library/src/blas3/Tensile/Logic/asm_full/vega10_Cijk_Ailk_Bjlk_HBH.yaml
- {MinimumRequiredVersion: 4.6.0}
- vega10
- gfx900
- [Device 6863, Device 6862, Device 687f, Device 6860, Device 6861, 'Vega 10 XTX [Radeon
    SolutionIndex: 0
    SolutionNameMin: Cijk_Ailk_Bjlk_HBH_MT032x016x08_PGR1_PLR1_TT04_02
    SolutionIndex: 1
    SolutionNameMin: Cijk_Ailk_Bjlk_HBH_MT064x016x08_PGR1_PLR1_TT04_02
    SolutionIndex: 2
    SolutionNameMin: Cijk_Ailk_Bjlk_HBH_MT032x032x08_PGR1_PLR1_TT04_04
    SolutionIndex: 3
    SolutionNameMin: Cijk_Ailk_Bjlk_HBH_MT064x032x08_PGR1_PLR1_TT08_04
    SolutionIndex: 4
    SolutionNameMin: Cijk_Ailk_Bjlk_HBH_MT064x064x08_PGR1_PLR1_TT08_08
    SolutionIndex: 5
    SolutionNameMin: Cijk_Ailk_Bjlk_HBH_MT064x016x08_PGR1_PLR1_TT04_02
    SolutionIndex: 6
    SolutionNameMin: Cijk_Ailk_Bjlk_HBH_MT016x016x16_PGR1_PLR1_TT02_02
    SolutionIndex: 7
    SolutionNameMin: Cijk_Ailk_Bjlk_HBH_MT032x016x16_PGR1_PLR1_TT04_02
    SolutionIndex: 8
    SolutionNameMin: Cijk_Ailk_Bjlk_HBH_MT032x032x16_PGR1_PLR1_TT04_04
    SolutionIndex: 9
    SolutionNameMin: Cijk_Ailk_Bjlk_HBH_MT032x016x16_PGR1_PLR1_TT02_02
    SolutionIndex: 10
    SolutionNameMin: Cijk_Ailk_Bjlk_HBH_MT064x016x16_PGR1_PLR1_TT04_02
    SolutionIndex: 11
    SolutionNameMin: Cijk_Ailk_Bjlk_HBH_MT064x016x16_PGR1_PLR1_TT02_02
    SolutionIndex: 12
    SolutionNameMin: Cijk_Ailk_Bjlk_HBH_MT128x016x16_PGR1_PLR1_TT04_02
    SolutionIndex: 13
    SolutionNameMin: Cijk_Ailk_Bjlk_HBH_MT032x032x16_PGR1_PLR1_TT04_04
    SolutionIndex: 14
    SolutionNameMin: Cijk_Ailk_Bjlk_HBH_MT064x064x16_PGR1_PLR1_TT08_08
    SolutionIndex: 15
    SolutionNameMin: Cijk_Ailk_Bjlk_HBH_MT032x016x16_PGR1_PLR1_TT02_02
    SolutionIndex: 16
    SolutionNameMin: Cijk_Ailk_Bjlk_HBH_MT064x016x16_PGR1_PLR1_TT04_02
    SolutionIndex: 17
    SolutionNameMin: Cijk_Ailk_Bjlk_HBH_MT064x032x16_PGR1_PLR1_TT04_04
    SolutionIndex: 18
    SolutionNameMin: Cijk_Ailk_Bjlk_HBH_MT064x016x16_PGR1_PLR1_TT02_02
    SolutionIndex: 19
    SolutionNameMin: Cijk_Ailk_Bjlk_HBH_MT128x016x16_PGR1_PLR1_TT04_02
    SolutionIndex: 20
    SolutionNameMin: Cijk_Ailk_Bjlk_HBH_MT032x016x24_PGR1_PLR1_TT04_02
    SolutionIndex: 21
    SolutionNameMin: Cijk_Ailk_Bjlk_HBH_MT032x032x24_PGR1_PLR1_TT04_04
    SolutionIndex: 22
    SolutionNameMin: Cijk_Ailk_Bjlk_HBH_MT016x016x32_PGR1_PLR1_TT02_02
    SolutionIndex: 23
    SolutionNameMin: Cijk_Ailk_Bjlk_HBH_MT032x016x32_PGR1_PLR1_TT02_02
    SolutionIndex: 24
    SolutionNameMin: Cijk_Ailk_Bjlk_HBH_MT064x016x32_PGR1_PLR1_TT02_02
    SolutionIndex: 25
    SolutionNameMin: Cijk_Ailk_Bjlk_HBH_MT128x016x32_PGR1_PLR1_TT04_02
    SolutionIndex: 26
    SolutionNameMin: Cijk_Ailk_Bjlk_HBH_MT032x008x32_PGR1_PLR1_TT02_02
    SolutionIndex: 27
    SolutionNameMin: Cijk_Ailk_Bjlk_HBH_MT032x032x32_PGR1_PLR1_TT04_04
    SolutionIndex: 28
    SolutionNameMin: Cijk_Ailk_Bjlk_HBH_MT064x016x32_PGR1_PLR1_TT04_02
    SolutionIndex: 29
    SolutionNameMin: Cijk_Ailk_Bjlk_HBH_MT064x016x32_PGR1_PLR1_TT02_02
    SolutionIndex: 30
    SolutionNameMin: Cijk_Ailk_Bjlk_HBH_MT128x016x32_PGR1_PLR1_TT04_02
    SolutionIndex: 31
    SolutionNameMin: Cijk_Ailk_Bjlk_HBH_MT016x016x64_PGR1_PLR1_TT02_02
    SolutionIndex: 32
    SolutionNameMin: Cijk_Ailk_Bjlk_HBH_MT032x016x64_PGR1_PLR1_TT02_02
    SolutionIndex: 33
    SolutionNameMin: Cijk_Ailk_Bjlk_HBH_MT064x016x64_PGR1_PLR1_TT02_02
    SolutionIndex: 34
    SolutionNameMin: Cijk_Ailk_Bjlk_HBH_MT032x032x64_PGR1_PLR1_TT04_04
    SolutionIndex: 35
    SolutionNameMin: Cijk_Ailk_Bjlk_HBH_MT032x016x64_PGR1_PLR1_TT02_02
    SolutionIndex: 36
    SolutionNameMin: Cijk_Ailk_Bjlk_HBH_MT064x016x64_PGR1_PLR1_TT02_02
    SolutionIndex: 37
    SolutionNameMin: Cijk_Ailk_Bjlk_HBH_MT032x064x08_PGR1_PLR1_TT04_08
    SolutionIndex: 38
    SolutionNameMin: Cijk_Ailk_Bjlk_HBH_MT048x064x08_PGR1_PLR1_TT06_08
    SolutionIndex: 39
    SolutionNameMin: Cijk_Ailk_Bjlk_HBH_MT064x048x08_PGR1_PLR1_TT08_06
    SolutionIndex: 40
    SolutionNameMin: Cijk_Ailk_Bjlk_HBH_MT064x128x08_PGR1_PLR1_TT04_08
    SolutionIndex: 41
    SolutionNameMin: Cijk_Ailk_Bjlk_HBH_MT064x064x16_PGR1_PLR1_TT04_04
    SolutionIndex: 42
    SolutionNameMin: Cijk_Ailk_Bjlk_HBH_MT064x128x16_PGR1_PLR1_TT04_08
    SolutionIndex: 43
    SolutionNameMin: Cijk_Ailk_Bjlk_HBH_MT096x128x16_PGR1_PLR1_TT06_08
    SolutionIndex: 44
    SolutionNameMin: Cijk_Ailk_Bjlk_HBH_MT128x064x16_PGR1_PLR1_TT08_04
    SolutionIndex: 45
    SolutionNameMin: Cijk_Ailk_Bjlk_HBH_MT128x096x16_PGR1_PLR1_TT08_06
    SolutionIndex: 46
    SolutionNameMin: Cijk_Ailk_Bjlk_HBH_MT128x128x16_PGR1_PLR1_TT08_08
    SolutionIndex: 47
    SolutionNameMin: Cijk_Ailk_Bjlk_HBH_MT064x064x32_PGR1_PLR1_TT04_04
    SolutionIndex: 48
    SolutionNameMin: Cijk_Ailk_Bjlk_HBH_MT064x128x32_PGR1_PLR1_TT04_08
    SolutionIndex: 49
    SolutionNameMin: Cijk_Ailk_Bjlk_HBH_MT128x064x32_PGR1_PLR1_TT08_04
    SolutionIndex: 50
    SolutionNameMin: Cijk_Ailk_Bjlk_HBH_MT032x032x16_PGR1_PLR1_TT02_02
    SolutionIndex: 51
    SolutionNameMin: Cijk_Ailk_Bjlk_HBH_MT032x032x32_PGR1_PLR1_TT02_02
    SolutionIndex: 52
    SolutionNameMin: Cijk_Ailk_Bjlk_HBH_MT032x032x64_PGR1_PLR1_TT02_02
    SolutionIndex: 53
    SolutionNameMin: Cijk_Ailk_Bjlk_HBH_MT064x128x04_PGR0_PLR0_TT04_08
    SolutionIndex: 54
    SolutionNameMin: Cijk_Ailk_Bjlk_HBH_MT064x064x04_PGR0_PLR0_TT04_04
    SolutionIndex: 55
    SolutionNameMin: Cijk_Ailk_Bjlk_HBH_MT064x128x04_PGR0_PLR1_TT04_08
    SolutionIndex: 56
    SolutionNameMin: Cijk_Ailk_Bjlk_HBH_MT064x064x04_PGR0_PLR1_TT04_04
    SolutionIndex: 57
    SolutionNameMin: Cijk_Ailk_Bjlk_HBH_MT064x064x04_PGR1_PLR1_TT04_04
    SolutionIndex: 58
    SolutionNameMin: Cijk_Ailk_Bjlk_HBH_MT064x128x08_PGR0_PLR0_TT04_08
    SolutionIndex: 59
    SolutionNameMin: Cijk_Ailk_Bjlk_HBH_MT064x064x08_PGR0_PLR0_TT04_04
    SolutionIndex: 60
    SolutionNameMin: Cijk_Ailk_Bjlk_HBH_MT064x064x08_PGR1_PLR0_TT04_04
    SolutionIndex: 61
    SolutionNameMin: Cijk_Ailk_Bjlk_HBH_MT064x128x08_PGR0_PLR1_TT04_08
    SolutionIndex: 62
    SolutionNameMin: Cijk_Ailk_Bjlk_HBH_MT064x064x08_PGR0_PLR1_TT04_04
    SolutionIndex: 63
    SolutionNameMin: Cijk_Ailk_Bjlk_HBH_MT064x128x08_PGR1_PLR1_TT04_08
    SolutionIndex: 64
    SolutionNameMin: Cijk_Ailk_Bjlk_HBH_MT064x064x08_PGR1_PLR1_TT04_04
    SolutionIndex: 65
    SolutionNameMin: Cijk_Ailk_Bjlk_HBH_MT064x128x16_PGR0_PLR0_TT04_08
    SolutionIndex: 66
    SolutionNameMin: Cijk_Ailk_Bjlk_HBH_MT064x064x16_PGR0_PLR0_TT04_04
    SolutionIndex: 67
    SolutionNameMin: Cijk_Ailk_Bjlk_HBH_MT064x064x16_PGR1_PLR0_TT04_04
    SolutionIndex: 68
    SolutionNameMin: Cijk_Ailk_Bjlk_HBH_MT064x064x16_PGR0_PLR1_TT04_04
    SolutionIndex: 69
    SolutionNameMin: Cijk_Ailk_Bjlk_HBH_MT064x128x16_PGR1_PLR1_TT04_08
    SolutionIndex: 70
    SolutionNameMin: Cijk_Ailk_Bjlk_HBH_MT064x064x16_PGR1_PLR1_TT04_04
    SolutionIndex: 71
    SolutionNameMin: Cijk_Ailk_Bjlk_HBH_MT128x128x04_PGR0_PLR0_TT08_08
    SolutionIndex: 72
    SolutionNameMin: Cijk_Ailk_Bjlk_HBH_MT064x128x04_PGR0_PLR0_TT04_08
    SolutionIndex: 73
    SolutionNameMin: Cijk_Ailk_Bjlk_HBH_MT064x064x04_PGR0_PLR0_TT04_04
    SolutionIndex: 74
    SolutionNameMin: Cijk_Ailk_Bjlk_HBH_MT064x128x04_PGR1_PLR0_TT04_08
    SolutionIndex: 75
    SolutionNameMin: Cijk_Ailk_Bjlk_HBH_MT064x064x04_PGR1_PLR0_TT04_04
    SolutionIndex: 76
    SolutionNameMin: Cijk_Ailk_Bjlk_HBH_MT064x128x04_PGR0_PLR1_TT04_08
    SolutionIndex: 77
    SolutionNameMin: Cijk_Ailk_Bjlk_HBH_MT064x064x04_PGR0_PLR1_TT04_04
    SolutionIndex: 78
    SolutionNameMin: Cijk_Ailk_Bjlk_HBH_MT128x128x04_PGR1_PLR1_TT08_08
    SolutionIndex: 79
    SolutionNameMin: Cijk_Ailk_Bjlk_HBH_MT064x128x04_PGR1_PLR1_TT04_08
    SolutionIndex: 80
    SolutionNameMin: Cijk_Ailk_Bjlk_HBH_MT064x064x04_PGR1_PLR1_TT04_04
    SolutionIndex: 81
    SolutionNameMin: Cijk_Ailk_Bjlk_HBH_MT064x064x08_PGR0_PLR0_TT04_04
    SolutionIndex: 82
    SolutionNameMin: Cijk_Ailk_Bjlk_HBH_MT064x128x08_PGR0_PLR1_TT04_08
    SolutionIndex: 83
    SolutionNameMin: Cijk_Ailk_Bjlk_HBH_MT064x064x08_PGR0_PLR1_TT04_04
    SolutionIndex: 84
    SolutionNameMin: Cijk_Ailk_Bjlk_HBH_MT064x064x08_PGR1_PLR1_TT04_04
    SolutionIndex: 85
    SolutionNameMin: Cijk_Ailk_Bjlk_HBH_MT064x064x16_PGR1_PLR0_TT04_04
    SolutionIndex: 86
    SolutionNameMin: Cijk_Ailk_Bjlk_HBH_MT064x128x16_PGR1_PLR1_TT04_08
    SolutionIndex: 87
    SolutionNameMin: Cijk_Ailk_Bjlk_HBH_MT064x064x16_PGR1_PLR1_TT04_04
- - - [2368, 1024, 1, 1]
    - [72, 144.844]
  - - [128, 256, 1, 1280]
    - [32, 1808.98]
  - - [32, 5056, 1, 1280]
    - [67, 1752.77]
  - - [448, 1, 1, 256]
    - [80, 3.63437]
  - - [5056, 1408, 1, 3328]
    - [4, 10171.3]
  - - [2368, 64, 1, 1]
    - [73, 14.5102]
  - - [5056, 1856, 1, 3328]
    - [2, 10252.1]
  - - [704, 64, 1, 1]
    - [77, 4.31364]
  - - [448, 3584, 1, 3328]
    - [41, 9869.43]
  - - [704, 64, 1, 3328]
    - [32, 2533.43]
  - - [5056, 4288, 1, 32]
    - [53, 4155.06]
  - - [5888, 256, 1, 256]
    - [44, 9318.76]
  - - [448, 3584, 1, 32]
    - [59, 2477.17]
  - - [5888, 704, 1, 1]
    - [77, 158.52]
  - - [6784, 6784, 1, 1280]
    - [44, 10085.7]
  - - [448, 1, 1, 1]
    - [71, 0.0671966]
  - - [1408, 3584, 1, 3328]
    - [3, 10464.0]
  - - [448, 448, 1, 3328]
    - [25, 6501.04]
  - - [1024, 2368, 1, 3328]
    - [42, 10054.4]
  - - [1, 4288, 1, 1280]
    - [87, 43.2542]
  - - [6784, 64, 1, 32]
    - [67, 1284.66]
  - - [64, 64, 1, 1280]
    - [52, 224.688]
  - - [448, 3584, 1, 1]
    - [80, 117.161]
  - - [448, 64, 1, 1]
    - [78, 3.39535]
  - - [32, 1408, 1, 32]
    - [62, 112.508]
  - - [64, 1024, 1, 1280]
    - [52, 3505.99]
  - - [1, 1408, 1, 3328]
    - [87, 17.859]
  - - [32, 3584, 1, 1280]
    - [64, 1654.21]
  - - [1024, 1, 1, 3328]
    - [87, 13.2503]
  - - [2944, 128, 1, 32]
    - [62, 1138.41]
  - - [1408, 5056, 1, 1]
    - [72, 189.925]
  - - [1024, 64, 1, 1280]
    - [52, 3495.18]
  - - [64, 5056, 1, 3328]
    - [51, 8326.18]
  - - [5888, 4288, 1, 3328]
    - [40, 9831.46]
  - - [1, 2368, 1, 1280]
    - [87, 28.0835]
  - - [704, 1024, 1, 1]
    - [77, 80.4302]
  - - [2368, 1408, 1, 32]
    - [59, 3214.99]
  - - [256, 1856, 1, 1280]
    - [47, 8369.16]
  - - [1024, 2944, 1, 1]
    - [72, 148.531]
  - - [2944, 3584, 1, 3328]
    - [41, 10036.1]
  - - [2368, 2944, 1, 1280]
    - [41, 11259.2]
  - - [256, 1408, 1, 1]
    - [77, 48.1754]
  - - [1, 1024, 1, 3328]
    - [87, 13.1367]
  - - [3584, 1408, 1, 32]
    - [53, 3443.78]
  - - [6784, 1856, 1, 32]
    - [53, 3904.65]
  - - [5056, 256, 1, 256]
    - [41, 9166.1]
  - - [1856, 2368, 1, 256]
    - [41, 10621.5]
  - - [2368, 1024, 1, 3328]
    - [44, 10324.1]
  - - [3584, 4288, 1, 32]
    - [53, 4070.42]
  - - [1024, 1024, 1, 1280]
    - [47, 10341.8]
  - - [32, 2944, 1, 3328]
    - [64, 1473.69]
  - - [704, 1408, 1, 3328]
    - [13, 10038.9]
  - - [1408, 704, 1, 256]
    - [47, 8672.43]
  - - [704, 64, 1, 32]
    - [59, 102.981]
  - - [5888, 1, 1, 3328]
    - [85, 56.7048]
  - - [2368, 32, 1, 256]
    - [64, 703.959]
  - - [2048, 7133, 1, 2048]
    - [41, 10409.3]
  - - [7680, 5481, 1, 2560]
    - [44, 9826.64]
  - - [6784, 128, 1, 3328]
    - [5, 9253.35]
  - - [2944, 1856, 1, 1]
    - [76, 176.888]
  - - [32, 448, 1, 3328]
    - [64, 223.092]
  - - [5056, 1, 1, 3328]
    - [87, 52.0864]
  - - [2368, 3584, 1, 1280]
    - [2, 11023.8]
  - - [4288, 5056, 1, 1]
    - [76, 220.718]
  - - [128, 4288, 1, 3328]
    - [10, 8186.79]
  - - [1408, 4288, 1, 1280]
    - [37, 11004.7]
  - - [1856, 704, 1, 1280]
    - [41, 10644.9]
  - - [448, 5888, 1, 256]
    - [41, 9495.85]
  - - [1, 5888, 1, 3328]
    - [87, 61.0496]
  - - [1024, 128, 1, 32]
    - [54, 306.053]
  - - [32, 4288, 1, 1280]
    - [67, 1495.91]
  - - [1024, 5056, 1, 1]
    - [72, 176.496]
  - - [704, 3584, 1, 1280]
    - [41, 10910.5]
  - - [1856, 5056, 1, 256]
    - [4, 11217.5]
  - - [1408, 1024, 1, 1280]
    - [41, 9989.33]
  - - [5056, 5888, 1, 3328]
    - [40, 9899.35]
  - - [3584, 3584, 1, 1280]
    - [37, 10818.1]
  - - [2368, 3584, 1, 32]
    - [53, 3760.24]
  - - [5056, 5056, 1, 1]
    - [76, 223.071]
  - - [512, 32, 1, 512]
    - [22, 780.989]
  - - [1024, 6784, 1, 1280]
    - [41, 11163.1]
  - - [1024, 3584, 1, 1]
    - [72, 163.512]
  - - [256, 5056, 1, 1]
    - [73, 108.526]
  - - [32, 5056, 1, 32]
    - [64, 541.79]
  - - [5888, 32, 1, 32]
    - [67, 626.097]
  - - [64, 128, 1, 3328]
    - [52, 474.279]
  - - [256, 5056, 1, 32]
    - [62, 2359.24]
  - - [5056, 64, 1, 32]
    - [62, 998.475]
  - - [256, 128, 1, 256]
    - [23, 1316.79]
  - - [128, 6784, 1, 32]
    - [59, 1933.63]
  - - [64, 128, 1, 1]
    - [73, 0.784299]
  - - [64, 2368, 1, 1280]
    - [51, 5583.63]
  - - [128, 704, 1, 32]
    - [59, 208.163]
  - - [64, 6784, 1, 3328]
    - [50, 8411.39]
  - - [2944, 256, 1, 1280]
    - [47, 9589.79]
  - - [2944, 4288, 1, 256]
    - [44, 11039.2]
  - - [1024, 1024, 1, 3328]
    - [42, 10515.4]
  - - [5056, 704, 1, 32]
    - [62, 3203.4]
  - - [1856, 4288, 1, 3328]
    - [41, 10277.4]
  - - [1, 1856, 1, 256]
    - [80, 15.7596]
  - - [6784, 4288, 1, 32]
    - [53, 4208.43]
  - - [4288, 1024, 1, 3328]
    - [47, 10402.3]
  - - [256, 128, 1, 1]
    - [73, 3.20548]
  - - [3584, 448, 1, 3328]
    - [41, 9150.78]
  - - [2944, 448, 1, 256]
    - [44, 8168.51]
  - - [3584, 2368, 1, 3328]
    - [2, 10072.1]
  - - [4288, 1856, 1, 1]
    - [74, 190.154]
  - - [1856, 2944, 1, 1]
    - [72, 175.626]
  - - [32, 4288, 1, 3328]
    - [67, 1568.61]
  - - [1, 3584, 1, 3328]
    - [87, 46.1367]
  - - [256, 32, 1, 3328]
    - [64, 128.955]
  - - [1856, 2368, 1, 32]
    - [62, 3307.63]
  - - [4288, 1856, 1, 32]
    - [53, 3700.73]
  - - [5056, 64, 1, 3328]
    - [51, 8340.53]
  - - [6784, 1, 1, 1280]
    - [87, 66.4157]
  - - [32, 2368, 1, 256]
    - [64, 705.855]
  - - [1408, 64, 1, 1]
    - [73, 8.68884]
  - - [1, 1, 1, 3328]
    - [84, 0.0140133]
  - - [5056, 2368, 1, 256]
    - [3, 11274.1]
  - - [1408, 5888, 1, 256]
    - [42, 11156.7]
  - - [5056, 6784, 1, 1]
    - [76, 229.452]
  - - [32, 448, 1, 1280]
    - [64, 207.818]
  - - [32, 448, 1, 32]
    - [63, 45.2039]
  - - [1024, 1408, 1, 3328]
    - [47, 9789.15]
  - - [256, 5056, 1, 1280]
    - [47, 10515.0]
  - - [704, 2368, 1, 1]
    - [73, 121.644]
  - - [64, 1024, 1, 32]
    - [62, 149.004]
  - - [1024, 256, 1, 256]
    - [13, 5592.17]
  - - [128, 1, 1, 1]
    - [73, 0.0152909]
  - - [3584, 4288, 1, 1280]
    - [41, 10827.0]
  - - [1856, 128, 1, 32]
    - [64, 848.126]
  - - [1856, 128, 1, 1280]
    - [25, 7151.71]
  - - [128, 2944, 1, 3328]
    - [7, 8092.64]
  - - [1, 6784, 1, 3328]
    - [86, 65.785]
  - - [2368, 4288, 1, 1]
    - [72, 201.582]
  - - [4288, 448, 1, 3328]
    - [4, 10241.5]
  - - [4288, 32, 1, 3328]
    - [67, 1589.24]
  - - [32, 2944, 1, 256]
    - [64, 868.183]
  - - [256, 1856, 1, 1]
    - [80, 59.3883]
  - - [704, 6784, 1, 1280]
    - [2, 11055.0]
  - - [2368, 4288, 1, 32]
    - [53, 3909.42]
  - - [3584, 6784, 1, 1]
    - [72, 222.829]
  - - [704, 5056, 1, 1280]
    - [41, 11197.0]
  - - [256, 3584, 1, 3328]
    - [47, 9361.88]
  - - [3584, 6784, 1, 32]
    - [53, 4226.66]
  - - [3584, 6784, 1, 1280]
    - [40, 10345.0]
  - - [4288, 4288, 1, 3328]
    - [42, 9829.75]
  - - [3584, 64, 1, 1280]
    - [25, 6929.22]
  - - [64, 1856, 1, 256]
    - [51, 3947.13]
  - - [3584, 64, 1, 32]
    - [64, 799.089]
  - - [448, 1, 1, 1280]
    - [87, 5.24473]
  - - [256, 4288, 1, 1280]
    - [47, 8905.25]
  - - [1408, 3584, 1, 1]
    - [72, 172.463]
  - - [4288, 1856, 1, 3328]
    - [41, 10260.8]
  - - [1856, 2944, 1, 1280]
    - [2, 11173.5]
  - - [4288, 256, 1, 256]
    - [41, 7936.47]
  - - [128, 5888, 1, 32]
    - [68, 1871.08]
  - - [128, 5888, 1, 1280]
    - [47, 9547.56]
  - - [1408, 128, 1, 3328]
    - [29, 6914.47]
  - - [3584, 256, 1, 256]
    - [47, 8006.99]
  - - [32, 6784, 1, 3328]
    - [67, 2458.54]
  - - [32, 3584, 1, 256]
    - [64, 1034.85]
  - - [256, 2368, 1, 32]
    - [64, 1549.54]
  - - [448, 128, 1, 3328]
    - [36, 3232.45]
  - - [64, 2944, 1, 3328]
    - [52, 7451.47]
  - - [64, 4288, 1, 3328]
    - [51, 7081.73]
  - - [5056, 1024, 1, 3328]
    - [44, 10487.4]
  - - [2368, 64, 1, 3328]
    - [52, 6145.06]
  - - [1856, 256, 1, 256]
    - [41, 7077.76]
  - - [3584, 704, 1, 1]
    - [73, 142.518]
  - - [256, 704, 1, 256]
    - [27, 3967.1]
  - - [448, 5056, 1, 1]
    - [76, 138.364]
  - - [5888, 5888, 1, 256]
    - [3, 11089.5]
  - - [3584, 704, 1, 32]
    - [59, 2945.87]
  - - [448, 6784, 1, 3328]
    - [2, 10509.7]
  - - [6784, 4288, 1, 1]
    - [72, 224.271]
  - - [5056, 704, 1, 1]
    - [73, 160.168]
  - - [1408, 2368, 1, 32]
    - [62, 3193.58]
  - - [448, 5056, 1, 32]
    - [59, 2869.47]
  - - [4288, 4288, 1, 1280]
    - [3, 10434.4]
  - - [6784, 1408, 1, 1]
    - [76, 199.916]
  - - [1856, 5888, 1, 3328]
    - [39, 10107.7]
  - - [1024, 704, 1, 1]
    - [77, 79.7672]
  - - [5056, 5888, 1, 1]
    - [72, 228.34]
  - - [2944, 1024, 1, 256]
    - [44, 10154.4]
  - - [448, 1408, 1, 3328]
    - [47, 8276.57]
  - - [5056, 32, 1, 3328]
    - [70, 1733.55]
  - - [2368, 4288, 1, 3328]
    - [47, 10229.3]
  - - [1024, 704, 1, 32]
    - [59, 1831.86]
  - - [448, 2944, 1, 256]
    - [42, 8110.34]
  - - [2944, 6784, 1, 256]
    - [40, 11300.2]
  - - [2368, 2368, 1, 1280]
    - [2, 11006.8]
  - - [5888, 128, 1, 3328]
    - [8, 9834.34]
  - - [256, 256, 1, 32]
    - [59, 156.416]
  - - [1024, 1, 1, 256]
    - [80, 8.75959]
  - - [3584, 3584, 1, 32]
    - [53, 3994.87]
  - - [2944, 448, 1, 1]
    - [72, 106.618]
  - - [128, 32, 1, 32]
    - [62, 9.88514]
  - - [5056, 64, 1, 1280]
    - [51, 7864.05]
  - - [2944, 2944, 1, 1280]
    - [37, 10984.6]
  - - [1, 2368, 1, 256]
    - [80, 20.1071]
  - - [64, 6784, 1, 1]
    - [73, 55.295]
  - - [2944, 32, 1, 1280]
    - [64, 1362.23]
  - - [64, 1408, 1, 3328]
    - [32, 4779.7]
  - - [256, 448, 1, 1280]
    - [24, 5228.87]
  - - [2368, 2944, 1, 1]
    - [76, 187.099]
  - - [6784, 4288, 1, 1280]
    - [44, 10242.6]
  - - [2944, 704, 1, 256]
    - [14, 10073.9]
  - - [5888, 1856, 1, 256]
    - [44, 11290.4]
  - - [704, 2944, 1, 3328]
    - [48, 10767.1]
  - - [5888, 256, 1, 1]
    - [72, 119.696]
  - - [704, 704, 1, 32]
    - [66, 1456.49]
  - - [256, 4288, 1, 256]
    - [47, 7936.47]
  - - [5056, 6784, 1, 32]
    - [53, 4304.78]
  - - [5056, 128, 1, 1]
    - [75, 72.8055]
  - - [448, 5056, 1, 1280]
    - [41, 10809.0]
  - - [448, 448, 1, 256]
    - [10, 4750.83]
  - - [256, 5888, 1, 3328]
    - [44, 10539.9]
  - - [704, 448, 1, 1280]
    - [47, 5606.81]
  - - [448, 64, 1, 256]
    - [23, 1165.73]
  - - [1024, 704, 1, 1280]
    - [47, 9193.13]
  - - [5888, 1024, 1, 1]
    - [72, 181.68]
  - - [5888, 448, 1, 32]
    - [62, 2884.84]
  - - [6784, 2944, 1, 256]
    - [40, 11296.5]
  - - [1760, 7133, 1, 1760]
    - [41, 10516.0]
  - - [1024, 256, 1, 1]
    - [77, 38.4657]
  - - [5888, 256, 1, 32]
    - [65, 2543.54]
  - - [2368, 448, 1, 256]
    - [47, 7686.01]
  - - [4288, 256, 1, 3328]
    - [2, 9034.11]
  - - [4288, 2944, 1, 256]
    - [40, 11044.7]
  - - [704, 4288, 1, 3328]
    - [2, 10244.2]
  - - [448, 5888, 1, 3328]
    - [2, 10023.6]
  - - [128, 256, 1, 3328]
    - [32, 1924.4]
  - - [2368, 5056, 1, 32]
    - [53, 3912.24]
  - - [32, 128, 1, 1280]
    - [64, 59.2272]
  - - [1408, 4288, 1, 1]
    - [72, 181.522]
  - - [1408, 1856, 1, 3328]
    - [3, 10970.3]
  - - [4288, 64, 1, 256]
    - [50, 5388.66]
  - - [2944, 5888, 1, 3328]
    - [14, 9747.42]
  - - [128, 6784, 1, 3328]
    - [17, 8872.46]
  - - [448, 4288, 1, 3328]
    - [47, 10400.7]
  - - [704, 2368, 1, 256]
    - [41, 8863.44]
  - - [1, 64, 1, 3328]
    - [87, 0.79914]
  - - [4288, 128, 1, 1]
    - [80, 63.3317]
  - - [704, 256, 1, 32]
    - [59, 432.516]
  - - [4288, 3584, 1, 3328]
    - [46, 9940.83]
  - - [2368, 1024, 1, 1280]
    - [44, 10415.1]
  - - [1408, 1024, 1, 1]
    - [72, 117.962]
  - - [1408, 1024, 1, 256]
    - [42, 8929.56]
  - - [5056, 3584, 1, 1]
    - [72, 219.984]
  - - [448, 1024, 1, 256]
    - [41, 6833.5]
  - - [6784, 6784, 1, 3328]
    - [46, 9869.31]
  - - [1408, 256, 1, 1280]
    - [47, 6374.98]
  - - [6784, 32, 1, 32]
    - [64, 710.454]
  - - [64, 1024, 1, 3328]
    - [52, 3755.49]
  - - [2368, 2944, 1, 3328]
    - [43, 10393.6]
  - - [448, 448, 1, 1280]
    - [25, 6149.05]
  - - [5056, 3584, 1, 32]
    - [53, 4115.61]
  - - [5056, 3584, 1, 1280]
    - [37, 10512.2]
  - - [1024, 256, 1, 1280]
    - [47, 7270.73]
  - - [1856, 1856, 1, 256]
    - [44, 10071.6]
  - - [32, 5888, 1, 256]
    - [64, 1623.81]
  - - [256, 1408, 1, 32]
    - [64, 1104.29]
  - - [2944, 1, 1, 3328]
    - [87, 37.9523]
  - - [32, 704, 1, 3328]
    - [64, 351.792]
  - - [5888, 4288, 1, 1]
    - [76, 225.27]
  - - [1024, 128, 1, 256]
    - [24, 4314.02]
  - - [32, 1856, 1, 3328]
    - [64, 934.27]
  - - [5056, 704, 1, 256]
    - [44, 10354.3]
  - - [448, 256, 1, 256]
    - [23, 3774.77]
  - - [2368, 5056, 1, 256]
    - [3, 11295.7]
  - - [1024, 5056, 1, 256]
    - [44, 10830.7]
  - - [32, 1024, 1, 3328]
    - [64, 515.279]
  - - [5888, 448, 1, 256]
    - [41, 9456.49]
  - - [6784, 5056, 1, 1280]
    - [38, 10090.1]
  - - [704, 6784, 1, 32]
    - [53, 3285.25]
  - - [4288, 6784, 1, 1280]
    - [42, 10201.9]
  - - [64, 1, 1, 256]
    - [80, 0.529131]
  - - [1856, 64, 1, 1280]
    - [51, 5532.48]
  - - [128, 1408, 1, 1]
    - [73, 16.8955]
  - - [1024, 64, 1, 32]
    - [59, 148.224]
  - - [1024, 64, 1, 3328]
    - [52, 3755.49]
  - - [704, 6784, 1, 3328]
    - [41, 10228.7]
  - - [5888, 4288, 1, 1280]
    - [47, 10245.1]
  - - [5888, 3584, 1, 1280]
    - [42, 10277.7]
  - - [5888, 128, 1, 1280]
    - [47, 9589.74]
  - - [1024, 2944, 1, 256]
    - [14, 10124.7]
  - - [1, 2944, 1, 1280]
    - [87, 34.5589]
  - - [32, 1024, 1, 256]
    - [64, 301.18]
  - - [2944, 1856, 1, 1280]
    - [41, 10986.3]
  - - [3584, 1, 1, 1280]
    - [87, 44.4577]
  - - [256, 3584, 1, 32]
    - [59, 2043.01]
  - - [1024, 2368, 1, 1]
    - [72, 144.84]
  - - [2944, 3584, 1, 1280]
    - [41, 10897.8]
  - - [64, 1, 1, 1]
    - [73, 0.00751306]
  - - [1856, 4288, 1, 256]
    - [41, 10802.8]
  - - [256, 128, 1, 3328]
    - [32, 1926.92]
  - - [1024, 1024, 1, 1024]
    - [41, 10265.7]
  - - [1, 1856, 1, 3328]
    - [87, 23.4884]
  - - [1408, 704, 1, 1]
    - [73, 96.2688]
  - - [2368, 2944, 1, 32]
    - [53, 3624.0]
  - - [128, 4288, 1, 32]
    - [64, 1419.8]
  - - [128, 704, 1, 1280]
    - [32, 4386.18]
  - - [64, 64, 1, 1]
    - [77, 0.392149]
  - - [1, 1408, 1, 1]
    - [77, 0.159728]
  - - [128, 2368, 1, 1280]
    - [11, 6900.49]
  - - [2944, 32, 1, 32]
    - [62, 236.611]
  - - [448, 1856, 1, 1]
    - [76, 83.1488]
  - - [4288, 704, 1, 256]
    - [14, 10188.0]
  - - [1856, 1024, 1, 256]
    - [14, 9173.32]
  - - [448, 1856, 1, 32]
    - [59, 1861.06]
  - - [448, 1856, 1, 3328]
    - [47, 8478.44]
  - - [448, 448, 1, 32]
    - [59, 453.937]
  - - [1024, 448, 1, 256]
    - [13, 6717.8]
  - - [6784, 1, 1, 256]
    - [87, 55.4255]
  - - [1024, 5056, 1, 32]
    - [53, 3516.58]
  - - [1024, 4288, 1, 1]
    - [74, 165.112]
  - - [704, 256, 1, 3328]
    - [34, 5244.09]
  - - [704, 1856, 1, 32]
    - [62, 2422.48]
  - - [1408, 5888, 1, 1280]
    - [42, 11144.5]
  - - [32, 704, 1, 1280]
    - [64, 321.182]
  - - [5056, 1856, 1, 256]
    - [4, 11209.8]
  - - [6784, 704, 1, 1280]
    - [47, 11165.7]
  - - [704, 1408, 1, 32]
    - [62, 2162.64]
  - - [5888, 1024, 1, 256]
    - [41, 10915.0]
  - - [64, 2944, 1, 1]
    - [77, 17.7868]
  - - [64, 2944, 1, 32]
    - [62, 432.954]
  - - [64, 2944, 1, 1280]
    - [51, 6912.37]
  - - [6784, 1856, 1, 3328]
    - [47, 9866.66]
  - - [64, 704, 1, 3328]
    - [31, 2517.7]
  - - [2368, 5888, 1, 1280]
    - [37, 10843.1]
  - - [1, 6784, 1, 256]
    - [87, 54.7778]
  - - [6784, 6784, 1, 32]
    - [53, 4382.01]
  - - [256, 1, 1, 1280]
    - [87, 3.02982]
  - - [5888, 128, 1, 32]
    - [59, 1871.08]
  - - [6784, 256, 1, 256]
    - [41, 9334.18]
  - - [2368, 3584, 1, 3328]
    - [2, 10045.8]
  - - [128, 4288, 1, 1280]
    - [9, 7943.13]
  - - [128, 128, 1, 256]
    - [22, 658.395]
  - - [5888, 1024, 1, 1280]
    - [47, 11159.3]
  - - [1856, 704, 1, 3328]
    - [47, 10624.8]
  - - [5888, 6784, 1, 3328]
    - [42, 9841.33]
  - - [6784, 448, 1, 1]
    - [75, 149.742]
  - - [6784, 1856, 1, 1]
    - [72, 208.557]
  - - [128, 32, 1, 1280]
    - [64, 59.5765]
  - - [2944, 2368, 1, 1280]
    - [41, 10816.4]
  - - [4288, 448, 1, 1]
    - [75, 126.504]
  - - [6784, 448, 1, 32]
    - [59, 3081.95]
  - - [6784, 448, 1, 3328]
    - [47, 10348.8]
  - - [1, 6784, 1, 1]
    - [75, 1.06491]
  - - [448, 3584, 1, 1280]
    - [13, 9603.49]
  - - [1408, 6784, 1, 1280]
    - [47, 10810.3]
  - - [5056, 5888, 1, 1280]
    - [42, 10316.4]
  - - [32, 2944, 1, 32]
    - [62, 235.244]
  - - [1, 256, 1, 256]
    - [80, 2.13699]
  - - [5056, 2944, 1, 32]
    - [53, 4054.25]
  - - [32, 6784, 1, 256]
    - [67, 1899.33]
  - - [64, 5056, 1, 256]
    - [51, 6282.23]
  - - [4288, 6784, 1, 1]
    - [74, 226.079]
  - - [448, 704, 1, 1280]
    - [47, 5595.27]
  - - [64, 2368, 1, 1]
    - [73, 14.1097]
  - - [1, 4288, 1, 3328]
    - [87, 44.7804]
  - - [5056, 4288, 1, 1]
    - [72, 220.386]
  - - [2368, 5888, 1, 32]
    - [53, 4028.81]
  - - [128, 3584, 1, 1280]
    - [24, 8097.06]
  - - [2944, 6784, 1, 1]
    - [72, 223.191]
  - - [1, 256, 1, 1]
    - [77, 0.028798]
  - - [5888, 1024, 1, 3328]
    - [41, 10551.4]
  - - [6784, 5888, 1, 256]
    - [39, 10947.1]
  - - [704, 128, 1, 1280]
    - [35, 4373.87]
  - - [4288, 128, 1, 256]
    - [11, 6726.31]
  - - [32, 3584, 1, 3328]
    - [64, 1800.95]
  - - [6784, 64, 1, 256]
    - [50, 6609.92]
  - - [1024, 1, 1, 1280]
    - [87, 12.1359]
  - - [4288, 2368, 1, 32]
    - [53, 3854.46]
  - - [704, 3584, 1, 1]
    - [72, 150.716]
  - - [704, 1856, 1, 3328]
    - [47, 10655.7]
  - - [2944, 128, 1, 1280]
    - [7, 7651.53]
  - - [1, 2368, 1, 3328]
    - [87, 30.8455]
  - - [6784, 704, 1, 32]
    - [53, 3290.49]
  - - [4288, 1, 1, 1280]
    - [87, 42.219]
  - - [704, 5888, 1, 256]
    - [40, 10690.4]
  - - [2944, 256, 1, 1]
    - [75, 82.7157]
  - - [64, 448, 1, 256]
    - [22, 1125.94]
  - - [1408, 448, 1, 1280]
    - [41, 8020.34]
  - - [1408, 128, 1, 32]
    - [62, 437.387]
  - - [3584, 5056, 1, 32]
    - [53, 4128.63]
  - - [1024, 32, 1, 1280]
    - [64, 476.211]
  - - [128, 2368, 1, 1]
    - [83, 40.5138]
  - - [6784, 1856, 1, 1280]
    - [47, 10769.6]
  - - [5056, 5056, 1, 3328]
    - [40, 9754.74]
  - - [128, 2944, 1, 1280]
    - [7, 7687.69]
  - - [128, 6784, 1, 1]
    - [72, 85.5646]
  - - [5888, 1408, 1, 256]
    - [40, 11113.4]
  - - [2368, 1024, 1, 32]
    - [59, 2869.84]
  - - [256, 256, 1, 3328]
    - [33, 3680.39]
  - - [64, 4288, 1, 1]
    - [75, 37.8032]
  - - [4288, 1024, 1, 256]
    - [41, 10589.3]
  - - [3584, 32, 1, 32]
    - [64, 438.446]
  - - [3584, 64, 1, 1]
    - [84, 32.9421]
  - - [704, 32, 1, 1280]
    - [64, 326.844]
  - - [32, 4288, 1, 32]
    - [67, 463.079]
  - - [32, 6784, 1, 1280]
    - [67, 2338.63]
  - - [64, 1408, 1, 1]
    - [77, 8.27551]
  - - [4288, 5888, 1, 1280]
    - [41, 10259.6]
  - - [256, 1024, 1, 256]
    - [47, 5733.84]
  - - [5056, 5888, 1, 256]
    - [40, 11431.2]
  - - [1408, 128, 1, 1280]
    - [24, 6447.55]
  - - [1024, 5888, 1, 1280]
    - [41, 11531.1]
  - - [64, 1024, 1, 1]
    - [77, 6.36488]
  - - [32, 32, 1, 32]
    - [54, 2.48506]
  - - [64, 128, 1, 256]
    - [6, 262.128]
  - - [5888, 5056, 1, 1280]
    - [47, 10188.4]
  - - [5888, 2944, 1, 1]
    - [72, 217.478]
  - - [64, 4288, 1, 1280]
    - [51, 6697.8]
  - - [704, 2944, 1, 1]
    - [76, 139.202]
  - - [1408, 4288, 1, 3328]
    - [3, 10260.8]
  - - [704, 2944, 1, 32]
    - [53, 2906.9]
  - - [1, 5888, 1, 1280]
    - [87, 57.5459]
  - - [2944, 4288, 1, 3328]
    - [47, 9889.41]
  - - [256, 2944, 1, 256]
    - [41, 8242.4]
  - - [704, 448, 1, 32]
    - [62, 987.287]
  - - [5056, 2944, 1, 256]
    - [42, 11214.4]
  - - [704, 1024, 1, 256]
    - [41, 7883.86]
  - - [2368, 1856, 1, 256]
    - [41, 10599.2]
  - - [64, 3584, 1, 1]
    - [77, 21.3552]
  - - [1024, 128, 1, 1280]
    - [29, 5852.35]
  - - [2368, 4288, 1, 1280]
    - [47, 10820.6]
  - - [3584, 448, 1, 256]
    - [41, 8589.59]
  - - [256, 6784, 1, 256]
    - [41, 9276.43]
  - - [1024, 32, 1, 32]
    - [59, 82.2993]
  - - [4288, 704, 1, 1]
    - [80, 150.377]
  - - [128, 64, 1, 32]
    - [62, 20.1077]
  - - [64, 1, 1, 1280]
    - [87, 0.744704]
  - - [6784, 5888, 1, 3328]
    - [40, 9822.74]
  - - [256, 5888, 1, 1]
    - [74, 119.696]
  - - [6784, 3584, 1, 256]
    - [42, 11416.6]
  - - [1408, 1856, 1, 256]
    - [44, 10392.5]
  - - [128, 1408, 1, 256]
    - [24, 4828.1]
  - - [2944, 2944, 1, 32]
    - [53, 3820.49]
  - - [2944, 2944, 1, 3328]
    - [40, 10145.8]
  - - [1, 2944, 1, 256]
    - [80, 25.0595]
  - - [448, 32, 1, 1280]
    - [64, 207.644]
  - - [3584, 1, 1, 256]
    - [87, 36.0053]
  - - [704, 32, 1, 3328]
    - [64, 354.378]
  - - [256, 448, 1, 3328]
    - [32, 5699.76]
  - - [2368, 64, 1, 256]
    - [51, 4223.76]
  - - [64, 448, 1, 1280]
    - [35, 1582.86]
  - - [1408, 448, 1, 3328]
    - [47, 8298.4]
  - - [2368, 6784, 1, 3328]
    - [40, 9969.8]
  - - [4096, 7133, 1, 4096]
    - [46, 9897.02]
  - - [4288, 3584, 1, 32]
    - [53, 4023.53]
  - - [5888, 64, 1, 3328]
    - [51, 8422.75]
  - - [3584, 704, 1, 1280]
    - [41, 10910.5]
  - - [448, 5056, 1, 3328]
    - [47, 10469.4]
  - - [4288, 448, 1, 256]
    - [14, 9298.12]
  - - [5056, 256, 1, 1280]
    - [41, 10539.8]
  - - [704, 448, 1, 3328]
    - [41, 5729.67]
  - - [2944, 5888, 1, 32]
    - [53, 4071.87]
  - - [3584, 5056, 1, 256]
    - [44, 11367.4]
  - - [6784, 1, 1, 3328]
    - [85, 66.0989]
  - - [1024, 32, 1, 512]
    - [23, 1551.29]
  - - [64, 256, 1, 1]
    - [77, 1.78368]
  - - [1856, 448, 1, 3328]
    - [48, 8377.65]
  - - [3584, 2368, 1, 256]
    - [41, 10883.1]
  - - [128, 1024, 1, 1280]
    - [33, 5898.02]
  - - [4288, 256, 1, 32]
    - [59, 2079.83]
  - - [4288, 256, 1, 1280]
    - [41, 8934.61]
  - - [448, 5056, 1, 256]
    - [41, 9712.05]
  - - [128, 1856, 1, 1]
    - [73, 34.4851]
  - - [128, 1856, 1, 32]
    - [64, 841.181]
  - - [1408, 1856, 1, 1]
    - [73, 145.172]
  - - [128, 2944, 1, 1]
    - [80, 49.3882]
  - - [3584, 32, 1, 256]
    - [64, 1330.05]
  - - [448, 2368, 1, 1280]
    - [41, 8634.56]
  - - [3584, 256, 1, 1]
    - [79, 92.4298]
  - - [1408, 1856, 1, 1280]
    - [41, 11305.8]
  - - [3584, 4288, 1, 3328]
    - [46, 9938.54]
  - - [448, 128, 1, 256]
    - [23, 2130.94]
  - - [448, 4288, 1, 32]
    - [53, 2738.82]
  - - [448, 4288, 1, 1280]
    - [41, 10223.1]
  - - [64, 3584, 1, 256]
    - [10, 5284.88]
  - - [6784, 1408, 1, 1280]
    - [41, 10883.7]
  - - [1024, 4288, 1, 3328]
    - [41, 10790.9]
  - - [1, 6784, 1, 1280]
    - [87, 66.3781]
  - - [5056, 1024, 1, 256]
    - [42, 10876.8]
  - - [2368, 448, 1, 32]
    - [62, 2036.82]
  - - [256, 1, 1, 256]
    - [80, 2.17909]
  - - [32, 2944, 1, 1280]
    - [64, 1362.23]
  - - [5056, 1024, 1, 1]
    - [72, 177.391]
  - - [2368, 256, 1, 256]
    - [41, 6736.23]
  - - [1, 5056, 1, 1]
    - [77, 0.822314]
  - - [4288, 32, 1, 32]
    - [59, 474.206]
  - - [1856, 3584, 1, 32]
    - [53, 3693.48]
  - - [5056, 3584, 1, 3328]
    - [40, 9936.55]
  - - [1856, 256, 1, 32]
    - [59, 1405.86]
  - - [4288, 5056, 1, 256]
    - [40, 11395.3]
  - - [1856, 5888, 1, 256]
    - [40, 11297.2]
  - - [256, 256, 1, 256]
    - [24, 2461.81]
  - - [2368, 3584, 1, 1]
    - [76, 196.855]
  - - [4288, 2368, 1, 256]
    - [41, 11041.9]
  - - [448, 1, 1, 3328]
    - [87, 5.6985]
  - - [1856, 256, 1, 1280]
    - [47, 8394.74]
  - - [1024, 6784, 1, 1]
    - [76, 186.442]
  - - [1408, 2944, 1, 3328]
    - [41, 10847.4]
  - - [32, 1856, 1, 32]
    - [59, 146.607]
  - - [256, 1, 1, 1]
    - [73, 0.0295373]
  - - [6784, 5056, 1, 3328]
    - [44, 9860.11]
  - - [6784, 5056, 1, 1]
    - [76, 226.091]
  - - [5888, 3584, 1, 32]
    - [53, 4132.38]
  - - [5888, 3584, 1, 3328]
    - [44, 9864.09]
  - - [1, 256, 1, 3328]
    - [87, 3.27484]
  - - [1024, 6784, 1, 256]
    - [41, 10789.9]
  - - [6784, 5888, 1, 32]
    - [53, 4261.64]
  - - [1408, 1, 1, 1280]
    - [87, 16.4499]
  - - [2368, 6784, 1, 32]
    - [53, 4099.02]
  - - [6784, 64, 1, 1]
    - [80, 54.7787]
  - - [2368, 32, 1, 32]
    - [59, 193.692]
  - - [3584, 1408, 1, 3328]
    - [46, 10437.9]
  - - [2944, 1408, 1, 1280]
    - [41, 11454.7]
  - - [1856, 64, 1, 1]
    - [77, 11.7046]
  - - [3584, 1024, 1, 1]
    - [72, 161.38]
  - - [256, 32, 1, 256]
    - [70, 87.3777]
  - - [2944, 1856, 1, 3328]
    - [47, 10337.4]
  - - [128, 1024, 1, 3328]
    - [33, 6471.01]
  - - [1408, 128, 1, 1]
    - [81, 17.0143]
  - - [2944, 3584, 1, 32]
    - [53, 3889.09]
  - - [3584, 1024, 1, 32]
    - [53, 3416.8]
  - - [4288, 6784, 1, 3328]
    - [42, 9857.7]
  - - [256, 128, 1, 1280]
    - [32, 1814.81]
  - - [6784, 5056, 1, 256]
    - [40, 11081.3]
  - - [1408, 32, 1, 3328]
    - [64, 703.341]
  - - [1856, 3584, 1, 1280]
    - [41, 10906.3]
  - - [256, 5888, 1, 256]
    - [44, 9236.12]
  - - [5056, 32, 1, 256]
    - [67, 1441.08]
  - - [2368, 1408, 1, 1]
    - [76, 150.031]
  - - [448, 2368, 1, 256]
    - [41, 7702.14]
  - - [64, 1408, 1, 1280]
    - [23, 4349.46]
  - - [3584, 32, 1, 1280]
    - [64, 1771.0]
  - - [128, 2368, 1, 3328]
    - [24, 7289.86]
  - - [3584, 1024, 1, 256]
    - [44, 10712.1]
  - - [256, 64, 1, 256]
    - [22, 666.133]
  - - [2368, 448, 1, 3328]
    - [2, 8565.96]
  - - [3584, 2368, 1, 1]
    - [76, 193.205]
  - - [1, 1, 1, 1]
    - [73, 0.000116374]
  - - [1024, 1856, 1, 32]
    - [53, 2727.6]
  - - [32, 1024, 1, 32]
    - [62, 77.3514]
  - - [4288, 1, 1, 256]
    - [87, 35.9681]
  - - [1856, 128, 1, 3328]
    - [25, 7673.0]
  - - [5888, 2368, 1, 1]
    - [72, 210.305]
  - - [5888, 128, 1, 1]
    - [77, 81.3936]
  - - [704, 256, 1, 1280]
    - [27, 4982.7]
  - - [704, 4288, 1, 256]
    - [4, 10138.5]
  - - [5888, 2368, 1, 32]
    - [53, 3949.57]
  - - [5888, 2368, 1, 1280]
    - [37, 10836.8]
  - - [128, 256, 1, 256]
    - [23, 1316.79]
  - - [2944, 5056, 1, 3328]
    - [47, 9952.02]
  - - [6784, 704, 1, 3328]
    - [2, 10362.0]
  - - [1856, 1856, 1, 32]
    - [53, 3200.17]
  - - [4288, 2944, 1, 32]
    - [53, 3900.83]
  - - [128, 448, 1, 1]
    - [73, 5.45173]
  - - [2944, 64, 1, 1]
    - [73, 17.7868]
  - - [704, 64, 1, 256]
    - [22, 1692.49]
  - - [256, 2368, 1, 3328]
    - [41, 7935.57]
  - - [704, 1, 1, 1]
    - [73, 0.0826388]
  - - [128, 448, 1, 1280]
    - [33, 3011.73]
  - - [5056, 5056, 1, 256]
    - [3, 11486.6]
  - - [5888, 64, 1, 1]
    - [75, 49.8719]
  - - [6784, 6784, 1, 256]
    - [14, 11000.0]
  - - [256, 3584, 1, 1]
    - [80, 90.4078]
  - - [2368, 2944, 1, 256]
    - [43, 10847.5]
  - - [448, 32, 1, 32]
    - [58, 44.8767]
  - - [5888, 3584, 1, 1]
    - [72, 222.56]
  - - [5888, 128, 1, 256]
    - [8, 8190.61]
  - - [3584, 704, 1, 3328]
    - [3, 10555.5]
  - - [4288, 704, 1, 3328]
    - [2, 10233.3]
  - - [4288, 2944, 1, 1280]
    - [47, 10765.1]
  - - [448, 3584, 1, 256]
    - [41, 8576.32]
  - - [704, 32, 1, 256]
    - [64, 210.419]
  - - [6784, 256, 1, 32]
    - [67, 2595.97]
  - - [1856, 128, 1, 1]
    - [73, 34.4826]
  - - [1856, 32, 1, 32]
    - [62, 148.3]
  - - [2368, 5056, 1, 1280]
    - [37, 10986.7]
  - - [704, 1856, 1, 1280]
    - [41, 10644.9]
  - - [1408, 1408, 1, 1280]
    - [41, 10572.8]
  - - [448, 1024, 1, 3328]
    - [47, 8391.77]
  - - [32, 704, 1, 32]
    - [62, 56.2519]
  - - [3584, 448, 1, 1]
    - [73, 115.909]
  - - [6784, 1024, 1, 3328]
    - [43, 10331.6]
  - - [5888, 1856, 1, 32]
    - [53, 3882.24]
  - - [5888, 704, 1, 3328]
    - [3, 10627.6]
  - - [5056, 1, 1, 256]
    - [87, 42.2048]
  - - [448, 6784, 1, 256]
    - [40, 10227.1]
  - - [1024, 128, 1, 1]
    - [77, 12.8219]
  - - [128, 64, 1, 256]
    - [25, 244.068]
  - - [128, 5056, 1, 1]
    - [80, 72.8055]
  - - [1856, 128, 1, 256]
    - [25, 5547.26]
  - - [64, 704, 1, 1]
    - [73, 4.37586]
  - - [2944, 5888, 1, 256]
    - [40, 11241.4]
  - - [1408, 64, 1, 256]
    - [51, 3145.66]
  - - [128, 5056, 1, 32]
    - [59, 1644.51]
  - - [128, 5056, 1, 1280]
    - [12, 8982.11]
  - - [448, 32, 1, 3328]
    - [64, 223.17]
  - - [1856, 1408, 1, 32]
    - [62, 3059.28]
  - - [64, 704, 1, 32]
    - [59, 101.904]
  - - [1, 5888, 1, 256]
    - [87, 47.543]
  - - [64, 2368, 1, 32]
    - [59, 357.75]
  - - [5888, 64, 1, 32]
    - [62, 1130.46]
  - - [2368, 256, 1, 1]
    - [75, 69.9444]
  - - [5888, 64, 1, 1280]
    - [51, 7969.94]
  - - [5056, 1, 1, 1]
    - [75, 0.853189]
  - - [5888, 2944, 1, 1280]
    - [41, 10684.8]
  - - [256, 1408, 1, 256]
    - [47, 5439.6]
  - - [448, 5888, 1, 1]
    - [72, 132.871]
  - - [3584, 1408, 1, 1]
    - [72, 172.9]
  - - [32, 6784, 1, 32]
    - [64, 705.117]
  - - [32, 1856, 1, 1280]
    - [64, 862.409]
  - - [448, 5888, 1, 32]
    - [59, 2921.84]
  - - [5056, 704, 1, 1280]
    - [41, 11199.0]
  - - [1856, 6784, 1, 1]
    - [76, 208.813]
  - - [5056, 64, 1, 1]
    - [73, 43.6803]
  - - [1, 5888, 1, 1]
    - [77, 0.946243]
  - - [2368, 1024, 1, 256]
    - [42, 9621.08]
  - - [1856, 6784, 1, 32]
    - [53, 3947.15]
  - - [1856, 6784, 1, 1280]
    - [47, 10764.8]
  - - [64, 3584, 1, 3328]
    - [20, 7324.15]
  - - [5888, 5056, 1, 3328]
    - [44, 9926.39]
  - - [1, 2944, 1, 3328]
    - [87, 37.5217]
  - - [1408, 6784, 1, 32]
    - [53, 3863.54]
  - - [32, 5888, 1, 1280]
    - [67, 2046.33]
  - - [448, 256, 1, 1]
    - [77, 11.1385]
  - - [3584, 5888, 1, 3328]
    - [44, 9852.0]
  - - [4288, 1408, 1, 256]
    - [42, 10716.5]
  - - [448, 64, 1, 1280]
    - [32, 1587.93]
  - - [128, 448, 1, 32]
    - [59, 133.898]
  - - [6784, 2368, 1, 256]
    - [44, 11357.9]
  - - [1408, 448, 1, 32]
    - [59, 1641.53]
  - - [1856, 1408, 1, 1280]
    - [47, 11269.2]
  - - [448, 256, 1, 3328]
    - [32, 5712.39]
  - - [1856, 2368, 1, 1]
    - [76, 162.995]
  - - [1408, 5056, 1, 3328]
    - [14, 10241.0]
  - - [128, 704, 1, 3328]
    - [32, 4779.74]
  - - [5056, 128, 1, 1280]
    - [19, 8910.56]
  - - [5056, 4288, 1, 256]
    - [42, 11362.5]
  - - [5056, 5056, 1, 32]
    - [53, 4194.05]
  - - [1856, 704, 1, 256]
    - [41, 9215.52]
  - - [2368, 256, 1, 32]
    - [64, 1558.75]
  - - [64, 256, 1, 256]
    - [26, 658.395]
  - - [448, 5888, 1, 1280]
    - [47, 10396.9]
  - - [704, 704, 1, 3328]
    - [47, 9051.35]
  - - [128, 6784, 1, 256]
    - [12, 7918.01]
  - - [5056, 448, 1, 256]
    - [47, 9581.26]
  - - [4288, 5888, 1, 1]
    - [76, 225.419]
  - - [1856, 5056, 1, 1280]
    - [14, 10822.2]
  - - [704, 1856, 1, 1]
    - [80, 109.561]
  - - [2368, 32, 1, 3328]
    - [64, 1178.79]
  - - [3584, 1856, 1, 256]
    - [44, 10864.0]
  - - [256, 3584, 1, 256]
    - [41, 8027.38]
  - - [2944, 1408, 1, 1]
    - [72, 168.041]
  - - [4288, 5888, 1, 32]
    - [53, 4212.7]
  - - [4288, 5888, 1, 3328]
    - [42, 9777.73]
  - - [1, 1024, 1, 1]
    - [73, 0.116159]
  - - [32, 64, 1, 32]
    - [62, 4.99836]
  - - [1408, 2368, 1, 1]
    - [76, 149.039]
  - - [2944, 2368, 1, 256]
    - [41, 10813.5]
  - - [1024, 1856, 1, 256]
    - [14, 9186.14]
  - - [2944, 64, 1, 3328]
    - [52, 7386.43]
  - - [1024, 5888, 1, 32]
    - [53, 3543.63]
  - - [1024, 5888, 1, 3328]
    - [47, 10696.9]
  - - [5056, 2368, 1, 32]
    - [53, 3894.58]
  - - [1408, 2368, 1, 1280]
    - [47, 11176.0]
  - - [256, 1, 1, 3328]
    - [87, 3.31542]
  - - [128, 1024, 1, 32]
    - [56, 304.409]
  - - [5056, 6784, 1, 3328]
    - [40, 9865.85]
  - - [448, 704, 1, 1]
    - [75, 42.1563]
  - - [448, 704, 1, 32]
    - [59, 973.197]
  - - [448, 704, 1, 3328]
    - [47, 5785.83]
  - - [1408, 2944, 1, 256]
    - [40, 10706.4]
  - - [3584, 4288, 1, 1]
    - [72, 215.435]
  - - [2368, 128, 1, 32]
    - [62, 941.957]
  - - [5056, 1408, 1, 1280]
    - [41, 11012.5]
  - - [2368, 128, 1, 3328]
    - [18, 7274.27]
  - - [704, 5056, 1, 32]
    - [53, 3328.17]
  - - [32, 2368, 1, 32]
    - [62, 188.132]
  - - [1408, 1, 1, 256]
    - [80, 12.1648]
  - - [256, 1856, 1, 32]
    - [68, 1405.79]
  - - [448, 1408, 1, 1]
    - [73, 70.9583]
  - - [5056, 4288, 1, 1280]
    - [4, 10383.3]
  - - [1408, 256, 1, 256]
    - [41, 5392.55]
  - - [128, 256, 1, 1]
    - [77, 3.18229]
  - - [256, 4288, 1, 32]
    - [59, 2079.89]
  - - [64, 64, 1, 3328]
    - [51, 225.79]
  - - [256, 256, 1, 1]
    - [73, 6.31916]
  - - [1408, 1, 1, 1]
    - [73, 0.16971]
  - - [448, 1408, 1, 256]
    - [41, 6920.4]
  - - [5888, 5888, 1, 1]
    - [76, 229.53]
  - - [128, 2944, 1, 32]
    - [64, 1130.46]
  - - [32, 1024, 1, 1280]
    - [64, 474.614]
  - - [32, 256, 1, 32]
    - [62, 19.5513]
  - - [2944, 704, 1, 1280]
    - [47, 11019.4]
  - - [1024, 3584, 1, 1280]
    - [47, 11490.5]
  - - [704, 6784, 1, 256]
    - [41, 10354.5]
  - - [1856, 448, 1, 1]
    - [75, 83.7687]
  - - [128, 704, 1, 1]
    - [73, 8.62729]
  - - [5056, 256, 1, 32]
    - [59, 2369.22]
  - - [4288, 1, 1, 3328]
    - [87, 44.4088]
  - - [5056, 1024, 1, 1280]
    - [42, 11565.8]
  - - [704, 704, 1, 1]
    - [80, 61.952]
  - - [1856, 448, 1, 1280]
    - [47, 8300.19]
  - - [3584, 6784, 1, 256]
    - [37, 11280.2]
  - - [64, 1856, 1, 1280]
    - [52, 5517.52]
  - - [1856, 1408, 1, 256]
    - [42, 10344.9]
  - - [4288, 4288, 1, 32]
    - [53, 4083.76]
  - - [128, 1, 1, 256]
    - [80, 1.08954]
  - - [32, 64, 1, 3328]
    - [64, 32.3295]
  - - [5888, 448, 1, 1]
    - [73, 140.752]
  - - [128, 5888, 1, 256]
    - [41, 8242.4]
  - - [3584, 256, 1, 3328]
    - [47, 9357.62]
  - - [5056, 5056, 1, 1280]
    - [37, 10361.6]
  - - [2368, 1, 1, 256]
    - [80, 20.2063]
  - - [6784, 1408, 1, 3328]
    - [47, 10146.4]
  - - [1408, 1408, 1, 1]
    - [76, 135.85]
  - - [32, 64, 1, 256]
    - [64, 18.8234]
  - - [2368, 1, 1, 1280]
    - [87, 28.2387]
  - - [32, 3584, 1, 32]
    - [62, 269.26]
  - - [2368, 5056, 1, 1]
    - [76, 204.849]
  - - [1, 3584, 1, 1]
    - [77, 0.380973]
  - - [256, 2944, 1, 3328]
    - [2, 9638.35]
  - - [1408, 64, 1, 3328]
    - [32, 4774.11]
  - - [1, 128, 1, 3328]
    - [87, 1.63509]
  - - [32, 256, 1, 256]
    - [64, 75.4942]
  - - [5888, 1408, 1, 32]
    - [53, 3822.07]
  - - [704, 256, 1, 1]
    - [77, 17.3785]
  - - [1, 448, 1, 1]
    - [73, 0.0508225]
  - - [256, 6784, 1, 3328]
    - [41, 10028.8]
  - - [64, 5888, 1, 256]
    - [51, 6479.21]
  - - [1856, 1, 1, 1]
    - [77, 0.221731]
  - - [1024, 256, 1, 3328]
    - [47, 7612.93]
  - - [704, 704, 1, 256]
    - [41, 7288.47]
  - - [448, 1024, 1, 32]
    - [59, 1385.83]
  - - [6784, 2368, 1, 1280]
    - [44, 10738.3]
  - - [128, 1856, 1, 1280]
    - [25, 7126.82]
  - - [256, 2368, 1, 256]
    - [47, 6693.23]
  - - [1024, 448, 1, 32]
    - [60, 1376.21]
  - - [6784, 1024, 1, 256]
    - [41, 10775.3]
  - - [1408, 6784, 1, 3328]
    - [41, 10241.6]
  - - [2944, 1408, 1, 3328]
    - [42, 10800.2]
  - - [1856, 32, 1, 256]
    - [64, 550.274]
  - - [704, 2368, 1, 32]
    - [59, 2562.82]
  - - [448, 256, 1, 32]
    - [54, 266.368]
  - - [704, 6784, 1, 1]
    - [76, 169.221]
  - - [2368, 6784, 1, 256]
    - [40, 11392.8]
  - - [1856, 64, 1, 256]
    - [51, 3985.67]
  - - [1856, 3584, 1, 3328]
    - [42, 10177.0]
  - - [1, 704, 1, 3328]
    - [87, 9.08859]
  - - [5056, 1408, 1, 32]
    - [53, 3656.67]
  - - [64, 1, 1, 3328]
    - [87, 0.807669]
  - - [5056, 4288, 1, 3328]
    - [42, 9854.55]
  - - [4288, 2368, 1, 1]
    - [72, 200.989]
  - - [704, 448, 1, 256]
    - [47, 4780.51]
  - - [448, 64, 1, 3328]
    - [32, 1688.24]
  - - [2368, 256, 1, 1280]
    - [41, 7724.89]
  - - [256, 32, 1, 1280]
    - [64, 128.102]
  - - [2368, 448, 1, 1280]
    - [41, 8671.31]
  - - [6784, 2944, 1, 32]
    - [53, 4135.99]
  - - [64, 4288, 1, 32]
    - [62, 846.808]
  - - [3584, 1856, 1, 1]
    - [72, 182.144]
  - - [128, 448, 1, 3328]
    - [36, 3232.45]
  - - [5888, 2368, 1, 3328]
    - [44, 10047.3]
  - - [2368, 704, 1, 1280]
    - [47, 10030.0]
  - - [1024, 1408, 1, 1280]
    - [41, 9977.34]
  - - [4288, 64, 1, 1280]
    - [51, 6660.21]
  - - [2368, 6784, 1, 1]
    - [72, 217.954]
  - - [2944, 5056, 1, 32]
    - [53, 4044.06]
  - - [5056, 256, 1, 3328]
    - [47, 10530.6]
  - - [448, 448, 1, 1]
    - [81, 18.8154]
  - - [256, 2368, 1, 1280]
    - [47, 7730.59]
  - - [704, 2368, 1, 3328]
    - [41, 10228.9]
  - - [3584, 2944, 1, 256]
    - [41, 10943.6]
  - - [64, 6784, 1, 256]
    - [51, 6668.61]
  - - [3584, 1024, 1, 1280]
    - [41, 11538.5]
  - - [1408, 256, 1, 32]
    - [62, 1104.35]
  - - [64, 1024, 1, 256]
    - [52, 2488.83]
  - - [1408, 32, 1, 32]
    - [59, 115.173]
  - - [128, 3584, 1, 256]
    - [41, 6775.35]
  - - [4288, 2944, 1, 1]
    - [74, 207.826]
  - - [5056, 3584, 1, 256]
    - [40, 11390.2]
  - - [2368, 704, 1, 256]
    - [41, 8946.03]
  - - [1856, 1856, 1, 1280]
    - [41, 10834.2]
  - - [64, 32, 1, 32]
    - [62, 4.91514]
  - - [1856, 1024, 1, 1]
    - [76, 130.237]
  - - [4288, 2944, 1, 3328]
    - [41, 9879.24]
  - - [1024, 128, 1, 3328]
    - [35, 6435.69]
  - - [4288, 128, 1, 3328]
    - [16, 8143.54]
  - - [4288, 704, 1, 32]
    - [62, 3068.42]
  - - [1856, 1024, 1, 32]
    - [62, 2683.02]
  - - [1, 448, 1, 3328]
    - [87, 5.72606]
  - - [6784, 2368, 1, 32]
    - [53, 4018.33]
  - - [5888, 5056, 1, 1]
    - [76, 225.775]
  - - [128, 6784, 1, 1280]
    - [1, 9017.23]
  - - [704, 5888, 1, 1]
    - [74, 174.324]
  - - [6784, 6784, 1, 1]
    - [72, 235.603]
  - - [1856, 32, 1, 1280]
    - [64, 846.054]
  - - [3584, 1024, 1, 3328]
    - [42, 10630.6]
  - - [5888, 448, 1, 3328]
    - [41, 9847.8]
  - - [704, 5888, 1, 32]
    - [55, 3410.77]
  - - [704, 5888, 1, 1280]
    - [41, 11476.7]
  - - [1024, 6784, 1, 3328]
    - [45, 10311.5]
  - - [704, 2944, 1, 1280]
    - [47, 10995.7]
  - - [4288, 6784, 1, 256]
    - [14, 11382.6]
  - - [3584, 256, 1, 32]
    - [62, 2043.01]
  - - [1408, 1408, 1, 32]
    - [53, 2807.84]
  - - [1408, 1408, 1, 3328]
    - [44, 9994.99]
  - - [1024, 64, 1, 256]
    - [24, 2488.83]
  - - [4288, 64, 1, 32]
    - [62, 852.853]
  - - [5888, 6784, 1, 32]
    - [53, 4342.06]
  - - [1024, 2944, 1, 3328]
    - [47, 10274.5]
  - - [64, 704, 1, 1280]
    - [22, 2345.04]
  - - [2944, 1856, 1, 256]
    - [41, 10765.8]
  - - [128, 5056, 1, 3328]
    - [15, 8805.29]
  - - [704, 1408, 1, 1]
    - [76, 95.5773]
  - - [6784, 5056, 1, 32]
    - [53, 4270.06]
  - - [1024, 448, 1, 3328]
    - [47, 8371.31]
  - - [5888, 1408, 1, 1]
    - [76, 198.432]
  - - [2944, 4288, 1, 1280]
    - [41, 10476.6]
  - - [64, 32, 1, 3328]
    - [64, 32.0034]
  - - [1024, 4288, 1, 256]
    - [41, 10596.7]
  - - [128, 2368, 1, 256]
    - [11, 5662.19]
  - - [2368, 64, 1, 32]
    - [59, 355.808]
  - - [1408, 1, 1, 3328]
    - [87, 18.3672]
  - - [64, 1408, 1, 32]
    - [59, 207.057]
  - - [2368, 5888, 1, 1]
    - [72, 213.889]
  - - [448, 1856, 1, 256]
    - [14, 7256.46]
  - - [1856, 6784, 1, 3328]
    - [41, 9906.58]
  - - [3584, 128, 1, 256]
    - [41, 6804.2]
  - - [1024, 448, 1, 1280]
    - [47, 8047.67]
  - - [1024, 2368, 1, 32]
    - [53, 2877.77]
  - - [128, 5888, 1, 1]
    - [77, 82.0493]
  - - [64, 5056, 1, 1]
    - [80, 42.8276]
  - - [32, 2368, 1, 1280]
    - [64, 1081.23]
  - - [2368, 2368, 1, 3328]
    - [41, 10544.2]
  - - [64, 448, 1, 1]
    - [73, 2.68792]
  - - [3584, 5888, 1, 32]
    - [53, 4156.88]
  - - [3584, 5888, 1, 1280]
    - [42, 10327.4]
  - - [64, 5056, 1, 32]
    - [64, 977.503]
  - - [6784, 704, 1, 256]
    - [41, 10361.0]
  - - [1408, 704, 1, 32]
    - [62, 2173.61]
  - - [1408, 704, 1, 1280]
    - [41, 9804.21]
  - - [2368, 5888, 1, 256]
    - [3, 11263.4]
  - - [2944, 64, 1, 32]
    - [62, 437.588]
  - - [1, 1408, 1, 256]
    - [80, 11.8104]
  - - [64, 2944, 1, 256]
    - [51, 5209.19]
  - - [5888, 5888, 1, 32]
    - [53, 4299.84]
  - - [1856, 1408, 1, 3328]
    - [3, 10897.0]
  - - [1024, 1024, 1, 32]
    - [62, 2299.35]
  - - [4288, 1024, 1, 1]
    - [76, 165.573]
  - - [2944, 5056, 1, 1280]
    - [2, 10857.5]
  - - [6784, 2944, 1, 1280]
    - [40, 10354.9]
  - - [6784, 256, 1, 3328]
    - [47, 10663.4]
  - - [5056, 128, 1, 3328]
    - [19, 9289.18]
  - - [128, 128, 1, 1280]
    - [31, 907.406]
  - - [128, 4288, 1, 1]
    - [75, 63.3317]
  - - [1408, 5056, 1, 32]
    - [53, 3745.75]
  - - [2944, 128, 1, 3328]
    - [29, 8054.13]
  - - [5888, 1856, 1, 1280]
    - [44, 10918.9]
  - - [256, 64, 1, 1280]
    - [31, 907.387]
  - - [5888, 256, 1, 1280]
    - [47, 10443.4]
  - - [1856, 5056, 1, 1]
    - [76, 196.099]
  - - [3584, 1856, 1, 1280]
    - [37, 11169.1]
  - - [704, 3584, 1, 256]
    - [42, 10045.8]
  - - [1856, 5056, 1, 32]
    - [53, 3760.41]
  - - [1856, 5056, 1, 3328]
    - [41, 10335.3]
  - - [1024, 2944, 1, 32]
    - [53, 3145.64]
  - - [1408, 6784, 1, 256]
    - [41, 10937.8]
  - - [1024, 2368, 1, 1280]
    - [44, 10459.3]
  - - [1856, 3584, 1, 1]
    - [76, 188.255]
  - - [2944, 5888, 1, 1280]
    - [47, 10599.0]
  - - [1, 1856, 1, 1]
    - [73, 0.212333]
  - - [3584, 3584, 1, 256]
    - [42, 11212.7]
  - - [1856, 2368, 1, 3328]
    - [41, 10717.2]
  - - [5888, 704, 1, 256]
    - [44, 10714.4]
  - - [64, 448, 1, 32]
    - [69, 80.955]
  - - [6784, 4288, 1, 256]
    - [14, 11313.4]
  - - [128, 64, 1, 3328]
    - [23, 442.355]
  - - [1, 5056, 1, 1280]
    - [87, 50.4416]
  - - [32, 64, 1, 1280]
    - [64, 29.5889]
  - - [1408, 2368, 1, 3328]
    - [41, 10530.2]
  - - [1024, 3584, 1, 256]
    - [44, 10649.2]
  - - [2944, 128, 1, 256]
    - [7, 6352.5]
  - - [6784, 128, 1, 1]
    - [72, 87.4826]
  - - [1408, 256, 1, 3328]
    - [41, 6550.86]
  - - [1024, 16, 1, 512]
    - [31, 780.989]
  - - [448, 32, 1, 256]
    - [64, 132.825]
  - - [5056, 6784, 1, 1280]
    - [40, 10144.7]
  - - [64, 2368, 1, 256]
    - [51, 4258.06]
  - - [2944, 256, 1, 256]
    - [41, 8268.53]
  - - [1, 128, 1, 256]
    - [80, 1.06334]
  - - [32, 256, 1, 1280]
    - [64, 116.89]
  - - [5888, 1, 1, 256]
    - [87, 48.3327]
  - - [32, 128, 1, 3328]
    - [64, 63.9178]
  - - [2560, 7133, 1, 2560]
    - [44, 10191.4]
  - - [6784, 128, 1, 256]
    - [1, 7981.12]
  - - [6784, 64, 1, 1280]
    - [51, 8101.89]
  - - [4288, 1024, 1, 32]
    - [59, 3253.54]
  - - [2944, 448, 1, 1280]
    - [41, 9145.29]
  - - [6784, 32, 1, 1280]
    - [67, 2365.18]
  - - [2944, 64, 1, 1280]
    - [51, 6883.07]
  - - [704, 448, 1, 1]
    - [77, 42.1534]
  - - [32, 128, 1, 32]
    - [62, 9.46232]
  - - [1, 128, 1, 1]
    - [83, 0.013935]
  - - [32, 4288, 1, 256]
    - [67, 1194.46]
  - - [5888, 1, 1, 1]
    - [77, 0.981252]
  - - [5888, 1856, 1, 3328]
    - [41, 10176.5]
  - - [32, 2368, 1, 3328]
    - [64, 1184.53]
  - - [2368, 3584, 1, 256]
    - [43, 10915.5]
  - - [4288, 1408, 1, 3328]
    - [47, 10311.5]
  - - [1856, 32, 1, 3328]
    - [64, 930.039]
  - - [2944, 32, 1, 256]
    - [64, 868.183]
  - - [128, 64, 1, 1]
    - [83, 0.8192]
  - - [256, 1024, 1, 3328]
    - [47, 7622.81]
  - - [32, 448, 1, 256]
    - [64, 132.117]
  - - [1856, 64, 1, 32]
    - [59, 283.505]
  - - [1856, 64, 1, 3328]
    - [52, 6043.67]
  - - [256, 5056, 1, 256]
    - [41, 9110.16]
  - - [5888, 2944, 1, 3328]
    - [42, 9732.67]
  - - [2368, 1408, 1, 3328]
    - [47, 10438.5]
  - - [5888, 704, 1, 32]
    - [68, 3297.7]
  - - [2944, 704, 1, 1]
    - [77, 135.167]
  - - [6784, 1856, 1, 256]
    - [40, 11004.9]
  - - [1, 704, 1, 256]
    - [80, 5.96304]
  - - [1856, 1856, 1, 1]
    - [72, 153.982]
  - - [5888, 32, 1, 256]
    - [67, 1661.08]
  - - [2368, 1856, 1, 1]
    - [72, 163.898]
  - - [128, 704, 1, 256]
    - [23, 3114.23]
  - - [256, 1408, 1, 3328]
    - [47, 6598.9]
  - - [2944, 128, 1, 1]
    - [73, 49.8752]
  - - [32, 256, 1, 3328]
    - [64, 128.147]
  - - [2944, 704, 1, 3328]
    - [14, 10855.0]
  - - [2368, 1856, 1, 32]
    - [62, 3307.63]
  - - [3584, 128, 1, 1280]
    - [16, 8031.44]
  - - [1024, 5056, 1, 3328]
    - [49, 10520.6]
  - - [256, 32, 1, 32]
    - [64, 33.7033]
  - - [64, 256, 1, 3328]
    - [31, 967.252]
  - - [256, 6784, 1, 1]
    - [75, 123.394]
  - - [1024, 3584, 1, 32]
    - [53, 3439.01]
  - - [256, 6784, 1, 32]
    - [60, 2604.97]
  - - [2944, 1408, 1, 32]
    - [53, 3340.76]
  - - [1024, 32, 1, 256]
    - [64, 305.235]
  - - [4288, 3584, 1, 1]
    - [72, 215.212]
  - - [1, 704, 1, 1]
    - [77, 0.0798593]
  - - [5056, 448, 1, 3328]
    - [38, 10313.4]
  - - [3584, 64, 1, 256]
    - [25, 5320.31]
  - - [64, 1856, 1, 32]
    - [59, 271.497]
  - - [64, 1856, 1, 3328]
    - [52, 6029.98]
  - - [5888, 5888, 1, 3328]
    - [44, 9824.64]
  - - [6784, 3584, 1, 32]
    - [53, 4204.66]
  - - [4288, 1856, 1, 256]
    - [41, 10785.8]
  - - [1856, 2944, 1, 256]
    - [41, 10790.4]
  - - [4288, 256, 1, 1]
    - [77, 97.4935]
  - - [64, 128, 1, 32]
    - [62, 17.873]
  - - [704, 1, 1, 1280]
    - [87, 8.32063]
  - - [1024, 2368, 1, 256]
    - [44, 9621.08]
  - - [2944, 5888, 1, 1]
    - [76, 217.678]
  - - [1024, 1856, 1, 3328]
    - [47, 10291.1]
  - - [5888, 1024, 1, 32]
    - [53, 3563.03]
  - - [3584, 256, 1, 1280]
    - [13, 9111.47]
  - - [1024, 1, 1, 1]
    - [73, 0.125667]
  - - [1408, 5056, 1, 1280]
    - [42, 11034.3]
  - - [5056, 6784, 1, 256]
    - [4, 11126.0]
  - - [256, 1856, 1, 256]
    - [47, 7047.41]
  - - [1856, 256, 1, 1]
    - [73, 61.6739]
  - - [5888, 32, 1, 1280]
    - [67, 2071.07]
  - - [256, 704, 1, 1]
    - [77, 17.3785]
  - - [256, 128, 1, 32]
    - [63, 90.1613]
  - - [1408, 1856, 1, 32]
    - [59, 3084.39]
  - - [2944, 5056, 1, 1]
    - [76, 214.908]
  - - [448, 128, 1, 1]
    - [77, 5.56927]
  - - [256, 704, 1, 32]
    - [57, 416.342]
  - - [256, 704, 1, 1280]
    - [21, 4974.7]
  - - [1, 2368, 1, 1]
    - [77, 0.268633]
  - - [5888, 5888, 1, 1280]
    - [41, 10124.1]
  - - [256, 2944, 1, 1280]
    - [47, 9568.68]
  - - [2944, 256, 1, 3328]
    - [41, 9840.03]
  - - [5056, 2944, 1, 1280]
    - [2, 10829.1]
  - - [704, 1024, 1, 3328]
    - [47, 9464.46]
  - - [2368, 1856, 1, 1280]
    - [2, 11274.3]
  - - [448, 2944, 1, 1]
    - [76, 107.909]
  - - [6784, 2944, 1, 1]
    - [76, 220.454]
  - - [2944, 1024, 1, 32]
    - [53, 3130.53]
  - - [2944, 1024, 1, 1280]
    - [41, 10978.2]
  - - [1408, 64, 1, 32]
    - [59, 216.266]
  - - [2368, 4288, 1, 256]
    - [41, 11052.3]
  - - [448, 1856, 1, 1280]
    - [41, 8257.27]
  - - [2368, 448, 1, 1]
    - [75, 96.1145]
  - - [448, 2944, 1, 32]
    - [62, 2269.89]
  - - [448, 2944, 1, 1280]
    - [47, 9127.0]
  - - [2944, 6784, 1, 1280]
    - [47, 10399.2]
  - - [256, 6784, 1, 1280]
    - [41, 10448.9]
  - - [5056, 128, 1, 256]
    - [0, 7712.27]
  - - [3072, 7435, 1, 1024]
    - [2, 10468.3]
  - - [3584, 2368, 1, 32]
    - [53, 3760.24]
  - - [704, 32, 1, 32]
    - [54, 54.6734]
  - - [6784, 3584, 1, 3328]
    - [40, 9883.54]
  - - [128, 32, 1, 256]
    - [64, 37.2503]
  - - [128, 1408, 1, 1280]
    - [24, 6394.64]
  - - [64, 32, 1, 1280]
    - [64, 29.5642]
  - - [128, 1856, 1, 3328]
    - [30, 7678.52]
  - - [2944, 2944, 1, 256]
    - [42, 10995.9]
  - - [5056, 2368, 1, 1280]
    - [3, 10941.4]
  - - [448, 128, 1, 32]
    - [53, 144.018]
  - - [32, 5056, 1, 3328]
    - [67, 1808.15]
  - - [448, 2944, 1, 3328]
    - [47, 8967.05]
  - - [2944, 1024, 1, 1]
    - [72, 159.594]
  - - [256, 4288, 1, 1]
    - [77, 96.8569]
  - - [2368, 128, 1, 1280]
    - [18, 6846.36]
  - - [3584, 704, 1, 256]
    - [44, 9976.8]
  - - [2368, 5888, 1, 3328]
    - [42, 10058.2]
  - - [1408, 3584, 1, 32]
    - [53, 3460.16]
  - - [2944, 4288, 1, 32]
    - [53, 3881.38]
  - - [5888, 1408, 1, 1280]
    - [42, 11248.7]
  - - [3584, 5056, 1, 1280]
    - [3, 10624.5]
  - - [5888, 6784, 1, 1280]
    - [42, 10049.1]
  - - [64, 1856, 1, 1]
    - [73, 11.1357]
  - - [704, 128, 1, 32]
    - [59, 207.057]
  - - [128, 3584, 1, 3328]
    - [24, 8566.17]
  - - [256, 4288, 1, 3328]
    - [41, 8870.0]
  - - [256, 2368, 1, 1]
    - [77, 69.3523]
  - - [1, 1408, 1, 1280]
    - [87, 16.4833]
  - - [6784, 1408, 1, 32]
    - [53, 3799.52]
  - - [1856, 704, 1, 32]
    - [59, 2432.98]
  - - [1024, 1856, 1, 1]
    - [72, 129.58]
  - - [704, 5056, 1, 3328]
    - [47, 10593.1]
  - - [1024, 3584, 1, 3328]
    - [44, 10687.2]
  - - [5888, 256, 1, 3328]
    - [40, 10386.4]
  - - [1856, 1408, 1, 1]
    - [72, 154.731]
  - - [2944, 448, 1, 32]
    - [62, 2260.89]
  - - [128, 448, 1, 256]
    - [33, 2154.08]
  - - [128, 1024, 1, 1]
    - [75, 12.203]
  - - [32, 32, 1, 256]
    - [64, 9.26402]
  - - [4288, 5056, 1, 1280]
    - [2, 10465.7]
  - - [1856, 1856, 1, 3328]
    - [41, 10444.1]
  - - [3584, 1856, 1, 3328]
    - [44, 10419.3]
  - - [4288, 2368, 1, 3328]
    - [41, 10188.1]
  - - [256, 64, 1, 32]
    - [64, 62.0827]
  - - [1, 1024, 1, 1280]
    - [87, 12.161]
  - - [32, 1408, 1, 256]
    - [64, 414.115]
  - - [1024, 32, 1, 3328]
    - [64, 516.908]
  - - [5888, 3584, 1, 256]
    - [39, 11382.6]
  - - [5888, 448, 1, 1280]
    - [47, 10401.7]
  - - [704, 5888, 1, 3328]
    - [47, 10720.0]
  - - [1024, 1408, 1, 256]
    - [44, 8850.23]
  - - [3584, 2944, 1, 1280]
    - [2, 10831.2]
  - - [1, 5056, 1, 256]
    - [87, 41.3071]
  - - [256, 1024, 1, 1]
    - [80, 38.0525]
  - - [32, 32, 1, 3328]
    - [64, 15.9628]
  - - [5056, 128, 1, 32]
    - [59, 1644.51]
  - - [2368, 1, 1, 3328]
    - [87, 30.7919]
  - - [4288, 1856, 1, 1280]
    - [2, 11039.5]
  - - [3584, 5888, 1, 1]
    - [76, 222.387]
  - - [5888, 4288, 1, 256]
    - [40, 11390.8]
  - - [1024, 2944, 1, 1280]
    - [41, 10973.6]
  - - [6784, 1, 1, 1]
    - [73, 1.10336]
  - - [1408, 64, 1, 1280]
    - [23, 4349.38]
  - - [1, 256, 1, 1280]
    - [87, 2.99697]
  - - [2944, 3584, 1, 256]
    - [41, 10937.0]
  - - [1, 128, 1, 1280]
    - [87, 1.49343]
  - - [1024, 256, 1, 32]
    - [64, 913.245]
  - - [5888, 1, 1, 1280]
    - [87, 57.9394]
  - - [2368, 32, 1, 1280]
    - [64, 1085.71]
  - - [5888, 1856, 1, 1]
    - [72, 202.365]
  - - [6784, 128, 1, 1280]
    - [19, 9044.41]
  - - [6784, 2368, 1, 3328]
    - [44, 10009.2]
  - - [1, 64, 1, 256]
    - [80, 0.530398]
  - - [704, 128, 1, 1]
    - [77, 8.75171]
  - - [1408, 4288, 1, 32]
    - [53, 3602.36]
  - - [32, 1408, 1, 3328]
    - [64, 708.261]
  - - [256, 448, 1, 256]
    - [23, 3848.24]
  - - [1856, 1024, 1, 1280]
    - [42, 10079.9]
  - - [1024, 448, 1, 1]
    - [75, 58.9807]
  - - [4288, 3584, 1, 1280]
    - [41, 10814.7]
  - - [448, 1024, 1, 1280]
    - [47, 8031.38]
  - - [5056, 1856, 1, 1]
    - [72, 196.403]
  - - [5888, 2368, 1, 256]
    - [44, 11289.8]
  - - [1408, 1024, 1, 32]
    - [59, 2442.49]
  - - [32, 704, 1, 256]
    - [64, 208.167]
  - - [2944, 1, 1, 256]
    - [80, 24.8759]
  - - [704, 1024, 1, 32]
    - [59, 1821.16]
  - - [5056, 1856, 1, 32]
    - [53, 3736.15]
  - - [5056, 1856, 1, 1280]
    - [37, 11181.9]
  - - [1, 64, 1, 1]
    - [77, 0.007082]
  - - [1408, 5888, 1, 3328]
    - [46, 10434.7]
  - - [1408, 704, 1, 3328]
    - [47, 10123.4]
  - - [5056, 704, 1, 3328]
    - [44, 10359.7]
  - - [704, 64, 1, 1280]
    - [31, 2359.19]
  - - [1, 704, 1, 1280]
    - [87, 8.40107]
  - - [1408, 256, 1, 1]
    - [73, 48.1786]
  - - [5888, 4288, 1, 32]
    - [53, 4206.2]
  - - [1408, 3584, 1, 256]
    - [40, 10595.0]
  - - [1408, 6784, 1, 1]
    - [76, 199.298]
  - - [6784, 256, 1, 1]
    - [75, 124.05]
  - - [2944, 1, 1, 1]
    - [73, 0.34558]
  - - [256, 1856, 1, 3328]
    - [47, 8670.29]
  - - [4288, 128, 1, 1280]
    - [10, 7877.13]
  - - [128, 128, 1, 1]
    - [73, 1.66301]
  - - [6784, 256, 1, 1280]
    - [2, 10330.2]
  - - [128, 4288, 1, 256]
    - [10, 6750.22]
  - - [2368, 6784, 1, 1280]
    - [40, 10697.4]
  - - [128, 128, 1, 32]
    - [67, 58.0125]
  - - [128, 128, 1, 3328]
    - [31, 965.984]
  - - [128, 1408, 1, 32]
    - [62, 439.856]
  - - [6784, 128, 1, 32]
    - [59, 1943.57]
  - - [1408, 448, 1, 1]
    - [80, 71.558]
  - - [2368, 704, 1, 3328]
    - [41, 9744.46]
  - - [704, 128, 1, 3328]
    - [32, 4746.08]
  - - [2944, 1856, 1, 32]
    - [53, 3481.4]
  - - [1024, 64, 1, 1]
    - [73, 6.50514]
  - - [1408, 32, 1, 1280]
    - [64, 655.338]
  - - [704, 1, 1, 256]
    - [80, 6.08238]
  - - [1856, 2944, 1, 3328]
    - [2, 10486.6]
  - - [3584, 2944, 1, 1]
    - [72, 202.615]
  - - [5888, 64, 1, 256]
    - [51, 6511.36]
  - - [64, 5056, 1, 1280]
    - [51, 7842.01]
  - - [1408, 2944, 1, 1]
    - [76, 167.039]
  - - [4288, 1408, 1, 32]
    - [53, 3548.47]
  - - [5888, 2944, 1, 256]
    - [42, 11220.3]
  - - [128, 64, 1, 1280]
    - [6, 398.744]
  - - [1408, 2944, 1, 32]
    - [53, 3378.58]
  - - [1, 3584, 1, 1280]
    - [80, 42.1575]
  - - [64, 64, 1, 32]
    - [59, 9.02762]
  - - [448, 1408, 1, 32]
    - [62, 1641.53]
  - - [128, 5056, 1, 256]
    - [12, 7738.93]
  - - [1, 1, 1, 1280]
    - [84, 0.0131804]
  - - [64, 704, 1, 256]
    - [22, 1692.49]
  - - [3584, 1408, 1, 1280]
    - [14, 11182.0]
  - - [5888, 6784, 1, 256]
    - [37, 10958.4]
  - - [6784, 5888, 1, 1]
    - [72, 230.538]
  - - [64, 4288, 1, 256]
    - [51, 5388.86]
  - - [1, 448, 1, 1280]
    - [87, 5.23054]
  - - [1024, 1024, 1, 1]
    - [79, 104.087]
  - - [6784, 5888, 1, 1280]
    - [40, 10100.3]
  - - [1024, 4288, 1, 32]
    - [53, 3264.73]
  - - [1856, 1, 1, 1280]
    - [87, 22.1636]
  - - [3584, 5888, 1, 256]
    - [38, 11384.4]
  - - [5056, 2368, 1, 1]
    - [76, 204.072]
  - - [256, 1408, 1, 1280]
    - [47, 6355.44]
  - - [512, 16, 1, 512]
    - [9, 311.116]
  - - [64, 256, 1, 32]
    - [64, 61.0134]
  - - [64, 5888, 1, 3328]
    - [51, 8418.59]
  - - [6784, 64, 1, 3328]
    - [50, 8318.13]
  - - [5056, 448, 1, 1]
    - [73, 137.12]
  - - [2944, 448, 1, 3328]
    - [41, 9021.66]
  - - [1856, 6784, 1, 256]
    - [40, 11027.2]
  - - [4288, 32, 1, 1280]
    - [67, 1516.0]
  - - [448, 1408, 1, 1280]
    - [47, 8055.87]
  - - [5056, 448, 1, 32]
    - [59, 2811.75]
  - - [3584, 2944, 1, 32]
    - [53, 3889.09]
  - - [2368, 128, 1, 1]
    - [80, 41.3314]
  - - [128, 3584, 1, 32]
    - [64, 1357.38]
  - - [3584, 1856, 1, 32]
    - [53, 3538.83]
  - - [4288, 64, 1, 3328]
    - [51, 7049.35]
  - - [5056, 64, 1, 256]
    - [51, 6317.93]
  - - [64, 448, 1, 3328]
    - [31, 1655.7]
  - - [4288, 1408, 1, 1280]
    - [37, 11056.0]
  - - [32, 5056, 1, 256]
    - [67, 1433.7]
  - - [704, 128, 1, 256]
    - [23, 3145.66]
  - - [704, 5056, 1, 1]
    - [82, 164.56]
  - - [256, 1024, 1, 32]
    - [64, 913.245]
  - - [256, 1024, 1, 1280]
    - [47, 7212.9]
  - - [2368, 128, 1, 256]
    - [11, 5692.93]
  - - [2368, 1408, 1, 1280]
    - [41, 11256.8]
  - - [128, 256, 1, 32]
    - [63, 91.3235]
  - - [64, 6784, 1, 32]
    - [64, 1293.45]
  - - [6784, 32, 1, 256]
    - [67, 1885.0]
  - - [5056, 2944, 1, 1]
    - [76, 213.311]
  - - [3584, 128, 1, 1]
    - [75, 59.5472]
  - - [1024, 4288, 1, 1280]
    - [47, 11409.4]
  - - [1856, 4288, 1, 1]
    - [76, 192.537]
  - - [128, 2944, 1, 256]
    - [12, 6383.6]
  - - [3584, 4288, 1, 256]
    - [42, 11193.0]
  - - [3584, 128, 1, 32]
    - [59, 1348.16]
  - - [3584, 128, 1, 3328]
    - [47, 8395.18]
  - - [704, 5056, 1, 256]
    - [42, 10389.4]
  - - [1856, 4288, 1, 32]
    - [53, 3724.79]
  - - [5056, 1, 1, 1280]
    - [87, 49.8374]
  - - [64, 256, 1, 1280]
    - [31, 907.387]
  - - [4288, 1024, 1, 1280]
    - [41, 11468.0]
  - - [1, 4288, 1, 256]
    - [87, 35.1161]
  - - [2944, 3584, 1, 1]
    - [76, 204.067]
  - - [4288, 6784, 1, 32]
    - [53, 4265.58]
  - - [4288, 4288, 1, 256]
    - [40, 11244.6]
  - - [3584, 3584, 1, 1]
    - [72, 212.505]
  - - [3584, 1408, 1, 256]
    - [42, 10601.5]
  - - [704, 3584, 1, 3328]
    - [3, 10604.9]
  - - [5056, 448, 1, 1280]
    - [41, 10806.0]
  - - [1408, 2944, 1, 1280]
    - [47, 11420.0]
  - - [5888, 704, 1, 1280]
    - [41, 11467.5]
  - - [64, 64, 1, 256]
    - [52, 164.586]
  - - [704, 1408, 1, 1280]
    - [41, 9826.72]
  - - [4288, 5888, 1, 256]
    - [40, 11411.6]
  - - [3584, 3584, 1, 3328]
    - [41, 10196.4]
  - - [2944, 6784, 1, 32]
    - [53, 4130.05]
  - - [448, 64, 1, 32]
    - [58, 84.8323]
  - - [5056, 256, 1, 1]
    - [75, 109.89]
  - - [64, 6784, 1, 1280]
    - [51, 8145.83]
  - - [2944, 2368, 1, 3328]
    - [47, 10235.0]
  - - [1, 4288, 1, 1]
    - [75, 0.70596]
  - - [1408, 128, 1, 256]
    - [24, 4828.1]
  - - [1024, 1856, 1, 1280]
    - [41, 10117.2]
  - - [1024, 5888, 1, 256]
    - [41, 10858.1]
  - - [704, 1408, 1, 256]
    - [42, 8628.79]
  - - [6784, 2944, 1, 3328]
    - [44, 9828.23]
  - - [1408, 2368, 1, 256]
    - [41, 10205.9]
  - - [1024, 1408, 1, 1]
    - [72, 115.853]
  - - [64, 128, 1, 1280]
    - [51, 428.944]
  - - [1408, 5056, 1, 256]
    - [44, 10900.3]
  - - [1024, 1408, 1, 32]
    - [62, 2442.49]
  - - [4288, 128, 1, 32]
    - [68, 1428.29]
  - - [6784, 704, 1, 1]
    - [72, 164.054]
  - - [448, 704, 1, 256]
    - [41, 4738.98]
  - - [704, 3584, 1, 32]
    - [53, 2961.86]
  - - [1856, 256, 1, 3328]
    - [47, 8691.47]
  - - [6784, 448, 1, 256]
    - [4, 10197.3]
  - - [4288, 4288, 1, 1]
    - [76, 218.116]
  - - [256, 2944, 1, 1]
    - [77, 82.0493]
  - - [64, 2368, 1, 3328]
    - [52, 6156.12]
  - - [256, 704, 1, 3328]
    - [34, 5237.29]
  - - [1, 2944, 1, 1]
    - [77, 0.328443]
  - - [1024, 1024, 1, 256]
    - [44, 9104.91]
  - - [4288, 704, 1, 1280]
    - [47, 10947.0]
  - - [3584, 1, 1, 1]
    - [77, 0.604792]
  - - [256, 2944, 1, 32]
    - [62, 1892.88]
  - - [6784, 4288, 1, 3328]
    - [44, 9841.59]
  - - [5056, 2944, 1, 3328]
    - [47, 9957.5]
  - - [704, 1024, 1, 1280]
    - [47, 9166.06]
  - - [256, 3584, 1, 1280]
    - [41, 9111.51]
  - - [2368, 1856, 1, 3328]
    - [41, 10815.2]
  - - [1856, 4288, 1, 1280]
    - [2, 11085.8]
  - - [1, 1024, 1, 256]
    - [80, 8.73784]
  - - [2944, 1024, 1, 3328]
    - [47, 10276.0]
  - - [2944, 256, 1, 32]
    - [59, 1892.88]
  - - [128, 1, 1, 3328]
    - [87, 1.63835]
  - - [5888, 5056, 1, 32]
    - [53, 4252.68]
  - - [4288, 1408, 1, 1]
    - [72, 183.567]
  - - [3584, 448, 1, 32]
    - [59, 2468.36]
  - - [3584, 448, 1, 1280]
    - [47, 8835.83]
  - - [2944, 6784, 1, 3328]
    - [45, 9742.75]
  - - [1856, 2368, 1, 1280]
    - [2, 11396.1]
  - - [6784, 1024, 1, 1280]
    - [41, 11053.1]
  - - [6784, 3584, 1, 1280]
    - [41, 10375.9]
  - - [1, 5056, 1, 3328]
    - [87, 51.7188]
  - - [4288, 64, 1, 1]
    - [83, 37.4217]
  - - [128, 2368, 1, 32]
    - [59, 935.281]
  - - [128, 1408, 1, 3328]
    - [24, 6753.01]
  - - [2944, 32, 1, 3328]
    - [64, 1480.39]
  - - [704, 1856, 1, 256]
    - [41, 9196.64]
  - - [2944, 2944, 1, 1]
    - [76, 197.308]
  - - [1408, 4288, 1, 256]
    - [44, 10683.6]
  - - [5888, 5056, 1, 256]
    - [44, 11025.7]
  - - [256, 5056, 1, 3328]
    - [47, 10530.6]
  - - [2368, 64, 1, 1280]
    - [52, 5643.82]
  - - [1856, 448, 1, 32]
    - [59, 1870.75]
  - - [1408, 448, 1, 256]
    - [41, 7031.91]
  - - [32, 128, 1, 256]
    - [64, 37.7471]
  - - [448, 1024, 1, 1]
    - [73, 58.4249]
  - - [448, 6784, 1, 1]
    - [76, 149.194]
  - - [704, 2944, 1, 256]
    - [14, 10031.7]
  - - [1408, 1408, 1, 256]
    - [42, 9649.5]
  - - [448, 6784, 1, 32]
    - [53, 3163.65]
  - - [1, 64, 1, 1280]
    - [87, 0.726122]
  - - [2944, 2368, 1, 1]
    - [72, 186.728]
  - - [4288, 448, 1, 32]
    - [59, 2668.38]
  - - [4288, 448, 1, 1280]
    - [44, 10166.7]
  - - [2944, 704, 1, 32]
    - [59, 2869.61]
  - - [1024, 704, 1, 256]
    - [41, 7909.03]
  - - [448, 4288, 1, 1]
    - [72, 130.976]
  - - [3584, 5056, 1, 1]
    - [72, 219.786]
  - - [2368, 2368, 1, 1]
    - [76, 179.806]
  - - [64, 5888, 1, 1]
    - [77, 49.3882]
  - - [1408, 3584, 1, 1280]
    - [40, 11220.8]
  - - [6784, 448, 1, 1280]
    - [41, 11053.7]
  - - [3584, 5056, 1, 3328]
    - [42, 9985.05]
  - - [2368, 2368, 1, 32]
    - [53, 3557.02]
  - - [64, 5888, 1, 32]
    - [64, 1122.67]
  - - [1856, 448, 1, 256]
    - [14, 7349.16]
  - - [3584, 2368, 1, 1280]
    - [2, 10982.5]
  - - [128, 1024, 1, 256]
    - [24, 4233.46]
  - - [3584, 64, 1, 3328]
    - [25, 7403.06]
  - - [5888, 2944, 1, 32]
    - [53, 4082.96]
  - - [2944, 1, 1, 1280]
    - [87, 34.3953]
  - - [1856, 2944, 1, 32]
    - [59, 3486.58]
  - - [5056, 1408, 1, 1]
    - [76, 189.175]
  - - [5888, 1408, 1, 3328]
    - [42, 10287.4]
  - - [448, 4288, 1, 256]
    - [14, 9285.04]
  - - [6784, 1024, 1, 1]
    - [72, 186.07]
  - - [256, 448, 1, 1]
    - [73, 10.9029]
  - - [128, 5888, 1, 3328]
    - [47, 9883.13]
  - - [6784, 1024, 1, 32]
    - [53, 3615.57]
  - - [256, 448, 1, 32]
    - [62, 273.718]
  - - [6784, 3584, 1, 1]
    - [72, 225.431]
  - - [2944, 2368, 1, 32]
    - [53, 3619.65]
  - - [3584, 6784, 1, 3328]
    - [42, 9896.43]
  - - [448, 128, 1, 1280]
    - [36, 3020.9]
  - - [64, 3584, 1, 32]
    - [64, 799.089]
  - - [64, 3584, 1, 1280]
    - [28, 6763.6]
  - - [6784, 1408, 1, 256]
    - [41, 10955.9]
  - - [5056, 1024, 1, 32]
    - [53, 3478.3]
  - - [1024, 5056, 1, 1280]
    - [41, 11546.4]
  - - [4288, 3584, 1, 256]
    - [44, 11204.8]
  - - [1408, 1024, 1, 3328]
    - [47, 9759.65]
  - - [2368, 256, 1, 3328]
    - [47, 7972.73]
  - - [448, 6784, 1, 1280]
    - [41, 11060.7]
  - - [1856, 5888, 1, 1]
    - [76, 207.489]
  - - [256, 5888, 1, 32]
    - [61, 2523.78]
  - - [3584, 1, 1, 3328]
    - [87, 46.0839]
  - - [4288, 32, 1, 256]
    - [67, 1234.9]
  - - [256, 64, 1, 1]
    - [73, 1.54675]
  - - [4288, 5056, 1, 32]
    - [53, 4181.04]
  - - [4288, 5056, 1, 3328]
    - [4, 9848.48]
  - - [1856, 5888, 1, 32]
    - [53, 3993.9]
  - - [1856, 5888, 1, 1280]
    - [40, 10962.1]
  - - [256, 256, 1, 1280]
    - [33, 3452.53]
  - - [704, 2368, 1, 1280]
    - [41, 10023.0]
  - - [5056, 32, 1, 1280]
    - [67, 1778.42]
  - - [4288, 2368, 1, 1280]
    - [2, 10869.5]
  - - [2944, 5056, 1, 256]
    - [40, 11241.4]
  - - [32, 1856, 1, 256]
    - [64, 553.238]
  - - [64, 5888, 1, 1280]
    - [51, 8019.03]
  - - [1, 1856, 1, 1280]
    - [87, 21.9963]
  - - [2944, 4288, 1, 1]
    - [76, 209.101]
  - - [5056, 5888, 1, 32]
    - [53, 4285.27]
  - - [704, 4288, 1, 1]
    - [76, 148.733]
  - - [704, 1, 1, 3328]
    - [87, 8.97002]
  - - [448, 256, 1, 1280]
    - [24, 5215.13]
  - - [5888, 6784, 1, 1]
    - [76, 232.527]
  - - [2368, 5056, 1, 3328]
    - [41, 10089.1]
  - - [704, 704, 1, 1280]
    - [47, 8676.82]
  - - [128, 32, 1, 3328]
    - [64, 63.7848]
  - - [1024, 6784, 1, 32]
    - [53, 3641.9]
  - - [2368, 1408, 1, 256]
    - [41, 10297.1]
  - - [3584, 2944, 1, 3328]
    - [41, 9918.89]
  - - [128, 1856, 1, 256]
    - [25, 5547.26]
  - - [32, 32, 1, 1280]
    - [64, 14.7451]
  - - [1408, 5888, 1, 1]
    - [72, 199.138]
  - - [1, 3584, 1, 256]
    - [80, 29.3503]
  - - [704, 4288, 1, 32]
    - [53, 3142.33]
  - - [1408, 5888, 1, 32]
    - [53, 3880.04]
  - - [5888, 32, 1, 3328]
    - [67, 2159.96]
  - - [6784, 2368, 1, 1]
    - [72, 214.292]
  - - [1856, 1, 1, 3328]
    - [87, 23.7832]
  - - [5056, 1408, 1, 256]
    - [40, 10866.6]
  - - [1, 1, 1, 256]
    - [84, 0.0088612]
  - - [2944, 1408, 1, 256]
    - [44, 10730.5]
  - - [4288, 1, 1, 1]
    - [80, 0.723591]
  - - [2368, 2368, 1, 256]
    - [40, 10765.9]
  - - [1, 448, 1, 256]
    - [80, 3.71279]
  - - [1856, 704, 1, 1]
    - [77, 110.245]
  - - [3584, 32, 1, 3328]
    - [64, 1847.45]
  - - [128, 3584, 1, 1]
    - [80, 58.4249]
  - - [1856, 1, 1, 256]
    - [80, 15.9161]
  - - [32, 5888, 1, 32]
    - [59, 611.958]
  - - [1024, 5888, 1, 1]
    - [72, 181.68]
  - - [6784, 32, 1, 3328]
    - [67, 2477.27]
  - - [2368, 704, 1, 1]
    - [73, 120.995]
  - - [1408, 32, 1, 256]
    - [64, 418.57]
  - - [448, 2368, 1, 1]
    - [73, 95.4744]
  - - [1856, 3584, 1, 256]
    - [40, 10936.4]
  - - [2944, 64, 1, 256]
    - [51, 5209.19]
  - - [2368, 704, 1, 32]
    - [59, 2553.74]
  - - [256, 5888, 1, 1280]
    - [47, 10430.9]
  - - [448, 2368, 1, 32]
    - [62, 2045.9]
  - - [448, 2368, 1, 3328]
    - [2, 8749.96]
  - - [64, 1408, 1, 256]
    - [23, 3083.22]
  - - [5056, 32, 1, 32]
    - [67, 554.706]
  - - [1024, 704, 1, 3328]
    - [47, 9461.72]
  - - [32, 5888, 1, 3328]
    - [67, 2147.9]
  - - [256, 64, 1, 3328]
    - [31, 964.711]
  - - [32, 1408, 1, 1280]
    - [64, 645.021]
  - - [64, 32, 1, 256]
    - [64, 18.6255]
  - - [1856, 1024, 1, 3328]
    - [47, 10304.7]
  - - [2368, 1, 1, 1]
    - [73, 0.290623]
  - - [5056, 2368, 1, 3328]
    - [47, 10053.0]
  - - [128, 1, 1, 1280]
    - [80, 1.50871]
  - - [704, 4288, 1, 1280]
    - [2, 10910.4]
  - - [704, 256, 1, 256]
    - [27, 3967.1]
- null
