library/src/blas3/Tensile/Logic/asm_full/vega20_Cijk_Alik_Bljk_HB.yaml
- {MinimumRequiredVersion: 4.3.0}
- vega20
- gfx906
- [Device 66a0, Device 66a7]
    SolutionIndex: 0
    SolutionNameMin: Cijk_Alik_Bljk_HB_MT256x064x32_GRVW08_NLCA01_NLCB01_PBC0_TT08_08_USFGRO00_VW08_WG32_08_01
    SolutionIndex: 1
    SolutionNameMin: Cijk_Alik_Bljk_HB_MT128x032x32_GRVW04_NLCA01_NLCB01_PBC0_TT04_04_USFGRO00_VW04_WG32_08_01
    SolutionIndex: 2
    SolutionNameMin: Cijk_Alik_Bljk_HB_MT016x016x32_GRVW02_NLCA01_NLCB01_PBC1_TT02_02_USFGRO01_VW02_WG08_08_01
    SolutionIndex: 3
    SolutionNameMin: Cijk_Alik_Bljk_HB_MT128x064x32_GRVW08_NLCA01_NLCB01_PBC0_TT08_08_USFGRO00_VW08_WG16_08_01
    SolutionIndex: 4
    SolutionNameMin: Cijk_Alik_Bljk_HB_MT032x032x32_GRVW04_NLCA01_NLCB01_PBC0_TT04_04_USFGRO00_VW04_WG08_08_01
    SolutionIndex: 5
    SolutionNameMin: Cijk_Alik_Bljk_HB_MT032x016x32_GRVW02_NLCA01_NLCB01_PBC1_TT02_02_USFGRO01_VW02_WG16_08_01
    SolutionIndex: 6
    SolutionNameMin: Cijk_Alik_Bljk_HB_MT032x032x16_GRVW04_NLCA01_NLCB01_PBC0_TT04_04_USFGRO00_VW04_WG08_08_01
    SolutionIndex: 7
    SolutionNameMin: Cijk_Alik_Bljk_HB_MT048x032x24_GRVW02_NLCA03_NLCB03_PBC1_TT06_04_USFGRO01_VW02_WG08_08_01
    SolutionIndex: 8
    SolutionNameMin: Cijk_Alik_Bljk_HB_MT032x032x24_GRVW04_NLCA03_NLCB03_PBC0_TT04_04_USFGRO00_VW04_WG08_08_01
    SolutionIndex: 9
    SolutionNameMin: Cijk_Alik_Bljk_HB_MT016x016x16_GRVW02_NLCA01_NLCB01_PBC0_TT02_02_USFGRO00_VW02_WG08_08_01
    SolutionIndex: 10
    SolutionNameMin: Cijk_Alik_Bljk_HB_MT032x016x24_GRVW02_NLCA03_NLCB03_PBC1_TT04_02_USFGRO01_VW02_WG08_08_01
    SolutionIndex: 11
    SolutionNameMin: Cijk_Alik_Bljk_HB_MT032x016x24_GRVW02_NLCA03_NLCB03_PBC1_TT04_02_USFGRO01_VW02_WG08_08_01
    SolutionIndex: 12
    SolutionNameMin: Cijk_Alik_Bljk_HB_MT064x032x32_GRVW04_NLCA01_NLCB01_PBC0_TT08_04_USFGRO00_VW04_WG08_08_01
    SolutionIndex: 13
    SolutionNameMin: Cijk_Alik_Bljk_HB_MT064x032x32_GRVW04_NLCA01_NLCB01_PBC0_TT04_04_USFGRO00_VW04_WG16_08_01
    SolutionIndex: 14
    SolutionNameMin: Cijk_Alik_Bljk_HB_MT016x016x24_GRVW02_NLCA03_NLCB03_PBC1_TT02_02_USFGRO01_VW02_WG08_08_01
    SolutionIndex: 15
    SolutionNameMin: Cijk_Alik_Bljk_HB_MT016x016x24_GRVW02_NLCA03_NLCB03_PBC1_TT02_02_USFGRO01_VW02_WG08_08_01
    SolutionIndex: 16
    SolutionNameMin: Cijk_Alik_Bljk_HB_MT032x032x16_GRVW04_NLCA01_NLCB01_PBC0_TT04_04_USFGRO00_VW04_WG08_08_01
    SolutionIndex: 17
    SolutionNameMin: Cijk_Alik_Bljk_HB_MT064x128x08_GRVW04_NLCA01_NLCB01_PBC0_TT04_08_USFGRO00_VW04_WG16_16_01
    SolutionIndex: 18
    SolutionNameMin: Cijk_Alik_Bljk_HB_MT064x128x32_GRVW04_NLCA01_NLCB01_PBC0_TT04_08_USFGRO00_VW04_WG16_16_01
    SolutionIndex: 19
    SolutionNameMin: Cijk_Alik_Bljk_HB_MT064x064x32_GRVW04_NLCA01_NLCB01_PBC0_TT04_04_USFGRO00_VW04_WG16_16_01
    SolutionIndex: 20
    SolutionNameMin: Cijk_Alik_Bljk_HB_MT128x128x32_GRVW08_NLCA01_NLCB01_PBC0_TT08_08_USFGRO00_VW08_WG16_16_01
    SolutionIndex: 21
    SolutionNameMin: Cijk_Alik_Bljk_HB_MT064x128x16_GRVW04_NLCA01_NLCB01_PBC0_TT04_08_USFGRO00_VW04_WG16_16_01
    SolutionIndex: 22
    SolutionNameMin: Cijk_Alik_Bljk_HB_MT128x128x64_GRVW08_NLCA01_NLCB01_PBC0_TT08_08_USFGRO00_VW08_WG16_16_01
    SolutionIndex: 23
    SolutionNameMin: Cijk_Alik_Bljk_HB_MT128x064x16_GRVW04_NLCA01_NLCB01_PBC0_TT08_04_USFGRO00_VW04_WG16_16_01
    SolutionIndex: 24
    SolutionNameMin: Cijk_Alik_Bljk_HB_MT128x064x08_GRVW04_NLCA01_NLCB01_PBC0_TT08_04_USFGRO00_VW04_WG16_16_01
    SolutionIndex: 25
    SolutionNameMin: Cijk_Alik_Bljk_HB_MT064x064x16_GRVW04_NLCA01_NLCB01_PBC0_TT04_04_USFGRO00_VW04_WG16_16_01
    SolutionIndex: 26
    SolutionNameMin: Cijk_Alik_Bljk_HB_MT128x128x08_GRVW08_NLCA01_NLCB01_PBC0_TT08_08_USFGRO00_VW08_WG16_16_01
    SolutionIndex: 27
    SolutionNameMin: Cijk_Alik_Bljk_HB_MT128x128x16_GRVW08_NLCA01_NLCB01_PBC0_TT08_08_USFGRO00_VW08_WG16_16_01
- - - [4096, 7000, 1, 4096]
    - [20, 14692.5]
  - - [7680, 12000, 1, 2560]
    - [27, 18507.2]
  - - [5124, 9124, 1, 1760]
    - [26, 17892.2]
  - - [1760, 32, 1, 1760]
    - [15, 2320.27]
  - - [512, 24000, 1, 1536]
    - [27, 15959.3]
  - - [3072, 24000, 1, 1024]
    - [27, 16714.6]
  - - [2048, 400, 1, 512]
    - [27, 7426.11]
  - - [2560, 7000, 1, 2560]
    - [27, 17016.8]
  - - [3072, 16, 1, 1024]
    - [2, 1490.84]
  - - [512, 48000, 1, 2816]
    - [27, 18174.7]
  - - [512, 48000, 1, 2048]
    - [20, 13403.0]
  - - [1760, 64, 1, 1760]
    - [15, 3896.31]
  - - [35, 8457, 1, 4096]
    - [7, 0.0]
  - - [2048, 1600, 1, 2048]
    - [19, 7893.56]
  - - [512, 48000, 1, 1536]
    - [27, 17265.6]
  - - [2560, 32, 1, 2560]
    - [15, 2739.19]
  - - [8448, 5984, 1, 2816]
    - [27, 18464.8]
  - - [4096, 3200, 1, 1024]
    - [20, 13714.5]
  - - [1024, 24000, 1, 2560]
    - [27, 17614.2]
  - - [1760, 6400, 1, 1760]
    - [26, 17849.5]
  - - [1024, 700, 1, 512]
    - [19, 7112.37]
  - - [4608, 32, 1, 1536]
    - [8, 3739.91]
  - - [3072, 64, 1, 1024]
    - [1, 3400.73]
  - - [16384, 3200, 1, 4096]
    - [20, 15087.6]
  - - [2560, 16, 1, 2560]
    - [14, 1742.96]
  - - [1024, 48000, 1, 2560]
    - [27, 18268.3]
  - - [35, 8457, 1, 2560]
    - [7, 0.0]
  - - [8448, 48000, 1, 2816]
    - [27, 18909.2]
  - - [2048, 32, 1, 2048]
    - [14, 1939.53]
  - - [2560, 3200, 1, 2560]
    - [27, 16374.6]
  - - [16384, 800, 1, 4096]
    - [20, 12513.8]
  - - [4608, 24000, 1, 1536]
    - [27, 18396.8]
  - - [7680, 48000, 1, 2560]
    - [27, 18845.7]
  - - [3072, 48000, 1, 1024]
    - [27, 17843.6]
  - - [1760, 16, 1, 1760]
    - [15, 1207.63]
  - - [8192, 3200, 1, 2048]
    - [20, 13854.1]
  - - [512, 24000, 1, 2816]
    - [27, 17854.0]
  - - [4096, 400, 1, 1024]
    - [20, 9416.81]
  - - [6144, 48000, 1, 2560]
    - [27, 18710.2]
  - - [4608, 48000, 1, 1536]
    - [27, 18690.2]
  - - [35, 8457, 1, 2048]
    - [7, 0.0]
  - - [4096, 128, 1, 4096]
    - [3, 4181.83]
  - - [2048, 800, 1, 512]
    - [20, 9763.16]
  - - [4608, 5984, 1, 1536]
    - [27, 17182.8]
  - - [2560, 128, 1, 2560]
    - [16, 5631.37]
  - - [6144, 5984, 1, 2048]
    - [20, 14195.5]
  - - [35, 8457, 1, 1760]
    - [7, 0.0]
  - - [7680, 24000, 1, 2560]
    - [27, 18711.5]
  - - [6144, 48000, 1, 2048]
    - [27, 16388.2]
  - - [5124, 9124, 1, 2560]
    - [27, 17565.1]
  - - [2048, 3200, 1, 2048]
    - [18, 9013.1]
  - - [2048, 16, 1, 2048]
    - [14, 1034.34]
  - - [1024, 24000, 1, 1536]
    - [27, 17230.3]
  - - [7680, 16, 1, 2560]
    - [10, 3024.69]
  - - [2560, 6400, 1, 2560]
    - [27, 17293.3]
  - - [2048, 128, 1, 2048]
    - [1, 3068.5]
  - - [512, 16, 1, 500000]
    - [2, 376.144]
  - - [1024, 8, 1, 500000]
    - [2, 376.122]
  - - [512, 24000, 1, 2560]
    - [27, 16855.7]
  - - [1024, 24000, 1, 2816]
    - [27, 18159.1]
  - - [7680, 5984, 1, 2560]
    - [27, 18071.5]
  - - [2048, 1600, 1, 512]
    - [20, 10623.7]
  - - [2048, 7000, 1, 2048]
    - [20, 12236.1]
  - - [1760, 800, 1, 1760]
    - [24, 12062.2]
  - - [5124, 9124, 1, 4096]
    - [20, 14653.2]
  - - [4096, 64, 1, 4096]
    - [4, 3436.15]
  - - [7680, 32, 1, 2560]
    - [1, 5153.47]
  - - [2560, 64, 1, 2560]
    - [16, 4365.36]
  - - [3072, 128, 1, 1024]
    - [1, 4734.81]
  - - [7680, 64, 1, 2560]
    - [12, 6658.95]
  - - [1760, 128, 1, 1760]
    - [8, 6103.55]
  - - [2560, 1600, 1, 2560]
    - [27, 12851.3]
  - - [2048, 3200, 1, 512]
    - [20, 12760.1]
  - - [2560, 800, 1, 2560]
    - [27, 10502.4]
  - - [3072, 32, 1, 1024]
    - [2, 2238.93]
  - - [6144, 32, 1, 2560]
    - [6, 4568.9]
  - - [4608, 12000, 1, 1536]
    - [27, 18234.5]
  - - [4096, 32, 1, 4096]
    - [13, 2290.37]
  - - [6144, 24000, 1, 2048]
    - [27, 15633.1]
  - - [8192, 800, 1, 2048]
    - [20, 10749.7]
  - - [4096, 1600, 1, 1024]
    - [20, 11653.9]
  - - [5124, 9124, 1, 2048]
    - [20, 14084.4]
  - - [8448, 24000, 1, 2816]
    - [27, 18834.1]
  - - [1024, 48000, 1, 1536]
    - [27, 18067.9]
  - - [7680, 128, 1, 2560]
    - [0, 10747.1]
  - - [8192, 1600, 1, 2048]
    - [20, 11701.1]
  - - [4096, 800, 1, 1024]
    - [20, 10104.2]
  - - [1024, 16, 1, 500000]
    - [2, 752.261]
  - - [2048, 800, 1, 2048]
    - [19, 6743.16]
  - - [1760, 3200, 1, 1760]
    - [26, 15820.0]
  - - [512, 48000, 1, 2560]
    - [27, 17649.0]
  - - [8448, 16, 1, 2816]
    - [10, 3315.58]
  - - [2048, 64, 1, 2048]
    - [4, 2388.18]
  - - [512, 24000, 1, 2048]
    - [20, 11910.1]
  - - [16384, 1600, 1, 4096]
    - [20, 13919.2]
  - - [4608, 16, 1, 1536]
    - [14, 2479.09]
  - - [1024, 24000, 1, 2048]
    - [20, 13316.2]
  - - [8192, 400, 1, 2048]
    - [22, 7457.1]
  - - [2048, 6400, 1, 2048]
    - [20, 11717.8]
  - - [6144, 12000, 1, 2048]
    - [20, 14989.9]
  - - [512, 8, 1, 500000]
    - [2, 188.054]
  - - [1760, 7000, 1, 1760]
    - [26, 16637.2]
  - - [1024, 48000, 1, 2816]
    - [27, 18689.1]
  - - [6144, 16, 1, 2560]
    - [11, 2803.65]
  - - [8448, 32, 1, 2816]
    - [6, 5202.68]
  - - [4096, 16, 1, 4096]
    - [5, 1301.55]
  - - [6144, 24000, 1, 2560]
    - [27, 18539.7]
  - - [1024, 1024, 1, 1024]
    - [20, 8755.13]
  - - [8448, 12000, 1, 2816]
    - [27, 18787.3]
  - - [16384, 400, 1, 4096]
    - [20, 9682.84]
  - - [1760, 1600, 1, 1760]
    - [26, 14669.9]
  - - [1024, 48000, 1, 2048]
    - [20, 14609.5]
- - - -1
    - - - 128
        - - - 4
            - - [-1, 9]
          - - 64
            - - [5888, 9]
              - [-1, 17]
          - - 128
            - - [2368, 9]
              - [-1, 17]
          - - 448
            - - [448, 9]
              - [-1, 17]
          - - 2368
            - - [128, 9]
              - [-1, 17]
          - - 5888
            - - [64, 9]
              - [-1, 17]
          - - -1
            - - [4, 9]
              - [-1, 17]
      - - 256
        - - - 4
            - - [4, 14]
              - [64, 2]
              - [128, 14]
              - [704, 2]
              - [1024, 14]
              - [1408, 2]
              - [-1, 14]
          - - 64
            - - [128, 14]
              - [256, 2]
              - [1856, 14]
              - [2368, 6]
              - [2944, 16]
              - [4288, 6]
              - [5056, 25]
              - [5888, 6]
              - [-1, 25]
          - - 128
            - - [4, 2]
              - [64, 14]
              - [128, 2]
              - [1024, 14]
              - [1408, 11]
              - [2368, 6]
              - [5888, 25]
              - [-1, 23]
          - - 256
            - - [4, 14]
              - [128, 2]
              - [448, 14]
              - [1024, 16]
              - [2944, 25]
              - [3584, 23]
              - [4288, 25]
              - [5888, 21]
              - [-1, 27]
          - - 448
            - - [4, 14]
              - [64, 15]
              - [128, 14]
              - [256, 15]
              - [1408, 25]
              - [1856, 21]
              - [2368, 23]
              - [2944, 21]
              - [3584, 27]
              - [5056, 21]
              - [5888, 27]
              - [-1, 21]
          - - 704
            - - [4, 2]
              - [128, 15]
              - [256, 16]
              - [1024, 25]
              - [1856, 21]
              - [2368, 27]
              - [2944, 21]
              - [3584, 27]
              - [4288, 21]
              - [5056, 27]
              - [5888, 21]
              - [-1, 27]
          - - 1024
            - - [64, 14]
              - [128, 15]
              - [256, 16]
              - [704, 25]
              - [1408, 23]
              - [1856, 27]
              - [2368, 23]
              - [-1, 27]
          - - 1408
            - - [4, 14]
              - [128, 15]
              - [448, 25]
              - [704, 23]
              - [1024, 21]
              - [-1, 27]
          - - 1856
            - - [4, 2]
              - [64, 15]
              - [128, 16]
              - [256, 25]
              - [704, 21]
              - [-1, 27]
          - - 2368
            - - [4, 14]
              - [64, 16]
              - [256, 25]
              - [448, 23]
              - [704, 27]
              - [1024, 21]
              - [-1, 27]
          - - 2944
            - - [4, 2]
              - [64, 6]
              - [256, 25]
              - [704, 23]
              - [-1, 27]
          - - 3584
            - - [4, 2]
              - [64, 16]
              - [128, 25]
              - [256, 21]
              - [448, 27]
              - [704, 23]
              - [-1, 27]
          - - 4288
            - - [4, 14]
              - [128, 25]
              - [256, 21]
              - [704, 23]
              - [-1, 27]
          - - 5056
            - - [4, 14]
              - [128, 25]
              - [448, 21]
              - [-1, 27]
          - - 5888
            - - [4, 14]
              - [128, 25]
              - [256, 23]
              - [448, 27]
              - [704, 23]
              - [-1, 27]
          - - -1
            - - [4, 14]
              - [64, 25]
              - [128, 23]
              - [256, 27]
              - [448, 23]
              - [-1, 27]
      - - 1280
        - - - 4
            - - [-1, 14]
          - - 64
            - - [256, 14]
              - [704, 15]
              - [1408, 14]
              - [1856, 15]
              - [2944, 16]
              - [5056, 6]
              - [5888, 16]
              - [-1, 25]
          - - 128
            - - [128, 14]
              - [256, 15]
              - [448, 14]
              - [704, 15]
              - [1024, 14]
              - [1856, 6]
              - [2368, 8]
              - [5888, 25]
              - [-1, 23]
          - - 256
            - - [448, 14]
              - [1024, 16]
              - [2944, 25]
              - [3584, 23]
              - [5056, 25]
              - [5888, 23]
              - [-1, 27]
          - - 448
            - - [4, 14]
              - [256, 15]
              - [1408, 25]
              - [1856, 21]
              - [2368, 25]
              - [2944, 23]
              - [3584, 27]
              - [4288, 21]
              - [5056, 23]
              - [5888, 27]
              - [-1, 21]
          - - 704
            - - [64, 14]
              - [128, 15]
              - [448, 16]
              - [1024, 25]
              - [1408, 21]
              - [1856, 25]
              - [2368, 27]
              - [4288, 21]
              - [5056, 27]
              - [5888, 21]
              - [-1, 27]
          - - 1024
            - - [64, 14]
              - [128, 15]
              - [256, 16]
              - [704, 25]
              - [1024, 21]
              - [1408, 23]
              - [1856, 27]
              - [2368, 23]
              - [-1, 27]
          - - 1408
            - - [4, 14]
              - [64, 15]
              - [128, 16]
              - [448, 25]
              - [704, 23]
              - [1024, 21]
              - [1408, 27]
              - [1856, 23]
              - [-1, 27]
          - - 1856
            - - [4, 14]
              - [64, 15]
              - [128, 16]
              - [256, 25]
              - [448, 27]
              - [704, 25]
              - [1024, 27]
              - [1408, 21]
              - [-1, 27]
          - - 2368
            - - [4, 14]
              - [64, 6]
              - [448, 25]
              - [704, 27]
              - [1024, 21]
              - [-1, 27]
          - - 2944
            - - [4, 14]
              - [64, 6]
              - [256, 25]
              - [448, 21]
              - [704, 23]
              - [-1, 27]
          - - 3584
            - - [4, 14]
              - [64, 16]
              - [128, 25]
              - [-1, 27]
          - - 4288
            - - [4, 14]
              - [64, 6]
              - [256, 25]
              - [704, 23]
              - [-1, 27]
          - - 5056
            - - [4, 14]
              - [64, 16]
              - [256, 25]
              - [448, 21]
              - [-1, 27]
          - - 5888
            - - [4, 14]
              - [128, 25]
              - [256, 21]
              - [448, 27]
              - [704, 23]
              - [-1, 27]
          - - -1
            - - [4, 14]
              - [64, 25]
              - [128, 21]
              - [256, 27]
              - [448, 23]
              - [-1, 27]
      - - -1
        - - - 4
            - - [5056, 14]
              - [-1, 8]
          - - 64
            - - [256, 14]
              - [448, 15]
              - [1408, 14]
              - [1856, 15]
              - [4288, 6]
              - [-1, 25]
          - - 128
            - - [448, 14]
              - [1024, 15]
              - [1408, 16]
              - [1856, 6]
              - [2368, 8]
              - [5888, 25]
              - [-1, 27]
          - - 256
            - - [256, 14]
              - [448, 15]
              - [1024, 16]
              - [2944, 25]
              - [3584, 27]
              - [5056, 25]
              - [5888, 23]
              - [-1, 27]
          - - 448
            - - [4, 14]
              - [256, 15]
              - [448, 16]
              - [1408, 25]
              - [1856, 27]
              - [2368, 25]
              - [2944, 23]
              - [3584, 27]
              - [4288, 21]
              - [5056, 23]
              - [5888, 27]
              - [-1, 21]
          - - 704
            - - [64, 14]
              - [128, 15]
              - [256, 16]
              - [1024, 25]
              - [1408, 21]
              - [1856, 25]
              - [2368, 27]
              - [4288, 21]
              - [5056, 27]
              - [5888, 21]
              - [-1, 27]
          - - 1024
            - - [4, 14]
              - [128, 15]
              - [256, 16]
              - [704, 25]
              - [1024, 27]
              - [1408, 21]
              - [1856, 27]
              - [2368, 21]
              - [-1, 27]
          - - 1408
            - - [4, 14]
              - [64, 15]
              - [128, 8]
              - [448, 25]
              - [704, 23]
              - [1024, 21]
              - [1408, 27]
              - [1856, 23]
              - [-1, 27]
          - - 1856
            - - [4, 14]
              - [64, 15]
              - [128, 16]
              - [256, 25]
              - [448, 27]
              - [704, 25]
              - [1024, 27]
              - [1408, 21]
              - [-1, 27]
          - - 2368
            - - [4, 14]
              - [64, 8]
              - [128, 6]
              - [448, 25]
              - [704, 27]
              - [1024, 23]
              - [-1, 27]
          - - 2944
            - - [4, 14]
              - [64, 16]
              - [256, 25]
              - [704, 23]
              - [-1, 27]
          - - 3584
            - - [4, 14]
              - [64, 6]
              - [128, 25]
              - [448, 27]
              - [704, 23]
              - [-1, 27]
          - - 4288
            - - [4, 14]
              - [64, 6]
              - [256, 25]
              - [704, 23]
              - [-1, 27]
          - - 5056
            - - [4, 14]
              - [64, 6]
              - [256, 25]
              - [448, 21]
              - [-1, 27]
          - - 5888
            - - [4, 8]
              - [128, 25]
              - [256, 21]
              - [448, 27]
              - [704, 23]
              - [-1, 27]
          - - -1
            - - [4, 8]
              - [64, 25]
              - [256, 27]
              - [448, 23]
              - [-1, 27]
