library/src/blas3/Tensile/Logic/asm_full/vega10_Cijk_Alik_Bljk_HBH.yaml
- {MinimumRequiredVersion: 4.5.0}
- vega10
- gfx900
- [Device 6863, Device 6862, Device 687f, Device 6860, Device 6861, 'Vega 10 XTX [Radeon
    SolutionIndex: 0
    SolutionNameMin: Cijk_Alik_Bljk_HBH_MT016x016x16_PGR1_PLR1_TT02_02
    SolutionIndex: 1
    SolutionNameMin: Cijk_Alik_Bljk_HBH_MT032x032x16_PGR1_PLR1_TT04_04
    SolutionIndex: 2
    SolutionNameMin: Cijk_Alik_Bljk_HBH_MT032x016x16_PGR1_PLR1_TT02_02
    SolutionIndex: 3
    SolutionNameMin: Cijk_Alik_Bljk_HBH_MT016x016x32_PGR1_PLR1_TT02_02
    SolutionIndex: 4
    SolutionNameMin: Cijk_Alik_Bljk_HBH_MT032x032x32_PGR1_PLR1_TT04_04
    SolutionIndex: 5
    SolutionNameMin: Cijk_Alik_Bljk_HBH_MT064x064x32_PGR1_PLR1_TT08_08
    SolutionIndex: 6
    SolutionNameMin: Cijk_Alik_Bljk_HBH_MT032x016x32_PGR1_PLR1_TT02_02
    SolutionIndex: 7
    SolutionNameMin: Cijk_Alik_Bljk_HBH_MT032x032x16_PGR1_PLR1_TT04_04
    SolutionIndex: 8
    SolutionNameMin: Cijk_Alik_Bljk_HBH_MT016x016x24_PGR1_PLR1_TT02_02
    SolutionIndex: 9
    SolutionNameMin: Cijk_Alik_Bljk_HBH_MT016x016x24_PGR1_PLR1_TT02_02
    SolutionIndex: 10
    SolutionNameMin: Cijk_Alik_Bljk_HBH_MT032x032x24_PGR1_PLR1_TT04_04
    SolutionIndex: 11
    SolutionNameMin: Cijk_Alik_Bljk_HBH_MT016x016x32_PGR1_PLR1_TT02_02
    SolutionIndex: 12
    SolutionNameMin: Cijk_Alik_Bljk_HBH_MT032x032x32_PGR1_PLR1_TT04_04
    SolutionIndex: 13
    SolutionNameMin: Cijk_Alik_Bljk_HBH_MT064x064x08_PGR1_PLR1_TT04_04
    SolutionIndex: 14
    SolutionNameMin: Cijk_Alik_Bljk_HBH_MT064x128x08_PGR1_PLR1_TT04_08
    SolutionIndex: 15
    SolutionNameMin: Cijk_Alik_Bljk_HBH_MT128x064x08_PGR1_PLR1_TT08_04
    SolutionIndex: 16
    SolutionNameMin: Cijk_Alik_Bljk_HBH_MT064x064x16_PGR1_PLR1_TT04_04
    SolutionIndex: 17
    SolutionNameMin: Cijk_Alik_Bljk_HBH_MT064x128x16_PGR1_PLR1_TT04_08
    SolutionIndex: 18
    SolutionNameMin: Cijk_Alik_Bljk_HBH_MT128x064x16_PGR1_PLR1_TT08_04
    SolutionIndex: 19
    SolutionNameMin: Cijk_Alik_Bljk_HBH_MT128x128x16_PGR1_PLR1_TT08_08
    SolutionIndex: 20
    SolutionNameMin: Cijk_Alik_Bljk_HBH_MT064x064x32_PGR1_PLR1_TT04_04
    SolutionIndex: 21
    SolutionNameMin: Cijk_Alik_Bljk_HBH_MT128x064x32_PGR1_PLR1_TT08_04
    SolutionIndex: 22
    SolutionNameMin: Cijk_Alik_Bljk_HBH_MT128x128x32_PGR1_PLR1_TT08_08
    SolutionIndex: 23
    SolutionNameMin: Cijk_Alik_Bljk_HBH_MT064x128x08_PGR1_PLR1_TT04_08
    SolutionIndex: 24
    SolutionNameMin: Cijk_Alik_Bljk_HBH_MT064x064x08_PGR1_PLR1_TT04_04
    SolutionIndex: 25
    SolutionNameMin: Cijk_Alik_Bljk_HBH_MT064x128x04_PGR0_PLR1_TT04_08
    SolutionIndex: 26
    SolutionNameMin: Cijk_Alik_Bljk_HBH_MT064x064x04_PGR1_PLR1_TT04_04
- - - [2560, 7000, 1, 2560]
    - [16, 10291.8]
  - - [7680, 12000, 1, 2560]
    - [17, 10133.3]
  - - [5124, 9124, 1, 1760]
    - [15, 10201.7]
  - - [1760, 32, 1, 1760]
    - [8, 2908.93]
  - - [512, 24000, 1, 1536]
    - [16, 11136.6]
  - - [3072, 24000, 1, 1024]
    - [18, 10100.3]
  - - [2048, 400, 1, 512]
    - [19, 7672.18]
  - - [2560, 128, 1, 2560]
    - [7, 5873.53]
  - - [3072, 16, 1, 1024]
    - [3, 1306.64]
  - - [512, 48000, 1, 2816]
    - [17, 10276.1]
  - - [512, 48000, 1, 2048]
    - [18, 9477.48]
  - - [1760, 64, 1, 1760]
    - [8, 4711.68]
  - - [2048, 1600, 1, 2048]
    - [20, 7798.34]
  - - [512, 48000, 1, 1536]
    - [16, 10377.7]
  - - [2560, 32, 1, 2560]
    - [9, 3460.93]
  - - [8448, 5984, 1, 2816]
    - [18, 10191.1]
  - - [4096, 3200, 1, 1024]
    - [18, 10440.0]
  - - [1024, 24000, 1, 2560]
    - [17, 10261.0]
  - - [1760, 6400, 1, 1760]
    - [15, 10928.2]
  - - [5124, 9124, 1, 2048]
    - [17, 9464.3]
  - - [1024, 700, 1, 512]
    - [16, 7108.09]
  - - [4608, 32, 1, 1536]
    - [9, 3885.05]
  - - [3072, 64, 1, 1024]
    - [11, 3401.51]
  - - [16384, 3200, 1, 4096]
    - [22, 9435.63]
  - - [2560, 16, 1, 2560]
    - [8, 1944.4]
  - - [1024, 48000, 1, 2560]
    - [19, 10226.5]
  - - [8448, 48000, 1, 2816]
    - [18, 10143.7]
  - - [2048, 32, 1, 2048]
    - [8, 1833.88]
  - - [2560, 3200, 1, 2560]
    - [18, 10319.1]
  - - [16384, 800, 1, 4096]
    - [22, 8482.62]
  - - [4608, 24000, 1, 1536]
    - [17, 10254.1]
  - - [7680, 48000, 1, 2560]
    - [18, 10165.9]
  - - [3072, 48000, 1, 1024]
    - [17, 10268.8]
  - - [1760, 16, 1, 1760]
    - [8, 1486.8]
  - - [8192, 3200, 1, 2048]
    - [22, 9387.18]
  - - [512, 24000, 1, 2816]
    - [16, 10492.4]
  - - [4096, 400, 1, 1024]
    - [22, 8000.1]
  - - [6144, 48000, 1, 2560]
    - [18, 10155.2]
  - - [4608, 48000, 1, 1536]
    - [18, 10191.4]
  - - [4096, 128, 1, 4096]
    - [12, 4906.89]
  - - [2048, 800, 1, 512]
    - [19, 8375.83]
  - - [4608, 5984, 1, 1536]
    - [17, 10472.9]
  - - [4096, 1600, 1, 1024]
    - [18, 10013.6]
  - - [6144, 5984, 1, 2048]
    - [22, 9418.0]
  - - [7680, 24000, 1, 2560]
    - [18, 10218.0]
  - - [6144, 48000, 1, 2048]
    - [18, 10033.9]
  - - [2048, 3200, 1, 2048]
    - [20, 8345.77]
  - - [5124, 9124, 1, 2560]
    - [16, 9858.99]
  - - [1024, 24000, 1, 1536]
    - [16, 10478.7]
  - - [7680, 16, 1, 2560]
    - [3, 2737.95]
  - - [2560, 6400, 1, 2560]
    - [16, 10349.6]
  - - [2048, 128, 1, 2048]
    - [4, 4030.85]
  - - [512, 16, 1, 500000]
    - [3, 454.667]
  - - [1024, 8, 1, 500000]
    - [3, 454.712]
  - - [512, 24000, 1, 2560]
    - [16, 10649.7]
  - - [1024, 24000, 1, 2816]
    - [18, 10275.5]
  - - [7680, 5984, 1, 2560]
    - [18, 10070.7]
  - - [2048, 1600, 1, 512]
    - [18, 9596.74]
  - - [2048, 7000, 1, 2048]
    - [22, 9006.02]
  - - [1760, 800, 1, 1760]
    - [15, 10006.8]
  - - [4096, 64, 1, 4096]
    - [4, 4146.15]
  - - [7680, 32, 1, 2560]
    - [4, 4949.38]
  - - [2560, 64, 1, 2560]
    - [9, 4663.99]
  - - [3072, 128, 1, 1024]
    - [12, 5462.93]
  - - [7680, 64, 1, 2560]
    - [10, 7182.36]
  - - [1760, 128, 1, 1760]
    - [7, 6252.84]
  - - [2560, 1600, 1, 2560]
    - [16, 10973.0]
  - - [2048, 3200, 1, 512]
    - [18, 10986.3]
  - - [2560, 800, 1, 2560]
    - [16, 8523.12]
  - - [3072, 32, 1, 1024]
    - [3, 2253.56]
  - - [6144, 32, 1, 2560]
    - [10, 4526.65]
  - - [4608, 12000, 1, 1536]
    - [17, 10308.9]
  - - [4096, 32, 1, 4096]
    - [6, 2334.88]
  - - [6144, 24000, 1, 2048]
    - [18, 9870.68]
  - - [8192, 800, 1, 2048]
    - [22, 8094.83]
  - - [5124, 9124, 1, 4096]
    - [19, 9243.08]
  - - [8448, 24000, 1, 2816]
    - [18, 10186.5]
  - - [1024, 48000, 1, 1536]
    - [17, 10278.2]
  - - [7680, 128, 1, 2560]
    - [5, 9351.1]
  - - [8192, 1600, 1, 2048]
    - [22, 8686.88]
  - - [4096, 800, 1, 1024]
    - [20, 8565.93]
  - - [1024, 16, 1, 500000]
    - [3, 909.431]
  - - [2048, 800, 1, 2048]
    - [22, 7859.91]
  - - [1760, 3200, 1, 1760]
    - [14, 11202.3]
  - - [512, 48000, 1, 2560]
    - [18, 10346.2]
  - - [8448, 16, 1, 2816]
    - [2, 3378.27]
  - - [2048, 64, 1, 2048]
    - [0, 2616.41]
  - - [512, 24000, 1, 2048]
    - [18, 9099.62]
  - - [16384, 1600, 1, 4096]
    - [22, 9139.35]
  - - [4608, 16, 1, 1536]
    - [9, 2457.81]
  - - [1024, 24000, 1, 2048]
    - [18, 9351.48]
  - - [8192, 400, 1, 2048]
    - [20, 6948.94]
  - - [2048, 6400, 1, 2048]
    - [22, 8962.98]
  - - [6144, 12000, 1, 2048]
    - [18, 9669.68]
  - - [512, 8, 1, 500000]
    - [3, 227.332]
  - - [1760, 7000, 1, 1760]
    - [15, 10539.4]
  - - [1024, 48000, 1, 2816]
    - [17, 10231.4]
  - - [6144, 16, 1, 2560]
    - [3, 2728.73]
  - - [8448, 32, 1, 2816]
    - [1, 4845.2]
  - - [4096, 7000, 1, 4096]
    - [22, 9435.12]
  - - [4096, 16, 1, 4096]
    - [6, 1592.15]
  - - [6144, 24000, 1, 2560]
    - [17, 10166.1]
  - - [1024, 1024, 1, 1024]
    - [21, 8627.93]
  - - [2048, 16, 1, 2048]
    - [9, 928.206]
  - - [8448, 12000, 1, 2816]
    - [17, 10215.8]
  - - [16384, 400, 1, 4096]
    - [16, 7342.92]
  - - [1760, 1600, 1, 1760]
    - [13, 10914.4]
  - - [1024, 48000, 1, 2048]
    - [18, 9823.68]
- - - -1
    - - - 1
        - - - 32
            - - [256, 26]
              - [448, 25]
              - [-1, 26]
          - - 64
            - - [-1, 26]
          - - 128
            - - [5056, 26]
              - [5888, 25]
              - [-1, 26]
          - - 256
            - - [2368, 26]
              - [2944, 25]
              - [4288, 26]
              - [5056, 25]
              - [5888, 26]
              - [-1, 25]
          - - 448
            - - [1856, 26]
              - [2944, 25]
              - [-1, 26]
          - - 704
            - - [1024, 26]
              - [1408, 25]
              - [1856, 26]
              - [2368, 25]
              - [-1, 26]
          - - 1024
            - - [704, 26]
              - [1024, 25]
              - [2368, 26]
              - [-1, 25]
          - - 1408
            - - [1024, 26]
              - [-1, 25]
          - - 1856
            - - [-1, 26]
          - - 2368
            - - [256, 26]
              - [448, 25]
              - [-1, 26]
          - - 2944
            - - [128, 26]
              - [256, 25]
              - [704, 26]
              - [-1, 25]
          - - 3584
            - - [64, 25]
              - [704, 26]
              - [-1, 25]
          - - 5056
            - - [128, 26]
              - [256, 25]
              - [-1, 26]
          - - 5888
            - - [64, 26]
              - [128, 25]
              - [704, 26]
              - [-1, 25]
          - - -1
            - - [32, 26]
              - [64, 25]
              - [448, 26]
              - [-1, 25]
      - - 32
        - - - 64
            - - [-1, 24]
          - - 128
            - - [128, 24]
              - [256, 23]
              - [-1, 24]
          - - 256
            - - [-1, 24]
          - - 448
            - - [3584, 24]
              - [-1, 23]
          - - 1024
            - - [2368, 24]
              - [-1, 23]
          - - 1408
            - - [704, 24]
              - [1024, 23]
              - [1856, 24]
              - [-1, 23]
          - - 2368
            - - [704, 24]
              - [-1, 23]
          - - 2944
            - - [1024, 24]
              - [-1, 23]
          - - 3584
            - - [704, 24]
              - [-1, 23]
          - - 5888
            - - [448, 24]
              - [-1, 23]
          - - -1
            - - [704, 24]
              - [-1, 23]
      - - 256
        - - - 1
            - - [-1, 26]
          - - 32
            - - [-1, 24]
          - - 64
            - - [1, 26]
              - [32, 24]
              - [128, 0]
              - [256, 3]
              - [448, 8]
              - [1024, 0]
              - [1408, 8]
              - [1856, 0]
              - [2368, 8]
              - [4288, 1]
              - [5056, 16]
              - [5888, 1]
              - [-1, 16]
          - - 128
            - - [1, 26]
              - [32, 24]
              - [64, 0]
              - [128, 11]
              - [1024, 0]
              - [1408, 1]
              - [1856, 7]
              - [-1, 16]
          - - 256
            - - [1, 26]
              - [32, 24]
              - [448, 0]
              - [1024, 7]
              - [-1, 16]
          - - 448
            - - [1, 26]
              - [32, 24]
              - [128, 0]
              - [256, 9]
              - [448, 7]
              - [-1, 16]
          - - 704
            - - [1, 26]
              - [32, 24]
              - [64, 0]
              - [128, 2]
              - [256, 7]
              - [2368, 16]
              - [2944, 17]
              - [3584, 16]
              - [4288, 17]
              - [-1, 16]
          - - 1024
            - - [1, 26]
              - [32, 24]
              - [128, 0]
              - [704, 16]
              - [1024, 19]
              - [1856, 16]
              - [2368, 18]
              - [-1, 16]
          - - 1408
            - - [1, 26]
              - [32, 24]
              - [64, 2]
              - [128, 1]
              - [1024, 16]
              - [1408, 19]
              - [1856, 18]
              - [-1, 16]
          - - 1856
            - - [1, 26]
              - [32, 24]
              - [64, 9]
              - [128, 7]
              - [704, 16]
              - [1024, 17]
              - [-1, 16]
          - - 2368
            - - [1, 26]
              - [32, 24]
              - [64, 1]
              - [5056, 16]
              - [-1, 17]
          - - 2944
            - - [1, 26]
              - [32, 24]
              - [64, 1]
              - [5888, 16]
              - [-1, 17]
          - - 3584
            - - [1, 26]
              - [32, 24]
              - [64, 1]
              - [128, 16]
              - [256, 19]
              - [704, 16]
              - [1024, 17]
              - [2368, 16]
              - [2944, 18]
              - [5056, 16]
              - [-1, 18]
          - - 4288
            - - [1, 26]
              - [32, 24]
              - [64, 1]
              - [256, 16]
              - [448, 18]
              - [2944, 16]
              - [5056, 17]
              - [5888, 16]
              - [-1, 17]
          - - 5056
            - - [1, 26]
              - [32, 24]
              - [704, 16]
              - [1024, 17]
              - [2368, 16]
              - [2944, 18]
              - [5056, 16]
              - [-1, 17]
          - - 5888
            - - [1, 26]
              - [32, 24]
              - [64, 1]
              - [3584, 16]
              - [4288, 18]
              - [5056, 16]
              - [-1, 17]
          - - -1
            - - [1, 26]
              - [32, 24]
              - [64, 1]
              - [256, 16]
              - [448, 18]
              - [2368, 16]
              - [2944, 17]
              - [3584, 18]
              - [4288, 17]
              - [-1, 16]
      - - 1280
        - - - 1
            - - [-1, 26]
          - - 32
            - - [-1, 24]
          - - 64
            - - [1, 26]
              - [32, 24]
              - [64, 0]
              - [128, 8]
              - [256, 9]
              - [1024, 8]
              - [1408, 9]
              - [2368, 8]
              - [2944, 9]
              - [3584, 1]
              - [4288, 8]
              - [5056, 7]
              - [-1, 1]
          - - 128
            - - [1, 26]
              - [32, 24]
              - [128, 8]
              - [256, 9]
              - [704, 8]
              - [1408, 9]
              - [1856, 10]
              - [2368, 1]
              - [3584, 7]
              - [5888, 16]
              - [-1, 17]
          - - 256
            - - [1, 26]
              - [32, 24]
              - [448, 8]
              - [1408, 7]
              - [2944, 16]
              - [3584, 19]
              - [-1, 16]
          - - 448
            - - [1, 26]
              - [32, 24]
              - [64, 8]
              - [256, 9]
              - [448, 1]
              - [704, 7]
              - [1408, 16]
              - [1856, 19]
              - [2368, 16]
              - [2944, 14]
              - [3584, 16]
              - [4288, 17]
              - [-1, 16]
          - - 704
            - - [1, 26]
              - [32, 24]
              - [128, 9]
              - [256, 7]
              - [448, 10]
              - [1024, 16]
              - [1408, 14]
              - [2368, 16]
              - [3584, 17]
              - [4288, 16]
              - [5056, 17]
              - [-1, 16]
          - - 1024
            - - [1, 26]
              - [32, 24]
              - [128, 8]
              - [256, 10]
              - [704, 16]
              - [1024, 19]
              - [1408, 16]
              - [1856, 19]
              - [4288, 16]
              - [5056, 17]
              - [-1, 16]
          - - 1408
            - - [1, 26]
              - [32, 24]
              - [128, 9]
              - [256, 7]
              - [1024, 16]
              - [1408, 19]
              - [1856, 18]
              - [4288, 16]
              - [5056, 17]
              - [5888, 18]
              - [-1, 16]
          - - 1856
            - - [1, 26]
              - [32, 24]
              - [64, 9]
              - [128, 10]
              - [1024, 16]
              - [1408, 17]
              - [2368, 16]
              - [2944, 18]
              - [5888, 16]
              - [-1, 17]
          - - 2368
            - - [1, 26]
              - [32, 24]
              - [64, 9]
              - [128, 1]
              - [704, 16]
              - [1024, 17]
              - [5056, 16]
              - [-1, 17]
          - - 2944
            - - [1, 26]
              - [32, 24]
              - [64, 9]
              - [128, 1]
              - [256, 16]
              - [448, 14]
              - [704, 16]
              - [1024, 18]
              - [5888, 16]
              - [-1, 15]
          - - 3584
            - - [1, 26]
              - [32, 24]
              - [64, 1]
              - [128, 7]
              - [256, 19]
              - [448, 16]
              - [704, 18]
              - [1024, 16]
              - [1408, 17]
              - [5056, 16]
              - [5888, 18]
              - [-1, 16]
          - - 4288
            - - [1, 26]
              - [32, 24]
              - [64, 9]
              - [256, 16]
              - [704, 18]
              - [1024, 16]
              - [1408, 17]
              - [2368, 16]
              - [2944, 18]
              - [-1, 16]
          - - 5056
            - - [1, 26]
              - [32, 24]
              - [64, 1]
              - [1024, 16]
              - [1408, 18]
              - [2368, 16]
              - [3584, 17]
              - [5056, 16]
              - [5888, 18]
              - [-1, 16]
          - - 5888
            - - [1, 26]
              - [32, 24]
              - [64, 7]
              - [448, 16]
              - [704, 18]
              - [1024, 16]
              - [1408, 18]
              - [1856, 16]
              - [2368, 18]
              - [2944, 17]
              - [5056, 16]
              - [5888, 15]
              - [-1, 17]
          - - -1
            - - [1, 26]
              - [32, 24]
              - [64, 7]
              - [256, 16]
              - [448, 18]
              - [1408, 16]
              - [1856, 14]
              - [2368, 18]
              - [5056, 16]
              - [5888, 18]
              - [-1, 16]
      - - -1
        - - - 1
            - - [-1, 26]
          - - 32
            - - [-1, 24]
          - - 64
            - - [1, 26]
              - [32, 24]
              - [128, 8]
              - [256, 9]
              - [448, 8]
              - [704, 9]
              - [1408, 8]
              - [2944, 9]
              - [3584, 10]
              - [4288, 1]
              - [-1, 10]
          - - 128
            - - [1, 26]
              - [32, 24]
              - [256, 8]
              - [1024, 9]
              - [1408, 8]
              - [1856, 10]
              - [2368, 7]
              - [2944, 1]
              - [3584, 10]
              - [5888, 16]
              - [-1, 17]
          - - 256
            - - [1, 26]
              - [32, 24]
              - [128, 8]
              - [256, 9]
              - [448, 8]
              - [704, 10]
              - [1408, 7]
              - [2944, 16]
              - [3584, 18]
              - [-1, 16]
          - - 448
            - - [1, 26]
              - [32, 24]
              - [64, 8]
              - [256, 9]
              - [448, 10]
              - [704, 7]
              - [-1, 16]
          - - 704
            - - [1, 26]
              - [32, 24]
              - [64, 8]
              - [128, 9]
              - [256, 16]
              - [448, 7]
              - [704, 16]
              - [1024, 7]
              - [1408, 17]
              - [2368, 16]
              - [2944, 17]
              - [3584, 16]
              - [4288, 17]
              - [5056, 16]
              - [-1, 17]
          - - 1024
            - - [1, 26]
              - [32, 24]
              - [64, 9]
              - [128, 8]
              - [448, 10]
              - [704, 7]
              - [1024, 19]
              - [1856, 16]
              - [2368, 18]
              - [2944, 19]
              - [3584, 16]
              - [4288, 17]
              - [-1, 16]
          - - 1408
            - - [1, 26]
              - [32, 24]
              - [128, 9]
              - [256, 18]
              - [1408, 16]
              - [1856, 15]
              - [2368, 18]
              - [2944, 16]
              - [4288, 19]
              - [-1, 16]
          - - 1856
            - - [1, 26]
              - [32, 24]
              - [64, 9]
              - [128, 1]
              - [256, 10]
              - [448, 7]
              - [704, 16]
              - [1024, 15]
              - [2368, 16]
              - [2944, 18]
              - [-1, 16]
          - - 2368
            - - [1, 26]
              - [32, 24]
              - [64, 9]
              - [128, 1]
              - [256, 16]
              - [448, 7]
              - [704, 16]
              - [1024, 15]
              - [3584, 16]
              - [4288, 15]
              - [5056, 16]
              - [-1, 17]
          - - 2944
            - - [1, 26]
              - [32, 24]
              - [64, 10]
              - [128, 1]
              - [1024, 16]
              - [1408, 18]
              - [4288, 16]
              - [5056, 17]
              - [-1, 16]
          - - 3584
            - - [1, 26]
              - [32, 24]
              - [64, 1]
              - [128, 16]
              - [256, 17]
              - [1024, 16]
              - [1408, 14]
              - [4288, 16]
              - [5056, 18]
              - [5888, 16]
              - [-1, 18]
          - - 4288
            - - [1, 26]
              - [32, 24]
              - [64, 9]
              - [448, 16]
              - [704, 18]
              - [1024, 17]
              - [1408, 19]
              - [3584, 16]
              - [5056, 18]
              - [-1, 17]
          - - 5056
            - - [1, 26]
              - [32, 24]
              - [704, 16]
              - [1024, 17]
              - [2944, 16]
              - [4288, 18]
              - [5056, 16]
              - [-1, 17]
          - - 5888
            - - [1, 26]
              - [32, 24]
              - [64, 1]
              - [1024, 16]
              - [1408, 15]
              - [1856, 18]
              - [2368, 15]
              - [2944, 19]
              - [3584, 17]
              - [-1, 18]
          - - -1
            - - [1, 26]
              - [32, 24]
              - [704, 16]
              - [1024, 19]
              - [2368, 16]
              - [3584, 17]
              - [4288, 15]
              - [5888, 18]
              - [-1, 17]
