library/src/blas3/Tensile/Logic/asm_full/vega20_Cijk_Alik_Bljk_SB.yaml
- {MinimumRequiredVersion: 4.2.0}
- vega20
- gfx906
- [Device 66a0, Device 66a7]
    SolutionIndex: 0
    SolutionNameMin: Cijk_Alik_Bljk_SB_MT064x008x32_GRVW04_GSU32_TT04_04_VW04_WG16_02_08
    SolutionIndex: 1
    SolutionNameMin: Cijk_Alik_Bljk_SB_MT128x016x32_GRVW04_GSU32_TT04_04_VW04_WG32_04_02
    SolutionIndex: 2
    SolutionNameMin: Cijk_Alik_Bljk_SB_MT064x016x32_GRVW04_GSU32_TT04_04_VW04_WG16_04_04
    SolutionIndex: 3
    SolutionNameMin: Cijk_Alik_Bljk_SB_MT064x008x32_GRVW04_GSU16_TT04_04_VW04_WG16_02_08
    SolutionIndex: 4
    SolutionNameMin: Cijk_Alik_Bljk_SB_MT036x048x16_GRVW01_GSU08_TT03_03_VW01_WG12_16_01
    SolutionIndex: 5
    SolutionNameMin: Cijk_Alik_Bljk_SB_MT036x048x16_GRVW01_GSU04_TT03_03_VW01_WG12_16_01
    SolutionIndex: 6
    SolutionNameMin: Cijk_Alik_Bljk_SB_MT064x064x24_GRVW04_GSU02_TT08_08_VW04_WG08_08_02
    SolutionIndex: 7
    SolutionNameMin: Cijk_Alik_Bljk_SB_MT128x032x16_GRVW04_GSU02_TT08_04_VW04_WG16_08_02
    SolutionIndex: 8
    SolutionNameMin: Cijk_Alik_Bljk_SB_MT128x032x16_GRVW04_GSU04_TT08_04_VW04_WG16_08_02
    SolutionIndex: 9
    SolutionNameMin: Cijk_Alik_Bljk_SB_MT016x016x16_GRVW02_GSU08_TT02_02_VW02_WG08_08_04
    SolutionIndex: 10
    SolutionNameMin: Cijk_Alik_Bljk_SB_MT016x016x16_GRVW02_GSU04_TT02_02_VW02_WG08_08_04
    SolutionIndex: 11
    SolutionNameMin: Cijk_Alik_Bljk_SB_MT016x016x16_GRVW02_GSU04_TT02_02_VW02_WG08_08_04
    SolutionIndex: 12
    SolutionNameMin: Cijk_Alik_Bljk_SB_MT064x064x32_GRVW04_GSU02_TT08_08_VW04_WG08_08_02
    SolutionIndex: 13
    SolutionNameMin: Cijk_Alik_Bljk_SB_MT032x016x16_GRVW02_GSU04_TT04_02_VW02_WG08_08_02
    SolutionIndex: 14
    SolutionNameMin: Cijk_Alik_Bljk_SB_MT032x016x16_GRVW02_GSU04_TT04_02_VW02_WG08_08_02
    SolutionIndex: 15
    SolutionNameMin: Cijk_Alik_Bljk_SB_MT128x064x16_GRVW04_GSU02_TT08_08_VW04_WG16_08_02
    SolutionIndex: 16
    SolutionNameMin: Cijk_Alik_Bljk_SB_MT064x032x16_GRVW04_GSU04_TT04_04_VW04_WG16_08_02
    SolutionIndex: 17
    SolutionNameMin: Cijk_Alik_Bljk_SB_MT032x032x32_GRVW04_GSU02_TT04_04_VW04_WG08_08_04
    SolutionIndex: 18
    SolutionNameMin: Cijk_Alik_Bljk_SB_MT032x032x32_GRVW04_GSU02_TT04_04_VW04_WG08_08_02
    SolutionIndex: 19
    SolutionNameMin: Cijk_Alik_Bljk_SB_MT032x016x16_GRVW02_GSU04_TT02_02_VW02_WG16_08_02
    SolutionIndex: 20
    SolutionNameMin: Cijk_Alik_Bljk_SB_MT064x032x16_GRVW04_GSU02_TT08_04_VW04_WG08_08_02
    SolutionIndex: 21
    SolutionNameMin: Cijk_Alik_Bljk_SB_MT032x032x16_GRVW04_GSU04_TT04_04_VW04_WG08_08_02
    SolutionIndex: 22
    SolutionNameMin: Cijk_Alik_Bljk_SB_MT032x032x16_GRVW04_GSU04_TT04_04_VW04_WG08_08_02
    SolutionIndex: 23
    SolutionNameMin: Cijk_Alik_Bljk_SB_MT032x016x16_GRVW02_GSU04_TT04_02_VW02_WG08_08_04
    SolutionIndex: 24
    SolutionNameMin: Cijk_Alik_Bljk_SB_MT032x032x16_GRVW04_GSU02_TT04_04_VW04_WG08_08_02
    SolutionIndex: 25
    SolutionNameMin: Cijk_Alik_Bljk_SB_MT032x032x16_GRVW04_GSU02_TT04_04_VW04_WG08_08_02
    SolutionIndex: 26
    SolutionNameMin: Cijk_Alik_Bljk_SB_MT064x016x32_GRVW04_GSU02_TT04_04_VW04_WG16_04_04
    SolutionIndex: 27
    SolutionNameMin: Cijk_Alik_Bljk_SB_MT032x032x32_GRVW04_GSU04_TT04_04_VW04_WG08_08_04
    SolutionIndex: 28
    SolutionNameMin: Cijk_Alik_Bljk_SB_MT128x064x16_GRVW04_GSU01_TT08_04_VW04_WG16_16_01
    SolutionIndex: 29
    SolutionNameMin: Cijk_Alik_Bljk_SB_MT128x064x16_GRVW04_GSU01_TT08_04_VW04_WG16_16_01
    SolutionIndex: 30
    SolutionNameMin: Cijk_Alik_Bljk_SB_MT064x064x32_GRVW04_GSU01_TT04_04_VW04_WG16_16_01
    SolutionIndex: 31
    SolutionNameMin: Cijk_Alik_Bljk_SB_MT128x128x32_GRVW04_GSU01_TT08_08_VW04_WG16_16_01
    SolutionIndex: 32
    SolutionNameMin: Cijk_Alik_Bljk_SB_MT064x064x16_GRVW04_GSU01_TT04_04_VW04_WG16_16_01
    SolutionIndex: 33
    SolutionNameMin: Cijk_Alik_Bljk_SB_MT064x128x16_GRVW04_GSU01_TT04_08_VW04_WG16_16_01
    SolutionIndex: 34
    SolutionNameMin: Cijk_Alik_Bljk_SB_MT064x064x16_GRVW04_GSU01_TT04_04_VW04_WG16_16_01
    SolutionIndex: 35
    SolutionNameMin: Cijk_Alik_Bljk_SB_MT128x128x16_GRVW04_GSU01_TT08_08_VW04_WG16_16_01
    SolutionIndex: 36
    SolutionNameMin: Cijk_Alik_Bljk_SB_MT128x128x16_GRVW04_GSU01_TT08_08_VW04_WG16_16_01
    SolutionIndex: 37
    SolutionNameMin: Cijk_Alik_Bljk_SB_MT128x128x08_GRVW04_GSU01_TT08_08_VW04_WG16_16_01
    SolutionIndex: 38
    SolutionNameMin: Cijk_Alik_Bljk_SB_MT064x128x08_GRVW04_GSU01_TT04_08_VW04_WG16_16_01
    SolutionIndex: 39
    SolutionNameMin: Cijk_Alik_Bljk_SB_MT128x128x08_GRVW04_GSU01_TT08_08_VW04_WG16_16_01
    SolutionIndex: 40
    SolutionNameMin: Cijk_Alik_Bljk_SB_MT096x128x16_GRVW02_GSU01_TT06_08_VW02_WG16_16_01
    SolutionIndex: 41
    SolutionNameMin: Cijk_Alik_Bljk_SB_MT064x128x08_GRVW04_GSU01_TT04_08_VW04_WG16_16_01
    SolutionIndex: 42
    SolutionNameMin: Cijk_Alik_Bljk_SB_MT128x064x08_GRVW04_GSU01_TT08_04_VW04_WG16_16_01
    SolutionIndex: 43
    SolutionNameMin: Cijk_Alik_Bljk_SB_MT008x008x08_GRVW02_GSU08_TT02_02_VW02_WG04_04_04
- - - [4096, 7000, 1, 4096]
    - [36, 8163.23]
  - - [7680, 12000, 1, 2560]
    - [36, 8679.71]
  - - [5124, 9124, 1, 1760]
    - [37, 8755.63]
  - - [1760, 32, 1, 1760]
    - [22, 3193.4]
  - - [512, 24000, 1, 1536]
    - [36, 8285.67]
  - - [3072, 24000, 1, 1024]
    - [35, 8336.76]
  - - [2048, 400, 1, 512]
    - [36, 4365.36]
  - - [2560, 7000, 1, 2560]
    - [36, 8312.05]
  - - [3072, 16, 1, 1024]
    - [11, 1145.97]
  - - [512, 48000, 1, 2816]
    - [37, 8720.74]
  - - [512, 48000, 1, 2048]
    - [36, 7952.68]
  - - [1760, 64, 1, 1760]
    - [24, 4317.17]
  - - [35, 8457, 1, 4096]
    - [4, 3582.68]
  - - [2048, 1600, 1, 2048]
    - [32, 5612.16]
  - - [512, 48000, 1, 1536]
    - [36, 8496.64]
  - - [2560, 32, 1, 2560]
    - [16, 2982.26]
  - - [8448, 5984, 1, 2816]
    - [39, 8848.46]
  - - [4096, 3200, 1, 1024]
    - [35, 7043.53]
  - - [1024, 24000, 1, 2560]
    - [36, 8539.88]
  - - [1760, 6400, 1, 1760]
    - [39, 8862.82]
  - - [1024, 700, 1, 512]
    - [28, 4197.13]
  - - [4608, 32, 1, 1536]
    - [25, 2848.21]
  - - [3072, 64, 1, 1024]
    - [15, 2084.96]
  - - [16384, 3200, 1, 4096]
    - [36, 8357.33]
  - - [2560, 16, 1, 2560]
    - [13, 1919.05]
  - - [1024, 48000, 1, 2560]
    - [35, 8617.89]
  - - [35, 8457, 1, 2560]
    - [4, 3647.17]
  - - [8448, 48000, 1, 2816]
    - [37, 9028.95]
  - - [2048, 32, 1, 2048]
    - [11, 1720.71]
  - - [2560, 3200, 1, 2560]
    - [35, 8281.17]
  - - [16384, 800, 1, 4096]
    - [35, 6945.84]
  - - [4608, 24000, 1, 1536]
    - [36, 8649.87]
  - - [7680, 48000, 1, 2560]
    - [36, 8764.03]
  - - [3072, 48000, 1, 1024]
    - [35, 8512.97]
  - - [1760, 16, 1, 1760]
    - [14, 2058.21]
  - - [8192, 3200, 1, 2048]
    - [35, 7837.15]
  - - [512, 24000, 1, 2816]
    - [36, 8599.04]
  - - [4096, 400, 1, 1024]
    - [30, 3909.62]
  - - [6144, 48000, 1, 2560]
    - [36, 8738.15]
  - - [4608, 48000, 1, 1536]
    - [36, 8721.62]
  - - [35, 8457, 1, 2048]
    - [4, 3008.08]
  - - [4096, 128, 1, 4096]
    - [8, 3965.6]
  - - [2048, 800, 1, 512]
    - [35, 5092.59]
  - - [4608, 5984, 1, 1536]
    - [36, 8470.15]
  - - [2560, 128, 1, 2560]
    - [8, 4043.81]
  - - [6144, 5984, 1, 2048]
    - [35, 8142.33]
  - - [35, 8457, 1, 1760]
    - [5, 3693.59]
  - - [7680, 24000, 1, 2560]
    - [36, 8710.92]
  - - [6144, 48000, 1, 2048]
    - [36, 8626.88]
  - - [5124, 9124, 1, 2560]
    - [36, 8396.46]
  - - [2048, 3200, 1, 2048]
    - [32, 6441.53]
  - - [2048, 16, 1, 2048]
    - [27, 1075.45]
  - - [1024, 24000, 1, 1536]
    - [36, 8440.56]
  - - [7680, 16, 1, 2560]
    - [14, 2360.2]
  - - [2560, 6400, 1, 2560]
    - [36, 8499.32]
  - - [2048, 128, 1, 2048]
    - [18, 2769.62]
  - - [512, 16, 1, 500000]
    - [2, 2728.3]
  - - [1024, 8, 1, 500000]
    - [0, 1722.61]
  - - [512, 24000, 1, 2560]
    - [35, 8396.37]
  - - [1024, 24000, 1, 2816]
    - [37, 8657.55]
  - - [7680, 5984, 1, 2560]
    - [35, 8603.76]
  - - [2048, 1600, 1, 512]
    - [34, 5399.39]
  - - [2048, 7000, 1, 2048]
    - [35, 7442.64]
  - - [1760, 800, 1, 1760]
    - [28, 6857.55]
  - - [5124, 9124, 1, 4096]
    - [35, 8149.1]
  - - [4096, 64, 1, 4096]
    - [21, 3356.24]
  - - [7680, 32, 1, 2560]
    - [17, 3574.64]
  - - [2560, 64, 1, 2560]
    - [6, 3367.26]
  - - [3072, 128, 1, 1024]
    - [15, 2423.25]
  - - [7680, 64, 1, 2560]
    - [12, 4222.39]
  - - [1760, 128, 1, 1760]
    - [20, 4931.44]
  - - [2560, 1600, 1, 2560]
    - [29, 6907.15]
  - - [2048, 3200, 1, 512]
    - [35, 6959.09]
  - - [2560, 800, 1, 2560]
    - [34, 6184.89]
  - - [3072, 32, 1, 1024]
    - [19, 1588.73]
  - - [6144, 32, 1, 2560]
    - [24, 3198.45]
  - - [4608, 12000, 1, 1536]
    - [35, 8584.89]
  - - [4096, 32, 1, 4096]
    - [22, 2535.24]
  - - [6144, 24000, 1, 2048]
    - [35, 8552.56]
  - - [8192, 800, 1, 2048]
    - [34, 6138.67]
  - - [4096, 1600, 1, 1024]
    - [32, 6068.5]
  - - [5124, 9124, 1, 2048]
    - [35, 8038.7]
  - - [8448, 24000, 1, 2816]
    - [39, 9003.32]
  - - [1024, 48000, 1, 1536]
    - [35, 8586.94]
  - - [7680, 128, 1, 2560]
    - [6, 4852.95]
  - - [8192, 1600, 1, 2048]
    - [35, 7291.96]
  - - [4096, 800, 1, 1024]
    - [32, 4905.55]
  - - [1024, 16, 1, 500000]
    - [1, 2949.61]
  - - [2048, 800, 1, 2048]
    - [31, 4526.98]
  - - [1760, 3200, 1, 1760]
    - [39, 8005.06]
  - - [512, 48000, 1, 2560]
    - [36, 8563.13]
  - - [8448, 16, 1, 2816]
    - [26, 2562.12]
  - - [2048, 64, 1, 2048]
    - [23, 2217.71]
  - - [512, 24000, 1, 2048]
    - [35, 7215.2]
  - - [16384, 1600, 1, 4096]
    - [35, 7800.3]
  - - [4608, 16, 1, 1536]
    - [14, 1974.27]
  - - [1024, 24000, 1, 2048]
    - [36, 7903.73]
  - - [8192, 400, 1, 2048]
    - [34, 5387.25]
  - - [2048, 6400, 1, 2048]
    - [36, 7403.62]
  - - [6144, 12000, 1, 2048]
    - [35, 8417.74]
  - - [512, 8, 1, 500000]
    - [3, 1734.98]
  - - [1760, 7000, 1, 1760]
    - [42, 8486.59]
  - - [1024, 48000, 1, 2816]
    - [37, 8845.95]
  - - [6144, 16, 1, 2560]
    - [13, 2286.11]
  - - [8448, 32, 1, 2816]
    - [16, 4073.49]
  - - [4096, 16, 1, 4096]
    - [10, 1579.75]
  - - [6144, 24000, 1, 2560]
    - [36, 8691.14]
  - - [1024, 1024, 1, 1024]
    - [40, 3790.34]
  - - [8448, 12000, 1, 2816]
    - [39, 8962.57]
  - - [16384, 400, 1, 4096]
    - [28, 6226.26]
  - - [1760, 1600, 1, 1760]
    - [37, 7692.93]
  - - [1024, 48000, 1, 2048]
    - [36, 8333.87]
- - - -1
    - - - -1
        - - - 4
            - - [448, 9]
              - [1856, 43]
              - [-1, 9]
          - - 64
            - - [128, 9]
              - [448, 27]
              - [704, 21]
              - [1024, 22]
              - [2368, 25]
              - [2944, 16]
              - [3584, 6]
              - [5056, 16]
              - [5888, 20]
              - [-1, 32]
          - - 128
            - - [64, 9]
              - [256, 27]
              - [448, 22]
              - [1024, 25]
              - [1408, 22]
              - [2368, 20]
              - [2944, 7]
              - [3584, 32]
              - [4288, 22]
              - [5888, 32]
              - [-1, 33]
          - - 256
            - - [4, 9]
              - [128, 27]
              - [256, 22]
              - [448, 25]
              - [1856, 32]
              - [2368, 34]
              - [2944, 32]
              - [3584, 41]
              - [4288, 32]
              - [5888, 42]
              - [-1, 39]
          - - 448
            - - [4, 9]
              - [64, 27]
              - [128, 22]
              - [256, 25]
              - [448, 22]
              - [1408, 32]
              - [1856, 42]
              - [2368, 32]
              - [2944, 42]
              - [3584, 34]
              - [4288, 41]
              - [5056, 34]
              - [5888, 39]
              - [-1, 33]
          - - 704
            - - [4, 43]
              - [64, 22]
              - [128, 25]
              - [1024, 32]
              - [1856, 41]
              - [2944, 32]
              - [5056, 33]
              - [5888, 32]
              - [-1, 39]
          - - 1024
            - - [4, 43]
              - [64, 21]
              - [128, 7]
              - [448, 32]
              - [704, 34]
              - [1408, 42]
              - [1856, 39]
              - [2368, 42]
              - [3584, 39]
              - [4288, 42]
              - [-1, 39]
          - - 1408
            - - [4, 43]
              - [64, 25]
              - [128, 21]
              - [256, 32]
              - [448, 34]
              - [704, 42]
              - [1024, 41]
              - [1856, 37]
              - [2368, 41]
              - [3584, 37]
              - [5888, 39]
              - [-1, 41]
          - - 1856
            - - [4, 43]
              - [64, 25]
              - [128, 20]
              - [256, 34]
              - [448, 42]
              - [704, 29]
              - [1408, 39]
              - [2944, 42]
              - [3584, 41]
              - [4288, 39]
              - [5056, 42]
              - [5888, 39]
              - [-1, 37]
          - - 2368
            - - [4, 9]
              - [64, 24]
              - [128, 20]
              - [448, 34]
              - [704, 32]
              - [1856, 41]
              - [2944, 39]
              - [4288, 42]
              - [-1, 37]
          - - 2944
            - - [4, 9]
              - [64, 16]
              - [128, 7]
              - [256, 34]
              - [448, 41]
              - [704, 42]
              - [1408, 37]
              - [1856, 42]
              - [2368, 39]
              - [2944, 41]
              - [4288, 42]
              - [-1, 37]
          - - 3584
            - - [4, 9]
              - [64, 6]
              - [128, 32]
              - [256, 42]
              - [448, 32]
              - [704, 42]
              - [1408, 37]
              - [1856, 42]
              - [2368, 37]
              - [2944, 42]
              - [-1, 37]
          - - 4288
            - - [4, 9]
              - [64, 16]
              - [128, 21]
              - [256, 32]
              - [448, 28]
              - [1024, 42]
              - [1856, 37]
              - [2944, 42]
              - [3584, 39]
              - [4288, 41]
              - [-1, 37]
          - - 5056
            - - [4, 9]
              - [64, 16]
              - [128, 32]
              - [256, 42]
              - [448, 32]
              - [704, 42]
              - [1408, 37]
              - [1856, 42]
              - [2368, 39]
              - [2944, 38]
              - [3584, 37]
              - [4288, 42]
              - [5888, 39]
              - [-1, 37]
          - - 5888
            - - [4, 9]
              - [64, 7]
              - [128, 32]
              - [256, 42]
              - [448, 37]
              - [704, 42]
              - [2944, 37]
              - [3584, 38]
              - [5056, 37]
              - [5888, 39]
              - [-1, 37]
          - - -1
            - - [4, 9]
              - [64, 32]
              - [128, 33]
              - [256, 37]
              - [448, 28]
              - [704, 37]
              - [1024, 39]
              - [1408, 38]
              - [1856, 42]
              - [2368, 37]
              - [2944, 38]
              - [3584, 39]
              - [4288, 37]
              - [5056, 39]
              - [-1, 37]
