library/src/blas3/Tensile/Logic/asm_full/vega10_Cijk_Ailk_Bljk_SB.yaml
- {MinimumRequiredVersion: 4.4.0}
- vega10
- gfx900
- [Device 6863, Device 6862, Device 687f, Device 6860, Device 6861, 'Vega 10 XTX [Radeon
    SolutionIndex: 0
    SolutionNameMin: Cijk_Ailk_Bljk_SB_MT032x016x32_DTL0_GRVW02_LPB00_PBC0_PGR1_TT02_02_USFGRO00_VW02_WG16_08_02
    SolutionIndex: 1
    SolutionNameMin: Cijk_Ailk_Bljk_SB_MT064x008x32_DTL0_GRVW02_LPB00_PBC0_PGR1_TT02_02_USFGRO00_VW02_WG32_04_02
    SolutionIndex: 2
    SolutionNameMin: Cijk_Ailk_Bljk_SB_MT064x016x64_DTL0_GRVW04_LPB00_PBC0_PGR0_TT04_04_USFGRO00_VW04_WG16_04_04
    SolutionIndex: 3
    SolutionNameMin: Cijk_Ailk_Bljk_SB_MT128x016x32_DTL0_GRVW04_LPB00_PBC0_PGR0_TT04_04_USFGRO00_VW04_WG32_04_02
    SolutionIndex: 4
    SolutionNameMin: Cijk_Ailk_Bljk_SB_MT128x008x32_DTL0_GRVW02_LPB00_PBC0_PGR0_TT08_02_USFGRO00_VW02_WG16_04_04
    SolutionIndex: 5
    SolutionNameMin: Cijk_Ailk_Bljk_SB_MT128x008x32_DTL0_GRVW04_LPB00_PBC0_PGR0_TT04_04_USFGRO00_VW04_WG32_02_04
    SolutionIndex: 6
    SolutionNameMin: Cijk_Ailk_Bljk_SB_MT064x008x64_DTL0_GRVW04_LPB00_PBC0_PGR0_TT04_04_USFGRO00_VW04_WG16_02_08
    SolutionIndex: 7
    SolutionNameMin: Cijk_Ailk_Bljk_SB_MT064x004x64_DTL0_GRVW02_LPB00_PBC0_PGR0_TT02_02_USFGRO00_VW02_WG32_02_04
    SolutionIndex: 8
    SolutionNameMin: Cijk_Ailk_Bljk_SB_MT064x016x32_DTL0_GRVW04_LPB00_PBC0_PGR1_TT04_04_USFGRO00_VW04_WG16_04_04
    SolutionIndex: 9
    SolutionNameMin: Cijk_Ailk_Bljk_SB_MT128x016x16_DTL0_GRVW04_LPB00_PBC0_PGR1_TT04_04_USFGRO00_VW04_WG32_04_02
    SolutionIndex: 10
    SolutionNameMin: Cijk_Ailk_Bljk_SB_MT128x016x32_DTL0_GRVW02_LPB00_PBC0_PGR0_TT08_02_USFGRO00_VW02_WG16_08_02
    SolutionIndex: 11
    SolutionNameMin: Cijk_Ailk_Bljk_SB_MT064x008x64_DTL0_GRVW04_LPB00_PBC0_PGR1_TT04_04_USFGRO00_VW04_WG16_02_08
    SolutionIndex: 12
    SolutionNameMin: Cijk_Ailk_Bljk_SB_MT048x048x16_DTL0_GRVW01_LPB00_PBC1_PGR1_TT03_03_USFGRO01_VW01_WG16_16_01
    SolutionIndex: 13
    SolutionNameMin: Cijk_Ailk_Bljk_SB_MT048x036x16_DTL0_GRVW01_LPB00_PBC1_PGR1_TT06_03_USFGRO01_VW01_WG08_12_02
    SolutionIndex: 14
    SolutionNameMin: Cijk_Ailk_Bljk_SB_MT048x024x32_DTL0_GRVW02_LPB00_PBC0_PGR1_TT06_04_USFGRO00_VW02_WG08_06_04
    SolutionIndex: 15
    SolutionNameMin: Cijk_Ailk_Bljk_SB_MT024x024x24_DTL0_GRVW01_LPB00_PBC1_PGR1_TT03_04_USFGRO01_VW01_WG08_06_04
    SolutionIndex: 16
    SolutionNameMin: Cijk_Ailk_Bljk_SB_MT048x036x16_DTL0_GRVW01_LPB00_PBC1_PGR1_TT06_03_USFGRO01_VW01_WG08_12_02
    SolutionIndex: 17
    SolutionNameMin: Cijk_Ailk_Bljk_SB_MT036x048x16_DTL0_GRVW01_LPB00_PBC1_PGR1_TT03_03_USFGRO01_VW01_WG12_16_01
    SolutionIndex: 18
    SolutionNameMin: Cijk_Ailk_Bljk_SB_MT032x016x08_DTL0_GRVW02_LPB00_PBC0_PGR1_TT02_02_USFGRO00_VW02_WG16_08_01
    SolutionIndex: 19
    SolutionNameMin: Cijk_Ailk_Bljk_SB_MT032x008x32_DTL0_GRVW02_LPB00_PBC0_PGR1_TT02_02_USFGRO00_VW02_WG16_04_04
    SolutionIndex: 20
    SolutionNameMin: Cijk_Ailk_Bljk_SB_MT032x032x32_DTL0_GRVW04_LPB00_PBC0_PGR1_TT04_04_USFGRO00_VW04_WG08_08_04
    SolutionIndex: 21
    SolutionNameMin: Cijk_Ailk_Bljk_SB_MT064x016x16_DTL0_GRVW04_LPB00_PBC0_PGR1_TT04_04_USFGRO00_VW04_WG16_04_04
    SolutionIndex: 22
    SolutionNameMin: Cijk_Ailk_Bljk_SB_MT256x032x16_DTL0_GRVW04_LPB00_PBC0_PGR1_TT08_08_USFGRO00_VW04_WG32_04_02
    SolutionIndex: 23
    SolutionNameMin: Cijk_Ailk_Bljk_SB_MT032x008x32_DTL0_GRVW02_LPB00_PBC0_PGR1_TT02_02_USFGRO00_VW02_WG16_04_04
    SolutionIndex: 24
    SolutionNameMin: Cijk_Ailk_Bljk_SB_MT032x008x32_DTL0_GRVW02_LPB00_PBC0_PGR1_TT02_02_USFGRO00_VW02_WG16_04_04
    SolutionIndex: 25
    SolutionNameMin: Cijk_Ailk_Bljk_SB_MT064x032x32_DTL0_GRVW04_LPB00_PBC0_PGR1_TT08_04_USFGRO00_VW04_WG08_08_04
    SolutionIndex: 26
    SolutionNameMin: Cijk_Ailk_Bljk_SB_MT064x016x16_DTL0_GRVW02_LPB00_PBC0_PGR1_TT04_02_USFGRO00_VW02_WG16_08_02
    SolutionIndex: 27
    SolutionNameMin: Cijk_Ailk_Bljk_SB_MT016x016x16_DTL0_GRVW02_LPB00_PBC1_PGR1_TT02_02_USFGRO01_VW02_WG08_08_04
    SolutionIndex: 28
    SolutionNameMin: Cijk_Ailk_Bljk_SB_MT128x032x16_DTL0_GRVW04_LPB00_PBC0_PGR1_TT08_04_USFGRO00_VW04_WG16_08_02
    SolutionIndex: 29
    SolutionNameMin: Cijk_Ailk_Bljk_SB_MT128x032x16_DTL0_GRVW04_LPB00_PBC0_PGR1_TT08_04_USFGRO00_VW04_WG16_08_02
    SolutionIndex: 30
    SolutionNameMin: Cijk_Ailk_Bljk_SB_MT016x016x16_DTL0_GRVW02_LPB00_PBC1_PGR1_TT02_02_USFGRO01_VW02_WG08_08_04
    SolutionIndex: 31
    SolutionNameMin: Cijk_Ailk_Bljk_SB_MT016x016x16_DTL0_GRVW02_LPB00_PBC1_PGR1_TT02_02_USFGRO01_VW02_WG08_08_04
    SolutionIndex: 32
    SolutionNameMin: Cijk_Ailk_Bljk_SB_MT064x016x32_DTL0_GRVW02_LPB00_PBC0_PGR1_TT04_02_USFGRO00_VW02_WG16_08_02
    SolutionIndex: 33
    SolutionNameMin: Cijk_Ailk_Bljk_SB_MT064x016x32_DTL0_GRVW02_LPB00_PBC0_PGR1_TT04_02_USFGRO00_VW02_WG16_08_02
    SolutionIndex: 34
    SolutionNameMin: Cijk_Ailk_Bljk_SB_MT032x032x16_DTL0_GRVW04_LPB00_PBC0_PGR1_TT04_04_USFGRO00_VW04_WG08_08_02
    SolutionIndex: 35
    SolutionNameMin: Cijk_Ailk_Bljk_SB_MT032x032x16_DTL0_GRVW04_LPB00_PBC0_PGR1_TT04_04_USFGRO00_VW04_WG08_08_02
    SolutionIndex: 36
    SolutionNameMin: Cijk_Ailk_Bljk_SB_MT064x032x16_DTL0_GRVW04_LPB00_PBC0_PGR1_TT08_04_USFGRO00_VW04_WG08_08_02
    SolutionIndex: 37
    SolutionNameMin: Cijk_Ailk_Bljk_SB_MT032x016x16_DTL0_GRVW02_LPB00_PBC0_PGR1_TT04_02_USFGRO00_VW02_WG08_08_04
    SolutionIndex: 38
    SolutionNameMin: Cijk_Ailk_Bljk_SB_MT064x016x16_DTL0_GRVW02_LPB00_PBC0_PGR1_TT04_02_USFGRO00_VW02_WG16_08_02
    SolutionIndex: 39
    SolutionNameMin: Cijk_Ailk_Bljk_SB_MT064x032x16_DTL0_GRVW04_LPB00_PBC0_PGR1_TT08_04_USFGRO00_VW04_WG08_08_02
    SolutionIndex: 40
    SolutionNameMin: Cijk_Ailk_Bljk_SB_MT032x016x16_DTL0_GRVW02_LPB00_PBC0_PGR1_TT04_02_USFGRO00_VW02_WG08_08_02
    SolutionIndex: 41
    SolutionNameMin: Cijk_Ailk_Bljk_SB_MT032x008x32_DTL0_GRVW02_LPB00_PBC0_PGR1_TT02_02_USFGRO00_VW02_WG16_04_04
    SolutionIndex: 42
    SolutionNameMin: Cijk_Ailk_Bljk_SB_MT032x016x32_DTL0_GRVW02_LPB00_PBC0_PGR1_TT04_02_USFGRO00_VW02_WG08_08_04
    SolutionIndex: 43
    SolutionNameMin: Cijk_Ailk_Bljk_SB_MT064x032x16_DTL0_GRVW04_LPB00_PBC0_PGR1_TT04_04_USFGRO00_VW04_WG16_08_02
    SolutionIndex: 44
    SolutionNameMin: Cijk_Ailk_Bljk_SB_MT128x016x16_DTL0_GRVW04_LPB00_PBC0_PGR1_TT08_04_USFGRO00_VW04_WG16_04_04
    SolutionIndex: 45
    SolutionNameMin: Cijk_Ailk_Bljk_SB_MT032x016x16_DTL0_GRVW02_LPB00_PBC0_PGR1_TT02_02_USFGRO00_VW02_WG16_08_02
    SolutionIndex: 46
    SolutionNameMin: Cijk_Ailk_Bljk_SB_MT064x064x08_DTL0_GRVW04_LPB00_PBC0_PGR1_TT04_04_USFGRO00_VW04_WG16_16_01
    SolutionIndex: 47
    SolutionNameMin: Cijk_Ailk_Bljk_SB_MT064x064x08_DTL0_GRVW04_LPB00_PBC0_PGR1_TT04_04_USFGRO00_VW04_WG16_16_01
    SolutionIndex: 48
    SolutionNameMin: Cijk_Ailk_Bljk_SB_MT064x128x16_DTL0_GRVW04_LPB00_PBC0_PGR1_TT04_08_USFGRO00_VW04_WG16_16_01
    SolutionIndex: 49
    SolutionNameMin: Cijk_Ailk_Bljk_SB_MT064x064x16_DTL0_GRVW04_LPB00_PBC0_PGR1_TT04_04_USFGRO00_VW04_WG16_16_01
    SolutionIndex: 50
    SolutionNameMin: Cijk_Ailk_Bljk_SB_MT064x064x16_DTL0_GRVW04_LPB00_PBC0_PGR1_TT04_04_USFGRO00_VW04_WG16_16_01
    SolutionIndex: 51
    SolutionNameMin: Cijk_Ailk_Bljk_SB_MT128x064x16_DTL0_GRVW04_LPB00_PBC0_PGR1_TT08_04_USFGRO00_VW04_WG16_16_01
    SolutionIndex: 52
    SolutionNameMin: Cijk_Ailk_Bljk_SB_MT128x064x16_DTL0_GRVW04_LPB00_PBC0_PGR1_TT08_04_USFGRO00_VW04_WG16_16_01
    SolutionIndex: 53
    SolutionNameMin: Cijk_Ailk_Bljk_SB_MT128x064x08_DTL0_GRVW04_LPB00_PBC0_PGR1_TT08_04_USFGRO00_VW04_WG16_16_01
    SolutionIndex: 54
    SolutionNameMin: Cijk_Ailk_Bljk_SB_MT128x064x08_DTL0_GRVW04_LPB00_PBC0_PGR1_TT08_04_USFGRO00_VW04_WG16_16_01
    SolutionIndex: 55
    SolutionNameMin: Cijk_Ailk_Bljk_SB_MT128x128x16_DTL0_GRVW04_LPB00_PBC0_PGR1_TT08_08_USFGRO00_VW04_WG16_16_01
    SolutionIndex: 56
    SolutionNameMin: Cijk_Ailk_Bljk_SB_MT128x128x16_DTL0_GRVW04_LPB00_PBC0_PGR1_TT08_08_USFGRO00_VW04_WG16_16_01
    SolutionIndex: 57
    SolutionNameMin: Cijk_Ailk_Bljk_SB_MT128x128x08_DTL0_GRVW04_LPB00_PBC0_PGR1_TT08_08_USFGRO00_VW04_WG16_16_01
    SolutionIndex: 58
    SolutionNameMin: Cijk_Ailk_Bljk_SB_MT128x064x32_DTL0_GRVW04_LPB00_PBC0_PGR1_TT08_04_USFGRO00_VW04_WG16_16_01
    SolutionIndex: 59
    SolutionNameMin: Cijk_Ailk_Bljk_SB_MT016x016x04_DTL0_GRVW02_LPB00_PBC0_PGR1_TT02_02_USFGRO00_VW02_WG08_08_01
    SolutionIndex: 60
    SolutionNameMin: Cijk_Ailk_Bljk_SB_MT016x016x16_DTL0_GRVW02_LPB00_PBC1_PGR1_TT02_02_USFGRO01_VW02_WG08_08_04
    SolutionIndex: 61
    SolutionNameMin: Cijk_Ailk_Bljk_SB_MT064x064x16_DTL0_GRVW04_LPB00_PBC0_PGR1_TT02_04_USFGRO00_VW02_WG32_16_01
    SolutionIndex: 62
    SolutionNameMin: Cijk_Ailk_Bljk_SB_MT128x064x16_DTL0_GRVW04_LPB04_PBC0_PGR1_TT04_04_USFGRO00_VW04_WG32_16_01
    SolutionIndex: 63
    SolutionNameMin: Cijk_Ailk_Bljk_SB_MT064x064x32_DTL0_GRVW04_LPB00_PBC0_PGR1_TT04_04_USFGRO00_VW01_WG16_16_01
    SolutionIndex: 64
    SolutionNameMin: Cijk_Ailk_Bljk_SB_MT128x064x32_DTL0_GRVW04_LPB04_PBC0_PGR1_TT04_04_USFGRO00_VW04_WG32_16_01
    SolutionIndex: 65
    SolutionNameMin: Cijk_Ailk_Bljk_SB_MT128x032x16_DTL0_GRVW04_LPB04_PBC0_PGR1_TT04_04_USFGRO00_VW04_WG32_08_01
    SolutionIndex: 66
    SolutionNameMin: Cijk_Ailk_Bljk_SB_MT128x064x32_DTL0_GRVW04_LPB04_PBC0_PGR1_TT04_04_USFGRO00_VW04_WG32_16_01
    SolutionIndex: 67
    SolutionNameMin: Cijk_Ailk_Bljk_SB_MT128x064x08_DTL0_GRVW04_LPB04_PBC0_PGR1_TT04_08_USFGRO00_VW04_WG32_08_01
    SolutionIndex: 68
    SolutionNameMin: Cijk_Ailk_Bljk_SB_MT128x064x08_DTL0_GRVW04_LPB04_PBC0_PGR1_TT04_08_USFGRO00_VW04_WG32_08_01
    SolutionIndex: 69
    SolutionNameMin: Cijk_Ailk_Bljk_SB_MT128x064x16_DTL0_GRVW04_LPB04_PBC0_PGR1_TT04_04_USFGRO00_VW04_WG32_16_01
    SolutionIndex: 70
    SolutionNameMin: Cijk_Ailk_Bljk_SB_MT128x032x16_DTL0_GRVW04_LPB04_PBC0_PGR0_TT04_04_USFGRO00_VW04_WG32_08_01
    SolutionIndex: 71
    SolutionNameMin: Cijk_Ailk_Bljk_SB_MT128x032x16_DTL0_GRVW04_LPB00_PBC0_PGR0_TT04_04_USFGRO00_VW04_WG32_08_01
    SolutionIndex: 72
    SolutionNameMin: Cijk_Ailk_Bljk_SB_MT128x032x16_DTL0_GRVW01_LPB04_PBC1_PGR0_TT04_04_USFGRO01_VW04_WG32_08_01
    SolutionIndex: 73
    SolutionNameMin: Cijk_Ailk_Bljk_SB_MT128x032x16_DTL0_GRVW01_LPB04_PBC1_PGR0_TT04_04_USFGRO01_VW01_WG32_08_01
    SolutionIndex: 74
    SolutionNameMin: Cijk_Ailk_Bljk_SB_MT256x032x16_DTL0_GRVW04_LPB04_PBC0_PGR0_TT08_04_USFGRO00_VW02_WG32_08_01
    SolutionIndex: 75
    SolutionNameMin: Cijk_Ailk_Bljk_SB_MT064x032x16_DTL0_GRVW01_LPB02_PBC1_PGR0_TT04_04_USFGRO01_VW02_WG16_08_01
    SolutionIndex: 76
    SolutionNameMin: Cijk_Ailk_Bljk_SB_MT064x064x16_DTL0_GRVW04_LPB04_PBC0_PGR0_TT04_04_USFGRO00_VW04_WG16_16_01
    SolutionIndex: 77
    SolutionNameMin: Cijk_Ailk_Bljk_SB_MT064x032x16_DTL0_GRVW01_LPB02_PBC1_PGR0_TT04_04_USFGRO01_VW01_WG16_08_01
- - - [4096, 7000, 1, 4096]
    - [55, 11898.2]
  - - [5124, 9124, 1, 1760]
    - [53, 11988.3]
  - - [5124, 9124, 1, 2560]
    - [55, 11615.6]
  - - [1760, 32, 1, 1760]
    - [20, 4168.61]
  - - [1024, 1500, 1, 1536]
    - [51, 10264.1]
  - - [512, 24000, 1, 1536]
    - [54, 11630.8]
  - - [3072, 24000, 1, 1024]
    - [55, 11946.7]
  - - [1024, 3000, 1, 2560]
    - [56, 11158.8]
  - - [512, 3136, 1, 2048]
    - [65, 8771.2]
  - - [7680, 4, 1, 2560]
    - [26, 792.866]
  - - [35, 1500, 1, 2048]
    - [14, 2464.27]
  - - [8448, 1500, 1, 2816]
    - [53, 11818.2]
  - - [784, 512, 64, 128]
    - [76, 10002.5]
  - - [2560, 7000, 1, 2560]
    - [53, 11975.6]
  - - [3072, 16, 1, 1024]
    - [42, 2334.93]
  - - [512, 48000, 1, 2048]
    - [52, 11191.8]
  - - [1760, 64, 1, 1760]
    - [34, 5743.03]
  - - [1024, 16, 1, 512]
    - [30, 1286.89]
  - - [196, 256, 64, 1024]
    - [73, 6299.29]
  - - [512, 48000, 1, 1536]
    - [54, 12083.6]
  - - [2560, 32, 1, 2560]
    - [36, 4544.21]
  - - [4608, 1500, 1, 1536]
    - [53, 11074.2]
  - - [2048, 128, 1, 2048]
    - [22, 6685.9]
  - - [1024, 24000, 1, 2560]
    - [54, 12168.8]
  - - [4608, 3000, 1, 1536]
    - [53, 11715.1]
  - - [5124, 9124, 1, 2048]
    - [55, 11572.0]
  - - [1024, 700, 1, 512]
    - [49, 7328.89]
  - - [3072, 1, 1, 128]
    - [45, 70.7796]
  - - [5124, 700, 1, 2560]
    - [49, 10333.9]
  - - [8448, 16, 1, 2816]
    - [38, 2820.18]
  - - [6144, 6000, 1, 2560]
    - [55, 11946.5]
  - - [4608, 32, 1, 1536]
    - [34, 4604.77]
  - - [35, 8457, 1, 2560]
    - [12, 4144.75]
  - - [3072, 64, 1, 1024]
    - [29, 4246.59]
  - - [512, 16, 1, 512]
    - [30, 845.03]
  - - [7680, 2, 1, 2560]
    - [26, 399.415]
  - - [4224, 1, 1, 128]
    - [23, 97.3132]
  - - [7680, 1, 1, 2560]
    - [21, 199.258]
  - - [128, 1500, 1, 1280]
    - [43, 5892.82]
  - - [35, 8457, 1, 4096]
    - [16, 4285.63]
  - - [1024, 1500, 1, 2816]
    - [53, 10815.1]
  - - [6144, 2, 1, 2560]
    - [40, 388.882]
  - - [8448, 48000, 1, 2816]
    - [53, 12392.6]
  - - [512, 6000, 1, 1536]
    - [55, 10655.5]
  - - [4224, 1500, 1, 176]
    - [54, 9800.64]
  - - [1024, 6000, 1, 2816]
    - [53, 11739.8]
  - - [512, 6000, 1, 2560]
    - [51, 10859.7]
  - - [512, 32, 1, 512]
    - [27, 1316.79]
  - - [2560, 128, 1, 2560]
    - [39, 6985.94]
  - - [4608, 24000, 1, 1536]
    - [53, 12199.9]
  - - [512, 2, 1, 500000]
    - [11, 418.388]
  - - [7680, 48000, 1, 2560]
    - [53, 12370.6]
  - - [3072, 48000, 1, 1024]
    - [55, 12094.6]
  - - [1760, 16, 1, 1760]
    - [24, 2496.49]
  - - [512, 3000, 1, 2816]
    - [54, 10771.2]
  - - [1760, 7000, 1, 1760]
    - [54, 11550.1]
  - - [64, 193600, 1, 256]
    - [63, 6848.98]
  - - [1024, 3000, 1, 2048]
    - [51, 10459.6]
  - - [6144, 4, 1, 2560]
    - [40, 764.463]
  - - [1024, 6000, 1, 2048]
    - [52, 10876.1]
  - - [512, 24000, 1, 2816]
    - [54, 11924.1]
  - - [6144, 48000, 1, 2560]
    - [57, 12304.0]
  - - [8448, 3000, 1, 2816]
    - [53, 12148.4]
  - - [35, 1500, 1, 2560]
    - [12, 3188.65]
  - - [3072, 4, 1, 1024]
    - [24, 684.933]
  - - [4608, 48000, 1, 1536]
    - [55, 12193.9]
  - - [2048, 32, 1, 2048]
    - [33, 3846.88]
  - - [7680, 1500, 1, 2560]
    - [53, 11614.7]
  - - [4096, 128, 1, 4096]
    - [29, 8627.98]
  - - [4608, 16, 1, 1536]
    - [45, 2734.82]
  - - [1024, 1500, 1, 2048]
    - [52, 9397.19]
  - - [3072, 3000, 1, 1024]
    - [51, 10785.4]
  - - [3072, 2, 1, 1024]
    - [23, 339.73]
  - - [8448, 1, 1, 2816]
    - [5, 196.421]
  - - [1024, 48000, 1, 2560]
    - [54, 12233.3]
  - - [1024, 3000, 1, 2816]
    - [53, 11400.0]
  - - [128, 1, 1, 1408]
    - [41, 35.78]
  - - [35, 8457, 1, 1760]
    - [13, 4543.03]
  - - [1024, 2, 1, 512]
    - [41, 186.248]
  - - [1024, 4, 1, 500000]
    - [10, 837.841]
  - - [6144, 1, 1, 2560]
    - [37, 194.263]
  - - [1024, 48000, 1, 2816]
    - [55, 12233.8]
  - - [512, 48000, 1, 2816]
    - [54, 12244.1]
  - - [2048, 16, 1, 2048]
    - [24, 2468.51]
  - - [1024, 24000, 1, 1536]
    - [55, 11831.7]
  - - [64, 193600, 1, 64]
    - [61, 5523.72]
  - - [7680, 6000, 1, 2560]
    - [53, 12170.2]
  - - [1760, 128, 1, 1760]
    - [39, 6741.18]
  - - [35, 8457, 1, 2048]
    - [12, 3733.3]
  - - [512, 1500, 1, 2816]
    - [49, 9823.46]
  - - [512, 1, 1, 512]
    - [7, 53.6191]
  - - [512, 16, 1, 500000]
    - [2, 3202.49]
  - - [512, 8, 1, 500000]
    - [1, 1653.14]
  - - [512, 24000, 1, 2560]
    - [54, 11765.0]
  - - [6144, 3000, 1, 2560]
    - [55, 11833.1]
  - - [1024, 24000, 1, 2816]
    - [53, 12290.5]
  - - [2048, 7000, 1, 2048]
    - [55, 11580.0]
  - - [7680, 3000, 1, 2560]
    - [53, 11997.5]
  - - [1024, 4, 1, 512]
    - [41, 358.365]
  - - [5124, 700, 1, 2048]
    - [51, 9571.87]
  - - [5124, 9124, 1, 4096]
    - [55, 11638.8]
  - - [4096, 64, 1, 4096]
    - [29, 7955.56]
  - - [256, 193600, 1, 64]
    - [69, 8645.22]
  - - [512, 6000, 1, 2048]
    - [51, 8815.84]
  - - [7680, 32, 1, 2560]
    - [28, 5688.68]
  - - [2560, 64, 1, 2560]
    - [43, 6147.8]
  - - [3136, 2048, 1, 512]
    - [70, 10337.9]
  - - [3072, 128, 1, 1024]
    - [52, 5921.2]
  - - [8448, 6000, 1, 2816]
    - [53, 12299.5]
  - - [7680, 64, 1, 2560]
    - [29, 7610.37]
  - - [5124, 1500, 1, 2560]
    - [55, 10942.5]
  - - [1024, 1500, 1, 2560]
    - [51, 10486.4]
  - - [3025, 64, 64, 64]
    - [74, 5136.73]
  - - [512, 4, 1, 512]
    - [31, 208.175]
  - - [1024, 6000, 1, 2560]
    - [55, 11501.5]
  - - [3072, 32, 1, 1024]
    - [40, 3298.33]
  - - [35, 700, 1, 2560]
    - [15, 2654.2]
  - - [3136, 512, 1, 2048]
    - [72, 7606.42]
  - - [196, 1024, 64, 256]
    - [76, 8277.28]
  - - [512, 50176, 1, 128]
    - [67, 10872.1]
  - - [4608, 1, 1, 1536]
    - [40, 186.255]
  - - [49, 512, 64, 2048]
    - [77, 3386.82]
  - - [4096, 32, 1, 4096]
    - [44, 5180.5]
  - - [7680, 24000, 1, 2560]
    - [53, 12327.8]
  - - [8448, 4, 1, 2816]
    - [5, 752.543]
  - - [64, 1, 1, 1216]
    - [41, 14.5915]
  - - [512, 1, 1, 500000]
    - [8, 210.506]
  - - [176, 1500, 1, 1408]
    - [35, 5896.49]
  - - [512, 3000, 1, 1536]
    - [52, 9952.95]
  - - [8448, 24000, 1, 2816]
    - [57, 12305.2]
  - - [4608, 2, 1, 1536]
    - [26, 367.492]
  - - [1024, 48000, 1, 1536]
    - [55, 12167.9]
  - - [7680, 128, 1, 2560]
    - [51, 9801.7]
  - - [3072, 6000, 1, 1024]
    - [55, 11287.6]
  - - [3072, 1500, 1, 128]
    - [54, 8759.48]
  - - [2048, 3136, 1, 512]
    - [62, 10481.9]
  - - [3025, 256, 64, 64]
    - [71, 8181.09]
  - - [1024, 3000, 1, 1536]
    - [55, 10933.5]
  - - [512, 4, 1, 500000]
    - [6, 834.906]
  - - [35, 700, 1, 2048]
    - [17, 2136.74]
  - - [1024, 16, 1, 500000]
    - [9, 3235.94]
  - - [512, 24000, 1, 2048]
    - [52, 10783.3]
  - - [128, 50176, 1, 512]
    - [66, 8597.92]
  - - [1024, 32, 1, 512]
    - [37, 1935.76]
  - - [256, 12544, 1, 1024]
    - [64, 8450.61]
  - - [1024, 12544, 1, 256]
    - [68, 10877.5]
  - - [512, 48000, 1, 2560]
    - [54, 12154.8]
  - - [2560, 16, 1, 2560]
    - [32, 2753.94]
  - - [2048, 64, 1, 2048]
    - [25, 4870.64]
  - - [512, 2, 1, 512]
    - [30, 105.639]
  - - [1024, 1, 1, 512]
    - [19, 95.6381]
  - - [512, 1500, 1, 2560]
    - [50, 9058.44]
  - - [6144, 32, 1, 2560]
    - [35, 5295.81]
  - - [1024, 1, 1, 500000]
    - [3, 210.173]
  - - [6144, 16, 1, 2560]
    - [37, 3027.87]
  - - [1024, 24000, 1, 2048]
    - [52, 11578.8]
  - - [4096, 16, 1, 4096]
    - [37, 3091.95]
  - - [5124, 1500, 1, 2048]
    - [55, 10638.1]
  - - [3072, 1500, 1, 1024]
    - [51, 10315.6]
  - - [1024, 2, 1, 500000]
    - [0, 417.05]
  - - [1024, 8, 1, 500000]
    - [4, 1660.28]
  - - [7680, 16, 1, 2560]
    - [26, 3092.93]
  - - [6144, 1500, 1, 2560]
    - [55, 11660.0]
  - - [3072, 1, 1, 1024]
    - [42, 171.233]
  - - [512, 6000, 1, 2816]
    - [53, 11406.6]
  - - [8448, 2, 1, 2816]
    - [5, 386.693]
  - - [4608, 4, 1, 1536]
    - [26, 726.608]
  - - [1024, 6000, 1, 1536]
    - [55, 11299.1]
  - - [8448, 32, 1, 2816]
    - [25, 4940.74]
  - - [512, 3000, 1, 2048]
    - [58, 7988.32]
  - - [6144, 24000, 1, 2560]
    - [55, 12231.7]
  - - [512, 3000, 1, 2560]
    - [52, 10247.6]
  - - [4608, 6000, 1, 1536]
    - [53, 12064.2]
  - - [1024, 1024, 1, 1024]
    - [51, 8221.8]
  - - [512, 1500, 1, 2048]
    - [52, 7400.81]
  - - [512, 1500, 1, 1536]
    - [50, 8721.11]
  - - [128, 1, 1, 1024]
    - [41, 23.5932]
  - - [49, 2048, 64, 512]
    - [75, 4940.02]
  - - [1024, 48000, 1, 2048]
    - [55, 11819.9]
- - - -1
    - - - 128
        - - - 4
            - - [-1, 59]
          - - 128
            - - [4, 59]
              - [-1, 18]
          - - 448
            - - [4, 59]
              - [448, 18]
              - [-1, 46]
          - - 704
            - - [4, 59]
              - [128, 18]
              - [-1, 46]
          - - 1024
            - - [4, 59]
              - [128, 18]
              - [256, 47]
              - [448, 46]
              - [-1, 47]
          - - 2944
            - - [4, 59]
              - [128, 18]
              - [-1, 46]
          - - 3584
            - - [4, 59]
              - [64, 18]
              - [256, 46]
              - [448, 47]
              - [-1, 46]
          - - 4288
            - - [4, 59]
              - [128, 18]
              - [1024, 46]
              - [1408, 47]
              - [1856, 46]
              - [-1, 47]
          - - 5056
            - - [4, 59]
              - [64, 18]
              - [128, 46]
              - [-1, 47]
          - - 5888
            - - [4, 59]
              - [64, 18]
              - [256, 46]
              - [448, 47]
              - [704, 46]
              - [1408, 47]
              - [1856, 46]
              - [-1, 47]
          - - -1
            - - [4, 59]
              - [128, 46]
              - [-1, 47]
      - - 256
        - - - 4
            - - [128, 30]
              - [256, 27]
              - [704, 30]
              - [4288, 27]
              - [-1, 30]
          - - 64
            - - [4, 30]
              - [64, 24]
              - [448, 23]
              - [1408, 37]
              - [1856, 26]
              - [2368, 37]
              - [2944, 50]
              - [3584, 37]
              - [4288, 45]
              - [5056, 42]
              - [5888, 27]
              - [-1, 42]
          - - 128
            - - [64, 30]
              - [256, 23]
              - [448, 26]
              - [704, 37]
              - [1024, 26]
              - [1408, 50]
              - [1856, 49]
              - [2944, 50]
              - [5056, 49]
              - [-1, 51]
          - - 256
            - - [4, 30]
              - [64, 27]
              - [128, 23]
              - [448, 26]
              - [2368, 50]
              - [2944, 49]
              - [3584, 50]
              - [4288, 49]
              - [5888, 53]
              - [-1, 50]
          - - 448
            - - [4, 30]
              - [64, 23]
              - [128, 45]
              - [256, 37]
              - [1024, 50]
              - [1408, 49]
              - [2368, 50]
              - [2944, 49]
              - [5056, 50]
              - [5888, 49]
              - [-1, 50]
          - - 704
            - - [4, 30]
              - [64, 37]
              - [128, 45]
              - [448, 50]
              - [5056, 49]
              - [5888, 50]
              - [-1, 49]
          - - 1024
            - - [4, 27]
              - [64, 37]
              - [128, 50]
              - [256, 49]
              - [448, 50]
              - [1024, 49]
              - [1408, 53]
              - [1856, 49]
              - [2944, 53]
              - [3584, 52]
              - [4288, 49]
              - [5056, 54]
              - [-1, 53]
          - - 1408
            - - [4, 27]
              - [64, 26]
              - [448, 50]
              - [704, 51]
              - [1024, 54]
              - [1408, 55]
              - [1856, 52]
              - [2368, 49]
              - [-1, 53]
          - - 1856
            - - [4, 27]
              - [64, 26]
              - [128, 50]
              - [1408, 49]
              - [1856, 53]
              - [3584, 49]
              - [4288, 54]
              - [5056, 49]
              - [-1, 54]
          - - 2368
            - - [4, 30]
              - [128, 50]
              - [704, 49]
              - [1024, 53]
              - [1408, 50]
              - [1856, 49]
              - [2368, 53]
              - [-1, 54]
          - - 2944
            - - [4, 27]
              - [128, 50]
              - [256, 49]
              - [1408, 53]
              - [1856, 49]
              - [5056, 53]
              - [-1, 54]
          - - 3584
            - - [4, 27]
              - [128, 50]
              - [256, 52]
              - [448, 49]
              - [704, 53]
              - [1408, 54]
              - [1856, 53]
              - [2368, 54]
              - [-1, 53]
          - - 4288
            - - [4, 27]
              - [128, 50]
              - [448, 49]
              - [704, 53]
              - [1024, 49]
              - [-1, 53]
          - - 5056
            - - [4, 27]
              - [128, 50]
              - [448, 49]
              - [-1, 53]
          - - 5888
            - - [4, 27]
              - [64, 50]
              - [128, 49]
              - [256, 53]
              - [448, 49]
              - [704, 53]
              - [1024, 49]
              - [5056, 53]
              - [-1, 55]
          - - -1
            - - [4, 27]
              - [256, 49]
              - [448, 51]
              - [5056, 53]
              - [5888, 55]
              - [-1, 56]
      - - 1280
        - - - 4
            - - [128, 60]
              - [1856, 30]
              - [2368, 27]
              - [-1, 30]
          - - 64
            - - [4, 60]
              - [128, 19]
              - [256, 23]
              - [448, 38]
              - [704, 37]
              - [1024, 32]
              - [1408, 21]
              - [1856, 43]
              - [2368, 34]
              - [2944, 43]
              - [3584, 26]
              - [-1, 20]
          - - 128
            - - [4, 60]
              - [64, 19]
              - [128, 23]
              - [256, 37]
              - [448, 20]
              - [704, 21]
              - [1408, 43]
              - [1856, 39]
              - [2944, 43]
              - [3584, 50]
              - [4288, 43]
              - [5056, 50]
              - [5888, 49]
              - [-1, 50]
          - - 256
            - - [4, 60]
              - [64, 23]
              - [128, 37]
              - [256, 20]
              - [448, 34]
              - [1408, 50]
              - [2368, 49]
              - [2944, 50]
              - [3584, 52]
              - [5056, 49]
              - [5888, 53]
              - [-1, 50]
          - - 448
            - - [4, 60]
              - [64, 38]
              - [128, 20]
              - [448, 34]
              - [704, 49]
              - [1408, 50]
              - [1856, 49]
              - [2368, 50]
              - [2944, 54]
              - [5888, 50]
              - [-1, 48]
          - - 704
            - - [4, 60]
              - [128, 20]
              - [256, 50]
              - [448, 49]
              - [704, 50]
              - [1024, 49]
              - [2368, 50]
              - [5888, 48]
              - [-1, 53]
          - - 1024
            - - [4, 60]
              - [64, 40]
              - [128, 29]
              - [704, 49]
              - [1024, 51]
              - [1408, 53]
              - [1856, 57]
              - [-1, 53]
          - - 1408
            - - [4, 60]
              - [64, 20]
              - [128, 43]
              - [256, 49]
              - [448, 50]
              - [704, 52]
              - [1024, 53]
              - [1408, 55]
              - [1856, 54]
              - [2368, 49]
              - [4288, 53]
              - [-1, 54]
          - - 1856
            - - [4, 60]
              - [64, 34]
              - [256, 50]
              - [448, 51]
              - [704, 49]
              - [1024, 54]
              - [1408, 48]
              - [1856, 53]
              - [2944, 54]
              - [3584, 48]
              - [-1, 54]
          - - 2368
            - - [4, 27]
              - [64, 35]
              - [128, 20]
              - [448, 50]
              - [704, 49]
              - [1024, 54]
              - [1408, 49]
              - [-1, 54]
          - - 2944
            - - [4, 27]
              - [64, 43]
              - [256, 49]
              - [1856, 53]
              - [-1, 54]
          - - 3584
            - - [4, 27]
              - [128, 50]
              - [256, 51]
              - [448, 49]
              - [1856, 53]
              - [2944, 54]
              - [-1, 53]
          - - 4288
            - - [4, 60]
              - [64, 35]
              - [256, 49]
              - [448, 54]
              - [4288, 53]
              - [-1, 54]
          - - 5056
            - - [4, 60]
              - [64, 39]
              - [128, 50]
              - [448, 49]
              - [5056, 53]
              - [5888, 55]
              - [-1, 53]
          - - 5888
            - - [4, 30]
              - [64, 50]
              - [128, 49]
              - [256, 53]
              - [448, 49]
              - [-1, 53]
          - - -1
            - - [4, 30]
              - [64, 50]
              - [128, 51]
              - [256, 49]
              - [5888, 53]
              - [-1, 55]
      - - -1
        - - - 4
            - - [-1, 60]
          - - 64
            - - [4, 60]
              - [64, 41]
              - [256, 19]
              - [704, 38]
              - [1408, 20]
              - [1856, 25]
              - [2368, 35]
              - [2944, 43]
              - [3584, 20]
              - [-1, 25]
          - - 128
            - - [4, 60]
              - [128, 19]
              - [256, 38]
              - [704, 20]
              - [1408, 43]
              - [1856, 39]
              - [5056, 43]
              - [5888, 49]
              - [-1, 52]
          - - 256
            - - [4, 60]
              - [64, 30]
              - [256, 20]
              - [448, 36]
              - [1408, 50]
              - [1856, 49]
              - [2944, 50]
              - [3584, 51]
              - [5056, 50]
              - [5888, 54]
              - [-1, 50]
          - - 448
            - - [4, 60]
              - [64, 38]
              - [128, 20]
              - [448, 34]
              - [1408, 50]
              - [1856, 51]
              - [2368, 50]
              - [2944, 54]
              - [3584, 50]
              - [4288, 48]
              - [5888, 50]
              - [-1, 48]
          - - 704
            - - [4, 60]
              - [64, 38]
              - [128, 20]
              - [256, 49]
              - [1024, 50]
              - [1408, 48]
              - [2368, 50]
              - [5888, 48]
              - [-1, 54]
          - - 1024
            - - [4, 30]
              - [64, 20]
              - [128, 29]
              - [704, 49]
              - [1024, 51]
              - [5056, 53]
              - [-1, 54]
          - - 1408
            - - [4, 30]
              - [64, 20]
              - [128, 25]
              - [448, 50]
              - [704, 51]
              - [1024, 54]
              - [1408, 55]
              - [1856, 54]
              - [2944, 53]
              - [3584, 54]
              - [5056, 53]
              - [-1, 54]
          - - 1856
            - - [4, 30]
              - [64, 36]
              - [128, 39]
              - [256, 50]
              - [448, 51]
              - [704, 49]
              - [1024, 55]
              - [1408, 48]
              - [1856, 54]
              - [2368, 53]
              - [-1, 54]
          - - 2368
            - - [4, 27]
              - [64, 35]
              - [128, 25]
              - [704, 50]
              - [-1, 54]
          - - 2944
            - - [4, 27]
              - [64, 43]
              - [128, 35]
              - [256, 49]
              - [1024, 53]
              - [-1, 54]
          - - 3584
            - - [4, 27]
              - [64, 35]
              - [128, 50]
              - [256, 51]
              - [448, 49]
              - [1024, 54]
              - [1856, 53]
              - [3584, 54]
              - [4288, 53]
              - [5888, 54]
              - [-1, 53]
          - - 4288
            - - [4, 30]
              - [128, 35]
              - [256, 49]
              - [448, 54]
              - [704, 53]
              - [1024, 54]
              - [1408, 53]
              - [1856, 54]
              - [2944, 53]
              - [3584, 54]
              - [-1, 53]
          - - 5056
            - - [4, 60]
              - [64, 25]
              - [128, 29]
              - [448, 49]
              - [-1, 53]
          - - 5888
            - - [4, 30]
              - [64, 29]
              - [128, 49]
              - [256, 53]
              - [448, 49]
              - [-1, 53]
          - - -1
            - - [4, 30]
              - [64, 50]
              - [128, 51]
              - [256, 49]
              - [5888, 53]
              - [-1, 57]
