library/src/blas3/Tensile/Logic/asm_full/vega10_Cijk_Alik_Bljk_SB.yaml
- {MinimumRequiredVersion: 3.3.5}
- vega10
- ["Device 6863"]
- AssignedDerivedParameters: true
- - - [8448, 48000, 1, 2816]
    - [182, 9705.93]
  - - [2048, 7000, 1, 2048]
    - [164, 7599.46]
  - - [7680, 64, 1, 2560]
    - [85, 4799.79]
  - - [7680, 128, 1, 2560]
    - [17, 6007.58]
  - - [4096, 64, 1, 4096]
    - [123, 3816.51]
  - - [512, 24000, 1, 2048]
    - [173, 7863.36]
  - - [5124, 9124, 1, 2560]
    - [170, 8779.8]
  - - [1024, 48000, 1, 2560]
    - [164, 8696.23]
  - - [2048, 32, 1, 2048]
    - [13, 1821.0]
  - - [3072, 48000, 1, 1024]
    - [174, 8154.88]
  - - [5124, 9124, 1, 4096]
    - [170, 8375.08]
  - - [5124, 9124, 1, 1760]
    - [182, 10343.1]
  - - [4096, 32, 1, 4096]
    - [47, 2616.44]
  - - [512, 48000, 1, 2560]
    - [169, 8919.19]
  - - [1760, 64, 1, 1760]
    - [121, 3988.46]
  - - [512, 24000, 1, 1536]
    - [169, 8412.73]
  - - [4096, 128, 1, 4096]
    - [123, 4933.66]
  - - [4608, 24000, 1, 1536]
    - [182, 8756.04]
  - - [7680, 48000, 1, 2560]
    - [180, 9023.41]
  - - [8448, 16, 1, 2816]
    - [159, 1978.59]
  - - [4608, 16, 1, 1536]
    - [12, 1412.93]
  - - [6144, 24000, 1, 2560]
    - [174, 8752.91]
  - - [3072, 24000, 1, 1024]
    - [174, 8003.71]
  - - [2560, 64, 1, 2560]
    - [47, 3599.6]
  - - [1024, 16, 1, 500000]
    - [2, 2851.69]
  - - [3072, 16, 1, 1024]
    - [47, 741.769]
  - - [3072, 128, 1, 1024]
    - [5, 2759.22]
  - - [2560, 7000, 1, 2560]
    - [170, 8687.13]
  - - [8448, 24000, 1, 2816]
    - [180, 9696.75]
  - - [512, 48000, 1, 2048]
    - [169, 8213.05]
  - - [2048, 64, 1, 2048]
    - [157, 2455.13]
  - - [512, 24000, 1, 2816]
    - [180, 9385.52]
  - - [2560, 128, 1, 2560]
    - [123, 4738.2]
  - - [2560, 16, 1, 2560]
    - [79, 1415.53]
  - - [6144, 48000, 1, 2560]
    - [180, 8842.54]
  - - [1024, 24000, 1, 2048]
    - [164, 7850.0]
  - - [1760, 7000, 1, 1760]
    - [182, 9704.74]
  - - [4096, 16, 1, 4096]
    - [48, 1417.2]
  - - [512, 48000, 1, 1536]
    - [164, 8566.75]
  - - [35, 8457, 1, 2048]
    - [88, 2838.52]
  - - [6144, 32, 1, 2560]
    - [7, 3188.44]
  - - [8448, 32, 1, 2816]
    - [5, 3764.4]
  - - [1024, 8, 1, 500000]
    - [1, 1460.07]
  - - [7680, 16, 1, 2560]
    - [48, 1791.82]
  - - [1024, 24000, 1, 2560]
    - [173, 8730.15]
  - - [1760, 16, 1, 1760]
    - [10, 1552.34]
  - - [5124, 9124, 1, 2048]
    - [166, 8341.08]
  - - [35, 8457, 1, 1760]
    - [118, 3240.85]
  - - [1024, 700, 1, 512]
    - [167, 3867.59]
  - - [2560, 32, 1, 2560]
    - [157, 2541.36]
  - - [1760, 32, 1, 1760]
    - [4, 2811.21]
  - - [6144, 16, 1, 2560]
    - [7, 1743.99]
  - - [7680, 24000, 1, 2560]
    - [182, 8874.43]
  - - [4096, 7000, 1, 4096]
    - [164, 8132.0]
  - - [3072, 32, 1, 1024]
    - [13, 1600.61]
  - - [4608, 32, 1, 1536]
    - [157, 2588.96]
  - - [35, 8457, 1, 2560]
    - [88, 3221.83]
  - - [4608, 48000, 1, 1536]
    - [182, 8873.79]
  - - [1024, 48000, 1, 2816]
    - [180, 9840.25]
  - - [3072, 64, 1, 1024]
    - [157, 2276.24]
  - - [512, 48000, 1, 2816]
    - [182, 9574.13]
  - - [2048, 16, 1, 2048]
    - [3, 1044.92]
  - - [1024, 24000, 1, 1536]
    - [164, 8478.8]
  - - [1024, 48000, 1, 1536]
    - [173, 8410.58]
  - - [1760, 128, 1, 1760]
    - [17, 5273.39]
  - - [2048, 128, 1, 2048]
    - [11, 3119.91]
  - - [35, 8457, 1, 4096]
    - [88, 3179.89]
  - - [512, 8, 1, 500000]
    - [0, 1480.44]
  - - [512, 24000, 1, 2560]
    - [164, 8648.89]
  - - [7680, 32, 1, 2560]
    - [4, 3284.31]
  - - [1024, 48000, 1, 2048]
    - [164, 8098.56]
  - - [512, 16, 1, 500000]
    - [0, 2876.32]
  - - [1024, 24000, 1, 2816]
    - [180, 9318.59]
- - - -1
    - - - -1
        - - - 4
            - - [-1, 62]
          - - 64
            - - [4, 206]
              - [64, 51]
              - [128, 62]
              - [256, 71]
              - [704, 6]
              - [1024, 4]
              - [1408, 88]
              - [1856, 118]
              - [2368, 88]
              - [2944, 121]
              - [3584, 118]
              - [4288, 88]
              - [5888, 121]
              - [-1, 169]
          - - 128
            - - [4, 206]
              - [64, 62]
              - [256, 6]
              - [448, 119]
              - [704, 88]
              - [1024, 121]
              - [1856, 118]
              - [2368, 121]
              - [2944, 118]
              - [3584, 169]
              - [4288, 121]
              - [5888, 169]
              - [-1, 164]
          - - 256
            - - [4, 206]
              - [64, 159]
              - [128, 8]
              - [256, 85]
              - [448, 121]
              - [1024, 169]
              - [1408, 166]
              - [2944, 169]
              - [3584, 164]
              - [4288, 169]
              - [5056, 166]
              - [5888, 164]
              - [-1, 166]
          - - 448
            - - [4, 206]
              - [64, 8]
              - [256, 119]
              - [448, 14]
              - [704, 169]
              - [1024, 166]
              - [1408, 169]
              - [1856, 164]
              - [2368, 166]
              - [2944, 173]
              - [3584, 166]
              - [4288, 167]
              - [5056, 169]
              - [5888, 182]
              - [-1, 167]
          - - 704
            - - [4, 206]
              - [64, 119]
              - [128, 85]
              - [256, 169]
              - [704, 166]
              - [1024, 169]
              - [1408, 167]
              - [2368, 166]
              - [2944, 167]
              - [3584, 164]
              - [5056, 167]
              - [5888, 164]
              - [-1, 182]
          - - 1024
            - - [4, 62]
              - [64, 4]
              - [128, 121]
              - [256, 166]
              - [704, 169]
              - [1408, 164]
              - [1856, 182]
              - [2368, 164]
              - [2944, 182]
              - [3584, 173]
              - [4288, 169]
              - [-1, 182]
          - - 1408
            - - [4, 210]
              - [64, 85]
              - [128, 118]
              - [448, 166]
              - [704, 170]
              - [1024, 173]
              - [1408, 182]
              - [1856, 173]
              - [2368, 166]
              - [-1, 182]
          - - 1856
            - - [4, 12]
              - [64, 118]
              - [128, 123]
              - [256, 166]
              - [448, 167]
              - [704, 166]
              - [1024, 182]
              - [1408, 167]
              - [1856, 173]
              - [2368, 166]
              - [2944, 170]
              - [-1, 182]
          - - 2368
            - - [4, 206]
              - [64, 85]
              - [128, 118]
              - [448, 166]
              - [704, 169]
              - [1024, 170]
              - [1408, 169]
              - [1856, 166]
              - [2368, 173]
              - [3584, 182]
              - [4288, 173]
              - [-1, 182]
          - - 2944
            - - [4, 62]
              - [128, 118]
              - [256, 166]
              - [448, 164]
              - [704, 173]
              - [1408, 182]
              - [1856, 167]
              - [-1, 182]
          - - 3584
            - - [4, 62]
              - [64, 85]
              - [128, 166]
              - [256, 164]
              - [448, 166]
              - [704, 173]
              - [1024, 167]
              - [-1, 182]
          - - 4288
            - - [4, 62]
              - [64, 85]
              - [128, 123]
              - [256, 166]
              - [448, 170]
              - [704, 173]
              - [1024, 166]
              - [1856, 182]
              - [2368, 170]
              - [-1, 182]
          - - 5056
            - - [4, 62]
              - [64, 118]
              - [448, 166]
              - [704, 170]
              - [-1, 182]
          - - 5888
            - - [4, 12]
              - [64, 118]
              - [128, 166]
              - [256, 167]
              - [448, 166]
              - [704, 170]
              - [-1, 182]
          - - -1
            - - [4, 9]
              - [64, 169]
              - [128, 170]
              - [256, 166]
              - [448, 170]
              - [-1, 182]
