library/src/blas3/Tensile/Logic/asm_full/vega10_Cijk_Ailk_Bljk_SB.yaml
- {MinimumRequiredVersion: 3.6.0}
- vega10
- gfx900
- [Device 6863, Device 6862, Device 687f]
- - - [4096, 7000, 1, 4096]
    - [52, 11467.3]
  - - [5124, 9124, 1, 1760]
    - [54, 11436.4]
  - - [5124, 9124, 1, 2560]
    - [52, 11187.5]
  - - [1760, 32, 1, 1760]
    - [34, 2953.92]
  - - [1024, 1500, 1, 1536]
    - [50, 9157.41]
  - - [512, 24000, 1, 1536]
    - [52, 10877.6]
  - - [3072, 24000, 1, 1024]
    - [52, 11125.0]
  - - [1024, 3000, 1, 2560]
    - [55, 10521.8]
  - - [512, 3136, 1, 2048]
    - [64, 467292.0]
  - - [7680, 4, 1, 2560]
    - [21, 548.939]
  - - [35, 1500, 1, 2048]
    - [27, 2041.45]
  - - [8448, 1500, 1, 2816]
    - [54, 11385.6]
  - - [784, 512, 64, 128]
    - [69, 7078.78]
  - - [2560, 7000, 1, 2560]
    - [55, 11108.0]
  - - [3072, 16, 1, 1024]
    - [28, 1606.29]
  - - [512, 48000, 1, 2048]
    - [53, 10462.0]
  - - [1760, 64, 1, 1760]
    - [35, 4883.64]
  - - [1024, 16, 1, 512]
    - [31, 658.395]
  - - [196, 256, 64, 1024]
    - [68, 5954.53]
  - - [512, 48000, 1, 1536]
    - [52, 11322.7]
  - - [2560, 32, 1, 2560]
    - [24, 3552.15]
  - - [4608, 1500, 1, 1536]
    - [52, 10269.6]
  - - [2048, 128, 1, 2048]
    - [29, 6221.06]
  - - [1024, 24000, 1, 2560]
    - [52, 11303.9]
  - - [4608, 3000, 1, 1536]
    - [54, 10786.3]
  - - [5124, 9124, 1, 2048]
    - [52, 10118.0]
  - - [1024, 700, 1, 512]
    - [47, 5675.12]
  - - [3072, 1, 1, 128]
    - [20, 34.923]
  - - [5124, 700, 1, 2560]
    - [47, 9935.54]
  - - [8448, 16, 1, 2816]
    - [37, 2087.93]
  - - [6144, 6000, 1, 2560]
    - [52, 11492.7]
  - - [4608, 32, 1, 1536]
    - [37, 3273.6]
  - - [35, 8457, 1, 2560]
    - [11, 3671.66]
  - - [3072, 64, 1, 1024]
    - [29, 3990.93]
  - - [512, 16, 1, 512]
    - [23, 393.204]
  - - [7680, 2, 1, 2560]
    - [25, 275.039]
  - - [4224, 1, 1, 128]
    - [43, 42.936]
  - - [7680, 1, 1, 2560]
    - [21, 137.662]
  - - [128, 1500, 1, 1280]
    - [22, 4829.19]
  - - [35, 8457, 1, 4096]
    - [12, 3338.12]
  - - [1024, 1500, 1, 2816]
    - [54, 10125.0]
  - - [6144, 2, 1, 2560]
    - [41, 264.586]
  - - [8448, 48000, 1, 2816]
    - [57, 12029.3]
  - - [512, 6000, 1, 1536]
    - [50, 9772.77]
  - - [4224, 1500, 1, 176]
    - [47, 6979.07]
  - - [1024, 6000, 1, 2816]
    - [52, 11063.6]
  - - [512, 6000, 1, 2560]
    - [55, 10385.9]
  - - [512, 32, 1, 512]
    - [31, 735.359]
  - - [2560, 128, 1, 2560]
    - [38, 6456.25]
  - - [4608, 24000, 1, 1536]
    - [55, 11404.8]
  - - [512, 2, 1, 500000]
    - [10, 309.861]
  - - [7680, 48000, 1, 2560]
    - [52, 11950.5]
  - - [3072, 48000, 1, 1024]
    - [52, 11251.1]
  - - [1760, 16, 1, 1760]
    - [21, 1600.62]
  - - [512, 3000, 1, 2816]
    - [51, 10179.7]
  - - [1760, 7000, 1, 1760]
    - [51, 11041.6]
  - - [64, 193600, 1, 256]
    - [60, 303680.0]
  - - [1024, 3000, 1, 2048]
    - [53, 9393.05]
  - - [6144, 4, 1, 2560]
    - [24, 524.594]
  - - [1024, 6000, 1, 2048]
    - [53, 9255.37]
  - - [512, 24000, 1, 2816]
    - [52, 11435.4]
  - - [6144, 48000, 1, 2560]
    - [52, 11888.9]
  - - [8448, 3000, 1, 2816]
    - [54, 11466.7]
  - - [35, 1500, 1, 2560]
    - [13, 2495.66]
  - - [3072, 4, 1, 1024]
    - [20, 427.874]
  - - [4608, 48000, 1, 1536]
    - [55, 11486.0]
  - - [2048, 32, 1, 2048]
    - [37, 3070.99]
  - - [7680, 1500, 1, 2560]
    - [54, 11107.6]
  - - [4096, 128, 1, 4096]
    - [50, 7759.65]
  - - [4608, 16, 1, 1536]
    - [43, 1866.64]
  - - [1024, 1500, 1, 2048]
    - [53, 8783.04]
  - - [3072, 3000, 1, 1024]
    - [52, 9694.68]
  - - [3072, 2, 1, 1024]
    - [20, 209.708]
  - - [8448, 1, 1, 2816]
    - [40, 137.478]
  - - [1024, 48000, 1, 2560]
    - [52, 11590.1]
  - - [1024, 3000, 1, 2816]
    - [54, 10645.5]
  - - [128, 1, 1, 1408]
    - [40, 16.6643]
  - - [35, 8457, 1, 1760]
    - [16, 3872.6]
  - - [1024, 2, 1, 512]
    - [23, 86.8458]
  - - [1024, 4, 1, 500000]
    - [4, 598.616]
  - - [6144, 1, 1, 2560]
    - [42, 132.706]
  - - [1024, 48000, 1, 2816]
    - [52, 11823.1]
  - - [512, 48000, 1, 2816]
    - [54, 11695.7]
  - - [2048, 16, 1, 2048]
    - [32, 1776.35]
  - - [1024, 24000, 1, 1536]
    - [52, 11058.8]
  - - [64, 193600, 1, 64]
    - [60, 84961.2]
  - - [7680, 6000, 1, 2560]
    - [52, 11623.0]
  - - [1760, 128, 1, 1760]
    - [38, 6082.39]
  - - [35, 8457, 1, 2048]
    - [11, 3136.61]
  - - [512, 1500, 1, 2816]
    - [47, 9327.58]
  - - [512, 1, 1, 512]
    - [17, 25.2779]
  - - [512, 16, 1, 500000]
    - [1, 2319.29]
  - - [512, 8, 1, 500000]
    - [10, 1172.68]
  - - [512, 24000, 1, 2560]
    - [52, 11061.4]
  - - [6144, 3000, 1, 2560]
    - [52, 11265.4]
  - - [1024, 24000, 1, 2816]
    - [52, 11523.0]
  - - [2048, 7000, 1, 2048]
    - [52, 10884.5]
  - - [7680, 3000, 1, 2560]
    - [55, 11207.6]
  - - [1024, 4, 1, 512]
    - [32, 172.626]
  - - [5124, 700, 1, 2048]
    - [50, 8447.44]
  - - [5124, 9124, 1, 4096]
    - [56, 9685.72]
  - - [4096, 64, 1, 4096]
    - [29, 6866.43]
  - - [512, 6000, 1, 2048]
    - [53, 7626.79]
  - - [7680, 32, 1, 2560]
    - [30, 3942.98]
  - - [2560, 64, 1, 2560]
    - [38, 4915.05]
  - - [3072, 128, 1, 1024]
    - [47, 4955.0]
  - - [8448, 6000, 1, 2816]
    - [52, 11754.0]
  - - [7680, 64, 1, 2560]
    - [30, 6830.08]
  - - [5124, 1500, 1, 2560]
    - [52, 10385.5]
  - - [1024, 1500, 1, 2560]
    - [50, 9607.68]
  - - [3025, 64, 64, 64]
    - [66, 2924.85]
  - - [512, 4, 1, 512]
    - [23, 98.3009]
  - - [1024, 6000, 1, 2560]
    - [52, 10910.0]
  - - [3072, 32, 1, 1024]
    - [37, 2685.57]
  - - [35, 700, 1, 2560]
    - [14, 1924.31]
  - - [196, 1024, 64, 256]
    - [59, 7019.46]
  - - [512, 50176, 1, 128]
    - [65, 228817.0]
  - - [4608, 1, 1, 1536]
    - [7, 125.556]
  - - [49, 512, 64, 2048]
    - [67, 3411.81]
  - - [4096, 32, 1, 4096]
    - [26, 3722.4]
  - - [7680, 24000, 1, 2560]
    - [52, 11858.4]
  - - [8448, 4, 1, 2816]
    - [44, 548.738]
  - - [64, 1, 1, 1216]
    - [40, 7.45119]
  - - [512, 1, 1, 500000]
    - [10, 157.853]
  - - [176, 1500, 1, 1408]
    - [18, 5078.9]
  - - [512, 3000, 1, 1536]
    - [50, 8999.57]
  - - [8448, 24000, 1, 2816]
    - [57, 11929.9]
  - - [4608, 2, 1, 1536]
    - [7, 251.444]
  - - [1024, 48000, 1, 1536]
    - [52, 11114.2]
  - - [7680, 128, 1, 2560]
    - [50, 8951.97]
  - - [3072, 6000, 1, 1024]
    - [52, 10351.7]
  - - [3072, 1500, 1, 128]
    - [45, 5042.65]
  - - [2048, 3136, 1, 512]
    - [62, 382698.0]
  - - [3025, 256, 64, 64]
    - [61, 4019.51]
  - - [1024, 3000, 1, 1536]
    - [55, 9849.84]
  - - [512, 4, 1, 500000]
    - [5, 600.11]
  - - [35, 700, 1, 2048]
    - [15, 1423.01]
  - - [1024, 16, 1, 500000]
    - [3, 2299.28]
  - - [512, 24000, 1, 2048]
    - [53, 9462.38]
  - - [128, 50176, 1, 512]
    - [64, 389382.0]
  - - [1024, 32, 1, 512]
    - [21, 1179.58]
  - - [256, 193600, 1, 64]
    - [65, 146142.0]
  - - [1024, 12544, 1, 256]
    - [63, 314839.0]
  - - [512, 48000, 1, 2560]
    - [51, 11382.8]
  - - [2560, 16, 1, 2560]
    - [36, 1865.0]
  - - [2048, 64, 1, 2048]
    - [35, 4258.24]
  - - [512, 2, 1, 512]
    - [8, 49.8444]
  - - [1024, 1, 1, 512]
    - [31, 43.9599]
  - - [512, 1500, 1, 2560]
    - [47, 8750.81]
  - - [6144, 32, 1, 2560]
    - [30, 3849.62]
  - - [1024, 1, 1, 500000]
    - [6, 150.116]
  - - [6144, 16, 1, 2560]
    - [42, 2075.3]
  - - [1024, 24000, 1, 2048]
    - [52, 10038.0]
  - - [4096, 16, 1, 4096]
    - [33, 2050.8]
  - - [5124, 1500, 1, 2048]
    - [52, 9765.87]
  - - [3072, 1500, 1, 1024]
    - [50, 8923.92]
  - - [1024, 2, 1, 500000]
    - [9, 300.839]
  - - [1024, 8, 1, 500000]
    - [0, 1181.15]
  - - [7680, 16, 1, 2560]
    - [39, 2140.42]
  - - [6144, 1500, 1, 2560]
    - [55, 11038.1]
  - - [3072, 1, 1, 1024]
    - [20, 105.376]
  - - [512, 6000, 1, 2816]
    - [52, 10727.7]
  - - [8448, 2, 1, 2816]
    - [44, 275.428]
  - - [4608, 4, 1, 1536]
    - [2, 493.787]
  - - [1024, 6000, 1, 1536]
    - [55, 10343.3]
  - - [8448, 32, 1, 2816]
    - [19, 3940.47]
  - - [512, 3000, 1, 2048]
    - [55, 7272.81]
  - - [6144, 24000, 1, 2560]
    - [52, 11828.6]
  - - [512, 3000, 1, 2560]
    - [53, 9784.78]
  - - [4608, 6000, 1, 1536]
    - [55, 11087.7]
  - - [256, 12544, 1, 1024]
    - [64, 435224.0]
  - - [512, 1500, 1, 2048]
    - [53, 6844.94]
  - - [512, 1500, 1, 1536]
    - [49, 7950.45]
  - - [128, 1, 1, 1024]
    - [40, 12.5494]
  - - [49, 2048, 64, 512]
    - [67, 4435.12]
  - - [1024, 48000, 1, 2048]
    - [52, 10242.7]
- - - -1
    - - - -1
        - - - 4
            - - [448, 58]
              - [1856, 31]
              - [2368, 28]
              - [3584, 31]
              - [4288, 58]
              - [5056, 31]
              - [-1, 28]
          - - 64
            - - [4, 58]
              - [128, 40]
              - [256, 17]
              - [448, 44]
              - [1408, 18]
              - [1856, 22]
              - [2944, 18]
              - [3584, 38]
              - [4288, 19]
              - [5888, 22]
              - [-1, 47]
          - - 128
            - - [4, 58]
              - [64, 40]
              - [128, 17]
              - [256, 25]
              - [448, 19]
              - [704, 18]
              - [1408, 22]
              - [1856, 38]
              - [2368, 22]
              - [2944, 38]
              - [3584, 49]
              - [5056, 38]
              - [5888, 49]
              - [-1, 38]
          - - 256
            - - [4, 58]
              - [64, 17]
              - [128, 25]
              - [256, 19]
              - [448, 22]
              - [5056, 49]
              - [5888, 51]
              - [-1, 49]
          - - 448
            - - [4, 58]
              - [64, 25]
              - [128, 18]
              - [256, 35]
              - [448, 38]
              - [1408, 49]
              - [1856, 51]
              - [2368, 49]
              - [2944, 54]
              - [3584, 47]
              - [4288, 46]
              - [5056, 49]
              - [5888, 47]
              - [-1, 46]
          - - 704
            - - [4, 58]
              - [64, 18]
              - [128, 19]
              - [256, 49]
              - [1024, 47]
              - [1408, 49]
              - [2368, 47]
              - [5888, 46]
              - [-1, 51]
          - - 1024
            - - [4, 31]
              - [64, 18]
              - [128, 30]
              - [448, 47]
              - [704, 49]
              - [1024, 50]
              - [1408, 54]
              - [1856, 55]
              - [2368, 54]
              - [2944, 55]
              - [5888, 54]
              - [-1, 57]
          - - 1408
            - - [4, 58]
              - [64, 19]
              - [128, 38]
              - [448, 49]
              - [704, 53]
              - [1024, 51]
              - [1408, 54]
              - [1856, 51]
              - [2368, 47]
              - [3584, 46]
              - [4288, 57]
              - [5056, 52]
              - [5888, 57]
              - [-1, 46]
          - - 1856
            - - [4, 58]
              - [64, 35]
              - [128, 38]
              - [256, 49]
              - [448, 53]
              - [704, 47]
              - [1024, 51]
              - [1408, 46]
              - [1856, 54]
              - [2944, 51]
              - [3584, 46]
              - [5056, 51]
              - [5888, 46]
              - [-1, 51]
          - - 2368
            - - [4, 58]
              - [64, 19]
              - [128, 38]
              - [704, 47]
              - [1024, 54]
              - [2944, 51]
              - [5056, 54]
              - [-1, 46]
          - - 2944
            - - [4, 58]
              - [64, 19]
              - [128, 30]
              - [256, 47]
              - [448, 54]
              - [1024, 51]
              - [-1, 46]
          - - 3584
            - - [4, 28]
              - [64, 30]
              - [128, 47]
              - [256, 51]
              - [448, 47]
              - [704, 51]
              - [-1, 54]
          - - 4288
            - - [4, 31]
              - [64, 19]
              - [128, 38]
              - [256, 47]
              - [5888, 54]
              - [-1, 48]
          - - 5056
            - - [4, 58]
              - [64, 19]
              - [128, 38]
              - [448, 47]
              - [5056, 54]
              - [5888, 48]
              - [-1, 46]
          - - 5888
            - - [4, 42]
              - [128, 47]
              - [256, 46]
              - [448, 47]
              - [1024, 54]
              - [1408, 55]
              - [2368, 54]
              - [2944, 55]
              - [-1, 54]
          - - -1
            - - [4, 42]
              - [64, 49]
              - [128, 38]
              - [256, 47]
              - [448, 54]
              - [704, 48]
              - [1024, 55]
              - [1856, 48]
              - [2368, 54]
              - [3584, 46]
              - [5056, 54]
              - [5888, 46]
              - [-1, 57]
