library/src/blas3/Tensile/Logic/asm_full/vega20_Cijk_Ailk_Bljk_DB.yaml
- {MinimumRequiredVersion: 4.6.0}
- vega20
- gfx906
- [Device 66a0, Device 66a1, Device 66a7]
    SolutionIndex: 0
    SolutionNameMin: Cijk_Ailk_Bljk_DB_MT064x064x08_NLCA01_TT04_04_WG16_16_01
    SolutionIndex: 1
    SolutionNameMin: Cijk_Ailk_Bljk_DB_MT064x064x04_NLCA01_TT04_04_WG16_16_01
    SolutionIndex: 2
    SolutionNameMin: Cijk_Ailk_Bljk_DB_MT064x032x08_NLCA01_TT04_04_WG16_08_01
    SolutionIndex: 3
    SolutionNameMin: Cijk_Ailk_Bljk_DB_MT096x032x08_NLCA03_TT06_04_WG16_08_01
    SolutionIndex: 4
    SolutionNameMin: Cijk_Ailk_Bljk_DB_MT064x064x08_NLCA01_TT04_04_WG16_16_01
- - - [4296, 4296, 1, 384]
    - [3, 4618.24]
  - - [6600, 6600, 1, 384]
    - [3, 4682.41]
  - - [35784, 35784, 1, 384]
    - [3, 4686.42]
  - - [20424, 20424, 1, 384]
    - [3, 4687.12]
  - - [22728, 22728, 1, 384]
    - [3, 4690.02]
  - - [3912, 3912, 1, 384]
    - [3, 4576.4]
  - - [10056, 10056, 1, 384]
    - [3, 4716.34]
  - - [31176, 31176, 1, 384]
    - [3, 4692.56]
  - - [10824, 10824, 1, 384]
    - [3, 4720.26]
  - - [31560, 31560, 1, 384]
    - [3, 4690.49]
  - - [43848, 43848, 1, 384]
    - [3, 4690.09]
  - - [456, 456, 1, 384]
    - [4, 2331.99]
  - - [9672, 9672, 1, 384]
    - [3, 4716.47]
  - - [72, 72, 1, 384]
    - [2, 60.7648]
  - - [18504, 18504, 1, 384]
    - [3, 4692.03]
  - - [25800, 25800, 1, 384]
    - [3, 4688.27]
  - - [36552, 36552, 1, 384]
    - [3, 4687.05]
  - - [6216, 6216, 1, 384]
    - [3, 4669.63]
  - - [13896, 13896, 1, 384]
    - [3, 4688.88]
  - - [11592, 11592, 1, 384]
    - [3, 4676.65]
  - - [19272, 19272, 1, 384]
    - [3, 4686.89]
  - - [12360, 12360, 1, 384]
    - [3, 4681.11]
  - - [840, 840, 1, 384]
    - [3, 3924.56]
  - - [5064, 5064, 1, 384]
    - [3, 4646.73]
  - - [10440, 10440, 1, 384]
    - [3, 4717.52]
  - - [37704, 37704, 1, 384]
    - [3, 4586.16]
  - - [26568, 26568, 1, 384]
    - [3, 4684.87]
  - - [36936, 36936, 1, 384]
    - [3, 4684.53]
  - - [29256, 29256, 1, 384]
    - [3, 4688.5]
  - - [40008, 40008, 1, 384]
    - [3, 4688.98]
  - - [3528, 3528, 1, 384]
    - [3, 4536.25]
  - - [37320, 37320, 1, 384]
    - [3, 4685.91]
  - - [2376, 2376, 1, 384]
    - [3, 4433.19]
  - - [22344, 22344, 1, 384]
    - [3, 4684.51]
  - - [28488, 28488, 1, 384]
    - [3, 4690.97]
  - - [29640, 29640, 1, 384]
    - [3, 4689.62]
  - - [39240, 39240, 1, 384]
    - [3, 4695.0]
  - - [12744, 12744, 1, 384]
    - [3, 4677.53]
  - - [15432, 15432, 1, 384]
    - [3, 4688.66]
  - - [18120, 18120, 1, 384]
    - [3, 4689.66]
  - - [38088, 38088, 1, 384]
    - [3, 4687.02]
  - - [35016, 35016, 1, 384]
    - [3, 4687.75]
  - - [44232, 44232, 1, 384]
    - [3, 4688.49]
  - - [9288, 9288, 1, 384]
    - [3, 4710.81]
  - - [16968, 16968, 1, 384]
    - [3, 4690.6]
  - - [20040, 20040, 1, 384]
    - [3, 4692.05]
  - - [1992, 1992, 1, 384]
    - [3, 4244.87]
  - - [16584, 16584, 1, 384]
    - [3, 4690.54]
  - - [40776, 40776, 1, 384]
    - [3, 4689.26]
  - - [1608, 1608, 1, 384]
    - [3, 3974.13]
  - - [20808, 20808, 1, 384]
    - [3, 4690.72]
  - - [43464, 43464, 1, 384]
    - [3, 4689.78]
  - - [13512, 13512, 1, 384]
    - [3, 4686.29]
  - - [33864, 33864, 1, 384]
    - [3, 4690.79]
  - - [8136, 8136, 1, 384]
    - [3, 4700.87]
  - - [33096, 33096, 1, 384]
    - [3, 4692.27]
  - - [23496, 23496, 1, 384]
    - [3, 4691.4]
  - - [42696, 42696, 1, 384]
    - [3, 4689.79]
  - - [6984, 6984, 1, 384]
    - [3, 4682.58]
  - - [32712, 32712, 1, 384]
    - [3, 4689.63]
  - - [13128, 13128, 1, 384]
    - [3, 4680.75]
  - - [21960, 21960, 1, 384]
    - [3, 4693.01]
  - - [3144, 3144, 1, 384]
    - [3, 4519.39]
  - - [44616, 44616, 1, 384]
    - [3, 4693.05]
  - - [25032, 25032, 1, 384]
    - [3, 4688.5]
  - - [28872, 28872, 1, 384]
    - [3, 4687.1]
  - - [2760, 2760, 1, 384]
    - [3, 4495.55]
  - - [25416, 25416, 1, 384]
    - [3, 4684.41]
  - - [34632, 34632, 1, 384]
    - [3, 4689.77]
  - - [39624, 39624, 1, 384]
    - [3, 4690.33]
  - - [30792, 30792, 1, 384]
    - [3, 4691.78]
  - - [18888, 18888, 1, 384]
    - [3, 4685.37]
  - - [24264, 24264, 1, 384]
    - [3, 4691.3]
  - - [34248, 34248, 1, 384]
    - [3, 4685.22]
  - - [5832, 5832, 1, 384]
    - [3, 4666.21]
  - - [33480, 33480, 1, 384]
    - [3, 4689.29]
  - - [5448, 5448, 1, 384]
    - [3, 4648.44]
  - - [32328, 32328, 1, 384]
    - [3, 4688.23]
  - - [7752, 7752, 1, 384]
    - [3, 4700.25]
  - - [23880, 23880, 1, 384]
    - [3, 4686.83]
  - - [1224, 1224, 1, 384]
    - [3, 4271.61]
  - - [35400, 35400, 1, 384]
    - [3, 4688.97]
  - - [42312, 42312, 1, 384]
    - [3, 4690.33]
  - - [41544, 41544, 1, 384]
    - [3, 4687.85]
  - - [43080, 43080, 1, 384]
    - [3, 4688.36]
  - - [21576, 21576, 1, 384]
    - [3, 4692.03]
  - - [8904, 8904, 1, 384]
    - [3, 4707.11]
  - - [41928, 41928, 1, 384]
    - [3, 4690.97]
  - - [7368, 7368, 1, 384]
    - [3, 4692.43]
  - - [31944, 31944, 1, 384]
    - [3, 4689.98]
  - - [26952, 26952, 1, 384]
    - [3, 4692.61]
  - - [15816, 15816, 1, 384]
    - [3, 4692.7]
  - - [8520, 8520, 1, 384]
    - [3, 4707.88]
  - - [41160, 41160, 1, 384]
    - [3, 4691.53]
  - - [19656, 19656, 1, 384]
    - [3, 4686.32]
  - - [14664, 14664, 1, 384]
    - [3, 4684.04]
  - - [30408, 30408, 1, 384]
    - [3, 4692.09]
  - - [24648, 24648, 1, 384]
    - [3, 4686.71]
  - - [38856, 38856, 1, 384]
    - [3, 4691.13]
  - - [17352, 17352, 1, 384]
    - [4, 4414.96]
  - - [38472, 38472, 1, 384]
    - [3, 4685.59]
  - - [36168, 36168, 1, 384]
    - [3, 4687.53]
  - - [45000, 45000, 1, 384]
    - [3, 4691.59]
  - - [21192, 21192, 1, 384]
    - [3, 4683.79]
  - - [27336, 27336, 1, 384]
    - [3, 4690.18]
  - - [16200, 16200, 1, 384]
    - [3, 4689.44]
  - - [40392, 40392, 1, 384]
    - [3, 4688.23]
  - - [11976, 11976, 1, 384]
    - [3, 4679.17]
  - - [11208, 11208, 1, 384]
    - [3, 4686.62]
  - - [17736, 17736, 1, 384]
    - [3, 4686.95]
  - - [15048, 15048, 1, 384]
    - [3, 4686.69]
  - - [26184, 26184, 1, 384]
    - [3, 4686.43]
  - - [23112, 23112, 1, 384]
    - [3, 4692.3]
  - - [30024, 30024, 1, 384]
    - [3, 4688.87]
  - - [14280, 14280, 1, 384]
    - [3, 4682.73]
  - - [28104, 28104, 1, 384]
    - [3, 4688.93]
  - - [4680, 4680, 1, 384]
    - [3, 4613.07]
  - - [27720, 27720, 1, 384]
    - [3, 4689.43]
- - - -1
    - - - -1
        - - - 1
            - - [-1, 1]
          - - -1
            - - [1, 1]
              - [-1, 0]
