library/src/blas3/Tensile/Logic/asm_full/vega10_Cijk_Ailk_Bljk_SB.yaml
- {MinimumRequiredVersion: 3.3.5}
- vega10
- gfx900
- [Device 6863,Device 6862,Device 687f]
- - - [4096, 7000, 1, 4096]
    - [65, 10430.1]
  - - [5124, 9124, 1, 1760]
    - [68, 10425.0]
  - - [5124, 9124, 1, 2560]
    - [65, 10350.7]
  - - [1760, 32, 1, 1760]
    - [21, 2973.59]
  - - [1024, 1500, 1, 1536]
    - [63, 8309.3]
  - - [512, 24000, 1, 1536]
    - [69, 9630.23]
  - - [3072, 24000, 1, 1024]
    - [69, 9678.87]
  - - [1024, 3000, 1, 2560]
    - [63, 9386.02]
  - - [7680, 4, 1, 2560]
    - [23, 733.694]
  - - [35, 1500, 1, 2048]
    - [11, 1902.34]
  - - [8448, 1500, 1, 2816]
    - [61, 10047.8]
  - - [2560, 7000, 1, 2560]
    - [64, 10216.5]
  - - [3072, 16, 1, 1024]
    - [30, 1661.27]
  - - [512, 48000, 1, 2048]
    - [62, 9997.61]
  - - [1760, 64, 1, 1760]
    - [18, 4117.31]
  - - [1024, 16, 1, 512]
    - [27, 517.097]
  - - [512, 48000, 1, 1536]
    - [62, 9927.79]
  - - [2560, 32, 1, 2560]
    - [42, 3565.61]
  - - [4608, 1500, 1, 1536]
    - [63, 9490.32]
  - - [2048, 128, 1, 2048]
    - [24, 4867.39]
  - - [1024, 24000, 1, 2560]
    - [65, 10263.0]
  - - [4608, 3000, 1, 1536]
    - [64, 9707.59]
  - - [5124, 9124, 1, 2048]
    - [65, 10037.4]
  - - [1024, 700, 1, 512]
    - [58, 5198.73]
  - - [3072, 1, 1, 128]
    - [30, 29.0068]
  - - [5124, 700, 1, 2560]
    - [58, 9029.42]
  - - [8448, 16, 1, 2816]
    - [22, 2782.02]
  - - [6144, 6000, 1, 2560]
    - [65, 10450.7]
  - - [4608, 32, 1, 1536]
    - [49, 3788.8]
  - - [35, 8457, 1, 2560]
    - [12, 3715.7]
  - - [3072, 64, 1, 1024]
    - [44, 3266.64]
  - - [512, 16, 1, 512]
    - [27, 291.869]
  - - [7680, 2, 1, 2560]
    - [29, 368.886]
  - - [4224, 1, 1, 128]
    - [48, 36.4937]
  - - [7680, 1, 1, 2560]
    - [29, 185.474]
  - - [128, 1500, 1, 1280]
    - [51, 4679.36]
  - - [35, 8457, 1, 4096]
    - [15, 3909.91]
  - - [1024, 1500, 1, 2816]
    - [63, 8968.04]
  - - [6144, 2, 1, 2560]
    - [43, 355.96]
  - - [8448, 48000, 1, 2816]
    - [65, 10839.8]
  - - [512, 6000, 1, 1536]
    - [62, 8923.95]
  - - [4224, 1500, 1, 176]
    - [58, 6277.68]
  - - [1024, 6000, 1, 2816]
    - [67, 9966.44]
  - - [512, 6000, 1, 2560]
    - [61, 9368.63]
  - - [512, 32, 1, 512]
    - [32, 566.224]
  - - [2560, 128, 1, 2560]
    - [49, 6361.97]
  - - [4608, 24000, 1, 1536]
    - [65, 10353.4]
  - - [512, 2, 1, 500000]
    - [8, 422.534]
  - - [7680, 48000, 1, 2560]
    - [65, 10758.2]
  - - [3072, 48000, 1, 1024]
    - [69, 9822.43]
  - - [1760, 16, 1, 1760]
    - [31, 1733.32]
  - - [512, 3000, 1, 2816]
    - [62, 8979.07]
  - - [1760, 7000, 1, 1760]
    - [63, 10144.3]
  - - [1024, 3000, 1, 2048]
    - [62, 8879.48]
  - - [6144, 4, 1, 2560]
    - [19, 699.61]
  - - [1024, 6000, 1, 2048]
    - [62, 9371.31]
  - - [512, 24000, 1, 2816]
    - [65, 10376.2]
  - - [6144, 48000, 1, 2560]
    - [65, 10688.3]
  - - [8448, 3000, 1, 2816]
    - [65, 10497.8]
  - - [35, 1500, 1, 2560]
    - [16, 2419.14]
  - - [3072, 4, 1, 1024]
    - [25, 466.665]
  - - [4608, 48000, 1, 1536]
    - [65, 10399.3]
  - - [2048, 32, 1, 2048]
    - [28, 2927.13]
  - - [7680, 1500, 1, 2560]
    - [63, 10004.5]
  - - [4096, 128, 1, 4096]
    - [58, 7086.32]
  - - [4608, 16, 1, 1536]
    - [29, 2174.65]
  - - [1024, 1500, 1, 2048]
    - [64, 8165.0]
  - - [3072, 3000, 1, 1024]
    - [64, 8832.37]
  - - [3072, 2, 1, 1024]
    - [25, 233.974]
  - - [8448, 1, 1, 2816]
    - [52, 187.807]
  - - [1024, 48000, 1, 2560]
    - [65, 10627.3]
  - - [1024, 3000, 1, 2816]
    - [61, 9552.7]
  - - [128, 1, 1, 1408]
    - [37, 12.5412]
  - - [35, 8457, 1, 1760]
    - [10, 3998.09]
  - - [1024, 2, 1, 512]
    - [27, 70.778]
  - - [1024, 4, 1, 500000]
    - [3, 846.984]
  - - [6144, 1, 1, 2560]
    - [19, 178.129]
  - - [1024, 48000, 1, 2816]
    - [65, 10727.6]
  - - [512, 48000, 1, 2816]
    - [65, 10526.2]
  - - [2048, 16, 1, 2048]
    - [32, 1833.9]
  - - [1024, 24000, 1, 1536]
    - [64, 9820.07]
  - - [7680, 6000, 1, 2560]
    - [65, 10659.9]
  - - [1760, 128, 1, 1760]
    - [34, 5652.07]
  - - [35, 8457, 1, 2048]
    - [9, 3362.15]
  - - [512, 1500, 1, 2816]
    - [58, 8370.25]
  - - [512, 1, 1, 512]
    - [37, 19.129]
  - - [512, 16, 1, 500000]
    - [2, 3200.66]
  - - [512, 8, 1, 500000]
    - [6, 1668.21]
  - - [512, 24000, 1, 2560]
    - [65, 10198.4]
  - - [6144, 3000, 1, 2560]
    - [65, 10182.7]
  - - [1024, 24000, 1, 2816]
    - [65, 10440.1]
  - - [2048, 7000, 1, 2048]
    - [69, 9714.94]
  - - [7680, 3000, 1, 2560]
    - [65, 10313.5]
  - - [1024, 4, 1, 512]
    - [27, 151.392]
  - - [5124, 700, 1, 2048]
    - [61, 8331.77]
  - - [5124, 9124, 1, 4096]
    - [65, 10279.4]
  - - [4096, 64, 1, 4096]
    - [41, 5930.92]
  - - [512, 6000, 1, 2048]
    - [61, 8710.1]
  - - [7680, 32, 1, 2560]
    - [17, 4869.96]
  - - [2560, 64, 1, 2560]
    - [51, 5276.92]
  - - [3072, 128, 1, 1024]
    - [58, 4373.0]
  - - [8448, 6000, 1, 2816]
    - [65, 10815.1]
  - - [7680, 64, 1, 2560]
    - [49, 6068.76]
  - - [5124, 1500, 1, 2560]
    - [65, 9436.21]
  - - [1024, 1500, 1, 2560]
    - [63, 8826.51]
  - - [512, 4, 1, 512]
    - [27, 74.1122]
  - - [1024, 6000, 1, 2560]
    - [63, 9786.62]
  - - [3072, 32, 1, 1024]
    - [44, 2540.01]
  - - [35, 700, 1, 2560]
    - [14, 1771.35]
  - - [4608, 1, 1, 1536]
    - [0, 152.147]
  - - [4096, 32, 1, 4096]
    - [23, 4613.34]
  - - [7680, 24000, 1, 2560]
    - [65, 10805.2]
  - - [8448, 4, 1, 2816]
    - [52, 739.976]
  - - [64, 1, 1, 1216]
    - [37, 5.55866]
  - - [512, 1, 1, 500000]
    - [7, 211.668]
  - - [176, 1500, 1, 1408]
    - [51, 4733.92]
  - - [512, 3000, 1, 1536]
    - [64, 8193.88]
  - - [8448, 24000, 1, 2816]
    - [65, 10877.1]
  - - [4608, 2, 1, 1536]
    - [40, 302.37]
  - - [1024, 48000, 1, 1536]
    - [69, 10077.1]
  - - [7680, 128, 1, 2560]
    - [61, 8365.62]
  - - [3072, 6000, 1, 1024]
    - [64, 9126.59]
  - - [3072, 1500, 1, 128]
    - [56, 4280.85]
  - - [1024, 3000, 1, 1536]
    - [63, 9003.42]
  - - [512, 4, 1, 500000]
    - [6, 842.032]
  - - [35, 700, 1, 2048]
    - [13, 1466.15]
  - - [1024, 16, 1, 500000]
    - [1, 3267.52]
  - - [512, 24000, 1, 2048]
    - [62, 9640.16]
  - - [1024, 32, 1, 512]
    - [32, 943.68]
  - - [512, 48000, 1, 2560]
    - [65, 10474.2]
  - - [2560, 16, 1, 2560]
    - [47, 2198.04]
  - - [2048, 64, 1, 2048]
    - [49, 4053.45]
  - - [512, 2, 1, 512]
    - [5, 36.862]
  - - [1024, 1, 1, 512]
    - [27, 35.5654]
  - - [512, 1500, 1, 2560]
    - [58, 7972.77]
  - - [6144, 32, 1, 2560]
    - [33, 4874.17]
  - - [1024, 1, 1, 500000]
    - [3, 212.475]
  - - [6144, 16, 1, 2560]
    - [23, 2681.37]
  - - [1024, 24000, 1, 2048]
    - [64, 9971.49]
  - - [4096, 16, 1, 4096]
    - [36, 2800.45]
  - - [5124, 1500, 1, 2048]
    - [69, 8978.95]
  - - [3072, 1500, 1, 1024]
    - [63, 8320.15]
  - - [1024, 2, 1, 500000]
    - [4, 424.077]
  - - [1024, 8, 1, 500000]
    - [3, 1679.66]
  - - [7680, 16, 1, 2560]
    - [29, 2786.49]
  - - [6144, 1500, 1, 2560]
    - [69, 9864.49]
  - - [3072, 1, 1, 1024]
    - [25, 117.31]
  - - [512, 6000, 1, 2816]
    - [62, 9621.97]
  - - [8448, 2, 1, 2816]
    - [52, 371.271]
  - - [4608, 4, 1, 1536]
    - [43, 599.047]
  - - [1024, 6000, 1, 1536]
    - [63, 9460.03]
  - - [8448, 32, 1, 2816]
    - [51, 4900.72]
  - - [512, 3000, 1, 2048]
    - [63, 7568.37]
  - - [6144, 24000, 1, 2560]
    - [65, 10712.3]
  - - [512, 3000, 1, 2560]
    - [62, 8723.52]
  - - [4608, 6000, 1, 1536]
    - [69, 9966.81]
  - - [512, 1500, 1, 2048]
    - [62, 6287.56]
  - - [512, 1500, 1, 1536]
    - [58, 7490.49]
  - - [128, 1, 1, 1024]
    - [37, 9.16812]
  - - [1024, 48000, 1, 2048]
    - [64, 10196.2]
- - - -1
    - - - -1
        - - - 4
            - - [-1, 39]
          - - 64
            - - [4, 89]
              - [64, 45]
              - [128, 46]
              - [256, 55]
              - [704, 26]
              - [1408, 20]
              - [1856, 17]
              - [2368, 20]
              - [2944, 51]
              - [3584, 21]
              - [5056, 51]
              - [5888, 49]
              - [-1, 60]
          - - 128
            - - [4, 89]
              - [64, 45]
              - [128, 55]
              - [256, 26]
              - [448, 21]
              - [704, 20]
              - [1024, 17]
              - [1408, 49]
              - [1856, 17]
              - [2368, 51]
              - [2944, 49]
              - [3584, 60]
              - [5056, 51]
              - [5888, 60]
              - [-1, 62]
          - - 256
            - - [4, 89]
              - [64, 19]
              - [128, 53]
              - [256, 21]
              - [448, 17]
              - [2944, 60]
              - [3584, 62]
              - [5056, 60]
              - [5888, 61]
              - [-1, 60]
          - - 448
            - - [4, 89]
              - [64, 26]
              - [256, 50]
              - [448, 34]
              - [704, 58]
              - [1408, 60]
              - [1856, 62]
              - [2368, 58]
              - [2944, 62]
              - [3584, 60]
              - [4288, 59]
              - [5056, 60]
              - [5888, 58]
              - [-1, 59]
          - - 704
            - - [4, 39]
              - [64, 26]
              - [128, 41]
              - [448, 60]
              - [704, 58]
              - [1408, 60]
              - [2368, 58]
              - [2944, 60]
              - [3584, 57]
              - [5056, 59]
              - [5888, 57]
              - [-1, 61]
          - - 1024
            - - [4, 39]
              - [64, 20]
              - [128, 18]
              - [256, 58]
              - [448, 60]
              - [704, 58]
              - [2944, 61]
              - [3584, 62]
              - [4288, 61]
              - [5888, 68]
              - [-1, 63]
          - - 1408
            - - [4, 54]
              - [64, 41]
              - [128, 49]
              - [448, 60]
              - [1024, 62]
              - [1408, 61]
              - [1856, 62]
              - [2368, 58]
              - [3584, 62]
              - [5056, 66]
              - [5888, 67]
              - [-1, 62]
          - - 1856
            - - [4, 54]
              - [128, 18]
              - [256, 58]
              - [448, 62]
              - [704, 60]
              - [1024, 61]
              - [1408, 57]
              - [1856, 62]
              - [2368, 58]
              - [2944, 62]
              - [3584, 57]
              - [4288, 66]
              - [5056, 62]
              - [5888, 65]
              - [-1, 62]
          - - 2368
            - - [4, 70]
              - [64, 34]
              - [128, 49]
              - [256, 58]
              - [448, 60]
              - [704, 58]
              - [1024, 62]
              - [1856, 58]
              - [2368, 62]
              - [2944, 66]
              - [3584, 62]
              - [4288, 61]
              - [-1, 65]
          - - 2944
            - - [4, 35]
              - [128, 49]
              - [256, 60]
              - [704, 62]
              - [1856, 61]
              - [2368, 68]
              - [5056, 61]
              - [5888, 65]
              - [-1, 61]
          - - 3584
            - - [4, 35]
              - [64, 38]
              - [128, 60]
              - [256, 62]
              - [448, 58]
              - [1408, 62]
              - [1856, 61]
              - [2368, 63]
              - [3584, 61]
              - [4288, 68]
              - [-1, 61]
          - - 4288
            - - [4, 48]
              - [64, 41]
              - [128, 49]
              - [256, 58]
              - [704, 61]
              - [1024, 58]
              - [1856, 65]
              - [2944, 61]
              - [3584, 65]
              - [5056, 61]
              - [-1, 65]
          - - 5056
            - - [4, 48]
              - [128, 49]
              - [448, 58]
              - [704, 61]
              - [1408, 65]
              - [1856, 61]
              - [2368, 65]
              - [2944, 61]
              - [3584, 65]
              - [4288, 61]
              - [-1, 65]
          - - 5888
            - - [4, 71]
              - [64, 49]
              - [128, 60]
              - [256, 61]
              - [448, 58]
              - [704, 61]
              - [1408, 65]
              - [2368, 61]
              - [-1, 65]
          - - -1
            - - [4, 82]
              - [64, 58]
              - [128, 62]
              - [256, 58]
              - [448, 61]
              - [704, 68]
              - [1024, 65]
              - [2368, 61]
              - [3584, 65]
              - [4288, 61]
              - [-1, 65]
