library/src/blas3/Tensile/Logic/asm_full/vega20_Cijk_Ailk_Bjlk_HBH.yaml
- {MinimumRequiredVersion: 4.6.0}
- vega20
- gfx906
- [Device 66a0, Device 66a1, Device 66a7]
    SolutionIndex: 0
    SolutionNameMin: Cijk_Ailk_Bjlk_HBH_MT032x016x08_PGR1_PLR1_TT04_02
    SolutionIndex: 1
    SolutionNameMin: Cijk_Ailk_Bjlk_HBH_MT032x032x08_PGR1_PLR1_TT04_04
    SolutionIndex: 2
    SolutionNameMin: Cijk_Ailk_Bjlk_HBH_MT064x016x08_PGR1_PLR1_TT04_02
    SolutionIndex: 3
    SolutionNameMin: Cijk_Ailk_Bjlk_HBH_MT032x032x08_PGR1_PLR1_TT04_04
    SolutionIndex: 4
    SolutionNameMin: Cijk_Ailk_Bjlk_HBH_MT064x064x08_PGR1_PLR1_TT08_08
    SolutionIndex: 5
    SolutionNameMin: Cijk_Ailk_Bjlk_HBH_MT016x016x16_PGR1_PLR1_TT02_02
    SolutionIndex: 6
    SolutionNameMin: Cijk_Ailk_Bjlk_HBH_MT032x016x16_PGR1_PLR1_TT04_02
    SolutionIndex: 7
    SolutionNameMin: Cijk_Ailk_Bjlk_HBH_MT032x032x16_PGR1_PLR1_TT04_04
    SolutionIndex: 8
    SolutionNameMin: Cijk_Ailk_Bjlk_HBH_MT032x016x16_PGR1_PLR1_TT02_02
    SolutionIndex: 9
    SolutionNameMin: Cijk_Ailk_Bjlk_HBH_MT064x016x16_PGR1_PLR1_TT04_02
    SolutionIndex: 10
    SolutionNameMin: Cijk_Ailk_Bjlk_HBH_MT064x016x16_PGR1_PLR1_TT02_02
    SolutionIndex: 11
    SolutionNameMin: Cijk_Ailk_Bjlk_HBH_MT128x016x16_PGR1_PLR1_TT04_02
    SolutionIndex: 12
    SolutionNameMin: Cijk_Ailk_Bjlk_HBH_MT032x016x16_PGR1_PLR1_TT04_02
    SolutionIndex: 13
    SolutionNameMin: Cijk_Ailk_Bjlk_HBH_MT032x032x16_PGR1_PLR1_TT04_04
    SolutionIndex: 14
    SolutionNameMin: Cijk_Ailk_Bjlk_HBH_MT032x016x16_PGR1_PLR1_TT02_02
    SolutionIndex: 15
    SolutionNameMin: Cijk_Ailk_Bjlk_HBH_MT032x016x24_PGR1_PLR1_TT04_02
    SolutionIndex: 16
    SolutionNameMin: Cijk_Ailk_Bjlk_HBH_MT016x016x32_PGR1_PLR1_TT02_02
    SolutionIndex: 17
    SolutionNameMin: Cijk_Ailk_Bjlk_HBH_MT032x016x32_PGR1_PLR1_TT02_02
    SolutionIndex: 18
    SolutionNameMin: Cijk_Ailk_Bjlk_HBH_MT064x016x32_PGR1_PLR1_TT04_02
    SolutionIndex: 19
    SolutionNameMin: Cijk_Ailk_Bjlk_HBH_MT064x016x32_PGR1_PLR1_TT02_02
    SolutionIndex: 20
    SolutionNameMin: Cijk_Ailk_Bjlk_HBH_MT128x016x32_PGR1_PLR1_TT04_02
    SolutionIndex: 21
    SolutionNameMin: Cijk_Ailk_Bjlk_HBH_MT032x032x32_PGR1_PLR1_TT04_04
    SolutionIndex: 22
    SolutionNameMin: Cijk_Ailk_Bjlk_HBH_MT032x016x32_PGR1_PLR1_TT02_02
    SolutionIndex: 23
    SolutionNameMin: Cijk_Ailk_Bjlk_HBH_MT064x016x32_PGR1_PLR1_TT02_02
    SolutionIndex: 24
    SolutionNameMin: Cijk_Ailk_Bjlk_HBH_MT016x016x64_PGR1_PLR1_TT02_02
    SolutionIndex: 25
    SolutionNameMin: Cijk_Ailk_Bjlk_HBH_MT032x016x64_PGR1_PLR1_TT02_02
    SolutionIndex: 26
    SolutionNameMin: Cijk_Ailk_Bjlk_HBH_MT064x016x64_PGR1_PLR1_TT02_02
    SolutionIndex: 27
    SolutionNameMin: Cijk_Ailk_Bjlk_HBH_MT032x032x64_PGR1_PLR1_TT04_04
    SolutionIndex: 28
    SolutionNameMin: Cijk_Ailk_Bjlk_HBH_MT032x016x64_PGR1_PLR1_TT02_02
    SolutionIndex: 29
    SolutionNameMin: Cijk_Ailk_Bjlk_HBH_MT064x016x64_PGR1_PLR1_TT02_02
    SolutionIndex: 30
    SolutionNameMin: Cijk_Ailk_Bjlk_HBH_MT032x064x08_PGR1_PLR1_TT04_08
    SolutionIndex: 31
    SolutionNameMin: Cijk_Ailk_Bjlk_HBH_MT048x064x08_PGR1_PLR1_TT06_08
    SolutionIndex: 32
    SolutionNameMin: Cijk_Ailk_Bjlk_HBH_MT064x048x08_PGR1_PLR1_TT08_06
    SolutionIndex: 33
    SolutionNameMin: Cijk_Ailk_Bjlk_HBH_MT064x128x08_PGR1_PLR1_TT04_08
    SolutionIndex: 34
    SolutionNameMin: Cijk_Ailk_Bjlk_HBH_MT064x064x16_PGR1_PLR1_TT04_04
    SolutionIndex: 35
    SolutionNameMin: Cijk_Ailk_Bjlk_HBH_MT064x128x16_PGR1_PLR1_TT04_08
    SolutionIndex: 36
    SolutionNameMin: Cijk_Ailk_Bjlk_HBH_MT128x064x16_PGR1_PLR1_TT08_04
    SolutionIndex: 37
    SolutionNameMin: Cijk_Ailk_Bjlk_HBH_MT064x064x32_PGR1_PLR1_TT04_04
    SolutionIndex: 38
    SolutionNameMin: Cijk_Ailk_Bjlk_HBH_MT032x032x16_PGR1_PLR1_TT02_02
    SolutionIndex: 39
    SolutionNameMin: Cijk_Ailk_Bjlk_HBH_MT032x032x32_PGR1_PLR1_TT02_02
    SolutionIndex: 40
    SolutionNameMin: Cijk_Ailk_Bjlk_HBH_MT032x032x64_PGR1_PLR1_TT02_02
    SolutionIndex: 41
    SolutionNameMin: Cijk_Ailk_Bjlk_HBH_MT064x128x04_PGR0_PLR0_TT04_08
    SolutionIndex: 42
    SolutionNameMin: Cijk_Ailk_Bjlk_HBH_MT064x064x04_PGR0_PLR0_TT04_04
    SolutionIndex: 43
    SolutionNameMin: Cijk_Ailk_Bjlk_HBH_MT064x064x04_PGR1_PLR0_TT04_04
    SolutionIndex: 44
    SolutionNameMin: Cijk_Ailk_Bjlk_HBH_MT064x064x04_PGR0_PLR1_TT04_04
    SolutionIndex: 45
    SolutionNameMin: Cijk_Ailk_Bjlk_HBH_MT128x128x04_PGR1_PLR1_TT08_08
    SolutionIndex: 46
    SolutionNameMin: Cijk_Ailk_Bjlk_HBH_MT064x064x04_PGR1_PLR1_TT04_04
    SolutionIndex: 47
    SolutionNameMin: Cijk_Ailk_Bjlk_HBH_MT128x128x08_PGR0_PLR0_TT08_08
    SolutionIndex: 48
    SolutionNameMin: Cijk_Ailk_Bjlk_HBH_MT064x128x08_PGR0_PLR0_TT04_08
    SolutionIndex: 49
    SolutionNameMin: Cijk_Ailk_Bjlk_HBH_MT064x064x08_PGR0_PLR0_TT04_04
    SolutionIndex: 50
    SolutionNameMin: Cijk_Ailk_Bjlk_HBH_MT064x128x08_PGR1_PLR0_TT04_08
    SolutionIndex: 51
    SolutionNameMin: Cijk_Ailk_Bjlk_HBH_MT064x064x08_PGR1_PLR0_TT04_04
    SolutionIndex: 52
    SolutionNameMin: Cijk_Ailk_Bjlk_HBH_MT064x064x08_PGR0_PLR1_TT04_04
    SolutionIndex: 53
    SolutionNameMin: Cijk_Ailk_Bjlk_HBH_MT064x128x08_PGR1_PLR1_TT04_08
    SolutionIndex: 54
    SolutionNameMin: Cijk_Ailk_Bjlk_HBH_MT064x064x08_PGR1_PLR1_TT04_04
    SolutionIndex: 55
    SolutionNameMin: Cijk_Ailk_Bjlk_HBH_MT064x128x16_PGR0_PLR0_TT04_08
    SolutionIndex: 56
    SolutionNameMin: Cijk_Ailk_Bjlk_HBH_MT064x064x16_PGR0_PLR0_TT04_04
    SolutionIndex: 57
    SolutionNameMin: Cijk_Ailk_Bjlk_HBH_MT064x064x16_PGR1_PLR0_TT04_04
    SolutionIndex: 58
    SolutionNameMin: Cijk_Ailk_Bjlk_HBH_MT064x064x16_PGR0_PLR1_TT04_04
    SolutionIndex: 59
    SolutionNameMin: Cijk_Ailk_Bjlk_HBH_MT064x064x16_PGR1_PLR1_TT04_04
    SolutionIndex: 60
    SolutionNameMin: Cijk_Ailk_Bjlk_HBH_MT128x128x04_PGR0_PLR0_TT08_08
    SolutionIndex: 61
    SolutionNameMin: Cijk_Ailk_Bjlk_HBH_MT064x128x04_PGR0_PLR0_TT04_08
    SolutionIndex: 62
    SolutionNameMin: Cijk_Ailk_Bjlk_HBH_MT064x064x04_PGR0_PLR0_TT04_04
    SolutionIndex: 63
    SolutionNameMin: Cijk_Ailk_Bjlk_HBH_MT128x128x04_PGR1_PLR0_TT08_08
    SolutionIndex: 64
    SolutionNameMin: Cijk_Ailk_Bjlk_HBH_MT064x128x04_PGR1_PLR0_TT04_08
    SolutionIndex: 65
    SolutionNameMin: Cijk_Ailk_Bjlk_HBH_MT064x064x04_PGR1_PLR0_TT04_04
    SolutionIndex: 66
    SolutionNameMin: Cijk_Ailk_Bjlk_HBH_MT064x128x04_PGR0_PLR1_TT04_08
    SolutionIndex: 67
    SolutionNameMin: Cijk_Ailk_Bjlk_HBH_MT064x064x04_PGR0_PLR1_TT04_04
    SolutionIndex: 68
    SolutionNameMin: Cijk_Ailk_Bjlk_HBH_MT128x128x04_PGR1_PLR1_TT08_08
    SolutionIndex: 69
    SolutionNameMin: Cijk_Ailk_Bjlk_HBH_MT064x128x04_PGR1_PLR1_TT04_08
    SolutionIndex: 70
    SolutionNameMin: Cijk_Ailk_Bjlk_HBH_MT064x064x04_PGR1_PLR1_TT04_04
    SolutionIndex: 71
    SolutionNameMin: Cijk_Ailk_Bjlk_HBH_MT064x128x08_PGR0_PLR0_TT04_08
    SolutionIndex: 72
    SolutionNameMin: Cijk_Ailk_Bjlk_HBH_MT064x064x08_PGR0_PLR0_TT04_04
    SolutionIndex: 73
    SolutionNameMin: Cijk_Ailk_Bjlk_HBH_MT064x064x08_PGR1_PLR0_TT04_04
    SolutionIndex: 74
    SolutionNameMin: Cijk_Ailk_Bjlk_HBH_MT128x128x08_PGR0_PLR1_TT08_08
    SolutionIndex: 75
    SolutionNameMin: Cijk_Ailk_Bjlk_HBH_MT064x128x08_PGR0_PLR1_TT04_08
    SolutionIndex: 76
    SolutionNameMin: Cijk_Ailk_Bjlk_HBH_MT064x064x08_PGR0_PLR1_TT04_04
    SolutionIndex: 77
    SolutionNameMin: Cijk_Ailk_Bjlk_HBH_MT064x064x08_PGR1_PLR1_TT04_04
    SolutionIndex: 78
    SolutionNameMin: Cijk_Ailk_Bjlk_HBH_MT064x128x16_PGR0_PLR0_TT04_08
    SolutionIndex: 79
    SolutionNameMin: Cijk_Ailk_Bjlk_HBH_MT064x064x16_PGR0_PLR0_TT04_04
    SolutionIndex: 80
    SolutionNameMin: Cijk_Ailk_Bjlk_HBH_MT064x064x16_PGR1_PLR0_TT04_04
    SolutionIndex: 81
    SolutionNameMin: Cijk_Ailk_Bjlk_HBH_MT064x064x16_PGR0_PLR1_TT04_04
    SolutionIndex: 82
    SolutionNameMin: Cijk_Ailk_Bjlk_HBH_MT064x064x16_PGR1_PLR1_TT04_04
    SolutionIndex: 0
    SolutionNameMin: Cijk_Ailk_Bjlk_HBH_MT064x128x16_EPS1_GRVW04_PGR1_PLR1_SNLL1_TT08_04_VW04_WG08_32_01_WGM01
    SolutionIndex: 1
    SolutionNameMin: Cijk_Ailk_Bjlk_HBH_MT128x128x16_EPS1_GRVW04_PGR1_PLR1_SNLL1_TT08_08_VW04_WG16_16_01_WGM01
    SolutionIndex: 2
    SolutionNameMin: Cijk_Ailk_Bjlk_HBH_MT064x128x16_EPS1_GRVW04_PGR1_PLR1_SNLL1_TT08_04_VW04_WG08_32_01_WGM08
    SolutionIndex: 3
    SolutionNameMin: Cijk_Ailk_Bjlk_HBH_MT128x064x16_EPS1_GRVW04_PGR1_PLR1_SNLL1_TT08_04_VW04_WG16_16_01_WGM08
    SolutionIndex: 4
    SolutionNameMin: Cijk_Ailk_Bjlk_HBH_MT128x128x16_EPS1_GRVW04_PGR1_PLR1_SNLL1_TT08_08_VW04_WG16_16_01_WGM08
    SolutionIndex: 5
    SolutionNameMin: Cijk_Ailk_Bjlk_HBH_MT128x064x16_EPS1_GRVW04_PGR1_PLR1_SNLL1_TT08_04_VW04_WG16_16_01_WGM64
    SolutionIndex: 6
    SolutionNameMin: Cijk_Ailk_Bjlk_HBH_MT064x064x32_EPS0_GRVW04_PGR0_PLR0_SNLL0_TT04_04_VW04_WG16_16_01_WGM01
    SolutionIndex: 7
    SolutionNameMin: Cijk_Ailk_Bjlk_HBH_MT128x064x16_EPS1_GRVW08_PGR1_PLR1_SNLL1_TT08_08_VW08_WG16_08_01_WGM64
    SolutionIndex: 8
    SolutionNameMin: Cijk_Ailk_Bjlk_HBH_MT128x128x32_EPS1_GRVW08_PGR1_PLR1_SNLL1_TT08_08_VW08_WG16_16_01_WGM64
    SolutionIndex: 0
    SolutionNameMin: Cijk_Ailk_Bjlk_HBH_MT032x032x08_PGR1_PLR1_TT04_04
    SolutionIndex: 1
    SolutionNameMin: Cijk_Ailk_Bjlk_HBH_MT064x064x08_PGR1_PLR1_TT08_08
    SolutionIndex: 2
    SolutionNameMin: Cijk_Ailk_Bjlk_HBH_MT032x032x16_PGR1_PLR1_TT04_04
    SolutionIndex: 3
    SolutionNameMin: Cijk_Ailk_Bjlk_HBH_MT064x032x16_PGR1_PLR1_TT04_04
    SolutionIndex: 4
    SolutionNameMin: Cijk_Ailk_Bjlk_HBH_MT032x032x16_PGR1_PLR1_TT04_04
    SolutionIndex: 5
    SolutionNameMin: Cijk_Ailk_Bjlk_HBH_MT064x032x16_PGR1_PLR1_TT04_04
    SolutionIndex: 6
    SolutionNameMin: Cijk_Ailk_Bjlk_HBH_MT032x032x32_PGR1_PLR1_TT04_04
    SolutionIndex: 7
    SolutionNameMin: Cijk_Ailk_Bjlk_HBH_MT064x032x32_PGR1_PLR1_TT04_04
    SolutionIndex: 8
    SolutionNameMin: Cijk_Ailk_Bjlk_HBH_MT128x032x32_PGR1_PLR1_TT04_04
    SolutionIndex: 9
    SolutionNameMin: Cijk_Ailk_Bjlk_HBH_MT128x016x32_PGR1_PLR1_TT04_04
    SolutionIndex: 10
    SolutionNameMin: Cijk_Ailk_Bjlk_HBH_MT032x032x32_PGR1_PLR1_TT04_04
    SolutionIndex: 11
    SolutionNameMin: Cijk_Ailk_Bjlk_HBH_MT064x032x32_PGR1_PLR1_TT04_04
    SolutionIndex: 12
    SolutionNameMin: Cijk_Ailk_Bjlk_HBH_MT128x032x32_PGR1_PLR1_TT04_04
    SolutionIndex: 13
    SolutionNameMin: Cijk_Ailk_Bjlk_HBH_MT128x016x32_PGR1_PLR1_TT04_04
    SolutionIndex: 14
    SolutionNameMin: Cijk_Ailk_Bjlk_HBH_MT032x032x64_PGR1_PLR1_TT04_04
    SolutionIndex: 15
    SolutionNameMin: Cijk_Ailk_Bjlk_HBH_MT032x032x64_PGR1_PLR1_TT04_04
    SolutionIndex: 16
    SolutionNameMin: Cijk_Ailk_Bjlk_HBH_MT064x032x64_PGR1_PLR1_TT04_04
    SolutionIndex: 17
    SolutionNameMin: Cijk_Ailk_Bjlk_HBH_MT064x064x08_PGR1_PLR1_TT08_08
    SolutionIndex: 18
    SolutionNameMin: Cijk_Ailk_Bjlk_HBH_MT064x064x16_PGR1_PLR1_TT08_08
    SolutionIndex: 19
    SolutionNameMin: Cijk_Ailk_Bjlk_HBH_MT064x064x16_PGR1_PLR1_TT08_08
    SolutionIndex: 20
    SolutionNameMin: Cijk_Ailk_Bjlk_HBH_MT128x064x32_PGR1_PLR1_TT08_08
    SolutionIndex: 21
    SolutionNameMin: Cijk_Ailk_Bjlk_HBH_MT064x064x16_PGR1_PLR1_TT04_04
    SolutionIndex: 22
    SolutionNameMin: Cijk_Ailk_Bjlk_HBH_MT064x128x16_PGR1_PLR1_TT04_08
    SolutionIndex: 23
    SolutionNameMin: Cijk_Ailk_Bjlk_HBH_MT128x064x16_PGR1_PLR1_TT08_04
    SolutionIndex: 24
    SolutionNameMin: Cijk_Ailk_Bjlk_HBH_MT128x128x16_PGR1_PLR1_TT08_08
    SolutionIndex: 25
    SolutionNameMin: Cijk_Ailk_Bjlk_HBH_MT064x064x32_PGR1_PLR1_TT04_04
    SolutionIndex: 26
    SolutionNameMin: Cijk_Ailk_Bjlk_HBH_MT064x128x32_PGR1_PLR1_TT04_08
    SolutionIndex: 27
    SolutionNameMin: Cijk_Ailk_Bjlk_HBH_MT128x064x32_PGR1_PLR1_TT08_04
    SolutionIndex: 28
    SolutionNameMin: Cijk_Ailk_Bjlk_HBH_MT128x128x32_PGR1_PLR1_TT08_08
    SolutionIndex: 29
    SolutionNameMin: Cijk_Ailk_Bjlk_HBH_MT064x064x16_PGR1_PLR1_TT04_04
    SolutionIndex: 30
    SolutionNameMin: Cijk_Ailk_Bjlk_HBH_MT064x064x32_PGR1_PLR1_TT04_04
    SolutionIndex: 31
    SolutionNameMin: Cijk_Ailk_Bjlk_HBH_MT064x064x64_PGR1_PLR1_TT04_04
    SolutionIndex: 32
    SolutionNameMin: Cijk_Ailk_Bjlk_HBH_MT064x128x04_PGR0_PLR0_TT04_08
    SolutionIndex: 33
    SolutionNameMin: Cijk_Ailk_Bjlk_HBH_MT064x064x04_PGR1_PLR0_TT04_04
    SolutionIndex: 34
    SolutionNameMin: Cijk_Ailk_Bjlk_HBH_MT128x128x04_PGR1_PLR1_TT08_08
    SolutionIndex: 35
    SolutionNameMin: Cijk_Ailk_Bjlk_HBH_MT128x128x08_PGR0_PLR0_TT08_08
    SolutionIndex: 36
    SolutionNameMin: Cijk_Ailk_Bjlk_HBH_MT064x064x08_PGR0_PLR0_TT04_04
    SolutionIndex: 37
    SolutionNameMin: Cijk_Ailk_Bjlk_HBH_MT064x128x08_PGR1_PLR0_TT04_08
    SolutionIndex: 38
    SolutionNameMin: Cijk_Ailk_Bjlk_HBH_MT064x064x08_PGR1_PLR0_TT04_04
    SolutionIndex: 39
    SolutionNameMin: Cijk_Ailk_Bjlk_HBH_MT064x128x08_PGR0_PLR1_TT04_08
    SolutionIndex: 40
    SolutionNameMin: Cijk_Ailk_Bjlk_HBH_MT064x064x08_PGR0_PLR1_TT04_04
    SolutionIndex: 41
    SolutionNameMin: Cijk_Ailk_Bjlk_HBH_MT064x128x08_PGR1_PLR1_TT04_08
    SolutionIndex: 42
    SolutionNameMin: Cijk_Ailk_Bjlk_HBH_MT064x064x08_PGR1_PLR1_TT04_04
    SolutionIndex: 43
    SolutionNameMin: Cijk_Ailk_Bjlk_HBH_MT064x128x16_PGR0_PLR0_TT04_08
    SolutionIndex: 44
    SolutionNameMin: Cijk_Ailk_Bjlk_HBH_MT064x064x16_PGR0_PLR0_TT04_04
    SolutionIndex: 45
    SolutionNameMin: Cijk_Ailk_Bjlk_HBH_MT064x064x16_PGR1_PLR0_TT04_04
    SolutionIndex: 46
    SolutionNameMin: Cijk_Ailk_Bjlk_HBH_MT064x128x16_PGR0_PLR1_TT04_08
    SolutionIndex: 47
    SolutionNameMin: Cijk_Ailk_Bjlk_HBH_MT064x064x16_PGR0_PLR1_TT04_04
    SolutionIndex: 48
    SolutionNameMin: Cijk_Ailk_Bjlk_HBH_MT064x128x16_PGR1_PLR1_TT04_08
    SolutionIndex: 49
    SolutionNameMin: Cijk_Ailk_Bjlk_HBH_MT064x064x16_PGR1_PLR1_TT04_04
    SolutionIndex: 50
    SolutionNameMin: Cijk_Ailk_Bjlk_HBH_MT128x128x04_PGR0_PLR0_TT08_08
    SolutionIndex: 51
    SolutionNameMin: Cijk_Ailk_Bjlk_HBH_MT064x128x04_PGR0_PLR0_TT04_08
    SolutionIndex: 52
    SolutionNameMin: Cijk_Ailk_Bjlk_HBH_MT064x064x04_PGR0_PLR0_TT04_04
    SolutionIndex: 53
    SolutionNameMin: Cijk_Ailk_Bjlk_HBH_MT128x128x04_PGR1_PLR0_TT08_08
    SolutionIndex: 54
    SolutionNameMin: Cijk_Ailk_Bjlk_HBH_MT064x128x04_PGR1_PLR0_TT04_08
    SolutionIndex: 55
    SolutionNameMin: Cijk_Ailk_Bjlk_HBH_MT064x064x04_PGR1_PLR0_TT04_04
    SolutionIndex: 56
    SolutionNameMin: Cijk_Ailk_Bjlk_HBH_MT128x128x04_PGR0_PLR1_TT08_08
    SolutionIndex: 57
    SolutionNameMin: Cijk_Ailk_Bjlk_HBH_MT064x128x04_PGR0_PLR1_TT04_08
    SolutionIndex: 58
    SolutionNameMin: Cijk_Ailk_Bjlk_HBH_MT064x064x04_PGR0_PLR1_TT04_04
    SolutionIndex: 59
    SolutionNameMin: Cijk_Ailk_Bjlk_HBH_MT128x128x04_PGR1_PLR1_TT08_08
    SolutionIndex: 60
    SolutionNameMin: Cijk_Ailk_Bjlk_HBH_MT064x128x04_PGR1_PLR1_TT04_08
    SolutionIndex: 61
    SolutionNameMin: Cijk_Ailk_Bjlk_HBH_MT064x064x04_PGR1_PLR1_TT04_04
    SolutionIndex: 62
    SolutionNameMin: Cijk_Ailk_Bjlk_HBH_MT064x128x08_PGR0_PLR0_TT04_08
    SolutionIndex: 63
    SolutionNameMin: Cijk_Ailk_Bjlk_HBH_MT064x064x08_PGR0_PLR0_TT04_04
    SolutionIndex: 64
    SolutionNameMin: Cijk_Ailk_Bjlk_HBH_MT064x064x08_PGR1_PLR0_TT04_04
    SolutionIndex: 65
    SolutionNameMin: Cijk_Ailk_Bjlk_HBH_MT128x128x08_PGR0_PLR1_TT08_08
    SolutionIndex: 66
    SolutionNameMin: Cijk_Ailk_Bjlk_HBH_MT064x128x08_PGR0_PLR1_TT04_08
    SolutionIndex: 67
    SolutionNameMin: Cijk_Ailk_Bjlk_HBH_MT064x064x08_PGR0_PLR1_TT04_04
    SolutionIndex: 68
    SolutionNameMin: Cijk_Ailk_Bjlk_HBH_MT064x128x08_PGR1_PLR1_TT04_08
    SolutionIndex: 69
    SolutionNameMin: Cijk_Ailk_Bjlk_HBH_MT064x064x08_PGR1_PLR1_TT04_04
    SolutionIndex: 70
    SolutionNameMin: Cijk_Ailk_Bjlk_HBH_MT064x064x16_PGR0_PLR0_TT04_04
    SolutionIndex: 71
    SolutionNameMin: Cijk_Ailk_Bjlk_HBH_MT064x064x16_PGR1_PLR0_TT04_04
    SolutionIndex: 72
    SolutionNameMin: Cijk_Ailk_Bjlk_HBH_MT064x128x16_PGR0_PLR1_TT04_08
    SolutionIndex: 73
    SolutionNameMin: Cijk_Ailk_Bjlk_HBH_MT064x064x16_PGR0_PLR1_TT04_04
    SolutionIndex: 74
    SolutionNameMin: Cijk_Ailk_Bjlk_HBH_MT064x064x16_PGR1_PLR1_TT04_04
- - - [2368, 1024, 1, 1]
    - [65, 135.921]
  - - [128, 256, 1, 1280]
    - [25, 1519.68]
  - - [32, 5056, 1, 1280]
    - [59, 1321.43]
  - - [448, 1, 1, 256]
    - [77, 3.34953]
  - - [5056, 1408, 1, 3328]
    - [35, 10050.4]
  - - [2368, 64, 1, 1]
    - [65, 12.5457]
  - - [5056, 1856, 1, 3328]
    - [34, 10336.3]
  - - [704, 64, 1, 1]
    - [67, 3.83129]
  - - [448, 3584, 1, 3328]
    - [34, 8595.33]
  - - [704, 64, 1, 3328]
    - [25, 2184.53]
  - - [5056, 4288, 1, 32]
    - [41, 3762.28]
  - - [5888, 256, 1, 256]
    - [36, 8316.29]
  - - [448, 3584, 1, 32]
    - [57, 2038.9]
  - - [5888, 704, 1, 1]
    - [67, 173.874]
  - - [6784, 6784, 1, 1280]
    - [33, 10307.1]
  - - [448, 1, 1, 1]
    - [74, 0.0486957]
  - - [1408, 3584, 1, 3328]
    - [34, 9898.39]
  - - [448, 448, 1, 3328]
    - [15, 5656.7]
  - - [1024, 2368, 1, 3328]
    - [34, 9278.24]
  - - [1, 4288, 1, 1280]
    - [82, 34.5284]
  - - [6784, 64, 1, 32]
    - [46, 923.779]
  - - [64, 64, 1, 1280]
    - [16, 170.667]
  - - [448, 3584, 1, 1]
    - [61, 108.489]
  - - [448, 64, 1, 1]
    - [74, 2.61606]
  - - [32, 1408, 1, 32]
    - [49, 96.3765]
  - - [64, 1024, 1, 1280]
    - [40, 2995.93]
  - - [1, 1408, 1, 3328]
    - [82, 17.5158]
  - - [32, 3584, 1, 1280]
    - [54, 1246.61]
  - - [1024, 1, 1, 3328]
    - [82, 12.9243]
  - - [2944, 128, 1, 32]
    - [52, 837.404]
  - - [1408, 5056, 1, 1]
    - [66, 205.985]
  - - [1024, 64, 1, 1280]
    - [40, 3004.52]
  - - [64, 5056, 1, 3328]
    - [39, 7229.37]
  - - [5888, 4288, 1, 3328]
    - [33, 10342.9]
  - - [1, 2368, 1, 1280]
    - [82, 27.2184]
  - - [704, 1024, 1, 1]
    - [61, 60.8865]
  - - [2368, 1408, 1, 32]
    - [41, 2744.15]
  - - [256, 1856, 1, 1280]
    - [37, 7345.1]
  - - [1024, 2944, 1, 1]
    - [62, 152.564]
  - - [2944, 3584, 1, 3328]
    - [34, 10239.7]
  - - [2368, 2944, 1, 1280]
    - [34, 10080.6]
  - - [256, 1408, 1, 1]
    - [62, 32.4144]
  - - [1, 1024, 1, 3328]
    - [82, 12.8154]
  - - [3584, 1408, 1, 32]
    - [41, 3144.09]
  - - [6784, 1856, 1, 32]
    - [41, 3579.56]
  - - [5056, 256, 1, 256]
    - [34, 8283.75]
  - - [1856, 2368, 1, 256]
    - [34, 9326.28]
  - - [2368, 1024, 1, 3328]
    - [34, 9276.53]
  - - [3584, 4288, 1, 32]
    - [41, 3639.6]
  - - [1024, 1024, 1, 1280]
    - [34, 9108.15]
  - - [32, 2944, 1, 3328]
    - [59, 1144.25]
  - - [704, 1408, 1, 3328]
    - [34, 8803.43]
  - - [1408, 704, 1, 256]
    - [34, 7516.45]
  - - [704, 64, 1, 32]
    - [49, 91.4843]
  - - [5888, 1, 1, 3328]
    - [82, 49.2047]
  - - [2368, 32, 1, 256]
    - [54, 566.55]
  - - [6784, 128, 1, 3328]
    - [11, 8159.8]
  - - [2944, 1856, 1, 1]
    - [62, 191.856]
  - - [32, 448, 1, 3328]
    - [54, 170.054]
  - - [5056, 1, 1, 3328]
    - [82, 42.7673]
  - - [2368, 3584, 1, 1280]
    - [34, 10083.2]
  - - [4288, 5056, 1, 1]
    - [67, 245.029]
  - - [128, 4288, 1, 3328]
    - [8, 7285.5]
  - - [1408, 4288, 1, 1280]
    - [36, 9839.08]
  - - [1856, 704, 1, 1280]
    - [34, 9324.7]
  - - [448, 5888, 1, 256]
    - [34, 8483.45]
  - - [1, 5888, 1, 3328]
    - [82, 49.523]
  - - [1024, 128, 1, 32]
    - [52, 264.792]
  - - [32, 4288, 1, 1280]
    - [59, 1117.85]
  - - [1024, 5056, 1, 1]
    - [67, 188.13]
  - - [704, 3584, 1, 1280]
    - [34, 9510.05]
  - - [1856, 5056, 1, 256]
    - [4, 9829.33]
  - - [1408, 1024, 1, 1280]
    - [34, 8751.39]
  - - [5056, 5888, 1, 3328]
    - [35, 10498.4]
  - - [3584, 3584, 1, 1280]
    - [34, 10328.7]
  - - [2368, 3584, 1, 32]
    - [41, 3361.15]
  - - [5056, 5056, 1, 1]
    - [62, 249.445]
  - - [1024, 6784, 1, 1280]
    - [34, 10048.7]
  - - [1024, 3584, 1, 1]
    - [61, 165.614]
  - - [256, 5056, 1, 1]
    - [65, 95.1718]
  - - [32, 5056, 1, 32]
    - [54, 407.024]
  - - [5888, 32, 1, 32]
    - [57, 456.766]
  - - [64, 128, 1, 3328]
    - [17, 386.819]
  - - [256, 5056, 1, 32]
    - [44, 1849.05]
  - - [5056, 64, 1, 32]
    - [54, 779.721]
  - - [256, 128, 1, 256]
    - [28, 1028.02]
  - - [128, 6784, 1, 32]
    - [52, 1536.91]
  - - [64, 128, 1, 1]
    - [62, 0.687248]
  - - [64, 2368, 1, 1280]
    - [39, 5009.98]
  - - [128, 704, 1, 32]
    - [52, 183.902]
  - - [64, 6784, 1, 3328]
    - [39, 7384.19]
  - - [2944, 256, 1, 1280]
    - [37, 8414.95]
  - - [2944, 4288, 1, 256]
    - [36, 9641.13]
  - - [1024, 1024, 1, 3328]
    - [37, 9320.68]
  - - [5056, 704, 1, 32]
    - [56, 2666.24]
  - - [1856, 4288, 1, 3328]
    - [34, 10172.2]
  - - [1, 1856, 1, 256]
    - [77, 13.78]
  - - [6784, 4288, 1, 32]
    - [41, 3739.05]
  - - [4288, 1024, 1, 3328]
    - [34, 10076.8]
  - - [256, 128, 1, 1]
    - [66, 3.30323]
  - - [3584, 448, 1, 3328]
    - [34, 8588.69]
  - - [2944, 448, 1, 256]
    - [34, 7289.32]
  - - [3584, 2368, 1, 3328]
    - [34, 10203.0]
  - - [4288, 1856, 1, 1]
    - [67, 212.568]
  - - [1856, 2944, 1, 1]
    - [77, 169.061]
  - - [32, 4288, 1, 3328]
    - [59, 1168.99]
  - - [1, 3584, 1, 3328]
    - [82, 45.4556]
  - - [256, 32, 1, 3328]
    - [59, 101.214]
  - - [1856, 2368, 1, 32]
    - [41, 2915.43]
  - - [4288, 1856, 1, 32]
    - [41, 3336.91]
  - - [5056, 64, 1, 3328]
    - [39, 7233.26]
  - - [6784, 1, 1, 1280]
    - [82, 54.9868]
  - - [32, 2368, 1, 256]
    - [54, 565.229]
  - - [1408, 64, 1, 1]
    - [67, 7.36209]
  - - [1, 1, 1, 3328]
    - [82, 0.0124812]
  - - [5056, 2368, 1, 256]
    - [30, 9823.68]
  - - [1408, 5888, 1, 256]
    - [33, 9771.26]
  - - [5056, 6784, 1, 1]
    - [62, 256.122]
  - - [32, 448, 1, 1280]
    - [54, 158.848]
  - - [32, 448, 1, 32]
    - [48, 31.8578]
  - - [1024, 1408, 1, 3328]
    - [34, 8889.66]
  - - [256, 5056, 1, 1280]
    - [34, 9237.01]
  - - [704, 2368, 1, 1]
    - [61, 107.971]
  - - [64, 1024, 1, 32]
    - [49, 135.126]
  - - [1024, 256, 1, 256]
    - [13, 4660.34]
  - - [128, 1, 1, 1]
    - [82, 0.0131148]
  - - [3584, 4288, 1, 1280]
    - [34, 10292.2]
  - - [1856, 128, 1, 32]
    - [59, 536.877]
  - - [1856, 128, 1, 1280]
    - [20, 6251.79]
  - - [128, 2944, 1, 3328]
    - [6, 7119.08]
  - - [1, 6784, 1, 3328]
    - [82, 56.0172]
  - - [2368, 4288, 1, 1]
    - [76, 214.763]
  - - [4288, 448, 1, 3328]
    - [34, 9056.51]
  - - [4288, 32, 1, 3328]
    - [59, 1160.91]
  - - [32, 2944, 1, 256]
    - [59, 619.026]
  - - [256, 1856, 1, 1]
    - [76, 41.5329]
  - - [704, 6784, 1, 1280]
    - [34, 9731.91]
  - - [2368, 4288, 1, 32]
    - [41, 3513.49]
  - - [3584, 6784, 1, 1]
    - [61, 252.218]
  - - [704, 5056, 1, 1280]
    - [34, 9745.17]
  - - [256, 3584, 1, 3328]
    - [37, 8160.82]
  - - [3584, 6784, 1, 32]
    - [41, 3834.99]
  - - [3584, 6784, 1, 1280]
    - [34, 10381.1]
  - - [4288, 4288, 1, 3328]
    - [34, 10331.3]
  - - [3584, 64, 1, 1280]
    - [20, 6066.14]
  - - [64, 1856, 1, 256]
    - [39, 3305.29]
  - - [3584, 64, 1, 32]
    - [54, 566.36]
  - - [448, 1, 1, 1280]
    - [82, 5.16055]
  - - [256, 4288, 1, 1280]
    - [34, 7872.55]
  - - [1408, 3584, 1, 1]
    - [66, 187.733]
  - - [4288, 1856, 1, 3328]
    - [34, 10161.0]
  - - [1856, 2944, 1, 1280]
    - [34, 10119.8]
  - - [4288, 256, 1, 256]
    - [34, 7053.67]
  - - [128, 5888, 1, 32]
    - [54, 1382.87]
  - - [128, 5888, 1, 1280]
    - [37, 8426.71]
  - - [1408, 128, 1, 3328]
    - [19, 6140.31]
  - - [3584, 256, 1, 256]
    - [34, 7126.24]
  - - [32, 6784, 1, 3328]
    - [59, 1800.05]
  - - [32, 3584, 1, 256]
    - [54, 806.597]
  - - [256, 2368, 1, 32]
    - [52, 1230.88]
  - - [448, 128, 1, 3328]
    - [29, 2761.01]
  - - [64, 2944, 1, 3328]
    - [40, 6592.18]
  - - [64, 4288, 1, 3328]
    - [39, 6187.74]
  - - [5056, 1024, 1, 3328]
    - [35, 10145.9]
  - - [2368, 64, 1, 3328]
    - [40, 5333.81]
  - - [1856, 256, 1, 256]
    - [34, 6033.47]
  - - [3584, 704, 1, 1]
    - [62, 139.554]
  - - [256, 704, 1, 256]
    - [13, 3258.29]
  - - [448, 5056, 1, 1]
    - [65, 130.477]
  - - [5888, 5888, 1, 256]
    - [33, 9891.16]
  - - [3584, 704, 1, 32]
    - [54, 2298.99]
  - - [448, 6784, 1, 3328]
    - [34, 9766.11]
  - - [6784, 4288, 1, 1]
    - [61, 253.219]
  - - [5056, 704, 1, 1]
    - [62, 162.977]
  - - [1408, 2368, 1, 32]
    - [41, 2732.9]
  - - [448, 5056, 1, 32]
    - [41, 2347.24]
  - - [4288, 4288, 1, 1280]
    - [34, 10247.7]
  - - [6784, 1408, 1, 1]
    - [69, 220.292]
  - - [1856, 5888, 1, 3328]
    - [35, 10365.7]
  - - [1024, 704, 1, 1]
    - [64, 59.6768]
  - - [5056, 5888, 1, 1]
    - [62, 254.008]
  - - [2944, 1024, 1, 256]
    - [35, 9007.38]
  - - [448, 1408, 1, 3328]
    - [37, 7212.92]
  - - [5056, 32, 1, 3328]
    - [59, 1359.98]
  - - [2368, 4288, 1, 3328]
    - [34, 10350.8]
  - - [1024, 704, 1, 32]
    - [51, 1264.73]
  - - [448, 2944, 1, 256]
    - [34, 7327.29]
  - - [2944, 6784, 1, 256]
    - [33, 9865.8]
  - - [2368, 2368, 1, 1280]
    - [35, 9930.14]
  - - [5888, 128, 1, 3328]
    - [37, 8596.77]
  - - [256, 256, 1, 32]
    - [49, 134.433]
  - - [1024, 1, 1, 256]
    - [77, 7.65607]
  - - [3584, 3584, 1, 32]
    - [41, 3670.02]
  - - [2944, 448, 1, 1]
    - [70, 94.208]
  - - [128, 32, 1, 32]
    - [52, 8.57801]
  - - [5056, 64, 1, 1280]
    - [39, 6903.13]
  - - [2944, 2944, 1, 1280]
    - [35, 10052.5]
  - - [1, 2368, 1, 256]
    - [77, 17.4198]
  - - [64, 6784, 1, 1]
    - [62, 40.806]
  - - [2944, 32, 1, 1280]
    - [59, 1039.54]
  - - [64, 1408, 1, 3328]
    - [25, 4179.11]
  - - [256, 448, 1, 1280]
    - [28, 4633.86]
  - - [2368, 2944, 1, 1]
    - [68, 178.57]
  - - [6784, 4288, 1, 1280]
    - [34, 10228.7]
  - - [2944, 704, 1, 256]
    - [36, 8914.31]
  - - [5888, 1856, 1, 256]
    - [36, 9861.82]
  - - [704, 2944, 1, 3328]
    - [34, 9770.98]
  - - [5888, 256, 1, 1]
    - [62, 102.96]
  - - [704, 704, 1, 32]
    - [52, 1054.5]
  - - [256, 4288, 1, 256]
    - [34, 7139.69]
  - - [5056, 6784, 1, 32]
    - [41, 3831.32]
  - - [5056, 128, 1, 1]
    - [65, 56.969]
  - - [448, 5056, 1, 1280]
    - [34, 9440.33]
  - - [448, 448, 1, 256]
    - [9, 4014.08]
  - - [256, 5888, 1, 3328]
    - [34, 9292.36]
  - - [704, 448, 1, 1280]
    - [37, 4875.63]
  - - [448, 64, 1, 256]
    - [16, 899.514]
  - - [1024, 704, 1, 1280]
    - [37, 8054.7]
  - - [5888, 1024, 1, 1]
    - [61, 198.333]
  - - [5888, 448, 1, 32]
    - [57, 2436.79]
  - - [6784, 2944, 1, 256]
    - [33, 9738.02]
  - - [1024, 256, 1, 1]
    - [77, 24.8242]
  - - [5888, 256, 1, 32]
    - [55, 1983.33]
  - - [2368, 448, 1, 256]
    - [34, 6885.93]
  - - [4288, 256, 1, 3328]
    - [37, 7984.87]
  - - [4288, 2944, 1, 256]
    - [33, 9661.9]
  - - [704, 4288, 1, 3328]
    - [34, 9701.8]
  - - [448, 5888, 1, 3328]
    - [34, 9221.31]
  - - [128, 256, 1, 3328]
    - [28, 1654.31]
  - - [2368, 5056, 1, 32]
    - [41, 3536.96]
  - - [32, 128, 1, 1280]
    - [54, 45.3536]
  - - [1408, 4288, 1, 1]
    - [67, 197.046]
  - - [1408, 1856, 1, 3328]
    - [34, 9989.08]
  - - [4288, 64, 1, 256]
    - [38, 4798.81]
  - - [2944, 5888, 1, 3328]
    - [34, 10336.1]
  - - [128, 6784, 1, 3328]
    - [11, 8157.96]
  - - [448, 4288, 1, 3328]
    - [34, 9070.9]
  - - [704, 2368, 1, 256]
    - [34, 8009.96]
  - - [1, 64, 1, 3328]
    - [82, 0.799279]
  - - [4288, 128, 1, 1]
    - [62, 50.8207]
  - - [704, 256, 1, 32]
    - [52, 355.121]
  - - [4288, 3584, 1, 3328]
    - [34, 10385.9]
  - - [2368, 1024, 1, 1280]
    - [34, 9150.31]
  - - [1408, 1024, 1, 1]
    - [61, 95.8638]
  - - [1408, 1024, 1, 256]
    - [35, 7954.71]
  - - [5056, 3584, 1, 1]
    - [62, 245.938]
  - - [448, 1024, 1, 256]
    - [34, 5848.63]
  - - [6784, 6784, 1, 3328]
    - [36, 10350.0]
  - - [1408, 256, 1, 1280]
    - [37, 5577.53]
  - - [6784, 32, 1, 32]
    - [54, 493.382]
  - - [64, 1024, 1, 3328]
    - [40, 3230.21]
  - - [2368, 2944, 1, 3328]
    - [34, 10207.3]
  - - [448, 448, 1, 1280]
    - [15, 5325.48]
  - - [5056, 3584, 1, 32]
    - [41, 3734.3]
  - - [5056, 3584, 1, 1280]
    - [33, 10306.5]
  - - [1024, 256, 1, 1280]
    - [21, 6278.9]
  - - [1856, 1856, 1, 256]
    - [35, 8904.0]
  - - [32, 5888, 1, 256]
    - [59, 1230.47]
  - - [256, 1408, 1, 32]
    - [54, 833.406]
  - - [2944, 1, 1, 3328]
    - [82, 36.9666]
  - - [32, 704, 1, 3328]
    - [54, 265.561]
  - - [5888, 4288, 1, 1]
    - [61, 249.681]
  - - [1024, 128, 1, 256]
    - [17, 3615.78]
  - - [32, 1856, 1, 3328]
    - [54, 704.306]
  - - [5056, 704, 1, 256]
    - [36, 9170.82]
  - - [448, 256, 1, 256]
    - [22, 3163.81]
  - - [2368, 5056, 1, 256]
    - [30, 9836.29]
  - - [1024, 5056, 1, 256]
    - [36, 9548.99]
  - - [32, 1024, 1, 3328]
    - [59, 408.006]
  - - [5888, 448, 1, 256]
    - [34, 8474.88]
  - - [6784, 5056, 1, 1280]
    - [4, 10192.9]
  - - [704, 6784, 1, 32]
    - [55, 2961.82]
  - - [4288, 6784, 1, 1280]
    - [34, 10397.1]
  - - [64, 1, 1, 256]
    - [77, 0.477389]
  - - [1856, 64, 1, 1280]
    - [40, 4823.72]
  - - [128, 1408, 1, 1]
    - [76, 13.9062]
  - - [1024, 64, 1, 32]
    - [49, 129.774]
  - - [1024, 64, 1, 3328]
    - [40, 3245.59]
  - - [704, 6784, 1, 3328]
    - [34, 9848.76]
  - - [5888, 4288, 1, 1280]
    - [33, 10286.6]
  - - [5888, 3584, 1, 1280]
    - [34, 10310.9]
  - - [5888, 128, 1, 1280]
    - [37, 8403.22]
  - - [1024, 2944, 1, 256]
    - [36, 8973.86]
  - - [1, 2944, 1, 1280]
    - [82, 32.5754]
  - - [32, 1024, 1, 256]
    - [54, 230.456]
  - - [2944, 1856, 1, 1280]
    - [34, 10110.4]
  - - [3584, 1, 1, 1280]
    - [82, 42.3516]
  - - [256, 3584, 1, 32]
    - [49, 1575.11]
  - - [1024, 2368, 1, 1]
    - [62, 135.921]
  - - [2944, 3584, 1, 1280]
    - [34, 10135.7]
  - - [64, 1, 1, 1]
    - [82, 0.00761905]
  - - [1856, 4288, 1, 256]
    - [34, 9502.72]
  - - [256, 128, 1, 3328]
    - [28, 1648.31]
  - - [1, 1856, 1, 3328]
    - [82, 23.2139]
  - - [1408, 704, 1, 1]
    - [70, 76.0147]
  - - [2368, 2944, 1, 32]
    - [41, 3101.84]
  - - [128, 4288, 1, 32]
    - [49, 1125.87]
  - - [128, 704, 1, 1280]
    - [25, 3855.06]
  - - [64, 64, 1, 1]
    - [67, 0.343624]
  - - [1, 1408, 1, 1]
    - [62, 0.128467]
  - - [128, 2368, 1, 1280]
    - [10, 6146.6]
  - - [2944, 32, 1, 32]
    - [49, 186.55]
  - - [448, 1856, 1, 1]
    - [65, 66.2013]
  - - [4288, 704, 1, 256]
    - [4, 8986.05]
  - - [1856, 1024, 1, 256]
    - [4, 8207.48]
  - - [448, 1856, 1, 32]
    - [49, 1484.8]
  - - [448, 1856, 1, 3328]
    - [37, 7397.33]
  - - [448, 448, 1, 32]
    - [49, 360.007]
  - - [1024, 448, 1, 256]
    - [13, 5895.61]
  - - [6784, 1, 1, 256]
    - [82, 43.5046]
  - - [1024, 5056, 1, 32]
    - [41, 3133.04]
  - - [1024, 4288, 1, 1]
    - [69, 178.783]
  - - [704, 256, 1, 3328]
    - [27, 4565.97]
  - - [704, 1856, 1, 32]
    - [54, 1866.61]
  - - [1408, 5888, 1, 1280]
    - [35, 10201.9]
  - - [32, 704, 1, 1280]
    - [54, 249.618]
  - - [5056, 1856, 1, 256]
    - [4, 9819.68]
  - - [6784, 704, 1, 1280]
    - [34, 9584.21]
  - - [704, 1408, 1, 32]
    - [49, 1645.2]
  - - [5888, 1024, 1, 256]
    - [34, 9546.66]
  - - [64, 2944, 1, 1]
    - [62, 14.4491]
  - - [64, 2944, 1, 32]
    - [52, 352.179]
  - - [64, 2944, 1, 1280]
    - [40, 6114.92]
  - - [6784, 1856, 1, 3328]
    - [3, 10003.4]
  - - [64, 704, 1, 3328]
    - [24, 2184.53]
  - - [2368, 5888, 1, 1280]
    - [33, 10251.1]
  - - [1, 6784, 1, 256]
    - [82, 43.2446]
  - - [6784, 6784, 1, 32]
    - [41, 3859.34]
  - - [256, 1, 1, 1280]
    - [82, 2.95527]
  - - [5888, 128, 1, 32]
    - [57, 1345.83]
  - - [6784, 256, 1, 256]
    - [37, 8221.08]
  - - [2368, 3584, 1, 3328]
    - [34, 10195.1]
  - - [128, 4288, 1, 1280]
    - [8, 7053.67]
  - - [128, 128, 1, 256]
    - [16, 519.097]
  - - [5888, 1024, 1, 1280]
    - [34, 10187.9]
  - - [1856, 704, 1, 3328]
    - [34, 9502.72]
  - - [5888, 6784, 1, 3328]
    - [34, 10270.6]
  - - [6784, 448, 1, 1]
    - [67, 149.569]
  - - [6784, 1856, 1, 1]
    - [62, 233.515]
  - - [128, 32, 1, 1280]
    - [59, 46.8784]
  - - [2944, 2368, 1, 1280]
    - [34, 10076.1]
  - - [4288, 448, 1, 1]
    - [65, 119.467]
  - - [6784, 448, 1, 32]
    - [48, 2355.99]
  - - [6784, 448, 1, 3328]
    - [34, 9596.36]
  - - [1, 6784, 1, 1]
    - [77, 0.731034]
  - - [448, 3584, 1, 1280]
    - [34, 8475.79]
  - - [1408, 6784, 1, 1280]
    - [34, 10150.1]
  - - [5056, 5888, 1, 1280]
    - [33, 10444.1]
  - - [32, 2944, 1, 32]
    - [52, 171.287]
  - - [1, 256, 1, 256]
    - [77, 1.8963]
  - - [5056, 2944, 1, 32]
    - [41, 3693.51]
  - - [32, 6784, 1, 256]
    - [59, 1397.75]
  - - [64, 5056, 1, 256]
    - [39, 5393.07]
  - - [4288, 6784, 1, 1]
    - [62, 253.749]
  - - [448, 704, 1, 1280]
    - [37, 4904.05]
  - - [64, 2368, 1, 1]
    - [72, 12.4632]
  - - [1, 4288, 1, 3328]
    - [82, 36.1022]
  - - [5056, 4288, 1, 1]
    - [67, 245.472]
  - - [2368, 5888, 1, 32]
    - [41, 3688.57]
  - - [128, 3584, 1, 1280]
    - [19, 7210.25]
  - - [2944, 6784, 1, 1]
    - [61, 243.799]
  - - [1, 256, 1, 1]
    - [62, 0.0231884]
  - - [5888, 1024, 1, 3328]
    - [34, 10285.8]
  - - [6784, 5888, 1, 256]
    - [33, 9932.5]
  - - [704, 128, 1, 1280]
    - [25, 3774.32]
  - - [4288, 128, 1, 256]
    - [10, 6014.95]
  - - [32, 3584, 1, 3328]
    - [59, 1403.65]
  - - [6784, 64, 1, 256]
    - [39, 5937.45]
  - - [1024, 1, 1, 1280]
    - [82, 11.804]
  - - [4288, 2368, 1, 32]
    - [41, 3486.35]
  - - [704, 3584, 1, 1]
    - [67, 137.726]
  - - [704, 1856, 1, 3328]
    - [34, 9497.74]
  - - [2944, 128, 1, 1280]
    - [12, 6851.49]
  - - [1, 2368, 1, 3328]
    - [82, 29.4848]
  - - [6784, 704, 1, 32]
    - [41, 2916.6]
  - - [4288, 1, 1, 1280]
    - [82, 35.0398]
  - - [704, 5888, 1, 256]
    - [35, 9461.12]
  - - [2944, 256, 1, 1]
    - [61, 62.8053]
  - - [64, 448, 1, 256]
    - [25, 873.813]
  - - [1408, 448, 1, 1280]
    - [37, 7072.56]
  - - [1408, 128, 1, 32]
    - [52, 349.949]
  - - [3584, 5056, 1, 32]
    - [41, 3713.26]
  - - [1024, 32, 1, 1280]
    - [59, 366.123]
  - - [128, 2368, 1, 1]
    - [62, 28.4872]
  - - [6784, 1856, 1, 1280]
    - [34, 9972.16]
  - - [5056, 5056, 1, 3328]
    - [30, 10464.7]
  - - [128, 2944, 1, 1280]
    - [6, 6843.71]
  - - [128, 6784, 1, 1]
    - [62, 70.9438]
  - - [5888, 1408, 1, 256]
    - [33, 9767.66]
  - - [2368, 1024, 1, 32]
    - [55, 2430.91]
  - - [256, 256, 1, 3328]
    - [24, 3184.93]
  - - [64, 4288, 1, 1]
    - [76, 25.7925]
  - - [4288, 1024, 1, 256]
    - [34, 9299.09]
  - - [3584, 32, 1, 32]
    - [54, 292.199]
  - - [3584, 64, 1, 1]
    - [72, 21.2385]
  - - [704, 32, 1, 1280]
    - [59, 246.882]
  - - [32, 4288, 1, 32]
    - [59, 322.861]
  - - [32, 6784, 1, 1280]
    - [59, 1768.54]
  - - [64, 1408, 1, 1]
    - [67, 7.71507]
  - - [4288, 5888, 1, 1280]
    - [34, 10317.3]
  - - [256, 1024, 1, 256]
    - [37, 4963.67]
  - - [5056, 5888, 1, 256]
    - [33, 10092.5]
  - - [1408, 128, 1, 1280]
    - [19, 5790.33]
  - - [1024, 5888, 1, 1280]
    - [34, 10218.1]
  - - [64, 1024, 1, 1]
    - [72, 5.57279]
  - - [32, 32, 1, 32]
    - [49, 2.12228]
  - - [64, 128, 1, 256]
    - [5, 231.986]
  - - [5888, 5056, 1, 1280]
    - [36, 10264.5]
  - - [5888, 2944, 1, 1]
    - [71, 239.687]
  - - [64, 4288, 1, 1280]
    - [39, 5941.69]
  - - [704, 2944, 1, 1]
    - [70, 122.783]
  - - [1408, 4288, 1, 3328]
    - [34, 9920.62]
  - - [704, 2944, 1, 32]
    - [41, 2375.45]
  - - [1, 5888, 1, 1280]
    - [82, 47.1512]
  - - [2944, 4288, 1, 3328]
    - [34, 10274.4]
  - - [256, 2944, 1, 256]
    - [34, 7220.73]
  - - [704, 448, 1, 32]
    - [54, 759.981]
  - - [5056, 2944, 1, 256]
    - [33, 9837.17]
  - - [704, 1024, 1, 256]
    - [34, 7011.75]
  - - [2368, 1856, 1, 256]
    - [34, 9326.28]
  - - [64, 3584, 1, 1]
    - [67, 16.6698]
  - - [1024, 128, 1, 1280]
    - [17, 5190.97]
  - - [2368, 4288, 1, 1280]
    - [34, 10246.2]
  - - [3584, 448, 1, 256]
    - [34, 7749.66]
  - - [256, 6784, 1, 256]
    - [34, 8307.1]
  - - [1024, 32, 1, 32]
    - [49, 69.3503]
  - - [4288, 704, 1, 1]
    - [67, 150.336]
  - - [128, 64, 1, 32]
    - [52, 16.5495]
  - - [64, 1, 1, 1280]
    - [82, 0.735104]
  - - [6784, 5888, 1, 3328]
    - [35, 10275.0]
  - - [256, 5888, 1, 1]
    - [67, 105.26]
  - - [6784, 3584, 1, 256]
    - [33, 9852.38]
  - - [1408, 1856, 1, 256]
    - [36, 9189.44]
  - - [128, 1408, 1, 256]
    - [19, 4032.98]
  - - [2944, 2944, 1, 32]
    - [41, 3372.43]
  - - [2944, 2944, 1, 3328]
    - [35, 10121.1]
  - - [1, 2944, 1, 256]
    - [77, 20.4356]
  - - [448, 32, 1, 1280]
    - [59, 160.179]
  - - [3584, 1, 1, 256]
    - [82, 31.3355]
  - - [704, 32, 1, 3328]
    - [59, 280.588]
  - - [256, 448, 1, 3328]
    - [25, 5043.36]
  - - [2368, 64, 1, 256]
    - [39, 3702.03]
  - - [64, 448, 1, 1280]
    - [24, 1325.87]
  - - [1408, 448, 1, 3328]
    - [37, 7220.86]
  - - [2368, 6784, 1, 3328]
    - [35, 10371.0]
  - - [4288, 3584, 1, 32]
    - [41, 3592.8]
  - - [5888, 64, 1, 3328]
    - [39, 7321.91]
  - - [3584, 704, 1, 1280]
    - [34, 9501.1]
  - - [448, 5056, 1, 3328]
    - [34, 9574.04]
  - - [4288, 448, 1, 256]
    - [4, 8307.13]
  - - [5056, 256, 1, 1280]
    - [34, 9224.67]
  - - [704, 448, 1, 3328]
    - [37, 5042.39]
  - - [2944, 5888, 1, 32]
    - [41, 3703.9]
  - - [3584, 5056, 1, 256]
    - [36, 9927.45]
  - - [6784, 1, 1, 3328]
    - [82, 56.6468]
  - - [64, 256, 1, 1]
    - [65, 1.43217]
  - - [1856, 448, 1, 3328]
    - [37, 7397.33]
  - - [3584, 2368, 1, 256]
    - [32, 9552.63]
  - - [128, 1024, 1, 1280]
    - [25, 5269.23]
  - - [4288, 256, 1, 32]
    - [56, 1682.34]
  - - [4288, 256, 1, 1280]
    - [34, 7837.42]
  - - [448, 5056, 1, 256]
    - [34, 8701.42]
  - - [128, 1856, 1, 1]
    - [73, 22.497]
  - - [128, 1856, 1, 32]
    - [54, 565.638]
  - - [1408, 1856, 1, 1]
    - [71, 121.887]
  - - [128, 2944, 1, 1]
    - [76, 35.6848]
  - - [3584, 32, 1, 256]
    - [59, 981.288]
  - - [448, 2368, 1, 1280]
    - [34, 7608.17]
  - - [3584, 256, 1, 1]
    - [72, 71.2348]
  - - [1408, 1856, 1, 1280]
    - [34, 9856.66]
  - - [3584, 4288, 1, 3328]
    - [34, 10396.2]
  - - [448, 128, 1, 256]
    - [17, 1714.96]
  - - [448, 4288, 1, 32]
    - [41, 2266.7]
  - - [448, 4288, 1, 1280]
    - [34, 8945.4]
  - - [64, 3584, 1, 256]
    - [9, 4675.18]
  - - [6784, 1408, 1, 1280]
    - [34, 9979.75]
  - - [1024, 4288, 1, 3328]
    - [34, 10080.1]
  - - [1, 6784, 1, 1280]
    - [82, 55.0426]
  - - [5056, 1024, 1, 256]
    - [33, 9571.06]
  - - [2368, 448, 1, 32]
    - [42, 1443.35]
  - - [256, 1, 1, 256]
    - [77, 1.923]
  - - [32, 2944, 1, 1280]
    - [59, 1034.54]
  - - [5056, 1024, 1, 1]
    - [62, 188.13]
  - - [2368, 256, 1, 256]
    - [34, 5968.82]
  - - [1, 5056, 1, 1]
    - [72, 0.540171]
  - - [4288, 32, 1, 32]
    - [54, 347.382]
  - - [1856, 3584, 1, 32]
    - [41, 3305.29]
  - - [5056, 3584, 1, 3328]
    - [35, 10371.5]
  - - [1856, 256, 1, 32]
    - [51, 964.743]
  - - [4288, 5056, 1, 256]
    - [33, 9927.93]
  - - [1856, 5888, 1, 256]
    - [35, 9886.91]
  - - [256, 256, 1, 256]
    - [19, 2016.49]
  - - [2368, 3584, 1, 1]
    - [67, 216.062]
  - - [4288, 2368, 1, 256]
    - [34, 9647.49]
  - - [448, 1, 1, 3328]
    - [82, 5.59496]
  - - [1856, 256, 1, 1280]
    - [37, 7338.01]
  - - [1024, 6784, 1, 1]
    - [71, 187.145]
  - - [1408, 2944, 1, 3328]
    - [34, 10097.7]
  - - [32, 1856, 1, 32]
    - [52, 120.593]
  - - [256, 1, 1, 1]
    - [62, 0.0336842]
  - - [6784, 5056, 1, 3328]
    - [34, 10296.1]
  - - [6784, 5056, 1, 1]
    - [61, 258.438]
  - - [5888, 3584, 1, 32]
    - [41, 3783.52]
  - - [5888, 3584, 1, 3328]
    - [34, 10392.4]
  - - [1, 256, 1, 3328]
    - [82, 3.19041]
  - - [1024, 6784, 1, 256]
    - [34, 9451.45]
  - - [6784, 5888, 1, 32]
    - [41, 3918.02]
  - - [1408, 1, 1, 1280]
    - [82, 15.966]
  - - [2368, 6784, 1, 32]
    - [41, 3673.99]
  - - [6784, 64, 1, 1]
    - [73, 39.0446]
  - - [2368, 32, 1, 32]
    - [49, 158.693]
  - - [3584, 1408, 1, 3328]
    - [34, 9903.05]
  - - [2944, 1408, 1, 1280]
    - [35, 9989.82]
  - - [1856, 64, 1, 1]
    - [76, 10.0324]
  - - [3584, 1024, 1, 1]
    - [61, 164.427]
  - - [256, 32, 1, 256]
    - [54, 62.4152]
  - - [2944, 1856, 1, 3328]
    - [34, 10228.4]
  - - [128, 1024, 1, 3328]
    - [25, 5715.51]
  - - [1408, 128, 1, 1]
    - [67, 13.5711]
  - - [2944, 3584, 1, 32]
    - [41, 3564.63]
  - - [3584, 1024, 1, 32]
    - [41, 2723.57]
  - - [4288, 6784, 1, 3328]
    - [34, 10489.5]
  - - [256, 128, 1, 1280]
    - [25, 1533.01]
  - - [6784, 5056, 1, 256]
    - [4, 9904.32]
  - - [1408, 32, 1, 3328]
    - [54, 538.91]
  - - [1856, 3584, 1, 1280]
    - [35, 10024.5]
  - - [256, 5888, 1, 256]
    - [35, 8301.98]
  - - [5056, 32, 1, 256]
    - [59, 1078.61]
  - - [2368, 1408, 1, 1]
    - [62, 160.295]
  - - [448, 2368, 1, 256]
    - [34, 6942.26]
  - - [64, 1408, 1, 1280]
    - [28, 3855.06]
  - - [3584, 32, 1, 1280]
    - [59, 1378.67]
  - - [128, 2368, 1, 3328]
    - [10, 6400.57]
  - - [3584, 1024, 1, 256]
    - [35, 9478.61]
  - - [256, 64, 1, 256]
    - [16, 514.008]
  - - [2368, 448, 1, 3328]
    - [34, 7730.24]
  - - [3584, 2368, 1, 1]
    - [67, 214.316]
  - - [1, 1, 1, 1]
    - [72, 8.99281e-05]
  - - [1024, 1856, 1, 32]
    - [56, 2165.86]
  - - [32, 1024, 1, 32]
    - [52, 67.5629]
  - - [4288, 1, 1, 256]
    - [82, 28.4681]
  - - [1856, 128, 1, 3328]
    - [20, 6664.08]
  - - [5888, 2368, 1, 1]
    - [61, 224.305]
  - - [5888, 128, 1, 1]
    - [64, 58.88]
  - - [704, 256, 1, 1280]
    - [27, 4362.46]
  - - [704, 4288, 1, 256]
    - [4, 8986.05]
  - - [5888, 2368, 1, 32]
    - [41, 3598.14]
  - - [5888, 2368, 1, 1280]
    - [36, 10245.9]
  - - [128, 256, 1, 256]
    - [17, 970.904]
  - - [2944, 5056, 1, 3328]
    - [34, 10425.8]
  - - [6784, 704, 1, 3328]
    - [34, 9673.25]
  - - [1856, 1856, 1, 32]
    - [41, 2707.06]
  - - [4288, 2944, 1, 32]
    - [41, 3541.06]
  - - [128, 448, 1, 1]
    - [67, 4.77867]
  - - [2944, 64, 1, 1]
    - [67, 14.72]
  - - [704, 64, 1, 256]
    - [25, 1373.14]
  - - [256, 2368, 1, 3328]
    - [37, 6937.62]
  - - [704, 1, 1, 1]
    - [62, 0.0647059]
  - - [128, 448, 1, 1280]
    - [29, 2527.56]
  - - [5056, 5056, 1, 256]
    - [30, 9973.43]
  - - [5888, 64, 1, 1]
    - [78, 31.1947]
  - - [6784, 6784, 1, 256]
    - [33, 9998.12]
  - - [256, 3584, 1, 1]
    - [70, 70.3607]
  - - [2368, 2944, 1, 256]
    - [31, 9513.2]
  - - [448, 32, 1, 32]
    - [49, 30.5021]
  - - [5888, 3584, 1, 1]
    - [64, 243.791]
  - - [5888, 128, 1, 256]
    - [7, 7264.23]
  - - [3584, 704, 1, 3328]
    - [34, 9653.5]
  - - [4288, 704, 1, 3328]
    - [34, 9693.56]
  - - [4288, 2944, 1, 1280]
    - [34, 10146.3]
  - - [448, 3584, 1, 256]
    - [34, 7749.66]
  - - [704, 32, 1, 256]
    - [54, 171.234]
  - - [6784, 256, 1, 32]
    - [41, 2098.74]
  - - [1856, 128, 1, 1]
    - [79, 21.2114]
  - - [1856, 32, 1, 32]
    - [49, 125.697]
  - - [2368, 5056, 1, 1280]
    - [30, 10294.6]
  - - [704, 1856, 1, 1280]
    - [37, 9328.86]
  - - [1408, 1408, 1, 1280]
    - [34, 9231.5]
  - - [448, 1024, 1, 3328]
    - [37, 7317.52]
  - - [32, 704, 1, 32]
    - [52, 47.4274]
  - - [3584, 448, 1, 1]
    - [72, 106.757]
  - - [6784, 1024, 1, 3328]
    - [37, 9948.61]
  - - [5888, 1856, 1, 32]
    - [41, 3508.23]
  - - [5888, 704, 1, 3328]
    - [36, 10072.3]
  - - [5056, 1, 1, 256]
    - [82, 33.4281]
  - - [448, 6784, 1, 256]
    - [35, 9080.81]
  - - [1024, 128, 1, 1]
    - [72, 10.996]
  - - [128, 64, 1, 256]
    - [8, 216.648]
  - - [128, 5056, 1, 1]
    - [76, 57.7829]
  - - [1856, 128, 1, 256]
    - [9, 4751.36]
  - - [64, 704, 1, 1]
    - [67, 3.88414]
  - - [2944, 5888, 1, 256]
    - [33, 9819.38]
  - - [1408, 64, 1, 256]
    - [39, 2645.49]
  - - [128, 5056, 1, 32]
    - [51, 1268.96]
  - - [128, 5056, 1, 1280]
    - [11, 7965.14]
  - - [448, 32, 1, 3328]
    - [59, 177.546]
  - - [1856, 1408, 1, 32]
    - [41, 2568.3]
  - - [64, 704, 1, 32]
    - [52, 92.899]
  - - [1, 5888, 1, 256]
    - [82, 37.0169]
  - - [64, 2368, 1, 32]
    - [52, 297.161]
  - - [5888, 64, 1, 32]
    - [52, 842.083]
  - - [2368, 256, 1, 1]
    - [62, 54.1257]
  - - [5888, 64, 1, 1280]
    - [39, 7068.36]
  - - [5056, 1, 1, 1]
    - [76, 0.509677]
  - - [5888, 2944, 1, 1280]
    - [34, 10201.9]
  - - [256, 1408, 1, 256]
    - [34, 4766.25]
  - - [448, 5888, 1, 1]
    - [62, 142.124]
  - - [3584, 1408, 1, 1]
    - [69, 186.072]
  - - [32, 6784, 1, 32]
    - [52, 504.856]
  - - [32, 1856, 1, 1280]
    - [54, 643.38]
  - - [448, 5888, 1, 32]
    - [45, 2259.38]
  - - [5056, 704, 1, 1280]
    - [36, 9725.2]
  - - [1856, 6784, 1, 1]
    - [67, 233.862]
  - - [5056, 64, 1, 1]
    - [62, 32.1016]
  - - [1, 5888, 1, 1]
    - [65, 0.579528]
  - - [2368, 1024, 1, 256]
    - [35, 8573.99]
  - - [1856, 6784, 1, 32]
    - [41, 3612.94]
  - - [1856, 6784, 1, 1280]
    - [34, 10156.7]
  - - [64, 3584, 1, 3328]
    - [15, 6399.76]
  - - [5888, 5056, 1, 3328]
    - [36, 10315.0]
  - - [1, 2944, 1, 3328]
    - [82, 36.6239]
  - - [1408, 6784, 1, 32]
    - [41, 3518.18]
  - - [32, 5888, 1, 1280]
    - [59, 1534.18]
  - - [448, 256, 1, 1]
    - [76, 9.62148]
  - - [3584, 5888, 1, 3328]
    - [34, 10419.3]
  - - [4288, 1408, 1, 256]
    - [33, 9406.04]
  - - [448, 64, 1, 1280]
    - [28, 1314.48]
  - - [128, 448, 1, 32]
    - [43, 116.435]
  - - [6784, 2368, 1, 256]
    - [36, 9776.8]
  - - [1408, 448, 1, 32]
    - [49, 1224.82]
  - - [1856, 1408, 1, 1280]
    - [34, 9849.7]
  - - [448, 256, 1, 3328]
    - [25, 5048.7]
  - - [1856, 2368, 1, 1]
    - [67, 177.218]
  - - [1408, 5056, 1, 3328]
    - [34, 10054.8]
  - - [128, 704, 1, 3328]
    - [25, 4151.34]
  - - [5056, 128, 1, 1280]
    - [11, 7916.43]
  - - [5056, 4288, 1, 256]
    - [33, 9918.0]
  - - [5056, 5056, 1, 32]
    - [41, 3690.1]
  - - [1856, 704, 1, 256]
    - [34, 8329.08]
  - - [2368, 256, 1, 32]
    - [51, 1212.42]
  - - [64, 256, 1, 256]
    - [24, 514.008]
  - - [448, 5888, 1, 1280]
    - [34, 9101.83]
  - - [704, 704, 1, 3328]
    - [37, 7884.37]
  - - [128, 6784, 1, 256]
    - [2, 7161.67]
  - - [5056, 448, 1, 256]
    - [34, 8701.42]
  - - [4288, 5888, 1, 1]
    - [62, 249.879]
  - - [1856, 5056, 1, 1280]
    - [30, 10265.5]
  - - [704, 1856, 1, 1]
    - [65, 92.8]
  - - [2368, 32, 1, 3328]
    - [54, 896.298]
  - - [3584, 1856, 1, 256]
    - [36, 9562.49]
  - - [256, 3584, 1, 256]
    - [34, 7126.24]
  - - [2944, 1408, 1, 1]
    - [66, 173.292]
  - - [4288, 5888, 1, 32]
    - [41, 3711.54]
  - - [4288, 5888, 1, 3328]
    - [34, 10413.1]
  - - [1, 1024, 1, 1]
    - [62, 0.0914286]
  - - [32, 64, 1, 32]
    - [49, 4.22268]
  - - [1408, 2368, 1, 1]
    - [75, 138.003]
  - - [2944, 2368, 1, 256]
    - [32, 9501.02]
  - - [1024, 1856, 1, 256]
    - [36, 8163.41]
  - - [2944, 64, 1, 3328]
    - [39, 6510.05]
  - - [1024, 5888, 1, 32]
    - [41, 3241.57]
  - - [1024, 5888, 1, 3328]
    - [34, 10321.8]
  - - [5056, 2368, 1, 32]
    - [41, 3536.96]
  - - [1408, 2368, 1, 1280]
    - [34, 9790.11]
  - - [256, 1, 1, 3328]
    - [82, 3.1952]
  - - [128, 1024, 1, 32]
    - [52, 273.067]
  - - [5056, 6784, 1, 3328]
    - [34, 10470.4]
  - - [448, 704, 1, 1]
    - [70, 27.7634]
  - - [448, 704, 1, 32]
    - [54, 729.23]
  - - [448, 704, 1, 3328]
    - [37, 5034.65]
  - - [1408, 2944, 1, 256]
    - [36, 9467.87]
  - - [3584, 4288, 1, 1]
    - [62, 240.128]
  - - [2368, 128, 1, 32]
    - [54, 709.015]
  - - [5056, 1408, 1, 1280]
    - [35, 9967.76]
  - - [2368, 128, 1, 3328]
    - [10, 6403.82]
  - - [704, 5056, 1, 32]
    - [55, 2780.8]
  - - [32, 2368, 1, 32]
    - [49, 155.438]
  - - [1408, 1, 1, 256]
    - [77, 10.5518]
  - - [256, 1856, 1, 32]
    - [54, 1010.93]
  - - [448, 1408, 1, 1]
    - [67, 53.6381]
  - - [5056, 4288, 1, 1280]
    - [34, 10329.4]
  - - [1408, 256, 1, 256]
    - [37, 4669.77]
  - - [128, 256, 1, 1]
    - [61, 3.30323]
  - - [256, 4288, 1, 32]
    - [56, 1695.33]
  - - [64, 64, 1, 3328]
    - [26, 201.411]
  - - [256, 256, 1, 1]
    - [76, 5.53514]
  - - [1408, 1, 1, 1]
    - [62, 0.129412]
  - - [448, 1408, 1, 256]
    - [34, 6229.97]
  - - [5888, 5888, 1, 1]
    - [69, 259.806]
  - - [128, 2944, 1, 32]
    - [54, 866.28]
  - - [32, 1024, 1, 1280]
    - [59, 362.829]
  - - [32, 256, 1, 32]
    - [52, 17.3376]
  - - [2944, 704, 1, 1280]
    - [34, 9617.52]
  - - [1024, 3584, 1, 1280]
    - [34, 10046.2]
  - - [704, 6784, 1, 256]
    - [34, 9151.49]
  - - [1856, 448, 1, 1]
    - [65, 66.6256]
  - - [128, 704, 1, 1]
    - [77, 7.4596]
  - - [5056, 256, 1, 32]
    - [54, 1842.47]
  - - [4288, 1, 1, 3328]
    - [82, 36.3227]
  - - [5056, 1024, 1, 1280]
    - [35, 10054.3]
  - - [704, 704, 1, 1]
    - [62, 43.3231]
  - - [1856, 448, 1, 1280]
    - [37, 7277.79]
  - - [3584, 6784, 1, 256]
    - [33, 9981.31]
  - - [64, 1856, 1, 1280]
    - [40, 4848.33]
  - - [1856, 1408, 1, 256]
    - [35, 9179.36]
  - - [4288, 4288, 1, 32]
    - [41, 3742.89]
  - - [128, 1, 1, 256]
    - [77, 0.977566]
  - - [32, 64, 1, 3328]
    - [54, 24.2934]
  - - [5888, 448, 1, 1]
    - [67, 142.124]
  - - [128, 5888, 1, 256]
    - [7, 7330.47]
  - - [3584, 256, 1, 3328]
    - [37, 8157.33]
  - - [5056, 5056, 1, 1280]
    - [30, 10409.2]
  - - [2368, 1, 1, 256]
    - [77, 17.4198]
  - - [6784, 1408, 1, 3328]
    - [34, 10055.6]
  - - [1408, 1408, 1, 1]
    - [74, 118.004]
  - - [32, 64, 1, 256]
    - [54, 15.3121]
  - - [2368, 1, 1, 1280]
    - [82, 27.1793]
  - - [32, 3584, 1, 32]
    - [49, 210.437]
  - - [2368, 5056, 1, 1]
    - [62, 231.668]
  - - [1, 3584, 1, 1]
    - [72, 0.367213]
  - - [256, 2944, 1, 3328]
    - [37, 8615.67]
  - - [1408, 64, 1, 3328]
    - [25, 4146.75]
  - - [1, 128, 1, 3328]
    - [82, 1.61016]
  - - [32, 256, 1, 256]
    - [54, 61.1058]
  - - [5888, 1408, 1, 32]
    - [41, 3483.32]
  - - [704, 256, 1, 1]
    - [62, 13.9062]
  - - [1, 448, 1, 1]
    - [75, 0.0523364]
  - - [256, 6784, 1, 3328]
    - [34, 9280.27]
  - - [64, 5888, 1, 256]
    - [39, 5688.03]
  - - [1856, 1, 1, 1]
    - [62, 0.170588]
  - - [1024, 256, 1, 3328]
    - [37, 6633.33]
  - - [704, 704, 1, 256]
    - [37, 6395.05]
  - - [448, 1024, 1, 32]
    - [54, 981.288]
  - - [6784, 2368, 1, 1280]
    - [36, 10130.9]
  - - [128, 1856, 1, 1280]
    - [20, 6272.42]
  - - [256, 2368, 1, 256]
    - [34, 5987.24]
  - - [1024, 448, 1, 32]
    - [51, 941.03]
  - - [6784, 1024, 1, 256]
    - [34, 9332.41]
  - - [1408, 6784, 1, 3328]
    - [34, 10255.2]
  - - [2944, 1408, 1, 3328]
    - [34, 10101.8]
  - - [1856, 32, 1, 256]
    - [54, 451.436]
  - - [704, 2368, 1, 32]
    - [54, 2051.78]
  - - [448, 256, 1, 32]
    - [58, 216.392]
  - - [704, 6784, 1, 1]
    - [62, 183.126]
  - - [2368, 6784, 1, 256]
    - [33, 9943.22]
  - - [1856, 64, 1, 256]
    - [39, 3248.79]
  - - [1856, 3584, 1, 3328]
    - [35, 10101.8]
  - - [1, 704, 1, 3328]
    - [82, 8.78944]
  - - [5056, 1408, 1, 32]
    - [41, 3350.05]
  - - [64, 1, 1, 3328]
    - [82, 0.799279]
  - - [5056, 4288, 1, 3328]
    - [34, 10445.7]
  - - [4288, 2368, 1, 1]
    - [62, 224.646]
  - - [704, 448, 1, 256]
    - [37, 4119.41]
  - - [448, 64, 1, 3328]
    - [25, 1447.52]
  - - [2368, 256, 1, 1280]
    - [37, 6792.25]
  - - [256, 32, 1, 1280]
    - [54, 90.833]
  - - [2368, 448, 1, 1280]
    - [34, 7591.16]
  - - [6784, 2944, 1, 32]
    - [41, 3750.63]
  - - [64, 4288, 1, 32]
    - [59, 649.543]
  - - [3584, 1856, 1, 1]
    - [69, 199.877]
  - - [128, 448, 1, 3328]
    - [26, 2790.07]
  - - [5888, 2368, 1, 3328]
    - [36, 10313.1]
  - - [2368, 704, 1, 1280]
    - [34, 8785.62]
  - - [1024, 1408, 1, 1280]
    - [34, 8751.39]
  - - [4288, 64, 1, 1280]
    - [39, 5965.91]
  - - [2368, 6784, 1, 1]
    - [67, 241.935]
  - - [2944, 5056, 1, 32]
    - [41, 3652.73]
  - - [5056, 256, 1, 3328]
    - [34, 9403.49]
  - - [448, 448, 1, 1]
    - [67, 14.5017]
  - - [256, 2368, 1, 1280]
    - [34, 6782.75]
  - - [704, 2368, 1, 3328]
    - [34, 8910.47]
  - - [3584, 2944, 1, 256]
    - [33, 9583.92]
  - - [64, 6784, 1, 256]
    - [38, 5837.66]
  - - [3584, 1024, 1, 1280]
    - [36, 10039.4]
  - - [1408, 256, 1, 32]
    - [54, 838.251]
  - - [64, 1024, 1, 256]
    - [19, 1997.29]
  - - [1408, 32, 1, 32]
    - [49, 99.0242]
  - - [128, 3584, 1, 256]
    - [34, 5967.51]
  - - [4288, 2944, 1, 1]
    - [62, 233.775]
  - - [5056, 3584, 1, 256]
    - [33, 9946.18]
  - - [2368, 704, 1, 256]
    - [34, 8046.2]
  - - [1856, 1856, 1, 1280]
    - [34, 9447.34]
  - - [64, 32, 1, 32]
    - [52, 4.42811]
  - - [1856, 1024, 1, 1]
    - [68, 115.887]
  - - [4288, 2944, 1, 3328]
    - [34, 10256.3]
  - - [1024, 128, 1, 3328]
    - [28, 5727.52]
  - - [4288, 128, 1, 3328]
    - [14, 7216.42]
  - - [4288, 704, 1, 32]
    - [56, 2520.88]
  - - [1856, 1024, 1, 32]
    - [41, 2190.83]
  - - [1, 448, 1, 3328]
    - [82, 5.6]
  - - [6784, 2368, 1, 32]
    - [41, 3620.17]
  - - [5888, 5056, 1, 1]
    - [66, 255.403]
  - - [128, 6784, 1, 1280]
    - [11, 8012.47]
  - - [704, 5888, 1, 1]
    - [62, 175.049]
  - - [6784, 6784, 1, 1]
    - [66, 265.474]
  - - [1856, 32, 1, 1280]
    - [59, 658.996]
  - - [3584, 1024, 1, 3328]
    - [34, 10171.4]
  - - [5888, 448, 1, 3328]
    - [34, 9207.37]
  - - [704, 5888, 1, 32]
    - [41, 2945.05]
  - - [704, 5888, 1, 1280]
    - [35, 9982.3]
  - - [1024, 6784, 1, 3328]
    - [34, 10171.3]
  - - [704, 2944, 1, 1280]
    - [34, 9628.69]
  - - [4288, 6784, 1, 256]
    - [33, 10035.3]
  - - [3584, 256, 1, 32]
    - [49, 1561.71]
  - - [1408, 1408, 1, 32]
    - [41, 2285.26]
  - - [1408, 1408, 1, 3328]
    - [34, 9352.52]
  - - [1024, 64, 1, 256]
    - [39, 1997.29]
  - - [4288, 64, 1, 32]
    - [54, 627.273]
  - - [5888, 6784, 1, 32]
    - [41, 3929.58]
  - - [1024, 2944, 1, 3328]
    - [34, 9689.39]
  - - [64, 704, 1, 1280]
    - [16, 2008.07]
  - - [2944, 1856, 1, 256]
    - [34, 9461.58]
  - - [128, 5056, 1, 3328]
    - [11, 8131.14]
  - - [704, 1408, 1, 1]
    - [69, 74.641]
  - - [6784, 5056, 1, 32]
    - [41, 3847.44]
  - - [1024, 448, 1, 3328]
    - [37, 7306.31]
  - - [5888, 1408, 1, 1]
    - [61, 212.79]
  - - [2944, 4288, 1, 1280]
    - [3, 10150.4]
  - - [64, 32, 1, 3328]
    - [59, 25.4699]
  - - [1024, 4288, 1, 256]
    - [34, 9305.24]
  - - [128, 2368, 1, 256]
    - [10, 4948.64]
  - - [2368, 64, 1, 32]
    - [49, 303.104]
  - - [1408, 1, 1, 3328]
    - [82, 17.5368]
  - - [64, 1408, 1, 32]
    - [49, 182.969]
  - - [2368, 5888, 1, 1]
    - [62, 222.019]
  - - [448, 1856, 1, 256]
    - [34, 6521.47]
  - - [1856, 6784, 1, 3328]
    - [34, 10249.7]
  - - [3584, 128, 1, 256]
    - [1, 5919.38]
  - - [1024, 448, 1, 1280]
    - [37, 7084.97]
  - - [1024, 2368, 1, 32]
    - [55, 2430.91]
  - - [128, 5888, 1, 1]
    - [69, 64.0871]
  - - [64, 5056, 1, 1]
    - [72, 30.8763]
  - - [32, 2368, 1, 1280]
    - [59, 841.371]
  - - [2368, 2368, 1, 3328]
    - [34, 10027.0]
  - - [64, 448, 1, 1]
    - [64, 2.9377]
  - - [3584, 5888, 1, 32]
    - [41, 3786.92]
  - - [3584, 5888, 1, 1280]
    - [34, 10321.0]
  - - [64, 5056, 1, 32]
    - [54, 756.922]
  - - [6784, 704, 1, 256]
    - [34, 9021.84]
  - - [1408, 704, 1, 32]
    - [52, 1638.4]
  - - [1408, 704, 1, 1280]
    - [37, 8628.79]
  - - [2368, 5888, 1, 256]
    - [33, 9890.69]
  - - [2944, 64, 1, 32]
    - [49, 360.605]
  - - [1, 1408, 1, 256]
    - [77, 10.5271]
  - - [64, 2944, 1, 256]
    - [39, 4369.07]
  - - [5888, 5888, 1, 32]
    - [41, 3861.71]
  - - [1856, 1408, 1, 3328]
    - [34, 9995.51]
  - - [1024, 1024, 1, 32]
    - [41, 1619.42]
  - - [4288, 1024, 1, 1]
    - [67, 175.356]
  - - [2944, 5056, 1, 1280]
    - [34, 10321.0]
  - - [6784, 2944, 1, 1280]
    - [37, 10061.5]
  - - [6784, 256, 1, 3328]
    - [37, 9140.54]
  - - [5056, 128, 1, 3328]
    - [11, 8133.59]
  - - [128, 128, 1, 1280]
    - [24, 762.047]
  - - [128, 4288, 1, 1]
    - [72, 49.3583]
  - - [1408, 5056, 1, 32]
    - [41, 3224.85]
  - - [2944, 128, 1, 3328]
    - [6, 7115.85]
  - - [5888, 1856, 1, 1280]
    - [36, 10280.5]
  - - [256, 64, 1, 1280]
    - [24, 764.268]
  - - [5888, 256, 1, 1280]
    - [34, 9131.86]
  - - [1856, 5056, 1, 1]
    - [62, 194.204]
  - - [3584, 1856, 1, 1280]
    - [36, 10019.8]
  - - [704, 3584, 1, 256]
    - [35, 8901.91]
  - - [1856, 5056, 1, 32]
    - [41, 3456.33]
  - - [1856, 5056, 1, 3328]
    - [34, 10355.2]
  - - [1024, 2944, 1, 32]
    - [41, 2691.66]
  - - [1408, 6784, 1, 256]
    - [34, 9593.84]
  - - [1024, 2368, 1, 1280]
    - [34, 9150.31]
  - - [1856, 3584, 1, 1]
    - [62, 202.802]
  - - [2944, 5888, 1, 1280]
    - [34, 10241.1]
  - - [1, 1856, 1, 1]
    - [67, 0.166906]
  - - [3584, 3584, 1, 256]
    - [33, 9810.07]
  - - [1856, 2368, 1, 3328]
    - [34, 10097.3]
  - - [5888, 704, 1, 256]
    - [36, 9434.2]
  - - [64, 448, 1, 32]
    - [55, 64.7955]
  - - [6784, 4288, 1, 256]
    - [4, 9893.43]
  - - [128, 64, 1, 3328]
    - [24, 387.258]
  - - [1, 5056, 1, 1280]
    - [82, 41.3155]
  - - [32, 64, 1, 1280]
    - [59, 23.0598]
  - - [1408, 2368, 1, 3328]
    - [34, 9933.42]
  - - [1024, 3584, 1, 256]
    - [36, 9440.56]
  - - [2944, 128, 1, 256]
    - [0, 5608.66]
  - - [6784, 128, 1, 1]
    - [62, 71.8834]
  - - [1408, 256, 1, 3328]
    - [37, 5756.1]
  - - [448, 32, 1, 256]
    - [54, 108.709]
  - - [5056, 6784, 1, 1280]
    - [33, 10401.6]
  - - [64, 2368, 1, 256]
    - [39, 3673.99]
  - - [2944, 256, 1, 256]
    - [34, 7286.18]
  - - [1, 128, 1, 256]
    - [77, 0.961502]
  - - [32, 256, 1, 1280]
    - [59, 91.9804]
  - - [5888, 1, 1, 256]
    - [82, 38.4522]
  - - [32, 128, 1, 3328]
    - [59, 50.502]
  - - [6784, 128, 1, 256]
    - [0, 7180.17]
  - - [6784, 64, 1, 1280]
    - [39, 7169.06]
  - - [4288, 1024, 1, 32]
    - [41, 2956.84]
  - - [2944, 448, 1, 1280]
    - [34, 8023.8]
  - - [6784, 32, 1, 1280]
    - [59, 1742.8]
  - - [2944, 64, 1, 1280]
    - [39, 6114.92]
  - - [704, 448, 1, 1]
    - [65, 29.4209]
  - - [32, 128, 1, 32]
    - [52, 8.48912]
  - - [1, 128, 1, 1]
    - [62, 0.0115942]
  - - [32, 4288, 1, 256]
    - [54, 869.488]
  - - [5888, 1, 1, 1]
    - [67, 0.603279]
  - - [5888, 1856, 1, 3328]
    - [36, 10359.8]
  - - [32, 2368, 1, 3328]
    - [54, 891.987]
  - - [2368, 3584, 1, 256]
    - [31, 9579.58]
  - - [4288, 1408, 1, 3328]
    - [34, 9916.3]
  - - [1856, 32, 1, 3328]
    - [54, 705.312]
  - - [2944, 32, 1, 256]
    - [54, 685.149]
  - - [128, 64, 1, 1]
    - [82, 0.716084]
  - - [256, 1024, 1, 3328]
    - [37, 6653.56]
  - - [32, 448, 1, 256]
    - [54, 106.687]
  - - [1856, 64, 1, 32]
    - [52, 238.762]
  - - [1856, 64, 1, 3328]
    - [40, 5245.66]
  - - [256, 5056, 1, 256]
    - [34, 8283.75]
  - - [5888, 2944, 1, 3328]
    - [34, 10319.3]
  - - [2368, 1408, 1, 3328]
    - [34, 9922.76]
  - - [5888, 704, 1, 32]
    - [52, 2754.25]
  - - [2944, 704, 1, 1]
    - [62, 98.5065]
  - - [6784, 1856, 1, 256]
    - [36, 9480.36]
  - - [1, 704, 1, 256]
    - [77, 5.26347]
  - - [1856, 1856, 1, 1]
    - [68, 130.482]
  - - [5888, 32, 1, 256]
    - [59, 1245.73]
  - - [2368, 1856, 1, 1]
    - [62, 177.218]
  - - [128, 704, 1, 256]
    - [25, 2597.82]
  - - [256, 1408, 1, 3328]
    - [37, 5749.48]
  - - [2944, 128, 1, 1]
    - [72, 35.6848]
  - - [32, 256, 1, 3328]
    - [59, 101.758]
  - - [2944, 704, 1, 3328]
    - [34, 9776.52]
  - - [2368, 1856, 1, 32]
    - [41, 2881.97]
  - - [3584, 128, 1, 1280]
    - [23, 7147.06]
  - - [1024, 5056, 1, 3328]
    - [34, 10158.4]
  - - [256, 32, 1, 32]
    - [49, 17.3376]
  - - [64, 256, 1, 3328]
    - [24, 828.158]
  - - [256, 6784, 1, 1]
    - [62, 113.659]
  - - [1024, 3584, 1, 32]
    - [41, 2884.1]
  - - [256, 6784, 1, 32]
    - [54, 2111.49]
  - - [2944, 1408, 1, 32]
    - [41, 2998.3]
  - - [1024, 32, 1, 256]
    - [54, 250.257]
  - - [4288, 3584, 1, 1]
    - [63, 221.316]
  - - [1, 704, 1, 1]
    - [70, 0.0642336]
  - - [5056, 448, 1, 3328]
    - [34, 9548.81]
  - - [3584, 64, 1, 256]
    - [20, 4705.15]
  - - [64, 1856, 1, 32]
    - [49, 242.416]
  - - [64, 1856, 1, 3328]
    - [25, 5245.66]
  - - [5888, 5888, 1, 3328]
    - [36, 10244.5]
  - - [6784, 3584, 1, 32]
    - [41, 3827.45]
  - - [4288, 1856, 1, 256]
    - [3, 9463.88]
  - - [1856, 2944, 1, 256]
    - [34, 9461.58]
  - - [4288, 256, 1, 1]
    - [71, 82.6602]
  - - [64, 128, 1, 32]
    - [49, 16.3025]
  - - [704, 1, 1, 1280]
    - [82, 7.94919]
  - - [1024, 2368, 1, 256]
    - [36, 8526.88]
  - - [2944, 5888, 1, 1]
    - [69, 247.631]
  - - [1024, 1856, 1, 3328]
    - [34, 8978.27]
  - - [5888, 1024, 1, 32]
    - [41, 3245.93]
  - - [3584, 256, 1, 1280]
    - [37, 8000.04]
  - - [1024, 1, 1, 1]
    - [65, 0.0927536]
  - - [1408, 5056, 1, 1280]
    - [36, 9982.61]
  - - [5056, 6784, 1, 256]
    - [33, 10053.1]
  - - [256, 1856, 1, 256]
    - [37, 6033.47]
  - - [1856, 256, 1, 1]
    - [65, 41.2444]
  - - [5888, 32, 1, 1280]
    - [59, 1559.57]
  - - [256, 704, 1, 1]
    - [62, 13.4898]
  - - [256, 128, 1, 32]
    - [52, 66.534]
  - - [1408, 1856, 1, 32]
    - [49, 2442.29]
  - - [2944, 5056, 1, 1]
    - [66, 226.627]
  - - [448, 128, 1, 1]
    - [67, 4.77867]
  - - [256, 704, 1, 32]
    - [58, 316.182]
  - - [256, 704, 1, 1280]
    - [27, 4342.75]
  - - [1, 2368, 1, 1]
    - [76, 0.208451]
  - - [5888, 5888, 1, 1280]
    - [36, 10185.4]
  - - [256, 2944, 1, 1280]
    - [37, 8403.22]
  - - [2944, 256, 1, 3328]
    - [37, 8601.49]
  - - [5056, 2944, 1, 1280]
    - [34, 10301.8]
  - - [704, 1024, 1, 3328]
    - [37, 8250.14]
  - - [2368, 1856, 1, 1280]
    - [34, 9978.73]
  - - [448, 2944, 1, 1]
    - [61, 94.7494]
  - - [6784, 2944, 1, 1]
    - [66, 251.918]
  - - [2944, 1024, 1, 32]
    - [41, 2679.69]
  - - [2944, 1024, 1, 1280]
    - [34, 9558.96]
  - - [1408, 64, 1, 32]
    - [52, 182.044]
  - - [2368, 4288, 1, 256]
    - [34, 9658.96]
  - - [448, 1856, 1, 1280]
    - [37, 7281.78]
  - - [2368, 448, 1, 1]
    - [65, 80.8585]
  - - [448, 2944, 1, 32]
    - [50, 1870.8]
  - - [448, 2944, 1, 1280]
    - [34, 8014.66]
  - - [2944, 6784, 1, 1280]
    - [34, 10289.6]
  - - [256, 6784, 1, 1280]
    - [34, 9155.61]
  - - [5056, 128, 1, 256]
    - [0, 6903.13]
  - - [3584, 2368, 1, 32]
    - [41, 3394.76]
  - - [704, 32, 1, 32]
    - [49, 47.6783]
  - - [6784, 3584, 1, 3328]
    - [3, 10224.4]
  - - [128, 32, 1, 256]
    - [54, 30.9132]
  - - [128, 1408, 1, 1280]
    - [19, 5767.17]
  - - [64, 32, 1, 1280]
    - [59, 23.456]
  - - [128, 1856, 1, 3328]
    - [15, 6646.15]
  - - [2944, 2944, 1, 256]
    - [33, 9636.82]
  - - [5056, 2368, 1, 1280]
    - [30, 10292.4]
  - - [448, 128, 1, 32]
    - [52, 118.848]
  - - [32, 5056, 1, 3328]
    - [59, 1330.41]
  - - [448, 2944, 1, 3328]
    - [34, 8145.3]
  - - [2944, 1024, 1, 1]
    - [80, 135.551]
  - - [256, 4288, 1, 1]
    - [77, 82.1653]
  - - [2368, 128, 1, 1280]
    - [10, 6154.4]
  - - [3584, 704, 1, 256]
    - [36, 8882.33]
  - - [2368, 5888, 1, 3328]
    - [35, 10321.0]
  - - [1408, 3584, 1, 32]
    - [41, 3119.8]
  - - [2944, 4288, 1, 32]
    - [41, 3551.02]
  - - [5888, 1408, 1, 1280]
    - [35, 10191.7]
  - - [3584, 5056, 1, 1280]
    - [35, 10307.9]
  - - [5888, 6784, 1, 1280]
    - [36, 10215.2]
  - - [64, 1856, 1, 1]
    - [67, 10.1699]
  - - [704, 128, 1, 32]
    - [49, 189.709]
  - - [128, 3584, 1, 3328]
    - [19, 7445.99]
  - - [256, 4288, 1, 3328]
    - [34, 7996.06]
  - - [256, 2368, 1, 1]
    - [65, 51.5483]
  - - [1, 1408, 1, 1280]
    - [82, 16.2305]
  - - [6784, 1408, 1, 32]
    - [41, 3495.65]
  - - [1856, 704, 1, 32]
    - [57, 1821.08]
  - - [1024, 1856, 1, 1]
    - [62, 118.784]
  - - [704, 5056, 1, 3328]
    - [34, 9864.24]
  - - [1024, 3584, 1, 3328]
    - [34, 10174.1]
  - - [5888, 256, 1, 3328]
    - [34, 9271.75]
  - - [1856, 1408, 1, 1]
    - [60, 112.253]
  - - [2944, 448, 1, 32]
    - [57, 1825.48]
  - - [128, 448, 1, 256]
    - [16, 1731.14]
  - - [128, 1024, 1, 1]
    - [77, 11.0703]
  - - [32, 32, 1, 256]
    - [54, 7.76493]
  - - [4288, 5056, 1, 1280]
    - [34, 10334.9]
  - - [1856, 1856, 1, 3328]
    - [34, 9555.31]
  - - [3584, 1856, 1, 3328]
    - [36, 10100.7]
  - - [4288, 2368, 1, 3328]
    - [34, 10331.0]
  - - [256, 64, 1, 32]
    - [49, 32.9327]
  - - [1, 1024, 1, 1280]
    - [82, 11.7785]
  - - [32, 1408, 1, 256]
    - [54, 341.657]
  - - [1024, 32, 1, 3328]
    - [54, 392.047]
  - - [5888, 3584, 1, 256]
    - [32, 9936.48]
  - - [5888, 448, 1, 1280]
    - [34, 9082.24]
  - - [704, 5888, 1, 3328]
    - [34, 10099.5]
  - - [1024, 1408, 1, 256]
    - [36, 7913.78]
  - - [3584, 2944, 1, 1280]
    - [3, 10117.5]
  - - [1, 5056, 1, 256]
    - [82, 33.3592]
  - - [256, 1024, 1, 1]
    - [80, 22.9147]
  - - [32, 32, 1, 3328]
    - [59, 12.7235]
  - - [5056, 128, 1, 32]
    - [59, 1256.64]
  - - [2368, 1, 1, 3328]
    - [82, 29.815]
  - - [4288, 1856, 1, 1280]
    - [34, 10048.6]
  - - [3584, 5888, 1, 1]
    - [66, 246.987]
  - - [5888, 4288, 1, 256]
    - [33, 9927.83]
  - - [1024, 2944, 1, 1280]
    - [34, 9564.64]
  - - [6784, 1, 1, 1]
    - [77, 0.700826]
  - - [1408, 64, 1, 1280]
    - [25, 3844.78]
  - - [1, 256, 1, 1280]
    - [82, 2.94042]
  - - [2944, 3584, 1, 256]
    - [34, 9589.35]
  - - [1, 128, 1, 1280]
    - [82, 1.46915]
  - - [1024, 256, 1, 32]
    - [59, 599.186]
  - - [5888, 1, 1, 1280]
    - [82, 47.3645]
  - - [2368, 32, 1, 1280]
    - [59, 827.023]
  - - [5888, 1856, 1, 1]
    - [62, 225.788]
  - - [6784, 128, 1, 1280]
    - [11, 8012.47]
  - - [6784, 2368, 1, 3328]
    - [34, 10150.3]
  - - [1, 64, 1, 256]
    - [77, 0.475174]
  - - [704, 128, 1, 1]
    - [72, 7.66258]
  - - [1408, 4288, 1, 32]
    - [41, 3224.3]
  - - [32, 1408, 1, 3328]
    - [54, 533.541]
  - - [256, 448, 1, 256]
    - [17, 3033.07]
  - - [1856, 1024, 1, 1280]
    - [34, 8850.03]
  - - [1024, 448, 1, 1]
    - [62, 41.5536]
  - - [4288, 3584, 1, 1280]
    - [34, 10267.7]
  - - [448, 1024, 1, 1280]
    - [37, 7084.97]
  - - [5056, 1856, 1, 1]
    - [67, 200.855]
  - - [5888, 2368, 1, 256]
    - [36, 9836.18]
  - - [1408, 1024, 1, 32]
    - [55, 1981.84]
  - - [32, 704, 1, 256]
    - [54, 171.234]
  - - [2944, 1, 1, 256]
    - [82, 21.1229]
  - - [704, 1024, 1, 32]
    - [54, 1360.18]
  - - [5056, 1856, 1, 32]
    - [41, 3427.92]
  - - [5056, 1856, 1, 1280]
    - [30, 10262.0]
  - - [1, 64, 1, 1]
    - [70, 0.0057971]
  - - [1408, 5888, 1, 3328]
    - [35, 10274.6]
  - - [1408, 704, 1, 3328]
    - [37, 8814.72]
  - - [5056, 704, 1, 3328]
    - [34, 9837.36]
  - - [704, 64, 1, 1280]
    - [25, 2030.69]
  - - [1, 704, 1, 1280]
    - [82, 8.12695]
  - - [1408, 256, 1, 1]
    - [80, 32.8876]
  - - [5888, 4288, 1, 32]
    - [41, 3783.85]
  - - [1408, 3584, 1, 256]
    - [36, 9350.36]
  - - [1408, 6784, 1, 1]
    - [71, 204.449]
  - - [6784, 256, 1, 1]
    - [61, 112.481]
  - - [2944, 1, 1, 1]
    - [67, 0.24698]
  - - [256, 1856, 1, 3328]
    - [37, 7567.25]
  - - [4288, 128, 1, 1280]
    - [8, 7025.46]
  - - [128, 128, 1, 1]
    - [72, 1.8789]
  - - [6784, 256, 1, 1280]
    - [34, 9013.06]
  - - [128, 4288, 1, 256]
    - [10, 6119.74]
  - - [2368, 6784, 1, 1280]
    - [35, 10308.5]
  - - [128, 128, 1, 32]
    - [46, 42.0103]
  - - [128, 128, 1, 3328]
    - [24, 829.166]
  - - [128, 1408, 1, 32]
    - [49, 356.879]
  - - [6784, 128, 1, 32]
    - [57, 1530.14]
  - - [1408, 448, 1, 1]
    - [73, 55.1385]
  - - [2368, 704, 1, 3328]
    - [34, 8912.76]
  - - [704, 128, 1, 3328]
    - [25, 4188.45]
  - - [2944, 1856, 1, 32]
    - [41, 3117.87]
  - - [1024, 64, 1, 1]
    - [62, 5.53514]
  - - [1408, 32, 1, 1280]
    - [59, 500.622]
  - - [704, 1, 1, 256]
    - [77, 5.27588]
  - - [1856, 2944, 1, 3328]
    - [34, 10219.6]
  - - [3584, 2944, 1, 1]
    - [66, 215.508]
  - - [5888, 64, 1, 256]
    - [39, 5714.99]
  - - [64, 5056, 1, 1280]
    - [39, 6949.46]
  - - [1408, 2944, 1, 1]
    - [60, 152.395]
  - - [4288, 1408, 1, 32]
    - [41, 3215.71]
  - - [5888, 2944, 1, 256]
    - [33, 9795.1]
  - - [128, 64, 1, 1280]
    - [17, 341.333]
  - - [1408, 2944, 1, 32]
    - [41, 2998.3]
  - - [1, 3584, 1, 1280]
    - [82, 43.3112]
  - - [64, 64, 1, 32]
    - [52, 8.11089]
  - - [448, 1408, 1, 32]
    - [59, 1261.57]
  - - [128, 5056, 1, 256]
    - [11, 6723.82]
  - - [1, 1, 1, 1280]
    - [82, 0.0114531]
  - - [64, 704, 1, 256]
    - [17, 1399.8]
  - - [3584, 1408, 1, 1280]
    - [36, 9809.29]
  - - [5888, 6784, 1, 256]
    - [33, 9922.48]
  - - [6784, 5888, 1, 1]
    - [66, 264.181]
  - - [64, 4288, 1, 256]
    - [39, 4772.73]
  - - [1, 448, 1, 1280]
    - [82, 5.05857]
  - - [1024, 1024, 1, 1]
    - [61, 78.959]
  - - [6784, 5888, 1, 1280]
    - [33, 10217.4]
  - - [1024, 4288, 1, 32]
    - [41, 2971.85]
  - - [1856, 1, 1, 1280]
    - [82, 21.3948]
  - - [3584, 5888, 1, 256]
    - [32, 9945.26]
  - - [5056, 2368, 1, 1]
    - [62, 230.242]
  - - [256, 1408, 1, 1280]
    - [37, 5588.34]
  - - [64, 256, 1, 32]
    - [54, 47.1482]
  - - [64, 5888, 1, 3328]
    - [39, 7328.76]
  - - [6784, 64, 1, 3328]
    - [38, 7285.89]
  - - [5056, 448, 1, 1]
    - [67, 129.879]
  - - [2944, 448, 1, 3328]
    - [34, 8141.67]
  - - [1856, 6784, 1, 256]
    - [33, 9652.98]
  - - [4288, 32, 1, 1280]
    - [59, 1138.13]
  - - [448, 1408, 1, 1280]
    - [34, 7072.56]
  - - [5056, 448, 1, 32]
    - [57, 2311.31]
  - - [3584, 2944, 1, 32]
    - [41, 3546.65]
  - - [2368, 128, 1, 1]
    - [72, 28.9221]
  - - [128, 3584, 1, 32]
    - [58, 991.896]
  - - [3584, 1856, 1, 32]
    - [41, 3229.08]
  - - [4288, 64, 1, 3328]
    - [39, 6174.35]
  - - [5056, 64, 1, 256]
    - [39, 5478.67]
  - - [64, 448, 1, 3328]
    - [25, 1449.28]
  - - [4288, 1408, 1, 1280]
    - [35, 9831.07]
  - - [32, 5056, 1, 256]
    - [59, 1089.97]
  - - [704, 128, 1, 256]
    - [17, 2574.63]
  - - [704, 5056, 1, 1]
    - [62, 163.576]
  - - [256, 1024, 1, 32]
    - [54, 613.202]
  - - [256, 1024, 1, 1280]
    - [37, 6374.32]
  - - [2368, 128, 1, 256]
    - [10, 4948.64]
  - - [2368, 1408, 1, 1280]
    - [34, 9802.7]
  - - [128, 256, 1, 32]
    - [53, 74.8983]
  - - [64, 6784, 1, 32]
    - [49, 909.269]
  - - [6784, 32, 1, 256]
    - [59, 1432.33]
  - - [5056, 2944, 1, 1]
    - [67, 232.286]
  - - [3584, 128, 1, 1]
    - [73, 40.6695]
  - - [1024, 4288, 1, 1280]
    - [34, 9960.95]
  - - [1856, 4288, 1, 1]
    - [62, 213.023]
  - - [128, 2944, 1, 256]
    - [0, 5407.45]
  - - [3584, 4288, 1, 256]
    - [33, 9816.01]
  - - [3584, 128, 1, 32]
    - [54, 1002.74]
  - - [3584, 128, 1, 3328]
    - [23, 7451.81]
  - - [704, 5056, 1, 256]
    - [35, 9163.44]
  - - [1856, 4288, 1, 32]
    - [41, 3336.91]
  - - [5056, 1, 1, 1280]
    - [82, 41.3156]
  - - [64, 256, 1, 1280]
    - [24, 762.047]
  - - [4288, 1024, 1, 1280]
    - [34, 9944.03]
  - - [1, 4288, 1, 256]
    - [82, 28.2337]
  - - [2944, 3584, 1, 1]
    - [61, 227.399]
  - - [4288, 6784, 1, 32]
    - [41, 3762.02]
  - - [4288, 4288, 1, 256]
    - [33, 9801.47]
  - - [3584, 3584, 1, 1]
    - [69, 237.169]
  - - [3584, 1408, 1, 256]
    - [36, 9344.95]
  - - [704, 3584, 1, 3328]
    - [34, 9647.28]
  - - [5056, 448, 1, 1280]
    - [34, 9413.35]
  - - [1408, 2944, 1, 1280]
    - [35, 9988.32]
  - - [5888, 704, 1, 1280]
    - [36, 9977.8]
  - - [64, 64, 1, 256]
    - [40, 137.971]
  - - [704, 1408, 1, 1280]
    - [34, 8633.48]
  - - [4288, 5888, 1, 256]
    - [33, 9943.73]
  - - [3584, 3584, 1, 3328]
    - [34, 10435.2]
  - - [2944, 6784, 1, 32]
    - [41, 3784.39]
  - - [448, 64, 1, 32]
    - [49, 57.344]
  - - [5056, 256, 1, 1]
    - [65, 91.9273]
  - - [64, 6784, 1, 1280]
    - [39, 7110.35]
  - - [2944, 2368, 1, 3328]
    - [34, 10197.3]
  - - [1, 4288, 1, 1]
    - [72, 0.432258]
  - - [1408, 128, 1, 256]
    - [23, 4061.39]
  - - [1024, 1856, 1, 1280]
    - [34, 8850.03]
  - - [1024, 5888, 1, 256]
    - [34, 9565.59]
  - - [704, 1408, 1, 256]
    - [34, 7698.89]
  - - [6784, 2944, 1, 3328]
    - [3, 10137.1]
  - - [1408, 2368, 1, 256]
    - [34, 9103.46]
  - - [1024, 1408, 1, 1]
    - [64, 99.5713]
  - - [64, 128, 1, 1280]
    - [17, 344.021]
  - - [1408, 5056, 1, 256]
    - [36, 9543.49]
  - - [1024, 1408, 1, 32]
    - [55, 1928.82]
  - - [4288, 128, 1, 32]
    - [58, 1081.51]
  - - [6784, 704, 1, 1]
    - [67, 182.01]
  - - [448, 704, 1, 256]
    - [34, 4187.78]
  - - [704, 3584, 1, 32]
    - [55, 2504.35]
  - - [1856, 256, 1, 3328]
    - [37, 7575.95]
  - - [6784, 448, 1, 256]
    - [4, 8971.9]
  - - [4288, 4288, 1, 1]
    - [70, 239.913]
  - - [256, 2944, 1, 1]
    - [72, 58.88]
  - - [64, 2368, 1, 3328]
    - [40, 5356.47]
  - - [256, 704, 1, 3328]
    - [27, 4582.71]
  - - [1, 2944, 1, 1]
    - [62, 0.231447]
  - - [1024, 1024, 1, 256]
    - [36, 8065.97]
  - - [4288, 704, 1, 1280]
    - [34, 9564.36]
  - - [3584, 1, 1, 1]
    - [76, 0.36129]
  - - [256, 2944, 1, 32]
    - [57, 1395.67]
  - - [6784, 4288, 1, 3328]
    - [34, 10300.4]
  - - [5056, 2944, 1, 3328]
    - [34, 10400.6]
  - - [704, 1024, 1, 1280]
    - [37, 8060.33]
  - - [256, 3584, 1, 1280]
    - [34, 8004.4]
  - - [2368, 1856, 1, 3328]
    - [34, 10097.3]
  - - [1856, 4288, 1, 1280]
    - [34, 10066.9]
  - - [1, 1024, 1, 256]
    - [77, 7.55023]
  - - [2944, 1024, 1, 3328]
    - [34, 9694.63]
  - - [2944, 256, 1, 32]
    - [51, 1364.1]
  - - [128, 1, 1, 3328]
    - [82, 1.59234]
  - - [5888, 5056, 1, 32]
    - [41, 3804.44]
  - - [4288, 1408, 1, 1]
    - [67, 196.023]
  - - [3584, 448, 1, 32]
    - [47, 1840.27]
  - - [3584, 448, 1, 1280]
    - [34, 8459.04]
  - - [2944, 6784, 1, 3328]
    - [34, 10380.4]
  - - [1856, 2368, 1, 1280]
    - [34, 9975.9]
  - - [6784, 1024, 1, 1280]
    - [34, 9889.58]
  - - [6784, 3584, 1, 1280]
    - [36, 10160.7]
  - - [1, 5056, 1, 3328]
    - [82, 42.3625]
  - - [4288, 64, 1, 1]
    - [62, 27.2254]
  - - [128, 2368, 1, 32]
    - [54, 725.998]
  - - [128, 1408, 1, 3328]
    - [19, 6155.43]
  - - [2944, 32, 1, 3328]
    - [54, 1121.65]
  - - [704, 1856, 1, 256]
    - [34, 8329.08]
  - - [2944, 2944, 1, 1]
    - [61, 216.678]
  - - [1408, 4288, 1, 256]
    - [36, 9396.89]
  - - [5888, 5056, 1, 256]
    - [36, 9925.3]
  - - [256, 5056, 1, 3328]
    - [34, 9410.06]
  - - [2368, 64, 1, 1280]
    - [39, 5020.36]
  - - [1856, 448, 1, 32]
    - [52, 1421.35]
  - - [1408, 448, 1, 256]
    - [34, 6210.8]
  - - [32, 128, 1, 256]
    - [54, 30.696]
  - - [448, 1024, 1, 1]
    - [81, 39.2767]
  - - [448, 6784, 1, 1]
    - [67, 151.962]
  - - [704, 2944, 1, 256]
    - [4, 8902.34]
  - - [1408, 1408, 1, 256]
    - [35, 8549.71]
  - - [448, 6784, 1, 32]
    - [41, 2671.85]
  - - [1, 64, 1, 1280]
    - [82, 0.736161]
  - - [2944, 2368, 1, 1]
    - [62, 205.041]
  - - [4288, 448, 1, 32]
    - [57, 2140.42]
  - - [4288, 448, 1, 1280]
    - [34, 8911.68]
  - - [2944, 704, 1, 32]
    - [52, 2252.8]
  - - [1024, 704, 1, 256]
    - [34, 7011.75]
  - - [448, 4288, 1, 1]
    - [65, 119.467]
  - - [3584, 5056, 1, 1]
    - [61, 239.692]
  - - [2368, 2368, 1, 1]
    - [62, 193.093]
  - - [64, 5888, 1, 1]
    - [67, 35.4165]
  - - [1408, 3584, 1, 1280]
    - [35, 9815.26]
  - - [6784, 448, 1, 1280]
    - [36, 9493.89]
  - - [3584, 5056, 1, 3328]
    - [36, 10374.6]
  - - [2368, 2368, 1, 32]
    - [41, 3163.57]
  - - [64, 5888, 1, 32]
    - [54, 837.404]
  - - [1856, 448, 1, 256]
    - [34, 6505.53]
  - - [3584, 2368, 1, 1280]
    - [34, 10078.0]
  - - [128, 1024, 1, 256]
    - [17, 3554.49]
  - - [3584, 64, 1, 3328]
    - [20, 6456.05]
  - - [5888, 2944, 1, 32]
    - [41, 3696.01]
  - - [2944, 1, 1, 1280]
    - [82, 33.5977]
  - - [1856, 2944, 1, 32]
    - [41, 3158.42]
  - - [5056, 1408, 1, 1]
    - [62, 205.509]
  - - [5888, 1408, 1, 3328]
    - [35, 10270.3]
  - - [448, 4288, 1, 256]
    - [4, 8307.13]
  - - [6784, 1024, 1, 1]
    - [66, 207.74]
  - - [256, 448, 1, 1]
    - [62, 9.55733]
  - - [128, 5888, 1, 3328]
    - [37, 8615.67]
  - - [6784, 1024, 1, 32]
    - [41, 3272.94]
  - - [256, 448, 1, 32]
    - [49, 202.093]
  - - [6784, 3584, 1, 1]
    - [66, 242.944]
  - - [2944, 2368, 1, 32]
    - [55, 3201.56]
  - - [3584, 6784, 1, 3328]
    - [34, 10471.0]
  - - [448, 128, 1, 1280]
    - [29, 2570.04]
  - - [64, 3584, 1, 32]
    - [54, 542.902]
  - - [64, 3584, 1, 1280]
    - [18, 5996.76]
  - - [6784, 1408, 1, 256]
    - [34, 9445.61]
  - - [5056, 1024, 1, 32]
    - [41, 3142.55]
  - - [1024, 5056, 1, 1280]
    - [36, 10058.0]
  - - [4288, 3584, 1, 256]
    - [33, 9823.85]
  - - [1408, 1024, 1, 3328]
    - [34, 8884.39]
  - - [2368, 256, 1, 3328]
    - [37, 6939.53]
  - - [448, 6784, 1, 1280]
    - [34, 9640.7]
  - - [1856, 5888, 1, 1]
    - [62, 203.579]
  - - [256, 5888, 1, 32]
    - [55, 2057.79]
  - - [3584, 1, 1, 3328]
    - [82, 45.4695]
  - - [4288, 32, 1, 256]
    - [59, 930.278]
  - - [256, 64, 1, 1]
    - [65, 1.91402]
  - - [4288, 5056, 1, 32]
    - [41, 3649.85]
  - - [4288, 5056, 1, 3328]
    - [34, 10437.5]
  - - [1856, 5888, 1, 32]
    - [41, 3431.12]
  - - [1856, 5888, 1, 1280]
    - [35, 10295.0]
  - - [256, 256, 1, 1280]
    - [26, 2962.08]
  - - [704, 2368, 1, 1280]
    - [34, 8788.52]
  - - [5056, 32, 1, 1280]
    - [59, 1293.69]
  - - [4288, 2368, 1, 1280]
    - [34, 10216.6]
  - - [2944, 5056, 1, 256]
    - [33, 9818.92]
  - - [32, 1856, 1, 256]
    - [54, 416.786]
  - - [64, 5888, 1, 1280]
    - [39, 7043.59]
  - - [1, 1856, 1, 1280]
    - [82, 20.898]
  - - [2944, 4288, 1, 1]
    - [62, 233.775]
  - - [5056, 5888, 1, 32]
    - [41, 3769.51]
  - - [704, 4288, 1, 1]
    - [62, 152.155]
  - - [704, 1, 1, 3328]
    - [82, 8.80264]
  - - [448, 256, 1, 1280]
    - [25, 4645.59]
  - - [5888, 6784, 1, 1]
    - [66, 256.184]
  - - [2368, 5056, 1, 3328]
    - [34, 10368.7]
  - - [704, 704, 1, 1280]
    - [37, 7654.3]
  - - [128, 32, 1, 3328]
    - [59, 51.5251]
  - - [1024, 6784, 1, 32]
    - [41, 3311.95]
  - - [2368, 1408, 1, 256]
    - [34, 9111.24]
  - - [3584, 2944, 1, 3328]
    - [34, 10236.6]
  - - [128, 1856, 1, 256]
    - [9, 4781.24]
  - - [32, 32, 1, 1280]
    - [54, 11.362]
  - - [1408, 5888, 1, 1]
    - [61, 215.444]
  - - [1, 3584, 1, 256]
    - [82, 31.4214]
  - - [704, 4288, 1, 32]
    - [41, 2648.03]
  - - [1408, 5888, 1, 32]
    - [41, 3501.71]
  - - [5888, 32, 1, 3328]
    - [59, 1572.02]
  - - [6784, 2368, 1, 1]
    - [61, 224.867]
  - - [1856, 1, 1, 3328]
    - [82, 23.1861]
  - - [5056, 1408, 1, 256]
    - [33, 9539.5]
  - - [1, 1, 1, 256]
    - [77, 0.00730594]
  - - [2944, 1408, 1, 256]
    - [35, 9461.12]
  - - [4288, 1, 1, 1]
    - [67, 0.442975]
  - - [2368, 2368, 1, 256]
    - [35, 9444.08]
  - - [1, 448, 1, 256]
    - [77, 3.31852]
  - - [1856, 704, 1, 1]
    - [69, 91.2447]
  - - [3584, 32, 1, 3328]
    - [59, 1464.85]
  - - [128, 3584, 1, 1]
    - [70, 42.794]
  - - [1856, 1, 1, 256]
    - [77, 13.8766]
  - - [32, 5888, 1, 32]
    - [59, 425.799]
  - - [1024, 5888, 1, 1]
    - [69, 178.593]
  - - [6784, 32, 1, 3328]
    - [59, 1816.71]
  - - [2368, 704, 1, 1]
    - [72, 107.971]
  - - [1408, 32, 1, 256]
    - [54, 347.42]
  - - [448, 2368, 1, 1]
    - [82, 74.0827]
  - - [1856, 3584, 1, 256]
    - [33, 9592.65]
  - - [2944, 64, 1, 256]
    - [39, 4400.96]
  - - [2368, 704, 1, 32]
    - [54, 2051.78]
  - - [256, 5888, 1, 1280]
    - [34, 9135.32]
  - - [448, 2368, 1, 32]
    - [56, 1664.1]
  - - [448, 2368, 1, 3328]
    - [34, 7734.3]
  - - [64, 1408, 1, 256]
    - [39, 2621.44]
  - - [5056, 32, 1, 32]
    - [54, 417.528]
  - - [1024, 704, 1, 3328]
    - [37, 8227.51]
  - - [32, 5888, 1, 3328]
    - [59, 1570.13]
  - - [256, 64, 1, 3328]
    - [24, 828.158]
  - - [32, 1408, 1, 1280]
    - [54, 499.581]
  - - [64, 32, 1, 256]
    - [54, 15.5299]
  - - [1856, 1024, 1, 3328]
    - [34, 8981.33]
  - - [2368, 1, 1, 1]
    - [65, 0.206993]
  - - [5056, 2368, 1, 3328]
    - [30, 10360.1]
  - - [128, 1, 1, 1280]
    - [82, 1.4938]
  - - [704, 4288, 1, 1280]
    - [34, 9570.05]
  - - [704, 256, 1, 256]
    - [13, 3353.0]
  - - [3136, 256, 64, 64]
    - [84, 17694.4]
  - - [784, 512, 64, 128]
    - [85, 18837.8]
  - - [784, 128, 64, 512]
    - [83, 20717.8]
  - - [3136, 64, 128, 64]
    - [89, 15383.3]
  - - [196, 256, 128, 1024]
    - [84, 17751.8]
  - - [196, 256, 64, 1024]
    - [84, 17162.5]
  - - [196, 1024, 128, 256]
    - [84, 16832.2]
  - - [784, 128, 256, 512]
    - [83, 21422.4]
  - - [3136, 64, 64, 256]
    - [88, 19953.5]
  - - [3136, 64, 256, 256]
    - [86, 20976.9]
  - - [3136, 256, 256, 64]
    - [91, 18870.2]
  - - [3136, 64, 128, 256]
    - [90, 20843.9]
  - - [784, 128, 128, 512]
    - [83, 21204.1]
  - - [784, 512, 128, 128]
    - [83, 19252.5]
  - - [784, 512, 256, 128]
    - [85, 19261.6]
  - - [196, 1024, 64, 256]
    - [84, 16634.6]
  - - [3136, 64, 64, 64]
    - [89, 14979.7]
  - - [196, 1024, 256, 256]
    - [87, 16995.7]
  - - [196, 256, 256, 1024]
    - [84, 18063.8]
  - - [3136, 256, 128, 64]
    - [90, 18163.6]
  - - [3136, 64, 256, 64]
    - [89, 15640.9]
  - - [4096, 7133, 1, 4096]
    - [116, 18834.1]
  - - [512, 16, 1, 512]
    - [101, 264.792]
  - - [2048, 7133, 1, 2048]
    - [111, 18669.8]
  - - [2560, 7133, 1, 2560]
    - [114, 18330.9]
  - - [1024, 1024, 1, 1024]
    - [114, 14385.6]
  - - [3072, 7435, 1, 1024]
    - [111, 18501.2]
  - - [1024, 32, 1, 512]
    - [95, 900.065]
  - - [1760, 7133, 1, 1760]
    - [114, 17490.3]
  - - [7680, 5481, 1, 2560]
    - [111, 18657.2]
  - - [1024, 16, 1, 512]
    - [95, 444.312]
  - - [512, 32, 1, 512]
    - [100, 516.54]
- null
