library/src/blas3/Tensile/Logic/asm_full/vega20_Cijk_Ailk_Bjlk_SB.yaml
- {MinimumRequiredVersion: 4.6.0}
- vega20
- gfx906
- [Device 66a0, Device 66a1, Device 66a7, Vega 20]
    SolutionIndex: 0
    SolutionNameMin: Cijk_Ailk_Bjlk_SB_MT032x008x08_GRVW02_GSU01_SNLL0_TT02_02_VW02_WG16_04_01
    SolutionIndex: 1
    SolutionNameMin: Cijk_Ailk_Bjlk_SB_MT016x016x08_GRVW02_GSU01_SNLL0_TT02_02_VW02_WG08_08_01
    SolutionIndex: 2
    SolutionNameMin: Cijk_Ailk_Bjlk_SB_MT032x016x08_GRVW02_GSU01_SNLL0_TT04_02_VW02_WG08_08_01
    SolutionIndex: 3
    SolutionNameMin: Cijk_Ailk_Bjlk_SB_MT032x032x08_GRVW04_GSU01_SNLL0_TT04_04_VW04_WG08_08_01
    SolutionIndex: 4
    SolutionNameMin: Cijk_Ailk_Bjlk_SB_MT032x016x08_GRVW02_GSU01_SNLL0_TT02_02_VW02_WG16_08_01
    SolutionIndex: 5
    SolutionNameMin: Cijk_Ailk_Bjlk_SB_MT064x016x08_GRVW02_GSU01_SNLL0_TT04_02_VW02_WG16_08_01
    SolutionIndex: 6
    SolutionNameMin: Cijk_Ailk_Bjlk_SB_MT016x016x08_GRVW02_GSU01_SNLL0_TT02_02_VW02_WG08_08_01
    SolutionIndex: 7
    SolutionNameMin: Cijk_Ailk_Bjlk_SB_MT032x016x08_GRVW02_GSU01_SNLL0_TT04_02_VW02_WG08_08_01
    SolutionIndex: 8
    SolutionNameMin: Cijk_Ailk_Bjlk_SB_MT032x032x08_GRVW04_GSU01_SNLL0_TT04_04_VW04_WG08_08_01
    SolutionIndex: 9
    SolutionNameMin: Cijk_Ailk_Bjlk_SB_MT032x016x08_GRVW02_GSU01_SNLL0_TT02_02_VW02_WG16_08_01
    SolutionIndex: 10
    SolutionNameMin: Cijk_Ailk_Bjlk_SB_MT064x016x08_GRVW02_GSU01_SNLL0_TT04_02_VW02_WG16_08_01
    SolutionIndex: 11
    SolutionNameMin: Cijk_Ailk_Bjlk_SB_MT064x008x16_GRVW02_GSU01_SNLL0_TT02_02_VW02_WG32_04_01
    SolutionIndex: 12
    SolutionNameMin: Cijk_Ailk_Bjlk_SB_MT016x016x16_GRVW02_GSU01_SNLL0_TT02_02_VW02_WG08_08_01
    SolutionIndex: 13
    SolutionNameMin: Cijk_Ailk_Bjlk_SB_MT032x016x16_GRVW02_GSU01_SNLL0_TT04_02_VW02_WG08_08_01
    SolutionIndex: 14
    SolutionNameMin: Cijk_Ailk_Bjlk_SB_MT032x032x16_GRVW04_GSU01_SNLL0_TT04_04_VW04_WG08_08_01
    SolutionIndex: 15
    SolutionNameMin: Cijk_Ailk_Bjlk_SB_MT064x016x16_GRVW02_GSU01_SNLL0_TT04_02_VW02_WG16_08_01
    SolutionIndex: 16
    SolutionNameMin: Cijk_Ailk_Bjlk_SB_MT064x032x16_GRVW04_GSU01_SNLL0_TT04_04_VW04_WG16_08_01
    SolutionIndex: 17
    SolutionNameMin: Cijk_Ailk_Bjlk_SB_MT064x008x16_GRVW02_GSU01_SNLL0_TT02_02_VW02_WG32_04_01
    SolutionIndex: 18
    SolutionNameMin: Cijk_Ailk_Bjlk_SB_MT032x008x16_GRVW02_GSU01_SNLL0_TT02_02_VW02_WG16_04_01
    SolutionIndex: 19
    SolutionNameMin: Cijk_Ailk_Bjlk_SB_MT016x016x16_GRVW02_GSU01_SNLL0_TT02_02_VW02_WG08_08_01
    SolutionIndex: 20
    SolutionNameMin: Cijk_Ailk_Bjlk_SB_MT016x016x24_GRVW02_GSU01_SNLL0_TT02_02_VW02_WG08_08_01
    SolutionIndex: 21
    SolutionNameMin: Cijk_Ailk_Bjlk_SB_MT016x016x08_GRVW02_GSU02_SNLL0_TT02_02_VW02_WG08_08_02
    SolutionIndex: 22
    SolutionNameMin: Cijk_Ailk_Bjlk_SB_MT032x016x08_GRVW02_GSU02_SNLL0_TT04_02_VW02_WG08_08_02
    SolutionIndex: 23
    SolutionNameMin: Cijk_Ailk_Bjlk_SB_MT016x016x08_GRVW02_GSU04_SNLL0_TT02_02_VW02_WG08_08_02
    SolutionIndex: 24
    SolutionNameMin: Cijk_Ailk_Bjlk_SB_MT016x016x08_GRVW02_GSU08_SNLL0_TT02_02_VW02_WG08_08_02
    SolutionIndex: 25
    SolutionNameMin: Cijk_Ailk_Bjlk_SB_MT016x016x16_GRVW02_GSU02_SNLL0_TT02_02_VW02_WG08_08_02
    SolutionIndex: 26
    SolutionNameMin: Cijk_Ailk_Bjlk_SB_MT032x016x16_GRVW02_GSU02_SNLL0_TT04_02_VW02_WG08_08_02
    SolutionIndex: 27
    SolutionNameMin: Cijk_Ailk_Bjlk_SB_MT032x032x16_GRVW04_GSU02_SNLL0_TT04_04_VW04_WG08_08_02
    SolutionIndex: 28
    SolutionNameMin: Cijk_Ailk_Bjlk_SB_MT064x032x16_GRVW04_GSU02_SNLL0_TT08_04_VW04_WG08_08_02
    SolutionIndex: 29
    SolutionNameMin: Cijk_Ailk_Bjlk_SB_MT016x016x16_GRVW02_GSU02_SNLL0_TT02_02_VW02_WG08_08_04
    SolutionIndex: 30
    SolutionNameMin: Cijk_Ailk_Bjlk_SB_MT032x016x16_GRVW02_GSU02_SNLL0_TT04_02_VW02_WG08_08_04
    SolutionIndex: 31
    SolutionNameMin: Cijk_Ailk_Bjlk_SB_MT032x016x16_GRVW02_GSU02_SNLL0_TT02_02_VW02_WG16_08_02
    SolutionIndex: 32
    SolutionNameMin: Cijk_Ailk_Bjlk_SB_MT064x016x16_GRVW02_GSU02_SNLL0_TT04_02_VW02_WG16_08_02
    SolutionIndex: 33
    SolutionNameMin: Cijk_Ailk_Bjlk_SB_MT064x016x16_GRVW04_GSU02_SNLL0_TT04_04_VW04_WG16_04_04
    SolutionIndex: 34
    SolutionNameMin: Cijk_Ailk_Bjlk_SB_MT016x016x16_GRVW02_GSU02_SNLL0_TT02_02_VW02_WG08_08_02
    SolutionIndex: 35
    SolutionNameMin: Cijk_Ailk_Bjlk_SB_MT032x016x16_GRVW02_GSU02_SNLL0_TT04_02_VW02_WG08_08_02
    SolutionIndex: 36
    SolutionNameMin: Cijk_Ailk_Bjlk_SB_MT032x032x16_GRVW04_GSU02_SNLL0_TT04_04_VW04_WG08_08_02
    SolutionIndex: 37
    SolutionNameMin: Cijk_Ailk_Bjlk_SB_MT016x016x16_GRVW02_GSU02_SNLL0_TT02_02_VW02_WG08_08_04
    SolutionIndex: 38
    SolutionNameMin: Cijk_Ailk_Bjlk_SB_MT032x016x16_GRVW02_GSU02_SNLL0_TT04_02_VW02_WG08_08_04
    SolutionIndex: 39
    SolutionNameMin: Cijk_Ailk_Bjlk_SB_MT032x016x16_GRVW02_GSU02_SNLL0_TT02_02_VW02_WG16_08_02
    SolutionIndex: 40
    SolutionNameMin: Cijk_Ailk_Bjlk_SB_MT016x016x16_GRVW02_GSU04_SNLL0_TT02_02_VW02_WG08_08_04
    SolutionIndex: 41
    SolutionNameMin: Cijk_Ailk_Bjlk_SB_MT032x032x16_GRVW04_GSU04_SNLL0_TT04_04_VW04_WG08_08_02
    SolutionIndex: 42
    SolutionNameMin: Cijk_Ailk_Bjlk_SB_MT016x016x16_GRVW02_GSU04_SNLL0_TT02_02_VW02_WG08_08_04
    SolutionIndex: 43
    SolutionNameMin: Cijk_Ailk_Bjlk_SB_MT016x016x16_GRVW02_GSU08_SNLL0_TT02_02_VW02_WG08_08_04
    SolutionIndex: 44
    SolutionNameMin: Cijk_Ailk_Bjlk_SB_MT032x008x32_GRVW02_GSU02_SNLL0_TT02_02_VW02_WG16_04_04
    SolutionIndex: 45
    SolutionNameMin: Cijk_Ailk_Bjlk_SB_MT032x016x32_GRVW02_GSU02_SNLL0_TT04_02_VW02_WG08_08_02
    SolutionIndex: 46
    SolutionNameMin: Cijk_Ailk_Bjlk_SB_MT016x016x32_GRVW02_GSU02_SNLL0_TT02_02_VW02_WG08_08_04
    SolutionIndex: 47
    SolutionNameMin: Cijk_Ailk_Bjlk_SB_MT032x016x32_GRVW02_GSU02_SNLL0_TT04_02_VW02_WG08_08_04
    SolutionIndex: 48
    SolutionNameMin: Cijk_Ailk_Bjlk_SB_MT032x032x32_GRVW04_GSU02_SNLL0_TT04_04_VW04_WG08_08_04
    SolutionIndex: 49
    SolutionNameMin: Cijk_Ailk_Bjlk_SB_MT064x032x32_GRVW04_GSU02_SNLL0_TT08_04_VW04_WG08_08_04
    SolutionIndex: 50
    SolutionNameMin: Cijk_Ailk_Bjlk_SB_MT064x032x32_GRVW04_GSU02_SNLL0_TT04_04_VW04_WG16_08_02
    SolutionIndex: 51
    SolutionNameMin: Cijk_Ailk_Bjlk_SB_MT128x032x32_GRVW04_GSU02_SNLL0_TT08_08_VW04_WG16_04_04
    SolutionIndex: 52
    SolutionNameMin: Cijk_Ailk_Bjlk_SB_MT032x016x32_GRVW02_GSU02_SNLL0_TT04_02_VW02_WG08_08_02
    SolutionIndex: 53
    SolutionNameMin: Cijk_Ailk_Bjlk_SB_MT032x032x32_GRVW04_GSU02_SNLL0_TT04_04_VW04_WG08_08_02
    SolutionIndex: 54
    SolutionNameMin: Cijk_Ailk_Bjlk_SB_MT016x016x32_GRVW02_GSU02_SNLL0_TT02_02_VW02_WG08_08_04
    SolutionIndex: 55
    SolutionNameMin: Cijk_Ailk_Bjlk_SB_MT032x016x32_GRVW02_GSU02_SNLL0_TT04_02_VW02_WG08_08_04
    SolutionIndex: 56
    SolutionNameMin: Cijk_Ailk_Bjlk_SB_MT032x032x32_GRVW04_GSU02_SNLL0_TT04_04_VW04_WG08_08_04
    SolutionIndex: 57
    SolutionNameMin: Cijk_Ailk_Bjlk_SB_MT064x032x32_GRVW04_GSU02_SNLL0_TT08_04_VW04_WG08_08_04
    SolutionIndex: 58
    SolutionNameMin: Cijk_Ailk_Bjlk_SB_MT064x008x32_GRVW02_GSU04_SNLL0_TT04_02_VW02_WG16_04_04
    SolutionIndex: 59
    SolutionNameMin: Cijk_Ailk_Bjlk_SB_MT016x016x32_GRVW02_GSU04_SNLL0_TT02_02_VW02_WG08_08_04
    SolutionIndex: 60
    SolutionNameMin: Cijk_Ailk_Bjlk_SB_MT032x016x32_GRVW02_GSU04_SNLL0_TT04_02_VW02_WG08_08_04
    SolutionIndex: 61
    SolutionNameMin: Cijk_Ailk_Bjlk_SB_MT032x032x32_GRVW04_GSU04_SNLL0_TT04_04_VW04_WG08_08_04
    SolutionIndex: 62
    SolutionNameMin: Cijk_Ailk_Bjlk_SB_MT032x032x32_GRVW04_GSU04_SNLL0_TT04_04_VW04_WG08_08_04
    SolutionIndex: 63
    SolutionNameMin: Cijk_Ailk_Bjlk_SB_MT032x008x32_GRVW02_GSU08_SNLL0_TT02_02_VW02_WG16_04_04
    SolutionIndex: 64
    SolutionNameMin: Cijk_Ailk_Bjlk_SB_MT016x016x32_GRVW02_GSU08_SNLL0_TT02_02_VW02_WG08_08_04
    SolutionIndex: 65
    SolutionNameMin: Cijk_Ailk_Bjlk_SB_MT128x128x08_GRVW04_GSU01_SNLL0_TT08_08_VW04_WG16_16_01
    SolutionIndex: 66
    SolutionNameMin: Cijk_Ailk_Bjlk_SB_MT064x064x16_GRVW04_GSU01_SNLL0_TT04_04_VW04_WG16_16_01
    SolutionIndex: 67
    SolutionNameMin: Cijk_Ailk_Bjlk_SB_MT064x128x16_GRVW04_GSU01_SNLL0_TT04_08_VW04_WG16_16_01
    SolutionIndex: 68
    SolutionNameMin: Cijk_Ailk_Bjlk_SB_MT128x064x16_GRVW04_GSU01_SNLL0_TT08_04_VW04_WG16_16_01
    SolutionIndex: 69
    SolutionNameMin: Cijk_Ailk_Bjlk_SB_MT064x064x16_GRVW04_GSU01_SNLL0_TT04_04_VW04_WG16_16_01
    SolutionIndex: 70
    SolutionNameMin: Cijk_Ailk_Bjlk_SB_MT064x128x16_GRVW04_GSU01_SNLL0_TT04_08_VW04_WG16_16_01
    SolutionIndex: 71
    SolutionNameMin: Cijk_Ailk_Bjlk_SB_MT128x064x16_GRVW04_GSU01_SNLL0_TT08_04_VW04_WG16_16_01
    SolutionIndex: 72
    SolutionNameMin: Cijk_Ailk_Bjlk_SB_MT128x128x08_GRVW04_GSU01_SNLL1_TT08_08_VW04_WG16_16_01
    SolutionIndex: 73
    SolutionNameMin: Cijk_Ailk_Bjlk_SB_MT128x128x08_GRVW04_GSU01_SNLL1_TT08_08_VW04_WG16_16_01
    SolutionIndex: 74
    SolutionNameMin: Cijk_Ailk_Bjlk_SB_MT064x064x16_GRVW04_GSU01_SNLL1_TT04_04_VW04_WG16_16_01
    SolutionIndex: 75
    SolutionNameMin: Cijk_Ailk_Bjlk_SB_MT064x128x16_GRVW04_GSU01_SNLL1_TT04_08_VW04_WG16_16_01
    SolutionIndex: 76
    SolutionNameMin: Cijk_Ailk_Bjlk_SB_MT096x128x16_GRVW02_GSU01_SNLL1_TT06_08_VW02_WG16_16_01
    SolutionIndex: 77
    SolutionNameMin: Cijk_Ailk_Bjlk_SB_MT128x064x16_GRVW04_GSU01_SNLL1_TT08_04_VW04_WG16_16_01
    SolutionIndex: 78
    SolutionNameMin: Cijk_Ailk_Bjlk_SB_MT128x096x16_GRVW02_GSU01_SNLL1_TT08_06_VW02_WG16_16_01
    SolutionIndex: 79
    SolutionNameMin: Cijk_Ailk_Bjlk_SB_MT128x128x16_GRVW04_GSU01_SNLL1_TT08_08_VW04_WG16_16_01
    SolutionIndex: 80
    SolutionNameMin: Cijk_Ailk_Bjlk_SB_MT064x064x16_GRVW04_GSU01_SNLL1_TT04_04_VW04_WG16_16_01
    SolutionIndex: 81
    SolutionNameMin: Cijk_Ailk_Bjlk_SB_MT064x128x16_GRVW04_GSU01_SNLL1_TT04_08_VW04_WG16_16_01
    SolutionIndex: 82
    SolutionNameMin: Cijk_Ailk_Bjlk_SB_MT096x128x16_GRVW02_GSU01_SNLL1_TT06_08_VW02_WG16_16_01
    SolutionIndex: 83
    SolutionNameMin: Cijk_Ailk_Bjlk_SB_MT128x064x16_GRVW04_GSU01_SNLL1_TT08_04_VW04_WG16_16_01
    SolutionIndex: 84
    SolutionNameMin: Cijk_Ailk_Bjlk_SB_MT128x096x16_GRVW02_GSU01_SNLL1_TT08_06_VW02_WG16_16_01
    SolutionIndex: 85
    SolutionNameMin: Cijk_Ailk_Bjlk_SB_MT128x128x16_GRVW04_GSU01_SNLL1_TT08_08_VW04_WG16_16_01
    SolutionIndex: 86
    SolutionNameMin: Cijk_Ailk_Bjlk_SB_MT016x016x04_GRVW02_GSU01_SNLL0_TT02_02_VW02_WG08_08_01
    SolutionIndex: 87
    SolutionNameMin: Cijk_Ailk_Bjlk_SB_MT032x032x02_GRVW04_GSU01_SNLL0_TT04_04_VW04_WG08_08_01
    SolutionIndex: 88
    SolutionNameMin: Cijk_Ailk_Bjlk_SB_MT008x008x08_GRVW02_GSU01_SNLL1_TT02_02_VW02_WG04_04_04
    SolutionIndex: 89
    SolutionNameMin: Cijk_Ailk_Bjlk_SB_MT016x016x16_GRVW02_GSU01_SNLL1_TT02_02_VW02_WG08_08_04
    SolutionIndex: 90
    SolutionNameMin: Cijk_Ailk_Bjlk_SB_MT008x008x08_GRVW02_GSU02_SNLL0_TT02_02_VW02_WG04_04_04
    SolutionIndex: 91
    SolutionNameMin: Cijk_Ailk_Bjlk_SB_MT016x016x04_GRVW02_GSU04_SNLL0_TT02_02_VW02_WG08_08_01
    SolutionIndex: 92
    SolutionNameMin: Cijk_Ailk_Bjlk_SB_MT008x008x08_GRVW02_GSU04_SNLL0_TT02_02_VW02_WG04_04_04
    SolutionIndex: 93
    SolutionNameMin: Cijk_Ailk_Bjlk_SB_MT016x016x04_GRVW02_GSU08_SNLL0_TT02_02_VW02_WG08_08_01
    SolutionIndex: 94
    SolutionNameMin: Cijk_Ailk_Bjlk_SB_MT008x008x08_GRVW02_GSU08_SNLL0_TT02_02_VW02_WG04_04_04
    SolutionIndex: 95
    SolutionNameMin: Cijk_Ailk_Bjlk_SB_MT016x016x08_GRVW02_GSU16_SNLL0_TT02_02_VW02_WG08_08_02
    SolutionIndex: 96
    SolutionNameMin: Cijk_Ailk_Bjlk_SB_MT008x008x08_GRVW02_GSU16_SNLL0_TT02_02_VW02_WG04_04_04
    SolutionIndex: 97
    SolutionNameMin: Cijk_Ailk_Bjlk_SB_MT016x016x16_GRVW02_GSU16_SNLL0_TT02_02_VW02_WG08_08_04
    SolutionIndex: 98
    SolutionNameMin: Cijk_Ailk_Bjlk_SB_MT064x128x08_DTL0_GRVW01_GSU01_PGR1_PLR1_TT04_08_USFGRO01_VW02_WG16_16_01_WGM01
    SolutionIndex: 99
    SolutionNameMin: Cijk_Ailk_Bjlk_SB_MT064x064x08_DTL0_GRVW01_GSU01_PGR1_PLR1_TT04_08_USFGRO01_VW04_WG16_08_01_WGM01
    SolutionIndex: 100
    SolutionNameMin: Cijk_Ailk_Bjlk_SB_MT032x256x08_DTL1_GRVW01_GSU01_PGR0_PLR1_TT04_08_USFGRO01_VW04_WG08_32_01_WGM01
    SolutionIndex: 101
    SolutionNameMin: Cijk_Ailk_Bjlk_SB_MT032x256x08_DTL1_GRVW01_GSU01_PGR0_PLR1_TT04_08_USFGRO01_VW04_WG08_32_01_WGM08
    SolutionIndex: 102
    SolutionNameMin: Cijk_Ailk_Bjlk_SB_MT032x256x08_DTL1_GRVW01_GSU01_PGR0_PLR1_TT04_08_USFGRO01_VW04_WG08_32_01_WGM64
    SolutionIndex: 103
    SolutionNameMin: Cijk_Ailk_Bjlk_SB_MT064x064x16_DTL0_GRVW01_GSU01_PGR0_PLR1_TT04_08_USFGRO01_VW04_WG16_08_01_WGM01
    SolutionIndex: 104
    SolutionNameMin: Cijk_Ailk_Bjlk_SB_MT064x064x16_DTL0_GRVW01_GSU01_PGR1_PLR1_TT04_04_USFGRO01_VW04_WG16_16_01_WGM01
    SolutionIndex: 105
    SolutionNameMin: Cijk_Ailk_Bjlk_SB_MT064x064x08_DTL0_GRVW04_GSU01_PGR1_PLR1_TT04_08_USFGRO0_VW04_WG16_08_01_WGM01
    SolutionIndex: 106
    SolutionNameMin: Cijk_Ailk_Bjlk_SB_MT032x128x08_DTL0_GRVW04_GSU01_PGR1_PLR1_TT04_04_USFGRO0_VW04_WG08_32_01_WGM01
    SolutionIndex: 107
    SolutionNameMin: Cijk_Ailk_Bjlk_SB_MT064x128x16_DTL0_GRVW04_GSU01_PGR0_PLR1_TT08_04_USFGRO0_VW04_WG08_32_01_WGM01
    SolutionIndex: 108
    SolutionNameMin: Cijk_Ailk_Bjlk_SB_MT064x064x16_DTL0_GRVW04_GSU01_PGR1_PLR1_TT04_04_USFGRO0_VW04_WG16_16_01_WGM01
    SolutionIndex: 109
    SolutionNameMin: Cijk_Ailk_Bjlk_SB_MT064x128x16_DTL0_GRVW04_GSU01_PGR0_PLR1_TT04_08_USFGRO0_VW04_WG16_16_01_WGM01
    SolutionIndex: 110
    SolutionNameMin: Cijk_Ailk_Bjlk_SB_MT064x064x16_DTL0_GRVW04_GSU01_PGR1_PLR1_TT04_04_USFGRO0_VW04_WG16_16_01_WGM08
    SolutionIndex: 111
    SolutionNameMin: Cijk_Ailk_Bjlk_SB_MT064x128x16_DTL0_GRVW04_GSU01_PGR0_PLR1_TT04_08_USFGRO0_VW04_WG16_16_01_WGM08
    SolutionIndex: 112
    SolutionNameMin: Cijk_Ailk_Bjlk_SB_MT64x32x8_SE_EPS0_GSU1_PGR0_PLR1_SNLL0_TT8_4_VW4_WG8_8_1_WGM1
    SolutionIndex: 113
    SolutionNameMin: Cijk_Ailk_Bjlk_SB_MT64x64x8_SE_EPS1_GSU1_PGR1_PLR1_SNLL1_TT8_8_VW4_WG8_8_1_WGM8
    SolutionIndex: 114
    SolutionNameMin: Cijk_Ailk_Bjlk_SB_MT64x32x8_SE_EPS0_GSU1_PGR0_PLR1_SNLL0_TT8_4_VW4_WG8_8_1_WGM64
    SolutionIndex: 115
    SolutionNameMin: Cijk_Ailk_Bjlk_SB_MT64x64x8_SE_EPS1_GSU1_PGR1_PLR1_SNLL1_TT8_8_VW4_WG8_8_1_WGM64
    SolutionIndex: 116
    SolutionNameMin: Cijk_Ailk_Bjlk_SB_MT128x32x16_SE_EPS0_GSU1_PGR0_PLR1_SNLL0_TT8_4_VW4_WG16_8_1_WGM1
    SolutionIndex: 117
    SolutionNameMin: Cijk_Ailk_Bjlk_SB_MT64x64x16_SE_EPS1_GSU1_PGR1_PLR1_SNLL1_TT4_4_VW4_WG16_16_1_WGM1
    SolutionIndex: 118
    SolutionNameMin: Cijk_Ailk_Bjlk_SB_MT128x32x16_SE_EPS0_GSU1_PGR0_PLR1_SNLL0_TT8_4_VW4_WG16_8_1_WGM8
    SolutionIndex: 119
    SolutionNameMin: Cijk_Ailk_Bjlk_SB_MT64x64x16_SE_EPS0_GSU1_PGR0_PLR0_SNLL0_TT4_4_VW4_WG16_16_1_WGM8
    SolutionIndex: 120
    SolutionNameMin: Cijk_Ailk_Bjlk_SB_MT64x64x16_SE_EPS0_GSU1_PGR0_PLR1_SNLL0_TT4_4_VW4_WG16_16_1_WGM8
    SolutionIndex: 121
    SolutionNameMin: Cijk_Ailk_Bjlk_SB_MT64x64x16_SE_EPS1_GSU1_PGR1_PLR1_SNLL1_TT4_4_VW4_WG16_16_1_WGM8
    SolutionIndex: 122
    SolutionNameMin: Cijk_Ailk_Bjlk_SB_MT128x32x16_SE_EPS0_GSU1_PGR0_PLR1_SNLL0_TT8_4_VW4_WG16_8_1_WGM64
    SolutionIndex: 123
    SolutionNameMin: Cijk_Ailk_Bjlk_SB_MT64x64x16_SE_EPS0_GSU1_PGR0_PLR0_SNLL0_TT4_4_VW4_WG16_16_1_WGM64
    SolutionIndex: 124
    SolutionNameMin: Cijk_Ailk_Bjlk_SB_MT64x64x16_SE_EPS0_GSU1_PGR0_PLR1_SNLL0_TT4_4_VW4_WG16_16_1_WGM64
    SolutionIndex: 125
    SolutionNameMin: Cijk_Ailk_Bjlk_SB_MT64x64x16_SE_EPS1_GSU1_PGR1_PLR1_SNLL1_TT4_4_VW4_WG16_16_1_WGM64
    SolutionIndex: 126
    SolutionNameMin: Cijk_Ailk_Bjlk_SB_MT64x64x8_SE_EPS1_FL0_GRVW1_NLCA1_NLCB1_PGR1_PLR0_SNLL1_TT4_4_USFGRO1_VW1_WGM1
    SolutionIndex: 127
    SolutionNameMin: Cijk_Ailk_Bjlk_SB_MT64x64x8_SE_EPS0_FL0_GRVW1_NLCA1_NLCB1_PGR0_PLR1_SNLL0_TT4_4_USFGRO1_VW1_WGM1
    SolutionIndex: 128
    SolutionNameMin: Cijk_Ailk_Bjlk_SB_MT64x32x8_SE_EPS0_FL0_GRVW1_NLCA1_NLCB1_PGR0_PLR1_SNLL0_TT4_2_USFGRO1_VW1_WGM1
    SolutionIndex: 129
    SolutionNameMin: Cijk_Ailk_Bjlk_SB_MT64x128x8_SE_EPS1_FL0_GRVW1_NLCA1_NLCB1_PGR1_PLR0_SNLL1_TT4_8_USFGRO1_VW1_WGM1
    SolutionIndex: 130
    SolutionNameMin: Cijk_Ailk_Bjlk_SB_MT64x32x8_SE_EPS0_FL0_GRVW1_NLCA1_NLCB1_PGR0_PLR0_SNLL0_TT4_4_USFGRO1_VW1_WGM1
    SolutionIndex: 131
    SolutionNameMin: Cijk_Ailk_Bjlk_SB_MT64x32x8_SE_EPS0_FL0_GRVW1_NLCA1_NLCB1_PGR0_PLR1_SNLL0_TT4_4_USFGRO1_VW1_WGM1
    SolutionIndex: 132
    SolutionNameMin: Cijk_Ailk_Bjlk_SB_MT64x16x8_SE_EPS0_FL0_GRVW1_NLCA1_NLCB1_PGR0_PLR0_SNLL0_TT4_2_USFGRO1_VW1_WGM1
    SolutionIndex: 133
    SolutionNameMin: Cijk_Ailk_Bjlk_SB_MT64x16x8_SE_EPS0_FL0_GRVW1_NLCA1_NLCB1_PGR0_PLR1_SNLL0_TT4_2_USFGRO1_VW1_WGM1
    SolutionIndex: 134
    SolutionNameMin: Cijk_Ailk_Bjlk_SB_MT64x64x8_SE_EPS1_FL0_GRVW1_NLCA1_NLCB1_PGR1_PLR0_SNLL1_TT4_4_USFGRO1_VW1_WGM8
    SolutionIndex: 135
    SolutionNameMin: Cijk_Ailk_Bjlk_SB_MT64x128x8_SE_EPS1_FL0_GRVW1_NLCA1_NLCB1_PGR1_PLR0_SNLL1_TT4_8_USFGRO1_VW1_WGM8
    SolutionIndex: 136
    SolutionNameMin: Cijk_Ailk_Bjlk_SB_MT64x32x8_SE_EPS0_FL0_GRVW1_NLCA1_NLCB1_PGR0_PLR0_SNLL0_TT4_4_USFGRO1_VW1_WGM8
    SolutionIndex: 137
    SolutionNameMin: Cijk_Ailk_Bjlk_SB_MT64x32x8_SE_EPS0_FL0_GRVW1_NLCA1_NLCB1_PGR0_PLR1_SNLL0_TT4_4_USFGRO1_VW1_WGM8
    SolutionIndex: 138
    SolutionNameMin: Cijk_Ailk_Bjlk_SB_MT64x16x8_SE_EPS0_FL0_GRVW1_NLCA1_NLCB1_PGR0_PLR1_SNLL0_TT4_2_USFGRO1_VW1_WGM8
    SolutionIndex: 139
    SolutionNameMin: Cijk_Ailk_Bjlk_SB_MT64x64x16_SE_EPS0_FL0_GRVW1_NLCA1_NLCB1_PGR0_PLR0_SNLL0_TT4_4_USFGRO1_VW1_WGM1
    SolutionIndex: 140
    SolutionNameMin: Cijk_Ailk_Bjlk_SB_MT64x16x16_SE_EPS0_FL0_GRVW1_NLCA1_NLCB1_PGR0_PLR0_SNLL0_TT4_2_USFGRO1_VW1_WGM1
    SolutionIndex: 141
    SolutionNameMin: Cijk_Ailk_Bjlk_SB_MT64x16x16_SE_EPS0_FL0_GRVW1_NLCA1_NLCB1_PGR0_PLR1_SNLL0_TT4_2_USFGRO1_VW1_WGM1
    SolutionIndex: 142
    SolutionNameMin: Cijk_Ailk_Bjlk_SB_MT64x32x32_SE_EPS0_FL0_GRVW1_NLCA1_NLCB1_PGR0_PLR1_SNLL0_TT4_2_USFGRO1_VW1_WGM8
    SolutionIndex: 143
    SolutionNameMin: Cijk_Ailk_Bjlk_SB_MT64x32x8_SE_EPS0_FL0_GRVW1_NLCA1_NLCB1_PGR0_PLR0_SNLL0_TT4_4_USFGRO1_VW4_WGM1
    SolutionIndex: 144
    SolutionNameMin: Cijk_Ailk_Bjlk_SB_MT64x32x8_SE_EPS0_FL0_GRVW1_NLCA1_NLCB1_PGR0_PLR1_SNLL0_TT4_4_USFGRO1_VW4_WGM1
    SolutionIndex: 145
    SolutionNameMin: Cijk_Ailk_Bjlk_SB_MT64x32x8_SE_EPS0_FL0_GRVW1_NLCA1_NLCB1_PGR0_PLR0_SNLL0_TT4_4_USFGRO1_VW4_WGM8
    SolutionIndex: 146
    SolutionNameMin: Cijk_Ailk_Bjlk_SB_MT64x32x8_SE_EPS0_FL0_GRVW1_NLCA1_NLCB1_PGR0_PLR1_SNLL0_TT4_4_USFGRO1_VW4_WGM8
    SolutionIndex: 147
    SolutionNameMin: Cijk_Ailk_Bjlk_SB_MT64x64x8_SE_EPS1_FL0_GRVW4_NLCA1_NLCB1_PGR1_PLR1_SNLL1_TT8_4_USFGRO0_VW4_WGM1
    SolutionIndex: 148
    SolutionNameMin: Cijk_Ailk_Bjlk_SB_MT64x64x16_SE_EPS1_FL0_GRVW4_NLCA1_NLCB1_PGR1_PLR1_SNLL1_TT4_4_USFGRO0_VW4_WGM1
    SolutionIndex: 149
    SolutionNameMin: Cijk_Ailk_Bjlk_SB_MT64x64x16_SE_EPS1_FL1_GRVW4_NLCA1_NLCB1_PGR1_PLR1_SNLL1_TT4_4_USFGRO0_VW4_WGM1
    SolutionIndex: 150
    SolutionNameMin: Cijk_Ailk_Bjlk_SB_MT64x128x16_SE_EPS1_FL0_GRVW4_NLCA1_NLCB1_PGR1_PLR1_SNLL1_TT4_8_USFGRO0_VW4_WGM1
    SolutionIndex: 151
    SolutionNameMin: Cijk_Ailk_Bjlk_SB_MT128x64x16_SE_EPS1_FL0_GRVW4_NLCA1_NLCB1_PGR1_PLR1_SNLL1_TT8_4_USFGRO0_VW4_WGM1
    SolutionIndex: 152
    SolutionNameMin: Cijk_Ailk_Bjlk_SB_MT128x64x16_SE_EPS1_FL1_GRVW4_NLCA1_NLCB1_PGR1_PLR1_SNLL1_TT8_4_USFGRO0_VW4_WGM1
    SolutionIndex: 153
    SolutionNameMin: Cijk_Ailk_Bjlk_SB_MT128x128x16_SE_EPS1_FL0_GRVW4_NLCA1_NLCB1_PGR1_PLR1_SNLL1_TT8_8_USFGRO0_VW4_WGM1
    SolutionIndex: 154
    SolutionNameMin: Cijk_Ailk_Bjlk_SB_MT128x128x16_SE_EPS1_FL1_GRVW4_NLCA1_NLCB1_PGR1_PLR1_SNLL1_TT8_8_USFGRO0_VW4_WGM1
    SolutionIndex: 155
    SolutionNameMin: Cijk_Ailk_Bjlk_SB_MT64x64x16_SE_EPS1_FL0_GRVW4_NLCA1_NLCB1_PGR1_PLR1_SNLL1_TT4_4_USFGRO0_VW4_WGM8
    SolutionIndex: 156
    SolutionNameMin: Cijk_Ailk_Bjlk_SB_MT64x128x16_SE_EPS1_FL0_GRVW4_NLCA1_NLCB1_PGR1_PLR1_SNLL1_TT4_8_USFGRO0_VW4_WGM8
    SolutionIndex: 157
    SolutionNameMin: Cijk_Ailk_Bjlk_SB_MT64x128x16_SE_EPS1_FL1_GRVW4_NLCA1_NLCB1_PGR1_PLR1_SNLL1_TT4_8_USFGRO0_VW4_WGM8
    SolutionIndex: 158
    SolutionNameMin: Cijk_Ailk_Bjlk_SB_MT128x64x16_SE_EPS1_FL0_GRVW4_NLCA1_NLCB1_PGR1_PLR1_SNLL1_TT8_4_USFGRO0_VW4_WGM8
    SolutionIndex: 159
    SolutionNameMin: Cijk_Ailk_Bjlk_SB_MT128x64x16_SE_EPS1_FL1_GRVW4_NLCA1_NLCB1_PGR1_PLR1_SNLL1_TT8_4_USFGRO0_VW4_WGM8
    SolutionIndex: 160
    SolutionNameMin: Cijk_Ailk_Bjlk_SB_MT128x128x16_SE_EPS1_FL0_GRVW4_NLCA1_NLCB1_PGR1_PLR1_SNLL1_TT8_8_USFGRO0_VW4_WGM8
    SolutionIndex: 161
    SolutionNameMin: Cijk_Ailk_Bjlk_SB_MT128x128x16_SE_EPS1_FL1_GRVW4_NLCA1_NLCB1_PGR1_PLR1_SNLL1_TT8_8_USFGRO0_VW4_WGM8
    SolutionIndex: 162
    SolutionNameMin: Cijk_Ailk_Bjlk_SB_MT032x008x08_GRVW02_GSU01_SNLL0_TT02_02_VW02_WG16_04_01
    SolutionIndex: 163
    SolutionNameMin: Cijk_Ailk_Bjlk_SB_MT016x016x08_GRVW02_GSU01_SNLL0_TT02_02_VW02_WG08_08_01
    SolutionIndex: 164
    SolutionNameMin: Cijk_Ailk_Bjlk_SB_MT032x016x08_GRVW02_GSU01_SNLL0_TT04_02_VW02_WG08_08_01
    SolutionIndex: 165
    SolutionNameMin: Cijk_Ailk_Bjlk_SB_MT032x032x08_GRVW04_GSU01_SNLL0_TT04_04_VW04_WG08_08_01
    SolutionIndex: 166
    SolutionNameMin: Cijk_Ailk_Bjlk_SB_MT032x016x08_GRVW02_GSU01_SNLL0_TT02_02_VW02_WG16_08_01
    SolutionIndex: 167
    SolutionNameMin: Cijk_Ailk_Bjlk_SB_MT064x016x08_GRVW02_GSU01_SNLL0_TT04_02_VW02_WG16_08_01
    SolutionIndex: 168
    SolutionNameMin: Cijk_Ailk_Bjlk_SB_MT016x016x08_GRVW02_GSU01_SNLL0_TT02_02_VW02_WG08_08_01
    SolutionIndex: 169
    SolutionNameMin: Cijk_Ailk_Bjlk_SB_MT032x016x08_GRVW02_GSU01_SNLL0_TT04_02_VW02_WG08_08_01
    SolutionIndex: 170
    SolutionNameMin: Cijk_Ailk_Bjlk_SB_MT032x032x08_GRVW04_GSU01_SNLL0_TT04_04_VW04_WG08_08_01
    SolutionIndex: 171
    SolutionNameMin: Cijk_Ailk_Bjlk_SB_MT032x016x08_GRVW02_GSU01_SNLL0_TT02_02_VW02_WG16_08_01
    SolutionIndex: 172
    SolutionNameMin: Cijk_Ailk_Bjlk_SB_MT064x016x08_GRVW02_GSU01_SNLL0_TT04_02_VW02_WG16_08_01
    SolutionIndex: 173
    SolutionNameMin: Cijk_Ailk_Bjlk_SB_MT064x008x16_GRVW02_GSU01_SNLL0_TT02_02_VW02_WG32_04_01
    SolutionIndex: 174
    SolutionNameMin: Cijk_Ailk_Bjlk_SB_MT016x016x16_GRVW02_GSU01_SNLL0_TT02_02_VW02_WG08_08_01
    SolutionIndex: 175
    SolutionNameMin: Cijk_Ailk_Bjlk_SB_MT032x016x16_GRVW02_GSU01_SNLL0_TT04_02_VW02_WG08_08_01
    SolutionIndex: 176
    SolutionNameMin: Cijk_Ailk_Bjlk_SB_MT032x032x16_GRVW04_GSU01_SNLL0_TT04_04_VW04_WG08_08_01
    SolutionIndex: 177
    SolutionNameMin: Cijk_Ailk_Bjlk_SB_MT064x016x16_GRVW02_GSU01_SNLL0_TT04_02_VW02_WG16_08_01
    SolutionIndex: 178
    SolutionNameMin: Cijk_Ailk_Bjlk_SB_MT064x032x16_GRVW04_GSU01_SNLL0_TT04_04_VW04_WG16_08_01
    SolutionIndex: 179
    SolutionNameMin: Cijk_Ailk_Bjlk_SB_MT064x008x16_GRVW02_GSU01_SNLL0_TT02_02_VW02_WG32_04_01
    SolutionIndex: 180
    SolutionNameMin: Cijk_Ailk_Bjlk_SB_MT032x008x16_GRVW02_GSU01_SNLL0_TT02_02_VW02_WG16_04_01
    SolutionIndex: 181
    SolutionNameMin: Cijk_Ailk_Bjlk_SB_MT016x016x16_GRVW02_GSU01_SNLL0_TT02_02_VW02_WG08_08_01
    SolutionIndex: 182
    SolutionNameMin: Cijk_Ailk_Bjlk_SB_MT016x016x24_GRVW02_GSU01_SNLL0_TT02_02_VW02_WG08_08_01
    SolutionIndex: 183
    SolutionNameMin: Cijk_Ailk_Bjlk_SB_MT016x016x08_GRVW02_GSU02_SNLL0_TT02_02_VW02_WG08_08_02
    SolutionIndex: 184
    SolutionNameMin: Cijk_Ailk_Bjlk_SB_MT032x016x08_GRVW02_GSU02_SNLL0_TT04_02_VW02_WG08_08_02
    SolutionIndex: 185
    SolutionNameMin: Cijk_Ailk_Bjlk_SB_MT016x016x08_GRVW02_GSU04_SNLL0_TT02_02_VW02_WG08_08_02
    SolutionIndex: 186
    SolutionNameMin: Cijk_Ailk_Bjlk_SB_MT016x016x08_GRVW02_GSU08_SNLL0_TT02_02_VW02_WG08_08_02
    SolutionIndex: 187
    SolutionNameMin: Cijk_Ailk_Bjlk_SB_MT016x016x16_GRVW02_GSU02_SNLL0_TT02_02_VW02_WG08_08_02
    SolutionIndex: 188
    SolutionNameMin: Cijk_Ailk_Bjlk_SB_MT032x016x16_GRVW02_GSU02_SNLL0_TT04_02_VW02_WG08_08_02
    SolutionIndex: 189
    SolutionNameMin: Cijk_Ailk_Bjlk_SB_MT032x032x16_GRVW04_GSU02_SNLL0_TT04_04_VW04_WG08_08_02
    SolutionIndex: 190
    SolutionNameMin: Cijk_Ailk_Bjlk_SB_MT064x032x16_GRVW04_GSU02_SNLL0_TT08_04_VW04_WG08_08_02
    SolutionIndex: 191
    SolutionNameMin: Cijk_Ailk_Bjlk_SB_MT016x016x16_GRVW02_GSU02_SNLL0_TT02_02_VW02_WG08_08_04
    SolutionIndex: 192
    SolutionNameMin: Cijk_Ailk_Bjlk_SB_MT032x016x16_GRVW02_GSU02_SNLL0_TT04_02_VW02_WG08_08_04
    SolutionIndex: 193
    SolutionNameMin: Cijk_Ailk_Bjlk_SB_MT032x016x16_GRVW02_GSU02_SNLL0_TT02_02_VW02_WG16_08_02
    SolutionIndex: 194
    SolutionNameMin: Cijk_Ailk_Bjlk_SB_MT064x016x16_GRVW02_GSU02_SNLL0_TT04_02_VW02_WG16_08_02
    SolutionIndex: 195
    SolutionNameMin: Cijk_Ailk_Bjlk_SB_MT064x016x16_GRVW04_GSU02_SNLL0_TT04_04_VW04_WG16_04_04
    SolutionIndex: 196
    SolutionNameMin: Cijk_Ailk_Bjlk_SB_MT016x016x16_GRVW02_GSU02_SNLL0_TT02_02_VW02_WG08_08_02
    SolutionIndex: 197
    SolutionNameMin: Cijk_Ailk_Bjlk_SB_MT032x016x16_GRVW02_GSU02_SNLL0_TT04_02_VW02_WG08_08_02
    SolutionIndex: 198
    SolutionNameMin: Cijk_Ailk_Bjlk_SB_MT032x032x16_GRVW04_GSU02_SNLL0_TT04_04_VW04_WG08_08_02
    SolutionIndex: 199
    SolutionNameMin: Cijk_Ailk_Bjlk_SB_MT016x016x16_GRVW02_GSU02_SNLL0_TT02_02_VW02_WG08_08_04
    SolutionIndex: 200
    SolutionNameMin: Cijk_Ailk_Bjlk_SB_MT032x016x16_GRVW02_GSU02_SNLL0_TT04_02_VW02_WG08_08_04
    SolutionIndex: 201
    SolutionNameMin: Cijk_Ailk_Bjlk_SB_MT032x016x16_GRVW02_GSU02_SNLL0_TT02_02_VW02_WG16_08_02
    SolutionIndex: 202
    SolutionNameMin: Cijk_Ailk_Bjlk_SB_MT016x016x16_GRVW02_GSU04_SNLL0_TT02_02_VW02_WG08_08_04
    SolutionIndex: 203
    SolutionNameMin: Cijk_Ailk_Bjlk_SB_MT032x032x16_GRVW04_GSU04_SNLL0_TT04_04_VW04_WG08_08_02
    SolutionIndex: 204
    SolutionNameMin: Cijk_Ailk_Bjlk_SB_MT016x016x16_GRVW02_GSU04_SNLL0_TT02_02_VW02_WG08_08_04
    SolutionIndex: 205
    SolutionNameMin: Cijk_Ailk_Bjlk_SB_MT016x016x16_GRVW02_GSU08_SNLL0_TT02_02_VW02_WG08_08_04
    SolutionIndex: 206
    SolutionNameMin: Cijk_Ailk_Bjlk_SB_MT032x008x32_GRVW02_GSU02_SNLL0_TT02_02_VW02_WG16_04_04
    SolutionIndex: 207
    SolutionNameMin: Cijk_Ailk_Bjlk_SB_MT032x016x32_GRVW02_GSU02_SNLL0_TT04_02_VW02_WG08_08_02
    SolutionIndex: 208
    SolutionNameMin: Cijk_Ailk_Bjlk_SB_MT016x016x32_GRVW02_GSU02_SNLL0_TT02_02_VW02_WG08_08_04
    SolutionIndex: 209
    SolutionNameMin: Cijk_Ailk_Bjlk_SB_MT032x016x32_GRVW02_GSU02_SNLL0_TT04_02_VW02_WG08_08_04
    SolutionIndex: 210
    SolutionNameMin: Cijk_Ailk_Bjlk_SB_MT032x032x32_GRVW04_GSU02_SNLL0_TT04_04_VW04_WG08_08_04
    SolutionIndex: 211
    SolutionNameMin: Cijk_Ailk_Bjlk_SB_MT064x032x32_GRVW04_GSU02_SNLL0_TT08_04_VW04_WG08_08_04
    SolutionIndex: 212
    SolutionNameMin: Cijk_Ailk_Bjlk_SB_MT064x032x32_GRVW04_GSU02_SNLL0_TT04_04_VW04_WG16_08_02
    SolutionIndex: 213
    SolutionNameMin: Cijk_Ailk_Bjlk_SB_MT128x032x32_GRVW04_GSU02_SNLL0_TT08_08_VW04_WG16_04_04
    SolutionIndex: 214
    SolutionNameMin: Cijk_Ailk_Bjlk_SB_MT032x016x32_GRVW02_GSU02_SNLL0_TT04_02_VW02_WG08_08_02
    SolutionIndex: 215
    SolutionNameMin: Cijk_Ailk_Bjlk_SB_MT032x032x32_GRVW04_GSU02_SNLL0_TT04_04_VW04_WG08_08_02
    SolutionIndex: 216
    SolutionNameMin: Cijk_Ailk_Bjlk_SB_MT016x016x32_GRVW02_GSU02_SNLL0_TT02_02_VW02_WG08_08_04
    SolutionIndex: 217
    SolutionNameMin: Cijk_Ailk_Bjlk_SB_MT032x016x32_GRVW02_GSU02_SNLL0_TT04_02_VW02_WG08_08_04
    SolutionIndex: 218
    SolutionNameMin: Cijk_Ailk_Bjlk_SB_MT032x032x32_GRVW04_GSU02_SNLL0_TT04_04_VW04_WG08_08_04
    SolutionIndex: 219
    SolutionNameMin: Cijk_Ailk_Bjlk_SB_MT064x032x32_GRVW04_GSU02_SNLL0_TT08_04_VW04_WG08_08_04
    SolutionIndex: 220
    SolutionNameMin: Cijk_Ailk_Bjlk_SB_MT064x008x32_GRVW02_GSU04_SNLL0_TT04_02_VW02_WG16_04_04
    SolutionIndex: 221
    SolutionNameMin: Cijk_Ailk_Bjlk_SB_MT016x016x32_GRVW02_GSU04_SNLL0_TT02_02_VW02_WG08_08_04
    SolutionIndex: 222
    SolutionNameMin: Cijk_Ailk_Bjlk_SB_MT032x016x32_GRVW02_GSU04_SNLL0_TT04_02_VW02_WG08_08_04
    SolutionIndex: 223
    SolutionNameMin: Cijk_Ailk_Bjlk_SB_MT032x032x32_GRVW04_GSU04_SNLL0_TT04_04_VW04_WG08_08_04
    SolutionIndex: 224
    SolutionNameMin: Cijk_Ailk_Bjlk_SB_MT032x032x32_GRVW04_GSU04_SNLL0_TT04_04_VW04_WG08_08_04
    SolutionIndex: 225
    SolutionNameMin: Cijk_Ailk_Bjlk_SB_MT032x008x32_GRVW02_GSU08_SNLL0_TT02_02_VW02_WG16_04_04
    SolutionIndex: 226
    SolutionNameMin: Cijk_Ailk_Bjlk_SB_MT016x016x32_GRVW02_GSU08_SNLL0_TT02_02_VW02_WG08_08_04
    SolutionIndex: 227
    SolutionNameMin: Cijk_Ailk_Bjlk_SB_MT128x128x08_GRVW04_GSU01_SNLL0_TT08_08_VW04_WG16_16_01
    SolutionIndex: 228
    SolutionNameMin: Cijk_Ailk_Bjlk_SB_MT064x064x16_GRVW04_GSU01_SNLL0_TT04_04_VW04_WG16_16_01
    SolutionIndex: 229
    SolutionNameMin: Cijk_Ailk_Bjlk_SB_MT064x128x16_GRVW04_GSU01_SNLL0_TT04_08_VW04_WG16_16_01
    SolutionIndex: 230
    SolutionNameMin: Cijk_Ailk_Bjlk_SB_MT128x064x16_GRVW04_GSU01_SNLL0_TT08_04_VW04_WG16_16_01
    SolutionIndex: 231
    SolutionNameMin: Cijk_Ailk_Bjlk_SB_MT064x064x16_GRVW04_GSU01_SNLL0_TT04_04_VW04_WG16_16_01
    SolutionIndex: 232
    SolutionNameMin: Cijk_Ailk_Bjlk_SB_MT064x128x16_GRVW04_GSU01_SNLL0_TT04_08_VW04_WG16_16_01
    SolutionIndex: 233
    SolutionNameMin: Cijk_Ailk_Bjlk_SB_MT128x064x16_GRVW04_GSU01_SNLL0_TT08_04_VW04_WG16_16_01
    SolutionIndex: 234
    SolutionNameMin: Cijk_Ailk_Bjlk_SB_MT128x128x08_GRVW04_GSU01_SNLL1_TT08_08_VW04_WG16_16_01
    SolutionIndex: 235
    SolutionNameMin: Cijk_Ailk_Bjlk_SB_MT128x128x08_GRVW04_GSU01_SNLL1_TT08_08_VW04_WG16_16_01
    SolutionIndex: 236
    SolutionNameMin: Cijk_Ailk_Bjlk_SB_MT064x064x16_GRVW04_GSU01_SNLL1_TT04_04_VW04_WG16_16_01
    SolutionIndex: 237
    SolutionNameMin: Cijk_Ailk_Bjlk_SB_MT064x128x16_GRVW04_GSU01_SNLL1_TT04_08_VW04_WG16_16_01
    SolutionIndex: 238
    SolutionNameMin: Cijk_Ailk_Bjlk_SB_MT096x128x16_GRVW02_GSU01_SNLL1_TT06_08_VW02_WG16_16_01
    SolutionIndex: 239
    SolutionNameMin: Cijk_Ailk_Bjlk_SB_MT128x064x16_GRVW04_GSU01_SNLL1_TT08_04_VW04_WG16_16_01
    SolutionIndex: 240
    SolutionNameMin: Cijk_Ailk_Bjlk_SB_MT128x096x16_GRVW02_GSU01_SNLL1_TT08_06_VW02_WG16_16_01
    SolutionIndex: 241
    SolutionNameMin: Cijk_Ailk_Bjlk_SB_MT128x128x16_GRVW04_GSU01_SNLL1_TT08_08_VW04_WG16_16_01
    SolutionIndex: 242
    SolutionNameMin: Cijk_Ailk_Bjlk_SB_MT064x064x16_GRVW04_GSU01_SNLL1_TT04_04_VW04_WG16_16_01
    SolutionIndex: 243
    SolutionNameMin: Cijk_Ailk_Bjlk_SB_MT064x128x16_GRVW04_GSU01_SNLL1_TT04_08_VW04_WG16_16_01
    SolutionIndex: 244
    SolutionNameMin: Cijk_Ailk_Bjlk_SB_MT096x128x16_GRVW02_GSU01_SNLL1_TT06_08_VW02_WG16_16_01
    SolutionIndex: 245
    SolutionNameMin: Cijk_Ailk_Bjlk_SB_MT128x064x16_GRVW04_GSU01_SNLL1_TT08_04_VW04_WG16_16_01
    SolutionIndex: 246
    SolutionNameMin: Cijk_Ailk_Bjlk_SB_MT128x096x16_GRVW02_GSU01_SNLL1_TT08_06_VW02_WG16_16_01
    SolutionIndex: 247
    SolutionNameMin: Cijk_Ailk_Bjlk_SB_MT128x128x16_GRVW04_GSU01_SNLL1_TT08_08_VW04_WG16_16_01
    SolutionIndex: 248
    SolutionNameMin: Cijk_Ailk_Bjlk_SB_MT016x016x04_GRVW02_GSU01_SNLL0_TT02_02_VW02_WG08_08_01
    SolutionIndex: 249
    SolutionNameMin: Cijk_Ailk_Bjlk_SB_MT032x032x02_GRVW04_GSU01_SNLL0_TT04_04_VW04_WG08_08_01
    SolutionIndex: 250
    SolutionNameMin: Cijk_Ailk_Bjlk_SB_MT008x008x08_GRVW02_GSU01_SNLL1_TT02_02_VW02_WG04_04_04
    SolutionIndex: 251
    SolutionNameMin: Cijk_Ailk_Bjlk_SB_MT016x016x16_GRVW02_GSU01_SNLL1_TT02_02_VW02_WG08_08_04
    SolutionIndex: 252
    SolutionNameMin: Cijk_Ailk_Bjlk_SB_MT008x008x08_GRVW02_GSU02_SNLL0_TT02_02_VW02_WG04_04_04
    SolutionIndex: 253
    SolutionNameMin: Cijk_Ailk_Bjlk_SB_MT016x016x04_GRVW02_GSU04_SNLL0_TT02_02_VW02_WG08_08_01
    SolutionIndex: 254
    SolutionNameMin: Cijk_Ailk_Bjlk_SB_MT008x008x08_GRVW02_GSU04_SNLL0_TT02_02_VW02_WG04_04_04
    SolutionIndex: 255
    SolutionNameMin: Cijk_Ailk_Bjlk_SB_MT016x016x04_GRVW02_GSU08_SNLL0_TT02_02_VW02_WG08_08_01
    SolutionIndex: 256
    SolutionNameMin: Cijk_Ailk_Bjlk_SB_MT008x008x08_GRVW02_GSU08_SNLL0_TT02_02_VW02_WG04_04_04
    SolutionIndex: 257
    SolutionNameMin: Cijk_Ailk_Bjlk_SB_MT016x016x08_GRVW02_GSU16_SNLL0_TT02_02_VW02_WG08_08_02
    SolutionIndex: 258
    SolutionNameMin: Cijk_Ailk_Bjlk_SB_MT008x008x08_GRVW02_GSU16_SNLL0_TT02_02_VW02_WG04_04_04
    SolutionIndex: 259
    SolutionNameMin: Cijk_Ailk_Bjlk_SB_MT016x016x16_GRVW02_GSU16_SNLL0_TT02_02_VW02_WG08_08_04
    SolutionIndex: 260
    SolutionNameMin: Cijk_Ailk_Bjlk_SB_MT064x128x08_DTL0_GRVW01_GSU01_PGR1_PLR1_TT04_08_USFGRO01_VW02_WG16_16_01_WGM01
    SolutionIndex: 261
    SolutionNameMin: Cijk_Ailk_Bjlk_SB_MT064x064x08_DTL0_GRVW01_GSU01_PGR1_PLR1_TT04_08_USFGRO01_VW04_WG16_08_01_WGM01
    SolutionIndex: 262
    SolutionNameMin: Cijk_Ailk_Bjlk_SB_MT032x256x08_DTL1_GRVW01_GSU01_PGR0_PLR1_TT04_08_USFGRO01_VW04_WG08_32_01_WGM01
    SolutionIndex: 263
    SolutionNameMin: Cijk_Ailk_Bjlk_SB_MT032x256x08_DTL1_GRVW01_GSU01_PGR0_PLR1_TT04_08_USFGRO01_VW04_WG08_32_01_WGM08
    SolutionIndex: 264
    SolutionNameMin: Cijk_Ailk_Bjlk_SB_MT032x256x08_DTL1_GRVW01_GSU01_PGR0_PLR1_TT04_08_USFGRO01_VW04_WG08_32_01_WGM64
    SolutionIndex: 265
    SolutionNameMin: Cijk_Ailk_Bjlk_SB_MT064x064x16_DTL0_GRVW01_GSU01_PGR0_PLR1_TT04_08_USFGRO01_VW04_WG16_08_01_WGM01
    SolutionIndex: 266
    SolutionNameMin: Cijk_Ailk_Bjlk_SB_MT064x064x16_DTL0_GRVW01_GSU01_PGR1_PLR1_TT04_04_USFGRO01_VW04_WG16_16_01_WGM01
    SolutionIndex: 267
    SolutionNameMin: Cijk_Ailk_Bjlk_SB_MT064x064x08_DTL0_GRVW04_GSU01_PGR1_PLR1_TT04_08_USFGRO0_VW04_WG16_08_01_WGM01
    SolutionIndex: 268
    SolutionNameMin: Cijk_Ailk_Bjlk_SB_MT032x128x08_DTL0_GRVW04_GSU01_PGR1_PLR1_TT04_04_USFGRO0_VW04_WG08_32_01_WGM01
    SolutionIndex: 269
    SolutionNameMin: Cijk_Ailk_Bjlk_SB_MT064x128x16_DTL0_GRVW04_GSU01_PGR0_PLR1_TT08_04_USFGRO0_VW04_WG08_32_01_WGM01
    SolutionIndex: 270
    SolutionNameMin: Cijk_Ailk_Bjlk_SB_MT064x064x16_DTL0_GRVW04_GSU01_PGR1_PLR1_TT04_04_USFGRO0_VW04_WG16_16_01_WGM01
    SolutionIndex: 271
    SolutionNameMin: Cijk_Ailk_Bjlk_SB_MT064x128x16_DTL0_GRVW04_GSU01_PGR0_PLR1_TT04_08_USFGRO0_VW04_WG16_16_01_WGM01
    SolutionIndex: 272
    SolutionNameMin: Cijk_Ailk_Bjlk_SB_MT064x064x16_DTL0_GRVW04_GSU01_PGR1_PLR1_TT04_04_USFGRO0_VW04_WG16_16_01_WGM08
    SolutionIndex: 273
    SolutionNameMin: Cijk_Ailk_Bjlk_SB_MT064x128x16_DTL0_GRVW04_GSU01_PGR0_PLR1_TT04_08_USFGRO0_VW04_WG16_16_01_WGM08
    SolutionIndex: 274
    SolutionNameMin: Cijk_Ailk_Bjlk_SB_MT64x32x8_SE_EPS0_GSU1_PGR0_PLR1_SNLL0_TT8_4_VW4_WG8_8_1_WGM1
    SolutionIndex: 275
    SolutionNameMin: Cijk_Ailk_Bjlk_SB_MT64x64x8_SE_EPS1_GSU1_PGR1_PLR1_SNLL1_TT8_8_VW4_WG8_8_1_WGM8
    SolutionIndex: 276
    SolutionNameMin: Cijk_Ailk_Bjlk_SB_MT64x32x8_SE_EPS0_GSU1_PGR0_PLR1_SNLL0_TT8_4_VW4_WG8_8_1_WGM64
    SolutionIndex: 277
    SolutionNameMin: Cijk_Ailk_Bjlk_SB_MT64x64x8_SE_EPS1_GSU1_PGR1_PLR1_SNLL1_TT8_8_VW4_WG8_8_1_WGM64
    SolutionIndex: 278
    SolutionNameMin: Cijk_Ailk_Bjlk_SB_MT128x32x16_SE_EPS0_GSU1_PGR0_PLR1_SNLL0_TT8_4_VW4_WG16_8_1_WGM1
    SolutionIndex: 279
    SolutionNameMin: Cijk_Ailk_Bjlk_SB_MT64x64x16_SE_EPS1_GSU1_PGR1_PLR1_SNLL1_TT4_4_VW4_WG16_16_1_WGM1
    SolutionIndex: 280
    SolutionNameMin: Cijk_Ailk_Bjlk_SB_MT128x32x16_SE_EPS0_GSU1_PGR0_PLR1_SNLL0_TT8_4_VW4_WG16_8_1_WGM8
    SolutionIndex: 281
    SolutionNameMin: Cijk_Ailk_Bjlk_SB_MT64x64x16_SE_EPS0_GSU1_PGR0_PLR0_SNLL0_TT4_4_VW4_WG16_16_1_WGM8
    SolutionIndex: 282
    SolutionNameMin: Cijk_Ailk_Bjlk_SB_MT64x64x16_SE_EPS0_GSU1_PGR0_PLR1_SNLL0_TT4_4_VW4_WG16_16_1_WGM8
    SolutionIndex: 283
    SolutionNameMin: Cijk_Ailk_Bjlk_SB_MT64x64x16_SE_EPS1_GSU1_PGR1_PLR1_SNLL1_TT4_4_VW4_WG16_16_1_WGM8
    SolutionIndex: 284
    SolutionNameMin: Cijk_Ailk_Bjlk_SB_MT128x32x16_SE_EPS0_GSU1_PGR0_PLR1_SNLL0_TT8_4_VW4_WG16_8_1_WGM64
    SolutionIndex: 285
    SolutionNameMin: Cijk_Ailk_Bjlk_SB_MT64x64x16_SE_EPS0_GSU1_PGR0_PLR0_SNLL0_TT4_4_VW4_WG16_16_1_WGM64
    SolutionIndex: 286
    SolutionNameMin: Cijk_Ailk_Bjlk_SB_MT64x64x16_SE_EPS0_GSU1_PGR0_PLR1_SNLL0_TT4_4_VW4_WG16_16_1_WGM64
    SolutionIndex: 287
    SolutionNameMin: Cijk_Ailk_Bjlk_SB_MT64x64x16_SE_EPS1_GSU1_PGR1_PLR1_SNLL1_TT4_4_VW4_WG16_16_1_WGM64
    SolutionIndex: 288
    SolutionNameMin: Cijk_Ailk_Bjlk_SB_MT64x64x8_SE_EPS1_FL0_GRVW1_NLCA1_NLCB1_PGR1_PLR0_SNLL1_TT4_4_USFGRO1_VW1_WGM1
    SolutionIndex: 289
    SolutionNameMin: Cijk_Ailk_Bjlk_SB_MT64x64x8_SE_EPS0_FL0_GRVW1_NLCA1_NLCB1_PGR0_PLR1_SNLL0_TT4_4_USFGRO1_VW1_WGM1
    SolutionIndex: 290
    SolutionNameMin: Cijk_Ailk_Bjlk_SB_MT64x32x8_SE_EPS0_FL0_GRVW1_NLCA1_NLCB1_PGR0_PLR1_SNLL0_TT4_2_USFGRO1_VW1_WGM1
    SolutionIndex: 291
    SolutionNameMin: Cijk_Ailk_Bjlk_SB_MT64x128x8_SE_EPS1_FL0_GRVW1_NLCA1_NLCB1_PGR1_PLR0_SNLL1_TT4_8_USFGRO1_VW1_WGM1
    SolutionIndex: 292
    SolutionNameMin: Cijk_Ailk_Bjlk_SB_MT64x32x8_SE_EPS0_FL0_GRVW1_NLCA1_NLCB1_PGR0_PLR0_SNLL0_TT4_4_USFGRO1_VW1_WGM1
    SolutionIndex: 293
    SolutionNameMin: Cijk_Ailk_Bjlk_SB_MT64x32x8_SE_EPS0_FL0_GRVW1_NLCA1_NLCB1_PGR0_PLR1_SNLL0_TT4_4_USFGRO1_VW1_WGM1
    SolutionIndex: 294
    SolutionNameMin: Cijk_Ailk_Bjlk_SB_MT64x16x8_SE_EPS0_FL0_GRVW1_NLCA1_NLCB1_PGR0_PLR0_SNLL0_TT4_2_USFGRO1_VW1_WGM1
    SolutionIndex: 295
    SolutionNameMin: Cijk_Ailk_Bjlk_SB_MT64x16x8_SE_EPS0_FL0_GRVW1_NLCA1_NLCB1_PGR0_PLR1_SNLL0_TT4_2_USFGRO1_VW1_WGM1
    SolutionIndex: 296
    SolutionNameMin: Cijk_Ailk_Bjlk_SB_MT64x64x8_SE_EPS1_FL0_GRVW1_NLCA1_NLCB1_PGR1_PLR0_SNLL1_TT4_4_USFGRO1_VW1_WGM8
    SolutionIndex: 297
    SolutionNameMin: Cijk_Ailk_Bjlk_SB_MT64x128x8_SE_EPS1_FL0_GRVW1_NLCA1_NLCB1_PGR1_PLR0_SNLL1_TT4_8_USFGRO1_VW1_WGM8
    SolutionIndex: 298
    SolutionNameMin: Cijk_Ailk_Bjlk_SB_MT64x32x8_SE_EPS0_FL0_GRVW1_NLCA1_NLCB1_PGR0_PLR0_SNLL0_TT4_4_USFGRO1_VW1_WGM8
    SolutionIndex: 299
    SolutionNameMin: Cijk_Ailk_Bjlk_SB_MT64x32x8_SE_EPS0_FL0_GRVW1_NLCA1_NLCB1_PGR0_PLR1_SNLL0_TT4_4_USFGRO1_VW1_WGM8
    SolutionIndex: 300
    SolutionNameMin: Cijk_Ailk_Bjlk_SB_MT64x16x8_SE_EPS0_FL0_GRVW1_NLCA1_NLCB1_PGR0_PLR1_SNLL0_TT4_2_USFGRO1_VW1_WGM8
    SolutionIndex: 301
    SolutionNameMin: Cijk_Ailk_Bjlk_SB_MT64x64x16_SE_EPS0_FL0_GRVW1_NLCA1_NLCB1_PGR0_PLR0_SNLL0_TT4_4_USFGRO1_VW1_WGM1
    SolutionIndex: 302
    SolutionNameMin: Cijk_Ailk_Bjlk_SB_MT64x16x16_SE_EPS0_FL0_GRVW1_NLCA1_NLCB1_PGR0_PLR0_SNLL0_TT4_2_USFGRO1_VW1_WGM1
    SolutionIndex: 303
    SolutionNameMin: Cijk_Ailk_Bjlk_SB_MT64x16x16_SE_EPS0_FL0_GRVW1_NLCA1_NLCB1_PGR0_PLR1_SNLL0_TT4_2_USFGRO1_VW1_WGM1
    SolutionIndex: 304
    SolutionNameMin: Cijk_Ailk_Bjlk_SB_MT64x32x32_SE_EPS0_FL0_GRVW1_NLCA1_NLCB1_PGR0_PLR1_SNLL0_TT4_2_USFGRO1_VW1_WGM8
    SolutionIndex: 305
    SolutionNameMin: Cijk_Ailk_Bjlk_SB_MT64x32x8_SE_EPS0_FL0_GRVW1_NLCA1_NLCB1_PGR0_PLR0_SNLL0_TT4_4_USFGRO1_VW4_WGM1
    SolutionIndex: 306
    SolutionNameMin: Cijk_Ailk_Bjlk_SB_MT64x32x8_SE_EPS0_FL0_GRVW1_NLCA1_NLCB1_PGR0_PLR1_SNLL0_TT4_4_USFGRO1_VW4_WGM1
    SolutionIndex: 307
    SolutionNameMin: Cijk_Ailk_Bjlk_SB_MT64x32x8_SE_EPS0_FL0_GRVW1_NLCA1_NLCB1_PGR0_PLR0_SNLL0_TT4_4_USFGRO1_VW4_WGM8
    SolutionIndex: 308
    SolutionNameMin: Cijk_Ailk_Bjlk_SB_MT64x32x8_SE_EPS0_FL0_GRVW1_NLCA1_NLCB1_PGR0_PLR1_SNLL0_TT4_4_USFGRO1_VW4_WGM8
    SolutionIndex: 309
    SolutionNameMin: Cijk_Ailk_Bjlk_SB_MT64x64x8_SE_EPS1_FL0_GRVW4_NLCA1_NLCB1_PGR1_PLR1_SNLL1_TT8_4_USFGRO0_VW4_WGM1
    SolutionIndex: 310
    SolutionNameMin: Cijk_Ailk_Bjlk_SB_MT64x64x16_SE_EPS1_FL0_GRVW4_NLCA1_NLCB1_PGR1_PLR1_SNLL1_TT4_4_USFGRO0_VW4_WGM1
    SolutionIndex: 311
    SolutionNameMin: Cijk_Ailk_Bjlk_SB_MT64x64x16_SE_EPS1_FL1_GRVW4_NLCA1_NLCB1_PGR1_PLR1_SNLL1_TT4_4_USFGRO0_VW4_WGM1
    SolutionIndex: 312
    SolutionNameMin: Cijk_Ailk_Bjlk_SB_MT64x128x16_SE_EPS1_FL0_GRVW4_NLCA1_NLCB1_PGR1_PLR1_SNLL1_TT4_8_USFGRO0_VW4_WGM1
    SolutionIndex: 313
    SolutionNameMin: Cijk_Ailk_Bjlk_SB_MT128x64x16_SE_EPS1_FL0_GRVW4_NLCA1_NLCB1_PGR1_PLR1_SNLL1_TT8_4_USFGRO0_VW4_WGM1
    SolutionIndex: 314
    SolutionNameMin: Cijk_Ailk_Bjlk_SB_MT128x64x16_SE_EPS1_FL1_GRVW4_NLCA1_NLCB1_PGR1_PLR1_SNLL1_TT8_4_USFGRO0_VW4_WGM1
    SolutionIndex: 315
    SolutionNameMin: Cijk_Ailk_Bjlk_SB_MT128x128x16_SE_EPS1_FL0_GRVW4_NLCA1_NLCB1_PGR1_PLR1_SNLL1_TT8_8_USFGRO0_VW4_WGM1
    SolutionIndex: 316
    SolutionNameMin: Cijk_Ailk_Bjlk_SB_MT128x128x16_SE_EPS1_FL1_GRVW4_NLCA1_NLCB1_PGR1_PLR1_SNLL1_TT8_8_USFGRO0_VW4_WGM1
    SolutionIndex: 317
    SolutionNameMin: Cijk_Ailk_Bjlk_SB_MT64x64x16_SE_EPS1_FL0_GRVW4_NLCA1_NLCB1_PGR1_PLR1_SNLL1_TT4_4_USFGRO0_VW4_WGM8
    SolutionIndex: 318
    SolutionNameMin: Cijk_Ailk_Bjlk_SB_MT64x128x16_SE_EPS1_FL0_GRVW4_NLCA1_NLCB1_PGR1_PLR1_SNLL1_TT4_8_USFGRO0_VW4_WGM8
    SolutionIndex: 319
    SolutionNameMin: Cijk_Ailk_Bjlk_SB_MT64x128x16_SE_EPS1_FL1_GRVW4_NLCA1_NLCB1_PGR1_PLR1_SNLL1_TT4_8_USFGRO0_VW4_WGM8
    SolutionIndex: 320
    SolutionNameMin: Cijk_Ailk_Bjlk_SB_MT128x64x16_SE_EPS1_FL0_GRVW4_NLCA1_NLCB1_PGR1_PLR1_SNLL1_TT8_4_USFGRO0_VW4_WGM8
    SolutionIndex: 321
    SolutionNameMin: Cijk_Ailk_Bjlk_SB_MT128x64x16_SE_EPS1_FL1_GRVW4_NLCA1_NLCB1_PGR1_PLR1_SNLL1_TT8_4_USFGRO0_VW4_WGM8
    SolutionIndex: 322
    SolutionNameMin: Cijk_Ailk_Bjlk_SB_MT128x128x16_SE_EPS1_FL0_GRVW4_NLCA1_NLCB1_PGR1_PLR1_SNLL1_TT8_8_USFGRO0_VW4_WGM8
    SolutionIndex: 323
    SolutionNameMin: Cijk_Ailk_Bjlk_SB_MT128x128x16_SE_EPS1_FL1_GRVW4_NLCA1_NLCB1_PGR1_PLR1_SNLL1_TT8_8_USFGRO0_VW4_WGM8
- - - [1024, 128, 1, 128]
    - [4, 1028.02]
  - - [4, 704, 1, 1280]
    - [43, 363.355]
  - - [4, 1856, 1, 3328]
    - [43, 579.434]
  - - [1856, 448, 1, 3328]
    - [80, 6966.73]
  - - [2944, 4288, 1, 1280]
    - [75, 9057.88]
  - - [2368, 64, 1, 3328]
    - [36, 5837.56]
  - - [2368, 5888, 1, 256]
    - [80, 9111.06]
  - - [128, 64, 1, 256]
    - [42, 374.491]
  - - [5888, 1024, 1, 1280]
    - [85, 8570.44]
  - - [128, 6784, 1, 3328]
    - [48, 7703.86]
  - - [64, 4, 1, 256]
    - [94, 11.2219]
  - - [5888, 1856, 1, 3328]
    - [80, 9394.3]
  - - [5056, 704, 1, 256]
    - [83, 8026.89]
  - - [5888, 2944, 1, 3328]
    - [73, 7608.11]
  - - [1856, 4288, 1, 256]
    - [74, 8986.32]
  - - [1024, 5056, 1, 128]
    - [66, 3898.24]
  - - [5056, 5056, 1, 3328]
    - [74, 9536.75]
  - - [1408, 5888, 1, 1280]
    - [75, 9279.09]
  - - [2368, 448, 1, 128]
    - [67, 2474.32]
  - - [1024, 3584, 1, 3328]
    - [77, 9258.48]
  - - [4, 2944, 1, 1280]
    - [29, 611.74]
  - - [1408, 64, 1, 128]
    - [0, 858.21]
  - - [256, 4288, 1, 3328]
    - [80, 7615.98]
  - - [5888, 1408, 1, 1280]
    - [73, 9620.29]
  - - [704, 1856, 1, 3328]
    - [74, 9033.65]
  - - [4, 1408, 1, 128]
    - [87, 24.355]
  - - [1024, 2368, 1, 256]
    - [74, 7526.15]
  - - [1408, 1856, 1, 1280]
    - [77, 8324.09]
  - - [1408, 64, 1, 1280]
    - [48, 4681.14]
  - - [448, 1024, 1, 1280]
    - [74, 7112.43]
  - - [256, 1408, 1, 3328]
    - [80, 5825.41]
  - - [5056, 5056, 1, 1280]
    - [83, 9233.55]
  - - [448, 5056, 1, 256]
    - [75, 7003.17]
  - - [704, 1856, 1, 1280]
    - [74, 8877.28]
  - - [128, 5056, 1, 128]
    - [66, 2301.04]
  - - [2368, 128, 1, 256]
    - [74, 3848.94]
  - - [1856, 1408, 1, 128]
    - [69, 4202.21]
  - - [64, 5056, 1, 256]
    - [75, 3109.52]
  - - [6784, 256, 1, 3328]
    - [74, 6388.43]
  - - [6784, 4288, 1, 3328]
    - [85, 9114.57]
  - - [4288, 448, 1, 256]
    - [78, 5782.95]
  - - [64, 704, 1, 128]
    - [11, 379.419]
  - - [1856, 2368, 1, 3328]
    - [74, 9128.36]
  - - [4288, 2944, 1, 1280]
    - [80, 9182.23]
  - - [704, 5056, 1, 1280]
    - [74, 9071.47]
  - - [2368, 704, 1, 3328]
    - [80, 7731.33]
  - - [256, 5888, 1, 256]
    - [74, 7920.28]
  - - [1856, 4288, 1, 3328]
    - [80, 9329.97]
  - - [256, 2944, 1, 256]
    - [81, 5312.17]
  - - [5888, 1024, 1, 256]
    - [72, 6710.87]
  - - [448, 64, 1, 1280]
    - [47, 2814.43]
  - - [448, 5056, 1, 3328]
    - [74, 8255.43]
  - - [3584, 4, 1, 1280]
    - [23, 640.715]
  - - [2944, 64, 1, 256]
    - [22, 2621.44]
  - - [128, 4, 1, 1280]
    - [94, 86.2316]
  - - [1408, 2944, 1, 256]
    - [74, 8848.89]
  - - [256, 1856, 1, 1280]
    - [74, 7366.45]
  - - [6784, 5056, 1, 3328]
    - [85, 8332.06]
  - - [5056, 5056, 1, 256]
    - [80, 9171.64]
  - - [1408, 6784, 1, 128]
    - [66, 5079.09]
  - - [64, 1024, 1, 1280]
    - [38, 3679.21]
  - - [2944, 4, 1, 256]
    - [29, 369.443]
  - - [704, 5056, 1, 128]
    - [66, 4509.17]
  - - [4, 2368, 1, 1280]
    - [23, 569.744]
  - - [2368, 2944, 1, 1280]
    - [85, 7451.04]
  - - [128, 3584, 1, 1280]
    - [83, 6071.16]
  - - [6784, 6784, 1, 1280]
    - [80, 9535.64]
  - - [1024, 256, 1, 3328]
    - [74, 5742.58]
  - - [1408, 4288, 1, 1280]
    - [83, 8254.99]
  - - [3584, 4288, 1, 1280]
    - [85, 9651.09]
  - - [2368, 704, 1, 1280]
    - [80, 8291.3]
  - - [5056, 4288, 1, 3328]
    - [72, 9406.26]
  - - [3584, 2368, 1, 3328]
    - [80, 9350.22]
  - - [64, 704, 1, 1280]
    - [47, 3384.49]
  - - [4288, 256, 1, 256]
    - [80, 5593.52]
  - - [2944, 128, 1, 128]
    - [2, 2130.5]
  - - [6784, 448, 1, 1280]
    - [83, 8815.75]
  - - [1408, 2944, 1, 128]
    - [66, 4558.24]
  - - [4288, 2944, 1, 256]
    - [85, 7865.33]
  - - [5888, 704, 1, 1280]
    - [74, 9262.89]
  - - [1856, 64, 1, 1280]
    - [48, 4359.05]
  - - [448, 5888, 1, 128]
    - [69, 4000.49]
  - - [5888, 64, 1, 3328]
    - [49, 6603.29]
  - - [2944, 256, 1, 3328]
    - [74, 8423.53]
  - - [1024, 64, 1, 128]
    - [19, 582.542]
  - - [5056, 2368, 1, 1280]
    - [74, 9419.81]
  - - [448, 3584, 1, 1280]
    - [74, 7985.72]
  - - [6784, 5888, 1, 256]
    - [72, 9494.26]
  - - [704, 1024, 1, 128]
    - [66, 2813.25]
  - - [704, 128, 1, 1280]
    - [48, 4477.61]
  - - [5888, 2944, 1, 128]
    - [69, 4745.86]
  - - [4, 3584, 1, 128]
    - [86, 96.379]
  - - [1408, 448, 1, 1280]
    - [74, 6912.7]
  - - [1024, 1408, 1, 256]
    - [82, 5810.75]
  - - [2368, 2368, 1, 3328]
    - [83, 9088.61]
  - - [1856, 6784, 1, 128]
    - [69, 5168.22]
  - - [5056, 704, 1, 3328]
    - [75, 7464.8]
  - - [1408, 1856, 1, 256]
    - [80, 6727.59]
  - - [1408, 704, 1, 3328]
    - [80, 8379.43]
  - - [2368, 5056, 1, 256]
    - [80, 8664.01]
  - - [5888, 1856, 1, 256]
    - [85, 5809.92]
  - - [4288, 64, 1, 3328]
    - [62, 6583.84]
  - - [2368, 4, 1, 1280]
    - [95, 545.151]
  - - [704, 5888, 1, 256]
    - [80, 8813.61]
  - - [4288, 64, 1, 256]
    - [38, 3059.87]
  - - [6784, 64, 1, 256]
    - [80, 3490.86]
  - - [2944, 256, 1, 256]
    - [74, 6970.3]
  - - [2944, 6784, 1, 3328]
    - [74, 9475.69]
  - - [704, 1408, 1, 3328]
    - [74, 8154.08]
  - - [3584, 704, 1, 3328]
    - [74, 8994.97]
  - - [2944, 256, 1, 128]
    - [66, 2824.03]
  - - [6784, 4, 1, 1280]
    - [23, 625.614]
  - - [1024, 64, 1, 1280]
    - [35, 3307.81]
  - - [448, 4288, 1, 256]
    - [80, 6074.38]
  - - [64, 3584, 1, 3328]
    - [28, 6200.16]
  - - [704, 2368, 1, 1280]
    - [74, 8291.3]
  - - [448, 2944, 1, 128]
    - [66, 3221.77]
  - - [1856, 2368, 1, 1280]
    - [85, 6855.14]
  - - [2368, 128, 1, 3328]
    - [36, 6479.51]
  - - [2944, 128, 1, 256]
    - [74, 3828.13]
  - - [448, 1408, 1, 256]
    - [75, 4525.8]
  - - [1856, 4288, 1, 1280]
    - [73, 9160.22]
  - - [64, 5056, 1, 3328]
    - [56, 6819.2]
  - - [4, 704, 1, 256]
    - [40, 123.441]
  - - [1024, 448, 1, 128]
    - [69, 1989.17]
  - - [704, 4, 1, 1280]
    - [43, 381.831]
  - - [704, 256, 1, 128]
    - [66, 1109.07]
  - - [704, 2944, 1, 128]
    - [66, 4088.93]
  - - [1408, 1024, 1, 1280]
    - [80, 8191.98]
  - - [704, 6784, 1, 256]
    - [74, 6717.8]
  - - [6784, 704, 1, 256]
    - [80, 5429.12]
  - - [5056, 1408, 1, 128]
    - [66, 4954.4]
  - - [256, 3584, 1, 3328]
    - [74, 7890.86]
  - - [4, 5888, 1, 3328]
    - [91, 690.947]
  - - [128, 1408, 1, 128]
    - [13, 1393.04]
  - - [3584, 4288, 1, 3328]
    - [76, 8900.77]
  - - [5888, 1856, 1, 1280]
    - [77, 9345.75]
  - - [5056, 1024, 1, 3328]
    - [78, 7834.74]
  - - [5056, 64, 1, 1280]
    - [56, 5890.04]
  - - [1024, 704, 1, 256]
    - [74, 6007.47]
  - - [1024, 4288, 1, 128]
    - [68, 3496.99]
  - - [4288, 64, 1, 1280]
    - [53, 4726.49]
  - - [2368, 3584, 1, 1280]
    - [72, 8128.72]
  - - [2368, 6784, 1, 1280]
    - [72, 9478.62]
  - - [1024, 256, 1, 256]
    - [80, 4092.0]
  - - [1856, 4, 1, 1280]
    - [95, 509.803]
  - - [448, 448, 1, 256]
    - [80, 3001.18]
  - - [2944, 3584, 1, 3328]
    - [81, 9081.81]
  - - [128, 4288, 1, 128]
    - [1, 2323.23]
  - - [64, 448, 1, 256]
    - [44, 1066.87]
  - - [128, 1024, 1, 3328]
    - [57, 6392.26]
  - - [4, 1408, 1, 3328]
    - [40, 616.556]
  - - [6784, 2944, 1, 256]
    - [83, 8547.63]
  - - [64, 1856, 1, 1280]
    - [56, 4409.61]
  - - [64, 1024, 1, 128]
    - [0, 554.802]
  - - [4288, 2368, 1, 3328]
    - [76, 8779.98]
  - - [1856, 2368, 1, 256]
    - [83, 4976.64]
  - - [3584, 256, 1, 128]
    - [68, 2812.27]
  - - [3584, 6784, 1, 3328]
    - [78, 9278.12]
  - - [256, 1024, 1, 256]
    - [74, 4346.43]
  - - [4, 6784, 1, 3328]
    - [93, 681.266]
  - - [1024, 5888, 1, 3328]
    - [74, 9187.51]
  - - [1024, 128, 1, 1280]
    - [26, 3659.95]
  - - [4288, 128, 1, 1280]
    - [80, 6019.07]
  - - [5056, 4288, 1, 1280]
    - [72, 9343.86]
  - - [5888, 64, 1, 256]
    - [74, 4692.07]
  - - [1856, 256, 1, 1280]
    - [80, 4790.28]
  - - [64, 5888, 1, 3328]
    - [48, 6702.1]
  - - [2944, 5888, 1, 128]
    - [69, 5202.55]
  - - [704, 5888, 1, 1280]
    - [74, 9264.19]
  - - [2368, 3584, 1, 128]
    - [66, 5053.61]
  - - [6784, 5888, 1, 3328]
    - [72, 7926.7]
  - - [704, 1024, 1, 1280]
    - [73, 5402.5]
  - - [448, 256, 1, 3328]
    - [56, 6124.55]
  - - [448, 1856, 1, 128]
    - [67, 2885.86]
  - - [128, 1024, 1, 128]
    - [1, 1013.12]
  - - [2944, 4, 1, 128]
    - [86, 77.5374]
  - - [1024, 704, 1, 1280]
    - [74, 7365.48]
  - - [128, 5888, 1, 256]
    - [74, 6990.51]
  - - [1024, 5056, 1, 1280]
    - [79, 9421.9]
  - - [4288, 1024, 1, 256]
    - [81, 6269.93]
  - - [2944, 2368, 1, 128]
    - [66, 4918.08]
  - - [704, 704, 1, 3328]
    - [74, 7963.55]
  - - [704, 1408, 1, 1280]
    - [74, 8347.22]
  - - [5888, 448, 1, 1280]
    - [80, 5216.95]
  - - [3584, 256, 1, 3328]
    - [74, 7802.15]
  - - [704, 5888, 1, 3328]
    - [80, 8381.36]
  - - [704, 1856, 1, 128]
    - [66, 3598.28]
  - - [128, 3584, 1, 3328]
    - [36, 7161.01]
  - - [6784, 2368, 1, 1280]
    - [85, 9464.31]
  - - [4, 4288, 1, 128]
    - [86, 132.58]
  - - [128, 704, 1, 1280]
    - [48, 4463.75]
  - - [3584, 2944, 1, 256]
    - [85, 8201.14]
  - - [1856, 128, 1, 3328]
    - [27, 6575.4]
  - - [4, 64, 1, 1280]
    - [43, 43.5745]
  - - [4, 5056, 1, 3328]
    - [23, 675.215]
  - - [128, 2944, 1, 1280]
    - [27, 5916.89]
  - - [2368, 1024, 1, 3328]
    - [80, 8646.74]
  - - [128, 256, 1, 3328]
    - [61, 4130.75]
  - - [1408, 5056, 1, 3328]
    - [79, 9529.65]
  - - [1856, 1856, 1, 3328]
    - [78, 8114.89]
  - - [3584, 128, 1, 256]
    - [74, 5603.08]
  - - [448, 1408, 1, 3328]
    - [74, 7072.93]
  - - [2368, 2368, 1, 256]
    - [81, 7648.66]
  - - [4288, 4288, 1, 1280]
    - [76, 9244.01]
  - - [64, 448, 1, 1280]
    - [47, 2885.23]
  - - [1408, 4288, 1, 256]
    - [74, 8080.31]
  - - [448, 4, 1, 256]
    - [92, 84.3294]
  - - [5888, 448, 1, 128]
    - [69, 3540.7]
  - - [448, 4, 1, 1280]
    - [43, 322.157]
  - - [704, 6784, 1, 3328]
    - [73, 8613.48]
  - - [5888, 5888, 1, 1280]
    - [80, 9501.95]
  - - [5056, 1024, 1, 1280]
    - [83, 9110.01]
  - - [448, 5888, 1, 3328]
    - [74, 8586.33]
  - - [128, 4, 1, 128]
    - [86, 4.17959]
  - - [1024, 2944, 1, 1280]
    - [82, 7096.43]
  - - [5056, 5888, 1, 1280]
    - [73, 9693.41]
  - - [4288, 5888, 1, 128]
    - [66, 5406.36]
  - - [256, 3584, 1, 256]
    - [74, 6908.27]
  - - [1408, 3584, 1, 128]
    - [66, 4645.59]
  - - [256, 2944, 1, 3328]
    - [77, 6284.3]
  - - [448, 3584, 1, 128]
    - [69, 3675.27]
  - - [5888, 2944, 1, 1280]
    - [79, 9628.8]
  - - [4, 6784, 1, 1280]
    - [23, 688.076]
  - - [2368, 5888, 1, 128]
    - [66, 5273.86]
  - - [64, 2944, 1, 128]
    - [10, 1316.44]
  - - [3584, 5888, 1, 256]
    - [80, 9239.04]
  - - [2368, 704, 1, 128]
    - [69, 3537.55]
  - - [3584, 2944, 1, 1280]
    - [74, 9324.52]
  - - [3584, 2368, 1, 128]
    - [66, 4766.24]
  - - [5056, 704, 1, 128]
    - [66, 4487.85]
  - - [448, 2368, 1, 128]
    - [69, 2876.92]
  - - [5056, 1408, 1, 3328]
    - [85, 9515.87]
  - - [1408, 704, 1, 256]
    - [77, 6836.08]
  - - [6784, 1024, 1, 3328]
    - [72, 9309.55]
  - - [6784, 2944, 1, 3328]
    - [73, 9536.48]
  - - [2944, 5056, 1, 3328]
    - [74, 9526.15]
  - - [1856, 1856, 1, 256]
    - [74, 5239.14]
  - - [1024, 5888, 1, 128]
    - [66, 4006.18]
  - - [2048, 7133, 1, 2048]
    - [72, 9827.97]
  - - [256, 4, 1, 128]
    - [87, 4.28908]
  - - [4288, 5888, 1, 1280]
    - [82, 9202.73]
  - - [4288, 4288, 1, 256]
    - [77, 5521.08]
  - - [448, 2944, 1, 3328]
    - [80, 7724.43]
  - - [4288, 1856, 1, 1280]
    - [80, 8826.24]
  - - [1856, 2944, 1, 3328]
    - [74, 9194.8]
  - - [256, 6784, 1, 3328]
    - [74, 8740.23]
  - - [64, 5888, 1, 256]
    - [74, 4766.25]
  - - [256, 5056, 1, 128]
    - [66, 2937.5]
  - - [5056, 1024, 1, 256]
    - [85, 5467.81]
  - - [704, 64, 1, 3328]
    - [62, 4818.33]
  - - [5056, 1856, 1, 3328]
    - [79, 8861.59]
  - - [4, 2944, 1, 3328]
    - [29, 662.002]
  - - [4, 5056, 1, 256]
    - [89, 494.021]
  - - [1856, 1408, 1, 256]
    - [74, 8674.68]
  - - [3584, 4, 1, 128]
    - [86, 108.196]
  - - [448, 448, 1, 3328]
    - [48, 6457.3]
  - - [6784, 128, 1, 3328]
    - [41, 7256.61]
  - - [4288, 1408, 1, 128]
    - [69, 4791.66]
  - - [4288, 5056, 1, 256]
    - [74, 8560.74]
  - - [1408, 128, 1, 1280]
    - [56, 5085.69]
  - - [5056, 256, 1, 3328]
    - [77, 7284.13]
  - - [704, 704, 1, 256]
    - [74, 6171.09]
  - - [1024, 5888, 1, 1280]
    - [79, 8852.79]
  - - [6784, 2368, 1, 128]
    - [67, 4729.2]
  - - [4, 5056, 1, 1280]
    - [40, 669.946]
  - - [64, 128, 1, 256]
    - [42, 369.217]
  - - [128, 1856, 1, 1280]
    - [36, 5549.03]
  - - [5056, 3584, 1, 256]
    - [80, 7115.74]
  - - [1856, 1024, 1, 1280]
    - [72, 8196.4]
  - - [6784, 4288, 1, 1280]
    - [73, 9509.56]
  - - [1856, 1856, 1, 1280]
    - [75, 5791.89]
  - - [6784, 2944, 1, 128]
    - [66, 5317.02]
  - - [1408, 5056, 1, 1280]
    - [75, 8980.63]
  - - [4, 2368, 1, 3328]
    - [40, 592.534]
  - - [5888, 1856, 1, 128]
    - [65, 4600.1]
  - - [448, 704, 1, 1280]
    - [74, 2286.48]
  - - [2368, 1024, 1, 128]
    - [69, 3911.02]
  - - [1024, 448, 1, 3328]
    - [74, 7295.14]
  - - [1856, 704, 1, 1280]
    - [74, 8881.02]
  - - [5056, 3584, 1, 128]
    - [66, 4911.58]
  - - [5888, 5888, 1, 3328]
    - [82, 9243.8]
  - - [6784, 1024, 1, 256]
    - [85, 5475.31]
  - - [2944, 2368, 1, 256]
    - [80, 5670.67]
  - - [256, 448, 1, 256]
    - [31, 2293.76]
  - - [5056, 5888, 1, 3328]
    - [75, 7847.97]
  - - [1856, 1024, 1, 256]
    - [80, 7517.6]
  - - [448, 1408, 1, 1280]
    - [74, 6917.44]
  - - [3584, 448, 1, 1280]
    - [80, 7980.76]
  - - [1024, 1024, 1, 1280]
    - [77, 8384.42]
  - - [448, 5888, 1, 256]
    - [74, 7365.65]
  - - [704, 64, 1, 128]
    - [19, 358.655]
  - - [1408, 6784, 1, 3328]
    - [80, 9094.09]
  - - [448, 1024, 1, 128]
    - [69, 1772.95]
  - - [4288, 704, 1, 128]
    - [66, 4355.28]
  - - [128, 1856, 1, 128]
    - [5, 1610.63]
  - - [448, 2368, 1, 3328]
    - [80, 7366.37]
  - - [5056, 64, 1, 128]
    - [5, 2157.23]
  - - [5056, 2944, 1, 256]
    - [74, 9123.06]
  - - [6784, 5888, 1, 128]
    - [65, 5285.8]
  - - [704, 1024, 1, 256]
    - [80, 6667.25]
  - - [1024, 4, 1, 256]
    - [29, 187.246]
  - - [2368, 1856, 1, 256]
    - [80, 6777.84]
  - - [128, 6784, 1, 1280]
    - [77, 7052.61]
  - - [1408, 3584, 1, 3328]
    - [81, 9037.95]
  - - [2368, 6784, 1, 256]
    - [74, 9181.35]
  - - [5056, 1408, 1, 1280]
    - [79, 9421.9]
  - - [256, 256, 1, 128]
    - [11, 543.304]
  - - [5056, 4288, 1, 128]
    - [69, 5339.92]
  - - [1408, 1856, 1, 128]
    - [66, 4270.89]
  - - [1408, 5888, 1, 3328]
    - [78, 9034.79]
  - - [1856, 256, 1, 256]
    - [80, 5847.83]
  - - [6784, 6784, 1, 256]
    - [73, 9624.38]
  - - [64, 256, 1, 128]
    - [12, 146.449]
  - - [4288, 2368, 1, 128]
    - [65, 3896.94]
  - - [1856, 4288, 1, 128]
    - [66, 4337.07]
  - - [256, 4288, 1, 1280]
    - [74, 7499.42]
  - - [2368, 2944, 1, 256]
    - [79, 7703.18]
  - - [4, 1856, 1, 256]
    - [92, 263.964]
  - - [3584, 1856, 1, 1280]
    - [74, 9224.33]
  - - [6784, 6784, 1, 128]
    - [66, 5476.03]
  - - [256, 1856, 1, 128]
    - [69, 1858.72]
  - - [704, 64, 1, 1280]
    - [47, 3368.67]
  - - [5888, 5056, 1, 256]
    - [80, 5859.81]
  - - [3584, 448, 1, 256]
    - [80, 7298.33]
  - - [448, 4288, 1, 128]
    - [66, 3813.45]
  - - [2944, 4288, 1, 3328]
    - [75, 9149.63]
  - - [256, 6784, 1, 256]
    - [74, 7984.85]
  - - [1408, 4288, 1, 128]
    - [69, 4728.34]
  - - [2944, 704, 1, 3328]
    - [80, 7149.76]
  - - [128, 448, 1, 256]
    - [46, 1699.08]
  - - [512, 32, 1, 512]
    - [46, 1127.5]
  - - [3584, 3584, 1, 256]
    - [75, 8558.01]
  - - [448, 1408, 1, 128]
    - [66, 2504.35]
  - - [128, 256, 1, 1280]
    - [47, 3216.49]
  - - [3584, 5056, 1, 256]
    - [72, 5674.35]
  - - [6784, 128, 1, 256]
    - [74, 6216.39]
  - - [4288, 4, 1, 256]
    - [90, 435.606]
  - - [64, 1408, 1, 3328]
    - [48, 6185.91]
  - - [704, 448, 1, 256]
    - [80, 4004.98]
  - - [2944, 2368, 1, 1280]
    - [81, 8542.7]
  - - [448, 64, 1, 3328]
    - [61, 3835.23]
  - - [1408, 3584, 1, 256]
    - [74, 8714.53]
  - - [3584, 4, 1, 3328]
    - [29, 689.454]
  - - [6784, 3584, 1, 256]
    - [79, 9271.24]
  - - [256, 128, 1, 128]
    - [12, 283.399]
  - - [704, 1408, 1, 128]
    - [66, 3210.47]
  - - [4, 2368, 1, 256]
    - [92, 360.838]
  - - [2944, 448, 1, 128]
    - [66, 3344.31]
  - - [128, 1408, 1, 256]
    - [74, 3186.28]
  - - [4, 2944, 1, 256]
    - [90, 384.522]
  - - [64, 128, 1, 3328]
    - [43, 2103.62]
  - - [5056, 2368, 1, 128]
    - [66, 5219.66]
  - - [2944, 2944, 1, 3328]
    - [83, 9174.59]
  - - [5056, 6784, 1, 256]
    - [85, 8992.26]
  - - [1856, 3584, 1, 128]
    - [66, 4957.17]
  - - [128, 2944, 1, 128]
    - [4, 2241.38]
  - - [1024, 704, 1, 3328]
    - [84, 6545.01]
  - - [6784, 448, 1, 256]
    - [80, 5379.15]
  - - [3584, 6784, 1, 128]
    - [66, 5101.91]
  - - [128, 4288, 1, 256]
    - [74, 5211.76]
  - - [704, 448, 1, 3328]
    - [75, 4504.05]
  - - [1024, 1024, 1, 3328]
    - [77, 8009.67]
  - - [128, 128, 1, 3328]
    - [60, 3184.93]
  - - [5056, 1856, 1, 256]
    - [74, 9138.33]
  - - [256, 128, 1, 256]
    - [46, 1205.26]
  - - [1024, 1856, 1, 256]
    - [85, 6374.99]
  - - [4288, 64, 1, 128]
    - [2, 1695.33]
  - - [256, 448, 1, 3328]
    - [49, 5659.57]
  - - [1408, 6784, 1, 1280]
    - [74, 9349.1]
  - - [3584, 3584, 1, 1280]
    - [79, 9302.09]
  - - [64, 2368, 1, 1280]
    - [48, 4432.97]
  - - [448, 2368, 1, 1280]
    - [74, 7250.67]
  - - [5888, 5888, 1, 128]
    - [66, 4615.93]
  - - [64, 6784, 1, 3328]
    - [80, 6987.13]
  - - [2944, 256, 1, 1280]
    - [83, 6127.35]
  - - [5056, 5888, 1, 128]
    - [65, 5106.29]
  - - [256, 2368, 1, 128]
    - [66, 2141.13]
  - - [5056, 2368, 1, 3328]
    - [77, 9041.65]
  - - [2944, 4288, 1, 256]
    - [85, 8691.12]
  - - [1408, 3584, 1, 1280]
    - [74, 9069.9]
  - - [2368, 64, 1, 256]
    - [46, 2412.77]
  - - [64, 448, 1, 3328]
    - [61, 3739.04]
  - - [256, 256, 1, 3328]
    - [48, 5304.08]
  - - [5888, 4, 1, 128]
    - [87, 105.555]
  - - [1856, 704, 1, 256]
    - [74, 8025.33]
  - - [4, 4288, 1, 1280]
    - [21, 578.97]
  - - [1408, 448, 1, 3328]
    - [82, 5714.41]
  - - [1024, 4, 1, 3328]
    - [40, 608.549]
  - - [2368, 256, 1, 256]
    - [80, 5172.98]
  - - [2368, 6784, 1, 3328]
    - [80, 9456.51]
  - - [1856, 1408, 1, 1280]
    - [85, 7805.09]
  - - [1856, 448, 1, 1280]
    - [72, 6184.94]
  - - [6784, 704, 1, 128]
    - [66, 4597.77]
  - - [4, 4, 1, 256]
    - [43, 0.691892]
  - - [128, 5888, 1, 128]
    - [4, 2691.66]
  - - [1408, 5888, 1, 256]
    - [79, 7164.17]
  - - [704, 2944, 1, 1280]
    - [81, 8139.71]
  - - [1856, 2368, 1, 128]
    - [69, 4623.28]
  - - [4096, 7133, 1, 4096]
    - [73, 9939.97]
  - - [256, 64, 1, 256]
    - [37, 689.853]
  - - [1024, 1024, 1, 256]
    - [80, 7216.01]
  - - [704, 1856, 1, 256]
    - [80, 6364.07]
  - - [128, 4288, 1, 3328]
    - [36, 7200.49]
  - - [3584, 704, 1, 1280]
    - [83, 7971.98]
  - - [256, 128, 1, 1280]
    - [34, 2702.52]
  - - [2368, 4, 1, 256]
    - [29, 325.918]
  - - [256, 2368, 1, 1280]
    - [74, 6638.83]
  - - [2944, 6784, 1, 128]
    - [65, 5233.43]
  - - [3584, 448, 1, 3328]
    - [74, 8094.3]
  - - [1408, 4, 1, 256]
    - [92, 243.546]
  - - [704, 2368, 1, 3328]
    - [74, 8403.01]
  - - [2944, 448, 1, 256]
    - [74, 7022.49]
  - - [1856, 448, 1, 128]
    - [69, 2842.69]
  - - [2368, 128, 1, 1280]
    - [56, 5685.42]
  - - [256, 5888, 1, 128]
    - [71, 2178.61]
  - - [64, 6784, 1, 256]
    - [74, 5385.13]
  - - [64, 5056, 1, 1280]
    - [48, 5603.19]
  - - [4, 6784, 1, 128]
    - [86, 180.156]
  - - [2944, 2944, 1, 1280]
    - [83, 9129.29]
  - - [5888, 2368, 1, 256]
    - [85, 6961.59]
  - - [4, 3584, 1, 1280]
    - [29, 646.13]
  - - [1408, 128, 1, 128]
    - [15, 1172.19]
  - - [6784, 704, 1, 3328]
    - [80, 9084.52]
  - - [128, 64, 1, 1280]
    - [59, 1260.31]
  - - [2368, 256, 1, 1280]
    - [80, 6643.38]
  - - [4, 448, 1, 3328]
    - [43, 433.414]
  - - [5888, 4288, 1, 128]
    - [67, 4753.07]
  - - [4, 5888, 1, 256]
    - [29, 471.04]
  - - [1408, 2944, 1, 3328]
    - [83, 9207.0]
  - - [3584, 704, 1, 128]
    - [69, 3762.36]
  - - [64, 1024, 1, 256]
    - [47, 1807.89]
  - - [5056, 5056, 1, 128]
    - [70, 4830.06]
  - - [2368, 448, 1, 1280]
    - [74, 7263.06]
  - - [128, 3584, 1, 256]
    - [77, 4369.07]
  - - [704, 448, 1, 1280]
    - [75, 4205.23]
  - - [448, 5056, 1, 128]
    - [66, 3855.47]
  - - [256, 4, 1, 1280]
    - [97, 157.538]
  - - [128, 5056, 1, 256]
    - [80, 6108.96]
  - - [1408, 5056, 1, 128]
    - [69, 4836.58]
  - - [2944, 3584, 1, 128]
    - [69, 4532.09]
  - - [3584, 2368, 1, 256]
    - [74, 8951.24]
  - - [5888, 5056, 1, 1280]
    - [85, 9276.39]
  - - [2368, 5056, 1, 128]
    - [69, 5167.56]
  - - [64, 704, 1, 256]
    - [29, 1501.87]
  - - [4288, 256, 1, 1280]
    - [74, 7496.2]
  - - [3584, 3584, 1, 3328]
    - [75, 9301.67]
  - - [1024, 256, 1, 128]
    - [66, 1508.74]
  - - [4, 704, 1, 128]
    - [87, 12.0469]
  - - [5888, 6784, 1, 256]
    - [73, 9370.37]
  - - [4288, 2944, 1, 3328]
    - [77, 9148.99]
  - - [2944, 64, 1, 128]
    - [13, 1456.36]
  - - [1856, 64, 1, 256]
    - [39, 2209.93]
  - - [4288, 128, 1, 3328]
    - [33, 6471.85]
  - - [4288, 704, 1, 1280]
    - [80, 8934.51]
  - - [256, 5056, 1, 1280]
    - [74, 8439.03]
  - - [1408, 256, 1, 128]
    - [69, 1769.07]
  - - [2944, 5888, 1, 3328]
    - [74, 9447.94]
  - - [6784, 5888, 1, 1280]
    - [85, 9372.15]
  - - [704, 128, 1, 256]
    - [31, 2059.7]
  - - [5888, 4288, 1, 1280]
    - [77, 9244.22]
  - - [448, 256, 1, 1280]
    - [56, 4741.62]
  - - [5888, 3584, 1, 128]
    - [65, 4979.96]
  - - [1856, 1856, 1, 128]
    - [69, 4363.88]
  - - [5056, 4, 1, 1280]
    - [89, 629.541]
  - - [256, 1408, 1, 1280]
    - [80, 5588.34]
  - - [512, 16, 1, 512]
    - [40, 689.853]
  - - [704, 3584, 1, 128]
    - [69, 4069.57]
  - - [5888, 448, 1, 3328]
    - [85, 7925.84]
  - - [2368, 4288, 1, 1280]
    - [84, 8492.6]
  - - [4288, 2944, 1, 128]
    - [66, 5238.11]
  - - [1024, 6784, 1, 3328]
    - [80, 8578.08]
  - - [128, 2368, 1, 256]
    - [80, 3788.8]
  - - [6784, 64, 1, 3328]
    - [74, 7003.36]
  - - [5056, 2944, 1, 3328]
    - [77, 8575.35]
  - - [448, 128, 1, 256]
    - [29, 1714.96]
  - - [2944, 3584, 1, 256]
    - [74, 8994.16]
  - - [1408, 1408, 1, 3328]
    - [72, 8757.6]
  - - [1856, 128, 1, 1280]
    - [74, 5598.07]
  - - [3584, 3584, 1, 128]
    - [65, 4787.34]
  - - [64, 3584, 1, 256]
    - [80, 3545.91]
  - - [1408, 4, 1, 3328]
    - [24, 640.14]
  - - [128, 2944, 1, 3328]
    - [48, 7204.14]
  - - [3584, 704, 1, 256]
    - [74, 6239.59]
  - - [2944, 448, 1, 3328]
    - [80, 7726.61]
  - - [3584, 1408, 1, 3328]
    - [72, 9358.68]
  - - [704, 3584, 1, 1280]
    - [80, 8005.18]
  - - [2944, 6784, 1, 1280]
    - [72, 9487.63]
  - - [1856, 6784, 1, 256]
    - [74, 5684.46]
  - - [4288, 448, 1, 3328]
    - [80, 8410.28]
  - - [6784, 4288, 1, 128]
    - [70, 4785.48]
  - - [6784, 704, 1, 1280]
    - [74, 5578.95]
  - - [256, 4288, 1, 256]
    - [74, 6781.33]
  - - [3584, 64, 1, 128]
    - [13, 1473.9]
  - - [5888, 1024, 1, 3328]
    - [72, 8639.39]
  - - [448, 64, 1, 128]
    - [4, 259.182]
  - - [704, 6784, 1, 1280]
    - [80, 9027.15]
  - - [5888, 128, 1, 256]
    - [80, 6812.78]
  - - [2368, 448, 1, 3328]
    - [80, 7356.53]
  - - [1856, 5056, 1, 3328]
    - [79, 8871.46]
  - - [4, 6784, 1, 256]
    - [88, 469.379]
  - - [1024, 3584, 1, 128]
    - [66, 3427.92]
  - - [1024, 1408, 1, 128]
    - [69, 2934.95]
  - - [2368, 2944, 1, 128]
    - [69, 4887.92]
  - - [5056, 64, 1, 256]
    - [38, 3186.06]
  - - [4, 448, 1, 1280]
    - [43, 273.067]
  - - [5056, 2944, 1, 128]
    - [70, 4752.69]
  - - [5888, 5056, 1, 3328]
    - [84, 9124.67]
  - - [1024, 704, 1, 128]
    - [69, 2302.26]
  - - [1408, 2368, 1, 128]
    - [69, 3826.85]
  - - [5888, 2368, 1, 128]
    - [66, 4912.67]
  - - [128, 5056, 1, 3328]
    - [56, 7583.7]
  - - [3584, 6784, 1, 1280]
    - [83, 9313.4]
  - - [3072, 7435, 1, 1024]
    - [77, 9321.97]
  - - [1856, 5888, 1, 256]
    - [74, 5778.24]
  - - [256, 256, 1, 256]
    - [26, 1576.81]
  - - [256, 64, 1, 128]
    - [12, 173.605]
  - - [4288, 4288, 1, 3328]
    - [79, 8416.17]
  - - [4288, 1408, 1, 1280]
    - [85, 9301.87]
  - - [3584, 5056, 1, 128]
    - [71, 4344.84]
  - - [4, 1024, 1, 3328]
    - [40, 615.139]
  - - [4288, 2368, 1, 256]
    - [74, 9142.57]
  - - [2944, 5056, 1, 1280]
    - [74, 9399.59]
  - - [448, 6784, 1, 256]
    - [73, 5710.83]
  - - [64, 1024, 1, 3328]
    - [56, 4975.0]
  - - [6784, 2368, 1, 3328]
    - [83, 9207.53]
  - - [256, 1024, 1, 1280]
    - [80, 5983.32]
  - - [704, 4, 1, 128]
    - [86, 15.0187]
  - - [256, 4, 1, 256]
    - [43, 52.8516]
  - - [4288, 128, 1, 256]
    - [74, 5242.88]
  - - [4288, 1856, 1, 3328]
    - [85, 9353.96]
  - - [3584, 448, 1, 128]
    - [66, 3353.8]
  - - [256, 4, 1, 3328]
    - [97, 313.224]
  - - [4, 1408, 1, 1280]
    - [40, 509.107]
  - - [3584, 64, 1, 1280]
    - [28, 5198.32]
  - - [1408, 448, 1, 128]
    - [66, 2628.27]
  - - [3584, 1024, 1, 1280]
    - [80, 8534.91]
  - - [1856, 5056, 1, 256]
    - [72, 8184.39]
  - - [4, 3584, 1, 256]
    - [90, 395.476]
  - - [1024, 4288, 1, 256]
    - [75, 5966.42]
  - - [5888, 3584, 1, 3328]
    - [78, 9189.33]
  - - [4, 256, 1, 256]
    - [94, 41.4785]
  - - [5056, 3584, 1, 3328]
    - [79, 9431.82]
  - - [128, 5888, 1, 1280]
    - [74, 8192.0]
  - - [704, 448, 1, 128]
    - [66, 1510.86]
  - - [2368, 1408, 1, 1280]
    - [74, 8415.55]
  - - [5056, 2944, 1, 1280]
    - [85, 9294.67]
  - - [4, 4, 1, 128]
    - [87, 0.0356549]
  - - [3584, 256, 1, 256]
    - [74, 6749.45]
  - - [128, 1856, 1, 3328]
    - [27, 6796.99]
  - - [1024, 6784, 1, 256]
    - [80, 8782.99]
  - - [4, 128, 1, 256]
    - [40, 27.3067]
  - - [64, 64, 1, 1280]
    - [59, 712.348]
  - - [6784, 4, 1, 128]
    - [87, 121.96]
  - - [2944, 1408, 1, 128]
    - [69, 4430.36]
  - - [448, 128, 1, 3328]
    - [56, 5097.24]
  - - [64, 2944, 1, 3328]
    - [56, 6362.1]
  - - [64, 4288, 1, 3328]
    - [56, 6564.91]
  - - [5056, 6784, 1, 3328]
    - [80, 8121.08]
  - - [128, 2944, 1, 256]
    - [74, 4692.07]
  - - [128, 6784, 1, 128]
    - [3, 2687.36]
  - - [3584, 4288, 1, 256]
    - [80, 9193.89]
  - - [448, 1856, 1, 256]
    - [80, 6231.29]
  - - [1856, 6784, 1, 3328]
    - [85, 9191.38]
  - - [3584, 128, 1, 3328]
    - [74, 7368.37]
  - - [64, 1856, 1, 256]
    - [25, 2184.53]
  - - [1024, 448, 1, 1280]
    - [80, 6977.22]
  - - [5888, 4288, 1, 256]
    - [80, 5780.4]
  - - [4, 448, 1, 128]
    - [87, 8.96]
  - - [5056, 1408, 1, 256]
    - [74, 5601.25]
  - - [64, 256, 1, 1280]
    - [40, 1927.53]
  - - [3584, 1024, 1, 256]
    - [85, 7542.74]
  - - [256, 704, 1, 256]
    - [74, 2957.52]
  - - [5888, 5888, 1, 256]
    - [85, 7344.04]
  - - [4288, 1024, 1, 1280]
    - [80, 8925.74]
  - - [5888, 128, 1, 3328]
    - [74, 8409.97]
  - - [448, 6784, 1, 3328]
    - [74, 8862.46]
  - - [2944, 1408, 1, 1280]
    - [85, 7478.83]
  - - [1024, 32, 1, 512]
    - [29, 1777.25]
  - - [2944, 1856, 1, 3328]
    - [74, 9153.33]
  - - [2368, 64, 1, 128]
    - [13, 1102.2]
  - - [2944, 2944, 1, 128]
    - [65, 4591.85]
  - - [4, 128, 1, 3328]
    - [95, 118.99]
  - - [3584, 5888, 1, 1280]
    - [74, 9222.39]
  - - [64, 4, 1, 128]
    - [86, 0.93516]
  - - [6784, 1856, 1, 1280]
    - [74, 9135.97]
  - - [2944, 5056, 1, 256]
    - [80, 8860.03]
  - - [2944, 5888, 1, 1280]
    - [73, 9643.53]
  - - [5888, 256, 1, 3328]
    - [80, 8799.43]
  - - [1856, 5888, 1, 3328]
    - [80, 9457.43]
  - - [3584, 1408, 1, 256]
    - [80, 8672.43]
  - - [704, 3584, 1, 3328]
    - [80, 8525.2]
  - - [5056, 448, 1, 1280]
    - [80, 8843.67]
  - - [3584, 1856, 1, 3328]
    - [72, 8881.43]
  - - [64, 1408, 1, 128]
    - [1, 747.042]
  - - [1408, 704, 1, 1280]
    - [74, 8342.83]
  - - [2944, 1024, 1, 256]
    - [85, 8079.48]
  - - [1024, 2368, 1, 128]
    - [69, 3347.48]
  - - [2368, 4288, 1, 3328]
    - [80, 9467.57]
  - - [4, 1408, 1, 256]
    - [92, 257.463]
  - - [1024, 1408, 1, 1280]
    - [80, 8241.74]
  - - [64, 64, 1, 256]
    - [40, 189.959]
  - - [704, 256, 1, 3328]
    - [74, 4519.18]
  - - [6784, 5056, 1, 256]
    - [73, 9133.68]
  - - [4, 4288, 1, 3328]
    - [24, 669.975]
  - - [448, 6784, 1, 128]
    - [66, 4481.82]
  - - [4, 704, 1, 3328]
    - [96, 522.971]
  - - [448, 2944, 1, 256]
    - [74, 7022.49]
  - - [2944, 6784, 1, 256]
    - [80, 9199.74]
  - - [2368, 2368, 1, 1280]
    - [85, 8646.74]
  - - [4, 4, 1, 1280]
    - [43, 3.01176]
  - - [1856, 3584, 1, 1280]
    - [72, 8805.35]
  - - [64, 2944, 1, 256]
    - [46, 2565.66]
  - - [3584, 1408, 1, 1280]
    - [85, 9273.02]
  - - [448, 256, 1, 128]
    - [1, 941.03]
  - - [4288, 448, 1, 128]
    - [67, 3215.1]
  - - [5056, 256, 1, 1280]
    - [80, 8790.03]
  - - [1856, 1408, 1, 3328]
    - [74, 9310.63]
  - - [128, 128, 1, 128]
    - [9, 155.115]
  - - [1024, 4288, 1, 3328]
    - [77, 8528.02]
  - - [448, 2368, 1, 256]
    - [81, 5097.24]
  - - [1024, 4, 1, 128]
    - [87, 10.2721]
  - - [5056, 448, 1, 256]
    - [80, 8236.68]
  - - [2944, 2368, 1, 3328]
    - [73, 9331.06]
  - - [704, 128, 1, 3328]
    - [48, 5969.2]
  - - [64, 64, 1, 3328]
    - [64, 1494.68]
  - - [1024, 1856, 1, 1280]
    - [79, 6356.33]
  - - [6784, 1856, 1, 256]
    - [80, 9068.53]
  - - [128, 2368, 1, 3328]
    - [56, 6714.12]
  - - [1024, 5888, 1, 256]
    - [80, 5501.5]
  - - [5056, 128, 1, 1280]
    - [36, 6455.54]
  - - [5056, 64, 1, 3328]
    - [41, 6703.71]
  - - [128, 704, 1, 128]
    - [2, 696.518]
  - - [1408, 2368, 1, 256]
    - [74, 8667.15]
  - - [1408, 1408, 1, 256]
    - [85, 7615.71]
  - - [4, 64, 1, 128]
    - [87, 0.98463]
  - - [64, 128, 1, 1280]
    - [59, 1379.71]
  - - [2368, 2368, 1, 128]
    - [69, 4582.16]
  - - [64, 5888, 1, 128]
    - [2, 2086.27]
  - - [5888, 4, 1, 3328]
    - [23, 667.414]
  - - [6784, 1408, 1, 128]
    - [70, 4516.24]
  - - [4288, 5888, 1, 256]
    - [85, 8497.33]
  - - [1408, 5056, 1, 256]
    - [74, 8867.36]
  - - [5056, 128, 1, 3328]
    - [56, 7678.88]
  - - [128, 128, 1, 1280]
    - [44, 2016.49]
  - - [448, 704, 1, 256]
    - [75, 3030.79]
  - - [4288, 3584, 1, 128]
    - [66, 5246.23]
  - - [2944, 128, 1, 3328]
    - [41, 6795.06]
  - - [128, 5056, 1, 1280]
    - [27, 6192.99]
  - - [3584, 5056, 1, 1280]
    - [79, 9499.07]
  - - [256, 448, 1, 1280]
    - [35, 4267.46]
  - - [704, 704, 1, 128]
    - [69, 2259.22]
  - - [5056, 4, 1, 128]
    - [87, 12.4313]
  - - [704, 256, 1, 1280]
    - [74, 4355.87]
  - - [64, 2368, 1, 3328]
    - [48, 6310.87]
  - - [1856, 1024, 1, 128]
    - [65, 4065.33]
  - - [1856, 64, 1, 128]
    - [4, 936.229]
  - - [64, 6784, 1, 1280]
    - [27, 5731.7]
  - - [704, 4288, 1, 256]
    - [80, 5218.8]
  - - [5888, 2368, 1, 1280]
    - [74, 9378.8]
  - - [128, 256, 1, 256]
    - [44, 1219.27]
  - - [256, 64, 1, 1280]
    - [46, 1820.44]
  - - [2368, 5888, 1, 1280]
    - [85, 9143.54]
  - - [5888, 256, 1, 1280]
    - [74, 8678.37]
  - - [4, 5888, 1, 1280]
    - [21, 668.142]
  - - [704, 128, 1, 128]
    - [9, 649.456]
  - - [1024, 4, 1, 1280]
    - [40, 478.365]
  - - [2368, 1856, 1, 3328]
    - [72, 8153.77]
  - - [2368, 128, 1, 128]
    - [7, 1858.11]
  - - [2944, 704, 1, 256]
    - [74, 8437.97]
  - - [5056, 128, 1, 128]
    - [3, 2689.53]
  - - [256, 704, 1, 3328]
    - [74, 4541.08]
  - - [704, 3584, 1, 256]
    - [75, 7770.97]
  - - [1024, 1024, 1, 1024]
    - [80, 8305.52]
  - - [704, 2944, 1, 3328]
    - [80, 9166.38]
  - - [6784, 1024, 1, 128]
    - [65, 4362.21]
  - - [256, 448, 1, 128]
    - [12, 899.514]
  - - [448, 1024, 1, 3328]
    - [74, 7385.46]
  - - [2944, 1024, 1, 3328]
    - [77, 8779.71]
  - - [2944, 5056, 1, 128]
    - [69, 5103.01]
  - - [1408, 6784, 1, 256]
    - [80, 8346.79]
  - - [6784, 1408, 1, 3328]
    - [76, 8878.3]
  - - [4288, 6784, 1, 128]
    - [65, 5432.89]
  - - [704, 64, 1, 256]
    - [54, 1441.79]
  - - [5888, 4, 1, 1280]
    - [91, 636.541]
  - - [256, 2368, 1, 3328]
    - [74, 6804.7]
  - - [6784, 2944, 1, 1280]
    - [73, 9472.16]
  - - [4288, 1856, 1, 128]
    - [69, 4886.28]
  - - [1856, 2944, 1, 128]
    - [66, 4642.86]
  - - [6784, 448, 1, 128]
    - [66, 4369.07]
  - - [64, 3584, 1, 128]
    - [13, 1645.75]
  - - [448, 5056, 1, 1280]
    - [74, 8553.54]
  - - [2368, 1856, 1, 128]
    - [66, 4741.75]
  - - [128, 448, 1, 1280]
    - [56, 3744.91]
  - - [4288, 704, 1, 256]
    - [74, 8444.06]
  - - [256, 3584, 1, 128]
    - [66, 2454.86]
  - - [5888, 704, 1, 256]
    - [74, 8819.47]
  - - [3584, 1024, 1, 128]
    - [69, 4094.86]
  - - [256, 5888, 1, 3328]
    - [83, 8538.23]
  - - [1408, 4288, 1, 3328]
    - [85, 9212.47]
  - - [6784, 4288, 1, 256]
    - [73, 9163.02]
  - - [4288, 256, 1, 128]
    - [66, 3081.34]
  - - [5888, 256, 1, 256]
    - [74, 7680.65]
  - - [6784, 1024, 1, 1280]
    - [85, 9248.53]
  - - [5888, 1024, 1, 128]
    - [69, 4061.84]
  - - [1024, 128, 1, 256]
    - [80, 2317.29]
  - - [128, 64, 1, 3328]
    - [63, 2116.69]
  - - [448, 64, 1, 256]
    - [46, 1079.42]
  - - [2368, 256, 1, 128]
    - [67, 2229.73]
  - - [6784, 3584, 1, 1280]
    - [80, 9096.5]
  - - [1024, 6784, 1, 1280]
    - [78, 9112.8]
  - - [2944, 64, 1, 1280]
    - [36, 4982.9]
  - - [1408, 2944, 1, 1280]
    - [75, 9131.53]
  - - [256, 1856, 1, 256]
    - [83, 4432.76]
  - - [1408, 2368, 1, 3328]
    - [83, 8449.08]
  - - [2944, 4, 1, 3328]
    - [29, 673.84]
  - - [128, 1408, 1, 3328]
    - [48, 6582.37]
  - - [2944, 1856, 1, 128]
    - [66, 4827.44]
  - - [256, 2944, 1, 128]
    - [69, 2416.56]
  - - [256, 6784, 1, 128]
    - [69, 3118.66]
  - - [2368, 4, 1, 128]
    - [87, 22.6197]
  - - [1408, 256, 1, 3328]
    - [74, 3733.72]
  - - [1856, 4, 1, 128]
    - [86, 7.10009]
  - - [1024, 16, 1, 512]
    - [42, 1165.08]
  - - [5056, 6784, 1, 128]
    - [70, 4949.03]
  - - [4288, 5056, 1, 128]
    - [69, 4966.8]
  - - [1856, 5888, 1, 128]
    - [65, 4351.66]
  - - [2944, 5888, 1, 256]
    - [85, 8460.89]
  - - [3584, 1856, 1, 256]
    - [80, 8876.6]
  - - [4288, 3584, 1, 1280]
    - [73, 9603.6]
  - - [2368, 448, 1, 256]
    - [74, 6604.6]
  - - [4288, 256, 1, 3328]
    - [74, 7619.79]
  - - [1856, 704, 1, 128]
    - [66, 3629.51]
  - - [1408, 64, 1, 256]
    - [30, 2168.11]
  - - [64, 1856, 1, 128]
    - [6, 979.662]
  - - [4, 256, 1, 128]
    - [87, 5.13595]
  - - [704, 4288, 1, 3328]
    - [80, 9014.42]
  - - [704, 5888, 1, 128]
    - [67, 4221.67]
  - - [6784, 3584, 1, 128]
    - [65, 5360.63]
  - - [1024, 64, 1, 256]
    - [25, 1588.75]
  - - [64, 2368, 1, 256]
    - [80, 2552.45]
  - - [4288, 5056, 1, 3328]
    - [79, 8193.28]
  - - [4, 1856, 1, 1280]
    - [29, 499.092]
  - - [4288, 128, 1, 128]
    - [66, 2373.47]
  - - [1408, 1408, 1, 128]
    - [69, 3753.78]
  - - [1024, 128, 1, 3328]
    - [51, 5656.22]
  - - [1856, 128, 1, 128]
    - [2, 1617.48]
  - - [5056, 2368, 1, 256]
    - [85, 5553.31]
  - - [4288, 704, 1, 3328]
    - [73, 6961.96]
  - - [448, 3584, 1, 256]
    - [83, 5981.4]
  - - [64, 128, 1, 128]
    - [20, 74.8983]
  - - [2368, 64, 1, 1280]
    - [56, 5041.23]
  - - [2368, 1024, 1, 1280]
    - [81, 7740.87]
  - - [2944, 1408, 1, 3328]
    - [83, 9204.55]
  - - [1408, 448, 1, 256]
    - [80, 5954.3]
  - - [1024, 1408, 1, 3328]
    - [77, 8161.44]
  - - [2560, 7133, 1, 2560]
    - [72, 9636.59]
  - - [1408, 4, 1, 1280]
    - [24, 520.879]
  - - [5888, 3584, 1, 256]
    - [85, 9225.16]
  - - [128, 1024, 1, 1280]
    - [27, 4755.45]
  - - [1408, 1856, 1, 3328]
    - [77, 9130.77]
  - - [4, 4, 1, 3328]
    - [97, 6.93333]
  - - [6784, 1408, 1, 1280]
    - [74, 9346.81]
  - - [4, 1024, 1, 1280]
    - [24, 422.813]
  - - [704, 2944, 1, 256]
    - [80, 8331.96]
  - - [704, 4288, 1, 128]
    - [66, 4371.04]
  - - [2368, 4288, 1, 128]
    - [66, 3988.79]
  - - [64, 4288, 1, 1280]
    - [56, 5407.53]
  - - [6784, 64, 1, 1280]
    - [36, 5708.15]
  - - [3584, 128, 1, 128]
    - [2, 2463.1]
  - - [1024, 6784, 1, 128]
    - [67, 3862.02]
  - - [4, 1856, 1, 128]
    - [87, 30.5362]
  - - [1408, 64, 1, 3328]
    - [56, 6095.38]
  - - [6784, 4, 1, 256]
    - [89, 487.838]
  - - [1408, 1408, 1, 1280]
    - [85, 8640.53]
  - - [256, 2368, 1, 256]
    - [77, 4282.26]
  - - [448, 4288, 1, 3328]
    - [74, 8516.03]
  - - [2368, 1408, 1, 256]
    - [80, 8632.09]
  - - [5888, 5056, 1, 128]
    - [66, 5091.01]
  - - [704, 2368, 1, 256]
    - [80, 7664.7]
  - - [2944, 448, 1, 1280]
    - [80, 7618.25]
  - - [5888, 2368, 1, 3328]
    - [83, 9343.38]
  - - [64, 2944, 1, 1280]
    - [48, 5162.08]
  - - [448, 1856, 1, 1280]
    - [74, 7027.9]
  - - [4288, 448, 1, 1280]
    - [74, 5855.66]
  - - [5888, 704, 1, 3328]
    - [83, 9190.81]
  - - [5056, 256, 1, 128]
    - [69, 3235.84]
  - - [1856, 256, 1, 128]
    - [67, 1849.68]
  - - [5056, 128, 1, 256]
    - [80, 6108.96]
  - - [704, 4, 1, 256]
    - [40, 125.156]
  - - [1408, 5888, 1, 128]
    - [66, 5055.06]
  - - [4288, 4, 1, 128]
    - [86, 95.6209]
  - - [1408, 1024, 1, 256]
    - [74, 7370.18]
  - - [1024, 1856, 1, 128]
    - [66, 2966.7]
  - - [256, 704, 1, 128]
    - [68, 528.129]
  - - [256, 1024, 1, 128]
    - [66, 1171.59]
  - - [448, 1024, 1, 256]
    - [80, 5624.55]
  - - [128, 4, 1, 3328]
    - [97, 191.885]
  - - [5056, 6784, 1, 1280]
    - [74, 9543.97]
  - - [704, 5056, 1, 3328]
    - [81, 8790.25]
  - - [64, 1408, 1, 1280]
    - [48, 4505.6]
  - - [3584, 5056, 1, 3328]
    - [79, 9073.42]
  - - [1856, 4, 1, 3328]
    - [97, 612.775]
  - - [4, 2944, 1, 128]
    - [86, 71.9145]
  - - [2368, 2944, 1, 3328]
    - [72, 9314.58]
  - - [448, 448, 1, 1280]
    - [56, 5129.81]
  - - [2368, 3584, 1, 256]
    - [74, 8998.7]
  - - [1024, 256, 1, 1280]
    - [81, 3566.58]
  - - [5056, 3584, 1, 1280]
    - [75, 9345.07]
  - - [448, 4, 1, 3328]
    - [97, 487.237]
  - - [1856, 2944, 1, 1280]
    - [85, 8438.69]
  - - [3584, 2368, 1, 1280]
    - [80, 9298.8]
  - - [128, 1024, 1, 256]
    - [32, 2356.35]
  - - [2944, 1408, 1, 256]
    - [72, 5440.72]
  - - [4288, 1408, 1, 3328]
    - [72, 9385.99]
  - - [3584, 64, 1, 3328]
    - [28, 6310.87]
  - - [1408, 128, 1, 256]
    - [74, 2942.43]
  - - [2944, 1024, 1, 128]
    - [69, 3927.89]
  - - [4288, 5056, 1, 1280]
    - [76, 8328.48]
  - - [5888, 6784, 1, 1280]
    - [85, 9757.34]
  - - [6784, 5056, 1, 128]
    - [65, 5101.3]
  - - [256, 1024, 1, 3328]
    - [74, 6475.77]
  - - [3584, 4, 1, 256]
    - [90, 420.873]
  - - [1856, 64, 1, 3328]
    - [56, 6409.1]
  - - [64, 6784, 1, 128]
    - [4, 2387.22]
  - - [5888, 1408, 1, 3328]
    - [79, 9655.79]
  - - [5888, 64, 1, 1280]
    - [74, 5870.76]
  - - [256, 5056, 1, 256]
    - [77, 6108.96]
  - - [128, 3584, 1, 128]
    - [7, 2383.13]
  - - [448, 3584, 1, 3328]
    - [72, 7092.18]
  - - [704, 2368, 1, 128]
    - [66, 3740.98]
  - - [5888, 256, 1, 128]
    - [67, 2977.44]
  - - [4, 5056, 1, 128]
    - [86, 132.62]
  - - [448, 256, 1, 256]
    - [38, 2308.19]
  - - [704, 4, 1, 3328]
    - [43, 552.574]
  - - [1408, 256, 1, 256]
    - [74, 4577.12]
  - - [3584, 1856, 1, 128]
    - [66, 4571.76]
  - - [4288, 4288, 1, 128]
    - [69, 5284.55]
  - - [1856, 1024, 1, 3328]
    - [80, 6362.15]
  - - [128, 5888, 1, 3328]
    - [50, 7040.73]
  - - [1024, 5056, 1, 256]
    - [85, 7855.6]
  - - [2368, 1408, 1, 3328]
    - [80, 9205.56]
  - - [5888, 448, 1, 256]
    - [77, 5538.74]
  - - [5888, 6784, 1, 128]
    - [65, 4500.75]
  - - [2368, 4, 1, 3328]
    - [43, 642.798]
  - - [6784, 5056, 1, 1280]
    - [81, 9249.13]
  - - [5056, 704, 1, 1280]
    - [80, 8883.27]
  - - [1408, 256, 1, 1280]
    - [74, 5632.0]
  - - [4288, 6784, 1, 1280]
    - [80, 8843.21]
  - - [128, 704, 1, 256]
    - [38, 2045.09]
  - - [1024, 1024, 1, 128]
    - [69, 2723.57]
  - - [448, 128, 1, 1280]
    - [48, 3807.07]
  - - [6784, 4, 1, 3328]
    - [91, 684.571]
  - - [4288, 4, 1, 1280]
    - [40, 601.825]
  - - [1024, 64, 1, 3328]
    - [52, 3928.38]
  - - [1856, 4, 1, 256]
    - [90, 293.294]
  - - [64, 3584, 1, 1280]
    - [74, 5265.45]
  - - [6784, 1408, 1, 256]
    - [74, 9059.26]
  - - [3584, 5888, 1, 128]
    - [66, 5084.19]
  - - [5056, 5888, 1, 256]
    - [85, 8589.99]
  - - [2368, 1024, 1, 256]
    - [77, 4493.03]
  - - [2944, 1856, 1, 256]
    - [83, 5202.31]
  - - [1856, 6784, 1, 1280]
    - [81, 9071.38]
  - - [64, 5056, 1, 128]
    - [4, 2038.32]
  - - [5888, 64, 1, 128]
    - [3, 2016.49]
  - - [448, 704, 1, 128]
    - [67, 1173.55]
  - - [4, 1024, 1, 128]
    - [86, 8.79685]
  - - [4288, 3584, 1, 256]
    - [80, 9080.16]
  - - [1408, 704, 1, 128]
    - [66, 3165.61]
  - - [64, 256, 1, 3328]
    - [60, 3126.49]
  - - [5056, 1856, 1, 1280]
    - [77, 8857.45]
  - - [1408, 1024, 1, 3328]
    - [83, 8177.02]
  - - [2368, 256, 1, 3328]
    - [74, 6810.21]
  - - [5888, 3584, 1, 1280]
    - [72, 9535.45]
  - - [1856, 3584, 1, 3328]
    - [74, 9281.81]
  - - [5888, 128, 1, 1280]
    - [80, 8136.72]
  - - [1024, 2944, 1, 256]
    - [72, 7247.86]
  - - [448, 6784, 1, 1280]
    - [80, 7013.94]
  - - [256, 3584, 1, 1280]
    - [74, 7738.54]
  - - [448, 128, 1, 128]
    - [4, 495.948]
  - - [704, 5056, 1, 256]
    - [80, 8609.34]
  - - [3584, 1024, 1, 3328]
    - [73, 7765.63]
  - - [2944, 1856, 1, 1280]
    - [85, 7775.93]
  - - [128, 256, 1, 128]
    - [17, 296.208]
  - - [5056, 256, 1, 256]
    - [74, 7829.63]
  - - [2368, 3584, 1, 3328]
    - [73, 8895.98]
  - - [2944, 704, 1, 1280]
    - [83, 6855.73]
  - - [128, 4, 1, 256]
    - [92, 24.8242]
  - - [2944, 3584, 1, 1280]
    - [85, 9049.12]
  - - [1856, 5888, 1, 1280]
    - [80, 9431.96]
  - - [256, 256, 1, 1280]
    - [45, 3942.02]
  - - [5056, 448, 1, 3328]
    - [85, 4587.73]
  - - [4288, 1408, 1, 256]
    - [85, 5408.73]
  - - [3584, 64, 1, 256]
    - [54, 2496.61]
  - - [64, 1856, 1, 3328]
    - [27, 5896.68]
  - - [256, 1408, 1, 128]
    - [66, 1643.07]
  - - [5888, 1408, 1, 128]
    - [65, 4436.27]
  - - [4288, 2368, 1, 1280]
    - [74, 9432.94]
  - - [4, 4288, 1, 256]
    - [89, 442.632]
  - - [256, 4288, 1, 128]
    - [66, 2814.69]
  - - [256, 128, 1, 3328]
    - [55, 3951.16]
  - - [6784, 2368, 1, 256]
    - [74, 9169.89]
  - - [5888, 128, 1, 128]
    - [3, 3156.71]
  - - [4288, 1856, 1, 256]
    - [80, 5658.13]
  - - [1856, 256, 1, 3328]
    - [74, 7646.27]
  - - [1856, 2944, 1, 256]
    - [81, 6444.88]
  - - [5056, 1024, 1, 128]
    - [65, 4607.2]
  - - [64, 5888, 1, 1280]
    - [80, 5842.36]
  - - [1760, 7133, 1, 1760]
    - [73, 9097.74]
  - - [6784, 256, 1, 128]
    - [66, 3685.31]
  - - [5888, 704, 1, 128]
    - [65, 3656.13]
  - - [6784, 64, 1, 128]
    - [16, 2191.42]
  - - [1024, 4288, 1, 1280]
    - [80, 9199.22]
  - - [2368, 5056, 1, 3328]
    - [76, 9072.78]
  - - [448, 4, 1, 128]
    - [87, 5.32937]
  - - [4, 256, 1, 3328]
    - [97, 310.937]
  - - [4288, 1024, 1, 3328]
    - [78, 8660.23]
  - - [1024, 5056, 1, 3328]
    - [74, 8886.66]
  - - [1024, 1856, 1, 3328]
    - [79, 8426.14]
  - - [704, 704, 1, 1280]
    - [74, 7661.7]
  - - [128, 2368, 1, 1280]
    - [48, 5746.05]
  - - [1408, 128, 1, 3328]
    - [56, 6530.77]
  - - [3584, 256, 1, 1280]
    - [80, 7633.94]
  - - [4, 128, 1, 128]
    - [87, 1.97874]
  - - [704, 6784, 1, 128]
    - [69, 4589.49]
  - - [3584, 128, 1, 1280]
    - [74, 7078.14]
  - - [4, 256, 1, 1280]
    - [43, 178.087]
  - - [128, 704, 1, 3328]
    - [48, 5959.71]
  - - [4288, 6784, 1, 256]
    - [74, 9326.44]
  - - [3584, 2944, 1, 3328]
    - [76, 9114.06]
  - - [128, 1856, 1, 256]
    - [80, 3672.55]
  - - [64, 4288, 1, 256]
    - [74, 3457.41]
  - - [4, 3584, 1, 3328]
    - [23, 694.27]
  - - [64, 4, 1, 3328]
    - [43, 71.4738]
  - - [4, 64, 1, 3328]
    - [43, 91.8069]
  - - [5888, 2944, 1, 256]
    - [73, 7241.45]
  - - [2368, 6784, 1, 128]
    - [69, 5229.53]
  - - [448, 4288, 1, 1280]
    - [74, 8416.3]
  - - [448, 1856, 1, 3328]
    - [74, 7161.46]
  - - [4, 1024, 1, 256]
    - [40, 187.246]
  - - [5056, 4288, 1, 256]
    - [85, 8947.16]
  - - [1024, 448, 1, 256]
    - [80, 5318.86]
  - - [1024, 3584, 1, 256]
    - [75, 6151.94]
  - - [2944, 128, 1, 1280]
    - [56, 6053.53]
  - - [1856, 5056, 1, 128]
    - [66, 5091.32]
  - - [64, 256, 1, 256]
    - [29, 771.012]
  - - [1408, 4, 1, 128]
    - [86, 40.7758]
  - - [128, 2368, 1, 128]
    - [14, 1520.27]
  - - [256, 704, 1, 1280]
    - [74, 4329.71]
  - - [64, 2368, 1, 128]
    - [5, 1212.42]
  - - [6784, 6784, 1, 3328]
    - [85, 8310.57]
  - - [448, 5888, 1, 1280]
    - [80, 8502.23]
  - - [5056, 448, 1, 128]
    - [66, 4160.9]
  - - [3584, 2944, 1, 128]
    - [66, 4363.41]
  - - [6784, 256, 1, 1280]
    - [80, 8629.57]
  - - [256, 2944, 1, 1280]
    - [80, 7277.38]
  - - [64, 4288, 1, 128]
    - [5, 1821.96]
  - - [2368, 5888, 1, 3328]
    - [74, 9017.42]
  - - [4, 64, 1, 256]
    - [40, 16.0627]
  - - [704, 1024, 1, 3328]
    - [80, 8059.45]
  - - [2368, 1856, 1, 1280]
    - [80, 8813.14]
  - - [128, 448, 1, 128]
    - [1, 588.144]
  - - [128, 6784, 1, 256]
    - [80, 6538.18]
  - - [3584, 4288, 1, 128]
    - [66, 5025.36]
  - - [64, 448, 1, 128]
    - [18, 231.693]
  - - [5888, 4288, 1, 3328]
    - [74, 9515.78]
  - - [2368, 704, 1, 256]
    - [80, 7642.74]
  - - [256, 1856, 1, 3328]
    - [80, 6547.07]
  - - [1856, 128, 1, 256]
    - [74, 3782.18]
  - - [6784, 128, 1, 128]
    - [8, 2835.44]
  - - [3584, 1408, 1, 128]
    - [65, 3049.11]
  - - [1856, 5056, 1, 1280]
    - [81, 8863.2]
  - - [2944, 1024, 1, 1280]
    - [85, 8873.15]
  - - [5056, 4, 1, 256]
    - [21, 494.021]
  - - [3584, 5888, 1, 3328]
    - [73, 9585.15]
  - - [2368, 4288, 1, 256]
    - [85, 6418.95]
  - - [1024, 2368, 1, 3328]
    - [80, 8645.26]
  - - [64, 704, 1, 3328]
    - [62, 4399.83]
  - - [704, 1408, 1, 256]
    - [74, 7428.44]
  - - [6784, 1856, 1, 3328]
    - [85, 9163.56]
  - - [1024, 2944, 1, 128]
    - [69, 3551.88]
  - - [1024, 3584, 1, 1280]
    - [83, 9112.37]
  - - [4288, 5888, 1, 3328]
    - [73, 8523.95]
  - - [4288, 4, 1, 3328]
    - [40, 619.916]
  - - [256, 1408, 1, 256]
    - [74, 4505.6]
  - - [448, 2944, 1, 1280]
    - [74, 7612.77]
  - - [4, 5888, 1, 128]
    - [86, 174.464]
  - - [1024, 2944, 1, 3328]
    - [79, 9136.64]
  - - [3584, 6784, 1, 256]
    - [79, 7253.79]
  - - [256, 6784, 1, 1280]
    - [74, 8637.62]
  - - [1856, 3584, 1, 256]
    - [80, 8199.57]
  - - [128, 448, 1, 3328]
    - [61, 4799.82]
  - - [6784, 1856, 1, 128]
    - [66, 5185.52]
  - - [4, 448, 1, 256]
    - [40, 86.8848]
  - - [2944, 704, 1, 128]
    - [69, 3798.54]
  - - [256, 5888, 1, 1280]
    - [74, 8678.37]
  - - [4, 128, 1, 1280]
    - [43, 102.4]
  - - [4288, 6784, 1, 3328]
    - [79, 8209.3]
  - - [6784, 128, 1, 1280]
    - [56, 6562.89]
  - - [64, 1408, 1, 256]
    - [46, 2059.7]
  - - [7680, 5481, 1, 2560]
    - [85, 9426.69]
  - - [2368, 1408, 1, 128]
    - [66, 4532.4]
  - - [1856, 448, 1, 256]
    - [74, 6275.38]
  - - [1408, 1024, 1, 128]
    - [66, 3604.48]
  - - [128, 64, 1, 128]
    - [1, 87.3813]
  - - [6784, 3584, 1, 3328]
    - [81, 8991.82]
  - - [2944, 64, 1, 3328]
    - [50, 6043.26]
  - - [64, 64, 1, 128]
    - [6, 36.209]
  - - [2368, 5056, 1, 1280]
    - [80, 9438.38]
  - - [64, 4, 1, 1280]
    - [43, 40.1569]
  - - [1408, 2368, 1, 1280]
    - [76, 7738.06]
  - - [128, 1408, 1, 1280]
    - [48, 4937.64]
  - - [256, 64, 1, 3328]
    - [58, 2683.36]
  - - [2944, 4288, 1, 128]
    - [66, 5173.71]
  - - [2944, 2944, 1, 256]
    - [74, 8943.82]
  - - [2944, 4, 1, 1280]
    - [23, 617.757]
  - - [5888, 4, 1, 256]
    - [89, 483.118]
  - - [6784, 256, 1, 256]
    - [80, 7916.6]
  - - [256, 5056, 1, 3328]
    - [74, 8953.15]
  - - [128, 4288, 1, 1280]
    - [27, 6014.95]
  - - [5056, 1856, 1, 128]
    - [68, 4221.05]
  - - [5888, 1408, 1, 256]
    - [79, 9144.75]
  - - [128, 128, 1, 256]
    - [29, 759.838]
  - - [5056, 4, 1, 3328]
    - [89, 642.718]
  - - [4288, 3584, 1, 3328]
    - [75, 9299.95]
  - - [448, 704, 1, 3328]
    - [81, 4480.98]
  - - [448, 448, 1, 128]
    - [5, 1360.71]
  - - [1024, 2368, 1, 1280]
    - [74, 8570.19]
  - - [1856, 704, 1, 3328]
    - [74, 8448.16]
  - - [4, 2368, 1, 128]
    - [86, 64.4902]
  - - [5888, 6784, 1, 3328]
    - [81, 9447.02]
  - - [704, 4288, 1, 1280]
    - [83, 7476.77]
  - - [704, 256, 1, 256]
    - [74, 2957.52]
  - - [6784, 448, 1, 3328]
    - [77, 8886.12]
  - - [4288, 1024, 1, 128]
    - [65, 3864.39]
  - - [49, 512, 128, 2048]
    - [108, 7112.68]
  - - [196, 256, 256, 1024]
    - [102, 8302.6]
  - - [784, 512, 256, 128]
    - [100, 9061.26]
  - - [49, 2048, 128, 512]
    - [98, 6963.26]
  - - [784, 512, 64, 128]
    - [100, 8822.52]
  - - [784, 128, 128, 512]
    - [107, 8983.53]
  - - [196, 256, 64, 1024]
    - [106, 7823.4]
  - - [3136, 256, 256, 64]
    - [103, 9051.28]
  - - [3136, 64, 128, 64]
    - [99, 8581.25]
  - - [49, 2048, 256, 512]
    - [98, 7049.54]
  - - [196, 1024, 64, 256]
    - [101, 7953.59]
  - - [784, 128, 256, 512]
    - [109, 9102.89]
  - - [196, 256, 128, 1024]
    - [101, 8085.79]
  - - [3136, 64, 64, 256]
    - [105, 9266.03]
  - - [784, 128, 64, 512]
    - [106, 8809.29]
  - - [49, 2048, 64, 512]
    - [98, 6843.85]
  - - [3136, 64, 128, 256]
    - [105, 9381.29]
  - - [3136, 256, 128, 64]
    - [103, 8982.54]
  - - [784, 512, 128, 128]
    - [100, 8965.89]
  - - [3136, 256, 64, 64]
    - [103, 8879.7]
  - - [3136, 64, 256, 256]
    - [105, 9566.33]
  - - [3136, 64, 64, 64]
    - [104, 8313.95]
  - - [3136, 64, 256, 64]
    - [99, 8743.7]
  - - [196, 1024, 128, 256]
    - [102, 8119.33]
  - - [49, 512, 64, 2048]
    - [110, 7055.31]
  - - [49, 512, 256, 2048]
    - [111, 7166.31]
  - - [196, 1024, 256, 256]
    - [102, 8210.56]
  - - [5329, 160, 64, 64]
    - [118, 8156.79]
  - - [1225, 288, 64, 48]
    - [122, 6926.13]
  - - [1225, 192, 64, 64]
    - [124, 7840.0]
  - - [64, 1280, 64, 384]
    - [125, 9276.01]
  - - [1225, 384, 64, 192]
    - [115, 9162.25]
  - - [1225, 288, 64, 64]
    - [116, 7495.17]
  - - [5329, 64, 64, 80]
    - [117, 8480.03]
  - - [289, 1024, 64, 256]
    - [115, 8483.73]
  - - [289, 768, 64, 192]
    - [121, 8234.74]
  - - [289, 768, 64, 128]
    - [121, 7988.71]
  - - [64, 1536, 64, 384]
    - [125, 9323.55]
  - - [1225, 384, 64, 64]
    - [124, 8158.7]
  - - [64, 2048, 64, 192]
    - [121, 8818.51]
  - - [64, 1280, 64, 320]
    - [117, 9202.07]
  - - [1225, 384, 64, 96]
    - [115, 8540.6]
  - - [64, 1280, 64, 448]
    - [121, 9317.72]
  - - [289, 768, 64, 160]
    - [125, 8128.71]
  - - [1225, 192, 64, 32]
    - [124, 6495.27]
  - - [64, 1536, 64, 256]
    - [121, 9142.9]
  - - [1225, 256, 64, 48]
    - [119, 7545.26]
  - - [1225, 256, 64, 64]
    - [120, 7972.35]
  - - [1225, 192, 64, 48]
    - [123, 7348.8]
  - - [289, 1024, 64, 384]
    - [113, 8725.56]
  - - [289, 1024, 64, 192]
    - [115, 8313.06]
  - - [64, 1280, 64, 192]
    - [117, 8768.58]
  - - [64, 2048, 64, 320]
    - [114, 9147.88]
  - - [64, 2048, 64, 448]
    - [112, 9304.06]
  - - [64, 2048, 64, 384]
    - [114, 9235.18]
  - - [289, 1024, 64, 128]
    - [121, 7989.41]
  - - [4096, 1024, 1, 2984]
    - [160, 9846.29]
  - - [1024, 4096, 1, 3437]
    - [161, 9915.7]
  - - [1024, 4096, 1, 3235]
    - [154, 9913.92]
  - - [4096, 1024, 1, 4032]
    - [160, 9925.96]
  - - [1024, 4096, 1, 3334]
    - [161, 9918.17]
  - - [4096, 1024, 1, 3288]
    - [161, 9854.57]
  - - [1024, 4096, 1, 3515]
    - [161, 9923.93]
  - - [4096, 1024, 1, 3437]
    - [161, 9869.53]
  - - [1024, 4096, 1, 3259]
    - [161, 9907.55]
  - - [1024, 4096, 1, 3384]
    - [153, 9921.11]
  - - [64, 92, 688, 92]
    - [131, 6137.79]
  - - [4096, 1024, 1, 3458]
    - [160, 9887.59]
  - - [1024, 4096, 1, 3412]
    - [160, 9930.46]
  - - [1024, 4096, 1, 3529]
    - [154, 9924.44]
  - - [1024, 4096, 1, 4032]
    - [161, 9963.38]
  - - [4096, 1024, 1, 3999]
    - [161, 9894.9]
  - - [1024, 4096, 1, 3079]
    - [154, 9894.48]
  - - [1024, 4096, 1, 3876]
    - [153, 9949.29]
  - - [1024, 4096, 1, 3450]
    - [161, 9915.55]
  - - [1024, 4096, 1, 3256]
    - [161, 9911.08]
  - - [4096, 1024, 1, 3403]
    - [160, 9858.83]
  - - [1024, 1024, 1, 3975]
    - [151, 8990.71]
  - - [1024, 4096, 1, 3359]
    - [161, 9914.9]
  - - [4096, 1024, 1, 3549]
    - [160, 9870.56]
  - - [4096, 1024, 1, 3176]
    - [161, 9855.82]
  - - [1024, 4096, 1, 3504]
    - [153, 9934.07]
  - - [4096, 1024, 1, 3314]
    - [160, 9873.8]
  - - [4096, 1024, 1, 3183]
    - [160, 9843.74]
  - - [1024, 4096, 1, 3209]
    - [154, 9904.87]
  - - [1024, 4096, 1, 3720]
    - [153, 9934.06]
  - - [1024, 4096, 1, 3859]
    - [153, 9952.43]
  - - [1024, 33708, 1, 4059]
    - [153, 10321.4]
  - - [1024, 4096, 1, 3968]
    - [153, 9955.86]
  - - [64, 123, 528, 123]
    - [126, 6916.11]
  - - [4096, 1024, 1, 3477]
    - [161, 9871.93]
  - - [4096, 1024, 1, 3233]
    - [161, 9862.25]
  - - [4096, 1024, 1, 3409]
    - [161, 9876.76]
  - - [4096, 1024, 1, 3564]
    - [161, 9870.39]
  - - [64, 102, 624, 100]
    - [126, 5773.06]
  - - [4096, 1024, 1, 3190]
    - [160, 9850.87]
  - - [64, 112, 576, 111]
    - [126, 6517.25]
  - - [1024, 4096, 1, 3288]
    - [160, 9911.8]
  - - [4096, 1024, 1, 3451]
    - [160, 9859.51]
  - - [1024, 4096, 1, 3348]
    - [153, 9915.37]
  - - [64, 102, 624, 102]
    - [126, 5783.6]
  - - [1024, 4096, 1, 3465]
    - [154, 9913.02]
  - - [1024, 33708, 1, 4032]
    - [153, 10340.3]
  - - [1024, 33708, 1, 3840]
    - [153, 10341.7]
  - - [4096, 1024, 1, 3391]
    - [161, 9861.67]
  - - [1024, 4096, 1, 3530]
    - [153, 9920.34]
  - - [4096, 1024, 1, 3209]
    - [160, 9846.9]
  - - [1024, 4096, 1, 3457]
    - [154, 9917.19]
  - - [1024, 4096, 1, 3386]
    - [153, 9917.55]
  - - [4096, 1024, 1, 3350]
    - [160, 9884.44]
  - - [1024, 4096, 1, 3184]
    - [161, 9925.88]
  - - [1024, 4096, 1, 3093]
    - [160, 9902.45]
  - - [64, 133, 480, 135]
    - [143, 6205.87]
  - - [1024, 4096, 1, 3400]
    - [153, 9917.0]
  - - [1024, 1024, 1, 4026]
    - [159, 9014.29]
  - - [1024, 4096, 1, 3214]
    - [153, 9895.84]
  - - [4096, 1024, 1, 3406]
    - [161, 9857.72]
  - - [1024, 4096, 1, 3565]
    - [160, 9919.27]
  - - [4096, 1024, 1, 3536]
    - [161, 9888.96]
  - - [1024, 4096, 1, 3183]
    - [160, 9907.45]
  - - [1024, 4096, 1, 3462]
    - [161, 9922.3]
  - - [4096, 1024, 1, 3130]
    - [154, 9845.94]
  - - [4096, 1024, 1, 3381]
    - [161, 9868.17]
  - - [4096, 1024, 1, 3298]
    - [160, 9870.44]
  - - [1024, 4096, 1, 3292]
    - [153, 9906.2]
  - - [4096, 1024, 1, 3289]
    - [160, 9856.45]
  - - [64, 160, 400, 159]
    - [146, 7427.74]
  - - [1024, 4096, 1, 3379]
    - [153, 9916.99]
  - - [1024, 4096, 1, 3990]
    - [154, 9947.27]
  - - [1024, 4096, 1, 3540]
    - [161, 9935.66]
  - - [4096, 1024, 1, 3412]
    - [161, 9867.46]
  - - [1024, 1024, 1, 3780]
    - [156, 9036.16]
  - - [1024, 4096, 1, 3555]
    - [160, 9927.27]
  - - [1024, 4096, 1, 3518]
    - [154, 9925.45]
  - - [4096, 1024, 1, 3189]
    - [160, 9861.14]
  - - [1024, 4096, 1, 3298]
    - [154, 9923.12]
  - - [4096, 1024, 1, 3072]
    - [160, 9871.98]
  - - [1024, 4096, 1, 3393]
    - [161, 9929.18]
  - - [1024, 4096, 1, 3207]
    - [153, 9912.71]
  - - [64, 228, 272, 232]
    - [149, 7350.04]
  - - [64, 23, 2720, 23]
    - [130, 2640.15]
  - - [4096, 1024, 1, 3487]
    - [161, 9860.81]
  - - [1024, 1024, 1, 3822]
    - [159, 8993.86]
  - - [64, 77, 816, 77]
    - [131, 5273.09]
  - - [4096, 1024, 1, 3431]
    - [161, 9867.43]
  - - [4096, 1024, 1, 3378]
    - [160, 9888.04]
  - - [4096, 1024, 1, 3529]
    - [154, 9879.4]
  - - [4096, 1024, 1, 3460]
    - [161, 9877.15]
  - - [1024, 4096, 1, 3336]
    - [153, 9912.31]
  - - [1024, 4096, 1, 3501]
    - [154, 9914.3]
  - - [64, 159, 400, 159]
    - [144, 7016.41]
  - - [1024, 4096, 1, 3584]
    - [161, 9940.49]
  - - [64, 135, 480, 134]
    - [144, 6241.29]
  - - [64, 99, 624, 99]
    - [135, 5617.29]
  - - [4096, 1024, 1, 2499]
    - [160, 9813.47]
  - - [1024, 1024, 1, 3942]
    - [156, 9059.91]
  - - [4096, 1024, 1, 3352]
    - [160, 9867.02]
  - - [1024, 4096, 1, 3543]
    - [161, 9928.67]
  - - [1024, 4096, 1, 3476]
    - [160, 9931.48]
  - - [1024, 33708, 1, 3822]
    - [153, 10324.6]
  - - [1024, 4096, 1, 3436]
    - [153, 9917.18]
  - - [1024, 1024, 1, 3861]
    - [152, 8998.39]
  - - [1024, 1024, 1, 4000]
    - [157, 9058.2]
  - - [1024, 4096, 1, 3594]
    - [153, 9927.78]
  - - [4096, 1024, 1, 3514]
    - [161, 9872.2]
  - - [1024, 4096, 1, 3064]
    - [160, 9907.0]
  - - [4096, 1024, 1, 3371]
    - [153, 9857.64]
  - - [4096, 1024, 1, 3558]
    - [161, 9876.21]
  - - [4096, 1024, 1, 3517]
    - [160, 9866.35]
  - - [4096, 1024, 1, 3144]
    - [160, 9846.26]
  - - [1024, 4096, 1, 3312]
    - [153, 9932.75]
  - - [4096, 1024, 1, 3079]
    - [160, 9851.0]
  - - [1024, 4096, 1, 3415]
    - [153, 9919.37]
  - - [1024, 4096, 1, 3221]
    - [160, 9908.08]
  - - [1024, 4096, 1, 3978]
    - [154, 9944.31]
  - - [4096, 1024, 1, 3876]
    - [160, 9898.89]
  - - [1024, 4096, 1, 3528]
    - [153, 9919.5]
  - - [1024, 4096, 1, 3181]
    - [161, 9894.76]
  - - [4096, 1024, 1, 3445]
    - [160, 9878.44]
  - - [4096, 1024, 1, 3450]
    - [153, 9864.72]
  - - [4096, 1024, 1, 3377]
    - [160, 9879.59]
  - - [1024, 4096, 1, 3532]
    - [154, 9928.09]
  - - [1024, 33708, 1, 3944]
    - [153, 10329.6]
  - - [4096, 1024, 1, 3483]
    - [160, 9861.73]
  - - [1024, 4096, 1, 3358]
    - [153, 9903.59]
  - - [4096, 1024, 1, 3464]
    - [160, 9876.74]
  - - [4096, 1024, 1, 3282]
    - [153, 9859.13]
  - - [4096, 1024, 1, 3256]
    - [161, 9855.0]
  - - [1024, 4096, 1, 3057]
    - [160, 9910.65]
  - - [4096, 1024, 1, 3481]
    - [160, 9866.19]
  - - [4096, 1024, 1, 3340]
    - [160, 9862.15]
  - - [1024, 1024, 1, 3870]
    - [159, 9082.35]
  - - [1024, 4096, 1, 3273]
    - [153, 9916.19]
  - - [64, 65, 992, 65]
    - [144, 4682.91]
  - - [4096, 1024, 1, 3392]
    - [154, 9881.02]
  - - [4096, 1024, 1, 3337]
    - [160, 9864.4]
  - - [4096, 1024, 1, 3359]
    - [160, 9874.32]
  - - [4096, 1024, 1, 3498]
    - [161, 9864.25]
  - - [4096, 1024, 1, 3169]
    - [160, 9851.0]
  - - [1024, 33708, 1, 3859]
    - [154, 10332.5]
  - - [64, 19, 3264, 19]
    - [130, 2182.04]
  - - [1024, 4096, 1, 3103]
    - [153, 9898.8]
  - - [4096, 1024, 1, 3900]
    - [160, 9897.02]
  - - [1024, 4096, 1, 3442]
    - [160, 9938.87]
  - - [1024, 4096, 1, 3248]
    - [160, 9939.82]
  - - [1024, 4096, 1, 3351]
    - [161, 9923.13]
  - - [4096, 1024, 1, 3593]
    - [160, 9894.26]
  - - [1024, 4096, 1, 3780]
    - [160, 9941.86]
  - - [64, 133, 480, 133]
    - [144, 6180.69]
  - - [1024, 33708, 1, 3681]
    - [153, 10332.2]
  - - [4096, 1024, 1, 3374]
    - [154, 9859.26]
  - - [1024, 4096, 1, 3557]
    - [153, 9928.1]
  - - [4096, 1024, 1, 3906]
    - [160, 9906.97]
  - - [4096, 1024, 1, 3504]
    - [160, 9885.95]
  - - [1024, 4096, 1, 3270]
    - [160, 9916.27]
  - - [4096, 1024, 1, 3098]
    - [153, 9854.66]
  - - [64, 232, 272, 232]
    - [149, 7394.0]
  - - [4096, 1024, 1, 3216]
    - [161, 9876.47]
  - - [64, 148, 432, 148]
    - [146, 6663.75]
  - - [1024, 4096, 1, 3550]
    - [160, 9920.18]
  - - [4096, 1024, 1, 3449]
    - [154, 9870.47]
  - - [1024, 4096, 1, 3403]
    - [161, 9908.11]
  - - [1024, 4096, 1, 3523]
    - [160, 9932.61]
  - - [1024, 4096, 1, 3486]
    - [160, 9917.36]
  - - [1024, 4096, 1, 3564]
    - [160, 9923.34]
  - - [1024, 33708, 1, 4005]
    - [153, 10339.4]
  - - [4096, 1024, 1, 3296]
    - [160, 9879.68]
  - - [1024, 4096, 1, 3263]
    - [153, 9907.07]
  - - [64, 25, 2512, 25]
    - [130, 2848.07]
  - - [1024, 4096, 1, 3130]
    - [161, 9900.0]
  - - [1024, 4096, 1, 3295]
    - [161, 9895.35]
  - - [1024, 33708, 1, 3925]
    - [154, 10342.2]
  - - [1024, 4096, 1, 3378]
    - [153, 9921.27]
  - - [4096, 1024, 1, 3720]
    - [161, 9885.72]
  - - [4096, 1024, 1, 3399]
    - [160, 9880.55]
  - - [4096, 1024, 1, 3543]
    - [161, 9870.63]
  - - [64, 9, 6544, 9]
    - [133, 955.07]
  - - [4096, 1024, 1, 3497]
    - [160, 9868.33]
  - - [4096, 1024, 1, 3594]
    - [161, 9876.78]
  - - [1024, 4096, 1, 3144]
    - [161, 9901.86]
  - - [1024, 4096, 1, 3975]
    - [154, 9950.09]
  - - [4096, 1024, 1, 3205]
    - [161, 9855.97]
  - - [1024, 33708, 1, 3995]
    - [153, 10331.0]
  - - [1024, 4096, 1, 3392]
    - [153, 9935.68]
  - - [1024, 4096, 1, 3055]
    - [161, 9893.15]
  - - [1024, 4096, 1, 4026]
    - [161, 9940.12]
  - - [4096, 1024, 1, 3557]
    - [160, 9883.9]
  - - [4096, 1024, 1, 3515]
    - [160, 9871.84]
  - - [4096, 1024, 1, 3486]
    - [161, 9860.64]
  - - [4096, 1024, 1, 3457]
    - [161, 9885.27]
  - - [1024, 4096, 1, 3511]
    - [153, 9928.14]
  - - [4096, 1024, 1, 3138]
    - [160, 9853.96]
  - - [1024, 4096, 1, 3339]
    - [154, 9912.79]
  - - [1024, 4096, 1, 3939]
    - [154, 9952.16]
  - - [4096, 1024, 1, 3500]
    - [154, 9863.52]
  - - [4096, 1024, 1, 3395]
    - [161, 9883.72]
  - - [4096, 1024, 1, 3968]
    - [161, 9920.26]
  - - [4096, 1024, 1, 4020]
    - [161, 9912.71]
  - - [4096, 1024, 1, 3942]
    - [160, 9910.07]
  - - [1024, 1024, 1, 4032]
    - [150, 9024.64]
  - - [4096, 1024, 1, 3349]
    - [161, 9865.94]
  - - [1024, 4096, 1, 3322]
    - [154, 9908.33]
  - - [4096, 1024, 1, 3452]
    - [160, 9872.59]
  - - [1024, 4096, 1, 3417]
    - [160, 9912.54]
  - - [1024, 1024, 1, 4012]
    - [158, 9085.37]
  - - [1024, 4096, 1, 3526]
    - [154, 9920.26]
  - - [4096, 1024, 1, 3485]
    - [154, 9861.54]
  - - [1024, 1024, 1, 3681]
    - [158, 8991.36]
  - - [4096, 1024, 1, 3303]
    - [161, 9861.2]
  - - [4096, 1024, 1, 3344]
    - [161, 9892.34]
  - - [1024, 4096, 1, 3479]
    - [161, 9921.67]
  - - [4096, 1024, 1, 3300]
    - [160, 9868.54]
  - - [1024, 4096, 1, 3439]
    - [154, 9918.19]
  - - [4096, 1024, 1, 3280]
    - [161, 9875.19]
  - - [1024, 4096, 1, 3245]
    - [153, 9910.39]
  - - [1024, 4096, 1, 3328]
    - [153, 9941.5]
  - - [4096, 1024, 1, 3418]
    - [153, 9870.66]
  - - [1024, 4096, 1, 3493]
    - [161, 9938.35]
  - - [1024, 4096, 1, 3500]
    - [153, 9916.83]
  - - [1024, 4096, 1, 3166]
    - [153, 9898.02]
  - - [4096, 1024, 1, 3126]
    - [154, 9846.94]
  - - [1024, 4096, 1, 3277]
    - [161, 9898.56]
  - - [1024, 4096, 1, 3315]
    - [160, 9923.01]
  - - [1024, 1024, 1, 3927]
    - [151, 8987.61]
  - - [1024, 4096, 1, 3414]
    - [153, 9915.91]
  - - [4096, 1024, 1, 3531]
    - [160, 9871.82]
  - - [4096, 1024, 1, 3484]
    - [153, 9867.76]
  - - [1024, 4096, 1, 3180]
    - [160, 9903.99]
  - - [4096, 1024, 1, 3360]
    - [160, 9879.47]
  - - [1024, 33708, 1, 3990]
    - [153, 10334.9]
  - - [4096, 1024, 1, 3466]
    - [160, 9874.92]
  - - [1024, 4096, 1, 3428]
    - [153, 9915.92]
  - - [1024, 4096, 1, 3137]
    - [160, 9913.17]
  - - [4096, 1024, 1, 4059]
    - [160, 9901.76]
  - - [1024, 4096, 1, 3353]
    - [160, 9914.5]
  - - [1024, 4096, 1, 3942]
    - [160, 9944.4]
  - - [4096, 1024, 1, 3506]
    - [153, 9875.65]
  - - [1024, 1024, 1, 3894]
    - [151, 8946.45]
  - - [4096, 1024, 1, 3508]
    - [161, 9877.57]
  - - [64, 132, 480, 135]
    - [144, 6164.76]
  - - [4096, 1024, 1, 3956]
    - [153, 9907.73]
  - - [64, 7, 8192, 7]
    - [132, 812.978]
  - - [1024, 4096, 1, 3272]
    - [154, 9909.72]
  - - [1024, 4096, 1, 3443]
    - [161, 9929.73]
  - - [1024, 4096, 1, 3375]
    - [161, 9909.13]
  - - [1024, 4096, 1, 3525]
    - [161, 9929.17]
  - - [4096, 1024, 1, 3472]
    - [160, 9889.87]
  - - [1024, 4096, 1, 3520]
    - [153, 9947.69]
  - - [4096, 1024, 1, 3322]
    - [160, 9862.88]
  - - [4096, 1024, 1, 3387]
    - [160, 9861.52]
  - - [64, 8, 7280, 8]
    - [138, 1024.0]
  - - [1024, 33708, 1, 3939]
    - [153, 10339.8]
  - - [4096, 1024, 1, 3345]
    - [161, 9873.58]
  - - [4096, 1024, 1, 2967]
    - [160, 9839.11]
  - - [1024, 4096, 1, 3453]
    - [153, 9905.71]
  - - [1024, 4096, 1, 3640]
    - [160, 9933.95]
  - - [4096, 1024, 1, 3291]
    - [154, 9860.74]
  - - [1024, 4096, 1, 3350]
    - [161, 9917.93]
  - - [4096, 1024, 1, 3417]
    - [160, 9864.51]
  - - [64, 135, 480, 135]
    - [144, 6265.35]
  - - [1024, 4096, 1, 3467]
    - [154, 9906.85]
  - - [1024, 4096, 1, 3491]
    - [160, 9933.2]
  - - [1024, 4096, 1, 3822]
    - [160, 9938.65]
  - - [4096, 1024, 1, 3292]
    - [160, 9849.11]
  - - [1024, 4096, 1, 3231]
    - [153, 9905.72]
  - - [1024, 4096, 1, 3364]
    - [154, 9930.22]
  - - [1024, 4096, 1, 3995]
    - [154, 9943.66]
  - - [1024, 4096, 1, 3545]
    - [153, 9928.43]
  - - [1024, 1024, 1, 3876]
    - [151, 9002.94]
  - - [1024, 4096, 1, 3186]
    - [153, 9920.91]
  - - [4096, 1024, 1, 3432]
    - [160, 9875.19]
  - - [64, 84, 752, 85]
    - [131, 5704.41]
  - - [4096, 1024, 1, 3367]
    - [154, 9867.96]
  - - [4096, 1024, 1, 3503]
    - [161, 9870.91]
  - - [1024, 4096, 1, 3095]
    - [154, 9902.8]
  - - [4096, 1024, 1, 3465]
    - [161, 9872.07]
  - - [1024, 4096, 1, 3402]
    - [160, 9914.56]
  - - [4096, 1024, 1, 3140]
    - [160, 9847.85]
  - - [1024, 1024, 1, 4050]
    - [157, 9055.65]
  - - [4096, 1024, 1, 3424]
    - [154, 9894.52]
  - - [4096, 1024, 1, 3257]
    - [153, 9860.87]
  - - [4096, 1024, 1, 2917]
    - [160, 9845.81]
  - - [1024, 33708, 1, 3640]
    - [153, 10321.6]
  - - [1024, 4096, 1, 3456]
    - [153, 9950.25]
  - - [1024, 4096, 1, 3014]
    - [153, 9907.87]
  - - [4096, 1024, 1, 3372]
    - [161, 9868.27]
  - - [64, 132, 480, 132]
    - [144, 6121.52]
  - - [1024, 4096, 1, 3294]
    - [161, 9903.13]
  - - [4096, 1024, 1, 3446]
    - [161, 9871.59]
  - - [1024, 4096, 1, 3389]
    - [154, 9909.17]
  - - [4096, 1024, 1, 3259]
    - [160, 9860.66]
  - - [4096, 1024, 1, 3544]
    - [160, 9878.66]
  - - [4096, 1024, 1, 3479]
    - [161, 9873.87]
  - - [4096, 1024, 1, 3542]
    - [160, 9878.87]
  - - [4096, 1024, 1, 3321]
    - [153, 9861.03]
  - - [1024, 4096, 1, 3147]
    - [153, 9894.67]
  - - [1024, 4096, 1, 3944]
    - [153, 9950.41]
  - - [4096, 1024, 1, 3870]
    - [161, 9881.64]
  - - [1024, 4096, 1, 3308]
    - [153, 9907.16]
  - - [4096, 1024, 1, 3401]
    - [160, 9864.49]
  - - [1024, 4096, 1, 3395]
    - [153, 9928.93]
  - - [64, 99, 624, 102]
    - [129, 5651.26]
  - - [1024, 4096, 1, 3563]
    - [160, 9922.66]
  - - [1024, 33708, 1, 3870]
    - [153, 10325.3]
  - - [4096, 1024, 1, 3494]
    - [160, 9875.27]
  - - [1024, 4096, 1, 3271]
    - [153, 9912.99]
  - - [1024, 33708, 1, 3910]
    - [153, 10341.4]
  - - [1024, 4096, 1, 3287]
    - [161, 9924.77]
  - - [1024, 33708, 1, 3860]
    - [153, 10330.6]
  - - [64, 143, 432, 148]
    - [146, 6571.68]
  - - [1024, 1024, 1, 3584]
    - [158, 8975.21]
  - - [64, 162, 400, 162]
    - [148, 6822.16]
  - - [4096, 1024, 1, 3341]
    - [160, 9854.56]
  - - [1024, 4096, 1, 3136]
    - [153, 9926.76]
  - - [4096, 1024, 1, 3439]
    - [160, 9854.23]
  - - [64, 148, 432, 147]
    - [144, 6677.51]
  - - [1024, 4096, 1, 3751]
    - [160, 9938.38]
  - - [1024, 4096, 1, 3301]
    - [160, 9919.05]
  - - [4096, 1024, 1, 3468]
    - [161, 9859.73]
  - - [1024, 4096, 1, 3416]
    - [161, 9918.42]
  - - [4096, 1024, 1, 3163]
    - [160, 9854.55]
  - - [1024, 4096, 1, 3230]
    - [154, 9897.44]
  - - [1024, 4096, 1, 3581]
    - [154, 9915.38]
  - - [1024, 1024, 1, 3960]
    - [156, 9045.76]
  - - [4096, 1024, 1, 3463]
    - [161, 9884.64]
  - - [1024, 4096, 1, 3478]
    - [154, 9926.92]
  - - [4096, 1024, 1, 3262]
    - [160, 9852.12]
  - - [1024, 4096, 1, 3438]
    - [160, 9912.58]
  - - [1024, 4096, 1, 3244]
    - [153, 9900.41]
  - - [1024, 4096, 1, 3445]
    - [153, 9920.22]
  - - [4096, 1024, 1, 3328]
    - [160, 9887.97]
  - - [1024, 4096, 1, 3492]
    - [154, 9937.12]
  - - [4096, 1024, 1, 3211]
    - [154, 9847.85]
  - - [1024, 4096, 1, 3910]
    - [161, 9946.47]
  - - [1024, 4096, 1, 3314]
    - [153, 9932.5]
  - - [4096, 1024, 1, 3859]
    - [160, 9902.74]
  - - [4096, 1024, 1, 3383]
    - [160, 9875.1]
  - - [1024, 4096, 1, 3409]
    - [161, 9926.69]
  - - [1024, 4096, 1, 4020]
    - [153, 9941.7]
  - - [4096, 1024, 1, 3530]
    - [160, 9872.71]
  - - [4096, 1024, 1, 3411]
    - [161, 9874.92]
  - - [1024, 4096, 1, 3566]
    - [161, 9921.0]
  - - [4096, 1024, 1, 3493]
    - [153, 9875.64]
  - - [4096, 1024, 1, 3184]
    - [160, 9873.04]
  - - [1024, 4096, 1, 3072]
    - [153, 9923.69]
  - - [1024, 4096, 1, 3431]
    - [154, 9910.93]
  - - [4096, 1024, 1, 3306]
    - [161, 9853.32]
  - - [1024, 4096, 1, 3352]
    - [161, 9913.22]
  - - [4096, 1024, 1, 3295]
    - [160, 9862.58]
  - - [64, 123, 528, 122]
    - [126, 6950.15]
  - - [1024, 4096, 1, 3517]
    - [154, 9919.96]
  - - [64, 102, 624, 101]
    - [134, 5791.39]
  - - [4096, 1024, 1, 3426]
    - [160, 9891.04]
  - - [4096, 1024, 1, 3385]
    - [160, 9868.31]
  - - [1024, 1024, 1, 3978]
    - [151, 9008.38]
  - - [4096, 1024, 1, 3572]
    - [153, 9884.71]
  - - [4096, 1024, 1, 3459]
    - [160, 9892.07]
  - - [1024, 4096, 1, 3374]
    - [161, 9908.42]
  - - [4096, 1024, 1, 3166]
    - [160, 9832.35]
  - - [4096, 1024, 1, 3093]
    - [161, 9841.15]
  - - [4096, 1024, 1, 3523]
    - [154, 9878.95]
  - - [4096, 1024, 1, 3413]
    - [154, 9880.71]
  - - [1024, 4096, 1, 3996]
    - [153, 9948.04]
  - - [1024, 4096, 1, 3452]
    - [161, 9915.87]
  - - [4096, 1024, 1, 3232]
    - [161, 9876.44]
  - - [4096, 1024, 1, 3400]
    - [153, 9867.05]
  - - [4096, 1024, 1, 3334]
    - [160, 9868.89]
  - - [1024, 4096, 1, 3345]
    - [153, 9920.5]
  - - [1024, 4096, 1, 3538]
    - [160, 9933.24]
  - - [1024, 4096, 1, 3466]
    - [160, 9920.75]
  - - [4096, 1024, 1, 3315]
    - [160, 9876.77]
  - - [4096, 1024, 1, 3214]
    - [161, 9847.83]
  - - [1024, 33708, 1, 3900]
    - [153, 10331.6]
  - - [64, 160, 400, 160]
    - [146, 7440.51]
  - - [1024, 4096, 1, 3367]
    - [160, 9926.22]
  - - [1024, 4096, 1, 2917]
    - [161, 9904.47]
  - - [1024, 1024, 1, 3995]
    - [152, 9000.23]
  - - [64, 132, 480, 134]
    - [144, 6146.78]
  - - [1024, 4096, 1, 3544]
    - [161, 9924.04]
  - - [4096, 1024, 1, 3414]
    - [161, 9867.8]
  - - [4096, 1024, 1, 3565]
    - [154, 9870.03]
  - - [1024, 4096, 1, 3512]
    - [160, 9919.74]
  - - [1024, 4096, 1, 3191]
    - [161, 9914.69]
  - - [64, 27, 2336, 27]
    - [128, 3054.61]
  - - [1024, 4096, 1, 3289]
    - [161, 9917.1]
  - - [4096, 1024, 1, 3290]
    - [160, 9858.31]
  - - [1024, 4096, 1, 3211]
    - [161, 9897.06]
  - - [1024, 33708, 1, 3969]
    - [154, 10336.0]
  - - [4096, 1024, 1, 3566]
    - [160, 9862.9]
  - - [64, 111, 576, 111]
    - [134, 6400.81]
  - - [1024, 4096, 1, 3459]
    - [160, 9922.93]
  - - [1024, 4096, 1, 3372]
    - [153, 9909.76]
  - - [4096, 1024, 1, 3339]
    - [160, 9859.2]
  - - [4096, 1024, 1, 3425]
    - [160, 9889.24]
  - - [4096, 1024, 1, 3388]
    - [160, 9871.57]
  - - [1024, 4096, 1, 3531]
    - [153, 9918.9]
  - - [4096, 1024, 1, 3286]
    - [161, 9868.32]
  - - [4096, 1024, 1, 3462]
    - [160, 9881.78]
  - - [1024, 4096, 1, 3388]
    - [153, 9904.59]
  - - [4096, 1024, 1, 3165]
    - [153, 9836.23]
  - - [4096, 1024, 1, 3304]
    - [160, 9857.45]
  - - [1024, 4096, 1, 2736]
    - [160, 9900.97]
  - - [4096, 1024, 1, 3397]
    - [160, 9872.0]
  - - [64, 38, 1680, 38]
    - [127, 3459.42]
  - - [1024, 4096, 1, 3311]
    - [161, 9908.22]
  - - [1024, 4096, 1, 3394]
    - [161, 9929.33]
  - - [4096, 1024, 1, 2736]
    - [160, 9833.78]
  - - [1024, 4096, 1, 3559]
    - [154, 9925.23]
  - - [4096, 1024, 1, 3180]
    - [160, 9837.95]
  - - [1024, 4096, 1, 3480]
    - [153, 9922.36]
  - - [4096, 1024, 1, 3318]
    - [160, 9867.77]
  - - [4096, 1024, 1, 3213]
    - [160, 9845.92]
  - - [1024, 4096, 1, 3286]
    - [160, 9912.04]
  - - [4096, 1024, 1, 3471]
    - [160, 9874.14]
  - - [1024, 4096, 1, 3381]
    - [161, 9922.86]
  - - [64, 100, 624, 100]
    - [135, 5705.14]
  - - [4096, 1024, 1, 3502]
    - [160, 9872.34]
  - - [64, 16, 3840, 16]
    - [141, 2091.57]
  - - [1024, 4096, 1, 3552]
    - [153, 9943.79]
  - - [4096, 1024, 1, 3519]
    - [161, 9869.85]
  - - [1024, 4096, 1, 3300]
    - [154, 9916.05]
  - - [1024, 4096, 1, 3419]
    - [153, 9913.96]
  - - [4096, 1024, 1, 4030]
    - [154, 9893.63]
  - - [4096, 1024, 1, 3976]
    - [161, 9898.25]
  - - [1024, 4096, 1, 3473]
    - [161, 9928.32]
  - - [1024, 1024, 1, 3977]
    - [158, 9009.23]
  - - [4096, 1024, 1, 3428]
    - [160, 9876.69]
  - - [1024, 4096, 1, 3433]
    - [154, 9923.82]
  - - [4096, 1024, 1, 3534]
    - [154, 9863.9]
  - - [4096, 1024, 1, 3461]
    - [160, 9873.02]
  - - [4096, 1024, 1, 3681]
    - [160, 9898.47]
  - - [4096, 1024, 1, 3495]
    - [161, 9875.98]
  - - [4096, 1024, 1, 3351]
    - [160, 9879.61]
  - - [1024, 4096, 1, 4059]
    - [153, 9948.51]
  - - [4096, 1024, 1, 3990]
    - [160, 9900.66]
  - - [1024, 4096, 1, 3325]
    - [154, 9903.2]
  - - [1024, 4096, 1, 3408]
    - [160, 9932.05]
  - - [64, 59, 1088, 59]
    - [134, 5343.67]
  - - [4096, 1024, 1, 3394]
    - [161, 9878.07]
  - - [1024, 4096, 1, 3573]
    - [161, 9935.2]
  - - [4096, 1024, 1, 3386]
    - [160, 9866.28]
  - - [4096, 1024, 1, 3540]
    - [160, 9882.23]
  - - [1024, 4096, 1, 3182]
    - [154, 9894.35]
  - - [1024, 4096, 1, 3430]
    - [153, 9915.14]
  - - [1024, 4096, 1, 3236]
    - [161, 9920.46]
  - - [4096, 1024, 1, 2977]
    - [160, 9847.98]
  - - [1024, 4096, 1, 3355]
    - [160, 9908.68]
  - - [4096, 1024, 1, 3139]
    - [160, 9850.61]
  - - [4096, 1024, 1, 3516]
    - [154, 9874.11]
  - - [4096, 1024, 1, 3368]
    - [154, 9872.54]
  - - [4096, 1024, 1, 3559]
    - [153, 9884.22]
  - - [64, 11, 5456, 11]
    - [141, 1382.57]
  - - [1024, 4096, 1, 3506]
    - [160, 9937.59]
  - - [1024, 4096, 1, 3145]
    - [153, 9905.01]
  - - [1024, 4096, 1, 3369]
    - [160, 9912.61]
  - - [64, 112, 576, 112]
    - [126, 6583.46]
  - - [4096, 1024, 1, 3522]
    - [160, 9889.37]
  - - [1024, 33708, 1, 3894]
    - [153, 10337.4]
  - - [64, 159, 400, 162]
    - [144, 7056.99]
  - - [4096, 1024, 1, 3336]
    - [160, 9867.57]
  - - [1024, 4096, 1, 3382]
    - [154, 9915.8]
  - - [4096, 1024, 1, 3533]
    - [160, 9878.46]
  - - [4096, 1024, 1, 4050]
    - [161, 9916.72]
  - - [4096, 1024, 1, 3480]
    - [154, 9869.22]
  - - [1024, 4096, 1, 3344]
    - [153, 9935.51]
  - - [64, 122, 528, 122]
    - [126, 6871.04]
  - - [1024, 4096, 1, 3509]
    - [154, 9925.7]
  - - [1024, 4096, 1, 3956]
    - [153, 9958.16]
  - - [4096, 1024, 1, 3616]
    - [160, 9904.53]
  - - [1024, 4096, 1, 3366]
    - [153, 9919.37]
  - - [4096, 1024, 1, 2935]
    - [153, 9833.13]
  - - [4096, 1024, 1, 3393]
    - [160, 9877.35]
  - - [4096, 1024, 1, 3547]
    - [154, 9865.0]
  - - [1024, 4096, 1, 3499]
    - [161, 9912.39]
  - - [4096, 1024, 1, 3357]
    - [160, 9855.18]
  - - [4096, 1024, 1, 3272]
    - [160, 9861.87]
  - - [4096, 1024, 1, 3207]
    - [160, 9847.68]
  - - [4096, 1024, 1, 3894]
    - [160, 9918.76]
  - - [1024, 4096, 1, 3444]
    - [160, 9932.61]
  - - [4096, 1024, 1, 3561]
    - [160, 9872.51]
  - - [4096, 1024, 1, 3376]
    - [160, 9885.49]
  - - [1024, 4096, 1, 3458]
    - [160, 9929.29]
  - - [4096, 1024, 1, 3231]
    - [154, 9846.98]
  - - [64, 228, 272, 228]
    - [155, 7302.59]
  - - [1024, 4096, 1, 3505]
    - [161, 9931.53]
  - - [4096, 1024, 1, 3277]
    - [160, 9857.1]
  - - [64, 21, 2976, 21]
    - [130, 2436.04]
  - - [1024, 4096, 1, 3391]
    - [160, 9911.15]
  - - [64, 32, 1984, 32]
    - [142, 3572.07]
  - - [1024, 4096, 1, 3536]
    - [161, 9946.8]
  - - [1024, 4096, 1, 3063]
    - [160, 9906.82]
  - - [1024, 1024, 1, 3925]
    - [152, 9011.35]
  - - [1024, 4096, 1, 3189]
    - [154, 9900.85]
  - - [1024, 4096, 1, 2505]
    - [160, 9854.75]
  - - [4096, 1024, 1, 3454]
    - [153, 9864.86]
  - - [1024, 4096, 1, 3405]
    - [161, 9906.23]
  - - [1024, 33708, 1, 4050]
    - [154, 10343.6]
  - - [4096, 1024, 1, 3520]
    - [160, 9886.93]
  - - [64, 93, 688, 93]
    - [137, 6222.76]
  - - [1024, 4096, 1, 3487]
    - [161, 9918.59]
  - - [1024, 4096, 1, 3558]
    - [161, 9930.89]
  - - [4096, 1024, 1, 3297]
    - [160, 9874.21]
  - - [1024, 1024, 1, 3840]
    - [156, 9075.32]
  - - [1024, 4096, 1, 3483]
    - [160, 9915.28]
  - - [1024, 1024, 1, 3956]
    - [159, 9009.93]
  - - [1024, 33708, 1, 3751]
    - [154, 10325.8]
  - - [4096, 1024, 1, 3380]
    - [160, 9888.37]
  - - [1024, 4096, 1, 3380]
    - [153, 9927.15]
  - - [1024, 4096, 1, 3396]
    - [161, 9931.86]
  - - [1024, 4096, 1, 3497]
    - [154, 9914.76]
  - - [1024, 4096, 1, 3502]
    - [161, 9921.42]
  - - [1024, 1024, 1, 3976]
    - [156, 9060.2]
  - - [1024, 4096, 1, 3138]
    - [154, 9908.56]
  - - [4096, 1024, 1, 3939]
    - [153, 9910.13]
  - - [1024, 4096, 1, 3303]
    - [154, 9916.54]
  - - [64, 111, 576, 112]
    - [134, 6495.09]
  - - [1024, 4096, 1, 3418]
    - [160, 9913.25]
  - - [1024, 4096, 1, 3224]
    - [154, 9903.95]
  - - [4096, 1024, 1, 3978]
    - [160, 9896.18]
  - - [1024, 4096, 1, 3472]
    - [153, 9937.38]
  - - [4096, 1024, 1, 3353]
    - [161, 9863.87]
  - - [4096, 1024, 1, 3362]
    - [160, 9870.96]
  - - [1024, 33708, 1, 3978]
    - [153, 10325.3]
  - - [64, 100, 624, 102]
    - [129, 5695.57]
  - - [1024, 4096, 1, 3432]
    - [161, 9915.46]
  - - [1024, 4096, 1, 3139]
    - [160, 9914.11]
  - - [1024, 4096, 1, 3341]
    - [161, 9912.0]
  - - [1024, 4096, 1, 3494]
    - [154, 9924.5]
  - - [1024, 4096, 1, 3969]
    - [153, 9952.18]
  - - [1024, 4096, 1, 3163]
    - [161, 9911.69]
  - - [1024, 1024, 1, 3955]
    - [151, 9097.76]
  - - [4096, 1024, 1, 3405]
    - [160, 9853.74]
  - - [1024, 1024, 1, 4030]
    - [151, 9083.76]
  - - [4096, 1024, 1, 3453]
    - [160, 9858.78]
  - - [1024, 4096, 1, 3411]
    - [161, 9926.44]
  - - [1024, 4096, 1, 3527]
    - [154, 9922.55]
  - - [4096, 1024, 1, 3474]
    - [160, 9878.39]
  - - [1024, 4096, 1, 3572]
    - [160, 9931.9]
  - - [4096, 1024, 1, 3293]
    - [160, 9848.16]
  - - [4096, 1024, 1, 3247]
    - [160, 9861.35]
  - - [64, 15, 4096, 15]
    - [141, 1955.65]
  - - [1024, 4096, 1, 3425]
    - [161, 9936.3]
  - - [1024, 4096, 1, 3354]
    - [153, 9917.45]
  - - [4096, 1024, 1, 3382]
    - [160, 9885.39]
  - - [4096, 1024, 1, 3236]
    - [160, 9860.5]
  - - [1024, 4096, 1, 3519]
    - [161, 9919.2]
  - - [4096, 1024, 1, 3354]
    - [160, 9854.65]
  - - [4096, 1024, 1, 3501]
    - [161, 9869.52]
  - - [1024, 1024, 1, 3906]
    - [159, 9104.89]
  - - [4096, 1024, 1, 3266]
    - [160, 9873.87]
  - - [64, 101, 624, 102]
    - [129, 5765.42]
  - - [1024, 4096, 1, 3368]
    - [160, 9909.67]
  - - [1024, 4096, 1, 4030]
    - [161, 9940.17]
  - - [1024, 4096, 1, 3533]
    - [154, 9916.54]
  - - [4096, 1024, 1, 3332]
    - [161, 9876.35]
  - - [4096, 1024, 1, 3584]
    - [160, 9896.5]
  - - [1024, 4096, 1, 3616]
    - [160, 9957.08]
  - - [4096, 1024, 1, 3265]
    - [160, 9877.68]
  - - [4096, 1024, 1, 3361]
    - [160, 9888.51]
  - - [4096, 1024, 1, 3467]
    - [160, 9863.3]
  - - [1024, 4096, 1, 3454]
    - [154, 9904.79]
  - - [1024, 4096, 1, 3101]
    - [161, 9893.02]
  - - [1024, 4096, 1, 3508]
    - [161, 9931.44]
  - - [4096, 1024, 1, 3267]
    - [160, 9864.38]
  - - [64, 54, 1184, 54]
    - [126, 4905.92]
  - - [4096, 1024, 1, 3419]
    - [160, 9872.46]
  - - [4096, 1024, 1, 3822]
    - [160, 9892.53]
  - - [1024, 4096, 1, 3266]
    - [160, 9918.48]
  - - [4096, 1024, 1, 3440]
    - [161, 9890.06]
  - - [1024, 4096, 1, 3361]
    - [160, 9930.87]
  - - [1024, 4096, 1, 3546]
    - [154, 9926.46]
  - - [4096, 1024, 1, 3473]
    - [160, 9888.96]
  - - [4096, 1024, 1, 3546]
    - [161, 9872.17]
  - - [1024, 4096, 1, 3088]
    - [154, 9917.93]
  - - [1024, 4096, 1, 3535]
    - [161, 9921.1]
  - - [1024, 4096, 1, 3447]
    - [161, 9920.53]
  - - [1024, 4096, 1, 3560]
    - [160, 9925.38]
  - - [1024, 4096, 1, 3422]
    - [154, 9922.11]
  - - [1024, 4096, 1, 3469]
    - [153, 9906.08]
  - - [4096, 1024, 1, 3488]
    - [160, 9903.16]
  - - [1024, 4096, 1, 3110]
    - [160, 9906.66]
  - - [1024, 4096, 1, 3265]
    - [161, 9916.59]
  - - [1024, 4096, 1, 3291]
    - [160, 9902.63]
  - - [1024, 4096, 1, 3390]
    - [161, 9907.12]
  - - [4096, 1024, 1, 3046]
    - [160, 9847.58]
  - - [1024, 4096, 1, 3539]
    - [161, 9933.39]
  - - [4096, 1024, 1, 3221]
    - [161, 9860.64]
  - - [4096, 1024, 1, 3433]
    - [160, 9872.64]
  - - [4096, 1024, 1, 3364]
    - [161, 9881.81]
  - - [4096, 1024, 1, 3470]
    - [160, 9858.46]
  - - [1024, 4096, 1, 3404]
    - [153, 9907.17]
  - - [1024, 33708, 1, 3968]
    - [154, 10350.2]
  - - [4096, 1024, 1, 3088]
    - [160, 9868.96]
  - - [1024, 4096, 1, 3247]
    - [160, 9900.92]
  - - [1024, 33708, 1, 3996]
    - [153, 10328.4]
  - - [4096, 1024, 1, 3482]
    - [161, 9866.89]
  - - [1024, 1024, 1, 3796]
    - [156, 9031.58]
  - - [4096, 1024, 1, 3995]
    - [161, 9896.68]
  - - [1024, 1024, 1, 3859]
    - [158, 9097.26]
  - - [1024, 4096, 1, 3280]
    - [154, 9933.95]
  - - [4096, 1024, 1, 3271]
    - [161, 9859.99]
  - - [64, 10, 5952, 10]
    - [141, 1220.92]
  - - [4096, 1024, 1, 3545]
    - [160, 9877.25]
  - - [4096, 1024, 1, 3476]
    - [153, 9882.47]
  - - [4096, 1024, 1, 3496]
    - [154, 9880.4]
  - - [4096, 1024, 1, 3191]
    - [154, 9858.6]
  - - [4096, 1024, 1, 3311]
    - [161, 9853.1]
  - - [1024, 4096, 1, 3302]
    - [161, 9919.22]
  - - [1024, 4096, 1, 3681]
    - [160, 9944.89]
  - - [4096, 1024, 1, 3582]
    - [153, 9869.67]
  - - [4096, 1024, 1, 3421]
    - [161, 9855.98]
  - - [4096, 1024, 1, 3560]
    - [154, 9884.38]
  - - [1024, 4096, 1, 3495]
    - [161, 9930.03]
  - - [4096, 1024, 1, 3186]
    - [160, 9870.49]
  - - [4096, 1024, 1, 3925]
    - [160, 9903.9]
  - - [64, 71, 896, 71]
    - [145, 5004.69]
  - - [1024, 4096, 1, 3435]
    - [161, 9916.48]
  - - [4096, 1024, 1, 3434]
    - [160, 9871.19]
  - - [1024, 33708, 1, 4012]
    - [153, 10332.4]
  - - [1024, 4096, 1, 3340]
    - [153, 9918.01]
  - - [1024, 1024, 1, 3860]
    - [151, 8999.26]
  - - [4096, 1024, 1, 3489]
    - [160, 9881.92]
  - - [1024, 4096, 1, 3162]
    - [161, 9906.18]
  - - [4096, 1024, 1, 3436]
    - [160, 9858.02]
  - - [1024, 1024, 1, 4005]
    - [157, 9042.96]
  - - [64, 84, 752, 84]
    - [130, 5629.83]
  - - [4096, 1024, 1, 3574]
    - [160, 9886.6]
  - - [4096, 1024, 1, 3469]
    - [153, 9856.16]
  - - [1024, 4096, 1, 3410]
    - [154, 9924.64]
  - - [1024, 4096, 1, 3216]
    - [153, 9930.57]
  - - [4096, 1024, 1, 3095]
    - [160, 9846.91]
  - - [1024, 1024, 1, 3990]
    - [159, 9088.94]
  - - [4096, 1024, 1, 3448]
    - [160, 9863.84]
  - - [1024, 4096, 1, 3176]
    - [161, 9913.91]
  - - [64, 49, 1296, 49]
    - [126, 4437.36]
  - - [4096, 1024, 1, 2918]
    - [160, 9830.83]
  - - [64, 14, 4368, 14]
    - [140, 1802.37]
  - - [1024, 4096, 1, 3424]
    - [160, 9933.95]
  - - [4096, 1024, 1, 3402]
    - [153, 9863.02]
  - - [4096, 1024, 1, 3145]
    - [154, 9856.46]
  - - [64, 134, 480, 134]
    - [146, 6183.95]
  - - [1024, 33708, 1, 3976]
    - [154, 10330.0]
  - - [4096, 1024, 1, 3518]
    - [153, 9855.97]
  - - [4096, 1024, 1, 3110]
    - [160, 9856.36]
  - - [4096, 1024, 1, 3325]
    - [160, 9852.26]
  - - [1024, 33708, 1, 3999]
    - [153, 10329.6]
  - - [4096, 1024, 1, 2985]
    - [160, 9837.2]
  - - [1024, 4096, 1, 3371]
    - [153, 9912.93]
  - - [4096, 1024, 1, 3342]
    - [160, 9863.06]
  - - [4096, 1024, 1, 3141]
    - [154, 9849.81]
  - - [4096, 1024, 1, 3532]
    - [154, 9866.2]
  - - [64, 78, 816, 78]
    - [131, 5316.78]
  - - [1024, 4096, 1, 3169]
    - [161, 9910.35]
  - - [1024, 4096, 1, 3514]
    - [160, 9917.9]
  - - [4096, 1024, 1, 3780]
    - [161, 9899.65]
  - - [1024, 4096, 1, 3098]
    - [153, 9901.52]
  - - [1024, 4096, 1, 3449]
    - [161, 9919.75]
  - - [1024, 4096, 1, 3222]
    - [153, 9917.56]
  - - [1024, 4096, 1, 3346]
    - [154, 9912.81]
  - - [4096, 1024, 1, 3064]
    - [161, 9848.69]
  - - [4096, 1024, 1, 3511]
    - [160, 9873.29]
  - - [4096, 1024, 1, 3384]
    - [160, 9870.88]
  - - [4096, 1024, 1, 3356]
    - [154, 9853.35]
  - - [1024, 4096, 1, 3796]
    - [153, 9940.56]
  - - [4096, 1024, 1, 3427]
    - [160, 9883.04]
  - - [4096, 1024, 1, 3390]
    - [160, 9863.69]
  - - [4096, 1024, 1, 3573]
    - [161, 9885.92]
  - - [4096, 1024, 1, 3456]
    - [154, 9890.51]
  - - [1024, 4096, 1, 3360]
    - [161, 9938.0]
  - - [1024, 33708, 1, 3977]
    - [154, 10327.1]
  - - [1024, 4096, 1, 2918]
    - [153, 9902.74]
  - - [4096, 1024, 1, 3975]
    - [160, 9905.17]
  - - [4096, 1024, 1, 3525]
    - [161, 9879.81]
  - - [4096, 1024, 1, 3398]
    - [153, 9873.81]
  - - [4096, 1024, 1, 3640]
    - [160, 9885.06]
  - - [1024, 1024, 1, 3999]
    - [152, 8995.32]
  - - [4096, 1024, 1, 3014]
    - [160, 9841.22]
  - - [1024, 4096, 1, 3446]
    - [153, 9917.11]
  - - [1024, 33708, 1, 3796]
    - [153, 10338.9]
  - - [4096, 1024, 1, 3101]
    - [153, 9827.24]
  - - [4096, 1024, 1, 3563]
    - [161, 9862.93]
  - - [4096, 1024, 1, 3539]
    - [153, 9889.44]
  - - [4096, 1024, 1, 3182]
    - [160, 9833.69]
  - - [1024, 4096, 1, 3468]
    - [154, 9912.95]
  - - [4096, 1024, 1, 3312]
    - [160, 9889.75]
  - - [4096, 1024, 1, 3215]
    - [160, 9853.78]
  - - [4096, 1024, 1, 3910]
    - [160, 9894.62]
  - - [1024, 33708, 1, 3780]
    - [154, 10331.9]
  - - [1024, 4096, 1, 3290]
    - [160, 9914.98]
  - - [1024, 4096, 1, 4012]
    - [160, 9942.55]
  - - [1024, 4096, 1, 3385]
    - [160, 9915.73]
  - - [1024, 33708, 1, 3975]
    - [153, 10330.0]
  - - [4096, 1024, 1, 3996]
    - [160, 9891.21]
  - - [4096, 1024, 1, 2765]
    - [161, 9800.28]
  - - [4096, 1024, 1, 3538]
    - [161, 9886.12]
  - - [4096, 1024, 1, 3415]
    - [161, 9874.5]
  - - [1024, 4096, 1, 3554]
    - [160, 9931.89]
  - - [4096, 1024, 1, 3513]
    - [154, 9874.15]
  - - [1024, 4096, 1, 3304]
    - [154, 9907.63]
  - - [4096, 1024, 1, 3294]
    - [160, 9851.15]
  - - [4096, 1024, 1, 3396]
    - [161, 9880.6]
  - - [1024, 4096, 1, 3213]
    - [154, 9891.02]
  - - [4096, 1024, 1, 3137]
    - [154, 9857.31]
  - - [4096, 1024, 1, 3552]
    - [160, 9904.12]
  - - [1024, 1024, 1, 4020]
    - [159, 9098.77]
  - - [64, 13, 4672, 13]
    - [141, 1693.44]
  - - [1024, 4096, 1, 3461]
    - [160, 9918.35]
  - - [4096, 1024, 1, 3263]
    - [153, 9843.79]
  - - [4096, 1024, 1, 3430]
    - [160, 9885.16]
  - - [4096, 1024, 1, 3389]
    - [160, 9859.13]
  - - [4096, 1024, 1, 3528]
    - [160, 9872.91]
  - - [1024, 4096, 1, 3463]
    - [161, 9929.51]
  - - [4096, 1024, 1, 3526]
    - [161, 9876.8]
  - - [4096, 1024, 1, 3154]
    - [160, 9858.15]
  - - [4096, 1024, 1, 3499]
    - [161, 9862.82]
  - - [1024, 1024, 1, 3939]
    - [159, 9107.31]
  - - [4096, 1024, 1, 3955]
    - [161, 9906.18]
  - - [1024, 4096, 1, 3297]
    - [154, 9925.24]
  - - [1024, 4096, 1, 3233]
    - [160, 9920.55]
  - - [1024, 4096, 1, 3226]
    - [160, 9911.25]
  - - [4096, 1024, 1, 3404]
    - [160, 9867.18]
  - - [4096, 1024, 1, 3355]
    - [160, 9862.56]
  - - [1024, 4096, 1, 3542]
    - [160, 9926.39]
  - - [4096, 1024, 1, 3181]
    - [161, 9831.76]
  - - [1024, 4096, 1, 3474]
    - [160, 9927.93]
  - - [4096, 1024, 1, 3319]
    - [160, 9870.18]
  - - [1024, 4096, 1, 3434]
    - [153, 9917.41]
  - - [1024, 4096, 1, 3860]
    - [160, 9945.22]
  - - [1024, 4096, 1, 3343]
    - [153, 9914.56]
  - - [64, 77, 816, 78]
    - [131, 5276.87]
  - - [1024, 4096, 1, 3488]
    - [160, 9945.71]
  - - [1024, 4096, 1, 3046]
    - [160, 9908.68]
  - - [1024, 4096, 1, 3141]
    - [161, 9909.08]
  - - [1024, 4096, 1, 3516]
    - [161, 9911.28]
  - - [4096, 1024, 1, 3147]
    - [160, 9840.37]
  - - [1024, 1024, 1, 4059]
    - [152, 9009.68]
  - - [1024, 1024, 1, 3944]
    - [152, 9006.07]
  - - [1024, 4096, 1, 3421]
    - [161, 9919.76]
  - - [4096, 1024, 1, 3944]
    - [154, 9899.43]
  - - [64, 45, 1424, 45]
    - [139, 4068.57]
  - - [1024, 4096, 1, 3574]
    - [154, 9930.09]
  - - [1024, 4096, 1, 3977]
    - [153, 9944.18]
  - - [1024, 1024, 1, 3968]
    - [158, 9045.12]
  - - [1024, 4096, 1, 2985]
    - [160, 9887.55]
  - - [64, 193, 320, 193]
    - [147, 6631.25]
  - - [1024, 4096, 1, 3427]
    - [161, 9933.31]
  - - [64, 12, 5040, 12]
    - [141, 1552.43]
  - - [1024, 4096, 1, 3482]
    - [161, 9942.12]
  - - [1024, 4096, 1, 3332]
    - [153, 9923.48]
  - - [1024, 1024, 1, 3720]
    - [157, 9039.46]
  - - [4096, 1024, 1, 3308]
    - [161, 9852.56]
  - - [1024, 4096, 1, 3513]
    - [161, 9919.89]
  - - [1024, 4096, 1, 3154]
    - [154, 9908.36]
  - - [1024, 4096, 1, 3955]
    - [161, 9949.91]
  - - [1024, 4096, 1, 2967]
    - [161, 9897.34]
  - - [1024, 33708, 1, 3942]
    - [153, 10336.0]
  - - [1024, 4096, 1, 3319]
    - [161, 9912.35]
  - - [4096, 1024, 1, 3860]
    - [160, 9909.19]
  - - [1024, 4096, 1, 3548]
    - [153, 9924.11]
  - - [4096, 1024, 1, 3977]
    - [161, 9891.34]
  - - [4096, 1024, 1, 3535]
    - [160, 9867.74]
  - - [1024, 4096, 1, 3541]
    - [161, 9923.06]
  - - [1024, 1024, 1, 3910]
    - [158, 9080.3]
  - - [1024, 33708, 1, 3584]
    - [153, 10332.9]
  - - [1024, 4096, 1, 3168]
    - [154, 9926.17]
  - - [1024, 4096, 1, 3448]
    - [161, 9922.32]
  - - [4096, 1024, 1, 3343]
    - [160, 9857.13]
  - - [64, 35, 1808, 35]
    - [143, 3175.34]
  - - [1024, 4096, 1, 3357]
    - [154, 9902.31]
  - - [64, 143, 432, 143]
    - [144, 6489.6]
  - - [4096, 1024, 1, 3510]
    - [160, 9867.3]
  - - [4096, 1024, 1, 3369]
    - [160, 9863.34]
  - - [64, 92, 688, 93]
    - [131, 6188.2]
  - - [4096, 1024, 1, 3379]
    - [160, 9870.02]
  - - [1024, 4096, 1, 3276]
    - [160, 9904.67]
  - - [1024, 4096, 1, 3363]
    - [160, 9925.03]
  - - [4096, 1024, 1, 3055]
    - [160, 9831.82]
  - - [1024, 4096, 1, 3524]
    - [153, 9923.69]
  - - [4096, 1024, 1, 3057]
    - [160, 9852.77]
  - - [1024, 33708, 1, 3720]
    - [154, 10327.0]
  - - [1024, 4096, 1, 3383]
    - [153, 9919.29]
  - - [1024, 4096, 1, 3522]
    - [154, 9932.46]
  - - [1024, 33708, 1, 3956]
    - [153, 10333.7]
  - - [1024, 4096, 1, 3481]
    - [153, 9921.98]
  - - [4096, 1024, 1, 3562]
    - [161, 9874.76]
  - - [4096, 1024, 1, 3299]
    - [160, 9872.87]
  - - [1024, 4096, 1, 3262]
    - [154, 9924.73]
  - - [1024, 4096, 1, 3840]
    - [153, 9961.74]
  - - [1024, 33708, 1, 4026]
    - [153, 10334.2]
  - - [4096, 1024, 1, 3168]
    - [154, 9878.35]
  - - [64, 101, 624, 101]
    - [134, 5734.62]
  - - [1024, 4096, 1, 3999]
    - [153, 9947.0]
  - - [1024, 4096, 1, 3549]
    - [153, 9923.2]
  - - [4096, 1024, 1, 3375]
    - [160, 9868.79]
  - - [1024, 4096, 1, 3496]
    - [161, 9928.57]
  - - [64, 29, 2176, 29]
    - [130, 3289.92]
  - - [1024, 4096, 1, 3190]
    - [161, 9897.51]
  - - [4096, 1024, 1, 3273]
    - [161, 9853.55]
  - - [1024, 4096, 1, 3406]
    - [160, 9906.94]
  - - [4096, 1024, 1, 4005]
    - [153, 9907.87]
  - - [4096, 1024, 1, 3555]
    - [160, 9878.86]
  - - [4096, 1024, 1, 2505]
    - [160, 9785.0]
  - - [1024, 4096, 1, 3460]
    - [160, 9930.14]
  - - [64, 17, 3632, 17]
    - [131, 1917.17]
  - - [1024, 4096, 1, 3579]
    - [154, 9920.84]
  - - [1024, 33708, 1, 4030]
    - [154, 10327.6]
  - - [1024, 4096, 1, 3510]
    - [154, 9931.21]
  - - [1024, 1024, 1, 3969]
    - [151, 9020.73]
  - - [1024, 4096, 1, 3282]
    - [161, 9919.95]
  - - [1024, 4096, 1, 3377]
    - [153, 9927.24]
  - - [1024, 4096, 1, 2935]
    - [161, 9903.38]
  - - [64, 41, 1552, 41]
    - [131, 3740.38]
  - - [1024, 4096, 1, 3498]
    - [153, 9914.91]
  - - [1024, 4096, 1, 3593]
    - [160, 9925.54]
  - - [1024, 1024, 1, 3948]
    - [159, 9008.93]
  - - [4096, 1024, 1, 3226]
    - [161, 9854.65]
  - - [1024, 4096, 1, 2499]
    - [160, 9904.72]
  - - [1024, 4096, 1, 3296]
    - [153, 9926.79]
  - - [1024, 4096, 1, 3455]
    - [160, 9917.42]
  - - [1024, 4096, 1, 3399]
    - [154, 9919.6]
  - - [1024, 4096, 1, 3205]
    - [153, 9917.64]
  - - [4096, 1024, 1, 4026]
    - [161, 9897.71]
  - - [1024, 4096, 1, 3484]
    - [153, 9915.43]
  - - [4096, 1024, 1, 3302]
    - [161, 9862.7]
  - - [1024, 4096, 1, 3485]
    - [161, 9912.9]
  - - [1024, 1024, 1, 3996]
    - [159, 9008.67]
  - - [1024, 4096, 1, 3126]
    - [154, 9910.06]
  - - [1024, 4096, 1, 4050]
    - [153, 9951.11]
  - - [4096, 1024, 1, 3235]
    - [154, 9870.64]
  - - [1024, 33708, 1, 3955]
    - [153, 10336.0]
  - - [1024, 4096, 1, 3342]
    - [153, 9903.75]
  - - [1024, 1024, 1, 3900]
    - [158, 9082.82]
  - - [1024, 4096, 1, 3397]
    - [161, 9922.6]
  - - [4096, 1024, 1, 3491]
    - [161, 9880.65]
  - - [1024, 4096, 1, 3503]
    - [153, 9923.18]
  - - [1024, 4096, 1, 3140]
    - [154, 9908.31]
  - - [4096, 1024, 1, 3121]
    - [160, 9860.22]
  - - [4096, 1024, 1, 3276]
    - [160, 9854.09]
  - - [1024, 4096, 1, 3321]
    - [161, 9917.76]
  - - [1024, 4096, 1, 3870]
    - [161, 9930.97]
  - - [4096, 1024, 1, 3475]
    - [160, 9877.48]
  - - [1024, 4096, 1, 2984]
    - [160, 9895.49]
  - - [4096, 1024, 1, 3363]
    - [154, 9873.34]
  - - [1024, 4096, 1, 3582]
    - [160, 9920.77]
  - - [4096, 1024, 1, 3509]
    - [160, 9886.76]
  - - [1024, 4096, 1, 3426]
    - [153, 9928.76]
  - - [4096, 1024, 1, 3136]
    - [160, 9872.51]
  - - [1024, 4096, 1, 3232]
    - [161, 9926.19]
  - - [4096, 1024, 1, 3103]
    - [160, 9838.93]
  - - [1024, 4096, 1, 3335]
    - [154, 9913.27]
  - - [1024, 4096, 1, 3900]
    - [153, 9937.91]
  - - [4096, 1024, 1, 3512]
    - [154, 9877.16]
  - - [4096, 1024, 1, 3222]
    - [160, 9859.67]
  - - [1024, 4096, 1, 3165]
    - [160, 9899.61]
  - - [4096, 1024, 1, 3408]
    - [160, 9899.58]
  - - [4096, 1024, 1, 3751]
    - [160, 9891.39]
  - - [1024, 4096, 1, 3318]
    - [153, 9913.32]
  - - [4096, 1024, 1, 3442]
    - [161, 9880.11]
  - - [1024, 4096, 1, 3413]
    - [160, 9921.8]
  - - [4096, 1024, 1, 3524]
    - [160, 9879.12]
  - - [1024, 4096, 1, 3976]
    - [161, 9945.47]
  - - [1024, 4096, 1, 3475]
    - [161, 9932.41]
  - - [1024, 4096, 1, 3534]
    - [153, 9911.39]
  - - [4096, 1024, 1, 3301]
    - [160, 9872.65]
  - - [4096, 1024, 1, 3248]
    - [160, 9878.12]
  - - [1024, 4096, 1, 2977]
    - [154, 9899.83]
  - - [4096, 1024, 1, 3346]
    - [160, 9875.97]
  - - [1024, 4096, 1, 3451]
    - [153, 9920.06]
  - - [1024, 4096, 1, 3257]
    - [154, 9904.92]
  - - [1024, 1024, 1, 3640]
    - [152, 8983.29]
  - - [1024, 4096, 1, 3356]
    - [153, 9904.38]
  - - [4096, 1024, 1, 3348]
    - [161, 9872.43]
  - - [4096, 1024, 1, 3335]
    - [160, 9865.72]
  - - [4096, 1024, 1, 3505]
    - [160, 9888.78]
  - - [1024, 4096, 1, 3490]
    - [153, 9937.9]
  - - [4096, 1024, 1, 3447]
    - [160, 9865.29]
  - - [1024, 4096, 1, 3267]
    - [161, 9919.22]
  - - [4096, 1024, 1, 3230]
    - [160, 9853.1]
  - - [4096, 1024, 1, 3455]
    - [160, 9862.34]
  - - [1024, 4096, 1, 3925]
    - [153, 9945.54]
  - - [1024, 4096, 1, 3362]
    - [154, 9921.53]
  - - [4096, 1024, 1, 3969]
    - [161, 9911.88]
  - - [4096, 1024, 1, 3527]
    - [160, 9882.77]
  - - [1024, 4096, 1, 3585]
    - [154, 9946.42]
  - - [4096, 1024, 1, 3063]
    - [160, 9853.93]
  - - [4096, 1024, 1, 3435]
    - [160, 9867.03]
  - - [4096, 1024, 1, 3366]
    - [161, 9863.92]
  - - [4096, 1024, 1, 3581]
    - [153, 9868.47]
  - - [1024, 33708, 1, 3906]
    - [153, 10339.2]
  - - [1024, 4096, 1, 3464]
    - [161, 9916.11]
  - - [1024, 4096, 1, 3440]
    - [160, 9945.15]
  - - [4096, 1024, 1, 3143]
    - [160, 9846.66]
  - - [1024, 4096, 1, 3349]
    - [154, 9912.73]
  - - [4096, 1024, 1, 3416]
    - [160, 9885.03]
  - - [4096, 1024, 1, 3365]
    - [160, 9875.9]
  - - [1024, 4096, 1, 3470]
    - [161, 9914.88]
  - - [4096, 1024, 1, 3287]
    - [160, 9860.59]
  - - [1024, 4096, 1, 3441]
    - [161, 9928.88]
  - - [4096, 1024, 1, 3224]
    - [160, 9857.73]
  - - [1024, 4096, 1, 3387]
    - [153, 9911.62]
  - - [1024, 4096, 1, 3547]
    - [153, 9920.26]
  - - [4096, 1024, 1, 3478]
    - [154, 9882.8]
  - - [4096, 1024, 1, 3548]
    - [161, 9869.35]
  - - [1024, 33708, 1, 4020]
    - [153, 10345.2]
  - - [4096, 1024, 1, 3320]
    - [160, 9863.64]
  - - [1024, 4096, 1, 3906]
    - [160, 9942.57]
  - - [4096, 1024, 1, 3796]
    - [160, 9899.03]
  - - [1024, 4096, 1, 3306]
    - [153, 9902.3]
  - - [1024, 4096, 1, 3401]
    - [161, 9913.85]
  - - [64, 147, 432, 147]
    - [144, 6626.5]
  - - [1024, 4096, 1, 3215]
    - [161, 9911.14]
  - - [4096, 1024, 1, 4012]
    - [161, 9898.1]
  - - [1024, 4096, 1, 2765]
    - [161, 9863.63]
  - - [4096, 1024, 1, 3554]
    - [154, 9883.42]
  - - [4096, 1024, 1, 3423]
    - [160, 9866.62]
  - - [1024, 1024, 1, 3751]
    - [158, 9006.26]
  - - [1024, 4096, 1, 3562]
    - [154, 9921.98]
  - - [1024, 4096, 1, 3489]
    - [153, 9936.68]
  - - [4096, 1024, 1, 3358]
    - [160, 9858.12]
  - - [4096, 1024, 1, 3270]
    - [161, 9850.74]
  - - [1024, 4096, 1, 3293]
    - [153, 9905.23]
  - - [1024, 4096, 1, 3376]
    - [153, 9934.88]
  - - [4096, 1024, 1, 3245]
    - [160, 9852.42]
  - - [4096, 1024, 1, 3541]
    - [160, 9887.12]
  - - [4096, 1024, 1, 3443]
    - [160, 9871.63]
  - - [4096, 1024, 1, 3438]
    - [161, 9863.76]
  - - [4096, 1024, 1, 3244]
    - [160, 9859.66]
  - - [1024, 4096, 1, 3365]
    - [160, 9922.0]
  - - [1024, 4096, 1, 3299]
    - [154, 9923.28]
  - - [4096, 1024, 1, 3840]
    - [160, 9914.65]
  - - [1024, 4096, 1, 3471]
    - [161, 9918.28]
  - - [1024, 4096, 1, 3398]
    - [153, 9918.89]
  - - [4096, 1024, 1, 3162]
    - [160, 9843.83]
  - - [1024, 4096, 1, 4005]
    - [154, 9947.77]
  - - [4096, 1024, 1, 3579]
    - [160, 9868.15]
  - - [64, 18, 3440, 18]
    - [136, 2059.23]
  - - [64, 177, 352, 177]
    - [155, 7315.3]
  - - [1024, 4096, 1, 3121]
    - [161, 9930.24]
  - - [4096, 1024, 1, 3441]
    - [160, 9883.18]
  - - [4096, 1024, 1, 3422]
    - [160, 9858.31]
  - - [4096, 1024, 1, 3444]
    - [160, 9886.93]
  - - [1024, 4096, 1, 3337]
    - [154, 9911.35]
  - - [4096, 1024, 1, 3550]
    - [153, 9871.77]
  - - [1024, 4096, 1, 3477]
    - [153, 9930.55]
  - - [4096, 1024, 1, 3490]
    - [160, 9878.35]
  - - [4096, 1024, 1, 3585]
    - [160, 9893.53]
  - - [1024, 4096, 1, 3143]
    - [153, 9901.09]
  - - [1024, 33708, 1, 3876]
    - [154, 10330.7]
  - - [1024, 4096, 1, 3320]
    - [161, 9913.08]
  - - [1024, 4096, 1, 3423]
    - [161, 9914.04]
  - - [1024, 4096, 1, 3894]
    - [153, 9944.37]
  - - [4096, 1024, 1, 3410]
    - [160, 9878.57]
  - - [1024, 4096, 1, 3561]
    - [153, 9926.58]
  - - [4096, 1024, 1, 3492]
    - [154, 9872.82]
  - - [64, 85, 752, 85]
    - [131, 5734.25]
  - - [1024, 128, 1, 128]
    - [166, 1028.12]
  - - [4, 704, 1, 1280]
    - [205, 363.455]
  - - [4, 1856, 1, 3328]
    - [205, 579.534]
  - - [1856, 448, 1, 3328]
    - [242, 6966.83]
  - - [2944, 4288, 1, 1280]
    - [237, 9057.98]
  - - [2368, 64, 1, 3328]
    - [198, 5837.66]
  - - [2368, 5888, 1, 256]
    - [242, 9111.16]
  - - [128, 64, 1, 256]
    - [204, 374.591]
  - - [5888, 1024, 1, 1280]
    - [247, 8570.54]
  - - [128, 6784, 1, 3328]
    - [210, 7703.96]
  - - [64, 4, 1, 256]
    - [256, 11.3219]
  - - [5888, 1856, 1, 3328]
    - [242, 9394.4]
  - - [5056, 704, 1, 256]
    - [245, 8026.99]
  - - [5888, 2944, 1, 3328]
    - [235, 7608.21]
  - - [1856, 4288, 1, 256]
    - [236, 8986.42]
  - - [1024, 5056, 1, 128]
    - [228, 3898.34]
  - - [5056, 5056, 1, 3328]
    - [236, 9536.85]
  - - [1408, 5888, 1, 1280]
    - [237, 9279.19]
  - - [2368, 448, 1, 128]
    - [229, 2474.42]
  - - [1024, 3584, 1, 3328]
    - [239, 9258.58]
  - - [4, 2944, 1, 1280]
    - [191, 611.84]
  - - [1408, 64, 1, 128]
    - [162, 858.31]
  - - [256, 4288, 1, 3328]
    - [242, 7616.08]
  - - [5888, 1408, 1, 1280]
    - [235, 9620.39]
  - - [704, 1856, 1, 3328]
    - [236, 9033.75]
  - - [4, 1408, 1, 128]
    - [249, 24.455]
  - - [1024, 2368, 1, 256]
    - [236, 7526.25]
  - - [1408, 1856, 1, 1280]
    - [239, 8324.19]
  - - [1408, 64, 1, 1280]
    - [210, 4681.24]
  - - [448, 1024, 1, 1280]
    - [236, 7112.53]
  - - [256, 1408, 1, 3328]
    - [242, 5825.51]
  - - [5056, 5056, 1, 1280]
    - [245, 9233.65]
  - - [448, 5056, 1, 256]
    - [237, 7003.27]
  - - [704, 1856, 1, 1280]
    - [236, 8877.38]
  - - [128, 5056, 1, 128]
    - [228, 2301.14]
  - - [2368, 128, 1, 256]
    - [236, 3849.04]
  - - [1856, 1408, 1, 128]
    - [231, 4202.31]
  - - [64, 5056, 1, 256]
    - [237, 3109.62]
  - - [6784, 256, 1, 3328]
    - [236, 6388.53]
  - - [6784, 4288, 1, 3328]
    - [247, 9114.67]
  - - [4288, 448, 1, 256]
    - [240, 5783.05]
  - - [64, 704, 1, 128]
    - [173, 379.519]
  - - [1856, 2368, 1, 3328]
    - [236, 9128.46]
  - - [4288, 2944, 1, 1280]
    - [242, 9182.33]
  - - [704, 5056, 1, 1280]
    - [236, 9071.57]
  - - [2368, 704, 1, 3328]
    - [242, 7731.43]
  - - [256, 5888, 1, 256]
    - [236, 7920.38]
  - - [1856, 4288, 1, 3328]
    - [242, 9330.07]
  - - [256, 2944, 1, 256]
    - [243, 5312.27]
  - - [5888, 1024, 1, 256]
    - [234, 6710.97]
  - - [448, 64, 1, 1280]
    - [209, 2814.53]
  - - [448, 5056, 1, 3328]
    - [236, 8255.53]
  - - [3584, 4, 1, 1280]
    - [185, 640.815]
  - - [2944, 64, 1, 256]
    - [184, 2621.54]
  - - [128, 4, 1, 1280]
    - [256, 86.3316]
  - - [1408, 2944, 1, 256]
    - [236, 8848.99]
  - - [256, 1856, 1, 1280]
    - [236, 7366.55]
  - - [6784, 5056, 1, 3328]
    - [247, 8332.16]
  - - [5056, 5056, 1, 256]
    - [242, 9171.74]
  - - [1408, 6784, 1, 128]
    - [228, 5079.19]
  - - [64, 1024, 1, 1280]
    - [200, 3679.31]
  - - [2944, 4, 1, 256]
    - [191, 369.543]
  - - [704, 5056, 1, 128]
    - [228, 4509.27]
  - - [4, 2368, 1, 1280]
    - [185, 569.844]
  - - [2368, 2944, 1, 1280]
    - [247, 7451.14]
  - - [128, 3584, 1, 1280]
    - [245, 6071.26]
  - - [6784, 6784, 1, 1280]
    - [242, 9535.74]
  - - [1024, 256, 1, 3328]
    - [236, 5742.68]
  - - [1408, 4288, 1, 1280]
    - [245, 8255.09]
  - - [3584, 4288, 1, 1280]
    - [247, 9651.19]
  - - [2368, 704, 1, 1280]
    - [242, 8291.4]
  - - [5056, 4288, 1, 3328]
    - [234, 9406.36]
  - - [3584, 2368, 1, 3328]
    - [242, 9350.32]
  - - [64, 704, 1, 1280]
    - [209, 3384.59]
  - - [4288, 256, 1, 256]
    - [242, 5593.62]
  - - [2944, 128, 1, 128]
    - [164, 2130.6]
  - - [6784, 448, 1, 1280]
    - [245, 8815.85]
  - - [1408, 2944, 1, 128]
    - [228, 4558.34]
  - - [4288, 2944, 1, 256]
    - [247, 7865.43]
  - - [5888, 704, 1, 1280]
    - [236, 9262.99]
  - - [1856, 64, 1, 1280]
    - [210, 4359.15]
  - - [448, 5888, 1, 128]
    - [231, 4000.59]
  - - [5888, 64, 1, 3328]
    - [211, 6603.39]
  - - [2944, 256, 1, 3328]
    - [236, 8423.63]
  - - [1024, 64, 1, 128]
    - [181, 582.642]
  - - [5056, 2368, 1, 1280]
    - [236, 9419.91]
  - - [448, 3584, 1, 1280]
    - [236, 7985.82]
  - - [6784, 5888, 1, 256]
    - [234, 9494.36]
  - - [704, 1024, 1, 128]
    - [228, 2813.35]
  - - [704, 128, 1, 1280]
    - [210, 4477.71]
  - - [5888, 2944, 1, 128]
    - [231, 4745.96]
  - - [4, 3584, 1, 128]
    - [248, 96.479]
  - - [1408, 448, 1, 1280]
    - [236, 6912.8]
  - - [1024, 1408, 1, 256]
    - [244, 5810.85]
  - - [2368, 2368, 1, 3328]
    - [245, 9088.71]
  - - [1856, 6784, 1, 128]
    - [231, 5168.32]
  - - [5056, 704, 1, 3328]
    - [237, 7464.9]
  - - [1408, 1856, 1, 256]
    - [242, 6727.69]
  - - [1408, 704, 1, 3328]
    - [242, 8379.53]
  - - [2368, 5056, 1, 256]
    - [242, 8664.11]
  - - [5888, 1856, 1, 256]
    - [247, 5810.02]
  - - [4288, 64, 1, 3328]
    - [224, 6583.94]
  - - [2368, 4, 1, 1280]
    - [257, 545.251]
  - - [704, 5888, 1, 256]
    - [242, 8813.71]
  - - [4288, 64, 1, 256]
    - [200, 3059.97]
  - - [6784, 64, 1, 256]
    - [242, 3490.96]
  - - [2944, 256, 1, 256]
    - [236, 6970.4]
  - - [2944, 6784, 1, 3328]
    - [236, 9475.79]
  - - [704, 1408, 1, 3328]
    - [236, 8154.18]
  - - [3584, 704, 1, 3328]
    - [236, 8995.07]
  - - [2944, 256, 1, 128]
    - [228, 2824.13]
  - - [6784, 4, 1, 1280]
    - [185, 625.714]
  - - [1024, 64, 1, 1280]
    - [197, 3307.91]
  - - [448, 4288, 1, 256]
    - [242, 6074.48]
  - - [64, 3584, 1, 3328]
    - [190, 6200.26]
  - - [704, 2368, 1, 1280]
    - [236, 8291.4]
  - - [448, 2944, 1, 128]
    - [228, 3221.87]
  - - [1856, 2368, 1, 1280]
    - [247, 6855.24]
  - - [2368, 128, 1, 3328]
    - [198, 6479.61]
  - - [2944, 128, 1, 256]
    - [236, 3828.23]
  - - [448, 1408, 1, 256]
    - [237, 4525.9]
  - - [1856, 4288, 1, 1280]
    - [235, 9160.32]
  - - [64, 5056, 1, 3328]
    - [218, 6819.3]
  - - [4, 704, 1, 256]
    - [202, 123.541]
  - - [1024, 448, 1, 128]
    - [231, 1989.27]
  - - [704, 4, 1, 1280]
    - [205, 381.931]
  - - [704, 256, 1, 128]
    - [228, 1109.17]
  - - [704, 2944, 1, 128]
    - [228, 4089.03]
  - - [1408, 1024, 1, 1280]
    - [242, 8192.08]
  - - [704, 6784, 1, 256]
    - [236, 6717.9]
  - - [6784, 704, 1, 256]
    - [242, 5429.22]
  - - [5056, 1408, 1, 128]
    - [228, 4954.5]
  - - [256, 3584, 1, 3328]
    - [236, 7890.96]
  - - [4, 5888, 1, 3328]
    - [253, 691.047]
  - - [128, 1408, 1, 128]
    - [175, 1393.14]
  - - [3584, 4288, 1, 3328]
    - [238, 8900.87]
  - - [5888, 1856, 1, 1280]
    - [239, 9345.85]
  - - [5056, 1024, 1, 3328]
    - [240, 7834.84]
  - - [5056, 64, 1, 1280]
    - [218, 5890.14]
  - - [1024, 704, 1, 256]
    - [236, 6007.57]
  - - [1024, 4288, 1, 128]
    - [230, 3497.09]
  - - [4288, 64, 1, 1280]
    - [215, 4726.59]
  - - [2368, 3584, 1, 1280]
    - [234, 8128.82]
  - - [2368, 6784, 1, 1280]
    - [234, 9478.72]
  - - [1024, 256, 1, 256]
    - [242, 4092.1]
  - - [1856, 4, 1, 1280]
    - [257, 509.903]
  - - [448, 448, 1, 256]
    - [242, 3001.28]
  - - [2944, 3584, 1, 3328]
    - [243, 9081.91]
  - - [128, 4288, 1, 128]
    - [163, 2323.33]
  - - [64, 448, 1, 256]
    - [206, 1066.97]
  - - [128, 1024, 1, 3328]
    - [219, 6392.36]
  - - [4, 1408, 1, 3328]
    - [202, 616.656]
  - - [6784, 2944, 1, 256]
    - [245, 8547.73]
  - - [64, 1856, 1, 1280]
    - [218, 4409.71]
  - - [64, 1024, 1, 128]
    - [162, 554.902]
  - - [4288, 2368, 1, 3328]
    - [238, 8780.08]
  - - [1856, 2368, 1, 256]
    - [245, 4976.74]
  - - [3584, 256, 1, 128]
    - [230, 2812.37]
  - - [3584, 6784, 1, 3328]
    - [240, 9278.22]
  - - [256, 1024, 1, 256]
    - [236, 4346.53]
  - - [4, 6784, 1, 3328]
    - [255, 681.366]
  - - [1024, 5888, 1, 3328]
    - [236, 9187.61]
  - - [1024, 128, 1, 1280]
    - [188, 3660.05]
  - - [4288, 128, 1, 1280]
    - [242, 6019.17]
  - - [5056, 4288, 1, 1280]
    - [234, 9343.96]
  - - [5888, 64, 1, 256]
    - [236, 4692.17]
  - - [1856, 256, 1, 1280]
    - [242, 4790.38]
  - - [64, 5888, 1, 3328]
    - [210, 6702.2]
  - - [2944, 5888, 1, 128]
    - [231, 5202.65]
  - - [704, 5888, 1, 1280]
    - [236, 9264.29]
  - - [2368, 3584, 1, 128]
    - [228, 5053.71]
  - - [6784, 5888, 1, 3328]
    - [234, 7926.8]
  - - [704, 1024, 1, 1280]
    - [235, 5402.6]
  - - [448, 256, 1, 3328]
    - [218, 6124.65]
  - - [448, 1856, 1, 128]
    - [229, 2885.96]
  - - [128, 1024, 1, 128]
    - [163, 1013.22]
  - - [2944, 4, 1, 128]
    - [248, 77.6374]
  - - [1024, 704, 1, 1280]
    - [236, 7365.58]
  - - [128, 5888, 1, 256]
    - [236, 6990.61]
  - - [1024, 5056, 1, 1280]
    - [241, 9422.0]
  - - [4288, 1024, 1, 256]
    - [243, 6270.03]
  - - [2944, 2368, 1, 128]
    - [228, 4918.18]
  - - [704, 704, 1, 3328]
    - [236, 7963.65]
  - - [704, 1408, 1, 1280]
    - [236, 8347.32]
  - - [5888, 448, 1, 1280]
    - [242, 5217.05]
  - - [3584, 256, 1, 3328]
    - [236, 7802.25]
  - - [704, 5888, 1, 3328]
    - [242, 8381.46]
  - - [704, 1856, 1, 128]
    - [228, 3598.38]
  - - [128, 3584, 1, 3328]
    - [198, 7161.11]
  - - [6784, 2368, 1, 1280]
    - [247, 9464.41]
  - - [4, 4288, 1, 128]
    - [248, 132.68]
  - - [128, 704, 1, 1280]
    - [210, 4463.85]
  - - [3584, 2944, 1, 256]
    - [247, 8201.24]
  - - [1856, 128, 1, 3328]
    - [189, 6575.5]
  - - [4, 64, 1, 1280]
    - [205, 43.6745]
  - - [4, 5056, 1, 3328]
    - [185, 675.315]
  - - [128, 2944, 1, 1280]
    - [189, 5916.99]
  - - [2368, 1024, 1, 3328]
    - [242, 8646.84]
  - - [128, 256, 1, 3328]
    - [223, 4130.85]
  - - [1408, 5056, 1, 3328]
    - [241, 9529.75]
  - - [1856, 1856, 1, 3328]
    - [240, 8114.99]
  - - [3584, 128, 1, 256]
    - [236, 5603.18]
  - - [448, 1408, 1, 3328]
    - [236, 7073.03]
  - - [2368, 2368, 1, 256]
    - [243, 7648.76]
  - - [4288, 4288, 1, 1280]
    - [238, 9244.11]
  - - [64, 448, 1, 1280]
    - [209, 2885.33]
  - - [1408, 4288, 1, 256]
    - [236, 8080.41]
  - - [448, 4, 1, 256]
    - [254, 84.4294]
  - - [5888, 448, 1, 128]
    - [231, 3540.8]
  - - [448, 4, 1, 1280]
    - [205, 322.257]
  - - [704, 6784, 1, 3328]
    - [235, 8613.58]
  - - [5888, 5888, 1, 1280]
    - [242, 9502.05]
  - - [5056, 1024, 1, 1280]
    - [245, 9110.11]
  - - [448, 5888, 1, 3328]
    - [236, 8586.43]
  - - [128, 4, 1, 128]
    - [248, 4.27959]
  - - [1024, 2944, 1, 1280]
    - [244, 7096.53]
  - - [5056, 5888, 1, 1280]
    - [235, 9693.51]
  - - [4288, 5888, 1, 128]
    - [228, 5406.46]
  - - [256, 3584, 1, 256]
    - [236, 6908.37]
  - - [1408, 3584, 1, 128]
    - [228, 4645.69]
  - - [256, 2944, 1, 3328]
    - [239, 6284.4]
  - - [448, 3584, 1, 128]
    - [231, 3675.37]
  - - [5888, 2944, 1, 1280]
    - [241, 9628.9]
  - - [4, 6784, 1, 1280]
    - [185, 688.176]
  - - [2368, 5888, 1, 128]
    - [228, 5273.96]
  - - [64, 2944, 1, 128]
    - [172, 1316.54]
  - - [3584, 5888, 1, 256]
    - [242, 9239.14]
  - - [2368, 704, 1, 128]
    - [231, 3537.65]
  - - [3584, 2944, 1, 1280]
    - [236, 9324.62]
  - - [3584, 2368, 1, 128]
    - [228, 4766.34]
  - - [5056, 704, 1, 128]
    - [228, 4487.95]
  - - [448, 2368, 1, 128]
    - [231, 2877.02]
  - - [5056, 1408, 1, 3328]
    - [247, 9515.97]
  - - [1408, 704, 1, 256]
    - [239, 6836.18]
  - - [6784, 1024, 1, 3328]
    - [234, 9309.65]
  - - [6784, 2944, 1, 3328]
    - [235, 9536.58]
  - - [2944, 5056, 1, 3328]
    - [236, 9526.25]
  - - [1856, 1856, 1, 256]
    - [236, 5239.24]
  - - [1024, 5888, 1, 128]
    - [228, 4006.28]
  - - [2048, 7133, 1, 2048]
    - [234, 9828.07]
  - - [256, 4, 1, 128]
    - [249, 4.38908]
  - - [4288, 5888, 1, 1280]
    - [244, 9202.83]
  - - [4288, 4288, 1, 256]
    - [239, 5521.18]
  - - [448, 2944, 1, 3328]
    - [242, 7724.53]
  - - [4288, 1856, 1, 1280]
    - [242, 8826.34]
  - - [1856, 2944, 1, 3328]
    - [236, 9194.9]
  - - [256, 6784, 1, 3328]
    - [236, 8740.33]
  - - [64, 5888, 1, 256]
    - [236, 4766.35]
  - - [256, 5056, 1, 128]
    - [228, 2937.6]
  - - [5056, 1024, 1, 256]
    - [247, 5467.91]
  - - [704, 64, 1, 3328]
    - [224, 4818.43]
  - - [5056, 1856, 1, 3328]
    - [241, 8861.69]
  - - [4, 2944, 1, 3328]
    - [191, 662.102]
  - - [4, 5056, 1, 256]
    - [251, 494.121]
  - - [1856, 1408, 1, 256]
    - [236, 8674.78]
  - - [3584, 4, 1, 128]
    - [248, 108.296]
  - - [448, 448, 1, 3328]
    - [210, 6457.4]
  - - [6784, 128, 1, 3328]
    - [203, 7256.71]
  - - [4288, 1408, 1, 128]
    - [231, 4791.76]
  - - [4288, 5056, 1, 256]
    - [236, 8560.84]
  - - [1408, 128, 1, 1280]
    - [218, 5085.79]
  - - [5056, 256, 1, 3328]
    - [239, 7284.23]
  - - [704, 704, 1, 256]
    - [236, 6171.19]
  - - [1024, 5888, 1, 1280]
    - [241, 8852.89]
  - - [6784, 2368, 1, 128]
    - [229, 4729.3]
  - - [4, 5056, 1, 1280]
    - [202, 670.046]
  - - [64, 128, 1, 256]
    - [204, 369.317]
  - - [128, 1856, 1, 1280]
    - [198, 5549.13]
  - - [5056, 3584, 1, 256]
    - [242, 7115.84]
  - - [1856, 1024, 1, 1280]
    - [234, 8196.5]
  - - [6784, 4288, 1, 1280]
    - [235, 9509.66]
  - - [1856, 1856, 1, 1280]
    - [237, 5791.99]
  - - [6784, 2944, 1, 128]
    - [228, 5317.12]
  - - [1408, 5056, 1, 1280]
    - [237, 8980.73]
  - - [4, 2368, 1, 3328]
    - [202, 592.634]
  - - [5888, 1856, 1, 128]
    - [227, 4600.2]
  - - [448, 704, 1, 1280]
    - [236, 2286.58]
  - - [2368, 1024, 1, 128]
    - [231, 3911.12]
  - - [1024, 448, 1, 3328]
    - [236, 7295.24]
  - - [1856, 704, 1, 1280]
    - [236, 8881.12]
  - - [5056, 3584, 1, 128]
    - [228, 4911.68]
  - - [5888, 5888, 1, 3328]
    - [244, 9243.9]
  - - [6784, 1024, 1, 256]
    - [247, 5475.41]
  - - [2944, 2368, 1, 256]
    - [242, 5670.77]
  - - [256, 448, 1, 256]
    - [193, 2293.86]
  - - [5056, 5888, 1, 3328]
    - [237, 7848.07]
  - - [1856, 1024, 1, 256]
    - [242, 7517.7]
  - - [448, 1408, 1, 1280]
    - [236, 6917.54]
  - - [3584, 448, 1, 1280]
    - [242, 7980.86]
  - - [1024, 1024, 1, 1280]
    - [239, 8384.52]
  - - [448, 5888, 1, 256]
    - [236, 7365.75]
  - - [704, 64, 1, 128]
    - [181, 358.755]
  - - [1408, 6784, 1, 3328]
    - [242, 9094.19]
  - - [448, 1024, 1, 128]
    - [231, 1773.05]
  - - [4288, 704, 1, 128]
    - [228, 4355.38]
  - - [128, 1856, 1, 128]
    - [167, 1610.73]
  - - [448, 2368, 1, 3328]
    - [242, 7366.47]
  - - [5056, 64, 1, 128]
    - [167, 2157.33]
  - - [5056, 2944, 1, 256]
    - [236, 9123.16]
  - - [6784, 5888, 1, 128]
    - [227, 5285.9]
  - - [704, 1024, 1, 256]
    - [242, 6667.35]
  - - [1024, 4, 1, 256]
    - [191, 187.346]
  - - [2368, 1856, 1, 256]
    - [242, 6777.94]
  - - [128, 6784, 1, 1280]
    - [239, 7052.71]
  - - [1408, 3584, 1, 3328]
    - [243, 9038.05]
  - - [2368, 6784, 1, 256]
    - [236, 9181.45]
  - - [5056, 1408, 1, 1280]
    - [241, 9422.0]
  - - [256, 256, 1, 128]
    - [173, 543.404]
  - - [5056, 4288, 1, 128]
    - [231, 5340.02]
  - - [1408, 1856, 1, 128]
    - [228, 4270.99]
  - - [1408, 5888, 1, 3328]
    - [240, 9034.89]
  - - [1856, 256, 1, 256]
    - [242, 5847.93]
  - - [6784, 6784, 1, 256]
    - [235, 9624.48]
  - - [64, 256, 1, 128]
    - [174, 146.549]
  - - [4288, 2368, 1, 128]
    - [227, 3897.04]
  - - [1856, 4288, 1, 128]
    - [228, 4337.17]
  - - [256, 4288, 1, 1280]
    - [236, 7499.52]
  - - [2368, 2944, 1, 256]
    - [241, 7703.28]
  - - [4, 1856, 1, 256]
    - [254, 264.064]
  - - [3584, 1856, 1, 1280]
    - [236, 9224.43]
  - - [6784, 6784, 1, 128]
    - [228, 5476.13]
  - - [256, 1856, 1, 128]
    - [231, 1858.82]
  - - [704, 64, 1, 1280]
    - [209, 3368.77]
  - - [5888, 5056, 1, 256]
    - [242, 5859.91]
  - - [3584, 448, 1, 256]
    - [242, 7298.43]
  - - [448, 4288, 1, 128]
    - [228, 3813.55]
  - - [2944, 4288, 1, 3328]
    - [237, 9149.73]
  - - [256, 6784, 1, 256]
    - [236, 7984.95]
  - - [1408, 4288, 1, 128]
    - [231, 4728.44]
  - - [2944, 704, 1, 3328]
    - [242, 7149.86]
  - - [128, 448, 1, 256]
    - [208, 1699.18]
  - - [512, 32, 1, 512]
    - [208, 1127.6]
  - - [3584, 3584, 1, 256]
    - [237, 8558.11]
  - - [448, 1408, 1, 128]
    - [228, 2504.45]
  - - [128, 256, 1, 1280]
    - [209, 3216.59]
  - - [3584, 5056, 1, 256]
    - [234, 5674.45]
  - - [6784, 128, 1, 256]
    - [236, 6216.49]
  - - [4288, 4, 1, 256]
    - [252, 435.706]
  - - [64, 1408, 1, 3328]
    - [210, 6186.01]
  - - [704, 448, 1, 256]
    - [242, 4005.08]
  - - [2944, 2368, 1, 1280]
    - [243, 8542.8]
  - - [448, 64, 1, 3328]
    - [223, 3835.33]
  - - [1408, 3584, 1, 256]
    - [236, 8714.63]
  - - [3584, 4, 1, 3328]
    - [191, 689.554]
  - - [6784, 3584, 1, 256]
    - [241, 9271.34]
  - - [256, 128, 1, 128]
    - [174, 283.499]
  - - [704, 1408, 1, 128]
    - [228, 3210.57]
  - - [4, 2368, 1, 256]
    - [254, 360.938]
  - - [2944, 448, 1, 128]
    - [228, 3344.41]
  - - [128, 1408, 1, 256]
    - [236, 3186.38]
  - - [4, 2944, 1, 256]
    - [252, 384.622]
  - - [64, 128, 1, 3328]
    - [205, 2103.72]
  - - [5056, 2368, 1, 128]
    - [228, 5219.76]
  - - [2944, 2944, 1, 3328]
    - [245, 9174.69]
  - - [5056, 6784, 1, 256]
    - [247, 8992.36]
  - - [1856, 3584, 1, 128]
    - [228, 4957.27]
  - - [128, 2944, 1, 128]
    - [166, 2241.48]
  - - [1024, 704, 1, 3328]
    - [246, 6545.11]
  - - [6784, 448, 1, 256]
    - [242, 5379.25]
  - - [3584, 6784, 1, 128]
    - [228, 5102.01]
  - - [128, 4288, 1, 256]
    - [236, 5211.86]
  - - [704, 448, 1, 3328]
    - [237, 4504.15]
  - - [1024, 1024, 1, 3328]
    - [239, 8009.77]
  - - [128, 128, 1, 3328]
    - [222, 3185.03]
  - - [5056, 1856, 1, 256]
    - [236, 9138.43]
  - - [256, 128, 1, 256]
    - [208, 1205.36]
  - - [1024, 1856, 1, 256]
    - [247, 6375.09]
  - - [4288, 64, 1, 128]
    - [164, 1695.43]
  - - [256, 448, 1, 3328]
    - [211, 5659.67]
  - - [1408, 6784, 1, 1280]
    - [236, 9349.2]
  - - [3584, 3584, 1, 1280]
    - [241, 9302.19]
  - - [64, 2368, 1, 1280]
    - [210, 4433.07]
  - - [448, 2368, 1, 1280]
    - [236, 7250.77]
  - - [5888, 5888, 1, 128]
    - [228, 4616.03]
  - - [64, 6784, 1, 3328]
    - [242, 6987.23]
  - - [2944, 256, 1, 1280]
    - [245, 6127.45]
  - - [5056, 5888, 1, 128]
    - [227, 5106.39]
  - - [256, 2368, 1, 128]
    - [228, 2141.23]
  - - [5056, 2368, 1, 3328]
    - [239, 9041.75]
  - - [2944, 4288, 1, 256]
    - [247, 8691.22]
  - - [1408, 3584, 1, 1280]
    - [236, 9070.0]
  - - [2368, 64, 1, 256]
    - [208, 2412.87]
  - - [64, 448, 1, 3328]
    - [223, 3739.14]
  - - [256, 256, 1, 3328]
    - [210, 5304.18]
  - - [5888, 4, 1, 128]
    - [249, 105.655]
  - - [1856, 704, 1, 256]
    - [236, 8025.43]
  - - [4, 4288, 1, 1280]
    - [183, 579.07]
  - - [1408, 448, 1, 3328]
    - [244, 5714.51]
  - - [1024, 4, 1, 3328]
    - [202, 608.649]
  - - [2368, 256, 1, 256]
    - [242, 5173.08]
  - - [2368, 6784, 1, 3328]
    - [242, 9456.61]
  - - [1856, 1408, 1, 1280]
    - [247, 7805.19]
  - - [1856, 448, 1, 1280]
    - [234, 6185.04]
  - - [6784, 704, 1, 128]
    - [228, 4597.87]
  - - [4, 4, 1, 256]
    - [205, 0.791892]
  - - [128, 5888, 1, 128]
    - [166, 2691.76]
  - - [1408, 5888, 1, 256]
    - [241, 7164.27]
  - - [704, 2944, 1, 1280]
    - [243, 8139.81]
  - - [1856, 2368, 1, 128]
    - [231, 4623.38]
  - - [4096, 7133, 1, 4096]
    - [235, 9940.07]
  - - [256, 64, 1, 256]
    - [199, 689.953]
  - - [1024, 1024, 1, 256]
    - [242, 7216.11]
  - - [704, 1856, 1, 256]
    - [242, 6364.17]
  - - [128, 4288, 1, 3328]
    - [198, 7200.59]
  - - [3584, 704, 1, 1280]
    - [245, 7972.08]
  - - [256, 128, 1, 1280]
    - [196, 2702.62]
  - - [2368, 4, 1, 256]
    - [191, 326.018]
  - - [256, 2368, 1, 1280]
    - [236, 6638.93]
  - - [2944, 6784, 1, 128]
    - [227, 5233.53]
  - - [3584, 448, 1, 3328]
    - [236, 8094.4]
  - - [1408, 4, 1, 256]
    - [254, 243.646]
  - - [704, 2368, 1, 3328]
    - [236, 8403.11]
  - - [2944, 448, 1, 256]
    - [236, 7022.59]
  - - [1856, 448, 1, 128]
    - [231, 2842.79]
  - - [2368, 128, 1, 1280]
    - [218, 5685.52]
  - - [256, 5888, 1, 128]
    - [233, 2178.71]
  - - [64, 6784, 1, 256]
    - [236, 5385.23]
  - - [64, 5056, 1, 1280]
    - [210, 5603.29]
  - - [4, 6784, 1, 128]
    - [248, 180.256]
  - - [2944, 2944, 1, 1280]
    - [245, 9129.39]
  - - [5888, 2368, 1, 256]
    - [247, 6961.69]
  - - [4, 3584, 1, 1280]
    - [191, 646.23]
  - - [1408, 128, 1, 128]
    - [177, 1172.29]
  - - [6784, 704, 1, 3328]
    - [242, 9084.62]
  - - [128, 64, 1, 1280]
    - [221, 1260.41]
  - - [2368, 256, 1, 1280]
    - [242, 6643.48]
  - - [4, 448, 1, 3328]
    - [205, 433.514]
  - - [5888, 4288, 1, 128]
    - [229, 4753.17]
  - - [4, 5888, 1, 256]
    - [191, 471.14]
  - - [1408, 2944, 1, 3328]
    - [245, 9207.1]
  - - [3584, 704, 1, 128]
    - [231, 3762.46]
  - - [64, 1024, 1, 256]
    - [209, 1807.99]
  - - [5056, 5056, 1, 128]
    - [232, 4830.16]
  - - [2368, 448, 1, 1280]
    - [236, 7263.16]
  - - [128, 3584, 1, 256]
    - [239, 4369.17]
  - - [704, 448, 1, 1280]
    - [237, 4205.33]
  - - [448, 5056, 1, 128]
    - [228, 3855.57]
  - - [256, 4, 1, 1280]
    - [259, 157.638]
  - - [128, 5056, 1, 256]
    - [242, 6109.06]
  - - [1408, 5056, 1, 128]
    - [231, 4836.68]
  - - [2944, 3584, 1, 128]
    - [231, 4532.19]
  - - [3584, 2368, 1, 256]
    - [236, 8951.34]
  - - [5888, 5056, 1, 1280]
    - [247, 9276.49]
  - - [2368, 5056, 1, 128]
    - [231, 5167.66]
  - - [64, 704, 1, 256]
    - [191, 1501.97]
  - - [4288, 256, 1, 1280]
    - [236, 7496.3]
  - - [3584, 3584, 1, 3328]
    - [237, 9301.77]
  - - [1024, 256, 1, 128]
    - [228, 1508.84]
  - - [4, 704, 1, 128]
    - [249, 12.1469]
  - - [5888, 6784, 1, 256]
    - [235, 9370.47]
  - - [4288, 2944, 1, 3328]
    - [239, 9149.09]
  - - [2944, 64, 1, 128]
    - [175, 1456.46]
  - - [1856, 64, 1, 256]
    - [201, 2210.03]
  - - [4288, 128, 1, 3328]
    - [195, 6471.95]
  - - [4288, 704, 1, 1280]
    - [242, 8934.61]
  - - [256, 5056, 1, 1280]
    - [236, 8439.13]
  - - [1408, 256, 1, 128]
    - [231, 1769.17]
  - - [2944, 5888, 1, 3328]
    - [236, 9448.04]
  - - [6784, 5888, 1, 1280]
    - [247, 9372.25]
  - - [704, 128, 1, 256]
    - [193, 2059.8]
  - - [5888, 4288, 1, 1280]
    - [239, 9244.32]
  - - [448, 256, 1, 1280]
    - [218, 4741.72]
  - - [5888, 3584, 1, 128]
    - [227, 4980.06]
  - - [1856, 1856, 1, 128]
    - [231, 4363.98]
  - - [5056, 4, 1, 1280]
    - [251, 629.641]
  - - [256, 1408, 1, 1280]
    - [242, 5588.44]
  - - [512, 16, 1, 512]
    - [202, 689.953]
  - - [704, 3584, 1, 128]
    - [231, 4069.67]
  - - [5888, 448, 1, 3328]
    - [247, 7925.94]
  - - [2368, 4288, 1, 1280]
    - [246, 8492.7]
  - - [4288, 2944, 1, 128]
    - [228, 5238.21]
  - - [1024, 6784, 1, 3328]
    - [242, 8578.18]
  - - [128, 2368, 1, 256]
    - [242, 3788.9]
  - - [6784, 64, 1, 3328]
    - [236, 7003.46]
  - - [5056, 2944, 1, 3328]
    - [239, 8575.45]
  - - [448, 128, 1, 256]
    - [191, 1715.06]
  - - [2944, 3584, 1, 256]
    - [236, 8994.26]
  - - [1408, 1408, 1, 3328]
    - [234, 8757.7]
  - - [1856, 128, 1, 1280]
    - [236, 5598.17]
  - - [3584, 3584, 1, 128]
    - [227, 4787.44]
  - - [64, 3584, 1, 256]
    - [242, 3546.01]
  - - [1408, 4, 1, 3328]
    - [186, 640.24]
  - - [128, 2944, 1, 3328]
    - [210, 7204.24]
  - - [3584, 704, 1, 256]
    - [236, 6239.69]
  - - [2944, 448, 1, 3328]
    - [242, 7726.71]
  - - [3584, 1408, 1, 3328]
    - [234, 9358.78]
  - - [704, 3584, 1, 1280]
    - [242, 8005.28]
  - - [2944, 6784, 1, 1280]
    - [234, 9487.73]
  - - [1856, 6784, 1, 256]
    - [236, 5684.56]
  - - [4288, 448, 1, 3328]
    - [242, 8410.38]
  - - [6784, 4288, 1, 128]
    - [232, 4785.58]
  - - [6784, 704, 1, 1280]
    - [236, 5579.05]
  - - [256, 4288, 1, 256]
    - [236, 6781.43]
  - - [3584, 64, 1, 128]
    - [175, 1474.0]
  - - [5888, 1024, 1, 3328]
    - [234, 8639.49]
  - - [448, 64, 1, 128]
    - [166, 259.282]
  - - [704, 6784, 1, 1280]
    - [242, 9027.25]
  - - [5888, 128, 1, 256]
    - [242, 6812.88]
  - - [2368, 448, 1, 3328]
    - [242, 7356.63]
  - - [1856, 5056, 1, 3328]
    - [241, 8871.56]
  - - [4, 6784, 1, 256]
    - [250, 469.479]
  - - [1024, 3584, 1, 128]
    - [228, 3428.02]
  - - [1024, 1408, 1, 128]
    - [231, 2935.05]
  - - [2368, 2944, 1, 128]
    - [231, 4888.02]
  - - [5056, 64, 1, 256]
    - [200, 3186.16]
  - - [4, 448, 1, 1280]
    - [205, 273.167]
  - - [5056, 2944, 1, 128]
    - [232, 4752.79]
  - - [5888, 5056, 1, 3328]
    - [246, 9124.77]
  - - [1024, 704, 1, 128]
    - [231, 2302.36]
  - - [1408, 2368, 1, 128]
    - [231, 3826.95]
  - - [5888, 2368, 1, 128]
    - [228, 4912.77]
  - - [128, 5056, 1, 3328]
    - [218, 7583.8]
  - - [3584, 6784, 1, 1280]
    - [245, 9313.5]
  - - [3072, 7435, 1, 1024]
    - [239, 9322.07]
  - - [1856, 5888, 1, 256]
    - [236, 5778.34]
  - - [256, 256, 1, 256]
    - [188, 1576.91]
  - - [256, 64, 1, 128]
    - [174, 173.705]
  - - [4288, 4288, 1, 3328]
    - [241, 8416.27]
  - - [4288, 1408, 1, 1280]
    - [247, 9301.97]
  - - [3584, 5056, 1, 128]
    - [233, 4344.94]
  - - [4, 1024, 1, 3328]
    - [202, 615.239]
  - - [4288, 2368, 1, 256]
    - [236, 9142.67]
  - - [2944, 5056, 1, 1280]
    - [236, 9399.69]
  - - [448, 6784, 1, 256]
    - [235, 5710.93]
  - - [64, 1024, 1, 3328]
    - [218, 4975.1]
  - - [6784, 2368, 1, 3328]
    - [245, 9207.63]
  - - [256, 1024, 1, 1280]
    - [242, 5983.42]
  - - [704, 4, 1, 128]
    - [248, 15.1187]
  - - [256, 4, 1, 256]
    - [205, 52.9516]
  - - [4288, 128, 1, 256]
    - [236, 5242.98]
  - - [4288, 1856, 1, 3328]
    - [247, 9354.06]
  - - [3584, 448, 1, 128]
    - [228, 3353.9]
  - - [256, 4, 1, 3328]
    - [259, 313.324]
  - - [4, 1408, 1, 1280]
    - [202, 509.207]
  - - [3584, 64, 1, 1280]
    - [190, 5198.42]
  - - [1408, 448, 1, 128]
    - [228, 2628.37]
  - - [3584, 1024, 1, 1280]
    - [242, 8535.01]
  - - [1856, 5056, 1, 256]
    - [234, 8184.49]
  - - [4, 3584, 1, 256]
    - [252, 395.576]
  - - [1024, 4288, 1, 256]
    - [237, 5966.52]
  - - [5888, 3584, 1, 3328]
    - [240, 9189.43]
  - - [4, 256, 1, 256]
    - [256, 41.5785]
  - - [5056, 3584, 1, 3328]
    - [241, 9431.92]
  - - [128, 5888, 1, 1280]
    - [236, 8192.1]
  - - [704, 448, 1, 128]
    - [228, 1510.96]
  - - [2368, 1408, 1, 1280]
    - [236, 8415.65]
  - - [5056, 2944, 1, 1280]
    - [247, 9294.77]
  - - [4, 4, 1, 128]
    - [249, 0.1356549]
  - - [3584, 256, 1, 256]
    - [236, 6749.55]
  - - [128, 1856, 1, 3328]
    - [189, 6797.09]
  - - [1024, 6784, 1, 256]
    - [242, 8783.09]
  - - [4, 128, 1, 256]
    - [202, 27.4067]
  - - [64, 64, 1, 1280]
    - [221, 712.448]
  - - [6784, 4, 1, 128]
    - [249, 122.06]
  - - [2944, 1408, 1, 128]
    - [231, 4430.46]
  - - [448, 128, 1, 3328]
    - [218, 5097.34]
  - - [64, 2944, 1, 3328]
    - [218, 6362.2]
  - - [64, 4288, 1, 3328]
    - [218, 6565.01]
  - - [5056, 6784, 1, 3328]
    - [242, 8121.18]
  - - [128, 2944, 1, 256]
    - [236, 4692.17]
  - - [128, 6784, 1, 128]
    - [165, 2687.46]
  - - [3584, 4288, 1, 256]
    - [242, 9193.99]
  - - [448, 1856, 1, 256]
    - [242, 6231.39]
  - - [1856, 6784, 1, 3328]
    - [247, 9191.48]
  - - [3584, 128, 1, 3328]
    - [236, 7368.47]
  - - [64, 1856, 1, 256]
    - [187, 2184.63]
  - - [1024, 448, 1, 1280]
    - [242, 6977.32]
  - - [5888, 4288, 1, 256]
    - [242, 5780.5]
  - - [4, 448, 1, 128]
    - [249, 9.06]
  - - [5056, 1408, 1, 256]
    - [236, 5601.35]
  - - [64, 256, 1, 1280]
    - [202, 1927.63]
  - - [3584, 1024, 1, 256]
    - [247, 7542.84]
  - - [256, 704, 1, 256]
    - [236, 2957.62]
  - - [5888, 5888, 1, 256]
    - [247, 7344.14]
  - - [4288, 1024, 1, 1280]
    - [242, 8925.84]
  - - [5888, 128, 1, 3328]
    - [236, 8410.07]
  - - [448, 6784, 1, 3328]
    - [236, 8862.56]
  - - [2944, 1408, 1, 1280]
    - [247, 7478.93]
  - - [1024, 32, 1, 512]
    - [191, 1777.35]
  - - [2944, 1856, 1, 3328]
    - [236, 9153.43]
  - - [2368, 64, 1, 128]
    - [175, 1102.3]
  - - [2944, 2944, 1, 128]
    - [227, 4591.95]
  - - [4, 128, 1, 3328]
    - [257, 119.09]
  - - [3584, 5888, 1, 1280]
    - [236, 9222.49]
  - - [64, 4, 1, 128]
    - [248, 1.03516]
  - - [6784, 1856, 1, 1280]
    - [236, 9136.07]
  - - [2944, 5056, 1, 256]
    - [242, 8860.13]
  - - [2944, 5888, 1, 1280]
    - [235, 9643.63]
  - - [5888, 256, 1, 3328]
    - [242, 8799.53]
  - - [1856, 5888, 1, 3328]
    - [242, 9457.53]
  - - [3584, 1408, 1, 256]
    - [242, 8672.53]
  - - [704, 3584, 1, 3328]
    - [242, 8525.3]
  - - [5056, 448, 1, 1280]
    - [242, 8843.77]
  - - [3584, 1856, 1, 3328]
    - [234, 8881.53]
  - - [64, 1408, 1, 128]
    - [163, 747.142]
  - - [1408, 704, 1, 1280]
    - [236, 8342.93]
  - - [2944, 1024, 1, 256]
    - [247, 8079.58]
  - - [1024, 2368, 1, 128]
    - [231, 3347.58]
  - - [2368, 4288, 1, 3328]
    - [242, 9467.67]
  - - [4, 1408, 1, 256]
    - [254, 257.563]
  - - [1024, 1408, 1, 1280]
    - [242, 8241.84]
  - - [64, 64, 1, 256]
    - [202, 190.059]
  - - [704, 256, 1, 3328]
    - [236, 4519.28]
  - - [6784, 5056, 1, 256]
    - [235, 9133.78]
  - - [4, 4288, 1, 3328]
    - [186, 670.075]
  - - [448, 6784, 1, 128]
    - [228, 4481.92]
  - - [4, 704, 1, 3328]
    - [258, 523.071]
  - - [448, 2944, 1, 256]
    - [236, 7022.59]
  - - [2944, 6784, 1, 256]
    - [242, 9199.84]
  - - [2368, 2368, 1, 1280]
    - [247, 8646.84]
  - - [4, 4, 1, 1280]
    - [205, 3.11176]
  - - [1856, 3584, 1, 1280]
    - [234, 8805.45]
  - - [64, 2944, 1, 256]
    - [208, 2565.76]
  - - [3584, 1408, 1, 1280]
    - [247, 9273.12]
  - - [448, 256, 1, 128]
    - [163, 941.13]
  - - [4288, 448, 1, 128]
    - [229, 3215.2]
  - - [5056, 256, 1, 1280]
    - [242, 8790.13]
  - - [1856, 1408, 1, 3328]
    - [236, 9310.73]
  - - [128, 128, 1, 128]
    - [171, 155.215]
  - - [1024, 4288, 1, 3328]
    - [239, 8528.12]
  - - [448, 2368, 1, 256]
    - [243, 5097.34]
  - - [1024, 4, 1, 128]
    - [249, 10.3721]
  - - [5056, 448, 1, 256]
    - [242, 8236.78]
  - - [2944, 2368, 1, 3328]
    - [235, 9331.16]
  - - [704, 128, 1, 3328]
    - [210, 5969.3]
  - - [64, 64, 1, 3328]
    - [226, 1494.78]
  - - [1024, 1856, 1, 1280]
    - [241, 6356.43]
  - - [6784, 1856, 1, 256]
    - [242, 9068.63]
  - - [128, 2368, 1, 3328]
    - [218, 6714.22]
  - - [1024, 5888, 1, 256]
    - [242, 5501.6]
  - - [5056, 128, 1, 1280]
    - [198, 6455.64]
  - - [5056, 64, 1, 3328]
    - [203, 6703.81]
  - - [128, 704, 1, 128]
    - [164, 696.618]
  - - [1408, 2368, 1, 256]
    - [236, 8667.25]
  - - [1408, 1408, 1, 256]
    - [247, 7615.81]
  - - [4, 64, 1, 128]
    - [249, 1.08463]
  - - [64, 128, 1, 1280]
    - [221, 1379.81]
  - - [2368, 2368, 1, 128]
    - [231, 4582.26]
  - - [64, 5888, 1, 128]
    - [164, 2086.37]
  - - [5888, 4, 1, 3328]
    - [185, 667.514]
  - - [6784, 1408, 1, 128]
    - [232, 4516.34]
  - - [4288, 5888, 1, 256]
    - [247, 8497.43]
  - - [1408, 5056, 1, 256]
    - [236, 8867.46]
  - - [5056, 128, 1, 3328]
    - [218, 7678.98]
  - - [128, 128, 1, 1280]
    - [206, 2016.59]
  - - [448, 704, 1, 256]
    - [237, 3030.89]
  - - [4288, 3584, 1, 128]
    - [228, 5246.33]
  - - [2944, 128, 1, 3328]
    - [203, 6795.16]
  - - [128, 5056, 1, 1280]
    - [189, 6193.09]
  - - [3584, 5056, 1, 1280]
    - [241, 9499.17]
  - - [256, 448, 1, 1280]
    - [197, 4267.56]
  - - [704, 704, 1, 128]
    - [231, 2259.32]
  - - [5056, 4, 1, 128]
    - [249, 12.5313]
  - - [704, 256, 1, 1280]
    - [236, 4355.97]
  - - [64, 2368, 1, 3328]
    - [210, 6310.97]
  - - [1856, 1024, 1, 128]
    - [227, 4065.43]
  - - [1856, 64, 1, 128]
    - [166, 936.329]
  - - [64, 6784, 1, 1280]
    - [189, 5731.8]
  - - [704, 4288, 1, 256]
    - [242, 5218.9]
  - - [5888, 2368, 1, 1280]
    - [236, 9378.9]
  - - [128, 256, 1, 256]
    - [206, 1219.37]
  - - [256, 64, 1, 1280]
    - [208, 1820.54]
  - - [2368, 5888, 1, 1280]
    - [247, 9143.64]
  - - [5888, 256, 1, 1280]
    - [236, 8678.47]
  - - [4, 5888, 1, 1280]
    - [183, 668.242]
  - - [704, 128, 1, 128]
    - [171, 649.556]
  - - [1024, 4, 1, 1280]
    - [202, 478.465]
  - - [2368, 1856, 1, 3328]
    - [234, 8153.87]
  - - [2368, 128, 1, 128]
    - [169, 1858.21]
  - - [2944, 704, 1, 256]
    - [236, 8438.07]
  - - [5056, 128, 1, 128]
    - [165, 2689.63]
  - - [256, 704, 1, 3328]
    - [236, 4541.18]
  - - [704, 3584, 1, 256]
    - [237, 7771.07]
  - - [1024, 1024, 1, 1024]
    - [242, 8305.62]
  - - [704, 2944, 1, 3328]
    - [242, 9166.48]
  - - [6784, 1024, 1, 128]
    - [227, 4362.31]
  - - [256, 448, 1, 128]
    - [174, 899.614]
  - - [448, 1024, 1, 3328]
    - [236, 7385.56]
  - - [2944, 1024, 1, 3328]
    - [239, 8779.81]
  - - [2944, 5056, 1, 128]
    - [231, 5103.11]
  - - [1408, 6784, 1, 256]
    - [242, 8346.89]
  - - [6784, 1408, 1, 3328]
    - [238, 8878.4]
  - - [4288, 6784, 1, 128]
    - [227, 5432.99]
  - - [704, 64, 1, 256]
    - [216, 1441.89]
  - - [5888, 4, 1, 1280]
    - [253, 636.641]
  - - [256, 2368, 1, 3328]
    - [236, 6804.8]
  - - [6784, 2944, 1, 1280]
    - [235, 9472.26]
  - - [4288, 1856, 1, 128]
    - [231, 4886.38]
  - - [1856, 2944, 1, 128]
    - [228, 4642.96]
  - - [6784, 448, 1, 128]
    - [228, 4369.17]
  - - [64, 3584, 1, 128]
    - [175, 1645.85]
  - - [448, 5056, 1, 1280]
    - [236, 8553.64]
  - - [2368, 1856, 1, 128]
    - [228, 4741.85]
  - - [128, 448, 1, 1280]
    - [218, 3745.01]
  - - [4288, 704, 1, 256]
    - [236, 8444.16]
  - - [256, 3584, 1, 128]
    - [228, 2454.96]
  - - [5888, 704, 1, 256]
    - [236, 8819.57]
  - - [3584, 1024, 1, 128]
    - [231, 4094.96]
  - - [256, 5888, 1, 3328]
    - [245, 8538.33]
  - - [1408, 4288, 1, 3328]
    - [247, 9212.57]
  - - [6784, 4288, 1, 256]
    - [235, 9163.12]
  - - [4288, 256, 1, 128]
    - [228, 3081.44]
  - - [5888, 256, 1, 256]
    - [236, 7680.75]
  - - [6784, 1024, 1, 1280]
    - [247, 9248.63]
  - - [5888, 1024, 1, 128]
    - [231, 4061.94]
  - - [1024, 128, 1, 256]
    - [242, 2317.39]
  - - [128, 64, 1, 3328]
    - [225, 2116.79]
  - - [448, 64, 1, 256]
    - [208, 1079.52]
  - - [2368, 256, 1, 128]
    - [229, 2229.83]
  - - [6784, 3584, 1, 1280]
    - [242, 9096.6]
  - - [1024, 6784, 1, 1280]
    - [240, 9112.9]
  - - [2944, 64, 1, 1280]
    - [198, 4983.0]
  - - [1408, 2944, 1, 1280]
    - [237, 9131.63]
  - - [256, 1856, 1, 256]
    - [245, 4432.86]
  - - [1408, 2368, 1, 3328]
    - [245, 8449.18]
  - - [2944, 4, 1, 3328]
    - [191, 673.94]
  - - [128, 1408, 1, 3328]
    - [210, 6582.47]
  - - [2944, 1856, 1, 128]
    - [228, 4827.54]
  - - [256, 2944, 1, 128]
    - [231, 2416.66]
  - - [256, 6784, 1, 128]
    - [231, 3118.76]
  - - [2368, 4, 1, 128]
    - [249, 22.7197]
  - - [1408, 256, 1, 3328]
    - [236, 3733.82]
  - - [1856, 4, 1, 128]
    - [248, 7.20009]
  - - [1024, 16, 1, 512]
    - [204, 1165.18]
  - - [5056, 6784, 1, 128]
    - [232, 4949.13]
  - - [4288, 5056, 1, 128]
    - [231, 4966.9]
  - - [1856, 5888, 1, 128]
    - [227, 4351.76]
  - - [2944, 5888, 1, 256]
    - [247, 8460.99]
  - - [3584, 1856, 1, 256]
    - [242, 8876.7]
  - - [4288, 3584, 1, 1280]
    - [235, 9603.7]
  - - [2368, 448, 1, 256]
    - [236, 6604.7]
  - - [4288, 256, 1, 3328]
    - [236, 7619.89]
  - - [1856, 704, 1, 128]
    - [228, 3629.61]
  - - [1408, 64, 1, 256]
    - [192, 2168.21]
  - - [64, 1856, 1, 128]
    - [168, 979.762]
  - - [4, 256, 1, 128]
    - [249, 5.23595]
  - - [704, 4288, 1, 3328]
    - [242, 9014.52]
  - - [704, 5888, 1, 128]
    - [229, 4221.77]
  - - [6784, 3584, 1, 128]
    - [227, 5360.73]
  - - [1024, 64, 1, 256]
    - [187, 1588.85]
  - - [64, 2368, 1, 256]
    - [242, 2552.55]
  - - [4288, 5056, 1, 3328]
    - [241, 8193.38]
  - - [4, 1856, 1, 1280]
    - [191, 499.192]
  - - [4288, 128, 1, 128]
    - [228, 2373.57]
  - - [1408, 1408, 1, 128]
    - [231, 3753.88]
  - - [1024, 128, 1, 3328]
    - [213, 5656.32]
  - - [1856, 128, 1, 128]
    - [164, 1617.58]
  - - [5056, 2368, 1, 256]
    - [247, 5553.41]
  - - [4288, 704, 1, 3328]
    - [235, 6962.06]
  - - [448, 3584, 1, 256]
    - [245, 5981.5]
  - - [64, 128, 1, 128]
    - [182, 74.9983]
  - - [2368, 64, 1, 1280]
    - [218, 5041.33]
  - - [2368, 1024, 1, 1280]
    - [243, 7740.97]
  - - [2944, 1408, 1, 3328]
    - [245, 9204.65]
  - - [1408, 448, 1, 256]
    - [242, 5954.4]
  - - [1024, 1408, 1, 3328]
    - [239, 8161.54]
  - - [2560, 7133, 1, 2560]
    - [234, 9636.69]
  - - [1408, 4, 1, 1280]
    - [186, 520.979]
  - - [5888, 3584, 1, 256]
    - [247, 9225.26]
  - - [128, 1024, 1, 1280]
    - [189, 4755.55]
  - - [1408, 1856, 1, 3328]
    - [239, 9130.87]
  - - [4, 4, 1, 3328]
    - [259, 7.03333]
  - - [6784, 1408, 1, 1280]
    - [236, 9346.91]
  - - [4, 1024, 1, 1280]
    - [186, 422.913]
  - - [704, 2944, 1, 256]
    - [242, 8332.06]
  - - [704, 4288, 1, 128]
    - [228, 4371.14]
  - - [2368, 4288, 1, 128]
    - [228, 3988.89]
  - - [64, 4288, 1, 1280]
    - [218, 5407.63]
  - - [6784, 64, 1, 1280]
    - [198, 5708.25]
  - - [3584, 128, 1, 128]
    - [164, 2463.2]
  - - [1024, 6784, 1, 128]
    - [229, 3862.12]
  - - [4, 1856, 1, 128]
    - [249, 30.6362]
  - - [1408, 64, 1, 3328]
    - [218, 6095.48]
  - - [6784, 4, 1, 256]
    - [251, 487.938]
  - - [1408, 1408, 1, 1280]
    - [247, 8640.63]
  - - [256, 2368, 1, 256]
    - [239, 4282.36]
  - - [448, 4288, 1, 3328]
    - [236, 8516.13]
  - - [2368, 1408, 1, 256]
    - [242, 8632.19]
  - - [5888, 5056, 1, 128]
    - [228, 5091.11]
  - - [704, 2368, 1, 256]
    - [242, 7664.8]
  - - [2944, 448, 1, 1280]
    - [242, 7618.35]
  - - [5888, 2368, 1, 3328]
    - [245, 9343.48]
  - - [64, 2944, 1, 1280]
    - [210, 5162.18]
  - - [448, 1856, 1, 1280]
    - [236, 7028.0]
  - - [4288, 448, 1, 1280]
    - [236, 5855.76]
  - - [5888, 704, 1, 3328]
    - [245, 9190.91]
  - - [5056, 256, 1, 128]
    - [231, 3235.94]
  - - [1856, 256, 1, 128]
    - [229, 1849.78]
  - - [5056, 128, 1, 256]
    - [242, 6109.06]
  - - [704, 4, 1, 256]
    - [202, 125.256]
  - - [1408, 5888, 1, 128]
    - [228, 5055.16]
  - - [4288, 4, 1, 128]
    - [248, 95.7209]
  - - [1408, 1024, 1, 256]
    - [236, 7370.28]
  - - [1024, 1856, 1, 128]
    - [228, 2966.8]
  - - [256, 704, 1, 128]
    - [230, 528.229]
  - - [256, 1024, 1, 128]
    - [228, 1171.69]
  - - [448, 1024, 1, 256]
    - [242, 5624.65]
  - - [128, 4, 1, 3328]
    - [259, 191.985]
  - - [5056, 6784, 1, 1280]
    - [236, 9544.07]
  - - [704, 5056, 1, 3328]
    - [243, 8790.35]
  - - [64, 1408, 1, 1280]
    - [210, 4505.7]
  - - [3584, 5056, 1, 3328]
    - [241, 9073.52]
  - - [1856, 4, 1, 3328]
    - [259, 612.875]
  - - [4, 2944, 1, 128]
    - [248, 72.0145]
  - - [2368, 2944, 1, 3328]
    - [234, 9314.68]
  - - [448, 448, 1, 1280]
    - [218, 5129.91]
  - - [2368, 3584, 1, 256]
    - [236, 8998.8]
  - - [1024, 256, 1, 1280]
    - [243, 3566.68]
  - - [5056, 3584, 1, 1280]
    - [237, 9345.17]
  - - [448, 4, 1, 3328]
    - [259, 487.337]
  - - [1856, 2944, 1, 1280]
    - [247, 8438.79]
  - - [3584, 2368, 1, 1280]
    - [242, 9298.9]
  - - [128, 1024, 1, 256]
    - [194, 2356.45]
  - - [2944, 1408, 1, 256]
    - [234, 5440.82]
  - - [4288, 1408, 1, 3328]
    - [234, 9386.09]
  - - [3584, 64, 1, 3328]
    - [190, 6310.97]
  - - [1408, 128, 1, 256]
    - [236, 2942.53]
  - - [2944, 1024, 1, 128]
    - [231, 3927.99]
  - - [4288, 5056, 1, 1280]
    - [238, 8328.58]
  - - [5888, 6784, 1, 1280]
    - [247, 9757.44]
  - - [6784, 5056, 1, 128]
    - [227, 5101.4]
  - - [256, 1024, 1, 3328]
    - [236, 6475.87]
  - - [3584, 4, 1, 256]
    - [252, 420.973]
  - - [1856, 64, 1, 3328]
    - [218, 6409.2]
  - - [64, 6784, 1, 128]
    - [166, 2387.32]
  - - [5888, 1408, 1, 3328]
    - [241, 9655.89]
  - - [5888, 64, 1, 1280]
    - [236, 5870.86]
  - - [256, 5056, 1, 256]
    - [239, 6109.06]
  - - [128, 3584, 1, 128]
    - [169, 2383.23]
  - - [448, 3584, 1, 3328]
    - [234, 7092.28]
  - - [704, 2368, 1, 128]
    - [228, 3741.08]
  - - [5888, 256, 1, 128]
    - [229, 2977.54]
  - - [4, 5056, 1, 128]
    - [248, 132.72]
  - - [448, 256, 1, 256]
    - [200, 2308.29]
  - - [704, 4, 1, 3328]
    - [205, 552.674]
  - - [1408, 256, 1, 256]
    - [236, 4577.22]
  - - [3584, 1856, 1, 128]
    - [228, 4571.86]
  - - [4288, 4288, 1, 128]
    - [231, 5284.65]
  - - [1856, 1024, 1, 3328]
    - [242, 6362.25]
  - - [128, 5888, 1, 3328]
    - [212, 7040.83]
  - - [1024, 5056, 1, 256]
    - [247, 7855.7]
  - - [2368, 1408, 1, 3328]
    - [242, 9205.66]
  - - [5888, 448, 1, 256]
    - [239, 5538.84]
  - - [5888, 6784, 1, 128]
    - [227, 4500.85]
  - - [2368, 4, 1, 3328]
    - [205, 642.898]
  - - [6784, 5056, 1, 1280]
    - [243, 9249.23]
  - - [5056, 704, 1, 1280]
    - [242, 8883.37]
  - - [1408, 256, 1, 1280]
    - [236, 5632.1]
  - - [4288, 6784, 1, 1280]
    - [242, 8843.31]
  - - [128, 704, 1, 256]
    - [200, 2045.19]
  - - [1024, 1024, 1, 128]
    - [231, 2723.67]
  - - [448, 128, 1, 1280]
    - [210, 3807.17]
  - - [6784, 4, 1, 3328]
    - [253, 684.671]
  - - [4288, 4, 1, 1280]
    - [202, 601.925]
  - - [1024, 64, 1, 3328]
    - [214, 3928.48]
  - - [1856, 4, 1, 256]
    - [252, 293.394]
  - - [64, 3584, 1, 1280]
    - [236, 5265.55]
  - - [6784, 1408, 1, 256]
    - [236, 9059.36]
  - - [3584, 5888, 1, 128]
    - [228, 5084.29]
  - - [5056, 5888, 1, 256]
    - [247, 8590.09]
  - - [2368, 1024, 1, 256]
    - [239, 4493.13]
  - - [2944, 1856, 1, 256]
    - [245, 5202.41]
  - - [1856, 6784, 1, 1280]
    - [243, 9071.48]
  - - [64, 5056, 1, 128]
    - [166, 2038.42]
  - - [5888, 64, 1, 128]
    - [165, 2016.59]
  - - [448, 704, 1, 128]
    - [229, 1173.65]
  - - [4, 1024, 1, 128]
    - [248, 8.89685]
  - - [4288, 3584, 1, 256]
    - [242, 9080.26]
  - - [1408, 704, 1, 128]
    - [228, 3165.71]
  - - [64, 256, 1, 3328]
    - [222, 3126.59]
  - - [5056, 1856, 1, 1280]
    - [239, 8857.55]
  - - [1408, 1024, 1, 3328]
    - [245, 8177.12]
  - - [2368, 256, 1, 3328]
    - [236, 6810.31]
  - - [5888, 3584, 1, 1280]
    - [234, 9535.55]
  - - [1856, 3584, 1, 3328]
    - [236, 9281.91]
  - - [5888, 128, 1, 1280]
    - [242, 8136.82]
  - - [1024, 2944, 1, 256]
    - [234, 7247.96]
  - - [448, 6784, 1, 1280]
    - [242, 7014.04]
  - - [256, 3584, 1, 1280]
    - [236, 7738.64]
  - - [448, 128, 1, 128]
    - [166, 496.048]
  - - [704, 5056, 1, 256]
    - [242, 8609.44]
  - - [3584, 1024, 1, 3328]
    - [235, 7765.73]
  - - [2944, 1856, 1, 1280]
    - [247, 7776.03]
  - - [128, 256, 1, 128]
    - [179, 296.308]
  - - [5056, 256, 1, 256]
    - [236, 7829.73]
  - - [2368, 3584, 1, 3328]
    - [235, 8896.08]
  - - [2944, 704, 1, 1280]
    - [245, 6855.83]
  - - [128, 4, 1, 256]
    - [254, 24.9242]
  - - [2944, 3584, 1, 1280]
    - [247, 9049.22]
  - - [1856, 5888, 1, 1280]
    - [242, 9432.06]
  - - [256, 256, 1, 1280]
    - [207, 3942.12]
  - - [5056, 448, 1, 3328]
    - [247, 4587.83]
  - - [4288, 1408, 1, 256]
    - [247, 5408.83]
  - - [3584, 64, 1, 256]
    - [216, 2496.71]
  - - [64, 1856, 1, 3328]
    - [189, 5896.78]
  - - [256, 1408, 1, 128]
    - [228, 1643.17]
  - - [5888, 1408, 1, 128]
    - [227, 4436.37]
  - - [4288, 2368, 1, 1280]
    - [236, 9433.04]
  - - [4, 4288, 1, 256]
    - [251, 442.732]
  - - [256, 4288, 1, 128]
    - [228, 2814.79]
  - - [256, 128, 1, 3328]
    - [217, 3951.26]
  - - [6784, 2368, 1, 256]
    - [236, 9169.99]
  - - [5888, 128, 1, 128]
    - [165, 3156.81]
  - - [4288, 1856, 1, 256]
    - [242, 5658.23]
  - - [1856, 256, 1, 3328]
    - [236, 7646.37]
  - - [1856, 2944, 1, 256]
    - [243, 6444.98]
  - - [5056, 1024, 1, 128]
    - [227, 4607.3]
  - - [64, 5888, 1, 1280]
    - [242, 5842.46]
  - - [1760, 7133, 1, 1760]
    - [235, 9097.84]
  - - [6784, 256, 1, 128]
    - [228, 3685.41]
  - - [5888, 704, 1, 128]
    - [227, 3656.23]
  - - [6784, 64, 1, 128]
    - [178, 2191.52]
  - - [1024, 4288, 1, 1280]
    - [242, 9199.32]
  - - [2368, 5056, 1, 3328]
    - [238, 9072.88]
  - - [448, 4, 1, 128]
    - [249, 5.42937]
  - - [4, 256, 1, 3328]
    - [259, 311.037]
  - - [4288, 1024, 1, 3328]
    - [240, 8660.33]
  - - [1024, 5056, 1, 3328]
    - [236, 8886.76]
  - - [1024, 1856, 1, 3328]
    - [241, 8426.24]
  - - [704, 704, 1, 1280]
    - [236, 7661.8]
  - - [128, 2368, 1, 1280]
    - [210, 5746.15]
  - - [1408, 128, 1, 3328]
    - [218, 6530.87]
  - - [3584, 256, 1, 1280]
    - [242, 7634.04]
  - - [4, 128, 1, 128]
    - [249, 2.07874]
  - - [704, 6784, 1, 128]
    - [231, 4589.59]
  - - [3584, 128, 1, 1280]
    - [236, 7078.24]
  - - [4, 256, 1, 1280]
    - [205, 178.187]
  - - [128, 704, 1, 3328]
    - [210, 5959.81]
  - - [4288, 6784, 1, 256]
    - [236, 9326.54]
  - - [3584, 2944, 1, 3328]
    - [238, 9114.16]
  - - [128, 1856, 1, 256]
    - [242, 3672.65]
  - - [64, 4288, 1, 256]
    - [236, 3457.51]
  - - [4, 3584, 1, 3328]
    - [185, 694.37]
  - - [64, 4, 1, 3328]
    - [205, 71.5738]
  - - [4, 64, 1, 3328]
    - [205, 91.9069]
  - - [5888, 2944, 1, 256]
    - [235, 7241.55]
  - - [2368, 6784, 1, 128]
    - [231, 5229.63]
  - - [448, 4288, 1, 1280]
    - [236, 8416.4]
  - - [448, 1856, 1, 3328]
    - [236, 7161.56]
  - - [4, 1024, 1, 256]
    - [202, 187.346]
  - - [5056, 4288, 1, 256]
    - [247, 8947.26]
  - - [1024, 448, 1, 256]
    - [242, 5318.96]
  - - [1024, 3584, 1, 256]
    - [237, 6152.04]
  - - [2944, 128, 1, 1280]
    - [218, 6053.63]
  - - [1856, 5056, 1, 128]
    - [228, 5091.42]
  - - [64, 256, 1, 256]
    - [191, 771.112]
  - - [1408, 4, 1, 128]
    - [248, 40.8758]
  - - [128, 2368, 1, 128]
    - [176, 1520.37]
  - - [256, 704, 1, 1280]
    - [236, 4329.81]
  - - [64, 2368, 1, 128]
    - [167, 1212.52]
  - - [6784, 6784, 1, 3328]
    - [247, 8310.67]
  - - [448, 5888, 1, 1280]
    - [242, 8502.33]
  - - [5056, 448, 1, 128]
    - [228, 4161.0]
  - - [3584, 2944, 1, 128]
    - [228, 4363.51]
  - - [6784, 256, 1, 1280]
    - [242, 8629.67]
  - - [256, 2944, 1, 1280]
    - [242, 7277.48]
  - - [64, 4288, 1, 128]
    - [167, 1822.06]
  - - [2368, 5888, 1, 3328]
    - [236, 9017.52]
  - - [4, 64, 1, 256]
    - [202, 16.1627]
  - - [704, 1024, 1, 3328]
    - [242, 8059.55]
  - - [2368, 1856, 1, 1280]
    - [242, 8813.24]
  - - [128, 448, 1, 128]
    - [163, 588.244]
  - - [128, 6784, 1, 256]
    - [242, 6538.28]
  - - [3584, 4288, 1, 128]
    - [228, 5025.46]
  - - [64, 448, 1, 128]
    - [180, 231.793]
  - - [5888, 4288, 1, 3328]
    - [236, 9515.88]
  - - [2368, 704, 1, 256]
    - [242, 7642.84]
  - - [256, 1856, 1, 3328]
    - [242, 6547.17]
  - - [1856, 128, 1, 256]
    - [236, 3782.28]
  - - [6784, 128, 1, 128]
    - [170, 2835.54]
  - - [3584, 1408, 1, 128]
    - [227, 3049.21]
  - - [1856, 5056, 1, 1280]
    - [243, 8863.3]
  - - [2944, 1024, 1, 1280]
    - [247, 8873.25]
  - - [5056, 4, 1, 256]
    - [183, 494.121]
  - - [3584, 5888, 1, 3328]
    - [235, 9585.25]
  - - [2368, 4288, 1, 256]
    - [247, 6419.05]
  - - [1024, 2368, 1, 3328]
    - [242, 8645.36]
  - - [64, 704, 1, 3328]
    - [224, 4399.93]
  - - [704, 1408, 1, 256]
    - [236, 7428.54]
  - - [6784, 1856, 1, 3328]
    - [247, 9163.66]
  - - [1024, 2944, 1, 128]
    - [231, 3551.98]
  - - [1024, 3584, 1, 1280]
    - [245, 9112.47]
  - - [4288, 5888, 1, 3328]
    - [235, 8524.05]
  - - [4288, 4, 1, 3328]
    - [202, 620.016]
  - - [256, 1408, 1, 256]
    - [236, 4505.7]
  - - [448, 2944, 1, 1280]
    - [236, 7612.87]
  - - [4, 5888, 1, 128]
    - [248, 174.564]
  - - [1024, 2944, 1, 3328]
    - [241, 9136.74]
  - - [3584, 6784, 1, 256]
    - [241, 7253.89]
  - - [256, 6784, 1, 1280]
    - [236, 8637.72]
  - - [1856, 3584, 1, 256]
    - [242, 8199.67]
  - - [128, 448, 1, 3328]
    - [223, 4799.92]
  - - [6784, 1856, 1, 128]
    - [228, 5185.62]
  - - [4, 448, 1, 256]
    - [202, 86.9848]
  - - [2944, 704, 1, 128]
    - [231, 3798.64]
  - - [256, 5888, 1, 1280]
    - [236, 8678.47]
  - - [4, 128, 1, 1280]
    - [205, 102.5]
  - - [4288, 6784, 1, 3328]
    - [241, 8209.4]
  - - [6784, 128, 1, 1280]
    - [218, 6562.99]
  - - [64, 1408, 1, 256]
    - [208, 2059.8]
  - - [7680, 5481, 1, 2560]
    - [247, 9426.79]
  - - [2368, 1408, 1, 128]
    - [228, 4532.5]
  - - [1856, 448, 1, 256]
    - [236, 6275.48]
  - - [1408, 1024, 1, 128]
    - [228, 3604.58]
  - - [128, 64, 1, 128]
    - [163, 87.4813]
  - - [6784, 3584, 1, 3328]
    - [243, 8991.92]
  - - [2944, 64, 1, 3328]
    - [212, 6043.36]
  - - [64, 64, 1, 128]
    - [168, 36.309]
  - - [2368, 5056, 1, 1280]
    - [242, 9438.48]
  - - [64, 4, 1, 1280]
    - [205, 40.2569]
  - - [1408, 2368, 1, 1280]
    - [238, 7738.16]
  - - [128, 1408, 1, 1280]
    - [210, 4937.74]
  - - [256, 64, 1, 3328]
    - [220, 2683.46]
  - - [2944, 4288, 1, 128]
    - [228, 5173.81]
  - - [2944, 2944, 1, 256]
    - [236, 8943.92]
  - - [2944, 4, 1, 1280]
    - [185, 617.857]
  - - [5888, 4, 1, 256]
    - [251, 483.218]
  - - [6784, 256, 1, 256]
    - [242, 7916.7]
  - - [256, 5056, 1, 3328]
    - [236, 8953.25]
  - - [128, 4288, 1, 1280]
    - [189, 6015.05]
  - - [5056, 1856, 1, 128]
    - [230, 4221.15]
  - - [5888, 1408, 1, 256]
    - [241, 9144.85]
  - - [128, 128, 1, 256]
    - [191, 759.938]
  - - [5056, 4, 1, 3328]
    - [251, 642.818]
  - - [4288, 3584, 1, 3328]
    - [237, 9300.05]
  - - [448, 704, 1, 3328]
    - [243, 4481.08]
  - - [448, 448, 1, 128]
    - [167, 1360.81]
  - - [1024, 2368, 1, 1280]
    - [236, 8570.29]
  - - [1856, 704, 1, 3328]
    - [236, 8448.26]
  - - [4, 2368, 1, 128]
    - [248, 64.5902]
  - - [5888, 6784, 1, 3328]
    - [243, 9447.12]
  - - [704, 4288, 1, 1280]
    - [245, 7476.87]
  - - [704, 256, 1, 256]
    - [236, 2957.62]
  - - [6784, 448, 1, 3328]
    - [239, 8886.22]
  - - [4288, 1024, 1, 128]
    - [227, 3864.49]
  - - [49, 512, 128, 2048]
    - [270, 7112.78]
  - - [196, 256, 256, 1024]
    - [264, 8302.7]
  - - [784, 512, 256, 128]
    - [262, 9061.36]
  - - [49, 2048, 128, 512]
    - [260, 6963.36]
  - - [784, 512, 64, 128]
    - [262, 8822.62]
  - - [784, 128, 128, 512]
    - [269, 8983.63]
  - - [196, 256, 64, 1024]
    - [268, 7823.5]
  - - [3136, 256, 256, 64]
    - [265, 9051.38]
  - - [3136, 64, 128, 64]
    - [261, 8581.35]
  - - [49, 2048, 256, 512]
    - [260, 7049.64]
  - - [196, 1024, 64, 256]
    - [263, 7953.69]
  - - [784, 128, 256, 512]
    - [271, 9102.99]
  - - [196, 256, 128, 1024]
    - [263, 8085.89]
  - - [3136, 64, 64, 256]
    - [267, 9266.13]
  - - [784, 128, 64, 512]
    - [268, 8809.39]
  - - [49, 2048, 64, 512]
    - [260, 6843.95]
  - - [3136, 64, 128, 256]
    - [267, 9381.39]
  - - [3136, 256, 128, 64]
    - [265, 8982.64]
  - - [784, 512, 128, 128]
    - [262, 8965.99]
  - - [3136, 256, 64, 64]
    - [265, 8879.8]
  - - [3136, 64, 256, 256]
    - [267, 9566.43]
  - - [3136, 64, 64, 64]
    - [266, 8314.05]
  - - [3136, 64, 256, 64]
    - [261, 8743.8]
  - - [196, 1024, 128, 256]
    - [264, 8119.43]
  - - [49, 512, 64, 2048]
    - [272, 7055.41]
  - - [49, 512, 256, 2048]
    - [273, 7166.41]
  - - [196, 1024, 256, 256]
    - [264, 8210.66]
  - - [5329, 160, 64, 64]
    - [280, 8156.89]
  - - [1225, 288, 64, 48]
    - [284, 6926.23]
  - - [1225, 192, 64, 64]
    - [286, 7840.1]
  - - [64, 1280, 64, 384]
    - [287, 9276.11]
  - - [1225, 384, 64, 192]
    - [277, 9162.35]
  - - [1225, 288, 64, 64]
    - [278, 7495.27]
  - - [5329, 64, 64, 80]
    - [279, 8480.13]
  - - [289, 1024, 64, 256]
    - [277, 8483.83]
  - - [289, 768, 64, 192]
    - [283, 8234.84]
  - - [289, 768, 64, 128]
    - [283, 7988.81]
  - - [64, 1536, 64, 384]
    - [287, 9323.65]
  - - [1225, 384, 64, 64]
    - [286, 8158.8]
  - - [64, 2048, 64, 192]
    - [283, 8818.61]
  - - [64, 1280, 64, 320]
    - [279, 9202.17]
  - - [1225, 384, 64, 96]
    - [277, 8540.7]
  - - [64, 1280, 64, 448]
    - [283, 9317.82]
  - - [289, 768, 64, 160]
    - [287, 8128.81]
  - - [1225, 192, 64, 32]
    - [286, 6495.37]
  - - [64, 1536, 64, 256]
    - [283, 9143.0]
  - - [1225, 256, 64, 48]
    - [281, 7545.36]
  - - [1225, 256, 64, 64]
    - [282, 7972.45]
  - - [1225, 192, 64, 48]
    - [285, 7348.9]
  - - [289, 1024, 64, 384]
    - [275, 8725.66]
  - - [289, 1024, 64, 192]
    - [277, 8313.16]
  - - [64, 1280, 64, 192]
    - [279, 8768.68]
  - - [64, 2048, 64, 320]
    - [276, 9147.98]
  - - [64, 2048, 64, 448]
    - [274, 9304.16]
  - - [64, 2048, 64, 384]
    - [276, 9235.28]
  - - [289, 1024, 64, 128]
    - [283, 7989.51]
  - - [4096, 1024, 1, 2984]
    - [322, 9846.39]
  - - [1024, 4096, 1, 3437]
    - [323, 9915.8]
  - - [1024, 4096, 1, 3235]
    - [316, 9914.02]
  - - [4096, 1024, 1, 4032]
    - [322, 9926.06]
  - - [1024, 4096, 1, 3334]
    - [323, 9918.27]
  - - [4096, 1024, 1, 3288]
    - [323, 9854.67]
  - - [1024, 4096, 1, 3515]
    - [323, 9924.03]
  - - [4096, 1024, 1, 3437]
    - [323, 9869.63]
  - - [1024, 4096, 1, 3259]
    - [323, 9907.65]
  - - [1024, 4096, 1, 3384]
    - [315, 9921.21]
  - - [64, 92, 688, 92]
    - [293, 6137.89]
  - - [4096, 1024, 1, 3458]
    - [322, 9887.69]
  - - [1024, 4096, 1, 3412]
    - [322, 9930.56]
  - - [1024, 4096, 1, 3529]
    - [316, 9924.54]
  - - [1024, 4096, 1, 4032]
    - [323, 9963.48]
  - - [4096, 1024, 1, 3999]
    - [323, 9895.0]
  - - [1024, 4096, 1, 3079]
    - [316, 9894.58]
  - - [1024, 4096, 1, 3876]
    - [315, 9949.39]
  - - [1024, 4096, 1, 3450]
    - [323, 9915.65]
  - - [1024, 4096, 1, 3256]
    - [323, 9911.18]
  - - [4096, 1024, 1, 3403]
    - [322, 9858.93]
  - - [1024, 1024, 1, 3975]
    - [313, 8990.81]
  - - [1024, 4096, 1, 3359]
    - [323, 9915.0]
  - - [4096, 1024, 1, 3549]
    - [322, 9870.66]
  - - [4096, 1024, 1, 3176]
    - [323, 9855.92]
  - - [1024, 4096, 1, 3504]
    - [315, 9934.17]
  - - [4096, 1024, 1, 3314]
    - [322, 9873.9]
  - - [4096, 1024, 1, 3183]
    - [322, 9843.84]
  - - [1024, 4096, 1, 3209]
    - [316, 9904.97]
  - - [1024, 4096, 1, 3720]
    - [315, 9934.16]
  - - [1024, 4096, 1, 3859]
    - [315, 9952.53]
  - - [1024, 33708, 1, 4059]
    - [315, 10321.5]
  - - [1024, 4096, 1, 3968]
    - [315, 9955.96]
  - - [64, 123, 528, 123]
    - [288, 6916.21]
  - - [4096, 1024, 1, 3477]
    - [323, 9872.03]
  - - [4096, 1024, 1, 3233]
    - [323, 9862.35]
  - - [4096, 1024, 1, 3409]
    - [323, 9876.86]
  - - [4096, 1024, 1, 3564]
    - [323, 9870.49]
  - - [64, 102, 624, 100]
    - [288, 5773.16]
  - - [4096, 1024, 1, 3190]
    - [322, 9850.97]
  - - [64, 112, 576, 111]
    - [288, 6517.35]
  - - [1024, 4096, 1, 3288]
    - [322, 9911.9]
  - - [4096, 1024, 1, 3451]
    - [322, 9859.61]
  - - [1024, 4096, 1, 3348]
    - [315, 9915.47]
  - - [64, 102, 624, 102]
    - [288, 5783.7]
  - - [1024, 4096, 1, 3465]
    - [316, 9913.12]
  - - [1024, 33708, 1, 4032]
    - [315, 10340.4]
  - - [1024, 33708, 1, 3840]
    - [315, 10341.8]
  - - [4096, 1024, 1, 3391]
    - [323, 9861.77]
  - - [1024, 4096, 1, 3530]
    - [315, 9920.44]
  - - [4096, 1024, 1, 3209]
    - [322, 9847.0]
  - - [1024, 4096, 1, 3457]
    - [316, 9917.29]
  - - [1024, 4096, 1, 3386]
    - [315, 9917.65]
  - - [4096, 1024, 1, 3350]
    - [322, 9884.54]
  - - [1024, 4096, 1, 3184]
    - [323, 9925.98]
  - - [1024, 4096, 1, 3093]
    - [322, 9902.55]
  - - [64, 133, 480, 135]
    - [305, 6205.97]
  - - [1024, 4096, 1, 3400]
    - [315, 9917.1]
  - - [1024, 1024, 1, 4026]
    - [321, 9014.39]
  - - [1024, 4096, 1, 3214]
    - [315, 9895.94]
  - - [4096, 1024, 1, 3406]
    - [323, 9857.82]
  - - [1024, 4096, 1, 3565]
    - [322, 9919.37]
  - - [4096, 1024, 1, 3536]
    - [323, 9889.06]
  - - [1024, 4096, 1, 3183]
    - [322, 9907.55]
  - - [1024, 4096, 1, 3462]
    - [323, 9922.4]
  - - [4096, 1024, 1, 3130]
    - [316, 9846.04]
  - - [4096, 1024, 1, 3381]
    - [323, 9868.27]
  - - [4096, 1024, 1, 3298]
    - [322, 9870.54]
  - - [1024, 4096, 1, 3292]
    - [315, 9906.3]
  - - [4096, 1024, 1, 3289]
    - [322, 9856.55]
  - - [64, 160, 400, 159]
    - [308, 7427.84]
  - - [1024, 4096, 1, 3379]
    - [315, 9917.09]
  - - [1024, 4096, 1, 3990]
    - [316, 9947.37]
  - - [1024, 4096, 1, 3540]
    - [323, 9935.76]
  - - [4096, 1024, 1, 3412]
    - [323, 9867.56]
  - - [1024, 1024, 1, 3780]
    - [318, 9036.26]
  - - [1024, 4096, 1, 3555]
    - [322, 9927.37]
  - - [1024, 4096, 1, 3518]
    - [316, 9925.55]
  - - [4096, 1024, 1, 3189]
    - [322, 9861.24]
  - - [1024, 4096, 1, 3298]
    - [316, 9923.22]
  - - [4096, 1024, 1, 3072]
    - [322, 9872.08]
  - - [1024, 4096, 1, 3393]
    - [323, 9929.28]
  - - [1024, 4096, 1, 3207]
    - [315, 9912.81]
  - - [64, 228, 272, 232]
    - [311, 7350.14]
  - - [64, 23, 2720, 23]
    - [292, 2640.25]
  - - [4096, 1024, 1, 3487]
    - [323, 9860.91]
  - - [1024, 1024, 1, 3822]
    - [321, 8993.96]
  - - [64, 77, 816, 77]
    - [293, 5273.19]
  - - [4096, 1024, 1, 3431]
    - [323, 9867.53]
  - - [4096, 1024, 1, 3378]
    - [322, 9888.14]
  - - [4096, 1024, 1, 3529]
    - [316, 9879.5]
  - - [4096, 1024, 1, 3460]
    - [323, 9877.25]
  - - [1024, 4096, 1, 3336]
    - [315, 9912.41]
  - - [1024, 4096, 1, 3501]
    - [316, 9914.4]
  - - [64, 159, 400, 159]
    - [306, 7016.51]
  - - [1024, 4096, 1, 3584]
    - [323, 9940.59]
  - - [64, 135, 480, 134]
    - [306, 6241.39]
  - - [64, 99, 624, 99]
    - [297, 5617.39]
  - - [4096, 1024, 1, 2499]
    - [322, 9813.57]
  - - [1024, 1024, 1, 3942]
    - [318, 9060.01]
  - - [4096, 1024, 1, 3352]
    - [322, 9867.12]
  - - [1024, 4096, 1, 3543]
    - [323, 9928.77]
  - - [1024, 4096, 1, 3476]
    - [322, 9931.58]
  - - [1024, 33708, 1, 3822]
    - [315, 10324.7]
  - - [1024, 4096, 1, 3436]
    - [315, 9917.28]
  - - [1024, 1024, 1, 3861]
    - [314, 8998.49]
  - - [1024, 1024, 1, 4000]
    - [319, 9058.3]
  - - [1024, 4096, 1, 3594]
    - [315, 9927.88]
  - - [4096, 1024, 1, 3514]
    - [323, 9872.3]
  - - [1024, 4096, 1, 3064]
    - [322, 9907.1]
  - - [4096, 1024, 1, 3371]
    - [315, 9857.74]
  - - [4096, 1024, 1, 3558]
    - [323, 9876.31]
  - - [4096, 1024, 1, 3517]
    - [322, 9866.45]
  - - [4096, 1024, 1, 3144]
    - [322, 9846.36]
  - - [1024, 4096, 1, 3312]
    - [315, 9932.85]
  - - [4096, 1024, 1, 3079]
    - [322, 9851.1]
  - - [1024, 4096, 1, 3415]
    - [315, 9919.47]
  - - [1024, 4096, 1, 3221]
    - [322, 9908.18]
  - - [1024, 4096, 1, 3978]
    - [316, 9944.41]
  - - [4096, 1024, 1, 3876]
    - [322, 9898.99]
  - - [1024, 4096, 1, 3528]
    - [315, 9919.6]
  - - [1024, 4096, 1, 3181]
    - [323, 9894.86]
  - - [4096, 1024, 1, 3445]
    - [322, 9878.54]
  - - [4096, 1024, 1, 3450]
    - [315, 9864.82]
  - - [4096, 1024, 1, 3377]
    - [322, 9879.69]
  - - [1024, 4096, 1, 3532]
    - [316, 9928.19]
  - - [1024, 33708, 1, 3944]
    - [315, 10329.7]
  - - [4096, 1024, 1, 3483]
    - [322, 9861.83]
  - - [1024, 4096, 1, 3358]
    - [315, 9903.69]
  - - [4096, 1024, 1, 3464]
    - [322, 9876.84]
  - - [4096, 1024, 1, 3282]
    - [315, 9859.23]
  - - [4096, 1024, 1, 3256]
    - [323, 9855.1]
  - - [1024, 4096, 1, 3057]
    - [322, 9910.75]
  - - [4096, 1024, 1, 3481]
    - [322, 9866.29]
  - - [4096, 1024, 1, 3340]
    - [322, 9862.25]
  - - [1024, 1024, 1, 3870]
    - [321, 9082.45]
  - - [1024, 4096, 1, 3273]
    - [315, 9916.29]
  - - [64, 65, 992, 65]
    - [306, 4683.01]
  - - [4096, 1024, 1, 3392]
    - [316, 9881.12]
  - - [4096, 1024, 1, 3337]
    - [322, 9864.5]
  - - [4096, 1024, 1, 3359]
    - [322, 9874.42]
  - - [4096, 1024, 1, 3498]
    - [323, 9864.35]
  - - [4096, 1024, 1, 3169]
    - [322, 9851.1]
  - - [1024, 33708, 1, 3859]
    - [316, 10332.6]
  - - [64, 19, 3264, 19]
    - [292, 2182.14]
  - - [1024, 4096, 1, 3103]
    - [315, 9898.9]
  - - [4096, 1024, 1, 3900]
    - [322, 9897.12]
  - - [1024, 4096, 1, 3442]
    - [322, 9938.97]
  - - [1024, 4096, 1, 3248]
    - [322, 9939.92]
  - - [1024, 4096, 1, 3351]
    - [323, 9923.23]
  - - [4096, 1024, 1, 3593]
    - [322, 9894.36]
  - - [1024, 4096, 1, 3780]
    - [322, 9941.96]
  - - [64, 133, 480, 133]
    - [306, 6180.79]
  - - [1024, 33708, 1, 3681]
    - [315, 10332.3]
  - - [4096, 1024, 1, 3374]
    - [316, 9859.36]
  - - [1024, 4096, 1, 3557]
    - [315, 9928.2]
  - - [4096, 1024, 1, 3906]
    - [322, 9907.07]
  - - [4096, 1024, 1, 3504]
    - [322, 9886.05]
  - - [1024, 4096, 1, 3270]
    - [322, 9916.37]
  - - [4096, 1024, 1, 3098]
    - [315, 9854.76]
  - - [64, 232, 272, 232]
    - [311, 7394.1]
  - - [4096, 1024, 1, 3216]
    - [323, 9876.57]
  - - [64, 148, 432, 148]
    - [308, 6663.85]
  - - [1024, 4096, 1, 3550]
    - [322, 9920.28]
  - - [4096, 1024, 1, 3449]
    - [316, 9870.57]
  - - [1024, 4096, 1, 3403]
    - [323, 9908.21]
  - - [1024, 4096, 1, 3523]
    - [322, 9932.71]
  - - [1024, 4096, 1, 3486]
    - [322, 9917.46]
  - - [1024, 4096, 1, 3564]
    - [322, 9923.44]
  - - [1024, 33708, 1, 4005]
    - [315, 10339.5]
  - - [4096, 1024, 1, 3296]
    - [322, 9879.78]
  - - [1024, 4096, 1, 3263]
    - [315, 9907.17]
  - - [64, 25, 2512, 25]
    - [292, 2848.17]
  - - [1024, 4096, 1, 3130]
    - [323, 9900.1]
  - - [1024, 4096, 1, 3295]
    - [323, 9895.45]
  - - [1024, 33708, 1, 3925]
    - [316, 10342.3]
  - - [1024, 4096, 1, 3378]
    - [315, 9921.37]
  - - [4096, 1024, 1, 3720]
    - [323, 9885.82]
  - - [4096, 1024, 1, 3399]
    - [322, 9880.65]
  - - [4096, 1024, 1, 3543]
    - [323, 9870.73]
  - - [64, 9, 6544, 9]
    - [295, 955.17]
  - - [4096, 1024, 1, 3497]
    - [322, 9868.43]
  - - [4096, 1024, 1, 3594]
    - [323, 9876.88]
  - - [1024, 4096, 1, 3144]
    - [323, 9901.96]
  - - [1024, 4096, 1, 3975]
    - [316, 9950.19]
  - - [4096, 1024, 1, 3205]
    - [323, 9856.07]
  - - [1024, 33708, 1, 3995]
    - [315, 10331.1]
  - - [1024, 4096, 1, 3392]
    - [315, 9935.78]
  - - [1024, 4096, 1, 3055]
    - [323, 9893.25]
  - - [1024, 4096, 1, 4026]
    - [323, 9940.22]
  - - [4096, 1024, 1, 3557]
    - [322, 9884.0]
  - - [4096, 1024, 1, 3515]
    - [322, 9871.94]
  - - [4096, 1024, 1, 3486]
    - [323, 9860.74]
  - - [4096, 1024, 1, 3457]
    - [323, 9885.37]
  - - [1024, 4096, 1, 3511]
    - [315, 9928.24]
  - - [4096, 1024, 1, 3138]
    - [322, 9854.06]
  - - [1024, 4096, 1, 3339]
    - [316, 9912.89]
  - - [1024, 4096, 1, 3939]
    - [316, 9952.26]
  - - [4096, 1024, 1, 3500]
    - [316, 9863.62]
  - - [4096, 1024, 1, 3395]
    - [323, 9883.82]
  - - [4096, 1024, 1, 3968]
    - [323, 9920.36]
  - - [4096, 1024, 1, 4020]
    - [323, 9912.81]
  - - [4096, 1024, 1, 3942]
    - [322, 9910.17]
  - - [1024, 1024, 1, 4032]
    - [312, 9024.74]
  - - [4096, 1024, 1, 3349]
    - [323, 9866.04]
  - - [1024, 4096, 1, 3322]
    - [316, 9908.43]
  - - [4096, 1024, 1, 3452]
    - [322, 9872.69]
  - - [1024, 4096, 1, 3417]
    - [322, 9912.64]
  - - [1024, 1024, 1, 4012]
    - [320, 9085.47]
  - - [1024, 4096, 1, 3526]
    - [316, 9920.36]
  - - [4096, 1024, 1, 3485]
    - [316, 9861.64]
  - - [1024, 1024, 1, 3681]
    - [320, 8991.46]
  - - [4096, 1024, 1, 3303]
    - [323, 9861.3]
  - - [4096, 1024, 1, 3344]
    - [323, 9892.44]
  - - [1024, 4096, 1, 3479]
    - [323, 9921.77]
  - - [4096, 1024, 1, 3300]
    - [322, 9868.64]
  - - [1024, 4096, 1, 3439]
    - [316, 9918.29]
  - - [4096, 1024, 1, 3280]
    - [323, 9875.29]
  - - [1024, 4096, 1, 3245]
    - [315, 9910.49]
  - - [1024, 4096, 1, 3328]
    - [315, 9941.6]
  - - [4096, 1024, 1, 3418]
    - [315, 9870.76]
  - - [1024, 4096, 1, 3493]
    - [323, 9938.45]
  - - [1024, 4096, 1, 3500]
    - [315, 9916.93]
  - - [1024, 4096, 1, 3166]
    - [315, 9898.12]
  - - [4096, 1024, 1, 3126]
    - [316, 9847.04]
  - - [1024, 4096, 1, 3277]
    - [323, 9898.66]
  - - [1024, 4096, 1, 3315]
    - [322, 9923.11]
  - - [1024, 1024, 1, 3927]
    - [313, 8987.71]
  - - [1024, 4096, 1, 3414]
    - [315, 9916.01]
  - - [4096, 1024, 1, 3531]
    - [322, 9871.92]
  - - [4096, 1024, 1, 3484]
    - [315, 9867.86]
  - - [1024, 4096, 1, 3180]
    - [322, 9904.09]
  - - [4096, 1024, 1, 3360]
    - [322, 9879.57]
  - - [1024, 33708, 1, 3990]
    - [315, 10335.0]
  - - [4096, 1024, 1, 3466]
    - [322, 9875.02]
  - - [1024, 4096, 1, 3428]
    - [315, 9916.02]
  - - [1024, 4096, 1, 3137]
    - [322, 9913.27]
  - - [4096, 1024, 1, 4059]
    - [322, 9901.86]
  - - [1024, 4096, 1, 3353]
    - [322, 9914.6]
  - - [1024, 4096, 1, 3942]
    - [322, 9944.5]
  - - [4096, 1024, 1, 3506]
    - [315, 9875.75]
  - - [1024, 1024, 1, 3894]
    - [313, 8946.55]
  - - [4096, 1024, 1, 3508]
    - [323, 9877.67]
  - - [64, 132, 480, 135]
    - [306, 6164.86]
  - - [4096, 1024, 1, 3956]
    - [315, 9907.83]
  - - [64, 7, 8192, 7]
    - [294, 813.078]
  - - [1024, 4096, 1, 3272]
    - [316, 9909.82]
  - - [1024, 4096, 1, 3443]
    - [323, 9929.83]
  - - [1024, 4096, 1, 3375]
    - [323, 9909.23]
  - - [1024, 4096, 1, 3525]
    - [323, 9929.27]
  - - [4096, 1024, 1, 3472]
    - [322, 9889.97]
  - - [1024, 4096, 1, 3520]
    - [315, 9947.79]
  - - [4096, 1024, 1, 3322]
    - [322, 9862.98]
  - - [4096, 1024, 1, 3387]
    - [322, 9861.62]
  - - [64, 8, 7280, 8]
    - [300, 1024.1]
  - - [1024, 33708, 1, 3939]
    - [315, 10339.9]
  - - [4096, 1024, 1, 3345]
    - [323, 9873.68]
  - - [4096, 1024, 1, 2967]
    - [322, 9839.21]
  - - [1024, 4096, 1, 3453]
    - [315, 9905.81]
  - - [1024, 4096, 1, 3640]
    - [322, 9934.05]
  - - [4096, 1024, 1, 3291]
    - [316, 9860.84]
  - - [1024, 4096, 1, 3350]
    - [323, 9918.03]
  - - [4096, 1024, 1, 3417]
    - [322, 9864.61]
  - - [64, 135, 480, 135]
    - [306, 6265.45]
  - - [1024, 4096, 1, 3467]
    - [316, 9906.95]
  - - [1024, 4096, 1, 3491]
    - [322, 9933.3]
  - - [1024, 4096, 1, 3822]
    - [322, 9938.75]
  - - [4096, 1024, 1, 3292]
    - [322, 9849.21]
  - - [1024, 4096, 1, 3231]
    - [315, 9905.82]
  - - [1024, 4096, 1, 3364]
    - [316, 9930.32]
  - - [1024, 4096, 1, 3995]
    - [316, 9943.76]
  - - [1024, 4096, 1, 3545]
    - [315, 9928.53]
  - - [1024, 1024, 1, 3876]
    - [313, 9003.04]
  - - [1024, 4096, 1, 3186]
    - [315, 9921.01]
  - - [4096, 1024, 1, 3432]
    - [322, 9875.29]
  - - [64, 84, 752, 85]
    - [293, 5704.51]
  - - [4096, 1024, 1, 3367]
    - [316, 9868.06]
  - - [4096, 1024, 1, 3503]
    - [323, 9871.01]
  - - [1024, 4096, 1, 3095]
    - [316, 9902.9]
  - - [4096, 1024, 1, 3465]
    - [323, 9872.17]
  - - [1024, 4096, 1, 3402]
    - [322, 9914.66]
  - - [4096, 1024, 1, 3140]
    - [322, 9847.95]
  - - [1024, 1024, 1, 4050]
    - [319, 9055.75]
  - - [4096, 1024, 1, 3424]
    - [316, 9894.62]
  - - [4096, 1024, 1, 3257]
    - [315, 9860.97]
  - - [4096, 1024, 1, 2917]
    - [322, 9845.91]
  - - [1024, 33708, 1, 3640]
    - [315, 10321.7]
  - - [1024, 4096, 1, 3456]
    - [315, 9950.35]
  - - [1024, 4096, 1, 3014]
    - [315, 9907.97]
  - - [4096, 1024, 1, 3372]
    - [323, 9868.37]
  - - [64, 132, 480, 132]
    - [306, 6121.62]
  - - [1024, 4096, 1, 3294]
    - [323, 9903.23]
  - - [4096, 1024, 1, 3446]
    - [323, 9871.69]
  - - [1024, 4096, 1, 3389]
    - [316, 9909.27]
  - - [4096, 1024, 1, 3259]
    - [322, 9860.76]
  - - [4096, 1024, 1, 3544]
    - [322, 9878.76]
  - - [4096, 1024, 1, 3479]
    - [323, 9873.97]
  - - [4096, 1024, 1, 3542]
    - [322, 9878.97]
  - - [4096, 1024, 1, 3321]
    - [315, 9861.13]
  - - [1024, 4096, 1, 3147]
    - [315, 9894.77]
  - - [1024, 4096, 1, 3944]
    - [315, 9950.51]
  - - [4096, 1024, 1, 3870]
    - [323, 9881.74]
  - - [1024, 4096, 1, 3308]
    - [315, 9907.26]
  - - [4096, 1024, 1, 3401]
    - [322, 9864.59]
  - - [1024, 4096, 1, 3395]
    - [315, 9929.03]
  - - [64, 99, 624, 102]
    - [291, 5651.36]
  - - [1024, 4096, 1, 3563]
    - [322, 9922.76]
  - - [1024, 33708, 1, 3870]
    - [315, 10325.4]
  - - [4096, 1024, 1, 3494]
    - [322, 9875.37]
  - - [1024, 4096, 1, 3271]
    - [315, 9913.09]
  - - [1024, 33708, 1, 3910]
    - [315, 10341.5]
  - - [1024, 4096, 1, 3287]
    - [323, 9924.87]
  - - [1024, 33708, 1, 3860]
    - [315, 10330.7]
  - - [64, 143, 432, 148]
    - [308, 6571.78]
  - - [1024, 1024, 1, 3584]
    - [320, 8975.31]
  - - [64, 162, 400, 162]
    - [310, 6822.26]
  - - [4096, 1024, 1, 3341]
    - [322, 9854.66]
  - - [1024, 4096, 1, 3136]
    - [315, 9926.86]
  - - [4096, 1024, 1, 3439]
    - [322, 9854.33]
  - - [64, 148, 432, 147]
    - [306, 6677.61]
  - - [1024, 4096, 1, 3751]
    - [322, 9938.48]
  - - [1024, 4096, 1, 3301]
    - [322, 9919.15]
  - - [4096, 1024, 1, 3468]
    - [323, 9859.83]
  - - [1024, 4096, 1, 3416]
    - [323, 9918.52]
  - - [4096, 1024, 1, 3163]
    - [322, 9854.65]
  - - [1024, 4096, 1, 3230]
    - [316, 9897.54]
  - - [1024, 4096, 1, 3581]
    - [316, 9915.48]
  - - [1024, 1024, 1, 3960]
    - [318, 9045.86]
  - - [4096, 1024, 1, 3463]
    - [323, 9884.74]
  - - [1024, 4096, 1, 3478]
    - [316, 9927.02]
  - - [4096, 1024, 1, 3262]
    - [322, 9852.22]
  - - [1024, 4096, 1, 3438]
    - [322, 9912.68]
  - - [1024, 4096, 1, 3244]
    - [315, 9900.51]
  - - [1024, 4096, 1, 3445]
    - [315, 9920.32]
  - - [4096, 1024, 1, 3328]
    - [322, 9888.07]
  - - [1024, 4096, 1, 3492]
    - [316, 9937.22]
  - - [4096, 1024, 1, 3211]
    - [316, 9847.95]
  - - [1024, 4096, 1, 3910]
    - [323, 9946.57]
  - - [1024, 4096, 1, 3314]
    - [315, 9932.6]
  - - [4096, 1024, 1, 3859]
    - [322, 9902.84]
  - - [4096, 1024, 1, 3383]
    - [322, 9875.2]
  - - [1024, 4096, 1, 3409]
    - [323, 9926.79]
  - - [1024, 4096, 1, 4020]
    - [315, 9941.8]
  - - [4096, 1024, 1, 3530]
    - [322, 9872.81]
  - - [4096, 1024, 1, 3411]
    - [323, 9875.02]
  - - [1024, 4096, 1, 3566]
    - [323, 9921.1]
  - - [4096, 1024, 1, 3493]
    - [315, 9875.74]
  - - [4096, 1024, 1, 3184]
    - [322, 9873.14]
  - - [1024, 4096, 1, 3072]
    - [315, 9923.79]
  - - [1024, 4096, 1, 3431]
    - [316, 9911.03]
  - - [4096, 1024, 1, 3306]
    - [323, 9853.42]
  - - [1024, 4096, 1, 3352]
    - [323, 9913.32]
  - - [4096, 1024, 1, 3295]
    - [322, 9862.68]
  - - [64, 123, 528, 122]
    - [288, 6950.25]
  - - [1024, 4096, 1, 3517]
    - [316, 9920.06]
  - - [64, 102, 624, 101]
    - [296, 5791.49]
  - - [4096, 1024, 1, 3426]
    - [322, 9891.14]
  - - [4096, 1024, 1, 3385]
    - [322, 9868.41]
  - - [1024, 1024, 1, 3978]
    - [313, 9008.48]
  - - [4096, 1024, 1, 3572]
    - [315, 9884.81]
  - - [4096, 1024, 1, 3459]
    - [322, 9892.17]
  - - [1024, 4096, 1, 3374]
    - [323, 9908.52]
  - - [4096, 1024, 1, 3166]
    - [322, 9832.45]
  - - [4096, 1024, 1, 3093]
    - [323, 9841.25]
  - - [4096, 1024, 1, 3523]
    - [316, 9879.05]
  - - [4096, 1024, 1, 3413]
    - [316, 9880.81]
  - - [1024, 4096, 1, 3996]
    - [315, 9948.14]
  - - [1024, 4096, 1, 3452]
    - [323, 9915.97]
  - - [4096, 1024, 1, 3232]
    - [323, 9876.54]
  - - [4096, 1024, 1, 3400]
    - [315, 9867.15]
  - - [4096, 1024, 1, 3334]
    - [322, 9868.99]
  - - [1024, 4096, 1, 3345]
    - [315, 9920.6]
  - - [1024, 4096, 1, 3538]
    - [322, 9933.34]
  - - [1024, 4096, 1, 3466]
    - [322, 9920.85]
  - - [4096, 1024, 1, 3315]
    - [322, 9876.87]
  - - [4096, 1024, 1, 3214]
    - [323, 9847.93]
  - - [1024, 33708, 1, 3900]
    - [315, 10331.7]
  - - [64, 160, 400, 160]
    - [308, 7440.61]
  - - [1024, 4096, 1, 3367]
    - [322, 9926.32]
  - - [1024, 4096, 1, 2917]
    - [323, 9904.57]
  - - [1024, 1024, 1, 3995]
    - [314, 9000.33]
  - - [64, 132, 480, 134]
    - [306, 6146.88]
  - - [1024, 4096, 1, 3544]
    - [323, 9924.14]
  - - [4096, 1024, 1, 3414]
    - [323, 9867.9]
  - - [4096, 1024, 1, 3565]
    - [316, 9870.13]
  - - [1024, 4096, 1, 3512]
    - [322, 9919.84]
  - - [1024, 4096, 1, 3191]
    - [323, 9914.79]
  - - [64, 27, 2336, 27]
    - [290, 3054.71]
  - - [1024, 4096, 1, 3289]
    - [323, 9917.2]
  - - [4096, 1024, 1, 3290]
    - [322, 9858.41]
  - - [1024, 4096, 1, 3211]
    - [323, 9897.16]
  - - [1024, 33708, 1, 3969]
    - [316, 10336.1]
  - - [4096, 1024, 1, 3566]
    - [322, 9863.0]
  - - [64, 111, 576, 111]
    - [296, 6400.91]
  - - [1024, 4096, 1, 3459]
    - [322, 9923.03]
  - - [1024, 4096, 1, 3372]
    - [315, 9909.86]
  - - [4096, 1024, 1, 3339]
    - [322, 9859.3]
  - - [4096, 1024, 1, 3425]
    - [322, 9889.34]
  - - [4096, 1024, 1, 3388]
    - [322, 9871.67]
  - - [1024, 4096, 1, 3531]
    - [315, 9919.0]
  - - [4096, 1024, 1, 3286]
    - [323, 9868.42]
  - - [4096, 1024, 1, 3462]
    - [322, 9881.88]
  - - [1024, 4096, 1, 3388]
    - [315, 9904.69]
  - - [4096, 1024, 1, 3165]
    - [315, 9836.33]
  - - [4096, 1024, 1, 3304]
    - [322, 9857.55]
  - - [1024, 4096, 1, 2736]
    - [322, 9901.07]
  - - [4096, 1024, 1, 3397]
    - [322, 9872.1]
  - - [64, 38, 1680, 38]
    - [289, 3459.52]
  - - [1024, 4096, 1, 3311]
    - [323, 9908.32]
  - - [1024, 4096, 1, 3394]
    - [323, 9929.43]
  - - [4096, 1024, 1, 2736]
    - [322, 9833.88]
  - - [1024, 4096, 1, 3559]
    - [316, 9925.33]
  - - [4096, 1024, 1, 3180]
    - [322, 9838.05]
  - - [1024, 4096, 1, 3480]
    - [315, 9922.46]
  - - [4096, 1024, 1, 3318]
    - [322, 9867.87]
  - - [4096, 1024, 1, 3213]
    - [322, 9846.02]
  - - [1024, 4096, 1, 3286]
    - [322, 9912.14]
  - - [4096, 1024, 1, 3471]
    - [322, 9874.24]
  - - [1024, 4096, 1, 3381]
    - [323, 9922.96]
  - - [64, 100, 624, 100]
    - [297, 5705.24]
  - - [4096, 1024, 1, 3502]
    - [322, 9872.44]
  - - [64, 16, 3840, 16]
    - [303, 2091.67]
  - - [1024, 4096, 1, 3552]
    - [315, 9943.89]
  - - [4096, 1024, 1, 3519]
    - [323, 9869.95]
  - - [1024, 4096, 1, 3300]
    - [316, 9916.15]
  - - [1024, 4096, 1, 3419]
    - [315, 9914.06]
  - - [4096, 1024, 1, 4030]
    - [316, 9893.73]
  - - [4096, 1024, 1, 3976]
    - [323, 9898.35]
  - - [1024, 4096, 1, 3473]
    - [323, 9928.42]
  - - [1024, 1024, 1, 3977]
    - [320, 9009.33]
  - - [4096, 1024, 1, 3428]
    - [322, 9876.79]
  - - [1024, 4096, 1, 3433]
    - [316, 9923.92]
  - - [4096, 1024, 1, 3534]
    - [316, 9864.0]
  - - [4096, 1024, 1, 3461]
    - [322, 9873.12]
  - - [4096, 1024, 1, 3681]
    - [322, 9898.57]
  - - [4096, 1024, 1, 3495]
    - [323, 9876.08]
  - - [4096, 1024, 1, 3351]
    - [322, 9879.71]
  - - [1024, 4096, 1, 4059]
    - [315, 9948.61]
  - - [4096, 1024, 1, 3990]
    - [322, 9900.76]
  - - [1024, 4096, 1, 3325]
    - [316, 9903.3]
  - - [1024, 4096, 1, 3408]
    - [322, 9932.15]
  - - [64, 59, 1088, 59]
    - [296, 5343.77]
  - - [4096, 1024, 1, 3394]
    - [323, 9878.17]
  - - [1024, 4096, 1, 3573]
    - [323, 9935.3]
  - - [4096, 1024, 1, 3386]
    - [322, 9866.38]
  - - [4096, 1024, 1, 3540]
    - [322, 9882.33]
  - - [1024, 4096, 1, 3182]
    - [316, 9894.45]
  - - [1024, 4096, 1, 3430]
    - [315, 9915.24]
  - - [1024, 4096, 1, 3236]
    - [323, 9920.56]
  - - [4096, 1024, 1, 2977]
    - [322, 9848.08]
  - - [1024, 4096, 1, 3355]
    - [322, 9908.78]
  - - [4096, 1024, 1, 3139]
    - [322, 9850.71]
  - - [4096, 1024, 1, 3516]
    - [316, 9874.21]
  - - [4096, 1024, 1, 3368]
    - [316, 9872.64]
  - - [4096, 1024, 1, 3559]
    - [315, 9884.32]
  - - [64, 11, 5456, 11]
    - [303, 1382.67]
  - - [1024, 4096, 1, 3506]
    - [322, 9937.69]
  - - [1024, 4096, 1, 3145]
    - [315, 9905.11]
  - - [1024, 4096, 1, 3369]
    - [322, 9912.71]
  - - [64, 112, 576, 112]
    - [288, 6583.56]
  - - [4096, 1024, 1, 3522]
    - [322, 9889.47]
  - - [1024, 33708, 1, 3894]
    - [315, 10337.5]
  - - [64, 159, 400, 162]
    - [306, 7057.09]
  - - [4096, 1024, 1, 3336]
    - [322, 9867.67]
  - - [1024, 4096, 1, 3382]
    - [316, 9915.9]
  - - [4096, 1024, 1, 3533]
    - [322, 9878.56]
  - - [4096, 1024, 1, 4050]
    - [323, 9916.82]
  - - [4096, 1024, 1, 3480]
    - [316, 9869.32]
  - - [1024, 4096, 1, 3344]
    - [315, 9935.61]
  - - [64, 122, 528, 122]
    - [288, 6871.14]
  - - [1024, 4096, 1, 3509]
    - [316, 9925.8]
  - - [1024, 4096, 1, 3956]
    - [315, 9958.26]
  - - [4096, 1024, 1, 3616]
    - [322, 9904.63]
  - - [1024, 4096, 1, 3366]
    - [315, 9919.47]
  - - [4096, 1024, 1, 2935]
    - [315, 9833.23]
  - - [4096, 1024, 1, 3393]
    - [322, 9877.45]
  - - [4096, 1024, 1, 3547]
    - [316, 9865.1]
  - - [1024, 4096, 1, 3499]
    - [323, 9912.49]
  - - [4096, 1024, 1, 3357]
    - [322, 9855.28]
  - - [4096, 1024, 1, 3272]
    - [322, 9861.97]
  - - [4096, 1024, 1, 3207]
    - [322, 9847.78]
  - - [4096, 1024, 1, 3894]
    - [322, 9918.86]
  - - [1024, 4096, 1, 3444]
    - [322, 9932.71]
  - - [4096, 1024, 1, 3561]
    - [322, 9872.61]
  - - [4096, 1024, 1, 3376]
    - [322, 9885.59]
  - - [1024, 4096, 1, 3458]
    - [322, 9929.39]
  - - [4096, 1024, 1, 3231]
    - [316, 9847.08]
  - - [64, 228, 272, 228]
    - [317, 7302.69]
  - - [1024, 4096, 1, 3505]
    - [323, 9931.63]
  - - [4096, 1024, 1, 3277]
    - [322, 9857.2]
  - - [64, 21, 2976, 21]
    - [292, 2436.14]
  - - [1024, 4096, 1, 3391]
    - [322, 9911.25]
  - - [64, 32, 1984, 32]
    - [304, 3572.17]
  - - [1024, 4096, 1, 3536]
    - [323, 9946.9]
  - - [1024, 4096, 1, 3063]
    - [322, 9906.92]
  - - [1024, 1024, 1, 3925]
    - [314, 9011.45]
  - - [1024, 4096, 1, 3189]
    - [316, 9900.95]
  - - [1024, 4096, 1, 2505]
    - [322, 9854.85]
  - - [4096, 1024, 1, 3454]
    - [315, 9864.96]
  - - [1024, 4096, 1, 3405]
    - [323, 9906.33]
  - - [1024, 33708, 1, 4050]
    - [316, 10343.7]
  - - [4096, 1024, 1, 3520]
    - [322, 9887.03]
  - - [64, 93, 688, 93]
    - [299, 6222.86]
  - - [1024, 4096, 1, 3487]
    - [323, 9918.69]
  - - [1024, 4096, 1, 3558]
    - [323, 9930.99]
  - - [4096, 1024, 1, 3297]
    - [322, 9874.31]
  - - [1024, 1024, 1, 3840]
    - [318, 9075.42]
  - - [1024, 4096, 1, 3483]
    - [322, 9915.38]
  - - [1024, 1024, 1, 3956]
    - [321, 9010.03]
  - - [1024, 33708, 1, 3751]
    - [316, 10325.9]
  - - [4096, 1024, 1, 3380]
    - [322, 9888.47]
  - - [1024, 4096, 1, 3380]
    - [315, 9927.25]
  - - [1024, 4096, 1, 3396]
    - [323, 9931.96]
  - - [1024, 4096, 1, 3497]
    - [316, 9914.86]
  - - [1024, 4096, 1, 3502]
    - [323, 9921.52]
  - - [1024, 1024, 1, 3976]
    - [318, 9060.3]
  - - [1024, 4096, 1, 3138]
    - [316, 9908.66]
  - - [4096, 1024, 1, 3939]
    - [315, 9910.23]
  - - [1024, 4096, 1, 3303]
    - [316, 9916.64]
  - - [64, 111, 576, 112]
    - [296, 6495.19]
  - - [1024, 4096, 1, 3418]
    - [322, 9913.35]
  - - [1024, 4096, 1, 3224]
    - [316, 9904.05]
  - - [4096, 1024, 1, 3978]
    - [322, 9896.28]
  - - [1024, 4096, 1, 3472]
    - [315, 9937.48]
  - - [4096, 1024, 1, 3353]
    - [323, 9863.97]
  - - [4096, 1024, 1, 3362]
    - [322, 9871.06]
  - - [1024, 33708, 1, 3978]
    - [315, 10325.4]
  - - [64, 100, 624, 102]
    - [291, 5695.67]
  - - [1024, 4096, 1, 3432]
    - [323, 9915.56]
  - - [1024, 4096, 1, 3139]
    - [322, 9914.21]
  - - [1024, 4096, 1, 3341]
    - [323, 9912.1]
  - - [1024, 4096, 1, 3494]
    - [316, 9924.6]
  - - [1024, 4096, 1, 3969]
    - [315, 9952.28]
  - - [1024, 4096, 1, 3163]
    - [323, 9911.79]
  - - [1024, 1024, 1, 3955]
    - [313, 9097.86]
  - - [4096, 1024, 1, 3405]
    - [322, 9853.84]
  - - [1024, 1024, 1, 4030]
    - [313, 9083.86]
  - - [4096, 1024, 1, 3453]
    - [322, 9858.88]
  - - [1024, 4096, 1, 3411]
    - [323, 9926.54]
  - - [1024, 4096, 1, 3527]
    - [316, 9922.65]
  - - [4096, 1024, 1, 3474]
    - [322, 9878.49]
  - - [1024, 4096, 1, 3572]
    - [322, 9932.0]
  - - [4096, 1024, 1, 3293]
    - [322, 9848.26]
  - - [4096, 1024, 1, 3247]
    - [322, 9861.45]
  - - [64, 15, 4096, 15]
    - [303, 1955.75]
  - - [1024, 4096, 1, 3425]
    - [323, 9936.4]
  - - [1024, 4096, 1, 3354]
    - [315, 9917.55]
  - - [4096, 1024, 1, 3382]
    - [322, 9885.49]
  - - [4096, 1024, 1, 3236]
    - [322, 9860.6]
  - - [1024, 4096, 1, 3519]
    - [323, 9919.3]
  - - [4096, 1024, 1, 3354]
    - [322, 9854.75]
  - - [4096, 1024, 1, 3501]
    - [323, 9869.62]
  - - [1024, 1024, 1, 3906]
    - [321, 9104.99]
  - - [4096, 1024, 1, 3266]
    - [322, 9873.97]
  - - [64, 101, 624, 102]
    - [291, 5765.52]
  - - [1024, 4096, 1, 3368]
    - [322, 9909.77]
  - - [1024, 4096, 1, 4030]
    - [323, 9940.27]
  - - [1024, 4096, 1, 3533]
    - [316, 9916.64]
  - - [4096, 1024, 1, 3332]
    - [323, 9876.45]
  - - [4096, 1024, 1, 3584]
    - [322, 9896.6]
  - - [1024, 4096, 1, 3616]
    - [322, 9957.18]
  - - [4096, 1024, 1, 3265]
    - [322, 9877.78]
  - - [4096, 1024, 1, 3361]
    - [322, 9888.61]
  - - [4096, 1024, 1, 3467]
    - [322, 9863.4]
  - - [1024, 4096, 1, 3454]
    - [316, 9904.89]
  - - [1024, 4096, 1, 3101]
    - [323, 9893.12]
  - - [1024, 4096, 1, 3508]
    - [323, 9931.54]
  - - [4096, 1024, 1, 3267]
    - [322, 9864.48]
  - - [64, 54, 1184, 54]
    - [288, 4906.02]
  - - [4096, 1024, 1, 3419]
    - [322, 9872.56]
  - - [4096, 1024, 1, 3822]
    - [322, 9892.63]
  - - [1024, 4096, 1, 3266]
    - [322, 9918.58]
  - - [4096, 1024, 1, 3440]
    - [323, 9890.16]
  - - [1024, 4096, 1, 3361]
    - [322, 9930.97]
  - - [1024, 4096, 1, 3546]
    - [316, 9926.56]
  - - [4096, 1024, 1, 3473]
    - [322, 9889.06]
  - - [4096, 1024, 1, 3546]
    - [323, 9872.27]
  - - [1024, 4096, 1, 3088]
    - [316, 9918.03]
  - - [1024, 4096, 1, 3535]
    - [323, 9921.2]
  - - [1024, 4096, 1, 3447]
    - [323, 9920.63]
  - - [1024, 4096, 1, 3560]
    - [322, 9925.48]
  - - [1024, 4096, 1, 3422]
    - [316, 9922.21]
  - - [1024, 4096, 1, 3469]
    - [315, 9906.18]
  - - [4096, 1024, 1, 3488]
    - [322, 9903.26]
  - - [1024, 4096, 1, 3110]
    - [322, 9906.76]
  - - [1024, 4096, 1, 3265]
    - [323, 9916.69]
  - - [1024, 4096, 1, 3291]
    - [322, 9902.73]
  - - [1024, 4096, 1, 3390]
    - [323, 9907.22]
  - - [4096, 1024, 1, 3046]
    - [322, 9847.68]
  - - [1024, 4096, 1, 3539]
    - [323, 9933.49]
  - - [4096, 1024, 1, 3221]
    - [323, 9860.74]
  - - [4096, 1024, 1, 3433]
    - [322, 9872.74]
  - - [4096, 1024, 1, 3364]
    - [323, 9881.91]
  - - [4096, 1024, 1, 3470]
    - [322, 9858.56]
  - - [1024, 4096, 1, 3404]
    - [315, 9907.27]
  - - [1024, 33708, 1, 3968]
    - [316, 10350.3]
  - - [4096, 1024, 1, 3088]
    - [322, 9869.06]
  - - [1024, 4096, 1, 3247]
    - [322, 9901.02]
  - - [1024, 33708, 1, 3996]
    - [315, 10328.5]
  - - [4096, 1024, 1, 3482]
    - [323, 9866.99]
  - - [1024, 1024, 1, 3796]
    - [318, 9031.68]
  - - [4096, 1024, 1, 3995]
    - [323, 9896.78]
  - - [1024, 1024, 1, 3859]
    - [320, 9097.36]
  - - [1024, 4096, 1, 3280]
    - [316, 9934.05]
  - - [4096, 1024, 1, 3271]
    - [323, 9860.09]
  - - [64, 10, 5952, 10]
    - [303, 1221.02]
  - - [4096, 1024, 1, 3545]
    - [322, 9877.35]
  - - [4096, 1024, 1, 3476]
    - [315, 9882.57]
  - - [4096, 1024, 1, 3496]
    - [316, 9880.5]
  - - [4096, 1024, 1, 3191]
    - [316, 9858.7]
  - - [4096, 1024, 1, 3311]
    - [323, 9853.2]
  - - [1024, 4096, 1, 3302]
    - [323, 9919.32]
  - - [1024, 4096, 1, 3681]
    - [322, 9944.99]
  - - [4096, 1024, 1, 3582]
    - [315, 9869.77]
  - - [4096, 1024, 1, 3421]
    - [323, 9856.08]
  - - [4096, 1024, 1, 3560]
    - [316, 9884.48]
  - - [1024, 4096, 1, 3495]
    - [323, 9930.13]
  - - [4096, 1024, 1, 3186]
    - [322, 9870.59]
  - - [4096, 1024, 1, 3925]
    - [322, 9904.0]
  - - [64, 71, 896, 71]
    - [307, 5004.79]
  - - [1024, 4096, 1, 3435]
    - [323, 9916.58]
  - - [4096, 1024, 1, 3434]
    - [322, 9871.29]
  - - [1024, 33708, 1, 4012]
    - [315, 10332.5]
  - - [1024, 4096, 1, 3340]
    - [315, 9918.11]
  - - [1024, 1024, 1, 3860]
    - [313, 8999.36]
  - - [4096, 1024, 1, 3489]
    - [322, 9882.02]
  - - [1024, 4096, 1, 3162]
    - [323, 9906.28]
  - - [4096, 1024, 1, 3436]
    - [322, 9858.12]
  - - [1024, 1024, 1, 4005]
    - [319, 9043.06]
  - - [64, 84, 752, 84]
    - [292, 5629.93]
  - - [4096, 1024, 1, 3574]
    - [322, 9886.7]
  - - [4096, 1024, 1, 3469]
    - [315, 9856.26]
  - - [1024, 4096, 1, 3410]
    - [316, 9924.74]
  - - [1024, 4096, 1, 3216]
    - [315, 9930.67]
  - - [4096, 1024, 1, 3095]
    - [322, 9847.01]
  - - [1024, 1024, 1, 3990]
    - [321, 9089.04]
  - - [4096, 1024, 1, 3448]
    - [322, 9863.94]
  - - [1024, 4096, 1, 3176]
    - [323, 9914.01]
  - - [64, 49, 1296, 49]
    - [288, 4437.46]
  - - [4096, 1024, 1, 2918]
    - [322, 9830.93]
  - - [64, 14, 4368, 14]
    - [302, 1802.47]
  - - [1024, 4096, 1, 3424]
    - [322, 9934.05]
  - - [4096, 1024, 1, 3402]
    - [315, 9863.12]
  - - [4096, 1024, 1, 3145]
    - [316, 9856.56]
  - - [64, 134, 480, 134]
    - [308, 6184.05]
  - - [1024, 33708, 1, 3976]
    - [316, 10330.1]
  - - [4096, 1024, 1, 3518]
    - [315, 9856.07]
  - - [4096, 1024, 1, 3110]
    - [322, 9856.46]
  - - [4096, 1024, 1, 3325]
    - [322, 9852.36]
  - - [1024, 33708, 1, 3999]
    - [315, 10329.7]
  - - [4096, 1024, 1, 2985]
    - [322, 9837.3]
  - - [1024, 4096, 1, 3371]
    - [315, 9913.03]
  - - [4096, 1024, 1, 3342]
    - [322, 9863.16]
  - - [4096, 1024, 1, 3141]
    - [316, 9849.91]
  - - [4096, 1024, 1, 3532]
    - [316, 9866.3]
  - - [64, 78, 816, 78]
    - [293, 5316.88]
  - - [1024, 4096, 1, 3169]
    - [323, 9910.45]
  - - [1024, 4096, 1, 3514]
    - [322, 9918.0]
  - - [4096, 1024, 1, 3780]
    - [323, 9899.75]
  - - [1024, 4096, 1, 3098]
    - [315, 9901.62]
  - - [1024, 4096, 1, 3449]
    - [323, 9919.85]
  - - [1024, 4096, 1, 3222]
    - [315, 9917.66]
  - - [1024, 4096, 1, 3346]
    - [316, 9912.91]
  - - [4096, 1024, 1, 3064]
    - [323, 9848.79]
  - - [4096, 1024, 1, 3511]
    - [322, 9873.39]
  - - [4096, 1024, 1, 3384]
    - [322, 9870.98]
  - - [4096, 1024, 1, 3356]
    - [316, 9853.45]
  - - [1024, 4096, 1, 3796]
    - [315, 9940.66]
  - - [4096, 1024, 1, 3427]
    - [322, 9883.14]
  - - [4096, 1024, 1, 3390]
    - [322, 9863.79]
  - - [4096, 1024, 1, 3573]
    - [323, 9886.02]
  - - [4096, 1024, 1, 3456]
    - [316, 9890.61]
  - - [1024, 4096, 1, 3360]
    - [323, 9938.1]
  - - [1024, 33708, 1, 3977]
    - [316, 10327.2]
  - - [1024, 4096, 1, 2918]
    - [315, 9902.84]
  - - [4096, 1024, 1, 3975]
    - [322, 9905.27]
  - - [4096, 1024, 1, 3525]
    - [323, 9879.91]
  - - [4096, 1024, 1, 3398]
    - [315, 9873.91]
  - - [4096, 1024, 1, 3640]
    - [322, 9885.16]
  - - [1024, 1024, 1, 3999]
    - [314, 8995.42]
  - - [4096, 1024, 1, 3014]
    - [322, 9841.32]
  - - [1024, 4096, 1, 3446]
    - [315, 9917.21]
  - - [1024, 33708, 1, 3796]
    - [315, 10339.0]
  - - [4096, 1024, 1, 3101]
    - [315, 9827.34]
  - - [4096, 1024, 1, 3563]
    - [323, 9863.03]
  - - [4096, 1024, 1, 3539]
    - [315, 9889.54]
  - - [4096, 1024, 1, 3182]
    - [322, 9833.79]
  - - [1024, 4096, 1, 3468]
    - [316, 9913.05]
  - - [4096, 1024, 1, 3312]
    - [322, 9889.85]
  - - [4096, 1024, 1, 3215]
    - [322, 9853.88]
  - - [4096, 1024, 1, 3910]
    - [322, 9894.72]
  - - [1024, 33708, 1, 3780]
    - [316, 10332.0]
  - - [1024, 4096, 1, 3290]
    - [322, 9915.08]
  - - [1024, 4096, 1, 4012]
    - [322, 9942.65]
  - - [1024, 4096, 1, 3385]
    - [322, 9915.83]
  - - [1024, 33708, 1, 3975]
    - [315, 10330.1]
  - - [4096, 1024, 1, 3996]
    - [322, 9891.31]
  - - [4096, 1024, 1, 2765]
    - [323, 9800.38]
  - - [4096, 1024, 1, 3538]
    - [323, 9886.22]
  - - [4096, 1024, 1, 3415]
    - [323, 9874.6]
  - - [1024, 4096, 1, 3554]
    - [322, 9931.99]
  - - [4096, 1024, 1, 3513]
    - [316, 9874.25]
  - - [1024, 4096, 1, 3304]
    - [316, 9907.73]
  - - [4096, 1024, 1, 3294]
    - [322, 9851.25]
  - - [4096, 1024, 1, 3396]
    - [323, 9880.7]
  - - [1024, 4096, 1, 3213]
    - [316, 9891.12]
  - - [4096, 1024, 1, 3137]
    - [316, 9857.41]
  - - [4096, 1024, 1, 3552]
    - [322, 9904.22]
  - - [1024, 1024, 1, 4020]
    - [321, 9098.87]
  - - [64, 13, 4672, 13]
    - [303, 1693.54]
  - - [1024, 4096, 1, 3461]
    - [322, 9918.45]
  - - [4096, 1024, 1, 3263]
    - [315, 9843.89]
  - - [4096, 1024, 1, 3430]
    - [322, 9885.26]
  - - [4096, 1024, 1, 3389]
    - [322, 9859.23]
  - - [4096, 1024, 1, 3528]
    - [322, 9873.01]
  - - [1024, 4096, 1, 3463]
    - [323, 9929.61]
  - - [4096, 1024, 1, 3526]
    - [323, 9876.9]
  - - [4096, 1024, 1, 3154]
    - [322, 9858.25]
  - - [4096, 1024, 1, 3499]
    - [323, 9862.92]
  - - [1024, 1024, 1, 3939]
    - [321, 9107.41]
  - - [4096, 1024, 1, 3955]
    - [323, 9906.28]
  - - [1024, 4096, 1, 3297]
    - [316, 9925.34]
  - - [1024, 4096, 1, 3233]
    - [322, 9920.65]
  - - [1024, 4096, 1, 3226]
    - [322, 9911.35]
  - - [4096, 1024, 1, 3404]
    - [322, 9867.28]
  - - [4096, 1024, 1, 3355]
    - [322, 9862.66]
  - - [1024, 4096, 1, 3542]
    - [322, 9926.49]
  - - [4096, 1024, 1, 3181]
    - [323, 9831.86]
  - - [1024, 4096, 1, 3474]
    - [322, 9928.03]
  - - [4096, 1024, 1, 3319]
    - [322, 9870.28]
  - - [1024, 4096, 1, 3434]
    - [315, 9917.51]
  - - [1024, 4096, 1, 3860]
    - [322, 9945.32]
  - - [1024, 4096, 1, 3343]
    - [315, 9914.66]
  - - [64, 77, 816, 78]
    - [293, 5276.97]
  - - [1024, 4096, 1, 3488]
    - [322, 9945.81]
  - - [1024, 4096, 1, 3046]
    - [322, 9908.78]
  - - [1024, 4096, 1, 3141]
    - [323, 9909.18]
  - - [1024, 4096, 1, 3516]
    - [323, 9911.38]
  - - [4096, 1024, 1, 3147]
    - [322, 9840.47]
  - - [1024, 1024, 1, 4059]
    - [314, 9009.78]
  - - [1024, 1024, 1, 3944]
    - [314, 9006.17]
  - - [1024, 4096, 1, 3421]
    - [323, 9919.86]
  - - [4096, 1024, 1, 3944]
    - [316, 9899.53]
  - - [64, 45, 1424, 45]
    - [301, 4068.67]
  - - [1024, 4096, 1, 3574]
    - [316, 9930.19]
  - - [1024, 4096, 1, 3977]
    - [315, 9944.28]
  - - [1024, 1024, 1, 3968]
    - [320, 9045.22]
  - - [1024, 4096, 1, 2985]
    - [322, 9887.65]
  - - [64, 193, 320, 193]
    - [309, 6631.35]
  - - [1024, 4096, 1, 3427]
    - [323, 9933.41]
  - - [64, 12, 5040, 12]
    - [303, 1552.53]
  - - [1024, 4096, 1, 3482]
    - [323, 9942.22]
  - - [1024, 4096, 1, 3332]
    - [315, 9923.58]
  - - [1024, 1024, 1, 3720]
    - [319, 9039.56]
  - - [4096, 1024, 1, 3308]
    - [323, 9852.66]
  - - [1024, 4096, 1, 3513]
    - [323, 9919.99]
  - - [1024, 4096, 1, 3154]
    - [316, 9908.46]
  - - [1024, 4096, 1, 3955]
    - [323, 9950.01]
  - - [1024, 4096, 1, 2967]
    - [323, 9897.44]
  - - [1024, 33708, 1, 3942]
    - [315, 10336.1]
  - - [1024, 4096, 1, 3319]
    - [323, 9912.45]
  - - [4096, 1024, 1, 3860]
    - [322, 9909.29]
  - - [1024, 4096, 1, 3548]
    - [315, 9924.21]
  - - [4096, 1024, 1, 3977]
    - [323, 9891.44]
  - - [4096, 1024, 1, 3535]
    - [322, 9867.84]
  - - [1024, 4096, 1, 3541]
    - [323, 9923.16]
  - - [1024, 1024, 1, 3910]
    - [320, 9080.4]
  - - [1024, 33708, 1, 3584]
    - [315, 10333.0]
  - - [1024, 4096, 1, 3168]
    - [316, 9926.27]
  - - [1024, 4096, 1, 3448]
    - [323, 9922.42]
  - - [4096, 1024, 1, 3343]
    - [322, 9857.23]
  - - [64, 35, 1808, 35]
    - [305, 3175.44]
  - - [1024, 4096, 1, 3357]
    - [316, 9902.41]
  - - [64, 143, 432, 143]
    - [306, 6489.7]
  - - [4096, 1024, 1, 3510]
    - [322, 9867.4]
  - - [4096, 1024, 1, 3369]
    - [322, 9863.44]
  - - [64, 92, 688, 93]
    - [293, 6188.3]
  - - [4096, 1024, 1, 3379]
    - [322, 9870.12]
  - - [1024, 4096, 1, 3276]
    - [322, 9904.77]
  - - [1024, 4096, 1, 3363]
    - [322, 9925.13]
  - - [4096, 1024, 1, 3055]
    - [322, 9831.92]
  - - [1024, 4096, 1, 3524]
    - [315, 9923.79]
  - - [4096, 1024, 1, 3057]
    - [322, 9852.87]
  - - [1024, 33708, 1, 3720]
    - [316, 10327.1]
  - - [1024, 4096, 1, 3383]
    - [315, 9919.39]
  - - [1024, 4096, 1, 3522]
    - [316, 9932.56]
  - - [1024, 33708, 1, 3956]
    - [315, 10333.8]
  - - [1024, 4096, 1, 3481]
    - [315, 9922.08]
  - - [4096, 1024, 1, 3562]
    - [323, 9874.86]
  - - [4096, 1024, 1, 3299]
    - [322, 9872.97]
  - - [1024, 4096, 1, 3262]
    - [316, 9924.83]
  - - [1024, 4096, 1, 3840]
    - [315, 9961.84]
  - - [1024, 33708, 1, 4026]
    - [315, 10334.3]
  - - [4096, 1024, 1, 3168]
    - [316, 9878.45]
  - - [64, 101, 624, 101]
    - [296, 5734.72]
  - - [1024, 4096, 1, 3999]
    - [315, 9947.1]
  - - [1024, 4096, 1, 3549]
    - [315, 9923.3]
  - - [4096, 1024, 1, 3375]
    - [322, 9868.89]
  - - [1024, 4096, 1, 3496]
    - [323, 9928.67]
  - - [64, 29, 2176, 29]
    - [292, 3290.02]
  - - [1024, 4096, 1, 3190]
    - [323, 9897.61]
  - - [4096, 1024, 1, 3273]
    - [323, 9853.65]
  - - [1024, 4096, 1, 3406]
    - [322, 9907.04]
  - - [4096, 1024, 1, 4005]
    - [315, 9907.97]
  - - [4096, 1024, 1, 3555]
    - [322, 9878.96]
  - - [4096, 1024, 1, 2505]
    - [322, 9785.1]
  - - [1024, 4096, 1, 3460]
    - [322, 9930.24]
  - - [64, 17, 3632, 17]
    - [293, 1917.27]
  - - [1024, 4096, 1, 3579]
    - [316, 9920.94]
  - - [1024, 33708, 1, 4030]
    - [316, 10327.7]
  - - [1024, 4096, 1, 3510]
    - [316, 9931.31]
  - - [1024, 1024, 1, 3969]
    - [313, 9020.83]
  - - [1024, 4096, 1, 3282]
    - [323, 9920.05]
  - - [1024, 4096, 1, 3377]
    - [315, 9927.34]
  - - [1024, 4096, 1, 2935]
    - [323, 9903.48]
  - - [64, 41, 1552, 41]
    - [293, 3740.48]
  - - [1024, 4096, 1, 3498]
    - [315, 9915.01]
  - - [1024, 4096, 1, 3593]
    - [322, 9925.64]
  - - [1024, 1024, 1, 3948]
    - [321, 9009.03]
  - - [4096, 1024, 1, 3226]
    - [323, 9854.75]
  - - [1024, 4096, 1, 2499]
    - [322, 9904.82]
  - - [1024, 4096, 1, 3296]
    - [315, 9926.89]
  - - [1024, 4096, 1, 3455]
    - [322, 9917.52]
  - - [1024, 4096, 1, 3399]
    - [316, 9919.7]
  - - [1024, 4096, 1, 3205]
    - [315, 9917.74]
  - - [4096, 1024, 1, 4026]
    - [323, 9897.81]
  - - [1024, 4096, 1, 3484]
    - [315, 9915.53]
  - - [4096, 1024, 1, 3302]
    - [323, 9862.8]
  - - [1024, 4096, 1, 3485]
    - [323, 9913.0]
  - - [1024, 1024, 1, 3996]
    - [321, 9008.77]
  - - [1024, 4096, 1, 3126]
    - [316, 9910.16]
  - - [1024, 4096, 1, 4050]
    - [315, 9951.21]
  - - [4096, 1024, 1, 3235]
    - [316, 9870.74]
  - - [1024, 33708, 1, 3955]
    - [315, 10336.1]
  - - [1024, 4096, 1, 3342]
    - [315, 9903.85]
  - - [1024, 1024, 1, 3900]
    - [320, 9082.92]
  - - [1024, 4096, 1, 3397]
    - [323, 9922.7]
  - - [4096, 1024, 1, 3491]
    - [323, 9880.75]
  - - [1024, 4096, 1, 3503]
    - [315, 9923.28]
  - - [1024, 4096, 1, 3140]
    - [316, 9908.41]
  - - [4096, 1024, 1, 3121]
    - [322, 9860.32]
  - - [4096, 1024, 1, 3276]
    - [322, 9854.19]
  - - [1024, 4096, 1, 3321]
    - [323, 9917.86]
  - - [1024, 4096, 1, 3870]
    - [323, 9931.07]
  - - [4096, 1024, 1, 3475]
    - [322, 9877.58]
  - - [1024, 4096, 1, 2984]
    - [322, 9895.59]
  - - [4096, 1024, 1, 3363]
    - [316, 9873.44]
  - - [1024, 4096, 1, 3582]
    - [322, 9920.87]
  - - [4096, 1024, 1, 3509]
    - [322, 9886.86]
  - - [1024, 4096, 1, 3426]
    - [315, 9928.86]
  - - [4096, 1024, 1, 3136]
    - [322, 9872.61]
  - - [1024, 4096, 1, 3232]
    - [323, 9926.29]
  - - [4096, 1024, 1, 3103]
    - [322, 9839.03]
  - - [1024, 4096, 1, 3335]
    - [316, 9913.37]
  - - [1024, 4096, 1, 3900]
    - [315, 9938.01]
  - - [4096, 1024, 1, 3512]
    - [316, 9877.26]
  - - [4096, 1024, 1, 3222]
    - [322, 9859.77]
  - - [1024, 4096, 1, 3165]
    - [322, 9899.71]
  - - [4096, 1024, 1, 3408]
    - [322, 9899.68]
  - - [4096, 1024, 1, 3751]
    - [322, 9891.49]
  - - [1024, 4096, 1, 3318]
    - [315, 9913.42]
  - - [4096, 1024, 1, 3442]
    - [323, 9880.21]
  - - [1024, 4096, 1, 3413]
    - [322, 9921.9]
  - - [4096, 1024, 1, 3524]
    - [322, 9879.22]
  - - [1024, 4096, 1, 3976]
    - [323, 9945.57]
  - - [1024, 4096, 1, 3475]
    - [323, 9932.51]
  - - [1024, 4096, 1, 3534]
    - [315, 9911.49]
  - - [4096, 1024, 1, 3301]
    - [322, 9872.75]
  - - [4096, 1024, 1, 3248]
    - [322, 9878.22]
  - - [1024, 4096, 1, 2977]
    - [316, 9899.93]
  - - [4096, 1024, 1, 3346]
    - [322, 9876.07]
  - - [1024, 4096, 1, 3451]
    - [315, 9920.16]
  - - [1024, 4096, 1, 3257]
    - [316, 9905.02]
  - - [1024, 1024, 1, 3640]
    - [314, 8983.39]
  - - [1024, 4096, 1, 3356]
    - [315, 9904.48]
  - - [4096, 1024, 1, 3348]
    - [323, 9872.53]
  - - [4096, 1024, 1, 3335]
    - [322, 9865.82]
  - - [4096, 1024, 1, 3505]
    - [322, 9888.88]
  - - [1024, 4096, 1, 3490]
    - [315, 9938.0]
  - - [4096, 1024, 1, 3447]
    - [322, 9865.39]
  - - [1024, 4096, 1, 3267]
    - [323, 9919.32]
  - - [4096, 1024, 1, 3230]
    - [322, 9853.2]
  - - [4096, 1024, 1, 3455]
    - [322, 9862.44]
  - - [1024, 4096, 1, 3925]
    - [315, 9945.64]
  - - [1024, 4096, 1, 3362]
    - [316, 9921.63]
  - - [4096, 1024, 1, 3969]
    - [323, 9911.98]
  - - [4096, 1024, 1, 3527]
    - [322, 9882.87]
  - - [1024, 4096, 1, 3585]
    - [316, 9946.52]
  - - [4096, 1024, 1, 3063]
    - [322, 9854.03]
  - - [4096, 1024, 1, 3435]
    - [322, 9867.13]
  - - [4096, 1024, 1, 3366]
    - [323, 9864.02]
  - - [4096, 1024, 1, 3581]
    - [315, 9868.57]
  - - [1024, 33708, 1, 3906]
    - [315, 10339.3]
  - - [1024, 4096, 1, 3464]
    - [323, 9916.21]
  - - [1024, 4096, 1, 3440]
    - [322, 9945.25]
  - - [4096, 1024, 1, 3143]
    - [322, 9846.76]
  - - [1024, 4096, 1, 3349]
    - [316, 9912.83]
  - - [4096, 1024, 1, 3416]
    - [322, 9885.13]
  - - [4096, 1024, 1, 3365]
    - [322, 9876.0]
  - - [1024, 4096, 1, 3470]
    - [323, 9914.98]
  - - [4096, 1024, 1, 3287]
    - [322, 9860.69]
  - - [1024, 4096, 1, 3441]
    - [323, 9928.98]
  - - [4096, 1024, 1, 3224]
    - [322, 9857.83]
  - - [1024, 4096, 1, 3387]
    - [315, 9911.72]
  - - [1024, 4096, 1, 3547]
    - [315, 9920.36]
  - - [4096, 1024, 1, 3478]
    - [316, 9882.9]
  - - [4096, 1024, 1, 3548]
    - [323, 9869.45]
  - - [1024, 33708, 1, 4020]
    - [315, 10345.3]
  - - [4096, 1024, 1, 3320]
    - [322, 9863.74]
  - - [1024, 4096, 1, 3906]
    - [322, 9942.67]
  - - [4096, 1024, 1, 3796]
    - [322, 9899.13]
  - - [1024, 4096, 1, 3306]
    - [315, 9902.4]
  - - [1024, 4096, 1, 3401]
    - [323, 9913.95]
  - - [64, 147, 432, 147]
    - [306, 6626.6]
  - - [1024, 4096, 1, 3215]
    - [323, 9911.24]
  - - [4096, 1024, 1, 4012]
    - [323, 9898.2]
  - - [1024, 4096, 1, 2765]
    - [323, 9863.73]
  - - [4096, 1024, 1, 3554]
    - [316, 9883.52]
  - - [4096, 1024, 1, 3423]
    - [322, 9866.72]
  - - [1024, 1024, 1, 3751]
    - [320, 9006.36]
  - - [1024, 4096, 1, 3562]
    - [316, 9922.08]
  - - [1024, 4096, 1, 3489]
    - [315, 9936.78]
  - - [4096, 1024, 1, 3358]
    - [322, 9858.22]
  - - [4096, 1024, 1, 3270]
    - [323, 9850.84]
  - - [1024, 4096, 1, 3293]
    - [315, 9905.33]
  - - [1024, 4096, 1, 3376]
    - [315, 9934.98]
  - - [4096, 1024, 1, 3245]
    - [322, 9852.52]
  - - [4096, 1024, 1, 3541]
    - [322, 9887.22]
  - - [4096, 1024, 1, 3443]
    - [322, 9871.73]
  - - [4096, 1024, 1, 3438]
    - [323, 9863.86]
  - - [4096, 1024, 1, 3244]
    - [322, 9859.76]
  - - [1024, 4096, 1, 3365]
    - [322, 9922.1]
  - - [1024, 4096, 1, 3299]
    - [316, 9923.38]
  - - [4096, 1024, 1, 3840]
    - [322, 9914.75]
  - - [1024, 4096, 1, 3471]
    - [323, 9918.38]
  - - [1024, 4096, 1, 3398]
    - [315, 9918.99]
  - - [4096, 1024, 1, 3162]
    - [322, 9843.93]
  - - [1024, 4096, 1, 4005]
    - [316, 9947.87]
  - - [4096, 1024, 1, 3579]
    - [322, 9868.25]
  - - [64, 18, 3440, 18]
    - [298, 2059.33]
  - - [64, 177, 352, 177]
    - [317, 7315.4]
  - - [1024, 4096, 1, 3121]
    - [323, 9930.34]
  - - [4096, 1024, 1, 3441]
    - [322, 9883.28]
  - - [4096, 1024, 1, 3422]
    - [322, 9858.41]
  - - [4096, 1024, 1, 3444]
    - [322, 9887.03]
  - - [1024, 4096, 1, 3337]
    - [316, 9911.45]
  - - [4096, 1024, 1, 3550]
    - [315, 9871.87]
  - - [1024, 4096, 1, 3477]
    - [315, 9930.65]
  - - [4096, 1024, 1, 3490]
    - [322, 9878.45]
  - - [4096, 1024, 1, 3585]
    - [322, 9893.63]
  - - [1024, 4096, 1, 3143]
    - [315, 9901.19]
  - - [1024, 33708, 1, 3876]
    - [316, 10330.8]
  - - [1024, 4096, 1, 3320]
    - [323, 9913.18]
  - - [1024, 4096, 1, 3423]
    - [323, 9914.14]
  - - [1024, 4096, 1, 3894]
    - [315, 9944.47]
  - - [4096, 1024, 1, 3410]
    - [322, 9878.67]
  - - [1024, 4096, 1, 3561]
    - [315, 9926.68]
  - - [4096, 1024, 1, 3492]
    - [316, 9872.92]
  - - [64, 85, 752, 85]
    - [293, 5734.35]
- null
