library/src/blas3/Tensile/Logic/asm_full/vega10_Cijk_Alik_Bljk_SB.yaml
- {MinimumRequiredVersion: 3.5.1}
- vega10
- gfx900
- [Device 6863,Device 6862,Device 687f]
- - - [4096, 7000, 1, 4096]
    - [33, 8280.91]
  - - [7680, 12000, 1, 2560]
    - [43, 9682.28]
  - - [5124, 9124, 1, 1760]
    - [48, 10969.0]
  - - [1760, 32, 1, 1760]
    - [7, 2921.66]
  - - [512, 24000, 1, 1536]
    - [32, 9286.92]
  - - [3072, 24000, 1, 1024]
    - [41, 9004.9]
  - - [2048, 400, 1, 512]
    - [39, 4238.13]
  - - [2560, 7000, 1, 2560]
    - [43, 9489.95]
  - - [3072, 16, 1, 1024]
    - [14, 753.276]
  - - [512, 48000, 1, 2816]
    - [48, 11020.6]
  - - [512, 48000, 1, 2048]
    - [33, 7862.07]
  - - [1760, 64, 1, 1760]
    - [15, 4574.79]
  - - [35, 8457, 1, 4096]
    - [5, 3223.08]
  - - [2048, 1600, 1, 2048]
    - [42, 5863.32]
  - - [512, 48000, 1, 1536]
    - [32, 9830.47]
  - - [2560, 32, 1, 2560]
    - [29, 2636.0]
  - - [8448, 5984, 1, 2816]
    - [48, 11094.9]
  - - [4096, 3200, 1, 1024]
    - [41, 7611.99]
  - - [1024, 24000, 1, 2560]
    - [39, 9258.71]
  - - [1760, 6400, 1, 1760]
    - [46, 11062.1]
  - - [1024, 700, 1, 512]
    - [35, 4419.58]
  - - [4608, 32, 1, 1536]
    - [29, 2556.48]
  - - [3072, 64, 1, 1024]
    - [29, 2236.89]
  - - [16384, 3200, 1, 4096]
    - [33, 7955.07]
  - - [2560, 16, 1, 2560]
    - [22, 1340.46]
  - - [1024, 48000, 1, 2560]
    - [43, 9296.36]
  - - [35, 8457, 1, 2560]
    - [3, 3430.33]
  - - [8448, 48000, 1, 2816]
    - [48, 11499.4]
  - - [2048, 32, 1, 2048]
    - [14, 1712.56]
  - - [2560, 3200, 1, 2560]
    - [42, 8857.32]
  - - [16384, 800, 1, 4096]
    - [33, 7095.05]
  - - [4608, 24000, 1, 1536]
    - [38, 10009.9]
  - - [7680, 48000, 1, 2560]
    - [32, 10147.6]
  - - [3072, 48000, 1, 1024]
    - [41, 9127.93]
  - - [1760, 16, 1, 1760]
    - [9, 1574.26]
  - - [8192, 3200, 1, 2048]
    - [41, 7748.21]
  - - [512, 24000, 1, 2816]
    - [48, 10830.6]
  - - [4096, 400, 1, 1024]
    - [37, 4248.46]
  - - [6144, 48000, 1, 2560]
    - [32, 9741.18]
  - - [4608, 48000, 1, 1536]
    - [38, 10035.0]
  - - [35, 8457, 1, 2048]
    - [3, 3030.9]
  - - [4096, 128, 1, 4096]
    - [25, 4663.79]
  - - [2048, 800, 1, 512]
    - [47, 4788.26]
  - - [4608, 5984, 1, 1536]
    - [38, 9431.12]
  - - [2560, 128, 1, 2560]
    - [28, 4864.39]
  - - [6144, 5984, 1, 2048]
    - [41, 7867.14]
  - - [35, 8457, 1, 1760]
    - [4, 3933.24]
  - - [7680, 24000, 1, 2560]
    - [41, 9818.18]
  - - [6144, 48000, 1, 2048]
    - [41, 8751.83]
  - - [5124, 9124, 1, 2560]
    - [41, 9428.44]
  - - [2048, 3200, 1, 2048]
    - [33, 6447.98]
  - - [2048, 16, 1, 2048]
    - [13, 901.431]
  - - [1024, 24000, 1, 1536]
    - [43, 8936.13]
  - - [7680, 16, 1, 2560]
    - [19, 1673.21]
  - - [2560, 6400, 1, 2560]
    - [43, 9139.99]
  - - [2048, 128, 1, 2048]
    - [10, 2923.57]
  - - [512, 16, 1, 500000]
    - [2, 2256.72]
  - - [1024, 8, 1, 500000]
    - [0, 1168.05]
  - - [512, 24000, 1, 2560]
    - [45, 9220.91]
  - - [1024, 24000, 1, 2816]
    - [32, 10345.6]
  - - [7680, 5984, 1, 2560]
    - [41, 9528.77]
  - - [2048, 1600, 1, 512]
    - [43, 5441.74]
  - - [2048, 7000, 1, 2048]
    - [31, 7705.83]
  - - [1760, 800, 1, 1760]
    - [40, 8458.4]
  - - [5124, 9124, 1, 4096]
    - [31, 8114.9]
  - - [4096, 64, 1, 4096]
    - [26, 3403.39]
  - - [7680, 32, 1, 2560]
    - [6, 3025.72]
  - - [2560, 64, 1, 2560]
    - [18, 3615.67]
  - - [3072, 128, 1, 1024]
    - [21, 2705.65]
  - - [7680, 64, 1, 2560]
    - [25, 4886.77]
  - - [1760, 128, 1, 1760]
    - [24, 5868.97]
  - - [2560, 1600, 1, 2560]
    - [38, 8131.51]
  - - [2048, 3200, 1, 512]
    - [41, 6448.9]
  - - [2560, 800, 1, 2560]
    - [47, 7461.95]
  - - [3072, 32, 1, 1024]
    - [14, 1545.98]
  - - [6144, 32, 1, 2560]
    - [29, 2850.06]
  - - [4608, 12000, 1, 1536]
    - [38, 9892.76]
  - - [4096, 32, 1, 4096]
    - [11, 2002.08]
  - - [6144, 24000, 1, 2048]
    - [41, 8309.87]
  - - [8192, 800, 1, 2048]
    - [42, 6211.03]
  - - [4096, 1600, 1, 1024]
    - [41, 6506.32]
  - - [5124, 9124, 1, 2048]
    - [41, 7727.96]
  - - [8448, 24000, 1, 2816]
    - [48, 11262.0]
  - - [1024, 48000, 1, 1536]
    - [41, 9081.37]
  - - [7680, 128, 1, 2560]
    - [23, 6145.58]
  - - [8192, 1600, 1, 2048]
    - [41, 7148.87]
  - - [4096, 800, 1, 1024]
    - [42, 5299.14]
  - - [1024, 16, 1, 500000]
    - [2, 2303.54]
  - - [2048, 800, 1, 2048]
    - [31, 4673.65]
  - - [1760, 3200, 1, 1760]
    - [32, 9982.25]
  - - [512, 48000, 1, 2560]
    - [45, 9346.64]
  - - [8448, 16, 1, 2816]
    - [8, 1870.54]
  - - [2048, 64, 1, 2048]
    - [14, 2368.48]
  - - [512, 24000, 1, 2048]
    - [33, 7439.73]
  - - [16384, 1600, 1, 4096]
    - [33, 7933.75]
  - - [4608, 16, 1, 1536]
    - [13, 1341.03]
  - - [1024, 24000, 1, 2048]
    - [31, 7638.71]
  - - [8192, 400, 1, 2048]
    - [42, 5536.86]
  - - [2048, 6400, 1, 2048]
    - [33, 7270.21]
  - - [6144, 12000, 1, 2048]
    - [41, 8112.0]
  - - [512, 8, 1, 500000]
    - [1, 1148.14]
  - - [1760, 7000, 1, 1760]
    - [48, 10322.5]
  - - [1024, 48000, 1, 2816]
    - [46, 10711.4]
  - - [6144, 16, 1, 2560]
    - [8, 1562.68]
  - - [8448, 32, 1, 2816]
    - [12, 3437.05]
  - - [4096, 16, 1, 4096]
    - [17, 1104.81]
  - - [6144, 24000, 1, 2560]
    - [41, 9627.58]
  - - [8448, 12000, 1, 2816]
    - [48, 11188.9]
  - - [16384, 400, 1, 4096]
    - [31, 6262.66]
  - - [1760, 1600, 1, 1760]
    - [46, 9566.21]
  - - [1024, 48000, 1, 2048]
    - [44, 7785.32]
- - - -1
    - - - -1
        - - - 4
            - - [64, 20]
              - [128, 13]
              - [1024, 20]
              - [1408, 13]
              - [5888, 20]
              - [-1, 13]
          - - 64
            - - [128, 20]
              - [256, 21]
              - [448, 19]
              - [704, 28]
              - [1024, 7]
              - [1408, 16]
              - [1856, 27]
              - [2368, 15]
              - [3584, 24]
              - [5888, 27]
              - [-1, 36]
          - - 128
            - - [64, 20]
              - [128, 22]
              - [256, 6]
              - [448, 28]
              - [1408, 16]
              - [1856, 24]
              - [2944, 16]
              - [3584, 36]
              - [5056, 24]
              - [5888, 36]
              - [-1, 32]
          - - 256
            - - [4, 20]
              - [64, 29]
              - [128, 7]
              - [256, 6]
              - [448, 16]
              - [2944, 36]
              - [3584, 32]
              - [5056, 34]
              - [5888, 32]
              - [-1, 46]
          - - 448
            - - [4, 20]
              - [64, 6]
              - [128, 28]
              - [256, 16]
              - [448, 24]
              - [1408, 36]
              - [1856, 30]
              - [2368, 34]
              - [2944, 30]
              - [3584, 48]
              - [4288, 35]
              - [5056, 34]
              - [5888, 46]
              - [-1, 35]
          - - 704
            - - [4, 20]
              - [64, 28]
              - [128, 15]
              - [448, 36]
              - [1024, 34]
              - [1408, 35]
              - [1856, 36]
              - [2368, 46]
              - [2944, 32]
              - [3584, 35]
              - [5056, 32]
              - [5888, 35]
              - [-1, 48]
          - - 1024
            - - [4, 20]
              - [64, 6]
              - [128, 15]
              - [256, 34]
              - [704, 36]
              - [1408, 38]
              - [1856, 46]
              - [2368, 38]
              - [2944, 48]
              - [3584, 40]
              - [4288, 38]
              - [-1, 48]
          - - 1408
            - - [4, 13]
              - [64, 28]
              - [128, 27]
              - [448, 36]
              - [704, 40]
              - [1024, 32]
              - [1408, 46]
              - [1856, 40]
              - [2368, 35]
              - [3584, 48]
              - [4288, 46]
              - [-1, 48]
          - - 1856
            - - [4, 20]
              - [64, 15]
              - [128, 24]
              - [256, 34]
              - [448, 30]
              - [704, 36]
              - [1024, 46]
              - [1408, 32]
              - [2944, 30]
              - [4288, 46]
              - [-1, 48]
          - - 2368
            - - [4, 20]
              - [64, 28]
              - [128, 16]
              - [448, 36]
              - [704, 46]
              - [1856, 30]
              - [2944, 46]
              - [3584, 48]
              - [4288, 30]
              - [5056, 46]
              - [-1, 48]
          - - 2944
            - - [4, 20]
              - [64, 27]
              - [128, 16]
              - [256, 34]
              - [448, 32]
              - [704, 38]
              - [1024, 46]
              - [-1, 48]
          - - 3584
            - - [4, 13]
              - [64, 23]
              - [128, 36]
              - [256, 35]
              - [448, 46]
              - [704, 40]
              - [1024, 32]
              - [-1, 48]
          - - 4288
            - - [4, 20]
              - [64, 28]
              - [128, 24]
              - [256, 34]
              - [1024, 30]
              - [-1, 48]
          - - 5056
            - - [4, 20]
              - [64, 27]
              - [128, 16]
              - [448, 34]
              - [704, 30]
              - [-1, 48]
          - - 5888
            - - [4, 20]
              - [64, 27]
              - [128, 34]
              - [256, 32]
              - [448, 46]
              - [704, 38]
              - [-1, 48]
          - - -1
            - - [4, 13]
              - [64, 34]
              - [128, 35]
              - [256, 46]
              - [448, 38]
              - [5056, 48]
              - [5888, 46]
              - [-1, 48]
