library/src/blas3/Tensile/Logic/asm_full/vega10_Cijk_Ailk_Bljk_HBH_GB.yaml
- {MinimumRequiredVersion: 4.26.0}
- vega10
- gfx900
- [Device 6863, Device 6862, Device 687f, Device 6860, Device 6861, 'Vega 10 XTX [Radeon
    SolutionIndex: 0
    SolutionNameMin: Cijk_Ailk_Bljk_HBH_GB_MT32x32x8_SN_GRVW4_LRVW4_TT4_4_VW4_WG8_8_1_WGM1
    SolutionIndex: 1
    SolutionNameMin: Cijk_Ailk_Bljk_HBH_GB_MT32x32x16_SN_GRVW4_LRVW4_TT4_4_VW4_WG8_8_1_WGM1
    SolutionIndex: 2
    SolutionNameMin: Cijk_Ailk_Bljk_HBH_GB_MT64x64x16_SN_GRVW4_LRVW4_TT4_4_VW4_WG16_16_1_WGM1
    SolutionIndex: 3
    SolutionNameMin: Cijk_Ailk_Bljk_HBH_GB_MT128x64x16_SN_GRVW4_LRVW4_TT8_4_VW4_WG16_16_1_WGM1
    SolutionIndex: 4
    SolutionNameMin: Cijk_Ailk_Bljk_HBH_GB_MT64x128x16_SN_GRVW4_LRVW4_TT4_8_VW4_WG16_16_1_WGM1
    SolutionIndex: 5
    SolutionNameMin: Cijk_Ailk_Bljk_HBH_GB_MT64x64x8_SN_GRVW2_LRVW2_TT4_4_VW2_WG16_16_1_WGM1
    SolutionIndex: 6
    SolutionNameMin: Cijk_Ailk_Bljk_HBH_GB_MT128x64x8_SN_GRVW2_LRVW2_TT8_4_VW2_WG16_16_1_WGM1
    SolutionIndex: 7
    SolutionNameMin: Cijk_Ailk_Bljk_HBH_GB_MT32x32x8_SN_GRVW4_LRVW4_TT4_4_VW4_WG8_8_1_WGM8
    SolutionIndex: 8
    SolutionNameMin: Cijk_Ailk_Bljk_HBH_GB_MT128x64x8_SN_GRVW4_LRVW4_TT8_4_VW4_WG16_16_1_WGM8
    SolutionIndex: 9
    SolutionNameMin: Cijk_Ailk_Bljk_HBH_GB_MT32x32x16_SN_GRVW4_LRVW4_TT4_4_VW4_WG8_8_1_WGM8
    SolutionIndex: 10
    SolutionNameMin: Cijk_Ailk_Bljk_HBH_GB_MT64x64x16_SN_GRVW4_LRVW4_TT4_4_VW4_WG16_16_1_WGM8
    SolutionIndex: 11
    SolutionNameMin: Cijk_Ailk_Bljk_HBH_GB_MT128x64x16_SN_GRVW4_LRVW4_TT8_4_VW4_WG16_16_1_WGM8
    SolutionIndex: 12
    SolutionNameMin: Cijk_Ailk_Bljk_HBH_GB_MT64x128x16_SN_GRVW4_LRVW4_TT4_8_VW4_WG16_16_1_WGM8
    SolutionIndex: 13
    SolutionNameMin: Cijk_Ailk_Bljk_HBH_GB_MT32x32x32_SN_GRVW4_LRVW4_TT4_4_VW4_WG8_8_1_WGM8
    SolutionIndex: 14
    SolutionNameMin: Cijk_Ailk_Bljk_HBH_GB_MT64x64x32_SN_GRVW4_LRVW4_TT4_4_VW4_WG16_16_1_WGM8
    SolutionIndex: 15
    SolutionNameMin: Cijk_Ailk_Bljk_HBH_GB_MT64x64x8_SN_GRVW2_LRVW2_TT4_4_VW2_WG16_16_1_WGM8
- - - [32, 32, 8, 32, 32, 32, 32, 32]
    - [0, 63.0]
  - - [32, 32, 8, 64, 32, 32, 32, 64]
    - [0, 96.0]
  - - [32, 32, 8, 128, 32, 32, 32, 128]
    - [7, 129.0]
  - - [32, 32, 8, 256, 32, 32, 32, 256]
    - [7, 158.0]
  - - [32, 32, 8, 512, 32, 32, 32, 512]
    - [1, 178.0]
  - - [32, 64, 8, 32, 32, 32, 32, 32]
    - [7, 133.0]
  - - [32, 64, 8, 64, 32, 32, 32, 64]
    - [0, 201.0]
  - - [32, 64, 8, 128, 32, 32, 32, 128]
    - [7, 266.0]
  - - [32, 64, 8, 256, 32, 32, 32, 256]
    - [1, 320.0]
  - - [32, 64, 8, 512, 32, 32, 32, 512]
    - [1, 363.0]
  - - [32, 128, 8, 32, 32, 32, 32, 32]
    - [0, 269.0]
  - - [32, 128, 8, 64, 32, 32, 32, 64]
    - [0, 403.0]
  - - [32, 128, 8, 128, 32, 32, 32, 128]
    - [0, 532.0]
  - - [32, 128, 8, 256, 32, 32, 32, 256]
    - [1, 646.0]
  - - [32, 128, 8, 512, 32, 32, 32, 512]
    - [9, 728.0]
  - - [32, 256, 8, 32, 32, 32, 32, 32]
    - [0, 536.0]
  - - [32, 256, 8, 64, 32, 32, 32, 64]
    - [0, 796.0]
  - - [32, 256, 8, 128, 32, 32, 32, 128]
    - [0, 1046.0]
  - - [32, 256, 8, 256, 32, 32, 32, 256]
    - [7, 1230.0]
  - - [32, 256, 8, 512, 32, 32, 32, 512]
    - [9, 1420.0]
  - - [32, 512, 8, 32, 32, 32, 32, 32]
    - [0, 1060.0]
  - - [32, 512, 8, 64, 32, 32, 32, 64]
    - [0, 1492.0]
  - - [32, 512, 8, 128, 32, 32, 32, 128]
    - [1, 1872.0]
  - - [32, 512, 8, 256, 32, 32, 32, 256]
    - [1, 2047.0]
  - - [32, 512, 8, 512, 32, 32, 32, 512]
    - [13, 2221.0]
  - - [64, 32, 8, 32, 64, 64, 64, 32]
    - [7, 132.0]
  - - [64, 32, 8, 64, 64, 64, 64, 64]
    - [7, 199.0]
  - - [64, 32, 8, 128, 64, 64, 64, 128]
    - [7, 267.0]
  - - [64, 32, 8, 256, 64, 64, 64, 256]
    - [0, 319.0]
  - - [64, 32, 8, 512, 64, 64, 64, 512]
    - [9, 363.0]
  - - [64, 64, 8, 32, 64, 64, 64, 32]
    - [0, 272.0]
  - - [64, 64, 8, 64, 64, 64, 64, 64]
    - [0, 402.0]
  - - [64, 64, 8, 128, 64, 64, 64, 128]
    - [7, 540.0]
  - - [64, 64, 8, 256, 64, 64, 64, 256]
    - [9, 646.0]
  - - [64, 64, 8, 512, 64, 64, 64, 512]
    - [9, 729.0]
  - - [64, 128, 8, 32, 64, 64, 64, 32]
    - [0, 531.0]
  - - [64, 128, 8, 64, 64, 64, 64, 64]
    - [7, 803.0]
  - - [64, 128, 8, 128, 64, 64, 64, 128]
    - [0, 1052.0]
  - - [64, 128, 8, 256, 64, 64, 64, 256]
    - [10, 1246.0]
  - - [64, 128, 8, 512, 64, 64, 64, 512]
    - [1, 1431.0]
  - - [64, 256, 8, 32, 64, 64, 64, 32]
    - [0, 1056.0]
  - - [64, 256, 8, 64, 64, 64, 64, 64]
    - [0, 1520.0]
  - - [64, 256, 8, 128, 64, 64, 64, 128]
    - [2, 1929.0]
  - - [64, 256, 8, 256, 64, 64, 64, 256]
    - [2, 2142.0]
  - - [64, 256, 8, 512, 64, 64, 64, 512]
    - [2, 2434.0]
  - - [64, 512, 8, 32, 64, 64, 64, 32]
    - [0, 1742.0]
  - - [64, 512, 8, 64, 64, 64, 64, 64]
    - [5, 2394.0]
  - - [64, 512, 8, 128, 64, 64, 64, 128]
    - [10, 2842.0]
  - - [64, 512, 8, 256, 64, 64, 64, 256]
    - [9, 2787.0]
  - - [64, 512, 8, 512, 64, 64, 64, 512]
    - [12, 3035.0]
  - - [128, 32, 8, 32, 128, 128, 128, 32]
    - [0, 269.0]
  - - [128, 32, 8, 64, 128, 128, 128, 64]
    - [0, 406.0]
  - - [128, 32, 8, 128, 128, 128, 128, 128]
    - [0, 537.0]
  - - [128, 32, 8, 256, 128, 128, 128, 256]
    - [1, 648.0]
  - - [128, 32, 8, 512, 128, 128, 128, 512]
    - [9, 732.0]
  - - [128, 64, 8, 32, 128, 128, 128, 32]
    - [0, 539.0]
  - - [128, 64, 8, 64, 128, 128, 128, 64]
    - [0, 800.0]
  - - [128, 64, 8, 128, 128, 128, 128, 128]
    - [0, 1054.0]
  - - [128, 64, 8, 256, 128, 128, 128, 256]
    - [2, 1247.0]
  - - [128, 64, 8, 512, 128, 128, 128, 512]
    - [10, 1416.0]
  - - [128, 128, 8, 32, 128, 128, 128, 32]
    - [7, 1049.0]
  - - [128, 128, 8, 64, 128, 128, 128, 64]
    - [7, 1524.0]
  - - [128, 128, 8, 128, 128, 128, 128, 128]
    - [2, 1926.0]
  - - [128, 128, 8, 256, 128, 128, 128, 256]
    - [10, 2139.0]
  - - [128, 128, 8, 512, 128, 128, 128, 512]
    - [10, 2448.0]
  - - [128, 256, 8, 32, 128, 128, 128, 32]
    - [2, 1750.0]
  - - [128, 256, 8, 64, 128, 128, 128, 64]
    - [15, 2347.0]
  - - [128, 256, 8, 128, 128, 128, 128, 128]
    - [10, 2838.0]
  - - [128, 256, 8, 256, 128, 128, 128, 256]
    - [4, 2788.0]
  - - [128, 256, 8, 512, 128, 128, 128, 512]
    - [11, 3116.0]
  - - [128, 512, 8, 32, 128, 128, 128, 32]
    - [2, 2817.0]
  - - [128, 512, 8, 64, 128, 128, 128, 64]
    - [5, 3800.0]
  - - [128, 512, 8, 128, 128, 128, 128, 128]
    - [10, 3683.0]
  - - [128, 512, 8, 256, 128, 128, 128, 256]
    - [10, 3842.0]
  - - [128, 512, 8, 512, 128, 128, 128, 512]
    - [10, 4164.0]
  - - [256, 32, 8, 32, 256, 256, 256, 32]
    - [0, 536.0]
  - - [256, 32, 8, 64, 256, 256, 256, 64]
    - [0, 805.0]
  - - [256, 32, 8, 128, 256, 256, 256, 128]
    - [7, 1036.0]
  - - [256, 32, 8, 256, 256, 256, 256, 256]
    - [1, 1209.0]
  - - [256, 32, 8, 512, 256, 256, 256, 512]
    - [1, 1385.0]
  - - [256, 64, 8, 32, 256, 256, 256, 32]
    - [5, 1020.0]
  - - [256, 64, 8, 64, 256, 256, 256, 64]
    - [5, 1504.0]
  - - [256, 64, 8, 128, 256, 256, 256, 128]
    - [10, 1924.0]
  - - [256, 64, 8, 256, 256, 256, 256, 256]
    - [10, 2133.0]
  - - [256, 64, 8, 512, 256, 256, 256, 512]
    - [2, 2415.0]
  - - [256, 128, 8, 32, 256, 256, 256, 32]
    - [5, 1734.0]
  - - [256, 128, 8, 64, 256, 256, 256, 64]
    - [5, 2367.0]
  - - [256, 128, 8, 128, 256, 256, 256, 128]
    - [10, 2826.0]
  - - [256, 128, 8, 256, 256, 256, 256, 256]
    - [2, 2801.0]
  - - [256, 128, 8, 512, 256, 256, 256, 512]
    - [4, 3101.0]
  - - [256, 256, 8, 32, 256, 256, 256, 32]
    - [14, 2735.0]
  - - [256, 256, 8, 64, 256, 256, 256, 64]
    - [5, 3816.0]
  - - [256, 256, 8, 128, 256, 256, 256, 128]
    - [5, 3398.0]
  - - [256, 256, 8, 256, 256, 256, 256, 256]
    - [2, 3901.0]
  - - [256, 256, 8, 512, 256, 256, 256, 512]
    - [10, 4281.0]
  - - [256, 512, 8, 32, 256, 256, 256, 32]
    - [10, 3885.0]
  - - [256, 512, 8, 64, 256, 256, 256, 64]
    - [2, 4196.0]
  - - [256, 512, 8, 128, 256, 256, 256, 128]
    - [15, 3969.0]
  - - [256, 512, 8, 256, 256, 256, 256, 256]
    - [10, 4928.0]
  - - [256, 512, 8, 512, 256, 256, 256, 512]
    - [2, 5044.0]
  - - [512, 32, 8, 32, 512, 512, 512, 32]
    - [7, 1028.0]
  - - [512, 32, 8, 64, 512, 512, 512, 64]
    - [7, 1524.0]
  - - [512, 32, 8, 128, 512, 512, 512, 128]
    - [1, 1883.0]
  - - [512, 32, 8, 256, 512, 512, 512, 256]
    - [13, 1910.0]
  - - [512, 32, 8, 512, 512, 512, 512, 512]
    - [1, 2288.0]
  - - [512, 64, 8, 32, 512, 512, 512, 32]
    - [0, 1729.0]
  - - [512, 64, 8, 64, 512, 512, 512, 64]
    - [5, 2321.0]
  - - [512, 64, 8, 128, 512, 512, 512, 128]
    - [10, 2815.0]
  - - [512, 64, 8, 256, 512, 512, 512, 256]
    - [10, 2782.0]
  - - [512, 64, 8, 512, 512, 512, 512, 512]
    - [8, 3088.0]
  - - [512, 128, 8, 32, 512, 512, 512, 32]
    - [5, 2755.0]
  - - [512, 128, 8, 64, 512, 512, 512, 64]
    - [10, 3710.0]
  - - [512, 128, 8, 128, 512, 512, 512, 128]
    - [5, 3468.0]
  - - [512, 128, 8, 256, 512, 512, 512, 256]
    - [2, 3840.0]
  - - [512, 128, 8, 512, 512, 512, 512, 512]
    - [10, 4251.0]
  - - [512, 256, 8, 32, 512, 512, 512, 32]
    - [10, 3888.0]
  - - [512, 256, 8, 64, 512, 512, 512, 64]
    - [10, 4237.0]
  - - [512, 256, 8, 128, 512, 512, 512, 128]
    - [5, 4069.0]
  - - [512, 256, 8, 256, 512, 512, 512, 256]
    - [10, 4918.0]
  - - [512, 256, 8, 512, 512, 512, 512, 512]
    - [10, 5022.0]
  - - [512, 512, 8, 32, 512, 512, 512, 32]
    - [6, 4044.0]
  - - [512, 512, 8, 64, 512, 512, 512, 64]
    - [6, 3948.0]
  - - [512, 512, 8, 128, 512, 512, 512, 128]
    - [3, 4933.0]
  - - [512, 512, 8, 256, 512, 512, 512, 256]
    - [4, 5446.0]
  - - [512, 512, 8, 512, 512, 512, 512, 512]
    - [8, 5743.0]
- null
