library/src/blas3/Tensile/Logic/asm_full/vega20_Cijk_Alik_Bljk_4xi8BH.yaml
- {MinimumRequiredVersion: 4.6.0}
- vega20
- gfx906
- [Device 66a0, Device 66a1, Device 66a7]
    SolutionIndex: 0
    SolutionNameMin: Cijk_Alik_Bljk_4xi8BH_MT064x032x08_GSU01_TT04_02_USFGRO01_WG16_16_01
    SolutionIndex: 1
    SolutionNameMin: Cijk_Alik_Bljk_4xi8BH_MT128x032x16_GSU01_TT08_02_USFGRO01_WG16_16_01
    SolutionIndex: 2
    SolutionNameMin: Cijk_Alik_Bljk_4xi8BH_MT032x128x16_GSU01_TT02_08_USFGRO01_WG16_16_01
    SolutionIndex: 3
    SolutionNameMin: Cijk_Alik_Bljk_4xi8BH_MT064x016x16_GSU01_TT08_02_USFGRO01_WG08_08_01
    SolutionIndex: 4
    SolutionNameMin: Cijk_Alik_Bljk_4xi8BH_MT016x064x16_GSU01_TT02_08_USFGRO01_WG08_08_01
- - - [128, 128, 2, 65]
    - [0, 1238.42]
  - - [128, 1, 2, 64]
    - [4, 7.80191]
  - - [127, 127, 2, 1]
    - [1, 33.6021]
  - - [129, 129, 2, 63]
    - [0, 1139.55]
  - - [127, 127, 2, 65]
    - [0, 1103.56]
  - - [1, 127, 2, 64]
    - [4, 7.59626]
  - - [1, 128, 2, 64]
    - [3, 7.65607]
  - - [128, 129, 2, 1]
    - [3, 34.4]
  - - [1, 128, 2, 63]
    - [4, 7.2]
  - - [127, 1, 2, 63]
    - [3, 7.27364]
  - - [129, 1, 2, 64]
    - [3, 7.78868]
  - - [128, 1, 2, 63]
    - [3, 7.46667]
  - - [1, 129, 2, 65]
    - [4, 7.55405]
  - - [127, 129, 2, 1]
    - [1, 33.4347]
  - - [128, 128, 2, 64]
    - [0, 1263.34]
  - - [128, 1, 2, 65]
    - [3, 7.7037]
  - - [1, 129, 2, 64]
    - [4, 7.93846]
  - - [1, 129, 2, 63]
    - [4, 7.59533]
  - - [1, 128, 2, 65]
    - [4, 7.56364]
  - - [129, 129, 2, 65]
    - [0, 1163.16]
  - - [128, 128, 2, 1]
    - [3, 37.2364]
  - - [1, 1, 2, 1]
    - [3, 0.00151515]
  - - [129, 1, 2, 65]
    - [3, 7.42035]
  - - [127, 1, 2, 64]
    - [3, 7.74095]
  - - [127, 128, 2, 1]
    - [4, 36.1244]
  - - [129, 127, 2, 1]
    - [2, 32.766]
  - - [127, 1, 2, 65]
    - [3, 7.50455]
  - - [128, 127, 2, 1]
    - [3, 35.3391]
  - - [127, 127, 2, 64]
    - [0, 1022.04]
  - - [1, 127, 2, 65]
    - [4, 7.30531]
  - - [129, 1, 2, 63]
    - [3, 7.45596]
  - - [129, 129, 2, 1]
    - [1, 32.0019]
  - - [129, 129, 2, 64]
    - [0, 1224.17]
  - - [127, 127, 2, 63]
    - [0, 940.858]
  - - [1, 127, 2, 63]
    - [3, 5.3698]
  - - [128, 128, 2, 63]
    - [0, 1243.6]
  - - [129, 128, 2, 1]
    - [4, 33.698]
- null
