library/src/blas3/Tensile/Logic/asm_full/vega20_Cijk_Ailk_Bjlk_HB.yaml
- {MinimumRequiredVersion: 4.4.0}
- vega20
- gfx906
- [Device 66a0, Device 66a7]
    SolutionIndex: 0
    SolutionNameMin: Cijk_Ailk_Bjlk_HB_MT064x064x08_PGR1_PLR1_TT08_08
    SolutionIndex: 1
    SolutionNameMin: Cijk_Ailk_Bjlk_HB_MT016x016x16_PGR1_PLR1_TT02_02
    SolutionIndex: 2
    SolutionNameMin: Cijk_Ailk_Bjlk_HB_MT064x016x32_PGR1_PLR1_TT02_02
    SolutionIndex: 3
    SolutionNameMin: Cijk_Ailk_Bjlk_HB_MT032x016x64_PGR1_PLR1_TT02_02
    SolutionIndex: 4
    SolutionNameMin: Cijk_Ailk_Bjlk_HB_MT064x064x16_PGR1_PLR1_TT04_04
    SolutionIndex: 5
    SolutionNameMin: Cijk_Ailk_Bjlk_HB_MT064x128x16_PGR1_PLR1_TT04_08
    SolutionIndex: 6
    SolutionNameMin: Cijk_Ailk_Bjlk_HB_MT128x064x16_PGR1_PLR1_TT08_04
    SolutionIndex: 7
    SolutionNameMin: Cijk_Ailk_Bjlk_HB_MT128x128x16_PGR1_PLR1_TT08_08
    SolutionIndex: 8
    SolutionNameMin: Cijk_Ailk_Bjlk_HB_MT064x128x08_PGR0_PLR0_TT04_08
    SolutionIndex: 9
    SolutionNameMin: Cijk_Ailk_Bjlk_HB_MT064x064x16_PGR0_PLR0_TT04_04
    SolutionIndex: 10
    SolutionNameMin: Cijk_Ailk_Bjlk_HB_MT064x064x32_PGR1_PLR1_TT04_04
    SolutionIndex: 11
    SolutionNameMin: Cijk_Ailk_Bjlk_HB_MT128x128x04_PGR0_PLR0_TT08_08
    SolutionIndex: 12
    SolutionNameMin: Cijk_Ailk_Bjlk_HB_MT064x128x04_PGR0_PLR0_TT04_08
    SolutionIndex: 13
    SolutionNameMin: Cijk_Ailk_Bjlk_HB_MT064x128x04_PGR0_PLR1_TT04_08
    SolutionIndex: 14
    SolutionNameMin: Cijk_Ailk_Bjlk_HB_MT064x064x16_PGR1_PLR1_TT04_04
    SolutionIndex: 15
    SolutionNameMin: Cijk_Ailk_Bjlk_HB_MT064x064x32_PGR1_PLR1_TT04_04
    SolutionIndex: 1
    SolutionNameMin: Cijk_Ailk_Bjlk_HB_MT032x128x16_DTL0_GRVW08_GSU01_PGR0_PLR1_TT04_04_VW04_WG08_32_01_WGM01
    SolutionIndex: 2
    SolutionNameMin: Cijk_Ailk_Bjlk_HB_MT064x256x08_DTL0_GRVW08_GSU01_PGR1_PLR1_TT08_08_VW08_WG08_32_01_WGM01
    SolutionIndex: 3
    SolutionNameMin: Cijk_Ailk_Bjlk_HB_MT128x064x08_DTL0_GRVW08_GSU01_PGR1_PLR1_TT08_08_VW08_WG16_08_01_WGM01
    SolutionIndex: 4
    SolutionNameMin: Cijk_Ailk_Bjlk_HB_MT032x128x16_DTL0_GRVW08_GSU01_PGR1_PLR1_TT04_04_VW04_WG08_32_01_WGM01
    SolutionIndex: 5
    SolutionNameMin: Cijk_Ailk_Bjlk_HB_MT128x064x16_DTL0_GRVW08_GSU01_PGR0_PLR1_TT08_04_VW04_WG16_16_01_WGM01
    SolutionIndex: 6
    SolutionNameMin: Cijk_Ailk_Bjlk_HB_MT064x128x16_DTL0_GRVW08_GSU01_PGR1_PLR1_TT08_04_VW04_WG08_32_01_WGM01
    SolutionIndex: 7
    SolutionNameMin: Cijk_Ailk_Bjlk_HB_MT128x064x16_DTL0_GRVW08_GSU01_PGR1_PLR1_TT08_04_VW04_WG16_16_01_WGM01
    SolutionIndex: 8
    SolutionNameMin: Cijk_Ailk_Bjlk_HB_MT032x128x16_DTL0_GRVW08_GSU01_PGR0_PLR1_TT04_04_VW04_WG08_32_01_WGM64
- - - [4096, 7133, 1, 4096]
    - [7, 19092.5]
  - - [512, 16, 1, 512]
    - [1, 297.88]
  - - [2048, 7133, 1, 2048]
    - [7, 18761.3]
  - - [2560, 7133, 1, 2560]
    - [6, 18696.1]
  - - [1024, 1024, 1, 1024]
    - [4, 14278.3]
  - - [3072, 7435, 1, 1024]
    - [0, 18595.1]
  - - [1024, 32, 1, 512]
    - [2, 1240.92]
  - - [1760, 7133, 1, 1760]
    - [5, 17821.9]
  - - [7680, 5481, 1, 2560]
    - [7, 18848.3]
  - - [1024, 16, 1, 512]
    - [1, 589.088]
  - - [512, 32, 1, 512]
    - [3, 627.866]
  - - [3136, 256, 64, 64]
    - [17, 16074.9]
  - - [784, 512, 64, 128]
    - [17, 15833.4]
  - - [784, 128, 64, 512]
    - [21, 16500.8]
  - - [196, 1024, 64, 256]
    - [16, 13742.4]
  - - [3136, 64, 128, 64]
    - [18, 14617.2]
  - - [784, 512, 128, 128]
    - [17, 16298.0]
  - - [196, 1024, 128, 256]
    - [23, 14030.9]
  - - [196, 256, 64, 1024]
    - [19, 14105.5]
  - - [3136, 64, 64, 64]
    - [20, 13485.4]
  - - [3136, 64, 64, 256]
    - [22, 16852.6]
  - - [3136, 64, 128, 256]
    - [20, 17346.9]
  - - [784, 128, 128, 512]
    - [21, 16988.5]
  - - [196, 256, 128, 1024]
    - [19, 14648.5]
  - - [3136, 256, 128, 64]
    - [17, 16431.6]
- - - -1
    - - - 1
        - - - 32
            - - [128, 14]
              - [256, 15]
              - [448, 14]
              - [1408, 15]
              - [1856, 14]
              - [5056, 15]
              - [-1, 14]
          - - 64
            - - [32, 15]
              - [64, 14]
              - [128, 15]
              - [256, 13]
              - [704, 14]
              - [1408, 13]
              - [1856, 14]
              - [2368, 13]
              - [2944, 14]
              - [5056, 12]
              - [5888, 13]
              - [-1, 14]
          - - 128
            - - [256, 14]
              - [448, 12]
              - [704, 14]
              - [1024, 15]
              - [1408, 13]
              - [1856, 12]
              - [2944, 13]
              - [4288, 14]
              - [5888, 12]
              - [-1, 13]
          - - 256
            - - [32, 14]
              - [128, 13]
              - [704, 14]
              - [1856, 13]
              - [2368, 14]
              - [2944, 13]
              - [3584, 14]
              - [-1, 13]
          - - 448
            - - [32, 14]
              - [64, 15]
              - [128, 13]
              - [256, 14]
              - [448, 15]
              - [1024, 13]
              - [1408, 12]
              - [2368, 13]
              - [2944, 12]
              - [3584, 11]
              - [4288, 13]
              - [-1, 12]
          - - 704
            - - [32, 14]
              - [128, 15]
              - [256, 13]
              - [448, 12]
              - [704, 14]
              - [1856, 13]
              - [3584, 12]
              - [5056, 13]
              - [5888, 12]
              - [-1, 13]
          - - 1024
            - - [32, 14]
              - [64, 15]
              - [128, 14]
              - [256, 12]
              - [448, 14]
              - [704, 13]
              - [1408, 12]
              - [2368, 13]
              - [2944, 12]
              - [4288, 13]
              - [5056, 12]
              - [5888, 13]
              - [-1, 12]
          - - 1408
            - - [32, 14]
              - [64, 15]
              - [448, 14]
              - [1024, 12]
              - [1408, 13]
              - [2944, 12]
              - [3584, 13]
              - [5056, 12]
              - [5888, 13]
              - [-1, 12]
          - - 1856
            - - [32, 14]
              - [64, 15]
              - [128, 13]
              - [256, 14]
              - [448, 13]
              - [704, 12]
              - [1024, 11]
              - [1856, 12]
              - [2944, 13]
              - [3584, 12]
              - [4288, 13]
              - [5888, 12]
              - [-1, 11]
          - - 2368
            - - [32, 14]
              - [64, 15]
              - [128, 14]
              - [256, 13]
              - [1408, 12]
              - [1856, 13]
              - [2944, 12]
              - [3584, 13]
              - [4288, 12]
              - [-1, 11]
          - - 2944
            - - [128, 14]
              - [1856, 13]
              - [2368, 12]
              - [2944, 13]
              - [3584, 12]
              - [-1, 13]
          - - 3584
            - - [32, 14]
              - [64, 15]
              - [256, 14]
              - [448, 11]
              - [704, 12]
              - [1856, 13]
              - [4288, 12]
              - [5056, 13]
              - [5888, 12]
              - [-1, 13]
          - - 4288
            - - [128, 14]
              - [448, 13]
              - [1408, 12]
              - [2368, 13]
              - [-1, 11]
          - - 5056
            - - [32, 14]
              - [64, 13]
              - [128, 14]
              - [256, 12]
              - [448, 13]
              - [704, 12]
              - [1024, 13]
              - [1408, 12]
              - [1856, 13]
              - [2368, 11]
              - [2944, 12]
              - [-1, 11]
          - - 5888
            - - [64, 14]
              - [128, 12]
              - [256, 13]
              - [704, 12]
              - [1024, 13]
              - [2944, 12]
              - [4288, 13]
              - [5056, 12]
              - [-1, 13]
          - - -1
            - - [64, 14]
              - [128, 12]
              - [256, 11]
              - [1408, 12]
              - [1856, 13]
              - [2368, 12]
              - [2944, 13]
              - [4288, 12]
              - [5056, 13]
              - [5888, 11]
              - [-1, 13]
      - - 32
        - - - 32
            - - [128, 9]
              - [256, 10]
              - [448, 9]
              - [4288, 10]
              - [-1, 9]
          - - 64
            - - [64, 10]
              - [-1, 9]
          - - 128
            - - [32, 10]
              - [1024, 9]
              - [1408, 8]
              - [-1, 9]
          - - 256
            - - [64, 10]
              - [4288, 9]
              - [5888, 8]
              - [-1, 9]
          - - 448
            - - [32, 9]
              - [64, 10]
              - [448, 9]
              - [704, 8]
              - [1024, 10]
              - [1408, 8]
              - [1856, 9]
              - [-1, 8]
          - - 704
            - - [32, 9]
              - [64, 10]
              - [1408, 9]
              - [3584, 8]
              - [4288, 9]
              - [-1, 8]
          - - 1024
            - - [32, 9]
              - [64, 10]
              - [1024, 9]
              - [1408, 8]
              - [3584, 9]
              - [-1, 8]
          - - 1408
            - - [32, 9]
              - [64, 10]
              - [448, 9]
              - [1408, 8]
              - [1856, 9]
              - [-1, 8]
          - - 1856
            - - [32, 9]
              - [64, 10]
              - [256, 9]
              - [1024, 8]
              - [1408, 9]
              - [-1, 8]
          - - 2368
            - - [32, 9]
              - [128, 10]
              - [256, 9]
              - [448, 8]
              - [1024, 9]
              - [-1, 8]
          - - 2944
            - - [32, 9]
              - [64, 10]
              - [256, 9]
              - [448, 8]
              - [704, 9]
              - [1408, 8]
              - [1856, 9]
              - [-1, 8]
          - - 3584
            - - [256, 9]
              - [448, 8]
              - [704, 9]
              - [-1, 8]
          - - 4288
            - - [128, 9]
              - [256, 8]
              - [448, 9]
              - [-1, 8]
          - - 5056
            - - [64, 10]
              - [128, 9]
              - [256, 8]
              - [448, 9]
              - [-1, 8]
          - - 5888
            - - [128, 9]
              - [256, 8]
              - [704, 9]
              - [-1, 8]
          - - -1
            - - [128, 9]
              - [448, 8]
              - [704, 9]
              - [-1, 8]
      - - 256
        - - - 1
            - - [128, 14]
              - [256, 15]
              - [704, 14]
              - [1024, 15]
              - [-1, 14]
          - - 32
            - - [32, 9]
              - [256, 10]
              - [4288, 9]
              - [5056, 10]
              - [-1, 9]
          - - 64
            - - [1, 14]
              - [32, 9]
              - [64, 2]
              - [128, 1]
              - [256, 2]
              - [2368, 1]
              - [2944, 2]
              - [3584, 1]
              - [-1, 4]
          - - 128
            - - [1, 15]
              - [32, 9]
              - [64, 1]
              - [256, 2]
              - [704, 1]
              - [1856, 2]
              - [5888, 4]
              - [-1, 5]
          - - 256
            - - [1, 14]
              - [32, 9]
              - [256, 1]
              - [448, 2]
              - [2944, 4]
              - [3584, 6]
              - [-1, 4]
          - - 448
            - - [1, 14]
              - [32, 9]
              - [256, 1]
              - [448, 2]
              - [3584, 4]
              - [4288, 5]
              - [5888, 4]
              - [-1, 5]
          - - 704
            - - [1, 14]
              - [32, 9]
              - [64, 2]
              - [128, 1]
              - [2368, 4]
              - [2944, 5]
              - [3584, 4]
              - [5056, 5]
              - [5888, 0]
              - [-1, 4]
          - - 1024
            - - [1, 14]
              - [32, 9]
              - [64, 2]
              - [128, 1]
              - [1408, 4]
              - [2944, 6]
              - [3584, 5]
              - [4288, 4]
              - [5888, 0]
              - [-1, 7]
          - - 1408
            - - [1, 14]
              - [32, 9]
              - [64, 1]
              - [128, 2]
              - [704, 4]
              - [1024, 5]
              - [1856, 6]
              - [2368, 4]
              - [3584, 7]
              - [5056, 0]
              - [5888, 7]
              - [-1, 6]
          - - 1856
            - - [1, 14]
              - [32, 9]
              - [64, 1]
              - [704, 4]
              - [1856, 5]
              - [2944, 4]
              - [3584, 5]
              - [5056, 0]
              - [-1, 5]
          - - 2368
            - - [1, 14]
              - [32, 9]
              - [64, 1]
              - [704, 4]
              - [1024, 5]
              - [1856, 4]
              - [2368, 5]
              - [2944, 0]
              - [3584, 5]
              - [5056, 0]
              - [-1, 5]
          - - 2944
            - - [1, 14]
              - [32, 9]
              - [64, 2]
              - [448, 4]
              - [1024, 6]
              - [1408, 7]
              - [1856, 4]
              - [2368, 0]
              - [2944, 5]
              - [5056, 6]
              - [-1, 7]
          - - 3584
            - - [1, 14]
              - [32, 9]
              - [448, 4]
              - [704, 6]
              - [1024, 5]
              - [1408, 0]
              - [3584, 6]
              - [4288, 7]
              - [5056, 0]
              - [-1, 7]
          - - 4288
            - - [1, 14]
              - [32, 9]
              - [256, 4]
              - [704, 6]
              - [1024, 5]
              - [2368, 0]
              - [2944, 5]
              - [5056, 0]
              - [5888, 7]
              - [-1, 0]
          - - 5056
            - - [1, 14]
              - [32, 9]
              - [448, 4]
              - [704, 6]
              - [2368, 0]
              - [2944, 5]
              - [5056, 0]
              - [5888, 7]
              - [-1, 0]
          - - 5888
            - - [1, 14]
              - [32, 9]
              - [128, 4]
              - [256, 5]
              - [448, 4]
              - [704, 0]
              - [1408, 7]
              - [2368, 6]
              - [3584, 7]
              - [5056, 0]
              - [-1, 7]
          - - -1
            - - [1, 14]
              - [32, 10]
              - [256, 4]
              - [448, 6]
              - [704, 4]
              - [1024, 7]
              - [2368, 6]
              - [3584, 7]
              - [5056, 0]
              - [-1, 7]
      - - 1280
        - - - 1
            - - [128, 15]
              - [256, 14]
              - [1408, 15]
              - [1856, 14]
              - [3584, 15]
              - [-1, 14]
          - - 32
            - - [-1, 10]
          - - 64
            - - [1, 15]
              - [32, 10]
              - [64, 1]
              - [448, 3]
              - [704, 2]
              - [1024, 1]
              - [1856, 2]
              - [2368, 1]
              - [2944, 2]
              - [-1, 4]
          - - 128
            - - [1, 15]
              - [32, 10]
              - [64, 2]
              - [256, 3]
              - [1408, 2]
              - [5888, 4]
              - [-1, 6]
          - - 256
            - - [1, 15]
              - [32, 10]
              - [64, 2]
              - [128, 3]
              - [448, 2]
              - [2944, 4]
              - [3584, 6]
              - [5056, 4]
              - [5888, 6]
              - [-1, 4]
          - - 448
            - - [1, 15]
              - [32, 10]
              - [64, 1]
              - [128, 2]
              - [256, 3]
              - [2368, 4]
              - [2944, 5]
              - [3584, 4]
              - [4288, 5]
              - [5888, 4]
              - [-1, 5]
          - - 704
            - - [1, 15]
              - [32, 10]
              - [64, 2]
              - [128, 3]
              - [2368, 4]
              - [5888, 5]
              - [-1, 7]
          - - 1024
            - - [1, 15]
              - [32, 10]
              - [128, 2]
              - [1024, 4]
              - [3584, 6]
              - [4288, 4]
              - [-1, 7]
          - - 1408
            - - [1, 15]
              - [32, 10]
              - [128, 2]
              - [448, 4]
              - [704, 6]
              - [1024, 5]
              - [1856, 6]
              - [2368, 4]
              - [5888, 7]
              - [-1, 6]
          - - 1856
            - - [1, 15]
              - [32, 10]
              - [64, 2]
              - [704, 4]
              - [1856, 5]
              - [2368, 4]
              - [2944, 6]
              - [3584, 5]
              - [4288, 7]
              - [5056, 0]
              - [-1, 5]
          - - 2368
            - - [1, 15]
              - [32, 10]
              - [64, 1]
              - [704, 4]
              - [1024, 6]
              - [1856, 4]
              - [2368, 5]
              - [2944, 7]
              - [3584, 5]
              - [4288, 0]
              - [5056, 7]
              - [-1, 5]
          - - 2944
            - - [1, 15]
              - [32, 10]
              - [64, 2]
              - [256, 4]
              - [448, 5]
              - [704, 6]
              - [1408, 7]
              - [1856, 5]
              - [2368, 7]
              - [3584, 5]
              - [5056, 6]
              - [5888, 7]
              - [-1, 5]
          - - 3584
            - - [1, 15]
              - [32, 10]
              - [448, 4]
              - [704, 6]
              - [1024, 5]
              - [1408, 7]
              - [2944, 6]
              - [3584, 5]
              - [4288, 7]
              - [-1, 6]
          - - 4288
            - - [1, 14]
              - [32, 10]
              - [256, 4]
              - [1024, 6]
              - [1856, 7]
              - [2368, 0]
              - [2944, 5]
              - [3584, 7]
              - [5056, 0]
              - [5888, 5]
              - [-1, 0]
          - - 5056
            - - [1, 14]
              - [32, 10]
              - [448, 4]
              - [704, 6]
              - [1408, 7]
              - [1856, 0]
              - [2368, 7]
              - [3584, 5]
              - [4288, 0]
              - [5888, 7]
              - [-1, 0]
          - - 5888
            - - [1, 14]
              - [32, 10]
              - [128, 4]
              - [256, 6]
              - [448, 4]
              - [704, 6]
              - [1408, 7]
              - [2368, 6]
              - [2944, 7]
              - [5056, 6]
              - [-1, 7]
          - - -1
            - - [1, 14]
              - [32, 10]
              - [256, 4]
              - [448, 6]
              - [704, 4]
              - [1024, 7]
              - [3584, 6]
              - [5056, 0]
              - [-1, 7]
      - - -1
        - - - 1
            - - [3584, 15]
              - [-1, 14]
          - - 32
            - - [-1, 10]
          - - 64
            - - [1, 15]
              - [32, 10]
              - [448, 3]
              - [1024, 2]
              - [1408, 3]
              - [1856, 2]
              - [2368, 1]
              - [2944, 2]
              - [-1, 4]
          - - 128
            - - [1, 15]
              - [32, 10]
              - [256, 3]
              - [448, 2]
              - [704, 3]
              - [1408, 2]
              - [5888, 4]
              - [-1, 5]
          - - 256
            - - [1, 15]
              - [32, 10]
              - [64, 3]
              - [256, 2]
              - [448, 3]
              - [2944, 4]
              - [3584, 5]
              - [5056, 4]
              - [5888, 6]
              - [-1, 4]
          - - 448
            - - [1, 15]
              - [32, 10]
              - [64, 3]
              - [256, 2]
              - [1408, 4]
              - [1856, 5]
              - [2368, 4]
              - [2944, 6]
              - [3584, 4]
              - [4288, 5]
              - [5888, 4]
              - [-1, 5]
          - - 704
            - - [1, 15]
              - [32, 10]
              - [64, 2]
              - [128, 3]
              - [1024, 4]
              - [1408, 5]
              - [2368, 4]
              - [5888, 5]
              - [-1, 7]
          - - 1024
            - - [1, 15]
              - [32, 10]
              - [64, 3]
              - [128, 2]
              - [704, 4]
              - [1024, 5]
              - [2368, 6]
              - [2944, 7]
              - [3584, 5]
              - [4288, 4]
              - [-1, 7]
          - - 1408
            - - [1, 15]
              - [32, 10]
              - [64, 3]
              - [128, 2]
              - [448, 4]
              - [1856, 6]
              - [2368, 4]
              - [5888, 7]
              - [-1, 6]
          - - 1856
            - - [1, 15]
              - [32, 10]
              - [64, 2]
              - [256, 4]
              - [448, 6]
              - [704, 4]
              - [1408, 5]
              - [1856, 6]
              - [2368, 4]
              - [3584, 5]
              - [4288, 7]
              - [5056, 0]
              - [-1, 5]
          - - 2368
            - - [1, 15]
              - [32, 10]
              - [64, 1]
              - [704, 4]
              - [1024, 5]
              - [1856, 4]
              - [2368, 5]
              - [2944, 7]
              - [3584, 5]
              - [4288, 0]
              - [5056, 7]
              - [-1, 5]
          - - 2944
            - - [1, 15]
              - [32, 10]
              - [64, 2]
              - [256, 4]
              - [704, 6]
              - [1408, 7]
              - [1856, 6]
              - [2368, 7]
              - [4288, 5]
              - [5056, 6]
              - [5888, 7]
              - [-1, 5]
          - - 3584
            - - [1, 15]
              - [32, 10]
              - [128, 4]
              - [256, 6]
              - [448, 4]
              - [1024, 6]
              - [1408, 7]
              - [2368, 6]
              - [3584, 5]
              - [4288, 7]
              - [5056, 6]
              - [5888, 5]
              - [-1, 6]
          - - 4288
            - - [1, 14]
              - [32, 10]
              - [256, 4]
              - [704, 6]
              - [1024, 4]
              - [1856, 7]
              - [2368, 0]
              - [2944, 5]
              - [3584, 7]
              - [5056, 0]
              - [5888, 5]
              - [-1, 0]
          - - 5056
            - - [1, 14]
              - [32, 10]
              - [448, 4]
              - [704, 6]
              - [1408, 7]
              - [1856, 0]
              - [2368, 7]
              - [3584, 5]
              - [4288, 0]
              - [5056, 7]
              - [5888, 5]
              - [-1, 0]
          - - 5888
            - - [1, 14]
              - [32, 10]
              - [128, 4]
              - [256, 6]
              - [448, 4]
              - [704, 6]
              - [1408, 7]
              - [2368, 6]
              - [2944, 7]
              - [5056, 6]
              - [-1, 7]
          - - -1
            - - [1, 14]
              - [32, 10]
              - [64, 4]
              - [128, 6]
              - [256, 4]
              - [448, 6]
              - [1024, 7]
              - [1408, 5]
              - [3584, 6]
              - [5056, 0]
              - [-1, 7]
