library/src/blas3/Tensile/Logic/asm_full/vega20_Cijk_Ailk_Bljk_HBH.yaml
- {MinimumRequiredVersion: 4.5.0}
- vega20
- gfx906
- [Device 66a0, Device 66a1, Device 66a7]
    SolutionIndex: 0
    SolutionNameMin: Cijk_Ailk_Bljk_HBH_MT016x016x16_PGR1_PLR1_TT02_02
    SolutionIndex: 1
    SolutionNameMin: Cijk_Ailk_Bljk_HBH_MT064x064x16_PGR1_PLR1_TT08_08
    SolutionIndex: 2
    SolutionNameMin: Cijk_Ailk_Bljk_HBH_MT032x016x16_PGR1_PLR1_TT02_02
    SolutionIndex: 3
    SolutionNameMin: Cijk_Ailk_Bljk_HBH_MT128x032x16_PGR1_PLR1_TT04_04
    SolutionIndex: 4
    SolutionNameMin: Cijk_Ailk_Bljk_HBH_MT016x016x32_PGR1_PLR1_TT02_02
    SolutionIndex: 5
    SolutionNameMin: Cijk_Ailk_Bljk_HBH_MT032x008x32_PGR1_PLR1_TT02_02
    SolutionIndex: 6
    SolutionNameMin: Cijk_Ailk_Bljk_HBH_MT064x008x32_PGR1_PLR1_TT02_02
    SolutionIndex: 7
    SolutionNameMin: Cijk_Ailk_Bljk_HBH_MT064x016x32_PGR1_PLR1_TT02_02
    SolutionIndex: 8
    SolutionNameMin: Cijk_Ailk_Bljk_HBH_MT032x008x64_PGR1_PLR1_TT02_02
    SolutionIndex: 9
    SolutionNameMin: Cijk_Ailk_Bljk_HBH_MT064x032x08_PGR1_PLR1_TT08_04
    SolutionIndex: 10
    SolutionNameMin: Cijk_Ailk_Bljk_HBH_MT032x016x16_PGR1_PLR1_TT04_02
    SolutionIndex: 11
    SolutionNameMin: Cijk_Ailk_Bljk_HBH_MT032x016x16_PGR1_PLR1_TT02_02
    SolutionIndex: 12
    SolutionNameMin: Cijk_Ailk_Bljk_HBH_MT128x032x16_PGR1_PLR1_TT04_04
    SolutionIndex: 13
    SolutionNameMin: Cijk_Ailk_Bljk_HBH_MT064x016x16_PGR1_PLR1_TT04_04
    SolutionIndex: 14
    SolutionNameMin: Cijk_Ailk_Bljk_HBH_MT064x016x32_PGR1_PLR1_TT02_02
    SolutionIndex: 15
    SolutionNameMin: Cijk_Ailk_Bljk_HBH_MT128x016x32_PGR1_PLR1_TT04_02
    SolutionIndex: 16
    SolutionNameMin: Cijk_Ailk_Bljk_HBH_MT032x008x32_PGR1_PLR1_TT02_02
    SolutionIndex: 17
    SolutionNameMin: Cijk_Ailk_Bljk_HBH_MT064x008x32_PGR1_PLR1_TT02_02
    SolutionIndex: 18
    SolutionNameMin: Cijk_Ailk_Bljk_HBH_MT064x064x08_PGR0_PLR1_TT04_04
    SolutionIndex: 19
    SolutionNameMin: Cijk_Ailk_Bljk_HBH_MT128x064x08_PGR1_PLR1_TT08_04
    SolutionIndex: 20
    SolutionNameMin: Cijk_Ailk_Bljk_HBH_MT064x032x16_PGR0_PLR1_TT08_04
    SolutionIndex: 21
    SolutionNameMin: Cijk_Ailk_Bljk_HBH_MT064x064x16_PGR0_PLR1_TT04_04
    SolutionIndex: 22
    SolutionNameMin: Cijk_Ailk_Bljk_HBH_MT064x064x16_PGR1_PLR1_TT04_04
    SolutionIndex: 23
    SolutionNameMin: Cijk_Ailk_Bljk_HBH_MT064x128x16_PGR1_PLR1_TT04_08
    SolutionIndex: 24
    SolutionNameMin: Cijk_Ailk_Bljk_HBH_MT128x064x16_PGR1_PLR1_TT08_04
    SolutionIndex: 25
    SolutionNameMin: Cijk_Ailk_Bljk_HBH_MT128x128x16_PGR1_PLR1_TT08_08
    SolutionIndex: 26
    SolutionNameMin: Cijk_Ailk_Bljk_HBH_MT064x064x32_PGR1_PLR1_TT04_04
    SolutionIndex: 27
    SolutionNameMin: Cijk_Ailk_Bljk_HBH_MT128x064x32_PGR1_PLR1_TT08_04
    SolutionIndex: 28
    SolutionNameMin: Cijk_Ailk_Bljk_HBH_MT128x128x32_PGR0_PLR1_TT08_08
    SolutionIndex: 29
    SolutionNameMin: Cijk_Ailk_Bljk_HBH_MT128x128x32_PGR1_PLR1_TT08_08
    SolutionIndex: 30
    SolutionNameMin: Cijk_Ailk_Bljk_HBH_MT128x128x64_PGR0_PLR1_TT08_08
    SolutionIndex: 31
    SolutionNameMin: Cijk_Ailk_Bljk_HBH_MT064x032x32_PGR1_PLR1_TT04_02
    SolutionIndex: 32
    SolutionNameMin: Cijk_Ailk_Bljk_HBH_MT128x064x16_PGR1_PLR1_TT04_08
    SolutionIndex: 33
    SolutionNameMin: Cijk_Ailk_Bljk_HBH_MT064x064x16_PGR1_PLR1_TT04_04
    SolutionIndex: 34
    SolutionNameMin: Cijk_Ailk_Bljk_HBH_MT064x128x16_PGR1_PLR1_TT04_08
    SolutionIndex: 35
    SolutionNameMin: Cijk_Ailk_Bljk_HBH_MT128x064x16_PGR1_PLR1_TT08_04
    SolutionIndex: 36
    SolutionNameMin: Cijk_Ailk_Bljk_HBH_MT128x032x16_PGR1_PLR1_TT04_04
    SolutionIndex: 37
    SolutionNameMin: Cijk_Ailk_Bljk_HBH_MT128x064x16_PGR1_PLR1_TT04_08
    SolutionIndex: 38
    SolutionNameMin: Cijk_Ailk_Bljk_HBH_MT064x032x16_PGR0_PLR0_TT04_04
    SolutionIndex: 39
    SolutionNameMin: Cijk_Ailk_Bljk_HBH_MT032x128x16_PGR0_PLR0_TT04_04
    SolutionIndex: 40
    SolutionNameMin: Cijk_Ailk_Bljk_HBH_MT128x032x16_PGR0_PLR0_TT04_04
    SolutionIndex: 41
    SolutionNameMin: Cijk_Ailk_Bljk_HBH_MT064x064x04_PGR1_PLR1_TT04_04
    SolutionIndex: 42
    SolutionNameMin: Cijk_Ailk_Bljk_HBH_MT064x064x08_PGR0_PLR0_TT04_04
    SolutionIndex: 43
    SolutionNameMin: Cijk_Ailk_Bljk_HBH_MT064x064x16_PGR1_PLR1_TT04_04
    SolutionIndex: 44
    SolutionNameMin: Cijk_Ailk_Bljk_HBH_MT064x064x04_PGR0_PLR0_TT04_04
    SolutionIndex: 45
    SolutionNameMin: Cijk_Ailk_Bljk_HBH_MT064x128x04_PGR1_PLR0_TT04_08
    SolutionIndex: 46
    SolutionNameMin: Cijk_Ailk_Bljk_HBH_MT064x064x04_PGR1_PLR1_TT04_04
    SolutionIndex: 47
    SolutionNameMin: Cijk_Ailk_Bljk_HBH_MT064x064x16_PGR1_PLR1_TT04_04
    SolutionIndex: 0
    SolutionNameMin: Cijk_Ailk_Bljk_HBH_MT064x128x08_GRVW04_LPB00_NLCB01_PBC0_PGR1_PLR1_TT08_04_USFGRO00_VW04_WG08_32_01_WGM01
    SolutionIndex: 1
    SolutionNameMin: Cijk_Ailk_Bljk_HBH_MT064x064x16_GRVW04_LPB00_NLCB01_PBC0_PGR1_PLR1_TT04_04_USFGRO00_VW04_WG16_16_01_WGM01
    SolutionIndex: 2
    SolutionNameMin: Cijk_Ailk_Bljk_HBH_MT064x128x08_GRVW04_LPB04_NLCB01_PBC0_PGR1_PLR1_TT08_04_USFGRO00_VW04_WG08_32_01_WGM01
    SolutionIndex: 3
    SolutionNameMin: Cijk_Ailk_Bljk_HBH_MT032x128x16_GRVW04_LPB04_NLCB01_PBC0_PGR0_PLR1_TT04_04_USFGRO00_VW04_WG08_32_01_WGM01
    SolutionIndex: 4
    SolutionNameMin: Cijk_Ailk_Bljk_HBH_MT064x128x16_GRVW04_LPB04_NLCB01_PBC0_PGR1_PLR1_TT08_04_USFGRO00_VW04_WG08_32_01_WGM01
    SolutionIndex: 5
    SolutionNameMin: Cijk_Ailk_Bljk_HBH_MT064x064x16_GRVW04_LPB04_NLCB01_PBC0_PGR0_PLR1_TT04_04_USFGRO00_VW04_WG16_16_01_WGM01
    SolutionIndex: 6
    SolutionNameMin: Cijk_Ailk_Bljk_HBH_MT128x064x16_GRVW04_LPB04_NLCB01_PBC0_PGR1_PLR1_TT08_04_USFGRO00_VW04_WG16_16_01_WGM01
    SolutionIndex: 7
    SolutionNameMin: Cijk_Ailk_Bljk_HBH_MT128x032x16_GRVW04_LPB04_NLCB01_PBC0_PGR1_PLR1_TT04_04_USFGRO00_VW04_WG32_08_01_WGM01
    SolutionIndex: 8
    SolutionNameMin: Cijk_Ailk_Bljk_HBH_MT064x064x16_GRVW04_LPB04_NLCB01_PBC0_PGR1_PLR1_TT04_04_USFGRO00_VW04_WG16_16_01_WGM08
    SolutionIndex: 9
    SolutionNameMin: Cijk_Ailk_Bljk_HBH_MT128x032x16_GRVW04_LPB04_NLCB01_PBC0_PGR1_PLR1_TT04_04_USFGRO00_VW04_WG32_08_01_WGM08
    SolutionIndex: 0
    SolutionNameMin: Cijk_Ailk_Bljk_HBH_MT032x128x16_DTL0_GRVW02_LPB04_PGR0_PLR1_TT04_04_USFGRO01_VW04_WG08_32_01_WGM01
    SolutionIndex: 1
    SolutionNameMin: Cijk_Ailk_Bljk_HBH_MT064x128x16_DTL0_GRVW02_LPB04_PGR0_PLR0_TT08_04_USFGRO01_VW04_WG08_32_01_WGM01
    SolutionIndex: 2
    SolutionNameMin: Cijk_Ailk_Bljk_HBH_MT064x064x16_DTL0_GRVW02_LPB04_PGR0_PLR1_TT04_04_USFGRO01_VW04_WG16_16_01_WGM01
    SolutionIndex: 3
    SolutionNameMin: Cijk_Ailk_Bljk_HBH_MT064x064x16_DTL0_GRVW02_LPB04_PGR1_PLR1_TT04_04_USFGRO01_VW04_WG16_16_01_WGM01
    SolutionIndex: 4
    SolutionNameMin: Cijk_Ailk_Bljk_HBH_MT032x128x32_DTL0_GRVW02_LPB04_PGR0_PLR1_TT04_04_USFGRO01_VW04_WG08_32_01_WGM01
    SolutionIndex: 5
    SolutionNameMin: Cijk_Ailk_Bljk_HBH_MT064x128x16_DTL0_GRVW04_LPB04_PGR1_PLR1_TT08_04_USFGRO0_VW04_WG08_32_01_WGM01
    SolutionIndex: 6
    SolutionNameMin: Cijk_Ailk_Bljk_HBH_MT064x064x16_DTL0_GRVW04_LPB04_PGR1_PLR1_TT04_04_USFGRO0_VW04_WG16_16_01_WGM08
    SolutionIndex: 7
    SolutionNameMin: Cijk_Ailk_Bljk_HBH_MT128x032x16_DTL0_GRVW04_LPB04_PGR1_PLR1_TT04_04_USFGRO0_VW04_WG32_08_01_WGM08
    SolutionIndex: 0
    SolutionNameMin: Cijk_Ailk_Bljk_HBH_MT032x032x08_PGR0_PLR1_TT04_04
    SolutionIndex: 1
    SolutionNameMin: Cijk_Ailk_Bljk_HBH_MT128x032x08_PGR1_PLR1_TT04_04
    SolutionIndex: 2
    SolutionNameMin: Cijk_Ailk_Bljk_HBH_MT032x032x16_PGR1_PLR1_TT04_04
    SolutionIndex: 3
    SolutionNameMin: Cijk_Ailk_Bljk_HBH_MT064x016x16_PGR1_PLR1_TT04_04
    SolutionIndex: 4
    SolutionNameMin: Cijk_Ailk_Bljk_HBH_MT064x032x16_PGR1_PLR1_TT04_04
    SolutionIndex: 5
    SolutionNameMin: Cijk_Ailk_Bljk_HBH_MT064x064x16_PGR1_PLR1_TT04_04
    SolutionIndex: 6
    SolutionNameMin: Cijk_Ailk_Bljk_HBH_MT128x016x16_PGR1_PLR1_TT04_04
    SolutionIndex: 7
    SolutionNameMin: Cijk_Ailk_Bljk_HBH_MT128x032x16_PGR1_PLR1_TT04_04
    SolutionIndex: 8
    SolutionNameMin: Cijk_Ailk_Bljk_HBH_MT032x032x32_PGR1_PLR1_TT04_04
    SolutionIndex: 9
    SolutionNameMin: Cijk_Ailk_Bljk_HBH_MT064x016x32_PGR1_PLR1_TT04_04
    SolutionIndex: 10
    SolutionNameMin: Cijk_Ailk_Bljk_HBH_MT064x032x32_PGR1_PLR1_TT04_04
    SolutionIndex: 11
    SolutionNameMin: Cijk_Ailk_Bljk_HBH_MT128x032x32_PGR1_PLR1_TT04_04
    SolutionIndex: 12
    SolutionNameMin: Cijk_Ailk_Bljk_HBH_MT128x016x64_PGR1_PLR1_TT04_04
    SolutionIndex: 13
    SolutionNameMin: Cijk_Ailk_Bljk_HBH_MT064x064x16_PGR1_PLR1_TT08_08
    SolutionIndex: 14
    SolutionNameMin: Cijk_Ailk_Bljk_HBH_MT032x032x08_PGR1_PLR1_TT04_04
    SolutionIndex: 15
    SolutionNameMin: Cijk_Ailk_Bljk_HBH_MT064x032x08_PGR1_PLR1_TT08_04
    SolutionIndex: 16
    SolutionNameMin: Cijk_Ailk_Bljk_HBH_MT064x064x08_PGR1_PLR1_TT08_08
    SolutionIndex: 17
    SolutionNameMin: Cijk_Ailk_Bljk_HBH_MT064x064x08_PGR1_PLR1_TT04_04
    SolutionIndex: 18
    SolutionNameMin: Cijk_Ailk_Bljk_HBH_MT128x064x08_PGR1_PLR1_TT08_04
    SolutionIndex: 19
    SolutionNameMin: Cijk_Ailk_Bljk_HBH_MT128x128x08_PGR1_PLR1_TT08_08
    SolutionIndex: 20
    SolutionNameMin: Cijk_Ailk_Bljk_HBH_MT128x032x08_PGR1_PLR1_TT04_04
    SolutionIndex: 21
    SolutionNameMin: Cijk_Ailk_Bljk_HBH_MT032x032x16_PGR1_PLR1_TT04_04
    SolutionIndex: 22
    SolutionNameMin: Cijk_Ailk_Bljk_HBH_MT064x032x16_PGR1_PLR1_TT08_04
    SolutionIndex: 23
    SolutionNameMin: Cijk_Ailk_Bljk_HBH_MT064x064x16_PGR1_PLR1_TT04_04
    SolutionIndex: 24
    SolutionNameMin: Cijk_Ailk_Bljk_HBH_MT128x064x16_PGR1_PLR1_TT08_04
    SolutionIndex: 25
    SolutionNameMin: Cijk_Ailk_Bljk_HBH_MT128x128x16_PGR1_PLR1_TT08_08
    SolutionIndex: 26
    SolutionNameMin: Cijk_Ailk_Bljk_HBH_MT064x032x16_PGR1_PLR1_TT04_04
    SolutionIndex: 27
    SolutionNameMin: Cijk_Ailk_Bljk_HBH_MT128x032x16_PGR1_PLR1_TT04_04
    SolutionIndex: 28
    SolutionNameMin: Cijk_Ailk_Bljk_HBH_MT064x016x16_PGR1_PLR1_TT04_04
    SolutionIndex: 29
    SolutionNameMin: Cijk_Ailk_Bljk_HBH_MT032x032x32_PGR1_PLR1_TT04_04
    SolutionIndex: 30
    SolutionNameMin: Cijk_Ailk_Bljk_HBH_MT128x064x32_PGR1_PLR1_TT08_04
    SolutionIndex: 31
    SolutionNameMin: Cijk_Ailk_Bljk_HBH_MT064x032x32_PGR1_PLR1_TT04_04
    SolutionIndex: 32
    SolutionNameMin: Cijk_Ailk_Bljk_HBH_MT128x032x32_PGR1_PLR1_TT04_04
    SolutionIndex: 33
    SolutionNameMin: Cijk_Ailk_Bljk_HBH_MT064x016x32_PGR1_PLR1_TT04_04
    SolutionIndex: 34
    SolutionNameMin: Cijk_Ailk_Bljk_HBH_MT128x016x64_PGR1_PLR1_TT04_04
    SolutionIndex: 35
    SolutionNameMin: Cijk_Ailk_Bljk_HBH_MT064x064x08_PGR1_PLR1_TT08_08
    SolutionIndex: 36
    SolutionNameMin: Cijk_Ailk_Bljk_HBH_MT064x064x16_PGR1_PLR1_TT08_08
    SolutionIndex: 37
    SolutionNameMin: Cijk_Ailk_Bljk_HBH_MT128x128x16_PGR1_PLR1_TT08_08
    SolutionIndex: 38
    SolutionNameMin: Cijk_Ailk_Bljk_HBH_MT128x128x32_PGR1_PLR1_TT08_08
    SolutionIndex: 39
    SolutionNameMin: Cijk_Ailk_Bljk_HBH_MT064x032x16_PGR0_PLR1_TT08_04
    SolutionIndex: 40
    SolutionNameMin: Cijk_Ailk_Bljk_HBH_MT064x064x32_PGR0_PLR1_TT08_08
    SolutionIndex: 41
    SolutionNameMin: Cijk_Ailk_Bljk_HBH_MT128x128x32_PGR0_PLR1_TT08_08
    SolutionIndex: 42
    SolutionNameMin: Cijk_Ailk_Bljk_HBH_MT064x128x16_PGR1_PLR1_TT04_08
    SolutionIndex: 43
    SolutionNameMin: Cijk_Ailk_Bljk_HBH_MT128x128x16_PGR1_PLR1_TT08_08
    SolutionIndex: 44
    SolutionNameMin: Cijk_Ailk_Bljk_HBH_MT128x064x16_PGR1_PLR1_TT04_08
    SolutionIndex: 45
    SolutionNameMin: Cijk_Ailk_Bljk_HBH_MT128x064x16_PGR1_PLR1_TT04_08
    SolutionIndex: 46
    SolutionNameMin: Cijk_Ailk_Bljk_HBH_MT128x064x32_PGR1_PLR1_TT04_04
    SolutionIndex: 47
    SolutionNameMin: Cijk_Ailk_Bljk_HBH_MT256x128x32_PGR1_PLR1_TT08_08
    SolutionIndex: 48
    SolutionNameMin: Cijk_Ailk_Bljk_HBH_MT064x128x16_PGR1_PLR0_TT04_08
    SolutionIndex: 49
    SolutionNameMin: Cijk_Ailk_Bljk_HBH_MT128x064x16_PGR1_PLR0_TT08_04
    SolutionIndex: 50
    SolutionNameMin: Cijk_Ailk_Bljk_HBH_MT128x032x16_PGR1_PLR0_TT04_04
    SolutionIndex: 51
    SolutionNameMin: Cijk_Ailk_Bljk_HBH_MT128x064x16_PGR1_PLR0_TT04_08
    SolutionIndex: 52
    SolutionNameMin: Cijk_Ailk_Bljk_HBH_MT256x032x16_PGR0_PLR0_TT08_04
    SolutionIndex: 53
    SolutionNameMin: Cijk_Ailk_Bljk_HBH_MT064x064x04_PGR0_PLR0_TT04_04
    SolutionIndex: 54
    SolutionNameMin: Cijk_Ailk_Bljk_HBH_MT064x064x04_PGR1_PLR0_TT04_04
    SolutionIndex: 55
    SolutionNameMin: Cijk_Ailk_Bljk_HBH_MT064x064x04_PGR0_PLR1_TT04_04
    SolutionIndex: 56
    SolutionNameMin: Cijk_Ailk_Bljk_HBH_MT064x064x04_PGR1_PLR1_TT04_04
    SolutionIndex: 57
    SolutionNameMin: Cijk_Ailk_Bljk_HBH_MT064x128x08_PGR0_PLR0_TT04_08
    SolutionIndex: 58
    SolutionNameMin: Cijk_Ailk_Bljk_HBH_MT064x064x08_PGR0_PLR0_TT04_04
    SolutionIndex: 59
    SolutionNameMin: Cijk_Ailk_Bljk_HBH_MT064x064x08_PGR1_PLR0_TT04_04
    SolutionIndex: 60
    SolutionNameMin: Cijk_Ailk_Bljk_HBH_MT064x064x08_PGR0_PLR1_TT04_04
    SolutionIndex: 61
    SolutionNameMin: Cijk_Ailk_Bljk_HBH_MT064x064x08_PGR1_PLR1_TT04_04
    SolutionIndex: 62
    SolutionNameMin: Cijk_Ailk_Bljk_HBH_MT064x064x16_PGR0_PLR0_TT04_04
    SolutionIndex: 63
    SolutionNameMin: Cijk_Ailk_Bljk_HBH_MT064x064x16_PGR1_PLR0_TT04_04
    SolutionIndex: 64
    SolutionNameMin: Cijk_Ailk_Bljk_HBH_MT064x064x16_PGR0_PLR1_TT04_04
    SolutionIndex: 65
    SolutionNameMin: Cijk_Ailk_Bljk_HBH_MT064x064x16_PGR1_PLR1_TT04_04
    SolutionIndex: 66
    SolutionNameMin: Cijk_Ailk_Bljk_HBH_MT064x128x04_PGR0_PLR0_TT04_08
    SolutionIndex: 67
    SolutionNameMin: Cijk_Ailk_Bljk_HBH_MT064x064x04_PGR0_PLR0_TT04_04
    SolutionIndex: 68
    SolutionNameMin: Cijk_Ailk_Bljk_HBH_MT064x128x04_PGR1_PLR0_TT04_08
    SolutionIndex: 69
    SolutionNameMin: Cijk_Ailk_Bljk_HBH_MT064x064x04_PGR1_PLR0_TT04_04
    SolutionIndex: 70
    SolutionNameMin: Cijk_Ailk_Bljk_HBH_MT128x128x04_PGR0_PLR1_TT08_08
    SolutionIndex: 71
    SolutionNameMin: Cijk_Ailk_Bljk_HBH_MT064x128x04_PGR0_PLR1_TT04_08
    SolutionIndex: 72
    SolutionNameMin: Cijk_Ailk_Bljk_HBH_MT064x064x04_PGR0_PLR1_TT04_04
    SolutionIndex: 73
    SolutionNameMin: Cijk_Ailk_Bljk_HBH_MT064x128x04_PGR1_PLR1_TT04_08
    SolutionIndex: 74
    SolutionNameMin: Cijk_Ailk_Bljk_HBH_MT064x064x04_PGR1_PLR1_TT04_04
    SolutionIndex: 75
    SolutionNameMin: Cijk_Ailk_Bljk_HBH_MT064x064x08_PGR0_PLR0_TT04_04
    SolutionIndex: 76
    SolutionNameMin: Cijk_Ailk_Bljk_HBH_MT064x064x08_PGR1_PLR0_TT04_04
    SolutionIndex: 77
    SolutionNameMin: Cijk_Ailk_Bljk_HBH_MT064x064x08_PGR0_PLR1_TT04_04
    SolutionIndex: 78
    SolutionNameMin: Cijk_Ailk_Bljk_HBH_MT064x064x08_PGR1_PLR1_TT04_04
    SolutionIndex: 79
    SolutionNameMin: Cijk_Ailk_Bljk_HBH_MT064x064x16_PGR1_PLR1_TT04_04
    SolutionIndex: 0
    SolutionNameMin: Cijk_Ailk_Bljk_HBH_MT128x064x16_DTL0_EPS1_GRVW02_LPB04_PGR1_PLR1_SNLL1_TT08_04_USFGRO01_VW04_WG16_16_01_WGM01
    SolutionIndex: 1
    SolutionNameMin: Cijk_Ailk_Bljk_HBH_MT128x064x16_DTL0_EPS1_GRVW02_LPB04_PGR1_PLR1_SNLL1_TT08_04_USFGRO01_VW04_WG16_16_01_WGM08
    SolutionIndex: 2
    SolutionNameMin: Cijk_Ailk_Bljk_HBH_MT064x128x32_DTL0_EPS0_GRVW02_LPB04_PGR0_PLR1_SNLL0_TT08_04_USFGRO01_VW04_WG08_32_01_WGM01
    SolutionIndex: 3
    SolutionNameMin: Cijk_Ailk_Bljk_HBH_MT064x064x32_DTL0_EPS0_GRVW02_LPB04_PGR0_PLR1_SNLL0_TT04_04_USFGRO01_VW04_WG16_16_01_WGM01
    SolutionIndex: 4
    SolutionNameMin: Cijk_Ailk_Bljk_HBH_MT064x064x32_DTL0_EPS0_GRVW02_LPB04_PGR0_PLR1_SNLL0_TT04_04_USFGRO01_VW04_WG16_16_01_WGM08
    SolutionIndex: 5
    SolutionNameMin: Cijk_Ailk_Bljk_HBH_MT256x064x16_DTL0_EPS1_GRVW04_LPB04_PGR1_PLR1_SNLL1_TT08_08_USFGRO0_VW04_WG32_08_01_WGM08
- - - [4096, 7000, 1, 4096]
    - [103, 16807.2]
  - - [5124, 9124, 1, 1760]
    - [85, 17213.3]
  - - [1760, 32, 1, 1760]
    - [99, 2024.58]
  - - [1024, 1500, 1, 1536]
    - [90, 14260.7]
  - - [512, 24000, 1, 2048]
    - [104, 15363.8]
  - - [3072, 24000, 1, 1024]
    - [103, 17692.5]
  - - [1024, 3000, 1, 2560]
    - [103, 16597.0]
  - - [512, 3136, 1, 2048]
    - [113, 12745.5]
  - - [7680, 4, 1, 2560]
    - [75, 1120.91]
  - - [64, 193600, 1, 64]
    - [102, 13449.6]
  - - [8448, 1500, 1, 2816]
    - [102, 16834.1]
  - - [2560, 7000, 1, 2560]
    - [102, 17300.9]
  - - [3072, 16, 1, 1024]
    - [68, 1668.82]
  - - [512, 48000, 1, 2048]
    - [104, 16039.8]
  - - [1760, 64, 1, 1760]
    - [70, 4164.84]
  - - [1024, 16, 1, 512]
    - [70, 442.437]
  - - [196, 256, 64, 1024]
    - [118, 10520.7]
  - - [512, 48000, 1, 1536]
    - [103, 17691.2]
  - - [2560, 32, 1, 2560]
    - [68, 3034.07]
  - - [4608, 1500, 1, 1536]
    - [103, 16553.6]
  - - [2048, 128, 1, 2048]
    - [98, 8430.76]
  - - [1024, 24000, 1, 2560]
    - [102, 17734.4]
  - - [4608, 3000, 1, 1536]
    - [103, 16918.7]
  - - [5124, 9124, 1, 2048]
    - [103, 16264.4]
  - - [2048, 16, 1, 2048]
    - [74, 1201.81]
  - - [1024, 700, 1, 512]
    - [89, 9305.31]
  - - [3072, 1, 1, 128]
    - [74, 52.2894]
  - - [5124, 700, 1, 2560]
    - [103, 14732.1]
  - - [8448, 16, 1, 2816]
    - [69, 4664.62]
  - - [6144, 6000, 1, 2560]
    - [104, 16232.7]
  - - [4608, 32, 1, 1536]
    - [87, 5055.63]
  - - [3072, 64, 1, 1024]
    - [87, 6355.01]
  - - [512, 16, 1, 512]
    - [100, 234.057]
  - - [7680, 2, 1, 2560]
    - [75, 559.818]
  - - [4224, 1, 1, 128]
    - [75, 71.8979]
  - - [7680, 1, 1, 2560]
    - [75, 279.909]
  - - [128, 1500, 1, 1280]
    - [87, 6508.47]
  - - [1024, 1500, 1, 2816]
    - [90, 14503.0]
  - - [6144, 2, 1, 2560]
    - [99, 449.904]
  - - [8448, 48000, 1, 2816]
    - [103, 15888.4]
  - - [512, 6000, 1, 2048]
    - [107, 12251.6]
  - - [4224, 1500, 1, 176]
    - [101, 14023.3]
  - - [1024, 6000, 1, 2816]
    - [102, 17627.3]
  - - [1024, 48000, 1, 1536]
    - [103, 18078.6]
  - - [1024, 48000, 1, 2560]
    - [103, 18159.7]
  - - [4096, 32, 1, 4096]
    - [99, 4887.75]
  - - [512, 16, 1, 500000]
    - [70, 330.797]
  - - [2560, 128, 1, 2560]
    - [92, 8651.62]
  - - [4608, 24000, 1, 1536]
    - [102, 18289.6]
  - - [512, 2, 1, 500000]
    - [70, 41.4055]
  - - [7680, 48000, 1, 2560]
    - [103, 15861.8]
  - - [3072, 48000, 1, 1024]
    - [103, 17963.4]
  - - [1760, 16, 1, 1760]
    - [70, 996.013]
  - - [1024, 1500, 1, 2048]
    - [96, 11148.7]
  - - [1024, 16, 1, 500000]
    - [70, 660.271]
  - - [64, 193600, 1, 256]
    - [108, 15721.4]
  - - [1024, 3000, 1, 2048]
    - [104, 13204.0]
  - - [6144, 4, 1, 2560]
    - [75, 898.779]
  - - [1024, 6000, 1, 2048]
    - [104, 14435.2]
  - - [512, 24000, 1, 2816]
    - [102, 17900.8]
  - - [6144, 48000, 1, 2560]
    - [103, 15014.0]
  - - [1760, 7000, 1, 1760]
    - [82, 16680.4]
  - - [8448, 3000, 1, 2816]
    - [102, 17619.4]
  - - [3072, 4, 1, 1024]
    - [68, 419.43]
  - - [4608, 48000, 1, 1536]
    - [102, 18011.9]
  - - [2048, 32, 1, 2048]
    - [75, 2396.75]
  - - [7680, 1500, 1, 2560]
    - [102, 16181.9]
  - - [4096, 128, 1, 4096]
    - [88, 11799.4]
  - - [4608, 16, 1, 1536]
    - [75, 2626.3]
  - - [512, 3000, 1, 1536]
    - [90, 14212.6]
  - - [3072, 2, 1, 1024]
    - [68, 208.603]
  - - [8448, 1, 1, 2816]
    - [69, 288.708]
  - - [1024, 3000, 1, 2816]
    - [102, 17047.8]
  - - [128, 1, 1, 1408]
    - [68, 4.74274]
  - - [64, 1, 1, 1216]
    - [70, 2.12402]
  - - [1024, 2, 1, 512]
    - [70, 55.3046]
  - - [1024, 4, 1, 500000]
    - [70, 165.068]
  - - [6144, 1, 1, 2560]
    - [75, 224.695]
  - - [5124, 9124, 1, 2560]
    - [104, 15812.4]
  - - [512, 48000, 1, 2816]
    - [102, 18093.7]
  - - [512, 3000, 1, 2816]
    - [90, 14503.0]
  - - [1024, 24000, 1, 1536]
    - [103, 17644.9]
  - - [7680, 6000, 1, 2560]
    - [102, 17621.4]
  - - [1760, 128, 1, 1760]
    - [68, 7636.61]
  - - [512, 1500, 1, 2816]
    - [89, 11254.6]
  - - [512, 1, 1, 512]
    - [78, 14.6942]
  - - [512, 6000, 1, 2560]
    - [103, 16681.5]
  - - [512, 8, 1, 500000]
    - [70, 165.531]
  - - [512, 24000, 1, 2560]
    - [103, 17549.6]
  - - [6144, 3000, 1, 2560]
    - [103, 17250.3]
  - - [1024, 24000, 1, 2816]
    - [102, 18141.5]
  - - [2048, 7000, 1, 2048]
    - [104, 15811.5]
  - - [7680, 3000, 1, 2560]
    - [91, 16174.8]
  - - [1024, 4, 1, 512]
    - [70, 110.609]
  - - [5124, 700, 1, 2048]
    - [104, 13227.0]
  - - [5124, 9124, 1, 4096]
    - [106, 14598.2]
  - - [4096, 64, 1, 4096]
    - [94, 8789.63]
  - - [256, 193600, 1, 64]
    - [79, 14438.9]
  - - [7680, 32, 1, 2560]
    - [77, 8438.11]
  - - [2560, 64, 1, 2560]
    - [87, 5871.09]
  - - [3072, 128, 1, 1024]
    - [92, 9460.84]
  - - [8448, 6000, 1, 2816]
    - [103, 17791.3]
  - - [7680, 64, 1, 2560]
    - [70, 11315.6]
  - - [5124, 1500, 1, 2560]
    - [103, 16114.3]
  - - [1024, 1500, 1, 2560]
    - [90, 14469.2]
  - - [512, 4, 1, 512]
    - [78, 58.7767]
  - - [1024, 6000, 1, 2560]
    - [103, 17148.5]
  - - [3072, 32, 1, 1024]
    - [75, 3311.29]
  - - [6144, 32, 1, 2560]
    - [68, 6860.91]
  - - [196, 1024, 64, 256]
    - [117, 12362.2]
  - - [512, 50176, 1, 128]
    - [109, 15858.1]
  - - [4608, 1, 1, 1536]
    - [75, 163.84]
  - - [1024, 32, 1, 512]
    - [70, 903.945]
  - - [7680, 24000, 1, 2560]
    - [103, 16884.4]
  - - [8448, 4, 1, 2816]
    - [75, 1158.21]
  - - [512, 1, 1, 500000]
    - [70, 20.6656]
  - - [176, 1500, 1, 1408]
    - [70, 6714.45]
  - - [512, 3000, 1, 2560]
    - [90, 14473.5]
  - - [8448, 24000, 1, 2816]
    - [103, 14521.7]
  - - [4608, 2, 1, 1536]
    - [75, 327.68]
  - - [512, 6000, 1, 1536]
    - [103, 16411.4]
  - - [7680, 128, 1, 2560]
    - [102, 14018.4]
  - - [3072, 6000, 1, 1024]
    - [103, 16634.7]
  - - [3072, 1500, 1, 128]
    - [102, 12889.5]
  - - [2048, 3136, 1, 512]
    - [111, 15712.6]
  - - [1024, 3000, 1, 1536]
    - [103, 16411.4]
  - - [512, 4, 1, 500000]
    - [70, 82.6607]
  - - [512, 6000, 1, 2816]
    - [102, 16765.0]
  - - [128, 50176, 1, 512]
    - [110, 15931.9]
  - - [256, 12544, 1, 1024]
    - [112, 13990.5]
  - - [1024, 12544, 1, 256]
    - [110, 16369.6]
  - - [512, 48000, 1, 2560]
    - [103, 17752.4]
  - - [2560, 16, 1, 2560]
    - [68, 1534.8]
  - - [2048, 64, 1, 2048]
    - [99, 4673.32]
  - - [512, 2, 1, 512]
    - [100, 29.2571]
  - - [1024, 1, 1, 512]
    - [70, 27.4209]
  - - [512, 1500, 1, 2560]
    - [89, 11065.3]
  - - [512, 24000, 1, 1536]
    - [103, 17460.8]
  - - [1024, 1, 1, 500000]
    - [70, 41.272]
  - - [6144, 16, 1, 2560]
    - [75, 3603.35]
  - - [1024, 24000, 1, 2048]
    - [104, 15981.1]
  - - [4096, 16, 1, 4096]
    - [76, 2492.9]
  - - [512, 32, 1, 512]
    - [98, 485.452]
  - - [5124, 1500, 1, 2048]
    - [104, 14336.0]
  - - [3072, 1500, 1, 1024]
    - [90, 14578.0]
  - - [1024, 2, 1, 500000]
    - [70, 82.5424]
  - - [1024, 8, 1, 500000]
    - [70, 330.331]
  - - [7680, 16, 1, 2560]
    - [75, 4483.65]
  - - [6144, 1500, 1, 2560]
    - [91, 16018.2]
  - - [3072, 1, 1, 1024]
    - [68, 105.138]
  - - [1024, 48000, 1, 2816]
    - [102, 18567.2]
  - - [8448, 2, 1, 2816]
    - [75, 577.417]
  - - [4608, 4, 1, 1536]
    - [75, 654.149]
  - - [1024, 6000, 1, 1536]
    - [103, 17084.0]
  - - [8448, 32, 1, 2816]
    - [92, 7192.61]
  - - [512, 3000, 1, 2048]
    - [104, 11129.8]
  - - [6144, 24000, 1, 2560]
    - [103, 16828.7]
  - - [4608, 6000, 1, 1536]
    - [103, 17675.9]
  - - [1024, 1024, 1, 1024]
    - [104, 13005.6]
  - - [512, 1500, 1, 2048]
    - [104, 9295.89]
  - - [512, 1500, 1, 1536]
    - [89, 10802.6]
  - - [128, 1, 1, 1024]
    - [68, 4.62825]
  - - [3072, 3000, 1, 1024]
    - [104, 15783.4]
  - - [1024, 48000, 1, 2048]
    - [103, 16639.0]
  - - [3136, 64, 128, 64]
    - [149, 14979.6]
  - - [784, 512, 64, 128]
    - [148, 15458.5]
  - - [3136, 256, 64, 64]
    - [148, 15446.9]
  - - [12544, 1024, 1, 256]
    - [146, 16777.2]
  - - [784, 128, 128, 512]
    - [148, 15975.2]
  - - [784, 512, 256, 128]
    - [148, 15958.1]
  - - [3136, 64, 64, 256]
    - [146, 16648.1]
  - - [3136, 512, 1, 2048]
    - [151, 12064.6]
  - - [12544, 256, 1, 1024]
    - [150, 14292.1]
  - - [3136, 2048, 1, 512]
    - [147, 16298.2]
  - - [3136, 256, 256, 64]
    - [148, 15753.2]
  - - [3136, 64, 128, 256]
    - [146, 16978.2]
  - - [784, 128, 64, 512]
    - [148, 15348.8]
  - - [3136, 64, 256, 64]
    - [149, 15308.8]
  - - [784, 512, 128, 128]
    - [148, 15772.9]
  - - [3136, 64, 64, 64]
    - [149, 14452.9]
  - - [784, 128, 256, 512]
    - [148, 16298.2]
  - - [3136, 64, 256, 256]
    - [146, 17164.3]
  - - [3136, 256, 128, 64]
    - [148, 15658.7]
- - - -1
    - - - 1
        - - - 32
            - - [32, 46]
              - [2944, 44]
              - [3584, 45]
              - [4288, 46]
              - [5056, 47]
              - [5888, 46]
              - [-1, 44]
          - - 64
            - - [256, 44]
              - [448, 45]
              - [1024, 44]
              - [1408, 47]
              - [2368, 44]
              - [2944, 46]
              - [3584, 47]
              - [-1, 46]
          - - 128
            - - [704, 44]
              - [3584, 46]
              - [4288, 47]
              - [5056, 46]
              - [-1, 45]
          - - 256
            - - [448, 44]
              - [1024, 47]
              - [1408, 46]
              - [2368, 44]
              - [2944, 45]
              - [3584, 46]
              - [4288, 45]
              - [5888, 46]
              - [-1, 44]
          - - 448
            - - [64, 44]
              - [128, 46]
              - [448, 44]
              - [1024, 46]
              - [1408, 45]
              - [1856, 44]
              - [2944, 45]
              - [-1, 44]
          - - 704
            - - [448, 44]
              - [704, 46]
              - [1024, 44]
              - [1408, 46]
              - [1856, 45]
              - [2368, 44]
              - [2944, 45]
              - [-1, 44]
          - - 1024
            - - [256, 44]
              - [448, 46]
              - [704, 44]
              - [1408, 46]
              - [2944, 44]
              - [3584, 45]
              - [4288, 44]
              - [-1, 45]
          - - 1408
            - - [128, 44]
              - [448, 46]
              - [1856, 44]
              - [2368, 45]
              - [2944, 44]
              - [5056, 45]
              - [5888, 44]
              - [-1, 45]
          - - 1856
            - - [128, 44]
              - [704, 46]
              - [1856, 44]
              - [2368, 46]
              - [-1, 44]
          - - 2368
            - - [32, 44]
              - [64, 47]
              - [256, 44]
              - [448, 46]
              - [1408, 44]
              - [1856, 46]
              - [5888, 44]
              - [-1, 46]
          - - 2944
            - - [32, 44]
              - [64, 47]
              - [128, 46]
              - [256, 44]
              - [448, 46]
              - [1024, 44]
              - [1408, 45]
              - [1856, 44]
              - [5888, 45]
              - [-1, 44]
          - - 3584
            - - [32, 46]
              - [64, 47]
              - [704, 44]
              - [3584, 45]
              - [4288, 44]
              - [-1, 45]
          - - 4288
            - - [32, 46]
              - [128, 44]
              - [256, 45]
              - [448, 44]
              - [1024, 46]
              - [-1, 44]
          - - 5056
            - - [64, 44]
              - [256, 45]
              - [-1, 44]
          - - 5888
            - - [32, 44]
              - [64, 46]
              - [128, 45]
              - [448, 44]
              - [704, 46]
              - [-1, 45]
          - - -1
            - - [32, 44]
              - [64, 46]
              - [-1, 45]
      - - 32
        - - - 32
            - - [256, 41]
              - [704, 42]
              - [1408, 41]
              - [1856, 42]
              - [2368, 41]
              - [2944, 42]
              - [4288, 43]
              - [-1, 41]
          - - 64
            - - [2944, 41]
              - [3584, 43]
              - [5056, 41]
              - [-1, 42]
          - - 128
            - - [64, 41]
              - [128, 42]
              - [1408, 41]
              - [1856, 42]
              - [2368, 43]
              - [2944, 42]
              - [5056, 41]
              - [-1, 42]
          - - 256
            - - [1408, 41]
              - [1856, 43]
              - [2368, 42]
              - [3584, 41]
              - [-1, 42]
          - - 448
            - - [256, 41]
              - [448, 42]
              - [704, 41]
              - [1024, 43]
              - [1408, 42]
              - [1856, 41]
              - [2368, 42]
              - [2944, 41]
              - [-1, 42]
          - - 704
            - - [64, 41]
              - [128, 42]
              - [256, 41]
              - [448, 43]
              - [704, 42]
              - [1024, 43]
              - [1408, 41]
              - [1856, 42]
              - [2368, 41]
              - [-1, 42]
          - - 1024
            - - [32, 41]
              - [64, 42]
              - [128, 41]
              - [256, 43]
              - [448, 41]
              - [1408, 42]
              - [1856, 41]
              - [5888, 42]
              - [-1, 41]
          - - 1408
            - - [448, 41]
              - [704, 42]
              - [1024, 41]
              - [-1, 42]
          - - 1856
            - - [128, 41]
              - [256, 43]
              - [448, 41]
              - [1856, 42]
              - [2368, 41]
              - [-1, 42]
          - - 2368
            - - [128, 41]
              - [-1, 42]
          - - 2944
            - - [64, 41]
              - [-1, 42]
          - - 3584
            - - [64, 42]
              - [128, 41]
              - [448, 42]
              - [704, 41]
              - [-1, 42]
          - - 5056
            - - [128, 41]
              - [-1, 42]
          - - 5888
            - - [32, 42]
              - [128, 41]
              - [-1, 42]
          - - -1
            - - [64, 41]
              - [-1, 42]
      - - 256
        - - - 1
            - - [704, 46]
              - [1024, 47]
              - [-1, 46]
          - - 32
            - - [2944, 41]
              - [-1, 43]
          - - 64
            - - [1, 46]
              - [32, 41]
              - [128, 0]
              - [256, 4]
              - [1024, 0]
              - [1408, 14]
              - [1856, 2]
              - [2368, 6]
              - [2944, 7]
              - [5056, 2]
              - [5888, 10]
              - [-1, 13]
          - - 128
            - - [1, 46]
              - [32, 41]
              - [64, 2]
              - [448, 5]
              - [1408, 7]
              - [1856, 15]
              - [2368, 7]
              - [2944, 10]
              - [3584, 3]
              - [4288, 2]
              - [-1, 3]
          - - 256
            - - [1, 46]
              - [32, 41]
              - [64, 0]
              - [256, 5]
              - [448, 11]
              - [2944, 22]
              - [3584, 24]
              - [5056, 22]
              - [5888, 24]
              - [-1, 22]
          - - 448
            - - [1, 46]
              - [32, 41]
              - [64, 0]
              - [128, 5]
              - [256, 2]
              - [448, 15]
              - [5888, 22]
              - [-1, 23]
          - - 704
            - - [1, 46]
              - [32, 41]
              - [64, 0]
              - [128, 7]
              - [2944, 22]
              - [3584, 23]
              - [4288, 22]
              - [5888, 23]
              - [-1, 22]
          - - 1024
            - - [1, 46]
              - [32, 41]
              - [128, 5]
              - [704, 22]
              - [3584, 24]
              - [4288, 22]
              - [5056, 24]
              - [-1, 22]
          - - 1408
            - - [1, 46]
              - [32, 41]
              - [64, 2]
              - [128, 7]
              - [448, 22]
              - [1856, 24]
              - [2368, 22]
              - [5888, 24]
              - [-1, 21]
          - - 1856
            - - [1, 46]
              - [32, 41]
              - [64, 2]
              - [128, 15]
              - [704, 22]
              - [1024, 9]
              - [1408, 23]
              - [1856, 24]
              - [2944, 22]
              - [3584, 23]
              - [4288, 21]
              - [5056, 9]
              - [5888, 23]
              - [-1, 24]
          - - 2368
            - - [1, 46]
              - [32, 41]
              - [64, 2]
              - [128, 7]
              - [704, 22]
              - [1024, 24]
              - [1856, 22]
              - [2368, 24]
              - [3584, 22]
              - [4288, 21]
              - [5056, 9]
              - [-1, 23]
          - - 2944
            - - [1, 46]
              - [32, 41]
              - [64, 7]
              - [128, 10]
              - [256, 22]
              - [1408, 24]
              - [2368, 22]
              - [-1, 24]
          - - 3584
            - - [1, 46]
              - [32, 41]
              - [64, 15]
              - [128, 3]
              - [256, 24]
              - [448, 22]
              - [1856, 24]
              - [2368, 22]
              - [-1, 24]
          - - 4288
            - - [1, 46]
              - [32, 43]
              - [64, 11]
              - [128, 2]
              - [256, 22]
              - [704, 24]
              - [1024, 22]
              - [1408, 24]
              - [2368, 22]
              - [5888, 24]
              - [-1, 23]
          - - 5056
            - - [1, 46]
              - [32, 43]
              - [64, 2]
              - [128, 3]
              - [448, 22]
              - [1408, 24]
              - [2368, 9]
              - [4288, 24]
              - [5056, 9]
              - [-1, 23]
          - - 5888
            - - [1, 46]
              - [32, 43]
              - [64, 10]
              - [128, 12]
              - [256, 24]
              - [448, 22]
              - [704, 24]
              - [1024, 22]
              - [-1, 24]
          - - -1
            - - [1, 46]
              - [32, 43]
              - [128, 3]
              - [256, 22]
              - [448, 24]
              - [1408, 22]
              - [-1, 24]
      - - 1280
        - - - 1
            - - [32, 46]
              - [3584, 47]
              - [-1, 46]
          - - 32
            - - [-1, 43]
          - - 64
            - - [1, 46]
              - [32, 43]
              - [64, 7]
              - [128, 2]
              - [256, 5]
              - [448, 8]
              - [1024, 5]
              - [1856, 6]
              - [2368, 2]
              - [2944, 7]
              - [3584, 10]
              - [4288, 2]
              - [5056, 7]
              - [5888, 10]
              - [-1, 22]
          - - 128
            - - [1, 46]
              - [32, 43]
              - [64, 2]
              - [128, 5]
              - [256, 16]
              - [448, 5]
              - [704, 6]
              - [1408, 7]
              - [1856, 15]
              - [2368, 7]
              - [2944, 10]
              - [3584, 3]
              - [4288, 10]
              - [5056, 12]
              - [5888, 3]
              - [-1, 24]
          - - 256
            - - [1, 46]
              - [32, 43]
              - [64, 8]
              - [256, 5]
              - [448, 7]
              - [2944, 22]
              - [3584, 24]
              - [5056, 22]
              - [5888, 24]
              - [-1, 22]
          - - 448
            - - [1, 46]
              - [32, 43]
              - [64, 8]
              - [128, 5]
              - [256, 17]
              - [448, 15]
              - [1408, 22]
              - [1856, 24]
              - [2368, 22]
              - [2944, 24]
              - [-1, 22]
          - - 704
            - - [1, 46]
              - [32, 43]
              - [64, 5]
              - [128, 6]
              - [-1, 22]
          - - 1024
            - - [1, 46]
              - [32, 43]
              - [64, 5]
              - [128, 7]
              - [704, 22]
              - [3584, 24]
              - [4288, 22]
              - [5056, 24]
              - [-1, 22]
          - - 1408
            - - [1, 46]
              - [32, 43]
              - [64, 6]
              - [128, 14]
              - [448, 22]
              - [1856, 24]
              - [2368, 22]
              - [5888, 24]
              - [-1, 22]
          - - 1856
            - - [1, 46]
              - [32, 43]
              - [64, 7]
              - [128, 15]
              - [256, 22]
              - [448, 24]
              - [704, 22]
              - [1024, 24]
              - [1408, 22]
              - [1856, 24]
              - [2944, 22]
              - [3584, 23]
              - [4288, 22]
              - [5056, 9]
              - [5888, 23]
              - [-1, 22]
          - - 2368
            - - [1, 46]
              - [32, 43]
              - [64, 2]
              - [128, 7]
              - [704, 22]
              - [1024, 24]
              - [1856, 22]
              - [2368, 24]
              - [5056, 22]
              - [5888, 9]
              - [-1, 23]
          - - 2944
            - - [1, 46]
              - [32, 43]
              - [64, 7]
              - [128, 10]
              - [256, 22]
              - [1408, 24]
              - [1856, 22]
              - [3584, 24]
              - [4288, 22]
              - [5888, 24]
              - [-1, 23]
          - - 3584
            - - [1, 47]
              - [32, 43]
              - [64, 15]
              - [128, 3]
              - [256, 24]
              - [448, 22]
              - [1024, 24]
              - [1408, 19]
              - [1856, 24]
              - [2368, 22]
              - [2944, 18]
              - [4288, 22]
              - [5056, 18]
              - [5888, 24]
              - [-1, 23]
          - - 4288
            - - [1, 46]
              - [32, 43]
              - [64, 2]
              - [128, 10]
              - [256, 22]
              - [704, 24]
              - [1024, 22]
              - [1408, 24]
              - [1856, 22]
              - [2368, 24]
              - [3584, 22]
              - [5888, 24]
              - [-1, 21]
          - - 5056
            - - [1, 46]
              - [32, 43]
              - [64, 7]
              - [128, 3]
              - [448, 22]
              - [1408, 24]
              - [1856, 22]
              - [2368, 9]
              - [2944, 23]
              - [4288, 24]
              - [5056, 21]
              - [-1, 23]
          - - 5888
            - - [1, 46]
              - [32, 43]
              - [64, 10]
              - [128, 3]
              - [256, 24]
              - [448, 22]
              - [704, 19]
              - [1024, 24]
              - [1408, 9]
              - [1856, 22]
              - [2368, 19]
              - [2944, 18]
              - [3584, 24]
              - [5056, 19]
              - [5888, 22]
              - [-1, 24]
          - - -1
            - - [1, 46]
              - [32, 43]
              - [128, 3]
              - [256, 22]
              - [448, 24]
              - [1856, 22]
              - [2368, 24]
              - [2944, 22]
              - [3584, 24]
              - [5056, 22]
              - [5888, 24]
              - [-1, 23]
      - - -1
        - - - 1
            - - [3584, 47]
              - [-1, 46]
          - - 32
            - - [-1, 43]
          - - 64
            - - [1, 47]
              - [32, 43]
              - [128, 5]
              - [448, 8]
              - [704, 16]
              - [1024, 5]
              - [1408, 6]
              - [1856, 7]
              - [2368, 2]
              - [2944, 7]
              - [3584, 2]
              - [4288, 11]
              - [5888, 7]
              - [-1, 22]
          - - 128
            - - [1, 47]
              - [32, 43]
              - [64, 5]
              - [128, 8]
              - [448, 5]
              - [704, 6]
              - [1408, 7]
              - [1856, 15]
              - [2368, 7]
              - [2944, 10]
              - [3584, 22]
              - [4288, 14]
              - [5056, 12]
              - [5888, 3]
              - [-1, 24]
          - - 256
            - - [1, 47]
              - [32, 43]
              - [64, 8]
              - [256, 5]
              - [448, 7]
              - [2944, 22]
              - [3584, 24]
              - [5056, 22]
              - [5888, 24]
              - [-1, 22]
          - - 448
            - - [1, 47]
              - [32, 43]
              - [128, 5]
              - [256, 14]
              - [448, 15]
              - [1408, 22]
              - [1856, 24]
              - [2368, 22]
              - [2944, 24]
              - [-1, 22]
          - - 704
            - - [1, 46]
              - [32, 43]
              - [64, 16]
              - [128, 6]
              - [-1, 22]
          - - 1024
            - - [1, 46]
              - [32, 43]
              - [64, 5]
              - [128, 14]
              - [704, 22]
              - [3584, 24]
              - [4288, 22]
              - [5056, 24]
              - [-1, 22]
          - - 1408
            - - [1, 47]
              - [32, 43]
              - [64, 6]
              - [128, 7]
              - [448, 22]
              - [1856, 24]
              - [2368, 22]
              - [5888, 24]
              - [-1, 22]
          - - 1856
            - - [1, 47]
              - [32, 43]
              - [64, 14]
              - [128, 15]
              - [256, 22]
              - [448, 24]
              - [704, 22]
              - [1024, 24]
              - [1408, 22]
              - [1856, 24]
              - [5056, 22]
              - [5888, 23]
              - [-1, 19]
          - - 2368
            - - [1, 47]
              - [32, 43]
              - [64, 2]
              - [128, 7]
              - [704, 22]
              - [1024, 24]
              - [1856, 22]
              - [2368, 19]
              - [3584, 22]
              - [4288, 18]
              - [5888, 22]
              - [-1, 23]
          - - 2944
            - - [1, 47]
              - [32, 43]
              - [64, 7]
              - [128, 10]
              - [256, 22]
              - [1024, 24]
              - [1408, 9]
              - [2368, 22]
              - [2944, 23]
              - [3584, 22]
              - [4288, 24]
              - [5056, 22]
              - [5888, 23]
              - [-1, 24]
          - - 3584
            - - [1, 47]
              - [32, 43]
              - [64, 15]
              - [128, 3]
              - [256, 24]
              - [448, 22]
              - [704, 24]
              - [1024, 9]
              - [1856, 19]
              - [2368, 24]
              - [2944, 22]
              - [4288, 21]
              - [5888, 19]
              - [-1, 22]
          - - 4288
            - - [1, 46]
              - [32, 43]
              - [64, 11]
              - [128, 10]
              - [256, 22]
              - [448, 19]
              - [704, 22]
              - [1408, 24]
              - [1856, 18]
              - [2944, 22]
              - [3584, 21]
              - [4288, 24]
              - [5056, 9]
              - [5888, 24]
              - [-1, 18]
          - - 5056
            - - [1, 46]
              - [32, 43]
              - [64, 14]
              - [128, 3]
              - [1024, 22]
              - [1408, 19]
              - [2368, 22]
              - [3584, 24]
              - [4288, 22]
              - [5056, 20]
              - [5888, 18]
              - [-1, 21]
          - - 5888
            - - [1, 46]
              - [32, 43]
              - [64, 10]
              - [128, 3]
              - [256, 24]
              - [448, 22]
              - [704, 24]
              - [1024, 19]
              - [1856, 23]
              - [2368, 19]
              - [2944, 24]
              - [4288, 18]
              - [-1, 24]
          - - -1
            - - [1, 46]
              - [32, 43]
              - [128, 3]
              - [256, 22]
              - [448, 24]
              - [1856, 22]
              - [2368, 24]
              - [2944, 22]
              - [4288, 21]
              - [5056, 22]
              - [5888, 21]
              - [-1, 24]
