library/src/blas3/Tensile/Logic/asm_full/vega20_Cijk_Ailk_Bjlk_DB.yaml
- {MinimumRequiredVersion: 4.8.1}
- vega20
- gfx906
- [Device 66a0, Device 66a1, Device 66a7, Vega 20]
    SolutionIndex: 0
    SolutionNameMin: Cijk_Ailk_Bjlk_DB_MT064x064x08_PLR1_TT04_04_WG16_16_01
    SolutionIndex: 1
    SolutionNameMin: Cijk_Ailk_Bjlk_DB_MT064x064x04_PLR1_TT04_04_WG16_16_01
    SolutionIndex: 4
    SolutionNameMin: Cijk_Ailk_Bjlk_DB_MT064x048x04_PLR0_TT04_06_WG16_08_01
    SolutionIndex: 5
    SolutionNameMin: Cijk_Ailk_Bjlk_DB_MT064x048x04_PLR0_TT04_06_WG16_08_01
    SolutionIndex: 8
    SolutionNameMin: Cijk_Ailk_Bjlk_DB_MT064x048x04_PLR0_TT04_06_WG16_08_01
    SolutionIndex: 9
    SolutionNameMin: Cijk_Ailk_Bjlk_DB_MT064x048x04_PLR0_TT04_06_WG16_08_01
    SolutionIndex: 10
    SolutionNameMin: Cijk_Ailk_Bjlk_DB_MT064x064x04_PLR1_TT04_08_WG16_08_01
    SolutionIndex: 11
    SolutionNameMin: Cijk_Ailk_Bjlk_DB_MT064x064x04_PLR1_TT04_08_WG16_08_01
    SolutionIndex: 12
    SolutionNameMin: Cijk_Ailk_Bjlk_DB_MT064x064x04_PLR1_TT04_08_WG16_08_01
    SolutionIndex: 14
    SolutionNameMin: Cijk_Ailk_Bjlk_DB_MT048x064x04_PLR0_TT06_04_WG08_16_01
    SolutionIndex: 15
    SolutionNameMin: Cijk_Ailk_Bjlk_DB_MT064x064x04_PLR1_TT08_04_WG08_16_01
    SolutionIndex: 16
    SolutionNameMin: Cijk_Ailk_Bjlk_DB_MT096x064x04_PLR0_TT06_04_WG16_16_01
    SolutionIndex: 17
    SolutionNameMin: Cijk_Ailk_Bjlk_DB_MT096x096x04_PLR0_TT06_06_WG16_16_01
    SolutionIndex: 18
    SolutionNameMin: Cijk_Ailk_Bjlk_DB_MT064x128x04_PLR1_TT04_08_WG16_16_01
    SolutionIndex: 24
    SolutionNameMin: Cijk_Ailk_Bjlk_DB_MT064x064x08_PLR1_TT04_04_WG16_16_01
    SolutionIndex: 25
    SolutionNameMin: Cijk_Ailk_Bjlk_DB_MT064x064x08_PLR0_TT04_04_WG16_16_01
    SolutionIndex: 29
    SolutionNameMin: Cijk_Ailk_Bjlk_DB_MT064x064x08_PLR0_TT04_04_WG16_16_01
    SolutionIndex: 30
    SolutionNameMin: Cijk_Ailk_Bjlk_DB_MT064x032x04_PLR0_TT04_04_WG16_08_01
    SolutionIndex: 31
    SolutionNameMin: Cijk_Ailk_Bjlk_DB_MT096x032x04_PLR1_TT06_04_WG16_08_01
    SolutionIndex: 32
    SolutionNameMin: Cijk_Ailk_Bjlk_DB_MT064x048x04_PLR1_TT04_06_WG16_08_01
    SolutionIndex: 33
    SolutionNameMin: Cijk_Ailk_Bjlk_DB_MT032x064x04_PLR0_TT04_04_WG08_16_01
    SolutionIndex: 34
    SolutionNameMin: Cijk_Ailk_Bjlk_DB_MT048x064x04_PLR0_TT06_04_WG08_16_01
    SolutionIndex: 35
    SolutionNameMin: Cijk_Ailk_Bjlk_DB_MT096x064x04_PLR0_TT06_04_WG16_16_01
    SolutionIndex: 36
    SolutionNameMin: Cijk_Ailk_Bjlk_DB_MT064x032x08_PLR1_TT04_04_WG16_08_01
    SolutionIndex: 37
    SolutionNameMin: Cijk_Ailk_Bjlk_DB_MT064x064x08_PLR1_TT04_04_WG16_16_01
    SolutionIndex: 38
    SolutionNameMin: Cijk_Ailk_Bjlk_DB_MT064x064x08_PLR0_TT04_04_WG16_16_01
    SolutionIndex: 39
    SolutionNameMin: Cijk_Ailk_Bjlk_DB_MT064x032x12_PLR1_TT04_04_WG16_08_01
    SolutionIndex: 42
    SolutionNameMin: Cijk_Ailk_Bjlk_DB_MT064x032x04_PK00_PLR0_SNLL0_TT04_04_WG16_08_01_WGM01
    SolutionIndex: 43
    SolutionNameMin: Cijk_Ailk_Bjlk_DB_MT064x048x04_PK00_PLR0_SNLL1_TT04_06_WG16_08_01_WGM01
    SolutionIndex: 44
    SolutionNameMin: Cijk_Ailk_Bjlk_DB_MT064x048x04_PK00_PLR0_SNLL0_TT04_06_WG16_08_01_WGM01
    SolutionIndex: 45
    SolutionNameMin: Cijk_Ailk_Bjlk_DB_MT064x064x04_PK00_PLR1_SNLL1_TT04_08_WG16_08_01_WGM01
    SolutionIndex: 50
    SolutionNameMin: Cijk_Ailk_Bjlk_DB_MT064x032x04_PK00_PLR0_SNLL0_TT04_04_WG16_08_01_WGM08
    SolutionIndex: 52
    SolutionNameMin: Cijk_Ailk_Bjlk_DB_MT096x032x04_PK04_PLR1_SNLL1_TT06_04_WG16_08_01_WGM08
    SolutionIndex: 53
    SolutionNameMin: Cijk_Ailk_Bjlk_DB_MT064x048x04_PK00_PLR0_SNLL1_TT04_06_WG16_08_01_WGM08
    SolutionIndex: 54
    SolutionNameMin: Cijk_Ailk_Bjlk_DB_MT064x048x04_PK00_PLR0_SNLL0_TT04_06_WG16_08_01_WGM08
    SolutionIndex: 57
    SolutionNameMin: Cijk_Ailk_Bjlk_DB_MT048x064x04_PK00_PLR0_SNLL1_TT06_04_WG08_16_01_WGM08
    SolutionIndex: 58
    SolutionNameMin: Cijk_Ailk_Bjlk_DB_MT048x064x04_PK00_PLR0_SNLL0_TT06_04_WG08_16_01_WGM08
    SolutionIndex: 59
    SolutionNameMin: Cijk_Ailk_Bjlk_DB_MT096x064x04_PK00_PLR0_SNLL1_TT06_04_WG16_16_01_WGM08
    SolutionIndex: 63
    SolutionNameMin: Cijk_Ailk_Bjlk_DB_MT064x032x08_PK00_PLR1_SNLL0_TT04_04_WG16_08_01_WGM01
    SolutionIndex: 64
    SolutionNameMin: Cijk_Ailk_Bjlk_DB_MT096x032x08_PK04_PLR1_SNLL1_TT06_04_WG16_08_01_WGM01
    SolutionIndex: 65
    SolutionNameMin: Cijk_Ailk_Bjlk_DB_MT096x032x08_PK04_PLR1_SNLL0_TT06_04_WG16_08_01_WGM01
    SolutionIndex: 67
    SolutionNameMin: Cijk_Ailk_Bjlk_DB_MT064x064x08_PK00_PLR1_SNLL1_TT04_04_WG16_16_01_WGM01
    SolutionIndex: 70
    SolutionNameMin: Cijk_Ailk_Bjlk_DB_MT064x064x08_PK00_PLR1_SNLL0_TT04_04_WG16_16_01_WGM01
    SolutionIndex: 72
    SolutionNameMin: Cijk_Ailk_Bjlk_DB_MT064x064x08_PK04_PLR1_SNLL0_TT04_04_WG16_16_01_WGM01
    SolutionIndex: 73
    SolutionNameMin: Cijk_Ailk_Bjlk_DB_MT064x064x08_PK04_PLR0_SNLL0_TT04_04_WG16_16_01_WGM01
    SolutionIndex: 74
    SolutionNameMin: Cijk_Ailk_Bjlk_DB_MT096x064x08_PK02_PLR1_SNLL0_TT06_04_WG16_16_01_WGM01
    SolutionIndex: 77
    SolutionNameMin: Cijk_Ailk_Bjlk_DB_MT096x032x08_PK04_PLR1_SNLL1_TT06_04_WG16_08_01_WGM08
    SolutionIndex: 78
    SolutionNameMin: Cijk_Ailk_Bjlk_DB_MT096x048x08_PK00_PLR1_SNLL1_TT06_06_WG16_08_01_WGM08
    SolutionIndex: 79
    SolutionNameMin: Cijk_Ailk_Bjlk_DB_MT064x064x08_PK00_PLR1_SNLL1_TT04_04_WG16_16_01_WGM08
    SolutionIndex: 82
    SolutionNameMin: Cijk_Ailk_Bjlk_DB_MT064x064x08_PK00_PLR1_SNLL0_TT04_04_WG16_16_01_WGM08
    SolutionIndex: 86
    SolutionNameMin: Cijk_Ailk_Bjlk_DB_MT096x064x08_PK02_PLR1_SNLL0_TT06_04_WG16_16_01_WGM08
    SolutionIndex: 93
    SolutionNameMin: Cijk_Ailk_Bjlk_DB_MT64x32x4_SE_PLR0_SNLL0_TT4_4_WG16_8_1_WGM1
    SolutionIndex: 94
    SolutionNameMin: Cijk_Ailk_Bjlk_DB_MT64x48x4_SE_PLR1_SNLL0_TT4_6_WG16_8_1_WGM1
    SolutionIndex: 95
    SolutionNameMin: Cijk_Ailk_Bjlk_DB_MT64x48x4_SE_PLR0_SNLL0_TT4_6_WG16_8_1_WGM1
    SolutionIndex: 96
    SolutionNameMin: Cijk_Ailk_Bjlk_DB_MT128x32x4_SE_PLR0_SNLL0_TT8_4_WG16_8_1_WGM1
    SolutionIndex: 98
    SolutionNameMin: Cijk_Ailk_Bjlk_DB_MT64x64x4_SE_PLR1_SNLL0_TT4_8_WG16_8_1_WGM1
    SolutionIndex: 99
    SolutionNameMin: Cijk_Ailk_Bjlk_DB_MT64x96x4_SE_PLR0_SNLL0_TT4_6_WG16_16_1_WGM1
    SolutionIndex: 100
    SolutionNameMin: Cijk_Ailk_Bjlk_DB_MT128x64x4_SE_PLR1_SNLL0_TT8_4_WG16_16_1_WGM1
    SolutionIndex: 101
    SolutionNameMin: Cijk_Ailk_Bjlk_DB_MT64x128x4_SE_PLR1_SNLL1_TT4_8_WG16_16_1_WGM1
    SolutionIndex: 104
    SolutionNameMin: Cijk_Ailk_Bjlk_DB_MT64x48x4_SE_PLR0_SNLL1_TT4_6_WG16_8_1_WGM4
    SolutionIndex: 105
    SolutionNameMin: Cijk_Ailk_Bjlk_DB_MT64x48x4_SE_PLR0_SNLL0_TT4_6_WG16_8_1_WGM4
    SolutionIndex: 106
    SolutionNameMin: Cijk_Ailk_Bjlk_DB_MT128x32x4_SE_PLR0_SNLL1_TT8_4_WG16_8_1_WGM4
    SolutionIndex: 108
    SolutionNameMin: Cijk_Ailk_Bjlk_DB_MT48x64x4_SE_PLR0_SNLL0_TT6_4_WG8_16_1_WGM4
    SolutionIndex: 109
    SolutionNameMin: Cijk_Ailk_Bjlk_DB_MT64x32x4_SE_PLR0_SNLL0_TT4_4_WG16_8_1_WGM8
    SolutionIndex: 110
    SolutionNameMin: Cijk_Ailk_Bjlk_DB_MT64x48x4_SE_PLR0_SNLL1_TT4_6_WG16_8_1_WGM8
    SolutionIndex: 111
    SolutionNameMin: Cijk_Ailk_Bjlk_DB_MT64x48x4_SE_PLR0_SNLL0_TT4_6_WG16_8_1_WGM8
    SolutionIndex: 114
    SolutionNameMin: Cijk_Ailk_Bjlk_DB_MT48x64x4_SE_PLR0_SNLL0_TT6_4_WG8_16_1_WGM8
    SolutionIndex: 115
    SolutionNameMin: Cijk_Ailk_Bjlk_DB_MT64x96x4_SE_PLR0_SNLL0_TT4_6_WG16_16_1_WGM8
    SolutionIndex: 116
    SolutionNameMin: Cijk_Ailk_Bjlk_DB_MT64x32x8_SE_PLR1_SNLL1_TT4_4_WG16_8_1_WGM1
    SolutionIndex: 117
    SolutionNameMin: Cijk_Ailk_Bjlk_DB_MT64x32x8_SE_PLR1_SNLL0_TT4_4_WG16_8_1_WGM1
    SolutionIndex: 118
    SolutionNameMin: Cijk_Ailk_Bjlk_DB_MT64x64x8_SE_PLR1_SNLL1_TT4_4_WG16_16_1_WGM1
    SolutionIndex: 119
    SolutionNameMin: Cijk_Ailk_Bjlk_DB_MT64x64x8_SE_PLR0_SNLL1_TT4_4_WG16_16_1_WGM1
    SolutionIndex: 120
    SolutionNameMin: Cijk_Ailk_Bjlk_DB_MT64x64x8_SE_PLR1_SNLL0_TT4_4_WG16_16_1_WGM1
    SolutionIndex: 121
    SolutionNameMin: Cijk_Ailk_Bjlk_DB_MT64x64x8_SE_PLR0_SNLL0_TT4_4_WG16_16_1_WGM1
    SolutionIndex: 123
    SolutionNameMin: Cijk_Ailk_Bjlk_DB_MT96x32x8_SE_PLR1_SNLL1_TT6_4_WG16_8_1_WGM4
    SolutionIndex: 126
    SolutionNameMin: Cijk_Ailk_Bjlk_DB_MT64x64x8_SE_PLR0_SNLL0_TT4_4_WG16_16_1_WGM4
    SolutionIndex: 127
    SolutionNameMin: Cijk_Ailk_Bjlk_DB_MT64x32x8_SE_PLR1_SNLL0_TT4_4_WG16_8_1_WGM8
    SolutionIndex: 129
    SolutionNameMin: Cijk_Ailk_Bjlk_DB_MT64x64x8_SE_PLR0_SNLL1_TT4_4_WG16_16_1_WGM8
    SolutionIndex: 131
    SolutionNameMin: Cijk_Ailk_Bjlk_DB_MT64x64x8_SE_PLR0_SNLL0_TT4_4_WG16_16_1_WGM8
    SolutionIndex: 134
    SolutionNameMin: Cijk_Ailk_Bjlk_DB_MT64x32x4_SE_PLR1_SNLL1_TT4_4_WG16_8_1_WGM1
    SolutionIndex: 135
    SolutionNameMin: Cijk_Ailk_Bjlk_DB_MT64x32x4_SE_PLR0_SNLL1_TT4_4_WG16_8_1_WGM1
    SolutionIndex: 136
    SolutionNameMin: Cijk_Ailk_Bjlk_DB_MT64x32x4_SE_PLR1_SNLL0_TT4_4_WG16_8_1_WGM1
    SolutionIndex: 137
    SolutionNameMin: Cijk_Ailk_Bjlk_DB_MT64x32x4_SE_PLR0_SNLL0_TT4_4_WG16_8_1_WGM1
    SolutionIndex: 138
    SolutionNameMin: Cijk_Ailk_Bjlk_DB_MT96x32x4_SE_PLR1_SNLL1_TT6_4_WG16_8_1_WGM1
    SolutionIndex: 139
    SolutionNameMin: Cijk_Ailk_Bjlk_DB_MT96x32x4_SE_PLR1_SNLL0_TT6_4_WG16_8_1_WGM1
    SolutionIndex: 140
    SolutionNameMin: Cijk_Ailk_Bjlk_DB_MT64x64x4_SE_PLR1_SNLL1_TT4_8_WG16_8_1_WGM1
    SolutionIndex: 144
    SolutionNameMin: Cijk_Ailk_Bjlk_DB_MT48x64x4_SE_PLR0_SNLL0_TT6_4_WG8_16_1_WGM1
    SolutionIndex: 145
    SolutionNameMin: Cijk_Ailk_Bjlk_DB_MT96x64x4_SE_PLR0_SNLL1_TT6_4_WG16_16_1_WGM1
    SolutionIndex: 146
    SolutionNameMin: Cijk_Ailk_Bjlk_DB_MT96x64x4_SE_PLR0_SNLL0_TT6_4_WG16_16_1_WGM1
    SolutionIndex: 147
    SolutionNameMin: Cijk_Ailk_Bjlk_DB_MT128x64x4_SE_PLR1_SNLL1_TT8_4_WG16_16_1_WGM1
    SolutionIndex: 148
    SolutionNameMin: Cijk_Ailk_Bjlk_DB_MT128x64x4_SE_PLR1_SNLL0_TT8_4_WG16_16_1_WGM1
    SolutionIndex: 149
    SolutionNameMin: Cijk_Ailk_Bjlk_DB_MT64x128x4_SE_PLR1_SNLL1_TT4_8_WG16_16_1_WGM1
    SolutionIndex: 150
    SolutionNameMin: Cijk_Ailk_Bjlk_DB_MT64x128x4_SE_PLR1_SNLL0_TT4_8_WG16_16_1_WGM1
    SolutionIndex: 152
    SolutionNameMin: Cijk_Ailk_Bjlk_DB_MT64x32x4_SE_PLR0_SNLL1_TT4_4_WG16_8_1_WGM4
    SolutionIndex: 154
    SolutionNameMin: Cijk_Ailk_Bjlk_DB_MT64x32x4_SE_PLR0_SNLL0_TT4_4_WG16_8_1_WGM4
    SolutionIndex: 155
    SolutionNameMin: Cijk_Ailk_Bjlk_DB_MT96x32x4_SE_PLR1_SNLL1_TT6_4_WG16_8_1_WGM4
    SolutionIndex: 156
    SolutionNameMin: Cijk_Ailk_Bjlk_DB_MT96x32x4_SE_PLR1_SNLL0_TT6_4_WG16_8_1_WGM4
    SolutionIndex: 160
    SolutionNameMin: Cijk_Ailk_Bjlk_DB_MT48x64x4_SE_PLR0_SNLL1_TT6_4_WG8_16_1_WGM4
    SolutionIndex: 161
    SolutionNameMin: Cijk_Ailk_Bjlk_DB_MT48x64x4_SE_PLR0_SNLL0_TT6_4_WG8_16_1_WGM4
    SolutionIndex: 162
    SolutionNameMin: Cijk_Ailk_Bjlk_DB_MT96x64x4_SE_PLR0_SNLL1_TT6_4_WG16_16_1_WGM4
    SolutionIndex: 163
    SolutionNameMin: Cijk_Ailk_Bjlk_DB_MT96x64x4_SE_PLR0_SNLL0_TT6_4_WG16_16_1_WGM4
    SolutionIndex: 165
    SolutionNameMin: Cijk_Ailk_Bjlk_DB_MT64x128x4_SE_PLR1_SNLL0_TT4_8_WG16_16_1_WGM4
    SolutionIndex: 167
    SolutionNameMin: Cijk_Ailk_Bjlk_DB_MT64x32x4_SE_PLR0_SNLL1_TT4_4_WG16_8_1_WGM8
    SolutionIndex: 168
    SolutionNameMin: Cijk_Ailk_Bjlk_DB_MT64x32x4_SE_PLR0_SNLL0_TT4_4_WG16_8_1_WGM8
    SolutionIndex: 169
    SolutionNameMin: Cijk_Ailk_Bjlk_DB_MT96x32x4_SE_PLR1_SNLL1_TT6_4_WG16_8_1_WGM8
    SolutionIndex: 172
    SolutionNameMin: Cijk_Ailk_Bjlk_DB_MT48x64x4_SE_PLR0_SNLL1_TT6_4_WG8_16_1_WGM8
    SolutionIndex: 173
    SolutionNameMin: Cijk_Ailk_Bjlk_DB_MT48x64x4_SE_PLR0_SNLL0_TT6_4_WG8_16_1_WGM8
    SolutionIndex: 174
    SolutionNameMin: Cijk_Ailk_Bjlk_DB_MT96x64x4_SE_PLR0_SNLL1_TT6_4_WG16_16_1_WGM8
    SolutionIndex: 176
    SolutionNameMin: Cijk_Ailk_Bjlk_DB_MT96x64x4_SE_PLR0_SNLL0_TT6_4_WG16_16_1_WGM8
    SolutionIndex: 178
    SolutionNameMin: Cijk_Ailk_Bjlk_DB_MT128x64x8_SE_PLR0_SNLL0_TT4_4_WG32_16_1_WGM1
    SolutionIndex: 179
    SolutionNameMin: Cijk_Ailk_Bjlk_DB_MT64x32x8_SE_PLR1_SNLL1_TT4_4_WG16_8_1_WGM1
    SolutionIndex: 180
    SolutionNameMin: Cijk_Ailk_Bjlk_DB_MT64x32x8_SE_PLR1_SNLL0_TT4_4_WG16_8_1_WGM1
    SolutionIndex: 181
    SolutionNameMin: Cijk_Ailk_Bjlk_DB_MT32x64x8_SE_PLR1_SNLL1_TT4_4_WG8_16_1_WGM1
    SolutionIndex: 182
    SolutionNameMin: Cijk_Ailk_Bjlk_DB_MT64x64x8_SE_PLR1_SNLL1_TT4_4_WG16_16_1_WGM1
    SolutionIndex: 183
    SolutionNameMin: Cijk_Ailk_Bjlk_DB_MT64x64x8_SE_PLR0_SNLL1_TT4_4_WG16_16_1_WGM1
    SolutionIndex: 184
    SolutionNameMin: Cijk_Ailk_Bjlk_DB_MT64x64x8_SE_PLR1_SNLL0_TT4_4_WG16_16_1_WGM1
    SolutionIndex: 185
    SolutionNameMin: Cijk_Ailk_Bjlk_DB_MT64x64x8_SE_PLR0_SNLL0_TT4_4_WG16_16_1_WGM1
    SolutionIndex: 187
    SolutionNameMin: Cijk_Ailk_Bjlk_DB_MT128x64x8_SE_PLR0_SNLL0_TT4_4_WG32_16_1_WGM4
    SolutionIndex: 188
    SolutionNameMin: Cijk_Ailk_Bjlk_DB_MT64x32x8_SE_PLR1_SNLL1_TT4_4_WG16_8_1_WGM4
    SolutionIndex: 189
    SolutionNameMin: Cijk_Ailk_Bjlk_DB_MT64x32x8_SE_PLR1_SNLL0_TT4_4_WG16_8_1_WGM4
    SolutionIndex: 190
    SolutionNameMin: Cijk_Ailk_Bjlk_DB_MT96x32x8_SE_PLR1_SNLL0_TT6_4_WG16_8_1_WGM4
    SolutionIndex: 191
    SolutionNameMin: Cijk_Ailk_Bjlk_DB_MT32x64x8_SE_PLR1_SNLL1_TT4_4_WG8_16_1_WGM4
    SolutionIndex: 192
    SolutionNameMin: Cijk_Ailk_Bjlk_DB_MT32x64x8_SE_PLR1_SNLL0_TT4_4_WG8_16_1_WGM4
    SolutionIndex: 193
    SolutionNameMin: Cijk_Ailk_Bjlk_DB_MT64x64x8_SE_PLR1_SNLL1_TT4_4_WG16_16_1_WGM4
    SolutionIndex: 194
    SolutionNameMin: Cijk_Ailk_Bjlk_DB_MT64x64x8_SE_PLR0_SNLL1_TT4_4_WG16_16_1_WGM4
    SolutionIndex: 195
    SolutionNameMin: Cijk_Ailk_Bjlk_DB_MT64x64x8_SE_PLR1_SNLL0_TT4_4_WG16_16_1_WGM4
    SolutionIndex: 196
    SolutionNameMin: Cijk_Ailk_Bjlk_DB_MT64x64x8_SE_PLR0_SNLL0_TT4_4_WG16_16_1_WGM4
    SolutionIndex: 199
    SolutionNameMin: Cijk_Ailk_Bjlk_DB_MT64x32x8_SE_PLR1_SNLL1_TT4_4_WG16_8_1_WGM8
    SolutionIndex: 200
    SolutionNameMin: Cijk_Ailk_Bjlk_DB_MT64x32x8_SE_PLR1_SNLL0_TT4_4_WG16_8_1_WGM8
    SolutionIndex: 201
    SolutionNameMin: Cijk_Ailk_Bjlk_DB_MT96x32x8_SE_PLR1_SNLL1_TT6_4_WG16_8_1_WGM8
    SolutionIndex: 202
    SolutionNameMin: Cijk_Ailk_Bjlk_DB_MT32x64x8_SE_PLR1_SNLL1_TT4_4_WG8_16_1_WGM8
    SolutionIndex: 203
    SolutionNameMin: Cijk_Ailk_Bjlk_DB_MT32x64x8_SE_PLR1_SNLL0_TT4_4_WG8_16_1_WGM8
    SolutionIndex: 204
    SolutionNameMin: Cijk_Ailk_Bjlk_DB_MT64x64x8_SE_PLR1_SNLL1_TT4_4_WG16_16_1_WGM8
    SolutionIndex: 205
    SolutionNameMin: Cijk_Ailk_Bjlk_DB_MT64x64x8_SE_PLR0_SNLL1_TT4_4_WG16_16_1_WGM8
    SolutionIndex: 206
    SolutionNameMin: Cijk_Ailk_Bjlk_DB_MT64x64x8_SE_PLR1_SNLL0_TT4_4_WG16_16_1_WGM8
    SolutionIndex: 207
    SolutionNameMin: Cijk_Ailk_Bjlk_DB_MT64x64x8_SE_PLR0_SNLL0_TT4_4_WG16_16_1_WGM8
    SolutionIndex: 208
    SolutionNameMin: Cijk_Ailk_Bjlk_DB_MT64x48x4_SE_PLR0_SNLL1_TT4_6_WG16_8_1_WGM1
    SolutionIndex: 209
    SolutionNameMin: Cijk_Ailk_Bjlk_DB_MT32x64x4_SE_PLR0_SNLL1_TT4_4_WG8_16_1_WGM1
    SolutionIndex: 211
    SolutionNameMin: Cijk_Ailk_Bjlk_DB_MT64x48x4_SE_PLR0_SNLL1_TT4_6_WG16_8_1_WGM4
    SolutionIndex: 212
    SolutionNameMin: Cijk_Ailk_Bjlk_DB_MT64x48x4_SE_PLR0_SNLL0_TT4_6_WG16_8_1_WGM4
    SolutionIndex: 213
    SolutionNameMin: Cijk_Ailk_Bjlk_DB_MT32x64x4_SE_PLR0_SNLL0_TT4_4_WG8_16_1_WGM8
- - - [38144, 38144, 1, 256]
    - [14, 4943.8]
  - - [29568, 128, 1, 384]
    - [37, 4500.02]
  - - [30848, 128, 1, 256]
    - [37, 4373.61]
  - - [25728, 128, 1, 384]
    - [37, 4474.18]
  - - [32256, 32256, 1, 256]
    - [14, 4916.49]
  - - [7680, 7680, 1, 256]
    - [9, 4862.77]
  - - [41984, 41984, 1, 256]
    - [12, 4914.14]
  - - [40448, 40448, 1, 256]
    - [14, 4917.55]
  - - [25728, 128, 1, 256]
    - [37, 4361.84]
  - - [64, 64, 1, 64]
    - [0, 27.1934]
  - - [15104, 15104, 1, 256]
    - [9, 4937.66]
  - - [17280, 17280, 1, 384]
    - [9, 5028.89]
  - - [34688, 128, 1, 384]
    - [37, 4631.6]
  - - [27392, 27392, 1, 256]
    - [8, 4944.53]
  - - [6528, 128, 1, 256]
    - [33, 3504.42]
  - - [35328, 35328, 1, 256]
    - [9, 4913.01]
  - - [18432, 18432, 1, 384]
    - [14, 5016.36]
  - - [31232, 31232, 1, 256]
    - [14, 4912.53]
  - - [7808, 128, 1, 256]
    - [37, 3823.26]
  - - [38400, 38400, 1, 384]
    - [12, 5031.62]
  - - [16128, 16128, 1, 256]
    - [9, 4943.0]
  - - [9472, 9472, 1, 256]
    - [9, 4905.43]
  - - [21888, 21888, 1, 384]
    - [12, 5036.49]
  - - [38656, 38656, 1, 256]
    - [9, 4955.08]
  - - [20224, 20224, 1, 256]
    - [9, 4937.41]
  - - [8960, 8960, 1, 256]
    - [9, 4907.66]
  - - [29952, 29952, 1, 384]
    - [12, 5037.48]
  - - [36864, 36864, 1, 384]
    - [12, 5032.98]
  - - [33408, 33408, 1, 384]
    - [12, 5043.49]
  - - [20608, 128, 1, 384]
    - [37, 4271.06]
  - - [23424, 23424, 1, 384]
    - [12, 5031.57]
  - - [4864, 4864, 1, 256]
    - [9, 4801.16]
  - - [21504, 21504, 1, 384]
    - [9, 5021.86]
  - - [25600, 25600, 1, 256]
    - [14, 4903.23]
  - - [40960, 40960, 1, 256]
    - [10, 4912.97]
  - - [19200, 19200, 1, 384]
    - [9, 5039.59]
  - - [64, 1, 1, 64]
    - [1, 0.433898]
  - - [25088, 25088, 1, 256]
    - [14, 4917.16]
  - - [41728, 41728, 1, 256]
    - [9, 4950.97]
  - - [35840, 35840, 1, 256]
    - [12, 4913.98]
  - - [34560, 34560, 1, 256]
    - [9, 4938.35]
  - - [26368, 26368, 1, 256]
    - [9, 4930.11]
  - - [5888, 5888, 1, 256]
    - [9, 4847.58]
  - - [28032, 28032, 1, 384]
    - [8, 5039.79]
  - - [42496, 42496, 1, 256]
    - [14, 4913.66]
  - - [27008, 128, 1, 256]
    - [37, 4323.82]
  - - [38400, 38400, 1, 256]
    - [14, 4915.12]
  - - [11008, 11008, 1, 256]
    - [9, 4903.83]
  - - [32000, 32000, 1, 256]
    - [14, 4933.59]
  - - [37248, 37248, 1, 384]
    - [12, 5048.12]
  - - [10496, 10496, 1, 256]
    - [9, 4921.39]
  - - [3328, 3328, 1, 256]
    - [9, 4642.33]
  - - [16640, 16640, 1, 256]
    - [9, 4936.05]
  - - [24960, 24960, 1, 384]
    - [9, 5038.33]
  - - [1536, 1536, 1, 384]
    - [4, 4666.1]
  - - [18688, 18688, 1, 256]
    - [9, 4946.22]
  - - [22272, 22272, 1, 384]
    - [12, 5031.77]
  - - [15488, 128, 1, 256]
    - [37, 4149.04]
  - - [28416, 28416, 1, 384]
    - [10, 5039.67]
  - - [3840, 3840, 1, 256]
    - [8, 4748.27]
  - - [19968, 19968, 1, 384]
    - [9, 5016.45]
  - - [43776, 43776, 1, 256]
    - [9, 4949.83]
  - - [35072, 35072, 1, 256]
    - [12, 4936.95]
  - - [20736, 20736, 1, 256]
    - [9, 4947.98]
  - - [7168, 7168, 1, 256]
    - [14, 4838.49]
  - - [18432, 18432, 1, 256]
    - [14, 4913.01]
  - - [38016, 38016, 1, 384]
    - [12, 5038.34]
  - - [35328, 35328, 1, 384]
    - [12, 5030.83]
  - - [38784, 38784, 1, 384]
    - [12, 5052.56]
  - - [26112, 26112, 1, 384]
    - [10, 5023.99]
  - - [27264, 27264, 1, 384]
    - [9, 5038.76]
  - - [44928, 44928, 1, 384]
    - [12, 5044.23]
  - - [41088, 128, 1, 384]
    - [34, 4559.64]
  - - [42368, 128, 1, 256]
    - [37, 4531.65]
  - - [3072, 3072, 1, 384]
    - [16, 4787.42]
  - - [3456, 3072, 1, 384]
    - [16, 4812.85]
  - - [9216, 9216, 1, 384]
    - [14, 4982.57]
  - - [10752, 10752, 1, 256]
    - [9, 4887.21]
  - - [9088, 128, 1, 384]
    - [34, 4442.06]
  - - [17152, 17152, 1, 256]
    - [9, 4931.31]
  - - [44928, 128, 1, 384]
    - [34, 4690.53]
  - - [7808, 128, 1, 384]
    - [37, 4053.43]
  - - [29184, 29184, 1, 256]
    - [14, 4921.28]
  - - [11776, 11776, 1, 256]
    - [14, 4885.04]
  - - [1, 64, 1, 64]
    - [1, 0.433898]
  - - [27136, 27136, 1, 256]
    - [12, 4903.82]
  - - [33408, 128, 1, 256]
    - [37, 4422.73]
  - - [33792, 33792, 1, 384]
    - [12, 5023.83]
  - - [4224, 4224, 1, 384]
    - [14, 4889.8]
  - - [43520, 43520, 1, 256]
    - [12, 4915.38]
  - - [14592, 14592, 1, 384]
    - [9, 5010.72]
  - - [41472, 41472, 1, 256]
    - [10, 4912.51]
  - - [14080, 14080, 1, 256]
    - [9, 4923.92]
  - - [34688, 128, 1, 256]
    - [37, 4509.11]
  - - [16896, 16896, 1, 256]
    - [14, 4908.48]
  - - [15744, 15744, 1, 384]
    - [9, 5029.34]
  - - [28416, 28416, 1, 256]
    - [9, 4935.51]
  - - [23808, 23808, 1, 256]
    - [9, 4947.2]
  - - [27648, 27648, 1, 256]
    - [14, 4917.33]
  - - [1152, 3072, 1, 384]
    - [14, 4728.45]
  - - [21888, 128, 1, 256]
    - [37, 4327.94]
  - - [2688, 128, 1, 384]
    - [37, 2844.97]
  - - [34816, 34816, 1, 256]
    - [14, 4915.79]
  - - [43776, 43776, 1, 384]
    - [12, 5043.62]
  - - [36096, 36096, 1, 256]
    - [9, 4953.01]
  - - [24320, 24320, 1, 256]
    - [9, 4942.95]
  - - [12544, 12544, 1, 256]
    - [9, 4929.98]
  - - [29184, 29184, 1, 384]
    - [12, 5029.38]
  - - [29568, 29568, 1, 384]
    - [12, 5040.32]
  - - [12928, 128, 1, 384]
    - [37, 4086.94]
  - - [36480, 36480, 1, 384]
    - [12, 5046.82]
  - - [30720, 30720, 1, 256]
    - [14, 4918.08]
  - - [25728, 25728, 1, 384]
    - [9, 5038.88]
  - - [34048, 34048, 1, 256]
    - [9, 4947.82]
  - - [2304, 2048, 1, 256]
    - [25, 4456.76]
  - - [12928, 128, 1, 256]
    - [37, 3941.43]
  - - [9728, 9728, 1, 256]
    - [14, 4882.17]
  - - [128, 128, 1, 256]
    - [36, 186.912]
  - - [33024, 33024, 1, 256]
    - [9, 4946.58]
  - - [15488, 128, 1, 384]
    - [37, 4301.92]
  - - [39808, 128, 1, 384]
    - [37, 4564.35]
  - - [18176, 18176, 1, 256]
    - [9, 4927.79]
  - - [21504, 21504, 1, 256]
    - [9, 4913.98]
  - - [16384, 16384, 1, 256]
    - [9, 4903.36]
  - - [1920, 1920, 1, 384]
    - [24, 4414.31]
  - - [27008, 128, 1, 384]
    - [34, 4595.96]
  - - [27904, 27904, 1, 256]
    - [8, 4934.31]
  - - [24448, 128, 1, 384]
    - [37, 4560.76]
  - - [7680, 7680, 1, 384]
    - [14, 4980.39]
  - - [35968, 128, 1, 384]
    - [34, 4651.88]
  - - [37632, 37632, 1, 256]
    - [9, 4941.1]
  - - [14848, 14848, 1, 256]
    - [9, 4898.96]
  - - [8832, 8832, 1, 384]
    - [9, 5012.35]
  - - [23552, 23552, 1, 256]
    - [14, 4906.6]
  - - [4608, 4608, 1, 50000]
    - [17, 5244.06]
  - - [13056, 13056, 1, 256]
    - [9, 4931.17]
  - - [38528, 128, 1, 256]
    - [37, 4508.88]
  - - [19584, 19584, 1, 384]
    - [9, 5045.62]
  - - [16768, 128, 1, 384]
    - [34, 4251.87]
  - - [22784, 22784, 1, 256]
    - [14, 4931.16]
  - - [44160, 44160, 1, 384]
    - [12, 5044.51]
  - - [28160, 28160, 1, 256]
    - [12, 4905.11]
  - - [14592, 14592, 1, 256]
    - [9, 4946.11]
  - - [20992, 20992, 1, 256]
    - [14, 4900.0]
  - - [41216, 41216, 1, 256]
    - [9, 4935.63]
  - - [21760, 21760, 1, 256]
    - [9, 4948.32]
  - - [25344, 25344, 1, 256]
    - [14, 4936.55]
  - - [4608, 4608, 1, 256]
    - [14, 4771.78]
  - - [3456, 3456, 1, 384]
    - [8, 4829.09]
  - - [2560, 2048, 1, 256]
    - [25, 4438.42]
  - - [30464, 30464, 1, 256]
    - [9, 4943.45]
  - - [19200, 19200, 1, 256]
    - [9, 4945.89]
  - - [22272, 22272, 1, 256]
    - [14, 4936.92]
  - - [29952, 29952, 1, 256]
    - [9, 4944.13]
  - - [20480, 20480, 1, 256]
    - [14, 4908.02]
  - - [5376, 5376, 1, 384]
    - [8, 4947.28]
  - - [17408, 17408, 1, 256]
    - [14, 4913.04]
  - - [32768, 32768, 1, 256]
    - [10, 4905.13]
  - - [18816, 18816, 1, 384]
    - [10, 5032.61]
  - - [3840, 3840, 1, 384]
    - [9, 4870.39]
  - - [34944, 34944, 1, 384]
    - [12, 5043.57]
  - - [18048, 18048, 1, 384]
    - [11, 5025.03]
  - - [34560, 34560, 1, 384]
    - [12, 5042.24]
  - - [9088, 128, 1, 256]
    - [34, 4182.52]
  - - [24576, 24576, 1, 256]
    - [14, 4922.48]
  - - [32128, 128, 1, 384]
    - [37, 4573.55]
  - - [8448, 8448, 1, 256]
    - [9, 4918.8]
  - - [42752, 42752, 1, 256]
    - [8, 4942.02]
  - - [5376, 5376, 1, 256]
    - [9, 4841.23]
  - - [18048, 128, 1, 256]
    - [37, 4307.97]
  - - [3584, 3584, 1, 256]
    - [9, 4668.55]
  - - [37120, 37120, 1, 256]
    - [9, 4941.96]
  - - [39936, 39936, 1, 384]
    - [12, 5032.16]
  - - [20736, 20736, 1, 384]
    - [9, 5031.05]
  - - [35584, 35584, 1, 256]
    - [9, 4939.06]
  - - [26112, 26112, 1, 256]
    - [9, 4912.04]
  - - [16896, 16896, 1, 384]
    - [14, 5009.28]
  - - [40704, 40704, 1, 384]
    - [12, 5044.18]
  - - [33280, 33280, 1, 256]
    - [14, 4917.79]
  - - [5632, 5632, 1, 256]
    - [9, 4794.28]
  - - [19456, 19456, 1, 256]
    - [14, 4903.62]
  - - [22016, 22016, 1, 256]
    - [14, 4909.78]
  - - [14208, 128, 1, 256]
    - [37, 4244.78]
  - - [13568, 13568, 1, 256]
    - [9, 4929.85]
  - - [30848, 128, 1, 384]
    - [37, 4442.81]
  - - [1408, 128, 1, 384]
    - [37, 2028.31]
  - - [5760, 5760, 1, 5760]
    - [18, 5159.55]
  - - [10752, 10752, 1, 384]
    - [14, 4998.43]
  - - [39936, 39936, 1, 256]
    - [14, 4913.67]
  - - [1920, 3072, 1, 384]
    - [5, 4825.97]
  - - [9984, 9984, 1, 256]
    - [9, 4920.05]
  - - [13056, 13056, 1, 384]
    - [9, 5023.78]
  - - [2816, 2048, 1, 256]
    - [29, 4480.45]
  - - [23168, 128, 1, 256]
    - [37, 4268.83]
  - - [19968, 19968, 1, 256]
    - [9, 4916.04]
  - - [44800, 44800, 1, 256]
    - [9, 4946.5]
  - - [11904, 11904, 1, 384]
    - [11, 5015.11]
  - - [14976, 14976, 1, 384]
    - [9, 5021.87]
  - - [35712, 35712, 1, 384]
    - [12, 5043.92]
  - - [12672, 12672, 1, 384]
    - [9, 5022.34]
  - - [43008, 43008, 1, 384]
    - [12, 5032.01]
  - - [41088, 41088, 1, 384]
    - [12, 5046.15]
  - - [10368, 128, 1, 384]
    - [31, 3879.48]
  - - [6912, 6912, 1, 384]
    - [14, 4979.18]
  - - [16128, 16128, 1, 384]
    - [11, 5027.9]
  - - [5120, 5120, 1, 256]
    - [14, 4783.78]
  - - [25856, 25856, 1, 256]
    - [9, 4933.64]
  - - [12288, 12288, 1, 256]
    - [9, 4898.9]
  - - [6400, 6400, 1, 256]
    - [9, 4861.45]
  - - [2688, 128, 1, 256]
    - [37, 2678.84]
  - - [11648, 128, 1, 256]
    - [37, 4050.1]
  - - [43264, 43264, 1, 256]
    - [14, 4943.12]
  - - [19712, 19712, 1, 256]
    - [9, 4935.51]
  - - [34176, 34176, 1, 384]
    - [12, 5041.26]
  - - [31104, 31104, 1, 384]
    - [12, 5042.35]
  - - [36608, 36608, 1, 256]
    - [9, 4943.46]
  - - [39808, 128, 1, 256]
    - [37, 4481.34]
  - - [13824, 13824, 1, 384]
    - [14, 4995.07]
  - - [42624, 42624, 1, 384]
    - [12, 5050.28]
  - - [21120, 21120, 1, 384]
    - [12, 5030.83]
  - - [23296, 23296, 1, 256]
    - [9, 4939.59]
  - - [42240, 42240, 1, 256]
    - [9, 4947.45]
  - - [33408, 128, 1, 384]
    - [35, 4605.83]
  - - [43648, 128, 1, 256]
    - [37, 4512.42]
  - - [19328, 128, 1, 384]
    - [37, 4341.12]
  - - [33792, 33792, 1, 256]
    - [9, 4920.25]
  - - [31488, 31488, 1, 256]
    - [8, 4951.46]
  - - [768, 3072, 1, 384]
    - [4, 4699.02]
  - - [6144, 6144, 1, 256]
    - [14, 4845.6]
  - - [20352, 20352, 1, 384]
    - [9, 5031.88]
  - - [23168, 128, 1, 384]
    - [34, 4385.22]
  - - [33536, 33536, 1, 256]
    - [8, 4934.85]
  - - [32640, 32640, 1, 384]
    - [12, 5043.9]
  - - [10368, 10368, 1, 384]
    - [9, 5013.29]
  - - [1536, 3072, 1, 384]
    - [14, 4745.29]
  - - [19328, 128, 1, 256]
    - [37, 4208.8]
  - - [2688, 3072, 1, 384]
    - [14, 4823.1]
  - - [24192, 24192, 1, 384]
    - [12, 5032.98]
  - - [6912, 6912, 1, 256]
    - [9, 4879.98]
  - - [15360, 15360, 1, 256]
    - [9, 4908.22]
  - - [18944, 18944, 1, 256]
    - [14, 4911.54]
  - - [37376, 37376, 1, 256]
    - [12, 4913.61]
  - - [31488, 31488, 1, 384]
    - [12, 5043.19]
  - - [26880, 26880, 1, 256]
    - [9, 4947.07]
  - - [44928, 128, 1, 128]
    - [38, 4272.7]
  - - [24448, 128, 1, 256]
    - [37, 4426.03]
  - - [31872, 31872, 1, 384]
    - [12, 5041.26]
  - - [1408, 128, 1, 256]
    - [37, 1909.66]
  - - [38528, 128, 1, 384]
    - [37, 4629.24]
  - - [15616, 15616, 1, 256]
    - [9, 4934.91]
  - - [39552, 39552, 1, 384]
    - [12, 5044.38]
  - - [4352, 4352, 1, 256]
    - [9, 4789.61]
  - - [28288, 128, 1, 384]
    - [37, 4562.32]
  - - [10368, 128, 1, 256]
    - [38, 3639.02]
  - - [32128, 128, 1, 256]
    - [37, 4456.36]
  - - [12288, 12288, 1, 384]
    - [14, 4999.49]
  - - [4608, 4608, 1, 4608]
    - [17, 5198.68]
  - - [5760, 5760, 1, 384]
    - [9, 4959.13]
  - - [8704, 8704, 1, 256]
    - [14, 4860.28]
  - - [17664, 17664, 1, 256]
    - [9, 4947.44]
  - - [24576, 24576, 1, 384]
    - [12, 5023.03]
  - - [37248, 128, 1, 384]
    - [37, 4520.08]
  - - [34304, 34304, 1, 256]
    - [10, 4909.95]
  - - [42368, 128, 1, 384]
    - [35, 4629.78]
  - - [17664, 17664, 1, 384]
    - [9, 5030.74]
  - - [12800, 12800, 1, 256]
    - [14, 4888.6]
  - - [2304, 2304, 1, 384]
    - [5, 4626.5]
  - - [26624, 26624, 1, 256]
    - [14, 4915.5]
  - - [36864, 36864, 1, 256]
    - [12, 4910.35]
  - - [40704, 40704, 1, 256]
    - [9, 4938.45]
  - - [12032, 12032, 1, 256]
    - [9, 4919.1]
  - - [33024, 33024, 1, 384]
    - [12, 5042.28]
  - - [28800, 28800, 1, 384]
    - [9, 5039.88]
  - - [14208, 128, 1, 384]
    - [37, 4433.42]
  - - [22656, 22656, 1, 384]
    - [9, 5035.91]
  - - [41472, 41472, 1, 384]
    - [10, 5031.66]
  - - [39680, 39680, 1, 256]
    - [9, 4943.75]
  - - [44032, 44032, 1, 256]
    - [12, 4914.17]
  - - [43392, 43392, 1, 384]
    - [12, 5048.33]
  - - [42240, 42240, 1, 384]
    - [12, 5046.69]
  - - [38912, 38912, 1, 256]
    - [14, 4920.17]
  - - [23040, 23040, 1, 384]
    - [12, 5020.32]
  - - [13312, 13312, 1, 256]
    - [14, 4891.4]
  - - [128, 128, 1, 384]
    - [39, 209.995]
  - - [11136, 11136, 1, 384]
    - [14, 5012.59]
  - - [39168, 39168, 1, 256]
    - [9, 4949.46]
  - - [25344, 25344, 1, 384]
    - [9, 5040.0]
  - - [5248, 128, 1, 256]
    - [32, 3506.66]
  - - [30208, 30208, 1, 256]
    - [14, 4913.31]
  - - [40192, 40192, 1, 256]
    - [9, 4951.49]
  - - [15872, 15872, 1, 256]
    - [14, 4908.5]
  - - [44544, 44544, 1, 256]
    - [14, 4925.67]
  - - [11520, 11520, 1, 256]
    - [9, 4927.86]
  - - [15360, 15360, 1, 384]
    - [14, 5006.79]
  - - [23040, 23040, 1, 256]
    - [9, 4921.45]
  - - [26496, 26496, 1, 384]
    - [12, 5038.29]
  - - [11264, 11264, 1, 256]
    - [14, 4882.79]
  - - [18048, 128, 1, 384]
    - [34, 4501.2]
  - - [30976, 30976, 1, 256]
    - [8, 4933.07]
  - - [11648, 128, 1, 384]
    - [31, 4249.73]
  - - [2304, 3072, 1, 384]
    - [5, 4820.36]
  - - [6144, 6144, 1, 384]
    - [14, 4942.89]
  - - [28928, 28928, 1, 256]
    - [14, 4937.18]
  - - [11520, 11520, 1, 384]
    - [14, 5020.03]
  - - [43008, 43008, 1, 256]
    - [9, 4926.27]
  - - [3072, 3072, 1, 384]
    - [14, 4831.58]
  - - [29440, 29440, 1, 256]
    - [9, 4941.34]
  - - [36352, 36352, 1, 256]
    - [9, 4907.78]
  - - [32256, 32256, 1, 384]
    - [12, 5028.89]
  - - [23808, 23808, 1, 384]
    - [12, 5036.49]
  - - [9984, 9984, 1, 384]
    - [9, 5008.45]
  - - [37248, 128, 1, 256]
    - [37, 4453.89]
  - - [1, 1, 1, 64]
    - [1, 0.00647773]
  - - [6528, 6528, 1, 384]
    - [9, 4987.46]
  - - [7296, 7296, 1, 384]
    - [9, 4993.92]
  - - [37888, 37888, 1, 256]
    - [10, 4912.3]
  - - [35968, 128, 1, 256]
    - [37, 4465.07]
  - - [13824, 13824, 1, 256]
    - [14, 4909.04]
  - - [39168, 39168, 1, 384]
    - [12, 5040.56]
  - - [37632, 37632, 1, 384]
    - [12, 5042.41]
  - - [29568, 128, 1, 256]
    - [37, 4399.23]
  - - [14336, 14336, 1, 256]
    - [14, 4896.25]
  - - [8064, 8064, 1, 384]
    - [9, 5003.24]
  - - [28288, 128, 1, 256]
    - [37, 4432.59]
  - - [16512, 16512, 1, 384]
    - [9, 5032.46]
  - - [30720, 30720, 1, 384]
    - [12, 5032.58]
  - - [21248, 21248, 1, 256]
    - [9, 4944.88]
  - - [29696, 29696, 1, 256]
    - [14, 4913.27]
  - - [384, 3072, 1, 384]
    - [5, 4524.43]
  - - [28672, 28672, 1, 256]
    - [9, 4908.07]
  - - [32512, 32512, 1, 256]
    - [9, 4930.53]
  - - [2688, 2688, 1, 384]
    - [9, 4703.56]
  - - [9216, 9216, 1, 256]
    - [14, 4886.08]
  - - [6656, 6656, 1, 256]
    - [14, 4834.44]
  - - [6528, 128, 1, 384]
    - [30, 3598.75]
  - - [30336, 30336, 1, 384]
    - [9, 5043.1]
  - - [13440, 13440, 1, 384]
    - [9, 5026.95]
  - - [20608, 128, 1, 256]
    - [37, 4181.84]
  - - [4992, 4992, 1, 384]
    - [9, 4934.36]
  - - [7936, 7936, 1, 256]
    - [9, 4884.07]
  - - [41856, 41856, 1, 384]
    - [12, 5048.24]
  - - [44288, 44288, 1, 256]
    - [9, 4953.6]
  - - [7744, 7744, 1, 7744]
    - [15, 5184.91]
  - - [7424, 7424, 1, 256]
    - [9, 4881.42]
  - - [39424, 39424, 1, 256]
    - [10, 4913.75]
  - - [43648, 128, 1, 384]
    - [37, 4586.9]
  - - [14208, 14208, 1, 384]
    - [9, 5027.29]
  - - [36096, 36096, 1, 384]
    - [12, 5035.57]
  - - [44544, 44544, 1, 384]
    - [12, 5036.22]
  - - [22528, 22528, 1, 256]
    - [14, 4904.7]
  - - [4096, 4096, 1, 256]
    - [9, 4699.5]
  - - [4608, 4608, 1, 384]
    - [14, 4895.84]
  - - [31744, 31744, 1, 256]
    - [14, 4909.71]
  - - [3968, 128, 1, 384]
    - [37, 3970.58]
  - - [17920, 17920, 1, 256]
    - [14, 4908.84]
  - - [5248, 128, 1, 384]
    - [32, 3773.4]
  - - [26880, 26880, 1, 384]
    - [12, 5036.35]
  - - [8192, 8192, 1, 256]
    - [14, 4865.66]
  - - [3968, 128, 1, 256]
    - [37, 3640.07]
  - - [41088, 128, 1, 256]
    - [37, 4463.51]
  - - [21888, 128, 1, 384]
    - [37, 4457.4]
  - - [16768, 128, 1, 256]
    - [37, 4102.86]
  - - [24064, 24064, 1, 256]
    - [14, 4908.54]
  - - [44928, 128, 1, 256]
    - [37, 4557.33]
  - - [9600, 9600, 1, 384]
    - [9, 5008.75]
  - - [27648, 27648, 1, 384]
    - [10, 5021.65]
  - - [24832, 24832, 1, 256]
    - [9, 4935.41]
  - - [8448, 8448, 1, 384]
    - [9, 4999.3]
  - - [10240, 10240, 1, 256]
    - [14, 4871.33]
  - - [40320, 40320, 1, 384]
    - [12, 5041.89]
  - - [18048, 3072, 1, 384]
    - [53, 4976.0]
  - - [2304, 1153, 1, 384]
    - [73, 4220.18]
  - - [18432, 2688, 1, 384]
    - [54, 4980.46]
  - - [3840, 2304, 1, 384]
    - [53, 4762.52]
  - - [30720, 1152, 1, 384]
    - [53, 4975.45]
  - - [43008, 2304, 1, 384]
    - [58, 5000.2]
  - - [26496, 768, 1, 384]
    - [53, 4924.0]
  - - [43776, 3072, 1, 384]
    - [54, 5014.4]
  - - [30336, 1536, 1, 384]
    - [58, 4974.95]
  - - [3840, 3072, 1, 384]
    - [54, 4825.56]
  - - [44160, 3072, 1, 384]
    - [54, 5014.27]
  - - [41472, 1153, 1, 384]
    - [54, 4774.86]
  - - [33408, 1920, 1, 384]
    - [54, 4993.44]
  - - [21504, 1153, 1, 384]
    - [54, 4755.34]
  - - [24576, 1920, 1, 384]
    - [54, 4996.19]
  - - [23040, 3072, 1, 384]
    - [54, 4993.0]
  - - [28032, 1152, 1, 384]
    - [54, 4958.04]
  - - [35328, 1153, 1, 384]
    - [54, 4764.12]
  - - [33792, 2688, 1, 384]
    - [54, 5010.32]
  - - [8448, 768, 1, 384]
    - [54, 4666.98]
  - - [8064, 2688, 1, 384]
    - [54, 4918.57]
  - - [33408, 2304, 1, 384]
    - [54, 5005.26]
  - - [31872, 1536, 1, 384]
    - [53, 4961.7]
  - - [41088, 1920, 1, 384]
    - [54, 5004.32]
  - - [17280, 3072, 1, 384]
    - [58, 4974.84]
  - - [37632, 3072, 1, 384]
    - [54, 5005.85]
  - - [38016, 1153, 1, 384]
    - [54, 4766.18]
  - - [32640, 1152, 1, 384]
    - [54, 4988.29]
  - - [27264, 1153, 1, 384]
    - [54, 4754.61]
  - - [30336, 1153, 1, 384]
    - [54, 4774.67]
  - - [26496, 3072, 1, 384]
    - [53, 4995.1]
  - - [41088, 2304, 1, 384]
    - [54, 5013.44]
  - - [3840, 1153, 1, 384]
    - [54, 4480.73]
  - - [16128, 2304, 1, 384]
    - [54, 4975.6]
  - - [5376, 1536, 1, 384]
    - [59, 4759.68]
  - - [39552, 3072, 1, 384]
    - [54, 5007.73]
  - - [23808, 3072, 1, 384]
    - [54, 4987.65]
  - - [24192, 1153, 1, 384]
    - [54, 4749.07]
  - - [16128, 1536, 1, 384]
    - [58, 4921.2]
  - - [5760, 1536, 1, 384]
    - [58, 4746.55]
  - - [36480, 2688, 1, 384]
    - [54, 5016.76]
  - - [21504, 1152, 1, 384]
    - [54, 4942.78]
  - - [38400, 1153, 1, 384]
    - [54, 4772.96]
  - - [39168, 1153, 1, 384]
    - [54, 4772.76]
  - - [21888, 1153, 1, 384]
    - [53, 4731.82]
  - - [19968, 1152, 1, 384]
    - [54, 4935.19]
  - - [28416, 2304, 1, 384]
    - [58, 4999.62]
  - - [26880, 768, 1, 384]
    - [54, 4925.95]
  - - [15360, 768, 1, 384]
    - [54, 4830.5]
  - - [42624, 768, 1, 384]
    - [58, 4943.89]
  - - [13056, 3072, 1, 384]
    - [57, 4961.56]
  - - [43008, 1920, 1, 384]
    - [54, 5006.56]
  - - [44160, 2688, 1, 384]
    - [54, 5024.47]
  - - [4992, 1536, 1, 384]
    - [58, 4711.65]
  - - [39168, 768, 1, 384]
    - [54, 4956.79]
  - - [16896, 1153, 1, 384]
    - [53, 4720.07]
  - - [6144, 1536, 1, 384]
    - [57, 4824.64]
  - - [26112, 1152, 1, 384]
    - [54, 4963.44]
  - - [43392, 1153, 1, 384]
    - [54, 4786.79]
  - - [29952, 1536, 1, 384]
    - [58, 4975.05]
  - - [17280, 1153, 1, 384]
    - [54, 4721.29]
  - - [10752, 2688, 1, 384]
    - [53, 4940.06]
  - - [33408, 1153, 1, 384]
    - [54, 4753.16]
  - - [42240, 2688, 1, 384]
    - [54, 5027.28]
  - - [36096, 1536, 1, 384]
    - [58, 4974.18]
  - - [22272, 2304, 1, 384]
    - [54, 4978.49]
  - - [26496, 1536, 1, 384]
    - [54, 4967.0]
  - - [42624, 2688, 1, 384]
    - [54, 5020.72]
  - - [29184, 3072, 1, 384]
    - [54, 5004.92]
  - - [9600, 1920, 1, 384]
    - [54, 4925.74]
  - - [27264, 3072, 1, 384]
    - [54, 5002.82]
  - - [7680, 1152, 1, 384]
    - [54, 4770.81]
  - - [24960, 1153, 1, 384]
    - [54, 4733.13]
  - - [18048, 1536, 1, 384]
    - [54, 4931.32]
  - - [17664, 1153, 1, 384]
    - [54, 4729.77]
  - - [20352, 1153, 1, 384]
    - [54, 4719.82]
  - - [29184, 1152, 1, 384]
    - [53, 4975.13]
  - - [17664, 2688, 1, 384]
    - [54, 4998.2]
  - - [15360, 1920, 1, 384]
    - [54, 4944.65]
  - - [18816, 1920, 1, 384]
    - [54, 4976.13]
  - - [33024, 768, 1, 384]
    - [58, 4938.33]
  - - [40704, 1153, 1, 384]
    - [54, 4789.41]
  - - [21888, 1920, 1, 384]
    - [54, 4986.65]
  - - [18816, 3072, 1, 384]
    - [58, 4990.17]
  - - [37248, 1536, 1, 384]
    - [54, 4991.0]
  - - [34176, 2304, 1, 384]
    - [54, 5004.96]
  - - [16896, 2304, 1, 384]
    - [54, 4983.23]
  - - [40320, 3072, 1, 384]
    - [54, 5007.94]
  - - [32640, 1153, 1, 384]
    - [54, 4772.66]
  - - [6144, 1920, 1, 384]
    - [54, 4888.89]
  - - [14208, 1152, 1, 384]
    - [54, 4904.31]
  - - [8832, 1153, 1, 384]
    - [54, 4648.8]
  - - [22272, 1920, 1, 384]
    - [54, 4983.64]
  - - [32640, 3072, 1, 384]
    - [54, 5010.56]
  - - [33408, 1536, 1, 384]
    - [58, 4967.79]
  - - [5760, 3072, 1, 384]
    - [58, 4891.71]
  - - [27648, 3072, 1, 384]
    - [54, 4993.37]
  - - [26880, 2688, 1, 384]
    - [54, 5005.72]
  - - [36864, 1153, 1, 384]
    - [54, 4769.78]
  - - [36864, 1920, 1, 384]
    - [54, 4992.34]
  - - [4224, 1152, 1, 384]
    - [79, 4568.62]
  - - [12288, 1153, 1, 384]
    - [54, 4669.03]
  - - [384, 768, 1, 384]
    - [63, 2496.61]
  - - [27648, 1920, 1, 384]
    - [54, 5001.99]
  - - [5760, 1152, 1, 384]
    - [54, 4760.91]
  - - [33792, 1536, 1, 384]
    - [58, 4977.76]
  - - [40704, 2688, 1, 384]
    - [54, 5015.99]
  - - [37632, 2304, 1, 384]
    - [54, 5005.92]
  - - [24192, 1152, 1, 384]
    - [54, 4961.05]
  - - [42240, 3072, 1, 384]
    - [58, 5004.17]
  - - [16896, 1920, 1, 384]
    - [54, 4970.43]
  - - [18048, 1153, 1, 384]
    - [54, 4715.89]
  - - [32640, 2304, 1, 384]
    - [58, 5006.2]
  - - [36096, 1152, 1, 384]
    - [54, 4988.85]
  - - [15744, 1920, 1, 384]
    - [54, 4952.28]
  - - [5760, 2304, 1, 384]
    - [58, 4873.84]
  - - [33408, 1152, 1, 384]
    - [54, 4965.87]
  - - [11904, 2304, 1, 384]
    - [58, 4939.36]
  - - [24576, 2304, 1, 384]
    - [58, 4975.94]
  - - [33024, 1536, 1, 384]
    - [54, 4974.96]
  - - [6528, 1152, 1, 384]
    - [53, 4680.05]
  - - [20736, 768, 1, 384]
    - [54, 4876.63]
  - - [37632, 1152, 1, 384]
    - [54, 4981.09]
  - - [12288, 1920, 1, 384]
    - [54, 4936.31]
  - - [36096, 2304, 1, 384]
    - [58, 5006.12]
  - - [6912, 1153, 1, 384]
    - [54, 4503.36]
  - - [13056, 2688, 1, 384]
    - [54, 4973.1]
  - - [20352, 2688, 1, 384]
    - [54, 4981.59]
  - - [14592, 2304, 1, 384]
    - [58, 4967.32]
  - - [16128, 1920, 1, 384]
    - [54, 4969.52]
  - - [9216, 1536, 1, 384]
    - [57, 4874.83]
  - - [16512, 1920, 1, 384]
    - [54, 4965.73]
  - - [35712, 1920, 1, 384]
    - [54, 5002.04]
  - - [9216, 2688, 1, 384]
    - [58, 4938.47]
  - - [16128, 2688, 1, 384]
    - [54, 4982.4]
  - - [19200, 3072, 1, 384]
    - [58, 4984.78]
  - - [23808, 2688, 1, 384]
    - [54, 4995.49]
  - - [18048, 768, 1, 384]
    - [58, 4844.52]
  - - [14592, 2688, 1, 384]
    - [54, 4985.88]
  - - [15360, 1152, 1, 384]
    - [54, 4899.89]
  - - [40320, 1152, 1, 384]
    - [54, 4980.48]
  - - [25344, 2688, 1, 384]
    - [54, 5000.78]
  - - [43008, 1152, 1, 384]
    - [54, 4980.46]
  - - [19200, 1152, 1, 384]
    - [54, 4923.07]
  - - [19584, 1152, 1, 384]
    - [53, 4918.1]
  - - [14208, 1920, 1, 384]
    - [54, 4945.28]
  - - [5376, 1152, 1, 384]
    - [54, 4716.35]
  - - [14976, 2688, 1, 384]
    - [54, 4967.39]
  - - [36480, 1152, 1, 384]
    - [54, 4981.47]
  - - [39936, 1920, 1, 384]
    - [54, 5004.42]
  - - [11136, 1152, 1, 384]
    - [54, 4862.99]
  - - [17280, 2304, 1, 384]
    - [58, 4970.17]
  - - [11520, 2304, 1, 384]
    - [54, 4938.06]
  - - [19968, 3072, 1, 384]
    - [58, 4982.79]
  - - [19968, 1153, 1, 384]
    - [54, 4742.25]
  - - [26496, 1152, 1, 384]
    - [54, 4962.9]
  - - [18432, 768, 1, 384]
    - [53, 4868.36]
  - - [4608, 768, 1, 384]
    - [58, 4714.67]
  - - [34944, 1920, 1, 384]
    - [54, 5010.1]
  - - [13824, 2688, 1, 384]
    - [54, 4966.11]
  - - [8832, 3072, 1, 384]
    - [58, 4924.87]
  - - [39936, 2304, 1, 384]
    - [58, 4990.91]
  - - [16896, 3072, 1, 384]
    - [54, 4980.59]
  - - [7680, 2688, 1, 384]
    - [53, 4910.94]
  - - [19968, 2304, 1, 384]
    - [54, 4971.64]
  - - [27648, 2688, 1, 384]
    - [54, 5009.45]
  - - [4224, 768, 1, 384]
    - [79, 4421.17]
  - - [35328, 3072, 1, 384]
    - [54, 5004.8]
  - - [11520, 3072, 1, 384]
    - [54, 4953.11]
  - - [24192, 1920, 1, 384]
    - [54, 4988.39]
  - - [32640, 1920, 1, 384]
    - [53, 4990.67]
  - - [4992, 3072, 1, 384]
    - [58, 4872.74]
  - - [34176, 2688, 1, 384]
    - [54, 5015.98]
  - - [35328, 1536, 1, 384]
    - [54, 4982.95]
  - - [20736, 1153, 1, 384]
    - [54, 4733.01]
  - - [3072, 1152, 1, 384]
    - [43, 4733.06]
  - - [20352, 3072, 1, 384]
    - [53, 4988.2]
  - - [26880, 1152, 1, 384]
    - [54, 4973.01]
  - - [8832, 2688, 1, 384]
    - [54, 4934.14]
  - - [18048, 1920, 1, 384]
    - [54, 4960.5]
  - - [31488, 768, 1, 384]
    - [58, 4934.42]
  - - [21504, 2304, 1, 384]
    - [54, 4970.73]
  - - [30720, 3072, 1, 384]
    - [54, 5006.94]
  - - [13440, 2688, 1, 384]
    - [53, 4976.92]
  - - [11136, 2688, 1, 384]
    - [54, 4947.1]
  - - [38784, 1153, 1, 384]
    - [54, 4766.9]
  - - [33024, 3072, 1, 384]
    - [58, 4997.81]
  - - [34944, 3072, 1, 384]
    - [54, 5008.65]
  - - [31872, 1152, 1, 384]
    - [54, 4970.23]
  - - [768, 1152, 1, 384]
    - [50, 3812.15]
  - - [29184, 2688, 1, 384]
    - [54, 5006.03]
  - - [10752, 3072, 1, 384]
    - [58, 4946.18]
  - - [20352, 768, 1, 384]
    - [54, 4891.01]
  - - [4608, 2688, 1, 384]
    - [54, 4839.98]
  - - [36480, 1153, 1, 384]
    - [54, 4772.03]
  - - [7296, 1153, 1, 384]
    - [77, 4534.67]
  - - [21504, 2688, 1, 384]
    - [54, 5001.68]
  - - [34176, 768, 1, 384]
    - [54, 4961.76]
  - - [3072, 1920, 1, 384]
    - [53, 4785.6]
  - - [21504, 1920, 1, 384]
    - [54, 4976.17]
  - - [23808, 1536, 1, 384]
    - [54, 4947.9]
  - - [15360, 1153, 1, 384]
    - [53, 4713.52]
  - - [30336, 3072, 1, 384]
    - [54, 5009.94]
  - - [26112, 3072, 1, 384]
    - [54, 4991.86]
  - - [8832, 1536, 1, 384]
    - [58, 4830.43]
  - - [11136, 1153, 1, 384]
    - [54, 4655.27]
  - - [43392, 1536, 1, 384]
    - [54, 4985.09]
  - - [28800, 2688, 1, 384]
    - [54, 5002.11]
  - - [31488, 2688, 1, 384]
    - [54, 5003.77]
  - - [10368, 3072, 1, 384]
    - [58, 4939.74]
  - - [12672, 1920, 1, 384]
    - [54, 4953.88]
  - - [30720, 1536, 1, 384]
    - [58, 4974.52]
  - - [8064, 3072, 1, 384]
    - [53, 4916.83]
  - - [23424, 1153, 1, 384]
    - [54, 4739.18]
  - - [17280, 1152, 1, 384]
    - [54, 4912.42]
  - - [13824, 768, 1, 384]
    - [58, 4838.66]
  - - [9216, 1152, 1, 384]
    - [54, 4884.81]
  - - [6528, 1920, 1, 384]
    - [54, 4877.74]
  - - [28800, 3072, 1, 384]
    - [54, 5003.78]
  - - [38016, 1536, 1, 384]
    - [58, 4975.98]
  - - [39552, 1152, 1, 384]
    - [54, 4977.34]
  - - [22272, 1153, 1, 384]
    - [54, 4743.23]
  - - [25344, 2304, 1, 384]
    - [58, 4997.0]
  - - [14592, 3072, 1, 384]
    - [58, 4964.13]
  - - [28032, 1920, 1, 384]
    - [54, 4998.51]
  - - [20736, 2688, 1, 384]
    - [54, 4999.38]
  - - [15744, 1536, 1, 384]
    - [54, 4925.53]
  - - [25728, 1152, 1, 384]
    - [54, 4961.4]
  - - [16512, 1536, 1, 384]
    - [58, 4916.69]
  - - [3072, 2304, 1, 384]
    - [57, 4795.53]
  - - [5760, 2688, 1, 384]
    - [53, 4885.8]
  - - [37248, 1153, 1, 384]
    - [54, 4778.69]
  - - [10368, 1153, 1, 384]
    - [54, 4650.73]
  - - [36864, 3072, 1, 384]
    - [54, 5011.29]
  - - [23040, 1152, 1, 384]
    - [54, 4941.03]
  - - [9600, 3072, 1, 384]
    - [58, 4926.41]
  - - [10368, 1152, 1, 384]
    - [54, 4833.77]
  - - [36096, 3072, 1, 384]
    - [58, 4998.24]
  - - [24576, 1536, 1, 384]
    - [54, 4959.6]
  - - [31104, 2304, 1, 384]
    - [58, 5000.88]
  - - [38400, 2304, 1, 384]
    - [54, 5006.02]
  - - [38016, 1152, 1, 384]
    - [54, 4980.77]
  - - [15360, 2688, 1, 384]
    - [54, 4972.49]
  - - [10752, 1153, 1, 384]
    - [54, 4652.71]
  - - [29952, 2688, 1, 384]
    - [54, 4996.93]
  - - [43008, 2688, 1, 384]
    - [54, 5016.71]
  - - [13440, 1920, 1, 384]
    - [54, 4949.38]
  - - [4992, 1152, 1, 384]
    - [58, 4706.52]
  - - [9984, 2304, 1, 384]
    - [58, 4929.36]
  - - [6528, 2688, 1, 384]
    - [54, 4895.06]
  - - [38016, 2688, 1, 384]
    - [54, 5022.4]
  - - [4608, 1152, 1, 384]
    - [54, 4639.97]
  - - [9600, 2304, 1, 384]
    - [58, 4915.54]
  - - [7680, 3072, 1, 384]
    - [57, 4903.82]
  - - [2304, 1536, 1, 384]
    - [44, 4756.25]
  - - [40320, 1536, 1, 384]
    - [58, 4970.14]
  - - [13440, 1536, 1, 384]
    - [58, 4898.8]
  - - [18432, 1152, 1, 384]
    - [54, 4919.24]
  - - [40320, 2688, 1, 384]
    - [58, 5011.34]
  - - [30336, 2304, 1, 384]
    - [54, 5007.68]
  - - [24192, 2688, 1, 384]
    - [54, 4999.28]
  - - [16896, 1152, 1, 384]
    - [54, 4903.98]
  - - [38016, 3072, 1, 384]
    - [54, 5009.48]
  - - [43392, 2304, 1, 384]
    - [54, 5010.45]
  - - [13440, 1152, 1, 384]
    - [54, 4881.78]
  - - [1152, 769, 1, 384]
    - [45, 3758.09]
  - - [36096, 1153, 1, 384]
    - [54, 4767.94]
  - - [33792, 1920, 1, 384]
    - [54, 4995.58]
  - - [11520, 1153, 1, 384]
    - [54, 4618.18]
  - - [12288, 3072, 1, 384]
    - [58, 4967.49]
  - - [28416, 3072, 1, 384]
    - [58, 5006.26]
  - - [35328, 768, 1, 384]
    - [58, 4919.38]
  - - [22656, 2688, 1, 384]
    - [54, 5003.16]
  - - [25728, 2688, 1, 384]
    - [54, 5012.43]
  - - [23040, 768, 1, 384]
    - [58, 4897.63]
  - - [29952, 2304, 1, 384]
    - [54, 5000.57]
  - - [33024, 1920, 1, 384]
    - [54, 4997.81]
  - - [14976, 768, 1, 384]
    - [53, 4802.12]
  - - [42624, 1920, 1, 384]
    - [53, 5006.57]
  - - [32640, 2688, 1, 384]
    - [57, 4994.42]
  - - [11520, 1536, 1, 384]
    - [58, 4894.24]
  - - [6912, 768, 1, 384]
    - [58, 4617.69]
  - - [28032, 3072, 1, 384]
    - [54, 5002.38]
  - - [39552, 1920, 1, 384]
    - [54, 5009.09]
  - - [32256, 1920, 1, 384]
    - [58, 4980.59]
  - - [42240, 1153, 1, 384]
    - [54, 4788.17]
  - - [10752, 1536, 1, 384]
    - [57, 4875.9]
  - - [16128, 1152, 1, 384]
    - [54, 4890.27]
  - - [6144, 1153, 1, 384]
    - [53, 4553.82]
  - - [24576, 2688, 1, 384]
    - [54, 5004.88]
  - - [12672, 2688, 1, 384]
    - [54, 4970.04]
  - - [5376, 768, 1, 384]
    - [82, 4567.96]
  - - [10752, 1920, 1, 384]
    - [54, 4908.99]
  - - [40704, 1536, 1, 384]
    - [58, 4983.48]
  - - [8832, 1152, 1, 384]
    - [54, 4844.5]
  - - [32256, 768, 1, 384]
    - [57, 4924.26]
  - - [11904, 1536, 1, 384]
    - [58, 4884.56]
  - - [35712, 1153, 1, 384]
    - [54, 4767.69]
  - - [32256, 1153, 1, 384]
    - [53, 4756.29]
  - - [18432, 1536, 1, 384]
    - [58, 4925.89]
  - - [34560, 3072, 1, 384]
    - [58, 4992.31]
  - - [18816, 2688, 1, 384]
    - [58, 4980.44]
  - - [28800, 1152, 1, 384]
    - [54, 4967.33]
  - - [28416, 1153, 1, 384]
    - [53, 4746.99]
  - - [26112, 1153, 1, 384]
    - [54, 4768.9]
  - - [11520, 2688, 1, 384]
    - [54, 4968.93]
  - - [19584, 3072, 1, 384]
    - [54, 4990.07]
  - - [24960, 1152, 1, 384]
    - [53, 4941.95]
  - - [8448, 3072, 1, 384]
    - [58, 4934.77]
  - - [25344, 1153, 1, 384]
    - [54, 4737.68]
  - - [22272, 2688, 1, 384]
    - [54, 4997.56]
  - - [24960, 2304, 1, 384]
    - [53, 4978.18]
  - - [11520, 768, 1, 384]
    - [58, 4755.58]
  - - [35712, 2688, 1, 384]
    - [54, 5015.3]
  - - [23424, 1152, 1, 384]
    - [54, 4958.67]
  - - [24960, 3072, 1, 384]
    - [58, 4993.05]
  - - [29952, 1920, 1, 384]
    - [54, 5008.35]
  - - [26880, 1920, 1, 384]
    - [54, 4987.49]
  - - [25728, 3072, 1, 384]
    - [58, 4995.52]
  - - [33408, 2688, 1, 384]
    - [54, 5011.23]
  - - [40704, 3072, 1, 384]
    - [54, 5020.07]
  - - [38400, 1152, 1, 384]
    - [54, 4995.51]
  - - [3840, 1152, 1, 384]
    - [79, 4607.0]
  - - [7680, 1153, 1, 384]
    - [53, 4562.99]
  - - [35328, 2688, 1, 384]
    - [54, 5015.72]
  - - [21120, 1536, 1, 384]
    - [54, 4947.29]
  - - [21120, 2688, 1, 384]
    - [54, 4986.85]
  - - [40320, 1153, 1, 384]
    - [54, 4783.53]
  - - [38784, 1152, 1, 384]
    - [54, 4982.34]
  - - [19584, 1920, 1, 384]
    - [54, 4971.73]
  - - [11904, 1152, 1, 384]
    - [53, 4871.01]
  - - [43392, 1920, 1, 384]
    - [54, 5007.9]
  - - [17664, 1536, 1, 384]
    - [54, 4929.34]
  - - [34176, 1920, 1, 384]
    - [54, 5002.6]
  - - [16512, 2688, 1, 384]
    - [54, 4991.73]
  - - [18816, 2304, 1, 384]
    - [54, 4978.77]
  - - [36864, 768, 1, 384]
    - [58, 4945.52]
  - - [14592, 1536, 1, 384]
    - [57, 4917.67]
  - - [11136, 2304, 1, 384]
    - [54, 4927.99]
  - - [9600, 2688, 1, 384]
    - [54, 4942.66]
  - - [13824, 1153, 1, 384]
    - [54, 4659.56]
  - - [9216, 2304, 1, 384]
    - [58, 4909.87]
  - - [3456, 1920, 1, 384]
    - [54, 4778.06]
  - - [14208, 768, 1, 384]
    - [58, 4833.11]
  - - [35712, 768, 1, 384]
    - [53, 4938.25]
  - - [21120, 768, 1, 384]
    - [58, 4857.7]
  - - [4992, 2688, 1, 384]
    - [54, 4838.95]
  - - [16128, 3072, 1, 384]
    - [53, 4973.38]
  - - [41472, 768, 1, 384]
    - [58, 4944.05]
  - - [4992, 1153, 1, 384]
    - [54, 4380.84]
  - - [3072, 1536, 1, 384]
    - [58, 4744.3]
  - - [43392, 3072, 1, 384]
    - [54, 5011.13]
  - - [44160, 1153, 1, 384]
    - [54, 4780.19]
  - - [37632, 1536, 1, 384]
    - [53, 4972.41]
  - - [15744, 1153, 1, 384]
    - [54, 4668.79]
  - - [17664, 768, 1, 384]
    - [54, 4864.53]
  - - [3456, 2304, 1, 384]
    - [58, 4725.6]
  - - [38784, 2304, 1, 384]
    - [54, 5006.74]
  - - [8448, 2688, 1, 384]
    - [54, 4950.25]
  - - [30720, 1153, 1, 384]
    - [54, 4756.85]
  - - [36864, 2304, 1, 384]
    - [54, 4996.22]
  - - [24192, 1536, 1, 384]
    - [58, 4961.97]
  - - [40704, 1920, 1, 384]
    - [54, 5013.97]
  - - [39552, 2688, 1, 384]
    - [54, 5012.93]
  - - [26112, 768, 1, 384]
    - [54, 4898.82]
  - - [29184, 1536, 1, 384]
    - [58, 4965.74]
  - - [12288, 1152, 1, 384]
    - [58, 4860.18]
  - - [32640, 1536, 1, 384]
    - [54, 4977.11]
  - - [5376, 2688, 1, 384]
    - [54, 4891.8]
  - - [13056, 768, 1, 384]
    - [58, 4792.36]
  - - [13824, 2304, 1, 384]
    - [58, 4935.43]
  - - [29952, 768, 1, 384]
    - [54, 4924.85]
  - - [1536, 1152, 1, 384]
    - [72, 4337.83]
  - - [28032, 2304, 1, 384]
    - [53, 4997.69]
  - - [16896, 768, 1, 384]
    - [58, 4850.32]
  - - [30336, 1920, 1, 384]
    - [54, 4993.11]
  - - [27264, 2304, 1, 384]
    - [54, 4996.78]
  - - [39552, 1153, 1, 384]
    - [54, 4779.56]
  - - [7680, 1536, 1, 384]
    - [57, 4825.15]
  - - [30336, 1152, 1, 384]
    - [53, 4968.41]
  - - [30720, 2688, 1, 384]
    - [54, 5003.59]
  - - [37632, 1153, 1, 384]
    - [54, 4761.67]
  - - [1920, 1153, 1, 384]
    - [44, 4410.98]
  - - [36096, 2688, 1, 384]
    - [54, 5005.94]
  - - [5760, 1920, 1, 384]
    - [54, 4789.48]
  - - [39552, 1536, 1, 384]
    - [58, 4980.13]
  - - [40704, 2304, 1, 384]
    - [54, 5007.3]
  - - [9216, 1153, 1, 384]
    - [54, 4581.63]
  - - [43776, 2304, 1, 384]
    - [54, 5018.37]
  - - [27648, 1152, 1, 384]
    - [54, 4975.02]
  - - [31488, 1152, 1, 384]
    - [54, 4966.8]
  - - [39168, 1152, 1, 384]
    - [54, 4993.91]
  - - [42240, 1536, 1, 384]
    - [58, 4989.22]
  - - [20352, 1152, 1, 384]
    - [58, 4919.18]
  - - [8448, 1920, 1, 384]
    - [54, 4868.33]
  - - [32256, 1536, 1, 384]
    - [58, 4973.64]
  - - [25344, 1152, 1, 384]
    - [54, 4952.11]
  - - [21888, 2304, 1, 384]
    - [53, 4979.92]
  - - [44160, 2304, 1, 384]
    - [58, 5006.17]
  - - [30336, 2688, 1, 384]
    - [54, 5003.67]
  - - [14208, 3072, 1, 384]
    - [58, 4960.88]
  - - [6144, 2688, 1, 384]
    - [54, 4907.9]
  - - [39168, 1536, 1, 384]
    - [58, 4985.33]
  - - [11904, 1920, 1, 384]
    - [54, 4911.57]
  - - [31104, 1920, 1, 384]
    - [54, 5006.15]
  - - [8064, 1536, 1, 384]
    - [57, 4812.75]
  - - [22272, 1152, 1, 384]
    - [54, 4946.29]
  - - [21120, 1920, 1, 384]
    - [54, 4983.79]
  - - [29952, 1152, 1, 384]
    - [54, 4972.01]
  - - [22656, 2304, 1, 384]
    - [54, 4996.56]
  - - [9600, 1152, 1, 384]
    - [54, 4791.42]
  - - [19968, 2688, 1, 384]
    - [54, 5002.09]
  - - [22656, 3072, 1, 384]
    - [53, 4993.93]
  - - [10752, 768, 1, 384]
    - [57, 4815.48]
  - - [41856, 768, 1, 384]
    - [54, 4963.18]
  - - [19584, 2688, 1, 384]
    - [54, 4996.85]
  - - [16128, 1153, 1, 384]
    - [54, 4690.92]
  - - [2304, 1152, 1, 384]
    - [70, 4291.81]
  - - [14592, 768, 1, 384]
    - [58, 4803.5]
  - - [24576, 3072, 1, 384]
    - [53, 4985.87]
  - - [14592, 1152, 1, 384]
    - [54, 4921.5]
  - - [18432, 2304, 1, 384]
    - [58, 4958.54]
  - - [9216, 1920, 1, 384]
    - [54, 4935.77]
  - - [31872, 2688, 1, 384]
    - [53, 5014.55]
  - - [41472, 1152, 1, 384]
    - [54, 4987.95]
  - - [14976, 1920, 1, 384]
    - [54, 4957.49]
  - - [13824, 1152, 1, 384]
    - [58, 4870.57]
  - - [33024, 2688, 1, 384]
    - [54, 5014.99]
  - - [43008, 1153, 1, 384]
    - [53, 4774.12]
  - - [1536, 768, 1, 384]
    - [58, 4513.6]
  - - [34176, 1153, 1, 384]
    - [54, 4761.81]
  - - [33024, 2304, 1, 384]
    - [54, 5008.01]
  - - [41856, 1153, 1, 384]
    - [54, 4781.96]
  - - [31488, 1153, 1, 384]
    - [54, 4765.83]
  - - [17280, 768, 1, 384]
    - [54, 4871.78]
  - - [29184, 1153, 1, 384]
    - [54, 4761.81]
  - - [21504, 3072, 1, 384]
    - [54, 4998.14]
  - - [3456, 1153, 1, 384]
    - [43, 4357.92]
  - - [37632, 2688, 1, 384]
    - [54, 5015.73]
  - - [14208, 2688, 1, 384]
    - [54, 4978.95]
  - - [38016, 2304, 1, 384]
    - [54, 5009.7]
  - - [16896, 2688, 1, 384]
    - [54, 4998.03]
  - - [4224, 1153, 1, 384]
    - [53, 4436.77]
  - - [31104, 768, 1, 384]
    - [54, 4937.32]
  - - [41472, 2304, 1, 384]
    - [54, 5011.85]
  - - [10752, 1152, 1, 384]
    - [53, 4835.45]
  - - [9216, 3072, 1, 384]
    - [57, 4928.13]
  - - [23424, 2688, 1, 384]
    - [54, 4997.16]
  - - [18048, 1152, 1, 384]
    - [53, 4933.06]
  - - [39936, 3072, 1, 384]
    - [54, 5007.46]
  - - [10368, 2688, 1, 384]
    - [58, 4951.96]
  - - [26496, 2688, 1, 384]
    - [54, 5010.88]
  - - [16512, 2304, 1, 384]
    - [54, 4977.77]
  - - [31104, 1153, 1, 384]
    - [54, 4761.88]
  - - [9600, 1153, 1, 384]
    - [54, 4598.23]
  - - [16512, 1153, 1, 384]
    - [54, 4701.43]
  - - [11520, 1920, 1, 384]
    - [54, 4923.98]
  - - [39552, 768, 1, 384]
    - [54, 4946.13]
  - - [5376, 1153, 1, 384]
    - [54, 4471.77]
  - - [23808, 1152, 1, 384]
    - [54, 4955.54]
  - - [29568, 3072, 1, 384]
    - [58, 4988.31]
  - - [12672, 2304, 1, 384]
    - [54, 4937.98]
  - - [11136, 768, 1, 384]
    - [54, 4802.78]
  - - [1152, 1152, 1, 384]
    - [65, 3860.67]
  - - [6144, 2304, 1, 384]
    - [53, 4884.29]
  - - [14208, 2304, 1, 384]
    - [54, 4952.69]
  - - [19584, 2304, 1, 384]
    - [54, 4982.82]
  - - [34560, 2688, 1, 384]
    - [54, 5009.37]
  - - [38400, 3072, 1, 384]
    - [54, 5017.18]
  - - [36480, 768, 1, 384]
    - [53, 4934.23]
  - - [15744, 1152, 1, 384]
    - [53, 4883.63]
  - - [15744, 2688, 1, 384]
    - [54, 4982.54]
  - - [39168, 3072, 1, 384]
    - [54, 5013.87]
  - - [14976, 1536, 1, 384]
    - [54, 4920.57]
  - - [6144, 3072, 1, 384]
    - [58, 4887.76]
  - - [31872, 1153, 1, 384]
    - [54, 4770.65]
  - - [24576, 1153, 1, 384]
    - [54, 4744.43]
  - - [41088, 3072, 1, 384]
    - [58, 5002.19]
  - - [34176, 3072, 1, 384]
    - [58, 5001.42]
  - - [6144, 1152, 1, 384]
    - [58, 4818.3]
  - - [33792, 1153, 1, 384]
    - [54, 4772.04]
  - - [1920, 768, 1, 384]
    - [74, 4210.53]
  - - [34560, 1536, 1, 384]
    - [54, 4972.95]
  - - [8448, 2304, 1, 384]
    - [54, 4901.92]
  - - [9984, 2688, 1, 384]
    - [54, 4939.14]
  - - [16512, 1152, 1, 384]
    - [54, 4896.62]
  - - [8064, 1153, 1, 384]
    - [54, 4611.67]
  - - [8064, 768, 1, 384]
    - [54, 4704.03]
  - - [44160, 1152, 1, 384]
    - [54, 4989.47]
  - - [26112, 2688, 1, 384]
    - [54, 5000.26]
  - - [21120, 1152, 1, 384]
    - [54, 4958.4]
  - - [6528, 3072, 1, 384]
    - [54, 4903.31]
  - - [39936, 768, 1, 384]
    - [54, 4946.83]
  - - [20736, 1152, 1, 384]
    - [54, 4955.03]
  - - [19200, 1920, 1, 384]
    - [58, 4968.75]
  - - [38400, 768, 1, 384]
    - [58, 4947.5]
  - - [19200, 1153, 1, 384]
    - [54, 4733.84]
  - - [29952, 3072, 1, 384]
    - [54, 5005.19]
  - - [19200, 2304, 1, 384]
    - [53, 4973.81]
  - - [8448, 1536, 1, 384]
    - [58, 4863.01]
  - - [13824, 1536, 1, 384]
    - [58, 4902.08]
  - - [6912, 1152, 1, 384]
    - [58, 4722.38]
  - - [32640, 768, 1, 384]
    - [54, 4946.11]
  - - [9600, 768, 1, 384]
    - [58, 4743.89]
  - - [29568, 1152, 1, 384]
    - [54, 4970.94]
  - - [34560, 2304, 1, 384]
    - [54, 5003.32]
  - - [10368, 768, 1, 384]
    - [54, 4706.68]
  - - [28800, 1153, 1, 384]
    - [53, 4744.69]
  - - [768, 768, 1, 384]
    - [78, 3482.36]
  - - [2688, 1152, 1, 384]
    - [58, 4580.46]
  - - [20736, 1536, 1, 384]
    - [58, 4937.58]
  - - [19584, 1153, 1, 384]
    - [54, 4733.21]
  - - [28800, 768, 1, 384]
    - [54, 4919.76]
  - - [42240, 768, 1, 384]
    - [54, 4964.33]
  - - [40320, 2304, 1, 384]
    - [53, 4996.6]
  - - [22656, 1153, 1, 384]
    - [54, 4730.71]
  - - [18816, 1153, 1, 384]
    - [54, 4724.3]
  - - [13440, 1153, 1, 384]
    - [54, 4651.66]
  - - [28416, 2688, 1, 384]
    - [58, 5004.98]
  - - [30720, 1920, 1, 384]
    - [54, 4998.82]
  - - [8064, 1152, 1, 384]
    - [58, 4796.25]
  - - [39936, 1536, 1, 384]
    - [54, 4982.15]
  - - [10368, 1536, 1, 384]
    - [53, 4857.73]
  - - [768, 769, 1, 384]
    - [42, 3419.59]
  - - [21888, 1536, 1, 384]
    - [53, 4949.57]
  - - [38784, 2688, 1, 384]
    - [53, 5006.9]
  - - [22272, 3072, 1, 384]
    - [54, 4984.17]
  - - [27648, 2304, 1, 384]
    - [58, 4997.34]
  - - [34944, 1153, 1, 384]
    - [54, 4789.65]
  - - [41088, 2688, 1, 384]
    - [54, 5018.71]
  - - [11136, 1920, 1, 384]
    - [54, 4929.72]
  - - [22656, 1152, 1, 384]
    - [54, 4942.93]
  - - [36864, 1536, 1, 384]
    - [54, 4983.74]
  - - [14592, 1153, 1, 384]
    - [54, 4703.98]
  - - [15744, 3072, 1, 384]
    - [58, 4970.56]
  - - [14976, 1153, 1, 384]
    - [54, 4692.61]
  - - [37248, 768, 1, 384]
    - [58, 4956.36]
  - - [23424, 3072, 1, 384]
    - [58, 4997.56]
  - - [23040, 2688, 1, 384]
    - [54, 4992.59]
  - - [4224, 3072, 1, 384]
    - [58, 4867.95]
  - - [6912, 2304, 1, 384]
    - [54, 4878.5]
  - - [24192, 3072, 1, 384]
    - [58, 4992.8]
  - - [17664, 3072, 1, 384]
    - [54, 4983.33]
  - - [27648, 1153, 1, 384]
    - [54, 4756.01]
  - - [37632, 1920, 1, 384]
    - [54, 5001.9]
  - - [36096, 768, 1, 384]
    - [54, 4957.69]
  - - [4224, 2688, 1, 384]
    - [58, 4850.68]
  - - [40704, 1152, 1, 384]
    - [54, 4978.42]
  - - [8448, 1153, 1, 384]
    - [53, 4621.16]
  - - [7680, 768, 1, 384]
    - [54, 4763.85]
  - - [25344, 3072, 1, 384]
    - [54, 4995.46]
  - - [13440, 3072, 1, 384]
    - [58, 4957.5]
  - - [38016, 1920, 1, 384]
    - [54, 5010.41]
  - - [35712, 2304, 1, 384]
    - [54, 5004.48]
  - - [34560, 1152, 1, 384]
    - [54, 4975.67]
  - - [42240, 1152, 1, 384]
    - [54, 4991.03]
  - - [31872, 3072, 1, 384]
    - [54, 5006.09]
  - - [43008, 3072, 1, 384]
    - [54, 5007.97]
  - - [37248, 2688, 1, 384]
    - [54, 5008.56]
  - - [42624, 1153, 1, 384]
    - [54, 4779.62]
  - - [29568, 1920, 1, 384]
    - [54, 4997.46]
  - - [38400, 2688, 1, 384]
    - [54, 5028.21]
  - - [25728, 768, 1, 384]
    - [53, 4892.89]
  - - [11136, 3072, 1, 384]
    - [54, 4953.38]
  - - [8832, 1920, 1, 384]
    - [53, 4869.19]
  - - [43776, 1920, 1, 384]
    - [54, 5004.77]
  - - [14976, 3072, 1, 384]
    - [53, 4964.71]
  - - [21120, 1153, 1, 384]
    - [53, 4722.78]
  - - [38784, 3072, 1, 384]
    - [58, 5003.44]
  - - [38784, 768, 1, 384]
    - [54, 4953.34]
  - - [36480, 1536, 1, 384]
    - [58, 4979.68]
  - - [15744, 768, 1, 384]
    - [58, 4854.56]
  - - [27264, 1920, 1, 384]
    - [54, 4996.32]
  - - [43392, 1152, 1, 384]
    - [54, 4985.1]
  - - [33792, 2304, 1, 384]
    - [54, 4992.42]
  - - [9984, 1153, 1, 384]
    - [54, 4637.86]
  - - [8832, 2304, 1, 384]
    - [58, 4918.67]
  - - [18432, 3072, 1, 384]
    - [54, 4992.21]
  - - [41088, 1152, 1, 384]
    - [54, 4977.11]
  - - [39168, 2688, 1, 384]
    - [54, 5027.17]
  - - [39936, 1152, 1, 384]
    - [54, 4980.38]
  - - [43776, 1153, 1, 384]
    - [54, 4784.95]
  - - [16512, 3072, 1, 384]
    - [58, 4976.13]
  - - [18816, 1152, 1, 384]
    - [54, 4909.98]
  - - [43776, 1152, 1, 384]
    - [54, 4989.26]
  - - [35328, 1920, 1, 384]
    - [54, 5000.27]
  - - [29952, 1153, 1, 384]
    - [54, 4764.22]
  - - [41856, 1152, 1, 384]
    - [54, 4993.95]
  - - [43008, 1536, 1, 384]
    - [54, 4994.71]
  - - [35328, 2304, 1, 384]
    - [58, 4989.08]
  - - [11520, 1152, 1, 384]
    - [54, 4882.24]
  - - [36864, 1152, 1, 384]
    - [58, 4972.27]
  - - [37248, 2304, 1, 384]
    - [58, 4996.85]
  - - [26880, 3072, 1, 384]
    - [58, 4997.79]
  - - [28032, 1153, 1, 384]
    - [54, 4750.89]
  - - [29184, 768, 1, 384]
    - [54, 4918.57]
  - - [3456, 1152, 1, 384]
    - [70, 4454.1]
  - - [39936, 1153, 1, 384]
    - [53, 4763.76]
  - - [18048, 2688, 1, 384]
    - [54, 4988.01]
  - - [7296, 2688, 1, 384]
    - [54, 4929.62]
  - - [13056, 2304, 1, 384]
    - [54, 4951.53]
  - - [42624, 1536, 1, 384]
    - [58, 4981.58]
  - - [2688, 1536, 1, 384]
    - [82, 4553.79]
  - - [29568, 1153, 1, 384]
    - [54, 4748.11]
  - - [32256, 2688, 1, 384]
    - [54, 5015.97]
  - - [18816, 1536, 1, 384]
    - [53, 4919.82]
  - - [32256, 3072, 1, 384]
    - [54, 5005.99]
  - - [33792, 3072, 1, 384]
    - [54, 5008.65]
  - - [9984, 3072, 1, 384]
    - [54, 4941.1]
  - - [34560, 1153, 1, 384]
    - [54, 4762.85]
  - - [13056, 1536, 1, 384]
    - [58, 4894.21]
  - - [34944, 1536, 1, 384]
    - [54, 4977.25]
  - - [23424, 768, 1, 384]
    - [58, 4900.42]
  - - [38400, 1920, 1, 384]
    - [54, 5014.41]
  - - [15360, 2304, 1, 384]
    - [54, 4941.01]
  - - [27264, 2688, 1, 384]
    - [54, 4997.74]
  - - [11136, 1536, 1, 384]
    - [58, 4862.51]
  - - [5760, 1153, 1, 384]
    - [54, 4539.43]
  - - [41472, 3072, 1, 384]
    - [54, 5016.11]
  - - [23040, 1153, 1, 384]
    - [54, 4738.31]
  - - [12288, 1536, 1, 384]
    - [58, 4905.89]
  - - [6528, 2304, 1, 384]
    - [54, 4860.93]
  - - [25728, 1153, 1, 384]
    - [54, 4744.88]
  - - [30720, 2304, 1, 384]
    - [54, 4997.63]
  - - [24576, 1152, 1, 384]
    - [53, 4944.53]
  - - [4608, 1153, 1, 384]
    - [52, 4445.27]
  - - [4992, 768, 1, 384]
    - [86, 4537.11]
  - - [34944, 2688, 1, 384]
    - [53, 5015.17]
  - - [24960, 2688, 1, 384]
    - [54, 5006.67]
  - - [12672, 3072, 1, 384]
    - [53, 4959.76]
  - - [18432, 1920, 1, 384]
    - [54, 4965.05]
  - - [3840, 2688, 1, 384]
    - [53, 4780.74]
  - - [26496, 1153, 1, 384]
    - [54, 4755.39]
  - - [13824, 1920, 1, 384]
    - [54, 4943.04]
  - - [26880, 1153, 1, 384]
    - [54, 4742.79]
  - - [17280, 2688, 1, 384]
    - [54, 4991.57]
  - - [5376, 3072, 1, 384]
    - [58, 4909.27]
  - - [15360, 1536, 1, 384]
    - [58, 4913.82]
  - - [43776, 2688, 1, 384]
    - [54, 5019.33]
  - - [24960, 1920, 1, 384]
    - [54, 4990.97]
  - - [31872, 768, 1, 384]
    - [54, 4936.78]
  - - [23808, 1153, 1, 384]
    - [54, 4751.73]
  - - [1920, 1152, 1, 384]
    - [44, 4434.77]
  - - [11904, 2688, 1, 384]
    - [54, 4948.94]
  - - [17664, 1152, 1, 384]
    - [53, 4921.27]
  - - [12672, 1153, 1, 384]
    - [54, 4659.93]
  - - [7296, 1152, 1, 384]
    - [54, 4749.42]
  - - [7296, 768, 1, 384]
    - [53, 4618.53]
  - - [1152, 1153, 1, 384]
    - [64, 3859.34]
  - - [27264, 1152, 1, 384]
    - [54, 4970.13]
  - - [19200, 1536, 1, 384]
    - [58, 4924.18]
  - - [11904, 3072, 1, 384]
    - [58, 4934.55]
  - - [37248, 1152, 1, 384]
    - [54, 4983.1]
  - - [20736, 3072, 1, 384]
    - [58, 4980.86]
  - - [11904, 1153, 1, 384]
    - [54, 4648.05]
  - - [12288, 768, 1, 384]
    - [58, 4831.07]
  - - [33792, 768, 1, 384]
    - [54, 4936.33]
  - - [21888, 2688, 1, 384]
    - [54, 4999.3]
  - - [15360, 3072, 1, 384]
    - [54, 4967.21]
  - - [2688, 1920, 1, 384]
    - [82, 4611.87]
  - - [21504, 1536, 1, 384]
    - [58, 4947.64]
  - - [19968, 768, 1, 384]
    - [58, 4886.98]
  - - [4608, 3072, 1, 384]
    - [58, 4872.38]
  - - [35328, 1152, 1, 384]
    - [54, 4964.92]
  - - [34176, 1152, 1, 384]
    - [54, 4976.68]
  - - [42624, 3072, 1, 384]
    - [54, 5009.18]
  - - [19200, 2688, 1, 384]
    - [58, 4986.14]
  - - [31104, 3072, 1, 384]
    - [58, 5003.6]
  - - [31488, 2304, 1, 384]
    - [54, 4993.86]
  - - [35712, 3072, 1, 384]
    - [58, 5009.56]
  - - [18432, 1153, 1, 384]
    - [54, 4706.24]
  - - [12288, 2688, 1, 384]
    - [53, 4956.38]
  - - [21120, 3072, 1, 384]
    - [58, 4982.52]
  - - [12288, 2304, 1, 384]
    - [53, 4931.88]
  - - [28416, 768, 1, 384]
    - [54, 4916.82]
  - - [33408, 3072, 1, 384]
    - [54, 4993.68]
  - - [27264, 1536, 1, 384]
    - [54, 4969.03]
  - - [12672, 1152, 1, 384]
    - [53, 4858.29]
  - - [28416, 1152, 1, 384]
    - [54, 4961.14]
  - - [6528, 1153, 1, 384]
    - [53, 4587.46]
  - - [34944, 1152, 1, 384]
    - [58, 4972.63]
  - - [34560, 768, 1, 384]
    - [54, 4949.96]
  - - [31488, 3072, 1, 384]
    - [54, 5005.47]
  - - [39936, 2688, 1, 384]
    - [54, 5028.3]
  - - [8064, 1920, 1, 384]
    - [53, 4871.23]
  - - [13056, 1153, 1, 384]
    - [54, 4697.06]
  - - [9984, 1152, 1, 384]
    - [54, 4816.36]
  - - [26880, 1536, 1, 384]
    - [54, 4961.16]
  - - [28032, 2688, 1, 384]
    - [54, 5015.88]
  - - [7296, 3072, 1, 384]
    - [54, 4921.05]
  - - [41472, 2688, 1, 384]
    - [54, 5028.2]
  - - [29568, 2688, 1, 384]
    - [54, 5009.14]
  - - [37248, 1920, 1, 384]
    - [54, 4999.35]
  - - [6912, 2688, 1, 384]
    - [54, 4884.78]
  - - [33024, 1152, 1, 384]
    - [54, 4976.89]
  - - [31104, 1152, 1, 384]
    - [54, 4969.95]
  - - [31104, 2688, 1, 384]
    - [54, 5015.92]
  - - [5376, 1920, 1, 384]
    - [53, 4786.52]
  - - [21888, 1152, 1, 384]
    - [54, 4936.25]
  - - [40320, 1920, 1, 384]
    - [54, 4991.36]
  - - [41856, 3072, 1, 384]
    - [58, 5015.47]
  - - [37248, 3072, 1, 384]
    - [58, 5002.66]
  - - [41856, 2688, 1, 384]
    - [54, 5020.04]
  - - [14208, 1153, 1, 384]
    - [53, 4687.64]
  - - [9984, 768, 1, 384]
    - [58, 4729.51]
  - - [3456, 2688, 1, 384]
    - [58, 4804.52]
  - - [41088, 1153, 1, 384]
    - [54, 4777.86]
  - - [13056, 1152, 1, 384]
    - [54, 4846.24]
  - - [32256, 1152, 1, 384]
    - [54, 4982.06]
  - - [6912, 3072, 1, 384]
    - [58, 4906.92]
  - - [14976, 1152, 1, 384]
    - [54, 4920.46]
  - - [21888, 3072, 1, 384]
    - [54, 4980.16]
  - - [1536, 1153, 1, 384]
    - [44, 4196.91]
  - - [27648, 1536, 1, 384]
    - [54, 4974.7]
  - - [35712, 1152, 1, 384]
    - [53, 4970.19]
  - - [43392, 2688, 1, 384]
    - [54, 5026.27]
  - - [13824, 3072, 1, 384]
    - [58, 4953.54]
  - - [36480, 1920, 1, 384]
    - [54, 5012.07]
  - - [36480, 3072, 1, 384]
    - [54, 4997.05]
  - - [29568, 1536, 1, 384]
    - [58, 4970.85]
  - - [33792, 1152, 1, 384]
    - [53, 4980.04]
  - - [36864, 2688, 1, 384]
    - [54, 5010.21]
  - - [23808, 768, 1, 384]
    - [54, 4895.19]
  - - [42624, 1152, 1, 384]
    - [54, 4985.64]
  - - [8448, 1152, 1, 384]
    - [53, 4837.08]
  - - [29568, 768, 1, 384]
    - [58, 4926.64]
  - - [2304, 768, 1, 384]
    - [67, 4308.13]
  - - [33024, 1153, 1, 384]
    - [53, 4765.11]
  - - [12672, 768, 1, 384]
    - [58, 4817.37]
  - - [15744, 2304, 1, 384]
    - [54, 4966.59]
  - - [36096, 1281, 1, 256]
    - [110, 4683.17]
  - - [24064, 3072, 1, 256]
    - [114, 4851.14]
  - - [256, 512, 1, 256]
    - [116, 1414.61]
  - - [40960, 27648, 1, 256]
    - [114, 4902.92]
  - - [11264, 1792, 1, 256]
    - [108, 4758.35]
  - - [31744, 3072, 1, 256]
    - [114, 4868.69]
  - - [13056, 1792, 1, 256]
    - [108, 4791.73]
  - - [35328, 22785, 1, 256]
    - [108, 4897.3]
  - - [28160, 15872, 1, 256]
    - [114, 4899.76]
  - - [39168, 1792, 1, 256]
    - [108, 4885.16]
  - - [2560, 2561, 1, 256]
    - [131, 4340.93]
  - - [35328, 1536, 1, 256]
    - [114, 4847.55]
  - - [37376, 3072, 1, 256]
    - [114, 4882.7]
  - - [23808, 11265, 1, 256]
    - [114, 4835.04]
  - - [27136, 1280, 1, 256]
    - [108, 4838.67]
  - - [28928, 3072, 1, 256]
    - [114, 4869.62]
  - - [13568, 1792, 1, 256]
    - [108, 4783.98]
  - - [16640, 4353, 1, 256]
    - [108, 4801.52]
  - - [33792, 1280, 1, 256]
    - [108, 4864.07]
  - - [38912, 26624, 1, 256]
    - [114, 4904.43]
  - - [6912, 3585, 1, 256]
    - [114, 4655.89]
  - - [32768, 1792, 1, 256]
    - [108, 4881.15]
  - - [30976, 18688, 1, 256]
    - [108, 4927.99]
  - - [512, 2048, 1, 256]
    - [101, 3956.89]
  - - [10496, 3072, 1, 256]
    - [114, 4799.18]
  - - [15872, 3584, 1, 256]
    - [114, 4836.6]
  - - [6400, 1792, 1, 256]
    - [114, 4632.11]
  - - [39680, 27393, 1, 256]
    - [108, 4914.19]
  - - [36864, 24577, 1, 256]
    - [114, 4847.19]
  - - [38400, 1280, 1, 256]
    - [108, 4877.02]
  - - [26112, 1536, 1, 256]
    - [114, 4828.11]
  - - [26368, 1536, 1, 256]
    - [114, 4811.11]
  - - [16896, 4353, 1, 256]
    - [108, 4789.47]
  - - [14336, 1793, 1, 256]
    - [108, 4611.18]
  - - [1280, 1025, 1, 256]
    - [94, 3505.98]
  - - [3840, 3072, 1, 256]
    - [114, 4640.01]
  - - [2560, 3072, 1, 256]
    - [121, 4517.7]
  - - [6656, 1536, 1, 256]
    - [131, 4559.98]
  - - [27136, 1792, 1, 256]
    - [108, 4865.58]
  - - [43776, 3072, 1, 256]
    - [114, 4875.0]
  - - [23296, 1792, 1, 256]
    - [108, 4851.68]
  - - [11264, 7937, 1, 256]
    - [108, 4828.6]
  - - [768, 3072, 1, 256]
    - [108, 4361.5]
  - - [6912, 3841, 1, 256]
    - [108, 4732.31]
  - - [40960, 769, 1, 256]
    - [108, 4446.94]
  - - [39680, 1281, 1, 256]
    - [111, 4677.39]
  - - [9984, 1280, 1, 256]
    - [108, 4687.58]
  - - [41984, 1536, 1, 256]
    - [114, 4854.32]
  - - [34304, 1281, 1, 256]
    - [105, 4683.32]
  - - [11264, 8192, 1, 256]
    - [114, 4859.68]
  - - [6400, 3072, 1, 256]
    - [114, 4706.18]
  - - [40448, 9216, 1, 256]
    - [114, 4897.2]
  - - [7680, 4353, 1, 256]
    - [108, 4741.99]
  - - [23296, 3072, 1, 256]
    - [114, 4842.7]
  - - [7936, 4609, 1, 256]
    - [114, 4702.55]
  - - [20736, 8448, 1, 256]
    - [108, 4916.88]
  - - [17408, 1792, 1, 256]
    - [108, 4832.36]
  - - [768, 1024, 1, 256]
    - [123, 3850.93]
  - - [1792, 1793, 1, 256]
    - [121, 4123.43]
  - - [38656, 3072, 1, 256]
    - [114, 4884.75]
  - - [12544, 9216, 1, 256]
    - [114, 4868.88]
  - - [28160, 1792, 1, 256]
    - [108, 4872.39]
  - - [13824, 3072, 1, 256]
    - [114, 4830.29]
  - - [42752, 1792, 1, 256]
    - [108, 4892.09]
  - - [35584, 23041, 1, 256]
    - [114, 4844.43]
  - - [13056, 3072, 1, 256]
    - [114, 4819.5]
  - - [2048, 2048, 1, 256]
    - [121, 4396.26]
  - - [37888, 768, 1, 256]
    - [108, 4813.19]
  - - [42752, 1281, 1, 256]
    - [111, 4695.66]
  - - [19456, 3072, 1, 256]
    - [114, 4838.24]
  - - [15872, 9216, 1, 256]
    - [114, 4875.14]
  - - [30976, 1792, 1, 256]
    - [108, 4883.06]
  - - [26368, 14081, 1, 256]
    - [108, 4892.51]
  - - [21760, 1281, 1, 256]
    - [110, 4634.78]
  - - [35328, 23041, 1, 256]
    - [114, 4847.66]
  - - [16128, 1280, 1, 256]
    - [108, 4776.25]
  - - [22528, 1281, 1, 256]
    - [111, 4638.44]
  - - [27648, 15105, 1, 256]
    - [108, 4884.37]
  - - [25856, 13568, 1, 256]
    - [108, 4932.23]
  - - [36864, 768, 1, 256]
    - [108, 4832.35]
  - - [23296, 9216, 1, 256]
    - [114, 4887.25]
  - - [32000, 1281, 1, 256]
    - [111, 4669.37]
  - - [18176, 1281, 1, 256]
    - [111, 4617.16]
  - - [2048, 1024, 1, 256]
    - [98, 4125.98]
  - - [21248, 1280, 1, 256]
    - [108, 4810.91]
  - - [19712, 1281, 1, 256]
    - [111, 4627.92]
  - - [12032, 1792, 1, 256]
    - [108, 4771.69]
  - - [23040, 3072, 1, 256]
    - [114, 4858.63]
  - - [11520, 1536, 1, 256]
    - [114, 4718.0]
  - - [16128, 768, 1, 256]
    - [108, 4684.85]
  - - [15360, 3072, 1, 256]
    - [114, 4834.08]
  - - [38912, 26369, 1, 256]
    - [108, 4892.03]
  - - [25344, 13056, 1, 256]
    - [108, 4931.37]
  - - [39168, 26880, 1, 256]
    - [108, 4936.42]
  - - [39424, 768, 1, 256]
    - [108, 4807.05]
  - - [16384, 1280, 1, 256]
    - [108, 4748.04]
  - - [10496, 1792, 1, 256]
    - [108, 4758.53]
  - - [28672, 3072, 1, 256]
    - [114, 4861.49]
  - - [5888, 1280, 1, 256]
    - [131, 4520.57]
  - - [27392, 768, 1, 256]
    - [108, 4783.53]
  - - [39680, 768, 1, 256]
    - [108, 4820.21]
  - - [11520, 8193, 1, 256]
    - [114, 4790.5]
  - - [17408, 4865, 1, 256]
    - [108, 4802.67]
  - - [35840, 1281, 1, 256]
    - [111, 4680.1]
  - - [14080, 1537, 1, 256]
    - [114, 4529.17]
  - - [29184, 768, 1, 256]
    - [114, 4792.21]
  - - [2560, 1280, 1, 256]
    - [121, 4244.39]
  - - [19200, 6913, 1, 256]
    - [108, 4858.08]
  - - [33536, 9216, 1, 256]
    - [114, 4892.07]
  - - [5632, 3072, 1, 256]
    - [114, 4691.54]
  - - [32768, 20480, 1, 256]
    - [114, 4898.68]
  - - [29440, 9216, 1, 256]
    - [114, 4893.91]
  - - [40960, 1792, 1, 256]
    - [108, 4890.71]
  - - [10240, 3072, 1, 256]
    - [114, 4785.4]
  - - [20992, 1792, 1, 256]
    - [108, 4846.76]
  - - [42240, 9216, 1, 256]
    - [114, 4898.87]
  - - [19200, 6912, 1, 256]
    - [108, 4915.74]
  - - [8704, 1280, 1, 256]
    - [108, 4637.3]
  - - [27392, 1792, 1, 256]
    - [108, 4871.35]
  - - [2048, 2049, 1, 256]
    - [115, 4209.52]
  - - [42496, 1536, 1, 256]
    - [114, 4850.99]
  - - [29440, 16897, 1, 256]
    - [114, 4832.96]
  - - [3584, 768, 1, 256]
    - [131, 4159.65]
  - - [20480, 8192, 1, 256]
    - [114, 4881.84]
  - - [15360, 1536, 1, 256]
    - [114, 4761.75]
  - - [11264, 8193, 1, 256]
    - [114, 4782.28]
  - - [19968, 1281, 1, 256]
    - [111, 4632.3]
  - - [26880, 14337, 1, 256]
    - [114, 4829.69]
  - - [28928, 16641, 1, 256]
    - [108, 4900.64]
  - - [15360, 2817, 1, 256]
    - [108, 4725.8]
  - - [15616, 1280, 1, 256]
    - [108, 4780.15]
  - - [1536, 1537, 1, 256]
    - [129, 3915.35]
  - - [44288, 1536, 1, 256]
    - [114, 4849.23]
  - - [7936, 1536, 1, 256]
    - [114, 4620.04]
  - - [18176, 5633, 1, 256]
    - [114, 4777.6]
  - - [44032, 1280, 1, 256]
    - [108, 4879.8]
  - - [8448, 3072, 1, 256]
    - [114, 4777.22]
  - - [17920, 5632, 1, 256]
    - [114, 4863.73]
  - - [3328, 1281, 1, 256]
    - [108, 4152.86]
  - - [22528, 10240, 1, 256]
    - [114, 4885.18]
  - - [1792, 2048, 1, 256]
    - [126, 4353.68]
  - - [25600, 1536, 1, 256]
    - [114, 4819.84]
  - - [38400, 1281, 1, 256]
    - [111, 4685.22]
  - - [39936, 3072, 1, 256]
    - [114, 4880.74]
  - - [7168, 4096, 1, 256]
    - [114, 4771.7]
  - - [10240, 768, 1, 256]
    - [131, 4532.34]
  - - [41216, 1280, 1, 256]
    - [108, 4876.53]
  - - [35328, 3072, 1, 256]
    - [114, 4872.89]
  - - [20480, 3072, 1, 256]
    - [114, 4844.01]
  - - [24832, 1792, 1, 256]
    - [108, 4848.04]
  - - [4352, 1280, 1, 256]
    - [114, 4381.42]
  - - [37376, 25088, 1, 256]
    - [114, 4899.56]
  - - [7168, 4097, 1, 256]
    - [114, 4683.2]
  - - [21504, 768, 1, 256]
    - [108, 4749.76]
  - - [13312, 3072, 1, 256]
    - [114, 4819.62]
  - - [35072, 768, 1, 256]
    - [114, 4797.96]
  - - [40960, 1025, 1, 256]
    - [111, 4541.8]
  - - [26880, 1280, 1, 256]
    - [108, 4839.8]
  - - [12032, 1536, 1, 256]
    - [114, 4727.39]
  - - [9216, 768, 1, 256]
    - [114, 4620.41]
  - - [44288, 27648, 1, 256]
    - [114, 4905.93]
  - - [23808, 1280, 1, 256]
    - [114, 4821.63]
  - - [32512, 1792, 1, 256]
    - [108, 4879.65]
  - - [23808, 11520, 1, 256]
    - [108, 4929.53]
  - - [12032, 1281, 1, 256]
    - [111, 4563.85]
  - - [25600, 13057, 1, 256]
    - [108, 4873.35]
  - - [31744, 1281, 1, 256]
    - [104, 4676.38]
  - - [12032, 1280, 1, 256]
    - [108, 4710.22]
  - - [30208, 1281, 1, 256]
    - [110, 4661.17]
  - - [40448, 1792, 1, 256]
    - [108, 4894.44]
  - - [25088, 12800, 1, 256]
    - [114, 4890.29]
  - - [22784, 10496, 1, 256]
    - [108, 4928.02]
  - - [38400, 26113, 1, 256]
    - [114, 4838.12]
  - - [9728, 3072, 1, 256]
    - [114, 4781.15]
  - - [20736, 1792, 1, 256]
    - [108, 4843.72]
  - - [11776, 1280, 1, 256]
    - [108, 4699.39]
  - - [7680, 3072, 1, 256]
    - [114, 4763.85]
  - - [5376, 2305, 1, 256]
    - [108, 4543.24]
  - - [6912, 3840, 1, 256]
    - [108, 4808.62]
  - - [12800, 3072, 1, 256]
    - [114, 4814.67]
  - - [43520, 3584, 1, 256]
    - [114, 4883.13]
  - - [12288, 3072, 1, 256]
    - [114, 4811.73]
  - - [12800, 1536, 1, 256]
    - [114, 4718.36]
  - - [21504, 8961, 1, 256]
    - [108, 4860.76]
  - - [19456, 1281, 1, 256]
    - [105, 4630.4]
  - - [2816, 2816, 1, 256]
    - [108, 4514.02]
  - - [39680, 9216, 1, 256]
    - [114, 4895.08]
  - - [18432, 1281, 1, 256]
    - [111, 4622.04]
  - - [33024, 9216, 1, 256]
    - [114, 4895.78]
  - - [3584, 513, 1, 256]
    - [98, 3686.41]
  - - [5888, 1281, 1, 256]
    - [111, 4384.4]
  - - [1280, 3072, 1, 256]
    - [121, 4414.29]
  - - [13056, 9216, 1, 256]
    - [114, 4881.89]
  - - [22016, 768, 1, 256]
    - [114, 4737.67]
  - - [33024, 1536, 1, 256]
    - [114, 4841.75]
  - - [36352, 1281, 1, 256]
    - [105, 4681.64]
  - - [26880, 9216, 1, 256]
    - [114, 4890.32]
  - - [23552, 1792, 1, 256]
    - [108, 4852.22]
  - - [38144, 1792, 1, 256]
    - [108, 4883.36]
  - - [44032, 27648, 1, 256]
    - [114, 4897.71]
  - - [7680, 768, 1, 256]
    - [108, 4580.05]
  - - [32000, 19712, 1, 256]
    - [108, 4930.66]
  - - [26880, 14593, 1, 256]
    - [108, 4893.08]
  - - [24064, 9216, 1, 256]
    - [114, 4879.56]
  - - [39424, 26881, 1, 256]
    - [108, 4894.82]
  - - [27392, 3072, 1, 256]
    - [114, 4860.99]
  - - [43264, 9216, 1, 256]
    - [114, 4890.94]
  - - [10752, 1792, 1, 256]
    - [108, 4770.31]
  - - [8960, 5633, 1, 256]
    - [114, 4735.37]
  - - [5120, 2048, 1, 256]
    - [114, 4624.37]
  - - [34560, 3072, 1, 256]
    - [114, 4876.85]
  - - [23808, 9216, 1, 256]
    - [114, 4888.51]
  - - [29696, 17153, 1, 256]
    - [108, 4893.72]
  - - [2560, 2305, 1, 256]
    - [108, 4317.5]
  - - [11776, 1536, 1, 256]
    - [114, 4698.36]
  - - [13568, 1536, 1, 256]
    - [114, 4741.69]
  - - [25856, 1792, 1, 256]
    - [108, 4873.73]
  - - [35072, 1281, 1, 256]
    - [111, 4681.22]
  - - [30208, 9216, 1, 256]
    - [114, 4891.99]
  - - [9728, 6656, 1, 256]
    - [114, 4845.11]
  - - [36608, 1536, 1, 256]
    - [114, 4836.59]
  - - [44288, 1280, 1, 256]
    - [108, 4879.26]
  - - [12800, 513, 1, 256]
    - [111, 4135.5]
  - - [7680, 1792, 1, 256]
    - [108, 4740.09]
  - - [42496, 2305, 1, 256]
    - [108, 4745.94]
  - - [37376, 1536, 1, 256]
    - [114, 4826.61]
  - - [20224, 1792, 1, 256]
    - [108, 4837.13]
  - - [43520, 1536, 1, 256]
    - [114, 4846.54]
  - - [9216, 1536, 1, 256]
    - [114, 4684.68]
  - - [1536, 1281, 1, 256]
    - [119, 3926.65]
  - - [26368, 768, 1, 256]
    - [114, 4763.28]
  - - [18176, 3072, 1, 256]
    - [114, 4836.18]
  - - [24320, 12033, 1, 256]
    - [108, 4887.2]
  - - [17408, 9216, 1, 256]
    - [114, 4877.42]
  - - [36352, 1792, 1, 256]
    - [108, 4879.61]
  - - [24832, 768, 1, 256]
    - [108, 4756.41]
  - - [20992, 8705, 1, 256]
    - [114, 4805.78]
  - - [19712, 7424, 1, 256]
    - [108, 4918.38]
  - - [38144, 768, 1, 256]
    - [108, 4817.45]
  - - [24576, 1280, 1, 256]
    - [108, 4838.3]
  - - [33536, 1536, 1, 256]
    - [114, 4837.31]
  - - [7168, 1281, 1, 256]
    - [110, 4466.53]
  - - [10752, 1536, 1, 256]
    - [114, 4673.11]
  - - [29696, 1280, 1, 256]
    - [108, 4849.39]
  - - [4096, 3072, 1, 256]
    - [114, 4622.36]
  - - [29696, 17409, 1, 256]
    - [114, 4835.93]
  - - [5888, 2816, 1, 256]
    - [108, 4715.85]
  - - [36352, 1280, 1, 256]
    - [108, 4856.26]
  - - [10240, 6913, 1, 256]
    - [108, 4802.01]
  - - [17408, 1536, 1, 256]
    - [114, 4774.5]
  - - [18944, 1536, 1, 256]
    - [114, 4789.79]
  - - [38656, 26113, 1, 256]
    - [114, 4842.22]
  - - [37376, 25089, 1, 256]
    - [114, 4840.42]
  - - [38400, 1536, 1, 256]
    - [114, 4837.72]
  - - [8448, 1792, 1, 256]
    - [108, 4718.67]
  - - [13056, 769, 1, 256]
    - [114, 4309.04]
  - - [24320, 11777, 1, 256]
    - [114, 4822.9]
  - - [5376, 2048, 1, 256]
    - [108, 4603.71]
  - - [17664, 9216, 1, 256]
    - [114, 4886.38]
  - - [8192, 4865, 1, 256]
    - [108, 4751.52]
  - - [17920, 1792, 1, 256]
    - [108, 4836.35]
  - - [32000, 19713, 1, 256]
    - [108, 4907.57]
  - - [8960, 768, 1, 256]
    - [108, 4526.69]
  - - [31232, 3072, 1, 256]
    - [114, 4864.43]
  - - [23296, 1280, 1, 256]
    - [108, 4823.96]
  - - [12544, 257, 1, 256]
    - [110, 3602.02]
  - - [43776, 3585, 1, 256]
    - [114, 4765.28]
  - - [11008, 1792, 1, 256]
    - [108, 4749.04]
  - - [27648, 1281, 1, 256]
    - [111, 4673.11]
  - - [27648, 1536, 1, 256]
    - [114, 4826.95]
  - - [29696, 17408, 1, 256]
    - [114, 4900.8]
  - - [2560, 1281, 1, 256]
    - [111, 4135.55]
  - - [4096, 768, 1, 256]
    - [121, 4303.7]
  - - [34560, 22272, 1, 256]
    - [108, 4940.76]
  - - [38656, 1281, 1, 256]
    - [111, 4695.98]
  - - [256, 2048, 1, 256]
    - [118, 3611.89]
  - - [32768, 20481, 1, 256]
    - [114, 4844.52]
  - - [14336, 3072, 1, 256]
    - [114, 4824.09]
  - - [2304, 2049, 1, 256]
    - [131, 4226.29]
  - - [19456, 7168, 1, 256]
    - [114, 4884.49]
  - - [13312, 9216, 1, 256]
    - [114, 4860.1]
  - - [10496, 7424, 1, 256]
    - [108, 4892.79]
  - - [22272, 768, 1, 256]
    - [108, 4747.24]
  - - [24064, 1792, 1, 256]
    - [108, 4850.1]
  - - [16896, 1792, 1, 256]
    - [108, 4830.53]
  - - [27904, 15616, 1, 256]
    - [108, 4921.71]
  - - [37888, 3072, 1, 256]
    - [114, 4871.17]
  - - [512, 257, 1, 256]
    - [118, 1382.82]
  - - [36096, 1792, 1, 256]
    - [108, 4891.04]
  - - [13056, 513, 1, 256]
    - [110, 4173.45]
  - - [12544, 768, 1, 256]
    - [114, 4615.34]
  - - [36608, 24065, 1, 256]
    - [114, 4840.03]
  - - [40704, 3072, 1, 256]
    - [114, 4888.03]
  - - [28928, 16640, 1, 256]
    - [108, 4934.13]
  - - [24576, 12288, 1, 256]
    - [114, 4898.05]
  - - [13056, 1536, 1, 256]
    - [114, 4747.92]
  - - [2304, 1024, 1, 256]
    - [108, 4309.22]
  - - [33280, 9216, 1, 256]
    - [114, 4891.76]
  - - [18944, 1280, 1, 256]
    - [108, 4790.38]
  - - [17152, 3072, 1, 256]
    - [114, 4836.94]
  - - [17152, 4864, 1, 256]
    - [108, 4889.87]
  - - [6912, 1280, 1, 256]
    - [114, 4604.26]
  - - [34304, 768, 1, 256]
    - [108, 4814.29]
  - - [13568, 1280, 1, 256]
    - [108, 4733.57]
  - - [32768, 768, 1, 256]
    - [108, 4804.93]
  - - [42496, 9216, 1, 256]
    - [114, 4886.31]
  - - [2304, 1280, 1, 256]
    - [108, 4251.95]
  - - [32256, 768, 1, 256]
    - [108, 4784.81]
  - - [4352, 1792, 1, 256]
    - [108, 4604.02]
  - - [5632, 768, 1, 256]
    - [131, 4336.9]
  - - [40704, 513, 1, 256]
    - [110, 4413.45]
  - - [30464, 1280, 1, 256]
    - [108, 4841.8]
  - - [27392, 1281, 1, 256]
    - [111, 4664.95]
  - - [22016, 1281, 1, 256]
    - [111, 4651.0]
  - - [20736, 768, 1, 256]
    - [108, 4729.1]
  - - [19712, 768, 1, 256]
    - [108, 4712.01]
  - - [33536, 20993, 1, 256]
    - [114, 4834.34]
  - - [11520, 8448, 1, 256]
    - [108, 4902.51]
  - - [25088, 1792, 1, 256]
    - [108, 4857.58]
  - - [2816, 3072, 1, 256]
    - [121, 4520.32]
  - - [3584, 3072, 1, 256]
    - [114, 4597.1]
  - - [4608, 1537, 1, 256]
    - [114, 4345.93]
  - - [24832, 1280, 1, 256]
    - [108, 4828.36]
  - - [44032, 9216, 1, 256]
    - [114, 4893.46]
  - - [33792, 21249, 1, 256]
    - [108, 4899.04]
  - - [15360, 1792, 1, 256]
    - [114, 4811.56]
  - - [16384, 768, 1, 256]
    - [108, 4673.05]
  - - [29184, 1280, 1, 256]
    - [108, 4853.93]
  - - [32512, 20225, 1, 256]
    - [108, 4902.47]
  - - [6400, 1281, 1, 256]
    - [108, 4398.88]
  - - [38656, 9216, 1, 256]
    - [114, 4902.8]
  - - [17664, 5377, 1, 256]
    - [108, 4837.32]
  - - [19456, 7169, 1, 256]
    - [114, 4793.95]
  - - [8448, 5121, 1, 256]
    - [114, 4725.93]
  - - [23040, 9216, 1, 256]
    - [114, 4887.59]
  - - [29440, 17152, 1, 256]
    - [108, 4934.14]
  - - [18688, 1281, 1, 256]
    - [111, 4631.27]
  - - [40448, 513, 1, 256]
    - [111, 4409.87]
  - - [41472, 1792, 1, 256]
    - [108, 4896.83]
  - - [17920, 3072, 1, 256]
    - [114, 4836.86]
  - - [30976, 768, 1, 256]
    - [108, 4790.55]
  - - [43008, 9216, 1, 256]
    - [114, 4901.51]
  - - [6144, 3072, 1, 256]
    - [114, 4723.02]
  - - [35072, 9216, 1, 256]
    - [114, 4891.49]
  - - [34816, 22273, 1, 256]
    - [108, 4892.51]
  - - [37120, 768, 1, 256]
    - [108, 4812.77]
  - - [35072, 22785, 1, 256]
    - [108, 4901.44]
  - - [23296, 1281, 1, 256]
    - [111, 4646.96]
  - - [39168, 9216, 1, 256]
    - [114, 4897.2]
  - - [35840, 1536, 1, 256]
    - [114, 4841.78]
  - - [42752, 2817, 1, 256]
    - [108, 4797.21]
  - - [11776, 3072, 1, 256]
    - [114, 4794.78]
  - - [17152, 1536, 1, 256]
    - [114, 4774.35]
  - - [24832, 12289, 1, 256]
    - [114, 4823.09]
  - - [22272, 1281, 1, 256]
    - [105, 4640.39]
  - - [6656, 3329, 1, 256]
    - [108, 4653.02]
  - - [24576, 12033, 1, 256]
    - [108, 4874.31]
  - - [6400, 1536, 1, 256]
    - [114, 4559.03]
  - - [32512, 3072, 1, 256]
    - [114, 4867.81]
  - - [13056, 1281, 1, 256]
    - [110, 4562.98]
  - - [30976, 3072, 1, 256]
    - [114, 4860.63]
  - - [22016, 9473, 1, 256]
    - [108, 4855.58]
  - - [19968, 1792, 1, 256]
    - [108, 4844.8]
  - - [29440, 3072, 1, 256]
    - [114, 4856.15]
  - - [15872, 1280, 1, 256]
    - [108, 4759.28]
  - - [27904, 1280, 1, 256]
    - [108, 4836.85]
  - - [43776, 3840, 1, 256]
    - [108, 4923.43]
  - - [41472, 768, 1, 256]
    - [108, 4838.66]
  - - [8192, 1792, 1, 256]
    - [108, 4690.12]
  - - [35840, 3072, 1, 256]
    - [114, 4873.45]
  - - [8704, 3072, 1, 256]
    - [114, 4761.75]
  - - [36864, 1280, 1, 256]
    - [108, 4863.2]
  - - [9728, 1792, 1, 256]
    - [108, 4736.31]
  - - [38144, 1281, 1, 256]
    - [110, 4690.14]
  - - [22272, 9729, 1, 256]
    - [114, 4813.35]
  - - [21504, 1281, 1, 256]
    - [111, 4643.1]
  - - [32768, 3072, 1, 256]
    - [114, 4867.19]
  - - [3072, 2048, 1, 256]
    - [114, 4566.27]
  - - [36864, 24576, 1, 256]
    - [114, 4903.25]
  - - [31232, 1281, 1, 256]
    - [111, 4674.37]
  - - [14080, 768, 1, 256]
    - [108, 4652.82]
  - - [9984, 1536, 1, 256]
    - [114, 4692.65]
  - - [11520, 1792, 1, 256]
    - [108, 4777.98]
  - - [12032, 8961, 1, 256]
    - [108, 4852.6]
  - - [4352, 768, 1, 256]
    - [121, 4281.62]
  - - [38400, 25857, 1, 256]
    - [108, 4897.25]
  - - [20224, 7937, 1, 256]
    - [108, 4859.3]
  - - [34304, 21761, 1, 256]
    - [108, 4892.21]
  - - [30720, 18432, 1, 256]
    - [114, 4899.21]
  - - [31744, 9216, 1, 256]
    - [114, 4889.27]
  - - [27136, 14848, 1, 256]
    - [114, 4882.42]
  - - [34048, 9216, 1, 256]
    - [114, 4894.39]
  - - [3584, 257, 1, 256]
    - [96, 3504.73]
  - - [18688, 6145, 1, 256]
    - [114, 4780.18]
  - - [24320, 1280, 1, 256]
    - [108, 4828.99]
  - - [36096, 768, 1, 256]
    - [108, 4816.07]
  - - [7168, 1536, 1, 256]
    - [114, 4589.61]
  - - [36608, 9216, 1, 256]
    - [114, 4889.4]
  - - [14848, 1792, 1, 256]
    - [108, 4790.66]
  - - [35584, 9216, 1, 256]
    - [114, 4887.44]
  - - [29952, 17664, 1, 256]
    - [108, 4929.28]
  - - [34816, 1792, 1, 256]
    - [108, 4871.33]
  - - [38912, 1280, 1, 256]
    - [108, 4864.3]
  - - [24064, 11776, 1, 256]
    - [114, 4879.99]
  - - [11264, 1280, 1, 256]
    - [108, 4714.39]
  - - [34048, 1792, 1, 256]
    - [108, 4879.05]
  - - [5376, 1792, 1, 256]
    - [108, 4617.06]
  - - [6656, 1281, 1, 256]
    - [111, 4424.96]
  - - [40448, 3072, 1, 256]
    - [114, 4886.15]
  - - [18688, 6401, 1, 256]
    - [108, 4845.17]
  - - [20480, 1536, 1, 256]
    - [114, 4788.82]
  - - [18432, 3072, 1, 256]
    - [114, 4849.62]
  - - [20224, 768, 1, 256]
    - [114, 4724.12]
  - - [32512, 9216, 1, 256]
    - [114, 4888.11]
  - - [14080, 1281, 1, 256]
    - [111, 4575.97]
  - - [10496, 1281, 1, 256]
    - [111, 4546.2]
  - - [25344, 768, 1, 256]
    - [108, 4771.55]
  - - [36608, 24320, 1, 256]
    - [108, 4935.73]
  - - [34816, 9216, 1, 256]
    - [114, 4895.78]
  - - [3072, 1792, 1, 256]
    - [108, 4571.45]
  - - [41216, 27648, 1, 256]
    - [114, 4899.76]
  - - [30464, 9216, 1, 256]
    - [114, 4893.89]
  - - [33024, 1281, 1, 256]
    - [111, 4682.45]
  - - [31488, 1536, 1, 256]
    - [114, 4841.1]
  - - [7424, 3072, 1, 256]
    - [114, 4749.2]
  - - [20480, 1792, 1, 256]
    - [108, 4838.22]
  - - [41984, 1793, 1, 256]
    - [108, 4695.02]
  - - [18688, 1792, 1, 256]
    - [108, 4831.58]
  - - [13824, 1792, 1, 256]
    - [108, 4812.84]
  - - [15360, 1280, 1, 256]
    - [108, 4782.01]
  - - [38144, 3072, 1, 256]
    - [114, 4873.64]
  - - [33280, 3072, 1, 256]
    - [114, 4869.98]
  - - [35584, 23296, 1, 256]
    - [108, 4935.36]
  - - [43520, 768, 1, 256]
    - [108, 4836.96]
  - - [40704, 1536, 1, 256]
    - [114, 4853.38]
  - - [29696, 3072, 1, 256]
    - [114, 4868.03]
  - - [32256, 19969, 1, 256]
    - [114, 4845.33]
  - - [39424, 1281, 1, 256]
    - [111, 4689.83]
  - - [40960, 9216, 1, 256]
    - [114, 4892.67]
  - - [37632, 9216, 1, 256]
    - [114, 4894.44]
  - - [37888, 1281, 1, 256]
    - [111, 4682.82]
  - - [42240, 2305, 1, 256]
    - [108, 4774.17]
  - - [17920, 5377, 1, 256]
    - [108, 4811.96]
  - - [2816, 1281, 1, 256]
    - [108, 4130.74]
  - - [37376, 1280, 1, 256]
    - [108, 4868.1]
  - - [27904, 9216, 1, 256]
    - [114, 4887.35]
  - - [34304, 22016, 1, 256]
    - [114, 4895.41]
  - - [11776, 8705, 1, 256]
    - [114, 4790.23]
  - - [22272, 1536, 1, 256]
    - [114, 4811.82]
  - - [25856, 9216, 1, 256]
    - [114, 4884.75]
  - - [19712, 3072, 1, 256]
    - [114, 4843.69]
  - - [20480, 1281, 1, 256]
    - [111, 4632.71]
  - - [17408, 1280, 1, 256]
    - [108, 4780.31]
  - - [41472, 9216, 1, 256]
    - [114, 4899.81]
  - - [42496, 27648, 1, 256]
    - [114, 4903.41]
  - - [35072, 3072, 1, 256]
    - [114, 4867.46]
  - - [4608, 1281, 1, 256]
    - [108, 4311.11]
  - - [44288, 4352, 1, 256]
    - [108, 4920.3]
  - - [41984, 1792, 1, 256]
    - [108, 4888.54]
  - - [42496, 2561, 1, 256]
    - [114, 4719.75]
  - - [9984, 6657, 1, 256]
    - [114, 4765.05]
  - - [43008, 3073, 1, 256]
    - [114, 4743.42]
  - - [4096, 2048, 1, 256]
    - [114, 4532.86]
  - - [36352, 24065, 1, 256]
    - [114, 4842.01]
  - - [4608, 2048, 1, 256]
    - [114, 4623.6]
  - - [24832, 3072, 1, 256]
    - [114, 4858.32]
  - - [25088, 1280, 1, 256]
    - [108, 4825.0]
  - - [29184, 16641, 1, 256]
    - [108, 4889.54]
  - - [1024, 2048, 1, 256]
    - [119, 4176.03]
  - - [768, 768, 1, 256]
    - [93, 3218.14]
  - - [42240, 27648, 1, 256]
    - [114, 4904.08]
  - - [8192, 5120, 1, 256]
    - [114, 4813.69]
  - - [31744, 1280, 1, 256]
    - [108, 4847.82]
  - - [9984, 1792, 1, 256]
    - [108, 4755.76]
  - - [13312, 1280, 1, 256]
    - [108, 4718.21]
  - - [44288, 3072, 1, 256]
    - [114, 4885.06]
  - - [18432, 6144, 1, 256]
    - [114, 4875.85]
  - - [23808, 1792, 1, 256]
    - [108, 4858.7]
  - - [32512, 1280, 1, 256]
    - [108, 4850.36]
  - - [11008, 768, 1, 256]
    - [108, 4586.85]
  - - [10752, 1280, 1, 256]
    - [108, 4714.21]
  - - [28672, 16129, 1, 256]
    - [108, 4885.81]
  - - [17920, 9216, 1, 256]
    - [114, 4870.8]
  - - [25088, 12801, 1, 256]
    - [114, 4823.45]
  - - [19712, 9216, 1, 256]
    - [114, 4879.59]
  - - [15616, 1281, 1, 256]
    - [111, 4599.8]
  - - [31744, 19457, 1, 256]
    - [114, 4843.61]
  - - [36864, 1792, 1, 256]
    - [108, 4887.47]
  - - [42496, 1792, 1, 256]
    - [108, 4894.83]
  - - [41216, 3072, 1, 256]
    - [114, 4876.45]
  - - [39936, 9216, 1, 256]
    - [114, 4900.98]
  - - [8960, 1792, 1, 256]
    - [108, 4744.25]
  - - [13824, 1281, 1, 256]
    - [111, 4560.02]
  - - [7936, 4864, 1, 256]
    - [108, 4829.9]
  - - [27648, 1280, 1, 256]
    - [108, 4845.38]
  - - [17664, 5121, 1, 256]
    - [114, 4777.53]
  - - [8704, 5632, 1, 256]
    - [114, 4816.97]
  - - [38144, 25601, 1, 256]
    - [114, 4847.92]
  - - [27136, 14849, 1, 256]
    - [114, 4826.41]
  - - [31744, 19456, 1, 256]
    - [114, 4900.55]
  - - [5376, 1280, 1, 256]
    - [108, 4535.08]
  - - [33024, 3072, 1, 256]
    - [114, 4872.23]
  - - [37888, 9216, 1, 256]
    - [114, 4895.39]
  - - [17664, 1792, 1, 256]
    - [108, 4830.93]
  - - [6912, 1792, 1, 256]
    - [108, 4681.81]
  - - [28672, 768, 1, 256]
    - [108, 4788.6]
  - - [32768, 1281, 1, 256]
    - [111, 4679.42]
  - - [11520, 1281, 1, 256]
    - [111, 4557.96]
  - - [42240, 2049, 1, 256]
    - [114, 4679.87]
  - - [34048, 3072, 1, 256]
    - [114, 4872.45]
  - - [10752, 7680, 1, 256]
    - [114, 4863.32]
  - - [37120, 9216, 1, 256]
    - [114, 4891.69]
  - - [14080, 9216, 1, 256]
    - [114, 4872.18]
  - - [38400, 1792, 1, 256]
    - [108, 4891.83]
  - - [43776, 9216, 1, 256]
    - [114, 4902.59]
  - - [26624, 768, 1, 256]
    - [108, 4778.09]
  - - [14336, 2049, 1, 256]
    - [114, 4620.67]
  - - [32512, 1281, 1, 256]
    - [111, 4672.07]
  - - [37120, 24577, 1, 256]
    - [114, 4847.11]
  - - [6144, 1281, 1, 256]
    - [108, 4402.29]
  - - [28672, 1280, 1, 256]
    - [108, 4839.72]
  - - [30976, 18433, 1, 256]
    - [114, 4838.9]
  - - [37632, 3072, 1, 256]
    - [114, 4876.2]
  - - [34560, 1792, 1, 256]
    - [108, 4888.65]
  - - [5120, 3072, 1, 256]
    - [114, 4658.62]
  - - [21760, 9217, 1, 256]
    - [114, 4809.15]
  - - [5120, 1280, 1, 256]
    - [114, 4533.9]
  - - [24064, 11521, 1, 256]
    - [108, 4867.25]
  - - [35328, 1280, 1, 256]
    - [108, 4864.56]
  - - [7936, 3072, 1, 256]
    - [114, 4747.84]
  - - [30720, 1280, 1, 256]
    - [108, 4850.59]
  - - [21760, 9472, 1, 256]
    - [108, 4918.98]
  - - [9216, 6145, 1, 256]
    - [114, 4762.4]
  - - [8192, 1536, 1, 256]
    - [114, 4635.92]
  - - [39936, 27648, 1, 256]
    - [114, 4907.0]
  - - [21248, 9216, 1, 256]
    - [114, 4894.56]
  - - [5376, 2049, 1, 256]
    - [114, 4484.37]
  - - [35072, 22529, 1, 256]
    - [114, 4844.15]
  - - [13312, 769, 1, 256]
    - [111, 4270.95]
  - - [35840, 9216, 1, 256]
    - [114, 4891.77]
  - - [27392, 1280, 1, 256]
    - [108, 4838.5]
  - - [39424, 27136, 1, 256]
    - [114, 4889.6]
  - - [26368, 9216, 1, 256]
    - [114, 4886.88]
  - - [34048, 21505, 1, 256]
    - [114, 4847.42]
  - - [29440, 1536, 1, 256]
    - [114, 4828.84]
  - - [38912, 768, 1, 256]
    - [108, 4824.69]
  - - [26112, 1792, 1, 256]
    - [108, 4861.97]
  - - [23296, 768, 1, 256]
    - [108, 4740.41]
  - - [3328, 3072, 1, 256]
    - [114, 4541.0]
  - - [3584, 1281, 1, 256]
    - [110, 4312.8]
  - - [43264, 27648, 1, 256]
    - [114, 4898.14]
  - - [18432, 9216, 1, 256]
    - [114, 4890.59]
  - - [29952, 1280, 1, 256]
    - [108, 4851.35]
  - - [43264, 1281, 1, 256]
    - [111, 4693.6]
  - - [38912, 3072, 1, 256]
    - [114, 4876.6]
  - - [9216, 6144, 1, 256]
    - [114, 4846.83]
  - - [30464, 17921, 1, 256]
    - [114, 4835.83]
  - - [37376, 9216, 1, 256]
    - [114, 4896.53]
  - - [256, 3072, 1, 256]
    - [119, 3804.38]
  - - [9472, 3072, 1, 256]
    - [114, 4781.43]
  - - [26624, 1280, 1, 256]
    - [108, 4830.76]
  - - [35840, 23552, 1, 256]
    - [114, 4907.63]
  - - [8960, 3072, 1, 256]
    - [114, 4780.35]
  - - [34816, 3072, 1, 256]
    - [114, 4875.29]
  - - [11008, 3072, 1, 256]
    - [114, 4805.41]
  - - [36864, 1536, 1, 256]
    - [114, 4848.52]
  - - [24064, 1281, 1, 256]
    - [111, 4650.89]
  - - [23552, 9216, 1, 256]
    - [114, 4888.89]
  - - [31232, 18945, 1, 256]
    - [114, 4838.36]
  - - [27136, 9216, 1, 256]
    - [114, 4883.27]
  - - [19968, 7681, 1, 256]
    - [114, 4818.33]
  - - [31488, 18945, 1, 256]
    - [114, 4844.6]
  - - [33280, 1792, 1, 256]
    - [108, 4879.84]
  - - [38912, 1281, 1, 256]
    - [111, 4689.14]
  - - [14592, 3072, 1, 256]
    - [114, 4830.86]
  - - [30976, 18689, 1, 256]
    - [108, 4903.0]
  - - [4096, 769, 1, 256]
    - [108, 3969.07]
  - - [31488, 3072, 1, 256]
    - [114, 4874.33]
  - - [28416, 1281, 1, 256]
    - [111, 4667.81]
  - - [33024, 1792, 1, 256]
    - [108, 4884.02]
  - - [42752, 2816, 1, 256]
    - [108, 4908.95]
  - - [11520, 8449, 1, 256]
    - [108, 4858.43]
  - - [4864, 1281, 1, 256]
    - [110, 4303.12]
  - - [14592, 768, 1, 256]
    - [108, 4650.37]
  - - [7424, 1792, 1, 256]
    - [108, 4706.71]
  - - [44544, 4353, 1, 256]
    - [108, 4823.01]
  - - [37120, 3072, 1, 256]
    - [114, 4881.63]
  - - [18176, 5889, 1, 256]
    - [108, 4839.47]
  - - [5632, 2305, 1, 256]
    - [108, 4534.62]
  - - [39936, 27393, 1, 256]
    - [108, 4895.56]
  - - [10240, 7169, 1, 256]
    - [114, 4766.24]
  - - [39168, 26625, 1, 256]
    - [114, 4841.65]
  - - [10752, 7681, 1, 256]
    - [114, 4785.3]
  - - [13824, 1536, 1, 256]
    - [114, 4727.78]
  - - [21760, 1280, 1, 256]
    - [108, 4811.41]
  - - [20480, 768, 1, 256]
    - [108, 4730.42]
  - - [18688, 768, 1, 256]
    - [108, 4713.67]
  - - [14336, 9216, 1, 256]
    - [114, 4871.65]
  - - [40960, 768, 1, 256]
    - [108, 4831.68]
  - - [37632, 25345, 1, 256]
    - [108, 4905.13]
  - - [35840, 23553, 1, 256]
    - [114, 4846.37]
  - - [6656, 3584, 1, 256]
    - [114, 4752.9]
  - - [16640, 1281, 1, 256]
    - [110, 4606.03]
  - - [35840, 1280, 1, 256]
    - [108, 4865.78]
  - - [23552, 3072, 1, 256]
    - [114, 4863.27]
  - - [41984, 1280, 1, 256]
    - [108, 4871.85]
  - - [19712, 7169, 1, 256]
    - [114, 4788.68]
  - - [8448, 768, 1, 256]
    - [108, 4508.54]
  - - [5888, 2561, 1, 256]
    - [114, 4539.78]
  - - [27136, 768, 1, 256]
    - [108, 4778.89]
  - - [22272, 1792, 1, 256]
    - [108, 4859.93]
  - - [11008, 1281, 1, 256]
    - [111, 4535.76]
  - - [12800, 9216, 1, 256]
    - [114, 4872.5]
  - - [15616, 1536, 1, 256]
    - [114, 4752.68]
  - - [6912, 1281, 1, 256]
    - [110, 4462.0]
  - - [3840, 769, 1, 256]
    - [94, 3939.75]
  - - [42240, 2304, 1, 256]
    - [108, 4900.7]
  - - [38144, 1280, 1, 256]
    - [108, 4863.51]
  - - [13056, 1280, 1, 256]
    - [108, 4745.74]
  - - [24576, 3072, 1, 256]
    - [114, 4859.2]
  - - [12288, 768, 1, 256]
    - [114, 4656.03]
  - - [27136, 1536, 1, 256]
    - [114, 4811.3]
  - - [25344, 12801, 1, 256]
    - [114, 4830.13]
  - - [32512, 20224, 1, 256]
    - [108, 4932.38]
  - - [17664, 3072, 1, 256]
    - [114, 4837.22]
  - - [7168, 1280, 1, 256]
    - [114, 4578.93]
  - - [43520, 3329, 1, 256]
    - [108, 4800.04]
  - - [28160, 15873, 1, 256]
    - [114, 4830.4]
  - - [31488, 1281, 1, 256]
    - [111, 4682.68]
  - - [40960, 3072, 1, 256]
    - [114, 4879.34]
  - - [14592, 9216, 1, 256]
    - [114, 4887.21]
  - - [43008, 1281, 1, 256]
    - [111, 4685.92]
  - - [9472, 1792, 1, 256]
    - [108, 4722.95]
  - - [22784, 10497, 1, 256]
    - [108, 4876.48]
  - - [22272, 3072, 1, 256]
    - [114, 4864.26]
  - - [9728, 1280, 1, 256]
    - [108, 4686.37]
  - - [39680, 27137, 1, 256]
    - [114, 4847.26]
  - - [20992, 8704, 1, 256]
    - [114, 4880.72]
  - - [24320, 1536, 1, 256]
    - [114, 4798.49]
  - - [7936, 4865, 1, 256]
    - [108, 4752.93]
  - - [17664, 5376, 1, 256]
    - [108, 4904.29]
  - - [30464, 1281, 1, 256]
    - [111, 4671.48]
  - - [37888, 25345, 1, 256]
    - [108, 4894.89]
  - - [23296, 10753, 1, 256]
    - [114, 4826.99]
  - - [28416, 15873, 1, 256]
    - [114, 4836.68]
  - - [27648, 15361, 1, 256]
    - [114, 4822.2]
  - - [19200, 1281, 1, 256]
    - [111, 4632.95]
  - - [30208, 1280, 1, 256]
    - [108, 4845.96]
  - - [27136, 3072, 1, 256]
    - [114, 4875.85]
  - - [29952, 1792, 1, 256]
    - [108, 4880.7]
  - - [16128, 1281, 1, 256]
    - [111, 4599.09]
  - - [18432, 1280, 1, 256]
    - [108, 4801.57]
  - - [16896, 1280, 1, 256]
    - [108, 4788.18]
  - - [26112, 1280, 1, 256]
    - [108, 4842.87]
  - - [36608, 3072, 1, 256]
    - [114, 4875.94]
  - - [39424, 1536, 1, 256]
    - [114, 4824.04]
  - - [15104, 2817, 1, 256]
    - [108, 4742.7]
  - - [25344, 1792, 1, 256]
    - [108, 4864.85]
  - - [19456, 9216, 1, 256]
    - [114, 4879.84]
  - - [24064, 11777, 1, 256]
    - [114, 4820.62]
  - - [29696, 1792, 1, 256]
    - [108, 4872.77]
  - - [24576, 768, 1, 256]
    - [114, 4769.64]
  - - [40448, 1536, 1, 256]
    - [114, 4845.48]
  - - [22784, 1280, 1, 256]
    - [108, 4821.54]
  - - [4864, 1280, 1, 256]
    - [114, 4557.46]
  - - [512, 3072, 1, 256]
    - [121, 4144.24]
  - - [34560, 1280, 1, 256]
    - [108, 4859.02]
  - - [5632, 2560, 1, 256]
    - [114, 4668.12]
  - - [38912, 9216, 1, 256]
    - [114, 4895.17]
  - - [7680, 1281, 1, 256]
    - [111, 4456.66]
  - - [19456, 6913, 1, 256]
    - [108, 4836.99]
  - - [15104, 1281, 1, 256]
    - [111, 4588.62]
  - - [22272, 9216, 1, 256]
    - [114, 4894.25]
  - - [14848, 1281, 1, 256]
    - [111, 4595.14]
  - - [19968, 1280, 1, 256]
    - [108, 4815.93]
  - - [29440, 1792, 1, 256]
    - [108, 4870.7]
  - - [41984, 9216, 1, 256]
    - [114, 4895.96]
  - - [14080, 1793, 1, 256]
    - [108, 4621.33]
  - - [20992, 8449, 1, 256]
    - [108, 4848.84]
  - - [17920, 768, 1, 256]
    - [108, 4677.66]
  - - [34304, 1280, 1, 256]
    - [108, 4859.64]
  - - [10496, 7169, 1, 256]
    - [114, 4778.13]
  - - [40704, 1280, 1, 256]
    - [108, 4877.38]
  - - [3328, 2048, 1, 256]
    - [114, 4483.59]
  - - [40704, 27648, 1, 256]
    - [114, 4903.84]
  - - [22784, 1281, 1, 256]
    - [111, 4663.86]
  - - [13568, 1025, 1, 256]
    - [111, 4422.0]
  - - [38144, 9216, 1, 256]
    - [114, 4895.66]
  - - [24064, 1280, 1, 256]
    - [108, 4817.5]
  - - [2304, 768, 1, 256]
    - [119, 4083.9]
  - - [27392, 15104, 1, 256]
    - [108, 4926.56]
  - - [2304, 3072, 1, 256]
    - [108, 4589.05]
  - - [9472, 6401, 1, 256]
    - [108, 4803.77]
  - - [39424, 1792, 1, 256]
    - [108, 4889.02]
  - - [41728, 768, 1, 256]
    - [108, 4829.33]
  - - [8960, 1280, 1, 256]
    - [108, 4636.2]
  - - [11264, 3072, 1, 256]
    - [114, 4801.7]
  - - [25344, 3072, 1, 256]
    - [114, 4859.97]
  - - [22784, 768, 1, 256]
    - [108, 4745.05]
  - - [24576, 1792, 1, 256]
    - [108, 4860.61]
  - - [27392, 14849, 1, 256]
    - [114, 4830.35]
  - - [14848, 2561, 1, 256]
    - [114, 4666.81]
  - - [28160, 3072, 1, 256]
    - [114, 4866.17]
  - - [4864, 1792, 1, 256]
    - [108, 4563.87]
  - - [20736, 1281, 1, 256]
    - [110, 4637.64]
  - - [23552, 11009, 1, 256]
    - [108, 4862.25]
  - - [11776, 8449, 1, 256]
    - [108, 4828.41]
  - - [16640, 1792, 1, 256]
    - [108, 4831.66]
  - - [24576, 12289, 1, 256]
    - [114, 4819.88]
  - - [38656, 26369, 1, 256]
    - [108, 4904.67]
  - - [5376, 2304, 1, 256]
    - [108, 4676.84]
  - - [13824, 9216, 1, 256]
    - [114, 4876.66]
  - - [28928, 1792, 1, 256]
    - [108, 4883.78]
  - - [36864, 1281, 1, 256]
    - [111, 4683.64]
  - - [25600, 1280, 1, 256]
    - [108, 4829.81]
  - - [27904, 15361, 1, 256]
    - [114, 4836.82]
  - - [3840, 1792, 1, 256]
    - [114, 4533.22]
  - - [14848, 3072, 1, 256]
    - [114, 4834.37]
  - - [14848, 1280, 1, 256]
    - [108, 4757.12]
  - - [27904, 1536, 1, 256]
    - [114, 4821.12]
  - - [39936, 1536, 1, 256]
    - [114, 4839.05]
  - - [34816, 1536, 1, 256]
    - [114, 4821.58]
  - - [14592, 2305, 1, 256]
    - [108, 4701.87]
  - - [22528, 9985, 1, 256]
    - [108, 4859.84]
  - - [22784, 3072, 1, 256]
    - [114, 4850.27]
  - - [26368, 13825, 1, 256]
    - [114, 4825.12]
  - - [4096, 1792, 1, 256]
    - [108, 4563.9]
  - - [17152, 1280, 1, 256]
    - [114, 4775.33]
  - - [30720, 18177, 1, 256]
    - [108, 4890.33]
  - - [37120, 24833, 1, 256]
    - [108, 4910.65]
  - - [3840, 768, 1, 256]
    - [108, 4237.63]
  - - [1792, 1537, 1, 256]
    - [131, 4101.34]
  - - [24320, 3072, 1, 256]
    - [114, 4862.62]
  - - [17664, 1280, 1, 256]
    - [108, 4786.59]
  - - [12800, 1280, 1, 256]
    - [108, 4736.54]
  - - [4352, 1536, 1, 256]
    - [131, 4462.49]
  - - [14592, 1281, 1, 256]
    - [111, 4574.98]
  - - [21248, 1281, 1, 256]
    - [111, 4632.35]
  - - [2560, 1536, 1, 256]
    - [119, 4337.44]
  - - [44032, 4097, 1, 256]
    - [114, 4772.58]
  - - [256, 257, 1, 256]
    - [127, 717.323]
  - - [34048, 1281, 1, 256]
    - [111, 4678.36]
  - - [44544, 27648, 1, 256]
    - [114, 4895.84]
  - - [34048, 21761, 1, 256]
    - [108, 4898.42]
  - - [26368, 1280, 1, 256]
    - [108, 4836.15]
  - - [24064, 1536, 1, 256]
    - [114, 4801.18]
  - - [24832, 12545, 1, 256]
    - [108, 4886.63]
  - - [44032, 3841, 1, 256]
    - [108, 4809.8]
  - - [22528, 9216, 1, 256]
    - [114, 4887.77]
  - - [40448, 257, 1, 256]
    - [110, 4067.55]
  - - [14592, 1280, 1, 256]
    - [114, 4757.34]
  - - [26624, 14337, 1, 256]
    - [114, 4827.0]
  - - [19456, 1280, 1, 256]
    - [108, 4792.91]
  - - [8192, 5121, 1, 256]
    - [114, 4713.79]
  - - [26880, 3072, 1, 256]
    - [114, 4869.1]
  - - [25600, 1281, 1, 256]
    - [105, 4650.44]
  - - [42240, 1536, 1, 256]
    - [114, 4852.48]
  - - [5888, 2817, 1, 256]
    - [108, 4605.56]
  - - [6144, 1792, 1, 256]
    - [108, 4653.57]
  - - [16384, 1792, 1, 256]
    - [108, 4813.87]
  - - [35584, 23297, 1, 256]
    - [108, 4910.58]
  - - [36352, 24064, 1, 256]
    - [114, 4896.08]
  - - [23040, 1536, 1, 256]
    - [114, 4800.91]
  - - [8704, 1536, 1, 256]
    - [114, 4626.57]
  - - [18432, 6145, 1, 256]
    - [114, 4790.37]
  - - [23040, 1281, 1, 256]
    - [110, 4646.77]
  - - [12032, 3072, 1, 256]
    - [114, 4794.17]
  - - [42752, 1280, 1, 256]
    - [108, 4887.85]
  - - [1536, 1536, 1, 256]
    - [108, 4386.84]
  - - [39168, 3072, 1, 256]
    - [114, 4875.8]
  - - [24576, 1281, 1, 256]
    - [110, 4651.17]
  - - [43520, 1281, 1, 256]
    - [111, 4697.69]
  - - [28160, 1536, 1, 256]
    - [114, 4828.86]
  - - [41728, 27648, 1, 256]
    - [114, 4901.64]
  - - [28416, 1792, 1, 256]
    - [108, 4871.7]
  - - [42240, 1792, 1, 256]
    - [108, 4894.29]
  - - [4864, 1536, 1, 256]
    - [131, 4477.07]
  - - [26368, 3072, 1, 256]
    - [114, 4863.97]
  - - [41728, 1536, 1, 256]
    - [114, 4848.22]
  - - [2048, 768, 1, 256]
    - [119, 4142.53]
  - - [24320, 12032, 1, 256]
    - [108, 4928.1]
  - - [28928, 16385, 1, 256]
    - [114, 4830.22]
  - - [34816, 22528, 1, 256]
    - [114, 4900.51]
  - - [26368, 1792, 1, 256]
    - [108, 4859.39]
  - - [34816, 1281, 1, 256]
    - [111, 4677.28]
  - - [25856, 13569, 1, 256]
    - [108, 4888.86]
  - - [4608, 1536, 1, 256]
    - [114, 4574.68]
  - - [25600, 13312, 1, 256]
    - [114, 4892.26]
  - - [31232, 18689, 1, 256]
    - [108, 4887.91]
  - - [20736, 9216, 1, 256]
    - [114, 4879.39]
  - - [34304, 9216, 1, 256]
    - [114, 4895.83]
  - - [7680, 1280, 1, 256]
    - [108, 4669.68]
  - - [14080, 1280, 1, 256]
    - [108, 4756.62]
  - - [29696, 1536, 1, 256]
    - [114, 4839.26]
  - - [43264, 3073, 1, 256]
    - [114, 4737.83]
  - - [17408, 1281, 1, 256]
    - [111, 4612.73]
  - - [37120, 1281, 1, 256]
    - [110, 4680.91]
  - - [8704, 5633, 1, 256]
    - [114, 4717.36]
  - - [4864, 1793, 1, 256]
    - [110, 4401.5]
  - - [41984, 3072, 1, 256]
    - [114, 4876.84]
  - - [13824, 1280, 1, 256]
    - [108, 4766.46]
  - - [20992, 3072, 1, 256]
    - [114, 4847.2]
  - - [40192, 1281, 1, 256]
    - [111, 4695.82]
  - - [9728, 6401, 1, 256]
    - [108, 4801.63]
  - - [17152, 1281, 1, 256]
    - [111, 4611.97]
  - - [16640, 4097, 1, 256]
    - [114, 4752.15]
  - - [38400, 9216, 1, 256]
    - [114, 4900.26]
  - - [33024, 768, 1, 256]
    - [108, 4811.32]
  - - [38656, 1536, 1, 256]
    - [114, 4847.85]
  - - [1536, 3072, 1, 256]
    - [114, 4514.73]
  - - [12544, 1792, 1, 256]
    - [108, 4771.31]
  - - [37632, 1792, 1, 256]
    - [108, 4892.47]
  - - [17152, 4609, 1, 256]
    - [114, 4751.08]
  - - [18944, 6656, 1, 256]
    - [114, 4871.36]
  - - [34560, 22017, 1, 256]
    - [114, 4847.94]
  - - [23296, 11008, 1, 256]
    - [108, 4916.85]
  - - [41472, 1281, 1, 256]
    - [105, 4666.6]
  - - [14848, 768, 1, 256]
    - [108, 4639.01]
  - - [38656, 1792, 1, 256]
    - [108, 4886.94]
  - - [7424, 4352, 1, 256]
    - [108, 4826.1]
  - - [8448, 5377, 1, 256]
    - [108, 4797.27]
  - - [37120, 1280, 1, 256]
    - [108, 4870.15]
  - - [29696, 1281, 1, 256]
    - [111, 4677.96]
  - - [29952, 17665, 1, 256]
    - [108, 4908.92]
  - - [16128, 3072, 1, 256]
    - [114, 4834.12]
  - - [2304, 2304, 1, 256]
    - [108, 4449.18]
  - - [33792, 21504, 1, 256]
    - [114, 4904.66]
  - - [24576, 1536, 1, 256]
    - [114, 4814.7]
  - - [7424, 1281, 1, 256]
    - [111, 4452.77]
  - - [37376, 1792, 1, 256]
    - [108, 4888.11]
  - - [42752, 768, 1, 256]
    - [108, 4833.01]
  - - [4096, 1025, 1, 256]
    - [131, 4083.55]
  - - [35840, 768, 1, 256]
    - [114, 4796.62]
  - - [2304, 2305, 1, 256]
    - [108, 4392.44]
  - - [19200, 3072, 1, 256]
    - [114, 4855.58]
  - - [43264, 768, 1, 256]
    - [108, 4827.61]
  - - [33536, 1792, 1, 256]
    - [108, 4888.13]
  - - [36864, 9216, 1, 256]
    - [114, 4878.23]
  - - [38656, 26368, 1, 256]
    - [108, 4935.58]
  - - [22016, 1280, 1, 256]
    - [108, 4812.55]
  - - [8448, 5376, 1, 256]
    - [108, 4869.25]
  - - [17920, 1281, 1, 256]
    - [111, 4618.67]
  - - [2048, 1281, 1, 256]
    - [121, 3953.46]
  - - [41472, 3072, 1, 256]
    - [114, 4889.91]
  - - [44288, 9216, 1, 256]
    - [114, 4904.58]
  - - [15104, 1792, 1, 256]
    - [108, 4808.19]
  - - [44288, 4097, 1, 256]
    - [114, 4776.03]
  - - [26112, 3072, 1, 256]
    - [114, 4862.46]
  - - [512, 768, 1, 256]
    - [117, 2929.69]
  - - [36096, 3072, 1, 256]
    - [114, 4876.19]
  - - [4864, 1537, 1, 256]
    - [114, 4365.93]
  - - [43264, 3329, 1, 256]
    - [108, 4807.7]
  - - [33792, 1536, 1, 256]
    - [114, 4846.64]
  - - [31232, 18944, 1, 256]
    - [114, 4897.06]
  - - [44288, 1792, 1, 256]
    - [108, 4902.9]
  - - [25344, 1536, 1, 256]
    - [114, 4819.45]
  - - [7936, 1281, 1, 256]
    - [111, 4449.63]
  - - [20224, 7681, 1, 256]
    - [114, 4807.14]
  - - [26112, 9216, 1, 256]
    - [114, 4890.77]
  - - [7936, 1280, 1, 256]
    - [108, 4650.34]
  - - [20224, 1280, 1, 256]
    - [108, 4803.43]
  - - [8960, 5888, 1, 256]
    - [108, 4862.07]
  - - [32000, 1792, 1, 256]
    - [108, 4877.75]
  - - [37888, 1792, 1, 256]
    - [108, 4891.32]
  - - [21504, 3072, 1, 256]
    - [114, 4857.04]
  - - [40448, 1281, 1, 256]
    - [111, 4693.09]
  - - [12544, 3072, 1, 256]
    - [114, 4812.57]
  - - [32256, 19713, 1, 256]
    - [108, 4890.6]
  - - [40704, 1792, 1, 256]
    - [108, 4896.13]
  - - [18176, 5888, 1, 256]
    - [108, 4913.17]
  - - [33792, 9216, 1, 256]
    - [114, 4892.37]
  - - [35584, 1536, 1, 256]
    - [114, 4845.41]
  - - [26624, 14336, 1, 256]
    - [114, 4892.81]
  - - [38912, 1792, 1, 256]
    - [108, 4884.84]
  - - [7936, 1792, 1, 256]
    - [114, 4674.94]
  - - [28672, 16385, 1, 256]
    - [114, 4840.83]
  - - [18944, 3072, 1, 256]
    - [114, 4836.88]
  - - [33280, 20993, 1, 256]
    - [114, 4833.4]
  - - [5888, 3072, 1, 256]
    - [114, 4699.69]
  - - [37120, 24832, 1, 256]
    - [108, 4934.35]
  - - [6400, 3329, 1, 256]
    - [108, 4657.6]
  - - [43520, 1792, 1, 256]
    - [108, 4899.17]
  - - [29184, 3072, 1, 256]
    - [114, 4874.12]
  - - [16896, 4609, 1, 256]
    - [114, 4762.69]
  - - [43776, 1280, 1, 256]
    - [108, 4882.01]
  - - [37632, 1536, 1, 256]
    - [114, 4843.26]
  - - [14336, 768, 1, 256]
    - [114, 4628.5]
  - - [41984, 1281, 1, 256]
    - [105, 4690.48]
  - - [41472, 1536, 1, 256]
    - [114, 4860.87]
  - - [26624, 1281, 1, 256]
    - [111, 4660.2]
  - - [39936, 768, 1, 256]
    - [108, 4827.32]
  - - [23296, 11009, 1, 256]
    - [108, 4881.27]
  - - [29952, 1281, 1, 256]
    - [111, 4671.17]
  - - [26624, 9216, 1, 256]
    - [114, 4886.69]
  - - [29184, 9216, 1, 256]
    - [114, 4888.43]
  - - [5120, 1281, 1, 256]
    - [108, 4300.8]
  - - [36352, 9216, 1, 256]
    - [114, 4897.24]
  - - [37632, 25344, 1, 256]
    - [108, 4939.08]
  - - [37888, 25600, 1, 256]
    - [114, 4902.38]
  - - [34560, 1281, 1, 256]
    - [111, 4688.21]
  - - [16640, 9216, 1, 256]
    - [114, 4875.89]
  - - [1792, 1281, 1, 256]
    - [95, 4215.66]
  - - [44544, 9216, 1, 256]
    - [114, 4902.97]
  - - [14080, 1792, 1, 256]
    - [108, 4788.44]
  - - [33536, 21249, 1, 256]
    - [108, 4906.97]
  - - [32256, 1281, 1, 256]
    - [111, 4678.17]
  - - [23552, 1280, 1, 256]
    - [108, 4812.5]
  - - [34048, 21760, 1, 256]
    - [108, 4931.49]
  - - [9984, 768, 1, 256]
    - [108, 4570.49]
  - - [40192, 1536, 1, 256]
    - [114, 4840.95]
  - - [4608, 1280, 1, 256]
    - [108, 4515.4]
  - - [41728, 3072, 1, 256]
    - [114, 4873.79]
  - - [35328, 9216, 1, 256]
    - [114, 4901.96]
  - - [11264, 1536, 1, 256]
    - [114, 4704.89]
  - - [32512, 768, 1, 256]
    - [108, 4794.14]
  - - [14592, 2049, 1, 256]
    - [114, 4615.94]
  - - [14848, 9216, 1, 256]
    - [114, 4875.41]
  - - [23808, 3072, 1, 256]
    - [114, 4858.77]
  - - [13568, 9216, 1, 256]
    - [114, 4861.93]
  - - [1024, 769, 1, 256]
    - [109, 3236.81]
  - - [42496, 2560, 1, 256]
    - [114, 4869.08]
  - - [42752, 3072, 1, 256]
    - [114, 4880.33]
  - - [39680, 27392, 1, 256]
    - [108, 4936.62]
  - - [14592, 1792, 1, 256]
    - [108, 4807.88]
  - - [25600, 13313, 1, 256]
    - [114, 4828.81]
  - - [26624, 1792, 1, 256]
    - [108, 4866.76]
  - - [20480, 8193, 1, 256]
    - [114, 4806.84]
  - - [36096, 23808, 1, 256]
    - [108, 4941.57]
  - - [15104, 2561, 1, 256]
    - [114, 4675.36]
  - - [11776, 1281, 1, 256]
    - [111, 4552.91]
  - - [43520, 3072, 1, 256]
    - [114, 4878.49]
  - - [1280, 2048, 1, 256]
    - [119, 4309.59]
  - - [33280, 1280, 1, 256]
    - [108, 4859.8]
  - - [43008, 1792, 1, 256]
    - [108, 4898.8]
  - - [18688, 3072, 1, 256]
    - [114, 4835.25]
  - - [35328, 23040, 1, 256]
    - [114, 4899.85]
  - - [18944, 6401, 1, 256]
    - [108, 4829.32]
  - - [16640, 768, 1, 256]
    - [114, 4683.29]
  - - [16128, 3585, 1, 256]
    - [114, 4738.4]
  - - [4352, 2048, 1, 256]
    - [114, 4576.59]
  - - [29952, 1536, 1, 256]
    - [114, 4832.83]
  - - [17408, 5121, 1, 256]
    - [114, 4773.85]
  - - [44032, 1536, 1, 256]
    - [114, 4846.95]
  - - [4608, 1792, 1, 256]
    - [108, 4649.68]
  - - [36608, 1792, 1, 256]
    - [108, 4881.8]
  - - [13056, 768, 1, 256]
    - [114, 4638.78]
  - - [35328, 1792, 1, 256]
    - [108, 4889.58]
  - - [40960, 1280, 1, 256]
    - [108, 4876.88]
  - - [1280, 1280, 1, 256]
    - [121, 3853.65]
  - - [26112, 13824, 1, 256]
    - [114, 4898.01]
  - - [6400, 1280, 1, 256]
    - [108, 4615.62]
  - - [43520, 3585, 1, 256]
    - [114, 4762.22]
  - - [40704, 9216, 1, 256]
    - [114, 4900.8]
  - - [2816, 2817, 1, 256]
    - [114, 4435.15]
  - - [27904, 15617, 1, 256]
    - [108, 4899.13]
  - - [21248, 3072, 1, 256]
    - [114, 4846.66]
  - - [19712, 1280, 1, 256]
    - [108, 4797.12]
  - - [38912, 1536, 1, 256]
    - [114, 4850.75]
  - - [20480, 1280, 1, 256]
    - [108, 4798.29]
  - - [8960, 1536, 1, 256]
    - [114, 4643.63]
  - - [28672, 1792, 1, 256]
    - [108, 4863.39]
  - - [18432, 1792, 1, 256]
    - [108, 4838.36]
  - - [39680, 1280, 1, 256]
    - [108, 4872.49]
  - - [29952, 9216, 1, 256]
    - [114, 4889.77]
  - - [4352, 1025, 1, 256]
    - [110, 4127.99]
  - - [35328, 1281, 1, 256]
    - [105, 4679.43]
  - - [25600, 1792, 1, 256]
    - [108, 4862.72]
  - - [34304, 22017, 1, 256]
    - [114, 4849.01]
  - - [39168, 1281, 1, 256]
    - [111, 4683.84]
  - - [28160, 15617, 1, 256]
    - [108, 4887.07]
  - - [11776, 8704, 1, 256]
    - [114, 4861.74]
  - - [19968, 9216, 1, 256]
    - [114, 4871.13]
  - - [7424, 4353, 1, 256]
    - [108, 4750.05]
  - - [19200, 1792, 1, 256]
    - [108, 4842.56]
  - - [27648, 15360, 1, 256]
    - [114, 4904.67]
  - - [26624, 3072, 1, 256]
    - [114, 4867.76]
  - - [21248, 1536, 1, 256]
    - [114, 4793.05]
  - - [16640, 1280, 1, 256]
    - [108, 4772.76]
  - - [23040, 10497, 1, 256]
    - [108, 4876.03]
  - - [21248, 8961, 1, 256]
    - [108, 4878.05]
  - - [32256, 1792, 1, 256]
    - [108, 4880.77]
  - - [26112, 13569, 1, 256]
    - [108, 4881.53]
  - - [12288, 8961, 1, 256]
    - [108, 4850.95]
  - - [16896, 3072, 1, 256]
    - [114, 4843.96]
  - - [6656, 3585, 1, 256]
    - [114, 4638.56]
  - - [19968, 7425, 1, 256]
    - [108, 4850.95]
  - - [40960, 1281, 1, 256]
    - [104, 4698.37]
  - - [9472, 768, 1, 256]
    - [108, 4541.24]
  - - [29440, 1281, 1, 256]
    - [111, 4665.96]
  - - [33792, 3072, 1, 256]
    - [114, 4876.56]
  - - [15616, 3072, 1, 256]
    - [114, 4831.05]
  - - [8704, 5377, 1, 256]
    - [108, 4763.43]
  - - [11520, 3072, 1, 256]
    - [114, 4808.04]
  - - [3584, 1280, 1, 256]
    - [114, 4417.05]
  - - [25856, 1536, 1, 256]
    - [114, 4824.7]
  - - [15872, 1281, 1, 256]
    - [111, 4601.63]
  - - [42496, 1281, 1, 256]
    - [111, 4692.25]
  - - [35840, 1792, 1, 256]
    - [108, 4884.92]
  - - [28416, 768, 1, 256]
    - [108, 4782.9]
  - - [2048, 1793, 1, 256]
    - [108, 4183.2]
  - - [32256, 3072, 1, 256]
    - [114, 4877.02]
  - - [18688, 1280, 1, 256]
    - [108, 4801.68]
  - - [20736, 1536, 1, 256]
    - [114, 4795.97]
  - - [25856, 1281, 1, 256]
    - [111, 4658.55]
  - - [22784, 10241, 1, 256]
    - [114, 4812.98]
  - - [36608, 24321, 1, 256]
    - [108, 4903.62]
  - - [36096, 9216, 1, 256]
    - [114, 4901.01]
  - - [10752, 768, 1, 256]
    - [108, 4627.69]
  - - [38400, 26112, 1, 256]
    - [114, 4898.24]
  - - [9216, 5889, 1, 256]
    - [108, 4802.06]
  - - [30976, 1281, 1, 256]
    - [111, 4682.99]
  - - [41472, 27648, 1, 256]
    - [114, 4901.13]
  - - [38144, 25856, 1, 256]
    - [108, 4938.12]
  - - [32256, 1280, 1, 256]
    - [108, 4859.7]
  - - [11008, 1536, 1, 256]
    - [114, 4703.48]
  - - [15360, 3073, 1, 256]
    - [114, 4704.25]
  - - [29184, 16896, 1, 256]
    - [114, 4898.76]
  - - [3072, 1281, 1, 256]
    - [108, 4152.6]
  - - [16128, 1792, 1, 256]
    - [108, 4816.52]
  - - [32768, 20225, 1, 256]
    - [108, 4893.63]
  - - [23040, 10752, 1, 256]
    - [114, 4891.62]
  - - [28160, 1280, 1, 256]
    - [108, 4841.28]
  - - [15872, 3585, 1, 256]
    - [114, 4718.54]
  - - [11008, 7681, 1, 256]
    - [114, 4786.9]
  - - [15360, 9216, 1, 256]
    - [114, 4877.18]
  - - [44032, 1281, 1, 256]
    - [105, 4697.18]
  - - [28416, 16128, 1, 256]
    - [108, 4930.36]
  - - [12288, 9216, 1, 256]
    - [114, 4871.3]
  - - [30208, 1792, 1, 256]
    - [108, 4867.85]
  - - [41728, 1792, 1, 256]
    - [108, 4890.6]
  - - [32256, 19968, 1, 256]
    - [114, 4896.65]
  - - [15360, 1281, 1, 256]
    - [111, 4599.08]
  - - [27904, 1792, 1, 256]
    - [108, 4868.86]
  - - [10240, 7168, 1, 256]
    - [114, 4838.62]
  - - [18944, 1792, 1, 256]
    - [108, 4839.19]
  - - [19200, 1536, 1, 256]
    - [114, 4805.45]
  - - [10240, 1280, 1, 256]
    - [114, 4662.15]
  - - [40192, 1792, 1, 256]
    - [108, 4898.56]
  - - [41728, 1793, 1, 256]
    - [108, 4717.24]
  - - [9984, 6912, 1, 256]
    - [108, 4889.52]
  - - [12544, 1281, 1, 256]
    - [111, 4552.69]
  - - [31488, 19201, 1, 256]
    - [108, 4906.77]
  - - [40192, 257, 1, 256]
    - [111, 4082.49]
  - - [31488, 1280, 1, 256]
    - [108, 4862.85]
  - - [42752, 27648, 1, 256]
    - [114, 4898.35]
  - - [3328, 1280, 1, 256]
    - [108, 4438.06]
  - - [40704, 768, 1, 256]
    - [108, 4831.63]
  - - [25088, 12545, 1, 256]
    - [108, 4873.51]
  - - [28928, 1280, 1, 256]
    - [108, 4850.35]
  - - [24576, 9216, 1, 256]
    - [114, 4894.34]
  - - [37376, 1281, 1, 256]
    - [111, 4677.08]
  - - [33024, 20737, 1, 256]
    - [108, 4899.25]
  - - [29696, 9216, 1, 256]
    - [114, 4890.39]
  - - [768, 769, 1, 256]
    - [93, 3170.96]
  - - [31232, 1536, 1, 256]
    - [114, 4824.45]
  - - [30208, 17920, 1, 256]
    - [114, 4897.89]
  - - [9216, 1792, 1, 256]
    - [108, 4758.32]
  - - [8448, 1280, 1, 256]
    - [108, 4641.9]
  - - [44544, 4609, 1, 256]
    - [114, 4788.82]
  - - [43520, 1280, 1, 256]
    - [108, 4875.96]
  - - [22016, 9728, 1, 256]
    - [114, 4886.75]
  - - [9472, 6400, 1, 256]
    - [108, 4852.21]
  - - [16640, 3072, 1, 256]
    - [114, 4838.79]
  - - [30208, 17921, 1, 256]
    - [114, 4829.29]
  - - [5376, 1281, 1, 256]
    - [110, 4372.48]
  - - [19200, 6657, 1, 256]
    - [114, 4800.91]
  - - [22016, 9729, 1, 256]
    - [114, 4808.68]
  - - [18176, 768, 1, 256]
    - [108, 4681.58]
  - - [7168, 1792, 1, 256]
    - [108, 4698.16]
  - - [21760, 1792, 1, 256]
    - [108, 4854.8]
  - - [29184, 1792, 1, 256]
    - [108, 4874.9]
  - - [12288, 1792, 1, 256]
    - [108, 4788.44]
  - - [15616, 3328, 1, 256]
    - [108, 4859.28]
  - - [22528, 1536, 1, 256]
    - [114, 4805.14]
  - - [14848, 2305, 1, 256]
    - [108, 4677.19]
  - - [41216, 1025, 1, 256]
    - [111, 4542.24]
  - - [8192, 3072, 1, 256]
    - [114, 4767.24]
  - - [5888, 1792, 1, 256]
    - [108, 4663.24]
  - - [21760, 3072, 1, 256]
    - [114, 4862.08]
  - - [22272, 9985, 1, 256]
    - [108, 4882.96]
  - - [29184, 1536, 1, 256]
    - [114, 4811.18]
  - - [19456, 1536, 1, 256]
    - [114, 4792.89]
  - - [26112, 1281, 1, 256]
    - [111, 4667.54]
  - - [18944, 1281, 1, 256]
    - [111, 4624.26]
  - - [22016, 3072, 1, 256]
    - [114, 4848.15]
  - - [30720, 9216, 1, 256]
    - [114, 4889.5]
  - - [39168, 768, 1, 256]
    - [108, 4823.82]
  - - [39424, 1280, 1, 256]
    - [108, 4869.67]
  - - [39680, 1792, 1, 256]
    - [108, 4888.94]
  - - [28928, 1281, 1, 256]
    - [111, 4671.6]
  - - [9728, 1536, 1, 256]
    - [114, 4653.99]
  - - [5120, 1792, 1, 256]
    - [114, 4593.26]
  - - [34560, 9216, 1, 256]
    - [114, 4897.29]
  - - [33536, 1281, 1, 256]
    - [111, 4683.76]
  - - [12032, 8705, 1, 256]
    - [114, 4790.34]
  - - [10752, 7425, 1, 256]
    - [108, 4828.48]
  - - [44032, 1792, 1, 256]
    - [108, 4890.7]
  - - [18688, 1536, 1, 256]
    - [114, 4779.65]
  - - [16128, 3840, 1, 256]
    - [108, 4878.42]
  - - [38656, 768, 1, 256]
    - [108, 4817.86]
  - - [21248, 1792, 1, 256]
    - [108, 4849.53]
  - - [36352, 3072, 1, 256]
    - [114, 4882.43]
  - - [16896, 1281, 1, 256]
    - [110, 4608.89]
  - - [19968, 7680, 1, 256]
    - [114, 4881.37]
  - - [14848, 1536, 1, 256]
    - [114, 4733.18]
  - - [3840, 513, 1, 256]
    - [110, 3689.64]
  - - [38400, 3072, 1, 256]
    - [114, 4876.81]
  - - [5376, 768, 1, 256]
    - [108, 4378.48]
  - - [37888, 1280, 1, 256]
    - [108, 4866.85]
  - - [20224, 9216, 1, 256]
    - [114, 4872.12]
  - - [17408, 5120, 1, 256]
    - [114, 4877.14]
  - - [28928, 9216, 1, 256]
    - [114, 4888.32]
  - - [19456, 1792, 1, 256]
    - [108, 4829.8]
  - - [10752, 3072, 1, 256]
    - [114, 4806.57]
  - - [35072, 1792, 1, 256]
    - [108, 4876.33]
  - - [28672, 1281, 1, 256]
    - [111, 4669.63]
  - - [31488, 19200, 1, 256]
    - [108, 4934.29]
  - - [11008, 7937, 1, 256]
    - [108, 4827.77]
  - - [21248, 8705, 1, 256]
    - [114, 4804.78]
  - - [13568, 3072, 1, 256]
    - [114, 4814.95]
  - - [28416, 1280, 1, 256]
    - [108, 4850.07]
  - - [39168, 1280, 1, 256]
    - [108, 4869.1]
  - - [15616, 3329, 1, 256]
    - [108, 4759.57]
  - - [36864, 3072, 1, 256]
    - [114, 4877.52]
  - - [34560, 22273, 1, 256]
    - [108, 4911.52]
  - - [11520, 1280, 1, 256]
    - [108, 4713.88]
  - - [34048, 768, 1, 256]
    - [108, 4799.61]
  - - [40448, 27648, 1, 256]
    - [114, 4900.89]
  - - [28416, 16129, 1, 256]
    - [108, 4900.77]
  - - [34816, 22529, 1, 256]
    - [114, 4840.24]
  - - [22528, 3072, 1, 256]
    - [114, 4856.62]
  - - [27136, 14593, 1, 256]
    - [108, 4876.34]
  - - [35584, 3072, 1, 256]
    - [114, 4864.55]
  - - [43008, 3072, 1, 256]
    - [114, 4876.39]
  - - [30464, 1792, 1, 256]
    - [108, 4874.38]
  - - [16384, 4097, 1, 256]
    - [114, 4727.13]
  - - [20992, 9216, 1, 256]
    - [114, 4884.6]
  - - [43776, 1536, 1, 256]
    - [114, 4851.31]
  - - [3072, 2817, 1, 256]
    - [108, 4463.97]
  - - [31488, 1792, 1, 256]
    - [108, 4881.85]
  - - [31488, 9216, 1, 256]
    - [114, 4891.61]
  - - [26368, 1281, 1, 256]
    - [110, 4656.34]
  - - [22272, 9984, 1, 256]
    - [108, 4927.08]
  - - [41728, 1537, 1, 256]
    - [114, 4627.73]
  - - [34560, 768, 1, 256]
    - [108, 4824.87]
  - - [26880, 1792, 1, 256]
    - [108, 4869.78]
  - - [30464, 768, 1, 256]
    - [108, 4787.28]
  - - [8448, 1281, 1, 256]
    - [111, 4505.01]
  - - [40704, 1281, 1, 256]
    - [111, 4687.89]
  - - [22784, 9216, 1, 256]
    - [114, 4883.28]
  - - [24320, 1281, 1, 256]
    - [105, 4658.09]
  - - [30720, 1281, 1, 256]
    - [111, 4674.19]
  - - [17920, 1280, 1, 256]
    - [108, 4779.91]
  - - [37632, 1281, 1, 256]
    - [111, 4683.16]
  - - [2816, 1792, 1, 256]
    - [108, 4496.82]
  - - [41472, 1537, 1, 256]
    - [114, 4634.45]
  - - [33536, 1280, 1, 256]
    - [108, 4858.73]
  - - [43008, 27648, 1, 256]
    - [114, 4902.81]
  - - [39424, 27137, 1, 256]
    - [114, 4844.63]
  - - [24320, 1792, 1, 256]
    - [108, 4852.75]
  - - [34816, 1280, 1, 256]
    - [108, 4855.84]
  - - [32000, 3072, 1, 256]
    - [114, 4866.95]
  - - [6144, 768, 1, 256]
    - [114, 4524.19]
  - - [12800, 1792, 1, 256]
    - [108, 4778.51]
  - - [41728, 1280, 1, 256]
    - [108, 4863.36]
  - - [15872, 3072, 1, 256]
    - [114, 4827.0]
  - - [30720, 768, 1, 256]
    - [108, 4811.05]
  - - [33792, 1281, 1, 256]
    - [111, 4682.58]
  - - [15872, 1792, 1, 256]
    - [108, 4818.61]
  - - [36608, 1280, 1, 256]
    - [108, 4865.07]
  - - [39936, 1792, 1, 256]
    - [108, 4892.15]
  - - [10496, 7425, 1, 256]
    - [108, 4830.56]
  - - [16896, 4608, 1, 256]
    - [114, 4855.85]
  - - [9984, 6913, 1, 256]
    - [108, 4832.39]
  - - [21248, 8960, 1, 256]
    - [108, 4918.7]
  - - [27392, 1536, 1, 256]
    - [114, 4814.66]
  - - [14336, 1792, 1, 256]
    - [114, 4788.88]
  - - [9472, 1280, 1, 256]
    - [108, 4686.8]
  - - [24832, 12544, 1, 256]
    - [108, 4925.92]
  - - [30464, 18176, 1, 256]
    - [108, 4926.11]
  - - [36096, 1280, 1, 256]
    - [108, 4867.95]
  - - [31744, 19201, 1, 256]
    - [108, 4887.65]
  - - [11008, 1280, 1, 256]
    - [108, 4709.99]
  - - [41216, 768, 1, 256]
    - [108, 4826.67]
  - - [1792, 768, 1, 256]
    - [129, 3727.49]
  - - [20992, 1280, 1, 256]
    - [108, 4810.39]
  - - [41216, 1281, 1, 256]
    - [111, 4695.74]
  - - [23040, 1280, 1, 256]
    - [108, 4834.5]
  - - [33792, 1792, 1, 256]
    - [108, 4882.32]
  - - [1536, 2048, 1, 256]
    - [108, 4439.4]
  - - [43264, 3328, 1, 256]
    - [108, 4918.88]
  - - [40192, 3072, 1, 256]
    - [114, 4880.38]
  - - [42240, 3072, 1, 256]
    - [114, 4884.1]
  - - [32256, 9216, 1, 256]
    - [114, 4883.17]
  - - [41984, 2049, 1, 256]
    - [114, 4680.53]
  - - [6656, 1792, 1, 256]
    - [108, 4646.44]
  - - [13824, 1537, 1, 256]
    - [114, 4538.24]
  - - [20736, 3072, 1, 256]
    - [114, 4850.35]
  - - [8192, 768, 1, 256]
    - [131, 4483.39]
  - - [43008, 768, 1, 256]
    - [108, 4841.69]
  - - [36096, 23809, 1, 256]
    - [108, 4911.33]
  - - [41728, 9216, 1, 256]
    - [114, 4897.8]
  - - [28160, 1281, 1, 256]
    - [111, 4672.57]
  - - [25600, 768, 1, 256]
    - [108, 4757.07]
  - - [9216, 1281, 1, 256]
    - [111, 4503.57]
  - - [37632, 768, 1, 256]
    - [108, 4822.8]
  - - [25600, 9216, 1, 256]
    - [114, 4876.5]
  - - [19968, 3072, 1, 256]
    - [114, 4854.06]
  - - [18176, 1280, 1, 256]
    - [108, 4785.71]
  - - [15616, 9216, 1, 256]
    - [114, 4869.47]
  - - [29184, 16897, 1, 256]
    - [114, 4834.06]
  - - [7168, 3841, 1, 256]
    - [108, 4695.84]
  - - [40704, 769, 1, 256]
    - [108, 4462.96]
  - - [39936, 1281, 1, 256]
    - [111, 4687.48]
  - - [6144, 3073, 1, 256]
    - [114, 4615.21]
  - - [9984, 1281, 1, 256]
    - [110, 4528.26]
  - - [8192, 1281, 1, 256]
    - [110, 4464.62]
  - - [34304, 1792, 1, 256]
    - [108, 4885.76]
  - - [39936, 1280, 1, 256]
    - [108, 4871.87]
  - - [43520, 9216, 1, 256]
    - [114, 4897.44]
  - - [18688, 6400, 1, 256]
    - [108, 4909.35]
  - - [20992, 1536, 1, 256]
    - [114, 4787.71]
  - - [7680, 4608, 1, 256]
    - [114, 4806.61]
  - - [21760, 768, 1, 256]
    - [108, 4730.63]
  - - [1536, 1280, 1, 256]
    - [114, 4290.13]
  - - [43264, 3072, 1, 256]
    - [114, 4876.04]
  - - [21760, 9216, 1, 256]
    - [114, 4883.57]
  - - [18432, 768, 1, 256]
    - [114, 4719.82]
  - - [11264, 768, 1, 256]
    - [129, 4548.17]
  - - [42496, 3072, 1, 256]
    - [114, 4874.68]
  - - [34048, 1280, 1, 256]
    - [108, 4859.0]
  - - [12800, 1281, 1, 256]
    - [111, 4565.37]
  - - [15104, 1536, 1, 256]
    - [114, 4754.65]
  - - [30208, 17665, 1, 256]
    - [108, 4888.96]
  - - [27392, 15105, 1, 256]
    - [108, 4893.62]
  - - [512, 513, 1, 256]
    - [116, 2042.54]
  - - [13312, 1536, 1, 256]
    - [114, 4704.74]
  - - [29952, 17409, 1, 256]
    - [114, 4835.83]
  - - [43264, 1280, 1, 256]
    - [108, 4883.15]
  - - [44032, 3072, 1, 256]
    - [114, 4881.55]
  - - [3840, 1280, 1, 256]
    - [114, 4429.98]
  - - [32768, 9216, 1, 256]
    - [114, 4890.08]
  - - [41216, 9216, 1, 256]
    - [114, 4895.49]
  - - [8448, 1536, 1, 256]
    - [114, 4676.87]
  - - [36352, 768, 1, 256]
    - [108, 4815.45]
  - - [2560, 2560, 1, 256]
    - [114, 4505.65]
  - - [12288, 1280, 1, 256]
    - [108, 4731.53]
  - - [768, 513, 1, 256]
    - [118, 2908.32]
  - - [23552, 768, 1, 256]
    - [108, 4753.14]
  - - [11264, 1281, 1, 256]
    - [111, 4539.26]
  - - [4096, 1281, 1, 256]
    - [131, 4242.12]
  - - [7168, 3072, 1, 256]
    - [114, 4736.94]
  - - [19712, 1792, 1, 256]
    - [108, 4838.89]
  - - [27136, 1281, 1, 256]
    - [111, 4660.66]
  - - [44288, 4353, 1, 256]
    - [108, 4837.39]
  - - [43776, 1281, 1, 256]
    - [111, 4694.73]
  - - [36608, 768, 1, 256]
    - [114, 4802.25]
  - - [34816, 768, 1, 256]
    - [108, 4807.9]
  - - [15616, 3073, 1, 256]
    - [114, 4702.18]
  - - [37376, 24833, 1, 256]
    - [108, 4889.54]
  - - [38144, 25857, 1, 256]
    - [108, 4908.37]
  - - [26880, 14592, 1, 256]
    - [108, 4938.53]
  - - [6144, 2817, 1, 256]
    - [108, 4615.38]
  - - [35584, 1280, 1, 256]
    - [108, 4862.7]
  - - [23808, 768, 1, 256]
    - [108, 4754.44]
  - - [33280, 1281, 1, 256]
    - [104, 4679.1]
  - - [39168, 26881, 1, 256]
    - [108, 4913.57]
  - - [20736, 1280, 1, 256]
    - [108, 4810.39]
  - - [5120, 1793, 1, 256]
    - [108, 4408.24]
  - - [32512, 19969, 1, 256]
    - [114, 4835.79]
  - - [17664, 1281, 1, 256]
    - [111, 4616.7]
  - - [5632, 1281, 1, 256]
    - [111, 4389.94]
  - - [42240, 1280, 1, 256]
    - [108, 4881.91]
  - - [43008, 2817, 1, 256]
    - [108, 4773.23]
  - - [26112, 13825, 1, 256]
    - [114, 4833.17]
  - - [1024, 1024, 1, 256]
    - [100, 3942.96]
  - - [4352, 3072, 1, 256]
    - [114, 4641.13]
  - - [14336, 1280, 1, 256]
    - [108, 4757.95]
  - - [33536, 3072, 1, 256]
    - [114, 4862.46]
  - - [9728, 6657, 1, 256]
    - [114, 4749.98]
  - - [2048, 3072, 1, 256]
    - [121, 4491.9]
  - - [24832, 9216, 1, 256]
    - [114, 4894.47]
  - - [37888, 1536, 1, 256]
    - [114, 4848.4]
  - - [5632, 2561, 1, 256]
    - [114, 4527.92]
  - - [41472, 1280, 1, 256]
    - [108, 4873.18]
  - - [3072, 3072, 1, 256]
    - [108, 4626.07]
  - - [29184, 1281, 1, 256]
    - [111, 4670.26]
  - - [33280, 20992, 1, 256]
    - [114, 4894.66]
  - - [25344, 1281, 1, 256]
    - [111, 4665.03]
  - - [4096, 1280, 1, 256]
    - [121, 4449.01]
  - - [20224, 7936, 1, 256]
    - [108, 4914.41]
  - - [28672, 16384, 1, 256]
    - [114, 4894.96]
  - - [28416, 9216, 1, 256]
    - [114, 4893.35]
  - - [7936, 768, 1, 256]
    - [108, 4503.76]
  - - [23552, 11265, 1, 256]
    - [114, 4822.78]
  - - [25088, 3072, 1, 256]
    - [114, 4848.19]
  - - [32000, 19457, 1, 256]
    - [114, 4832.33]
  - - [44800, 3072, 1, 256]
    - [114, 4869.17]
  - - [37120, 1792, 1, 256]
    - [108, 4882.97]
  - - [30464, 18177, 1, 256]
    - [108, 4902.06]
  - - [4864, 2048, 1, 256]
    - [114, 4577.03]
  - - [44544, 4608, 1, 256]
    - [114, 4894.31]
  - - [29440, 1280, 1, 256]
    - [108, 4838.64]
  - - [7168, 768, 1, 256]
    - [131, 4462.03]
  - - [18944, 9216, 1, 256]
    - [114, 4885.46]
  - - [33280, 20737, 1, 256]
    - [108, 4890.04]
  - - [25856, 3072, 1, 256]
    - [114, 4858.55]
  - - [9472, 1281, 1, 256]
    - [110, 4500.71]
  - - [8192, 1280, 1, 256]
    - [108, 4643.89]
  - - [24320, 768, 1, 256]
    - [108, 4763.79]
  - - [27648, 9216, 1, 256]
    - [114, 4892.71]
  - - [42752, 9216, 1, 256]
    - [114, 4892.88]
  - - [5120, 2049, 1, 256]
    - [114, 4448.53]
  - - [28160, 9216, 1, 256]
    - [114, 4891.17]
  - - [37632, 25089, 1, 256]
    - [114, 4848.75]
  - - [28928, 768, 1, 256]
    - [108, 4778.91]
  - - [22016, 1792, 1, 256]
    - [108, 4846.3]
  - - [16384, 9216, 1, 256]
    - [114, 4875.89]
  - - [21504, 9217, 1, 256]
    - [114, 4813.93]
  - - [20480, 7937, 1, 256]
    - [108, 4849.09]
  - - [33536, 21248, 1, 256]
    - [108, 4930.79]
  - - [41728, 1281, 1, 256]
    - [111, 4690.84]
  - - [12800, 768, 1, 256]
    - [114, 4593.64]
  - - [28672, 9216, 1, 256]
    - [114, 4895.61]
  - - [6144, 1280, 1, 256]
    - [108, 4641.86]
  - - [30976, 1280, 1, 256]
    - [108, 4856.28]
  - - [32000, 9216, 1, 256]
    - [114, 4895.58]
  - - [40448, 1280, 1, 256]
    - [108, 4873.65]
  - - [44544, 3072, 1, 256]
    - [114, 4888.4]
  - - [5376, 3072, 1, 256]
    - [114, 4702.01]
  - - [35584, 1792, 1, 256]
    - [108, 4888.78]
  - - [35840, 23297, 1, 256]
    - [108, 4896.78]
  - - [23808, 11521, 1, 256]
    - [108, 4896.2]
  - - [13312, 1025, 1, 256]
    - [110, 4411.78]
  - - [18176, 9216, 1, 256]
    - [114, 4877.85]
  - - [17920, 5633, 1, 256]
    - [114, 4768.68]
  - - [23808, 1281, 1, 256]
    - [111, 4644.56]
  - - [33024, 1280, 1, 256]
    - [108, 4860.45]
  - - [27648, 3072, 1, 256]
    - [114, 4859.92]
  - - [1024, 3072, 1, 256]
    - [121, 4341.75]
  - - [22016, 9216, 1, 256]
    - [114, 4887.16]
  - - [20992, 1281, 1, 256]
    - [111, 4636.96]
  - - [3840, 1281, 1, 256]
    - [111, 4244.56]
  - - [21760, 9473, 1, 256]
    - [108, 4874.58]
  - - [6144, 1536, 1, 256]
    - [114, 4604.21]
  - - [16896, 1536, 1, 256]
    - [114, 4777.63]
  - - [19968, 768, 1, 256]
    - [108, 4735.44]
  - - [23552, 11264, 1, 256]
    - [114, 4887.59]
  - - [27904, 3072, 1, 256]
    - [114, 4871.25]
  - - [19712, 7425, 1, 256]
    - [108, 4855.1]
  - - [26624, 14081, 1, 256]
    - [108, 4880.05]
  - - [31232, 1280, 1, 256]
    - [108, 4854.43]
  - - [3328, 257, 1, 256]
    - [106, 3325.57]
  - - [24320, 9216, 1, 256]
    - [114, 4879.89]
  - - [14080, 3072, 1, 256]
    - [114, 4820.2]
  - - [17408, 3072, 1, 256]
    - [114, 4833.43]
  - - [21504, 9216, 1, 256]
    - [114, 4893.88]
  - - [10752, 1281, 1, 256]
    - [111, 4544.48]
  - - [14848, 2560, 1, 256]
    - [114, 4809.98]
  - - [34304, 3072, 1, 256]
    - [114, 4867.98]
  - - [15104, 9216, 1, 256]
    - [114, 4880.09]
  - - [10496, 768, 1, 256]
    - [108, 4559.83]
  - - [17152, 4865, 1, 256]
    - [108, 4815.64]
  - - [38912, 26625, 1, 256]
    - [114, 4845.15]
  - - [44288, 1281, 1, 256]
    - [111, 4694.49]
  - - [41216, 1792, 1, 256]
    - [108, 4892.9]
  - - [39424, 3072, 1, 256]
    - [114, 4879.59]
  - - [30720, 18433, 1, 256]
    - [114, 4830.81]
  - - [18944, 6657, 1, 256]
    - [114, 4786.02]
  - - [5632, 1792, 1, 256]
    - [108, 4648.94]
  - - [2304, 1281, 1, 256]
    - [114, 4179.94]
  - - [18176, 1792, 1, 256]
    - [108, 4833.0]
  - - [31232, 9216, 1, 256]
    - [114, 4891.3]
  - - [31744, 1536, 1, 256]
    - [114, 4834.71]
  - - [42752, 2561, 1, 256]
    - [114, 4723.03]
  - - [18688, 9216, 1, 256]
    - [114, 4873.43]
  - - [43776, 1792, 1, 256]
    - [108, 4905.12]
  - - [25344, 1280, 1, 256]
    - [108, 4838.45]
  - - [10240, 1792, 1, 256]
    - [108, 4747.95]
  - - [33792, 21505, 1, 256]
    - [114, 4845.58]
  - - [35072, 1536, 1, 256]
    - [114, 4846.93]
  - - [25856, 13313, 1, 256]
    - [114, 4827.17]
  - - [32000, 1280, 1, 256]
    - [108, 4851.82]
  - - [29952, 3072, 1, 256]
    - [114, 4871.69]
  - - [23296, 1536, 1, 256]
    - [114, 4799.82]
  - - [5888, 768, 1, 256]
    - [108, 4371.71]
  - - [20480, 9216, 1, 256]
    - [114, 4889.14]
  - - [21504, 1536, 1, 256]
    - [114, 4806.02]
  - - [7424, 1280, 1, 256]
    - [114, 4565.19]
  - - [19200, 1280, 1, 256]
    - [108, 4796.78]
  - - [11008, 7936, 1, 256]
    - [108, 4889.21]
  - - [17152, 1792, 1, 256]
    - [108, 4831.58]
  - - [38656, 1280, 1, 256]
    - [108, 4866.01]
  - - [22528, 768, 1, 256]
    - [108, 4736.29]
  - - [23040, 10753, 1, 256]
    - [114, 4824.01]
  - - [8960, 5889, 1, 256]
    - [108, 4803.27]
  - - [21504, 1280, 1, 256]
    - [108, 4812.87]
  - - [16640, 4352, 1, 256]
    - [108, 4884.81]
  - - [30464, 3072, 1, 256]
    - [114, 4858.35]
  - - [13312, 1281, 1, 256]
    - [111, 4576.36]
  - - [8960, 1281, 1, 256]
    - [111, 4509.09]
  - - [16128, 9216, 1, 256]
    - [114, 4881.83]
  - - [26880, 1281, 1, 256]
    - [111, 4665.95]
  - - [5632, 1280, 1, 256]
    - [114, 4508.24]
  - - [43008, 1280, 1, 256]
    - [108, 4874.13]
  - - [22528, 1280, 1, 256]
    - [108, 4809.98]
  - - [21504, 1792, 1, 256]
    - [108, 4850.43]
  - - [6400, 768, 1, 256]
    - [108, 4413.2]
  - - [39680, 1536, 1, 256]
    - [114, 4848.85]
  - - [25344, 13057, 1, 256]
    - [108, 4896.54]
  - - [39424, 9216, 1, 256]
    - [114, 4898.24]
  - - [27648, 1792, 1, 256]
    - [108, 4873.95]
  - - [25600, 3072, 1, 256]
    - [114, 4857.7]
  - - [28416, 3072, 1, 256]
    - [114, 4871.19]
  - - [24832, 1281, 1, 256]
    - [111, 4651.3]
  - - [12032, 8960, 1, 256]
    - [108, 4898.88]
  - - [25088, 1281, 1, 256]
    - [111, 4655.96]
  - - [12800, 257, 1, 256]
    - [110, 3664.02]
  - - [43264, 1792, 1, 256]
    - [108, 4888.68]
  - - [40192, 1280, 1, 256]
    - [108, 4867.36]
  - - [20736, 8193, 1, 256]
    - [114, 4814.18]
  - - [30976, 9216, 1, 256]
    - [114, 4890.09]
  - - [1280, 1281, 1, 256]
    - [121, 3814.6]
  - - [23552, 1536, 1, 256]
    - [114, 4816.73]
  - - [16384, 3072, 1, 256]
    - [114, 4834.64]
  - - [25856, 1280, 1, 256]
    - [108, 4837.78]
  - - [40192, 27648, 1, 256]
    - [114, 4899.44]
  - - [31232, 1792, 1, 256]
    - [108, 4884.35]
  - - [36352, 23809, 1, 256]
    - [108, 4889.75]
  - - [23552, 1281, 1, 256]
    - [111, 4645.58]
  - - [15872, 3329, 1, 256]
    - [108, 4749.94]
  - - [1792, 1792, 1, 256]
    - [120, 4201.16]
  - - [31744, 1792, 1, 256]
    - [108, 4872.27]
  - - [14336, 1281, 1, 256]
    - [111, 4585.91]
  - - [9984, 3072, 1, 256]
    - [114, 4803.46]
  - - [11776, 1792, 1, 256]
    - [114, 4762.05]
  - - [37120, 1536, 1, 256]
    - [114, 4850.07]
  - - [14592, 2304, 1, 256]
    - [108, 4845.03]
  - - [16384, 1281, 1, 256]
    - [110, 4598.04]
  - - [7424, 768, 1, 256]
    - [114, 4468.58]
  - - [10240, 1536, 1, 256]
    - [114, 4677.88]
  - - [2816, 2561, 1, 256]
    - [114, 4419.32]
  - - [35072, 1280, 1, 256]
    - [108, 4862.24]
  - - [27392, 9216, 1, 256]
    - [114, 4892.62]
  - - [15104, 1280, 1, 256]
    - [114, 4749.24]
  - - [15104, 3072, 1, 256]
    - [114, 4829.19]
  - - [19200, 9216, 1, 256]
    - [114, 4892.23]
  - - [6656, 1280, 1, 256]
    - [108, 4605.62]
  - - [36096, 23553, 1, 256]
    - [114, 4842.95]
  - - [1024, 1025, 1, 256]
    - [95, 3821.07]
  - - [9216, 1280, 1, 256]
    - [108, 4680.56]
  - - [16128, 3841, 1, 256]
    - [108, 4789.84]
  - - [18432, 5889, 1, 256]
    - [108, 4831.48]
  - - [42496, 1280, 1, 256]
    - [108, 4874.3]
  - - [43776, 3841, 1, 256]
    - [108, 4828.55]
  - - [22528, 10241, 1, 256]
    - [114, 4822.0]
  - - [20224, 3072, 1, 256]
    - [114, 4847.43]
  - - [39680, 3072, 1, 256]
    - [114, 4879.87]
  - - [20736, 8449, 1, 256]
    - [108, 4871.02]
  - - [15104, 2816, 1, 256]
    - [108, 4846.88]
  - - [25088, 1536, 1, 256]
    - [114, 4798.81]
  - - [30720, 1792, 1, 256]
    - [108, 4882.78]
  - - [36864, 24321, 1, 256]
    - [108, 4898.3]
  - - [12288, 1281, 1, 256]
    - [111, 4569.0]
  - - [22784, 1536, 1, 256]
    - [114, 4806.97]
  - - [35584, 1281, 1, 256]
    - [110, 4679.24]
  - - [7424, 4097, 1, 256]
    - [114, 4677.61]
  - - [20224, 1281, 1, 256]
    - [111, 4629.47]
  - - [7680, 4609, 1, 256]
    - [114, 4717.36]
  - - [12032, 768, 1, 256]
    - [108, 4602.67]
  - - [1792, 3072, 1, 256]
    - [121, 4483.61]
  - - [6400, 3073, 1, 256]
    - [114, 4596.99]
  - - [29440, 17153, 1, 256]
    - [108, 4897.93]
  - - [8704, 1792, 1, 256]
    - [114, 4718.05]
  - - [30720, 3072, 1, 256]
    - [114, 4863.94]
  - - [16384, 3841, 1, 256]
    - [108, 4773.2]
  - - [40192, 9216, 1, 256]
    - [114, 4884.88]
  - - [15616, 1792, 1, 256]
    - [108, 4807.84]
  - - [23040, 1792, 1, 256]
    - [108, 4856.04]
  - - [42240, 1281, 1, 256]
    - [111, 4696.3]
  - - [6912, 1536, 1, 256]
    - [114, 4626.39]
  - - [37888, 25601, 1, 256]
    - [114, 4845.53]
  - - [26368, 14080, 1, 256]
    - [108, 4926.21]
  - - [37632, 1280, 1, 256]
    - [108, 4872.24]
  - - [30208, 3072, 1, 256]
    - [114, 4861.41]
  - - [36608, 1281, 1, 256]
    - [104, 4680.64]
  - - [26880, 768, 1, 256]
    - [108, 4782.99]
  - - [33024, 20736, 1, 256]
    - [108, 4937.08]
  - - [35072, 22784, 1, 256]
    - [108, 4937.24]
  - - [9472, 6145, 1, 256]
    - [114, 4753.47]
  - - [22784, 1792, 1, 256]
    - [108, 4851.38]
  - - [22272, 1280, 1, 256]
    - [108, 4820.91]
  - - [13568, 1281, 1, 256]
    - [110, 4584.02]
  - - [5120, 1536, 1, 256]
    - [129, 4516.08]
  - - [32768, 1280, 1, 256]
    - [108, 4854.52]
  - - [768, 2048, 1, 256]
    - [119, 4135.73]
  - - [4352, 1281, 1, 256]
    - [108, 4300.28]
  - - [27904, 1281, 1, 256]
    - [105, 4662.46]
  - - [9728, 1281, 1, 256]
    - [111, 4508.42]
  - - [1024, 1280, 1, 256]
    - [120, 4046.62]
  - - [10496, 1280, 1, 256]
    - [108, 4685.99]
  - - [6400, 3328, 1, 256]
    - [108, 4768.92]
  - - [12544, 1280, 1, 256]
    - [108, 4737.03]
  - - [10240, 1281, 1, 256]
    - [111, 4538.91]
  - - [8704, 1281, 1, 256]
    - [110, 4493.63]
  - - [13312, 1792, 1, 256]
    - [108, 4784.63]
  - - [41984, 27648, 1, 256]
    - [114, 4899.26]
  - - [33024, 20481, 1, 256]
    - [114, 4844.49]
  - - [33280, 1536, 1, 256]
    - [114, 4835.86]
  - - [9216, 3072, 1, 256]
    - [114, 4788.68]
  - - [2816, 1536, 1, 256]
    - [99, 4333.5]
  - - [22528, 1792, 1, 256]
    - [108, 4850.54]
  - - [25088, 768, 1, 256]
    - [108, 4756.33]
  - - [13825, 128, 1, 128]
    - [183, 2964.77]
  - - [20609, 128, 1, 256]
    - [196, 3907.18]
  - - [6017, 128, 1, 256]
    - [167, 3092.3]
  - - [2305, 128, 1, 128]
    - [180, 1854.87]
  - - [15745, 128, 1, 256]
    - [206, 3679.98]
  - - [8833, 128, 1, 128]
    - [204, 2980.23]
  - - [641, 128, 1, 128]
    - [181, 666.38]
  - - [2561, 128, 1, 256]
    - [200, 2375.96]
  - - [9217, 128, 1, 128]
    - [193, 2769.83]
  - - [15361, 128, 1, 256]
    - [206, 3512.07]
  - - [22913, 128, 1, 256]
    - [196, 3965.85]
  - - [2177, 128, 1, 128]
    - [180, 1805.06]
  - - [19073, 128, 1, 256]
    - [196, 3942.63]
  - - [28289, 128, 1, 128]
    - [194, 3631.21]
  - - [13057, 128, 1, 256]
    - [207, 3712.71]
  - - [1793, 128, 1, 128]
    - [182, 1684.43]
  - - [16769, 128, 1, 128]
    - [195, 3366.95]
  - - [23681, 128, 1, 256]
    - [204, 3880.68]
  - - [14593, 128, 1, 256]
    - [206, 3669.31]
  - - [24449, 128, 1, 128]
    - [205, 3534.89]
  - - [4609, 128, 1, 256]
    - [168, 3010.93]
  - - [10625, 128, 1, 128]
    - [194, 3064.79]
  - - [15745, 128, 1, 256]
    - [206, 3672.64]
  - - [12545, 128, 1, 256]
    - [194, 3608.46]
  - - [6017, 128, 1, 256]
    - [165, 3046.43]
  - - [5633, 128, 1, 128]
    - [185, 2704.9]
  - - [641, 128, 1, 256]
    - [199, 849.697]
  - - [18305, 128, 1, 256]
    - [207, 3820.5]
  - - [23297, 128, 1, 256]
    - [207, 3793.47]
  - - [21377, 128, 1, 256]
    - [195, 3812.77]
  - - [9601, 128, 1, 128]
    - [195, 2910.87]
  - - [13697, 128, 1, 256]
    - [173, 3630.08]
  - - [23681, 128, 1, 128]
    - [196, 3476.61]
  - - [24833, 128, 1, 256]
    - [194, 3937.91]
  - - [25985, 128, 1, 128]
    - [194, 3569.24]
  - - [9601, 128, 1, 256]
    - [193, 3294.99]
  - - [17153, 128, 1, 128]
    - [193, 3275.46]
  - - [9985, 128, 1, 128]
    - [196, 2882.22]
  - - [23297, 128, 1, 128]
    - [196, 3439.97]
  - - [19073, 128, 1, 128]
    - [205, 3470.59]
  - - [2689, 128, 1, 256]
    - [179, 2561.45]
  - - [4993, 128, 1, 128]
    - [185, 2625.33]
  - - [6913, 128, 1, 256]
    - [165, 3343.05]
  - - [6785, 128, 1, 128]
    - [205, 2748.9]
  - - [27905, 128, 1, 128]
    - [194, 3548.56]
  - - [7169, 128, 1, 256]
    - [148, 3440.45]
  - - [11905, 128, 1, 256]
    - [206, 3495.55]
  - - [1409, 128, 1, 128]
    - [180, 1384.0]
  - - [12673, 128, 1, 128]
    - [194, 3220.14]
  - - [27521, 128, 1, 256]
    - [193, 3940.78]
  - - [1409, 128, 1, 256]
    - [200, 1770.34]
  - - [25217, 128, 1, 128]
    - [205, 3547.01]
  - - [7297, 128, 1, 128]
    - [194, 2907.44]
  - - [14081, 128, 1, 128]
    - [194, 3100.85]
  - - [22913, 128, 1, 128]
    - [205, 3540.24]
  - - [10753, 128, 1, 256]
    - [169, 3462.61]
  - - [641, 128, 1, 256]
    - [181, 852.447]
  - - [21377, 128, 1, 256]
    - [206, 3814.44]
  - - [7937, 128, 1, 128]
    - [145, 2854.27]
  - - [11393, 128, 1, 128]
    - [194, 3207.27]
  - - [26369, 128, 1, 128]
    - [207, 3527.36]
  - - [12161, 128, 1, 256]
    - [207, 3564.33]
  - - [8449, 128, 1, 128]
    - [162, 2925.37]
  - - [22145, 128, 1, 256]
    - [195, 3880.47]
  - - [18305, 128, 1, 256]
    - [196, 3816.61]
  - - [20225, 128, 1, 256]
    - [207, 3807.06]
  - - [10241, 128, 1, 256]
    - [185, 3334.43]
  - - [4096, 128, 1, 256]
    - [137, 2817.33]
  - - [6913, 128, 1, 128]
    - [205, 2759.81]
  - - [4993, 128, 1, 256]
    - [138, 3180.61]
  - - [23681, 128, 1, 128]
    - [194, 3492.88]
  - - [6401, 128, 1, 256]
    - [147, 3162.67]
  - - [13057, 128, 1, 128]
    - [205, 3175.86]
  - - [2945, 128, 1, 128]
    - [195, 2229.71]
  - - [3713, 128, 1, 256]
    - [184, 3232.4]
  - - [10753, 128, 1, 128]
    - [185, 2869.33]
  - - [14849, 128, 1, 256]
    - [148, 3662.85]
  - - [3841, 128, 1, 128]
    - [167, 2250.75]
  - - [28289, 128, 1, 256]
    - [196, 4004.55]
  - - [12929, 128, 1, 128]
    - [194, 3260.91]
  - - [14081, 128, 1, 256]
    - [163, 3633.13]
  - - [14977, 128, 1, 256]
    - [195, 3809.12]
  - - [10753, 128, 1, 256]
    - [155, 3468.06]
  - - [12545, 128, 1, 128]
    - [194, 3135.1]
  - - [16129, 128, 1, 256]
    - [193, 3665.16]
  - - [11777, 128, 1, 256]
    - [185, 3360.4]
  - - [11777, 128, 1, 128]
    - [207, 2886.81]
  - - [17537, 128, 1, 256]
    - [195, 3716.07]
  - - [5377, 128, 1, 128]
    - [183, 2695.76]
  - - [8065, 128, 1, 256]
    - [172, 3594.6]
  - - [6145, 128, 1, 128]
    - [168, 2542.42]
  - - [20993, 128, 1, 128]
    - [194, 3289.5]
  - - [641, 128, 1, 128]
    - [181, 669.78]
  - - [15617, 128, 1, 128]
    - [195, 3179.3]
  - - [5633, 128, 1, 256]
    - [190, 3400.56]
  - - [4865, 128, 1, 128]
    - [207, 2564.61]
  - - [385, 128, 1, 256]
    - [181, 511.17]
  - - [7169, 128, 1, 256]
    - [147, 3416.43]
  - - [14593, 128, 1, 256]
    - [206, 3653.61]
  - - [3841, 128, 1, 256]
    - [135, 2671.09]
  - - [8833, 128, 1, 256]
    - [195, 3510.92]
  - - [4225, 128, 1, 128]
    - [154, 2451.22]
  - - [11009, 128, 1, 256]
    - [196, 3623.38]
  - - [512, 128, 1, 256]
    - [179, 682.008]
  - - [385, 128, 1, 128]
    - [181, 404.349]
  - - [19073, 128, 1, 128]
    - [194, 3473.69]
  - - [9473, 128, 1, 256]
    - [195, 3596.06]
  - - [5761, 128, 1, 128]
    - [167, 2502.36]
  - - [15617, 128, 1, 128]
    - [204, 3172.98]
  - - [11905, 128, 1, 128]
    - [205, 3072.65]
  - - [4097, 128, 1, 256]
    - [167, 2728.67]
  - - [24833, 128, 1, 256]
    - [207, 3949.37]
  - - [6145, 128, 1, 128]
    - [154, 2557.92]
  - - [25217, 128, 1, 256]
    - [173, 3898.43]
  - - [9089, 128, 1, 256]
    - [204, 3581.39]
  - - [10369, 128, 1, 256]
    - [207, 3492.72]
  - - [14209, 128, 1, 256]
    - [176, 3728.39]
  - - [6401, 128, 1, 128]
    - [167, 2661.78]
  - - [27137, 128, 1, 256]
    - [196, 3804.66]
  - - [16385, 128, 1, 256]
    - [138, 3468.38]
  - - [24833, 128, 1, 128]
    - [205, 3489.41]
  - - [18689, 128, 1, 128]
    - [207, 3354.53]
  - - [7553, 128, 1, 256]
    - [140, 3595.26]
  - - [8321, 128, 1, 128]
    - [146, 2976.68]
  - - [15361, 128, 1, 128]
    - [194, 3073.7]
  - - [10369, 128, 1, 256]
    - [206, 3475.57]
  - - [12545, 128, 1, 256]
    - [194, 3613.52]
  - - [1153, 128, 1, 128]
    - [181, 1160.37]
  - - [1025, 128, 1, 128]
    - [191, 997.245]
  - - [11905, 128, 1, 256]
    - [195, 3513.18]
  - - [19841, 128, 1, 256]
    - [195, 3818.13]
  - - [27521, 128, 1, 256]
    - [206, 3943.54]
  - - [15233, 128, 1, 128]
    - [206, 3338.38]
  - - [21761, 128, 1, 256]
    - [204, 3798.55]
  - - [17153, 128, 1, 256]
    - [204, 3800.86]
  - - [15617, 128, 1, 256]
    - [195, 3613.97]
  - - [4865, 128, 1, 256]
    - [185, 3084.68]
  - - [24449, 128, 1, 128]
    - [205, 3529.9]
  - - [6913, 128, 1, 128]
    - [183, 2735.81]
  - - [14209, 128, 1, 128]
    - [194, 3189.06]
  - - [19457, 128, 1, 256]
    - [207, 3661.66]
  - - [9857, 128, 1, 256]
    - [195, 3349.18]
  - - [11521, 128, 1, 128]
    - [204, 3007.65]
  - - [8449, 128, 1, 256]
    - [160, 3623.78]
  - - [6401, 128, 1, 128]
    - [168, 2669.91]
  - - [19841, 128, 1, 256]
    - [206, 3827.11]
  - - [7553, 128, 1, 256]
    - [165, 3591.07]
  - - [4097, 128, 1, 128]
    - [154, 2308.3]
  - - [18689, 128, 1, 128]
    - [196, 3353.06]
  - - [28673, 128, 1, 256]
    - [194, 3842.46]
  - - [12161, 128, 1, 128]
    - [194, 3134.78]
  - - [1921, 128, 1, 256]
    - [180, 1940.42]
  - - [13825, 128, 1, 128]
    - [176, 2952.42]
  - - [9985, 128, 1, 256]
    - [194, 3352.35]
  - - [1409, 128, 1, 128]
    - [182, 1390.67]
  - - [2048, 128, 1, 256]
    - [179, 2031.14]
  - - [7937, 128, 1, 256]
    - [172, 3480.73]
  - - [9857, 128, 1, 128]
    - [194, 2906.72]
  - - [13825, 128, 1, 256]
    - [176, 3564.83]
  - - [3073, 128, 1, 256]
    - [184, 2701.07]
  - - [4993, 128, 1, 128]
    - [194, 2649.14]
  - - [16129, 128, 1, 256]
    - [206, 3673.31]
  - - [9089, 128, 1, 128]
    - [193, 3026.71]
  - - [22145, 128, 1, 256]
    - [206, 3874.67]
  - - [23297, 128, 1, 128]
    - [205, 3427.6]
  - - [6785, 128, 1, 256]
    - [150, 3324.34]
  - - [5249, 128, 1, 256]
    - [156, 3282.43]
  - - [4865, 128, 1, 128]
    - [185, 2567.94]
  - - [7681, 128, 1, 256]
    - [161, 3366.66]
  - - [17153, 128, 1, 256]
    - [195, 3822.57]
  - - [1025, 128, 1, 256]
    - [200, 1301.83]
  - - [3329, 128, 1, 128]
    - [180, 2334.86]
  - - [25217, 128, 1, 128]
    - [194, 3544.58]
  - - [14465, 128, 1, 128]
    - [193, 3220.04]
  - - [9857, 128, 1, 256]
    - [207, 3356.14]
  - - [5633, 128, 1, 128]
    - [185, 2676.66]
  - - [11137, 128, 1, 256]
    - [205, 3702.7]
  - - [1153, 128, 1, 256]
    - [200, 1482.79]
  - - [12545, 128, 1, 128]
    - [205, 3135.1]
  - - [14465, 128, 1, 128]
    - [195, 3227.06]
  - - [11777, 128, 1, 256]
    - [185, 3363.93]
  - - [8192, 128, 1, 256]
    - [144, 3548.87]
  - - [16001, 128, 1, 128]
    - [206, 3286.87]
  - - [26753, 128, 1, 128]
    - [207, 3641.76]
  - - [10753, 128, 1, 128]
    - [178, 2869.35]
  - - [23681, 128, 1, 256]
    - [206, 3890.01]
  - - [7297, 128, 1, 128]
    - [194, 2907.44]
  - - [13697, 128, 1, 128]
    - [204, 3150.08]
  - - [28289, 128, 1, 256]
    - [196, 4010.8]
  - - [3073, 128, 1, 128]
    - [189, 2162.72]
  - - [22529, 128, 1, 256]
    - [194, 3763.41]
  - - [13057, 128, 1, 128]
    - [205, 3187.22]
  - - [18689, 128, 1, 256]
    - [194, 3826.56]
  - - [8833, 128, 1, 128]
    - [195, 2965.57]
  - - [1793, 128, 1, 128]
    - [182, 1696.1]
  - - [385, 128, 1, 256]
    - [181, 512.833]
  - - [257, 128, 1, 128]
    - [179, 265.826]
  - - [15233, 128, 1, 256]
    - [195, 3851.51]
  - - [27521, 128, 1, 128]
    - [205, 3599.18]
  - - [16385, 128, 1, 128]
    - [138, 2870.54]
  - - [25985, 128, 1, 128]
    - [196, 3581.25]
  - - [22529, 128, 1, 256]
    - [196, 3762.65]
  - - [12161, 128, 1, 256]
    - [194, 3556.7]
  - - [9601, 128, 1, 256]
    - [207, 3300.53]
  - - [4481, 128, 1, 256]
    - [168, 3038.77]
  - - [6017, 128, 1, 128]
    - [167, 2594.29]
  - - [7297, 128, 1, 256]
    - [149, 3503.94]
  - - [1024, 128, 1, 256]
    - [189, 1306.64]
  - - [7553, 128, 1, 128]
    - [194, 2986.22]
  - - [21761, 128, 1, 128]
    - [205, 3386.52]
  - - [4097, 128, 1, 256]
    - [154, 2735.34]
  - - [3841, 128, 1, 256]
    - [137, 2650.85]
  - - [6401, 128, 1, 256]
    - [154, 3153.16]
  - - [11393, 128, 1, 256]
    - [207, 3760.34]
  - - [11521, 128, 1, 256]
    - [195, 3434.51]
  - - [27905, 128, 1, 128]
    - [196, 3547.46]
  - - [11009, 128, 1, 256]
    - [205, 3611.77]
  - - [21761, 128, 1, 128]
    - [205, 3381.38]
  - - [7681, 128, 1, 256]
    - [163, 3359.47]
  - - [2305, 128, 1, 128]
    - [180, 1876.99]
  - - [12929, 128, 1, 256]
    - [205, 3729.38]
  - - [20225, 128, 1, 128]
    - [205, 3359.36]
  - - [17153, 128, 1, 128]
    - [195, 3257.25]
  - - [13313, 128, 1, 128]
    - [185, 2992.87]
  - - [512, 128, 1, 256]
    - [179, 680.894]
  - - [7553, 128, 1, 128]
    - [194, 2952.03]
  - - [26369, 128, 1, 128]
    - [194, 3527.36]
  - - [2561, 128, 1, 128]
    - [200, 1914.21]
  - - [1537, 128, 1, 128]
    - [200, 1447.25]
  - - [6017, 128, 1, 128]
    - [152, 2608.0]
  - - [24449, 128, 1, 256]
    - [207, 3948.09]
  - - [12289, 128, 1, 256]
    - [183, 3423.04]
  - - [4225, 128, 1, 256]
    - [137, 2891.5]
  - - [26369, 128, 1, 256]
    - [205, 3949.81]
  - - [17921, 128, 1, 256]
    - [196, 3629.4]
  - - [2945, 128, 1, 256]
    - [182, 2674.66]
  - - [24065, 128, 1, 128]
    - [196, 3308.84]
  - - [6529, 128, 1, 128]
    - [152, 2762.68]
  - - [6145, 128, 1, 256]
    - [148, 3056.46]
  - - [25985, 128, 1, 256]
    - [196, 3953.74]
  - - [14209, 128, 1, 128]
    - [193, 3196.06]
  - - [2048, 128, 1, 256]
    - [180, 2033.62]
  - - [4097, 128, 1, 128]
    - [168, 2321.09]
  - - [8705, 128, 1, 256]
    - [184, 3295.35]
  - - [2305, 128, 1, 256]
    - [180, 2239.92]
  - - [384, 128, 1, 256]
    - [179, 523.416]
  - - [2177, 128, 1, 128]
    - [189, 1812.4]
  - - [25601, 128, 1, 256]
    - [207, 3815.93]
  - - [15361, 128, 1, 128]
    - [193, 3026.4]
  - - [28673, 128, 1, 128]
    - [196, 3265.08]
  - - [20609, 128, 1, 128]
    - [194, 3486.77]
  - - [13057, 128, 1, 256]
    - [207, 3715.29]
  - - [9217, 128, 1, 128]
    - [182, 2751.68]
  - - [4096, 128, 1, 256]
    - [137, 2822.07]
  - - [17537, 128, 1, 256]
    - [195, 3717.03]
  - - [16001, 128, 1, 128]
    - [195, 3286.87]
  - - [21761, 128, 1, 256]
    - [206, 3789.68]
  - - [4481, 128, 1, 256]
    - [137, 3038.77]
  - - [385, 128, 1, 128]
    - [179, 399.23]
  - - [16769, 128, 1, 128]
    - [195, 3345.63]
  - - [22913, 128, 1, 256]
    - [207, 3967.52]
  - - [19457, 128, 1, 256]
    - [207, 3650.76]
  - - [6145, 128, 1, 256]
    - [148, 3050.9]
  - - [19457, 128, 1, 128]
    - [205, 3199.36]
  - - [1537, 128, 1, 128]
    - [202, 1443.93]
  - - [16769, 128, 1, 256]
    - [204, 3831.85]
  - - [12673, 128, 1, 256]
    - [207, 3676.26]
  - - [8321, 128, 1, 256]
    - [161, 3664.83]
  - - [3329, 128, 1, 128]
    - [180, 2346.92]
  - - [25985, 128, 1, 256]
    - [196, 3953.74]
  - - [5249, 128, 1, 128]
    - [193, 2707.8]
  - - [16129, 128, 1, 128]
    - [193, 3221.08]
  - - [13441, 128, 1, 256]
    - [161, 3583.11]
  - - [5377, 128, 1, 256]
    - [156, 3311.91]
  - - [9089, 128, 1, 128]
    - [193, 3044.05]
  - - [26753, 128, 1, 128]
    - [196, 3634.51]
  - - [20225, 128, 1, 256]
    - [207, 3806.2]
  - - [19457, 128, 1, 128]
    - [196, 3167.57]
  - - [6913, 128, 1, 256]
    - [165, 3337.15]
  - - [21377, 128, 1, 128]
    - [195, 3420.33]
  - - [14465, 128, 1, 256]
    - [206, 3711.17]
  - - [2689, 128, 1, 256]
    - [179, 2558.45]
  - - [11521, 128, 1, 256]
    - [196, 3393.75]
  - - [23297, 128, 1, 256]
    - [196, 3799.51]
  - - [11137, 128, 1, 128]
    - [194, 3159.08]
  - - [11393, 128, 1, 128]
    - [194, 3200.67]
  - - [13697, 128, 1, 256]
    - [161, 3639.51]
  - - [14209, 128, 1, 256]
    - [163, 3734.37]
  - - [16769, 128, 1, 256]
    - [195, 3825.45]
  - - [3329, 128, 1, 256]
    - [184, 2919.83]
  - - [11393, 128, 1, 256]
    - [194, 3757.31]
  - - [7681, 128, 1, 128]
    - [162, 2764.64]
  - - [7169, 128, 1, 128]
    - [178, 2780.7]
  - - [13441, 128, 1, 256]
    - [173, 3591.29]
  - - [257, 128, 1, 128]
    - [181, 263.828]
  - - [15233, 128, 1, 256]
    - [195, 3858.66]
  - - [5377, 128, 1, 128]
    - [185, 2682.61]
  - - [22145, 128, 1, 128]
    - [196, 3470.01]
  - - [11009, 128, 1, 128]
    - [194, 3071.72]
  - - [27521, 128, 1, 128]
    - [205, 3588.86]
  - - [20993, 128, 1, 256]
    - [196, 3788.83]
  - - [4609, 128, 1, 256]
    - [154, 3001.35]
  - - [3073, 128, 1, 128]
    - [180, 2162.72]
  - - [13313, 128, 1, 256]
    - [206, 3564.06]
  - - [11521, 128, 1, 128]
    - [205, 2988.6]
  - - [25601, 128, 1, 128]
    - [196, 3334.24]
  - - [4609, 128, 1, 128]
    - [154, 2510.46]
  - - [25601, 128, 1, 256]
    - [196, 3809.69]
  - - [16385, 128, 1, 128]
    - [183, 2860.75]
  - - [20993, 128, 1, 128]
    - [196, 3191.82]
  - - [5761, 128, 1, 256]
    - [165, 2942.29]
  - - [17921, 128, 1, 128]
    - [194, 3153.12]
  - - [14465, 128, 1, 256]
    - [206, 3705.36]
  - - [2305, 128, 1, 256]
    - [180, 2234.62]
  - - [2689, 128, 1, 128]
    - [180, 2114.04]
  - - [257, 128, 1, 256]
    - [179, 340.671]
  - - [8705, 128, 1, 128]
    - [184, 2749.09]
  - - [27137, 128, 1, 256]
    - [196, 3810.53]
  - - [1153, 128, 1, 256]
    - [202, 1468.95]
  - - [8705, 128, 1, 256]
    - [206, 3306.04]
  - - [10241, 128, 1, 128]
    - [185, 2772.45]
  - - [22913, 128, 1, 128]
    - [205, 3550.96]
  - - [20609, 128, 1, 256]
    - [196, 3903.56]
  - - [25217, 128, 1, 256]
    - [173, 3899.16]
  - - [8321, 128, 1, 128]
    - [144, 2968.89]
  - - [16385, 128, 1, 256]
    - [139, 3477.36]
  - - [14977, 128, 1, 128]
    - [194, 3314.21]
  - - [1921, 128, 1, 256]
    - [180, 1940.42]
  - - [7937, 128, 1, 256]
    - [160, 3491.95]
  - - [11137, 128, 1, 256]
    - [207, 3705.71]
  - - [3329, 128, 1, 256]
    - [182, 2916.7]
  - - [4225, 128, 1, 128]
    - [137, 2458.18]
  - - [14081, 128, 1, 256]
    - [176, 3653.84]
  - - [1024, 128, 1, 256]
    - [200, 1292.54]
  - - [12929, 128, 1, 256]
    - [205, 3729.39]
  - - [6529, 128, 1, 128]
    - [152, 2754.15]
  - - [25601, 128, 1, 128]
    - [194, 3323.67]
  - - [1409, 128, 1, 256]
    - [200, 1775.79]
  - - [9985, 128, 1, 128]
    - [205, 2892.4]
  - - [9857, 128, 1, 128]
    - [207, 2917.22]
  - - [3073, 128, 1, 256]
    - [193, 2675.24]
  - - [26369, 128, 1, 256]
    - [196, 3948.37]
  - - [18305, 128, 1, 128]
    - [194, 3394.18]
  - - [4225, 128, 1, 256]
    - [137, 2898.76]
  - - [1537, 128, 1, 256]
    - [200, 1870.89]
  - - [3457, 128, 1, 128]
    - [195, 2471.18]
  - - [1153, 128, 1, 128]
    - [193, 1160.37]
  - - [5249, 128, 1, 128]
    - [193, 2742.33]
  - - [24065, 128, 1, 256]
    - [196, 3751.49]
  - - [7297, 128, 1, 256]
    - [150, 3501.89]
  - - [12289, 128, 1, 128]
    - [183, 2912.95]
  - - [14593, 128, 1, 128]
    - [205, 3165.94]
  - - [9985, 128, 1, 256]
    - [205, 3345.49]
  - - [2177, 128, 1, 256]
    - [188, 2164.32]
  - - [4481, 128, 1, 128]
    - [137, 2559.86]
  - - [8065, 128, 1, 128]
    - [160, 2936.38]
  - - [14593, 128, 1, 128]
    - [205, 3179.41]
  - - [14081, 128, 1, 128]
    - [195, 3110.88]
  - - [3457, 128, 1, 256]
    - [184, 3048.41]
  - - [12929, 128, 1, 128]
    - [205, 3252.9]
  - - [3457, 128, 1, 128]
    - [184, 2424.64]
  - - [5761, 128, 1, 128]
    - [152, 2497.04]
  - - [24065, 128, 1, 256]
    - [196, 3773.75]
  - - [6529, 128, 1, 256]
    - [149, 3231.76]
  - - [15233, 128, 1, 128]
    - [194, 3343.76]
  - - [8705, 128, 1, 128]
    - [193, 2686.95]
  - - [4865, 128, 1, 256]
    - [183, 3061.0]
  - - [1025, 128, 1, 128]
    - [202, 1004.4]
  - - [8192, 128, 1, 256]
    - [144, 3562.05]
  - - [11009, 128, 1, 128]
    - [194, 3065.47]
  - - [26753, 128, 1, 256]
    - [196, 4045.79]
  - - [15361, 128, 1, 256]
    - [206, 3549.72]
  - - [14977, 128, 1, 256]
    - [195, 3810.3]
  - - [28289, 128, 1, 128]
    - [194, 3631.21]
  - - [4481, 128, 1, 128]
    - [135, 2563.43]
  - - [17537, 128, 1, 128]
    - [193, 3322.46]
  - - [3457, 128, 1, 256]
    - [193, 3048.41]
  - - [12289, 128, 1, 128]
    - [183, 2909.58]
  - - [18689, 128, 1, 256]
    - [207, 3830.39]
  - - [2177, 128, 1, 256]
    - [180, 2159.09]
  - - [20993, 128, 1, 256]
    - [194, 3782.99]
  - - [8065, 128, 1, 128]
    - [160, 2936.38]
  - - [13313, 128, 1, 256]
    - [183, 3548.98]
  - - [1793, 128, 1, 256]
    - [182, 2182.5]
  - - [22529, 128, 1, 128]
    - [196, 3233.31]
  - - [10625, 128, 1, 256]
    - [194, 3559.93]
  - - [12673, 128, 1, 256]
    - [207, 3680.16]
  - - [7937, 128, 1, 128]
    - [173, 2866.84]
  - - [17921, 128, 1, 128]
    - [195, 3085.52]
  - - [20225, 128, 1, 128]
    - [205, 3371.67]
  - - [9473, 128, 1, 256]
    - [195, 3612.8]
  - - [21377, 128, 1, 128]
    - [206, 3439.14]
  - - [14849, 128, 1, 128]
    - [178, 3036.52]
  - - [6785, 128, 1, 256]
    - [149, 3320.35]
  - - [257, 128, 1, 256]
    - [179, 341.777]
  - - [10241, 128, 1, 128]
    - [194, 2836.18]
  - - [4609, 128, 1, 128]
    - [168, 2517.13]
  - - [24449, 128, 1, 256]
    - [207, 3949.64]
  - - [14977, 128, 1, 128]
    - [205, 3298.17]
  - - [13697, 128, 1, 128]
    - [195, 3158.96]
  - - [9217, 128, 1, 256]
    - [195, 3349.86]
  - - [9601, 128, 1, 128]
    - [196, 2870.49]
  - - [19841, 128, 1, 128]
    - [206, 3398.95]
  - - [26753, 128, 1, 256]
    - [196, 4041.33]
  - - [24065, 128, 1, 128]
    - [194, 3321.11]
  - - [15745, 128, 1, 128]
    - [195, 3265.39]
  - - [4993, 128, 1, 256]
    - [139, 3160.96]
  - - [2945, 128, 1, 256]
    - [182, 2677.63]
  - - [13441, 128, 1, 128]
    - [195, 3145.96]
  - - [11777, 128, 1, 128]
    - [183, 2934.22]
  - - [1025, 128, 1, 256]
    - [203, 1295.8]
  - - [11905, 128, 1, 128]
    - [205, 3090.17]
  - - [8065, 128, 1, 256]
    - [160, 3586.79]
  - - [8321, 128, 1, 256]
    - [160, 3662.86]
  - - [15617, 128, 1, 256]
    - [206, 3611.93]
  - - [3713, 128, 1, 128]
    - [182, 2582.08]
  - - [15745, 128, 1, 128]
    - [193, 3248.95]
  - - [27137, 128, 1, 128]
    - [205, 3401.27]
  - - [8449, 128, 1, 256]
    - [160, 3640.95]
  - - [19841, 128, 1, 128]
    - [196, 3401.8]
  - - [3841, 128, 1, 128]
    - [137, 2276.81]
  - - [11137, 128, 1, 128]
    - [207, 3165.67]
  - - [18305, 128, 1, 128]
    - [205, 3400.34]
  - - [22145, 128, 1, 128]
    - [194, 3471.34]
  - - [5761, 128, 1, 256]
    - [167, 2953.34]
  - - [24833, 128, 1, 128]
    - [205, 3494.2]
  - - [2945, 128, 1, 128]
    - [195, 2242.14]
  - - [14849, 128, 1, 128]
    - [187, 3041.08]
  - - [14849, 128, 1, 256]
    - [148, 3654.05]
  - - [3713, 128, 1, 256]
    - [184, 3239.29]
  - - [20609, 128, 1, 128]
    - [196, 3479.57]
  - - [16001, 128, 1, 256]
    - [193, 3714.38]
  - - [6529, 128, 1, 256]
    - [150, 3235.67]
  - - [8449, 128, 1, 128]
    - [161, 2935.31]
  - - [17537, 128, 1, 128]
    - [206, 3342.57]
  - - [10369, 128, 1, 128]
    - [207, 3018.58]
  - - [27137, 128, 1, 128]
    - [196, 3382.63]
  - - [10241, 128, 1, 256]
    - [201, 3322.55]
  - - [7681, 128, 1, 128]
    - [174, 2794.1]
  - - [10625, 128, 1, 128]
    - [207, 3084.34]
  - - [3713, 128, 1, 128]
    - [193, 2595.3]
  - - [2689, 128, 1, 128]
    - [180, 2109.99]
  - - [13313, 128, 1, 128]
    - [205, 3031.13]
  - - [1921, 128, 1, 128]
    - [180, 1635.85]
  - - [7169, 128, 1, 128]
    - [178, 2762.39]
  - - [2561, 128, 1, 128]
    - [200, 1971.78]
  - - [9089, 128, 1, 256]
    - [204, 3584.84]
  - - [9473, 128, 1, 128]
    - [195, 2998.56]
  - - [13441, 128, 1, 128]
    - [206, 3151.36]
  - - [12289, 128, 1, 256]
    - [185, 3407.98]
  - - [12161, 128, 1, 128]
    - [194, 3128.86]
  - - [1537, 128, 1, 256]
    - [189, 1876.47]
  - - [6785, 128, 1, 128]
    - [205, 2751.62]
  - - [17921, 128, 1, 256]
    - [196, 3633.89]
  - - [2561, 128, 1, 256]
    - [192, 2378.65]
  - - [27905, 128, 1, 256]
    - [194, 3922.41]
  - - [13825, 128, 1, 256]
    - [176, 3548.07]
  - - [19073, 128, 1, 256]
    - [196, 3948.6]
  - - [8833, 128, 1, 256]
    - [193, 3507.51]
  - - [16129, 128, 1, 128]
    - [195, 3207.01]
  - - [27905, 128, 1, 256]
    - [196, 3935.23]
  - - [5377, 128, 1, 256]
    - [155, 3329.43]
  - - [1793, 128, 1, 256]
    - [182, 2163.24]
  - - [9473, 128, 1, 128]
    - [193, 3005.53]
  - - [22529, 128, 1, 128]
    - [194, 3229.93]
  - - [9217, 128, 1, 256]
    - [184, 3361.79]
  - - [16001, 128, 1, 256]
    - [195, 3711.22]
  - - [5633, 128, 1, 256]
    - [139, 3425.8]
  - - [10625, 128, 1, 256]
    - [194, 3557.02]
  - - [1921, 128, 1, 128]
    - [179, 1635.85]
  - - [5249, 128, 1, 256]
    - [185, 3284.94]
  - - [12673, 128, 1, 128]
    - [205, 3208.2]
  - - [10369, 128, 1, 128]
    - [207, 3022.88]
  - - [30976, 1024, 1, 128]
    - [207, 4256.57]
  - - [42240, 26369, 1, 128]
    - [207, 4325.82]
  - - [33024, 17025, 1, 128]
    - [207, 4318.8]
  - - [39168, 512, 1, 128]
    - [207, 4202.54]
  - - [30848, 1024, 1, 128]
    - [207, 4259.88]
  - - [41728, 8192, 1, 128]
    - [207, 4331.21]
  - - [39552, 23553, 1, 128]
    - [207, 4321.89]
  - - [35072, 512, 1, 128]
    - [207, 4197.67]
  - - [29952, 14081, 1, 128]
    - [207, 4312.99]
  - - [33280, 2048, 1, 128]
    - [207, 4302.1]
  - - [40320, 128, 1, 128]
    - [207, 3930.28]
  - - [35456, 1024, 1, 128]
    - [207, 4265.6]
  - - [36096, 1024, 1, 128]
    - [207, 4270.32]
  - - [36992, 20993, 1, 128]
    - [207, 4319.91]
  - - [36096, 20097, 1, 128]
    - [207, 4321.44]
  - - [31488, 15489, 1, 128]
    - [207, 4316.54]
  - - [39552, 23681, 1, 128]
    - [207, 4325.92]
  - - [36864, 128, 1, 128]
    - [207, 3814.93]
  - - [40320, 4096, 1, 128]
    - [207, 4324.23]
  - - [35200, 2048, 1, 128]
    - [207, 4303.78]
  - - [29824, 2048, 1, 128]
    - [207, 4297.97]
  - - [34688, 2048, 1, 128]
    - [207, 4299.73]
  - - [42752, 26753, 1, 128]
    - [207, 4326.69]
  - - [34304, 4096, 1, 128]
    - [207, 4319.2]
  - - [36480, 20481, 1, 128]
    - [207, 4318.63]
  - - [33408, 128, 1, 128]
    - [207, 3802.14]
  - - [38784, 4096, 1, 128]
    - [207, 4324.17]
  - - [43264, 27393, 1, 128]
    - [207, 4326.31]
  - - [34560, 128, 1, 128]
    - [207, 3876.16]
  - - [30336, 4096, 1, 128]
    - [207, 4314.73]
  - - [29056, 2048, 1, 128]
    - [207, 4296.8]
  - - [34816, 512, 1, 128]
    - [207, 4194.3]
  - - [38272, 2048, 1, 128]
    - [207, 4304.88]
  - - [39808, 23937, 1, 128]
    - [207, 4326.49]
  - - [30848, 512, 1, 128]
    - [207, 4176.97]
  - - [40448, 512, 1, 128]
    - [207, 4204.41]
  - - [40448, 24577, 1, 128]
    - [207, 4310.08]
  - - [44544, 28545, 1, 128]
    - [207, 4321.86]
  - - [30208, 14209, 1, 128]
    - [207, 4309.0]
  - - [34688, 18689, 1, 128]
    - [207, 4321.21]
  - - [31360, 512, 1, 128]
    - [207, 4180.65]
  - - [38912, 512, 1, 128]
    - [207, 4208.7]
  - - [39680, 1024, 1, 128]
    - [207, 4270.2]
  - - [34048, 1024, 1, 128]
    - [207, 4255.41]
  - - [39552, 4096, 1, 128]
    - [207, 4322.62]
  - - [40320, 24321, 1, 128]
    - [207, 4325.58]
  - - [40832, 24833, 1, 128]
    - [207, 4325.97]
  - - [36736, 1024, 1, 128]
    - [207, 4268.37]
  - - [44672, 1024, 1, 128]
    - [207, 4280.65]
  - - [32000, 128, 1, 128]
    - [196, 3791.49]
  - - [40704, 4096, 1, 128]
    - [207, 4323.29]
  - - [38144, 1024, 1, 128]
    - [207, 4266.02]
  - - [30720, 14849, 1, 128]
    - [207, 4299.53]
  - - [38144, 8192, 1, 128]
    - [207, 4330.61]
  - - [30208, 1024, 1, 128]
    - [207, 4247.03]
  - - [43136, 1024, 1, 128]
    - [207, 4278.73]
  - - [38528, 1024, 1, 128]
    - [207, 4275.84]
  - - [43264, 2048, 1, 128]
    - [207, 4309.69]
  - - [38400, 22529, 1, 128]
    - [207, 4308.52]
  - - [37120, 128, 1, 128]
    - [206, 3831.74]
  - - [32256, 128, 1, 128]
    - [194, 3791.12]
  - - [29952, 13953, 1, 128]
    - [196, 4312.15]
  - - [34560, 8192, 1, 128]
    - [207, 4331.55]
  - - [37504, 21505, 1, 128]
    - [207, 4320.08]
  - - [33536, 128, 1, 128]
    - [205, 3802.97]
  - - [41856, 2048, 1, 128]
    - [207, 4308.54]
  - - [32896, 4096, 1, 128]
    - [207, 4317.31]
  - - [41856, 8192, 1, 128]
    - [207, 4331.62]
  - - [29440, 4096, 1, 128]
    - [207, 4317.73]
  - - [33664, 8192, 1, 128]
    - [207, 4329.18]
  - - [36992, 512, 1, 128]
    - [207, 4203.32]
  - - [33280, 512, 1, 128]
    - [207, 4187.21]
  - - [41728, 128, 1, 128]
    - [196, 3921.03]
  - - [31744, 128, 1, 128]
    - [194, 3753.56]
  - - [31360, 1024, 1, 128]
    - [207, 4260.38]
  - - [29952, 8192, 1, 128]
    - [207, 4329.46]
  - - [38016, 2048, 1, 128]
    - [207, 4301.11]
  - - [34176, 8192, 1, 128]
    - [207, 4330.14]
  - - [30464, 512, 1, 128]
    - [207, 4175.01]
  - - [41984, 2048, 1, 128]
    - [207, 4308.79]
  - - [40448, 4096, 1, 128]
    - [207, 4323.95]
  - - [33920, 4096, 1, 128]
    - [207, 4321.42]
  - - [41088, 8192, 1, 128]
    - [207, 4331.33]
  - - [39808, 8192, 1, 128]
    - [207, 4331.2]
  - - [40832, 4096, 1, 128]
    - [207, 4323.01]
  - - [30592, 2048, 1, 128]
    - [207, 4298.07]
  - - [36352, 1024, 1, 128]
    - [207, 4269.32]
  - - [30336, 2048, 1, 128]
    - [207, 4295.34]
  - - [30976, 512, 1, 128]
    - [207, 4171.55]
  - - [42368, 1024, 1, 128]
    - [207, 4279.63]
  - - [29056, 1024, 1, 128]
    - [207, 4251.42]
  - - [38784, 22913, 1, 128]
    - [207, 4325.08]
  - - [28928, 512, 1, 128]
    - [207, 4168.48]
  - - [40576, 512, 1, 128]
    - [207, 4212.37]
  - - [34816, 4096, 1, 128]
    - [207, 4320.99]
  - - [41600, 2048, 1, 128]
    - [207, 4309.05]
  - - [29696, 8192, 1, 128]
    - [207, 4329.43]
  - - [41856, 4096, 1, 128]
    - [207, 4323.41]
  - - [35584, 2048, 1, 128]
    - [207, 4300.11]
  - - [30848, 14849, 1, 128]
    - [207, 4311.12]
  - - [33280, 17281, 1, 128]
    - [207, 4313.9]
  - - [43776, 2048, 1, 128]
    - [207, 4310.12]
  - - [42112, 8192, 1, 128]
    - [207, 4331.42]
  - - [37376, 128, 1, 128]
    - [207, 3837.85]
  - - [41600, 4096, 1, 128]
    - [207, 4325.29]
  - - [36224, 20353, 1, 128]
    - [207, 4323.19]
  - - [29952, 1024, 1, 128]
    - [207, 4254.11]
  - - [34176, 1024, 1, 128]
    - [207, 4267.02]
  - - [31744, 512, 1, 128]
    - [207, 4180.15]
  - - [42624, 8192, 1, 128]
    - [207, 4331.55]
  - - [41216, 128, 1, 128]
    - [196, 3888.98]
  - - [42624, 26753, 1, 128]
    - [207, 4327.9]
  - - [32512, 2048, 1, 128]
    - [207, 4298.72]
  - - [40064, 4096, 1, 128]
    - [207, 4324.2]
  - - [32640, 4096, 1, 128]
    - [207, 4320.7]
  - - [42112, 26241, 1, 128]
    - [207, 4326.97]
  - - [32256, 512, 1, 128]
    - [207, 4182.02]
  - - [40960, 1024, 1, 128]
    - [207, 4276.63]
  - - [35968, 128, 1, 128]
    - [207, 3856.67]
  - - [32384, 8192, 1, 128]
    - [207, 4328.21]
  - - [42880, 512, 1, 128]
    - [207, 4221.52]
  - - [33024, 8192, 1, 128]
    - [207, 4330.73]
  - - [43904, 1024, 1, 128]
    - [207, 4280.66]
  - - [33664, 17665, 1, 128]
    - [207, 4319.89]
  - - [41856, 512, 1, 128]
    - [207, 4207.68]
  - - [40704, 128, 1, 128]
    - [205, 3874.58]
  - - [33408, 17537, 1, 128]
    - [207, 4320.25]
  - - [37120, 512, 1, 128]
    - [207, 4203.0]
  - - [41216, 25345, 1, 128]
    - [207, 4325.37]
  - - [39680, 8192, 1, 128]
    - [207, 4332.63]
  - - [40192, 24193, 1, 128]
    - [207, 4324.91]
  - - [33024, 17153, 1, 128]
    - [207, 4318.7]
  - - [38272, 1024, 1, 128]
    - [207, 4271.45]
  - - [35328, 1024, 1, 128]
    - [207, 4266.5]
  - - [31104, 8192, 1, 128]
    - [207, 4327.99]
  - - [40320, 8192, 1, 128]
    - [207, 4330.86]
  - - [29312, 2048, 1, 128]
    - [207, 4295.3]
  - - [36608, 20737, 1, 128]
    - [207, 4322.0]
  - - [42240, 4096, 1, 128]
    - [207, 4325.37]
  - - [43520, 2048, 1, 128]
    - [207, 4306.91]
  - - [29056, 512, 1, 128]
    - [207, 4163.12]
  - - [35328, 19329, 1, 128]
    - [207, 4316.45]
  - - [30464, 128, 1, 128]
    - [196, 3792.71]
  - - [29696, 13697, 1, 128]
    - [207, 4306.46]
  - - [43904, 28033, 1, 128]
    - [207, 4328.34]
  - - [35584, 19713, 1, 128]
    - [207, 4321.49]
  - - [41088, 4096, 1, 128]
    - [207, 4324.72]
  - - [42368, 2048, 1, 128]
    - [207, 4306.72]
  - - [36736, 128, 1, 128]
    - [206, 3836.57]
  - - [30336, 8192, 1, 128]
    - [207, 4329.77]
  - - [43008, 128, 1, 128]
    - [205, 3892.2]
  - - [37120, 1024, 1, 128]
    - [207, 4271.03]
  - - [31104, 2048, 1, 128]
    - [207, 4298.04]
  - - [33152, 4096, 1, 128]
    - [207, 4320.32]
  - - [43392, 27521, 1, 128]
    - [207, 4327.83]
  - - [37248, 21249, 1, 128]
    - [207, 4323.38]
  - - [33920, 17921, 1, 128]
    - [207, 4315.7]
  - - [39680, 4096, 1, 128]
    - [207, 4320.9]
  - - [43264, 512, 1, 128]
    - [207, 4221.03]
  - - [35712, 8192, 1, 128]
    - [207, 4330.01]
  - - [31616, 2048, 1, 128]
    - [207, 4295.78]
  - - [35328, 512, 1, 128]
    - [207, 4192.78]
  - - [43136, 27265, 1, 128]
    - [207, 4327.78]
  - - [30208, 128, 1, 128]
    - [196, 3760.85]
  - - [40320, 24449, 1, 128]
    - [207, 4326.5]
  - - [44288, 2048, 1, 128]
    - [207, 4310.41]
  - - [35072, 1024, 1, 128]
    - [207, 4269.09]
  - - [30464, 14465, 1, 128]
    - [207, 4313.62]
  - - [44160, 8192, 1, 128]
    - [207, 4333.57]
  - - [33792, 17793, 1, 128]
    - [207, 4314.44]
  - - [37632, 1024, 1, 128]
    - [207, 4263.92]
  - - [35968, 2048, 1, 128]
    - [207, 4304.13]
  - - [38400, 8192, 1, 128]
    - [207, 4331.17]
  - - [32512, 4096, 1, 128]
    - [207, 4320.12]
  - - [32512, 16641, 1, 128]
    - [207, 4317.37]
  - - [39424, 128, 1, 128]
    - [194, 3854.87]
  - - [30976, 8192, 1, 128]
    - [207, 4330.2]
  - - [35968, 20097, 1, 128]
    - [196, 4322.47]
  - - [38656, 512, 1, 128]
    - [207, 4206.28]
  - - [34944, 18945, 1, 128]
    - [207, 4318.09]
  - - [33664, 17793, 1, 128]
    - [207, 4319.8]
  - - [38656, 22657, 1, 128]
    - [207, 4324.69]
  - - [34944, 1024, 1, 128]
    - [207, 4266.35]
  - - [31872, 16001, 1, 128]
    - [196, 4317.51]
  - - [43392, 8192, 1, 128]
    - [207, 4331.89]
  - - [38016, 512, 1, 128]
    - [207, 4205.63]
  - - [29440, 8192, 1, 128]
    - [207, 4329.47]
  - - [35200, 1024, 1, 128]
    - [207, 4259.99]
  - - [34304, 18433, 1, 128]
    - [207, 4304.46]
  - - [44672, 28801, 1, 128]
    - [207, 4328.5]
  - - [29184, 4096, 1, 128]
    - [207, 4318.16]
  - - [33408, 8192, 1, 128]
    - [207, 4330.95]
  - - [39040, 128, 1, 128]
    - [207, 3865.3]
  - - [39680, 23681, 1, 128]
    - [207, 4324.58]
  - - [38144, 4096, 1, 128]
    - [207, 4323.24]
  - - [42368, 26497, 1, 128]
    - [207, 4327.44]
  - - [42368, 4096, 1, 128]
    - [207, 4323.18]
  - - [31872, 128, 1, 128]
    - [194, 3790.58]
  - - [41984, 512, 1, 128]
    - [207, 4222.62]
  - - [39296, 2048, 1, 128]
    - [207, 4306.45]
  - - [33920, 2048, 1, 128]
    - [207, 4299.85]
  - - [36736, 20865, 1, 128]
    - [207, 4323.69]
  - - [34432, 8192, 1, 128]
    - [207, 4331.43]
  - - [30848, 14977, 1, 128]
    - [207, 4317.0]
  - - [31744, 15873, 1, 128]
    - [207, 4301.1]
  - - [42880, 27009, 1, 128]
    - [207, 4327.96]
  - - [42240, 26241, 1, 128]
    - [207, 4326.2]
  - - [38400, 4096, 1, 128]
    - [207, 4322.76]
  - - [42624, 26625, 1, 128]
    - [207, 4323.0]
  - - [35072, 4096, 1, 128]
    - [207, 4321.79]
  - - [40576, 4096, 1, 128]
    - [207, 4323.95]
  - - [39296, 8192, 1, 128]
    - [207, 4332.11]
  - - [42624, 512, 1, 128]
    - [207, 4221.17]
  - - [32768, 8192, 1, 128]
    - [207, 4330.73]
  - - [36864, 1024, 1, 128]
    - [207, 4270.52]
  - - [43392, 128, 1, 128]
    - [207, 3925.21]
  - - [41344, 2048, 1, 128]
    - [207, 4308.14]
  - - [35584, 4096, 1, 128]
    - [207, 4319.34]
  - - [40064, 2048, 1, 128]
    - [207, 4307.56]
  - - [40576, 24705, 1, 128]
    - [207, 4326.36]
  - - [39808, 1024, 1, 128]
    - [207, 4275.13]
  - - [36992, 1024, 1, 128]
    - [207, 4270.1]
  - - [42496, 1024, 1, 128]
    - [207, 4278.19]
  - - [43904, 128, 1, 128]
    - [196, 3947.11]
  - - [31232, 512, 1, 128]
    - [207, 4178.89]
  - - [42112, 128, 1, 128]
    - [207, 3939.94]
  - - [37376, 2048, 1, 128]
    - [207, 4306.54]
  - - [38016, 128, 1, 128]
    - [205, 3884.09]
  - - [42368, 8192, 1, 128]
    - [207, 4331.48]
  - - [43392, 512, 1, 128]
    - [207, 4224.21]
  - - [41984, 1024, 1, 128]
    - [207, 4278.17]
  - - [42240, 2048, 1, 128]
    - [207, 4307.13]
  - - [29952, 128, 1, 128]
    - [194, 3751.79]
  - - [36608, 8192, 1, 128]
    - [207, 4330.44]
  - - [32512, 16513, 1, 128]
    - [207, 4317.99]
  - - [29568, 512, 1, 128]
    - [207, 4170.83]
  - - [34304, 1024, 1, 128]
    - [207, 4264.63]
  - - [41984, 4096, 1, 128]
    - [207, 4324.36]
  - - [30464, 4096, 1, 128]
    - [207, 4317.01]
  - - [41216, 2048, 1, 128]
    - [207, 4305.41]
  - - [36480, 20609, 1, 128]
    - [207, 4323.16]
  - - [44800, 4096, 1, 128]
    - [207, 4326.13]
  - - [36864, 512, 1, 128]
    - [207, 4202.18]
  - - [39680, 2048, 1, 128]
    - [207, 4307.98]
  - - [43648, 4096, 1, 128]
    - [207, 4323.56]
  - - [33664, 128, 1, 128]
    - [205, 3823.84]
  - - [41600, 512, 1, 128]
    - [207, 4215.57]
  - - [43776, 1024, 1, 128]
    - [207, 4280.92]
  - - [37632, 512, 1, 128]
    - [205, 4190.31]
  - - [44160, 128, 1, 128]
    - [194, 3960.57]
  - - [37248, 8192, 1, 128]
    - [207, 4331.72]
  - - [34816, 18817, 1, 128]
    - [207, 4315.31]
  - - [38528, 22529, 1, 128]
    - [207, 4320.88]
  - - [40192, 24321, 1, 128]
    - [207, 4325.01]
  - - [40832, 128, 1, 128]
    - [194, 3872.37]
  - - [29312, 8192, 1, 128]
    - [207, 4327.55]
  - - [43776, 27777, 1, 128]
    - [207, 4326.93]
  - - [37632, 21633, 1, 128]
    - [207, 4323.12]
  - - [33792, 4096, 1, 128]
    - [207, 4319.89]
  - - [35968, 1024, 1, 128]
    - [207, 4267.66]
  - - [37888, 512, 1, 128]
    - [207, 4206.24]
  - - [35968, 512, 1, 128]
    - [207, 4200.28]
  - - [30592, 1024, 1, 128]
    - [207, 4259.17]
  - - [38400, 512, 1, 128]
    - [207, 4210.3]
  - - [43264, 1024, 1, 128]
    - [207, 4279.64]
  - - [38528, 4096, 1, 128]
    - [207, 4320.18]
  - - [28928, 1024, 1, 128]
    - [207, 4249.97]
  - - [33152, 1024, 1, 128]
    - [207, 4259.26]
  - - [41344, 1024, 1, 128]
    - [207, 4278.41]
  - - [30848, 8192, 1, 128]
    - [207, 4328.51]
  - - [41344, 4096, 1, 128]
    - [207, 4324.71]
  - - [38912, 2048, 1, 128]
    - [207, 4307.15]
  - - [38272, 128, 1, 128]
    - [205, 3892.77]
  - - [31488, 4096, 1, 128]
    - [207, 4316.02]
  - - [44416, 4096, 1, 128]
    - [207, 4324.12]
  - - [39552, 2048, 1, 128]
    - [207, 4306.85]
  - - [37760, 1024, 1, 128]
    - [207, 4271.63]
  - - [34304, 18305, 1, 128]
    - [207, 4314.15]
  - - [44544, 28673, 1, 128]
    - [207, 4311.64]
  - - [44416, 8192, 1, 128]
    - [207, 4316.39]
  - - [38144, 512, 1, 128]
    - [207, 4207.29]
  - - [30208, 14337, 1, 128]
    - [207, 4297.49]
  - - [38144, 2048, 1, 128]
    - [207, 4303.25]
  - - [40448, 128, 1, 128]
    - [194, 3874.53]
  - - [42240, 8192, 1, 128]
    - [207, 4331.68]
  - - [39424, 2048, 1, 128]
    - [207, 4308.3]
  - - [41088, 512, 1, 128]
    - [207, 4215.84]
  - - [36224, 2048, 1, 128]
    - [207, 4301.85]
  - - [31744, 4096, 1, 128]
    - [207, 4319.53]
  - - [44160, 512, 1, 128]
    - [207, 4219.74]
  - - [32000, 1024, 1, 128]
    - [207, 4261.12]
  - - [42752, 1024, 1, 128]
    - [207, 4279.9]
  - - [42496, 2048, 1, 128]
    - [207, 4309.57]
  - - [32640, 2048, 1, 128]
    - [207, 4298.39]
  - - [42752, 26881, 1, 128]
    - [207, 4326.14]
  - - [32256, 8192, 1, 128]
    - [207, 4328.45]
  - - [44800, 512, 1, 128]
    - [207, 4226.18]
  - - [34816, 128, 1, 128]
    - [207, 3786.67]
  - - [38272, 8192, 1, 128]
    - [207, 4331.68]
  - - [44800, 28929, 1, 128]
    - [207, 4327.49]
  - - [37120, 8192, 1, 128]
    - [207, 4330.24]
  - - [43776, 512, 1, 128]
    - [207, 4222.2]
  - - [43008, 1024, 1, 128]
    - [207, 4278.6]
  - - [34432, 18561, 1, 128]
    - [196, 4320.85]
  - - [36736, 4096, 1, 128]
    - [207, 4319.14]
  - - [36224, 512, 1, 128]
    - [207, 4205.3]
  - - [32768, 512, 1, 128]
    - [207, 4187.75]
  - - [30592, 128, 1, 128]
    - [196, 3813.29]
  - - [43008, 27137, 1, 128]
    - [207, 4311.15]
  - - [34048, 18177, 1, 128]
    - [207, 4320.04]
  - - [43136, 2048, 1, 128]
    - [207, 4309.52]
  - - [29184, 13313, 1, 128]
    - [207, 4294.82]
  - - [40064, 24193, 1, 128]
    - [196, 4325.65]
  - - [40960, 128, 1, 128]
    - [196, 3857.71]
  - - [29184, 2048, 1, 128]
    - [207, 4292.28]
  - - [37248, 128, 1, 128]
    - [195, 3848.83]
  - - [35328, 128, 1, 128]
    - [196, 3806.98]
  - - [43264, 128, 1, 128]
    - [207, 3901.57]
  - - [29952, 4096, 1, 128]
    - [207, 4316.37]
  - - [36736, 20737, 1, 128]
    - [196, 4322.57]
  - - [34176, 4096, 1, 128]
    - [207, 4320.64]
  - - [32768, 1024, 1, 128]
    - [207, 4260.03]
  - - [44160, 4096, 1, 128]
    - [207, 4325.87]
  - - [31104, 1024, 1, 128]
    - [207, 4258.26]
  - - [33792, 512, 1, 128]
    - [207, 4191.76]
  - - [41216, 25217, 1, 128]
    - [207, 4325.66]
  - - [31872, 1024, 1, 128]
    - [207, 4257.74]
  - - [38528, 8192, 1, 128]
    - [207, 4330.2]
  - - [44672, 4096, 1, 128]
    - [207, 4325.84]
  - - [32512, 1024, 1, 128]
    - [207, 4262.09]
  - - [39168, 8192, 1, 128]
    - [207, 4331.85]
  - - [31360, 15361, 1, 128]
    - [207, 4311.87]
  - - [38016, 22145, 1, 128]
    - [207, 4324.0]
  - - [35712, 128, 1, 128]
    - [207, 3855.46]
  - - [30208, 4096, 1, 128]
    - [207, 4318.13]
  - - [33920, 128, 1, 128]
    - [205, 3833.78]
  - - [30336, 128, 1, 128]
    - [207, 3790.6]
  - - [42368, 128, 1, 128]
    - [194, 3894.5]
  - - [38912, 4096, 1, 128]
    - [207, 4322.15]
  - - [34176, 512, 1, 128]
    - [207, 4194.61]
  - - [42752, 8192, 1, 128]
    - [207, 4331.74]
  - - [31488, 1024, 1, 128]
    - [207, 4251.68]
  - - [36608, 1024, 1, 128]
    - [207, 4270.45]
  - - [41856, 128, 1, 128]
    - [207, 3926.76]
  - - [29312, 13441, 1, 128]
    - [207, 4313.31]
  - - [43520, 128, 1, 128]
    - [205, 3899.76]
  - - [31616, 8192, 1, 128]
    - [207, 4328.54]
  - - [40448, 2048, 1, 128]
    - [207, 4302.13]
  - - [35328, 2048, 1, 128]
    - [207, 4304.33]
  - - [36864, 20865, 1, 128]
    - [207, 4317.74]
  - - [32000, 2048, 1, 128]
    - [207, 4294.89]
  - - [34176, 18177, 1, 128]
    - [207, 4320.57]
  - - [37504, 128, 1, 128]
    - [194, 3857.76]
  - - [33792, 1024, 1, 128]
    - [207, 4263.75]
  - - [31872, 8192, 1, 128]
    - [207, 4330.0]
  - - [40704, 512, 1, 128]
    - [207, 4214.18]
  - - [37632, 128, 1, 128]
    - [196, 3866.08]
  - - [32640, 1024, 1, 128]
    - [207, 4257.92]
  - - [44544, 8192, 1, 128]
    - [207, 4333.04]
  - - [39424, 8192, 1, 128]
    - [207, 4332.54]
  - - [39296, 512, 1, 128]
    - [207, 4208.01]
  - - [35840, 128, 1, 128]
    - [207, 3828.92]
  - - [39168, 1024, 1, 128]
    - [207, 4273.91]
  - - [35712, 19841, 1, 128]
    - [207, 4323.01]
  - - [29568, 13569, 1, 128]
    - [207, 4313.25]
  - - [34944, 4096, 1, 128]
    - [207, 4321.66]
  - - [32768, 2048, 1, 128]
    - [207, 4299.86]
  - - [39296, 128, 1, 128]
    - [194, 3858.01]
  - - [29568, 4096, 1, 128]
    - [207, 4316.46]
  - - [39040, 1024, 1, 128]
    - [207, 4258.67]
  - - [37376, 1024, 1, 128]
    - [207, 4270.05]
  - - [33536, 2048, 1, 128]
    - [207, 4302.6]
  - - [31488, 8192, 1, 128]
    - [207, 4328.44]
  - - [37888, 1024, 1, 128]
    - [207, 4270.18]
  - - [41472, 4096, 1, 128]
    - [207, 4323.88]
  - - [30592, 512, 1, 128]
    - [207, 4173.7]
  - - [34560, 18561, 1, 128]
    - [207, 4320.38]
  - - [29184, 512, 1, 128]
    - [207, 4172.34]
  - - [32256, 16257, 1, 128]
    - [207, 4310.76]
  - - [43392, 27393, 1, 128]
    - [207, 4327.25]
  - - [29312, 4096, 1, 128]
    - [207, 4314.6]
  - - [43648, 2048, 1, 128]
    - [207, 4310.66]
  - - [44288, 1024, 1, 128]
    - [207, 4282.43]
  - - [35456, 128, 1, 128]
    - [205, 3829.85]
  - - [44160, 28289, 1, 128]
    - [207, 4327.91]
  - - [40320, 1024, 1, 128]
    - [207, 4274.78]
  - - [37888, 22017, 1, 128]
    - [207, 4308.06]
  - - [29696, 512, 1, 128]
    - [207, 4176.65]
  - - [35840, 2048, 1, 128]
    - [207, 4304.22]
  - - [37504, 2048, 1, 128]
    - [207, 4306.45]
  - - [41728, 4096, 1, 128]
    - [207, 4324.98]
  - - [42752, 4096, 1, 128]
    - [207, 4325.22]
  - - [29824, 4096, 1, 128]
    - [207, 4314.62]
  - - [44800, 1024, 1, 128]
    - [207, 4282.15]
  - - [30592, 4096, 1, 128]
    - [207, 4313.84]
  - - [43904, 4096, 1, 128]
    - [207, 4325.91]
  - - [39552, 8192, 1, 128]
    - [207, 4331.21]
  - - [37632, 2048, 1, 128]
    - [207, 4304.63]
  - - [29312, 128, 1, 128]
    - [195, 3743.74]
  - - [30080, 512, 1, 128]
    - [205, 4162.77]
  - - [33664, 2048, 1, 128]
    - [207, 4299.5]
  - - [43520, 27521, 1, 128]
    - [207, 4321.66]
  - - [36224, 128, 1, 128]
    - [194, 3876.0]
  - - [28928, 12929, 1, 128]
    - [196, 4309.98]
  - - [29440, 1024, 1, 128]
    - [207, 4251.41]
  - - [35840, 19969, 1, 128]
    - [207, 4305.07]
  - - [42880, 4096, 1, 128]
    - [207, 4325.25]
  - - [42496, 8192, 1, 128]
    - [207, 4332.95]
  - - [39936, 24065, 1, 128]
    - [207, 4309.25]
  - - [33408, 1024, 1, 128]
    - [207, 4261.74]
  - - [32256, 2048, 1, 128]
    - [207, 4299.31]
  - - [35712, 19713, 1, 128]
    - [196, 4321.76]
  - - [40192, 4096, 1, 128]
    - [207, 4321.5]
  - - [32000, 16129, 1, 128]
    - [207, 4316.39]
  - - [44032, 512, 1, 128]
    - [207, 4222.04]
  - - [35584, 128, 1, 128]
    - [194, 3831.55]
  - - [35584, 8192, 1, 128]
    - [207, 4331.66]
  - - [37888, 21889, 1, 128]
    - [207, 4318.77]
  - - [37504, 1024, 1, 128]
    - [207, 4271.72]
  - - [33664, 512, 1, 128]
    - [207, 4183.17]
  - - [32384, 1024, 1, 128]
    - [207, 4259.45]
  - - [38400, 1024, 1, 128]
    - [207, 4272.05]
  - - [35200, 128, 1, 128]
    - [194, 3817.29]
  - - [43648, 1024, 1, 128]
    - [207, 4279.39]
  - - [36608, 128, 1, 128]
    - [204, 3824.18]
  - - [32768, 128, 1, 128]
    - [205, 3752.24]
  - - [28928, 4096, 1, 128]
    - [207, 4316.44]
  - - [35200, 19329, 1, 128]
    - [207, 4322.56]
  - - [41216, 8192, 1, 128]
    - [207, 4332.73]
  - - [36864, 8192, 1, 128]
    - [207, 4329.97]
  - - [40064, 128, 1, 128]
    - [196, 3915.58]
  - - [42624, 1024, 1, 128]
    - [207, 4281.21]
  - - [34688, 128, 1, 128]
    - [206, 3819.4]
  - - [43648, 27777, 1, 128]
    - [207, 4328.56]
  - - [37888, 8192, 1, 128]
    - [207, 4332.4]
  - - [41472, 25601, 1, 128]
    - [207, 4310.7]
  - - [38272, 512, 1, 128]
    - [207, 4203.02]
  - - [35456, 4096, 1, 128]
    - [207, 4322.18]
  - - [42496, 26625, 1, 128]
    - [207, 4310.27]
  - - [43136, 4096, 1, 128]
    - [207, 4323.96]
  - - [44800, 8192, 1, 128]
    - [207, 4332.97]
  - - [36480, 8192, 1, 128]
    - [207, 4331.19]
  - - [37504, 4096, 1, 128]
    - [207, 4323.76]
  - - [39040, 8192, 1, 128]
    - [207, 4331.89]
  - - [31104, 512, 1, 128]
    - [207, 4182.25]
  - - [34176, 2048, 1, 128]
    - [207, 4300.44]
  - - [31616, 512, 1, 128]
    - [207, 4175.7]
  - - [35456, 2048, 1, 128]
    - [207, 4303.13]
  - - [43136, 8192, 1, 128]
    - [207, 4331.59]
  - - [33024, 128, 1, 128]
    - [206, 3798.54]
  - - [38656, 4096, 1, 128]
    - [207, 4320.52]
  - - [33408, 17409, 1, 128]
    - [207, 4315.93]
  - - [39424, 1024, 1, 128]
    - [207, 4277.49]
  - - [29312, 13313, 1, 128]
    - [207, 4308.67]
  - - [35840, 4096, 1, 128]
    - [207, 4322.27]
  - - [42496, 512, 1, 128]
    - [207, 4223.05]
  - - [37632, 8192, 1, 128]
    - [207, 4331.9]
  - - [41088, 2048, 1, 128]
    - [207, 4309.08]
  - - [38528, 512, 1, 128]
    - [207, 4209.69]
  - - [35072, 2048, 1, 128]
    - [207, 4296.06]
  - - [31104, 4096, 1, 128]
    - [207, 4315.78]
  - - [33280, 4096, 1, 128]
    - [207, 4321.02]
  - - [43904, 8192, 1, 128]
    - [207, 4333.07]
  - - [34816, 8192, 1, 128]
    - [207, 4328.84]
  - - [38016, 1024, 1, 128]
    - [207, 4272.41]
  - - [33152, 128, 1, 128]
    - [205, 3793.03]
  - - [42496, 128, 1, 128]
    - [194, 3883.61]
  - - [40832, 24961, 1, 128]
    - [207, 4327.38]
  - - [41728, 1024, 1, 128]
    - [207, 4275.75]
  - - [41472, 25473, 1, 128]
    - [207, 4320.54]
  - - [34560, 2048, 1, 128]
    - [207, 4301.19]
  - - [31616, 15617, 1, 128]
    - [207, 4316.05]
  - - [33664, 4096, 1, 128]
    - [207, 4319.7]
  - - [35328, 8192, 1, 128]
    - [207, 4331.35]
  - - [39808, 4096, 1, 128]
    - [207, 4321.59]
  - - [37248, 512, 1, 128]
    - [207, 4201.23]
  - - [31360, 4096, 1, 128]
    - [207, 4318.71]
  - - [41344, 8192, 1, 128]
    - [207, 4331.28]
  - - [32000, 512, 1, 128]
    - [207, 4182.25]
  - - [35968, 19969, 1, 128]
    - [207, 4318.66]
  - - [30080, 14081, 1, 128]
    - [196, 4313.39]
  - - [35840, 8192, 1, 128]
    - [207, 4331.46]
  - - [44672, 2048, 1, 128]
    - [207, 4305.71]
  - - [31872, 2048, 1, 128]
    - [207, 4292.56]
  - - [42496, 4096, 1, 128]
    - [207, 4325.0]
  - - [43776, 128, 1, 128]
    - [207, 3926.13]
  - - [40704, 2048, 1, 128]
    - [207, 4304.69]
  - - [34432, 128, 1, 128]
    - [194, 3863.92]
  - - [44544, 2048, 1, 128]
    - [207, 4308.58]
  - - [32384, 16385, 1, 128]
    - [207, 4314.48]
  - - [43776, 27905, 1, 128]
    - [207, 4326.53]
  - - [44032, 4096, 1, 128]
    - [207, 4325.03]
  - - [36480, 512, 1, 128]
    - [207, 4200.79]
  - - [44160, 1024, 1, 128]
    - [207, 4279.65]
  - - [41216, 4096, 1, 128]
    - [207, 4323.54]
  - - [44032, 2048, 1, 128]
    - [207, 4307.24]
  - - [33152, 2048, 1, 128]
    - [207, 4299.21]
  - - [41984, 25985, 1, 128]
    - [207, 4321.67]
  - - [39552, 512, 1, 128]
    - [207, 4213.94]
  - - [41344, 25473, 1, 128]
    - [207, 4327.24]
  - - [40960, 4096, 1, 128]
    - [207, 4321.1]
  - - [32640, 128, 1, 128]
    - [194, 3851.73]
  - - [35968, 4096, 1, 128]
    - [207, 4321.76]
  - - [33536, 4096, 1, 128]
    - [207, 4320.45]
  - - [30976, 15105, 1, 128]
    - [207, 4315.37]
  - - [35072, 8192, 1, 128]
    - [207, 4331.32]
  - - [39424, 23425, 1, 128]
    - [207, 4319.52]
  - - [43520, 1024, 1, 128]
    - [207, 4282.34]
  - - [44288, 28417, 1, 128]
    - [207, 4327.05]
  - - [30848, 128, 1, 128]
    - [206, 3764.99]
  - - [35712, 512, 1, 128]
    - [207, 4200.63]
  - - [44160, 2048, 1, 128]
    - [207, 4307.68]
  - - [34048, 8192, 1, 128]
    - [207, 4331.03]
  - - [40448, 24449, 1, 128]
    - [207, 4320.15]
  - - [39168, 23297, 1, 128]
    - [207, 4323.72]
  - - [32128, 1024, 1, 128]
    - [207, 4259.98]
  - - [36864, 20993, 1, 128]
    - [207, 4307.73]
  - - [40064, 1024, 1, 128]
    - [207, 4276.41]
  - - [38784, 8192, 1, 128]
    - [207, 4329.95]
  - - [37248, 2048, 1, 128]
    - [207, 4307.16]
  - - [34560, 4096, 1, 128]
    - [207, 4321.34]
  - - [39040, 23041, 1, 128]
    - [207, 4321.06]
  - - [36480, 1024, 1, 128]
    - [207, 4269.51]
  - - [39040, 2048, 1, 128]
    - [207, 4305.54]
  - - [39808, 23809, 1, 128]
    - [196, 4325.49]
  - - [36992, 4096, 1, 128]
    - [207, 4322.67]
  - - [32768, 16897, 1, 128]
    - [207, 4300.91]
  - - [30976, 2048, 1, 128]
    - [207, 4298.75]
  - - [32640, 16769, 1, 128]
    - [196, 4318.18]
  - - [29824, 13953, 1, 128]
    - [207, 4314.43]
  - - [29184, 128, 1, 128]
    - [205, 3700.85]
  - - [30720, 8192, 1, 128]
    - [207, 4329.6]
  - - [30848, 2048, 1, 128]
    - [207, 4297.37]
  - - [38016, 4096, 1, 128]
    - [207, 4322.71]
  - - [35456, 8192, 1, 128]
    - [207, 4331.2]
  - - [36992, 21121, 1, 128]
    - [207, 4323.61]
  - - [36736, 2048, 1, 128]
    - [207, 4304.23]
  - - [37888, 128, 1, 128]
    - [207, 3852.76]
  - - [39808, 2048, 1, 128]
    - [207, 4308.1]
  - - [41856, 25985, 1, 128]
    - [207, 4327.12]
  - - [34688, 4096, 1, 128]
    - [207, 4321.43]
  - - [38784, 1024, 1, 128]
    - [207, 4271.84]
  - - [40960, 25089, 1, 128]
    - [207, 4307.55]
  - - [32000, 4096, 1, 128]
    - [207, 4317.74]
  - - [41600, 25601, 1, 128]
    - [207, 4322.52]
  - - [37504, 512, 1, 128]
    - [207, 4206.07]
  - - [32128, 16129, 1, 128]
    - [207, 4317.45]
  - - [37248, 21377, 1, 128]
    - [207, 4324.35]
  - - [35840, 512, 1, 128]
    - [207, 4200.0]
  - - [36096, 128, 1, 128]
    - [194, 3859.29]
  - - [32512, 8192, 1, 128]
    - [207, 4328.9]
  - - [36736, 8192, 1, 128]
    - [207, 4330.52]
  - - [42880, 1024, 1, 128]
    - [207, 4278.73]
  - - [44288, 8192, 1, 128]
    - [207, 4331.9]
  - - [36224, 1024, 1, 128]
    - [207, 4268.66]
  - - [41344, 25345, 1, 128]
    - [207, 4326.06]
  - - [32384, 512, 1, 128]
    - [207, 4182.73]
  - - [38272, 4096, 1, 128]
    - [207, 4322.79]
  - - [37120, 2048, 1, 128]
    - [207, 4302.53]
  - - [33152, 8192, 1, 128]
    - [207, 4329.02]
  - - [36096, 4096, 1, 128]
    - [207, 4322.6]
  - - [34560, 18689, 1, 128]
    - [207, 4320.76]
  - - [36864, 4096, 1, 128]
    - [207, 4323.25]
  - - [34944, 512, 1, 128]
    - [207, 4190.62]
  - - [37760, 128, 1, 128]
    - [205, 3871.46]
  - - [31616, 128, 1, 128]
    - [194, 3767.79]
  - - [36224, 4096, 1, 128]
    - [207, 4321.7]
  - - [40576, 24577, 1, 128]
    - [207, 4321.93]
  - - [34688, 1024, 1, 128]
    - [207, 4266.09]
  - - [40192, 1024, 1, 128]
    - [207, 4270.19]
  - - [44672, 512, 1, 128]
    - [207, 4230.42]
  - - [33664, 1024, 1, 128]
    - [207, 4264.35]
  - - [39424, 512, 1, 128]
    - [207, 4210.98]
  - - [44416, 1024, 1, 128]
    - [207, 4282.42]
  - - [33408, 2048, 1, 128]
    - [207, 4302.27]
  - - [43648, 8192, 1, 128]
    - [207, 4332.59]
  - - [43520, 27649, 1, 128]
    - [207, 4311.23]
  - - [40448, 1024, 1, 128]
    - [207, 4270.52]
  - - [33152, 17153, 1, 128]
    - [207, 4319.75]
  - - [33024, 512, 1, 128]
    - [207, 4190.08]
  - - [39680, 128, 1, 128]
    - [207, 3878.97]
  - - [29696, 4096, 1, 128]
    - [207, 4318.4]
  - - [42112, 2048, 1, 128]
    - [207, 4307.89]
  - - [38016, 8192, 1, 128]
    - [207, 4331.84]
  - - [30464, 8192, 1, 128]
    - [207, 4328.01]
  - - [43648, 128, 1, 128]
    - [196, 3924.1]
  - - [32896, 16897, 1, 128]
    - [207, 4314.49]
  - - [43008, 8192, 1, 128]
    - [207, 4331.16]
  - - [34304, 512, 1, 128]
    - [207, 4180.26]
  - - [38528, 128, 1, 128]
    - [207, 3861.28]
  - - [41216, 1024, 1, 128]
    - [207, 4275.02]
  - - [38272, 22401, 1, 128]
    - [207, 4325.3]
  - - [34048, 4096, 1, 128]
    - [207, 4318.62]
  - - [30720, 512, 1, 128]
    - [207, 4185.23]
  - - [41728, 512, 1, 128]
    - [207, 4217.59]
  - - [43136, 512, 1, 128]
    - [207, 4225.65]
  - - [41088, 1024, 1, 128]
    - [207, 4275.14]
  - - [33536, 1024, 1, 128]
    - [207, 4264.62]
  - - [41088, 25089, 1, 128]
    - [207, 4322.4]
  - - [36352, 20353, 1, 128]
    - [207, 4317.26]
  - - [29184, 1024, 1, 128]
    - [207, 4251.17]
  - - [44800, 128, 1, 128]
    - [194, 3913.43]
  - - [41600, 8192, 1, 128]
    - [207, 4332.78]
  - - [44416, 28545, 1, 128]
    - [207, 4328.63]
  - - [34048, 512, 1, 128]
    - [207, 4195.88]
  - - [32128, 16257, 1, 128]
    - [207, 4318.96]
  - - [44288, 4096, 1, 128]
    - [207, 4323.06]
  - - [34432, 18433, 1, 128]
    - [207, 4317.06]
  - - [41856, 25857, 1, 128]
    - [207, 4326.75]
  - - [32128, 2048, 1, 128]
    - [207, 4299.82]
  - - [34688, 512, 1, 128]
    - [207, 4199.88]
  - - [39936, 4096, 1, 128]
    - [207, 4321.1]
  - - [38656, 1024, 1, 128]
    - [207, 4267.64]
  - - [37760, 512, 1, 128]
    - [207, 4207.99]
  - - [30336, 512, 1, 128]
    - [207, 4171.07]
  - - [38016, 22017, 1, 128]
    - [207, 4320.7]
  - - [44544, 4096, 1, 128]
    - [207, 4325.56]
  - - [38912, 8192, 1, 128]
    - [207, 4329.22]
  - - [39936, 128, 1, 128]
    - [196, 3874.41]
  - - [36480, 2048, 1, 128]
    - [207, 4302.78]
  - - [35200, 4096, 1, 128]
    - [207, 4321.43]
  - - [30976, 14977, 1, 128]
    - [207, 4315.42]
  - - [31104, 15105, 1, 128]
    - [207, 4316.04]
  - - [40832, 1024, 1, 128]
    - [207, 4268.84]
  - - [32384, 16513, 1, 128]
    - [207, 4318.8]
  - - [43392, 4096, 1, 128]
    - [207, 4323.69]
  - - [32768, 4096, 1, 128]
    - [207, 4316.98]
  - - [38272, 22273, 1, 128]
    - [207, 4324.76]
  - - [32128, 512, 1, 128]
    - [207, 4186.63]
  - - [32896, 2048, 1, 128]
    - [207, 4300.9]
  - - [37376, 21505, 1, 128]
    - [207, 4306.13]
  - - [41856, 1024, 1, 128]
    - [207, 4273.63]
  - - [33536, 8192, 1, 128]
    - [207, 4328.83]
  - - [29568, 1024, 1, 128]
    - [207, 4252.66]
  - - [44032, 28033, 1, 128]
    - [207, 4322.45]
  - - [33280, 8192, 1, 128]
    - [207, 4330.37]
  - - [39296, 4096, 1, 128]
    - [207, 4323.3]
  - - [30592, 14593, 1, 128]
    - [196, 4314.56]
  - - [37504, 8192, 1, 128]
    - [207, 4332.18]
  - - [30336, 14465, 1, 128]
    - [207, 4313.86]
  - - [29952, 2048, 1, 128]
    - [207, 4296.01]
  - - [40832, 512, 1, 128]
    - [207, 4216.24]
  - - [44672, 28673, 1, 128]
    - [207, 4324.13]
  - - [30080, 4096, 1, 128]
    - [207, 4319.47]
  - - [37888, 2048, 1, 128]
    - [207, 4305.58]
  - - [37632, 21761, 1, 128]
    - [207, 4322.86]
  - - [29824, 8192, 1, 128]
    - [207, 4330.1]
  - - [35328, 19457, 1, 128]
    - [207, 4305.54]
  - - [37376, 4096, 1, 128]
    - [207, 4322.46]
  - - [33792, 17921, 1, 128]
    - [207, 4304.32]
  - - [34304, 8192, 1, 128]
    - [207, 4331.19]
  - - [42752, 512, 1, 128]
    - [207, 4216.27]
  - - [36992, 2048, 1, 128]
    - [207, 4304.06]
  - - [39168, 4096, 1, 128]
    - [207, 4322.35]
  - - [31360, 15489, 1, 128]
    - [207, 4316.67]
  - - [43520, 8192, 1, 128]
    - [207, 4331.64]
  - - [30080, 2048, 1, 128]
    - [207, 4297.06]
  - - [30720, 4096, 1, 128]
    - [207, 4319.15]
  - - [34176, 128, 1, 128]
    - [196, 3847.85]
  - - [32768, 16769, 1, 128]
    - [207, 4309.74]
  - - [35072, 128, 1, 128]
    - [195, 3812.5]
  - - [35712, 4096, 1, 128]
    - [207, 4319.48]
  - - [36480, 4096, 1, 128]
    - [207, 4321.8]
  - - [39424, 4096, 1, 128]
    - [207, 4323.52]
  - - [38400, 128, 1, 128]
    - [196, 3887.45]
  - - [34432, 2048, 1, 128]
    - [207, 4303.16]
  - - [41344, 512, 1, 128]
    - [207, 4219.12]
  - - [35200, 512, 1, 128]
    - [207, 4198.27]
  - - [39936, 8192, 1, 128]
    - [207, 4332.27]
  - - [31488, 128, 1, 128]
    - [207, 3763.48]
  - - [43008, 512, 1, 128]
    - [207, 4222.96]
  - - [33024, 4096, 1, 128]
    - [207, 4321.04]
  - - [36608, 512, 1, 128]
    - [207, 4202.53]
  - - [37376, 8192, 1, 128]
    - [207, 4331.25]
  - - [29824, 13825, 1, 128]
    - [207, 4309.12]
  - - [36352, 2048, 1, 128]
    - [207, 4296.57]
  - - [30336, 1024, 1, 128]
    - [207, 4255.71]
  - - [44416, 28417, 1, 128]
    - [207, 4328.04]
  - - [38144, 22273, 1, 128]
    - [207, 4323.77]
  - - [28928, 2048, 1, 128]
    - [207, 4295.8]
  - - [29568, 13697, 1, 128]
    - [207, 4313.16]
  - - [43136, 27137, 1, 128]
    - [207, 4323.47]
  - - [42112, 4096, 1, 128]
    - [207, 4323.51]
  - - [40960, 512, 1, 128]
    - [207, 4213.0]
  - - [35584, 1024, 1, 128]
    - [207, 4268.93]
  - - [31232, 15361, 1, 128]
    - [207, 4299.86]
  - - [40960, 8192, 1, 128]
    - [207, 4332.08]
  - - [31232, 1024, 1, 128]
    - [207, 4254.81]
  - - [29312, 512, 1, 128]
    - [207, 4167.36]
  - - [44416, 512, 1, 128]
    - [207, 4224.74]
  - - [42240, 512, 1, 128]
    - [207, 4220.39]
  - - [31232, 8192, 1, 128]
    - [207, 4328.76]
  - - [35072, 19201, 1, 128]
    - [207, 4320.22]
  - - [29568, 128, 1, 128]
    - [195, 3750.71]
  - - [33792, 2048, 1, 128]
    - [207, 4301.26]
  - - [35712, 2048, 1, 128]
    - [207, 4301.38]
  - - [40576, 128, 1, 128]
    - [206, 3873.2]
  - - [40704, 1024, 1, 128]
    - [207, 4273.73]
  - - [29824, 1024, 1, 128]
    - [207, 4254.19]
  - - [33536, 17665, 1, 128]
    - [207, 4319.37]
  - - [43008, 27009, 1, 128]
    - [207, 4322.04]
  - - [34304, 2048, 1, 128]
    - [207, 4298.39]
  - - [37120, 21249, 1, 128]
    - [207, 4322.41]
  - - [41600, 1024, 1, 128]
    - [207, 4279.63]
  - - [33024, 1024, 1, 128]
    - [207, 4262.7]
  - - [42368, 512, 1, 128]
    - [207, 4220.82]
  - - [30592, 14721, 1, 128]
    - [207, 4316.04]
  - - [29696, 2048, 1, 128]
    - [207, 4296.33]
  - - [31232, 128, 1, 128]
    - [207, 3743.81]
  - - [38784, 22785, 1, 128]
    - [207, 4324.44]
  - - [32896, 1024, 1, 128]
    - [207, 4252.88]
  - - [32128, 128, 1, 128]
    - [196, 3814.38]
  - - [35968, 8192, 1, 128]
    - [207, 4329.58]
  - - [38400, 2048, 1, 128]
    - [207, 4302.44]
  - - [36864, 2048, 1, 128]
    - [207, 4305.68]
  - - [31616, 4096, 1, 128]
    - [207, 4320.46]
  - - [34688, 18817, 1, 128]
    - [207, 4321.39]
  - - [42624, 4096, 1, 128]
    - [207, 4323.85]
  - - [29312, 1024, 1, 128]
    - [207, 4250.73]
  - - [37760, 2048, 1, 128]
    - [207, 4303.49]
  - - [39808, 512, 1, 128]
    - [207, 4216.26]
  - - [41472, 128, 1, 128]
    - [194, 3884.5]
  - - [32128, 4096, 1, 128]
    - [207, 4317.37]
  - - [43520, 4096, 1, 128]
    - [207, 4325.6]
  - - [41472, 512, 1, 128]
    - [207, 4219.3]
  - - [38912, 22913, 1, 128]
    - [207, 4319.53]
  - - [30464, 1024, 1, 128]
    - [207, 4256.0]
  - - [33280, 128, 1, 128]
    - [196, 3784.42]
  - - [31872, 15873, 1, 128]
    - [207, 4313.92]
  - - [36352, 4096, 1, 128]
    - [207, 4322.18]
  - - [30720, 2048, 1, 128]
    - [207, 4293.32]
  - - [33792, 128, 1, 128]
    - [207, 3806.7]
  - - [36096, 8192, 1, 128]
    - [207, 4330.14]
  - - [38784, 128, 1, 128]
    - [207, 3859.55]
  - - [30208, 2048, 1, 128]
    - [207, 4295.41]
  - - [34432, 4096, 1, 128]
    - [207, 4320.96]
  - - [42880, 128, 1, 128]
    - [207, 3903.9]
  - - [31616, 15745, 1, 128]
    - [207, 4317.67]
  - - [40960, 2048, 1, 128]
    - [207, 4304.19]
  - - [41344, 128, 1, 128]
    - [196, 3893.88]
  - - [41728, 25857, 1, 128]
    - [207, 4325.44]
  - - [32896, 512, 1, 128]
    - [207, 4182.9]
  - - [41728, 2048, 1, 128]
    - [207, 4309.92]
  - - [42368, 26369, 1, 128]
    - [207, 4327.04]
  - - [30720, 14721, 1, 128]
    - [207, 4309.56]
  - - [37376, 512, 1, 128]
    - [207, 4207.27]
  - - [35456, 19457, 1, 128]
    - [207, 4318.42]
  - - [29184, 13185, 1, 128]
    - [207, 4305.07]
  - - [34944, 128, 1, 128]
    - [206, 3814.78]
  - - [36608, 20609, 1, 128]
    - [207, 4322.75]
  - - [35584, 19585, 1, 128]
    - [207, 4321.91]
  - - [42880, 8192, 1, 128]
    - [207, 4332.25]
  - - [39936, 1024, 1, 128]
    - [207, 4277.52]
  - - [34944, 19073, 1, 128]
    - [207, 4322.44]
  - - [32512, 128, 1, 128]
    - [205, 3822.31]
  - - [40064, 512, 1, 128]
    - [207, 4211.52]
  - - [30464, 2048, 1, 128]
    - [207, 4296.2]
  - - [30592, 8192, 1, 128]
    - [207, 4329.53]
  - - [39040, 512, 1, 128]
    - [207, 4216.14]
  - - [41088, 128, 1, 128]
    - [207, 3881.37]
  - - [29824, 128, 1, 128]
    - [204, 3749.5]
  - - [32384, 128, 1, 128]
    - [194, 3814.92]
  - - [41728, 25729, 1, 128]
    - [207, 4325.84]
  - - [30976, 4096, 1, 128]
    - [207, 4319.38]
  - - [42624, 128, 1, 128]
    - [196, 3890.97]
  - - [42112, 512, 1, 128]
    - [207, 4222.02]
  - - [38784, 2048, 1, 128]
    - [207, 4306.44]
  - - [35200, 8192, 1, 128]
    - [207, 4329.73]
  - - [30976, 128, 1, 128]
    - [195, 3758.22]
  - - [32640, 16641, 1, 128]
    - [207, 4318.68]
  - - [41984, 8192, 1, 128]
    - [207, 4331.75]
  - - [30080, 128, 1, 128]
    - [196, 3767.81]
  - - [35584, 512, 1, 128]
    - [207, 4200.95]
  - - [44800, 2048, 1, 128]
    - [207, 4309.93]
  - - [34048, 128, 1, 128]
    - [205, 3829.22]
  - - [35712, 1024, 1, 128]
    - [207, 4268.04]
  - - [43136, 128, 1, 128]
    - [196, 3903.78]
  - - [33280, 1024, 1, 128]
    - [207, 4255.51]
  - - [34816, 18945, 1, 128]
    - [207, 4305.87]
  - - [40704, 8192, 1, 128]
    - [207, 4331.36]
  - - [34304, 128, 1, 128]
    - [194, 3833.8]
  - - [39936, 512, 1, 128]
    - [207, 4202.11]
  - - [36096, 2048, 1, 128]
    - [207, 4302.71]
  - - [40832, 8192, 1, 128]
    - [207, 4331.53]
  - - [37760, 4096, 1, 128]
    - [207, 4322.85]
  - - [36736, 512, 1, 128]
    - [207, 4201.92]
  - - [31744, 8192, 1, 128]
    - [207, 4328.56]
  - - [33920, 1024, 1, 128]
    - [207, 4264.14]
  - - [39808, 128, 1, 128]
    - [207, 3894.28]
  - - [36608, 2048, 1, 128]
    - [207, 4302.85]
  - - [30464, 14593, 1, 128]
    - [207, 4314.11]
  - - [35200, 19201, 1, 128]
    - [196, 4321.26]
  - - [41472, 1024, 1, 128]
    - [207, 4276.13]
  - - [30720, 128, 1, 128]
    - [205, 3779.78]
  - - [41600, 128, 1, 128]
    - [207, 3912.59]
  - - [38144, 22145, 1, 128]
    - [207, 4324.33]
  - - [37120, 4096, 1, 128]
    - [207, 4322.76]
  - - [40704, 24705, 1, 128]
    - [207, 4325.87]
  - - [41088, 25217, 1, 128]
    - [207, 4327.11]
  - - [43776, 8192, 1, 128]
    - [207, 4332.82]
  - - [38912, 1024, 1, 128]
    - [207, 4267.87]
  - - [43008, 2048, 1, 128]
    - [207, 4309.54]
  - - [42496, 26497, 1, 128]
    - [207, 4320.61]
  - - [33536, 512, 1, 128]
    - [207, 4191.74]
  - - [43520, 512, 1, 128]
    - [207, 4222.62]
  - - [39040, 23169, 1, 128]
    - [207, 4325.34]
  - - [29568, 2048, 1, 128]
    - [207, 4292.88]
  - - [44672, 8192, 1, 128]
    - [207, 4333.32]
  - - [29824, 512, 1, 128]
    - [207, 4173.88]
  - - [34944, 2048, 1, 128]
    - [207, 4303.55]
  - - [33408, 4096, 1, 128]
    - [207, 4317.8]
  - - [41600, 25729, 1, 128]
    - [207, 4326.79]
  - - [40832, 2048, 1, 128]
    - [207, 4307.32]
  - - [38912, 128, 1, 128]
    - [194, 3837.79]
  - - [34048, 2048, 1, 128]
    - [207, 4301.52]
  - - [43904, 2048, 1, 128]
    - [207, 4310.68]
  - - [39296, 23297, 1, 128]
    - [207, 4325.38]
  - - [31232, 4096, 1, 128]
    - [207, 4315.73]
  - - [35840, 1024, 1, 128]
    - [207, 4269.17]
  - - [28928, 128, 1, 128]
    - [193, 3727.24]
  - - [42752, 2048, 1, 128]
    - [207, 4310.12]
  - - [44032, 1024, 1, 128]
    - [207, 4281.3]
  - - [29440, 13569, 1, 128]
    - [207, 4312.73]
  - - [35456, 19585, 1, 128]
    - [207, 4323.07]
  - - [35840, 19841, 1, 128]
    - [207, 4317.0]
  - - [31360, 128, 1, 128]
    - [195, 3767.98]
  - - [40192, 2048, 1, 128]
    - [207, 4307.4]
  - - [33920, 8192, 1, 128]
    - [207, 4330.28]
  - - [43648, 512, 1, 128]
    - [207, 4224.78]
  - - [30080, 14209, 1, 128]
    - [207, 4315.26]
  - - [39680, 23809, 1, 128]
    - [207, 4324.89]
  - - [32512, 512, 1, 128]
    - [207, 4185.73]
  - - [34816, 2048, 1, 128]
    - [207, 4299.74]
  - - [43392, 1024, 1, 128]
    - [207, 4279.77]
  - - [39040, 4096, 1, 128]
    - [207, 4320.44]
  - - [43264, 4096, 1, 128]
    - [207, 4324.65]
  - - [44416, 2048, 1, 128]
    - [207, 4305.41]
  - - [31488, 512, 1, 128]
    - [207, 4180.37]
  - - [31616, 1024, 1, 128]
    - [207, 4254.24]
  - - [44032, 8192, 1, 128]
    - [207, 4331.93]
  - - [39424, 23553, 1, 128]
    - [207, 4308.85]
  - - [31360, 8192, 1, 128]
    - [207, 4328.21]
  - - [42752, 128, 1, 128]
    - [207, 3898.31]
  - - [40192, 512, 1, 128]
    - [207, 4214.16]
  - - [36096, 20225, 1, 128]
    - [207, 4322.11]
  - - [41984, 26113, 1, 128]
    - [207, 4311.34]
  - - [39936, 2048, 1, 128]
    - [207, 4307.16]
  - - [42880, 2048, 1, 128]
    - [207, 4310.29]
  - - [29440, 128, 1, 128]
    - [206, 3732.16]
  - - [40192, 128, 1, 128]
    - [194, 3916.87]
  - - [36608, 4096, 1, 128]
    - [207, 4322.39]
  - - [37760, 21761, 1, 128]
    - [196, 4324.06]
  - - [44160, 28161, 1, 128]
    - [207, 4323.97]
  - - [44288, 512, 1, 128]
    - [207, 4211.59]
  - - [29056, 13185, 1, 128]
    - [207, 4311.91]
  - - [43904, 512, 1, 128]
    - [207, 4225.1]
  - - [29696, 128, 1, 128]
    - [207, 3729.97]
  - - [36224, 8192, 1, 128]
    - [207, 4331.76]
  - - [33024, 2048, 1, 128]
    - [207, 4300.73]
  - - [44032, 28161, 1, 128]
    - [207, 4311.59]
  - - [44032, 128, 1, 128]
    - [196, 3925.02]
  - - [38784, 512, 1, 128]
    - [207, 4211.54]
  - - [29056, 8192, 1, 128]
    - [207, 4327.01]
  - - [33920, 18049, 1, 128]
    - [207, 4320.25]
  - - [34816, 1024, 1, 128]
    - [207, 4268.21]
  - - [29056, 128, 1, 128]
    - [196, 3721.48]
  - - [39552, 1024, 1, 128]
    - [207, 4274.39]
  - - [36992, 8192, 1, 128]
    - [207, 4331.77]
  - - [44544, 1024, 1, 128]
    - [207, 4284.3]
  - - [43904, 27905, 1, 128]
    - [207, 4327.93]
  - - [29440, 512, 1, 128]
    - [207, 4167.48]
  - - [29568, 8192, 1, 128]
    - [207, 4328.82]
  - - [41472, 2048, 1, 128]
    - [207, 4309.28]
  - - [29184, 8192, 1, 128]
    - [207, 4327.42]
  - - [33408, 512, 1, 128]
    - [207, 4186.6]
  - - [38656, 22785, 1, 128]
    - [207, 4323.77]
  - - [31744, 15745, 1, 128]
    - [207, 4310.75]
  - - [38656, 2048, 1, 128]
    - [207, 4306.38]
  - - [30080, 8192, 1, 128]
    - [207, 4327.39]
  - - [44672, 128, 1, 128]
    - [207, 3915.61]
  - - [40704, 24833, 1, 128]
    - [207, 4324.95]
  - - [33792, 8192, 1, 128]
    - [207, 4330.76]
  - - [33920, 512, 1, 128]
    - [207, 4191.77]
  - - [40576, 1024, 1, 128]
    - [207, 4277.97]
  - - [36224, 20225, 1, 128]
    - [207, 4322.93]
  - - [34432, 1024, 1, 128]
    - [207, 4265.5]
  - - [31488, 15617, 1, 128]
    - [207, 4315.67]
  - - [40576, 2048, 1, 128]
    - [207, 4307.0]
  - - [30208, 512, 1, 128]
    - [207, 4178.37]
  - - [36480, 128, 1, 128]
    - [205, 3891.19]
  - - [37504, 21633, 1, 128]
    - [207, 4324.81]
  - - [32896, 17025, 1, 128]
    - [207, 4319.68]
  - - [39168, 2048, 1, 128]
    - [207, 4308.2]
  - - [29440, 2048, 1, 128]
    - [207, 4296.29]
  - - [29440, 13441, 1, 128]
    - [207, 4311.14]
  - - [32640, 8192, 1, 128]
    - [207, 4330.13]
  - - [35072, 19073, 1, 128]
    - [207, 4320.49]
  - - [33152, 512, 1, 128]
    - [207, 4191.39]
  - - [40576, 8192, 1, 128]
    - [207, 4330.85]
  - - [34944, 8192, 1, 128]
    - [207, 4330.89]
  - - [38656, 128, 1, 128]
    - [206, 3850.55]
  - - [33536, 17537, 1, 128]
    - [207, 4318.82]
  - - [29952, 512, 1, 128]
    - [207, 4174.68]
  - - [31488, 2048, 1, 128]
    - [207, 4299.43]
  - - [31872, 4096, 1, 128]
    - [207, 4319.95]
  - - [31232, 15233, 1, 128]
    - [207, 4310.31]
  - - [38912, 23041, 1, 128]
    - [207, 4309.16]
  - - [31232, 2048, 1, 128]
    - [207, 4299.23]
  - - [40448, 8192, 1, 128]
    - [207, 4332.38]
  - - [36352, 128, 1, 128]
    - [194, 3857.45]
  - - [43776, 4096, 1, 128]
    - [207, 4324.61]
  - - [32000, 8192, 1, 128]
    - [207, 4330.52]
  - - [37760, 8192, 1, 128]
    - [207, 4330.27]
  - - [30080, 1024, 1, 128]
    - [207, 4254.77]
  - - [44544, 128, 1, 128]
    - [207, 3902.72]
  - - [29696, 1024, 1, 128]
    - [207, 4253.52]
  - - [32640, 512, 1, 128]
    - [207, 4188.38]
  - - [44416, 128, 1, 128]
    - [207, 3912.43]
  - - [41216, 512, 1, 128]
    - [207, 4212.88]
  - - [31872, 512, 1, 128]
    - [207, 4182.54]
  - - [34432, 512, 1, 128]
    - [207, 4193.05]
  - - [34560, 1024, 1, 128]
    - [207, 4262.98]
  - - [42240, 128, 1, 128]
    - [196, 3937.52]
  - - [44288, 28289, 1, 128]
    - [207, 4327.37]
  - - [30336, 14337, 1, 128]
    - [207, 4310.1]
  - - [32384, 2048, 1, 128]
    - [207, 4295.4]
  - - [38400, 22401, 1, 128]
    - [207, 4319.08]
  - - [39296, 1024, 1, 128]
    - [207, 4275.49]
  - - [28928, 8192, 1, 128]
    - [207, 4326.73]
  - - [40320, 2048, 1, 128]
    - [207, 4307.46]
  - - [31104, 15233, 1, 128]
    - [196, 4316.74]
  - - [39680, 512, 1, 128]
    - [207, 4208.97]
  - - [34048, 18049, 1, 128]
    - [207, 4320.26]
  - - [30720, 1024, 1, 128]
    - [207, 4256.91]
  - - [42880, 26881, 1, 128]
    - [207, 4326.99]
  - - [32896, 8192, 1, 128]
    - [207, 4328.36]
  - - [43264, 8192, 1, 128]
    - [207, 4331.47]
  - - [37632, 4096, 1, 128]
    - [207, 4320.16]
  - - [32256, 4096, 1, 128]
    - [207, 4320.53]
  - - [37248, 4096, 1, 128]
    - [207, 4322.99]
  - - [33280, 17409, 1, 128]
    - [207, 4302.38]
  - - [36096, 512, 1, 128]
    - [207, 4199.96]
  - - [37120, 21121, 1, 128]
    - [207, 4323.22]
  - - [32896, 128, 1, 128]
    - [206, 3801.97]
  - - [36352, 20481, 1, 128]
    - [207, 4306.59]
  - - [43392, 2048, 1, 128]
    - [207, 4309.48]
  - - [36352, 512, 1, 128]
    - [207, 4199.03]
  - - [29056, 13057, 1, 128]
    - [207, 4312.28]
  - - [29056, 4096, 1, 128]
    - [207, 4315.25]
  - - [37888, 4096, 1, 128]
    - [207, 4321.99]
  - - [40320, 512, 1, 128]
    - [207, 4217.33]
  - - [39168, 128, 1, 128]
    - [206, 3860.25]
  - - [41472, 8192, 1, 128]
    - [207, 4331.93]
  - - [34560, 512, 1, 128]
    - [207, 4202.08]
  - - [34176, 18305, 1, 128]
    - [207, 4321.76]
  - - [34688, 8192, 1, 128]
    - [207, 4330.72]
  - - [29696, 13825, 1, 128]
    - [207, 4295.57]
  - - [33152, 17281, 1, 128]
    - [207, 4319.7]
  - - [30208, 8192, 1, 128]
    - [207, 4329.29]
  - - [43648, 27649, 1, 128]
    - [207, 4323.6]
  - - [31360, 2048, 1, 128]
    - [207, 4300.41]
  - - [41984, 128, 1, 128]
    - [205, 3897.69]
  - - [38528, 2048, 1, 128]
    - [207, 4302.73]
  - - [32256, 16385, 1, 128]
    - [207, 4301.56]
  - - [42240, 1024, 1, 128]
    - [207, 4277.78]
  - - [32000, 16001, 1, 128]
    - [196, 4315.91]
  - - [37248, 1024, 1, 128]
    - [207, 4270.92]
  - - [32256, 1024, 1, 128]
    - [207, 4259.37]
  - - [39296, 23425, 1, 128]
    - [207, 4325.13]
  - - [43008, 4096, 1, 128]
    - [207, 4323.69]
  - - [31104, 128, 1, 128]
    - [206, 3762.6]
  - - [38656, 8192, 1, 128]
    - [207, 4332.29]
  - - [44288, 128, 1, 128]
    - [196, 3912.93]
  - - [38528, 22657, 1, 128]
    - [207, 4325.58]
  - - [39552, 128, 1, 128]
    - [207, 3878.5]
  - - [37376, 21377, 1, 128]
    - [207, 4318.4]
  - - [28928, 13057, 1, 128]
    - [207, 4309.69]
  - - [43264, 27265, 1, 128]
    - [207, 4326.69]
  - - [35328, 4096, 1, 128]
    - [207, 4320.68]
  - - [30848, 4096, 1, 128]
    - [207, 4317.79]
  - - [44800, 28801, 1, 128]
    - [207, 4327.58]
  - - [35456, 512, 1, 128]
    - [207, 4203.71]
  - - [40960, 24961, 1, 128]
    - [207, 4319.29]
  - - [39936, 23937, 1, 128]
    - [207, 4320.07]
  - - [31744, 1024, 1, 128]
    - [207, 4259.57]
  - - [32128, 8192, 1, 128]
    - [207, 4328.66]
  - - [42112, 26113, 1, 128]
    - [207, 4322.92]
  - - [31744, 2048, 1, 128]
    - [207, 4296.52]
  - - [42112, 1024, 1, 128]
    - [207, 4280.43]
  - - [40064, 8192, 1, 128]
    - [207, 4332.75]
  - - [38144, 128, 1, 128]
    - [207, 3890.38]
  - - [42624, 2048, 1, 128]
    - [207, 4306.29]
  - - [36992, 128, 1, 128]
    - [194, 3837.87]
  - - [40192, 8192, 1, 128]
    - [207, 4330.53]
  - - [40064, 24065, 1, 128]
    - [207, 4322.23]
  - - [37760, 21889, 1, 128]
    - [207, 4324.33]
  - - [36352, 8192, 1, 128]
    - [207, 4331.51]
  - - [44544, 512, 1, 128]
    - [207, 4227.34]
  - - [32384, 4096, 1, 128]
    - [207, 4317.95]
  - - [39168, 23169, 1, 128]
    - [207, 4324.67]
  - - [1408, 897, 1, 128]
    - [183, 2982.67]
  - - [16512, 512, 1, 128]
    - [207, 4054.14]
  - - [20480, 12673, 1, 128]
    - [207, 4302.23]
  - - [20992, 512, 1, 128]
    - [207, 4110.09]
  - - [9344, 512, 1, 128]
    - [207, 3851.37]
  - - [18048, 2048, 1, 128]
    - [207, 4270.79]
  - - [20352, 12673, 1, 128]
    - [207, 4308.17]
  - - [640, 128, 1, 128]
    - [179, 684.449]
  - - [28160, 512, 1, 128]
    - [207, 4161.76]
  - - [20608, 4096, 1, 128]
    - [207, 4308.85]
  - - [19328, 1024, 1, 128]
    - [207, 4208.24]
  - - [26496, 4096, 1, 128]
    - [207, 4316.5]
  - - [10624, 512, 1, 128]
    - [207, 3903.64]
  - - [20352, 1024, 1, 128]
    - [207, 4217.38]
  - - [10240, 6529, 1, 128]
    - [207, 4251.97]
  - - [22144, 14465, 1, 128]
    - [207, 4313.25]
  - - [13184, 2048, 1, 128]
    - [207, 4241.66]
  - - [14720, 6913, 1, 128]
    - [196, 4274.48]
  - - [21248, 512, 1, 128]
    - [207, 4102.37]
  - - [10496, 128, 1, 128]
    - [205, 3144.95]
  - - [13056, 5377, 1, 128]
    - [207, 4251.21]
  - - [10880, 128, 1, 128]
    - [196, 3215.33]
  - - [18688, 512, 1, 128]
    - [207, 4091.19]
  - - [22656, 4096, 1, 128]
    - [207, 4310.72]
  - - [15232, 1024, 1, 128]
    - [207, 4174.66]
  - - [20224, 4096, 1, 128]
    - [207, 4307.72]
  - - [6016, 2305, 1, 128]
    - [196, 4064.67]
  - - [13184, 4096, 1, 128]
    - [207, 4289.25]
  - - [256, 129, 1, 128]
    - [202, 271.663]
  - - [11264, 7553, 1, 128]
    - [207, 4263.11]
  - - [18176, 128, 1, 128]
    - [194, 3498.54]
  - - [15872, 8193, 1, 128]
    - [207, 4266.73]
  - - [26112, 4096, 1, 128]
    - [207, 4315.14]
  - - [22784, 2048, 1, 128]
    - [207, 4281.25]
  - - [10880, 7297, 1, 128]
    - [207, 4268.06]
  - - [14720, 2048, 1, 128]
    - [207, 4248.43]
  - - [9216, 5633, 1, 128]
    - [207, 4220.73]
  - - [23040, 15233, 1, 128]
    - [207, 4307.93]
  - - [8832, 5121, 1, 128]
    - [207, 4227.23]
  - - [18816, 1024, 1, 128]
    - [207, 4206.33]
  - - [128, 129, 1, 128]
    - [179, 133.43]
  - - [15488, 512, 1, 128]
    - [207, 4031.7]
  - - [18176, 1024, 1, 128]
    - [207, 4184.58]
  - - [16128, 8449, 1, 128]
    - [207, 4286.93]
  - - [16000, 2048, 1, 128]
    - [207, 4262.33]
  - - [24960, 9089, 1, 128]
    - [207, 4298.45]
  - - [14336, 1024, 1, 128]
    - [207, 4165.29]
  - - [25472, 8192, 1, 128]
    - [207, 4327.67]
  - - [23040, 128, 1, 128]
    - [205, 3650.74]
  - - [9472, 512, 1, 128]
    - [205, 3872.95]
  - - [19072, 128, 1, 128]
    - [205, 3614.94]
  - - [10624, 6913, 1, 128]
    - [207, 4265.41]
  - - [7808, 1024, 1, 128]
    - [207, 4024.73]
  - - [27008, 11137, 1, 128]
    - [207, 4306.64]
  - - [21504, 4096, 1, 128]
    - [207, 4309.48]
  - - [7936, 1024, 1, 128]
    - [205, 4031.73]
  - - [12928, 5121, 1, 128]
    - [207, 4242.16]
  - - [26240, 8192, 1, 128]
    - [207, 4327.23]
  - - [18304, 2048, 1, 128]
    - [207, 4268.63]
  - - [24576, 1024, 1, 128]
    - [207, 4235.78]
  - - [10624, 128, 1, 128]
    - [194, 3178.65]
  - - [24576, 128, 1, 128]
    - [207, 3628.81]
  - - [25600, 9601, 1, 128]
    - [207, 4294.96]
  - - [5248, 128, 1, 128]
    - [193, 2784.43]
  - - [24448, 4096, 1, 128]
    - [207, 4313.84]
  - - [19328, 128, 1, 128]
    - [206, 3539.0]
  - - [24064, 512, 1, 128]
    - [205, 4116.36]
  - - [11136, 512, 1, 128]
    - [205, 3917.8]
  - - [14592, 1024, 1, 128]
    - [207, 4168.71]
  - - [12544, 4737, 1, 128]
    - [207, 4229.62]
  - - [17280, 128, 1, 128]
    - [195, 3546.04]
  - - [25344, 8192, 1, 128]
    - [207, 4327.32]
  - - [4608, 512, 1, 128]
    - [205, 3526.27]
  - - [4608, 128, 1, 128]
    - [154, 2639.77]
  - - [21760, 512, 1, 128]
    - [207, 4111.59]
  - - [7936, 128, 1, 128]
    - [173, 3012.59]
  - - [11008, 7425, 1, 128]
    - [196, 4270.34]
  - - [13824, 2048, 1, 128]
    - [207, 4250.58]
  - - [18048, 512, 1, 128]
    - [207, 4068.5]
  - - [19584, 11905, 1, 128]
    - [207, 4304.5]
  - - [22656, 512, 1, 128]
    - [207, 4124.4]
  - - [4608, 3073, 1, 128]
    - [207, 4042.94]
  - - [5504, 128, 1, 128]
    - [204, 2860.96]
  - - [4864, 1024, 1, 128]
    - [207, 3868.53]
  - - [17664, 1024, 1, 128]
    - [207, 4198.87]
  - - [18176, 2048, 1, 128]
    - [207, 4270.85]
  - - [2048, 1537, 1, 128]
    - [194, 3502.39]
  - - [22528, 128, 1, 128]
    - [196, 3610.11]
  - - [21760, 13953, 1, 128]
    - [207, 4310.01]
  - - [7040, 128, 1, 128]
    - [194, 2930.47]
  - - [3328, 1665, 1, 128]
    - [196, 3787.18]
  - - [768, 512, 1, 128]
    - [184, 2365.21]
  - - [21504, 13697, 1, 128]
    - [207, 4304.94]
  - - [18560, 10881, 1, 128]
    - [196, 4300.44]
  - - [2560, 128, 1, 128]
    - [180, 2084.64]
  - - [15616, 1024, 1, 128]
    - [207, 4177.19]
  - - [19456, 4096, 1, 128]
    - [207, 4306.94]
  - - [25600, 2048, 1, 128]
    - [207, 4289.31]
  - - [2304, 128, 1, 128]
    - [180, 1929.89]
  - - [1664, 1025, 1, 128]
    - [211, 3127.75]
  - - [23168, 15361, 1, 128]
    - [207, 4310.6]
  - - [9856, 128, 1, 128]
    - [204, 3023.97]
  - - [13312, 2048, 1, 128]
    - [207, 4234.2]
  - - [19200, 512, 1, 128]
    - [207, 4098.14]
  - - [19200, 2048, 1, 128]
    - [207, 4272.78]
  - - [23168, 2048, 1, 128]
    - [207, 4284.25]
  - - [18688, 128, 1, 128]
    - [194, 3555.32]
  - - [13568, 1024, 1, 128]
    - [207, 4157.82]
  - - [17792, 9985, 1, 128]
    - [196, 4297.44]
  - - [20608, 1024, 1, 128]
    - [207, 4219.46]
  - - [11648, 8065, 1, 128]
    - [207, 4278.62]
  - - [1280, 128, 1, 128]
    - [193, 1304.2]
  - - [16256, 4096, 1, 128]
    - [207, 4292.58]
  - - [17024, 1024, 1, 128]
    - [207, 4198.41]
  - - [19456, 128, 1, 128]
    - [206, 3521.51]
  - - [20736, 512, 1, 128]
    - [207, 4093.23]
  - - [14464, 6785, 1, 128]
    - [196, 4273.09]
  - - [20736, 13057, 1, 128]
    - [207, 4307.72]
  - - [8704, 2048, 1, 128]
    - [207, 4198.31]
  - - [640, 512, 1, 128]
    - [180, 2114.06]
  - - [768, 129, 1, 128]
    - [179, 804.646]
  - - [27776, 1024, 1, 128]
    - [207, 4243.78]
  - - [19200, 11521, 1, 128]
    - [207, 4303.44]
  - - [6400, 2048, 1, 128]
    - [207, 4143.75]
  - - [14976, 7297, 1, 128]
    - [196, 4279.35]
  - - [7040, 2048, 1, 128]
    - [207, 4159.89]
  - - [25984, 128, 1, 128]
    - [206, 3699.36]
  - - [13696, 128, 1, 128]
    - [195, 3311.61]
  - - [2688, 1153, 1, 128]
    - [207, 3498.29]
  - - [15232, 2048, 1, 128]
    - [207, 4255.27]
  - - [11776, 128, 1, 128]
    - [205, 3156.71]
  - - [3328, 512, 1, 128]
    - [194, 3425.0]
  - - [11648, 7937, 1, 128]
    - [196, 4276.82]
  - - [19456, 2048, 1, 128]
    - [207, 4274.02]
  - - [11008, 128, 1, 128]
    - [194, 3257.84]
  - - [9984, 6401, 1, 128]
    - [196, 4256.16]
  - - [25856, 9857, 1, 128]
    - [207, 4301.48]
  - - [4224, 512, 1, 128]
    - [206, 3465.5]
  - - [13568, 5761, 1, 128]
    - [207, 4257.22]
  - - [5632, 2049, 1, 128]
    - [205, 3972.45]
  - - [8832, 2048, 1, 128]
    - [207, 4194.61]
  - - [5632, 3969, 1, 128]
    - [207, 4149.61]
  - - [25856, 2048, 1, 128]
    - [207, 4288.78]
  - - [25472, 2048, 1, 128]
    - [207, 4289.58]
  - - [20736, 12929, 1, 128]
    - [196, 4307.23]
  - - [14592, 128, 1, 128]
    - [195, 3388.26]
  - - [1792, 512, 1, 128]
    - [185, 2959.69]
  - - [14208, 2048, 1, 128]
    - [207, 4250.79]
  - - [15360, 7681, 1, 128]
    - [207, 4262.39]
  - - [5760, 2048, 1, 128]
    - [207, 4133.68]
  - - [6400, 512, 1, 128]
    - [205, 3672.77]
  - - [5248, 3713, 1, 128]
    - [196, 4138.22]
  - - [16768, 1024, 1, 128]
    - [207, 4188.23]
  - - [10752, 512, 1, 128]
    - [205, 3912.94]
  - - [26624, 2048, 1, 128]
    - [207, 4290.0]
  - - [384, 128, 1, 128]
    - [181, 419.43]
  - - [27392, 8192, 1, 128]
    - [207, 4327.7]
  - - [24448, 512, 1, 128]
    - [207, 4144.83]
  - - [11136, 7553, 1, 128]
    - [196, 4272.94]
  - - [17024, 9345, 1, 128]
    - [196, 4293.8]
  - - [16000, 8193, 1, 128]
    - [207, 4282.48]
  - - [5888, 2048, 1, 128]
    - [207, 4134.98]
  - - [18304, 10497, 1, 128]
    - [196, 4299.88]
  - - [3968, 128, 1, 128]
    - [167, 2390.14]
  - - [14336, 6529, 1, 128]
    - [207, 4262.34]
  - - [19840, 128, 1, 128]
    - [206, 3562.68]
  - - [25600, 8192, 1, 128]
    - [207, 4327.12]
  - - [18688, 11009, 1, 128]
    - [196, 4299.72]
  - - [7680, 1024, 1, 128]
    - [207, 4045.95]
  - - [7168, 128, 1, 128]
    - [205, 2959.69]
  - - [1664, 512, 1, 128]
    - [152, 2869.79]
  - - [12544, 1024, 1, 128]
    - [207, 4143.57]
  - - [6528, 2048, 1, 128]
    - [207, 4148.35]
  - - [19072, 4096, 1, 128]
    - [207, 4305.41]
  - - [2048, 512, 1, 128]
    - [212, 3121.34]
  - - [13568, 5889, 1, 128]
    - [207, 4255.83]
  - - [23680, 16001, 1, 128]
    - [207, 4315.59]
  - - [26112, 10113, 1, 128]
    - [207, 4296.95]
  - - [15872, 128, 1, 128]
    - [195, 3403.75]
  - - [16384, 512, 1, 128]
    - [207, 4043.92]
  - - [9856, 6273, 1, 128]
    - [196, 4254.74]
  - - [26368, 1024, 1, 128]
    - [207, 4240.62]
  - - [16256, 2048, 1, 128]
    - [207, 4265.17]
  - - [3968, 2305, 1, 128]
    - [196, 3967.46]
  - - [28672, 8192, 1, 128]
    - [207, 4326.24]
  - - [10368, 1024, 1, 128]
    - [207, 4102.63]
  - - [11008, 1024, 1, 128]
    - [207, 4125.7]
  - - [11776, 4097, 1, 128]
    - [207, 4197.95]
  - - [26496, 2048, 1, 128]
    - [207, 4288.99]
  - - [17792, 4096, 1, 128]
    - [207, 4303.36]
  - - [2304, 512, 1, 128]
    - [206, 3132.68]
  - - [9216, 2048, 1, 128]
    - [205, 4186.74]
  - - [12416, 512, 1, 128]
    - [207, 3987.91]
  - - [18048, 128, 1, 128]
    - [206, 3511.86]
  - - [21888, 14209, 1, 128]
    - [207, 4312.42]
  - - [9344, 5761, 1, 128]
    - [207, 4246.48]
  - - [19712, 2048, 1, 128]
    - [207, 4275.37]
  - - [12288, 1024, 1, 128]
    - [207, 4134.87]
  - - [3584, 1921, 1, 128]
    - [207, 3863.83]
  - - [22784, 128, 1, 128]
    - [205, 3654.0]
  - - [26880, 128, 1, 128]
    - [207, 3778.33]
  - - [17408, 1024, 1, 128]
    - [207, 4189.69]
  - - [15488, 4096, 1, 128]
    - [207, 4296.94]
  - - [13312, 5633, 1, 128]
    - [207, 4236.82]
  - - [22016, 14337, 1, 128]
    - [207, 4296.13]
  - - [19328, 2048, 1, 128]
    - [207, 4270.24]
  - - [25600, 128, 1, 128]
    - [206, 3656.12]
  - - [22784, 15105, 1, 128]
    - [207, 4313.16]
  - - [5376, 3713, 1, 128]
    - [196, 4140.23]
  - - [14208, 512, 1, 128]
    - [205, 4008.67]
  - - [12928, 4096, 1, 128]
    - [207, 4290.95]
  - - [768, 257, 1, 128]
    - [181, 1521.94]
  - - [27776, 11777, 1, 128]
    - [207, 4305.02]
  - - [12032, 1024, 1, 128]
    - [207, 4130.15]
  - - [14208, 4096, 1, 128]
    - [207, 4293.12]
  - - [19840, 12161, 1, 128]
    - [207, 4306.57]
  - - [17536, 512, 1, 128]
    - [207, 4070.7]
  - - [19840, 4096, 1, 128]
    - [207, 4300.78]
  - - [26624, 512, 1, 128]
    - [207, 4148.43]
  - - [27136, 11137, 1, 128]
    - [207, 4300.1]
  - - [11008, 512, 1, 128]
    - [207, 3945.63]
  - - [1024, 513, 1, 128]
    - [154, 2401.43]
  - - [15744, 512, 1, 128]
    - [207, 4041.83]
  - - [22016, 128, 1, 128]
    - [206, 3574.21]
  - - [9344, 1024, 1, 128]
    - [207, 4093.37]
  - - [28544, 1024, 1, 128]
    - [207, 4250.34]
  - - [13440, 5633, 1, 128]
    - [207, 4252.48]
  - - [21632, 13825, 1, 128]
    - [207, 4306.77]
  - - [24064, 4096, 1, 128]
    - [207, 4312.67]
  - - [24192, 512, 1, 128]
    - [207, 4133.5]
  - - [22912, 15233, 1, 128]
    - [207, 4314.03]
  - - [20864, 13185, 1, 128]
    - [196, 4308.91]
  - - [8064, 4353, 1, 128]
    - [196, 4207.05]
  - - [8704, 5121, 1, 128]
    - [207, 4207.5]
  - - [19840, 1024, 1, 128]
    - [207, 4210.6]
  - - [15616, 128, 1, 128]
    - [195, 3377.15]
  - - [21632, 512, 1, 128]
    - [207, 4108.72]
  - - [13440, 512, 1, 128]
    - [205, 3997.11]
  - - [23936, 128, 1, 128]
    - [206, 3647.39]
  - - [8960, 5377, 1, 128]
    - [207, 4235.54]
  - - [27008, 512, 1, 128]
    - [207, 4158.04]
  - - [13440, 5761, 1, 128]
    - [207, 4260.86]
  - - [3072, 512, 1, 128]
    - [194, 3259.82]
  - - [4096, 1024, 1, 128]
    - [205, 3782.91]
  - - [7296, 3585, 1, 128]
    - [207, 4168.73]
  - - [12416, 4737, 1, 128]
    - [207, 4240.22]
  - - [6912, 512, 1, 128]
    - [207, 3716.65]
  - - [11136, 2048, 1, 128]
    - [207, 4228.57]
  - - [18176, 10369, 1, 128]
    - [207, 4298.52]
  - - [14976, 4096, 1, 128]
    - [207, 4297.24]
  - - [19712, 4096, 1, 128]
    - [207, 4309.1]
  - - [8064, 1024, 1, 128]
    - [207, 4041.62]
  - - [9600, 128, 1, 128]
    - [206, 3244.34]
  - - [26240, 1024, 1, 128]
    - [207, 4240.22]
  - - [5248, 3585, 1, 128]
    - [207, 4126.74]
  - - [16768, 2048, 1, 128]
    - [207, 4260.49]
  - - [13184, 128, 1, 128]
    - [196, 3404.9]
  - - [19328, 11521, 1, 128]
    - [207, 4304.13]
  - - [4864, 512, 1, 128]
    - [195, 3496.79]
  - - [3584, 2049, 1, 128]
    - [205, 3857.45]
  - - [18560, 128, 1, 128]
    - [194, 3555.74]
  - - [27392, 11393, 1, 128]
    - [207, 4306.61]
  - - [27520, 512, 1, 128]
    - [207, 4158.71]
  - - [18176, 4096, 1, 128]
    - [207, 4303.02]
  - - [7808, 4225, 1, 128]
    - [207, 4198.38]
  - - [15232, 128, 1, 128]
    - [195, 3466.13]
  - - [25728, 1024, 1, 128]
    - [207, 4227.54]
  - - [23936, 512, 1, 128]
    - [207, 4143.78]
  - - [23424, 2048, 1, 128]
    - [207, 4285.28]
  - - [28032, 12161, 1, 128]
    - [207, 4309.97]
  - - [27136, 512, 1, 128]
    - [207, 4159.77]
  - - [14336, 6657, 1, 128]
    - [207, 4253.71]
  - - [15616, 4096, 1, 128]
    - [207, 4298.6]
  - - [3328, 1793, 1, 128]
    - [207, 3817.42]
  - - [28416, 512, 1, 128]
    - [207, 4159.08]
  - - [16384, 8705, 1, 128]
    - [207, 4273.58]
  - - [3200, 1537, 1, 128]
    - [207, 3739.34]
  - - [26368, 128, 1, 128]
    - [207, 3735.85]
  - - [16000, 512, 1, 128]
    - [207, 4045.43]
  - - [25216, 9345, 1, 128]
    - [207, 4299.84]
  - - [28288, 4096, 1, 128]
    - [207, 4317.73]
  - - [24832, 512, 1, 128]
    - [207, 4137.57]
  - - [18048, 10369, 1, 128]
    - [207, 4299.93]
  - - [20480, 4096, 1, 128]
    - [207, 4307.3]
  - - [17792, 10113, 1, 128]
    - [207, 4298.78]
  - - [13312, 5505, 1, 128]
    - [207, 4248.26]
  - - [17024, 2048, 1, 128]
    - [207, 4266.32]
  - - [20608, 12929, 1, 128]
    - [207, 4307.77]
  - - [16896, 4096, 1, 128]
    - [207, 4298.85]
  - - [27776, 2048, 1, 128]
    - [207, 4294.24]
  - - [6912, 3201, 1, 128]
    - [196, 4141.38]
  - - [15744, 2048, 1, 128]
    - [207, 4256.42]
  - - [24448, 128, 1, 128]
    - [195, 3695.17]
  - - [2688, 128, 1, 128]
    - [180, 2121.4]
  - - [7808, 2048, 1, 128]
    - [207, 4174.46]
  - - [1408, 512, 1, 128]
    - [193, 2879.98]
  - - [12032, 512, 1, 128]
    - [207, 3949.76]
  - - [26752, 512, 1, 128]
    - [207, 4156.12]
  - - [16128, 8321, 1, 128]
    - [207, 4286.42]
  - - [25856, 128, 1, 128]
    - [195, 3687.54]
  - - [24064, 8192, 1, 128]
    - [207, 4319.61]
  - - [28160, 4096, 1, 128]
    - [207, 4315.68]
  - - [13312, 128, 1, 128]
    - [205, 3412.12]
  - - [10112, 6401, 1, 128]
    - [196, 4258.26]
  - - [16384, 4096, 1, 128]
    - [207, 4300.04]
  - - [16512, 2048, 1, 128]
    - [207, 4260.19]
  - - [27520, 11521, 1, 128]
    - [207, 4308.16]
  - - [8192, 4481, 1, 128]
    - [207, 4196.74]
  - - [16768, 512, 1, 128]
    - [207, 4061.61]
  - - [6144, 128, 1, 128]
    - [167, 2714.76]
  - - [13568, 512, 1, 128]
    - [207, 3990.98]
  - - [9344, 5633, 1, 128]
    - [207, 4238.11]
  - - [13440, 4096, 1, 128]
    - [207, 4291.58]
  - - [2176, 1665, 1, 128]
    - [205, 3615.13]
  - - [28288, 128, 1, 128]
    - [196, 3752.19]
  - - [11776, 4096, 1, 128]
    - [207, 4277.05]
  - - [17280, 512, 1, 128]
    - [207, 4070.09]
  - - [5504, 3841, 1, 128]
    - [207, 4150.1]
  - - [14848, 7041, 1, 128]
    - [207, 4269.69]
  - - [3584, 128, 1, 128]
    - [182, 2589.08]
  - - [26880, 8192, 1, 128]
    - [207, 4326.84]
  - - [2944, 1409, 1, 128]
    - [194, 3667.84]
  - - [26368, 10369, 1, 128]
    - [196, 4302.43]
  - - [21888, 512, 1, 128]
    - [207, 4110.17]
  - - [15872, 2048, 1, 128]
    - [207, 4259.92]
  - - [20224, 512, 1, 128]
    - [207, 4092.76]
  - - [24320, 8449, 1, 128]
    - [196, 4293.57]
  - - [5632, 1024, 1, 128]
    - [207, 3924.08]
  - - [17152, 9473, 1, 128]
    - [207, 4293.65]
  - - [4096, 128, 1, 128]
    - [213, 2442.1]
  - - [8832, 128, 1, 128]
    - [193, 3094.6]
  - - [2048, 1409, 1, 128]
    - [195, 3466.22]
  - - [28160, 12289, 1, 128]
    - [207, 4294.14]
  - - [9088, 5505, 1, 128]
    - [196, 4238.77]
  - - [19200, 1024, 1, 128]
    - [207, 4213.41]
  - - [18048, 4096, 1, 128]
    - [207, 4303.18]
  - - [12928, 512, 1, 128]
    - [205, 3994.19]
  - - [20864, 4096, 1, 128]
    - [207, 4309.24]
  - - [27008, 2048, 1, 128]
    - [207, 4287.57]
  - - [16640, 128, 1, 128]
    - [204, 3463.28]
  - - [24960, 8192, 1, 128]
    - [207, 4326.77]
  - - [24320, 1024, 1, 128]
    - [207, 4238.02]
  - - [23552, 15873, 1, 128]
    - [207, 4299.17]
  - - [26240, 4096, 1, 128]
    - [207, 4316.64]
  - - [24320, 128, 1, 128]
    - [207, 3658.27]
  - - [26240, 128, 1, 128]
    - [205, 3716.43]
  - - [3200, 1665, 1, 128]
    - [207, 3783.75]
  - - [11776, 2048, 1, 128]
    - [207, 4232.49]
  - - [6144, 512, 1, 128]
    - [205, 3684.6]
  - - [24960, 128, 1, 128]
    - [207, 3694.84]
  - - [23424, 128, 1, 128]
    - [193, 3619.19]
  - - [11776, 8065, 1, 128]
    - [207, 4267.21]
  - - [19072, 11265, 1, 128]
    - [207, 4298.7]
  - - [8192, 4609, 1, 128]
    - [207, 4189.54]
  - - [21888, 4096, 1, 128]
    - [207, 4309.21]
  - - [14976, 2048, 1, 128]
    - [207, 4252.83]
  - - [23680, 4096, 1, 128]
    - [207, 4312.31]
  - - [14080, 1024, 1, 128]
    - [207, 4159.89]
  - - [19968, 4096, 1, 128]
    - [207, 4306.88]
  - - [8704, 128, 1, 128]
    - [193, 3039.35]
  - - [23424, 15745, 1, 128]
    - [196, 4315.33]
  - - [8320, 2048, 1, 128]
    - [207, 4192.37]
  - - [6144, 2433, 1, 128]
    - [196, 4058.26]
  - - [19200, 11393, 1, 128]
    - [207, 4303.61]
  - - [28416, 128, 1, 128]
    - [194, 3755.78]
  - - [14080, 2048, 1, 128]
    - [207, 4235.5]
  - - [12544, 4096, 1, 128]
    - [207, 4286.93]
  - - [17024, 128, 1, 128]
    - [195, 3514.63]
  - - [23936, 16257, 1, 128]
    - [207, 4316.53]
  - - [12288, 128, 1, 128]
    - [196, 3243.02]
  - - [28800, 1024, 1, 128]
    - [207, 4248.88]
  - - [13824, 6017, 1, 128]
    - [207, 4254.34]
  - - [23040, 2048, 1, 128]
    - [207, 4282.45]
  - - [9984, 6273, 1, 128]
    - [207, 4254.73]
  - - [23680, 512, 1, 128]
    - [207, 4126.49]
  - - [7936, 4353, 1, 128]
    - [196, 4202.76]
  - - [24192, 2048, 1, 128]
    - [207, 4287.31]
  - - [8448, 512, 1, 128]
    - [207, 3807.75]
  - - [5760, 2177, 1, 128]
    - [196, 4029.57]
  - - [22656, 14977, 1, 128]
    - [207, 4314.36]
  - - [17024, 4096, 1, 128]
    - [207, 4302.68]
  - - [24960, 8961, 1, 128]
    - [207, 4298.05]
  - - [5888, 1024, 1, 128]
    - [207, 3939.92]
  - - [9344, 2048, 1, 128]
    - [207, 4204.38]
  - - [11520, 1024, 1, 128]
    - [207, 4129.15]
  - - [17024, 9217, 1, 128]
    - [207, 4290.14]
  - - [10368, 6657, 1, 128]
    - [207, 4256.86]
  - - [21632, 2048, 1, 128]
    - [207, 4280.29]
  - - [26880, 2048, 1, 128]
    - [207, 4291.16]
  - - [20736, 4096, 1, 128]
    - [207, 4309.22]
  - - [26624, 8192, 1, 128]
    - [207, 4323.81]
  - - [26752, 2048, 1, 128]
    - [207, 4291.53]
  - - [24192, 8321, 1, 128]
    - [207, 4295.12]
  - - [4736, 1024, 1, 128]
    - [205, 3866.2]
  - - [27648, 8192, 1, 128]
    - [207, 4328.62]
  - - [27392, 11521, 1, 128]
    - [207, 4306.76]
  - - [27776, 4096, 1, 128]
    - [207, 4316.95]
  - - [28672, 12801, 1, 128]
    - [207, 4295.29]
  - - [13056, 512, 1, 128]
    - [207, 3966.42]
  - - [25088, 2048, 1, 128]
    - [207, 4287.38]
  - - [17408, 9601, 1, 128]
    - [207, 4287.83]
  - - [5120, 3585, 1, 128]
    - [207, 4105.73]
  - - [13824, 512, 1, 128]
    - [205, 4005.87]
  - - [8576, 1024, 1, 128]
    - [207, 4061.54]
  - - [16768, 4096, 1, 128]
    - [207, 4291.77]
  - - [25728, 9729, 1, 128]
    - [207, 4297.61]
  - - [27392, 512, 1, 128]
    - [207, 4155.47]
  - - [13824, 128, 1, 128]
    - [206, 3265.45]
  - - [27264, 1024, 1, 128]
    - [207, 4244.92]
  - - [22272, 14465, 1, 128]
    - [207, 4311.55]
  - - [19840, 2048, 1, 128]
    - [207, 4273.71]
  - - [18176, 10497, 1, 128]
    - [207, 4298.06]
  - - [4992, 3329, 1, 128]
    - [196, 4116.32]
  - - [14976, 7169, 1, 128]
    - [207, 4274.22]
  - - [10112, 512, 1, 128]
    - [207, 3888.17]
  - - [24704, 128, 1, 128]
    - [193, 3687.59]
  - - [16896, 128, 1, 128]
    - [204, 3444.8]
  - - [10880, 7169, 1, 128]
    - [207, 4258.15]
  - - [9600, 512, 1, 128]
    - [205, 3902.89]
  - - [22528, 1024, 1, 128]
    - [207, 4226.97]
  - - [27008, 128, 1, 128]
    - [206, 3715.98]
  - - [4480, 2945, 1, 128]
    - [196, 4073.28]
  - - [15872, 8065, 1, 128]
    - [207, 4278.74]
  - - [28672, 128, 1, 128]
    - [196, 3747.3]
  - - [9344, 128, 1, 128]
    - [193, 3205.43]
  - - [15360, 2048, 1, 128]
    - [207, 4257.64]
  - - [11392, 512, 1, 128]
    - [205, 3943.51]
  - - [9216, 128, 1, 128]
    - [195, 3148.34]
  - - [8192, 2048, 1, 128]
    - [207, 4184.82]
  - - [14464, 1024, 1, 128]
    - [207, 4165.92]
  - - [4096, 2433, 1, 128]
    - [207, 3986.73]
  - - [6528, 2945, 1, 128]
    - [207, 4124.14]
  - - [12672, 512, 1, 128]
    - [207, 3972.03]
  - - [26624, 128, 1, 128]
    - [194, 3718.1]
  - - [19712, 1024, 1, 128]
    - [207, 4209.61]
  - - [4480, 2817, 1, 128]
    - [196, 4057.11]
  - - [13440, 2048, 1, 128]
    - [207, 4245.65]
  - - [256, 257, 1, 128]
    - [199, 537.078]
  - - [16000, 128, 1, 128]
    - [195, 3411.56]
  - - [7552, 3969, 1, 128]
    - [196, 4191.6]
  - - [12416, 2048, 1, 128]
    - [207, 4238.43]
  - - [18432, 512, 1, 128]
    - [207, 4068.85]
  - - [14464, 512, 1, 128]
    - [205, 3998.28]
  - - [1280, 769, 1, 128]
    - [208, 3008.43]
  - - [14976, 512, 1, 128]
    - [207, 4024.39]
  - - [28032, 4096, 1, 128]
    - [207, 4316.91]
  - - [27904, 128, 1, 128]
    - [196, 3724.17]
  - - [20224, 12545, 1, 128]
    - [207, 4304.82]
  - - [15872, 4096, 1, 128]
    - [207, 4298.56]
  - - [3456, 1793, 1, 128]
    - [196, 3830.98]
  - - [14336, 128, 1, 128]
    - [195, 3319.4]
  - - [21248, 2048, 1, 128]
    - [207, 4279.11]
  - - [23040, 1024, 1, 128]
    - [207, 4227.89]
  - - [15232, 7425, 1, 128]
    - [207, 4279.59]
  - - [14592, 512, 1, 128]
    - [207, 4006.63]
  - - [22912, 15105, 1, 128]
    - [207, 4314.47]
  - - [22528, 2048, 1, 128]
    - [207, 4280.52]
  - - [3072, 1024, 1, 128]
    - [207, 3687.3]
  - - [17536, 4096, 1, 128]
    - [207, 4301.93]
  - - [384, 257, 1, 128]
    - [181, 801.527]
  - - [14464, 6657, 1, 128]
    - [207, 4267.38]
  - - [20096, 1024, 1, 128]
    - [207, 4211.74]
  - - [26880, 4096, 1, 128]
    - [207, 4313.86]
  - - [18816, 2048, 1, 128]
    - [207, 4269.83]
  - - [17152, 512, 1, 128]
    - [207, 4059.79]
  - - [18432, 4096, 1, 128]
    - [207, 4305.07]
  - - [10368, 2048, 1, 128]
    - [207, 4218.78]
  - - [1408, 769, 1, 128]
    - [182, 2918.96]
  - - [7168, 2048, 1, 128]
    - [207, 4168.99]
  - - [17664, 128, 1, 128]
    - [206, 3461.81]
  - - [1152, 513, 1, 128]
    - [196, 2521.5]
  - - [7296, 3713, 1, 128]
    - [207, 4172.91]
  - - [24064, 2048, 1, 128]
    - [207, 4277.23]
  - - [8576, 2048, 1, 128]
    - [207, 4197.12]
  - - [23168, 15489, 1, 128]
    - [196, 4315.1]
  - - [14848, 7169, 1, 128]
    - [207, 4262.02]
  - - [2432, 512, 1, 128]
    - [193, 2978.02]
  - - [19712, 12033, 1, 128]
    - [207, 4304.97]
  - - [25856, 4096, 1, 128]
    - [207, 4313.68]
  - - [17152, 9345, 1, 128]
    - [207, 4293.82]
  - - [3712, 128, 1, 128]
    - [184, 2644.24]
  - - [22272, 128, 1, 128]
    - [195, 3621.51]
  - - [25600, 9729, 1, 128]
    - [207, 4283.68]
  - - [6016, 2433, 1, 128]
    - [196, 4061.23]
  - - [12928, 128, 1, 128]
    - [205, 3392.25]
  - - [25088, 8192, 1, 128]
    - [207, 4327.58]
  - - [7040, 1024, 1, 128]
    - [207, 4002.89]
  - - [4736, 3201, 1, 128]
    - [207, 4103.52]
  - - [16000, 1024, 1, 128]
    - [207, 4182.59]
  - - [1920, 512, 1, 128]
    - [194, 3060.05]
  - - [8192, 1024, 1, 128]
    - [207, 4047.58]
  - - [8448, 4865, 1, 128]
    - [196, 4224.27]
  - - [11136, 7425, 1, 128]
    - [196, 4272.36]
  - - [23296, 4096, 1, 128]
    - [207, 4306.46]
  - - [27904, 2048, 1, 128]
    - [207, 4293.97]
  - - [23552, 4096, 1, 128]
    - [207, 4311.04]
  - - [24960, 2048, 1, 128]
    - [207, 4287.31]
  - - [2816, 128, 1, 128]
    - [180, 2231.01]
  - - [7424, 3841, 1, 128]
    - [196, 4178.11]
  - - [20480, 128, 1, 128]
    - [194, 3569.62]
  - - [18816, 11137, 1, 128]
    - [207, 4303.15]
  - - [26496, 128, 1, 128]
    - [194, 3733.32]
  - - [16896, 9217, 1, 128]
    - [207, 4274.9]
  - - [23296, 512, 1, 128]
    - [207, 4128.07]
  - - [8064, 2048, 1, 128]
    - [207, 4183.01]
  - - [19968, 128, 1, 128]
    - [206, 3522.35]
  - - [8320, 4737, 1, 128]
    - [196, 4219.54]
  - - [27648, 1024, 1, 128]
    - [207, 4238.06]
  - - [3712, 512, 1, 128]
    - [206, 3390.05]
  - - [256, 128, 1, 128]
    - [179, 276.669]
  - - [3072, 1537, 1, 128]
    - [207, 3679.82]
  - - [5504, 1024, 1, 128]
    - [207, 3938.74]
  - - [20992, 2048, 1, 128]
    - [207, 4275.91]
  - - [20480, 1024, 1, 128]
    - [207, 4218.56]
  - - [20864, 128, 1, 128]
    - [196, 3645.86]
  - - [28544, 12545, 1, 128]
    - [207, 4311.12]
  - - [1152, 512, 1, 128]
    - [134, 2617.8]
  - - [24320, 8321, 1, 128]
    - [207, 4292.03]
  - - [2688, 512, 1, 128]
    - [205, 3212.27]
  - - [27904, 8192, 1, 128]
    - [207, 4327.89]
  - - [3840, 2177, 1, 128]
    - [196, 3958.42]
  - - [25344, 128, 1, 128]
    - [204, 3661.69]
  - - [13184, 512, 1, 128]
    - [207, 3978.02]
  - - [7680, 512, 1, 128]
    - [205, 3814.15]
  - - [11904, 2048, 1, 128]
    - [207, 4234.37]
  - - [12544, 512, 1, 128]
    - [205, 3951.56]
  - - [8448, 4737, 1, 128]
    - [207, 4215.35]
  - - [28544, 128, 1, 128]
    - [194, 3778.8]
  - - [21760, 14081, 1, 128]
    - [207, 4310.97]
  - - [12800, 128, 1, 128]
    - [194, 3347.93]
  - - [17664, 4096, 1, 128]
    - [207, 4303.77]
  - - [2432, 1793, 1, 128]
    - [207, 3714.09]
  - - [16384, 8577, 1, 128]
    - [207, 4282.4]
  - - [28544, 512, 1, 128]
    - [207, 4161.46]
  - - [28032, 12033, 1, 128]
    - [207, 4309.61]
  - - [4864, 3329, 1, 128]
    - [196, 4106.78]
  - - [12928, 5249, 1, 128]
    - [196, 4250.24]
  - - [4736, 512, 1, 128]
    - [205, 3590.68]
  - - [27264, 2048, 1, 128]
    - [207, 4294.51]
  - - [19840, 12033, 1, 128]
    - [196, 4305.8]
  - - [19584, 4096, 1, 128]
    - [207, 4305.82]
  - - [21376, 4096, 1, 128]
    - [207, 4308.73]
  - - [20352, 4096, 1, 128]
    - [207, 4307.34]
  - - [6400, 2689, 1, 128]
    - [207, 4096.91]
  - - [24704, 8192, 1, 128]
    - [207, 4327.12]
  - - [22528, 14849, 1, 128]
    - [207, 4297.7]
  - - [18304, 512, 1, 128]
    - [207, 4070.21]
  - - [6656, 1024, 1, 128]
    - [205, 3993.11]
  - - [13568, 4096, 1, 128]
    - [207, 4292.4]
  - - [6016, 512, 1, 128]
    - [205, 3634.44]
  - - [17664, 2048, 1, 128]
    - [207, 4268.07]
  - - [17408, 512, 1, 128]
    - [207, 4061.71]
  - - [24960, 4096, 1, 128]
    - [207, 4313.02]
  - - [20608, 12801, 1, 128]
    - [207, 4303.23]
  - - [27648, 11649, 1, 128]
    - [207, 4300.77]
  - - [5760, 128, 1, 128]
    - [182, 2901.96]
  - - [17792, 512, 1, 128]
    - [207, 4065.05]
  - - [17664, 512, 1, 128]
    - [207, 4074.44]
  - - [19968, 12161, 1, 128]
    - [207, 4299.75]
  - - [19840, 512, 1, 128]
    - [207, 4091.88]
  - - [12032, 4353, 1, 128]
    - [207, 4227.97]
  - - [25984, 512, 1, 128]
    - [207, 4147.31]
  - - [27648, 4096, 1, 128]
    - [207, 4317.17]
  - - [10752, 7041, 1, 128]
    - [207, 4254.72]
  - - [28544, 2048, 1, 128]
    - [207, 4295.23]
  - - [7680, 2048, 1, 128]
    - [207, 4181.06]
  - - [13184, 5377, 1, 128]
    - [196, 4253.93]
  - - [6784, 3201, 1, 128]
    - [207, 4139.5]
  - - [16384, 2048, 1, 128]
    - [207, 4261.22]
  - - [22656, 1024, 1, 128]
    - [207, 4227.26]
  - - [12800, 512, 1, 128]
    - [207, 3972.63]
  - - [23936, 1024, 1, 128]
    - [207, 4232.33]
  - - [15360, 1024, 1, 128]
    - [207, 4175.52]
  - - [15488, 2048, 1, 128]
    - [207, 4257.29]
  - - [11392, 1024, 1, 128]
    - [207, 4129.35]
  - - [15744, 1024, 1, 128]
    - [207, 4180.37]
  - - [9856, 2048, 1, 128]
    - [207, 4211.53]
  - - [5888, 2305, 1, 128]
    - [196, 4045.63]
  - - [10496, 512, 1, 128]
    - [207, 3933.35]
  - - [1664, 1153, 1, 128]
    - [204, 3238.13]
  - - [3456, 1024, 1, 128]
    - [207, 3712.99]
  - - [20992, 13313, 1, 128]
    - [207, 4292.84]
  - - [11904, 4096, 1, 128]
    - [207, 4277.91]
  - - [13056, 1024, 1, 128]
    - [207, 4146.74]
  - - [12800, 2048, 1, 128]
    - [207, 4235.81]
  - - [12160, 512, 1, 128]
    - [207, 3952.97]
  - - [5760, 2049, 1, 128]
    - [207, 3994.41]
  - - [11392, 128, 1, 128]
    - [194, 3321.11]
  - - [5632, 128, 1, 128]
    - [193, 2872.81]
  - - [11520, 2048, 1, 128]
    - [207, 4227.42]
  - - [11648, 2048, 1, 128]
    - [207, 4231.03]
  - - [28544, 8192, 1, 128]
    - [207, 4328.88]
  - - [22912, 1024, 1, 128]
    - [207, 4231.65]
  - - [10752, 7169, 1, 128]
    - [207, 4252.75]
  - - [8320, 128, 1, 128]
    - [173, 3081.24]
  - - [23808, 1024, 1, 128]
    - [207, 4234.83]
  - - [25984, 8192, 1, 128]
    - [207, 4327.71]
  - - [22656, 2048, 1, 128]
    - [207, 4281.75]
  - - [7296, 1024, 1, 128]
    - [207, 4014.7]
  - - [28032, 512, 1, 128]
    - [207, 4162.75]
  - - [22400, 2048, 1, 128]
    - [207, 4282.15]
  - - [22144, 512, 1, 128]
    - [207, 4115.32]
  - - [13312, 4096, 1, 128]
    - [207, 4291.37]
  - - [10240, 2048, 1, 128]
    - [207, 4219.09]
  - - [12672, 128, 1, 128]
    - [194, 3337.9]
  - - [10752, 2048, 1, 128]
    - [207, 4218.91]
  - - [1152, 128, 1, 128]
    - [181, 1188.56]
  - - [13696, 5889, 1, 128]
    - [196, 4261.93]
  - - [9216, 1024, 1, 128]
    - [207, 4075.98]
  - - [17152, 128, 1, 128]
    - [206, 3519.77]
  - - [24320, 2048, 1, 128]
    - [207, 4287.62]
  - - [16512, 8705, 1, 128]
    - [207, 4284.86]
  - - [3072, 1409, 1, 128]
    - [196, 3656.56]
  - - [1024, 128, 1, 128]
    - [193, 1053.85]
  - - [22400, 14593, 1, 128]
    - [207, 4312.78]
  - - [4096, 512, 1, 128]
    - [206, 3370.61]
  - - [4992, 128, 1, 128]
    - [196, 2708.24]
  - - [9472, 5889, 1, 128]
    - [196, 4246.81]
  - - [9472, 5761, 1, 128]
    - [207, 4243.87]
  - - [27136, 1024, 1, 128]
    - [207, 4239.7]
  - - [6528, 1024, 1, 128]
    - [207, 3981.19]
  - - [25472, 1024, 1, 128]
    - [207, 4239.04]
  - - [5120, 512, 1, 128]
    - [205, 3581.81]
  - - [5504, 512, 1, 128]
    - [205, 3597.03]
  - - [21120, 13441, 1, 128]
    - [207, 4311.0]
  - - [4352, 128, 1, 128]
    - [154, 2561.18]
  - - [8832, 5249, 1, 128]
    - [196, 4232.87]
  - - [1536, 1025, 1, 128]
    - [207, 3186.64]
  - - [11520, 512, 1, 128]
    - [207, 3969.37]
  - - [5632, 2048, 1, 128]
    - [207, 4110.69]
  - - [7424, 128, 1, 128]
    - [207, 3040.87]
  - - [18432, 128, 1, 128]
    - [194, 3503.36]
  - - [12672, 2048, 1, 128]
    - [207, 4237.53]
  - - [14208, 128, 1, 128]
    - [195, 3354.23]
  - - [15360, 7553, 1, 128]
    - [207, 4274.16]
  - - [26496, 1024, 1, 128]
    - [207, 4243.71]
  - - [27136, 128, 1, 128]
    - [205, 3676.78]
  - - [12032, 2048, 1, 128]
    - [207, 4235.07]
  - - [11648, 1024, 1, 128]
    - [207, 4125.4]
  - - [11776, 512, 1, 128]
    - [205, 3939.11]
  - - [1024, 512, 1, 128]
    - [209, 2431.48]
  - - [11264, 7681, 1, 128]
    - [207, 4253.36]
  - - [19456, 11777, 1, 128]
    - [207, 4286.65]
  - - [14080, 4096, 1, 128]
    - [207, 4293.24]
  - - [7040, 3329, 1, 128]
    - [196, 4152.36]
  - - [27392, 4096, 1, 128]
    - [207, 4317.32]
  - - [14720, 7041, 1, 128]
    - [196, 4274.18]
  - - [19584, 1024, 1, 128]
    - [207, 4207.23]
  - - [21376, 13569, 1, 128]
    - [207, 4309.94]
  - - [20480, 12801, 1, 128]
    - [207, 4292.57]
  - - [21248, 128, 1, 128]
    - [195, 3581.55]
  - - [9728, 1024, 1, 128]
    - [207, 4095.15]
  - - [18688, 10881, 1, 128]
    - [207, 4301.14]
  - - [21120, 13313, 1, 128]
    - [207, 4305.52]
  - - [20096, 2048, 1, 128]
    - [207, 4278.23]
  - - [16640, 4096, 1, 128]
    - [207, 4301.77]
  - - [28160, 12161, 1, 128]
    - [207, 4303.77]
  - - [640, 129, 1, 128]
    - [188, 672.244]
  - - [28672, 512, 1, 128]
    - [207, 4165.29]
  - - [12416, 4096, 1, 128]
    - [207, 4286.55]
  - - [25344, 9473, 1, 128]
    - [207, 4298.63]
  - - [18304, 1024, 1, 128]
    - [207, 4198.12]
  - - [25600, 4096, 1, 128]
    - [207, 4315.52]
  - - [22272, 512, 1, 128]
    - [207, 4115.77]
  - - [21504, 13825, 1, 128]
    - [207, 4294.8]
  - - [4736, 128, 1, 128]
    - [137, 2701.76]
  - - [26496, 10625, 1, 128]
    - [207, 4304.59]
  - - [7040, 512, 1, 128]
    - [207, 3748.57]
  - - [14336, 4096, 1, 128]
    - [207, 4295.16]
  - - [9216, 512, 1, 128]
    - [207, 3834.31]
  - - [1280, 641, 1, 128]
    - [137, 2749.25]
  - - [16768, 8961, 1, 128]
    - [196, 4291.06]
  - - [18944, 11137, 1, 128]
    - [207, 4296.77]
  - - [21504, 2048, 1, 128]
    - [207, 4277.56]
  - - [21888, 1024, 1, 128]
    - [207, 4222.95]
  - - [11264, 512, 1, 128]
    - [207, 3918.25]
  - - [27776, 8192, 1, 128]
    - [207, 4328.5]
  - - [10368, 6785, 1, 128]
    - [196, 4262.64]
  - - [18432, 10753, 1, 128]
    - [207, 4284.06]
  - - [19968, 2048, 1, 128]
    - [207, 4277.38]
  - - [16640, 512, 1, 128]
    - [207, 4049.16]
  - - [24576, 8577, 1, 128]
    - [207, 4288.81]
  - - [28672, 2048, 1, 128]
    - [207, 4294.77]
  - - [11136, 128, 1, 128]
    - [207, 3269.75]
  - - [12288, 4609, 1, 128]
    - [207, 4215.31]
  - - [14848, 1024, 1, 128]
    - [207, 4171.29]
  - - [14848, 128, 1, 128]
    - [196, 3388.16]
  - - [7424, 1024, 1, 128]
    - [207, 4033.65]
  - - [2560, 1024, 1, 128]
    - [194, 3568.1]
  - - [6400, 128, 1, 128]
    - [152, 2791.74]
  - - [15488, 7809, 1, 128]
    - [207, 4282.6]
  - - [17920, 2048, 1, 128]
    - [207, 4267.93]
  - - [5760, 512, 1, 128]
    - [205, 3692.17]
  - - [16640, 1024, 1, 128]
    - [207, 4189.47]
  - - [28160, 2048, 1, 128]
    - [207, 4292.05]
  - - [5504, 3969, 1, 128]
    - [207, 4158.3]
  - - [11776, 1024, 1, 128]
    - [207, 4132.76]
  - - [18816, 128, 1, 128]
    - [194, 3586.33]
  - - [27904, 12033, 1, 128]
    - [196, 4307.78]
  - - [11520, 7937, 1, 128]
    - [207, 4275.5]
  - - [18944, 11265, 1, 128]
    - [207, 4285.82]
  - - [5376, 1024, 1, 128]
    - [207, 3911.21]
  - - [12032, 4225, 1, 128]
    - [207, 4222.19]
  - - [5376, 128, 1, 128]
    - [182, 2815.87]
  - - [9856, 1024, 1, 128]
    - [207, 4093.3]
  - - [26752, 10881, 1, 128]
    - [207, 4305.84]
  - - [20352, 128, 1, 128]
    - [205, 3574.69]
  - - [14464, 128, 1, 128]
    - [195, 3373.84]
  - - [1024, 385, 1, 128]
    - [180, 2327.62]
  - - [3840, 128, 1, 128]
    - [193, 2656.86]
  - - [24192, 128, 1, 128]
    - [206, 3663.23]
  - - [28544, 12673, 1, 128]
    - [207, 4311.71]
  - - [1664, 128, 1, 128]
    - [182, 1642.35]
  - - [26752, 8192, 1, 128]
    - [207, 4328.27]
  - - [16896, 1024, 1, 128]
    - [207, 4189.54]
  - - [9728, 128, 1, 128]
    - [195, 3016.33]
  - - [11264, 2048, 1, 128]
    - [207, 4229.39]
  - - [11392, 2048, 1, 128]
    - [207, 4227.07]
  - - [20224, 2048, 1, 128]
    - [207, 4274.52]
  - - [26880, 1024, 1, 128]
    - [207, 4241.98]
  - - [15104, 512, 1, 128]
    - [207, 4025.11]
  - - [26368, 2048, 1, 128]
    - [207, 4280.64]
  - - [6784, 3073, 1, 128]
    - [207, 4133.28]
  - - [23168, 128, 1, 128]
    - [206, 3651.25]
  - - [8448, 1024, 1, 128]
    - [205, 4042.4]
  - - [16896, 9089, 1, 128]
    - [207, 4285.15]
  - - [17536, 128, 1, 128]
    - [195, 3473.28]
  - - [22912, 512, 1, 128]
    - [207, 4132.89]
  - - [28032, 128, 1, 128]
    - [207, 3738.82]
  - - [19584, 512, 1, 128]
    - [207, 4093.7]
  - - [27136, 11265, 1, 128]
    - [207, 4291.42]
  - - [4992, 512, 1, 128]
    - [205, 3528.43]
  - - [8448, 128, 1, 128]
    - [160, 3103.41]
  - - [27648, 128, 1, 128]
    - [207, 3684.0]
  - - [16640, 2048, 1, 128]
    - [207, 4260.84]
  - - [26752, 10753, 1, 128]
    - [207, 4301.36]
  - - [2944, 1281, 1, 128]
    - [195, 3585.28]
  - - [5376, 3841, 1, 128]
    - [196, 4146.69]
  - - [10496, 6913, 1, 128]
    - [196, 4261.74]
  - - [17024, 512, 1, 128]
    - [207, 4055.27]
  - - [11008, 7297, 1, 128]
    - [207, 4267.66]
  - - [14080, 128, 1, 128]
    - [206, 3329.76]
  - - [5888, 512, 1, 128]
    - [206, 3619.85]
  - - [19200, 128, 1, 128]
    - [194, 3607.49]
  - - [14208, 6529, 1, 128]
    - [207, 4270.6]
  - - [22912, 4096, 1, 128]
    - [207, 4311.05]
  - - [14336, 2048, 1, 128]
    - [207, 4251.24]
  - - [17792, 128, 1, 128]
    - [195, 3483.56]
  - - [22656, 14849, 1, 128]
    - [207, 4309.99]
  - - [19712, 512, 1, 128]
    - [207, 4089.67]
  - - [5248, 1024, 1, 128]
    - [207, 3933.36]
  - - [3712, 2049, 1, 128]
    - [207, 3913.63]
  - - [24448, 8449, 1, 128]
    - [196, 4294.69]
  - - [8192, 512, 1, 128]
    - [207, 3790.39]
  - - [25472, 4096, 1, 128]
    - [207, 4315.36]
  - - [25088, 512, 1, 128]
    - [207, 4141.48]
  - - [23168, 1024, 1, 128]
    - [207, 4225.58]
  - - [24320, 8192, 1, 128]
    - [207, 4324.41]
  - - [24192, 8192, 1, 128]
    - [207, 4326.83]
  - - [2176, 512, 1, 128]
    - [193, 3013.66]
  - - [4992, 3457, 1, 128]
    - [207, 4119.93]
  - - [896, 257, 1, 128]
    - [136, 1538.35]
  - - [28288, 1024, 1, 128]
    - [207, 4247.74]
  - - [20864, 1024, 1, 128]
    - [207, 4225.15]
  - - [18432, 2048, 1, 128]
    - [207, 4268.26]
  - - [17280, 9601, 1, 128]
    - [207, 4295.84]
  - - [18944, 4096, 1, 128]
    - [207, 4304.24]
  - - [13440, 128, 1, 128]
    - [205, 3453.58]
  - - [7424, 2048, 1, 128]
    - [207, 4164.15]
  - - [768, 128, 1, 128]
    - [179, 804.534]
  - - [16128, 512, 1, 128]
    - [207, 4034.22]
  - - [28288, 12289, 1, 128]
    - [207, 4306.71]
  - - [23552, 128, 1, 128]
    - [195, 3606.31]
  - - [24832, 8192, 1, 128]
    - [207, 4326.47]
  - - [10240, 1024, 1, 128]
    - [207, 4105.02]
  - - [8960, 2048, 1, 128]
    - [207, 4194.6]
  - - [17664, 9985, 1, 128]
    - [207, 4296.95]
  - - [25088, 4096, 1, 128]
    - [207, 4314.66]
  - - [7552, 2048, 1, 128]
    - [207, 4175.55]
  - - [15104, 7297, 1, 128]
    - [207, 4277.92]
  - - [7168, 1024, 1, 128]
    - [207, 4013.68]
  - - [26112, 8192, 1, 128]
    - [207, 4327.82]
  - - [24192, 1024, 1, 128]
    - [207, 4231.92]
  - - [22912, 2048, 1, 128]
    - [207, 4282.59]
  - - [10368, 512, 1, 128]
    - [207, 3906.83]
  - - [22528, 4096, 1, 128]
    - [207, 4311.21]
  - - [6528, 128, 1, 128]
    - [152, 2835.49]
  - - [26752, 4096, 1, 128]
    - [207, 4314.08]
  - - [2816, 512, 1, 128]
    - [205, 3276.8]
  - - [22016, 14209, 1, 128]
    - [207, 4306.29]
  - - [8832, 1024, 1, 128]
    - [207, 4076.73]
  - - [16384, 128, 1, 128]
    - [195, 3391.05]
  - - [5120, 1024, 1, 128]
    - [205, 3872.86]
  - - [24832, 8833, 1, 128]
    - [207, 4296.41]
  - - [11520, 128, 1, 128]
    - [206, 3325.29]
  - - [24960, 512, 1, 128]
    - [207, 4149.19]
  - - [27520, 2048, 1, 128]
    - [207, 4294.48]
  - - [22272, 14593, 1, 128]
    - [207, 4312.23]
  - - [2048, 128, 1, 128]
    - [200, 1762.31]
  - - [2176, 1537, 1, 128]
    - [205, 3548.55]
  - - [10496, 1024, 1, 128]
    - [207, 4106.17]
  - - [12160, 4353, 1, 128]
    - [196, 4229.94]
  - - [6144, 1024, 1, 128]
    - [207, 3960.0]
  - - [26752, 1024, 1, 128]
    - [207, 4243.03]
  - - [17280, 4096, 1, 128]
    - [207, 4300.22]
  - - [16896, 512, 1, 128]
    - [207, 4047.14]
  - - [4480, 128, 1, 128]
    - [135, 2602.85]
  - - [18944, 128, 1, 128]
    - [194, 3565.93]
  - - [9600, 2048, 1, 128]
    - [207, 4209.74]
  - - [19456, 1024, 1, 128]
    - [207, 4210.09]
  - - [9984, 2048, 1, 128]
    - [207, 4213.48]
  - - [25216, 9217, 1, 128]
    - [207, 4295.4]
  - - [19968, 1024, 1, 128]
    - [207, 4211.31]
  - - [13952, 2048, 1, 128]
    - [207, 4244.93]
  - - [10496, 2048, 1, 128]
    - [207, 4219.26]
  - - [12672, 1024, 1, 128]
    - [207, 4147.38]
  - - [19072, 11393, 1, 128]
    - [207, 4303.76]
  - - [11008, 2048, 1, 128]
    - [207, 4220.8]
  - - [27520, 11649, 1, 128]
    - [207, 4308.26]
  - - [10880, 512, 1, 128]
    - [205, 3910.88]
  - - [14592, 6785, 1, 128]
    - [207, 4272.77]
  - - [7424, 512, 1, 128]
    - [207, 3754.15]
  - - [13056, 5249, 1, 128]
    - [207, 4248.99]
  - - [23296, 15489, 1, 128]
    - [207, 4313.31]
  - - [28416, 8192, 1, 128]
    - [207, 4329.3]
  - - [11392, 7681, 1, 128]
    - [207, 4269.56]
  - - [18048, 1024, 1, 128]
    - [207, 4199.07]
  - - [15616, 7809, 1, 128]
    - [207, 4281.79]
  - - [128, 128, 1, 128]
    - [179, 132.396]
  - - [24704, 512, 1, 128]
    - [207, 4145.33]
  - - [7680, 4097, 1, 128]
    - [207, 4174.11]
  - - [16640, 8961, 1, 128]
    - [207, 4290.47]
  - - [18944, 1024, 1, 128]
    - [207, 4195.73]
  - - [12928, 2048, 1, 128]
    - [207, 4237.3]
  - - [22272, 2048, 1, 128]
    - [207, 4282.79]
  - - [27904, 11905, 1, 128]
    - [207, 4307.24]
  - - [26240, 2048, 1, 128]
    - [207, 4280.33]
  - - [9728, 6017, 1, 128]
    - [207, 4242.6]
  - - [20736, 1024, 1, 128]
    - [207, 4220.35]
  - - [3456, 1921, 1, 128]
    - [196, 3888.13]
  - - [8064, 512, 1, 128]
    - [205, 3820.72]
  - - [4224, 1024, 1, 128]
    - [205, 3826.71]
  - - [25984, 10113, 1, 128]
    - [207, 4303.66]
  - - [13696, 6017, 1, 128]
    - [207, 4263.4]
  - - [27520, 8192, 1, 128]
    - [207, 4328.46]
  - - [18944, 512, 1, 128]
    - [207, 4074.28]
  - - [6272, 128, 1, 128]
    - [167, 2753.5]
  - - [27264, 4096, 1, 128]
    - [207, 4316.5]
  - - [1792, 1153, 1, 128]
    - [206, 3334.22]
  - - [17536, 9729, 1, 128]
    - [207, 4293.34]
  - - [13184, 5505, 1, 128]
    - [207, 4254.9]
  - - [2944, 128, 1, 128]
    - [195, 2249.74]
  - - [25344, 512, 1, 128]
    - [207, 4146.56]
  - - [23040, 15361, 1, 128]
    - [207, 4298.67]
  - - [8704, 512, 1, 128]
    - [205, 3801.82]
  - - [20864, 13057, 1, 128]
    - [207, 4309.03]
  - - [19328, 4096, 1, 128]
    - [207, 4304.7]
  - - [28288, 8192, 1, 128]
    - [207, 4328.72]
  - - [10112, 1024, 1, 128]
    - [207, 4092.25]
  - - [17536, 2048, 1, 128]
    - [207, 4265.77]
  - - [7552, 128, 1, 128]
    - [205, 3071.8]
  - - [15616, 7937, 1, 128]
    - [207, 4282.94]
  - - [23040, 512, 1, 128]
    - [207, 4137.3]
  - - [25984, 2048, 1, 128]
    - [207, 4288.96]
  - - [14720, 128, 1, 128]
    - [195, 3389.16]
  - - [23424, 1024, 1, 128]
    - [207, 4231.53]
  - - [1920, 1281, 1, 128]
    - [195, 3398.3]
  - - [27136, 2048, 1, 128]
    - [207, 4292.4]
  - - [28800, 8192, 1, 128]
    - [207, 4329.43]
  - - [15488, 128, 1, 128]
    - [195, 3403.37]
  - - [28800, 12929, 1, 128]
    - [196, 4311.85]
  - - [21888, 14081, 1, 128]
    - [207, 4311.95]
  - - [25600, 1024, 1, 128]
    - [207, 4236.24]
  - - [21632, 1024, 1, 128]
    - [207, 4222.79]
  - - [24448, 1024, 1, 128]
    - [207, 4235.1]
  - - [4352, 2689, 1, 128]
    - [207, 4044.07]
  - - [20480, 512, 1, 128]
    - [205, 4094.5]
  - - [7296, 128, 1, 128]
    - [205, 3006.48]
  - - [4992, 1024, 1, 128]
    - [207, 3905.87]
  - - [27264, 11393, 1, 128]
    - [207, 4307.57]
  - - [26752, 128, 1, 128]
    - [194, 3771.99]
  - - [24960, 1024, 1, 128]
    - [207, 4237.33]
  - - [21504, 512, 1, 128]
    - [207, 4110.14]
  - - [6272, 2561, 1, 128]
    - [207, 4082.63]
  - - [25088, 9089, 1, 128]
    - [207, 4292.08]
  - - [20864, 512, 1, 128]
    - [207, 4096.78]
  - - [4224, 2561, 1, 128]
    - [207, 4005.15]
  - - [15744, 8065, 1, 128]
    - [207, 4286.14]
  - - [21632, 128, 1, 128]
    - [206, 3595.96]
  - - [15104, 4096, 1, 128]
    - [207, 4297.0]
  - - [20352, 512, 1, 128]
    - [207, 4095.9]
  - - [25472, 9601, 1, 128]
    - [207, 4301.22]
  - - [27904, 512, 1, 128]
    - [207, 4163.37]
  - - [19968, 512, 1, 128]
    - [207, 4092.0]
  - - [5760, 1024, 1, 128]
    - [207, 3957.72]
  - - [28416, 12545, 1, 128]
    - [207, 4309.84]
  - - [16512, 8833, 1, 128]
    - [196, 4290.47]
  - - [6016, 128, 1, 128]
    - [154, 2681.34]
