library/src/blas3/Tensile/Logic/asm_full/vega10_Cijk_Alik_Bjlk_HBH.yaml
- {MinimumRequiredVersion: 4.6.0}
- vega10
- gfx900
- [Device 6863, Device 6862, Device 687f, Device 6860, Device 6861, 'Vega 10 XTX [Radeon
    SolutionIndex: 0
    SolutionNameMin: Cijk_Alik_Bjlk_HBH_MT032x064x08_PGR1_PLR1_TT04_08
    SolutionIndex: 1
    SolutionNameMin: Cijk_Alik_Bjlk_HBH_MT032x064x08_PGR1_PLR1_TT02_04
    SolutionIndex: 2
    SolutionNameMin: Cijk_Alik_Bjlk_HBH_MT064x128x08_PGR1_PLR1_TT04_08
    SolutionIndex: 3
    SolutionNameMin: Cijk_Alik_Bjlk_HBH_MT032x064x08_PGR1_PLR1_TT04_08
    SolutionIndex: 4
    SolutionNameMin: Cijk_Alik_Bjlk_HBH_MT064x064x08_PGR1_PLR1_TT08_08
    SolutionIndex: 5
    SolutionNameMin: Cijk_Alik_Bjlk_HBH_MT032x064x08_PGR1_PLR1_TT02_04
    SolutionIndex: 6
    SolutionNameMin: Cijk_Alik_Bjlk_HBH_MT064x128x08_PGR1_PLR1_TT04_08
    SolutionIndex: 7
    SolutionNameMin: Cijk_Alik_Bjlk_HBH_MT016x016x16_PGR1_PLR1_TT02_02
    SolutionIndex: 8
    SolutionNameMin: Cijk_Alik_Bjlk_HBH_MT016x032x16_PGR1_PLR1_TT02_04
    SolutionIndex: 9
    SolutionNameMin: Cijk_Alik_Bjlk_HBH_MT032x032x16_PGR1_PLR1_TT04_04
    SolutionIndex: 10
    SolutionNameMin: Cijk_Alik_Bjlk_HBH_MT064x064x16_PGR1_PLR1_TT08_08
    SolutionIndex: 11
    SolutionNameMin: Cijk_Alik_Bjlk_HBH_MT016x032x16_PGR1_PLR1_TT02_02
    SolutionIndex: 12
    SolutionNameMin: Cijk_Alik_Bjlk_HBH_MT016x064x16_PGR1_PLR1_TT02_04
    SolutionIndex: 13
    SolutionNameMin: Cijk_Alik_Bjlk_HBH_MT016x064x16_PGR1_PLR1_TT02_02
    SolutionIndex: 14
    SolutionNameMin: Cijk_Alik_Bjlk_HBH_MT016x128x16_PGR1_PLR1_TT02_04
    SolutionIndex: 15
    SolutionNameMin: Cijk_Alik_Bjlk_HBH_MT064x064x16_PGR1_PLR1_TT04_04
    SolutionIndex: 16
    SolutionNameMin: Cijk_Alik_Bjlk_HBH_MT064x128x16_PGR1_PLR1_TT04_08
    SolutionIndex: 17
    SolutionNameMin: Cijk_Alik_Bjlk_HBH_MT128x128x16_PGR1_PLR1_TT08_08
    SolutionIndex: 18
    SolutionNameMin: Cijk_Alik_Bjlk_HBH_MT032x032x16_PGR1_PLR1_TT04_04
    SolutionIndex: 19
    SolutionNameMin: Cijk_Alik_Bjlk_HBH_MT032x064x16_PGR1_PLR1_TT04_08
    SolutionIndex: 20
    SolutionNameMin: Cijk_Alik_Bjlk_HBH_MT064x064x16_PGR1_PLR1_TT08_08
    SolutionIndex: 21
    SolutionNameMin: Cijk_Alik_Bjlk_HBH_MT016x032x16_PGR1_PLR1_TT02_02
    SolutionIndex: 22
    SolutionNameMin: Cijk_Alik_Bjlk_HBH_MT016x064x16_PGR1_PLR1_TT02_04
    SolutionIndex: 23
    SolutionNameMin: Cijk_Alik_Bjlk_HBH_MT032x064x16_PGR1_PLR1_TT04_04
    SolutionIndex: 24
    SolutionNameMin: Cijk_Alik_Bjlk_HBH_MT016x064x16_PGR1_PLR1_TT02_02
    SolutionIndex: 25
    SolutionNameMin: Cijk_Alik_Bjlk_HBH_MT016x128x16_PGR1_PLR1_TT02_04
    SolutionIndex: 26
    SolutionNameMin: Cijk_Alik_Bjlk_HBH_MT064x064x16_PGR1_PLR1_TT04_04
    SolutionIndex: 27
    SolutionNameMin: Cijk_Alik_Bjlk_HBH_MT064x128x16_PGR1_PLR1_TT04_08
    SolutionIndex: 28
    SolutionNameMin: Cijk_Alik_Bjlk_HBH_MT128x128x16_PGR1_PLR1_TT08_08
    SolutionIndex: 29
    SolutionNameMin: Cijk_Alik_Bjlk_HBH_MT064x016x16_PGR1_PLR1_TT02_02
    SolutionIndex: 30
    SolutionNameMin: Cijk_Alik_Bjlk_HBH_MT016x016x24_PGR1_PLR1_TT02_02
    SolutionIndex: 31
    SolutionNameMin: Cijk_Alik_Bjlk_HBH_MT032x032x24_PGR1_PLR1_TT04_04
    SolutionIndex: 32
    SolutionNameMin: Cijk_Alik_Bjlk_HBH_MT016x016x24_PGR1_PLR1_TT02_02
    SolutionIndex: 33
    SolutionNameMin: Cijk_Alik_Bjlk_HBH_MT016x032x24_PGR1_PLR1_TT02_04
    SolutionIndex: 34
    SolutionNameMin: Cijk_Alik_Bjlk_HBH_MT032x032x24_PGR1_PLR1_TT04_04
    SolutionIndex: 35
    SolutionNameMin: Cijk_Alik_Bjlk_HBH_MT064x064x24_PGR1_PLR1_TT08_08
    SolutionIndex: 36
    SolutionNameMin: Cijk_Alik_Bjlk_HBH_MT008x064x32_PGR1_PLR1_TT02_02
    SolutionIndex: 37
    SolutionNameMin: Cijk_Alik_Bjlk_HBH_MT016x016x32_PGR1_PLR1_TT02_02
    SolutionIndex: 38
    SolutionNameMin: Cijk_Alik_Bjlk_HBH_MT016x032x32_PGR1_PLR1_TT02_02
    SolutionIndex: 39
    SolutionNameMin: Cijk_Alik_Bjlk_HBH_MT016x064x32_PGR1_PLR1_TT02_02
    SolutionIndex: 40
    SolutionNameMin: Cijk_Alik_Bjlk_HBH_MT008x064x32_PGR1_PLR1_TT02_02
    SolutionIndex: 41
    SolutionNameMin: Cijk_Alik_Bjlk_HBH_MT016x064x32_PGR1_PLR1_TT02_02
    SolutionIndex: 42
    SolutionNameMin: Cijk_Alik_Bjlk_HBH_MT008x064x64_PGR1_PLR1_TT02_02
    SolutionIndex: 43
    SolutionNameMin: Cijk_Alik_Bjlk_HBH_MT008x064x64_PGR1_PLR1_TT02_02
    SolutionIndex: 44
    SolutionNameMin: Cijk_Alik_Bjlk_HBH_MT048x064x08_PGR1_PLR1_TT06_08
    SolutionIndex: 45
    SolutionNameMin: Cijk_Alik_Bjlk_HBH_MT048x064x08_PGR1_PLR1_TT06_08
    SolutionIndex: 46
    SolutionNameMin: Cijk_Alik_Bjlk_HBH_MT032x032x16_PGR0_PLR1_TT04_04
    SolutionIndex: 47
    SolutionNameMin: Cijk_Alik_Bjlk_HBH_MT032x064x16_PGR0_PLR1_TT04_08
    SolutionIndex: 48
    SolutionNameMin: Cijk_Alik_Bjlk_HBH_MT064x064x16_PGR0_PLR1_TT04_04
    SolutionIndex: 49
    SolutionNameMin: Cijk_Alik_Bjlk_HBH_MT128x064x16_PGR1_PLR1_TT08_04
    SolutionIndex: 50
    SolutionNameMin: Cijk_Alik_Bjlk_HBH_MT032x032x16_PGR0_PLR1_TT04_04
    SolutionIndex: 51
    SolutionNameMin: Cijk_Alik_Bjlk_HBH_MT064x064x16_PGR0_PLR1_TT04_04
    SolutionIndex: 52
    SolutionNameMin: Cijk_Alik_Bjlk_HBH_MT128x064x16_PGR1_PLR1_TT08_04
    SolutionIndex: 53
    SolutionNameMin: Cijk_Alik_Bjlk_HBH_MT032x032x24_PGR0_PLR1_TT04_04
    SolutionIndex: 54
    SolutionNameMin: Cijk_Alik_Bjlk_HBH_MT064x128x04_PGR0_PLR0_TT04_08
    SolutionIndex: 55
    SolutionNameMin: Cijk_Alik_Bjlk_HBH_MT064x064x04_PGR0_PLR0_TT04_04
    SolutionIndex: 56
    SolutionNameMin: Cijk_Alik_Bjlk_HBH_MT064x064x04_PGR1_PLR0_TT04_04
    SolutionIndex: 57
    SolutionNameMin: Cijk_Alik_Bjlk_HBH_MT064x064x04_PGR0_PLR1_TT04_04
    SolutionIndex: 58
    SolutionNameMin: Cijk_Alik_Bjlk_HBH_MT064x128x04_PGR1_PLR1_TT04_08
    SolutionIndex: 59
    SolutionNameMin: Cijk_Alik_Bjlk_HBH_MT064x064x04_PGR1_PLR1_TT04_04
    SolutionIndex: 60
    SolutionNameMin: Cijk_Alik_Bjlk_HBH_MT064x064x08_PGR0_PLR0_TT04_04
    SolutionIndex: 61
    SolutionNameMin: Cijk_Alik_Bjlk_HBH_MT064x064x08_PGR1_PLR0_TT04_04
    SolutionIndex: 62
    SolutionNameMin: Cijk_Alik_Bjlk_HBH_MT064x064x08_PGR0_PLR1_TT04_04
    SolutionIndex: 63
    SolutionNameMin: Cijk_Alik_Bjlk_HBH_MT064x064x08_PGR1_PLR1_TT04_04
    SolutionIndex: 64
    SolutionNameMin: Cijk_Alik_Bjlk_HBH_MT064x064x16_PGR0_PLR0_TT04_04
    SolutionIndex: 65
    SolutionNameMin: Cijk_Alik_Bjlk_HBH_MT064x064x16_PGR1_PLR0_TT04_04
    SolutionIndex: 66
    SolutionNameMin: Cijk_Alik_Bjlk_HBH_MT064x128x16_PGR1_PLR1_TT04_08
    SolutionIndex: 67
    SolutionNameMin: Cijk_Alik_Bjlk_HBH_MT064x064x16_PGR1_PLR1_TT04_04
    SolutionIndex: 68
    SolutionNameMin: Cijk_Alik_Bjlk_HBH_MT128x128x04_PGR0_PLR0_TT08_08
    SolutionIndex: 69
    SolutionNameMin: Cijk_Alik_Bjlk_HBH_MT064x128x04_PGR0_PLR0_TT04_08
    SolutionIndex: 70
    SolutionNameMin: Cijk_Alik_Bjlk_HBH_MT064x064x04_PGR0_PLR0_TT04_04
    SolutionIndex: 71
    SolutionNameMin: Cijk_Alik_Bjlk_HBH_MT128x128x04_PGR1_PLR0_TT08_08
    SolutionIndex: 72
    SolutionNameMin: Cijk_Alik_Bjlk_HBH_MT064x128x04_PGR1_PLR0_TT04_08
    SolutionIndex: 73
    SolutionNameMin: Cijk_Alik_Bjlk_HBH_MT064x064x04_PGR1_PLR0_TT04_04
    SolutionIndex: 74
    SolutionNameMin: Cijk_Alik_Bjlk_HBH_MT064x128x04_PGR0_PLR1_TT04_08
    SolutionIndex: 75
    SolutionNameMin: Cijk_Alik_Bjlk_HBH_MT064x064x04_PGR0_PLR1_TT04_04
    SolutionIndex: 76
    SolutionNameMin: Cijk_Alik_Bjlk_HBH_MT064x128x04_PGR1_PLR1_TT04_08
    SolutionIndex: 77
    SolutionNameMin: Cijk_Alik_Bjlk_HBH_MT064x064x04_PGR1_PLR1_TT04_04
    SolutionIndex: 78
    SolutionNameMin: Cijk_Alik_Bjlk_HBH_MT064x064x08_PGR0_PLR0_TT04_04
    SolutionIndex: 79
    SolutionNameMin: Cijk_Alik_Bjlk_HBH_MT064x064x08_PGR1_PLR0_TT04_04
    SolutionIndex: 80
    SolutionNameMin: Cijk_Alik_Bjlk_HBH_MT064x064x08_PGR0_PLR1_TT04_04
    SolutionIndex: 81
    SolutionNameMin: Cijk_Alik_Bjlk_HBH_MT064x064x08_PGR1_PLR1_TT04_04
    SolutionIndex: 82
    SolutionNameMin: Cijk_Alik_Bjlk_HBH_MT064x064x16_PGR1_PLR1_TT04_04
- - - [2368, 1024, 1, 1]
    - [69, 144.844]
  - - [128, 256, 1, 1280]
    - [36, 1705.45]
  - - [32, 5056, 1, 1280]
    - [63, 1778.42]
  - - [448, 1, 1, 256]
    - [77, 3.86096]
  - - [5056, 1408, 1, 3328]
    - [27, 10342.6]
  - - [2368, 64, 1, 1]
    - [70, 14.9334]
  - - [5056, 1856, 1, 3328]
    - [15, 10237.7]
  - - [704, 64, 1, 1]
    - [80, 4.22387]
  - - [448, 3584, 1, 3328]
    - [26, 9164.72]
  - - [2368, 32, 1, 256]
    - [63, 700.199]
  - - [5888, 256, 1, 256]
    - [15, 9219.68]
  - - [448, 3584, 1, 32]
    - [61, 2477.17]
  - - [1856, 256, 1, 1]
    - [73, 61.0872]
  - - [6784, 6784, 1, 1280]
    - [27, 10017.1]
  - - [448, 1, 1, 1]
    - [71, 0.066459]
  - - [1408, 3584, 1, 3328]
    - [4, 10315.9]
  - - [448, 448, 1, 3328]
    - [14, 6210.01]
  - - [1024, 2368, 1, 3328]
    - [26, 10045.1]
  - - [1, 4288, 1, 1280]
    - [77, 41.626]
  - - [6784, 64, 1, 32]
    - [61, 1311.59]
  - - [256, 128, 1, 256]
    - [36, 1258.23]
  - - [448, 3584, 1, 1]
    - [70, 114.684]
  - - [448, 64, 1, 1]
    - [71, 3.33686]
  - - [32, 1408, 1, 32]
    - [60, 106.942]
  - - [64, 1024, 1, 1280]
    - [39, 3254.11]
  - - [1, 1408, 1, 3328]
    - [82, 18.3779]
  - - [32, 3584, 1, 1280]
    - [63, 1648.71]
  - - [1024, 1, 1, 3328]
    - [82, 13.2579]
  - - [32, 1024, 1, 3328]
    - [63, 520.933]
  - - [1408, 5056, 1, 1]
    - [74, 189.55]
  - - [1024, 64, 1, 1280]
    - [39, 3235.47]
  - - [64, 5056, 1, 3328]
    - [24, 7524.63]
  - - [5888, 4288, 1, 3328]
    - [6, 9567.82]
  - - [1, 2368, 1, 1280]
    - [82, 28.5938]
  - - [704, 1024, 1, 1]
    - [75, 79.7716]
  - - [2368, 1408, 1, 32]
    - [62, 3265.97]
  - - [256, 1856, 1, 1280]
    - [15, 8057.05]
  - - [1024, 2944, 1, 1]
    - [72, 158.971]
  - - [2944, 3584, 1, 3328]
    - [27, 9813.34]
  - - [2368, 2944, 1, 1280]
    - [45, 10893.6]
  - - [256, 1408, 1, 1]
    - [75, 47.7035]
  - - [1, 1024, 1, 3328]
    - [82, 13.3231]
  - - [3584, 1408, 1, 32]
    - [54, 3471.21]
  - - [6784, 1856, 1, 32]
    - [62, 4008.25]
  - - [5056, 256, 1, 256]
    - [15, 9110.03]
  - - [1856, 2368, 1, 256]
    - [15, 10734.1]
  - - [2368, 1024, 1, 3328]
    - [16, 9919.81]
  - - [3584, 4288, 1, 32]
    - [54, 4067.93]
  - - [1024, 1024, 1, 1280]
    - [26, 10144.9]
  - - [32, 128, 1, 3328]
    - [63, 65.5806]
  - - [32, 2944, 1, 3328]
    - [63, 1499.8]
  - - [704, 1408, 1, 3328]
    - [35, 9618.28]
  - - [1408, 704, 1, 256]
    - [26, 8500.31]
  - - [704, 64, 1, 32]
    - [57, 102.44]
  - - [5888, 1, 1, 3328]
    - [77, 54.7223]
  - - [5056, 4288, 1, 32]
    - [54, 4216.81]
  - - [6784, 128, 1, 3328]
    - [14, 9380.15]
  - - [2944, 1856, 1, 1]
    - [74, 175.209]
  - - [32, 448, 1, 3328]
    - [63, 227.265]
  - - [5056, 1, 1, 3328]
    - [81, 50.4439]
  - - [2368, 3584, 1, 1280]
    - [45, 10779.8]
  - - [4288, 5056, 1, 1]
    - [74, 220.387]
  - - [128, 4288, 1, 3328]
    - [14, 7944.14]
  - - [1408, 4288, 1, 1280]
    - [2, 11047.8]
  - - [1856, 704, 1, 1280]
    - [26, 10472.1]
  - - [448, 5888, 1, 256]
    - [26, 9476.13]
  - - [1, 5888, 1, 3328]
    - [77, 56.851]
  - - [1024, 128, 1, 32]
    - [57, 296.438]
  - - [32, 4288, 1, 1280]
    - [63, 1516.0]
  - - [1024, 5056, 1, 1]
    - [69, 175.168]
  - - [704, 3584, 1, 1280]
    - [26, 10810.4]
  - - [1856, 5056, 1, 256]
    - [15, 11233.0]
  - - [1408, 1024, 1, 1280]
    - [15, 9874.5]
  - - [5056, 5888, 1, 3328]
    - [28, 9627.7]
  - - [3584, 3584, 1, 1280]
    - [26, 10779.8]
  - - [2368, 3584, 1, 32]
    - [60, 3787.43]
  - - [5056, 5056, 1, 1]
    - [69, 222.066]
  - - [2368, 256, 1, 32]
    - [61, 1577.51]
  - - [1024, 6784, 1, 1280]
    - [26, 10802.5]
  - - [1024, 3584, 1, 1]
    - [72, 171.432]
  - - [256, 5056, 1, 1]
    - [75, 107.196]
  - - [32, 5056, 1, 32]
    - [63, 550.342]
  - - [5888, 32, 1, 32]
    - [61, 630.945]
  - - [64, 128, 1, 3328]
    - [30, 426.961]
  - - [256, 5056, 1, 32]
    - [61, 2441.64]
  - - [5056, 64, 1, 32]
    - [61, 991.354]
  - - [128, 6784, 1, 32]
    - [63, 1923.66]
  - - [64, 128, 1, 1]
    - [81, 0.762685]
  - - [64, 2368, 1, 1280]
    - [13, 5104.78]
  - - [128, 704, 1, 32]
    - [56, 201.692]
  - - [64, 6784, 1, 3328]
    - [24, 7755.89]
  - - [2944, 256, 1, 1280]
    - [9, 9151.74]
  - - [2944, 4288, 1, 256]
    - [15, 11215.1]
  - - [1024, 1024, 1, 3328]
    - [15, 10424.6]
  - - [5056, 704, 1, 32]
    - [60, 3313.84]
  - - [1856, 4288, 1, 3328]
    - [26, 10090.3]
  - - [1, 1856, 1, 256]
    - [77, 16.321]
  - - [6784, 4288, 1, 32]
    - [60, 4278.65]
  - - [4288, 1024, 1, 3328]
    - [26, 10748.0]
  - - [256, 128, 1, 1]
    - [69, 4.096]
  - - [3584, 448, 1, 3328]
    - [15, 9749.35]
  - - [2944, 448, 1, 256]
    - [15, 8024.66]
  - - [3584, 2368, 1, 3328]
    - [26, 10264.3]
  - - [4288, 1856, 1, 1]
    - [72, 190.152]
  - - [1856, 2944, 1, 1]
    - [69, 173.968]
  - - [32, 4288, 1, 3328]
    - [63, 1536.55]
  - - [1, 3584, 1, 3328]
    - [82, 47.1499]
  - - [256, 32, 1, 3328]
    - [63, 126.257]
  - - [1856, 2368, 1, 32]
    - [60, 3390.35]
  - - [4288, 1856, 1, 32]
    - [62, 3782.15]
  - - [5056, 64, 1, 3328]
    - [13, 7551.96]
  - - [6784, 1, 1, 1280]
    - [81, 65.0161]
  - - [32, 2368, 1, 256]
    - [63, 715.501]
  - - [1408, 64, 1, 1]
    - [70, 8.81506]
  - - [1, 1, 1, 3328]
    - [77, 0.0137896]
  - - [5056, 2368, 1, 256]
    - [47, 11176.6]
  - - [1408, 5888, 1, 256]
    - [2, 11204.7]
  - - [5056, 6784, 1, 1]
    - [69, 227.647]
  - - [32, 448, 1, 1280]
    - [63, 211.183]
  - - [32, 448, 1, 32]
    - [66, 39.9558]
  - - [256, 5056, 1, 1280]
    - [26, 10349.5]
  - - [704, 2368, 1, 1]
    - [75, 119.709]
  - - [64, 1024, 1, 32]
    - [60, 145.187]
  - - [1024, 256, 1, 256]
    - [26, 5524.05]
  - - [128, 1, 1, 1]
    - [70, 0.0151578]
  - - [128, 3584, 1, 256]
    - [15, 6661.21]
  - - [3584, 4288, 1, 1280]
    - [15, 10713.0]
  - - [1856, 128, 1, 32]
    - [65, 814.504]
  - - [1856, 128, 1, 1280]
    - [14, 6910.83]
  - - [128, 2944, 1, 3328]
    - [14, 7896.37]
  - - [1, 6784, 1, 3328]
    - [82, 64.8748]
  - - [2368, 4288, 1, 1]
    - [69, 199.526]
  - - [4288, 448, 1, 3328]
    - [26, 10295.2]
  - - [4288, 32, 1, 3328]
    - [63, 1546.57]
  - - [32, 2944, 1, 256]
    - [63, 875.209]
  - - [256, 1856, 1, 1]
    - [77, 60.5115]
  - - [704, 6784, 1, 1280]
    - [15, 10906.0]
  - - [3584, 6784, 1, 1]
    - [74, 222.527]
  - - [704, 5056, 1, 1280]
    - [6, 11016.5]
  - - [256, 3584, 1, 3328]
    - [9, 9023.71]
  - - [1024, 32, 1, 3328]
    - [63, 505.373]
  - - [3584, 6784, 1, 32]
    - [54, 4192.93]
  - - [3584, 6784, 1, 1280]
    - [26, 10341.7]
  - - [4288, 4288, 1, 3328]
    - [2, 9567.77]
  - - [3584, 64, 1, 1280]
    - [33, 6476.26]
  - - [64, 1856, 1, 256]
    - [39, 3665.24]
  - - [3584, 64, 1, 32]
    - [64, 768.147]
  - - [448, 1, 1, 1280]
    - [81, 5.36467]
  - - [256, 4288, 1, 1280]
    - [15, 8797.82]
  - - [1408, 3584, 1, 1]
    - [74, 174.226]
  - - [4288, 1856, 1, 3328]
    - [26, 10229.4]
  - - [1856, 2944, 1, 1280]
    - [26, 11060.9]
  - - [4288, 256, 1, 256]
    - [15, 7969.78]
  - - [128, 5888, 1, 32]
    - [63, 1871.08]
  - - [128, 5888, 1, 1280]
    - [15, 9342.16]
  - - [1408, 128, 1, 3328]
    - [24, 6426.05]
  - - [3584, 256, 1, 256]
    - [15, 7986.84]
  - - [32, 6784, 1, 3328]
    - [63, 2499.49]
  - - [64, 64, 1, 1280]
    - [30, 189.75]
  - - [32, 3584, 1, 256]
    - [63, 1048.54]
  - - [704, 256, 1, 32]
    - [60, 403.397]
  - - [448, 128, 1, 3328]
    - [39, 3034.49]
  - - [64, 2944, 1, 3328]
    - [24, 6718.15]
  - - [64, 4288, 1, 3328]
    - [24, 6438.29]
  - - [5056, 1024, 1, 3328]
    - [2, 10702.6]
  - - [2368, 64, 1, 3328]
    - [11, 5451.33]
  - - [1856, 256, 1, 256]
    - [15, 6957.52]
  - - [3584, 704, 1, 1]
    - [75, 142.514]
  - - [256, 704, 1, 256]
    - [9, 3892.63]
  - - [448, 5056, 1, 1]
    - [74, 136.509]
  - - [5888, 5888, 1, 256]
    - [6, 11049.6]
  - - [3584, 704, 1, 32]
    - [61, 3010.96]
  - - [448, 6784, 1, 3328]
    - [15, 10315.2]
  - - [6784, 4288, 1, 1]
    - [69, 224.143]
  - - [5056, 704, 1, 1]
    - [70, 157.031]
  - - [1408, 2368, 1, 32]
    - [62, 3266.02]
  - - [448, 5056, 1, 32]
    - [62, 2903.49]
  - - [4288, 4288, 1, 1280]
    - [16, 10437.5]
  - - [6784, 1408, 1, 1]
    - [74, 198.991]
  - - [5888, 256, 1, 3328]
    - [15, 10068.2]
  - - [1856, 5888, 1, 3328]
    - [27, 10191.7]
  - - [1024, 704, 1, 1]
    - [70, 79.1194]
  - - [5056, 5888, 1, 1]
    - [69, 225.521]
  - - [2944, 1024, 1, 256]
    - [2, 10124.7]
  - - [448, 1408, 1, 3328]
    - [26, 8039.42]
  - - [5056, 32, 1, 3328]
    - [63, 1833.69]
  - - [2368, 4288, 1, 3328]
    - [26, 9859.37]
  - - [1024, 704, 1, 32]
    - [63, 1810.59]
  - - [448, 2944, 1, 256]
    - [15, 8053.08]
  - - [2944, 6784, 1, 256]
    - [15, 11389.7]
  - - [2368, 2368, 1, 1280]
    - [2, 11256.2]
  - - [5888, 128, 1, 3328]
    - [18, 9421.14]
  - - [256, 256, 1, 32]
    - [57, 150.593]
  - - [1024, 1, 1, 256]
    - [77, 8.86925]
  - - [3584, 3584, 1, 32]
    - [60, 4012.22]
  - - [2944, 448, 1, 1]
    - [69, 105.979]
  - - [128, 32, 1, 32]
    - [60, 9.99672]
  - - [5056, 64, 1, 1280]
    - [13, 7131.82]
  - - [2944, 2944, 1, 1280]
    - [2, 11044.5]
  - - [1, 2368, 1, 256]
    - [77, 20.5101]
  - - [64, 6784, 1, 1]
    - [77, 56.3572]
  - - [2944, 32, 1, 1280]
    - [63, 1309.62]
  - - [64, 1408, 1, 3328]
    - [36, 4367.22]
  - - [256, 448, 1, 1280]
    - [39, 4821.75]
  - - [2368, 2944, 1, 1]
    - [74, 185.622]
  - - [6784, 4288, 1, 1280]
    - [26, 10061.8]
  - - [2944, 704, 1, 256]
    - [26, 9811.83]
  - - [5888, 1856, 1, 256]
    - [15, 11253.4]
  - - [704, 2944, 1, 3328]
    - [16, 11005.1]
  - - [5888, 256, 1, 1]
    - [69, 121.119]
  - - [704, 704, 1, 32]
    - [61, 1446.59]
  - - [256, 4288, 1, 256]
    - [15, 7903.43]
  - - [5056, 6784, 1, 32]
    - [54, 4359.25]
  - - [5056, 128, 1, 1]
    - [73, 72.2004]
  - - [448, 5056, 1, 1280]
    - [15, 10667.6]
  - - [448, 448, 1, 256]
    - [14, 4593.47]
  - - [256, 5888, 1, 3328]
    - [6, 10324.6]
  - - [704, 448, 1, 1280]
    - [15, 5422.67]
  - - [448, 64, 1, 256]
    - [36, 1088.86]
  - - [1024, 704, 1, 1280]
    - [26, 8916.76]
  - - [5888, 1024, 1, 1]
    - [69, 180.873]
  - - [5888, 448, 1, 32]
    - [62, 2944.46]
  - - [6784, 2944, 1, 256]
    - [2, 11369.0]
  - - [1024, 256, 1, 1]
    - [70, 38.0525]
  - - [5888, 256, 1, 32]
    - [61, 2523.85]
  - - [2368, 448, 1, 256]
    - [15, 7734.71]
  - - [4288, 256, 1, 3328]
    - [26, 8557.55]
  - - [4288, 2944, 1, 256]
    - [15, 11232.4]
  - - [704, 4288, 1, 3328]
    - [6, 10137.7]
  - - [448, 5888, 1, 3328]
    - [50, 9251.24]
  - - [128, 256, 1, 3328]
    - [42, 1810.77]
  - - [2368, 5056, 1, 32]
    - [60, 4024.91]
  - - [32, 128, 1, 1280]
    - [63, 60.2353]
  - - [1408, 4288, 1, 1]
    - [69, 180.718]
  - - [1408, 1856, 1, 3328]
    - [15, 10556.0]
  - - [4288, 64, 1, 256]
    - [13, 5044.67]
  - - [2944, 5888, 1, 3328]
    - [16, 9625.96]
  - - [128, 6784, 1, 3328]
    - [23, 8816.29]
  - - [448, 4288, 1, 3328]
    - [2, 10183.5]
  - - [704, 2368, 1, 256]
    - [15, 8932.18]
  - - [1, 64, 1, 3328]
    - [82, 0.825525]
  - - [4288, 128, 1, 1]
    - [70, 63.328]
  - - [256, 2368, 1, 32]
    - [63, 1558.75]
  - - [4288, 3584, 1, 3328]
    - [16, 9808.08]
  - - [2368, 1024, 1, 1280]
    - [26, 10386.6]
  - - [1408, 1024, 1, 1]
    - [74, 116.546]
  - - [1408, 1024, 1, 256]
    - [27, 8787.86]
  - - [5056, 3584, 1, 1]
    - [74, 218.608]
  - - [448, 1024, 1, 256]
    - [15, 6661.4]
  - - [6784, 6784, 1, 3328]
    - [28, 9652.62]
  - - [1408, 256, 1, 1280]
    - [26, 6166.69]
  - - [6784, 32, 1, 32]
    - [61, 721.372]
  - - [64, 1024, 1, 3328]
    - [40, 3459.82]
  - - [2368, 2944, 1, 3328]
    - [15, 10297.6]
  - - [448, 448, 1, 1280]
    - [14, 5848.3]
  - - [5056, 3584, 1, 32]
    - [54, 4183.82]
  - - [5056, 3584, 1, 1280]
    - [16, 10499.1]
  - - [1024, 256, 1, 1280]
    - [31, 6863.18]
  - - [1856, 1856, 1, 256]
    - [15, 10054.6]
  - - [32, 5888, 1, 256]
    - [63, 1648.48]
  - - [256, 1408, 1, 32]
    - [63, 1081.31]
  - - [2944, 1, 1, 3328]
    - [77, 38.3263]
  - - [32, 704, 1, 3328]
    - [63, 356.878]
  - - [5888, 4288, 1, 1]
    - [74, 222.187]
  - - [1024, 128, 1, 256]
    - [39, 4008.65]
  - - [32, 1856, 1, 3328]
    - [63, 945.863]
  - - [5056, 704, 1, 256]
    - [15, 10310.9]
  - - [448, 256, 1, 256]
    - [36, 3570.71]
  - - [2368, 5056, 1, 256]
    - [0, 11173.6]
  - - [1024, 5056, 1, 256]
    - [26, 10662.9]
  - - [1024, 64, 1, 1]
    - [80, 6.10148]
  - - [5888, 448, 1, 256]
    - [15, 9565.59]
  - - [6784, 5056, 1, 1280]
    - [16, 9957.88]
  - - [704, 6784, 1, 32]
    - [60, 3382.2]
  - - [4288, 6784, 1, 1280]
    - [16, 10118.7]
  - - [64, 1, 1, 256]
    - [77, 0.550186]
  - - [1856, 64, 1, 1280]
    - [39, 4969.8]
  - - [128, 1408, 1, 1]
    - [70, 16.5503]
  - - [1024, 64, 1, 32]
    - [57, 149.004]
  - - [1024, 64, 1, 3328]
    - [39, 3455.77]
  - - [704, 6784, 1, 3328]
    - [26, 10129.7]
  - - [5888, 4288, 1, 1280]
    - [2, 10093.9]
  - - [5888, 3584, 1, 1280]
    - [26, 10396.0]
  - - [32, 2368, 1, 1280]
    - [63, 1111.52]
  - - [5888, 128, 1, 1280]
    - [26, 9302.07]
  - - [1024, 2944, 1, 256]
    - [6, 9941.16]
  - - [1, 2944, 1, 1280]
    - [82, 35.6987]
  - - [4288, 2368, 1, 32]
    - [62, 3937.51]
  - - [2944, 1856, 1, 1280]
    - [15, 11147.1]
  - - [3584, 1, 1, 1280]
    - [77, 44.8767]
  - - [256, 3584, 1, 32]
    - [63, 2011.93]
  - - [1024, 2368, 1, 1]
    - [69, 145.483]
  - - [2944, 3584, 1, 1280]
    - [26, 10836.9]
  - - [64, 1, 1, 1]
    - [82, 0.00981821]
  - - [1856, 4288, 1, 256]
    - [15, 10979.5]
  - - [256, 128, 1, 3328]
    - [42, 1815.23]
  - - [1024, 1024, 1, 1024]
    - [16, 9754.42]
  - - [1, 1856, 1, 3328]
    - [82, 24.2254]
  - - [1408, 704, 1, 1]
    - [73, 95.5819]
  - - [2368, 2944, 1, 32]
    - [60, 3722.54]
  - - [128, 4288, 1, 32]
    - [63, 1411.3]
  - - [128, 704, 1, 1280]
    - [36, 4033.9]
  - - [64, 64, 1, 1]
    - [70, 0.392168]
  - - [1, 1408, 1, 1]
    - [75, 0.16108]
  - - [128, 2368, 1, 1280]
    - [24, 6706.07]
  - - [2944, 32, 1, 32]
    - [55, 235.244]
  - - [448, 1856, 1, 1]
    - [72, 83.1446]
  - - [4288, 704, 1, 256]
    - [15, 10118.8]
  - - [1856, 1024, 1, 256]
    - [2, 9135.0]
  - - [448, 1856, 1, 32]
    - [63, 1851.54]
  - - [448, 1856, 1, 3328]
    - [19, 8217.31]
  - - [448, 448, 1, 32]
    - [57, 456.308]
  - - [1024, 448, 1, 256]
    - [15, 6661.4]
  - - [6784, 1, 1, 256]
    - [81, 53.6492]
  - - [1024, 5056, 1, 32]
    - [62, 3467.53]
  - - [1024, 4288, 1, 1]
    - [74, 164.654]
  - - [704, 256, 1, 3328]
    - [34, 5032.22]
  - - [704, 1856, 1, 32]
    - [62, 2475.62]
  - - [1408, 5888, 1, 1280]
    - [26, 11171.5]
  - - [32, 704, 1, 1280]
    - [63, 332.143]
  - - [5056, 1856, 1, 256]
    - [15, 11225.3]
  - - [6784, 704, 1, 1280]
    - [15, 10851.5]
  - - [704, 1408, 1, 32]
    - [61, 2162.64]
  - - [5888, 1024, 1, 256]
    - [15, 11042.2]
  - - [64, 2944, 1, 1]
    - [70, 17.6634]
  - - [64, 2944, 1, 32]
    - [60, 417.398]
  - - [64, 2944, 1, 1280]
    - [24, 6225.17]
  - - [6784, 1856, 1, 3328]
    - [16, 9744.11]
  - - [64, 704, 1, 3328]
    - [36, 2401.2]
  - - [2368, 5888, 1, 1280]
    - [6, 10767.5]
  - - [1, 6784, 1, 256]
    - [77, 52.6849]
  - - [6784, 6784, 1, 32]
    - [54, 4382.01]
  - - [256, 1, 1, 1280]
    - [77, 3.12396]
  - - [5888, 128, 1, 32]
    - [61, 1871.15]
  - - [6784, 256, 1, 256]
    - [15, 9363.27]
  - - [2368, 3584, 1, 3328]
    - [15, 10101.4]
  - - [128, 4288, 1, 1280]
    - [14, 7666.99]
  - - [128, 128, 1, 256]
    - [37, 636.224]
  - - [5888, 1024, 1, 1280]
    - [15, 11394.8]
  - - [1856, 704, 1, 3328]
    - [15, 10382.4]
  - - [5888, 6784, 1, 3328]
    - [27, 9582.71]
  - - [6784, 1856, 1, 1]
    - [74, 207.285]
  - - [128, 32, 1, 1280]
    - [63, 57.2626]
  - - [2944, 2368, 1, 1280]
    - [26, 11271.8]
  - - [4288, 448, 1, 1]
    - [72, 129.668]
  - - [6784, 448, 1, 32]
    - [62, 3178.96]
  - - [6784, 448, 1, 3328]
    - [26, 10308.2]
  - - [1, 6784, 1, 1]
    - [77, 1.05268]
  - - [448, 3584, 1, 1280]
    - [15, 9560.47]
  - - [1408, 6784, 1, 1280]
    - [48, 10813.8]
  - - [5056, 5888, 1, 1280]
    - [27, 10180.4]
  - - [32, 2944, 1, 32]
    - [60, 226.088]
  - - [5888, 704, 1, 1]
    - [77, 164.099]
  - - [1, 256, 1, 256]
    - [82, 2.74755]
  - - [5056, 2944, 1, 32]
    - [60, 4098.18]
  - - [32, 6784, 1, 256]
    - [63, 1904.12]
  - - [64, 5056, 1, 256]
    - [13, 5885.64]
  - - [4288, 6784, 1, 1]
    - [69, 225.043]
  - - [448, 704, 1, 1280]
    - [26, 5406.55]
  - - [64, 2368, 1, 1]
    - [70, 14.6138]
  - - [1, 4288, 1, 3328]
    - [77, 42.753]
  - - [5056, 4288, 1, 1]
    - [72, 219.56]
  - - [2368, 5888, 1, 32]
    - [54, 4050.49]
  - - [128, 3584, 1, 1280]
    - [26, 7832.97]
  - - [2944, 6784, 1, 1]
    - [74, 220.815]
  - - [1, 256, 1, 1]
    - [79, 0.0460805]
  - - [5888, 1024, 1, 3328]
    - [26, 10662.7]
  - - [6784, 5888, 1, 256]
    - [0, 11111.0]
  - - [704, 128, 1, 1280]
    - [36, 4065.47]
  - - [4288, 128, 1, 256]
    - [12, 6609.09]
  - - [32, 3584, 1, 3328]
    - [63, 1821.33]
  - - [6784, 64, 1, 256]
    - [12, 6149.5]
  - - [1024, 1, 1, 1280]
    - [81, 12.2961]
  - - [2368, 4288, 1, 32]
    - [62, 3941.05]
  - - [704, 3584, 1, 1]
    - [69, 150.048]
  - - [704, 1856, 1, 3328]
    - [26, 10089.7]
  - - [2944, 128, 1, 1280]
    - [14, 7545.13]
  - - [1, 2368, 1, 3328]
    - [82, 30.9532]
  - - [6784, 704, 1, 32]
    - [60, 3404.51]
  - - [4288, 1, 1, 1280]
    - [81, 41.2782]
  - - [704, 5888, 1, 256]
    - [16, 10738.5]
  - - [2944, 256, 1, 1]
    - [73, 82.0493]
  - - [64, 448, 1, 256]
    - [42, 1101.03]
  - - [1408, 448, 1, 1280]
    - [26, 7807.75]
  - - [1408, 128, 1, 32]
    - [60, 405.496]
  - - [256, 1024, 1, 256]
    - [15, 5557.9]
  - - [3584, 5056, 1, 32]
    - [54, 4102.67]
  - - [1024, 32, 1, 1280]
    - [63, 466.788]
  - - [128, 2368, 1, 1]
    - [77, 40.9185]
  - - [6784, 1856, 1, 1280]
    - [46, 10486.2]
  - - [5056, 5056, 1, 3328]
    - [28, 9527.49]
  - - [128, 2944, 1, 1280]
    - [14, 7536.4]
  - - [128, 6784, 1, 1]
    - [76, 86.8352]
  - - [5888, 1408, 1, 256]
    - [16, 11169.7]
  - - [2368, 1024, 1, 32]
    - [62, 2934.13]
  - - [256, 256, 1, 3328]
    - [39, 3447.68]
  - - [64, 4288, 1, 1]
    - [73, 37.0479]
  - - [4288, 1024, 1, 256]
    - [15, 10716.4]
  - - [3584, 32, 1, 32]
    - [64, 416.338]
  - - [3584, 64, 1, 1]
    - [70, 33.296]
  - - [704, 32, 1, 1280]
    - [63, 312.167]
  - - [32, 4288, 1, 32]
    - [63, 459.493]
  - - [64, 64, 1, 3328]
    - [30, 215.985]
  - - [64, 1408, 1, 1]
    - [70, 8.50675]
  - - [4288, 5888, 1, 1280]
    - [16, 10179.4]
  - - [704, 64, 1, 3328]
    - [30, 2367.51]
  - - [5056, 5888, 1, 256]
    - [16, 11541.5]
  - - [1408, 128, 1, 1280]
    - [24, 5988.83]
  - - [1024, 5888, 1, 1280]
    - [26, 11161.7]
  - - [64, 1024, 1, 1]
    - [70, 6.01855]
  - - [32, 32, 1, 32]
    - [55, 2.54232]
  - - [64, 128, 1, 256]
    - [7, 264.575]
  - - [5888, 5056, 1, 1280]
    - [6, 10101.2]
  - - [5888, 2944, 1, 1]
    - [74, 216.672]
  - - [64, 4288, 1, 1280]
    - [24, 6071.77]
  - - [704, 2944, 1, 1]
    - [69, 139.897]
  - - [1408, 4288, 1, 3328]
    - [15, 10229.1]
  - - [704, 2944, 1, 32]
    - [61, 2888.17]
  - - [1, 5888, 1, 1280]
    - [77, 55.8712]
  - - [2944, 4288, 1, 3328]
    - [2, 9672.5]
  - - [256, 2944, 1, 256]
    - [15, 8088.63]
  - - [704, 448, 1, 32]
    - [61, 966.302]
  - - [5056, 2944, 1, 256]
    - [16, 11300.6]
  - - [704, 1024, 1, 256]
    - [15, 7761.19]
  - - [2368, 1856, 1, 256]
    - [15, 10718.9]
  - - [64, 3584, 1, 1]
    - [75, 20.6431]
  - - [1024, 128, 1, 1280]
    - [41, 5431.37]
  - - [2368, 4288, 1, 1280]
    - [15, 11038.4]
  - - [3584, 448, 1, 256]
    - [15, 8656.61]
  - - [256, 6784, 1, 256]
    - [15, 9305.17]
  - - [1024, 32, 1, 32]
    - [57, 84.2568]
  - - [2944, 5888, 1, 1]
    - [69, 216.072]
  - - [128, 64, 1, 32]
    - [62, 18.3356]
  - - [64, 1, 1, 1280]
    - [77, 0.755904]
  - - [6784, 5888, 1, 3328]
    - [27, 9480.85]
  - - [256, 5888, 1, 1]
    - [72, 118.996]
  - - [6784, 3584, 1, 256]
    - [47, 11265.0]
  - - [1408, 1856, 1, 256]
    - [15, 10216.2]
  - - [128, 1408, 1, 256]
    - [13, 4647.9]
  - - [2944, 2944, 1, 32]
    - [54, 3824.41]
  - - [2944, 2944, 1, 3328]
    - [26, 10085.9]
  - - [1, 2944, 1, 256]
    - [77, 25.6279]
  - - [448, 32, 1, 1280]
    - [63, 203.048]
  - - [3584, 1, 1, 256]
    - [81, 36.3224]
  - - [704, 32, 1, 3328]
    - [63, 345.429]
  - - [256, 448, 1, 3328]
    - [41, 5162.85]
  - - [2368, 64, 1, 256]
    - [11, 3938.01]
  - - [64, 448, 1, 1280]
    - [38, 1470.12]
  - - [1408, 448, 1, 3328]
    - [15, 8037.14]
  - - [2368, 6784, 1, 3328]
    - [27, 9667.44]
  - - [256, 2368, 1, 1]
    - [75, 68.7701]
  - - [4288, 3584, 1, 32]
    - [60, 4108.2]
  - - [5888, 64, 1, 3328]
    - [24, 7639.81]
  - - [3584, 704, 1, 1280]
    - [26, 10505.6]
  - - [448, 5056, 1, 3328]
    - [26, 10689.4]
  - - [4288, 448, 1, 256]
    - [15, 9207.85]
  - - [5056, 256, 1, 1280]
    - [15, 10388.0]
  - - [704, 448, 1, 3328]
    - [15, 5571.97]
  - - [2944, 5888, 1, 32]
    - [54, 4121.18]
  - - [3584, 5056, 1, 256]
    - [16, 11244.9]
  - - [6784, 1, 1, 3328]
    - [77, 63.3511]
  - - [32, 2368, 1, 3328]
    - [63, 1206.36]
  - - [64, 256, 1, 1]
    - [70, 2.54213]
  - - [1856, 448, 1, 3328]
    - [35, 8089.19]
  - - [3584, 2368, 1, 256]
    - [15, 11038.7]
  - - [128, 1024, 1, 1280]
    - [39, 5457.51]
  - - [4288, 256, 1, 32]
    - [61, 2185.28]
  - - [4288, 256, 1, 1280]
    - [53, 8239.85]
  - - [448, 5056, 1, 256]
    - [15, 9760.43]
  - - [128, 1856, 1, 1]
    - [77, 34.4851]
  - - [128, 1856, 1, 32]
    - [63, 808.097]
  - - [1408, 1856, 1, 1]
    - [75, 145.176]
  - - [128, 2944, 1, 1]
    - [75, 49.3882]
  - - [3584, 32, 1, 256]
    - [64, 995.849]
  - - [1408, 1408, 1, 1280]
    - [4, 10321.2]
  - - [3584, 256, 1, 1]
    - [72, 91.7458]
  - - [1408, 1856, 1, 1280]
    - [15, 11213.2]
  - - [448, 4288, 1, 1]
    - [72, 129.668]
  - - [3584, 4288, 1, 3328]
    - [27, 9805.29]
  - - [448, 128, 1, 256]
    - [39, 2108.3]
  - - [448, 4288, 1, 32]
    - [54, 2729.76]
  - - [448, 4288, 1, 1280]
    - [16, 10058.9]
  - - [64, 3584, 1, 256]
    - [14, 5284.64]
  - - [6784, 1408, 1, 1280]
    - [15, 10873.6]
  - - [1, 6784, 1, 1280]
    - [77, 63.7432]
  - - [5056, 1024, 1, 256]
    - [2, 10870.2]
  - - [2368, 448, 1, 32]
    - [62, 2111.89]
  - - [256, 1, 1, 256]
    - [79, 2.26851]
  - - [32, 2944, 1, 1280]
    - [63, 1377.22]
  - - [5056, 1024, 1, 1]
    - [69, 175.168]
  - - [2368, 256, 1, 256]
    - [26, 6608.72]
  - - [1, 5056, 1, 1]
    - [77, 0.822314]
  - - [4288, 32, 1, 32]
    - [63, 481.935]
  - - [1856, 3584, 1, 32]
    - [54, 3703.02]
  - - [5056, 3584, 1, 3328]
    - [52, 9793.34]
  - - [4288, 5056, 1, 256]
    - [15, 11491.4]
  - - [1856, 5888, 1, 256]
    - [16, 11372.0]
  - - [256, 256, 1, 256]
    - [39, 2359.17]
  - - [2368, 3584, 1, 1]
    - [74, 193.205]
  - - [4288, 2368, 1, 256]
    - [15, 11239.9]
  - - [448, 1, 1, 3328]
    - [77, 5.75224]
  - - [1856, 256, 1, 1280]
    - [15, 8144.93]
  - - [1024, 6784, 1, 1]
    - [72, 185.335]
  - - [1408, 2944, 1, 3328]
    - [2, 10430.0]
  - - [32, 1856, 1, 32]
    - [60, 141.747]
  - - [256, 1, 1, 1]
    - [75, 0.0479985]
  - - [6784, 5056, 1, 3328]
    - [10, 9417.16]
  - - [6784, 5056, 1, 1]
    - [74, 227.871]
  - - [5888, 3584, 1, 32]
    - [54, 4214.53]
  - - [5888, 3584, 1, 3328]
    - [27, 9792.96]
  - - [1, 256, 1, 3328]
    - [82, 3.36194]
  - - [1024, 6784, 1, 256]
    - [26, 10775.3]
  - - [6784, 5888, 1, 32]
    - [54, 4381.75]
  - - [1408, 1, 1, 1280]
    - [81, 17.4655]
  - - [2368, 6784, 1, 32]
    - [54, 4111.17]
  - - [6784, 64, 1, 1]
    - [73, 56.3572]
  - - [2368, 32, 1, 32]
    - [57, 192.554]
  - - [3584, 1408, 1, 3328]
    - [6, 10468.3]
  - - [2944, 1408, 1, 1280]
    - [15, 11441.8]
  - - [1856, 64, 1, 1]
    - [70, 11.7046]
  - - [3584, 1024, 1, 1]
    - [72, 170.841]
  - - [256, 32, 1, 256]
    - [63, 95.9685]
  - - [2944, 1856, 1, 3328]
    - [26, 10380.6]
  - - [128, 1024, 1, 3328]
    - [41, 5894.54]
  - - [1408, 128, 1, 1]
    - [70, 17.0143]
  - - [2944, 3584, 1, 32]
    - [60, 3939.51]
  - - [3584, 1024, 1, 32]
    - [62, 3387.58]
  - - [4288, 6784, 1, 3328]
    - [16, 9507.8]
  - - [256, 128, 1, 1280]
    - [43, 1700.37]
  - - [6784, 5056, 1, 256]
    - [52, 11020.5]
  - - [1408, 32, 1, 3328]
    - [63, 690.386]
  - - [1856, 3584, 1, 1280]
    - [15, 11064.8]
  - - [256, 5888, 1, 256]
    - [15, 9138.78]
  - - [5056, 32, 1, 256]
    - [63, 1404.86]
  - - [1024, 4288, 1, 3328]
    - [26, 10457.4]
  - - [448, 2368, 1, 256]
    - [15, 7702.14]
  - - [64, 1408, 1, 1280]
    - [36, 4054.89]
  - - [3584, 32, 1, 1280]
    - [63, 1562.89]
  - - [128, 2368, 1, 3328]
    - [24, 7063.0]
  - - [3584, 1024, 1, 256]
    - [2, 10640.2]
  - - [256, 64, 1, 256]
    - [37, 636.224]
  - - [2368, 448, 1, 3328]
    - [15, 8399.88]
  - - [3584, 2368, 1, 1]
    - [69, 194.516]
  - - [1, 1, 1, 1]
    - [70, 0.000117392]
  - - [1024, 1856, 1, 32]
    - [54, 2700.66]
  - - [32, 1024, 1, 32]
    - [62, 78.6393]
  - - [4288, 1, 1, 256]
    - [81, 34.3029]
  - - [1856, 128, 1, 3328]
    - [14, 7310.36]
  - - [5888, 2368, 1, 1]
    - [69, 210.303]
  - - [5888, 128, 1, 1]
    - [73, 82.0493]
  - - [704, 256, 1, 1280]
    - [31, 4798.43]
  - - [704, 4288, 1, 256]
    - [2, 10128.6]
  - - [5888, 2368, 1, 32]
    - [62, 4042.34]
  - - [5888, 2368, 1, 1280]
    - [0, 10609.2]
  - - [128, 256, 1, 256]
    - [36, 1258.23]
  - - [2944, 5056, 1, 3328]
    - [27, 9770.54]
  - - [6784, 704, 1, 3328]
    - [48, 9743.71]
  - - [1856, 1856, 1, 32]
    - [60, 3234.97]
  - - [4288, 2944, 1, 32]
    - [62, 3989.29]
  - - [128, 448, 1, 1]
    - [70, 5.45147]
  - - [2944, 64, 1, 1]
    - [70, 17.9128]
  - - [704, 64, 1, 256]
    - [7, 1588.86]
  - - [256, 2368, 1, 3328]
    - [15, 7730.59]
  - - [704, 1, 1, 1]
    - [70, 0.0841049]
  - - [128, 448, 1, 1280]
    - [32, 2783.32]
  - - [5056, 5056, 1, 256]
    - [47, 11326.1]
  - - [6784, 6784, 1, 256]
    - [52, 10904.2]
  - - [256, 3584, 1, 1]
    - [76, 91.0719]
  - - [2368, 2944, 1, 256]
    - [15, 10961.0]
  - - [448, 32, 1, 32]
    - [57, 36.6445]
  - - [5888, 3584, 1, 1]
    - [74, 221.35]
  - - [5888, 128, 1, 256]
    - [15, 8063.78]
  - - [3584, 704, 1, 3328]
    - [15, 10462.0]
  - - [4288, 704, 1, 3328]
    - [26, 10293.1]
  - - [4288, 2944, 1, 1280]
    - [15, 10636.0]
  - - [448, 3584, 1, 256]
    - [15, 8670.12]
  - - [704, 32, 1, 256]
    - [63, 206.509]
  - - [6784, 256, 1, 32]
    - [60, 2651.01]
  - - [1856, 128, 1, 1]
    - [73, 35.2422]
  - - [1856, 32, 1, 32]
    - [55, 147.449]
  - - [2368, 5056, 1, 1280]
    - [15, 11031.2]
  - - [704, 1856, 1, 1280]
    - [15, 10481.8]
  - - [448, 1024, 1, 3328]
    - [15, 8069.74]
  - - [32, 704, 1, 32]
    - [62, 53.473]
  - - [3584, 448, 1, 1]
    - [70, 115.293]
  - - [6784, 1024, 1, 3328]
    - [15, 10257.9]
  - - [5888, 1856, 1, 32]
    - [62, 3967.08]
  - - [5888, 704, 1, 3328]
    - [26, 10645.2]
  - - [5056, 1, 1, 256]
    - [81, 40.7299]
  - - [448, 6784, 1, 256]
    - [27, 10167.7]
  - - [1024, 128, 1, 1]
    - [75, 12.1195]
  - - [128, 64, 1, 256]
    - [7, 237.907]
  - - [128, 5056, 1, 1]
    - [77, 71.6131]
  - - [1856, 128, 1, 256]
    - [14, 5473.38]
  - - [64, 704, 1, 1]
    - [70, 4.19477]
  - - [2944, 5888, 1, 256]
    - [16, 11277.3]
  - - [1408, 64, 1, 256]
    - [36, 2937.94]
  - - [128, 5056, 1, 32]
    - [61, 1634.91]
  - - [128, 5056, 1, 1280]
    - [25, 8924.77]
  - - [448, 32, 1, 3328]
    - [63, 214.261]
  - - [1856, 1408, 1, 32]
    - [62, 3118.49]
  - - [64, 704, 1, 32]
    - [60, 100.846]
  - - [1, 5888, 1, 256]
    - [77, 47.1025]
  - - [64, 2368, 1, 32]
    - [59, 335.733]
  - - [5888, 64, 1, 32]
    - [61, 1154.54]
  - - [2368, 256, 1, 1]
    - [73, 69.3523]
  - - [5888, 64, 1, 1280]
    - [13, 7234.98]
  - - [5056, 1, 1, 1]
    - [73, 0.853189]
  - - [5888, 2944, 1, 1280]
    - [27, 10489.5]
  - - [256, 1408, 1, 256]
    - [15, 5300.71]
  - - [448, 5888, 1, 1]
    - [74, 142.439]
  - - [2944, 128, 1, 32]
    - [62, 1154.49]
  - - [3584, 1408, 1, 1]
    - [69, 172.9]
  - - [32, 6784, 1, 1280]
    - [63, 2407.68]
  - - [32, 6784, 1, 32]
    - [63, 694.647]
  - - [32, 1856, 1, 1280]
    - [63, 860.958]
  - - [448, 5888, 1, 32]
    - [60, 2959.74]
  - - [5056, 704, 1, 1280]
    - [49, 10851.2]
  - - [1856, 6784, 1, 1]
    - [74, 206.783]
  - - [5056, 64, 1, 1]
    - [73, 43.6833]
  - - [1, 5888, 1, 1]
    - [75, 0.946243]
  - - [2368, 1024, 1, 256]
    - [2, 9577.07]
  - - [1856, 6784, 1, 32]
    - [54, 3987.68]
  - - [1856, 6784, 1, 1280]
    - [27, 10620.3]
  - - [64, 3584, 1, 3328]
    - [14, 7121.69]
  - - [5888, 5056, 1, 3328]
    - [27, 9614.62]
  - - [1, 2944, 1, 3328]
    - [82, 38.5947]
  - - [1408, 6784, 1, 32]
    - [60, 3892.72]
  - - [32, 5888, 1, 1280]
    - [63, 2073.71]
  - - [448, 256, 1, 1]
    - [70, 10.7517]
  - - [3584, 5888, 1, 3328]
    - [6, 9699.29]
  - - [4288, 1408, 1, 256]
    - [16, 10727.5]
  - - [448, 64, 1, 1280]
    - [42, 1496.8]
  - - [128, 448, 1, 32]
    - [57, 132.468]
  - - [6784, 2368, 1, 256]
    - [49, 11213.3]
  - - [1408, 448, 1, 32]
    - [61, 1612.36]
  - - [1856, 1408, 1, 1280]
    - [15, 11232.7]
  - - [448, 256, 1, 3328]
    - [36, 5178.43]
  - - [1856, 2368, 1, 1]
    - [72, 165.727]
  - - [1408, 5056, 1, 3328]
    - [28, 10055.5]
  - - [128, 704, 1, 3328]
    - [36, 4353.15]
  - - [5056, 128, 1, 1280]
    - [25, 8953.32]
  - - [5056, 4288, 1, 256]
    - [46, 11253.2]
  - - [5056, 5056, 1, 32]
    - [54, 4242.38]
  - - [1856, 704, 1, 256]
    - [15, 9234.22]
  - - [5888, 32, 1, 1280]
    - [63, 2034.82]
  - - [64, 256, 1, 256]
    - [37, 629.114]
  - - [448, 5888, 1, 1280]
    - [26, 10368.6]
  - - [704, 704, 1, 3328]
    - [26, 8728.47]
  - - [128, 6784, 1, 256]
    - [1, 7835.4]
  - - [5056, 448, 1, 256]
    - [15, 9797.13]
  - - [4288, 5888, 1, 1]
    - [74, 222.767]
  - - [1856, 5056, 1, 1280]
    - [0, 11036.6]
  - - [704, 1856, 1, 1]
    - [73, 108.214]
  - - [2368, 32, 1, 3328]
    - [63, 1180.02]
  - - [3584, 1856, 1, 256]
    - [15, 10874.3]
  - - [256, 3584, 1, 256]
    - [26, 7927.0]
  - - [2944, 1408, 1, 1]
    - [68, 169.055]
  - - [4288, 5888, 1, 32]
    - [54, 4258.76]
  - - [4288, 5888, 1, 3328]
    - [16, 9554.52]
  - - [1, 1024, 1, 1]
    - [70, 0.114247]
  - - [32, 64, 1, 32]
    - [60, 4.75657]
  - - [1408, 2368, 1, 1]
    - [74, 157.926]
  - - [2944, 2368, 1, 256]
    - [15, 10971.0]
  - - [1024, 1856, 1, 256]
    - [27, 9034.5]
  - - [2944, 64, 1, 3328]
    - [13, 6707.51]
  - - [1024, 5888, 1, 32]
    - [62, 3627.54]
  - - [1024, 5888, 1, 3328]
    - [15, 10465.0]
  - - [5056, 2368, 1, 32]
    - [62, 4024.91]
  - - [1408, 2368, 1, 1280]
    - [15, 11204.2]
  - - [256, 1, 1, 3328]
    - [77, 3.27951]
  - - [128, 1024, 1, 32]
    - [57, 298.007]
  - - [5056, 6784, 1, 3328]
    - [28, 9485.44]
  - - [448, 704, 1, 1]
    - [75, 42.1563]
  - - [448, 704, 1, 32]
    - [63, 973.197]
  - - [448, 704, 1, 3328]
    - [26, 5571.95]
  - - [1408, 2944, 1, 256]
    - [2, 10706.4]
  - - [3584, 4288, 1, 1]
    - [74, 214.545]
  - - [2368, 128, 1, 32]
    - [63, 935.281]
  - - [5056, 1408, 1, 1280]
    - [15, 11074.0]
  - - [2368, 128, 1, 3328]
    - [13, 7122.09]
  - - [704, 5056, 1, 32]
    - [54, 3306.72]
  - - [32, 2368, 1, 32]
    - [60, 181.86]
  - - [1408, 1, 1, 256]
    - [77, 12.2568]
  - - [256, 1856, 1, 32]
    - [60, 1368.34]
  - - [448, 1408, 1, 1]
    - [73, 70.3764]
  - - [5056, 4288, 1, 1280]
    - [15, 10457.0]
  - - [1408, 256, 1, 256]
    - [26, 5278.27]
  - - [128, 256, 1, 1]
    - [72, 4.1732]
  - - [256, 4288, 1, 32]
    - [61, 2165.28]
  - - [1856, 2368, 1, 1280]
    - [15, 11051.1]
  - - [256, 256, 1, 1]
    - [70, 6.10148]
  - - [1408, 1, 1, 1]
    - [70, 0.171237]
  - - [448, 1408, 1, 256]
    - [15, 6876.79]
  - - [5888, 5888, 1, 1]
    - [74, 227.41]
  - - [128, 2944, 1, 32]
    - [63, 1114.99]
  - - [32, 1024, 1, 1280]
    - [63, 473.424]
  - - [32, 256, 1, 32]
    - [62, 19.6598]
  - - [2944, 704, 1, 1280]
    - [26, 10915.3]
  - - [1024, 3584, 1, 1280]
    - [3, 11426.3]
  - - [704, 6784, 1, 256]
    - [15, 10486.1]
  - - [1856, 448, 1, 1]
    - [74, 83.1446]
  - - [128, 704, 1, 1]
    - [70, 8.56659]
  - - [5056, 256, 1, 32]
    - [62, 2474.09]
  - - [4288, 1, 1, 3328]
    - [81, 42.3769]
  - - [5056, 1024, 1, 1280]
    - [27, 11456.2]
  - - [704, 704, 1, 1]
    - [77, 61.9481]
  - - [1856, 448, 1, 1280]
    - [26, 8126.51]
  - - [3584, 6784, 1, 256]
    - [27, 11404.2]
  - - [64, 1856, 1, 1280]
    - [39, 5006.21]
  - - [1856, 1408, 1, 256]
    - [2, 10297.7]
  - - [4288, 4288, 1, 32]
    - [54, 4134.79]
  - - [128, 1, 1, 256]
    - [77, 1.10866]
  - - [32, 64, 1, 3328]
    - [63, 32.6391]
  - - [5888, 448, 1, 1]
    - [72, 140.194]
  - - [128, 5888, 1, 256]
    - [15, 8139.3]
  - - [3584, 256, 1, 3328]
    - [15, 9149.9]
  - - [5056, 5056, 1, 1280]
    - [2, 10160.0]
  - - [2368, 1, 1, 256]
    - [77, 20.9297]
  - - [6784, 1408, 1, 3328]
    - [15, 10217.0]
  - - [1408, 1408, 1, 1]
    - [72, 134.486]
  - - [32, 64, 1, 256]
    - [63, 18.975]
  - - [2368, 1, 1, 1280]
    - [81, 28.8357]
  - - [32, 3584, 1, 32]
    - [60, 270.73]
  - - [2368, 5056, 1, 1]
    - [69, 206.156]
  - - [1, 3584, 1, 1]
    - [73, 0.590056]
  - - [256, 2944, 1, 3328]
    - [15, 9597.38]
  - - [1408, 64, 1, 3328]
    - [40, 4348.45]
  - - [1, 128, 1, 3328]
    - [82, 1.69384]
  - - [32, 256, 1, 256]
    - [63, 76.7232]
  - - [5888, 1408, 1, 32]
    - [54, 3871.68]
  - - [704, 256, 1, 1]
    - [75, 16.5503]
  - - [1, 448, 1, 1]
    - [74, 0.0695112]
  - - [256, 6784, 1, 3328]
    - [15, 9991.57]
  - - [64, 5888, 1, 256]
    - [1, 6231.04]
  - - [1856, 1, 1, 1]
    - [75, 0.223709]
  - - [1024, 256, 1, 3328]
    - [18, 7039.58]
  - - [704, 704, 1, 256]
    - [26, 7166.41]
  - - [448, 1024, 1, 32]
    - [62, 1357.38]
  - - [6784, 2368, 1, 1280]
    - [26, 10667.3]
  - - [128, 1856, 1, 1280]
    - [14, 6934.24]
  - - [256, 2368, 1, 256]
    - [15, 6567.33]
  - - [1024, 448, 1, 32]
    - [61, 1357.38]
  - - [6784, 1024, 1, 256]
    - [15, 10947.3]
  - - [1408, 6784, 1, 3328]
    - [26, 10079.2]
  - - [2944, 1408, 1, 3328]
    - [16, 10652.5]
  - - [1856, 32, 1, 256]
    - [63, 548.804]
  - - [704, 2368, 1, 32]
    - [60, 2571.96]
  - - [448, 256, 1, 32]
    - [55, 262.135]
  - - [704, 6784, 1, 1]
    - [74, 166.169]
  - - [2368, 6784, 1, 256]
    - [27, 11346.2]
  - - [1856, 64, 1, 256]
    - [39, 3665.24]
  - - [1856, 3584, 1, 3328]
    - [6, 10441.5]
  - - [1, 704, 1, 3328]
    - [82, 9.23455]
  - - [5056, 1408, 1, 32]
    - [54, 3696.21]
  - - [64, 1, 1, 3328]
    - [77, 0.804281]
  - - [5056, 4288, 1, 3328]
    - [10, 9621.69]
  - - [4288, 2368, 1, 1]
    - [74, 201.284]
  - - [704, 448, 1, 256]
    - [26, 4657.92]
  - - [448, 64, 1, 3328]
    - [42, 1592.26]
  - - [2368, 256, 1, 1280]
    - [26, 7487.44]
  - - [2368, 448, 1, 1280]
    - [26, 8542.01]
  - - [6784, 2944, 1, 32]
    - [54, 4200.44]
  - - [64, 4288, 1, 32]
    - [63, 834.854]
  - - [3584, 1856, 1, 1]
    - [75, 175.045]
  - - [128, 448, 1, 3328]
    - [39, 3030.9]
  - - [5888, 2368, 1, 3328]
    - [49, 9731.41]
  - - [2368, 704, 1, 1280]
    - [15, 9939.99]
  - - [1024, 1408, 1, 1280]
    - [26, 9839.41]
  - - [4288, 64, 1, 1280]
    - [13, 6079.54]
  - - [2368, 6784, 1, 1]
    - [69, 215.358]
  - - [2944, 5056, 1, 32]
    - [60, 4087.77]
  - - [5056, 256, 1, 3328]
    - [15, 9969.15]
  - - [448, 448, 1, 1]
    - [70, 19.2153]
  - - [256, 2368, 1, 1280]
    - [18, 7439.56]
  - - [704, 2368, 1, 3328]
    - [26, 10123.8]
  - - [3584, 2944, 1, 256]
    - [15, 11130.7]
  - - [64, 6784, 1, 256]
    - [15, 6357.91]
  - - [3584, 1024, 1, 1280]
    - [15, 11407.8]
  - - [1408, 256, 1, 32]
    - [61, 1128.33]
  - - [64, 1024, 1, 256]
    - [39, 2311.07]
  - - [1408, 32, 1, 32]
    - [57, 116.551]
  - - [256, 32, 1, 1280]
    - [63, 115.178]
  - - [4288, 2944, 1, 1]
    - [74, 207.321]
  - - [5056, 3584, 1, 256]
    - [47, 11234.9]
  - - [2368, 704, 1, 256]
    - [15, 9001.89]
  - - [1856, 1856, 1, 1280]
    - [26, 10779.3]
  - - [64, 32, 1, 32]
    - [55, 4.861]
  - - [4288, 704, 1, 1]
    - [74, 148.729]
  - - [1856, 1024, 1, 1]
    - [72, 130.237]
  - - [4288, 2944, 1, 3328]
    - [27, 9794.94]
  - - [1024, 128, 1, 3328]
    - [39, 5900.44]
  - - [4288, 128, 1, 3328]
    - [22, 7998.25]
  - - [4288, 704, 1, 32]
    - [62, 3134.79]
  - - [1856, 1024, 1, 32]
    - [61, 2683.02]
  - - [1, 448, 1, 3328]
    - [82, 5.66323]
  - - [6784, 2368, 1, 32]
    - [62, 4086.96]
  - - [5888, 5056, 1, 1]
    - [74, 226.922]
  - - [128, 6784, 1, 1280]
    - [25, 9071.76]
  - - [704, 5888, 1, 1]
    - [69, 165.558]
  - - [6784, 6784, 1, 1]
    - [69, 232.779]
  - - [5888, 448, 1, 3328]
    - [26, 9768.25]
  - - [704, 5888, 1, 32]
    - [54, 3365.89]
  - - [704, 5888, 1, 1280]
    - [6, 11354.8]
  - - [1024, 6784, 1, 3328]
    - [26, 10138.3]
  - - [704, 2944, 1, 1280]
    - [27, 10822.9]
  - - [4288, 6784, 1, 256]
    - [15, 11547.3]
  - - [3584, 256, 1, 32]
    - [61, 2043.01]
  - - [1408, 1408, 1, 32]
    - [54, 2789.56]
  - - [1408, 1408, 1, 3328]
    - [26, 10632.1]
  - - [1024, 64, 1, 256]
    - [39, 2335.03]
  - - [4288, 64, 1, 32]
    - [61, 846.808]
  - - [5888, 6784, 1, 32]
    - [54, 4303.08]
  - - [1024, 2944, 1, 3328]
    - [15, 10230.2]
  - - [64, 704, 1, 1280]
    - [30, 2211.76]
  - - [2944, 1856, 1, 256]
    - [15, 10864.9]
  - - [128, 5056, 1, 3328]
    - [5, 9018.33]
  - - [704, 1408, 1, 1]
    - [72, 97.6728]
  - - [6784, 5056, 1, 32]
    - [54, 4332.48]
  - - [1024, 448, 1, 3328]
    - [15, 8072.9]
  - - [5888, 1408, 1, 1]
    - [69, 197.732]
  - - [2944, 4288, 1, 1280]
    - [15, 10760.9]
  - - [64, 32, 1, 3328]
    - [63, 29.0894]
  - - [1024, 4288, 1, 256]
    - [26, 10537.8]
  - - [128, 2368, 1, 256]
    - [13, 5484.3]
  - - [2368, 64, 1, 32]
    - [57, 346.392]
  - - [1408, 1, 1, 3328]
    - [82, 18.1355]
  - - [64, 1408, 1, 32]
    - [57, 196.597]
  - - [2368, 5888, 1, 1]
    - [69, 212.44]
  - - [448, 1856, 1, 256]
    - [15, 7256.33]
  - - [1856, 6784, 1, 3328]
    - [52, 9566.3]
  - - [3584, 128, 1, 256]
    - [15, 6661.21]
  - - [1024, 448, 1, 1280]
    - [15, 7794.5]
  - - [1024, 2368, 1, 32]
    - [62, 2917.8]
  - - [128, 5888, 1, 1]
    - [77, 82.0493]
  - - [64, 5056, 1, 1]
    - [70, 42.4122]
  - - [1856, 256, 1, 32]
    - [61, 1425.36]
  - - [2368, 2368, 1, 3328]
    - [15, 10518.2]
  - - [64, 448, 1, 1]
    - [69, 3.65155]
  - - [3584, 5888, 1, 32]
    - [54, 4136.14]
  - - [3584, 5888, 1, 1280]
    - [45, 10353.2]
  - - [64, 5056, 1, 32]
    - [63, 984.38]
  - - [6784, 704, 1, 256]
    - [15, 10553.1]
  - - [1408, 704, 1, 32]
    - [60, 2162.64]
  - - [1408, 704, 1, 1280]
    - [15, 9606.23]
  - - [2368, 5888, 1, 256]
    - [6, 11273.9]
  - - [2944, 64, 1, 32]
    - [57, 428.386]
  - - [1, 1408, 1, 256]
    - [77, 12.3814]
  - - [64, 2944, 1, 256]
    - [13, 4859.16]
  - - [5888, 5888, 1, 32]
    - [54, 4294.91]
  - - [1856, 1408, 1, 3328]
    - [6, 10818.7]
  - - [1024, 1024, 1, 32]
    - [61, 2276.27]
  - - [6784, 704, 1, 1]
    - [69, 164.054]
  - - [2944, 5056, 1, 1280]
    - [26, 10613.3]
  - - [6784, 2944, 1, 1280]
    - [26, 10429.6]
  - - [6784, 256, 1, 3328]
    - [26, 9926.73]
  - - [5056, 128, 1, 3328]
    - [14, 9379.04]
  - - [128, 128, 1, 1280]
    - [37, 845.098]
  - - [5888, 64, 1, 1]
    - [80, 49.3882]
  - - [1408, 5056, 1, 32]
    - [54, 3718.57]
  - - [2944, 128, 1, 3328]
    - [14, 7896.34]
  - - [5888, 1856, 1, 1280]
    - [15, 10962.7]
  - - [256, 64, 1, 1280]
    - [37, 845.098]
  - - [5888, 256, 1, 1280]
    - [26, 10286.6]
  - - [1856, 5056, 1, 1]
    - [74, 195.794]
  - - [3584, 1856, 1, 1280]
    - [0, 10818.0]
  - - [704, 3584, 1, 256]
    - [16, 9976.72]
  - - [1856, 5056, 1, 32]
    - [62, 3894.05]
  - - [1856, 5056, 1, 3328]
    - [26, 10152.1]
  - - [1024, 2944, 1, 32]
    - [62, 3138.07]
  - - [1408, 6784, 1, 256]
    - [15, 11122.0]
  - - [1024, 2368, 1, 1280]
    - [27, 10320.1]
  - - [1856, 3584, 1, 1]
    - [74, 187.47]
  - - [2944, 5888, 1, 1280]
    - [15, 10658.5]
  - - [1, 1856, 1, 1]
    - [75, 0.21055]
  - - [3584, 3584, 1, 256]
    - [27, 11204.2]
  - - [1856, 2368, 1, 3328]
    - [26, 10492.2]
  - - [5888, 704, 1, 256]
    - [15, 10611.2]
  - - [64, 448, 1, 32]
    - [58, 76.9331]
  - - [6784, 4288, 1, 256]
    - [49, 11349.2]
  - - [128, 64, 1, 3328]
    - [30, 427.457]
  - - [1, 5056, 1, 1280]
    - [77, 48.6441]
  - - [32, 64, 1, 1280]
    - [63, 30.0922]
  - - [1408, 2368, 1, 3328]
    - [15, 10464.7]
  - - [1024, 3584, 1, 256]
    - [52, 10336.8]
  - - [2944, 128, 1, 256]
    - [14, 6321.69]
  - - [6784, 128, 1, 1]
    - [74, 86.8309]
  - - [1408, 256, 1, 3328]
    - [9, 6264.47]
  - - [2368, 1408, 1, 1]
    - [69, 158.486]
  - - [448, 32, 1, 256]
    - [63, 131.766]
  - - [5056, 6784, 1, 1280]
    - [2, 9974.47]
  - - [64, 2368, 1, 256]
    - [13, 3998.07]
  - - [2944, 256, 1, 256]
    - [15, 8113.97]
  - - [1, 128, 1, 256]
    - [77, 1.09493]
  - - [32, 256, 1, 1280]
    - [63, 120.676]
  - - [5888, 1, 1, 256]
    - [81, 46.1415]
  - - [1856, 32, 1, 1280]
    - [63, 846.751]
  - - [6784, 128, 1, 256]
    - [1, 7855.75]
  - - [6784, 64, 1, 1280]
    - [12, 7406.04]
  - - [4288, 1024, 1, 32]
    - [62, 3393.24]
  - - [2944, 448, 1, 1280]
    - [26, 9040.08]
  - - [6784, 32, 1, 1280]
    - [63, 2304.15]
  - - [2944, 64, 1, 1280]
    - [13, 6201.4]
  - - [704, 448, 1, 1]
    - [73, 41.7434]
  - - [32, 128, 1, 32]
    - [60, 9.82991]
  - - [1, 128, 1, 1]
    - [75, 0.0143998]
  - - [32, 4288, 1, 256]
    - [63, 1228.51]
  - - [5888, 1, 1, 1]
    - [73, 0.969378]
  - - [5888, 1856, 1, 3328]
    - [26, 9955.05]
  - - [2368, 3584, 1, 256]
    - [15, 11076.2]
  - - [4288, 1408, 1, 3328]
    - [2, 10108.6]
  - - [1856, 32, 1, 3328]
    - [63, 920.414]
  - - [2944, 32, 1, 256]
    - [63, 843.452]
  - - [128, 64, 1, 1]
    - [81, 0.857262]
  - - [256, 1024, 1, 3328]
    - [34, 7260.93]
  - - [32, 448, 1, 256]
    - [63, 136.485]
  - - [1856, 64, 1, 32]
    - [55, 265.875]
  - - [1856, 64, 1, 3328]
    - [39, 5368.77]
  - - [256, 5056, 1, 256]
    - [15, 9091.66]
  - - [5888, 2944, 1, 3328]
    - [16, 9798.42]
  - - [2368, 1408, 1, 3328]
    - [15, 10315.5]
  - - [5888, 704, 1, 32]
    - [60, 3347.0]
  - - [2944, 704, 1, 1]
    - [70, 134.513]
  - - [6784, 1856, 1, 256]
    - [15, 11203.3]
  - - [1, 704, 1, 256]
    - [77, 6.06723]
  - - [1856, 1856, 1, 1]
    - [74, 162.595]
  - - [5888, 32, 1, 256]
    - [63, 1611.74]
  - - [2368, 1856, 1, 1]
    - [74, 163.447]
  - - [128, 704, 1, 256]
    - [36, 2937.94]
  - - [256, 1408, 1, 3328]
    - [26, 6355.46]
  - - [2944, 128, 1, 1]
    - [75, 50.3651]
  - - [32, 256, 1, 3328]
    - [63, 131.536]
  - - [2944, 704, 1, 3328]
    - [15, 10848.6]
  - - [2368, 1856, 1, 32]
    - [60, 3402.49]
  - - [3584, 128, 1, 1280]
    - [15, 7825.25]
  - - [1024, 5056, 1, 3328]
    - [26, 10344.7]
  - - [256, 32, 1, 32]
    - [67, 31.8813]
  - - [64, 256, 1, 3328]
    - [30, 890.06]
  - - [256, 6784, 1, 1]
    - [77, 122.748]
  - - [1024, 3584, 1, 32]
    - [54, 3394.87]
  - - [256, 6784, 1, 32]
    - [61, 2641.63]
  - - [2944, 1408, 1, 32]
    - [54, 3397.8]
  - - [1024, 32, 1, 256]
    - [63, 301.174]
  - - [4288, 3584, 1, 1]
    - [69, 213.441]
  - - [1, 704, 1, 1]
    - [70, 0.077902]
  - - [5056, 448, 1, 3328]
    - [15, 10548.6]
  - - [3584, 64, 1, 256]
    - [8, 5081.36]
  - - [64, 1856, 1, 32]
    - [55, 272.939]
  - - [64, 1856, 1, 3328]
    - [39, 5347.27]
  - - [5888, 5888, 1, 3328]
    - [27, 9668.26]
  - - [6784, 3584, 1, 32]
    - [54, 4264.41]
  - - [4288, 1856, 1, 256]
    - [15, 10997.1]
  - - [1856, 2944, 1, 256]
    - [15, 10902.5]
  - - [4288, 256, 1, 1]
    - [73, 96.8527]
  - - [64, 128, 1, 32]
    - [60, 17.9637]
  - - [704, 1, 1, 1280]
    - [81, 8.6953]
  - - [1024, 2368, 1, 256]
    - [26, 9384.01]
  - - [6784, 1024, 1, 1]
    - [69, 185.335]
  - - [1024, 1856, 1, 3328]
    - [15, 10214.7]
  - - [5888, 1024, 1, 32]
    - [62, 3663.25]
  - - [3584, 256, 1, 1280]
    - [15, 8906.69]
  - - [1024, 1, 1, 1]
    - [70, 0.122327]
  - - [1408, 5056, 1, 1280]
    - [26, 11041.2]
  - - [5056, 6784, 1, 256]
    - [16, 11149.0]
  - - [256, 1856, 1, 256]
    - [15, 6813.32]
  - - [256, 704, 1, 1]
    - [70, 17.2546]
  - - [256, 128, 1, 32]
    - [58, 91.9158]
  - - [1408, 1856, 1, 32]
    - [62, 3092.89]
  - - [2944, 5056, 1, 1]
    - [69, 213.311]
  - - [448, 128, 1, 1]
    - [70, 5.45147]
  - - [256, 704, 1, 32]
    - [57, 416.342]
  - - [256, 704, 1, 1280]
    - [31, 4769.01]
  - - [1, 2368, 1, 1]
    - [75, 0.266382]
  - - [5888, 5888, 1, 1280]
    - [16, 9946.42]
  - - [256, 2944, 1, 1280]
    - [26, 9315.37]
  - - [2944, 256, 1, 3328]
    - [26, 8681.92]
  - - [5056, 2944, 1, 1280]
    - [49, 10493.8]
  - - [704, 1024, 1, 3328]
    - [15, 9172.29]
  - - [2368, 1856, 1, 1280]
    - [51, 10889.5]
  - - [448, 2944, 1, 1]
    - [72, 105.979]
  - - [6784, 2944, 1, 1]
    - [74, 219.915]
  - - [2944, 1024, 1, 32]
    - [60, 3168.58]
  - - [2944, 1024, 1, 1280]
    - [2, 10870.5]
  - - [1408, 64, 1, 32]
    - [57, 204.88]
  - - [2368, 4288, 1, 256]
    - [15, 11232.7]
  - - [448, 1856, 1, 1280]
    - [15, 8121.89]
  - - [2368, 448, 1, 1]
    - [75, 92.993]
  - - [448, 2944, 1, 32]
    - [61, 2252.02]
  - - [448, 2944, 1, 1280]
    - [15, 9036.5]
  - - [2944, 6784, 1, 1280]
    - [0, 10314.6]
  - - [256, 6784, 1, 1280]
    - [26, 10344.5]
  - - [5056, 128, 1, 256]
    - [14, 7659.32]
  - - [3584, 2368, 1, 32]
    - [62, 3826.95]
  - - [704, 32, 1, 32]
    - [57, 57.5865]
  - - [6784, 3584, 1, 3328]
    - [16, 9636.86]
  - - [128, 32, 1, 256]
    - [63, 37.0554]
  - - [128, 1408, 1, 1280]
    - [13, 6023.55]
  - - [64, 32, 1, 1280]
    - [63, 25.6623]
  - - [128, 1856, 1, 3328]
    - [14, 7315.36]
  - - [2944, 2944, 1, 256]
    - [16, 11060.8]
  - - [5056, 2368, 1, 1280]
    - [15, 10879.3]
  - - [448, 128, 1, 32]
    - [60, 129.017]
  - - [32, 5056, 1, 3328]
    - [63, 1867.14]
  - - [448, 2944, 1, 3328]
    - [15, 8857.13]
  - - [2944, 1024, 1, 1]
    - [69, 158.971]
  - - [256, 4288, 1, 1]
    - [78, 95.6084]
  - - [2368, 128, 1, 1280]
    - [13, 6758.05]
  - - [3584, 704, 1, 256]
    - [26, 9731.78]
  - - [2368, 5888, 1, 3328]
    - [16, 9706.53]
  - - [1408, 3584, 1, 32]
    - [60, 3482.29]
  - - [2944, 4288, 1, 32]
    - [62, 3995.11]
  - - [5888, 1408, 1, 1280]
    - [26, 11142.8]
  - - [3584, 5056, 1, 1280]
    - [26, 10379.4]
  - - [5888, 6784, 1, 1280]
    - [27, 10028.1]
  - - [64, 1856, 1, 1]
    - [70, 11.0589]
  - - [704, 128, 1, 32]
    - [57, 205.963]
  - - [128, 3584, 1, 3328]
    - [26, 8076.1]
  - - [256, 4288, 1, 3328]
    - [26, 8599.34]
  - - [1, 1408, 1, 1280]
    - [82, 17.2917]
  - - [6784, 1408, 1, 32]
    - [60, 3903.78]
  - - [1856, 704, 1, 32]
    - [61, 2475.62]
  - - [128, 4288, 1, 1]
    - [75, 62.7919]
  - - [704, 5056, 1, 3328]
    - [15, 10744.7]
  - - [1024, 3584, 1, 3328]
    - [26, 11046.6]
  - - [3584, 1024, 1, 3328]
    - [15, 10578.8]
  - - [1856, 1408, 1, 1]
    - [69, 154.726]
  - - [2944, 448, 1, 32]
    - [63, 2243.11]
  - - [128, 448, 1, 256]
    - [41, 2043.01]
  - - [128, 1024, 1, 1]
    - [70, 12.5494]
  - - [32, 32, 1, 256]
    - [63, 9.51296]
  - - [4288, 5056, 1, 1280]
    - [15, 10301.4]
  - - [1856, 1856, 1, 3328]
    - [15, 9974.87]
  - - [3584, 1856, 1, 3328]
    - [49, 10186.7]
  - - [4288, 2368, 1, 3328]
    - [2, 9943.4]
  - - [256, 64, 1, 32]
    - [59, 58.9783]
  - - [1, 1024, 1, 1280]
    - [82, 12.3996]
  - - [32, 1408, 1, 256]
    - [63, 427.776]
  - - [448, 6784, 1, 32]
    - [54, 3171.29]
  - - [5888, 3584, 1, 256]
    - [2, 11421.8]
  - - [32, 1024, 1, 256]
    - [63, 307.726]
  - - [5888, 448, 1, 1280]
    - [26, 10349.7]
  - - [704, 5888, 1, 3328]
    - [6, 10388.7]
  - - [1024, 1408, 1, 256]
    - [6, 8711.01]
  - - [3584, 2944, 1, 1280]
    - [26, 10758.3]
  - - [1, 5056, 1, 256]
    - [77, 39.8018]
  - - [256, 1024, 1, 1]
    - [80, 37.6481]
  - - [32, 32, 1, 3328]
    - [63, 16.2791]
  - - [5056, 128, 1, 32]
    - [61, 1664.07]
  - - [2368, 1, 1, 3328]
    - [77, 31.2166]
  - - [4288, 1856, 1, 1280]
    - [26, 10880.5]
  - - [3584, 5888, 1, 1]
    - [74, 220.322]
  - - [5888, 4288, 1, 256]
    - [15, 11482.2]
  - - [1024, 2944, 1, 1280]
    - [26, 10906.9]
  - - [6784, 1, 1, 1]
    - [75, 1.10345]
  - - [1408, 64, 1, 1280]
    - [36, 4076.17]
  - - [1, 256, 1, 1280]
    - [82, 3.36391]
  - - [2944, 3584, 1, 256]
    - [15, 11137.5]
  - - [1, 128, 1, 1280]
    - [82, 1.52012]
  - - [1024, 256, 1, 32]
    - [63, 905.946]
  - - [5888, 1, 1, 1280]
    - [81, 56.649]
  - - [2368, 32, 1, 1280]
    - [63, 1077.67]
  - - [6784, 448, 1, 1]
    - [75, 148.114]
  - - [6784, 128, 1, 1280]
    - [1, 9165.95]
  - - [448, 2368, 1, 1280]
    - [26, 8510.29]
  - - [6784, 2368, 1, 3328]
    - [49, 9826.31]
  - - [1, 64, 1, 256]
    - [77, 0.530398]
  - - [704, 128, 1, 1]
    - [79, 8.27551]
  - - [1408, 4288, 1, 32]
    - [54, 3612.37]
  - - [32, 1408, 1, 3328]
    - [63, 712.25]
  - - [256, 448, 1, 256]
    - [13, 3538.64]
  - - [1856, 1024, 1, 1280]
    - [27, 9903.6]
  - - [1024, 448, 1, 1]
    - [73, 58.9807]
  - - [4288, 3584, 1, 1280]
    - [15, 10597.6]
  - - [448, 1024, 1, 1280]
    - [26, 7840.76]
  - - [5056, 1856, 1, 1]
    - [69, 195.493]
  - - [5888, 2368, 1, 256]
    - [47, 11177.2]
  - - [1408, 1024, 1, 32]
    - [61, 2432.95]
  - - [32, 704, 1, 256]
    - [63, 213.299]
  - - [2944, 1, 1, 256]
    - [77, 25.1838]
  - - [704, 1024, 1, 32]
    - [61, 1831.86]
  - - [5056, 1856, 1, 32]
    - [62, 3894.08]
  - - [5056, 1856, 1, 1280]
    - [26, 11018.6]
  - - [1, 64, 1, 1]
    - [70, 0.0070816]
  - - [1408, 5888, 1, 3328]
    - [26, 10293.6]
  - - [1408, 704, 1, 3328]
    - [26, 9872.01]
  - - [5056, 704, 1, 3328]
    - [15, 10279.8]
  - - [704, 64, 1, 1280]
    - [30, 2218.06]
  - - [1, 704, 1, 1280]
    - [82, 8.54264]
  - - [1408, 256, 1, 1]
    - [73, 48.1754]
  - - [5888, 4288, 1, 32]
    - [54, 4229.04]
  - - [1408, 3584, 1, 256]
    - [2, 10595.0]
  - - [1408, 6784, 1, 1]
    - [74, 197.165]
  - - [2944, 1, 1, 1]
    - [70, 0.34558]
  - - [256, 1856, 1, 3328]
    - [15, 8380.94]
  - - [4288, 128, 1, 1280]
    - [12, 7748.43]
  - - [128, 128, 1, 1]
    - [73, 2.54213]
  - - [6784, 256, 1, 1280]
    - [26, 10330.2]
  - - [128, 4288, 1, 256]
    - [14, 6540.79]
  - - [2368, 6784, 1, 1280]
    - [15, 10739.2]
  - - [128, 128, 1, 32]
    - [62, 57.5413]
  - - [128, 128, 1, 3328]
    - [30, 890.06]
  - - [128, 1408, 1, 32]
    - [57, 425.433]
  - - [6784, 128, 1, 32]
    - [61, 1933.57]
  - - [1408, 448, 1, 1]
    - [73, 71.558]
  - - [2368, 704, 1, 3328]
    - [15, 9579.91]
  - - [704, 128, 1, 3328]
    - [36, 4353.15]
  - - [2944, 1856, 1, 32]
    - [62, 3560.19]
  - - [5888, 1856, 1, 1]
    - [69, 202.923]
  - - [1408, 32, 1, 1280]
    - [63, 640.775]
  - - [704, 1, 1, 256]
    - [77, 6.19071]
  - - [1856, 2944, 1, 3328]
    - [15, 10432.3]
  - - [3584, 2944, 1, 1]
    - [70, 189.664]
  - - [5888, 64, 1, 256]
    - [8, 5973.87]
  - - [64, 5056, 1, 1280]
    - [24, 7113.69]
  - - [1408, 2944, 1, 1]
    - [69, 167.039]
  - - [4288, 1408, 1, 32]
    - [54, 3602.36]
  - - [5888, 2944, 1, 256]
    - [16, 11285.8]
  - - [128, 64, 1, 1280]
    - [7, 391.034]
  - - [1408, 2944, 1, 32]
    - [60, 3483.78]
  - - [1, 3584, 1, 1280]
    - [82, 45.1712]
  - - [64, 64, 1, 32]
    - [60, 8.93652]
  - - [448, 1408, 1, 32]
    - [63, 1593.52]
  - - [128, 5056, 1, 256]
    - [14, 7581.51]
  - - [1, 1, 1, 1280]
    - [77, 0.0128091]
  - - [64, 704, 1, 256]
    - [38, 1588.86]
  - - [3584, 1408, 1, 1280]
    - [16, 11179.1]
  - - [5888, 6784, 1, 256]
    - [16, 10911.6]
  - - [6784, 5888, 1, 1]
    - [74, 229.753]
  - - [64, 4288, 1, 256]
    - [13, 5018.01]
  - - [1, 448, 1, 1280]
    - [82, 5.36838]
  - - [1024, 1024, 1, 1]
    - [69, 104.082]
  - - [6784, 5888, 1, 1280]
    - [27, 9933.7]
  - - [1024, 4288, 1, 32]
    - [62, 3357.21]
  - - [1856, 1, 1, 1280]
    - [81, 22.8261]
  - - [3584, 5888, 1, 256]
    - [15, 11336.6]
  - - [5056, 2368, 1, 1]
    - [74, 205.63]
  - - [256, 1408, 1, 1280]
    - [15, 6172.8]
  - - [64, 256, 1, 32]
    - [60, 35.389]
  - - [64, 5888, 1, 3328]
    - [25, 7870.67]
  - - [6784, 64, 1, 3328]
    - [12, 7716.01]
  - - [5056, 448, 1, 1]
    - [75, 136.509]
  - - [2944, 448, 1, 3328]
    - [26, 8695.95]
  - - [1856, 6784, 1, 256]
    - [15, 11188.8]
  - - [4288, 32, 1, 1280]
    - [63, 1492.14]
  - - [448, 1408, 1, 1280]
    - [15, 7835.79]
  - - [5056, 448, 1, 32]
    - [60, 2903.49]
  - - [3584, 2944, 1, 32]
    - [62, 3919.18]
  - - [2368, 128, 1, 1]
    - [77, 41.3314]
  - - [128, 3584, 1, 32]
    - [63, 1348.09]
  - - [3584, 1856, 1, 32]
    - [62, 3651.26]
  - - [4288, 64, 1, 3328]
    - [24, 6434.93]
  - - [5056, 64, 1, 256]
    - [13, 5764.41]
  - - [1024, 1856, 1, 1]
    - [68, 128.281]
  - - [64, 448, 1, 3328]
    - [42, 1594.22]
  - - [4288, 1408, 1, 1280]
    - [15, 10800.8]
  - - [32, 5056, 1, 256]
    - [63, 1426.36]
  - - [704, 128, 1, 256]
    - [36, 2937.94]
  - - [704, 5056, 1, 1]
    - [72, 167.424]
  - - [256, 1024, 1, 32]
    - [63, 913.245]
  - - [256, 1024, 1, 1280]
    - [31, 6832.09]
  - - [2368, 128, 1, 256]
    - [13, 5513.14]
  - - [2368, 1408, 1, 1280]
    - [15, 11202.0]
  - - [128, 256, 1, 32]
    - [57, 74.8956]
  - - [64, 6784, 1, 32]
    - [63, 1275.93]
  - - [6784, 32, 1, 256]
    - [63, 1812.13]
  - - [5056, 2944, 1, 1]
    - [69, 212.186]
  - - [3584, 128, 1, 1]
    - [73, 58.9807]
  - - [1024, 4288, 1, 1280]
    - [15, 10961.1]
  - - [1856, 4288, 1, 1]
    - [69, 189.482]
  - - [128, 2944, 1, 256]
    - [14, 6260.97]
  - - [3584, 4288, 1, 256]
    - [26, 11204.8]
  - - [3584, 128, 1, 32]
    - [61, 1376.21]
  - - [3584, 128, 1, 3328]
    - [15, 8079.24]
  - - [704, 5056, 1, 256]
    - [2, 10354.4]
  - - [1856, 4288, 1, 32]
    - [60, 3773.85]
  - - [5056, 1, 1, 1280]
    - [81, 49.1644]
  - - [64, 256, 1, 1280]
    - [37, 845.098]
  - - [4288, 1024, 1, 1280]
    - [51, 10965.8]
  - - [1, 4288, 1, 256]
    - [77, 34.7047]
  - - [2944, 3584, 1, 1]
    - [74, 202.615]
  - - [4288, 6784, 1, 32]
    - [54, 4321.32]
  - - [4288, 4288, 1, 256]
    - [15, 11351.1]
  - - [3584, 3584, 1, 1]
    - [72, 210.696]
  - - [3584, 1408, 1, 256]
    - [15, 10550.1]
  - - [704, 3584, 1, 3328]
    - [26, 10523.2]
  - - [5056, 448, 1, 1280]
    - [15, 10729.0]
  - - [1408, 2944, 1, 1280]
    - [2, 11380.0]
  - - [5888, 704, 1, 1280]
    - [20, 11170.6]
  - - [64, 64, 1, 256]
    - [29, 127.525]
  - - [704, 1408, 1, 1280]
    - [15, 9649.56]
  - - [4288, 5888, 1, 256]
    - [2, 11486.8]
  - - [3584, 3584, 1, 3328]
    - [16, 9983.81]
  - - [2944, 6784, 1, 32]
    - [54, 4171.99]
  - - [448, 64, 1, 32]
    - [57, 65.1891]
  - - [5056, 256, 1, 1]
    - [70, 109.204]
  - - [64, 6784, 1, 1280]
    - [15, 7413.4]
  - - [2944, 2368, 1, 3328]
    - [15, 10280.0]
  - - [1, 4288, 1, 1]
    - [77, 0.697463]
  - - [1408, 128, 1, 256]
    - [13, 4613.5]
  - - [1024, 1856, 1, 1280]
    - [27, 9897.64]
  - - [1024, 5888, 1, 256]
    - [26, 10897.8]
  - - [704, 1408, 1, 256]
    - [15, 8500.31]
  - - [6784, 2944, 1, 3328]
    - [27, 9581.38]
  - - [1408, 2368, 1, 256]
    - [15, 10334.0]
  - - [1024, 1408, 1, 1]
    - [72, 115.853]
  - - [64, 128, 1, 1280]
    - [7, 389.957]
  - - [5888, 32, 1, 3328]
    - [63, 2132.75]
  - - [1408, 5056, 1, 256]
    - [2, 10909.9]
  - - [1024, 1408, 1, 32]
    - [61, 2452.09]
  - - [4288, 1024, 1, 1]
    - [69, 165.115]
  - - [448, 704, 1, 256]
    - [15, 4677.89]
  - - [704, 3584, 1, 32]
    - [60, 3002.67]
  - - [1856, 256, 1, 3328]
    - [15, 8283.36]
  - - [6784, 448, 1, 256]
    - [52, 9918.08]
  - - [4288, 4288, 1, 1]
    - [74, 216.217]
  - - [256, 2944, 1, 1]
    - [70, 80.7483]
  - - [64, 2368, 1, 3328]
    - [21, 5451.36]
  - - [256, 704, 1, 3328]
    - [31, 5019.76]
  - - [1, 2944, 1, 1]
    - [75, 0.325754]
  - - [1024, 1024, 1, 256]
    - [26, 8881.83]
  - - [4288, 704, 1, 1280]
    - [15, 10953.9]
  - - [3584, 1, 1, 1]
    - [77, 0.597333]
  - - [256, 2944, 1, 32]
    - [63, 1860.47]
  - - [6784, 4288, 1, 3328]
    - [10, 9630.48]
  - - [5056, 2944, 1, 3328]
    - [27, 9839.84]
  - - [704, 1024, 1, 1280]
    - [15, 8897.63]
  - - [256, 3584, 1, 1280]
    - [26, 8921.75]
  - - [2368, 1856, 1, 3328]
    - [26, 10704.4]
  - - [1856, 4288, 1, 1280]
    - [26, 11052.8]
  - - [1, 1024, 1, 256]
    - [77, 8.75945]
  - - [2944, 1024, 1, 3328]
    - [28, 10376.0]
  - - [2944, 256, 1, 32]
    - [61, 1892.88]
  - - [128, 1, 1, 3328]
    - [82, 1.63277]
  - - [5888, 5056, 1, 32]
    - [54, 4259.73]
  - - [4288, 1408, 1, 1]
    - [69, 181.119]
  - - [3584, 448, 1, 32]
    - [62, 2468.36]
  - - [3584, 448, 1, 1280]
    - [26, 9411.27]
  - - [2944, 6784, 1, 3328]
    - [27, 9597.06]
  - - [1024, 1408, 1, 3328]
    - [26, 9535.51]
  - - [6784, 1024, 1, 1280]
    - [44, 10786.0]
  - - [6784, 3584, 1, 1280]
    - [15, 10393.3]
  - - [1, 5056, 1, 3328]
    - [77, 50.4327]
  - - [4288, 64, 1, 1]
    - [77, 37.8032]
  - - [128, 2368, 1, 32]
    - [63, 928.61]
  - - [128, 1408, 1, 3328]
    - [13, 6451.66]
  - - [2944, 32, 1, 3328]
    - [63, 1440.59]
  - - [704, 1856, 1, 256]
    - [15, 9272.23]
  - - [2944, 2944, 1, 1]
    - [74, 196.643]
  - - [1408, 4288, 1, 256]
    - [2, 10733.0]
  - - [5888, 5056, 1, 256]
    - [6, 11173.0]
  - - [256, 5056, 1, 3328]
    - [15, 10067.5]
  - - [2368, 64, 1, 1280]
    - [11, 5124.73]
  - - [1856, 448, 1, 32]
    - [60, 1851.54]
  - - [1408, 448, 1, 256]
    - [15, 6833.57]
  - - [32, 128, 1, 256]
    - [63, 38.465]
  - - [448, 1024, 1, 1]
    - [70, 57.8794]
  - - [448, 6784, 1, 1]
    - [72, 159.644]
  - - [704, 2944, 1, 256]
    - [16, 9989.63]
  - - [1408, 1408, 1, 256]
    - [16, 9502.35]
  - - [1, 64, 1, 1280]
    - [77, 0.73044]
  - - [2944, 2368, 1, 1]
    - [72, 185.624]
  - - [4288, 448, 1, 32]
    - [61, 2685.63]
  - - [4288, 448, 1, 1280]
    - [4, 10013.3]
  - - [2944, 704, 1, 32]
    - [61, 2878.89]
  - - [1024, 704, 1, 256]
    - [26, 7689.24]
  - - [6784, 256, 1, 1]
    - [75, 122.748]
  - - [3584, 5056, 1, 1]
    - [74, 220.381]
  - - [2368, 2368, 1, 1]
    - [72, 178.112]
  - - [64, 5888, 1, 1]
    - [73, 49.3914]
  - - [1408, 3584, 1, 1280]
    - [2, 11194.9]
  - - [6784, 448, 1, 1280]
    - [15, 11016.6]
  - - [3584, 5056, 1, 3328]
    - [52, 9774.17]
  - - [2368, 2368, 1, 32]
    - [54, 3551.78]
  - - [64, 5888, 1, 32]
    - [63, 1138.36]
  - - [1856, 448, 1, 256]
    - [26, 7238.2]
  - - [3584, 2368, 1, 1280]
    - [15, 11137.6]
  - - [128, 1024, 1, 256]
    - [39, 4044.41]
  - - [3584, 64, 1, 3328]
    - [33, 6934.81]
  - - [5888, 2944, 1, 32]
    - [60, 4114.38]
  - - [2944, 1, 1, 1280]
    - [77, 35.9765]
  - - [1856, 2944, 1, 32]
    - [62, 3592.67]
  - - [5056, 1408, 1, 1]
    - [69, 188.434]
  - - [5888, 1408, 1, 3328]
    - [15, 10349.1]
  - - [448, 4288, 1, 256]
    - [15, 9182.32]
  - - [256, 448, 1, 1]
    - [70, 10.9029]
  - - [128, 5888, 1, 3328]
    - [26, 9594.66]
  - - [6784, 1024, 1, 32]
    - [60, 3700.28]
  - - [256, 448, 1, 32]
    - [57, 264.935]
  - - [6784, 3584, 1, 1]
    - [69, 223.132]
  - - [2944, 2368, 1, 32]
    - [62, 3731.79]
  - - [3584, 6784, 1, 3328]
    - [27, 9718.48]
  - - [448, 128, 1, 1280]
    - [41, 2814.97]
  - - [64, 3584, 1, 32]
    - [57, 492.967]
  - - [64, 3584, 1, 1280]
    - [14, 6650.16]
  - - [6784, 1408, 1, 256]
    - [15, 11129.6]
  - - [5056, 1024, 1, 32]
    - [54, 3522.12]
  - - [1024, 5056, 1, 1280]
    - [26, 11485.6]
  - - [4288, 3584, 1, 256]
    - [2, 11307.4]
  - - [1408, 1024, 1, 3328]
    - [26, 9657.79]
  - - [2368, 256, 1, 3328]
    - [9, 7633.08]
  - - [448, 6784, 1, 1280]
    - [15, 11016.6]
  - - [1856, 5888, 1, 1]
    - [74, 205.752]
  - - [256, 5888, 1, 32]
    - [61, 2504.39]
  - - [3584, 1, 1, 3328]
    - [77, 47.5256]
  - - [4288, 32, 1, 256]
    - [63, 1222.18]
  - - [256, 64, 1, 1]
    - [73, 2.54232]
  - - [4288, 5056, 1, 32]
    - [54, 4214.91]
  - - [4288, 5056, 1, 3328]
    - [27, 9553.18]
  - - [1856, 5888, 1, 32]
    - [54, 4021.14]
  - - [1856, 5888, 1, 1280]
    - [3, 10972.2]
  - - [256, 256, 1, 1280]
    - [39, 3254.11]
  - - [704, 2368, 1, 1280]
    - [26, 9933.12]
  - - [5056, 32, 1, 1280]
    - [63, 1748.39]
  - - [4288, 2368, 1, 1280]
    - [6, 10774.7]
  - - [2944, 5056, 1, 256]
    - [15, 11398.3]
  - - [4288, 128, 1, 32]
    - [61, 1419.8]
  - - [64, 5888, 1, 1280]
    - [25, 7484.42]
  - - [1, 1856, 1, 1280]
    - [82, 22.427]
  - - [2944, 4288, 1, 1]
    - [74, 207.069]
  - - [5056, 5888, 1, 32]
    - [54, 4334.38]
  - - [704, 4288, 1, 1]
    - [74, 157.955]
  - - [704, 1, 1, 3328]
    - [81, 9.22917]
  - - [448, 256, 1, 1280]
    - [36, 4833.5]
  - - [5888, 6784, 1, 1]
    - [69, 229.167]
  - - [2368, 5056, 1, 3328]
    - [17, 9608.91]
  - - [704, 704, 1, 1280]
    - [15, 8445.73]
  - - [128, 32, 1, 3328]
    - [63, 61.4012]
  - - [1024, 6784, 1, 32]
    - [62, 3682.11]
  - - [2368, 1408, 1, 256]
    - [26, 10187.8]
  - - [3584, 2944, 1, 3328]
    - [26, 9842.88]
  - - [128, 1856, 1, 256]
    - [14, 5401.43]
  - - [32, 32, 1, 1280]
    - [63, 14.8816]
  - - [1408, 5888, 1, 1]
    - [69, 196.688]
  - - [1, 3584, 1, 256]
    - [82, 36.0053]
  - - [704, 4288, 1, 32]
    - [54, 3165.19]
  - - [1408, 5888, 1, 32]
    - [54, 3863.31]
  - - [32, 1856, 1, 256]
    - [63, 560.798]
  - - [6784, 2368, 1, 1]
    - [74, 214.293]
  - - [1856, 1, 1, 3328]
    - [77, 23.9609]
  - - [5056, 1408, 1, 256]
    - [16, 10924.5]
  - - [1, 1, 1, 256]
    - [77, 0.00907062]
  - - [2944, 1408, 1, 256]
    - [2, 10714.4]
  - - [4288, 1, 1, 1]
    - [73, 0.723591]
  - - [2368, 2368, 1, 256]
    - [2, 10771.9]
  - - [1, 448, 1, 256]
    - [77, 3.78539]
  - - [1856, 704, 1, 1]
    - [70, 108.885]
  - - [3584, 32, 1, 3328]
    - [63, 1766.39]
  - - [128, 3584, 1, 1]
    - [73, 57.8794]
  - - [1856, 1, 1, 256]
    - [77, 16.2796]
  - - [32, 5888, 1, 32]
    - [63, 621.322]
  - - [1024, 5888, 1, 1]
    - [74, 182.496]
  - - [6784, 32, 1, 3328]
    - [65, 2290.52]
  - - [2368, 704, 1, 1]
    - [70, 119.072]
  - - [1408, 32, 1, 256]
    - [63, 411.926]
  - - [448, 2368, 1, 1]
    - [75, 94.2195]
  - - [1856, 3584, 1, 256]
    - [2, 10931.2]
  - - [2944, 64, 1, 256]
    - [13, 4718.46]
  - - [2368, 704, 1, 32]
    - [62, 2590.44]
  - - [256, 5888, 1, 1280]
    - [15, 10323.3]
  - - [448, 2368, 1, 32]
    - [61, 2092.56]
  - - [448, 2368, 1, 3328]
    - [15, 8344.01]
  - - [64, 1408, 1, 256]
    - [36, 2937.94]
  - - [5056, 32, 1, 32]
    - [61, 559.139]
  - - [1024, 704, 1, 3328]
    - [15, 9182.7]
  - - [32, 5888, 1, 3328]
    - [63, 2096.83]
  - - [256, 64, 1, 3328]
    - [30, 892.215]
  - - [32, 1408, 1, 1280]
    - [63, 665.993]
  - - [64, 32, 1, 256]
    - [63, 18.2415]
  - - [1856, 1024, 1, 3328]
    - [15, 10028.8]
  - - [2368, 1, 1, 1]
    - [70, 0.282898]
  - - [5056, 2368, 1, 3328]
    - [26, 9926.33]
  - - [128, 1, 1, 1280]
    - [77, 1.53276]
  - - [704, 4288, 1, 1280]
    - [15, 10944.7]
  - - [704, 256, 1, 256]
    - [18, 3844.78]
- null
