library/src/blas3/Tensile/Logic/asm_full/vega10_Cijk_Alik_Bljk_HB.yaml
- {MinimumRequiredVersion: 4.4.0}
- vega10
- gfx900
- [Device 6863, Device 6862, Device 687f, Device 6860, Device 6861, 'Vega 10 XTX [Radeon
    SolutionIndex: 0
    SolutionNameMin: Cijk_Alik_Bljk_HB_MT016x016x16_PGR1_PLR1_TT02_02
    SolutionIndex: 1
    SolutionNameMin: Cijk_Alik_Bljk_HB_MT032x032x16_PGR1_PLR1_TT04_04
    SolutionIndex: 2
    SolutionNameMin: Cijk_Alik_Bljk_HB_MT064x032x16_PGR1_PLR1_TT04_04
    SolutionIndex: 3
    SolutionNameMin: Cijk_Alik_Bljk_HB_MT016x016x32_PGR1_PLR1_TT02_02
    SolutionIndex: 4
    SolutionNameMin: Cijk_Alik_Bljk_HB_MT032x032x32_PGR1_PLR1_TT04_04
    SolutionIndex: 5
    SolutionNameMin: Cijk_Alik_Bljk_HB_MT032x016x32_PGR1_PLR1_TT02_02
    SolutionIndex: 6
    SolutionNameMin: Cijk_Alik_Bljk_HB_MT128x032x32_PGR1_PLR1_TT04_04
    SolutionIndex: 7
    SolutionNameMin: Cijk_Alik_Bljk_HB_MT256x064x32_PGR1_PLR1_TT08_08
    SolutionIndex: 8
    SolutionNameMin: Cijk_Alik_Bljk_HB_MT016x016x64_PGR1_PLR1_TT02_02
    SolutionIndex: 9
    SolutionNameMin: Cijk_Alik_Bljk_HB_MT032x032x16_PGR1_PLR1_TT04_04
    SolutionIndex: 10
    SolutionNameMin: Cijk_Alik_Bljk_HB_MT016x016x24_PGR1_PLR1_TT02_02
    SolutionIndex: 11
    SolutionNameMin: Cijk_Alik_Bljk_HB_MT032x016x24_PGR1_PLR1_TT04_02
    SolutionIndex: 12
    SolutionNameMin: Cijk_Alik_Bljk_HB_MT032x032x24_PGR1_PLR1_TT04_04
    SolutionIndex: 13
    SolutionNameMin: Cijk_Alik_Bljk_HB_MT016x016x24_PGR1_PLR1_TT02_02
    SolutionIndex: 14
    SolutionNameMin: Cijk_Alik_Bljk_HB_MT032x032x24_PGR1_PLR1_TT04_04
    SolutionIndex: 15
    SolutionNameMin: Cijk_Alik_Bljk_HB_MT064x032x32_PGR1_PLR1_TT08_04
    SolutionIndex: 16
    SolutionNameMin: Cijk_Alik_Bljk_HB_MT064x032x32_PGR1_PLR1_TT04_04
    SolutionIndex: 17
    SolutionNameMin: Cijk_Alik_Bljk_HB_MT128x032x32_PGR1_PLR1_TT04_04
    SolutionIndex: 18
    SolutionNameMin: Cijk_Alik_Bljk_HB_MT128x128x08_PGR1_PLR1_TT08_08
    SolutionIndex: 19
    SolutionNameMin: Cijk_Alik_Bljk_HB_MT064x064x16_PGR1_PLR1_TT04_04
    SolutionIndex: 20
    SolutionNameMin: Cijk_Alik_Bljk_HB_MT128x064x16_PGR1_PLR1_TT08_04
    SolutionIndex: 21
    SolutionNameMin: Cijk_Alik_Bljk_HB_MT128x128x16_PGR1_PLR1_TT08_08
    SolutionIndex: 22
    SolutionNameMin: Cijk_Alik_Bljk_HB_MT064x064x32_PGR1_PLR1_TT04_04
    SolutionIndex: 23
    SolutionNameMin: Cijk_Alik_Bljk_HB_MT128x128x32_PGR1_PLR1_TT08_08
    SolutionIndex: 24
    SolutionNameMin: Cijk_Alik_Bljk_HB_MT064x128x08_PGR0_PLR0_TT04_08
    SolutionIndex: 25
    SolutionNameMin: Cijk_Alik_Bljk_HB_MT064x064x08_PGR1_PLR1_TT04_04
    SolutionIndex: 26
    SolutionNameMin: Cijk_Alik_Bljk_HB_MT064x064x04_PGR0_PLR1_TT04_04
    SolutionIndex: 27
    SolutionNameMin: Cijk_Alik_Bljk_HB_MT064x064x08_PGR1_PLR1_TT04_04
- - - [2560, 7000, 1, 2560]
    - [21, 21344.7]
  - - [7680, 12000, 1, 2560]
    - [21, 23186.3]
  - - [5124, 9124, 1, 1760]
    - [21, 22926.4]
  - - [1760, 32, 1, 1760]
    - [13, 3055.07]
  - - [512, 24000, 1, 1536]
    - [21, 20157.7]
  - - [3072, 24000, 1, 1024]
    - [21, 20353.5]
  - - [2048, 400, 1, 512]
    - [21, 9059.27]
  - - [2560, 128, 1, 2560]
    - [9, 7362.92]
  - - [3072, 16, 1, 1024]
    - [0, 1183.7]
  - - [512, 48000, 1, 2816]
    - [21, 23218.4]
  - - [512, 48000, 1, 2048]
    - [23, 16565.6]
  - - [1760, 64, 1, 1760]
    - [13, 5021.06]
  - - [2048, 1600, 1, 2048]
    - [22, 10216.6]
  - - [512, 48000, 1, 1536]
    - [21, 21831.3]
  - - [2560, 32, 1, 2560]
    - [13, 3534.4]
  - - [8448, 5984, 1, 2816]
    - [21, 23557.2]
  - - [4096, 3200, 1, 1024]
    - [23, 16171.7]
  - - [1024, 24000, 1, 2560]
    - [21, 20611.8]
  - - [1760, 6400, 1, 1760]
    - [18, 23199.7]
  - - [5124, 9124, 1, 2048]
    - [23, 17543.7]
  - - [1024, 700, 1, 512]
    - [22, 9073.87]
  - - [4608, 32, 1, 1536]
    - [14, 4126.22]
  - - [3072, 64, 1, 1024]
    - [16, 3633.4]
  - - [16384, 3200, 1, 4096]
    - [23, 16999.4]
  - - [2560, 16, 1, 2560]
    - [10, 2002.17]
  - - [1024, 48000, 1, 2560]
    - [21, 22637.2]
  - - [8448, 48000, 1, 2816]
    - [21, 23864.8]
  - - [2048, 32, 1, 2048]
    - [0, 1699.69]
  - - [2560, 3200, 1, 2560]
    - [23, 19209.2]
  - - [16384, 800, 1, 4096]
    - [23, 14440.1]
  - - [4608, 24000, 1, 1536]
    - [21, 23409.5]
  - - [7680, 48000, 1, 2560]
    - [21, 23729.1]
  - - [3072, 48000, 1, 1024]
    - [21, 22004.3]
  - - [1760, 16, 1, 1760]
    - [13, 1563.21]
  - - [8192, 3200, 1, 2048]
    - [23, 15942.5]
  - - [512, 24000, 1, 2816]
    - [21, 22654.0]
  - - [4096, 400, 1, 1024]
    - [23, 10764.1]
  - - [6144, 48000, 1, 2560]
    - [21, 23243.5]
  - - [4608, 48000, 1, 1536]
    - [21, 23517.2]
  - - [4096, 128, 1, 4096]
    - [7, 4761.02]
  - - [2048, 800, 1, 512]
    - [23, 11970.6]
  - - [4608, 5984, 1, 1536]
    - [21, 22033.3]
  - - [4096, 1600, 1, 1024]
    - [23, 12920.6]
  - - [6144, 5984, 1, 2048]
    - [23, 17590.7]
  - - [7680, 24000, 1, 2560]
    - [21, 23385.9]
  - - [6144, 48000, 1, 2048]
    - [23, 19933.9]
  - - [2048, 3200, 1, 2048]
    - [23, 11769.3]
  - - [5124, 9124, 1, 2560]
    - [21, 22014.2]
  - - [1024, 24000, 1, 1536]
    - [21, 21700.2]
  - - [7680, 16, 1, 2560]
    - [3, 2782.81]
  - - [2560, 6400, 1, 2560]
    - [21, 20738.8]
  - - [2048, 128, 1, 2048]
    - [6, 3469.35]
  - - [512, 16, 1, 500000]
    - [0, 508.253]
  - - [1024, 8, 1, 500000]
    - [0, 506.679]
  - - [512, 24000, 1, 2560]
    - [21, 19585.3]
  - - [1024, 24000, 1, 2816]
    - [21, 23343.4]
  - - [7680, 5984, 1, 2560]
    - [21, 21788.0]
  - - [2048, 1600, 1, 512]
    - [23, 13023.8]
  - - [2048, 7000, 1, 2048]
    - [23, 15502.5]
  - - [1760, 800, 1, 1760]
    - [20, 15423.1]
  - - [4096, 64, 1, 4096]
    - [4, 3997.51]
  - - [7680, 32, 1, 2560]
    - [1, 5291.67]
  - - [2560, 64, 1, 2560]
    - [14, 5867.47]
  - - [3072, 128, 1, 1024]
    - [17, 5876.35]
  - - [7680, 64, 1, 2560]
    - [15, 7770.47]
  - - [1760, 128, 1, 1760]
    - [12, 8048.74]
  - - [2560, 1600, 1, 2560]
    - [21, 15422.7]
  - - [2048, 3200, 1, 512]
    - [23, 15236.0]
  - - [2560, 800, 1, 2560]
    - [21, 13907.7]
  - - [3072, 32, 1, 1024]
    - [0, 2295.45]
  - - [6144, 32, 1, 2560]
    - [12, 4660.14]
  - - [4608, 12000, 1, 1536]
    - [21, 22816.2]
  - - [4096, 32, 1, 4096]
    - [16, 2485.42]
  - - [6144, 24000, 1, 2048]
    - [23, 19517.0]
  - - [8192, 800, 1, 2048]
    - [23, 12001.6]
  - - [5124, 9124, 1, 4096]
    - [23, 18302.0]
  - - [8448, 24000, 1, 2816]
    - [21, 23806.3]
  - - [1024, 48000, 1, 1536]
    - [21, 22640.1]
  - - [7680, 128, 1, 2560]
    - [7, 12264.5]
  - - [8192, 1600, 1, 2048]
    - [23, 14492.4]
  - - [4096, 800, 1, 1024]
    - [23, 12872.0]
  - - [1024, 16, 1, 500000]
    - [0, 1013.39]
  - - [2048, 800, 1, 2048]
    - [22, 8346.54]
  - - [1760, 3200, 1, 1760]
    - [21, 20940.9]
  - - [512, 48000, 1, 2560]
    - [21, 21569.8]
  - - [8448, 16, 1, 2816]
    - [11, 3398.37]
  - - [2048, 64, 1, 2048]
    - [3, 2716.44]
  - - [512, 24000, 1, 2048]
    - [23, 14505.0]
  - - [16384, 1600, 1, 4096]
    - [23, 16072.4]
  - - [4608, 16, 1, 1536]
    - [13, 2302.34]
  - - [1024, 24000, 1, 2048]
    - [23, 16809.7]
  - - [8192, 400, 1, 2048]
    - [22, 9536.6]
  - - [2048, 6400, 1, 2048]
    - [23, 14199.9]
  - - [6144, 12000, 1, 2048]
    - [23, 18701.3]
  - - [512, 8, 1, 500000]
    - [0, 253.428]
  - - [1760, 7000, 1, 1760]
    - [18, 21301.9]
  - - [1024, 48000, 1, 2816]
    - [21, 23855.2]
  - - [6144, 16, 1, 2560]
    - [3, 2631.5]
  - - [8448, 32, 1, 2816]
    - [2, 6183.32]
  - - [4096, 7000, 1, 4096]
    - [23, 18035.2]
  - - [4096, 16, 1, 4096]
    - [8, 1412.21]
  - - [6144, 24000, 1, 2560]
    - [21, 21863.6]
  - - [1024, 1024, 1, 1024]
    - [23, 10428.0]
  - - [2048, 16, 1, 2048]
    - [5, 883.837]
  - - [8448, 12000, 1, 2816]
    - [21, 23850.1]
  - - [16384, 400, 1, 4096]
    - [23, 11423.5]
  - - [1760, 1600, 1, 1760]
    - [21, 19143.2]
  - - [1024, 48000, 1, 2048]
    - [23, 18312.5]
- - - -1
    - - - 1
        - - - 32
            - - [32, 26]
              - [64, 27]
              - [704, 26]
              - [1024, 27]
              - [-1, 26]
          - - 64
            - - [32, 26]
              - [64, 27]
              - [448, 26]
              - [704, 27]
              - [2944, 26]
              - [3584, 27]
              - [-1, 26]
          - - 128
            - - [-1, 26]
          - - 256
            - - [3584, 26]
              - [4288, 27]
              - [-1, 26]
          - - 448
            - - [32, 27]
              - [-1, 26]
          - - 1024
            - - [-1, 26]
          - - 1408
            - - [64, 26]
              - [128, 27]
              - [-1, 26]
          - - 1856
            - - [32, 27]
              - [128, 26]
              - [256, 27]
              - [-1, 26]
          - - 2944
            - - [-1, 26]
          - - 3584
            - - [128, 26]
              - [256, 27]
              - [-1, 26]
          - - 4288
            - - [-1, 26]
          - - 5056
            - - [32, 27]
              - [-1, 26]
          - - -1
            - - [-1, 26]
      - - 32
        - - - 128
            - - [-1, 25]
          - - 256
            - - [3584, 25]
              - [4288, 24]
              - [5056, 25]
              - [-1, 24]
          - - 448
            - - [2368, 25]
              - [4288, 24]
              - [-1, 25]
          - - 704
            - - [1408, 25]
              - [2944, 24]
              - [3584, 25]
              - [-1, 24]
          - - 1024
            - - [1024, 25]
              - [1856, 24]
              - [2944, 25]
              - [-1, 24]
          - - 1408
            - - [704, 25]
              - [-1, 24]
          - - 1856
            - - [448, 25]
              - [-1, 24]
          - - 2368
            - - [256, 25]
              - [-1, 24]
          - - 2944
            - - [256, 25]
              - [704, 24]
              - [1024, 25]
              - [-1, 24]
          - - 3584
            - - [256, 25]
              - [-1, 24]
          - - 5888
            - - [128, 25]
              - [256, 24]
              - [448, 25]
              - [-1, 24]
          - - -1
            - - [64, 25]
              - [-1, 24]
      - - 256
        - - - 1
            - - [-1, 27]
          - - 32
            - - [-1, 25]
          - - 64
            - - [1, 27]
              - [32, 25]
              - [1856, 0]
              - [2368, 10]
              - [3584, 1]
              - [4288, 2]
              - [5056, 1]
              - [-1, 19]
          - - 128
            - - [1, 27]
              - [32, 25]
              - [704, 0]
              - [1024, 13]
              - [1856, 1]
              - [2368, 2]
              - [2944, 1]
              - [5888, 19]
              - [-1, 20]
          - - 256
            - - [1, 27]
              - [32, 25]
              - [448, 0]
              - [704, 9]
              - [2944, 19]
              - [5888, 20]
              - [-1, 21]
          - - 448
            - - [1, 27]
              - [32, 25]
              - [128, 0]
              - [256, 13]
              - [1408, 19]
              - [2944, 20]
              - [3584, 21]
              - [4288, 19]
              - [5056, 20]
              - [-1, 21]
          - - 704
            - - [1, 27]
              - [32, 25]
              - [128, 0]
              - [256, 9]
              - [1408, 19]
              - [1856, 20]
              - [2368, 21]
              - [2944, 19]
              - [-1, 21]
          - - 1024
            - - [1, 27]
              - [32, 25]
              - [128, 0]
              - [704, 19]
              - [1408, 20]
              - [1856, 21]
              - [2368, 20]
              - [-1, 21]
          - - 1408
            - - [1, 27]
              - [32, 25]
              - [64, 0]
              - [128, 1]
              - [448, 19]
              - [1024, 20]
              - [-1, 21]
          - - 1856
            - - [1, 27]
              - [32, 25]
              - [64, 13]
              - [128, 9]
              - [256, 19]
              - [704, 20]
              - [2368, 21]
              - [2944, 20]
              - [-1, 21]
          - - 2368
            - - [1, 27]
              - [32, 25]
              - [64, 13]
              - [128, 2]
              - [448, 19]
              - [-1, 21]
          - - 2944
            - - [1, 27]
              - [32, 25]
              - [64, 1]
              - [256, 19]
              - [704, 20]
              - [1408, 21]
              - [1856, 20]
              - [-1, 21]
          - - 3584
            - - [1, 27]
              - [32, 25]
              - [64, 1]
              - [128, 19]
              - [448, 20]
              - [-1, 21]
          - - 4288
            - - [1, 27]
              - [32, 25]
              - [64, 2]
              - [256, 19]
              - [704, 20]
              - [-1, 21]
          - - 5056
            - - [1, 27]
              - [32, 25]
              - [64, 2]
              - [256, 19]
              - [-1, 21]
          - - 5888
            - - [1, 27]
              - [32, 25]
              - [128, 19]
              - [256, 20]
              - [448, 21]
              - [704, 20]
              - [-1, 21]
          - - -1
            - - [1, 27]
              - [32, 25]
              - [64, 19]
              - [128, 20]
              - [256, 21]
              - [448, 20]
              - [-1, 21]
      - - 1280
        - - - 1
            - - [-1, 27]
          - - 32
            - - [-1, 25]
          - - 64
            - - [1, 27]
              - [32, 25]
              - [64, 0]
              - [1856, 10]
              - [2944, 12]
              - [3584, 1]
              - [4288, 12]
              - [5888, 2]
              - [-1, 19]
          - - 128
            - - [1, 27]
              - [32, 25]
              - [256, 10]
              - [448, 13]
              - [1024, 10]
              - [1408, 1]
              - [1856, 14]
              - [2368, 2]
              - [2944, 12]
              - [5888, 19]
              - [-1, 20]
          - - 256
            - - [1, 27]
              - [32, 25]
              - [64, 13]
              - [128, 10]
              - [256, 13]
              - [448, 10]
              - [1024, 14]
              - [2944, 19]
              - [3584, 20]
              - [5056, 19]
              - [5888, 20]
              - [-1, 21]
          - - 448
            - - [1, 27]
              - [32, 25]
              - [64, 10]
              - [256, 13]
              - [1408, 19]
              - [1856, 20]
              - [2368, 19]
              - [2944, 20]
              - [3584, 21]
              - [5056, 19]
              - [-1, 21]
          - - 704
            - - [1, 27]
              - [32, 25]
              - [64, 10]
              - [128, 13]
              - [256, 14]
              - [1856, 19]
              - [2368, 21]
              - [2944, 19]
              - [-1, 21]
          - - 1024
            - - [1, 27]
              - [32, 25]
              - [128, 10]
              - [256, 9]
              - [704, 19]
              - [2368, 20]
              - [-1, 21]
          - - 1408
            - - [1, 27]
              - [32, 25]
              - [64, 13]
              - [256, 14]
              - [704, 19]
              - [1024, 20]
              - [1408, 21]
              - [1856, 20]
              - [-1, 21]
          - - 1856
            - - [1, 27]
              - [32, 25]
              - [64, 13]
              - [128, 14]
              - [256, 19]
              - [448, 20]
              - [704, 19]
              - [1024, 20]
              - [-1, 21]
          - - 2368
            - - [1, 27]
              - [32, 25]
              - [64, 1]
              - [128, 2]
              - [448, 19]
              - [704, 21]
              - [1024, 20]
              - [-1, 21]
          - - 2944
            - - [1, 27]
              - [32, 25]
              - [64, 12]
              - [256, 19]
              - [704, 20]
              - [-1, 21]
          - - 3584
            - - [1, 27]
              - [32, 25]
              - [64, 9]
              - [128, 19]
              - [256, 20]
              - [448, 21]
              - [704, 20]
              - [-1, 21]
          - - 4288
            - - [1, 27]
              - [32, 25]
              - [64, 14]
              - [256, 19]
              - [704, 20]
              - [-1, 21]
          - - 5056
            - - [1, 27]
              - [32, 25]
              - [64, 9]
              - [256, 19]
              - [448, 20]
              - [-1, 21]
          - - 5888
            - - [1, 27]
              - [32, 25]
              - [64, 2]
              - [128, 19]
              - [256, 20]
              - [448, 21]
              - [704, 20]
              - [-1, 21]
          - - -1
            - - [1, 27]
              - [32, 25]
              - [64, 19]
              - [128, 20]
              - [256, 21]
              - [448, 20]
              - [-1, 21]
      - - -1
        - - - 1
            - - [-1, 27]
          - - 32
            - - [-1, 25]
          - - 64
            - - [1, 27]
              - [32, 25]
              - [704, 10]
              - [1024, 13]
              - [1856, 10]
              - [2368, 12]
              - [2944, 14]
              - [3584, 9]
              - [4288, 12]
              - [5056, 14]
              - [5888, 2]
              - [-1, 19]
          - - 128
            - - [1, 27]
              - [32, 25]
              - [704, 10]
              - [1024, 13]
              - [1856, 12]
              - [2368, 2]
              - [2944, 14]
              - [3584, 19]
              - [4288, 2]
              - [5888, 19]
              - [-1, 21]
          - - 256
            - - [1, 27]
              - [32, 25]
              - [64, 10]
              - [256, 13]
              - [448, 10]
              - [1408, 14]
              - [1856, 20]
              - [2944, 19]
              - [3584, 21]
              - [5056, 19]
              - [5888, 20]
              - [-1, 21]
          - - 448
            - - [1, 27]
              - [32, 25]
              - [64, 10]
              - [256, 13]
              - [448, 9]
              - [1408, 19]
              - [1856, 21]
              - [2368, 19]
              - [2944, 20]
              - [3584, 21]
              - [4288, 19]
              - [5056, 20]
              - [-1, 21]
          - - 704
            - - [1, 27]
              - [32, 25]
              - [64, 10]
              - [128, 13]
              - [256, 14]
              - [448, 9]
              - [1856, 19]
              - [2368, 21]
              - [2944, 19]
              - [-1, 21]
          - - 1024
            - - [1, 27]
              - [32, 25]
              - [128, 13]
              - [256, 14]
              - [448, 20]
              - [704, 19]
              - [1408, 20]
              - [1856, 21]
              - [2368, 20]
              - [-1, 21]
          - - 1408
            - - [1, 27]
              - [32, 25]
              - [64, 13]
              - [256, 14]
              - [448, 19]
              - [1024, 20]
              - [1408, 21]
              - [1856, 20]
              - [-1, 21]
          - - 1856
            - - [1, 27]
              - [32, 25]
              - [64, 13]
              - [128, 14]
              - [256, 20]
              - [448, 21]
              - [704, 19]
              - [-1, 21]
          - - 2368
            - - [1, 27]
              - [32, 25]
              - [64, 12]
              - [128, 2]
              - [448, 19]
              - [704, 21]
              - [1024, 20]
              - [-1, 21]
          - - 2944
            - - [1, 27]
              - [32, 25]
              - [64, 12]
              - [128, 14]
              - [256, 19]
              - [704, 20]
              - [-1, 21]
          - - 3584
            - - [1, 27]
              - [32, 25]
              - [64, 14]
              - [128, 19]
              - [256, 20]
              - [448, 21]
              - [704, 20]
              - [-1, 21]
          - - 4288
            - - [1, 27]
              - [32, 25]
              - [64, 14]
              - [256, 19]
              - [704, 20]
              - [-1, 21]
          - - 5056
            - - [1, 27]
              - [32, 25]
              - [64, 14]
              - [256, 19]
              - [-1, 21]
          - - 5888
            - - [1, 27]
              - [32, 25]
              - [64, 2]
              - [128, 19]
              - [256, 20]
              - [448, 21]
              - [704, 20]
              - [-1, 21]
          - - -1
            - - [1, 27]
              - [32, 25]
              - [64, 19]
              - [128, 20]
              - [256, 21]
              - [448, 20]
              - [-1, 21]
