library/src/blas3/Tensile/Logic/asm_full/vega20_Cijk_Alik_Bljk_CB_GB.yaml
- {MinimumRequiredVersion: 4.26.0}
- vega20
- gfx906
- [Device 66a0, Device 66a1, Device 66a7, Device 66af, Vega 20]
    SolutionIndex: 0
    SolutionNameMin: Cijk_Alik_Bljk_CB_GB_MT32x32x8_SN_AMAS3_GRVW2_LRVW2_TT4_4_VW2_WG8_8_1_WGM1
    SolutionIndex: 1
    SolutionNameMin: Cijk_Alik_Bljk_CB_GB_MT64x64x8_SN_AMAS3_GRVW2_LRVW2_TT4_4_VW2_WG16_16_1_WGM1
    SolutionIndex: 2
    SolutionNameMin: Cijk_Alik_Bljk_CB_GB_MT32x32x16_SN_AMAS3_GRVW2_LRVW2_TT4_4_VW2_WG8_8_1_WGM1
    SolutionIndex: 3
    SolutionNameMin: Cijk_Alik_Bljk_CB_GB_MT64x64x16_SN_AMAS3_GRVW2_LRVW2_TT4_4_VW2_WG16_16_1_WGM1
    SolutionIndex: 4
    SolutionNameMin: Cijk_Alik_Bljk_CB_GB_MT64x128x16_SN_AMAS3_GRVW2_LRVW2_TT4_8_VW2_WG16_16_1_WGM1
    SolutionIndex: 5
    SolutionNameMin: Cijk_Alik_Bljk_CB_GB_MT64x64x8_SN_AMAS0_GRVW1_LRVW1_TT4_4_VW1_WG16_16_1_WGM1
    SolutionIndex: 6
    SolutionNameMin: Cijk_Alik_Bljk_CB_GB_MT32x32x8_SN_AMAS3_GRVW2_LRVW2_TT4_4_VW2_WG8_8_1_WGM8
    SolutionIndex: 7
    SolutionNameMin: Cijk_Alik_Bljk_CB_GB_MT64x64x8_SN_AMAS3_GRVW2_LRVW2_TT4_4_VW2_WG16_16_1_WGM8
    SolutionIndex: 8
    SolutionNameMin: Cijk_Alik_Bljk_CB_GB_MT32x32x16_SN_AMAS3_GRVW2_LRVW2_TT4_4_VW2_WG8_8_1_WGM8
    SolutionIndex: 9
    SolutionNameMin: Cijk_Alik_Bljk_CB_GB_MT64x64x16_SN_AMAS3_GRVW2_LRVW2_TT4_4_VW2_WG16_16_1_WGM8
- - - [32, 32, 8, 32, 32, 32, 32, 32]
    - [6, 46.0]
  - - [32, 32, 8, 64, 32, 32, 64, 64]
    - [0, 61.0]
  - - [32, 32, 8, 128, 32, 32, 128, 128]
    - [0, 74.0]
  - - [32, 32, 8, 256, 32, 32, 256, 256]
    - [0, 82.0]
  - - [32, 32, 8, 512, 32, 32, 512, 512]
    - [6, 87.0]
  - - [32, 64, 8, 32, 32, 32, 32, 32]
    - [0, 99.0]
  - - [32, 64, 8, 64, 32, 32, 64, 64]
    - [0, 129.0]
  - - [32, 64, 8, 128, 32, 32, 128, 128]
    - [0, 151.0]
  - - [32, 64, 8, 256, 32, 32, 256, 256]
    - [6, 166.0]
  - - [32, 64, 8, 512, 32, 32, 512, 512]
    - [0, 172.0]
  - - [32, 128, 8, 32, 32, 32, 32, 32]
    - [0, 204.0]
  - - [32, 128, 8, 64, 32, 32, 64, 64]
    - [6, 262.0]
  - - [32, 128, 8, 128, 32, 32, 128, 128]
    - [0, 304.0]
  - - [32, 128, 8, 256, 32, 32, 256, 256]
    - [6, 330.0]
  - - [32, 128, 8, 512, 32, 32, 512, 512]
    - [0, 325.0]
  - - [32, 256, 8, 32, 32, 32, 32, 32]
    - [0, 401.0]
  - - [32, 256, 8, 64, 32, 32, 64, 64]
    - [0, 518.0]
  - - [32, 256, 8, 128, 32, 32, 128, 128]
    - [0, 594.0]
  - - [32, 256, 8, 256, 32, 32, 256, 256]
    - [0, 599.0]
  - - [32, 256, 8, 512, 32, 32, 512, 512]
    - [3, 538.0]
  - - [32, 512, 8, 32, 32, 32, 32, 32]
    - [6, 768.0]
  - - [32, 512, 8, 64, 32, 32, 64, 64]
    - [6, 987.0]
  - - [32, 512, 8, 128, 32, 32, 128, 128]
    - [0, 1023.0]
  - - [32, 512, 8, 256, 32, 32, 256, 256]
    - [3, 884.0]
  - - [32, 512, 8, 512, 32, 32, 512, 512]
    - [9, 814.0]
  - - [64, 32, 8, 32, 64, 64, 32, 32]
    - [0, 98.0]
  - - [64, 32, 8, 64, 64, 64, 64, 64]
    - [0, 128.0]
  - - [64, 32, 8, 128, 64, 64, 128, 128]
    - [0, 151.0]
  - - [64, 32, 8, 256, 64, 64, 256, 256]
    - [0, 166.0]
  - - [64, 32, 8, 512, 64, 64, 512, 512]
    - [6, 174.0]
  - - [64, 64, 8, 32, 64, 64, 32, 32]
    - [0, 204.0]
  - - [64, 64, 8, 64, 64, 64, 64, 64]
    - [0, 263.0]
  - - [64, 64, 8, 128, 64, 64, 128, 128]
    - [0, 307.0]
  - - [64, 64, 8, 256, 64, 64, 256, 256]
    - [6, 333.0]
  - - [64, 64, 8, 512, 64, 64, 512, 512]
    - [6, 345.0]
  - - [64, 128, 8, 32, 64, 64, 32, 32]
    - [0, 401.0]
  - - [64, 128, 8, 64, 64, 64, 64, 64]
    - [0, 523.0]
  - - [64, 128, 8, 128, 64, 64, 128, 128]
    - [0, 610.0]
  - - [64, 128, 8, 256, 64, 64, 256, 256]
    - [6, 657.0]
  - - [64, 128, 8, 512, 64, 64, 512, 512]
    - [2, 639.0]
  - - [64, 256, 8, 32, 64, 64, 32, 32]
    - [0, 774.0]
  - - [64, 256, 8, 64, 64, 64, 64, 64]
    - [0, 1011.0]
  - - [64, 256, 8, 128, 64, 64, 128, 128]
    - [0, 1181.0]
  - - [64, 256, 8, 256, 64, 64, 256, 256]
    - [2, 1061.0]
  - - [64, 256, 8, 512, 64, 64, 512, 512]
    - [9, 1014.0]
  - - [64, 512, 8, 32, 64, 64, 32, 32]
    - [6, 1374.0]
  - - [64, 512, 8, 64, 64, 64, 64, 64]
    - [0, 1779.0]
  - - [64, 512, 8, 128, 64, 64, 128, 128]
    - [2, 1666.0]
  - - [64, 512, 8, 256, 64, 64, 256, 256]
    - [3, 1574.0]
  - - [64, 512, 8, 512, 64, 64, 512, 512]
    - [9, 1419.0]
  - - [128, 32, 8, 32, 128, 128, 32, 32]
    - [0, 205.0]
  - - [128, 32, 8, 64, 128, 128, 64, 64]
    - [0, 262.0]
  - - [128, 32, 8, 128, 128, 128, 128, 128]
    - [0, 308.0]
  - - [128, 32, 8, 256, 128, 128, 256, 256]
    - [6, 333.0]
  - - [128, 32, 8, 512, 128, 128, 512, 512]
    - [0, 345.0]
  - - [128, 64, 8, 32, 128, 128, 32, 32]
    - [0, 400.0]
  - - [128, 64, 8, 64, 128, 128, 64, 64]
    - [0, 524.0]
  - - [128, 64, 8, 128, 128, 128, 128, 128]
    - [0, 613.0]
  - - [128, 64, 8, 256, 128, 128, 256, 256]
    - [0, 664.0]
  - - [128, 64, 8, 512, 128, 128, 512, 512]
    - [2, 694.0]
  - - [128, 128, 8, 32, 128, 128, 32, 32]
    - [0, 773.0]
  - - [128, 128, 8, 64, 128, 128, 64, 64]
    - [0, 1011.0]
  - - [128, 128, 8, 128, 128, 128, 128, 128]
    - [0, 1192.0]
  - - [128, 128, 8, 256, 128, 128, 256, 256]
    - [0, 1306.0]
  - - [128, 128, 8, 512, 128, 128, 512, 512]
    - [2, 1241.0]
  - - [128, 256, 8, 32, 128, 128, 32, 32]
    - [0, 1404.0]
  - - [128, 256, 8, 64, 128, 128, 64, 64]
    - [0, 1838.0]
  - - [128, 256, 8, 128, 128, 128, 128, 128]
    - [0, 2180.0]
  - - [128, 256, 8, 256, 128, 128, 256, 256]
    - [3, 1895.0]
  - - [128, 256, 8, 512, 128, 128, 512, 512]
    - [3, 1827.0]
  - - [128, 512, 8, 32, 128, 128, 32, 32]
    - [5, 1901.0]
  - - [128, 512, 8, 64, 128, 128, 64, 64]
    - [5, 2433.0]
  - - [128, 512, 8, 128, 128, 128, 128, 128]
    - [0, 2733.0]
  - - [128, 512, 8, 256, 128, 128, 256, 256]
    - [3, 2478.0]
  - - [128, 512, 8, 512, 128, 128, 512, 512]
    - [4, 1990.0]
  - - [256, 32, 8, 32, 256, 256, 32, 32]
    - [0, 398.0]
  - - [256, 32, 8, 64, 256, 256, 64, 64]
    - [0, 516.0]
  - - [256, 32, 8, 128, 256, 256, 128, 128]
    - [0, 600.0]
  - - [256, 32, 8, 256, 256, 256, 256, 256]
    - [0, 660.0]
  - - [256, 32, 8, 512, 256, 256, 512, 512]
    - [6, 695.0]
  - - [256, 64, 8, 32, 256, 256, 32, 32]
    - [0, 734.0]
  - - [256, 64, 8, 64, 256, 256, 64, 64]
    - [0, 985.0]
  - - [256, 64, 8, 128, 256, 256, 128, 128]
    - [0, 1172.0]
  - - [256, 64, 8, 256, 256, 256, 256, 256]
    - [0, 1303.0]
  - - [256, 64, 8, 512, 256, 256, 512, 512]
    - [2, 1371.0]
  - - [256, 128, 8, 32, 256, 256, 32, 32]
    - [1, 1296.0]
  - - [256, 128, 8, 64, 256, 256, 64, 64]
    - [0, 1758.0]
  - - [256, 128, 8, 128, 256, 256, 128, 128]
    - [0, 2162.0]
  - - [256, 128, 8, 256, 256, 256, 256, 256]
    - [6, 2425.0]
  - - [256, 128, 8, 512, 256, 256, 512, 512]
    - [1, 1958.0]
  - - [256, 256, 8, 32, 256, 256, 32, 32]
    - [5, 1889.0]
  - - [256, 256, 8, 64, 256, 256, 64, 64]
    - [5, 2446.0]
  - - [256, 256, 8, 128, 256, 256, 128, 128]
    - [5, 2851.0]
  - - [256, 256, 8, 256, 256, 256, 256, 256]
    - [6, 3054.0]
  - - [256, 256, 8, 512, 256, 256, 512, 512]
    - [3, 2520.0]
  - - [256, 512, 8, 32, 256, 256, 32, 32]
    - [5, 2216.0]
  - - [256, 512, 8, 64, 256, 256, 64, 64]
    - [1, 2769.0]
  - - [256, 512, 8, 128, 256, 256, 128, 128]
    - [1, 3088.0]
  - - [256, 512, 8, 256, 256, 256, 256, 256]
    - [1, 3178.0]
  - - [256, 512, 8, 512, 256, 256, 512, 512]
    - [3, 2918.0]
  - - [512, 32, 8, 32, 512, 512, 32, 32]
    - [0, 677.0]
  - - [512, 32, 8, 64, 512, 512, 64, 64]
    - [0, 913.0]
  - - [512, 32, 8, 128, 512, 512, 128, 128]
    - [0, 1120.0]
  - - [512, 32, 8, 256, 512, 512, 256, 256]
    - [6, 1273.0]
  - - [512, 32, 8, 512, 512, 512, 512, 512]
    - [8, 1367.0]
  - - [512, 64, 8, 32, 512, 512, 32, 32]
    - [7, 1256.0]
  - - [512, 64, 8, 64, 512, 512, 64, 64]
    - [6, 1745.0]
  - - [512, 64, 8, 128, 512, 512, 128, 128]
    - [6, 2143.0]
  - - [512, 64, 8, 256, 512, 512, 256, 256]
    - [1, 2393.0]
  - - [512, 64, 8, 512, 512, 512, 512, 512]
    - [6, 2622.0]
  - - [512, 128, 8, 32, 512, 512, 32, 32]
    - [1, 1765.0]
  - - [512, 128, 8, 64, 512, 512, 64, 64]
    - [6, 2401.0]
  - - [512, 128, 8, 128, 512, 512, 128, 128]
    - [7, 2794.0]
  - - [512, 128, 8, 256, 512, 512, 256, 256]
    - [1, 3095.0]
  - - [512, 128, 8, 512, 512, 512, 512, 512]
    - [3, 3015.0]
  - - [512, 256, 8, 32, 512, 512, 32, 32]
    - [1, 2145.0]
  - - [512, 256, 8, 64, 512, 512, 64, 64]
    - [1, 2693.0]
  - - [512, 256, 8, 128, 512, 512, 128, 128]
    - [1, 3068.0]
  - - [512, 256, 8, 256, 512, 512, 256, 256]
    - [1, 3230.0]
  - - [512, 256, 8, 512, 512, 512, 512, 512]
    - [3, 3224.0]
  - - [512, 512, 8, 32, 512, 512, 32, 32]
    - [1, 2491.0]
  - - [512, 512, 8, 64, 512, 512, 64, 64]
    - [7, 3015.0]
  - - [512, 512, 8, 128, 512, 512, 128, 128]
    - [1, 3294.0]
  - - [512, 512, 8, 256, 512, 512, 256, 256]
    - [1, 3317.0]
  - - [512, 512, 8, 512, 512, 512, 512, 512]
    - [3, 3215.0]
- null
