library/src/blas3/Tensile/Logic/asm_full/vega20_Cijk_Ailk_Bjlk_ZB.yaml
- {MinimumRequiredVersion: 4.11.0}
- vega20
- gfx906
- [Device 66af, Device 66a0, Device 66a1, Device 66a7, Vega 20]
    SolutionIndex: 0
    SolutionNameMin: Cijk_Ailk_Bjlk_ZB_MT64x64x8_SE_
    SolutionIndex: 1
    SolutionNameMin: Cijk_Ailk_Bjlk_ZB_MT64x64x4_SE_
    SolutionIndex: 2
    SolutionNameMin: Cijk_Ailk_Bjlk_ZB_MT32x32x16_SE_EPS1_PGR1_PLR1_TT2_2_WG16_16_1
    SolutionIndex: 3
    SolutionNameMin: Cijk_Ailk_Bjlk_ZB_MT64x64x8_SE_EPS1_PGR1_PLR0_TT4_4_WG16_16_1
    SolutionIndex: 4
    SolutionNameMin: Cijk_Ailk_Bjlk_ZB_MT32x16x4_SE_EPS1_PGR1_PLR1_TT4_2_WG8_8_1
    SolutionIndex: 5
    SolutionNameMin: Cijk_Ailk_Bjlk_ZB_MT64x32x8_SE_EPS1_PGR1_PLR1_TT4_2_WG16_16_1
    SolutionIndex: 6
    SolutionNameMin: Cijk_Ailk_Bjlk_ZB_MT64x64x4_SE_EPS1_PGR1_PLR0_TT4_4_WG16_16_1
    SolutionIndex: 7
    SolutionNameMin: Cijk_Ailk_Bjlk_ZB_MT32x32x4_SE_EPS1_PGR1_PLR0_TT4_4_WG8_8_1
    SolutionIndex: 8
    SolutionNameMin: Cijk_Ailk_Bjlk_ZB_MT64x32x4_SE_EPS1_PGR1_PLR0_TT4_4_WG16_8_1
    SolutionIndex: 9
    SolutionNameMin: Cijk_Ailk_Bjlk_ZB_MT64x16x8_SE_EPS0_PGR0_PLR0_TT4_2_WG16_8_1
    SolutionIndex: 10
    SolutionNameMin: Cijk_Ailk_Bjlk_ZB_MT64x64x8_SE_
    SolutionIndex: 11
    SolutionNameMin: Cijk_Ailk_Bjlk_ZB_MT64x64x4_SE_
    SolutionIndex: 12
    SolutionNameMin: Cijk_Ailk_Bjlk_ZB_MT32x32x16_SE_EPS1_PGR1_PLR1_TT2_2_WG16_16_1
    SolutionIndex: 13
    SolutionNameMin: Cijk_Ailk_Bjlk_ZB_MT64x64x8_SE_EPS1_PGR1_PLR0_TT4_4_WG16_16_1
    SolutionIndex: 14
    SolutionNameMin: Cijk_Ailk_Bjlk_ZB_MT32x16x4_SE_EPS1_PGR1_PLR1_TT4_2_WG8_8_1
    SolutionIndex: 15
    SolutionNameMin: Cijk_Ailk_Bjlk_ZB_MT64x32x8_SE_EPS1_PGR1_PLR1_TT4_2_WG16_16_1
    SolutionIndex: 16
    SolutionNameMin: Cijk_Ailk_Bjlk_ZB_MT64x64x4_SE_EPS1_PGR1_PLR0_TT4_4_WG16_16_1
    SolutionIndex: 17
    SolutionNameMin: Cijk_Ailk_Bjlk_ZB_MT32x32x4_SE_EPS1_PGR1_PLR0_TT4_4_WG8_8_1
    SolutionIndex: 18
    SolutionNameMin: Cijk_Ailk_Bjlk_ZB_MT64x32x4_SE_EPS1_PGR1_PLR0_TT4_4_WG16_8_1
    SolutionIndex: 19
    SolutionNameMin: Cijk_Ailk_Bjlk_ZB_MT64x16x8_SE_EPS0_PGR0_PLR0_TT4_2_WG16_8_1
- - - [1, 1, 1, 256]
    - [0, 0.00916253]
  - - [64, 64, 1, 256]
    - [0, 41.8762]
  - - [64, 1, 1, 256]
    - [0, 0.655885]
  - - [1, 64, 1, 256]
    - [1, 0.623918]
  - - [43392, 1792, 1, 128]
    - [8, 4932.49]
  - - [7424, 7424, 1, 7424]
    - [6, 5155.82]
  - - [40832, 1792, 1, 256]
    - [6, 5049.42]
  - - [5632, 1792, 1, 384]
    - [5, 4926.69]
  - - [23552, 1792, 1, 256]
    - [6, 5029.52]
  - - [39552, 1792, 1, 256]
    - [6, 5053.2]
  - - [31232, 1792, 1, 384]
    - [6, 5089.49]
  - - [10112, 1792, 1, 384]
    - [6, 5038.77]
  - - [24832, 1792, 1, 384]
    - [6, 5101.04]
  - - [42752, 1792, 1, 384]
    - [3, 5084.83]
  - - [13952, 1792, 1, 128]
    - [7, 4862.86]
  - - [6400, 6400, 1, 6400]
    - [6, 5137.29]
  - - [33792, 1792, 1, 384]
    - [6, 5077.38]
  - - [40192, 1792, 1, 128]
    - [8, 4912.28]
  - - [5632, 5632, 1, 5632]
    - [6, 5152.04]
  - - [15232, 1792, 1, 128]
    - [6, 4855.81]
  - - [4352, 1792, 1, 128]
    - [8, 4755.81]
  - - [10752, 1792, 1, 256]
    - [6, 4988.67]
  - - [44032, 1792, 1, 128]
    - [8, 4917.94]
  - - [6272, 1792, 1, 384]
    - [5, 4971.59]
  - - [21632, 1792, 1, 128]
    - [6, 4913.9]
  - - [38272, 1792, 1, 128]
    - [7, 4935.83]
  - - [12032, 1792, 1, 256]
    - [3, 4943.66]
  - - [40832, 1792, 1, 128]
    - [6, 4926.81]
  - - [512, 512, 1, 512]
    - [4, 4660.34]
  - - [12672, 1792, 1, 128]
    - [6, 4857.21]
  - - [10752, 1792, 1, 384]
    - [6, 5051.3]
  - - [5376, 5376, 1, 5376]
    - [6, 5122.21]
  - - [44032, 1792, 1, 256]
    - [6, 5040.89]
  - - [15872, 1792, 1, 384]
    - [6, 5043.76]
  - - [3072, 3072, 1, 3072]
    - [6, 5182.56]
  - - [5632, 1792, 1, 128]
    - [8, 4666.73]
  - - [36352, 1792, 1, 128]
    - [8, 4912.15]
  - - [256, 256, 1, 256]
    - [2, 2031.14]
  - - [29312, 1792, 1, 384]
    - [6, 5076.33]
  - - [7552, 1792, 1, 384]
    - [6, 5062.09]
  - - [7680, 7680, 1, 7680]
    - [6, 5187.3]
  - - [17792, 1792, 1, 128]
    - [3, 4892.88]
  - - [30592, 1792, 1, 384]
    - [3, 5089.3]
  - - [29312, 1792, 1, 128]
    - [6, 4915.53]
  - - [11392, 1792, 1, 384]
    - [6, 5080.52]
  - - [5888, 5888, 1, 5888]
    - [6, 5132.22]
  - - [28032, 1792, 1, 256]
    - [6, 5054.25]
  - - [6144, 6144, 1, 6144]
    - [6, 5193.11]
  - - [28672, 1792, 1, 128]
    - [8, 4619.87]
  - - [4864, 4864, 1, 4864]
    - [6, 5100.0]
  - - [38272, 1792, 1, 384]
    - [6, 5098.84]
  - - [24192, 1792, 1, 128]
    - [6, 4909.63]
  - - [25472, 1792, 1, 256]
    - [6, 5025.68]
  - - [35072, 1792, 1, 128]
    - [6, 4902.65]
  - - [32512, 1792, 1, 256]
    - [6, 5031.18]
  - - [2560, 2560, 1, 2560]
    - [5, 5096.85]
  - - [3840, 3840, 1, 3840]
    - [5, 5043.45]
  - - [38272, 1792, 1, 256]
    - [6, 5058.26]
  - - [37632, 1792, 1, 128]
    - [8, 4896.35]
  - - [36352, 1792, 1, 384]
    - [6, 5075.71]
  - - [29952, 1792, 1, 128]
    - [6, 4892.3]
  - - [5120, 5120, 1, 5120]
    - [6, 5201.55]
  - - [8192, 1792, 1, 128]
    - [9, 4380.47]
  - - [13312, 1792, 1, 128]
    - [8, 4845.52]
  - - [2304, 2304, 1, 2304]
    - [5, 4924.93]
  - - [38912, 1792, 1, 128]
    - [8, 4887.78]
  - - [42112, 1792, 1, 384]
    - [3, 5104.87]
  - - [15232, 1792, 1, 384]
    - [6, 5024.47]
  - - [31872, 1792, 1, 128]
    - [7, 4914.47]
  - - [16512, 1792, 1, 256]
    - [3, 5001.39]
  - - [16512, 1792, 1, 384]
    - [6, 5054.43]
  - - [15872, 1792, 1, 256]
    - [6, 4991.71]
  - - [39552, 1792, 1, 384]
    - [6, 5081.54]
  - - [22272, 1792, 1, 256]
    - [6, 5006.13]
  - - [6912, 6912, 1, 6912]
    - [6, 5152.85]
  - - [8832, 1792, 1, 384]
    - [6, 4983.63]
  - - [35072, 1792, 1, 256]
    - [6, 5051.47]
  - - [36992, 1792, 1, 384]
    - [6, 5088.37]
  - - [43392, 1792, 1, 256]
    - [6, 5045.38]
  - - [8192, 8192, 1, 8192]
    - [6, 5177.56]
  - - [16512, 1792, 1, 128]
    - [8, 4877.6]
  - - [44032, 1792, 1, 384]
    - [6, 5097.45]
  - - [27392, 1792, 1, 256]
    - [6, 5047.97]
  - - [33152, 1792, 1, 128]
    - [7, 4912.51]
  - - [7552, 1792, 1, 128]
    - [8, 4809.92]
  - - [4608, 4608, 1, 4608]
    - [3, 5130.54]
  - - [39552, 1792, 1, 128]
    - [7, 4921.11]
  - - [6656, 6656, 1, 6656]
    - [6, 5165.68]
  - - [3072, 1792, 1, 384]
    - [5, 4946.71]
  - - [36992, 1792, 1, 128]
    - [8, 4923.73]
  - - [36992, 1792, 1, 256]
    - [6, 5042.17]
  - - [23552, 1792, 1, 128]
    - [8, 4886.27]
  - - [31872, 1792, 1, 256]
    - [6, 5054.39]
  - - [15872, 1792, 1, 128]
    - [6, 4842.07]
  - - [8192, 1792, 1, 256]
    - [5, 4584.05]
  - - [40832, 1792, 1, 384]
    - [6, 5104.93]
  - - [26752, 1792, 1, 256]
    - [6, 5040.05]
  - - [19072, 1792, 1, 128]
    - [3, 4887.55]
  - - [18432, 1792, 1, 384]
    - [3, 5073.02]
  - - [768, 768, 1, 768]
    - [2, 4503.73]
  - - [29952, 1792, 1, 256]
    - [6, 5027.41]
  - - [29312, 1792, 1, 256]
    - [6, 5028.32]
  - - [40192, 1792, 1, 384]
    - [6, 5086.78]
  - - [32512, 1792, 1, 128]
    - [8, 4902.36]
  - - [11392, 1792, 1, 128]
    - [6, 4873.45]
  - - [42752, 1792, 1, 256]
    - [6, 5033.56]
  - - [20352, 1792, 1, 384]
    - [6, 5075.92]
  - - [19712, 1792, 1, 128]
    - [6, 4881.73]
  - - [20992, 1792, 1, 384]
    - [6, 5075.85]
  - - [18432, 1792, 1, 256]
    - [3, 4994.39]
  - - [10752, 1792, 1, 128]
    - [6, 4824.05]
  - - [4992, 1792, 1, 128]
    - [5, 4687.04]
  - - [2048, 2048, 1, 2048]
    - [6, 5154.41]
  - - [26752, 1792, 1, 128]
    - [7, 4906.65]
  - - [19712, 1792, 1, 384]
    - [6, 5052.96]
  - - [26112, 1792, 1, 256]
    - [6, 5007.53]
  - - [3072, 1792, 1, 128]
    - [5, 4623.03]
  - - [22272, 1792, 1, 384]
    - [6, 5057.08]
  - - [12032, 1792, 1, 128]
    - [3, 4803.91]
  - - [34432, 1792, 1, 256]
    - [3, 5044.01]
  - - [22272, 1792, 1, 128]
    - [6, 4871.61]
  - - [1024, 1024, 1, 1024]
    - [6, 5064.82]
  - - [41472, 1792, 1, 256]
    - [6, 5044.5]
  - - [12672, 1792, 1, 384]
    - [6, 5036.82]
  - - [13312, 1792, 1, 384]
    - [6, 5043.19]
  - - [7552, 1792, 1, 256]
    - [6, 5006.63]
  - - [9472, 1792, 1, 384]
    - [6, 4997.04]
  - - [41472, 1792, 1, 384]
    - [6, 5087.92]
  - - [31232, 1792, 1, 128]
    - [6, 4900.45]
  - - [35712, 1792, 1, 256]
    - [6, 5034.55]
  - - [24832, 1792, 1, 256]
    - [6, 5045.58]
  - - [33792, 1792, 1, 256]
    - [6, 5035.09]
  - - [14592, 1792, 1, 128]
    - [6, 4867.73]
  - - [21632, 1792, 1, 256]
    - [3, 5046.95]
  - - [26752, 1792, 1, 384]
    - [6, 5077.33]
  - - [33792, 1792, 1, 128]
    - [8, 4902.88]
  - - [27392, 1792, 1, 128]
    - [6, 4892.13]
  - - [4096, 4096, 1, 4096]
    - [6, 5174.69]
  - - [6272, 1792, 1, 128]
    - [3, 4738.93]
  - - [22912, 1792, 1, 256]
    - [6, 5025.68]
  - - [6912, 1792, 1, 384]
    - [6, 4999.2]
  - - [34432, 1792, 1, 128]
    - [7, 4924.35]
  - - [35712, 1792, 1, 384]
    - [6, 5065.95]
  - - [42112, 1792, 1, 128]
    - [7, 4928.3]
  - - [30592, 1792, 1, 256]
    - [6, 5038.5]
  - - [17152, 1792, 1, 128]
    - [6, 4864.19]
  - - [1792, 1792, 1, 1792]
    - [5, 4797.0]
  - - [36352, 1792, 1, 256]
    - [6, 5029.14]
  - - [26112, 1792, 1, 384]
    - [6, 5077.62]
  - - [4352, 4352, 1, 4352]
    - [6, 5075.51]
  - - [17152, 1792, 1, 256]
    - [6, 5018.18]
  - - [19072, 1792, 1, 256]
    - [6, 4994.35]
  - - [42752, 1792, 1, 128]
    - [8, 4910.21]
  - - [26112, 1792, 1, 128]
    - [8, 4893.11]
  - - [2816, 2816, 1, 2816]
    - [5, 4983.56]
  - - [24192, 1792, 1, 384]
    - [6, 5099.05]
  - - [22912, 1792, 1, 128]
    - [3, 4904.31]
  - - [10112, 1792, 1, 128]
    - [6, 4826.95]
  - - [14592, 1792, 1, 384]
    - [6, 5072.06]
  - - [17792, 1792, 1, 256]
    - [6, 5037.22]
  - - [9472, 1792, 1, 128]
    - [8, 4816.55]
  - - [31232, 1792, 1, 256]
    - [6, 5053.62]
  - - [31872, 1792, 1, 384]
    - [6, 5103.86]
  - - [19072, 1792, 1, 384]
    - [3, 5042.64]
  - - [35712, 1792, 1, 128]
    - [6, 4916.08]
  - - [25472, 1792, 1, 384]
    - [6, 5078.13]
  - - [33152, 1792, 1, 384]
    - [6, 5085.44]
  - - [20352, 1792, 1, 256]
    - [6, 5020.87]
  - - [28672, 1792, 1, 384]
    - [3, 5028.16]
  - - [37632, 1792, 1, 384]
    - [6, 5086.87]
  - - [6912, 1792, 1, 128]
    - [6, 4784.66]
  - - [33152, 1792, 1, 256]
    - [6, 5037.57]
  - - [28032, 1792, 1, 384]
    - [6, 5103.85]
  - - [3712, 1792, 1, 128]
    - [3, 4634.97]
  - - [13952, 1792, 1, 256]
    - [6, 5025.76]
  - - [1280, 1280, 1, 1280]
    - [2, 4689.72]
  - - [24192, 1792, 1, 256]
    - [3, 5039.38]
  - - [23552, 1792, 1, 384]
    - [6, 5072.0]
  - - [13952, 1792, 1, 384]
    - [3, 5068.07]
  - - [24832, 1792, 1, 128]
    - [6, 4899.83]
  - - [43392, 1792, 1, 384]
    - [6, 5096.87]
  - - [14592, 1792, 1, 256]
    - [6, 5015.89]
  - - [4992, 1792, 1, 384]
    - [5, 4889.87]
  - - [1536, 1536, 1, 1536]
    - [5, 5060.01]
  - - [30592, 1792, 1, 128]
    - [8, 4910.68]
  - - [8192, 1792, 1, 384]
    - [5, 4689.17]
  - - [11392, 1792, 1, 256]
    - [6, 5039.05]
  - - [18432, 1792, 1, 128]
    - [8, 4845.9]
  - - [32512, 1792, 1, 384]
    - [6, 5084.98]
  - - [20992, 1792, 1, 256]
    - [6, 5025.79]
  - - [20352, 1792, 1, 128]
    - [6, 4908.06]
  - - [41472, 1792, 1, 128]
    - [8, 4908.9]
  - - [37632, 1792, 1, 256]
    - [6, 5036.18]
  - - [9472, 1792, 1, 256]
    - [6, 4939.18]
  - - [25472, 1792, 1, 128]
    - [6, 4897.21]
  - - [10112, 1792, 1, 256]
    - [6, 4994.4]
  - - [6272, 1792, 1, 256]
    - [5, 4914.92]
  - - [17152, 1792, 1, 384]
    - [6, 5069.78]
  - - [22912, 1792, 1, 384]
    - [3, 5067.39]
  - - [13312, 1792, 1, 256]
    - [8, 4976.53]
  - - [42112, 1792, 1, 256]
    - [6, 5061.42]
  - - [35072, 1792, 1, 384]
    - [6, 5089.61]
  - - [34432, 1792, 1, 384]
    - [6, 5098.86]
  - - [38912, 1792, 1, 384]
    - [3, 5075.89]
  - - [7936, 7936, 1, 7936]
    - [6, 5152.51]
  - - [29952, 1792, 1, 384]
    - [6, 5071.33]
  - - [3072, 1792, 1, 256]
    - [5, 4835.93]
  - - [8832, 1792, 1, 256]
    - [6, 4920.81]
  - - [3712, 1792, 1, 384]
    - [6, 4947.57]
  - - [40192, 1792, 1, 256]
    - [6, 5034.88]
  - - [7168, 7168, 1, 7168]
    - [6, 5194.56]
  - - [8832, 1792, 1, 128]
    - [6, 4787.2]
  - - [19712, 1792, 1, 256]
    - [6, 5016.65]
  - - [17792, 1792, 1, 384]
    - [6, 5096.9]
  - - [3584, 3584, 1, 3584]
    - [5, 5110.68]
  - - [4992, 1792, 1, 256]
    - [7, 4839.58]
  - - [28032, 1792, 1, 128]
    - [6, 4917.9]
  - - [27392, 1792, 1, 384]
    - [6, 5087.97]
  - - [38912, 1792, 1, 256]
    - [6, 5019.16]
  - - [28672, 1792, 1, 256]
    - [3, 4948.54]
  - - [21632, 1792, 1, 384]
    - [6, 5101.08]
  - - [3328, 3328, 1, 3328]
    - [5, 5020.5]
  - - [6912, 1792, 1, 256]
    - [3, 4937.08]
  - - [4352, 1792, 1, 384]
    - [6, 5008.41]
  - - [20992, 1792, 1, 128]
    - [8, 4884.81]
  - - [15232, 1792, 1, 256]
    - [6, 4989.36]
  - - [5632, 1792, 1, 256]
    - [5, 4866.44]
  - - [3712, 1792, 1, 256]
    - [6, 4856.51]
  - - [12032, 1792, 1, 384]
    - [6, 5005.89]
  - - [12672, 1792, 1, 256]
    - [3, 4986.19]
  - - [4352, 1792, 1, 256]
    - [6, 4939.6]
  - - [1, 1, 1, 256]
    - [10, 0.00916253]
  - - [64, 64, 1, 256]
    - [10, 41.8762]
  - - [64, 1, 1, 256]
    - [10, 0.655885]
  - - [1, 64, 1, 256]
    - [11, 0.623918]
  - - [43392, 1792, 1, 128]
    - [18, 4932.49]
  - - [7424, 7424, 1, 7424]
    - [16, 5155.82]
  - - [40832, 1792, 1, 256]
    - [16, 5049.42]
  - - [5632, 1792, 1, 384]
    - [15, 4926.69]
  - - [23552, 1792, 1, 256]
    - [16, 5029.52]
  - - [39552, 1792, 1, 256]
    - [16, 5053.2]
  - - [31232, 1792, 1, 384]
    - [16, 5089.49]
  - - [10112, 1792, 1, 384]
    - [16, 5038.77]
  - - [24832, 1792, 1, 384]
    - [16, 5101.04]
  - - [42752, 1792, 1, 384]
    - [13, 5084.83]
  - - [13952, 1792, 1, 128]
    - [17, 4862.86]
  - - [6400, 6400, 1, 6400]
    - [16, 5137.29]
  - - [33792, 1792, 1, 384]
    - [16, 5077.38]
  - - [40192, 1792, 1, 128]
    - [18, 4912.28]
  - - [5632, 5632, 1, 5632]
    - [16, 5152.04]
  - - [15232, 1792, 1, 128]
    - [16, 4855.81]
  - - [4352, 1792, 1, 128]
    - [18, 4755.81]
  - - [10752, 1792, 1, 256]
    - [16, 4988.67]
  - - [44032, 1792, 1, 128]
    - [18, 4917.94]
  - - [6272, 1792, 1, 384]
    - [15, 4971.59]
  - - [21632, 1792, 1, 128]
    - [16, 4913.9]
  - - [38272, 1792, 1, 128]
    - [17, 4935.83]
  - - [12032, 1792, 1, 256]
    - [13, 4943.66]
  - - [40832, 1792, 1, 128]
    - [16, 4926.81]
  - - [512, 512, 1, 512]
    - [14, 4660.34]
  - - [12672, 1792, 1, 128]
    - [16, 4857.21]
  - - [10752, 1792, 1, 384]
    - [16, 5051.3]
  - - [5376, 5376, 1, 5376]
    - [16, 5122.21]
  - - [44032, 1792, 1, 256]
    - [16, 5040.89]
  - - [15872, 1792, 1, 384]
    - [16, 5043.76]
  - - [3072, 3072, 1, 3072]
    - [16, 5182.56]
  - - [5632, 1792, 1, 128]
    - [18, 4666.73]
  - - [36352, 1792, 1, 128]
    - [18, 4912.15]
  - - [256, 256, 1, 256]
    - [12, 2031.14]
  - - [29312, 1792, 1, 384]
    - [16, 5076.33]
  - - [7552, 1792, 1, 384]
    - [16, 5062.09]
  - - [7680, 7680, 1, 7680]
    - [16, 5187.3]
  - - [17792, 1792, 1, 128]
    - [13, 4892.88]
  - - [30592, 1792, 1, 384]
    - [13, 5089.3]
  - - [29312, 1792, 1, 128]
    - [16, 4915.53]
  - - [11392, 1792, 1, 384]
    - [16, 5080.52]
  - - [5888, 5888, 1, 5888]
    - [16, 5132.22]
  - - [28032, 1792, 1, 256]
    - [16, 5054.25]
  - - [6144, 6144, 1, 6144]
    - [16, 5193.11]
  - - [28672, 1792, 1, 128]
    - [18, 4619.87]
  - - [4864, 4864, 1, 4864]
    - [16, 5100.0]
  - - [38272, 1792, 1, 384]
    - [16, 5098.84]
  - - [24192, 1792, 1, 128]
    - [16, 4909.63]
  - - [25472, 1792, 1, 256]
    - [16, 5025.68]
  - - [35072, 1792, 1, 128]
    - [16, 4902.65]
  - - [32512, 1792, 1, 256]
    - [16, 5031.18]
  - - [2560, 2560, 1, 2560]
    - [15, 5096.85]
  - - [3840, 3840, 1, 3840]
    - [15, 5043.45]
  - - [38272, 1792, 1, 256]
    - [16, 5058.26]
  - - [37632, 1792, 1, 128]
    - [18, 4896.35]
  - - [36352, 1792, 1, 384]
    - [16, 5075.71]
  - - [29952, 1792, 1, 128]
    - [16, 4892.3]
  - - [5120, 5120, 1, 5120]
    - [16, 5201.55]
  - - [8192, 1792, 1, 128]
    - [19, 4380.47]
  - - [13312, 1792, 1, 128]
    - [18, 4845.52]
  - - [2304, 2304, 1, 2304]
    - [15, 4924.93]
  - - [38912, 1792, 1, 128]
    - [18, 4887.78]
  - - [42112, 1792, 1, 384]
    - [13, 5104.87]
  - - [15232, 1792, 1, 384]
    - [16, 5024.47]
  - - [31872, 1792, 1, 128]
    - [17, 4914.47]
  - - [16512, 1792, 1, 256]
    - [13, 5001.39]
  - - [16512, 1792, 1, 384]
    - [16, 5054.43]
  - - [15872, 1792, 1, 256]
    - [16, 4991.71]
  - - [39552, 1792, 1, 384]
    - [16, 5081.54]
  - - [22272, 1792, 1, 256]
    - [16, 5006.13]
  - - [6912, 6912, 1, 6912]
    - [16, 5152.85]
  - - [8832, 1792, 1, 384]
    - [16, 4983.63]
  - - [35072, 1792, 1, 256]
    - [16, 5051.47]
  - - [36992, 1792, 1, 384]
    - [16, 5088.37]
  - - [43392, 1792, 1, 256]
    - [16, 5045.38]
  - - [8192, 8192, 1, 8192]
    - [16, 5177.56]
  - - [16512, 1792, 1, 128]
    - [18, 4877.6]
  - - [44032, 1792, 1, 384]
    - [16, 5097.45]
  - - [27392, 1792, 1, 256]
    - [16, 5047.97]
  - - [33152, 1792, 1, 128]
    - [17, 4912.51]
  - - [7552, 1792, 1, 128]
    - [18, 4809.92]
  - - [4608, 4608, 1, 4608]
    - [13, 5130.54]
  - - [39552, 1792, 1, 128]
    - [17, 4921.11]
  - - [6656, 6656, 1, 6656]
    - [16, 5165.68]
  - - [3072, 1792, 1, 384]
    - [15, 4946.71]
  - - [36992, 1792, 1, 128]
    - [18, 4923.73]
  - - [36992, 1792, 1, 256]
    - [16, 5042.17]
  - - [23552, 1792, 1, 128]
    - [18, 4886.27]
  - - [31872, 1792, 1, 256]
    - [16, 5054.39]
  - - [15872, 1792, 1, 128]
    - [16, 4842.07]
  - - [8192, 1792, 1, 256]
    - [15, 4584.05]
  - - [40832, 1792, 1, 384]
    - [16, 5104.93]
  - - [26752, 1792, 1, 256]
    - [16, 5040.05]
  - - [19072, 1792, 1, 128]
    - [13, 4887.55]
  - - [18432, 1792, 1, 384]
    - [13, 5073.02]
  - - [768, 768, 1, 768]
    - [12, 4503.73]
  - - [29952, 1792, 1, 256]
    - [16, 5027.41]
  - - [29312, 1792, 1, 256]
    - [16, 5028.32]
  - - [40192, 1792, 1, 384]
    - [16, 5086.78]
  - - [32512, 1792, 1, 128]
    - [18, 4902.36]
  - - [11392, 1792, 1, 128]
    - [16, 4873.45]
  - - [42752, 1792, 1, 256]
    - [16, 5033.56]
  - - [20352, 1792, 1, 384]
    - [16, 5075.92]
  - - [19712, 1792, 1, 128]
    - [16, 4881.73]
  - - [20992, 1792, 1, 384]
    - [16, 5075.85]
  - - [18432, 1792, 1, 256]
    - [13, 4994.39]
  - - [10752, 1792, 1, 128]
    - [16, 4824.05]
  - - [4992, 1792, 1, 128]
    - [15, 4687.04]
  - - [2048, 2048, 1, 2048]
    - [16, 5154.41]
  - - [26752, 1792, 1, 128]
    - [17, 4906.65]
  - - [19712, 1792, 1, 384]
    - [16, 5052.96]
  - - [26112, 1792, 1, 256]
    - [16, 5007.53]
  - - [3072, 1792, 1, 128]
    - [15, 4623.03]
  - - [22272, 1792, 1, 384]
    - [16, 5057.08]
  - - [12032, 1792, 1, 128]
    - [13, 4803.91]
  - - [34432, 1792, 1, 256]
    - [13, 5044.01]
  - - [22272, 1792, 1, 128]
    - [16, 4871.61]
  - - [1024, 1024, 1, 1024]
    - [16, 5064.82]
  - - [41472, 1792, 1, 256]
    - [16, 5044.5]
  - - [12672, 1792, 1, 384]
    - [16, 5036.82]
  - - [13312, 1792, 1, 384]
    - [16, 5043.19]
  - - [7552, 1792, 1, 256]
    - [16, 5006.63]
  - - [9472, 1792, 1, 384]
    - [16, 4997.04]
  - - [41472, 1792, 1, 384]
    - [16, 5087.92]
  - - [31232, 1792, 1, 128]
    - [16, 4900.45]
  - - [35712, 1792, 1, 256]
    - [16, 5034.55]
  - - [24832, 1792, 1, 256]
    - [16, 5045.58]
  - - [33792, 1792, 1, 256]
    - [16, 5035.09]
  - - [14592, 1792, 1, 128]
    - [16, 4867.73]
  - - [21632, 1792, 1, 256]
    - [13, 5046.95]
  - - [26752, 1792, 1, 384]
    - [16, 5077.33]
  - - [33792, 1792, 1, 128]
    - [18, 4902.88]
  - - [27392, 1792, 1, 128]
    - [16, 4892.13]
  - - [4096, 4096, 1, 4096]
    - [16, 5174.69]
  - - [6272, 1792, 1, 128]
    - [13, 4738.93]
  - - [22912, 1792, 1, 256]
    - [16, 5025.68]
  - - [6912, 1792, 1, 384]
    - [16, 4999.2]
  - - [34432, 1792, 1, 128]
    - [17, 4924.35]
  - - [35712, 1792, 1, 384]
    - [16, 5065.95]
  - - [42112, 1792, 1, 128]
    - [17, 4928.3]
  - - [30592, 1792, 1, 256]
    - [16, 5038.5]
  - - [17152, 1792, 1, 128]
    - [16, 4864.19]
  - - [1792, 1792, 1, 1792]
    - [15, 4797.0]
  - - [36352, 1792, 1, 256]
    - [16, 5029.14]
  - - [26112, 1792, 1, 384]
    - [16, 5077.62]
  - - [4352, 4352, 1, 4352]
    - [16, 5075.51]
  - - [17152, 1792, 1, 256]
    - [16, 5018.18]
  - - [19072, 1792, 1, 256]
    - [16, 4994.35]
  - - [42752, 1792, 1, 128]
    - [18, 4910.21]
  - - [26112, 1792, 1, 128]
    - [18, 4893.11]
  - - [2816, 2816, 1, 2816]
    - [15, 4983.56]
  - - [24192, 1792, 1, 384]
    - [16, 5099.05]
  - - [22912, 1792, 1, 128]
    - [13, 4904.31]
  - - [10112, 1792, 1, 128]
    - [16, 4826.95]
  - - [14592, 1792, 1, 384]
    - [16, 5072.06]
  - - [17792, 1792, 1, 256]
    - [16, 5037.22]
  - - [9472, 1792, 1, 128]
    - [18, 4816.55]
  - - [31232, 1792, 1, 256]
    - [16, 5053.62]
  - - [31872, 1792, 1, 384]
    - [16, 5103.86]
  - - [19072, 1792, 1, 384]
    - [13, 5042.64]
  - - [35712, 1792, 1, 128]
    - [16, 4916.08]
  - - [25472, 1792, 1, 384]
    - [16, 5078.13]
  - - [33152, 1792, 1, 384]
    - [16, 5085.44]
  - - [20352, 1792, 1, 256]
    - [16, 5020.87]
  - - [28672, 1792, 1, 384]
    - [13, 5028.16]
  - - [37632, 1792, 1, 384]
    - [16, 5086.87]
  - - [6912, 1792, 1, 128]
    - [16, 4784.66]
  - - [33152, 1792, 1, 256]
    - [16, 5037.57]
  - - [28032, 1792, 1, 384]
    - [16, 5103.85]
  - - [3712, 1792, 1, 128]
    - [13, 4634.97]
  - - [13952, 1792, 1, 256]
    - [16, 5025.76]
  - - [1280, 1280, 1, 1280]
    - [12, 4689.72]
  - - [24192, 1792, 1, 256]
    - [13, 5039.38]
  - - [23552, 1792, 1, 384]
    - [16, 5072.0]
  - - [13952, 1792, 1, 384]
    - [13, 5068.07]
  - - [24832, 1792, 1, 128]
    - [16, 4899.83]
  - - [43392, 1792, 1, 384]
    - [16, 5096.87]
  - - [14592, 1792, 1, 256]
    - [16, 5015.89]
  - - [4992, 1792, 1, 384]
    - [15, 4889.87]
  - - [1536, 1536, 1, 1536]
    - [15, 5060.01]
  - - [30592, 1792, 1, 128]
    - [18, 4910.68]
  - - [8192, 1792, 1, 384]
    - [15, 4689.17]
  - - [11392, 1792, 1, 256]
    - [16, 5039.05]
  - - [18432, 1792, 1, 128]
    - [18, 4845.9]
  - - [32512, 1792, 1, 384]
    - [16, 5084.98]
  - - [20992, 1792, 1, 256]
    - [16, 5025.79]
  - - [20352, 1792, 1, 128]
    - [16, 4908.06]
  - - [41472, 1792, 1, 128]
    - [18, 4908.9]
  - - [37632, 1792, 1, 256]
    - [16, 5036.18]
  - - [9472, 1792, 1, 256]
    - [16, 4939.18]
  - - [25472, 1792, 1, 128]
    - [16, 4897.21]
  - - [10112, 1792, 1, 256]
    - [16, 4994.4]
  - - [6272, 1792, 1, 256]
    - [15, 4914.92]
  - - [17152, 1792, 1, 384]
    - [16, 5069.78]
  - - [22912, 1792, 1, 384]
    - [13, 5067.39]
  - - [13312, 1792, 1, 256]
    - [18, 4976.53]
  - - [42112, 1792, 1, 256]
    - [16, 5061.42]
  - - [35072, 1792, 1, 384]
    - [16, 5089.61]
  - - [34432, 1792, 1, 384]
    - [16, 5098.86]
  - - [38912, 1792, 1, 384]
    - [13, 5075.89]
  - - [7936, 7936, 1, 7936]
    - [16, 5152.51]
  - - [29952, 1792, 1, 384]
    - [16, 5071.33]
  - - [3072, 1792, 1, 256]
    - [15, 4835.93]
  - - [8832, 1792, 1, 256]
    - [16, 4920.81]
  - - [3712, 1792, 1, 384]
    - [16, 4947.57]
  - - [40192, 1792, 1, 256]
    - [16, 5034.88]
  - - [7168, 7168, 1, 7168]
    - [16, 5194.56]
  - - [8832, 1792, 1, 128]
    - [16, 4787.2]
  - - [19712, 1792, 1, 256]
    - [16, 5016.65]
  - - [17792, 1792, 1, 384]
    - [16, 5096.9]
  - - [3584, 3584, 1, 3584]
    - [15, 5110.68]
  - - [4992, 1792, 1, 256]
    - [17, 4839.58]
  - - [28032, 1792, 1, 128]
    - [16, 4917.9]
  - - [27392, 1792, 1, 384]
    - [16, 5087.97]
  - - [38912, 1792, 1, 256]
    - [16, 5019.16]
  - - [28672, 1792, 1, 256]
    - [13, 4948.54]
  - - [21632, 1792, 1, 384]
    - [16, 5101.08]
  - - [3328, 3328, 1, 3328]
    - [15, 5020.5]
  - - [6912, 1792, 1, 256]
    - [13, 4937.08]
  - - [4352, 1792, 1, 384]
    - [16, 5008.41]
  - - [20992, 1792, 1, 128]
    - [18, 4884.81]
  - - [15232, 1792, 1, 256]
    - [16, 4989.36]
  - - [5632, 1792, 1, 256]
    - [15, 4866.44]
  - - [3712, 1792, 1, 256]
    - [16, 4856.51]
  - - [12032, 1792, 1, 384]
    - [16, 5005.89]
  - - [12672, 1792, 1, 256]
    - [13, 4986.19]
  - - [4352, 1792, 1, 256]
    - [16, 4939.6]
- null
