library/src/blas3/Tensile/Logic/asm_full/vega10_Cijk_Ailk_Bjlk_HBH_GB.yaml
- {MinimumRequiredVersion: 4.26.0}
- vega10
- gfx900
- [Device 6863, Device 6862, Device 687f, Device 6860, Device 6861, 'Vega 10 XTX [Radeon
    SolutionIndex: 0
    SolutionNameMin: Cijk_Ailk_Bjlk_HBH_GB_MT32x32x8_SN_GRVW4_LRVW4_TT4_4_VW4_WG8_8_1_WGM1
    SolutionIndex: 1
    SolutionNameMin: Cijk_Ailk_Bjlk_HBH_GB_MT32x64x8_SN_GRVW4_LRVW4_TT4_8_VW4_WG8_8_1_WGM1
    SolutionIndex: 2
    SolutionNameMin: Cijk_Ailk_Bjlk_HBH_GB_MT32x32x16_SN_GRVW4_LRVW4_TT4_4_VW4_WG8_8_1_WGM1
    SolutionIndex: 3
    SolutionNameMin: Cijk_Ailk_Bjlk_HBH_GB_MT64x64x16_SN_GRVW4_LRVW4_TT4_4_VW4_WG16_16_1_WGM1
    SolutionIndex: 4
    SolutionNameMin: Cijk_Ailk_Bjlk_HBH_GB_MT128x64x16_SN_GRVW4_LRVW4_TT8_4_VW4_WG16_16_1_WGM1
    SolutionIndex: 5
    SolutionNameMin: Cijk_Ailk_Bjlk_HBH_GB_MT64x128x16_SN_GRVW4_LRVW4_TT4_8_VW4_WG16_16_1_WGM1
    SolutionIndex: 6
    SolutionNameMin: Cijk_Ailk_Bjlk_HBH_GB_MT32x32x32_SN_GRVW4_LRVW4_TT4_4_VW4_WG8_8_1_WGM1
    SolutionIndex: 7
    SolutionNameMin: Cijk_Ailk_Bjlk_HBH_GB_MT64x64x32_SN_GRVW4_LRVW4_TT4_4_VW4_WG16_16_1_WGM1
    SolutionIndex: 8
    SolutionNameMin: Cijk_Ailk_Bjlk_HBH_GB_MT64x64x8_SN_GRVW2_LRVW2_TT4_4_VW2_WG16_16_1_WGM1
    SolutionIndex: 9
    SolutionNameMin: Cijk_Ailk_Bjlk_HBH_GB_MT64x128x8_SN_GRVW2_LRVW2_TT4_8_VW2_WG16_16_1_WGM1
    SolutionIndex: 10
    SolutionNameMin: Cijk_Ailk_Bjlk_HBH_GB_MT64x64x16_SN_GRVW2_LRVW2_TT4_4_VW2_WG16_16_1_WGM1
    SolutionIndex: 11
    SolutionNameMin: Cijk_Ailk_Bjlk_HBH_GB_MT64x64x32_SN_GRVW2_LRVW2_TT4_4_VW2_WG16_16_1_WGM1
    SolutionIndex: 12
    SolutionNameMin: Cijk_Ailk_Bjlk_HBH_GB_MT32x32x8_SN_GRVW4_LRVW4_TT4_4_VW4_WG8_8_1_WGM8
    SolutionIndex: 13
    SolutionNameMin: Cijk_Ailk_Bjlk_HBH_GB_MT32x32x16_SN_GRVW4_LRVW4_TT4_4_VW4_WG8_8_1_WGM8
    SolutionIndex: 14
    SolutionNameMin: Cijk_Ailk_Bjlk_HBH_GB_MT64x64x16_SN_GRVW4_LRVW4_TT4_4_VW4_WG16_16_1_WGM8
    SolutionIndex: 15
    SolutionNameMin: Cijk_Ailk_Bjlk_HBH_GB_MT128x64x16_SN_GRVW4_LRVW4_TT8_4_VW4_WG16_16_1_WGM8
    SolutionIndex: 16
    SolutionNameMin: Cijk_Ailk_Bjlk_HBH_GB_MT64x128x16_SN_GRVW4_LRVW4_TT4_8_VW4_WG16_16_1_WGM8
    SolutionIndex: 17
    SolutionNameMin: Cijk_Ailk_Bjlk_HBH_GB_MT64x64x32_SN_GRVW4_LRVW4_TT4_4_VW4_WG16_16_1_WGM8
    SolutionIndex: 18
    SolutionNameMin: Cijk_Ailk_Bjlk_HBH_GB_MT64x64x8_SN_GRVW2_LRVW2_TT4_4_VW2_WG16_16_1_WGM8
    SolutionIndex: 19
    SolutionNameMin: Cijk_Ailk_Bjlk_HBH_GB_MT128x64x8_SN_GRVW2_LRVW2_TT8_4_VW2_WG16_16_1_WGM8
    SolutionIndex: 20
    SolutionNameMin: Cijk_Ailk_Bjlk_HBH_GB_MT64x128x8_SN_GRVW2_LRVW2_TT4_8_VW2_WG16_16_1_WGM8
    SolutionIndex: 21
    SolutionNameMin: Cijk_Ailk_Bjlk_HBH_GB_MT64x64x16_SN_GRVW2_LRVW2_TT4_4_VW2_WG16_16_1_WGM8
    SolutionIndex: 22
    SolutionNameMin: Cijk_Ailk_Bjlk_HBH_GB_MT128x64x16_SN_GRVW2_LRVW2_TT8_4_VW2_WG16_16_1_WGM8
    SolutionIndex: 23
    SolutionNameMin: Cijk_Ailk_Bjlk_HBH_GB_MT64x64x32_SN_GRVW2_LRVW2_TT4_4_VW2_WG16_16_1_WGM8
- - - [32, 32, 8, 32, 32, 32, 32, 32]
    - [12, 62.0]
  - - [32, 32, 8, 64, 32, 32, 32, 32]
    - [0, 95.0]
  - - [32, 32, 8, 128, 32, 32, 32, 32]
    - [0, 130.0]
  - - [32, 32, 8, 256, 32, 32, 32, 32]
    - [0, 158.0]
  - - [32, 32, 8, 512, 32, 32, 32, 32]
    - [13, 181.0]
  - - [32, 64, 8, 32, 32, 32, 32, 64]
    - [0, 130.0]
  - - [32, 64, 8, 64, 32, 32, 32, 64]
    - [0, 197.0]
  - - [32, 64, 8, 128, 32, 32, 32, 64]
    - [0, 266.0]
  - - [32, 64, 8, 256, 32, 32, 32, 64]
    - [0, 323.0]
  - - [32, 64, 8, 512, 32, 32, 32, 64]
    - [13, 367.0]
  - - [32, 128, 8, 32, 32, 32, 32, 128]
    - [0, 272.0]
  - - [32, 128, 8, 64, 32, 32, 32, 128]
    - [0, 400.0]
  - - [32, 128, 8, 128, 32, 32, 32, 128]
    - [0, 543.0]
  - - [32, 128, 8, 256, 32, 32, 32, 128]
    - [13, 655.0]
  - - [32, 128, 8, 512, 32, 32, 32, 128]
    - [2, 743.0]
  - - [32, 256, 8, 32, 32, 32, 32, 256]
    - [0, 543.0]
  - - [32, 256, 8, 64, 32, 32, 32, 256]
    - [0, 812.0]
  - - [32, 256, 8, 128, 32, 32, 32, 256]
    - [0, 1069.0]
  - - [32, 256, 8, 256, 32, 32, 32, 256]
    - [2, 1258.0]
  - - [32, 256, 8, 512, 32, 32, 32, 256]
    - [2, 1435.0]
  - - [32, 512, 8, 32, 32, 32, 32, 512]
    - [0, 924.0]
  - - [32, 512, 8, 64, 32, 32, 32, 512]
    - [0, 1291.0]
  - - [32, 512, 8, 128, 32, 32, 32, 512]
    - [2, 1522.0]
  - - [32, 512, 8, 256, 32, 32, 32, 512]
    - [13, 1599.0]
  - - [32, 512, 8, 512, 32, 32, 32, 512]
    - [13, 1809.0]
  - - [64, 32, 8, 32, 64, 64, 64, 32]
    - [0, 126.0]
  - - [64, 32, 8, 64, 64, 64, 64, 32]
    - [0, 194.0]
  - - [64, 32, 8, 128, 64, 64, 64, 32]
    - [0, 267.0]
  - - [64, 32, 8, 256, 64, 64, 64, 32]
    - [0, 322.0]
  - - [64, 32, 8, 512, 64, 64, 64, 32]
    - [2, 367.0]
  - - [64, 64, 8, 32, 64, 64, 64, 64]
    - [0, 266.0]
  - - [64, 64, 8, 64, 64, 64, 64, 64]
    - [0, 402.0]
  - - [64, 64, 8, 128, 64, 64, 64, 64]
    - [0, 543.0]
  - - [64, 64, 8, 256, 64, 64, 64, 64]
    - [13, 655.0]
  - - [64, 64, 8, 512, 64, 64, 64, 64]
    - [13, 745.0]
  - - [64, 128, 8, 32, 64, 64, 64, 128]
    - [0, 543.0]
  - - [64, 128, 8, 64, 64, 64, 64, 128]
    - [0, 817.0]
  - - [64, 128, 8, 128, 64, 64, 64, 128]
    - [0, 1067.0]
  - - [64, 128, 8, 256, 64, 64, 64, 128]
    - [14, 1262.0]
  - - [64, 128, 8, 512, 64, 64, 64, 128]
    - [2, 1451.0]
  - - [64, 256, 8, 32, 64, 64, 64, 256]
    - [18, 1018.0]
  - - [64, 256, 8, 64, 64, 64, 64, 256]
    - [3, 1498.0]
  - - [64, 256, 8, 128, 64, 64, 64, 256]
    - [3, 1987.0]
  - - [64, 256, 8, 256, 64, 64, 64, 256]
    - [3, 2201.0]
  - - [64, 256, 8, 512, 64, 64, 64, 256]
    - [17, 2484.0]
  - - [64, 512, 8, 32, 64, 64, 64, 512]
    - [3, 1740.0]
  - - [64, 512, 8, 64, 64, 64, 64, 512]
    - [3, 2374.0]
  - - [64, 512, 8, 128, 64, 64, 64, 512]
    - [3, 2729.0]
  - - [64, 512, 8, 256, 64, 64, 64, 512]
    - [21, 2750.0]
  - - [64, 512, 8, 512, 64, 64, 64, 512]
    - [5, 3139.0]
  - - [128, 32, 8, 32, 128, 128, 128, 32]
    - [12, 266.0]
  - - [128, 32, 8, 64, 128, 128, 128, 32]
    - [0, 405.0]
  - - [128, 32, 8, 128, 128, 128, 128, 32]
    - [0, 542.0]
  - - [128, 32, 8, 256, 128, 128, 128, 32]
    - [2, 654.0]
  - - [128, 32, 8, 512, 128, 128, 128, 32]
    - [13, 743.0]
  - - [128, 64, 8, 32, 128, 128, 128, 64]
    - [0, 538.0]
  - - [128, 64, 8, 64, 128, 128, 128, 64]
    - [0, 811.0]
  - - [128, 64, 8, 128, 128, 128, 128, 64]
    - [0, 1055.0]
  - - [128, 64, 8, 256, 128, 128, 128, 64]
    - [14, 1269.0]
  - - [128, 64, 8, 512, 128, 128, 128, 64]
    - [13, 1448.0]
  - - [128, 128, 8, 32, 128, 128, 128, 128]
    - [18, 1011.0]
  - - [128, 128, 8, 64, 128, 128, 128, 128]
    - [18, 1498.0]
  - - [128, 128, 8, 128, 128, 128, 128, 128]
    - [3, 1956.0]
  - - [128, 128, 8, 256, 128, 128, 128, 128]
    - [3, 2176.0]
  - - [128, 128, 8, 512, 128, 128, 128, 128]
    - [14, 2500.0]
  - - [128, 256, 8, 32, 128, 128, 128, 256]
    - [3, 1716.0]
  - - [128, 256, 8, 64, 128, 128, 128, 256]
    - [14, 2382.0]
  - - [128, 256, 8, 128, 128, 128, 128, 256]
    - [10, 2749.0]
  - - [128, 256, 8, 256, 128, 128, 128, 256]
    - [3, 2968.0]
  - - [128, 256, 8, 512, 128, 128, 128, 256]
    - [16, 3194.0]
  - - [128, 512, 8, 32, 128, 128, 128, 512]
    - [8, 2755.0]
  - - [128, 512, 8, 64, 128, 128, 128, 512]
    - [18, 3819.0]
  - - [128, 512, 8, 128, 128, 128, 128, 512]
    - [17, 3595.0]
  - - [128, 512, 8, 256, 128, 128, 128, 512]
    - [23, 3918.0]
  - - [128, 512, 8, 512, 128, 128, 128, 512]
    - [3, 4287.0]
  - - [256, 32, 8, 32, 256, 256, 256, 32]
    - [12, 532.0]
  - - [256, 32, 8, 64, 256, 256, 256, 32]
    - [0, 808.0]
  - - [256, 32, 8, 128, 256, 256, 256, 32]
    - [12, 1041.0]
  - - [256, 32, 8, 256, 256, 256, 256, 32]
    - [12, 1180.0]
  - - [256, 32, 8, 512, 256, 256, 256, 32]
    - [2, 1395.0]
  - - [256, 64, 8, 32, 256, 256, 256, 64]
    - [7, 1020.0]
  - - [256, 64, 8, 64, 256, 256, 256, 64]
    - [18, 1492.0]
  - - [256, 64, 8, 128, 256, 256, 256, 64]
    - [3, 1941.0]
  - - [256, 64, 8, 256, 256, 256, 256, 64]
    - [3, 2165.0]
  - - [256, 64, 8, 512, 256, 256, 256, 64]
    - [7, 2443.0]
  - - [256, 128, 8, 32, 256, 256, 256, 128]
    - [18, 1716.0]
  - - [256, 128, 8, 64, 256, 256, 256, 128]
    - [3, 2325.0]
  - - [256, 128, 8, 128, 256, 256, 256, 128]
    - [3, 2757.0]
  - - [256, 128, 8, 256, 256, 256, 256, 128]
    - [7, 2991.0]
  - - [256, 128, 8, 512, 256, 256, 256, 128]
    - [23, 3016.0]
  - - [256, 256, 8, 32, 256, 256, 256, 256]
    - [10, 2874.0]
  - - [256, 256, 8, 64, 256, 256, 256, 256]
    - [3, 3740.0]
  - - [256, 256, 8, 128, 256, 256, 256, 256]
    - [8, 3695.0]
  - - [256, 256, 8, 256, 256, 256, 256, 256]
    - [11, 3935.0]
  - - [256, 256, 8, 512, 256, 256, 256, 256]
    - [14, 4417.0]
  - - [256, 512, 8, 32, 256, 256, 256, 512]
    - [14, 3905.0]
  - - [256, 512, 8, 64, 256, 256, 256, 512]
    - [1, 4028.0]
  - - [256, 512, 8, 128, 256, 256, 256, 512]
    - [15, 4036.0]
  - - [256, 512, 8, 256, 256, 256, 256, 512]
    - [10, 4752.0]
  - - [256, 512, 8, 512, 256, 256, 256, 512]
    - [3, 5080.0]
  - - [512, 32, 8, 32, 512, 512, 512, 32]
    - [12, 1033.0]
  - - [512, 32, 8, 64, 512, 512, 512, 32]
    - [12, 1475.0]
  - - [512, 32, 8, 128, 512, 512, 512, 32]
    - [2, 1880.0]
  - - [512, 32, 8, 256, 512, 512, 512, 32]
    - [12, 2027.0]
  - - [512, 32, 8, 512, 512, 512, 512, 32]
    - [6, 2340.0]
  - - [512, 64, 8, 32, 512, 512, 512, 64]
    - [0, 1716.0]
  - - [512, 64, 8, 64, 512, 512, 512, 64]
    - [14, 2372.0]
  - - [512, 64, 8, 128, 512, 512, 512, 64]
    - [3, 2849.0]
  - - [512, 64, 8, 256, 512, 512, 512, 64]
    - [17, 2901.0]
  - - [512, 64, 8, 512, 512, 512, 512, 64]
    - [4, 3064.0]
  - - [512, 128, 8, 32, 512, 512, 512, 128]
    - [0, 2900.0]
  - - [512, 128, 8, 64, 512, 512, 512, 128]
    - [18, 3753.0]
  - - [512, 128, 8, 128, 512, 512, 512, 128]
    - [7, 3708.0]
  - - [512, 128, 8, 256, 512, 512, 512, 128]
    - [7, 4109.0]
  - - [512, 128, 8, 512, 512, 512, 512, 128]
    - [3, 4365.0]
  - - [512, 256, 8, 32, 512, 512, 512, 256]
    - [14, 3768.0]
  - - [512, 256, 8, 64, 512, 512, 512, 256]
    - [8, 4192.0]
  - - [512, 256, 8, 128, 512, 512, 512, 256]
    - [19, 3986.0]
  - - [512, 256, 8, 256, 512, 512, 512, 256]
    - [3, 4993.0]
  - - [512, 256, 8, 512, 512, 512, 512, 256]
    - [10, 5142.0]
  - - [512, 512, 8, 32, 512, 512, 512, 512]
    - [9, 3778.0]
  - - [512, 512, 8, 64, 512, 512, 512, 512]
    - [20, 3888.0]
  - - [512, 512, 8, 128, 512, 512, 512, 512]
    - [5, 4987.0]
  - - [512, 512, 8, 256, 512, 512, 512, 512]
    - [22, 5599.0]
  - - [512, 512, 8, 512, 512, 512, 512, 512]
    - [15, 6008.0]
- null
