library/src/blas3/Tensile/Logic/asm_full/vega20_Cijk_Ailk_Bjlk_ZB_GB.yaml
- {MinimumRequiredVersion: 4.26.0}
- vega20
- gfx906
- [Device 66a0, Device 66a1, Device 66a7, Device 66af, Vega 20]
    SolutionIndex: 0
    SolutionNameMin: Cijk_Ailk_Bjlk_ZB_GB_MT32x32x8_SN_WG8_8_1_WGM1
    SolutionIndex: 1
    SolutionNameMin: Cijk_Ailk_Bjlk_ZB_GB_MT64x64x8_SN_WG16_16_1_WGM1
    SolutionIndex: 2
    SolutionNameMin: Cijk_Ailk_Bjlk_ZB_GB_MT32x32x8_SN_WG8_8_1_WGM8
- - - [32, 32, 8, 32, 32, 32, 32, 32]
    - [0, 29.0]
  - - [32, 32, 8, 64, 32, 32, 32, 32]
    - [0, 36.0]
  - - [32, 32, 8, 128, 32, 32, 32, 32]
    - [0, 42.0]
  - - [32, 32, 8, 256, 32, 32, 32, 32]
    - [2, 45.0]
  - - [32, 32, 8, 512, 32, 32, 32, 32]
    - [0, 45.0]
  - - [32, 64, 8, 32, 32, 32, 32, 64]
    - [0, 63.0]
  - - [32, 64, 8, 64, 32, 32, 32, 64]
    - [0, 76.0]
  - - [32, 64, 8, 128, 32, 32, 32, 64]
    - [0, 85.0]
  - - [32, 64, 8, 256, 32, 32, 32, 64]
    - [0, 89.0]
  - - [32, 64, 8, 512, 32, 32, 32, 64]
    - [0, 91.0]
  - - [32, 128, 8, 32, 32, 32, 32, 128]
    - [0, 126.0]
  - - [32, 128, 8, 64, 32, 32, 32, 128]
    - [0, 153.0]
  - - [32, 128, 8, 128, 32, 32, 32, 128]
    - [0, 170.0]
  - - [32, 128, 8, 256, 32, 32, 32, 128]
    - [0, 178.0]
  - - [32, 128, 8, 512, 32, 32, 32, 128]
    - [0, 185.0]
  - - [32, 256, 8, 32, 32, 32, 32, 256]
    - [0, 248.0]
  - - [32, 256, 8, 64, 32, 32, 32, 256]
    - [0, 301.0]
  - - [32, 256, 8, 128, 32, 32, 32, 256]
    - [0, 336.0]
  - - [32, 256, 8, 256, 32, 32, 32, 256]
    - [0, 359.0]
  - - [32, 256, 8, 512, 32, 32, 32, 256]
    - [0, 372.0]
  - - [32, 512, 8, 32, 32, 32, 32, 512]
    - [0, 464.0]
  - - [32, 512, 8, 64, 32, 32, 32, 512]
    - [0, 573.0]
  - - [32, 512, 8, 128, 32, 32, 32, 512]
    - [0, 656.0]
  - - [32, 512, 8, 256, 32, 32, 32, 512]
    - [0, 706.0]
  - - [32, 512, 8, 512, 32, 32, 32, 512]
    - [0, 735.0]
  - - [64, 32, 8, 32, 64, 64, 64, 32]
    - [0, 63.0]
  - - [64, 32, 8, 64, 64, 64, 64, 32]
    - [0, 76.0]
  - - [64, 32, 8, 128, 64, 64, 64, 32]
    - [0, 85.0]
  - - [64, 32, 8, 256, 64, 64, 64, 32]
    - [0, 89.0]
  - - [64, 32, 8, 512, 64, 64, 64, 32]
    - [0, 91.0]
  - - [64, 64, 8, 32, 64, 64, 64, 64]
    - [0, 128.0]
  - - [64, 64, 8, 64, 64, 64, 64, 64]
    - [0, 153.0]
  - - [64, 64, 8, 128, 64, 64, 64, 64]
    - [0, 170.0]
  - - [64, 64, 8, 256, 64, 64, 64, 64]
    - [0, 178.0]
  - - [64, 64, 8, 512, 64, 64, 64, 64]
    - [0, 185.0]
  - - [64, 128, 8, 32, 64, 64, 64, 128]
    - [0, 249.0]
  - - [64, 128, 8, 64, 64, 64, 64, 128]
    - [0, 302.0]
  - - [64, 128, 8, 128, 64, 64, 64, 128]
    - [0, 337.0]
  - - [64, 128, 8, 256, 64, 64, 64, 128]
    - [0, 359.0]
  - - [64, 128, 8, 512, 64, 64, 64, 128]
    - [0, 373.0]
  - - [64, 256, 8, 32, 64, 64, 64, 256]
    - [0, 463.0]
  - - [64, 256, 8, 64, 64, 64, 64, 256]
    - [0, 567.0]
  - - [64, 256, 8, 128, 64, 64, 64, 256]
    - [0, 653.0]
  - - [64, 256, 8, 256, 64, 64, 64, 256]
    - [0, 704.0]
  - - [64, 256, 8, 512, 64, 64, 64, 256]
    - [0, 734.0]
  - - [64, 512, 8, 32, 64, 64, 64, 512]
    - [1, 786.0]
  - - [64, 512, 8, 64, 64, 64, 64, 512]
    - [0, 1042.0]
  - - [64, 512, 8, 128, 64, 64, 64, 512]
    - [2, 1211.0]
  - - [64, 512, 8, 256, 64, 64, 64, 512]
    - [2, 1326.0]
  - - [64, 512, 8, 512, 64, 64, 64, 512]
    - [2, 1411.0]
  - - [128, 32, 8, 32, 128, 128, 128, 32]
    - [0, 128.0]
  - - [128, 32, 8, 64, 128, 128, 128, 32]
    - [0, 153.0]
  - - [128, 32, 8, 128, 128, 128, 128, 32]
    - [2, 169.0]
  - - [128, 32, 8, 256, 128, 128, 128, 32]
    - [0, 177.0]
  - - [128, 32, 8, 512, 128, 128, 128, 32]
    - [0, 185.0]
  - - [128, 64, 8, 32, 128, 128, 128, 64]
    - [0, 247.0]
  - - [128, 64, 8, 64, 128, 128, 128, 64]
    - [0, 301.0]
  - - [128, 64, 8, 128, 128, 128, 128, 64]
    - [0, 335.0]
  - - [128, 64, 8, 256, 128, 128, 128, 64]
    - [0, 359.0]
  - - [128, 64, 8, 512, 128, 128, 128, 64]
    - [0, 372.0]
  - - [128, 128, 8, 32, 128, 128, 128, 128]
    - [0, 454.0]
  - - [128, 128, 8, 64, 128, 128, 128, 128]
    - [0, 567.0]
  - - [128, 128, 8, 128, 128, 128, 128, 128]
    - [0, 650.0]
  - - [128, 128, 8, 256, 128, 128, 128, 128]
    - [0, 702.0]
  - - [128, 128, 8, 512, 128, 128, 128, 128]
    - [0, 733.0]
  - - [128, 256, 8, 32, 128, 128, 128, 256]
    - [1, 781.0]
  - - [128, 256, 8, 64, 128, 128, 128, 256]
    - [0, 1020.0]
  - - [128, 256, 8, 128, 128, 128, 128, 256]
    - [0, 1214.0]
  - - [128, 256, 8, 256, 128, 128, 128, 256]
    - [0, 1341.0]
  - - [128, 256, 8, 512, 128, 128, 128, 256]
    - [0, 1416.0]
  - - [128, 512, 8, 32, 128, 128, 128, 512]
    - [0, 911.0]
  - - [128, 512, 8, 64, 128, 128, 128, 512]
    - [1, 1095.0]
  - - [128, 512, 8, 128, 128, 128, 128, 512]
    - [0, 1258.0]
  - - [128, 512, 8, 256, 128, 128, 128, 512]
    - [0, 1372.0]
  - - [128, 512, 8, 512, 128, 128, 128, 512]
    - [0, 1427.0]
  - - [256, 32, 8, 32, 256, 256, 256, 32]
    - [2, 239.0]
  - - [256, 32, 8, 64, 256, 256, 256, 32]
    - [0, 296.0]
  - - [256, 32, 8, 128, 256, 256, 256, 32]
    - [0, 332.0]
  - - [256, 32, 8, 256, 256, 256, 256, 32]
    - [0, 356.0]
  - - [256, 32, 8, 512, 256, 256, 256, 32]
    - [0, 371.0]
  - - [256, 64, 8, 32, 256, 256, 256, 64]
    - [1, 445.0]
  - - [256, 64, 8, 64, 256, 256, 256, 64]
    - [0, 553.0]
  - - [256, 64, 8, 128, 256, 256, 256, 64]
    - [0, 637.0]
  - - [256, 64, 8, 256, 256, 256, 256, 64]
    - [0, 696.0]
  - - [256, 64, 8, 512, 256, 256, 256, 64]
    - [0, 730.0]
  - - [256, 128, 8, 32, 256, 256, 256, 128]
    - [1, 796.0]
  - - [256, 128, 8, 64, 256, 256, 256, 128]
    - [1, 1002.0]
  - - [256, 128, 8, 128, 256, 256, 256, 128]
    - [1, 1191.0]
  - - [256, 128, 8, 256, 256, 256, 256, 128]
    - [0, 1312.0]
  - - [256, 128, 8, 512, 256, 256, 256, 128]
    - [0, 1401.0]
  - - [256, 256, 8, 32, 256, 256, 256, 256]
    - [2, 894.0]
  - - [256, 256, 8, 64, 256, 256, 256, 256]
    - [0, 1109.0]
  - - [256, 256, 8, 128, 256, 256, 256, 256]
    - [2, 1257.0]
  - - [256, 256, 8, 256, 256, 256, 256, 256]
    - [2, 1367.0]
  - - [256, 256, 8, 512, 256, 256, 256, 256]
    - [0, 1401.0]
  - - [256, 512, 8, 32, 256, 256, 256, 512]
    - [0, 975.0]
  - - [256, 512, 8, 64, 256, 256, 256, 512]
    - [0, 1176.0]
  - - [256, 512, 8, 128, 256, 256, 256, 512]
    - [2, 1296.0]
  - - [256, 512, 8, 256, 256, 256, 256, 512]
    - [1, 1371.0]
  - - [256, 512, 8, 512, 256, 256, 256, 512]
    - [0, 1396.0]
  - - [512, 32, 8, 32, 512, 512, 512, 32]
    - [0, 434.0]
  - - [512, 32, 8, 64, 512, 512, 512, 32]
    - [0, 553.0]
  - - [512, 32, 8, 128, 512, 512, 512, 32]
    - [0, 640.0]
  - - [512, 32, 8, 256, 512, 512, 512, 32]
    - [0, 692.0]
  - - [512, 32, 8, 512, 512, 512, 512, 32]
    - [0, 729.0]
  - - [512, 64, 8, 32, 512, 512, 512, 64]
    - [1, 785.0]
  - - [512, 64, 8, 64, 512, 512, 512, 64]
    - [1, 1012.0]
  - - [512, 64, 8, 128, 512, 512, 512, 64]
    - [0, 1188.0]
  - - [512, 64, 8, 256, 512, 512, 512, 64]
    - [0, 1310.0]
  - - [512, 64, 8, 512, 512, 512, 512, 64]
    - [2, 1399.0]
  - - [512, 128, 8, 32, 512, 512, 512, 128]
    - [1, 892.0]
  - - [512, 128, 8, 64, 512, 512, 512, 128]
    - [0, 1115.0]
  - - [512, 128, 8, 128, 512, 512, 512, 128]
    - [0, 1266.0]
  - - [512, 128, 8, 256, 512, 512, 512, 128]
    - [0, 1352.0]
  - - [512, 128, 8, 512, 512, 512, 512, 128]
    - [0, 1399.0]
  - - [512, 256, 8, 32, 512, 512, 512, 256]
    - [0, 972.0]
  - - [512, 256, 8, 64, 512, 512, 512, 256]
    - [0, 1176.0]
  - - [512, 256, 8, 128, 512, 512, 512, 256]
    - [0, 1313.0]
  - - [512, 256, 8, 256, 512, 512, 512, 256]
    - [1, 1362.0]
  - - [512, 256, 8, 512, 512, 512, 512, 256]
    - [0, 1383.0]
  - - [512, 512, 8, 32, 512, 512, 512, 512]
    - [2, 1018.0]
  - - [512, 512, 8, 64, 512, 512, 512, 512]
    - [0, 1203.0]
  - - [512, 512, 8, 128, 512, 512, 512, 512]
    - [0, 1316.0]
  - - [512, 512, 8, 256, 512, 512, 512, 512]
    - [0, 1352.0]
  - - [512, 512, 8, 512, 512, 512, 512, 512]
    - [0, 1370.0]
- null
