library/src/blas3/Tensile/Logic/asm_full/vega10_Cijk_Ailk_Bjlk_SB.yaml
- {MinimumRequiredVersion: 4.0.2}
- vega10
- gfx900
- [Device 6863, Device 6862, Device 687f]
- - - [4096, 7133, 1, 4096]
    - [13, 12214.5]
  - - [512, 16, 1, 512]
    - [2, 390.477]
  - - [2048, 7133, 1, 2048]
    - [13, 11784.2]
  - - [2560, 7133, 1, 2560]
    - [8, 11898.5]
  - - [1024, 1024, 1, 1024]
    - [12, 8501.49]
  - - [3072, 7435, 1, 1024]
    - [13, 11104.1]
  - - [1024, 32, 1, 512]
    - [1, 1185.79]
  - - [1760, 7133, 1, 1760]
    - [9, 11437.4]
  - - [7680, 5481, 1, 2560]
    - [13, 12044.1]
  - - [1024, 16, 1, 512]
    - [2, 682.167]
  - - [512, 32, 1, 512]
    - [4, 730.62]
- - - -1
    - - - -1
        - - - 4
            - - [704, 5]
              - [1024, 2]
              - [2944, 5]
              - [4288, 2]
              - [-1, 5]
          - - 64
            - - [128, 5]
              - [256, 2]
              - [1856, 0]
              - [3584, 6]
              - [5056, 0]
              - [5888, 11]
              - [-1, 9]
          - - 128
            - - [64, 5]
              - [128, 2]
              - [704, 0]
              - [1408, 6]
              - [2368, 3]
              - [5056, 6]
              - [5888, 11]
              - [-1, 6]
          - - 256
            - - [4, 5]
              - [64, 2]
              - [448, 0]
              - [1024, 11]
              - [1408, 9]
              - [2944, 11]
              - [3584, 9]
              - [5056, 11]
              - [5888, 9]
              - [-1, 11]
          - - 448
            - - [4, 5]
              - [64, 4]
              - [448, 0]
              - [1408, 11]
              - [1856, 9]
              - [5056, 11]
              - [5888, 9]
              - [-1, 10]
          - - 704
            - - [4, 5]
              - [128, 0]
              - [448, 11]
              - [704, 9]
              - [1024, 11]
              - [1408, 9]
              - [4288, 11]
              - [5056, 8]
              - [5888, 10]
              - [-1, 11]
          - - 1024
            - - [4, 2]
              - [64, 0]
              - [128, 6]
              - [704, 9]
              - [1024, 12]
              - [1408, 9]
              - [1856, 14]
              - [2368, 9]
              - [2944, 14]
              - [3584, 7]
              - [4288, 9]
              - [5056, 13]
              - [5888, 14]
              - [-1, 13]
          - - 1408
            - - [4, 5]
              - [128, 0]
              - [448, 11]
              - [704, 9]
              - [1024, 10]
              - [1856, 11]
              - [2368, 9]
              - [2944, 14]
              - [4288, 13]
              - [5888, 14]
              - [-1, 9]
          - - 1856
            - - [4, 5]
              - [64, 0]
              - [128, 3]
              - [448, 11]
              - [704, 9]
              - [1024, 13]
              - [1408, 9]
              - [1856, 10]
              - [2944, 9]
              - [3584, 8]
              - [5056, 9]
              - [-1, 10]
          - - 2368
            - - [4, 5]
              - [64, 3]
              - [128, 0]
              - [256, 9]
              - [448, 11]
              - [704, 9]
              - [1024, 10]
              - [1856, 9]
              - [2368, 10]
              - [5056, 9]
              - [-1, 10]
          - - 2944
            - - [4, 5]
              - [64, 0]
              - [128, 3]
              - [704, 9]
              - [1024, 10]
              - [1408, 14]
              - [2368, 9]
              - [2944, 10]
              - [3584, 9]
              - [5056, 10]
              - [5888, 14]
              - [-1, 8]
          - - 3584
            - - [4, 5]
              - [64, 3]
              - [704, 9]
              - [1408, 10]
              - [1856, 7]
              - [2368, 9]
              - [3584, 10]
              - [4288, 14]
              - [5056, 7]
              - [-1, 10]
          - - 4288
            - - [4, 5]
              - [128, 0]
              - [704, 9]
              - [1024, 10]
              - [1408, 14]
              - [2368, 9]
              - [2944, 10]
              - [3584, 14]
              - [-1, 10]
          - - 5056
            - - [4, 5]
              - [64, 0]
              - [128, 3]
              - [704, 9]
              - [1408, 14]
              - [2368, 9]
              - [4288, 10]
              - [5056, 14]
              - [-1, 10]
          - - 5888
            - - [4, 2]
              - [64, 11]
              - [704, 9]
              - [1408, 14]
              - [2368, 7]
              - [2944, 14]
              - [3584, 7]
              - [4288, 10]
              - [5056, 7]
              - [-1, 10]
          - - -1
            - - [4, 2]
              - [64, 9]
              - [128, 0]
              - [704, 9]
              - [1024, 14]
              - [1408, 9]
              - [1856, 10]
              - [2368, 7]
              - [3584, 10]
              - [5056, 7]
              - [-1, 14]
