library/src/blas3/Tensile/Logic/asm_full/vega20_Cijk_Alik_Bljk_SB.yaml
- {MinimumRequiredVersion: 4.3.0}
- vega20
- gfx906
- [Device 66a0, Device 66a7]
    SolutionIndex: 0
    SolutionNameMin: Cijk_Alik_Bljk_SB_MT128x016x32_GRVW04_GSU16_TT04_04_VW04_WG32_04_02
    SolutionIndex: 1
    SolutionNameMin: Cijk_Alik_Bljk_SB_MT128x008x32_GRVW04_GSU16_TT04_04_VW04_WG32_02_04
    SolutionIndex: 2
    SolutionNameMin: Cijk_Alik_Bljk_SB_MT036x048x16_GRVW01_GSU04_TT03_03_VW01_WG12_16_01
    SolutionIndex: 3
    SolutionNameMin: Cijk_Alik_Bljk_SB_MT036x048x16_GRVW01_GSU08_TT03_03_VW01_WG12_16_01
    SolutionIndex: 4
    SolutionNameMin: Cijk_Alik_Bljk_SB_MT032x016x16_GRVW02_GSU01_TT02_02_VW02_WG16_08_01
    SolutionIndex: 5
    SolutionNameMin: Cijk_Alik_Bljk_SB_MT064x032x32_GRVW04_GSU02_TT08_04_VW04_WG08_08_04
    SolutionIndex: 6
    SolutionNameMin: Cijk_Alik_Bljk_SB_MT016x016x16_GRVW02_GSU04_TT02_02_VW02_WG08_08_04
    SolutionIndex: 7
    SolutionNameMin: Cijk_Alik_Bljk_SB_MT016x016x16_GRVW02_GSU04_TT02_02_VW02_WG08_08_04
    SolutionIndex: 8
    SolutionNameMin: Cijk_Alik_Bljk_SB_MT032x032x16_GRVW04_GSU02_TT04_04_VW04_WG08_08_02
    SolutionIndex: 9
    SolutionNameMin: Cijk_Alik_Bljk_SB_MT032x032x16_GRVW04_GSU02_TT04_04_VW04_WG08_08_02
    SolutionIndex: 10
    SolutionNameMin: Cijk_Alik_Bljk_SB_MT128x064x32_GRVW04_GSU04_TT08_08_VW04_WG16_08_02
    SolutionIndex: 11
    SolutionNameMin: Cijk_Alik_Bljk_SB_MT128x032x32_GRVW04_GSU02_TT08_08_VW04_WG16_04_04
    SolutionIndex: 12
    SolutionNameMin: Cijk_Alik_Bljk_SB_MT016x016x16_GRVW02_GSU08_TT02_02_VW02_WG08_08_04
    SolutionIndex: 13
    SolutionNameMin: Cijk_Alik_Bljk_SB_MT064x016x32_GRVW04_GSU04_TT04_04_VW04_WG16_04_04
    SolutionIndex: 14
    SolutionNameMin: Cijk_Alik_Bljk_SB_MT064x016x32_GRVW04_GSU02_TT04_04_VW04_WG16_04_04
    SolutionIndex: 15
    SolutionNameMin: Cijk_Alik_Bljk_SB_MT064x016x32_GRVW04_GSU02_TT04_04_VW04_WG16_04_04
    SolutionIndex: 16
    SolutionNameMin: Cijk_Alik_Bljk_SB_MT064x032x16_GRVW04_GSU04_TT04_04_VW04_WG16_08_02
    SolutionIndex: 17
    SolutionNameMin: Cijk_Alik_Bljk_SB_MT064x032x16_GRVW04_GSU02_TT08_04_VW04_WG08_08_02
    SolutionIndex: 18
    SolutionNameMin: Cijk_Alik_Bljk_SB_MT128x064x16_GRVW04_GSU04_TT08_08_VW04_WG16_08_02
    SolutionIndex: 19
    SolutionNameMin: Cijk_Alik_Bljk_SB_MT128x064x16_GRVW04_GSU02_TT08_08_VW04_WG16_08_02
    SolutionIndex: 20
    SolutionNameMin: Cijk_Alik_Bljk_SB_MT128x064x16_GRVW04_GSU02_TT08_08_VW04_WG16_08_02
    SolutionIndex: 21
    SolutionNameMin: Cijk_Alik_Bljk_SB_MT032x032x16_GRVW04_GSU04_TT04_04_VW04_WG08_08_02
    SolutionIndex: 22
    SolutionNameMin: Cijk_Alik_Bljk_SB_MT032x016x16_GRVW02_GSU04_TT04_02_VW02_WG08_08_04
    SolutionIndex: 23
    SolutionNameMin: Cijk_Alik_Bljk_SB_MT064x128x08_GRVW04_GSU01_TT04_08_VW04_WG16_16_01
    SolutionIndex: 24
    SolutionNameMin: Cijk_Alik_Bljk_SB_MT064x064x08_GRVW04_GSU01_TT04_04_VW04_WG16_16_01
    SolutionIndex: 25
    SolutionNameMin: Cijk_Alik_Bljk_SB_MT064x064x16_GRVW04_GSU01_TT04_04_VW04_WG16_16_01
    SolutionIndex: 26
    SolutionNameMin: Cijk_Alik_Bljk_SB_MT064x128x16_GRVW04_GSU01_TT04_08_VW04_WG16_16_01
    SolutionIndex: 27
    SolutionNameMin: Cijk_Alik_Bljk_SB_MT128x064x08_GRVW04_GSU01_TT08_04_VW04_WG16_16_01
    SolutionIndex: 28
    SolutionNameMin: Cijk_Alik_Bljk_SB_MT064x128x16_GRVW04_GSU01_TT04_08_VW04_WG16_16_01
    SolutionIndex: 29
    SolutionNameMin: Cijk_Alik_Bljk_SB_MT064x064x16_GRVW04_GSU01_TT04_04_VW04_WG16_16_01
    SolutionIndex: 30
    SolutionNameMin: Cijk_Alik_Bljk_SB_MT064x128x16_GRVW04_GSU01_TT04_08_VW04_WG16_16_01
    SolutionIndex: 31
    SolutionNameMin: Cijk_Alik_Bljk_SB_MT064x064x16_GRVW04_GSU01_TT04_04_VW04_WG16_16_01
    SolutionIndex: 32
    SolutionNameMin: Cijk_Alik_Bljk_SB_MT128x064x16_GRVW04_GSU01_TT08_04_VW04_WG16_16_01
    SolutionIndex: 33
    SolutionNameMin: Cijk_Alik_Bljk_SB_MT128x128x16_GRVW04_GSU01_TT08_08_VW04_WG16_16_01
    SolutionIndex: 34
    SolutionNameMin: Cijk_Alik_Bljk_SB_MT128x064x16_GRVW04_GSU01_TT08_04_VW04_WG16_16_01
    SolutionIndex: 35
    SolutionNameMin: Cijk_Alik_Bljk_SB_MT128x128x16_GRVW04_GSU01_TT08_08_VW04_WG16_16_01
    SolutionIndex: 36
    SolutionNameMin: Cijk_Alik_Bljk_SB_MT128x128x08_GRVW04_GSU01_TT08_08_VW04_WG16_16_01
    SolutionIndex: 37
    SolutionNameMin: Cijk_Alik_Bljk_SB_MT096x128x16_GRVW02_GSU01_TT06_08_VW02_WG16_16_01
    SolutionIndex: 38
    SolutionNameMin: Cijk_Alik_Bljk_SB_MT128x128x08_GRVW04_GSU01_TT08_08_VW04_WG16_16_01
    SolutionIndex: 39
    SolutionNameMin: Cijk_Alik_Bljk_SB_MT128x064x32_GRVW04_GSU01_TT08_04_VW04_WG16_16_01
    SolutionIndex: 40
    SolutionNameMin: Cijk_Alik_Bljk_SB_MT064x064x32_GRVW04_GSU01_TT04_04_VW04_WG16_16_01
    SolutionIndex: 41
    SolutionNameMin: Cijk_Alik_Bljk_SB_MT016x016x04_GRVW02_GSU01_TT02_02_VW02_WG08_08_01
- - - [4096, 7000, 1, 4096]
    - [33, 8282.42]
  - - [7680, 12000, 1, 2560]
    - [33, 8785.83]
  - - [5124, 9124, 1, 1760]
    - [27, 8807.59]
  - - [1760, 32, 1, 1760]
    - [21, 3128.84]
  - - [512, 24000, 1, 1536]
    - [35, 8274.63]
  - - [3072, 24000, 1, 1024]
    - [35, 8422.93]
  - - [2048, 400, 1, 512]
    - [33, 4347.26]
  - - [2560, 7000, 1, 2560]
    - [35, 8331.98]
  - - [3072, 16, 1, 1024]
    - [6, 1121.46]
  - - [512, 48000, 1, 2816]
    - [38, 8694.27]
  - - [512, 48000, 1, 2048]
    - [35, 8077.66]
  - - [1760, 64, 1, 1760]
    - [8, 4378.18]
  - - [35, 8457, 1, 4096]
    - [3, 3629.0]
  - - [2048, 1600, 1, 2048]
    - [28, 5466.59]
  - - [512, 48000, 1, 1536]
    - [35, 8529.66]
  - - [2560, 32, 1, 2560]
    - [8, 2958.69]
  - - [8448, 5984, 1, 2816]
    - [33, 8756.71]
  - - [4096, 3200, 1, 1024]
    - [35, 7173.63]
  - - [1024, 24000, 1, 2560]
    - [33, 8557.26]
  - - [1760, 6400, 1, 1760]
    - [38, 8879.01]
  - - [1024, 700, 1, 512]
    - [30, 4311.53]
  - - [4608, 32, 1, 1536]
    - [8, 2839.64]
  - - [3072, 64, 1, 1024]
    - [19, 2121.89]
  - - [16384, 3200, 1, 4096]
    - [33, 8420.91]
  - - [2560, 16, 1, 2560]
    - [22, 1888.61]
  - - [1024, 48000, 1, 2560]
    - [33, 8805.81]
  - - [35, 8457, 1, 2560]
    - [3, 3649.98]
  - - [8448, 48000, 1, 2816]
    - [38, 9029.09]
  - - [2048, 32, 1, 2048]
    - [7, 1711.94]
  - - [2560, 3200, 1, 2560]
    - [35, 8292.43]
  - - [16384, 800, 1, 4096]
    - [35, 7047.0]
  - - [4608, 24000, 1, 1536]
    - [35, 8808.91]
  - - [7680, 48000, 1, 2560]
    - [33, 8908.76]
  - - [3072, 48000, 1, 1024]
    - [35, 8654.7]
  - - [1760, 16, 1, 1760]
    - [13, 2128.93]
  - - [8192, 3200, 1, 2048]
    - [35, 8012.69]
  - - [512, 24000, 1, 2816]
    - [33, 8600.4]
  - - [4096, 400, 1, 1024]
    - [39, 3803.27]
  - - [6144, 48000, 1, 2560]
    - [33, 8880.91]
  - - [4608, 48000, 1, 1536]
    - [35, 8867.05]
  - - [35, 8457, 1, 2048]
    - [3, 3062.8]
  - - [4096, 128, 1, 4096]
    - [19, 4671.62]
  - - [2048, 800, 1, 512]
    - [33, 5521.64]
  - - [4608, 5984, 1, 1536]
    - [35, 8506.76]
  - - [2560, 128, 1, 2560]
    - [16, 3953.85]
  - - [6144, 5984, 1, 2048]
    - [35, 8208.73]
  - - [35, 8457, 1, 1760]
    - [2, 3803.62]
  - - [7680, 24000, 1, 2560]
    - [33, 8851.46]
  - - [6144, 48000, 1, 2048]
    - [35, 8801.3]
  - - [5124, 9124, 1, 2560]
    - [33, 8413.13]
  - - [2048, 3200, 1, 2048]
    - [28, 6397.08]
  - - [2048, 16, 1, 2048]
    - [22, 1103.75]
  - - [1024, 24000, 1, 1536]
    - [35, 8486.71]
  - - [7680, 16, 1, 2560]
    - [15, 2424.24]
  - - [2560, 6400, 1, 2560]
    - [35, 8502.9]
  - - [2048, 128, 1, 2048]
    - [10, 3128.57]
  - - [512, 16, 1, 500000]
    - [0, 3415.33]
  - - [1024, 8, 1, 500000]
    - [1, 1900.14]
  - - [512, 24000, 1, 2560]
    - [35, 8407.68]
  - - [1024, 24000, 1, 2816]
    - [33, 8651.67]
  - - [7680, 5984, 1, 2560]
    - [33, 8639.9]
  - - [2048, 1600, 1, 512]
    - [34, 5146.31]
  - - [2048, 7000, 1, 2048]
    - [35, 7515.95]
  - - [1760, 800, 1, 1760]
    - [27, 7267.84]
  - - [5124, 9124, 1, 4096]
    - [35, 8317.76]
  - - [4096, 64, 1, 4096]
    - [18, 3929.03]
  - - [7680, 32, 1, 2560]
    - [11, 3817.57]
  - - [2560, 64, 1, 2560]
    - [9, 3590.97]
  - - [3072, 128, 1, 1024]
    - [20, 2419.75]
  - - [7680, 64, 1, 2560]
    - [20, 4818.76]
  - - [1760, 128, 1, 1760]
    - [17, 5098.86]
  - - [2560, 1600, 1, 2560]
    - [34, 6942.64]
  - - [2048, 3200, 1, 512]
    - [35, 6432.89]
  - - [2560, 800, 1, 2560]
    - [29, 6105.94]
  - - [3072, 32, 1, 1024]
    - [7, 1619.4]
  - - [6144, 32, 1, 2560]
    - [9, 3283.59]
  - - [4608, 12000, 1, 1536]
    - [35, 8765.42]
  - - [4096, 32, 1, 4096]
    - [9, 2602.09]
  - - [6144, 24000, 1, 2048]
    - [35, 8699.72]
  - - [8192, 800, 1, 2048]
    - [28, 6051.86]
  - - [4096, 1600, 1, 1024]
    - [34, 6030.11]
  - - [5124, 9124, 1, 2048]
    - [35, 8186.56]
  - - [8448, 24000, 1, 2816]
    - [38, 9049.75]
  - - [1024, 48000, 1, 1536]
    - [33, 8743.76]
  - - [7680, 128, 1, 2560]
    - [19, 5270.03]
  - - [8192, 1600, 1, 2048]
    - [35, 7095.51]
  - - [4096, 800, 1, 1024]
    - [37, 4779.76]
  - - [1024, 16, 1, 500000]
    - [0, 3471.84]
  - - [2048, 800, 1, 2048]
    - [40, 4488.7]
  - - [1760, 3200, 1, 1760]
    - [27, 8572.17]
  - - [512, 48000, 1, 2560]
    - [35, 8569.94]
  - - [8448, 16, 1, 2816]
    - [14, 2644.72]
  - - [2048, 64, 1, 2048]
    - [10, 2326.91]
  - - [512, 24000, 1, 2048]
    - [35, 7385.27]
  - - [16384, 1600, 1, 4096]
    - [35, 7848.14]
  - - [4608, 16, 1, 1536]
    - [22, 1933.82]
  - - [1024, 24000, 1, 2048]
    - [35, 8091.27]
  - - [8192, 400, 1, 2048]
    - [29, 5115.55]
  - - [2048, 6400, 1, 2048]
    - [28, 7259.62]
  - - [6144, 12000, 1, 2048]
    - [35, 8502.99]
  - - [512, 8, 1, 500000]
    - [1, 1887.32]
  - - [1760, 7000, 1, 1760]
    - [27, 8472.26]
  - - [1024, 48000, 1, 2816]
    - [33, 8865.39]
  - - [6144, 16, 1, 2560]
    - [22, 2313.0]
  - - [8448, 32, 1, 2816]
    - [5, 4105.12]
  - - [4096, 16, 1, 4096]
    - [6, 1538.47]
  - - [6144, 24000, 1, 2560]
    - [33, 8859.73]
  - - [1024, 1024, 1, 1024]
    - [35, 3948.68]
  - - [8448, 12000, 1, 2816]
    - [38, 8967.0]
  - - [16384, 400, 1, 4096]
    - [32, 6303.46]
  - - [1760, 1600, 1, 1760]
    - [36, 7724.57]
  - - [1024, 48000, 1, 2048]
    - [35, 8461.94]
- - - -1
    - - - 128
        - - - 4
            - - [-1, 41]
          - - 64
            - - [4, 41]
              - [5056, 4]
              - [-1, 24]
          - - 128
            - - [4, 41]
              - [2368, 4]
              - [3584, 24]
              - [4288, 4]
              - [5888, 24]
              - [-1, 23]
          - - 256
            - - [4, 41]
              - [448, 4]
              - [2368, 24]
              - [2944, 25]
              - [3584, 23]
              - [-1, 25]
          - - 448
            - - [4, 41]
              - [448, 4]
              - [1408, 24]
              - [1856, 23]
              - [3584, 24]
              - [4288, 23]
              - [5056, 24]
              - [-1, 23]
          - - 704
            - - [4, 41]
              - [128, 4]
              - [1024, 24]
              - [1408, 23]
              - [1856, 25]
              - [2368, 24]
              - [5888, 23]
              - [-1, 24]
          - - 1024
            - - [4, 41]
              - [128, 4]
              - [256, 25]
              - [448, 24]
              - [704, 25]
              - [1024, 23]
              - [5888, 25]
              - [-1, 26]
          - - 1408
            - - [4, 41]
              - [128, 4]
              - [1024, 24]
              - [1408, 23]
              - [2368, 24]
              - [5056, 23]
              - [-1, 26]
          - - 1856
            - - [4, 41]
              - [64, 4]
              - [256, 24]
              - [448, 23]
              - [704, 25]
              - [1856, 23]
              - [2368, 24]
              - [4288, 23]
              - [5056, 24]
              - [-1, 23]
          - - 2368
            - - [4, 41]
              - [64, 4]
              - [704, 24]
              - [1024, 23]
              - [1856, 24]
              - [2368, 23]
              - [2944, 24]
              - [-1, 23]
          - - 2944
            - - [4, 41]
              - [64, 4]
              - [128, 24]
              - [256, 25]
              - [448, 24]
              - [704, 25]
              - [1856, 23]
              - [-1, 26]
          - - 3584
            - - [4, 41]
              - [64, 4]
              - [128, 24]
              - [256, 23]
              - [704, 25]
              - [1024, 26]
              - [1856, 25]
              - [-1, 26]
          - - 4288
            - - [4, 41]
              - [128, 4]
              - [704, 25]
              - [-1, 26]
          - - 5056
            - - [4, 41]
              - [64, 24]
              - [704, 25]
              - [1408, 23]
              - [-1, 26]
          - - 5888
            - - [4, 41]
              - [128, 25]
              - [256, 26]
              - [704, 25]
              - [-1, 26]
          - - -1
            - - [4, 41]
              - [64, 24]
              - [128, 23]
              - [448, 25]
              - [-1, 26]
      - - 256
        - - - 4
            - - [-1, 6]
          - - 64
            - - [4, 6]
              - [64, 7]
              - [704, 6]
              - [1024, 7]
              - [1408, 6]
              - [3584, 31]
              - [5056, 29]
              - [-1, 31]
          - - 128
            - - [64, 6]
              - [128, 7]
              - [448, 6]
              - [2368, 31]
              - [3584, 29]
              - [4288, 31]
              - [5056, 29]
              - [5888, 32]
              - [-1, 30]
          - - 256
            - - [64, 6]
              - [128, 7]
              - [256, 6]
              - [2368, 31]
              - [2944, 34]
              - [3584, 28]
              - [4288, 32]
              - [5888, 34]
              - [-1, 33]
          - - 448
            - - [4, 6]
              - [64, 7]
              - [128, 6]
              - [256, 29]
              - [1408, 31]
              - [1856, 28]
              - [2368, 34]
              - [2944, 32]
              - [3584, 35]
              - [4288, 28]
              - [5056, 34]
              - [5888, 35]
              - [-1, 28]
          - - 704
            - - [4, 6]
              - [64, 7]
              - [128, 6]
              - [704, 31]
              - [1024, 29]
              - [1408, 28]
              - [1856, 32]
              - [2368, 33]
              - [2944, 28]
              - [3584, 33]
              - [4288, 28]
              - [5056, 33]
              - [5888, 28]
              - [-1, 35]
          - - 1024
            - - [64, 6]
              - [128, 31]
              - [256, 29]
              - [448, 31]
              - [704, 29]
              - [1408, 34]
              - [1856, 33]
              - [2368, 34]
              - [4288, 35]
              - [5056, 33]
              - [-1, 35]
          - - 1408
            - - [64, 6]
              - [448, 31]
              - [704, 34]
              - [1024, 37]
              - [1856, 33]
              - [2368, 29]
              - [5056, 33]
              - [5888, 35]
              - [-1, 33]
          - - 1856
            - - [4, 6]
              - [128, 31]
              - [256, 40]
              - [448, 34]
              - [704, 30]
              - [1024, 35]
              - [1408, 33]
              - [1856, 34]
              - [2368, 32]
              - [2944, 33]
              - [5056, 35]
              - [5888, 33]
              - [-1, 35]
          - - 2368
            - - [4, 6]
              - [64, 31]
              - [256, 29]
              - [448, 30]
              - [704, 35]
              - [1024, 32]
              - [1408, 29]
              - [1856, 34]
              - [2944, 33]
              - [3584, 35]
              - [4288, 34]
              - [5888, 33]
              - [-1, 35]
          - - 2944
            - - [4, 6]
              - [128, 31]
              - [256, 28]
              - [448, 30]
              - [704, 34]
              - [1408, 33]
              - [1856, 35]
              - [2368, 33]
              - [3584, 35]
              - [4288, 33]
              - [-1, 35]
          - - 3584
            - - [4, 6]
              - [64, 29]
              - [128, 31]
              - [256, 34]
              - [448, 33]
              - [704, 35]
              - [2944, 33]
              - [3584, 35]
              - [5056, 33]
              - [-1, 35]
          - - 4288
            - - [4, 6]
              - [64, 31]
              - [128, 29]
              - [256, 28]
              - [448, 32]
              - [704, 34]
              - [1024, 35]
              - [1408, 33]
              - [1856, 35]
              - [2368, 34]
              - [-1, 35]
          - - 5056
            - - [4, 6]
              - [128, 31]
              - [256, 28]
              - [448, 30]
              - [-1, 35]
          - - 5888
            - - [4, 6]
              - [64, 31]
              - [128, 30]
              - [256, 37]
              - [448, 33]
              - [704, 32]
              - [5056, 35]
              - [-1, 33]
          - - -1
            - - [4, 6]
              - [64, 31]
              - [128, 28]
              - [256, 33]
              - [448, 32]
              - [2368, 35]
              - [2944, 33]
              - [3584, 35]
              - [5888, 33]
              - [-1, 35]
      - - 1280
        - - - 4
            - - [256, 12]
              - [1024, 6]
              - [3584, 12]
              - [-1, 6]
          - - 64
            - - [64, 12]
              - [128, 6]
              - [704, 22]
              - [1024, 8]
              - [1856, 9]
              - [3584, 8]
              - [4288, 9]
              - [5056, 29]
              - [-1, 31]
          - - 128
            - - [4, 12]
              - [64, 7]
              - [256, 22]
              - [448, 14]
              - [1856, 9]
              - [2368, 31]
              - [2944, 29]
              - [4288, 31]
              - [5056, 29]
              - [5888, 31]
              - [-1, 30]
          - - 256
            - - [4, 12]
              - [128, 22]
              - [448, 9]
              - [704, 31]
              - [1024, 40]
              - [2368, 31]
              - [2944, 29]
              - [3584, 30]
              - [5056, 31]
              - [5888, 34]
              - [-1, 33]
          - - 448
            - - [4, 12]
              - [64, 22]
              - [128, 21]
              - [256, 9]
              - [448, 17]
              - [704, 31]
              - [1024, 29]
              - [1408, 31]
              - [1856, 30]
              - [2368, 31]
              - [2944, 32]
              - [3584, 31]
              - [4288, 30]
              - [5056, 29]
              - [5888, 35]
              - [-1, 28]
          - - 704
            - - [4, 12]
              - [64, 21]
              - [128, 8]
              - [256, 40]
              - [448, 31]
              - [1024, 29]
              - [1408, 30]
              - [1856, 29]
              - [2368, 33]
              - [5888, 28]
              - [-1, 33]
          - - 1024
            - - [4, 12]
              - [64, 14]
              - [128, 11]
              - [256, 40]
              - [704, 31]
              - [1024, 33]
              - [1408, 34]
              - [1856, 33]
              - [2368, 34]
              - [2944, 35]
              - [3584, 32]
              - [4288, 34]
              - [5056, 35]
              - [5888, 33]
              - [-1, 35]
          - - 1408
            - - [4, 12]
              - [128, 9]
              - [448, 29]
              - [704, 32]
              - [1024, 28]
              - [1408, 33]
              - [1856, 34]
              - [2368, 29]
              - [-1, 33]
          - - 1856
            - - [4, 12]
              - [64, 9]
              - [128, 40]
              - [256, 31]
              - [448, 28]
              - [704, 29]
              - [1024, 33]
              - [1408, 28]
              - [2944, 32]
              - [-1, 33]
          - - 2368
            - - [4, 12]
              - [64, 9]
              - [448, 31]
              - [704, 33]
              - [1024, 34]
              - [1408, 29]
              - [2368, 34]
              - [3584, 33]
              - [4288, 34]
              - [-1, 33]
          - - 2944
            - - [4, 6]
              - [64, 9]
              - [128, 29]
              - [256, 31]
              - [448, 30]
              - [704, 34]
              - [1408, 33]
              - [1856, 28]
              - [4288, 33]
              - [5888, 35]
              - [-1, 33]
          - - 3584
            - - [4, 12]
              - [128, 31]
              - [256, 30]
              - [448, 33]
              - [704, 34]
              - [1024, 28]
              - [1408, 33]
              - [1856, 32]
              - [5056, 33]
              - [5888, 35]
              - [-1, 33]
          - - 4288
            - - [4, 6]
              - [64, 9]
              - [128, 31]
              - [256, 29]
              - [704, 34]
              - [1024, 30]
              - [1856, 35]
              - [2368, 34]
              - [-1, 35]
          - - 5056
            - - [4, 6]
              - [128, 31]
              - [256, 29]
              - [448, 31]
              - [704, 34]
              - [1024, 33]
              - [-1, 35]
          - - 5888
            - - [4, 6]
              - [128, 31]
              - [256, 28]
              - [448, 33]
              - [704, 32]
              - [5056, 35]
              - [-1, 33]
          - - -1
            - - [4, 6]
              - [64, 31]
              - [128, 32]
              - [256, 33]
              - [448, 34]
              - [704, 33]
              - [2368, 35]
              - [2944, 33]
              - [3584, 35]
              - [5888, 33]
              - [-1, 35]
      - - -1
        - - - 4
            - - [704, 12]
              - [1024, 6]
              - [5056, 12]
              - [5888, 6]
              - [-1, 12]
          - - 64
            - - [128, 12]
              - [448, 13]
              - [704, 21]
              - [1856, 16]
              - [2944, 8]
              - [3584, 17]
              - [4288, 16]
              - [5056, 5]
              - [-1, 31]
          - - 128
            - - [4, 12]
              - [64, 6]
              - [128, 22]
              - [256, 13]
              - [448, 21]
              - [704, 16]
              - [1024, 5]
              - [1408, 8]
              - [1856, 17]
              - [2368, 16]
              - [2944, 9]
              - [3584, 31]
              - [4288, 16]
              - [5056, 29]
              - [5888, 31]
              - [-1, 30]
          - - 256
            - - [4, 12]
              - [64, 7]
              - [128, 13]
              - [256, 21]
              - [448, 5]
              - [1024, 40]
              - [1856, 31]
              - [2368, 29]
              - [2944, 31]
              - [3584, 30]
              - [5056, 31]
              - [5888, 30]
              - [-1, 31]
          - - 448
            - - [4, 12]
              - [64, 13]
              - [256, 21]
              - [448, 9]
              - [704, 29]
              - [1408, 31]
              - [1856, 30]
              - [2368, 31]
              - [2944, 34]
              - [3584, 31]
              - [4288, 30]
              - [5056, 29]
              - [5888, 33]
              - [-1, 28]
          - - 704
            - - [4, 12]
              - [64, 21]
              - [128, 8]
              - [256, 40]
              - [448, 29]
              - [1024, 31]
              - [1408, 30]
              - [1856, 31]
              - [2368, 29]
              - [2944, 30]
              - [3584, 28]
              - [5056, 30]
              - [5888, 28]
              - [-1, 33]
          - - 1024
            - - [4, 6]
              - [64, 21]
              - [128, 18]
              - [256, 40]
              - [448, 31]
              - [704, 29]
              - [1024, 30]
              - [1408, 32]
              - [1856, 33]
              - [2368, 28]
              - [2944, 33]
              - [4288, 32]
              - [5056, 35]
              - [-1, 33]
          - - 1408
            - - [4, 12]
              - [64, 16]
              - [128, 21]
              - [256, 29]
              - [448, 31]
              - [704, 32]
              - [1024, 34]
              - [1408, 33]
              - [1856, 34]
              - [2368, 29]
              - [-1, 33]
          - - 1856
            - - [4, 12]
              - [64, 21]
              - [128, 19]
              - [256, 29]
              - [448, 32]
              - [704, 29]
              - [1024, 33]
              - [1408, 28]
              - [2944, 32]
              - [3584, 28]
              - [4288, 33]
              - [5056, 38]
              - [5888, 33]
              - [-1, 36]
          - - 2368
            - - [4, 12]
              - [64, 9]
              - [128, 21]
              - [256, 29]
              - [704, 31]
              - [1024, 34]
              - [1408, 29]
              - [1856, 32]
              - [2368, 34]
              - [3584, 33]
              - [4288, 32]
              - [5056, 33]
              - [5888, 36]
              - [-1, 33]
          - - 2944
            - - [4, 12]
              - [64, 16]
              - [128, 21]
              - [256, 31]
              - [448, 30]
              - [704, 34]
              - [1408, 33]
              - [1856, 32]
              - [5056, 33]
              - [5888, 38]
              - [-1, 33]
          - - 3584
            - - [4, 6]
              - [64, 17]
              - [128, 31]
              - [256, 30]
              - [448, 31]
              - [704, 32]
              - [1024, 28]
              - [1408, 33]
              - [1856, 32]
              - [-1, 33]
          - - 4288
            - - [4, 6]
              - [128, 21]
              - [256, 29]
              - [704, 34]
              - [1024, 28]
              - [1856, 33]
              - [2368, 32]
              - [4288, 33]
              - [-1, 38]
          - - 5056
            - - [4, 6]
              - [64, 16]
              - [256, 29]
              - [448, 31]
              - [704, 32]
              - [1408, 33]
              - [1856, 35]
              - [2368, 33]
              - [-1, 38]
          - - 5888
            - - [4, 6]
              - [64, 16]
              - [128, 31]
              - [256, 30]
              - [448, 33]
              - [704, 32]
              - [3584, 33]
              - [-1, 38]
          - - -1
            - - [4, 6]
              - [64, 29]
              - [128, 30]
              - [256, 31]
              - [448, 34]
              - [704, 33]
              - [1024, 35]
              - [1408, 33]
              - [1856, 35]
              - [2944, 33]
              - [5888, 38]
              - [-1, 33]
