library/src/blas3/Tensile/Logic/asm_full/vega20_Cijk_Ailk_Bljk_SB.yaml
- {MinimumRequiredVersion: 4.6.0}
- vega20
- gfx906
- [Device 66a0, Device 66a1, Device 66a7]
    SolutionIndex: 0
    SolutionNameMin: Cijk_Ailk_Bljk_SB_MT128x016x16_DTL0_EPS1_GRVW02_LPB00_PGR1_SNLL0_TT08_02_USFGRO0_VW02_WG16_08_02
    SolutionIndex: 1
    SolutionNameMin: Cijk_Ailk_Bljk_SB_MT128x016x16_DTL0_EPS1_GRVW02_LPB00_PGR1_SNLL0_TT08_02_USFGRO0_VW02_WG16_08_02
    SolutionIndex: 2
    SolutionNameMin: Cijk_Ailk_Bljk_SB_MT128x016x16_DTL0_EPS1_GRVW04_LPB00_PGR1_SNLL0_TT04_04_USFGRO0_VW04_WG32_04_02
    SolutionIndex: 3
    SolutionNameMin: Cijk_Ailk_Bljk_SB_MT064x016x32_DTL0_EPS0_GRVW02_LPB00_PGR0_SNLL0_TT04_02_USFGRO0_VW02_WG16_08_02
    SolutionIndex: 4
    SolutionNameMin: Cijk_Ailk_Bljk_SB_MT128x008x32_DTL0_EPS0_GRVW02_LPB00_PGR0_SNLL0_TT04_02_USFGRO0_VW02_WG32_04_02
    SolutionIndex: 5
    SolutionNameMin: Cijk_Ailk_Bljk_SB_MT128x008x32_DTL0_EPS0_GRVW04_LPB00_PGR0_SNLL0_TT04_04_USFGRO0_VW04_WG32_02_04
    SolutionIndex: 6
    SolutionNameMin: Cijk_Ailk_Bljk_SB_MT064x008x32_DTL0_EPS0_GRVW04_LPB00_PGR0_SNLL0_TT04_04_USFGRO0_VW04_WG16_02_08
    SolutionIndex: 7
    SolutionNameMin: Cijk_Ailk_Bljk_SB_MT064x008x32_DTL0_EPS1_GRVW04_LPB00_PGR1_SNLL0_TT04_04_USFGRO0_VW04_WG16_02_08
    SolutionIndex: 8
    SolutionNameMin: Cijk_Ailk_Bljk_SB_MT064x008x32_DTL0_EPS0_GRVW02_LPB00_PGR0_SNLL0_TT02_02_USFGRO0_VW02_WG32_04_02
    SolutionIndex: 9
    SolutionNameMin: Cijk_Ailk_Bljk_SB_MT128x008x32_DTL0_EPS0_GRVW04_LPB00_PGR0_SNLL0_TT04_04_USFGRO0_VW04_WG32_02_04
    SolutionIndex: 10
    SolutionNameMin: Cijk_Ailk_Bljk_SB_MT064x008x32_DTL0_EPS1_GRVW02_LPB00_PGR1_SNLL0_TT08_02_USFGRO0_VW02_WG08_04_08
    SolutionIndex: 11
    SolutionNameMin: Cijk_Ailk_Bljk_SB_MT032x008x64_DTL0_EPS0_GRVW02_LPB00_PGR0_SNLL0_TT02_02_USFGRO0_VW02_WG16_04_04
    SolutionIndex: 12
    SolutionNameMin: Cijk_Ailk_Bljk_SB_MT064x004x64_DTL0_EPS0_GRVW02_LPB00_PGR0_SNLL0_TT02_02_USFGRO0_VW02_WG32_02_04
    SolutionIndex: 13
    SolutionNameMin: Cijk_Ailk_Bljk_SB_MT064x004x64_DTL0_EPS0_GRVW02_LPB00_PGR0_SNLL0_TT04_02_USFGRO0_VW02_WG16_02_08
    SolutionIndex: 14
    SolutionNameMin: Cijk_Ailk_Bljk_SB_MT048x036x16_DTL0_EPS1_GRVW01_LPB00_PGR1_SNLL0_TT06_03_USFGRO01_VW01_WG08_12_02
    SolutionIndex: 15
    SolutionNameMin: Cijk_Ailk_Bljk_SB_MT036x048x16_DTL0_EPS1_GRVW01_LPB00_PGR1_SNLL0_TT03_03_USFGRO01_VW01_WG12_16_01
    SolutionIndex: 16
    SolutionNameMin: Cijk_Ailk_Bljk_SB_MT048x048x16_DTL0_EPS1_GRVW01_LPB00_PGR1_SNLL0_TT03_03_USFGRO01_VW01_WG16_16_01
    SolutionIndex: 17
    SolutionNameMin: Cijk_Ailk_Bljk_SB_MT048x024x32_DTL0_EPS1_GRVW02_LPB00_PGR1_SNLL0_TT06_04_USFGRO0_VW02_WG08_06_04
    SolutionIndex: 18
    SolutionNameMin: Cijk_Ailk_Bljk_SB_MT024x024x32_DTL0_EPS1_GRVW01_LPB00_PGR1_SNLL0_TT03_04_USFGRO01_VW01_WG08_06_04
    SolutionIndex: 19
    SolutionNameMin: Cijk_Ailk_Bljk_SB_MT048x024x32_DTL0_EPS1_GRVW02_LPB00_PGR1_SNLL0_TT06_04_USFGRO0_VW02_WG08_06_04
    SolutionIndex: 20
    SolutionNameMin: Cijk_Ailk_Bljk_SB_MT032x008x08_DTL0_EPS0_GRVW02_LPB00_PGR1_SNLL0_TT02_02_USFGRO00_VW02_WG16_04_01
    SolutionIndex: 21
    SolutionNameMin: Cijk_Ailk_Bljk_SB_MT016x016x08_DTL0_EPS0_GRVW02_LPB00_PGR1_SNLL0_TT02_02_USFGRO00_VW02_WG08_08_01
    SolutionIndex: 22
    SolutionNameMin: Cijk_Ailk_Bljk_SB_MT032x032x08_DTL0_EPS0_GRVW04_LPB00_PGR1_SNLL0_TT04_04_USFGRO00_VW04_WG08_08_01
    SolutionIndex: 23
    SolutionNameMin: Cijk_Ailk_Bljk_SB_MT064x032x08_DTL0_EPS0_GRVW04_LPB00_PGR1_SNLL0_TT08_04_USFGRO00_VW04_WG08_08_01
    SolutionIndex: 24
    SolutionNameMin: Cijk_Ailk_Bljk_SB_MT032x016x08_DTL0_EPS0_GRVW02_LPB00_PGR1_SNLL0_TT02_02_USFGRO00_VW02_WG16_08_01
    SolutionIndex: 25
    SolutionNameMin: Cijk_Ailk_Bljk_SB_MT064x016x08_DTL0_EPS0_GRVW02_LPB00_PGR1_SNLL0_TT04_02_USFGRO00_VW02_WG16_08_01
    SolutionIndex: 26
    SolutionNameMin: Cijk_Ailk_Bljk_SB_MT016x016x08_DTL0_EPS0_GRVW02_LPB00_PGR1_SNLL0_TT02_02_USFGRO00_VW02_WG08_08_01
    SolutionIndex: 27
    SolutionNameMin: Cijk_Ailk_Bljk_SB_MT032x016x08_DTL0_EPS0_GRVW02_LPB00_PGR1_SNLL0_TT04_02_USFGRO00_VW02_WG08_08_01
    SolutionIndex: 28
    SolutionNameMin: Cijk_Ailk_Bljk_SB_MT032x032x08_DTL0_EPS0_GRVW04_LPB00_PGR1_SNLL0_TT04_04_USFGRO00_VW04_WG08_08_01
    SolutionIndex: 29
    SolutionNameMin: Cijk_Ailk_Bljk_SB_MT032x016x08_DTL0_EPS0_GRVW02_LPB00_PGR1_SNLL0_TT02_02_USFGRO00_VW02_WG16_08_01
    SolutionIndex: 30
    SolutionNameMin: Cijk_Ailk_Bljk_SB_MT064x016x08_DTL0_EPS0_GRVW02_LPB00_PGR1_SNLL0_TT04_02_USFGRO00_VW02_WG16_08_01
    SolutionIndex: 31
    SolutionNameMin: Cijk_Ailk_Bljk_SB_MT064x008x16_DTL0_EPS0_GRVW02_LPB00_PGR1_SNLL0_TT02_02_USFGRO00_VW02_WG32_04_01
    SolutionIndex: 32
    SolutionNameMin: Cijk_Ailk_Bljk_SB_MT016x016x16_DTL0_EPS0_GRVW02_LPB00_PGR1_SNLL0_TT02_02_USFGRO00_VW02_WG08_08_01
    SolutionIndex: 33
    SolutionNameMin: Cijk_Ailk_Bljk_SB_MT032x016x16_DTL0_EPS0_GRVW02_LPB00_PGR1_SNLL0_TT04_02_USFGRO00_VW02_WG08_08_01
    SolutionIndex: 34
    SolutionNameMin: Cijk_Ailk_Bljk_SB_MT032x032x16_DTL0_EPS0_GRVW04_LPB00_PGR1_SNLL0_TT04_04_USFGRO00_VW04_WG08_08_01
    SolutionIndex: 35
    SolutionNameMin: Cijk_Ailk_Bljk_SB_MT064x016x16_DTL0_EPS0_GRVW02_LPB00_PGR1_SNLL0_TT04_02_USFGRO00_VW02_WG16_08_01
    SolutionIndex: 36
    SolutionNameMin: Cijk_Ailk_Bljk_SB_MT064x032x16_DTL0_EPS0_GRVW04_LPB00_PGR1_SNLL0_TT04_04_USFGRO00_VW04_WG16_08_01
    SolutionIndex: 37
    SolutionNameMin: Cijk_Ailk_Bljk_SB_MT064x016x16_DTL0_EPS0_GRVW02_LPB00_PGR1_SNLL0_TT04_02_USFGRO00_VW02_WG16_08_01
    SolutionIndex: 38
    SolutionNameMin: Cijk_Ailk_Bljk_SB_MT032x016x24_DTL0_EPS0_GRVW02_LPB00_PGR1_SNLL0_TT04_02_USFGRO00_VW02_WG08_08_01
    SolutionIndex: 39
    SolutionNameMin: Cijk_Ailk_Bljk_SB_MT032x008x32_DTL0_EPS0_GRVW02_LPB00_PGR1_SNLL0_TT02_02_USFGRO00_VW02_WG16_04_01
    SolutionIndex: 40
    SolutionNameMin: Cijk_Ailk_Bljk_SB_MT016x016x08_DTL0_EPS1_GRVW02_LPB00_PGR1_SNLL0_TT02_02_USFGRO01_VW02_WG08_08_02
    SolutionIndex: 41
    SolutionNameMin: Cijk_Ailk_Bljk_SB_MT128x032x08_DTL0_EPS1_GRVW04_LPB00_PGR1_SNLL0_TT08_04_USFGRO0_VW04_WG16_08_02
    SolutionIndex: 42
    SolutionNameMin: Cijk_Ailk_Bljk_SB_MT016x016x08_DTL0_EPS1_GRVW02_LPB00_PGR1_SNLL0_TT02_02_USFGRO01_VW02_WG08_08_02
    SolutionIndex: 43
    SolutionNameMin: Cijk_Ailk_Bljk_SB_MT016x016x08_DTL0_EPS1_GRVW02_LPB00_PGR1_SNLL0_TT02_02_USFGRO01_VW02_WG08_08_02
    SolutionIndex: 44
    SolutionNameMin: Cijk_Ailk_Bljk_SB_MT128x016x16_DTL0_EPS1_GRVW04_LPB00_PGR1_SNLL0_TT04_04_USFGRO0_VW04_WG32_04_02
    SolutionIndex: 45
    SolutionNameMin: Cijk_Ailk_Bljk_SB_MT064x016x16_DTL0_EPS1_GRVW04_LPB00_PGR1_SNLL0_TT04_04_USFGRO0_VW04_WG16_04_04
    SolutionIndex: 46
    SolutionNameMin: Cijk_Ailk_Bljk_SB_MT016x016x16_DTL0_EPS1_GRVW02_LPB00_PGR1_SNLL0_TT02_02_USFGRO0_VW02_WG08_08_02
    SolutionIndex: 47
    SolutionNameMin: Cijk_Ailk_Bljk_SB_MT032x016x16_DTL0_EPS1_GRVW02_LPB00_PGR1_SNLL0_TT04_02_USFGRO0_VW02_WG08_08_02
    SolutionIndex: 48
    SolutionNameMin: Cijk_Ailk_Bljk_SB_MT032x032x16_DTL0_EPS1_GRVW04_LPB00_PGR1_SNLL0_TT04_04_USFGRO0_VW04_WG08_08_02
    SolutionIndex: 49
    SolutionNameMin: Cijk_Ailk_Bljk_SB_MT064x032x16_DTL0_EPS1_GRVW04_LPB00_PGR1_SNLL0_TT08_04_USFGRO0_VW04_WG08_08_02
    SolutionIndex: 50
    SolutionNameMin: Cijk_Ailk_Bljk_SB_MT016x016x16_DTL0_EPS1_GRVW02_LPB00_PGR1_SNLL0_TT02_02_USFGRO01_VW02_WG08_08_04
    SolutionIndex: 51
    SolutionNameMin: Cijk_Ailk_Bljk_SB_MT032x016x16_DTL0_EPS1_GRVW02_LPB00_PGR1_SNLL0_TT04_02_USFGRO0_VW02_WG08_08_04
    SolutionIndex: 52
    SolutionNameMin: Cijk_Ailk_Bljk_SB_MT064x016x16_DTL0_EPS1_GRVW02_LPB00_PGR1_SNLL0_TT04_02_USFGRO0_VW02_WG16_08_02
    SolutionIndex: 53
    SolutionNameMin: Cijk_Ailk_Bljk_SB_MT128x016x16_DTL0_EPS1_GRVW04_LPB00_PGR1_SNLL0_TT04_04_USFGRO0_VW04_WG32_04_02
    SolutionIndex: 54
    SolutionNameMin: Cijk_Ailk_Bljk_SB_MT064x016x16_DTL0_EPS1_GRVW04_LPB00_PGR1_SNLL0_TT04_04_USFGRO0_VW04_WG16_04_04
    SolutionIndex: 55
    SolutionNameMin: Cijk_Ailk_Bljk_SB_MT128x016x16_DTL0_EPS1_GRVW04_LPB00_PGR1_SNLL0_TT08_04_USFGRO0_VW04_WG16_04_04
    SolutionIndex: 56
    SolutionNameMin: Cijk_Ailk_Bljk_SB_MT032x016x16_DTL0_EPS1_GRVW02_LPB00_PGR1_SNLL0_TT04_02_USFGRO0_VW02_WG08_08_02
    SolutionIndex: 57
    SolutionNameMin: Cijk_Ailk_Bljk_SB_MT032x032x16_DTL0_EPS1_GRVW04_LPB00_PGR1_SNLL0_TT04_04_USFGRO0_VW04_WG08_08_02
    SolutionIndex: 58
    SolutionNameMin: Cijk_Ailk_Bljk_SB_MT064x032x16_DTL0_EPS1_GRVW04_LPB00_PGR1_SNLL0_TT08_04_USFGRO0_VW04_WG08_08_02
    SolutionIndex: 59
    SolutionNameMin: Cijk_Ailk_Bljk_SB_MT016x016x16_DTL0_EPS1_GRVW02_LPB00_PGR1_SNLL0_TT02_02_USFGRO01_VW02_WG08_08_04
    SolutionIndex: 60
    SolutionNameMin: Cijk_Ailk_Bljk_SB_MT032x016x16_DTL0_EPS1_GRVW02_LPB00_PGR1_SNLL0_TT04_02_USFGRO0_VW02_WG08_08_04
    SolutionIndex: 61
    SolutionNameMin: Cijk_Ailk_Bljk_SB_MT032x016x16_DTL0_EPS1_GRVW02_LPB00_PGR1_SNLL0_TT02_02_USFGRO0_VW02_WG16_08_02
    SolutionIndex: 62
    SolutionNameMin: Cijk_Ailk_Bljk_SB_MT064x016x16_DTL0_EPS1_GRVW02_LPB00_PGR1_SNLL0_TT04_02_USFGRO0_VW02_WG16_08_02
    SolutionIndex: 63
    SolutionNameMin: Cijk_Ailk_Bljk_SB_MT128x064x16_DTL0_EPS1_GRVW04_LPB00_PGR1_SNLL0_TT08_08_USFGRO0_VW04_WG16_08_02
    SolutionIndex: 64
    SolutionNameMin: Cijk_Ailk_Bljk_SB_MT128x016x16_DTL0_EPS1_GRVW04_LPB00_PGR1_SNLL0_TT04_04_USFGRO0_VW04_WG32_04_02
    SolutionIndex: 65
    SolutionNameMin: Cijk_Ailk_Bljk_SB_MT032x016x16_DTL0_EPS1_GRVW02_LPB00_PGR1_SNLL0_TT04_02_USFGRO0_VW02_WG08_08_02
    SolutionIndex: 66
    SolutionNameMin: Cijk_Ailk_Bljk_SB_MT032x032x16_DTL0_EPS1_GRVW04_LPB00_PGR1_SNLL0_TT04_04_USFGRO0_VW04_WG08_08_02
    SolutionIndex: 67
    SolutionNameMin: Cijk_Ailk_Bljk_SB_MT064x032x16_DTL0_EPS1_GRVW04_LPB00_PGR1_SNLL0_TT08_04_USFGRO0_VW04_WG08_08_02
    SolutionIndex: 68
    SolutionNameMin: Cijk_Ailk_Bljk_SB_MT016x016x16_DTL0_EPS1_GRVW02_LPB00_PGR1_SNLL0_TT02_02_USFGRO01_VW02_WG08_08_04
    SolutionIndex: 69
    SolutionNameMin: Cijk_Ailk_Bljk_SB_MT032x016x16_DTL0_EPS1_GRVW02_LPB00_PGR1_SNLL0_TT04_02_USFGRO0_VW02_WG08_08_04
    SolutionIndex: 70
    SolutionNameMin: Cijk_Ailk_Bljk_SB_MT064x016x16_DTL0_EPS1_GRVW04_LPB00_PGR1_SNLL0_TT04_04_USFGRO0_VW04_WG16_04_04
    SolutionIndex: 71
    SolutionNameMin: Cijk_Ailk_Bljk_SB_MT032x032x16_DTL0_EPS1_GRVW04_LPB00_PGR1_SNLL0_TT04_04_USFGRO0_VW04_WG08_08_02
    SolutionIndex: 72
    SolutionNameMin: Cijk_Ailk_Bljk_SB_MT032x016x16_DTL0_EPS1_GRVW02_LPB00_PGR1_SNLL0_TT04_02_USFGRO0_VW02_WG08_08_04
    SolutionIndex: 73
    SolutionNameMin: Cijk_Ailk_Bljk_SB_MT016x016x16_DTL0_EPS1_GRVW02_LPB00_PGR1_SNLL0_TT02_02_USFGRO01_VW02_WG08_08_04
    SolutionIndex: 74
    SolutionNameMin: Cijk_Ailk_Bljk_SB_MT064x064x24_DTL0_EPS1_GRVW04_LPB00_PGR1_SNLL0_TT08_08_USFGRO0_VW04_WG08_08_02
    SolutionIndex: 75
    SolutionNameMin: Cijk_Ailk_Bljk_SB_MT064x064x24_DTL0_EPS1_GRVW04_LPB00_PGR1_SNLL0_TT08_08_USFGRO0_VW04_WG08_08_02
    SolutionIndex: 76
    SolutionNameMin: Cijk_Ailk_Bljk_SB_MT032x008x32_DTL0_EPS1_GRVW02_LPB00_PGR1_SNLL0_TT02_02_USFGRO0_VW02_WG16_04_04
    SolutionIndex: 77
    SolutionNameMin: Cijk_Ailk_Bljk_SB_MT064x008x32_DTL0_EPS1_GRVW02_LPB00_PGR1_SNLL0_TT04_02_USFGRO0_VW02_WG16_04_04
    SolutionIndex: 78
    SolutionNameMin: Cijk_Ailk_Bljk_SB_MT128x032x32_DTL0_EPS1_GRVW04_LPB00_PGR1_SNLL0_TT08_08_USFGRO0_VW04_WG16_04_04
    SolutionIndex: 79
    SolutionNameMin: Cijk_Ailk_Bljk_SB_MT032x016x32_DTL0_EPS1_GRVW02_LPB00_PGR1_SNLL0_TT04_02_USFGRO0_VW02_WG08_08_02
    SolutionIndex: 80
    SolutionNameMin: Cijk_Ailk_Bljk_SB_MT016x016x32_DTL0_EPS1_GRVW02_LPB00_PGR1_SNLL0_TT02_02_USFGRO0_VW02_WG08_08_04
    SolutionIndex: 81
    SolutionNameMin: Cijk_Ailk_Bljk_SB_MT032x032x32_DTL0_EPS1_GRVW04_LPB00_PGR1_SNLL0_TT04_04_USFGRO0_VW04_WG08_08_04
    SolutionIndex: 82
    SolutionNameMin: Cijk_Ailk_Bljk_SB_MT064x032x32_DTL0_EPS1_GRVW04_LPB00_PGR1_SNLL0_TT08_04_USFGRO0_VW04_WG08_08_04
    SolutionIndex: 83
    SolutionNameMin: Cijk_Ailk_Bljk_SB_MT064x016x32_DTL0_EPS1_GRVW02_LPB00_PGR1_SNLL0_TT04_02_USFGRO0_VW02_WG16_08_02
    SolutionIndex: 84
    SolutionNameMin: Cijk_Ailk_Bljk_SB_MT032x008x32_DTL0_EPS1_GRVW02_LPB00_PGR1_SNLL0_TT02_02_USFGRO0_VW02_WG16_04_04
    SolutionIndex: 85
    SolutionNameMin: Cijk_Ailk_Bljk_SB_MT128x032x32_DTL0_EPS1_GRVW04_LPB00_PGR1_SNLL0_TT08_08_USFGRO0_VW04_WG16_04_04
    SolutionIndex: 86
    SolutionNameMin: Cijk_Ailk_Bljk_SB_MT032x016x32_DTL0_EPS1_GRVW02_LPB00_PGR1_SNLL0_TT04_02_USFGRO0_VW02_WG08_08_04
    SolutionIndex: 87
    SolutionNameMin: Cijk_Ailk_Bljk_SB_MT032x032x32_DTL0_EPS1_GRVW04_LPB00_PGR1_SNLL0_TT04_04_USFGRO0_VW04_WG08_08_04
    SolutionIndex: 88
    SolutionNameMin: Cijk_Ailk_Bljk_SB_MT064x032x32_DTL0_EPS1_GRVW04_LPB00_PGR1_SNLL0_TT08_04_USFGRO0_VW04_WG08_08_04
    SolutionIndex: 89
    SolutionNameMin: Cijk_Ailk_Bljk_SB_MT064x032x32_DTL0_EPS1_GRVW04_LPB00_PGR1_SNLL0_TT04_04_USFGRO0_VW04_WG16_08_02
    SolutionIndex: 90
    SolutionNameMin: Cijk_Ailk_Bljk_SB_MT128x064x32_DTL0_EPS1_GRVW04_LPB00_PGR1_SNLL0_TT08_08_USFGRO0_VW04_WG16_08_02
    SolutionIndex: 91
    SolutionNameMin: Cijk_Ailk_Bljk_SB_MT032x008x32_DTL0_EPS1_GRVW02_LPB00_PGR1_SNLL0_TT02_02_USFGRO0_VW02_WG16_04_04
    SolutionIndex: 92
    SolutionNameMin: Cijk_Ailk_Bljk_SB_MT064x008x32_DTL0_EPS1_GRVW02_LPB00_PGR1_SNLL0_TT04_02_USFGRO0_VW02_WG16_04_04
    SolutionIndex: 93
    SolutionNameMin: Cijk_Ailk_Bljk_SB_MT032x032x32_DTL0_EPS1_GRVW04_LPB00_PGR1_SNLL0_TT04_04_USFGRO0_VW04_WG08_08_04
    SolutionIndex: 94
    SolutionNameMin: Cijk_Ailk_Bljk_SB_MT032x008x32_DTL0_EPS1_GRVW02_LPB00_PGR1_SNLL0_TT02_02_USFGRO0_VW02_WG16_04_04
    SolutionIndex: 95
    SolutionNameMin: Cijk_Ailk_Bljk_SB_MT032x032x32_DTL0_EPS1_GRVW04_LPB00_PGR1_SNLL0_TT04_04_USFGRO0_VW04_WG08_08_04
    SolutionIndex: 96
    SolutionNameMin: Cijk_Ailk_Bljk_SB_MT064x032x32_DTL0_EPS1_GRVW04_LPB00_PGR1_SNLL0_TT08_04_USFGRO0_VW04_WG08_08_04
    SolutionIndex: 97
    SolutionNameMin: Cijk_Ailk_Bljk_SB_MT064x016x32_DTL0_EPS1_GRVW02_LPB00_PGR1_SNLL0_TT04_02_USFGRO0_VW02_WG16_08_02
    SolutionIndex: 98
    SolutionNameMin: Cijk_Ailk_Bljk_SB_MT032x008x32_DTL0_EPS1_GRVW02_LPB00_PGR1_SNLL0_TT02_02_USFGRO0_VW02_WG16_04_04
    SolutionIndex: 99
    SolutionNameMin: Cijk_Ailk_Bljk_SB_MT032x008x32_DTL0_EPS1_GRVW02_LPB00_PGR1_SNLL0_TT02_02_USFGRO0_VW02_WG16_04_04
    SolutionIndex: 100
    SolutionNameMin: Cijk_Ailk_Bljk_SB_MT128x128x08_DTL0_EPS0_GRVW04_LPB00_PGR0_SNLL0_TT08_08_USFGRO00_VW04_WG16_16_01
    SolutionIndex: 101
    SolutionNameMin: Cijk_Ailk_Bljk_SB_MT064x064x16_DTL0_EPS0_GRVW04_LPB00_PGR0_SNLL0_TT04_04_USFGRO00_VW04_WG16_16_01
    SolutionIndex: 102
    SolutionNameMin: Cijk_Ailk_Bljk_SB_MT064x064x16_DTL0_EPS0_GRVW04_LPB00_PGR1_SNLL0_TT04_04_USFGRO00_VW04_WG16_16_01
    SolutionIndex: 103
    SolutionNameMin: Cijk_Ailk_Bljk_SB_MT064x128x16_DTL0_EPS0_GRVW04_LPB00_PGR1_SNLL0_TT04_08_USFGRO00_VW04_WG16_16_01
    SolutionIndex: 104
    SolutionNameMin: Cijk_Ailk_Bljk_SB_MT096x128x16_DTL0_EPS0_GRVW02_LPB00_PGR0_SNLL0_TT06_08_USFGRO00_VW02_WG16_16_01
    SolutionIndex: 105
    SolutionNameMin: Cijk_Ailk_Bljk_SB_MT128x064x16_DTL0_EPS0_GRVW04_LPB00_PGR0_SNLL0_TT08_04_USFGRO00_VW04_WG16_16_01
    SolutionIndex: 106
    SolutionNameMin: Cijk_Ailk_Bljk_SB_MT128x064x16_DTL0_EPS0_GRVW04_LPB00_PGR1_SNLL0_TT08_04_USFGRO00_VW04_WG16_16_01
    SolutionIndex: 107
    SolutionNameMin: Cijk_Ailk_Bljk_SB_MT064x064x16_DTL0_EPS0_GRVW04_LPB00_PGR0_SNLL0_TT04_04_USFGRO00_VW04_WG16_16_01
    SolutionIndex: 108
    SolutionNameMin: Cijk_Ailk_Bljk_SB_MT064x064x16_DTL0_EPS0_GRVW04_LPB00_PGR1_SNLL0_TT04_04_USFGRO00_VW04_WG16_16_01
    SolutionIndex: 109
    SolutionNameMin: Cijk_Ailk_Bljk_SB_MT064x128x16_DTL0_EPS0_GRVW04_LPB00_PGR1_SNLL0_TT04_08_USFGRO00_VW04_WG16_16_01
    SolutionIndex: 110
    SolutionNameMin: Cijk_Ailk_Bljk_SB_MT096x128x16_DTL0_EPS0_GRVW02_LPB00_PGR0_SNLL0_TT06_08_USFGRO00_VW02_WG16_16_01
    SolutionIndex: 111
    SolutionNameMin: Cijk_Ailk_Bljk_SB_MT128x064x16_DTL0_EPS0_GRVW04_LPB00_PGR1_SNLL0_TT08_04_USFGRO00_VW04_WG16_16_01
    SolutionIndex: 112
    SolutionNameMin: Cijk_Ailk_Bljk_SB_MT064x064x32_DTL0_EPS0_GRVW04_LPB00_PGR0_SNLL0_TT04_04_USFGRO00_VW04_WG16_16_01
    SolutionIndex: 113
    SolutionNameMin: Cijk_Ailk_Bljk_SB_MT064x128x32_DTL0_EPS0_GRVW04_LPB00_PGR0_SNLL0_TT04_08_USFGRO00_VW04_WG16_16_01
    SolutionIndex: 114
    SolutionNameMin: Cijk_Ailk_Bljk_SB_MT128x064x32_DTL0_EPS0_GRVW04_LPB00_PGR0_SNLL0_TT08_04_USFGRO00_VW04_WG16_16_01
    SolutionIndex: 115
    SolutionNameMin: Cijk_Ailk_Bljk_SB_MT064x064x32_DTL0_EPS0_GRVW04_LPB00_PGR0_SNLL0_TT04_04_USFGRO00_VW04_WG16_16_01
    SolutionIndex: 116
    SolutionNameMin: Cijk_Ailk_Bljk_SB_MT064x064x32_DTL0_EPS0_GRVW04_LPB00_PGR1_SNLL0_TT04_04_USFGRO00_VW04_WG16_16_01
    SolutionIndex: 117
    SolutionNameMin: Cijk_Ailk_Bljk_SB_MT128x128x08_DTL0_EPS1_GRVW04_LPB00_PGR1_SNLL1_TT08_08_USFGRO0_VW04_WG16_16_01
    SolutionIndex: 118
    SolutionNameMin: Cijk_Ailk_Bljk_SB_MT128x128x08_DTL0_EPS1_GRVW04_LPB00_PGR1_SNLL1_TT08_08_USFGRO0_VW04_WG16_16_01
    SolutionIndex: 119
    SolutionNameMin: Cijk_Ailk_Bljk_SB_MT064x064x16_DTL0_EPS0_GRVW04_LPB00_PGR0_SNLL0_TT04_04_USFGRO0_VW04_WG16_16_01
    SolutionIndex: 120
    SolutionNameMin: Cijk_Ailk_Bljk_SB_MT064x064x16_DTL0_EPS1_GRVW04_LPB00_PGR1_SNLL1_TT04_04_USFGRO0_VW04_WG16_16_01
    SolutionIndex: 121
    SolutionNameMin: Cijk_Ailk_Bljk_SB_MT064x128x16_DTL0_EPS0_GRVW04_LPB00_PGR0_SNLL0_TT04_08_USFGRO0_VW04_WG16_16_01
    SolutionIndex: 122
    SolutionNameMin: Cijk_Ailk_Bljk_SB_MT064x128x16_DTL0_EPS1_GRVW04_LPB00_PGR1_SNLL1_TT04_08_USFGRO0_VW04_WG16_16_01
    SolutionIndex: 123
    SolutionNameMin: Cijk_Ailk_Bljk_SB_MT096x128x16_DTL0_EPS1_GRVW02_LPB00_PGR1_SNLL1_TT06_08_USFGRO0_VW02_WG16_16_01
    SolutionIndex: 124
    SolutionNameMin: Cijk_Ailk_Bljk_SB_MT128x064x16_DTL0_EPS0_GRVW04_LPB00_PGR0_SNLL0_TT08_04_USFGRO0_VW04_WG16_16_01
    SolutionIndex: 125
    SolutionNameMin: Cijk_Ailk_Bljk_SB_MT128x064x16_DTL0_EPS1_GRVW04_LPB00_PGR1_SNLL1_TT08_04_USFGRO0_VW04_WG16_16_01
    SolutionIndex: 126
    SolutionNameMin: Cijk_Ailk_Bljk_SB_MT128x096x16_DTL0_EPS1_GRVW02_LPB00_PGR1_SNLL1_TT08_06_USFGRO0_VW02_WG16_16_01
    SolutionIndex: 127
    SolutionNameMin: Cijk_Ailk_Bljk_SB_MT128x128x16_DTL0_EPS0_GRVW04_LPB00_PGR0_SNLL0_TT08_08_USFGRO0_VW04_WG16_16_01
    SolutionIndex: 128
    SolutionNameMin: Cijk_Ailk_Bljk_SB_MT128x128x16_DTL0_EPS1_GRVW04_LPB00_PGR1_SNLL1_TT08_08_USFGRO0_VW04_WG16_16_01
    SolutionIndex: 129
    SolutionNameMin: Cijk_Ailk_Bljk_SB_MT064x064x16_DTL0_EPS0_GRVW04_LPB00_PGR0_SNLL0_TT04_04_USFGRO0_VW04_WG16_16_01
    SolutionIndex: 130
    SolutionNameMin: Cijk_Ailk_Bljk_SB_MT064x064x16_DTL0_EPS1_GRVW04_LPB00_PGR1_SNLL1_TT04_04_USFGRO0_VW04_WG16_16_01
    SolutionIndex: 131
    SolutionNameMin: Cijk_Ailk_Bljk_SB_MT064x128x16_DTL0_EPS0_GRVW04_LPB00_PGR0_SNLL0_TT04_08_USFGRO0_VW04_WG16_16_01
    SolutionIndex: 132
    SolutionNameMin: Cijk_Ailk_Bljk_SB_MT064x128x16_DTL0_EPS1_GRVW04_LPB00_PGR1_SNLL1_TT04_08_USFGRO0_VW04_WG16_16_01
    SolutionIndex: 133
    SolutionNameMin: Cijk_Ailk_Bljk_SB_MT096x128x16_DTL0_EPS1_GRVW02_LPB00_PGR1_SNLL1_TT06_08_USFGRO0_VW02_WG16_16_01
    SolutionIndex: 134
    SolutionNameMin: Cijk_Ailk_Bljk_SB_MT128x064x16_DTL0_EPS0_GRVW04_LPB00_PGR0_SNLL0_TT08_04_USFGRO0_VW04_WG16_16_01
    SolutionIndex: 135
    SolutionNameMin: Cijk_Ailk_Bljk_SB_MT128x064x16_DTL0_EPS1_GRVW04_LPB00_PGR1_SNLL1_TT08_04_USFGRO0_VW04_WG16_16_01
    SolutionIndex: 136
    SolutionNameMin: Cijk_Ailk_Bljk_SB_MT128x096x16_DTL0_EPS1_GRVW02_LPB00_PGR1_SNLL1_TT08_06_USFGRO0_VW02_WG16_16_01
    SolutionIndex: 137
    SolutionNameMin: Cijk_Ailk_Bljk_SB_MT128x128x16_DTL0_EPS0_GRVW04_LPB00_PGR0_SNLL0_TT08_08_USFGRO0_VW04_WG16_16_01
    SolutionIndex: 138
    SolutionNameMin: Cijk_Ailk_Bljk_SB_MT128x128x16_DTL0_EPS1_GRVW04_LPB00_PGR1_SNLL1_TT08_08_USFGRO0_VW04_WG16_16_01
    SolutionIndex: 139
    SolutionNameMin: Cijk_Ailk_Bljk_SB_MT128x128x24_DTL0_EPS0_GRVW04_LPB00_PGR0_SNLL0_TT08_08_USFGRO0_VW04_WG16_16_01
    SolutionIndex: 140
    SolutionNameMin: Cijk_Ailk_Bljk_SB_MT128x128x24_DTL0_EPS1_GRVW04_LPB00_PGR1_SNLL1_TT08_08_USFGRO0_VW04_WG16_16_01
    SolutionIndex: 141
    SolutionNameMin: Cijk_Ailk_Bljk_SB_MT128x128x24_DTL0_EPS0_GRVW04_LPB00_PGR0_SNLL0_TT08_08_USFGRO0_VW04_WG16_16_01
    SolutionIndex: 142
    SolutionNameMin: Cijk_Ailk_Bljk_SB_MT128x128x24_DTL0_EPS1_GRVW04_LPB00_PGR1_SNLL1_TT08_08_USFGRO0_VW04_WG16_16_01
    SolutionIndex: 143
    SolutionNameMin: Cijk_Ailk_Bljk_SB_MT064x064x32_DTL0_EPS0_GRVW04_LPB00_PGR0_SNLL0_TT04_04_USFGRO0_VW04_WG16_16_01
    SolutionIndex: 144
    SolutionNameMin: Cijk_Ailk_Bljk_SB_MT064x064x32_DTL0_EPS1_GRVW04_LPB00_PGR1_SNLL1_TT04_04_USFGRO0_VW04_WG16_16_01
    SolutionIndex: 145
    SolutionNameMin: Cijk_Ailk_Bljk_SB_MT128x064x32_DTL0_EPS0_GRVW04_LPB00_PGR0_SNLL0_TT08_04_USFGRO0_VW04_WG16_16_01
    SolutionIndex: 146
    SolutionNameMin: Cijk_Ailk_Bljk_SB_MT128x064x32_DTL0_EPS1_GRVW04_LPB00_PGR1_SNLL1_TT08_04_USFGRO0_VW04_WG16_16_01
    SolutionIndex: 147
    SolutionNameMin: Cijk_Ailk_Bljk_SB_MT128x128x32_DTL0_EPS0_GRVW04_LPB00_PGR0_SNLL0_TT08_08_USFGRO0_VW04_WG16_16_01
    SolutionIndex: 148
    SolutionNameMin: Cijk_Ailk_Bljk_SB_MT128x128x32_DTL0_EPS1_GRVW04_LPB00_PGR1_SNLL1_TT08_08_USFGRO0_VW04_WG16_16_01
    SolutionIndex: 149
    SolutionNameMin: Cijk_Ailk_Bljk_SB_MT064x064x32_DTL0_EPS0_GRVW04_LPB00_PGR0_SNLL0_TT04_04_USFGRO0_VW04_WG16_16_01
    SolutionIndex: 150
    SolutionNameMin: Cijk_Ailk_Bljk_SB_MT064x064x32_DTL0_EPS1_GRVW04_LPB00_PGR1_SNLL1_TT04_04_USFGRO0_VW04_WG16_16_01
    SolutionIndex: 151
    SolutionNameMin: Cijk_Ailk_Bljk_SB_MT128x064x32_DTL0_EPS0_GRVW04_LPB00_PGR0_SNLL0_TT08_04_USFGRO0_VW04_WG16_16_01
    SolutionIndex: 152
    SolutionNameMin: Cijk_Ailk_Bljk_SB_MT128x064x32_DTL0_EPS1_GRVW04_LPB00_PGR1_SNLL1_TT08_04_USFGRO0_VW04_WG16_16_01
    SolutionIndex: 153
    SolutionNameMin: Cijk_Ailk_Bljk_SB_MT128x128x32_DTL0_EPS0_GRVW04_LPB00_PGR0_SNLL0_TT08_08_USFGRO0_VW04_WG16_16_01
    SolutionIndex: 154
    SolutionNameMin: Cijk_Ailk_Bljk_SB_MT128x128x32_DTL0_EPS1_GRVW04_LPB00_PGR1_SNLL1_TT08_08_USFGRO0_VW04_WG16_16_01
    SolutionIndex: 155
    SolutionNameMin: Cijk_Ailk_Bljk_SB_MT016x016x04_DTL0_EPS0_GRVW02_LPB00_PGR1_SNLL0_TT02_02_USFGRO00_VW02_WG08_08_01
    SolutionIndex: 156
    SolutionNameMin: Cijk_Ailk_Bljk_SB_MT032x032x02_DTL0_EPS0_GRVW04_LPB00_PGR1_SNLL0_TT04_04_USFGRO00_VW04_WG08_08_01
    SolutionIndex: 157
    SolutionNameMin: Cijk_Ailk_Bljk_SB_MT016x016x16_DTL0_EPS1_GRVW02_LPB00_PGR1_SNLL1_TT02_02_USFGRO01_VW02_WG08_08_04
    SolutionIndex: 158
    SolutionNameMin: Cijk_Ailk_Bljk_SB_MT016x016x04_DTL0_EPS1_GRVW02_LPB00_PGR1_SNLL0_TT02_02_USFGRO01_VW02_WG08_08_01
    SolutionIndex: 159
    SolutionNameMin: Cijk_Ailk_Bljk_SB_MT008x008x08_DTL0_EPS1_GRVW02_LPB00_PGR1_SNLL0_TT02_02_USFGRO01_VW02_WG04_04_04
    SolutionIndex: 160
    SolutionNameMin: Cijk_Ailk_Bljk_SB_MT016x016x04_DTL0_EPS1_GRVW02_LPB00_PGR1_SNLL0_TT02_02_USFGRO01_VW02_WG08_08_01
    SolutionIndex: 161
    SolutionNameMin: Cijk_Ailk_Bljk_SB_MT008x008x08_DTL0_EPS1_GRVW02_LPB00_PGR1_SNLL0_TT02_02_USFGRO01_VW02_WG04_04_04
    SolutionIndex: 162
    SolutionNameMin: Cijk_Ailk_Bljk_SB_MT016x016x08_DTL0_EPS1_GRVW02_LPB00_PGR1_SNLL0_TT02_02_USFGRO01_VW02_WG08_08_02
    SolutionIndex: 163
    SolutionNameMin: Cijk_Ailk_Bljk_SB_MT008x008x08_DTL0_EPS1_GRVW02_LPB00_PGR1_SNLL0_TT02_02_USFGRO01_VW02_WG04_04_04
    SolutionIndex: 164
    SolutionNameMin: Cijk_Ailk_Bljk_SB_MT016x016x16_DTL0_EPS1_GRVW02_LPB00_PGR1_SNLL0_TT02_02_USFGRO01_VW02_WG08_08_04
    SolutionIndex: 165
    SolutionNameMin: Cijk_Ailk_Bljk_SB_MT128x032x08_DTL0_EPS1_GRVW04_LPB04_PGR1_SNLL1_TT04_04_USFGRO0_VW04_WG32_08_01
    SolutionIndex: 166
    SolutionNameMin: Cijk_Ailk_Bljk_SB_MT128x032x08_DTL0_EPS1_GRVW04_LPB04_PGR1_SNLL1_TT04_04_USFGRO0_VW04_WG32_08_01
    SolutionIndex: 167
    SolutionNameMin: Cijk_Ailk_Bljk_SB_MT064x064x16_DTL0_EPS1_GRVW04_LPB04_PGR1_SNLL1_TT04_04_USFGRO0_VW04_WG16_16_01
    SolutionIndex: 168
    SolutionNameMin: Cijk_Ailk_Bljk_SB_MT128x064x16_DTL0_EPS1_GRVW04_LPB04_PGR1_SNLL1_TT04_08_USFGRO0_VW04_WG32_08_01
    SolutionIndex: 169
    SolutionNameMin: Cijk_Ailk_Bljk_SB_MT032x128x16_DTL0_EPS0_GRVW01_LPB02_PGR0_SNLL0_TT04_04_USFGRO01_VW01_WG08_32_01
    SolutionIndex: 170
    SolutionNameMin: Cijk_Ailk_Bljk_SB_MT128x032x16_DTL0_EPS0_GRVW01_LPB02_PGR0_SNLL0_TT04_04_USFGRO01_VW02_WG32_08_01
    SolutionIndex: 171
    SolutionNameMin: Cijk_Ailk_Bljk_SB_MT256x032x16_DTL1_EPS0_GRVW01_LPB02_PGR0_SNLL0_TT08_04_USFGRO01_VW02_WG32_08_01
    SolutionIndex: 172
    SolutionNameMin: Cijk_Ailk_Bljk_SB_MT064x032x16_DTL0_EPS0_GRVW01_LPB04_PGR0_SNLL0_TT04_04_USFGRO01_VW01_WG16_08_01
    SolutionIndex: 173
    SolutionNameMin: Cijk_Ailk_Bljk_SB_MT064x064x16_DTL0_EPS0_GRVW01_LPB04_PGR0_SNLL0_TT04_04_USFGRO01_VW04_WG16_16_01
    SolutionIndex: 174
    SolutionNameMin: Cijk_Ailk_Bljk_SB_MT064x064x16_DTL0_EPS0_GRVW04_LPB04_PGR0_SNLL0_TT04_04_USFGRO0_VW04_WG16_16_01
    SolutionIndex: 175
    SolutionNameMin: Cijk_Ailk_Bljk_SB_MT128x064x16_DTL0_EPS0_GRVW04_LPB04_PGR0_SNLL0_TT08_04_USFGRO0_VW04_WG16_16_01
    SolutionIndex: 176
    SolutionNameMin: Cijk_Ailk_Bljk_SB_MT128x064x08_DTL0_GRVW01_GSU08_PGR1_PLR1_TT08_04_USFGRO01_VW01_WG16_16_01_WGM01
    SolutionIndex: 177
    SolutionNameMin: Cijk_Ailk_Bljk_SB_MT256x032x08_DTL1_GRVW01_GSU01_PGR0_PLR1_TT08_04_USFGRO01_VW04_WG32_08_01_WGM08
    SolutionIndex: 178
    SolutionNameMin: Cijk_Ailk_Bljk_SB_MT128x064x08_DTL0_GRVW02_GSU01_PGR1_PLR1_TT08_04_USFGRO0_VW02_WG16_16_01_WGM01
    SolutionIndex: 179
    SolutionNameMin: Cijk_Ailk_Bljk_SB_MT128x064x08_DTL0_GRVW02_GSU01_PGR1_PLR1_TT04_08_USFGRO0_VW02_WG32_08_01_WGM01
    SolutionIndex: 180
    SolutionNameMin: Cijk_Ailk_Bljk_SB_MT064x064x08_DTL0_GRVW04_GSU01_PGR1_PLR1_TT04_08_USFGRO0_VW04_WG16_08_01_WGM01
    SolutionIndex: 181
    SolutionNameMin: Cijk_Ailk_Bljk_SB_MT064x064x08_DTL0_GRVW04_GSU01_PGR1_PLR1_TT04_08_USFGRO0_VW04_WG16_08_01_WGM08
    SolutionIndex: 182
    SolutionNameMin: Cijk_Ailk_Bljk_SB_MT064x128x16_DTL0_GRVW04_GSU01_PGR0_PLR1_TT08_04_USFGRO0_VW04_WG08_32_01_WGM01
    SolutionIndex: 183
    SolutionNameMin: Cijk_Ailk_Bljk_SB_MT064x064x16_DTL0_GRVW04_GSU01_PGR1_PLR1_TT04_04_USFGRO0_VW04_WG16_16_01_WGM01
    SolutionIndex: 184
    SolutionNameMin: Cijk_Ailk_Bljk_SB_MT064x128x16_DTL0_GRVW04_GSU01_PGR0_PLR1_TT04_08_USFGRO0_VW04_WG16_16_01_WGM01
    SolutionIndex: 185
    SolutionNameMin: Cijk_Ailk_Bljk_SB_MT128x064x16_DTL0_GRVW04_GSU01_PGR0_PLR1_TT08_04_USFGRO0_VW04_WG16_16_01_WGM01
    SolutionIndex: 186
    SolutionNameMin: Cijk_Ailk_Bljk_SB_MT128x064x16_DTL0_GRVW04_GSU01_PGR1_PLR1_TT08_04_USFGRO0_VW04_WG16_16_01_WGM01
    SolutionIndex: 187
    SolutionNameMin: Cijk_Ailk_Bljk_SB_MT128x064x16_DTL0_GRVW04_GSU01_PGR1_PLR1_TT04_08_USFGRO0_VW04_WG32_08_01_WGM01
    SolutionIndex: 188
    SolutionNameMin: Cijk_Ailk_Bljk_SB_MT128x064x16_DTL0_GRVW04_GSU01_PGR1_PLR1_TT04_08_USFGRO0_VW04_WG32_08_01_WGM08
    SolutionIndex: 189
    SolutionNameMin: Cijk_Ailk_Bljk_SB_MT128x64x8_EPS1_GRVW4_GSU1_LPB0_PGR1_SNLL1_TT8_4_VW4_WG16_16_1_WGM4
    SolutionIndex: 190
    SolutionNameMin: Cijk_Ailk_Bljk_SB_MT128x128x16_EPS1_GRVW4_GSU1_LPB0_PGR1_SNLL1_TT8_8_VW4_WG16_16_1_WGM4
    SolutionIndex: 191
    SolutionNameMin: Cijk_Ailk_Bljk_SB_MT128x64x8_EPS1_GRVW4_GSU1_LPB0_PGR1_SNLL1_TT8_4_VW4_WG16_16_1_WGM8
    SolutionIndex: 192
    SolutionNameMin: Cijk_Ailk_Bljk_SB_MT128x128x16_EPS1_GRVW4_GSU1_LPB0_PGR1_SNLL1_TT8_8_VW4_WG16_16_1_WGM8
    SolutionIndex: 193
    SolutionNameMin: Cijk_Ailk_Bljk_SB_MT128x128x16_EPS1_GRVW4_GSU1_LPB0_PGR1_SNLL1_TT8_8_VW4_WG16_16_1_WGM32
    SolutionIndex: 194
    SolutionNameMin: Cijk_Ailk_Bljk_SB_MT64x32x32_EPS1_GRVW2_GSU1_LPB2_PGR1_SNLL1_TT4_4_VW2_WG16_8_2_WGM4
    SolutionIndex: 195
    SolutionNameMin: Cijk_Ailk_Bljk_SB_MT128x64x8_EPS1_GRVW4_GSU1_LPB4_PGR1_SNLL1_TT8_4_VW4_WG16_16_1_WGM4
    SolutionIndex: 196
    SolutionNameMin: Cijk_Ailk_Bljk_SB_MT32x16x16_EPS1_GRVW4_GSU1_LPB4_PGR1_SNLL1_TT4_4_VW4_WG8_4_2_WGM4
    SolutionIndex: 197
    SolutionNameMin: Cijk_Ailk_Bljk_SB_MT128x64x16_EPS1_GRVW4_GSU1_LPB4_PGR1_SNLL1_TT8_4_VW4_WG16_16_1_WGM4
    SolutionIndex: 198
    SolutionNameMin: Cijk_Ailk_Bljk_SB_MT64x32x16_EPS1_GRVW4_GSU1_LPB4_PGR1_SNLL1_TT4_4_VW4_WG16_8_2_WGM4
    SolutionIndex: 199
    SolutionNameMin: Cijk_Ailk_Bljk_SB_MT64x64x16_EPS1_GRVW4_GSU1_LPB4_PGR1_SNLL1_TT4_8_VW4_WG16_8_2_WGM4
    SolutionIndex: 200
    SolutionNameMin: Cijk_Ailk_Bljk_SB_MT32x16x32_EPS1_GRVW4_GSU1_LPB4_PGR1_SNLL1_TT4_4_VW4_WG8_4_2_WGM4
    SolutionIndex: 201
    SolutionNameMin: Cijk_Ailk_Bljk_SB_MT64x32x32_EPS1_GRVW4_GSU1_LPB4_PGR1_SNLL1_TT4_4_VW4_WG16_8_2_WGM4
    SolutionIndex: 202
    SolutionNameMin: Cijk_Ailk_Bljk_SB_MT128x64x16_EPS1_GRVW4_GSU1_LPB4_PGR1_SNLL1_TT8_4_VW4_WG16_16_1_WGM8
    SolutionIndex: 203
    SolutionNameMin: Cijk_Ailk_Bljk_SB_MT64x32x16_EPS1_GRVW4_GSU1_LPB4_PGR1_SNLL1_TT4_4_VW4_WG16_8_2_WGM8
    SolutionIndex: 204
    SolutionNameMin: Cijk_Ailk_Bljk_SB_MT64x64x16_EPS1_GRVW4_GSU1_LPB4_PGR1_SNLL1_TT4_8_VW4_WG16_8_2_WGM8
    SolutionIndex: 205
    SolutionNameMin: Cijk_Ailk_Bljk_SB_MT128x32x16_EPS1_GRVW4_GSU1_LPB4_PGR1_SNLL1_TT8_4_VW4_WG16_8_2_WGM8
    SolutionIndex: 206
    SolutionNameMin: Cijk_Ailk_Bljk_SB_MT64x32x32_EPS1_GRVW4_GSU1_LPB4_PGR1_SNLL1_TT4_4_VW4_WG16_8_2_WGM8
    SolutionIndex: 207
    SolutionNameMin: Cijk_Ailk_Bljk_SB_MT128x64x16_EPS1_GRVW4_GSU1_LPB4_PGR1_SNLL1_TT8_4_VW4_WG16_16_1_WGM16
    SolutionIndex: 208
    SolutionNameMin: Cijk_Ailk_Bljk_SB_MT64x32x16_EPS1_GRVW4_GSU1_LPB4_PGR1_SNLL1_TT4_4_VW4_WG16_8_2_WGM16
    SolutionIndex: 209
    SolutionNameMin: Cijk_Ailk_Bljk_SB_MT64x64x16_EPS1_GRVW4_GSU1_LPB4_PGR1_SNLL1_TT4_8_VW4_WG16_8_2_WGM16
    SolutionIndex: 210
    SolutionNameMin: Cijk_Ailk_Bljk_SB_MT128x32x16_EPS1_GRVW4_GSU1_LPB4_PGR1_SNLL1_TT8_4_VW4_WG16_8_2_WGM16
    SolutionIndex: 211
    SolutionNameMin: Cijk_Ailk_Bljk_SB_MT64x32x32_EPS1_GRVW4_GSU1_LPB4_PGR1_SNLL1_TT4_4_VW4_WG16_8_2_WGM16
    SolutionIndex: 212
    SolutionNameMin: Cijk_Ailk_Bljk_SB_MT128x64x16_EPS1_GRVW4_GSU1_LPB4_PGR1_SNLL1_TT8_4_VW4_WG16_16_1_WGM32
    SolutionIndex: 213
    SolutionNameMin: Cijk_Ailk_Bljk_SB_MT64x32x16_EPS1_GRVW4_GSU1_LPB4_PGR1_SNLL1_TT4_4_VW4_WG16_8_2_WGM32
    SolutionIndex: 214
    SolutionNameMin: Cijk_Ailk_Bljk_SB_MT64x32x32_EPS1_GRVW4_GSU1_LPB4_PGR1_SNLL1_TT4_4_VW4_WG16_8_2_WGM32
    SolutionIndex: 215
    SolutionNameMin: Cijk_Ailk_Bljk_SB_MT128x64x8_SE_EPS1_PGR1_SNLL1_TT8_4_WG16_16_1_WGM2
    SolutionIndex: 216
    SolutionNameMin: Cijk_Ailk_Bljk_SB_MT128x64x8_SE_EPS1_PGR1_SNLL1_TT4_8_WG32_8_1_WGM2
    SolutionIndex: 217
    SolutionNameMin: Cijk_Ailk_Bljk_SB_MT256x32x8_SE_EPS1_PGR1_SNLL1_TT4_8_WG64_4_1_WGM2
    SolutionIndex: 218
    SolutionNameMin: Cijk_Ailk_Bljk_SB_MT128x32x8_SE_EPS1_PGR1_SNLL1_TT4_4_WG32_8_1_WGM4
    SolutionIndex: 219
    SolutionNameMin: Cijk_Ailk_Bljk_SB_MT128x64x8_SE_EPS1_PGR1_SNLL1_TT4_8_WG32_8_1_WGM7
    SolutionIndex: 220
    SolutionNameMin: Cijk_Ailk_Bljk_SB_MT128x64x8_SE_EPS1_PGR1_SNLL1_TT4_8_WG32_8_1_WGM15
    SolutionIndex: 221
    SolutionNameMin: Cijk_Ailk_Bljk_SB_MT128x64x8_SE_EPS1_PGR1_SNLL1_TT8_4_WG16_16_1_WGM16
    SolutionIndex: 222
    SolutionNameMin: Cijk_Ailk_Bljk_SB_MT128x64x8_SE_EPS1_PGR1_SNLL1_TT8_4_WG16_16_1_WGM17
    SolutionIndex: 223
    SolutionNameMin: Cijk_Ailk_Bljk_SB_MT256x16x8_SE_EPS0_PGR0_SNLL0_TT4_4_WG64_4_1_WGM17
    SolutionIndex: 224
    SolutionNameMin: Cijk_Ailk_Bljk_SB_MT128x64x8_SE_EPS1_PGR1_SNLL1_TT4_8_WG32_8_1_WGM32
    SolutionIndex: 225
    SolutionNameMin: Cijk_Ailk_Bljk_SB_MT256x16x8_SE_EPS0_PGR0_SNLL0_TT4_4_WG64_4_1_WGM32
    SolutionIndex: 226
    SolutionNameMin: Cijk_Ailk_Bljk_SB_MT64x64x16_SE_EPS1_PGR1_SNLL1_TT4_4_WG16_16_1_WGM2
    SolutionIndex: 227
    SolutionNameMin: Cijk_Ailk_Bljk_SB_MT64x64x16_SE_EPS1_PGR1_SNLL1_TT4_8_WG16_8_2_WGM2
    SolutionIndex: 228
    SolutionNameMin: Cijk_Ailk_Bljk_SB_MT64x128x16_SE_EPS1_PGR1_SNLL1_TT4_8_WG16_16_1_WGM7
    SolutionIndex: 229
    SolutionNameMin: Cijk_Ailk_Bljk_SB_MT64x64x16_SE_EPS1_PGR1_SNLL1_TT4_8_WG16_8_2_WGM7
    SolutionIndex: 230
    SolutionNameMin: Cijk_Ailk_Bljk_SB_MT64x64x16_SE_EPS1_PGR1_SNLL1_TT4_8_WG16_8_2_WGM11
    SolutionIndex: 231
    SolutionNameMin: Cijk_Ailk_Bljk_SB_MT64x64x16_SE_EPS1_PGR1_SNLL1_TT4_4_WG16_16_1_WGM16
    SolutionIndex: 232
    SolutionNameMin: Cijk_Ailk_Bljk_SB_MT64x64x16_SE_EPS1_PGR1_SNLL1_TT4_8_WG16_8_2_WGM32
    SolutionIndex: 233
    SolutionNameMin: Cijk_Ailk_Bljk_SB_MT64x32x16_SE_EPS1_PGR1_SNLL1_TT4_4_WG16_8_2_WGM64
    SolutionIndex: 234
    SolutionNameMin: Cijk_Ailk_Bljk_SB_MT64x64x32_SE_EPS1_PGR1_SNLL1_TT4_8_WG16_8_2_WGM32
    SolutionIndex: 235
    SolutionNameMin: Cijk_Ailk_Bljk_SB_MT128x64x8_SE_EPS1_PGR1_SNLL1_TT8_4_WG16_16_1_WGM8
    SolutionIndex: 236
    SolutionNameMin: Cijk_Ailk_Bljk_SB_MT64x64x16_SE_EPS1_PGR1_SNLL1_TT4_4_WG16_16_1_WGM1
    SolutionIndex: 237
    SolutionNameMin: Cijk_Ailk_Bljk_SB_MT128x64x16_SE_EPS1_PGR1_SNLL1_TT8_4_WG16_16_1_WGM1
    SolutionIndex: 238
    SolutionNameMin: Cijk_Ailk_Bljk_SB_MT128x128x16_SE_EPS1_PGR1_SNLL1_TT8_4_WG16_32_1_WGM1
    SolutionIndex: 239
    SolutionNameMin: Cijk_Ailk_Bljk_SB_MT64x64x16_SE_EPS1_PGR1_SNLL1_TT4_4_WG16_16_1_WGM8
- - - [704, 1024, 1, 128]
    - [102, 3019.46]
  - - [1024, 1024, 1, 3328]
    - [140, 8162.55]
  - - [4, 704, 1, 1280]
    - [43, 319.546]
  - - [4, 1856, 1, 3328]
    - [73, 550.514]
  - - [1856, 448, 1, 3328]
    - [125, 6813.05]
  - - [2944, 4288, 1, 1280]
    - [134, 8975.76]
  - - [2368, 64, 1, 3328]
    - [48, 5482.23]
  - - [1760, 32, 1, 1760]
    - [87, 3859.94]
  - - [2368, 5888, 1, 256]
    - [131, 8656.73]
  - - [5888, 1856, 1, 256]
    - [121, 7881.43]
  - - [64, 3584, 1, 1280]
    - [57, 4835.33]
  - - [512, 24000, 1, 1536]
    - [128, 8665.9]
  - - [128, 6784, 1, 3328]
    - [125, 7062.25]
  - - [5888, 1408, 1, 256]
    - [138, 8130.22]
  - - [5888, 1856, 1, 3328]
    - [128, 8840.75]
  - - [512, 4, 1, 512]
    - [13, 170.223]
  - - [35, 1500, 1, 2560]
    - [17, 2896.55]
  - - [1856, 4288, 1, 256]
    - [117, 8374.63]
  - - [1024, 5056, 1, 128]
    - [114, 3304.25]
  - - [5056, 5056, 1, 3328]
    - [128, 8905.43]
  - - [1408, 5888, 1, 1280]
    - [128, 9418.1]
  - - [2368, 448, 1, 128]
    - [102, 3074.97]
  - - [6144, 6000, 1, 2560]
    - [128, 9336.33]
  - - [2368, 6784, 1, 128]
    - [101, 4919.26]
  - - [1024, 3584, 1, 3328]
    - [119, 8071.07]
  - - [512, 48000, 1, 2048]
    - [128, 8763.06]
  - - [1408, 64, 1, 128]
    - [24, 805.47]
  - - [256, 4288, 1, 3328]
    - [150, 6331.86]
  - - [5888, 1408, 1, 1280]
    - [118, 9226.17]
  - - [704, 1856, 1, 3328]
    - [144, 6309.4]
  - - [1408, 4288, 1, 256]
    - [128, 8374.5]
  - - [1024, 2368, 1, 256]
    - [125, 7341.02]
  - - [64, 4, 1, 256]
    - [68, 13.0032]
  - - [1408, 1856, 1, 1280]
    - [135, 8772.95]
  - - [1408, 64, 1, 1280]
    - [81, 4049.98]
  - - [448, 1024, 1, 1280]
    - [144, 6071.16]
  - - [4096, 32, 1, 4096]
    - [78, 5491.72]
  - - [256, 1408, 1, 3328]
    - [130, 5351.39]
  - - [5056, 5056, 1, 1280]
    - [138, 9408.57]
  - - [448, 5056, 1, 256]
    - [143, 6680.44]
  - - [704, 1856, 1, 1280]
    - [120, 7503.93]
  - - [128, 5056, 1, 128]
    - [35, 2316.48]
  - - [2368, 128, 1, 256]
    - [120, 3660.12]
  - - [1856, 1408, 1, 128]
    - [107, 3885.87]
  - - [64, 5056, 1, 256]
    - [130, 3318.81]
  - - [6784, 256, 1, 3328]
    - [128, 7590.54]
  - - [1408, 3584, 1, 256]
    - [117, 8276.82]
  - - [4288, 448, 1, 256]
    - [130, 7139.69]
  - - [64, 704, 1, 128]
    - [31, 375.467]
  - - [1024, 1856, 1, 128]
    - [100, 2890.56]
  - - [4288, 2944, 1, 1280]
    - [134, 8981.35]
  - - [704, 5056, 1, 1280]
    - [120, 7684.62]
  - - [2368, 704, 1, 3328]
    - [135, 7070.04]
  - - [256, 5888, 1, 256]
    - [120, 7319.35]
  - - [1856, 4288, 1, 3328]
    - [118, 9238.59]
  - - [256, 2944, 1, 256]
    - [120, 6090.21]
  - - [5888, 1024, 1, 256]
    - [124, 8269.95]
  - - [448, 64, 1, 1280]
    - [77, 2493.22]
  - - [3072, 64, 1, 1024]
    - [60, 3149.67]
  - - [3584, 4, 1, 1280]
    - [162, 567.762]
  - - [2560, 16, 1, 2560]
    - [69, 2887.05]
  - - [2944, 64, 1, 256]
    - [60, 2565.66]
  - - [128, 4, 1, 1280]
    - [163, 78.7692]
  - - [1408, 2944, 1, 256]
    - [124, 8337.2]
  - - [256, 1856, 1, 1280]
    - [150, 6267.25]
  - - [6784, 5056, 1, 3328]
    - [134, 9423.9]
  - - [5056, 5056, 1, 256]
    - [121, 8758.23]
  - - [128, 256, 1, 256]
    - [76, 1205.26]
  - - [64, 1024, 1, 1280]
    - [87, 3566.58]
  - - [2944, 4, 1, 256]
    - [40, 319.349]
  - - [704, 5056, 1, 128]
    - [109, 4073.73]
  - - [4, 2368, 1, 1280]
    - [68, 496.892]
  - - [2368, 2944, 1, 1280]
    - [117, 9085.45]
  - - [448, 448, 1, 3328]
    - [95, 5428.66]
  - - [6784, 6784, 1, 1280]
    - [134, 8726.93]
  - - [1024, 256, 1, 3328]
    - [144, 5499.32]
  - - [1408, 4288, 1, 1280]
    - [118, 9094.32]
  - - [3584, 4288, 1, 1280]
    - [121, 8703.78]
  - - [512, 6000, 1, 2560]
    - [124, 8474.46]
  - - [2368, 704, 1, 1280]
    - [130, 7651.49]
  - - [5056, 4288, 1, 3328]
    - [138, 8545.25]
  - - [3584, 2368, 1, 3328]
    - [126, 8797.78]
  - - [5888, 6784, 1, 1280]
    - [124, 8785.08]
  - - [64, 704, 1, 1280]
    - [47, 2783.38]
  - - [4288, 256, 1, 256]
    - [120, 6162.68]
  - - [2944, 128, 1, 128]
    - [22, 1951.23]
  - - [6144, 32, 1, 2560]
    - [81, 4588.95]
  - - [6784, 448, 1, 1280]
    - [125, 8674.21]
  - - [2944, 5888, 1, 256]
    - [138, 8991.66]
  - - [64, 64, 1, 1280]
    - [98, 712.348]
  - - [4288, 2944, 1, 256]
    - [134, 8678.04]
  - - [5888, 704, 1, 1280]
    - [124, 8652.61]
  - - [5056, 4, 1, 3328]
    - [40, 650.672]
  - - [1856, 64, 1, 1280]
    - [57, 4471.87]
  - - [1760, 16, 1, 1760]
    - [97, 2592.13]
  - - [448, 5888, 1, 128]
    - [107, 3822.93]
  - - [5888, 64, 1, 3328]
    - [89, 6013.12]
  - - [2944, 256, 1, 3328]
    - [130, 7791.35]
  - - [1024, 64, 1, 128]
    - [31, 592.416]
  - - [5056, 2368, 1, 1280]
    - [117, 9260.43]
  - - [448, 3584, 1, 1280]
    - [138, 6771.24]
  - - [6784, 5888, 1, 256]
    - [132, 7933.29]
  - - [64, 1024, 1, 3328]
    - [81, 4782.98]
  - - [704, 128, 1, 1280]
    - [87, 3971.88]
  - - [4, 3584, 1, 128]
    - [156, 59.4238]
  - - [1408, 448, 1, 1280]
    - [130, 5902.07]
  - - [1024, 1408, 1, 256]
    - [125, 5272.84]
  - - [2368, 2368, 1, 3328]
    - [130, 8488.66]
  - - [1856, 6784, 1, 128]
    - [107, 4742.41]
  - - [5056, 704, 1, 3328]
    - [133, 7772.38]
  - - [1408, 1856, 1, 256]
    - [151, 5229.74]
  - - [1408, 704, 1, 3328]
    - [151, 6954.83]
  - - [2368, 5056, 1, 256]
    - [124, 8580.58]
  - - [1408, 256, 1, 1280]
    - [150, 4790.01]
  - - [3072, 128, 1, 1024]
    - [146, 4579.77]
  - - [3584, 2368, 1, 1280]
    - [117, 8675.03]
  - - [4288, 64, 1, 3328]
    - [96, 5550.01]
  - - [2368, 4, 1, 1280]
    - [162, 537.418]
  - - [704, 5888, 1, 256]
    - [118, 5305.78]
  - - [6784, 2944, 1, 128]
    - [114, 4344.11]
  - - [6784, 64, 1, 256]
    - [144, 4496.32]
  - - [2944, 256, 1, 256]
    - [130, 6553.6]
  - - [2944, 6784, 1, 3328]
    - [118, 8895.66]
  - - [128, 1, 1, 1408]
    - [98, 25.6]
  - - [704, 1408, 1, 3328]
    - [132, 7913.11]
  - - [3584, 704, 1, 3328]
    - [117, 7526.33]
  - - [2944, 256, 1, 128]
    - [101, 2830.66]
  - - [6784, 4, 1, 1280]
    - [158, 645.135]
  - - [1024, 64, 1, 1280]
    - [56, 3013.15]
  - - [8448, 4, 1, 2816]
    - [8, 984.668]
  - - [448, 4288, 1, 256]
    - [130, 7139.69]
  - - [64, 3584, 1, 3328]
    - [54, 5683.17]
  - - [704, 2368, 1, 1280]
    - [138, 7045.2]
  - - [1856, 2368, 1, 1280]
    - [135, 8327.8]
  - - [2368, 128, 1, 3328]
    - [71, 6082.55]
  - - [64, 193600, 1, 64]
    - [120, 6747.67]
  - - [1760, 128, 1, 1760]
    - [48, 5512.97]
  - - [448, 1408, 1, 256]
    - [130, 5591.44]
  - - [1856, 4288, 1, 1280]
    - [128, 8647.62]
  - - [64, 5056, 1, 3328]
    - [88, 6096.49]
  - - [512, 1500, 1, 2816]
    - [130, 7879.2]
  - - [1024, 448, 1, 128]
    - [102, 1844.23]
  - - [704, 4, 1, 1280]
    - [68, 341.333]
  - - [704, 256, 1, 128]
    - [102, 1001.24]
  - - [256, 193600, 1, 64]
    - [138, 8113.2]
  - - [704, 2944, 1, 128]
    - [109, 3747.03]
  - - [1408, 1024, 1, 1280]
    - [135, 7080.61]
  - - [704, 6784, 1, 256]
    - [153, 6630.37]
  - - [6784, 704, 1, 256]
    - [120, 8005.76]
  - - [5056, 1408, 1, 128]
    - [111, 4303.03]
  - - [2048, 7000, 1, 2048]
    - [128, 9269.1]
  - - [256, 3584, 1, 3328]
    - [122, 7334.38]
  - - [5056, 704, 1, 256]
    - [130, 7954.02]
  - - [128, 1408, 1, 128]
    - [25, 1242.92]
  - - [3584, 4288, 1, 3328]
    - [154, 7683.71]
  - - [5888, 1856, 1, 1280]
    - [118, 8831.24]
  - - [256, 1408, 1, 256]
    - [120, 4352.58]
  - - [5056, 64, 1, 1280]
    - [87, 5011.95]
  - - [1024, 704, 1, 256]
    - [120, 5710.07]
  - - [64, 256, 1, 128]
    - [26, 149.797]
  - - [2368, 3584, 1, 1280]
    - [128, 8609.58]
  - - [1024, 256, 1, 256]
    - [144, 3276.8]
  - - [1856, 4, 1, 1280]
    - [42, 497.004]
  - - [448, 448, 1, 256]
    - [130, 3117.73]
  - - [2944, 3584, 1, 3328]
    - [118, 8879.35]
  - - [7680, 32, 1, 2560]
    - [88, 5310.14]
  - - [128, 4288, 1, 128]
    - [28, 2116.1]
  - - [256, 256, 1, 3328]
    - [81, 4774.6]
  - - [128, 1024, 1, 3328]
    - [82, 5894.7]
  - - [4, 1408, 1, 3328]
    - [73, 552.574]
  - - [196, 256, 64, 1024]
    - [171, 5218.24]
  - - [6784, 2944, 1, 256]
    - [136, 8271.08]
  - - [64, 1856, 1, 1280]
    - [87, 4167.86]
  - - [64, 1024, 1, 128]
    - [21, 589.088]
  - - [1024, 1500, 1, 2560]
    - [125, 8407.78]
  - - [1856, 2368, 1, 256]
    - [120, 8092.05]
  - - [3584, 256, 1, 128]
    - [103, 2607.47]
  - - [3584, 6784, 1, 3328]
    - [137, 8558.73]
  - - [256, 1024, 1, 256]
    - [130, 3901.68]
  - - [4, 6784, 1, 3328]
    - [68, 662.475]
  - - [1024, 5888, 1, 3328]
    - [128, 9161.66]
  - - [1024, 128, 1, 1280]
    - [85, 3942.02]
  - - [3072, 32, 1, 1024]
    - [62, 2840.39]
  - - [6144, 24000, 1, 2560]
    - [118, 7605.77]
  - - [448, 1024, 1, 256]
    - [120, 5062.09]
  - - [5056, 4288, 1, 1280]
    - [128, 9090.89]
  - - [5888, 64, 1, 256]
    - [130, 4449.68]
  - - [1856, 256, 1, 1280]
    - [144, 5834.36]
  - - [64, 5888, 1, 3328]
    - [82, 6152.34]
  - - [2368, 2368, 1, 1280]
    - [122, 8594.56]
  - - [2944, 5888, 1, 128]
    - [107, 4776.09]
  - - [704, 5888, 1, 1280]
    - [122, 8435.81]
  - - [2368, 3584, 1, 128]
    - [104, 4590.61]
  - - [1856, 5056, 1, 128]
    - [115, 4503.38]
  - - [4608, 1, 1, 1536]
    - [13, 226.855]
  - - [448, 256, 1, 3328]
    - [57, 5415.46]
  - - [2944, 6784, 1, 1280]
    - [141, 8385.01]
  - - [448, 1856, 1, 128]
    - [111, 2618.86]
  - - [128, 1024, 1, 128]
    - [20, 940.427]
  - - [7680, 4, 1, 2560]
    - [44, 985.004]
  - - [1024, 704, 1, 1280]
    - [130, 7204.46]
  - - [128, 5888, 1, 256]
    - [120, 6313.42]
  - - [1024, 5056, 1, 1280]
    - [125, 8979.66]
  - - [4288, 1024, 1, 256]
    - [117, 7198.19]
  - - [2944, 2368, 1, 128]
    - [102, 4624.47]
  - - [704, 704, 1, 3328]
    - [143, 5870.61]
  - - [704, 1408, 1, 1280]
    - [132, 7680.22]
  - - [5888, 448, 1, 1280]
    - [120, 7718.56]
  - - [3584, 256, 1, 3328]
    - [125, 7523.78]
  - - [704, 5888, 1, 3328]
    - [130, 8196.89]
  - - [704, 1856, 1, 128]
    - [108, 3388.33]
  - - [128, 3584, 1, 3328]
    - [82, 6626.4]
  - - [4, 4288, 1, 128]
    - [155, 159.548]
  - - [128, 704, 1, 1280]
    - [45, 4038.63]
  - - [3584, 2944, 1, 256]
    - [118, 7685.89]
  - - [1856, 128, 1, 3328]
    - [74, 6070.53]
  - - [1856, 2368, 1, 3328]
    - [135, 8460.52]
  - - [512, 6000, 1, 2816]
    - [138, 9019.45]
  - - [2944, 448, 1, 128]
    - [101, 3027.63]
  - - [64, 193600, 1, 256]
    - [144, 7080.22]
  - - [128, 2944, 1, 1280]
    - [120, 5397.77]
  - - [448, 2944, 1, 1280]
    - [130, 6996.87]
  - - [512, 24000, 1, 2048]
    - [138, 8832.57]
  - - [128, 256, 1, 3328]
    - [77, 3531.47]
  - - [1408, 5056, 1, 3328]
    - [133, 7969.84]
  - - [1856, 1856, 1, 3328]
    - [120, 8140.24]
  - - [3584, 128, 1, 256]
    - [130, 4860.95]
  - - [448, 1408, 1, 3328]
    - [120, 6353.65]
  - - [2368, 2368, 1, 256]
    - [134, 8369.27]
  - - [4288, 4288, 1, 1280]
    - [124, 8666.42]
  - - [64, 448, 1, 1280]
    - [77, 2591.82]
  - - [5888, 1024, 1, 1280]
    - [117, 8526.5]
  - - [704, 1024, 1, 256]
    - [130, 4971.7]
  - - [1024, 12544, 1, 256]
    - [168, 8611.8]
  - - [448, 4, 1, 256]
    - [73, 78.5534]
  - - [5888, 448, 1, 128]
    - [104, 3591.93]
  - - [512, 48000, 1, 2560]
    - [138, 9237.34]
  - - [8448, 16, 1, 2816]
    - [3, 3360.11]
  - - [704, 6784, 1, 3328]
    - [139, 7774.85]
  - - [5888, 5888, 1, 1280]
    - [125, 9238.15]
  - - [5056, 1024, 1, 1280]
    - [153, 8227.78]
  - - [448, 5888, 1, 3328]
    - [128, 7777.53]
  - - [3072, 2, 1, 1024]
    - [65, 376.283]
  - - [1024, 2944, 1, 1280]
    - [118, 8650.35]
  - - [5056, 5888, 1, 1280]
    - [128, 8861.5]
  - - [4288, 5888, 1, 128]
    - [108, 5048.91]
  - - [256, 3584, 1, 256]
    - [120, 6314.01]
  - - [256, 4, 1, 1280]
    - [164, 163.84]
  - - [1408, 3584, 1, 128]
    - [108, 4290.12]
  - - [256, 2944, 1, 3328]
    - [130, 7620.89]
  - - [448, 3584, 1, 128]
    - [108, 3353.8]
  - - [5888, 2944, 1, 1280]
    - [118, 9498.21]
  - - [4, 6784, 1, 1280]
    - [68, 623.816]
  - - [2368, 5888, 1, 128]
    - [107, 4840.19]
  - - [35, 8457, 1, 1760]
    - [14, 4059.78]
  - - [64, 2944, 1, 128]
    - [25, 1310.72]
  - - [2368, 4, 1, 256]
    - [159, 369.639]
  - - [3584, 5888, 1, 256]
    - [136, 7996.23]
  - - [2368, 1024, 1, 128]
    - [102, 3914.97]
  - - [2368, 704, 1, 128]
    - [102, 3658.87]
  - - [512, 32, 1, 512]
    - [91, 1127.5]
  - - [3584, 2368, 1, 128]
    - [102, 4462.38]
  - - [5056, 704, 1, 128]
    - [101, 4062.11]
  - - [448, 2368, 1, 128]
    - [102, 2828.97]
  - - [4, 5056, 1, 256]
    - [50, 425.768]
  - - [5056, 1408, 1, 3328]
    - [135, 8848.82]
  - - [1408, 704, 1, 256]
    - [130, 5394.46]
  - - [6784, 1024, 1, 3328]
    - [117, 9231.92]
  - - [6784, 2944, 1, 3328]
    - [128, 8714.74]
  - - [7680, 1, 1, 2560]
    - [64, 248.745]
  - - [1856, 1856, 1, 256]
    - [129, 7586.48]
  - - [64, 64, 1, 3328]
    - [99, 1363.15]
  - - [512, 1, 1, 512]
    - [13, 43.1158]
  - - [6784, 2368, 1, 1280]
    - [130, 8665.64]
  - - [4608, 2, 1, 1536]
    - [13, 452.55]
  - - [4288, 3584, 1, 256]
    - [138, 8936.6]
  - - [4288, 5888, 1, 1280]
    - [135, 8957.05]
  - - [4608, 4, 1, 1536]
    - [6, 846.637]
  - - [1024, 6000, 1, 1536]
    - [128, 8398.44]
  - - [8448, 32, 1, 2816]
    - [88, 5342.97]
  - - [448, 2944, 1, 3328]
    - [135, 7246.94]
  - - [4288, 1856, 1, 1280]
    - [118, 8902.76]
  - - [1856, 2944, 1, 3328]
    - [130, 8622.76]
  - - [256, 6784, 1, 3328]
    - [130, 8050.67]
  - - [512, 3000, 1, 1536]
    - [151, 7108.02]
  - - [64, 5888, 1, 256]
    - [143, 3567.64]
  - - [256, 5056, 1, 128]
    - [110, 3041.02]
  - - [5056, 1024, 1, 256]
    - [134, 8401.37]
  - - [704, 64, 1, 3328]
    - [93, 4298.92]
  - - [5056, 1856, 1, 3328]
    - [138, 8660.67]
  - - [4, 2944, 1, 3328]
    - [68, 618.537]
  - - [512, 1500, 1, 2048]
    - [150, 5481.12]
  - - [1024, 1, 1, 500000]
    - [4, 259.961]
  - - [256, 4, 1, 256]
    - [68, 50.4123]
  - - [6784, 128, 1, 3328]
    - [122, 6950.81]
  - - [4288, 1408, 1, 128]
    - [102, 4539.48]
  - - [1856, 5888, 1, 3328]
    - [128, 8712.83]
  - - [4288, 5056, 1, 256]
    - [134, 8997.05]
  - - [1408, 128, 1, 1280]
    - [57, 4599.02]
  - - [4096, 7000, 1, 4096]
    - [124, 8555.79]
  - - [5056, 256, 1, 3328]
    - [130, 8257.06]
  - - [704, 704, 1, 256]
    - [120, 5852.29]
  - - [1024, 3000, 1, 2560]
    - [117, 8258.74]
  - - [1024, 5888, 1, 1280]
    - [117, 8988.89]
  - - [6784, 2368, 1, 128]
    - [103, 4562.15]
  - - [4, 5056, 1, 1280]
    - [68, 600.341]
  - - [256, 64, 1, 1280]
    - [91, 1899.59]
  - - [128, 1856, 1, 1280]
    - [130, 5185.66]
  - - [1856, 1024, 1, 1280]
    - [135, 7875.85]
  - - [6784, 4288, 1, 1280]
    - [138, 8981.08]
  - - [1856, 1856, 1, 1280]
    - [119, 7794.61]
  - - [35, 1500, 1, 2048]
    - [19, 2192.5]
  - - [3072, 24000, 1, 1024]
    - [131, 8690.48]
  - - [1408, 5056, 1, 1280]
    - [130, 8427.77]
  - - [4, 2368, 1, 3328]
    - [73, 594.322]
  - - [5888, 1856, 1, 128]
    - [102, 4293.95]
  - - [448, 704, 1, 1280]
    - [125, 4136.29]
  - - [448, 6784, 1, 128]
    - [103, 3976.1]
  - - [1024, 448, 1, 3328]
    - [135, 6376.23]
  - - [2944, 128, 1, 256]
    - [120, 4466.16]
  - - [5056, 3584, 1, 128]
    - [108, 4997.08]
  - - [5888, 5888, 1, 3328]
    - [138, 8870.27]
  - - [6784, 1024, 1, 256]
    - [117, 8520.43]
  - - [2944, 2368, 1, 256]
    - [154, 6174.49]
  - - [256, 448, 1, 256]
    - [130, 1844.23]
  - - [5056, 5888, 1, 3328]
    - [119, 8076.55]
  - - [1856, 1024, 1, 256]
    - [130, 7188.82]
  - - [512, 48000, 1, 1536]
    - [141, 7282.1]
  - - [3584, 448, 1, 1280]
    - [120, 6869.0]
  - - [1024, 1024, 1, 1280]
    - [130, 8027.35]
  - - [448, 5888, 1, 256]
    - [120, 5765.74]
  - - [2048, 128, 1, 2048]
    - [78, 4834.91]
  - - [1408, 6784, 1, 3328]
    - [130, 8613.66]
  - - [448, 1024, 1, 128]
    - [101, 2315.47]
  - - [4288, 704, 1, 128]
    - [102, 4138.82]
  - - [128, 1856, 1, 128]
    - [37, 1397.46]
  - - [448, 2368, 1, 3328]
    - [120, 6786.38]
  - - [5056, 64, 1, 128]
    - [102, 1664.74]
  - - [5056, 2944, 1, 256]
    - [153, 7697.39]
  - - [6784, 5888, 1, 128]
    - [102, 5003.57]
  - - [1024, 700, 1, 512]
    - [130, 6036.21]
  - - [3072, 1, 1, 128]
    - [84, 70.2171]
  - - [1024, 4, 1, 256]
    - [42, 154.202]
  - - [2944, 704, 1, 128]
    - [108, 3696.9]
  - - [128, 6784, 1, 1280]
    - [120, 6731.41]
  - - [1408, 3584, 1, 3328]
    - [118, 9257.97]
  - - [2368, 6784, 1, 256]
    - [117, 8840.3]
  - - [5056, 1408, 1, 1280]
    - [118, 9240.74]
  - - [5056, 4288, 1, 128]
    - [113, 4309.08]
  - - [4, 704, 1, 256]
    - [68, 130.597]
  - - [4288, 2368, 1, 3328]
    - [131, 8755.23]
  - - [1408, 1856, 1, 128]
    - [101, 3918.65]
  - - [1408, 5888, 1, 3328]
    - [138, 8910.37]
  - - [1856, 256, 1, 256]
    - [120, 5631.24]
  - - [6784, 6784, 1, 256]
    - [128, 9298.66]
  - - [5888, 5056, 1, 128]
    - [103, 4811.26]
  - - [4288, 2368, 1, 128]
    - [102, 4749.0]
  - - [128, 5888, 1, 1280]
    - [129, 6393.76]
  - - [256, 4288, 1, 1280]
    - [120, 6887.69]
  - - [2368, 2944, 1, 256]
    - [134, 8314.72]
  - - [4, 1856, 1, 256]
    - [157, 266.93]
  - - [3584, 1856, 1, 1280]
    - [118, 8631.81]
  - - [6784, 6784, 1, 128]
    - [108, 5059.86]
  - - [256, 1856, 1, 128]
    - [101, 1858.72]
  - - [49, 512, 64, 2048]
    - [172, 3053.57]
  - - [704, 64, 1, 1280]
    - [51, 2849.39]
  - - [5888, 5056, 1, 256]
    - [137, 8202.42]
  - - [8448, 48000, 1, 2816]
    - [128, 4281.84]
  - - [512, 6000, 1, 2048]
    - [120, 8047.79]
  - - [3584, 448, 1, 256]
    - [130, 6805.33]
  - - [448, 4288, 1, 128]
    - [108, 3500.73]
  - - [7680, 64, 1, 2560]
    - [63, 5957.8]
  - - [256, 6784, 1, 256]
    - [130, 7331.73]
  - - [1408, 4288, 1, 128]
    - [102, 4501.39]
  - - [2944, 704, 1, 3328]
    - [130, 8439.6]
  - - [128, 448, 1, 256]
    - [51, 1555.09]
  - - [2048, 32, 1, 2048]
    - [62, 3226.39]
  - - [3584, 3584, 1, 256]
    - [134, 8784.8]
  - - [448, 1408, 1, 128]
    - [101, 2535.82]
  - - [128, 256, 1, 1280]
    - [77, 2896.62]
  - - [3584, 5056, 1, 256]
    - [121, 8566.42]
  - - [6784, 128, 1, 256]
    - [120, 6053.87]
  - - [4288, 4, 1, 256]
    - [40, 428.8]
  - - [64, 1408, 1, 3328]
    - [45, 5025.01]
  - - [704, 448, 1, 256]
    - [144, 3409.64]
  - - [2944, 2368, 1, 1280]
    - [118, 9066.25]
  - - [448, 64, 1, 3328]
    - [93, 3528.86]
  - - [704, 6784, 1, 128]
    - [107, 4212.51]
  - - [3584, 4, 1, 3328]
    - [160, 658.253]
  - - [6784, 3584, 1, 256]
    - [128, 9061.74]
  - - [704, 448, 1, 128]
    - [107, 1552.7]
  - - [256, 128, 1, 128]
    - [32, 281.875]
  - - [704, 1408, 1, 128]
    - [107, 3026.66]
  - - [4, 448, 1, 128]
    - [156, 5.46127]
  - - [4288, 128, 1, 1280]
    - [87, 5471.54]
  - - [128, 1408, 1, 256]
    - [130, 2813.25]
  - - [4, 2944, 1, 256]
    - [50, 316.666]
  - - [64, 128, 1, 3328]
    - [98, 1872.46]
  - - [1856, 1408, 1, 256]
    - [120, 7735.79]
  - - [5056, 2368, 1, 128]
    - [102, 4830.09]
  - - [2944, 2944, 1, 3328]
    - [138, 8890.01]
  - - [5056, 6784, 1, 256]
    - [128, 9015.15]
  - - [1856, 3584, 1, 128]
    - [109, 4455.02]
  - - [5888, 4, 1, 1280]
    - [158, 641.963]
  - - [128, 2944, 1, 128]
    - [27, 2036.93]
  - - [35, 8457, 1, 2560]
    - [15, 3988.13]
  - - [3584, 6784, 1, 128]
    - [102, 4774.44]
  - - [128, 4288, 1, 256]
    - [120, 4851.75]
  - - [704, 448, 1, 3328]
    - [135, 4432.53]
  - - [2368, 6784, 1, 1280]
    - [118, 9161.38]
  - - [128, 128, 1, 3328]
    - [92, 2839.89]
  - - [5056, 1856, 1, 256]
    - [134, 8380.84]
  - - [256, 128, 1, 256]
    - [76, 1165.08]
  - - [1024, 3000, 1, 2816]
    - [135, 8714.17]
  - - [1024, 1856, 1, 256]
    - [125, 7014.69]
  - - [64, 1, 1, 1216]
    - [98, 11.7205]
  - - [4288, 64, 1, 128]
    - [29, 1669.55]
  - - [256, 448, 1, 3328]
    - [53, 5152.29]
  - - [1408, 6784, 1, 1280]
    - [138, 8735.12]
  - - [3584, 3584, 1, 1280]
    - [135, 9019.99]
  - - [7680, 24000, 1, 2560]
    - [138, 6940.14]
  - - [64, 2368, 1, 1280]
    - [48, 4432.97]
  - - [448, 2368, 1, 1280]
    - [123, 5352.82]
  - - [4608, 48000, 1, 1536]
    - [117, 8129.01]
  - - [5888, 5888, 1, 128]
    - [110, 4700.81]
  - - [64, 6784, 1, 3328]
    - [120, 6170.72]
  - - [2944, 256, 1, 1280]
    - [150, 6177.55]
  - - [2048, 16, 1, 2048]
    - [72, 2167.6]
  - - [256, 2368, 1, 128]
    - [101, 2037.67]
  - - [5056, 2368, 1, 3328]
    - [118, 9040.5]
  - - [2944, 4288, 1, 256]
    - [149, 7552.12]
  - - [1408, 3584, 1, 1280]
    - [125, 8808.66]
  - - [2368, 64, 1, 256]
    - [61, 2320.41]
  - - [1024, 128, 1, 128]
    - [21, 1075.46]
  - - [704, 128, 1, 3328]
    - [54, 4984.92]
  - - [5888, 4, 1, 128]
    - [155, 33.5558]
  - - [1856, 704, 1, 256]
    - [130, 7110.88]
  - - [1024, 1500, 1, 2816]
    - [125, 8499.78]
  - - [8448, 1, 1, 2816]
    - [8, 251.369]
  - - [1024, 4, 1, 3328]
    - [164, 540.932]
  - - [1024, 6000, 1, 2048]
    - [125, 8698.49]
  - - [512, 24000, 1, 2560]
    - [118, 8963.6]
  - - [6144, 3000, 1, 2560]
    - [141, 8761.87]
  - - [2368, 6784, 1, 3328]
    - [135, 8867.39]
  - - [1856, 1408, 1, 1280]
    - [122, 7908.43]
  - - [1856, 448, 1, 1280]
    - [135, 6543.91]
  - - [6784, 704, 1, 128]
    - [101, 4086.35]
  - - [4, 4, 1, 256]
    - [68, 0.752941]
  - - [128, 5888, 1, 128]
    - [25, 2582.15]
  - - [5056, 2944, 1, 128]
    - [105, 4579.07]
  - - [1408, 5888, 1, 256]
    - [117, 8810.67]
  - - [704, 2944, 1, 1280]
    - [132, 8420.8]
  - - [4288, 64, 1, 1280]
    - [57, 4906.05]
  - - [256, 64, 1, 256]
    - [59, 689.853]
  - - [1024, 1024, 1, 256]
    - [135, 5527.91]
  - - [704, 1856, 1, 256]
    - [119, 4452.82]
  - - [2560, 64, 1, 2560]
    - [48, 4562.99]
  - - [3584, 704, 1, 1280]
    - [125, 7898.67]
  - - [256, 128, 1, 1280]
    - [77, 2864.96]
  - - [5888, 2368, 1, 256]
    - [124, 8628.27]
  - - [256, 2368, 1, 1280]
    - [120, 6073.47]
  - - [2944, 6784, 1, 128]
    - [101, 4756.67]
  - - [3584, 448, 1, 3328]
    - [120, 7264.97]
  - - [1408, 4, 1, 256]
    - [161, 234.057]
  - - [704, 2368, 1, 3328]
    - [118, 7248.88]
  - - [2944, 448, 1, 256]
    - [125, 6365.79]
  - - [1856, 448, 1, 128]
    - [103, 2976.24]
  - - [4608, 6000, 1, 1536]
    - [138, 9469.32]
  - - [2368, 128, 1, 1280]
    - [87, 4773.29]
  - - [256, 5888, 1, 128]
    - [102, 3111.9]
  - - [64, 6784, 1, 256]
    - [120, 3755.04]
  - - [64, 5056, 1, 1280]
    - [81, 4935.5]
  - - [4, 6784, 1, 128]
    - [156, 111.042]
  - - [3025, 64, 64, 64]
    - [170, 6643.65]
  - - [2944, 2944, 1, 1280]
    - [118, 8869.45]
  - - [5056, 448, 1, 3328]
    - [151, 6706.1]
  - - [4, 3584, 1, 1280]
    - [68, 573.44]
  - - [1408, 128, 1, 128]
    - [20, 1293.09]
  - - [6784, 704, 1, 3328]
    - [135, 8368.23]
  - - [128, 64, 1, 1280]
    - [94, 1260.31]
  - - [2368, 256, 1, 1280]
    - [120, 6154.37]
  - - [4, 448, 1, 3328]
    - [73, 351.638]
  - - [5888, 4288, 1, 128]
    - [102, 4340.89]
  - - [4, 5888, 1, 256]
    - [50, 428.218]
  - - [1408, 2944, 1, 3328]
    - [117, 9400.75]
  - - [3584, 704, 1, 128]
    - [104, 3392.45]
  - - [64, 1024, 1, 256]
    - [51, 1762.31]
  - - [2368, 448, 1, 1280]
    - [144, 5972.48]
  - - [128, 3584, 1, 256]
    - [120, 5224.22]
  - - [704, 448, 1, 1280]
    - [120, 4566.76]
  - - [448, 5056, 1, 128]
    - [102, 3876.09]
  - - [6144, 4, 1, 2560]
    - [44, 948.651]
  - - [5056, 3584, 1, 256]
    - [134, 8162.46]
  - - [4288, 4288, 1, 256]
    - [141, 7653.24]
  - - [1408, 5056, 1, 128]
    - [108, 4554.24]
  - - [2944, 3584, 1, 128]
    - [114, 4146.9]
  - - [3584, 2368, 1, 256]
    - [135, 8194.95]
  - - [5888, 5056, 1, 1280]
    - [134, 9413.33]
  - - [128, 1024, 1, 1280]
    - [87, 4433.73]
  - - [8448, 24000, 1, 2816]
    - [128, 5227.02]
  - - [64, 704, 1, 256]
    - [51, 1441.79]
  - - [4288, 256, 1, 1280]
    - [150, 5687.7]
  - - [3584, 3584, 1, 3328]
    - [125, 9183.53]
  - - [704, 64, 1, 128]
    - [29, 402.735]
  - - [3072, 1500, 1, 128]
    - [124, 7394.98]
  - - [2048, 3136, 1, 512]
    - [166, 8447.2]
  - - [3025, 256, 64, 64]
    - [174, 8063.69]
  - - [5888, 6784, 1, 256]
    - [118, 9281.91]
  - - [4288, 2944, 1, 3328]
    - [118, 9153.77]
  - - [2944, 64, 1, 128]
    - [35, 1463.43]
  - - [1024, 128, 1, 3328]
    - [85, 5377.31]
  - - [1024, 16, 1, 500000]
    - [1, 3997.03]
  - - [4288, 128, 1, 3328]
    - [89, 6053.21]
  - - [7680, 128, 1, 2560]
    - [135, 7769.14]
  - - [256, 5056, 1, 1280]
    - [144, 7200.74]
  - - [1408, 256, 1, 128]
    - [112, 1671.64]
  - - [2944, 5888, 1, 3328]
    - [124, 8642.08]
  - - [6784, 5888, 1, 1280]
    - [138, 8871.05]
  - - [3072, 1, 1, 1024]
    - [84, 205.872]
  - - [704, 128, 1, 256]
    - [47, 1935.29]
  - - [5888, 4288, 1, 1280]
    - [125, 9176.6]
  - - [1024, 24000, 1, 2048]
    - [124, 8667.69]
  - - [448, 256, 1, 1280]
    - [57, 4327.85]
  - - [5888, 3584, 1, 128]
    - [102, 4669.35]
  - - [64, 4288, 1, 3328]
    - [82, 5374.94]
  - - [448, 4, 1, 1280]
    - [73, 289.616]
  - - [6784, 6784, 1, 3328]
    - [131, 8306.63]
  - - [5056, 4, 1, 1280]
    - [43, 607.099]
  - - [4, 5888, 1, 3328]
    - [68, 651.438]
  - - [256, 1408, 1, 1280]
    - [120, 5176.99]
  - - [3072, 16, 1, 1024]
    - [79, 2207.53]
  - - [704, 3584, 1, 128]
    - [112, 3653.41]
  - - [1024, 2, 1, 512]
    - [99, 156.038]
  - - [5888, 448, 1, 3328]
    - [120, 7896.75]
  - - [2368, 4288, 1, 1280]
    - [117, 8517.53]
  - - [4288, 2944, 1, 128]
    - [106, 4439.16]
  - - [256, 64, 1, 3328]
    - [92, 2704.66]
  - - [2944, 64, 1, 3328]
    - [57, 5647.05]
  - - [6784, 64, 1, 3328]
    - [130, 6434.51]
  - - [5056, 2944, 1, 3328]
    - [141, 8497.1]
  - - [448, 128, 1, 256]
    - [59, 1516.54]
  - - [2944, 3584, 1, 256]
    - [135, 8365.73]
  - - [1408, 1408, 1, 3328]
    - [118, 8440.32]
  - - [1856, 128, 1, 1280]
    - [120, 5242.83]
  - - [3584, 3584, 1, 128]
    - [102, 4385.84]
  - - [64, 3584, 1, 256]
    - [120, 3276.8]
  - - [1408, 4, 1, 3328]
    - [43, 605.404]
  - - [128, 2944, 1, 3328]
    - [88, 6295.65]
  - - [3584, 704, 1, 256]
    - [125, 7711.54]
  - - [2944, 448, 1, 3328]
    - [136, 6503.87]
  - - [1024, 2, 1, 500000]
    - [5, 521.703]
  - - [3584, 1408, 1, 3328]
    - [127, 8296.1]
  - - [704, 3584, 1, 1280]
    - [132, 7670.55]
  - - [1024, 1408, 1, 128]
    - [107, 2830.51]
  - - [1856, 6784, 1, 256]
    - [138, 8149.57]
  - - [4288, 448, 1, 3328]
    - [119, 7406.34]
  - - [6784, 4288, 1, 128]
    - [114, 4417.99]
  - - [6784, 704, 1, 1280]
    - [135, 8302.35]
  - - [6144, 1, 1, 2560]
    - [44, 243.327]
  - - [3584, 6784, 1, 256]
    - [117, 9036.49]
  - - [6144, 16, 1, 2560]
    - [51, 3266.59]
  - - [3584, 64, 1, 128]
    - [35, 1555.09]
  - - [5888, 1024, 1, 3328]
    - [125, 8887.98]
  - - [448, 64, 1, 128]
    - [21, 247.974]
  - - [704, 6784, 1, 1280]
    - [121, 7892.46]
  - - [4, 448, 1, 256]
    - [43, 70.7951]
  - - [196, 1024, 64, 256]
    - [169, 6630.76]
  - - [5888, 128, 1, 256]
    - [119, 5714.99]
  - - [4096, 16, 1, 4096]
    - [65, 3251.4]
  - - [1856, 5056, 1, 3328]
    - [134, 8740.17]
  - - [4, 6784, 1, 256]
    - [157, 360.312]
  - - [1024, 3584, 1, 128]
    - [102, 3456.17]
  - - [64, 704, 1, 3328]
    - [70, 3817.37]
  - - [2368, 2944, 1, 128]
    - [108, 4605.37]
  - - [5056, 64, 1, 256]
    - [120, 3863.69]
  - - [512, 1500, 1, 1536]
    - [120, 6801.46]
  - - [512, 1, 1, 500000]
    - [9, 260.968]
  - - [5888, 2944, 1, 3328]
    - [124, 8501.78]
  - - [128, 3584, 1, 1280]
    - [125, 5938.54]
  - - [1024, 704, 1, 128]
    - [111, 2172.19]
  - - [1408, 2368, 1, 128]
    - [107, 4023.1]
  - - [5888, 2368, 1, 128]
    - [108, 4424.52]
  - - [128, 5056, 1, 3328]
    - [120, 6692.06]
  - - [3584, 6784, 1, 1280]
    - [118, 9488.54]
  - - [4288, 1856, 1, 256]
    - [128, 8287.42]
  - - [1856, 5888, 1, 256]
    - [139, 7707.73]
  - - [256, 256, 1, 256]
    - [86, 1613.19]
  - - [4288, 4288, 1, 3328]
    - [128, 8923.49]
  - - [1024, 1024, 1, 128]
    - [108, 2553.61]
  - - [4288, 1408, 1, 1280]
    - [128, 8930.37]
  - - [3584, 5056, 1, 128]
    - [112, 4495.05]
  - - [4, 1024, 1, 3328]
    - [68, 415.594]
  - - [4, 704, 1, 128]
    - [156, 13.8634]
  - - [4288, 2368, 1, 256]
    - [153, 7134.98]
  - - [2944, 5056, 1, 1280]
    - [125, 9118.51]
  - - [448, 6784, 1, 256]
    - [149, 5430.21]
  - - [64, 128, 1, 128]
    - [32, 82.957]
  - - [1856, 2368, 1, 128]
    - [108, 4422.65]
  - - [6784, 2368, 1, 3328]
    - [121, 8769.3]
  - - [1408, 6784, 1, 128]
    - [108, 4738.9]
  - - [256, 1024, 1, 1280]
    - [130, 5722.11]
  - - [704, 4, 1, 128]
    - [156, 8.56578]
  - - [1408, 4, 1, 128]
    - [156, 26.0439]
  - - [4288, 128, 1, 256]
    - [130, 4865.28]
  - - [4288, 1856, 1, 3328]
    - [117, 9249.94]
  - - [3584, 448, 1, 128]
    - [108, 3029.49]
  - - [64, 4288, 1, 128]
    - [25, 1535.28]
  - - [64, 448, 1, 3328]
    - [95, 3457.26]
  - - [448, 4, 1, 3328]
    - [73, 367.228]
  - - [256, 4, 1, 3328]
    - [164, 320.289]
  - - [4, 1408, 1, 1280]
    - [161, 343.939]
  - - [3584, 64, 1, 1280]
    - [49, 5190.97]
  - - [1408, 448, 1, 128]
    - [109, 2218.14]
  - - [3584, 1024, 1, 1280]
    - [131, 8253.01]
  - - [1856, 5056, 1, 256]
    - [149, 7552.45]
  - - [4, 3584, 1, 256]
    - [68, 325.356]
  - - [6784, 4288, 1, 3328]
    - [124, 8655.24]
  - - [4, 2944, 1, 1280]
    - [68, 547.721]
  - - [1024, 4288, 1, 256]
    - [125, 7788.73]
  - - [5888, 3584, 1, 3328]
    - [128, 9173.29]
  - - [1856, 4, 1, 256]
    - [159, 282.819]
  - - [4, 256, 1, 256]
    - [68, 49.6485]
  - - [5056, 3584, 1, 3328]
    - [134, 8457.43]
  - - [1408, 128, 1, 3328]
    - [88, 5714.42]
  - - [4, 64, 1, 1280]
    - [164, 42.6667]
  - - [2368, 1408, 1, 1280]
    - [125, 8224.82]
  - - [5056, 2944, 1, 1280]
    - [117, 9295.03]
  - - [8448, 6000, 1, 2816]
    - [121, 8037.87]
  - - [4, 4, 1, 128]
    - [156, 0.0433898]
  - - [3584, 256, 1, 256]
    - [120, 6116.69]
  - - [3584, 2944, 1, 1280]
    - [117, 8796.39]
  - - [1024, 6784, 1, 256]
    - [124, 8187.76]
  - - [4, 128, 1, 256]
    - [68, 30.3407]
  - - [6784, 448, 1, 256]
    - [120, 7862.2]
  - - [5124, 9124, 1, 2048]
    - [122, 8176.31]
  - - [2944, 5056, 1, 3328]
    - [117, 9328.24]
  - - [6784, 4, 1, 128]
    - [155, 204.8]
  - - [2944, 1408, 1, 128]
    - [106, 3838.1]
  - - [448, 128, 1, 3328]
    - [71, 4632.06]
  - - [64, 2944, 1, 3328]
    - [88, 5663.37]
  - - [5056, 6784, 1, 3328]
    - [124, 8420.07]
  - - [704, 2368, 1, 128]
    - [108, 3321.69]
  - - [3072, 1500, 1, 1024]
    - [125, 8221.67]
  - - [128, 2944, 1, 256]
    - [120, 4550.42]
  - - [128, 6784, 1, 128]
    - [25, 2767.66]
  - - [3584, 4288, 1, 256]
    - [124, 8808.54]
  - - [448, 1856, 1, 256]
    - [129, 5166.53]
  - - [1856, 6784, 1, 3328]
    - [121, 8339.66]
  - - [3584, 128, 1, 3328]
    - [130, 6791.47]
  - - [64, 1856, 1, 256]
    - [52, 2209.93]
  - - [64, 448, 1, 256]
    - [84, 1008.25]
  - - [5888, 4288, 1, 256]
    - [124, 8869.53]
  - - [128, 1500, 1, 1280]
    - [81, 4733.44]
  - - [5056, 1408, 1, 256]
    - [122, 7523.21]
  - - [35, 8457, 1, 4096]
    - [15, 4023.07]
  - - [64, 256, 1, 1280]
    - [76, 1941.81]
  - - [2944, 4, 1, 128]
    - [155, 95.6426]
  - - [3584, 1024, 1, 256]
    - [147, 6553.58]
  - - [512, 6000, 1, 1536]
    - [121, 7357.15]
  - - [256, 704, 1, 256]
    - [120, 2912.71]
  - - [5888, 5888, 1, 256]
    - [131, 8802.6]
  - - [4288, 1024, 1, 1280]
    - [124, 8248.73]
  - - [5888, 128, 1, 3328]
    - [74, 6848.49]
  - - [448, 6784, 1, 3328]
    - [120, 8343.68]
  - - [2944, 1408, 1, 1280]
    - [117, 9229.38]
  - - [3072, 6000, 1, 1024]
    - [138, 9014.91]
  - - [1024, 32, 1, 512]
    - [59, 1497.97]
  - - [2944, 1856, 1, 3328]
    - [134, 7176.38]
  - - [2368, 64, 1, 128]
    - [25, 1206.38]
  - - [256, 1024, 1, 128]
    - [102, 1178.18]
  - - [3584, 5888, 1, 1280]
    - [124, 9023.48]
  - - [64, 4, 1, 128]
    - [156, 0.989372]
  - - [6784, 1856, 1, 1280]
    - [118, 8964.41]
  - - [2944, 5056, 1, 256]
    - [124, 8860.02]
  - - [5888, 256, 1, 3328]
    - [135, 8308.56]
  - - [2944, 4288, 1, 128]
    - [103, 4507.51]
  - - [3584, 1408, 1, 256]
    - [118, 8234.61]
  - - [704, 3584, 1, 3328]
    - [130, 7377.16]
  - - [5056, 448, 1, 1280]
    - [119, 7145.37]
  - - [3584, 1856, 1, 3328]
    - [135, 8954.71]
  - - [64, 1408, 1, 128]
    - [32, 731.874]
  - - [4288, 6784, 1, 1280]
    - [124, 9166.45]
  - - [1024, 3000, 1, 2048]
    - [135, 7723.73]
  - - [1408, 704, 1, 1280]
    - [125, 7863.0]
  - - [2944, 1024, 1, 256]
    - [118, 5034.92]
  - - [256, 64, 1, 128]
    - [24, 150.657]
  - - [2368, 4288, 1, 3328]
    - [122, 8568.74]
  - - [4, 1408, 1, 256]
    - [68, 219.785]
  - - [1024, 1408, 1, 1280]
    - [150, 6761.03]
  - - [64, 64, 1, 256]
    - [50, 198.594]
  - - [704, 256, 1, 3328]
    - [120, 4291.52]
  - - [6784, 5056, 1, 256]
    - [119, 8544.92]
  - - [1856, 1856, 1, 128]
    - [107, 4034.83]
  - - [4288, 5888, 1, 256]
    - [138, 8997.95]
  - - [4, 704, 1, 3328]
    - [73, 452.3]
  - - [35, 8457, 1, 2048]
    - [16, 3375.27]
  - - [448, 2944, 1, 256]
    - [120, 6346.64]
  - - [4, 4288, 1, 3328]
    - [73, 630.878]
  - - [2944, 6784, 1, 256]
    - [147, 8002.82]
  - - [2944, 2944, 1, 128]
    - [102, 4661.31]
  - - [4, 4, 1, 1280]
    - [73, 3.04762]
  - - [1856, 3584, 1, 1280]
    - [117, 8677.56]
  - - [64, 2944, 1, 256]
    - [120, 2926.85]
  - - [3584, 1408, 1, 1280]
    - [131, 8238.8]
  - - [448, 256, 1, 128]
    - [32, 1042.62]
  - - [4288, 448, 1, 128]
    - [108, 3698.72]
  - - [5056, 256, 1, 1280]
    - [125, 7058.4]
  - - [1856, 1408, 1, 3328]
    - [122, 8348.25]
  - - [128, 128, 1, 128]
    - [32, 145.636]
  - - [1024, 4288, 1, 3328]
    - [118, 8042.51]
  - - [448, 2368, 1, 256]
    - [130, 5934.9]
  - - [1024, 4, 1, 128]
    - [156, 15.83]
  - - [64, 1408, 1, 1280]
    - [54, 3865.39]
  - - [64, 6784, 1, 1280]
    - [150, 5629.51]
  - - [5056, 448, 1, 256]
    - [120, 7637.81]
  - - [2944, 2368, 1, 3328]
    - [128, 9112.34]
  - - [704, 4288, 1, 3328]
    - [120, 7950.1]
  - - [1408, 128, 1, 256]
    - [120, 2898.07]
  - - [1024, 1856, 1, 1280]
    - [118, 8087.41]
  - - [6784, 1856, 1, 256]
    - [149, 7538.15]
  - - [512, 48000, 1, 2816]
    - [117, 9704.11]
  - - [512, 3000, 1, 2816]
    - [119, 7621.53]
  - - [128, 2368, 1, 3328]
    - [82, 6038.84]
  - - [1024, 5888, 1, 256]
    - [134, 8185.72]
  - - [64, 2944, 1, 1280]
    - [81, 4540.14]
  - - [6784, 1408, 1, 256]
    - [134, 8573.9]
  - - [5056, 64, 1, 3328]
    - [82, 6310.87]
  - - [128, 704, 1, 128]
    - [21, 696.518]
  - - [1408, 2368, 1, 256]
    - [120, 4994.96]
  - - [1408, 1408, 1, 256]
    - [117, 7552.24]
  - - [4, 64, 1, 128]
    - [155, 1.80441]
  - - [64, 128, 1, 1280]
    - [94, 1272.54]
  - - [1024, 8, 1, 500000]
    - [2, 2013.13]
  - - [4, 2368, 1, 128]
    - [156, 49.8526]
  - - [2368, 2368, 1, 128]
    - [107, 4483.7]
  - - [64, 5888, 1, 128]
    - [24, 1957.57]
  - - [5888, 4, 1, 3328]
    - [157, 638.698]
  - - [6784, 1408, 1, 128]
    - [102, 4715.51]
  - - [1408, 5056, 1, 256]
    - [134, 8557.57]
  - - [512, 50176, 1, 128]
    - [165, 8809.29]
  - - [5056, 128, 1, 3328]
    - [57, 6810.56]
  - - [128, 128, 1, 1280]
    - [91, 1899.59]
  - - [512, 2, 1, 512]
    - [11, 87.3813]
  - - [448, 704, 1, 256]
    - [130, 3765.87]
  - - [4288, 3584, 1, 128]
    - [115, 4563.67]
  - - [2944, 128, 1, 3328]
    - [57, 6507.35]
  - - [128, 5056, 1, 1280]
    - [120, 6557.75]
  - - [3584, 5056, 1, 1280]
    - [117, 9407.83]
  - - [256, 448, 1, 1280]
    - [81, 4096.0]
  - - [704, 704, 1, 128]
    - [107, 2374.21]
  - - [5056, 4, 1, 128]
    - [155, 125.42]
  - - [704, 256, 1, 1280]
    - [130, 4016.13]
  - - [64, 2368, 1, 3328]
    - [87, 5159.19]
  - - [1856, 1024, 1, 128]
    - [107, 3356.37]
  - - [1856, 64, 1, 128]
    - [24, 945.544]
  - - [4096, 64, 1, 4096]
    - [90, 6260.14]
  - - [1024, 24000, 1, 1536]
    - [134, 9368.4]
  - - [704, 4288, 1, 256]
    - [131, 7329.29]
  - - [5888, 2368, 1, 1280]
    - [120, 8624.61]
  - - [6784, 1856, 1, 3328]
    - [124, 9012.35]
  - - [64, 128, 1, 256]
    - [50, 374.491]
  - - [2368, 5888, 1, 1280]
    - [118, 9045.66]
  - - [5888, 256, 1, 1280]
    - [135, 7999.07]
  - - [4, 5888, 1, 1280]
    - [68, 615.739]
  - - [704, 128, 1, 128]
    - [24, 693.169]
  - - [1024, 4, 1, 1280]
    - [163, 372.364]
  - - [2368, 1856, 1, 3328]
    - [135, 8246.81]
  - - [2368, 128, 1, 128]
    - [25, 1963.43]
  - - [2944, 704, 1, 256]
    - [135, 7116.14]
  - - [5056, 128, 1, 128]
    - [28, 2519.39]
  - - [2368, 1024, 1, 3328]
    - [120, 7959.03]
  - - [35, 700, 1, 2048]
    - [16, 1766.76]
  - - [256, 704, 1, 3328]
    - [120, 4296.46]
  - - [704, 3584, 1, 256]
    - [119, 7441.51]
  - - [704, 2944, 1, 3328]
    - [136, 7195.71]
  - - [6784, 1024, 1, 128]
    - [107, 4509.08]
  - - [256, 448, 1, 128]
    - [32, 837.903]
  - - [448, 1024, 1, 3328]
    - [130, 6515.55]
  - - [2944, 1024, 1, 3328]
    - [125, 8751.53]
  - - [2944, 5056, 1, 128]
    - [102, 4799.63]
  - - [2368, 256, 1, 256]
    - [119, 4754.57]
  - - [1408, 6784, 1, 256]
    - [147, 7476.99]
  - - [6784, 1408, 1, 3328]
    - [125, 8968.47]
  - - [4288, 6784, 1, 128]
    - [100, 4455.64]
  - - [1408, 2944, 1, 128]
    - [112, 3862.69]
  - - [704, 64, 1, 256]
    - [51, 1441.79]
  - - [3072, 4, 1, 1024]
    - [69, 711.703]
  - - [256, 2368, 1, 3328]
    - [144, 5199.63]
  - - [6784, 2944, 1, 1280]
    - [128, 8914.35]
  - - [4288, 1856, 1, 128]
    - [108, 4683.2]
  - - [1856, 2944, 1, 128]
    - [102, 4589.24]
  - - [6784, 448, 1, 128]
    - [102, 3918.43]
  - - [64, 3584, 1, 128]
    - [33, 1468.01]
  - - [448, 5056, 1, 1280]
    - [125, 7561.3]
  - - [4288, 5056, 1, 1280]
    - [117, 9304.01]
  - - [2368, 1856, 1, 128]
    - [107, 4322.07]
  - - [128, 448, 1, 1280]
    - [87, 3336.38]
  - - [4288, 704, 1, 256]
    - [130, 7834.55]
  - - [256, 3584, 1, 128]
    - [103, 2500.86]
  - - [5888, 704, 1, 256]
    - [149, 7244.39]
  - - [3584, 1024, 1, 128]
    - [114, 3168.93]
  - - [256, 5888, 1, 3328]
    - [135, 7763.37]
  - - [1408, 4288, 1, 3328]
    - [117, 9273.7]
  - - [6784, 4288, 1, 256]
    - [125, 8825.1]
  - - [4288, 256, 1, 128]
    - [104, 2621.44]
  - - [448, 1856, 1, 3328]
    - [145, 5859.7]
  - - [5888, 256, 1, 256]
    - [135, 7124.74]
  - - [1024, 4, 1, 500000]
    - [0, 1030.1]
  - - [6784, 1024, 1, 1280]
    - [117, 9083.01]
  - - [5888, 1024, 1, 128]
    - [104, 4297.06]
  - - [1024, 128, 1, 256]
    - [120, 2086.72]
  - - [512, 16, 1, 500000]
    - [1, 3921.86]
  - - [128, 64, 1, 3328]
    - [91, 1969.87]
  - - [448, 64, 1, 256]
    - [76, 1092.27]
  - - [2368, 256, 1, 128]
    - [107, 2174.74]
  - - [6784, 3584, 1, 1280]
    - [117, 9558.72]
  - - [1024, 6784, 1, 1280]
    - [126, 8637.62]
  - - [2944, 64, 1, 1280]
    - [48, 4770.03]
  - - [1408, 2944, 1, 1280]
    - [117, 9238.37]
  - - [256, 1856, 1, 256]
    - [143, 4498.33]
  - - [1408, 2368, 1, 3328]
    - [125, 8344.87]
  - - [2944, 4, 1, 3328]
    - [160, 661.109]
  - - [128, 1408, 1, 3328]
    - [88, 5641.32]
  - - [2944, 1856, 1, 128]
    - [102, 4487.94]
  - - [256, 2944, 1, 128]
    - [112, 2233.08]
  - - [256, 6784, 1, 128]
    - [101, 3139.8]
  - - [2368, 4, 1, 128]
    - [156, 38.6612]
  - - [1408, 256, 1, 3328]
    - [152, 4927.57]
  - - [1856, 4, 1, 128]
    - [156, 42.2719]
  - - [1024, 16, 1, 512]
    - [68, 1115.51]
  - - [5056, 6784, 1, 128]
    - [103, 4963.35]
  - - [4288, 5056, 1, 128]
    - [101, 4927.99]
  - - [1856, 5888, 1, 128]
    - [108, 4865.05]
  - - [7680, 2, 1, 2560]
    - [44, 499.512]
  - - [3584, 1856, 1, 256]
    - [134, 7978.28]
  - - [4288, 3584, 1, 1280]
    - [134, 7852.16]
  - - [2368, 448, 1, 256]
    - [149, 5238.83]
  - - [4288, 256, 1, 3328]
    - [120, 6751.24]
  - - [1856, 704, 1, 128]
    - [102, 3525.46]
  - - [1408, 64, 1, 256]
    - [61, 1884.7]
  - - [64, 1856, 1, 128]
    - [38, 888.105]
  - - [4, 256, 1, 128]
    - [155, 7.28178]
  - - [512, 16, 1, 512]
    - [68, 663.656]
  - - [704, 5888, 1, 128]
    - [102, 4424.45]
  - - [6784, 3584, 1, 128]
    - [104, 3823.3]
  - - [1024, 64, 1, 256]
    - [46, 1379.71]
  - - [64, 2368, 1, 256]
    - [120, 2424.83]
  - - [5124, 1500, 1, 2048]
    - [138, 8391.74]
  - - [4288, 5056, 1, 3328]
    - [124, 9274.04]
  - - [4, 1856, 1, 1280]
    - [68, 453.374]
  - - [4288, 128, 1, 128]
    - [102, 2157.7]
  - - [512, 2, 1, 500000]
    - [12, 516.795]
  - - [1408, 1408, 1, 128]
    - [103, 3600.39]
  - - [7680, 16, 1, 2560]
    - [83, 3542.49]
  - - [1856, 128, 1, 128]
    - [35, 1532.7]
  - - [5056, 2368, 1, 256]
    - [147, 7683.97]
  - - [4288, 704, 1, 3328]
    - [120, 7642.86]
  - - [448, 3584, 1, 256]
    - [130, 6733.97]
  - - [2368, 64, 1, 1280]
    - [81, 3962.14]
  - - [2368, 1024, 1, 1280]
    - [132, 7989.54]
  - - [2944, 1408, 1, 3328]
    - [135, 8954.56]
  - - [6144, 1500, 1, 2560]
    - [153, 8169.97]
  - - [4224, 1, 1, 128]
    - [84, 76.8]
  - - [1024, 1408, 1, 3328]
    - [150, 6961.28]
  - - [2944, 5888, 1, 1280]
    - [131, 8797.43]
  - - [8448, 2, 1, 2816]
    - [6, 496.858]
  - - [1408, 4, 1, 1280]
    - [161, 471.791]
  - - [5888, 3584, 1, 256]
    - [138, 8246.2]
  - - [2368, 5056, 1, 128]
    - [101, 4906.8]
  - - [1408, 1856, 1, 3328]
    - [125, 9006.7]
  - - [4, 4, 1, 3328]
    - [73, 5.73793]
  - - [5888, 5056, 1, 3328]
    - [138, 8545.0]
  - - [7680, 6000, 1, 2560]
    - [131, 7995.9]
  - - [6784, 1408, 1, 1280]
    - [125, 8888.03]
  - - [4, 1024, 1, 1280]
    - [73, 302.009]
  - - [512, 3000, 1, 2560]
    - [125, 7809.33]
  - - [704, 2944, 1, 256]
    - [130, 4909.14]
  - - [4288, 64, 1, 256]
    - [130, 3264.62]
  - - [6784, 5888, 1, 3328]
    - [138, 9544.42]
  - - [2368, 4288, 1, 128]
    - [101, 4872.93]
  - - [64, 4288, 1, 1280]
    - [87, 4656.32]
  - - [6784, 64, 1, 1280]
    - [120, 6230.33]
  - - [3584, 128, 1, 128]
    - [28, 2315.47]
  - - [1024, 6784, 1, 128]
    - [102, 3758.84]
  - - [1024, 1500, 1, 1536]
    - [151, 6971.9]
  - - [1408, 64, 1, 3328]
    - [54, 5079.48]
  - - [6784, 4, 1, 256]
    - [40, 487.838]
  - - [1408, 1408, 1, 1280]
    - [153, 7423.21]
  - - [256, 2368, 1, 256]
    - [120, 4986.8]
  - - [3072, 3000, 1, 1024]
    - [122, 7843.91]
  - - [448, 4288, 1, 3328]
    - [121, 7204.69]
  - - [2368, 1408, 1, 256]
    - [153, 5897.86]
  - - [704, 2368, 1, 256]
    - [120, 7000.83]
  - - [1024, 24000, 1, 2560]
    - [147, 8562.21]
  - - [2944, 448, 1, 1280]
    - [135, 7155.83]
  - - [5888, 2368, 1, 3328]
    - [134, 9252.32]
  - - [1024, 256, 1, 128]
    - [116, 1255.78]
  - - [5124, 9124, 1, 1760]
    - [128, 9168.39]
  - - [448, 1408, 1, 1280]
    - [120, 6150.24]
  - - [448, 1856, 1, 1280]
    - [135, 6489.66]
  - - [4288, 448, 1, 1280]
    - [150, 6886.92]
  - - [5888, 704, 1, 3328]
    - [130, 8230.54]
  - - [4, 1856, 1, 128]
    - [156, 26.9964]
  - - [5056, 256, 1, 128]
    - [101, 3468.91]
  - - [1856, 256, 1, 128]
    - [102, 2534.06]
  - - [128, 2368, 1, 256]
    - [120, 3660.12]
  - - [704, 4, 1, 256]
    - [68, 134.496]
  - - [1024, 6784, 1, 3328]
    - [122, 8482.65]
  - - [1408, 5888, 1, 128]
    - [102, 4644.42]
  - - [4288, 4, 1, 128]
    - [155, 35.7799]
  - - [512, 3136, 1, 2048]
    - [167, 6386.59]
  - - [1408, 1024, 1, 256]
    - [120, 5440.72]
  - - [128, 64, 1, 256]
    - [50, 379.919]
  - - [8448, 1500, 1, 2816]
    - [117, 9155.82]
  - - [256, 704, 1, 128]
    - [102, 895.523]
  - - [2560, 7000, 1, 2560]
    - [129, 8565.56]
  - - [5888, 64, 1, 1280]
    - [144, 5007.73]
  - - [128, 4, 1, 3328]
    - [163, 165.11]
  - - [5056, 6784, 1, 1280]
    - [128, 9331.38]
  - - [1024, 448, 1, 1280]
    - [130, 6501.36]
  - - [704, 5056, 1, 3328]
    - [117, 8090.03]
  - - [128, 5056, 1, 256]
    - [130, 5537.27]
  - - [3584, 5056, 1, 3328]
    - [126, 8633.14]
  - - [1856, 4, 1, 3328]
    - [164, 582.714]
  - - [4, 2944, 1, 128]
    - [155, 114.192]
  - - [2368, 2944, 1, 3328]
    - [134, 8749.45]
  - - [448, 448, 1, 1280]
    - [58, 4694.83]
  - - [128, 4, 1, 128]
    - [155, 4.84734]
  - - [2368, 3584, 1, 256]
    - [134, 8418.49]
  - - [4608, 3000, 1, 1536]
    - [124, 9076.37]
  - - [1024, 256, 1, 1280]
    - [130, 5562.74]
  - - [5056, 3584, 1, 1280]
    - [124, 8364.99]
  - - [5124, 9124, 1, 4096]
    - [134, 8648.48]
  - - [7680, 48000, 1, 2560]
    - [128, 4098.16]
  - - [1856, 704, 1, 1280]
    - [120, 8140.94]
  - - [1856, 2944, 1, 1280]
    - [122, 8214.3]
  - - [4608, 1500, 1, 1536]
    - [130, 8424.43]
  - - [1024, 48000, 1, 2816]
    - [121, 8513.08]
  - - [5124, 9124, 1, 2560]
    - [138, 8641.14]
  - - [128, 1024, 1, 256]
    - [52, 2356.35]
  - - [2944, 1408, 1, 256]
    - [134, 8254.19]
  - - [4288, 1408, 1, 3328]
    - [128, 9138.39]
  - - [3584, 64, 1, 3328]
    - [41, 5629.52]
  - - [5888, 2944, 1, 128]
    - [102, 4119.23]
  - - [2944, 1024, 1, 128]
    - [104, 4002.86]
  - - [128, 1, 1, 1024]
    - [98, 19.9805]
  - - [5124, 700, 1, 2048]
    - [135, 7653.74]
  - - [4, 4288, 1, 1280]
    - [68, 587.649]
  - - [6784, 5056, 1, 128]
    - [107, 4855.75]
  - - [256, 1024, 1, 3328]
    - [130, 6116.18]
  - - [3584, 4, 1, 256]
    - [42, 395.476]
  - - [1856, 64, 1, 3328]
    - [57, 5732.5]
  - - [4, 128, 1, 3328]
    - [163, 162.589]
  - - [256, 12544, 1, 1024]
    - [167, 7628.82]
  - - [5888, 1408, 1, 3328]
    - [128, 9524.33]
  - - [448, 2944, 1, 128]
    - [102, 3163.81]
  - - [2368, 1856, 1, 256]
    - [130, 8167.26]
  - - [256, 5056, 1, 256]
    - [120, 7292.03]
  - - [5056, 5056, 1, 128]
    - [108, 5043.89]
  - - [448, 3584, 1, 3328]
    - [125, 6839.46]
  - - [4, 5056, 1, 3328]
    - [73, 639.786]
  - - [256, 256, 1, 128]
    - [32, 554.802]
  - - [5888, 256, 1, 128]
    - [104, 3562.37]
  - - [4, 5056, 1, 128]
    - [155, 149.807]
  - - [448, 256, 1, 256]
    - [51, 2121.4]
  - - [704, 4, 1, 3328]
    - [161, 455.819]
  - - [1408, 256, 1, 256]
    - [120, 4352.58]
  - - [3584, 1856, 1, 128]
    - [111, 3933.13]
  - - [4288, 4288, 1, 128]
    - [102, 4888.51]
  - - [1856, 1024, 1, 3328]
    - [138, 8242.54]
  - - [1856, 4288, 1, 128]
    - [107, 4647.3]
  - - [1024, 6000, 1, 2560]
    - [132, 8526.65]
  - - [1024, 5056, 1, 256]
    - [117, 7343.73]
  - - [5056, 5888, 1, 128]
    - [106, 4053.4]
  - - [2368, 1408, 1, 3328]
    - [120, 8466.1]
  - - [1024, 48000, 1, 1536]
    - [138, 9487.64]
  - - [5888, 448, 1, 256]
    - [151, 6081.44]
  - - [5888, 6784, 1, 128]
    - [103, 4820.17]
  - - [2368, 4, 1, 3328]
    - [162, 620.528]
  - - [6784, 5056, 1, 1280]
    - [147, 8525.4]
  - - [5056, 704, 1, 1280]
    - [117, 7932.96]
  - - [1024, 48000, 1, 2560]
    - [138, 8877.84]
  - - [4608, 32, 1, 1536]
    - [67, 3556.73]
  - - [1024, 2368, 1, 128]
    - [110, 2943.65]
  - - [128, 704, 1, 256]
    - [51, 2059.7]
  - - [2368, 448, 1, 3328]
    - [130, 5290.32]
  - - [128, 5888, 1, 3328]
    - [130, 7764.33]
  - - [448, 128, 1, 1280]
    - [81, 3373.18]
  - - [6784, 4, 1, 3328]
    - [40, 675.963]
  - - [4288, 4, 1, 1280]
    - [73, 564.675]
  - - [1024, 64, 1, 3328]
    - [87, 4293.38]
  - - [3072, 48000, 1, 1024]
    - [137, 7826.41]
  - - [256, 4, 1, 128]
    - [156, 4.83304]
  - - [1024, 5888, 1, 128]
    - [115, 3610.36]
  - - [3584, 5888, 1, 128]
    - [103, 4722.25]
  - - [5056, 5888, 1, 256]
    - [138, 9159.01]
  - - [2368, 1024, 1, 256]
    - [130, 7482.61]
  - - [2944, 1856, 1, 256]
    - [134, 8208.9]
  - - [1856, 6784, 1, 1280]
    - [130, 8205.33]
  - - [64, 5056, 1, 128]
    - [25, 2079.25]
  - - [64, 6784, 1, 128]
    - [25, 2437.48]
  - - [448, 704, 1, 128]
    - [101, 1506.35]
  - - [4, 1024, 1, 128]
    - [156, 17.2463]
  - - [1408, 448, 1, 256]
    - [120, 5545.35]
  - - [1408, 704, 1, 128]
    - [106, 2931.55]
  - - [64, 256, 1, 3328]
    - [92, 2816.42]
  - - [8448, 3000, 1, 2816]
    - [126, 8872.89]
  - - [6784, 448, 1, 3328]
    - [120, 7555.38]
  - - [5056, 1856, 1, 1280]
    - [118, 8652.26]
  - - [1408, 1024, 1, 3328]
    - [122, 7781.32]
  - - [2368, 256, 1, 3328]
    - [126, 5391.96]
  - - [7680, 1500, 1, 2560]
    - [124, 8919.62]
  - - [5888, 3584, 1, 1280]
    - [124, 9235.75]
  - - [1856, 3584, 1, 3328]
    - [135, 8348.73]
  - - [5888, 128, 1, 1280]
    - [120, 5928.51]
  - - [1024, 2944, 1, 256]
    - [151, 6630.17]
  - - [448, 6784, 1, 1280]
    - [132, 8332.35]
  - - [256, 3584, 1, 1280]
    - [122, 7140.09]
  - - [448, 128, 1, 128]
    - [24, 552.713]
  - - [704, 5056, 1, 256]
    - [130, 7959.58]
  - - [3584, 1024, 1, 3328]
    - [122, 8386.74]
  - - [2944, 1856, 1, 1280]
    - [138, 7670.19]
  - - [128, 256, 1, 128]
    - [39, 258.27]
  - - [5056, 256, 1, 256]
    - [130, 5736.67]
  - - [2944, 4288, 1, 3328]
    - [117, 8730.7]
  - - [2368, 3584, 1, 3328]
    - [119, 8437.61]
  - - [2944, 704, 1, 1280]
    - [130, 8342.43]
  - - [128, 4, 1, 256]
    - [50, 24.8242]
  - - [2944, 3584, 1, 1280]
    - [132, 8322.01]
  - - [1856, 5888, 1, 1280]
    - [117, 8911.81]
  - - [256, 256, 1, 1280]
    - [81, 3653.57]
  - - [4608, 24000, 1, 1536]
    - [131, 8930.96]
  - - [4288, 1408, 1, 256]
    - [118, 8338.35]
  - - [3584, 64, 1, 256]
    - [130, 3413.97]
  - - [64, 1856, 1, 3328]
    - [57, 5460.13]
  - - [256, 1408, 1, 128]
    - [101, 1423.99]
  - - [5888, 1408, 1, 128]
    - [112, 4177.78]
  - - [4288, 2368, 1, 1280]
    - [121, 8595.95]
  - - [4, 4288, 1, 256]
    - [157, 370.854]
  - - [256, 4288, 1, 128]
    - [102, 2907.89]
  - - [256, 128, 1, 3328]
    - [95, 3644.78]
  - - [512, 8, 1, 500000]
    - [7, 2025.79]
  - - [6784, 2368, 1, 256]
    - [120, 8470.31]
  - - [5888, 128, 1, 128]
    - [25, 2604.45]
  - - [1408, 448, 1, 3328]
    - [130, 6540.52]
  - - [1024, 24000, 1, 2816]
    - [147, 8363.93]
  - - [704, 1024, 1, 1280]
    - [130, 7277.18]
  - - [1856, 256, 1, 3328]
    - [120, 7039.04]
  - - [1856, 2944, 1, 256]
    - [129, 8151.49]
  - - [5056, 1024, 1, 128]
    - [103, 4422.72]
  - - [64, 5888, 1, 1280]
    - [81, 4854.52]
  - - [7680, 3000, 1, 2560]
    - [134, 8789.47]
  - - [4224, 1500, 1, 176]
    - [130, 7902.04]
  - - [5124, 700, 1, 2560]
    - [120, 8232.49]
  - - [6784, 256, 1, 128]
    - [101, 3548.82]
  - - [5888, 704, 1, 128]
    - [108, 3959.55]
  - - [6784, 64, 1, 128]
    - [36, 2150.72]
  - - [4, 448, 1, 1280]
    - [161, 267.963]
  - - [1024, 4288, 1, 1280]
    - [135, 8363.62]
  - - [2368, 5056, 1, 3328]
    - [134, 8581.75]
  - - [448, 4, 1, 128]
    - [155, 16.7673]
  - - [4, 256, 1, 3328]
    - [164, 201.888]
  - - [4288, 1024, 1, 3328]
    - [130, 8567.62]
  - - [6144, 48000, 1, 2560]
    - [138, 3751.58]
  - - [1024, 5056, 1, 3328]
    - [117, 9440.56]
  - - [1024, 1856, 1, 3328]
    - [138, 8244.26]
  - - [704, 704, 1, 1280]
    - [130, 5529.89]
  - - [128, 2368, 1, 1280]
    - [87, 5062.28]
  - - [3584, 4, 1, 128]
    - [156, 61.4949]
  - - [3584, 256, 1, 1280]
    - [154, 6260.14]
  - - [4, 128, 1, 128]
    - [155, 1.1587]
  - - [128, 4288, 1, 3328]
    - [66, 6186.05]
  - - [5124, 1500, 1, 2560]
    - [134, 8432.52]
  - - [3584, 128, 1, 1280]
    - [120, 6547.75]
  - - [4, 256, 1, 1280]
    - [73, 180.044]
  - - [128, 704, 1, 3328]
    - [45, 5177.71]
  - - [4288, 6784, 1, 256]
    - [118, 9005.24]
  - - [3584, 2944, 1, 3328]
    - [135, 8872.17]
  - - [128, 1856, 1, 256]
    - [120, 3690.38]
  - - [64, 4288, 1, 256]
    - [120, 3007.47]
  - - [4, 3584, 1, 3328]
    - [50, 639.89]
  - - [64, 4, 1, 3328]
    - [164, 98.6074]
  - - [4, 64, 1, 3328]
    - [164, 91.8069]
  - - [35, 700, 1, 2560]
    - [18, 2397.55]
  - - [5888, 2944, 1, 256]
    - [128, 9031.18]
  - - [4, 2368, 1, 256]
    - [68, 256.868]
  - - [1856, 64, 1, 256]
    - [52, 2222.86]
  - - [5056, 128, 1, 1280]
    - [120, 6557.75]
  - - [448, 4288, 1, 1280]
    - [144, 6891.56]
  - - [256, 4288, 1, 256]
    - [120, 6250.41]
  - - [1024, 4288, 1, 128]
    - [104, 3951.31]
  - - [4, 1024, 1, 256]
    - [68, 182.044]
  - - [5056, 4288, 1, 256]
    - [124, 8933.33]
  - - [1024, 448, 1, 256]
    - [130, 4573.23]
  - - [1024, 3584, 1, 256]
    - [125, 7447.08]
  - - [2944, 128, 1, 1280]
    - [130, 5417.17]
  - - [49, 2048, 64, 512]
    - [173, 5916.81]
  - - [2560, 32, 1, 2560]
    - [67, 4076.89]
  - - [64, 256, 1, 256]
    - [84, 689.853]
  - - [1024, 4, 1, 512]
    - [76, 288.07]
  - - [128, 2368, 1, 128]
    - [30, 1809.58]
  - - [256, 704, 1, 1280]
    - [120, 4032.98]
  - - [64, 2368, 1, 128]
    - [21, 1165.78]
  - - [176, 1500, 1, 1408]
    - [48, 4922.03]
  - - [448, 5888, 1, 1280]
    - [130, 7550.11]
  - - [512, 3000, 1, 2048]
    - [152, 6562.34]
  - - [5056, 448, 1, 128]
    - [102, 3947.87]
  - - [4288, 704, 1, 1280]
    - [120, 8243.72]
  - - [3584, 2944, 1, 128]
    - [112, 4284.78]
  - - [6784, 256, 1, 1280]
    - [120, 7955.11]
  - - [256, 2944, 1, 1280]
    - [150, 6691.8]
  - - [2560, 128, 1, 2560]
    - [88, 5347.13]
  - - [2368, 5888, 1, 3328]
    - [125, 8918.97]
  - - [4, 64, 1, 256]
    - [73, 13.0032]
  - - [704, 1024, 1, 3328]
    - [150, 6648.02]
  - - [2368, 1856, 1, 1280]
    - [136, 8016.41]
  - - [448, 5056, 1, 3328]
    - [120, 8231.63]
  - - [128, 448, 1, 128]
    - [29, 441.108]
  - - [128, 6784, 1, 256]
    - [130, 5849.95]
  - - [512, 4, 1, 500000]
    - [10, 1027.04]
  - - [3584, 4288, 1, 128]
    - [106, 4260.8]
  - - [64, 448, 1, 128]
    - [29, 253.454]
  - - [1024, 6000, 1, 2816]
    - [134, 8886.04]
  - - [5888, 4288, 1, 3328]
    - [134, 8968.06]
  - - [2368, 704, 1, 256]
    - [150, 4663.14]
  - - [256, 1856, 1, 3328]
    - [122, 6480.53]
  - - [1856, 128, 1, 256]
    - [120, 3726.56]
  - - [6784, 128, 1, 128]
    - [23, 2823.91]
  - - [3584, 1408, 1, 128]
    - [106, 3666.68]
  - - [1856, 5056, 1, 1280]
    - [117, 8651.26]
  - - [2944, 1024, 1, 1280]
    - [128, 8765.11]
  - - [5056, 4, 1, 256]
    - [42, 428.588]
  - - [3584, 5888, 1, 3328]
    - [128, 9347.65]
  - - [2368, 4288, 1, 256]
    - [138, 8013.0]
  - - [1024, 2368, 1, 3328]
    - [125, 8119.19]
  - - [128, 3584, 1, 128]
    - [25, 2584.52]
  - - [704, 1408, 1, 256]
    - [130, 6792.17]
  - - [4096, 128, 1, 4096]
    - [152, 6624.74]
  - - [1024, 2944, 1, 128]
    - [104, 3771.27]
  - - [1024, 3584, 1, 1280]
    - [125, 8952.61]
  - - [4288, 5888, 1, 3328]
    - [138, 9047.95]
  - - [4288, 4, 1, 3328]
    - [43, 615.106]
  - - [4608, 16, 1, 1536]
    - [47, 2894.84]
  - - [5888, 64, 1, 128]
    - [34, 1827.06]
  - - [4, 5888, 1, 128]
    - [155, 179.444]
  - - [1024, 2944, 1, 3328]
    - [126, 8298.67]
  - - [2048, 64, 1, 2048]
    - [55, 4963.67]
  - - [6144, 2, 1, 2560]
    - [44, 477.78]
  - - [256, 6784, 1, 1280]
    - [118, 7491.84]
  - - [1856, 3584, 1, 256]
    - [130, 7580.5]
  - - [128, 448, 1, 3328]
    - [81, 4417.61]
  - - [6784, 1856, 1, 128]
    - [109, 4621.64]
  - - [1024, 1500, 1, 2048]
    - [130, 6284.4]
  - - [5056, 128, 1, 256]
    - [130, 5705.06]
  - - [512, 24000, 1, 2816]
    - [117, 8919.75]
  - - [256, 5888, 1, 1280]
    - [132, 7977.9]
  - - [4, 128, 1, 1280]
    - [73, 94.1609]
  - - [4288, 6784, 1, 3328]
    - [138, 9012.48]
  - - [6784, 128, 1, 1280]
    - [122, 6807.25]
  - - [64, 1408, 1, 256]
    - [51, 2045.09]
  - - [2368, 1408, 1, 128]
    - [102, 4340.63]
  - - [1856, 448, 1, 256]
    - [151, 3639.89]
  - - [1408, 1024, 1, 128]
    - [110, 3417.58]
  - - [128, 64, 1, 128]
    - [31, 68.6241]
  - - [6784, 3584, 1, 3328]
    - [128, 9425.53]
  - - [1760, 7000, 1, 1760]
    - [125, 8780.31]
  - - [1024, 704, 1, 3328]
    - [142, 5644.5]
  - - [64, 64, 1, 128]
    - [21, 38.1023]
  - - [2368, 5056, 1, 1280]
    - [139, 8462.31]
  - - [64, 4, 1, 1280]
    - [73, 46.5455]
  - - [1408, 2368, 1, 1280]
    - [125, 8234.98]
  - - [128, 1408, 1, 1280]
    - [87, 4491.56]
  - - [1024, 1, 1, 512]
    - [91, 81.92]
  - - [4, 1408, 1, 128]
    - [155, 56.32]
  - - [704, 4288, 1, 128]
    - [109, 3942.86]
  - - [128, 1856, 1, 3328]
    - [75, 6111.83]
  - - [2944, 2944, 1, 256]
    - [134, 8640.12]
  - - [2944, 4, 1, 1280]
    - [68, 554.165]
  - - [5888, 4, 1, 256]
    - [50, 435.644]
  - - [6784, 256, 1, 256]
    - [130, 7025.86]
  - - [256, 5056, 1, 3328]
    - [130, 8249.47]
  - - [128, 4288, 1, 1280]
    - [120, 5561.64]
  - - [5056, 1856, 1, 128]
    - [114, 3975.18]
  - - [1024, 3000, 1, 1536]
    - [135, 8544.44]
  - - [5056, 1024, 1, 3328]
    - [128, 9361.37]
  - - [128, 128, 1, 256]
    - [80, 699.051]
  - - [1760, 64, 1, 1760]
    - [48, 4956.16]
  - - [4288, 3584, 1, 3328]
    - [148, 7506.08]
  - - [448, 704, 1, 3328]
    - [120, 4697.56]
  - - [448, 448, 1, 128]
    - [37, 1249.52]
  - - [1024, 2368, 1, 1280]
    - [130, 7756.34]
  - - [1856, 704, 1, 3328]
    - [130, 8340.56]
  - - [512, 1500, 1, 2560]
    - [132, 6041.29]
  - - [5888, 6784, 1, 3328]
    - [128, 9199.28]
  - - [704, 4288, 1, 1280]
    - [122, 8341.96]
  - - [128, 50176, 1, 512]
    - [168, 7589.38]
  - - [704, 256, 1, 256]
    - [120, 2912.71]
  - - [1024, 48000, 1, 2048]
    - [125, 8947.32]
  - - [4288, 1024, 1, 128]
    - [101, 4291.65]
  - - [3136, 64, 128, 64]
    - [183, 8175.06]
  - - [784, 512, 64, 128]
    - [181, 8378.34]
  - - [3136, 256, 64, 64]
    - [184, 8506.65]
  - - [12544, 1024, 1, 256]
    - [177, 8927.93]
  - - [784, 128, 128, 512]
    - [182, 8190.53]
  - - [784, 512, 256, 128]
    - [180, 8637.14]
  - - [3136, 64, 64, 256]
    - [179, 8782.93]
  - - [3136, 512, 1, 2048]
    - [176, 7298.32]
  - - [12544, 256, 1, 1024]
    - [188, 7667.25]
  - - [3136, 2048, 1, 512]
    - [187, 8447.22]
  - - [3136, 256, 256, 64]
    - [180, 8663.08]
  - - [3136, 64, 128, 256]
    - [178, 8943.46]
  - - [784, 128, 64, 512]
    - [186, 8006.27]
  - - [3136, 64, 256, 64]
    - [183, 8267.12]
  - - [784, 512, 128, 128]
    - [180, 8564.25]
  - - [3136, 64, 64, 64]
    - [183, 8009.35]
  - - [784, 128, 256, 512]
    - [184, 8377.06]
  - - [3136, 64, 256, 256]
    - [185, 9033.88]
  - - [3136, 256, 128, 64]
    - [180, 8624.46]
  - - [1024, 256, 1, 1024]
    - [206, 6331.03]
  - - [1024, 512, 1, 2048]
    - [205, 8100.04]
  - - [512, 200, 1, 512]
    - [214, 2861.83]
  - - [4096, 256, 1, 2048]
    - [197, 8812.72]
  - - [4096, 512, 1, 1024]
    - [207, 9068.77]
  - - [1024, 200, 1, 1024]
    - [206, 5110.02]
  - - [1024, 512, 1, 1024]
    - [199, 7785.25]
  - - [2048, 256, 1, 4096]
    - [209, 8438.71]
  - - [2048, 768, 1, 512]
    - [191, 8618.43]
  - - [512, 256, 1, 1024]
    - [211, 4834.93]
  - - [512, 768, 1, 2048]
    - [208, 6908.94]
  - - [2048, 256, 1, 1024]
    - [204, 7941.88]
  - - [1024, 256, 1, 2048]
    - [201, 6997.8]
  - - [2048, 200, 1, 512]
    - [204, 5649.66]
  - - [512, 1024, 1, 512]
    - [204, 7200.52]
  - - [4096, 200, 1, 1024]
    - [202, 6678.83]
  - - [2048, 200, 1, 4096]
    - [210, 6706.59]
  - - [2048, 512, 1, 1024]
    - [207, 8548.9]
  - - [1024, 1024, 1, 512]
    - [202, 8046.63]
  - - [1024, 200, 1, 4096]
    - [201, 5884.26]
  - - [512, 512, 1, 512]
    - [203, 5886.74]
  - - [2048, 512, 1, 4096]
    - [212, 8995.84]
  - - [4096, 512, 1, 2048]
    - [207, 9298.08]
  - - [512, 256, 1, 2048]
    - [200, 5186.16]
  - - [4096, 1024, 1, 2048]
    - [189, 9790.67]
  - - [2048, 1024, 1, 2048]
    - [190, 9278.8]
  - - [1024, 200, 1, 512]
    - [206, 4535.36]
  - - [512, 512, 1, 1024]
    - [206, 6553.6]
  - - [1024, 1024, 1, 4096]
    - [197, 8967.29]
  - - [2048, 1024, 1, 4096]
    - [192, 9500.46]
  - - [4096, 200, 1, 2048]
    - [198, 7082.58]
  - - [2048, 200, 1, 1024]
    - [204, 6211.94]
  - - [1024, 768, 1, 512]
    - [205, 7401.71]
  - - [2048, 512, 1, 512]
    - [202, 8124.56]
  - - [2048, 200, 1, 2048]
    - [204, 6561.8]
  - - [512, 1024, 1, 1024]
    - [210, 7407.16]
  - - [2048, 256, 1, 2048]
    - [205, 8224.13]
  - - [512, 768, 1, 512]
    - [203, 6469.36]
  - - [512, 200, 1, 1024]
    - [206, 3755.64]
  - - [4096, 1024, 1, 1024]
    - [189, 9605.85]
  - - [512, 512, 1, 2048]
    - [206, 6631.31]
  - - [4096, 256, 1, 4096]
    - [212, 8961.29]
  - - [1024, 512, 1, 512]
    - [205, 7108.99]
  - - [512, 256, 1, 512]
    - [213, 4032.98]
  - - [1024, 256, 1, 4096]
    - [201, 7326.3]
  - - [4096, 512, 1, 4096]
    - [193, 9471.97]
  - - [1024, 200, 1, 2048]
    - [194, 5530.46]
  - - [512, 1024, 1, 2048]
    - [203, 7398.99]
  - - [2048, 1024, 1, 512]
    - [195, 8995.83]
  - - [1024, 1024, 1, 2048]
    - [202, 8830.11]
  - - [4096, 256, 1, 1024]
    - [202, 8581.7]
  - - [512, 768, 1, 1024]
    - [203, 6875.91]
  - - [1024, 512, 1, 4096]
    - [199, 8484.05]
  - - [1024, 256, 1, 512]
    - [196, 5667.98]
  - - [4096, 200, 1, 4096]
    - [209, 7018.59]
  - - [2048, 256, 1, 512]
    - [209, 7078.99]
  - - [512, 200, 1, 2048]
    - [214, 4283.4]
  - - [1024, 1024, 1, 1024]
    - [197, 8565.27]
  - - [2048, 512, 1, 2048]
    - [197, 8850.49]
  - - [4096, 1024, 1, 4096]
    - [190, 9843.18]
  - - [2048, 1024, 1, 1024]
    - [195, 9234.11]
  - - [704, 1024, 1, 128]
    - [317, 3019.56]
  - - [1024, 1024, 1, 3328]
    - [355, 8162.65]
  - - [4, 704, 1, 1280]
    - [258, 319.646]
  - - [4, 1856, 1, 3328]
    - [288, 550.614]
  - - [1856, 448, 1, 3328]
    - [340, 6813.15]
  - - [2944, 4288, 1, 1280]
    - [349, 8975.86]
  - - [2368, 64, 1, 3328]
    - [263, 5482.33]
  - - [1760, 32, 1, 1760]
    - [302, 3860.04]
  - - [2368, 5888, 1, 256]
    - [346, 8656.83]
  - - [5888, 1856, 1, 256]
    - [336, 7881.53]
  - - [64, 3584, 1, 1280]
    - [272, 4835.43]
  - - [512, 24000, 1, 1536]
    - [343, 8666.0]
  - - [128, 6784, 1, 3328]
    - [340, 7062.35]
  - - [5888, 1408, 1, 256]
    - [353, 8130.32]
  - - [5888, 1856, 1, 3328]
    - [343, 8840.85]
  - - [512, 4, 1, 512]
    - [228, 170.323]
  - - [35, 1500, 1, 2560]
    - [232, 2896.65]
  - - [1856, 4288, 1, 256]
    - [332, 8374.73]
  - - [1024, 5056, 1, 128]
    - [329, 3304.35]
  - - [5056, 5056, 1, 3328]
    - [343, 8905.53]
  - - [1408, 5888, 1, 1280]
    - [343, 9418.2]
  - - [2368, 448, 1, 128]
    - [317, 3075.07]
  - - [6144, 6000, 1, 2560]
    - [343, 9336.43]
  - - [2368, 6784, 1, 128]
    - [316, 4919.36]
  - - [1024, 3584, 1, 3328]
    - [334, 8071.17]
  - - [512, 48000, 1, 2048]
    - [343, 8763.16]
  - - [1408, 64, 1, 128]
    - [239, 805.57]
  - - [256, 4288, 1, 3328]
    - [365, 6331.96]
  - - [5888, 1408, 1, 1280]
    - [333, 9226.27]
  - - [704, 1856, 1, 3328]
    - [359, 6309.5]
  - - [1408, 4288, 1, 256]
    - [343, 8374.6]
  - - [1024, 2368, 1, 256]
    - [340, 7341.12]
  - - [64, 4, 1, 256]
    - [283, 13.1032]
  - - [1408, 1856, 1, 1280]
    - [350, 8773.05]
  - - [1408, 64, 1, 1280]
    - [296, 4050.08]
  - - [448, 1024, 1, 1280]
    - [359, 6071.26]
  - - [4096, 32, 1, 4096]
    - [293, 5491.82]
  - - [256, 1408, 1, 3328]
    - [345, 5351.49]
  - - [5056, 5056, 1, 1280]
    - [353, 9408.67]
  - - [448, 5056, 1, 256]
    - [358, 6680.54]
  - - [704, 1856, 1, 1280]
    - [335, 7504.03]
  - - [128, 5056, 1, 128]
    - [250, 2316.58]
  - - [2368, 128, 1, 256]
    - [335, 3660.22]
  - - [1856, 1408, 1, 128]
    - [322, 3885.97]
  - - [64, 5056, 1, 256]
    - [345, 3318.91]
  - - [6784, 256, 1, 3328]
    - [343, 7590.64]
  - - [1408, 3584, 1, 256]
    - [332, 8276.92]
  - - [4288, 448, 1, 256]
    - [345, 7139.79]
  - - [64, 704, 1, 128]
    - [246, 375.567]
  - - [1024, 1856, 1, 128]
    - [315, 2890.66]
  - - [4288, 2944, 1, 1280]
    - [349, 8981.45]
  - - [704, 5056, 1, 1280]
    - [335, 7684.72]
  - - [2368, 704, 1, 3328]
    - [350, 7070.14]
  - - [256, 5888, 1, 256]
    - [335, 7319.45]
  - - [1856, 4288, 1, 3328]
    - [333, 9238.69]
  - - [256, 2944, 1, 256]
    - [335, 6090.31]
  - - [5888, 1024, 1, 256]
    - [339, 8270.05]
  - - [448, 64, 1, 1280]
    - [292, 2493.32]
  - - [3072, 64, 1, 1024]
    - [275, 3149.77]
  - - [3584, 4, 1, 1280]
    - [377, 567.862]
  - - [2560, 16, 1, 2560]
    - [284, 2887.15]
  - - [2944, 64, 1, 256]
    - [275, 2565.76]
  - - [128, 4, 1, 1280]
    - [378, 78.8692]
  - - [1408, 2944, 1, 256]
    - [339, 8337.3]
  - - [256, 1856, 1, 1280]
    - [365, 6267.35]
  - - [6784, 5056, 1, 3328]
    - [349, 9424.0]
  - - [5056, 5056, 1, 256]
    - [336, 8758.33]
  - - [128, 256, 1, 256]
    - [291, 1205.36]
  - - [64, 1024, 1, 1280]
    - [302, 3566.68]
  - - [2944, 4, 1, 256]
    - [255, 319.449]
  - - [704, 5056, 1, 128]
    - [324, 4073.83]
  - - [4, 2368, 1, 1280]
    - [283, 496.992]
  - - [2368, 2944, 1, 1280]
    - [332, 9085.55]
  - - [448, 448, 1, 3328]
    - [310, 5428.76]
  - - [6784, 6784, 1, 1280]
    - [349, 8727.03]
  - - [1024, 256, 1, 3328]
    - [359, 5499.42]
  - - [1408, 4288, 1, 1280]
    - [333, 9094.42]
  - - [3584, 4288, 1, 1280]
    - [336, 8703.88]
  - - [512, 6000, 1, 2560]
    - [339, 8474.56]
  - - [2368, 704, 1, 1280]
    - [345, 7651.59]
  - - [5056, 4288, 1, 3328]
    - [353, 8545.35]
  - - [3584, 2368, 1, 3328]
    - [341, 8797.88]
  - - [5888, 6784, 1, 1280]
    - [339, 8785.18]
  - - [64, 704, 1, 1280]
    - [262, 2783.48]
  - - [4288, 256, 1, 256]
    - [335, 6162.78]
  - - [2944, 128, 1, 128]
    - [237, 1951.33]
  - - [6144, 32, 1, 2560]
    - [296, 4589.05]
  - - [6784, 448, 1, 1280]
    - [340, 8674.31]
  - - [2944, 5888, 1, 256]
    - [353, 8991.76]
  - - [64, 64, 1, 1280]
    - [313, 712.448]
  - - [4288, 2944, 1, 256]
    - [349, 8678.14]
  - - [5888, 704, 1, 1280]
    - [339, 8652.71]
  - - [5056, 4, 1, 3328]
    - [255, 650.772]
  - - [1856, 64, 1, 1280]
    - [272, 4471.97]
  - - [1760, 16, 1, 1760]
    - [312, 2592.23]
  - - [448, 5888, 1, 128]
    - [322, 3823.03]
  - - [5888, 64, 1, 3328]
    - [304, 6013.22]
  - - [2944, 256, 1, 3328]
    - [345, 7791.45]
  - - [1024, 64, 1, 128]
    - [246, 592.516]
  - - [5056, 2368, 1, 1280]
    - [332, 9260.53]
  - - [448, 3584, 1, 1280]
    - [353, 6771.34]
  - - [6784, 5888, 1, 256]
    - [347, 7933.39]
  - - [64, 1024, 1, 3328]
    - [296, 4783.08]
  - - [704, 128, 1, 1280]
    - [302, 3971.98]
  - - [4, 3584, 1, 128]
    - [371, 59.5238]
  - - [1408, 448, 1, 1280]
    - [345, 5902.17]
  - - [1024, 1408, 1, 256]
    - [340, 5272.94]
  - - [2368, 2368, 1, 3328]
    - [345, 8488.76]
  - - [1856, 6784, 1, 128]
    - [322, 4742.51]
  - - [5056, 704, 1, 3328]
    - [348, 7772.48]
  - - [1408, 1856, 1, 256]
    - [366, 5229.84]
  - - [1408, 704, 1, 3328]
    - [366, 6954.93]
  - - [2368, 5056, 1, 256]
    - [339, 8580.68]
  - - [1408, 256, 1, 1280]
    - [365, 4790.11]
  - - [3072, 128, 1, 1024]
    - [361, 4579.87]
  - - [3584, 2368, 1, 1280]
    - [332, 8675.13]
  - - [4288, 64, 1, 3328]
    - [311, 5550.11]
  - - [2368, 4, 1, 1280]
    - [377, 537.518]
  - - [704, 5888, 1, 256]
    - [333, 5305.88]
  - - [6784, 2944, 1, 128]
    - [329, 4344.21]
  - - [6784, 64, 1, 256]
    - [359, 4496.42]
  - - [2944, 256, 1, 256]
    - [345, 6553.7]
  - - [2944, 6784, 1, 3328]
    - [333, 8895.76]
  - - [128, 1, 1, 1408]
    - [313, 25.7]
  - - [704, 1408, 1, 3328]
    - [347, 7913.21]
  - - [3584, 704, 1, 3328]
    - [332, 7526.43]
  - - [2944, 256, 1, 128]
    - [316, 2830.76]
  - - [6784, 4, 1, 1280]
    - [373, 645.235]
  - - [1024, 64, 1, 1280]
    - [271, 3013.25]
  - - [8448, 4, 1, 2816]
    - [223, 984.768]
  - - [448, 4288, 1, 256]
    - [345, 7139.79]
  - - [64, 3584, 1, 3328]
    - [269, 5683.27]
  - - [704, 2368, 1, 1280]
    - [353, 7045.3]
  - - [1856, 2368, 1, 1280]
    - [350, 8327.9]
  - - [2368, 128, 1, 3328]
    - [286, 6082.65]
  - - [64, 193600, 1, 64]
    - [335, 6747.77]
  - - [1760, 128, 1, 1760]
    - [263, 5513.07]
  - - [448, 1408, 1, 256]
    - [345, 5591.54]
  - - [1856, 4288, 1, 1280]
    - [343, 8647.72]
  - - [64, 5056, 1, 3328]
    - [303, 6096.59]
  - - [512, 1500, 1, 2816]
    - [345, 7879.3]
  - - [1024, 448, 1, 128]
    - [317, 1844.33]
  - - [704, 4, 1, 1280]
    - [283, 341.433]
  - - [704, 256, 1, 128]
    - [317, 1001.34]
  - - [256, 193600, 1, 64]
    - [353, 8113.3]
  - - [704, 2944, 1, 128]
    - [324, 3747.13]
  - - [1408, 1024, 1, 1280]
    - [350, 7080.71]
  - - [704, 6784, 1, 256]
    - [368, 6630.47]
  - - [6784, 704, 1, 256]
    - [335, 8005.86]
  - - [5056, 1408, 1, 128]
    - [326, 4303.13]
  - - [2048, 7000, 1, 2048]
    - [343, 9269.2]
  - - [256, 3584, 1, 3328]
    - [337, 7334.48]
  - - [5056, 704, 1, 256]
    - [345, 7954.12]
  - - [128, 1408, 1, 128]
    - [240, 1243.02]
  - - [3584, 4288, 1, 3328]
    - [369, 7683.81]
  - - [5888, 1856, 1, 1280]
    - [333, 8831.34]
  - - [256, 1408, 1, 256]
    - [335, 4352.68]
  - - [5056, 64, 1, 1280]
    - [302, 5012.05]
  - - [1024, 704, 1, 256]
    - [335, 5710.17]
  - - [64, 256, 1, 128]
    - [241, 149.897]
  - - [2368, 3584, 1, 1280]
    - [343, 8609.68]
  - - [1024, 256, 1, 256]
    - [359, 3276.9]
  - - [1856, 4, 1, 1280]
    - [257, 497.104]
  - - [448, 448, 1, 256]
    - [345, 3117.83]
  - - [2944, 3584, 1, 3328]
    - [333, 8879.45]
  - - [7680, 32, 1, 2560]
    - [303, 5310.24]
  - - [128, 4288, 1, 128]
    - [243, 2116.2]
  - - [256, 256, 1, 3328]
    - [296, 4774.7]
  - - [128, 1024, 1, 3328]
    - [297, 5894.8]
  - - [4, 1408, 1, 3328]
    - [288, 552.674]
  - - [196, 256, 64, 1024]
    - [386, 5218.34]
  - - [6784, 2944, 1, 256]
    - [351, 8271.18]
  - - [64, 1856, 1, 1280]
    - [302, 4167.96]
  - - [64, 1024, 1, 128]
    - [236, 589.188]
  - - [1024, 1500, 1, 2560]
    - [340, 8407.88]
  - - [1856, 2368, 1, 256]
    - [335, 8092.15]
  - - [3584, 256, 1, 128]
    - [318, 2607.57]
  - - [3584, 6784, 1, 3328]
    - [352, 8558.83]
  - - [256, 1024, 1, 256]
    - [345, 3901.78]
  - - [4, 6784, 1, 3328]
    - [283, 662.575]
  - - [1024, 5888, 1, 3328]
    - [343, 9161.76]
  - - [1024, 128, 1, 1280]
    - [300, 3942.12]
  - - [3072, 32, 1, 1024]
    - [277, 2840.49]
  - - [6144, 24000, 1, 2560]
    - [333, 7605.87]
  - - [448, 1024, 1, 256]
    - [335, 5062.19]
  - - [5056, 4288, 1, 1280]
    - [343, 9090.99]
  - - [5888, 64, 1, 256]
    - [345, 4449.78]
  - - [1856, 256, 1, 1280]
    - [359, 5834.46]
  - - [64, 5888, 1, 3328]
    - [297, 6152.44]
  - - [2368, 2368, 1, 1280]
    - [337, 8594.66]
  - - [2944, 5888, 1, 128]
    - [322, 4776.19]
  - - [704, 5888, 1, 1280]
    - [337, 8435.91]
  - - [2368, 3584, 1, 128]
    - [319, 4590.71]
  - - [1856, 5056, 1, 128]
    - [330, 4503.48]
  - - [4608, 1, 1, 1536]
    - [228, 226.955]
  - - [448, 256, 1, 3328]
    - [272, 5415.56]
  - - [2944, 6784, 1, 1280]
    - [356, 8385.11]
  - - [448, 1856, 1, 128]
    - [326, 2618.96]
  - - [128, 1024, 1, 128]
    - [235, 940.527]
  - - [7680, 4, 1, 2560]
    - [259, 985.104]
  - - [1024, 704, 1, 1280]
    - [345, 7204.56]
  - - [128, 5888, 1, 256]
    - [335, 6313.52]
  - - [1024, 5056, 1, 1280]
    - [340, 8979.76]
  - - [4288, 1024, 1, 256]
    - [332, 7198.29]
  - - [2944, 2368, 1, 128]
    - [317, 4624.57]
  - - [704, 704, 1, 3328]
    - [358, 5870.71]
  - - [704, 1408, 1, 1280]
    - [347, 7680.32]
  - - [5888, 448, 1, 1280]
    - [335, 7718.66]
  - - [3584, 256, 1, 3328]
    - [340, 7523.88]
  - - [704, 5888, 1, 3328]
    - [345, 8196.99]
  - - [704, 1856, 1, 128]
    - [323, 3388.43]
  - - [128, 3584, 1, 3328]
    - [297, 6626.5]
  - - [4, 4288, 1, 128]
    - [370, 159.648]
  - - [128, 704, 1, 1280]
    - [260, 4038.73]
  - - [3584, 2944, 1, 256]
    - [333, 7685.99]
  - - [1856, 128, 1, 3328]
    - [289, 6070.63]
  - - [1856, 2368, 1, 3328]
    - [350, 8460.62]
  - - [512, 6000, 1, 2816]
    - [353, 9019.55]
  - - [2944, 448, 1, 128]
    - [316, 3027.73]
  - - [64, 193600, 1, 256]
    - [359, 7080.32]
  - - [128, 2944, 1, 1280]
    - [335, 5397.87]
  - - [448, 2944, 1, 1280]
    - [345, 6996.97]
  - - [512, 24000, 1, 2048]
    - [353, 8832.67]
  - - [128, 256, 1, 3328]
    - [292, 3531.57]
  - - [1408, 5056, 1, 3328]
    - [348, 7969.94]
  - - [1856, 1856, 1, 3328]
    - [335, 8140.34]
  - - [3584, 128, 1, 256]
    - [345, 4861.05]
  - - [448, 1408, 1, 3328]
    - [335, 6353.75]
  - - [2368, 2368, 1, 256]
    - [349, 8369.37]
  - - [4288, 4288, 1, 1280]
    - [339, 8666.52]
  - - [64, 448, 1, 1280]
    - [292, 2591.92]
  - - [5888, 1024, 1, 1280]
    - [332, 8526.6]
  - - [704, 1024, 1, 256]
    - [345, 4971.8]
  - - [1024, 12544, 1, 256]
    - [383, 8611.9]
  - - [448, 4, 1, 256]
    - [288, 78.6534]
  - - [5888, 448, 1, 128]
    - [319, 3592.03]
  - - [512, 48000, 1, 2560]
    - [353, 9237.44]
  - - [8448, 16, 1, 2816]
    - [218, 3360.21]
  - - [704, 6784, 1, 3328]
    - [354, 7774.95]
  - - [5888, 5888, 1, 1280]
    - [340, 9238.25]
  - - [5056, 1024, 1, 1280]
    - [368, 8227.88]
  - - [448, 5888, 1, 3328]
    - [343, 7777.63]
  - - [3072, 2, 1, 1024]
    - [280, 376.383]
  - - [1024, 2944, 1, 1280]
    - [333, 8650.45]
  - - [5056, 5888, 1, 1280]
    - [343, 8861.6]
  - - [4288, 5888, 1, 128]
    - [323, 5049.01]
  - - [256, 3584, 1, 256]
    - [335, 6314.11]
  - - [256, 4, 1, 1280]
    - [379, 163.94]
  - - [1408, 3584, 1, 128]
    - [323, 4290.22]
  - - [256, 2944, 1, 3328]
    - [345, 7620.99]
  - - [448, 3584, 1, 128]
    - [323, 3353.9]
  - - [5888, 2944, 1, 1280]
    - [333, 9498.31]
  - - [4, 6784, 1, 1280]
    - [283, 623.916]
  - - [2368, 5888, 1, 128]
    - [322, 4840.29]
  - - [35, 8457, 1, 1760]
    - [229, 4059.88]
  - - [64, 2944, 1, 128]
    - [240, 1310.82]
  - - [2368, 4, 1, 256]
    - [374, 369.739]
  - - [3584, 5888, 1, 256]
    - [351, 7996.33]
  - - [2368, 1024, 1, 128]
    - [317, 3915.07]
  - - [2368, 704, 1, 128]
    - [317, 3658.97]
  - - [512, 32, 1, 512]
    - [306, 1127.6]
  - - [3584, 2368, 1, 128]
    - [317, 4462.48]
  - - [5056, 704, 1, 128]
    - [316, 4062.21]
  - - [448, 2368, 1, 128]
    - [317, 2829.07]
  - - [4, 5056, 1, 256]
    - [265, 425.868]
  - - [5056, 1408, 1, 3328]
    - [350, 8848.92]
  - - [1408, 704, 1, 256]
    - [345, 5394.56]
  - - [6784, 1024, 1, 3328]
    - [332, 9232.02]
  - - [6784, 2944, 1, 3328]
    - [343, 8714.84]
  - - [7680, 1, 1, 2560]
    - [279, 248.845]
  - - [1856, 1856, 1, 256]
    - [344, 7586.58]
  - - [64, 64, 1, 3328]
    - [314, 1363.25]
  - - [512, 1, 1, 512]
    - [228, 43.2158]
  - - [6784, 2368, 1, 1280]
    - [345, 8665.74]
  - - [4608, 2, 1, 1536]
    - [228, 452.65]
  - - [4288, 3584, 1, 256]
    - [353, 8936.7]
  - - [4288, 5888, 1, 1280]
    - [350, 8957.15]
  - - [4608, 4, 1, 1536]
    - [221, 846.737]
  - - [1024, 6000, 1, 1536]
    - [343, 8398.54]
  - - [8448, 32, 1, 2816]
    - [303, 5343.07]
  - - [448, 2944, 1, 3328]
    - [350, 7247.04]
  - - [4288, 1856, 1, 1280]
    - [333, 8902.86]
  - - [1856, 2944, 1, 3328]
    - [345, 8622.86]
  - - [256, 6784, 1, 3328]
    - [345, 8050.77]
  - - [512, 3000, 1, 1536]
    - [366, 7108.12]
  - - [64, 5888, 1, 256]
    - [358, 3567.74]
  - - [256, 5056, 1, 128]
    - [325, 3041.12]
  - - [5056, 1024, 1, 256]
    - [349, 8401.47]
  - - [704, 64, 1, 3328]
    - [308, 4299.02]
  - - [5056, 1856, 1, 3328]
    - [353, 8660.77]
  - - [4, 2944, 1, 3328]
    - [283, 618.637]
  - - [512, 1500, 1, 2048]
    - [365, 5481.22]
  - - [1024, 1, 1, 500000]
    - [219, 260.061]
  - - [256, 4, 1, 256]
    - [283, 50.5123]
  - - [6784, 128, 1, 3328]
    - [337, 6950.91]
  - - [4288, 1408, 1, 128]
    - [317, 4539.58]
  - - [1856, 5888, 1, 3328]
    - [343, 8712.93]
  - - [4288, 5056, 1, 256]
    - [349, 8997.15]
  - - [1408, 128, 1, 1280]
    - [272, 4599.12]
  - - [4096, 7000, 1, 4096]
    - [339, 8555.89]
  - - [5056, 256, 1, 3328]
    - [345, 8257.16]
  - - [704, 704, 1, 256]
    - [335, 5852.39]
  - - [1024, 3000, 1, 2560]
    - [332, 8258.84]
  - - [1024, 5888, 1, 1280]
    - [332, 8988.99]
  - - [6784, 2368, 1, 128]
    - [318, 4562.25]
  - - [4, 5056, 1, 1280]
    - [283, 600.441]
  - - [256, 64, 1, 1280]
    - [306, 1899.69]
  - - [128, 1856, 1, 1280]
    - [345, 5185.76]
  - - [1856, 1024, 1, 1280]
    - [350, 7875.95]
  - - [6784, 4288, 1, 1280]
    - [353, 8981.18]
  - - [1856, 1856, 1, 1280]
    - [334, 7794.71]
  - - [35, 1500, 1, 2048]
    - [234, 2192.6]
  - - [3072, 24000, 1, 1024]
    - [346, 8690.58]
  - - [1408, 5056, 1, 1280]
    - [345, 8427.87]
  - - [4, 2368, 1, 3328]
    - [288, 594.422]
  - - [5888, 1856, 1, 128]
    - [317, 4294.05]
  - - [448, 704, 1, 1280]
    - [340, 4136.39]
  - - [448, 6784, 1, 128]
    - [318, 3976.2]
  - - [1024, 448, 1, 3328]
    - [350, 6376.33]
  - - [2944, 128, 1, 256]
    - [335, 4466.26]
  - - [5056, 3584, 1, 128]
    - [323, 4997.18]
  - - [5888, 5888, 1, 3328]
    - [353, 8870.37]
  - - [6784, 1024, 1, 256]
    - [332, 8520.53]
  - - [2944, 2368, 1, 256]
    - [369, 6174.59]
  - - [256, 448, 1, 256]
    - [345, 1844.33]
  - - [5056, 5888, 1, 3328]
    - [334, 8076.65]
  - - [1856, 1024, 1, 256]
    - [345, 7188.92]
  - - [512, 48000, 1, 1536]
    - [356, 7282.2]
  - - [3584, 448, 1, 1280]
    - [335, 6869.1]
  - - [1024, 1024, 1, 1280]
    - [345, 8027.45]
  - - [448, 5888, 1, 256]
    - [335, 5765.84]
  - - [2048, 128, 1, 2048]
    - [293, 4835.01]
  - - [1408, 6784, 1, 3328]
    - [345, 8613.76]
  - - [448, 1024, 1, 128]
    - [316, 2315.57]
  - - [4288, 704, 1, 128]
    - [317, 4138.92]
  - - [128, 1856, 1, 128]
    - [252, 1397.56]
  - - [448, 2368, 1, 3328]
    - [335, 6786.48]
  - - [5056, 64, 1, 128]
    - [317, 1664.84]
  - - [5056, 2944, 1, 256]
    - [368, 7697.49]
  - - [6784, 5888, 1, 128]
    - [317, 5003.67]
  - - [1024, 700, 1, 512]
    - [345, 6036.31]
  - - [3072, 1, 1, 128]
    - [299, 70.3171]
  - - [1024, 4, 1, 256]
    - [257, 154.302]
  - - [2944, 704, 1, 128]
    - [323, 3697.0]
  - - [128, 6784, 1, 1280]
    - [335, 6731.51]
  - - [1408, 3584, 1, 3328]
    - [333, 9258.07]
  - - [2368, 6784, 1, 256]
    - [332, 8840.4]
  - - [5056, 1408, 1, 1280]
    - [333, 9240.84]
  - - [5056, 4288, 1, 128]
    - [328, 4309.18]
  - - [4, 704, 1, 256]
    - [283, 130.697]
  - - [4288, 2368, 1, 3328]
    - [346, 8755.33]
  - - [1408, 1856, 1, 128]
    - [316, 3918.75]
  - - [1408, 5888, 1, 3328]
    - [353, 8910.47]
  - - [1856, 256, 1, 256]
    - [335, 5631.34]
  - - [6784, 6784, 1, 256]
    - [343, 9298.76]
  - - [5888, 5056, 1, 128]
    - [318, 4811.36]
  - - [4288, 2368, 1, 128]
    - [317, 4749.1]
  - - [128, 5888, 1, 1280]
    - [344, 6393.86]
  - - [256, 4288, 1, 1280]
    - [335, 6887.79]
  - - [2368, 2944, 1, 256]
    - [349, 8314.82]
  - - [4, 1856, 1, 256]
    - [372, 267.03]
  - - [3584, 1856, 1, 1280]
    - [333, 8631.91]
  - - [6784, 6784, 1, 128]
    - [323, 5059.96]
  - - [256, 1856, 1, 128]
    - [316, 1858.82]
  - - [49, 512, 64, 2048]
    - [387, 3053.67]
  - - [704, 64, 1, 1280]
    - [266, 2849.49]
  - - [5888, 5056, 1, 256]
    - [352, 8202.52]
  - - [8448, 48000, 1, 2816]
    - [343, 4281.94]
  - - [512, 6000, 1, 2048]
    - [335, 8047.89]
  - - [3584, 448, 1, 256]
    - [345, 6805.43]
  - - [448, 4288, 1, 128]
    - [323, 3500.83]
  - - [7680, 64, 1, 2560]
    - [278, 5957.9]
  - - [256, 6784, 1, 256]
    - [345, 7331.83]
  - - [1408, 4288, 1, 128]
    - [317, 4501.49]
  - - [2944, 704, 1, 3328]
    - [345, 8439.7]
  - - [128, 448, 1, 256]
    - [266, 1555.19]
  - - [2048, 32, 1, 2048]
    - [277, 3226.49]
  - - [3584, 3584, 1, 256]
    - [349, 8784.9]
  - - [448, 1408, 1, 128]
    - [316, 2535.92]
  - - [128, 256, 1, 1280]
    - [292, 2896.72]
  - - [3584, 5056, 1, 256]
    - [336, 8566.52]
  - - [6784, 128, 1, 256]
    - [335, 6053.97]
  - - [4288, 4, 1, 256]
    - [255, 428.9]
  - - [64, 1408, 1, 3328]
    - [260, 5025.11]
  - - [704, 448, 1, 256]
    - [359, 3409.74]
  - - [2944, 2368, 1, 1280]
    - [333, 9066.35]
  - - [448, 64, 1, 3328]
    - [308, 3528.96]
  - - [704, 6784, 1, 128]
    - [322, 4212.61]
  - - [3584, 4, 1, 3328]
    - [375, 658.353]
  - - [6784, 3584, 1, 256]
    - [343, 9061.84]
  - - [704, 448, 1, 128]
    - [322, 1552.8]
  - - [256, 128, 1, 128]
    - [247, 281.975]
  - - [704, 1408, 1, 128]
    - [322, 3026.76]
  - - [4, 448, 1, 128]
    - [371, 5.56127]
  - - [4288, 128, 1, 1280]
    - [302, 5471.64]
  - - [128, 1408, 1, 256]
    - [345, 2813.35]
  - - [4, 2944, 1, 256]
    - [265, 316.766]
  - - [64, 128, 1, 3328]
    - [313, 1872.56]
  - - [1856, 1408, 1, 256]
    - [335, 7735.89]
  - - [5056, 2368, 1, 128]
    - [317, 4830.19]
  - - [2944, 2944, 1, 3328]
    - [353, 8890.11]
  - - [5056, 6784, 1, 256]
    - [343, 9015.25]
  - - [1856, 3584, 1, 128]
    - [324, 4455.12]
  - - [5888, 4, 1, 1280]
    - [373, 642.063]
  - - [128, 2944, 1, 128]
    - [242, 2037.03]
  - - [35, 8457, 1, 2560]
    - [230, 3988.23]
  - - [3584, 6784, 1, 128]
    - [317, 4774.54]
  - - [128, 4288, 1, 256]
    - [335, 4851.85]
  - - [704, 448, 1, 3328]
    - [350, 4432.63]
  - - [2368, 6784, 1, 1280]
    - [333, 9161.48]
  - - [128, 128, 1, 3328]
    - [307, 2839.99]
  - - [5056, 1856, 1, 256]
    - [349, 8380.94]
  - - [256, 128, 1, 256]
    - [291, 1165.18]
  - - [1024, 3000, 1, 2816]
    - [350, 8714.27]
  - - [1024, 1856, 1, 256]
    - [340, 7014.79]
  - - [64, 1, 1, 1216]
    - [313, 11.8205]
  - - [4288, 64, 1, 128]
    - [244, 1669.65]
  - - [256, 448, 1, 3328]
    - [268, 5152.39]
  - - [1408, 6784, 1, 1280]
    - [353, 8735.22]
  - - [3584, 3584, 1, 1280]
    - [350, 9020.09]
  - - [7680, 24000, 1, 2560]
    - [353, 6940.24]
  - - [64, 2368, 1, 1280]
    - [263, 4433.07]
  - - [448, 2368, 1, 1280]
    - [338, 5352.92]
  - - [4608, 48000, 1, 1536]
    - [332, 8129.11]
  - - [5888, 5888, 1, 128]
    - [325, 4700.91]
  - - [64, 6784, 1, 3328]
    - [335, 6170.82]
  - - [2944, 256, 1, 1280]
    - [365, 6177.65]
  - - [2048, 16, 1, 2048]
    - [287, 2167.7]
  - - [256, 2368, 1, 128]
    - [316, 2037.77]
  - - [5056, 2368, 1, 3328]
    - [333, 9040.6]
  - - [2944, 4288, 1, 256]
    - [364, 7552.22]
  - - [1408, 3584, 1, 1280]
    - [340, 8808.76]
  - - [2368, 64, 1, 256]
    - [276, 2320.51]
  - - [1024, 128, 1, 128]
    - [236, 1075.56]
  - - [704, 128, 1, 3328]
    - [269, 4985.02]
  - - [5888, 4, 1, 128]
    - [370, 33.6558]
  - - [1856, 704, 1, 256]
    - [345, 7110.98]
  - - [1024, 1500, 1, 2816]
    - [340, 8499.88]
  - - [8448, 1, 1, 2816]
    - [223, 251.469]
  - - [1024, 4, 1, 3328]
    - [379, 541.032]
  - - [1024, 6000, 1, 2048]
    - [340, 8698.59]
  - - [512, 24000, 1, 2560]
    - [333, 8963.7]
  - - [6144, 3000, 1, 2560]
    - [356, 8761.97]
  - - [2368, 6784, 1, 3328]
    - [350, 8867.49]
  - - [1856, 1408, 1, 1280]
    - [337, 7908.53]
  - - [1856, 448, 1, 1280]
    - [350, 6544.01]
  - - [6784, 704, 1, 128]
    - [316, 4086.45]
  - - [4, 4, 1, 256]
    - [283, 0.852941]
  - - [128, 5888, 1, 128]
    - [240, 2582.25]
  - - [5056, 2944, 1, 128]
    - [320, 4579.17]
  - - [1408, 5888, 1, 256]
    - [332, 8810.77]
  - - [704, 2944, 1, 1280]
    - [347, 8420.9]
  - - [4288, 64, 1, 1280]
    - [272, 4906.15]
  - - [256, 64, 1, 256]
    - [274, 689.953]
  - - [1024, 1024, 1, 256]
    - [350, 5528.01]
  - - [704, 1856, 1, 256]
    - [334, 4452.92]
  - - [2560, 64, 1, 2560]
    - [263, 4563.09]
  - - [3584, 704, 1, 1280]
    - [340, 7898.77]
  - - [256, 128, 1, 1280]
    - [292, 2865.06]
  - - [5888, 2368, 1, 256]
    - [339, 8628.37]
  - - [256, 2368, 1, 1280]
    - [335, 6073.57]
  - - [2944, 6784, 1, 128]
    - [316, 4756.77]
  - - [3584, 448, 1, 3328]
    - [335, 7265.07]
  - - [1408, 4, 1, 256]
    - [376, 234.157]
  - - [704, 2368, 1, 3328]
    - [333, 7248.98]
  - - [2944, 448, 1, 256]
    - [340, 6365.89]
  - - [1856, 448, 1, 128]
    - [318, 2976.34]
  - - [4608, 6000, 1, 1536]
    - [353, 9469.42]
  - - [2368, 128, 1, 1280]
    - [302, 4773.39]
  - - [256, 5888, 1, 128]
    - [317, 3112.0]
  - - [64, 6784, 1, 256]
    - [335, 3755.14]
  - - [64, 5056, 1, 1280]
    - [296, 4935.6]
  - - [4, 6784, 1, 128]
    - [371, 111.142]
  - - [3025, 64, 64, 64]
    - [385, 6643.75]
  - - [2944, 2944, 1, 1280]
    - [333, 8869.55]
  - - [5056, 448, 1, 3328]
    - [366, 6706.2]
  - - [4, 3584, 1, 1280]
    - [283, 573.54]
  - - [1408, 128, 1, 128]
    - [235, 1293.19]
  - - [6784, 704, 1, 3328]
    - [350, 8368.33]
  - - [128, 64, 1, 1280]
    - [309, 1260.41]
  - - [2368, 256, 1, 1280]
    - [335, 6154.47]
  - - [4, 448, 1, 3328]
    - [288, 351.738]
  - - [5888, 4288, 1, 128]
    - [317, 4340.99]
  - - [4, 5888, 1, 256]
    - [265, 428.318]
  - - [1408, 2944, 1, 3328]
    - [332, 9400.85]
  - - [3584, 704, 1, 128]
    - [319, 3392.55]
  - - [64, 1024, 1, 256]
    - [266, 1762.41]
  - - [2368, 448, 1, 1280]
    - [359, 5972.58]
  - - [128, 3584, 1, 256]
    - [335, 5224.32]
  - - [704, 448, 1, 1280]
    - [335, 4566.86]
  - - [448, 5056, 1, 128]
    - [317, 3876.19]
  - - [6144, 4, 1, 2560]
    - [259, 948.751]
  - - [5056, 3584, 1, 256]
    - [349, 8162.56]
  - - [4288, 4288, 1, 256]
    - [356, 7653.34]
  - - [1408, 5056, 1, 128]
    - [323, 4554.34]
  - - [2944, 3584, 1, 128]
    - [329, 4147.0]
  - - [3584, 2368, 1, 256]
    - [350, 8195.05]
  - - [5888, 5056, 1, 1280]
    - [349, 9413.43]
  - - [128, 1024, 1, 1280]
    - [302, 4433.83]
  - - [8448, 24000, 1, 2816]
    - [343, 5227.12]
  - - [64, 704, 1, 256]
    - [266, 1441.89]
  - - [4288, 256, 1, 1280]
    - [365, 5687.8]
  - - [3584, 3584, 1, 3328]
    - [340, 9183.63]
  - - [704, 64, 1, 128]
    - [244, 402.835]
  - - [3072, 1500, 1, 128]
    - [339, 7395.08]
  - - [2048, 3136, 1, 512]
    - [381, 8447.3]
  - - [3025, 256, 64, 64]
    - [389, 8063.79]
  - - [5888, 6784, 1, 256]
    - [333, 9282.01]
  - - [4288, 2944, 1, 3328]
    - [333, 9153.87]
  - - [2944, 64, 1, 128]
    - [250, 1463.53]
  - - [1024, 128, 1, 3328]
    - [300, 5377.41]
  - - [1024, 16, 1, 500000]
    - [216, 3997.13]
  - - [4288, 128, 1, 3328]
    - [304, 6053.31]
  - - [7680, 128, 1, 2560]
    - [350, 7769.24]
  - - [256, 5056, 1, 1280]
    - [359, 7200.84]
  - - [1408, 256, 1, 128]
    - [327, 1671.74]
  - - [2944, 5888, 1, 3328]
    - [339, 8642.18]
  - - [6784, 5888, 1, 1280]
    - [353, 8871.15]
  - - [3072, 1, 1, 1024]
    - [299, 205.972]
  - - [704, 128, 1, 256]
    - [262, 1935.39]
  - - [5888, 4288, 1, 1280]
    - [340, 9176.7]
  - - [1024, 24000, 1, 2048]
    - [339, 8667.79]
  - - [448, 256, 1, 1280]
    - [272, 4327.95]
  - - [5888, 3584, 1, 128]
    - [317, 4669.45]
  - - [64, 4288, 1, 3328]
    - [297, 5375.04]
  - - [448, 4, 1, 1280]
    - [288, 289.716]
  - - [6784, 6784, 1, 3328]
    - [346, 8306.73]
  - - [5056, 4, 1, 1280]
    - [258, 607.199]
  - - [4, 5888, 1, 3328]
    - [283, 651.538]
  - - [256, 1408, 1, 1280]
    - [335, 5177.09]
  - - [3072, 16, 1, 1024]
    - [294, 2207.63]
  - - [704, 3584, 1, 128]
    - [327, 3653.51]
  - - [1024, 2, 1, 512]
    - [314, 156.138]
  - - [5888, 448, 1, 3328]
    - [335, 7896.85]
  - - [2368, 4288, 1, 1280]
    - [332, 8517.63]
  - - [4288, 2944, 1, 128]
    - [321, 4439.26]
  - - [256, 64, 1, 3328]
    - [307, 2704.76]
  - - [2944, 64, 1, 3328]
    - [272, 5647.15]
  - - [6784, 64, 1, 3328]
    - [345, 6434.61]
  - - [5056, 2944, 1, 3328]
    - [356, 8497.2]
  - - [448, 128, 1, 256]
    - [274, 1516.64]
  - - [2944, 3584, 1, 256]
    - [350, 8365.83]
  - - [1408, 1408, 1, 3328]
    - [333, 8440.42]
  - - [1856, 128, 1, 1280]
    - [335, 5242.93]
  - - [3584, 3584, 1, 128]
    - [317, 4385.94]
  - - [64, 3584, 1, 256]
    - [335, 3276.9]
  - - [1408, 4, 1, 3328]
    - [258, 605.504]
  - - [128, 2944, 1, 3328]
    - [303, 6295.75]
  - - [3584, 704, 1, 256]
    - [340, 7711.64]
  - - [2944, 448, 1, 3328]
    - [351, 6503.97]
  - - [1024, 2, 1, 500000]
    - [220, 521.803]
  - - [3584, 1408, 1, 3328]
    - [342, 8296.2]
  - - [704, 3584, 1, 1280]
    - [347, 7670.65]
  - - [1024, 1408, 1, 128]
    - [322, 2830.61]
  - - [1856, 6784, 1, 256]
    - [353, 8149.67]
  - - [4288, 448, 1, 3328]
    - [334, 7406.44]
  - - [6784, 4288, 1, 128]
    - [329, 4418.09]
  - - [6784, 704, 1, 1280]
    - [350, 8302.45]
  - - [6144, 1, 1, 2560]
    - [259, 243.427]
  - - [3584, 6784, 1, 256]
    - [332, 9036.59]
  - - [6144, 16, 1, 2560]
    - [266, 3266.69]
  - - [3584, 64, 1, 128]
    - [250, 1555.19]
  - - [5888, 1024, 1, 3328]
    - [340, 8888.08]
  - - [448, 64, 1, 128]
    - [236, 248.074]
  - - [704, 6784, 1, 1280]
    - [336, 7892.56]
  - - [4, 448, 1, 256]
    - [258, 70.8951]
  - - [196, 1024, 64, 256]
    - [384, 6630.86]
  - - [5888, 128, 1, 256]
    - [334, 5715.09]
  - - [4096, 16, 1, 4096]
    - [280, 3251.5]
  - - [1856, 5056, 1, 3328]
    - [349, 8740.27]
  - - [4, 6784, 1, 256]
    - [372, 360.412]
  - - [1024, 3584, 1, 128]
    - [317, 3456.27]
  - - [64, 704, 1, 3328]
    - [285, 3817.47]
  - - [2368, 2944, 1, 128]
    - [323, 4605.47]
  - - [5056, 64, 1, 256]
    - [335, 3863.79]
  - - [512, 1500, 1, 1536]
    - [335, 6801.56]
  - - [512, 1, 1, 500000]
    - [224, 261.068]
  - - [5888, 2944, 1, 3328]
    - [339, 8501.88]
  - - [128, 3584, 1, 1280]
    - [340, 5938.64]
  - - [1024, 704, 1, 128]
    - [326, 2172.29]
  - - [1408, 2368, 1, 128]
    - [322, 4023.2]
  - - [5888, 2368, 1, 128]
    - [323, 4424.62]
  - - [128, 5056, 1, 3328]
    - [335, 6692.16]
  - - [3584, 6784, 1, 1280]
    - [333, 9488.64]
  - - [4288, 1856, 1, 256]
    - [343, 8287.52]
  - - [1856, 5888, 1, 256]
    - [354, 7707.83]
  - - [256, 256, 1, 256]
    - [301, 1613.29]
  - - [4288, 4288, 1, 3328]
    - [343, 8923.59]
  - - [1024, 1024, 1, 128]
    - [323, 2553.71]
  - - [4288, 1408, 1, 1280]
    - [343, 8930.47]
  - - [3584, 5056, 1, 128]
    - [327, 4495.15]
  - - [4, 1024, 1, 3328]
    - [283, 415.694]
  - - [4, 704, 1, 128]
    - [371, 13.9634]
  - - [4288, 2368, 1, 256]
    - [368, 7135.08]
  - - [2944, 5056, 1, 1280]
    - [340, 9118.61]
  - - [448, 6784, 1, 256]
    - [364, 5430.31]
  - - [64, 128, 1, 128]
    - [247, 83.057]
  - - [1856, 2368, 1, 128]
    - [323, 4422.75]
  - - [6784, 2368, 1, 3328]
    - [336, 8769.4]
  - - [1408, 6784, 1, 128]
    - [323, 4739.0]
  - - [256, 1024, 1, 1280]
    - [345, 5722.21]
  - - [704, 4, 1, 128]
    - [371, 8.66578]
  - - [1408, 4, 1, 128]
    - [371, 26.1439]
  - - [4288, 128, 1, 256]
    - [345, 4865.38]
  - - [4288, 1856, 1, 3328]
    - [332, 9250.04]
  - - [3584, 448, 1, 128]
    - [323, 3029.59]
  - - [64, 4288, 1, 128]
    - [240, 1535.38]
  - - [64, 448, 1, 3328]
    - [310, 3457.36]
  - - [448, 4, 1, 3328]
    - [288, 367.328]
  - - [256, 4, 1, 3328]
    - [379, 320.389]
  - - [4, 1408, 1, 1280]
    - [376, 344.039]
  - - [3584, 64, 1, 1280]
    - [264, 5191.07]
  - - [1408, 448, 1, 128]
    - [324, 2218.24]
  - - [3584, 1024, 1, 1280]
    - [346, 8253.11]
  - - [1856, 5056, 1, 256]
    - [364, 7552.55]
  - - [4, 3584, 1, 256]
    - [283, 325.456]
  - - [6784, 4288, 1, 3328]
    - [339, 8655.34]
  - - [4, 2944, 1, 1280]
    - [283, 547.821]
  - - [1024, 4288, 1, 256]
    - [340, 7788.83]
  - - [5888, 3584, 1, 3328]
    - [343, 9173.39]
  - - [1856, 4, 1, 256]
    - [374, 282.919]
  - - [4, 256, 1, 256]
    - [283, 49.7485]
  - - [5056, 3584, 1, 3328]
    - [349, 8457.53]
  - - [1408, 128, 1, 3328]
    - [303, 5714.52]
  - - [4, 64, 1, 1280]
    - [379, 42.7667]
  - - [2368, 1408, 1, 1280]
    - [340, 8224.92]
  - - [5056, 2944, 1, 1280]
    - [332, 9295.13]
  - - [8448, 6000, 1, 2816]
    - [336, 8037.97]
  - - [4, 4, 1, 128]
    - [371, 0.1433898]
  - - [3584, 256, 1, 256]
    - [335, 6116.79]
  - - [3584, 2944, 1, 1280]
    - [332, 8796.49]
  - - [1024, 6784, 1, 256]
    - [339, 8187.86]
  - - [4, 128, 1, 256]
    - [283, 30.4407]
  - - [6784, 448, 1, 256]
    - [335, 7862.3]
  - - [5124, 9124, 1, 2048]
    - [337, 8176.41]
  - - [2944, 5056, 1, 3328]
    - [332, 9328.34]
  - - [6784, 4, 1, 128]
    - [370, 204.9]
  - - [2944, 1408, 1, 128]
    - [321, 3838.2]
  - - [448, 128, 1, 3328]
    - [286, 4632.16]
  - - [64, 2944, 1, 3328]
    - [303, 5663.47]
  - - [5056, 6784, 1, 3328]
    - [339, 8420.17]
  - - [704, 2368, 1, 128]
    - [323, 3321.79]
  - - [3072, 1500, 1, 1024]
    - [340, 8221.77]
  - - [128, 2944, 1, 256]
    - [335, 4550.52]
  - - [128, 6784, 1, 128]
    - [240, 2767.76]
  - - [3584, 4288, 1, 256]
    - [339, 8808.64]
  - - [448, 1856, 1, 256]
    - [344, 5166.63]
  - - [1856, 6784, 1, 3328]
    - [336, 8339.76]
  - - [3584, 128, 1, 3328]
    - [345, 6791.57]
  - - [64, 1856, 1, 256]
    - [267, 2210.03]
  - - [64, 448, 1, 256]
    - [299, 1008.35]
  - - [5888, 4288, 1, 256]
    - [339, 8869.63]
  - - [128, 1500, 1, 1280]
    - [296, 4733.54]
  - - [5056, 1408, 1, 256]
    - [337, 7523.31]
  - - [35, 8457, 1, 4096]
    - [230, 4023.17]
  - - [64, 256, 1, 1280]
    - [291, 1941.91]
  - - [2944, 4, 1, 128]
    - [370, 95.7426]
  - - [3584, 1024, 1, 256]
    - [362, 6553.68]
  - - [512, 6000, 1, 1536]
    - [336, 7357.25]
  - - [256, 704, 1, 256]
    - [335, 2912.81]
  - - [5888, 5888, 1, 256]
    - [346, 8802.7]
  - - [4288, 1024, 1, 1280]
    - [339, 8248.83]
  - - [5888, 128, 1, 3328]
    - [289, 6848.59]
  - - [448, 6784, 1, 3328]
    - [335, 8343.78]
  - - [2944, 1408, 1, 1280]
    - [332, 9229.48]
  - - [3072, 6000, 1, 1024]
    - [353, 9015.01]
  - - [1024, 32, 1, 512]
    - [274, 1498.07]
  - - [2944, 1856, 1, 3328]
    - [349, 7176.48]
  - - [2368, 64, 1, 128]
    - [240, 1206.48]
  - - [256, 1024, 1, 128]
    - [317, 1178.28]
  - - [3584, 5888, 1, 1280]
    - [339, 9023.58]
  - - [64, 4, 1, 128]
    - [371, 1.089372]
  - - [6784, 1856, 1, 1280]
    - [333, 8964.51]
  - - [2944, 5056, 1, 256]
    - [339, 8860.12]
  - - [5888, 256, 1, 3328]
    - [350, 8308.66]
  - - [2944, 4288, 1, 128]
    - [318, 4507.61]
  - - [3584, 1408, 1, 256]
    - [333, 8234.71]
  - - [704, 3584, 1, 3328]
    - [345, 7377.26]
  - - [5056, 448, 1, 1280]
    - [334, 7145.47]
  - - [3584, 1856, 1, 3328]
    - [350, 8954.81]
  - - [64, 1408, 1, 128]
    - [247, 731.974]
  - - [4288, 6784, 1, 1280]
    - [339, 9166.55]
  - - [1024, 3000, 1, 2048]
    - [350, 7723.83]
  - - [1408, 704, 1, 1280]
    - [340, 7863.1]
  - - [2944, 1024, 1, 256]
    - [333, 5035.02]
  - - [256, 64, 1, 128]
    - [239, 150.757]
  - - [2368, 4288, 1, 3328]
    - [337, 8568.84]
  - - [4, 1408, 1, 256]
    - [283, 219.885]
  - - [1024, 1408, 1, 1280]
    - [365, 6761.13]
  - - [64, 64, 1, 256]
    - [265, 198.694]
  - - [704, 256, 1, 3328]
    - [335, 4291.62]
  - - [6784, 5056, 1, 256]
    - [334, 8545.02]
  - - [1856, 1856, 1, 128]
    - [322, 4034.93]
  - - [4288, 5888, 1, 256]
    - [353, 8998.05]
  - - [4, 704, 1, 3328]
    - [288, 452.4]
  - - [35, 8457, 1, 2048]
    - [231, 3375.37]
  - - [448, 2944, 1, 256]
    - [335, 6346.74]
  - - [4, 4288, 1, 3328]
    - [288, 630.978]
  - - [2944, 6784, 1, 256]
    - [362, 8002.92]
  - - [2944, 2944, 1, 128]
    - [317, 4661.41]
  - - [4, 4, 1, 1280]
    - [288, 3.14762]
  - - [1856, 3584, 1, 1280]
    - [332, 8677.66]
  - - [64, 2944, 1, 256]
    - [335, 2926.95]
  - - [3584, 1408, 1, 1280]
    - [346, 8238.9]
  - - [448, 256, 1, 128]
    - [247, 1042.72]
  - - [4288, 448, 1, 128]
    - [323, 3698.82]
  - - [5056, 256, 1, 1280]
    - [340, 7058.5]
  - - [1856, 1408, 1, 3328]
    - [337, 8348.35]
  - - [128, 128, 1, 128]
    - [247, 145.736]
  - - [1024, 4288, 1, 3328]
    - [333, 8042.61]
  - - [448, 2368, 1, 256]
    - [345, 5935.0]
  - - [1024, 4, 1, 128]
    - [371, 15.93]
  - - [64, 1408, 1, 1280]
    - [269, 3865.49]
  - - [64, 6784, 1, 1280]
    - [365, 5629.61]
  - - [5056, 448, 1, 256]
    - [335, 7637.91]
  - - [2944, 2368, 1, 3328]
    - [343, 9112.44]
  - - [704, 4288, 1, 3328]
    - [335, 7950.2]
  - - [1408, 128, 1, 256]
    - [335, 2898.17]
  - - [1024, 1856, 1, 1280]
    - [333, 8087.51]
  - - [6784, 1856, 1, 256]
    - [364, 7538.25]
  - - [512, 48000, 1, 2816]
    - [332, 9704.21]
  - - [512, 3000, 1, 2816]
    - [334, 7621.63]
  - - [128, 2368, 1, 3328]
    - [297, 6038.94]
  - - [1024, 5888, 1, 256]
    - [349, 8185.82]
  - - [64, 2944, 1, 1280]
    - [296, 4540.24]
  - - [6784, 1408, 1, 256]
    - [349, 8574.0]
  - - [5056, 64, 1, 3328]
    - [297, 6310.97]
  - - [128, 704, 1, 128]
    - [236, 696.618]
  - - [1408, 2368, 1, 256]
    - [335, 4995.06]
  - - [1408, 1408, 1, 256]
    - [332, 7552.34]
  - - [4, 64, 1, 128]
    - [370, 1.90441]
  - - [64, 128, 1, 1280]
    - [309, 1272.64]
  - - [1024, 8, 1, 500000]
    - [217, 2013.23]
  - - [4, 2368, 1, 128]
    - [371, 49.9526]
  - - [2368, 2368, 1, 128]
    - [322, 4483.8]
  - - [64, 5888, 1, 128]
    - [239, 1957.67]
  - - [5888, 4, 1, 3328]
    - [372, 638.798]
  - - [6784, 1408, 1, 128]
    - [317, 4715.61]
  - - [1408, 5056, 1, 256]
    - [349, 8557.67]
  - - [512, 50176, 1, 128]
    - [380, 8809.39]
  - - [5056, 128, 1, 3328]
    - [272, 6810.66]
  - - [128, 128, 1, 1280]
    - [306, 1899.69]
  - - [512, 2, 1, 512]
    - [226, 87.4813]
  - - [448, 704, 1, 256]
    - [345, 3765.97]
  - - [4288, 3584, 1, 128]
    - [330, 4563.77]
  - - [2944, 128, 1, 3328]
    - [272, 6507.45]
  - - [128, 5056, 1, 1280]
    - [335, 6557.85]
  - - [3584, 5056, 1, 1280]
    - [332, 9407.93]
  - - [256, 448, 1, 1280]
    - [296, 4096.1]
  - - [704, 704, 1, 128]
    - [322, 2374.31]
  - - [5056, 4, 1, 128]
    - [370, 125.52]
  - - [704, 256, 1, 1280]
    - [345, 4016.23]
  - - [64, 2368, 1, 3328]
    - [302, 5159.29]
  - - [1856, 1024, 1, 128]
    - [322, 3356.47]
  - - [1856, 64, 1, 128]
    - [239, 945.644]
  - - [4096, 64, 1, 4096]
    - [305, 6260.24]
  - - [1024, 24000, 1, 1536]
    - [349, 9368.5]
  - - [704, 4288, 1, 256]
    - [346, 7329.39]
  - - [5888, 2368, 1, 1280]
    - [335, 8624.71]
  - - [6784, 1856, 1, 3328]
    - [339, 9012.45]
  - - [64, 128, 1, 256]
    - [265, 374.591]
  - - [2368, 5888, 1, 1280]
    - [333, 9045.76]
  - - [5888, 256, 1, 1280]
    - [350, 7999.17]
  - - [4, 5888, 1, 1280]
    - [283, 615.839]
  - - [704, 128, 1, 128]
    - [239, 693.269]
  - - [1024, 4, 1, 1280]
    - [378, 372.464]
  - - [2368, 1856, 1, 3328]
    - [350, 8246.91]
  - - [2368, 128, 1, 128]
    - [240, 1963.53]
  - - [2944, 704, 1, 256]
    - [350, 7116.24]
  - - [5056, 128, 1, 128]
    - [243, 2519.49]
  - - [2368, 1024, 1, 3328]
    - [335, 7959.13]
  - - [35, 700, 1, 2048]
    - [231, 1766.86]
  - - [256, 704, 1, 3328]
    - [335, 4296.56]
  - - [704, 3584, 1, 256]
    - [334, 7441.61]
  - - [704, 2944, 1, 3328]
    - [351, 7195.81]
  - - [6784, 1024, 1, 128]
    - [322, 4509.18]
  - - [256, 448, 1, 128]
    - [247, 838.003]
  - - [448, 1024, 1, 3328]
    - [345, 6515.65]
  - - [2944, 1024, 1, 3328]
    - [340, 8751.63]
  - - [2944, 5056, 1, 128]
    - [317, 4799.73]
  - - [2368, 256, 1, 256]
    - [334, 4754.67]
  - - [1408, 6784, 1, 256]
    - [362, 7477.09]
  - - [6784, 1408, 1, 3328]
    - [340, 8968.57]
  - - [4288, 6784, 1, 128]
    - [315, 4455.74]
  - - [1408, 2944, 1, 128]
    - [327, 3862.79]
  - - [704, 64, 1, 256]
    - [266, 1441.89]
  - - [3072, 4, 1, 1024]
    - [284, 711.803]
  - - [256, 2368, 1, 3328]
    - [359, 5199.73]
  - - [6784, 2944, 1, 1280]
    - [343, 8914.45]
  - - [4288, 1856, 1, 128]
    - [323, 4683.3]
  - - [1856, 2944, 1, 128]
    - [317, 4589.34]
  - - [6784, 448, 1, 128]
    - [317, 3918.53]
  - - [64, 3584, 1, 128]
    - [248, 1468.11]
  - - [448, 5056, 1, 1280]
    - [340, 7561.4]
  - - [4288, 5056, 1, 1280]
    - [332, 9304.11]
  - - [2368, 1856, 1, 128]
    - [322, 4322.17]
  - - [128, 448, 1, 1280]
    - [302, 3336.48]
  - - [4288, 704, 1, 256]
    - [345, 7834.65]
  - - [256, 3584, 1, 128]
    - [318, 2500.96]
  - - [5888, 704, 1, 256]
    - [364, 7244.49]
  - - [3584, 1024, 1, 128]
    - [329, 3169.03]
  - - [256, 5888, 1, 3328]
    - [350, 7763.47]
  - - [1408, 4288, 1, 3328]
    - [332, 9273.8]
  - - [6784, 4288, 1, 256]
    - [340, 8825.2]
  - - [4288, 256, 1, 128]
    - [319, 2621.54]
  - - [448, 1856, 1, 3328]
    - [360, 5859.8]
  - - [5888, 256, 1, 256]
    - [350, 7124.84]
  - - [1024, 4, 1, 500000]
    - [215, 1030.2]
  - - [6784, 1024, 1, 1280]
    - [332, 9083.11]
  - - [5888, 1024, 1, 128]
    - [319, 4297.16]
  - - [1024, 128, 1, 256]
    - [335, 2086.82]
  - - [512, 16, 1, 500000]
    - [216, 3921.96]
  - - [128, 64, 1, 3328]
    - [306, 1969.97]
  - - [448, 64, 1, 256]
    - [291, 1092.37]
  - - [2368, 256, 1, 128]
    - [322, 2174.84]
  - - [6784, 3584, 1, 1280]
    - [332, 9558.82]
  - - [1024, 6784, 1, 1280]
    - [341, 8637.72]
  - - [2944, 64, 1, 1280]
    - [263, 4770.13]
  - - [1408, 2944, 1, 1280]
    - [332, 9238.47]
  - - [256, 1856, 1, 256]
    - [358, 4498.43]
  - - [1408, 2368, 1, 3328]
    - [340, 8344.97]
  - - [2944, 4, 1, 3328]
    - [375, 661.209]
  - - [128, 1408, 1, 3328]
    - [303, 5641.42]
  - - [2944, 1856, 1, 128]
    - [317, 4488.04]
  - - [256, 2944, 1, 128]
    - [327, 2233.18]
  - - [256, 6784, 1, 128]
    - [316, 3139.9]
  - - [2368, 4, 1, 128]
    - [371, 38.7612]
  - - [1408, 256, 1, 3328]
    - [367, 4927.67]
  - - [1856, 4, 1, 128]
    - [371, 42.3719]
  - - [1024, 16, 1, 512]
    - [283, 1115.61]
  - - [5056, 6784, 1, 128]
    - [318, 4963.45]
  - - [4288, 5056, 1, 128]
    - [316, 4928.09]
  - - [1856, 5888, 1, 128]
    - [323, 4865.15]
  - - [7680, 2, 1, 2560]
    - [259, 499.612]
  - - [3584, 1856, 1, 256]
    - [349, 7978.38]
  - - [4288, 3584, 1, 1280]
    - [349, 7852.26]
  - - [2368, 448, 1, 256]
    - [364, 5238.93]
  - - [4288, 256, 1, 3328]
    - [335, 6751.34]
  - - [1856, 704, 1, 128]
    - [317, 3525.56]
  - - [1408, 64, 1, 256]
    - [276, 1884.8]
  - - [64, 1856, 1, 128]
    - [253, 888.205]
  - - [4, 256, 1, 128]
    - [370, 7.38178]
  - - [512, 16, 1, 512]
    - [283, 663.756]
  - - [704, 5888, 1, 128]
    - [317, 4424.55]
  - - [6784, 3584, 1, 128]
    - [319, 3823.4]
  - - [1024, 64, 1, 256]
    - [261, 1379.81]
  - - [64, 2368, 1, 256]
    - [335, 2424.93]
  - - [5124, 1500, 1, 2048]
    - [353, 8391.84]
  - - [4288, 5056, 1, 3328]
    - [339, 9274.14]
  - - [4, 1856, 1, 1280]
    - [283, 453.474]
  - - [4288, 128, 1, 128]
    - [317, 2157.8]
  - - [512, 2, 1, 500000]
    - [227, 516.895]
  - - [1408, 1408, 1, 128]
    - [318, 3600.49]
  - - [7680, 16, 1, 2560]
    - [298, 3542.59]
  - - [1856, 128, 1, 128]
    - [250, 1532.8]
  - - [5056, 2368, 1, 256]
    - [362, 7684.07]
  - - [4288, 704, 1, 3328]
    - [335, 7642.96]
  - - [448, 3584, 1, 256]
    - [345, 6734.07]
  - - [2368, 64, 1, 1280]
    - [296, 3962.24]
  - - [2368, 1024, 1, 1280]
    - [347, 7989.64]
  - - [2944, 1408, 1, 3328]
    - [350, 8954.66]
  - - [6144, 1500, 1, 2560]
    - [368, 8170.07]
  - - [4224, 1, 1, 128]
    - [299, 76.9]
  - - [1024, 1408, 1, 3328]
    - [365, 6961.38]
  - - [2944, 5888, 1, 1280]
    - [346, 8797.53]
  - - [8448, 2, 1, 2816]
    - [221, 496.958]
  - - [1408, 4, 1, 1280]
    - [376, 471.891]
  - - [5888, 3584, 1, 256]
    - [353, 8246.3]
  - - [2368, 5056, 1, 128]
    - [316, 4906.9]
  - - [1408, 1856, 1, 3328]
    - [340, 9006.8]
  - - [4, 4, 1, 3328]
    - [288, 5.83793]
  - - [5888, 5056, 1, 3328]
    - [353, 8545.1]
  - - [7680, 6000, 1, 2560]
    - [346, 7996.0]
  - - [6784, 1408, 1, 1280]
    - [340, 8888.13]
  - - [4, 1024, 1, 1280]
    - [288, 302.109]
  - - [512, 3000, 1, 2560]
    - [340, 7809.43]
  - - [704, 2944, 1, 256]
    - [345, 4909.24]
  - - [4288, 64, 1, 256]
    - [345, 3264.72]
  - - [6784, 5888, 1, 3328]
    - [353, 9544.52]
  - - [2368, 4288, 1, 128]
    - [316, 4873.03]
  - - [64, 4288, 1, 1280]
    - [302, 4656.42]
  - - [6784, 64, 1, 1280]
    - [335, 6230.43]
  - - [3584, 128, 1, 128]
    - [243, 2315.57]
  - - [1024, 6784, 1, 128]
    - [317, 3758.94]
  - - [1024, 1500, 1, 1536]
    - [366, 6972.0]
  - - [1408, 64, 1, 3328]
    - [269, 5079.58]
  - - [6784, 4, 1, 256]
    - [255, 487.938]
  - - [1408, 1408, 1, 1280]
    - [368, 7423.31]
  - - [256, 2368, 1, 256]
    - [335, 4986.9]
  - - [3072, 3000, 1, 1024]
    - [337, 7844.01]
  - - [448, 4288, 1, 3328]
    - [336, 7204.79]
  - - [2368, 1408, 1, 256]
    - [368, 5897.96]
  - - [704, 2368, 1, 256]
    - [335, 7000.93]
  - - [1024, 24000, 1, 2560]
    - [362, 8562.31]
  - - [2944, 448, 1, 1280]
    - [350, 7155.93]
  - - [5888, 2368, 1, 3328]
    - [349, 9252.42]
  - - [1024, 256, 1, 128]
    - [331, 1255.88]
  - - [5124, 9124, 1, 1760]
    - [343, 9168.49]
  - - [448, 1408, 1, 1280]
    - [335, 6150.34]
  - - [448, 1856, 1, 1280]
    - [350, 6489.76]
  - - [4288, 448, 1, 1280]
    - [365, 6887.02]
  - - [5888, 704, 1, 3328]
    - [345, 8230.64]
  - - [4, 1856, 1, 128]
    - [371, 27.0964]
  - - [5056, 256, 1, 128]
    - [316, 3469.01]
  - - [1856, 256, 1, 128]
    - [317, 2534.16]
  - - [128, 2368, 1, 256]
    - [335, 3660.22]
  - - [704, 4, 1, 256]
    - [283, 134.596]
  - - [1024, 6784, 1, 3328]
    - [337, 8482.75]
  - - [1408, 5888, 1, 128]
    - [317, 4644.52]
  - - [4288, 4, 1, 128]
    - [370, 35.8799]
  - - [512, 3136, 1, 2048]
    - [382, 6386.69]
  - - [1408, 1024, 1, 256]
    - [335, 5440.82]
  - - [128, 64, 1, 256]
    - [265, 380.019]
  - - [8448, 1500, 1, 2816]
    - [332, 9155.92]
  - - [256, 704, 1, 128]
    - [317, 895.623]
  - - [2560, 7000, 1, 2560]
    - [344, 8565.66]
  - - [5888, 64, 1, 1280]
    - [359, 5007.83]
  - - [128, 4, 1, 3328]
    - [378, 165.21]
  - - [5056, 6784, 1, 1280]
    - [343, 9331.48]
  - - [1024, 448, 1, 1280]
    - [345, 6501.46]
  - - [704, 5056, 1, 3328]
    - [332, 8090.13]
  - - [128, 5056, 1, 256]
    - [345, 5537.37]
  - - [3584, 5056, 1, 3328]
    - [341, 8633.24]
  - - [1856, 4, 1, 3328]
    - [379, 582.814]
  - - [4, 2944, 1, 128]
    - [370, 114.292]
  - - [2368, 2944, 1, 3328]
    - [349, 8749.55]
  - - [448, 448, 1, 1280]
    - [273, 4694.93]
  - - [128, 4, 1, 128]
    - [370, 4.94734]
  - - [2368, 3584, 1, 256]
    - [349, 8418.59]
  - - [4608, 3000, 1, 1536]
    - [339, 9076.47]
  - - [1024, 256, 1, 1280]
    - [345, 5562.84]
  - - [5056, 3584, 1, 1280]
    - [339, 8365.09]
  - - [5124, 9124, 1, 4096]
    - [349, 8648.58]
  - - [7680, 48000, 1, 2560]
    - [343, 4098.26]
  - - [1856, 704, 1, 1280]
    - [335, 8141.04]
  - - [1856, 2944, 1, 1280]
    - [337, 8214.4]
  - - [4608, 1500, 1, 1536]
    - [345, 8424.53]
  - - [1024, 48000, 1, 2816]
    - [336, 8513.18]
  - - [5124, 9124, 1, 2560]
    - [353, 8641.24]
  - - [128, 1024, 1, 256]
    - [267, 2356.45]
  - - [2944, 1408, 1, 256]
    - [349, 8254.29]
  - - [4288, 1408, 1, 3328]
    - [343, 9138.49]
  - - [3584, 64, 1, 3328]
    - [256, 5629.62]
  - - [5888, 2944, 1, 128]
    - [317, 4119.33]
  - - [2944, 1024, 1, 128]
    - [319, 4002.96]
  - - [128, 1, 1, 1024]
    - [313, 20.0805]
  - - [5124, 700, 1, 2048]
    - [350, 7653.84]
  - - [4, 4288, 1, 1280]
    - [283, 587.749]
  - - [6784, 5056, 1, 128]
    - [322, 4855.85]
  - - [256, 1024, 1, 3328]
    - [345, 6116.28]
  - - [3584, 4, 1, 256]
    - [257, 395.576]
  - - [1856, 64, 1, 3328]
    - [272, 5732.6]
  - - [4, 128, 1, 3328]
    - [378, 162.689]
  - - [256, 12544, 1, 1024]
    - [382, 7628.92]
  - - [5888, 1408, 1, 3328]
    - [343, 9524.43]
  - - [448, 2944, 1, 128]
    - [317, 3163.91]
  - - [2368, 1856, 1, 256]
    - [345, 8167.36]
  - - [256, 5056, 1, 256]
    - [335, 7292.13]
  - - [5056, 5056, 1, 128]
    - [323, 5043.99]
  - - [448, 3584, 1, 3328]
    - [340, 6839.56]
  - - [4, 5056, 1, 3328]
    - [288, 639.886]
  - - [256, 256, 1, 128]
    - [247, 554.902]
  - - [5888, 256, 1, 128]
    - [319, 3562.47]
  - - [4, 5056, 1, 128]
    - [370, 149.907]
  - - [448, 256, 1, 256]
    - [266, 2121.5]
  - - [704, 4, 1, 3328]
    - [376, 455.919]
  - - [1408, 256, 1, 256]
    - [335, 4352.68]
  - - [3584, 1856, 1, 128]
    - [326, 3933.23]
  - - [4288, 4288, 1, 128]
    - [317, 4888.61]
  - - [1856, 1024, 1, 3328]
    - [353, 8242.64]
  - - [1856, 4288, 1, 128]
    - [322, 4647.4]
  - - [1024, 6000, 1, 2560]
    - [347, 8526.75]
  - - [1024, 5056, 1, 256]
    - [332, 7343.83]
  - - [5056, 5888, 1, 128]
    - [321, 4053.5]
  - - [2368, 1408, 1, 3328]
    - [335, 8466.2]
  - - [1024, 48000, 1, 1536]
    - [353, 9487.74]
  - - [5888, 448, 1, 256]
    - [366, 6081.54]
  - - [5888, 6784, 1, 128]
    - [318, 4820.27]
  - - [2368, 4, 1, 3328]
    - [377, 620.628]
  - - [6784, 5056, 1, 1280]
    - [362, 8525.5]
  - - [5056, 704, 1, 1280]
    - [332, 7933.06]
  - - [1024, 48000, 1, 2560]
    - [353, 8877.94]
  - - [4608, 32, 1, 1536]
    - [282, 3556.83]
  - - [1024, 2368, 1, 128]
    - [325, 2943.75]
  - - [128, 704, 1, 256]
    - [266, 2059.8]
  - - [2368, 448, 1, 3328]
    - [345, 5290.42]
  - - [128, 5888, 1, 3328]
    - [345, 7764.43]
  - - [448, 128, 1, 1280]
    - [296, 3373.28]
  - - [6784, 4, 1, 3328]
    - [255, 676.063]
  - - [4288, 4, 1, 1280]
    - [288, 564.775]
  - - [1024, 64, 1, 3328]
    - [302, 4293.48]
  - - [3072, 48000, 1, 1024]
    - [352, 7826.51]
  - - [256, 4, 1, 128]
    - [371, 4.93304]
  - - [1024, 5888, 1, 128]
    - [330, 3610.46]
  - - [3584, 5888, 1, 128]
    - [318, 4722.35]
  - - [5056, 5888, 1, 256]
    - [353, 9159.11]
  - - [2368, 1024, 1, 256]
    - [345, 7482.71]
  - - [2944, 1856, 1, 256]
    - [349, 8209.0]
  - - [1856, 6784, 1, 1280]
    - [345, 8205.43]
  - - [64, 5056, 1, 128]
    - [240, 2079.35]
  - - [64, 6784, 1, 128]
    - [240, 2437.58]
  - - [448, 704, 1, 128]
    - [316, 1506.45]
  - - [4, 1024, 1, 128]
    - [371, 17.3463]
  - - [1408, 448, 1, 256]
    - [335, 5545.45]
  - - [1408, 704, 1, 128]
    - [321, 2931.65]
  - - [64, 256, 1, 3328]
    - [307, 2816.52]
  - - [8448, 3000, 1, 2816]
    - [341, 8872.99]
  - - [6784, 448, 1, 3328]
    - [335, 7555.48]
  - - [5056, 1856, 1, 1280]
    - [333, 8652.36]
  - - [1408, 1024, 1, 3328]
    - [337, 7781.42]
  - - [2368, 256, 1, 3328]
    - [341, 5392.06]
  - - [7680, 1500, 1, 2560]
    - [339, 8919.72]
  - - [5888, 3584, 1, 1280]
    - [339, 9235.85]
  - - [1856, 3584, 1, 3328]
    - [350, 8348.83]
  - - [5888, 128, 1, 1280]
    - [335, 5928.61]
  - - [1024, 2944, 1, 256]
    - [366, 6630.27]
  - - [448, 6784, 1, 1280]
    - [347, 8332.45]
  - - [256, 3584, 1, 1280]
    - [337, 7140.19]
  - - [448, 128, 1, 128]
    - [239, 552.813]
  - - [704, 5056, 1, 256]
    - [345, 7959.68]
  - - [3584, 1024, 1, 3328]
    - [337, 8386.84]
  - - [2944, 1856, 1, 1280]
    - [353, 7670.29]
  - - [128, 256, 1, 128]
    - [254, 258.37]
  - - [5056, 256, 1, 256]
    - [345, 5736.77]
  - - [2944, 4288, 1, 3328]
    - [332, 8730.8]
  - - [2368, 3584, 1, 3328]
    - [334, 8437.71]
  - - [2944, 704, 1, 1280]
    - [345, 8342.53]
  - - [128, 4, 1, 256]
    - [265, 24.9242]
  - - [2944, 3584, 1, 1280]
    - [347, 8322.11]
  - - [1856, 5888, 1, 1280]
    - [332, 8911.91]
  - - [256, 256, 1, 1280]
    - [296, 3653.67]
  - - [4608, 24000, 1, 1536]
    - [346, 8931.06]
  - - [4288, 1408, 1, 256]
    - [333, 8338.45]
  - - [3584, 64, 1, 256]
    - [345, 3414.07]
  - - [64, 1856, 1, 3328]
    - [272, 5460.23]
  - - [256, 1408, 1, 128]
    - [316, 1424.09]
  - - [5888, 1408, 1, 128]
    - [327, 4177.88]
  - - [4288, 2368, 1, 1280]
    - [336, 8596.05]
  - - [4, 4288, 1, 256]
    - [372, 370.954]
  - - [256, 4288, 1, 128]
    - [317, 2907.99]
  - - [256, 128, 1, 3328]
    - [310, 3644.88]
  - - [512, 8, 1, 500000]
    - [222, 2025.89]
  - - [6784, 2368, 1, 256]
    - [335, 8470.41]
  - - [5888, 128, 1, 128]
    - [240, 2604.55]
  - - [1408, 448, 1, 3328]
    - [345, 6540.62]
  - - [1024, 24000, 1, 2816]
    - [362, 8364.03]
  - - [704, 1024, 1, 1280]
    - [345, 7277.28]
  - - [1856, 256, 1, 3328]
    - [335, 7039.14]
  - - [1856, 2944, 1, 256]
    - [344, 8151.59]
  - - [5056, 1024, 1, 128]
    - [318, 4422.82]
  - - [64, 5888, 1, 1280]
    - [296, 4854.62]
  - - [7680, 3000, 1, 2560]
    - [349, 8789.57]
  - - [4224, 1500, 1, 176]
    - [345, 7902.14]
  - - [5124, 700, 1, 2560]
    - [335, 8232.59]
  - - [6784, 256, 1, 128]
    - [316, 3548.92]
  - - [5888, 704, 1, 128]
    - [323, 3959.65]
  - - [6784, 64, 1, 128]
    - [251, 2150.82]
  - - [4, 448, 1, 1280]
    - [376, 268.063]
  - - [1024, 4288, 1, 1280]
    - [350, 8363.72]
  - - [2368, 5056, 1, 3328]
    - [349, 8581.85]
  - - [448, 4, 1, 128]
    - [370, 16.8673]
  - - [4, 256, 1, 3328]
    - [379, 201.988]
  - - [4288, 1024, 1, 3328]
    - [345, 8567.72]
  - - [6144, 48000, 1, 2560]
    - [353, 3751.68]
  - - [1024, 5056, 1, 3328]
    - [332, 9440.66]
  - - [1024, 1856, 1, 3328]
    - [353, 8244.36]
  - - [704, 704, 1, 1280]
    - [345, 5529.99]
  - - [128, 2368, 1, 1280]
    - [302, 5062.38]
  - - [3584, 4, 1, 128]
    - [371, 61.5949]
  - - [3584, 256, 1, 1280]
    - [369, 6260.24]
  - - [4, 128, 1, 128]
    - [370, 1.2587]
  - - [128, 4288, 1, 3328]
    - [281, 6186.15]
  - - [5124, 1500, 1, 2560]
    - [349, 8432.62]
  - - [3584, 128, 1, 1280]
    - [335, 6547.85]
  - - [4, 256, 1, 1280]
    - [288, 180.144]
  - - [128, 704, 1, 3328]
    - [260, 5177.81]
  - - [4288, 6784, 1, 256]
    - [333, 9005.34]
  - - [3584, 2944, 1, 3328]
    - [350, 8872.27]
  - - [128, 1856, 1, 256]
    - [335, 3690.48]
  - - [64, 4288, 1, 256]
    - [335, 3007.57]
  - - [4, 3584, 1, 3328]
    - [265, 639.99]
  - - [64, 4, 1, 3328]
    - [379, 98.7074]
  - - [4, 64, 1, 3328]
    - [379, 91.9069]
  - - [35, 700, 1, 2560]
    - [233, 2397.65]
  - - [5888, 2944, 1, 256]
    - [343, 9031.28]
  - - [4, 2368, 1, 256]
    - [283, 256.968]
  - - [1856, 64, 1, 256]
    - [267, 2222.96]
  - - [5056, 128, 1, 1280]
    - [335, 6557.85]
  - - [448, 4288, 1, 1280]
    - [359, 6891.66]
  - - [256, 4288, 1, 256]
    - [335, 6250.51]
  - - [1024, 4288, 1, 128]
    - [319, 3951.41]
  - - [4, 1024, 1, 256]
    - [283, 182.144]
  - - [5056, 4288, 1, 256]
    - [339, 8933.43]
  - - [1024, 448, 1, 256]
    - [345, 4573.33]
  - - [1024, 3584, 1, 256]
    - [340, 7447.18]
  - - [2944, 128, 1, 1280]
    - [345, 5417.27]
  - - [49, 2048, 64, 512]
    - [388, 5916.91]
  - - [2560, 32, 1, 2560]
    - [282, 4076.99]
  - - [64, 256, 1, 256]
    - [299, 689.953]
  - - [1024, 4, 1, 512]
    - [291, 288.17]
  - - [128, 2368, 1, 128]
    - [245, 1809.68]
  - - [256, 704, 1, 1280]
    - [335, 4033.08]
  - - [64, 2368, 1, 128]
    - [236, 1165.88]
  - - [176, 1500, 1, 1408]
    - [263, 4922.13]
  - - [448, 5888, 1, 1280]
    - [345, 7550.21]
  - - [512, 3000, 1, 2048]
    - [367, 6562.44]
  - - [5056, 448, 1, 128]
    - [317, 3947.97]
  - - [4288, 704, 1, 1280]
    - [335, 8243.82]
  - - [3584, 2944, 1, 128]
    - [327, 4284.88]
  - - [6784, 256, 1, 1280]
    - [335, 7955.21]
  - - [256, 2944, 1, 1280]
    - [365, 6691.9]
  - - [2560, 128, 1, 2560]
    - [303, 5347.23]
  - - [2368, 5888, 1, 3328]
    - [340, 8919.07]
  - - [4, 64, 1, 256]
    - [288, 13.1032]
  - - [704, 1024, 1, 3328]
    - [365, 6648.12]
  - - [2368, 1856, 1, 1280]
    - [351, 8016.51]
  - - [448, 5056, 1, 3328]
    - [335, 8231.73]
  - - [128, 448, 1, 128]
    - [244, 441.208]
  - - [128, 6784, 1, 256]
    - [345, 5850.05]
  - - [512, 4, 1, 500000]
    - [225, 1027.14]
  - - [3584, 4288, 1, 128]
    - [321, 4260.9]
  - - [64, 448, 1, 128]
    - [244, 253.554]
  - - [1024, 6000, 1, 2816]
    - [349, 8886.14]
  - - [5888, 4288, 1, 3328]
    - [349, 8968.16]
  - - [2368, 704, 1, 256]
    - [365, 4663.24]
  - - [256, 1856, 1, 3328]
    - [337, 6480.63]
  - - [1856, 128, 1, 256]
    - [335, 3726.66]
  - - [6784, 128, 1, 128]
    - [238, 2824.01]
  - - [3584, 1408, 1, 128]
    - [321, 3666.78]
  - - [1856, 5056, 1, 1280]
    - [332, 8651.36]
  - - [2944, 1024, 1, 1280]
    - [343, 8765.21]
  - - [5056, 4, 1, 256]
    - [257, 428.688]
  - - [3584, 5888, 1, 3328]
    - [343, 9347.75]
  - - [2368, 4288, 1, 256]
    - [353, 8013.1]
  - - [1024, 2368, 1, 3328]
    - [340, 8119.29]
  - - [128, 3584, 1, 128]
    - [240, 2584.62]
  - - [704, 1408, 1, 256]
    - [345, 6792.27]
  - - [4096, 128, 1, 4096]
    - [367, 6624.84]
  - - [1024, 2944, 1, 128]
    - [319, 3771.37]
  - - [1024, 3584, 1, 1280]
    - [340, 8952.71]
  - - [4288, 5888, 1, 3328]
    - [353, 9048.05]
  - - [4288, 4, 1, 3328]
    - [258, 615.206]
  - - [4608, 16, 1, 1536]
    - [262, 2894.94]
  - - [5888, 64, 1, 128]
    - [249, 1827.16]
  - - [4, 5888, 1, 128]
    - [370, 179.544]
  - - [1024, 2944, 1, 3328]
    - [341, 8298.77]
  - - [2048, 64, 1, 2048]
    - [270, 4963.77]
  - - [6144, 2, 1, 2560]
    - [259, 477.88]
  - - [256, 6784, 1, 1280]
    - [333, 7491.94]
  - - [1856, 3584, 1, 256]
    - [345, 7580.6]
  - - [128, 448, 1, 3328]
    - [296, 4417.71]
  - - [6784, 1856, 1, 128]
    - [324, 4621.74]
  - - [1024, 1500, 1, 2048]
    - [345, 6284.5]
  - - [5056, 128, 1, 256]
    - [345, 5705.16]
  - - [512, 24000, 1, 2816]
    - [332, 8919.85]
  - - [256, 5888, 1, 1280]
    - [347, 7978.0]
  - - [4, 128, 1, 1280]
    - [288, 94.2609]
  - - [4288, 6784, 1, 3328]
    - [353, 9012.58]
  - - [6784, 128, 1, 1280]
    - [337, 6807.35]
  - - [64, 1408, 1, 256]
    - [266, 2045.19]
  - - [2368, 1408, 1, 128]
    - [317, 4340.73]
  - - [1856, 448, 1, 256]
    - [366, 3639.99]
  - - [1408, 1024, 1, 128]
    - [325, 3417.68]
  - - [128, 64, 1, 128]
    - [246, 68.7241]
  - - [6784, 3584, 1, 3328]
    - [343, 9425.63]
  - - [1760, 7000, 1, 1760]
    - [340, 8780.41]
  - - [1024, 704, 1, 3328]
    - [357, 5644.6]
  - - [64, 64, 1, 128]
    - [236, 38.2023]
  - - [2368, 5056, 1, 1280]
    - [354, 8462.41]
  - - [64, 4, 1, 1280]
    - [288, 46.6455]
  - - [1408, 2368, 1, 1280]
    - [340, 8235.08]
  - - [128, 1408, 1, 1280]
    - [302, 4491.66]
  - - [1024, 1, 1, 512]
    - [306, 82.02]
  - - [4, 1408, 1, 128]
    - [370, 56.42]
  - - [704, 4288, 1, 128]
    - [324, 3942.96]
  - - [128, 1856, 1, 3328]
    - [290, 6111.93]
  - - [2944, 2944, 1, 256]
    - [349, 8640.22]
  - - [2944, 4, 1, 1280]
    - [283, 554.265]
  - - [5888, 4, 1, 256]
    - [265, 435.744]
  - - [6784, 256, 1, 256]
    - [345, 7025.96]
  - - [256, 5056, 1, 3328]
    - [345, 8249.57]
  - - [128, 4288, 1, 1280]
    - [335, 5561.74]
  - - [5056, 1856, 1, 128]
    - [329, 3975.28]
  - - [1024, 3000, 1, 1536]
    - [350, 8544.54]
  - - [5056, 1024, 1, 3328]
    - [343, 9361.47]
  - - [128, 128, 1, 256]
    - [295, 699.151]
  - - [1760, 64, 1, 1760]
    - [263, 4956.26]
  - - [4288, 3584, 1, 3328]
    - [363, 7506.18]
  - - [448, 704, 1, 3328]
    - [335, 4697.66]
  - - [448, 448, 1, 128]
    - [252, 1249.62]
  - - [1024, 2368, 1, 1280]
    - [345, 7756.44]
  - - [1856, 704, 1, 3328]
    - [345, 8340.66]
  - - [512, 1500, 1, 2560]
    - [347, 6041.39]
  - - [5888, 6784, 1, 3328]
    - [343, 9199.38]
  - - [704, 4288, 1, 1280]
    - [337, 8342.06]
  - - [128, 50176, 1, 512]
    - [383, 7589.48]
  - - [704, 256, 1, 256]
    - [335, 2912.81]
  - - [1024, 48000, 1, 2048]
    - [340, 8947.42]
  - - [4288, 1024, 1, 128]
    - [316, 4291.75]
  - - [3136, 64, 128, 64]
    - [398, 8175.16]
  - - [784, 512, 64, 128]
    - [396, 8378.44]
  - - [3136, 256, 64, 64]
    - [399, 8506.75]
  - - [12544, 1024, 1, 256]
    - [392, 8928.03]
  - - [784, 128, 128, 512]
    - [397, 8190.63]
  - - [784, 512, 256, 128]
    - [395, 8637.24]
  - - [3136, 64, 64, 256]
    - [394, 8783.03]
  - - [3136, 512, 1, 2048]
    - [391, 7298.42]
  - - [12544, 256, 1, 1024]
    - [403, 7667.35]
  - - [3136, 2048, 1, 512]
    - [402, 8447.32]
  - - [3136, 256, 256, 64]
    - [395, 8663.18]
  - - [3136, 64, 128, 256]
    - [393, 8943.56]
  - - [784, 128, 64, 512]
    - [401, 8006.37]
  - - [3136, 64, 256, 64]
    - [398, 8267.22]
  - - [784, 512, 128, 128]
    - [395, 8564.35]
  - - [3136, 64, 64, 64]
    - [398, 8009.45]
  - - [784, 128, 256, 512]
    - [399, 8377.16]
  - - [3136, 64, 256, 256]
    - [400, 9033.98]
  - - [3136, 256, 128, 64]
    - [395, 8624.56]
  - - [1024, 256, 1, 1024]
    - [421, 6331.13]
  - - [1024, 512, 1, 2048]
    - [420, 8100.14]
  - - [512, 200, 1, 512]
    - [429, 2861.93]
  - - [4096, 256, 1, 2048]
    - [412, 8812.82]
  - - [4096, 512, 1, 1024]
    - [422, 9068.87]
  - - [1024, 200, 1, 1024]
    - [421, 5110.12]
  - - [1024, 512, 1, 1024]
    - [414, 7785.35]
  - - [2048, 256, 1, 4096]
    - [424, 8438.81]
  - - [2048, 768, 1, 512]
    - [406, 8618.53]
  - - [512, 256, 1, 1024]
    - [426, 4835.03]
  - - [512, 768, 1, 2048]
    - [423, 6909.04]
  - - [2048, 256, 1, 1024]
    - [419, 7941.98]
  - - [1024, 256, 1, 2048]
    - [416, 6997.9]
  - - [2048, 200, 1, 512]
    - [419, 5649.76]
  - - [512, 1024, 1, 512]
    - [419, 7200.62]
  - - [4096, 200, 1, 1024]
    - [417, 6678.93]
  - - [2048, 200, 1, 4096]
    - [425, 6706.69]
  - - [2048, 512, 1, 1024]
    - [422, 8549.0]
  - - [1024, 1024, 1, 512]
    - [417, 8046.73]
  - - [1024, 200, 1, 4096]
    - [416, 5884.36]
  - - [512, 512, 1, 512]
    - [418, 5886.84]
  - - [2048, 512, 1, 4096]
    - [427, 8995.94]
  - - [4096, 512, 1, 2048]
    - [422, 9298.18]
  - - [512, 256, 1, 2048]
    - [415, 5186.26]
  - - [4096, 1024, 1, 2048]
    - [404, 9790.77]
  - - [2048, 1024, 1, 2048]
    - [405, 9278.9]
  - - [1024, 200, 1, 512]
    - [421, 4535.46]
  - - [512, 512, 1, 1024]
    - [421, 6553.7]
  - - [1024, 1024, 1, 4096]
    - [412, 8967.39]
  - - [2048, 1024, 1, 4096]
    - [407, 9500.56]
  - - [4096, 200, 1, 2048]
    - [413, 7082.68]
  - - [2048, 200, 1, 1024]
    - [419, 6212.04]
  - - [1024, 768, 1, 512]
    - [420, 7401.81]
  - - [2048, 512, 1, 512]
    - [417, 8124.66]
  - - [2048, 200, 1, 2048]
    - [419, 6561.9]
  - - [512, 1024, 1, 1024]
    - [425, 7407.26]
  - - [2048, 256, 1, 2048]
    - [420, 8224.23]
  - - [512, 768, 1, 512]
    - [418, 6469.46]
  - - [512, 200, 1, 1024]
    - [421, 3755.74]
  - - [4096, 1024, 1, 1024]
    - [404, 9605.95]
  - - [512, 512, 1, 2048]
    - [421, 6631.41]
  - - [4096, 256, 1, 4096]
    - [427, 8961.39]
  - - [1024, 512, 1, 512]
    - [420, 7109.09]
  - - [512, 256, 1, 512]
    - [428, 4033.08]
  - - [1024, 256, 1, 4096]
    - [416, 7326.4]
  - - [4096, 512, 1, 4096]
    - [408, 9472.07]
  - - [1024, 200, 1, 2048]
    - [409, 5530.56]
  - - [512, 1024, 1, 2048]
    - [418, 7399.09]
  - - [2048, 1024, 1, 512]
    - [410, 8995.93]
  - - [1024, 1024, 1, 2048]
    - [417, 8830.21]
  - - [4096, 256, 1, 1024]
    - [417, 8581.8]
  - - [512, 768, 1, 1024]
    - [418, 6876.01]
  - - [1024, 512, 1, 4096]
    - [414, 8484.15]
  - - [1024, 256, 1, 512]
    - [411, 5668.08]
  - - [4096, 200, 1, 4096]
    - [424, 7018.69]
  - - [2048, 256, 1, 512]
    - [424, 7079.09]
  - - [512, 200, 1, 2048]
    - [429, 4283.5]
  - - [1024, 1024, 1, 1024]
    - [412, 8565.37]
  - - [2048, 512, 1, 2048]
    - [412, 8850.59]
  - - [4096, 1024, 1, 4096]
    - [405, 9843.28]
  - - [2048, 1024, 1, 1024]
    - [195, 9234.11]
  - - [4096, 384, 1, 2048, 4096, 4096, 4096, 2048]
    - [237, 8892.52]
  - - [4096, 192, 1, 2048, 4096, 4096, 4096, 2048]
    - [231, 8024.18]
  - - [289, 160, 64, 768, 289, 289, 289, 768]
    - [233, 6783.63]
  - - [1225, 192, 64, 384, 1225, 1225, 1225, 384]
    - [220, 9373.83]
  - - [5329, 64, 64, 160, 5329, 5329, 5329, 160]
    - [224, 9186.69]
  - - [1225, 64, 64, 288, 1225, 1225, 1225, 288]
    - [215, 8492.41]
  - - [1225, 64, 64, 384, 1225, 1225, 1225, 384]
    - [219, 8735.76]
  - - [289, 128, 64, 1024, 289, 289, 289, 1024]
    - [234, 7000.2]
  - - [4096, 320, 1, 1280, 4096, 4096, 4096, 1280]
    - [239, 8302.26]
  - - [4096, 384, 1, 1536, 4096, 4096, 4096, 1536]
    - [221, 9052.45]
  - - [4096, 192, 1, 1280, 4096, 4096, 4096, 1280]
    - [236, 7561.85]
  - - [289, 192, 64, 768, 289, 289, 289, 768]
    - [232, 7882.5]
  - - [1225, 48, 64, 256, 1225, 1225, 1225, 256]
    - [223, 6620.25]
  - - [289, 192, 64, 1024, 289, 289, 289, 1024]
    - [230, 7346.99]
  - - [1225, 64, 64, 192, 1225, 1225, 1225, 192]
    - [216, 8098.35]
  - - [1225, 96, 64, 384, 1225, 1225, 1225, 384]
    - [217, 8303.08]
  - - [1225, 48, 64, 288, 1225, 1225, 1225, 288]
    - [225, 6746.77]
  - - [4096, 320, 1, 2048, 4096, 4096, 4096, 2048]
    - [226, 8384.42]
  - - [4096, 256, 1, 1536, 4096, 4096, 4096, 1536]
    - [238, 8734.34]
  - - [1225, 48, 64, 192, 1225, 1225, 1225, 192]
    - [225, 6516.36]
  - - [4096, 384, 1, 1280, 4096, 4096, 4096, 1280]
    - [235, 9023.24]
  - - [1225, 64, 64, 256, 1225, 1225, 1225, 256]
    - [222, 8319.34]
  - - [4096, 448, 1, 1280, 4096, 4096, 4096, 1280]
    - [226, 8343.32]
  - - [289, 128, 64, 768, 289, 289, 289, 768]
    - [228, 7667.98]
  - - [289, 256, 64, 1024, 289, 289, 289, 1024]
    - [229, 7535.46]
  - - [4096, 448, 1, 2048, 4096, 4096, 4096, 2048]
    - [226, 8572.31]
  - - [5329, 80, 64, 64, 5329, 5329, 5329, 64]
    - [225, 6492.44]
  - - [1225, 32, 64, 192, 1225, 1225, 1225, 192]
    - [218, 6278.54]
  - - [289, 384, 64, 1024, 289, 289, 289, 1024]
    - [227, 7767.57]
- null
