library/src/blas3/Tensile/Logic/asm_full/vega20_Cijk_Ailk_Bjlk_SB_GB.yaml
- {MinimumRequiredVersion: 4.26.0}
- vega20
- gfx906
- [Device 66a0, Device 66a1, Device 66a7, Device 66af, Vega 20]
    SolutionIndex: 0
    SolutionNameMin: Cijk_Ailk_Bjlk_SB_GB_MT32x32x8_SN_AMAS3_GRVW4_LRVW4_TT4_4_VW4_WG8_8_1_WGM1
    SolutionIndex: 1
    SolutionNameMin: Cijk_Ailk_Bjlk_SB_GB_MT128x128x8_SN_AMAS3_GRVW4_LRVW4_TT8_8_VW4_WG16_16_1_WGM1
    SolutionIndex: 2
    SolutionNameMin: Cijk_Ailk_Bjlk_SB_GB_MT32x32x16_SN_AMAS3_GRVW4_LRVW4_TT4_4_VW4_WG8_8_1_WGM1
    SolutionIndex: 3
    SolutionNameMin: Cijk_Ailk_Bjlk_SB_GB_MT64x64x16_SN_AMAS3_GRVW4_LRVW4_TT4_4_VW4_WG16_16_1_WGM1
    SolutionIndex: 4
    SolutionNameMin: Cijk_Ailk_Bjlk_SB_GB_MT128x64x16_SN_AMAS3_GRVW4_LRVW4_TT8_4_VW4_WG16_16_1_WGM1
    SolutionIndex: 5
    SolutionNameMin: Cijk_Ailk_Bjlk_SB_GB_MT64x128x16_SN_AMAS3_GRVW4_LRVW4_TT4_8_VW4_WG16_16_1_WGM1
    SolutionIndex: 6
    SolutionNameMin: Cijk_Ailk_Bjlk_SB_GB_MT32x32x32_SN_AMAS3_GRVW4_LRVW4_TT4_4_VW4_WG8_8_1_WGM1
    SolutionIndex: 7
    SolutionNameMin: Cijk_Ailk_Bjlk_SB_GB_MT64x64x32_SN_AMAS3_GRVW4_LRVW4_TT4_4_VW4_WG16_16_1_WGM1
    SolutionIndex: 8
    SolutionNameMin: Cijk_Ailk_Bjlk_SB_GB_MT64x64x8_SN_AMAS0_GRVW1_LRVW1_TT4_4_VW1_WG16_16_1_WGM1
    SolutionIndex: 9
    SolutionNameMin: Cijk_Ailk_Bjlk_SB_GB_MT128x128x8_SN_AMAS0_GRVW1_LRVW1_TT8_8_VW1_WG16_16_1_WGM1
    SolutionIndex: 10
    SolutionNameMin: Cijk_Ailk_Bjlk_SB_GB_MT64x64x16_SN_AMAS0_GRVW1_LRVW1_TT4_4_VW1_WG16_16_1_WGM1
    SolutionIndex: 11
    SolutionNameMin: Cijk_Ailk_Bjlk_SB_GB_MT32x32x8_SN_AMAS3_GRVW4_LRVW4_TT4_4_VW4_WG8_8_1_WGM8
    SolutionIndex: 12
    SolutionNameMin: Cijk_Ailk_Bjlk_SB_GB_MT32x64x8_SN_AMAS3_GRVW4_LRVW4_TT4_8_VW4_WG8_8_1_WGM8
    SolutionIndex: 13
    SolutionNameMin: Cijk_Ailk_Bjlk_SB_GB_MT32x32x16_SN_AMAS3_GRVW4_LRVW4_TT4_4_VW4_WG8_8_1_WGM8
    SolutionIndex: 14
    SolutionNameMin: Cijk_Ailk_Bjlk_SB_GB_MT64x64x16_SN_AMAS3_GRVW4_LRVW4_TT4_4_VW4_WG16_16_1_WGM8
    SolutionIndex: 15
    SolutionNameMin: Cijk_Ailk_Bjlk_SB_GB_MT32x32x32_SN_AMAS3_GRVW4_LRVW4_TT4_4_VW4_WG8_8_1_WGM8
    SolutionIndex: 16
    SolutionNameMin: Cijk_Ailk_Bjlk_SB_GB_MT64x64x32_SN_AMAS3_GRVW4_LRVW4_TT4_4_VW4_WG16_16_1_WGM8
    SolutionIndex: 17
    SolutionNameMin: Cijk_Ailk_Bjlk_SB_GB_MT64x64x16_SN_AMAS0_GRVW1_LRVW1_TT4_4_VW1_WG16_16_1_WGM8
- - - [32, 32, 8, 32, 32, 32, 32, 32]
    - [11, 85.0]
  - - [32, 32, 8, 64, 32, 32, 32, 32]
    - [0, 131.0]
  - - [32, 32, 8, 128, 32, 32, 32, 32]
    - [0, 178.0]
  - - [32, 32, 8, 256, 32, 32, 32, 32]
    - [2, 219.0]
  - - [32, 32, 8, 512, 32, 32, 32, 32]
    - [13, 250.0]
  - - [32, 64, 8, 32, 32, 32, 32, 64]
    - [0, 181.0]
  - - [32, 64, 8, 64, 32, 32, 32, 64]
    - [0, 271.0]
  - - [32, 64, 8, 128, 32, 32, 32, 64]
    - [2, 367.0]
  - - [32, 64, 8, 256, 32, 32, 32, 64]
    - [2, 449.0]
  - - [32, 64, 8, 512, 32, 32, 32, 64]
    - [6, 509.0]
  - - [32, 128, 8, 32, 32, 32, 32, 128]
    - [0, 369.0]
  - - [32, 128, 8, 64, 32, 32, 32, 128]
    - [0, 552.0]
  - - [32, 128, 8, 128, 32, 32, 32, 128]
    - [2, 744.0]
  - - [32, 128, 8, 256, 32, 32, 32, 128]
    - [2, 905.0]
  - - [32, 128, 8, 512, 32, 32, 32, 128]
    - [6, 1015.0]
  - - [32, 256, 8, 32, 32, 32, 32, 256]
    - [0, 720.0]
  - - [32, 256, 8, 64, 32, 32, 32, 256]
    - [11, 1068.0]
  - - [32, 256, 8, 128, 32, 32, 32, 256]
    - [2, 1446.0]
  - - [32, 256, 8, 256, 32, 32, 32, 256]
    - [2, 1774.0]
  - - [32, 256, 8, 512, 32, 32, 32, 256]
    - [15, 2004.0]
  - - [32, 512, 8, 32, 32, 32, 32, 512]
    - [0, 1362.0]
  - - [32, 512, 8, 64, 32, 32, 32, 512]
    - [0, 2044.0]
  - - [32, 512, 8, 128, 32, 32, 32, 512]
    - [2, 2699.0]
  - - [32, 512, 8, 256, 32, 32, 32, 512]
    - [2, 3372.0]
  - - [32, 512, 8, 512, 32, 32, 32, 512]
    - [13, 3894.0]
  - - [64, 32, 8, 32, 64, 64, 64, 32]
    - [0, 181.0]
  - - [64, 32, 8, 64, 64, 64, 64, 32]
    - [0, 271.0]
  - - [64, 32, 8, 128, 64, 64, 64, 32]
    - [2, 365.0]
  - - [64, 32, 8, 256, 64, 64, 64, 32]
    - [2, 447.0]
  - - [64, 32, 8, 512, 64, 64, 64, 32]
    - [6, 506.0]
  - - [64, 64, 8, 32, 64, 64, 64, 64]
    - [0, 361.0]
  - - [64, 64, 8, 64, 64, 64, 64, 64]
    - [0, 548.0]
  - - [64, 64, 8, 128, 64, 64, 64, 64]
    - [2, 736.0]
  - - [64, 64, 8, 256, 64, 64, 64, 64]
    - [13, 902.0]
  - - [64, 64, 8, 512, 64, 64, 64, 64]
    - [15, 1019.0]
  - - [64, 128, 8, 32, 64, 64, 64, 128]
    - [0, 712.0]
  - - [64, 128, 8, 64, 64, 64, 64, 128]
    - [0, 1085.0]
  - - [64, 128, 8, 128, 64, 64, 64, 128]
    - [0, 1446.0]
  - - [64, 128, 8, 256, 64, 64, 64, 128]
    - [3, 1785.0]
  - - [64, 128, 8, 512, 64, 64, 64, 128]
    - [6, 2025.0]
  - - [64, 256, 8, 32, 64, 64, 64, 256]
    - [0, 1358.0]
  - - [64, 256, 8, 64, 64, 64, 64, 256]
    - [0, 2072.0]
  - - [64, 256, 8, 128, 64, 64, 64, 256]
    - [0, 2804.0]
  - - [64, 256, 8, 256, 64, 64, 64, 256]
    - [13, 3475.0]
  - - [64, 256, 8, 512, 64, 64, 64, 256]
    - [13, 3931.0]
  - - [64, 512, 8, 32, 64, 64, 64, 512]
    - [11, 2521.0]
  - - [64, 512, 8, 64, 64, 64, 64, 512]
    - [11, 3813.0]
  - - [64, 512, 8, 128, 64, 64, 64, 512]
    - [13, 5096.0]
  - - [64, 512, 8, 256, 64, 64, 64, 512]
    - [3, 6453.0]
  - - [64, 512, 8, 512, 64, 64, 64, 512]
    - [7, 7692.0]
  - - [128, 32, 8, 32, 128, 128, 128, 32]
    - [0, 364.0]
  - - [128, 32, 8, 64, 128, 128, 128, 32]
    - [0, 547.0]
  - - [128, 32, 8, 128, 128, 128, 128, 32]
    - [13, 735.0]
  - - [128, 32, 8, 256, 128, 128, 128, 32]
    - [13, 900.0]
  - - [128, 32, 8, 512, 128, 128, 128, 32]
    - [6, 1009.0]
  - - [128, 64, 8, 32, 128, 128, 128, 64]
    - [0, 707.0]
  - - [128, 64, 8, 64, 128, 128, 128, 64]
    - [0, 1079.0]
  - - [128, 64, 8, 128, 128, 128, 128, 64]
    - [2, 1460.0]
  - - [128, 64, 8, 256, 128, 128, 128, 64]
    - [2, 1780.0]
  - - [128, 64, 8, 512, 128, 128, 128, 64]
    - [6, 2014.0]
  - - [128, 128, 8, 32, 128, 128, 128, 128]
    - [0, 1362.0]
  - - [128, 128, 8, 64, 128, 128, 128, 128]
    - [0, 2060.0]
  - - [128, 128, 8, 128, 128, 128, 128, 128]
    - [2, 2823.0]
  - - [128, 128, 8, 256, 128, 128, 128, 128]
    - [3, 3487.0]
  - - [128, 128, 8, 512, 128, 128, 128, 128]
    - [6, 3962.0]
  - - [128, 256, 8, 32, 128, 128, 128, 256]
    - [0, 2539.0]
  - - [128, 256, 8, 64, 128, 128, 128, 256]
    - [0, 3869.0]
  - - [128, 256, 8, 128, 128, 128, 128, 256]
    - [0, 5236.0]
  - - [128, 256, 8, 256, 128, 128, 128, 256]
    - [2, 6503.0]
  - - [128, 256, 8, 512, 128, 128, 128, 256]
    - [7, 7588.0]
  - - [128, 512, 8, 32, 128, 128, 128, 512]
    - [8, 3987.0]
  - - [128, 512, 8, 64, 128, 128, 128, 512]
    - [8, 5533.0]
  - - [128, 512, 8, 128, 128, 128, 128, 512]
    - [11, 7346.0]
  - - [128, 512, 8, 256, 128, 128, 128, 512]
    - [16, 9223.0]
  - - [128, 512, 8, 512, 128, 128, 128, 512]
    - [14, 10880.0]
  - - [256, 32, 8, 32, 256, 256, 256, 32]
    - [0, 701.0]
  - - [256, 32, 8, 64, 256, 256, 256, 32]
    - [0, 1061.0]
  - - [256, 32, 8, 128, 256, 256, 256, 32]
    - [2, 1438.0]
  - - [256, 32, 8, 256, 256, 256, 256, 32]
    - [13, 1755.0]
  - - [256, 32, 8, 512, 256, 256, 256, 32]
    - [6, 2001.0]
  - - [256, 64, 8, 32, 256, 256, 256, 64]
    - [0, 1324.0]
  - - [256, 64, 8, 64, 256, 256, 256, 64]
    - [0, 2016.0]
  - - [256, 64, 8, 128, 256, 256, 256, 64]
    - [2, 2763.0]
  - - [256, 64, 8, 256, 256, 256, 256, 64]
    - [2, 3402.0]
  - - [256, 64, 8, 512, 256, 256, 256, 64]
    - [6, 3907.0]
  - - [256, 128, 8, 32, 256, 256, 256, 128]
    - [8, 2433.0]
  - - [256, 128, 8, 64, 256, 256, 256, 128]
    - [11, 3686.0]
  - - [256, 128, 8, 128, 256, 256, 256, 128]
    - [13, 5072.0]
  - - [256, 128, 8, 256, 256, 256, 256, 128]
    - [3, 6413.0]
  - - [256, 128, 8, 512, 256, 256, 256, 128]
    - [7, 7609.0]
  - - [256, 256, 8, 32, 256, 256, 256, 256]
    - [8, 4104.0]
  - - [256, 256, 8, 64, 256, 256, 256, 256]
    - [8, 5615.0]
  - - [256, 256, 8, 128, 256, 256, 256, 256]
    - [3, 7774.0]
  - - [256, 256, 8, 256, 256, 256, 256, 256]
    - [3, 9533.0]
  - - [256, 256, 8, 512, 256, 256, 256, 256]
    - [3, 11009.0]
  - - [256, 512, 8, 32, 256, 256, 256, 512]
    - [10, 5809.0]
  - - [256, 512, 8, 64, 256, 256, 256, 512]
    - [14, 7696.0]
  - - [256, 512, 8, 128, 256, 256, 256, 512]
    - [3, 9533.0]
  - - [256, 512, 8, 256, 256, 256, 256, 512]
    - [4, 10923.0]
  - - [256, 512, 8, 512, 256, 256, 256, 512]
    - [5, 12186.0]
  - - [512, 32, 8, 32, 512, 512, 512, 32]
    - [0, 1324.0]
  - - [512, 32, 8, 64, 512, 512, 512, 32]
    - [0, 2020.0]
  - - [512, 32, 8, 128, 512, 512, 512, 32]
    - [2, 2724.0]
  - - [512, 32, 8, 256, 512, 512, 512, 32]
    - [13, 3404.0]
  - - [512, 32, 8, 512, 512, 512, 512, 32]
    - [15, 3925.0]
  - - [512, 64, 8, 32, 512, 512, 512, 64]
    - [11, 2399.0]
  - - [512, 64, 8, 64, 512, 512, 512, 64]
    - [0, 3686.0]
  - - [512, 64, 8, 128, 512, 512, 512, 64]
    - [13, 5090.0]
  - - [512, 64, 8, 256, 512, 512, 512, 64]
    - [3, 6448.0]
  - - [512, 64, 8, 512, 512, 512, 512, 64]
    - [7, 7578.0]
  - - [512, 128, 8, 32, 512, 512, 512, 128]
    - [11, 3738.0]
  - - [512, 128, 8, 64, 512, 512, 512, 128]
    - [11, 5607.0]
  - - [512, 128, 8, 128, 512, 512, 512, 128]
    - [3, 7626.0]
  - - [512, 128, 8, 256, 512, 512, 512, 128]
    - [14, 9592.0]
  - - [512, 128, 8, 512, 512, 512, 512, 128]
    - [14, 10856.0]
  - - [512, 256, 8, 32, 512, 512, 512, 256]
    - [11, 5296.0]
  - - [512, 256, 8, 64, 512, 512, 512, 256]
    - [14, 7571.0]
  - - [512, 256, 8, 128, 512, 512, 512, 256]
    - [14, 9817.0]
  - - [512, 256, 8, 256, 512, 512, 512, 256]
    - [12, 11096.0]
  - - [512, 256, 8, 512, 512, 512, 512, 256]
    - [4, 12257.0]
  - - [512, 512, 8, 32, 512, 512, 512, 512]
    - [17, 6317.0]
  - - [512, 512, 8, 64, 512, 512, 512, 512]
    - [14, 8608.0]
  - - [512, 512, 8, 128, 512, 512, 512, 512]
    - [3, 10492.0]
  - - [512, 512, 8, 256, 512, 512, 512, 512]
    - [9, 11892.0]
  - - [512, 512, 8, 512, 512, 512, 512, 512]
    - [1, 12856.0]
- null
