library/src/blas3/Tensile/Logic/asm_full/vega20_Cijk_Ailk_Bjlk_SB.yaml
- {MinimumRequiredVersion: 4.6.0}
- vega20
- gfx906
- [Device 66a0, Device 66a1, Device 66a7, Vega 20]
    SolutionIndex: 0
    SolutionNameMin: Cijk_Ailk_Bjlk_SB_MT032x008x08_GRVW02_GSU01_SNLL0_TT02_02_VW02_WG16_04_01
    SolutionIndex: 1
    SolutionNameMin: Cijk_Ailk_Bjlk_SB_MT016x016x08_GRVW02_GSU01_SNLL0_TT02_02_VW02_WG08_08_01
    SolutionIndex: 2
    SolutionNameMin: Cijk_Ailk_Bjlk_SB_MT032x016x08_GRVW02_GSU01_SNLL0_TT04_02_VW02_WG08_08_01
    SolutionIndex: 3
    SolutionNameMin: Cijk_Ailk_Bjlk_SB_MT032x032x08_GRVW04_GSU01_SNLL0_TT04_04_VW04_WG08_08_01
    SolutionIndex: 4
    SolutionNameMin: Cijk_Ailk_Bjlk_SB_MT032x016x08_GRVW02_GSU01_SNLL0_TT02_02_VW02_WG16_08_01
    SolutionIndex: 5
    SolutionNameMin: Cijk_Ailk_Bjlk_SB_MT064x016x08_GRVW02_GSU01_SNLL0_TT04_02_VW02_WG16_08_01
    SolutionIndex: 6
    SolutionNameMin: Cijk_Ailk_Bjlk_SB_MT016x016x08_GRVW02_GSU01_SNLL0_TT02_02_VW02_WG08_08_01
    SolutionIndex: 7
    SolutionNameMin: Cijk_Ailk_Bjlk_SB_MT032x016x08_GRVW02_GSU01_SNLL0_TT04_02_VW02_WG08_08_01
    SolutionIndex: 8
    SolutionNameMin: Cijk_Ailk_Bjlk_SB_MT032x032x08_GRVW04_GSU01_SNLL0_TT04_04_VW04_WG08_08_01
    SolutionIndex: 9
    SolutionNameMin: Cijk_Ailk_Bjlk_SB_MT032x016x08_GRVW02_GSU01_SNLL0_TT02_02_VW02_WG16_08_01
    SolutionIndex: 10
    SolutionNameMin: Cijk_Ailk_Bjlk_SB_MT064x016x08_GRVW02_GSU01_SNLL0_TT04_02_VW02_WG16_08_01
    SolutionIndex: 11
    SolutionNameMin: Cijk_Ailk_Bjlk_SB_MT064x008x16_GRVW02_GSU01_SNLL0_TT02_02_VW02_WG32_04_01
    SolutionIndex: 12
    SolutionNameMin: Cijk_Ailk_Bjlk_SB_MT016x016x16_GRVW02_GSU01_SNLL0_TT02_02_VW02_WG08_08_01
    SolutionIndex: 13
    SolutionNameMin: Cijk_Ailk_Bjlk_SB_MT032x016x16_GRVW02_GSU01_SNLL0_TT04_02_VW02_WG08_08_01
    SolutionIndex: 14
    SolutionNameMin: Cijk_Ailk_Bjlk_SB_MT032x032x16_GRVW04_GSU01_SNLL0_TT04_04_VW04_WG08_08_01
    SolutionIndex: 15
    SolutionNameMin: Cijk_Ailk_Bjlk_SB_MT064x016x16_GRVW02_GSU01_SNLL0_TT04_02_VW02_WG16_08_01
    SolutionIndex: 16
    SolutionNameMin: Cijk_Ailk_Bjlk_SB_MT064x032x16_GRVW04_GSU01_SNLL0_TT04_04_VW04_WG16_08_01
    SolutionIndex: 17
    SolutionNameMin: Cijk_Ailk_Bjlk_SB_MT064x008x16_GRVW02_GSU01_SNLL0_TT02_02_VW02_WG32_04_01
    SolutionIndex: 18
    SolutionNameMin: Cijk_Ailk_Bjlk_SB_MT032x008x16_GRVW02_GSU01_SNLL0_TT02_02_VW02_WG16_04_01
    SolutionIndex: 19
    SolutionNameMin: Cijk_Ailk_Bjlk_SB_MT016x016x16_GRVW02_GSU01_SNLL0_TT02_02_VW02_WG08_08_01
    SolutionIndex: 20
    SolutionNameMin: Cijk_Ailk_Bjlk_SB_MT016x016x24_GRVW02_GSU01_SNLL0_TT02_02_VW02_WG08_08_01
    SolutionIndex: 21
    SolutionNameMin: Cijk_Ailk_Bjlk_SB_MT016x016x08_GRVW02_GSU02_SNLL0_TT02_02_VW02_WG08_08_02
    SolutionIndex: 22
    SolutionNameMin: Cijk_Ailk_Bjlk_SB_MT032x016x08_GRVW02_GSU02_SNLL0_TT04_02_VW02_WG08_08_02
    SolutionIndex: 23
    SolutionNameMin: Cijk_Ailk_Bjlk_SB_MT016x016x08_GRVW02_GSU04_SNLL0_TT02_02_VW02_WG08_08_02
    SolutionIndex: 24
    SolutionNameMin: Cijk_Ailk_Bjlk_SB_MT016x016x08_GRVW02_GSU08_SNLL0_TT02_02_VW02_WG08_08_02
    SolutionIndex: 25
    SolutionNameMin: Cijk_Ailk_Bjlk_SB_MT016x016x16_GRVW02_GSU02_SNLL0_TT02_02_VW02_WG08_08_02
    SolutionIndex: 26
    SolutionNameMin: Cijk_Ailk_Bjlk_SB_MT032x016x16_GRVW02_GSU02_SNLL0_TT04_02_VW02_WG08_08_02
    SolutionIndex: 27
    SolutionNameMin: Cijk_Ailk_Bjlk_SB_MT032x032x16_GRVW04_GSU02_SNLL0_TT04_04_VW04_WG08_08_02
    SolutionIndex: 28
    SolutionNameMin: Cijk_Ailk_Bjlk_SB_MT064x032x16_GRVW04_GSU02_SNLL0_TT08_04_VW04_WG08_08_02
    SolutionIndex: 29
    SolutionNameMin: Cijk_Ailk_Bjlk_SB_MT016x016x16_GRVW02_GSU02_SNLL0_TT02_02_VW02_WG08_08_04
    SolutionIndex: 30
    SolutionNameMin: Cijk_Ailk_Bjlk_SB_MT032x016x16_GRVW02_GSU02_SNLL0_TT04_02_VW02_WG08_08_04
    SolutionIndex: 31
    SolutionNameMin: Cijk_Ailk_Bjlk_SB_MT032x016x16_GRVW02_GSU02_SNLL0_TT02_02_VW02_WG16_08_02
    SolutionIndex: 32
    SolutionNameMin: Cijk_Ailk_Bjlk_SB_MT064x016x16_GRVW02_GSU02_SNLL0_TT04_02_VW02_WG16_08_02
    SolutionIndex: 33
    SolutionNameMin: Cijk_Ailk_Bjlk_SB_MT064x016x16_GRVW04_GSU02_SNLL0_TT04_04_VW04_WG16_04_04
    SolutionIndex: 34
    SolutionNameMin: Cijk_Ailk_Bjlk_SB_MT016x016x16_GRVW02_GSU02_SNLL0_TT02_02_VW02_WG08_08_02
    SolutionIndex: 35
    SolutionNameMin: Cijk_Ailk_Bjlk_SB_MT032x016x16_GRVW02_GSU02_SNLL0_TT04_02_VW02_WG08_08_02
    SolutionIndex: 36
    SolutionNameMin: Cijk_Ailk_Bjlk_SB_MT032x032x16_GRVW04_GSU02_SNLL0_TT04_04_VW04_WG08_08_02
    SolutionIndex: 37
    SolutionNameMin: Cijk_Ailk_Bjlk_SB_MT016x016x16_GRVW02_GSU02_SNLL0_TT02_02_VW02_WG08_08_04
    SolutionIndex: 38
    SolutionNameMin: Cijk_Ailk_Bjlk_SB_MT032x016x16_GRVW02_GSU02_SNLL0_TT04_02_VW02_WG08_08_04
    SolutionIndex: 39
    SolutionNameMin: Cijk_Ailk_Bjlk_SB_MT032x016x16_GRVW02_GSU02_SNLL0_TT02_02_VW02_WG16_08_02
    SolutionIndex: 40
    SolutionNameMin: Cijk_Ailk_Bjlk_SB_MT016x016x16_GRVW02_GSU04_SNLL0_TT02_02_VW02_WG08_08_04
    SolutionIndex: 41
    SolutionNameMin: Cijk_Ailk_Bjlk_SB_MT032x032x16_GRVW04_GSU04_SNLL0_TT04_04_VW04_WG08_08_02
    SolutionIndex: 42
    SolutionNameMin: Cijk_Ailk_Bjlk_SB_MT016x016x16_GRVW02_GSU04_SNLL0_TT02_02_VW02_WG08_08_04
    SolutionIndex: 43
    SolutionNameMin: Cijk_Ailk_Bjlk_SB_MT016x016x16_GRVW02_GSU08_SNLL0_TT02_02_VW02_WG08_08_04
    SolutionIndex: 44
    SolutionNameMin: Cijk_Ailk_Bjlk_SB_MT032x008x32_GRVW02_GSU02_SNLL0_TT02_02_VW02_WG16_04_04
    SolutionIndex: 45
    SolutionNameMin: Cijk_Ailk_Bjlk_SB_MT032x016x32_GRVW02_GSU02_SNLL0_TT04_02_VW02_WG08_08_02
    SolutionIndex: 46
    SolutionNameMin: Cijk_Ailk_Bjlk_SB_MT016x016x32_GRVW02_GSU02_SNLL0_TT02_02_VW02_WG08_08_04
    SolutionIndex: 47
    SolutionNameMin: Cijk_Ailk_Bjlk_SB_MT032x016x32_GRVW02_GSU02_SNLL0_TT04_02_VW02_WG08_08_04
    SolutionIndex: 48
    SolutionNameMin: Cijk_Ailk_Bjlk_SB_MT032x032x32_GRVW04_GSU02_SNLL0_TT04_04_VW04_WG08_08_04
    SolutionIndex: 49
    SolutionNameMin: Cijk_Ailk_Bjlk_SB_MT064x032x32_GRVW04_GSU02_SNLL0_TT08_04_VW04_WG08_08_04
    SolutionIndex: 50
    SolutionNameMin: Cijk_Ailk_Bjlk_SB_MT064x032x32_GRVW04_GSU02_SNLL0_TT04_04_VW04_WG16_08_02
    SolutionIndex: 51
    SolutionNameMin: Cijk_Ailk_Bjlk_SB_MT128x032x32_GRVW04_GSU02_SNLL0_TT08_08_VW04_WG16_04_04
    SolutionIndex: 52
    SolutionNameMin: Cijk_Ailk_Bjlk_SB_MT032x016x32_GRVW02_GSU02_SNLL0_TT04_02_VW02_WG08_08_02
    SolutionIndex: 53
    SolutionNameMin: Cijk_Ailk_Bjlk_SB_MT032x032x32_GRVW04_GSU02_SNLL0_TT04_04_VW04_WG08_08_02
    SolutionIndex: 54
    SolutionNameMin: Cijk_Ailk_Bjlk_SB_MT016x016x32_GRVW02_GSU02_SNLL0_TT02_02_VW02_WG08_08_04
    SolutionIndex: 55
    SolutionNameMin: Cijk_Ailk_Bjlk_SB_MT032x016x32_GRVW02_GSU02_SNLL0_TT04_02_VW02_WG08_08_04
    SolutionIndex: 56
    SolutionNameMin: Cijk_Ailk_Bjlk_SB_MT032x032x32_GRVW04_GSU02_SNLL0_TT04_04_VW04_WG08_08_04
    SolutionIndex: 57
    SolutionNameMin: Cijk_Ailk_Bjlk_SB_MT064x032x32_GRVW04_GSU02_SNLL0_TT08_04_VW04_WG08_08_04
    SolutionIndex: 58
    SolutionNameMin: Cijk_Ailk_Bjlk_SB_MT064x008x32_GRVW02_GSU04_SNLL0_TT04_02_VW02_WG16_04_04
    SolutionIndex: 59
    SolutionNameMin: Cijk_Ailk_Bjlk_SB_MT016x016x32_GRVW02_GSU04_SNLL0_TT02_02_VW02_WG08_08_04
    SolutionIndex: 60
    SolutionNameMin: Cijk_Ailk_Bjlk_SB_MT032x016x32_GRVW02_GSU04_SNLL0_TT04_02_VW02_WG08_08_04
    SolutionIndex: 61
    SolutionNameMin: Cijk_Ailk_Bjlk_SB_MT032x032x32_GRVW04_GSU04_SNLL0_TT04_04_VW04_WG08_08_04
    SolutionIndex: 62
    SolutionNameMin: Cijk_Ailk_Bjlk_SB_MT032x032x32_GRVW04_GSU04_SNLL0_TT04_04_VW04_WG08_08_04
    SolutionIndex: 63
    SolutionNameMin: Cijk_Ailk_Bjlk_SB_MT032x008x32_GRVW02_GSU08_SNLL0_TT02_02_VW02_WG16_04_04
    SolutionIndex: 64
    SolutionNameMin: Cijk_Ailk_Bjlk_SB_MT016x016x32_GRVW02_GSU08_SNLL0_TT02_02_VW02_WG08_08_04
    SolutionIndex: 65
    SolutionNameMin: Cijk_Ailk_Bjlk_SB_MT128x128x08_GRVW04_GSU01_SNLL0_TT08_08_VW04_WG16_16_01
    SolutionIndex: 66
    SolutionNameMin: Cijk_Ailk_Bjlk_SB_MT064x064x16_GRVW04_GSU01_SNLL0_TT04_04_VW04_WG16_16_01
    SolutionIndex: 67
    SolutionNameMin: Cijk_Ailk_Bjlk_SB_MT064x128x16_GRVW04_GSU01_SNLL0_TT04_08_VW04_WG16_16_01
    SolutionIndex: 68
    SolutionNameMin: Cijk_Ailk_Bjlk_SB_MT128x064x16_GRVW04_GSU01_SNLL0_TT08_04_VW04_WG16_16_01
    SolutionIndex: 69
    SolutionNameMin: Cijk_Ailk_Bjlk_SB_MT064x064x16_GRVW04_GSU01_SNLL0_TT04_04_VW04_WG16_16_01
    SolutionIndex: 70
    SolutionNameMin: Cijk_Ailk_Bjlk_SB_MT064x128x16_GRVW04_GSU01_SNLL0_TT04_08_VW04_WG16_16_01
    SolutionIndex: 71
    SolutionNameMin: Cijk_Ailk_Bjlk_SB_MT128x064x16_GRVW04_GSU01_SNLL0_TT08_04_VW04_WG16_16_01
    SolutionIndex: 72
    SolutionNameMin: Cijk_Ailk_Bjlk_SB_MT128x128x08_GRVW04_GSU01_SNLL1_TT08_08_VW04_WG16_16_01
    SolutionIndex: 73
    SolutionNameMin: Cijk_Ailk_Bjlk_SB_MT128x128x08_GRVW04_GSU01_SNLL1_TT08_08_VW04_WG16_16_01
    SolutionIndex: 74
    SolutionNameMin: Cijk_Ailk_Bjlk_SB_MT064x064x16_GRVW04_GSU01_SNLL1_TT04_04_VW04_WG16_16_01
    SolutionIndex: 75
    SolutionNameMin: Cijk_Ailk_Bjlk_SB_MT064x128x16_GRVW04_GSU01_SNLL1_TT04_08_VW04_WG16_16_01
    SolutionIndex: 76
    SolutionNameMin: Cijk_Ailk_Bjlk_SB_MT096x128x16_GRVW02_GSU01_SNLL1_TT06_08_VW02_WG16_16_01
    SolutionIndex: 77
    SolutionNameMin: Cijk_Ailk_Bjlk_SB_MT128x064x16_GRVW04_GSU01_SNLL1_TT08_04_VW04_WG16_16_01
    SolutionIndex: 78
    SolutionNameMin: Cijk_Ailk_Bjlk_SB_MT128x096x16_GRVW02_GSU01_SNLL1_TT08_06_VW02_WG16_16_01
    SolutionIndex: 79
    SolutionNameMin: Cijk_Ailk_Bjlk_SB_MT128x128x16_GRVW04_GSU01_SNLL1_TT08_08_VW04_WG16_16_01
    SolutionIndex: 80
    SolutionNameMin: Cijk_Ailk_Bjlk_SB_MT064x064x16_GRVW04_GSU01_SNLL1_TT04_04_VW04_WG16_16_01
    SolutionIndex: 81
    SolutionNameMin: Cijk_Ailk_Bjlk_SB_MT064x128x16_GRVW04_GSU01_SNLL1_TT04_08_VW04_WG16_16_01
    SolutionIndex: 82
    SolutionNameMin: Cijk_Ailk_Bjlk_SB_MT096x128x16_GRVW02_GSU01_SNLL1_TT06_08_VW02_WG16_16_01
    SolutionIndex: 83
    SolutionNameMin: Cijk_Ailk_Bjlk_SB_MT128x064x16_GRVW04_GSU01_SNLL1_TT08_04_VW04_WG16_16_01
    SolutionIndex: 84
    SolutionNameMin: Cijk_Ailk_Bjlk_SB_MT128x096x16_GRVW02_GSU01_SNLL1_TT08_06_VW02_WG16_16_01
    SolutionIndex: 85
    SolutionNameMin: Cijk_Ailk_Bjlk_SB_MT128x128x16_GRVW04_GSU01_SNLL1_TT08_08_VW04_WG16_16_01
    SolutionIndex: 86
    SolutionNameMin: Cijk_Ailk_Bjlk_SB_MT016x016x04_GRVW02_GSU01_SNLL0_TT02_02_VW02_WG08_08_01
    SolutionIndex: 87
    SolutionNameMin: Cijk_Ailk_Bjlk_SB_MT032x032x02_GRVW04_GSU01_SNLL0_TT04_04_VW04_WG08_08_01
    SolutionIndex: 88
    SolutionNameMin: Cijk_Ailk_Bjlk_SB_MT008x008x08_GRVW02_GSU01_SNLL1_TT02_02_VW02_WG04_04_04
    SolutionIndex: 89
    SolutionNameMin: Cijk_Ailk_Bjlk_SB_MT016x016x16_GRVW02_GSU01_SNLL1_TT02_02_VW02_WG08_08_04
    SolutionIndex: 90
    SolutionNameMin: Cijk_Ailk_Bjlk_SB_MT008x008x08_GRVW02_GSU02_SNLL0_TT02_02_VW02_WG04_04_04
    SolutionIndex: 91
    SolutionNameMin: Cijk_Ailk_Bjlk_SB_MT016x016x04_GRVW02_GSU04_SNLL0_TT02_02_VW02_WG08_08_01
    SolutionIndex: 92
    SolutionNameMin: Cijk_Ailk_Bjlk_SB_MT008x008x08_GRVW02_GSU04_SNLL0_TT02_02_VW02_WG04_04_04
    SolutionIndex: 93
    SolutionNameMin: Cijk_Ailk_Bjlk_SB_MT016x016x04_GRVW02_GSU08_SNLL0_TT02_02_VW02_WG08_08_01
    SolutionIndex: 94
    SolutionNameMin: Cijk_Ailk_Bjlk_SB_MT008x008x08_GRVW02_GSU08_SNLL0_TT02_02_VW02_WG04_04_04
    SolutionIndex: 95
    SolutionNameMin: Cijk_Ailk_Bjlk_SB_MT016x016x08_GRVW02_GSU16_SNLL0_TT02_02_VW02_WG08_08_02
    SolutionIndex: 96
    SolutionNameMin: Cijk_Ailk_Bjlk_SB_MT008x008x08_GRVW02_GSU16_SNLL0_TT02_02_VW02_WG04_04_04
    SolutionIndex: 97
    SolutionNameMin: Cijk_Ailk_Bjlk_SB_MT016x016x16_GRVW02_GSU16_SNLL0_TT02_02_VW02_WG08_08_04
    SolutionIndex: 98
    SolutionNameMin: Cijk_Ailk_Bjlk_SB_MT064x128x08_DTL0_GRVW01_GSU01_PGR1_PLR1_TT04_08_USFGRO01_VW02_WG16_16_01_WGM01
    SolutionIndex: 99
    SolutionNameMin: Cijk_Ailk_Bjlk_SB_MT064x064x08_DTL0_GRVW01_GSU01_PGR1_PLR1_TT04_08_USFGRO01_VW04_WG16_08_01_WGM01
    SolutionIndex: 100
    SolutionNameMin: Cijk_Ailk_Bjlk_SB_MT032x256x08_DTL1_GRVW01_GSU01_PGR0_PLR1_TT04_08_USFGRO01_VW04_WG08_32_01_WGM01
    SolutionIndex: 101
    SolutionNameMin: Cijk_Ailk_Bjlk_SB_MT032x256x08_DTL1_GRVW01_GSU01_PGR0_PLR1_TT04_08_USFGRO01_VW04_WG08_32_01_WGM08
    SolutionIndex: 102
    SolutionNameMin: Cijk_Ailk_Bjlk_SB_MT032x256x08_DTL1_GRVW01_GSU01_PGR0_PLR1_TT04_08_USFGRO01_VW04_WG08_32_01_WGM64
    SolutionIndex: 103
    SolutionNameMin: Cijk_Ailk_Bjlk_SB_MT064x064x16_DTL0_GRVW01_GSU01_PGR0_PLR1_TT04_08_USFGRO01_VW04_WG16_08_01_WGM01
    SolutionIndex: 104
    SolutionNameMin: Cijk_Ailk_Bjlk_SB_MT064x064x16_DTL0_GRVW01_GSU01_PGR1_PLR1_TT04_04_USFGRO01_VW04_WG16_16_01_WGM01
    SolutionIndex: 105
    SolutionNameMin: Cijk_Ailk_Bjlk_SB_MT064x064x08_DTL0_GRVW04_GSU01_PGR1_PLR1_TT04_08_USFGRO0_VW04_WG16_08_01_WGM01
    SolutionIndex: 106
    SolutionNameMin: Cijk_Ailk_Bjlk_SB_MT032x128x08_DTL0_GRVW04_GSU01_PGR1_PLR1_TT04_04_USFGRO0_VW04_WG08_32_01_WGM01
    SolutionIndex: 107
    SolutionNameMin: Cijk_Ailk_Bjlk_SB_MT064x128x16_DTL0_GRVW04_GSU01_PGR0_PLR1_TT08_04_USFGRO0_VW04_WG08_32_01_WGM01
    SolutionIndex: 108
    SolutionNameMin: Cijk_Ailk_Bjlk_SB_MT064x064x16_DTL0_GRVW04_GSU01_PGR1_PLR1_TT04_04_USFGRO0_VW04_WG16_16_01_WGM01
    SolutionIndex: 109
    SolutionNameMin: Cijk_Ailk_Bjlk_SB_MT064x128x16_DTL0_GRVW04_GSU01_PGR0_PLR1_TT04_08_USFGRO0_VW04_WG16_16_01_WGM01
    SolutionIndex: 110
    SolutionNameMin: Cijk_Ailk_Bjlk_SB_MT064x064x16_DTL0_GRVW04_GSU01_PGR1_PLR1_TT04_04_USFGRO0_VW04_WG16_16_01_WGM08
    SolutionIndex: 111
    SolutionNameMin: Cijk_Ailk_Bjlk_SB_MT064x128x16_DTL0_GRVW04_GSU01_PGR0_PLR1_TT04_08_USFGRO0_VW04_WG16_16_01_WGM08
    SolutionIndex: 112
    SolutionNameMin: Cijk_Ailk_Bjlk_SB_MT64x32x8_SE_EPS0_GSU1_PGR0_PLR1_SNLL0_TT8_4_VW4_WG8_8_1_WGM1
    SolutionIndex: 113
    SolutionNameMin: Cijk_Ailk_Bjlk_SB_MT64x64x8_SE_EPS1_GSU1_PGR1_PLR1_SNLL1_TT8_8_VW4_WG8_8_1_WGM8
    SolutionIndex: 114
    SolutionNameMin: Cijk_Ailk_Bjlk_SB_MT64x32x8_SE_EPS0_GSU1_PGR0_PLR1_SNLL0_TT8_4_VW4_WG8_8_1_WGM64
    SolutionIndex: 115
    SolutionNameMin: Cijk_Ailk_Bjlk_SB_MT64x64x8_SE_EPS1_GSU1_PGR1_PLR1_SNLL1_TT8_8_VW4_WG8_8_1_WGM64
    SolutionIndex: 116
    SolutionNameMin: Cijk_Ailk_Bjlk_SB_MT128x32x16_SE_EPS0_GSU1_PGR0_PLR1_SNLL0_TT8_4_VW4_WG16_8_1_WGM1
    SolutionIndex: 117
    SolutionNameMin: Cijk_Ailk_Bjlk_SB_MT64x64x16_SE_EPS1_GSU1_PGR1_PLR1_SNLL1_TT4_4_VW4_WG16_16_1_WGM1
    SolutionIndex: 118
    SolutionNameMin: Cijk_Ailk_Bjlk_SB_MT128x32x16_SE_EPS0_GSU1_PGR0_PLR1_SNLL0_TT8_4_VW4_WG16_8_1_WGM8
    SolutionIndex: 119
    SolutionNameMin: Cijk_Ailk_Bjlk_SB_MT64x64x16_SE_EPS0_GSU1_PGR0_PLR0_SNLL0_TT4_4_VW4_WG16_16_1_WGM8
    SolutionIndex: 120
    SolutionNameMin: Cijk_Ailk_Bjlk_SB_MT64x64x16_SE_EPS0_GSU1_PGR0_PLR1_SNLL0_TT4_4_VW4_WG16_16_1_WGM8
    SolutionIndex: 121
    SolutionNameMin: Cijk_Ailk_Bjlk_SB_MT64x64x16_SE_EPS1_GSU1_PGR1_PLR1_SNLL1_TT4_4_VW4_WG16_16_1_WGM8
    SolutionIndex: 122
    SolutionNameMin: Cijk_Ailk_Bjlk_SB_MT128x32x16_SE_EPS0_GSU1_PGR0_PLR1_SNLL0_TT8_4_VW4_WG16_8_1_WGM64
    SolutionIndex: 123
    SolutionNameMin: Cijk_Ailk_Bjlk_SB_MT64x64x16_SE_EPS0_GSU1_PGR0_PLR0_SNLL0_TT4_4_VW4_WG16_16_1_WGM64
    SolutionIndex: 124
    SolutionNameMin: Cijk_Ailk_Bjlk_SB_MT64x64x16_SE_EPS0_GSU1_PGR0_PLR1_SNLL0_TT4_4_VW4_WG16_16_1_WGM64
    SolutionIndex: 125
    SolutionNameMin: Cijk_Ailk_Bjlk_SB_MT64x64x16_SE_EPS1_GSU1_PGR1_PLR1_SNLL1_TT4_4_VW4_WG16_16_1_WGM64
    SolutionIndex: 126
    SolutionNameMin: Cijk_Ailk_Bjlk_SB_MT032x008x08_GRVW02_GSU01_SNLL0_TT02_02_VW02_WG16_04_01
    SolutionIndex: 127
    SolutionNameMin: Cijk_Ailk_Bjlk_SB_MT016x016x08_GRVW02_GSU01_SNLL0_TT02_02_VW02_WG08_08_01
    SolutionIndex: 128
    SolutionNameMin: Cijk_Ailk_Bjlk_SB_MT032x016x08_GRVW02_GSU01_SNLL0_TT04_02_VW02_WG08_08_01
    SolutionIndex: 129
    SolutionNameMin: Cijk_Ailk_Bjlk_SB_MT032x032x08_GRVW04_GSU01_SNLL0_TT04_04_VW04_WG08_08_01
    SolutionIndex: 130
    SolutionNameMin: Cijk_Ailk_Bjlk_SB_MT032x016x08_GRVW02_GSU01_SNLL0_TT02_02_VW02_WG16_08_01
    SolutionIndex: 131
    SolutionNameMin: Cijk_Ailk_Bjlk_SB_MT064x016x08_GRVW02_GSU01_SNLL0_TT04_02_VW02_WG16_08_01
    SolutionIndex: 132
    SolutionNameMin: Cijk_Ailk_Bjlk_SB_MT016x016x08_GRVW02_GSU01_SNLL0_TT02_02_VW02_WG08_08_01
    SolutionIndex: 133
    SolutionNameMin: Cijk_Ailk_Bjlk_SB_MT032x016x08_GRVW02_GSU01_SNLL0_TT04_02_VW02_WG08_08_01
    SolutionIndex: 134
    SolutionNameMin: Cijk_Ailk_Bjlk_SB_MT032x032x08_GRVW04_GSU01_SNLL0_TT04_04_VW04_WG08_08_01
    SolutionIndex: 135
    SolutionNameMin: Cijk_Ailk_Bjlk_SB_MT032x016x08_GRVW02_GSU01_SNLL0_TT02_02_VW02_WG16_08_01
    SolutionIndex: 136
    SolutionNameMin: Cijk_Ailk_Bjlk_SB_MT064x016x08_GRVW02_GSU01_SNLL0_TT04_02_VW02_WG16_08_01
    SolutionIndex: 137
    SolutionNameMin: Cijk_Ailk_Bjlk_SB_MT064x008x16_GRVW02_GSU01_SNLL0_TT02_02_VW02_WG32_04_01
    SolutionIndex: 138
    SolutionNameMin: Cijk_Ailk_Bjlk_SB_MT016x016x16_GRVW02_GSU01_SNLL0_TT02_02_VW02_WG08_08_01
    SolutionIndex: 139
    SolutionNameMin: Cijk_Ailk_Bjlk_SB_MT032x016x16_GRVW02_GSU01_SNLL0_TT04_02_VW02_WG08_08_01
    SolutionIndex: 140
    SolutionNameMin: Cijk_Ailk_Bjlk_SB_MT032x032x16_GRVW04_GSU01_SNLL0_TT04_04_VW04_WG08_08_01
    SolutionIndex: 141
    SolutionNameMin: Cijk_Ailk_Bjlk_SB_MT064x016x16_GRVW02_GSU01_SNLL0_TT04_02_VW02_WG16_08_01
    SolutionIndex: 142
    SolutionNameMin: Cijk_Ailk_Bjlk_SB_MT064x032x16_GRVW04_GSU01_SNLL0_TT04_04_VW04_WG16_08_01
    SolutionIndex: 143
    SolutionNameMin: Cijk_Ailk_Bjlk_SB_MT064x008x16_GRVW02_GSU01_SNLL0_TT02_02_VW02_WG32_04_01
    SolutionIndex: 144
    SolutionNameMin: Cijk_Ailk_Bjlk_SB_MT032x008x16_GRVW02_GSU01_SNLL0_TT02_02_VW02_WG16_04_01
    SolutionIndex: 145
    SolutionNameMin: Cijk_Ailk_Bjlk_SB_MT016x016x16_GRVW02_GSU01_SNLL0_TT02_02_VW02_WG08_08_01
    SolutionIndex: 146
    SolutionNameMin: Cijk_Ailk_Bjlk_SB_MT016x016x24_GRVW02_GSU01_SNLL0_TT02_02_VW02_WG08_08_01
    SolutionIndex: 147
    SolutionNameMin: Cijk_Ailk_Bjlk_SB_MT016x016x08_GRVW02_GSU02_SNLL0_TT02_02_VW02_WG08_08_02
    SolutionIndex: 148
    SolutionNameMin: Cijk_Ailk_Bjlk_SB_MT032x016x08_GRVW02_GSU02_SNLL0_TT04_02_VW02_WG08_08_02
    SolutionIndex: 149
    SolutionNameMin: Cijk_Ailk_Bjlk_SB_MT016x016x08_GRVW02_GSU04_SNLL0_TT02_02_VW02_WG08_08_02
    SolutionIndex: 150
    SolutionNameMin: Cijk_Ailk_Bjlk_SB_MT016x016x08_GRVW02_GSU08_SNLL0_TT02_02_VW02_WG08_08_02
    SolutionIndex: 151
    SolutionNameMin: Cijk_Ailk_Bjlk_SB_MT016x016x16_GRVW02_GSU02_SNLL0_TT02_02_VW02_WG08_08_02
    SolutionIndex: 152
    SolutionNameMin: Cijk_Ailk_Bjlk_SB_MT032x016x16_GRVW02_GSU02_SNLL0_TT04_02_VW02_WG08_08_02
    SolutionIndex: 153
    SolutionNameMin: Cijk_Ailk_Bjlk_SB_MT032x032x16_GRVW04_GSU02_SNLL0_TT04_04_VW04_WG08_08_02
    SolutionIndex: 154
    SolutionNameMin: Cijk_Ailk_Bjlk_SB_MT064x032x16_GRVW04_GSU02_SNLL0_TT08_04_VW04_WG08_08_02
    SolutionIndex: 155
    SolutionNameMin: Cijk_Ailk_Bjlk_SB_MT016x016x16_GRVW02_GSU02_SNLL0_TT02_02_VW02_WG08_08_04
    SolutionIndex: 156
    SolutionNameMin: Cijk_Ailk_Bjlk_SB_MT032x016x16_GRVW02_GSU02_SNLL0_TT04_02_VW02_WG08_08_04
    SolutionIndex: 157
    SolutionNameMin: Cijk_Ailk_Bjlk_SB_MT032x016x16_GRVW02_GSU02_SNLL0_TT02_02_VW02_WG16_08_02
    SolutionIndex: 158
    SolutionNameMin: Cijk_Ailk_Bjlk_SB_MT064x016x16_GRVW02_GSU02_SNLL0_TT04_02_VW02_WG16_08_02
    SolutionIndex: 159
    SolutionNameMin: Cijk_Ailk_Bjlk_SB_MT064x016x16_GRVW04_GSU02_SNLL0_TT04_04_VW04_WG16_04_04
    SolutionIndex: 160
    SolutionNameMin: Cijk_Ailk_Bjlk_SB_MT016x016x16_GRVW02_GSU02_SNLL0_TT02_02_VW02_WG08_08_02
    SolutionIndex: 161
    SolutionNameMin: Cijk_Ailk_Bjlk_SB_MT032x016x16_GRVW02_GSU02_SNLL0_TT04_02_VW02_WG08_08_02
    SolutionIndex: 162
    SolutionNameMin: Cijk_Ailk_Bjlk_SB_MT032x032x16_GRVW04_GSU02_SNLL0_TT04_04_VW04_WG08_08_02
    SolutionIndex: 163
    SolutionNameMin: Cijk_Ailk_Bjlk_SB_MT016x016x16_GRVW02_GSU02_SNLL0_TT02_02_VW02_WG08_08_04
    SolutionIndex: 164
    SolutionNameMin: Cijk_Ailk_Bjlk_SB_MT032x016x16_GRVW02_GSU02_SNLL0_TT04_02_VW02_WG08_08_04
    SolutionIndex: 165
    SolutionNameMin: Cijk_Ailk_Bjlk_SB_MT032x016x16_GRVW02_GSU02_SNLL0_TT02_02_VW02_WG16_08_02
    SolutionIndex: 166
    SolutionNameMin: Cijk_Ailk_Bjlk_SB_MT016x016x16_GRVW02_GSU04_SNLL0_TT02_02_VW02_WG08_08_04
    SolutionIndex: 167
    SolutionNameMin: Cijk_Ailk_Bjlk_SB_MT032x032x16_GRVW04_GSU04_SNLL0_TT04_04_VW04_WG08_08_02
    SolutionIndex: 168
    SolutionNameMin: Cijk_Ailk_Bjlk_SB_MT016x016x16_GRVW02_GSU04_SNLL0_TT02_02_VW02_WG08_08_04
    SolutionIndex: 169
    SolutionNameMin: Cijk_Ailk_Bjlk_SB_MT016x016x16_GRVW02_GSU08_SNLL0_TT02_02_VW02_WG08_08_04
    SolutionIndex: 170
    SolutionNameMin: Cijk_Ailk_Bjlk_SB_MT032x008x32_GRVW02_GSU02_SNLL0_TT02_02_VW02_WG16_04_04
    SolutionIndex: 171
    SolutionNameMin: Cijk_Ailk_Bjlk_SB_MT032x016x32_GRVW02_GSU02_SNLL0_TT04_02_VW02_WG08_08_02
    SolutionIndex: 172
    SolutionNameMin: Cijk_Ailk_Bjlk_SB_MT016x016x32_GRVW02_GSU02_SNLL0_TT02_02_VW02_WG08_08_04
    SolutionIndex: 173
    SolutionNameMin: Cijk_Ailk_Bjlk_SB_MT032x016x32_GRVW02_GSU02_SNLL0_TT04_02_VW02_WG08_08_04
    SolutionIndex: 174
    SolutionNameMin: Cijk_Ailk_Bjlk_SB_MT032x032x32_GRVW04_GSU02_SNLL0_TT04_04_VW04_WG08_08_04
    SolutionIndex: 175
    SolutionNameMin: Cijk_Ailk_Bjlk_SB_MT064x032x32_GRVW04_GSU02_SNLL0_TT08_04_VW04_WG08_08_04
    SolutionIndex: 176
    SolutionNameMin: Cijk_Ailk_Bjlk_SB_MT064x032x32_GRVW04_GSU02_SNLL0_TT04_04_VW04_WG16_08_02
    SolutionIndex: 177
    SolutionNameMin: Cijk_Ailk_Bjlk_SB_MT128x032x32_GRVW04_GSU02_SNLL0_TT08_08_VW04_WG16_04_04
    SolutionIndex: 178
    SolutionNameMin: Cijk_Ailk_Bjlk_SB_MT032x016x32_GRVW02_GSU02_SNLL0_TT04_02_VW02_WG08_08_02
    SolutionIndex: 179
    SolutionNameMin: Cijk_Ailk_Bjlk_SB_MT032x032x32_GRVW04_GSU02_SNLL0_TT04_04_VW04_WG08_08_02
    SolutionIndex: 180
    SolutionNameMin: Cijk_Ailk_Bjlk_SB_MT016x016x32_GRVW02_GSU02_SNLL0_TT02_02_VW02_WG08_08_04
    SolutionIndex: 181
    SolutionNameMin: Cijk_Ailk_Bjlk_SB_MT032x016x32_GRVW02_GSU02_SNLL0_TT04_02_VW02_WG08_08_04
    SolutionIndex: 182
    SolutionNameMin: Cijk_Ailk_Bjlk_SB_MT032x032x32_GRVW04_GSU02_SNLL0_TT04_04_VW04_WG08_08_04
    SolutionIndex: 183
    SolutionNameMin: Cijk_Ailk_Bjlk_SB_MT064x032x32_GRVW04_GSU02_SNLL0_TT08_04_VW04_WG08_08_04
    SolutionIndex: 184
    SolutionNameMin: Cijk_Ailk_Bjlk_SB_MT064x008x32_GRVW02_GSU04_SNLL0_TT04_02_VW02_WG16_04_04
    SolutionIndex: 185
    SolutionNameMin: Cijk_Ailk_Bjlk_SB_MT016x016x32_GRVW02_GSU04_SNLL0_TT02_02_VW02_WG08_08_04
    SolutionIndex: 186
    SolutionNameMin: Cijk_Ailk_Bjlk_SB_MT032x016x32_GRVW02_GSU04_SNLL0_TT04_02_VW02_WG08_08_04
    SolutionIndex: 187
    SolutionNameMin: Cijk_Ailk_Bjlk_SB_MT032x032x32_GRVW04_GSU04_SNLL0_TT04_04_VW04_WG08_08_04
    SolutionIndex: 188
    SolutionNameMin: Cijk_Ailk_Bjlk_SB_MT032x032x32_GRVW04_GSU04_SNLL0_TT04_04_VW04_WG08_08_04
    SolutionIndex: 189
    SolutionNameMin: Cijk_Ailk_Bjlk_SB_MT032x008x32_GRVW02_GSU08_SNLL0_TT02_02_VW02_WG16_04_04
    SolutionIndex: 190
    SolutionNameMin: Cijk_Ailk_Bjlk_SB_MT016x016x32_GRVW02_GSU08_SNLL0_TT02_02_VW02_WG08_08_04
    SolutionIndex: 191
    SolutionNameMin: Cijk_Ailk_Bjlk_SB_MT128x128x08_GRVW04_GSU01_SNLL0_TT08_08_VW04_WG16_16_01
    SolutionIndex: 192
    SolutionNameMin: Cijk_Ailk_Bjlk_SB_MT064x064x16_GRVW04_GSU01_SNLL0_TT04_04_VW04_WG16_16_01
    SolutionIndex: 193
    SolutionNameMin: Cijk_Ailk_Bjlk_SB_MT064x128x16_GRVW04_GSU01_SNLL0_TT04_08_VW04_WG16_16_01
    SolutionIndex: 194
    SolutionNameMin: Cijk_Ailk_Bjlk_SB_MT128x064x16_GRVW04_GSU01_SNLL0_TT08_04_VW04_WG16_16_01
    SolutionIndex: 195
    SolutionNameMin: Cijk_Ailk_Bjlk_SB_MT064x064x16_GRVW04_GSU01_SNLL0_TT04_04_VW04_WG16_16_01
    SolutionIndex: 196
    SolutionNameMin: Cijk_Ailk_Bjlk_SB_MT064x128x16_GRVW04_GSU01_SNLL0_TT04_08_VW04_WG16_16_01
    SolutionIndex: 197
    SolutionNameMin: Cijk_Ailk_Bjlk_SB_MT128x064x16_GRVW04_GSU01_SNLL0_TT08_04_VW04_WG16_16_01
    SolutionIndex: 198
    SolutionNameMin: Cijk_Ailk_Bjlk_SB_MT128x128x08_GRVW04_GSU01_SNLL1_TT08_08_VW04_WG16_16_01
    SolutionIndex: 199
    SolutionNameMin: Cijk_Ailk_Bjlk_SB_MT128x128x08_GRVW04_GSU01_SNLL1_TT08_08_VW04_WG16_16_01
    SolutionIndex: 200
    SolutionNameMin: Cijk_Ailk_Bjlk_SB_MT064x064x16_GRVW04_GSU01_SNLL1_TT04_04_VW04_WG16_16_01
    SolutionIndex: 201
    SolutionNameMin: Cijk_Ailk_Bjlk_SB_MT064x128x16_GRVW04_GSU01_SNLL1_TT04_08_VW04_WG16_16_01
    SolutionIndex: 202
    SolutionNameMin: Cijk_Ailk_Bjlk_SB_MT096x128x16_GRVW02_GSU01_SNLL1_TT06_08_VW02_WG16_16_01
    SolutionIndex: 203
    SolutionNameMin: Cijk_Ailk_Bjlk_SB_MT128x064x16_GRVW04_GSU01_SNLL1_TT08_04_VW04_WG16_16_01
    SolutionIndex: 204
    SolutionNameMin: Cijk_Ailk_Bjlk_SB_MT128x096x16_GRVW02_GSU01_SNLL1_TT08_06_VW02_WG16_16_01
    SolutionIndex: 205
    SolutionNameMin: Cijk_Ailk_Bjlk_SB_MT128x128x16_GRVW04_GSU01_SNLL1_TT08_08_VW04_WG16_16_01
    SolutionIndex: 206
    SolutionNameMin: Cijk_Ailk_Bjlk_SB_MT064x064x16_GRVW04_GSU01_SNLL1_TT04_04_VW04_WG16_16_01
    SolutionIndex: 207
    SolutionNameMin: Cijk_Ailk_Bjlk_SB_MT064x128x16_GRVW04_GSU01_SNLL1_TT04_08_VW04_WG16_16_01
    SolutionIndex: 208
    SolutionNameMin: Cijk_Ailk_Bjlk_SB_MT096x128x16_GRVW02_GSU01_SNLL1_TT06_08_VW02_WG16_16_01
    SolutionIndex: 209
    SolutionNameMin: Cijk_Ailk_Bjlk_SB_MT128x064x16_GRVW04_GSU01_SNLL1_TT08_04_VW04_WG16_16_01
    SolutionIndex: 210
    SolutionNameMin: Cijk_Ailk_Bjlk_SB_MT128x096x16_GRVW02_GSU01_SNLL1_TT08_06_VW02_WG16_16_01
    SolutionIndex: 211
    SolutionNameMin: Cijk_Ailk_Bjlk_SB_MT128x128x16_GRVW04_GSU01_SNLL1_TT08_08_VW04_WG16_16_01
    SolutionIndex: 212
    SolutionNameMin: Cijk_Ailk_Bjlk_SB_MT016x016x04_GRVW02_GSU01_SNLL0_TT02_02_VW02_WG08_08_01
    SolutionIndex: 213
    SolutionNameMin: Cijk_Ailk_Bjlk_SB_MT032x032x02_GRVW04_GSU01_SNLL0_TT04_04_VW04_WG08_08_01
    SolutionIndex: 214
    SolutionNameMin: Cijk_Ailk_Bjlk_SB_MT008x008x08_GRVW02_GSU01_SNLL1_TT02_02_VW02_WG04_04_04
    SolutionIndex: 215
    SolutionNameMin: Cijk_Ailk_Bjlk_SB_MT016x016x16_GRVW02_GSU01_SNLL1_TT02_02_VW02_WG08_08_04
    SolutionIndex: 216
    SolutionNameMin: Cijk_Ailk_Bjlk_SB_MT008x008x08_GRVW02_GSU02_SNLL0_TT02_02_VW02_WG04_04_04
    SolutionIndex: 217
    SolutionNameMin: Cijk_Ailk_Bjlk_SB_MT016x016x04_GRVW02_GSU04_SNLL0_TT02_02_VW02_WG08_08_01
    SolutionIndex: 218
    SolutionNameMin: Cijk_Ailk_Bjlk_SB_MT008x008x08_GRVW02_GSU04_SNLL0_TT02_02_VW02_WG04_04_04
    SolutionIndex: 219
    SolutionNameMin: Cijk_Ailk_Bjlk_SB_MT016x016x04_GRVW02_GSU08_SNLL0_TT02_02_VW02_WG08_08_01
    SolutionIndex: 220
    SolutionNameMin: Cijk_Ailk_Bjlk_SB_MT008x008x08_GRVW02_GSU08_SNLL0_TT02_02_VW02_WG04_04_04
    SolutionIndex: 221
    SolutionNameMin: Cijk_Ailk_Bjlk_SB_MT016x016x08_GRVW02_GSU16_SNLL0_TT02_02_VW02_WG08_08_02
    SolutionIndex: 222
    SolutionNameMin: Cijk_Ailk_Bjlk_SB_MT008x008x08_GRVW02_GSU16_SNLL0_TT02_02_VW02_WG04_04_04
    SolutionIndex: 223
    SolutionNameMin: Cijk_Ailk_Bjlk_SB_MT016x016x16_GRVW02_GSU16_SNLL0_TT02_02_VW02_WG08_08_04
    SolutionIndex: 224
    SolutionNameMin: Cijk_Ailk_Bjlk_SB_MT064x128x08_DTL0_GRVW01_GSU01_PGR1_PLR1_TT04_08_USFGRO01_VW02_WG16_16_01_WGM01
    SolutionIndex: 225
    SolutionNameMin: Cijk_Ailk_Bjlk_SB_MT064x064x08_DTL0_GRVW01_GSU01_PGR1_PLR1_TT04_08_USFGRO01_VW04_WG16_08_01_WGM01
    SolutionIndex: 226
    SolutionNameMin: Cijk_Ailk_Bjlk_SB_MT032x256x08_DTL1_GRVW01_GSU01_PGR0_PLR1_TT04_08_USFGRO01_VW04_WG08_32_01_WGM01
    SolutionIndex: 227
    SolutionNameMin: Cijk_Ailk_Bjlk_SB_MT032x256x08_DTL1_GRVW01_GSU01_PGR0_PLR1_TT04_08_USFGRO01_VW04_WG08_32_01_WGM08
    SolutionIndex: 228
    SolutionNameMin: Cijk_Ailk_Bjlk_SB_MT032x256x08_DTL1_GRVW01_GSU01_PGR0_PLR1_TT04_08_USFGRO01_VW04_WG08_32_01_WGM64
    SolutionIndex: 229
    SolutionNameMin: Cijk_Ailk_Bjlk_SB_MT064x064x16_DTL0_GRVW01_GSU01_PGR0_PLR1_TT04_08_USFGRO01_VW04_WG16_08_01_WGM01
    SolutionIndex: 230
    SolutionNameMin: Cijk_Ailk_Bjlk_SB_MT064x064x16_DTL0_GRVW01_GSU01_PGR1_PLR1_TT04_04_USFGRO01_VW04_WG16_16_01_WGM01
    SolutionIndex: 231
    SolutionNameMin: Cijk_Ailk_Bjlk_SB_MT064x064x08_DTL0_GRVW04_GSU01_PGR1_PLR1_TT04_08_USFGRO0_VW04_WG16_08_01_WGM01
    SolutionIndex: 232
    SolutionNameMin: Cijk_Ailk_Bjlk_SB_MT032x128x08_DTL0_GRVW04_GSU01_PGR1_PLR1_TT04_04_USFGRO0_VW04_WG08_32_01_WGM01
    SolutionIndex: 233
    SolutionNameMin: Cijk_Ailk_Bjlk_SB_MT064x128x16_DTL0_GRVW04_GSU01_PGR0_PLR1_TT08_04_USFGRO0_VW04_WG08_32_01_WGM01
    SolutionIndex: 234
    SolutionNameMin: Cijk_Ailk_Bjlk_SB_MT064x064x16_DTL0_GRVW04_GSU01_PGR1_PLR1_TT04_04_USFGRO0_VW04_WG16_16_01_WGM01
    SolutionIndex: 235
    SolutionNameMin: Cijk_Ailk_Bjlk_SB_MT064x128x16_DTL0_GRVW04_GSU01_PGR0_PLR1_TT04_08_USFGRO0_VW04_WG16_16_01_WGM01
    SolutionIndex: 236
    SolutionNameMin: Cijk_Ailk_Bjlk_SB_MT064x064x16_DTL0_GRVW04_GSU01_PGR1_PLR1_TT04_04_USFGRO0_VW04_WG16_16_01_WGM08
    SolutionIndex: 237
    SolutionNameMin: Cijk_Ailk_Bjlk_SB_MT064x128x16_DTL0_GRVW04_GSU01_PGR0_PLR1_TT04_08_USFGRO0_VW04_WG16_16_01_WGM08
    SolutionIndex: 238
    SolutionNameMin: Cijk_Ailk_Bjlk_SB_MT64x32x8_SE_EPS0_GSU1_PGR0_PLR1_SNLL0_TT8_4_VW4_WG8_8_1_WGM1
    SolutionIndex: 239
    SolutionNameMin: Cijk_Ailk_Bjlk_SB_MT64x64x8_SE_EPS1_GSU1_PGR1_PLR1_SNLL1_TT8_8_VW4_WG8_8_1_WGM8
    SolutionIndex: 240
    SolutionNameMin: Cijk_Ailk_Bjlk_SB_MT64x32x8_SE_EPS0_GSU1_PGR0_PLR1_SNLL0_TT8_4_VW4_WG8_8_1_WGM64
    SolutionIndex: 241
    SolutionNameMin: Cijk_Ailk_Bjlk_SB_MT64x64x8_SE_EPS1_GSU1_PGR1_PLR1_SNLL1_TT8_8_VW4_WG8_8_1_WGM64
    SolutionIndex: 242
    SolutionNameMin: Cijk_Ailk_Bjlk_SB_MT128x32x16_SE_EPS0_GSU1_PGR0_PLR1_SNLL0_TT8_4_VW4_WG16_8_1_WGM1
    SolutionIndex: 243
    SolutionNameMin: Cijk_Ailk_Bjlk_SB_MT64x64x16_SE_EPS1_GSU1_PGR1_PLR1_SNLL1_TT4_4_VW4_WG16_16_1_WGM1
    SolutionIndex: 244
    SolutionNameMin: Cijk_Ailk_Bjlk_SB_MT128x32x16_SE_EPS0_GSU1_PGR0_PLR1_SNLL0_TT8_4_VW4_WG16_8_1_WGM8
    SolutionIndex: 245
    SolutionNameMin: Cijk_Ailk_Bjlk_SB_MT64x64x16_SE_EPS0_GSU1_PGR0_PLR0_SNLL0_TT4_4_VW4_WG16_16_1_WGM8
    SolutionIndex: 246
    SolutionNameMin: Cijk_Ailk_Bjlk_SB_MT64x64x16_SE_EPS0_GSU1_PGR0_PLR1_SNLL0_TT4_4_VW4_WG16_16_1_WGM8
    SolutionIndex: 247
    SolutionNameMin: Cijk_Ailk_Bjlk_SB_MT64x64x16_SE_EPS1_GSU1_PGR1_PLR1_SNLL1_TT4_4_VW4_WG16_16_1_WGM8
    SolutionIndex: 248
    SolutionNameMin: Cijk_Ailk_Bjlk_SB_MT128x32x16_SE_EPS0_GSU1_PGR0_PLR1_SNLL0_TT8_4_VW4_WG16_8_1_WGM64
    SolutionIndex: 249
    SolutionNameMin: Cijk_Ailk_Bjlk_SB_MT64x64x16_SE_EPS0_GSU1_PGR0_PLR0_SNLL0_TT4_4_VW4_WG16_16_1_WGM64
    SolutionIndex: 250
    SolutionNameMin: Cijk_Ailk_Bjlk_SB_MT64x64x16_SE_EPS0_GSU1_PGR0_PLR1_SNLL0_TT4_4_VW4_WG16_16_1_WGM64
    SolutionIndex: 251
    SolutionNameMin: Cijk_Ailk_Bjlk_SB_MT64x64x16_SE_EPS1_GSU1_PGR1_PLR1_SNLL1_TT4_4_VW4_WG16_16_1_WGM64
- - - [1024, 128, 1, 128]
    - [4, 1028.02]
  - - [4, 704, 1, 1280]
    - [43, 363.355]
  - - [4, 1856, 1, 3328]
    - [43, 579.434]
  - - [1856, 448, 1, 3328]
    - [80, 6966.73]
  - - [2944, 4288, 1, 1280]
    - [75, 9057.88]
  - - [2368, 64, 1, 3328]
    - [36, 5837.56]
  - - [2368, 5888, 1, 256]
    - [80, 9111.06]
  - - [128, 64, 1, 256]
    - [42, 374.491]
  - - [5888, 1024, 1, 1280]
    - [85, 8570.44]
  - - [128, 6784, 1, 3328]
    - [48, 7703.86]
  - - [64, 4, 1, 256]
    - [94, 11.2219]
  - - [5888, 1856, 1, 3328]
    - [80, 9394.3]
  - - [5056, 704, 1, 256]
    - [83, 8026.89]
  - - [5888, 2944, 1, 3328]
    - [73, 7608.11]
  - - [1856, 4288, 1, 256]
    - [74, 8986.32]
  - - [1024, 5056, 1, 128]
    - [66, 3898.24]
  - - [5056, 5056, 1, 3328]
    - [74, 9536.75]
  - - [1408, 5888, 1, 1280]
    - [75, 9279.09]
  - - [2368, 448, 1, 128]
    - [67, 2474.32]
  - - [1024, 3584, 1, 3328]
    - [77, 9258.48]
  - - [4, 2944, 1, 1280]
    - [29, 611.74]
  - - [1408, 64, 1, 128]
    - [0, 858.21]
  - - [256, 4288, 1, 3328]
    - [80, 7615.98]
  - - [5888, 1408, 1, 1280]
    - [73, 9620.29]
  - - [704, 1856, 1, 3328]
    - [74, 9033.65]
  - - [4, 1408, 1, 128]
    - [87, 24.355]
  - - [1024, 2368, 1, 256]
    - [74, 7526.15]
  - - [1408, 1856, 1, 1280]
    - [77, 8324.09]
  - - [1408, 64, 1, 1280]
    - [48, 4681.14]
  - - [448, 1024, 1, 1280]
    - [74, 7112.43]
  - - [256, 1408, 1, 3328]
    - [80, 5825.41]
  - - [5056, 5056, 1, 1280]
    - [83, 9233.55]
  - - [448, 5056, 1, 256]
    - [75, 7003.17]
  - - [704, 1856, 1, 1280]
    - [74, 8877.28]
  - - [128, 5056, 1, 128]
    - [66, 2301.04]
  - - [2368, 128, 1, 256]
    - [74, 3848.94]
  - - [1856, 1408, 1, 128]
    - [69, 4202.21]
  - - [64, 5056, 1, 256]
    - [75, 3109.52]
  - - [6784, 256, 1, 3328]
    - [74, 6388.43]
  - - [6784, 4288, 1, 3328]
    - [85, 9114.57]
  - - [4288, 448, 1, 256]
    - [78, 5782.95]
  - - [64, 704, 1, 128]
    - [11, 379.419]
  - - [1856, 2368, 1, 3328]
    - [74, 9128.36]
  - - [4288, 2944, 1, 1280]
    - [80, 9182.23]
  - - [704, 5056, 1, 1280]
    - [74, 9071.47]
  - - [2368, 704, 1, 3328]
    - [80, 7731.33]
  - - [256, 5888, 1, 256]
    - [74, 7920.28]
  - - [1856, 4288, 1, 3328]
    - [80, 9329.97]
  - - [256, 2944, 1, 256]
    - [81, 5312.17]
  - - [5888, 1024, 1, 256]
    - [72, 6710.87]
  - - [448, 64, 1, 1280]
    - [47, 2814.43]
  - - [448, 5056, 1, 3328]
    - [74, 8255.43]
  - - [3584, 4, 1, 1280]
    - [23, 640.715]
  - - [2944, 64, 1, 256]
    - [22, 2621.44]
  - - [128, 4, 1, 1280]
    - [94, 86.2316]
  - - [1408, 2944, 1, 256]
    - [74, 8848.89]
  - - [256, 1856, 1, 1280]
    - [74, 7366.45]
  - - [6784, 5056, 1, 3328]
    - [85, 8332.06]
  - - [5056, 5056, 1, 256]
    - [80, 9171.64]
  - - [1408, 6784, 1, 128]
    - [66, 5079.09]
  - - [64, 1024, 1, 1280]
    - [38, 3679.21]
  - - [2944, 4, 1, 256]
    - [29, 369.443]
  - - [704, 5056, 1, 128]
    - [66, 4509.17]
  - - [4, 2368, 1, 1280]
    - [23, 569.744]
  - - [2368, 2944, 1, 1280]
    - [85, 7451.04]
  - - [128, 3584, 1, 1280]
    - [83, 6071.16]
  - - [6784, 6784, 1, 1280]
    - [80, 9535.64]
  - - [1024, 256, 1, 3328]
    - [74, 5742.58]
  - - [1408, 4288, 1, 1280]
    - [83, 8254.99]
  - - [3584, 4288, 1, 1280]
    - [85, 9651.09]
  - - [2368, 704, 1, 1280]
    - [80, 8291.3]
  - - [5056, 4288, 1, 3328]
    - [72, 9406.26]
  - - [3584, 2368, 1, 3328]
    - [80, 9350.22]
  - - [64, 704, 1, 1280]
    - [47, 3384.49]
  - - [4288, 256, 1, 256]
    - [80, 5593.52]
  - - [2944, 128, 1, 128]
    - [2, 2130.5]
  - - [6784, 448, 1, 1280]
    - [83, 8815.75]
  - - [1408, 2944, 1, 128]
    - [66, 4558.24]
  - - [4288, 2944, 1, 256]
    - [85, 7865.33]
  - - [5888, 704, 1, 1280]
    - [74, 9262.89]
  - - [1856, 64, 1, 1280]
    - [48, 4359.05]
  - - [448, 5888, 1, 128]
    - [69, 4000.49]
  - - [5888, 64, 1, 3328]
    - [49, 6603.29]
  - - [2944, 256, 1, 3328]
    - [74, 8423.53]
  - - [1024, 64, 1, 128]
    - [19, 582.542]
  - - [5056, 2368, 1, 1280]
    - [74, 9419.81]
  - - [448, 3584, 1, 1280]
    - [74, 7985.72]
  - - [6784, 5888, 1, 256]
    - [72, 9494.26]
  - - [704, 1024, 1, 128]
    - [66, 2813.25]
  - - [704, 128, 1, 1280]
    - [48, 4477.61]
  - - [5888, 2944, 1, 128]
    - [69, 4745.86]
  - - [4, 3584, 1, 128]
    - [86, 96.379]
  - - [1408, 448, 1, 1280]
    - [74, 6912.7]
  - - [1024, 1408, 1, 256]
    - [82, 5810.75]
  - - [2368, 2368, 1, 3328]
    - [83, 9088.61]
  - - [1856, 6784, 1, 128]
    - [69, 5168.22]
  - - [5056, 704, 1, 3328]
    - [75, 7464.8]
  - - [1408, 1856, 1, 256]
    - [80, 6727.59]
  - - [1408, 704, 1, 3328]
    - [80, 8379.43]
  - - [2368, 5056, 1, 256]
    - [80, 8664.01]
  - - [5888, 1856, 1, 256]
    - [85, 5809.92]
  - - [4288, 64, 1, 3328]
    - [62, 6583.84]
  - - [2368, 4, 1, 1280]
    - [95, 545.151]
  - - [704, 5888, 1, 256]
    - [80, 8813.61]
  - - [4288, 64, 1, 256]
    - [38, 3059.87]
  - - [6784, 64, 1, 256]
    - [80, 3490.86]
  - - [2944, 256, 1, 256]
    - [74, 6970.3]
  - - [2944, 6784, 1, 3328]
    - [74, 9475.69]
  - - [704, 1408, 1, 3328]
    - [74, 8154.08]
  - - [3584, 704, 1, 3328]
    - [74, 8994.97]
  - - [2944, 256, 1, 128]
    - [66, 2824.03]
  - - [6784, 4, 1, 1280]
    - [23, 625.614]
  - - [1024, 64, 1, 1280]
    - [35, 3307.81]
  - - [448, 4288, 1, 256]
    - [80, 6074.38]
  - - [64, 3584, 1, 3328]
    - [28, 6200.16]
  - - [704, 2368, 1, 1280]
    - [74, 8291.3]
  - - [448, 2944, 1, 128]
    - [66, 3221.77]
  - - [1856, 2368, 1, 1280]
    - [85, 6855.14]
  - - [2368, 128, 1, 3328]
    - [36, 6479.51]
  - - [2944, 128, 1, 256]
    - [74, 3828.13]
  - - [448, 1408, 1, 256]
    - [75, 4525.8]
  - - [1856, 4288, 1, 1280]
    - [73, 9160.22]
  - - [64, 5056, 1, 3328]
    - [56, 6819.2]
  - - [4, 704, 1, 256]
    - [40, 123.441]
  - - [1024, 448, 1, 128]
    - [69, 1989.17]
  - - [704, 4, 1, 1280]
    - [43, 381.831]
  - - [704, 256, 1, 128]
    - [66, 1109.07]
  - - [704, 2944, 1, 128]
    - [66, 4088.93]
  - - [1408, 1024, 1, 1280]
    - [80, 8191.98]
  - - [704, 6784, 1, 256]
    - [74, 6717.8]
  - - [6784, 704, 1, 256]
    - [80, 5429.12]
  - - [5056, 1408, 1, 128]
    - [66, 4954.4]
  - - [256, 3584, 1, 3328]
    - [74, 7890.86]
  - - [4, 5888, 1, 3328]
    - [91, 690.947]
  - - [128, 1408, 1, 128]
    - [13, 1393.04]
  - - [3584, 4288, 1, 3328]
    - [76, 8900.77]
  - - [5888, 1856, 1, 1280]
    - [77, 9345.75]
  - - [5056, 1024, 1, 3328]
    - [78, 7834.74]
  - - [5056, 64, 1, 1280]
    - [56, 5890.04]
  - - [1024, 704, 1, 256]
    - [74, 6007.47]
  - - [1024, 4288, 1, 128]
    - [68, 3496.99]
  - - [4288, 64, 1, 1280]
    - [53, 4726.49]
  - - [2368, 3584, 1, 1280]
    - [72, 8128.72]
  - - [2368, 6784, 1, 1280]
    - [72, 9478.62]
  - - [1024, 256, 1, 256]
    - [80, 4092.0]
  - - [1856, 4, 1, 1280]
    - [95, 509.803]
  - - [448, 448, 1, 256]
    - [80, 3001.18]
  - - [2944, 3584, 1, 3328]
    - [81, 9081.81]
  - - [128, 4288, 1, 128]
    - [1, 2323.23]
  - - [64, 448, 1, 256]
    - [44, 1066.87]
  - - [128, 1024, 1, 3328]
    - [57, 6392.26]
  - - [4, 1408, 1, 3328]
    - [40, 616.556]
  - - [6784, 2944, 1, 256]
    - [83, 8547.63]
  - - [64, 1856, 1, 1280]
    - [56, 4409.61]
  - - [64, 1024, 1, 128]
    - [0, 554.802]
  - - [4288, 2368, 1, 3328]
    - [76, 8779.98]
  - - [1856, 2368, 1, 256]
    - [83, 4976.64]
  - - [3584, 256, 1, 128]
    - [68, 2812.27]
  - - [3584, 6784, 1, 3328]
    - [78, 9278.12]
  - - [256, 1024, 1, 256]
    - [74, 4346.43]
  - - [4, 6784, 1, 3328]
    - [93, 681.266]
  - - [1024, 5888, 1, 3328]
    - [74, 9187.51]
  - - [1024, 128, 1, 1280]
    - [26, 3659.95]
  - - [4288, 128, 1, 1280]
    - [80, 6019.07]
  - - [5056, 4288, 1, 1280]
    - [72, 9343.86]
  - - [5888, 64, 1, 256]
    - [74, 4692.07]
  - - [1856, 256, 1, 1280]
    - [80, 4790.28]
  - - [64, 5888, 1, 3328]
    - [48, 6702.1]
  - - [2944, 5888, 1, 128]
    - [69, 5202.55]
  - - [704, 5888, 1, 1280]
    - [74, 9264.19]
  - - [2368, 3584, 1, 128]
    - [66, 5053.61]
  - - [6784, 5888, 1, 3328]
    - [72, 7926.7]
  - - [704, 1024, 1, 1280]
    - [73, 5402.5]
  - - [448, 256, 1, 3328]
    - [56, 6124.55]
  - - [448, 1856, 1, 128]
    - [67, 2885.86]
  - - [128, 1024, 1, 128]
    - [1, 1013.12]
  - - [2944, 4, 1, 128]
    - [86, 77.5374]
  - - [1024, 704, 1, 1280]
    - [74, 7365.48]
  - - [128, 5888, 1, 256]
    - [74, 6990.51]
  - - [1024, 5056, 1, 1280]
    - [79, 9421.9]
  - - [4288, 1024, 1, 256]
    - [81, 6269.93]
  - - [2944, 2368, 1, 128]
    - [66, 4918.08]
  - - [704, 704, 1, 3328]
    - [74, 7963.55]
  - - [704, 1408, 1, 1280]
    - [74, 8347.22]
  - - [5888, 448, 1, 1280]
    - [80, 5216.95]
  - - [3584, 256, 1, 3328]
    - [74, 7802.15]
  - - [704, 5888, 1, 3328]
    - [80, 8381.36]
  - - [704, 1856, 1, 128]
    - [66, 3598.28]
  - - [128, 3584, 1, 3328]
    - [36, 7161.01]
  - - [6784, 2368, 1, 1280]
    - [85, 9464.31]
  - - [4, 4288, 1, 128]
    - [86, 132.58]
  - - [128, 704, 1, 1280]
    - [48, 4463.75]
  - - [3584, 2944, 1, 256]
    - [85, 8201.14]
  - - [1856, 128, 1, 3328]
    - [27, 6575.4]
  - - [4, 64, 1, 1280]
    - [43, 43.5745]
  - - [4, 5056, 1, 3328]
    - [23, 675.215]
  - - [128, 2944, 1, 1280]
    - [27, 5916.89]
  - - [2368, 1024, 1, 3328]
    - [80, 8646.74]
  - - [128, 256, 1, 3328]
    - [61, 4130.75]
  - - [1408, 5056, 1, 3328]
    - [79, 9529.65]
  - - [1856, 1856, 1, 3328]
    - [78, 8114.89]
  - - [3584, 128, 1, 256]
    - [74, 5603.08]
  - - [448, 1408, 1, 3328]
    - [74, 7072.93]
  - - [2368, 2368, 1, 256]
    - [81, 7648.66]
  - - [4288, 4288, 1, 1280]
    - [76, 9244.01]
  - - [64, 448, 1, 1280]
    - [47, 2885.23]
  - - [1408, 4288, 1, 256]
    - [74, 8080.31]
  - - [448, 4, 1, 256]
    - [92, 84.3294]
  - - [5888, 448, 1, 128]
    - [69, 3540.7]
  - - [448, 4, 1, 1280]
    - [43, 322.157]
  - - [704, 6784, 1, 3328]
    - [73, 8613.48]
  - - [5888, 5888, 1, 1280]
    - [80, 9501.95]
  - - [5056, 1024, 1, 1280]
    - [83, 9110.01]
  - - [448, 5888, 1, 3328]
    - [74, 8586.33]
  - - [128, 4, 1, 128]
    - [86, 4.17959]
  - - [1024, 2944, 1, 1280]
    - [82, 7096.43]
  - - [5056, 5888, 1, 1280]
    - [73, 9693.41]
  - - [4288, 5888, 1, 128]
    - [66, 5406.36]
  - - [256, 3584, 1, 256]
    - [74, 6908.27]
  - - [1408, 3584, 1, 128]
    - [66, 4645.59]
  - - [256, 2944, 1, 3328]
    - [77, 6284.3]
  - - [448, 3584, 1, 128]
    - [69, 3675.27]
  - - [5888, 2944, 1, 1280]
    - [79, 9628.8]
  - - [4, 6784, 1, 1280]
    - [23, 688.076]
  - - [2368, 5888, 1, 128]
    - [66, 5273.86]
  - - [64, 2944, 1, 128]
    - [10, 1316.44]
  - - [3584, 5888, 1, 256]
    - [80, 9239.04]
  - - [2368, 704, 1, 128]
    - [69, 3537.55]
  - - [3584, 2944, 1, 1280]
    - [74, 9324.52]
  - - [3584, 2368, 1, 128]
    - [66, 4766.24]
  - - [5056, 704, 1, 128]
    - [66, 4487.85]
  - - [448, 2368, 1, 128]
    - [69, 2876.92]
  - - [5056, 1408, 1, 3328]
    - [85, 9515.87]
  - - [1408, 704, 1, 256]
    - [77, 6836.08]
  - - [6784, 1024, 1, 3328]
    - [72, 9309.55]
  - - [6784, 2944, 1, 3328]
    - [73, 9536.48]
  - - [2944, 5056, 1, 3328]
    - [74, 9526.15]
  - - [1856, 1856, 1, 256]
    - [74, 5239.14]
  - - [1024, 5888, 1, 128]
    - [66, 4006.18]
  - - [2048, 7133, 1, 2048]
    - [72, 9827.97]
  - - [256, 4, 1, 128]
    - [87, 4.28908]
  - - [4288, 5888, 1, 1280]
    - [82, 9202.73]
  - - [4288, 4288, 1, 256]
    - [77, 5521.08]
  - - [448, 2944, 1, 3328]
    - [80, 7724.43]
  - - [4288, 1856, 1, 1280]
    - [80, 8826.24]
  - - [1856, 2944, 1, 3328]
    - [74, 9194.8]
  - - [256, 6784, 1, 3328]
    - [74, 8740.23]
  - - [64, 5888, 1, 256]
    - [74, 4766.25]
  - - [256, 5056, 1, 128]
    - [66, 2937.5]
  - - [5056, 1024, 1, 256]
    - [85, 5467.81]
  - - [704, 64, 1, 3328]
    - [62, 4818.33]
  - - [5056, 1856, 1, 3328]
    - [79, 8861.59]
  - - [4, 2944, 1, 3328]
    - [29, 662.002]
  - - [4, 5056, 1, 256]
    - [89, 494.021]
  - - [1856, 1408, 1, 256]
    - [74, 8674.68]
  - - [3584, 4, 1, 128]
    - [86, 108.196]
  - - [448, 448, 1, 3328]
    - [48, 6457.3]
  - - [6784, 128, 1, 3328]
    - [41, 7256.61]
  - - [4288, 1408, 1, 128]
    - [69, 4791.66]
  - - [4288, 5056, 1, 256]
    - [74, 8560.74]
  - - [1408, 128, 1, 1280]
    - [56, 5085.69]
  - - [5056, 256, 1, 3328]
    - [77, 7284.13]
  - - [704, 704, 1, 256]
    - [74, 6171.09]
  - - [1024, 5888, 1, 1280]
    - [79, 8852.79]
  - - [6784, 2368, 1, 128]
    - [67, 4729.2]
  - - [4, 5056, 1, 1280]
    - [40, 669.946]
  - - [64, 128, 1, 256]
    - [42, 369.217]
  - - [128, 1856, 1, 1280]
    - [36, 5549.03]
  - - [5056, 3584, 1, 256]
    - [80, 7115.74]
  - - [1856, 1024, 1, 1280]
    - [72, 8196.4]
  - - [6784, 4288, 1, 1280]
    - [73, 9509.56]
  - - [1856, 1856, 1, 1280]
    - [75, 5791.89]
  - - [6784, 2944, 1, 128]
    - [66, 5317.02]
  - - [1408, 5056, 1, 1280]
    - [75, 8980.63]
  - - [4, 2368, 1, 3328]
    - [40, 592.534]
  - - [5888, 1856, 1, 128]
    - [65, 4600.1]
  - - [448, 704, 1, 1280]
    - [74, 2286.48]
  - - [2368, 1024, 1, 128]
    - [69, 3911.02]
  - - [1024, 448, 1, 3328]
    - [74, 7295.14]
  - - [1856, 704, 1, 1280]
    - [74, 8881.02]
  - - [5056, 3584, 1, 128]
    - [66, 4911.58]
  - - [5888, 5888, 1, 3328]
    - [82, 9243.8]
  - - [6784, 1024, 1, 256]
    - [85, 5475.31]
  - - [2944, 2368, 1, 256]
    - [80, 5670.67]
  - - [256, 448, 1, 256]
    - [31, 2293.76]
  - - [5056, 5888, 1, 3328]
    - [75, 7847.97]
  - - [1856, 1024, 1, 256]
    - [80, 7517.6]
  - - [448, 1408, 1, 1280]
    - [74, 6917.44]
  - - [3584, 448, 1, 1280]
    - [80, 7980.76]
  - - [1024, 1024, 1, 1280]
    - [77, 8384.42]
  - - [448, 5888, 1, 256]
    - [74, 7365.65]
  - - [704, 64, 1, 128]
    - [19, 358.655]
  - - [1408, 6784, 1, 3328]
    - [80, 9094.09]
  - - [448, 1024, 1, 128]
    - [69, 1772.95]
  - - [4288, 704, 1, 128]
    - [66, 4355.28]
  - - [128, 1856, 1, 128]
    - [5, 1610.63]
  - - [448, 2368, 1, 3328]
    - [80, 7366.37]
  - - [5056, 64, 1, 128]
    - [5, 2157.23]
  - - [5056, 2944, 1, 256]
    - [74, 9123.06]
  - - [6784, 5888, 1, 128]
    - [65, 5285.8]
  - - [704, 1024, 1, 256]
    - [80, 6667.25]
  - - [1024, 4, 1, 256]
    - [29, 187.246]
  - - [2368, 1856, 1, 256]
    - [80, 6777.84]
  - - [128, 6784, 1, 1280]
    - [77, 7052.61]
  - - [1408, 3584, 1, 3328]
    - [81, 9037.95]
  - - [2368, 6784, 1, 256]
    - [74, 9181.35]
  - - [5056, 1408, 1, 1280]
    - [79, 9421.9]
  - - [256, 256, 1, 128]
    - [11, 543.304]
  - - [5056, 4288, 1, 128]
    - [69, 5339.92]
  - - [1408, 1856, 1, 128]
    - [66, 4270.89]
  - - [1408, 5888, 1, 3328]
    - [78, 9034.79]
  - - [1856, 256, 1, 256]
    - [80, 5847.83]
  - - [6784, 6784, 1, 256]
    - [73, 9624.38]
  - - [64, 256, 1, 128]
    - [12, 146.449]
  - - [4288, 2368, 1, 128]
    - [65, 3896.94]
  - - [1856, 4288, 1, 128]
    - [66, 4337.07]
  - - [256, 4288, 1, 1280]
    - [74, 7499.42]
  - - [2368, 2944, 1, 256]
    - [79, 7703.18]
  - - [4, 1856, 1, 256]
    - [92, 263.964]
  - - [3584, 1856, 1, 1280]
    - [74, 9224.33]
  - - [6784, 6784, 1, 128]
    - [66, 5476.03]
  - - [256, 1856, 1, 128]
    - [69, 1858.72]
  - - [704, 64, 1, 1280]
    - [47, 3368.67]
  - - [5888, 5056, 1, 256]
    - [80, 5859.81]
  - - [3584, 448, 1, 256]
    - [80, 7298.33]
  - - [448, 4288, 1, 128]
    - [66, 3813.45]
  - - [2944, 4288, 1, 3328]
    - [75, 9149.63]
  - - [256, 6784, 1, 256]
    - [74, 7984.85]
  - - [1408, 4288, 1, 128]
    - [69, 4728.34]
  - - [2944, 704, 1, 3328]
    - [80, 7149.76]
  - - [128, 448, 1, 256]
    - [46, 1699.08]
  - - [512, 32, 1, 512]
    - [46, 1127.5]
  - - [3584, 3584, 1, 256]
    - [75, 8558.01]
  - - [448, 1408, 1, 128]
    - [66, 2504.35]
  - - [128, 256, 1, 1280]
    - [47, 3216.49]
  - - [3584, 5056, 1, 256]
    - [72, 5674.35]
  - - [6784, 128, 1, 256]
    - [74, 6216.39]
  - - [4288, 4, 1, 256]
    - [90, 435.606]
  - - [64, 1408, 1, 3328]
    - [48, 6185.91]
  - - [704, 448, 1, 256]
    - [80, 4004.98]
  - - [2944, 2368, 1, 1280]
    - [81, 8542.7]
  - - [448, 64, 1, 3328]
    - [61, 3835.23]
  - - [1408, 3584, 1, 256]
    - [74, 8714.53]
  - - [3584, 4, 1, 3328]
    - [29, 689.454]
  - - [6784, 3584, 1, 256]
    - [79, 9271.24]
  - - [256, 128, 1, 128]
    - [12, 283.399]
  - - [704, 1408, 1, 128]
    - [66, 3210.47]
  - - [4, 2368, 1, 256]
    - [92, 360.838]
  - - [2944, 448, 1, 128]
    - [66, 3344.31]
  - - [128, 1408, 1, 256]
    - [74, 3186.28]
  - - [4, 2944, 1, 256]
    - [90, 384.522]
  - - [64, 128, 1, 3328]
    - [43, 2103.62]
  - - [5056, 2368, 1, 128]
    - [66, 5219.66]
  - - [2944, 2944, 1, 3328]
    - [83, 9174.59]
  - - [5056, 6784, 1, 256]
    - [85, 8992.26]
  - - [1856, 3584, 1, 128]
    - [66, 4957.17]
  - - [128, 2944, 1, 128]
    - [4, 2241.38]
  - - [1024, 704, 1, 3328]
    - [84, 6545.01]
  - - [6784, 448, 1, 256]
    - [80, 5379.15]
  - - [3584, 6784, 1, 128]
    - [66, 5101.91]
  - - [128, 4288, 1, 256]
    - [74, 5211.76]
  - - [704, 448, 1, 3328]
    - [75, 4504.05]
  - - [1024, 1024, 1, 3328]
    - [77, 8009.67]
  - - [128, 128, 1, 3328]
    - [60, 3184.93]
  - - [5056, 1856, 1, 256]
    - [74, 9138.33]
  - - [256, 128, 1, 256]
    - [46, 1205.26]
  - - [1024, 1856, 1, 256]
    - [85, 6374.99]
  - - [4288, 64, 1, 128]
    - [2, 1695.33]
  - - [256, 448, 1, 3328]
    - [49, 5659.57]
  - - [1408, 6784, 1, 1280]
    - [74, 9349.1]
  - - [3584, 3584, 1, 1280]
    - [79, 9302.09]
  - - [64, 2368, 1, 1280]
    - [48, 4432.97]
  - - [448, 2368, 1, 1280]
    - [74, 7250.67]
  - - [5888, 5888, 1, 128]
    - [66, 4615.93]
  - - [64, 6784, 1, 3328]
    - [80, 6987.13]
  - - [2944, 256, 1, 1280]
    - [83, 6127.35]
  - - [5056, 5888, 1, 128]
    - [65, 5106.29]
  - - [256, 2368, 1, 128]
    - [66, 2141.13]
  - - [5056, 2368, 1, 3328]
    - [77, 9041.65]
  - - [2944, 4288, 1, 256]
    - [85, 8691.12]
  - - [1408, 3584, 1, 1280]
    - [74, 9069.9]
  - - [2368, 64, 1, 256]
    - [46, 2412.77]
  - - [64, 448, 1, 3328]
    - [61, 3739.04]
  - - [256, 256, 1, 3328]
    - [48, 5304.08]
  - - [5888, 4, 1, 128]
    - [87, 105.555]
  - - [1856, 704, 1, 256]
    - [74, 8025.33]
  - - [4, 4288, 1, 1280]
    - [21, 578.97]
  - - [1408, 448, 1, 3328]
    - [82, 5714.41]
  - - [1024, 4, 1, 3328]
    - [40, 608.549]
  - - [2368, 256, 1, 256]
    - [80, 5172.98]
  - - [2368, 6784, 1, 3328]
    - [80, 9456.51]
  - - [1856, 1408, 1, 1280]
    - [85, 7805.09]
  - - [1856, 448, 1, 1280]
    - [72, 6184.94]
  - - [6784, 704, 1, 128]
    - [66, 4597.77]
  - - [4, 4, 1, 256]
    - [43, 0.691892]
  - - [128, 5888, 1, 128]
    - [4, 2691.66]
  - - [1408, 5888, 1, 256]
    - [79, 7164.17]
  - - [704, 2944, 1, 1280]
    - [81, 8139.71]
  - - [1856, 2368, 1, 128]
    - [69, 4623.28]
  - - [4096, 7133, 1, 4096]
    - [73, 9939.97]
  - - [256, 64, 1, 256]
    - [37, 689.853]
  - - [1024, 1024, 1, 256]
    - [80, 7216.01]
  - - [704, 1856, 1, 256]
    - [80, 6364.07]
  - - [128, 4288, 1, 3328]
    - [36, 7200.49]
  - - [3584, 704, 1, 1280]
    - [83, 7971.98]
  - - [256, 128, 1, 1280]
    - [34, 2702.52]
  - - [2368, 4, 1, 256]
    - [29, 325.918]
  - - [256, 2368, 1, 1280]
    - [74, 6638.83]
  - - [2944, 6784, 1, 128]
    - [65, 5233.43]
  - - [3584, 448, 1, 3328]
    - [74, 8094.3]
  - - [1408, 4, 1, 256]
    - [92, 243.546]
  - - [704, 2368, 1, 3328]
    - [74, 8403.01]
  - - [2944, 448, 1, 256]
    - [74, 7022.49]
  - - [1856, 448, 1, 128]
    - [69, 2842.69]
  - - [2368, 128, 1, 1280]
    - [56, 5685.42]
  - - [256, 5888, 1, 128]
    - [71, 2178.61]
  - - [64, 6784, 1, 256]
    - [74, 5385.13]
  - - [64, 5056, 1, 1280]
    - [48, 5603.19]
  - - [4, 6784, 1, 128]
    - [86, 180.156]
  - - [2944, 2944, 1, 1280]
    - [83, 9129.29]
  - - [5888, 2368, 1, 256]
    - [85, 6961.59]
  - - [4, 3584, 1, 1280]
    - [29, 646.13]
  - - [1408, 128, 1, 128]
    - [15, 1172.19]
  - - [6784, 704, 1, 3328]
    - [80, 9084.52]
  - - [128, 64, 1, 1280]
    - [59, 1260.31]
  - - [2368, 256, 1, 1280]
    - [80, 6643.38]
  - - [4, 448, 1, 3328]
    - [43, 433.414]
  - - [5888, 4288, 1, 128]
    - [67, 4753.07]
  - - [4, 5888, 1, 256]
    - [29, 471.04]
  - - [1408, 2944, 1, 3328]
    - [83, 9207.0]
  - - [3584, 704, 1, 128]
    - [69, 3762.36]
  - - [64, 1024, 1, 256]
    - [47, 1807.89]
  - - [5056, 5056, 1, 128]
    - [70, 4830.06]
  - - [2368, 448, 1, 1280]
    - [74, 7263.06]
  - - [128, 3584, 1, 256]
    - [77, 4369.07]
  - - [704, 448, 1, 1280]
    - [75, 4205.23]
  - - [448, 5056, 1, 128]
    - [66, 3855.47]
  - - [256, 4, 1, 1280]
    - [97, 157.538]
  - - [128, 5056, 1, 256]
    - [80, 6108.96]
  - - [1408, 5056, 1, 128]
    - [69, 4836.58]
  - - [2944, 3584, 1, 128]
    - [69, 4532.09]
  - - [3584, 2368, 1, 256]
    - [74, 8951.24]
  - - [5888, 5056, 1, 1280]
    - [85, 9276.39]
  - - [2368, 5056, 1, 128]
    - [69, 5167.56]
  - - [64, 704, 1, 256]
    - [29, 1501.87]
  - - [4288, 256, 1, 1280]
    - [74, 7496.2]
  - - [3584, 3584, 1, 3328]
    - [75, 9301.67]
  - - [1024, 256, 1, 128]
    - [66, 1508.74]
  - - [4, 704, 1, 128]
    - [87, 12.0469]
  - - [5888, 6784, 1, 256]
    - [73, 9370.37]
  - - [4288, 2944, 1, 3328]
    - [77, 9148.99]
  - - [2944, 64, 1, 128]
    - [13, 1456.36]
  - - [1856, 64, 1, 256]
    - [39, 2209.93]
  - - [4288, 128, 1, 3328]
    - [33, 6471.85]
  - - [4288, 704, 1, 1280]
    - [80, 8934.51]
  - - [256, 5056, 1, 1280]
    - [74, 8439.03]
  - - [1408, 256, 1, 128]
    - [69, 1769.07]
  - - [2944, 5888, 1, 3328]
    - [74, 9447.94]
  - - [6784, 5888, 1, 1280]
    - [85, 9372.15]
  - - [704, 128, 1, 256]
    - [31, 2059.7]
  - - [5888, 4288, 1, 1280]
    - [77, 9244.22]
  - - [448, 256, 1, 1280]
    - [56, 4741.62]
  - - [5888, 3584, 1, 128]
    - [65, 4979.96]
  - - [1856, 1856, 1, 128]
    - [69, 4363.88]
  - - [5056, 4, 1, 1280]
    - [89, 629.541]
  - - [256, 1408, 1, 1280]
    - [80, 5588.34]
  - - [512, 16, 1, 512]
    - [40, 689.853]
  - - [704, 3584, 1, 128]
    - [69, 4069.57]
  - - [5888, 448, 1, 3328]
    - [85, 7925.84]
  - - [2368, 4288, 1, 1280]
    - [84, 8492.6]
  - - [4288, 2944, 1, 128]
    - [66, 5238.11]
  - - [1024, 6784, 1, 3328]
    - [80, 8578.08]
  - - [128, 2368, 1, 256]
    - [80, 3788.8]
  - - [6784, 64, 1, 3328]
    - [74, 7003.36]
  - - [5056, 2944, 1, 3328]
    - [77, 8575.35]
  - - [448, 128, 1, 256]
    - [29, 1714.96]
  - - [2944, 3584, 1, 256]
    - [74, 8994.16]
  - - [1408, 1408, 1, 3328]
    - [72, 8757.6]
  - - [1856, 128, 1, 1280]
    - [74, 5598.07]
  - - [3584, 3584, 1, 128]
    - [65, 4787.34]
  - - [64, 3584, 1, 256]
    - [80, 3545.91]
  - - [1408, 4, 1, 3328]
    - [24, 640.14]
  - - [128, 2944, 1, 3328]
    - [48, 7204.14]
  - - [3584, 704, 1, 256]
    - [74, 6239.59]
  - - [2944, 448, 1, 3328]
    - [80, 7726.61]
  - - [3584, 1408, 1, 3328]
    - [72, 9358.68]
  - - [704, 3584, 1, 1280]
    - [80, 8005.18]
  - - [2944, 6784, 1, 1280]
    - [72, 9487.63]
  - - [1856, 6784, 1, 256]
    - [74, 5684.46]
  - - [4288, 448, 1, 3328]
    - [80, 8410.28]
  - - [6784, 4288, 1, 128]
    - [70, 4785.48]
  - - [6784, 704, 1, 1280]
    - [74, 5578.95]
  - - [256, 4288, 1, 256]
    - [74, 6781.33]
  - - [3584, 64, 1, 128]
    - [13, 1473.9]
  - - [5888, 1024, 1, 3328]
    - [72, 8639.39]
  - - [448, 64, 1, 128]
    - [4, 259.182]
  - - [704, 6784, 1, 1280]
    - [80, 9027.15]
  - - [5888, 128, 1, 256]
    - [80, 6812.78]
  - - [2368, 448, 1, 3328]
    - [80, 7356.53]
  - - [1856, 5056, 1, 3328]
    - [79, 8871.46]
  - - [4, 6784, 1, 256]
    - [88, 469.379]
  - - [1024, 3584, 1, 128]
    - [66, 3427.92]
  - - [1024, 1408, 1, 128]
    - [69, 2934.95]
  - - [2368, 2944, 1, 128]
    - [69, 4887.92]
  - - [5056, 64, 1, 256]
    - [38, 3186.06]
  - - [4, 448, 1, 1280]
    - [43, 273.067]
  - - [5056, 2944, 1, 128]
    - [70, 4752.69]
  - - [5888, 5056, 1, 3328]
    - [84, 9124.67]
  - - [1024, 704, 1, 128]
    - [69, 2302.26]
  - - [1408, 2368, 1, 128]
    - [69, 3826.85]
  - - [5888, 2368, 1, 128]
    - [66, 4912.67]
  - - [128, 5056, 1, 3328]
    - [56, 7583.7]
  - - [3584, 6784, 1, 1280]
    - [83, 9313.4]
  - - [3072, 7435, 1, 1024]
    - [77, 9321.97]
  - - [1856, 5888, 1, 256]
    - [74, 5778.24]
  - - [256, 256, 1, 256]
    - [26, 1576.81]
  - - [256, 64, 1, 128]
    - [12, 173.605]
  - - [4288, 4288, 1, 3328]
    - [79, 8416.17]
  - - [4288, 1408, 1, 1280]
    - [85, 9301.87]
  - - [3584, 5056, 1, 128]
    - [71, 4344.84]
  - - [4, 1024, 1, 3328]
    - [40, 615.139]
  - - [4288, 2368, 1, 256]
    - [74, 9142.57]
  - - [2944, 5056, 1, 1280]
    - [74, 9399.59]
  - - [448, 6784, 1, 256]
    - [73, 5710.83]
  - - [64, 1024, 1, 3328]
    - [56, 4975.0]
  - - [6784, 2368, 1, 3328]
    - [83, 9207.53]
  - - [256, 1024, 1, 1280]
    - [80, 5983.32]
  - - [704, 4, 1, 128]
    - [86, 15.0187]
  - - [256, 4, 1, 256]
    - [43, 52.8516]
  - - [4288, 128, 1, 256]
    - [74, 5242.88]
  - - [4288, 1856, 1, 3328]
    - [85, 9353.96]
  - - [3584, 448, 1, 128]
    - [66, 3353.8]
  - - [256, 4, 1, 3328]
    - [97, 313.224]
  - - [4, 1408, 1, 1280]
    - [40, 509.107]
  - - [3584, 64, 1, 1280]
    - [28, 5198.32]
  - - [1408, 448, 1, 128]
    - [66, 2628.27]
  - - [3584, 1024, 1, 1280]
    - [80, 8534.91]
  - - [1856, 5056, 1, 256]
    - [72, 8184.39]
  - - [4, 3584, 1, 256]
    - [90, 395.476]
  - - [1024, 4288, 1, 256]
    - [75, 5966.42]
  - - [5888, 3584, 1, 3328]
    - [78, 9189.33]
  - - [4, 256, 1, 256]
    - [94, 41.4785]
  - - [5056, 3584, 1, 3328]
    - [79, 9431.82]
  - - [128, 5888, 1, 1280]
    - [74, 8192.0]
  - - [704, 448, 1, 128]
    - [66, 1510.86]
  - - [2368, 1408, 1, 1280]
    - [74, 8415.55]
  - - [5056, 2944, 1, 1280]
    - [85, 9294.67]
  - - [4, 4, 1, 128]
    - [87, 0.0356549]
  - - [3584, 256, 1, 256]
    - [74, 6749.45]
  - - [128, 1856, 1, 3328]
    - [27, 6796.99]
  - - [1024, 6784, 1, 256]
    - [80, 8782.99]
  - - [4, 128, 1, 256]
    - [40, 27.3067]
  - - [64, 64, 1, 1280]
    - [59, 712.348]
  - - [6784, 4, 1, 128]
    - [87, 121.96]
  - - [2944, 1408, 1, 128]
    - [69, 4430.36]
  - - [448, 128, 1, 3328]
    - [56, 5097.24]
  - - [64, 2944, 1, 3328]
    - [56, 6362.1]
  - - [64, 4288, 1, 3328]
    - [56, 6564.91]
  - - [5056, 6784, 1, 3328]
    - [80, 8121.08]
  - - [128, 2944, 1, 256]
    - [74, 4692.07]
  - - [128, 6784, 1, 128]
    - [3, 2687.36]
  - - [3584, 4288, 1, 256]
    - [80, 9193.89]
  - - [448, 1856, 1, 256]
    - [80, 6231.29]
  - - [1856, 6784, 1, 3328]
    - [85, 9191.38]
  - - [3584, 128, 1, 3328]
    - [74, 7368.37]
  - - [64, 1856, 1, 256]
    - [25, 2184.53]
  - - [1024, 448, 1, 1280]
    - [80, 6977.22]
  - - [5888, 4288, 1, 256]
    - [80, 5780.4]
  - - [4, 448, 1, 128]
    - [87, 8.96]
  - - [5056, 1408, 1, 256]
    - [74, 5601.25]
  - - [64, 256, 1, 1280]
    - [40, 1927.53]
  - - [3584, 1024, 1, 256]
    - [85, 7542.74]
  - - [256, 704, 1, 256]
    - [74, 2957.52]
  - - [5888, 5888, 1, 256]
    - [85, 7344.04]
  - - [4288, 1024, 1, 1280]
    - [80, 8925.74]
  - - [5888, 128, 1, 3328]
    - [74, 8409.97]
  - - [448, 6784, 1, 3328]
    - [74, 8862.46]
  - - [2944, 1408, 1, 1280]
    - [85, 7478.83]
  - - [1024, 32, 1, 512]
    - [29, 1777.25]
  - - [2944, 1856, 1, 3328]
    - [74, 9153.33]
  - - [2368, 64, 1, 128]
    - [13, 1102.2]
  - - [2944, 2944, 1, 128]
    - [65, 4591.85]
  - - [4, 128, 1, 3328]
    - [95, 118.99]
  - - [3584, 5888, 1, 1280]
    - [74, 9222.39]
  - - [64, 4, 1, 128]
    - [86, 0.93516]
  - - [6784, 1856, 1, 1280]
    - [74, 9135.97]
  - - [2944, 5056, 1, 256]
    - [80, 8860.03]
  - - [2944, 5888, 1, 1280]
    - [73, 9643.53]
  - - [5888, 256, 1, 3328]
    - [80, 8799.43]
  - - [1856, 5888, 1, 3328]
    - [80, 9457.43]
  - - [3584, 1408, 1, 256]
    - [80, 8672.43]
  - - [704, 3584, 1, 3328]
    - [80, 8525.2]
  - - [5056, 448, 1, 1280]
    - [80, 8843.67]
  - - [3584, 1856, 1, 3328]
    - [72, 8881.43]
  - - [64, 1408, 1, 128]
    - [1, 747.042]
  - - [1408, 704, 1, 1280]
    - [74, 8342.83]
  - - [2944, 1024, 1, 256]
    - [85, 8079.48]
  - - [1024, 2368, 1, 128]
    - [69, 3347.48]
  - - [2368, 4288, 1, 3328]
    - [80, 9467.57]
  - - [4, 1408, 1, 256]
    - [92, 257.463]
  - - [1024, 1408, 1, 1280]
    - [80, 8241.74]
  - - [64, 64, 1, 256]
    - [40, 189.959]
  - - [704, 256, 1, 3328]
    - [74, 4519.18]
  - - [6784, 5056, 1, 256]
    - [73, 9133.68]
  - - [4, 4288, 1, 3328]
    - [24, 669.975]
  - - [448, 6784, 1, 128]
    - [66, 4481.82]
  - - [4, 704, 1, 3328]
    - [96, 522.971]
  - - [448, 2944, 1, 256]
    - [74, 7022.49]
  - - [2944, 6784, 1, 256]
    - [80, 9199.74]
  - - [2368, 2368, 1, 1280]
    - [85, 8646.74]
  - - [4, 4, 1, 1280]
    - [43, 3.01176]
  - - [1856, 3584, 1, 1280]
    - [72, 8805.35]
  - - [64, 2944, 1, 256]
    - [46, 2565.66]
  - - [3584, 1408, 1, 1280]
    - [85, 9273.02]
  - - [448, 256, 1, 128]
    - [1, 941.03]
  - - [4288, 448, 1, 128]
    - [67, 3215.1]
  - - [5056, 256, 1, 1280]
    - [80, 8790.03]
  - - [1856, 1408, 1, 3328]
    - [74, 9310.63]
  - - [128, 128, 1, 128]
    - [9, 155.115]
  - - [1024, 4288, 1, 3328]
    - [77, 8528.02]
  - - [448, 2368, 1, 256]
    - [81, 5097.24]
  - - [1024, 4, 1, 128]
    - [87, 10.2721]
  - - [5056, 448, 1, 256]
    - [80, 8236.68]
  - - [2944, 2368, 1, 3328]
    - [73, 9331.06]
  - - [704, 128, 1, 3328]
    - [48, 5969.2]
  - - [64, 64, 1, 3328]
    - [64, 1494.68]
  - - [1024, 1856, 1, 1280]
    - [79, 6356.33]
  - - [6784, 1856, 1, 256]
    - [80, 9068.53]
  - - [128, 2368, 1, 3328]
    - [56, 6714.12]
  - - [1024, 5888, 1, 256]
    - [80, 5501.5]
  - - [5056, 128, 1, 1280]
    - [36, 6455.54]
  - - [5056, 64, 1, 3328]
    - [41, 6703.71]
  - - [128, 704, 1, 128]
    - [2, 696.518]
  - - [1408, 2368, 1, 256]
    - [74, 8667.15]
  - - [1408, 1408, 1, 256]
    - [85, 7615.71]
  - - [4, 64, 1, 128]
    - [87, 0.98463]
  - - [64, 128, 1, 1280]
    - [59, 1379.71]
  - - [2368, 2368, 1, 128]
    - [69, 4582.16]
  - - [64, 5888, 1, 128]
    - [2, 2086.27]
  - - [5888, 4, 1, 3328]
    - [23, 667.414]
  - - [6784, 1408, 1, 128]
    - [70, 4516.24]
  - - [4288, 5888, 1, 256]
    - [85, 8497.33]
  - - [1408, 5056, 1, 256]
    - [74, 8867.36]
  - - [5056, 128, 1, 3328]
    - [56, 7678.88]
  - - [128, 128, 1, 1280]
    - [44, 2016.49]
  - - [448, 704, 1, 256]
    - [75, 3030.79]
  - - [4288, 3584, 1, 128]
    - [66, 5246.23]
  - - [2944, 128, 1, 3328]
    - [41, 6795.06]
  - - [128, 5056, 1, 1280]
    - [27, 6192.99]
  - - [3584, 5056, 1, 1280]
    - [79, 9499.07]
  - - [256, 448, 1, 1280]
    - [35, 4267.46]
  - - [704, 704, 1, 128]
    - [69, 2259.22]
  - - [5056, 4, 1, 128]
    - [87, 12.4313]
  - - [704, 256, 1, 1280]
    - [74, 4355.87]
  - - [64, 2368, 1, 3328]
    - [48, 6310.87]
  - - [1856, 1024, 1, 128]
    - [65, 4065.33]
  - - [1856, 64, 1, 128]
    - [4, 936.229]
  - - [64, 6784, 1, 1280]
    - [27, 5731.7]
  - - [704, 4288, 1, 256]
    - [80, 5218.8]
  - - [5888, 2368, 1, 1280]
    - [74, 9378.8]
  - - [128, 256, 1, 256]
    - [44, 1219.27]
  - - [256, 64, 1, 1280]
    - [46, 1820.44]
  - - [2368, 5888, 1, 1280]
    - [85, 9143.54]
  - - [5888, 256, 1, 1280]
    - [74, 8678.37]
  - - [4, 5888, 1, 1280]
    - [21, 668.142]
  - - [704, 128, 1, 128]
    - [9, 649.456]
  - - [1024, 4, 1, 1280]
    - [40, 478.365]
  - - [2368, 1856, 1, 3328]
    - [72, 8153.77]
  - - [2368, 128, 1, 128]
    - [7, 1858.11]
  - - [2944, 704, 1, 256]
    - [74, 8437.97]
  - - [5056, 128, 1, 128]
    - [3, 2689.53]
  - - [256, 704, 1, 3328]
    - [74, 4541.08]
  - - [704, 3584, 1, 256]
    - [75, 7770.97]
  - - [1024, 1024, 1, 1024]
    - [80, 8305.52]
  - - [704, 2944, 1, 3328]
    - [80, 9166.38]
  - - [6784, 1024, 1, 128]
    - [65, 4362.21]
  - - [256, 448, 1, 128]
    - [12, 899.514]
  - - [448, 1024, 1, 3328]
    - [74, 7385.46]
  - - [2944, 1024, 1, 3328]
    - [77, 8779.71]
  - - [2944, 5056, 1, 128]
    - [69, 5103.01]
  - - [1408, 6784, 1, 256]
    - [80, 8346.79]
  - - [6784, 1408, 1, 3328]
    - [76, 8878.3]
  - - [4288, 6784, 1, 128]
    - [65, 5432.89]
  - - [704, 64, 1, 256]
    - [54, 1441.79]
  - - [5888, 4, 1, 1280]
    - [91, 636.541]
  - - [256, 2368, 1, 3328]
    - [74, 6804.7]
  - - [6784, 2944, 1, 1280]
    - [73, 9472.16]
  - - [4288, 1856, 1, 128]
    - [69, 4886.28]
  - - [1856, 2944, 1, 128]
    - [66, 4642.86]
  - - [6784, 448, 1, 128]
    - [66, 4369.07]
  - - [64, 3584, 1, 128]
    - [13, 1645.75]
  - - [448, 5056, 1, 1280]
    - [74, 8553.54]
  - - [2368, 1856, 1, 128]
    - [66, 4741.75]
  - - [128, 448, 1, 1280]
    - [56, 3744.91]
  - - [4288, 704, 1, 256]
    - [74, 8444.06]
  - - [256, 3584, 1, 128]
    - [66, 2454.86]
  - - [5888, 704, 1, 256]
    - [74, 8819.47]
  - - [3584, 1024, 1, 128]
    - [69, 4094.86]
  - - [256, 5888, 1, 3328]
    - [83, 8538.23]
  - - [1408, 4288, 1, 3328]
    - [85, 9212.47]
  - - [6784, 4288, 1, 256]
    - [73, 9163.02]
  - - [4288, 256, 1, 128]
    - [66, 3081.34]
  - - [5888, 256, 1, 256]
    - [74, 7680.65]
  - - [6784, 1024, 1, 1280]
    - [85, 9248.53]
  - - [5888, 1024, 1, 128]
    - [69, 4061.84]
  - - [1024, 128, 1, 256]
    - [80, 2317.29]
  - - [128, 64, 1, 3328]
    - [63, 2116.69]
  - - [448, 64, 1, 256]
    - [46, 1079.42]
  - - [2368, 256, 1, 128]
    - [67, 2229.73]
  - - [6784, 3584, 1, 1280]
    - [80, 9096.5]
  - - [1024, 6784, 1, 1280]
    - [78, 9112.8]
  - - [2944, 64, 1, 1280]
    - [36, 4982.9]
  - - [1408, 2944, 1, 1280]
    - [75, 9131.53]
  - - [256, 1856, 1, 256]
    - [83, 4432.76]
  - - [1408, 2368, 1, 3328]
    - [83, 8449.08]
  - - [2944, 4, 1, 3328]
    - [29, 673.84]
  - - [128, 1408, 1, 3328]
    - [48, 6582.37]
  - - [2944, 1856, 1, 128]
    - [66, 4827.44]
  - - [256, 2944, 1, 128]
    - [69, 2416.56]
  - - [256, 6784, 1, 128]
    - [69, 3118.66]
  - - [2368, 4, 1, 128]
    - [87, 22.6197]
  - - [1408, 256, 1, 3328]
    - [74, 3733.72]
  - - [1856, 4, 1, 128]
    - [86, 7.10009]
  - - [1024, 16, 1, 512]
    - [42, 1165.08]
  - - [5056, 6784, 1, 128]
    - [70, 4949.03]
  - - [4288, 5056, 1, 128]
    - [69, 4966.8]
  - - [1856, 5888, 1, 128]
    - [65, 4351.66]
  - - [2944, 5888, 1, 256]
    - [85, 8460.89]
  - - [3584, 1856, 1, 256]
    - [80, 8876.6]
  - - [4288, 3584, 1, 1280]
    - [73, 9603.6]
  - - [2368, 448, 1, 256]
    - [74, 6604.6]
  - - [4288, 256, 1, 3328]
    - [74, 7619.79]
  - - [1856, 704, 1, 128]
    - [66, 3629.51]
  - - [1408, 64, 1, 256]
    - [30, 2168.11]
  - - [64, 1856, 1, 128]
    - [6, 979.662]
  - - [4, 256, 1, 128]
    - [87, 5.13595]
  - - [704, 4288, 1, 3328]
    - [80, 9014.42]
  - - [704, 5888, 1, 128]
    - [67, 4221.67]
  - - [6784, 3584, 1, 128]
    - [65, 5360.63]
  - - [1024, 64, 1, 256]
    - [25, 1588.75]
  - - [64, 2368, 1, 256]
    - [80, 2552.45]
  - - [4288, 5056, 1, 3328]
    - [79, 8193.28]
  - - [4, 1856, 1, 1280]
    - [29, 499.092]
  - - [4288, 128, 1, 128]
    - [66, 2373.47]
  - - [1408, 1408, 1, 128]
    - [69, 3753.78]
  - - [1024, 128, 1, 3328]
    - [51, 5656.22]
  - - [1856, 128, 1, 128]
    - [2, 1617.48]
  - - [5056, 2368, 1, 256]
    - [85, 5553.31]
  - - [4288, 704, 1, 3328]
    - [73, 6961.96]
  - - [448, 3584, 1, 256]
    - [83, 5981.4]
  - - [64, 128, 1, 128]
    - [20, 74.8983]
  - - [2368, 64, 1, 1280]
    - [56, 5041.23]
  - - [2368, 1024, 1, 1280]
    - [81, 7740.87]
  - - [2944, 1408, 1, 3328]
    - [83, 9204.55]
  - - [1408, 448, 1, 256]
    - [80, 5954.3]
  - - [1024, 1408, 1, 3328]
    - [77, 8161.44]
  - - [2560, 7133, 1, 2560]
    - [72, 9636.59]
  - - [1408, 4, 1, 1280]
    - [24, 520.879]
  - - [5888, 3584, 1, 256]
    - [85, 9225.16]
  - - [128, 1024, 1, 1280]
    - [27, 4755.45]
  - - [1408, 1856, 1, 3328]
    - [77, 9130.77]
  - - [4, 4, 1, 3328]
    - [97, 6.93333]
  - - [6784, 1408, 1, 1280]
    - [74, 9346.81]
  - - [4, 1024, 1, 1280]
    - [24, 422.813]
  - - [704, 2944, 1, 256]
    - [80, 8331.96]
  - - [704, 4288, 1, 128]
    - [66, 4371.04]
  - - [2368, 4288, 1, 128]
    - [66, 3988.79]
  - - [64, 4288, 1, 1280]
    - [56, 5407.53]
  - - [6784, 64, 1, 1280]
    - [36, 5708.15]
  - - [3584, 128, 1, 128]
    - [2, 2463.1]
  - - [1024, 6784, 1, 128]
    - [67, 3862.02]
  - - [4, 1856, 1, 128]
    - [87, 30.5362]
  - - [1408, 64, 1, 3328]
    - [56, 6095.38]
  - - [6784, 4, 1, 256]
    - [89, 487.838]
  - - [1408, 1408, 1, 1280]
    - [85, 8640.53]
  - - [256, 2368, 1, 256]
    - [77, 4282.26]
  - - [448, 4288, 1, 3328]
    - [74, 8516.03]
  - - [2368, 1408, 1, 256]
    - [80, 8632.09]
  - - [5888, 5056, 1, 128]
    - [66, 5091.01]
  - - [704, 2368, 1, 256]
    - [80, 7664.7]
  - - [2944, 448, 1, 1280]
    - [80, 7618.25]
  - - [5888, 2368, 1, 3328]
    - [83, 9343.38]
  - - [64, 2944, 1, 1280]
    - [48, 5162.08]
  - - [448, 1856, 1, 1280]
    - [74, 7027.9]
  - - [4288, 448, 1, 1280]
    - [74, 5855.66]
  - - [5888, 704, 1, 3328]
    - [83, 9190.81]
  - - [5056, 256, 1, 128]
    - [69, 3235.84]
  - - [1856, 256, 1, 128]
    - [67, 1849.68]
  - - [5056, 128, 1, 256]
    - [80, 6108.96]
  - - [704, 4, 1, 256]
    - [40, 125.156]
  - - [1408, 5888, 1, 128]
    - [66, 5055.06]
  - - [4288, 4, 1, 128]
    - [86, 95.6209]
  - - [1408, 1024, 1, 256]
    - [74, 7370.18]
  - - [1024, 1856, 1, 128]
    - [66, 2966.7]
  - - [256, 704, 1, 128]
    - [68, 528.129]
  - - [256, 1024, 1, 128]
    - [66, 1171.59]
  - - [448, 1024, 1, 256]
    - [80, 5624.55]
  - - [128, 4, 1, 3328]
    - [97, 191.885]
  - - [5056, 6784, 1, 1280]
    - [74, 9543.97]
  - - [704, 5056, 1, 3328]
    - [81, 8790.25]
  - - [64, 1408, 1, 1280]
    - [48, 4505.6]
  - - [3584, 5056, 1, 3328]
    - [79, 9073.42]
  - - [1856, 4, 1, 3328]
    - [97, 612.775]
  - - [4, 2944, 1, 128]
    - [86, 71.9145]
  - - [2368, 2944, 1, 3328]
    - [72, 9314.58]
  - - [448, 448, 1, 1280]
    - [56, 5129.81]
  - - [2368, 3584, 1, 256]
    - [74, 8998.7]
  - - [1024, 256, 1, 1280]
    - [81, 3566.58]
  - - [5056, 3584, 1, 1280]
    - [75, 9345.07]
  - - [448, 4, 1, 3328]
    - [97, 487.237]
  - - [1856, 2944, 1, 1280]
    - [85, 8438.69]
  - - [3584, 2368, 1, 1280]
    - [80, 9298.8]
  - - [128, 1024, 1, 256]
    - [32, 2356.35]
  - - [2944, 1408, 1, 256]
    - [72, 5440.72]
  - - [4288, 1408, 1, 3328]
    - [72, 9385.99]
  - - [3584, 64, 1, 3328]
    - [28, 6310.87]
  - - [1408, 128, 1, 256]
    - [74, 2942.43]
  - - [2944, 1024, 1, 128]
    - [69, 3927.89]
  - - [4288, 5056, 1, 1280]
    - [76, 8328.48]
  - - [5888, 6784, 1, 1280]
    - [85, 9757.34]
  - - [6784, 5056, 1, 128]
    - [65, 5101.3]
  - - [256, 1024, 1, 3328]
    - [74, 6475.77]
  - - [3584, 4, 1, 256]
    - [90, 420.873]
  - - [1856, 64, 1, 3328]
    - [56, 6409.1]
  - - [64, 6784, 1, 128]
    - [4, 2387.22]
  - - [5888, 1408, 1, 3328]
    - [79, 9655.79]
  - - [5888, 64, 1, 1280]
    - [74, 5870.76]
  - - [256, 5056, 1, 256]
    - [77, 6108.96]
  - - [128, 3584, 1, 128]
    - [7, 2383.13]
  - - [448, 3584, 1, 3328]
    - [72, 7092.18]
  - - [704, 2368, 1, 128]
    - [66, 3740.98]
  - - [5888, 256, 1, 128]
    - [67, 2977.44]
  - - [4, 5056, 1, 128]
    - [86, 132.62]
  - - [448, 256, 1, 256]
    - [38, 2308.19]
  - - [704, 4, 1, 3328]
    - [43, 552.574]
  - - [1408, 256, 1, 256]
    - [74, 4577.12]
  - - [3584, 1856, 1, 128]
    - [66, 4571.76]
  - - [4288, 4288, 1, 128]
    - [69, 5284.55]
  - - [1856, 1024, 1, 3328]
    - [80, 6362.15]
  - - [128, 5888, 1, 3328]
    - [50, 7040.73]
  - - [1024, 5056, 1, 256]
    - [85, 7855.6]
  - - [2368, 1408, 1, 3328]
    - [80, 9205.56]
  - - [5888, 448, 1, 256]
    - [77, 5538.74]
  - - [5888, 6784, 1, 128]
    - [65, 4500.75]
  - - [2368, 4, 1, 3328]
    - [43, 642.798]
  - - [6784, 5056, 1, 1280]
    - [81, 9249.13]
  - - [5056, 704, 1, 1280]
    - [80, 8883.27]
  - - [1408, 256, 1, 1280]
    - [74, 5632.0]
  - - [4288, 6784, 1, 1280]
    - [80, 8843.21]
  - - [128, 704, 1, 256]
    - [38, 2045.09]
  - - [1024, 1024, 1, 128]
    - [69, 2723.57]
  - - [448, 128, 1, 1280]
    - [48, 3807.07]
  - - [6784, 4, 1, 3328]
    - [91, 684.571]
  - - [4288, 4, 1, 1280]
    - [40, 601.825]
  - - [1024, 64, 1, 3328]
    - [52, 3928.38]
  - - [1856, 4, 1, 256]
    - [90, 293.294]
  - - [64, 3584, 1, 1280]
    - [74, 5265.45]
  - - [6784, 1408, 1, 256]
    - [74, 9059.26]
  - - [3584, 5888, 1, 128]
    - [66, 5084.19]
  - - [5056, 5888, 1, 256]
    - [85, 8589.99]
  - - [2368, 1024, 1, 256]
    - [77, 4493.03]
  - - [2944, 1856, 1, 256]
    - [83, 5202.31]
  - - [1856, 6784, 1, 1280]
    - [81, 9071.38]
  - - [64, 5056, 1, 128]
    - [4, 2038.32]
  - - [5888, 64, 1, 128]
    - [3, 2016.49]
  - - [448, 704, 1, 128]
    - [67, 1173.55]
  - - [4, 1024, 1, 128]
    - [86, 8.79685]
  - - [4288, 3584, 1, 256]
    - [80, 9080.16]
  - - [1408, 704, 1, 128]
    - [66, 3165.61]
  - - [64, 256, 1, 3328]
    - [60, 3126.49]
  - - [5056, 1856, 1, 1280]
    - [77, 8857.45]
  - - [1408, 1024, 1, 3328]
    - [83, 8177.02]
  - - [2368, 256, 1, 3328]
    - [74, 6810.21]
  - - [5888, 3584, 1, 1280]
    - [72, 9535.45]
  - - [1856, 3584, 1, 3328]
    - [74, 9281.81]
  - - [5888, 128, 1, 1280]
    - [80, 8136.72]
  - - [1024, 2944, 1, 256]
    - [72, 7247.86]
  - - [448, 6784, 1, 1280]
    - [80, 7013.94]
  - - [256, 3584, 1, 1280]
    - [74, 7738.54]
  - - [448, 128, 1, 128]
    - [4, 495.948]
  - - [704, 5056, 1, 256]
    - [80, 8609.34]
  - - [3584, 1024, 1, 3328]
    - [73, 7765.63]
  - - [2944, 1856, 1, 1280]
    - [85, 7775.93]
  - - [128, 256, 1, 128]
    - [17, 296.208]
  - - [5056, 256, 1, 256]
    - [74, 7829.63]
  - - [2368, 3584, 1, 3328]
    - [73, 8895.98]
  - - [2944, 704, 1, 1280]
    - [83, 6855.73]
  - - [128, 4, 1, 256]
    - [92, 24.8242]
  - - [2944, 3584, 1, 1280]
    - [85, 9049.12]
  - - [1856, 5888, 1, 1280]
    - [80, 9431.96]
  - - [256, 256, 1, 1280]
    - [45, 3942.02]
  - - [5056, 448, 1, 3328]
    - [85, 4587.73]
  - - [4288, 1408, 1, 256]
    - [85, 5408.73]
  - - [3584, 64, 1, 256]
    - [54, 2496.61]
  - - [64, 1856, 1, 3328]
    - [27, 5896.68]
  - - [256, 1408, 1, 128]
    - [66, 1643.07]
  - - [5888, 1408, 1, 128]
    - [65, 4436.27]
  - - [4288, 2368, 1, 1280]
    - [74, 9432.94]
  - - [4, 4288, 1, 256]
    - [89, 442.632]
  - - [256, 4288, 1, 128]
    - [66, 2814.69]
  - - [256, 128, 1, 3328]
    - [55, 3951.16]
  - - [6784, 2368, 1, 256]
    - [74, 9169.89]
  - - [5888, 128, 1, 128]
    - [3, 3156.71]
  - - [4288, 1856, 1, 256]
    - [80, 5658.13]
  - - [1856, 256, 1, 3328]
    - [74, 7646.27]
  - - [1856, 2944, 1, 256]
    - [81, 6444.88]
  - - [5056, 1024, 1, 128]
    - [65, 4607.2]
  - - [64, 5888, 1, 1280]
    - [80, 5842.36]
  - - [1760, 7133, 1, 1760]
    - [73, 9097.74]
  - - [6784, 256, 1, 128]
    - [66, 3685.31]
  - - [5888, 704, 1, 128]
    - [65, 3656.13]
  - - [6784, 64, 1, 128]
    - [16, 2191.42]
  - - [1024, 4288, 1, 1280]
    - [80, 9199.22]
  - - [2368, 5056, 1, 3328]
    - [76, 9072.78]
  - - [448, 4, 1, 128]
    - [87, 5.32937]
  - - [4, 256, 1, 3328]
    - [97, 310.937]
  - - [4288, 1024, 1, 3328]
    - [78, 8660.23]
  - - [1024, 5056, 1, 3328]
    - [74, 8886.66]
  - - [1024, 1856, 1, 3328]
    - [79, 8426.14]
  - - [704, 704, 1, 1280]
    - [74, 7661.7]
  - - [128, 2368, 1, 1280]
    - [48, 5746.05]
  - - [1408, 128, 1, 3328]
    - [56, 6530.77]
  - - [3584, 256, 1, 1280]
    - [80, 7633.94]
  - - [4, 128, 1, 128]
    - [87, 1.97874]
  - - [704, 6784, 1, 128]
    - [69, 4589.49]
  - - [3584, 128, 1, 1280]
    - [74, 7078.14]
  - - [4, 256, 1, 1280]
    - [43, 178.087]
  - - [128, 704, 1, 3328]
    - [48, 5959.71]
  - - [4288, 6784, 1, 256]
    - [74, 9326.44]
  - - [3584, 2944, 1, 3328]
    - [76, 9114.06]
  - - [128, 1856, 1, 256]
    - [80, 3672.55]
  - - [64, 4288, 1, 256]
    - [74, 3457.41]
  - - [4, 3584, 1, 3328]
    - [23, 694.27]
  - - [64, 4, 1, 3328]
    - [43, 71.4738]
  - - [4, 64, 1, 3328]
    - [43, 91.8069]
  - - [5888, 2944, 1, 256]
    - [73, 7241.45]
  - - [2368, 6784, 1, 128]
    - [69, 5229.53]
  - - [448, 4288, 1, 1280]
    - [74, 8416.3]
  - - [448, 1856, 1, 3328]
    - [74, 7161.46]
  - - [4, 1024, 1, 256]
    - [40, 187.246]
  - - [5056, 4288, 1, 256]
    - [85, 8947.16]
  - - [1024, 448, 1, 256]
    - [80, 5318.86]
  - - [1024, 3584, 1, 256]
    - [75, 6151.94]
  - - [2944, 128, 1, 1280]
    - [56, 6053.53]
  - - [1856, 5056, 1, 128]
    - [66, 5091.32]
  - - [64, 256, 1, 256]
    - [29, 771.012]
  - - [1408, 4, 1, 128]
    - [86, 40.7758]
  - - [128, 2368, 1, 128]
    - [14, 1520.27]
  - - [256, 704, 1, 1280]
    - [74, 4329.71]
  - - [64, 2368, 1, 128]
    - [5, 1212.42]
  - - [6784, 6784, 1, 3328]
    - [85, 8310.57]
  - - [448, 5888, 1, 1280]
    - [80, 8502.23]
  - - [5056, 448, 1, 128]
    - [66, 4160.9]
  - - [3584, 2944, 1, 128]
    - [66, 4363.41]
  - - [6784, 256, 1, 1280]
    - [80, 8629.57]
  - - [256, 2944, 1, 1280]
    - [80, 7277.38]
  - - [64, 4288, 1, 128]
    - [5, 1821.96]
  - - [2368, 5888, 1, 3328]
    - [74, 9017.42]
  - - [4, 64, 1, 256]
    - [40, 16.0627]
  - - [704, 1024, 1, 3328]
    - [80, 8059.45]
  - - [2368, 1856, 1, 1280]
    - [80, 8813.14]
  - - [128, 448, 1, 128]
    - [1, 588.144]
  - - [128, 6784, 1, 256]
    - [80, 6538.18]
  - - [3584, 4288, 1, 128]
    - [66, 5025.36]
  - - [64, 448, 1, 128]
    - [18, 231.693]
  - - [5888, 4288, 1, 3328]
    - [74, 9515.78]
  - - [2368, 704, 1, 256]
    - [80, 7642.74]
  - - [256, 1856, 1, 3328]
    - [80, 6547.07]
  - - [1856, 128, 1, 256]
    - [74, 3782.18]
  - - [6784, 128, 1, 128]
    - [8, 2835.44]
  - - [3584, 1408, 1, 128]
    - [65, 3049.11]
  - - [1856, 5056, 1, 1280]
    - [81, 8863.2]
  - - [2944, 1024, 1, 1280]
    - [85, 8873.15]
  - - [5056, 4, 1, 256]
    - [21, 494.021]
  - - [3584, 5888, 1, 3328]
    - [73, 9585.15]
  - - [2368, 4288, 1, 256]
    - [85, 6418.95]
  - - [1024, 2368, 1, 3328]
    - [80, 8645.26]
  - - [64, 704, 1, 3328]
    - [62, 4399.83]
  - - [704, 1408, 1, 256]
    - [74, 7428.44]
  - - [6784, 1856, 1, 3328]
    - [85, 9163.56]
  - - [1024, 2944, 1, 128]
    - [69, 3551.88]
  - - [1024, 3584, 1, 1280]
    - [83, 9112.37]
  - - [4288, 5888, 1, 3328]
    - [73, 8523.95]
  - - [4288, 4, 1, 3328]
    - [40, 619.916]
  - - [256, 1408, 1, 256]
    - [74, 4505.6]
  - - [448, 2944, 1, 1280]
    - [74, 7612.77]
  - - [4, 5888, 1, 128]
    - [86, 174.464]
  - - [1024, 2944, 1, 3328]
    - [79, 9136.64]
  - - [3584, 6784, 1, 256]
    - [79, 7253.79]
  - - [256, 6784, 1, 1280]
    - [74, 8637.62]
  - - [1856, 3584, 1, 256]
    - [80, 8199.57]
  - - [128, 448, 1, 3328]
    - [61, 4799.82]
  - - [6784, 1856, 1, 128]
    - [66, 5185.52]
  - - [4, 448, 1, 256]
    - [40, 86.8848]
  - - [2944, 704, 1, 128]
    - [69, 3798.54]
  - - [256, 5888, 1, 1280]
    - [74, 8678.37]
  - - [4, 128, 1, 1280]
    - [43, 102.4]
  - - [4288, 6784, 1, 3328]
    - [79, 8209.3]
  - - [6784, 128, 1, 1280]
    - [56, 6562.89]
  - - [64, 1408, 1, 256]
    - [46, 2059.7]
  - - [7680, 5481, 1, 2560]
    - [85, 9426.69]
  - - [2368, 1408, 1, 128]
    - [66, 4532.4]
  - - [1856, 448, 1, 256]
    - [74, 6275.38]
  - - [1408, 1024, 1, 128]
    - [66, 3604.48]
  - - [128, 64, 1, 128]
    - [1, 87.3813]
  - - [6784, 3584, 1, 3328]
    - [81, 8991.82]
  - - [2944, 64, 1, 3328]
    - [50, 6043.26]
  - - [64, 64, 1, 128]
    - [6, 36.209]
  - - [2368, 5056, 1, 1280]
    - [80, 9438.38]
  - - [64, 4, 1, 1280]
    - [43, 40.1569]
  - - [1408, 2368, 1, 1280]
    - [76, 7738.06]
  - - [128, 1408, 1, 1280]
    - [48, 4937.64]
  - - [256, 64, 1, 3328]
    - [58, 2683.36]
  - - [2944, 4288, 1, 128]
    - [66, 5173.71]
  - - [2944, 2944, 1, 256]
    - [74, 8943.82]
  - - [2944, 4, 1, 1280]
    - [23, 617.757]
  - - [5888, 4, 1, 256]
    - [89, 483.118]
  - - [6784, 256, 1, 256]
    - [80, 7916.6]
  - - [256, 5056, 1, 3328]
    - [74, 8953.15]
  - - [128, 4288, 1, 1280]
    - [27, 6014.95]
  - - [5056, 1856, 1, 128]
    - [68, 4221.05]
  - - [5888, 1408, 1, 256]
    - [79, 9144.75]
  - - [128, 128, 1, 256]
    - [29, 759.838]
  - - [5056, 4, 1, 3328]
    - [89, 642.718]
  - - [4288, 3584, 1, 3328]
    - [75, 9299.95]
  - - [448, 704, 1, 3328]
    - [81, 4480.98]
  - - [448, 448, 1, 128]
    - [5, 1360.71]
  - - [1024, 2368, 1, 1280]
    - [74, 8570.19]
  - - [1856, 704, 1, 3328]
    - [74, 8448.16]
  - - [4, 2368, 1, 128]
    - [86, 64.4902]
  - - [5888, 6784, 1, 3328]
    - [81, 9447.02]
  - - [704, 4288, 1, 1280]
    - [83, 7476.77]
  - - [704, 256, 1, 256]
    - [74, 2957.52]
  - - [6784, 448, 1, 3328]
    - [77, 8886.12]
  - - [4288, 1024, 1, 128]
    - [65, 3864.39]
  - - [49, 512, 128, 2048]
    - [108, 7112.68]
  - - [196, 256, 256, 1024]
    - [102, 8302.6]
  - - [784, 512, 256, 128]
    - [100, 9061.26]
  - - [49, 2048, 128, 512]
    - [98, 6963.26]
  - - [784, 512, 64, 128]
    - [100, 8822.52]
  - - [784, 128, 128, 512]
    - [107, 8983.53]
  - - [196, 256, 64, 1024]
    - [106, 7823.4]
  - - [3136, 256, 256, 64]
    - [103, 9051.28]
  - - [3136, 64, 128, 64]
    - [99, 8581.25]
  - - [49, 2048, 256, 512]
    - [98, 7049.54]
  - - [196, 1024, 64, 256]
    - [101, 7953.59]
  - - [784, 128, 256, 512]
    - [109, 9102.89]
  - - [196, 256, 128, 1024]
    - [101, 8085.79]
  - - [3136, 64, 64, 256]
    - [105, 9266.03]
  - - [784, 128, 64, 512]
    - [106, 8809.29]
  - - [49, 2048, 64, 512]
    - [98, 6843.85]
  - - [3136, 64, 128, 256]
    - [105, 9381.29]
  - - [3136, 256, 128, 64]
    - [103, 8982.54]
  - - [784, 512, 128, 128]
    - [100, 8965.89]
  - - [3136, 256, 64, 64]
    - [103, 8879.7]
  - - [3136, 64, 256, 256]
    - [105, 9566.33]
  - - [3136, 64, 64, 64]
    - [104, 8313.95]
  - - [3136, 64, 256, 64]
    - [99, 8743.7]
  - - [196, 1024, 128, 256]
    - [102, 8119.33]
  - - [49, 512, 64, 2048]
    - [110, 7055.31]
  - - [49, 512, 256, 2048]
    - [111, 7166.31]
  - - [196, 1024, 256, 256]
    - [102, 8210.56]
  - - [5329, 160, 64, 64, 5329, 5329, 5329, 160]
    - [118, 8156.79]
  - - [1225, 288, 64, 48, 1225, 1225, 1225, 288]
    - [122, 6926.13]
  - - [1225, 192, 64, 64, 1225, 1225, 1225, 192]
    - [124, 7840.0]
  - - [64, 1280, 64, 384, 64, 64, 64, 1280]
    - [125, 9276.01]
  - - [1225, 384, 64, 192, 1225, 1225, 1225, 384]
    - [115, 9162.25]
  - - [1225, 288, 64, 64, 1225, 1225, 1225, 288]
    - [116, 7495.17]
  - - [5329, 64, 64, 80, 5329, 5329, 5329, 64]
    - [117, 8480.03]
  - - [289, 1024, 64, 256, 289, 289, 289, 1024]
    - [115, 8483.73]
  - - [289, 768, 64, 192, 289, 289, 289, 768]
    - [121, 8234.74]
  - - [289, 768, 64, 128, 289, 289, 289, 768]
    - [121, 7988.71]
  - - [64, 1536, 64, 384, 64, 64, 64, 1536]
    - [125, 9323.55]
  - - [1225, 384, 64, 64, 1225, 1225, 1225, 384]
    - [124, 8158.7]
  - - [64, 2048, 64, 192, 64, 64, 64, 2048]
    - [121, 8818.51]
  - - [64, 1280, 64, 320, 64, 64, 64, 1280]
    - [117, 9202.07]
  - - [1225, 384, 64, 96, 1225, 1225, 1225, 384]
    - [115, 8540.6]
  - - [64, 1280, 64, 448, 64, 64, 64, 1280]
    - [121, 9317.72]
  - - [289, 768, 64, 160, 289, 289, 289, 768]
    - [125, 8128.71]
  - - [1225, 192, 64, 32, 1225, 1225, 1225, 192]
    - [124, 6495.27]
  - - [64, 1536, 64, 256, 64, 64, 64, 1536]
    - [121, 9142.9]
  - - [1225, 256, 64, 48, 1225, 1225, 1225, 256]
    - [119, 7545.26]
  - - [1225, 256, 64, 64, 1225, 1225, 1225, 256]
    - [120, 7972.35]
  - - [1225, 192, 64, 48, 1225, 1225, 1225, 192]
    - [123, 7348.8]
  - - [289, 1024, 64, 384, 289, 289, 289, 1024]
    - [113, 8725.56]
  - - [289, 1024, 64, 192, 289, 289, 289, 1024]
    - [115, 8313.06]
  - - [64, 1280, 64, 192, 64, 64, 64, 1280]
    - [117, 8768.58]
  - - [64, 2048, 64, 320, 64, 64, 64, 2048]
    - [114, 9147.88]
  - - [64, 2048, 64, 448, 64, 64, 64, 2048]
    - [112, 9304.06]
  - - [64, 2048, 64, 384, 64, 64, 64, 2048]
    - [114, 9235.18]
  - - [289, 1024, 64, 128, 289, 289, 289, 1024]
    - [121, 7989.41]
  - - [1024, 128, 1, 128]
    - [130, 1028.12]
  - - [4, 704, 1, 1280]
    - [169, 363.455]
  - - [4, 1856, 1, 3328]
    - [169, 579.534]
  - - [1856, 448, 1, 3328]
    - [206, 6966.83]
  - - [2944, 4288, 1, 1280]
    - [201, 9057.98]
  - - [2368, 64, 1, 3328]
    - [162, 5837.66]
  - - [2368, 5888, 1, 256]
    - [206, 9111.16]
  - - [128, 64, 1, 256]
    - [168, 374.591]
  - - [5888, 1024, 1, 1280]
    - [211, 8570.54]
  - - [128, 6784, 1, 3328]
    - [174, 7703.96]
  - - [64, 4, 1, 256]
    - [220, 11.3219]
  - - [5888, 1856, 1, 3328]
    - [206, 9394.4]
  - - [5056, 704, 1, 256]
    - [209, 8026.99]
  - - [5888, 2944, 1, 3328]
    - [199, 7608.21]
  - - [1856, 4288, 1, 256]
    - [200, 8986.42]
  - - [1024, 5056, 1, 128]
    - [192, 3898.34]
  - - [5056, 5056, 1, 3328]
    - [200, 9536.85]
  - - [1408, 5888, 1, 1280]
    - [201, 9279.19]
  - - [2368, 448, 1, 128]
    - [193, 2474.42]
  - - [1024, 3584, 1, 3328]
    - [203, 9258.58]
  - - [4, 2944, 1, 1280]
    - [155, 611.84]
  - - [1408, 64, 1, 128]
    - [126, 858.31]
  - - [256, 4288, 1, 3328]
    - [206, 7616.08]
  - - [5888, 1408, 1, 1280]
    - [199, 9620.39]
  - - [704, 1856, 1, 3328]
    - [200, 9033.75]
  - - [4, 1408, 1, 128]
    - [213, 24.455]
  - - [1024, 2368, 1, 256]
    - [200, 7526.25]
  - - [1408, 1856, 1, 1280]
    - [203, 8324.19]
  - - [1408, 64, 1, 1280]
    - [174, 4681.24]
  - - [448, 1024, 1, 1280]
    - [200, 7112.53]
  - - [256, 1408, 1, 3328]
    - [206, 5825.51]
  - - [5056, 5056, 1, 1280]
    - [209, 9233.65]
  - - [448, 5056, 1, 256]
    - [201, 7003.27]
  - - [704, 1856, 1, 1280]
    - [200, 8877.38]
  - - [128, 5056, 1, 128]
    - [192, 2301.14]
  - - [2368, 128, 1, 256]
    - [200, 3849.04]
  - - [1856, 1408, 1, 128]
    - [195, 4202.31]
  - - [64, 5056, 1, 256]
    - [201, 3109.62]
  - - [6784, 256, 1, 3328]
    - [200, 6388.53]
  - - [6784, 4288, 1, 3328]
    - [211, 9114.67]
  - - [4288, 448, 1, 256]
    - [204, 5783.05]
  - - [64, 704, 1, 128]
    - [137, 379.519]
  - - [1856, 2368, 1, 3328]
    - [200, 9128.46]
  - - [4288, 2944, 1, 1280]
    - [206, 9182.33]
  - - [704, 5056, 1, 1280]
    - [200, 9071.57]
  - - [2368, 704, 1, 3328]
    - [206, 7731.43]
  - - [256, 5888, 1, 256]
    - [200, 7920.38]
  - - [1856, 4288, 1, 3328]
    - [206, 9330.07]
  - - [256, 2944, 1, 256]
    - [207, 5312.27]
  - - [5888, 1024, 1, 256]
    - [198, 6710.97]
  - - [448, 64, 1, 1280]
    - [173, 2814.53]
  - - [448, 5056, 1, 3328]
    - [200, 8255.53]
  - - [3584, 4, 1, 1280]
    - [149, 640.815]
  - - [2944, 64, 1, 256]
    - [148, 2621.54]
  - - [128, 4, 1, 1280]
    - [220, 86.3316]
  - - [1408, 2944, 1, 256]
    - [200, 8848.99]
  - - [256, 1856, 1, 1280]
    - [200, 7366.55]
  - - [6784, 5056, 1, 3328]
    - [211, 8332.16]
  - - [5056, 5056, 1, 256]
    - [206, 9171.74]
  - - [1408, 6784, 1, 128]
    - [192, 5079.19]
  - - [64, 1024, 1, 1280]
    - [164, 3679.31]
  - - [2944, 4, 1, 256]
    - [155, 369.543]
  - - [704, 5056, 1, 128]
    - [192, 4509.27]
  - - [4, 2368, 1, 1280]
    - [149, 569.844]
  - - [2368, 2944, 1, 1280]
    - [211, 7451.14]
  - - [128, 3584, 1, 1280]
    - [209, 6071.26]
  - - [6784, 6784, 1, 1280]
    - [206, 9535.74]
  - - [1024, 256, 1, 3328]
    - [200, 5742.68]
  - - [1408, 4288, 1, 1280]
    - [209, 8255.09]
  - - [3584, 4288, 1, 1280]
    - [211, 9651.19]
  - - [2368, 704, 1, 1280]
    - [206, 8291.4]
  - - [5056, 4288, 1, 3328]
    - [198, 9406.36]
  - - [3584, 2368, 1, 3328]
    - [206, 9350.32]
  - - [64, 704, 1, 1280]
    - [173, 3384.59]
  - - [4288, 256, 1, 256]
    - [206, 5593.62]
  - - [2944, 128, 1, 128]
    - [128, 2130.6]
  - - [6784, 448, 1, 1280]
    - [209, 8815.85]
  - - [1408, 2944, 1, 128]
    - [192, 4558.34]
  - - [4288, 2944, 1, 256]
    - [211, 7865.43]
  - - [5888, 704, 1, 1280]
    - [200, 9262.99]
  - - [1856, 64, 1, 1280]
    - [174, 4359.15]
  - - [448, 5888, 1, 128]
    - [195, 4000.59]
  - - [5888, 64, 1, 3328]
    - [175, 6603.39]
  - - [2944, 256, 1, 3328]
    - [200, 8423.63]
  - - [1024, 64, 1, 128]
    - [145, 582.642]
  - - [5056, 2368, 1, 1280]
    - [200, 9419.91]
  - - [448, 3584, 1, 1280]
    - [200, 7985.82]
  - - [6784, 5888, 1, 256]
    - [198, 9494.36]
  - - [704, 1024, 1, 128]
    - [192, 2813.35]
  - - [704, 128, 1, 1280]
    - [174, 4477.71]
  - - [5888, 2944, 1, 128]
    - [195, 4745.96]
  - - [4, 3584, 1, 128]
    - [212, 96.479]
  - - [1408, 448, 1, 1280]
    - [200, 6912.8]
  - - [1024, 1408, 1, 256]
    - [208, 5810.85]
  - - [2368, 2368, 1, 3328]
    - [209, 9088.71]
  - - [1856, 6784, 1, 128]
    - [195, 5168.32]
  - - [5056, 704, 1, 3328]
    - [201, 7464.9]
  - - [1408, 1856, 1, 256]
    - [206, 6727.69]
  - - [1408, 704, 1, 3328]
    - [206, 8379.53]
  - - [2368, 5056, 1, 256]
    - [206, 8664.11]
  - - [5888, 1856, 1, 256]
    - [211, 5810.02]
  - - [4288, 64, 1, 3328]
    - [188, 6583.94]
  - - [2368, 4, 1, 1280]
    - [221, 545.251]
  - - [704, 5888, 1, 256]
    - [206, 8813.71]
  - - [4288, 64, 1, 256]
    - [164, 3059.97]
  - - [6784, 64, 1, 256]
    - [206, 3490.96]
  - - [2944, 256, 1, 256]
    - [200, 6970.4]
  - - [2944, 6784, 1, 3328]
    - [200, 9475.79]
  - - [704, 1408, 1, 3328]
    - [200, 8154.18]
  - - [3584, 704, 1, 3328]
    - [200, 8995.07]
  - - [2944, 256, 1, 128]
    - [192, 2824.13]
  - - [6784, 4, 1, 1280]
    - [149, 625.714]
  - - [1024, 64, 1, 1280]
    - [161, 3307.91]
  - - [448, 4288, 1, 256]
    - [206, 6074.48]
  - - [64, 3584, 1, 3328]
    - [154, 6200.26]
  - - [704, 2368, 1, 1280]
    - [200, 8291.4]
  - - [448, 2944, 1, 128]
    - [192, 3221.87]
  - - [1856, 2368, 1, 1280]
    - [211, 6855.24]
  - - [2368, 128, 1, 3328]
    - [162, 6479.61]
  - - [2944, 128, 1, 256]
    - [200, 3828.23]
  - - [448, 1408, 1, 256]
    - [201, 4525.9]
  - - [1856, 4288, 1, 1280]
    - [199, 9160.32]
  - - [64, 5056, 1, 3328]
    - [182, 6819.3]
  - - [4, 704, 1, 256]
    - [166, 123.541]
  - - [1024, 448, 1, 128]
    - [195, 1989.27]
  - - [704, 4, 1, 1280]
    - [169, 381.931]
  - - [704, 256, 1, 128]
    - [192, 1109.17]
  - - [704, 2944, 1, 128]
    - [192, 4089.03]
  - - [1408, 1024, 1, 1280]
    - [206, 8192.08]
  - - [704, 6784, 1, 256]
    - [200, 6717.9]
  - - [6784, 704, 1, 256]
    - [206, 5429.22]
  - - [5056, 1408, 1, 128]
    - [192, 4954.5]
  - - [256, 3584, 1, 3328]
    - [200, 7890.96]
  - - [4, 5888, 1, 3328]
    - [217, 691.047]
  - - [128, 1408, 1, 128]
    - [139, 1393.14]
  - - [3584, 4288, 1, 3328]
    - [202, 8900.87]
  - - [5888, 1856, 1, 1280]
    - [203, 9345.85]
  - - [5056, 1024, 1, 3328]
    - [204, 7834.84]
  - - [5056, 64, 1, 1280]
    - [182, 5890.14]
  - - [1024, 704, 1, 256]
    - [200, 6007.57]
  - - [1024, 4288, 1, 128]
    - [194, 3497.09]
  - - [4288, 64, 1, 1280]
    - [179, 4726.59]
  - - [2368, 3584, 1, 1280]
    - [198, 8128.82]
  - - [2368, 6784, 1, 1280]
    - [198, 9478.72]
  - - [1024, 256, 1, 256]
    - [206, 4092.1]
  - - [1856, 4, 1, 1280]
    - [221, 509.903]
  - - [448, 448, 1, 256]
    - [206, 3001.28]
  - - [2944, 3584, 1, 3328]
    - [207, 9081.91]
  - - [128, 4288, 1, 128]
    - [127, 2323.33]
  - - [64, 448, 1, 256]
    - [170, 1066.97]
  - - [128, 1024, 1, 3328]
    - [183, 6392.36]
  - - [4, 1408, 1, 3328]
    - [166, 616.656]
  - - [6784, 2944, 1, 256]
    - [209, 8547.73]
  - - [64, 1856, 1, 1280]
    - [182, 4409.71]
  - - [64, 1024, 1, 128]
    - [126, 554.902]
  - - [4288, 2368, 1, 3328]
    - [202, 8780.08]
  - - [1856, 2368, 1, 256]
    - [209, 4976.74]
  - - [3584, 256, 1, 128]
    - [194, 2812.37]
  - - [3584, 6784, 1, 3328]
    - [204, 9278.22]
  - - [256, 1024, 1, 256]
    - [200, 4346.53]
  - - [4, 6784, 1, 3328]
    - [219, 681.366]
  - - [1024, 5888, 1, 3328]
    - [200, 9187.61]
  - - [1024, 128, 1, 1280]
    - [152, 3660.05]
  - - [4288, 128, 1, 1280]
    - [206, 6019.17]
  - - [5056, 4288, 1, 1280]
    - [198, 9343.96]
  - - [5888, 64, 1, 256]
    - [200, 4692.17]
  - - [1856, 256, 1, 1280]
    - [206, 4790.38]
  - - [64, 5888, 1, 3328]
    - [174, 6702.2]
  - - [2944, 5888, 1, 128]
    - [195, 5202.65]
  - - [704, 5888, 1, 1280]
    - [200, 9264.29]
  - - [2368, 3584, 1, 128]
    - [192, 5053.71]
  - - [6784, 5888, 1, 3328]
    - [198, 7926.8]
  - - [704, 1024, 1, 1280]
    - [199, 5402.6]
  - - [448, 256, 1, 3328]
    - [182, 6124.65]
  - - [448, 1856, 1, 128]
    - [193, 2885.96]
  - - [128, 1024, 1, 128]
    - [127, 1013.22]
  - - [2944, 4, 1, 128]
    - [212, 77.6374]
  - - [1024, 704, 1, 1280]
    - [200, 7365.58]
  - - [128, 5888, 1, 256]
    - [200, 6990.61]
  - - [1024, 5056, 1, 1280]
    - [205, 9422.0]
  - - [4288, 1024, 1, 256]
    - [207, 6270.03]
  - - [2944, 2368, 1, 128]
    - [192, 4918.18]
  - - [704, 704, 1, 3328]
    - [200, 7963.65]
  - - [704, 1408, 1, 1280]
    - [200, 8347.32]
  - - [5888, 448, 1, 1280]
    - [206, 5217.05]
  - - [3584, 256, 1, 3328]
    - [200, 7802.25]
  - - [704, 5888, 1, 3328]
    - [206, 8381.46]
  - - [704, 1856, 1, 128]
    - [192, 3598.38]
  - - [128, 3584, 1, 3328]
    - [162, 7161.11]
  - - [6784, 2368, 1, 1280]
    - [211, 9464.41]
  - - [4, 4288, 1, 128]
    - [212, 132.68]
  - - [128, 704, 1, 1280]
    - [174, 4463.85]
  - - [3584, 2944, 1, 256]
    - [211, 8201.24]
  - - [1856, 128, 1, 3328]
    - [153, 6575.5]
  - - [4, 64, 1, 1280]
    - [169, 43.6745]
  - - [4, 5056, 1, 3328]
    - [149, 675.315]
  - - [128, 2944, 1, 1280]
    - [153, 5916.99]
  - - [2368, 1024, 1, 3328]
    - [206, 8646.84]
  - - [128, 256, 1, 3328]
    - [187, 4130.85]
  - - [1408, 5056, 1, 3328]
    - [205, 9529.75]
  - - [1856, 1856, 1, 3328]
    - [204, 8114.99]
  - - [3584, 128, 1, 256]
    - [200, 5603.18]
  - - [448, 1408, 1, 3328]
    - [200, 7073.03]
  - - [2368, 2368, 1, 256]
    - [207, 7648.76]
  - - [4288, 4288, 1, 1280]
    - [202, 9244.11]
  - - [64, 448, 1, 1280]
    - [173, 2885.33]
  - - [1408, 4288, 1, 256]
    - [200, 8080.41]
  - - [448, 4, 1, 256]
    - [218, 84.4294]
  - - [5888, 448, 1, 128]
    - [195, 3540.8]
  - - [448, 4, 1, 1280]
    - [169, 322.257]
  - - [704, 6784, 1, 3328]
    - [199, 8613.58]
  - - [5888, 5888, 1, 1280]
    - [206, 9502.05]
  - - [5056, 1024, 1, 1280]
    - [209, 9110.11]
  - - [448, 5888, 1, 3328]
    - [200, 8586.43]
  - - [128, 4, 1, 128]
    - [212, 4.27959]
  - - [1024, 2944, 1, 1280]
    - [208, 7096.53]
  - - [5056, 5888, 1, 1280]
    - [199, 9693.51]
  - - [4288, 5888, 1, 128]
    - [192, 5406.46]
  - - [256, 3584, 1, 256]
    - [200, 6908.37]
  - - [1408, 3584, 1, 128]
    - [192, 4645.69]
  - - [256, 2944, 1, 3328]
    - [203, 6284.4]
  - - [448, 3584, 1, 128]
    - [195, 3675.37]
  - - [5888, 2944, 1, 1280]
    - [205, 9628.9]
  - - [4, 6784, 1, 1280]
    - [149, 688.176]
  - - [2368, 5888, 1, 128]
    - [192, 5273.96]
  - - [64, 2944, 1, 128]
    - [136, 1316.54]
  - - [3584, 5888, 1, 256]
    - [206, 9239.14]
  - - [2368, 704, 1, 128]
    - [195, 3537.65]
  - - [3584, 2944, 1, 1280]
    - [200, 9324.62]
  - - [3584, 2368, 1, 128]
    - [192, 4766.34]
  - - [5056, 704, 1, 128]
    - [192, 4487.95]
  - - [448, 2368, 1, 128]
    - [195, 2877.02]
  - - [5056, 1408, 1, 3328]
    - [211, 9515.97]
  - - [1408, 704, 1, 256]
    - [203, 6836.18]
  - - [6784, 1024, 1, 3328]
    - [198, 9309.65]
  - - [6784, 2944, 1, 3328]
    - [199, 9536.58]
  - - [2944, 5056, 1, 3328]
    - [200, 9526.25]
  - - [1856, 1856, 1, 256]
    - [200, 5239.24]
  - - [1024, 5888, 1, 128]
    - [192, 4006.28]
  - - [2048, 7133, 1, 2048]
    - [198, 9828.07]
  - - [256, 4, 1, 128]
    - [213, 4.38908]
  - - [4288, 5888, 1, 1280]
    - [208, 9202.83]
  - - [4288, 4288, 1, 256]
    - [203, 5521.18]
  - - [448, 2944, 1, 3328]
    - [206, 7724.53]
  - - [4288, 1856, 1, 1280]
    - [206, 8826.34]
  - - [1856, 2944, 1, 3328]
    - [200, 9194.9]
  - - [256, 6784, 1, 3328]
    - [200, 8740.33]
  - - [64, 5888, 1, 256]
    - [200, 4766.35]
  - - [256, 5056, 1, 128]
    - [192, 2937.6]
  - - [5056, 1024, 1, 256]
    - [211, 5467.91]
  - - [704, 64, 1, 3328]
    - [188, 4818.43]
  - - [5056, 1856, 1, 3328]
    - [205, 8861.69]
  - - [4, 2944, 1, 3328]
    - [155, 662.102]
  - - [4, 5056, 1, 256]
    - [215, 494.121]
  - - [1856, 1408, 1, 256]
    - [200, 8674.78]
  - - [3584, 4, 1, 128]
    - [212, 108.296]
  - - [448, 448, 1, 3328]
    - [174, 6457.4]
  - - [6784, 128, 1, 3328]
    - [167, 7256.71]
  - - [4288, 1408, 1, 128]
    - [195, 4791.76]
  - - [4288, 5056, 1, 256]
    - [200, 8560.84]
  - - [1408, 128, 1, 1280]
    - [182, 5085.79]
  - - [5056, 256, 1, 3328]
    - [203, 7284.23]
  - - [704, 704, 1, 256]
    - [200, 6171.19]
  - - [1024, 5888, 1, 1280]
    - [205, 8852.89]
  - - [6784, 2368, 1, 128]
    - [193, 4729.3]
  - - [4, 5056, 1, 1280]
    - [166, 670.046]
  - - [64, 128, 1, 256]
    - [168, 369.317]
  - - [128, 1856, 1, 1280]
    - [162, 5549.13]
  - - [5056, 3584, 1, 256]
    - [206, 7115.84]
  - - [1856, 1024, 1, 1280]
    - [198, 8196.5]
  - - [6784, 4288, 1, 1280]
    - [199, 9509.66]
  - - [1856, 1856, 1, 1280]
    - [201, 5791.99]
  - - [6784, 2944, 1, 128]
    - [192, 5317.12]
  - - [1408, 5056, 1, 1280]
    - [201, 8980.73]
  - - [4, 2368, 1, 3328]
    - [166, 592.634]
  - - [5888, 1856, 1, 128]
    - [191, 4600.2]
  - - [448, 704, 1, 1280]
    - [200, 2286.58]
  - - [2368, 1024, 1, 128]
    - [195, 3911.12]
  - - [1024, 448, 1, 3328]
    - [200, 7295.24]
  - - [1856, 704, 1, 1280]
    - [200, 8881.12]
  - - [5056, 3584, 1, 128]
    - [192, 4911.68]
  - - [5888, 5888, 1, 3328]
    - [208, 9243.9]
  - - [6784, 1024, 1, 256]
    - [211, 5475.41]
  - - [2944, 2368, 1, 256]
    - [206, 5670.77]
  - - [256, 448, 1, 256]
    - [157, 2293.86]
  - - [5056, 5888, 1, 3328]
    - [201, 7848.07]
  - - [1856, 1024, 1, 256]
    - [206, 7517.7]
  - - [448, 1408, 1, 1280]
    - [200, 6917.54]
  - - [3584, 448, 1, 1280]
    - [206, 7980.86]
  - - [1024, 1024, 1, 1280]
    - [203, 8384.52]
  - - [448, 5888, 1, 256]
    - [200, 7365.75]
  - - [704, 64, 1, 128]
    - [145, 358.755]
  - - [1408, 6784, 1, 3328]
    - [206, 9094.19]
  - - [448, 1024, 1, 128]
    - [195, 1773.05]
  - - [4288, 704, 1, 128]
    - [192, 4355.38]
  - - [128, 1856, 1, 128]
    - [131, 1610.73]
  - - [448, 2368, 1, 3328]
    - [206, 7366.47]
  - - [5056, 64, 1, 128]
    - [131, 2157.33]
  - - [5056, 2944, 1, 256]
    - [200, 9123.16]
  - - [6784, 5888, 1, 128]
    - [191, 5285.9]
  - - [704, 1024, 1, 256]
    - [206, 6667.35]
  - - [1024, 4, 1, 256]
    - [155, 187.346]
  - - [2368, 1856, 1, 256]
    - [206, 6777.94]
  - - [128, 6784, 1, 1280]
    - [203, 7052.71]
  - - [1408, 3584, 1, 3328]
    - [207, 9038.05]
  - - [2368, 6784, 1, 256]
    - [200, 9181.45]
  - - [5056, 1408, 1, 1280]
    - [205, 9422.0]
  - - [256, 256, 1, 128]
    - [137, 543.404]
  - - [5056, 4288, 1, 128]
    - [195, 5340.02]
  - - [1408, 1856, 1, 128]
    - [192, 4270.99]
  - - [1408, 5888, 1, 3328]
    - [204, 9034.89]
  - - [1856, 256, 1, 256]
    - [206, 5847.93]
  - - [6784, 6784, 1, 256]
    - [199, 9624.48]
  - - [64, 256, 1, 128]
    - [138, 146.549]
  - - [4288, 2368, 1, 128]
    - [191, 3897.04]
  - - [1856, 4288, 1, 128]
    - [192, 4337.17]
  - - [256, 4288, 1, 1280]
    - [200, 7499.52]
  - - [2368, 2944, 1, 256]
    - [205, 7703.28]
  - - [4, 1856, 1, 256]
    - [218, 264.064]
  - - [3584, 1856, 1, 1280]
    - [200, 9224.43]
  - - [6784, 6784, 1, 128]
    - [192, 5476.13]
  - - [256, 1856, 1, 128]
    - [195, 1858.82]
  - - [704, 64, 1, 1280]
    - [173, 3368.77]
  - - [5888, 5056, 1, 256]
    - [206, 5859.91]
  - - [3584, 448, 1, 256]
    - [206, 7298.43]
  - - [448, 4288, 1, 128]
    - [192, 3813.55]
  - - [2944, 4288, 1, 3328]
    - [201, 9149.73]
  - - [256, 6784, 1, 256]
    - [200, 7984.95]
  - - [1408, 4288, 1, 128]
    - [195, 4728.44]
  - - [2944, 704, 1, 3328]
    - [206, 7149.86]
  - - [128, 448, 1, 256]
    - [172, 1699.18]
  - - [512, 32, 1, 512]
    - [172, 1127.6]
  - - [3584, 3584, 1, 256]
    - [201, 8558.11]
  - - [448, 1408, 1, 128]
    - [192, 2504.45]
  - - [128, 256, 1, 1280]
    - [173, 3216.59]
  - - [3584, 5056, 1, 256]
    - [198, 5674.45]
  - - [6784, 128, 1, 256]
    - [200, 6216.49]
  - - [4288, 4, 1, 256]
    - [216, 435.706]
  - - [64, 1408, 1, 3328]
    - [174, 6186.01]
  - - [704, 448, 1, 256]
    - [206, 4005.08]
  - - [2944, 2368, 1, 1280]
    - [207, 8542.8]
  - - [448, 64, 1, 3328]
    - [187, 3835.33]
  - - [1408, 3584, 1, 256]
    - [200, 8714.63]
  - - [3584, 4, 1, 3328]
    - [155, 689.554]
  - - [6784, 3584, 1, 256]
    - [205, 9271.34]
  - - [256, 128, 1, 128]
    - [138, 283.499]
  - - [704, 1408, 1, 128]
    - [192, 3210.57]
  - - [4, 2368, 1, 256]
    - [218, 360.938]
  - - [2944, 448, 1, 128]
    - [192, 3344.41]
  - - [128, 1408, 1, 256]
    - [200, 3186.38]
  - - [4, 2944, 1, 256]
    - [216, 384.622]
  - - [64, 128, 1, 3328]
    - [169, 2103.72]
  - - [5056, 2368, 1, 128]
    - [192, 5219.76]
  - - [2944, 2944, 1, 3328]
    - [209, 9174.69]
  - - [5056, 6784, 1, 256]
    - [211, 8992.36]
  - - [1856, 3584, 1, 128]
    - [192, 4957.27]
  - - [128, 2944, 1, 128]
    - [130, 2241.48]
  - - [1024, 704, 1, 3328]
    - [210, 6545.11]
  - - [6784, 448, 1, 256]
    - [206, 5379.25]
  - - [3584, 6784, 1, 128]
    - [192, 5102.01]
  - - [128, 4288, 1, 256]
    - [200, 5211.86]
  - - [704, 448, 1, 3328]
    - [201, 4504.15]
  - - [1024, 1024, 1, 3328]
    - [203, 8009.77]
  - - [128, 128, 1, 3328]
    - [186, 3185.03]
  - - [5056, 1856, 1, 256]
    - [200, 9138.43]
  - - [256, 128, 1, 256]
    - [172, 1205.36]
  - - [1024, 1856, 1, 256]
    - [211, 6375.09]
  - - [4288, 64, 1, 128]
    - [128, 1695.43]
  - - [256, 448, 1, 3328]
    - [175, 5659.67]
  - - [1408, 6784, 1, 1280]
    - [200, 9349.2]
  - - [3584, 3584, 1, 1280]
    - [205, 9302.19]
  - - [64, 2368, 1, 1280]
    - [174, 4433.07]
  - - [448, 2368, 1, 1280]
    - [200, 7250.77]
  - - [5888, 5888, 1, 128]
    - [192, 4616.03]
  - - [64, 6784, 1, 3328]
    - [206, 6987.23]
  - - [2944, 256, 1, 1280]
    - [209, 6127.45]
  - - [5056, 5888, 1, 128]
    - [191, 5106.39]
  - - [256, 2368, 1, 128]
    - [192, 2141.23]
  - - [5056, 2368, 1, 3328]
    - [203, 9041.75]
  - - [2944, 4288, 1, 256]
    - [211, 8691.22]
  - - [1408, 3584, 1, 1280]
    - [200, 9070.0]
  - - [2368, 64, 1, 256]
    - [172, 2412.87]
  - - [64, 448, 1, 3328]
    - [187, 3739.14]
  - - [256, 256, 1, 3328]
    - [174, 5304.18]
  - - [5888, 4, 1, 128]
    - [213, 105.655]
  - - [1856, 704, 1, 256]
    - [200, 8025.43]
  - - [4, 4288, 1, 1280]
    - [147, 579.07]
  - - [1408, 448, 1, 3328]
    - [208, 5714.51]
  - - [1024, 4, 1, 3328]
    - [166, 608.649]
  - - [2368, 256, 1, 256]
    - [206, 5173.08]
  - - [2368, 6784, 1, 3328]
    - [206, 9456.61]
  - - [1856, 1408, 1, 1280]
    - [211, 7805.19]
  - - [1856, 448, 1, 1280]
    - [198, 6185.04]
  - - [6784, 704, 1, 128]
    - [192, 4597.87]
  - - [4, 4, 1, 256]
    - [169, 0.791892]
  - - [128, 5888, 1, 128]
    - [130, 2691.76]
  - - [1408, 5888, 1, 256]
    - [205, 7164.27]
  - - [704, 2944, 1, 1280]
    - [207, 8139.81]
  - - [1856, 2368, 1, 128]
    - [195, 4623.38]
  - - [4096, 7133, 1, 4096]
    - [199, 9940.07]
  - - [256, 64, 1, 256]
    - [163, 689.953]
  - - [1024, 1024, 1, 256]
    - [206, 7216.11]
  - - [704, 1856, 1, 256]
    - [206, 6364.17]
  - - [128, 4288, 1, 3328]
    - [162, 7200.59]
  - - [3584, 704, 1, 1280]
    - [209, 7972.08]
  - - [256, 128, 1, 1280]
    - [160, 2702.62]
  - - [2368, 4, 1, 256]
    - [155, 326.018]
  - - [256, 2368, 1, 1280]
    - [200, 6638.93]
  - - [2944, 6784, 1, 128]
    - [191, 5233.53]
  - - [3584, 448, 1, 3328]
    - [200, 8094.4]
  - - [1408, 4, 1, 256]
    - [218, 243.646]
  - - [704, 2368, 1, 3328]
    - [200, 8403.11]
  - - [2944, 448, 1, 256]
    - [200, 7022.59]
  - - [1856, 448, 1, 128]
    - [195, 2842.79]
  - - [2368, 128, 1, 1280]
    - [182, 5685.52]
  - - [256, 5888, 1, 128]
    - [197, 2178.71]
  - - [64, 6784, 1, 256]
    - [200, 5385.23]
  - - [64, 5056, 1, 1280]
    - [174, 5603.29]
  - - [4, 6784, 1, 128]
    - [212, 180.256]
  - - [2944, 2944, 1, 1280]
    - [209, 9129.39]
  - - [5888, 2368, 1, 256]
    - [211, 6961.69]
  - - [4, 3584, 1, 1280]
    - [155, 646.23]
  - - [1408, 128, 1, 128]
    - [141, 1172.29]
  - - [6784, 704, 1, 3328]
    - [206, 9084.62]
  - - [128, 64, 1, 1280]
    - [185, 1260.41]
  - - [2368, 256, 1, 1280]
    - [206, 6643.48]
  - - [4, 448, 1, 3328]
    - [169, 433.514]
  - - [5888, 4288, 1, 128]
    - [193, 4753.17]
  - - [4, 5888, 1, 256]
    - [155, 471.14]
  - - [1408, 2944, 1, 3328]
    - [209, 9207.1]
  - - [3584, 704, 1, 128]
    - [195, 3762.46]
  - - [64, 1024, 1, 256]
    - [173, 1807.99]
  - - [5056, 5056, 1, 128]
    - [196, 4830.16]
  - - [2368, 448, 1, 1280]
    - [200, 7263.16]
  - - [128, 3584, 1, 256]
    - [203, 4369.17]
  - - [704, 448, 1, 1280]
    - [201, 4205.33]
  - - [448, 5056, 1, 128]
    - [192, 3855.57]
  - - [256, 4, 1, 1280]
    - [223, 157.638]
  - - [128, 5056, 1, 256]
    - [206, 6109.06]
  - - [1408, 5056, 1, 128]
    - [195, 4836.68]
  - - [2944, 3584, 1, 128]
    - [195, 4532.19]
  - - [3584, 2368, 1, 256]
    - [200, 8951.34]
  - - [5888, 5056, 1, 1280]
    - [211, 9276.49]
  - - [2368, 5056, 1, 128]
    - [195, 5167.66]
  - - [64, 704, 1, 256]
    - [155, 1501.97]
  - - [4288, 256, 1, 1280]
    - [200, 7496.3]
  - - [3584, 3584, 1, 3328]
    - [201, 9301.77]
  - - [1024, 256, 1, 128]
    - [192, 1508.84]
  - - [4, 704, 1, 128]
    - [213, 12.1469]
  - - [5888, 6784, 1, 256]
    - [199, 9370.47]
  - - [4288, 2944, 1, 3328]
    - [203, 9149.09]
  - - [2944, 64, 1, 128]
    - [139, 1456.46]
  - - [1856, 64, 1, 256]
    - [165, 2210.03]
  - - [4288, 128, 1, 3328]
    - [159, 6471.95]
  - - [4288, 704, 1, 1280]
    - [206, 8934.61]
  - - [256, 5056, 1, 1280]
    - [200, 8439.13]
  - - [1408, 256, 1, 128]
    - [195, 1769.17]
  - - [2944, 5888, 1, 3328]
    - [200, 9448.04]
  - - [6784, 5888, 1, 1280]
    - [211, 9372.25]
  - - [704, 128, 1, 256]
    - [157, 2059.8]
  - - [5888, 4288, 1, 1280]
    - [203, 9244.32]
  - - [448, 256, 1, 1280]
    - [182, 4741.72]
  - - [5888, 3584, 1, 128]
    - [191, 4980.06]
  - - [1856, 1856, 1, 128]
    - [195, 4363.98]
  - - [5056, 4, 1, 1280]
    - [215, 629.641]
  - - [256, 1408, 1, 1280]
    - [206, 5588.44]
  - - [512, 16, 1, 512]
    - [166, 689.953]
  - - [704, 3584, 1, 128]
    - [195, 4069.67]
  - - [5888, 448, 1, 3328]
    - [211, 7925.94]
  - - [2368, 4288, 1, 1280]
    - [210, 8492.7]
  - - [4288, 2944, 1, 128]
    - [192, 5238.21]
  - - [1024, 6784, 1, 3328]
    - [206, 8578.18]
  - - [128, 2368, 1, 256]
    - [206, 3788.9]
  - - [6784, 64, 1, 3328]
    - [200, 7003.46]
  - - [5056, 2944, 1, 3328]
    - [203, 8575.45]
  - - [448, 128, 1, 256]
    - [155, 1715.06]
  - - [2944, 3584, 1, 256]
    - [200, 8994.26]
  - - [1408, 1408, 1, 3328]
    - [198, 8757.7]
  - - [1856, 128, 1, 1280]
    - [200, 5598.17]
  - - [3584, 3584, 1, 128]
    - [191, 4787.44]
  - - [64, 3584, 1, 256]
    - [206, 3546.01]
  - - [1408, 4, 1, 3328]
    - [150, 640.24]
  - - [128, 2944, 1, 3328]
    - [174, 7204.24]
  - - [3584, 704, 1, 256]
    - [200, 6239.69]
  - - [2944, 448, 1, 3328]
    - [206, 7726.71]
  - - [3584, 1408, 1, 3328]
    - [198, 9358.78]
  - - [704, 3584, 1, 1280]
    - [206, 8005.28]
  - - [2944, 6784, 1, 1280]
    - [198, 9487.73]
  - - [1856, 6784, 1, 256]
    - [200, 5684.56]
  - - [4288, 448, 1, 3328]
    - [206, 8410.38]
  - - [6784, 4288, 1, 128]
    - [196, 4785.58]
  - - [6784, 704, 1, 1280]
    - [200, 5579.05]
  - - [256, 4288, 1, 256]
    - [200, 6781.43]
  - - [3584, 64, 1, 128]
    - [139, 1474.0]
  - - [5888, 1024, 1, 3328]
    - [198, 8639.49]
  - - [448, 64, 1, 128]
    - [130, 259.282]
  - - [704, 6784, 1, 1280]
    - [206, 9027.25]
  - - [5888, 128, 1, 256]
    - [206, 6812.88]
  - - [2368, 448, 1, 3328]
    - [206, 7356.63]
  - - [1856, 5056, 1, 3328]
    - [205, 8871.56]
  - - [4, 6784, 1, 256]
    - [214, 469.479]
  - - [1024, 3584, 1, 128]
    - [192, 3428.02]
  - - [1024, 1408, 1, 128]
    - [195, 2935.05]
  - - [2368, 2944, 1, 128]
    - [195, 4888.02]
  - - [5056, 64, 1, 256]
    - [164, 3186.16]
  - - [4, 448, 1, 1280]
    - [169, 273.167]
  - - [5056, 2944, 1, 128]
    - [196, 4752.79]
  - - [5888, 5056, 1, 3328]
    - [210, 9124.77]
  - - [1024, 704, 1, 128]
    - [195, 2302.36]
  - - [1408, 2368, 1, 128]
    - [195, 3826.95]
  - - [5888, 2368, 1, 128]
    - [192, 4912.77]
  - - [128, 5056, 1, 3328]
    - [182, 7583.8]
  - - [3584, 6784, 1, 1280]
    - [209, 9313.5]
  - - [3072, 7435, 1, 1024]
    - [203, 9322.07]
  - - [1856, 5888, 1, 256]
    - [200, 5778.34]
  - - [256, 256, 1, 256]
    - [152, 1576.91]
  - - [256, 64, 1, 128]
    - [138, 173.705]
  - - [4288, 4288, 1, 3328]
    - [205, 8416.27]
  - - [4288, 1408, 1, 1280]
    - [211, 9301.97]
  - - [3584, 5056, 1, 128]
    - [197, 4344.94]
  - - [4, 1024, 1, 3328]
    - [166, 615.239]
  - - [4288, 2368, 1, 256]
    - [200, 9142.67]
  - - [2944, 5056, 1, 1280]
    - [200, 9399.69]
  - - [448, 6784, 1, 256]
    - [199, 5710.93]
  - - [64, 1024, 1, 3328]
    - [182, 4975.1]
  - - [6784, 2368, 1, 3328]
    - [209, 9207.63]
  - - [256, 1024, 1, 1280]
    - [206, 5983.42]
  - - [704, 4, 1, 128]
    - [212, 15.1187]
  - - [256, 4, 1, 256]
    - [169, 52.9516]
  - - [4288, 128, 1, 256]
    - [200, 5242.98]
  - - [4288, 1856, 1, 3328]
    - [211, 9354.06]
  - - [3584, 448, 1, 128]
    - [192, 3353.9]
  - - [256, 4, 1, 3328]
    - [223, 313.324]
  - - [4, 1408, 1, 1280]
    - [166, 509.207]
  - - [3584, 64, 1, 1280]
    - [154, 5198.42]
  - - [1408, 448, 1, 128]
    - [192, 2628.37]
  - - [3584, 1024, 1, 1280]
    - [206, 8535.01]
  - - [1856, 5056, 1, 256]
    - [198, 8184.49]
  - - [4, 3584, 1, 256]
    - [216, 395.576]
  - - [1024, 4288, 1, 256]
    - [201, 5966.52]
  - - [5888, 3584, 1, 3328]
    - [204, 9189.43]
  - - [4, 256, 1, 256]
    - [220, 41.5785]
  - - [5056, 3584, 1, 3328]
    - [205, 9431.92]
  - - [128, 5888, 1, 1280]
    - [200, 8192.1]
  - - [704, 448, 1, 128]
    - [192, 1510.96]
  - - [2368, 1408, 1, 1280]
    - [200, 8415.65]
  - - [5056, 2944, 1, 1280]
    - [211, 9294.77]
  - - [4, 4, 1, 128]
    - [213, 0.1356549]
  - - [3584, 256, 1, 256]
    - [200, 6749.55]
  - - [128, 1856, 1, 3328]
    - [153, 6797.09]
  - - [1024, 6784, 1, 256]
    - [206, 8783.09]
  - - [4, 128, 1, 256]
    - [166, 27.4067]
  - - [64, 64, 1, 1280]
    - [185, 712.448]
  - - [6784, 4, 1, 128]
    - [213, 122.06]
  - - [2944, 1408, 1, 128]
    - [195, 4430.46]
  - - [448, 128, 1, 3328]
    - [182, 5097.34]
  - - [64, 2944, 1, 3328]
    - [182, 6362.2]
  - - [64, 4288, 1, 3328]
    - [182, 6565.01]
  - - [5056, 6784, 1, 3328]
    - [206, 8121.18]
  - - [128, 2944, 1, 256]
    - [200, 4692.17]
  - - [128, 6784, 1, 128]
    - [129, 2687.46]
  - - [3584, 4288, 1, 256]
    - [206, 9193.99]
  - - [448, 1856, 1, 256]
    - [206, 6231.39]
  - - [1856, 6784, 1, 3328]
    - [211, 9191.48]
  - - [3584, 128, 1, 3328]
    - [200, 7368.47]
  - - [64, 1856, 1, 256]
    - [151, 2184.63]
  - - [1024, 448, 1, 1280]
    - [206, 6977.32]
  - - [5888, 4288, 1, 256]
    - [206, 5780.5]
  - - [4, 448, 1, 128]
    - [213, 9.06]
  - - [5056, 1408, 1, 256]
    - [200, 5601.35]
  - - [64, 256, 1, 1280]
    - [166, 1927.63]
  - - [3584, 1024, 1, 256]
    - [211, 7542.84]
  - - [256, 704, 1, 256]
    - [200, 2957.62]
  - - [5888, 5888, 1, 256]
    - [211, 7344.14]
  - - [4288, 1024, 1, 1280]
    - [206, 8925.84]
  - - [5888, 128, 1, 3328]
    - [200, 8410.07]
  - - [448, 6784, 1, 3328]
    - [200, 8862.56]
  - - [2944, 1408, 1, 1280]
    - [211, 7478.93]
  - - [1024, 32, 1, 512]
    - [155, 1777.35]
  - - [2944, 1856, 1, 3328]
    - [200, 9153.43]
  - - [2368, 64, 1, 128]
    - [139, 1102.3]
  - - [2944, 2944, 1, 128]
    - [191, 4591.95]
  - - [4, 128, 1, 3328]
    - [221, 119.09]
  - - [3584, 5888, 1, 1280]
    - [200, 9222.49]
  - - [64, 4, 1, 128]
    - [212, 1.03516]
  - - [6784, 1856, 1, 1280]
    - [200, 9136.07]
  - - [2944, 5056, 1, 256]
    - [206, 8860.13]
  - - [2944, 5888, 1, 1280]
    - [199, 9643.63]
  - - [5888, 256, 1, 3328]
    - [206, 8799.53]
  - - [1856, 5888, 1, 3328]
    - [206, 9457.53]
  - - [3584, 1408, 1, 256]
    - [206, 8672.53]
  - - [704, 3584, 1, 3328]
    - [206, 8525.3]
  - - [5056, 448, 1, 1280]
    - [206, 8843.77]
  - - [3584, 1856, 1, 3328]
    - [198, 8881.53]
  - - [64, 1408, 1, 128]
    - [127, 747.142]
  - - [1408, 704, 1, 1280]
    - [200, 8342.93]
  - - [2944, 1024, 1, 256]
    - [211, 8079.58]
  - - [1024, 2368, 1, 128]
    - [195, 3347.58]
  - - [2368, 4288, 1, 3328]
    - [206, 9467.67]
  - - [4, 1408, 1, 256]
    - [218, 257.563]
  - - [1024, 1408, 1, 1280]
    - [206, 8241.84]
  - - [64, 64, 1, 256]
    - [166, 190.059]
  - - [704, 256, 1, 3328]
    - [200, 4519.28]
  - - [6784, 5056, 1, 256]
    - [199, 9133.78]
  - - [4, 4288, 1, 3328]
    - [150, 670.075]
  - - [448, 6784, 1, 128]
    - [192, 4481.92]
  - - [4, 704, 1, 3328]
    - [222, 523.071]
  - - [448, 2944, 1, 256]
    - [200, 7022.59]
  - - [2944, 6784, 1, 256]
    - [206, 9199.84]
  - - [2368, 2368, 1, 1280]
    - [211, 8646.84]
  - - [4, 4, 1, 1280]
    - [169, 3.11176]
  - - [1856, 3584, 1, 1280]
    - [198, 8805.45]
  - - [64, 2944, 1, 256]
    - [172, 2565.76]
  - - [3584, 1408, 1, 1280]
    - [211, 9273.12]
  - - [448, 256, 1, 128]
    - [127, 941.13]
  - - [4288, 448, 1, 128]
    - [193, 3215.2]
  - - [5056, 256, 1, 1280]
    - [206, 8790.13]
  - - [1856, 1408, 1, 3328]
    - [200, 9310.73]
  - - [128, 128, 1, 128]
    - [135, 155.215]
  - - [1024, 4288, 1, 3328]
    - [203, 8528.12]
  - - [448, 2368, 1, 256]
    - [207, 5097.34]
  - - [1024, 4, 1, 128]
    - [213, 10.3721]
  - - [5056, 448, 1, 256]
    - [206, 8236.78]
  - - [2944, 2368, 1, 3328]
    - [199, 9331.16]
  - - [704, 128, 1, 3328]
    - [174, 5969.3]
  - - [64, 64, 1, 3328]
    - [190, 1494.78]
  - - [1024, 1856, 1, 1280]
    - [205, 6356.43]
  - - [6784, 1856, 1, 256]
    - [206, 9068.63]
  - - [128, 2368, 1, 3328]
    - [182, 6714.22]
  - - [1024, 5888, 1, 256]
    - [206, 5501.6]
  - - [5056, 128, 1, 1280]
    - [162, 6455.64]
  - - [5056, 64, 1, 3328]
    - [167, 6703.81]
  - - [128, 704, 1, 128]
    - [128, 696.618]
  - - [1408, 2368, 1, 256]
    - [200, 8667.25]
  - - [1408, 1408, 1, 256]
    - [211, 7615.81]
  - - [4, 64, 1, 128]
    - [213, 1.08463]
  - - [64, 128, 1, 1280]
    - [185, 1379.81]
  - - [2368, 2368, 1, 128]
    - [195, 4582.26]
  - - [64, 5888, 1, 128]
    - [128, 2086.37]
  - - [5888, 4, 1, 3328]
    - [149, 667.514]
  - - [6784, 1408, 1, 128]
    - [196, 4516.34]
  - - [4288, 5888, 1, 256]
    - [211, 8497.43]
  - - [1408, 5056, 1, 256]
    - [200, 8867.46]
  - - [5056, 128, 1, 3328]
    - [182, 7678.98]
  - - [128, 128, 1, 1280]
    - [170, 2016.59]
  - - [448, 704, 1, 256]
    - [201, 3030.89]
  - - [4288, 3584, 1, 128]
    - [192, 5246.33]
  - - [2944, 128, 1, 3328]
    - [167, 6795.16]
  - - [128, 5056, 1, 1280]
    - [153, 6193.09]
  - - [3584, 5056, 1, 1280]
    - [205, 9499.17]
  - - [256, 448, 1, 1280]
    - [161, 4267.56]
  - - [704, 704, 1, 128]
    - [195, 2259.32]
  - - [5056, 4, 1, 128]
    - [213, 12.5313]
  - - [704, 256, 1, 1280]
    - [200, 4355.97]
  - - [64, 2368, 1, 3328]
    - [174, 6310.97]
  - - [1856, 1024, 1, 128]
    - [191, 4065.43]
  - - [1856, 64, 1, 128]
    - [130, 936.329]
  - - [64, 6784, 1, 1280]
    - [153, 5731.8]
  - - [704, 4288, 1, 256]
    - [206, 5218.9]
  - - [5888, 2368, 1, 1280]
    - [200, 9378.9]
  - - [128, 256, 1, 256]
    - [170, 1219.37]
  - - [256, 64, 1, 1280]
    - [172, 1820.54]
  - - [2368, 5888, 1, 1280]
    - [211, 9143.64]
  - - [5888, 256, 1, 1280]
    - [200, 8678.47]
  - - [4, 5888, 1, 1280]
    - [147, 668.242]
  - - [704, 128, 1, 128]
    - [135, 649.556]
  - - [1024, 4, 1, 1280]
    - [166, 478.465]
  - - [2368, 1856, 1, 3328]
    - [198, 8153.87]
  - - [2368, 128, 1, 128]
    - [133, 1858.21]
  - - [2944, 704, 1, 256]
    - [200, 8438.07]
  - - [5056, 128, 1, 128]
    - [129, 2689.63]
  - - [256, 704, 1, 3328]
    - [200, 4541.18]
  - - [704, 3584, 1, 256]
    - [201, 7771.07]
  - - [1024, 1024, 1, 1024]
    - [206, 8305.62]
  - - [704, 2944, 1, 3328]
    - [206, 9166.48]
  - - [6784, 1024, 1, 128]
    - [191, 4362.31]
  - - [256, 448, 1, 128]
    - [138, 899.614]
  - - [448, 1024, 1, 3328]
    - [200, 7385.56]
  - - [2944, 1024, 1, 3328]
    - [203, 8779.81]
  - - [2944, 5056, 1, 128]
    - [195, 5103.11]
  - - [1408, 6784, 1, 256]
    - [206, 8346.89]
  - - [6784, 1408, 1, 3328]
    - [202, 8878.4]
  - - [4288, 6784, 1, 128]
    - [191, 5432.99]
  - - [704, 64, 1, 256]
    - [180, 1441.89]
  - - [5888, 4, 1, 1280]
    - [217, 636.641]
  - - [256, 2368, 1, 3328]
    - [200, 6804.8]
  - - [6784, 2944, 1, 1280]
    - [199, 9472.26]
  - - [4288, 1856, 1, 128]
    - [195, 4886.38]
  - - [1856, 2944, 1, 128]
    - [192, 4642.96]
  - - [6784, 448, 1, 128]
    - [192, 4369.17]
  - - [64, 3584, 1, 128]
    - [139, 1645.85]
  - - [448, 5056, 1, 1280]
    - [200, 8553.64]
  - - [2368, 1856, 1, 128]
    - [192, 4741.85]
  - - [128, 448, 1, 1280]
    - [182, 3745.01]
  - - [4288, 704, 1, 256]
    - [200, 8444.16]
  - - [256, 3584, 1, 128]
    - [192, 2454.96]
  - - [5888, 704, 1, 256]
    - [200, 8819.57]
  - - [3584, 1024, 1, 128]
    - [195, 4094.96]
  - - [256, 5888, 1, 3328]
    - [209, 8538.33]
  - - [1408, 4288, 1, 3328]
    - [211, 9212.57]
  - - [6784, 4288, 1, 256]
    - [199, 9163.12]
  - - [4288, 256, 1, 128]
    - [192, 3081.44]
  - - [5888, 256, 1, 256]
    - [200, 7680.75]
  - - [6784, 1024, 1, 1280]
    - [211, 9248.63]
  - - [5888, 1024, 1, 128]
    - [195, 4061.94]
  - - [1024, 128, 1, 256]
    - [206, 2317.39]
  - - [128, 64, 1, 3328]
    - [189, 2116.79]
  - - [448, 64, 1, 256]
    - [172, 1079.52]
  - - [2368, 256, 1, 128]
    - [193, 2229.83]
  - - [6784, 3584, 1, 1280]
    - [206, 9096.6]
  - - [1024, 6784, 1, 1280]
    - [204, 9112.9]
  - - [2944, 64, 1, 1280]
    - [162, 4983.0]
  - - [1408, 2944, 1, 1280]
    - [201, 9131.63]
  - - [256, 1856, 1, 256]
    - [209, 4432.86]
  - - [1408, 2368, 1, 3328]
    - [209, 8449.18]
  - - [2944, 4, 1, 3328]
    - [155, 673.94]
  - - [128, 1408, 1, 3328]
    - [174, 6582.47]
  - - [2944, 1856, 1, 128]
    - [192, 4827.54]
  - - [256, 2944, 1, 128]
    - [195, 2416.66]
  - - [256, 6784, 1, 128]
    - [195, 3118.76]
  - - [2368, 4, 1, 128]
    - [213, 22.7197]
  - - [1408, 256, 1, 3328]
    - [200, 3733.82]
  - - [1856, 4, 1, 128]
    - [212, 7.20009]
  - - [1024, 16, 1, 512]
    - [168, 1165.18]
  - - [5056, 6784, 1, 128]
    - [196, 4949.13]
  - - [4288, 5056, 1, 128]
    - [195, 4966.9]
  - - [1856, 5888, 1, 128]
    - [191, 4351.76]
  - - [2944, 5888, 1, 256]
    - [211, 8460.99]
  - - [3584, 1856, 1, 256]
    - [206, 8876.7]
  - - [4288, 3584, 1, 1280]
    - [199, 9603.7]
  - - [2368, 448, 1, 256]
    - [200, 6604.7]
  - - [4288, 256, 1, 3328]
    - [200, 7619.89]
  - - [1856, 704, 1, 128]
    - [192, 3629.61]
  - - [1408, 64, 1, 256]
    - [156, 2168.21]
  - - [64, 1856, 1, 128]
    - [132, 979.762]
  - - [4, 256, 1, 128]
    - [213, 5.23595]
  - - [704, 4288, 1, 3328]
    - [206, 9014.52]
  - - [704, 5888, 1, 128]
    - [193, 4221.77]
  - - [6784, 3584, 1, 128]
    - [191, 5360.73]
  - - [1024, 64, 1, 256]
    - [151, 1588.85]
  - - [64, 2368, 1, 256]
    - [206, 2552.55]
  - - [4288, 5056, 1, 3328]
    - [205, 8193.38]
  - - [4, 1856, 1, 1280]
    - [155, 499.192]
  - - [4288, 128, 1, 128]
    - [192, 2373.57]
  - - [1408, 1408, 1, 128]
    - [195, 3753.88]
  - - [1024, 128, 1, 3328]
    - [177, 5656.32]
  - - [1856, 128, 1, 128]
    - [128, 1617.58]
  - - [5056, 2368, 1, 256]
    - [211, 5553.41]
  - - [4288, 704, 1, 3328]
    - [199, 6962.06]
  - - [448, 3584, 1, 256]
    - [209, 5981.5]
  - - [64, 128, 1, 128]
    - [146, 74.9983]
  - - [2368, 64, 1, 1280]
    - [182, 5041.33]
  - - [2368, 1024, 1, 1280]
    - [207, 7740.97]
  - - [2944, 1408, 1, 3328]
    - [209, 9204.65]
  - - [1408, 448, 1, 256]
    - [206, 5954.4]
  - - [1024, 1408, 1, 3328]
    - [203, 8161.54]
  - - [2560, 7133, 1, 2560]
    - [198, 9636.69]
  - - [1408, 4, 1, 1280]
    - [150, 520.979]
  - - [5888, 3584, 1, 256]
    - [211, 9225.26]
  - - [128, 1024, 1, 1280]
    - [153, 4755.55]
  - - [1408, 1856, 1, 3328]
    - [203, 9130.87]
  - - [4, 4, 1, 3328]
    - [223, 7.03333]
  - - [6784, 1408, 1, 1280]
    - [200, 9346.91]
  - - [4, 1024, 1, 1280]
    - [150, 422.913]
  - - [704, 2944, 1, 256]
    - [206, 8332.06]
  - - [704, 4288, 1, 128]
    - [192, 4371.14]
  - - [2368, 4288, 1, 128]
    - [192, 3988.89]
  - - [64, 4288, 1, 1280]
    - [182, 5407.63]
  - - [6784, 64, 1, 1280]
    - [162, 5708.25]
  - - [3584, 128, 1, 128]
    - [128, 2463.2]
  - - [1024, 6784, 1, 128]
    - [193, 3862.12]
  - - [4, 1856, 1, 128]
    - [213, 30.6362]
  - - [1408, 64, 1, 3328]
    - [182, 6095.48]
  - - [6784, 4, 1, 256]
    - [215, 487.938]
  - - [1408, 1408, 1, 1280]
    - [211, 8640.63]
  - - [256, 2368, 1, 256]
    - [203, 4282.36]
  - - [448, 4288, 1, 3328]
    - [200, 8516.13]
  - - [2368, 1408, 1, 256]
    - [206, 8632.19]
  - - [5888, 5056, 1, 128]
    - [192, 5091.11]
  - - [704, 2368, 1, 256]
    - [206, 7664.8]
  - - [2944, 448, 1, 1280]
    - [206, 7618.35]
  - - [5888, 2368, 1, 3328]
    - [209, 9343.48]
  - - [64, 2944, 1, 1280]
    - [174, 5162.18]
  - - [448, 1856, 1, 1280]
    - [200, 7028.0]
  - - [4288, 448, 1, 1280]
    - [200, 5855.76]
  - - [5888, 704, 1, 3328]
    - [209, 9190.91]
  - - [5056, 256, 1, 128]
    - [195, 3235.94]
  - - [1856, 256, 1, 128]
    - [193, 1849.78]
  - - [5056, 128, 1, 256]
    - [206, 6109.06]
  - - [704, 4, 1, 256]
    - [166, 125.256]
  - - [1408, 5888, 1, 128]
    - [192, 5055.16]
  - - [4288, 4, 1, 128]
    - [212, 95.7209]
  - - [1408, 1024, 1, 256]
    - [200, 7370.28]
  - - [1024, 1856, 1, 128]
    - [192, 2966.8]
  - - [256, 704, 1, 128]
    - [194, 528.229]
  - - [256, 1024, 1, 128]
    - [192, 1171.69]
  - - [448, 1024, 1, 256]
    - [206, 5624.65]
  - - [128, 4, 1, 3328]
    - [223, 191.985]
  - - [5056, 6784, 1, 1280]
    - [200, 9544.07]
  - - [704, 5056, 1, 3328]
    - [207, 8790.35]
  - - [64, 1408, 1, 1280]
    - [174, 4505.7]
  - - [3584, 5056, 1, 3328]
    - [205, 9073.52]
  - - [1856, 4, 1, 3328]
    - [223, 612.875]
  - - [4, 2944, 1, 128]
    - [212, 72.0145]
  - - [2368, 2944, 1, 3328]
    - [198, 9314.68]
  - - [448, 448, 1, 1280]
    - [182, 5129.91]
  - - [2368, 3584, 1, 256]
    - [200, 8998.8]
  - - [1024, 256, 1, 1280]
    - [207, 3566.68]
  - - [5056, 3584, 1, 1280]
    - [201, 9345.17]
  - - [448, 4, 1, 3328]
    - [223, 487.337]
  - - [1856, 2944, 1, 1280]
    - [211, 8438.79]
  - - [3584, 2368, 1, 1280]
    - [206, 9298.9]
  - - [128, 1024, 1, 256]
    - [158, 2356.45]
  - - [2944, 1408, 1, 256]
    - [198, 5440.82]
  - - [4288, 1408, 1, 3328]
    - [198, 9386.09]
  - - [3584, 64, 1, 3328]
    - [154, 6310.97]
  - - [1408, 128, 1, 256]
    - [200, 2942.53]
  - - [2944, 1024, 1, 128]
    - [195, 3927.99]
  - - [4288, 5056, 1, 1280]
    - [202, 8328.58]
  - - [5888, 6784, 1, 1280]
    - [211, 9757.44]
  - - [6784, 5056, 1, 128]
    - [191, 5101.4]
  - - [256, 1024, 1, 3328]
    - [200, 6475.87]
  - - [3584, 4, 1, 256]
    - [216, 420.973]
  - - [1856, 64, 1, 3328]
    - [182, 6409.2]
  - - [64, 6784, 1, 128]
    - [130, 2387.32]
  - - [5888, 1408, 1, 3328]
    - [205, 9655.89]
  - - [5888, 64, 1, 1280]
    - [200, 5870.86]
  - - [256, 5056, 1, 256]
    - [203, 6109.06]
  - - [128, 3584, 1, 128]
    - [133, 2383.23]
  - - [448, 3584, 1, 3328]
    - [198, 7092.28]
  - - [704, 2368, 1, 128]
    - [192, 3741.08]
  - - [5888, 256, 1, 128]
    - [193, 2977.54]
  - - [4, 5056, 1, 128]
    - [212, 132.72]
  - - [448, 256, 1, 256]
    - [164, 2308.29]
  - - [704, 4, 1, 3328]
    - [169, 552.674]
  - - [1408, 256, 1, 256]
    - [200, 4577.22]
  - - [3584, 1856, 1, 128]
    - [192, 4571.86]
  - - [4288, 4288, 1, 128]
    - [195, 5284.65]
  - - [1856, 1024, 1, 3328]
    - [206, 6362.25]
  - - [128, 5888, 1, 3328]
    - [176, 7040.83]
  - - [1024, 5056, 1, 256]
    - [211, 7855.7]
  - - [2368, 1408, 1, 3328]
    - [206, 9205.66]
  - - [5888, 448, 1, 256]
    - [203, 5538.84]
  - - [5888, 6784, 1, 128]
    - [191, 4500.85]
  - - [2368, 4, 1, 3328]
    - [169, 642.898]
  - - [6784, 5056, 1, 1280]
    - [207, 9249.23]
  - - [5056, 704, 1, 1280]
    - [206, 8883.37]
  - - [1408, 256, 1, 1280]
    - [200, 5632.1]
  - - [4288, 6784, 1, 1280]
    - [206, 8843.31]
  - - [128, 704, 1, 256]
    - [164, 2045.19]
  - - [1024, 1024, 1, 128]
    - [195, 2723.67]
  - - [448, 128, 1, 1280]
    - [174, 3807.17]
  - - [6784, 4, 1, 3328]
    - [217, 684.671]
  - - [4288, 4, 1, 1280]
    - [166, 601.925]
  - - [1024, 64, 1, 3328]
    - [178, 3928.48]
  - - [1856, 4, 1, 256]
    - [216, 293.394]
  - - [64, 3584, 1, 1280]
    - [200, 5265.55]
  - - [6784, 1408, 1, 256]
    - [200, 9059.36]
  - - [3584, 5888, 1, 128]
    - [192, 5084.29]
  - - [5056, 5888, 1, 256]
    - [211, 8590.09]
  - - [2368, 1024, 1, 256]
    - [203, 4493.13]
  - - [2944, 1856, 1, 256]
    - [209, 5202.41]
  - - [1856, 6784, 1, 1280]
    - [207, 9071.48]
  - - [64, 5056, 1, 128]
    - [130, 2038.42]
  - - [5888, 64, 1, 128]
    - [129, 2016.59]
  - - [448, 704, 1, 128]
    - [193, 1173.65]
  - - [4, 1024, 1, 128]
    - [212, 8.89685]
  - - [4288, 3584, 1, 256]
    - [206, 9080.26]
  - - [1408, 704, 1, 128]
    - [192, 3165.71]
  - - [64, 256, 1, 3328]
    - [186, 3126.59]
  - - [5056, 1856, 1, 1280]
    - [203, 8857.55]
  - - [1408, 1024, 1, 3328]
    - [209, 8177.12]
  - - [2368, 256, 1, 3328]
    - [200, 6810.31]
  - - [5888, 3584, 1, 1280]
    - [198, 9535.55]
  - - [1856, 3584, 1, 3328]
    - [200, 9281.91]
  - - [5888, 128, 1, 1280]
    - [206, 8136.82]
  - - [1024, 2944, 1, 256]
    - [198, 7247.96]
  - - [448, 6784, 1, 1280]
    - [206, 7014.04]
  - - [256, 3584, 1, 1280]
    - [200, 7738.64]
  - - [448, 128, 1, 128]
    - [130, 496.048]
  - - [704, 5056, 1, 256]
    - [206, 8609.44]
  - - [3584, 1024, 1, 3328]
    - [199, 7765.73]
  - - [2944, 1856, 1, 1280]
    - [211, 7776.03]
  - - [128, 256, 1, 128]
    - [143, 296.308]
  - - [5056, 256, 1, 256]
    - [200, 7829.73]
  - - [2368, 3584, 1, 3328]
    - [199, 8896.08]
  - - [2944, 704, 1, 1280]
    - [209, 6855.83]
  - - [128, 4, 1, 256]
    - [218, 24.9242]
  - - [2944, 3584, 1, 1280]
    - [211, 9049.22]
  - - [1856, 5888, 1, 1280]
    - [206, 9432.06]
  - - [256, 256, 1, 1280]
    - [171, 3942.12]
  - - [5056, 448, 1, 3328]
    - [211, 4587.83]
  - - [4288, 1408, 1, 256]
    - [211, 5408.83]
  - - [3584, 64, 1, 256]
    - [180, 2496.71]
  - - [64, 1856, 1, 3328]
    - [153, 5896.78]
  - - [256, 1408, 1, 128]
    - [192, 1643.17]
  - - [5888, 1408, 1, 128]
    - [191, 4436.37]
  - - [4288, 2368, 1, 1280]
    - [200, 9433.04]
  - - [4, 4288, 1, 256]
    - [215, 442.732]
  - - [256, 4288, 1, 128]
    - [192, 2814.79]
  - - [256, 128, 1, 3328]
    - [181, 3951.26]
  - - [6784, 2368, 1, 256]
    - [200, 9169.99]
  - - [5888, 128, 1, 128]
    - [129, 3156.81]
  - - [4288, 1856, 1, 256]
    - [206, 5658.23]
  - - [1856, 256, 1, 3328]
    - [200, 7646.37]
  - - [1856, 2944, 1, 256]
    - [207, 6444.98]
  - - [5056, 1024, 1, 128]
    - [191, 4607.3]
  - - [64, 5888, 1, 1280]
    - [206, 5842.46]
  - - [1760, 7133, 1, 1760]
    - [199, 9097.84]
  - - [6784, 256, 1, 128]
    - [192, 3685.41]
  - - [5888, 704, 1, 128]
    - [191, 3656.23]
  - - [6784, 64, 1, 128]
    - [142, 2191.52]
  - - [1024, 4288, 1, 1280]
    - [206, 9199.32]
  - - [2368, 5056, 1, 3328]
    - [202, 9072.88]
  - - [448, 4, 1, 128]
    - [213, 5.42937]
  - - [4, 256, 1, 3328]
    - [223, 311.037]
  - - [4288, 1024, 1, 3328]
    - [204, 8660.33]
  - - [1024, 5056, 1, 3328]
    - [200, 8886.76]
  - - [1024, 1856, 1, 3328]
    - [205, 8426.24]
  - - [704, 704, 1, 1280]
    - [200, 7661.8]
  - - [128, 2368, 1, 1280]
    - [174, 5746.15]
  - - [1408, 128, 1, 3328]
    - [182, 6530.87]
  - - [3584, 256, 1, 1280]
    - [206, 7634.04]
  - - [4, 128, 1, 128]
    - [213, 2.07874]
  - - [704, 6784, 1, 128]
    - [195, 4589.59]
  - - [3584, 128, 1, 1280]
    - [200, 7078.24]
  - - [4, 256, 1, 1280]
    - [169, 178.187]
  - - [128, 704, 1, 3328]
    - [174, 5959.81]
  - - [4288, 6784, 1, 256]
    - [200, 9326.54]
  - - [3584, 2944, 1, 3328]
    - [202, 9114.16]
  - - [128, 1856, 1, 256]
    - [206, 3672.65]
  - - [64, 4288, 1, 256]
    - [200, 3457.51]
  - - [4, 3584, 1, 3328]
    - [149, 694.37]
  - - [64, 4, 1, 3328]
    - [169, 71.5738]
  - - [4, 64, 1, 3328]
    - [169, 91.9069]
  - - [5888, 2944, 1, 256]
    - [199, 7241.55]
  - - [2368, 6784, 1, 128]
    - [195, 5229.63]
  - - [448, 4288, 1, 1280]
    - [200, 8416.4]
  - - [448, 1856, 1, 3328]
    - [200, 7161.56]
  - - [4, 1024, 1, 256]
    - [166, 187.346]
  - - [5056, 4288, 1, 256]
    - [211, 8947.26]
  - - [1024, 448, 1, 256]
    - [206, 5318.96]
  - - [1024, 3584, 1, 256]
    - [201, 6152.04]
  - - [2944, 128, 1, 1280]
    - [182, 6053.63]
  - - [1856, 5056, 1, 128]
    - [192, 5091.42]
  - - [64, 256, 1, 256]
    - [155, 771.112]
  - - [1408, 4, 1, 128]
    - [212, 40.8758]
  - - [128, 2368, 1, 128]
    - [140, 1520.37]
  - - [256, 704, 1, 1280]
    - [200, 4329.81]
  - - [64, 2368, 1, 128]
    - [131, 1212.52]
  - - [6784, 6784, 1, 3328]
    - [211, 8310.67]
  - - [448, 5888, 1, 1280]
    - [206, 8502.33]
  - - [5056, 448, 1, 128]
    - [192, 4161.0]
  - - [3584, 2944, 1, 128]
    - [192, 4363.51]
  - - [6784, 256, 1, 1280]
    - [206, 8629.67]
  - - [256, 2944, 1, 1280]
    - [206, 7277.48]
  - - [64, 4288, 1, 128]
    - [131, 1822.06]
  - - [2368, 5888, 1, 3328]
    - [200, 9017.52]
  - - [4, 64, 1, 256]
    - [166, 16.1627]
  - - [704, 1024, 1, 3328]
    - [206, 8059.55]
  - - [2368, 1856, 1, 1280]
    - [206, 8813.24]
  - - [128, 448, 1, 128]
    - [127, 588.244]
  - - [128, 6784, 1, 256]
    - [206, 6538.28]
  - - [3584, 4288, 1, 128]
    - [192, 5025.46]
  - - [64, 448, 1, 128]
    - [144, 231.793]
  - - [5888, 4288, 1, 3328]
    - [200, 9515.88]
  - - [2368, 704, 1, 256]
    - [206, 7642.84]
  - - [256, 1856, 1, 3328]
    - [206, 6547.17]
  - - [1856, 128, 1, 256]
    - [200, 3782.28]
  - - [6784, 128, 1, 128]
    - [134, 2835.54]
  - - [3584, 1408, 1, 128]
    - [191, 3049.21]
  - - [1856, 5056, 1, 1280]
    - [207, 8863.3]
  - - [2944, 1024, 1, 1280]
    - [211, 8873.25]
  - - [5056, 4, 1, 256]
    - [147, 494.121]
  - - [3584, 5888, 1, 3328]
    - [199, 9585.25]
  - - [2368, 4288, 1, 256]
    - [211, 6419.05]
  - - [1024, 2368, 1, 3328]
    - [206, 8645.36]
  - - [64, 704, 1, 3328]
    - [188, 4399.93]
  - - [704, 1408, 1, 256]
    - [200, 7428.54]
  - - [6784, 1856, 1, 3328]
    - [211, 9163.66]
  - - [1024, 2944, 1, 128]
    - [195, 3551.98]
  - - [1024, 3584, 1, 1280]
    - [209, 9112.47]
  - - [4288, 5888, 1, 3328]
    - [199, 8524.05]
  - - [4288, 4, 1, 3328]
    - [166, 620.016]
  - - [256, 1408, 1, 256]
    - [200, 4505.7]
  - - [448, 2944, 1, 1280]
    - [200, 7612.87]
  - - [4, 5888, 1, 128]
    - [212, 174.564]
  - - [1024, 2944, 1, 3328]
    - [205, 9136.74]
  - - [3584, 6784, 1, 256]
    - [205, 7253.89]
  - - [256, 6784, 1, 1280]
    - [200, 8637.72]
  - - [1856, 3584, 1, 256]
    - [206, 8199.67]
  - - [128, 448, 1, 3328]
    - [187, 4799.92]
  - - [6784, 1856, 1, 128]
    - [192, 5185.62]
  - - [4, 448, 1, 256]
    - [166, 86.9848]
  - - [2944, 704, 1, 128]
    - [195, 3798.64]
  - - [256, 5888, 1, 1280]
    - [200, 8678.47]
  - - [4, 128, 1, 1280]
    - [169, 102.5]
  - - [4288, 6784, 1, 3328]
    - [205, 8209.4]
  - - [6784, 128, 1, 1280]
    - [182, 6562.99]
  - - [64, 1408, 1, 256]
    - [172, 2059.8]
  - - [7680, 5481, 1, 2560]
    - [211, 9426.79]
  - - [2368, 1408, 1, 128]
    - [192, 4532.5]
  - - [1856, 448, 1, 256]
    - [200, 6275.48]
  - - [1408, 1024, 1, 128]
    - [192, 3604.58]
  - - [128, 64, 1, 128]
    - [127, 87.4813]
  - - [6784, 3584, 1, 3328]
    - [207, 8991.92]
  - - [2944, 64, 1, 3328]
    - [176, 6043.36]
  - - [64, 64, 1, 128]
    - [132, 36.309]
  - - [2368, 5056, 1, 1280]
    - [206, 9438.48]
  - - [64, 4, 1, 1280]
    - [169, 40.2569]
  - - [1408, 2368, 1, 1280]
    - [202, 7738.16]
  - - [128, 1408, 1, 1280]
    - [174, 4937.74]
  - - [256, 64, 1, 3328]
    - [184, 2683.46]
  - - [2944, 4288, 1, 128]
    - [192, 5173.81]
  - - [2944, 2944, 1, 256]
    - [200, 8943.92]
  - - [2944, 4, 1, 1280]
    - [149, 617.857]
  - - [5888, 4, 1, 256]
    - [215, 483.218]
  - - [6784, 256, 1, 256]
    - [206, 7916.7]
  - - [256, 5056, 1, 3328]
    - [200, 8953.25]
  - - [128, 4288, 1, 1280]
    - [153, 6015.05]
  - - [5056, 1856, 1, 128]
    - [194, 4221.15]
  - - [5888, 1408, 1, 256]
    - [205, 9144.85]
  - - [128, 128, 1, 256]
    - [155, 759.938]
  - - [5056, 4, 1, 3328]
    - [215, 642.818]
  - - [4288, 3584, 1, 3328]
    - [201, 9300.05]
  - - [448, 704, 1, 3328]
    - [207, 4481.08]
  - - [448, 448, 1, 128]
    - [131, 1360.81]
  - - [1024, 2368, 1, 1280]
    - [200, 8570.29]
  - - [1856, 704, 1, 3328]
    - [200, 8448.26]
  - - [4, 2368, 1, 128]
    - [212, 64.5902]
  - - [5888, 6784, 1, 3328]
    - [207, 9447.12]
  - - [704, 4288, 1, 1280]
    - [209, 7476.87]
  - - [704, 256, 1, 256]
    - [200, 2957.62]
  - - [6784, 448, 1, 3328]
    - [203, 8886.22]
  - - [4288, 1024, 1, 128]
    - [191, 3864.49]
  - - [49, 512, 128, 2048]
    - [234, 7112.78]
  - - [196, 256, 256, 1024]
    - [228, 8302.7]
  - - [784, 512, 256, 128]
    - [226, 9061.36]
  - - [49, 2048, 128, 512]
    - [224, 6963.36]
  - - [784, 512, 64, 128]
    - [226, 8822.62]
  - - [784, 128, 128, 512]
    - [233, 8983.63]
  - - [196, 256, 64, 1024]
    - [232, 7823.5]
  - - [3136, 256, 256, 64]
    - [229, 9051.38]
  - - [3136, 64, 128, 64]
    - [225, 8581.35]
  - - [49, 2048, 256, 512]
    - [224, 7049.64]
  - - [196, 1024, 64, 256]
    - [227, 7953.69]
  - - [784, 128, 256, 512]
    - [235, 9102.99]
  - - [196, 256, 128, 1024]
    - [227, 8085.89]
  - - [3136, 64, 64, 256]
    - [231, 9266.13]
  - - [784, 128, 64, 512]
    - [232, 8809.39]
  - - [49, 2048, 64, 512]
    - [224, 6843.95]
  - - [3136, 64, 128, 256]
    - [231, 9381.39]
  - - [3136, 256, 128, 64]
    - [229, 8982.64]
  - - [784, 512, 128, 128]
    - [226, 8965.99]
  - - [3136, 256, 64, 64]
    - [229, 8879.8]
  - - [3136, 64, 256, 256]
    - [231, 9566.43]
  - - [3136, 64, 64, 64]
    - [230, 8314.05]
  - - [3136, 64, 256, 64]
    - [225, 8743.8]
  - - [196, 1024, 128, 256]
    - [228, 8119.43]
  - - [49, 512, 64, 2048]
    - [236, 7055.41]
  - - [49, 512, 256, 2048]
    - [237, 7166.41]
  - - [196, 1024, 256, 256]
    - [228, 8210.66]
  - - [5329, 160, 64, 64, 5329, 5329, 5329, 160]
    - [244, 8156.89]
  - - [1225, 288, 64, 48, 1225, 1225, 1225, 288]
    - [248, 6926.23]
  - - [1225, 192, 64, 64, 1225, 1225, 1225, 192]
    - [250, 7840.1]
  - - [64, 1280, 64, 384, 64, 64, 64, 1280]
    - [251, 9276.11]
  - - [1225, 384, 64, 192, 1225, 1225, 1225, 384]
    - [241, 9162.35]
  - - [1225, 288, 64, 64, 1225, 1225, 1225, 288]
    - [242, 7495.27]
  - - [5329, 64, 64, 80, 5329, 5329, 5329, 64]
    - [243, 8480.13]
  - - [289, 1024, 64, 256, 289, 289, 289, 1024]
    - [241, 8483.83]
  - - [289, 768, 64, 192, 289, 289, 289, 768]
    - [247, 8234.84]
  - - [289, 768, 64, 128, 289, 289, 289, 768]
    - [247, 7988.81]
  - - [64, 1536, 64, 384, 64, 64, 64, 1536]
    - [251, 9323.65]
  - - [1225, 384, 64, 64, 1225, 1225, 1225, 384]
    - [250, 8158.8]
  - - [64, 2048, 64, 192, 64, 64, 64, 2048]
    - [247, 8818.61]
  - - [64, 1280, 64, 320, 64, 64, 64, 1280]
    - [243, 9202.17]
  - - [1225, 384, 64, 96, 1225, 1225, 1225, 384]
    - [241, 8540.7]
  - - [64, 1280, 64, 448, 64, 64, 64, 1280]
    - [247, 9317.82]
  - - [289, 768, 64, 160, 289, 289, 289, 768]
    - [251, 8128.81]
  - - [1225, 192, 64, 32, 1225, 1225, 1225, 192]
    - [250, 6495.37]
  - - [64, 1536, 64, 256, 64, 64, 64, 1536]
    - [247, 9143.0]
  - - [1225, 256, 64, 48, 1225, 1225, 1225, 256]
    - [245, 7545.36]
  - - [1225, 256, 64, 64, 1225, 1225, 1225, 256]
    - [246, 7972.45]
  - - [1225, 192, 64, 48, 1225, 1225, 1225, 192]
    - [249, 7348.9]
  - - [289, 1024, 64, 384, 289, 289, 289, 1024]
    - [239, 8725.66]
  - - [289, 1024, 64, 192, 289, 289, 289, 1024]
    - [241, 8313.16]
  - - [64, 1280, 64, 192, 64, 64, 64, 1280]
    - [243, 8768.68]
  - - [64, 2048, 64, 320, 64, 64, 64, 2048]
    - [240, 9147.98]
  - - [64, 2048, 64, 448, 64, 64, 64, 2048]
    - [238, 9304.16]
  - - [64, 2048, 64, 384, 64, 64, 64, 2048]
    - [240, 9235.28]
  - - [289, 1024, 64, 128, 289, 289, 289, 1024]
    - [247, 7989.51]
- null
