library/src/blas3/Tensile/Logic/asm_full/vega10_Cijk_Ailk_Bljk_SB.yaml
- {MinimumRequiredVersion: 4.0.2}
- vega10
- gfx900
- [Device 6863, Device 6862, Device 687f, Device 6860]
- - - [4096, 7000, 1, 4096]
    - [52, 10970.7]
  - - [5124, 9124, 1, 1760]
    - [54, 10615.0]
  - - [5124, 9124, 1, 2560]
    - [52, 10726.3]
  - - [1760, 32, 1, 1760]
    - [18, 3043.4]
  - - [1024, 1500, 1, 1536]
    - [56, 8671.4]
  - - [512, 24000, 1, 1536]
    - [52, 10207.5]
  - - [3072, 24000, 1, 1024]
    - [52, 10528.4]
  - - [1024, 3000, 1, 2560]
    - [52, 9731.54]
  - - [512, 3136, 1, 2048]
    - [62, 420365.0]
  - - [7680, 4, 1, 2560]
    - [25, 768.516]
  - - [35, 1500, 1, 2048]
    - [10, 2051.51]
  - - [8448, 1500, 1, 2816]
    - [50, 10438.0]
  - - [784, 512, 64, 128]
    - [63, 8718.15]
  - - [2560, 7000, 1, 2560]
    - [50, 10562.1]
  - - [3072, 16, 1, 1024]
    - [37, 1760.63]
  - - [512, 48000, 1, 2048]
    - [49, 10167.5]
  - - [1760, 64, 1, 1760]
    - [31, 4547.75]
  - - [1024, 16, 1, 512]
    - [29, 556.427]
  - - [196, 256, 64, 1024]
    - [65, 6054.88]
  - - [512, 48000, 1, 1536]
    - [51, 10383.4]
  - - [2560, 32, 1, 2560]
    - [35, 3906.01]
  - - [4608, 1500, 1, 1536]
    - [52, 9700.17]
  - - [2048, 128, 1, 2048]
    - [22, 5728.05]
  - - [1024, 24000, 1, 2560]
    - [52, 10548.5]
  - - [4608, 3000, 1, 1536]
    - [50, 10138.9]
  - - [5124, 9124, 1, 2048]
    - [52, 10635.1]
  - - [1024, 700, 1, 512]
    - [46, 5176.37]
  - - [3072, 1, 1, 128]
    - [24, 28.9501]
  - - [5124, 700, 1, 2560]
    - [46, 9304.04]
  - - [8448, 16, 1, 2816]
    - [34, 2764.74]
  - - [6144, 6000, 1, 2560]
    - [52, 10926.0]
  - - [4608, 32, 1, 1536]
    - [39, 3586.67]
  - - [35, 8457, 1, 2560]
    - [14, 3924.71]
  - - [3072, 64, 1, 1024]
    - [39, 3662.44]
  - - [512, 16, 1, 512]
    - [16, 310.435]
  - - [7680, 2, 1, 2560]
    - [21, 388.851]
  - - [4224, 1, 1, 128]
    - [23, 36.9082]
  - - [7680, 1, 1, 2560]
    - [43, 192.798]
  - - [128, 1500, 1, 1280]
    - [39, 4881.26]
  - - [35, 8457, 1, 4096]
    - [13, 4057.33]
  - - [1024, 1500, 1, 2816]
    - [50, 9273.39]
  - - [6144, 2, 1, 2560]
    - [19, 373.612]
  - - [8448, 48000, 1, 2816]
    - [52, 11281.2]
  - - [512, 6000, 1, 1536]
    - [52, 9528.09]
  - - [4224, 1500, 1, 176]
    - [47, 7331.09]
  - - [1024, 6000, 1, 2816]
    - [52, 10236.7]
  - - [512, 6000, 1, 2560]
    - [52, 9889.06]
  - - [512, 32, 1, 512]
    - [29, 581.089]
  - - [2560, 128, 1, 2560]
    - [39, 6105.69]
  - - [4608, 24000, 1, 1536]
    - [52, 10990.6]
  - - [512, 2, 1, 500000]
    - [6, 440.195]
  - - [7680, 48000, 1, 2560]
    - [52, 11277.7]
  - - [3072, 48000, 1, 1024]
    - [52, 10730.0]
  - - [1760, 16, 1, 1760]
    - [26, 1764.44]
  - - [512, 3000, 1, 2816]
    - [51, 9398.05]
  - - [1760, 7000, 1, 1760]
    - [51, 10016.2]
  - - [64, 193600, 1, 256]
    - [61, 280532.0]
  - - [1024, 3000, 1, 2048]
    - [49, 9111.37]
  - - [6144, 4, 1, 2560]
    - [19, 731.772]
  - - [1024, 6000, 1, 2048]
    - [49, 9515.11]
  - - [512, 24000, 1, 2816]
    - [50, 10508.2]
  - - [6144, 48000, 1, 2560]
    - [52, 11161.7]
  - - [8448, 3000, 1, 2816]
    - [53, 10787.9]
  - - [35, 1500, 1, 2560]
    - [14, 2783.47]
  - - [3072, 4, 1, 1024]
    - [38, 470.593]
  - - [4608, 48000, 1, 1536]
    - [52, 11049.1]
  - - [2048, 32, 1, 2048]
    - [18, 3044.18]
  - - [7680, 1500, 1, 2560]
    - [50, 10348.3]
  - - [4096, 128, 1, 4096]
    - [28, 7547.69]
  - - [4608, 16, 1, 1536]
    - [25, 2420.19]
  - - [1024, 1500, 1, 2048]
    - [49, 8190.29]
  - - [3072, 3000, 1, 1024]
    - [57, 9265.31]
  - - [3072, 2, 1, 1024]
    - [23, 240.415]
  - - [8448, 1, 1, 2816]
    - [3, 192.371]
  - - [1024, 48000, 1, 2560]
    - [52, 11147.1]
  - - [1024, 3000, 1, 2816]
    - [53, 9965.45]
  - - [128, 1, 1, 1408]
    - [36, 13.409]
  - - [35, 8457, 1, 1760]
    - [11, 4113.27]
  - - [1024, 2, 1, 512]
    - [8, 74.471]
  - - [1024, 4, 1, 500000]
    - [1, 880.552]
  - - [6144, 1, 1, 2560]
    - [19, 184.777]
  - - [1024, 48000, 1, 2816]
    - [52, 11092.5]
  - - [512, 48000, 1, 2816]
    - [50, 10801.8]
  - - [2048, 16, 1, 2048]
    - [42, 1918.07]
  - - [1024, 24000, 1, 1536]
    - [52, 10413.9]
  - - [64, 193600, 1, 64]
    - [60, 70133.0]
  - - [7680, 6000, 1, 2560]
    - [54, 10990.2]
  - - [1760, 128, 1, 1760]
    - [32, 5542.32]
  - - [35, 8457, 1, 2048]
    - [14, 3510.9]
  - - [512, 1500, 1, 2816]
    - [46, 8502.13]
  - - [512, 1, 1, 512]
    - [36, 20.4797]
  - - [512, 16, 1, 500000]
    - [5, 3337.7]
  - - [512, 8, 1, 500000]
    - [0, 1727.2]
  - - [512, 24000, 1, 2560]
    - [52, 10435.2]
  - - [6144, 3000, 1, 2560]
    - [52, 10765.5]
  - - [1024, 24000, 1, 2816]
    - [52, 10668.8]
  - - [2048, 7000, 1, 2048]
    - [52, 10456.3]
  - - [7680, 3000, 1, 2560]
    - [50, 10707.7]
  - - [1024, 4, 1, 512]
    - [15, 148.194]
  - - [5124, 700, 1, 2048]
    - [48, 8684.08]
  - - [5124, 9124, 1, 4096]
    - [52, 10821.8]
  - - [4096, 64, 1, 4096]
    - [22, 6904.03]
  - - [256, 193600, 1, 64]
    - [61, 135165.0]
  - - [512, 6000, 1, 2048]
    - [48, 8595.3]
  - - [7680, 32, 1, 2560]
    - [27, 5464.57]
  - - [2560, 64, 1, 2560]
    - [40, 5228.81]
  - - [3072, 128, 1, 1024]
    - [49, 4664.07]
  - - [8448, 6000, 1, 2816]
    - [53, 11099.8]
  - - [7680, 64, 1, 2560]
    - [28, 6826.51]
  - - [5124, 1500, 1, 2560]
    - [52, 9924.63]
  - - [1024, 1500, 1, 2560]
    - [56, 9073.62]
  - - [3025, 64, 64, 64]
    - [64, 5087.17]
  - - [512, 4, 1, 512]
    - [8, 80.5774]
  - - [1024, 6000, 1, 2560]
    - [53, 10116.6]
  - - [3072, 32, 1, 1024]
    - [17, 2496.55]
  - - [35, 700, 1, 2560]
    - [12, 1938.42]
  - - [196, 1024, 64, 256]
    - [66, 7350.36]
  - - [512, 50176, 1, 128]
    - [62, 210189.0]
  - - [4608, 1, 1, 1536]
    - [2, 160.016]
  - - [4096, 32, 1, 4096]
    - [27, 4883.28]
  - - [7680, 24000, 1, 2560]
    - [52, 11265.7]
  - - [8448, 4, 1, 2816]
    - [41, 748.815]
  - - [64, 1, 1, 1216]
    - [36, 6.07992]
  - - [512, 1, 1, 500000]
    - [6, 220.745]
  - - [176, 1500, 1, 1408]
    - [31, 5006.76]
  - - [512, 3000, 1, 1536]
    - [49, 8579.46]
  - - [8448, 24000, 1, 2816]
    - [54, 11226.3]
  - - [4608, 2, 1, 1536]
    - [9, 316.977]
  - - [1024, 48000, 1, 1536]
    - [52, 10832.6]
  - - [7680, 128, 1, 2560]
    - [49, 8550.01]
  - - [3072, 6000, 1, 1024]
    - [52, 10052.4]
  - - [3072, 1500, 1, 128]
    - [57, 6212.9]
  - - [2048, 3136, 1, 512]
    - [60, 350312.0]
  - - [3025, 256, 64, 64]
    - [67, 8032.48]
  - - [1024, 3000, 1, 1536]
    - [53, 9385.23]
  - - [512, 4, 1, 500000]
    - [0, 875.999]
  - - [35, 700, 1, 2048]
    - [14, 1618.31]
  - - [1024, 16, 1, 500000]
    - [4, 3414.47]
  - - [512, 24000, 1, 2048]
    - [49, 9753.49]
  - - [128, 50176, 1, 512]
    - [62, 350312.0]
  - - [1024, 32, 1, 512]
    - [24, 962.959]
  - - [256, 12544, 1, 1024]
    - [61, 391871.0]
  - - [1024, 12544, 1, 256]
    - [62, 287217.0]
  - - [512, 48000, 1, 2560]
    - [52, 10951.3]
  - - [2560, 16, 1, 2560]
    - [30, 2251.17]
  - - [2048, 64, 1, 2048]
    - [20, 4839.44]
  - - [512, 2, 1, 512]
    - [8, 40.7319]
  - - [1024, 1, 1, 512]
    - [15, 37.6164]
  - - [512, 1500, 1, 2560]
    - [46, 8216.14]
  - - [6144, 32, 1, 2560]
    - [27, 4854.41]
  - - [1024, 1, 1, 500000]
    - [1, 221.69]
  - - [6144, 16, 1, 2560]
    - [44, 2863.16]
  - - [1024, 24000, 1, 2048]
    - [52, 10582.2]
  - - [4096, 16, 1, 4096]
    - [33, 2937.57]
  - - [5124, 1500, 1, 2048]
    - [52, 9663.03]
  - - [3072, 1500, 1, 1024]
    - [56, 8731.87]
  - - [1024, 2, 1, 500000]
    - [7, 442.59]
  - - [1024, 8, 1, 500000]
    - [3, 1743.51]
  - - [7680, 16, 1, 2560]
    - [19, 2941.21]
  - - [6144, 1500, 1, 2560]
    - [52, 10554.7]
  - - [3072, 1, 1, 1024]
    - [24, 121.195]
  - - [512, 6000, 1, 2816]
    - [52, 10032.0]
  - - [8448, 2, 1, 2816]
    - [7, 380.801]
  - - [4608, 4, 1, 1536]
    - [25, 628.944]
  - - [1024, 6000, 1, 1536]
    - [52, 9753.58]
  - - [8448, 32, 1, 2816]
    - [35, 4908.33]
  - - [512, 3000, 1, 2048]
    - [55, 7268.44]
  - - [6144, 24000, 1, 2560]
    - [54, 11143.4]
  - - [512, 3000, 1, 2560]
    - [49, 9087.05]
  - - [4608, 6000, 1, 1536]
    - [52, 10503.0]
  - - [1024, 1024, 1, 1024]
    - [48, 6613.73]
  - - [512, 1500, 1, 2048]
    - [48, 6602.35]
  - - [512, 1500, 1, 1536]
    - [47, 7598.88]
  - - [128, 1, 1, 1024]
    - [36, 10.183]
  - - [1024, 48000, 1, 2048]
    - [52, 10967.4]
- - - -1
    - - - -1
        - - - 4
            - - [-1, 58]
          - - 64
            - - [4, 58]
              - [128, 36]
              - [256, 16]
              - [448, 34]
              - [704, 35]
              - [1024, 17]
              - [1408, 35]
              - [2368, 31]
              - [2944, 40]
              - [4288, 35]
              - [5888, 40]
              - [-1, 47]
          - - 128
            - - [4, 58]
              - [64, 36]
              - [128, 16]
              - [256, 34]
              - [704, 35]
              - [1408, 40]
              - [1856, 31]
              - [2944, 40]
              - [3584, 47]
              - [4288, 35]
              - [5056, 40]
              - [5888, 47]
              - [-1, 48]
          - - 256
            - - [4, 58]
              - [64, 15]
              - [128, 18]
              - [256, 17]
              - [448, 40]
              - [2944, 47]
              - [3584, 51]
              - [4288, 47]
              - [5056, 46]
              - [5888, 51]
              - [-1, 46]
          - - 448
            - - [4, 58]
              - [64, 34]
              - [128, 35]
              - [256, 31]
              - [448, 32]
              - [704, 46]
              - [1408, 47]
              - [1856, 48]
              - [2368, 47]
              - [2944, 51]
              - [3584, 46]
              - [4288, 45]
              - [5056, 47]
              - [5888, 52]
              - [-1, 45]
          - - 704
            - - [4, 58]
              - [128, 35]
              - [448, 46]
              - [2368, 47]
              - [5888, 45]
              - [-1, 52]
          - - 1024
            - - [4, 58]
              - [64, 17]
              - [128, 28]
              - [704, 46]
              - [1024, 48]
              - [1408, 51]
              - [1856, 53]
              - [2368, 50]
              - [2944, 53]
              - [4288, 50]
              - [-1, 52]
          - - 1408
            - - [4, 58]
              - [64, 35]
              - [128, 39]
              - [448, 47]
              - [704, 49]
              - [1024, 51]
              - [1408, 52]
              - [1856, 50]
              - [2368, 47]
              - [4288, 52]
              - [-1, 50]
          - - 1856
            - - [4, 58]
              - [64, 31]
              - [128, 32]
              - [256, 47]
              - [448, 48]
              - [704, 46]
              - [1024, 52]
              - [1408, 45]
              - [2944, 51]
              - [3584, 45]
              - [4288, 52]
              - [5056, 50]
              - [5888, 45]
              - [-1, 51]
          - - 2368
            - - [4, 58]
              - [64, 31]
              - [128, 39]
              - [704, 46]
              - [2368, 51]
              - [2944, 52]
              - [3584, 50]
              - [4288, 51]
              - [5056, 52]
              - [-1, 45]
          - - 2944
            - - [4, 58]
              - [64, 39]
              - [128, 32]
              - [256, 47]
              - [448, 50]
              - [704, 51]
              - [1024, 52]
              - [1408, 54]
              - [1856, 50]
              - [2368, 52]
              - [5056, 50]
              - [5888, 52]
              - [-1, 50]
          - - 3584
            - - [4, 59]
              - [64, 28]
              - [128, 47]
              - [256, 49]
              - [448, 46]
              - [1024, 51]
              - [1408, 52]
              - [-1, 50]
          - - 4288
            - - [4, 59]
              - [128, 32]
              - [256, 47]
              - [448, 50]
              - [704, 51]
              - [1024, 50]
              - [1408, 52]
              - [2944, 51]
              - [3584, 52]
              - [5056, 51]
              - [5888, 50]
              - [-1, 45]
          - - 5056
            - - [4, 59]
              - [64, 39]
              - [128, 32]
              - [448, 46]
              - [704, 51]
              - [1408, 52]
              - [1856, 51]
              - [2368, 52]
              - [4288, 51]
              - [5888, 54]
              - [-1, 45]
          - - 5888
            - - [4, 59]
              - [64, 28]
              - [128, 47]
              - [256, 51]
              - [448, 47]
              - [704, 51]
              - [1408, 52]
              - [1856, 51]
              - [-1, 50]
          - - -1
            - - [4, 59]
              - [64, 47]
              - [128, 48]
              - [256, 46]
              - [448, 50]
              - [704, 53]
              - [1024, 52]
              - [5888, 50]
              - [-1, 52]
