library/src/blas3/Tensile/Logic/asm_full/vega10_Cijk_Ailk_Bjlk_SB.yaml
- {MinimumRequiredVersion: 4.5.0}
- vega10
- gfx900
- [Device 6863, Device 6862, Device 687f, Device 6860, Device 6861, 'Vega 10 XTX [Radeon
    SolutionIndex: 0
    SolutionNameMin: Cijk_Ailk_Bjlk_SB_MT016x016x16_GRVW02_GSU02_TT02_02_VW02_WG08_08_04
    SolutionIndex: 1
    SolutionNameMin: Cijk_Ailk_Bjlk_SB_MT016x016x16_GRVW02_GSU08_TT02_02_VW02_WG08_08_04
    SolutionIndex: 2
    SolutionNameMin: Cijk_Ailk_Bjlk_SB_MT016x016x32_GRVW02_GSU02_TT02_02_VW02_WG08_08_04
    SolutionIndex: 3
    SolutionNameMin: Cijk_Ailk_Bjlk_SB_MT016x016x32_GRVW02_GSU02_TT02_02_VW02_WG08_08_04
    SolutionIndex: 4
    SolutionNameMin: Cijk_Ailk_Bjlk_SB_MT032x032x32_GRVW04_GSU02_TT04_04_VW04_WG08_08_04
    SolutionIndex: 5
    SolutionNameMin: Cijk_Ailk_Bjlk_SB_MT016x016x32_GRVW02_GSU04_TT02_02_VW02_WG08_08_04
    SolutionIndex: 6
    SolutionNameMin: Cijk_Ailk_Bjlk_SB_MT064x064x08_GRVW04_GSU01_TT04_04_VW04_WG16_16_01
    SolutionIndex: 7
    SolutionNameMin: Cijk_Ailk_Bjlk_SB_MT064x064x08_GRVW04_GSU01_TT04_04_VW04_WG16_16_01
    SolutionIndex: 8
    SolutionNameMin: Cijk_Ailk_Bjlk_SB_MT064x064x16_GRVW04_GSU01_TT04_04_VW04_WG16_16_01
    SolutionIndex: 9
    SolutionNameMin: Cijk_Ailk_Bjlk_SB_MT064x128x16_GRVW04_GSU01_TT04_08_VW04_WG16_16_01
    SolutionIndex: 10
    SolutionNameMin: Cijk_Ailk_Bjlk_SB_MT064x064x16_GRVW04_GSU01_TT04_04_VW04_WG16_16_01
    SolutionIndex: 11
    SolutionNameMin: Cijk_Ailk_Bjlk_SB_MT064x064x08_GRVW04_GSU01_TT04_04_VW04_WG16_16_01
    SolutionIndex: 12
    SolutionNameMin: Cijk_Ailk_Bjlk_SB_MT064x128x08_GRVW04_GSU01_TT04_08_VW04_WG16_16_01
    SolutionIndex: 13
    SolutionNameMin: Cijk_Ailk_Bjlk_SB_MT128x064x08_GRVW04_GSU01_TT08_04_VW04_WG16_16_01
    SolutionIndex: 14
    SolutionNameMin: Cijk_Ailk_Bjlk_SB_MT064x064x08_GRVW04_GSU01_TT04_04_VW04_WG16_16_01
    SolutionIndex: 15
    SolutionNameMin: Cijk_Ailk_Bjlk_SB_MT064x128x08_GRVW04_GSU01_TT04_08_VW04_WG16_16_01
    SolutionIndex: 16
    SolutionNameMin: Cijk_Ailk_Bjlk_SB_MT128x064x08_GRVW04_GSU01_TT08_04_VW04_WG16_16_01
    SolutionIndex: 17
    SolutionNameMin: Cijk_Ailk_Bjlk_SB_MT128x128x08_GRVW04_GSU01_TT08_08_VW04_WG16_16_01
    SolutionIndex: 18
    SolutionNameMin: Cijk_Ailk_Bjlk_SB_MT064x064x16_GRVW04_GSU01_TT04_04_VW04_WG16_16_01
    SolutionIndex: 19
    SolutionNameMin: Cijk_Ailk_Bjlk_SB_MT128x064x16_GRVW04_GSU01_TT08_04_VW04_WG16_16_01
    SolutionIndex: 20
    SolutionNameMin: Cijk_Ailk_Bjlk_SB_MT128x128x16_GRVW04_GSU01_TT08_08_VW04_WG16_16_01
    SolutionIndex: 21
    SolutionNameMin: Cijk_Ailk_Bjlk_SB_MT064x064x16_GRVW04_GSU01_TT04_04_VW04_WG16_16_01
    SolutionIndex: 22
    SolutionNameMin: Cijk_Ailk_Bjlk_SB_MT128x064x16_GRVW04_GSU01_TT08_04_VW04_WG16_16_01
    SolutionIndex: 23
    SolutionNameMin: Cijk_Ailk_Bjlk_SB_MT128x128x16_GRVW04_GSU01_TT08_08_VW04_WG16_16_01
    SolutionIndex: 24
    SolutionNameMin: Cijk_Ailk_Bjlk_SB_MT032x032x02_GRVW04_GSU01_TT04_04_VW04_WG08_08_01
    SolutionIndex: 25
    SolutionNameMin: Cijk_Ailk_Bjlk_SB_MT016x016x04_GRVW02_GSU01_TT02_02_VW02_WG08_08_01
    SolutionIndex: 0
    SolutionNameMin: Cijk_Ailk_Bjlk_SB_MT064x064x16_DTL0_GRVW01_GSU01_PGR1_PLR1_TT04_04_USFGRO01_VW02_WG16_16_01_WGM01
    SolutionIndex: 1
    SolutionNameMin: Cijk_Ailk_Bjlk_SB_MT064x064x16_DTL0_GRVW01_GSU01_PGR0_PLR0_TT04_04_USFGRO01_VW04_WG16_16_01_WGM01
    SolutionIndex: 2
    SolutionNameMin: Cijk_Ailk_Bjlk_SB_MT128x064x16_DTL0_GRVW01_GSU01_PGR1_PLR1_TT08_04_USFGRO01_VW04_WG16_16_01_WGM01
    SolutionIndex: 3
    SolutionNameMin: Cijk_Ailk_Bjlk_SB_MT128x064x16_DTL0_GRVW01_GSU01_PGR1_PLR1_TT04_08_USFGRO01_VW04_WG32_08_01_WGM01
    SolutionIndex: 4
    SolutionNameMin: Cijk_Ailk_Bjlk_SB_MT032x256x16_DTL1_GRVW01_GSU01_PGR0_PLR1_TT04_08_USFGRO01_VW04_WG08_32_01_WGM08
    SolutionIndex: 5
    SolutionNameMin: Cijk_Ailk_Bjlk_SB_MT064x064x16_DTL0_GRVW01_GSU01_PGR1_PLR1_TT04_04_USFGRO01_VW04_WG16_16_01_WGM08
    SolutionIndex: 6
    SolutionNameMin: Cijk_Ailk_Bjlk_SB_MT064x064x16_DTL0_GRVW01_GSU01_PGR1_PLR1_TT04_04_USFGRO01_VW04_WG16_16_01_WGM64
    SolutionIndex: 7
    SolutionNameMin: Cijk_Ailk_Bjlk_SB_MT032x128x16_DTL0_GRVW04_GSU01_PGR0_PLR1_TT04_04_USFGRO0_VW04_WG08_32_01_WGM01
    SolutionIndex: 8
    SolutionNameMin: Cijk_Ailk_Bjlk_SB_MT064x064x16_DTL0_GRVW04_GSU01_PGR1_PLR1_TT04_04_USFGRO0_VW04_WG16_16_01_WGM01
    SolutionIndex: 9
    SolutionNameMin: Cijk_Ailk_Bjlk_SB_MT064x128x16_DTL0_GRVW04_GSU01_PGR0_PLR1_TT04_08_USFGRO0_VW04_WG16_16_01_WGM01
    SolutionIndex: 10
    SolutionNameMin: Cijk_Ailk_Bjlk_SB_MT064x064x16_DTL0_GRVW04_GSU01_PGR1_PLR1_TT04_04_USFGRO0_VW04_WG16_16_01_WGM08
    SolutionIndex: 11
    SolutionNameMin: Cijk_Ailk_Bjlk_SB_MT032x128x16_DTL0_GRVW04_GSU01_PGR0_PLR1_TT04_04_USFGRO0_VW04_WG08_32_01_WGM64
- - - [4096, 7133, 1, 4096]
    - [23, 10115.5]
  - - [512, 16, 1, 512]
    - [5, 797.472]
  - - [2048, 7133, 1, 2048]
    - [13, 10174.7]
  - - [2560, 7133, 1, 2560]
    - [15, 10045.6]
  - - [1024, 1024, 1, 1024]
    - [19, 9741.23]
  - - [3072, 7435, 1, 1024]
    - [13, 9886.7]
  - - [1024, 32, 1, 512]
    - [3, 2040.4]
  - - [1760, 7133, 1, 1760]
    - [15, 9990.38]
  - - [7680, 5481, 1, 2560]
    - [23, 9946.81]
  - - [1024, 16, 1, 512]
    - [5, 1364.33]
  - - [512, 32, 1, 512]
    - [2, 1509.83]
  - - [3136, 256, 64, 64]
    - [29, 7707.9]
  - - [784, 512, 64, 128]
    - [35, 8994.9]
  - - [49, 2048, 128, 512]
    - [26, 6772.45]
  - - [784, 128, 64, 512]
    - [36, 9035.2]
  - - [196, 1024, 64, 256]
    - [30, 8030.01]
  - - [3136, 64, 128, 64]
    - [32, 5170.03]
  - - [784, 512, 128, 128]
    - [35, 9170.52]
  - - [196, 1024, 128, 256]
    - [37, 8177.2]
  - - [196, 256, 64, 1024]
    - [33, 7986.69]
  - - [3136, 64, 64, 64]
    - [27, 5023.76]
  - - [3136, 64, 64, 256]
    - [36, 7535.2]
  - - [3136, 64, 128, 256]
    - [31, 7524.34]
  - - [784, 128, 128, 512]
    - [36, 9226.75]
  - - [49, 2048, 64, 512]
    - [36, 6643.23]
  - - [196, 256, 128, 1024]
    - [37, 8251.69]
  - - [49, 512, 64, 2048]
    - [34, 6630.34]
  - - [49, 512, 128, 2048]
    - [34, 7073.56]
  - - [3136, 256, 128, 64]
    - [28, 7839.96]
- - - -1
    - - - 128
        - - - 4
            - - [-1, 24]
          - - 64
            - - [4, 24]
              - [64, 7]
              - [256, 6]
              - [704, 8]
              - [3584, 6]
              - [4288, 8]
              - [5056, 6]
              - [5888, 8]
              - [-1, 6]
          - - 128
            - - [4, 24]
              - [256, 6]
              - [704, 8]
              - [1408, 6]
              - [1856, 7]
              - [2944, 6]
              - [3584, 7]
              - [4288, 6]
              - [5056, 8]
              - [5888, 7]
              - [-1, 8]
          - - 256
            - - [4, 24]
              - [256, 6]
              - [448, 8]
              - [2368, 6]
              - [2944, 10]
              - [-1, 8]
          - - 448
            - - [4, 24]
              - [256, 6]
              - [448, 8]
              - [4288, 6]
              - [5056, 8]
              - [-1, 6]
          - - 704
            - - [4, 24]
              - [64, 7]
              - [2368, 6]
              - [2944, 8]
              - [5888, 6]
              - [-1, 8]
          - - 1024
            - - [4, 24]
              - [128, 7]
              - [448, 6]
              - [1024, 7]
              - [1856, 10]
              - [2944, 7]
              - [3584, 10]
              - [5056, 8]
              - [-1, 7]
          - - 1408
            - - [4, 24]
              - [64, 7]
              - [1408, 6]
              - [2944, 8]
              - [4288, 6]
              - [5056, 8]
              - [5888, 7]
              - [-1, 9]
          - - 1856
            - - [4, 24]
              - [64, 7]
              - [1024, 6]
              - [1408, 8]
              - [2368, 6]
              - [3584, 8]
              - [4288, 7]
              - [5888, 8]
              - [-1, 10]
          - - 2368
            - - [4, 24]
              - [64, 7]
              - [704, 6]
              - [1024, 7]
              - [1408, 8]
              - [1856, 6]
              - [2944, 8]
              - [3584, 7]
              - [4288, 8]
              - [5888, 10]
              - [-1, 8]
          - - 2944
            - - [4, 24]
              - [64, 7]
              - [704, 6]
              - [1024, 7]
              - [1408, 6]
              - [3584, 8]
              - [4288, 10]
              - [5056, 8]
              - [-1, 10]
          - - 3584
            - - [4, 24]
              - [64, 7]
              - [256, 6]
              - [704, 7]
              - [1024, 10]
              - [1408, 8]
              - [1856, 6]
              - [2368, 9]
              - [2944, 8]
              - [3584, 6]
              - [5056, 10]
              - [-1, 6]
          - - 4288
            - - [4, 24]
              - [64, 8]
              - [704, 6]
              - [1408, 7]
              - [2368, 8]
              - [5056, 10]
              - [5888, 6]
              - [-1, 10]
          - - 5056
            - - [4, 24]
              - [64, 8]
              - [704, 6]
              - [1024, 7]
              - [1856, 6]
              - [2368, 8]
              - [2944, 9]
              - [3584, 10]
              - [5888, 7]
              - [-1, 8]
          - - 5888
            - - [4, 24]
              - [128, 8]
              - [256, 7]
              - [1408, 8]
              - [1856, 6]
              - [2944, 9]
              - [4288, 7]
              - [5056, 10]
              - [5888, 8]
              - [-1, 10]
          - - -1
            - - [4, 24]
              - [64, 8]
              - [256, 6]
              - [704, 8]
              - [1408, 6]
              - [2368, 10]
              - [2944, 8]
              - [4288, 7]
              - [-1, 10]
      - - 256
        - - - 4
            - - [4, 1]
              - [-1, 0]
          - - 64
            - - [4, 1]
              - [64, 5]
              - [448, 2]
              - [1024, 0]
              - [1856, 2]
              - [-1, 18]
          - - 128
            - - [4, 0]
              - [704, 2]
              - [1024, 14]
              - [3584, 18]
              - [4288, 21]
              - [-1, 18]
          - - 256
            - - [4, 1]
              - [64, 2]
              - [128, 0]
              - [256, 3]
              - [448, 2]
              - [-1, 18]
          - - 448
            - - [4, 0]
              - [64, 2]
              - [128, 0]
              - [448, 14]
              - [5888, 18]
              - [-1, 21]
          - - 704
            - - [64, 0]
              - [128, 3]
              - [256, 14]
              - [2944, 18]
              - [3584, 15]
              - [4288, 18]
              - [5056, 21]
              - [5888, 12]
              - [-1, 18]
          - - 1024
            - - [64, 0]
              - [256, 14]
              - [704, 18]
              - [1024, 16]
              - [1408, 21]
              - [1856, 16]
              - [2368, 21]
              - [2944, 16]
              - [3584, 21]
              - [4288, 18]
              - [5056, 13]
              - [-1, 21]
          - - 1408
            - - [4, 0]
              - [64, 2]
              - [704, 18]
              - [1024, 21]
              - [1408, 18]
              - [1856, 13]
              - [2368, 18]
              - [2944, 13]
              - [3584, 12]
              - [5056, 13]
              - [5888, 20]
              - [-1, 18]
          - - 1856
            - - [4, 0]
              - [64, 2]
              - [128, 18]
              - [256, 21]
              - [2944, 18]
              - [3584, 12]
              - [4288, 11]
              - [5056, 18]
              - [5888, 11]
              - [-1, 18]
          - - 2368
            - - [4, 0]
              - [256, 18]
              - [448, 21]
              - [704, 18]
              - [1024, 15]
              - [1408, 18]
              - [1856, 14]
              - [2368, 21]
              - [2944, 22]
              - [3584, 21]
              - [4288, 11]
              - [5056, 21]
              - [5888, 15]
              - [-1, 12]
          - - 2944
            - - [4, 0]
              - [448, 18]
              - [704, 21]
              - [1024, 16]
              - [1408, 13]
              - [1856, 21]
              - [2368, 18]
              - [2944, 21]
              - [3584, 11]
              - [4288, 22]
              - [5056, 13]
              - [5888, 23]
              - [-1, 16]
          - - 3584
            - - [4, 0]
              - [256, 18]
              - [704, 21]
              - [1024, 15]
              - [1856, 21]
              - [2368, 12]
              - [2944, 14]
              - [3584, 19]
              - [4288, 14]
              - [5056, 21]
              - [5888, 23]
              - [-1, 12]
          - - 4288
            - - [4, 0]
              - [128, 18]
              - [1024, 21]
              - [1408, 15]
              - [1856, 18]
              - [2368, 12]
              - [3584, 19]
              - [4288, 23]
              - [5056, 21]
              - [5888, 20]
              - [-1, 21]
          - - 5056
            - - [4, 0]
              - [128, 18]
              - [448, 21]
              - [704, 18]
              - [1024, 16]
              - [1408, 21]
              - [1856, 14]
              - [2944, 15]
              - [3584, 21]
              - [4288, 20]
              - [5056, 15]
              - [5888, 20]
              - [-1, 15]
          - - 5888
            - - [4, 0]
              - [128, 18]
              - [704, 21]
              - [1408, 16]
              - [1856, 15]
              - [2368, 19]
              - [2944, 22]
              - [5888, 14]
              - [-1, 15]
          - - -1
            - - [4, 0]
              - [128, 18]
              - [704, 21]
              - [1024, 15]
              - [1408, 20]
              - [1856, 19]
              - [2368, 14]
              - [2944, 20]
              - [3584, 21]
              - [5056, 20]
              - [5888, 15]
              - [-1, 17]
      - - 1280
        - - - 4
            - - [704, 1]
              - [1024, 0]
              - [1408, 1]
              - [-1, 0]
          - - 64
            - - [64, 1]
              - [128, 5]
              - [256, 2]
              - [448, 5]
              - [2368, 4]
              - [3584, 18]
              - [5056, 4]
              - [-1, 18]
          - - 128
            - - [4, 1]
              - [64, 5]
              - [128, 2]
              - [1408, 4]
              - [1856, 18]
              - [2368, 4]
              - [2944, 18]
              - [3584, 21]
              - [4288, 4]
              - [-1, 18]
          - - 256
            - - [4, 1]
              - [64, 2]
              - [448, 4]
              - [4288, 18]
              - [5888, 21]
              - [-1, 18]
          - - 448
            - - [4, 1]
              - [64, 5]
              - [448, 4]
              - [704, 21]
              - [2944, 18]
              - [3584, 14]
              - [4288, 12]
              - [-1, 11]
          - - 704
            - - [4, 1]
              - [128, 4]
              - [1024, 18]
              - [1408, 21]
              - [1856, 18]
              - [2368, 11]
              - [2944, 12]
              - [-1, 11]
          - - 1024
            - - [4, 1]
              - [128, 4]
              - [704, 21]
              - [1024, 22]
              - [1408, 16]
              - [1856, 13]
              - [2368, 12]
              - [2944, 11]
              - [3584, 19]
              - [-1, 11]
          - - 1408
            - - [4, 1]
              - [128, 4]
              - [256, 21]
              - [448, 18]
              - [1024, 21]
              - [1408, 11]
              - [1856, 13]
              - [5056, 11]
              - [5888, 23]
              - [-1, 14]
          - - 1856
            - - [4, 1]
              - [64, 4]
              - [448, 18]
              - [704, 14]
              - [1024, 12]
              - [2944, 11]
              - [3584, 15]
              - [4288, 23]
              - [5056, 18]
              - [5888, 12]
              - [-1, 16]
          - - 2368
            - - [4, 0]
              - [128, 4]
              - [256, 18]
              - [448, 14]
              - [704, 11]
              - [1024, 13]
              - [2368, 11]
              - [2944, 13]
              - [4288, 15]
              - [5056, 21]
              - [5888, 13]
              - [-1, 15]
          - - 2944
            - - [4, 0]
              - [64, 4]
              - [128, 18]
              - [256, 21]
              - [704, 16]
              - [2368, 11]
              - [2944, 15]
              - [3584, 14]
              - [4288, 16]
              - [5888, 15]
              - [-1, 12]
          - - 3584
            - - [4, 0]
              - [128, 18]
              - [256, 21]
              - [704, 11]
              - [1024, 13]
              - [1856, 11]
              - [2368, 15]
              - [2944, 21]
              - [3584, 15]
              - [4288, 20]
              - [5056, 16]
              - [-1, 15]
          - - 4288
            - - [4, 1]
              - [128, 4]
              - [256, 18]
              - [448, 13]
              - [704, 11]
              - [1024, 21]
              - [1408, 11]
              - [1856, 23]
              - [2944, 15]
              - [3584, 23]
              - [4288, 21]
              - [-1, 15]
          - - 5056
            - - [4, 1]
              - [64, 4]
              - [128, 21]
              - [256, 14]
              - [704, 11]
              - [1024, 23]
              - [1408, 15]
              - [2368, 21]
              - [2944, 12]
              - [3584, 15]
              - [4288, 16]
              - [5056, 20]
              - [5888, 15]
              - [-1, 17]
          - - 5888
            - - [4, 0]
              - [256, 21]
              - [704, 11]
              - [1024, 17]
              - [1408, 23]
              - [1856, 21]
              - [2368, 16]
              - [2944, 17]
              - [3584, 16]
              - [5056, 17]
              - [-1, 20]
          - - -1
            - - [4, 0]
              - [128, 18]
              - [256, 14]
              - [704, 11]
              - [1024, 17]
              - [1408, 21]
              - [2368, 16]
              - [3584, 23]
              - [4288, 17]
              - [5056, 16]
              - [5888, 17]
              - [-1, 23]
      - - -1
        - - - 4
            - - [704, 1]
              - [1024, 0]
              - [1408, 1]
              - [3584, 0]
              - [5056, 1]
              - [5888, 25]
              - [-1, 1]
          - - 64
            - - [64, 1]
              - [448, 5]
              - [2944, 4]
              - [3584, 18]
              - [4288, 4]
              - [-1, 11]
          - - 128
            - - [4, 1]
              - [128, 5]
              - [1856, 4]
              - [2944, 11]
              - [3584, 14]
              - [5888, 11]
              - [-1, 12]
          - - 256
            - - [4, 1]
              - [64, 5]
              - [448, 4]
              - [704, 11]
              - [1024, 18]
              - [1408, 11]
              - [1856, 18]
              - [2944, 11]
              - [3584, 12]
              - [4288, 11]
              - [5056, 18]
              - [5888, 12]
              - [-1, 21]
          - - 448
            - - [4, 1]
              - [448, 4]
              - [1024, 18]
              - [1408, 11]
              - [1856, 12]
              - [2368, 18]
              - [2944, 15]
              - [3584, 21]
              - [5888, 11]
              - [-1, 12]
          - - 704
            - - [4, 1]
              - [128, 4]
              - [256, 11]
              - [448, 21]
              - [1024, 11]
              - [1408, 15]
              - [1856, 11]
              - [2368, 21]
              - [3584, 15]
              - [4288, 12]
              - [5056, 15]
              - [5888, 12]
              - [-1, 20]
          - - 1024
            - - [4, 1]
              - [128, 4]
              - [256, 11]
              - [448, 14]
              - [704, 11]
              - [1024, 12]
              - [1408, 15]
              - [1856, 13]
              - [2368, 12]
              - [2944, 19]
              - [3584, 15]
              - [4288, 12]
              - [5056, 15]
              - [5888, 23]
              - [-1, 15]
          - - 1408
            - - [4, 1]
              - [128, 4]
              - [256, 18]
              - [448, 11]
              - [704, 19]
              - [1024, 11]
              - [1408, 21]
              - [2368, 11]
              - [2944, 23]
              - [3584, 15]
              - [5056, 20]
              - [5888, 23]
              - [-1, 12]
          - - 1856
            - - [4, 0]
              - [128, 4]
              - [256, 14]
              - [704, 11]
              - [1856, 15]
              - [2368, 14]
              - [2944, 21]
              - [3584, 15]
              - [4288, 20]
              - [-1, 15]
          - - 2368
            - - [4, 0]
              - [128, 4]
              - [256, 11]
              - [704, 21]
              - [1024, 15]
              - [1408, 21]
              - [1856, 11]
              - [2368, 16]
              - [2944, 23]
              - [3584, 12]
              - [4288, 16]
              - [5056, 20]
              - [-1, 15]
          - - 2944
            - - [4, 0]
              - [64, 4]
              - [704, 11]
              - [1024, 13]
              - [1408, 12]
              - [1856, 21]
              - [2368, 20]
              - [2944, 15]
              - [3584, 16]
              - [4288, 15]
              - [5056, 13]
              - [5888, 17]
              - [-1, 20]
          - - 3584
            - - [4, 0]
              - [128, 18]
              - [256, 11]
              - [448, 21]
              - [704, 13]
              - [1024, 15]
              - [1408, 23]
              - [1856, 13]
              - [2368, 21]
              - [3584, 15]
              - [4288, 20]
              - [5056, 16]
              - [5888, 20]
              - [-1, 23]
          - - 4288
            - - [4, 1]
              - [448, 11]
              - [1024, 22]
              - [1856, 23]
              - [2368, 12]
              - [2944, 15]
              - [3584, 17]
              - [4288, 15]
              - [5056, 16]
              - [5888, 17]
              - [-1, 15]
          - - 5056
            - - [4, 0]
              - [256, 11]
              - [448, 21]
              - [704, 22]
              - [1024, 20]
              - [1408, 23]
              - [1856, 21]
              - [2368, 20]
              - [2944, 16]
              - [3584, 23]
              - [4288, 15]
              - [5056, 17]
              - [5888, 23]
              - [-1, 17]
          - - 5888
            - - [4, 1]
              - [256, 11]
              - [448, 14]
              - [704, 13]
              - [1024, 23]
              - [1408, 17]
              - [2368, 16]
              - [2944, 20]
              - [5056, 17]
              - [-1, 23]
          - - -1
            - - [4, 0]
              - [128, 11]
              - [256, 21]
              - [448, 22]
              - [704, 23]
              - [1856, 15]
              - [2944, 23]
              - [3584, 17]
              - [4288, 16]
              - [5056, 17]
              - [5888, 23]
              - [-1, 17]
