library/src/blas3/Tensile/Logic/asm_full/vega10_Cijk_Ailk_Bljk_SB.yaml
- {MinimumRequiredVersion: 4.1.0}
- vega10
- gfx900
- [Device 6863, Device 6862, Device 687f, Device 6860]
- - - [2560, 7000, 1, 2560]
    - [57, 11168.7]
  - - [5124, 9124, 1, 1760]
    - [57, 11045.9]
  - - [5124, 9124, 1, 2560]
    - [60, 10960.2]
  - - [1760, 32, 1, 1760]
    - [24, 3818.89]
  - - [1024, 1500, 1, 1536]
    - [55, 9406.52]
  - - [3136, 2048, 1, 512]
    - [1, 9603.56]
  - - [512, 24000, 1, 1536]
    - [58, 10580.2]
  - - [1024, 3000, 1, 2560]
    - [59, 10323.9]
  - - [512, 3136, 1, 2048]
    - [67, 1444990.0]
  - - [8448, 4, 1, 2816]
    - [49, 786.212]
  - - [35, 1500, 1, 2560]
    - [20, 3203.29]
  - - [3072, 24000, 1, 1024]
    - [58, 11254.6]
  - - [784, 512, 64, 128]
    - [70, 9178.46]
  - - [2560, 128, 1, 2560]
    - [29, 6513.66]
  - - [3072, 16, 1, 1024]
    - [50, 2246.88]
  - - [512, 48000, 1, 2048]
    - [58, 10516.8]
  - - [1760, 64, 1, 1760]
    - [35, 5269.91]
  - - [1024, 16, 1, 512]
    - [21, 928.848]
  - - [196, 256, 64, 1024]
    - [70, 6061.23]
  - - [512, 48000, 1, 1536]
    - [57, 10923.3]
  - - [2560, 32, 1, 2560]
    - [23, 4481.83]
  - - [4608, 1500, 1, 1536]
    - [57, 10378.5]
  - - [2048, 128, 1, 2048]
    - [27, 6223.88]
  - - [1024, 24000, 1, 2560]
    - [57, 11020.4]
  - - [4608, 3000, 1, 1536]
    - [57, 10949.0]
  - - [5124, 9124, 1, 2048]
    - [58, 10902.5]
  - - [1024, 700, 1, 512]
    - [54, 6862.82]
  - - [3072, 1, 1, 128]
    - [28, 57.5969]
  - - [5124, 700, 1, 2560]
    - [54, 9706.18]
  - - [8448, 16, 1, 2816]
    - [42, 2897.96]
  - - [6144, 6000, 1, 2560]
    - [58, 10919.5]
  - - [4608, 32, 1, 1536]
    - [48, 3907.93]
  - - [35, 8457, 1, 2560]
    - [20, 4195.11]
  - - [3072, 64, 1, 1024]
    - [27, 3846.57]
  - - [512, 16, 1, 512]
    - [30, 578.263]
  - - [7680, 2, 1, 2560]
    - [25, 412.031]
  - - [193600, 256, 1, 64]
    - [5, 8887.1]
  - - [7680, 1, 1, 2560]
    - [31, 206.786]
  - - [128, 1500, 1, 1280]
    - [48, 5442.41]
  - - [35, 8457, 1, 4096]
    - [19, 4152.2]
  - - [1024, 1500, 1, 2816]
    - [57, 9800.87]
  - - [6144, 2, 1, 2560]
    - [45, 397.803]
  - - [8448, 48000, 1, 2816]
    - [58, 11289.5]
  - - [512, 6000, 1, 1536]
    - [59, 9958.52]
  - - [4224, 1500, 1, 176]
    - [57, 9143.54]
  - - [7680, 64, 1, 2560]
    - [33, 6988.27]
  - - [1024, 6000, 1, 2816]
    - [57, 10672.8]
  - - [50176, 512, 1, 128]
    - [1, 9679.94]
  - - [512, 32, 1, 512]
    - [37, 999.672]
  - - [4096, 128, 1, 4096]
    - [55, 7919.8]
  - - [4608, 24000, 1, 1536]
    - [57, 11527.1]
  - - [512, 2, 1, 500000]
    - [6, 442.603]
  - - [7680, 48000, 1, 2560]
    - [58, 11284.3]
  - - [3072, 48000, 1, 1024]
    - [58, 11384.9]
  - - [1760, 16, 1, 1760]
    - [53, 2285.02]
  - - [512, 3000, 1, 2816]
    - [57, 9807.18]
  - - [8448, 1500, 1, 2816]
    - [57, 10757.6]
  - - [1760, 7000, 1, 1760]
    - [57, 10836.7]
  - - [64, 193600, 1, 256]
    - [69, 550684.0]
  - - [1024, 3000, 1, 2048]
    - [56, 9745.7]
  - - [6144, 4, 1, 2560]
    - [22, 786.412]
  - - [1024, 6000, 1, 2048]
    - [55, 10270.7]
  - - [193600, 64, 1, 64]
    - [4, 5918.83]
  - - [4224, 1, 1, 128]
    - [28, 69.1213]
  - - [6144, 48000, 1, 2560]
    - [58, 11192.2]
  - - [8448, 3000, 1, 2816]
    - [60, 11066.8]
  - - [35, 1500, 1, 2048]
    - [17, 2340.5]
  - - [3072, 4, 1, 1024]
    - [28, 643.424]
  - - [4608, 48000, 1, 1536]
    - [58, 11453.9]
  - - [2048, 32, 1, 2048]
    - [34, 3534.44]
  - - [7680, 1500, 1, 2560]
    - [57, 10895.9]
  - - [3072, 128, 1, 1024]
    - [56, 5481.28]
  - - [4608, 16, 1, 1536]
    - [31, 2658.57]
  - - [1024, 1500, 1, 2048]
    - [56, 8877.33]
  - - [3072, 3000, 1, 1024]
    - [58, 10226.3]
  - - [3072, 2, 1, 1024]
    - [28, 324.067]
  - - [8448, 1, 1, 2816]
    - [12, 202.502]
  - - [1024, 48000, 1, 2560]
    - [57, 11480.5]
  - - [1024, 3000, 1, 2816]
    - [58, 10437.4]
  - - [128, 1, 1, 1408]
    - [46, 26.1285]
  - - [35, 8457, 1, 1760]
    - [16, 4304.18]
  - - [1024, 2, 1, 512]
    - [22, 131.654]
  - - [512, 4, 1, 500000]
    - [10, 881.575]
  - - [6144, 1, 1, 2560]
    - [51, 200.342]
  - - [1024, 48000, 1, 2816]
    - [58, 11479.2]
  - - [512, 48000, 1, 2816]
    - [58, 11171.3]
  - - [2048, 16, 1, 2048]
    - [53, 2489.98]
  - - [1024, 24000, 1, 1536]
    - [56, 10846.7]
  - - [64, 193600, 1, 64]
    - [67, 139390.0]
  - - [7680, 6000, 1, 2560]
    - [57, 11501.4]
  - - [1760, 128, 1, 1760]
    - [36, 6174.47]
  - - [35, 8457, 1, 2048]
    - [15, 3680.68]
  - - [512, 1500, 1, 2816]
    - [54, 8955.27]
  - - [3072, 1, 1, 1024]
    - [28, 162.632]
  - - [512, 16, 1, 500000]
    - [9, 3363.82]
  - - [1024, 8, 1, 500000]
    - [7, 1754.61]
  - - [512, 24000, 1, 2560]
    - [57, 10752.2]
  - - [1024, 1024, 1, 1024]
    - [56, 8018.68]
  - - [1024, 24000, 1, 2816]
    - [60, 11080.8]
  - - [512, 50176, 1, 128]
    - [68, 327957.0]
  - - [2048, 7000, 1, 2048]
    - [58, 10874.1]
  - - [7680, 3000, 1, 2560]
    - [57, 11281.4]
  - - [5124, 700, 1, 2048]
    - [59, 9052.42]
  - - [5124, 9124, 1, 4096]
    - [58, 10941.7]
  - - [2560, 64, 1, 2560]
    - [47, 5559.0]
  - - [256, 193600, 1, 64]
    - [67, 176304.0]
  - - [256, 12544, 1, 1024]
    - [67, 1216820.0]
  - - [7680, 4, 1, 2560]
    - [31, 822.837]
  - - [512, 6000, 1, 2048]
    - [55, 8557.07]
  - - [7680, 32, 1, 2560]
    - [32, 5832.01]
  - - [8448, 6000, 1, 2816]
    - [58, 11377.6]
  - - [4096, 64, 1, 4096]
    - [27, 7252.24]
  - - [5124, 1500, 1, 2560]
    - [58, 10283.9]
  - - [1024, 1500, 1, 2560]
    - [55, 9599.76]
  - - [3025, 64, 64, 64]
    - [70, 5371.43]
  - - [512, 4, 1, 512]
    - [22, 153.592]
  - - [1024, 6000, 1, 2560]
    - [58, 10558.5]
  - - [3072, 32, 1, 1024]
    - [26, 3152.66]
  - - [35, 700, 1, 2560]
    - [18, 2370.89]
  - - [3136, 512, 1, 2048]
    - [3, 8115.33]
  - - [196, 1024, 64, 256]
    - [70, 7664.69]
  - - [6144, 3000, 1, 2560]
    - [58, 10844.0]
  - - [4608, 1, 1, 1536]
    - [14, 184.318]
  - - [512, 6000, 1, 2560]
    - [59, 10152.3]
  - - [49, 512, 64, 2048]
    - [70, 3453.15]
  - - [4096, 32, 1, 4096]
    - [41, 5290.5]
  - - [7680, 24000, 1, 2560]
    - [57, 11510.7]
  - - [512, 3000, 1, 2048]
    - [62, 7587.6]
  - - [1024, 4, 1, 512]
    - [22, 265.678]
  - - [64, 1, 1, 1216]
    - [40, 11.5201]
  - - [512, 1, 1, 500000]
    - [10, 221.711]
  - - [512, 1500, 1, 2560]
    - [54, 8631.7]
  - - [176, 1500, 1, 1408]
    - [35, 5484.89]
  - - [512, 3000, 1, 1536]
    - [55, 9256.92]
  - - [8448, 24000, 1, 2816]
    - [57, 11288.2]
  - - [4608, 2, 1, 1536]
    - [31, 368.631]
  - - [1024, 48000, 1, 1536]
    - [60, 11268.0]
  - - [7680, 128, 1, 2560]
    - [55, 9218.15]
  - - [3072, 6000, 1, 1024]
    - [58, 10706.9]
  - - [3072, 1500, 1, 128]
    - [54, 7780.66]
  - - [2048, 3136, 1, 512]
    - [66, 872367.0]
  - - [3025, 256, 64, 64]
    - [70, 8301.58]
  - - [1024, 3000, 1, 1536]
    - [58, 10166.0]
  - - [1024, 4, 1, 500000]
    - [13, 882.169]
  - - [35, 700, 1, 2048]
    - [17, 2004.47]
  - - [1024, 16, 1, 500000]
    - [8, 3438.83]
  - - [512, 24000, 1, 2048]
    - [55, 10184.1]
  - - [128, 50176, 1, 512]
    - [67, 872478.0]
  - - [1024, 32, 1, 512]
    - [28, 1594.04]
  - - [12544, 1024, 1, 256]
    - [0, 10167.3]
  - - [1024, 12544, 1, 256]
    - [65, 563936.0]
  - - [512, 48000, 1, 2560]
    - [58, 11145.4]
  - - [2560, 16, 1, 2560]
    - [52, 2642.51]
  - - [2048, 64, 1, 2048]
    - [44, 4796.4]
  - - [512, 2, 1, 512]
    - [46, 77.6088]
  - - [1024, 1, 1, 512]
    - [22, 70.2151]
  - - [512, 1500, 1, 2048]
    - [55, 6977.24]
  - - [6144, 32, 1, 2560]
    - [33, 5196.55]
  - - [512, 24000, 1, 2816]
    - [57, 10828.8]
  - - [1024, 1, 1, 500000]
    - [11, 222.354]
  - - [6144, 16, 1, 2560]
    - [38, 3048.11]
  - - [1024, 24000, 1, 2048]
    - [56, 10874.1]
  - - [5124, 1500, 1, 2048]
    - [58, 9943.44]
  - - [3072, 1500, 1, 1024]
    - [56, 9533.55]
  - - [1024, 2, 1, 500000]
    - [11, 443.503]
  - - [512, 8, 1, 500000]
    - [12, 1744.14]
  - - [7680, 16, 1, 2560]
    - [25, 3141.74]
  - - [6144, 1500, 1, 2560]
    - [58, 10730.5]
  - - [512, 1, 1, 512]
    - [21, 38.4006]
  - - [512, 6000, 1, 2816]
    - [58, 10443.7]
  - - [8448, 2, 1, 2816]
    - [11, 402.083]
  - - [4608, 4, 1, 1536]
    - [31, 735.9]
  - - [1024, 6000, 1, 1536]
    - [58, 10409.2]
  - - [8448, 32, 1, 2816]
    - [43, 5061.49]
  - - [4096, 7000, 1, 4096]
    - [58, 11208.1]
  - - [4096, 16, 1, 4096]
    - [39, 3150.9]
  - - [6144, 24000, 1, 2560]
    - [58, 11454.1]
  - - [512, 3000, 1, 2560]
    - [55, 9523.71]
  - - [4608, 6000, 1, 1536]
    - [57, 11222.5]
  - - [12544, 256, 1, 1024]
    - [2, 8940.65]
  - - [512, 1500, 1, 1536]
    - [54, 8319.17]
  - - [128, 1, 1, 1024]
    - [46, 19.4008]
  - - [49, 2048, 64, 512]
    - [70, 5036.06]
  - - [1024, 48000, 1, 2048]
    - [58, 11313.9]
- - - -1
    - - - -1
        - - - 4
            - - [-1, 64]
          - - 64
            - - [4, 64]
              - [128, 46]
              - [256, 53]
              - [704, 52]
              - [1024, 24]
              - [1408, 43]
              - [2368, 36]
              - [3584, 48]
              - [4288, 43]
              - [5056, 29]
              - [-1, 47]
          - - 128
            - - [4, 64]
              - [64, 46]
              - [128, 53]
              - [256, 52]
              - [704, 43]
              - [1408, 29]
              - [1856, 33]
              - [2368, 29]
              - [2944, 32]
              - [3584, 29]
              - [4288, 47]
              - [5056, 32]
              - [5888, 63]
              - [-1, 56]
          - - 256
            - - [4, 64]
              - [64, 53]
              - [128, 24]
              - [256, 23]
              - [448, 29]
              - [2944, 63]
              - [3584, 56]
              - [5056, 63]
              - [5888, 57]
              - [-1, 63]
          - - 448
            - - [4, 64]
              - [64, 52]
              - [128, 43]
              - [448, 35]
              - [1408, 63]
              - [1856, 56]
              - [2368, 63]
              - [2944, 57]
              - [5056, 63]
              - [5888, 61]
              - [-1, 54]
          - - 704
            - - [4, 64]
              - [128, 43]
              - [3584, 63]
              - [5888, 54]
              - [-1, 60]
          - - 1024
            - - [4, 64]
              - [64, 24]
              - [128, 41]
              - [704, 63]
              - [1024, 56]
              - [1408, 57]
              - [1856, 61]
              - [-1, 57]
          - - 1408
            - - [4, 64]
              - [64, 43]
              - [128, 47]
              - [448, 63]
              - [704, 56]
              - [-1, 57]
          - - 1856
            - - [4, 64]
              - [64, 35]
              - [128, 33]
              - [256, 63]
              - [448, 56]
              - [704, 63]
              - [1024, 60]
              - [1408, 63]
              - [2944, 57]
              - [3584, 54]
              - [5056, 57]
              - [5888, 54]
              - [-1, 57]
          - - 2368
            - - [4, 64]
              - [64, 36]
              - [128, 29]
              - [704, 63]
              - [2368, 57]
              - [2944, 60]
              - [5056, 57]
              - [5888, 60]
              - [-1, 57]
          - - 2944
            - - [4, 64]
              - [64, 29]
              - [128, 33]
              - [256, 63]
              - [5056, 57]
              - [5888, 60]
              - [-1, 57]
          - - 3584
            - - [4, 64]
              - [64, 33]
              - [128, 63]
              - [256, 56]
              - [448, 63]
              - [-1, 57]
          - - 4288
            - - [4, 64]
              - [128, 36]
              - [256, 63]
              - [2944, 57]
              - [3584, 60]
              - [-1, 57]
          - - 5056
            - - [4, 64]
              - [64, 29]
              - [128, 36]
              - [448, 63]
              - [704, 57]
              - [1408, 61]
              - [1856, 57]
              - [2368, 61]
              - [5056, 57]
              - [5888, 60]
              - [-1, 57]
          - - 5888
            - - [4, 64]
              - [64, 33]
              - [128, 63]
              - [704, 57]
              - [1408, 61]
              - [-1, 57]
          - - -1
            - - [4, 64]
              - [64, 47]
              - [128, 56]
              - [256, 63]
              - [448, 57]
              - [704, 60]
              - [1024, 61]
              - [1856, 57]
              - [2944, 61]
              - [3584, 60]
              - [4288, 61]
              - [-1, 60]
