library/src/blas3/Tensile/Logic/asm_full/vega20_Cijk_Ailk_Bjlk_DB.yaml
- {MinimumRequiredVersion: 4.6.0}
- vega20
- gfx906
- [Device 66a0, Device 66a1, Device 66a7]
    SolutionIndex: 0
    SolutionNameMin: Cijk_Ailk_Bjlk_DB_MT064x064x08_NLCA01_NLCB01_TT04_04_USFGRO0_WG16_16_01
    SolutionIndex: 1
    SolutionNameMin: Cijk_Ailk_Bjlk_DB_MT064x064x04_NLCA01_NLCB01_TT04_04_USFGRO01_WG16_16_01
    SolutionIndex: 2
    SolutionNameMin: Cijk_Ailk_Bjlk_DB_MT096x032x08_NLCA03_NLCB01_TT06_04_USFGRO0_WG16_08_01
    SolutionIndex: 3
    SolutionNameMin: Cijk_Ailk_Bjlk_DB_MT032x064x08_NLCA01_NLCB01_TT04_04_USFGRO0_WG08_16_01
    SolutionIndex: 4
    SolutionNameMin: Cijk_Ailk_Bjlk_DB_MT032x096x08_NLCA01_NLCB03_TT04_06_USFGRO0_WG08_16_01
- - - [3072, 3072, 1, 384]
    - [0, 4376.45]
  - - [5760, 5760, 1, 5760]
    - [0, 2272.23]
  - - [4132, 4132, 1, 400]
    - [1, 4348.03]
  - - [4224, 4224, 1, 384]
    - [2, 3797.72]
  - - [768, 768, 1, 384]
    - [2, 3475.94]
  - - [2304, 2304, 1, 384]
    - [4, 4495.48]
  - - [36, 36, 1, 400]
    - [3, 15.3011]
  - - [1, 1, 1, 64]
    - [1, 0.00622568]
  - - [3840, 3840, 1, 384]
    - [2, 4590.81]
  - - [2688, 2688, 1, 384]
    - [0, 4554.08]
  - - [7744, 7744, 1, 7744]
    - [0, 2322.98]
  - - [1152, 1152, 1, 384]
    - [2, 3932.16]
  - - [3108, 3108, 1, 400]
    - [0, 4471.23]
  - - [1920, 1920, 1, 384]
    - [0, 4258.65]
  - - [64, 64, 1, 64]
    - [0, 5.77919]
  - - [2084, 2084, 1, 400]
    - [4, 4304.31]
  - - [1, 64, 1, 64]
    - [1, 0.259241]
  - - [64, 1, 1, 64]
    - [1, 0.3751]
  - - [1536, 1536, 1, 384]
    - [0, 4387.69]
  - - [384, 384, 1, 384]
    - [0, 1657.59]
  - - [1060, 1060, 1, 400]
    - [0, 3790.82]
  - - [3456, 3456, 1, 384]
    - [2, 4620.66]
- null
