library/src/blas3/Tensile/Logic/asm_full/vega20_Cijk_Ailk_Bjlk_4xi8BH.yaml
- {MinimumRequiredVersion: 4.6.0}
- vega20
- gfx906
- [Device 66a0, Device 66a1, Device 66a7]
    SolutionIndex: 0
    SolutionNameMin: Cijk_Ailk_Bjlk_4xi8BH_MT064x032x08_DTL0_GSU01_NLCA01_NLCB01_TT04_02_USFGRO0_WG16_16_01
    SolutionIndex: 1
    SolutionNameMin: Cijk_Ailk_Bjlk_4xi8BH_MT128x032x16_DTL0_GSU01_NLCA01_NLCB01_TT08_02_USFGRO01_WG16_16_01
    SolutionIndex: 2
    SolutionNameMin: Cijk_Ailk_Bjlk_4xi8BH_MT032x128x16_DTL0_GSU01_NLCA01_NLCB01_TT02_08_USFGRO01_WG16_16_01
- - - [128, 128, 2, 65]
    - [0, 1314.77]
  - - [128, 1, 2, 64]
    - [1, 7.87692]
  - - [127, 127, 2, 1]
    - [1, 37.5093]
  - - [129, 129, 2, 63]
    - [0, 1233.39]
  - - [127, 127, 2, 65]
    - [0, 1191.43]
  - - [1, 127, 2, 64]
    - [2, 7.74095]
  - - [1, 128, 2, 64]
    - [2, 7.80191]
  - - [128, 129, 2, 1]
    - [1, 38.4]
  - - [1, 128, 2, 63]
    - [2, 7.46667]
  - - [127, 1, 2, 63]
    - [2, 7.47757]
  - - [129, 1, 2, 64]
    - [2, 7.93846]
  - - [128, 1, 2, 63]
    - [1, 7.53645]
  - - [1, 129, 2, 65]
    - [2, 7.69266]
  - - [127, 129, 2, 1]
    - [1, 39.0071]
  - - [128, 128, 2, 64]
    - [0, 1361.79]
  - - [128, 1, 2, 65]
    - [2, 7.7757]
  - - [1, 129, 2, 64]
    - [2, 7.93846]
  - - [1, 129, 2, 63]
    - [2, 7.59533]
  - - [1, 128, 2, 65]
    - [2, 7.63303]
  - - [129, 129, 2, 65]
    - [0, 1257.75]
  - - [128, 128, 2, 1]
    - [1, 42.0103]
  - - [1, 1, 2, 1]
    - [1, 0.00149254]
  - - [129, 1, 2, 65]
    - [1, 7.69266]
  - - [127, 1, 2, 64]
    - [1, 7.81538]
  - - [127, 128, 2, 1]
    - [1, 37.8047]
  - - [129, 127, 2, 1]
    - [2, 37.2341]
  - - [127, 1, 2, 65]
    - [2, 7.57339]
  - - [128, 127, 2, 1]
    - [1, 37.8047]
  - - [127, 127, 2, 64]
    - [0, 1064.18]
  - - [1, 127, 2, 65]
    - [2, 7.50455]
  - - [129, 1, 2, 63]
    - [1, 7.66698]
  - - [129, 129, 2, 1]
    - [1, 36.1761]
  - - [129, 129, 2, 64]
    - [0, 1252.97]
  - - [127, 127, 2, 63]
    - [0, 915.43]
  - - [1, 127, 2, 63]
    - [1, 5.3698]
  - - [128, 128, 2, 63]
    - [0, 1290.24]
  - - [129, 128, 2, 1]
    - [1, 35.8957]
- null
