library/src/blas3/Tensile/Logic/asm_full/vega10_Cijk_Ailk_Bljk_HB.yaml
- {MinimumRequiredVersion: 4.6.0}
- vega10
- gfx900
- [Device 6863, Device 6862, Device 687f, Device 6860, Device 6861, 'Vega 10 XTX [Radeon
    SolutionIndex: 0
    SolutionNameMin: Cijk_Ailk_Bljk_HB_MT016x016x08_EPS1_GRVW02_LPB00_PGR1_SNLL1_TT02_02_USFGRO01_VW02_WG08_08_01
    SolutionIndex: 1
    SolutionNameMin: Cijk_Ailk_Bljk_HB_MT032x008x08_EPS1_GRVW02_LPB00_PGR1_SNLL1_TT02_02_USFGRO01_VW02_WG16_04_01
    SolutionIndex: 2
    SolutionNameMin: Cijk_Ailk_Bljk_HB_MT032x016x08_EPS1_GRVW02_LPB00_PGR1_SNLL1_TT02_02_USFGRO01_VW02_WG16_08_01
    SolutionIndex: 3
    SolutionNameMin: Cijk_Ailk_Bljk_HB_MT064x016x08_EPS1_GRVW02_LPB00_PGR1_SNLL1_TT04_02_USFGRO01_VW02_WG16_08_01
    SolutionIndex: 4
    SolutionNameMin: Cijk_Ailk_Bljk_HB_MT064x032x08_EPS1_GRVW04_LPB00_PGR1_SNLL1_TT04_04_USFGRO0_VW04_WG16_08_01
    SolutionIndex: 5
    SolutionNameMin: Cijk_Ailk_Bljk_HB_MT128x032x08_EPS1_GRVW04_LPB00_PGR1_SNLL1_TT04_04_USFGRO0_VW04_WG32_08_01
    SolutionIndex: 6
    SolutionNameMin: Cijk_Ailk_Bljk_HB_MT256x064x08_EPS1_GRVW08_LPB00_PGR1_SNLL1_TT08_08_USFGRO0_VW08_WG32_08_01
    SolutionIndex: 7
    SolutionNameMin: Cijk_Ailk_Bljk_HB_MT016x016x16_EPS1_GRVW02_LPB00_PGR1_SNLL1_TT02_02_USFGRO01_VW02_WG08_08_01
    SolutionIndex: 8
    SolutionNameMin: Cijk_Ailk_Bljk_HB_MT032x032x16_EPS1_GRVW04_LPB00_PGR1_SNLL1_TT04_04_USFGRO0_VW04_WG08_08_01
    SolutionIndex: 9
    SolutionNameMin: Cijk_Ailk_Bljk_HB_MT032x008x16_EPS1_GRVW02_LPB00_PGR1_SNLL1_TT02_02_USFGRO01_VW02_WG16_04_01
    SolutionIndex: 10
    SolutionNameMin: Cijk_Ailk_Bljk_HB_MT064x016x16_EPS1_GRVW04_LPB00_PGR1_SNLL1_TT04_04_USFGRO0_VW04_WG16_04_01
    SolutionIndex: 11
    SolutionNameMin: Cijk_Ailk_Bljk_HB_MT032x016x16_EPS1_GRVW02_LPB00_PGR1_SNLL1_TT02_02_USFGRO01_VW02_WG16_08_01
    SolutionIndex: 12
    SolutionNameMin: Cijk_Ailk_Bljk_HB_MT064x016x16_EPS1_GRVW02_LPB00_PGR1_SNLL1_TT04_02_USFGRO01_VW02_WG16_08_01
    SolutionIndex: 13
    SolutionNameMin: Cijk_Ailk_Bljk_HB_MT064x032x16_EPS1_GRVW04_LPB00_PGR1_SNLL1_TT04_04_USFGRO0_VW04_WG16_08_01
    SolutionIndex: 14
    SolutionNameMin: Cijk_Ailk_Bljk_HB_MT064x064x16_EPS1_GRVW04_LPB00_PGR1_SNLL1_TT04_04_USFGRO0_VW04_WG16_16_01
    SolutionIndex: 15
    SolutionNameMin: Cijk_Ailk_Bljk_HB_MT128x128x16_EPS1_GRVW08_LPB00_PGR1_SNLL1_TT08_08_USFGRO0_VW08_WG16_16_01
    SolutionIndex: 16
    SolutionNameMin: Cijk_Ailk_Bljk_HB_MT064x008x16_EPS1_GRVW02_LPB00_PGR1_SNLL1_TT02_02_USFGRO01_VW02_WG32_04_01
    SolutionIndex: 17
    SolutionNameMin: Cijk_Ailk_Bljk_HB_MT128x016x16_EPS1_GRVW04_LPB00_PGR1_SNLL1_TT04_04_USFGRO0_VW04_WG32_04_01
    SolutionIndex: 18
    SolutionNameMin: Cijk_Ailk_Bljk_HB_MT064x016x16_EPS1_GRVW02_LPB00_PGR1_SNLL1_TT02_02_USFGRO01_VW02_WG32_08_01
    SolutionIndex: 19
    SolutionNameMin: Cijk_Ailk_Bljk_HB_MT128x032x16_EPS1_GRVW04_LPB00_PGR1_SNLL1_TT04_04_USFGRO0_VW04_WG32_08_01
    SolutionIndex: 20
    SolutionNameMin: Cijk_Ailk_Bljk_HB_MT016x016x32_EPS1_GRVW02_LPB00_PGR1_SNLL1_TT02_02_USFGRO01_VW02_WG08_08_01
    SolutionIndex: 21
    SolutionNameMin: Cijk_Ailk_Bljk_HB_MT032x008x32_EPS1_GRVW02_LPB00_PGR1_SNLL1_TT02_02_USFGRO01_VW02_WG16_04_01
    SolutionIndex: 22
    SolutionNameMin: Cijk_Ailk_Bljk_HB_MT032x016x32_EPS1_GRVW02_LPB00_PGR1_SNLL1_TT02_02_USFGRO01_VW02_WG16_08_01
    SolutionIndex: 23
    SolutionNameMin: Cijk_Ailk_Bljk_HB_MT064x008x32_EPS1_GRVW02_LPB00_PGR1_SNLL1_TT02_02_USFGRO01_VW02_WG32_04_01
    SolutionIndex: 24
    SolutionNameMin: Cijk_Ailk_Bljk_HB_MT064x016x32_EPS1_GRVW02_LPB00_PGR1_SNLL1_TT02_02_USFGRO01_VW02_WG32_08_01
    SolutionIndex: 25
    SolutionNameMin: Cijk_Ailk_Bljk_HB_MT032x008x64_EPS1_GRVW02_LPB00_PGR1_SNLL1_TT02_02_USFGRO01_VW02_WG16_04_01
    SolutionIndex: 26
    SolutionNameMin: Cijk_Ailk_Bljk_HB_MT064x008x64_EPS1_GRVW02_LPB00_PGR1_SNLL1_TT02_02_USFGRO01_VW02_WG32_04_01
    SolutionIndex: 27
    SolutionNameMin: Cijk_Ailk_Bljk_HB_MT032x032x08_EPS1_GRVW04_LPB00_PGR1_SNLL1_TT04_04_USFGRO0_VW04_WG08_08_01
    SolutionIndex: 28
    SolutionNameMin: Cijk_Ailk_Bljk_HB_MT064x032x08_EPS1_GRVW04_LPB00_PGR1_SNLL1_TT08_04_USFGRO0_VW04_WG08_08_01
    SolutionIndex: 29
    SolutionNameMin: Cijk_Ailk_Bljk_HB_MT064x016x08_EPS1_GRVW02_LPB00_PGR1_SNLL1_TT04_02_USFGRO01_VW02_WG16_08_01
    SolutionIndex: 30
    SolutionNameMin: Cijk_Ailk_Bljk_HB_MT064x032x08_EPS1_GRVW04_LPB00_PGR1_SNLL1_TT04_04_USFGRO0_VW04_WG16_08_01
    SolutionIndex: 31
    SolutionNameMin: Cijk_Ailk_Bljk_HB_MT128x032x08_EPS1_GRVW04_LPB00_PGR1_SNLL1_TT04_04_USFGRO0_VW04_WG32_08_01
    SolutionIndex: 32
    SolutionNameMin: Cijk_Ailk_Bljk_HB_MT128x016x08_EPS1_GRVW04_LPB00_PGR1_SNLL1_TT04_04_USFGRO0_VW04_WG32_04_01
    SolutionIndex: 33
    SolutionNameMin: Cijk_Ailk_Bljk_HB_MT032x032x16_EPS1_GRVW04_LPB00_PGR1_SNLL1_TT04_04_USFGRO0_VW04_WG08_08_01
    SolutionIndex: 34
    SolutionNameMin: Cijk_Ailk_Bljk_HB_MT064x032x16_EPS1_GRVW04_LPB00_PGR1_SNLL1_TT08_04_USFGRO0_VW04_WG08_08_01
    SolutionIndex: 35
    SolutionNameMin: Cijk_Ailk_Bljk_HB_MT064x064x16_EPS1_GRVW08_LPB00_PGR1_SNLL1_TT08_08_USFGRO0_VW08_WG08_08_01
    SolutionIndex: 36
    SolutionNameMin: Cijk_Ailk_Bljk_HB_MT032x016x16_EPS1_GRVW02_LPB00_PGR1_SNLL1_TT02_02_USFGRO01_VW02_WG16_08_01
    SolutionIndex: 37
    SolutionNameMin: Cijk_Ailk_Bljk_HB_MT064x016x16_EPS1_GRVW02_LPB00_PGR1_SNLL1_TT04_02_USFGRO01_VW02_WG16_08_01
    SolutionIndex: 38
    SolutionNameMin: Cijk_Ailk_Bljk_HB_MT064x032x16_EPS1_GRVW04_LPB00_PGR1_SNLL1_TT04_04_USFGRO0_VW04_WG16_08_01
    SolutionIndex: 39
    SolutionNameMin: Cijk_Ailk_Bljk_HB_MT128x032x16_EPS1_GRVW04_LPB00_PGR1_SNLL1_TT04_04_USFGRO0_VW04_WG32_08_01
    SolutionIndex: 40
    SolutionNameMin: Cijk_Ailk_Bljk_HB_MT064x016x16_EPS1_GRVW04_LPB00_PGR1_SNLL1_TT04_04_USFGRO0_VW04_WG16_04_01
    SolutionIndex: 41
    SolutionNameMin: Cijk_Ailk_Bljk_HB_MT128x016x16_EPS1_GRVW04_LPB00_PGR1_SNLL1_TT04_04_USFGRO0_VW04_WG32_04_01
    SolutionIndex: 42
    SolutionNameMin: Cijk_Ailk_Bljk_HB_MT016x016x24_EPS1_GRVW02_LPB00_PGR1_SNLL1_TT02_02_USFGRO01_VW02_WG08_08_01
    SolutionIndex: 43
    SolutionNameMin: Cijk_Ailk_Bljk_HB_MT032x016x24_EPS1_GRVW02_LPB00_PGR1_SNLL1_TT04_02_USFGRO01_VW02_WG08_08_01
    SolutionIndex: 44
    SolutionNameMin: Cijk_Ailk_Bljk_HB_MT032x032x24_EPS1_GRVW04_LPB00_PGR1_SNLL1_TT04_04_USFGRO0_VW04_WG08_08_01
    SolutionIndex: 45
    SolutionNameMin: Cijk_Ailk_Bljk_HB_MT016x016x24_EPS1_GRVW02_LPB00_PGR1_SNLL1_TT02_02_USFGRO01_VW02_WG08_08_01
    SolutionIndex: 46
    SolutionNameMin: Cijk_Ailk_Bljk_HB_MT032x016x24_EPS1_GRVW02_LPB00_PGR1_SNLL1_TT04_02_USFGRO01_VW02_WG08_08_01
    SolutionIndex: 47
    SolutionNameMin: Cijk_Ailk_Bljk_HB_MT032x032x24_EPS1_GRVW04_LPB00_PGR1_SNLL1_TT04_04_USFGRO0_VW04_WG08_08_01
    SolutionIndex: 48
    SolutionNameMin: Cijk_Ailk_Bljk_HB_MT064x016x32_EPS1_GRVW02_LPB00_PGR1_SNLL1_TT02_02_USFGRO01_VW02_WG32_08_01
    SolutionIndex: 49
    SolutionNameMin: Cijk_Ailk_Bljk_HB_MT032x008x32_EPS1_GRVW02_LPB00_PGR1_SNLL1_TT02_02_USFGRO01_VW02_WG16_04_01
    SolutionIndex: 50
    SolutionNameMin: Cijk_Ailk_Bljk_HB_MT064x008x32_EPS1_GRVW02_LPB00_PGR1_SNLL1_TT02_02_USFGRO01_VW02_WG32_04_01
    SolutionIndex: 51
    SolutionNameMin: Cijk_Ailk_Bljk_HB_MT032x008x64_EPS1_GRVW02_LPB00_PGR1_SNLL1_TT02_02_USFGRO01_VW02_WG16_04_01
    SolutionIndex: 52
    SolutionNameMin: Cijk_Ailk_Bljk_HB_MT064x064x08_EPS1_GRVW04_LPB00_PGR1_SNLL1_TT04_04_USFGRO01_VW04_WG16_16_01
    SolutionIndex: 53
    SolutionNameMin: Cijk_Ailk_Bljk_HB_MT128x064x08_EPS0_GRVW04_LPB00_PGR0_SNLL0_TT08_04_USFGRO0_VW04_WG16_16_01
    SolutionIndex: 54
    SolutionNameMin: Cijk_Ailk_Bljk_HB_MT128x064x08_EPS1_GRVW04_LPB00_PGR1_SNLL1_TT08_04_USFGRO0_VW04_WG16_16_01
    SolutionIndex: 55
    SolutionNameMin: Cijk_Ailk_Bljk_HB_MT064x064x16_EPS0_GRVW08_LPB00_PGR0_SNLL0_TT08_08_USFGRO0_VW08_WG08_08_01
    SolutionIndex: 56
    SolutionNameMin: Cijk_Ailk_Bljk_HB_MT064x064x16_EPS1_GRVW04_LPB00_PGR1_SNLL1_TT04_04_USFGRO0_VW04_WG16_16_01
    SolutionIndex: 57
    SolutionNameMin: Cijk_Ailk_Bljk_HB_MT064x128x16_EPS0_GRVW04_LPB00_PGR0_SNLL0_TT04_08_USFGRO0_VW04_WG16_16_01
    SolutionIndex: 58
    SolutionNameMin: Cijk_Ailk_Bljk_HB_MT064x128x16_EPS1_GRVW04_LPB00_PGR1_SNLL1_TT04_08_USFGRO0_VW04_WG16_16_01
    SolutionIndex: 59
    SolutionNameMin: Cijk_Ailk_Bljk_HB_MT128x064x16_EPS0_GRVW04_LPB00_PGR0_SNLL0_TT08_04_USFGRO0_VW04_WG16_16_01
    SolutionIndex: 60
    SolutionNameMin: Cijk_Ailk_Bljk_HB_MT128x064x16_EPS1_GRVW04_LPB00_PGR1_SNLL1_TT08_04_USFGRO0_VW04_WG16_16_01
    SolutionIndex: 61
    SolutionNameMin: Cijk_Ailk_Bljk_HB_MT128x128x16_EPS0_GRVW08_LPB00_PGR0_SNLL0_TT08_08_USFGRO0_VW08_WG16_16_01
    SolutionIndex: 62
    SolutionNameMin: Cijk_Ailk_Bljk_HB_MT128x128x16_EPS1_GRVW08_LPB00_PGR1_SNLL1_TT08_08_USFGRO0_VW08_WG16_16_01
    SolutionIndex: 63
    SolutionNameMin: Cijk_Ailk_Bljk_HB_MT128x064x32_EPS0_GRVW04_LPB00_PGR0_SNLL0_TT08_04_USFGRO0_VW04_WG16_16_01
    SolutionIndex: 64
    SolutionNameMin: Cijk_Ailk_Bljk_HB_MT128x064x32_EPS1_GRVW04_LPB00_PGR1_SNLL1_TT08_04_USFGRO0_VW04_WG16_16_01
    SolutionIndex: 65
    SolutionNameMin: Cijk_Ailk_Bljk_HB_MT128x128x32_EPS0_GRVW08_LPB00_PGR0_SNLL0_TT08_08_USFGRO0_VW08_WG16_16_01
    SolutionIndex: 66
    SolutionNameMin: Cijk_Ailk_Bljk_HB_MT128x128x32_EPS1_GRVW08_LPB00_PGR1_SNLL1_TT08_08_USFGRO0_VW08_WG16_16_01
    SolutionIndex: 67
    SolutionNameMin: Cijk_Ailk_Bljk_HB_MT256x032x08_EPS1_GRVW02_LPB00_PGR1_SNLL1_TT08_04_USFGRO01_VW02_WG32_08_01
    SolutionIndex: 68
    SolutionNameMin: Cijk_Ailk_Bljk_HB_MT064x032x16_EPS1_GRVW02_LPB02_PGR1_SNLL1_TT04_04_USFGRO01_VW02_WG16_08_01
    SolutionIndex: 69
    SolutionNameMin: Cijk_Ailk_Bljk_HB_MT064x064x16_EPS1_GRVW02_LPB02_PGR1_SNLL1_TT04_04_USFGRO01_VW02_WG16_16_01
    SolutionIndex: 70
    SolutionNameMin: Cijk_Ailk_Bljk_HB_MT128x064x32_EPS1_GRVW02_LPB04_PGR1_SNLL1_TT04_04_USFGRO01_VW02_WG32_16_01
    SolutionIndex: 71
    SolutionNameMin: Cijk_Ailk_Bljk_HB_MT128x064x16_EPS1_GRVW04_LPB04_PGR1_SNLL1_TT04_08_USFGRO0_VW04_WG32_08_01
    SolutionIndex: 72
    SolutionNameMin: Cijk_Ailk_Bljk_HB_MT256x064x16_EPS1_GRVW04_LPB04_PGR1_SNLL1_TT08_04_USFGRO0_VW04_WG32_16_01
    SolutionIndex: 73
    SolutionNameMin: Cijk_Ailk_Bljk_HB_MT256x032x16_EPS0_GRVW02_LPB04_PGR0_SNLL0_TT08_04_USFGRO01_VW02_WG32_08_01
    SolutionIndex: 74
    SolutionNameMin: Cijk_Ailk_Bljk_HB_MT064x064x16_EPS0_GRVW04_LPB04_PGR0_SNLL0_TT04_08_USFGRO0_VW04_WG16_08_01
    SolutionIndex: 75
    SolutionNameMin: Cijk_Ailk_Bljk_HB_MT128x064x16_EPS0_GRVW04_LPB04_PGR0_SNLL0_TT08_04_USFGRO0_VW04_WG16_16_01
    SolutionIndex: 76
    SolutionNameMin: Cijk_Ailk_Bljk_HB_MT128x064x16_EPS0_GRVW04_LPB04_PGR0_SNLL0_TT04_08_USFGRO0_VW04_WG32_08_01
    SolutionIndex: 77
    SolutionNameMin: Cijk_Ailk_Bljk_HB_MT256x032x16_EPS0_GRVW04_LPB04_PGR0_SNLL0_TT08_04_USFGRO0_VW04_WG32_08_01
    SolutionIndex: 0
    SolutionNameMin: Cijk_Ailk_Bljk_HB_MT256x064x08_GSU01_LPB00_NLCB01_PGR0_PLR0_TT08_08_WG32_08_01_WGM01
    SolutionIndex: 1
    SolutionNameMin: Cijk_Ailk_Bljk_HB_MT128x128x16_GSU01_LPB00_NLCB01_PGR1_PLR1_TT08_08_WG16_16_01_WGM01
    SolutionIndex: 2
    SolutionNameMin: Cijk_Ailk_Bljk_HB_MT256x064x16_GSU01_LPB00_NLCB01_PGR1_PLR1_TT08_08_WG32_08_01_WGM01
    SolutionIndex: 3
    SolutionNameMin: Cijk_Ailk_Bljk_HB_MT128x128x16_GSU01_LPB00_NLCB01_PGR1_PLR1_TT08_08_WG16_16_01_WGM64
    SolutionIndex: 4
    SolutionNameMin: Cijk_Ailk_Bljk_HB_MT128x064x32_GSU01_LPB00_NLCB01_PGR1_PLR1_TT08_08_WG16_08_02_WGM08
    SolutionIndex: 5
    SolutionNameMin: Cijk_Ailk_Bljk_HB_MT256x064x16_GSU01_LPB08_NLCB01_PGR1_PLR1_TT08_08_WG32_08_01_WGM01
    SolutionIndex: 6
    SolutionNameMin: Cijk_Ailk_Bljk_HB_MT128x032x32_GSU01_LPB08_NLCB01_PGR1_PLR1_TT08_08_WG16_04_04_WGM08
- - - [1024, 1024, 1, 3328]
    - [60, 17683.5]
  - - [2944, 4288, 1, 1280]
    - [54, 21171.9]
  - - [2368, 64, 1, 3328]
    - [36, 5946.47]
  - - [1760, 32, 1, 1760]
    - [49, 2787.77]
  - - [2368, 5888, 1, 256]
    - [54, 19635.2]
  - - [256, 704, 1, 1280]
    - [47, 6011.93]
  - - [512, 24000, 1, 1536]
    - [62, 20948.5]
  - - [128, 6784, 1, 3328]
    - [60, 14481.1]
  - - [5888, 1856, 1, 3328]
    - [54, 20827.4]
  - - [512, 4, 1, 512]
    - [21, 100.395]
  - - [5888, 2944, 1, 3328]
    - [62, 19841.3]
  - - [1856, 4288, 1, 256]
    - [62, 18968.2]
  - - [5056, 5056, 1, 3328]
    - [62, 18674.5]
  - - [1408, 5888, 1, 1280]
    - [54, 22072.8]
  - - [6144, 6000, 1, 2560]
    - [62, 18828.6]
  - - [1024, 3584, 1, 3328]
    - [60, 20235.8]
  - - [512, 48000, 1, 2048]
    - [65, 17166.2]
  - - [448, 3584, 1, 3328]
    - [60, 15302.4]
  - - [256, 4288, 1, 3328]
    - [56, 13745.1]
  - - [5888, 1408, 1, 1280]
    - [54, 22219.9]
  - - [704, 1856, 1, 3328]
    - [56, 16319.8]
  - - [1024, 2368, 1, 256]
    - [54, 15236.3]
  - - [5056, 6784, 1, 1280]
    - [54, 20279.3]
  - - [1408, 64, 1, 1280]
    - [42, 3992.5]
  - - [448, 1024, 1, 1280]
    - [56, 10948.8]
  - - [4096, 32, 1, 4096]
    - [46, 5635.73]
  - - [5056, 5056, 1, 1280]
    - [62, 20294.8]
  - - [4288, 6784, 1, 256]
    - [54, 21504.0]
  - - [6784, 448, 1, 256]
    - [60, 16334.8]
  - - [5056, 256, 1, 1280]
    - [56, 15574.8]
  - - [5888, 704, 1, 1280]
    - [60, 20635.5]
  - - [3584, 1024, 1, 256]
    - [54, 16239.7]
  - - [6784, 4288, 1, 3328]
    - [62, 18606.5]
  - - [1856, 2368, 1, 3328]
    - [60, 19578.9]
  - - [5888, 2944, 1, 1280]
    - [54, 20780.3]
  - - [5888, 1024, 1, 256]
    - [54, 18754.8]
  - - [448, 64, 1, 1280]
    - [42, 1567.85]
  - - [3072, 64, 1, 1024]
    - [37, 6425.08]
  - - [2560, 16, 1, 2560]
    - [21, 2144.74]
  - - [1024, 704, 1, 256]
    - [56, 10168.8]
  - - [1408, 2944, 1, 256]
    - [62, 17641.9]
  - - [256, 1856, 1, 1280]
    - [56, 11170.2]
  - - [6784, 5056, 1, 3328]
    - [62, 18348.5]
  - - [5056, 5056, 1, 256]
    - [54, 21463.4]
  - - [256, 2944, 1, 3328]
    - [56, 13871.2]
  - - [64, 1024, 1, 1280]
    - [42, 3217.11]
  - - [1024, 3584, 1, 1280]
    - [60, 20325.6]
  - - [2368, 2944, 1, 1280]
    - [54, 21111.5]
  - - [128, 3584, 1, 1280]
    - [10, 10844.0]
  - - [6784, 6784, 1, 1280]
    - [62, 19643.0]
  - - [1024, 256, 1, 3328]
    - [47, 9444.48]
  - - [1408, 4288, 1, 1280]
    - [54, 21046.0]
  - - [3584, 4288, 1, 1280]
    - [62, 21537.2]
  - - [512, 6000, 1, 2560]
    - [60, 20152.8]
  - - [2368, 704, 1, 1280]
    - [54, 15273.7]
  - - [5056, 4288, 1, 3328]
    - [54, 18500.5]
  - - [3584, 2368, 1, 3328]
    - [60, 19537.2]
  - - [5888, 6784, 1, 1280]
    - [54, 20567.8]
  - - [64, 704, 1, 1280]
    - [42, 2337.96]
  - - [4288, 256, 1, 256]
    - [56, 11028.1]
  - - [6144, 32, 1, 2560]
    - [46, 7070.29]
  - - [6784, 448, 1, 1280]
    - [54, 19000.1]
  - - [2944, 5888, 1, 256]
    - [54, 21182.9]
  - - [256, 128, 1, 256]
    - [9, 1167.44]
  - - [4288, 2944, 1, 256]
    - [59, 19598.7]
  - - [1760, 16, 1, 1760]
    - [21, 1454.49]
  - - [6144, 24000, 1, 2560]
    - [62, 18047.6]
  - - [5888, 64, 1, 3328]
    - [38, 10476.4]
  - - [2944, 256, 1, 3328]
    - [56, 14632.5]
  - - [5056, 2368, 1, 1280]
    - [62, 20702.5]
  - - [448, 3584, 1, 1280]
    - [35, 14005.3]
  - - [6784, 5888, 1, 256]
    - [62, 22125.8]
  - - [64, 1024, 1, 3328]
    - [49, 3484.39]
  - - [704, 128, 1, 1280]
    - [11, 3972.15]
  - - [1408, 448, 1, 1280]
    - [56, 11558.4]
  - - [1024, 1408, 1, 256]
    - [54, 12710.9]
  - - [2368, 2368, 1, 3328]
    - [54, 20731.0]
  - - [5056, 704, 1, 3328]
    - [54, 19879.7]
  - - [1408, 1856, 1, 256]
    - [54, 16098.2]
  - - [1408, 256, 1, 1280]
    - [56, 8674.55]
  - - [3072, 128, 1, 1024]
    - [41, 9291.75]
  - - [5888, 1856, 1, 256]
    - [54, 20773.6]
  - - [704, 5888, 1, 256]
    - [57, 15864.1]
  - - [6784, 64, 1, 256]
    - [39, 7428.01]
  - - [128, 1, 1, 1408]
    - [25, 7.19802]
  - - [3584, 704, 1, 3328]
    - [54, 18978.1]
  - - [1408, 1408, 1, 256]
    - [54, 14958.9]
  - - [1024, 64, 1, 1280]
    - [42, 3311.21]
  - - [8448, 4, 1, 2816]
    - [23, 1425.75]
  - - [448, 4288, 1, 256]
    - [58, 12941.3]
  - - [64, 3584, 1, 3328]
    - [44, 8250.7]
  - - [704, 2368, 1, 1280]
    - [54, 15289.9]
  - - [7680, 16, 1, 2560]
    - [24, 5308.26]
  - - [1856, 2368, 1, 1280]
    - [60, 19558.0]
  - - [2368, 128, 1, 3328]
    - [38, 8484.42]
  - - [1408, 1408, 1, 3328]
    - [60, 18974.3]
  - - [2944, 128, 1, 256]
    - [31, 7039.48]
  - - [448, 1408, 1, 256]
    - [56, 8719.73]
  - - [64, 5056, 1, 3328]
    - [13, 8853.54]
  - - [512, 1500, 1, 2816]
    - [56, 14782.5]
  - - [256, 193600, 1, 64]
    - [67, 17182.9]
  - - [1408, 1024, 1, 1280]
    - [60, 16368.9]
  - - [704, 6784, 1, 256]
    - [54, 16554.8]
  - - [6784, 704, 1, 256]
    - [60, 17015.5]
  - - [2048, 7000, 1, 2048]
    - [65, 18702.8]
  - - [256, 3584, 1, 3328]
    - [60, 15409.5]
  - - [5056, 704, 1, 256]
    - [54, 17180.0]
  - - [1408, 3584, 1, 256]
    - [54, 17868.2]
  - - [3584, 4288, 1, 3328]
    - [62, 19931.9]
  - - [5888, 1856, 1, 1280]
    - [54, 21429.0]
  - - [256, 1408, 1, 256]
    - [52, 6420.9]
  - - [5056, 64, 1, 1280]
    - [38, 8246.89]
  - - [2368, 128, 1, 256]
    - [29, 5852.0]
  - - [2368, 3584, 1, 1280]
    - [54, 20436.1]
  - - [1024, 256, 1, 256]
    - [27, 5557.9]
  - - [448, 448, 1, 256]
    - [29, 4533.28]
  - - [2944, 3584, 1, 3328]
    - [54, 19770.4]
  - - [7680, 32, 1, 2560]
    - [44, 8467.81]
  - - [256, 256, 1, 3328]
    - [49, 3509.31]
  - - [128, 1024, 1, 3328]
    - [24, 6108.54]
  - - [6784, 2944, 1, 256]
    - [62, 20865.0]
  - - [64, 1856, 1, 1280]
    - [24, 4886.97]
  - - [448, 256, 1, 256]
    - [18, 3476.83]
  - - [1024, 1500, 1, 2560]
    - [60, 18160.3]
  - - [1856, 2368, 1, 256]
    - [54, 17478.3]
  - - [3584, 6784, 1, 3328]
    - [62, 18798.1]
  - - [256, 1024, 1, 256]
    - [52, 5424.69]
  - - [1024, 128, 1, 1280]
    - [48, 5431.28]
  - - [3072, 32, 1, 1024]
    - [36, 3961.8]
  - - [4288, 128, 1, 1280]
    - [38, 10468.1]
  - - [5056, 4288, 1, 1280]
    - [54, 20617.5]
  - - [5888, 64, 1, 256]
    - [5, 6890.64]
  - - [6784, 1856, 1, 3328]
    - [54, 19610.2]
  - - [1408, 5056, 1, 1280]
    - [62, 21494.0]
  - - [1856, 256, 1, 1280]
    - [56, 11387.1]
  - - [64, 5888, 1, 3328]
    - [14, 9405.43]
  - - [196, 1024, 64, 256]
    - [76, 15532.3]
  - - [6784, 5888, 1, 3328]
    - [62, 18601.3]
  - - [4608, 1, 1, 1536]
    - [23, 221.181]
  - - [448, 256, 1, 3328]
    - [24, 5367.26]
  - - [2368, 5056, 1, 1280]
    - [54, 20831.8]
  - - [7680, 4, 1, 2560]
    - [23, 1396.91]
  - - [1024, 704, 1, 1280]
    - [52, 13016.4]
  - - [256, 1408, 1, 3328]
    - [47, 9508.93]
  - - [6784, 128, 1, 3328]
    - [60, 14600.3]
  - - [1024, 5056, 1, 1280]
    - [62, 21204.5]
  - - [4288, 1024, 1, 256]
    - [54, 16404.9]
  - - [2368, 1408, 1, 256]
    - [59, 15719.6]
  - - [704, 704, 1, 3328]
    - [47, 12453.2]
  - - [5888, 448, 1, 1280]
    - [54, 17226.1]
  - - [3584, 256, 1, 3328]
    - [54, 15176.9]
  - - [704, 5888, 1, 3328]
    - [58, 19028.1]
  - - [1024, 6784, 1, 1280]
    - [54, 20232.2]
  - - [128, 3584, 1, 3328]
    - [13, 11913.5]
  - - [128, 704, 1, 1280]
    - [11, 3992.5]
  - - [3584, 2944, 1, 1280]
    - [54, 20494.7]
  - - [1856, 128, 1, 3328]
    - [44, 8614.32]
  - - [512, 6000, 1, 2816]
    - [62, 19402.2]
  - - [128, 2944, 1, 1280]
    - [13, 9478.19]
  - - [512, 24000, 1, 2048]
    - [63, 15872.9]
  - - [448, 1856, 1, 1280]
    - [60, 12794.0]
  - - [1408, 5056, 1, 3328]
    - [62, 20832.9]
  - - [1856, 1856, 1, 3328]
    - [60, 18977.4]
  - - [3584, 128, 1, 256]
    - [31, 8257.37]
  - - [448, 1408, 1, 3328]
    - [56, 12209.8]
  - - [2368, 2368, 1, 256]
    - [54, 17601.0]
  - - [4288, 4288, 1, 1280]
    - [60, 20704.9]
  - - [64, 448, 1, 1280]
    - [42, 1562.91]
  - - [5888, 1024, 1, 1280]
    - [62, 21111.1]
  - - [704, 1024, 1, 256]
    - [56, 10045.7]
  - - [1024, 12544, 1, 256]
    - [6, 20316.4]
  - - [512, 48000, 1, 2560]
    - [60, 19203.7]
  - - [8448, 16, 1, 2816]
    - [16, 4833.87]
  - - [704, 6784, 1, 3328]
    - [62, 18583.6]
  - - [5888, 5888, 1, 3328]
    - [62, 18675.5]
  - - [5056, 1024, 1, 1280]
    - [54, 21407.4]
  - - [448, 5888, 1, 3328]
    - [54, 17113.2]
  - - [3072, 2, 1, 1024]
    - [23, 283.106]
  - - [1024, 2944, 1, 1280]
    - [60, 19336.2]
  - - [5056, 5888, 1, 1280]
    - [62, 20740.5]
  - - [448, 6784, 1, 256]
    - [58, 14898.3]
  - - [256, 3584, 1, 256]
    - [56, 10396.0]
  - - [256, 448, 1, 256]
    - [18, 3416.75]
  - - [6144, 16, 1, 2560]
    - [22, 4481.93]
  - - [3584, 5888, 1, 256]
    - [54, 21035.0]
  - - [2944, 3584, 1, 256]
    - [54, 20190.5]
  - - [512, 32, 1, 512]
    - [23, 797.51]
  - - [3072, 1500, 1, 1024]
    - [60, 19054.4]
  - - [1408, 704, 1, 256]
    - [56, 11573.0]
  - - [6784, 1024, 1, 3328]
    - [60, 19708.1]
  - - [6784, 2944, 1, 3328]
    - [54, 19117.1]
  - - [7680, 1, 1, 2560]
    - [26, 348.312]
  - - [64, 64, 1, 3328]
    - [51, 242.45]
  - - [512, 1, 1, 512]
    - [21, 25.0988]
  - - [6784, 2368, 1, 1280]
    - [59, 20630.7]
  - - [512, 2, 1, 512]
    - [11, 49.8444]
  - - [4288, 3584, 1, 256]
    - [60, 20225.0]
  - - [4288, 5888, 1, 1280]
    - [54, 20554.4]
  - - [4608, 4, 1, 1536]
    - [21, 880.636]
  - - [1024, 6000, 1, 1536]
    - [60, 20933.0]
  - - [8448, 32, 1, 2816]
    - [37, 7479.45]
  - - [448, 2944, 1, 3328]
    - [60, 15784.3]
  - - [4288, 1856, 1, 1280]
    - [61, 20187.8]
  - - [1856, 2944, 1, 3328]
    - [54, 20052.4]
  - - [256, 6784, 1, 3328]
    - [54, 16520.1]
  - - [512, 3000, 1, 1536]
    - [60, 15774.9]
  - - [64, 5888, 1, 256]
    - [13, 6544.26]
  - - [5056, 1024, 1, 256]
    - [62, 18091.4]
  - - [704, 64, 1, 3328]
    - [42, 2412.65]
  - - [5056, 1856, 1, 3328]
    - [54, 19880.6]
  - - [512, 1500, 1, 2048]
    - [64, 10664.5]
  - - [1024, 1, 1, 500000]
    - [25, 63.4424]
  - - [448, 448, 1, 3328]
    - [10, 7271.75]
  - - [448, 2368, 1, 1280]
    - [56, 12685.9]
  - - [1408, 128, 1, 1280]
    - [37, 6240.85]
  - - [4096, 7000, 1, 4096]
    - [65, 17104.7]
  - - [5056, 256, 1, 3328]
    - [56, 16270.3]
  - - [704, 704, 1, 256]
    - [56, 8274.27]
  - - [1024, 5888, 1, 1280]
    - [62, 21017.4]
  - - [64, 128, 1, 256]
    - [23, 345.239]
  - - [128, 1856, 1, 1280]
    - [40, 7616.08]
  - - [5056, 3584, 1, 256]
    - [54, 20756.8]
  - - [1856, 1024, 1, 1280]
    - [54, 17311.8]
  - - [64, 193600, 1, 64]
    - [14, 10662.3]
  - - [1856, 1856, 1, 1280]
    - [54, 19515.8]
  - - [3072, 24000, 1, 1024]
    - [62, 18977.1]
  - - [128, 4288, 1, 3328]
    - [17, 11389.7]
  - - [1856, 1024, 1, 3328]
    - [54, 17991.0]
  - - [256, 2368, 1, 256]
    - [56, 8656.97]
  - - [1024, 448, 1, 3328]
    - [47, 11975.7]
  - - [1856, 704, 1, 1280]
    - [56, 15755.6]
  - - [6784, 1024, 1, 256]
    - [62, 18741.1]
  - - [5056, 5888, 1, 3328]
    - [62, 19006.8]
  - - [1856, 1024, 1, 256]
    - [54, 14595.7]
  - - [512, 48000, 1, 1536]
    - [62, 20633.8]
  - - [5056, 1408, 1, 3328]
    - [62, 19856.3]
  - - [1024, 1024, 1, 1280]
    - [60, 16382.3]
  - - [448, 5888, 1, 256]
    - [54, 13917.6]
  - - [2048, 128, 1, 2048]
    - [40, 8732.02]
  - - [1408, 6784, 1, 3328]
    - [54, 19476.0]
  - - [1024, 24000, 1, 2560]
    - [62, 19811.1]
  - - [2944, 1408, 1, 3328]
    - [62, 19851.6]
  - - [2944, 4288, 1, 3328]
    - [54, 19923.0]
  - - [256, 2944, 1, 256]
    - [56, 10295.0]
  - - [5056, 2944, 1, 256]
    - [60, 20252.2]
  - - [1024, 700, 1, 512]
    - [56, 11158.5]
  - - [3072, 1, 1, 128]
    - [0, 73.7257]
  - - [2368, 1856, 1, 256]
    - [54, 17458.2]
  - - [128, 6784, 1, 1280]
    - [60, 12979.9]
  - - [1408, 3584, 1, 3328]
    - [60, 19883.5]
  - - [2368, 6784, 1, 256]
    - [55, 19984.6]
  - - [4288, 2368, 1, 3328]
    - [54, 20414.6]
  - - [704, 3584, 1, 1280]
    - [58, 17523.5]
  - - [1408, 5888, 1, 3328]
    - [54, 20519.8]
  - - [1856, 5056, 1, 256]
    - [54, 19477.4]
  - - [6784, 6784, 1, 256]
    - [61, 21701.4]
  - - [1408, 704, 1, 3328]
    - [60, 16785.8]
  - - [128, 5888, 1, 1280]
    - [56, 13221.3]
  - - [2368, 4288, 1, 1280]
    - [54, 21012.6]
  - - [3584, 1856, 1, 1280]
    - [59, 20179.3]
  - - [704, 1408, 1, 3328]
    - [34, 16042.1]
  - - [704, 64, 1, 1280]
    - [42, 2337.96]
  - - [8448, 48000, 1, 2816]
    - [62, 17775.7]
  - - [512, 6000, 1, 2048]
    - [63, 15077.6]
  - - [3584, 448, 1, 256]
    - [60, 12276.3]
  - - [3584, 3584, 1, 1280]
    - [54, 21418.1]
  - - [7680, 64, 1, 2560]
    - [38, 12601.2]
  - - [256, 6784, 1, 256]
    - [56, 12797.1]
  - - [1856, 3584, 1, 3328]
    - [62, 19285.5]
  - - [128, 448, 1, 256]
    - [7, 1942.96]
  - - [2048, 32, 1, 2048]
    - [24, 3218.26]
  - - [3584, 3584, 1, 256]
    - [54, 20840.9]
  - - [6784, 4288, 1, 1280]
    - [54, 20625.2]
  - - [448, 704, 1, 1280]
    - [56, 7665.03]
  - - [3584, 5056, 1, 256]
    - [54, 21300.4]
  - - [6784, 128, 1, 256]
    - [5, 10873.0]
  - - [64, 1408, 1, 3328]
    - [42, 4316.03]
  - - [704, 448, 1, 256]
    - [52, 5676.95]
  - - [2944, 2368, 1, 1280]
    - [54, 21238.0]
  - - [448, 64, 1, 3328]
    - [42, 1622.34]
  - - [6784, 3584, 1, 256]
    - [62, 21512.0]
  - - [256, 1856, 1, 3328]
    - [56, 12232.8]
  - - [256, 704, 1, 256]
    - [52, 3967.1]
  - - [128, 1408, 1, 256]
    - [18, 4513.31]
  - - [64, 128, 1, 3328]
    - [51, 481.729]
  - - [1856, 1408, 1, 256]
    - [58, 15203.8]
  - - [2944, 2944, 1, 3328]
    - [60, 20152.4]
  - - [5056, 6784, 1, 256]
    - [61, 20854.4]
  - - [1408, 4288, 1, 3328]
    - [62, 19529.5]
  - - [6784, 256, 1, 1280]
    - [60, 15945.5]
  - - [1024, 704, 1, 3328]
    - [56, 13984.2]
  - - [2368, 704, 1, 3328]
    - [60, 15959.1]
  - - [128, 4288, 1, 256]
    - [32, 8176.03]
  - - [3584, 6784, 1, 256]
    - [54, 21661.8]
  - - [128, 128, 1, 3328]
    - [21, 940.078]
  - - [5056, 1856, 1, 256]
    - [54, 19571.4]
  - - [1024, 3000, 1, 2816]
    - [54, 20402.1]
  - - [64, 1, 1, 1216]
    - [42, 3.11751]
  - - [704, 4288, 1, 256]
    - [58, 14797.8]
  - - [256, 448, 1, 3328]
    - [24, 5400.98]
  - - [1408, 6784, 1, 1280]
    - [60, 21055.2]
  - - [7680, 24000, 1, 2560]
    - [62, 17905.5]
  - - [64, 2368, 1, 1280]
    - [36, 5388.37]
  - - [4608, 48000, 1, 1536]
    - [62, 18137.7]
  - - [64, 6784, 1, 3328]
    - [13, 11008.0]
  - - [2944, 256, 1, 1280]
    - [56, 13722.8]
  - - [2048, 16, 1, 2048]
    - [21, 1693.34]
  - - [1024, 24000, 1, 1536]
    - [62, 20553.1]
  - - [5056, 2368, 1, 3328]
    - [62, 20042.8]
  - - [2944, 4288, 1, 256]
    - [54, 20617.6]
  - - [1408, 3584, 1, 1280]
    - [54, 20830.6]
  - - [2368, 64, 1, 256]
    - [2, 3967.82]
  - - [256, 256, 1, 256]
    - [23, 2264.9]
  - - [704, 128, 1, 3328]
    - [36, 4357.83]
  - - [1856, 704, 1, 256]
    - [56, 12828.2]
  - - [1024, 1500, 1, 2816]
    - [60, 18292.9]
  - - [8448, 1, 1, 2816]
    - [23, 360.033]
  - - [1024, 6000, 1, 2048]
    - [63, 16237.8]
  - - [512, 24000, 1, 2560]
    - [62, 20931.6]
  - - [6144, 3000, 1, 2560]
    - [62, 19674.2]
  - - [2368, 6784, 1, 3328]
    - [62, 19095.3]
  - - [5056, 704, 1, 1280]
    - [54, 20265.2]
  - - [1856, 4288, 1, 3328]
    - [62, 19932.5]
  - - [1408, 5888, 1, 256]
    - [62, 19813.6]
  - - [704, 2944, 1, 1280]
    - [58, 17720.4]
  - - [4288, 64, 1, 1280]
    - [12, 7046.1]
  - - [704, 1856, 1, 256]
    - [56, 12755.8]
  - - [2560, 64, 1, 2560]
    - [36, 6270.36]
  - - [3584, 704, 1, 1280]
    - [60, 18914.7]
  - - [5888, 5056, 1, 256]
    - [54, 22096.4]
  - - [3584, 448, 1, 3328]
    - [62, 14938.0]
  - - [704, 2368, 1, 3328]
    - [60, 15928.5]
  - - [2944, 448, 1, 256]
    - [54, 12026.4]
  - - [448, 5056, 1, 3328]
    - [60, 17578.7]
  - - [2368, 128, 1, 1280]
    - [37, 7713.57]
  - - [4288, 448, 1, 256]
    - [60, 14307.8]
  - - [64, 6784, 1, 256]
    - [10, 7044.34]
  - - [64, 5056, 1, 1280]
    - [38, 7875.19]
  - - [5888, 2368, 1, 256]
    - [54, 21041.4]
  - - [704, 448, 1, 3328]
    - [47, 8354.66]
  - - [6784, 704, 1, 3328]
    - [62, 19389.7]
  - - [128, 64, 1, 1280]
    - [25, 455.151]
  - - [2368, 256, 1, 1280]
    - [27, 11167.3]
  - - [1408, 2944, 1, 3328]
    - [54, 20816.9]
  - - [64, 1024, 1, 256]
    - [11, 2077.8]
  - - [2368, 448, 1, 1280]
    - [56, 12747.7]
  - - [128, 3584, 1, 256]
    - [5, 7966.66]
  - - [1856, 448, 1, 3328]
    - [60, 14048.9]
  - - [6144, 4, 1, 2560]
    - [21, 1208.13]
  - - [128, 5056, 1, 256]
    - [17, 9319.1]
  - - [4288, 4288, 1, 256]
    - [54, 21124.7]
  - - [2368, 704, 1, 256]
    - [54, 12831.1]
  - - [3584, 2368, 1, 256]
    - [54, 19488.3]
  - - [5888, 5056, 1, 1280]
    - [54, 20872.6]
  - - [128, 1024, 1, 1280]
    - [18, 5457.51]
  - - [8448, 24000, 1, 2816]
    - [62, 17931.1]
  - - [64, 704, 1, 256]
    - [7, 1621.93]
  - - [4288, 256, 1, 1280]
    - [56, 13236.7]
  - - [3584, 3584, 1, 3328]
    - [54, 20374.4]
  - - [128, 1024, 1, 256]
    - [18, 3871.52]
  - - [3072, 1500, 1, 128]
    - [54, 15861.2]
  - - [2048, 3136, 1, 512]
    - [71, 19529.8]
  - - [5888, 6784, 1, 256]
    - [62, 22129.3]
  - - [4288, 2944, 1, 3328]
    - [62, 19374.4]
  - - [1856, 64, 1, 256]
    - [18, 3392.69]
  - - [1024, 16, 1, 500000]
    - [25, 1015.0]
  - - [4288, 128, 1, 3328]
    - [41, 11463.8]
  - - [7680, 128, 1, 2560]
    - [60, 16396.1]
  - - [256, 5056, 1, 1280]
    - [56, 15424.5]
  - - [6784, 5888, 1, 1280]
    - [62, 20416.9]
  - - [3072, 1, 1, 1024]
    - [23, 142.505]
  - - [704, 128, 1, 256]
    - [18, 2780.53]
  - - [5888, 4288, 1, 1280]
    - [54, 21093.0]
  - - [1024, 24000, 1, 2048]
    - [65, 17599.3]
  - - [448, 256, 1, 1280]
    - [18, 4941.95]
  - - [448, 2368, 1, 3328]
    - [56, 13294.6]
  - - [256, 1408, 1, 1280]
    - [56, 8543.64]
  - - [3072, 16, 1, 1024]
    - [24, 2198.85]
  - - [1408, 1856, 1, 1280]
    - [60, 18597.8]
  - - [1024, 2, 1, 512]
    - [23, 98.3009]
  - - [5888, 448, 1, 3328]
    - [54, 17661.5]
  - - [704, 5888, 1, 1280]
    - [55, 19474.2]
  - - [256, 64, 1, 3328]
    - [42, 943.69]
  - - [128, 2368, 1, 256]
    - [29, 6020.22]
  - - [6784, 64, 1, 3328]
    - [40, 11447.2]
  - - [5056, 2944, 1, 3328]
    - [54, 20068.6]
  - - [448, 128, 1, 256]
    - [9, 1835.01]
  - - [4096, 16, 1, 4096]
    - [21, 3461.09]
  - - [1856, 128, 1, 1280]
    - [40, 7532.22]
  - - [448, 4288, 1, 1280]
    - [35, 16597.2]
  - - [64, 3584, 1, 256]
    - [3, 5081.36]
  - - [128, 2944, 1, 3328]
    - [13, 10437.6]
  - - [3584, 704, 1, 256]
    - [54, 16268.0]
  - - [2944, 448, 1, 3328]
    - [54, 15709.0]
  - - [1024, 2, 1, 500000]
    - [25, 126.886]
  - - [3584, 1408, 1, 3328]
    - [62, 20285.6]
  - - [2368, 1024, 1, 1280]
    - [54, 18441.8]
  - - [2944, 6784, 1, 1280]
    - [55, 20378.3]
  - - [1856, 6784, 1, 256]
    - [54, 20305.0]
  - - [4288, 448, 1, 3328]
    - [54, 17602.5]
  - - [6784, 704, 1, 1280]
    - [54, 19790.3]
  - - [6144, 1, 1, 2560]
    - [21, 304.197]
  - - [5888, 1024, 1, 3328]
    - [62, 20510.1]
  - - [704, 6784, 1, 1280]
    - [54, 19658.3]
  - - [5888, 128, 1, 256]
    - [5, 10852.6]
  - - [512, 3000, 1, 2048]
    - [63, 12888.0]
  - - [5056, 1024, 1, 3328]
    - [54, 20423.3]
  - - [704, 5056, 1, 1280]
    - [58, 18436.8]
  - - [64, 704, 1, 3328]
    - [42, 2421.32]
  - - [2944, 1856, 1, 256]
    - [54, 18585.9]
  - - [5056, 64, 1, 256]
    - [3, 6110.76]
  - - [512, 1500, 1, 1536]
    - [56, 12801.2]
  - - [512, 1, 1, 500000]
    - [25, 31.7221]
  - - [5888, 5056, 1, 3328]
    - [62, 18970.7]
  - - [128, 5056, 1, 3328]
    - [17, 13349.5]
  - - [3584, 6784, 1, 1280]
    - [54, 21013.9]
  - - [1856, 5888, 1, 256]
    - [62, 19721.3]
  - - [64, 448, 1, 3328]
    - [42, 1622.33]
  - - [4288, 4288, 1, 3328]
    - [62, 18841.8]
  - - [4288, 1408, 1, 1280]
    - [54, 21109.8]
  - - [64, 1856, 1, 256]
    - [2, 3420.94]
  - - [4288, 2368, 1, 256]
    - [60, 19462.6]
  - - [2944, 5056, 1, 1280]
    - [54, 20515.5]
  - - [256, 4288, 1, 1280]
    - [56, 13000.8]
  - - [6784, 2368, 1, 3328]
    - [60, 19159.6]
  - - [256, 1024, 1, 1280]
    - [56, 8206.02]
  - - [4288, 128, 1, 256]
    - [32, 8430.38]
  - - [4288, 1856, 1, 3328]
    - [62, 19948.1]
  - - [1856, 2944, 1, 1280]
    - [54, 20623.9]
  - - [3584, 64, 1, 1280]
    - [40, 7259.09]
  - - [4288, 6784, 1, 3328]
    - [62, 18507.2]
  - - [3584, 1024, 1, 1280]
    - [60, 20576.2]
  - - [1024, 4288, 1, 256]
    - [54, 16973.8]
  - - [5888, 3584, 1, 3328]
    - [62, 19418.1]
  - - [5056, 3584, 1, 3328]
    - [54, 19321.3]
  - - [1408, 128, 1, 3328]
    - [12, 6861.75]
  - - [2368, 1408, 1, 1280]
    - [54, 19095.9]
  - - [5056, 2944, 1, 1280]
    - [54, 20939.7]
  - - [8448, 6000, 1, 2816]
    - [62, 18781.2]
  - - [3584, 256, 1, 256]
    - [52, 10712.0]
  - - [1024, 6784, 1, 256]
    - [54, 18712.0]
  - - [2944, 5056, 1, 3328]
    - [62, 19503.8]
  - - [3584, 2944, 1, 256]
    - [54, 20101.5]
  - - [448, 128, 1, 3328]
    - [49, 3085.34]
  - - [64, 2944, 1, 3328]
    - [12, 7048.18]
  - - [64, 4288, 1, 3328]
    - [13, 7577.95]
  - - [5056, 6784, 1, 3328]
    - [62, 18505.4]
  - - [128, 2944, 1, 256]
    - [4, 6927.01]
  - - [3584, 4288, 1, 256]
    - [55, 20490.3]
  - - [1856, 6784, 1, 3328]
    - [54, 20081.5]
  - - [3584, 128, 1, 3328]
    - [47, 12024.6]
  - - [128, 256, 1, 1280]
    - [23, 1747.59]
  - - [64, 448, 1, 256]
    - [20, 1152.19]
  - - [128, 1500, 1, 1280]
    - [12, 6702.3]
  - - [64, 256, 1, 1280]
    - [21, 895.913]
  - - [512, 6000, 1, 1536]
    - [60, 19623.8]
  - - [5056, 1408, 1, 1280]
    - [54, 21052.5]
  - - [5888, 5888, 1, 256]
    - [55, 21525.4]
  - - [4288, 1024, 1, 1280]
    - [54, 20093.4]
  - - [5888, 128, 1, 3328]
    - [31, 14760.1]
  - - [448, 6784, 1, 3328]
    - [58, 17650.3]
  - - [2944, 1408, 1, 1280]
    - [54, 21047.9]
  - - [64, 128, 1, 1280]
    - [51, 453.703]
  - - [3072, 6000, 1, 1024]
    - [60, 20721.9]
  - - [1024, 32, 1, 512]
    - [23, 1561.98]
  - - [2944, 1856, 1, 3328]
    - [54, 20119.8]
  - - [448, 5056, 1, 256]
    - [54, 13978.5]
  - - [64, 64, 1, 256]
    - [7, 137.428]
  - - [3584, 5888, 1, 1280]
    - [54, 21131.3]
  - - [6784, 1856, 1, 1280]
    - [54, 21556.3]
  - - [5888, 256, 1, 3328]
    - [54, 17929.3]
  - - [1856, 5888, 1, 3328]
    - [54, 19562.7]
  - - [3584, 1408, 1, 256]
    - [54, 18338.0]
  - - [704, 3584, 1, 3328]
    - [58, 18154.4]
  - - [5056, 448, 1, 1280]
    - [60, 16987.6]
  - - [3584, 1856, 1, 3328]
    - [54, 20142.0]
  - - [64, 193600, 1, 256]
    - [68, 13343.7]
  - - [1024, 3000, 1, 2048]
    - [63, 14752.8]
  - - [1408, 704, 1, 1280]
    - [60, 15500.4]
  - - [2944, 1024, 1, 256]
    - [60, 15930.1]
  - - [448, 1408, 1, 1280]
    - [56, 11413.3]
  - - [2368, 4288, 1, 3328]
    - [54, 20337.2]
  - - [1024, 1408, 1, 1280]
    - [54, 16422.9]
  - - [256, 128, 1, 1280]
    - [23, 1758.4]
  - - [704, 1408, 1, 1280]
    - [34, 14740.1]
  - - [6784, 5056, 1, 256]
    - [62, 21642.6]
  - - [4288, 5888, 1, 256]
    - [54, 21597.4]
  - - [448, 2944, 1, 256]
    - [54, 11687.1]
  - - [2944, 6784, 1, 256]
    - [54, 21441.9]
  - - [2368, 2368, 1, 1280]
    - [54, 21267.2]
  - - [1856, 3584, 1, 1280]
    - [54, 20204.1]
  - - [64, 2944, 1, 256]
    - [18, 4617.95]
  - - [3584, 1408, 1, 1280]
    - [62, 20870.5]
  - - [5056, 3584, 1, 1280]
    - [54, 20973.7]
  - - [256, 5888, 1, 256]
    - [54, 12613.0]
  - - [128, 256, 1, 3328]
    - [42, 1831.04]
  - - [1856, 1408, 1, 3328]
    - [58, 18893.5]
  - - [1024, 4288, 1, 3328]
    - [60, 18971.8]
  - - [448, 2368, 1, 256]
    - [56, 10596.0]
  - - [64, 1408, 1, 1280]
    - [42, 4044.44]
  - - [64, 6784, 1, 1280]
    - [8, 9389.65]
  - - [2944, 2368, 1, 3328]
    - [54, 20154.5]
  - - [704, 4288, 1, 3328]
    - [58, 18512.5]
  - - [1024, 48000, 1, 2816]
    - [62, 18884.9]
  - - [1024, 1856, 1, 1280]
    - [60, 17357.5]
  - - [6784, 1856, 1, 256]
    - [54, 20486.5]
  - - [512, 48000, 1, 2816]
    - [62, 19825.4]
  - - [512, 3000, 1, 2816]
    - [54, 18224.3]
  - - [128, 2368, 1, 3328]
    - [13, 8484.39]
  - - [1024, 5888, 1, 256]
    - [54, 17993.7]
  - - [64, 2944, 1, 1280]
    - [37, 6201.4]
  - - [5056, 64, 1, 3328]
    - [38, 9040.78]
  - - [1408, 2368, 1, 256]
    - [59, 15784.1]
  - - [2944, 704, 1, 3328]
    - [60, 19836.8]
  - - [256, 64, 1, 256]
    - [7, 658.395]
  - - [1024, 8, 1, 500000]
    - [25, 507.507]
  - - [2944, 2944, 1, 1280]
    - [54, 21664.1]
  - - [6784, 256, 1, 3328]
    - [54, 16464.3]
  - - [1408, 5056, 1, 256]
    - [54, 19115.8]
  - - [512, 50176, 1, 128]
    - [15, 20390.9]
  - - [5056, 128, 1, 3328]
    - [38, 13442.0]
  - - [128, 128, 1, 1280]
    - [25, 907.387]
  - - [448, 704, 1, 256]
    - [52, 5706.64]
  - - [1856, 256, 1, 3328]
    - [47, 12338.9]
  - - [2944, 128, 1, 3328]
    - [44, 9970.44]
  - - [704, 256, 1, 256]
    - [52, 3892.79]
  - - [256, 448, 1, 1280]
    - [24, 5017.11]
  - - [704, 256, 1, 1280]
    - [33, 6094.28]
  - - [64, 2368, 1, 3328]
    - [11, 5905.22]
  - - [256, 704, 1, 3328]
    - [47, 6647.66]
  - - [1024, 1024, 1, 256]
    - [54, 11959.7]
  - - [4096, 64, 1, 4096]
    - [40, 9436.92]
  - - [1408, 4288, 1, 256]
    - [53, 17286.7]
  - - [5888, 2368, 1, 1280]
    - [54, 21511.0]
  - - [128, 256, 1, 256]
    - [9, 1217.68]
  - - [256, 64, 1, 1280]
    - [21, 898.754]
  - - [2368, 5888, 1, 1280]
    - [62, 20058.6]
  - - [5888, 256, 1, 1280]
    - [60, 17192.0]
  - - [1760, 128, 1, 1760]
    - [40, 7517.59]
  - - [704, 1024, 1, 1280]
    - [56, 13126.1]
  - - [2368, 1856, 1, 3328]
    - [54, 19672.5]
  - - [2944, 704, 1, 256]
    - [54, 15707.4]
  - - [2368, 6784, 1, 1280]
    - [54, 21083.6]
  - - [2368, 1024, 1, 3328]
    - [60, 18514.5]
  - - [1856, 4288, 1, 1280]
    - [54, 21291.1]
  - - [704, 3584, 1, 256]
    - [56, 13996.3]
  - - [704, 2944, 1, 3328]
    - [35, 18456.7]
  - - [1856, 5056, 1, 3328]
    - [54, 20062.3]
  - - [196, 256, 64, 1024]
    - [73, 10244.9]
  - - [3584, 5056, 1, 1280]
    - [62, 20538.9]
  - - [2944, 1024, 1, 3328]
    - [60, 19970.3]
  - - [256, 4288, 1, 256]
    - [56, 10686.3]
  - - [2368, 256, 1, 256]
    - [27, 9188.78]
  - - [1408, 6784, 1, 256]
    - [54, 19743.0]
  - - [6784, 1408, 1, 3328]
    - [54, 19483.0]
  - - [1024, 2368, 1, 1280]
    - [54, 18523.4]
  - - [704, 64, 1, 256]
    - [18, 1749.61]
  - - [3072, 4, 1, 1024]
    - [21, 566.224]
  - - [256, 2368, 1, 3328]
    - [56, 11744.2]
  - - [6784, 2944, 1, 1280]
    - [62, 20745.8]
  - - [3584, 448, 1, 1280]
    - [54, 14773.4]
  - - [2944, 6784, 1, 3328]
    - [54, 18693.7]
  - - [448, 5056, 1, 1280]
    - [54, 17113.9]
  - - [4288, 5056, 1, 1280]
    - [54, 21310.7]
  - - [128, 448, 1, 1280]
    - [24, 2872.14]
  - - [4288, 704, 1, 256]
    - [54, 16772.5]
  - - [64, 64, 1, 1280]
    - [25, 228.309]
  - - [5888, 704, 1, 256]
    - [54, 18225.5]
  - - [256, 5888, 1, 3328]
    - [60, 18015.2]
  - - [6784, 4288, 1, 256]
    - [54, 21926.1]
  - - [5888, 256, 1, 256]
    - [28, 13187.8]
  - - [1024, 4, 1, 500000]
    - [25, 253.779]
  - - [6784, 1024, 1, 1280]
    - [62, 21140.8]
  - - [704, 448, 1, 1280]
    - [56, 7632.78]
  - - [512, 16, 1, 500000]
    - [25, 507.544]
  - - [128, 64, 1, 3328]
    - [21, 477.352]
  - - [448, 64, 1, 256]
    - [7, 1113.31]
  - - [2944, 704, 1, 1280]
    - [60, 19130.9]
  - - [6784, 3584, 1, 1280]
    - [54, 20386.8]
  - - [2944, 64, 1, 1280]
    - [12, 6550.75]
  - - [1408, 2944, 1, 1280]
    - [62, 20961.7]
  - - [256, 1856, 1, 256]
    - [56, 7932.36]
  - - [1408, 2368, 1, 3328]
    - [60, 18603.1]
  - - [128, 1408, 1, 3328]
    - [37, 6855.91]
  - - [2368, 2944, 1, 256]
    - [54, 19030.4]
  - - [64, 5056, 1, 256]
    - [12, 6110.76]
  - - [1408, 256, 1, 3328]
    - [47, 9508.93]
  - - [1024, 16, 1, 512]
    - [23, 797.51]
  - - [7680, 2, 1, 2560]
    - [26, 701.226]
  - - [3584, 1856, 1, 256]
    - [54, 19317.8]
  - - [4288, 3584, 1, 1280]
    - [62, 21695.6]
  - - [2368, 448, 1, 256]
    - [56, 10688.8]
  - - [4288, 256, 1, 3328]
    - [56, 13795.0]
  - - [1408, 64, 1, 256]
    - [18, 2755.95]
  - - [512, 16, 1, 512]
    - [21, 404.446]
  - - [4288, 2944, 1, 1280]
    - [60, 20788.5]
  - - [5056, 448, 1, 3328]
    - [60, 17651.8]
  - - [1024, 64, 1, 256]
    - [9, 2488.83]
  - - [64, 2368, 1, 256]
    - [2, 4060.21]
  - - [5124, 1500, 1, 2048]
    - [65, 17136.8]
  - - [4288, 5056, 1, 3328]
    - [62, 18881.4]
  - - [512, 2, 1, 500000]
    - [25, 63.4436]
  - - [2944, 256, 1, 256]
    - [52, 10762.7]
  - - [1024, 128, 1, 3328]
    - [48, 6108.54]
  - - [256, 5056, 1, 3328]
    - [56, 15589.9]
  - - [5056, 2368, 1, 256]
    - [62, 19768.8]
  - - [4288, 704, 1, 3328]
    - [54, 19621.3]
  - - [448, 3584, 1, 256]
    - [56, 11882.1]
  - - [2368, 64, 1, 1280]
    - [11, 5444.4]
  - - [6144, 1500, 1, 2560]
    - [62, 19923.4]
  - - [4224, 1, 1, 128]
    - [1, 101.373]
  - - [1024, 1408, 1, 3328]
    - [60, 17268.7]
  - - [2944, 5888, 1, 1280]
    - [54, 21132.1]
  - - [8448, 2, 1, 2816]
    - [50, 709.723]
  - - [5888, 3584, 1, 256]
    - [55, 20860.5]
  - - [1408, 1856, 1, 3328]
    - [54, 20425.3]
  - - [7680, 6000, 1, 2560]
    - [62, 18819.6]
  - - [6784, 1408, 1, 1280]
    - [62, 20556.9]
  - - [512, 3000, 1, 2560]
    - [60, 18135.5]
  - - [704, 2944, 1, 256]
    - [58, 14155.4]
  - - [4288, 64, 1, 256]
    - [29, 5713.38]
  - - [2944, 5888, 1, 3328]
    - [62, 19861.0]
  - - [64, 4288, 1, 1280]
    - [13, 6842.76]
  - - [6784, 64, 1, 1280]
    - [38, 10376.7]
  - - [704, 1856, 1, 1280]
    - [56, 15679.0]
  - - [1024, 1500, 1, 1536]
    - [60, 17586.7]
  - - [1408, 64, 1, 3328]
    - [11, 4371.96]
  - - [1408, 1408, 1, 1280]
    - [60, 18153.7]
  - - [448, 1024, 1, 3328]
    - [56, 11865.4]
  - - [3072, 3000, 1, 1024]
    - [60, 19899.7]
  - - [448, 4288, 1, 3328]
    - [58, 17063.1]
  - - [704, 2368, 1, 256]
    - [56, 12524.4]
  - - [2944, 448, 1, 1280]
    - [60, 15102.8]
  - - [5888, 2368, 1, 3328]
    - [54, 19464.4]
  - - [5124, 9124, 1, 1760]
    - [62, 18504.9]
  - - [4288, 5056, 1, 256]
    - [54, 21480.6]
  - - [4288, 448, 1, 1280]
    - [60, 17619.1]
  - - [5888, 704, 1, 3328]
    - [60, 21061.7]
  - - [4288, 3584, 1, 3328]
    - [54, 19965.9]
  - - [2944, 64, 1, 256]
    - [18, 4617.95]
  - - [1024, 6784, 1, 3328]
    - [62, 20280.5]
  - - [512, 3136, 1, 2048]
    - [72, 14105.8]
  - - [1408, 1024, 1, 256]
    - [54, 13216.6]
  - - [8448, 1500, 1, 2816]
    - [60, 19610.2]
  - - [2560, 7000, 1, 2560]
    - [62, 19582.5]
  - - [448, 1024, 1, 256]
    - [56, 7733.73]
  - - [6784, 6784, 1, 3328]
    - [62, 18841.8]
  - - [1024, 448, 1, 1280]
    - [56, 10933.8]
  - - [704, 5056, 1, 3328]
    - [58, 18828.8]
  - - [256, 2368, 1, 1280]
    - [56, 10900.0]
  - - [3584, 5056, 1, 3328]
    - [54, 19356.6]
  - - [2368, 2944, 1, 3328]
    - [62, 19383.7]
  - - [448, 448, 1, 1280]
    - [44, 6760.38]
  - - [2368, 3584, 1, 256]
    - [54, 19566.4]
  - - [4608, 3000, 1, 1536]
    - [62, 20448.4]
  - - [1024, 256, 1, 1280]
    - [56, 8265.86]
  - - [128, 5056, 1, 1280]
    - [17, 12235.0]
  - - [5124, 9124, 1, 4096]
    - [65, 16511.7]
  - - [7680, 48000, 1, 2560]
    - [62, 17778.9]
  - - [4608, 1500, 1, 1536]
    - [60, 20457.2]
  - - [3584, 2368, 1, 1280]
    - [54, 21106.7]
  - - [5124, 9124, 1, 2560]
    - [62, 18164.1]
  - - [1856, 1856, 1, 256]
    - [54, 16420.2]
  - - [4288, 1408, 1, 3328]
    - [62, 20683.6]
  - - [3584, 64, 1, 3328]
    - [47, 8323.98]
  - - [5124, 9124, 1, 2048]
    - [65, 17337.2]
  - - [128, 1, 1, 1024]
    - [7, 6.27454]
  - - [5124, 700, 1, 2048]
    - [66, 15868.9]
  - - [256, 1024, 1, 3328]
    - [47, 9406.75]
  - - [1856, 64, 1, 3328]
    - [24, 5576.35]
  - - [256, 12544, 1, 1024]
    - [70, 13658.8]
  - - [5888, 1408, 1, 3328]
    - [62, 20320.5]
  - - [256, 5056, 1, 256]
    - [56, 11928.1]
  - - [1856, 64, 1, 1280]
    - [18, 4981.85]
  - - [1408, 256, 1, 256]
    - [27, 6590.81]
  - - [2368, 5056, 1, 256]
    - [62, 19825.7]
  - - [128, 5888, 1, 3328]
    - [56, 14500.9]
  - - [1024, 6000, 1, 2560]
    - [62, 20552.7]
  - - [1024, 5056, 1, 256]
    - [54, 18054.9]
  - - [4224, 1500, 1, 176]
    - [59, 16707.9]
  - - [2368, 1408, 1, 3328]
    - [60, 19045.4]
  - - [1024, 48000, 1, 1536]
    - [62, 19650.7]
  - - [5888, 448, 1, 256]
    - [60, 14024.7]
  - - [6784, 5056, 1, 1280]
    - [54, 20498.2]
  - - [1024, 48000, 1, 2560]
    - [62, 18878.8]
  - - [4608, 32, 1, 1536]
    - [11, 5402.07]
  - - [4288, 6784, 1, 1280]
    - [55, 20295.4]
  - - [2368, 448, 1, 3328]
    - [56, 13261.3]
  - - [1024, 128, 1, 256]
    - [11, 3838.74]
  - - [448, 128, 1, 1280]
    - [48, 2888.87]
  - - [1024, 64, 1, 3328]
    - [42, 3488.52]
  - - [3072, 48000, 1, 1024]
    - [62, 18681.8]
  - - [64, 3584, 1, 1280]
    - [44, 7039.95]
  - - [6784, 1408, 1, 256]
    - [54, 19945.8]
  - - [5888, 4288, 1, 256]
    - [54, 21715.6]
  - - [5056, 5888, 1, 256]
    - [54, 21645.5]
  - - [2368, 1024, 1, 256]
    - [54, 15461.1]
  - - [1856, 6784, 1, 1280]
    - [54, 21257.2]
  - - [3584, 128, 1, 1280]
    - [5, 10964.1]
  - - [128, 64, 1, 256]
    - [23, 345.239]
  - - [1408, 448, 1, 256]
    - [56, 8789.98]
  - - [64, 256, 1, 3328]
    - [42, 943.69]
  - - [8448, 3000, 1, 2816]
    - [62, 19011.2]
  - - [6784, 448, 1, 3328]
    - [54, 20177.7]
  - - [5056, 1856, 1, 1280]
    - [54, 21318.6]
  - - [1408, 1024, 1, 3328]
    - [60, 17324.1]
  - - [2368, 256, 1, 3328]
    - [27, 11950.4]
  - - [7680, 1500, 1, 2560]
    - [54, 19163.4]
  - - [5888, 3584, 1, 1280]
    - [54, 21244.5]
  - - [5888, 128, 1, 1280]
    - [56, 13608.0]
  - - [1024, 2944, 1, 256]
    - [54, 16202.7]
  - - [448, 6784, 1, 1280]
    - [58, 17470.5]
  - - [256, 3584, 1, 1280]
    - [60, 14117.5]
  - - [704, 5056, 1, 256]
    - [57, 15318.7]
  - - [3584, 1024, 1, 3328]
    - [60, 20897.5]
  - - [2944, 1856, 1, 1280]
    - [54, 20687.1]
  - - [5056, 256, 1, 256]
    - [56, 12965.4]
  - - [128, 5888, 1, 256]
    - [19, 10017.8]
  - - [2368, 3584, 1, 3328]
    - [54, 20256.5]
  - - [3584, 5888, 1, 3328]
    - [62, 19462.3]
  - - [2944, 3584, 1, 1280]
    - [54, 21769.6]
  - - [1856, 5888, 1, 1280]
    - [62, 20295.8]
  - - [256, 256, 1, 1280]
    - [48, 3311.21]
  - - [4608, 24000, 1, 1536]
    - [62, 18753.1]
  - - [4288, 1408, 1, 256]
    - [62, 18206.8]
  - - [3584, 64, 1, 256]
    - [12, 5017.11]
  - - [64, 1856, 1, 3328]
    - [24, 5553.13]
  - - [1408, 128, 1, 256]
    - [18, 4417.38]
  - - [4288, 2368, 1, 1280]
    - [54, 21530.9]
  - - [2944, 5056, 1, 256]
    - [59, 20228.3]
  - - [256, 128, 1, 3328]
    - [23, 1858.78]
  - - [512, 8, 1, 500000]
    - [25, 253.77]
  - - [6784, 2368, 1, 256]
    - [62, 20561.9]
  - - [1024, 1024, 1, 1024]
    - [64, 13496.3]
  - - [1408, 448, 1, 3328]
    - [56, 12268.0]
  - - [1024, 24000, 1, 2816]
    - [60, 19004.3]
  - - [4288, 1856, 1, 256]
    - [62, 18773.9]
  - - [1856, 2944, 1, 256]
    - [54, 18262.3]
  - - [4608, 6000, 1, 1536]
    - [62, 20788.0]
  - - [64, 5888, 1, 1280]
    - [13, 9006.11]
  - - [7680, 3000, 1, 2560]
    - [60, 19005.5]
  - - [5124, 700, 1, 2560]
    - [60, 18132.8]
  - - [1856, 1408, 1, 1280]
    - [58, 17549.8]
  - - [128, 704, 1, 256]
    - [11, 2755.95]
  - - [1024, 4288, 1, 1280]
    - [60, 19549.8]
  - - [2368, 5056, 1, 3328]
    - [62, 19510.6]
  - - [4288, 1024, 1, 3328]
    - [60, 19640.5]
  - - [6144, 48000, 1, 2560]
    - [62, 17809.7]
  - - [1024, 5056, 1, 3328]
    - [62, 20199.8]
  - - [1024, 1856, 1, 3328]
    - [60, 18155.5]
  - - [704, 704, 1, 1280]
    - [56, 11877.9]
  - - [128, 2368, 1, 1280]
    - [13, 7690.86]
  - - [3584, 256, 1, 1280]
    - [60, 14438.9]
  - - [5888, 64, 1, 1280]
    - [38, 9505.74]
  - - [5124, 1500, 1, 2560]
    - [62, 19688.7]
  - - [128, 704, 1, 3328]
    - [11, 4325.24]
  - - [3584, 2944, 1, 3328]
    - [54, 20308.2]
  - - [128, 1856, 1, 256]
    - [3, 5401.43]
  - - [64, 4288, 1, 256]
    - [3, 5298.43]
  - - [5888, 2944, 1, 256]
    - [55, 20671.3]
  - - [5056, 128, 1, 1280]
    - [38, 12452.9]
  - - [448, 1856, 1, 3328]
    - [60, 14006.7]
  - - [5056, 4288, 1, 256]
    - [54, 21455.9]
  - - [1024, 448, 1, 256]
    - [52, 7443.31]
  - - [1024, 3584, 1, 256]
    - [60, 17116.3]
  - - [2944, 128, 1, 1280]
    - [13, 9618.14]
  - - [2560, 32, 1, 2560]
    - [45, 3825.77]
  - - [64, 256, 1, 256]
    - [7, 674.109]
  - - [1024, 4, 1, 512]
    - [23, 197.975]
  - - [704, 256, 1, 3328]
    - [47, 6550.84]
  - - [5056, 1408, 1, 256]
    - [54, 19326.0]
  - - [5888, 5888, 1, 1280]
    - [62, 20778.1]
  - - [176, 1500, 1, 1408]
    - [37, 6762.76]
  - - [448, 5888, 1, 1280]
    - [60, 16831.7]
  - - [1024, 3000, 1, 2560]
    - [60, 20187.3]
  - - [4288, 704, 1, 1280]
    - [54, 19632.1]
  - - [2944, 1408, 1, 256]
    - [54, 18389.2]
  - - [4608, 2, 1, 1536]
    - [23, 441.334]
  - - [256, 2944, 1, 1280]
    - [56, 12692.9]
  - - [2560, 128, 1, 2560]
    - [38, 9001.81]
  - - [2368, 5888, 1, 3328]
    - [62, 19056.4]
  - - [704, 1024, 1, 3328]
    - [56, 13978.2]
  - - [2368, 1856, 1, 1280]
    - [60, 19578.1]
  - - [1856, 448, 1, 1280]
    - [60, 12909.0]
  - - [128, 6784, 1, 256]
    - [13, 10138.1]
  - - [512, 4, 1, 500000]
    - [25, 126.881]
  - - [1024, 6000, 1, 2816]
    - [54, 20689.5]
  - - [5888, 4288, 1, 3328]
    - [61, 18579.5]
  - - [1856, 128, 1, 256]
    - [3, 5296.99]
  - - [5056, 448, 1, 256]
    - [54, 13928.6]
  - - [1856, 5056, 1, 1280]
    - [54, 20682.3]
  - - [2944, 1024, 1, 1280]
    - [62, 19451.7]
  - - [2368, 4288, 1, 256]
    - [60, 19462.6]
  - - [1024, 2368, 1, 3328]
    - [60, 18870.5]
  - - [4288, 64, 1, 3328]
    - [38, 7667.49]
  - - [704, 1408, 1, 256]
    - [56, 11231.3]
  - - [4096, 128, 1, 4096]
    - [40, 12653.9]
  - - [4288, 5888, 1, 3328]
    - [62, 18869.4]
  - - [4608, 16, 1, 1536]
    - [21, 3204.98]
  - - [448, 2944, 1, 1280]
    - [54, 14837.3]
  - - [1024, 2944, 1, 3328]
    - [54, 20272.2]
  - - [2048, 64, 1, 2048]
    - [48, 5706.72]
  - - [6144, 2, 1, 2560]
    - [21, 604.93]
  - - [256, 6784, 1, 1280]
    - [54, 15629.9]
  - - [1856, 3584, 1, 256]
    - [54, 18086.8]
  - - [128, 448, 1, 3328]
    - [21, 3070.65]
  - - [1856, 256, 1, 256]
    - [27, 8597.01]
  - - [1024, 1500, 1, 2048]
    - [63, 13558.8]
  - - [5056, 128, 1, 256]
    - [30, 9724.14]
  - - [512, 24000, 1, 2816]
    - [62, 20835.3]
  - - [256, 5888, 1, 1280]
    - [60, 16880.0]
  - - [6784, 128, 1, 1280]
    - [32, 13603.5]
  - - [64, 1408, 1, 256]
    - [18, 2755.95]
  - - [2944, 2368, 1, 256]
    - [60, 18363.1]
  - - [1856, 448, 1, 256]
    - [56, 9807.45]
  - - [1024, 1856, 1, 256]
    - [60, 14094.4]
  - - [6784, 3584, 1, 3328]
    - [54, 18678.5]
  - - [1760, 7000, 1, 1760]
    - [54, 19838.3]
  - - [2944, 64, 1, 3328]
    - [43, 7077.7]
  - - [1024, 5888, 1, 3328]
    - [62, 20371.3]
  - - [1408, 2368, 1, 1280]
    - [54, 18883.1]
  - - [128, 1408, 1, 1280]
    - [37, 6342.51]
  - - [1024, 1, 1, 512]
    - [7, 43.1566]
  - - [128, 1856, 1, 3328]
    - [44, 8572.8]
  - - [2944, 2944, 1, 256]
    - [54, 20021.8]
  - - [6784, 256, 1, 256]
    - [54, 13249.2]
  - - [128, 4288, 1, 1280]
    - [13, 10502.8]
  - - [1024, 3000, 1, 1536]
    - [62, 19733.3]
  - - [5888, 1408, 1, 256]
    - [54, 20162.1]
  - - [128, 128, 1, 256]
    - [23, 666.133]
  - - [1760, 64, 1, 1760]
    - [24, 4910.49]
  - - [448, 704, 1, 3328]
    - [47, 8404.22]
  - - [448, 1856, 1, 256]
    - [54, 9675.28]
  - - [1856, 704, 1, 3328]
    - [56, 16429.4]
  - - [512, 1500, 1, 2560]
    - [56, 13787.7]
  - - [5888, 6784, 1, 3328]
    - [62, 18714.0]
  - - [704, 4288, 1, 1280]
    - [58, 17610.6]
  - - [128, 50176, 1, 512]
    - [69, 15820.1]
  - - [1024, 48000, 1, 2048]
    - [65, 17839.8]
  - - [3136, 64, 128, 64]
    - [83, 9365.01]
  - - [784, 512, 64, 128]
    - [79, 16514.2]
  - - [3136, 256, 64, 64]
    - [83, 14417.0]
  - - [784, 128, 128, 512]
    - [81, 17178.8]
  - - [784, 128, 64, 512]
    - [79, 16782.7]
  - - [3136, 512, 1, 2048]
    - [84, 14718.2]
  - - [12544, 256, 1, 1024]
    - [82, 17538.5]
  - - [3136, 64, 128, 256]
    - [80, 14182.1]
  - - [3136, 64, 64, 256]
    - [80, 13815.8]
  - - [3136, 2048, 1, 512]
    - [79, 17165.5]
  - - [784, 512, 128, 128]
    - [79, 17096.1]
  - - [3136, 64, 64, 64]
    - [78, 8807.55]
  - - [12544, 1024, 1, 256]
    - [81, 19300.0]
  - - [3136, 256, 128, 64]
    - [83, 14951.2]
- null
