library/src/blas3/Tensile/Logic/asm_full/vega10_Cijk_Alik_Bljk_HB.yaml
- {MinimumRequiredVersion: 4.3.0}
- vega10
- gfx900
- [Device 6863, Device 6862, Device 687f, Device 6860, Device 6861, 'Vega 10 XTX [Radeon
    SolutionIndex: 0
    SolutionNameMin: Cijk_Alik_Bljk_HB_MT256x064x32_GRVW08_NLCA01_NLCB01_PBC0_TT08_08_USFGRO00_VW08_WG32_08_01
    SolutionIndex: 1
    SolutionNameMin: Cijk_Alik_Bljk_HB_MT128x032x32_GRVW04_NLCA01_NLCB01_PBC0_TT04_04_USFGRO00_VW04_WG32_08_01
    SolutionIndex: 2
    SolutionNameMin: Cijk_Alik_Bljk_HB_MT064x032x32_GRVW04_NLCA01_NLCB01_PBC0_TT04_04_USFGRO00_VW04_WG16_08_01
    SolutionIndex: 3
    SolutionNameMin: Cijk_Alik_Bljk_HB_MT016x016x32_GRVW02_NLCA01_NLCB01_PBC1_TT02_02_USFGRO01_VW02_WG08_08_01
    SolutionIndex: 4
    SolutionNameMin: Cijk_Alik_Bljk_HB_MT032x032x32_GRVW04_NLCA01_NLCB01_PBC0_TT04_04_USFGRO00_VW04_WG08_08_01
    SolutionIndex: 5
    SolutionNameMin: Cijk_Alik_Bljk_HB_MT032x016x32_GRVW02_NLCA01_NLCB01_PBC1_TT02_02_USFGRO01_VW02_WG16_08_01
    SolutionIndex: 6
    SolutionNameMin: Cijk_Alik_Bljk_HB_MT016x016x16_GRVW02_NLCA01_NLCB01_PBC1_TT02_02_USFGRO01_VW02_WG08_08_01
    SolutionIndex: 7
    SolutionNameMin: Cijk_Alik_Bljk_HB_MT032x032x16_GRVW04_NLCA01_NLCB01_PBC0_TT04_04_USFGRO00_VW04_WG08_08_01
    SolutionIndex: 8
    SolutionNameMin: Cijk_Alik_Bljk_HB_MT032x016x64_GRVW02_NLCA01_NLCB01_PBC1_TT02_02_USFGRO01_VW02_WG16_08_01
    SolutionIndex: 9
    SolutionNameMin: Cijk_Alik_Bljk_HB_MT048x032x24_GRVW02_NLCA03_NLCB03_PBC1_TT06_04_USFGRO01_VW02_WG08_08_01
    SolutionIndex: 10
    SolutionNameMin: Cijk_Alik_Bljk_HB_MT032x032x24_GRVW04_NLCA03_NLCB03_PBC0_TT04_04_USFGRO00_VW04_WG08_08_01
    SolutionIndex: 11
    SolutionNameMin: Cijk_Alik_Bljk_HB_MT016x016x08_GRVW02_NLCA01_NLCB01_PBC0_TT02_02_USFGRO00_VW02_WG08_08_01
    SolutionIndex: 12
    SolutionNameMin: Cijk_Alik_Bljk_HB_MT032x016x24_GRVW02_NLCA03_NLCB03_PBC1_TT04_02_USFGRO01_VW02_WG08_08_01
    SolutionIndex: 13
    SolutionNameMin: Cijk_Alik_Bljk_HB_MT032x032x24_GRVW04_NLCA03_NLCB03_PBC0_TT04_04_USFGRO00_VW04_WG08_08_01
    SolutionIndex: 14
    SolutionNameMin: Cijk_Alik_Bljk_HB_MT128x032x32_GRVW04_NLCA01_NLCB01_PBC0_TT04_04_USFGRO00_VW04_WG32_08_01
    SolutionIndex: 15
    SolutionNameMin: Cijk_Alik_Bljk_HB_MT064x064x32_GRVW08_NLCA01_NLCB01_PBC0_TT08_08_USFGRO00_VW08_WG08_08_01
    SolutionIndex: 16
    SolutionNameMin: Cijk_Alik_Bljk_HB_MT064x032x32_GRVW04_NLCA01_NLCB01_PBC0_TT04_04_USFGRO00_VW04_WG16_08_01
    SolutionIndex: 17
    SolutionNameMin: Cijk_Alik_Bljk_HB_MT016x016x24_GRVW02_NLCA03_NLCB03_PBC1_TT02_02_USFGRO01_VW02_WG08_08_01
    SolutionIndex: 18
    SolutionNameMin: Cijk_Alik_Bljk_HB_MT016x016x24_GRVW02_NLCA03_NLCB03_PBC1_TT02_02_USFGRO01_VW02_WG08_08_01
    SolutionIndex: 19
    SolutionNameMin: Cijk_Alik_Bljk_HB_MT064x032x16_GRVW04_NLCA01_NLCB01_PBC0_TT04_04_USFGRO00_VW04_WG16_08_01
    SolutionIndex: 20
    SolutionNameMin: Cijk_Alik_Bljk_HB_MT016x016x32_GRVW02_NLCA01_NLCB01_PBC1_TT02_02_USFGRO01_VW02_WG08_08_01
    SolutionIndex: 21
    SolutionNameMin: Cijk_Alik_Bljk_HB_MT032x032x16_GRVW04_NLCA01_NLCB01_PBC0_TT04_04_USFGRO00_VW04_WG08_08_01
    SolutionIndex: 22
    SolutionNameMin: Cijk_Alik_Bljk_HB_MT064x064x08_GRVW04_NLCA01_NLCB01_PBC0_TT04_04_USFGRO00_VW04_WG16_16_01
    SolutionIndex: 23
    SolutionNameMin: Cijk_Alik_Bljk_HB_MT096x128x16_GRVW02_NLCA01_NLCB01_PBC0_TT06_08_USFGRO00_VW02_WG16_16_01
    SolutionIndex: 24
    SolutionNameMin: Cijk_Alik_Bljk_HB_MT064x064x32_GRVW04_NLCA01_NLCB01_PBC0_TT04_04_USFGRO00_VW04_WG16_16_01
    SolutionIndex: 25
    SolutionNameMin: Cijk_Alik_Bljk_HB_MT128x128x32_GRVW08_NLCA01_NLCB01_PBC0_TT08_08_USFGRO00_VW08_WG16_16_01
    SolutionIndex: 26
    SolutionNameMin: Cijk_Alik_Bljk_HB_MT064x128x16_GRVW04_NLCA01_NLCB01_PBC0_TT04_08_USFGRO00_VW04_WG16_16_01
    SolutionIndex: 27
    SolutionNameMin: Cijk_Alik_Bljk_HB_MT128x064x16_GRVW04_NLCA01_NLCB01_PBC0_TT08_04_USFGRO00_VW04_WG16_16_01
    SolutionIndex: 28
    SolutionNameMin: Cijk_Alik_Bljk_HB_MT128x064x08_GRVW04_NLCA01_NLCB01_PBC0_TT08_04_USFGRO00_VW04_WG16_16_01
    SolutionIndex: 29
    SolutionNameMin: Cijk_Alik_Bljk_HB_MT064x064x16_GRVW04_NLCA01_NLCB01_PBC0_TT04_04_USFGRO00_VW04_WG16_16_01
    SolutionIndex: 30
    SolutionNameMin: Cijk_Alik_Bljk_HB_MT128x128x08_GRVW08_NLCA01_NLCB01_PBC0_TT08_08_USFGRO00_VW08_WG16_16_01
    SolutionIndex: 31
    SolutionNameMin: Cijk_Alik_Bljk_HB_MT128x128x16_GRVW08_NLCA01_NLCB01_PBC0_TT08_08_USFGRO00_VW08_WG16_16_01
- - - [4096, 7000, 1, 4096]
    - [25, 18103.5]
  - - [7680, 12000, 1, 2560]
    - [31, 23356.2]
  - - [5124, 9124, 1, 1760]
    - [30, 22720.2]
  - - [1760, 32, 1, 1760]
    - [18, 3007.01]
  - - [512, 24000, 1, 1536]
    - [31, 20333.1]
  - - [3072, 24000, 1, 1024]
    - [31, 20117.1]
  - - [2048, 400, 1, 512]
    - [31, 9374.32]
  - - [2560, 7000, 1, 2560]
    - [31, 20273.3]
  - - [3072, 16, 1, 1024]
    - [18, 1329.64]
  - - [512, 48000, 1, 2816]
    - [31, 23106.4]
  - - [512, 48000, 1, 2048]
    - [25, 16831.8]
  - - [1760, 64, 1, 1760]
    - [18, 5002.31]
  - - [35, 8457, 1, 4096]
    - [9, 0.0]
  - - [2048, 1600, 1, 2048]
    - [24, 10164.4]
  - - [512, 48000, 1, 1536]
    - [31, 21701.3]
  - - [2560, 32, 1, 2560]
    - [18, 3503.78]
  - - [8448, 5984, 1, 2816]
    - [31, 23447.2]
  - - [4096, 3200, 1, 1024]
    - [25, 16532.7]
  - - [1024, 24000, 1, 2560]
    - [31, 19733.0]
  - - [1760, 6400, 1, 1760]
    - [30, 23240.1]
  - - [1024, 700, 1, 512]
    - [24, 8991.5]
  - - [4608, 32, 1, 1536]
    - [10, 4098.56]
  - - [3072, 64, 1, 1024]
    - [16, 3628.55]
  - - [16384, 3200, 1, 4096]
    - [25, 17479.6]
  - - [2560, 16, 1, 2560]
    - [18, 1960.56]
  - - [1024, 48000, 1, 2560]
    - [31, 22254.0]
  - - [35, 8457, 1, 2560]
    - [9, 0.0]
  - - [8448, 48000, 1, 2816]
    - [31, 23836.4]
  - - [2048, 32, 1, 2048]
    - [17, 1690.18]
  - - [2560, 3200, 1, 2560]
    - [25, 19205.6]
  - - [16384, 800, 1, 4096]
    - [25, 14976.4]
  - - [4608, 24000, 1, 1536]
    - [31, 23271.3]
  - - [7680, 48000, 1, 2560]
    - [31, 23918.3]
  - - [3072, 48000, 1, 1024]
    - [31, 21844.0]
  - - [1760, 16, 1, 1760]
    - [18, 1538.06]
  - - [8192, 3200, 1, 2048]
    - [25, 15849.1]
  - - [512, 24000, 1, 2816]
    - [31, 23053.5]
  - - [4096, 400, 1, 1024]
    - [25, 10337.0]
  - - [6144, 48000, 1, 2560]
    - [31, 23428.4]
  - - [4608, 48000, 1, 1536]
    - [31, 23582.1]
  - - [35, 8457, 1, 2048]
    - [9, 0.0]
  - - [4096, 128, 1, 4096]
    - [0, 5155.6]
  - - [2048, 800, 1, 512]
    - [31, 12149.4]
  - - [4608, 5984, 1, 1536]
    - [31, 21947.3]
  - - [2560, 128, 1, 2560]
    - [21, 7411.12]
  - - [6144, 5984, 1, 2048]
    - [25, 17488.0]
  - - [35, 8457, 1, 1760]
    - [9, 0.0]
  - - [7680, 24000, 1, 2560]
    - [31, 23571.6]
  - - [6144, 48000, 1, 2048]
    - [25, 19770.6]
  - - [5124, 9124, 1, 2560]
    - [31, 22126.4]
  - - [2048, 3200, 1, 2048]
    - [24, 11339.9]
  - - [2048, 16, 1, 2048]
    - [8, 894.308]
  - - [1024, 24000, 1, 1536]
    - [31, 21588.9]
  - - [7680, 16, 1, 2560]
    - [3, 2715.19]
  - - [2560, 6400, 1, 2560]
    - [31, 19752.8]
  - - [2048, 128, 1, 2048]
    - [1, 3549.21]
  - - [512, 16, 1, 500000]
    - [6, 505.456]
  - - [1024, 8, 1, 500000]
    - [6, 505.942]
  - - [512, 24000, 1, 2560]
    - [31, 21182.5]
  - - [1024, 24000, 1, 2816]
    - [31, 23059.3]
  - - [7680, 5984, 1, 2560]
    - [31, 22638.2]
  - - [2048, 1600, 1, 512]
    - [25, 12759.6]
  - - [2048, 7000, 1, 2048]
    - [25, 15058.7]
  - - [1760, 800, 1, 1760]
    - [28, 15869.5]
  - - [5124, 9124, 1, 4096]
    - [25, 18324.7]
  - - [4096, 64, 1, 4096]
    - [4, 3737.74]
  - - [7680, 32, 1, 2560]
    - [21, 4952.26]
  - - [2560, 64, 1, 2560]
    - [13, 5730.86]
  - - [3072, 128, 1, 1024]
    - [14, 5557.86]
  - - [7680, 64, 1, 2560]
    - [19, 7261.04]
  - - [1760, 128, 1, 1760]
    - [10, 7976.76]
  - - [2560, 1600, 1, 2560]
    - [27, 15334.4]
  - - [2048, 3200, 1, 512]
    - [25, 15486.1]
  - - [2560, 800, 1, 2560]
    - [31, 13479.6]
  - - [3072, 32, 1, 1024]
    - [17, 2198.87]
  - - [6144, 32, 1, 2560]
    - [10, 4832.52]
  - - [4608, 12000, 1, 1536]
    - [31, 22888.0]
  - - [4096, 32, 1, 4096]
    - [2, 2429.59]
  - - [6144, 24000, 1, 2048]
    - [25, 19370.4]
  - - [8192, 800, 1, 2048]
    - [25, 12744.3]
  - - [4096, 1600, 1, 1024]
    - [25, 14905.1]
  - - [5124, 9124, 1, 2048]
    - [25, 17912.2]
  - - [8448, 24000, 1, 2816]
    - [31, 23736.4]
  - - [1024, 48000, 1, 1536]
    - [31, 22758.7]
  - - [7680, 128, 1, 2560]
    - [15, 14038.2]
  - - [8192, 1600, 1, 2048]
    - [25, 13534.6]
  - - [4096, 800, 1, 1024]
    - [25, 12624.5]
  - - [1024, 16, 1, 500000]
    - [6, 1011.53]
  - - [2048, 800, 1, 2048]
    - [24, 8500.04]
  - - [1760, 3200, 1, 1760]
    - [30, 20651.9]
  - - [512, 48000, 1, 2560]
    - [31, 21439.3]
  - - [8448, 16, 1, 2816]
    - [12, 3396.13]
  - - [2048, 64, 1, 2048]
    - [16, 2581.01]
  - - [512, 24000, 1, 2048]
    - [25, 14553.1]
  - - [16384, 1600, 1, 4096]
    - [25, 16481.8]
  - - [4608, 16, 1, 1536]
    - [17, 2355.57]
  - - [1024, 24000, 1, 2048]
    - [25, 16717.5]
  - - [8192, 400, 1, 2048]
    - [24, 9506.03]
  - - [2048, 6400, 1, 2048]
    - [25, 14426.1]
  - - [6144, 12000, 1, 2048]
    - [25, 18841.0]
  - - [512, 8, 1, 500000]
    - [6, 252.613]
  - - [1760, 7000, 1, 1760]
    - [31, 21253.2]
  - - [1024, 48000, 1, 2816]
    - [31, 23807.8]
  - - [6144, 16, 1, 2560]
    - [20, 2565.9]
  - - [8448, 32, 1, 2816]
    - [7, 6150.01]
  - - [4096, 16, 1, 4096]
    - [5, 1460.59]
  - - [6144, 24000, 1, 2560]
    - [31, 22523.3]
  - - [1024, 1024, 1, 1024]
    - [25, 10383.2]
  - - [8448, 12000, 1, 2816]
    - [31, 23707.1]
  - - [16384, 400, 1, 4096]
    - [25, 11660.5]
  - - [1760, 1600, 1, 1760]
    - [30, 19336.8]
  - - [1024, 48000, 1, 2048]
    - [25, 18487.9]
- - - -1
    - - - 128
        - - - 4
            - - [-1, 11]
          - - 64
            - - [1856, 11]
              - [-1, 22]
          - - 128
            - - [704, 11]
              - [-1, 22]
          - - 256
            - - [256, 11]
              - [4288, 22]
              - [5056, 23]
              - [-1, 22]
          - - 448
            - - [128, 11]
              - [2368, 22]
              - [2944, 23]
              - [-1, 22]
          - - 704
            - - [128, 11]
              - [-1, 22]
          - - 1024
            - - [64, 11]
              - [1024, 22]
              - [1408, 23]
              - [2368, 22]
              - [2944, 23]
              - [3584, 22]
              - [-1, 23]
          - - 1408
            - - [64, 11]
              - [704, 22]
              - [1024, 23]
              - [3584, 22]
              - [4288, 23]
              - [5056, 22]
              - [-1, 23]
          - - 1856
            - - [64, 11]
              - [448, 22]
              - [704, 23]
              - [1856, 22]
              - [2368, 23]
              - [5056, 22]
              - [-1, 23]
          - - 2368
            - - [4, 11]
              - [1408, 22]
              - [1856, 23]
              - [2368, 22]
              - [-1, 23]
          - - 2944
            - - [4, 11]
              - [256, 22]
              - [448, 23]
              - [704, 22]
              - [1024, 23]
              - [2368, 22]
              - [-1, 23]
          - - 3584
            - - [4, 11]
              - [1024, 22]
              - [-1, 23]
          - - 4288
            - - [4, 11]
              - [704, 22]
              - [1024, 23]
              - [1408, 22]
              - [-1, 23]
          - - 5056
            - - [4, 11]
              - [128, 22]
              - [256, 23]
              - [1408, 22]
              - [-1, 23]
          - - 5888
            - - [4, 11]
              - [128, 22]
              - [256, 23]
              - [704, 22]
              - [-1, 23]
          - - -1
            - - [4, 11]
              - [704, 22]
              - [-1, 23]
      - - 256
        - - - 4
            - - [704, 6]
              - [1024, 17]
              - [-1, 6]
          - - 64
            - - [1856, 6]
              - [2368, 17]
              - [2944, 7]
              - [5056, 21]
              - [-1, 29]
          - - 128
            - - [256, 6]
              - [448, 17]
              - [1024, 6]
              - [1408, 17]
              - [2944, 7]
              - [5888, 29]
              - [-1, 26]
          - - 256
            - - [256, 6]
              - [448, 17]
              - [704, 29]
              - [1024, 21]
              - [2944, 29]
              - [3584, 26]
              - [5888, 27]
              - [-1, 31]
          - - 448
            - - [128, 6]
              - [256, 18]
              - [1408, 29]
              - [2368, 26]
              - [2944, 27]
              - [3584, 31]
              - [4288, 26]
              - [5056, 27]
              - [5888, 31]
              - [-1, 26]
          - - 704
            - - [64, 6]
              - [128, 18]
              - [256, 21]
              - [1024, 29]
              - [1856, 26]
              - [2368, 31]
              - [4288, 26]
              - [5056, 31]
              - [5888, 26]
              - [-1, 31]
          - - 1024
            - - [128, 6]
              - [704, 29]
              - [1024, 27]
              - [1408, 26]
              - [1856, 31]
              - [2368, 27]
              - [-1, 31]
          - - 1408
            - - [64, 6]
              - [128, 7]
              - [448, 29]
              - [704, 27]
              - [1024, 26]
              - [-1, 31]
          - - 1856
            - - [4, 6]
              - [64, 18]
              - [128, 21]
              - [256, 29]
              - [448, 26]
              - [704, 27]
              - [1024, 26]
              - [-1, 31]
          - - 2368
            - - [4, 6]
              - [64, 18]
              - [128, 19]
              - [256, 29]
              - [448, 26]
              - [704, 31]
              - [1024, 26]
              - [-1, 31]
          - - 2944
            - - [4, 6]
              - [64, 7]
              - [256, 29]
              - [704, 27]
              - [-1, 31]
          - - 3584
            - - [4, 6]
              - [64, 21]
              - [128, 29]
              - [256, 27]
              - [448, 26]
              - [704, 31]
              - [1024, 26]
              - [-1, 31]
          - - 4288
            - - [4, 6]
              - [64, 19]
              - [256, 29]
              - [704, 27]
              - [-1, 31]
          - - 5056
            - - [4, 6]
              - [64, 21]
              - [256, 29]
              - [448, 26]
              - [-1, 31]
          - - 5888
            - - [4, 6]
              - [128, 29]
              - [256, 26]
              - [448, 31]
              - [704, 27]
              - [-1, 31]
          - - -1
            - - [4, 17]
              - [64, 29]
              - [128, 26]
              - [256, 31]
              - [448, 27]
              - [-1, 31]
      - - 1280
        - - - 4
            - - [4, 6]
              - [-1, 17]
          - - 64
            - - [4, 17]
              - [64, 6]
              - [256, 17]
              - [448, 18]
              - [1024, 17]
              - [1856, 18]
              - [2368, 7]
              - [2944, 10]
              - [5888, 7]
              - [-1, 29]
          - - 128
            - - [448, 17]
              - [704, 18]
              - [1024, 17]
              - [1408, 7]
              - [2944, 10]
              - [5888, 29]
              - [-1, 27]
          - - 256
            - - [64, 17]
              - [128, 18]
              - [256, 17]
              - [448, 18]
              - [704, 13]
              - [1024, 21]
              - [2944, 29]
              - [3584, 27]
              - [5056, 29]
              - [5888, 27]
              - [-1, 31]
          - - 448
            - - [4, 17]
              - [64, 18]
              - [128, 17]
              - [256, 18]
              - [1408, 29]
              - [1856, 26]
              - [2368, 29]
              - [2944, 27]
              - [3584, 31]
              - [4288, 26]
              - [5056, 27]
              - [5888, 31]
              - [-1, 26]
          - - 704
            - - [64, 17]
              - [128, 18]
              - [256, 13]
              - [1024, 29]
              - [1408, 26]
              - [1856, 29]
              - [2368, 31]
              - [4288, 26]
              - [5056, 31]
              - [5888, 26]
              - [-1, 31]
          - - 1024
            - - [64, 17]
              - [128, 18]
              - [256, 21]
              - [704, 29]
              - [1408, 27]
              - [1856, 31]
              - [2368, 27]
              - [-1, 31]
          - - 1408
            - - [4, 17]
              - [64, 18]
              - [128, 21]
              - [256, 13]
              - [448, 29]
              - [1024, 27]
              - [1408, 31]
              - [1856, 27]
              - [-1, 31]
          - - 1856
            - - [4, 17]
              - [64, 18]
              - [128, 13]
              - [256, 29]
              - [448, 26]
              - [704, 29]
              - [1024, 31]
              - [1408, 26]
              - [-1, 31]
          - - 2368
            - - [4, 17]
              - [64, 10]
              - [128, 13]
              - [448, 29]
              - [704, 31]
              - [1024, 27]
              - [-1, 31]
          - - 2944
            - - [4, 17]
              - [64, 21]
              - [256, 29]
              - [448, 26]
              - [704, 27]
              - [-1, 31]
          - - 3584
            - - [4, 17]
              - [64, 21]
              - [128, 29]
              - [256, 27]
              - [448, 31]
              - [704, 27]
              - [-1, 31]
          - - 4288
            - - [4, 17]
              - [64, 7]
              - [256, 29]
              - [704, 27]
              - [-1, 31]
          - - 5056
            - - [4, 17]
              - [64, 21]
              - [256, 29]
              - [448, 27]
              - [-1, 31]
          - - 5888
            - - [4, 17]
              - [64, 7]
              - [128, 29]
              - [256, 27]
              - [448, 31]
              - [704, 27]
              - [-1, 31]
          - - -1
            - - [4, 17]
              - [64, 29]
              - [128, 27]
              - [256, 31]
              - [448, 27]
              - [-1, 31]
      - - -1
        - - - 4
            - - [-1, 17]
          - - 64
            - - [256, 17]
              - [448, 18]
              - [1024, 17]
              - [1408, 18]
              - [1856, 17]
              - [2944, 10]
              - [3584, 13]
              - [4288, 10]
              - [5888, 13]
              - [-1, 29]
          - - 128
            - - [704, 17]
              - [1024, 18]
              - [1856, 10]
              - [2368, 19]
              - [2944, 10]
              - [3584, 29]
              - [4288, 19]
              - [5888, 29]
              - [-1, 27]
          - - 256
            - - [128, 17]
              - [256, 18]
              - [448, 17]
              - [1408, 13]
              - [2944, 29]
              - [3584, 15]
              - [5056, 29]
              - [5888, 26]
              - [-1, 31]
          - - 448
            - - [4, 17]
              - [256, 18]
              - [448, 21]
              - [1408, 29]
              - [1856, 31]
              - [2368, 29]
              - [2944, 26]
              - [3584, 31]
              - [4288, 26]
              - [5056, 27]
              - [5888, 31]
              - [-1, 26]
          - - 704
            - - [64, 17]
              - [128, 18]
              - [256, 13]
              - [448, 21]
              - [1024, 29]
              - [1408, 26]
              - [1856, 29]
              - [2368, 31]
              - [4288, 26]
              - [5056, 31]
              - [5888, 26]
              - [-1, 31]
          - - 1024
            - - [128, 17]
              - [256, 13]
              - [704, 29]
              - [1024, 31]
              - [1408, 27]
              - [1856, 31]
              - [2368, 26]
              - [-1, 31]
          - - 1408
            - - [4, 17]
              - [64, 18]
              - [256, 13]
              - [448, 29]
              - [704, 15]
              - [1024, 27]
              - [1408, 31]
              - [1856, 27]
              - [-1, 31]
          - - 1856
            - - [4, 17]
              - [64, 18]
              - [128, 13]
              - [256, 29]
              - [448, 31]
              - [704, 29]
              - [1024, 31]
              - [1408, 26]
              - [-1, 31]
          - - 2368
            - - [4, 17]
              - [64, 10]
              - [128, 13]
              - [448, 29]
              - [704, 31]
              - [1024, 27]
              - [-1, 31]
          - - 2944
            - - [4, 17]
              - [128, 13]
              - [256, 29]
              - [448, 26]
              - [704, 27]
              - [-1, 31]
          - - 3584
            - - [4, 17]
              - [64, 13]
              - [128, 29]
              - [256, 26]
              - [-1, 31]
          - - 4288
            - - [4, 17]
              - [64, 7]
              - [256, 29]
              - [704, 27]
              - [-1, 31]
          - - 5056
            - - [4, 17]
              - [64, 13]
              - [256, 29]
              - [448, 26]
              - [-1, 31]
          - - 5888
            - - [4, 17]
              - [64, 13]
              - [128, 29]
              - [256, 26]
              - [448, 31]
              - [704, 27]
              - [-1, 31]
          - - -1
            - - [4, 17]
              - [64, 29]
              - [128, 27]
              - [256, 31]
              - [448, 27]
              - [-1, 31]
