library/src/blas3/Tensile/Logic/asm_full/vega20_Cijk_Ailk_Bljk_SB.yaml
- {MinimumRequiredVersion: 4.3.0}
- vega20
- gfx906
- [Device 66a0, Device 66a7]
    SolutionIndex: 0
    SolutionNameMin: Cijk_Ailk_Bljk_SB_MT064x008x32_DTL0_GRVW02_LPB00_PBC0_PGR0_TT04_02_USFGRO00_VW02_WG16_04_04
    SolutionIndex: 1
    SolutionNameMin: Cijk_Ailk_Bljk_SB_MT128x008x32_DTL0_GRVW02_LPB00_PBC0_PGR0_TT04_02_USFGRO00_VW02_WG32_04_02
    SolutionIndex: 2
    SolutionNameMin: Cijk_Ailk_Bljk_SB_MT064x008x32_DTL0_GRVW02_LPB00_PBC0_PGR0_TT02_02_USFGRO00_VW02_WG32_04_02
    SolutionIndex: 3
    SolutionNameMin: Cijk_Ailk_Bljk_SB_MT128x016x16_DTL0_GRVW02_LPB00_PBC0_PGR1_TT08_02_USFGRO00_VW02_WG16_08_02
    SolutionIndex: 4
    SolutionNameMin: Cijk_Ailk_Bljk_SB_MT128x008x32_DTL0_GRVW02_LPB00_PBC0_PGR0_TT08_02_USFGRO00_VW02_WG16_04_04
    SolutionIndex: 5
    SolutionNameMin: Cijk_Ailk_Bljk_SB_MT064x004x64_DTL0_GRVW02_LPB00_PBC0_PGR0_TT02_02_USFGRO00_VW02_WG32_02_04
    SolutionIndex: 6
    SolutionNameMin: Cijk_Ailk_Bljk_SB_MT128x016x16_DTL0_GRVW04_LPB00_PBC0_PGR1_TT04_04_USFGRO00_VW04_WG32_04_02
    SolutionIndex: 7
    SolutionNameMin: Cijk_Ailk_Bljk_SB_MT128x008x32_DTL0_GRVW02_LPB00_PBC0_PGR0_TT04_02_USFGRO00_VW02_WG32_04_02
    SolutionIndex: 8
    SolutionNameMin: Cijk_Ailk_Bljk_SB_MT128x008x32_DTL0_GRVW04_LPB00_PBC0_PGR0_TT04_04_USFGRO00_VW04_WG32_02_04
    SolutionIndex: 9
    SolutionNameMin: Cijk_Ailk_Bljk_SB_MT048x096x08_DTL0_GRVW02_LPB00_PBC0_PGR1_TT04_06_USFGRO00_VW02_WG12_16_01
    SolutionIndex: 10
    SolutionNameMin: Cijk_Ailk_Bljk_SB_MT048x024x32_DTL0_GRVW02_LPB00_PBC0_PGR1_TT06_04_USFGRO00_VW02_WG08_06_04
    SolutionIndex: 11
    SolutionNameMin: Cijk_Ailk_Bljk_SB_MT048x036x16_DTL0_GRVW01_LPB00_PBC1_PGR1_TT06_03_USFGRO01_VW01_WG08_12_02
    SolutionIndex: 12
    SolutionNameMin: Cijk_Ailk_Bljk_SB_MT036x048x16_DTL0_GRVW01_LPB00_PBC1_PGR1_TT03_03_USFGRO01_VW01_WG12_16_01
    SolutionIndex: 13
    SolutionNameMin: Cijk_Ailk_Bljk_SB_MT032x016x08_DTL0_GRVW02_LPB00_PBC0_PGR1_TT02_02_USFGRO00_VW02_WG16_08_01
    SolutionIndex: 14
    SolutionNameMin: Cijk_Ailk_Bljk_SB_MT032x008x32_DTL0_GRVW02_LPB00_PBC0_PGR1_TT02_02_USFGRO00_VW02_WG16_04_04
    SolutionIndex: 15
    SolutionNameMin: Cijk_Ailk_Bljk_SB_MT032x016x16_DTL0_GRVW02_LPB00_PBC0_PGR1_TT04_02_USFGRO00_VW02_WG08_08_02
    SolutionIndex: 16
    SolutionNameMin: Cijk_Ailk_Bljk_SB_MT032x008x32_DTL0_GRVW02_LPB00_PBC0_PGR1_TT02_02_USFGRO00_VW02_WG16_04_04
    SolutionIndex: 17
    SolutionNameMin: Cijk_Ailk_Bljk_SB_MT032x032x32_DTL0_GRVW04_LPB00_PBC0_PGR1_TT04_04_USFGRO00_VW04_WG08_08_04
    SolutionIndex: 18
    SolutionNameMin: Cijk_Ailk_Bljk_SB_MT128x016x16_DTL0_GRVW04_LPB00_PBC0_PGR1_TT04_04_USFGRO00_VW04_WG32_04_02
    SolutionIndex: 19
    SolutionNameMin: Cijk_Ailk_Bljk_SB_MT032x008x32_DTL0_GRVW02_LPB00_PBC0_PGR1_TT02_02_USFGRO00_VW02_WG16_04_04
    SolutionIndex: 20
    SolutionNameMin: Cijk_Ailk_Bljk_SB_MT064x032x32_DTL0_GRVW04_LPB00_PBC0_PGR1_TT08_04_USFGRO00_VW04_WG08_08_04
    SolutionIndex: 21
    SolutionNameMin: Cijk_Ailk_Bljk_SB_MT064x016x16_DTL0_GRVW02_LPB00_PBC0_PGR1_TT04_02_USFGRO00_VW02_WG16_08_02
    SolutionIndex: 22
    SolutionNameMin: Cijk_Ailk_Bljk_SB_MT128x032x16_DTL0_GRVW04_LPB00_PBC0_PGR1_TT08_04_USFGRO00_VW04_WG16_08_02
    SolutionIndex: 23
    SolutionNameMin: Cijk_Ailk_Bljk_SB_MT128x032x16_DTL0_GRVW04_LPB00_PBC0_PGR1_TT08_04_USFGRO00_VW04_WG16_08_02
    SolutionIndex: 24
    SolutionNameMin: Cijk_Ailk_Bljk_SB_MT032x032x16_DTL0_GRVW04_LPB00_PBC0_PGR1_TT04_04_USFGRO00_VW04_WG08_08_02
    SolutionIndex: 25
    SolutionNameMin: Cijk_Ailk_Bljk_SB_MT032x032x16_DTL0_GRVW04_LPB00_PBC0_PGR1_TT04_04_USFGRO00_VW04_WG08_08_02
    SolutionIndex: 26
    SolutionNameMin: Cijk_Ailk_Bljk_SB_MT016x016x08_DTL0_GRVW02_LPB00_PBC1_PGR1_TT02_02_USFGRO01_VW02_WG08_08_02
    SolutionIndex: 27
    SolutionNameMin: Cijk_Ailk_Bljk_SB_MT064x016x32_DTL0_GRVW02_LPB00_PBC0_PGR1_TT04_02_USFGRO00_VW02_WG16_08_02
    SolutionIndex: 28
    SolutionNameMin: Cijk_Ailk_Bljk_SB_MT128x032x32_DTL0_GRVW04_LPB00_PBC0_PGR1_TT08_08_USFGRO00_VW04_WG16_04_04
    SolutionIndex: 29
    SolutionNameMin: Cijk_Ailk_Bljk_SB_MT128x032x32_DTL0_GRVW04_LPB00_PBC0_PGR1_TT08_08_USFGRO00_VW04_WG16_04_04
    SolutionIndex: 30
    SolutionNameMin: Cijk_Ailk_Bljk_SB_MT016x016x16_DTL0_GRVW02_LPB00_PBC1_PGR1_TT02_02_USFGRO01_VW02_WG08_08_04
    SolutionIndex: 31
    SolutionNameMin: Cijk_Ailk_Bljk_SB_MT064x032x16_DTL0_GRVW04_LPB00_PBC0_PGR1_TT04_04_USFGRO00_VW04_WG16_08_02
    SolutionIndex: 32
    SolutionNameMin: Cijk_Ailk_Bljk_SB_MT064x032x16_DTL0_GRVW04_LPB00_PBC0_PGR1_TT04_04_USFGRO00_VW04_WG16_08_02
    SolutionIndex: 33
    SolutionNameMin: Cijk_Ailk_Bljk_SB_MT128x016x32_DTL0_GRVW04_LPB00_PBC0_PGR1_TT04_04_USFGRO00_VW04_WG32_04_02
    SolutionIndex: 34
    SolutionNameMin: Cijk_Ailk_Bljk_SB_MT032x016x16_DTL0_GRVW02_LPB00_PBC0_PGR1_TT04_02_USFGRO00_VW02_WG08_08_02
    SolutionIndex: 35
    SolutionNameMin: Cijk_Ailk_Bljk_SB_MT032x008x32_DTL0_GRVW02_LPB00_PBC0_PGR1_TT02_02_USFGRO00_VW02_WG16_04_04
    SolutionIndex: 36
    SolutionNameMin: Cijk_Ailk_Bljk_SB_MT032x008x32_DTL0_GRVW02_LPB00_PBC0_PGR1_TT02_02_USFGRO00_VW02_WG16_04_04
    SolutionIndex: 37
    SolutionNameMin: Cijk_Ailk_Bljk_SB_MT032x016x32_DTL0_GRVW02_LPB00_PBC0_PGR1_TT04_02_USFGRO00_VW02_WG08_08_04
    SolutionIndex: 38
    SolutionNameMin: Cijk_Ailk_Bljk_SB_MT064x032x16_DTL0_GRVW04_LPB00_PBC0_PGR1_TT04_04_USFGRO00_VW04_WG16_08_02
    SolutionIndex: 39
    SolutionNameMin: Cijk_Ailk_Bljk_SB_MT064x032x16_DTL0_GRVW04_LPB00_PBC0_PGR1_TT04_04_USFGRO00_VW04_WG16_08_02
    SolutionIndex: 40
    SolutionNameMin: Cijk_Ailk_Bljk_SB_MT032x016x08_DTL0_GRVW02_LPB00_PBC0_PGR1_TT04_02_USFGRO00_VW02_WG08_08_02
    SolutionIndex: 41
    SolutionNameMin: Cijk_Ailk_Bljk_SB_MT032x016x32_DTL0_GRVW02_LPB00_PBC0_PGR1_TT04_02_USFGRO00_VW02_WG08_08_04
    SolutionIndex: 42
    SolutionNameMin: Cijk_Ailk_Bljk_SB_MT032x016x16_DTL0_GRVW02_LPB00_PBC0_PGR1_TT04_02_USFGRO00_VW02_WG08_08_04
    SolutionIndex: 43
    SolutionNameMin: Cijk_Ailk_Bljk_SB_MT064x064x08_DTL0_GRVW04_LPB00_PBC0_PGR1_TT04_04_USFGRO00_VW04_WG16_16_01
    SolutionIndex: 44
    SolutionNameMin: Cijk_Ailk_Bljk_SB_MT128x096x16_DTL0_GRVW02_LPB00_PBC0_PGR0_TT08_06_USFGRO00_VW02_WG16_16_01
    SolutionIndex: 45
    SolutionNameMin: Cijk_Ailk_Bljk_SB_MT064x064x16_DTL0_GRVW04_LPB00_PBC0_PGR1_TT04_04_USFGRO00_VW04_WG16_16_01
    SolutionIndex: 46
    SolutionNameMin: Cijk_Ailk_Bljk_SB_MT064x128x16_DTL0_GRVW04_LPB00_PBC0_PGR1_TT04_08_USFGRO00_VW04_WG16_16_01
    SolutionIndex: 47
    SolutionNameMin: Cijk_Ailk_Bljk_SB_MT064x064x16_DTL0_GRVW04_LPB00_PBC0_PGR1_TT04_04_USFGRO00_VW04_WG16_16_01
    SolutionIndex: 48
    SolutionNameMin: Cijk_Ailk_Bljk_SB_MT128x064x16_DTL0_GRVW04_LPB00_PBC0_PGR1_TT08_04_USFGRO00_VW04_WG16_16_01
    SolutionIndex: 49
    SolutionNameMin: Cijk_Ailk_Bljk_SB_MT128x064x16_DTL0_GRVW04_LPB00_PBC0_PGR1_TT08_04_USFGRO00_VW04_WG16_16_01
    SolutionIndex: 50
    SolutionNameMin: Cijk_Ailk_Bljk_SB_MT128x064x08_DTL0_GRVW04_LPB00_PBC0_PGR1_TT08_04_USFGRO00_VW04_WG16_16_01
    SolutionIndex: 51
    SolutionNameMin: Cijk_Ailk_Bljk_SB_MT128x064x08_DTL0_GRVW04_LPB00_PBC0_PGR1_TT08_04_USFGRO00_VW04_WG16_16_01
    SolutionIndex: 52
    SolutionNameMin: Cijk_Ailk_Bljk_SB_MT128x128x16_DTL0_GRVW04_LPB00_PBC0_PGR1_TT08_08_USFGRO00_VW04_WG16_16_01
    SolutionIndex: 53
    SolutionNameMin: Cijk_Ailk_Bljk_SB_MT128x128x16_DTL0_GRVW04_LPB00_PBC0_PGR1_TT08_08_USFGRO00_VW04_WG16_16_01
    SolutionIndex: 54
    SolutionNameMin: Cijk_Ailk_Bljk_SB_MT128x128x08_DTL0_GRVW04_LPB00_PBC0_PGR1_TT08_08_USFGRO00_VW04_WG16_16_01
    SolutionIndex: 55
    SolutionNameMin: Cijk_Ailk_Bljk_SB_MT128x064x32_DTL0_GRVW04_LPB00_PBC0_PGR1_TT08_04_USFGRO00_VW04_WG16_16_01
    SolutionIndex: 56
    SolutionNameMin: Cijk_Ailk_Bljk_SB_MT128x064x16_DTL0_GRVW04_LPB00_PBC0_PGR0_TT08_04_USFGRO00_VW04_WG16_16_01
    SolutionIndex: 57
    SolutionNameMin: Cijk_Ailk_Bljk_SB_MT016x016x04_DTL0_GRVW02_LPB00_PBC0_PGR1_TT02_02_USFGRO00_VW02_WG08_08_01
    SolutionIndex: 58
    SolutionNameMin: Cijk_Ailk_Bljk_SB_MT128x064x08_DTL0_GRVW04_LPB04_PBC0_PGR1_TT08_04_USFGRO00_VW04_WG16_16_01
    SolutionIndex: 59
    SolutionNameMin: Cijk_Ailk_Bljk_SB_MT064x128x16_DTL0_GRVW04_LPB04_PBC0_PGR1_TT04_08_USFGRO00_VW04_WG16_16_01
    SolutionIndex: 60
    SolutionNameMin: Cijk_Ailk_Bljk_SB_MT128x064x16_DTL0_GRVW04_LPB04_PBC0_PGR1_TT04_04_USFGRO00_VW04_WG32_16_01
    SolutionIndex: 61
    SolutionNameMin: Cijk_Ailk_Bljk_SB_MT128x032x16_DTL0_GRVW04_LPB04_PBC0_PGR1_TT04_04_USFGRO00_VW04_WG32_08_01
    SolutionIndex: 62
    SolutionNameMin: Cijk_Ailk_Bljk_SB_MT128x064x08_DTL0_GRVW04_LPB04_PBC0_PGR1_TT04_08_USFGRO00_VW04_WG32_08_01
    SolutionIndex: 63
    SolutionNameMin: Cijk_Ailk_Bljk_SB_MT128x064x16_DTL0_GRVW04_LPB04_PBC0_PGR1_TT04_04_USFGRO00_VW04_WG32_16_01
    SolutionIndex: 64
    SolutionNameMin: Cijk_Ailk_Bljk_SB_MT064x064x16_DTL0_GRVW01_LPB02_PBC1_PGR0_TT04_04_USFGRO01_VW02_WG16_16_01
    SolutionIndex: 65
    SolutionNameMin: Cijk_Ailk_Bljk_SB_MT128x032x16_DTL0_GRVW04_LPB04_PBC0_PGR0_TT04_04_USFGRO00_VW04_WG32_08_01
    SolutionIndex: 66
    SolutionNameMin: Cijk_Ailk_Bljk_SB_MT128x032x16_DTL0_GRVW01_LPB02_PBC1_PGR0_TT04_04_USFGRO01_VW02_WG32_08_01
    SolutionIndex: 67
    SolutionNameMin: Cijk_Ailk_Bljk_SB_MT064x064x16_DTL0_GRVW01_LPB04_PBC1_PGR0_TT04_04_USFGRO01_VW04_WG16_16_01
    SolutionIndex: 68
    SolutionNameMin: Cijk_Ailk_Bljk_SB_MT064x064x16_DTL0_GRVW04_LPB04_PBC0_PGR0_TT04_04_USFGRO00_VW04_WG16_16_01
    SolutionIndex: 69
    SolutionNameMin: Cijk_Ailk_Bljk_SB_MT064x064x16_DTL0_GRVW01_LPB04_PBC1_PGR0_TT04_04_USFGRO01_VW01_WG16_16_01
    SolutionIndex: 70
    SolutionNameMin: Cijk_Ailk_Bljk_SB_MT032x128x16_DTL0_GRVW01_LPB04_PBC1_PGR0_TT04_04_USFGRO01_VW04_WG08_32_01
- - - [4096, 7000, 1, 4096]
    - [50, 9006.54]
  - - [5124, 9124, 1, 1760]
    - [50, 9056.38]
  - - [5124, 9124, 1, 2560]
    - [50, 8966.43]
  - - [1760, 32, 1, 1760]
    - [17, 3612.3]
  - - [1024, 1500, 1, 1536]
    - [48, 7818.35]
  - - [512, 24000, 1, 1536]
    - [52, 8840.82]
  - - [3072, 24000, 1, 1024]
    - [50, 9063.97]
  - - [1024, 3000, 1, 2560]
    - [52, 8478.01]
  - - [512, 3136, 1, 2048]
    - [61, 6620.0]
  - - [7680, 4, 1, 2560]
    - [18, 1227.25]
  - - [35, 1500, 1, 2048]
    - [10, 2027.13]
  - - [8448, 1500, 1, 2816]
    - [50, 8922.21]
  - - [784, 512, 64, 128]
    - [68, 7762.72]
  - - [2560, 7000, 1, 2560]
    - [50, 9035.97]
  - - [3072, 16, 1, 1024]
    - [15, 2090.14]
  - - [512, 48000, 1, 2048]
    - [48, 8606.75]
  - - [1760, 64, 1, 1760]
    - [39, 4309.66]
  - - [1024, 16, 1, 512]
    - [14, 1028.02]
  - - [196, 256, 64, 1024]
    - [65, 5407.66]
  - - [512, 48000, 1, 1536]
    - [50, 9073.04]
  - - [2560, 32, 1, 2560]
    - [20, 3566.52]
  - - [4608, 1500, 1, 1536]
    - [52, 8418.45]
  - - [2048, 128, 1, 2048]
    - [23, 5420.67]
  - - [1024, 24000, 1, 2560]
    - [51, 9144.21]
  - - [4608, 3000, 1, 1536]
    - [50, 8900.64]
  - - [5124, 9124, 1, 2048]
    - [50, 8768.54]
  - - [1024, 700, 1, 512]
    - [45, 5628.77]
  - - [3072, 1, 1, 128]
    - [19, 59.2193]
  - - [5124, 700, 1, 2560]
    - [45, 7815.33]
  - - [8448, 16, 1, 2816]
    - [21, 3871.31]
  - - [6144, 6000, 1, 2560]
    - [51, 9164.96]
  - - [4608, 32, 1, 1536]
    - [31, 3574.63]
  - - [35, 8457, 1, 2560]
    - [12, 3791.71]
  - - [3072, 64, 1, 1024]
    - [23, 3387.0]
  - - [512, 16, 1, 512]
    - [16, 663.656]
  - - [7680, 2, 1, 2560]
    - [18, 624.539]
  - - [4224, 1, 1, 128]
    - [40, 77.6828]
  - - [7680, 1, 1, 2560]
    - [18, 311.084]
  - - [128, 1500, 1, 1280]
    - [39, 4426.43]
  - - [35, 8457, 1, 4096]
    - [11, 3771.71]
  - - [1024, 1500, 1, 2816]
    - [50, 8158.51]
  - - [6144, 2, 1, 2560]
    - [1, 543.111]
  - - [8448, 48000, 1, 2816]
    - [51, 9399.0]
  - - [512, 6000, 1, 1536]
    - [52, 8393.56]
  - - [4224, 1500, 1, 176]
    - [51, 7722.44]
  - - [1024, 6000, 1, 2816]
    - [50, 8860.08]
  - - [512, 6000, 1, 2560]
    - [52, 8501.48]
  - - [512, 32, 1, 512]
    - [19, 1127.5]
  - - [2560, 128, 1, 2560]
    - [38, 5481.23]
  - - [4608, 24000, 1, 1536]
    - [50, 9258.34]
  - - [512, 2, 1, 500000]
    - [7, 676.952]
  - - [7680, 48000, 1, 2560]
    - [51, 9379.4]
  - - [3072, 48000, 1, 1024]
    - [50, 9142.88]
  - - [1760, 16, 1, 1760]
    - [27, 2468.21]
  - - [512, 3000, 1, 2816]
    - [50, 8164.67]
  - - [1760, 7000, 1, 1760]
    - [51, 8720.87]
  - - [64, 193600, 1, 256]
    - [59, 6938.87]
  - - [1024, 3000, 1, 2048]
    - [48, 7791.74]
  - - [6144, 4, 1, 2560]
    - [4, 1016.05]
  - - [1024, 6000, 1, 2048]
    - [48, 8205.13]
  - - [512, 24000, 1, 2816]
    - [50, 9023.29]
  - - [6144, 48000, 1, 2560]
    - [51, 9365.88]
  - - [8448, 3000, 1, 2816]
    - [50, 9184.18]
  - - [35, 1500, 1, 2560]
    - [12, 2999.97]
  - - [3072, 4, 1, 1024]
    - [14, 660.867]
  - - [4608, 48000, 1, 1536]
    - [50, 9289.51]
  - - [2048, 32, 1, 2048]
    - [34, 3017.45]
  - - [7680, 1500, 1, 2560]
    - [50, 8741.43]
  - - [4096, 128, 1, 4096]
    - [55, 6409.54]
  - - [4608, 16, 1, 1536]
    - [34, 2865.51]
  - - [1024, 1500, 1, 2048]
    - [49, 6869.5]
  - - [3072, 3000, 1, 1024]
    - [48, 8233.62]
  - - [3072, 2, 1, 1024]
    - [19, 389.323]
  - - [8448, 1, 1, 2816]
    - [2, 313.346]
  - - [1024, 48000, 1, 2560]
    - [51, 9250.97]
  - - [1024, 3000, 1, 2816]
    - [52, 8554.14]
  - - [128, 1, 1, 1408]
    - [36, 28.16]
  - - [35, 8457, 1, 1760]
    - [9, 3937.0]
  - - [1024, 2, 1, 512]
    - [36, 150.657]
  - - [1024, 4, 1, 500000]
    - [3, 1207.99]
  - - [6144, 1, 1, 2560]
    - [1, 276.13]
  - - [1024, 48000, 1, 2816]
    - [54, 9217.85]
  - - [512, 48000, 1, 2816]
    - [50, 9283.88]
  - - [2048, 16, 1, 2048]
    - [41, 2242.91]
  - - [1024, 24000, 1, 1536]
    - [51, 8999.49]
  - - [64, 193600, 1, 64]
    - [47, 7034.91]
  - - [7680, 6000, 1, 2560]
    - [50, 9214.94]
  - - [1760, 128, 1, 1760]
    - [25, 5272.41]
  - - [35, 8457, 1, 2048]
    - [12, 3203.95]
  - - [512, 1500, 1, 2816]
    - [45, 7445.12]
  - - [512, 1, 1, 512]
    - [5, 48.1882]
  - - [512, 16, 1, 500000]
    - [3, 4813.77]
  - - [512, 8, 1, 500000]
    - [7, 2605.29]
  - - [512, 24000, 1, 2560]
    - [52, 8898.78]
  - - [6144, 3000, 1, 2560]
    - [50, 8954.64]
  - - [1024, 24000, 1, 2816]
    - [50, 9263.0]
  - - [2048, 7000, 1, 2048]
    - [52, 8714.15]
  - - [7680, 3000, 1, 2560]
    - [50, 9065.6]
  - - [1024, 4, 1, 512]
    - [16, 323.635]
  - - [5124, 700, 1, 2048]
    - [48, 7266.03]
  - - [5124, 9124, 1, 4096]
    - [51, 8823.78]
  - - [4096, 64, 1, 4096]
    - [23, 6310.1]
  - - [256, 193600, 1, 64]
    - [62, 7964.79]
  - - [512, 6000, 1, 2048]
    - [48, 7166.22]
  - - [7680, 32, 1, 2560]
    - [23, 5795.29]
  - - [2560, 64, 1, 2560]
    - [38, 4631.44]
  - - [3136, 2048, 1, 512]
    - [65, 7887.85]
  - - [3072, 128, 1, 1024]
    - [49, 4493.85]
  - - [8448, 6000, 1, 2816]
    - [51, 9311.77]
  - - [7680, 64, 1, 2560]
    - [22, 6012.39]
  - - [5124, 1500, 1, 2560]
    - [52, 8282.21]
  - - [1024, 1500, 1, 2560]
    - [48, 7954.57]
  - - [3025, 64, 64, 64]
    - [67, 6859.65]
  - - [512, 4, 1, 512]
    - [16, 187.246]
  - - [1024, 6000, 1, 2560]
    - [52, 8738.01]
  - - [3072, 32, 1, 1024]
    - [28, 2583.73]
  - - [35, 700, 1, 2560]
    - [10, 2252.83]
  - - [3136, 512, 1, 2048]
    - [66, 5803.95]
  - - [196, 1024, 64, 256]
    - [70, 6528.52]
  - - [512, 50176, 1, 128]
    - [58, 8513.59]
  - - [4608, 1, 1, 1536]
    - [0, 252.782]
  - - [49, 512, 64, 2048]
    - [69, 3368.59]
  - - [4096, 32, 1, 4096]
    - [29, 5210.24]
  - - [7680, 24000, 1, 2560]
    - [51, 9362.45]
  - - [8448, 4, 1, 2816]
    - [0, 1203.91]
  - - [64, 1, 1, 1216]
    - [30, 11.7205]
  - - [512, 1, 1, 500000]
    - [8, 340.965]
  - - [176, 1500, 1, 1408]
    - [24, 4623.23]
  - - [512, 3000, 1, 1536]
    - [49, 7847.47]
  - - [8448, 24000, 1, 2816]
    - [51, 9390.43]
  - - [4608, 2, 1, 1536]
    - [2, 479.524]
  - - [1024, 48000, 1, 1536]
    - [52, 9162.54]
  - - [7680, 128, 1, 2560]
    - [48, 7464.83]
  - - [3072, 6000, 1, 1024]
    - [53, 8628.71]
  - - [3072, 1500, 1, 128]
    - [51, 7082.34]
  - - [2048, 3136, 1, 512]
    - [60, 8094.44]
  - - [3025, 256, 64, 64]
    - [67, 7578.12]
  - - [1024, 3000, 1, 1536]
    - [52, 8385.21]
  - - [512, 4, 1, 500000]
    - [7, 1336.24]
  - - [35, 700, 1, 2048]
    - [10, 1966.11]
  - - [1024, 16, 1, 500000]
    - [3, 4575.86]
  - - [512, 24000, 1, 2048]
    - [48, 8365.73]
  - - [128, 50176, 1, 512]
    - [63, 7620.25]
  - - [1024, 32, 1, 512]
    - [37, 1530.77]
  - - [256, 12544, 1, 1024]
    - [61, 7112.58]
  - - [1024, 12544, 1, 256]
    - [62, 8397.05]
  - - [512, 48000, 1, 2560]
    - [51, 9195.97]
  - - [2560, 16, 1, 2560]
    - [42, 2730.63]
  - - [2048, 64, 1, 2048]
    - [38, 3901.62]
  - - [512, 2, 1, 512]
    - [16, 91.0222]
  - - [1024, 1, 1, 512]
    - [16, 77.1012]
  - - [512, 1500, 1, 2560]
    - [47, 6952.09]
  - - [6144, 32, 1, 2560]
    - [23, 4375.09]
  - - [1024, 1, 1, 500000]
    - [4, 304.265]
  - - [6144, 16, 1, 2560]
    - [18, 3472.06]
  - - [1024, 24000, 1, 2048]
    - [52, 8813.16]
  - - [4096, 16, 1, 4096]
    - [33, 3524.58]
  - - [5124, 1500, 1, 2048]
    - [52, 7962.72]
  - - [3072, 1500, 1, 1024]
    - [48, 7792.52]
  - - [1024, 2, 1, 500000]
    - [6, 608.559]
  - - [1024, 8, 1, 500000]
    - [3, 2429.61]
  - - [7680, 16, 1, 2560]
    - [18, 4237.16]
  - - [6144, 1500, 1, 2560]
    - [52, 8833.8]
  - - [3072, 1, 1, 1024]
    - [19, 198.594]
  - - [512, 6000, 1, 2816]
    - [51, 8630.6]
  - - [8448, 2, 1, 2816]
    - [0, 615.027]
  - - [4608, 4, 1, 1536]
    - [5, 912.084]
  - - [1024, 6000, 1, 1536]
    - [53, 8612.33]
  - - [8448, 32, 1, 2816]
    - [32, 5333.91]
  - - [512, 3000, 1, 2048]
    - [56, 6241.43]
  - - [6144, 24000, 1, 2560]
    - [51, 9324.89]
  - - [512, 3000, 1, 2560]
    - [49, 7979.11]
  - - [4608, 6000, 1, 1536]
    - [50, 9166.22]
  - - [1024, 1024, 1, 1024]
    - [48, 5928.26]
  - - [512, 1500, 1, 2048]
    - [48, 5723.58]
  - - [512, 1500, 1, 1536]
    - [45, 6524.51]
  - - [128, 1, 1, 1024]
    - [35, 19.9805]
  - - [49, 2048, 64, 512]
    - [64, 5471.73]
  - - [1024, 48000, 1, 2048]
    - [52, 9092.29]
- - - -1
    - - - 128
        - - - 4
            - - [-1, 57]
          - - 64
            - - [4, 57]
              - [5888, 13]
              - [-1, 43]
          - - 128
            - - [4, 57]
              - [2944, 13]
              - [3584, 43]
              - [-1, 13]
          - - 256
            - - [4, 57]
              - [448, 13]
              - [4288, 43]
              - [5888, 44]
              - [-1, 43]
          - - 448
            - - [4, 57]
              - [448, 13]
              - [-1, 43]
          - - 704
            - - [4, 57]
              - [128, 13]
              - [-1, 43]
          - - 1024
            - - [4, 57]
              - [128, 13]
              - [704, 43]
              - [-1, 44]
          - - 1408
            - - [4, 57]
              - [128, 13]
              - [704, 43]
              - [1024, 44]
              - [3584, 43]
              - [4288, 44]
              - [5056, 43]
              - [-1, 44]
          - - 1856
            - - [4, 57]
              - [128, 13]
              - [1408, 43]
              - [1856, 44]
              - [2944, 43]
              - [3584, 44]
              - [5888, 43]
              - [-1, 44]
          - - 2368
            - - [4, 57]
              - [128, 13]
              - [4288, 43]
              - [-1, 44]
          - - 2944
            - - [4, 57]
              - [128, 13]
              - [256, 43]
              - [448, 44]
              - [704, 43]
              - [1024, 44]
              - [1856, 43]
              - [2368, 44]
              - [2944, 43]
              - [-1, 44]
          - - 3584
            - - [4, 57]
              - [64, 13]
              - [704, 43]
              - [-1, 44]
          - - 4288
            - - [4, 57]
              - [128, 13]
              - [704, 43]
              - [1408, 44]
              - [2368, 43]
              - [-1, 44]
          - - 5056
            - - [4, 57]
              - [128, 13]
              - [1856, 43]
              - [-1, 44]
          - - 5888
            - - [4, 57]
              - [64, 13]
              - [448, 43]
              - [-1, 44]
          - - -1
            - - [4, 57]
              - [1024, 43]
              - [-1, 44]
      - - 256
        - - - 4
            - - [448, 30]
              - [-1, 26]
          - - 64
            - - [4, 30]
              - [448, 19]
              - [1024, 37]
              - [1856, 34]
              - [2368, 47]
              - [2944, 45]
              - [5888, 47]
              - [-1, 45]
          - - 128
            - - [4, 26]
              - [256, 19]
              - [448, 37]
              - [704, 34]
              - [1408, 47]
              - [1856, 45]
              - [5888, 47]
              - [-1, 45]
          - - 256
            - - [4, 30]
              - [128, 19]
              - [448, 34]
              - [704, 47]
              - [1408, 45]
              - [1856, 47]
              - [2368, 45]
              - [5056, 47]
              - [5888, 50]
              - [-1, 47]
          - - 448
            - - [4, 30]
              - [64, 37]
              - [128, 34]
              - [256, 47]
              - [448, 45]
              - [3584, 47]
              - [4288, 45]
              - [-1, 47]
          - - 704
            - - [4, 26]
              - [64, 34]
              - [128, 19]
              - [448, 47]
              - [2368, 45]
              - [2944, 47]
              - [3584, 45]
              - [4288, 47]
              - [-1, 45]
          - - 1024
            - - [4, 26]
              - [64, 19]
              - [128, 47]
              - [256, 45]
              - [448, 47]
              - [704, 45]
              - [1408, 48]
              - [1856, 50]
              - [2368, 48]
              - [2944, 52]
              - [-1, 50]
          - - 1408
            - - [4, 26]
              - [64, 34]
              - [128, 47]
              - [256, 45]
              - [448, 47]
              - [704, 48]
              - [1024, 51]
              - [1856, 50]
              - [2368, 45]
              - [-1, 50]
          - - 1856
            - - [4, 26]
              - [64, 34]
              - [448, 47]
              - [1408, 45]
              - [1856, 50]
              - [2368, 45]
              - [2944, 50]
              - [3584, 45]
              - [5056, 51]
              - [-1, 50]
          - - 2368
            - - [4, 26]
              - [128, 47]
              - [704, 45]
              - [1024, 50]
              - [1856, 45]
              - [5888, 50]
              - [-1, 51]
          - - 2944
            - - [4, 26]
              - [128, 47]
              - [256, 45]
              - [448, 51]
              - [2944, 50]
              - [3584, 51]
              - [-1, 50]
          - - 3584
            - - [4, 26]
              - [128, 47]
              - [448, 45]
              - [1024, 50]
              - [1408, 52]
              - [2368, 50]
              - [2944, 51]
              - [3584, 50]
              - [-1, 51]
          - - 4288
            - - [4, 26]
              - [64, 47]
              - [448, 45]
              - [704, 50]
              - [1024, 45]
              - [-1, 50]
          - - 5056
            - - [4, 26]
              - [64, 45]
              - [128, 47]
              - [256, 45]
              - [448, 47]
              - [-1, 50]
          - - 5888
            - - [4, 26]
              - [64, 47]
              - [128, 45]
              - [256, 50]
              - [448, 45]
              - [-1, 50]
          - - -1
            - - [4, 26]
              - [128, 45]
              - [256, 47]
              - [448, 48]
              - [-1, 50]
      - - 1280
        - - - 4
            - - [-1, 30]
          - - 64
            - - [4, 30]
              - [64, 35]
              - [128, 16]
              - [256, 19]
              - [704, 15]
              - [1408, 17]
              - [2368, 24]
              - [2944, 39]
              - [3584, 24]
              - [5056, 17]
              - [5888, 47]
              - [-1, 45]
          - - 128
            - - [4, 30]
              - [64, 14]
              - [128, 19]
              - [256, 42]
              - [448, 15]
              - [704, 17]
              - [1408, 39]
              - [1856, 47]
              - [2368, 39]
              - [2944, 47]
              - [3584, 45]
              - [4288, 38]
              - [5056, 47]
              - [5888, 45]
              - [-1, 48]
          - - 256
            - - [4, 30]
              - [64, 42]
              - [128, 17]
              - [256, 34]
              - [448, 39]
              - [1024, 47]
              - [1408, 45]
              - [2944, 47]
              - [3584, 48]
              - [4288, 45]
              - [5056, 47]
              - [5888, 51]
              - [-1, 47]
          - - 448
            - - [4, 30]
              - [64, 15]
              - [128, 17]
              - [256, 24]
              - [448, 25]
              - [704, 47]
              - [1024, 45]
              - [1408, 47]
              - [1856, 49]
              - [2368, 47]
              - [2944, 50]
              - [3584, 47]
              - [4288, 46]
              - [5056, 45]
              - [5888, 47]
              - [-1, 46]
          - - 704
            - - [4, 30]
              - [64, 42]
              - [128, 17]
              - [256, 45]
              - [448, 47]
              - [704, 45]
              - [1024, 47]
              - [2368, 45]
              - [5888, 46]
              - [-1, 50]
          - - 1024
            - - [4, 30]
              - [64, 33]
              - [128, 28]
              - [704, 45]
              - [1024, 48]
              - [2944, 50]
              - [3584, 51]
              - [4288, 50]
              - [5056, 53]
              - [5888, 50]
              - [-1, 52]
          - - 1408
            - - [4, 30]
              - [64, 17]
              - [128, 38]
              - [256, 45]
              - [448, 47]
              - [704, 48]
              - [1024, 51]
              - [1408, 52]
              - [5056, 50]
              - [5888, 51]
              - [-1, 50]
          - - 1856
            - - [4, 30]
              - [64, 39]
              - [128, 45]
              - [256, 47]
              - [448, 48]
              - [704, 45]
              - [1024, 50]
              - [1408, 46]
              - [2944, 50]
              - [3584, 46]
              - [-1, 51]
          - - 2368
            - - [4, 26]
              - [64, 25]
              - [128, 38]
              - [256, 45]
              - [448, 47]
              - [704, 45]
              - [2368, 50]
              - [-1, 51]
          - - 2944
            - - [4, 26]
              - [64, 38]
              - [256, 47]
              - [448, 51]
              - [1024, 50]
              - [1408, 52]
              - [2368, 50]
              - [-1, 51]
          - - 3584
            - - [4, 26]
              - [64, 45]
              - [128, 47]
              - [256, 49]
              - [448, 45]
              - [704, 50]
              - [1024, 51]
              - [1856, 50]
              - [3584, 51]
              - [4288, 50]
              - [-1, 51]
          - - 4288
            - - [4, 30]
              - [64, 25]
              - [128, 45]
              - [256, 47]
              - [448, 51]
              - [1408, 50]
              - [-1, 51]
          - - 5056
            - - [4, 30]
              - [64, 38]
              - [128, 47]
              - [448, 45]
              - [704, 50]
              - [-1, 51]
          - - 5888
            - - [4, 26]
              - [64, 47]
              - [128, 45]
              - [256, 50]
              - [448, 47]
              - [-1, 51]
          - - -1
            - - [4, 26]
              - [64, 47]
              - [128, 48]
              - [256, 45]
              - [704, 50]
              - [-1, 51]
      - - -1
        - - - 4
            - - [-1, 30]
          - - 64
            - - [4, 30]
              - [64, 35]
              - [128, 16]
              - [256, 41]
              - [448, 27]
              - [704, 32]
              - [1408, 17]
              - [1856, 39]
              - [2368, 24]
              - [3584, 38]
              - [4288, 32]
              - [5056, 39]
              - [5888, 38]
              - [-1, 47]
          - - 128
            - - [4, 30]
              - [64, 16]
              - [128, 41]
              - [256, 27]
              - [704, 17]
              - [1408, 20]
              - [1856, 23]
              - [2368, 39]
              - [2944, 23]
              - [3584, 47]
              - [4288, 32]
              - [5056, 23]
              - [5888, 47]
              - [-1, 48]
          - - 256
            - - [4, 30]
              - [64, 41]
              - [128, 27]
              - [256, 17]
              - [448, 20]
              - [1856, 47]
              - [2368, 45]
              - [2944, 47]
              - [3584, 48]
              - [4288, 47]
              - [5056, 45]
              - [5888, 51]
              - [-1, 47]
          - - 448
            - - [4, 30]
              - [64, 27]
              - [128, 32]
              - [256, 20]
              - [448, 24]
              - [1024, 47]
              - [1408, 45]
              - [1856, 48]
              - [2368, 47]
              - [2944, 51]
              - [3584, 45]
              - [4288, 46]
              - [5888, 47]
              - [-1, 46]
          - - 704
            - - [4, 30]
              - [64, 31]
              - [128, 32]
              - [256, 45]
              - [704, 47]
              - [1024, 45]
              - [1408, 46]
              - [2368, 45]
              - [5888, 46]
              - [-1, 51]
          - - 1024
            - - [4, 30]
              - [64, 33]
              - [128, 28]
              - [704, 45]
              - [1024, 48]
              - [1408, 50]
              - [1856, 52]
              - [4288, 50]
              - [5056, 51]
              - [-1, 50]
          - - 1408
            - - [4, 30]
              - [64, 31]
              - [128, 20]
              - [448, 47]
              - [704, 48]
              - [1024, 51]
              - [1408, 52]
              - [1856, 51]
              - [5056, 50]
              - [5888, 51]
              - [-1, 50]
          - - 1856
            - - [4, 30]
              - [64, 20]
              - [128, 23]
              - [256, 47]
              - [448, 48]
              - [704, 45]
              - [1024, 52]
              - [1408, 46]
              - [1856, 50]
              - [-1, 51]
          - - 2368
            - - [4, 26]
              - [64, 31]
              - [128, 20]
              - [448, 47]
              - [704, 45]
              - [1408, 51]
              - [1856, 50]
              - [-1, 51]
          - - 2944
            - - [4, 26]
              - [64, 20]
              - [128, 25]
              - [256, 45]
              - [448, 51]
              - [1408, 50]
              - [-1, 51]
          - - 3584
            - - [4, 26]
              - [64, 22]
              - [128, 45]
              - [256, 48]
              - [448, 45]
              - [-1, 51]
          - - 4288
            - - [4, 26]
              - [64, 31]
              - [128, 25]
              - [256, 47]
              - [-1, 51]
          - - 5056
            - - [4, 26]
              - [64, 20]
              - [128, 22]
              - [448, 45]
              - [-1, 51]
          - - 5888
            - - [4, 26]
              - [64, 22]
              - [128, 47]
              - [-1, 51]
          - - -1
            - - [4, 26]
              - [64, 47]
              - [128, 48]
              - [256, 47]
              - [-1, 51]
