library/src/blas3/Tensile/Logic/asm_full/vega10_Cijk_Ailk_Bljk_SB.yaml
- {MinimumRequiredVersion: 4.2.0}
- vega10
- gfx900
- [Device 6863, Device 6862, Device 687f, Device 6860]
- - - [4096, 7000, 1, 4096]
    - [54, 11219.6]
  - - [5124, 9124, 1, 1760]
    - [56, 10965.1]
  - - [5124, 9124, 1, 2560]
    - [52, 11073.6]
  - - [1760, 32, 1, 1760]
    - [17, 3818.89]
  - - [1024, 1500, 1, 1536]
    - [50, 9425.23]
  - - [512, 24000, 1, 1536]
    - [53, 10995.3]
  - - [3072, 24000, 1, 1024]
    - [54, 11242.2]
  - - [1024, 3000, 1, 2560]
    - [54, 10428.0]
  - - [512, 3136, 1, 2048]
    - [60, 1491550.0]
  - - [7680, 4, 1, 2560]
    - [24, 815.554]
  - - [35, 1500, 1, 2048]
    - [11, 2340.53]
  - - [8448, 1500, 1, 2816]
    - [52, 10943.9]
  - - [784, 512, 64, 128]
    - [67, 9185.76]
  - - [2560, 7000, 1, 2560]
    - [52, 11264.8]
  - - [3072, 16, 1, 1024]
    - [37, 2268.52]
  - - [512, 48000, 1, 2048]
    - [50, 10710.7]
  - - [1760, 64, 1, 1760]
    - [29, 5143.51]
  - - [1024, 16, 1, 512]
    - [22, 893.652]
  - - [196, 256, 64, 1024]
    - [70, 6112.51]
  - - [512, 48000, 1, 1536]
    - [52, 11319.3]
  - - [2560, 32, 1, 2560]
    - [18, 4414.71]
  - - [4608, 1500, 1, 1536]
    - [54, 10238.3]
  - - [2048, 128, 1, 2048]
    - [27, 6657.47]
  - - [1024, 24000, 1, 2560]
    - [53, 11379.4]
  - - [4608, 3000, 1, 1536]
    - [52, 10701.8]
  - - [5124, 9124, 1, 2048]
    - [54, 10888.9]
  - - [1024, 700, 1, 512]
    - [47, 6685.03]
  - - [3072, 1, 1, 128]
    - [21, 56.4226]
  - - [5124, 700, 1, 2560]
    - [47, 9443.53]
  - - [8448, 16, 1, 2816]
    - [43, 2859.25]
  - - [6144, 6000, 1, 2560]
    - [54, 11223.9]
  - - [4608, 32, 1, 1536]
    - [39, 4405.21]
  - - [35, 8457, 1, 2560]
    - [14, 4117.3]
  - - [3072, 64, 1, 1024]
    - [33, 4219.2]
  - - [512, 16, 1, 512]
    - [15, 561.721]
  - - [7680, 2, 1, 2560]
    - [31, 411.725]
  - - [4224, 1, 1, 128]
    - [21, 64.9859]
  - - [7680, 1, 1, 2560]
    - [20, 206.324]
  - - [128, 1500, 1, 1280]
    - [39, 5574.06]
  - - [35, 8457, 1, 4096]
    - [13, 4078.69]
  - - [1024, 1500, 1, 2816]
    - [52, 9951.6]
  - - [6144, 2, 1, 2560]
    - [19, 399.602]
  - - [8448, 48000, 1, 2816]
    - [56, 11442.1]
  - - [512, 6000, 1, 1536]
    - [54, 10076.5]
  - - [4224, 1500, 1, 176]
    - [53, 9159.58]
  - - [1024, 6000, 1, 2816]
    - [54, 10858.1]
  - - [512, 6000, 1, 2560]
    - [55, 10322.9]
  - - [512, 32, 1, 512]
    - [22, 982.972]
  - - [2560, 128, 1, 2560]
    - [23, 6627.08]
  - - [4608, 24000, 1, 1536]
    - [56, 11434.0]
  - - [512, 2, 1, 500000]
    - [0, 442.386]
  - - [7680, 48000, 1, 2560]
    - [56, 11519.1]
  - - [3072, 48000, 1, 1024]
    - [54, 11391.0]
  - - [1760, 16, 1, 1760]
    - [45, 2248.21]
  - - [512, 3000, 1, 2816]
    - [52, 9936.97]
  - - [1760, 7000, 1, 1760]
    - [53, 10854.1]
  - - [64, 193600, 1, 256]
    - [62, 557561.0]
  - - [1024, 3000, 1, 2048]
    - [51, 9743.55]
  - - [6144, 4, 1, 2560]
    - [19, 792.752]
  - - [1024, 6000, 1, 2048]
    - [51, 10338.5]
  - - [512, 24000, 1, 2816]
    - [55, 10988.0]
  - - [6144, 48000, 1, 2560]
    - [56, 11210.0]
  - - [8448, 3000, 1, 2816]
    - [52, 11169.1]
  - - [35, 1500, 1, 2560]
    - [14, 3171.08]
  - - [3072, 4, 1, 1024]
    - [22, 616.534]
  - - [4608, 48000, 1, 1536]
    - [54, 11409.0]
  - - [2048, 32, 1, 2048]
    - [17, 3588.19]
  - - [7680, 1500, 1, 2560]
    - [52, 10926.3]
  - - [4096, 128, 1, 4096]
    - [50, 7860.02]
  - - [4608, 16, 1, 1536]
    - [34, 2708.32]
  - - [1024, 1500, 1, 2048]
    - [51, 8961.86]
  - - [3072, 3000, 1, 1024]
    - [54, 10138.8]
  - - [3072, 2, 1, 1024]
    - [3, 300.921]
  - - [8448, 1, 1, 2816]
    - [1, 203.364]
  - - [1024, 48000, 1, 2560]
    - [53, 11519.4]
  - - [1024, 3000, 1, 2816]
    - [54, 10550.6]
  - - [128, 1, 1, 1408]
    - [36, 25.342]
  - - [35, 8457, 1, 1760]
    - [10, 4301.67]
  - - [1024, 2, 1, 512]
    - [15, 128.215]
  - - [1024, 4, 1, 500000]
    - [4, 882.252]
  - - [6144, 1, 1, 2560]
    - [19, 201.622]
  - - [1024, 48000, 1, 2816]
    - [54, 11486.1]
  - - [512, 48000, 1, 2816]
    - [52, 11523.4]
  - - [2048, 16, 1, 2048]
    - [25, 2353.35]
  - - [1024, 24000, 1, 1536]
    - [53, 11209.3]
  - - [64, 193600, 1, 64]
    - [60, 139378.0]
  - - [7680, 6000, 1, 2560]
    - [56, 11272.2]
  - - [1760, 128, 1, 1760]
    - [30, 6060.4]
  - - [35, 8457, 1, 2048]
    - [14, 3675.93]
  - - [512, 1500, 1, 2816]
    - [47, 9000.31]
  - - [512, 1, 1, 512]
    - [36, 38.0025]
  - - [512, 16, 1, 500000]
    - [7, 3349.93]
  - - [512, 8, 1, 500000]
    - [0, 1743.3]
  - - [512, 24000, 1, 2560]
    - [54, 10801.6]
  - - [6144, 3000, 1, 2560]
    - [54, 11131.3]
  - - [1024, 24000, 1, 2816]
    - [54, 11171.8]
  - - [2048, 7000, 1, 2048]
    - [54, 10898.8]
  - - [7680, 3000, 1, 2560]
    - [52, 11319.6]
  - - [1024, 4, 1, 512]
    - [36, 268.09]
  - - [5124, 700, 1, 2048]
    - [55, 8918.77]
  - - [5124, 9124, 1, 4096]
    - [54, 10951.9]
  - - [4096, 64, 1, 4096]
    - [35, 7269.71]
  - - [256, 193600, 1, 64]
    - [60, 177707.0]
  - - [512, 6000, 1, 2048]
    - [50, 9088.92]
  - - [7680, 32, 1, 2560]
    - [27, 5824.34]
  - - [2560, 64, 1, 2560]
    - [38, 5638.71]
  - - [3136, 2048, 1, 512]
    - [64, 9427.34]
  - - [3072, 128, 1, 1024]
    - [51, 5418.33]
  - - [8448, 6000, 1, 2816]
    - [54, 11353.9]
  - - [7680, 64, 1, 2560]
    - [27, 7066.43]
  - - [5124, 1500, 1, 2560]
    - [54, 10218.6]
  - - [1024, 1500, 1, 2560]
    - [50, 9729.84]
  - - [3025, 64, 64, 64]
    - [65, 5376.62]
  - - [512, 4, 1, 512]
    - [8, 152.01]
  - - [1024, 6000, 1, 2560]
    - [54, 10801.9]
  - - [3072, 32, 1, 1024]
    - [19, 3090.68]
  - - [35, 700, 1, 2560]
    - [12, 2416.4]
  - - [3136, 512, 1, 2048]
    - [63, 7105.26]
  - - [196, 1024, 64, 256]
    - [66, 7679.97]
  - - [512, 50176, 1, 128]
    - [62, 325650.0]
  - - [4608, 1, 1, 1536]
    - [2, 187.087]
  - - [49, 512, 64, 2048]
    - [68, 3417.17]
  - - [4096, 32, 1, 4096]
    - [19, 5526.77]
  - - [7680, 24000, 1, 2560]
    - [56, 11356.5]
  - - [8448, 4, 1, 2816]
    - [41, 791.327]
  - - [64, 1, 1, 1216]
    - [32, 11.5201]
  - - [512, 1, 1, 500000]
    - [0, 221.793]
  - - [176, 1500, 1, 1408]
    - [29, 5439.23]
  - - [512, 3000, 1, 1536]
    - [51, 9316.71]
  - - [8448, 24000, 1, 2816]
    - [56, 11353.9]
  - - [4608, 2, 1, 1536]
    - [9, 366.596]
  - - [1024, 48000, 1, 1536]
    - [54, 11415.3]
  - - [7680, 128, 1, 2560]
    - [51, 9172.75]
  - - [3072, 6000, 1, 1024]
    - [54, 10700.0]
  - - [3072, 1500, 1, 128]
    - [47, 7766.11]
  - - [2048, 3136, 1, 512]
    - [61, 872478.0]
  - - [3025, 256, 64, 64]
    - [64, 8280.0]
  - - [1024, 3000, 1, 1536]
    - [55, 10230.3]
  - - [512, 4, 1, 500000]
    - [0, 880.93]
  - - [35, 700, 1, 2048]
    - [11, 1881.55]
  - - [1024, 16, 1, 500000]
    - [6, 3434.12]
  - - [512, 24000, 1, 2048]
    - [50, 10385.8]
  - - [128, 50176, 1, 512]
    - [60, 872478.0]
  - - [1024, 32, 1, 512]
    - [37, 1562.4]
  - - [256, 12544, 1, 1024]
    - [60, 1216820.0]
  - - [1024, 12544, 1, 256]
    - [59, 557148.0]
  - - [512, 48000, 1, 2560]
    - [53, 11540.3]
  - - [2560, 16, 1, 2560]
    - [28, 2628.39]
  - - [2048, 64, 1, 2048]
    - [26, 4915.1]
  - - [512, 2, 1, 512]
    - [8, 77.6033]
  - - [1024, 1, 1, 512]
    - [16, 66.4194]
  - - [512, 1500, 1, 2560]
    - [47, 8567.51]
  - - [6144, 32, 1, 2560]
    - [27, 5564.24]
  - - [1024, 1, 1, 500000]
    - [5, 222.437]
  - - [6144, 16, 1, 2560]
    - [44, 3029.85]
  - - [1024, 24000, 1, 2048]
    - [54, 10984.1]
  - - [4096, 16, 1, 4096]
    - [37, 3117.07]
  - - [5124, 1500, 1, 2048]
    - [54, 9910.05]
  - - [3072, 1500, 1, 1024]
    - [51, 9692.3]
  - - [1024, 2, 1, 500000]
    - [4, 443.272]
  - - [1024, 8, 1, 500000]
    - [4, 1753.33]
  - - [7680, 16, 1, 2560]
    - [42, 3110.82]
  - - [6144, 1500, 1, 2560]
    - [54, 10979.9]
  - - [3072, 1, 1, 1024]
    - [2, 156.31]
  - - [512, 6000, 1, 2816]
    - [54, 10516.8]
  - - [8448, 2, 1, 2816]
    - [40, 400.158]
  - - [4608, 4, 1, 1536]
    - [24, 722.54]
  - - [1024, 6000, 1, 1536]
    - [55, 10556.6]
  - - [8448, 32, 1, 2816]
    - [23, 5049.55]
  - - [512, 3000, 1, 2048]
    - [51, 7930.4]
  - - [6144, 24000, 1, 2560]
    - [54, 11414.1]
  - - [512, 3000, 1, 2560]
    - [50, 9639.94]
  - - [4608, 6000, 1, 1536]
    - [54, 11122.4]
  - - [1024, 1024, 1, 1024]
    - [51, 8010.15]
  - - [512, 1500, 1, 2048]
    - [50, 7041.67]
  - - [512, 1500, 1, 1536]
    - [49, 8467.8]
  - - [128, 1, 1, 1024]
    - [36, 19.6084]
  - - [49, 2048, 64, 512]
    - [69, 5057.54]
  - - [1024, 48000, 1, 2048]
    - [54, 11337.2]
- - - -1
    - - - -1
        - - - 4
            - - [-1, 57]
          - - 64
            - - [4, 57]
              - [128, 36]
              - [256, 45]
              - [704, 43]
              - [1408, 17]
              - [1856, 23]
              - [2368, 29]
              - [2944, 38]
              - [3584, 33]
              - [4288, 39]
              - [5056, 23]
              - [5888, 38]
              - [-1, 47]
          - - 128
            - - [4, 57]
              - [64, 36]
              - [128, 45]
              - [256, 43]
              - [704, 17]
              - [1024, 23]
              - [1408, 39]
              - [1856, 26]
              - [2368, 23]
              - [2944, 26]
              - [3584, 47]
              - [4288, 38]
              - [5056, 26]
              - [5888, 47]
              - [-1, 50]
          - - 256
            - - [4, 57]
              - [64, 45]
              - [128, 43]
              - [448, 23]
              - [704, 49]
              - [1024, 47]
              - [2944, 49]
              - [3584, 50]
              - [5056, 47]
              - [5888, 53]
              - [-1, 49]
          - - 448
            - - [4, 57]
              - [64, 43]
              - [128, 18]
              - [256, 29]
              - [448, 30]
              - [704, 49]
              - [1024, 47]
              - [1408, 49]
              - [1856, 50]
              - [2368, 47]
              - [2944, 46]
              - [3584, 47]
              - [4288, 46]
              - [5056, 47]
              - [5888, 52]
              - [-1, 48]
          - - 704
            - - [4, 57]
              - [64, 43]
              - [128, 18]
              - [448, 49]
              - [1024, 47]
              - [1408, 46]
              - [2368, 49]
              - [2944, 48]
              - [5888, 46]
              - [-1, 53]
          - - 1024
            - - [4, 57]
              - [64, 17]
              - [128, 27]
              - [256, 47]
              - [704, 49]
              - [1024, 50]
              - [1408, 53]
              - [4288, 52]
              - [-1, 54]
          - - 1408
            - - [4, 57]
              - [64, 18]
              - [128, 38]
              - [448, 49]
              - [704, 50]
              - [1024, 53]
              - [1408, 54]
              - [2368, 53]
              - [2944, 52]
              - [4288, 53]
              - [-1, 52]
          - - 1856
            - - [4, 57]
              - [64, 29]
              - [128, 30]
              - [256, 49]
              - [448, 50]
              - [704, 47]
              - [1024, 54]
              - [1408, 46]
              - [1856, 52]
              - [2368, 46]
              - [2944, 52]
              - [3584, 48]
              - [5056, 52]
              - [-1, 46]
          - - 2368
            - - [4, 57]
              - [64, 30]
              - [128, 23]
              - [704, 47]
              - [1024, 53]
              - [1408, 52]
              - [1856, 53]
              - [2368, 52]
              - [5056, 53]
              - [5888, 46]
              - [-1, 48]
          - - 2944
            - - [4, 57]
              - [64, 38]
              - [128, 27]
              - [256, 47]
              - [448, 52]
              - [704, 53]
              - [1024, 52]
              - [1408, 53]
              - [1856, 52]
              - [-1, 53]
          - - 3584
            - - [4, 58]
              - [64, 27]
              - [128, 49]
              - [256, 50]
              - [448, 47]
              - [3584, 52]
              - [4288, 54]
              - [-1, 52]
          - - 4288
            - - [4, 58]
              - [64, 38]
              - [128, 30]
              - [256, 47]
              - [448, 53]
              - [1024, 52]
              - [1856, 54]
              - [2944, 52]
              - [3584, 54]
              - [-1, 52]
          - - 5056
            - - [4, 58]
              - [64, 38]
              - [128, 27]
              - [448, 47]
              - [704, 52]
              - [1024, 48]
              - [2368, 46]
              - [2944, 52]
              - [3584, 46]
              - [4288, 52]
              - [5056, 48]
              - [5888, 46]
              - [-1, 48]
          - - 5888
            - - [4, 58]
              - [64, 27]
              - [128, 47]
              - [256, 52]
              - [448, 47]
              - [704, 53]
              - [1408, 46]
              - [-1, 52]
          - - -1
            - - [4, 58]
              - [64, 49]
              - [128, 50]
              - [256, 47]
              - [448, 52]
              - [1024, 46]
              - [2368, 52]
              - [-1, 46]
