library/src/blas3/Tensile/Logic/asm_full/vega20_Cijk_Alik_Bljk_HBH.yaml
- {MinimumRequiredVersion: 4.6.0}
- vega20
- gfx906
- [Device 66a0, Device 66a1, Device 66a7, Device 66af, Vega 20]
    SolutionIndex: 0
    SolutionNameMin: Cijk_Alik_Bljk_HBH_MT032x016x08_PGR1_PLR1_TT04_02
    SolutionIndex: 1
    SolutionNameMin: Cijk_Alik_Bljk_HBH_MT032x016x08_PGR1_PLR1_TT02_02
    SolutionIndex: 2
    SolutionNameMin: Cijk_Alik_Bljk_HBH_MT032x032x08_PGR1_PLR1_TT02_02
    SolutionIndex: 3
    SolutionNameMin: Cijk_Alik_Bljk_HBH_MT016x016x16_PGR1_PLR1_TT02_02
    SolutionIndex: 4
    SolutionNameMin: Cijk_Alik_Bljk_HBH_MT032x032x16_PGR1_PLR1_TT04_04
    SolutionIndex: 5
    SolutionNameMin: Cijk_Alik_Bljk_HBH_MT032x016x16_PGR1_PLR1_TT02_02
    SolutionIndex: 6
    SolutionNameMin: Cijk_Alik_Bljk_HBH_MT064x032x16_PGR1_PLR1_TT04_04
    SolutionIndex: 7
    SolutionNameMin: Cijk_Alik_Bljk_HBH_MT016x016x32_PGR1_PLR1_TT02_02
    SolutionIndex: 8
    SolutionNameMin: Cijk_Alik_Bljk_HBH_MT032x032x32_PGR1_PLR1_TT04_04
    SolutionIndex: 9
    SolutionNameMin: Cijk_Alik_Bljk_HBH_MT064x016x32_PGR1_PLR1_TT02_02
    SolutionIndex: 10
    SolutionNameMin: Cijk_Alik_Bljk_HBH_MT032x016x08_PGR1_PLR1_TT04_02
    SolutionIndex: 11
    SolutionNameMin: Cijk_Alik_Bljk_HBH_MT016x016x16_PGR1_PLR1_TT02_02
    SolutionIndex: 12
    SolutionNameMin: Cijk_Alik_Bljk_HBH_MT032x032x16_PGR1_PLR1_TT04_04
    SolutionIndex: 13
    SolutionNameMin: Cijk_Alik_Bljk_HBH_MT064x064x16_PGR1_PLR1_TT08_08
    SolutionIndex: 14
    SolutionNameMin: Cijk_Alik_Bljk_HBH_MT064x032x16_PGR1_PLR1_TT04_04
    SolutionIndex: 15
    SolutionNameMin: Cijk_Alik_Bljk_HBH_MT016x016x24_PGR1_PLR1_TT02_02
    SolutionIndex: 16
    SolutionNameMin: Cijk_Alik_Bljk_HBH_MT032x016x24_PGR1_PLR1_TT04_02
    SolutionIndex: 17
    SolutionNameMin: Cijk_Alik_Bljk_HBH_MT032x032x24_PGR1_PLR1_TT04_04
    SolutionIndex: 18
    SolutionNameMin: Cijk_Alik_Bljk_HBH_MT016x016x24_PGR1_PLR1_TT02_02
    SolutionIndex: 19
    SolutionNameMin: Cijk_Alik_Bljk_HBH_MT032x016x24_PGR1_PLR1_TT04_02
    SolutionIndex: 20
    SolutionNameMin: Cijk_Alik_Bljk_HBH_MT032x032x24_PGR1_PLR1_TT04_04
    SolutionIndex: 21
    SolutionNameMin: Cijk_Alik_Bljk_HBH_MT064x064x24_PGR1_PLR1_TT08_08
    SolutionIndex: 22
    SolutionNameMin: Cijk_Alik_Bljk_HBH_MT032x032x32_PGR1_PLR1_TT04_04
    SolutionIndex: 23
    SolutionNameMin: Cijk_Alik_Bljk_HBH_MT064x064x08_PGR1_PLR1_TT04_04
    SolutionIndex: 24
    SolutionNameMin: Cijk_Alik_Bljk_HBH_MT064x128x08_PGR1_PLR1_TT04_08
    SolutionIndex: 25
    SolutionNameMin: Cijk_Alik_Bljk_HBH_MT128x064x08_PGR1_PLR1_TT08_04
    SolutionIndex: 26
    SolutionNameMin: Cijk_Alik_Bljk_HBH_MT064x064x16_PGR1_PLR1_TT04_04
    SolutionIndex: 27
    SolutionNameMin: Cijk_Alik_Bljk_HBH_MT064x128x16_PGR1_PLR1_TT04_08
    SolutionIndex: 28
    SolutionNameMin: Cijk_Alik_Bljk_HBH_MT128x064x16_PGR1_PLR1_TT08_04
    SolutionIndex: 29
    SolutionNameMin: Cijk_Alik_Bljk_HBH_MT128x128x16_PGR1_PLR1_TT08_08
    SolutionIndex: 30
    SolutionNameMin: Cijk_Alik_Bljk_HBH_MT064x064x32_PGR1_PLR1_TT04_04
    SolutionIndex: 31
    SolutionNameMin: Cijk_Alik_Bljk_HBH_MT128x064x32_PGR1_PLR1_TT08_04
    SolutionIndex: 32
    SolutionNameMin: Cijk_Alik_Bljk_HBH_MT128x128x32_PGR1_PLR1_TT08_08
    SolutionIndex: 33
    SolutionNameMin: Cijk_Alik_Bljk_HBH_MT064x128x04_PGR0_PLR0_TT04_08
    SolutionIndex: 34
    SolutionNameMin: Cijk_Alik_Bljk_HBH_MT064x064x04_PGR0_PLR0_TT04_04
    SolutionIndex: 35
    SolutionNameMin: Cijk_Alik_Bljk_HBH_MT064x064x04_PGR1_PLR0_TT04_04
    SolutionIndex: 36
    SolutionNameMin: Cijk_Alik_Bljk_HBH_MT064x064x04_PGR0_PLR1_TT04_04
    SolutionIndex: 37
    SolutionNameMin: Cijk_Alik_Bljk_HBH_MT064x064x08_PGR0_PLR0_TT04_04
    SolutionIndex: 38
    SolutionNameMin: Cijk_Alik_Bljk_HBH_MT064x064x08_PGR1_PLR0_TT04_04
    SolutionIndex: 39
    SolutionNameMin: Cijk_Alik_Bljk_HBH_MT128x128x08_PGR0_PLR1_TT08_08
    SolutionIndex: 40
    SolutionNameMin: Cijk_Alik_Bljk_HBH_MT064x128x08_PGR0_PLR1_TT04_08
    SolutionIndex: 41
    SolutionNameMin: Cijk_Alik_Bljk_HBH_MT064x064x08_PGR0_PLR1_TT04_04
    SolutionIndex: 42
    SolutionNameMin: Cijk_Alik_Bljk_HBH_MT064x064x08_PGR1_PLR1_TT04_04
    SolutionIndex: 43
    SolutionNameMin: Cijk_Alik_Bljk_HBH_MT064x064x16_PGR0_PLR0_TT04_04
    SolutionIndex: 44
    SolutionNameMin: Cijk_Alik_Bljk_HBH_MT064x064x16_PGR1_PLR0_TT04_04
    SolutionIndex: 45
    SolutionNameMin: Cijk_Alik_Bljk_HBH_MT064x064x16_PGR0_PLR1_TT04_04
    SolutionIndex: 46
    SolutionNameMin: Cijk_Alik_Bljk_HBH_MT064x064x16_PGR1_PLR1_TT04_04
    SolutionIndex: 47
    SolutionNameMin: Cijk_Alik_Bljk_HBH_MT064x128x04_PGR0_PLR0_TT04_08
    SolutionIndex: 48
    SolutionNameMin: Cijk_Alik_Bljk_HBH_MT064x064x04_PGR0_PLR0_TT04_04
    SolutionIndex: 49
    SolutionNameMin: Cijk_Alik_Bljk_HBH_MT064x128x04_PGR1_PLR0_TT04_08
    SolutionIndex: 50
    SolutionNameMin: Cijk_Alik_Bljk_HBH_MT064x064x04_PGR1_PLR0_TT04_04
    SolutionIndex: 51
    SolutionNameMin: Cijk_Alik_Bljk_HBH_MT128x128x04_PGR0_PLR1_TT08_08
    SolutionIndex: 52
    SolutionNameMin: Cijk_Alik_Bljk_HBH_MT064x128x04_PGR0_PLR1_TT04_08
    SolutionIndex: 53
    SolutionNameMin: Cijk_Alik_Bljk_HBH_MT064x064x04_PGR0_PLR1_TT04_04
    SolutionIndex: 54
    SolutionNameMin: Cijk_Alik_Bljk_HBH_MT064x128x04_PGR1_PLR1_TT04_08
    SolutionIndex: 55
    SolutionNameMin: Cijk_Alik_Bljk_HBH_MT064x064x04_PGR1_PLR1_TT04_04
    SolutionIndex: 56
    SolutionNameMin: Cijk_Alik_Bljk_HBH_MT128x128x08_PGR0_PLR0_TT08_08
    SolutionIndex: 57
    SolutionNameMin: Cijk_Alik_Bljk_HBH_MT064x128x08_PGR0_PLR0_TT04_08
    SolutionIndex: 58
    SolutionNameMin: Cijk_Alik_Bljk_HBH_MT064x064x08_PGR0_PLR0_TT04_04
    SolutionIndex: 59
    SolutionNameMin: Cijk_Alik_Bljk_HBH_MT064x064x08_PGR1_PLR0_TT04_04
    SolutionIndex: 60
    SolutionNameMin: Cijk_Alik_Bljk_HBH_MT064x128x08_PGR0_PLR1_TT04_08
    SolutionIndex: 61
    SolutionNameMin: Cijk_Alik_Bljk_HBH_MT064x064x08_PGR0_PLR1_TT04_04
    SolutionIndex: 62
    SolutionNameMin: Cijk_Alik_Bljk_HBH_MT064x128x08_PGR1_PLR1_TT04_08
    SolutionIndex: 63
    SolutionNameMin: Cijk_Alik_Bljk_HBH_MT064x064x08_PGR1_PLR1_TT04_04
    SolutionIndex: 64
    SolutionNameMin: Cijk_Alik_Bljk_HBH_MT064x064x16_PGR1_PLR1_TT04_04
    SolutionIndex: 0
    SolutionNameMin: Cijk_Alik_Bljk_HBH_MT064x032x16_EPS1_GRVW04_LPB04_PGR1_PLR1_SNLL1_TT04_04_VW04_WG16_08_01_WGM01
    SolutionIndex: 1
    SolutionNameMin: Cijk_Alik_Bljk_HBH_MT064x064x16_EPS1_GRVW04_LPB04_PGR1_PLR1_SNLL1_TT04_04_VW04_WG16_16_01_WGM01
    SolutionIndex: 2
    SolutionNameMin: Cijk_Alik_Bljk_HBH_MT064x032x16_EPS1_GRVW04_LPB04_PGR1_PLR1_SNLL1_TT04_04_VW04_WG16_08_01_WGM08
    SolutionIndex: 3
    SolutionNameMin: Cijk_Alik_Bljk_HBH_MT064x032x16_EPS1_GRVW04_LPB04_PGR1_PLR1_SNLL1_TT04_04_VW04_WG16_08_01_WGM64
    SolutionIndex: 4
    SolutionNameMin: Cijk_Alik_Bljk_HBH_MT032x128x32_EPS1_GRVW04_LPB04_PGR1_PLR1_SNLL1_TT04_04_VW04_WG08_32_01_WGM01
    SolutionIndex: 5
    SolutionNameMin: Cijk_Alik_Bljk_HBH_MT032x128x32_EPS1_GRVW04_LPB04_PGR1_PLR1_SNLL1_TT04_04_VW04_WG08_32_01_WGM64
    SolutionIndex: 0
    SolutionNameMin: Cijk_Alik_Bljk_HBH_MT032x032x08_PGR0_PLR1_TT04_04
    SolutionIndex: 1
    SolutionNameMin: Cijk_Alik_Bljk_HBH_MT032x032x08_PGR1_PLR1_TT04_04
    SolutionIndex: 2
    SolutionNameMin: Cijk_Alik_Bljk_HBH_MT032x032x16_PGR1_PLR1_TT04_04
    SolutionIndex: 3
    SolutionNameMin: Cijk_Alik_Bljk_HBH_MT064x016x16_PGR1_PLR1_TT04_04
    SolutionIndex: 4
    SolutionNameMin: Cijk_Alik_Bljk_HBH_MT064x064x16_PGR1_PLR1_TT04_04
    SolutionIndex: 5
    SolutionNameMin: Cijk_Alik_Bljk_HBH_MT032x032x32_PGR1_PLR1_TT04_04
    SolutionIndex: 6
    SolutionNameMin: Cijk_Alik_Bljk_HBH_MT064x016x32_PGR1_PLR1_TT04_04
    SolutionIndex: 7
    SolutionNameMin: Cijk_Alik_Bljk_HBH_MT064x064x16_PGR1_PLR1_TT08_08
    SolutionIndex: 8
    SolutionNameMin: Cijk_Alik_Bljk_HBH_MT032x032x16_PGR1_PLR1_TT04_04
    SolutionIndex: 9
    SolutionNameMin: Cijk_Alik_Bljk_HBH_MT064x032x16_PGR1_PLR1_TT04_04
    SolutionIndex: 10
    SolutionNameMin: Cijk_Alik_Bljk_HBH_MT032x032x32_PGR1_PLR1_TT04_04
    SolutionIndex: 11
    SolutionNameMin: Cijk_Alik_Bljk_HBH_MT064x032x32_PGR1_PLR1_TT04_04
    SolutionIndex: 12
    SolutionNameMin: Cijk_Alik_Bljk_HBH_MT064x064x08_PGR1_PLR1_TT08_08
    SolutionIndex: 13
    SolutionNameMin: Cijk_Alik_Bljk_HBH_MT064x064x16_PGR1_PLR1_TT08_08
    SolutionIndex: 14
    SolutionNameMin: Cijk_Alik_Bljk_HBH_MT064x064x32_PGR1_PLR1_TT08_08
    SolutionIndex: 15
    SolutionNameMin: Cijk_Alik_Bljk_HBH_MT128x128x08_PGR1_PLR1_TT08_08
    SolutionIndex: 16
    SolutionNameMin: Cijk_Alik_Bljk_HBH_MT032x064x16_PGR1_PLR1_TT04_08
    SolutionIndex: 17
    SolutionNameMin: Cijk_Alik_Bljk_HBH_MT064x064x16_PGR1_PLR1_TT04_04
    SolutionIndex: 18
    SolutionNameMin: Cijk_Alik_Bljk_HBH_MT064x128x16_PGR1_PLR1_TT04_08
    SolutionIndex: 19
    SolutionNameMin: Cijk_Alik_Bljk_HBH_MT128x064x16_PGR1_PLR1_TT08_04
    SolutionIndex: 20
    SolutionNameMin: Cijk_Alik_Bljk_HBH_MT128x128x32_PGR1_PLR1_TT08_08
    SolutionIndex: 21
    SolutionNameMin: Cijk_Alik_Bljk_HBH_MT128x128x16_PGR1_PLR1_TT08_08
    SolutionIndex: 22
    SolutionNameMin: Cijk_Alik_Bljk_HBH_MT128x128x32_PGR1_PLR1_TT08_08
    SolutionIndex: 23
    SolutionNameMin: Cijk_Alik_Bljk_HBH_MT064x128x04_PGR0_PLR0_TT04_08
    SolutionIndex: 24
    SolutionNameMin: Cijk_Alik_Bljk_HBH_MT064x064x04_PGR0_PLR0_TT04_04
    SolutionIndex: 25
    SolutionNameMin: Cijk_Alik_Bljk_HBH_MT064x064x04_PGR1_PLR0_TT04_04
    SolutionIndex: 26
    SolutionNameMin: Cijk_Alik_Bljk_HBH_MT064x064x04_PGR1_PLR1_TT04_04
    SolutionIndex: 27
    SolutionNameMin: Cijk_Alik_Bljk_HBH_MT128x128x08_PGR0_PLR0_TT08_08
    SolutionIndex: 28
    SolutionNameMin: Cijk_Alik_Bljk_HBH_MT064x064x08_PGR0_PLR0_TT04_04
    SolutionIndex: 29
    SolutionNameMin: Cijk_Alik_Bljk_HBH_MT064x128x08_PGR1_PLR0_TT04_08
    SolutionIndex: 30
    SolutionNameMin: Cijk_Alik_Bljk_HBH_MT064x064x08_PGR1_PLR0_TT04_04
    SolutionIndex: 31
    SolutionNameMin: Cijk_Alik_Bljk_HBH_MT064x064x08_PGR0_PLR1_TT04_04
    SolutionIndex: 32
    SolutionNameMin: Cijk_Alik_Bljk_HBH_MT064x064x08_PGR1_PLR1_TT04_04
    SolutionIndex: 33
    SolutionNameMin: Cijk_Alik_Bljk_HBH_MT064x064x16_PGR1_PLR0_TT04_04
    SolutionIndex: 34
    SolutionNameMin: Cijk_Alik_Bljk_HBH_MT064x128x16_PGR1_PLR1_TT04_08
    SolutionIndex: 35
    SolutionNameMin: Cijk_Alik_Bljk_HBH_MT064x064x16_PGR1_PLR1_TT04_04
    SolutionIndex: 36
    SolutionNameMin: Cijk_Alik_Bljk_HBH_MT128x128x04_PGR0_PLR0_TT08_08
    SolutionIndex: 37
    SolutionNameMin: Cijk_Alik_Bljk_HBH_MT064x128x04_PGR0_PLR0_TT04_08
    SolutionIndex: 38
    SolutionNameMin: Cijk_Alik_Bljk_HBH_MT064x064x04_PGR0_PLR0_TT04_04
    SolutionIndex: 39
    SolutionNameMin: Cijk_Alik_Bljk_HBH_MT064x128x04_PGR1_PLR0_TT04_08
    SolutionIndex: 40
    SolutionNameMin: Cijk_Alik_Bljk_HBH_MT064x064x04_PGR1_PLR0_TT04_04
    SolutionIndex: 41
    SolutionNameMin: Cijk_Alik_Bljk_HBH_MT064x128x04_PGR0_PLR1_TT04_08
    SolutionIndex: 42
    SolutionNameMin: Cijk_Alik_Bljk_HBH_MT064x064x04_PGR0_PLR1_TT04_04
    SolutionIndex: 43
    SolutionNameMin: Cijk_Alik_Bljk_HBH_MT064x128x04_PGR1_PLR1_TT04_08
    SolutionIndex: 44
    SolutionNameMin: Cijk_Alik_Bljk_HBH_MT064x064x04_PGR1_PLR1_TT04_04
    SolutionIndex: 45
    SolutionNameMin: Cijk_Alik_Bljk_HBH_MT128x128x08_PGR0_PLR0_TT08_08
    SolutionIndex: 46
    SolutionNameMin: Cijk_Alik_Bljk_HBH_MT064x128x08_PGR0_PLR0_TT04_08
    SolutionIndex: 47
    SolutionNameMin: Cijk_Alik_Bljk_HBH_MT064x064x08_PGR0_PLR0_TT04_04
    SolutionIndex: 48
    SolutionNameMin: Cijk_Alik_Bljk_HBH_MT064x064x08_PGR1_PLR0_TT04_04
    SolutionIndex: 49
    SolutionNameMin: Cijk_Alik_Bljk_HBH_MT064x064x08_PGR0_PLR1_TT04_04
    SolutionIndex: 50
    SolutionNameMin: Cijk_Alik_Bljk_HBH_MT064x064x08_PGR1_PLR1_TT04_04
    SolutionIndex: 51
    SolutionNameMin: Cijk_Alik_Bljk_HBH_MT064x064x16_PGR0_PLR0_TT04_04
    SolutionIndex: 52
    SolutionNameMin: Cijk_Alik_Bljk_HBH_MT064x064x16_PGR1_PLR1_TT04_04
- - - [2368, 1024, 1, 1]
    - [48, 135.921]
  - - [448, 1, 1, 256]
    - [63, 2.9317]
  - - [5056, 1408, 1, 3328]
    - [29, 9713.46]
  - - [5056, 1856, 1, 3328]
    - [26, 9979.08]
  - - [5888, 128, 1, 1]
    - [52, 63.2268]
  - - [448, 3584, 1, 3328]
    - [26, 8233.0]
  - - [704, 64, 1, 3328]
    - [18, 1985.52]
  - - [5056, 4288, 1, 32]
    - [33, 3673.04]
  - - [3584, 1024, 1, 256]
    - [26, 9167.88]
  - - [32, 5056, 1, 1280]
    - [46, 1183.66]
  - - [1856, 256, 1, 1]
    - [48, 41.5329]
  - - [256, 1856, 1, 32]
    - [41, 931.639]
  - - [1408, 3584, 1, 3328]
    - [26, 9700.78]
  - - [128, 3584, 1, 1280]
    - [20, 6478.4]
  - - [1024, 2368, 1, 3328]
    - [26, 8980.86]
  - - [4288, 64, 1, 3328]
    - [18, 4487.57]
  - - [1, 4288, 1, 1280]
    - [63, 28.4562]
  - - [2368, 64, 1, 1]
    - [61, 11.9899]
  - - [256, 128, 1, 256]
    - [3, 944.663]
  - - [448, 64, 1, 1]
    - [56, 2.54184]
  - - [32, 1408, 1, 32]
    - [35, 94.8547]
  - - [448, 3584, 1, 32]
    - [41, 2013.33]
  - - [64, 1024, 1, 1280]
    - [18, 2582.7]
  - - [1, 1408, 1, 3328]
    - [64, 13.9892]
  - - [1408, 128, 1, 32]
    - [35, 343.284]
  - - [4288, 6784, 1, 3328]
    - [26, 10375.2]
  - - [1024, 1, 1, 3328]
    - [64, 10.2523]
  - - [2944, 128, 1, 32]
    - [42, 832.778]
  - - [64, 6784, 1, 1]
    - [48, 40.5015]
  - - [1024, 64, 1, 1280]
    - [18, 2570.04]
  - - [448, 128, 1, 256]
    - [3, 1504.1]
  - - [64, 5056, 1, 3328]
    - [14, 4864.87]
  - - [5888, 4288, 1, 3328]
    - [26, 10103.2]
  - - [1, 2368, 1, 1280]
    - [64, 21.5763]
  - - [704, 1024, 1, 1]
    - [53, 61.3007]
  - - [2368, 1408, 1, 32]
    - [33, 2699.71]
  - - [256, 1856, 1, 1280]
    - [20, 6692.06]
  - - [1024, 2944, 1, 1]
    - [48, 151.338]
  - - [2944, 3584, 1, 3328]
    - [26, 10082.3]
  - - [2368, 2944, 1, 1280]
    - [26, 9948.47]
  - - [256, 1408, 1, 1]
    - [48, 31.9546]
  - - [1, 1024, 1, 3328]
    - [64, 10.2474]
  - - [6784, 5888, 1, 3328]
    - [24, 10078.0]
  - - [3584, 1408, 1, 32]
    - [33, 3044.51]
  - - [5056, 256, 1, 256]
    - [26, 7770.87]
  - - [1856, 2368, 1, 256]
    - [26, 9198.19]
  - - [2368, 1024, 1, 3328]
    - [26, 8964.9]
  - - [3584, 4288, 1, 32]
    - [33, 3541.06]
  - - [1024, 1024, 1, 1280]
    - [29, 8529.34]
  - - [3584, 3584, 1, 1]
    - [52, 234.742]
  - - [32, 2944, 1, 3328]
    - [46, 1056.92]
  - - [704, 1408, 1, 3328]
    - [21, 8222.38]
  - - [1408, 704, 1, 256]
    - [26, 7275.1]
  - - [704, 64, 1, 32]
    - [35, 90.112]
  - - [5888, 1, 1, 3328]
    - [63, 39.9838]
  - - [2368, 32, 1, 256]
    - [42, 528.286]
  - - [6784, 128, 1, 3328]
    - [6, 7259.53]
  - - [2944, 256, 1, 1]
    - [57, 55.0924]
  - - [1408, 2368, 1, 1]
    - [53, 157.271]
  - - [32, 448, 1, 3328]
    - [46, 163.66]
  - - [5056, 1, 1, 3328]
    - [63, 34.3732]
  - - [2944, 256, 1, 32]
    - [35, 1351.86]
  - - [5056, 6784, 1, 1280]
    - [26, 10126.7]
  - - [4288, 5056, 1, 1]
    - [48, 243.706]
  - - [5056, 4288, 1, 1]
    - [48, 243.488]
  - - [128, 4288, 1, 3328]
    - [20, 5792.17]
  - - [5056, 128, 1, 256]
    - [14, 5883.35]
  - - [1408, 4288, 1, 1280]
    - [26, 9675.49]
  - - [1856, 704, 1, 1280]
    - [26, 8802.52]
  - - [4288, 1024, 1, 3328]
    - [26, 9839.05]
  - - [1, 5888, 1, 3328]
    - [63, 40.036]
  - - [1024, 128, 1, 32]
    - [35, 266.136]
  - - [32, 4288, 1, 1280]
    - [46, 989.39]
  - - [1024, 5056, 1, 1]
    - [48, 188.13]
  - - [704, 3584, 1, 1280]
    - [26, 9204.33]
  - - [1856, 5056, 1, 256]
    - [26, 9643.09]
  - - [1408, 1024, 1, 1280]
    - [26, 8337.07]
  - - [5056, 5888, 1, 3328]
    - [25, 9933.66]
  - - [448, 1, 1, 1]
    - [56, 0.0478633]
  - - [3584, 3584, 1, 1280]
    - [26, 10217.3]
  - - [2368, 3584, 1, 32]
    - [33, 3361.15]
  - - [2944, 2368, 1, 1]
    - [48, 204.56]
  - - [704, 4288, 1, 1]
    - [48, 150.938]
  - - [2368, 256, 1, 32]
    - [37, 1182.84]
  - - [1024, 6784, 1, 1280]
    - [26, 9909.87]
  - - [1024, 3584, 1, 1]
    - [54, 165.019]
  - - [32, 5056, 1, 32]
    - [37, 380.687]
  - - [5888, 32, 1, 32]
    - [35, 443.332]
  - - [64, 128, 1, 3328]
    - [15, 361.386]
  - - [256, 5056, 1, 32]
    - [41, 1842.47]
  - - [5056, 64, 1, 32]
    - [42, 775.051]
  - - [2368, 5056, 1, 32]
    - [33, 3430.55]
  - - [6784, 1856, 1, 32]
    - [33, 3435.5]
  - - [64, 128, 1, 1]
    - [48, 0.682667]
  - - [64, 2368, 1, 1280]
    - [15, 4089.09]
  - - [128, 704, 1, 32]
    - [35, 179.327]
  - - [64, 6784, 1, 3328]
    - [17, 6382.23]
  - - [2944, 256, 1, 1280]
    - [26, 7734.85]
  - - [5056, 704, 1, 1]
    - [48, 162.977]
  - - [2944, 4288, 1, 256]
    - [26, 9650.36]
  - - [1024, 1024, 1, 3328]
    - [29, 8699.79]
  - - [5056, 704, 1, 32]
    - [37, 2661.25]
  - - [1856, 4288, 1, 3328]
    - [26, 10002.3]
  - - [1, 1856, 1, 256]
    - [63, 12.0715]
  - - [6784, 4288, 1, 32]
    - [33, 3717.55]
  - - [5888, 64, 1, 256]
    - [6, 4567.66]
  - - [256, 128, 1, 1]
    - [60, 3.2]
  - - [5888, 5056, 1, 256]
    - [26, 9716.76]
  - - [2944, 448, 1, 256]
    - [26, 7010.83]
  - - [3584, 2368, 1, 3328]
    - [26, 10020.6]
  - - [4288, 1856, 1, 1]
    - [53, 211.663]
  - - [1856, 2944, 1, 1]
    - [48, 188.676]
  - - [32, 4288, 1, 3328]
    - [46, 1031.66]
  - - [1, 3584, 1, 3328]
    - [64, 35.909]
  - - [256, 32, 1, 3328]
    - [46, 95.673]
  - - [1856, 2368, 1, 32]
    - [33, 2886.7]
  - - [4288, 1856, 1, 32]
    - [33, 3255.02]
  - - [5056, 64, 1, 3328]
    - [6, 4871.91]
  - - [6784, 1, 1, 1280]
    - [63, 44.0698]
  - - [1024, 448, 1, 32]
    - [35, 960.737]
  - - [1408, 64, 1, 1]
    - [55, 7.41053]
  - - [1, 1, 1, 3328]
    - [64, 0.00988828]
  - - [5056, 2368, 1, 256]
    - [26, 9535.18]
  - - [1408, 5888, 1, 256]
    - [29, 9546.23]
  - - [5056, 6784, 1, 1]
    - [53, 256.275]
  - - [32, 448, 1, 1280]
    - [46, 148.08]
  - - [32, 448, 1, 32]
    - [41, 29.2571]
  - - [1856, 64, 1, 256]
    - [11, 2639.64]
  - - [1024, 1408, 1, 3328]
    - [26, 8456.02]
  - - [256, 5056, 1, 1280]
    - [26, 8712.4]
  - - [704, 2368, 1, 1]
    - [50, 110.256]
  - - [64, 1024, 1, 32]
    - [35, 132.396]
  - - [1024, 256, 1, 256]
    - [12, 4279.9]
  - - [128, 1, 1, 1]
    - [64, 0.0117647]
  - - [3584, 4288, 1, 1280]
    - [26, 10194.1]
  - - [1856, 128, 1, 32]
    - [42, 539.927]
  - - [1856, 128, 1, 1280]
    - [20, 5279.29]
  - - [128, 2944, 1, 3328]
    - [14, 5645.02]
  - - [1, 6784, 1, 3328]
    - [63, 45.8885]
  - - [3584, 2368, 1, 1]
    - [54, 213.884]
  - - [4288, 448, 1, 3328]
    - [26, 8702.45]
  - - [4288, 32, 1, 3328]
    - [46, 1033.16]
  - - [256, 1856, 1, 1]
    - [50, 41.2444]
  - - [704, 6784, 1, 1280]
    - [26, 9561.43]
  - - [2368, 4288, 1, 32]
    - [33, 3353.92]
  - - [704, 5056, 1, 1280]
    - [26, 9506.06]
  - - [256, 3584, 1, 3328]
    - [29, 7615.36]
  - - [1024, 32, 1, 3328]
    - [46, 372.445]
  - - [3584, 6784, 1, 32]
    - [33, 3712.04]
  - - [3584, 6784, 1, 1280]
    - [26, 10288.0]
  - - [4288, 4288, 1, 3328]
    - [26, 10217.3]
  - - [3584, 64, 1, 1280]
    - [20, 5069.08]
  - - [64, 1856, 1, 256]
    - [3, 2695.81]
  - - [3584, 64, 1, 32]
    - [42, 539.708]
  - - [448, 1, 1, 1280]
    - [64, 4.16019]
  - - [256, 4288, 1, 1280]
    - [26, 7429.63]
  - - [1408, 3584, 1, 1]
    - [47, 185.525]
  - - [4288, 1856, 1, 3328]
    - [26, 9984.76]
  - - [1856, 2944, 1, 1280]
    - [26, 9921.13]
  - - [4288, 256, 1, 256]
    - [26, 6729.37]
  - - [128, 5888, 1, 32]
    - [41, 1333.92]
  - - [128, 5888, 1, 1280]
    - [26, 7705.19]
  - - [1408, 128, 1, 3328]
    - [18, 4697.57]
  - - [3584, 256, 1, 256]
    - [26, 6749.45]
  - - [32, 6784, 1, 3328]
    - [46, 1619.59]
  - - [64, 64, 1, 1280]
    - [15, 162.62]
  - - [32, 3584, 1, 256]
    - [46, 915.216]
  - - [704, 256, 1, 32]
    - [35, 340.045]
  - - [448, 128, 1, 3328]
    - [15, 2474.6]
  - - [64, 2944, 1, 3328]
    - [18, 4951.42]
  - - [64, 4288, 1, 3328]
    - [2, 4464.75]
  - - [5056, 1024, 1, 3328]
    - [29, 9792.55]
  - - [128, 256, 1, 1280]
    - [15, 1372.48]
  - - [1856, 256, 1, 256]
    - [12, 5508.82]
  - - [3584, 704, 1, 1]
    - [53, 138.939]
  - - [256, 704, 1, 256]
    - [12, 3186.28]
  - - [448, 5056, 1, 1]
    - [53, 131.691]
  - - [5888, 5888, 1, 256]
    - [26, 9722.13]
  - - [3584, 704, 1, 32]
    - [41, 2420.27]
  - - [448, 6784, 1, 3328]
    - [26, 9479.8]
  - - [6784, 4288, 1, 1]
    - [49, 249.398]
  - - [3584, 6784, 1, 1]
    - [47, 251.799]
  - - [1408, 2368, 1, 32]
    - [33, 2656.69]
  - - [448, 5056, 1, 32]
    - [37, 2317.23]
  - - [4288, 4288, 1, 1280]
    - [26, 10167.7]
  - - [6784, 1408, 1, 1]
    - [47, 222.343]
  - - [1856, 5888, 1, 3328]
    - [26, 10203.6]
  - - [1024, 704, 1, 1]
    - [50, 60.8865]
  - - [3584, 1856, 1, 3328]
    - [26, 9897.67]
  - - [5056, 5888, 1, 1]
    - [48, 252.8]
  - - [2944, 1024, 1, 256]
    - [26, 8738.08]
  - - [448, 1408, 1, 3328]
    - [26, 6618.06]
  - - [5056, 32, 1, 3328]
    - [46, 1218.2]
  - - [2368, 4288, 1, 3328]
    - [26, 10188.3]
  - - [1024, 704, 1, 32]
    - [42, 1304.79]
  - - [448, 2944, 1, 256]
    - [26, 6976.06]
  - - [2944, 6784, 1, 256]
    - [26, 9781.25]
  - - [2368, 2368, 1, 1280]
    - [26, 9749.92]
  - - [5888, 128, 1, 3328]
    - [26, 7806.88]
  - - [256, 256, 1, 32]
    - [35, 127.875]
  - - [1024, 1, 1, 256]
    - [63, 6.68735]
  - - [3584, 3584, 1, 32]
    - [33, 3526.44]
  - - [2944, 448, 1, 1]
    - [63, 88.6366]
  - - [128, 32, 1, 32]
    - [35, 8.57801]
  - - [5056, 64, 1, 1280]
    - [6, 4710.96]
  - - [2944, 2944, 1, 1280]
    - [26, 9892.58]
  - - [1, 2368, 1, 256]
    - [63, 15.2467]
  - - [1408, 5056, 1, 1]
    - [47, 205.985]
  - - [2944, 32, 1, 1280]
    - [46, 987.764]
  - - [64, 1408, 1, 3328]
    - [15, 3454.97]
  - - [256, 448, 1, 1280]
    - [15, 3855.06]
  - - [2368, 6784, 1, 1]
    - [48, 220.182]
  - - [6784, 4288, 1, 1280]
    - [26, 10119.3]
  - - [2944, 704, 1, 256]
    - [26, 8524.73]
  - - [2368, 6784, 1, 1280]
    - [26, 10158.6]
  - - [704, 2944, 1, 3328]
    - [13, 9393.09]
  - - [5888, 256, 1, 1]
    - [48, 103.525]
  - - [704, 704, 1, 32]
    - [37, 991.232]
  - - [256, 4288, 1, 256]
    - [26, 6820.83]
  - - [5056, 6784, 1, 32]
    - [33, 3765.08]
  - - [5056, 128, 1, 1]
    - [48, 57.7829]
  - - [448, 5056, 1, 1280]
    - [26, 9092.17]
  - - [448, 448, 1, 256]
    - [12, 3548.36]
  - - [256, 5888, 1, 3328]
    - [26, 8824.21]
  - - [704, 448, 1, 1280]
    - [12, 4525.8]
  - - [448, 64, 1, 256]
    - [3, 819.2]
  - - [1024, 704, 1, 1280]
    - [26, 7365.48]
  - - [5888, 1024, 1, 1]
    - [52, 196.779]
  - - [5888, 448, 1, 32]
    - [41, 2365.76]
  - - [6784, 2944, 1, 256]
    - [26, 9622.2]
  - - [1024, 256, 1, 1]
    - [48, 24.6376]
  - - [2368, 448, 1, 256]
    - [26, 6478.56]
  - - [4288, 256, 1, 3328]
    - [26, 7548.01]
  - - [4288, 2944, 1, 256]
    - [26, 9611.32]
  - - [448, 5888, 1, 3328]
    - [26, 8943.24]
  - - [128, 256, 1, 3328]
    - [15, 1465.75]
  - - [128, 6784, 1, 32]
    - [37, 1478.05]
  - - [1856, 64, 1, 32]
    - [35, 239.968]
  - - [1408, 4288, 1, 1]
    - [47, 196.533]
  - - [1408, 1856, 1, 3328]
    - [26, 9652.06]
  - - [4288, 64, 1, 256]
    - [18, 3471.08]
  - - [3584, 1024, 1, 3328]
    - [26, 9893.89]
  - - [2944, 5888, 1, 3328]
    - [26, 10215.1]
  - - [128, 6784, 1, 3328]
    - [6, 7302.09]
  - - [448, 4288, 1, 3328]
    - [26, 8714.79]
  - - [704, 2368, 1, 256]
    - [26, 7731.35]
  - - [1, 64, 1, 3328]
    - [64, 0.633905]
  - - [4288, 128, 1, 1]
    - [48, 50.0788]
  - - [256, 2368, 1, 32]
    - [42, 1182.84]
  - - [4288, 3584, 1, 3328]
    - [26, 10250.9]
  - - [1408, 64, 1, 256]
    - [2, 2089.55]
  - - [1408, 1024, 1, 1]
    - [47, 100.684]
  - - [64, 1024, 1, 1]
    - [55, 5.61096]
  - - [1408, 1024, 1, 256]
    - [26, 7638.63]
  - - [5056, 3584, 1, 1]
    - [53, 232.554]
  - - [448, 1024, 1, 256]
    - [26, 5397.08]
  - - [6784, 6784, 1, 3328]
    - [29, 10167.0]
  - - [6784, 32, 1, 32]
    - [41, 485.113]
  - - [64, 1024, 1, 3328]
    - [15, 2751.06]
  - - [2368, 2944, 1, 3328]
    - [26, 10010.3]
  - - [448, 448, 1, 1280]
    - [20, 4441.58]
  - - [5056, 3584, 1, 32]
    - [33, 3609.7]
  - - [5056, 3584, 1, 1280]
    - [26, 9970.46]
  - - [1856, 1856, 1, 256]
    - [26, 8693.34]
  - - [32, 5888, 1, 256]
    - [46, 1110.37]
  - - [256, 1408, 1, 32]
    - [42, 754.865]
  - - [2944, 1, 1, 3328]
    - [64, 28.9802]
  - - [32, 704, 1, 3328]
    - [46, 253.083]
  - - [5888, 4288, 1, 1]
    - [52, 250.472]
  - - [1024, 128, 1, 256]
    - [1, 2892.62]
  - - [32, 1856, 1, 3328]
    - [46, 668.301]
  - - [5056, 704, 1, 256]
    - [26, 8795.49]
  - - [2368, 5056, 1, 256]
    - [26, 9689.5]
  - - [1024, 5056, 1, 256]
    - [26, 9297.14]
  - - [32, 1024, 1, 3328]
    - [46, 368.419]
  - - [5888, 448, 1, 256]
    - [26, 8116.38]
  - - [6784, 5056, 1, 1280]
    - [26, 10124.3]
  - - [4288, 6784, 1, 1280]
    - [26, 10329.3]
  - - [64, 1, 1, 256]
    - [63, 0.417108]
  - - [1856, 64, 1, 1280]
    - [18, 3959.47]
  - - [128, 1408, 1, 1]
    - [50, 13.9062]
  - - [1024, 64, 1, 32]
    - [35, 133.747]
  - - [1024, 64, 1, 3328]
    - [15, 2745.52]
  - - [704, 6784, 1, 3328]
    - [26, 9645.55]
  - - [2944, 1856, 1, 1]
    - [48, 191.319]
  - - [5888, 4288, 1, 1280]
    - [26, 10045.8]
  - - [5888, 3584, 1, 1280]
    - [26, 10041.1]
  - - [32, 2368, 1, 1280]
    - [46, 798.167]
  - - [3584, 1408, 1, 1280]
    - [26, 9608.51]
  - - [1024, 2944, 1, 256]
    - [29, 8659.69]
  - - [1, 2944, 1, 1280]
    - [64, 27.0247]
  - - [32, 1024, 1, 256]
    - [42, 214.433]
  - - [2944, 1856, 1, 1280]
    - [26, 9924.51]
  - - [3584, 1, 1, 1280]
    - [64, 32.7867]
  - - [256, 3584, 1, 32]
    - [41, 1535.57]
  - - [1024, 2368, 1, 1]
    - [47, 135.921]
  - - [2944, 3584, 1, 1280]
    - [26, 10022.0]
  - - [64, 1, 1, 1]
    - [53, 0.00610687]
  - - [1856, 4288, 1, 256]
    - [26, 9467.39]
  - - [256, 1, 1, 256]
    - [63, 1.92753]
  - - [256, 128, 1, 3328]
    - [15, 1472.08]
  - - [1, 1856, 1, 3328]
    - [64, 18.4535]
  - - [448, 3584, 1, 1]
    - [53, 110.886]
  - - [2368, 2944, 1, 32]
    - [33, 3231.24]
  - - [128, 4288, 1, 32]
    - [42, 1081.51]
  - - [448, 256, 1, 256]
    - [11, 2463.1]
  - - [64, 64, 1, 1]
    - [53, 0.343624]
  - - [1, 1408, 1, 1]
    - [48, 0.129412]
  - - [2944, 32, 1, 32]
    - [35, 179.444]
  - - [448, 1856, 1, 1]
    - [59, 66.2013]
  - - [4288, 704, 1, 256]
    - [26, 8726.29]
  - - [1856, 1024, 1, 256]
    - [26, 7898.36]
  - - [448, 1856, 1, 32]
    - [37, 1439.81]
  - - [448, 1856, 1, 3328]
    - [21, 6915.21]
  - - [448, 448, 1, 32]
    - [43, 330.377]
  - - [1024, 448, 1, 256]
    - [26, 5397.08]
  - - [6784, 1, 1, 256]
    - [63, 37.1091]
  - - [704, 6784, 1, 32]
    - [33, 2851.31]
  - - [1024, 4288, 1, 1]
    - [48, 177.626]
  - - [704, 256, 1, 3328]
    - [20, 4242.96]
  - - [704, 1856, 1, 32]
    - [41, 1880.03]
  - - [1408, 5888, 1, 1280]
    - [26, 10023.8]
  - - [32, 704, 1, 1280]
    - [46, 238.392]
  - - [5056, 1856, 1, 256]
    - [26, 9472.74]
  - - [6784, 704, 1, 1280]
    - [26, 9393.35]
  - - [704, 1408, 1, 32]
    - [41, 1585.97]
  - - [5888, 1024, 1, 256]
    - [26, 9320.68]
  - - [64, 2944, 1, 1]
    - [53, 14.5383]
  - - [64, 2944, 1, 32]
    - [37, 345.717]
  - - [64, 2944, 1, 1280]
    - [15, 4637.93]
  - - [6784, 1856, 1, 3328]
    - [26, 9901.31]
  - - [2368, 5888, 1, 1280]
    - [26, 10108.5]
  - - [5888, 6784, 1, 32]
    - [33, 3787.97]
  - - [1, 6784, 1, 256]
    - [63, 37.3645]
  - - [6784, 6784, 1, 32]
    - [33, 3798.03]
  - - [256, 1, 1, 1280]
    - [64, 2.51751]
  - - [5888, 128, 1, 32]
    - [37, 1272.01]
  - - [6784, 256, 1, 256]
    - [26, 7939.22]
  - - [2368, 3584, 1, 3328]
    - [26, 10026.9]
  - - [128, 4288, 1, 1280]
    - [26, 5662.04]
  - - [32, 3584, 1, 1280]
    - [46, 1263.78]
  - - [5888, 1024, 1, 1280]
    - [26, 9838.75]
  - - [1856, 704, 1, 3328]
    - [26, 8960.69]
  - - [5888, 6784, 1, 3328]
    - [26, 10157.2]
  - - [6784, 448, 1, 1]
    - [48, 150.16]
  - - [6784, 1856, 1, 1]
    - [49, 231.114]
  - - [128, 32, 1, 1280]
    - [46, 42.4731]
  - - [2944, 2368, 1, 1280]
    - [26, 9934.3]
  - - [128, 256, 1, 1]
    - [49, 3.25079]
  - - [6784, 448, 1, 32]
    - [37, 2511.76]
  - - [6784, 448, 1, 3328]
    - [26, 9299.89]
  - - [1, 6784, 1, 1]
    - [53, 0.724786]
  - - [448, 3584, 1, 1280]
    - [26, 8106.69]
  - - [1408, 6784, 1, 1280]
    - [26, 10030.2]
  - - [5056, 5888, 1, 1280]
    - [26, 10089.9]
  - - [32, 2944, 1, 32]
    - [35, 185.632]
  - - [5888, 704, 1, 1]
    - [53, 170.442]
  - - [3584, 1856, 1, 1]
    - [53, 200.359]
  - - [1, 256, 1, 256]
    - [64, 1.99319]
  - - [5056, 2944, 1, 32]
    - [33, 3639.33]
  - - [32, 6784, 1, 256]
    - [46, 1249.43]
  - - [4288, 6784, 1, 1]
    - [48, 252.516]
  - - [1, 4288, 1, 3328]
    - [63, 29.3148]
  - - [1024, 6784, 1, 1]
    - [54, 187.145]
  - - [2368, 5888, 1, 32]
    - [33, 3609.78]
  - - [448, 448, 1, 3328]
    - [20, 4706.47]
  - - [1, 256, 1, 1]
    - [50, 0.0323232]
  - - [3584, 4288, 1, 1]
    - [54, 240.429]
  - - [5888, 1024, 1, 3328]
    - [26, 9467.37]
  - - [6784, 5888, 1, 256]
    - [26, 9746.19]
  - - [704, 128, 1, 1280]
    - [18, 3232.72]
  - - [4288, 128, 1, 256]
    - [26, 5032.56]
  - - [5056, 1024, 1, 1]
    - [48, 187.043]
  - - [32, 3584, 1, 3328]
    - [46, 1328.61]
  - - [1024, 1, 1, 1280]
    - [64, 9.509]
  - - [4288, 2368, 1, 32]
    - [33, 3427.51]
  - - [704, 3584, 1, 1]
    - [50, 137.127]
  - - [704, 1856, 1, 3328]
    - [26, 8965.13]
  - - [2944, 128, 1, 1280]
    - [6, 5491.18]
  - - [1, 2368, 1, 3328]
    - [64, 23.4936]
  - - [6784, 704, 1, 32]
    - [33, 2847.06]
  - - [4288, 1, 1, 1280]
    - [63, 28.1526]
  - - [704, 5888, 1, 256]
    - [26, 9129.03]
  - - [2368, 3584, 1, 1280]
    - [26, 9964.81]
  - - [64, 448, 1, 256]
    - [3, 819.2]
  - - [1408, 448, 1, 1280]
    - [26, 6448.91]
  - - [3584, 5056, 1, 32]
    - [33, 3579.4]
  - - [1024, 32, 1, 1280]
    - [46, 346.522]
  - - [128, 2368, 1, 1]
    - [55, 28.703]
  - - [6784, 1856, 1, 1280]
    - [26, 9852.67]
  - - [5056, 5056, 1, 3328]
    - [27, 9686.26]
  - - [128, 704, 1, 1280]
    - [18, 3218.29]
  - - [128, 2944, 1, 1280]
    - [6, 5491.18]
  - - [2368, 5056, 1, 1]
    - [53, 230.597]
  - - [5888, 1408, 1, 256]
    - [29, 9430.85]
  - - [2368, 1024, 1, 32]
    - [33, 2359.93]
  - - [256, 256, 1, 3328]
    - [15, 2740.0]
  - - [64, 4288, 1, 1]
    - [48, 25.2235]
  - - [4288, 1024, 1, 256]
    - [26, 9195.63]
  - - [3584, 32, 1, 32]
    - [42, 278.032]
  - - [3584, 64, 1, 1]
    - [59, 22.5764]
  - - [704, 32, 1, 1280]
    - [46, 234.362]
  - - [32, 4288, 1, 32]
    - [46, 308.351]
  - - [64, 64, 1, 3328]
    - [15, 181.849]
  - - [64, 1408, 1, 1]
    - [55, 7.76828]
  - - [4288, 5888, 1, 1280]
    - [26, 10242.0]
  - - [1856, 2944, 1, 3328]
    - [26, 10013.9]
  - - [256, 1024, 1, 256]
    - [12, 4485.89]
  - - [5056, 5888, 1, 256]
    - [26, 9720.72]
  - - [1408, 128, 1, 1280]
    - [18, 4541.08]
  - - [5056, 256, 1, 3328]
    - [26, 8745.23]
  - - [1024, 5888, 1, 1280]
    - [26, 10040.5]
  - - [1024, 448, 1, 1]
    - [53, 42.477]
  - - [32, 32, 1, 32]
    - [37, 2.12228]
  - - [5056, 1, 1, 1280]
    - [63, 33.5668]
  - - [5888, 5056, 1, 1280]
    - [26, 10088.9]
  - - [5888, 2944, 1, 1]
    - [47, 240.485]
  - - [64, 4288, 1, 1280]
    - [10, 4480.52]
  - - [1408, 4288, 1, 3328]
    - [26, 9733.76]
  - - [704, 2944, 1, 32]
    - [33, 2355.2]
  - - [1, 5888, 1, 1280]
    - [63, 38.3738]
  - - [2944, 4288, 1, 3328]
    - [26, 10131.0]
  - - [256, 2944, 1, 256]
    - [26, 6755.53]
  - - [704, 448, 1, 32]
    - [42, 712.75]
  - - [5056, 2944, 1, 256]
    - [26, 9616.71]
  - - [704, 1024, 1, 256]
    - [26, 6535.03]
  - - [2368, 1856, 1, 256]
    - [26, 9216.27]
  - - [64, 3584, 1, 1]
    - [50, 16.4782]
  - - [1024, 128, 1, 1280]
    - [18, 4324.02]
  - - [2368, 4288, 1, 1280]
    - [26, 10118.6]
  - - [3584, 448, 1, 256]
    - [26, 7457.22]
  - - [256, 6784, 1, 256]
    - [26, 8054.28]
  - - [1024, 32, 1, 32]
    - [35, 69.7191]
  - - [1024, 1408, 1, 1]
    - [48, 101.249]
  - - [128, 64, 1, 32]
    - [35, 16.7184]
  - - [64, 1, 1, 1280]
    - [64, 0.585141]
  - - [2368, 32, 1, 32]
    - [35, 156.239]
  - - [256, 5888, 1, 1]
    - [53, 104.097]
  - - [2944, 2944, 1, 1]
    - [47, 219.31]
  - - [6784, 3584, 1, 256]
    - [26, 9704.91]
  - - [1408, 1856, 1, 256]
    - [26, 8821.09]
  - - [128, 1408, 1, 256]
    - [1, 3151.46]
  - - [2944, 2944, 1, 32]
    - [33, 3289.24]
  - - [2944, 2944, 1, 3328]
    - [26, 9956.17]
  - - [1, 2944, 1, 256]
    - [63, 18.5084]
  - - [448, 32, 1, 1280]
    - [46, 151.104]
  - - [3584, 1, 1, 256]
    - [59, 22.9836]
  - - [704, 32, 1, 3328]
    - [46, 257.321]
  - - [256, 448, 1, 3328]
    - [18, 4109.41]
  - - [128, 128, 1, 256]
    - [3, 480.998]
  - - [2368, 64, 1, 256]
    - [18, 2819.57]
  - - [64, 448, 1, 1280]
    - [15, 1200.92]
  - - [6784, 1408, 1, 32]
    - [33, 3402.27]
  - - [1408, 448, 1, 3328]
    - [26, 6608.06]
  - - [2368, 6784, 1, 3328]
    - [26, 10217.2]
  - - [256, 2368, 1, 1]
    - [61, 52.2593]
  - - [4288, 3584, 1, 32]
    - [33, 3494.76]
  - - [5888, 64, 1, 3328]
    - [6, 5642.98]
  - - [3584, 704, 1, 1280]
    - [26, 9206.43]
  - - [448, 5056, 1, 3328]
    - [26, 9224.45]
  - - [4288, 448, 1, 256]
    - [26, 7860.97]
  - - [5056, 256, 1, 1280]
    - [26, 8589.54]
  - - [704, 448, 1, 3328]
    - [20, 4684.15]
  - - [2944, 5888, 1, 32]
    - [33, 3647.4]
  - - [3584, 5056, 1, 256]
    - [26, 9740.68]
  - - [6784, 1, 1, 3328]
    - [63, 46.0157]
  - - [32, 2368, 1, 3328]
    - [46, 856.598]
  - - [4288, 256, 1, 1]
    - [49, 83.1612]
  - - [64, 256, 1, 1]
    - [53, 1.57538]
  - - [1856, 448, 1, 3328]
    - [26, 6895.91]
  - - [3584, 2368, 1, 256]
    - [26, 9475.97]
  - - [4288, 4288, 1, 256]
    - [26, 9722.11]
  - - [4288, 256, 1, 1280]
    - [26, 7429.63]
  - - [448, 5056, 1, 256]
    - [26, 8302.73]
  - - [128, 1856, 1, 1]
    - [50, 22.497]
  - - [4288, 704, 1, 1280]
    - [26, 9317.14]
  - - [128, 1856, 1, 32]
    - [46, 546.133]
  - - [2368, 704, 1, 1]
    - [53, 109.102]
  - - [3584, 32, 1, 256]
    - [46, 843.682]
  - - [448, 2368, 1, 1280]
    - [26, 7161.95]
  - - [3584, 256, 1, 1]
    - [48, 73.5179]
  - - [1408, 1856, 1, 1280]
    - [26, 9530.88]
  - - [3584, 4288, 1, 3328]
    - [26, 10260.3]
  - - [448, 4288, 1, 32]
    - [33, 2227.27]
  - - [448, 4288, 1, 1280]
    - [26, 8580.79]
  - - [64, 3584, 1, 256]
    - [12, 3989.15]
  - - [1, 6784, 1, 1280]
    - [63, 44.742]
  - - [5056, 1024, 1, 256]
    - [26, 9173.59]
  - - [2368, 448, 1, 32]
    - [37, 1625.85]
  - - [4288, 3584, 1, 1280]
    - [26, 10189.8]
  - - [32, 2944, 1, 1280]
    - [46, 959.47]
  - - [1408, 704, 1, 1]
    - [50, 74.194]
  - - [2368, 256, 1, 256]
    - [26, 5590.39]
  - - [1, 5056, 1, 1]
    - [53, 0.549565]
  - - [4288, 32, 1, 32]
    - [42, 345.197]
  - - [1856, 3584, 1, 32]
    - [33, 3047.84]
  - - [5056, 3584, 1, 3328]
    - [24, 9923.39]
  - - [4288, 5056, 1, 256]
    - [26, 9858.8]
  - - [1856, 5888, 1, 256]
    - [26, 9684.3]
  - - [256, 256, 1, 256]
    - [11, 1777.25]
  - - [2368, 3584, 1, 1]
    - [48, 215.185]
  - - [4288, 2368, 1, 256]
    - [26, 9630.33]
  - - [448, 1, 1, 3328]
    - [64, 4.43311]
  - - [1856, 256, 1, 1280]
    - [20, 6616.34]
  - - [256, 2944, 1, 1]
    - [49, 61.5739]
  - - [1408, 2944, 1, 3328]
    - [26, 9850.8]
  - - [32, 1856, 1, 32]
    - [35, 121.83]
  - - [5888, 3584, 1, 1]
    - [52, 246.526]
  - - [256, 1, 1, 1]
    - [55, 0.0336842]
  - - [6784, 5056, 1, 3328]
    - [26, 10162.1]
  - - [6784, 5056, 1, 1]
    - [47, 257.816]
  - - [5888, 3584, 1, 32]
    - [33, 3698.96]
  - - [5888, 3584, 1, 3328]
    - [26, 10089.6]
  - - [32, 1024, 1, 1280]
    - [46, 339.125]
  - - [1, 256, 1, 3328]
    - [64, 2.5943]
  - - [1024, 6784, 1, 256]
    - [26, 9423.4]
  - - [6784, 5888, 1, 32]
    - [33, 3772.77]
  - - [1408, 1, 1, 1280]
    - [64, 13.0597]
  - - [2368, 6784, 1, 32]
    - [33, 3607.98]
  - - [6784, 64, 1, 1]
    - [53, 42.4]
  - - [5056, 1408, 1, 1280]
    - [29, 9632.26]
  - - [3584, 1408, 1, 3328]
    - [26, 9686.9]
  - - [2944, 3584, 1, 1]
    - [47, 229.376]
  - - [2944, 1408, 1, 1280]
    - [26, 9756.17]
  - - [1856, 64, 1, 1]
    - [48, 9.89867]
  - - [3584, 1024, 1, 1]
    - [48, 163.84]
  - - [256, 32, 1, 256]
    - [46, 70.6588]
  - - [2944, 1856, 1, 3328]
    - [26, 10006.4]
  - - [128, 1024, 1, 3328]
    - [15, 4656.36]
  - - [1408, 128, 1, 1]
    - [53, 13.1743]
  - - [2944, 3584, 1, 32]
    - [33, 3467.97]
  - - [5888, 256, 1, 32]
    - [40, 1944.94]
  - - [6784, 64, 1, 256]
    - [26, 5145.79]
  - - [256, 128, 1, 1280]
    - [15, 1376.08]
  - - [6784, 5056, 1, 256]
    - [26, 9755.54]
  - - [1408, 32, 1, 3328]
    - [46, 507.261]
  - - [1856, 3584, 1, 1280]
    - [26, 9841.0]
  - - [256, 5888, 1, 256]
    - [26, 7894.35]
  - - [5056, 32, 1, 256]
    - [46, 978.704]
  - - [1024, 4288, 1, 3328]
    - [26, 9856.57]
  - - [448, 2368, 1, 256]
    - [26, 6553.6]
  - - [64, 1408, 1, 1280]
    - [15, 3232.72]
  - - [3584, 32, 1, 1280]
    - [46, 1228.25]
  - - [128, 2368, 1, 3328]
    - [6, 4560.26]
  - - [64, 5056, 1, 256]
    - [6, 4044.8]
  - - [256, 64, 1, 256]
    - [3, 468.114]
  - - [32, 1408, 1, 256]
    - [42, 319.688]
  - - [2368, 448, 1, 3328]
    - [26, 7310.24]
  - - [2368, 1408, 1, 1]
    - [48, 157.271]
  - - [1, 1, 1, 1]
    - [53, 8.99281e-05]
  - - [1024, 1856, 1, 32]
    - [33, 2153.59]
  - - [32, 1024, 1, 32]
    - [34, 65.536]
  - - [4288, 1, 1, 256]
    - [63, 24.2004]
  - - [1856, 128, 1, 3328]
    - [20, 5574.07]
  - - [5888, 2368, 1, 1]
    - [53, 235.839]
  - - [2368, 2368, 1, 1]
    - [48, 192.035]
  - - [704, 256, 1, 1280]
    - [20, 3999.42]
  - - [704, 4288, 1, 256]
    - [26, 8663.68]
  - - [5888, 2368, 1, 32]
    - [33, 3461.9]
  - - [5888, 2368, 1, 1280]
    - [25, 9612.39]
  - - [128, 256, 1, 256]
    - [3, 936.229]
  - - [2944, 5056, 1, 3328]
    - [26, 10283.5]
  - - [6784, 704, 1, 3328]
    - [26, 9461.34]
  - - [1856, 1856, 1, 32]
    - [33, 2701.75]
  - - [4288, 2944, 1, 32]
    - [33, 3428.07]
  - - [256, 5056, 1, 1]
    - [49, 92.4526]
  - - [704, 64, 1, 256]
    - [3, 1264.73]
  - - [256, 2368, 1, 3328]
    - [26, 6363.42]
  - - [704, 1, 1, 1]
    - [48, 0.0637681]
  - - [128, 448, 1, 1280]
    - [15, 2311.09]
  - - [5056, 5056, 1, 256]
    - [26, 9693.33]
  - - [5888, 256, 1, 256]
    - [26, 7830.28]
  - - [5888, 64, 1, 1]
    - [50, 37.6832]
  - - [6784, 6784, 1, 256]
    - [29, 9863.53]
  - - [256, 3584, 1, 1]
    - [48, 72.5873]
  - - [2368, 1, 1, 256]
    - [63, 15.3083]
  - - [448, 32, 1, 32]
    - [35, 30.1811]
  - - [704, 64, 1, 1]
    - [61, 3.83129]
  - - [3584, 704, 1, 3328]
    - [26, 9315.09]
  - - [4288, 704, 1, 3328]
    - [26, 9404.63]
  - - [4288, 2944, 1, 1280]
    - [26, 10053.9]
  - - [448, 3584, 1, 256]
    - [26, 7457.22]
  - - [704, 32, 1, 256]
    - [42, 158.788]
  - - [6784, 256, 1, 32]
    - [41, 2124.41]
  - - [1856, 128, 1, 1]
    - [50, 21.6759]
  - - [1856, 32, 1, 32]
    - [35, 127.725]
  - - [6784, 1408, 1, 1280]
    - [26, 9840.31]
  - - [2368, 5056, 1, 1280]
    - [26, 10145.2]
  - - [704, 1856, 1, 1280]
    - [26, 8765.61]
  - - [1408, 1408, 1, 1280]
    - [29, 8950.18]
  - - [448, 1024, 1, 3328]
    - [26, 6587.53]
  - - [32, 704, 1, 32]
    - [35, 47.1791]
  - - [256, 704, 1, 1]
    - [53, 13.5711]
  - - [5888, 1856, 1, 32]
    - [33, 3439.22]
  - - [5888, 704, 1, 3328]
    - [26, 9671.24]
  - - [5056, 1, 1, 256]
    - [63, 28.6358]
  - - [448, 6784, 1, 256]
    - [26, 8714.64]
  - - [1024, 128, 1, 1]
    - [55, 11.1456]
  - - [128, 64, 1, 256]
    - [3, 209.715]
  - - [1856, 128, 1, 256]
    - [12, 4154.19]
  - - [2944, 5888, 1, 256]
    - [26, 9745.2]
  - - [1024, 256, 1, 1280]
    - [20, 5777.28]
  - - [128, 5056, 1, 32]
    - [37, 1226.86]
  - - [128, 5056, 1, 1280]
    - [26, 6658.96]
  - - [448, 32, 1, 3328]
    - [46, 158.569]
  - - [1856, 1408, 1, 32]
    - [33, 2506.71]
  - - [64, 704, 1, 32]
    - [35, 91.4843]
  - - [64, 704, 1, 3328]
    - [15, 1979.23]
  - - [64, 2368, 1, 32]
    - [35, 297.161]
  - - [5888, 64, 1, 32]
    - [44, 757.451]
  - - [2368, 256, 1, 1]
    - [63, 48.265]
  - - [5888, 64, 1, 1280]
    - [14, 5451.46]
  - - [5056, 1, 1, 1]
    - [61, 0.5056]
  - - [5888, 2944, 1, 1280]
    - [29, 9808.6]
  - - [32, 2368, 1, 256]
    - [42, 529.439]
  - - [256, 1408, 1, 256]
    - [12, 4385.68]
  - - [448, 5888, 1, 1]
    - [53, 142.739]
  - - [3584, 1408, 1, 1]
    - [47, 183.902]
  - - [32, 6784, 1, 1280]
    - [46, 1561.78]
  - - [32, 6784, 1, 32]
    - [42, 482.418]
  - - [448, 5888, 1, 32]
    - [33, 2425.59]
  - - [5056, 704, 1, 1280]
    - [26, 9340.79]
  - - [1856, 6784, 1, 1]
    - [53, 231.454]
  - - [5056, 64, 1, 1]
    - [55, 31.355]
  - - [1, 5888, 1, 1]
    - [48, 0.623729]
  - - [2368, 1024, 1, 256]
    - [26, 8290.02]
  - - [1856, 6784, 1, 32]
    - [33, 3507.27]
  - - [1856, 6784, 1, 1280]
    - [26, 10056.3]
  - - [64, 3584, 1, 3328]
    - [17, 5381.86]
  - - [5888, 5056, 1, 3328]
    - [24, 9915.45]
  - - [1, 2944, 1, 3328]
    - [64, 29.1596]
  - - [1408, 6784, 1, 32]
    - [33, 3348.6]
  - - [32, 5888, 1, 1280]
    - [46, 1354.29]
  - - [448, 256, 1, 1]
    - [48, 9.49404]
  - - [3584, 5888, 1, 3328]
    - [26, 10294.5]
  - - [4288, 1408, 1, 256]
    - [26, 9191.25]
  - - [448, 64, 1, 1280]
    - [15, 1207.24]
  - - [128, 448, 1, 32]
    - [45, 106.687]
  - - [6784, 2368, 1, 256]
    - [26, 9569.32]
  - - [1408, 448, 1, 32]
    - [37, 1213.05]
  - - [1856, 1408, 1, 1280]
    - [26, 9539.58]
  - - [448, 256, 1, 3328]
    - [18, 4095.3]
  - - [1856, 2368, 1, 1]
    - [48, 177.218]
  - - [1408, 5056, 1, 3328]
    - [26, 9884.32]
  - - [128, 704, 1, 3328]
    - [15, 3477.42]
  - - [5056, 128, 1, 1280]
    - [6, 6663.25]
  - - [5056, 4288, 1, 256]
    - [26, 9677.28]
  - - [5056, 5056, 1, 32]
    - [33, 3723.69]
  - - [1856, 704, 1, 256]
    - [26, 7874.19]
  - - [64, 256, 1, 256]
    - [3, 485.452]
  - - [448, 5888, 1, 1280]
    - [26, 8831.38]
  - - [128, 6784, 1, 256]
    - [6, 6387.88]
  - - [5056, 448, 1, 256]
    - [26, 8255.45]
  - - [4288, 5888, 1, 1]
    - [48, 249.484]
  - - [1856, 5056, 1, 1280]
    - [26, 10114.7]
  - - [2368, 4288, 1, 1]
    - [53, 222.675]
  - - [2368, 32, 1, 3328]
    - [46, 851.278]
  - - [3584, 1856, 1, 256]
    - [26, 9352.41]
  - - [256, 3584, 1, 256]
    - [26, 6703.23]
  - - [64, 704, 1, 1]
    - [53, 3.83129]
  - - [4288, 5888, 1, 32]
    - [33, 3672.4]
  - - [4288, 5888, 1, 3328]
    - [26, 10292.6]
  - - [1, 1024, 1, 1]
    - [53, 0.0934307]
  - - [1024, 2944, 1, 3328]
    - [26, 9409.5]
  - - [2944, 2368, 1, 256]
    - [26, 9452.73]
  - - [1024, 1856, 1, 256]
    - [26, 7888.12]
  - - [2944, 64, 1, 3328]
    - [19, 4632.45]
  - - [1024, 5888, 1, 32]
    - [41, 2973.77]
  - - [1024, 5888, 1, 3328]
    - [26, 10125.9]
  - - [5056, 2368, 1, 32]
    - [33, 3339.64]
  - - [1408, 2368, 1, 1280]
    - [26, 9551.71]
  - - [256, 1, 1, 3328]
    - [64, 2.54106]
  - - [128, 1024, 1, 32]
    - [35, 259.549]
  - - [5056, 6784, 1, 3328]
    - [26, 10178.4]
  - - [448, 704, 1, 1]
    - [63, 27.9603]
  - - [32, 64, 1, 32]
    - [35, 4.20103]
  - - [448, 704, 1, 32]
    - [42, 678.262]
  - - [448, 704, 1, 3328]
    - [20, 4692.53]
  - - [1408, 2944, 1, 256]
    - [29, 9211.45]
  - - [64, 5888, 1, 1]
    - [58, 35.1522]
  - - [2368, 128, 1, 32]
    - [42, 684.981]
  - - [2368, 256, 1, 1280]
    - [26, 6253.6]
  - - [2368, 128, 1, 3328]
    - [14, 4556.97]
  - - [704, 5056, 1, 32]
    - [33, 2786.24]
  - - [32, 2368, 1, 32]
    - [35, 152.314]
  - - [1408, 1, 1, 256]
    - [63, 9.23279]
  - - [4288, 256, 1, 32]
    - [41, 1728.71]
  - - [448, 1408, 1, 1]
    - [59, 53.2757]
  - - [5056, 4288, 1, 1280]
    - [26, 10064.2]
  - - [1408, 256, 1, 256]
    - [26, 4402.42]
  - - [4288, 448, 1, 1]
    - [48, 87.3193]
  - - [256, 4288, 1, 32]
    - [37, 1701.9]
  - - [1408, 256, 1, 1280]
    - [20, 5103.69]
  - - [256, 256, 1, 1]
    - [48, 5.49799]
  - - [1408, 1, 1, 1]
    - [55, 0.129412]
  - - [448, 1408, 1, 256]
    - [26, 5750.74]
  - - [5888, 5888, 1, 1]
    - [52, 262.005]
  - - [128, 2944, 1, 32]
    - [42, 819.2]
  - - [32, 256, 1, 32]
    - [42, 23.4057]
  - - [2944, 704, 1, 1280]
    - [26, 9262.91]
  - - [1024, 3584, 1, 1280]
    - [26, 9799.78]
  - - [1856, 448, 1, 1]
    - [48, 66.6256]
  - - [2368, 2944, 1, 1]
    - [53, 204.56]
  - - [5056, 256, 1, 32]
    - [41, 1903.44]
  - - [4288, 1, 1, 3328]
    - [63, 29.31]
  - - [5056, 1024, 1, 1280]
    - [29, 9676.14]
  - - [704, 704, 1, 1]
    - [53, 43.6282]
  - - [1856, 448, 1, 1280]
    - [26, 6780.74]
  - - [3584, 6784, 1, 256]
    - [26, 9877.41]
  - - [64, 1856, 1, 1280]
    - [18, 3984.37]
  - - [1856, 1408, 1, 256]
    - [26, 8830.41]
  - - [4288, 4288, 1, 32]
    - [33, 3628.41]
  - - [128, 1, 1, 256]
    - [63, 0.835908]
  - - [32, 64, 1, 3328]
    - [46, 23.2334]
  - - [5888, 448, 1, 1]
    - [48, 139.126]
  - - [128, 5888, 1, 256]
    - [26, 6643.87]
  - - [3584, 256, 1, 3328]
    - [21, 7616.88]
  - - [5056, 5056, 1, 1280]
    - [26, 10067.7]
  - - [6784, 1408, 1, 3328]
    - [26, 9895.84]
  - - [448, 2368, 1, 1]
    - [61, 79.8843]
  - - [2368, 1, 1, 1280]
    - [64, 21.9259]
  - - [32, 3584, 1, 32]
    - [42, 273.067]
  - - [128, 6784, 1, 1]
    - [53, 72.8483]
  - - [1, 3584, 1, 1]
    - [48, 0.373333]
  - - [5888, 5888, 1, 3328]
    - [24, 10023.9]
  - - [256, 2944, 1, 3328]
    - [26, 7897.34]
  - - [1, 128, 1, 3328]
    - [64, 1.27114]
  - - [32, 256, 1, 256]
    - [46, 70.4688]
  - - [5888, 1408, 1, 32]
    - [33, 3390.72]
  - - [704, 256, 1, 1]
    - [53, 14.1686]
  - - [1, 448, 1, 1]
    - [54, 0.0533333]
  - - [256, 6784, 1, 3328]
    - [26, 8889.74]
  - - [64, 5888, 1, 256]
    - [6, 4637.93]
  - - [1856, 1, 1, 1]
    - [48, 0.170588]
  - - [1024, 256, 1, 3328]
    - [20, 6133.4]
  - - [704, 704, 1, 256]
    - [26, 5746.27]
  - - [448, 1024, 1, 32]
    - [37, 899.514]
  - - [6784, 2368, 1, 1280]
    - [26, 9952.06]
  - - [128, 1856, 1, 1280]
    - [17, 5271.97]
  - - [256, 2368, 1, 256]
    - [26, 5558.35]
  - - [2944, 1408, 1, 1]
    - [48, 173.874]
  - - [6784, 1024, 1, 256]
    - [26, 9270.15]
  - - [5056, 1408, 1, 32]
    - [33, 3178.06]
  - - [1408, 6784, 1, 3328]
    - [26, 10099.1]
  - - [2944, 1408, 1, 3328]
    - [26, 9849.68]
  - - [1856, 32, 1, 256]
    - [42, 424.229]
  - - [704, 2368, 1, 32]
    - [37, 2033.01]
  - - [448, 256, 1, 32]
    - [36, 220.554]
  - - [704, 6784, 1, 1]
    - [53, 182.566]
  - - [2368, 6784, 1, 256]
    - [26, 9712.16]
  - - [1856, 3584, 1, 3328]
    - [26, 9915.41]
  - - [1, 704, 1, 3328]
    - [64, 7.00464]
  - - [64, 1, 1, 3328]
    - [64, 0.635266]
  - - [448, 704, 1, 1280]
    - [12, 4542.1]
  - - [704, 1856, 1, 1]
    - [55, 93.8667]
  - - [704, 448, 1, 256]
    - [26, 3866.87]
  - - [448, 64, 1, 3328]
    - [15, 1293.66]
  - - [704, 6784, 1, 256]
    - [26, 9037.84]
  - - [256, 32, 1, 1280]
    - [46, 86.6878]
  - - [2368, 448, 1, 1280]
    - [26, 7195.35]
  - - [6784, 2944, 1, 32]
    - [33, 3684.89]
  - - [64, 4288, 1, 32]
    - [35, 620.185]
  - - [128, 704, 1, 1]
    - [55, 7.66258]
  - - [128, 448, 1, 3328]
    - [18, 2487.5]
  - - [5888, 2368, 1, 3328]
    - [26, 9960.49]
  - - [2368, 704, 1, 1280]
    - [26, 8432.87]
  - - [1024, 1408, 1, 1280]
    - [26, 8325.03]
  - - [4288, 64, 1, 1280]
    - [18, 4321.76]
  - - [128, 5056, 1, 1]
    - [59, 57.373]
  - - [2944, 5056, 1, 32]
    - [33, 3569.51]
  - - [448, 448, 1, 1]
    - [63, 14.336]
  - - [256, 2368, 1, 1280]
    - [26, 6241.52]
  - - [704, 2368, 1, 3328]
    - [26, 8534.36]
  - - [3584, 2944, 1, 256]
    - [26, 9559.5]
  - - [64, 6784, 1, 256]
    - [12, 5203.61]
  - - [3584, 1024, 1, 1280]
    - [26, 9780.19]
  - - [64, 1024, 1, 256]
    - [3, 1733.18]
  - - [1408, 32, 1, 32]
    - [35, 94.8547]
  - - [128, 3584, 1, 256]
    - [12, 5417.0]
  - - [704, 1408, 1, 1]
    - [50, 76.0147]
  - - [5056, 3584, 1, 256]
    - [26, 9587.67]
  - - [2368, 704, 1, 256]
    - [26, 7753.82]
  - - [1856, 1856, 1, 1280]
    - [26, 9219.77]
  - - [32, 5888, 1, 32]
    - [35, 440.739]
  - - [64, 32, 1, 32]
    - [35, 4.38075]
  - - [4288, 704, 1, 1]
    - [51, 117.553]
  - - [1856, 1024, 1, 1]
    - [53, 118.193]
  - - [4288, 2944, 1, 3328]
    - [26, 10118.2]
  - - [1024, 128, 1, 3328]
    - [15, 4668.32]
  - - [4288, 128, 1, 3328]
    - [20, 5784.83]
  - - [4288, 704, 1, 32]
    - [41, 2552.86]
  - - [1856, 1024, 1, 32]
    - [39, 2105.87]
  - - [1, 448, 1, 3328]
    - [64, 4.42154]
  - - [2944, 6784, 1, 1]
    - [52, 252.683]
  - - [6784, 2368, 1, 32]
    - [33, 3561.98]
  - - [5888, 5056, 1, 1]
    - [47, 255.403]
  - - [128, 6784, 1, 1280]
    - [14, 7146.93]
  - - [704, 5888, 1, 1]
    - [48, 174.459]
  - - [6784, 6784, 1, 1]
    - [52, 252.65]
  - - [1856, 32, 1, 1280]
    - [46, 630.572]
  - - [5888, 448, 1, 3328]
    - [26, 8787.11]
  - - [704, 5888, 1, 32]
    - [33, 2903.78]
  - - [704, 5888, 1, 1280]
    - [26, 9753.3]
  - - [1024, 6784, 1, 3328]
    - [26, 9994.39]
  - - [704, 2944, 1, 1280]
    - [26, 9252.57]
  - - [4288, 6784, 1, 256]
    - [26, 9912.4]
  - - [3584, 256, 1, 32]
    - [37, 1535.57]
  - - [1408, 1408, 1, 32]
    - [33, 2246.42]
  - - [1408, 1408, 1, 3328]
    - [29, 9045.79]
  - - [1024, 64, 1, 256]
    - [3, 1747.63]
  - - [4288, 64, 1, 32]
    - [42, 616.701]
  - - [1408, 256, 1, 32]
    - [42, 800.996]
  - - [5888, 128, 1, 256]
    - [26, 6755.53]
  - - [64, 704, 1, 1280]
    - [15, 1839.02]
  - - [2944, 1856, 1, 256]
    - [26, 9385.4]
  - - [128, 5056, 1, 3328]
    - [6, 6798.53]
  - - [4288, 2944, 1, 1]
    - [53, 231.037]
  - - [6784, 5056, 1, 32]
    - [33, 3746.58]
  - - [1024, 448, 1, 3328]
    - [20, 6647.19]
  - - [3584, 128, 1, 1]
    - [55, 43.774]
  - - [2944, 4288, 1, 1280]
    - [26, 10065.4]
  - - [64, 32, 1, 3328]
    - [46, 23.348]
  - - [1024, 4288, 1, 256]
    - [26, 9195.63]
  - - [128, 2368, 1, 256]
    - [0, 3848.94]
  - - [2368, 64, 1, 32]
    - [35, 298.625]
  - - [1408, 1, 1, 3328]
    - [64, 13.9659]
  - - [64, 1408, 1, 32]
    - [37, 180.224]
  - - [2368, 5888, 1, 1]
    - [53, 235.52]
  - - [1408, 1856, 1, 32]
    - [41, 2381.09]
  - - [448, 1856, 1, 256]
    - [26, 6102.66]
  - - [1856, 6784, 1, 3328]
    - [26, 10106.9]
  - - [3584, 128, 1, 256]
    - [12, 5417.0]
  - - [1024, 448, 1, 1280]
    - [26, 6404.91]
  - - [1024, 2368, 1, 32]
    - [33, 2377.29]
  - - [32, 2944, 1, 256]
    - [42, 599.335]
  - - [128, 5888, 1, 1]
    - [52, 63.2268]
  - - [64, 5056, 1, 1]
    - [55, 29.9615]
  - - [1856, 256, 1, 32]
    - [35, 950.272]
  - - [2368, 2368, 1, 3328]
    - [26, 9828.05]
  - - [64, 448, 1, 1]
    - [62, 2.8672]
  - - [3584, 5888, 1, 32]
    - [33, 3619.66]
  - - [3584, 5888, 1, 1280]
    - [26, 10238.4]
  - - [64, 5056, 1, 32]
    - [42, 739.621]
  - - [2944, 64, 1, 1]
    - [55, 14.188]
  - - [6784, 704, 1, 256]
    - [26, 8906.17]
  - - [3584, 1024, 1, 32]
    - [33, 2817.67]
  - - [1408, 704, 1, 32]
    - [37, 1598.76]
  - - [1408, 704, 1, 1280]
    - [26, 8042.45]
  - - [2368, 5888, 1, 256]
    - [26, 9680.39]
  - - [2944, 64, 1, 32]
    - [35, 347.311]
  - - [1, 1408, 1, 256]
    - [63, 9.25175]
  - - [64, 2944, 1, 256]
    - [1, 3387.25]
  - - [5888, 5888, 1, 32]
    - [33, 3752.01]
  - - [1856, 1408, 1, 3328]
    - [26, 9658.06]
  - - [1024, 1024, 1, 32]
    - [37, 1671.04]
  - - [4288, 1024, 1, 1]
    - [48, 175.356]
  - - [704, 4288, 1, 3328]
    - [26, 9420.87]
  - - [2944, 5056, 1, 1280]
    - [26, 10223.1]
  - - [6784, 2944, 1, 1280]
    - [26, 9995.1]
  - - [6784, 256, 1, 3328]
    - [26, 8751.89]
  - - [5056, 128, 1, 3328]
    - [6, 6800.25]
  - - [128, 128, 1, 1280]
    - [15, 686.241]
  - - [128, 4288, 1, 1]
    - [61, 48.6582]
  - - [1408, 5056, 1, 32]
    - [33, 3075.1]
  - - [2944, 128, 1, 3328]
    - [6, 5655.2]
  - - [5888, 1856, 1, 1280]
    - [26, 9930.71]
  - - [64, 128, 1, 256]
    - [3, 222.156]
  - - [5888, 256, 1, 1280]
    - [26, 8576.55]
  - - [1856, 5056, 1, 1]
    - [53, 203.292]
  - - [3584, 1856, 1, 1280]
    - [26, 9838.28]
  - - [6784, 448, 1, 256]
    - [26, 8546.17]
  - - [704, 3584, 1, 256]
    - [26, 8498.98]
  - - [1856, 5056, 1, 32]
    - [33, 3357.4]
  - - [1856, 5056, 1, 3328]
    - [26, 10189.0]
  - - [1024, 2944, 1, 32]
    - [33, 2571.14]
  - - [1408, 6784, 1, 256]
    - [26, 9575.81]
  - - [1024, 2368, 1, 1280]
    - [26, 8872.01]
  - - [1856, 3584, 1, 1]
    - [53, 201.329]
  - - [5888, 128, 1, 1280]
    - [26, 7670.88]
  - - [2944, 5888, 1, 1280]
    - [26, 10160.4]
  - - [1, 1856, 1, 1]
    - [58, 0.166906]
  - - [3584, 3584, 1, 256]
    - [26, 9749.57]
  - - [1856, 2368, 1, 3328]
    - [26, 9862.57]
  - - [5888, 704, 1, 256]
    - [26, 9041.91]
  - - [64, 448, 1, 32]
    - [35, 58.5143]
  - - [6784, 4288, 1, 256]
    - [26, 9746.34]
  - - [128, 64, 1, 3328]
    - [15, 361.77]
  - - [1, 5056, 1, 1280]
    - [63, 33.6086]
  - - [32, 64, 1, 1280]
    - [46, 21.2366]
  - - [1408, 2368, 1, 3328]
    - [26, 9646.71]
  - - [1024, 3584, 1, 256]
    - [26, 9160.73]
  - - [2944, 128, 1, 256]
    - [14, 4550.42]
  - - [6784, 128, 1, 1]
    - [50, 71.4105]
  - - [1408, 256, 1, 3328]
    - [20, 5246.55]
  - - [448, 32, 1, 256]
    - [42, 100.383]
  - - [1024, 32, 1, 256]
    - [42, 231.986]
  - - [1, 5888, 1, 256]
    - [63, 32.4855]
  - - [64, 2368, 1, 256]
    - [1, 3012.21]
  - - [2944, 256, 1, 256]
    - [26, 6793.59]
  - - [1, 128, 1, 256]
    - [63, 0.834216]
  - - [32, 256, 1, 1280]
    - [46, 92.0449]
  - - [5888, 1, 1, 256]
    - [63, 32.6544]
  - - [32, 128, 1, 3328]
    - [46, 46.696]
  - - [6784, 128, 1, 256]
    - [26, 6272.52]
  - - [6784, 64, 1, 1280]
    - [20, 6104.41]
  - - [4288, 1024, 1, 32]
    - [33, 2922.4]
  - - [1408, 64, 1, 3328]
    - [18, 3461.37]
  - - [2944, 448, 1, 1280]
    - [26, 7659.74]
  - - [6784, 32, 1, 1280]
    - [46, 1541.68]
  - - [2944, 64, 1, 1280]
    - [18, 4616.62]
  - - [704, 448, 1, 1]
    - [61, 29.8667]
  - - [32, 128, 1, 32]
    - [35, 8.53333]
  - - [1, 128, 1, 1]
    - [53, 0.0115942]
  - - [5888, 1, 1, 1]
    - [48, 0.598374]
  - - [5888, 1856, 1, 3328]
    - [25, 9825.58]
  - - [2368, 3584, 1, 256]
    - [26, 9485.87]
  - - [4288, 1408, 1, 3328]
    - [26, 9723.2]
  - - [1856, 32, 1, 3328]
    - [46, 667.939]
  - - [2944, 32, 1, 256]
    - [42, 638.698]
  - - [128, 64, 1, 1]
    - [64, 0.682667]
  - - [256, 1024, 1, 3328]
    - [20, 6147.23]
  - - [32, 448, 1, 256]
    - [42, 99.7287]
  - - [1856, 64, 1, 3328]
    - [18, 4263.52]
  - - [256, 5056, 1, 256]
    - [26, 7859.35]
  - - [5888, 2944, 1, 3328]
    - [26, 10008.4]
  - - [2368, 1408, 1, 3328]
    - [26, 9644.69]
  - - [5888, 704, 1, 32]
    - [41, 2772.68]
  - - [2944, 704, 1, 1]
    - [53, 122.783]
  - - [6784, 1856, 1, 256]
    - [26, 9453.67]
  - - [1, 704, 1, 256]
    - [63, 4.58819]
  - - [1856, 1856, 1, 1]
    - [48, 161.27]
  - - [5888, 32, 1, 256]
    - [46, 1118.61]
  - - [128, 704, 1, 256]
    - [15, 2135.99]
  - - [256, 1408, 1, 3328]
    - [20, 5242.88]
  - - [2944, 128, 1, 1]
    - [63, 30.7869]
  - - [32, 256, 1, 3328]
    - [46, 95.2452]
  - - [2944, 704, 1, 3328]
    - [26, 9391.04]
  - - [704, 1024, 1, 32]
    - [42, 1304.79]
  - - [2368, 1856, 1, 32]
    - [33, 2872.55]
  - - [5056, 4288, 1, 3328]
    - [24, 9931.21]
  - - [3584, 448, 1, 3328]
    - [26, 8223.87]
  - - [256, 32, 1, 32]
    - [42, 23.7449]
  - - [64, 256, 1, 3328]
    - [15, 739.235]
  - - [256, 6784, 1, 1]
    - [48, 114.861]
  - - [1024, 3584, 1, 32]
    - [33, 2796.2]
  - - [256, 6784, 1, 32]
    - [41, 2111.49]
  - - [2944, 1408, 1, 32]
    - [33, 2898.71]
  - - [4288, 3584, 1, 1]
    - [53, 240.128]
  - - [1, 704, 1, 1]
    - [55, 0.0633094]
  - - [5056, 448, 1, 3328]
    - [26, 9062.96]
  - - [3584, 64, 1, 256]
    - [12, 3989.15]
  - - [64, 1856, 1, 32]
    - [35, 241.186]
  - - [64, 1856, 1, 3328]
    - [18, 4252.51]
  - - [6784, 3584, 1, 32]
    - [33, 3756.49]
  - - [4288, 1856, 1, 256]
    - [26, 9439.32]
  - - [1856, 2944, 1, 256]
    - [26, 9385.4]
  - - [128, 448, 1, 1]
    - [55, 4.81074]
  - - [64, 128, 1, 32]
    - [35, 16.5495]
  - - [704, 1, 1, 1280]
    - [64, 6.37823]
  - - [2944, 5888, 1, 1]
    - [52, 240.487]
  - - [1024, 1856, 1, 3328]
    - [29, 8678.66]
  - - [5888, 1024, 1, 32]
    - [33, 3164.99]
  - - [3584, 256, 1, 1280]
    - [26, 7459.38]
  - - [1024, 1, 1, 1]
    - [58, 0.0941176]
  - - [1408, 5056, 1, 1280]
    - [26, 9815.72]
  - - [3584, 128, 1, 1280]
    - [20, 6416.11]
  - - [5056, 6784, 1, 256]
    - [26, 9751.21]
  - - [256, 1856, 1, 256]
    - [26, 5589.84]
  - - [5888, 32, 1, 1280]
    - [46, 1354.9]
  - - [256, 128, 1, 32]
    - [37, 64.251]
  - - [32, 1856, 1, 1280]
    - [46, 614.268]
  - - [2944, 5056, 1, 1]
    - [47, 240.078]
  - - [448, 128, 1, 1]
    - [55, 4.84324]
  - - [256, 704, 1, 32]
    - [38, 309.397]
  - - [256, 704, 1, 1280]
    - [20, 4004.98]
  - - [1, 2368, 1, 1]
    - [59, 0.20274]
  - - [5888, 5888, 1, 1280]
    - [26, 10089.1]
  - - [256, 2944, 1, 1280]
    - [26, 7710.12]
  - - [2944, 256, 1, 3328]
    - [26, 7893.36]
  - - [5056, 2944, 1, 1280]
    - [26, 10012.9]
  - - [704, 1024, 1, 3328]
    - [26, 7553.97]
  - - [2368, 1856, 1, 1280]
    - [26, 9772.11]
  - - [448, 2944, 1, 1]
    - [49, 96.4117]
  - - [6784, 2944, 1, 1]
    - [47, 249.651]
  - - [2944, 1024, 1, 32]
    - [33, 2661.95]
  - - [2944, 1024, 1, 1280]
    - [26, 9302.7]
  - - [1408, 64, 1, 32]
    - [37, 182.969]
  - - [5056, 5056, 1, 1]
    - [48, 248.281]
  - - [2368, 4288, 1, 256]
    - [26, 9656.07]
  - - [448, 1856, 1, 1280]
    - [26, 6756.63]
  - - [2368, 448, 1, 1]
    - [57, 76.2115]
  - - [448, 2944, 1, 32]
    - [41, 1838.2]
  - - [448, 2944, 1, 1280]
    - [26, 7643.1]
  - - [2944, 6784, 1, 1280]
    - [26, 10191.5]
  - - [256, 6784, 1, 1280]
    - [26, 8776.77]
  - - [128, 2368, 1, 1280]
    - [0, 4685.67]
  - - [3584, 2368, 1, 32]
    - [33, 3328.2]
  - - [704, 32, 1, 32]
    - [37, 46.9333]
  - - [6784, 3584, 1, 3328]
    - [24, 9976.77]
  - - [128, 32, 1, 256]
    - [42, 28.556]
  - - [128, 1408, 1, 1280]
    - [15, 4526.82]
  - - [64, 32, 1, 1280]
    - [46, 21.2366]
  - - [128, 1856, 1, 3328]
    - [17, 5570.93]
  - - [2944, 2944, 1, 256]
    - [26, 9456.13]
  - - [1408, 1024, 1, 3328]
    - [26, 8453.64]
  - - [5056, 2368, 1, 1280]
    - [26, 9949.7]
  - - [448, 128, 1, 32]
    - [35, 112.439]
  - - [2368, 64, 1, 3328]
    - [18, 4271.38]
  - - [32, 5056, 1, 3328]
    - [46, 1211.4]
  - - [448, 2944, 1, 3328]
    - [26, 7758.31]
  - - [2944, 1024, 1, 1]
    - [48, 151.948]
  - - [2368, 128, 1, 1280]
    - [14, 4445.16]
  - - [3584, 704, 1, 256]
    - [26, 8580.27]
  - - [2368, 5888, 1, 3328]
    - [26, 10162.4]
  - - [4288, 2368, 1, 1]
    - [48, 223.853]
  - - [1408, 3584, 1, 32]
    - [33, 3044.51]
  - - [2944, 4288, 1, 32]
    - [37, 3306.84]
  - - [5888, 1408, 1, 1280]
    - [29, 9867.2]
  - - [3584, 5056, 1, 1280]
    - [26, 10154.9]
  - - [5888, 6784, 1, 1280]
    - [25, 10023.6]
  - - [64, 1856, 1, 1]
    - [55, 10.1007]
  - - [704, 128, 1, 32]
    - [35, 183.902]
  - - [3584, 2944, 1, 1]
    - [49, 227.791]
  - - [128, 3584, 1, 3328]
    - [17, 6729.23]
  - - [256, 4288, 1, 3328]
    - [26, 7543.03]
  - - [4288, 64, 1, 1]
    - [48, 26.8]
  - - [1, 1408, 1, 1280]
    - [64, 12.8658]
  - - [5056, 32, 1, 1280]
    - [46, 1186.38]
  - - [1856, 704, 1, 32]
    - [41, 1866.61]
  - - [1024, 1856, 1, 1]
    - [48, 119.984]
  - - [704, 5056, 1, 3328]
    - [26, 9610.08]
  - - [1024, 3584, 1, 3328]
    - [26, 9909.31]
  - - [5888, 256, 1, 3328]
    - [26, 8696.92]
  - - [1856, 1408, 1, 1]
    - [53, 142.024]
  - - [2944, 448, 1, 32]
    - [41, 1851.1]
  - - [128, 448, 1, 256]
    - [3, 1609.66]
  - - [128, 1024, 1, 1]
    - [55, 10.996]
  - - [32, 32, 1, 256]
    - [42, 7.15459]
  - - [4288, 5056, 1, 1280]
    - [26, 10262.2]
  - - [1856, 1856, 1, 3328]
    - [26, 9300.43]
  - - [1024, 2368, 1, 256]
    - [26, 8316.68]
  - - [4288, 2368, 1, 3328]
    - [26, 10180.2]
  - - [256, 64, 1, 32]
    - [42, 43.9839]
  - - [1, 1024, 1, 1280]
    - [64, 9.53112]
  - - [5056, 128, 1, 32]
    - [35, 1262.77]
  - - [5888, 3584, 1, 256]
    - [26, 9660.69]
  - - [1024, 5056, 1, 32]
    - [33, 2941.67]
  - - [5888, 448, 1, 1280]
    - [26, 8691.35]
  - - [704, 5888, 1, 3328]
    - [26, 9854.19]
  - - [1024, 1408, 1, 256]
    - [26, 7588.38]
  - - [3584, 2944, 1, 1280]
    - [26, 10010.1]
  - - [1, 5056, 1, 256]
    - [63, 28.6865]
  - - [256, 1024, 1, 1]
    - [53, 23.2397]
  - - [32, 32, 1, 3328]
    - [46, 11.6964]
  - - [2368, 1, 1, 3328]
    - [64, 23.3988]
  - - [4288, 1856, 1, 1280]
    - [26, 9912.53]
  - - [3584, 5888, 1, 1]
    - [47, 246.987]
  - - [5888, 4288, 1, 256]
    - [26, 9675.77]
  - - [1024, 2944, 1, 1280]
    - [26, 9313.48]
  - - [6784, 1, 1, 1]
    - [61, 0.695082]
  - - [1408, 64, 1, 1280]
    - [18, 3203.98]
  - - [1, 256, 1, 1280]
    - [64, 2.47043]
  - - [2944, 3584, 1, 256]
    - [26, 9586.64]
  - - [1, 128, 1, 1280]
    - [64, 1.18519]
  - - [1024, 256, 1, 32]
    - [42, 606.113]
  - - [5888, 1, 1, 1280]
    - [63, 38.9934]
  - - [2368, 32, 1, 1280]
    - [46, 798.167]
  - - [5888, 1856, 1, 1]
    - [47, 202.974]
  - - [6784, 128, 1, 1280]
    - [14, 7132.25]
  - - [6784, 2368, 1, 3328]
    - [26, 10011.6]
  - - [1, 64, 1, 256]
    - [63, 0.415416]
  - - [704, 128, 1, 1]
    - [55, 7.76828]
  - - [1408, 4288, 1, 32]
    - [33, 3152.74]
  - - [256, 64, 1, 1280]
    - [15, 680.894]
  - - [256, 448, 1, 256]
    - [1, 2678.84]
  - - [1856, 1024, 1, 1280]
    - [29, 8544.17]
  - - [5888, 1856, 1, 256]
    - [26, 9505.3]
  - - [5056, 1856, 1, 1]
    - [48, 220.074]
  - - [5888, 2368, 1, 256]
    - [26, 9513.2]
  - - [1408, 1024, 1, 32]
    - [37, 1948.37]
  - - [32, 704, 1, 256]
    - [46, 156.377]
  - - [2944, 1, 1, 256]
    - [63, 18.6921]
  - - [32, 4288, 1, 256]
    - [42, 792.583]
  - - [5056, 1856, 1, 32]
    - [33, 3255.49]
  - - [5056, 1856, 1, 1280]
    - [26, 9913.69]
  - - [1, 64, 1, 1]
    - [48, 0.00571429]
  - - [1408, 5888, 1, 3328]
    - [26, 10099.2]
  - - [1408, 704, 1, 3328]
    - [21, 8212.56]
  - - [5056, 704, 1, 3328]
    - [26, 9429.53]
  - - [704, 64, 1, 1280]
    - [18, 1839.02]
  - - [1, 704, 1, 1280]
    - [64, 6.44394]
  - - [5888, 6784, 1, 1]
    - [47, 264.46]
  - - [5888, 4288, 1, 32]
    - [33, 3715.64]
  - - [1408, 3584, 1, 256]
    - [26, 9138.69]
  - - [1856, 704, 1, 1]
    - [50, 92.8]
  - - [6784, 256, 1, 1]
    - [53, 114.257]
  - - [2944, 1, 1, 1]
    - [48, 0.245333]
  - - [256, 1856, 1, 3328]
    - [20, 6954.84]
  - - [4288, 128, 1, 1280]
    - [12, 5669.35]
  - - [6784, 256, 1, 1280]
    - [26, 8618.88]
  - - [128, 4288, 1, 256]
    - [14, 5105.71]
  - - [128, 128, 1, 32]
    - [42, 43.4013]
  - - [128, 1408, 1, 32]
    - [41, 332.21]
  - - [6784, 128, 1, 32]
    - [41, 1516.77]
  - - [1408, 448, 1, 1]
    - [50, 53.6381]
  - - [2368, 704, 1, 3328]
    - [26, 8539.61]
  - - [704, 128, 1, 3328]
    - [18, 3458.17]
  - - [2944, 1856, 1, 32]
    - [33, 2977.69]
  - - [1024, 64, 1, 1]
    - [48, 5.53514]
  - - [1408, 32, 1, 1280]
    - [46, 470.559]
  - - [704, 1, 1, 256]
    - [63, 4.59755]
  - - [2368, 1408, 1, 256]
    - [26, 8965.77]
  - - [2368, 1856, 1, 1]
    - [48, 176.082]
  - - [4288, 1408, 1, 1]
    - [61, 186.343]
  - - [3584, 2368, 1, 1280]
    - [26, 9953.86]
  - - [64, 5056, 1, 1280]
    - [10, 4921.43]
  - - [1408, 2944, 1, 1]
    - [47, 173.874]
  - - [4288, 1408, 1, 32]
    - [33, 3169.29]
  - - [5888, 2944, 1, 256]
    - [26, 9570.34]
  - - [128, 64, 1, 1280]
    - [3, 326.05]
  - - [1408, 2944, 1, 32]
    - [33, 2893.65]
  - - [1, 3584, 1, 1280]
    - [64, 34.0319]
  - - [64, 64, 1, 32]
    - [35, 8.15124]
  - - [448, 1408, 1, 32]
    - [42, 1201.49]
  - - [128, 5056, 1, 256]
    - [26, 5916.96]
  - - [1, 1, 1, 1280]
    - [64, 0.00913242]
  - - [64, 704, 1, 256]
    - [3, 1264.73]
  - - [5888, 6784, 1, 256]
    - [26, 9743.22]
  - - [6784, 5888, 1, 1]
    - [47, 263.763]
  - - [64, 4288, 1, 256]
    - [1, 3769.02]
  - - [1, 448, 1, 1280]
    - [64, 4.15777]
  - - [1024, 1024, 1, 1]
    - [48, 78.4862]
  - - [6784, 5888, 1, 1280]
    - [24, 9977.93]
  - - [1024, 4288, 1, 32]
    - [41, 2828.28]
  - - [1856, 1, 1, 1280]
    - [64, 16.9982]
  - - [3584, 5888, 1, 256]
    - [26, 9822.3]
  - - [5056, 2368, 1, 1]
    - [54, 214.102]
  - - [256, 1408, 1, 1280]
    - [20, 5117.27]
  - - [64, 256, 1, 32]
    - [35, 33.6082]
  - - [64, 5888, 1, 3328]
    - [6, 5661.33]
  - - [6784, 64, 1, 3328]
    - [20, 6344.12]
  - - [5056, 448, 1, 1]
    - [48, 131.081]
  - - [2944, 448, 1, 3328]
    - [26, 7768.19]
  - - [2368, 1024, 1, 1280]
    - [26, 8869.98]
  - - [1856, 6784, 1, 256]
    - [26, 9639.12]
  - - [4288, 32, 1, 1280]
    - [46, 993.869]
  - - [448, 1408, 1, 1280]
    - [26, 6486.21]
  - - [5056, 448, 1, 32]
    - [41, 2305.43]
  - - [3584, 2944, 1, 32]
    - [33, 3493.81]
  - - [2368, 128, 1, 1]
    - [55, 25.9507]
  - - [32, 128, 1, 1280]
    - [46, 42.4729]
  - - [3584, 1856, 1, 32]
    - [33, 3133.99]
  - - [128, 128, 1, 3328]
    - [15, 732.876]
  - - [5056, 64, 1, 256]
    - [6, 4013.44]
  - - [64, 448, 1, 3328]
    - [15, 1295.07]
  - - [4288, 1408, 1, 1280]
    - [26, 9645.54]
  - - [6784, 2368, 1, 1]
    - [57, 233.768]
  - - [32, 5056, 1, 256]
    - [46, 960.546]
  - - [704, 128, 1, 256]
    - [11, 2135.99]
  - - [704, 5056, 1, 1]
    - [53, 163.576]
  - - [256, 1024, 1, 32]
    - [44, 548.993]
  - - [256, 1024, 1, 1280]
    - [20, 5809.29]
  - - [2368, 128, 1, 256]
    - [14, 3759.43]
  - - [32, 64, 1, 256]
    - [42, 14.2161]
  - - [2368, 1408, 1, 1280]
    - [26, 9536.34]
  - - [128, 256, 1, 32]
    - [35, 66.198]
  - - [64, 6784, 1, 32]
    - [42, 909.269]
  - - [6784, 32, 1, 256]
    - [46, 1265.36]
  - - [256, 4288, 1, 1]
    - [49, 82.1653]
  - - [5888, 1408, 1, 1]
    - [52, 189.449]
  - - [1024, 4288, 1, 1280]
    - [26, 9769.79]
  - - [1856, 4288, 1, 1]
    - [48, 211.663]
  - - [128, 2944, 1, 256]
    - [14, 4567.66]
  - - [3584, 4288, 1, 256]
    - [26, 9736.33]
  - - [2368, 2944, 1, 256]
    - [26, 9448.71]
  - - [3584, 128, 1, 32]
    - [37, 950.781]
  - - [3584, 128, 1, 3328]
    - [20, 6696.17]
  - - [704, 5056, 1, 256]
    - [26, 8891.61]
  - - [1856, 4288, 1, 32]
    - [33, 3292.05]
  - - [64, 256, 1, 1280]
    - [15, 684.449]
  - - [4288, 1024, 1, 1280]
    - [26, 9752.16]
  - - [1, 4288, 1, 256]
    - [63, 24.1577]
  - - [64, 2368, 1, 1]
    - [55, 12.3817]
  - - [4288, 6784, 1, 32]
    - [33, 3693.94]
  - - [704, 704, 1, 3328]
    - [26, 7109.53]
  - - [128, 2944, 1, 1]
    - [61, 36.2338]
  - - [3584, 1408, 1, 256]
    - [29, 9087.27]
  - - [704, 3584, 1, 3328]
    - [26, 9327.51]
  - - [5056, 448, 1, 1280]
    - [26, 8939.67]
  - - [1408, 2944, 1, 1280]
    - [26, 9760.48]
  - - [5888, 704, 1, 1280]
    - [26, 9570.33]
  - - [64, 64, 1, 256]
    - [3, 104.025]
  - - [704, 1408, 1, 1280]
    - [13, 8067.0]
  - - [4288, 5888, 1, 256]
    - [26, 9808.52]
  - - [6784, 64, 1, 32]
    - [38, 918.891]
  - - [3584, 3584, 1, 3328]
    - [26, 10292.5]
  - - [2944, 6784, 1, 32]
    - [33, 3654.55]
  - - [448, 64, 1, 32]
    - [35, 56.7762]
  - - [5056, 256, 1, 1]
    - [49, 94.0651]
  - - [64, 6784, 1, 1280]
    - [20, 6109.78]
  - - [2944, 2368, 1, 3328]
    - [26, 10014.8]
  - - [1, 4288, 1, 1]
    - [61, 0.397037]
  - - [1408, 128, 1, 256]
    - [12, 3134.33]
  - - [1024, 1856, 1, 1280]
    - [29, 8548.98]
  - - [448, 5888, 1, 256]
    - [26, 8235.16]
  - - [1024, 5888, 1, 256]
    - [26, 9467.03]
  - - [704, 1408, 1, 256]
    - [26, 7111.98]
  - - [6784, 2944, 1, 3328]
    - [26, 10044.1]
  - - [1408, 2368, 1, 256]
    - [26, 8905.89]
  - - [64, 128, 1, 1280]
    - [3, 327.675]
  - - [5888, 32, 1, 3328]
    - [46, 1415.33]
  - - [1408, 5056, 1, 256]
    - [26, 9366.9]
  - - [1024, 1408, 1, 32]
    - [41, 1884.7]
  - - [4288, 128, 1, 32]
    - [35, 1081.51]
  - - [6784, 704, 1, 1]
    - [48, 180.907]
  - - [448, 704, 1, 256]
    - [26, 3866.87]
  - - [704, 3584, 1, 32]
    - [33, 2449.65]
  - - [1856, 256, 1, 3328]
    - [20, 6964.64]
  - - [448, 1024, 1, 1280]
    - [26, 6393.76]
  - - [4288, 4288, 1, 1]
    - [48, 239.164]
  - - [5056, 2944, 1, 1]
    - [48, 238.539]
  - - [64, 2368, 1, 3328]
    - [15, 4306.4]
  - - [256, 704, 1, 3328]
    - [20, 4235.77]
  - - [1, 2944, 1, 1]
    - [53, 0.242105]
  - - [1024, 1024, 1, 256]
    - [26, 7557.3]
  - - [3584, 1, 1, 1]
    - [48, 0.367213]
  - - [256, 2944, 1, 32]
    - [41, 1328.04]
  - - [6784, 4288, 1, 3328]
    - [25, 10071.9]
  - - [5056, 2944, 1, 3328]
    - [25, 9797.94]
  - - [704, 1024, 1, 1280]
    - [26, 7398.55]
  - - [256, 3584, 1, 1280]
    - [26, 7444.25]
  - - [2368, 1856, 1, 3328]
    - [26, 9854.59]
  - - [1856, 4288, 1, 1280]
    - [26, 9934.97]
  - - [1, 1024, 1, 256]
    - [63, 6.68735]
  - - [3584, 448, 1, 1]
    - [59, 104.533]
  - - [2944, 1024, 1, 3328]
    - [26, 9404.55]
  - - [32, 1408, 1, 3328]
    - [46, 506.576]
  - - [128, 1, 1, 3328]
    - [64, 1.27114]
  - - [5888, 5056, 1, 32]
    - [33, 3705.01]
  - - [704, 2944, 1, 1]
    - [55, 123.958]
  - - [3584, 448, 1, 32]
    - [41, 2013.33]
  - - [3584, 448, 1, 1280]
    - [26, 8093.92]
  - - [2944, 6784, 1, 3328]
    - [26, 10252.2]
  - - [1856, 2368, 1, 1280]
    - [26, 9769.4]
  - - [6784, 1024, 1, 1280]
    - [26, 9720.91]
  - - [6784, 3584, 1, 1280]
    - [26, 10084.8]
  - - [1, 5056, 1, 3328]
    - [63, 34.1666]
  - - [128, 128, 1, 1]
    - [63, 1.8789]
  - - [128, 2368, 1, 32]
    - [42, 688.873]
  - - [128, 1408, 1, 3328]
    - [15, 4691.69]
  - - [2944, 32, 1, 3328]
    - [46, 1055.5]
  - - [704, 1856, 1, 256]
    - [26, 7844.65]
  - - [1408, 1408, 1, 1]
    - [48, 119.714]
  - - [1408, 4288, 1, 256]
    - [26, 9204.39]
  - - [256, 5056, 1, 3328]
    - [26, 8876.42]
  - - [2368, 64, 1, 1280]
    - [18, 4054.9]
  - - [1856, 448, 1, 32]
    - [41, 1433.6]
  - - [1408, 448, 1, 256]
    - [26, 5718.16]
  - - [32, 128, 1, 256]
    - [42, 26.859]
  - - [448, 1024, 1, 1]
    - [53, 39.0095]
  - - [128, 1024, 1, 1280]
    - [15, 4378.19]
  - - [448, 6784, 1, 1]
    - [48, 153.187]
  - - [704, 2944, 1, 256]
    - [26, 8427.25]
  - - [1408, 1408, 1, 256]
    - [29, 8303.51]
  - - [448, 6784, 1, 32]
    - [41, 2475.95]
  - - [1, 64, 1, 1280]
    - [64, 0.584141]
  - - [1408, 1856, 1, 1]
    - [53, 140.8]
  - - [4288, 448, 1, 32]
    - [41, 2134.47]
  - - [4288, 448, 1, 1280]
    - [26, 8561.67]
  - - [2944, 704, 1, 32]
    - [37, 2240.62]
  - - [1024, 704, 1, 256]
    - [26, 6372.56]
  - - [448, 4288, 1, 1]
    - [48, 120.064]
  - - [3584, 5056, 1, 1]
    - [48, 244.346]
  - - [1408, 3584, 1, 1280]
    - [26, 9607.37]
  - - [6784, 448, 1, 1280]
    - [26, 9201.07]
  - - [3584, 5056, 1, 3328]
    - [26, 10224.4]
  - - [2368, 2368, 1, 32]
    - [33, 3115.24]
  - - [64, 5888, 1, 32]
    - [42, 823.677]
  - - [1856, 448, 1, 256]
    - [26, 6173.46]
  - - [128, 1024, 1, 256]
    - [15, 2853.27]
  - - [3584, 64, 1, 3328]
    - [20, 5369.75]
  - - [5888, 2944, 1, 32]
    - [33, 3628.31]
  - - [2944, 1, 1, 1280]
    - [64, 27.1024]
  - - [1856, 2944, 1, 32]
    - [33, 3069.7]
  - - [5056, 1408, 1, 1]
    - [53, 204.095]
  - - [5888, 1408, 1, 3328]
    - [26, 9895.17]
  - - [448, 4288, 1, 256]
    - [26, 7911.55]
  - - [6784, 1024, 1, 1]
    - [54, 205.284]
  - - [256, 448, 1, 1]
    - [55, 9.49404]
  - - [128, 5888, 1, 3328]
    - [26, 7903.31]
  - - [6784, 1024, 1, 32]
    - [33, 3246.18]
  - - [256, 448, 1, 32]
    - [37, 224.878]
  - - [6784, 3584, 1, 1]
    - [53, 252.638]
  - - [2944, 2368, 1, 32]
    - [33, 3150.91]
  - - [3584, 6784, 1, 3328]
    - [26, 10349.4]
  - - [448, 128, 1, 1280]
    - [18, 2328.69]
  - - [64, 3584, 1, 32]
    - [35, 397.188]
  - - [64, 3584, 1, 1280]
    - [20, 5111.44]
  - - [6784, 1408, 1, 256]
    - [26, 9410.71]
  - - [5056, 1024, 1, 32]
    - [37, 2962.71]
  - - [1024, 5056, 1, 1280]
    - [26, 9865.13]
  - - [4288, 3584, 1, 256]
    - [26, 9765.33]
  - - [2368, 256, 1, 3328]
    - [26, 6361.82]
  - - [448, 6784, 1, 1280]
    - [26, 9369.5]
  - - [1856, 5888, 1, 1]
    - [53, 226.162]
  - - [256, 5888, 1, 32]
    - [33, 1976.82]
  - - [3584, 1, 1, 3328]
    - [64, 35.6259]
  - - [4288, 32, 1, 256]
    - [46, 831.612]
  - - [256, 64, 1, 1]
    - [55, 1.86182]
  - - [4288, 5056, 1, 32]
    - [33, 3676.16]
  - - [4288, 5056, 1, 3328]
    - [26, 10318.7]
  - - [1856, 5888, 1, 32]
    - [33, 3458.27]
  - - [1856, 5888, 1, 1280]
    - [26, 10133.3]
  - - [256, 256, 1, 1280]
    - [15, 2595.49]
  - - [704, 2368, 1, 1280]
    - [26, 8419.56]
  - - [4288, 2368, 1, 1280]
    - [26, 10112.3]
  - - [2944, 5056, 1, 256]
    - [26, 9790.66]
  - - [32, 1856, 1, 256]
    - [42, 391.058]
  - - [64, 5888, 1, 1280]
    - [14, 5506.22]
  - - [1, 1856, 1, 1280]
    - [64, 16.9691]
  - - [2944, 4288, 1, 1]
    - [54, 232.741]
  - - [5056, 5888, 1, 32]
    - [33, 3723.54]
  - - [704, 1, 1, 3328]
    - [64, 6.99459]
  - - [448, 256, 1, 1280]
    - [18, 3791.34]
  - - [1408, 256, 1, 1]
    - [55, 32.4144]
  - - [2368, 5056, 1, 3328]
    - [26, 10218.7]
  - - [1024, 5056, 1, 3328]
    - [26, 9952.29]
  - - [704, 704, 1, 1280]
    - [26, 6895.53]
  - - [128, 32, 1, 3328]
    - [46, 46.5556]
  - - [1024, 6784, 1, 32]
    - [33, 3104.72]
  - - [3584, 2944, 1, 3328]
    - [26, 10082.8]
  - - [128, 1856, 1, 256]
    - [4, 4131.62]
  - - [32, 32, 1, 1280]
    - [46, 10.8288]
  - - [1408, 5888, 1, 1]
    - [52, 198.143]
  - - [1, 3584, 1, 256]
    - [64, 26.244]
  - - [704, 4288, 1, 32]
    - [33, 2630.72]
  - - [1408, 5888, 1, 32]
    - [33, 3376.91]
  - - [6784, 1024, 1, 3328]
    - [26, 9789.87]
  - - [1856, 1, 1, 3328]
    - [64, 18.4579]
  - - [5056, 1408, 1, 256]
    - [26, 9200.45]
  - - [1, 1, 1, 256]
    - [63, 0.00650406]
  - - [2944, 1408, 1, 256]
    - [26, 9185.93]
  - - [4288, 1, 1, 1]
    - [55, 0.4288]
  - - [2368, 2368, 1, 256]
    - [26, 9263.68]
  - - [1, 448, 1, 256]
    - [63, 2.90791]
  - - [1408, 6784, 1, 1]
    - [47, 209.104]
  - - [3584, 32, 1, 3328]
    - [46, 1332.32]
  - - [128, 3584, 1, 1]
    - [55, 42.1647]
  - - [1856, 1, 1, 256]
    - [63, 12.1207]
  - - [6784, 6784, 1, 1280]
    - [26, 10129.9]
  - - [1024, 5888, 1, 1]
    - [47, 168.983]
  - - [6784, 32, 1, 3328]
    - [46, 1615.83]
  - - [1408, 32, 1, 256]
    - [42, 316.182]
  - - [128, 3584, 1, 32]
    - [41, 945.88]
  - - [1856, 3584, 1, 256]
    - [26, 9368.88]
  - - [2944, 64, 1, 256]
    - [4, 3276.8]
  - - [2368, 704, 1, 32]
    - [37, 2014.59]
  - - [256, 5888, 1, 1280]
    - [26, 8719.18]
  - - [448, 2368, 1, 32]
    - [41, 1478.56]
  - - [448, 2368, 1, 3328]
    - [26, 7299.36]
  - - [64, 1408, 1, 256]
    - [3, 2235.34]
  - - [5056, 32, 1, 32]
    - [35, 399.486]
  - - [1024, 704, 1, 3328]
    - [26, 7553.97]
  - - [32, 5888, 1, 3328]
    - [46, 1408.97]
  - - [256, 64, 1, 3328]
    - [15, 738.434]
  - - [32, 1408, 1, 1280]
    - [46, 477.099]
  - - [64, 32, 1, 256]
    - [42, 14.3092]
  - - [1856, 1024, 1, 3328]
    - [29, 8677.71]
  - - [2368, 1, 1, 1]
    - [53, 0.208451]
  - - [5056, 2368, 1, 3328]
    - [26, 10011.7]
  - - [128, 1, 1, 1280]
    - [64, 1.17029]
  - - [704, 4288, 1, 1280]
    - [26, 9320.73]
  - - [704, 256, 1, 256]
    - [12, 3019.46]
  - - [512, 128, 1, 784]
    - [65, 2335.46]
  - - [1024, 256, 1, 196]
    - [69, 6422.53]
  - - [256, 64, 1, 3136]
    - [67, 699.622]
  - - [256, 1024, 1, 196]
    - [66, 6553.6]
  - - [64, 256, 1, 3136]
    - [70, 745.938]
  - - [128, 512, 1, 784]
    - [68, 2343.99]
  - - [64, 64, 1, 3136]
    - [69, 173.394]
  - - [2560, 7000, 1, 2560]
    - [92, 16137.8]
  - - [7680, 12000, 1, 2560]
    - [92, 17417.3]
  - - [5124, 9124, 1, 1760]
    - [86, 16765.5]
  - - [1760, 32, 1, 1760]
    - [73, 2058.21]
  - - [512, 24000, 1, 1536]
    - [92, 15627.6]
  - - [3072, 24000, 1, 1024]
    - [92, 15979.2]
  - - [2048, 400, 1, 512]
    - [93, 8566.8]
  - - [2560, 128, 1, 2560]
    - [79, 6425.1]
  - - [3072, 16, 1, 1024]
    - [81, 1388.84]
  - - [512, 48000, 1, 2816]
    - [92, 17041.1]
  - - [512, 48000, 1, 2048]
    - [93, 13666.4]
  - - [1760, 64, 1, 1760]
    - [73, 3977.66]
  - - [2048, 1600, 1, 2048]
    - [93, 8132.44]
  - - [512, 48000, 1, 1536]
    - [92, 16411.9]
  - - [2560, 32, 1, 2560]
    - [73, 2919.2]
  - - [8448, 5984, 1, 2816]
    - [92, 17042.5]
  - - [4096, 3200, 1, 1024]
    - [93, 13560.6]
  - - [1024, 24000, 1, 2560]
    - [92, 16564.8]
  - - [1760, 6400, 1, 1760]
    - [86, 16926.8]
  - - [5124, 9124, 1, 2048]
    - [93, 13714.0]
  - - [1024, 700, 1, 512]
    - [85, 7304.97]
  - - [4608, 32, 1, 1536]
    - [73, 4437.55]
  - - [3072, 64, 1, 1024]
    - [81, 4026.53]
  - - [16384, 3200, 1, 4096]
    - [93, 14198.9]
  - - [2560, 16, 1, 2560]
    - [79, 1508.31]
  - - [1024, 48000, 1, 2560]
    - [92, 17206.1]
  - - [8448, 48000, 1, 2816]
    - [92, 15639.3]
  - - [2048, 32, 1, 2048]
    - [76, 1622.55]
  - - [2560, 3200, 1, 2560]
    - [92, 15546.4]
  - - [16384, 800, 1, 4096]
    - [93, 11602.3]
  - - [4608, 24000, 1, 1536]
    - [92, 17258.8]
  - - [7680, 48000, 1, 2560]
    - [92, 16396.9]
  - - [3072, 48000, 1, 1024]
    - [92, 16635.3]
  - - [1760, 16, 1, 1760]
    - [76, 980.253]
  - - [8192, 3200, 1, 2048]
    - [93, 13580.9]
  - - [512, 24000, 1, 2816]
    - [92, 16863.1]
  - - [4096, 400, 1, 1024]
    - [93, 10185.3]
  - - [6144, 48000, 1, 2560]
    - [92, 17453.5]
  - - [4608, 48000, 1, 1536]
    - [92, 17440.2]
  - - [4096, 128, 1, 4096]
    - [81, 4579.25]
  - - [2048, 800, 1, 512]
    - [92, 10402.5]
  - - [4608, 5984, 1, 1536]
    - [92, 16367.1]
  - - [4096, 1600, 1, 1024]
    - [93, 12198.1]
  - - [6144, 5984, 1, 2048]
    - [93, 13951.2]
  - - [7680, 24000, 1, 2560]
    - [92, 17331.0]
  - - [6144, 48000, 1, 2048]
    - [93, 14769.8]
  - - [2048, 3200, 1, 2048]
    - [93, 11336.0]
  - - [5124, 9124, 1, 2560]
    - [92, 16462.5]
  - - [1024, 24000, 1, 1536]
    - [92, 16343.1]
  - - [7680, 16, 1, 2560]
    - [76, 2919.2]
  - - [2560, 6400, 1, 2560]
    - [92, 16353.8]
  - - [2048, 128, 1, 2048]
    - [76, 3513.55]
  - - [512, 16, 1, 500000]
    - [76, 307.342]
  - - [1024, 8, 1, 500000]
    - [73, 308.821]
  - - [512, 24000, 1, 2560]
    - [92, 16086.4]
  - - [1024, 24000, 1, 2816]
    - [92, 17012.3]
  - - [7680, 5984, 1, 2560]
    - [92, 17049.2]
  - - [2048, 1600, 1, 512]
    - [93, 10506.8]
  - - [2048, 7000, 1, 2048]
    - [93, 12810.7]
  - - [1760, 800, 1, 1760]
    - [83, 11553.9]
  - - [4096, 64, 1, 4096]
    - [76, 3569.62]
  - - [7680, 32, 1, 2560]
    - [76, 5765.63]
  - - [2560, 64, 1, 2560]
    - [79, 5253.39]
  - - [3072, 128, 1, 1024]
    - [81, 5130.65]
  - - [7680, 64, 1, 2560]
    - [85, 6667.5]
  - - [1760, 128, 1, 1760]
    - [73, 6931.69]
  - - [2560, 1600, 1, 2560]
    - [92, 12198.4]
  - - [2048, 3200, 1, 512]
    - [93, 12372.6]
  - - [2560, 800, 1, 2560]
    - [92, 10495.8]
  - - [3072, 32, 1, 1024]
    - [76, 2677.22]
  - - [6144, 32, 1, 2560]
    - [73, 5354.43]
  - - [4608, 12000, 1, 1536]
    - [92, 16965.2]
  - - [4096, 32, 1, 4096]
    - [82, 2331.79]
  - - [6144, 24000, 1, 2048]
    - [93, 14617.2]
  - - [8192, 800, 1, 2048]
    - [93, 10239.4]
  - - [5124, 9124, 1, 4096]
    - [93, 13825.1]
  - - [8448, 24000, 1, 2816]
    - [92, 17284.5]
  - - [1024, 48000, 1, 1536]
    - [92, 16922.2]
  - - [7680, 128, 1, 2560]
    - [85, 11685.5]
  - - [8192, 1600, 1, 2048]
    - [93, 12203.4]
  - - [4096, 800, 1, 1024]
    - [93, 10420.6]
  - - [1024, 16, 1, 500000]
    - [76, 614.679]
  - - [2048, 800, 1, 2048]
    - [91, 7507.26]
  - - [1760, 3200, 1, 1760]
    - [86, 15165.7]
  - - [512, 48000, 1, 2560]
    - [92, 16707.7]
  - - [8448, 16, 1, 2816]
    - [74, 3408.25]
  - - [2048, 64, 1, 2048]
    - [76, 2897.62]
  - - [512, 24000, 1, 2048]
    - [93, 12518.3]
  - - [16384, 1600, 1, 4096]
    - [93, 13160.1]
  - - [4608, 16, 1, 1536]
    - [73, 2250.52]
  - - [1024, 24000, 1, 2048]
    - [93, 13613.5]
  - - [8192, 400, 1, 2048]
    - [93, 8130.86]
  - - [2048, 6400, 1, 2048]
    - [93, 12671.6]
  - - [6144, 12000, 1, 2048]
    - [93, 14419.8]
  - - [512, 8, 1, 500000]
    - [73, 154.817]
  - - [1760, 7000, 1, 1760]
    - [86, 15775.6]
  - - [1024, 48000, 1, 2816]
    - [92, 17431.7]
  - - [6144, 16, 1, 2560]
    - [79, 2774.01]
  - - [8448, 32, 1, 2816]
    - [79, 6068.77]
  - - [4096, 7000, 1, 4096]
    - [93, 13834.0]
  - - [4096, 16, 1, 4096]
    - [77, 1181.49]
  - - [6144, 24000, 1, 2560]
    - [92, 17224.4]
  - - [1024, 1024, 1, 1024]
    - [93, 10502.2]
  - - [2048, 16, 1, 2048]
    - [81, 858.609]
  - - [8448, 12000, 1, 2816]
    - [92, 17285.6]
  - - [16384, 400, 1, 4096]
    - [93, 9542.53]
  - - [1760, 1600, 1, 1760]
    - [84, 14824.6]
  - - [1024, 48000, 1, 2048]
    - [93, 14216.2]
- null
