library/src/blas3/Tensile/Logic/asm_full/vega20_Cijk_Alik_Bljk_HBH.yaml
- {MinimumRequiredVersion: 4.6.0}
- vega20
- gfx906
- [Device 66a0, Device 66a1, Device 66a7, Device 66af, Vega 20]
    SolutionIndex: 0
    SolutionNameMin: Cijk_Alik_Bljk_HBH_MT032x016x08_PGR1_PLR1_TT04_02
    SolutionIndex: 1
    SolutionNameMin: Cijk_Alik_Bljk_HBH_MT032x016x08_PGR1_PLR1_TT02_02
    SolutionIndex: 2
    SolutionNameMin: Cijk_Alik_Bljk_HBH_MT032x032x08_PGR1_PLR1_TT02_02
    SolutionIndex: 3
    SolutionNameMin: Cijk_Alik_Bljk_HBH_MT016x016x16_PGR1_PLR1_TT02_02
    SolutionIndex: 4
    SolutionNameMin: Cijk_Alik_Bljk_HBH_MT032x032x16_PGR1_PLR1_TT04_04
    SolutionIndex: 5
    SolutionNameMin: Cijk_Alik_Bljk_HBH_MT064x032x16_PGR1_PLR1_TT04_04
    SolutionIndex: 6
    SolutionNameMin: Cijk_Alik_Bljk_HBH_MT032x016x08_PGR1_PLR1_TT04_02
    SolutionIndex: 7
    SolutionNameMin: Cijk_Alik_Bljk_HBH_MT016x016x16_PGR1_PLR1_TT02_02
    SolutionIndex: 8
    SolutionNameMin: Cijk_Alik_Bljk_HBH_MT032x032x16_PGR1_PLR1_TT04_04
    SolutionIndex: 9
    SolutionNameMin: Cijk_Alik_Bljk_HBH_MT064x064x16_PGR1_PLR1_TT08_08
    SolutionIndex: 10
    SolutionNameMin: Cijk_Alik_Bljk_HBH_MT064x032x16_PGR1_PLR1_TT04_04
    SolutionIndex: 11
    SolutionNameMin: Cijk_Alik_Bljk_HBH_MT016x016x24_PGR1_PLR1_TT02_02
    SolutionIndex: 12
    SolutionNameMin: Cijk_Alik_Bljk_HBH_MT032x032x24_PGR1_PLR1_TT04_04
    SolutionIndex: 13
    SolutionNameMin: Cijk_Alik_Bljk_HBH_MT016x016x24_PGR1_PLR1_TT02_02
    SolutionIndex: 14
    SolutionNameMin: Cijk_Alik_Bljk_HBH_MT032x016x24_PGR1_PLR1_TT04_02
    SolutionIndex: 15
    SolutionNameMin: Cijk_Alik_Bljk_HBH_MT032x032x24_PGR1_PLR1_TT04_04
    SolutionIndex: 16
    SolutionNameMin: Cijk_Alik_Bljk_HBH_MT064x064x24_PGR1_PLR1_TT08_08
    SolutionIndex: 17
    SolutionNameMin: Cijk_Alik_Bljk_HBH_MT064x128x08_PGR1_PLR1_TT04_08
    SolutionIndex: 18
    SolutionNameMin: Cijk_Alik_Bljk_HBH_MT128x064x08_PGR1_PLR1_TT08_04
    SolutionIndex: 19
    SolutionNameMin: Cijk_Alik_Bljk_HBH_MT064x064x16_PGR1_PLR1_TT04_04
    SolutionIndex: 20
    SolutionNameMin: Cijk_Alik_Bljk_HBH_MT064x128x16_PGR1_PLR1_TT04_08
    SolutionIndex: 21
    SolutionNameMin: Cijk_Alik_Bljk_HBH_MT128x128x16_PGR1_PLR1_TT08_08
    SolutionIndex: 22
    SolutionNameMin: Cijk_Alik_Bljk_HBH_MT064x128x04_PGR0_PLR0_TT04_08
    SolutionIndex: 23
    SolutionNameMin: Cijk_Alik_Bljk_HBH_MT064x064x04_PGR0_PLR0_TT04_04
    SolutionIndex: 24
    SolutionNameMin: Cijk_Alik_Bljk_HBH_MT064x064x04_PGR1_PLR0_TT04_04
    SolutionIndex: 25
    SolutionNameMin: Cijk_Alik_Bljk_HBH_MT064x064x04_PGR0_PLR1_TT04_04
    SolutionIndex: 26
    SolutionNameMin: Cijk_Alik_Bljk_HBH_MT064x064x08_PGR0_PLR0_TT04_04
    SolutionIndex: 27
    SolutionNameMin: Cijk_Alik_Bljk_HBH_MT064x064x08_PGR1_PLR0_TT04_04
    SolutionIndex: 28
    SolutionNameMin: Cijk_Alik_Bljk_HBH_MT128x128x08_PGR0_PLR1_TT08_08
    SolutionIndex: 29
    SolutionNameMin: Cijk_Alik_Bljk_HBH_MT064x128x08_PGR0_PLR1_TT04_08
    SolutionIndex: 30
    SolutionNameMin: Cijk_Alik_Bljk_HBH_MT064x064x08_PGR0_PLR1_TT04_04
    SolutionIndex: 31
    SolutionNameMin: Cijk_Alik_Bljk_HBH_MT064x064x08_PGR1_PLR1_TT04_04
    SolutionIndex: 32
    SolutionNameMin: Cijk_Alik_Bljk_HBH_MT064x064x16_PGR0_PLR0_TT04_04
    SolutionIndex: 33
    SolutionNameMin: Cijk_Alik_Bljk_HBH_MT064x064x16_PGR1_PLR0_TT04_04
    SolutionIndex: 34
    SolutionNameMin: Cijk_Alik_Bljk_HBH_MT064x064x16_PGR0_PLR1_TT04_04
    SolutionIndex: 35
    SolutionNameMin: Cijk_Alik_Bljk_HBH_MT064x064x16_PGR1_PLR1_TT04_04
    SolutionIndex: 36
    SolutionNameMin: Cijk_Alik_Bljk_HBH_MT064x128x04_PGR0_PLR0_TT04_08
    SolutionIndex: 37
    SolutionNameMin: Cijk_Alik_Bljk_HBH_MT064x064x04_PGR0_PLR0_TT04_04
    SolutionIndex: 38
    SolutionNameMin: Cijk_Alik_Bljk_HBH_MT064x128x04_PGR1_PLR0_TT04_08
    SolutionIndex: 39
    SolutionNameMin: Cijk_Alik_Bljk_HBH_MT064x064x04_PGR1_PLR0_TT04_04
    SolutionIndex: 40
    SolutionNameMin: Cijk_Alik_Bljk_HBH_MT128x128x04_PGR0_PLR1_TT08_08
    SolutionIndex: 41
    SolutionNameMin: Cijk_Alik_Bljk_HBH_MT064x128x04_PGR0_PLR1_TT04_08
    SolutionIndex: 42
    SolutionNameMin: Cijk_Alik_Bljk_HBH_MT064x064x04_PGR0_PLR1_TT04_04
    SolutionIndex: 43
    SolutionNameMin: Cijk_Alik_Bljk_HBH_MT064x128x04_PGR1_PLR1_TT04_08
    SolutionIndex: 44
    SolutionNameMin: Cijk_Alik_Bljk_HBH_MT064x064x04_PGR1_PLR1_TT04_04
    SolutionIndex: 45
    SolutionNameMin: Cijk_Alik_Bljk_HBH_MT128x128x08_PGR0_PLR0_TT08_08
    SolutionIndex: 46
    SolutionNameMin: Cijk_Alik_Bljk_HBH_MT064x128x08_PGR0_PLR0_TT04_08
    SolutionIndex: 47
    SolutionNameMin: Cijk_Alik_Bljk_HBH_MT064x064x08_PGR0_PLR0_TT04_04
    SolutionIndex: 48
    SolutionNameMin: Cijk_Alik_Bljk_HBH_MT064x064x08_PGR1_PLR0_TT04_04
    SolutionIndex: 49
    SolutionNameMin: Cijk_Alik_Bljk_HBH_MT064x128x08_PGR0_PLR1_TT04_08
    SolutionIndex: 50
    SolutionNameMin: Cijk_Alik_Bljk_HBH_MT064x064x08_PGR0_PLR1_TT04_04
    SolutionIndex: 51
    SolutionNameMin: Cijk_Alik_Bljk_HBH_MT064x128x08_PGR1_PLR1_TT04_08
    SolutionIndex: 52
    SolutionNameMin: Cijk_Alik_Bljk_HBH_MT064x064x08_PGR1_PLR1_TT04_04
    SolutionIndex: 53
    SolutionNameMin: Cijk_Alik_Bljk_HBH_MT064x064x16_PGR1_PLR1_TT04_04
    SolutionIndex: 54
    SolutionNameMin: Cijk_Alik_Bljk_HBH_MT064x032x16_EPS1_GRVW04_LPB04_PGR1_PLR1_SNLL1_TT04_04_VW04_WG16_08_01_WGM01
    SolutionIndex: 55
    SolutionNameMin: Cijk_Alik_Bljk_HBH_MT064x064x16_EPS1_GRVW04_LPB04_PGR1_PLR1_SNLL1_TT04_04_VW04_WG16_16_01_WGM01
    SolutionIndex: 56
    SolutionNameMin: Cijk_Alik_Bljk_HBH_MT064x032x16_EPS1_GRVW04_LPB04_PGR1_PLR1_SNLL1_TT04_04_VW04_WG16_08_01_WGM08
    SolutionIndex: 57
    SolutionNameMin: Cijk_Alik_Bljk_HBH_MT064x032x16_EPS1_GRVW04_LPB04_PGR1_PLR1_SNLL1_TT04_04_VW04_WG16_08_01_WGM64
    SolutionIndex: 58
    SolutionNameMin: Cijk_Alik_Bljk_HBH_MT032x128x32_EPS1_GRVW04_LPB04_PGR1_PLR1_SNLL1_TT04_04_VW04_WG08_32_01_WGM01
    SolutionIndex: 59
    SolutionNameMin: Cijk_Alik_Bljk_HBH_MT032x128x32_EPS1_GRVW04_LPB04_PGR1_PLR1_SNLL1_TT04_04_VW04_WG08_32_01_WGM64
    SolutionIndex: 60
    SolutionNameMin: Cijk_Alik_Bljk_HBH_MT032x032x16_PGR1_PLR1_TT04_04
    SolutionIndex: 61
    SolutionNameMin: Cijk_Alik_Bljk_HBH_MT064x016x16_PGR1_PLR1_TT04_04
    SolutionIndex: 62
    SolutionNameMin: Cijk_Alik_Bljk_HBH_MT032x032x32_PGR1_PLR1_TT04_04
    SolutionIndex: 63
    SolutionNameMin: Cijk_Alik_Bljk_HBH_MT064x016x32_PGR1_PLR1_TT04_04
    SolutionIndex: 64
    SolutionNameMin: Cijk_Alik_Bljk_HBH_MT032x032x16_PGR1_PLR1_TT04_04
    SolutionIndex: 65
    SolutionNameMin: Cijk_Alik_Bljk_HBH_MT032x032x32_PGR1_PLR1_TT04_04
    SolutionIndex: 66
    SolutionNameMin: Cijk_Alik_Bljk_HBH_MT064x032x32_PGR1_PLR1_TT04_04
    SolutionIndex: 67
    SolutionNameMin: Cijk_Alik_Bljk_HBH_MT064x064x08_PGR1_PLR1_TT08_08
    SolutionIndex: 68
    SolutionNameMin: Cijk_Alik_Bljk_HBH_MT064x064x16_PGR1_PLR1_TT08_08
    SolutionIndex: 69
    SolutionNameMin: Cijk_Alik_Bljk_HBH_MT064x064x32_PGR1_PLR1_TT08_08
    SolutionIndex: 70
    SolutionNameMin: Cijk_Alik_Bljk_HBH_MT128x128x08_PGR1_PLR1_TT08_08
    SolutionIndex: 71
    SolutionNameMin: Cijk_Alik_Bljk_HBH_MT128x064x16_PGR1_PLR1_TT08_04
    SolutionIndex: 72
    SolutionNameMin: Cijk_Alik_Bljk_HBH_MT128x128x32_PGR1_PLR1_TT08_08
    SolutionIndex: 73
    SolutionNameMin: Cijk_Alik_Bljk_HBH_MT128x128x16_PGR1_PLR1_TT08_08
    SolutionIndex: 74
    SolutionNameMin: Cijk_Alik_Bljk_HBH_MT128x128x32_PGR1_PLR1_TT08_08
    SolutionIndex: 75
    SolutionNameMin: Cijk_Alik_Bljk_HBH_MT064x064x04_PGR1_PLR1_TT04_04
    SolutionIndex: 76
    SolutionNameMin: Cijk_Alik_Bljk_HBH_MT064x064x08_PGR1_PLR0_TT04_04
    SolutionIndex: 77
    SolutionNameMin: Cijk_Alik_Bljk_HBH_MT064x128x16_PGR1_PLR1_TT04_08
    SolutionIndex: 78
    SolutionNameMin: Cijk_Alik_Bljk_HBH_MT064x064x04_PGR0_PLR0_TT04_04
    SolutionIndex: 79
    SolutionNameMin: Cijk_Alik_Bljk_HBH_MT064x064x04_PGR0_PLR1_TT04_04
    SolutionIndex: 80
    SolutionNameMin: Cijk_Alik_Bljk_HBH_MT064x128x08_PGR0_PLR0_TT04_08
    SolutionIndex: 81
    SolutionNameMin: Cijk_Alik_Bljk_HBH_MT064x064x08_PGR1_PLR1_TT04_04
    SolutionIndex: 82
    SolutionNameMin: Cijk_Alik_Bljk_HBH_MT64x64x16_SE_GRVW4_LRVW4_TT4_4_VW4_WG16_16_1_WGM1
    SolutionIndex: 83
    SolutionNameMin: Cijk_Alik_Bljk_HBH_MT128x64x16_SE_GRVW4_LRVW4_TT8_4_VW4_WG16_16_1_WGM1
    SolutionIndex: 84
    SolutionNameMin: Cijk_Alik_Bljk_HBH_MT64x64x16_SE_GRVW4_LRVW4_TT4_4_VW4_WG16_16_1_WGM8
    SolutionIndex: 85
    SolutionNameMin: Cijk_Alik_Bljk_HBH_MT64x64x32_SE_GRVW4_LRVW4_TT4_4_VW4_WG16_16_1_WGM1
    SolutionIndex: 86
    SolutionNameMin: Cijk_Alik_Bljk_HBH_MT96x64x16_SE_GRVW2_LRVW2_TT6_4_VW2_WG16_16_1_WGM1
    SolutionIndex: 87
    SolutionNameMin: Cijk_Alik_Bljk_HBH_MT96x64x16_SE_GRVW2_LRVW2_TT6_4_VW2_WG16_16_1_WGM8
    SolutionIndex: 88
    SolutionNameMin: Cijk_Alik_Bljk_HBH_MT64x64x16_SE_GRVW4_LRVW4_TT4_4_VW4_WG16_16_1_WGM1
    SolutionIndex: 89
    SolutionNameMin: Cijk_Alik_Bljk_HBH_MT64x64x16_SE_GRVW4_LRVW4_TT4_4_VW4_WG16_16_1_WGM8
    SolutionIndex: 90
    SolutionNameMin: Cijk_Alik_Bljk_HBH_MT128x64x16_SE_GRVW4_LRVW4_TT8_4_VW4_WG16_16_1_WGM8
    SolutionIndex: 91
    SolutionNameMin: Cijk_Alik_Bljk_HBH_MT64x128x16_SE_GRVW2_LRVW2_TT4_8_VW2_WG16_16_1_WGM1
    SolutionIndex: 92
    SolutionNameMin: Cijk_Alik_Bljk_HBH_MT32x64x16_SE_GRVW4_LRVW4_TT4_4_VW4_WG8_16_1_WGM1
    SolutionIndex: 93
    SolutionNameMin: Cijk_Alik_Bljk_HBH_MT64x48x16_SE_GRVW2_LRVW2_TT4_6_VW2_WG16_8_1_WGM1
    SolutionIndex: 94
    SolutionNameMin: Cijk_Alik_Bljk_HBH_MT64x128x8_SE_GRVW4_LRVW4_TT8_8_VW4_WG8_16_1_WGM1
    SolutionIndex: 95
    SolutionNameMin: Cijk_Alik_Bljk_HBH_MT128x64x16_SE_GRVW4_LRVW4_TT8_4_VW4_WG16_16_1_WGM1
    SolutionIndex: 96
    SolutionNameMin: Cijk_Alik_Bljk_HBH_MT64x32x16_SE_GRVW4_LRVW4_TT4_4_VW4_WG16_8_1_WGM1
    SolutionIndex: 97
    SolutionNameMin: Cijk_Alik_Bljk_HBH_MT32x32x16_SE_GRVW4_LRVW4_TT4_4_VW4_WG8_8_1_WGM8
    SolutionIndex: 98
    SolutionNameMin: Cijk_Alik_Bljk_HBH_MT64x64x16_SE_GRVW4_LRVW4_TT8_4_VW4_WG8_16_1_WGM1
    SolutionIndex: 99
    SolutionNameMin: Cijk_Alik_Bljk_HBH_MT32x32x16_SE_GRVW4_LRVW4_TT4_4_VW4_WG8_8_1_WGM1
    SolutionIndex: 100
    SolutionNameMin: Cijk_Alik_Bljk_HBH_MT64x64x16_SE_GRVW2_LRVW2_TT8_4_VW2_WG8_16_1_WGM1
    SolutionIndex: 101
    SolutionNameMin: Cijk_Alik_Bljk_HBH_MT64x64x16_SE_GRVW4_LRVW4_TT8_4_VW4_WG8_16_1_WGM8
    SolutionIndex: 102
    SolutionNameMin: Cijk_Alik_Bljk_HBH_MT128x64x16_SE_GRVW2_LRVW2_TT8_4_VW2_WG16_16_1_WGM1
    SolutionIndex: 103
    SolutionNameMin: Cijk_Alik_Bljk_HBH_MT64x128x8_SE_GRVW2_LRVW2_TT4_8_VW2_WG16_16_1_WGM1
    SolutionIndex: 104
    SolutionNameMin: Cijk_Alik_Bljk_HBH_MT64x128x16_SE_GRVW4_LRVW4_TT4_8_VW4_WG16_16_1_WGM1
    SolutionIndex: 105
    SolutionNameMin: Cijk_Alik_Bljk_HBH_MT64x32x16_SE_GRVW4_LRVW4_TT4_4_VW4_WG16_8_1_WGM8
    SolutionIndex: 106
    SolutionNameMin: Cijk_Alik_Bljk_HBH_MT48x64x16_SE_GRVW2_LRVW2_TT6_4_VW2_WG8_16_1_WGM8
    SolutionIndex: 107
    SolutionNameMin: Cijk_Alik_Bljk_HBH_MT96x64x16_SE_GRVW2_LRVW2_TT6_4_VW2_WG16_16_1_WGM1
    SolutionIndex: 108
    SolutionNameMin: Cijk_Alik_Bljk_HBH_MT64x64x16_SE_GRVW2_LRVW2_TT4_8_VW2_WG16_8_1_WGM1
    SolutionIndex: 109
    SolutionNameMin: Cijk_Alik_Bljk_HBH_MT64x128x8_SE_GRVW2_LRVW2_TT4_8_VW2_WG16_16_1_WGM8
    SolutionIndex: 110
    SolutionNameMin: Cijk_Alik_Bljk_HBH_MT64x96x16_SE_GRVW2_LRVW2_TT4_6_VW2_WG16_16_1_WGM1
    SolutionIndex: 111
    SolutionNameMin: Cijk_Alik_Bljk_HBH_MT64x64x16_SE_GRVW4_LRVW4_TT4_8_VW4_WG16_8_1_WGM8
    SolutionIndex: 112
    SolutionNameMin: Cijk_Alik_Bljk_HBH_MT128x64x16_SE_GRVW2_LRVW2_TT8_4_VW2_WG16_16_1_WGM8
    SolutionIndex: 113
    SolutionNameMin: Cijk_Alik_Bljk_HBH_MT96x32x16_SE_GRVW2_LRVW2_TT6_4_VW2_WG16_8_1_WGM8
    SolutionIndex: 114
    SolutionNameMin: Cijk_Alik_Bljk_HBH_MT64x64x16_SE_GRVW2_LRVW2_TT4_4_VW2_WG16_16_1_WGM1
    SolutionIndex: 115
    SolutionNameMin: Cijk_Alik_Bljk_HBH_MT96x64x16_SE_GRVW2_LRVW2_TT6_4_VW2_WG16_16_1_WGM8
    SolutionIndex: 116
    SolutionNameMin: Cijk_Alik_Bljk_HBH_MT64x128x16_SE_GRVW4_LRVW4_TT4_8_VW4_WG16_16_1_WGM8
    SolutionIndex: 117
    SolutionNameMin: Cijk_Alik_Bljk_HBH_MT48x64x16_SE_GRVW2_LRVW2_TT6_4_VW2_WG8_16_1_WGM1
    SolutionIndex: 118
    SolutionNameMin: Cijk_Alik_Bljk_HBH_MT64x64x16_SE_GRVW2_LRVW2_TT4_8_VW2_WG16_8_1_WGM8
    SolutionIndex: 119
    SolutionNameMin: Cijk_Alik_Bljk_HBH_MT64x64x16_SE_GRVW4_LRVW4_TT4_8_VW4_WG16_8_1_WGM1
    SolutionIndex: 120
    SolutionNameMin: Cijk_Alik_Bljk_HBH_MT64x64x16_SE_GRVW2_LRVW2_TT4_4_VW2_WG16_16_1_WGM8
    SolutionIndex: 121
    SolutionNameMin: Cijk_Alik_Bljk_HBH_MT64x64x16_SE_GRVW2_LRVW2_TT8_4_VW2_WG8_16_1_WGM8
    SolutionIndex: 122
    SolutionNameMin: Cijk_Alik_Bljk_HBH_MT64x128x16_SE_GRVW2_LRVW2_TT4_8_VW2_WG16_16_1_WGM8
    SolutionIndex: 123
    SolutionNameMin: Cijk_Alik_Bljk_HBH_MT128x128x16_SE_GRVW8_LRVW8_TT8_8_VW8_WG16_16_1_WGM1
    SolutionIndex: 124
    SolutionNameMin: Cijk_Alik_Bljk_HBH_MT128x128x16_SE_GRVW4_LRVW4_TT8_8_VW4_WG16_16_1_WGM1
    SolutionIndex: 125
    SolutionNameMin: Cijk_Alik_Bljk_HBH_MT128x128x16_SE_GRVW4_LRVW4_TT8_8_VW4_WG16_16_1_WGM8
    SolutionIndex: 126
    SolutionNameMin: Cijk_Alik_Bljk_HBH_MT64x64x16_SE_GRVW8_LRVW8_TT8_8_VW8_WG8_8_1_WGM8
    SolutionIndex: 127
    SolutionNameMin: Cijk_Alik_Bljk_HBH_MT64x64x8_SE_GRVW2_LRVW2_TT4_4_VW2_WG16_16_1_WGM1
    SolutionIndex: 128
    SolutionNameMin: Cijk_Alik_Bljk_HBH_MT64x64x16_SE_GRVW8_LRVW8_TT8_8_VW8_WG8_8_1_WGM1
    SolutionIndex: 129
    SolutionNameMin: Cijk_Alik_Bljk_HBH_MT64x128x8_SE_GRVW4_LRVW4_TT4_8_VW4_WG16_16_1_WGM1
    SolutionIndex: 130
    SolutionNameMin: Cijk_Alik_Bljk_HBH_MT128x64x16_SE_GRVW8_LRVW8_TT8_8_VW8_WG16_8_1_WGM1
    SolutionIndex: 131
    SolutionNameMin: Cijk_Alik_Bljk_HBH_MT128x128x16_SE_GRVW8_LRVW8_TT8_8_VW8_WG16_16_1_WGM8
    SolutionIndex: 132
    SolutionNameMin: Cijk_Alik_Bljk_HBH_MT64x128x16_SE_GRVW8_LRVW8_TT8_8_VW8_WG8_16_1_WGM8
    SolutionIndex: 133
    SolutionNameMin: Cijk_Alik_Bljk_HBH_MT128x64x16_SE_GRVW4_LRVW4_TT8_8_VW4_WG16_8_1_WGM1
    SolutionIndex: 134
    SolutionNameMin: Cijk_Alik_Bljk_HBH_MT64x96x16_SE_GRVW2_LRVW2_TT4_6_VW2_WG16_16_1_WGM8
    SolutionIndex: 135
    SolutionNameMin: Cijk_Alik_Bljk_HBH_MT64x48x16_SE_GRVW2_LRVW2_TT4_6_VW2_WG16_8_1_WGM8
    SolutionIndex: 136
    SolutionNameMin: Cijk_Alik_Bljk_HBH_MT64x128x16_SE_GRVW8_LRVW8_TT8_8_VW8_WG8_16_1_WGM1
    SolutionIndex: 137
    SolutionNameMin: Cijk_Alik_Bljk_HBH_MT128x64x16_SE_GRVW8_LRVW8_TT8_8_VW8_WG16_8_1_WGM8
    SolutionIndex: 138
    SolutionNameMin: Cijk_Alik_Bljk_HBH_MT64x128x8_SE_GRVW4_LRVW4_TT8_8_VW4_WG8_16_1_WGM8
    SolutionIndex: 139
    SolutionNameMin: Cijk_Alik_Bljk_HBH_MT64x16x16_SE_GRVW4_LRVW4_TT4_4_VW4_WG16_4_1_WGM8
    SolutionIndex: 140
    SolutionNameMin: Cijk_Alik_Bljk_HBH_MT32x64x16_SE_GRVW4_LRVW4_TT4_4_VW4_WG8_16_1_WGM8
    SolutionIndex: 141
    SolutionNameMin: Cijk_Alik_Bljk_HBH_MT64x96x8_SE_GRVW2_LRVW2_TT4_6_VW2_WG16_16_1_WGM8
    SolutionIndex: 142
    SolutionNameMin: Cijk_Alik_Bljk_HBH_MT64x48x8_SE_GRVW2_LRVW2_TT4_6_VW2_WG16_8_1_WGM1
    SolutionIndex: 143
    SolutionNameMin: Cijk_Alik_Bljk_HBH_MT64x96x8_SE_GRVW2_LRVW2_TT4_6_VW2_WG16_16_1_WGM1
    SolutionIndex: 144
    SolutionNameMin: Cijk_Alik_Bljk_HBH_MT64x16x16_SE_GRVW4_LRVW4_TT4_4_VW4_WG16_4_1_WGM1
    SolutionIndex: 145
    SolutionNameMin: Cijk_Alik_Bljk_HBH_MT32x32x8_SE_GRVW4_LRVW4_TT4_4_VW4_WG8_8_1_WGM1
    SolutionIndex: 146
    SolutionNameMin: Cijk_Alik_Bljk_HBH_MT32x32x32_SE_GRVW4_LRVW4_TT4_4_VW4_WG8_8_1_WGM8
    SolutionIndex: 147
    SolutionNameMin: Cijk_Alik_Bljk_HBH_MT32x64x32_SE_GRVW4_LRVW4_TT4_4_VW4_WG8_16_1_WGM1
    SolutionIndex: 148
    SolutionNameMin: Cijk_Alik_Bljk_HBH_MT64x32x32_SE_GRVW4_LRVW4_TT4_4_VW4_WG16_8_1_WGM1
    SolutionIndex: 149
    SolutionNameMin: Cijk_Alik_Bljk_HBH_MT32x32x16_SE_GRVW2_LRVW2_TT2_4_VW2_WG16_8_1_WGM8
    SolutionIndex: 150
    SolutionNameMin: Cijk_Alik_Bljk_HBH_MT32x32x16_SE_GRVW2_LRVW2_TT4_2_VW2_WG8_16_1_WGM1
    SolutionIndex: 151
    SolutionNameMin: Cijk_Alik_Bljk_HBH_MT32x32x16_SE_GRVW2_LRVW2_TT4_2_VW2_WG8_16_1_WGM8
    SolutionIndex: 152
    SolutionNameMin: Cijk_Alik_Bljk_HBH_MT32x16x16_SE_GRVW2_LRVW2_TT4_2_VW2_WG8_8_1_WGM8
- - - [2368, 1024, 1, 1]
    - [37, 135.921]
  - - [448, 1, 1, 256]
    - [52, 2.9317]
  - - [5056, 1408, 1, 3328]
    - [21, 9713.46]
  - - [5056, 1856, 1, 3328]
    - [19, 9979.08]
  - - [5888, 128, 1, 1]
    - [41, 63.2268]
  - - [448, 3584, 1, 3328]
    - [19, 8233.0]
  - - [704, 64, 1, 3328]
    - [13, 1985.52]
  - - [5056, 4288, 1, 32]
    - [22, 3673.04]
  - - [3584, 1024, 1, 256]
    - [19, 9167.88]
  - - [32, 5056, 1, 1280]
    - [35, 1183.66]
  - - [1856, 256, 1, 1]
    - [37, 41.5329]
  - - [256, 1856, 1, 32]
    - [30, 931.639]
  - - [1408, 3584, 1, 3328]
    - [19, 9700.78]
  - - [128, 3584, 1, 1280]
    - [15, 6478.4]
  - - [1024, 2368, 1, 3328]
    - [19, 8980.86]
  - - [4288, 64, 1, 3328]
    - [13, 4487.57]
  - - [1, 4288, 1, 1280]
    - [52, 28.4562]
  - - [2368, 64, 1, 1]
    - [50, 11.9899]
  - - [256, 128, 1, 256]
    - [3, 944.663]
  - - [448, 64, 1, 1]
    - [45, 2.54184]
  - - [32, 1408, 1, 32]
    - [24, 94.8547]
  - - [448, 3584, 1, 32]
    - [30, 2013.33]
  - - [64, 1024, 1, 1280]
    - [13, 2582.7]
  - - [1, 1408, 1, 3328]
    - [53, 13.9892]
  - - [1408, 128, 1, 32]
    - [24, 343.284]
  - - [4288, 6784, 1, 3328]
    - [19, 10375.2]
  - - [1024, 1, 1, 3328]
    - [53, 10.2523]
  - - [2944, 128, 1, 32]
    - [31, 832.778]
  - - [64, 6784, 1, 1]
    - [37, 40.5015]
  - - [1024, 64, 1, 1280]
    - [13, 2570.04]
  - - [448, 128, 1, 256]
    - [3, 1504.1]
  - - [64, 5056, 1, 3328]
    - [10, 4864.87]
  - - [5888, 4288, 1, 3328]
    - [19, 10103.2]
  - - [1, 2368, 1, 1280]
    - [53, 21.5763]
  - - [704, 1024, 1, 1]
    - [42, 61.3007]
  - - [2368, 1408, 1, 32]
    - [22, 2699.71]
  - - [256, 1856, 1, 1280]
    - [15, 6692.06]
  - - [1024, 2944, 1, 1]
    - [37, 151.338]
  - - [2944, 3584, 1, 3328]
    - [19, 10082.3]
  - - [2368, 2944, 1, 1280]
    - [19, 9948.47]
  - - [256, 1408, 1, 1]
    - [37, 31.9546]
  - - [1, 1024, 1, 3328]
    - [53, 10.2474]
  - - [6784, 5888, 1, 3328]
    - [17, 10078.0]
  - - [3584, 1408, 1, 32]
    - [22, 3044.51]
  - - [5056, 256, 1, 256]
    - [19, 7770.87]
  - - [1856, 2368, 1, 256]
    - [19, 9198.19]
  - - [2368, 1024, 1, 3328]
    - [19, 8964.9]
  - - [3584, 4288, 1, 32]
    - [22, 3541.06]
  - - [1024, 1024, 1, 1280]
    - [21, 8529.34]
  - - [3584, 3584, 1, 1]
    - [41, 234.742]
  - - [32, 2944, 1, 3328]
    - [35, 1056.92]
  - - [704, 1408, 1, 3328]
    - [16, 8222.38]
  - - [1408, 704, 1, 256]
    - [19, 7275.1]
  - - [704, 64, 1, 32]
    - [24, 90.112]
  - - [5888, 1, 1, 3328]
    - [52, 39.9838]
  - - [2368, 32, 1, 256]
    - [31, 528.286]
  - - [6784, 128, 1, 3328]
    - [5, 7259.53]
  - - [2944, 256, 1, 1]
    - [46, 55.0924]
  - - [1408, 2368, 1, 1]
    - [42, 157.271]
  - - [32, 448, 1, 3328]
    - [35, 163.66]
  - - [5056, 1, 1, 3328]
    - [52, 34.3732]
  - - [2944, 256, 1, 32]
    - [24, 1351.86]
  - - [5056, 6784, 1, 1280]
    - [19, 10126.7]
  - - [4288, 5056, 1, 1]
    - [37, 243.706]
  - - [5056, 4288, 1, 1]
    - [37, 243.488]
  - - [128, 4288, 1, 3328]
    - [15, 5792.17]
  - - [5056, 128, 1, 256]
    - [10, 5883.35]
  - - [1408, 4288, 1, 1280]
    - [19, 9675.49]
  - - [1856, 704, 1, 1280]
    - [19, 8802.52]
  - - [4288, 1024, 1, 3328]
    - [19, 9839.05]
  - - [1, 5888, 1, 3328]
    - [52, 40.036]
  - - [1024, 128, 1, 32]
    - [24, 266.136]
  - - [32, 4288, 1, 1280]
    - [35, 989.39]
  - - [1024, 5056, 1, 1]
    - [37, 188.13]
  - - [704, 3584, 1, 1280]
    - [19, 9204.33]
  - - [1856, 5056, 1, 256]
    - [19, 9643.09]
  - - [1408, 1024, 1, 1280]
    - [19, 8337.07]
  - - [5056, 5888, 1, 3328]
    - [18, 9933.66]
  - - [448, 1, 1, 1]
    - [45, 0.0478633]
  - - [3584, 3584, 1, 1280]
    - [19, 10217.3]
  - - [2368, 3584, 1, 32]
    - [22, 3361.15]
  - - [2944, 2368, 1, 1]
    - [37, 204.56]
  - - [704, 4288, 1, 1]
    - [37, 150.938]
  - - [2368, 256, 1, 32]
    - [26, 1182.84]
  - - [1024, 6784, 1, 1280]
    - [19, 9909.87]
  - - [1024, 3584, 1, 1]
    - [43, 165.019]
  - - [32, 5056, 1, 32]
    - [26, 380.687]
  - - [5888, 32, 1, 32]
    - [24, 443.332]
  - - [64, 128, 1, 3328]
    - [11, 361.386]
  - - [256, 5056, 1, 32]
    - [30, 1842.47]
  - - [5056, 64, 1, 32]
    - [31, 775.051]
  - - [2368, 5056, 1, 32]
    - [22, 3430.55]
  - - [6784, 1856, 1, 32]
    - [22, 3435.5]
  - - [64, 128, 1, 1]
    - [37, 0.682667]
  - - [64, 2368, 1, 1280]
    - [11, 4089.09]
  - - [128, 704, 1, 32]
    - [24, 179.327]
  - - [64, 6784, 1, 3328]
    - [12, 6382.23]
  - - [2944, 256, 1, 1280]
    - [19, 7734.85]
  - - [5056, 704, 1, 1]
    - [37, 162.977]
  - - [2944, 4288, 1, 256]
    - [19, 9650.36]
  - - [1024, 1024, 1, 3328]
    - [21, 8699.79]
  - - [5056, 704, 1, 32]
    - [26, 2661.25]
  - - [1856, 4288, 1, 3328]
    - [19, 10002.3]
  - - [1, 1856, 1, 256]
    - [52, 12.0715]
  - - [6784, 4288, 1, 32]
    - [22, 3717.55]
  - - [5888, 64, 1, 256]
    - [5, 4567.66]
  - - [256, 128, 1, 1]
    - [49, 3.2]
  - - [5888, 5056, 1, 256]
    - [19, 9716.76]
  - - [2944, 448, 1, 256]
    - [19, 7010.83]
  - - [3584, 2368, 1, 3328]
    - [19, 10020.6]
  - - [4288, 1856, 1, 1]
    - [42, 211.663]
  - - [1856, 2944, 1, 1]
    - [37, 188.676]
  - - [32, 4288, 1, 3328]
    - [35, 1031.66]
  - - [1, 3584, 1, 3328]
    - [53, 35.909]
  - - [256, 32, 1, 3328]
    - [35, 95.673]
  - - [1856, 2368, 1, 32]
    - [22, 2886.7]
  - - [4288, 1856, 1, 32]
    - [22, 3255.02]
  - - [5056, 64, 1, 3328]
    - [5, 4871.91]
  - - [6784, 1, 1, 1280]
    - [52, 44.0698]
  - - [1024, 448, 1, 32]
    - [24, 960.737]
  - - [1408, 64, 1, 1]
    - [44, 7.41053]
  - - [1, 1, 1, 3328]
    - [53, 0.00988828]
  - - [5056, 2368, 1, 256]
    - [19, 9535.18]
  - - [1408, 5888, 1, 256]
    - [21, 9546.23]
  - - [5056, 6784, 1, 1]
    - [42, 256.275]
  - - [32, 448, 1, 1280]
    - [35, 148.08]
  - - [32, 448, 1, 32]
    - [30, 29.2571]
  - - [1856, 64, 1, 256]
    - [7, 2639.64]
  - - [1024, 1408, 1, 3328]
    - [19, 8456.02]
  - - [256, 5056, 1, 1280]
    - [19, 8712.4]
  - - [704, 2368, 1, 1]
    - [39, 110.256]
  - - [64, 1024, 1, 32]
    - [24, 132.396]
  - - [1024, 256, 1, 256]
    - [8, 4279.9]
  - - [128, 1, 1, 1]
    - [53, 0.0117647]
  - - [3584, 4288, 1, 1280]
    - [19, 10194.1]
  - - [1856, 128, 1, 32]
    - [31, 539.927]
  - - [1856, 128, 1, 1280]
    - [15, 5279.29]
  - - [128, 2944, 1, 3328]
    - [10, 5645.02]
  - - [1, 6784, 1, 3328]
    - [52, 45.8885]
  - - [3584, 2368, 1, 1]
    - [43, 213.884]
  - - [4288, 448, 1, 3328]
    - [19, 8702.45]
  - - [4288, 32, 1, 3328]
    - [35, 1033.16]
  - - [256, 1856, 1, 1]
    - [39, 41.2444]
  - - [704, 6784, 1, 1280]
    - [19, 9561.43]
  - - [2368, 4288, 1, 32]
    - [22, 3353.92]
  - - [704, 5056, 1, 1280]
    - [19, 9506.06]
  - - [256, 3584, 1, 3328]
    - [21, 7615.36]
  - - [1024, 32, 1, 3328]
    - [35, 372.445]
  - - [3584, 6784, 1, 32]
    - [22, 3712.04]
  - - [3584, 6784, 1, 1280]
    - [19, 10288.0]
  - - [4288, 4288, 1, 3328]
    - [19, 10217.3]
  - - [3584, 64, 1, 1280]
    - [15, 5069.08]
  - - [64, 1856, 1, 256]
    - [3, 2695.81]
  - - [3584, 64, 1, 32]
    - [31, 539.708]
  - - [448, 1, 1, 1280]
    - [53, 4.16019]
  - - [256, 4288, 1, 1280]
    - [19, 7429.63]
  - - [1408, 3584, 1, 1]
    - [36, 185.525]
  - - [4288, 1856, 1, 3328]
    - [19, 9984.76]
  - - [1856, 2944, 1, 1280]
    - [19, 9921.13]
  - - [4288, 256, 1, 256]
    - [19, 6729.37]
  - - [128, 5888, 1, 32]
    - [30, 1333.92]
  - - [128, 5888, 1, 1280]
    - [19, 7705.19]
  - - [1408, 128, 1, 3328]
    - [13, 4697.57]
  - - [3584, 256, 1, 256]
    - [19, 6749.45]
  - - [32, 6784, 1, 3328]
    - [35, 1619.59]
  - - [64, 64, 1, 1280]
    - [11, 162.62]
  - - [32, 3584, 1, 256]
    - [35, 915.216]
  - - [704, 256, 1, 32]
    - [24, 340.045]
  - - [448, 128, 1, 3328]
    - [11, 2474.6]
  - - [64, 2944, 1, 3328]
    - [13, 4951.42]
  - - [64, 4288, 1, 3328]
    - [2, 4464.75]
  - - [5056, 1024, 1, 3328]
    - [21, 9792.55]
  - - [128, 256, 1, 1280]
    - [11, 1372.48]
  - - [1856, 256, 1, 256]
    - [8, 5508.82]
  - - [3584, 704, 1, 1]
    - [42, 138.939]
  - - [256, 704, 1, 256]
    - [8, 3186.28]
  - - [448, 5056, 1, 1]
    - [42, 131.691]
  - - [5888, 5888, 1, 256]
    - [19, 9722.13]
  - - [3584, 704, 1, 32]
    - [30, 2420.27]
  - - [448, 6784, 1, 3328]
    - [19, 9479.8]
  - - [6784, 4288, 1, 1]
    - [38, 249.398]
  - - [3584, 6784, 1, 1]
    - [36, 251.799]
  - - [1408, 2368, 1, 32]
    - [22, 2656.69]
  - - [448, 5056, 1, 32]
    - [26, 2317.23]
  - - [4288, 4288, 1, 1280]
    - [19, 10167.7]
  - - [6784, 1408, 1, 1]
    - [36, 222.343]
  - - [1856, 5888, 1, 3328]
    - [19, 10203.6]
  - - [1024, 704, 1, 1]
    - [39, 60.8865]
  - - [3584, 1856, 1, 3328]
    - [19, 9897.67]
  - - [5056, 5888, 1, 1]
    - [37, 252.8]
  - - [2944, 1024, 1, 256]
    - [19, 8738.08]
  - - [448, 1408, 1, 3328]
    - [19, 6618.06]
  - - [5056, 32, 1, 3328]
    - [35, 1218.2]
  - - [2368, 4288, 1, 3328]
    - [19, 10188.3]
  - - [1024, 704, 1, 32]
    - [31, 1304.79]
  - - [448, 2944, 1, 256]
    - [19, 6976.06]
  - - [2944, 6784, 1, 256]
    - [19, 9781.25]
  - - [2368, 2368, 1, 1280]
    - [19, 9749.92]
  - - [5888, 128, 1, 3328]
    - [19, 7806.88]
  - - [256, 256, 1, 32]
    - [24, 127.875]
  - - [1024, 1, 1, 256]
    - [52, 6.68735]
  - - [3584, 3584, 1, 32]
    - [22, 3526.44]
  - - [2944, 448, 1, 1]
    - [52, 88.6366]
  - - [128, 32, 1, 32]
    - [24, 8.57801]
  - - [5056, 64, 1, 1280]
    - [5, 4710.96]
  - - [2944, 2944, 1, 1280]
    - [19, 9892.58]
  - - [1, 2368, 1, 256]
    - [52, 15.2467]
  - - [1408, 5056, 1, 1]
    - [36, 205.985]
  - - [2944, 32, 1, 1280]
    - [35, 987.764]
  - - [64, 1408, 1, 3328]
    - [11, 3454.97]
  - - [256, 448, 1, 1280]
    - [11, 3855.06]
  - - [2368, 6784, 1, 1]
    - [37, 220.182]
  - - [6784, 4288, 1, 1280]
    - [19, 10119.3]
  - - [2944, 704, 1, 256]
    - [19, 8524.73]
  - - [2368, 6784, 1, 1280]
    - [19, 10158.6]
  - - [704, 2944, 1, 3328]
    - [9, 9393.09]
  - - [5888, 256, 1, 1]
    - [37, 103.525]
  - - [704, 704, 1, 32]
    - [26, 991.232]
  - - [256, 4288, 1, 256]
    - [19, 6820.83]
  - - [5056, 6784, 1, 32]
    - [22, 3765.08]
  - - [5056, 128, 1, 1]
    - [37, 57.7829]
  - - [448, 5056, 1, 1280]
    - [19, 9092.17]
  - - [448, 448, 1, 256]
    - [8, 3548.36]
  - - [256, 5888, 1, 3328]
    - [19, 8824.21]
  - - [704, 448, 1, 1280]
    - [8, 4525.8]
  - - [448, 64, 1, 256]
    - [3, 819.2]
  - - [1024, 704, 1, 1280]
    - [19, 7365.48]
  - - [5888, 1024, 1, 1]
    - [41, 196.779]
  - - [5888, 448, 1, 32]
    - [30, 2365.76]
  - - [6784, 2944, 1, 256]
    - [19, 9622.2]
  - - [1024, 256, 1, 1]
    - [37, 24.6376]
  - - [2368, 448, 1, 256]
    - [19, 6478.56]
  - - [4288, 256, 1, 3328]
    - [19, 7548.01]
  - - [4288, 2944, 1, 256]
    - [19, 9611.32]
  - - [448, 5888, 1, 3328]
    - [19, 8943.24]
  - - [128, 256, 1, 3328]
    - [11, 1465.75]
  - - [128, 6784, 1, 32]
    - [26, 1478.05]
  - - [1856, 64, 1, 32]
    - [24, 239.968]
  - - [1408, 4288, 1, 1]
    - [36, 196.533]
  - - [1408, 1856, 1, 3328]
    - [19, 9652.06]
  - - [4288, 64, 1, 256]
    - [13, 3471.08]
  - - [3584, 1024, 1, 3328]
    - [19, 9893.89]
  - - [2944, 5888, 1, 3328]
    - [19, 10215.1]
  - - [128, 6784, 1, 3328]
    - [5, 7302.09]
  - - [448, 4288, 1, 3328]
    - [19, 8714.79]
  - - [704, 2368, 1, 256]
    - [19, 7731.35]
  - - [1, 64, 1, 3328]
    - [53, 0.633905]
  - - [4288, 128, 1, 1]
    - [37, 50.0788]
  - - [256, 2368, 1, 32]
    - [31, 1182.84]
  - - [4288, 3584, 1, 3328]
    - [19, 10250.9]
  - - [1408, 64, 1, 256]
    - [2, 2089.55]
  - - [1408, 1024, 1, 1]
    - [36, 100.684]
  - - [64, 1024, 1, 1]
    - [44, 5.61096]
  - - [1408, 1024, 1, 256]
    - [19, 7638.63]
  - - [5056, 3584, 1, 1]
    - [42, 232.554]
  - - [448, 1024, 1, 256]
    - [19, 5397.08]
  - - [6784, 6784, 1, 3328]
    - [21, 10167.0]
  - - [6784, 32, 1, 32]
    - [30, 485.113]
  - - [64, 1024, 1, 3328]
    - [11, 2751.06]
  - - [2368, 2944, 1, 3328]
    - [19, 10010.3]
  - - [448, 448, 1, 1280]
    - [15, 4441.58]
  - - [5056, 3584, 1, 32]
    - [22, 3609.7]
  - - [5056, 3584, 1, 1280]
    - [19, 9970.46]
  - - [1856, 1856, 1, 256]
    - [19, 8693.34]
  - - [32, 5888, 1, 256]
    - [35, 1110.37]
  - - [256, 1408, 1, 32]
    - [31, 754.865]
  - - [2944, 1, 1, 3328]
    - [53, 28.9802]
  - - [32, 704, 1, 3328]
    - [35, 253.083]
  - - [5888, 4288, 1, 1]
    - [41, 250.472]
  - - [1024, 128, 1, 256]
    - [1, 2892.62]
  - - [32, 1856, 1, 3328]
    - [35, 668.301]
  - - [5056, 704, 1, 256]
    - [19, 8795.49]
  - - [2368, 5056, 1, 256]
    - [19, 9689.5]
  - - [1024, 5056, 1, 256]
    - [19, 9297.14]
  - - [32, 1024, 1, 3328]
    - [35, 368.419]
  - - [5888, 448, 1, 256]
    - [19, 8116.38]
  - - [6784, 5056, 1, 1280]
    - [19, 10124.3]
  - - [4288, 6784, 1, 1280]
    - [19, 10329.3]
  - - [64, 1, 1, 256]
    - [52, 0.417108]
  - - [1856, 64, 1, 1280]
    - [13, 3959.47]
  - - [128, 1408, 1, 1]
    - [39, 13.9062]
  - - [1024, 64, 1, 32]
    - [24, 133.747]
  - - [1024, 64, 1, 3328]
    - [11, 2745.52]
  - - [704, 6784, 1, 3328]
    - [19, 9645.55]
  - - [2944, 1856, 1, 1]
    - [37, 191.319]
  - - [5888, 4288, 1, 1280]
    - [19, 10045.8]
  - - [5888, 3584, 1, 1280]
    - [19, 10041.1]
  - - [32, 2368, 1, 1280]
    - [35, 798.167]
  - - [3584, 1408, 1, 1280]
    - [19, 9608.51]
  - - [1024, 2944, 1, 256]
    - [21, 8659.69]
  - - [1, 2944, 1, 1280]
    - [53, 27.0247]
  - - [32, 1024, 1, 256]
    - [31, 214.433]
  - - [2944, 1856, 1, 1280]
    - [19, 9924.51]
  - - [3584, 1, 1, 1280]
    - [53, 32.7867]
  - - [256, 3584, 1, 32]
    - [30, 1535.57]
  - - [1024, 2368, 1, 1]
    - [36, 135.921]
  - - [2944, 3584, 1, 1280]
    - [19, 10022.0]
  - - [64, 1, 1, 1]
    - [42, 0.00610687]
  - - [1856, 4288, 1, 256]
    - [19, 9467.39]
  - - [256, 1, 1, 256]
    - [52, 1.92753]
  - - [256, 128, 1, 3328]
    - [11, 1472.08]
  - - [1, 1856, 1, 3328]
    - [53, 18.4535]
  - - [448, 3584, 1, 1]
    - [42, 110.886]
  - - [2368, 2944, 1, 32]
    - [22, 3231.24]
  - - [128, 4288, 1, 32]
    - [31, 1081.51]
  - - [448, 256, 1, 256]
    - [7, 2463.1]
  - - [64, 64, 1, 1]
    - [42, 0.343624]
  - - [1, 1408, 1, 1]
    - [37, 0.129412]
  - - [2944, 32, 1, 32]
    - [24, 179.444]
  - - [448, 1856, 1, 1]
    - [48, 66.2013]
  - - [4288, 704, 1, 256]
    - [19, 8726.29]
  - - [1856, 1024, 1, 256]
    - [19, 7898.36]
  - - [448, 1856, 1, 32]
    - [26, 1439.81]
  - - [448, 1856, 1, 3328]
    - [16, 6915.21]
  - - [448, 448, 1, 32]
    - [32, 330.377]
  - - [1024, 448, 1, 256]
    - [19, 5397.08]
  - - [6784, 1, 1, 256]
    - [52, 37.1091]
  - - [704, 6784, 1, 32]
    - [22, 2851.31]
  - - [1024, 4288, 1, 1]
    - [37, 177.626]
  - - [704, 256, 1, 3328]
    - [15, 4242.96]
  - - [704, 1856, 1, 32]
    - [30, 1880.03]
  - - [1408, 5888, 1, 1280]
    - [19, 10023.8]
  - - [32, 704, 1, 1280]
    - [35, 238.392]
  - - [5056, 1856, 1, 256]
    - [19, 9472.74]
  - - [6784, 704, 1, 1280]
    - [19, 9393.35]
  - - [704, 1408, 1, 32]
    - [30, 1585.97]
  - - [5888, 1024, 1, 256]
    - [19, 9320.68]
  - - [64, 2944, 1, 1]
    - [42, 14.5383]
  - - [64, 2944, 1, 32]
    - [26, 345.717]
  - - [64, 2944, 1, 1280]
    - [11, 4637.93]
  - - [6784, 1856, 1, 3328]
    - [19, 9901.31]
  - - [2368, 5888, 1, 1280]
    - [19, 10108.5]
  - - [5888, 6784, 1, 32]
    - [22, 3787.97]
  - - [1, 6784, 1, 256]
    - [52, 37.3645]
  - - [6784, 6784, 1, 32]
    - [22, 3798.03]
  - - [256, 1, 1, 1280]
    - [53, 2.51751]
  - - [5888, 128, 1, 32]
    - [26, 1272.01]
  - - [6784, 256, 1, 256]
    - [19, 7939.22]
  - - [2368, 3584, 1, 3328]
    - [19, 10026.9]
  - - [128, 4288, 1, 1280]
    - [19, 5662.04]
  - - [32, 3584, 1, 1280]
    - [35, 1263.78]
  - - [5888, 1024, 1, 1280]
    - [19, 9838.75]
  - - [1856, 704, 1, 3328]
    - [19, 8960.69]
  - - [5888, 6784, 1, 3328]
    - [19, 10157.2]
  - - [6784, 448, 1, 1]
    - [37, 150.16]
  - - [6784, 1856, 1, 1]
    - [38, 231.114]
  - - [128, 32, 1, 1280]
    - [35, 42.4731]
  - - [2944, 2368, 1, 1280]
    - [19, 9934.3]
  - - [128, 256, 1, 1]
    - [38, 3.25079]
  - - [6784, 448, 1, 32]
    - [26, 2511.76]
  - - [6784, 448, 1, 3328]
    - [19, 9299.89]
  - - [1, 6784, 1, 1]
    - [42, 0.724786]
  - - [448, 3584, 1, 1280]
    - [19, 8106.69]
  - - [1408, 6784, 1, 1280]
    - [19, 10030.2]
  - - [5056, 5888, 1, 1280]
    - [19, 10089.9]
  - - [32, 2944, 1, 32]
    - [24, 185.632]
  - - [5888, 704, 1, 1]
    - [42, 170.442]
  - - [3584, 1856, 1, 1]
    - [42, 200.359]
  - - [1, 256, 1, 256]
    - [53, 1.99319]
  - - [5056, 2944, 1, 32]
    - [22, 3639.33]
  - - [32, 6784, 1, 256]
    - [35, 1249.43]
  - - [4288, 6784, 1, 1]
    - [37, 252.516]
  - - [1, 4288, 1, 3328]
    - [52, 29.3148]
  - - [1024, 6784, 1, 1]
    - [43, 187.145]
  - - [2368, 5888, 1, 32]
    - [22, 3609.78]
  - - [448, 448, 1, 3328]
    - [15, 4706.47]
  - - [1, 256, 1, 1]
    - [39, 0.0323232]
  - - [3584, 4288, 1, 1]
    - [43, 240.429]
  - - [5888, 1024, 1, 3328]
    - [19, 9467.37]
  - - [6784, 5888, 1, 256]
    - [19, 9746.19]
  - - [704, 128, 1, 1280]
    - [13, 3232.72]
  - - [4288, 128, 1, 256]
    - [19, 5032.56]
  - - [5056, 1024, 1, 1]
    - [37, 187.043]
  - - [32, 3584, 1, 3328]
    - [35, 1328.61]
  - - [1024, 1, 1, 1280]
    - [53, 9.509]
  - - [4288, 2368, 1, 32]
    - [22, 3427.51]
  - - [704, 3584, 1, 1]
    - [39, 137.127]
  - - [704, 1856, 1, 3328]
    - [19, 8965.13]
  - - [2944, 128, 1, 1280]
    - [5, 5491.18]
  - - [1, 2368, 1, 3328]
    - [53, 23.4936]
  - - [6784, 704, 1, 32]
    - [22, 2847.06]
  - - [4288, 1, 1, 1280]
    - [52, 28.1526]
  - - [704, 5888, 1, 256]
    - [19, 9129.03]
  - - [2368, 3584, 1, 1280]
    - [19, 9964.81]
  - - [64, 448, 1, 256]
    - [3, 819.2]
  - - [1408, 448, 1, 1280]
    - [19, 6448.91]
  - - [3584, 5056, 1, 32]
    - [22, 3579.4]
  - - [1024, 32, 1, 1280]
    - [35, 346.522]
  - - [128, 2368, 1, 1]
    - [44, 28.703]
  - - [6784, 1856, 1, 1280]
    - [19, 9852.67]
  - - [5056, 5056, 1, 3328]
    - [20, 9686.26]
  - - [128, 704, 1, 1280]
    - [13, 3218.29]
  - - [128, 2944, 1, 1280]
    - [5, 5491.18]
  - - [2368, 5056, 1, 1]
    - [42, 230.597]
  - - [5888, 1408, 1, 256]
    - [21, 9430.85]
  - - [2368, 1024, 1, 32]
    - [22, 2359.93]
  - - [256, 256, 1, 3328]
    - [11, 2740.0]
  - - [64, 4288, 1, 1]
    - [37, 25.2235]
  - - [4288, 1024, 1, 256]
    - [19, 9195.63]
  - - [3584, 32, 1, 32]
    - [31, 278.032]
  - - [3584, 64, 1, 1]
    - [48, 22.5764]
  - - [704, 32, 1, 1280]
    - [35, 234.362]
  - - [32, 4288, 1, 32]
    - [35, 308.351]
  - - [64, 64, 1, 3328]
    - [11, 181.849]
  - - [64, 1408, 1, 1]
    - [44, 7.76828]
  - - [4288, 5888, 1, 1280]
    - [19, 10242.0]
  - - [1856, 2944, 1, 3328]
    - [19, 10013.9]
  - - [256, 1024, 1, 256]
    - [8, 4485.89]
  - - [5056, 5888, 1, 256]
    - [19, 9720.72]
  - - [1408, 128, 1, 1280]
    - [13, 4541.08]
  - - [5056, 256, 1, 3328]
    - [19, 8745.23]
  - - [1024, 5888, 1, 1280]
    - [19, 10040.5]
  - - [1024, 448, 1, 1]
    - [42, 42.477]
  - - [32, 32, 1, 32]
    - [26, 2.12228]
  - - [5056, 1, 1, 1280]
    - [52, 33.5668]
  - - [5888, 5056, 1, 1280]
    - [19, 10088.9]
  - - [5888, 2944, 1, 1]
    - [36, 240.485]
  - - [64, 4288, 1, 1280]
    - [6, 4480.52]
  - - [1408, 4288, 1, 3328]
    - [19, 9733.76]
  - - [704, 2944, 1, 32]
    - [22, 2355.2]
  - - [1, 5888, 1, 1280]
    - [52, 38.3738]
  - - [2944, 4288, 1, 3328]
    - [19, 10131.0]
  - - [256, 2944, 1, 256]
    - [19, 6755.53]
  - - [704, 448, 1, 32]
    - [31, 712.75]
  - - [5056, 2944, 1, 256]
    - [19, 9616.71]
  - - [704, 1024, 1, 256]
    - [19, 6535.03]
  - - [2368, 1856, 1, 256]
    - [19, 9216.27]
  - - [64, 3584, 1, 1]
    - [39, 16.4782]
  - - [1024, 128, 1, 1280]
    - [13, 4324.02]
  - - [2368, 4288, 1, 1280]
    - [19, 10118.6]
  - - [3584, 448, 1, 256]
    - [19, 7457.22]
  - - [256, 6784, 1, 256]
    - [19, 8054.28]
  - - [1024, 32, 1, 32]
    - [24, 69.7191]
  - - [1024, 1408, 1, 1]
    - [37, 101.249]
  - - [128, 64, 1, 32]
    - [24, 16.7184]
  - - [64, 1, 1, 1280]
    - [53, 0.585141]
  - - [2368, 32, 1, 32]
    - [24, 156.239]
  - - [256, 5888, 1, 1]
    - [42, 104.097]
  - - [2944, 2944, 1, 1]
    - [36, 219.31]
  - - [6784, 3584, 1, 256]
    - [19, 9704.91]
  - - [1408, 1856, 1, 256]
    - [19, 8821.09]
  - - [128, 1408, 1, 256]
    - [1, 3151.46]
  - - [2944, 2944, 1, 32]
    - [22, 3289.24]
  - - [2944, 2944, 1, 3328]
    - [19, 9956.17]
  - - [1, 2944, 1, 256]
    - [52, 18.5084]
  - - [448, 32, 1, 1280]
    - [35, 151.104]
  - - [3584, 1, 1, 256]
    - [48, 22.9836]
  - - [704, 32, 1, 3328]
    - [35, 257.321]
  - - [256, 448, 1, 3328]
    - [13, 4109.41]
  - - [128, 128, 1, 256]
    - [3, 480.998]
  - - [2368, 64, 1, 256]
    - [13, 2819.57]
  - - [64, 448, 1, 1280]
    - [11, 1200.92]
  - - [6784, 1408, 1, 32]
    - [22, 3402.27]
  - - [1408, 448, 1, 3328]
    - [19, 6608.06]
  - - [2368, 6784, 1, 3328]
    - [19, 10217.2]
  - - [256, 2368, 1, 1]
    - [50, 52.2593]
  - - [4288, 3584, 1, 32]
    - [22, 3494.76]
  - - [5888, 64, 1, 3328]
    - [5, 5642.98]
  - - [3584, 704, 1, 1280]
    - [19, 9206.43]
  - - [448, 5056, 1, 3328]
    - [19, 9224.45]
  - - [4288, 448, 1, 256]
    - [19, 7860.97]
  - - [5056, 256, 1, 1280]
    - [19, 8589.54]
  - - [704, 448, 1, 3328]
    - [15, 4684.15]
  - - [2944, 5888, 1, 32]
    - [22, 3647.4]
  - - [3584, 5056, 1, 256]
    - [19, 9740.68]
  - - [6784, 1, 1, 3328]
    - [52, 46.0157]
  - - [32, 2368, 1, 3328]
    - [35, 856.598]
  - - [4288, 256, 1, 1]
    - [38, 83.1612]
  - - [64, 256, 1, 1]
    - [42, 1.57538]
  - - [1856, 448, 1, 3328]
    - [19, 6895.91]
  - - [3584, 2368, 1, 256]
    - [19, 9475.97]
  - - [4288, 4288, 1, 256]
    - [19, 9722.11]
  - - [4288, 256, 1, 1280]
    - [19, 7429.63]
  - - [448, 5056, 1, 256]
    - [19, 8302.73]
  - - [128, 1856, 1, 1]
    - [39, 22.497]
  - - [4288, 704, 1, 1280]
    - [19, 9317.14]
  - - [128, 1856, 1, 32]
    - [35, 546.133]
  - - [2368, 704, 1, 1]
    - [42, 109.102]
  - - [3584, 32, 1, 256]
    - [35, 843.682]
  - - [448, 2368, 1, 1280]
    - [19, 7161.95]
  - - [3584, 256, 1, 1]
    - [37, 73.5179]
  - - [1408, 1856, 1, 1280]
    - [19, 9530.88]
  - - [3584, 4288, 1, 3328]
    - [19, 10260.3]
  - - [448, 4288, 1, 32]
    - [22, 2227.27]
  - - [448, 4288, 1, 1280]
    - [19, 8580.79]
  - - [64, 3584, 1, 256]
    - [8, 3989.15]
  - - [1, 6784, 1, 1280]
    - [52, 44.742]
  - - [5056, 1024, 1, 256]
    - [19, 9173.59]
  - - [2368, 448, 1, 32]
    - [26, 1625.85]
  - - [4288, 3584, 1, 1280]
    - [19, 10189.8]
  - - [32, 2944, 1, 1280]
    - [35, 959.47]
  - - [1408, 704, 1, 1]
    - [39, 74.194]
  - - [2368, 256, 1, 256]
    - [19, 5590.39]
  - - [1, 5056, 1, 1]
    - [42, 0.549565]
  - - [4288, 32, 1, 32]
    - [31, 345.197]
  - - [1856, 3584, 1, 32]
    - [22, 3047.84]
  - - [5056, 3584, 1, 3328]
    - [17, 9923.39]
  - - [4288, 5056, 1, 256]
    - [19, 9858.8]
  - - [1856, 5888, 1, 256]
    - [19, 9684.3]
  - - [256, 256, 1, 256]
    - [7, 1777.25]
  - - [2368, 3584, 1, 1]
    - [37, 215.185]
  - - [4288, 2368, 1, 256]
    - [19, 9630.33]
  - - [448, 1, 1, 3328]
    - [53, 4.43311]
  - - [1856, 256, 1, 1280]
    - [15, 6616.34]
  - - [256, 2944, 1, 1]
    - [38, 61.5739]
  - - [1408, 2944, 1, 3328]
    - [19, 9850.8]
  - - [32, 1856, 1, 32]
    - [24, 121.83]
  - - [5888, 3584, 1, 1]
    - [41, 246.526]
  - - [256, 1, 1, 1]
    - [44, 0.0336842]
  - - [6784, 5056, 1, 3328]
    - [19, 10162.1]
  - - [6784, 5056, 1, 1]
    - [36, 257.816]
  - - [5888, 3584, 1, 32]
    - [22, 3698.96]
  - - [5888, 3584, 1, 3328]
    - [19, 10089.6]
  - - [32, 1024, 1, 1280]
    - [35, 339.125]
  - - [1, 256, 1, 3328]
    - [53, 2.5943]
  - - [1024, 6784, 1, 256]
    - [19, 9423.4]
  - - [6784, 5888, 1, 32]
    - [22, 3772.77]
  - - [1408, 1, 1, 1280]
    - [53, 13.0597]
  - - [2368, 6784, 1, 32]
    - [22, 3607.98]
  - - [6784, 64, 1, 1]
    - [42, 42.4]
  - - [5056, 1408, 1, 1280]
    - [21, 9632.26]
  - - [3584, 1408, 1, 3328]
    - [19, 9686.9]
  - - [2944, 3584, 1, 1]
    - [36, 229.376]
  - - [2944, 1408, 1, 1280]
    - [19, 9756.17]
  - - [1856, 64, 1, 1]
    - [37, 9.89867]
  - - [3584, 1024, 1, 1]
    - [37, 163.84]
  - - [256, 32, 1, 256]
    - [35, 70.6588]
  - - [2944, 1856, 1, 3328]
    - [19, 10006.4]
  - - [128, 1024, 1, 3328]
    - [11, 4656.36]
  - - [1408, 128, 1, 1]
    - [42, 13.1743]
  - - [2944, 3584, 1, 32]
    - [22, 3467.97]
  - - [5888, 256, 1, 32]
    - [29, 1944.94]
  - - [6784, 64, 1, 256]
    - [19, 5145.79]
  - - [256, 128, 1, 1280]
    - [11, 1376.08]
  - - [6784, 5056, 1, 256]
    - [19, 9755.54]
  - - [1408, 32, 1, 3328]
    - [35, 507.261]
  - - [1856, 3584, 1, 1280]
    - [19, 9841.0]
  - - [256, 5888, 1, 256]
    - [19, 7894.35]
  - - [5056, 32, 1, 256]
    - [35, 978.704]
  - - [1024, 4288, 1, 3328]
    - [19, 9856.57]
  - - [448, 2368, 1, 256]
    - [19, 6553.6]
  - - [64, 1408, 1, 1280]
    - [11, 3232.72]
  - - [3584, 32, 1, 1280]
    - [35, 1228.25]
  - - [128, 2368, 1, 3328]
    - [5, 4560.26]
  - - [64, 5056, 1, 256]
    - [5, 4044.8]
  - - [256, 64, 1, 256]
    - [3, 468.114]
  - - [32, 1408, 1, 256]
    - [31, 319.688]
  - - [2368, 448, 1, 3328]
    - [19, 7310.24]
  - - [2368, 1408, 1, 1]
    - [37, 157.271]
  - - [1, 1, 1, 1]
    - [42, 8.99281e-05]
  - - [1024, 1856, 1, 32]
    - [22, 2153.59]
  - - [32, 1024, 1, 32]
    - [23, 65.536]
  - - [4288, 1, 1, 256]
    - [52, 24.2004]
  - - [1856, 128, 1, 3328]
    - [15, 5574.07]
  - - [5888, 2368, 1, 1]
    - [42, 235.839]
  - - [2368, 2368, 1, 1]
    - [37, 192.035]
  - - [704, 256, 1, 1280]
    - [15, 3999.42]
  - - [704, 4288, 1, 256]
    - [19, 8663.68]
  - - [5888, 2368, 1, 32]
    - [22, 3461.9]
  - - [5888, 2368, 1, 1280]
    - [18, 9612.39]
  - - [128, 256, 1, 256]
    - [3, 936.229]
  - - [2944, 5056, 1, 3328]
    - [19, 10283.5]
  - - [6784, 704, 1, 3328]
    - [19, 9461.34]
  - - [1856, 1856, 1, 32]
    - [22, 2701.75]
  - - [4288, 2944, 1, 32]
    - [22, 3428.07]
  - - [256, 5056, 1, 1]
    - [38, 92.4526]
  - - [704, 64, 1, 256]
    - [3, 1264.73]
  - - [256, 2368, 1, 3328]
    - [19, 6363.42]
  - - [704, 1, 1, 1]
    - [37, 0.0637681]
  - - [128, 448, 1, 1280]
    - [11, 2311.09]
  - - [5056, 5056, 1, 256]
    - [19, 9693.33]
  - - [5888, 256, 1, 256]
    - [19, 7830.28]
  - - [5888, 64, 1, 1]
    - [39, 37.6832]
  - - [6784, 6784, 1, 256]
    - [21, 9863.53]
  - - [256, 3584, 1, 1]
    - [37, 72.5873]
  - - [2368, 1, 1, 256]
    - [52, 15.3083]
  - - [448, 32, 1, 32]
    - [24, 30.1811]
  - - [704, 64, 1, 1]
    - [50, 3.83129]
  - - [3584, 704, 1, 3328]
    - [19, 9315.09]
  - - [4288, 704, 1, 3328]
    - [19, 9404.63]
  - - [4288, 2944, 1, 1280]
    - [19, 10053.9]
  - - [448, 3584, 1, 256]
    - [19, 7457.22]
  - - [704, 32, 1, 256]
    - [31, 158.788]
  - - [6784, 256, 1, 32]
    - [30, 2124.41]
  - - [1856, 128, 1, 1]
    - [39, 21.6759]
  - - [1856, 32, 1, 32]
    - [24, 127.725]
  - - [6784, 1408, 1, 1280]
    - [19, 9840.31]
  - - [2368, 5056, 1, 1280]
    - [19, 10145.2]
  - - [704, 1856, 1, 1280]
    - [19, 8765.61]
  - - [1408, 1408, 1, 1280]
    - [21, 8950.18]
  - - [448, 1024, 1, 3328]
    - [19, 6587.53]
  - - [32, 704, 1, 32]
    - [24, 47.1791]
  - - [256, 704, 1, 1]
    - [42, 13.5711]
  - - [5888, 1856, 1, 32]
    - [22, 3439.22]
  - - [5888, 704, 1, 3328]
    - [19, 9671.24]
  - - [5056, 1, 1, 256]
    - [52, 28.6358]
  - - [448, 6784, 1, 256]
    - [19, 8714.64]
  - - [1024, 128, 1, 1]
    - [44, 11.1456]
  - - [128, 64, 1, 256]
    - [3, 209.715]
  - - [1856, 128, 1, 256]
    - [8, 4154.19]
  - - [2944, 5888, 1, 256]
    - [19, 9745.2]
  - - [1024, 256, 1, 1280]
    - [15, 5777.28]
  - - [128, 5056, 1, 32]
    - [26, 1226.86]
  - - [128, 5056, 1, 1280]
    - [19, 6658.96]
  - - [448, 32, 1, 3328]
    - [35, 158.569]
  - - [1856, 1408, 1, 32]
    - [22, 2506.71]
  - - [64, 704, 1, 32]
    - [24, 91.4843]
  - - [64, 704, 1, 3328]
    - [11, 1979.23]
  - - [64, 2368, 1, 32]
    - [24, 297.161]
  - - [5888, 64, 1, 32]
    - [33, 757.451]
  - - [2368, 256, 1, 1]
    - [52, 48.265]
  - - [5888, 64, 1, 1280]
    - [10, 5451.46]
  - - [5056, 1, 1, 1]
    - [50, 0.5056]
  - - [5888, 2944, 1, 1280]
    - [21, 9808.6]
  - - [32, 2368, 1, 256]
    - [31, 529.439]
  - - [256, 1408, 1, 256]
    - [8, 4385.68]
  - - [448, 5888, 1, 1]
    - [42, 142.739]
  - - [3584, 1408, 1, 1]
    - [36, 183.902]
  - - [32, 6784, 1, 1280]
    - [35, 1561.78]
  - - [32, 6784, 1, 32]
    - [31, 482.418]
  - - [448, 5888, 1, 32]
    - [22, 2425.59]
  - - [5056, 704, 1, 1280]
    - [19, 9340.79]
  - - [1856, 6784, 1, 1]
    - [42, 231.454]
  - - [5056, 64, 1, 1]
    - [44, 31.355]
  - - [1, 5888, 1, 1]
    - [37, 0.623729]
  - - [2368, 1024, 1, 256]
    - [19, 8290.02]
  - - [1856, 6784, 1, 32]
    - [22, 3507.27]
  - - [1856, 6784, 1, 1280]
    - [19, 10056.3]
  - - [64, 3584, 1, 3328]
    - [12, 5381.86]
  - - [5888, 5056, 1, 3328]
    - [17, 9915.45]
  - - [1, 2944, 1, 3328]
    - [53, 29.1596]
  - - [1408, 6784, 1, 32]
    - [22, 3348.6]
  - - [32, 5888, 1, 1280]
    - [35, 1354.29]
  - - [448, 256, 1, 1]
    - [37, 9.49404]
  - - [3584, 5888, 1, 3328]
    - [19, 10294.5]
  - - [4288, 1408, 1, 256]
    - [19, 9191.25]
  - - [448, 64, 1, 1280]
    - [11, 1207.24]
  - - [128, 448, 1, 32]
    - [34, 106.687]
  - - [6784, 2368, 1, 256]
    - [19, 9569.32]
  - - [1408, 448, 1, 32]
    - [26, 1213.05]
  - - [1856, 1408, 1, 1280]
    - [19, 9539.58]
  - - [448, 256, 1, 3328]
    - [13, 4095.3]
  - - [1856, 2368, 1, 1]
    - [37, 177.218]
  - - [1408, 5056, 1, 3328]
    - [19, 9884.32]
  - - [128, 704, 1, 3328]
    - [11, 3477.42]
  - - [5056, 128, 1, 1280]
    - [5, 6663.25]
  - - [5056, 4288, 1, 256]
    - [19, 9677.28]
  - - [5056, 5056, 1, 32]
    - [22, 3723.69]
  - - [1856, 704, 1, 256]
    - [19, 7874.19]
  - - [64, 256, 1, 256]
    - [3, 485.452]
  - - [448, 5888, 1, 1280]
    - [19, 8831.38]
  - - [128, 6784, 1, 256]
    - [5, 6387.88]
  - - [5056, 448, 1, 256]
    - [19, 8255.45]
  - - [4288, 5888, 1, 1]
    - [37, 249.484]
  - - [1856, 5056, 1, 1280]
    - [19, 10114.7]
  - - [2368, 4288, 1, 1]
    - [42, 222.675]
  - - [2368, 32, 1, 3328]
    - [35, 851.278]
  - - [3584, 1856, 1, 256]
    - [19, 9352.41]
  - - [256, 3584, 1, 256]
    - [19, 6703.23]
  - - [64, 704, 1, 1]
    - [42, 3.83129]
  - - [4288, 5888, 1, 32]
    - [22, 3672.4]
  - - [4288, 5888, 1, 3328]
    - [19, 10292.6]
  - - [1, 1024, 1, 1]
    - [42, 0.0934307]
  - - [1024, 2944, 1, 3328]
    - [19, 9409.5]
  - - [2944, 2368, 1, 256]
    - [19, 9452.73]
  - - [1024, 1856, 1, 256]
    - [19, 7888.12]
  - - [2944, 64, 1, 3328]
    - [14, 4632.45]
  - - [1024, 5888, 1, 32]
    - [30, 2973.77]
  - - [1024, 5888, 1, 3328]
    - [19, 10125.9]
  - - [5056, 2368, 1, 32]
    - [22, 3339.64]
  - - [1408, 2368, 1, 1280]
    - [19, 9551.71]
  - - [256, 1, 1, 3328]
    - [53, 2.54106]
  - - [128, 1024, 1, 32]
    - [24, 259.549]
  - - [5056, 6784, 1, 3328]
    - [19, 10178.4]
  - - [448, 704, 1, 1]
    - [52, 27.9603]
  - - [32, 64, 1, 32]
    - [24, 4.20103]
  - - [448, 704, 1, 32]
    - [31, 678.262]
  - - [448, 704, 1, 3328]
    - [15, 4692.53]
  - - [1408, 2944, 1, 256]
    - [21, 9211.45]
  - - [64, 5888, 1, 1]
    - [47, 35.1522]
  - - [2368, 128, 1, 32]
    - [31, 684.981]
  - - [2368, 256, 1, 1280]
    - [19, 6253.6]
  - - [2368, 128, 1, 3328]
    - [10, 4556.97]
  - - [704, 5056, 1, 32]
    - [22, 2786.24]
  - - [32, 2368, 1, 32]
    - [24, 152.314]
  - - [1408, 1, 1, 256]
    - [52, 9.23279]
  - - [4288, 256, 1, 32]
    - [30, 1728.71]
  - - [448, 1408, 1, 1]
    - [48, 53.2757]
  - - [5056, 4288, 1, 1280]
    - [19, 10064.2]
  - - [1408, 256, 1, 256]
    - [19, 4402.42]
  - - [4288, 448, 1, 1]
    - [37, 87.3193]
  - - [256, 4288, 1, 32]
    - [26, 1701.9]
  - - [1408, 256, 1, 1280]
    - [15, 5103.69]
  - - [256, 256, 1, 1]
    - [37, 5.49799]
  - - [1408, 1, 1, 1]
    - [44, 0.129412]
  - - [448, 1408, 1, 256]
    - [19, 5750.74]
  - - [5888, 5888, 1, 1]
    - [41, 262.005]
  - - [128, 2944, 1, 32]
    - [31, 819.2]
  - - [32, 256, 1, 32]
    - [31, 23.4057]
  - - [2944, 704, 1, 1280]
    - [19, 9262.91]
  - - [1024, 3584, 1, 1280]
    - [19, 9799.78]
  - - [1856, 448, 1, 1]
    - [37, 66.6256]
  - - [2368, 2944, 1, 1]
    - [42, 204.56]
  - - [5056, 256, 1, 32]
    - [30, 1903.44]
  - - [4288, 1, 1, 3328]
    - [52, 29.31]
  - - [5056, 1024, 1, 1280]
    - [21, 9676.14]
  - - [704, 704, 1, 1]
    - [42, 43.6282]
  - - [1856, 448, 1, 1280]
    - [19, 6780.74]
  - - [3584, 6784, 1, 256]
    - [19, 9877.41]
  - - [64, 1856, 1, 1280]
    - [13, 3984.37]
  - - [1856, 1408, 1, 256]
    - [19, 8830.41]
  - - [4288, 4288, 1, 32]
    - [22, 3628.41]
  - - [128, 1, 1, 256]
    - [52, 0.835908]
  - - [32, 64, 1, 3328]
    - [35, 23.2334]
  - - [5888, 448, 1, 1]
    - [37, 139.126]
  - - [128, 5888, 1, 256]
    - [19, 6643.87]
  - - [3584, 256, 1, 3328]
    - [16, 7616.88]
  - - [5056, 5056, 1, 1280]
    - [19, 10067.7]
  - - [6784, 1408, 1, 3328]
    - [19, 9895.84]
  - - [448, 2368, 1, 1]
    - [50, 79.8843]
  - - [2368, 1, 1, 1280]
    - [53, 21.9259]
  - - [32, 3584, 1, 32]
    - [31, 273.067]
  - - [128, 6784, 1, 1]
    - [42, 72.8483]
  - - [1, 3584, 1, 1]
    - [37, 0.373333]
  - - [5888, 5888, 1, 3328]
    - [17, 10023.9]
  - - [256, 2944, 1, 3328]
    - [19, 7897.34]
  - - [1, 128, 1, 3328]
    - [53, 1.27114]
  - - [32, 256, 1, 256]
    - [35, 70.4688]
  - - [5888, 1408, 1, 32]
    - [22, 3390.72]
  - - [704, 256, 1, 1]
    - [42, 14.1686]
  - - [1, 448, 1, 1]
    - [43, 0.0533333]
  - - [256, 6784, 1, 3328]
    - [19, 8889.74]
  - - [64, 5888, 1, 256]
    - [5, 4637.93]
  - - [1856, 1, 1, 1]
    - [37, 0.170588]
  - - [1024, 256, 1, 3328]
    - [15, 6133.4]
  - - [704, 704, 1, 256]
    - [19, 5746.27]
  - - [448, 1024, 1, 32]
    - [26, 899.514]
  - - [6784, 2368, 1, 1280]
    - [19, 9952.06]
  - - [128, 1856, 1, 1280]
    - [12, 5271.97]
  - - [256, 2368, 1, 256]
    - [19, 5558.35]
  - - [2944, 1408, 1, 1]
    - [37, 173.874]
  - - [6784, 1024, 1, 256]
    - [19, 9270.15]
  - - [5056, 1408, 1, 32]
    - [22, 3178.06]
  - - [1408, 6784, 1, 3328]
    - [19, 10099.1]
  - - [2944, 1408, 1, 3328]
    - [19, 9849.68]
  - - [1856, 32, 1, 256]
    - [31, 424.229]
  - - [704, 2368, 1, 32]
    - [26, 2033.01]
  - - [448, 256, 1, 32]
    - [25, 220.554]
  - - [704, 6784, 1, 1]
    - [42, 182.566]
  - - [2368, 6784, 1, 256]
    - [19, 9712.16]
  - - [1856, 3584, 1, 3328]
    - [19, 9915.41]
  - - [1, 704, 1, 3328]
    - [53, 7.00464]
  - - [64, 1, 1, 3328]
    - [53, 0.635266]
  - - [448, 704, 1, 1280]
    - [8, 4542.1]
  - - [704, 1856, 1, 1]
    - [44, 93.8667]
  - - [704, 448, 1, 256]
    - [19, 3866.87]
  - - [448, 64, 1, 3328]
    - [11, 1293.66]
  - - [704, 6784, 1, 256]
    - [19, 9037.84]
  - - [256, 32, 1, 1280]
    - [35, 86.6878]
  - - [2368, 448, 1, 1280]
    - [19, 7195.35]
  - - [6784, 2944, 1, 32]
    - [22, 3684.89]
  - - [64, 4288, 1, 32]
    - [24, 620.185]
  - - [128, 704, 1, 1]
    - [44, 7.66258]
  - - [128, 448, 1, 3328]
    - [13, 2487.5]
  - - [5888, 2368, 1, 3328]
    - [19, 9960.49]
  - - [2368, 704, 1, 1280]
    - [19, 8432.87]
  - - [1024, 1408, 1, 1280]
    - [19, 8325.03]
  - - [4288, 64, 1, 1280]
    - [13, 4321.76]
  - - [128, 5056, 1, 1]
    - [48, 57.373]
  - - [2944, 5056, 1, 32]
    - [22, 3569.51]
  - - [448, 448, 1, 1]
    - [52, 14.336]
  - - [256, 2368, 1, 1280]
    - [19, 6241.52]
  - - [704, 2368, 1, 3328]
    - [19, 8534.36]
  - - [3584, 2944, 1, 256]
    - [19, 9559.5]
  - - [64, 6784, 1, 256]
    - [8, 5203.61]
  - - [3584, 1024, 1, 1280]
    - [19, 9780.19]
  - - [64, 1024, 1, 256]
    - [3, 1733.18]
  - - [1408, 32, 1, 32]
    - [24, 94.8547]
  - - [128, 3584, 1, 256]
    - [8, 5417.0]
  - - [704, 1408, 1, 1]
    - [39, 76.0147]
  - - [5056, 3584, 1, 256]
    - [19, 9587.67]
  - - [2368, 704, 1, 256]
    - [19, 7753.82]
  - - [1856, 1856, 1, 1280]
    - [19, 9219.77]
  - - [32, 5888, 1, 32]
    - [24, 440.739]
  - - [64, 32, 1, 32]
    - [24, 4.38075]
  - - [4288, 704, 1, 1]
    - [40, 117.553]
  - - [1856, 1024, 1, 1]
    - [42, 118.193]
  - - [4288, 2944, 1, 3328]
    - [19, 10118.2]
  - - [1024, 128, 1, 3328]
    - [11, 4668.32]
  - - [4288, 128, 1, 3328]
    - [15, 5784.83]
  - - [4288, 704, 1, 32]
    - [30, 2552.86]
  - - [1856, 1024, 1, 32]
    - [28, 2105.87]
  - - [1, 448, 1, 3328]
    - [53, 4.42154]
  - - [2944, 6784, 1, 1]
    - [41, 252.683]
  - - [6784, 2368, 1, 32]
    - [22, 3561.98]
  - - [5888, 5056, 1, 1]
    - [36, 255.403]
  - - [128, 6784, 1, 1280]
    - [10, 7146.93]
  - - [704, 5888, 1, 1]
    - [37, 174.459]
  - - [6784, 6784, 1, 1]
    - [41, 252.65]
  - - [1856, 32, 1, 1280]
    - [35, 630.572]
  - - [5888, 448, 1, 3328]
    - [19, 8787.11]
  - - [704, 5888, 1, 32]
    - [22, 2903.78]
  - - [704, 5888, 1, 1280]
    - [19, 9753.3]
  - - [1024, 6784, 1, 3328]
    - [19, 9994.39]
  - - [704, 2944, 1, 1280]
    - [19, 9252.57]
  - - [4288, 6784, 1, 256]
    - [19, 9912.4]
  - - [3584, 256, 1, 32]
    - [26, 1535.57]
  - - [1408, 1408, 1, 32]
    - [22, 2246.42]
  - - [1408, 1408, 1, 3328]
    - [21, 9045.79]
  - - [1024, 64, 1, 256]
    - [3, 1747.63]
  - - [4288, 64, 1, 32]
    - [31, 616.701]
  - - [1408, 256, 1, 32]
    - [31, 800.996]
  - - [5888, 128, 1, 256]
    - [19, 6755.53]
  - - [64, 704, 1, 1280]
    - [11, 1839.02]
  - - [2944, 1856, 1, 256]
    - [19, 9385.4]
  - - [128, 5056, 1, 3328]
    - [5, 6798.53]
  - - [4288, 2944, 1, 1]
    - [42, 231.037]
  - - [6784, 5056, 1, 32]
    - [22, 3746.58]
  - - [1024, 448, 1, 3328]
    - [15, 6647.19]
  - - [3584, 128, 1, 1]
    - [44, 43.774]
  - - [2944, 4288, 1, 1280]
    - [19, 10065.4]
  - - [64, 32, 1, 3328]
    - [35, 23.348]
  - - [1024, 4288, 1, 256]
    - [19, 9195.63]
  - - [128, 2368, 1, 256]
    - [0, 3848.94]
  - - [2368, 64, 1, 32]
    - [24, 298.625]
  - - [1408, 1, 1, 3328]
    - [53, 13.9659]
  - - [64, 1408, 1, 32]
    - [26, 180.224]
  - - [2368, 5888, 1, 1]
    - [42, 235.52]
  - - [1408, 1856, 1, 32]
    - [30, 2381.09]
  - - [448, 1856, 1, 256]
    - [19, 6102.66]
  - - [1856, 6784, 1, 3328]
    - [19, 10106.9]
  - - [3584, 128, 1, 256]
    - [8, 5417.0]
  - - [1024, 448, 1, 1280]
    - [19, 6404.91]
  - - [1024, 2368, 1, 32]
    - [22, 2377.29]
  - - [32, 2944, 1, 256]
    - [31, 599.335]
  - - [128, 5888, 1, 1]
    - [41, 63.2268]
  - - [64, 5056, 1, 1]
    - [44, 29.9615]
  - - [1856, 256, 1, 32]
    - [24, 950.272]
  - - [2368, 2368, 1, 3328]
    - [19, 9828.05]
  - - [64, 448, 1, 1]
    - [51, 2.8672]
  - - [3584, 5888, 1, 32]
    - [22, 3619.66]
  - - [3584, 5888, 1, 1280]
    - [19, 10238.4]
  - - [64, 5056, 1, 32]
    - [31, 739.621]
  - - [2944, 64, 1, 1]
    - [44, 14.188]
  - - [6784, 704, 1, 256]
    - [19, 8906.17]
  - - [3584, 1024, 1, 32]
    - [22, 2817.67]
  - - [1408, 704, 1, 32]
    - [26, 1598.76]
  - - [1408, 704, 1, 1280]
    - [19, 8042.45]
  - - [2368, 5888, 1, 256]
    - [19, 9680.39]
  - - [2944, 64, 1, 32]
    - [24, 347.311]
  - - [1, 1408, 1, 256]
    - [52, 9.25175]
  - - [64, 2944, 1, 256]
    - [1, 3387.25]
  - - [5888, 5888, 1, 32]
    - [22, 3752.01]
  - - [1856, 1408, 1, 3328]
    - [19, 9658.06]
  - - [1024, 1024, 1, 32]
    - [26, 1671.04]
  - - [4288, 1024, 1, 1]
    - [37, 175.356]
  - - [704, 4288, 1, 3328]
    - [19, 9420.87]
  - - [2944, 5056, 1, 1280]
    - [19, 10223.1]
  - - [6784, 2944, 1, 1280]
    - [19, 9995.1]
  - - [6784, 256, 1, 3328]
    - [19, 8751.89]
  - - [5056, 128, 1, 3328]
    - [5, 6800.25]
  - - [128, 128, 1, 1280]
    - [11, 686.241]
  - - [128, 4288, 1, 1]
    - [50, 48.6582]
  - - [1408, 5056, 1, 32]
    - [22, 3075.1]
  - - [2944, 128, 1, 3328]
    - [5, 5655.2]
  - - [5888, 1856, 1, 1280]
    - [19, 9930.71]
  - - [64, 128, 1, 256]
    - [3, 222.156]
  - - [5888, 256, 1, 1280]
    - [19, 8576.55]
  - - [1856, 5056, 1, 1]
    - [42, 203.292]
  - - [3584, 1856, 1, 1280]
    - [19, 9838.28]
  - - [6784, 448, 1, 256]
    - [19, 8546.17]
  - - [704, 3584, 1, 256]
    - [19, 8498.98]
  - - [1856, 5056, 1, 32]
    - [22, 3357.4]
  - - [1856, 5056, 1, 3328]
    - [19, 10189.0]
  - - [1024, 2944, 1, 32]
    - [22, 2571.14]
  - - [1408, 6784, 1, 256]
    - [19, 9575.81]
  - - [1024, 2368, 1, 1280]
    - [19, 8872.01]
  - - [1856, 3584, 1, 1]
    - [42, 201.329]
  - - [5888, 128, 1, 1280]
    - [19, 7670.88]
  - - [2944, 5888, 1, 1280]
    - [19, 10160.4]
  - - [1, 1856, 1, 1]
    - [47, 0.166906]
  - - [3584, 3584, 1, 256]
    - [19, 9749.57]
  - - [1856, 2368, 1, 3328]
    - [19, 9862.57]
  - - [5888, 704, 1, 256]
    - [19, 9041.91]
  - - [64, 448, 1, 32]
    - [24, 58.5143]
  - - [6784, 4288, 1, 256]
    - [19, 9746.34]
  - - [128, 64, 1, 3328]
    - [11, 361.77]
  - - [1, 5056, 1, 1280]
    - [52, 33.6086]
  - - [32, 64, 1, 1280]
    - [35, 21.2366]
  - - [1408, 2368, 1, 3328]
    - [19, 9646.71]
  - - [1024, 3584, 1, 256]
    - [19, 9160.73]
  - - [2944, 128, 1, 256]
    - [10, 4550.42]
  - - [6784, 128, 1, 1]
    - [39, 71.4105]
  - - [1408, 256, 1, 3328]
    - [15, 5246.55]
  - - [448, 32, 1, 256]
    - [31, 100.383]
  - - [1024, 32, 1, 256]
    - [31, 231.986]
  - - [1, 5888, 1, 256]
    - [52, 32.4855]
  - - [64, 2368, 1, 256]
    - [1, 3012.21]
  - - [2944, 256, 1, 256]
    - [19, 6793.59]
  - - [1, 128, 1, 256]
    - [52, 0.834216]
  - - [32, 256, 1, 1280]
    - [35, 92.0449]
  - - [5888, 1, 1, 256]
    - [52, 32.6544]
  - - [32, 128, 1, 3328]
    - [35, 46.696]
  - - [6784, 128, 1, 256]
    - [19, 6272.52]
  - - [6784, 64, 1, 1280]
    - [15, 6104.41]
  - - [4288, 1024, 1, 32]
    - [22, 2922.4]
  - - [1408, 64, 1, 3328]
    - [13, 3461.37]
  - - [2944, 448, 1, 1280]
    - [19, 7659.74]
  - - [6784, 32, 1, 1280]
    - [35, 1541.68]
  - - [2944, 64, 1, 1280]
    - [13, 4616.62]
  - - [704, 448, 1, 1]
    - [50, 29.8667]
  - - [32, 128, 1, 32]
    - [24, 8.53333]
  - - [1, 128, 1, 1]
    - [42, 0.0115942]
  - - [5888, 1, 1, 1]
    - [37, 0.598374]
  - - [5888, 1856, 1, 3328]
    - [18, 9825.58]
  - - [2368, 3584, 1, 256]
    - [19, 9485.87]
  - - [4288, 1408, 1, 3328]
    - [19, 9723.2]
  - - [1856, 32, 1, 3328]
    - [35, 667.939]
  - - [2944, 32, 1, 256]
    - [31, 638.698]
  - - [128, 64, 1, 1]
    - [53, 0.682667]
  - - [256, 1024, 1, 3328]
    - [15, 6147.23]
  - - [32, 448, 1, 256]
    - [31, 99.7287]
  - - [1856, 64, 1, 3328]
    - [13, 4263.52]
  - - [256, 5056, 1, 256]
    - [19, 7859.35]
  - - [5888, 2944, 1, 3328]
    - [19, 10008.4]
  - - [2368, 1408, 1, 3328]
    - [19, 9644.69]
  - - [5888, 704, 1, 32]
    - [30, 2772.68]
  - - [2944, 704, 1, 1]
    - [42, 122.783]
  - - [6784, 1856, 1, 256]
    - [19, 9453.67]
  - - [1, 704, 1, 256]
    - [52, 4.58819]
  - - [1856, 1856, 1, 1]
    - [37, 161.27]
  - - [5888, 32, 1, 256]
    - [35, 1118.61]
  - - [128, 704, 1, 256]
    - [11, 2135.99]
  - - [256, 1408, 1, 3328]
    - [15, 5242.88]
  - - [2944, 128, 1, 1]
    - [52, 30.7869]
  - - [32, 256, 1, 3328]
    - [35, 95.2452]
  - - [2944, 704, 1, 3328]
    - [19, 9391.04]
  - - [704, 1024, 1, 32]
    - [31, 1304.79]
  - - [2368, 1856, 1, 32]
    - [22, 2872.55]
  - - [5056, 4288, 1, 3328]
    - [17, 9931.21]
  - - [3584, 448, 1, 3328]
    - [19, 8223.87]
  - - [256, 32, 1, 32]
    - [31, 23.7449]
  - - [64, 256, 1, 3328]
    - [11, 739.235]
  - - [256, 6784, 1, 1]
    - [37, 114.861]
  - - [1024, 3584, 1, 32]
    - [22, 2796.2]
  - - [256, 6784, 1, 32]
    - [30, 2111.49]
  - - [2944, 1408, 1, 32]
    - [22, 2898.71]
  - - [4288, 3584, 1, 1]
    - [42, 240.128]
  - - [1, 704, 1, 1]
    - [44, 0.0633094]
  - - [5056, 448, 1, 3328]
    - [19, 9062.96]
  - - [3584, 64, 1, 256]
    - [8, 3989.15]
  - - [64, 1856, 1, 32]
    - [24, 241.186]
  - - [64, 1856, 1, 3328]
    - [13, 4252.51]
  - - [6784, 3584, 1, 32]
    - [22, 3756.49]
  - - [4288, 1856, 1, 256]
    - [19, 9439.32]
  - - [1856, 2944, 1, 256]
    - [19, 9385.4]
  - - [128, 448, 1, 1]
    - [44, 4.81074]
  - - [64, 128, 1, 32]
    - [24, 16.5495]
  - - [704, 1, 1, 1280]
    - [53, 6.37823]
  - - [2944, 5888, 1, 1]
    - [41, 240.487]
  - - [1024, 1856, 1, 3328]
    - [21, 8678.66]
  - - [5888, 1024, 1, 32]
    - [22, 3164.99]
  - - [3584, 256, 1, 1280]
    - [19, 7459.38]
  - - [1024, 1, 1, 1]
    - [47, 0.0941176]
  - - [1408, 5056, 1, 1280]
    - [19, 9815.72]
  - - [3584, 128, 1, 1280]
    - [15, 6416.11]
  - - [5056, 6784, 1, 256]
    - [19, 9751.21]
  - - [256, 1856, 1, 256]
    - [19, 5589.84]
  - - [5888, 32, 1, 1280]
    - [35, 1354.9]
  - - [256, 128, 1, 32]
    - [26, 64.251]
  - - [32, 1856, 1, 1280]
    - [35, 614.268]
  - - [2944, 5056, 1, 1]
    - [36, 240.078]
  - - [448, 128, 1, 1]
    - [44, 4.84324]
  - - [256, 704, 1, 32]
    - [27, 309.397]
  - - [256, 704, 1, 1280]
    - [15, 4004.98]
  - - [1, 2368, 1, 1]
    - [48, 0.20274]
  - - [5888, 5888, 1, 1280]
    - [19, 10089.1]
  - - [256, 2944, 1, 1280]
    - [19, 7710.12]
  - - [2944, 256, 1, 3328]
    - [19, 7893.36]
  - - [5056, 2944, 1, 1280]
    - [19, 10012.9]
  - - [704, 1024, 1, 3328]
    - [19, 7553.97]
  - - [2368, 1856, 1, 1280]
    - [19, 9772.11]
  - - [448, 2944, 1, 1]
    - [38, 96.4117]
  - - [6784, 2944, 1, 1]
    - [36, 249.651]
  - - [2944, 1024, 1, 32]
    - [22, 2661.95]
  - - [2944, 1024, 1, 1280]
    - [19, 9302.7]
  - - [1408, 64, 1, 32]
    - [26, 182.969]
  - - [5056, 5056, 1, 1]
    - [37, 248.281]
  - - [2368, 4288, 1, 256]
    - [19, 9656.07]
  - - [448, 1856, 1, 1280]
    - [19, 6756.63]
  - - [2368, 448, 1, 1]
    - [46, 76.2115]
  - - [448, 2944, 1, 32]
    - [30, 1838.2]
  - - [448, 2944, 1, 1280]
    - [19, 7643.1]
  - - [2944, 6784, 1, 1280]
    - [19, 10191.5]
  - - [256, 6784, 1, 1280]
    - [19, 8776.77]
  - - [128, 2368, 1, 1280]
    - [0, 4685.67]
  - - [3584, 2368, 1, 32]
    - [22, 3328.2]
  - - [704, 32, 1, 32]
    - [26, 46.9333]
  - - [6784, 3584, 1, 3328]
    - [17, 9976.77]
  - - [128, 32, 1, 256]
    - [31, 28.556]
  - - [128, 1408, 1, 1280]
    - [11, 4526.82]
  - - [64, 32, 1, 1280]
    - [35, 21.2366]
  - - [128, 1856, 1, 3328]
    - [12, 5570.93]
  - - [2944, 2944, 1, 256]
    - [19, 9456.13]
  - - [1408, 1024, 1, 3328]
    - [19, 8453.64]
  - - [5056, 2368, 1, 1280]
    - [19, 9949.7]
  - - [448, 128, 1, 32]
    - [24, 112.439]
  - - [2368, 64, 1, 3328]
    - [13, 4271.38]
  - - [32, 5056, 1, 3328]
    - [35, 1211.4]
  - - [448, 2944, 1, 3328]
    - [19, 7758.31]
  - - [2944, 1024, 1, 1]
    - [37, 151.948]
  - - [2368, 128, 1, 1280]
    - [10, 4445.16]
  - - [3584, 704, 1, 256]
    - [19, 8580.27]
  - - [2368, 5888, 1, 3328]
    - [19, 10162.4]
  - - [4288, 2368, 1, 1]
    - [37, 223.853]
  - - [1408, 3584, 1, 32]
    - [22, 3044.51]
  - - [2944, 4288, 1, 32]
    - [26, 3306.84]
  - - [5888, 1408, 1, 1280]
    - [21, 9867.2]
  - - [3584, 5056, 1, 1280]
    - [19, 10154.9]
  - - [5888, 6784, 1, 1280]
    - [18, 10023.6]
  - - [64, 1856, 1, 1]
    - [44, 10.1007]
  - - [704, 128, 1, 32]
    - [24, 183.902]
  - - [3584, 2944, 1, 1]
    - [38, 227.791]
  - - [128, 3584, 1, 3328]
    - [12, 6729.23]
  - - [256, 4288, 1, 3328]
    - [19, 7543.03]
  - - [4288, 64, 1, 1]
    - [37, 26.8]
  - - [1, 1408, 1, 1280]
    - [53, 12.8658]
  - - [5056, 32, 1, 1280]
    - [35, 1186.38]
  - - [1856, 704, 1, 32]
    - [30, 1866.61]
  - - [1024, 1856, 1, 1]
    - [37, 119.984]
  - - [704, 5056, 1, 3328]
    - [19, 9610.08]
  - - [1024, 3584, 1, 3328]
    - [19, 9909.31]
  - - [5888, 256, 1, 3328]
    - [19, 8696.92]
  - - [1856, 1408, 1, 1]
    - [42, 142.024]
  - - [2944, 448, 1, 32]
    - [30, 1851.1]
  - - [128, 448, 1, 256]
    - [3, 1609.66]
  - - [128, 1024, 1, 1]
    - [44, 10.996]
  - - [32, 32, 1, 256]
    - [31, 7.15459]
  - - [4288, 5056, 1, 1280]
    - [19, 10262.2]
  - - [1856, 1856, 1, 3328]
    - [19, 9300.43]
  - - [1024, 2368, 1, 256]
    - [19, 8316.68]
  - - [4288, 2368, 1, 3328]
    - [19, 10180.2]
  - - [256, 64, 1, 32]
    - [31, 43.9839]
  - - [1, 1024, 1, 1280]
    - [53, 9.53112]
  - - [5056, 128, 1, 32]
    - [24, 1262.77]
  - - [5888, 3584, 1, 256]
    - [19, 9660.69]
  - - [1024, 5056, 1, 32]
    - [22, 2941.67]
  - - [5888, 448, 1, 1280]
    - [19, 8691.35]
  - - [704, 5888, 1, 3328]
    - [19, 9854.19]
  - - [1024, 1408, 1, 256]
    - [19, 7588.38]
  - - [3584, 2944, 1, 1280]
    - [19, 10010.1]
  - - [1, 5056, 1, 256]
    - [52, 28.6865]
  - - [256, 1024, 1, 1]
    - [42, 23.2397]
  - - [32, 32, 1, 3328]
    - [35, 11.6964]
  - - [2368, 1, 1, 3328]
    - [53, 23.3988]
  - - [4288, 1856, 1, 1280]
    - [19, 9912.53]
  - - [3584, 5888, 1, 1]
    - [36, 246.987]
  - - [5888, 4288, 1, 256]
    - [19, 9675.77]
  - - [1024, 2944, 1, 1280]
    - [19, 9313.48]
  - - [6784, 1, 1, 1]
    - [50, 0.695082]
  - - [1408, 64, 1, 1280]
    - [13, 3203.98]
  - - [1, 256, 1, 1280]
    - [53, 2.47043]
  - - [2944, 3584, 1, 256]
    - [19, 9586.64]
  - - [1, 128, 1, 1280]
    - [53, 1.18519]
  - - [1024, 256, 1, 32]
    - [31, 606.113]
  - - [5888, 1, 1, 1280]
    - [52, 38.9934]
  - - [2368, 32, 1, 1280]
    - [35, 798.167]
  - - [5888, 1856, 1, 1]
    - [36, 202.974]
  - - [6784, 128, 1, 1280]
    - [10, 7132.25]
  - - [6784, 2368, 1, 3328]
    - [19, 10011.6]
  - - [1, 64, 1, 256]
    - [52, 0.415416]
  - - [704, 128, 1, 1]
    - [44, 7.76828]
  - - [1408, 4288, 1, 32]
    - [22, 3152.74]
  - - [256, 64, 1, 1280]
    - [11, 680.894]
  - - [256, 448, 1, 256]
    - [1, 2678.84]
  - - [1856, 1024, 1, 1280]
    - [21, 8544.17]
  - - [5888, 1856, 1, 256]
    - [19, 9505.3]
  - - [5056, 1856, 1, 1]
    - [37, 220.074]
  - - [5888, 2368, 1, 256]
    - [19, 9513.2]
  - - [1408, 1024, 1, 32]
    - [26, 1948.37]
  - - [32, 704, 1, 256]
    - [35, 156.377]
  - - [2944, 1, 1, 256]
    - [52, 18.6921]
  - - [32, 4288, 1, 256]
    - [31, 792.583]
  - - [5056, 1856, 1, 32]
    - [22, 3255.49]
  - - [5056, 1856, 1, 1280]
    - [19, 9913.69]
  - - [1, 64, 1, 1]
    - [37, 0.00571429]
  - - [1408, 5888, 1, 3328]
    - [19, 10099.2]
  - - [1408, 704, 1, 3328]
    - [16, 8212.56]
  - - [5056, 704, 1, 3328]
    - [19, 9429.53]
  - - [704, 64, 1, 1280]
    - [13, 1839.02]
  - - [1, 704, 1, 1280]
    - [53, 6.44394]
  - - [5888, 6784, 1, 1]
    - [36, 264.46]
  - - [5888, 4288, 1, 32]
    - [22, 3715.64]
  - - [1408, 3584, 1, 256]
    - [19, 9138.69]
  - - [1856, 704, 1, 1]
    - [39, 92.8]
  - - [6784, 256, 1, 1]
    - [42, 114.257]
  - - [2944, 1, 1, 1]
    - [37, 0.245333]
  - - [256, 1856, 1, 3328]
    - [15, 6954.84]
  - - [4288, 128, 1, 1280]
    - [8, 5669.35]
  - - [6784, 256, 1, 1280]
    - [19, 8618.88]
  - - [128, 4288, 1, 256]
    - [10, 5105.71]
  - - [128, 128, 1, 32]
    - [31, 43.4013]
  - - [128, 1408, 1, 32]
    - [30, 332.21]
  - - [6784, 128, 1, 32]
    - [30, 1516.77]
  - - [1408, 448, 1, 1]
    - [39, 53.6381]
  - - [2368, 704, 1, 3328]
    - [19, 8539.61]
  - - [704, 128, 1, 3328]
    - [13, 3458.17]
  - - [2944, 1856, 1, 32]
    - [22, 2977.69]
  - - [1024, 64, 1, 1]
    - [37, 5.53514]
  - - [1408, 32, 1, 1280]
    - [35, 470.559]
  - - [704, 1, 1, 256]
    - [52, 4.59755]
  - - [2368, 1408, 1, 256]
    - [19, 8965.77]
  - - [2368, 1856, 1, 1]
    - [37, 176.082]
  - - [4288, 1408, 1, 1]
    - [50, 186.343]
  - - [3584, 2368, 1, 1280]
    - [19, 9953.86]
  - - [64, 5056, 1, 1280]
    - [6, 4921.43]
  - - [1408, 2944, 1, 1]
    - [36, 173.874]
  - - [4288, 1408, 1, 32]
    - [22, 3169.29]
  - - [5888, 2944, 1, 256]
    - [19, 9570.34]
  - - [128, 64, 1, 1280]
    - [3, 326.05]
  - - [1408, 2944, 1, 32]
    - [22, 2893.65]
  - - [1, 3584, 1, 1280]
    - [53, 34.0319]
  - - [64, 64, 1, 32]
    - [24, 8.15124]
  - - [448, 1408, 1, 32]
    - [31, 1201.49]
  - - [128, 5056, 1, 256]
    - [19, 5916.96]
  - - [1, 1, 1, 1280]
    - [53, 0.00913242]
  - - [64, 704, 1, 256]
    - [3, 1264.73]
  - - [5888, 6784, 1, 256]
    - [19, 9743.22]
  - - [6784, 5888, 1, 1]
    - [36, 263.763]
  - - [64, 4288, 1, 256]
    - [1, 3769.02]
  - - [1, 448, 1, 1280]
    - [53, 4.15777]
  - - [1024, 1024, 1, 1]
    - [37, 78.4862]
  - - [6784, 5888, 1, 1280]
    - [17, 9977.93]
  - - [1024, 4288, 1, 32]
    - [30, 2828.28]
  - - [1856, 1, 1, 1280]
    - [53, 16.9982]
  - - [3584, 5888, 1, 256]
    - [19, 9822.3]
  - - [5056, 2368, 1, 1]
    - [43, 214.102]
  - - [256, 1408, 1, 1280]
    - [15, 5117.27]
  - - [64, 256, 1, 32]
    - [24, 33.6082]
  - - [64, 5888, 1, 3328]
    - [5, 5661.33]
  - - [6784, 64, 1, 3328]
    - [15, 6344.12]
  - - [5056, 448, 1, 1]
    - [37, 131.081]
  - - [2944, 448, 1, 3328]
    - [19, 7768.19]
  - - [2368, 1024, 1, 1280]
    - [19, 8869.98]
  - - [1856, 6784, 1, 256]
    - [19, 9639.12]
  - - [4288, 32, 1, 1280]
    - [35, 993.869]
  - - [448, 1408, 1, 1280]
    - [19, 6486.21]
  - - [5056, 448, 1, 32]
    - [30, 2305.43]
  - - [3584, 2944, 1, 32]
    - [22, 3493.81]
  - - [2368, 128, 1, 1]
    - [44, 25.9507]
  - - [32, 128, 1, 1280]
    - [35, 42.4729]
  - - [3584, 1856, 1, 32]
    - [22, 3133.99]
  - - [128, 128, 1, 3328]
    - [11, 732.876]
  - - [5056, 64, 1, 256]
    - [5, 4013.44]
  - - [64, 448, 1, 3328]
    - [11, 1295.07]
  - - [4288, 1408, 1, 1280]
    - [19, 9645.54]
  - - [6784, 2368, 1, 1]
    - [46, 233.768]
  - - [32, 5056, 1, 256]
    - [35, 960.546]
  - - [704, 128, 1, 256]
    - [7, 2135.99]
  - - [704, 5056, 1, 1]
    - [42, 163.576]
  - - [256, 1024, 1, 32]
    - [33, 548.993]
  - - [256, 1024, 1, 1280]
    - [15, 5809.29]
  - - [2368, 128, 1, 256]
    - [10, 3759.43]
  - - [32, 64, 1, 256]
    - [31, 14.2161]
  - - [2368, 1408, 1, 1280]
    - [19, 9536.34]
  - - [128, 256, 1, 32]
    - [24, 66.198]
  - - [64, 6784, 1, 32]
    - [31, 909.269]
  - - [6784, 32, 1, 256]
    - [35, 1265.36]
  - - [256, 4288, 1, 1]
    - [38, 82.1653]
  - - [5888, 1408, 1, 1]
    - [41, 189.449]
  - - [1024, 4288, 1, 1280]
    - [19, 9769.79]
  - - [1856, 4288, 1, 1]
    - [37, 211.663]
  - - [128, 2944, 1, 256]
    - [10, 4567.66]
  - - [3584, 4288, 1, 256]
    - [19, 9736.33]
  - - [2368, 2944, 1, 256]
    - [19, 9448.71]
  - - [3584, 128, 1, 32]
    - [26, 950.781]
  - - [3584, 128, 1, 3328]
    - [15, 6696.17]
  - - [704, 5056, 1, 256]
    - [19, 8891.61]
  - - [1856, 4288, 1, 32]
    - [22, 3292.05]
  - - [64, 256, 1, 1280]
    - [11, 684.449]
  - - [4288, 1024, 1, 1280]
    - [19, 9752.16]
  - - [1, 4288, 1, 256]
    - [52, 24.1577]
  - - [64, 2368, 1, 1]
    - [44, 12.3817]
  - - [4288, 6784, 1, 32]
    - [22, 3693.94]
  - - [704, 704, 1, 3328]
    - [19, 7109.53]
  - - [128, 2944, 1, 1]
    - [50, 36.2338]
  - - [3584, 1408, 1, 256]
    - [21, 9087.27]
  - - [704, 3584, 1, 3328]
    - [19, 9327.51]
  - - [5056, 448, 1, 1280]
    - [19, 8939.67]
  - - [1408, 2944, 1, 1280]
    - [19, 9760.48]
  - - [5888, 704, 1, 1280]
    - [19, 9570.33]
  - - [64, 64, 1, 256]
    - [3, 104.025]
  - - [704, 1408, 1, 1280]
    - [9, 8067.0]
  - - [4288, 5888, 1, 256]
    - [19, 9808.52]
  - - [6784, 64, 1, 32]
    - [27, 918.891]
  - - [3584, 3584, 1, 3328]
    - [19, 10292.5]
  - - [2944, 6784, 1, 32]
    - [22, 3654.55]
  - - [448, 64, 1, 32]
    - [24, 56.7762]
  - - [5056, 256, 1, 1]
    - [38, 94.0651]
  - - [64, 6784, 1, 1280]
    - [15, 6109.78]
  - - [2944, 2368, 1, 3328]
    - [19, 10014.8]
  - - [1, 4288, 1, 1]
    - [50, 0.397037]
  - - [1408, 128, 1, 256]
    - [8, 3134.33]
  - - [1024, 1856, 1, 1280]
    - [21, 8548.98]
  - - [448, 5888, 1, 256]
    - [19, 8235.16]
  - - [1024, 5888, 1, 256]
    - [19, 9467.03]
  - - [704, 1408, 1, 256]
    - [19, 7111.98]
  - - [6784, 2944, 1, 3328]
    - [19, 10044.1]
  - - [1408, 2368, 1, 256]
    - [19, 8905.89]
  - - [64, 128, 1, 1280]
    - [3, 327.675]
  - - [5888, 32, 1, 3328]
    - [35, 1415.33]
  - - [1408, 5056, 1, 256]
    - [19, 9366.9]
  - - [1024, 1408, 1, 32]
    - [30, 1884.7]
  - - [4288, 128, 1, 32]
    - [24, 1081.51]
  - - [6784, 704, 1, 1]
    - [37, 180.907]
  - - [448, 704, 1, 256]
    - [19, 3866.87]
  - - [704, 3584, 1, 32]
    - [22, 2449.65]
  - - [1856, 256, 1, 3328]
    - [15, 6964.64]
  - - [448, 1024, 1, 1280]
    - [19, 6393.76]
  - - [4288, 4288, 1, 1]
    - [37, 239.164]
  - - [5056, 2944, 1, 1]
    - [37, 238.539]
  - - [64, 2368, 1, 3328]
    - [11, 4306.4]
  - - [256, 704, 1, 3328]
    - [15, 4235.77]
  - - [1, 2944, 1, 1]
    - [42, 0.242105]
  - - [1024, 1024, 1, 256]
    - [19, 7557.3]
  - - [3584, 1, 1, 1]
    - [37, 0.367213]
  - - [256, 2944, 1, 32]
    - [30, 1328.04]
  - - [6784, 4288, 1, 3328]
    - [18, 10071.9]
  - - [5056, 2944, 1, 3328]
    - [18, 9797.94]
  - - [704, 1024, 1, 1280]
    - [19, 7398.55]
  - - [256, 3584, 1, 1280]
    - [19, 7444.25]
  - - [2368, 1856, 1, 3328]
    - [19, 9854.59]
  - - [1856, 4288, 1, 1280]
    - [19, 9934.97]
  - - [1, 1024, 1, 256]
    - [52, 6.68735]
  - - [3584, 448, 1, 1]
    - [48, 104.533]
  - - [2944, 1024, 1, 3328]
    - [19, 9404.55]
  - - [32, 1408, 1, 3328]
    - [35, 506.576]
  - - [128, 1, 1, 3328]
    - [53, 1.27114]
  - - [5888, 5056, 1, 32]
    - [22, 3705.01]
  - - [704, 2944, 1, 1]
    - [44, 123.958]
  - - [3584, 448, 1, 32]
    - [30, 2013.33]
  - - [3584, 448, 1, 1280]
    - [19, 8093.92]
  - - [2944, 6784, 1, 3328]
    - [19, 10252.2]
  - - [1856, 2368, 1, 1280]
    - [19, 9769.4]
  - - [6784, 1024, 1, 1280]
    - [19, 9720.91]
  - - [6784, 3584, 1, 1280]
    - [19, 10084.8]
  - - [1, 5056, 1, 3328]
    - [52, 34.1666]
  - - [128, 128, 1, 1]
    - [52, 1.8789]
  - - [128, 2368, 1, 32]
    - [31, 688.873]
  - - [128, 1408, 1, 3328]
    - [11, 4691.69]
  - - [2944, 32, 1, 3328]
    - [35, 1055.5]
  - - [704, 1856, 1, 256]
    - [19, 7844.65]
  - - [1408, 1408, 1, 1]
    - [37, 119.714]
  - - [1408, 4288, 1, 256]
    - [19, 9204.39]
  - - [256, 5056, 1, 3328]
    - [19, 8876.42]
  - - [2368, 64, 1, 1280]
    - [13, 4054.9]
  - - [1856, 448, 1, 32]
    - [30, 1433.6]
  - - [1408, 448, 1, 256]
    - [19, 5718.16]
  - - [32, 128, 1, 256]
    - [31, 26.859]
  - - [448, 1024, 1, 1]
    - [42, 39.0095]
  - - [128, 1024, 1, 1280]
    - [11, 4378.19]
  - - [448, 6784, 1, 1]
    - [37, 153.187]
  - - [704, 2944, 1, 256]
    - [19, 8427.25]
  - - [1408, 1408, 1, 256]
    - [21, 8303.51]
  - - [448, 6784, 1, 32]
    - [30, 2475.95]
  - - [1, 64, 1, 1280]
    - [53, 0.584141]
  - - [1408, 1856, 1, 1]
    - [42, 140.8]
  - - [4288, 448, 1, 32]
    - [30, 2134.47]
  - - [4288, 448, 1, 1280]
    - [19, 8561.67]
  - - [2944, 704, 1, 32]
    - [26, 2240.62]
  - - [1024, 704, 1, 256]
    - [19, 6372.56]
  - - [448, 4288, 1, 1]
    - [37, 120.064]
  - - [3584, 5056, 1, 1]
    - [37, 244.346]
  - - [1408, 3584, 1, 1280]
    - [19, 9607.37]
  - - [6784, 448, 1, 1280]
    - [19, 9201.07]
  - - [3584, 5056, 1, 3328]
    - [19, 10224.4]
  - - [2368, 2368, 1, 32]
    - [22, 3115.24]
  - - [64, 5888, 1, 32]
    - [31, 823.677]
  - - [1856, 448, 1, 256]
    - [19, 6173.46]
  - - [128, 1024, 1, 256]
    - [11, 2853.27]
  - - [3584, 64, 1, 3328]
    - [15, 5369.75]
  - - [5888, 2944, 1, 32]
    - [22, 3628.31]
  - - [2944, 1, 1, 1280]
    - [53, 27.1024]
  - - [1856, 2944, 1, 32]
    - [22, 3069.7]
  - - [5056, 1408, 1, 1]
    - [42, 204.095]
  - - [5888, 1408, 1, 3328]
    - [19, 9895.17]
  - - [448, 4288, 1, 256]
    - [19, 7911.55]
  - - [6784, 1024, 1, 1]
    - [43, 205.284]
  - - [256, 448, 1, 1]
    - [44, 9.49404]
  - - [128, 5888, 1, 3328]
    - [19, 7903.31]
  - - [6784, 1024, 1, 32]
    - [22, 3246.18]
  - - [256, 448, 1, 32]
    - [26, 224.878]
  - - [6784, 3584, 1, 1]
    - [42, 252.638]
  - - [2944, 2368, 1, 32]
    - [22, 3150.91]
  - - [3584, 6784, 1, 3328]
    - [19, 10349.4]
  - - [448, 128, 1, 1280]
    - [13, 2328.69]
  - - [64, 3584, 1, 32]
    - [24, 397.188]
  - - [64, 3584, 1, 1280]
    - [15, 5111.44]
  - - [6784, 1408, 1, 256]
    - [19, 9410.71]
  - - [5056, 1024, 1, 32]
    - [26, 2962.71]
  - - [1024, 5056, 1, 1280]
    - [19, 9865.13]
  - - [4288, 3584, 1, 256]
    - [19, 9765.33]
  - - [2368, 256, 1, 3328]
    - [19, 6361.82]
  - - [448, 6784, 1, 1280]
    - [19, 9369.5]
  - - [1856, 5888, 1, 1]
    - [42, 226.162]
  - - [256, 5888, 1, 32]
    - [22, 1976.82]
  - - [3584, 1, 1, 3328]
    - [53, 35.6259]
  - - [4288, 32, 1, 256]
    - [35, 831.612]
  - - [256, 64, 1, 1]
    - [44, 1.86182]
  - - [4288, 5056, 1, 32]
    - [22, 3676.16]
  - - [4288, 5056, 1, 3328]
    - [19, 10318.7]
  - - [1856, 5888, 1, 32]
    - [22, 3458.27]
  - - [1856, 5888, 1, 1280]
    - [19, 10133.3]
  - - [256, 256, 1, 1280]
    - [11, 2595.49]
  - - [704, 2368, 1, 1280]
    - [19, 8419.56]
  - - [4288, 2368, 1, 1280]
    - [19, 10112.3]
  - - [2944, 5056, 1, 256]
    - [19, 9790.66]
  - - [32, 1856, 1, 256]
    - [31, 391.058]
  - - [64, 5888, 1, 1280]
    - [10, 5506.22]
  - - [1, 1856, 1, 1280]
    - [53, 16.9691]
  - - [2944, 4288, 1, 1]
    - [43, 232.741]
  - - [5056, 5888, 1, 32]
    - [22, 3723.54]
  - - [704, 1, 1, 3328]
    - [53, 6.99459]
  - - [448, 256, 1, 1280]
    - [13, 3791.34]
  - - [1408, 256, 1, 1]
    - [44, 32.4144]
  - - [2368, 5056, 1, 3328]
    - [19, 10218.7]
  - - [1024, 5056, 1, 3328]
    - [19, 9952.29]
  - - [704, 704, 1, 1280]
    - [19, 6895.53]
  - - [128, 32, 1, 3328]
    - [35, 46.5556]
  - - [1024, 6784, 1, 32]
    - [22, 3104.72]
  - - [3584, 2944, 1, 3328]
    - [19, 10082.8]
  - - [128, 1856, 1, 256]
    - [4, 4131.62]
  - - [32, 32, 1, 1280]
    - [35, 10.8288]
  - - [1408, 5888, 1, 1]
    - [41, 198.143]
  - - [1, 3584, 1, 256]
    - [53, 26.244]
  - - [704, 4288, 1, 32]
    - [22, 2630.72]
  - - [1408, 5888, 1, 32]
    - [22, 3376.91]
  - - [6784, 1024, 1, 3328]
    - [19, 9789.87]
  - - [1856, 1, 1, 3328]
    - [53, 18.4579]
  - - [5056, 1408, 1, 256]
    - [19, 9200.45]
  - - [1, 1, 1, 256]
    - [52, 0.00650406]
  - - [2944, 1408, 1, 256]
    - [19, 9185.93]
  - - [4288, 1, 1, 1]
    - [44, 0.4288]
  - - [2368, 2368, 1, 256]
    - [19, 9263.68]
  - - [1, 448, 1, 256]
    - [52, 2.90791]
  - - [1408, 6784, 1, 1]
    - [36, 209.104]
  - - [3584, 32, 1, 3328]
    - [35, 1332.32]
  - - [128, 3584, 1, 1]
    - [44, 42.1647]
  - - [1856, 1, 1, 256]
    - [52, 12.1207]
  - - [6784, 6784, 1, 1280]
    - [19, 10129.9]
  - - [1024, 5888, 1, 1]
    - [36, 168.983]
  - - [6784, 32, 1, 3328]
    - [35, 1615.83]
  - - [1408, 32, 1, 256]
    - [31, 316.182]
  - - [128, 3584, 1, 32]
    - [30, 945.88]
  - - [1856, 3584, 1, 256]
    - [19, 9368.88]
  - - [2944, 64, 1, 256]
    - [4, 3276.8]
  - - [2368, 704, 1, 32]
    - [26, 2014.59]
  - - [256, 5888, 1, 1280]
    - [19, 8719.18]
  - - [448, 2368, 1, 32]
    - [30, 1478.56]
  - - [448, 2368, 1, 3328]
    - [19, 7299.36]
  - - [64, 1408, 1, 256]
    - [3, 2235.34]
  - - [5056, 32, 1, 32]
    - [24, 399.486]
  - - [1024, 704, 1, 3328]
    - [19, 7553.97]
  - - [32, 5888, 1, 3328]
    - [35, 1408.97]
  - - [256, 64, 1, 3328]
    - [11, 738.434]
  - - [32, 1408, 1, 1280]
    - [35, 477.099]
  - - [64, 32, 1, 256]
    - [31, 14.3092]
  - - [1856, 1024, 1, 3328]
    - [21, 8677.71]
  - - [2368, 1, 1, 1]
    - [42, 0.208451]
  - - [5056, 2368, 1, 3328]
    - [19, 10011.7]
  - - [128, 1, 1, 1280]
    - [53, 1.17029]
  - - [704, 4288, 1, 1280]
    - [19, 9320.73]
  - - [704, 256, 1, 256]
    - [8, 3019.46]
  - - [512, 128, 1, 784]
    - [54, 2335.46]
  - - [1024, 256, 1, 196]
    - [58, 6422.53]
  - - [256, 64, 1, 3136]
    - [56, 699.622]
  - - [256, 1024, 1, 196]
    - [55, 6553.6]
  - - [64, 256, 1, 3136]
    - [59, 745.938]
  - - [128, 512, 1, 784]
    - [57, 2343.99]
  - - [64, 64, 1, 3136]
    - [58, 173.394]
  - - [2560, 7000, 1, 2560]
    - [73, 16137.8]
  - - [7680, 12000, 1, 2560]
    - [73, 17417.3]
  - - [5124, 9124, 1, 1760]
    - [70, 16765.5]
  - - [1760, 32, 1, 1760]
    - [60, 2058.21]
  - - [512, 24000, 1, 1536]
    - [73, 15627.6]
  - - [3072, 24000, 1, 1024]
    - [73, 15979.2]
  - - [2048, 400, 1, 512]
    - [74, 8566.8]
  - - [2560, 128, 1, 2560]
    - [64, 6425.1]
  - - [3072, 16, 1, 1024]
    - [65, 1388.84]
  - - [512, 48000, 1, 2816]
    - [73, 17041.1]
  - - [512, 48000, 1, 2048]
    - [74, 13666.4]
  - - [1760, 64, 1, 1760]
    - [60, 3977.66]
  - - [2048, 1600, 1, 2048]
    - [74, 8132.44]
  - - [512, 48000, 1, 1536]
    - [73, 16411.9]
  - - [2560, 32, 1, 2560]
    - [60, 2919.2]
  - - [8448, 5984, 1, 2816]
    - [73, 17042.5]
  - - [4096, 3200, 1, 1024]
    - [74, 13560.6]
  - - [1024, 24000, 1, 2560]
    - [73, 16564.8]
  - - [1760, 6400, 1, 1760]
    - [70, 16926.8]
  - - [5124, 9124, 1, 2048]
    - [74, 13714.0]
  - - [1024, 700, 1, 512]
    - [69, 7304.97]
  - - [4608, 32, 1, 1536]
    - [60, 4437.55]
  - - [3072, 64, 1, 1024]
    - [65, 4026.53]
  - - [16384, 3200, 1, 4096]
    - [74, 14198.9]
  - - [2560, 16, 1, 2560]
    - [64, 1508.31]
  - - [1024, 48000, 1, 2560]
    - [73, 17206.1]
  - - [8448, 48000, 1, 2816]
    - [73, 15639.3]
  - - [2048, 32, 1, 2048]
    - [62, 1622.55]
  - - [2560, 3200, 1, 2560]
    - [73, 15546.4]
  - - [16384, 800, 1, 4096]
    - [74, 11602.3]
  - - [4608, 24000, 1, 1536]
    - [73, 17258.8]
  - - [7680, 48000, 1, 2560]
    - [73, 16396.9]
  - - [3072, 48000, 1, 1024]
    - [73, 16635.3]
  - - [1760, 16, 1, 1760]
    - [62, 980.253]
  - - [8192, 3200, 1, 2048]
    - [74, 13580.9]
  - - [512, 24000, 1, 2816]
    - [73, 16863.1]
  - - [4096, 400, 1, 1024]
    - [101, 8871.2]
  - - [6144, 48000, 1, 2560]
    - [73, 17453.5]
  - - [4608, 48000, 1, 1536]
    - [73, 17440.2]
  - - [4096, 128, 1, 4096]
    - [65, 4579.25]
  - - [2048, 800, 1, 512]
    - [73, 10402.5]
  - - [4608, 5984, 1, 1536]
    - [73, 16367.1]
  - - [4096, 1600, 1, 1024]
    - [74, 12198.1]
  - - [6144, 5984, 1, 2048]
    - [74, 13951.2]
  - - [7680, 24000, 1, 2560]
    - [73, 17331.0]
  - - [6144, 48000, 1, 2048]
    - [74, 14769.8]
  - - [2048, 3200, 1, 2048]
    - [74, 11336.0]
  - - [5124, 9124, 1, 2560]
    - [73, 16462.5]
  - - [1024, 24000, 1, 1536]
    - [73, 16343.1]
  - - [7680, 16, 1, 2560]
    - [62, 2919.2]
  - - [2560, 6400, 1, 2560]
    - [73, 16353.8]
  - - [2048, 128, 1, 2048]
    - [62, 3513.55]
  - - [512, 16, 1, 500000]
    - [62, 307.342]
  - - [1024, 8, 1, 500000]
    - [60, 308.821]
  - - [512, 24000, 1, 2560]
    - [73, 16086.4]
  - - [1024, 24000, 1, 2816]
    - [73, 17012.3]
  - - [7680, 5984, 1, 2560]
    - [73, 17049.2]
  - - [2048, 1600, 1, 512]
    - [74, 10506.8]
  - - [2048, 7000, 1, 2048]
    - [74, 12810.7]
  - - [1760, 800, 1, 1760]
    - [67, 11553.9]
  - - [4096, 64, 1, 4096]
    - [62, 3569.62]
  - - [7680, 32, 1, 2560]
    - [62, 5765.63]
  - - [2560, 64, 1, 2560]
    - [64, 5253.39]
  - - [3072, 128, 1, 1024]
    - [65, 5130.65]
  - - [7680, 64, 1, 2560]
    - [69, 6667.5]
  - - [1760, 128, 1, 1760]
    - [60, 6931.69]
  - - [2560, 1600, 1, 2560]
    - [73, 12198.4]
  - - [2048, 3200, 1, 512]
    - [74, 12372.6]
  - - [2560, 800, 1, 2560]
    - [73, 10495.8]
  - - [3072, 32, 1, 1024]
    - [62, 2677.22]
  - - [6144, 32, 1, 2560]
    - [60, 5354.43]
  - - [4608, 12000, 1, 1536]
    - [73, 16965.2]
  - - [4096, 32, 1, 4096]
    - [66, 2331.79]
  - - [6144, 24000, 1, 2048]
    - [74, 14617.2]
  - - [8192, 800, 1, 2048]
    - [74, 10239.4]
  - - [5124, 9124, 1, 4096]
    - [74, 13825.1]
  - - [8448, 24000, 1, 2816]
    - [73, 17284.5]
  - - [1024, 48000, 1, 1536]
    - [73, 16922.2]
  - - [7680, 128, 1, 2560]
    - [69, 11685.5]
  - - [8192, 1600, 1, 2048]
    - [74, 12203.4]
  - - [4096, 800, 1, 1024]
    - [104, 9312.37]
  - - [1024, 16, 1, 500000]
    - [62, 614.679]
  - - [2048, 800, 1, 2048]
    - [72, 7507.26]
  - - [1760, 3200, 1, 1760]
    - [70, 15165.7]
  - - [512, 48000, 1, 2560]
    - [73, 16707.7]
  - - [8448, 16, 1, 2816]
    - [61, 3408.25]
  - - [2048, 64, 1, 2048]
    - [62, 2897.62]
  - - [512, 24000, 1, 2048]
    - [74, 12518.3]
  - - [16384, 1600, 1, 4096]
    - [74, 13160.1]
  - - [4608, 16, 1, 1536]
    - [60, 2250.52]
  - - [1024, 24000, 1, 2048]
    - [74, 13613.5]
  - - [8192, 400, 1, 2048]
    - [74, 8130.86]
  - - [2048, 6400, 1, 2048]
    - [74, 12671.6]
  - - [6144, 12000, 1, 2048]
    - [74, 14419.8]
  - - [512, 8, 1, 500000]
    - [60, 154.817]
  - - [1760, 7000, 1, 1760]
    - [70, 15775.6]
  - - [1024, 48000, 1, 2816]
    - [73, 17431.7]
  - - [6144, 16, 1, 2560]
    - [64, 2774.01]
  - - [8448, 32, 1, 2816]
    - [64, 6068.77]
  - - [4096, 7000, 1, 4096]
    - [74, 13834.0]
  - - [4096, 16, 1, 4096]
    - [63, 1181.49]
  - - [6144, 24000, 1, 2560]
    - [73, 17224.4]
  - - [1024, 1024, 1, 1024]
    - [74, 10502.2]
  - - [2048, 16, 1, 2048]
    - [65, 858.609]
  - - [8448, 12000, 1, 2816]
    - [73, 17285.6]
  - - [16384, 400, 1, 4096]
    - [74, 9542.53]
  - - [1760, 1600, 1, 1760]
    - [68, 14824.6]
  - - [1024, 48000, 1, 2048]
    - [74, 14216.2]
  - - [512, 512, 64, 64]
    - [82, 12135.4]
  - - [512, 512, 256, 64]
    - [83, 12755.3]
  - - [512, 512, 128, 64]
    - [84, 12596.7]
  - - [512, 512, 40, 64]
    - [84, 12035.3]
  - - [1024, 1024, 64, 96]
    - [83, 13355.0]
  - - [1024, 1024, 128, 96]
    - [83, 13489.2]
  - - [1024, 1024, 256, 64]
    - [83, 12996.2]
  - - [1024, 1024, 32, 64]
    - [82, 12608.5]
  - - [1024, 1024, 64, 64]
    - [83, 12734.1]
  - - [64, 512, 64, 512]
    - [85, 10222.2]
  - - [64, 512, 256, 512]
    - [84, 12644.2]
  - - [64, 512, 128, 512]
    - [84, 11101.5]
  - - [64, 512, 40, 512]
    - [85, 9372.75]
  - - [96, 1024, 64, 1024]
    - [86, 10856.1]
  - - [96, 1024, 128, 1024]
    - [87, 12126.3]
  - - [64, 1024, 256, 1024]
    - [84, 12270.6]
  - - [64, 1024, 32, 1024]
    - [85, 9953.11]
  - - [64, 1024, 64, 1024]
    - [85, 10841.5]
  - - [1024, 26656, 1, 4096]
    - [88, 12270.4]
  - - [1024, 33792, 1, 1024]
    - [88, 12692.2]
  - - [1024, 26624, 1, 4096]
    - [88, 12244.1]
  - - [1024, 26624, 1, 1024]
    - [88, 12625.8]
  - - [33712, 484, 1, 1024]
    - [89, 11765.7]
  - - [4096, 484, 1, 1024]
    - [89, 10516.2]
  - - [4096, 23040, 1, 1024]
    - [88, 12705.7]
  - - [1024, 23040, 1, 1024]
    - [90, 12296.5]
  - - [1024, 20480, 1, 4096]
    - [91, 11822.5]
  - - [33712, 316, 1, 1024]
    - [89, 11363.2]
  - - [1024, 316, 1, 1024]
    - [92, 5493.2]
  - - [33712, 428, 1, 1024]
    - [88, 10985.5]
  - - [1024, 18944, 1, 4096]
    - [88, 11308.3]
  - - [4096, 18944, 1, 1024]
    - [88, 11200.6]
  - - [1024, 17408, 1, 4096]
    - [88, 10645.7]
  - - [33712, 248, 1, 1024]
    - [89, 11109.2]
  - - [33712, 288, 1, 1024]
    - [89, 9646.49]
  - - [4096, 288, 1, 1024]
    - [93, 8728.03]
  - - [1024, 16384, 1, 4096]
    - [88, 10614.9]
  - - [4096, 16384, 1, 1024]
    - [94, 10043.9]
  - - [1024, 16384, 1, 1024]
    - [95, 11275.2]
  - - [33712, 256, 1, 1024]
    - [89, 11477.1]
  - - [4096, 256, 1, 1024]
    - [96, 9250.02]
  - - [33712, 368, 1, 1024]
    - [90, 10607.7]
  - - [4096, 368, 1, 1024]
    - [89, 8659.69]
  - - [1024, 368, 1, 1024]
    - [97, 6144.52]
  - - [1024, 444, 1, 1024]
    - [88, 7441.94]
  - - [33712, 480, 1, 1024]
    - [98, 10489.5]
  - - [4096, 480, 1, 1024]
    - [89, 9746.64]
  - - [1024, 480, 1, 1024]
    - [99, 7884.03]
  - - [1024, 15360, 1, 4096]
    - [100, 10824.6]
  - - [4096, 15360, 1, 1024]
    - [98, 9902.79]
  - - [1024, 15360, 1, 1024]
    - [95, 11504.4]
  - - [1024, 288, 1, 1024]
    - [96, 4993.22]
  - - [4096, 308, 1, 1024]
    - [89, 9504.46]
  - - [33712, 404, 1, 1024]
    - [90, 10271.7]
  - - [4096, 404, 1, 1024]
    - [101, 8774.33]
  - - [1024, 404, 1, 1024]
    - [89, 6754.22]
  - - [1024, 14336, 1, 4096]
    - [102, 10174.2]
  - - [4096, 14336, 1, 1024]
    - [103, 10802.7]
  - - [1024, 14336, 1, 1024]
    - [91, 11145.6]
  - - [33712, 252, 1, 1024]
    - [104, 10332.7]
  - - [33712, 324, 1, 1024]
    - [105, 8975.42]
  - - [4096, 304, 1, 1024]
    - [106, 8366.59]
  - - [4096, 324, 1, 1024]
    - [93, 8917.02]
  - - [33712, 384, 1, 1024]
    - [103, 10598.8]
  - - [4096, 384, 1, 1024]
    - [89, 9758.92]
  - - [1024, 12800, 1, 4096]
    - [107, 10327.0]
  - - [4096, 12800, 1, 1024]
    - [103, 10806.7]
  - - [1024, 12800, 1, 1024]
    - [108, 10481.8]
  - - [4096, 276, 1, 1024]
    - [93, 8354.71]
  - - [1024, 276, 1, 1024]
    - [96, 4772.54]
  - - [33712, 344, 1, 1024]
    - [109, 9772.89]
  - - [1024, 344, 1, 1024]
    - [96, 5948.39]
  - - [1024, 372, 1, 1024]
    - [92, 6315.9]
  - - [33712, 464, 1, 1024]
    - [95, 10143.0]
  - - [4096, 464, 1, 1024]
    - [88, 9425.4]
  - - [1024, 464, 1, 1024]
    - [99, 7649.99]
  - - [1024, 11776, 1, 4096]
    - [110, 10587.5]
  - - [33712, 244, 1, 1024]
    - [104, 10785.6]
  - - [33712, 340, 1, 1024]
    - [91, 9576.03]
  - - [33712, 436, 1, 1024]
    - [90, 10224.4]
  - - [1024, 436, 1, 1024]
    - [96, 7233.85]
  - - [4096, 460, 1, 1024]
    - [89, 9362.26]
  - - [1024, 11264, 1, 4096]
    - [95, 10918.2]
  - - [4096, 336, 1, 1024]
    - [93, 9918.96]
  - - [33712, 416, 1, 1024]
    - [90, 10526.6]
  - - [1024, 416, 1, 1024]
    - [99, 6910.77]
  - - [4096, 440, 1, 1024]
    - [111, 10252.7]
  - - [4096, 10752, 1, 1024]
    - [112, 11308.6]
  - - [1024, 10752, 1, 1024]
    - [91, 10729.2]
  - - [33712, 440, 1, 1024]
    - [90, 11080.6]
  - - [33712, 216, 1, 1024]
    - [113, 8854.06]
  - - [33712, 272, 1, 1024]
    - [89, 9116.23]
  - - [4096, 272, 1, 1024]
    - [96, 8038.69]
  - - [1024, 272, 1, 1024]
    - [92, 4734.61]
  - - [33712, 312, 1, 1024]
    - [108, 10840.8]
  - - [4096, 312, 1, 1024]
    - [106, 8600.31]
  - - [1024, 312, 1, 1024]
    - [92, 5409.32]
  - - [33712, 356, 1, 1024]
    - [114, 10278.2]
  - - [1024, 356, 1, 1024]
    - [92, 5966.96]
  - - [33712, 396, 1, 1024]
    - [90, 9986.5]
  - - [4096, 232, 1, 1024]
    - [115, 8382.83]
  - - [33712, 268, 1, 1024]
    - [105, 9672.58]
  - - [4096, 268, 1, 1024]
    - [93, 7586.89]
  - - [1024, 268, 1, 1024]
    - [92, 4664.98]
  - - [1024, 360, 1, 1024]
    - [88, 6144.0]
  - - [33712, 400, 1, 1024]
    - [90, 10082.1]
  - - [1024, 400, 1, 1024]
    - [99, 6636.56]
  - - [1024, 296, 1, 1024]
    - [96, 5152.37]
  - - [33712, 328, 1, 1024]
    - [114, 9574.9]
  - - [4096, 328, 1, 1024]
    - [93, 9017.64]
  - - [1024, 380, 1, 1024]
    - [92, 6361.09]
  - - [4096, 432, 1, 1024]
    - [89, 9750.0]
  - - [33712, 280, 1, 1024]
    - [105, 9469.67]
  - - [4096, 280, 1, 1024]
    - [89, 8137.51]
  - - [1024, 280, 1, 1024]
    - [92, 4867.4]
  - - [33712, 320, 1, 1024]
    - [114, 11159.2]
  - - [4096, 320, 1, 1024]
    - [93, 8830.11]
  - - [4096, 448, 1, 1024]
    - [89, 10128.5]
  - - [4096, 492, 1, 1024]
    - [89, 9994.15]
  - - [1024, 492, 1, 1024]
    - [105, 6889.68]
  - - [33712, 212, 1, 1024]
    - [116, 9413.53]
  - - [4096, 212, 1, 1024]
    - [96, 9140.55]
  - - [33712, 392, 1, 1024]
    - [95, 9883.89]
  - - [4096, 392, 1, 1024]
    - [111, 8527.84]
  - - [33712, 456, 1, 1024]
    - [95, 9533.88]
  - - [4096, 456, 1, 1024]
    - [89, 8602.91]
  - - [1024, 456, 1, 1024]
    - [105, 7518.09]
  - - [33712, 468, 1, 1024]
    - [95, 10030.7]
  - - [4096, 468, 1, 1024]
    - [89, 8797.64]
  - - [4096, 488, 1, 1024]
    - [89, 10576.8]
  - - [1024, 488, 1, 1024]
    - [92, 6775.76]
  - - [33712, 236, 1, 1024]
    - [104, 10442.7]
  - - [4096, 236, 1, 1024]
    - [115, 8527.36]
  - - [4096, 260, 1, 1024]
    - [93, 7861.3]
  - - [1024, 260, 1, 1024]
    - [96, 4531.74]
  - - [4096, 372, 1, 1024]
    - [89, 10115.9]
  - - [4096, 364, 1, 1024]
    - [89, 9237.21]
  - - [1024, 364, 1, 1024]
    - [92, 6220.37]
  - - [33712, 472, 1, 1024]
    - [90, 10343.5]
  - - [4096, 472, 1, 1024]
    - [89, 9610.23]
  - - [4096, 240, 1, 1024]
    - [89, 8665.92]
  - - [33712, 292, 1, 1024]
    - [114, 9510.28]
  - - [4096, 292, 1, 1024]
    - [117, 8057.48]
  - - [1024, 292, 1, 1024]
    - [92, 5076.0]
  - - [33712, 348, 1, 1024]
    - [91, 9836.65]
  - - [4096, 348, 1, 1024]
    - [89, 8222.27]
  - - [1024, 348, 1, 1024]
    - [96, 6025.5]
  - - [33712, 408, 1, 1024]
    - [90, 10286.7]
  - - [4096, 408, 1, 1024]
    - [101, 8898.07]
  - - [1024, 408, 1, 1024]
    - [88, 6927.12]
  - - [33712, 208, 1, 1024]
    - [116, 9234.97]
  - - [4096, 208, 1, 1024]
    - [96, 8493.14]
  - - [33712, 264, 1, 1024]
    - [118, 9143.53]
  - - [1024, 264, 1, 1024]
    - [96, 4589.26]
  - - [1024, 2912, 1, 4096]
    - [95, 9554.56]
  - - [33712, 7424, 1, 1024]
    - [95, 11322.4]
  - - [4096, 7424, 1, 1024]
    - [95, 11502.8]
  - - [1024, 9960, 1, 4096]
    - [88, 11086.8]
  - - [1024, 7904, 1, 1024]
    - [88, 11409.6]
  - - [1024, 5840, 1, 1024]
    - [111, 10756.9]
  - - [1024, 8208, 1, 4096]
    - [100, 10560.6]
  - - [1024, 8208, 1, 1024]
    - [88, 11513.7]
  - - [4096, 7072, 1, 1024]
    - [95, 11510.5]
  - - [1024, 8320, 1, 1024]
    - [88, 11358.4]
  - - [1024, 7448, 1, 4096]
    - [110, 10285.5]
  - - [1024, 9512, 1, 1024]
    - [89, 11428.7]
  - - [33712, 8192, 1, 1024]
    - [102, 10958.2]
  - - [4096, 8432, 1, 1024]
    - [114, 11422.0]
  - - [1024, 1344, 1, 1024]
    - [88, 10485.8]
  - - [1024, 468, 1, 1024]
    - [96, 7745.16]
  - - [4096, 3240, 1, 1024]
    - [91, 10743.7]
  - - [4096, 9960, 1, 1024]
    - [88, 11813.2]
  - - [1024, 9960, 1, 1024]
    - [119, 11038.1]
  - - [4096, 8288, 1, 1024]
    - [88, 11792.8]
  - - [33712, 4368, 1, 1024]
    - [120, 10725.3]
  - - [4096, 9968, 1, 1024]
    - [104, 11577.0]
  - - [4096, 9200, 1, 1024]
    - [119, 11869.0]
  - - [1024, 7200, 1, 1024]
    - [88, 11366.0]
  - - [1024, 7752, 1, 4096]
    - [108, 10703.9]
  - - [4096, 7752, 1, 1024]
    - [95, 11479.7]
  - - [4096, 9048, 1, 1024]
    - [119, 11845.4]
  - - [4096, 8320, 1, 1024]
    - [89, 11786.8]
  - - [1024, 6800, 1, 4096]
    - [95, 10721.9]
  - - [33712, 4896, 1, 1024]
    - [92, 10397.1]
  - - [33712, 7616, 1, 1024]
    - [112, 10938.2]
  - - [1024, 9144, 1, 1024]
    - [88, 12355.8]
  - - [33712, 4488, 1, 1024]
    - [121, 10391.7]
  - - [33712, 6400, 1, 1024]
    - [119, 11655.3]
  - - [4096, 7840, 1, 1024]
    - [90, 11446.1]
  - - [1024, 7840, 1, 1024]
    - [88, 11314.7]
  - - [4096, 9760, 1, 1024]
    - [119, 11309.1]
  - - [1024, 4608, 1, 4096]
    - [102, 10092.4]
  - - [1024, 9168, 1, 1024]
    - [91, 10907.3]
  - - [1024, 9696, 1, 4096]
    - [88, 11304.4]
  - - [4096, 13312, 1, 1024]
    - [103, 10809.7]
  - - [4096, 9696, 1, 1024]
    - [98, 11353.9]
  - - [33712, 8000, 1, 1024]
    - [122, 10936.0]
  - - [4096, 5760, 1, 1024]
    - [104, 11445.9]
  - - [1024, 6600, 1, 4096]
    - [95, 10501.0]
  - - [1024, 8128, 1, 4096]
    - [100, 10984.1]
  - - [1024, 7040, 1, 4096]
    - [95, 10533.3]
  - - [1024, 9656, 1, 4096]
    - [88, 11783.9]
  - - [1024, 8216, 1, 4096]
    - [88, 11087.9]
  - - [1024, 3240, 1, 4096]
    - [110, 9508.45]
  - - [33712, 9440, 1, 1024]
    - [95, 10301.3]
  - - [1024, 9440, 1, 4096]
    - [88, 11168.9]
  - - [4096, 9440, 1, 1024]
    - [89, 11779.2]
  - - [1024, 6160, 1, 4096]
    - [118, 9925.62]
  - - [4096, 6160, 1, 1024]
    - [116, 10400.3]
  - - [33712, 4352, 1, 1024]
    - [96, 10286.9]
  - - [1024, 8816, 1, 4096]
    - [88, 11906.5]
  - - [1024, 2720, 1, 1024]
    - [88, 11386.6]
  - - [1024, 6968, 1, 4096]
    - [88, 11057.0]
  - - [33712, 5360, 1, 1024]
    - [90, 11348.8]
  - - [1024, 4800, 1, 4096]
    - [104, 10883.4]
  - - [1024, 9000, 1, 1024]
    - [119, 10165.8]
  - - [4096, 26624, 1, 1024]
    - [123, 9807.12]
  - - [33712, 9048, 1, 1024]
    - [102, 10388.7]
  - - [1024, 9840, 1, 4096]
    - [88, 11692.8]
  - - [33712, 10120, 1, 1024]
    - [104, 10162.8]
  - - [33712, 8816, 1, 1024]
    - [88, 10795.7]
  - - [4096, 4048, 1, 1024]
    - [89, 11504.9]
  - - [1024, 5640, 1, 1024]
    - [88, 10974.5]
  - - [1024, 308, 1, 1024]
    - [92, 5361.25]
  - - [1024, 8944, 1, 4096]
    - [88, 11128.5]
  - - [4096, 9184, 1, 1024]
    - [88, 12371.9]
  - - [4096, 332, 1, 1024]
    - [93, 9740.51]
  - - [4096, 9656, 1, 1024]
    - [88, 11818.9]
  - - [1024, 33792, 1, 4096]
    - [114, 10869.4]
  - - [1024, 324, 1, 1024]
    - [96, 5609.95]
  - - [1024, 6080, 1, 1024]
    - [88, 11386.1]
  - - [4096, 8008, 1, 1024]
    - [88, 10883.4]
  - - [1024, 8528, 1, 4096]
    - [88, 11600.0]
  - - [1024, 6864, 1, 1024]
    - [88, 11202.5]
  - - [4096, 2912, 1, 1024]
    - [108, 10319.2]
  - - [1024, 8880, 1, 1024]
    - [121, 10159.9]
  - - [1024, 8024, 1, 4096]
    - [88, 11111.9]
  - - [1024, 9792, 1, 4096]
    - [88, 11247.5]
  - - [33712, 9408, 1, 1024]
    - [88, 10606.6]
  - - [4096, 9408, 1, 1024]
    - [98, 11904.4]
  - - [1024, 3240, 1, 1024]
    - [88, 10953.6]
  - - [4096, 396, 1, 1024]
    - [98, 8632.74]
  - - [33712, 8064, 1, 1024]
    - [90, 11264.4]
  - - [1024, 8840, 1, 4096]
    - [88, 10674.3]
  - - [4096, 4472, 1, 1024]
    - [119, 11968.4]
  - - [4096, 3024, 1, 1024]
    - [90, 10169.6]
  - - [4096, 6784, 1, 1024]
    - [104, 10772.5]
  - - [1024, 2400, 1, 1024]
    - [90, 9772.34]
  - - [4096, 10168, 1, 1024]
    - [88, 11807.4]
  - - [1024, 4032, 1, 1024]
    - [89, 10758.9]
  - - [1024, 9408, 1, 4096]
    - [100, 10338.5]
  - - [33712, 5760, 1, 1024]
    - [119, 10694.2]
  - - [1024, 8288, 1, 1024]
    - [88, 12106.5]
  - - [4096, 9088, 1, 1024]
    - [119, 11893.9]
  - - [1024, 7040, 1, 1024]
    - [88, 11465.5]
  - - [33712, 10112, 1, 1024]
    - [104, 10257.5]
  - - [1024, 9408, 1, 1024]
    - [88, 12396.9]
  - - [1024, 5984, 1, 1024]
    - [88, 11217.6]
  - - [4096, 8904, 1, 1024]
    - [119, 12061.1]
  - - [4096, 248, 1, 1024]
    - [89, 8954.74]
  - - [33712, 5576, 1, 1024]
    - [103, 11052.7]
  - - [4096, 8880, 1, 1024]
    - [89, 11804.4]
  - - [1024, 9800, 1, 4096]
    - [88, 11186.3]
  - - [33712, 8968, 1, 1024]
    - [98, 10587.2]
  - - [4096, 216, 1, 1024]
    - [97, 8895.97]
  - - [4096, 7800, 1, 1024]
    - [89, 12180.3]
  - - [1024, 7800, 1, 1024]
    - [89, 11254.5]
  - - [1024, 5760, 1, 4096]
    - [124, 10206.1]
  - - [33712, 9504, 1, 1024]
    - [88, 10231.0]
  - - [4096, 9752, 1, 1024]
    - [104, 11453.5]
  - - [33712, 7936, 1, 1024]
    - [112, 11186.5]
  - - [1024, 9344, 1, 1024]
    - [88, 12323.7]
  - - [33712, 8832, 1, 1024]
    - [102, 10809.1]
  - - [1024, 8904, 1, 4096]
    - [88, 10539.2]
  - - [33712, 9384, 1, 1024]
    - [88, 10278.5]
  - - [33712, 9112, 1, 1024]
    - [88, 10561.6]
  - - [4096, 9384, 1, 1024]
    - [98, 11885.8]
  - - [4096, 296, 1, 1024]
    - [89, 9171.91]
  - - [1024, 9384, 1, 1024]
    - [104, 10916.6]
  - - [4096, 9168, 1, 1024]
    - [88, 11789.4]
  - - [33712, 372, 1, 1024]
    - [90, 10725.8]
  - - [1024, 6912, 1, 4096]
    - [95, 10602.6]
  - - [4096, 6912, 1, 1024]
    - [104, 10790.8]
  - - [1024, 9152, 1, 4096]
    - [88, 11779.5]
  - - [33712, 7168, 1, 1024]
    - [88, 11674.1]
  - - [33712, 10000, 1, 1024]
    - [104, 10364.1]
  - - [4096, 4704, 1, 1024]
    - [90, 12106.0]
  - - [1024, 8352, 1, 4096]
    - [88, 10990.2]
  - - [4096, 8352, 1, 1024]
    - [89, 11777.7]
  - - [33712, 9840, 1, 1024]
    - [88, 10206.9]
  - - [1024, 7296, 1, 4096]
    - [108, 10818.8]
  - - [4096, 1344, 1, 1024]
    - [89, 12074.0]
  - - [33712, 5280, 1, 1024]
    - [114, 10641.9]
  - - [4096, 7904, 1, 1024]
    - [95, 11530.2]
  - - [1024, 7360, 1, 1024]
    - [88, 11271.0]
  - - [4096, 2400, 1, 1024]
    - [90, 10296.1]
  - - [33712, 5800, 1, 1024]
    - [98, 11071.8]
  - - [1024, 5800, 1, 4096]
    - [114, 10308.7]
  - - [4096, 5800, 1, 1024]
    - [95, 11448.1]
  - - [1024, 5800, 1, 1024]
    - [95, 10680.2]
  - - [4096, 6600, 1, 1024]
    - [104, 11505.5]
  - - [4096, 8208, 1, 1024]
    - [95, 11473.4]
  - - [4096, 7056, 1, 1024]
    - [95, 11495.1]
  - - [33712, 10040, 1, 1024]
    - [104, 10277.2]
  - - [33712, 8320, 1, 1024]
    - [102, 11107.7]
  - - [1024, 10000, 1, 1024]
    - [88, 12268.0]
  - - [1024, 8512, 1, 4096]
    - [102, 11413.6]
  - - [33712, 336, 1, 1024]
    - [120, 9818.38]
  - - [1024, 20480, 1, 1024]
    - [102, 10468.5]
  - - [4096, 8856, 1, 1024]
    - [111, 11332.0]
  - - [1024, 4896, 1, 4096]
    - [112, 10257.4]
  - - [1024, 9296, 1, 4096]
    - [88, 10310.9]
  - - [1024, 7168, 1, 1024]
    - [88, 11315.4]
  - - [1024, 396, 1, 1024]
    - [92, 6496.13]
  - - [1024, 3040, 1, 4096]
    - [118, 9318.46]
  - - [1024, 9520, 1, 1024]
    - [104, 10259.8]
  - - [1024, 8064, 1, 1024]
    - [88, 10498.2]
  - - [4096, 8816, 1, 1024]
    - [119, 11378.0]
  - - [4096, 2176, 1, 1024]
    - [104, 11121.5]
  - - [4096, 8944, 1, 1024]
    - [88, 11809.2]
  - - [33712, 6624, 1, 1024]
    - [88, 11911.1]
  - - [1024, 8016, 1, 4096]
    - [100, 10931.9]
  - - [33712, 5600, 1, 1024]
    - [95, 10958.1]
  - - [1024, 5600, 1, 1024]
    - [88, 12112.2]
  - - [1024, 4800, 1, 1024]
    - [88, 10256.7]
  - - [1024, 8024, 1, 1024]
    - [88, 10452.4]
  - - [1024, 8232, 1, 1024]
    - [88, 10707.4]
  - - [4096, 9928, 1, 1024]
    - [98, 11332.5]
  - - [1024, 1232, 1, 4096]
    - [89, 9132.19]
  - - [4096, 8576, 1, 1024]
    - [89, 11797.2]
  - - [33712, 8784, 1, 1024]
    - [88, 10767.7]
  - - [4096, 9672, 1, 1024]
    - [89, 11776.3]
  - - [1024, 4704, 1, 4096]
    - [114, 9464.79]
  - - [1024, 2912, 1, 1024]
    - [115, 10028.4]
  - - [1024, 3344, 1, 4096]
    - [95, 9709.86]
  - - [1024, 8320, 1, 4096]
    - [100, 10500.1]
  - - [1024, 8816, 1, 1024]
    - [88, 11416.0]
  - - [33712, 2400, 1, 1024]
    - [98, 10493.7]
  - - [1024, 8096, 1, 4096]
    - [88, 11123.8]
  - - [4096, 8096, 1, 1024]
    - [101, 11363.8]
  - - [1024, 2720, 1, 4096]
    - [125, 9639.43]
  - - [1024, 9512, 1, 4096]
    - [95, 10756.9]
  - - [1024, 8832, 1, 4096]
    - [88, 11219.2]
  - - [4096, 8832, 1, 1024]
    - [89, 11826.7]
  - - [1024, 8832, 1, 1024]
    - [104, 11303.8]
  - - [1024, 3024, 1, 1024]
    - [90, 9968.81]
  - - [1024, 3024, 1, 4096]
    - [95, 9746.96]
  - - [1024, 4760, 1, 4096]
    - [110, 9417.71]
  - - [33712, 8200, 1, 1024]
    - [122, 10761.7]
  - - [4096, 6072, 1, 1024]
    - [114, 11408.6]
  - - [1024, 9280, 1, 4096]
    - [88, 11101.1]
  - - [1024, 8640, 1, 1024]
    - [104, 11067.8]
  - - [1024, 5784, 1, 1024]
    - [119, 10532.3]
  - - [1024, 9072, 1, 4096]
    - [108, 10415.9]
  - - [4096, 9072, 1, 1024]
    - [89, 11822.2]
  - - [1024, 9072, 1, 1024]
    - [120, 11071.5]
  - - [4096, 3120, 1, 1024]
    - [91, 10703.9]
  - - [1024, 4968, 1, 4096]
    - [91, 9738.47]
  - - [4096, 8192, 1, 1024]
    - [118, 10705.3]
  - - [1024, 428, 1, 1024]
    - [88, 7173.76]
  - - [1024, 9424, 1, 4096]
    - [88, 11165.8]
  - - [1024, 7632, 1, 1024]
    - [88, 11336.6]
  - - [4096, 7200, 1, 1024]
    - [118, 10701.5]
  - - [4096, 5880, 1, 1024]
    - [102, 11202.0]
  - - [33712, 8616, 1, 1024]
    - [90, 11106.3]
  - - [1024, 8400, 1, 1024]
    - [88, 12260.6]
  - - [1024, 8120, 1, 1024]
    - [88, 11392.6]
  - - [1024, 3040, 1, 1024]
    - [90, 9288.05]
  - - [1024, 17408, 1, 1024]
    - [114, 10577.6]
  - - [1024, 912, 1, 4096]
    - [88, 9100.67]
  - - [4096, 344, 1, 1024]
    - [89, 8767.84]
  - - [1024, 8960, 1, 4096]
    - [88, 10950.4]
  - - [4096, 8960, 1, 1024]
    - [89, 11843.5]
  - - [1024, 8960, 1, 1024]
    - [116, 11501.3]
  - - [33712, 4704, 1, 1024]
    - [95, 10673.2]
  - - [1024, 8600, 1, 4096]
    - [91, 10783.9]
  - - [1024, 9152, 1, 1024]
    - [88, 11230.8]
  - - [1024, 9672, 1, 4096]
    - [88, 10817.0]
  - - [4096, 11776, 1, 1024]
    - [95, 11618.1]
  - - [4096, 10240, 1, 1024]
    - [88, 11820.4]
  - - [1024, 7800, 1, 4096]
    - [88, 11137.1]
  - - [33712, 7872, 1, 1024]
    - [102, 10770.5]
  - - [1024, 6128, 1, 1024]
    - [88, 12264.6]
  - - [4096, 9472, 1, 1024]
    - [98, 12043.0]
  - - [1024, 6864, 1, 4096]
    - [88, 10664.4]
  - - [4096, 10200, 1, 1024]
    - [104, 11542.7]
  - - [1024, 6240, 1, 4096]
    - [95, 10913.2]
  - - [33712, 9912, 1, 1024]
    - [104, 10654.8]
  - - [33712, 7744, 1, 1024]
    - [112, 11203.2]
  - - [4096, 7744, 1, 1024]
    - [104, 11509.4]
  - - [1024, 7744, 1, 1024]
    - [88, 12307.7]
  - - [33712, 9856, 1, 1024]
    - [88, 10016.0]
  - - [1024, 5640, 1, 4096]
    - [104, 10290.1]
  - - [4096, 2720, 1, 1024]
    - [108, 11093.4]
  - - [1024, 7360, 1, 4096]
    - [88, 10383.3]
  - - [1024, 9016, 1, 4096]
    - [88, 11167.7]
  - - [1024, 9016, 1, 1024]
    - [114, 11003.2]
  - - [33712, 8016, 1, 1024]
    - [122, 10970.2]
  - - [1024, 7072, 1, 4096]
    - [114, 10669.5]
  - - [1024, 9696, 1, 1024]
    - [88, 11390.8]
  - - [1024, 6936, 1, 4096]
    - [95, 10391.0]
  - - [1024, 8200, 1, 1024]
    - [88, 11509.8]
  - - [4096, 7208, 1, 1024]
    - [95, 11544.4]
  - - [1024, 8192, 1, 4096]
    - [88, 11257.2]
  - - [1024, 9576, 1, 1024]
    - [88, 10677.5]
  - - [4096, 9280, 1, 1024]
    - [101, 11436.1]
  - - [4096, 10032, 1, 1024]
    - [88, 11837.5]
  - - [4096, 9504, 1, 1024]
    - [88, 11781.1]
  - - [1024, 484, 1, 1024]
    - [105, 6777.66]
  - - [4096, 3584, 1, 1024]
    - [90, 11348.2]
  - - [4096, 7176, 1, 1024]
    - [95, 11467.6]
  - - [1024, 8856, 1, 1024]
    - [88, 11459.9]
  - - [1024, 452, 1, 1024]
    - [97, 7350.44]
  - - [1024, 6960, 1, 1024]
    - [88, 11343.7]
  - - [1024, 5600, 1, 4096]
    - [125, 9936.72]
  - - [4096, 8016, 1, 1024]
    - [95, 11090.0]
  - - [4096, 10208, 1, 1024]
    - [88, 11781.6]
  - - [1024, 10032, 1, 4096]
    - [102, 10816.1]
  - - [1024, 2400, 1, 4096]
    - [120, 9003.84]
  - - [1024, 10224, 1, 1024]
    - [91, 11090.6]
  - - [4096, 444, 1, 1024]
    - [89, 10003.6]
  - - [1024, 5120, 1, 1024]
    - [88, 11271.2]
  - - [4096, 8200, 1, 1024]
    - [111, 12113.7]
  - - [33712, 8664, 1, 1024]
    - [88, 10921.3]
  - - [1024, 9400, 1, 4096]
    - [88, 11166.9]
  - - [1024, 7696, 1, 4096]
    - [89, 10868.4]
  - - [4096, 8624, 1, 1024]
    - [89, 11785.9]
  - - [1024, 8664, 1, 1024]
    - [88, 11510.3]
  - - [33712, 10168, 1, 1024]
    - [104, 10208.3]
  - - [33712, 5984, 1, 1024]
    - [98, 11559.7]
  - - [33712, 9728, 1, 1024]
    - [88, 10305.6]
  - - [1024, 5888, 1, 1024]
    - [88, 12240.3]
  - - [33712, 444, 1, 1024]
    - [90, 10400.1]
  - - [4096, 9728, 1, 1024]
    - [98, 11395.9]
  - - [1024, 5776, 1, 4096]
    - [90, 10165.8]
  - - [1024, 9240, 1, 1024]
    - [119, 10763.4]
  - - [1024, 10240, 1, 4096]
    - [88, 11240.3]
  - - [4096, 9976, 1, 1024]
    - [88, 11845.0]
  - - [1024, 4968, 1, 1024]
    - [119, 11310.8]
  - - [1024, 9504, 1, 1024]
    - [126, 10251.9]
  - - [4096, 7040, 1, 1024]
    - [90, 11472.6]
  - - [1024, 8400, 1, 4096]
    - [88, 11024.1]
  - - [1024, 7176, 1, 4096]
    - [95, 10625.5]
  - - [1024, 9240, 1, 4096]
    - [88, 11620.3]
  - - [1024, 10064, 1, 1024]
    - [104, 11182.6]
  - - [33712, 7040, 1, 1024]
    - [95, 11596.9]
  - - [1024, 9752, 1, 1024]
    - [88, 12263.4]
  - - [1024, 4920, 1, 4096]
    - [95, 9619.21]
  - - [4096, 9880, 1, 1024]
    - [119, 11339.1]
  - - [4096, 4032, 1, 1024]
    - [90, 11343.2]
  - - [4096, 428, 1, 1024]
    - [98, 9307.12]
  - - [1024, 6624, 1, 1024]
    - [98, 10607.4]
  - - [1024, 5888, 1, 4096]
    - [104, 10547.7]
  - - [1024, 6336, 1, 4096]
    - [118, 9817.29]
  - - [1024, 9144, 1, 4096]
    - [88, 11264.8]
  - - [33712, 9696, 1, 1024]
    - [88, 10149.2]
  - - [1024, 10152, 1, 1024]
    - [88, 12467.3]
  - - [4096, 9952, 1, 1024]
    - [88, 11818.9]
  - - [33712, 8432, 1, 1024]
    - [102, 10821.3]
  - - [33712, 364, 1, 1024]
    - [88, 11640.0]
  - - [1024, 6664, 1, 4096]
    - [95, 10519.5]
  - - [33712, 2912, 1, 1024]
    - [95, 9985.4]
  - - [1024, 8928, 1, 4096]
    - [88, 10346.7]
  - - [1024, 10224, 1, 4096]
    - [88, 11154.3]
  - - [1024, 10120, 1, 4096]
    - [88, 11208.3]
  - - [4096, 6720, 1, 1024]
    - [114, 10629.3]
  - - [1024, 6480, 1, 1024]
    - [89, 11300.5]
  - - [33712, 296, 1, 1024]
    - [118, 9710.91]
  - - [1024, 6496, 1, 1024]
    - [88, 10503.8]
  - - [1024, 10176, 1, 4096]
    - [110, 10437.5]
  - - [33712, 9512, 1, 1024]
    - [104, 10440.6]
  - - [1024, 8664, 1, 4096]
    - [88, 10691.8]
  - - [1024, 9840, 1, 1024]
    - [120, 11161.8]
  - - [1024, 9272, 1, 1024]
    - [88, 10587.1]
  - - [4096, 8216, 1, 1024]
    - [88, 11774.0]
  - - [1024, 8448, 1, 4096]
    - [88, 11634.6]
  - - [4096, 9888, 1, 1024]
    - [98, 11352.3]
  - - [4096, 8640, 1, 1024]
    - [89, 11808.1]
  - - [1024, 8544, 1, 4096]
    - [88, 11701.9]
  - - [1024, 4392, 1, 1024]
    - [88, 11124.0]
  - - [4096, 10040, 1, 1024]
    - [119, 11386.2]
  - - [33712, 360, 1, 1024]
    - [91, 10167.2]
  - - [1024, 448, 1, 1024]
    - [92, 7432.94]
  - - [4096, 6560, 1, 1024]
    - [116, 11608.3]
  - - [1024, 7688, 1, 1024]
    - [88, 11426.2]
  - - [1024, 5120, 1, 4096]
    - [95, 9361.92]
  - - [1024, 4536, 1, 4096]
    - [124, 10219.0]
  - - [33712, 9776, 1, 1024]
    - [88, 10083.6]
  - - [33712, 9240, 1, 1024]
    - [88, 10854.9]
  - - [1024, 9048, 1, 1024]
    - [88, 12228.7]
  - - [1024, 6720, 1, 1024]
    - [88, 10497.0]
  - - [1024, 8928, 1, 1024]
    - [107, 10177.5]
  - - [1024, 3120, 1, 1024]
    - [88, 10553.4]
  - - [1024, 8448, 1, 1024]
    - [104, 10837.7]
  - - [33712, 10080, 1, 1024]
    - [104, 10282.5]
  - - [1024, 6360, 1, 1024]
    - [89, 11866.4]
  - - [33712, 6840, 1, 1024]
    - [88, 11558.5]
  - - [1024, 8496, 1, 1024]
    - [88, 12409.0]
  - - [4096, 6384, 1, 1024]
    - [104, 10686.3]
  - - [1024, 4216, 1, 4096]
    - [95, 9829.2]
  - - [1024, 9440, 1, 1024]
    - [104, 10156.1]
  - - [33712, 10224, 1, 1024]
    - [104, 10375.9]
  - - [1024, 9280, 1, 1024]
    - [88, 12234.4]
  - - [4096, 9312, 1, 1024]
    - [88, 11642.5]
  - - [4096, 9016, 1, 1024]
    - [119, 11945.8]
  - - [1024, 8192, 1, 1024]
    - [88, 11493.7]
  - - [1024, 8712, 1, 1024]
    - [88, 10474.2]
  - - [1024, 6664, 1, 1024]
    - [101, 10702.9]
  - - [1024, 8704, 1, 4096]
    - [100, 10596.0]
  - - [33712, 9792, 1, 1024]
    - [88, 10426.9]
  - - [4096, 512, 1, 1024]
    - [89, 11129.1]
  - - [4096, 9144, 1, 1024]
    - [88, 12108.4]
  - - [1024, 5632, 1, 4096]
    - [124, 9988.77]
  - - [1024, 1584, 1, 1024]
    - [88, 10078.5]
  - - [4096, 8976, 1, 1024]
    - [119, 11937.8]
  - - [33712, 8512, 1, 1024]
    - [102, 10945.1]
  - - [33712, 3072, 1, 1024]
    - [127, 10148.6]
  - - [1024, 9976, 1, 1024]
    - [88, 10618.6]
  - - [4096, 10224, 1, 1024]
    - [98, 11380.7]
  - - [4096, 352, 1, 1024]
    - [89, 8963.03]
  - - [1024, 9464, 1, 1024]
    - [104, 10982.4]
  - - [4096, 9520, 1, 1024]
    - [88, 11807.1]
  - - [4096, 9568, 1, 1024]
    - [88, 11790.2]
  - - [1024, 6976, 1, 4096]
    - [95, 10830.7]
  - - [1024, 340, 1, 1024]
    - [96, 5863.75]
  - - [4096, 7392, 1, 1024]
    - [95, 12301.3]
  - - [33712, 9744, 1, 1024]
    - [88, 10266.3]
  - - [33712, 496, 1, 1024]
    - [89, 11395.5]
  - - [33712, 9272, 1, 1024]
    - [104, 10327.6]
  - - [4096, 6480, 1, 1024]
    - [114, 11288.8]
  - - [1024, 5920, 1, 1024]
    - [88, 11875.5]
  - - [33712, 3240, 1, 1024]
    - [88, 10256.8]
  - - [4096, 7560, 1, 1024]
    - [128, 10661.4]
  - - [1024, 10080, 1, 1024]
    - [104, 12000.0]
  - - [33712, 9936, 1, 1024]
    - [104, 10153.6]
  - - [1024, 8160, 1, 4096]
    - [100, 11016.9]
  - - [33712, 10184, 1, 1024]
    - [104, 10144.0]
  - - [1024, 7560, 1, 4096]
    - [108, 10749.6]
  - - [1024, 5832, 1, 1024]
    - [88, 12135.4]
  - - [33712, 6976, 1, 1024]
    - [88, 11714.3]
  - - [1024, 6480, 1, 4096]
    - [114, 10688.6]
  - - [1024, 9912, 1, 4096]
    - [88, 11318.6]
  - - [1024, 9360, 1, 4096]
    - [88, 11217.0]
  - - [4096, 10000, 1, 1024]
    - [88, 11806.1]
  - - [1024, 5104, 1, 1024]
    - [88, 11236.0]
  - - [1024, 7936, 1, 4096]
    - [108, 10704.2]
  - - [4096, 9856, 1, 1024]
    - [89, 11856.4]
  - - [1024, 5984, 1, 4096]
    - [104, 9996.9]
  - - [4096, 2112, 1, 1024]
    - [88, 10654.2]
  - - [1024, 8480, 1, 1024]
    - [88, 10117.3]
  - - [1024, 13312, 1, 1024]
    - [125, 10496.4]
  - - [33712, 9016, 1, 1024]
    - [98, 10545.1]
  - - [1024, 6560, 1, 1024]
    - [88, 12223.9]
  - - [4096, 9360, 1, 1024]
    - [88, 11695.2]
  - - [4096, 9840, 1, 1024]
    - [119, 11412.4]
  - - [4096, 9176, 1, 1024]
    - [88, 12277.0]
  - - [1024, 8648, 1, 4096]
    - [88, 11350.4]
  - - [1024, 10120, 1, 1024]
    - [104, 11243.0]
  - - [4096, 8512, 1, 1024]
    - [89, 11797.4]
  - - [1024, 7896, 1, 1024]
    - [88, 11410.6]
  - - [1024, 352, 1, 1024]
    - [96, 6110.91]
  - - [1024, 4864, 1, 1024]
    - [88, 11190.7]
  - - [1024, 8904, 1, 1024]
    - [88, 10687.4]
  - - [33712, 7072, 1, 1024]
    - [104, 11486.7]
  - - [1024, 9504, 1, 4096]
    - [88, 11802.9]
  - - [4096, 8160, 1, 1024]
    - [89, 11787.9]
  - - [1024, 7344, 1, 4096]
    - [95, 10603.0]
  - - [33712, 9888, 1, 1024]
    - [88, 10182.0]
  - - [33712, 10176, 1, 1024]
    - [95, 10145.3]
  - - [4096, 228, 1, 1024]
    - [88, 8232.62]
  - - [1024, 10040, 1, 1024]
    - [104, 11161.6]
  - - [1024, 4368, 1, 1024]
    - [111, 10306.4]
  - - [1024, 6768, 1, 1024]
    - [101, 10860.6]
  - - [1024, 5824, 1, 1024]
    - [90, 9952.55]
  - - [1024, 5680, 1, 4096]
    - [95, 11043.7]
  - - [33712, 9296, 1, 1024]
    - [102, 10443.1]
  - - [4096, 380, 1, 1024]
    - [89, 10344.2]
  - - [1024, 8840, 1, 1024]
    - [104, 10787.4]
  - - [1024, 9184, 1, 1024]
    - [104, 11191.5]
  - - [4096, 7224, 1, 1024]
    - [95, 10968.9]
  - - [33712, 10240, 1, 1024]
    - [104, 10333.8]
  - - [1024, 8616, 1, 4096]
    - [89, 10454.7]
  - - [1024, 7920, 1, 4096]
    - [88, 10696.1]
  - - [1024, 412, 1, 1024]
    - [96, 6792.66]
  - - [1024, 9312, 1, 4096]
    - [88, 11118.8]
  - - [4096, 9344, 1, 1024]
    - [89, 11818.0]
  - - [4096, 8024, 1, 1024]
    - [89, 11759.9]
  - - [1024, 8568, 1, 1024]
    - [89, 11389.7]
  - - [1024, 10080, 1, 4096]
    - [88, 11265.8]
  - - [33712, 284, 1, 1024]
    - [111, 9925.44]
  - - [1024, 9640, 1, 4096]
    - [110, 10513.6]
  - - [1024, 8736, 1, 4096]
    - [88, 11319.4]
  - - [1024, 10240, 1, 1024]
    - [104, 11385.9]
  - - [1024, 9328, 1, 1024]
    - [88, 10655.7]
  - - [1024, 10112, 1, 4096]
    - [88, 10461.9]
  - - [4096, 5600, 1, 1024]
    - [114, 10502.6]
  - - [1024, 10000, 1, 4096]
    - [88, 11296.1]
  - - [4096, 8448, 1, 1024]
    - [89, 11570.5]
  - - [1024, 4560, 1, 4096]
    - [91, 9266.81]
  - - [4096, 8704, 1, 1024]
    - [119, 11363.0]
  - - [33712, 9640, 1, 1024]
    - [88, 10183.7]
  - - [4096, 252, 1, 1024]
    - [115, 9099.21]
  - - [1024, 5280, 1, 1024]
    - [88, 11144.3]
  - - [1024, 4048, 1, 1024]
    - [110, 10014.7]
  - - [33712, 9152, 1, 1024]
    - [98, 10612.1]
  - - [4096, 8536, 1, 1024]
    - [95, 11459.6]
  - - [4096, 26656, 1, 1024]
    - [129, 10541.9]
  - - [33712, 10152, 1, 1024]
    - [104, 10023.4]
  - - [1024, 7424, 1, 4096]
    - [114, 11005.5]
  - - [1024, 9728, 1, 4096]
    - [88, 11314.0]
  - - [4096, 5832, 1, 1024]
    - [103, 10598.8]
  - - [4096, 7936, 1, 1024]
    - [95, 10758.2]
  - - [33712, 8736, 1, 1024]
    - [102, 10679.6]
  - - [4096, 416, 1, 1024]
    - [89, 10069.4]
  - - [1024, 9600, 1, 4096]
    - [88, 10994.4]
  - - [4096, 6128, 1, 1024]
    - [114, 10640.3]
  - - [1024, 23040, 1, 4096]
    - [104, 11218.3]
  - - [4096, 8928, 1, 1024]
    - [111, 11341.4]
  - - [1024, 4080, 1, 1024]
    - [88, 10884.8]
  - - [4096, 224, 1, 1024]
    - [105, 9729.95]
  - - [1024, 7216, 1, 1024]
    - [88, 10567.7]
  - - [1024, 5720, 1, 1024]
    - [119, 10526.9]
  - - [4096, 9936, 1, 1024]
    - [119, 11378.5]
  - - [4096, 8280, 1, 1024]
    - [88, 11778.8]
  - - [4096, 3344, 1, 1024]
    - [114, 11069.0]
  - - [1024, 5632, 1, 1024]
    - [119, 10404.4]
  - - [1024, 8592, 1, 4096]
    - [88, 11043.0]
  - - [1024, 9656, 1, 1024]
    - [114, 11221.1]
  - - [1024, 7224, 1, 1024]
    - [88, 11420.4]
  - - [4096, 10120, 1, 1024]
    - [98, 11343.7]
  - - [1024, 8968, 1, 1024]
    - [104, 10939.5]
  - - [1024, 9168, 1, 4096]
    - [88, 10422.7]
  - - [4096, 20480, 1, 1024]
    - [88, 11022.4]
  - - [33712, 6072, 1, 1024]
    - [129, 10857.1]
  - - [33712, 6968, 1, 1024]
    - [88, 11587.7]
  - - [1024, 10752, 1, 4096]
    - [88, 11307.7]
  - - [1024, 8464, 1, 4096]
    - [88, 11088.9]
  - - [1024, 8288, 1, 4096]
    - [88, 11348.9]
  - - [1024, 6696, 1, 1024]
    - [88, 11288.2]
  - - [1024, 8944, 1, 1024]
    - [130, 10093.0]
  - - [33712, 7488, 1, 1024]
    - [104, 11193.5]
  - - [33712, 420, 1, 1024]
    - [88, 10877.8]
  - - [1024, 8704, 1, 1024]
    - [104, 10338.4]
  - - [1024, 4608, 1, 1024]
    - [88, 11100.5]
  - - [1024, 10168, 1, 1024]
    - [104, 11299.2]
  - - [1024, 10168, 1, 4096]
    - [95, 11018.2]
  - - [1024, 8296, 1, 1024]
    - [88, 11277.4]
  - - [4096, 7920, 1, 1024]
    - [118, 10736.5]
  - - [33712, 304, 1, 1024]
    - [120, 10627.0]
  - - [1024, 3400, 1, 1024]
    - [88, 10005.5]
  - - [1024, 6400, 1, 4096]
    - [104, 10741.8]
  - - [4096, 9240, 1, 1024]
    - [119, 11858.1]
  - - [1024, 7904, 1, 4096]
    - [88, 11081.0]
  - - [1024, 9880, 1, 4096]
    - [88, 11085.8]
  - - [33712, 9976, 1, 1024]
    - [88, 10106.7]
  - - [1024, 9568, 1, 1024]
    - [88, 12326.4]
  - - [4096, 8496, 1, 1024]
    - [89, 11780.8]
  - - [33712, 9568, 1, 1024]
    - [88, 10438.5]
  - - [1024, 8160, 1, 1024]
    - [88, 12269.6]
  - - [1024, 8008, 1, 1024]
    - [88, 11250.0]
  - - [1024, 9984, 1, 4096]
    - [88, 11229.6]
  - - [33712, 8680, 1, 1024]
    - [102, 10778.5]
  - - [33712, 224, 1, 1024]
    - [89, 10775.8]
  - - [1024, 7656, 1, 1024]
    - [88, 10550.8]
  - - [33712, 380, 1, 1024]
    - [118, 10325.2]
  - - [4096, 7728, 1, 1024]
    - [104, 11487.9]
  - - [4096, 6816, 1, 1024]
    - [118, 11092.8]
  - - [1024, 3120, 1, 4096]
    - [88, 10232.5]
  - - [1024, 9088, 1, 1024]
    - [104, 11067.3]
  - - [1024, 8584, 1, 4096]
    - [88, 10721.3]
  - - [33712, 9576, 1, 1024]
    - [88, 10557.7]
  - - [1024, 9112, 1, 1024]
    - [88, 12319.0]
  - - [1024, 6624, 1, 4096]
    - [104, 10519.4]
  - - [33712, 7680, 1, 1024]
    - [131, 10909.3]
  - - [1024, 4048, 1, 4096]
    - [88, 10585.6]
  - - [33712, 9752, 1, 1024]
    - [88, 10290.2]
  - - [1024, 9568, 1, 4096]
    - [88, 11679.0]
  - - [1024, 9184, 1, 4096]
    - [88, 11182.7]
  - - [1024, 9728, 1, 1024]
    - [104, 11295.7]
  - - [33712, 10208, 1, 1024]
    - [104, 10308.6]
  - - [33712, 8704, 1, 1024]
    - [102, 10572.3]
  - - [33712, 2720, 1, 1024]
    - [112, 10271.4]
  - - [33712, 9312, 1, 1024]
    - [88, 10546.7]
  - - [1024, 9744, 1, 1024]
    - [88, 12263.9]
  - - [1024, 9984, 1, 1024]
    - [88, 10627.9]
  - - [4096, 6400, 1, 1024]
    - [98, 11154.3]
  - - [33712, 9400, 1, 1024]
    - [88, 10726.0]
  - - [4096, 8528, 1, 1024]
    - [114, 11396.6]
  - - [1024, 5040, 1, 4096]
    - [102, 9653.32]
  - - [4096, 6976, 1, 1024]
    - [95, 10704.9]
  - - [4096, 8648, 1, 1024]
    - [111, 11354.4]
  - - [1024, 9768, 1, 4096]
    - [88, 11170.0]
  - - [1024, 8280, 1, 4096]
    - [88, 11073.1]
  - - [4096, 5888, 1, 1024]
    - [114, 10601.7]
  - - [1024, 9744, 1, 4096]
    - [88, 10981.4]
  - - [1024, 10160, 1, 1024]
    - [104, 11288.4]
  - - [4096, 5440, 1, 1024]
    - [101, 10449.2]
  - - [4096, 8736, 1, 1024]
    - [111, 11316.3]
  - - [1024, 6072, 1, 1024]
    - [88, 11376.0]
  - - [1024, 9176, 1, 1024]
    - [104, 10362.0]
  - - [4096, 504, 1, 1024]
    - [115, 9297.7]
  - - [1024, 7936, 1, 1024]
    - [116, 11421.8]
  - - [4096, 5984, 1, 1024]
    - [132, 10610.2]
  - - [33712, 308, 1, 1024]
    - [88, 11853.9]
  - - [1024, 9864, 1, 1024]
    - [118, 10221.3]
  - - [4096, 9776, 1, 1024]
    - [88, 11478.6]
  - - [1024, 9176, 1, 4096]
    - [88, 11108.7]
  - - [4096, 1584, 1, 1024]
    - [88, 11017.1]
  - - [33712, 8800, 1, 1024]
    - [88, 11122.4]
  - - [4096, 4640, 1, 1024]
    - [90, 11981.3]
  - - [1024, 8640, 1, 4096]
    - [88, 10444.9]
  - - [1024, 4640, 1, 4096]
    - [114, 9645.87]
  - - [1024, 4760, 1, 1024]
    - [111, 9926.82]
  - - [1024, 388, 1, 1024]
    - [97, 6437.46]
  - - [1024, 7520, 1, 1024]
    - [88, 11213.4]
  - - [33712, 9928, 1, 1024]
    - [95, 10020.5]
  - - [4096, 5840, 1, 1024]
    - [95, 11310.4]
  - - [1024, 9856, 1, 4096]
    - [88, 11183.6]
  - - [33712, 412, 1, 1024]
    - [90, 10429.0]
  - - [1024, 5936, 1, 4096]
    - [118, 10065.5]
  - - [1024, 4216, 1, 1024]
    - [90, 9978.29]
  - - [33712, 5936, 1, 1024]
    - [98, 10811.3]
  - - [1024, 9272, 1, 4096]
    - [88, 11142.1]
  - - [4096, 8584, 1, 1024]
    - [89, 11743.2]
  - - [4096, 9792, 1, 1024]
    - [88, 12213.2]
  - - [4096, 5680, 1, 1024]
    - [102, 11217.2]
  - - [33712, 432, 1, 1024]
    - [88, 9695.39]
  - - [1024, 9384, 1, 4096]
    - [88, 11272.0]
  - - [4096, 8480, 1, 1024]
    - [89, 11760.2]
  - - [1024, 7616, 1, 4096]
    - [108, 10560.0]
  - - [1024, 10192, 1, 1024]
    - [88, 11452.0]
  - - [1024, 5760, 1, 1024]
    - [111, 10609.5]
  - - [4096, 10192, 1, 1024]
    - [119, 11366.5]
  - - [1024, 5200, 1, 1024]
    - [88, 10970.1]
  - - [1024, 6160, 1, 1024]
    - [88, 10327.5]
  - - [1024, 10192, 1, 4096]
    - [95, 10633.2]
  - - [1024, 4032, 1, 4096]
    - [95, 10182.7]
  - - [1024, 9216, 1, 4096]
    - [88, 10518.1]
  - - [1024, 1344, 1, 4096]
    - [89, 9451.92]
  - - [33712, 9360, 1, 1024]
    - [104, 10307.4]
  - - [33712, 4160, 1, 1024]
    - [111, 10721.1]
  - - [1024, 392, 1, 1024]
    - [99, 6536.92]
  - - [1024, 9880, 1, 1024]
    - [104, 10984.7]
  - - [1024, 10200, 1, 1024]
    - [104, 10503.0]
  - - [4096, 5824, 1, 1024]
    - [98, 11307.8]
  - - [1024, 10200, 1, 4096]
    - [88, 11199.6]
  - - [1024, 1232, 1, 1024]
    - [88, 9634.89]
  - - [1024, 9792, 1, 1024]
    - [133, 10199.1]
  - - [33712, 3256, 1, 1024]
    - [89, 10072.8]
  - - [4096, 7776, 1, 1024]
    - [118, 10723.2]
  - - [33712, 9672, 1, 1024]
    - [88, 10396.6]
  - - [4096, 8400, 1, 1024]
    - [114, 11385.4]
  - - [1024, 9776, 1, 1024]
    - [88, 11474.5]
  - - [4096, 10184, 1, 1024]
    - [88, 11426.9]
  - - [33712, 9216, 1, 1024]
    - [102, 10481.5]
  - - [1024, 8512, 1, 1024]
    - [88, 12442.1]
  - - [1024, 7448, 1, 1024]
    - [88, 10576.6]
  - - [1024, 9912, 1, 1024]
    - [100, 10234.6]
  - - [1024, 10208, 1, 1024]
    - [104, 10509.6]
  - - [4096, 6336, 1, 1024]
    - [118, 10605.2]
  - - [1024, 8000, 1, 1024]
    - [88, 12369.6]
  - - [4096, 356, 1, 1024]
    - [134, 8150.48]
  - - [1024, 9112, 1, 4096]
    - [88, 11097.9]
  - - [1024, 10208, 1, 4096]
    - [102, 11190.6]
  - - [1024, 7488, 1, 4096]
    - [88, 10403.7]
  - - [1024, 6400, 1, 1024]
    - [88, 11947.8]
  - - [1024, 8584, 1, 1024]
    - [121, 10249.8]
  - - [33712, 488, 1, 1024]
    - [90, 9942.3]
  - - [1024, 9360, 1, 1024]
    - [116, 10859.8]
  - - [1024, 472, 1, 1024]
    - [99, 7723.59]
  - - [33712, 6048, 1, 1024]
    - [119, 11099.5]
  - - [4096, 9112, 1, 1024]
    - [89, 11794.0]
  - - [1024, 4704, 1, 1024]
    - [89, 10837.8]
  - - [1024, 6720, 1, 4096]
    - [88, 10383.1]
  - - [1024, 10112, 1, 1024]
    - [88, 11601.9]
  - - [4096, 6120, 1, 1024]
    - [104, 11466.8]
  - - [1024, 7920, 1, 1024]
    - [88, 10603.5]
  - - [4096, 500, 1, 1024]
    - [107, 9851.31]
  - - [4096, 9024, 1, 1024]
    - [88, 12454.0]
  - - [1024, 6528, 1, 1024]
    - [88, 11384.2]
  - - [1024, 7560, 1, 1024]
    - [100, 10128.8]
  - - [1024, 4640, 1, 1024]
    - [95, 10194.0]
  - - [1024, 1984, 1, 4096]
    - [89, 8719.79]
  - - [4096, 1984, 1, 1024]
    - [101, 10696.0]
  - - [1024, 7480, 1, 1024]
    - [101, 10662.5]
  - - [1024, 9976, 1, 4096]
    - [110, 10488.7]
  - - [4096, 6496, 1, 1024]
    - [95, 10671.7]
  - - [1024, 3360, 1, 4096]
    - [88, 9619.41]
  - - [1024, 2112, 1, 1024]
    - [89, 9073.21]
  - - [1024, 2112, 1, 4096]
    - [116, 9114.27]
  - - [1024, 8200, 1, 4096]
    - [88, 11027.7]
  - - [1024, 336, 1, 1024]
    - [96, 5817.73]
  - - [1024, 9312, 1, 1024]
    - [104, 11346.5]
  - - [1024, 7392, 1, 4096]
    - [88, 10276.9]
  - - [33712, 10032, 1, 1024]
    - [88, 10317.8]
  - - [1024, 8616, 1, 1024]
    - [88, 12268.5]
  - - [1024, 10064, 1, 4096]
    - [88, 11143.2]
  - - [33712, 9288, 1, 1024]
    - [102, 10356.3]
  - - [33712, 7192, 1, 1024]
    - [95, 11679.6]
  - - [4096, 9576, 1, 1024]
    - [89, 11810.0]
  - - [1024, 9120, 1, 1024]
    - [114, 11121.8]
  - - [4096, 9648, 1, 1024]
    - [98, 11895.5]
  - - [33712, 6912, 1, 1024]
    - [95, 11508.1]
  - - [1024, 9576, 1, 4096]
    - [88, 11191.4]
  - - [33712, 3360, 1, 1024]
    - [88, 10170.5]
  - - [1024, 9920, 1, 1024]
    - [88, 10801.0]
  - - [1024, 7072, 1, 1024]
    - [98, 10709.9]
  - - [4096, 9920, 1, 1024]
    - [98, 11380.6]
  - - [33712, 9920, 1, 1024]
    - [95, 10156.9]
  - - [4096, 5640, 1, 1024]
    - [114, 11224.5]
  - - [4096, 9680, 1, 1024]
    - [88, 11782.5]
  - - [33712, 8120, 1, 1024]
    - [91, 11012.0]
  - - [1024, 7424, 1, 1024]
    - [88, 12172.6]
  - - [1024, 10032, 1, 1024]
    - [104, 10335.7]
  - - [1024, 5680, 1, 1024]
    - [119, 10453.3]
  - - [1024, 800, 1, 1024]
    - [92, 8804.16]
  - - [1024, 4160, 1, 4096]
    - [95, 9674.98]
  - - [33712, 8976, 1, 1024]
    - [98, 10500.1]
  - - [1024, 9768, 1, 1024]
    - [88, 12284.7]
  - - [1024, 384, 1, 1024]
    - [92, 6436.27]
  - - [4096, 9768, 1, 1024]
    - [88, 11815.3]
  - - [1024, 10184, 1, 4096]
    - [104, 11081.4]
  - - [1024, 9248, 1, 4096]
    - [88, 10962.5]
  - - [1024, 5832, 1, 4096]
    - [104, 10500.1]
  - - [1024, 6888, 1, 4096]
    - [88, 10217.2]
  - - [33712, 10200, 1, 1024]
    - [104, 10118.0]
  - - [4096, 4368, 1, 1024]
    - [89, 11541.6]
  - - [4096, 6080, 1, 1024]
    - [98, 10726.0]
  - - [4096, 7144, 1, 1024]
    - [118, 10652.4]
  - - [33712, 6960, 1, 1024]
    - [88, 11616.1]
  - - [1024, 9720, 1, 1024]
    - [88, 12236.0]
  - - [1024, 7392, 1, 1024]
    - [88, 10507.3]
  - - [33712, 8584, 1, 1024]
    - [102, 10787.8]
  - - [33712, 8576, 1, 1024]
    - [102, 10876.8]
  - - [33712, 7392, 1, 1024]
    - [91, 11297.2]
  - - [4096, 9400, 1, 1024]
    - [98, 11972.3]
  - - [4096, 9800, 1, 1024]
    - [88, 11785.0]
  - - [4096, 3600, 1, 1024]
    - [95, 11064.8]
  - - [4096, 5280, 1, 1024]
    - [101, 11182.1]
  - - [4096, 3808, 1, 1024]
    - [95, 11348.2]
  - - [4096, 360, 1, 1024]
    - [96, 8460.02]
  - - [4096, 9512, 1, 1024]
    - [88, 11793.8]
  - - [1024, 5280, 1, 4096]
    - [104, 9657.52]
  - - [1024, 2880, 1, 1024]
    - [107, 9918.18]
  - - [33712, 3120, 1, 1024]
    - [89, 10265.7]
  - - [1024, 9048, 1, 4096]
    - [88, 10458.2]
  - - [4096, 6048, 1, 1024]
    - [93, 10805.2]
  - - [1024, 9632, 1, 1024]
    - [88, 11580.3]
  - - [4096, 9152, 1, 1024]
    - [88, 11843.8]
  - - [4096, 3400, 1, 1024]
    - [103, 10525.3]
  - - [1024, 9024, 1, 1024]
    - [104, 10992.5]
  - - [1024, 7688, 1, 4096]
    - [108, 10861.5]
  - - [1024, 9920, 1, 4096]
    - [88, 11221.9]
  - - [33712, 512, 1, 1024]
    - [90, 11220.6]
  - - [1024, 9472, 1, 1024]
    - [88, 10820.2]
  - - [1024, 6784, 1, 4096]
    - [95, 10662.7]
  - - [33712, 9072, 1, 1024]
    - [88, 10720.4]
  - - [1024, 8280, 1, 1024]
    - [88, 12111.1]
  - - [4096, 10152, 1, 1024]
    - [98, 11375.4]
  - - [1024, 9472, 1, 4096]
    - [88, 10690.2]
  - - [33712, 9472, 1, 1024]
    - [88, 10865.1]
  - - [4096, 9120, 1, 1024]
    - [100, 11459.0]
  - - [4096, 9600, 1, 1024]
    - [88, 11826.3]
  - - [1024, 7168, 1, 4096]
    - [88, 10658.2]
  - - [1024, 6816, 1, 1024]
    - [89, 12265.0]
  - - [1024, 6880, 1, 1024]
    - [88, 10409.5]
  - - [4096, 5720, 1, 1024]
    - [107, 10580.1]
  - - [33712, 7144, 1, 1024]
    - [89, 11544.9]
  - - [1024, 3400, 1, 4096]
    - [88, 10642.9]
  - - [1024, 10040, 1, 4096]
    - [91, 11077.6]
  - - [33712, 8448, 1, 1024]
    - [88, 11173.3]
  - - [33712, 4640, 1, 1024]
    - [121, 10560.5]
  - - [1024, 4368, 1, 4096]
    - [90, 10046.4]
  - - [1024, 6912, 1, 1024]
    - [101, 11004.1]
  - - [1024, 4864, 1, 4096]
    - [104, 9588.03]
  - - [1024, 5824, 1, 4096]
    - [95, 10583.9]
  - - [33712, 10064, 1, 1024]
    - [104, 10134.2]
  - - [33712, 492, 1, 1024]
    - [89, 11298.2]
  - - [1024, 3344, 1, 1024]
    - [88, 10605.0]
  - - [1024, 3584, 1, 1024]
    - [126, 9982.17]
  - - [33712, 6336, 1, 1024]
    - [98, 11721.8]
  - - [4096, 6864, 1, 1024]
    - [114, 11335.9]
  - - [4096, 4536, 1, 1024]
    - [95, 11473.7]
  - - [1024, 1984, 1, 1024]
    - [88, 10146.2]
  - - [1024, 8216, 1, 1024]
    - [104, 11084.8]
  - - [1024, 8968, 1, 4096]
    - [110, 10427.4]
  - - [33712, 8160, 1, 1024]
    - [91, 10994.4]
  - - [1024, 8432, 1, 4096]
    - [100, 10814.6]
  - - [1024, 11264, 1, 1024]
    - [114, 11224.7]
  - - [4096, 5104, 1, 1024]
    - [101, 11187.6]
  - - [1024, 3864, 1, 4096]
    - [88, 9963.81]
  - - [1024, 7872, 1, 1024]
    - [88, 10536.1]
  - - [4096, 7448, 1, 1024]
    - [89, 10885.3]
  - - [1024, 8736, 1, 1024]
    - [88, 11328.1]
  - - [33712, 9720, 1, 1024]
    - [88, 10349.6]
  - - [1024, 8600, 1, 1024]
    - [88, 12239.0]
  - - [4096, 8600, 1, 1024]
    - [88, 11742.7]
  - - [4096, 6960, 1, 1024]
    - [95, 11515.9]
  - - [1024, 5400, 1, 1024]
    - [88, 11687.4]
  - - [4096, 5400, 1, 1024]
    - [101, 11191.2]
  - - [33712, 9984, 1, 1024]
    - [88, 10119.3]
  - - [1024, 5400, 1, 4096]
    - [104, 10498.6]
  - - [33712, 5400, 1, 1024]
    - [93, 10461.1]
  - - [4096, 7400, 1, 1024]
    - [104, 11513.5]
  - - [4096, 5632, 1, 1024]
    - [114, 11314.6]
  - - [33712, 7800, 1, 1024]
    - [89, 11136.8]
  - - [1024, 5456, 1, 1024]
    - [88, 11818.3]
  - - [4096, 5456, 1, 1024]
    - [98, 11248.1]
  - - [1024, 5456, 1, 4096]
    - [91, 9827.21]
  - - [4096, 17408, 1, 1024]
    - [111, 9971.02]
  - - [33712, 228, 1, 1024]
    - [116, 10087.6]
  - - [33712, 9520, 1, 1024]
    - [95, 10154.7]
  - - [1024, 8976, 1, 4096]
    - [88, 11134.0]
  - - [1024, 508, 1, 1024]
    - [96, 7098.57]
  - - [1024, 8520, 1, 1024]
    - [104, 10909.8]
  - - [1024, 9856, 1, 1024]
    - [104, 10943.2]
  - - [4096, 9000, 1, 1024]
    - [119, 11663.2]
  - - [4096, 8520, 1, 1024]
    - [89, 11727.0]
  - - [1024, 5936, 1, 1024]
    - [88, 11114.9]
  - - [1024, 8520, 1, 4096]
    - [100, 10666.0]
  - - [33712, 9088, 1, 1024]
    - [88, 10681.7]
  - - [33712, 9328, 1, 1024]
    - [88, 10520.9]
  - - [1024, 18944, 1, 1024]
    - [90, 12244.9]
  - - [1024, 4536, 1, 1024]
    - [95, 10714.4]
  - - [1024, 1584, 1, 4096]
    - [88, 9033.71]
  - - [1024, 8256, 1, 4096]
    - [88, 11181.0]
  - - [1024, 8784, 1, 1024]
    - [88, 11381.3]
  - - [4096, 6800, 1, 1024]
    - [104, 11445.1]
  - - [4096, 5120, 1, 1024]
    - [95, 11508.9]
  - - [1024, 7224, 1, 4096]
    - [88, 10318.6]
  - - [1024, 8784, 1, 4096]
    - [88, 10978.4]
  - - [1024, 4560, 1, 1024]
    - [88, 10995.0]
  - - [4096, 6656, 1, 1024]
    - [104, 10753.9]
  - - [1024, 6656, 1, 4096]
    - [124, 10159.7]
  - - [1024, 8232, 1, 4096]
    - [100, 10983.4]
  - - [33712, 3864, 1, 1024]
    - [98, 10459.3]
  - - [1024, 2392, 1, 1024]
    - [88, 10874.9]
  - - [4096, 2392, 1, 1024]
    - [104, 11072.7]
  - - [4096, 10176, 1, 1024]
    - [98, 11407.9]
  - - [1024, 2392, 1, 4096]
    - [120, 8959.72]
  - - [33712, 276, 1, 1024]
    - [105, 9975.49]
  - - [1024, 7616, 1, 1024]
    - [119, 10861.1]
  - - [33712, 8096, 1, 1024]
    - [88, 10960.6]
  - - [33712, 448, 1, 1024]
    - [88, 11599.5]
  - - [1024, 9720, 1, 4096]
    - [88, 11239.7]
  - - [1024, 8360, 1, 1024]
    - [104, 10711.2]
  - - [1024, 3696, 1, 1024]
    - [95, 10777.3]
  - - [4096, 3696, 1, 1024]
    - [116, 10419.2]
  - - [1024, 304, 1, 1024]
    - [92, 5270.62]
  - - [33712, 8208, 1, 1024]
    - [91, 10815.3]
  - - [1024, 3696, 1, 4096]
    - [88, 10704.1]
  - - [1024, 7968, 1, 1024]
    - [128, 10422.9]
  - - [4096, 7968, 1, 1024]
    - [111, 11335.9]
  - - [1024, 7968, 1, 4096]
    - [88, 11225.6]
  - - [33712, 7968, 1, 1024]
    - [89, 11156.1]
  - - [1024, 7504, 1, 1024]
    - [88, 12291.4]
  - - [1024, 9760, 1, 1024]
    - [104, 10062.6]
  - - [1024, 8760, 1, 4096]
    - [88, 10433.3]
  - - [1024, 6048, 1, 1024]
    - [88, 11324.6]
  - - [1024, 5040, 1, 1024]
    - [119, 10091.7]
  - - [1024, 6048, 1, 4096]
    - [135, 9876.29]
  - - [33712, 8528, 1, 1024]
    - [122, 10831.7]
  - - [1024, 9400, 1, 1024]
    - [88, 12388.9]
  - - [33712, 8400, 1, 1024]
    - [102, 10993.7]
  - - [4096, 11264, 1, 1024]
    - [88, 12024.2]
  - - [33712, 8520, 1, 1024]
    - [102, 10879.2]
  - - [33712, 7400, 1, 1024]
    - [90, 11498.0]
  - - [33712, 9760, 1, 1024]
    - [88, 10102.8]
  - - [1024, 3072, 1, 1024]
    - [89, 11135.3]
  - - [1024, 3072, 1, 4096]
    - [95, 9893.77]
  - - [1024, 7216, 1, 4096]
    - [88, 10328.6]
  - - [33712, 9768, 1, 1024]
    - [88, 10413.1]
  - - [1024, 9040, 1, 1024]
    - [88, 12199.0]
  - - [4096, 9040, 1, 1024]
    - [88, 11667.2]
  - - [4096, 7696, 1, 1024]
    - [89, 11706.2]
  - - [1024, 9040, 1, 4096]
    - [88, 11816.4]
  - - [4096, 10160, 1, 1024]
    - [88, 11796.1]
  - - [1024, 8880, 1, 4096]
    - [88, 11109.8]
  - - [4096, 2304, 1, 1024]
    - [116, 11784.9]
  - - [1024, 2304, 1, 4096]
    - [91, 9784.98]
  - - [4096, 8664, 1, 1024]
    - [88, 11750.9]
  - - [33712, 4920, 1, 1024]
    - [120, 10757.2]
  - - [4096, 5776, 1, 1024]
    - [120, 10486.8]
  - - [1024, 8496, 1, 4096]
    - [88, 11141.4]
  - - [1024, 9936, 1, 4096]
    - [88, 11168.2]
  - - [1024, 6384, 1, 1024]
    - [88, 11140.5]
  - - [1024, 7128, 1, 4096]
    - [88, 10979.9]
  - - [1024, 6384, 1, 4096]
    - [108, 10208.4]
  - - [1024, 9752, 1, 4096]
    - [88, 11245.7]
  - - [33712, 9880, 1, 1024]
    - [104, 10057.8]
  - - [33712, 7200, 1, 1024]
    - [88, 11422.3]
  - - [1024, 6000, 1, 1024]
    - [89, 12019.4]
  - - [4096, 7488, 1, 1024]
    - [88, 11806.7]
  - - [1024, 6120, 1, 1024]
    - [88, 12254.2]
  - - [1024, 6120, 1, 4096]
    - [95, 10415.9]
  - - [1024, 7992, 1, 1024]
    - [88, 11535.3]
  - - [1024, 9640, 1, 1024]
    - [88, 10743.4]
  - - [4096, 9640, 1, 1024]
    - [98, 11390.3]
  - - [1024, 26656, 1, 1024]
    - [108, 11431.6]
  - - [1024, 3808, 1, 4096]
    - [90, 10368.1]
  - - [4096, 9720, 1, 1024]
    - [88, 11823.5]
  - - [1024, 5840, 1, 4096]
    - [104, 10035.8]
  - - [33712, 5840, 1, 1024]
    - [119, 10572.8]
  - - [1024, 5576, 1, 1024]
    - [88, 12056.3]
  - - [1024, 8624, 1, 1024]
    - [122, 10715.3]
  - - [33712, 8624, 1, 1024]
    - [102, 10688.1]
  - - [4096, 9864, 1, 1024]
    - [89, 11767.7]
  - - [4096, 9464, 1, 1024]
    - [88, 11806.0]
  - - [33712, 452, 1, 1024]
    - [95, 9862.64]
  - - [1024, 9464, 1, 4096]
    - [88, 11300.3]
  - - [1024, 5472, 1, 4096]
    - [91, 9821.28]
  - - [1024, 8120, 1, 4096]
    - [100, 10691.4]
  - - [1024, 5776, 1, 1024]
    - [88, 11227.5]
  - - [1024, 6336, 1, 1024]
    - [104, 10093.2]
  - - [4096, 5936, 1, 1024]
    - [89, 10737.9]
  - - [1024, 3864, 1, 1024]
    - [88, 10092.9]
  - - [1024, 9928, 1, 4096]
    - [95, 10889.1]
  - - [4096, 6688, 1, 1024]
    - [104, 10616.2]
  - - [1024, 9648, 1, 1024]
    - [88, 11598.4]
  - - [1024, 9648, 1, 4096]
    - [95, 11030.6]
  - - [1024, 5440, 1, 1024]
    - [88, 11012.0]
  - - [1024, 5440, 1, 4096]
    - [118, 9861.07]
  - - [1024, 8040, 1, 1024]
    - [89, 10465.9]
  - - [1024, 8040, 1, 4096]
    - [108, 10710.9]
  - - [4096, 7520, 1, 1024]
    - [95, 10828.4]
  - - [33712, 9176, 1, 1024]
    - [104, 10510.9]
  - - [1024, 6032, 1, 1024]
    - [88, 12081.7]
  - - [1024, 6032, 1, 4096]
    - [104, 9507.54]
  - - [33712, 6032, 1, 1024]
    - [98, 11538.6]
  - - [1024, 6976, 1, 1024]
    - [88, 12176.8]
  - - [1024, 9928, 1, 1024]
    - [119, 10927.8]
  - - [1024, 9952, 1, 4096]
    - [88, 11221.6]
  - - [1024, 3600, 1, 4096]
    - [95, 10304.8]
  - - [33712, 8256, 1, 1024]
    - [102, 10893.1]
  - - [4096, 4800, 1, 1024]
    - [114, 11311.0]
  - - [33712, 4800, 1, 1024]
    - [95, 10525.2]
  - - [1024, 6688, 1, 1024]
    - [88, 12057.9]
  - - [1024, 8856, 1, 4096]
    - [110, 10424.5]
  - - [4096, 8544, 1, 1024]
    - [89, 11760.0]
  - - [33712, 6720, 1, 1024]
    - [88, 11903.0]
  - - [1024, 8008, 1, 4096]
    - [114, 10884.8]
  - - [4096, 7504, 1, 1024]
    - [95, 11447.4]
  - - [1024, 7504, 1, 4096]
    - [108, 10327.7]
  - - [1024, 6784, 1, 1024]
    - [88, 11509.1]
  - - [33712, 5472, 1, 1024]
    - [114, 10563.7]
  - - [33712, 9680, 1, 1024]
    - [88, 10346.0]
  - - [1024, 8112, 1, 4096]
    - [108, 10816.4]
  - - [1024, 7728, 1, 4096]
    - [88, 10787.8]
  - - [1024, 5104, 1, 4096]
    - [114, 9860.92]
  - - [33712, 8352, 1, 1024]
    - [88, 10910.8]
  - - [4096, 5200, 1, 1024]
    - [95, 11935.4]
  - - [33712, 8008, 1, 1024]
    - [98, 11144.4]
  - - [4096, 9328, 1, 1024]
    - [114, 11441.5]
  - - [1024, 5472, 1, 1024]
    - [88, 11070.0]
  - - [1024, 9968, 1, 4096]
    - [88, 10537.3]
  - - [1024, 11776, 1, 1024]
    - [120, 10513.6]
  - - [1024, 7056, 1, 4096]
    - [108, 10491.7]
  - - [4096, 388, 1, 1024]
    - [90, 9134.4]
  - - [33712, 7056, 1, 1024]
    - [95, 11450.9]
  - - [33712, 4048, 1, 1024]
    - [88, 9881.66]
  - - [4096, 7384, 1, 1024]
    - [118, 10653.4]
  - - [1024, 8360, 1, 4096]
    - [88, 11219.0]
  - - [1024, 8296, 1, 4096]
    - [88, 11003.0]
  - - [1024, 10184, 1, 1024]
    - [104, 11315.0]
  - - [1024, 7872, 1, 4096]
    - [108, 10619.8]
  - - [4096, 8568, 1, 1024]
    - [111, 11393.1]
  - - [1024, 8432, 1, 1024]
    - [88, 11512.5]
  - - [1024, 9216, 1, 1024]
    - [88, 10785.3]
  - - [1024, 8544, 1, 1024]
    - [88, 10532.1]
  - - [1024, 6528, 1, 4096]
    - [104, 10217.5]
  - - [1024, 7344, 1, 1024]
    - [88, 11239.9]
  - - [4096, 7344, 1, 1024]
    - [95, 11582.8]
  - - [1024, 6968, 1, 1024]
    - [88, 12138.6]
  - - [4096, 10064, 1, 1024]
    - [98, 11249.9]
  - - [4096, 5920, 1, 1024]
    - [119, 10478.6]
  - - [1024, 7144, 1, 1024]
    - [102, 10531.7]
  - - [1024, 7144, 1, 4096]
    - [88, 11044.8]
  - - [1024, 9888, 1, 4096]
    - [88, 11288.0]
  - - [1024, 7400, 1, 1024]
    - [88, 10508.4]
  - - [33712, 9424, 1, 1024]
    - [98, 10128.8]
  - - [1024, 7400, 1, 4096]
    - [95, 10570.6]
  - - [4096, 244, 1, 1024]
    - [115, 8828.59]
  - - [1024, 4472, 1, 1024]
    - [88, 10792.7]
  - - [1024, 8800, 1, 1024]
    - [88, 10576.1]
  - - [1024, 6768, 1, 4096]
    - [104, 10705.9]
  - - [4096, 8800, 1, 1024]
    - [111, 11329.0]
  - - [1024, 8800, 1, 4096]
    - [88, 11063.0]
  - - [1024, 7488, 1, 1024]
    - [88, 11472.4]
  - - [1024, 6072, 1, 4096]
    - [135, 9288.55]
  - - [1024, 5568, 1, 1024]
    - [89, 11248.6]
  - - [4096, 5568, 1, 1024]
    - [101, 11306.1]
  - - [1024, 5568, 1, 4096]
    - [95, 9746.67]
  - - [33712, 5568, 1, 1024]
    - [107, 10671.4]
  - - [4096, 8784, 1, 1024]
    - [114, 11413.2]
  - - [1024, 320, 1, 1024]
    - [96, 5533.38]
  - - [33712, 7520, 1, 1024]
    - [116, 11593.1]
  - - [33712, 260, 1, 1024]
    - [89, 10077.5]
  - - [1024, 9288, 1, 1024]
    - [104, 10491.1]
  - - [4096, 7296, 1, 1024]
    - [95, 11477.1]
  - - [4096, 6000, 1, 1024]
    - [98, 11204.7]
  - - [1024, 460, 1, 1024]
    - [96, 7508.48]
  - - [1024, 6000, 1, 4096]
    - [104, 10888.2]
  - - [33712, 6864, 1, 1024]
    - [88, 11673.1]
  - - [1024, 5720, 1, 4096]
    - [112, 10184.1]
  - - [33712, 232, 1, 1024]
    - [131, 9128.37]
  - - [1024, 512, 1, 1024]
    - [105, 7162.1]
  - - [33712, 8640, 1, 1024]
    - [102, 10837.7]
  - - [4096, 6768, 1, 1024]
    - [114, 11376.6]
  - - [4096, 8968, 1, 1024]
    - [119, 11567.4]
  - - [33712, 5120, 1, 1024]
    - [120, 10545.4]
  - - [1024, 7680, 1, 1024]
    - [88, 12216.4]
  - - [4096, 7680, 1, 1024]
    - [88, 11770.7]
  - - [1024, 7680, 1, 4096]
    - [88, 10881.3]
  - - [1024, 7752, 1, 1024]
    - [88, 11198.8]
  - - [1024, 9296, 1, 1024]
    - [104, 10496.6]
  - - [4096, 9296, 1, 1024]
    - [88, 11741.7]
  - - [33712, 7920, 1, 1024]
    - [89, 11266.0]
  - - [1024, 4920, 1, 1024]
    - [88, 12101.2]
  - - [4096, 33792, 1, 1024]
    - [98, 10416.1]
  - - [4096, 5472, 1, 1024]
    - [101, 11285.1]
  - - [1024, 7888, 1, 4096]
    - [100, 10752.1]
  - - [1024, 7440, 1, 1024]
    - [88, 11390.9]
  - - [4096, 7440, 1, 1024]
    - [89, 10851.8]
  - - [33712, 8904, 1, 1024]
    - [88, 10841.9]
  - - [33712, 9648, 1, 1024]
    - [88, 10278.5]
  - - [33712, 7176, 1, 1024]
    - [95, 11273.1]
  - - [4096, 4160, 1, 1024]
    - [90, 11350.1]
  - - [1024, 4896, 1, 1024]
    - [111, 11286.1]
  - - [4096, 4896, 1, 1024]
    - [104, 10450.7]
  - - [1024, 7176, 1, 1024]
    - [98, 10859.8]
  - - [1024, 7728, 1, 1024]
    - [88, 10654.5]
  - - [4096, 4488, 1, 1024]
    - [111, 11082.3]
  - - [1024, 6128, 1, 4096]
    - [95, 10589.1]
  - - [1024, 8128, 1, 1024]
    - [89, 11402.7]
  - - [33712, 7992, 1, 1024]
    - [89, 11271.9]
  - - [4096, 8128, 1, 1024]
    - [95, 11526.3]
  - - [33712, 8128, 1, 1024]
    - [102, 11134.2]
  - - [1024, 328, 1, 1024]
    - [96, 5649.36]
  - - [1024, 7440, 1, 4096]
    - [88, 10926.3]
  - - [4096, 284, 1, 1024]
    - [95, 8421.82]
  - - [1024, 7568, 1, 1024]
    - [114, 10863.5]
  - - [4096, 7568, 1, 1024]
    - [110, 10889.5]
  - - [1024, 9328, 1, 4096]
    - [88, 11507.2]
  - - [33712, 8648, 1, 1024]
    - [104, 10716.6]
  - - [4096, 7992, 1, 1024]
    - [95, 11496.1]
  - - [1024, 7992, 1, 4096]
    - [88, 10879.1]
  - - [4096, 6664, 1, 1024]
    - [104, 10582.3]
  - - [1024, 8480, 1, 4096]
    - [88, 11068.9]
  - - [1024, 8576, 1, 1024]
    - [89, 11388.8]
  - - [1024, 6272, 1, 4096]
    - [118, 10107.0]
  - - [1024, 8576, 1, 4096]
    - [100, 10711.5]
  - - [1024, 7384, 1, 1024]
    - [88, 11307.8]
  - - [1024, 9952, 1, 1024]
    - [119, 10242.8]
  - - [1024, 7384, 1, 4096]
    - [88, 10116.6]
  - - [1024, 9968, 1, 1024]
    - [88, 11442.6]
  - - [1024, 2040, 1, 1024]
    - [88, 9645.97]
  - - [4096, 2040, 1, 1024]
    - [104, 10984.3]
  - - [4096, 5784, 1, 1024]
    - [101, 10453.6]
  - - [1024, 5784, 1, 4096]
    - [102, 9953.63]
  - - [4096, 8616, 1, 1024]
    - [111, 11320.6]
  - - [33712, 10160, 1, 1024]
    - [104, 10063.1]
  - - [1024, 912, 1, 1024]
    - [89, 10260.7]
  - - [4096, 912, 1, 1024]
    - [89, 10251.9]
  - - [4096, 7888, 1, 1024]
    - [89, 11731.1]
  - - [4096, 476, 1, 1024]
    - [89, 10346.6]
  - - [33712, 9184, 1, 1024]
    - [88, 10475.6]
  - - [1024, 7776, 1, 1024]
    - [88, 12028.9]
  - - [1024, 10176, 1, 1024]
    - [88, 10828.8]
  - - [33712, 7776, 1, 1024]
    - [91, 11342.4]
  - - [1024, 7776, 1, 4096]
    - [95, 10839.8]
  - - [1024, 6240, 1, 1024]
    - [88, 11262.6]
  - - [4096, 6240, 1, 1024]
    - [136, 10721.8]
  - - [4096, 7480, 1, 1024]
    - [90, 11391.2]
  - - [1024, 5328, 1, 4096]
    - [114, 10768.7]
  - - [33712, 5040, 1, 1024]
    - [93, 10534.8]
  - - [1024, 5016, 1, 1024]
    - [102, 11277.1]
  - - [4096, 8232, 1, 1024]
    - [88, 11788.6]
  - - [4096, 8360, 1, 1024]
    - [89, 11808.1]
  - - [33712, 8360, 1, 1024]
    - [102, 10860.5]
  - - [4096, 6624, 1, 1024]
    - [114, 11332.2]
  - - [33712, 4536, 1, 1024]
    - [104, 10625.8]
  - - [4096, 5576, 1, 1024]
    - [95, 11279.9]
  - - [1024, 5576, 1, 4096]
    - [88, 10042.0]
  - - [4096, 2880, 1, 1024]
    - [89, 10760.0]
  - - [1024, 2880, 1, 4096]
    - [88, 9510.86]
  - - [1024, 8760, 1, 1024]
    - [104, 11213.9]
  - - [4096, 8760, 1, 1024]
    - [88, 11801.4]
  - - [33712, 8760, 1, 1024]
    - [88, 11039.7]
  - - [1024, 2176, 1, 4096]
    - [89, 10423.5]
  - - [4096, 9984, 1, 1024]
    - [88, 11546.5]
  - - [33712, 7640, 1, 1024]
    - [112, 11082.0]
  - - [4096, 8184, 1, 1024]
    - [95, 11631.9]
  - - [1024, 8184, 1, 4096]
    - [100, 11105.9]
  - - [33712, 9120, 1, 1024]
    - [119, 10673.4]
  - - [1024, 9600, 1, 1024]
    - [88, 12348.3]
  - - [1024, 4352, 1, 1024]
    - [107, 10680.1]
  - - [4096, 264, 1, 1024]
    - [93, 8042.51]
  - - [4096, 8592, 1, 1024]
    - [88, 12401.0]
  - - [4096, 4352, 1, 1024]
    - [114, 11331.4]
  - - [4096, 3360, 1, 1024]
    - [90, 11003.8]
  - - [1024, 4352, 1, 4096]
    - [88, 9397.42]
  - - [1024, 6512, 1, 1024]
    - [101, 10428.1]
  - - [1024, 9680, 1, 1024]
    - [136, 10334.6]
  - - [1024, 9288, 1, 4096]
    - [88, 10319.5]
  - - [1024, 8624, 1, 4096]
    - [88, 11357.0]
  - - [4096, 9744, 1, 1024]
    - [88, 11782.7]
  - - [33712, 6496, 1, 1024]
    - [88, 11708.1]
  - - [1024, 5880, 1, 1024]
    - [88, 12231.4]
  - - [1024, 5880, 1, 4096]
    - [104, 10620.1]
  - - [1024, 440, 1, 1024]
    - [105, 7431.92]
  - - [33712, 5880, 1, 1024]
    - [98, 11104.2]
  - - [1024, 6816, 1, 4096]
    - [104, 10797.5]
  - - [4096, 7872, 1, 1024]
    - [95, 11130.5]
  - - [1024, 13312, 1, 4096]
    - [123, 9823.08]
  - - [1024, 9800, 1, 1024]
    - [104, 10897.6]
  - - [4096, 4864, 1, 1024]
    - [111, 10421.0]
  - - [1024, 8568, 1, 4096]
    - [100, 10527.3]
  - - [4096, 8256, 1, 1024]
    - [89, 11664.6]
  - - [4096, 8120, 1, 1024]
    - [89, 11575.1]
  - - [4096, 1232, 1, 1024]
    - [89, 11557.0]
  - - [1024, 5920, 1, 4096]
    - [104, 9994.77]
  - - [4096, 6360, 1, 1024]
    - [104, 10995.7]
  - - [1024, 6360, 1, 4096]
    - [118, 9956.59]
  - - [1024, 9424, 1, 1024]
    - [88, 11608.1]
  - - [33712, 6528, 1, 1024]
    - [119, 11603.5]
  - - [1024, 10160, 1, 4096]
    - [88, 11572.6]
  - - [33712, 8232, 1, 1024]
    - [90, 10945.2]
  - - [1024, 8680, 1, 1024]
    - [88, 12339.5]
  - - [4096, 8680, 1, 1024]
    - [88, 11766.8]
  - - [33712, 8592, 1, 1024]
    - [102, 10930.8]
  - - [1024, 5328, 1, 1024]
    - [89, 12009.4]
  - - [4096, 3072, 1, 1024]
    - [95, 11142.2]
  - - [1024, 4488, 1, 1024]
    - [88, 10815.4]
  - - [1024, 432, 1, 1024]
    - [92, 7113.46]
  - - [1024, 7888, 1, 1024]
    - [88, 11386.5]
  - - [1024, 4488, 1, 4096]
    - [95, 10253.6]
  - - [33712, 6272, 1, 1024]
    - [88, 12068.9]
  - - [4096, 6696, 1, 1024]
    - [114, 11349.1]
  - - [4096, 340, 1, 1024]
    - [116, 8047.74]
  - - [1024, 6696, 1, 4096]
    - [104, 10614.1]
  - - [33712, 8880, 1, 1024]
    - [102, 10705.8]
  - - [1024, 8536, 1, 1024]
    - [88, 12142.7]
  - - [1024, 8536, 1, 4096]
    - [88, 11138.7]
  - - [1024, 10152, 1, 4096]
    - [95, 11409.8]
  - - [4096, 3000, 1, 1024]
    - [91, 10667.1]
  - - [33712, 7360, 1, 1024]
    - [95, 11331.0]
  - - [4096, 3864, 1, 1024]
    - [88, 11600.1]
  - - [33712, 5824, 1, 1024]
    - [88, 11691.1]
  - - [1024, 8712, 1, 4096]
    - [88, 11710.5]
  - - [1024, 9680, 1, 4096]
    - [88, 11081.2]
  - - [1024, 8000, 1, 4096]
    - [88, 11136.1]
  - - [1024, 3600, 1, 1024]
    - [88, 11483.5]
  - - [1024, 3808, 1, 1024]
    - [107, 10109.8]
  - - [4096, 10112, 1, 1024]
    - [119, 11389.5]
  - - [4096, 6968, 1, 1024]
    - [95, 11500.4]
  - - [1024, 8096, 1, 1024]
    - [88, 11365.1]
  - - [33712, 9800, 1, 1024]
    - [88, 10092.1]
  - - [4096, 6936, 1, 1024]
    - [114, 11357.5]
  - - [33712, 8600, 1, 1024]
    - [102, 10821.7]
  - - [4096, 9288, 1, 1024]
    - [104, 11577.1]
  - - [33712, 9656, 1, 1024]
    - [88, 10235.3]
  - - [1024, 2176, 1, 1024]
    - [88, 10795.3]
  - - [4096, 8000, 1, 1024]
    - [88, 12512.4]
  - - [1024, 2304, 1, 1024]
    - [88, 11374.4]
  - - [1024, 7296, 1, 1024]
    - [104, 11036.3]
  - - [1024, 6272, 1, 1024]
    - [98, 10615.7]
  - - [4096, 6272, 1, 1024]
    - [104, 11537.2]
  - - [33712, 9600, 1, 1024]
    - [104, 10278.3]
  - - [33712, 7840, 1, 1024]
    - [91, 11223.5]
  - - [4096, 8040, 1, 1024]
    - [95, 11563.6]
  - - [1024, 5304, 1, 1024]
    - [88, 11961.5]
  - - [4096, 5304, 1, 1024]
    - [102, 11149.1]
  - - [1024, 5304, 1, 4096]
    - [104, 10430.3]
  - - [1024, 8184, 1, 1024]
    - [88, 10651.3]
  - - [4096, 6528, 1, 1024]
    - [104, 11578.7]
  - - [1024, 3584, 1, 4096]
    - [88, 10395.2]
  - - [4096, 7616, 1, 1024]
    - [90, 11458.6]
  - - [1024, 9936, 1, 1024]
    - [88, 11412.9]
  - - [1024, 8112, 1, 1024]
    - [88, 10558.6]
  - - [4096, 7360, 1, 1024]
    - [95, 11580.9]
  - - [1024, 6440, 1, 1024]
    - [88, 11976.5]
  - - [4096, 7688, 1, 1024]
    - [95, 11383.6]
  - - [33712, 7688, 1, 1024]
    - [112, 11046.2]
  - - [4096, 4920, 1, 1024]
    - [95, 11823.8]
  - - [1024, 420, 1, 1024]
    - [96, 6933.28]
  - - [33712, 10192, 1, 1024]
    - [104, 10368.5]
  - - [1024, 6888, 1, 1024]
    - [88, 12023.2]
  - - [1024, 8016, 1, 1024]
    - [104, 10825.0]
  - - [33712, 8712, 1, 1024]
    - [102, 10757.9]
  - - [4096, 5016, 1, 1024]
    - [95, 11514.6]
  - - [1024, 5016, 1, 4096]
    - [95, 10545.0]
  - - [33712, 5016, 1, 1024]
    - [114, 10356.0]
  - - [1024, 5200, 1, 4096]
    - [135, 9830.13]
  - - [4096, 6880, 1, 1024]
    - [104, 11135.4]
  - - [33712, 332, 1, 1024]
    - [91, 9384.39]
  - - [1024, 8064, 1, 4096]
    - [100, 10966.3]
  - - [4096, 9424, 1, 1024]
    - [89, 11759.2]
  - - [1024, 7208, 1, 1024]
    - [114, 10971.6]
  - - [1024, 7208, 1, 4096]
    - [88, 10272.8]
  - - [1024, 8464, 1, 1024]
    - [88, 11557.3]
  - - [1024, 6840, 1, 1024]
    - [88, 10687.0]
  - - [1024, 7128, 1, 1024]
    - [104, 10777.2]
  - - [4096, 7128, 1, 1024]
    - [95, 11398.2]
  - - [1024, 800, 1, 4096]
    - [88, 8811.54]
  - - [1024, 9248, 1, 1024]
    - [104, 11275.8]
  - - [4096, 9248, 1, 1024]
    - [98, 11594.3]
  - - [1024, 4480, 1, 1024]
    - [88, 10804.1]
  - - [4096, 4480, 1, 1024]
    - [101, 10493.2]
  - - [1024, 4480, 1, 4096]
    - [102, 10135.5]
  - - [1024, 9776, 1, 4096]
    - [88, 10516.5]
  - - [1024, 9200, 1, 1024]
    - [104, 11207.9]
  - - [1024, 9200, 1, 4096]
    - [88, 11241.3]
  - - [1024, 6560, 1, 4096]
    - [95, 10442.4]
  - - [1024, 3000, 1, 1024]
    - [90, 10564.6]
  - - [4096, 6032, 1, 1024]
    - [90, 11043.0]
  - - [1024, 3000, 1, 4096]
    - [88, 10256.0]
  - - [1024, 9120, 1, 4096]
    - [100, 10453.6]
  - - [4096, 9272, 1, 1024]
    - [88, 12292.5]
  - - [4096, 7216, 1, 1024]
    - [95, 12051.6]
  - - [1024, 9632, 1, 4096]
    - [88, 11651.6]
  - - [4096, 9912, 1, 1024]
    - [88, 11843.8]
  - - [1024, 8680, 1, 4096]
    - [88, 11635.9]
  - - [4096, 7192, 1, 1024]
    - [95, 11488.6]
  - - [1024, 7192, 1, 4096]
    - [95, 10681.2]
  - - [4096, 6888, 1, 1024]
    - [104, 10750.4]
  - - [1024, 7744, 1, 4096]
    - [108, 10931.2]
  - - [1024, 7520, 1, 4096]
    - [108, 10904.5]
  - - [4096, 8424, 1, 1024]
    - [89, 11751.9]
  - - [1024, 2592, 1, 1024]
    - [88, 10843.9]
  - - [1024, 2592, 1, 4096]
    - [95, 9782.95]
  - - [1024, 9888, 1, 1024]
    - [108, 10283.5]
  - - [4096, 8712, 1, 1024]
    - [88, 12560.0]
  - - [1024, 9024, 1, 4096]
    - [88, 11497.1]
  - - [33712, 9168, 1, 1024]
    - [88, 10639.1]
  - - [1024, 7192, 1, 1024]
    - [88, 12154.0]
  - - [33712, 240, 1, 1024]
    - [104, 9849.06]
  - - [1024, 6880, 1, 4096]
    - [110, 10358.9]
  - - [1024, 9520, 1, 4096]
    - [88, 11248.0]
  - - [1024, 9000, 1, 4096]
    - [88, 11675.0]
  - - [1024, 6600, 1, 1024]
    - [88, 11120.6]
  - - [4096, 4608, 1, 1024]
    - [111, 10526.8]
  - - [1024, 2040, 1, 4096]
    - [89, 8976.45]
  - - [33712, 4608, 1, 1024]
    - [118, 10752.1]
  - - [4096, 7168, 1, 1024]
    - [128, 10842.1]
  - - [4096, 8112, 1, 1024]
    - [89, 10926.4]
  - - [33712, 8112, 1, 1024]
    - [112, 11032.5]
  - - [4096, 7640, 1, 1024]
    - [104, 11525.8]
  - - [1024, 7840, 1, 4096]
    - [88, 11071.8]
  - - [4096, 4968, 1, 1024]
    - [104, 11438.0]
  - - [4096, 7656, 1, 1024]
    - [95, 11504.9]
  - - [1024, 7656, 1, 4096]
    - [108, 11001.6]
  - - [4096, 5040, 1, 1024]
    - [104, 11344.2]
  - - [1024, 4224, 1, 1024]
    - [111, 10649.1]
  - - [1024, 9088, 1, 4096]
    - [88, 10985.2]
  - - [1024, 7056, 1, 1024]
    - [88, 11145.4]
  - - [4096, 4392, 1, 1024]
    - [111, 11114.3]
  - - [1024, 4392, 1, 4096]
    - [114, 9984.24]
  - - [1024, 9864, 1, 4096]
    - [88, 10464.3]
  - - [33712, 8184, 1, 1024]
    - [91, 11034.8]
  - - [33712, 9864, 1, 1024]
    - [104, 10286.5]
  - - [33712, 7208, 1, 1024]
    - [102, 11485.4]
  - - [1024, 5504, 1, 1024]
    - [88, 11918.4]
  - - [4096, 5504, 1, 1024]
    - [137, 10614.9]
  - - [1024, 7896, 1, 4096]
    - [100, 10426.0]
  - - [1024, 5504, 1, 4096]
    - [121, 10109.2]
  - - [33712, 5504, 1, 1024]
    - [98, 11018.0]
  - - [1024, 1856, 1, 1024]
    - [95, 11002.7]
  - - [4096, 1856, 1, 1024]
    - [88, 11318.8]
  - - [33712, 388, 1, 1024]
    - [90, 9106.7]
  - - [1024, 1856, 1, 4096]
    - [102, 9997.69]
  - - [1024, 8256, 1, 1024]
    - [88, 10746.0]
  - - [1024, 6496, 1, 4096]
    - [104, 10033.2]
  - - [1024, 332, 1, 1024]
    - [96, 5703.26]
  - - [1024, 8592, 1, 1024]
    - [114, 11027.9]
  - - [1024, 7696, 1, 1024]
    - [98, 10669.8]
  - - [1024, 3256, 1, 1024]
    - [107, 9541.01]
  - - [4096, 3256, 1, 1024]
    - [95, 11382.8]
  - - [1024, 3256, 1, 4096]
    - [90, 9505.94]
  - - [33712, 6664, 1, 1024]
    - [88, 11726.2]
  - - [33712, 7888, 1, 1024]
    - [112, 11118.2]
  - - [4096, 6840, 1, 1024]
    - [114, 11391.7]
  - - [1024, 6840, 1, 4096]
    - [95, 11286.0]
  - - [1024, 6800, 1, 1024]
    - [88, 12241.3]
  - - [33712, 508, 1, 1024]
    - [138, 10347.8]
  - - [4096, 6512, 1, 1024]
    - [128, 10786.5]
  - - [1024, 6512, 1, 4096]
    - [110, 10274.9]
  - - [1024, 3360, 1, 1024]
    - [89, 10653.1]
  - - [1024, 1224, 1, 1024]
    - [106, 8443.77]
  - - [1024, 4160, 1, 1024]
    - [88, 11082.5]
  - - [33712, 9952, 1, 1024]
    - [104, 10145.8]
  - - [4096, 1224, 1, 1024]
    - [89, 11498.4]
  - - [1024, 1224, 1, 4096]
    - [89, 8945.17]
  - - [33712, 9144, 1, 1024]
    - [88, 10860.1]
  - - [4096, 9216, 1, 1024]
    - [98, 12029.9]
  - - [33712, 9024, 1, 1024]
    - [88, 10841.4]
  - - [4096, 436, 1, 1024]
    - [89, 10519.5]
  - - [4096, 8464, 1, 1024]
    - [88, 12545.4]
  - - [4096, 7632, 1, 1024]
    - [90, 11469.8]
  - - [4096, 412, 1, 1024]
    - [89, 9958.78]
  - - [1024, 7632, 1, 4096]
    - [88, 11890.4]
  - - [4096, 4224, 1, 1024]
    - [114, 11309.9]
  - - [33712, 5104, 1, 1024]
    - [98, 10196.7]
  - - [1024, 4224, 1, 4096]
    - [95, 9889.63]
  - - [33712, 7568, 1, 1024]
    - [102, 11097.1]
  - - [1024, 4472, 1, 4096]
    - [95, 11053.2]
  - - [33712, 8928, 1, 1024]
    - [102, 10676.5]
  - - [1024, 9760, 1, 4096]
    - [88, 11189.9]
  - - [33712, 4864, 1, 1024]
    - [107, 10626.4]
  - - [33712, 7560, 1, 1024]
    - [102, 11148.5]
  - - [4096, 8296, 1, 1024]
    - [95, 11444.2]
  - - [33712, 7480, 1, 1024]
    - [116, 11582.6]
  - - [33712, 5632, 1, 1024]
    - [98, 11219.3]
  - - [4096, 3040, 1, 1024]
    - [88, 11534.5]
  - - [1024, 500, 1, 1024]
    - [96, 6979.34]
  - - [1024, 6688, 1, 4096]
    - [108, 10608.2]
  - - [4096, 5328, 1, 1024]
    - [104, 10631.0]
  - - [4096, 2592, 1, 1024]
    - [108, 10330.3]
  - - [1024, 7200, 1, 4096]
    - [88, 10327.7]
  - - [1024, 8528, 1, 1024]
    - [88, 11329.6]
  - - [33712, 5720, 1, 1024]
    - [98, 11495.6]
  - - [1024, 6960, 1, 4096]
    - [114, 10279.5]
  - - [4096, 4560, 1, 1024]
    - [90, 11257.5]
  - - [1024, 8352, 1, 1024]
    - [100, 10058.9]
  - - [33712, 6600, 1, 1024]
    - [88, 11927.8]
  - - [1024, 8976, 1, 1024]
    - [88, 12126.3]
  - - [33712, 8296, 1, 1024]
    - [102, 11117.1]
  - - [1024, 6936, 1, 1024]
    - [88, 12107.0]
  - - [33712, 7344, 1, 1024]
    - [90, 11733.4]
  - - [1024, 7640, 1, 1024]
    - [88, 12149.8]
  - - [1024, 7640, 1, 4096]
    - [88, 11035.2]
  - - [1024, 4600, 1, 1024]
    - [88, 11847.7]
  - - [4096, 4600, 1, 1024]
    - [98, 11089.4]
  - - [1024, 4600, 1, 4096]
    - [114, 9908.45]
  - - [33712, 4600, 1, 1024]
    - [112, 11095.1]
  - - [33712, 8840, 1, 1024]
    - [88, 10518.3]
  - - [4096, 4216, 1, 1024]
    - [88, 11622.0]
  - - [33712, 9000, 1, 1024]
    - [104, 10491.3]
  - - [33712, 9464, 1, 1024]
    - [88, 10418.7]
  - - [1024, 8424, 1, 1024]
    - [88, 12312.1]
  - - [1024, 8424, 1, 4096]
    - [100, 10738.4]
  - - [4096, 6440, 1, 1024]
    - [116, 11274.2]
  - - [1024, 6440, 1, 4096]
    - [104, 10713.3]
  - - [4096, 8064, 1, 1024]
    - [111, 11264.9]
  - - [1024, 7480, 1, 4096]
    - [88, 10606.8]
  - - [4096, 4080, 1, 1024]
    - [114, 11222.9]
  - - [1024, 6656, 1, 1024]
    - [88, 11217.9]
  - - [1024, 4080, 1, 4096]
    - [95, 9476.31]
  - - [1024, 6080, 1, 4096]
    - [95, 10274.5]
  - - [4096, 4760, 1, 1024]
    - [95, 10630.0]
  - - [1024, 5360, 1, 1024]
    - [119, 10268.1]
  - - [4096, 8840, 1, 1024]
    - [88, 11756.3]
  - - [4096, 5360, 1, 1024]
    - [98, 11322.2]
  - - [1024, 5360, 1, 4096]
    - [104, 9768.06]
  - - [4096, 9632, 1, 1024]
    - [98, 11669.9]
  - - [4096, 508, 1, 1024]
    - [89, 11001.1]
  - - [1024, 476, 1, 1024]
    - [105, 7759.98]
  - - [33712, 476, 1, 1024]
    - [95, 10313.8]
  - - [4096, 452, 1, 1024]
    - [88, 8545.89]
  - - [4096, 420, 1, 1024]
    - [89, 10142.8]
  - - [4096, 316, 1, 1024]
    - [90, 9297.14]
  - - [33712, 352, 1, 1024]
    - [109, 9952.32]
  - - [1024, 284, 1, 1024]
    - [92, 4950.06]
  - - [33712, 460, 1, 1024]
    - [107, 10278.4]
  - - [1024, 7568, 1, 4096]
    - [88, 10194.8]
  - - [33712, 8960, 1, 1024]
    - [102, 10770.0]
  - - [1024, 9344, 1, 4096]
    - [88, 11129.9]
  - - [1024, 9672, 1, 1024]
    - [104, 11231.7]
  - - [1024, 504, 1, 1024]
    - [105, 7050.19]
  - - [33712, 504, 1, 1024]
    - [95, 11024.0]
  - - [4096, 10080, 1, 1024]
    - [88, 11404.7]
  - - [4096, 7896, 1, 1024]
    - [89, 11742.7]
  - - [33712, 500, 1, 1024]
    - [114, 11007.4]
  - - [1024, 496, 1, 1024]
    - [105, 6938.28]
  - - [4096, 496, 1, 1024]
    - [89, 10036.5]
  - - [1024, 424, 1, 1024]
    - [96, 7016.99]
  - - [4096, 424, 1, 1024]
    - [88, 10155.2]
  - - [33712, 424, 1, 1024]
    - [90, 11538.9]
  - - [1024, 376, 1, 1024]
    - [97, 6270.11]
  - - [1024, 8648, 1, 1024]
    - [114, 11096.5]
  - - [4096, 376, 1, 1024]
    - [89, 9518.67]
  - - [33712, 376, 1, 1024]
    - [91, 10623.2]
  - - [1024, 484, 1, 4096]
    - [88, 6774.02]
  - - [1024, 428, 1, 4096]
    - [99, 7393.57]
  - - [1024, 288, 1, 4096]
    - [97, 5290.63]
  - - [1024, 304, 1, 4096]
    - [99, 5565.06]
  - - [33712, 104, 1, 1024]
    - [88, 9715.8]
  - - [4096, 104, 1, 1024]
    - [139, 6112.77]
  - - [1024, 308, 1, 4096]
    - [97, 5632.38]
  - - [1024, 404, 1, 4096]
    - [99, 7158.23]
  - - [4096, 188, 1, 1024]
    - [140, 8460.61]
  - - [4096, 148, 1, 1024]
    - [97, 7782.81]
  - - [33712, 176, 1, 1024]
    - [89, 11189.9]
  - - [1024, 384, 1, 4096]
    - [99, 6833.88]
  - - [4096, 96, 1, 1024]
    - [99, 6395.38]
  - - [4096, 168, 1, 1024]
    - [140, 7606.25]
  - - [1024, 372, 1, 4096]
    - [99, 6613.59]
  - - [1024, 464, 1, 4096]
    - [99, 7926.66]
  - - [33712, 156, 1, 1024]
    - [89, 9922.75]
  - - [1024, 340, 1, 4096]
    - [105, 6153.18]
  - - [1024, 436, 1, 4096]
    - [105, 7624.72]
  - - [1024, 416, 1, 4096]
    - [97, 7383.32]
  - - [1024, 440, 1, 4096]
    - [88, 7583.37]
  - - [1024, 272, 1, 4096]
    - [92, 5000.21]
  - - [1024, 356, 1, 4096]
    - [99, 6365.83]
  - - [4096, 132, 1, 1024]
    - [97, 6997.57]
  - - [1024, 360, 1, 4096]
    - [99, 6430.78]
  - - [33712, 112, 1, 1024]
    - [88, 10427.1]
  - - [33712, 200, 1, 1024]
    - [89, 9627.67]
  - - [4096, 200, 1, 1024]
    - [105, 8730.86]
  - - [1024, 296, 1, 4096]
    - [97, 5433.79]
  - - [1024, 328, 1, 4096]
    - [99, 5968.97]
  - - [1024, 380, 1, 4096]
    - [99, 6710.31]
  - - [1024, 432, 1, 4096]
    - [99, 7462.67]
  - - [4096, 80, 1, 1024]
    - [99, 5315.97]
  - - [1024, 448, 1, 4096]
    - [89, 7668.32]
  - - [33712, 88, 1, 1024]
    - [141, 9689.5]
  - - [33712, 140, 1, 1024]
    - [135, 9558.83]
  - - [33712, 172, 1, 1024]
    - [89, 10927.6]
  - - [4096, 172, 1, 1024]
    - [105, 7821.12]
  - - [1024, 392, 1, 4096]
    - [99, 6943.26]
  - - [1024, 456, 1, 4096]
    - [99, 7805.25]
  - - [1024, 468, 1, 4096]
    - [105, 7963.85]
  - - [33712, 40, 1, 1024]
    - [142, 7237.11]
  - - [4096, 68, 1, 1024]
    - [99, 4553.2]
  - - [33712, 124, 1, 1024]
    - [88, 11534.3]
  - - [4096, 124, 1, 1024]
    - [105, 6916.14]
  - - [4096, 184, 1, 1024]
    - [140, 8359.53]
  - - [1024, 412, 1, 4096]
    - [99, 7233.97]
  - - [33712, 52, 1, 1024]
    - [89, 8426.08]
  - - [4096, 76, 1, 1024]
    - [97, 5050.18]
  - - [33712, 92, 1, 1024]
    - [141, 10099.0]
  - - [4096, 92, 1, 1024]
    - [99, 6090.21]
  - - [1024, 348, 1, 4096]
    - [99, 6311.03]
  - - [33712, 136, 1, 1024]
    - [93, 9212.82]
  - - [1024, 408, 1, 4096]
    - [97, 7219.34]
  - - [33712, 16, 1, 1024]
    - [139, 4706.35]
  - - [33712, 24, 1, 1024]
    - [96, 5844.43]
  - - [33712, 100, 1, 1024]
    - [88, 9334.03]
  - - [4096, 100, 1, 1024]
    - [140, 5589.42]
  - - [33712, 120, 1, 1024]
    - [88, 11191.2]
  - - [4096, 120, 1, 1024]
    - [105, 6678.83]
  - - [33712, 152, 1, 1024]
    - [89, 9662.62]
  - - [4096, 152, 1, 1024]
    - [97, 7874.68]
  - - [1024, 280, 1, 4096]
    - [97, 5147.28]
  - - [33712, 44, 1, 1024]
    - [142, 7674.43]
  - - [1024, 276, 1, 4096]
    - [97, 5066.64]
  - - [4096, 164, 1, 1024]
    - [105, 7438.0]
  - - [1024, 376, 1, 4096]
    - [99, 6657.61]
  - - [33712, 184, 1, 1024]
    - [89, 11674.5]
  - - [33712, 12, 1, 1024]
    - [139, 3501.12]
  - - [4096, 176, 1, 1024]
    - [92, 7934.2]
  - - [4096, 136, 1, 1024]
    - [97, 7173.36]
  - - [1024, 472, 1, 4096]
    - [99, 8011.12]
  - - [1024, 344, 1, 4096]
    - [105, 6191.37]
  - - [1024, 260, 1, 4096]
    - [97, 4782.97]
  - - [4096, 84, 1, 1024]
    - [97, 5546.62]
  - - [1024, 396, 1, 4096]
    - [97, 7007.01]
  - - [33712, 204, 1, 1024]
    - [88, 9765.76]
  - - [33712, 108, 1, 1024]
    - [88, 9407.22]
  - - [1024, 368, 1, 4096]
    - [99, 6575.92]
  - - [4096, 144, 1, 1024]
    - [97, 7557.3]
  - - [33712, 168, 1, 1024]
    - [89, 10670.3]
  - - [1024, 312, 1, 4096]
    - [97, 5677.8]
  - - [33712, 96, 1, 1024]
    - [143, 10111.1]
  - - [1024, 316, 1, 4096]
    - [99, 5736.66]
  - - [33712, 80, 1, 1024]
    - [143, 8326.33]
  - - [1024, 500, 1, 4096]
    - [140, 7113.8]
  - - [4096, 108, 1, 1024]
    - [139, 6561.19]
  - - [1024, 324, 1, 4096]
    - [97, 5888.01]
  - - [33712, 148, 1, 1024]
    - [113, 8830.73]
  - - [4096, 88, 1, 1024]
    - [97, 5847.57]
  - - [4096, 116, 1, 1024]
    - [105, 6428.9]
  - - [1024, 400, 1, 4096]
    - [99, 7063.48]
  - - [33712, 28, 1, 1024]
    - [96, 6746.16]
  - - [1024, 320, 1, 4096]
    - [99, 5817.33]
  - - [33712, 56, 1, 1024]
    - [89, 9057.24]
  - - [4096, 204, 1, 1024]
    - [105, 8846.55]
  - - [4096, 112, 1, 1024]
    - [139, 6851.84]
  - - [1024, 504, 1, 4096]
    - [140, 7037.04]
  - - [33712, 48, 1, 1024]
    - [142, 8314.97]
  - - [1024, 332, 1, 4096]
    - [99, 6022.95]
  - - [1024, 488, 1, 4096]
    - [99, 6828.19]
  - - [33712, 64, 1, 1024]
    - [89, 9679.92]
  - - [33712, 132, 1, 1024]
    - [135, 8320.13]
  - - [1024, 512, 1, 4096]
    - [140, 7078.98]
  - - [4096, 140, 1, 1024]
    - [97, 7274.56]
  - - [1024, 268, 1, 4096]
    - [97, 4906.04]
  - - [1024, 480, 1, 4096]
    - [99, 7573.21]
  - - [1024, 292, 1, 4096]
    - [99, 5350.99]
  - - [33712, 84, 1, 1024]
    - [143, 9209.12]
  - - [33712, 188, 1, 1024]
    - [101, 10531.5]
  - - [1024, 336, 1, 4096]
    - [99, 6066.13]
  - - [4096, 160, 1, 1024]
    - [97, 8160.12]
  - - [33712, 8, 1, 1024]
    - [144, 2271.12]
  - - [1024, 284, 1, 4096]
    - [97, 5198.93]
  - - [1024, 364, 1, 4096]
    - [97, 6488.96]
  - - [4096, 128, 1, 1024]
    - [105, 7177.42]
  - - [33712, 180, 1, 1024]
    - [89, 10675.1]
  - - [1024, 508, 1, 4096]
    - [99, 7134.69]
  - - [1024, 264, 1, 4096]
    - [105, 4784.37]
  - - [33712, 164, 1, 1024]
    - [89, 9734.26]
  - - [4096, 192, 1, 1024]
    - [140, 8677.87]
  - - [1024, 460, 1, 4096]
    - [99, 7678.19]
  - - [33712, 76, 1, 1024]
    - [141, 8540.36]
  - - [1024, 352, 1, 4096]
    - [99, 6357.18]
  - - [4096, 156, 1, 1024]
    - [97, 8113.98]
  - - [33712, 32, 1, 1024]
    - [96, 7731.49]
  - - [1024, 444, 1, 4096]
    - [99, 7577.58]
  - - [33712, 192, 1, 1024]
    - [88, 11349.4]
  - - [33712, 128, 1, 1024]
    - [88, 10351.1]
  - - [33712, 68, 1, 1024]
    - [143, 7200.7]
  - - [1024, 492, 1, 4096]
    - [140, 6482.76]
  - - [1024, 476, 1, 4096]
    - [99, 7567.03]
  - - [1024, 452, 1, 4096]
    - [99, 7262.57]
  - - [1024, 420, 1, 4096]
    - [88, 7156.34]
  - - [1024, 388, 1, 4096]
    - [105, 6774.0]
  - - [4096, 180, 1, 1024]
    - [140, 8128.5]
  - - [33712, 160, 1, 1024]
    - [89, 9494.22]
  - - [33712, 144, 1, 1024]
    - [135, 9152.72]
  - - [33712, 116, 1, 1024]
    - [111, 9618.65]
  - - [4096, 72, 1, 1024]
    - [99, 4796.54]
  - - [33712, 72, 1, 1024]
    - [143, 7609.33]
  - - [33712, 60, 1, 1024]
    - [140, 8449.99]
  - - [33712, 36, 1, 1024]
    - [142, 5956.46]
  - - [33712, 20, 1, 1024]
    - [99, 4682.73]
  - - [1024, 496, 1, 4096]
    - [88, 6809.28]
  - - [1024, 424, 1, 4096]
    - [99, 7310.02]
  - - [1024, 252, 1, 1024]
    - [96, 4328.98]
  - - [1024, 244, 1, 1024]
    - [96, 4235.97]
  - - [1024, 212, 1, 1024]
    - [99, 4301.43]
  - - [1024, 236, 1, 1024]
    - [139, 4575.89]
  - - [1024, 208, 1, 1024]
    - [97, 4253.19]
  - - [1024, 248, 1, 1024]
    - [96, 4351.52]
  - - [1024, 256, 1, 1024]
    - [92, 4485.89]
  - - [1024, 240, 1, 1024]
    - [139, 4667.25]
  - - [1024, 216, 1, 1024]
    - [99, 4396.2]
  - - [1024, 228, 1, 1024]
    - [139, 4394.77]
  - - [1024, 224, 1, 1024]
    - [97, 4609.13]
  - - [1024, 232, 1, 1024]
    - [139, 4511.68]
  - - [1024, 248, 1, 4096]
    - [92, 4533.58]
  - - [1024, 256, 1, 4096]
    - [96, 4719.32]
  - - [1024, 104, 1, 4096]
    - [97, 2412.65]
  - - [1024, 104, 1, 1024]
    - [145, 2163.73]
  - - [1024, 188, 1, 1024]
    - [145, 3832.28]
  - - [1024, 252, 1, 4096]
    - [97, 4645.58]
  - - [1024, 148, 1, 4096]
    - [99, 3412.25]
  - - [1024, 148, 1, 1024]
    - [88, 3059.72]
  - - [1024, 176, 1, 4096]
    - [99, 4066.76]
  - - [1024, 96, 1, 1024]
    - [96, 2010.05]
  - - [1024, 136, 1, 4096]
    - [97, 3164.81]
  - - [1024, 136, 1, 1024]
    - [88, 2861.28]
  - - [1024, 168, 1, 4096]
    - [97, 3893.92]
  - - [1024, 168, 1, 1024]
    - [88, 3500.81]
  - - [1024, 156, 1, 4096]
    - [99, 3604.62]
  - - [1024, 156, 1, 1024]
    - [88, 3225.12]
  - - [1024, 204, 1, 4096]
    - [97, 4730.42]
  - - [1024, 204, 1, 1024]
    - [97, 4158.43]
  - - [1024, 244, 1, 4096]
    - [97, 4507.61]
  - - [1024, 188, 1, 4096]
    - [99, 4340.21]
  - - [1024, 112, 1, 4096]
    - [146, 2555.28]
  - - [1024, 112, 1, 1024]
    - [145, 2319.13]
  - - [1024, 128, 1, 4096]
    - [97, 2957.64]
  - - [1024, 128, 1, 1024]
    - [145, 2663.05]
  - - [1024, 200, 1, 4096]
    - [97, 4629.47]
  - - [1024, 200, 1, 1024]
    - [97, 4083.24]
  - - [1024, 184, 1, 4096]
    - [97, 4262.88]
  - - [1024, 184, 1, 1024]
    - [88, 3744.91]
  - - [1024, 56, 1, 4096]
    - [147, 1341.26]
  - - [4096, 56, 1, 1024]
    - [96, 3842.95]
  - - [1024, 56, 1, 1024]
    - [92, 1185.79]
  - - [1024, 88, 1, 1024]
    - [96, 1851.42]
  - - [1024, 140, 1, 4096]
    - [99, 3243.5]
  - - [1024, 172, 1, 4096]
    - [97, 3986.63]
  - - [1024, 172, 1, 1024]
    - [88, 3533.6]
  - - [1024, 28, 1, 4096]
    - [92, 685.344]
  - - [4096, 28, 1, 1024]
    - [97, 2279.51]
  - - [1024, 28, 1, 1024]
    - [92, 601.642]
  - - [1024, 40, 1, 4096]
    - [92, 964.208]
  - - [4096, 40, 1, 1024]
    - [144, 3004.52]
  - - [1024, 68, 1, 4096]
    - [96, 1649.01]
  - - [1024, 68, 1, 1024]
    - [88, 1437.56]
  - - [1024, 124, 1, 4096]
    - [146, 2824.14]
  - - [1024, 124, 1, 1024]
    - [145, 2555.49]
  - - [1024, 236, 1, 4096]
    - [139, 5168.42]
  - - [1024, 44, 1, 4096]
    - [147, 1057.71]
  - - [4096, 44, 1, 1024]
    - [139, 3348.14]
  - - [1024, 44, 1, 1024]
    - [96, 930.188]
  - - [1024, 52, 1, 4096]
    - [147, 1244.88]
  - - [4096, 52, 1, 1024]
    - [96, 3559.14]
  - - [1024, 76, 1, 4096]
    - [148, 1822.78]
  - - [1024, 192, 1, 1024]
    - [145, 3944.49]
  - - [1024, 240, 1, 4096]
    - [139, 5271.43]
  - - [4096, 8, 1, 1024]
    - [97, 650.28]
  - - [4096, 16, 1, 1024]
    - [97, 1316.89]
  - - [1024, 24, 1, 4096]
    - [92, 588.537]
  - - [1024, 32, 1, 4096]
    - [92, 785.45]
  - - [1024, 64, 1, 4096]
    - [147, 1534.97]
  - - [1024, 100, 1, 4096]
    - [97, 2344.75]
  - - [1024, 208, 1, 4096]
    - [97, 4812.53]
  - - [1024, 108, 1, 1024]
    - [88, 2243.39]
  - - [4096, 20, 1, 1024]
    - [97, 1618.17]
  - - [1024, 52, 1, 1024]
    - [92, 1094.02]
  - - [33712, 4, 1, 1024]
    - [144, 1169.41]
  - - [1024, 152, 1, 1024]
    - [88, 3162.37]
  - - [1024, 132, 1, 4096]
    - [88, 3128.66]
  - - [1024, 24, 1, 1024]
    - [92, 515.693]
  - - [1024, 48, 1, 4096]
    - [147, 1148.6]
  - - [1024, 180, 1, 1024]
    - [96, 3768.84]
  - - [1024, 84, 1, 4096]
    - [148, 1996.38]
  - - [1024, 160, 1, 4096]
    - [97, 3733.25]
  - - [4096, 12, 1, 1024]
    - [97, 970.904]
  - - [4096, 24, 1, 1024]
    - [97, 1897.88]
  - - [1024, 216, 1, 4096]
    - [97, 4984.43]
  - - [1024, 120, 1, 1024]
    - [145, 2473.06]
  - - [1024, 80, 1, 1024]
    - [96, 1691.25]
  - - [1024, 72, 1, 4096]
    - [148, 1726.84]
  - - [1024, 176, 1, 1024]
    - [96, 3673.36]
  - - [1024, 96, 1, 4096]
    - [148, 2287.8]
  - - [1024, 32, 1, 1024]
    - [92, 687.591]
  - - [1024, 48, 1, 1024]
    - [92, 1023.0]
  - - [1024, 92, 1, 4096]
    - [148, 2191.48]
  - - [1024, 76, 1, 1024]
    - [96, 1609.28]
  - - [1024, 100, 1, 1024]
    - [88, 2070.65]
  - - [1024, 140, 1, 1024]
    - [88, 2936.01]
  - - [1024, 152, 1, 4096]
    - [97, 3526.18]
  - - [1024, 64, 1, 1024]
    - [92, 1366.22]
  - - [4096, 36, 1, 1024]
    - [144, 2731.46]
  - - [1024, 40, 1, 1024]
    - [96, 846.992]
  - - [1024, 228, 1, 4096]
    - [144, 4915.2]
  - - [1024, 60, 1, 1024]
    - [96, 1264.36]
  - - [1024, 88, 1, 4096]
    - [148, 2100.97]
  - - [1024, 192, 1, 4096]
    - [97, 4469.95]
  - - [1024, 120, 1, 4096]
    - [97, 2766.69]
  - - [1024, 116, 1, 1024]
    - [145, 2394.39]
  - - [1024, 224, 1, 4096]
    - [97, 5224.22]
  - - [1024, 36, 1, 1024]
    - [96, 764.764]
  - - [1024, 232, 1, 4096]
    - [139, 5097.85]
  - - [1024, 164, 1, 1024]
    - [88, 3379.84]
  - - [4096, 64, 1, 1024]
    - [92, 4415.06]
  - - [1024, 132, 1, 1024]
    - [88, 2768.24]
  - - [4096, 60, 1, 1024]
    - [92, 4112.06]
  - - [1024, 144, 1, 4096]
    - [97, 3358.43]
  - - [1024, 72, 1, 1024]
    - [96, 1519.68]
  - - [1024, 160, 1, 1024]
    - [145, 3334.1]
  - - [1024, 92, 1, 1024]
    - [96, 1929.38]
  - - [1024, 212, 1, 4096]
    - [97, 4933.38]
  - - [4096, 32, 1, 1024]
    - [97, 2557.5]
  - - [1024, 80, 1, 4096]
    - [148, 1911.72]
  - - [1024, 84, 1, 1024]
    - [96, 1761.61]
  - - [1024, 180, 1, 4096]
    - [99, 4161.02]
  - - [1024, 144, 1, 1024]
    - [88, 3019.9]
  - - [1024, 116, 1, 4096]
    - [146, 2635.07]
  - - [1024, 108, 1, 4096]
    - [99, 2495.51]
  - - [1024, 164, 1, 4096]
    - [97, 3816.39]
  - - [1024, 60, 1, 4096]
    - [148, 1433.79]
  - - [4096, 48, 1, 1024]
    - [144, 3679.21]
  - - [1024, 36, 1, 4096]
    - [92, 876.247]
  - - [1024, 20, 1, 1024]
    - [92, 429.744]
  - - [1024, 20, 1, 4096]
    - [92, 490.447]
  - - [1024, 8, 1, 4096]
    - [149, 248.92]
  - - [1024, 8, 1, 1024]
    - [150, 222.628]
  - - [1024, 16, 1, 4096]
    - [150, 505.034]
  - - [1024, 16, 1, 1024]
    - [150, 443.373]
  - - [1024, 12, 1, 1024]
    - [150, 333.234]
  - - [1024, 4, 1, 1024]
    - [149, 111.078]
  - - [1024, 12, 1, 4096]
    - [151, 378.775]
  - - [4096, 4, 1, 1024]
    - [152, 410.402]
  - - [1024, 4, 1, 4096]
    - [150, 126.563]
- null
