library/src/blas3/Tensile/Logic/asm_full/vega20_Cijk_Ailk_Bjlk_DB.yaml
- {MinimumRequiredVersion: 4.7.1}
- vega20
- gfx906
- [Device 66a0, Device 66a1, Device 66a7]
    SolutionIndex: 0
    SolutionNameMin: Cijk_Ailk_Bjlk_DB_MT064x064x08_
    SolutionIndex: 1
    SolutionNameMin: Cijk_Ailk_Bjlk_DB_MT064x064x04_
    SolutionIndex: 2
    SolutionNameMin: Cijk_Ailk_Bjlk_DB_MT192x096x08_PLR0_TT06_06
    SolutionIndex: 3
    SolutionNameMin: Cijk_Ailk_Bjlk_DB_MT096x064x04_PLR0_TT06_04
    SolutionIndex: 4
    SolutionNameMin: Cijk_Ailk_Bjlk_DB_MT064x096x04_PLR0_TT04_06
    SolutionIndex: 5
    SolutionNameMin: Cijk_Ailk_Bjlk_DB_MT128x064x04_PLR1_TT08_04
    SolutionIndex: 6
    SolutionNameMin: Cijk_Ailk_Bjlk_DB_MT096x064x08_PLR1_TT06_04
    SolutionIndex: 7
    SolutionNameMin: Cijk_Ailk_Bjlk_DB_MT064x096x08_PLR1_TT04_06
    SolutionIndex: 8
    SolutionNameMin: Cijk_Ailk_Bjlk_DB_MT128x064x08_PLR0_TT08_04
    SolutionIndex: 9
    SolutionNameMin: Cijk_Ailk_Bjlk_DB_MT064x096x04_PLR1_TT04_06_WG16_16_01_WGM01
    SolutionIndex: 10
    SolutionNameMin: Cijk_Ailk_Bjlk_DB_MT128x064x04_PLR1_TT08_04_WG16_16_01_WGM01
    SolutionIndex: 11
    SolutionNameMin: Cijk_Ailk_Bjlk_DB_MT064x096x04_PLR1_TT04_06_WG16_16_01_WGM08
    SolutionIndex: 12
    SolutionNameMin: Cijk_Ailk_Bjlk_DB_MT128x064x04_PLR1_TT08_04_WG16_16_01_WGM08
    SolutionIndex: 13
    SolutionNameMin: Cijk_Ailk_Bjlk_DB_MT064x064x08_PLR1_TT04_04_WG16_16_01_WGM01
    SolutionIndex: 14
    SolutionNameMin: Cijk_Ailk_Bjlk_DB_MT128x128x08_PLR1_TT08_04_WG16_32_01_WGM01
    SolutionIndex: 15
    SolutionNameMin: Cijk_Ailk_Bjlk_DB_MT064x064x08_PLR1_TT04_04_WG16_16_01_WGM08
    SolutionIndex: 16
    SolutionNameMin: Cijk_Ailk_Bjlk_DB_MT096x064x04_PLR1_TT06_04_WG16_16_01_WGM01
    SolutionIndex: 17
    SolutionNameMin: Cijk_Ailk_Bjlk_DB_MT096x064x04_PLR0_TT06_04_WG16_16_01_WGM01
    SolutionIndex: 18
    SolutionNameMin: Cijk_Ailk_Bjlk_DB_MT064x096x04_PLR1_TT04_06_WG16_16_01_WGM01
    SolutionIndex: 19
    SolutionNameMin: Cijk_Ailk_Bjlk_DB_MT128x064x04_PLR1_TT08_04_WG16_16_01_WGM01
    SolutionIndex: 20
    SolutionNameMin: Cijk_Ailk_Bjlk_DB_MT096x064x04_PLR1_TT06_04_WG16_16_01_WGM08
    SolutionIndex: 21
    SolutionNameMin: Cijk_Ailk_Bjlk_DB_MT064x096x04_PLR1_TT04_06_WG16_16_01_WGM08
    SolutionIndex: 22
    SolutionNameMin: Cijk_Ailk_Bjlk_DB_MT128x064x04_PLR1_TT08_04_WG16_16_01_WGM08
    SolutionIndex: 23
    SolutionNameMin: Cijk_Ailk_Bjlk_DB_MT128x096x08_PLR1_TT04_06_WG32_16_01_WGM01
    SolutionIndex: 24
    SolutionNameMin: Cijk_Ailk_Bjlk_DB_MT064x064x08_PLR1_TT04_04_WG16_16_01_WGM01
    SolutionIndex: 25
    SolutionNameMin: Cijk_Ailk_Bjlk_DB_MT128x128x08_PLR1_TT08_04_WG16_32_01_WGM01
    SolutionIndex: 26
    SolutionNameMin: Cijk_Ailk_Bjlk_DB_MT064x064x08_PLR1_TT04_04_WG16_16_01_WGM08
- - - [4608, 4608, 1, 384]
    - [3, 4854.92]
  - - [1536, 1536, 1, 384]
    - [7, 4685.42]
  - - [35328, 35328, 1, 384]
    - [5, 5036.05]
  - - [41088, 41088, 1, 384]
    - [5, 5090.79]
  - - [44544, 44544, 1, 384]
    - [5, 5033.52]
  - - [1152, 1152, 1, 384]
    - [6, 4078.18]
  - - [43776, 43776, 1, 384]
    - [5, 5080.68]
  - - [20736, 20736, 1, 384]
    - [5, 5072.07]
  - - [2304, 2304, 1, 384]
    - [4, 4672.74]
  - - [31872, 31872, 1, 384]
    - [5, 5089.65]
  - - [18816, 18816, 1, 384]
    - [5, 5081.64]
  - - [2688, 2688, 1, 384]
    - [5, 4828.31]
  - - [22272, 22272, 1, 384]
    - [5, 5071.93]
  - - [26496, 26496, 1, 384]
    - [5, 5090.41]
  - - [8832, 8832, 1, 384]
    - [5, 5027.24]
  - - [29184, 29184, 1, 384]
    - [5, 5034.51]
  - - [6528, 6528, 1, 384]
    - [5, 4992.96]
  - - [11520, 11520, 1, 384]
    - [5, 5041.28]
  - - [39552, 39552, 1, 384]
    - [5, 5092.55]
  - - [12672, 12672, 1, 384]
    - [5, 5063.32]
  - - [26112, 26112, 1, 384]
    - [5, 5032.68]
  - - [24576, 24576, 1, 384]
    - [8, 4825.67]
  - - [38016, 38016, 1, 384]
    - [5, 5090.94]
  - - [12288, 12288, 1, 384]
    - [5, 4944.1]
  - - [43008, 43008, 1, 384]
    - [5, 5028.03]
  - - [36096, 36096, 1, 384]
    - [5, 5079.22]
  - - [41472, 41472, 1, 384]
    - [5, 5036.62]
  - - [34560, 34560, 1, 384]
    - [5, 5076.51]
  - - [5760, 5760, 1, 5760]
    - [2, 5068.84]
  - - [1920, 1920, 1, 384]
    - [6, 4571.7]
  - - [39936, 39936, 1, 384]
    - [5, 5030.8]
  - - [23424, 23424, 1, 384]
    - [5, 5087.4]
  - - [384, 384, 1, 384]
    - [6, 1250.51]
  - - [38784, 38784, 1, 384]
    - [5, 5089.71]
  - - [29568, 29568, 1, 384]
    - [5, 5089.63]
  - - [10752, 10752, 1, 384]
    - [5, 4994.58]
  - - [4224, 4224, 1, 384]
    - [3, 4896.25]
  - - [25344, 25344, 1, 384]
    - [5, 5075.0]
  - - [28032, 28032, 1, 384]
    - [5, 5087.73]
  - - [15744, 15744, 1, 384]
    - [5, 5076.18]
  - - [16128, 16128, 1, 384]
    - [5, 5060.4]
  - - [7744, 7744, 1, 7744]
    - [2, 5113.24]
  - - [4992, 4992, 1, 384]
    - [5, 4938.45]
  - - [21120, 21120, 1, 384]
    - [5, 5082.8]
  - - [31104, 31104, 1, 384]
    - [5, 5091.39]
  - - [7680, 7680, 1, 384]
    - [5, 4935.78]
  - - [21504, 21504, 1, 384]
    - [5, 5026.45]
  - - [44160, 44160, 1, 384]
    - [5, 5089.31]
  - - [5376, 5376, 1, 384]
    - [3, 4929.62]
  - - [14592, 14592, 1, 384]
    - [5, 5056.01]
  - - [21888, 21888, 1, 384]
    - [5, 5085.94]
  - - [27648, 27648, 1, 384]
    - [5, 5029.56]
  - - [13056, 13056, 1, 384]
    - [5, 5049.41]
  - - [19968, 19968, 1, 384]
    - [5, 5029.51]
  - - [25728, 25728, 1, 384]
    - [5, 5086.89]
  - - [22656, 22656, 1, 384]
    - [5, 5086.36]
  - - [17664, 17664, 1, 384]
    - [5, 5067.5]
  - - [38400, 38400, 1, 384]
    - [5, 5034.84]
  - - [13440, 13440, 1, 384]
    - [5, 5066.24]
  - - [32640, 32640, 1, 384]
    - [5, 5091.63]
  - - [11904, 11904, 1, 384]
    - [5, 5057.32]
  - - [28416, 28416, 1, 384]
    - [5, 5076.97]
  - - [32256, 32256, 1, 384]
    - [5, 5034.81]
  - - [13824, 13824, 1, 384]
    - [5, 5014.89]
  - - [42240, 42240, 1, 384]
    - [5, 5080.89]
  - - [10368, 10368, 1, 384]
    - [5, 5044.13]
  - - [27264, 27264, 1, 384]
    - [5, 5087.77]
  - - [29952, 29952, 1, 384]
    - [5, 5077.42]
  - - [37248, 37248, 1, 384]
    - [5, 5091.27]
  - - [31488, 31488, 1, 384]
    - [5, 5076.62]
  - - [26880, 26880, 1, 384]
    - [5, 5076.86]
  - - [14976, 14976, 1, 384]
    - [5, 5071.57]
  - - [33024, 33024, 1, 384]
    - [5, 5079.86]
  - - [23040, 23040, 1, 384]
    - [5, 5029.24]
  - - [24960, 24960, 1, 384]
    - [5, 5086.65]
  - - [17280, 17280, 1, 384]
    - [5, 5078.71]
  - - [15360, 15360, 1, 384]
    - [5, 5016.14]
  - - [43392, 43392, 1, 384]
    - [5, 5092.64]
  - - [9984, 9984, 1, 384]
    - [5, 5029.16]
  - - [28800, 28800, 1, 384]
    - [5, 5088.25]
  - - [23808, 23808, 1, 384]
    - [5, 5074.44]
  - - [42624, 42624, 1, 384]
    - [5, 5091.78]
  - - [18048, 18048, 1, 384]
    - [5, 5080.2]
  - - [30720, 30720, 1, 384]
    - [5, 5028.5]
  - - [18432, 18432, 1, 384]
    - [5, 5016.1]
  - - [20352, 20352, 1, 384]
    - [5, 5084.91]
  - - [30336, 30336, 1, 384]
    - [5, 5089.52]
  - - [35712, 35712, 1, 384]
    - [5, 5091.49]
  - - [11136, 11136, 1, 384]
    - [5, 5049.58]
  - - [41856, 41856, 1, 384]
    - [5, 5091.73]
  - - [16896, 16896, 1, 384]
    - [5, 5022.69]
  - - [33408, 33408, 1, 384]
    - [5, 5091.25]
  - - [16512, 16512, 1, 384]
    - [5, 5078.28]
  - - [3456, 3456, 1, 384]
    - [3, 4825.64]
  - - [33792, 33792, 1, 384]
    - [5, 5032.24]
  - - [9600, 9600, 1, 384]
    - [5, 5042.34]
  - - [3840, 3840, 1, 384]
    - [3, 4864.37]
  - - [36864, 36864, 1, 384]
    - [5, 4981.54]
  - - [44928, 44928, 1, 384]
    - [5, 5090.45]
  - - [14208, 14208, 1, 384]
    - [5, 5070.01]
  - - [34176, 34176, 1, 384]
    - [5, 5090.51]
  - - [36480, 36480, 1, 384]
    - [5, 5091.46]
  - - [8448, 8448, 1, 384]
    - [5, 5020.6]
  - - [6144, 6144, 1, 384]
    - [5, 4938.46]
  - - [40320, 40320, 1, 384]
    - [5, 5089.46]
  - - [9216, 9216, 1, 384]
    - [5, 4979.39]
  - - [7296, 7296, 1, 384]
    - [5, 5010.44]
  - - [19200, 19200, 1, 384]
    - [5, 5068.83]
  - - [34944, 34944, 1, 384]
    - [5, 5092.02]
  - - [768, 768, 1, 384]
    - [7, 3570.2]
  - - [6912, 6912, 1, 384]
    - [5, 4968.51]
  - - [5760, 5760, 1, 384]
    - [5, 4963.16]
  - - [19584, 19584, 1, 384]
    - [5, 5083.48]
  - - [37632, 37632, 1, 384]
    - [5, 5081.27]
  - - [24192, 24192, 1, 384]
    - [5, 5086.04]
  - - [4608, 4608, 1, 4608]
    - [2, 5211.21]
  - - [4608, 4608, 1, 50000]
    - [2, 5211.21]
  - - [39168, 39168, 1, 384]
    - [5, 5078.01]
  - - [40704, 40704, 1, 384]
    - [5, 5078.29]
  - - [8064, 8064, 1, 384]
    - [5, 5029.01]
  - - [41728, 41728, 1, 256]
    - [12, 4883.63]
  - - [3840, 3840, 1, 256]
    - [9, 4573.62]
  - - [13312, 13312, 1, 256]
    - [12, 4798.92]
  - - [29952, 29952, 1, 256]
    - [12, 4888.92]
  - - [13824, 13824, 1, 256]
    - [12, 4797.03]
  - - [44544, 44544, 1, 256]
    - [12, 4821.18]
  - - [31488, 31488, 1, 256]
    - [12, 4881.82]
  - - [4864, 4864, 1, 256]
    - [12, 4685.01]
  - - [10240, 10240, 1, 256]
    - [12, 4776.71]
  - - [33024, 33024, 1, 256]
    - [12, 4880.77]
  - - [2816, 2816, 1, 256]
    - [15, 4493.64]
  - - [23040, 23040, 1, 256]
    - [12, 4812.96]
  - - [7936, 7936, 1, 256]
    - [12, 4807.25]
  - - [4608, 4608, 1, 256]
    - [12, 4604.14]
  - - [44800, 44800, 1, 256]
    - [12, 4881.32]
  - - [39680, 39680, 1, 256]
    - [12, 4888.26]
  - - [30464, 30464, 1, 256]
    - [12, 4880.77]
  - - [32768, 32768, 1, 256]
    - [14, 4647.34]
  - - [2560, 2560, 1, 256]
    - [15, 4376.83]
  - - [41984, 41984, 1, 256]
    - [12, 4819.02]
  - - [11008, 11008, 1, 256]
    - [12, 4833.67]
  - - [31744, 31744, 1, 256]
    - [12, 4829.25]
  - - [9984, 9984, 1, 256]
    - [12, 4824.51]
  - - [17408, 17408, 1, 256]
    - [12, 4802.66]
  - - [8448, 8448, 1, 256]
    - [12, 4808.06]
  - - [23552, 23552, 1, 256]
    - [12, 4811.48]
  - - [24064, 24064, 1, 256]
    - [12, 4826.17]
  - - [5120, 5120, 1, 256]
    - [10, 4746.85]
  - - [1536, 1536, 1, 256]
    - [11, 4422.83]
  - - [6400, 6400, 1, 256]
    - [10, 4767.65]
  - - [18432, 18432, 1, 256]
    - [12, 4796.68]
  - - [19712, 19712, 1, 256]
    - [12, 4876.64]
  - - [8192, 8192, 1, 256]
    - [10, 4729.63]
  - - [25344, 25344, 1, 256]
    - [12, 4878.61]
  - - [28928, 28928, 1, 256]
    - [12, 4880.82]
  - - [1280, 1280, 1, 256]
    - [13, 3934.63]
  - - [10496, 10496, 1, 256]
    - [12, 4826.0]
  - - [6144, 6144, 1, 256]
    - [10, 4749.12]
  - - [15616, 15616, 1, 256]
    - [12, 4860.42]
  - - [30720, 30720, 1, 256]
    - [12, 4816.67]
  - - [1792, 1792, 1, 256]
    - [13, 4257.75]
  - - [20480, 20480, 1, 256]
    - [14, 4738.69]
  - - [33792, 33792, 1, 256]
    - [12, 4818.68]
  - - [35072, 35072, 1, 256]
    - [10, 4846.02]
  - - [8704, 8704, 1, 256]
    - [12, 4744.25]
  - - [40192, 40192, 1, 256]
    - [12, 4883.88]
  - - [9728, 9728, 1, 256]
    - [12, 4773.55]
  - - [17152, 17152, 1, 256]
    - [12, 4863.18]
  - - [11264, 11264, 1, 256]
    - [12, 4792.11]
  - - [7168, 7168, 1, 256]
    - [10, 4761.64]
  - - [34816, 34816, 1, 256]
    - [12, 4815.82]
  - - [38656, 38656, 1, 256]
    - [12, 4894.8]
  - - [44032, 44032, 1, 256]
    - [12, 4824.11]
  - - [9472, 9472, 1, 256]
    - [10, 4828.14]
  - - [12032, 12032, 1, 256]
    - [12, 4845.71]
  - - [23296, 23296, 1, 256]
    - [12, 4881.71]
  - - [34304, 34304, 1, 256]
    - [12, 4820.52]
  - - [43520, 43520, 1, 256]
    - [12, 4818.38]
  - - [19456, 19456, 1, 256]
    - [12, 4810.39]
  - - [38400, 38400, 1, 256]
    - [12, 4824.39]
  - - [9216, 9216, 1, 256]
    - [12, 4784.51]
  - - [28160, 28160, 1, 256]
    - [12, 4821.96]
  - - [19200, 19200, 1, 256]
    - [12, 4868.67]
  - - [40448, 40448, 1, 256]
    - [12, 4819.0]
  - - [32512, 32512, 1, 256]
    - [12, 4886.09]
  - - [768, 768, 1, 256]
    - [9, 3413.09]
  - - [20992, 20992, 1, 256]
    - [12, 4816.15]
  - - [15104, 15104, 1, 256]
    - [12, 4857.59]
  - - [25856, 25856, 1, 256]
    - [12, 4882.02]
  - - [32256, 32256, 1, 256]
    - [12, 4821.93]
  - - [27136, 27136, 1, 256]
    - [12, 4822.27]
  - - [37632, 37632, 1, 256]
    - [12, 4884.02]
  - - [6656, 6656, 1, 256]
    - [10, 4721.27]
  - - [512, 512, 1, 256]
    - [15, 2768.52]
  - - [35584, 35584, 1, 256]
    - [10, 4773.25]
  - - [14848, 14848, 1, 256]
    - [12, 4800.64]
  - - [8960, 8960, 1, 256]
    - [10, 4815.4]
  - - [35840, 35840, 1, 256]
    - [12, 4818.61]
  - - [35328, 35328, 1, 256]
    - [12, 4779.74]
  - - [21504, 21504, 1, 256]
    - [12, 4810.7]
  - - [21760, 21760, 1, 256]
    - [12, 4868.37]
  - - [12544, 12544, 1, 256]
    - [12, 4858.82]
  - - [30976, 30976, 1, 256]
    - [12, 4885.02]
  - - [43776, 43776, 1, 256]
    - [12, 4889.52]
  - - [24576, 24576, 1, 256]
    - [14, 4716.28]
  - - [39424, 39424, 1, 256]
    - [12, 4820.85]
  - - [20736, 20736, 1, 256]
    - [12, 4870.14]
  - - [5632, 5632, 1, 256]
    - [10, 4684.22]
  - - [26880, 26880, 1, 256]
    - [12, 4879.27]
  - - [41216, 41216, 1, 256]
    - [12, 4878.75]
  - - [22528, 22528, 1, 256]
    - [12, 4807.78]
  - - [7424, 7424, 1, 256]
    - [12, 4794.64]
  - - [15872, 15872, 1, 256]
    - [12, 4805.95]
  - - [28672, 28672, 1, 256]
    - [14, 4742.96]
  - - [42240, 42240, 1, 256]
    - [12, 4879.59]
  - - [37888, 37888, 1, 256]
    - [12, 4815.79]
  - - [1024, 1024, 1, 256]
    - [10, 4473.92]
  - - [29184, 29184, 1, 256]
    - [12, 4826.98]
  - - [11520, 11520, 1, 256]
    - [12, 4836.84]
  - - [22272, 22272, 1, 256]
    - [12, 4873.63]
  - - [29440, 29440, 1, 256]
    - [12, 4890.39]
  - - [25088, 25088, 1, 256]
    - [12, 4813.85]
  - - [38912, 38912, 1, 256]
    - [12, 4803.93]
  - - [26112, 26112, 1, 256]
    - [12, 4821.26]
  - - [18176, 18176, 1, 256]
    - [12, 4877.22]
  - - [38144, 38144, 1, 256]
    - [12, 4888.08]
  - - [17664, 17664, 1, 256]
    - [12, 4869.58]
  - - [12288, 12288, 1, 256]
    - [14, 4704.73]
  - - [16640, 16640, 1, 256]
    - [12, 4867.4]
  - - [43008, 43008, 1, 256]
    - [12, 4807.56]
  - - [36096, 36096, 1, 256]
    - [12, 4881.33]
  - - [37120, 37120, 1, 256]
    - [12, 4883.51]
  - - [29696, 29696, 1, 256]
    - [12, 4812.2]
  - - [23808, 23808, 1, 256]
    - [12, 4888.54]
  - - [41472, 41472, 1, 256]
    - [12, 4820.4]
  - - [42496, 42496, 1, 256]
    - [12, 4821.49]
  - - [34560, 34560, 1, 256]
    - [12, 4884.56]
  - - [25600, 25600, 1, 256]
    - [12, 4810.58]
  - - [21248, 21248, 1, 256]
    - [12, 4876.25]
  - - [3584, 3584, 1, 256]
    - [15, 4506.31]
  - - [39936, 39936, 1, 256]
    - [12, 4819.4]
  - - [36864, 36864, 1, 256]
    - [14, 4716.73]
  - - [24320, 24320, 1, 256]
    - [12, 4886.72]
  - - [13568, 13568, 1, 256]
    - [12, 4855.74]
  - - [6912, 6912, 1, 256]
    - [10, 4803.55]
  - - [18944, 18944, 1, 256]
    - [12, 4811.54]
  - - [27392, 27392, 1, 256]
    - [12, 4873.4]
  - - [2304, 2304, 1, 256]
    - [9, 4456.19]
  - - [36352, 36352, 1, 256]
    - [12, 4823.32]
  - - [26368, 26368, 1, 256]
    - [12, 4881.35]
  - - [31232, 31232, 1, 256]
    - [12, 4832.24]
  - - [16128, 16128, 1, 256]
    - [12, 4867.45]
  - - [33536, 33536, 1, 256]
    - [12, 4879.67]
  - - [256, 256, 1, 256]
    - [13, 702.563]
  - - [24832, 24832, 1, 256]
    - [12, 4877.98]
  - - [14080, 14080, 1, 256]
    - [12, 4861.39]
  - - [10752, 10752, 1, 256]
    - [12, 4772.26]
  - - [15360, 15360, 1, 256]
    - [12, 4814.19]
  - - [22784, 22784, 1, 256]
    - [12, 4877.98]
  - - [33280, 33280, 1, 256]
    - [12, 4834.11]
  - - [20224, 20224, 1, 256]
    - [12, 4872.28]
  - - [18688, 18688, 1, 256]
    - [12, 4876.69]
  - - [37376, 37376, 1, 256]
    - [12, 4820.5]
  - - [32000, 32000, 1, 256]
    - [12, 4879.78]
  - - [7680, 7680, 1, 256]
    - [12, 4733.45]
  - - [43264, 43264, 1, 256]
    - [12, 4878.68]
  - - [28416, 28416, 1, 256]
    - [12, 4889.07]
  - - [5376, 5376, 1, 256]
    - [10, 4730.79]
  - - [14592, 14592, 1, 256]
    - [12, 4857.15]
  - - [36608, 36608, 1, 256]
    - [12, 4891.42]
  - - [26624, 26624, 1, 256]
    - [12, 4803.15]
  - - [3328, 3328, 1, 256]
    - [10, 4554.64]
  - - [30208, 30208, 1, 256]
    - [12, 4823.23]
  - - [42752, 42752, 1, 256]
    - [12, 4884.6]
  - - [27648, 27648, 1, 256]
    - [12, 4813.31]
  - - [4352, 4352, 1, 256]
    - [12, 4653.19]
  - - [13056, 13056, 1, 256]
    - [12, 4843.78]
  - - [19968, 19968, 1, 256]
    - [12, 4820.27]
  - - [14336, 14336, 1, 256]
    - [12, 4786.63]
  - - [17920, 17920, 1, 256]
    - [12, 4820.48]
  - - [11776, 11776, 1, 256]
    - [12, 4774.19]
  - - [16896, 16896, 1, 256]
    - [12, 4798.79]
  - - [39168, 39168, 1, 256]
    - [12, 4898.34]
  - - [4096, 4096, 1, 256]
    - [10, 4721.83]
  - - [12800, 12800, 1, 256]
    - [12, 4789.69]
  - - [44288, 44288, 1, 256]
    - [12, 4886.3]
  - - [5888, 5888, 1, 256]
    - [10, 4723.15]
  - - [40960, 40960, 1, 256]
    - [14, 4698.87]
  - - [27904, 27904, 1, 256]
    - [12, 4885.53]
  - - [34048, 34048, 1, 256]
    - [12, 4881.56]
  - - [22016, 22016, 1, 256]
    - [12, 4811.9]
  - - [40704, 40704, 1, 256]
    - [12, 4884.02]
  - - [16384, 16384, 1, 256]
    - [14, 4721.36]
  - - [33408, 2048, 1, 384]
    - [22, 4946.08]
  - - [39680, 2048, 1, 256]
    - [22, 4863.65]
  - - [36352, 3072, 1, 256]
    - [22, 4838.31]
  - - [11776, 3072, 1, 256]
    - [22, 4765.09]
  - - [4608, 2048, 1, 384]
    - [22, 4877.11]
  - - [9472, 3072, 1, 256]
    - [22, 4822.67]
  - - [11520, 2048, 1, 384]
    - [22, 4839.38]
  - - [2048, 2048, 1, 256]
    - [19, 4666.83]
  - - [1792, 2048, 1, 256]
    - [26, 4516.95]
  - - [34304, 3072, 1, 256]
    - [22, 4819.71]
  - - [17408, 2048, 1, 256]
    - [22, 4782.35]
  - - [5632, 2048, 1, 256]
    - [22, 4730.23]
  - - [6528, 2048, 1, 384]
    - [22, 4832.49]
  - - [38912, 3072, 1, 256]
    - [22, 4825.73]
  - - [9216, 2048, 1, 256]
    - [22, 4753.51]
  - - [30720, 2048, 1, 384]
    - [22, 4925.11]
  - - [20224, 3072, 1, 256]
    - [22, 4821.52]
  - - [20992, 2048, 1, 256]
    - [22, 4800.27]
  - - [2560, 3072, 1, 256]
    - [23, 4516.49]
  - - [7424, 3072, 1, 256]
    - [22, 4783.29]
  - - [24576, 2048, 1, 256]
    - [25, 4711.54]
  - - [25344, 3072, 1, 256]
    - [22, 4857.57]
  - - [26496, 2048, 1, 384]
    - [22, 4952.36]
  - - [9984, 3072, 1, 384]
    - [22, 4846.68]
  - - [14848, 3072, 1, 256]
    - [22, 4778.04]
  - - [12544, 3072, 1, 256]
    - [22, 4825.95]
  - - [43008, 3072, 1, 256]
    - [22, 4824.3]
  - - [42752, 2048, 1, 256]
    - [22, 4868.17]
  - - [42752, 3072, 1, 256]
    - [22, 4884.93]
  - - [3840, 2048, 1, 384]
    - [20, 4763.86]
  - - [3840, 3072, 1, 256]
    - [26, 4646.58]
  - - [30336, 2048, 1, 384]
    - [22, 4934.69]
  - - [39936, 2048, 1, 256]
    - [22, 4814.75]
  - - [7680, 3072, 1, 384]
    - [22, 4826.39]
  - - [30976, 2048, 1, 256]
    - [22, 4854.42]
  - - [19456, 3072, 1, 256]
    - [22, 4809.59]
  - - [23296, 3072, 1, 256]
    - [22, 4840.72]
  - - [1536, 2048, 1, 256]
    - [19, 4665.75]
  - - [20992, 3072, 1, 256]
    - [22, 4798.57]
  - - [28800, 3072, 1, 384]
    - [22, 4966.08]
  - - [42240, 2048, 1, 256]
    - [22, 4866.22]
  - - [7296, 3072, 1, 384]
    - [19, 4816.19]
  - - [32512, 3072, 1, 256]
    - [22, 4863.12]
  - - [27136, 3072, 1, 256]
    - [22, 4804.9]
  - - [16896, 2048, 1, 256]
    - [22, 4794.54]
  - - [20736, 2048, 1, 256]
    - [22, 4800.19]
  - - [14592, 3072, 1, 384]
    - [22, 4943.56]
  - - [39936, 3072, 1, 384]
    - [22, 4941.73]
  - - [4096, 2048, 1, 256]
    - [19, 4686.79]
  - - [37888, 3072, 1, 256]
    - [22, 4829.27]
  - - [35712, 2048, 1, 384]
    - [22, 4966.25]
  - - [4864, 3072, 1, 256]
    - [26, 4656.04]
  - - [25088, 3072, 1, 256]
    - [22, 4801.43]
  - - [10752, 3072, 1, 256]
    - [22, 4750.73]
  - - [36480, 2048, 1, 384]
    - [22, 4948.79]
  - - [24960, 2048, 1, 384]
    - [22, 4931.31]
  - - [25600, 3072, 1, 256]
    - [22, 4809.99]
  - - [15616, 2048, 1, 256]
    - [22, 4769.49]
  - - [34560, 2048, 1, 256]
    - [22, 4844.15]
  - - [22528, 3072, 1, 256]
    - [22, 4799.63]
  - - [41728, 2048, 1, 256]
    - [22, 4864.14]
  - - [22272, 3072, 1, 256]
    - [22, 4840.66]
  - - [6144, 2048, 1, 256]
    - [19, 4721.55]
  - - [39552, 2048, 1, 384]
    - [22, 4954.45]
  - - [16128, 2048, 1, 384]
    - [22, 4889.59]
  - - [24192, 2048, 1, 384]
    - [22, 4904.47]
  - - [44544, 2048, 1, 384]
    - [22, 4925.69]
  - - [11904, 3072, 1, 384]
    - [22, 4945.82]
  - - [34944, 3072, 1, 384]
    - [22, 4966.42]
  - - [26880, 2048, 1, 256]
    - [22, 4835.94]
  - - [10240, 2048, 1, 256]
    - [22, 4742.35]
  - - [9984, 3072, 1, 256]
    - [22, 4752.19]
  - - [9984, 2048, 1, 256]
    - [22, 4715.94]
  - - [34560, 3072, 1, 384]
    - [22, 4962.21]
  - - [41472, 3072, 1, 256]
    - [22, 4833.74]
  - - [13824, 2048, 1, 256]
    - [22, 4777.58]
  - - [30976, 3072, 1, 256]
    - [22, 4885.99]
  - - [21760, 2048, 1, 256]
    - [22, 4812.1]
  - - [43264, 3072, 1, 256]
    - [22, 4895.89]
  - - [31872, 3072, 1, 384]
    - [22, 4949.87]
  - - [6144, 2048, 1, 384]
    - [19, 4874.16]
  - - [33408, 3072, 1, 384]
    - [22, 4982.02]
  - - [36864, 3072, 1, 256]
    - [25, 4737.42]
  - - [28416, 3072, 1, 256]
    - [22, 4862.0]
  - - [29184, 2048, 1, 256]
    - [22, 4810.2]
  - - [21888, 3072, 1, 384]
    - [22, 4930.3]
  - - [26112, 2048, 1, 384]
    - [22, 4922.61]
  - - [15616, 3072, 1, 256]
    - [22, 4849.22]
  - - [40192, 3072, 1, 256]
    - [22, 4891.08]
  - - [13440, 3072, 1, 384]
    - [22, 4897.84]
  - - [35072, 2048, 1, 256]
    - [22, 4857.68]
  - - [21504, 3072, 1, 256]
    - [22, 4794.97]
  - - [22656, 2048, 1, 384]
    - [22, 4897.16]
  - - [768, 3072, 1, 256]
    - [18, 4588.13]
  - - [8832, 2048, 1, 384]
    - [20, 4824.26]
  - - [26112, 3072, 1, 384]
    - [22, 4904.63]
  - - [9984, 2048, 1, 384]
    - [22, 4818.92]
  - - [33024, 2048, 1, 384]
    - [22, 4953.72]
  - - [41472, 2048, 1, 384]
    - [22, 4931.02]
  - - [36096, 2048, 1, 256]
    - [22, 4857.78]
  - - [25728, 3072, 1, 384]
    - [22, 4959.71]
  - - [28032, 3072, 1, 384]
    - [22, 4959.89]
  - - [38144, 3072, 1, 256]
    - [22, 4901.37]
  - - [42496, 2048, 1, 256]
    - [22, 4811.18]
  - - [33792, 3072, 1, 384]
    - [22, 4926.39]
  - - [44160, 2048, 1, 384]
    - [22, 4954.87]
  - - [18176, 3072, 1, 256]
    - [22, 4829.91]
  - - [43520, 2048, 1, 256]
    - [22, 4814.34]
  - - [9216, 3072, 1, 256]
    - [22, 4772.16]
  - - [36864, 2048, 1, 384]
    - [25, 4832.27]
  - - [6400, 2048, 1, 256]
    - [26, 4651.56]
  - - [19968, 2048, 1, 256]
    - [22, 4800.71]
  - - [2560, 2048, 1, 256]
    - [19, 4683.76]
  - - [37888, 2048, 1, 256]
    - [22, 4820.67]
  - - [44288, 3072, 1, 256]
    - [22, 4906.96]
  - - [27648, 3072, 1, 256]
    - [22, 4818.61]
  - - [43392, 3072, 1, 384]
    - [22, 4977.71]
  - - [39552, 3072, 1, 384]
    - [22, 4985.63]
  - - [14336, 3072, 1, 256]
    - [22, 4786.42]
  - - [33280, 3072, 1, 256]
    - [22, 4824.96]
  - - [31488, 3072, 1, 256]
    - [22, 4871.7]
  - - [28928, 2048, 1, 256]
    - [22, 4852.64]
  - - [22784, 3072, 1, 256]
    - [22, 4867.46]
  - - [9728, 2048, 1, 256]
    - [22, 4766.44]
  - - [17664, 2048, 1, 256]
    - [22, 4791.62]
  - - [40960, 3072, 1, 256]
    - [25, 4718.9]
  - - [7936, 3072, 1, 256]
    - [22, 4718.41]
  - - [4352, 3072, 1, 256]
    - [22, 4699.0]
  - - [43776, 3072, 1, 384]
    - [22, 4982.36]
  - - [25088, 2048, 1, 256]
    - [22, 4797.42]
  - - [17152, 2048, 1, 256]
    - [22, 4787.89]
  - - [3840, 2048, 1, 256]
    - [20, 4613.36]
  - - [39936, 3072, 1, 256]
    - [22, 4839.56]
  - - [11520, 3072, 1, 256]
    - [22, 4806.83]
  - - [37120, 2048, 1, 256]
    - [22, 4857.68]
  - - [17408, 3072, 1, 256]
    - [22, 4795.25]
  - - [9216, 2048, 1, 384]
    - [22, 4880.26]
  - - [13056, 3072, 1, 256]
    - [22, 4786.97]
  - - [36864, 3072, 1, 384]
    - [25, 4838.64]
  - - [37632, 2048, 1, 384]
    - [22, 4941.01]
  - - [24832, 3072, 1, 256]
    - [22, 4870.39]
  - - [3584, 3072, 1, 256]
    - [22, 4563.76]
  - - [7680, 2048, 1, 256]
    - [22, 4766.49]
  - - [384, 2048, 1, 384]
    - [16, 4657.46]
  - - [28800, 2048, 1, 384]
    - [22, 4919.69]
  - - [10368, 2048, 1, 384]
    - [20, 4820.71]
  - - [30720, 3072, 1, 256]
    - [22, 4828.64]
  - - [3328, 3072, 1, 256]
    - [22, 4666.33]
  - - [30464, 3072, 1, 256]
    - [22, 4881.2]
  - - [37376, 2048, 1, 256]
    - [22, 4828.75]
  - - [25344, 3072, 1, 384]
    - [22, 4933.15]
  - - [23040, 2048, 1, 256]
    - [22, 4789.4]
  - - [27136, 2048, 1, 256]
    - [22, 4803.86]
  - - [36096, 3072, 1, 256]
    - [22, 4881.27]
  - - [2304, 2048, 1, 256]
    - [20, 4559.72]
  - - [7168, 3072, 1, 256]
    - [19, 4756.45]
  - - [43008, 3072, 1, 384]
    - [22, 4939.42]
  - - [1920, 3072, 1, 384]
    - [22, 4605.01]
  - - [35712, 3072, 1, 384]
    - [22, 4971.03]
  - - [27264, 2048, 1, 384]
    - [22, 4914.94]
  - - [35328, 2048, 1, 384]
    - [22, 4917.23]
  - - [44160, 3072, 1, 384]
    - [22, 4978.61]
  - - [29952, 2048, 1, 256]
    - [22, 4839.53]
  - - [20480, 3072, 1, 256]
    - [25, 4739.95]
  - - [28928, 3072, 1, 256]
    - [22, 4891.75]
  - - [21248, 2048, 1, 256]
    - [22, 4812.14]
  - - [39168, 2048, 1, 256]
    - [22, 4872.02]
  - - [22016, 3072, 1, 256]
    - [22, 4805.63]
  - - [38784, 2048, 1, 384]
    - [22, 4972.42]
  - - [4608, 2048, 1, 256]
    - [19, 4709.77]
  - - [1536, 2048, 1, 384]
    - [19, 4824.13]
  - - [33536, 3072, 1, 256]
    - [22, 4876.64]
  - - [24832, 2048, 1, 256]
    - [22, 4836.67]
  - - [34176, 3072, 1, 384]
    - [22, 4965.21]
  - - [42240, 2048, 1, 384]
    - [22, 4955.24]
  - - [30208, 3072, 1, 256]
    - [22, 4823.2]
  - - [8192, 2048, 1, 256]
    - [19, 4722.25]
  - - [39168, 3072, 1, 384]
    - [22, 4974.31]
  - - [31488, 2048, 1, 256]
    - [22, 4853.02]
  - - [28160, 3072, 1, 256]
    - [22, 4830.47]
  - - [8960, 3072, 1, 256]
    - [22, 4727.0]
  - - [5376, 3072, 1, 384]
    - [22, 4845.8]
  - - [3584, 2048, 1, 256]
    - [19, 4697.16]
  - - [16896, 2048, 1, 384]
    - [22, 4902.01]
  - - [12672, 2048, 1, 384]
    - [22, 4909.79]
  - - [34944, 2048, 1, 384]
    - [22, 4938.71]
  - - [1152, 3072, 1, 384]
    - [24, 4499.86]
  - - [26368, 3072, 1, 256]
    - [22, 4860.56]
  - - [256, 2048, 1, 256]
    - [24, 4117.11]
  - - [36864, 2048, 1, 256]
    - [25, 4726.68]
  - - [18944, 2048, 1, 256]
    - [22, 4783.8]
  - - [768, 2048, 1, 384]
    - [20, 4674.77]
  - - [14592, 2048, 1, 256]
    - [22, 4776.74]
  - - [8448, 3072, 1, 384]
    - [22, 4912.88]
  - - [19584, 2048, 1, 384]
    - [22, 4895.59]
  - - [35072, 3072, 1, 256]
    - [22, 4886.37]
  - - [14208, 3072, 1, 384]
    - [22, 4925.55]
  - - [22272, 3072, 1, 384]
    - [22, 4931.97]
  - - [39424, 3072, 1, 256]
    - [22, 4833.22]
  - - [41216, 2048, 1, 256]
    - [22, 4873.37]
  - - [25856, 2048, 1, 256]
    - [22, 4839.98]
  - - [26880, 2048, 1, 384]
    - [22, 4922.08]
  - - [16384, 3072, 1, 256]
    - [25, 4696.29]
  - - [28032, 2048, 1, 384]
    - [22, 4971.25]
  - - [38144, 2048, 1, 256]
    - [22, 4868.61]
  - - [16128, 3072, 1, 256]
    - [22, 4828.1]
  - - [19200, 3072, 1, 384]
    - [22, 4917.56]
  - - [512, 2048, 1, 256]
    - [22, 4555.95]
  - - [13824, 2048, 1, 384]
    - [22, 4909.26]
  - - [4352, 2048, 1, 256]
    - [26, 4595.77]
  - - [23296, 2048, 1, 256]
    - [22, 4817.4]
  - - [19968, 3072, 1, 256]
    - [22, 4794.85]
  - - [4224, 3072, 1, 384]
    - [20, 4708.08]
  - - [44288, 2048, 1, 256]
    - [22, 4868.27]
  - - [41472, 2048, 1, 256]
    - [22, 4827.09]
  - - [4992, 2048, 1, 384]
    - [20, 4817.5]
  - - [31744, 2048, 1, 256]
    - [22, 4820.88]
  - - [13568, 3072, 1, 256]
    - [22, 4827.33]
  - - [40704, 3072, 1, 256]
    - [22, 4882.4]
  - - [28416, 3072, 1, 384]
    - [22, 4944.27]
  - - [3072, 2048, 1, 256]
    - [19, 4677.13]
  - - [36480, 3072, 1, 384]
    - [22, 4981.48]
  - - [29184, 2048, 1, 384]
    - [22, 4918.71]
  - - [23808, 2048, 1, 256]
    - [22, 4833.22]
  - - [6144, 3072, 1, 256]
    - [19, 4756.88]
  - - [21504, 3072, 1, 384]
    - [22, 4930.34]
  - - [40448, 2048, 1, 256]
    - [22, 4830.58]
  - - [5888, 3072, 1, 256]
    - [26, 4662.04]
  - - [768, 3072, 1, 384]
    - [18, 4768.27]
  - - [31232, 2048, 1, 256]
    - [22, 4813.51]
  - - [10496, 2048, 1, 256]
    - [22, 4732.65]
  - - [36096, 2048, 1, 384]
    - [22, 4956.78]
  - - [10368, 3072, 1, 384]
    - [22, 4877.5]
  - - [18432, 3072, 1, 384]
    - [22, 4910.02]
  - - [8064, 2048, 1, 384]
    - [22, 4849.21]
  - - [2816, 3072, 1, 256]
    - [26, 4617.98]
  - - [2688, 2048, 1, 384]
    - [20, 4804.83]
  - - [6912, 3072, 1, 256]
    - [26, 4689.62]
  - - [41216, 3072, 1, 256]
    - [22, 4883.72]
  - - [5376, 2048, 1, 256]
    - [20, 4634.6]
  - - [15360, 3072, 1, 256]
    - [22, 4809.99]
  - - [37632, 2048, 1, 256]
    - [22, 4856.27]
  - - [28672, 3072, 1, 256]
    - [25, 4732.06]
  - - [27648, 3072, 1, 384]
    - [22, 4909.65]
  - - [34304, 2048, 1, 256]
    - [22, 4808.57]
  - - [12032, 3072, 1, 256]
    - [22, 4761.76]
  - - [31488, 3072, 1, 384]
    - [22, 4946.18]
  - - [12800, 2048, 1, 256]
    - [22, 4766.54]
  - - [18816, 3072, 1, 384]
    - [22, 4918.7]
  - - [43776, 2048, 1, 256]
    - [22, 4863.55]
  - - [17664, 2048, 1, 384]
    - [22, 4891.95]
  - - [5120, 3072, 1, 256]
    - [19, 4748.28]
  - - [5376, 3072, 1, 256]
    - [22, 4734.24]
  - - [40320, 3072, 1, 384]
    - [22, 4983.12]
  - - [42496, 3072, 1, 256]
    - [22, 4833.26]
  - - [24576, 2048, 1, 384]
    - [25, 4818.74]
  - - [11776, 2048, 1, 256]
    - [22, 4763.18]
  - - [19712, 2048, 1, 256]
    - [22, 4803.21]
  - - [11520, 3072, 1, 384]
    - [22, 4905.98]
  - - [23552, 2048, 1, 256]
    - [22, 4788.44]
  - - [12288, 2048, 1, 384]
    - [25, 4813.37]
  - - [512, 3072, 1, 256]
    - [18, 4432.55]
  - - [1792, 3072, 1, 256]
    - [18, 4604.32]
  - - [13056, 3072, 1, 384]
    - [22, 4887.38]
  - - [21120, 3072, 1, 384]
    - [22, 4982.09]
  - - [11136, 3072, 1, 384]
    - [22, 4913.37]
  - - [10496, 3072, 1, 256]
    - [22, 4811.27]
  - - [32640, 2048, 1, 384]
    - [22, 4965.18]
  - - [11264, 3072, 1, 256]
    - [22, 4779.33]
  - - [30720, 3072, 1, 384]
    - [22, 4936.42]
  - - [15104, 3072, 1, 256]
    - [22, 4810.58]
  - - [33024, 3072, 1, 256]
    - [22, 4888.31]
  - - [14976, 2048, 1, 384]
    - [22, 4864.06]
  - - [23040, 2048, 1, 384]
    - [22, 4900.32]
  - - [14208, 2048, 1, 384]
    - [22, 4909.08]
  - - [1280, 2048, 1, 256]
    - [24, 4485.9]
  - - [37248, 2048, 1, 384]
    - [22, 4968.8]
  - - [2304, 2048, 1, 384]
    - [20, 4738.35]
  - - [24576, 3072, 1, 256]
    - [25, 4707.71]
  - - [9600, 3072, 1, 384]
    - [22, 4834.55]
  - - [25344, 2048, 1, 256]
    - [22, 4850.12]
  - - [18176, 2048, 1, 256]
    - [22, 4793.11]
  - - [8704, 2048, 1, 256]
    - [22, 4755.73]
  - - [35584, 2048, 1, 256]
    - [22, 4858.72]
  - - [12544, 2048, 1, 256]
    - [22, 4740.57]
  - - [29952, 3072, 1, 256]
    - [22, 4884.51]
  - - [29952, 2048, 1, 384]
    - [22, 4934.03]
  - - [44032, 2048, 1, 256]
    - [22, 4817.99]
  - - [1024, 3072, 1, 256]
    - [19, 4672.24]
  - - [44800, 2048, 1, 256]
    - [22, 4864.22]
  - - [3840, 3072, 1, 384]
    - [18, 4776.72]
  - - [6912, 2048, 1, 256]
    - [26, 4661.31]
  - - [7680, 2048, 1, 384]
    - [22, 4882.47]
  - - [35328, 3072, 1, 256]
    - [22, 4822.86]
  - - [29568, 3072, 1, 384]
    - [22, 4983.53]
  - - [29696, 2048, 1, 256]
    - [22, 4809.91]
  - - [12288, 2048, 1, 256]
    - [25, 4705.14]
  - - [38656, 3072, 1, 256]
    - [22, 4880.02]
  - - [39424, 2048, 1, 256]
    - [22, 4837.61]
  - - [32000, 2048, 1, 256]
    - [22, 4846.34]
  - - [19456, 2048, 1, 256]
    - [22, 4788.01]
  - - [34816, 3072, 1, 256]
    - [22, 4815.79]
  - - [14080, 3072, 1, 256]
    - [22, 4802.81]
  - - [34176, 2048, 1, 384]
    - [22, 4972.57]
  - - [40704, 2048, 1, 384]
    - [22, 4936.1]
  - - [44544, 3072, 1, 256]
    - [22, 4831.9]
  - - [3456, 2048, 1, 384]
    - [20, 4804.35]
  - - [7296, 2048, 1, 384]
    - [20, 4847.11]
  - - [11008, 3072, 1, 256]
    - [22, 4776.78]
  - - [18688, 2048, 1, 256]
    - [22, 4797.16]
  - - [16896, 3072, 1, 256]
    - [22, 4793.98]
  - - [40704, 2048, 1, 256]
    - [22, 4864.57]
  - - [13568, 2048, 1, 256]
    - [22, 4755.43]
  - - [14592, 2048, 1, 384]
    - [22, 4872.72]
  - - [4096, 3072, 1, 256]
    - [19, 4732.1]
  - - [33024, 2048, 1, 256]
    - [22, 4868.99]
  - - [4864, 2048, 1, 256]
    - [26, 4636.96]
  - - [40448, 3072, 1, 256]
    - [22, 4840.39]
  - - [5760, 2048, 1, 384]
    - [20, 4822.49]
  - - [26112, 2048, 1, 256]
    - [22, 4798.54]
  - - [35840, 2048, 1, 256]
    - [22, 4812.06]
  - - [8448, 2048, 1, 256]
    - [22, 4678.86]
  - - [42624, 2048, 1, 384]
    - [22, 4957.17]
  - - [13312, 3072, 1, 256]
    - [22, 4795.43]
  - - [32256, 2048, 1, 384]
    - [22, 4941.91]
  - - [24320, 2048, 1, 256]
    - [22, 4817.04]
  - - [16128, 3072, 1, 384]
    - [22, 4908.97]
  - - [6912, 3072, 1, 384]
    - [20, 4786.97]
  - - [24192, 3072, 1, 384]
    - [22, 4974.95]
  - - [30208, 2048, 1, 256]
    - [22, 4819.17]
  - - [41088, 2048, 1, 384]
    - [22, 4939.95]
  - - [27904, 2048, 1, 256]
    - [22, 4853.94]
  - - [10240, 3072, 1, 256]
    - [22, 4750.74]
  - - [2304, 3072, 1, 256]
    - [18, 4618.06]
  - - [37632, 3072, 1, 256]
    - [22, 4870.11]
  - - [19200, 2048, 1, 256]
    - [22, 4814.78]
  - - [11904, 2048, 1, 384]
    - [20, 4822.24]
  - - [44928, 2048, 1, 384]
    - [22, 4960.56]
  - - [3072, 3072, 1, 384]
    - [19, 4861.41]
  - - [21760, 3072, 1, 256]
    - [22, 4863.3]
  - - [23808, 2048, 1, 384]
    - [22, 4916.14]
  - - [43776, 3072, 1, 256]
    - [22, 4879.1]
  - - [39168, 2048, 1, 384]
    - [22, 4957.01]
  - - [6144, 3072, 1, 384]
    - [19, 4887.24]
  - - [23552, 3072, 1, 256]
    - [22, 4810.43]
  - - [32640, 3072, 1, 384]
    - [22, 4983.1]
  - - [39680, 3072, 1, 256]
    - [22, 4883.82]
  - - [29184, 3072, 1, 256]
    - [22, 4819.15]
  - - [9472, 2048, 1, 256]
    - [22, 4713.07]
  - - [21504, 2048, 1, 256]
    - [22, 4792.77]
  - - [15360, 3072, 1, 384]
    - [22, 4924.45]
  - - [38400, 2048, 1, 384]
    - [22, 4932.1]
  - - [768, 2048, 1, 256]
    - [20, 4503.95]
  - - [18048, 2048, 1, 384]
    - [22, 4883.62]
  - - [42240, 3072, 1, 256]
    - [22, 4890.43]
  - - [5632, 3072, 1, 256]
    - [19, 4661.72]
  - - [41472, 3072, 1, 384]
    - [22, 4929.81]
  - - [6528, 3072, 1, 384]
    - [20, 4774.78]
  - - [5376, 2048, 1, 384]
    - [20, 4745.29]
  - - [25728, 2048, 1, 384]
    - [22, 4917.07]
  - - [33792, 2048, 1, 384]
    - [22, 4930.53]
  - - [41856, 3072, 1, 384]
    - [22, 4985.67]
  - - [41984, 2048, 1, 256]
    - [22, 4817.12]
  - - [20224, 2048, 1, 256]
    - [22, 4798.45]
  - - [6656, 2048, 1, 256]
    - [19, 4753.8]
  - - [16512, 3072, 1, 384]
    - [22, 4912.38]
  - - [7424, 2048, 1, 256]
    - [22, 4653.66]
  - - [37248, 3072, 1, 384]
    - [22, 4979.81]
  - - [27648, 2048, 1, 256]
    - [22, 4814.32]
  - - [31104, 2048, 1, 384]
    - [22, 4970.95]
  - - [9600, 2048, 1, 384]
    - [22, 4866.42]
  - - [32768, 3072, 1, 256]
    - [25, 4670.28]
  - - [14848, 2048, 1, 256]
    - [22, 4791.49]
  - - [8448, 3072, 1, 256]
    - [22, 4776.13]
  - - [35584, 3072, 1, 256]
    - [22, 4873.88]
  - - [17664, 3072, 1, 256]
    - [22, 4858.69]
  - - [43008, 2048, 1, 256]
    - [22, 4811.5]
  - - [44032, 3072, 1, 256]
    - [22, 4830.41]
  - - [34816, 2048, 1, 256]
    - [22, 4815.66]
  - - [29568, 2048, 1, 384]
    - [22, 4951.47]
  - - [43776, 2048, 1, 384]
    - [22, 4970.02]
  - - [43264, 2048, 1, 256]
    - [22, 4871.54]
  - - [42624, 3072, 1, 384]
    - [22, 5001.32]
  - - [16640, 2048, 1, 256]
    - [22, 4794.66]
  - - [3328, 2048, 1, 256]
    - [26, 4597.48]
  - - [38656, 2048, 1, 256]
    - [22, 4864.05]
  - - [12288, 3072, 1, 256]
    - [25, 4711.79]
  - - [34048, 3072, 1, 256]
    - [22, 4879.67]
  - - [13056, 2048, 1, 256]
    - [22, 4750.12]
  - - [1536, 3072, 1, 256]
    - [18, 4533.03]
  - - [32256, 2048, 1, 256]
    - [22, 4815.01]
  - - [33792, 2048, 1, 256]
    - [22, 4817.69]
  - - [32768, 2048, 1, 256]
    - [25, 4646.48]
  - - [24576, 3072, 1, 384]
    - [25, 4837.81]
  - - [29696, 3072, 1, 256]
    - [22, 4837.07]
  - - [32512, 2048, 1, 256]
    - [22, 4842.03]
  - - [30336, 3072, 1, 384]
    - [22, 4990.17]
  - - [25344, 2048, 1, 384]
    - [22, 4926.05]
  - - [19968, 2048, 1, 384]
    - [22, 4909.62]
  - - [23040, 3072, 1, 256]
    - [22, 4810.6]
  - - [18688, 3072, 1, 256]
    - [22, 4855.39]
  - - [20736, 3072, 1, 256]
    - [22, 4857.87]
  - - [35328, 3072, 1, 384]
    - [22, 4921.97]
  - - [19584, 3072, 1, 384]
    - [22, 4928.0]
  - - [7168, 2048, 1, 256]
    - [22, 4741.97]
  - - [27392, 2048, 1, 256]
    - [22, 4843.49]
  - - [256, 3072, 1, 256]
    - [18, 4434.53]
  - - [10752, 2048, 1, 256]
    - [22, 4787.31]
  - - [41728, 3072, 1, 256]
    - [22, 4870.51]
  - - [15872, 2048, 1, 256]
    - [22, 4788.98]
  - - [29440, 2048, 1, 256]
    - [22, 4846.6]
  - - [24960, 3072, 1, 384]
    - [22, 4943.33]
  - - [35840, 3072, 1, 256]
    - [22, 4827.42]
  - - [33024, 3072, 1, 384]
    - [22, 4979.83]
  - - [22528, 2048, 1, 256]
    - [22, 4782.55]
  - - [38784, 3072, 1, 384]
    - [22, 4977.3]
  - - [32256, 3072, 1, 384]
    - [22, 4928.43]
  - - [44928, 3072, 1, 384]
    - [22, 4994.28]
  - - [4608, 3072, 1, 256]
    - [22, 4629.39]
  - - [44544, 3072, 1, 384]
    - [22, 4941.28]
  - - [26880, 3072, 1, 256]
    - [22, 4875.94]
  - - [42240, 3072, 1, 384]
    - [22, 4964.28]
  - - [8192, 3072, 1, 256]
    - [19, 4731.96]
  - - [8960, 2048, 1, 256]
    - [22, 4683.95]
  - - [34560, 2048, 1, 384]
    - [22, 4934.06]
  - - [13824, 3072, 1, 256]
    - [22, 4776.65]
  - - [16896, 3072, 1, 384]
    - [22, 4902.78]
  - - [14336, 2048, 1, 256]
    - [22, 4743.16]
  - - [40960, 2048, 1, 256]
    - [25, 4696.8]
  - - [11008, 2048, 1, 256]
    - [22, 4716.56]
  - - [1152, 2048, 1, 384]
    - [16, 4773.3]
  - - [2048, 3072, 1, 256]
    - [19, 4703.9]
  - - [37376, 3072, 1, 256]
    - [22, 4847.61]
  - - [28416, 2048, 1, 256]
    - [22, 4832.25]
  - - [15744, 2048, 1, 384]
    - [22, 4930.01]
  - - [18944, 3072, 1, 256]
    - [22, 4790.79]
  - - [16640, 3072, 1, 256]
    - [22, 4845.04]
  - - [43392, 2048, 1, 384]
    - [22, 4979.56]
  - - [8448, 2048, 1, 384]
    - [22, 4795.16]
  - - [43520, 3072, 1, 256]
    - [22, 4830.63]
  - - [16512, 2048, 1, 384]
    - [20, 4860.53]
  - - [17280, 3072, 1, 384]
    - [22, 4950.74]
  - - [17920, 3072, 1, 256]
    - [22, 4796.18]
  - - [25856, 3072, 1, 256]
    - [22, 4873.51]
  - - [18432, 2048, 1, 256]
    - [22, 4773.61]
  - - [11136, 2048, 1, 384]
    - [22, 4890.18]
  - - [19200, 2048, 1, 384]
    - [22, 4906.78]
  - - [22016, 2048, 1, 256]
    - [22, 4802.04]
  - - [41856, 2048, 1, 384]
    - [22, 4979.27]
  - - [38016, 2048, 1, 384]
    - [22, 4962.1]
  - - [38400, 2048, 1, 256]
    - [22, 4812.25]
  - - [6400, 3072, 1, 256]
    - [22, 4743.27]
  - - [25600, 2048, 1, 256]
    - [22, 4787.62]
  - - [44800, 3072, 1, 256]
    - [22, 4899.84]
  - - [36608, 3072, 1, 256]
    - [22, 4878.53]
  - - [31104, 3072, 1, 384]
    - [22, 4952.07]
  - - [9728, 3072, 1, 256]
    - [22, 4745.45]
  - - [44544, 2048, 1, 256]
    - [22, 4830.54]
  - - [29184, 3072, 1, 384]
    - [22, 4923.67]
  - - [23808, 3072, 1, 256]
    - [22, 4883.67]
  - - [26624, 3072, 1, 256]
    - [22, 4807.99]
  - - [13440, 2048, 1, 384]
    - [20, 4844.12]
  - - [21504, 2048, 1, 384]
    - [22, 4910.64]
  - - [7936, 2048, 1, 256]
    - [26, 4670.18]
  - - [2304, 3072, 1, 384]
    - [18, 4774.64]
  - - [41984, 3072, 1, 256]
    - [22, 4842.23]
  - - [31232, 3072, 1, 256]
    - [22, 4831.41]
  - - [11520, 2048, 1, 256]
    - [22, 4724.21]
  - - [36096, 3072, 1, 384]
    - [22, 4979.03]
  - - [15360, 2048, 1, 256]
    - [22, 4775.31]
  - - [9216, 3072, 1, 384]
    - [22, 4890.01]
  - - [38400, 3072, 1, 384]
    - [22, 4924.68]
  - - [2816, 2048, 1, 256]
    - [26, 4600.52]
  - - [41088, 3072, 1, 384]
    - [22, 4993.58]
  - - [37632, 3072, 1, 384]
    - [22, 4969.82]
  - - [7680, 3072, 1, 256]
    - [22, 4711.53]
  - - [20736, 2048, 1, 384]
    - [22, 4901.91]
  - - [384, 3072, 1, 384]
    - [17, 4145.18]
  - - [30720, 2048, 1, 256]
    - [22, 4812.18]
  - - [32256, 3072, 1, 256]
    - [22, 4815.67]
  - - [27648, 2048, 1, 384]
    - [22, 4914.72]
  - - [30464, 2048, 1, 256]
    - [22, 4849.68]
  - - [31488, 2048, 1, 384]
    - [22, 4943.0]
  - - [17920, 2048, 1, 256]
    - [22, 4781.4]
  - - [19968, 3072, 1, 384]
    - [22, 4905.92]
  - - [18816, 2048, 1, 384]
    - [22, 4939.95]
  - - [17664, 3072, 1, 384]
    - [22, 4948.41]
  - - [5120, 2048, 1, 256]
    - [19, 4710.73]
  - - [43008, 2048, 1, 384]
    - [22, 4925.75]
  - - [1920, 2048, 1, 384]
    - [16, 4793.5]
  - - [36352, 2048, 1, 256]
    - [22, 4824.47]
  - - [27904, 3072, 1, 256]
    - [22, 4880.01]
  - - [4608, 3072, 1, 384]
    - [22, 4755.92]
  - - [27264, 3072, 1, 384]
    - [22, 4985.52]
  - - [18432, 3072, 1, 256]
    - [22, 4798.26]
  - - [19712, 3072, 1, 256]
    - [22, 4848.61]
  - - [29440, 3072, 1, 256]
    - [22, 4875.34]
  - - [39168, 3072, 1, 256]
    - [22, 4894.65]
  - - [17152, 3072, 1, 256]
    - [22, 4817.26]
  - - [12288, 3072, 1, 384]
    - [25, 4828.37]
  - - [10752, 3072, 1, 384]
    - [22, 4855.08]
  - - [20352, 3072, 1, 384]
    - [22, 4956.45]
  - - [13056, 2048, 1, 384]
    - [22, 4854.14]
  - - [20480, 2048, 1, 256]
    - [25, 4710.64]
  - - [21120, 2048, 1, 384]
    - [22, 4893.95]
  - - [1536, 3072, 1, 384]
    - [18, 4705.37]
  - - [11264, 2048, 1, 256]
    - [22, 4739.95]
  - - [33536, 2048, 1, 256]
    - [22, 4865.66]
  - - [15104, 2048, 1, 256]
    - [22, 4786.08]
  - - [33792, 3072, 1, 256]
    - [22, 4829.42]
  - - [8832, 3072, 1, 384]
    - [22, 4916.6]
  - - [23040, 3072, 1, 384]
    - [22, 4916.7]
  - - [12672, 3072, 1, 384]
    - [22, 4864.03]
  - - [24064, 3072, 1, 256]
    - [22, 4811.64]
  - - [20736, 3072, 1, 384]
    - [22, 4957.77]
  - - [26624, 2048, 1, 256]
    - [22, 4794.29]
  - - [1280, 3072, 1, 256]
    - [18, 4609.14]
  - - [26368, 2048, 1, 256]
    - [22, 4850.62]
  - - [8704, 3072, 1, 256]
    - [22, 4746.3]
  - - [10752, 2048, 1, 384]
    - [22, 4893.36]
  - - [14592, 3072, 1, 256]
    - [22, 4844.17]
  - - [29952, 3072, 1, 384]
    - [22, 4963.88]
  - - [1024, 2048, 1, 256]
    - [19, 4632.99]
  - - [23424, 3072, 1, 384]
    - [22, 4964.09]
  - - [12800, 3072, 1, 256]
    - [22, 4752.85]
  - - [22272, 2048, 1, 384]
    - [22, 4908.38]
  - - [21248, 3072, 1, 256]
    - [22, 4841.33]
  - - [32000, 3072, 1, 256]
    - [22, 4887.72]
  - - [26880, 3072, 1, 384]
    - [22, 4973.93]
  - - [28160, 2048, 1, 256]
    - [22, 4816.96]
  - - [16384, 2048, 1, 256]
    - [25, 4669.57]
  - - [16128, 2048, 1, 256]
    - [22, 4791.11]
  - - [40704, 3072, 1, 384]
    - [22, 4963.5]
  - - [15360, 2048, 1, 384]
    - [22, 4915.85]
  - - [27392, 3072, 1, 256]
    - [22, 4878.12]
  - - [6656, 3072, 1, 256]
    - [19, 4697.82]
  - - [13824, 3072, 1, 384]
    - [22, 4881.78]
  - - [3456, 3072, 1, 384]
    - [21, 4695.78]
  - - [3072, 3072, 1, 256]
    - [19, 4716.39]
  - - [38400, 3072, 1, 256]
    - [22, 4819.57]
  - - [4224, 2048, 1, 384]
    - [20, 4815.46]
  - - [4992, 3072, 1, 384]
    - [22, 4816.79]
  - - [38912, 2048, 1, 256]
    - [22, 4807.82]
  - - [17280, 2048, 1, 384]
    - [22, 4905.98]
  - - [28416, 2048, 1, 384]
    - [22, 4943.17]
  - - [15872, 3072, 1, 256]
    - [22, 4802.57]
  - - [22272, 2048, 1, 256]
    - [22, 4821.93]
  - - [40192, 2048, 1, 256]
    - [22, 4876.52]
  - - [22784, 2048, 1, 256]
    - [22, 4815.37]
  - - [39936, 2048, 1, 384]
    - [22, 4930.21]
  - - [22656, 3072, 1, 384]
    - [22, 4942.3]
  - - [3072, 2048, 1, 384]
    - [19, 4843.47]
  - - [33280, 2048, 1, 256]
    - [22, 4810.89]
  - - [5888, 2048, 1, 256]
    - [26, 4643.52]
  - - [6912, 2048, 1, 384]
    - [20, 4773.8]
  - - [5760, 3072, 1, 384]
    - [22, 4893.41]
  - - [40320, 2048, 1, 384]
    - [22, 4975.52]
  - - [34048, 2048, 1, 256]
    - [22, 4849.55]
  - - [34560, 3072, 1, 256]
    - [22, 4871.83]
  - - [35328, 2048, 1, 256]
    - [22, 4826.38]
  - - [13312, 2048, 1, 256]
    - [22, 4766.13]
  - - [18432, 2048, 1, 384]
    - [22, 4892.38]
  - - [24320, 3072, 1, 256]
    - [22, 4841.31]
  - - [18048, 3072, 1, 384]
    - [22, 4970.52]
  - - [26496, 3072, 1, 384]
    - [22, 4964.14]
  - - [2688, 3072, 1, 384]
    - [22, 4811.98]
  - - [21888, 2048, 1, 384]
    - [22, 4942.31]
  - - [20352, 2048, 1, 384]
    - [22, 4945.59]
  - - [31744, 3072, 1, 256]
    - [22, 4820.19]
  - - [28672, 2048, 1, 256]
    - [25, 4720.52]
  - - [8064, 3072, 1, 384]
    - [22, 4871.41]
  - - [19200, 3072, 1, 256]
    - [22, 4815.08]
  - - [12032, 2048, 1, 256]
    - [22, 4728.25]
  - - [37120, 3072, 1, 256]
    - [22, 4891.95]
  - - [14080, 2048, 1, 256]
    - [22, 4764.67]
  - - [14976, 3072, 1, 384]
    - [22, 4954.19]
  - - [24064, 2048, 1, 256]
    - [22, 4815.9]
  - - [23424, 2048, 1, 384]
    - [22, 4954.23]
  - - [36608, 2048, 1, 256]
    - [22, 4855.39]
  - - [38016, 3072, 1, 384]
    - [22, 4974.33]
  - - [15744, 3072, 1, 384]
    - [22, 4910.17]
  - - [23808, 3072, 1, 384]
    - [22, 4968.14]
  - - [26112, 3072, 1, 256]
    - [22, 4814.04]
  - - [31872, 2048, 1, 384]
    - [22, 4934.6]
- - - -1
    - - - -1
        - - - 1
            - - [-1, 1]
          - - -1
            - - [1, 1]
              - [-1, 0]
