library/src/blas3/Tensile/Logic/asm_full/vega20_Cijk_Ailk_Bljk_HB.yaml
- {MinimumRequiredVersion: 4.3.0}
- vega20
- gfx906
- [Device 66a0, Device 66a7]
    SolutionIndex: 0
    SolutionNameMin: Cijk_Ailk_Bljk_HB_MT064x016x32_PGR1_PLR1_TT02_02
    SolutionIndex: 1
    SolutionNameMin: Cijk_Ailk_Bljk_HB_MT064x064x16_PGR1_PLR1_TT04_04
    SolutionIndex: 2
    SolutionNameMin: Cijk_Ailk_Bljk_HB_MT128x128x16_PGR1_PLR1_TT08_08
    SolutionIndex: 3
    SolutionNameMin: Cijk_Ailk_Bljk_HB_MT016x016x08_PGR1_PLR1_TT02_02
    SolutionIndex: 4
    SolutionNameMin: Cijk_Ailk_Bljk_HB_MT032x008x32_PGR1_PLR1_TT02_02
    SolutionIndex: 5
    SolutionNameMin: Cijk_Ailk_Bljk_HB_MT256x064x08_PGR1_PLR1_TT08_08
    SolutionIndex: 6
    SolutionNameMin: Cijk_Ailk_Bljk_HB_MT032x032x16_PGR1_PLR1_TT04_04
    SolutionIndex: 7
    SolutionNameMin: Cijk_Ailk_Bljk_HB_MT032x016x16_PGR1_PLR1_TT02_02
    SolutionIndex: 8
    SolutionNameMin: Cijk_Ailk_Bljk_HB_MT064x016x16_PGR1_PLR1_TT04_02
    SolutionIndex: 9
    SolutionNameMin: Cijk_Ailk_Bljk_HB_MT064x008x32_PGR1_PLR1_TT02_02
    SolutionIndex: 10
    SolutionNameMin: Cijk_Ailk_Bljk_HB_MT048x032x24_PGR1_PLR1_TT06_04
    SolutionIndex: 11
    SolutionNameMin: Cijk_Ailk_Bljk_HB_MT032x032x24_PGR1_PLR1_TT04_04
    SolutionIndex: 12
    SolutionNameMin: Cijk_Ailk_Bljk_HB_MT032x016x16_PGR1_PLR1_TT02_02
    SolutionIndex: 13
    SolutionNameMin: Cijk_Ailk_Bljk_HB_MT032x008x32_PGR1_PLR1_TT02_02
    SolutionIndex: 14
    SolutionNameMin: Cijk_Ailk_Bljk_HB_MT032x016x24_PGR1_PLR1_TT04_02
    SolutionIndex: 15
    SolutionNameMin: Cijk_Ailk_Bljk_HB_MT064x016x32_PGR1_PLR1_TT04_02
    SolutionIndex: 16
    SolutionNameMin: Cijk_Ailk_Bljk_HB_MT064x008x32_PGR1_PLR1_TT02_02
    SolutionIndex: 17
    SolutionNameMin: Cijk_Ailk_Bljk_HB_MT128x032x32_PGR1_PLR1_TT04_04
    SolutionIndex: 18
    SolutionNameMin: Cijk_Ailk_Bljk_HB_MT064x016x16_PGR1_PLR1_TT04_02
    SolutionIndex: 19
    SolutionNameMin: Cijk_Ailk_Bljk_HB_MT016x016x16_PGR1_PLR1_TT02_02
    SolutionIndex: 20
    SolutionNameMin: Cijk_Ailk_Bljk_HB_MT064x016x16_PGR1_PLR1_TT04_04
    SolutionIndex: 21
    SolutionNameMin: Cijk_Ailk_Bljk_HB_MT064x016x32_PGR1_PLR1_TT02_02
    SolutionIndex: 22
    SolutionNameMin: Cijk_Ailk_Bljk_HB_MT128x032x16_PGR1_PLR1_TT04_04
    SolutionIndex: 23
    SolutionNameMin: Cijk_Ailk_Bljk_HB_MT128x064x32_PGR0_PLR1_TT08_04
    SolutionIndex: 24
    SolutionNameMin: Cijk_Ailk_Bljk_HB_MT064x128x16_PGR1_PLR1_TT04_08
    SolutionIndex: 25
    SolutionNameMin: Cijk_Ailk_Bljk_HB_MT064x064x16_PGR1_PLR1_TT04_04
    SolutionIndex: 26
    SolutionNameMin: Cijk_Ailk_Bljk_HB_MT128x064x16_PGR1_PLR1_TT08_04
    SolutionIndex: 27
    SolutionNameMin: Cijk_Ailk_Bljk_HB_MT128x128x32_PGR0_PLR1_TT08_08
    SolutionIndex: 28
    SolutionNameMin: Cijk_Ailk_Bljk_HB_MT128x128x32_PGR1_PLR1_TT08_08
    SolutionIndex: 29
    SolutionNameMin: Cijk_Ailk_Bljk_HB_MT128x064x32_PGR1_PLR1_TT08_04
    SolutionIndex: 30
    SolutionNameMin: Cijk_Ailk_Bljk_HB_MT064x064x16_PGR0_PLR1_TT08_08
    SolutionIndex: 31
    SolutionNameMin: Cijk_Ailk_Bljk_HB_MT128x064x08_PGR1_PLR1_TT08_04
    SolutionIndex: 32
    SolutionNameMin: Cijk_Ailk_Bljk_HB_MT128x128x16_PGR1_PLR1_TT08_08
    SolutionIndex: 33
    SolutionNameMin: Cijk_Ailk_Bljk_HB_MT064x128x16_PGR1_PLR1_TT04_08
    SolutionIndex: 34
    SolutionNameMin: Cijk_Ailk_Bljk_HB_MT128x064x32_PGR1_PLR1_TT04_04
    SolutionIndex: 35
    SolutionNameMin: Cijk_Ailk_Bljk_HB_MT128x064x16_PGR1_PLR1_TT04_08
    SolutionIndex: 36
    SolutionNameMin: Cijk_Ailk_Bljk_HB_MT128x064x16_PGR1_PLR1_TT08_04
    SolutionIndex: 37
    SolutionNameMin: Cijk_Ailk_Bljk_HB_MT256x064x16_PGR1_PLR1_TT08_04
    SolutionIndex: 38
    SolutionNameMin: Cijk_Ailk_Bljk_HB_MT128x064x16_PGR1_PLR1_TT08_04
    SolutionIndex: 39
    SolutionNameMin: Cijk_Ailk_Bljk_HB_MT064x064x16_PGR1_PLR0_TT04_04
    SolutionIndex: 40
    SolutionNameMin: Cijk_Ailk_Bljk_HB_MT256x032x16_PGR0_PLR0_TT08_04
    SolutionIndex: 41
    SolutionNameMin: Cijk_Ailk_Bljk_HB_MT064x128x16_PGR0_PLR0_TT04_08
    SolutionIndex: 42
    SolutionNameMin: Cijk_Ailk_Bljk_HB_MT128x064x16_PGR0_PLR0_TT04_08
    SolutionIndex: 43
    SolutionNameMin: Cijk_Ailk_Bljk_HB_MT128x064x16_PGR0_PLR0_TT08_04
    SolutionIndex: 44
    SolutionNameMin: Cijk_Ailk_Bljk_HB_MT064x128x08_PGR0_PLR0_TT04_08
    SolutionIndex: 45
    SolutionNameMin: Cijk_Ailk_Bljk_HB_MT064x064x08_PGR1_PLR1_TT04_04
    SolutionIndex: 46
    SolutionNameMin: Cijk_Ailk_Bljk_HB_MT064x064x16_PGR1_PLR1_TT04_04
    SolutionIndex: 47
    SolutionNameMin: Cijk_Ailk_Bljk_HB_MT064x128x04_PGR0_PLR0_TT04_08
    SolutionIndex: 48
    SolutionNameMin: Cijk_Ailk_Bljk_HB_MT064x064x16_PGR0_PLR0_TT04_04
- - - [4096, 7000, 1, 4096]
    - [32, 17623.3]
  - - [5124, 9124, 1, 1760]
    - [30, 18128.4]
  - - [5124, 9124, 1, 2560]
    - [32, 18110.3]
  - - [1760, 32, 1, 1760]
    - [4, 2419.97]
  - - [1024, 1500, 1, 1536]
    - [26, 14708.6]
  - - [512, 24000, 1, 1536]
    - [32, 18042.7]
  - - [3072, 24000, 1, 1024]
    - [32, 18518.9]
  - - [1024, 3000, 1, 2560]
    - [32, 16568.8]
  - - [512, 3136, 1, 2048]
    - [37, 12269.7]
  - - [7680, 4, 1, 2560]
    - [4, 1333.82]
  - - [35, 1500, 1, 2048]
    - [10, 0.0]
  - - [8448, 1500, 1, 2816]
    - [31, 17589.3]
  - - [784, 512, 64, 128]
    - [41, 15017.8]
  - - [2560, 7000, 1, 2560]
    - [32, 17875.6]
  - - [3072, 16, 1, 1024]
    - [4, 1929.86]
  - - [512, 48000, 1, 2048]
    - [27, 16895.9]
  - - [1760, 64, 1, 1760]
    - [0, 4228.76]
  - - [1024, 16, 1, 512]
    - [7, 624.129]
  - - [196, 256, 64, 1024]
    - [40, 10737.6]
  - - [512, 48000, 1, 1536]
    - [32, 18422.4]
  - - [2560, 32, 1, 2560]
    - [9, 3260.47]
  - - [4608, 1500, 1, 1536]
    - [32, 16854.0]
  - - [2048, 128, 1, 2048]
    - [22, 7131.56]
  - - [1024, 24000, 1, 2560]
    - [32, 18488.8]
  - - [4608, 3000, 1, 1536]
    - [32, 17523.9]
  - - [5124, 9124, 1, 2048]
    - [32, 17127.2]
  - - [1024, 700, 1, 512]
    - [25, 9823.25]
  - - [3072, 1, 1, 128]
    - [3, 57.1493]
  - - [5124, 700, 1, 2560]
    - [32, 14974.0]
  - - [8448, 16, 1, 2816]
    - [9, 4393.22]
  - - [6144, 6000, 1, 2560]
    - [32, 18532.8]
  - - [4608, 32, 1, 1536]
    - [12, 4595.98]
  - - [35, 8457, 1, 2560]
    - [10, 0.0]
  - - [3072, 64, 1, 1024]
    - [15, 5400.32]
  - - [512, 16, 1, 512]
    - [16, 313.945]
  - - [7680, 2, 1, 2560]
    - [9, 665.104]
  - - [4224, 1, 1, 128]
    - [3, 78.5803]
  - - [7680, 1, 1, 2560]
    - [4, 335.277]
  - - [128, 1500, 1, 1280]
    - [6, 5525.06]
  - - [35, 8457, 1, 4096]
    - [10, 0.0]
  - - [1024, 1500, 1, 2816]
    - [26, 15031.0]
  - - [6144, 2, 1, 2560]
    - [4, 547.65]
  - - [8448, 48000, 1, 2816]
    - [32, 19228.5]
  - - [512, 6000, 1, 1536]
    - [32, 16329.3]
  - - [4224, 1500, 1, 176]
    - [31, 14519.8]
  - - [1024, 6000, 1, 2816]
    - [32, 17652.9]
  - - [512, 6000, 1, 2560]
    - [32, 16549.3]
  - - [512, 32, 1, 512]
    - [12, 613.202]
  - - [2560, 128, 1, 2560]
    - [18, 7420.82]
  - - [4608, 24000, 1, 1536]
    - [32, 19019.7]
  - - [512, 2, 1, 500000]
    - [4, 51.445]
  - - [7680, 48000, 1, 2560]
    - [32, 19209.0]
  - - [3072, 48000, 1, 1024]
    - [32, 18870.3]
  - - [1760, 16, 1, 1760]
    - [13, 1241.49]
  - - [512, 3000, 1, 2816]
    - [26, 15056.1]
  - - [1760, 7000, 1, 1760]
    - [31, 17135.7]
  - - [64, 193600, 1, 256]
    - [33, 15548.5]
  - - [1024, 3000, 1, 2048]
    - [23, 12835.3]
  - - [6144, 4, 1, 2560]
    - [13, 1075.82]
  - - [1024, 6000, 1, 2048]
    - [27, 14874.6]
  - - [512, 24000, 1, 2816]
    - [32, 18218.0]
  - - [6144, 48000, 1, 2560]
    - [32, 19150.9]
  - - [8448, 3000, 1, 2816]
    - [32, 18318.2]
  - - [35, 1500, 1, 2560]
    - [10, 0.0]
  - - [3072, 4, 1, 1024]
    - [4, 499.312]
  - - [4608, 48000, 1, 1536]
    - [32, 19159.2]
  - - [2048, 32, 1, 2048]
    - [13, 2810.2]
  - - [7680, 1500, 1, 2560]
    - [26, 17086.2]
  - - [4096, 128, 1, 4096]
    - [17, 10925.2]
  - - [4608, 16, 1, 1536]
    - [9, 2848.21]
  - - [1024, 1500, 1, 2048]
    - [23, 11054.6]
  - - [3072, 3000, 1, 1024]
    - [26, 16388.3]
  - - [3072, 2, 1, 1024]
    - [4, 248.866]
  - - [8448, 1, 1, 2816]
    - [9, 338.3]
  - - [1024, 48000, 1, 2560]
    - [32, 19023.0]
  - - [1024, 3000, 1, 2816]
    - [32, 16559.4]
  - - [128, 1, 1, 1408]
    - [4, 5.88189]
  - - [35, 8457, 1, 1760]
    - [10, 0.0]
  - - [1024, 2, 1, 512]
    - [4, 78.4833]
  - - [1024, 4, 1, 500000]
    - [4, 205.783]
  - - [6144, 1, 1, 2560]
    - [13, 270.433]
  - - [1024, 48000, 1, 2816]
    - [32, 19048.4]
  - - [512, 48000, 1, 2816]
    - [32, 18519.5]
  - - [2048, 16, 1, 2048]
    - [4, 1463.96]
  - - [1024, 24000, 1, 1536]
    - [32, 18402.3]
  - - [64, 193600, 1, 64]
    - [1, 12707.9]
  - - [7680, 6000, 1, 2560]
    - [32, 18638.9]
  - - [1760, 128, 1, 1760]
    - [11, 6564.34]
  - - [35, 8457, 1, 2048]
    - [10, 0.0]
  - - [512, 1500, 1, 2816]
    - [25, 12310.2]
  - - [512, 1, 1, 512]
    - [4, 19.9797]
  - - [512, 16, 1, 500000]
    - [4, 411.57]
  - - [512, 8, 1, 500000]
    - [4, 205.788]
  - - [512, 24000, 1, 2560]
    - [32, 18188.2]
  - - [6144, 3000, 1, 2560]
    - [32, 18280.4]
  - - [1024, 24000, 1, 2816]
    - [32, 18513.1]
  - - [2048, 7000, 1, 2048]
    - [27, 16419.7]
  - - [7680, 3000, 1, 2560]
    - [32, 18061.9]
  - - [1024, 4, 1, 512]
    - [16, 155.115]
  - - [5124, 700, 1, 2048]
    - [28, 13173.7]
  - - [5124, 9124, 1, 4096]
    - [32, 17588.2]
  - - [4096, 64, 1, 4096]
    - [20, 8099.92]
  - - [256, 193600, 1, 64]
    - [5, 16117.4]
  - - [512, 6000, 1, 2048]
    - [23, 12706.7]
  - - [7680, 32, 1, 2560]
    - [20, 7248.1]
  - - [2560, 64, 1, 2560]
    - [12, 5360.75]
  - - [3136, 2048, 1, 512]
    - [43, 15274.4]
  - - [3072, 128, 1, 1024]
    - [20, 8131.04]
  - - [8448, 6000, 1, 2816]
    - [32, 18841.1]
  - - [7680, 64, 1, 2560]
    - [22, 10361.3]
  - - [5124, 1500, 1, 2560]
    - [32, 16686.9]
  - - [1024, 1500, 1, 2560]
    - [26, 14948.7]
  - - [3025, 64, 64, 64]
    - [39, 0.0]
  - - [512, 4, 1, 512]
    - [13, 78.9561]
  - - [1024, 6000, 1, 2560]
    - [32, 17536.8]
  - - [3072, 32, 1, 1024]
    - [13, 3495.19]
  - - [35, 700, 1, 2560]
    - [10, 0.0]
  - - [3136, 512, 1, 2048]
    - [40, 9592.45]
  - - [196, 1024, 64, 256]
    - [42, 12721.6]
  - - [512, 50176, 1, 128]
    - [2, 17069.6]
  - - [4608, 1, 1, 1536]
    - [4, 193.171]
  - - [49, 512, 64, 2048]
    - [39, 0.0]
  - - [4096, 32, 1, 4096]
    - [21, 5154.22]
  - - [7680, 24000, 1, 2560]
    - [32, 19082.1]
  - - [8448, 4, 1, 2816]
    - [9, 1379.89]
  - - [64, 1, 1, 1216]
    - [4, 2.65788]
  - - [512, 1, 1, 500000]
    - [4, 25.7202]
  - - [176, 1500, 1, 1408]
    - [8, 5866.57]
  - - [512, 3000, 1, 1536]
    - [26, 14701.3]
  - - [8448, 24000, 1, 2816]
    - [32, 19154.9]
  - - [4608, 2, 1, 1536]
    - [4, 389.746]
  - - [1024, 48000, 1, 1536]
    - [32, 18945.3]
  - - [7680, 128, 1, 2560]
    - [26, 13448.9]
  - - [3072, 6000, 1, 1024]
    - [26, 17087.4]
  - - [3072, 1500, 1, 128]
    - [31, 13527.9]
  - - [2048, 3136, 1, 512]
    - [38, 16006.1]
  - - [3025, 256, 64, 64]
    - [39, 0.0]
  - - [1024, 3000, 1, 1536]
    - [32, 16257.3]
  - - [512, 4, 1, 500000]
    - [4, 102.892]
  - - [35, 700, 1, 2048]
    - [10, 0.0]
  - - [1024, 16, 1, 500000]
    - [4, 823.086]
  - - [512, 24000, 1, 2048]
    - [27, 15984.2]
  - - [128, 50176, 1, 512]
    - [36, 15925.4]
  - - [1024, 32, 1, 512]
    - [4, 1198.33]
  - - [256, 12544, 1, 1024]
    - [34, 13788.5]
  - - [1024, 12544, 1, 256]
    - [35, 16797.5]
  - - [512, 48000, 1, 2560]
    - [32, 18499.2]
  - - [2560, 16, 1, 2560]
    - [4, 1846.07]
  - - [2048, 64, 1, 2048]
    - [16, 4814.08]
  - - [512, 2, 1, 512]
    - [4, 39.9595]
  - - [1024, 1, 1, 512]
    - [7, 36.611]
  - - [512, 1500, 1, 2560]
    - [25, 11367.1]
  - - [6144, 32, 1, 2560]
    - [14, 6131.95]
  - - [1024, 1, 1, 500000]
    - [4, 51.4462]
  - - [6144, 16, 1, 2560]
    - [16, 3941.98]
  - - [1024, 24000, 1, 2048]
    - [27, 16993.1]
  - - [4096, 16, 1, 4096]
    - [4, 2956.31]
  - - [5124, 1500, 1, 2048]
    - [27, 14583.4]
  - - [3072, 1500, 1, 1024]
    - [26, 15166.2]
  - - [1024, 2, 1, 500000]
    - [4, 102.893]
  - - [1024, 8, 1, 500000]
    - [4, 411.53]
  - - [7680, 16, 1, 2560]
    - [0, 4771.97]
  - - [6144, 1500, 1, 2560]
    - [32, 17728.2]
  - - [3072, 1, 1, 1024]
    - [4, 124.435]
  - - [512, 6000, 1, 2816]
    - [32, 16574.6]
  - - [8448, 2, 1, 2816]
    - [9, 687.55]
  - - [4608, 4, 1, 1536]
    - [4, 774.375]
  - - [1024, 6000, 1, 1536]
    - [32, 17311.9]
  - - [8448, 32, 1, 2816]
    - [18, 6147.1]
  - - [512, 3000, 1, 2048]
    - [28, 10946.8]
  - - [6144, 24000, 1, 2560]
    - [32, 19086.7]
  - - [512, 3000, 1, 2560]
    - [26, 15008.0]
  - - [4608, 6000, 1, 1536]
    - [32, 18438.8]
  - - [1024, 1024, 1, 1024]
    - [29, 12201.5]
  - - [512, 1500, 1, 2048]
    - [29, 9295.75]
  - - [512, 1500, 1, 1536]
    - [25, 10963.1]
  - - [128, 1, 1, 1024]
    - [19, 5.35414]
  - - [49, 2048, 64, 512]
    - [39, 0.0]
  - - [1024, 48000, 1, 2048]
    - [27, 17677.3]
- - - -1
    - - - 1
        - - - 32
            - - [64, 48]
              - [128, 47]
              - [704, 48]
              - [1024, 46]
              - [1408, 48]
              - [2368, 46]
              - [3584, 48]
              - [4288, 46]
              - [5888, 48]
              - [-1, 46]
          - - 64
            - - [64, 48]
              - [128, 46]
              - [256, 48]
              - [448, 46]
              - [704, 48]
              - [1024, 46]
              - [2368, 48]
              - [2944, 46]
              - [3584, 48]
              - [4288, 47]
              - [-1, 48]
          - - 128
            - - [64, 46]
              - [448, 48]
              - [704, 46]
              - [1024, 48]
              - [1408, 47]
              - [2944, 46]
              - [4288, 48]
              - [5056, 46]
              - [5888, 48]
              - [-1, 46]
          - - 256
            - - [32, 46]
              - [128, 48]
              - [256, 46]
              - [1024, 48]
              - [1408, 46]
              - [2368, 48]
              - [2944, 46]
              - [4288, 47]
              - [5888, 48]
              - [-1, 47]
          - - 448
            - - [1024, 48]
              - [1856, 46]
              - [2368, 47]
              - [2944, 48]
              - [5056, 47]
              - [-1, 48]
          - - 704
            - - [32, 46]
              - [64, 48]
              - [128, 46]
              - [448, 48]
              - [704, 46]
              - [2944, 47]
              - [3584, 48]
              - [-1, 47]
          - - 1024
            - - [64, 46]
              - [128, 48]
              - [256, 47]
              - [704, 48]
              - [1024, 47]
              - [1408, 48]
              - [1856, 47]
              - [3584, 48]
              - [-1, 47]
          - - 1408
            - - [448, 48]
              - [704, 46]
              - [1408, 47]
              - [2368, 48]
              - [-1, 47]
          - - 1856
            - - [64, 48]
              - [128, 47]
              - [448, 48]
              - [3584, 47]
              - [-1, 48]
          - - 2368
            - - [256, 48]
              - [448, 46]
              - [704, 47]
              - [1408, 48]
              - [1856, 47]
              - [2368, 48]
              - [2944, 47]
              - [-1, 48]
          - - 2944
            - - [32, 48]
              - [64, 46]
              - [128, 48]
              - [256, 46]
              - [1024, 48]
              - [-1, 47]
          - - 3584
            - - [64, 48]
              - [256, 46]
              - [448, 47]
              - [1024, 48]
              - [-1, 47]
          - - 4288
            - - [32, 46]
              - [448, 48]
              - [1408, 47]
              - [-1, 48]
          - - 5056
            - - [64, 46]
              - [128, 48]
              - [256, 47]
              - [448, 48]
              - [1408, 47]
              - [-1, 48]
          - - 5888
            - - [64, 46]
              - [128, 48]
              - [256, 47]
              - [448, 48]
              - [-1, 47]
          - - -1
            - - [64, 46]
              - [256, 48]
              - [448, 47]
              - [704, 48]
              - [-1, 47]
      - - 32
        - - - 128
            - - [-1, 45]
          - - 256
            - - [3584, 45]
              - [-1, 44]
          - - 448
            - - [1408, 45]
              - [1856, 44]
              - [2368, 45]
              - [2944, 44]
              - [3584, 45]
              - [4288, 44]
              - [5888, 45]
              - [-1, 44]
          - - 704
            - - [1408, 45]
              - [2944, 44]
              - [4288, 45]
              - [-1, 44]
          - - 1024
            - - [1024, 45]
              - [1856, 44]
              - [2944, 45]
              - [3584, 44]
              - [4288, 45]
              - [-1, 44]
          - - 1408
            - - [704, 45]
              - [1408, 44]
              - [2368, 45]
              - [-1, 44]
          - - 1856
            - - [704, 45]
              - [1024, 44]
              - [1856, 45]
              - [-1, 44]
          - - 2368
            - - [448, 45]
              - [-1, 44]
          - - 2944
            - - [256, 45]
              - [448, 44]
              - [1024, 45]
              - [-1, 44]
          - - 3584
            - - [256, 45]
              - [448, 44]
              - [704, 45]
              - [-1, 44]
          - - 4288
            - - [704, 45]
              - [-1, 44]
          - - 5056
            - - [128, 45]
              - [256, 44]
              - [448, 45]
              - [-1, 44]
          - - -1
            - - [128, 45]
              - [256, 44]
              - [704, 45]
              - [-1, 44]
      - - 256
        - - - 1
            - - [-1, 46]
          - - 32
            - - [-1, 45]
          - - 64
            - - [1, 46]
              - [32, 45]
              - [64, 19]
              - [128, 12]
              - [256, 7]
              - [1024, 3]
              - [1856, 12]
              - [2368, 7]
              - [2944, 0]
              - [4288, 8]
              - [5056, 18]
              - [5888, 20]
              - [-1, 1]
          - - 128
            - - [1, 46]
              - [32, 45]
              - [128, 7]
              - [256, 21]
              - [448, 7]
              - [704, 12]
              - [1024, 7]
              - [1408, 8]
              - [1856, 6]
              - [2368, 8]
              - [2944, 25]
              - [4288, 20]
              - [-1, 25]
          - - 256
            - - [1, 46]
              - [32, 45]
              - [256, 7]
              - [448, 0]
              - [2944, 25]
              - [3584, 26]
              - [5056, 25]
              - [5888, 31]
              - [-1, 26]
          - - 448
            - - [1, 46]
              - [32, 45]
              - [64, 3]
              - [256, 7]
              - [448, 8]
              - [1408, 25]
              - [1856, 26]
              - [2368, 25]
              - [2944, 31]
              - [3584, 25]
              - [4288, 24]
              - [5056, 31]
              - [5888, 26]
              - [-1, 24]
          - - 704
            - - [1, 46]
              - [32, 45]
              - [64, 21]
              - [128, 7]
              - [1856, 25]
              - [2368, 26]
              - [5888, 24]
              - [-1, 32]
          - - 1024
            - - [1, 46]
              - [32, 45]
              - [64, 7]
              - [128, 12]
              - [704, 25]
              - [1024, 31]
              - [4288, 26]
              - [-1, 32]
          - - 1408
            - - [1, 46]
              - [32, 45]
              - [64, 7]
              - [128, 18]
              - [704, 25]
              - [1024, 31]
              - [1408, 26]
              - [1856, 31]
              - [2368, 26]
              - [5888, 32]
              - [-1, 31]
          - - 1856
            - - [1, 46]
              - [32, 45]
              - [64, 0]
              - [128, 8]
              - [256, 25]
              - [448, 31]
              - [704, 25]
              - [1024, 26]
              - [1408, 24]
              - [1856, 26]
              - [2944, 31]
              - [4288, 32]
              - [5056, 30]
              - [5888, 32]
              - [-1, 31]
          - - 2368
            - - [1, 46]
              - [32, 45]
              - [64, 9]
              - [128, 8]
              - [704, 25]
              - [1024, 26]
              - [1408, 31]
              - [1856, 26]
              - [2368, 31]
              - [2944, 32]
              - [4288, 31]
              - [-1, 32]
          - - 2944
            - - [1, 46]
              - [32, 45]
              - [64, 0]
              - [128, 6]
              - [256, 25]
              - [448, 31]
              - [704, 26]
              - [1408, 32]
              - [1856, 31]
              - [2368, 32]
              - [5056, 31]
              - [-1, 32]
          - - 3584
            - - [1, 46]
              - [32, 45]
              - [64, 6]
              - [256, 25]
              - [448, 26]
              - [704, 31]
              - [1024, 26]
              - [1408, 32]
              - [2944, 31]
              - [4288, 32]
              - [5056, 31]
              - [-1, 32]
          - - 4288
            - - [1, 46]
              - [32, 45]
              - [64, 18]
              - [128, 22]
              - [256, 25]
              - [704, 26]
              - [1024, 31]
              - [1856, 32]
              - [2944, 31]
              - [3584, 32]
              - [5056, 31]
              - [5888, 32]
              - [-1, 30]
          - - 5056
            - - [1, 46]
              - [32, 45]
              - [64, 1]
              - [256, 25]
              - [448, 26]
              - [704, 31]
              - [1408, 32]
              - [1856, 31]
              - [2368, 32]
              - [2944, 31]
              - [3584, 32]
              - [4288, 31]
              - [5888, 32]
              - [-1, 30]
          - - 5888
            - - [1, 46]
              - [32, 45]
              - [64, 22]
              - [128, 25]
              - [704, 26]
              - [1408, 32]
              - [2368, 31]
              - [3584, 32]
              - [4288, 30]
              - [-1, 32]
          - - -1
            - - [1, 46]
              - [32, 45]
              - [64, 1]
              - [448, 26]
              - [704, 31]
              - [1024, 32]
              - [2368, 31]
              - [3584, 32]
              - [5056, 30]
              - [-1, 32]
      - - 1280
        - - - 1
            - - [-1, 46]
          - - 32
            - - [-1, 45]
          - - 64
            - - [1, 46]
              - [32, 45]
              - [64, 13]
              - [128, 4]
              - [256, 7]
              - [1024, 4]
              - [1408, 9]
              - [1856, 0]
              - [2368, 7]
              - [2944, 18]
              - [3584, 6]
              - [5056, 8]
              - [5888, 20]
              - [-1, 1]
          - - 128
            - - [1, 46]
              - [32, 45]
              - [64, 4]
              - [128, 9]
              - [256, 4]
              - [448, 21]
              - [704, 12]
              - [1024, 21]
              - [1408, 20]
              - [1856, 6]
              - [2368, 8]
              - [2944, 20]
              - [3584, 25]
              - [4288, 20]
              - [5888, 25]
              - [-1, 26]
          - - 256
            - - [1, 46]
              - [32, 45]
              - [64, 4]
              - [128, 13]
              - [256, 4]
              - [448, 0]
              - [2944, 25]
              - [3584, 26]
              - [5056, 25]
              - [-1, 26]
          - - 448
            - - [1, 46]
              - [32, 45]
              - [128, 4]
              - [256, 0]
              - [448, 6]
              - [1408, 25]
              - [1856, 26]
              - [2368, 25]
              - [3584, 26]
              - [4288, 24]
              - [5888, 26]
              - [-1, 24]
          - - 704
            - - [1, 46]
              - [32, 45]
              - [64, 4]
              - [128, 7]
              - [1024, 25]
              - [1408, 24]
              - [1856, 25]
              - [2368, 26]
              - [5056, 24]
              - [5888, 30]
              - [-1, 32]
          - - 1024
            - - [1, 46]
              - [32, 45]
              - [64, 4]
              - [128, 21]
              - [704, 25]
              - [2368, 26]
              - [2944, 32]
              - [3584, 26]
              - [4288, 31]
              - [-1, 32]
          - - 1408
            - - [1, 46]
              - [32, 45]
              - [64, 7]
              - [128, 20]
              - [448, 25]
              - [2368, 26]
              - [5888, 32]
              - [-1, 31]
          - - 1856
            - - [1, 46]
              - [32, 45]
              - [64, 21]
              - [128, 20]
              - [256, 25]
              - [448, 26]
              - [704, 25]
              - [1024, 26]
              - [1408, 24]
              - [2368, 26]
              - [2944, 31]
              - [4288, 32]
              - [5056, 30]
              - [5888, 32]
              - [-1, 31]
          - - 2368
            - - [1, 46]
              - [32, 45]
              - [64, 12]
              - [128, 8]
              - [448, 25]
              - [1856, 26]
              - [2368, 31]
              - [2944, 32]
              - [4288, 31]
              - [-1, 32]
          - - 2944
            - - [1, 46]
              - [32, 45]
              - [64, 14]
              - [128, 20]
              - [256, 25]
              - [704, 26]
              - [1408, 32]
              - [1856, 26]
              - [2368, 32]
              - [5056, 31]
              - [-1, 32]
          - - 3584
            - - [1, 46]
              - [32, 45]
              - [64, 6]
              - [128, 20]
              - [1024, 26]
              - [1408, 32]
              - [1856, 26]
              - [3584, 31]
              - [-1, 32]
          - - 4288
            - - [1, 46]
              - [32, 45]
              - [64, 8]
              - [128, 20]
              - [256, 25]
              - [704, 26]
              - [1024, 31]
              - [1856, 32]
              - [2944, 31]
              - [3584, 32]
              - [5056, 31]
              - [-1, 32]
          - - 5056
            - - [1, 46]
              - [32, 45]
              - [64, 8]
              - [256, 25]
              - [704, 26]
              - [1408, 32]
              - [1856, 31]
              - [3584, 32]
              - [4288, 31]
              - [-1, 32]
          - - 5888
            - - [1, 46]
              - [32, 45]
              - [64, 20]
              - [128, 25]
              - [704, 26]
              - [1408, 32]
              - [2368, 31]
              - [-1, 32]
          - - -1
            - - [1, 46]
              - [32, 45]
              - [64, 20]
              - [448, 26]
              - [1024, 32]
              - [1856, 31]
              - [3584, 32]
              - [5056, 30]
              - [-1, 32]
      - - -1
        - - - 1
            - - [-1, 46]
          - - 32
            - - [-1, 45]
          - - 64
            - - [1, 46]
              - [32, 45]
              - [256, 4]
              - [704, 13]
              - [1024, 4]
              - [1408, 16]
              - [1856, 0]
              - [2368, 12]
              - [2944, 18]
              - [3584, 6]
              - [5056, 8]
              - [5888, 25]
              - [-1, 1]
          - - 128
            - - [1, 46]
              - [32, 45]
              - [64, 13]
              - [128, 7]
              - [448, 4]
              - [704, 16]
              - [1024, 21]
              - [1408, 14]
              - [1856, 11]
              - [2368, 8]
              - [2944, 11]
              - [4288, 20]
              - [5888, 25]
              - [-1, 26]
          - - 256
            - - [1, 46]
              - [32, 45]
              - [256, 4]
              - [448, 0]
              - [2944, 25]
              - [3584, 26]
              - [5056, 25]
              - [-1, 26]
          - - 448
            - - [1, 46]
              - [32, 45]
              - [64, 4]
              - [128, 13]
              - [256, 0]
              - [448, 20]
              - [1408, 25]
              - [1856, 26]
              - [2368, 25]
              - [3584, 26]
              - [4288, 24]
              - [5056, 26]
              - [5888, 32]
              - [-1, 24]
          - - 704
            - - [1, 46]
              - [32, 45]
              - [64, 4]
              - [128, 9]
              - [1024, 25]
              - [1408, 24]
              - [1856, 25]
              - [2368, 26]
              - [5888, 24]
              - [-1, 32]
          - - 1024
            - - [1, 46]
              - [32, 45]
              - [64, 13]
              - [128, 21]
              - [704, 25]
              - [2368, 26]
              - [2944, 32]
              - [4288, 26]
              - [-1, 32]
          - - 1408
            - - [1, 46]
              - [32, 45]
              - [64, 9]
              - [128, 20]
              - [448, 25]
              - [2368, 26]
              - [5888, 32]
              - [-1, 31]
          - - 1856
            - - [1, 46]
              - [32, 45]
              - [64, 0]
              - [128, 20]
              - [256, 25]
              - [448, 26]
              - [704, 25]
              - [1024, 26]
              - [1408, 24]
              - [2944, 26]
              - [4288, 32]
              - [5056, 31]
              - [5888, 32]
              - [-1, 31]
          - - 2368
            - - [1, 46]
              - [32, 45]
              - [64, 7]
              - [128, 18]
              - [448, 25]
              - [2368, 26]
              - [2944, 32]
              - [4288, 31]
              - [-1, 32]
          - - 2944
            - - [1, 46]
              - [32, 45]
              - [64, 6]
              - [128, 20]
              - [256, 25]
              - [704, 26]
              - [1408, 32]
              - [1856, 26]
              - [2368, 32]
              - [5056, 31]
              - [-1, 32]
          - - 3584
            - - [1, 46]
              - [32, 45]
              - [64, 20]
              - [128, 25]
              - [1024, 26]
              - [1408, 32]
              - [3584, 31]
              - [4288, 32]
              - [5056, 31]
              - [-1, 32]
          - - 4288
            - - [1, 46]
              - [32, 45]
              - [64, 18]
              - [128, 20]
              - [256, 25]
              - [1024, 26]
              - [1856, 32]
              - [2944, 31]
              - [3584, 32]
              - [5056, 31]
              - [-1, 32]
          - - 5056
            - - [1, 46]
              - [32, 45]
              - [64, 18]
              - [256, 25]
              - [704, 26]
              - [1408, 32]
              - [1856, 31]
              - [2368, 32]
              - [4288, 31]
              - [-1, 32]
          - - 5888
            - - [1, 46]
              - [32, 45]
              - [64, 20]
              - [128, 25]
              - [256, 26]
              - [448, 32]
              - [704, 26]
              - [1408, 32]
              - [2368, 31]
              - [-1, 32]
          - - -1
            - - [1, 46]
              - [32, 45]
              - [64, 1]
              - [448, 26]
              - [1024, 32]
              - [2368, 31]
              - [3584, 32]
              - [5056, 31]
              - [-1, 32]
