library/src/blas3/Tensile/Logic/asm_full/vega20_Cijk_Ailk_Bjlk_SB.yaml
- {MinimumRequiredVersion: 4.3.0}
- vega20
- gfx906
- [Device 66a0, Device 66a7]
    SolutionIndex: 0
    SolutionNameMin: Cijk_Ailk_Bjlk_SB_MT064x016x08_GRVW02_GSU01_TT04_02_VW02_WG16_08_01
    SolutionIndex: 1
    SolutionNameMin: Cijk_Ailk_Bjlk_SB_MT032x016x08_GRVW02_GSU01_TT02_02_VW02_WG16_08_01
    SolutionIndex: 2
    SolutionNameMin: Cijk_Ailk_Bjlk_SB_MT032x008x32_GRVW02_GSU04_TT02_02_VW02_WG16_04_04
    SolutionIndex: 3
    SolutionNameMin: Cijk_Ailk_Bjlk_SB_MT032x032x32_GRVW04_GSU02_TT04_04_VW04_WG08_08_04
    SolutionIndex: 4
    SolutionNameMin: Cijk_Ailk_Bjlk_SB_MT032x032x32_GRVW04_GSU02_TT04_04_VW04_WG08_08_04
    SolutionIndex: 5
    SolutionNameMin: Cijk_Ailk_Bjlk_SB_MT016x016x32_GRVW02_GSU04_TT02_02_VW02_WG08_08_04
    SolutionIndex: 6
    SolutionNameMin: Cijk_Ailk_Bjlk_SB_MT016x016x16_GRVW02_GSU04_TT02_02_VW02_WG08_08_04
    SolutionIndex: 7
    SolutionNameMin: Cijk_Ailk_Bjlk_SB_MT032x032x16_GRVW04_GSU02_TT04_04_VW04_WG08_08_02
    SolutionIndex: 8
    SolutionNameMin: Cijk_Ailk_Bjlk_SB_MT016x016x08_GRVW02_GSU04_TT02_02_VW02_WG08_08_02
    SolutionIndex: 9
    SolutionNameMin: Cijk_Ailk_Bjlk_SB_MT016x016x32_GRVW02_GSU02_TT02_02_VW02_WG08_08_04
    SolutionIndex: 10
    SolutionNameMin: Cijk_Ailk_Bjlk_SB_MT016x016x16_GRVW02_GSU08_TT02_02_VW02_WG08_08_04
    SolutionIndex: 11
    SolutionNameMin: Cijk_Ailk_Bjlk_SB_MT064x032x16_GRVW04_GSU02_TT04_04_VW04_WG16_08_02
    SolutionIndex: 12
    SolutionNameMin: Cijk_Ailk_Bjlk_SB_MT064x064x08_GRVW04_GSU01_TT04_04_VW04_WG16_16_01
    SolutionIndex: 13
    SolutionNameMin: Cijk_Ailk_Bjlk_SB_MT064x064x08_GRVW04_GSU01_TT04_04_VW04_WG16_16_01
    SolutionIndex: 14
    SolutionNameMin: Cijk_Ailk_Bjlk_SB_MT128x128x08_GRVW04_GSU01_TT08_08_VW04_WG16_16_01
    SolutionIndex: 15
    SolutionNameMin: Cijk_Ailk_Bjlk_SB_MT128x064x08_GRVW04_GSU01_TT08_04_VW04_WG16_16_01
    SolutionIndex: 16
    SolutionNameMin: Cijk_Ailk_Bjlk_SB_MT064x128x08_GRVW04_GSU01_TT04_08_VW04_WG16_16_01
    SolutionIndex: 17
    SolutionNameMin: Cijk_Ailk_Bjlk_SB_MT064x064x16_GRVW04_GSU01_TT04_04_VW04_WG16_16_01
    SolutionIndex: 18
    SolutionNameMin: Cijk_Ailk_Bjlk_SB_MT064x128x08_GRVW04_GSU01_TT04_08_VW04_WG16_16_01
    SolutionIndex: 19
    SolutionNameMin: Cijk_Ailk_Bjlk_SB_MT064x064x16_GRVW04_GSU01_TT04_04_VW04_WG16_16_01
    SolutionIndex: 20
    SolutionNameMin: Cijk_Ailk_Bjlk_SB_MT128x064x16_GRVW04_GSU01_TT08_04_VW04_WG16_16_01
    SolutionIndex: 21
    SolutionNameMin: Cijk_Ailk_Bjlk_SB_MT128x064x08_GRVW04_GSU01_TT08_04_VW04_WG16_16_01
    SolutionIndex: 22
    SolutionNameMin: Cijk_Ailk_Bjlk_SB_MT128x128x16_GRVW04_GSU01_TT08_08_VW04_WG16_16_01
    SolutionIndex: 23
    SolutionNameMin: Cijk_Ailk_Bjlk_SB_MT128x128x16_GRVW04_GSU01_TT08_08_VW04_WG16_16_01
    SolutionIndex: 24
    SolutionNameMin: Cijk_Ailk_Bjlk_SB_MT016x016x04_GRVW02_GSU01_TT02_02_VW02_WG08_08_01
    SolutionIndex: 25
    SolutionNameMin: Cijk_Ailk_Bjlk_SB_MT016x016x04_GRVW02_GSU04_TT02_02_VW02_WG08_08_01
- - - [4096, 7133, 1, 4096]
    - [23, 9390.61]
  - - [512, 16, 1, 512]
    - [2, 680.894]
  - - [2048, 7133, 1, 2048]
    - [22, 9284.01]
  - - [2560, 7133, 1, 2560]
    - [21, 9339.22]
  - - [1024, 1024, 1, 1024]
    - [20, 7941.76]
  - - [3072, 7435, 1, 1024]
    - [21, 9199.24]
  - - [1024, 32, 1, 512]
    - [6, 1691.25]
  - - [1760, 7133, 1, 1760]
    - [21, 8922.75]
  - - [7680, 5481, 1, 2560]
    - [15, 9352.93]
  - - [1024, 16, 1, 512]
    - [9, 1139.76]
  - - [512, 32, 1, 512]
    - [5, 1165.08]
- - - -1
    - - - 128
        - - - 4
            - - [-1, 24]
          - - 64
            - - [4, 24]
              - [2368, 1]
              - [2944, 0]
              - [4288, 1]
              - [5056, 0]
              - [5888, 1]
              - [-1, 0]
          - - 128
            - - [4, 24]
              - [1024, 1]
              - [1408, 0]
              - [1856, 1]
              - [2368, 0]
              - [4288, 1]
              - [-1, 0]
          - - 256
            - - [4, 24]
              - [448, 1]
              - [1024, 13]
              - [1408, 12]
              - [1856, 13]
              - [3584, 12]
              - [5056, 13]
              - [5888, 12]
              - [-1, 13]
          - - 448
            - - [4, 24]
              - [448, 1]
              - [704, 13]
              - [1408, 12]
              - [2944, 13]
              - [3584, 14]
              - [-1, 13]
          - - 704
            - - [4, 24]
              - [128, 1]
              - [256, 12]
              - [448, 13]
              - [1024, 12]
              - [1408, 13]
              - [2368, 12]
              - [5888, 13]
              - [-1, 12]
          - - 1024
            - - [4, 24]
              - [128, 1]
              - [2944, 13]
              - [4288, 12]
              - [5056, 13]
              - [5888, 12]
              - [-1, 14]
          - - 1408
            - - [4, 24]
              - [64, 1]
              - [128, 0]
              - [256, 13]
              - [704, 12]
              - [1408, 13]
              - [1856, 12]
              - [2368, 13]
              - [3584, 12]
              - [5056, 13]
              - [5888, 14]
              - [-1, 13]
          - - 1856
            - - [4, 24]
              - [128, 1]
              - [704, 12]
              - [1024, 14]
              - [2944, 13]
              - [3584, 12]
              - [4288, 14]
              - [5056, 13]
              - [5888, 14]
              - [-1, 13]
          - - 2368
            - - [4, 24]
              - [128, 1]
              - [256, 12]
              - [448, 13]
              - [704, 14]
              - [1856, 13]
              - [2368, 12]
              - [2944, 14]
              - [4288, 13]
              - [-1, 14]
          - - 2944
            - - [4, 24]
              - [64, 1]
              - [128, 0]
              - [704, 12]
              - [1024, 13]
              - [1408, 12]
              - [1856, 13]
              - [2368, 12]
              - [4288, 13]
              - [5056, 12]
              - [-1, 14]
          - - 3584
            - - [4, 24]
              - [64, 1]
              - [128, 0]
              - [256, 12]
              - [1024, 13]
              - [1408, 12]
              - [1856, 13]
              - [2368, 12]
              - [-1, 14]
          - - 4288
            - - [4, 24]
              - [128, 0]
              - [256, 13]
              - [448, 12]
              - [1024, 13]
              - [1408, 14]
              - [2944, 13]
              - [3584, 14]
              - [5888, 13]
              - [-1, 14]
          - - 5056
            - - [4, 24]
              - [128, 0]
              - [448, 12]
              - [704, 13]
              - [1408, 14]
              - [4288, 13]
              - [5888, 14]
              - [-1, 13]
          - - 5888
            - - [4, 24]
              - [128, 0]
              - [256, 12]
              - [448, 13]
              - [704, 12]
              - [1024, 14]
              - [1856, 12]
              - [-1, 14]
          - - -1
            - - [4, 24]
              - [128, 0]
              - [704, 12]
              - [1024, 13]
              - [1408, 14]
              - [1856, 12]
              - [2368, 13]
              - [-1, 14]
      - - 256
        - - - 4
            - - [4, 10]
              - [1408, 6]
              - [-1, 8]
          - - 64
            - - [4, 6]
              - [64, 5]
              - [1856, 9]
              - [-1, 19]
          - - 128
            - - [64, 6]
              - [128, 5]
              - [256, 6]
              - [704, 9]
              - [5056, 19]
              - [5888, 17]
              - [-1, 19]
          - - 256
            - - [4, 6]
              - [448, 9]
              - [704, 19]
              - [1408, 17]
              - [5888, 19]
              - [-1, 17]
          - - 448
            - - [4, 6]
              - [64, 5]
              - [128, 9]
              - [256, 17]
              - [448, 19]
              - [704, 17]
              - [1856, 19]
              - [2368, 17]
              - [2944, 19]
              - [3584, 17]
              - [-1, 19]
          - - 704
            - - [64, 6]
              - [128, 9]
              - [448, 17]
              - [1024, 19]
              - [1856, 17]
              - [5056, 19]
              - [5888, 16]
              - [-1, 19]
          - - 1024
            - - [4, 6]
              - [64, 9]
              - [256, 17]
              - [448, 19]
              - [704, 17]
              - [1024, 20]
              - [2944, 17]
              - [3584, 15]
              - [4288, 17]
              - [5056, 21]
              - [5888, 17]
              - [-1, 21]
          - - 1408
            - - [4, 6]
              - [64, 9]
              - [128, 19]
              - [448, 17]
              - [704, 19]
              - [1024, 21]
              - [1408, 19]
              - [1856, 17]
              - [2368, 19]
              - [-1, 21]
          - - 1856
            - - [4, 6]
              - [64, 9]
              - [256, 19]
              - [704, 17]
              - [1024, 16]
              - [1408, 19]
              - [2944, 17]
              - [3584, 16]
              - [5056, 17]
              - [-1, 16]
          - - 2368
            - - [4, 8]
              - [64, 17]
              - [128, 19]
              - [256, 17]
              - [448, 19]
              - [704, 17]
              - [1024, 16]
              - [1856, 17]
              - [2368, 16]
              - [2944, 19]
              - [4288, 17]
              - [5056, 19]
              - [-1, 16]
          - - 2944
            - - [4, 8]
              - [64, 17]
              - [128, 19]
              - [256, 17]
              - [704, 19]
              - [1024, 21]
              - [1408, 16]
              - [1856, 19]
              - [2368, 17]
              - [3584, 16]
              - [5056, 21]
              - [5888, 16]
              - [-1, 21]
          - - 3584
            - - [4, 8]
              - [64, 19]
              - [256, 17]
              - [448, 19]
              - [704, 17]
              - [1024, 15]
              - [1856, 21]
              - [2368, 19]
              - [-1, 21]
          - - 4288
            - - [4, 25]
              - [256, 19]
              - [448, 17]
              - [704, 19]
              - [1024, 17]
              - [1408, 18]
              - [1856, 19]
              - [2368, 17]
              - [-1, 16]
          - - 5056
            - - [4, 25]
              - [64, 19]
              - [256, 17]
              - [704, 19]
              - [1024, 18]
              - [1408, 16]
              - [2368, 17]
              - [-1, 16]
          - - 5888
            - - [4, 25]
              - [64, 19]
              - [128, 17]
              - [448, 19]
              - [704, 21]
              - [1024, 18]
              - [1408, 16]
              - [2368, 21]
              - [2944, 16]
              - [3584, 15]
              - [5056, 21]
              - [-1, 16]
          - - -1
            - - [4, 25]
              - [128, 19]
              - [256, 17]
              - [448, 19]
              - [1024, 17]
              - [1408, 16]
              - [2368, 21]
              - [2944, 16]
              - [3584, 15]
              - [5056, 21]
              - [5888, 16]
              - [-1, 22]
      - - 1280
        - - - 4
            - - [704, 10]
              - [1856, 6]
              - [3584, 8]
              - [-1, 6]
          - - 64
            - - [64, 10]
              - [128, 5]
              - [256, 9]
              - [448, 6]
              - [1856, 3]
              - [2368, 7]
              - [2944, 4]
              - [3584, 19]
              - [4288, 3]
              - [5056, 4]
              - [5888, 19]
              - [-1, 17]
          - - 128
            - - [4, 10]
              - [128, 5]
              - [256, 4]
              - [704, 3]
              - [1024, 11]
              - [1408, 3]
              - [1856, 19]
              - [2368, 3]
              - [2944, 17]
              - [3584, 19]
              - [4288, 11]
              - [5056, 17]
              - [-1, 19]
          - - 256
            - - [4, 10]
              - [64, 9]
              - [128, 4]
              - [448, 3]
              - [2368, 19]
              - [2944, 17]
              - [-1, 19]
          - - 448
            - - [4, 10]
              - [64, 5]
              - [448, 4]
              - [1408, 19]
              - [2944, 17]
              - [3584, 19]
              - [4288, 17]
              - [5888, 19]
              - [-1, 18]
          - - 704
            - - [4, 10]
              - [64, 3]
              - [128, 4]
              - [256, 19]
              - [704, 17]
              - [1024, 19]
              - [1408, 17]
              - [2944, 19]
              - [3584, 18]
              - [5056, 16]
              - [5888, 18]
              - [-1, 19]
          - - 1024
            - - [4, 6]
              - [64, 4]
              - [128, 3]
              - [704, 17]
              - [1024, 20]
              - [1856, 17]
              - [2368, 15]
              - [2944, 22]
              - [3584, 15]
              - [4288, 17]
              - [5056, 21]
              - [-1, 17]
          - - 1408
            - - [4, 6]
              - [64, 3]
              - [128, 4]
              - [256, 19]
              - [448, 17]
              - [704, 19]
              - [1024, 21]
              - [1408, 19]
              - [1856, 21]
              - [2368, 19]
              - [3584, 16]
              - [5888, 21]
              - [-1, 16]
          - - 1856
            - - [4, 6]
              - [64, 3]
              - [704, 19]
              - [1024, 18]
              - [1856, 16]
              - [2368, 19]
              - [2944, 17]
              - [3584, 18]
              - [5056, 19]
              - [-1, 18]
          - - 2368
            - - [4, 8]
              - [128, 4]
              - [448, 17]
              - [704, 19]
              - [1024, 18]
              - [1408, 17]
              - [1856, 19]
              - [2368, 16]
              - [2944, 17]
              - [4288, 16]
              - [5056, 17]
              - [-1, 18]
          - - 2944
            - - [4, 8]
              - [64, 3]
              - [128, 7]
              - [448, 19]
              - [704, 17]
              - [1024, 22]
              - [1408, 16]
              - [2368, 19]
              - [2944, 18]
              - [3584, 16]
              - [4288, 15]
              - [5056, 21]
              - [5888, 23]
              - [-1, 16]
          - - 3584
            - - [4, 6]
              - [128, 19]
              - [256, 17]
              - [448, 19]
              - [704, 21]
              - [1408, 18]
              - [1856, 21]
              - [2368, 19]
              - [2944, 15]
              - [5056, 21]
              - [5888, 15]
              - [-1, 21]
          - - 4288
            - - [4, 10]
              - [64, 4]
              - [128, 7]
              - [448, 19]
              - [704, 21]
              - [1408, 18]
              - [1856, 17]
              - [2368, 15]
              - [2944, 16]
              - [3584, 18]
              - [4288, 15]
              - [5056, 21]
              - [5888, 18]
              - [-1, 16]
          - - 5056
            - - [4, 6]
              - [64, 4]
              - [256, 17]
              - [448, 19]
              - [704, 21]
              - [1408, 18]
              - [2368, 19]
              - [4288, 18]
              - [5056, 16]
              - [-1, 18]
          - - 5888
            - - [4, 6]
              - [256, 19]
              - [448, 17]
              - [704, 21]
              - [1408, 23]
              - [2368, 21]
              - [2944, 16]
              - [3584, 18]
              - [4288, 15]
              - [5056, 21]
              - [-1, 15]
          - - -1
            - - [4, 8]
              - [64, 19]
              - [256, 17]
              - [448, 21]
              - [704, 19]
              - [1024, 18]
              - [1408, 16]
              - [1856, 15]
              - [2368, 21]
              - [2944, 16]
              - [3584, 18]
              - [5888, 15]
              - [-1, 23]
      - - -1
        - - - 4
            - - [1024, 10]
              - [1856, 6]
              - [2944, 10]
              - [3584, 8]
              - [5056, 25]
              - [-1, 8]
          - - 64
            - - [64, 10]
              - [448, 5]
              - [1024, 3]
              - [1408, 4]
              - [2368, 3]
              - [2944, 11]
              - [4288, 3]
              - [5056, 4]
              - [5888, 11]
              - [-1, 3]
          - - 128
            - - [4, 10]
              - [128, 5]
              - [256, 9]
              - [704, 4]
              - [1024, 11]
              - [1408, 3]
              - [1856, 7]
              - [2368, 3]
              - [2944, 7]
              - [3584, 19]
              - [4288, 3]
              - [5056, 7]
              - [5888, 19]
              - [-1, 7]
          - - 256
            - - [4, 10]
              - [64, 5]
              - [256, 4]
              - [448, 3]
              - [704, 19]
              - [1856, 17]
              - [2944, 19]
              - [3584, 17]
              - [5056, 19]
              - [-1, 17]
          - - 448
            - - [4, 10]
              - [64, 9]
              - [128, 3]
              - [256, 4]
              - [448, 3]
              - [1024, 17]
              - [1408, 19]
              - [1856, 17]
              - [3584, 19]
              - [4288, 17]
              - [5056, 19]
              - [5888, 17]
              - [-1, 16]
          - - 704
            - - [4, 10]
              - [128, 3]
              - [1856, 19]
              - [2368, 17]
              - [2944, 19]
              - [3584, 18]
              - [5056, 16]
              - [5888, 18]
              - [-1, 17]
          - - 1024
            - - [4, 10]
              - [128, 3]
              - [704, 17]
              - [1024, 20]
              - [1408, 17]
              - [1856, 23]
              - [2368, 15]
              - [2944, 23]
              - [3584, 15]
              - [4288, 17]
              - [5056, 23]
              - [-1, 17]
          - - 1408
            - - [4, 6]
              - [64, 3]
              - [128, 4]
              - [704, 19]
              - [1024, 17]
              - [1408, 23]
              - [1856, 21]
              - [2368, 17]
              - [2944, 22]
              - [5888, 23]
              - [-1, 16]
          - - 1856
            - - [4, 10]
              - [64, 3]
              - [128, 7]
              - [256, 17]
              - [448, 19]
              - [704, 17]
              - [1024, 22]
              - [1408, 18]
              - [1856, 21]
              - [2944, 19]
              - [3584, 18]
              - [4288, 23]
              - [5056, 17]
              - [5888, 18]
              - [-1, 16]
          - - 2368
            - - [4, 10]
              - [128, 4]
              - [448, 19]
              - [704, 17]
              - [1024, 18]
              - [1856, 17]
              - [2368, 18]
              - [2944, 17]
              - [4288, 18]
              - [5056, 19]
              - [-1, 18]
          - - 2944
            - - [4, 10]
              - [64, 4]
              - [128, 7]
              - [256, 19]
              - [704, 17]
              - [1024, 22]
              - [1408, 23]
              - [1856, 17]
              - [2368, 19]
              - [3584, 18]
              - [4288, 15]
              - [5056, 21]
              - [5888, 23]
              - [-1, 18]
          - - 3584
            - - [4, 8]
              - [64, 7]
              - [448, 17]
              - [704, 21]
              - [1024, 18]
              - [1408, 23]
              - [2368, 21]
              - [2944, 15]
              - [3584, 18]
              - [4288, 23]
              - [5056, 21]
              - [-1, 18]
          - - 4288
            - - [4, 6]
              - [128, 4]
              - [448, 17]
              - [704, 21]
              - [1024, 18]
              - [1408, 23]
              - [1856, 21]
              - [2944, 18]
              - [3584, 23]
              - [-1, 18]
          - - 5056
            - - [4, 25]
              - [64, 4]
              - [128, 7]
              - [448, 17]
              - [704, 21]
              - [1408, 23]
              - [2368, 19]
              - [-1, 18]
          - - 5888
            - - [4, 25]
              - [64, 11]
              - [448, 19]
              - [704, 21]
              - [1408, 23]
              - [2368, 21]
              - [2944, 23]
              - [3584, 18]
              - [5056, 15]
              - [-1, 18]
          - - -1
            - - [4, 25]
              - [64, 11]
              - [128, 4]
              - [256, 17]
              - [448, 21]
              - [704, 17]
              - [1024, 23]
              - [1408, 18]
              - [1856, 15]
              - [2368, 21]
              - [2944, 15]
              - [3584, 18]
              - [5056, 15]
              - [5888, 18]
              - [-1, 23]
