library/src/blas3/Tensile/Logic/asm_full/vega10_Cijk_Ailk_Bjlk_SB.yaml
- {MinimumRequiredVersion: 3.3.5}
- vega10
- gfx900
- [Device 6863,Device 6862]
- - - [4096, 7133, 1, 4096]
    - [25, 11741.3]
  - - [512, 16, 1, 512]
    - [6, 293.38]
  - - [1760, 7133, 1, 1760]
    - [18, 10616.3]
  - - [2560, 7133, 1, 2560]
    - [26, 11273.0]
  - - [1024, 32, 1, 512]
    - [8, 997.753]
  - - [3072, 7435, 1, 1024]
    - [25, 10377.5]
  - - [512, 32, 1, 512]
    - [8, 555.114]
  - - [2048, 7133, 1, 2048]
    - [25, 11292.0]
  - - [7680, 5481, 1, 2560]
    - [25, 11526.0]
  - - [1024, 16, 1, 512]
    - [6, 521.858]
- - - -1
    - - - -1
        - - - 4
            - - [-1, 11]
          - - 64
            - - [4, 30]
              - [128, 9]
              - [448, 16]
              - [704, 4]
              - [1408, 2]
              - [1856, 0]
              - [2368, 2]
              - [2944, 14]
              - [3584, 1]
              - [4288, 2]
              - [5888, 14]
              - [-1, 20]
          - - 128
            - - [4, 30]
              - [64, 9]
              - [256, 16]
              - [704, 2]
              - [1024, 0]
              - [1408, 14]
              - [1856, 3]
              - [3584, 14]
              - [4288, 2]
              - [5056, 13]
              - [5888, 18]
              - [-1, 14]
          - - 256
            - - [4, 30]
              - [64, 16]
              - [128, 4]
              - [256, 3]
              - [448, 0]
              - [2944, 20]
              - [3584, 17]
              - [4288, 20]
              - [5888, 18]
              - [-1, 20]
          - - 448
            - - [4, 11]
              - [64, 4]
              - [128, 2]
              - [256, 0]
              - [448, 7]
              - [704, 20]
              - [1024, 18]
              - [1408, 20]
              - [1856, 22]
              - [2944, 20]
              - [3584, 18]
              - [5888, 20]
              - [-1, 17]
          - - 704
            - - [4, 11]
              - [64, 4]
              - [128, 3]
              - [448, 20]
              - [704, 18]
              - [1024, 20]
              - [1408, 17]
              - [1856, 18]
              - [2368, 20]
              - [4288, 17]
              - [5056, 19]
              - [5888, 17]
              - [-1, 20]
          - - 1024
            - - [4, 6]
              - [64, 2]
              - [128, 1]
              - [704, 18]
              - [1024, 21]
              - [1408, 18]
              - [1856, 26]
              - [2368, 21]
              - [2944, 26]
              - [3584, 17]
              - [4288, 18]
              - [-1, 26]
          - - 1408
            - - [4, 15]
              - [64, 3]
              - [128, 13]
              - [448, 20]
              - [704, 18]
              - [1024, 19]
              - [1408, 25]
              - [2368, 20]
              - [5888, 26]
              - [-1, 20]
          - - 1856
            - - [4, 15]
              - [64, 1]
              - [128, 3]
              - [256, 18]
              - [448, 17]
              - [704, 20]
              - [1024, 26]
              - [1408, 19]
              - [1856, 17]
              - [2944, 20]
              - [3584, 17]
              - [4288, 26]
              - [5056, 20]
              - [5888, 17]
              - [-1, 20]
          - - 2368
            - - [4, 27]
              - [64, 3]
              - [128, 13]
              - [256, 20]
              - [448, 18]
              - [704, 20]
              - [1024, 19]
              - [1408, 20]
              - [1856, 18]
              - [2368, 17]
              - [2944, 26]
              - [3584, 23]
              - [4288, 18]
              - [-1, 26]
          - - 2944
            - - [4, 5]
              - [128, 13]
              - [256, 18]
              - [448, 20]
              - [704, 18]
              - [1408, 26]
              - [1856, 18]
              - [2368, 26]
              - [2944, 17]
              - [4288, 18]
              - [-1, 26]
          - - 3584
            - - [4, 5]
              - [64, 10]
              - [128, 20]
              - [256, 22]
              - [448, 18]
              - [704, 22]
              - [1024, 19]
              - [1408, 26]
              - [1856, 21]
              - [2368, 24]
              - [2944, 18]
              - [-1, 26]
          - - 4288
            - - [4, 12]
              - [128, 3]
              - [448, 18]
              - [704, 22]
              - [1024, 18]
              - [1856, 26]
              - [2944, 18]
              - [3584, 26]
              - [5056, 21]
              - [-1, 26]
          - - 5056
            - - [4, 29]
              - [128, 13]
              - [448, 18]
              - [704, 21]
              - [1408, 26]
              - [1856, 18]
              - [3584, 26]
              - [4288, 19]
              - [-1, 26]
          - - 5888
            - - [4, 29]
              - [64, 13]
              - [128, 20]
              - [448, 18]
              - [704, 21]
              - [1408, 26]
              - [1856, 21]
              - [5888, 26]
              - [-1, 25]
          - - -1
            - - [4, 12]
              - [64, 20]
              - [128, 17]
              - [704, 18]
              - [1024, 26]
              - [1856, 18]
              - [-1, 26]
