library/src/blas3/Tensile/Logic/asm_full/vega10_Cijk_Ailk_Bljk_HB.yaml
- {MinimumRequiredVersion: 4.4.0}
- vega10
- gfx900
- [Device 6863, Device 6862, Device 687f, Device 6860, Device 6861, 'Vega 10 XTX [Radeon
    SolutionIndex: 0
    SolutionNameMin: Cijk_Ailk_Bljk_HB_MT016x016x08_PGR1_PLR1_TT02_02
    SolutionIndex: 1
    SolutionNameMin: Cijk_Ailk_Bljk_HB_MT256x064x08_PGR1_PLR1_TT08_08
    SolutionIndex: 2
    SolutionNameMin: Cijk_Ailk_Bljk_HB_MT016x016x16_PGR1_PLR1_TT02_02
    SolutionIndex: 3
    SolutionNameMin: Cijk_Ailk_Bljk_HB_MT032x008x16_PGR1_PLR1_TT02_02
    SolutionIndex: 4
    SolutionNameMin: Cijk_Ailk_Bljk_HB_MT064x016x16_PGR1_PLR1_TT04_04
    SolutionIndex: 5
    SolutionNameMin: Cijk_Ailk_Bljk_HB_MT032x016x16_PGR1_PLR1_TT02_02
    SolutionIndex: 6
    SolutionNameMin: Cijk_Ailk_Bljk_HB_MT064x016x16_PGR1_PLR1_TT04_02
    SolutionIndex: 7
    SolutionNameMin: Cijk_Ailk_Bljk_HB_MT064x032x16_PGR1_PLR1_TT04_04
    SolutionIndex: 8
    SolutionNameMin: Cijk_Ailk_Bljk_HB_MT064x064x16_PGR1_PLR1_TT04_04
    SolutionIndex: 9
    SolutionNameMin: Cijk_Ailk_Bljk_HB_MT032x008x32_PGR1_PLR1_TT02_02
    SolutionIndex: 10
    SolutionNameMin: Cijk_Ailk_Bljk_HB_MT032x016x32_PGR1_PLR1_TT02_02
    SolutionIndex: 11
    SolutionNameMin: Cijk_Ailk_Bljk_HB_MT064x016x32_PGR1_PLR1_TT04_02
    SolutionIndex: 12
    SolutionNameMin: Cijk_Ailk_Bljk_HB_MT064x008x32_PGR1_PLR1_TT02_02
    SolutionIndex: 13
    SolutionNameMin: Cijk_Ailk_Bljk_HB_MT064x016x32_PGR1_PLR1_TT02_02
    SolutionIndex: 14
    SolutionNameMin: Cijk_Ailk_Bljk_HB_MT064x032x16_PGR1_PLR1_TT08_04
    SolutionIndex: 15
    SolutionNameMin: Cijk_Ailk_Bljk_HB_MT032x016x16_PGR1_PLR1_TT02_02
    SolutionIndex: 16
    SolutionNameMin: Cijk_Ailk_Bljk_HB_MT064x016x16_PGR1_PLR1_TT04_02
    SolutionIndex: 17
    SolutionNameMin: Cijk_Ailk_Bljk_HB_MT064x032x16_PGR1_PLR1_TT04_04
    SolutionIndex: 18
    SolutionNameMin: Cijk_Ailk_Bljk_HB_MT064x016x16_PGR1_PLR1_TT04_04
    SolutionIndex: 19
    SolutionNameMin: Cijk_Ailk_Bljk_HB_MT016x016x24_PGR1_PLR1_TT02_02
    SolutionIndex: 20
    SolutionNameMin: Cijk_Ailk_Bljk_HB_MT032x032x24_PGR1_PLR1_TT04_04
    SolutionIndex: 21
    SolutionNameMin: Cijk_Ailk_Bljk_HB_MT016x016x24_PGR1_PLR1_TT02_02
    SolutionIndex: 22
    SolutionNameMin: Cijk_Ailk_Bljk_HB_MT032x032x24_PGR1_PLR1_TT04_04
    SolutionIndex: 23
    SolutionNameMin: Cijk_Ailk_Bljk_HB_MT064x016x32_PGR1_PLR1_TT02_02
    SolutionIndex: 24
    SolutionNameMin: Cijk_Ailk_Bljk_HB_MT032x008x32_PGR1_PLR1_TT02_02
    SolutionIndex: 25
    SolutionNameMin: Cijk_Ailk_Bljk_HB_MT064x008x32_PGR1_PLR1_TT02_02
    SolutionIndex: 26
    SolutionNameMin: Cijk_Ailk_Bljk_HB_MT128x064x08_PGR1_PLR1_TT08_04
    SolutionIndex: 27
    SolutionNameMin: Cijk_Ailk_Bljk_HB_MT128x128x08_PGR1_PLR1_TT08_08
    SolutionIndex: 28
    SolutionNameMin: Cijk_Ailk_Bljk_HB_MT064x064x16_PGR1_PLR1_TT04_04
    SolutionIndex: 29
    SolutionNameMin: Cijk_Ailk_Bljk_HB_MT064x128x16_PGR1_PLR1_TT04_08
    SolutionIndex: 30
    SolutionNameMin: Cijk_Ailk_Bljk_HB_MT128x064x16_PGR1_PLR1_TT08_04
    SolutionIndex: 31
    SolutionNameMin: Cijk_Ailk_Bljk_HB_MT128x128x16_PGR1_PLR1_TT08_08
    SolutionIndex: 32
    SolutionNameMin: Cijk_Ailk_Bljk_HB_MT128x064x32_PGR0_PLR1_TT08_04
    SolutionIndex: 33
    SolutionNameMin: Cijk_Ailk_Bljk_HB_MT128x064x32_PGR1_PLR1_TT08_04
    SolutionIndex: 34
    SolutionNameMin: Cijk_Ailk_Bljk_HB_MT128x128x32_PGR0_PLR1_TT08_08
    SolutionIndex: 35
    SolutionNameMin: Cijk_Ailk_Bljk_HB_MT128x128x32_PGR1_PLR1_TT08_08
    SolutionIndex: 36
    SolutionNameMin: Cijk_Ailk_Bljk_HB_MT128x064x16_PGR1_PLR1_TT04_08
    SolutionIndex: 37
    SolutionNameMin: Cijk_Ailk_Bljk_HB_MT064x032x16_PGR1_PLR1_TT04_02
    SolutionIndex: 38
    SolutionNameMin: Cijk_Ailk_Bljk_HB_MT128x064x32_PGR1_PLR1_TT04_04
    SolutionIndex: 39
    SolutionNameMin: Cijk_Ailk_Bljk_HB_MT064x032x16_PGR1_PLR1_TT02_04
    SolutionIndex: 40
    SolutionNameMin: Cijk_Ailk_Bljk_HB_MT128x064x16_PGR1_PLR1_TT08_04
    SolutionIndex: 41
    SolutionNameMin: Cijk_Ailk_Bljk_HB_MT128x064x16_PGR1_PLR1_TT08_04
    SolutionIndex: 42
    SolutionNameMin: Cijk_Ailk_Bljk_HB_MT256x064x16_PGR1_PLR1_TT08_04
    SolutionIndex: 43
    SolutionNameMin: Cijk_Ailk_Bljk_HB_MT128x032x16_PGR0_PLR0_TT04_04
    SolutionIndex: 44
    SolutionNameMin: Cijk_Ailk_Bljk_HB_MT128x064x16_PGR0_PLR0_TT08_04
    SolutionIndex: 45
    SolutionNameMin: Cijk_Ailk_Bljk_HB_MT128x064x16_PGR0_PLR0_TT04_08
    SolutionIndex: 46
    SolutionNameMin: Cijk_Ailk_Bljk_HB_MT256x032x16_PGR0_PLR0_TT08_04
    SolutionIndex: 47
    SolutionNameMin: Cijk_Ailk_Bljk_HB_MT064x064x08_PGR0_PLR0_TT04_04
    SolutionIndex: 48
    SolutionNameMin: Cijk_Ailk_Bljk_HB_MT064x128x08_PGR0_PLR1_TT04_08
    SolutionIndex: 49
    SolutionNameMin: Cijk_Ailk_Bljk_HB_MT064x064x16_PGR1_PLR1_TT04_04
    SolutionIndex: 50
    SolutionNameMin: Cijk_Ailk_Bljk_HB_MT064x128x04_PGR0_PLR0_TT04_08
    SolutionIndex: 51
    SolutionNameMin: Cijk_Ailk_Bljk_HB_MT064x064x04_PGR1_PLR1_TT04_04
    SolutionIndex: 52
    SolutionNameMin: Cijk_Ailk_Bljk_HB_MT064x064x08_PGR1_PLR1_TT04_04
- - - [4096, 7000, 1, 4096]
    - [30, 21792.1]
  - - [5124, 9124, 1, 1760]
    - [31, 23233.4]
  - - [1760, 32, 1, 1760]
    - [19, 3111.9]
  - - [1024, 1500, 1, 1536]
    - [30, 19060.0]
  - - [512, 24000, 1, 2048]
    - [32, 18443.7]
  - - [3072, 24000, 1, 1024]
    - [31, 23743.9]
  - - [1024, 3000, 1, 2560]
    - [31, 21759.4]
  - - [512, 3136, 1, 2048]
    - [42, 14767.4]
  - - [7680, 4, 1, 2560]
    - [12, 1472.46]
  - - [64, 193600, 1, 64]
    - [37, 11001.9]
  - - [8448, 1500, 1, 2816]
    - [31, 22404.7]
  - - [784, 512, 64, 128]
    - [44, 18825.6]
  - - [2560, 7000, 1, 2560]
    - [31, 22869.1]
  - - [3072, 16, 1, 1024]
    - [12, 2461.75]
  - - [512, 48000, 1, 2048]
    - [34, 20099.7]
  - - [1760, 64, 1, 1760]
    - [13, 5484.07]
  - - [1024, 16, 1, 512]
    - [12, 826.586]
  - - [196, 256, 64, 1024]
    - [43, 10313.9]
  - - [512, 48000, 1, 1536]
    - [31, 23369.6]
  - - [2560, 32, 1, 2560]
    - [5, 4295.95]
  - - [4608, 1500, 1, 1536]
    - [30, 21837.8]
  - - [2048, 128, 1, 2048]
    - [18, 9741.19]
  - - [1024, 24000, 1, 2560]
    - [31, 23699.0]
  - - [4608, 3000, 1, 1536]
    - [31, 22768.8]
  - - [5124, 9124, 1, 2048]
    - [30, 21491.7]
  - - [2048, 16, 1, 2048]
    - [9, 1907.23]
  - - [1024, 700, 1, 512]
    - [28, 12324.2]
  - - [3072, 1, 1, 128]
    - [0, 68.054]
  - - [5124, 700, 1, 2560]
    - [31, 19158.1]
  - - [8448, 16, 1, 2816]
    - [11, 5302.74]
  - - [6144, 6000, 1, 2560]
    - [31, 23781.5]
  - - [4608, 32, 1, 1536]
    - [25, 5925.48]
  - - [3072, 64, 1, 1024]
    - [16, 7228.18]
  - - [512, 16, 1, 512]
    - [12, 425.731]
  - - [7680, 2, 1, 2560]
    - [12, 741.371]
  - - [4224, 1, 1, 128]
    - [0, 94.7882]
  - - [7680, 1, 1, 2560]
    - [12, 374.342]
  - - [128, 1500, 1, 1280]
    - [6, 7591.86]
  - - [1024, 1500, 1, 2816]
    - [30, 19788.6]
  - - [6144, 2, 1, 2560]
    - [9, 671.927]
  - - [8448, 48000, 1, 2816]
    - [31, 24216.2]
  - - [512, 6000, 1, 2048]
    - [32, 15543.8]
  - - [4224, 1500, 1, 176]
    - [26, 18677.0]
  - - [1024, 6000, 1, 2816]
    - [31, 22857.3]
  - - [1024, 48000, 1, 1536]
    - [31, 24307.5]
  - - [1024, 48000, 1, 2560]
    - [31, 24421.9]
  - - [4096, 32, 1, 4096]
    - [23, 6698.2]
  - - [512, 16, 1, 500000]
    - [9, 560.608]
  - - [2560, 128, 1, 2560]
    - [7, 9812.96]
  - - [4608, 24000, 1, 1536]
    - [31, 24251.4]
  - - [512, 2, 1, 500000]
    - [9, 70.076]
  - - [7680, 48000, 1, 2560]
    - [31, 24203.9]
  - - [3072, 48000, 1, 1024]
    - [31, 24067.6]
  - - [1760, 16, 1, 1760]
    - [21, 1612.18]
  - - [1024, 1500, 1, 2048]
    - [32, 14453.9]
  - - [1024, 16, 1, 500000]
    - [9, 1121.1]
  - - [64, 193600, 1, 256]
    - [39, 13689.1]
  - - [1024, 3000, 1, 2048]
    - [32, 16765.2]
  - - [6144, 4, 1, 2560]
    - [9, 1324.98]
  - - [1024, 6000, 1, 2048]
    - [32, 17959.6]
  - - [512, 24000, 1, 2816]
    - [31, 23075.0]
  - - [6144, 48000, 1, 2560]
    - [31, 24102.3]
  - - [1760, 7000, 1, 1760]
    - [31, 21972.4]
  - - [8448, 3000, 1, 2816]
    - [31, 23541.9]
  - - [3072, 4, 1, 1024]
    - [24, 622.208]
  - - [4608, 48000, 1, 1536]
    - [31, 24181.7]
  - - [2048, 32, 1, 2048]
    - [13, 3623.74]
  - - [7680, 1500, 1, 2560]
    - [30, 21967.3]
  - - [4096, 128, 1, 4096]
    - [14, 14045.5]
  - - [4608, 16, 1, 1536]
    - [12, 3622.66]
  - - [512, 3000, 1, 1536]
    - [30, 18969.1]
  - - [3072, 2, 1, 1024]
    - [9, 316.91]
  - - [8448, 1, 1, 2816]
    - [12, 364.111]
  - - [1024, 3000, 1, 2816]
    - [27, 21686.5]
  - - [128, 1, 1, 1408]
    - [9, 7.95077]
  - - [64, 1, 1, 1216]
    - [2, 3.46724]
  - - [1024, 2, 1, 512]
    - [9, 103.318]
  - - [1024, 4, 1, 500000]
    - [9, 280.29]
  - - [6144, 1, 1, 2560]
    - [9, 332.28]
  - - [5124, 9124, 1, 2560]
    - [31, 23214.1]
  - - [512, 48000, 1, 2816]
    - [31, 23824.1]
  - - [512, 3000, 1, 2816]
    - [30, 19686.5]
  - - [1024, 24000, 1, 1536]
    - [31, 23339.2]
  - - [7680, 6000, 1, 2560]
    - [31, 23831.6]
  - - [1760, 128, 1, 1760]
    - [4, 8563.93]
  - - [512, 1500, 1, 2816]
    - [28, 16103.2]
  - - [512, 1, 1, 512]
    - [9, 26.6082]
  - - [512, 6000, 1, 2560]
    - [31, 21582.4]
  - - [512, 8, 1, 500000]
    - [9, 280.298]
  - - [512, 24000, 1, 2560]
    - [31, 22943.9]
  - - [6144, 3000, 1, 2560]
    - [31, 23226.4]
  - - [1024, 24000, 1, 2816]
    - [31, 23727.7]
  - - [2048, 7000, 1, 2048]
    - [34, 20839.6]
  - - [7680, 3000, 1, 2560]
    - [31, 23154.2]
  - - [1024, 4, 1, 512]
    - [3, 208.164]
  - - [5124, 700, 1, 2048]
    - [34, 16841.7]
  - - [5124, 9124, 1, 4096]
    - [30, 21481.0]
  - - [4096, 64, 1, 4096]
    - [18, 10375.8]
  - - [256, 193600, 1, 64]
    - [36, 17978.0]
  - - [7680, 32, 1, 2560]
    - [22, 9384.7]
  - - [2560, 64, 1, 2560]
    - [15, 6981.6]
  - - [3136, 2048, 1, 512]
    - [44, 20113.6]
  - - [3072, 128, 1, 1024]
    - [18, 10255.9]
  - - [8448, 6000, 1, 2816]
    - [31, 24197.8]
  - - [7680, 64, 1, 2560]
    - [17, 13787.5]
  - - [5124, 1500, 1, 2560]
    - [31, 21691.7]
  - - [1024, 1500, 1, 2560]
    - [30, 19660.0]
  - - [512, 4, 1, 512]
    - [9, 105.639]
  - - [1024, 6000, 1, 2560]
    - [31, 22560.1]
  - - [3072, 32, 1, 1024]
    - [13, 4440.86]
  - - [6144, 32, 1, 2560]
    - [20, 7694.79]
  - - [3136, 512, 1, 2048]
    - [46, 12621.8]
  - - [196, 1024, 64, 256]
    - [45, 16496.0]
  - - [512, 50176, 1, 128]
    - [1, 21867.4]
  - - [4608, 1, 1, 1536]
    - [12, 241.892]
  - - [1024, 32, 1, 512]
    - [13, 1606.24]
  - - [7680, 24000, 1, 2560]
    - [31, 24061.3]
  - - [8448, 4, 1, 2816]
    - [12, 1461.42]
  - - [512, 1, 1, 500000]
    - [9, 35.0387]
  - - [176, 1500, 1, 1408]
    - [7, 7602.87]
  - - [512, 3000, 1, 2560]
    - [30, 19594.7]
  - - [8448, 24000, 1, 2816]
    - [31, 24215.1]
  - - [4608, 2, 1, 1536]
    - [12, 481.35]
  - - [512, 6000, 1, 1536]
    - [30, 21113.2]
  - - [7680, 128, 1, 2560]
    - [30, 17610.6]
  - - [3072, 6000, 1, 1024]
    - [30, 22313.2]
  - - [3072, 1500, 1, 128]
    - [26, 16519.4]
  - - [2048, 3136, 1, 512]
    - [41, 21421.0]
  - - [1024, 3000, 1, 1536]
    - [30, 21176.4]
  - - [512, 4, 1, 500000]
    - [9, 140.151]
  - - [512, 6000, 1, 2816]
    - [31, 21869.0]
  - - [128, 50176, 1, 512]
    - [8, 16763.6]
  - - [256, 12544, 1, 1024]
    - [38, 14826.9]
  - - [1024, 12544, 1, 256]
    - [40, 22019.3]
  - - [512, 48000, 1, 2560]
    - [31, 23627.6]
  - - [2560, 16, 1, 2560]
    - [12, 2423.84]
  - - [2048, 64, 1, 2048]
    - [23, 6291.19]
  - - [512, 2, 1, 512]
    - [9, 53.6191]
  - - [1024, 1, 1, 512]
    - [3, 45.9579]
  - - [512, 1500, 1, 2560]
    - [28, 14607.1]
  - - [512, 24000, 1, 1536]
    - [31, 23344.0]
  - - [1024, 1, 1, 500000]
    - [9, 70.0752]
  - - [6144, 16, 1, 2560]
    - [10, 4881.12]
  - - [1024, 24000, 1, 2048]
    - [34, 21301.3]
  - - [4096, 16, 1, 4096]
    - [9, 3896.47]
  - - [512, 32, 1, 512]
    - [10, 826.586]
  - - [5124, 1500, 1, 2048]
    - [34, 18589.5]
  - - [3072, 1500, 1, 1024]
    - [30, 19868.5]
  - - [1024, 2, 1, 500000]
    - [9, 140.148]
  - - [1024, 8, 1, 500000]
    - [9, 560.562]
  - - [7680, 16, 1, 2560]
    - [13, 5801.3]
  - - [6144, 1500, 1, 2560]
    - [31, 22610.5]
  - - [3072, 1, 1, 1024]
    - [9, 156.699]
  - - [1024, 48000, 1, 2816]
    - [31, 24444.2]
  - - [8448, 2, 1, 2816]
    - [12, 724.116]
  - - [4608, 4, 1, 1536]
    - [12, 967.569]
  - - [1024, 6000, 1, 1536]
    - [31, 21977.4]
  - - [8448, 32, 1, 2816]
    - [16, 8093.99]
  - - [512, 3000, 1, 2048]
    - [35, 13464.1]
  - - [6144, 24000, 1, 2560]
    - [31, 24094.3]
  - - [4608, 6000, 1, 1536]
    - [31, 23495.6]
  - - [1024, 1024, 1, 1024]
    - [33, 15436.5]
  - - [512, 1500, 1, 2048]
    - [33, 11782.9]
  - - [512, 1500, 1, 1536]
    - [28, 13847.5]
  - - [128, 1, 1, 1024]
    - [3, 6.85828]
  - - [3072, 3000, 1, 1024]
    - [34, 21151.7]
  - - [1024, 48000, 1, 2048]
    - [34, 22030.8]
- - - -1
    - - - 1
        - - - 32
            - - [64, 51]
              - [128, 52]
              - [256, 51]
              - [448, 52]
              - [2368, 51]
              - [2944, 52]
              - [3584, 51]
              - [5888, 52]
              - [-1, 51]
          - - 64
            - - [64, 51]
              - [128, 52]
              - [448, 51]
              - [1024, 52]
              - [1856, 50]
              - [2368, 52]
              - [2944, 50]
              - [3584, 51]
              - [5056, 50]
              - [-1, 51]
          - - 128
            - - [32, 52]
              - [64, 51]
              - [256, 52]
              - [5056, 51]
              - [5888, 52]
              - [-1, 51]
          - - 256
            - - [32, 51]
              - [64, 52]
              - [128, 51]
              - [256, 52]
              - [448, 51]
              - [704, 50]
              - [3584, 51]
              - [-1, 50]
          - - 448
            - - [32, 52]
              - [128, 51]
              - [256, 52]
              - [448, 51]
              - [704, 52]
              - [1856, 51]
              - [2368, 52]
              - [2944, 51]
              - [5056, 50]
              - [5888, 51]
              - [-1, 50]
          - - 704
            - - [32, 52]
              - [64, 51]
              - [128, 52]
              - [448, 51]
              - [704, 52]
              - [1024, 51]
              - [1408, 52]
              - [1856, 51]
              - [2944, 50]
              - [4288, 51]
              - [-1, 50]
          - - 1024
            - - [32, 52]
              - [64, 51]
              - [128, 52]
              - [256, 51]
              - [448, 52]
              - [1024, 50]
              - [2368, 51]
              - [-1, 50]
          - - 1408
            - - [32, 52]
              - [64, 51]
              - [128, 52]
              - [448, 51]
              - [704, 50]
              - [1408, 51]
              - [1856, 50]
              - [2368, 51]
              - [-1, 50]
          - - 1856
            - - [32, 51]
              - [64, 52]
              - [128, 50]
              - [256, 52]
              - [448, 51]
              - [1024, 50]
              - [2368, 51]
              - [3584, 50]
              - [5056, 51]
              - [5888, 50]
              - [-1, 51]
          - - 2368
            - - [32, 52]
              - [64, 51]
              - [128, 52]
              - [448, 51]
              - [704, 50]
              - [2944, 51]
              - [3584, 50]
              - [4288, 51]
              - [-1, 50]
          - - 2944
            - - [64, 51]
              - [128, 52]
              - [1024, 51]
              - [1408, 50]
              - [1856, 51]
              - [-1, 50]
          - - 3584
            - - [256, 51]
              - [448, 50]
              - [704, 51]
              - [-1, 50]
          - - 4288
            - - [128, 51]
              - [1408, 50]
              - [2368, 51]
              - [3584, 50]
              - [5888, 51]
              - [-1, 50]
          - - 5056
            - - [64, 52]
              - [1024, 51]
              - [2368, 50]
              - [-1, 51]
          - - 5888
            - - [64, 51]
              - [128, 52]
              - [-1, 50]
          - - -1
            - - [64, 51]
              - [256, 52]
              - [-1, 50]
      - - 32
        - - - 128
            - - [-1, 47]
          - - 256
            - - [5056, 47]
              - [-1, 48]
          - - 448
            - - [2944, 47]
              - [4288, 48]
              - [-1, 47]
          - - 704
            - - [1408, 47]
              - [2944, 48]
              - [5056, 47]
              - [-1, 48]
          - - 1024
            - - [1408, 47]
              - [1856, 48]
              - [5056, 47]
              - [5888, 48]
              - [-1, 47]
          - - 1408
            - - [4288, 47]
              - [-1, 48]
          - - 1856
            - - [704, 47]
              - [1024, 48]
              - [1408, 47]
              - [-1, 48]
          - - 2368
            - - [448, 47]
              - [704, 48]
              - [1408, 47]
              - [-1, 48]
          - - 2944
            - - [256, 47]
              - [448, 48]
              - [1024, 47]
              - [1408, 48]
              - [1856, 47]
              - [-1, 48]
          - - 3584
            - - [64, 47]
              - [128, 49]
              - [704, 47]
              - [-1, 48]
          - - 4288
            - - [704, 47]
              - [-1, 48]
          - - 5056
            - - [128, 47]
              - [256, 48]
              - [448, 47]
              - [-1, 48]
          - - 5888
            - - [64, 47]
              - [128, 49]
              - [448, 47]
              - [-1, 48]
          - - -1
            - - [128, 47]
              - [256, 48]
              - [448, 47]
              - [-1, 48]
      - - 256
        - - - 1
            - - [-1, 52]
          - - 32
            - - [-1, 49]
          - - 64
            - - [1, 51]
              - [32, 49]
              - [64, 3]
              - [256, 10]
              - [704, 2]
              - [1856, 3]
              - [2368, 5]
              - [5056, 6]
              - [5888, 7]
              - [-1, 4]
          - - 128
            - - [1, 52]
              - [32, 49]
              - [64, 12]
              - [128, 10]
              - [256, 13]
              - [448, 3]
              - [704, 5]
              - [1024, 3]
              - [1856, 6]
              - [2368, 16]
              - [2944, 7]
              - [3584, 4]
              - [5056, 7]
              - [5888, 28]
              - [-1, 7]
          - - 256
            - - [1, 52]
              - [32, 49]
              - [128, 2]
              - [256, 15]
              - [448, 5]
              - [5056, 28]
              - [5888, 30]
              - [-1, 28]
          - - 448
            - - [1, 51]
              - [32, 49]
              - [64, 2]
              - [256, 3]
              - [448, 6]
              - [1408, 28]
              - [1856, 26]
              - [2368, 28]
              - [2944, 26]
              - [3584, 28]
              - [4288, 29]
              - [5056, 26]
              - [5888, 30]
              - [-1, 29]
          - - 704
            - - [1, 52]
              - [32, 49]
              - [64, 12]
              - [128, 3]
              - [1856, 28]
              - [2368, 30]
              - [5888, 29]
              - [-1, 31]
          - - 1024
            - - [1, 51]
              - [32, 49]
              - [64, 13]
              - [128, 5]
              - [704, 28]
              - [1024, 26]
              - [1856, 30]
              - [2944, 26]
              - [4288, 30]
              - [5888, 31]
              - [-1, 30]
          - - 1408
            - - [1, 51]
              - [32, 49]
              - [64, 2]
              - [128, 6]
              - [704, 28]
              - [1024, 26]
              - [1408, 30]
              - [1856, 26]
              - [2368, 30]
              - [2944, 31]
              - [3584, 30]
              - [4288, 31]
              - [5056, 30]
              - [5888, 31]
              - [-1, 26]
          - - 1856
            - - [1, 52]
              - [32, 49]
              - [64, 5]
              - [128, 6]
              - [704, 28]
              - [1024, 30]
              - [1408, 29]
              - [1856, 26]
              - [2944, 30]
              - [4288, 31]
              - [5056, 26]
              - [5888, 31]
              - [-1, 26]
          - - 2368
            - - [1, 52]
              - [32, 49]
              - [64, 5]
              - [128, 6]
              - [448, 28]
              - [2368, 26]
              - [2944, 31]
              - [3584, 30]
              - [4288, 26]
              - [5888, 30]
              - [-1, 27]
          - - 2944
            - - [1, 51]
              - [32, 49]
              - [64, 6]
              - [128, 7]
              - [256, 28]
              - [448, 26]
              - [704, 30]
              - [1024, 26]
              - [1408, 31]
              - [1856, 30]
              - [2944, 26]
              - [3584, 30]
              - [5056, 26]
              - [5888, 31]
              - [-1, 26]
          - - 3584
            - - [1, 51]
              - [32, 49]
              - [64, 6]
              - [128, 7]
              - [256, 28]
              - [704, 26]
              - [1024, 30]
              - [1408, 31]
              - [3584, 26]
              - [4288, 31]
              - [5056, 27]
              - [-1, 31]
          - - 4288
            - - [1, 52]
              - [32, 49]
              - [64, 17]
              - [128, 7]
              - [256, 28]
              - [704, 30]
              - [2368, 26]
              - [2944, 30]
              - [3584, 26]
              - [4288, 27]
              - [5888, 26]
              - [-1, 31]
          - - 5056
            - - [1, 52]
              - [32, 49]
              - [64, 6]
              - [128, 7]
              - [256, 28]
              - [1024, 30]
              - [1408, 26]
              - [1856, 30]
              - [3584, 31]
              - [4288, 26]
              - [-1, 31]
          - - 5888
            - - [1, 52]
              - [32, 49]
              - [64, 8]
              - [128, 28]
              - [448, 30]
              - [704, 26]
              - [1408, 31]
              - [1856, 26]
              - [3584, 31]
              - [4288, 26]
              - [-1, 31]
          - - -1
            - - [1, 52]
              - [32, 49]
              - [64, 8]
              - [128, 26]
              - [256, 28]
              - [448, 30]
              - [704, 26]
              - [1024, 31]
              - [2368, 26]
              - [2944, 27]
              - [4288, 30]
              - [5888, 31]
              - [-1, 27]
      - - 1280
        - - - 1
            - - [-1, 52]
          - - 32
            - - [-1, 49]
          - - 64
            - - [1, 52]
              - [32, 49]
              - [256, 9]
              - [448, 21]
              - [1024, 19]
              - [1408, 15]
              - [1856, 13]
              - [2368, 5]
              - [2944, 11]
              - [3584, 20]
              - [4288, 17]
              - [5056, 6]
              - [-1, 7]
          - - 128
            - - [1, 52]
              - [32, 49]
              - [64, 9]
              - [256, 12]
              - [448, 9]
              - [704, 15]
              - [1024, 13]
              - [1408, 6]
              - [1856, 4]
              - [5056, 7]
              - [5888, 28]
              - [-1, 30]
          - - 256
            - - [1, 52]
              - [32, 49]
              - [64, 5]
              - [128, 12]
              - [448, 13]
              - [2944, 28]
              - [3584, 30]
              - [5056, 28]
              - [-1, 30]
          - - 448
            - - [1, 52]
              - [32, 49]
              - [64, 12]
              - [128, 23]
              - [256, 13]
              - [448, 4]
              - [1408, 28]
              - [1856, 30]
              - [2368, 28]
              - [2944, 30]
              - [3584, 28]
              - [4288, 29]
              - [5056, 30]
              - [5888, 31]
              - [-1, 29]
          - - 704
            - - [1, 52]
              - [32, 49]
              - [64, 19]
              - [128, 5]
              - [1024, 28]
              - [1408, 14]
              - [1856, 28]
              - [2368, 30]
              - [2944, 29]
              - [3584, 31]
              - [4288, 29]
              - [5056, 31]
              - [5888, 29]
              - [-1, 31]
          - - 1024
            - - [1, 52]
              - [32, 49]
              - [64, 19]
              - [128, 23]
              - [704, 28]
              - [2944, 30]
              - [4288, 26]
              - [-1, 31]
          - - 1408
            - - [1, 52]
              - [32, 49]
              - [64, 15]
              - [128, 6]
              - [448, 28]
              - [1408, 30]
              - [1856, 26]
              - [2368, 30]
              - [4288, 31]
              - [5056, 27]
              - [5888, 31]
              - [-1, 30]
          - - 1856
            - - [1, 52]
              - [32, 49]
              - [64, 13]
              - [128, 4]
              - [256, 28]
              - [448, 30]
              - [704, 28]
              - [1024, 30]
              - [1408, 29]
              - [2944, 30]
              - [3584, 31]
              - [4288, 27]
              - [5056, 26]
              - [5888, 31]
              - [-1, 26]
          - - 2368
            - - [1, 52]
              - [32, 49]
              - [64, 5]
              - [128, 7]
              - [448, 28]
              - [1408, 30]
              - [1856, 26]
              - [2368, 30]
              - [2944, 31]
              - [4288, 26]
              - [-1, 31]
          - - 2944
            - - [1, 52]
              - [32, 49]
              - [64, 6]
              - [128, 7]
              - [256, 28]
              - [704, 30]
              - [1024, 26]
              - [1408, 31]
              - [1856, 26]
              - [2368, 31]
              - [5056, 26]
              - [-1, 31]
          - - 3584
            - - [1, 52]
              - [32, 49]
              - [64, 18]
              - [128, 4]
              - [1024, 30]
              - [1408, 31]
              - [1856, 26]
              - [2368, 30]
              - [3584, 26]
              - [4288, 27]
              - [5888, 26]
              - [-1, 31]
          - - 4288
            - - [1, 52]
              - [32, 49]
              - [128, 7]
              - [256, 28]
              - [704, 30]
              - [1024, 26]
              - [1408, 31]
              - [1856, 30]
              - [2944, 26]
              - [3584, 31]
              - [4288, 26]
              - [5056, 30]
              - [-1, 31]
          - - 5056
            - - [1, 52]
              - [32, 49]
              - [128, 17]
              - [256, 28]
              - [448, 30]
              - [704, 26]
              - [1024, 31]
              - [1408, 26]
              - [1856, 30]
              - [2368, 27]
              - [2944, 26]
              - [3584, 31]
              - [4288, 26]
              - [-1, 31]
          - - 5888
            - - [1, 52]
              - [32, 49]
              - [64, 17]
              - [128, 28]
              - [256, 30]
              - [704, 26]
              - [1408, 31]
              - [1856, 30]
              - [2368, 26]
              - [3584, 31]
              - [4288, 27]
              - [-1, 31]
          - - -1
            - - [1, 52]
              - [32, 49]
              - [64, 7]
              - [448, 30]
              - [704, 31]
              - [1408, 26]
              - [1856, 30]
              - [2368, 31]
              - [2944, 27]
              - [-1, 31]
      - - -1
        - - - 1
            - - [-1, 52]
          - - 32
            - - [-1, 49]
          - - 64
            - - [1, 52]
              - [32, 49]
              - [64, 9]
              - [128, 24]
              - [256, 9]
              - [704, 19]
              - [1024, 9]
              - [1408, 15]
              - [1856, 13]
              - [2368, 5]
              - [2944, 6]
              - [3584, 22]
              - [5056, 6]
              - [-1, 7]
          - - 128
            - - [1, 52]
              - [32, 49]
              - [128, 9]
              - [448, 19]
              - [704, 15]
              - [1024, 13]
              - [1408, 6]
              - [1856, 22]
              - [5056, 7]
              - [5888, 28]
              - [-1, 30]
          - - 256
            - - [1, 52]
              - [32, 49]
              - [64, 24]
              - [128, 19]
              - [256, 24]
              - [448, 13]
              - [704, 22]
              - [2944, 28]
              - [3584, 30]
              - [5056, 28]
              - [-1, 30]
          - - 448
            - - [1, 52]
              - [32, 49]
              - [128, 19]
              - [256, 13]
              - [448, 4]
              - [1408, 28]
              - [1856, 30]
              - [2368, 28]
              - [2944, 30]
              - [3584, 28]
              - [4288, 29]
              - [5056, 30]
              - [5888, 31]
              - [-1, 29]
          - - 704
            - - [1, 52]
              - [32, 49]
              - [64, 19]
              - [128, 12]
              - [256, 22]
              - [1024, 28]
              - [1408, 14]
              - [1856, 28]
              - [2368, 30]
              - [5888, 29]
              - [-1, 31]
          - - 1024
            - - [1, 52]
              - [32, 49]
              - [64, 9]
              - [128, 23]
              - [256, 22]
              - [704, 28]
              - [1408, 30]
              - [1856, 31]
              - [2368, 26]
              - [2944, 31]
              - [3584, 30]
              - [4288, 26]
              - [5056, 31]
              - [5888, 27]
              - [-1, 31]
          - - 1408
            - - [1, 52]
              - [32, 49]
              - [64, 15]
              - [128, 6]
              - [448, 28]
              - [1408, 30]
              - [2368, 26]
              - [5888, 31]
              - [-1, 26]
          - - 1856
            - - [1, 52]
              - [32, 49]
              - [64, 13]
              - [128, 20]
              - [256, 28]
              - [448, 30]
              - [704, 28]
              - [1024, 30]
              - [1408, 29]
              - [1856, 30]
              - [2944, 26]
              - [4288, 31]
              - [5056, 26]
              - [5888, 31]
              - [-1, 26]
          - - 2368
            - - [1, 52]
              - [32, 49]
              - [64, 15]
              - [128, 17]
              - [448, 28]
              - [704, 31]
              - [1024, 26]
              - [1408, 30]
              - [1856, 26]
              - [2368, 30]
              - [2944, 31]
              - [4288, 26]
              - [-1, 31]
          - - 2944
            - - [1, 52]
              - [32, 49]
              - [64, 6]
              - [128, 17]
              - [256, 28]
              - [704, 30]
              - [1408, 31]
              - [1856, 26]
              - [2368, 31]
              - [2944, 30]
              - [3584, 26]
              - [4288, 30]
              - [-1, 31]
          - - 3584
            - - [1, 52]
              - [32, 49]
              - [64, 18]
              - [128, 17]
              - [1024, 30]
              - [1408, 31]
              - [3584, 26]
              - [-1, 31]
          - - 4288
            - - [1, 52]
              - [32, 49]
              - [64, 17]
              - [128, 4]
              - [256, 28]
              - [704, 30]
              - [1024, 26]
              - [1856, 31]
              - [2368, 26]
              - [3584, 31]
              - [5056, 26]
              - [-1, 31]
          - - 5056
            - - [1, 52]
              - [32, 49]
              - [128, 17]
              - [256, 28]
              - [448, 30]
              - [704, 26]
              - [1408, 31]
              - [1856, 30]
              - [3584, 31]
              - [4288, 26]
              - [-1, 31]
          - - 5888
            - - [1, 52]
              - [32, 49]
              - [64, 17]
              - [128, 28]
              - [256, 30]
              - [448, 27]
              - [704, 30]
              - [1408, 31]
              - [2368, 26]
              - [-1, 31]
          - - -1
            - - [1, 52]
              - [32, 49]
              - [64, 17]
              - [256, 30]
              - [448, 26]
              - [1024, 31]
              - [1856, 26]
              - [-1, 31]
