library/src/blas3/Tensile/Logic/asm_full/vega10_Cijk_Alik_Bljk_SB.yaml
- {MinimumRequiredVersion: 4.1.0}
- vega10
- gfx900
- [Device 6863, Device 6862, Device 687f, Device 6860]
- - - [4096, 7000, 1, 4096]
    - [34, 8887.78]
  - - [7680, 12000, 1, 2560]
    - [34, 10395.7]
  - - [5124, 9124, 1, 1760]
    - [38, 10677.7]
  - - [1760, 32, 1, 1760]
    - [7, 3416.44]
  - - [512, 24000, 1, 1536]
    - [34, 10360.9]
  - - [3072, 24000, 1, 1024]
    - [37, 9902.86]
  - - [2048, 400, 1, 512]
    - [34, 5137.69]
  - - [2560, 7000, 1, 2560]
    - [37, 10323.5]
  - - [3072, 16, 1, 1024]
    - [22, 907.402]
  - - [512, 48000, 1, 2816]
    - [38, 10933.4]
  - - [512, 48000, 1, 2048]
    - [34, 8691.03]
  - - [1760, 64, 1, 1760]
    - [13, 4890.8]
  - - [35, 8457, 1, 4096]
    - [4, 3916.59]
  - - [2048, 1600, 1, 2048]
    - [27, 6467.65]
  - - [512, 48000, 1, 1536]
    - [37, 10361.1]
  - - [2560, 32, 1, 2560]
    - [13, 2954.95]
  - - [8448, 5984, 1, 2816]
    - [40, 10851.1]
  - - [4096, 3200, 1, 1024]
    - [36, 8029.73]
  - - [1024, 24000, 1, 2560]
    - [34, 10565.1]
  - - [1760, 6400, 1, 1760]
    - [40, 10966.8]
  - - [1024, 700, 1, 512]
    - [27, 5140.25]
  - - [4608, 32, 1, 1536]
    - [23, 2866.77]
  - - [3072, 64, 1, 1024]
    - [15, 2330.1]
  - - [16384, 3200, 1, 4096]
    - [34, 9018.16]
  - - [2560, 16, 1, 2560]
    - [12, 1694.86]
  - - [1024, 48000, 1, 2560]
    - [34, 10761.6]
  - - [35, 8457, 1, 2560]
    - [4, 3939.21]
  - - [8448, 48000, 1, 2816]
    - [38, 10977.9]
  - - [2048, 32, 1, 2048]
    - [12, 2062.72]
  - - [2560, 3200, 1, 2560]
    - [37, 9132.15]
  - - [16384, 800, 1, 4096]
    - [34, 7301.1]
  - - [4608, 24000, 1, 1536]
    - [34, 10877.9]
  - - [7680, 48000, 1, 2560]
    - [37, 10664.7]
  - - [3072, 48000, 1, 1024]
    - [37, 10116.8]
  - - [1760, 16, 1, 1760]
    - [24, 2002.74]
  - - [8192, 3200, 1, 2048]
    - [27, 8623.13]
  - - [512, 24000, 1, 2816]
    - [38, 10782.0]
  - - [4096, 400, 1, 1024]
    - [41, 4954.3]
  - - [6144, 48000, 1, 2560]
    - [34, 10240.0]
  - - [4608, 48000, 1, 1536]
    - [37, 11021.0]
  - - [35, 8457, 1, 2048]
    - [4, 3424.86]
  - - [4096, 128, 1, 4096]
    - [19, 5242.76]
  - - [2048, 800, 1, 512]
    - [37, 6642.01]
  - - [4608, 5984, 1, 1536]
    - [37, 10543.3]
  - - [2560, 128, 1, 2560]
    - [17, 4913.04]
  - - [6144, 5984, 1, 2048]
    - [27, 9095.88]
  - - [35, 8457, 1, 1760]
    - [3, 4259.14]
  - - [7680, 24000, 1, 2560]
    - [34, 10472.8]
  - - [6144, 48000, 1, 2048]
    - [34, 9538.38]
  - - [5124, 9124, 1, 2560]
    - [34, 10415.7]
  - - [2048, 3200, 1, 2048]
    - [27, 7786.26]
  - - [2048, 16, 1, 2048]
    - [23, 1278.72]
  - - [1024, 24000, 1, 1536]
    - [34, 10475.4]
  - - [7680, 16, 1, 2560]
    - [16, 1968.66]
  - - [2560, 6400, 1, 2560]
    - [37, 10443.7]
  - - [2048, 128, 1, 2048]
    - [14, 3390.01]
  - - [512, 16, 1, 500000]
    - [1, 2896.88]
  - - [1024, 8, 1, 500000]
    - [0, 1555.88]
  - - [512, 24000, 1, 2560]
    - [37, 10331.1]
  - - [1024, 24000, 1, 2816]
    - [34, 10699.2]
  - - [7680, 5984, 1, 2560]
    - [37, 10332.2]
  - - [2048, 1600, 1, 512]
    - [42, 6247.97]
  - - [2048, 7000, 1, 2048]
    - [27, 8344.28]
  - - [1760, 800, 1, 1760]
    - [25, 8526.34]
  - - [5124, 9124, 1, 4096]
    - [37, 9029.27]
  - - [4096, 64, 1, 4096]
    - [19, 4374.02]
  - - [7680, 32, 1, 2560]
    - [6, 3669.49]
  - - [2560, 64, 1, 2560]
    - [8, 4028.76]
  - - [3072, 128, 1, 1024]
    - [15, 2786.5]
  - - [7680, 64, 1, 2560]
    - [21, 5064.19]
  - - [1760, 128, 1, 1760]
    - [18, 5918.88]
  - - [2560, 1600, 1, 2560]
    - [27, 7878.41]
  - - [2048, 3200, 1, 512]
    - [37, 8009.63]
  - - [2560, 800, 1, 2560]
    - [39, 7282.31]
  - - [3072, 32, 1, 1024]
    - [12, 1838.37]
  - - [6144, 32, 1, 2560]
    - [23, 3178.14]
  - - [4608, 12000, 1, 1536]
    - [37, 10769.4]
  - - [4096, 32, 1, 4096]
    - [5, 3027.09]
  - - [6144, 24000, 1, 2048]
    - [34, 9298.5]
  - - [8192, 800, 1, 2048]
    - [27, 6819.58]
  - - [4096, 1600, 1, 1024]
    - [36, 6724.34]
  - - [5124, 9124, 1, 2048]
    - [36, 8871.82]
  - - [8448, 24000, 1, 2816]
    - [38, 11059.4]
  - - [1024, 48000, 1, 1536]
    - [34, 10854.6]
  - - [7680, 128, 1, 2560]
    - [20, 5976.79]
  - - [8192, 1600, 1, 2048]
    - [27, 7841.73]
  - - [4096, 800, 1, 1024]
    - [42, 5941.16]
  - - [1024, 16, 1, 500000]
    - [2, 2986.55]
  - - [2048, 800, 1, 2048]
    - [42, 5529.03]
  - - [1760, 3200, 1, 1760]
    - [25, 10293.8]
  - - [512, 48000, 1, 2560]
    - [34, 10428.6]
  - - [8448, 16, 1, 2816]
    - [15, 2112.28]
  - - [2048, 64, 1, 2048]
    - [9, 2798.22]
  - - [512, 24000, 1, 2048]
    - [35, 8324.37]
  - - [16384, 1600, 1, 4096]
    - [34, 8218.27]
  - - [4608, 16, 1, 1536]
    - [12, 1646.83]
  - - [1024, 24000, 1, 2048]
    - [34, 8860.99]
  - - [8192, 400, 1, 2048]
    - [26, 5679.43]
  - - [2048, 6400, 1, 2048]
    - [26, 7983.21]
  - - [6144, 12000, 1, 2048]
    - [27, 9171.02]
  - - [512, 8, 1, 500000]
    - [0, 1558.32]
  - - [1760, 7000, 1, 1760]
    - [31, 10462.3]
  - - [1024, 48000, 1, 2816]
    - [38, 10960.2]
  - - [6144, 16, 1, 2560]
    - [24, 1892.44]
  - - [8448, 32, 1, 2816]
    - [7, 3748.27]
  - - [4096, 16, 1, 4096]
    - [11, 1651.26]
  - - [6144, 24000, 1, 2560]
    - [37, 9995.43]
  - - [1024, 1024, 1, 1024]
    - [36, 4429.19]
  - - [8448, 12000, 1, 2816]
    - [34, 11067.5]
  - - [16384, 400, 1, 4096]
    - [37, 6384.29]
  - - [1760, 1600, 1, 1760]
    - [40, 9457.76]
  - - [1024, 48000, 1, 2048]
    - [34, 9241.7]
- - - -1
    - - - -1
        - - - 4
            - - [-1, 43]
          - - 64
            - - [4, 43]
              - [128, 11]
              - [256, 15]
              - [448, 8]
              - [1408, 17]
              - [2368, 13]
              - [5888, 17]
              - [-1, 32]
          - - 128
            - - [4, 43]
              - [64, 11]
              - [128, 15]
              - [256, 7]
              - [704, 17]
              - [1024, 14]
              - [1408, 17]
              - [1856, 10]
              - [2368, 17]
              - [2944, 10]
              - [3584, 32]
              - [4288, 17]
              - [5056, 10]
              - [5888, 32]
              - [-1, 30]
          - - 256
            - - [4, 43]
              - [64, 24]
              - [128, 8]
              - [256, 17]
              - [448, 14]
              - [2368, 32]
              - [2944, 29]
              - [3584, 25]
              - [4288, 32]
              - [5056, 29]
              - [5888, 25]
              - [-1, 40]
          - - 448
            - - [4, 43]
              - [64, 7]
              - [128, 17]
              - [256, 14]
              - [448, 13]
              - [1408, 29]
              - [1856, 25]
              - [2368, 32]
              - [2944, 25]
              - [3584, 40]
              - [4288, 30]
              - [5056, 25]
              - [5888, 38]
              - [-1, 30]
          - - 704
            - - [4, 43]
              - [128, 17]
              - [1024, 32]
              - [1408, 31]
              - [2368, 32]
              - [5888, 30]
              - [-1, 40]
          - - 1024
            - - [4, 43]
              - [64, 7]
              - [128, 10]
              - [704, 32]
              - [1408, 25]
              - [1856, 40]
              - [2368, 25]
              - [2944, 40]
              - [3584, 25]
              - [4288, 33]
              - [5056, 38]
              - [-1, 40]
          - - 1408
            - - [4, 43]
              - [128, 17]
              - [448, 32]
              - [704, 25]
              - [1024, 31]
              - [1408, 38]
              - [1856, 35]
              - [2368, 31]
              - [4288, 40]
              - [-1, 38]
          - - 1856
            - - [4, 43]
              - [64, 17]
              - [128, 10]
              - [256, 29]
              - [448, 25]
              - [704, 29]
              - [1024, 38]
              - [1856, 30]
              - [2368, 35]
              - [2944, 25]
              - [3584, 38]
              - [4288, 40]
              - [5056, 25]
              - [5888, 38]
              - [-1, 25]
          - - 2368
            - - [4, 43]
              - [128, 17]
              - [256, 29]
              - [704, 32]
              - [1024, 31]
              - [1408, 25]
              - [1856, 31]
              - [3584, 38]
              - [4288, 30]
              - [-1, 38]
          - - 2944
            - - [4, 43]
              - [64, 17]
              - [128, 10]
              - [256, 29]
              - [448, 31]
              - [704, 25]
              - [1408, 38]
              - [1856, 25]
              - [2368, 40]
              - [3584, 25]
              - [4288, 38]
              - [5888, 40]
              - [-1, 25]
          - - 3584
            - - [4, 43]
              - [64, 10]
              - [128, 32]
              - [256, 30]
              - [448, 38]
              - [704, 25]
              - [1024, 31]
              - [1408, 38]
              - [1856, 25]
              - [2368, 40]
              - [4288, 38]
              - [-1, 40]
          - - 4288
            - - [4, 43]
              - [64, 17]
              - [128, 13]
              - [256, 32]
              - [448, 35]
              - [704, 25]
              - [1024, 31]
              - [1408, 38]
              - [1856, 40]
              - [2368, 27]
              - [5888, 40]
              - [-1, 38]
          - - 5056
            - - [4, 43]
              - [64, 17]
              - [128, 10]
              - [256, 32]
              - [448, 31]
              - [704, 25]
              - [1024, 40]
              - [1408, 38]
              - [1856, 25]
              - [2944, 40]
              - [3584, 38]
              - [4288, 28]
              - [5056, 40]
              - [5888, 28]
              - [-1, 38]
          - - 5888
            - - [4, 43]
              - [64, 10]
              - [128, 32]
              - [256, 31]
              - [448, 38]
              - [704, 25]
              - [1024, 38]
              - [-1, 40]
          - - -1
            - - [4, 43]
              - [64, 32]
              - [128, 30]
              - [256, 40]
              - [448, 35]
              - [704, 40]
              - [1024, 25]
              - [1856, 28]
              - [2368, 40]
              - [2944, 28]
              - [4288, 40]
              - [-1, 38]
