library/src/blas3/Tensile/Logic/asm_full/vega20_Cijk_Ailk_Bljk_HB.yaml
- {MinimumRequiredVersion: 4.6.0}
- vega20
- gfx906
- [Device 66a0, Device 66a1, Device 66a7]
    SolutionIndex: 0
    SolutionNameMin: Cijk_Ailk_Bljk_HB_MT016x016x08_PGR1_PLR1_TT02_02
    SolutionIndex: 1
    SolutionNameMin: Cijk_Ailk_Bljk_HB_MT032x016x08_PGR1_PLR1_TT02_02
    SolutionIndex: 2
    SolutionNameMin: Cijk_Ailk_Bljk_HB_MT064x016x08_PGR1_PLR1_TT04_02
    SolutionIndex: 3
    SolutionNameMin: Cijk_Ailk_Bljk_HB_MT064x032x08_PGR1_PLR1_TT04_04
    SolutionIndex: 4
    SolutionNameMin: Cijk_Ailk_Bljk_HB_MT128x016x08_PGR1_PLR1_TT04_04
    SolutionIndex: 5
    SolutionNameMin: Cijk_Ailk_Bljk_HB_MT128x032x08_PGR1_PLR1_TT04_04
    SolutionIndex: 6
    SolutionNameMin: Cijk_Ailk_Bljk_HB_MT256x064x08_PGR1_PLR1_TT08_08
    SolutionIndex: 7
    SolutionNameMin: Cijk_Ailk_Bljk_HB_MT016x016x16_PGR1_PLR1_TT02_02
    SolutionIndex: 8
    SolutionNameMin: Cijk_Ailk_Bljk_HB_MT032x016x16_PGR1_PLR1_TT04_02
    SolutionIndex: 9
    SolutionNameMin: Cijk_Ailk_Bljk_HB_MT032x032x16_PGR1_PLR1_TT04_04
    SolutionIndex: 10
    SolutionNameMin: Cijk_Ailk_Bljk_HB_MT032x008x16_PGR1_PLR1_TT02_02
    SolutionIndex: 11
    SolutionNameMin: Cijk_Ailk_Bljk_HB_MT064x016x16_PGR1_PLR1_TT04_04
    SolutionIndex: 12
    SolutionNameMin: Cijk_Ailk_Bljk_HB_MT032x016x16_PGR1_PLR1_TT02_02
    SolutionIndex: 13
    SolutionNameMin: Cijk_Ailk_Bljk_HB_MT064x016x16_PGR1_PLR1_TT04_02
    SolutionIndex: 14
    SolutionNameMin: Cijk_Ailk_Bljk_HB_MT064x032x16_PGR1_PLR1_TT04_04
    SolutionIndex: 15
    SolutionNameMin: Cijk_Ailk_Bljk_HB_MT064x008x16_PGR1_PLR1_TT02_02
    SolutionIndex: 16
    SolutionNameMin: Cijk_Ailk_Bljk_HB_MT128x016x16_PGR1_PLR1_TT04_04
    SolutionIndex: 17
    SolutionNameMin: Cijk_Ailk_Bljk_HB_MT064x016x16_PGR1_PLR1_TT02_02
    SolutionIndex: 18
    SolutionNameMin: Cijk_Ailk_Bljk_HB_MT128x016x16_PGR1_PLR1_TT04_02
    SolutionIndex: 19
    SolutionNameMin: Cijk_Ailk_Bljk_HB_MT016x016x32_PGR1_PLR1_TT02_02
    SolutionIndex: 20
    SolutionNameMin: Cijk_Ailk_Bljk_HB_MT032x008x32_PGR1_PLR1_TT02_02
    SolutionIndex: 21
    SolutionNameMin: Cijk_Ailk_Bljk_HB_MT032x016x32_PGR1_PLR1_TT02_02
    SolutionIndex: 22
    SolutionNameMin: Cijk_Ailk_Bljk_HB_MT064x008x32_PGR1_PLR1_TT02_02
    SolutionIndex: 23
    SolutionNameMin: Cijk_Ailk_Bljk_HB_MT064x016x32_PGR1_PLR1_TT02_02
    SolutionIndex: 24
    SolutionNameMin: Cijk_Ailk_Bljk_HB_MT032x008x64_PGR1_PLR1_TT02_02
    SolutionIndex: 25
    SolutionNameMin: Cijk_Ailk_Bljk_HB_MT032x016x64_PGR1_PLR1_TT02_02
    SolutionIndex: 26
    SolutionNameMin: Cijk_Ailk_Bljk_HB_MT032x032x08_PGR1_PLR1_TT04_04
    SolutionIndex: 27
    SolutionNameMin: Cijk_Ailk_Bljk_HB_MT064x032x08_PGR1_PLR1_TT08_04
    SolutionIndex: 28
    SolutionNameMin: Cijk_Ailk_Bljk_HB_MT064x064x08_PGR1_PLR1_TT08_08
    SolutionIndex: 29
    SolutionNameMin: Cijk_Ailk_Bljk_HB_MT064x016x08_PGR1_PLR1_TT04_02
    SolutionIndex: 30
    SolutionNameMin: Cijk_Ailk_Bljk_HB_MT064x032x08_PGR1_PLR1_TT04_04
    SolutionIndex: 31
    SolutionNameMin: Cijk_Ailk_Bljk_HB_MT128x032x08_PGR1_PLR1_TT08_04
    SolutionIndex: 32
    SolutionNameMin: Cijk_Ailk_Bljk_HB_MT128x032x08_PGR1_PLR1_TT04_04
    SolutionIndex: 33
    SolutionNameMin: Cijk_Ailk_Bljk_HB_MT256x032x08_PGR1_PLR1_TT08_04
    SolutionIndex: 34
    SolutionNameMin: Cijk_Ailk_Bljk_HB_MT064x016x08_PGR1_PLR1_TT04_04
    SolutionIndex: 35
    SolutionNameMin: Cijk_Ailk_Bljk_HB_MT128x016x08_PGR1_PLR1_TT04_04
    SolutionIndex: 36
    SolutionNameMin: Cijk_Ailk_Bljk_HB_MT256x032x16_PGR1_PLR1_TT08_04
    SolutionIndex: 37
    SolutionNameMin: Cijk_Ailk_Bljk_HB_MT016x016x16_PGR1_PLR1_TT02_02
    SolutionIndex: 38
    SolutionNameMin: Cijk_Ailk_Bljk_HB_MT032x032x16_PGR1_PLR1_TT04_04
    SolutionIndex: 39
    SolutionNameMin: Cijk_Ailk_Bljk_HB_MT064x032x16_PGR1_PLR1_TT08_04
    SolutionIndex: 40
    SolutionNameMin: Cijk_Ailk_Bljk_HB_MT064x064x16_PGR1_PLR1_TT08_08
    SolutionIndex: 41
    SolutionNameMin: Cijk_Ailk_Bljk_HB_MT032x016x16_PGR1_PLR1_TT02_02
    SolutionIndex: 42
    SolutionNameMin: Cijk_Ailk_Bljk_HB_MT064x016x16_PGR1_PLR1_TT04_02
    SolutionIndex: 43
    SolutionNameMin: Cijk_Ailk_Bljk_HB_MT064x032x16_PGR1_PLR1_TT04_04
    SolutionIndex: 44
    SolutionNameMin: Cijk_Ailk_Bljk_HB_MT064x016x16_PGR1_PLR1_TT02_02
    SolutionIndex: 45
    SolutionNameMin: Cijk_Ailk_Bljk_HB_MT128x032x16_PGR1_PLR1_TT04_04
    SolutionIndex: 46
    SolutionNameMin: Cijk_Ailk_Bljk_HB_MT064x016x16_PGR1_PLR1_TT04_04
    SolutionIndex: 47
    SolutionNameMin: Cijk_Ailk_Bljk_HB_MT128x016x16_PGR1_PLR1_TT04_04
    SolutionIndex: 48
    SolutionNameMin: Cijk_Ailk_Bljk_HB_MT016x016x24_PGR1_PLR1_TT02_02
    SolutionIndex: 49
    SolutionNameMin: Cijk_Ailk_Bljk_HB_MT032x016x24_PGR1_PLR1_TT04_02
    SolutionIndex: 50
    SolutionNameMin: Cijk_Ailk_Bljk_HB_MT032x032x24_PGR1_PLR1_TT04_04
    SolutionIndex: 51
    SolutionNameMin: Cijk_Ailk_Bljk_HB_MT016x016x24_PGR1_PLR1_TT02_02
    SolutionIndex: 52
    SolutionNameMin: Cijk_Ailk_Bljk_HB_MT032x032x24_PGR1_PLR1_TT04_04
    SolutionIndex: 53
    SolutionNameMin: Cijk_Ailk_Bljk_HB_MT064x016x32_PGR1_PLR1_TT02_02
    SolutionIndex: 54
    SolutionNameMin: Cijk_Ailk_Bljk_HB_MT032x008x32_PGR1_PLR1_TT02_02
    SolutionIndex: 55
    SolutionNameMin: Cijk_Ailk_Bljk_HB_MT064x008x32_PGR1_PLR1_TT02_02
    SolutionIndex: 56
    SolutionNameMin: Cijk_Ailk_Bljk_HB_MT064x048x08_PGR1_PLR1_TT08_06
    SolutionIndex: 57
    SolutionNameMin: Cijk_Ailk_Bljk_HB_MT064x064x08_PGR0_PLR1_TT04_04
    SolutionIndex: 58
    SolutionNameMin: Cijk_Ailk_Bljk_HB_MT064x064x08_PGR1_PLR1_TT04_04
    SolutionIndex: 59
    SolutionNameMin: Cijk_Ailk_Bljk_HB_MT064x128x08_PGR1_PLR1_TT04_08
    SolutionIndex: 60
    SolutionNameMin: Cijk_Ailk_Bljk_HB_MT128x064x08_PGR0_PLR1_TT08_04
    SolutionIndex: 61
    SolutionNameMin: Cijk_Ailk_Bljk_HB_MT128x064x08_PGR1_PLR1_TT08_04
    SolutionIndex: 62
    SolutionNameMin: Cijk_Ailk_Bljk_HB_MT064x032x16_PGR0_PLR1_TT08_04
    SolutionIndex: 63
    SolutionNameMin: Cijk_Ailk_Bljk_HB_MT064x048x16_PGR0_PLR1_TT08_06
    SolutionIndex: 64
    SolutionNameMin: Cijk_Ailk_Bljk_HB_MT064x048x16_PGR1_PLR1_TT08_06
    SolutionIndex: 65
    SolutionNameMin: Cijk_Ailk_Bljk_HB_MT064x064x16_PGR0_PLR1_TT08_08
    SolutionIndex: 66
    SolutionNameMin: Cijk_Ailk_Bljk_HB_MT064x064x16_PGR0_PLR1_TT04_04
    SolutionIndex: 67
    SolutionNameMin: Cijk_Ailk_Bljk_HB_MT064x064x16_PGR1_PLR1_TT04_04
    SolutionIndex: 68
    SolutionNameMin: Cijk_Ailk_Bljk_HB_MT064x128x16_PGR0_PLR1_TT04_08
    SolutionIndex: 69
    SolutionNameMin: Cijk_Ailk_Bljk_HB_MT064x128x16_PGR1_PLR1_TT04_08
    SolutionIndex: 70
    SolutionNameMin: Cijk_Ailk_Bljk_HB_MT096x128x16_PGR1_PLR1_TT06_08
    SolutionIndex: 71
    SolutionNameMin: Cijk_Ailk_Bljk_HB_MT128x064x16_PGR0_PLR1_TT08_04
    SolutionIndex: 72
    SolutionNameMin: Cijk_Ailk_Bljk_HB_MT128x064x16_PGR1_PLR1_TT08_04
    SolutionIndex: 73
    SolutionNameMin: Cijk_Ailk_Bljk_HB_MT128x096x16_PGR1_PLR1_TT08_06
    SolutionIndex: 74
    SolutionNameMin: Cijk_Ailk_Bljk_HB_MT128x128x16_PGR0_PLR1_TT08_08
    SolutionIndex: 75
    SolutionNameMin: Cijk_Ailk_Bljk_HB_MT128x128x16_PGR1_PLR1_TT08_08
    SolutionIndex: 76
    SolutionNameMin: Cijk_Ailk_Bljk_HB_MT048x064x24_PGR0_PLR1_TT06_08
    SolutionIndex: 77
    SolutionNameMin: Cijk_Ailk_Bljk_HB_MT064x032x24_PGR0_PLR1_TT08_04
    SolutionIndex: 78
    SolutionNameMin: Cijk_Ailk_Bljk_HB_MT064x048x24_PGR0_PLR1_TT08_06
    SolutionIndex: 79
    SolutionNameMin: Cijk_Ailk_Bljk_HB_MT064x064x24_PGR0_PLR1_TT08_08
    SolutionIndex: 80
    SolutionNameMin: Cijk_Ailk_Bljk_HB_MT064x064x32_PGR0_PLR1_TT08_08
    SolutionIndex: 81
    SolutionNameMin: Cijk_Ailk_Bljk_HB_MT064x064x32_PGR0_PLR1_TT04_04
    SolutionIndex: 82
    SolutionNameMin: Cijk_Ailk_Bljk_HB_MT064x064x32_PGR1_PLR1_TT04_04
    SolutionIndex: 83
    SolutionNameMin: Cijk_Ailk_Bljk_HB_MT064x128x32_PGR0_PLR1_TT04_08
    SolutionIndex: 84
    SolutionNameMin: Cijk_Ailk_Bljk_HB_MT128x064x32_PGR0_PLR1_TT08_04
    SolutionIndex: 85
    SolutionNameMin: Cijk_Ailk_Bljk_HB_MT128x064x32_PGR1_PLR1_TT08_04
    SolutionIndex: 86
    SolutionNameMin: Cijk_Ailk_Bljk_HB_MT128x128x32_PGR0_PLR1_TT08_08
    SolutionIndex: 87
    SolutionNameMin: Cijk_Ailk_Bljk_HB_MT128x128x32_PGR1_PLR1_TT08_08
    SolutionIndex: 88
    SolutionNameMin: Cijk_Ailk_Bljk_HB_MT064x064x64_PGR1_PLR1_TT04_04
    SolutionIndex: 89
    SolutionNameMin: Cijk_Ailk_Bljk_HB_MT128x128x64_PGR0_PLR1_TT08_08
    SolutionIndex: 90
    SolutionNameMin: Cijk_Ailk_Bljk_HB_MT128x064x08_PGR1_PLR1_TT08_04
    SolutionIndex: 91
    SolutionNameMin: Cijk_Ailk_Bljk_HB_MT256x128x32_PGR1_PLR1_TT08_08
    SolutionIndex: 92
    SolutionNameMin: Cijk_Ailk_Bljk_HB_MT256x064x08_PGR1_PLR1_TT08_08
    SolutionIndex: 93
    SolutionNameMin: Cijk_Ailk_Bljk_HB_MT064x064x16_PGR1_PLR1_TT04_04
    SolutionIndex: 94
    SolutionNameMin: Cijk_Ailk_Bljk_HB_MT128x064x16_PGR1_PLR1_TT08_04
    SolutionIndex: 95
    SolutionNameMin: Cijk_Ailk_Bljk_HB_MT128x032x16_PGR1_PLR1_TT04_04
    SolutionIndex: 96
    SolutionNameMin: Cijk_Ailk_Bljk_HB_MT128x032x16_PGR0_PLR0_TT04_04
    SolutionIndex: 97
    SolutionNameMin: Cijk_Ailk_Bljk_HB_MT128x064x16_PGR0_PLR0_TT04_08
    SolutionIndex: 98
    SolutionNameMin: Cijk_Ailk_Bljk_HB_MT064x128x16_PGR0_PLR0_TT04_08
    SolutionIndex: 99
    SolutionNameMin: Cijk_Ailk_Bljk_HB_MT128x064x16_PGR0_PLR0_TT08_04
    SolutionIndex: 100
    SolutionNameMin: Cijk_Ailk_Bljk_HB_MT256x032x16_PGR0_PLR0_TT08_04
    SolutionIndex: 101
    SolutionNameMin: Cijk_Ailk_Bljk_HB_MT064x128x04_PGR0_PLR0_TT04_08
    SolutionIndex: 102
    SolutionNameMin: Cijk_Ailk_Bljk_HB_MT064x064x04_PGR0_PLR0_TT04_04
    SolutionIndex: 103
    SolutionNameMin: Cijk_Ailk_Bljk_HB_MT064x128x04_PGR1_PLR0_TT04_08
    SolutionIndex: 104
    SolutionNameMin: Cijk_Ailk_Bljk_HB_MT064x064x04_PGR1_PLR0_TT04_04
    SolutionIndex: 105
    SolutionNameMin: Cijk_Ailk_Bljk_HB_MT064x064x04_PGR0_PLR1_TT04_04
    SolutionIndex: 106
    SolutionNameMin: Cijk_Ailk_Bljk_HB_MT064x128x04_PGR1_PLR1_TT04_08
    SolutionIndex: 107
    SolutionNameMin: Cijk_Ailk_Bljk_HB_MT064x064x04_PGR1_PLR1_TT04_04
    SolutionIndex: 108
    SolutionNameMin: Cijk_Ailk_Bljk_HB_MT064x128x08_PGR0_PLR0_TT04_08
    SolutionIndex: 109
    SolutionNameMin: Cijk_Ailk_Bljk_HB_MT064x064x08_PGR0_PLR0_TT04_04
    SolutionIndex: 110
    SolutionNameMin: Cijk_Ailk_Bljk_HB_MT064x128x08_PGR1_PLR0_TT04_08
    SolutionIndex: 111
    SolutionNameMin: Cijk_Ailk_Bljk_HB_MT064x064x08_PGR1_PLR0_TT04_04
    SolutionIndex: 112
    SolutionNameMin: Cijk_Ailk_Bljk_HB_MT064x128x08_PGR0_PLR1_TT04_08
    SolutionIndex: 113
    SolutionNameMin: Cijk_Ailk_Bljk_HB_MT064x064x08_PGR0_PLR1_TT04_04
    SolutionIndex: 114
    SolutionNameMin: Cijk_Ailk_Bljk_HB_MT064x064x08_PGR1_PLR1_TT04_04
    SolutionIndex: 115
    SolutionNameMin: Cijk_Ailk_Bljk_HB_MT064x128x16_PGR0_PLR0_TT04_08
    SolutionIndex: 116
    SolutionNameMin: Cijk_Ailk_Bljk_HB_MT064x064x16_PGR0_PLR0_TT04_04
    SolutionIndex: 117
    SolutionNameMin: Cijk_Ailk_Bljk_HB_MT064x064x16_PGR1_PLR0_TT04_04
    SolutionIndex: 118
    SolutionNameMin: Cijk_Ailk_Bljk_HB_MT064x128x16_PGR0_PLR1_TT04_08
    SolutionIndex: 119
    SolutionNameMin: Cijk_Ailk_Bljk_HB_MT064x064x16_PGR0_PLR1_TT04_04
    SolutionIndex: 120
    SolutionNameMin: Cijk_Ailk_Bljk_HB_MT064x064x16_PGR1_PLR1_TT04_04
    SolutionIndex: 121
    SolutionNameMin: Cijk_Ailk_Bljk_HB_MT064x064x32_PGR0_PLR0_TT04_04
    SolutionIndex: 122
    SolutionNameMin: Cijk_Ailk_Bljk_HB_MT064x064x32_PGR1_PLR0_TT04_04
    SolutionIndex: 123
    SolutionNameMin: Cijk_Ailk_Bljk_HB_MT064x064x32_PGR0_PLR1_TT04_04
    SolutionIndex: 124
    SolutionNameMin: Cijk_Ailk_Bljk_HB_MT064x064x32_PGR1_PLR1_TT04_04
    SolutionIndex: 125
    SolutionNameMin: Cijk_Ailk_Bljk_HB_MT128x128x04_PGR0_PLR0_TT08_08
    SolutionIndex: 126
    SolutionNameMin: Cijk_Ailk_Bljk_HB_MT064x128x04_PGR0_PLR0_TT04_08
    SolutionIndex: 127
    SolutionNameMin: Cijk_Ailk_Bljk_HB_MT064x064x04_PGR0_PLR0_TT04_04
    SolutionIndex: 128
    SolutionNameMin: Cijk_Ailk_Bljk_HB_MT128x128x04_PGR1_PLR0_TT08_08
    SolutionIndex: 129
    SolutionNameMin: Cijk_Ailk_Bljk_HB_MT064x128x04_PGR1_PLR0_TT04_08
    SolutionIndex: 130
    SolutionNameMin: Cijk_Ailk_Bljk_HB_MT064x064x04_PGR1_PLR0_TT04_04
    SolutionIndex: 131
    SolutionNameMin: Cijk_Ailk_Bljk_HB_MT128x128x04_PGR0_PLR1_TT08_08
    SolutionIndex: 132
    SolutionNameMin: Cijk_Ailk_Bljk_HB_MT064x128x04_PGR0_PLR1_TT04_08
    SolutionIndex: 133
    SolutionNameMin: Cijk_Ailk_Bljk_HB_MT064x064x04_PGR0_PLR1_TT04_04
    SolutionIndex: 134
    SolutionNameMin: Cijk_Ailk_Bljk_HB_MT064x064x04_PGR1_PLR1_TT04_04
    SolutionIndex: 135
    SolutionNameMin: Cijk_Ailk_Bljk_HB_MT064x128x08_PGR0_PLR0_TT04_08
    SolutionIndex: 136
    SolutionNameMin: Cijk_Ailk_Bljk_HB_MT064x064x08_PGR0_PLR0_TT04_04
    SolutionIndex: 137
    SolutionNameMin: Cijk_Ailk_Bljk_HB_MT064x128x08_PGR1_PLR0_TT04_08
    SolutionIndex: 138
    SolutionNameMin: Cijk_Ailk_Bljk_HB_MT064x064x08_PGR1_PLR0_TT04_04
    SolutionIndex: 139
    SolutionNameMin: Cijk_Ailk_Bljk_HB_MT064x128x08_PGR0_PLR1_TT04_08
    SolutionIndex: 140
    SolutionNameMin: Cijk_Ailk_Bljk_HB_MT064x064x08_PGR0_PLR1_TT04_04
    SolutionIndex: 141
    SolutionNameMin: Cijk_Ailk_Bljk_HB_MT064x128x08_PGR1_PLR1_TT04_08
    SolutionIndex: 142
    SolutionNameMin: Cijk_Ailk_Bljk_HB_MT064x064x08_PGR1_PLR1_TT04_04
    SolutionIndex: 143
    SolutionNameMin: Cijk_Ailk_Bljk_HB_MT064x064x16_PGR0_PLR0_TT04_04
    SolutionIndex: 144
    SolutionNameMin: Cijk_Ailk_Bljk_HB_MT064x064x16_PGR1_PLR0_TT04_04
    SolutionIndex: 145
    SolutionNameMin: Cijk_Ailk_Bljk_HB_MT064x064x16_PGR0_PLR1_TT04_04
    SolutionIndex: 146
    SolutionNameMin: Cijk_Ailk_Bljk_HB_MT064x064x16_PGR1_PLR1_TT04_04
    SolutionIndex: 147
    SolutionNameMin: Cijk_Ailk_Bljk_HB_MT064x064x32_PGR0_PLR0_TT04_04
    SolutionIndex: 148
    SolutionNameMin: Cijk_Ailk_Bljk_HB_MT064x064x32_PGR1_PLR0_TT04_04
    SolutionIndex: 149
    SolutionNameMin: Cijk_Ailk_Bljk_HB_MT064x064x32_PGR0_PLR1_TT04_04
    SolutionIndex: 150
    SolutionNameMin: Cijk_Ailk_Bljk_HB_MT064x064x32_PGR1_PLR1_TT04_04
- - - [1856, 3584, 1, 1]
    - [132, 177.668]
  - - [128, 256, 1, 1280]
    - [20, 1428.58]
  - - [1760, 32, 1, 1760]
    - [48, 2503.11]
  - - [448, 1, 1, 256]
    - [134, 3.28055]
  - - [5056, 1408, 1, 3328]
    - [61, 18770.6]
  - - [3072, 24000, 1, 1024]
    - [86, 18819.8]
  - - [5056, 1856, 1, 3328]
    - [60, 16464.4]
  - - [5888, 128, 1, 1]
    - [144, 61.5739]
  - - [448, 3584, 1, 3328]
    - [61, 13158.8]
  - - [704, 64, 1, 3328]
    - [20, 2151.93]
  - - [2560, 32, 1, 2560]
    - [23, 3400.05]
  - - [5056, 4288, 1, 32]
    - [110, 3881.85]
  - - [5888, 256, 1, 256]
    - [61, 12561.1]
  - - [32, 5056, 1, 1280]
    - [120, 1443.77]
  - - [1856, 256, 1, 1]
    - [130, 40.4027]
  - - [448, 1, 1, 1]
    - [127, 0.0345679]
  - - [1408, 3584, 1, 3328]
    - [89, 13842.7]
  - - [448, 448, 1, 3328]
    - [9, 6320.43]
  - - [1024, 2368, 1, 3328]
    - [72, 16243.6]
  - - [4288, 64, 1, 3328]
    - [14, 6739.3]
  - - [1, 4288, 1, 1280]
    - [138, 33.5]
  - - [2368, 64, 1, 1]
    - [136, 12.8]
  - - [6144, 32, 1, 2560]
    - [42, 6506.16]
  - - [256, 128, 1, 256]
    - [7, 911.805]
  - - [448, 64, 1, 1]
    - [130, 2.42162]
  - - [32, 1408, 1, 32]
    - [121, 78.0191]
  - - [448, 3584, 1, 32]
    - [108, 2162.47]
  - - [64, 1024, 1, 1280]
    - [48, 2788.77]
  - - [704, 128, 1, 1280]
    - [12, 3551.21]
  - - [1, 1408, 1, 3328]
    - [148, 14.8888]
  - - [32, 3584, 1, 1280]
    - [120, 1338.44]
  - - [4288, 6784, 1, 3328]
    - [71, 16288.2]
  - - [128, 1, 1, 1408]
    - [48, 5.73232]
  - - [2944, 128, 1, 32]
    - [102, 678.977]
  - - [64, 6784, 1, 1]
    - [127, 35.4719]
  - - [448, 128, 1, 256]
    - [41, 1581.9]
  - - [64, 5056, 1, 3328]
    - [42, 7867.38]
  - - [5888, 4288, 1, 3328]
    - [61, 19588.6]
  - - [1, 2368, 1, 1280]
    - [146, 26.4951]
  - - [704, 1024, 1, 1]
    - [134, 60.0747]
  - - [2368, 1408, 1, 32]
    - [119, 2589.63]
  - - [256, 1856, 1, 1280]
    - [38, 9316.39]
  - - [1024, 2944, 1, 1]
    - [138, 129.052]
  - - [2368, 2944, 1, 1280]
    - [86, 16872.2]
  - - [3136, 512, 1, 2048]
    - [96, 9842.94]
  - - [1, 1024, 1, 3328]
    - [146, 12.6705]
  - - [3584, 1408, 1, 32]
    - [108, 3095.87]
  - - [6784, 1856, 1, 32]
    - [112, 3940.88]
  - - [5056, 256, 1, 256]
    - [27, 11224.6]
  - - [1856, 2368, 1, 256]
    - [60, 13356.2]
  - - [512, 6000, 1, 2816]
    - [72, 17435.4]
  - - [2368, 1024, 1, 3328]
    - [60, 13984.9]
  - - [3584, 4288, 1, 32]
    - [112, 4245.36]
  - - [1024, 1024, 1, 1280]
    - [72, 14601.6]
  - - [3584, 3584, 1, 1]
    - [126, 241.086]
  - - [512, 48000, 1, 2560]
    - [61, 19144.8]
  - - [32, 2944, 1, 3328]
    - [116, 969.341]
  - - [704, 1408, 1, 3328]
    - [39, 13978.1]
  - - [1408, 704, 1, 256]
    - [82, 7325.5]
  - - [704, 64, 1, 32]
    - [119, 87.0647]
  - - [8448, 1, 1, 2816]
    - [22, 362.646]
  - - [2368, 32, 1, 256]
    - [109, 534.104]
  - - [7680, 2, 1, 2560]
    - [20, 697.191]
  - - [7680, 3000, 1, 2560]
    - [80, 15269.0]
  - - [256, 193600, 1, 64]
    - [6, 17661.1]
  - - [2944, 256, 1, 1]
    - [136, 52.9258]
  - - [1408, 2368, 1, 1]
    - [136, 143.713]
  - - [32, 448, 1, 3328]
    - [114, 184.98]
  - - [5056, 1, 1, 3328]
    - [144, 35.966]
  - - [2944, 256, 1, 32]
    - [109, 1293.84]
  - - [5056, 6784, 1, 1280]
    - [72, 18789.3]
  - - [4288, 5056, 1, 1]
    - [129, 215.938]
  - - [5056, 4288, 1, 1]
    - [132, 223.599]
  - - [128, 4288, 1, 3328]
    - [16, 9988.08]
  - - [5056, 128, 1, 256]
    - [30, 9083.06]
  - - [1408, 4288, 1, 1280]
    - [87, 16510.0]
  - - [1856, 704, 1, 1280]
    - [67, 13772.1]
  - - [4288, 1024, 1, 3328]
    - [71, 16059.6]
  - - [1, 5888, 1, 3328]
    - [144, 50.6598]
  - - [1024, 128, 1, 32]
    - [105, 270.252]
  - - [1024, 2368, 1, 32]
    - [119, 2331.57]
  - - [256, 704, 1, 1]
    - [127, 12.5855]
  - - [128, 448, 1, 1280]
    - [51, 2414.48]
  - - [704, 3584, 1, 1280]
    - [86, 12832.2]
  - - [1856, 5056, 1, 256]
    - [86, 15367.8]
  - - [1408, 1024, 1, 1280]
    - [72, 14526.9]
  - - [2368, 3584, 1, 1]
    - [126, 173.912]
  - - [5056, 5888, 1, 3328]
    - [71, 15709.8]
  - - [1024, 6000, 1, 1536]
    - [69, 15755.9]
  - - [3584, 3584, 1, 1280]
    - [75, 18548.8]
  - - [2368, 3584, 1, 32]
    - [112, 3689.96]
  - - [2944, 2368, 1, 1]
    - [137, 176.045]
  - - [704, 4288, 1, 1]
    - [132, 128.348]
  - - [512, 32, 1, 512]
    - [37, 589.088]
  - - [1024, 6784, 1, 1280]
    - [75, 14117.7]
  - - [1024, 3584, 1, 1]
    - [129, 130.327]
  - - [6784, 128, 1, 256]
    - [5, 9924.02]
  - - [2944, 2368, 1, 1280]
    - [61, 17904.0]
  - - [32, 5056, 1, 32]
    - [109, 317.239]
  - - [5888, 32, 1, 32]
    - [105, 345.717]
  - - [64, 128, 1, 3328]
    - [48, 400.926]
  - - [256, 5056, 1, 32]
    - [106, 1889.54]
  - - [5056, 64, 1, 32]
    - [102, 607.67]
  - - [64, 1, 1, 1216]
    - [20, 2.74028]
  - - [128, 6784, 1, 32]
    - [102, 1523.42]
  - - [64, 128, 1, 1]
    - [134, 0.673684]
  - - [64, 2368, 1, 1280]
    - [55, 4849.66]
  - - [128, 704, 1, 32]
    - [105, 181.13]
  - - [64, 6784, 1, 3328]
    - [14, 9864.4]
  - - [2944, 256, 1, 1280]
    - [67, 12205.1]
  - - [5124, 9124, 1, 4096]
    - [75, 15758.1]
  - - [5056, 704, 1, 1]
    - [127, 140.356]
  - - [2944, 4288, 1, 256]
    - [65, 15823.1]
  - - [1024, 1024, 1, 3328]
    - [87, 13923.0]
  - - [1024, 1500, 1, 2816]
    - [84, 12900.8]
  - - [5888, 1, 1, 256]
    - [142, 36.9443]
  - - [5056, 704, 1, 32]
    - [114, 2533.4]
  - - [5056, 704, 1, 1280]
    - [86, 14255.5]
  - - [1856, 4288, 1, 3328]
    - [61, 18490.6]
  - - [1, 1856, 1, 256]
    - [144, 13.78]
  - - [6784, 4288, 1, 32]
    - [108, 4453.08]
  - - [448, 5888, 1, 256]
    - [61, 12966.3]
  - - [1408, 64, 1, 256]
    - [12, 2423.18]
  - - [5888, 5056, 1, 256]
    - [86, 17842.9]
  - - [3584, 448, 1, 3328]
    - [87, 12628.9]
  - - [5124, 700, 1, 2560]
    - [86, 12537.1]
  - - [2944, 448, 1, 256]
    - [84, 9337.43]
  - - [3584, 2368, 1, 3328]
    - [40, 14308.2]
  - - [4288, 1856, 1, 1]
    - [132, 190.213]
  - - [1856, 2944, 1, 1]
    - [130, 146.883]
  - - [32, 4288, 1, 3328]
    - [120, 1311.02]
  - - [1, 3584, 1, 3328]
    - [146, 43.6075]
  - - [256, 32, 1, 3328]
    - [120, 104.057]
  - - [1856, 2368, 1, 32]
    - [108, 3167.57]
  - - [4288, 1856, 1, 32]
    - [112, 3580.89]
  - - [5056, 64, 1, 3328]
    - [42, 7826.22]
  - - [6784, 1, 1, 1280]
    - [142, 56.9187]
  - - [1408, 256, 1, 1280]
    - [67, 7155.3]
  - - [1408, 64, 1, 1]
    - [138, 7.71507]
  - - [6144, 4, 1, 2560]
    - [22, 1117.09]
  - - [1, 1, 1, 3328]
    - [146, 0.0123442]
  - - [5056, 2368, 1, 256]
    - [72, 16997.4]
  - - [704, 704, 1, 256]
    - [67, 7376.61]
  - - [5056, 6784, 1, 1]
    - [125, 226.492]
  - - [32, 448, 1, 1280]
    - [122, 153.429]
  - - [32, 448, 1, 32]
    - [105, 27.9727]
  - - [1856, 64, 1, 256]
    - [17, 3090.32]
  - - [1024, 1408, 1, 3328]
    - [72, 13851.8]
  - - [7680, 128, 1, 2560]
    - [36, 13882.3]
  - - [256, 5056, 1, 1280]
    - [66, 12275.9]
  - - [704, 2368, 1, 1]
    - [127, 101.651]
  - - [64, 1024, 1, 32]
    - [102, 120.804]
  - - [1024, 256, 1, 256]
    - [26, 5053.38]
  - - [128, 1, 1, 1]
    - [133, 0.0116788]
  - - [1024, 1500, 1, 1536]
    - [72, 15456.6]
  - - [3584, 4288, 1, 1280]
    - [65, 16319.8]
  - - [2368, 5888, 1, 32]
    - [108, 4122.04]
  - - [1856, 128, 1, 32]
    - [104, 468.114]
  - - [1856, 128, 1, 1280]
    - [50, 6824.22]
  - - [128, 2944, 1, 3328]
    - [14, 9237.6]
  - - [1024, 2, 1, 500000]
    - [20, 107.487]
  - - [1, 6784, 1, 3328]
    - [141, 56.2067]
  - - [3584, 2368, 1, 1]
    - [130, 182.908]
  - - [4288, 32, 1, 3328]
    - [117, 1222.57]
  - - [6144, 1, 1, 2560]
    - [20, 281.673]
  - - [32, 2944, 1, 256]
    - [120, 668.438]
  - - [256, 1856, 1, 1]
    - [138, 39.3325]
  - - [1408, 3584, 1, 1]
    - [126, 182.836]
  - - [704, 6784, 1, 1280]
    - [61, 16846.3]
  - - [2368, 4288, 1, 32]
    - [108, 3875.57]
  - - [1024, 3000, 1, 2560]
    - [61, 15596.4]
  - - [704, 5056, 1, 1280]
    - [69, 12404.9]
  - - [256, 3584, 1, 3328]
    - [28, 12017.7]
  - - [3584, 6784, 1, 32]
    - [108, 4479.74]
  - - [3584, 6784, 1, 1280]
    - [68, 17289.1]
  - - [4288, 4288, 1, 3328]
    - [75, 16496.2]
  - - [3584, 64, 1, 1280]
    - [50, 6565.32]
  - - [64, 1856, 1, 256]
    - [12, 3141.39]
  - - [3584, 64, 1, 32]
    - [114, 454.21]
  - - [448, 1, 1, 1280]
    - [144, 4.78824]
  - - [704, 128, 1, 3328]
    - [51, 3876.59]
  - - [64, 1856, 1, 1]
    - [136, 9.76802]
  - - [4288, 1856, 1, 3328]
    - [61, 15511.3]
  - - [1856, 2944, 1, 1280]
    - [79, 14405.2]
  - - [4288, 256, 1, 256]
    - [58, 7911.55]
  - - [128, 5888, 1, 32]
    - [113, 1485.05]
  - - [128, 5888, 1, 1280]
    - [67, 12168.1]
  - - [1408, 128, 1, 3328]
    - [13, 6095.38]
  - - [3584, 256, 1, 256]
    - [26, 9918.96]
  - - [32, 6784, 1, 3328]
    - [120, 2055.27]
  - - [64, 64, 1, 1280]
    - [48, 181.54]
  - - [32, 3584, 1, 256]
    - [120, 722.444]
  - - [2944, 5056, 1, 3328]
    - [61, 18477.2]
  - - [704, 256, 1, 32]
    - [109, 383.455]
  - - [448, 128, 1, 3328]
    - [48, 2692.45]
  - - [64, 4288, 1, 3328]
    - [13, 6759.25]
  - - [5888, 32, 1, 256]
    - [120, 1240.6]
  - - [5056, 1024, 1, 3328]
    - [87, 17356.5]
  - - [2368, 64, 1, 3328]
    - [12, 5275.79]
  - - [1856, 256, 1, 256]
    - [67, 7380.75]
  - - [128, 1500, 1, 1280]
    - [17, 5885.06]
  - - [7680, 6000, 1, 2560]
    - [87, 17495.9]
  - - [256, 704, 1, 256]
    - [38, 3392.45]
  - - [5888, 5888, 1, 256]
    - [60, 17567.6]
  - - [3584, 704, 1, 32]
    - [109, 2523.14]
  - - [448, 6784, 1, 3328]
    - [72, 14290.9]
  - - [6784, 4288, 1, 1]
    - [137, 240.81]
  - - [3584, 6784, 1, 1]
    - [135, 230.594]
  - - [1408, 2368, 1, 32]
    - [114, 2640.91]
  - - [448, 5056, 1, 32]
    - [107, 2177.97]
  - - [2048, 128, 1, 2048]
    - [46, 7600.1]
  - - [6784, 1408, 1, 1]
    - [132, 208.374]
  - - [1856, 5888, 1, 3328]
    - [75, 17241.6]
  - - [5056, 5888, 1, 1]
    - [131, 217.997]
  - - [2944, 1024, 1, 256]
    - [61, 15609.9]
  - - [448, 1408, 1, 3328]
    - [67, 10710.5]
  - - [5056, 32, 1, 3328]
    - [120, 1546.89]
  - - [2368, 4288, 1, 3328]
    - [69, 15624.4]
  - - [1024, 704, 1, 32]
    - [119, 1237.59]
  - - [448, 2944, 1, 256]
    - [61, 10934.0]
  - - [2944, 6784, 1, 256]
    - [61, 18584.1]
  - - [2368, 2368, 1, 1280]
    - [86, 15701.6]
  - - [5888, 128, 1, 3328]
    - [32, 13063.5]
  - - [256, 256, 1, 32]
    - [111, 124.239]
  - - [1024, 1, 1, 256]
    - [142, 7.4984]
  - - [3584, 3584, 1, 32]
    - [112, 4126.93]
  - - [2944, 448, 1, 1]
    - [139, 83.6873]
  - - [4608, 32, 1, 1536]
    - [15, 4806.71]
  - - [512, 48000, 1, 2816]
    - [61, 19783.5]
  - - [128, 32, 1, 32]
    - [113, 8.44536]
  - - [5056, 64, 1, 1280]
    - [13, 7481.71]
  - - [1024, 1, 1, 3328]
    - [134, 10.5]
  - - [2944, 2944, 1, 1280]
    - [61, 17314.8]
  - - [1, 2368, 1, 256]
    - [142, 18.7101]
  - - [1408, 5056, 1, 1]
    - [132, 200.418]
  - - [2944, 32, 1, 1280]
    - [120, 1089.9]
  - - [64, 1408, 1, 3328]
    - [51, 3864.6]
  - - [256, 448, 1, 1280]
    - [17, 4411.08]
  - - [4096, 64, 1, 4096]
    - [42, 7744.82]
  - - [2368, 6784, 1, 1]
    - [132, 207.017]
  - - [6784, 4288, 1, 1280]
    - [65, 19327.1]
  - - [2944, 704, 1, 256]
    - [72, 9262.91]
  - - [5888, 1856, 1, 256]
    - [61, 18299.3]
  - - [704, 2944, 1, 3328]
    - [61, 14101.9]
  - - [5888, 256, 1, 1]
    - [130, 93.7393]
  - - [512, 50176, 1, 128]
    - [90, 18358.2]
  - - [704, 704, 1, 32]
    - [105, 1071.6]
  - - [256, 4288, 1, 256]
    - [72, 9171.62]
  - - [5056, 6784, 1, 32]
    - [118, 4041.22]
  - - [5056, 128, 1, 1]
    - [136, 48.1524]
  - - [3072, 4, 1, 1024]
    - [20, 512.334]
  - - [448, 5056, 1, 1280]
    - [69, 12716.3]
  - - [448, 448, 1, 256]
    - [13, 4197.73]
  - - [256, 5888, 1, 3328]
    - [72, 15656.6]
  - - [704, 448, 1, 1280]
    - [38, 6773.52]
  - - [448, 64, 1, 256]
    - [7, 882.215]
  - - [5888, 1024, 1, 1]
    - [132, 185.175]
  - - [5888, 448, 1, 32]
    - [109, 2586.1]
  - - [6784, 2944, 1, 256]
    - [61, 18562.5]
  - - [1024, 256, 1, 1]
    - [130, 22.2912]
  - - [5888, 256, 1, 32]
    - [106, 2168.82]
  - - [2368, 448, 1, 256]
    - [81, 8300.16]
  - - [4288, 256, 1, 3328]
    - [39, 11239.3]
  - - [4288, 2944, 1, 256]
    - [86, 16335.0]
  - - [4096, 16, 1, 4096]
    - [20, 3084.05]
  - - [448, 5888, 1, 3328]
    - [87, 14201.3]
  - - [512, 2, 1, 500000]
    - [20, 53.7552]
  - - [128, 256, 1, 3328]
    - [51, 1592.46]
  - - [2368, 5056, 1, 32]
    - [112, 4027.79]
  - - [32, 128, 1, 1280]
    - [120, 46.3152]
  - - [1408, 4288, 1, 1]
    - [126, 175.918]
  - - [1408, 1856, 1, 3328]
    - [72, 17469.2]
  - - [4288, 64, 1, 256]
    - [13, 4933.61]
  - - [3584, 1024, 1, 3328]
    - [87, 15277.9]
  - - [2944, 5888, 1, 3328]
    - [86, 18195.0]
  - - [128, 6784, 1, 3328]
    - [31, 12179.2]
  - - [448, 4288, 1, 3328]
    - [69, 13802.2]
  - - [704, 2368, 1, 256]
    - [61, 11546.8]
  - - [1, 64, 1, 3328]
    - [146, 0.772604]
  - - [4288, 128, 1, 1]
    - [133, 46.9918]
  - - [256, 2368, 1, 32]
    - [116, 1149.21]
  - - [4288, 3584, 1, 3328]
    - [61, 19354.4]
  - - [1024, 24000, 1, 2560]
    - [86, 15708.8]
  - - [1408, 1024, 1, 1]
    - [129, 91.951]
  - - [64, 1024, 1, 1]
    - [134, 5.42517]
  - - [1408, 1024, 1, 256]
    - [61, 11505.6]
  - - [5056, 3584, 1, 1]
    - [133, 231.131]
  - - [448, 1024, 1, 256]
    - [58, 6924.56]
  - - [6784, 6784, 1, 3328]
    - [75, 19880.2]
  - - [6784, 32, 1, 32]
    - [119, 434.176]
  - - [2368, 2944, 1, 3328]
    - [71, 17080.5]
  - - [128, 3584, 1, 3328]
    - [43, 10503.1]
  - - [5056, 3584, 1, 32]
    - [108, 4474.25]
  - - [5056, 3584, 1, 1280]
    - [65, 13343.6]
  - - [7680, 48000, 1, 2560]
    - [75, 14667.3]
  - - [1856, 1856, 1, 256]
    - [72, 14796.2]
  - - [32, 5888, 1, 256]
    - [120, 1213.14]
  - - [256, 1408, 1, 32]
    - [113, 728.178]
  - - [2944, 1, 1, 3328]
    - [146, 36.5255]
  - - [32, 704, 1, 3328]
    - [122, 270.076]
  - - [5888, 4288, 1, 1]
    - [132, 229.859]
  - - [1024, 128, 1, 256]
    - [44, 3382.5]
  - - [32, 1856, 1, 3328]
    - [114, 769.451]
  - - [512, 16, 1, 512]
    - [7, 306.601]
  - - [5056, 704, 1, 256]
    - [61, 15930.3]
  - - [2368, 5056, 1, 256]
    - [75, 17343.8]
  - - [3584, 704, 1, 1]
    - [130, 125.654]
  - - [1024, 5056, 1, 256]
    - [86, 15255.5]
  - - [32, 1024, 1, 3328]
    - [120, 416.101]
  - - [5888, 448, 1, 256]
    - [27, 11269.7]
  - - [6784, 5056, 1, 1280]
    - [72, 18235.5]
  - - [1024, 48000, 1, 2560]
    - [86, 18879.6]
  - - [8448, 32, 1, 2816]
    - [42, 6663.74]
  - - [4288, 6784, 1, 1280]
    - [75, 19050.3]
  - - [64, 1, 1, 256]
    - [146, 0.461261]
  - - [2944, 3584, 1, 3328]
    - [68, 16390.3]
  - - [128, 1408, 1, 1]
    - [136, 13.2518]
  - - [1024, 64, 1, 32]
    - [122, 112.508]
  - - [1024, 64, 1, 3328]
    - [51, 3077.09]
  - - [704, 6784, 1, 3328]
    - [73, 14542.4]
  - - [2944, 1856, 1, 1]
    - [127, 172.913]
  - - [5888, 4288, 1, 1280]
    - [71, 18066.3]
  - - [5888, 3584, 1, 1280]
    - [72, 18782.9]
  - - [3584, 1408, 1, 1280]
    - [65, 17145.9]
  - - [1024, 2944, 1, 256]
    - [60, 10508.6]
  - - [1, 2944, 1, 1280]
    - [144, 30.4093]
  - - [32, 1024, 1, 256]
    - [107, 223.577]
  - - [2944, 1856, 1, 1280]
    - [84, 14194.6]
  - - [3584, 1, 1, 1280]
    - [146, 40.1007]
  - - [256, 3584, 1, 32]
    - [111, 1456.36]
  - - [1024, 2368, 1, 1]
    - [129, 99.7053]
  - - [2944, 3584, 1, 1280]
    - [86, 16430.2]
  - - [64, 1, 1, 1]
    - [130, 0.00615385]
  - - [1856, 4288, 1, 256]
    - [61, 17000.9]
  - - [256, 128, 1, 3328]
    - [51, 1590.61]
  - - [1024, 1024, 1, 1024]
    - [72, 10198.9]
  - - [1, 1856, 1, 3328]
    - [138, 17.9057]
  - - [704, 5888, 1, 1]
    - [134, 156.539]
  - - [2368, 2944, 1, 32]
    - [108, 3640.41]
  - - [128, 4288, 1, 32]
    - [116, 1040.5]
  - - [448, 256, 1, 256]
    - [44, 2936.01]
  - - [64, 64, 1, 1]
    - [130, 0.343624]
  - - [1, 1408, 1, 1]
    - [136, 0.121379]
  - - [128, 2368, 1, 1280]
    - [13, 7008.18]
  - - [5888, 64, 1, 3328]
    - [47, 9103.46]
  - - [5124, 1500, 1, 2560]
    - [89, 13380.0]
  - - [4288, 704, 1, 256]
    - [72, 14930.5]
  - - [1856, 1024, 1, 256]
    - [61, 10540.3]
  - - [448, 1856, 1, 32]
    - [114, 1471.66]
  - - [448, 1856, 1, 3328]
    - [61, 11326.1]
  - - [448, 448, 1, 32]
    - [109, 420.323]
  - - [1024, 448, 1, 256]
    - [67, 7161.01]
  - - [6784, 1, 1, 256]
    - [146, 40.8829]
  - - [704, 6784, 1, 32]
    - [112, 3008.46]
  - - [1024, 4288, 1, 1]
    - [135, 148.744]
  - - [704, 256, 1, 3328]
    - [38, 5336.15]
  - - [704, 1856, 1, 32]
    - [109, 1833.86]
  - - [1408, 5888, 1, 1280]
    - [61, 17266.9]
  - - [32, 704, 1, 1280]
    - [120, 262.526]
  - - [5056, 1856, 1, 256]
    - [61, 17287.6]
  - - [6784, 704, 1, 1280]
    - [71, 15350.5]
  - - [704, 1408, 1, 32]
    - [114, 1716.42]
  - - [5888, 1024, 1, 256]
    - [84, 14291.7]
  - - [64, 2944, 1, 1]
    - [148, 13.7731]
  - - [7680, 16, 1, 2560]
    - [23, 5034.78]
  - - [6144, 2, 1, 2560]
    - [22, 556.175]
  - - [64, 2944, 1, 32]
    - [114, 326.261]
  - - [64, 2944, 1, 1280]
    - [13, 5911.09]
  - - [512, 1500, 1, 1536]
    - [72, 10882.4]
  - - [6784, 1856, 1, 3328]
    - [72, 18377.9]
  - - [512, 24000, 1, 2816]
    - [74, 17880.1]
  - - [2368, 5888, 1, 1280]
    - [68, 15576.3]
  - - [1, 6784, 1, 256]
    - [142, 42.8181]
  - - [6784, 6784, 1, 32]
    - [115, 4248.57]
  - - [256, 1, 1, 1280]
    - [142, 2.91116]
  - - [5888, 128, 1, 32]
    - [116, 1456.36]
  - - [6784, 256, 1, 256]
    - [72, 12241.1]
  - - [2368, 3584, 1, 3328]
    - [61, 18602.4]
  - - [128, 4288, 1, 1280]
    - [43, 9524.75]
  - - [128, 128, 1, 256]
    - [12, 472.332]
  - - [5888, 1024, 1, 1280]
    - [86, 16751.0]
  - - [1856, 704, 1, 3328]
    - [59, 12081.7]
  - - [1024, 1500, 1, 2048]
    - [87, 11558.4]
  - - [5888, 6784, 1, 3328]
    - [86, 16980.5]
  - - [6784, 448, 1, 1]
    - [130, 124.559]
  - - [6784, 1856, 1, 1]
    - [126, 232.824]
  - - [128, 32, 1, 1280]
    - [120, 47.6625]
  - - [32, 1856, 1, 32]
    - [102, 126.366]
  - - [128, 256, 1, 1]
    - [133, 2.74899]
  - - [6784, 448, 1, 32]
    - [119, 2302.45]
  - - [6784, 448, 1, 3328]
    - [72, 15618.5]
  - - [1, 6784, 1, 1]
    - [130, 0.540127]
  - - [448, 3584, 1, 1280]
    - [62, 11871.6]
  - - [1408, 6784, 1, 1280]
    - [61, 17093.1]
  - - [3584, 1856, 1, 3328]
    - [65, 16982.9]
  - - [32, 2944, 1, 32]
    - [102, 199.382]
  - - [5888, 704, 1, 1]
    - [132, 138.541]
  - - [3584, 1856, 1, 1]
    - [127, 181.945]
  - - [1, 256, 1, 256]
    - [146, 1.72827]
  - - [5056, 2944, 1, 32]
    - [108, 4033.84]
  - - [32, 6784, 1, 256]
    - [120, 1397.75]
  - - [64, 5056, 1, 256]
    - [2, 5658.3]
  - - [4288, 6784, 1, 1]
    - [127, 244.699]
  - - [2944, 64, 1, 256]
    - [8, 3992.92]
  - - [512, 48000, 1, 2048]
    - [84, 15526.0]
  - - [1, 4288, 1, 3328]
    - [134, 36.0583]
  - - [1024, 6784, 1, 1]
    - [126, 173.67]
  - - [256, 32, 1, 1280]
    - [114, 98.997]
  - - [128, 3584, 1, 1280]
    - [67, 9839.18]
  - - [4608, 24000, 1, 1536]
    - [73, 17024.1]
  - - [1760, 16, 1, 1760]
    - [20, 1285.31]
  - - [1, 256, 1, 1]
    - [142, 0.022069]
  - - [3584, 4288, 1, 1]
    - [126, 244.095]
  - - [5888, 1024, 1, 3328]
    - [72, 16503.4]
  - - [6784, 5888, 1, 256]
    - [84, 15923.9]
  - - [4288, 6784, 1, 256]
    - [74, 18001.8]
  - - [2368, 3584, 1, 256]
    - [61, 13306.3]
  - - [32, 3584, 1, 3328]
    - [120, 1488.62]
  - - [1024, 1, 1, 1280]
    - [146, 11.5462]
  - - [4288, 2368, 1, 32]
    - [108, 3842.57]
  - - [704, 3584, 1, 1]
    - [133, 128.208]
  - - [704, 1856, 1, 3328]
    - [67, 14100.0]
  - - [2944, 128, 1, 1280]
    - [47, 8456.26]
  - - [512, 1500, 1, 2816]
    - [67, 12556.2]
  - - [4096, 7000, 1, 4096]
    - [75, 17430.4]
  - - [1, 2368, 1, 3328]
    - [146, 29.0929]
  - - [6784, 704, 1, 32]
    - [109, 3173.38]
  - - [4288, 1, 1, 1280]
    - [134, 34.6855]
  - - [704, 5888, 1, 256]
    - [84, 12644.9]
  - - [2368, 3584, 1, 1280]
    - [60, 15647.6]
  - - [256, 12544, 1, 1024]
    - [95, 14674.8]
  - - [64, 448, 1, 256]
    - [7, 811.95]
  - - [1408, 448, 1, 1280]
    - [67, 10235.8]
  - - [1408, 128, 1, 32]
    - [120, 304.176]
  - - [3584, 5056, 1, 32]
    - [112, 4345.49]
  - - [1024, 32, 1, 1280]
    - [120, 371.835]
  - - [128, 2368, 1, 1]
    - [134, 21.6503]
  - - [8448, 4, 1, 2816]
    - [22, 1450.58]
  - - [448, 448, 1, 1280]
    - [11, 5924.84]
  - - [6784, 1856, 1, 1280]
    - [75, 18157.5]
  - - [6144, 48000, 1, 2560]
    - [74, 14907.9]
  - - [5056, 5056, 1, 3328]
    - [72, 18818.7]
  - - [128, 704, 1, 1280]
    - [48, 3508.01]
  - - [128, 2944, 1, 1280]
    - [14, 8687.77]
  - - [2368, 5056, 1, 1]
    - [133, 203.063]
  - - [5888, 1408, 1, 256]
    - [86, 16622.1]
  - - [2368, 1024, 1, 32]
    - [109, 2325.98]
  - - [256, 256, 1, 3328]
    - [48, 3098.07]
  - - [64, 4288, 1, 1]
    - [130, 23.0228]
  - - [6144, 16, 1, 2560]
    - [12, 4106.69]
  - - [4288, 1024, 1, 256]
    - [61, 14979.7]
  - - [3584, 32, 1, 32]
    - [109, 246.641]
  - - [5124, 700, 1, 2048]
    - [86, 12554.3]
  - - [3584, 64, 1, 1]
    - [130, 19.5048]
  - - [704, 32, 1, 1280]
    - [114, 249.445]
  - - [7680, 1, 1, 2560]
    - [20, 349.587]
  - - [64, 64, 1, 3328]
    - [20, 200.936]
  - - [64, 1408, 1, 1]
    - [140, 6.62588]
  - - [4288, 5888, 1, 1280]
    - [62, 15445.6]
  - - [1856, 2944, 1, 3328]
    - [60, 14269.0]
  - - [4608, 3000, 1, 1536]
    - [75, 16790.3]
  - - [256, 1024, 1, 256]
    - [67, 4848.91]
  - - [5056, 5888, 1, 256]
    - [65, 18444.0]
  - - [1408, 128, 1, 1280]
    - [13, 5687.54]
  - - [1024, 5888, 1, 1280]
    - [75, 18167.4]
  - - [1024, 448, 1, 1]
    - [148, 33.1468]
  - - [32, 32, 1, 32]
    - [109, 2.22609]
  - - [5056, 1, 1, 1280]
    - [145, 36.4068]
  - - [5888, 5056, 1, 1280]
    - [63, 16698.1]
  - - [5888, 2944, 1, 1]
    - [137, 219.088]
  - - [64, 4288, 1, 1280]
    - [13, 6382.14]
  - - [448, 704, 1, 1280]
    - [67, 6810.08]
  - - [1408, 4288, 1, 3328]
    - [85, 14788.9]
  - - [704, 2944, 1, 32]
    - [112, 2754.25]
  - - [1, 5888, 1, 1280]
    - [143, 43.9198]
  - - [2944, 4288, 1, 3328]
    - [84, 15520.5]
  - - [256, 2944, 1, 256]
    - [61, 8374.04]
  - - [704, 448, 1, 32]
    - [107, 589.518]
  - - [5056, 2944, 1, 256]
    - [86, 16860.7]
  - - [1024, 700, 1, 512]
    - [67, 10309.0]
  - - [704, 1024, 1, 256]
    - [67, 9264.53]
  - - [2368, 1856, 1, 256]
    - [69, 13193.3]
  - - [64, 3584, 1, 1]
    - [130, 19.243]
  - - [1024, 128, 1, 1280]
    - [17, 4993.22]
  - - [2368, 4288, 1, 1280]
    - [60, 13862.1]
  - - [512, 6000, 1, 2048]
    - [85, 13372.4]
  - - [256, 6784, 1, 256]
    - [61, 12029.1]
  - - [1024, 32, 1, 32]
    - [107, 70.4688]
  - - [1024, 1408, 1, 1]
    - [127, 92.4226]
  - - [128, 64, 1, 32]
    - [109, 17.156]
  - - [64, 1, 1, 1280]
    - [146, 0.716084]
  - - [6784, 5888, 1, 3328]
    - [69, 17554.0]
  - - [256, 5888, 1, 1]
    - [129, 94.6814]
  - - [2944, 2944, 1, 1]
    - [132, 216.678]
  - - [6784, 3584, 1, 256]
    - [75, 18577.9]
  - - [1408, 1856, 1, 256]
    - [61, 15067.4]
  - - [128, 1408, 1, 256]
    - [17, 4004.98]
  - - [2944, 2944, 1, 32]
    - [112, 3588.88]
  - - [2944, 2944, 1, 3328]
    - [79, 14476.5]
  - - [1, 2944, 1, 256]
    - [142, 21.3624]
  - - [448, 32, 1, 1280]
    - [120, 172.204]
  - - [3584, 1, 1, 256]
    - [142, 26.3651]
  - - [704, 32, 1, 3328]
    - [124, 268.605]
  - - [256, 448, 1, 3328]
    - [53, 4790.18]
  - - [5124, 9124, 1, 2048]
    - [89, 14031.4]
  - - [1024, 24000, 1, 1536]
    - [72, 18999.0]
  - - [2368, 64, 1, 256]
    - [41, 3619.15]
  - - [64, 448, 1, 1280]
    - [41, 1239.87]
  - - [1408, 448, 1, 3328]
    - [82, 9204.0]
  - - [2368, 6784, 1, 3328]
    - [69, 16097.0]
  - - [4288, 3584, 1, 32]
    - [101, 3727.88]
  - - [256, 2368, 1, 1]
    - [138, 47.0658]
  - - [32, 4288, 1, 1280]
    - [120, 1243.88]
  - - [6784, 704, 1, 256]
    - [61, 15919.8]
  - - [3584, 704, 1, 1280]
    - [85, 13542.5]
  - - [448, 5056, 1, 3328]
    - [61, 12930.9]
  - - [4288, 448, 1, 256]
    - [60, 11576.8]
  - - [5056, 256, 1, 1280]
    - [61, 13024.8]
  - - [704, 448, 1, 3328]
    - [38, 7181.34]
  - - [2944, 5888, 1, 32]
    - [112, 4207.35]
  - - [3584, 5056, 1, 256]
    - [61, 18573.4]
  - - [6784, 1, 1, 3328]
    - [144, 55.6196]
  - - [1024, 32, 1, 512]
    - [7, 1184.83]
  - - [4288, 256, 1, 1]
    - [134, 77.0876]
  - - [64, 256, 1, 1]
    - [148, 1.19766]
  - - [1856, 448, 1, 3328]
    - [87, 11015.9]
  - - [3584, 2368, 1, 256]
    - [61, 17353.4]
  - - [4288, 4288, 1, 256]
    - [75, 17428.4]
  - - [4288, 256, 1, 1280]
    - [67, 11616.2]
  - - [4288, 4288, 1, 1280]
    - [79, 16336.7]
  - - [4288, 704, 1, 1280]
    - [84, 13863.4]
  - - [128, 1856, 1, 32]
    - [114, 437.913]
  - - [256, 1856, 1, 32]
    - [119, 922.594]
  - - [1408, 1856, 1, 1]
    - [138, 125.156]
  - - [2368, 704, 1, 1]
    - [134, 83.6884]
  - - [128, 50176, 1, 512]
    - [94, 16272.4]
  - - [3584, 32, 1, 256]
    - [109, 903.945]
  - - [6784, 128, 1, 3328]
    - [72, 12796.1]
  - - [3584, 256, 1, 1]
    - [130, 70.7951]
  - - [2048, 16, 1, 2048]
    - [20, 1511.46]
  - - [1408, 1856, 1, 1280]
    - [85, 14026.1]
  - - [3584, 4288, 1, 3328]
    - [60, 15241.8]
  - - [1024, 24000, 1, 2048]
    - [87, 17488.9]
  - - [448, 4288, 1, 32]
    - [112, 2371.63]
  - - [448, 4288, 1, 1280]
    - [76, 11172.8]
  - - [64, 3584, 1, 256]
    - [13, 4705.15]
  - - [6784, 1408, 1, 1280]
    - [74, 16746.6]
  - - [3584, 704, 1, 256]
    - [61, 15007.5]
  - - [1, 6784, 1, 1280]
    - [144, 55.8067]
  - - [5056, 1024, 1, 256]
    - [86, 13591.1]
  - - [2368, 448, 1, 32]
    - [103, 1499.45]
  - - [256, 1, 1, 256]
    - [146, 1.72827]
  - - [32, 2944, 1, 1280]
    - [120, 1102.65]
  - - [448, 3584, 1, 1]
    - [127, 70.6704]
  - - [2368, 256, 1, 256]
    - [26, 8471.03]
  - - [1, 5056, 1, 1]
    - [134, 0.347253]
  - - [512, 3000, 1, 2048]
    - [84, 10743.6]
  - - [4288, 32, 1, 32]
    - [102, 295.088]
  - - [3072, 1500, 1, 1024]
    - [83, 12404.3]
  - - [1856, 3584, 1, 32]
    - [112, 3446.58]
  - - [5056, 3584, 1, 3328]
    - [60, 17522.1]
  - - [1856, 256, 1, 32]
    - [107, 959.871]
  - - [4288, 5056, 1, 256]
    - [86, 17079.3]
  - - [1856, 5888, 1, 256]
    - [60, 16257.6]
  - - [256, 256, 1, 256]
    - [12, 1792.44]
  - - [128, 1856, 1, 1]
    - [136, 19.1587]
  - - [4288, 2368, 1, 256]
    - [60, 14127.3]
  - - [448, 1, 1, 3328]
    - [146, 5.53841]
  - - [1856, 256, 1, 1280]
    - [67, 10163.3]
  - - [256, 2944, 1, 1]
    - [133, 60.7794]
  - - [1408, 2944, 1, 3328]
    - [61, 16397.7]
  - - [4288, 128, 1, 256]
    - [34, 7876.08]
  - - [5888, 3584, 1, 1]
    - [129, 239.15]
  - - [256, 1, 1, 1]
    - [133, 0.0233577]
  - - [6784, 5056, 1, 3328]
    - [71, 18929.3]
  - - [6784, 5056, 1, 1]
    - [126, 284.883]
  - - [5888, 3584, 1, 32]
    - [108, 4444.99]
  - - [5888, 3584, 1, 3328]
    - [61, 17332.3]
  - - [32, 1024, 1, 1280]
    - [120, 371.572]
  - - [1, 256, 1, 3328]
    - [146, 3.16575]
  - - [1024, 6784, 1, 256]
    - [86, 14979.7]
  - - [6784, 5888, 1, 32]
    - [112, 4768.03]
  - - [1408, 1, 1, 1280]
    - [142, 16.4079]
  - - [2368, 6784, 1, 32]
    - [118, 3892.07]
  - - [6784, 64, 1, 1]
    - [133, 36.1813]
  - - [2368, 32, 1, 32]
    - [109, 166.541]
  - - [8448, 6000, 1, 2816]
    - [71, 17026.1]
  - - [5056, 1408, 1, 1280]
    - [61, 17772.1]
  - - [3584, 1408, 1, 3328]
    - [61, 18079.8]
  - - [2944, 3584, 1, 1]
    - [132, 228.978]
  - - [2944, 1408, 1, 1280]
    - [79, 12908.2]
  - - [256, 1408, 1, 1]
    - [144, 24.6208]
  - - [3584, 1024, 1, 1]
    - [129, 142.028]
  - - [256, 32, 1, 256]
    - [109, 63.6272]
  - - [2944, 1856, 1, 3328]
    - [72, 17594.6]
  - - [128, 1024, 1, 3328]
    - [23, 5485.51]
  - - [1408, 128, 1, 1]
    - [127, 15.7538]
  - - [2944, 3584, 1, 32]
    - [119, 3654.13]
  - - [3584, 1024, 1, 32]
    - [114, 2769.82]
  - - [64, 193600, 1, 256]
    - [93, 15752.6]
  - - [6784, 64, 1, 256]
    - [30, 7124.94]
  - - [256, 128, 1, 1280]
    - [48, 1440.35]
  - - [6784, 5056, 1, 256]
    - [61, 18682.5]
  - - [1408, 32, 1, 3328]
    - [117, 502.5]
  - - [1856, 3584, 1, 1280]
    - [72, 16848.2]
  - - [256, 5888, 1, 256]
    - [61, 12399.6]
  - - [5056, 32, 1, 256]
    - [114, 1071.91]
  - - [1024, 4288, 1, 3328]
    - [67, 14961.2]
  - - [448, 2368, 1, 256]
    - [67, 9699.33]
  - - [64, 1408, 1, 1280]
    - [41, 3542.49]
  - - [1024, 48000, 1, 2816]
    - [74, 19524.5]
  - - [3584, 32, 1, 1280]
    - [122, 1231.55]
  - - [128, 2368, 1, 3328]
    - [13, 7395.38]
  - - [3584, 1024, 1, 256]
    - [72, 15848.9]
  - - [256, 64, 1, 256]
    - [7, 463.972]
  - - [32, 1408, 1, 256]
    - [120, 318.981]
  - - [2368, 448, 1, 3328]
    - [64, 10009.5]
  - - [2368, 1408, 1, 1]
    - [138, 136.199]
  - - [1, 1, 1, 1]
    - [133, 8.99281e-05]
  - - [1024, 1856, 1, 32]
    - [108, 2249.16]
  - - [32, 1024, 1, 32]
    - [105, 70.8497]
  - - [4288, 1, 1, 256]
    - [138, 27.0643]
  - - [1856, 128, 1, 3328]
    - [50, 7690.92]
  - - [5888, 2368, 1, 1]
    - [126, 217.584]
  - - [2368, 2368, 1, 1]
    - [132, 165.704]
  - - [704, 256, 1, 1280]
    - [52, 5112.74]
  - - [704, 4288, 1, 256]
    - [69, 13879.3]
  - - [5888, 2368, 1, 32]
    - [108, 4149.64]
  - - [5888, 2368, 1, 1280]
    - [73, 17081.5]
  - - [128, 256, 1, 256]
    - [7, 919.804]
  - - [32, 4288, 1, 32]
    - [113, 295.088]
  - - [6784, 704, 1, 3328]
    - [79, 13534.0]
  - - [1856, 1856, 1, 32]
    - [109, 2701.75]
  - - [4288, 2944, 1, 32]
    - [108, 4010.76]
  - - [256, 5056, 1, 1]
    - [134, 80.095]
  - - [704, 64, 1, 256]
    - [17, 1275.92]
  - - [256, 2368, 1, 3328]
    - [58, 10015.2]
  - - [704, 1, 1, 1]
    - [127, 0.0651852]
  - - [64, 2944, 1, 3328]
    - [49, 6315.96]
  - - [5056, 5056, 1, 256]
    - [75, 18370.1]
  - - [1024, 4, 1, 500000]
    - [24, 210.249]
  - - [5888, 64, 1, 1]
    - [142, 32.263]
  - - [6784, 6784, 1, 256]
    - [61, 19025.0]
  - - [256, 1856, 1, 256]
    - [58, 7205.85]
  - - [5888, 64, 1, 32]
    - [107, 672.914]
  - - [2368, 2944, 1, 256]
    - [75, 16635.7]
  - - [448, 32, 1, 32]
    - [119, 29.2571]
  - - [704, 64, 1, 1]
    - [130, 3.75467]
  - - [3584, 704, 1, 3328]
    - [62, 14741.9]
  - - [4288, 704, 1, 3328]
    - [61, 15034.1]
  - - [4288, 2944, 1, 1280]
    - [73, 16117.3]
  - - [5124, 1500, 1, 2048]
    - [75, 15577.6]
  - - [448, 3584, 1, 256]
    - [67, 11049.5]
  - - [704, 32, 1, 256]
    - [107, 162.73]
  - - [6784, 256, 1, 32]
    - [112, 2307.91]
  - - [1856, 128, 1, 1]
    - [127, 20.9127]
  - - [1856, 32, 1, 32]
    - [104, 125.697]
  - - [2368, 5056, 1, 1280]
    - [72, 17558.3]
  - - [1408, 6784, 1, 3328]
    - [86, 15979.3]
  - - [6144, 1500, 1, 2560]
    - [79, 13319.1]
  - - [1408, 1408, 1, 1280]
    - [40, 15271.7]
  - - [448, 1024, 1, 3328]
    - [67, 10434.2]
  - - [32, 704, 1, 32]
    - [116, 39.1791]
  - - [1024, 5056, 1, 1]
    - [126, 175.384]
  - - [5888, 1856, 1, 32]
    - [112, 3895.95]
  - - [5888, 704, 1, 3328]
    - [72, 16882.5]
  - - [5056, 1, 1, 256]
    - [146, 30.9946]
  - - [448, 6784, 1, 256]
    - [72, 12967.4]
  - - [1024, 128, 1, 1]
    - [136, 10.8503]
  - - [128, 64, 1, 256]
    - [10, 238.313]
  - - [2560, 128, 1, 2560]
    - [47, 7860.39]
  - - [1024, 64, 1, 1280]
    - [48, 2811.2]
  - - [1024, 256, 1, 1280]
    - [67, 7358.43]
  - - [128, 5056, 1, 32]
    - [109, 1275.21]
  - - [128, 5056, 1, 1280]
    - [16, 11206.4]
  - - [1856, 1408, 1, 32]
    - [109, 2343.72]
  - - [64, 704, 1, 32]
    - [102, 81.5493]
  - - [64, 704, 1, 3328]
    - [48, 2120.28]
  - - [64, 2368, 1, 32]
    - [119, 261.297]
  - - [2944, 32, 1, 3328]
    - [124, 1139.26]
  - - [2368, 256, 1, 1]
    - [134, 45.9248]
  - - [5888, 64, 1, 1280]
    - [47, 8503.97]
  - - [5056, 1, 1, 1]
    - [134, 0.486154]
  - - [5888, 2944, 1, 1280]
    - [65, 18715.7]
  - - [32, 2368, 1, 256]
    - [114, 570.549]
  - - [1024, 6000, 1, 2560]
    - [86, 14821.5]
  - - [4224, 1500, 1, 176]
    - [61, 15948.7]
  - - [3584, 1408, 1, 1]
    - [132, 174.732]
  - - [32, 6784, 1, 1280]
    - [114, 1919.01]
  - - [32, 6784, 1, 32]
    - [109, 407.677]
  - - [7680, 32, 1, 2560]
    - [52, 7605.73]
  - - [448, 5888, 1, 32]
    - [116, 2431.17]
  - - [8448, 48000, 1, 2816]
    - [74, 9849.26]
  - - [1856, 6784, 1, 1]
    - [132, 187.815]
  - - [5056, 64, 1, 1]
    - [148, 24.6634]
  - - [3072, 48000, 1, 1024]
    - [60, 17781.6]
  - - [1, 5888, 1, 1]
    - [147, 0.462893]
  - - [2368, 1024, 1, 256]
    - [26, 9822.1]
  - - [1856, 6784, 1, 32]
    - [112, 4032.38]
  - - [1856, 6784, 1, 1280]
    - [72, 18006.6]
  - - [64, 3584, 1, 3328]
    - [50, 7408.42]
  - - [1408, 448, 1, 256]
    - [38, 7733.75]
  - - [5888, 5056, 1, 3328]
    - [84, 16128.0]
  - - [4096, 128, 1, 4096]
    - [32, 11231.6]
  - - [1, 2944, 1, 3328]
    - [146, 36.7668]
  - - [1408, 6784, 1, 32]
    - [112, 3875.0]
  - - [32, 5888, 1, 1280]
    - [120, 1708.98]
  - - [448, 256, 1, 1]
    - [133, 9.43158]
  - - [3584, 5888, 1, 3328]
    - [75, 17740.0]
  - - [4288, 1408, 1, 256]
    - [86, 15643.7]
  - - [448, 64, 1, 1280]
    - [51, 1250.01]
  - - [128, 448, 1, 32]
    - [107, 119.467]
  - - [512, 3136, 1, 2048]
    - [91, 12694.3]
  - - [6784, 2368, 1, 256]
    - [61, 18639.0]
  - - [1024, 24000, 1, 2816]
    - [86, 18469.9]
  - - [1408, 448, 1, 32]
    - [109, 1274.31]
  - - [1856, 1408, 1, 1280]
    - [84, 12161.7]
  - - [448, 256, 1, 3328]
    - [23, 4819.21]
  - - [1856, 2368, 1, 1]
    - [130, 139.79]
  - - [1408, 5056, 1, 3328]
    - [78, 13513.9]
  - - [128, 704, 1, 3328]
    - [22, 3805.75]
  - - [5056, 128, 1, 1280]
    - [43, 11182.2]
  - - [5056, 4288, 1, 256]
    - [84, 15724.5]
  - - [5056, 5056, 1, 32]
    - [108, 4159.99]
  - - [1856, 704, 1, 256]
    - [67, 11061.4]
  - - [3072, 32, 1, 1024]
    - [17, 3615.78]
  - - [64, 256, 1, 256]
    - [1, 468.114]
  - - [1024, 4, 1, 512]
    - [7, 149.797]
  - - [448, 5888, 1, 1280]
    - [61, 15003.6]
  - - [704, 704, 1, 3328]
    - [39, 10562.3]
  - - [128, 6784, 1, 256]
    - [32, 9648.36]
  - - [512, 4, 1, 500000]
    - [20, 101.573]
  - - [5056, 448, 1, 256]
    - [27, 11941.2]
  - - [4288, 5888, 1, 1]
    - [132, 216.459]
  - - [1856, 5056, 1, 1280]
    - [72, 17601.7]
  - - [2368, 4288, 1, 1]
    - [139, 178.265]
  - - [2368, 32, 1, 3328]
    - [114, 983.549]
  - - [3584, 1856, 1, 256]
    - [72, 16681.8]
  - - [256, 3584, 1, 256]
    - [61, 9918.96]
  - - [64, 704, 1, 1]
    - [140, 3.70526]
  - - [4288, 5888, 1, 32]
    - [108, 4388.99]
  - - [4288, 5888, 1, 3328]
    - [75, 19217.7]
  - - [1, 1024, 1, 1]
    - [134, 0.0934307]
  - - [1024, 2944, 1, 3328]
    - [61, 16092.6]
  - - [6144, 24000, 1, 2560]
    - [74, 16953.6]
  - - [1024, 5888, 1, 1]
    - [130, 160.014]
  - - [6784, 128, 1, 1280]
    - [72, 12123.6]
  - - [2944, 2368, 1, 256]
    - [61, 17055.4]
  - - [1024, 1856, 1, 256]
    - [27, 9638.26]
  - - [1760, 7000, 1, 1760]
    - [71, 17136.0]
  - - [2944, 64, 1, 3328]
    - [49, 6295.67]
  - - [1024, 5888, 1, 32]
    - [112, 3387.25]
  - - [1024, 5888, 1, 3328]
    - [75, 14333.3]
  - - [5056, 2368, 1, 32]
    - [110, 3348.98]
  - - [1408, 2368, 1, 1280]
    - [86, 13471.3]
  - - [256, 1, 1, 3328]
    - [146, 3.17235]
  - - [128, 1024, 1, 32]
    - [114, 259.549]
  - - [5056, 6784, 1, 3328]
    - [61, 19352.7]
  - - [1024, 3000, 1, 1536]
    - [75, 17151.0]
  - - [32, 64, 1, 32]
    - [105, 4.01569]
  - - [448, 704, 1, 32]
    - [113, 657.067]
  - - [448, 704, 1, 3328]
    - [52, 7433.6]
  - - [1408, 2944, 1, 256]
    - [86, 11950.0]
  - - [64, 6784, 1, 256]
    - [14, 6844.15]
  - - [1024, 704, 1, 1]
    - [133, 60.4779]
  - - [2368, 128, 1, 32]
    - [107, 569.209]
  - - [3584, 448, 1, 256]
    - [61, 11443.3]
  - - [784, 512, 64, 128]
    - [98, 15907.2]
  - - [2368, 128, 1, 3328]
    - [13, 7386.72]
  - - [704, 1856, 1, 1280]
    - [61, 13082.6]
  - - [704, 5056, 1, 32]
    - [109, 2836.19]
  - - [32, 2368, 1, 32]
    - [109, 139.679]
  - - [1408, 1, 1, 256]
    - [134, 11.0703]
  - - [4288, 256, 1, 32]
    - [105, 1596.7]
  - - [448, 1408, 1, 1]
    - [143, 49.28]
  - - [5056, 4288, 1, 1280]
    - [61, 18828.7]
  - - [5888, 1, 1, 3328]
    - [144, 48.7929]
  - - [1408, 256, 1, 256]
    - [26, 5945.53]
  - - [4288, 448, 1, 1]
    - [138, 104.859]
  - - [1024, 448, 1, 32]
    - [109, 822.874]
  - - [5888, 6784, 1, 1280]
    - [68, 15902.9]
  - - [256, 256, 1, 1]
    - [134, 4.84734]
  - - [1856, 64, 1, 1280]
    - [23, 4579.62]
  - - [1408, 1, 1, 1]
    - [142, 0.123077]
  - - [448, 1408, 1, 256]
    - [67, 7704.23]
  - - [5888, 5888, 1, 1]
    - [129, 256.121]
  - - [4608, 16, 1, 1536]
    - [51, 2949.12]
  - - [128, 2944, 1, 32]
    - [111, 658.222]
  - - [448, 32, 1, 3328]
    - [121, 160.965]
  - - [32, 256, 1, 32]
    - [119, 16.0627]
  - - [2944, 704, 1, 1280]
    - [72, 16663.9]
  - - [1024, 3584, 1, 1280]
    - [72, 17729.5]
  - - [1856, 448, 1, 1]
    - [136, 64.5565]
  - - [2368, 2944, 1, 1]
    - [132, 172.902]
  - - [5056, 256, 1, 32]
    - [108, 1869.08]
  - - [4288, 1, 1, 3328]
    - [142, 39.3776]
  - - [5056, 1024, 1, 1280]
    - [86, 16988.8]
  - - [704, 704, 1, 1]
    - [133, 43.9376]
  - - [1856, 448, 1, 1280]
    - [85, 10321.0]
  - - [3584, 6784, 1, 256]
    - [75, 18577.9]
  - - [1856, 1024, 1, 1]
    - [127, 101.093]
  - - [64, 1856, 1, 1280]
    - [17, 4525.1]
  - - [1856, 1408, 1, 256]
    - [69, 13937.3]
  - - [4288, 4288, 1, 32]
    - [112, 4241.51]
  - - [128, 1, 1, 256]
    - [134, 0.916331]
  - - [32, 64, 1, 3328]
    - [120, 25.3185]
  - - [5888, 448, 1, 1]
    - [130, 108.108]
  - - [7680, 4, 1, 2560]
    - [20, 1392.41]
  - - [128, 5888, 1, 256]
    - [32, 10007.2]
  - - [3584, 256, 1, 3328]
    - [77, 11846.1]
  - - [5056, 5056, 1, 1280]
    - [65, 16573.8]
  - - [2368, 1, 1, 256]
    - [142, 17.5002]
  - - [6784, 1408, 1, 3328]
    - [75, 17949.1]
  - - [512, 24000, 1, 2048]
    - [84, 15464.9]
  - - [1408, 1408, 1, 1]
    - [126, 118.568]
  - - [32, 64, 1, 256]
    - [120, 15.2409]
  - - [2368, 1, 1, 1280]
    - [144, 23.9797]
  - - [32, 3584, 1, 32]
    - [105, 219.499]
  - - [128, 6784, 1, 1]
    - [142, 57.7362]
  - - [1, 3584, 1, 1]
    - [127, 0.324638]
  - - [3072, 2, 1, 1024]
    - [10, 255.335]
  - - [512, 24000, 1, 2560]
    - [86, 17001.7]
  - - [1, 128, 1, 3328]
    - [146, 1.58335]
  - - [32, 256, 1, 256]
    - [120, 60.6815]
  - - [4608, 1, 1, 1536]
    - [20, 201.076]
  - - [5888, 1408, 1, 32]
    - [108, 3802.89]
  - - [704, 256, 1, 1]
    - [136, 16.6874]
  - - [448, 2944, 1, 3328]
    - [61, 13530.6]
  - - [1, 448, 1, 1]
    - [134, 0.0339394]
  - - [64, 5888, 1, 256]
    - [14, 6215.79]
  - - [1856, 1, 1, 1]
    - [149, 0.148718]
  - - [1024, 256, 1, 3328]
    - [82, 7588.86]
  - - [512, 1500, 1, 2048]
    - [85, 9786.36]
  - - [448, 1024, 1, 32]
    - [119, 794.376]
  - - [6784, 2368, 1, 1280]
    - [65, 18472.9]
  - - [128, 1856, 1, 1280]
    - [11, 6987.29]
  - - [256, 2368, 1, 256]
    - [67, 7917.82]
  - - [2944, 1408, 1, 1]
    - [126, 159.921]
  - - [6784, 1024, 1, 256]
    - [61, 17073.6]
  - - [5056, 1408, 1, 32]
    - [112, 3604.48]
  - - [2944, 1408, 1, 3328]
    - [69, 14686.8]
  - - [1856, 32, 1, 256]
    - [119, 429.017]
  - - [704, 2368, 1, 32]
    - [105, 2077.35]
  - - [448, 256, 1, 32]
    - [114, 218.453]
  - - [704, 6784, 1, 1]
    - [138, 165.372]
  - - [2368, 6784, 1, 256]
    - [61, 17999.4]
  - - [256, 1408, 1, 256]
    - [58, 5945.53]
  - - [256, 4288, 1, 1280]
    - [39, 10936.3]
  - - [6144, 6000, 1, 2560]
    - [75, 18676.5]
  - - [1856, 1856, 1, 1]
    - [134, 148.48]
  - - [1856, 3584, 1, 3328]
    - [87, 15525.1]
  - - [1, 704, 1, 3328]
    - [150, 8.03026]
  - - [256, 128, 1, 1]
    - [136, 2.73067]
  - - [4096, 32, 1, 4096]
    - [44, 5126.73]
  - - [64, 1, 1, 3328]
    - [150, 0.730825]
  - - [256, 2944, 1, 3328]
    - [72, 11133.7]
  - - [704, 1856, 1, 1]
    - [129, 85.512]
  - - [704, 448, 1, 256]
    - [67, 5021.17]
  - - [448, 64, 1, 3328]
    - [48, 1398.31]
  - - [704, 6784, 1, 256]
    - [86, 13918.9]
  - - [2368, 448, 1, 1280]
    - [61, 10715.8]
  - - [6784, 2944, 1, 32]
    - [108, 4450.61]
  - - [64, 4288, 1, 32]
    - [113, 571.733]
  - - [128, 704, 1, 1]
    - [134, 7.76828]
  - - [128, 448, 1, 3328]
    - [48, 2683.36]
  - - [5888, 2368, 1, 3328]
    - [75, 18863.6]
  - - [2368, 704, 1, 1280]
    - [72, 13417.1]
  - - [1024, 1408, 1, 1280]
    - [77, 13077.5]
  - - [3072, 6000, 1, 1024]
    - [86, 18015.4]
  - - [1408, 5888, 1, 256]
    - [61, 17430.3]
  - - [4288, 64, 1, 1280]
    - [13, 6410.09]
  - - [128, 5056, 1, 1]
    - [133, 50.246]
  - - [2944, 5056, 1, 32]
    - [101, 3770.71]
  - - [7680, 64, 1, 2560]
    - [45, 10773.0]
  - - [448, 448, 1, 1]
    - [130, 16.5053]
  - - [256, 2368, 1, 1280]
    - [67, 9847.03]
  - - [704, 2368, 1, 3328]
    - [75, 13476.5]
  - - [3584, 2944, 1, 256]
    - [61, 16342.8]
  - - [5056, 256, 1, 3328]
    - [66, 12432.3]
  - - [3584, 1024, 1, 1280]
    - [87, 14716.8]
  - - [1408, 256, 1, 32]
    - [114, 689.853]
  - - [64, 1024, 1, 256]
    - [10, 1823.61]
  - - [1408, 32, 1, 32]
    - [107, 94.8547]
  - - [128, 3584, 1, 256]
    - [32, 7489.83]
  - - [704, 1408, 1, 1]
    - [133, 76.0147]
  - - [5056, 3584, 1, 256]
    - [61, 18585.3]
  - - [2368, 704, 1, 256]
    - [67, 9134.64]
  - - [1856, 1856, 1, 1280]
    - [72, 16384.0]
  - - [32, 5888, 1, 32]
    - [109, 345.717]
  - - [2368, 2368, 1, 3328]
    - [69, 16470.3]
  - - [4288, 704, 1, 1]
    - [133, 127.913]
  - - [3072, 1500, 1, 128]
    - [61, 14924.7]
  - - [2048, 3136, 1, 512]
    - [33, 16330.6]
  - - [4288, 2944, 1, 3328]
    - [71, 16163.0]
  - - [1024, 128, 1, 3328]
    - [23, 5485.51]
  - - [4288, 128, 1, 3328]
    - [14, 9979.35]
  - - [4288, 704, 1, 32]
    - [109, 2558.26]
  - - [1856, 1024, 1, 32]
    - [101, 2203.53]
  - - [1, 448, 1, 3328]
    - [142, 5.57153]
  - - [2944, 6784, 1, 1]
    - [137, 220.151]
  - - [6784, 2368, 1, 32]
    - [101, 3889.71]
  - - [5888, 5056, 1, 1]
    - [126, 259.68]
  - - [128, 6784, 1, 1280]
    - [72, 12134.2]
  - - [6784, 6784, 1, 1]
    - [128, 240.102]
  - - [1856, 32, 1, 1280]
    - [120, 681.687]
  - - [3072, 16, 1, 1024]
    - [23, 1997.29]
  - - [1024, 2, 1, 512]
    - [10, 75.7642]
  - - [5888, 448, 1, 3328]
    - [77, 12392.2]
  - - [704, 5888, 1, 32]
    - [101, 3003.73]
  - - [704, 5888, 1, 1280]
    - [60, 14220.1]
  - - [1024, 6784, 1, 3328]
    - [75, 17302.5]
  - - [704, 2944, 1, 1280]
    - [69, 15395.1]
  - - [3584, 256, 1, 32]
    - [113, 1638.4]
  - - [1408, 1408, 1, 32]
    - [108, 2402.99]
  - - [1024, 64, 1, 256]
    - [1, 1807.89]
  - - [4288, 64, 1, 32]
    - [107, 590.176]
  - - [5888, 6784, 1, 32]
    - [112, 4260.71]
  - - [5888, 128, 1, 256]
    - [5, 10306.5]
  - - [64, 704, 1, 1280]
    - [48, 1927.53]
  - - [2944, 1856, 1, 256]
    - [84, 13954.5]
  - - [128, 5056, 1, 3328]
    - [16, 11735.9]
  - - [4288, 2944, 1, 1]
    - [126, 191.503]
  - - [6784, 5056, 1, 32]
    - [109, 4049.57]
  - - [64, 1024, 1, 3328]
    - [20, 3084.05]
  - - [3584, 128, 1, 1]
    - [130, 39.0095]
  - - [2944, 4288, 1, 1280]
    - [74, 17368.8]
  - - [64, 32, 1, 3328]
    - [116, 20.3333]
  - - [1024, 4288, 1, 256]
    - [61, 15491.6]
  - - [128, 2368, 1, 256]
    - [29, 5358.74]
  - - [2368, 64, 1, 32]
    - [102, 276.807]
  - - [1408, 1, 1, 3328]
    - [146, 17.3703]
  - - [64, 1408, 1, 32]
    - [102, 166.874]
  - - [2368, 5888, 1, 1]
    - [139, 199.183]
  - - [1408, 1856, 1, 32]
    - [113, 2488.81]
  - - [256, 4288, 1, 32]
    - [108, 1608.39]
  - - [1856, 6784, 1, 3328]
    - [60, 17577.4]
  - - [3584, 128, 1, 256]
    - [30, 7808.54]
  - - [1024, 448, 1, 1280]
    - [88, 6518.68]
  - - [512, 6000, 1, 1536]
    - [75, 17111.2]
  - - [128, 5888, 1, 1]
    - [138, 58.1531]
  - - [32, 2368, 1, 1280]
    - [124, 818.094]
  - - [64, 32, 1, 32]
    - [102, 3.82804]
  - - [1408, 704, 1, 1]
    - [134, 76.0147]
  - - [64, 448, 1, 1]
    - [130, 2.40537]
  - - [3584, 5888, 1, 32]
    - [112, 4485.14]
  - - [3584, 5888, 1, 1280]
    - [61, 19429.2]
  - - [448, 5888, 1, 1]
    - [140, 123.958]
  - - [64, 5056, 1, 32]
    - [102, 628.318]
  - - [2944, 64, 1, 1]
    - [133, 13.3062]
  - - [1408, 704, 1, 32]
    - [109, 1605.23]
  - - [1408, 704, 1, 1280]
    - [72, 13827.1]
  - - [2368, 5888, 1, 256]
    - [72, 15782.4]
  - - [2944, 64, 1, 32]
    - [119, 320.708]
  - - [1, 1408, 1, 256]
    - [142, 10.9625]
  - - [64, 2944, 1, 256]
    - [17, 4216.3]
  - - [5888, 5888, 1, 32]
    - [108, 4628.64]
  - - [1856, 1408, 1, 3328]
    - [61, 15025.7]
  - - [1024, 1024, 1, 32]
    - [119, 1800.13]
  - - [4288, 1024, 1, 1]
    - [132, 146.755]
  - - [704, 4288, 1, 3328]
    - [72, 14406.3]
  - - [2944, 5056, 1, 1280]
    - [65, 18231.4]
  - - [512, 3000, 1, 2816]
    - [61, 15799.9]
  - - [6784, 2944, 1, 1280]
    - [71, 18349.3]
  - - [6784, 256, 1, 3328]
    - [28, 14143.9]
  - - [5056, 128, 1, 3328]
    - [16, 11839.1]
  - - [128, 128, 1, 1280]
    - [48, 720.176]
  - - [128, 4288, 1, 1]
    - [142, 44.2632]
  - - [1408, 5056, 1, 32]
    - [108, 3586.32]
  - - [2944, 128, 1, 3328]
    - [14, 9270.38]
  - - [5888, 1856, 1, 1280]
    - [75, 18473.3]
  - - [64, 128, 1, 256]
    - [7, 262.144]
  - - [5888, 256, 1, 1280]
    - [61, 15073.3]
  - - [1856, 5056, 1, 1]
    - [132, 169.508]
  - - [3584, 1856, 1, 1280]
    - [74, 16396.6]
  - - [704, 3584, 1, 256]
    - [69, 13434.3]
  - - [1856, 5056, 1, 32]
    - [108, 3705.4]
  - - [1856, 5056, 1, 3328]
    - [65, 15591.1]
  - - [1024, 2944, 1, 32]
    - [119, 2644.44]
  - - [1408, 6784, 1, 256]
    - [61, 16896.6]
  - - [1024, 2368, 1, 1280]
    - [61, 14893.4]
  - - [448, 6784, 1, 1]
    - [127, 134.718]
  - - [5888, 128, 1, 1280]
    - [32, 12587.3]
  - - [512, 4, 1, 512]
    - [7, 76.2047]
  - - [2944, 5888, 1, 1280]
    - [62, 14579.6]
  - - [1, 1856, 1, 1]
    - [142, 0.157823]
  - - [3584, 3584, 1, 256]
    - [86, 16648.1]
  - - [1856, 2368, 1, 3328]
    - [61, 16309.7]
  - - [5888, 704, 1, 256]
    - [56, 12644.9]
  - - [64, 448, 1, 32]
    - [113, 50.7469]
  - - [6784, 4288, 1, 256]
    - [61, 19001.2]
  - - [128, 64, 1, 3328]
    - [48, 406.183]
  - - [2944, 64, 1, 1280]
    - [13, 5899.52]
  - - [1, 5056, 1, 1280]
    - [142, 38.5036]
  - - [32, 64, 1, 1280]
    - [120, 24.4903]
  - - [1408, 2368, 1, 3328]
    - [57, 12611.4]
  - - [1024, 3584, 1, 256]
    - [61, 11502.5]
  - - [2944, 128, 1, 256]
    - [5, 6448.46]
  - - [6784, 128, 1, 1]
    - [140, 57.1284]
  - - [1408, 256, 1, 3328]
    - [26, 8298.08]
  - - [1024, 16, 1, 512]
    - [12, 592.416]
  - - [448, 32, 1, 256]
    - [116, 108.196]
  - - [512, 24000, 1, 1536]
    - [75, 19086.6]
  - - [1, 5888, 1, 256]
    - [134, 36.2338]
  - - [64, 2368, 1, 256]
    - [1, 3565.93]
  - - [448, 1856, 1, 256]
    - [67, 9019.53]
  - - [2944, 256, 1, 256]
    - [58, 10133.3]
  - - [1, 128, 1, 256]
    - [144, 0.93945]
  - - [32, 256, 1, 1280]
    - [114, 96.7321]
  - - [4224, 1, 1, 128]
    - [1, 82.4195]
  - - [32, 128, 1, 3328]
    - [120, 52.2198]
  - - [1024, 3000, 1, 2048]
    - [85, 13787.4]
  - - [1024, 12544, 1, 256]
    - [92, 17763.3]
  - - [6784, 64, 1, 1280]
    - [14, 9451.45]
  - - [4288, 1024, 1, 32]
    - [109, 2907.89]
  - - [2944, 1, 1, 1280]
    - [134, 28.9159]
  - - [1408, 64, 1, 3328]
    - [41, 3868.59]
  - - [2944, 448, 1, 1280]
    - [61, 12922.6]
  - - [6784, 32, 1, 1280]
    - [120, 1955.75]
  - - [1024, 704, 1, 1280]
    - [58, 11604.0]
  - - [704, 448, 1, 1]
    - [140, 28.16]
  - - [32, 128, 1, 32]
    - [105, 8.57801]
  - - [1, 128, 1, 1]
    - [130, 0.00987654]
  - - [2560, 7000, 1, 2560]
    - [86, 17736.0]
  - - [5888, 1, 1, 1]
    - [136, 0.462893]
  - - [5888, 1856, 1, 3328]
    - [74, 17829.2]
  - - [32, 2368, 1, 3328]
    - [114, 982.63]
  - - [196, 256, 64, 1024]
    - [100, 10693.1]
  - - [4288, 1408, 1, 3328]
    - [84, 15023.3]
  - - [1856, 64, 1, 1]
    - [134, 10.3111]
  - - [1856, 32, 1, 3328]
    - [122, 717.602]
  - - [2944, 32, 1, 256]
    - [124, 556.21]
  - - [128, 64, 1, 1]
    - [147, 0.605917]
  - - [256, 1024, 1, 3328]
    - [82, 7578.31]
  - - [32, 448, 1, 256]
    - [113, 96.5794]
  - - [1856, 64, 1, 32]
    - [109, 252.732]
  - - [1856, 64, 1, 3328]
    - [53, 4956.28]
  - - [256, 5056, 1, 256]
    - [67, 11634.5]
  - - [5888, 2944, 1, 3328]
    - [68, 16929.7]
  - - [2368, 1408, 1, 3328]
    - [72, 15334.5]
  - - [5888, 704, 1, 32]
    - [116, 2898.71]
  - - [2944, 704, 1, 1]
    - [140, 113.628]
  - - [6784, 1856, 1, 256]
    - [72, 17233.3]
  - - [1, 704, 1, 256]
    - [142, 4.91878]
  - - [448, 5056, 1, 1]
    - [130, 116.998]
  - - [3584, 448, 1, 32]
    - [108, 2092.03]
  - - [2368, 1856, 1, 1]
    - [133, 137.344]
  - - [128, 704, 1, 256]
    - [12, 2423.18]
  - - [256, 1408, 1, 3328]
    - [58, 7725.21]
  - - [2944, 128, 1, 1]
    - [145, 31.827]
  - - [32, 256, 1, 3328]
    - [120, 105.605]
  - - [2944, 704, 1, 3328]
    - [61, 16829.8]
  - - [704, 1024, 1, 32]
    - [109, 1434.62]
  - - [2368, 1856, 1, 32]
    - [108, 2994.89]
  - - [5056, 4288, 1, 3328]
    - [71, 18609.1]
  - - [64, 193600, 1, 64]
    - [67, 12823.2]
  - - [256, 32, 1, 32]
    - [119, 16.3025]
  - - [64, 256, 1, 3328]
    - [20, 802.797]
  - - [256, 6784, 1, 1]
    - [126, 104.873]
  - - [7680, 1500, 1, 2560]
    - [66, 14702.1]
  - - [704, 5056, 1, 256]
    - [75, 10775.9]
  - - [1024, 3584, 1, 32]
    - [109, 2718.53]
  - - [256, 6784, 1, 32]
    - [112, 2248.16]
  - - [2944, 1408, 1, 32]
    - [112, 2815.04]
  - - [1024, 32, 1, 256]
    - [116, 231.474]
  - - [4288, 3584, 1, 1]
    - [126, 202.213]
  - - [1, 704, 1, 1]
    - [133, 0.0642336]
  - - [5056, 448, 1, 3328]
    - [60, 13076.3]
  - - [3584, 64, 1, 256]
    - [18, 4705.15]
  - - [64, 1856, 1, 32]
    - [102, 187.801]
  - - [64, 1856, 1, 3328]
    - [23, 4971.24]
  - - [5888, 5888, 1, 3328]
    - [74, 18838.6]
  - - [4288, 1856, 1, 256]
    - [74, 16252.3]
  - - [1856, 2944, 1, 256]
    - [86, 14123.6]
  - - [128, 448, 1, 1]
    - [143, 4.68497]
  - - [64, 128, 1, 32]
    - [102, 14.0034]
  - - [704, 1, 1, 1280]
    - [146, 7.76828]
  - - [5056, 5888, 1, 1280]
    - [75, 17055.1]
  - - [2944, 5888, 1, 1]
    - [132, 238.108]
  - - [1024, 1856, 1, 3328]
    - [75, 13352.9]
  - - [5888, 1024, 1, 32]
    - [108, 3455.19]
  - - [3584, 256, 1, 1280]
    - [72, 12866.0]
  - - [1024, 1, 1, 1]
    - [127, 0.0941176]
  - - [1408, 5056, 1, 1280]
    - [86, 16972.3]
  - - [3584, 128, 1, 1280]
    - [14, 9932.38]
  - - [5056, 6784, 1, 256]
    - [84, 15792.7]
  - - [64, 4288, 1, 256]
    - [29, 4933.61]
  - - [5888, 32, 1, 1280]
    - [120, 1688.88]
  - - [256, 128, 1, 32]
    - [104, 56.9878]
  - - [32, 1856, 1, 1280]
    - [124, 620.282]
  - - [2944, 5056, 1, 1]
    - [126, 245.463]
  - - [448, 128, 1, 1]
    - [134, 4.74702]
  - - [256, 704, 1, 32]
    - [109, 329.176]
  - - [1, 2368, 1, 1]
    - [143, 0.181595]
  - - [5888, 5888, 1, 1280]
    - [74, 18820.5]
  - - [256, 2944, 1, 1280]
    - [67, 12205.1]
  - - [2944, 256, 1, 3328]
    - [67, 11768.9]
  - - [5056, 2944, 1, 1280]
    - [60, 17989.1]
  - - [704, 1024, 1, 3328]
    - [67, 12200.7]
  - - [2368, 1856, 1, 1280]
    - [86, 14466.2]
  - - [1024, 6000, 1, 2816]
    - [69, 15847.3]
  - - [1856, 128, 1, 256]
    - [13, 4968.74]
  - - [6784, 2944, 1, 1]
    - [126, 256.315]
  - - [2944, 1024, 1, 32]
    - [118, 2460.94]
  - - [2944, 1024, 1, 1280]
    - [87, 15559.5]
  - - [1408, 64, 1, 32]
    - [102, 165.343]
  - - [5056, 5056, 1, 1]
    - [126, 216.637]
  - - [2368, 4288, 1, 256]
    - [72, 16896.9]
  - - [448, 1856, 1, 1280]
    - [72, 10728.9]
  - - [256, 3584, 1, 1]
    - [136, 58.2173]
  - - [448, 2944, 1, 32]
    - [115, 1752.71]
  - - [448, 2944, 1, 1280]
    - [72, 13180.9]
  - - [2944, 6784, 1, 1280]
    - [61, 17821.3]
  - - [2048, 64, 1, 2048]
    - [23, 4941.74]
  - - [8448, 2, 1, 2816]
    - [20, 717.418]
  - - [256, 6784, 1, 1280]
    - [58, 12590.5]
  - - [3136, 2048, 1, 512]
    - [99, 16337.1]
  - - [3584, 2368, 1, 32]
    - [114, 3394.76]
  - - [704, 32, 1, 32]
    - [102, 43.9571]
  - - [6784, 3584, 1, 3328]
    - [80, 15227.2]
  - - [128, 32, 1, 256]
    - [114, 32.9327]
  - - [128, 1408, 1, 1280]
    - [17, 5556.04]
  - - [6784, 3584, 1, 32]
    - [109, 3974.48]
  - - [128, 1856, 1, 3328]
    - [52, 7673.0]
  - - [2944, 2944, 1, 256]
    - [61, 17509.3]
  - - [1408, 1024, 1, 3328]
    - [64, 13442.1]
  - - [8448, 3000, 1, 2816]
    - [68, 17020.4]
  - - [1760, 64, 1, 1760]
    - [17, 4481.16]
  - - [5056, 2368, 1, 1280]
    - [74, 16465.6]
  - - [8448, 1500, 1, 2816]
    - [75, 17905.9]
  - - [448, 128, 1, 32]
    - [102, 120.092]
  - - [32, 5056, 1, 3328]
    - [114, 1530.02]
  - - [1024, 5056, 1, 1280]
    - [86, 16358.1]
  - - [2944, 1024, 1, 1]
    - [130, 138.541]
  - - [4608, 4, 1, 1536]
    - [22, 793.485]
  - - [2368, 128, 1, 1280]
    - [43, 7018.33]
  - - [196, 1024, 64, 256]
    - [97, 13525.6]
  - - [2368, 5888, 1, 3328]
    - [56, 13963.6]
  - - [448, 5056, 1, 256]
    - [82, 10550.6]
  - - [4288, 2368, 1, 1]
    - [134, 178.265]
  - - [1408, 3584, 1, 32]
    - [114, 3081.69]
  - - [2944, 4288, 1, 32]
    - [111, 3439.75]
  - - [5888, 1408, 1, 1280]
    - [86, 17444.1]
  - - [3584, 5056, 1, 1280]
    - [80, 15235.5]
  - - [2368, 448, 1, 1]
    - [130, 72.4634]
  - - [512, 6000, 1, 2560]
    - [87, 16408.6]
  - - [448, 704, 1, 1]
    - [140, 25.4348]
  - - [704, 128, 1, 32]
    - [102, 189.709]
  - - [3584, 2944, 1, 1]
    - [126, 223.544]
  - - [2944, 5888, 1, 256]
    - [65, 18050.6]
  - - [2944, 32, 1, 32]
    - [106, 133.156]
  - - [256, 4288, 1, 3328]
    - [67, 11661.2]
  - - [4288, 64, 1, 1]
    - [134, 23.8222]
  - - [1024, 1, 1, 512]
    - [10, 37.6644]
  - - [1, 1408, 1, 1280]
    - [144, 15.1296]
  - - [6784, 1408, 1, 32]
    - [114, 3537.73]
  - - [1856, 704, 1, 32]
    - [108, 1736.38]
  - - [1024, 1856, 1, 1]
    - [134, 96.5724]
  - - [704, 5056, 1, 3328]
    - [66, 13928.3]
  - - [1024, 3584, 1, 3328]
    - [75, 15888.5]
  - - [5888, 256, 1, 3328]
    - [27, 15157.1]
  - - [2368, 256, 1, 1280]
    - [26, 10263.8]
  - - [2048, 7000, 1, 2048]
    - [72, 16838.0]
  - - [1856, 1408, 1, 1]
    - [133, 126.122]
  - - [2944, 448, 1, 32]
    - [108, 1764.43]
  - - [128, 448, 1, 256]
    - [1, 1555.09]
  - - [128, 1024, 1, 1]
    - [130, 10.1764]
  - - [32, 32, 1, 256]
    - [113, 7.3636]
  - - [4288, 5056, 1, 1280]
    - [84, 15980.9]
  - - [1856, 1856, 1, 3328]
    - [87, 14317.2]
  - - [1024, 2368, 1, 256]
    - [61, 13685.1]
  - - [4288, 2368, 1, 3328]
    - [65, 16128.5]
  - - [256, 64, 1, 32]
    - [102, 33.267]
  - - [1, 1024, 1, 1280]
    - [142, 11.2373]
  - - [64, 32, 1, 1280]
    - [124, 21.6005]
  - - [1024, 32, 1, 3328]
    - [114, 384.526]
  - - [5888, 3584, 1, 256]
    - [61, 18633.6]
  - - [1024, 5056, 1, 32]
    - [108, 3225.76]
  - - [704, 5888, 1, 3328]
    - [73, 14576.3]
  - - [1024, 48000, 1, 1536]
    - [84, 16358.1]
  - - [1024, 1408, 1, 256]
    - [72, 9512.85]
  - - [3584, 2944, 1, 1280]
    - [71, 17510.7]
  - - [1, 5056, 1, 256]
    - [134, 27.4224]
  - - [256, 1024, 1, 1]
    - [130, 18.513]
  - - [32, 32, 1, 3328]
    - [120, 13.3286]
  - - [5056, 128, 1, 32]
    - [114, 1238.6]
  - - [2368, 1, 1, 3328]
    - [142, 29.5822]
  - - [4288, 1856, 1, 1280]
    - [57, 13562.3]
  - - [3584, 5888, 1, 1]
    - [126, 242.447]
  - - [8448, 16, 1, 2816]
    - [12, 4650.94]
  - - [5888, 4288, 1, 256]
    - [61, 18650.2]
  - - [512, 2, 1, 512]
    - [7, 38.3251]
  - - [1024, 2944, 1, 1280]
    - [61, 17062.1]
  - - [6784, 1, 1, 1]
    - [143, 0.507784]
  - - [1408, 64, 1, 1280]
    - [41, 3577.65]
  - - [1, 256, 1, 1280]
    - [142, 2.88654]
  - - [2944, 3584, 1, 256]
    - [72, 17052.5]
  - - [1, 128, 1, 1280]
    - [142, 1.42124]
  - - [1024, 256, 1, 32]
    - [114, 436.907]
  - - [3072, 1, 1, 1024]
    - [20, 128.923]
  - - [2368, 32, 1, 1280]
    - [122, 811.523]
  - - [5888, 1856, 1, 1]
    - [126, 206.659]
  - - [512, 3000, 1, 1536]
    - [72, 15497.2]
  - - [1408, 1408, 1, 3328]
    - [61, 12558.3]
  - - [1024, 1500, 1, 2560]
    - [73, 13841.7]
  - - [1024, 1, 1, 500000]
    - [20, 53.9551]
  - - [448, 2368, 1, 1280]
    - [61, 10722.6]
  - - [6784, 2368, 1, 3328]
    - [60, 17711.8]
  - - [1, 64, 1, 256]
    - [142, 0.465455]
  - - [704, 128, 1, 1]
    - [127, 9.46555]
  - - [1408, 4288, 1, 32]
    - [112, 3599.11]
  - - [256, 64, 1, 1280]
    - [19, 736.36]
  - - [256, 448, 1, 256]
    - [41, 2936.01]
  - - [1856, 1024, 1, 1280]
    - [72, 15257.8]
  - - [4288, 3584, 1, 1280]
    - [63, 16567.2]
  - - [448, 1024, 1, 1280]
    - [52, 9520.15]
  - - [1024, 448, 1, 3328]
    - [52, 10532.1]
  - - [512, 48000, 1, 1536]
    - [60, 17925.7]
  - - [5056, 1856, 1, 1]
    - [132, 187.979]
  - - [5888, 2368, 1, 256]
    - [61, 18255.6]
  - - [1408, 1024, 1, 32]
    - [108, 1890.87]
  - - [32, 704, 1, 256]
    - [107, 163.468]
  - - [2944, 1, 1, 256]
    - [134, 19.5048]
  - - [32, 4288, 1, 256]
    - [114, 973.595]
  - - [5056, 1856, 1, 32]
    - [112, 3298.4]
  - - [5056, 1856, 1, 1280]
    - [60, 15029.3]
  - - [1, 64, 1, 1]
    - [134, 0.00583942]
  - - [1408, 5888, 1, 3328]
    - [61, 19209.9]
  - - [1408, 704, 1, 3328]
    - [85, 13057.4]
  - - [5056, 704, 1, 3328]
    - [71, 13590.8]
  - - [704, 64, 1, 1280]
    - [48, 1996.94]
  - - [1, 704, 1, 1280]
    - [144, 7.46455]
  - - [5888, 6784, 1, 1]
    - [132, 274.794]
  - - [5888, 4288, 1, 32]
    - [108, 4651.82]
  - - [1408, 3584, 1, 256]
    - [75, 16545.2]
  - - [64, 5056, 1, 1]
    - [133, 26.7868]
  - - [6784, 256, 1, 1]
    - [134, 103.375]
  - - [2944, 1, 1, 1]
    - [130, 0.201093]
  - - [256, 1856, 1, 3328]
    - [67, 10771.5]
  - - [4288, 128, 1, 1280]
    - [35, 9801.14]
  - - [6784, 256, 1, 1280]
    - [61, 14005.7]
  - - [2048, 32, 1, 2048]
    - [53, 2877.74]
  - - [128, 4288, 1, 256]
    - [4, 7806.07]
  - - [2368, 6784, 1, 1280]
    - [69, 17334.2]
  - - [128, 128, 1, 32]
    - [116, 28.0068]
  - - [128, 1408, 1, 32]
    - [105, 356.879]
  - - [6784, 128, 1, 32]
    - [109, 1557.58]
  - - [1408, 448, 1, 1]
    - [138, 51.5346]
  - - [2368, 1024, 1, 1]
    - [133, 116.132]
  - - [1024, 3000, 1, 2816]
    - [75, 17438.2]
  - - [2368, 704, 1, 3328]
    - [67, 13303.3]
  - - [5888, 1, 1, 1280]
    - [142, 51.0612]
  - - [4608, 6000, 1, 1536]
    - [72, 17509.1]
  - - [2944, 1856, 1, 32]
    - [115, 2842.17]
  - - [1024, 64, 1, 1]
    - [133, 5.57279]
  - - [1408, 32, 1, 1280]
    - [124, 478.683]
  - - [704, 1, 1, 256]
    - [144, 4.84473]
  - - [2368, 1408, 1, 256]
    - [72, 14437.4]
  - - [128, 3584, 1, 1]
    - [145, 36.5248]
  - - [4288, 1408, 1, 1]
    - [126, 170.358]
  - - [5888, 64, 1, 256]
    - [3, 6483.13]
  - - [64, 5056, 1, 1280]
    - [14, 7470.91]
  - - [1408, 2944, 1, 1]
    - [126, 162.428]
  - - [4288, 1408, 1, 32]
    - [112, 3515.29]
  - - [5888, 2944, 1, 256]
    - [75, 18385.7]
  - - [128, 64, 1, 1280]
    - [20, 364.089]
  - - [1408, 2944, 1, 32]
    - [119, 2839.15]
  - - [1, 3584, 1, 1280]
    - [142, 35.3975]
  - - [64, 64, 1, 32]
    - [107, 8.27475]
  - - [448, 1408, 1, 32]
    - [109, 1017.39]
  - - [128, 5056, 1, 256]
    - [5, 8850.16]
  - - [1, 1, 1, 1280]
    - [142, 0.0115942]
  - - [3072, 3000, 1, 1024]
    - [78, 12941.8]
  - - [8448, 24000, 1, 2816]
    - [86, 15555.8]
  - - [64, 704, 1, 256]
    - [7, 1360.18]
  - - [3072, 128, 1, 1024]
    - [46, 8388.61]
  - - [5888, 6784, 1, 256]
    - [60, 16516.5]
  - - [6784, 5888, 1, 1]
    - [135, 251.158]
  - - [1024, 16, 1, 500000]
    - [20, 835.774]
  - - [1, 448, 1, 1280]
    - [144, 4.73448]
  - - [1024, 1024, 1, 1]
    - [138, 79.4376]
  - - [1856, 704, 1, 1]
    - [132, 82.4889]
  - - [6784, 5888, 1, 1280]
    - [61, 19552.9]
  - - [1024, 4288, 1, 32]
    - [108, 3065.21]
  - - [1856, 1, 1, 1280]
    - [144, 18.4447]
  - - [3584, 5888, 1, 256]
    - [65, 18070.2]
  - - [5056, 2368, 1, 1]
    - [126, 197.698]
  - - [256, 1408, 1, 1280]
    - [67, 7762.0]
  - - [2560, 16, 1, 2560]
    - [20, 1891.37]
  - - [64, 256, 1, 32]
    - [119, 28.2483]
  - - [64, 5888, 1, 3328]
    - [14, 9248.5]
  - - [6784, 64, 1, 3328]
    - [52, 9973.34]
  - - [5056, 448, 1, 1]
    - [138, 112.803]
  - - [2944, 448, 1, 3328]
    - [69, 12703.6]
  - - [2368, 1024, 1, 1280]
    - [61, 16158.8]
  - - [1856, 6784, 1, 256]
    - [61, 17749.6]
  - - [4288, 32, 1, 1280]
    - [120, 1238.97]
  - - [448, 1408, 1, 1280]
    - [67, 10267.1]
  - - [5056, 448, 1, 32]
    - [116, 2141.93]
  - - [3584, 2944, 1, 32]
    - [112, 3970.38]
  - - [2368, 128, 1, 1]
    - [127, 25.4282]
  - - [3584, 1856, 1, 32]
    - [108, 3460.03]
  - - [128, 128, 1, 3328]
    - [20, 803.743]
  - - [5056, 64, 1, 256]
    - [2, 5784.74]
  - - [4608, 1500, 1, 1536]
    - [75, 16518.6]
  - - [512, 1, 1, 500000]
    - [20, 26.0404]
  - - [64, 448, 1, 3328]
    - [48, 1398.31]
  - - [4288, 1408, 1, 1280]
    - [56, 14863.8]
  - - [32, 5056, 1, 256]
    - [114, 1048.05]
  - - [704, 128, 1, 256]
    - [17, 2423.18]
  - - [704, 5056, 1, 1]
    - [140, 133.212]
  - - [256, 1024, 1, 32]
    - [113, 474.469]
  - - [256, 1024, 1, 1280]
    - [38, 7410.43]
  - - [2368, 128, 1, 256]
    - [13, 5449.06]
  - - [2368, 1408, 1, 1280]
    - [86, 13423.8]
  - - [128, 256, 1, 32]
    - [102, 56.9878]
  - - [64, 6784, 1, 32]
    - [109, 909.269]
  - - [6784, 32, 1, 256]
    - [120, 1506.9]
  - - [256, 4288, 1, 1]
    - [134, 74.1708]
  - - [5888, 1408, 1, 1]
    - [132, 210.2]
  - - [1024, 4288, 1, 1280]
    - [71, 14703.7]
  - - [1856, 4288, 1, 1]
    - [126, 188.412]
  - - [128, 2944, 1, 256]
    - [3, 6625.62]
  - - [3584, 4288, 1, 256]
    - [61, 18315.9]
  - - [3584, 128, 1, 32]
    - [105, 960.737]
  - - [3584, 128, 1, 3328]
    - [46, 10537.9]
  - - [4288, 448, 1, 3328]
    - [85, 13386.0]
  - - [1856, 4288, 1, 32]
    - [118, 3354.49]
  - - [64, 256, 1, 1280]
    - [48, 720.176]
  - - [1024, 6000, 1, 2048]
    - [87, 14301.3]
  - - [4288, 1024, 1, 1280]
    - [72, 16851.6]
  - - [1, 4288, 1, 256]
    - [134, 29.3197]
  - - [64, 2368, 1, 1]
    - [150, 11.1435]
  - - [4288, 6784, 1, 32]
    - [108, 4545.27]
  - - [256, 6784, 1, 3328]
    - [87, 13683.1]
  - - [128, 2944, 1, 1]
    - [130, 31.1947]
  - - [3584, 1408, 1, 256]
    - [72, 10200.9]
  - - [704, 3584, 1, 3328]
    - [61, 14535.7]
  - - [5056, 448, 1, 1280]
    - [61, 15069.2]
  - - [1408, 2944, 1, 1280]
    - [86, 16760.8]
  - - [5888, 704, 1, 1280]
    - [72, 16404.2]
  - - [64, 64, 1, 256]
    - [7, 120.25]
  - - [704, 1408, 1, 1280]
    - [39, 13227.5]
  - - [4288, 5888, 1, 256]
    - [86, 17544.6]
  - - [6784, 64, 1, 32]
    - [109, 923.779]
  - - [3584, 3584, 1, 3328]
    - [60, 17873.1]
  - - [2944, 6784, 1, 32]
    - [108, 4493.16]
  - - [448, 64, 1, 32]
    - [109, 53.5925]
  - - [5056, 256, 1, 1]
    - [126, 82.5469]
  - - [64, 6784, 1, 1280]
    - [14, 9425.8]
  - - [2944, 2368, 1, 3328]
    - [61, 17958.3]
  - - [1, 4288, 1, 1]
    - [136, 0.397037]
  - - [1408, 128, 1, 256]
    - [17, 4149.04]
  - - [1024, 1856, 1, 1280]
    - [72, 15296.1]
  - - [5124, 9124, 1, 2560]
    - [74, 18422.3]
  - - [1024, 5888, 1, 256]
    - [75, 16504.5]
  - - [704, 1408, 1, 256]
    - [67, 10538.0]
  - - [6784, 2944, 1, 3328]
    - [75, 19106.7]
  - - [1408, 2368, 1, 256]
    - [72, 14595.4]
  - - [64, 128, 1, 1280]
    - [7, 365.103]
  - - [1024, 8, 1, 500000]
    - [25, 403.108]
  - - [5888, 32, 1, 3328]
    - [120, 1817.32]
  - - [1408, 5056, 1, 256]
    - [61, 16911.9]
  - - [1024, 1408, 1, 32]
    - [115, 1860.38]
  - - [4288, 128, 1, 32]
    - [109, 1108.82]
  - - [6784, 704, 1, 1]
    - [126, 149.998]
  - - [448, 704, 1, 256]
    - [38, 4923.19]
  - - [704, 3584, 1, 32]
    - [114, 2443.72]
  - - [1856, 256, 1, 3328]
    - [52, 9917.54]
  - - [6784, 448, 1, 256]
    - [72, 15101.8]
  - - [4288, 4288, 1, 1]
    - [129, 209.705]
  - - [5056, 2944, 1, 1]
    - [130, 194.624]
  - - [64, 2368, 1, 3328]
    - [41, 5271.37]
  - - [256, 704, 1, 3328]
    - [38, 5784.97]
  - - [1, 2944, 1, 1]
    - [133, 0.262857]
  - - [1024, 1024, 1, 256]
    - [67, 11110.7]
  - - [2560, 64, 1, 2560]
    - [22, 5553.9]
  - - [3584, 1, 1, 1]
    - [144, 0.315493]
  - - [256, 2944, 1, 32]
    - [119, 1449.35]
  - - [6784, 4288, 1, 3328]
    - [66, 15457.3]
  - - [5056, 2944, 1, 3328]
    - [69, 17253.9]
  - - [1760, 128, 1, 1760]
    - [46, 6826.67]
  - - [704, 1024, 1, 1280]
    - [58, 11101.4]
  - - [256, 3584, 1, 1280]
    - [72, 12843.5]
  - - [2368, 1856, 1, 3328]
    - [87, 14792.2]
  - - [1856, 4288, 1, 1280]
    - [61, 18211.7]
  - - [1, 1024, 1, 256]
    - [144, 7.58519]
  - - [3584, 448, 1, 1]
    - [126, 97.9044]
  - - [2944, 1024, 1, 3328]
    - [69, 15872.6]
  - - [32, 1408, 1, 3328]
    - [123, 488.488]
  - - [128, 1, 1, 3328]
    - [144, 1.5824]
  - - [5888, 5056, 1, 32]
    - [108, 4601.18]
  - - [704, 2944, 1, 1]
    - [127, 113.628]
  - - [3584, 448, 1, 1280]
    - [80, 10753.5]
  - - [2944, 6784, 1, 3328]
    - [72, 17654.1]
  - - [1856, 2368, 1, 1280]
    - [61, 17243.8]
  - - [6784, 1024, 1, 1280]
    - [87, 16493.4]
  - - [512, 16, 1, 500000]
    - [25, 403.165]
  - - [6784, 3584, 1, 1280]
    - [65, 18858.9]
  - - [1, 5056, 1, 3328]
    - [144, 43.9927]
  - - [448, 1856, 1, 1]
    - [133, 56.487]
  - - [128, 2368, 1, 32]
    - [102, 624.957]
  - - [128, 1408, 1, 3328]
    - [42, 6090.43]
  - - [704, 1856, 1, 256]
    - [67, 11778.0]
  - - [448, 2368, 1, 1]
    - [140, 61.1097]
  - - [1408, 4288, 1, 256]
    - [75, 16484.7]
  - - [7680, 24000, 1, 2560]
    - [86, 15474.3]
  - - [256, 5056, 1, 3328]
    - [59, 12627.6]
  - - [2368, 64, 1, 1280]
    - [12, 4958.76]
  - - [1856, 448, 1, 32]
    - [113, 1484.8]
  - - [512, 1, 1, 512]
    - [7, 19.0512]
  - - [32, 128, 1, 256]
    - [119, 30.2707]
  - - [448, 1024, 1, 1]
    - [133, 32.3977]
  - - [128, 1024, 1, 1280]
    - [23, 4981.36]
  - - [512, 3000, 1, 2560]
    - [64, 12880.5]
  - - [704, 2944, 1, 256]
    - [69, 8557.73]
  - - [1408, 1408, 1, 256]
    - [61, 11032.8]
  - - [3072, 1, 1, 128]
    - [0, 59.9415]
  - - [448, 6784, 1, 32]
    - [102, 2486.08]
  - - [5124, 9124, 1, 1760]
    - [61, 19606.0]
  - - [1, 64, 1, 1280]
    - [142, 0.718093]
  - - [448, 2944, 1, 1]
    - [126, 73.93]
  - - [4288, 448, 1, 32]
    - [119, 2076.78]
  - - [4288, 448, 1, 1280]
    - [40, 14777.1]
  - - [2944, 704, 1, 32]
    - [105, 2302.86]
  - - [5888, 448, 1, 1280]
    - [61, 14824.4]
  - - [448, 4288, 1, 1]
    - [132, 99.6382]
  - - [3584, 5056, 1, 1]
    - [129, 216.962]
  - - [64, 5888, 1, 1]
    - [134, 30.587]
  - - [1408, 3584, 1, 1280]
    - [65, 17048.2]
  - - [6784, 448, 1, 1280]
    - [61, 14930.2]
  - - [3584, 5056, 1, 3328]
    - [86, 16763.1]
  - - [2368, 2368, 1, 32]
    - [108, 3308.21]
  - - [64, 5888, 1, 32]
    - [119, 735.282]
  - - [1856, 448, 1, 256]
    - [61, 9143.51]
  - - [3584, 2368, 1, 1280]
    - [60, 15566.9]
  - - [128, 1024, 1, 256]
    - [17, 3437.95]
  - - [3584, 64, 1, 3328]
    - [50, 7414.17]
  - - [5888, 2944, 1, 32]
    - [108, 4396.77]
  - - [128, 1, 1, 1024]
    - [7, 5.44319]
  - - [1856, 2944, 1, 32]
    - [112, 2977.69]
  - - [5056, 1408, 1, 1]
    - [139, 170.47]
  - - [5888, 1408, 1, 3328]
    - [74, 15418.3]
  - - [448, 4288, 1, 256]
    - [40, 11936.5]
  - - [6784, 1024, 1, 1]
    - [132, 185.15]
  - - [256, 448, 1, 1]
    - [130, 9.68649]
  - - [128, 5888, 1, 3328]
    - [5, 13020.1]
  - - [6784, 1024, 1, 32]
    - [112, 3539.78]
  - - [256, 448, 1, 32]
    - [104, 221.619]
  - - [6784, 3584, 1, 1]
    - [132, 272.822]
  - - [2944, 2368, 1, 32]
    - [109, 3276.8]
  - - [3584, 6784, 1, 3328]
    - [60, 15165.4]
  - - [5056, 1024, 1, 1]
    - [132, 175.384]
  - - [448, 128, 1, 1280]
    - [7, 2408.15]
  - - [64, 3584, 1, 32]
    - [120, 365.539]
  - - [64, 3584, 1, 1280]
    - [13, 6612.64]
  - - [6784, 1408, 1, 256]
    - [61, 17647.8]
  - - [5056, 1024, 1, 32]
    - [119, 2962.71]
  - - [256, 704, 1, 1280]
    - [67, 5167.71]
  - - [4288, 3584, 1, 256]
    - [75, 18040.4]
  - - [4608, 48000, 1, 1536]
    - [60, 16591.4]
  - - [2368, 256, 1, 32]
    - [102, 1049.71]
  - - [2368, 256, 1, 3328]
    - [52, 8980.84]
  - - [448, 6784, 1, 1280]
    - [69, 15153.5]
  - - [1856, 5888, 1, 1]
    - [133, 206.972]
  - - [256, 5888, 1, 32]
    - [108, 2100.81]
  - - [3584, 1, 1, 3328]
    - [142, 44.3865]
  - - [4288, 32, 1, 256]
    - [117, 899.777]
  - - [256, 64, 1, 1]
    - [143, 1.32987]
  - - [4288, 5056, 1, 32]
    - [112, 4435.82]
  - - [4288, 5056, 1, 3328]
    - [75, 18533.0]
  - - [1856, 5888, 1, 32]
    - [112, 3447.36]
  - - [1856, 5888, 1, 1280]
    - [75, 18524.2]
  - - [256, 256, 1, 1280]
    - [23, 2744.96]
  - - [704, 2368, 1, 1280]
    - [77, 12246.6]
  - - [5056, 32, 1, 1280]
    - [120, 1465.84]
  - - [4288, 2368, 1, 1280]
    - [71, 17622.7]
  - - [2944, 5056, 1, 256]
    - [86, 15893.0]
  - - [512, 8, 1, 500000]
    - [21, 211.82]
  - - [32, 1856, 1, 256]
    - [114, 475.136]
  - - [64, 5888, 1, 1280]
    - [43, 8576.55]
  - - [1, 1856, 1, 1280]
    - [142, 20.6653]
  - - [2944, 4288, 1, 1]
    - [136, 220.697]
  - - [5056, 5888, 1, 32]
    - [108, 4377.9]
  - - [704, 1, 1, 3328]
    - [146, 8.66718]
  - - [448, 256, 1, 1280]
    - [17, 4389.97]
  - - [1408, 256, 1, 1]
    - [134, 30.4432]
  - - [2368, 5056, 1, 3328]
    - [86, 15704.2]
  - - [1024, 5056, 1, 3328]
    - [86, 15536.1]
  - - [704, 704, 1, 1280]
    - [58, 9623.61]
  - - [128, 32, 1, 3328]
    - [120, 53.3647]
  - - [1024, 6784, 1, 32]
    - [116, 3296.24]
  - - [3072, 64, 1, 1024]
    - [42, 5963.47]
  - - [3584, 2944, 1, 3328]
    - [85, 14910.4]
  - - [128, 1856, 1, 256]
    - [42, 4904.63]
  - - [32, 32, 1, 1280]
    - [114, 12.0382]
  - - [1408, 5888, 1, 1]
    - [132, 217.708]
  - - [1, 3584, 1, 256]
    - [142, 26.6097]
  - - [704, 4288, 1, 32]
    - [114, 2642.23]
  - - [1408, 5888, 1, 32]
    - [112, 3542.87]
  - - [6784, 1024, 1, 3328]
    - [65, 17305.6]
  - - [6784, 2368, 1, 1]
    - [132, 241.064]
  - - [1856, 1, 1, 3328]
    - [147, 17.6924]
  - - [5056, 1408, 1, 256]
    - [75, 16974.9]
  - - [176, 1500, 1, 1408]
    - [30, 6042.13]
  - - [1, 1, 1, 256]
    - [146, 0.00712695]
  - - [2944, 1408, 1, 256]
    - [61, 16498.1]
  - - [4288, 1, 1, 1]
    - [140, 0.391241]
  - - [4608, 2, 1, 1536]
    - [54, 402.153]
  - - [2368, 2368, 1, 256]
    - [86, 14297.8]
  - - [1, 448, 1, 256]
    - [143, 2.96812]
  - - [1408, 6784, 1, 1]
    - [126, 189.221]
  - - [3584, 32, 1, 3328]
    - [123, 1274.31]
  - - [1856, 1, 1, 256]
    - [145, 12.4251]
  - - [6784, 6784, 1, 1280]
    - [75, 18250.2]
  - - [128, 128, 1, 1]
    - [142, 1.14413]
  - - [6784, 32, 1, 3328]
    - [122, 1937.53]
  - - [1408, 32, 1, 256]
    - [114, 317.575]
  - - [128, 3584, 1, 32]
    - [107, 955.733]
  - - [1856, 3584, 1, 256]
    - [72, 15605.6]
  - - [1024, 704, 1, 256]
    - [58, 9190.71]
  - - [2368, 704, 1, 32]
    - [108, 2193.52]
  - - [256, 5888, 1, 1280]
    - [61, 14914.8]
  - - [448, 2368, 1, 32]
    - [105, 1531.93]
  - - [448, 2368, 1, 3328]
    - [67, 11519.7]
  - - [64, 1408, 1, 256]
    - [12, 2464.6]
  - - [5056, 32, 1, 32]
    - [102, 359.538]
  - - [1024, 704, 1, 3328]
    - [67, 12171.0]
  - - [32, 5888, 1, 3328]
    - [120, 1794.44]
  - - [256, 64, 1, 3328]
    - [48, 801.852]
  - - [32, 1408, 1, 1280]
    - [120, 528.129]
  - - [64, 32, 1, 256]
    - [107, 13.4571]
  - - [1856, 1024, 1, 3328]
    - [84, 12780.9]
  - - [6144, 3000, 1, 2560]
    - [70, 16245.9]
  - - [2368, 1, 1, 1]
    - [145, 0.216058]
  - - [5056, 2368, 1, 3328]
    - [61, 15671.6]
  - - [512, 1500, 1, 2560]
    - [72, 11206.6]
  - - [128, 1, 1, 1280]
    - [150, 1.28967]
  - - [704, 4288, 1, 1280]
    - [69, 15570.6]
  - - [704, 256, 1, 256]
    - [38, 3151.46]
  - - [1024, 48000, 1, 2048]
    - [71, 18354.7]
- null
