library/src/blas3/Tensile/Logic/asm_full/vega10_Cijk_Ailk_Bljk_DB.yaml
- {MinimumRequiredVersion: 4.5.0}
- vega10
- gfx900
- [Device 6863, Device 6862, Device 687f, Device 6860, Device 6861, 'Vega 10 XTX [Radeon
    SolutionIndex: 0
    SolutionNameMin: Cijk_Ailk_Bljk_DB_MT064x064x08_NLCA01_PBC0_TT04_04_USFGRO00_WG16_16_01
    SolutionIndex: 1
    SolutionNameMin: Cijk_Ailk_Bljk_DB_MT064x064x04_NLCA01_PBC1_TT04_04_USFGRO01_WG16_16_01
    SolutionIndex: 2
    SolutionNameMin: Cijk_Ailk_Bljk_DB_MT064x032x08_NLCA01_PBC0_TT04_04_USFGRO00_WG16_08_01
- - - [12324, 12324, 1, 384]
    - [2, 768.487]
  - - [14372, 14372, 1, 384]
    - [0, 767.901]
  - - [3108, 3108, 1, 384]
    - [0, 768.175]
  - - [4132, 4132, 1, 384]
    - [0, 762.961]
  - - [5156, 5156, 1, 384]
    - [0, 769.678]
  - - [7204, 7204, 1, 384]
    - [0, 768.352]
  - - [15396, 15396, 1, 384]
    - [0, 763.981]
  - - [10276, 10276, 1, 384]
    - [0, 767.391]
  - - [9252, 9252, 1, 384]
    - [0, 767.587]
  - - [8228, 8228, 1, 384]
    - [0, 767.8]
  - - [11300, 11300, 1, 384]
    - [0, 768.354]
  - - [1060, 1060, 1, 384]
    - [0, 666.689]
  - - [2084, 2084, 1, 384]
    - [0, 738.659]
  - - [13348, 13348, 1, 384]
    - [0, 770.271]
  - - [6180, 6180, 1, 384]
    - [0, 767.203]
  - - [36, 36, 1, 384]
    - [2, 3.47374]
- - - -1
    - - - -1
        - - - 1
            - - [-1, 1]
          - - -1
            - - [1, 1]
              - [-1, 0]
