library/src/blas3/Tensile/Logic/asm_full/vega20_Cijk_Ailk_Bljk_DB.yaml
- {MinimumRequiredVersion: 4.2.0}
- vega20
- gfx906
- [Device 66a0, Device 66a7]
    SolutionIndex: 0
    SolutionNameMin: Cijk_Ailk_Bljk_DB_MT064x064x08_NLCA01_PBC0_TT04_04_USFGRO00_WG16_16_01
    SolutionIndex: 1
    SolutionNameMin: Cijk_Ailk_Bljk_DB_MT064x064x04_NLCA01_PBC0_TT04_04_USFGRO00_WG16_16_01
    SolutionIndex: 2
    SolutionNameMin: Cijk_Ailk_Bljk_DB_MT096x032x08_NLCA03_PBC0_TT06_04_USFGRO00_WG16_08_01
    SolutionIndex: 3
    SolutionNameMin: Cijk_Ailk_Bljk_DB_MT064x064x08_NLCA01_PBC0_TT04_04_USFGRO00_WG16_16_01
    SolutionIndex: 4
    SolutionNameMin: Cijk_Ailk_Bljk_DB_MT064x032x08_NLCA01_PBC0_TT04_04_USFGRO00_WG16_08_01
    SolutionIndex: 5
    SolutionNameMin: Cijk_Ailk_Bljk_DB_MT096x032x08_NLCA03_PBC0_TT06_04_USFGRO00_WG16_08_01
- - - [39972, 39972, 1, 384]
    - [2, 3764.45]
  - - [11300, 11300, 1, 384]
    - [3, 4042.05]
  - - [1024, 1024, 1, 384]
    - [3, 3269.31]
  - - [32804, 32804, 1, 384]
    - [2, 3770.11]
  - - [22528, 22528, 1, 384]
    - [2, 3765.5]
  - - [58404, 58404, 1, 384]
    - [2, 3770.24]
  - - [48164, 48164, 1, 384]
    - [2, 3766.14]
  - - [37888, 37888, 1, 384]
    - [2, 3770.11]
  - - [2048, 2048, 1, 384]
    - [3, 3700.13]
  - - [11264, 11264, 1, 384]
    - [3, 4023.18]
  - - [7204, 7204, 1, 384]
    - [3, 4027.57]
  - - [52260, 52260, 1, 384]
    - [2, 3758.26]
  - - [38912, 38912, 1, 384]
    - [2, 3764.14]
  - - [24576, 24576, 1, 384]
    - [2, 3681.77]
  - - [23552, 23552, 1, 384]
    - [2, 3765.87]
  - - [24612, 24612, 1, 384]
    - [2, 3769.4]
  - - [17444, 17444, 1, 384]
    - [2, 3769.86]
  - - [62500, 62500, 1, 384]
    - [2, 3771.24]
  - - [29696, 29696, 1, 384]
    - [2, 3773.74]
  - - [22564, 22564, 1, 384]
    - [2, 3745.37]
  - - [12288, 12288, 1, 384]
    - [5, 3947.04]
  - - [31744, 31744, 1, 384]
    - [2, 3773.59]
  - - [25600, 25600, 1, 384]
    - [2, 3773.11]
  - - [18468, 18468, 1, 384]
    - [2, 3768.61]
  - - [39936, 39936, 1, 384]
    - [2, 3773.86]
  - - [33828, 33828, 1, 384]
    - [2, 3780.94]
  - - [14372, 14372, 1, 384]
    - [3, 4050.1]
  - - [3072, 3072, 1, 384]
    - [3, 3895.42]
  - - [4132, 4132, 1, 384]
    - [3, 3960.15]
  - - [59428, 59428, 1, 384]
    - [2, 3775.71]
  - - [40996, 40996, 1, 384]
    - [2, 3730.81]
  - - [35840, 35840, 1, 384]
    - [2, 3767.19]
  - - [25636, 25636, 1, 384]
    - [2, 3765.46]
  - - [61476, 61476, 1, 384]
    - [2, 3763.33]
  - - [43044, 43044, 1, 384]
    - [2, 3784.23]
  - - [13348, 13348, 1, 384]
    - [3, 4049.84]
  - - [19492, 19492, 1, 384]
    - [2, 3760.42]
  - - [21504, 21504, 1, 384]
    - [2, 3758.24]
  - - [15396, 15396, 1, 384]
    - [3, 4055.24]
  - - [26624, 26624, 1, 384]
    - [2, 3764.05]
  - - [27648, 27648, 1, 384]
    - [2, 3765.66]
  - - [23588, 23588, 1, 384]
    - [2, 3767.33]
  - - [35876, 35876, 1, 384]
    - [2, 3775.24]
  - - [14336, 14336, 1, 384]
    - [3, 3996.24]
  - - [42020, 42020, 1, 384]
    - [2, 3787.55]
  - - [4096, 4096, 1, 384]
    - [3, 3888.62]
  - - [40960, 40960, 1, 384]
    - [2, 3659.51]
  - - [12324, 12324, 1, 384]
    - [3, 4049.1]
  - - [5156, 5156, 1, 384]
    - [3, 3979.82]
  - - [16384, 16384, 1, 384]
    - [2, 3495.21]
  - - [6180, 6180, 1, 384]
    - [3, 4021.48]
  - - [15360, 15360, 1, 384]
    - [3, 4029.3]
  - - [8228, 8228, 1, 384]
    - [3, 4035.79]
  - - [13312, 13312, 1, 384]
    - [3, 4027.53]
  - - [55332, 55332, 1, 384]
    - [2, 3761.88]
  - - [21540, 21540, 1, 384]
    - [2, 3768.13]
  - - [28708, 28708, 1, 384]
    - [2, 3780.2]
  - - [10276, 10276, 1, 384]
    - [3, 4040.45]
  - - [28672, 28672, 1, 384]
    - [2, 3776.19]
  - - [32768, 32768, 1, 384]
    - [2, 3373.52]
  - - [7168, 7168, 1, 384]
    - [3, 4004.83]
  - - [56356, 56356, 1, 384]
    - [2, 3773.91]
  - - [41984, 41984, 1, 384]
    - [2, 3767.28]
  - - [36900, 36900, 1, 384]
    - [2, 3786.78]
  - - [44068, 44068, 1, 384]
    - [2, 3770.71]
  - - [29732, 29732, 1, 384]
    - [2, 3790.39]
  - - [34852, 34852, 1, 384]
    - [2, 3759.88]
  - - [17408, 17408, 1, 384]
    - [2, 3764.19]
  - - [36, 36, 1, 384]
    - [4, 14.5174]
  - - [9252, 9252, 1, 384]
    - [3, 4035.95]
  - - [45092, 45092, 1, 384]
    - [2, 3764.07]
  - - [5120, 5120, 1, 384]
    - [3, 3982.89]
  - - [30720, 30720, 1, 384]
    - [2, 3789.06]
  - - [18432, 18432, 1, 384]
    - [2, 3769.53]
  - - [46116, 46116, 1, 384]
    - [2, 3760.82]
  - - [8192, 8192, 1, 384]
    - [5, 3823.04]
  - - [53284, 53284, 1, 384]
    - [2, 3759.31]
  - - [49188, 49188, 1, 384]
    - [2, 3774.58]
  - - [6144, 6144, 1, 384]
    - [3, 3983.94]
  - - [3108, 3108, 1, 384]
    - [3, 3926.97]
  - - [54308, 54308, 1, 384]
    - [2, 3764.87]
  - - [20480, 20480, 1, 384]
    - [2, 3768.67]
  - - [10240, 10240, 1, 384]
    - [3, 3993.28]
  - - [33792, 33792, 1, 384]
    - [2, 3755.08]
  - - [36864, 36864, 1, 384]
    - [2, 3770.04]
  - - [1060, 1060, 1, 384]
    - [3, 3246.96]
  - - [30756, 30756, 1, 384]
    - [2, 3785.23]
  - - [37924, 37924, 1, 384]
    - [2, 3756.32]
  - - [19456, 19456, 1, 384]
    - [2, 3757.82]
  - - [34816, 34816, 1, 384]
    - [2, 3765.97]
  - - [20516, 20516, 1, 384]
    - [2, 3771.77]
  - - [9216, 9216, 1, 384]
    - [3, 4018.08]
  - - [2084, 2084, 1, 384]
    - [3, 3689.95]
  - - [57380, 57380, 1, 384]
    - [2, 3777.0]
  - - [26660, 26660, 1, 384]
    - [2, 3747.57]
  - - [50212, 50212, 1, 384]
    - [2, 3753.58]
  - - [27684, 27684, 1, 384]
    - [2, 3767.96]
  - - [38948, 38948, 1, 384]
    - [2, 3775.69]
  - - [31780, 31780, 1, 384]
    - [2, 3768.78]
  - - [51236, 51236, 1, 384]
    - [2, 3780.57]
  - - [60452, 60452, 1, 384]
    - [2, 3773.49]
  - - [47140, 47140, 1, 384]
    - [2, 3761.16]
  - - [16420, 16420, 1, 384]
    - [2, 3737.65]
- - - -1
    - - - -1
        - - - 1
            - - [-1, 1]
          - - -1
            - - [1, 1]
              - [-1, 0]
