library/src/blas3/Tensile/Logic/asm_full/vega20_Cijk_Ailk_Bljk_HB.yaml
- {MinimumRequiredVersion: 4.4.0}
- vega20
- gfx906
- [Device 66a0, Device 66a7]
    SolutionIndex: 0
    SolutionNameMin: Cijk_Ailk_Bljk_HB_MT016x016x08_PGR1_PLR1_TT02_02
    SolutionIndex: 1
    SolutionNameMin: Cijk_Ailk_Bljk_HB_MT256x064x08_PGR1_PLR1_TT08_08
    SolutionIndex: 2
    SolutionNameMin: Cijk_Ailk_Bljk_HB_MT016x016x16_PGR1_PLR1_TT02_02
    SolutionIndex: 3
    SolutionNameMin: Cijk_Ailk_Bljk_HB_MT032x008x16_PGR1_PLR1_TT02_02
    SolutionIndex: 4
    SolutionNameMin: Cijk_Ailk_Bljk_HB_MT064x016x16_PGR1_PLR1_TT04_04
    SolutionIndex: 5
    SolutionNameMin: Cijk_Ailk_Bljk_HB_MT032x016x16_PGR1_PLR1_TT02_02
    SolutionIndex: 6
    SolutionNameMin: Cijk_Ailk_Bljk_HB_MT064x016x16_PGR1_PLR1_TT04_02
    SolutionIndex: 7
    SolutionNameMin: Cijk_Ailk_Bljk_HB_MT064x032x16_PGR1_PLR1_TT04_04
    SolutionIndex: 8
    SolutionNameMin: Cijk_Ailk_Bljk_HB_MT064x064x16_PGR1_PLR1_TT04_04
    SolutionIndex: 9
    SolutionNameMin: Cijk_Ailk_Bljk_HB_MT128x128x16_PGR1_PLR1_TT08_08
    SolutionIndex: 10
    SolutionNameMin: Cijk_Ailk_Bljk_HB_MT032x008x32_PGR1_PLR1_TT02_02
    SolutionIndex: 11
    SolutionNameMin: Cijk_Ailk_Bljk_HB_MT032x016x32_PGR1_PLR1_TT02_02
    SolutionIndex: 12
    SolutionNameMin: Cijk_Ailk_Bljk_HB_MT064x008x32_PGR1_PLR1_TT02_02
    SolutionIndex: 13
    SolutionNameMin: Cijk_Ailk_Bljk_HB_MT064x016x32_PGR1_PLR1_TT02_02
    SolutionIndex: 14
    SolutionNameMin: Cijk_Ailk_Bljk_HB_MT064x032x16_PGR1_PLR1_TT08_04
    SolutionIndex: 15
    SolutionNameMin: Cijk_Ailk_Bljk_HB_MT032x016x16_PGR1_PLR1_TT02_02
    SolutionIndex: 16
    SolutionNameMin: Cijk_Ailk_Bljk_HB_MT064x016x16_PGR1_PLR1_TT04_02
    SolutionIndex: 17
    SolutionNameMin: Cijk_Ailk_Bljk_HB_MT064x032x16_PGR1_PLR1_TT04_04
    SolutionIndex: 18
    SolutionNameMin: Cijk_Ailk_Bljk_HB_MT064x016x16_PGR1_PLR1_TT04_04
    SolutionIndex: 19
    SolutionNameMin: Cijk_Ailk_Bljk_HB_MT016x016x24_PGR1_PLR1_TT02_02
    SolutionIndex: 20
    SolutionNameMin: Cijk_Ailk_Bljk_HB_MT032x032x24_PGR1_PLR1_TT04_04
    SolutionIndex: 21
    SolutionNameMin: Cijk_Ailk_Bljk_HB_MT016x016x24_PGR1_PLR1_TT02_02
    SolutionIndex: 22
    SolutionNameMin: Cijk_Ailk_Bljk_HB_MT064x016x32_PGR1_PLR1_TT02_02
    SolutionIndex: 23
    SolutionNameMin: Cijk_Ailk_Bljk_HB_MT032x008x32_PGR1_PLR1_TT02_02
    SolutionIndex: 24
    SolutionNameMin: Cijk_Ailk_Bljk_HB_MT064x008x32_PGR1_PLR1_TT02_02
    SolutionIndex: 25
    SolutionNameMin: Cijk_Ailk_Bljk_HB_MT128x064x08_PGR1_PLR1_TT08_04
    SolutionIndex: 26
    SolutionNameMin: Cijk_Ailk_Bljk_HB_MT064x064x16_PGR0_PLR1_TT08_08
    SolutionIndex: 27
    SolutionNameMin: Cijk_Ailk_Bljk_HB_MT064x064x16_PGR1_PLR1_TT04_04
    SolutionIndex: 28
    SolutionNameMin: Cijk_Ailk_Bljk_HB_MT128x064x16_PGR1_PLR1_TT08_04
    SolutionIndex: 29
    SolutionNameMin: Cijk_Ailk_Bljk_HB_MT128x128x16_PGR1_PLR1_TT08_08
    SolutionIndex: 30
    SolutionNameMin: Cijk_Ailk_Bljk_HB_MT128x064x32_PGR0_PLR1_TT08_04
    SolutionIndex: 31
    SolutionNameMin: Cijk_Ailk_Bljk_HB_MT128x064x32_PGR1_PLR1_TT08_04
    SolutionIndex: 32
    SolutionNameMin: Cijk_Ailk_Bljk_HB_MT128x128x32_PGR0_PLR1_TT08_08
    SolutionIndex: 33
    SolutionNameMin: Cijk_Ailk_Bljk_HB_MT128x128x32_PGR1_PLR1_TT08_08
    SolutionIndex: 34
    SolutionNameMin: Cijk_Ailk_Bljk_HB_MT128x064x16_PGR1_PLR1_TT04_08
    SolutionIndex: 35
    SolutionNameMin: Cijk_Ailk_Bljk_HB_MT256x064x16_PGR1_PLR1_TT08_04
    SolutionIndex: 36
    SolutionNameMin: Cijk_Ailk_Bljk_HB_MT064x128x16_PGR1_PLR1_TT04_08
    SolutionIndex: 37
    SolutionNameMin: Cijk_Ailk_Bljk_HB_MT128x064x16_PGR1_PLR1_TT08_04
    SolutionIndex: 38
    SolutionNameMin: Cijk_Ailk_Bljk_HB_MT128x064x16_PGR1_PLR1_TT04_08
    SolutionIndex: 39
    SolutionNameMin: Cijk_Ailk_Bljk_HB_MT128x064x32_PGR1_PLR1_TT04_04
    SolutionIndex: 40
    SolutionNameMin: Cijk_Ailk_Bljk_HB_MT064x128x16_PGR0_PLR0_TT04_08
    SolutionIndex: 41
    SolutionNameMin: Cijk_Ailk_Bljk_HB_MT128x064x16_PGR0_PLR0_TT08_04
    SolutionIndex: 42
    SolutionNameMin: Cijk_Ailk_Bljk_HB_MT256x032x16_PGR0_PLR0_TT08_04
    SolutionIndex: 43
    SolutionNameMin: Cijk_Ailk_Bljk_HB_MT064x128x08_PGR0_PLR0_TT04_08
    SolutionIndex: 44
    SolutionNameMin: Cijk_Ailk_Bljk_HB_MT064x064x08_PGR1_PLR1_TT04_04
    SolutionIndex: 45
    SolutionNameMin: Cijk_Ailk_Bljk_HB_MT064x128x04_PGR0_PLR1_TT04_08
    SolutionIndex: 46
    SolutionNameMin: Cijk_Ailk_Bljk_HB_MT064x064x08_PGR1_PLR1_TT04_04
    SolutionIndex: 0
    SolutionNameMin: Cijk_Ailk_Bljk_HB_MT128x128x16_DTL0_GRVW08_GSU01_LPB00_PGR1_PLR1_TT08_08_VW08_WG16_16_01_WGM01
    SolutionIndex: 1
    SolutionNameMin: Cijk_Ailk_Bljk_HB_MT128x128x16_DTL0_GRVW08_GSU01_LPB00_PGR1_PLR1_TT08_08_VW08_WG16_16_01_WGM08
    SolutionIndex: 2
    SolutionNameMin: Cijk_Ailk_Bljk_HB_MT128x032x16_DTL0_GRVW08_GSU01_LPB04_PGR1_PLR1_TT08_04_VW04_WG16_08_02_WGM64
    SolutionIndex: 3
    SolutionNameMin: Cijk_Ailk_Bljk_HB_MT128x064x16_DTL0_GRVW08_GSU01_LPB04_PGR1_PLR1_TT08_04_VW04_WG16_16_01_WGM01
    SolutionIndex: 4
    SolutionNameMin: Cijk_Ailk_Bljk_HB_MT128x064x16_DTL0_GRVW08_GSU01_LPB04_PGR1_PLR1_TT08_04_VW04_WG16_16_01_WGM08
    SolutionIndex: 5
    SolutionNameMin: Cijk_Ailk_Bljk_HB_MT128x064x32_DTL0_GRVW08_GSU05_LPB04_PGR0_PLR1_TT08_04_VW04_WG16_16_01_WGM08
    SolutionIndex: 6
    SolutionNameMin: Cijk_Ailk_Bljk_HB_MT064x128x16_DTL0_GRVW08_GSU01_LPB00_PGR0_PLR1_TT08_04_VW04_WG08_32_01_WGM01
    SolutionIndex: 7
    SolutionNameMin: Cijk_Ailk_Bljk_HB_MT256x064x08_DTL0_GRVW08_GSU01_LPB08_PGR1_PLR1_TT08_08_VW08_WG32_08_01_WGM01
    SolutionIndex: 8
    SolutionNameMin: Cijk_Ailk_Bljk_HB_MT064x128x16_DTL0_GRVW08_GSU01_LPB04_PGR0_PLR0_TT08_04_VW04_WG08_32_01_WGM01
    SolutionIndex: 9
    SolutionNameMin: Cijk_Ailk_Bljk_HB_MT128x064x16_DTL0_GRVW08_GSU01_LPB04_PGR0_PLR1_TT08_04_VW04_WG16_16_01_WGM01
- - - [4096, 7000, 1, 4096]
    - [29, 17757.6]
  - - [5124, 9124, 1, 1760]
    - [26, 18131.0]
  - - [1760, 32, 1, 1760]
    - [19, 2419.97]
  - - [1024, 1500, 1, 1536]
    - [28, 14723.3]
  - - [512, 24000, 1, 2048]
    - [32, 15966.3]
  - - [3072, 24000, 1, 1024]
    - [29, 18557.1]
  - - [1024, 3000, 1, 2560]
    - [29, 16568.8]
  - - [512, 3136, 1, 2048]
    - [35, 12233.2]
  - - [7680, 4, 1, 2560]
    - [10, 1355.89]
  - - [64, 193600, 1, 64]
    - [8, 13111.3]
  - - [8448, 1500, 1, 2816]
    - [25, 17596.3]
  - - [2560, 7000, 1, 2560]
    - [29, 17884.5]
  - - [3072, 16, 1, 1024]
    - [10, 1906.47]
  - - [512, 48000, 1, 2048]
    - [32, 16872.4]
  - - [1760, 64, 1, 1760]
    - [22, 4250.47]
  - - [1024, 16, 1, 512]
    - [12, 616.809]
  - - [196, 256, 64, 1024]
    - [42, 10709.7]
  - - [512, 48000, 1, 1536]
    - [29, 18451.2]
  - - [2560, 32, 1, 2560]
    - [21, 3289.08]
  - - [4608, 1500, 1, 1536]
    - [29, 16881.9]
  - - [2048, 128, 1, 2048]
    - [18, 7557.2]
  - - [1024, 24000, 1, 2560]
    - [29, 18477.1]
  - - [4608, 3000, 1, 1536]
    - [29, 17496.2]
  - - [5124, 9124, 1, 2048]
    - [28, 17005.1]
  - - [2048, 16, 1, 2048]
    - [24, 1458.87]
  - - [1024, 700, 1, 512]
    - [27, 9577.16]
  - - [3072, 1, 1, 128]
    - [0, 55.8506]
  - - [5124, 700, 1, 2560]
    - [29, 14958.4]
  - - [8448, 16, 1, 2816]
    - [12, 4389.14]
  - - [6144, 6000, 1, 2560]
    - [29, 18527.3]
  - - [4608, 32, 1, 1536]
    - [5, 4664.13]
  - - [3072, 64, 1, 1024]
    - [16, 5732.45]
  - - [512, 16, 1, 512]
    - [11, 312.076]
  - - [7680, 2, 1, 2560]
    - [12, 677.013]
  - - [4224, 1, 1, 128]
    - [0, 76.7945]
  - - [7680, 1, 1, 2560]
    - [10, 338.507]
  - - [128, 1500, 1, 1280]
    - [16, 5829.15]
  - - [1024, 1500, 1, 2816]
    - [28, 14997.6]
  - - [6144, 2, 1, 2560]
    - [10, 537.906]
  - - [8448, 48000, 1, 2816]
    - [29, 19239.9]
  - - [512, 6000, 1, 2048]
    - [30, 12822.8]
  - - [4224, 1500, 1, 176]
    - [25, 14750.3]
  - - [1024, 6000, 1, 2816]
    - [29, 17657.2]
  - - [1024, 48000, 1, 1536]
    - [29, 18960.2]
  - - [1024, 48000, 1, 2560]
    - [29, 19035.2]
  - - [4096, 32, 1, 4096]
    - [22, 5158.18]
  - - [512, 16, 1, 500000]
    - [10, 421.473]
  - - [2560, 128, 1, 2560]
    - [7, 7505.78]
  - - [4608, 24000, 1, 1536]
    - [29, 19042.2]
  - - [512, 2, 1, 500000]
    - [10, 52.6841]
  - - [7680, 48000, 1, 2560]
    - [29, 19220.9]
  - - [3072, 48000, 1, 1024]
    - [29, 18897.3]
  - - [1760, 16, 1, 1760]
    - [10, 1241.51]
  - - [1024, 1500, 1, 2048]
    - [30, 11054.5]
  - - [1024, 16, 1, 500000]
    - [10, 842.932]
  - - [64, 193600, 1, 256]
    - [36, 15708.7]
  - - [1024, 3000, 1, 2048]
    - [30, 12826.9]
  - - [6144, 4, 1, 2560]
    - [10, 1086.22]
  - - [1024, 6000, 1, 2048]
    - [32, 14803.2]
  - - [512, 24000, 1, 2816]
    - [29, 18237.2]
  - - [6144, 48000, 1, 2560]
    - [29, 19165.8]
  - - [1760, 7000, 1, 1760]
    - [25, 17173.7]
  - - [8448, 3000, 1, 2816]
    - [29, 18328.0]
  - - [3072, 4, 1, 1024]
    - [10, 499.312]
  - - [4608, 48000, 1, 1536]
    - [29, 19175.4]
  - - [2048, 32, 1, 2048]
    - [13, 2727.97]
  - - [7680, 1500, 1, 2560]
    - [28, 17107.6]
  - - [4096, 128, 1, 4096]
    - [14, 10741.6]
  - - [4608, 16, 1, 1536]
    - [12, 2859.72]
  - - [512, 3000, 1, 1536]
    - [28, 14738.0]
  - - [3072, 2, 1, 1024]
    - [10, 248.866]
  - - [8448, 1, 1, 2816]
    - [12, 349.839]
  - - [1024, 3000, 1, 2816]
    - [29, 16592.4]
  - - [128, 1, 1, 1408]
    - [10, 5.92832]
  - - [64, 1, 1, 1216]
    - [21, 2.62914]
  - - [1024, 2, 1, 512]
    - [12, 78.0161]
  - - [1024, 4, 1, 500000]
    - [10, 210.733]
  - - [6144, 1, 1, 2560]
    - [10, 267.854]
  - - [5124, 9124, 1, 2560]
    - [29, 18123.3]
  - - [512, 48000, 1, 2816]
    - [29, 18530.6]
  - - [512, 3000, 1, 2816]
    - [28, 15060.3]
  - - [1024, 24000, 1, 1536]
    - [29, 18418.1]
  - - [7680, 6000, 1, 2560]
    - [29, 18654.2]
  - - [1760, 128, 1, 1760]
    - [4, 6706.52]
  - - [512, 1500, 1, 2816]
    - [27, 12310.2]
  - - [512, 1, 1, 512]
    - [10, 19.7398]
  - - [512, 6000, 1, 2560]
    - [29, 16568.8]
  - - [512, 8, 1, 500000]
    - [10, 210.742]
  - - [512, 24000, 1, 2560]
    - [29, 18191.5]
  - - [6144, 3000, 1, 2560]
    - [29, 18267.9]
  - - [1024, 24000, 1, 2816]
    - [29, 18513.1]
  - - [2048, 7000, 1, 2048]
    - [32, 16361.8]
  - - [7680, 3000, 1, 2560]
    - [29, 18064.6]
  - - [1024, 4, 1, 512]
    - [12, 157.918]
  - - [5124, 700, 1, 2048]
    - [33, 12974.5]
  - - [5124, 9124, 1, 4096]
    - [29, 17622.4]
  - - [4096, 64, 1, 4096]
    - [18, 8104.81]
  - - [256, 193600, 1, 64]
    - [1, 16520.3]
  - - [7680, 32, 1, 2560]
    - [20, 7426.09]
  - - [2560, 64, 1, 2560]
    - [15, 5311.87]
  - - [3072, 128, 1, 1024]
    - [18, 8065.81]
  - - [8448, 6000, 1, 2816]
    - [29, 18862.8]
  - - [7680, 64, 1, 2560]
    - [17, 10506.6]
  - - [5124, 1500, 1, 2560]
    - [29, 16697.1]
  - - [1024, 1500, 1, 2560]
    - [28, 15008.0]
  - - [512, 4, 1, 512]
    - [10, 79.4376]
  - - [1024, 6000, 1, 2560]
    - [29, 17547.8]
  - - [3072, 32, 1, 1024]
    - [23, 3475.94]
  - - [6144, 32, 1, 2560]
    - [16, 6102.21]
  - - [196, 1024, 64, 256]
    - [41, 12954.2]
  - - [512, 50176, 1, 128]
    - [9, 17234.2]
  - - [4608, 1, 1, 1536]
    - [12, 195.303]
  - - [1024, 32, 1, 512]
    - [13, 1191.56]
  - - [7680, 24000, 1, 2560]
    - [29, 19096.0]
  - - [8448, 4, 1, 2816]
    - [12, 1381.49]
  - - [512, 1, 1, 500000]
    - [10, 26.3429]
  - - [176, 1500, 1, 1408]
    - [6, 5851.8]
  - - [512, 3000, 1, 2560]
    - [28, 14980.6]
  - - [8448, 24000, 1, 2816]
    - [29, 19167.3]
  - - [4608, 2, 1, 1536]
    - [24, 391.471]
  - - [512, 6000, 1, 1536]
    - [29, 16297.7]
  - - [7680, 128, 1, 2560]
    - [28, 13448.9]
  - - [3072, 6000, 1, 1024]
    - [29, 17229.7]
  - - [3072, 1500, 1, 128]
    - [28, 13356.4]
  - - [2048, 3136, 1, 512]
    - [37, 16081.2]
  - - [1024, 3000, 1, 1536]
    - [29, 16266.3]
  - - [512, 4, 1, 500000]
    - [10, 105.37]
  - - [512, 6000, 1, 2816]
    - [29, 16592.4]
  - - [128, 50176, 1, 512]
    - [38, 15937.8]
  - - [256, 12544, 1, 1024]
    - [39, 13642.1]
  - - [1024, 12544, 1, 256]
    - [34, 16977.9]
  - - [512, 48000, 1, 2560]
    - [29, 18505.3]
  - - [2560, 16, 1, 2560]
    - [12, 1828.03]
  - - [2048, 64, 1, 2048]
    - [22, 4884.11]
  - - [512, 2, 1, 512]
    - [12, 39.961]
  - - [1024, 1, 1, 512]
    - [3, 36.8167]
  - - [512, 1500, 1, 2560]
    - [27, 11252.6]
  - - [512, 24000, 1, 1536]
    - [29, 18068.9]
  - - [1024, 1, 1, 500000]
    - [10, 52.6845]
  - - [6144, 16, 1, 2560]
    - [11, 3850.28]
  - - [1024, 24000, 1, 2048]
    - [32, 17013.3]
  - - [4096, 16, 1, 4096]
    - [10, 3003.94]
  - - [512, 32, 1, 512]
    - [13, 613.18]
  - - [5124, 1500, 1, 2048]
    - [32, 14639.8]
  - - [3072, 1500, 1, 1024]
    - [28, 15323.9]
  - - [1024, 2, 1, 500000]
    - [10, 105.368]
  - - [1024, 8, 1, 500000]
    - [10, 421.476]
  - - [7680, 16, 1, 2560]
    - [13, 4783.58]
  - - [6144, 1500, 1, 2560]
    - [29, 17719.6]
  - - [3072, 1, 1, 1024]
    - [10, 123.653]
  - - [1024, 48000, 1, 2816]
    - [29, 19062.4]
  - - [8448, 2, 1, 2816]
    - [12, 705.493]
  - - [4608, 4, 1, 1536]
    - [10, 769.325]
  - - [1024, 6000, 1, 1536]
    - [29, 17319.5]
  - - [8448, 32, 1, 2816]
    - [7, 6231.61]
  - - [512, 3000, 1, 2048]
    - [30, 11054.5]
  - - [6144, 24000, 1, 2560]
    - [29, 19049.0]
  - - [4608, 6000, 1, 1536]
    - [29, 18443.3]
  - - [1024, 1024, 1, 1024]
    - [31, 12223.6]
  - - [512, 1500, 1, 2048]
    - [31, 9304.55]
  - - [512, 1500, 1, 1536]
    - [27, 10685.1]
  - - [128, 1, 1, 1024]
    - [2, 5.35425]
  - - [3072, 3000, 1, 1024]
    - [28, 16530.7]
  - - [1024, 48000, 1, 2048]
    - [32, 17675.1]
  - - [3136, 64, 128, 64]
    - [54, 14524.3]
  - - [784, 512, 64, 128]
    - [53, 15406.1]
  - - [3136, 256, 64, 64]
    - [47, 15900.8]
  - - [784, 128, 128, 512]
    - [47, 15815.2]
  - - [784, 128, 64, 512]
    - [48, 15050.8]
  - - [3136, 512, 1, 2048]
    - [52, 14833.5]
  - - [12544, 256, 1, 1024]
    - [49, 15072.8]
  - - [3136, 64, 128, 256]
    - [56, 17266.8]
  - - [3136, 64, 64, 256]
    - [50, 16825.1]
  - - [3136, 2048, 1, 512]
    - [51, 16285.1]
  - - [784, 512, 128, 128]
    - [55, 15812.1]
  - - [3136, 64, 64, 64]
    - [54, 13432.6]
  - - [12544, 1024, 1, 256]
    - [50, 16901.1]
  - - [3136, 256, 128, 64]
    - [47, 16310.9]
- - - -1
    - - - 1
        - - - 32
            - - [1856, 46]
              - [2368, 45]
              - [3584, 46]
              - [4288, 45]
              - [-1, 46]
          - - 64
            - - [4288, 46]
              - [5056, 45]
              - [-1, 46]
          - - 128
            - - [1024, 46]
              - [1408, 45]
              - [1856, 46]
              - [2368, 45]
              - [5056, 46]
              - [5888, 45]
              - [-1, 46]
          - - 256
            - - [704, 46]
              - [1408, 45]
              - [2368, 46]
              - [3584, 45]
              - [4288, 46]
              - [-1, 45]
          - - 448
            - - [32, 45]
              - [704, 46]
              - [1024, 45]
              - [1408, 46]
              - [2368, 45]
              - [3584, 46]
              - [4288, 45]
              - [5056, 46]
              - [-1, 45]
          - - 704
            - - [256, 46]
              - [448, 45]
              - [704, 46]
              - [-1, 45]
          - - 1024
            - - [32, 45]
              - [448, 46]
              - [1024, 45]
              - [1408, 46]
              - [1856, 45]
              - [2368, 46]
              - [-1, 45]
          - - 1408
            - - [448, 46]
              - [704, 45]
              - [1024, 46]
              - [-1, 45]
          - - 1856
            - - [448, 46]
              - [-1, 45]
          - - 2368
            - - [64, 46]
              - [128, 45]
              - [256, 46]
              - [-1, 45]
          - - 2944
            - - [32, 46]
              - [64, 45]
              - [448, 46]
              - [-1, 45]
          - - 3584
            - - [64, 46]
              - [128, 45]
              - [256, 46]
              - [448, 45]
              - [704, 46]
              - [-1, 45]
          - - 4288
            - - [64, 46]
              - [-1, 45]
          - - 5056
            - - [32, 45]
              - [256, 46]
              - [-1, 45]
          - - -1
            - - [128, 46]
              - [-1, 45]
      - - 32
        - - - 128
            - - [-1, 44]
          - - 256
            - - [704, 44]
              - [1024, 43]
              - [3584, 44]
              - [-1, 43]
          - - 448
            - - [1856, 44]
              - [-1, 43]
          - - 704
            - - [1408, 44]
              - [3584, 43]
              - [4288, 44]
              - [-1, 43]
          - - 1024
            - - [1024, 44]
              - [1856, 43]
              - [2944, 44]
              - [-1, 43]
          - - 1408
            - - [704, 44]
              - [1408, 43]
              - [1856, 44]
              - [-1, 43]
          - - 1856
            - - [448, 44]
              - [-1, 43]
          - - 2368
            - - [256, 44]
              - [-1, 43]
          - - 2944
            - - [256, 44]
              - [448, 43]
              - [1024, 44]
              - [-1, 43]
          - - 3584
            - - [64, 44]
              - [128, 43]
              - [448, 44]
              - [704, 43]
              - [1024, 44]
              - [-1, 43]
          - - 4288
            - - [128, 44]
              - [-1, 43]
          - - -1
            - - [128, 44]
              - [256, 43]
              - [448, 44]
              - [-1, 43]
      - - 256
        - - - 1
            - - [-1, 46]
          - - 32
            - - [-1, 44]
          - - 64
            - - [1, 46]
              - [32, 44]
              - [128, 5]
              - [1408, 2]
              - [1856, 5]
              - [2368, 3]
              - [5056, 6]
              - [-1, 7]
          - - 128
            - - [1, 46]
              - [32, 44]
              - [64, 5]
              - [128, 15]
              - [1024, 3]
              - [2368, 6]
              - [2944, 7]
              - [3584, 27]
              - [5056, 7]
              - [5888, 27]
              - [-1, 28]
          - - 256
            - - [1, 46]
              - [32, 44]
              - [64, 2]
              - [448, 5]
              - [2944, 27]
              - [3584, 28]
              - [5056, 27]
              - [5888, 25]
              - [-1, 28]
          - - 448
            - - [1, 46]
              - [32, 44]
              - [128, 2]
              - [256, 3]
              - [448, 6]
              - [1408, 27]
              - [1856, 25]
              - [2368, 27]
              - [2944, 25]
              - [4288, 27]
              - [5056, 25]
              - [5888, 28]
              - [-1, 27]
          - - 704
            - - [1, 46]
              - [32, 44]
              - [64, 13]
              - [128, 5]
              - [1856, 27]
              - [2368, 28]
              - [4288, 27]
              - [5056, 28]
              - [5888, 26]
              - [-1, 29]
          - - 1024
            - - [1, 46]
              - [32, 44]
              - [64, 3]
              - [128, 15]
              - [704, 27]
              - [3584, 28]
              - [4288, 25]
              - [5056, 28]
              - [-1, 29]
          - - 1408
            - - [1, 46]
              - [32, 44]
              - [64, 5]
              - [128, 6]
              - [448, 27]
              - [1024, 28]
              - [1856, 25]
              - [2368, 28]
              - [3584, 29]
              - [4288, 28]
              - [5888, 29]
              - [-1, 28]
          - - 1856
            - - [1, 46]
              - [32, 44]
              - [64, 15]
              - [128, 6]
              - [256, 27]
              - [448, 25]
              - [704, 27]
              - [1024, 28]
              - [1408, 27]
              - [1856, 28]
              - [2368, 25]
              - [2944, 28]
              - [4288, 29]
              - [5056, 26]
              - [5888, 29]
              - [-1, 25]
          - - 2368
            - - [1, 46]
              - [32, 44]
              - [64, 6]
              - [128, 16]
              - [448, 27]
              - [2368, 25]
              - [2944, 29]
              - [4288, 25]
              - [-1, 29]
          - - 2944
            - - [1, 46]
              - [32, 44]
              - [64, 6]
              - [128, 7]
              - [256, 27]
              - [448, 28]
              - [704, 25]
              - [1024, 28]
              - [1408, 29]
              - [5056, 25]
              - [-1, 29]
          - - 3584
            - - [1, 46]
              - [32, 44]
              - [64, 16]
              - [128, 18]
              - [448, 28]
              - [1024, 25]
              - [1408, 29]
              - [1856, 25]
              - [2368, 28]
              - [3584, 25]
              - [4288, 29]
              - [5056, 25]
              - [-1, 29]
          - - 4288
            - - [1, 46]
              - [32, 44]
              - [64, 6]
              - [128, 7]
              - [256, 27]
              - [704, 28]
              - [1024, 25]
              - [1856, 29]
              - [2944, 25]
              - [3584, 29]
              - [5056, 25]
              - [5888, 29]
              - [-1, 26]
          - - 5056
            - - [1, 46]
              - [32, 44]
              - [64, 4]
              - [128, 17]
              - [448, 27]
              - [704, 28]
              - [1408, 29]
              - [1856, 25]
              - [2368, 29]
              - [4288, 25]
              - [5888, 29]
              - [-1, 26]
          - - 5888
            - - [1, 46]
              - [32, 44]
              - [64, 7]
              - [128, 27]
              - [448, 28]
              - [704, 25]
              - [1408, 29]
              - [2368, 25]
              - [3584, 29]
              - [4288, 25]
              - [5056, 26]
              - [-1, 29]
          - - -1
            - - [1, 46]
              - [32, 44]
              - [64, 7]
              - [448, 28]
              - [704, 25]
              - [1024, 29]
              - [2368, 25]
              - [3584, 29]
              - [5056, 26]
              - [-1, 29]
      - - 1280
        - - - 1
            - - [-1, 46]
          - - 32
            - - [-1, 44]
          - - 64
            - - [1, 46]
              - [32, 44]
              - [128, 10]
              - [256, 24]
              - [1408, 19]
              - [1856, 22]
              - [2368, 5]
              - [2944, 16]
              - [3584, 6]
              - [4288, 7]
              - [5056, 17]
              - [5888, 7]
              - [-1, 18]
          - - 128
            - - [1, 46]
              - [32, 44]
              - [64, 23]
              - [256, 12]
              - [448, 13]
              - [704, 15]
              - [1024, 22]
              - [1408, 6]
              - [1856, 4]
              - [2368, 17]
              - [2944, 7]
              - [3584, 18]
              - [5056, 7]
              - [5888, 27]
              - [-1, 28]
          - - 256
            - - [1, 46]
              - [32, 44]
              - [64, 5]
              - [128, 12]
              - [256, 23]
              - [448, 13]
              - [2944, 27]
              - [3584, 28]
              - [5056, 27]
              - [-1, 28]
          - - 448
            - - [1, 46]
              - [32, 44]
              - [64, 12]
              - [128, 3]
              - [256, 13]
              - [448, 18]
              - [1408, 27]
              - [1856, 28]
              - [2368, 27]
              - [3584, 28]
              - [4288, 27]
              - [-1, 28]
          - - 704
            - - [1, 46]
              - [32, 44]
              - [64, 19]
              - [128, 15]
              - [1024, 27]
              - [1408, 14]
              - [1856, 27]
              - [2368, 28]
              - [3584, 27]
              - [4288, 28]
              - [5056, 29]
              - [5888, 26]
              - [-1, 29]
          - - 1024
            - - [1, 46]
              - [32, 44]
              - [64, 19]
              - [128, 22]
              - [704, 27]
              - [1856, 28]
              - [2368, 25]
              - [2944, 29]
              - [3584, 28]
              - [4288, 25]
              - [-1, 29]
          - - 1408
            - - [1, 46]
              - [32, 44]
              - [64, 12]
              - [128, 16]
              - [448, 27]
              - [2368, 28]
              - [5888, 29]
              - [-1, 25]
          - - 1856
            - - [1, 46]
              - [32, 44]
              - [64, 5]
              - [128, 18]
              - [256, 27]
              - [448, 28]
              - [704, 27]
              - [1024, 28]
              - [1408, 27]
              - [2368, 28]
              - [2944, 25]
              - [4288, 29]
              - [5056, 26]
              - [5888, 29]
              - [-1, 25]
          - - 2368
            - - [1, 46]
              - [32, 44]
              - [64, 5]
              - [128, 7]
              - [448, 27]
              - [1856, 28]
              - [2368, 25]
              - [2944, 29]
              - [4288, 25]
              - [-1, 29]
          - - 2944
            - - [1, 46]
              - [32, 44]
              - [64, 6]
              - [128, 7]
              - [256, 27]
              - [704, 28]
              - [1408, 29]
              - [1856, 28]
              - [2368, 29]
              - [5056, 25]
              - [-1, 29]
          - - 3584
            - - [1, 46]
              - [32, 44]
              - [64, 20]
              - [128, 18]
              - [1024, 28]
              - [1408, 29]
              - [1856, 25]
              - [2368, 28]
              - [3584, 25]
              - [-1, 29]
          - - 4288
            - - [1, 46]
              - [32, 44]
              - [128, 7]
              - [256, 27]
              - [1024, 28]
              - [1856, 29]
              - [2944, 25]
              - [3584, 29]
              - [5056, 25]
              - [-1, 29]
          - - 5056
            - - [1, 46]
              - [32, 44]
              - [128, 17]
              - [256, 27]
              - [704, 28]
              - [1408, 29]
              - [1856, 26]
              - [2368, 29]
              - [2944, 25]
              - [3584, 29]
              - [4288, 25]
              - [-1, 29]
          - - 5888
            - - [1, 46]
              - [32, 44]
              - [64, 17]
              - [128, 27]
              - [704, 28]
              - [1408, 29]
              - [2368, 25]
              - [-1, 29]
          - - -1
            - - [1, 46]
              - [32, 44]
              - [64, 7]
              - [448, 28]
              - [1024, 29]
              - [2368, 25]
              - [3584, 29]
              - [5056, 26]
              - [-1, 29]
      - - -1
        - - - 1
            - - [-1, 46]
          - - 32
            - - [-1, 44]
          - - 64
            - - [1, 46]
              - [32, 44]
              - [128, 10]
              - [704, 19]
              - [1024, 13]
              - [1408, 12]
              - [1856, 13]
              - [2368, 5]
              - [2944, 16]
              - [3584, 18]
              - [5056, 7]
              - [5888, 17]
              - [-1, 7]
          - - 128
            - - [1, 46]
              - [32, 44]
              - [128, 10]
              - [256, 12]
              - [448, 19]
              - [704, 12]
              - [1024, 22]
              - [1408, 6]
              - [1856, 18]
              - [2368, 7]
              - [2944, 17]
              - [5056, 7]
              - [5888, 27]
              - [-1, 28]
          - - 256
            - - [1, 46]
              - [32, 44]
              - [64, 23]
              - [128, 19]
              - [256, 10]
              - [448, 13]
              - [2944, 27]
              - [3584, 28]
              - [5056, 27]
              - [-1, 28]
          - - 448
            - - [1, 46]
              - [32, 44]
              - [128, 19]
              - [256, 22]
              - [448, 20]
              - [1408, 27]
              - [1856, 28]
              - [2368, 27]
              - [3584, 28]
              - [4288, 27]
              - [5056, 28]
              - [5888, 29]
              - [-1, 28]
          - - 704
            - - [1, 46]
              - [32, 44]
              - [64, 21]
              - [128, 12]
              - [1024, 27]
              - [1408, 14]
              - [1856, 27]
              - [2368, 28]
              - [2944, 27]
              - [3584, 29]
              - [4288, 28]
              - [5056, 29]
              - [5888, 28]
              - [-1, 29]
          - - 1024
            - - [1, 46]
              - [32, 44]
              - [64, 10]
              - [128, 22]
              - [704, 27]
              - [2368, 28]
              - [2944, 29]
              - [4288, 28]
              - [-1, 29]
          - - 1408
            - - [1, 46]
              - [32, 44]
              - [64, 12]
              - [128, 6]
              - [448, 27]
              - [2368, 28]
              - [5888, 29]
              - [-1, 25]
          - - 1856
            - - [1, 46]
              - [32, 44]
              - [64, 13]
              - [128, 18]
              - [256, 27]
              - [448, 28]
              - [704, 27]
              - [1024, 28]
              - [1408, 29]
              - [2944, 28]
              - [4288, 29]
              - [5056, 25]
              - [5888, 29]
              - [-1, 25]
          - - 2368
            - - [1, 46]
              - [32, 44]
              - [64, 5]
              - [128, 17]
              - [448, 27]
              - [2368, 28]
              - [2944, 29]
              - [4288, 25]
              - [-1, 29]
          - - 2944
            - - [1, 46]
              - [32, 44]
              - [64, 6]
              - [128, 7]
              - [256, 27]
              - [704, 28]
              - [1408, 29]
              - [1856, 28]
              - [2368, 29]
              - [5056, 25]
              - [-1, 29]
          - - 3584
            - - [1, 46]
              - [32, 44]
              - [64, 20]
              - [128, 4]
              - [1024, 28]
              - [1408, 29]
              - [1856, 28]
              - [3584, 25]
              - [4288, 29]
              - [5056, 25]
              - [-1, 29]
          - - 4288
            - - [1, 46]
              - [32, 44]
              - [64, 7]
              - [128, 17]
              - [256, 27]
              - [1024, 28]
              - [1856, 29]
              - [2944, 25]
              - [3584, 29]
              - [5056, 25]
              - [-1, 29]
          - - 5056
            - - [1, 46]
              - [32, 44]
              - [64, 7]
              - [128, 17]
              - [256, 27]
              - [704, 28]
              - [1408, 29]
              - [1856, 26]
              - [2368, 29]
              - [4288, 25]
              - [-1, 29]
          - - 5888
            - - [1, 46]
              - [32, 44]
              - [64, 17]
              - [128, 27]
              - [256, 28]
              - [448, 29]
              - [704, 28]
              - [1408, 29]
              - [2368, 25]
              - [-1, 29]
          - - -1
            - - [1, 46]
              - [32, 44]
              - [64, 18]
              - [448, 28]
              - [1024, 29]
              - [2368, 25]
              - [3584, 29]
              - [5056, 25]
              - [-1, 29]
