library/src/blas3/Tensile/Logic/asm_full/vega10_Cijk_Alik_Bljk_SB.yaml
- {MinimumRequiredVersion: 4.0.2}
- vega10
- gfx900
- [Device 6863, Device 6862, Device 687f, Device 6860]
- - - [4096, 7000, 1, 4096]
    - [27, 7744.55]
  - - [7680, 12000, 1, 2560]
    - [36, 10012.8]
  - - [5124, 9124, 1, 1760]
    - [42, 11144.6]
  - - [1760, 32, 1, 1760]
    - [8, 3083.2]
  - - [512, 24000, 1, 1536]
    - [35, 9582.03]
  - - [3072, 24000, 1, 1024]
    - [36, 9101.79]
  - - [2048, 400, 1, 512]
    - [34, 4273.32]
  - - [2560, 7000, 1, 2560]
    - [38, 9684.35]
  - - [3072, 16, 1, 1024]
    - [15, 713.712]
  - - [512, 48000, 1, 2816]
    - [34, 11062.9]
  - - [512, 48000, 1, 2048]
    - [30, 7798.98]
  - - [1760, 64, 1, 1760]
    - [12, 4813.38]
  - - [35, 8457, 1, 4096]
    - [6, 3322.54]
  - - [2048, 1600, 1, 2048]
    - [27, 5954.65]
  - - [512, 48000, 1, 1536]
    - [34, 10446.5]
  - - [2560, 32, 1, 2560]
    - [13, 2516.5]
  - - [8448, 5984, 1, 2816]
    - [34, 11278.9]
  - - [4096, 3200, 1, 1024]
    - [36, 7883.56]
  - - [1024, 24000, 1, 2560]
    - [34, 9709.16]
  - - [1760, 6400, 1, 1760]
    - [40, 11195.3]
  - - [1024, 700, 1, 512]
    - [28, 4483.58]
  - - [4608, 32, 1, 1536]
    - [25, 2556.48]
  - - [3072, 64, 1, 1024]
    - [11, 2315.0]
  - - [16384, 3200, 1, 4096]
    - [27, 6929.39]
  - - [2560, 16, 1, 2560]
    - [10, 1435.63]
  - - [1024, 48000, 1, 2560]
    - [39, 9909.97]
  - - [35, 8457, 1, 2560]
    - [7, 3406.35]
  - - [8448, 48000, 1, 2816]
    - [34, 11570.1]
  - - [2048, 32, 1, 2048]
    - [11, 1802.86]
  - - [2560, 3200, 1, 2560]
    - [38, 9020.43]
  - - [16384, 800, 1, 4096]
    - [27, 6527.59]
  - - [4608, 24000, 1, 1536]
    - [37, 10725.2]
  - - [7680, 48000, 1, 2560]
    - [34, 10892.4]
  - - [3072, 48000, 1, 1024]
    - [36, 9452.28]
  - - [1760, 16, 1, 1760]
    - [10, 1604.48]
  - - [8192, 3200, 1, 2048]
    - [36, 8103.76]
  - - [512, 24000, 1, 2816]
    - [40, 10985.8]
  - - [4096, 400, 1, 1024]
    - [44, 4577.3]
  - - [6144, 48000, 1, 2560]
    - [28, 10134.9]
  - - [4608, 48000, 1, 1536]
    - [37, 10842.7]
  - - [35, 8457, 1, 2048]
    - [4, 3043.29]
  - - [4096, 128, 1, 4096]
    - [21, 4602.33]
  - - [2048, 800, 1, 512]
    - [37, 5625.56]
  - - [4608, 5984, 1, 1536]
    - [37, 10281.8]
  - - [2560, 128, 1, 2560]
    - [24, 5069.04]
  - - [6144, 5984, 1, 2048]
    - [36, 8290.9]
  - - [35, 8457, 1, 1760]
    - [5, 3991.27]
  - - [7680, 24000, 1, 2560]
    - [34, 10283.6]
  - - [6144, 48000, 1, 2048]
    - [36, 9018.31]
  - - [5124, 9124, 1, 2560]
    - [36, 9717.99]
  - - [2048, 3200, 1, 2048]
    - [28, 6646.17]
  - - [2048, 16, 1, 2048]
    - [11, 947.638]
  - - [1024, 24000, 1, 1536]
    - [34, 9833.31]
  - - [7680, 16, 1, 2560]
    - [15, 1666.64]
  - - [2560, 6400, 1, 2560]
    - [38, 9607.57]
  - - [2048, 128, 1, 2048]
    - [19, 3106.53]
  - - [512, 16, 1, 500000]
    - [3, 2276.7]
  - - [1024, 8, 1, 500000]
    - [1, 1166.74]
  - - [512, 24000, 1, 2560]
    - [34, 9560.1]
  - - [1024, 24000, 1, 2816]
    - [34, 11001.9]
  - - [7680, 5984, 1, 2560]
    - [36, 9839.69]
  - - [2048, 1600, 1, 512]
    - [38, 5581.21]
  - - [2048, 7000, 1, 2048]
    - [28, 7283.68]
  - - [1760, 800, 1, 1760]
    - [26, 8686.83]
  - - [5124, 9124, 1, 4096]
    - [27, 8077.21]
  - - [4096, 64, 1, 4096]
    - [22, 3302.59]
  - - [7680, 32, 1, 2560]
    - [8, 3112.2]
  - - [2560, 64, 1, 2560]
    - [9, 3737.39]
  - - [3072, 128, 1, 1024]
    - [17, 2790.37]
  - - [7680, 64, 1, 2560]
    - [21, 4916.46]
  - - [1760, 128, 1, 1760]
    - [13, 5875.4]
  - - [2560, 1600, 1, 2560]
    - [37, 8187.94]
  - - [2048, 3200, 1, 512]
    - [28, 6908.19]
  - - [2560, 800, 1, 2560]
    - [41, 7012.44]
  - - [3072, 32, 1, 1024]
    - [11, 1681.81]
  - - [6144, 32, 1, 2560]
    - [25, 2943.91]
  - - [4608, 12000, 1, 1536]
    - [37, 10574.1]
  - - [4096, 32, 1, 4096]
    - [8, 1989.44]
  - - [6144, 24000, 1, 2048]
    - [36, 8660.96]
  - - [8192, 800, 1, 2048]
    - [27, 6283.39]
  - - [4096, 1600, 1, 1024]
    - [36, 6878.29]
  - - [5124, 9124, 1, 2048]
    - [36, 8194.22]
  - - [8448, 24000, 1, 2816]
    - [34, 11499.8]
  - - [1024, 48000, 1, 1536]
    - [34, 10023.9]
  - - [7680, 128, 1, 2560]
    - [20, 6207.33]
  - - [8192, 1600, 1, 2048]
    - [28, 7366.11]
  - - [4096, 800, 1, 1024]
    - [44, 5514.61]
  - - [1024, 16, 1, 500000]
    - [2, 2289.95]
  - - [2048, 800, 1, 2048]
    - [43, 4984.27]
  - - [1760, 3200, 1, 1760]
    - [26, 10872.8]
  - - [512, 48000, 1, 2560]
    - [37, 9788.5]
  - - [8448, 16, 1, 2816]
    - [18, 1885.64]
  - - [2048, 64, 1, 2048]
    - [11, 2441.89]
  - - [512, 24000, 1, 2048]
    - [30, 7680.76]
  - - [16384, 1600, 1, 4096]
    - [27, 7053.41]
  - - [4608, 16, 1, 1536]
    - [11, 1399.98]
  - - [1024, 24000, 1, 2048]
    - [36, 7443.8]
  - - [8192, 400, 1, 2048]
    - [43, 5116.28]
  - - [2048, 6400, 1, 2048]
    - [28, 7402.83]
  - - [6144, 12000, 1, 2048]
    - [36, 8388.26]
  - - [512, 8, 1, 500000]
    - [0, 1151.43]
  - - [1760, 7000, 1, 1760]
    - [32, 10762.3]
  - - [1024, 48000, 1, 2816]
    - [34, 11284.1]
  - - [6144, 16, 1, 2560]
    - [10, 1643.57]
  - - [8448, 32, 1, 2816]
    - [8, 3532.75]
  - - [4096, 16, 1, 4096]
    - [14, 1100.11]
  - - [6144, 24000, 1, 2560]
    - [36, 9906.56]
  - - [1024, 1024, 1, 1024]
    - [36, 4514.19]
  - - [8448, 12000, 1, 2816]
    - [34, 11447.1]
  - - [16384, 400, 1, 4096]
    - [27, 5962.97]
  - - [1760, 1600, 1, 1760]
    - [42, 9637.85]
  - - [1024, 48000, 1, 2048]
    - [36, 7708.47]
- - - -1
    - - - -1
        - - - 4
            - - [1024, 16]
              - [1856, 10]
              - [2368, 16]
              - [2944, 10]
              - [4288, 16]
              - [5056, 10]
              - [-1, 16]
          - - 64
            - - [128, 16]
              - [256, 18]
              - [448, 15]
              - [1408, 24]
              - [2368, 12]
              - [5888, 23]
              - [-1, 31]
          - - 128
            - - [64, 16]
              - [128, 18]
              - [256, 9]
              - [704, 24]
              - [1408, 23]
              - [1856, 12]
              - [2944, 23]
              - [3584, 31]
              - [5056, 23]
              - [5888, 31]
              - [-1, 28]
          - - 256
            - - [4, 16]
              - [64, 18]
              - [256, 9]
              - [448, 23]
              - [2944, 31]
              - [3584, 28]
              - [5056, 31]
              - [5888, 29]
              - [-1, 31]
          - - 448
            - - [4, 16]
              - [64, 9]
              - [448, 24]
              - [1408, 31]
              - [1856, 26]
              - [2368, 31]
              - [2944, 26]
              - [3584, 31]
              - [4288, 28]
              - [5056, 26]
              - [5888, 42]
              - [-1, 28]
          - - 704
            - - [4, 16]
              - [64, 24]
              - [128, 12]
              - [1024, 31]
              - [1408, 28]
              - [2368, 31]
              - [5888, 28]
              - [-1, 42]
          - - 1024
            - - [4, 10]
              - [64, 24]
              - [128, 21]
              - [704, 31]
              - [1024, 33]
              - [1408, 26]
              - [1856, 42]
              - [2368, 26]
              - [2944, 42]
              - [4288, 26]
              - [5888, 40]
              - [-1, 42]
          - - 1408
            - - [4, 10]
              - [64, 12]
              - [128, 23]
              - [448, 31]
              - [704, 33]
              - [1024, 32]
              - [1408, 40]
              - [1856, 33]
              - [2368, 32]
              - [-1, 40]
          - - 1856
            - - [4, 16]
              - [64, 12]
              - [128, 13]
              - [256, 31]
              - [448, 26]
              - [704, 31]
              - [1024, 40]
              - [1856, 32]
              - [2944, 26]
              - [3584, 42]
              - [5056, 40]
              - [-1, 42]
          - - 2368
            - - [4, 16]
              - [64, 13]
              - [128, 23]
              - [704, 31]
              - [1024, 26]
              - [1408, 32]
              - [1856, 26]
              - [2368, 33]
              - [2944, 42]
              - [5056, 40]
              - [-1, 42]
          - - 2944
            - - [4, 16]
              - [128, 23]
              - [256, 31]
              - [448, 32]
              - [704, 33]
              - [1408, 40]
              - [1856, 26]
              - [2944, 40]
              - [3584, 42]
              - [4288, 40]
              - [-1, 42]
          - - 3584
            - - [4, 16]
              - [128, 31]
              - [256, 28]
              - [448, 31]
              - [704, 26]
              - [1024, 32]
              - [1408, 40]
              - [-1, 42]
          - - 4288
            - - [4, 16]
              - [64, 24]
              - [128, 13]
              - [256, 31]
              - [448, 33]
              - [1024, 26]
              - [1856, 42]
              - [2368, 32]
              - [-1, 42]
          - - 5056
            - - [4, 16]
              - [64, 23]
              - [256, 31]
              - [448, 32]
              - [704, 26]
              - [2368, 42]
              - [2944, 26]
              - [-1, 42]
          - - 5888
            - - [4, 10]
              - [64, 23]
              - [128, 31]
              - [256, 32]
              - [448, 40]
              - [704, 26]
              - [-1, 42]
          - - -1
            - - [4, 10]
              - [64, 31]
              - [128, 28]
              - [256, 31]
              - [448, 33]
              - [1024, 42]
              - [1408, 32]
              - [1856, 29]
              - [2368, 42]
              - [2944, 29]
              - [5056, 42]
              - [5888, 40]
              - [-1, 42]
