library/src/blas3/Tensile/Logic/asm_full/vega20_Cijk_Alik_Bljk_SB.yaml
- {MinimumRequiredVersion: 4.6.0}
- vega20
- gfx906
- [Device 66a0, Device 66a1, Device 66a7]
    SolutionIndex: 0
    SolutionNameMin: Cijk_Alik_Bljk_SB_MT064x008x32_GRVW02_GSU32_SNLL0_TT04_02_VW02_WG16_04_04
    SolutionIndex: 1
    SolutionNameMin: Cijk_Alik_Bljk_SB_MT064x008x32_GRVW04_GSU32_SNLL0_TT04_04_VW04_WG16_02_08
    SolutionIndex: 2
    SolutionNameMin: Cijk_Alik_Bljk_SB_MT064x016x64_GRVW04_GSU32_SNLL0_TT04_04_VW04_WG16_04_04
    SolutionIndex: 3
    SolutionNameMin: Cijk_Alik_Bljk_SB_MT064x016x64_GRVW04_GSU32_SNLL0_TT04_04_VW04_WG16_04_04
    SolutionIndex: 4
    SolutionNameMin: Cijk_Alik_Bljk_SB_MT036x048x16_GRVW01_GSU02_SNLL0_TT03_03_VW01_WG12_16_01
    SolutionIndex: 5
    SolutionNameMin: Cijk_Alik_Bljk_SB_MT048x036x16_GRVW01_GSU08_SNLL0_TT06_03_VW01_WG08_12_02
    SolutionIndex: 6
    SolutionNameMin: Cijk_Alik_Bljk_SB_MT048x048x16_GRVW02_GSU08_SNLL0_TT06_04_VW02_WG08_12_02
    SolutionIndex: 7
    SolutionNameMin: Cijk_Alik_Bljk_SB_MT048x048x16_GRVW01_GSU08_SNLL0_TT03_03_VW01_WG16_16_01
    SolutionIndex: 8
    SolutionNameMin: Cijk_Alik_Bljk_SB_MT032x008x08_GRVW02_GSU01_SNLL0_TT02_02_VW02_WG16_04_01
    SolutionIndex: 9
    SolutionNameMin: Cijk_Alik_Bljk_SB_MT016x016x08_GRVW02_GSU01_SNLL0_TT02_02_VW02_WG08_08_01
    SolutionIndex: 10
    SolutionNameMin: Cijk_Alik_Bljk_SB_MT032x016x08_GRVW02_GSU01_SNLL0_TT04_02_VW02_WG08_08_01
    SolutionIndex: 11
    SolutionNameMin: Cijk_Alik_Bljk_SB_MT032x032x08_GRVW04_GSU01_SNLL0_TT04_04_VW04_WG08_08_01
    SolutionIndex: 12
    SolutionNameMin: Cijk_Alik_Bljk_SB_MT032x016x08_GRVW02_GSU01_SNLL0_TT02_02_VW02_WG16_08_01
    SolutionIndex: 13
    SolutionNameMin: Cijk_Alik_Bljk_SB_MT016x016x08_GRVW02_GSU01_SNLL0_TT02_02_VW02_WG08_08_01
    SolutionIndex: 14
    SolutionNameMin: Cijk_Alik_Bljk_SB_MT032x032x08_GRVW04_GSU01_SNLL0_TT04_04_VW04_WG08_08_01
    SolutionIndex: 15
    SolutionNameMin: Cijk_Alik_Bljk_SB_MT032x016x08_GRVW02_GSU01_SNLL0_TT02_02_VW02_WG16_08_01
    SolutionIndex: 16
    SolutionNameMin: Cijk_Alik_Bljk_SB_MT064x008x16_GRVW02_GSU01_SNLL0_TT02_02_VW02_WG32_04_01
    SolutionIndex: 17
    SolutionNameMin: Cijk_Alik_Bljk_SB_MT032x008x16_GRVW02_GSU01_SNLL0_TT02_02_VW02_WG16_04_01
    SolutionIndex: 18
    SolutionNameMin: Cijk_Alik_Bljk_SB_MT016x016x16_GRVW02_GSU01_SNLL0_TT02_02_VW02_WG08_08_01
    SolutionIndex: 19
    SolutionNameMin: Cijk_Alik_Bljk_SB_MT032x016x16_GRVW02_GSU01_SNLL0_TT04_02_VW02_WG08_08_01
    SolutionIndex: 20
    SolutionNameMin: Cijk_Alik_Bljk_SB_MT032x032x16_GRVW04_GSU01_SNLL0_TT04_04_VW04_WG08_08_01
    SolutionIndex: 21
    SolutionNameMin: Cijk_Alik_Bljk_SB_MT032x016x16_GRVW02_GSU01_SNLL0_TT02_02_VW02_WG16_08_01
    SolutionIndex: 22
    SolutionNameMin: Cijk_Alik_Bljk_SB_MT064x016x16_GRVW02_GSU01_SNLL0_TT04_02_VW02_WG16_08_01
    SolutionIndex: 23
    SolutionNameMin: Cijk_Alik_Bljk_SB_MT064x032x16_GRVW04_GSU01_SNLL0_TT04_04_VW04_WG16_08_01
    SolutionIndex: 24
    SolutionNameMin: Cijk_Alik_Bljk_SB_MT064x008x16_GRVW02_GSU01_SNLL0_TT02_02_VW02_WG32_04_01
    SolutionIndex: 25
    SolutionNameMin: Cijk_Alik_Bljk_SB_MT032x008x16_GRVW02_GSU01_SNLL0_TT02_02_VW02_WG16_04_01
    SolutionIndex: 26
    SolutionNameMin: Cijk_Alik_Bljk_SB_MT032x016x16_GRVW02_GSU01_SNLL0_TT02_02_VW02_WG16_08_01
    SolutionIndex: 27
    SolutionNameMin: Cijk_Alik_Bljk_SB_MT064x032x16_GRVW04_GSU01_SNLL0_TT04_04_VW04_WG16_08_01
    SolutionIndex: 28
    SolutionNameMin: Cijk_Alik_Bljk_SB_MT032x032x08_GRVW04_GSU02_SNLL0_TT04_04_VW04_WG08_08_04
    SolutionIndex: 29
    SolutionNameMin: Cijk_Alik_Bljk_SB_MT016x016x08_GRVW02_GSU08_SNLL0_TT02_02_VW02_WG08_08_02
    SolutionIndex: 30
    SolutionNameMin: Cijk_Alik_Bljk_SB_MT032x032x08_GRVW04_GSU08_SNLL0_TT04_04_VW04_WG08_08_04
    SolutionIndex: 31
    SolutionNameMin: Cijk_Alik_Bljk_SB_MT032x016x16_GRVW02_GSU02_SNLL0_TT04_02_VW02_WG08_08_02
    SolutionIndex: 32
    SolutionNameMin: Cijk_Alik_Bljk_SB_MT032x032x16_GRVW04_GSU02_SNLL0_TT04_04_VW04_WG08_08_02
    SolutionIndex: 33
    SolutionNameMin: Cijk_Alik_Bljk_SB_MT064x032x16_GRVW04_GSU02_SNLL0_TT08_04_VW04_WG08_08_02
    SolutionIndex: 34
    SolutionNameMin: Cijk_Alik_Bljk_SB_MT016x016x16_GRVW02_GSU02_SNLL0_TT02_02_VW02_WG08_08_04
    SolutionIndex: 35
    SolutionNameMin: Cijk_Alik_Bljk_SB_MT032x016x16_GRVW02_GSU02_SNLL0_TT04_02_VW02_WG08_08_04
    SolutionIndex: 36
    SolutionNameMin: Cijk_Alik_Bljk_SB_MT032x016x16_GRVW02_GSU02_SNLL0_TT02_02_VW02_WG16_08_02
    SolutionIndex: 37
    SolutionNameMin: Cijk_Alik_Bljk_SB_MT064x016x16_GRVW02_GSU02_SNLL0_TT04_02_VW02_WG16_08_02
    SolutionIndex: 38
    SolutionNameMin: Cijk_Alik_Bljk_SB_MT128x064x16_GRVW04_GSU02_SNLL0_TT08_08_VW04_WG16_08_02
    SolutionIndex: 39
    SolutionNameMin: Cijk_Alik_Bljk_SB_MT032x016x16_GRVW02_GSU02_SNLL0_TT04_02_VW02_WG08_08_02
    SolutionIndex: 40
    SolutionNameMin: Cijk_Alik_Bljk_SB_MT032x032x16_GRVW04_GSU02_SNLL0_TT04_04_VW04_WG08_08_02
    SolutionIndex: 41
    SolutionNameMin: Cijk_Alik_Bljk_SB_MT064x032x16_GRVW04_GSU02_SNLL0_TT08_04_VW04_WG08_08_02
    SolutionIndex: 42
    SolutionNameMin: Cijk_Alik_Bljk_SB_MT016x016x16_GRVW02_GSU02_SNLL0_TT02_02_VW02_WG08_08_04
    SolutionIndex: 43
    SolutionNameMin: Cijk_Alik_Bljk_SB_MT032x016x16_GRVW02_GSU02_SNLL0_TT04_02_VW02_WG08_08_04
    SolutionIndex: 44
    SolutionNameMin: Cijk_Alik_Bljk_SB_MT032x016x16_GRVW02_GSU02_SNLL0_TT02_02_VW02_WG16_08_02
    SolutionIndex: 45
    SolutionNameMin: Cijk_Alik_Bljk_SB_MT128x064x16_GRVW04_GSU02_SNLL0_TT08_08_VW04_WG16_08_02
    SolutionIndex: 46
    SolutionNameMin: Cijk_Alik_Bljk_SB_MT064x016x16_GRVW04_GSU04_SNLL0_TT04_04_VW04_WG16_04_04
    SolutionIndex: 47
    SolutionNameMin: Cijk_Alik_Bljk_SB_MT032x032x16_GRVW04_GSU04_SNLL0_TT04_04_VW04_WG08_08_02
    SolutionIndex: 48
    SolutionNameMin: Cijk_Alik_Bljk_SB_MT064x032x16_GRVW04_GSU04_SNLL0_TT08_04_VW04_WG08_08_02
    SolutionIndex: 49
    SolutionNameMin: Cijk_Alik_Bljk_SB_MT016x016x16_GRVW02_GSU04_SNLL0_TT02_02_VW02_WG08_08_04
    SolutionIndex: 50
    SolutionNameMin: Cijk_Alik_Bljk_SB_MT032x016x16_GRVW02_GSU04_SNLL0_TT04_02_VW02_WG08_08_04
    SolutionIndex: 51
    SolutionNameMin: Cijk_Alik_Bljk_SB_MT032x016x16_GRVW02_GSU04_SNLL0_TT02_02_VW02_WG16_08_02
    SolutionIndex: 52
    SolutionNameMin: Cijk_Alik_Bljk_SB_MT032x016x16_GRVW02_GSU04_SNLL0_TT04_02_VW02_WG08_08_02
    SolutionIndex: 53
    SolutionNameMin: Cijk_Alik_Bljk_SB_MT032x032x16_GRVW04_GSU04_SNLL0_TT04_04_VW04_WG08_08_02
    SolutionIndex: 54
    SolutionNameMin: Cijk_Alik_Bljk_SB_MT064x032x16_GRVW04_GSU04_SNLL0_TT08_04_VW04_WG08_08_02
    SolutionIndex: 55
    SolutionNameMin: Cijk_Alik_Bljk_SB_MT016x016x16_GRVW02_GSU04_SNLL0_TT02_02_VW02_WG08_08_04
    SolutionIndex: 56
    SolutionNameMin: Cijk_Alik_Bljk_SB_MT032x016x16_GRVW02_GSU04_SNLL0_TT04_02_VW02_WG08_08_04
    SolutionIndex: 57
    SolutionNameMin: Cijk_Alik_Bljk_SB_MT032x016x16_GRVW02_GSU04_SNLL0_TT02_02_VW02_WG16_08_02
    SolutionIndex: 58
    SolutionNameMin: Cijk_Alik_Bljk_SB_MT128x064x16_GRVW04_GSU04_SNLL0_TT08_08_VW04_WG16_08_02
    SolutionIndex: 59
    SolutionNameMin: Cijk_Alik_Bljk_SB_MT016x016x16_GRVW02_GSU08_SNLL0_TT02_02_VW02_WG08_08_04
    SolutionIndex: 60
    SolutionNameMin: Cijk_Alik_Bljk_SB_MT016x016x16_GRVW02_GSU08_SNLL0_TT02_02_VW02_WG08_08_04
    SolutionIndex: 61
    SolutionNameMin: Cijk_Alik_Bljk_SB_MT032x016x16_GRVW02_GSU08_SNLL0_TT02_02_VW02_WG16_08_02
    SolutionIndex: 62
    SolutionNameMin: Cijk_Alik_Bljk_SB_MT064x064x24_GRVW04_GSU02_SNLL0_TT08_08_VW04_WG08_08_02
    SolutionIndex: 63
    SolutionNameMin: Cijk_Alik_Bljk_SB_MT064x064x24_GRVW04_GSU02_SNLL0_TT08_08_VW04_WG08_08_02
    SolutionIndex: 64
    SolutionNameMin: Cijk_Alik_Bljk_SB_MT064x064x24_GRVW04_GSU04_SNLL0_TT08_08_VW04_WG08_08_02
    SolutionIndex: 65
    SolutionNameMin: Cijk_Alik_Bljk_SB_MT064x064x24_GRVW04_GSU04_SNLL0_TT08_08_VW04_WG08_08_02
    SolutionIndex: 66
    SolutionNameMin: Cijk_Alik_Bljk_SB_MT032x032x32_GRVW04_GSU02_SNLL0_TT04_04_VW04_WG08_08_02
    SolutionIndex: 67
    SolutionNameMin: Cijk_Alik_Bljk_SB_MT032x032x32_GRVW04_GSU02_SNLL0_TT04_04_VW04_WG08_08_04
    SolutionIndex: 68
    SolutionNameMin: Cijk_Alik_Bljk_SB_MT064x032x32_GRVW04_GSU02_SNLL0_TT08_04_VW04_WG08_08_04
    SolutionIndex: 69
    SolutionNameMin: Cijk_Alik_Bljk_SB_MT128x032x32_GRVW04_GSU02_SNLL0_TT08_04_VW04_WG16_08_02
    SolutionIndex: 70
    SolutionNameMin: Cijk_Alik_Bljk_SB_MT032x032x32_GRVW04_GSU02_SNLL0_TT04_04_VW04_WG08_08_04
    SolutionIndex: 71
    SolutionNameMin: Cijk_Alik_Bljk_SB_MT064x032x32_GRVW04_GSU02_SNLL0_TT08_04_VW04_WG08_08_04
    SolutionIndex: 72
    SolutionNameMin: Cijk_Alik_Bljk_SB_MT064x064x32_GRVW04_GSU02_SNLL0_TT08_08_VW04_WG08_08_04
    SolutionIndex: 73
    SolutionNameMin: Cijk_Alik_Bljk_SB_MT064x032x32_GRVW04_GSU02_SNLL0_TT04_04_VW04_WG16_08_02
    SolutionIndex: 74
    SolutionNameMin: Cijk_Alik_Bljk_SB_MT032x008x32_GRVW02_GSU04_SNLL0_TT02_02_VW02_WG16_04_04
    SolutionIndex: 75
    SolutionNameMin: Cijk_Alik_Bljk_SB_MT064x064x32_GRVW04_GSU04_SNLL0_TT08_08_VW04_WG08_08_02
    SolutionIndex: 76
    SolutionNameMin: Cijk_Alik_Bljk_SB_MT032x032x32_GRVW04_GSU04_SNLL0_TT04_04_VW04_WG08_08_04
    SolutionIndex: 77
    SolutionNameMin: Cijk_Alik_Bljk_SB_MT032x032x32_GRVW04_GSU04_SNLL0_TT04_04_VW04_WG08_08_04
    SolutionIndex: 78
    SolutionNameMin: Cijk_Alik_Bljk_SB_MT064x032x32_GRVW04_GSU04_SNLL0_TT08_04_VW04_WG08_08_04
    SolutionIndex: 79
    SolutionNameMin: Cijk_Alik_Bljk_SB_MT064x032x32_GRVW04_GSU04_SNLL0_TT04_04_VW04_WG16_08_02
    SolutionIndex: 80
    SolutionNameMin: Cijk_Alik_Bljk_SB_MT064x064x16_GRVW04_GSU01_SNLL0_TT04_04_VW04_WG16_16_01
    SolutionIndex: 81
    SolutionNameMin: Cijk_Alik_Bljk_SB_MT064x128x16_GRVW04_GSU01_SNLL0_TT04_08_VW04_WG16_16_01
    SolutionIndex: 82
    SolutionNameMin: Cijk_Alik_Bljk_SB_MT096x128x16_GRVW02_GSU01_SNLL0_TT06_08_VW02_WG16_16_01
    SolutionIndex: 83
    SolutionNameMin: Cijk_Alik_Bljk_SB_MT128x064x16_GRVW04_GSU01_SNLL0_TT08_04_VW04_WG16_16_01
    SolutionIndex: 84
    SolutionNameMin: Cijk_Alik_Bljk_SB_MT064x064x16_GRVW04_GSU01_SNLL0_TT04_04_VW04_WG16_16_01
    SolutionIndex: 85
    SolutionNameMin: Cijk_Alik_Bljk_SB_MT064x128x16_GRVW04_GSU01_SNLL0_TT04_08_VW04_WG16_16_01
    SolutionIndex: 86
    SolutionNameMin: Cijk_Alik_Bljk_SB_MT128x064x16_GRVW04_GSU01_SNLL0_TT08_04_VW04_WG16_16_01
    SolutionIndex: 87
    SolutionNameMin: Cijk_Alik_Bljk_SB_MT064x064x32_GRVW04_GSU01_SNLL0_TT04_04_VW04_WG16_16_01
    SolutionIndex: 88
    SolutionNameMin: Cijk_Alik_Bljk_SB_MT064x064x32_GRVW04_GSU01_SNLL0_TT04_04_VW04_WG16_16_01
    SolutionIndex: 89
    SolutionNameMin: Cijk_Alik_Bljk_SB_MT128x128x08_GRVW04_GSU01_SNLL1_TT08_08_VW04_WG16_16_01
    SolutionIndex: 90
    SolutionNameMin: Cijk_Alik_Bljk_SB_MT128x128x08_GRVW04_GSU01_SNLL1_TT08_08_VW04_WG16_16_01
    SolutionIndex: 91
    SolutionNameMin: Cijk_Alik_Bljk_SB_MT064x064x16_GRVW04_GSU01_SNLL1_TT04_04_VW04_WG16_16_01
    SolutionIndex: 92
    SolutionNameMin: Cijk_Alik_Bljk_SB_MT064x128x16_GRVW04_GSU01_SNLL1_TT04_08_VW04_WG16_16_01
    SolutionIndex: 93
    SolutionNameMin: Cijk_Alik_Bljk_SB_MT096x128x16_GRVW02_GSU01_SNLL1_TT06_08_VW02_WG16_16_01
    SolutionIndex: 94
    SolutionNameMin: Cijk_Alik_Bljk_SB_MT128x064x16_GRVW04_GSU01_SNLL1_TT08_04_VW04_WG16_16_01
    SolutionIndex: 95
    SolutionNameMin: Cijk_Alik_Bljk_SB_MT128x096x16_GRVW02_GSU01_SNLL1_TT08_06_VW02_WG16_16_01
    SolutionIndex: 96
    SolutionNameMin: Cijk_Alik_Bljk_SB_MT128x128x16_GRVW04_GSU01_SNLL1_TT08_08_VW04_WG16_16_01
    SolutionIndex: 97
    SolutionNameMin: Cijk_Alik_Bljk_SB_MT064x064x16_GRVW04_GSU01_SNLL1_TT04_04_VW04_WG16_16_01
    SolutionIndex: 98
    SolutionNameMin: Cijk_Alik_Bljk_SB_MT064x128x16_GRVW04_GSU01_SNLL1_TT04_08_VW04_WG16_16_01
    SolutionIndex: 99
    SolutionNameMin: Cijk_Alik_Bljk_SB_MT096x128x16_GRVW02_GSU01_SNLL1_TT06_08_VW02_WG16_16_01
    SolutionIndex: 100
    SolutionNameMin: Cijk_Alik_Bljk_SB_MT128x064x16_GRVW04_GSU01_SNLL1_TT08_04_VW04_WG16_16_01
    SolutionIndex: 101
    SolutionNameMin: Cijk_Alik_Bljk_SB_MT128x096x16_GRVW02_GSU01_SNLL1_TT08_06_VW02_WG16_16_01
    SolutionIndex: 102
    SolutionNameMin: Cijk_Alik_Bljk_SB_MT128x128x16_GRVW04_GSU01_SNLL1_TT08_08_VW04_WG16_16_01
    SolutionIndex: 103
    SolutionNameMin: Cijk_Alik_Bljk_SB_MT128x128x24_GRVW04_GSU01_SNLL1_TT08_08_VW04_WG16_16_01
    SolutionIndex: 104
    SolutionNameMin: Cijk_Alik_Bljk_SB_MT128x128x24_GRVW04_GSU01_SNLL1_TT08_08_VW04_WG16_16_01
    SolutionIndex: 105
    SolutionNameMin: Cijk_Alik_Bljk_SB_MT064x064x32_GRVW04_GSU01_SNLL1_TT04_04_VW04_WG16_16_01
    SolutionIndex: 106
    SolutionNameMin: Cijk_Alik_Bljk_SB_MT064x128x32_GRVW04_GSU01_SNLL1_TT04_08_VW04_WG16_16_01
    SolutionIndex: 107
    SolutionNameMin: Cijk_Alik_Bljk_SB_MT128x128x32_GRVW04_GSU01_SNLL1_TT08_08_VW04_WG16_16_01
    SolutionIndex: 108
    SolutionNameMin: Cijk_Alik_Bljk_SB_MT064x064x32_GRVW04_GSU01_SNLL1_TT04_04_VW04_WG16_16_01
    SolutionIndex: 109
    SolutionNameMin: Cijk_Alik_Bljk_SB_MT064x128x32_GRVW04_GSU01_SNLL1_TT04_08_VW04_WG16_16_01
    SolutionIndex: 110
    SolutionNameMin: Cijk_Alik_Bljk_SB_MT128x128x32_GRVW04_GSU01_SNLL1_TT08_08_VW04_WG16_16_01
    SolutionIndex: 111
    SolutionNameMin: Cijk_Alik_Bljk_SB_MT016x016x04_GRVW02_GSU01_SNLL0_TT02_02_VW02_WG08_08_01
    SolutionIndex: 112
    SolutionNameMin: Cijk_Alik_Bljk_SB_MT032x032x02_GRVW04_GSU01_SNLL0_TT04_04_VW04_WG08_08_01
    SolutionIndex: 113
    SolutionNameMin: Cijk_Alik_Bljk_SB_MT016x016x16_GRVW02_GSU01_SNLL1_TT02_02_VW02_WG08_08_04
    SolutionIndex: 114
    SolutionNameMin: Cijk_Alik_Bljk_SB_MT008x008x08_GRVW02_GSU02_SNLL0_TT02_02_VW02_WG04_04_04
    SolutionIndex: 115
    SolutionNameMin: Cijk_Alik_Bljk_SB_MT008x008x08_GRVW02_GSU04_SNLL0_TT02_02_VW02_WG04_04_04
    SolutionIndex: 116
    SolutionNameMin: Cijk_Alik_Bljk_SB_MT008x008x08_GRVW02_GSU08_SNLL0_TT02_02_VW02_WG04_04_04
    SolutionIndex: 117
    SolutionNameMin: Cijk_Alik_Bljk_SB_MT008x008x08_GRVW02_GSU16_SNLL0_TT02_02_VW02_WG04_04_04
    SolutionIndex: 118
    SolutionNameMin: Cijk_Alik_Bljk_SB_MT016x016x16_GRVW02_GSU16_SNLL0_TT02_02_VW02_WG08_08_04
    SolutionIndex: 119
    SolutionNameMin: Cijk_Alik_Bljk_SB_MT064x032x16_GRVW01_GSU04_LPA01_LPB01_PGR1_PLR1_TT04_04_USFGRO01_VW01_WG16_08_02_WGM01
    SolutionIndex: 120
    SolutionNameMin: Cijk_Alik_Bljk_SB_MT064x016x16_GRVW01_GSU04_LPA01_LPB01_PGR1_PLR1_TT04_04_USFGRO01_VW01_WG16_04_04_WGM01
    SolutionIndex: 121
    SolutionNameMin: Cijk_Alik_Bljk_SB_MT064x016x32_GRVW01_GSU08_LPA01_LPB01_PGR1_PLR1_TT04_04_USFGRO01_VW01_WG16_04_04_WGM01
    SolutionIndex: 122
    SolutionNameMin: Cijk_Alik_Bljk_SB_MT064x016x32_GRVW01_GSU08_LPA01_LPB01_PGR1_PLR1_TT04_04_USFGRO01_VW01_WG16_04_04_WGM08
    SolutionIndex: 123
    SolutionNameMin: Cijk_Alik_Bljk_SB_MT064x032x32_GRVW01_GSU01_LPA02_LPB02_PGR1_PLR1_TT04_08_USFGRO01_VW02_WG16_04_04_WGM01
    SolutionIndex: 124
    SolutionNameMin: Cijk_Alik_Bljk_SB_MT032x008x32_GRVW01_GSU08_LPA02_LPB02_PGR1_PLR1_TT02_02_USFGRO01_VW02_WG16_04_04_WGM01
    SolutionIndex: 125
    SolutionNameMin: Cijk_Alik_Bljk_SB_MT064x032x16_GRVW01_GSU01_LPA04_LPB04_PGR1_PLR1_TT04_04_USFGRO01_VW04_WG16_08_02_WGM01
    SolutionIndex: 126
    SolutionNameMin: Cijk_Alik_Bljk_SB_MT128x064x16_GRVW01_GSU01_LPA04_LPB04_PGR1_PLR1_TT04_08_USFGRO01_VW04_WG32_08_01_WGM01
    SolutionIndex: 127
    SolutionNameMin: Cijk_Alik_Bljk_SB_MT128x064x16_GRVW04_GSU01_LPA04_LPB04_PGR1_PLR1_TT04_08_USFGRO0_VW04_WG32_08_01_WGM01
    SolutionIndex: 128
    SolutionNameMin: Cijk_Alik_Bljk_SB_MT128x128x16_EPS1_GSU1_LPA0_LPB0_PGR1_SNLL1_TT8_8_VW2_WG16_16_1_WGM1
    SolutionIndex: 129
    SolutionNameMin: Cijk_Alik_Bljk_SB_MT64x32x16_EPS1_GSU3_LPA0_LPB0_PGR1_SNLL0_TT4_4_VW2_WG16_8_1_WGM1
    SolutionIndex: 130
    SolutionNameMin: Cijk_Alik_Bljk_SB_MT64x64x16_EPS1_GSU3_LPA0_LPB0_PGR1_SNLL0_TT4_4_VW2_WG16_16_1_WGM1
    SolutionIndex: 131
    SolutionNameMin: Cijk_Alik_Bljk_SB_MT128x128x16_EPS1_GSU3_LPA0_LPB0_PGR1_SNLL0_TT8_8_VW2_WG16_16_1_WGM1
    SolutionIndex: 132
    SolutionNameMin: Cijk_Alik_Bljk_SB_MT64x64x16_EPS1_GSU5_LPA0_LPB0_PGR1_SNLL0_TT4_4_VW2_WG16_16_1_WGM1
    SolutionIndex: 133
    SolutionNameMin: Cijk_Alik_Bljk_SB_MT128x128x16_EPS1_GSU5_LPA0_LPB0_PGR1_SNLL0_TT8_8_VW2_WG16_16_1_WGM1
    SolutionIndex: 134
    SolutionNameMin: Cijk_Alik_Bljk_SB_MT64x64x16_EPS1_GSU5_LPA0_LPB0_PGR1_SNLL0_TT4_4_VW2_WG16_16_1_WGM8
    SolutionIndex: 135
    SolutionNameMin: Cijk_Alik_Bljk_SB_MT64x64x16_EPS1_GSU3_LPA0_LPB0_PGR1_SNLL0_TT4_4_VW2_WG16_16_1_WGM64
    SolutionIndex: 136
    SolutionNameMin: Cijk_Alik_Bljk_SB_MT32x128x16_EPS1_GSU5_LPA0_LPB0_PGR1_SNLL0_TT4_4_VW2_WG8_32_1_WGM64
    SolutionIndex: 137
    SolutionNameMin: Cijk_Alik_Bljk_SB_MT64x64x16_EPS1_GSU5_LPA0_LPB0_PGR1_SNLL0_TT4_4_VW2_WG16_16_1_WGM64
    SolutionIndex: 138
    SolutionNameMin: Cijk_Alik_Bljk_SB_MT128x32x8_EPS1_GSU1_LPA0_LPB0_PGR1_SNLL1_TT4_4_VW4_WG32_8_1_WGM1
    SolutionIndex: 139
    SolutionNameMin: Cijk_Alik_Bljk_SB_MT128x128x16_EPS1_GSU1_LPA0_LPB0_PGR1_SNLL1_TT8_8_VW4_WG16_16_1_WGM1
    SolutionIndex: 140
    SolutionNameMin: Cijk_Alik_Bljk_SB_MT64x64x16_EPS1_GSU3_LPA0_LPB0_PGR1_SNLL0_TT4_4_VW4_WG16_16_1_WGM1
    SolutionIndex: 141
    SolutionNameMin: Cijk_Alik_Bljk_SB_MT128x128x16_EPS1_GSU1_LPA0_LPB0_PGR1_SNLL1_TT8_8_VW4_WG16_16_1_WGM8
    SolutionIndex: 142
    SolutionNameMin: Cijk_Alik_Bljk_SB_MT128x64x16_EPS0_GSU1_LPA0_LPB0_PGR0_SNLL0_TT4_8_VW4_WG32_8_1_WGM8
    SolutionIndex: 143
    SolutionNameMin: Cijk_Alik_Bljk_SB_MT64x32x16_EPS1_GSU1_LPA0_LPB0_PGR1_SNLL1_TT4_4_VW4_WG16_8_1_WGM64
    SolutionIndex: 144
    SolutionNameMin: Cijk_Alik_Bljk_SB_MT128x128x16_EPS1_GSU1_LPA0_LPB0_PGR1_SNLL1_TT8_8_VW4_WG16_16_1_WGM64
    SolutionIndex: 145
    SolutionNameMin: Cijk_Alik_Bljk_SB_MT128x64x16_EPS1_GSU1_LPA0_LPB0_PGR1_SNLL1_TT4_8_VW4_WG32_8_1_WGM64
    SolutionIndex: 146
    SolutionNameMin: Cijk_Alik_Bljk_SB_MT64x64x8_EPS1_GSU1_LPA2_LPB0_PGR1_SNLL1_TT4_8_VW2_WG16_8_1_WGM8
    SolutionIndex: 147
    SolutionNameMin: Cijk_Alik_Bljk_SB_MT64x32x16_EPS1_GSU3_LPA2_LPB0_PGR1_SNLL0_TT4_4_VW2_WG16_8_1_WGM1
    SolutionIndex: 148
    SolutionNameMin: Cijk_Alik_Bljk_SB_MT128x32x16_EPS1_GSU3_LPA2_LPB0_PGR1_SNLL0_TT4_4_VW2_WG32_8_1_WGM1
    SolutionIndex: 149
    SolutionNameMin: Cijk_Alik_Bljk_SB_MT64x64x16_EPS1_GSU5_LPA2_LPB0_PGR1_SNLL0_TT4_4_VW2_WG16_16_1_WGM1
    SolutionIndex: 150
    SolutionNameMin: Cijk_Alik_Bljk_SB_MT64x32x16_EPS0_GSU1_LPA2_LPB0_PGR0_SNLL0_TT4_4_VW2_WG16_8_1_WGM8
    SolutionIndex: 151
    SolutionNameMin: Cijk_Alik_Bljk_SB_MT64x64x16_EPS0_GSU1_LPA2_LPB0_PGR0_SNLL0_TT4_4_VW2_WG16_16_1_WGM8
    SolutionIndex: 152
    SolutionNameMin: Cijk_Alik_Bljk_SB_MT64x32x16_EPS1_GSU3_LPA2_LPB0_PGR1_SNLL0_TT4_4_VW2_WG16_8_1_WGM8
    SolutionIndex: 153
    SolutionNameMin: Cijk_Alik_Bljk_SB_MT64x64x16_EPS1_GSU5_LPA2_LPB0_PGR1_SNLL0_TT4_4_VW2_WG16_16_1_WGM8
    SolutionIndex: 154
    SolutionNameMin: Cijk_Alik_Bljk_SB_MT128x32x16_EPS1_GSU1_LPA2_LPB0_PGR1_SNLL1_TT4_4_VW2_WG32_8_1_WGM64
    SolutionIndex: 155
    SolutionNameMin: Cijk_Alik_Bljk_SB_MT64x32x16_EPS1_GSU5_LPA2_LPB0_PGR1_SNLL0_TT4_4_VW2_WG16_8_1_WGM64
    SolutionIndex: 156
    SolutionNameMin: Cijk_Alik_Bljk_SB_MT256x64x8_EPS1_GSU1_LPA4_LPB0_PGR1_SNLL1_TT8_8_VW4_WG32_8_1_WGM1
    SolutionIndex: 157
    SolutionNameMin: Cijk_Alik_Bljk_SB_MT128x128x8_EPS1_GSU1_LPA4_LPB0_PGR1_SNLL1_TT8_8_VW4_WG16_16_1_WGM8
    SolutionIndex: 158
    SolutionNameMin: Cijk_Alik_Bljk_SB_MT64x64x16_EPS1_GSU5_LPA4_LPB0_PGR1_SNLL0_TT4_4_VW4_WG16_16_1_WGM1
    SolutionIndex: 159
    SolutionNameMin: Cijk_Alik_Bljk_SB_MT64x64x16_EPS1_GSU1_LPA4_LPB0_PGR1_SNLL1_TT4_4_VW4_WG16_16_1_WGM8
    SolutionIndex: 160
    SolutionNameMin: Cijk_Alik_Bljk_SB_MT128x64x16_EPS1_GSU1_LPA4_LPB0_PGR1_SNLL1_TT8_4_VW4_WG16_16_1_WGM8
    SolutionIndex: 161
    SolutionNameMin: Cijk_Alik_Bljk_SB_MT128x64x16_EPS0_GSU1_LPA4_LPB0_PGR0_SNLL0_TT4_8_VW4_WG32_8_1_WGM8
    SolutionIndex: 162
    SolutionNameMin: Cijk_Alik_Bljk_SB_MT128x64x16_EPS1_GSU1_LPA4_LPB0_PGR1_SNLL1_TT4_8_VW4_WG32_8_1_WGM8
    SolutionIndex: 163
    SolutionNameMin: Cijk_Alik_Bljk_SB_MT64x64x16_EPS1_GSU1_LPA4_LPB0_PGR1_SNLL1_TT4_4_VW4_WG16_16_1_WGM64
    SolutionIndex: 164
    SolutionNameMin: Cijk_Alik_Bljk_SB_MT128x32x16_EPS0_GSU1_LPA4_LPB0_PGR0_SNLL0_TT4_4_VW4_WG32_8_1_WGM64
    SolutionIndex: 165
    SolutionNameMin: Cijk_Alik_Bljk_SB_MT64x32x16_EPS1_GSU5_LPA4_LPB0_PGR1_SNLL0_TT4_4_VW4_WG16_8_1_WGM64
    SolutionIndex: 166
    SolutionNameMin: Cijk_Alik_Bljk_SB_MT32x128x32_EPS1_GSU1_LPA4_LPB0_PGR1_SNLL1_TT4_4_VW4_WG8_32_1_WGM64
    SolutionIndex: 167
    SolutionNameMin: Cijk_Alik_Bljk_SB_MT128x64x8_EPS1_GSU1_LPA0_LPB2_PGR1_SNLL1_TT8_4_VW2_WG16_16_1_WGM8
    SolutionIndex: 168
    SolutionNameMin: Cijk_Alik_Bljk_SB_MT64x32x16_EPS1_GSU5_LPA0_LPB2_PGR1_SNLL0_TT4_4_VW2_WG16_8_1_WGM1
    SolutionIndex: 169
    SolutionNameMin: Cijk_Alik_Bljk_SB_MT64x64x16_EPS1_GSU5_LPA0_LPB2_PGR1_SNLL0_TT4_4_VW2_WG16_16_1_WGM1
    SolutionIndex: 170
    SolutionNameMin: Cijk_Alik_Bljk_SB_MT64x64x16_EPS1_GSU3_LPA0_LPB2_PGR1_SNLL0_TT4_4_VW2_WG16_16_1_WGM64
    SolutionIndex: 171
    SolutionNameMin: Cijk_Alik_Bljk_SB_MT64x32x16_EPS1_GSU5_LPA0_LPB2_PGR1_SNLL0_TT4_4_VW2_WG16_8_1_WGM64
    SolutionIndex: 172
    SolutionNameMin: Cijk_Alik_Bljk_SB_MT128x64x8_EPS1_GSU1_LPA0_LPB4_PGR1_SNLL1_TT4_8_VW4_WG32_8_1_WGM8
    SolutionIndex: 173
    SolutionNameMin: Cijk_Alik_Bljk_SB_MT64x32x16_EPS1_GSU1_LPA0_LPB4_PGR1_SNLL1_TT4_4_VW4_WG16_8_1_WGM1
    SolutionIndex: 174
    SolutionNameMin: Cijk_Alik_Bljk_SB_MT128x64x16_EPS0_GSU1_LPA0_LPB4_PGR0_SNLL0_TT8_4_VW4_WG16_16_1_WGM1
    SolutionIndex: 175
    SolutionNameMin: Cijk_Alik_Bljk_SB_MT64x32x16_EPS1_GSU5_LPA0_LPB4_PGR1_SNLL0_TT4_4_VW4_WG16_8_1_WGM1
    SolutionIndex: 176
    SolutionNameMin: Cijk_Alik_Bljk_SB_MT64x64x16_EPS1_GSU5_LPA0_LPB4_PGR1_SNLL0_TT4_4_VW4_WG16_16_1_WGM1
    SolutionIndex: 177
    SolutionNameMin: Cijk_Alik_Bljk_SB_MT64x128x16_EPS1_GSU1_LPA0_LPB4_PGR1_SNLL1_TT8_4_VW4_WG8_32_1_WGM8
    SolutionIndex: 178
    SolutionNameMin: Cijk_Alik_Bljk_SB_MT64x256x16_EPS1_GSU1_LPA0_LPB4_PGR1_SNLL1_TT8_8_VW4_WG8_32_1_WGM8
    SolutionIndex: 179
    SolutionNameMin: Cijk_Alik_Bljk_SB_MT64x128x16_EPS1_GSU1_LPA0_LPB4_PGR1_SNLL1_TT4_8_VW4_WG16_16_1_WGM8
    SolutionIndex: 180
    SolutionNameMin: Cijk_Alik_Bljk_SB_MT128x32x16_EPS0_GSU1_LPA0_LPB4_PGR0_SNLL0_TT4_4_VW4_WG32_8_1_WGM8
    SolutionIndex: 181
    SolutionNameMin: Cijk_Alik_Bljk_SB_MT64x32x16_EPS1_GSU5_LPA0_LPB4_PGR1_SNLL0_TT4_4_VW4_WG16_8_1_WGM8
    SolutionIndex: 182
    SolutionNameMin: Cijk_Alik_Bljk_SB_MT64x64x16_EPS1_GSU5_LPA0_LPB4_PGR1_SNLL0_TT4_4_VW4_WG16_16_1_WGM8
    SolutionIndex: 183
    SolutionNameMin: Cijk_Alik_Bljk_SB_MT64x32x16_EPS1_GSU1_LPA0_LPB4_PGR1_SNLL1_TT4_4_VW4_WG16_8_1_WGM64
    SolutionIndex: 184
    SolutionNameMin: Cijk_Alik_Bljk_SB_MT32x256x16_EPS1_GSU1_LPA0_LPB4_PGR1_SNLL1_TT4_8_VW4_WG8_32_1_WGM64
    SolutionIndex: 185
    SolutionNameMin: Cijk_Alik_Bljk_SB_MT64x128x16_EPS1_GSU1_LPA0_LPB4_PGR1_SNLL1_TT8_4_VW4_WG8_32_1_WGM64
    SolutionIndex: 186
    SolutionNameMin: Cijk_Alik_Bljk_SB_MT64x128x16_EPS1_GSU1_LPA0_LPB4_PGR1_SNLL1_TT4_8_VW4_WG16_16_1_WGM64
    SolutionIndex: 187
    SolutionNameMin: Cijk_Alik_Bljk_SB_MT128x64x16_EPS1_GSU1_LPA0_LPB4_PGR1_SNLL1_TT4_8_VW4_WG32_8_1_WGM64
    SolutionIndex: 188
    SolutionNameMin: Cijk_Alik_Bljk_SB_MT64x32x16_EPS1_GSU5_LPA0_LPB4_PGR1_SNLL0_TT4_4_VW4_WG16_8_1_WGM64
    SolutionIndex: 189
    SolutionNameMin: Cijk_Alik_Bljk_SB_MT32x128x32_EPS1_GSU5_LPA0_LPB4_PGR1_SNLL0_TT4_4_VW4_WG8_32_1_WGM8
    SolutionIndex: 190
    SolutionNameMin: Cijk_Alik_Bljk_SB_MT32x128x32_EPS1_GSU1_LPA0_LPB4_PGR1_SNLL1_TT4_4_VW4_WG8_32_1_WGM64
    SolutionIndex: 191
    SolutionNameMin: Cijk_Alik_Bljk_SB_MT128x32x8_EPS1_GSU1_LPA2_LPB2_PGR1_SNLL1_TT4_4_VW2_WG32_8_1_WGM64
    SolutionIndex: 192
    SolutionNameMin: Cijk_Alik_Bljk_SB_MT64x32x16_EPS1_GSU3_LPA2_LPB2_PGR1_SNLL0_TT4_4_VW2_WG16_8_1_WGM1
    SolutionIndex: 193
    SolutionNameMin: Cijk_Alik_Bljk_SB_MT32x128x16_EPS1_GSU3_LPA2_LPB2_PGR1_SNLL0_TT4_4_VW2_WG8_32_1_WGM1
    SolutionIndex: 194
    SolutionNameMin: Cijk_Alik_Bljk_SB_MT64x64x16_EPS1_GSU3_LPA2_LPB2_PGR1_SNLL0_TT4_4_VW2_WG16_16_1_WGM1
    SolutionIndex: 195
    SolutionNameMin: Cijk_Alik_Bljk_SB_MT64x128x16_EPS1_GSU3_LPA2_LPB2_PGR1_SNLL0_TT4_8_VW2_WG16_16_1_WGM1
    SolutionIndex: 196
    SolutionNameMin: Cijk_Alik_Bljk_SB_MT128x32x16_EPS1_GSU3_LPA2_LPB2_PGR1_SNLL0_TT4_4_VW2_WG32_8_1_WGM1
    SolutionIndex: 197
    SolutionNameMin: Cijk_Alik_Bljk_SB_MT64x32x16_EPS1_GSU5_LPA2_LPB2_PGR1_SNLL0_TT4_4_VW2_WG16_8_1_WGM1
    SolutionIndex: 198
    SolutionNameMin: Cijk_Alik_Bljk_SB_MT64x64x16_EPS0_GSU5_LPA2_LPB2_PGR0_SNLL0_TT4_4_VW2_WG16_16_1_WGM1
    SolutionIndex: 199
    SolutionNameMin: Cijk_Alik_Bljk_SB_MT64x64x16_EPS1_GSU5_LPA2_LPB2_PGR1_SNLL0_TT4_4_VW2_WG16_16_1_WGM1
    SolutionIndex: 200
    SolutionNameMin: Cijk_Alik_Bljk_SB_MT128x64x16_EPS1_GSU5_LPA2_LPB2_PGR1_SNLL0_TT8_4_VW2_WG16_16_1_WGM1
    SolutionIndex: 201
    SolutionNameMin: Cijk_Alik_Bljk_SB_MT128x64x16_EPS1_GSU5_LPA2_LPB2_PGR1_SNLL0_TT4_8_VW2_WG32_8_1_WGM1
    SolutionIndex: 202
    SolutionNameMin: Cijk_Alik_Bljk_SB_MT64x32x16_EPS1_GSU1_LPA2_LPB2_PGR1_SNLL1_TT4_4_VW2_WG16_8_1_WGM8
    SolutionIndex: 203
    SolutionNameMin: Cijk_Alik_Bljk_SB_MT64x64x16_EPS1_GSU1_LPA2_LPB2_PGR1_SNLL1_TT4_4_VW2_WG16_16_1_WGM8
    SolutionIndex: 204
    SolutionNameMin: Cijk_Alik_Bljk_SB_MT128x64x16_EPS1_GSU1_LPA2_LPB2_PGR1_SNLL1_TT8_4_VW2_WG16_16_1_WGM8
    SolutionIndex: 205
    SolutionNameMin: Cijk_Alik_Bljk_SB_MT64x128x16_EPS1_GSU3_LPA2_LPB2_PGR1_SNLL0_TT8_4_VW2_WG8_32_1_WGM8
    SolutionIndex: 206
    SolutionNameMin: Cijk_Alik_Bljk_SB_MT32x128x16_EPS1_GSU5_LPA2_LPB2_PGR1_SNLL0_TT4_4_VW2_WG8_32_1_WGM8
    SolutionIndex: 207
    SolutionNameMin: Cijk_Alik_Bljk_SB_MT64x128x16_EPS1_GSU5_LPA2_LPB2_PGR1_SNLL0_TT8_4_VW2_WG8_32_1_WGM8
    SolutionIndex: 208
    SolutionNameMin: Cijk_Alik_Bljk_SB_MT64x64x16_EPS1_GSU5_LPA2_LPB2_PGR1_SNLL0_TT4_4_VW2_WG16_16_1_WGM8
    SolutionIndex: 209
    SolutionNameMin: Cijk_Alik_Bljk_SB_MT64x128x16_EPS1_GSU5_LPA2_LPB2_PGR1_SNLL0_TT4_8_VW2_WG16_16_1_WGM8
    SolutionIndex: 210
    SolutionNameMin: Cijk_Alik_Bljk_SB_MT64x64x16_EPS1_GSU1_LPA2_LPB2_PGR1_SNLL1_TT4_4_VW2_WG16_16_1_WGM64
    SolutionIndex: 211
    SolutionNameMin: Cijk_Alik_Bljk_SB_MT64x128x16_EPS1_GSU1_LPA2_LPB2_PGR1_SNLL1_TT4_8_VW2_WG16_16_1_WGM64
    SolutionIndex: 212
    SolutionNameMin: Cijk_Alik_Bljk_SB_MT64x128x16_EPS1_GSU3_LPA2_LPB2_PGR1_SNLL0_TT4_8_VW2_WG16_16_1_WGM64
    SolutionIndex: 213
    SolutionNameMin: Cijk_Alik_Bljk_SB_MT128x64x16_EPS1_GSU3_LPA2_LPB2_PGR1_SNLL0_TT8_4_VW2_WG16_16_1_WGM64
    SolutionIndex: 214
    SolutionNameMin: Cijk_Alik_Bljk_SB_MT64x32x16_EPS1_GSU5_LPA2_LPB2_PGR1_SNLL0_TT4_4_VW2_WG16_8_1_WGM64
    SolutionIndex: 215
    SolutionNameMin: Cijk_Alik_Bljk_SB_MT64x64x16_EPS1_GSU5_LPA2_LPB2_PGR1_SNLL0_TT4_4_VW2_WG16_16_1_WGM64
    SolutionIndex: 216
    SolutionNameMin: Cijk_Alik_Bljk_SB_MT32x128x32_EPS1_GSU5_LPA2_LPB2_PGR1_SNLL0_TT4_4_VW2_WG8_32_1_WGM1
    SolutionIndex: 217
    SolutionNameMin: Cijk_Alik_Bljk_SB_MT64x128x32_EPS1_GSU1_LPA2_LPB2_PGR1_SNLL1_TT8_4_VW2_WG8_32_1_WGM8
    SolutionIndex: 218
    SolutionNameMin: Cijk_Alik_Bljk_SB_MT64x64x32_EPS1_GSU5_LPA2_LPB2_PGR1_SNLL0_TT4_4_VW2_WG16_16_1_WGM64
    SolutionIndex: 219
    SolutionNameMin: Cijk_Alik_Bljk_SB_MT128x32x8_EPS1_GSU1_LPA4_LPB4_PGR1_SNLL1_TT4_4_VW4_WG32_8_1_WGM8
    SolutionIndex: 220
    SolutionNameMin: Cijk_Alik_Bljk_SB_MT128x64x8_EPS1_GSU1_LPA4_LPB4_PGR1_SNLL1_TT4_8_VW4_WG32_8_1_WGM8
    SolutionIndex: 221
    SolutionNameMin: Cijk_Alik_Bljk_SB_MT64x32x16_EPS1_GSU1_LPA4_LPB4_PGR1_SNLL1_TT4_4_VW4_WG16_8_1_WGM1
    SolutionIndex: 222
    SolutionNameMin: Cijk_Alik_Bljk_SB_MT32x128x16_EPS1_GSU1_LPA4_LPB4_PGR1_SNLL1_TT4_4_VW4_WG8_32_1_WGM1
    SolutionIndex: 223
    SolutionNameMin: Cijk_Alik_Bljk_SB_MT64x64x16_EPS1_GSU1_LPA4_LPB4_PGR1_SNLL1_TT4_4_VW4_WG16_16_1_WGM1
    SolutionIndex: 224
    SolutionNameMin: Cijk_Alik_Bljk_SB_MT128x64x16_EPS1_GSU1_LPA4_LPB4_PGR1_SNLL1_TT8_4_VW4_WG16_16_1_WGM1
    SolutionIndex: 225
    SolutionNameMin: Cijk_Alik_Bljk_SB_MT128x32x16_EPS1_GSU1_LPA4_LPB4_PGR1_SNLL1_TT4_4_VW4_WG32_8_1_WGM1
    SolutionIndex: 226
    SolutionNameMin: Cijk_Alik_Bljk_SB_MT128x64x16_EPS1_GSU1_LPA4_LPB4_PGR1_SNLL1_TT4_8_VW4_WG32_8_1_WGM1
    SolutionIndex: 227
    SolutionNameMin: Cijk_Alik_Bljk_SB_MT256x32x16_EPS0_GSU1_LPA4_LPB4_PGR0_SNLL0_TT8_4_VW4_WG32_8_1_WGM1
    SolutionIndex: 228
    SolutionNameMin: Cijk_Alik_Bljk_SB_MT128x64x16_EPS1_GSU3_LPA4_LPB4_PGR1_SNLL0_TT8_4_VW4_WG16_16_1_WGM1
    SolutionIndex: 229
    SolutionNameMin: Cijk_Alik_Bljk_SB_MT64x32x16_EPS1_GSU5_LPA4_LPB4_PGR1_SNLL0_TT4_4_VW4_WG16_8_1_WGM1
    SolutionIndex: 230
    SolutionNameMin: Cijk_Alik_Bljk_SB_MT64x128x16_EPS1_GSU1_LPA4_LPB4_PGR1_SNLL1_TT8_4_VW4_WG8_32_1_WGM8
    SolutionIndex: 231
    SolutionNameMin: Cijk_Alik_Bljk_SB_MT64x64x16_EPS1_GSU1_LPA4_LPB4_PGR1_SNLL1_TT4_4_VW4_WG16_16_1_WGM8
    SolutionIndex: 232
    SolutionNameMin: Cijk_Alik_Bljk_SB_MT64x128x16_EPS1_GSU1_LPA4_LPB4_PGR1_SNLL1_TT4_8_VW4_WG16_16_1_WGM8
    SolutionIndex: 233
    SolutionNameMin: Cijk_Alik_Bljk_SB_MT128x64x16_EPS1_GSU1_LPA4_LPB4_PGR1_SNLL1_TT8_4_VW4_WG16_16_1_WGM8
    SolutionIndex: 234
    SolutionNameMin: Cijk_Alik_Bljk_SB_MT128x128x16_EPS1_GSU1_LPA4_LPB4_PGR1_SNLL1_TT8_8_VW4_WG16_16_1_WGM8
    SolutionIndex: 235
    SolutionNameMin: Cijk_Alik_Bljk_SB_MT128x32x16_EPS0_GSU1_LPA4_LPB4_PGR0_SNLL0_TT4_4_VW4_WG32_8_1_WGM8
    SolutionIndex: 236
    SolutionNameMin: Cijk_Alik_Bljk_SB_MT128x32x16_EPS1_GSU1_LPA4_LPB4_PGR1_SNLL1_TT4_4_VW4_WG32_8_1_WGM8
    SolutionIndex: 237
    SolutionNameMin: Cijk_Alik_Bljk_SB_MT128x64x16_EPS1_GSU1_LPA4_LPB4_PGR1_SNLL1_TT4_8_VW4_WG32_8_1_WGM8
    SolutionIndex: 238
    SolutionNameMin: Cijk_Alik_Bljk_SB_MT64x32x16_EPS1_GSU5_LPA4_LPB4_PGR1_SNLL0_TT4_4_VW4_WG16_8_1_WGM8
    SolutionIndex: 239
    SolutionNameMin: Cijk_Alik_Bljk_SB_MT64x32x16_EPS1_GSU1_LPA4_LPB4_PGR1_SNLL1_TT4_4_VW4_WG16_8_1_WGM64
    SolutionIndex: 240
    SolutionNameMin: Cijk_Alik_Bljk_SB_MT32x128x16_EPS1_GSU1_LPA4_LPB4_PGR1_SNLL1_TT4_4_VW4_WG8_32_1_WGM64
    SolutionIndex: 241
    SolutionNameMin: Cijk_Alik_Bljk_SB_MT64x128x16_EPS1_GSU1_LPA4_LPB4_PGR1_SNLL1_TT8_4_VW4_WG8_32_1_WGM64
    SolutionIndex: 242
    SolutionNameMin: Cijk_Alik_Bljk_SB_MT64x64x16_EPS1_GSU1_LPA4_LPB4_PGR1_SNLL1_TT4_4_VW4_WG16_16_1_WGM64
    SolutionIndex: 243
    SolutionNameMin: Cijk_Alik_Bljk_SB_MT64x128x16_EPS1_GSU1_LPA4_LPB4_PGR1_SNLL1_TT4_8_VW4_WG16_16_1_WGM64
    SolutionIndex: 244
    SolutionNameMin: Cijk_Alik_Bljk_SB_MT128x64x16_EPS1_GSU1_LPA4_LPB4_PGR1_SNLL1_TT8_4_VW4_WG16_16_1_WGM64
    SolutionIndex: 245
    SolutionNameMin: Cijk_Alik_Bljk_SB_MT128x128x16_EPS1_GSU1_LPA4_LPB4_PGR1_SNLL1_TT8_8_VW4_WG16_16_1_WGM64
    SolutionIndex: 246
    SolutionNameMin: Cijk_Alik_Bljk_SB_MT128x32x16_EPS1_GSU1_LPA4_LPB4_PGR1_SNLL1_TT4_4_VW4_WG32_8_1_WGM64
    SolutionIndex: 247
    SolutionNameMin: Cijk_Alik_Bljk_SB_MT128x64x16_EPS1_GSU1_LPA4_LPB4_PGR1_SNLL1_TT4_8_VW4_WG32_8_1_WGM64
    SolutionIndex: 248
    SolutionNameMin: Cijk_Alik_Bljk_SB_MT32x128x16_EPS1_GSU5_LPA4_LPB4_PGR1_SNLL0_TT4_4_VW4_WG8_32_1_WGM64
    SolutionIndex: 249
    SolutionNameMin: Cijk_Alik_Bljk_SB_MT32x128x32_EPS1_GSU1_LPA4_LPB4_PGR1_SNLL1_TT4_4_VW4_WG8_32_1_WGM1
    SolutionIndex: 250
    SolutionNameMin: Cijk_Alik_Bljk_SB_MT64x64x32_EPS1_GSU1_LPA4_LPB4_PGR1_SNLL1_TT4_4_VW4_WG16_16_1_WGM1
    SolutionIndex: 251
    SolutionNameMin: Cijk_Alik_Bljk_SB_MT32x128x32_EPS1_GSU5_LPA4_LPB4_PGR1_SNLL0_TT4_4_VW4_WG8_32_1_WGM1
    SolutionIndex: 252
    SolutionNameMin: Cijk_Alik_Bljk_SB_MT64x64x32_EPS1_GSU1_LPA4_LPB4_PGR1_SNLL1_TT4_4_VW4_WG16_16_1_WGM8
    SolutionIndex: 253
    SolutionNameMin: Cijk_Alik_Bljk_SB_MT64x128x32_EPS1_GSU1_LPA4_LPB4_PGR1_SNLL1_TT4_8_VW4_WG16_16_1_WGM8
    SolutionIndex: 254
    SolutionNameMin: Cijk_Alik_Bljk_SB_MT64x64x32_EPS1_GSU1_LPA4_LPB4_PGR1_SNLL1_TT4_4_VW4_WG16_16_1_WGM64
    SolutionIndex: 255
    SolutionNameMin: Cijk_Alik_Bljk_SB_MT64x128x32_EPS1_GSU1_LPA4_LPB4_PGR1_SNLL1_TT4_8_VW4_WG16_16_1_WGM64
    SolutionIndex: 256
    SolutionNameMin: Cijk_Alik_Bljk_SB_MT064x008x32_GRVW02_GSU32_SNLL0_TT04_02_VW02_WG16_04_04
    SolutionIndex: 257
    SolutionNameMin: Cijk_Alik_Bljk_SB_MT064x008x32_GRVW04_GSU32_SNLL0_TT04_04_VW04_WG16_02_08
    SolutionIndex: 258
    SolutionNameMin: Cijk_Alik_Bljk_SB_MT064x016x64_GRVW04_GSU32_SNLL0_TT04_04_VW04_WG16_04_04
    SolutionIndex: 259
    SolutionNameMin: Cijk_Alik_Bljk_SB_MT064x016x64_GRVW04_GSU32_SNLL0_TT04_04_VW04_WG16_04_04
    SolutionIndex: 260
    SolutionNameMin: Cijk_Alik_Bljk_SB_MT036x048x16_GRVW01_GSU02_SNLL0_TT03_03_VW01_WG12_16_01
    SolutionIndex: 261
    SolutionNameMin: Cijk_Alik_Bljk_SB_MT048x036x16_GRVW01_GSU08_SNLL0_TT06_03_VW01_WG08_12_02
    SolutionIndex: 262
    SolutionNameMin: Cijk_Alik_Bljk_SB_MT048x048x16_GRVW02_GSU08_SNLL0_TT06_04_VW02_WG08_12_02
    SolutionIndex: 263
    SolutionNameMin: Cijk_Alik_Bljk_SB_MT048x048x16_GRVW01_GSU08_SNLL0_TT03_03_VW01_WG16_16_01
    SolutionIndex: 264
    SolutionNameMin: Cijk_Alik_Bljk_SB_MT032x008x08_GRVW02_GSU01_SNLL0_TT02_02_VW02_WG16_04_01
    SolutionIndex: 265
    SolutionNameMin: Cijk_Alik_Bljk_SB_MT016x016x08_GRVW02_GSU01_SNLL0_TT02_02_VW02_WG08_08_01
    SolutionIndex: 266
    SolutionNameMin: Cijk_Alik_Bljk_SB_MT032x016x08_GRVW02_GSU01_SNLL0_TT04_02_VW02_WG08_08_01
    SolutionIndex: 267
    SolutionNameMin: Cijk_Alik_Bljk_SB_MT032x032x08_GRVW04_GSU01_SNLL0_TT04_04_VW04_WG08_08_01
    SolutionIndex: 268
    SolutionNameMin: Cijk_Alik_Bljk_SB_MT032x016x08_GRVW02_GSU01_SNLL0_TT02_02_VW02_WG16_08_01
    SolutionIndex: 269
    SolutionNameMin: Cijk_Alik_Bljk_SB_MT016x016x08_GRVW02_GSU01_SNLL0_TT02_02_VW02_WG08_08_01
    SolutionIndex: 270
    SolutionNameMin: Cijk_Alik_Bljk_SB_MT032x032x08_GRVW04_GSU01_SNLL0_TT04_04_VW04_WG08_08_01
    SolutionIndex: 271
    SolutionNameMin: Cijk_Alik_Bljk_SB_MT032x016x08_GRVW02_GSU01_SNLL0_TT02_02_VW02_WG16_08_01
    SolutionIndex: 272
    SolutionNameMin: Cijk_Alik_Bljk_SB_MT064x008x16_GRVW02_GSU01_SNLL0_TT02_02_VW02_WG32_04_01
    SolutionIndex: 273
    SolutionNameMin: Cijk_Alik_Bljk_SB_MT032x008x16_GRVW02_GSU01_SNLL0_TT02_02_VW02_WG16_04_01
    SolutionIndex: 274
    SolutionNameMin: Cijk_Alik_Bljk_SB_MT016x016x16_GRVW02_GSU01_SNLL0_TT02_02_VW02_WG08_08_01
    SolutionIndex: 275
    SolutionNameMin: Cijk_Alik_Bljk_SB_MT032x016x16_GRVW02_GSU01_SNLL0_TT04_02_VW02_WG08_08_01
    SolutionIndex: 276
    SolutionNameMin: Cijk_Alik_Bljk_SB_MT032x032x16_GRVW04_GSU01_SNLL0_TT04_04_VW04_WG08_08_01
    SolutionIndex: 277
    SolutionNameMin: Cijk_Alik_Bljk_SB_MT032x016x16_GRVW02_GSU01_SNLL0_TT02_02_VW02_WG16_08_01
    SolutionIndex: 278
    SolutionNameMin: Cijk_Alik_Bljk_SB_MT064x016x16_GRVW02_GSU01_SNLL0_TT04_02_VW02_WG16_08_01
    SolutionIndex: 279
    SolutionNameMin: Cijk_Alik_Bljk_SB_MT064x032x16_GRVW04_GSU01_SNLL0_TT04_04_VW04_WG16_08_01
    SolutionIndex: 280
    SolutionNameMin: Cijk_Alik_Bljk_SB_MT064x008x16_GRVW02_GSU01_SNLL0_TT02_02_VW02_WG32_04_01
    SolutionIndex: 281
    SolutionNameMin: Cijk_Alik_Bljk_SB_MT032x008x16_GRVW02_GSU01_SNLL0_TT02_02_VW02_WG16_04_01
    SolutionIndex: 282
    SolutionNameMin: Cijk_Alik_Bljk_SB_MT032x016x16_GRVW02_GSU01_SNLL0_TT02_02_VW02_WG16_08_01
    SolutionIndex: 283
    SolutionNameMin: Cijk_Alik_Bljk_SB_MT064x032x16_GRVW04_GSU01_SNLL0_TT04_04_VW04_WG16_08_01
    SolutionIndex: 284
    SolutionNameMin: Cijk_Alik_Bljk_SB_MT032x032x08_GRVW04_GSU02_SNLL0_TT04_04_VW04_WG08_08_04
    SolutionIndex: 285
    SolutionNameMin: Cijk_Alik_Bljk_SB_MT016x016x08_GRVW02_GSU08_SNLL0_TT02_02_VW02_WG08_08_02
    SolutionIndex: 286
    SolutionNameMin: Cijk_Alik_Bljk_SB_MT032x032x08_GRVW04_GSU08_SNLL0_TT04_04_VW04_WG08_08_04
    SolutionIndex: 287
    SolutionNameMin: Cijk_Alik_Bljk_SB_MT032x016x16_GRVW02_GSU02_SNLL0_TT04_02_VW02_WG08_08_02
    SolutionIndex: 288
    SolutionNameMin: Cijk_Alik_Bljk_SB_MT032x032x16_GRVW04_GSU02_SNLL0_TT04_04_VW04_WG08_08_02
    SolutionIndex: 289
    SolutionNameMin: Cijk_Alik_Bljk_SB_MT064x032x16_GRVW04_GSU02_SNLL0_TT08_04_VW04_WG08_08_02
    SolutionIndex: 290
    SolutionNameMin: Cijk_Alik_Bljk_SB_MT016x016x16_GRVW02_GSU02_SNLL0_TT02_02_VW02_WG08_08_04
    SolutionIndex: 291
    SolutionNameMin: Cijk_Alik_Bljk_SB_MT032x016x16_GRVW02_GSU02_SNLL0_TT04_02_VW02_WG08_08_04
    SolutionIndex: 292
    SolutionNameMin: Cijk_Alik_Bljk_SB_MT032x016x16_GRVW02_GSU02_SNLL0_TT02_02_VW02_WG16_08_02
    SolutionIndex: 293
    SolutionNameMin: Cijk_Alik_Bljk_SB_MT064x016x16_GRVW02_GSU02_SNLL0_TT04_02_VW02_WG16_08_02
    SolutionIndex: 294
    SolutionNameMin: Cijk_Alik_Bljk_SB_MT128x064x16_GRVW04_GSU02_SNLL0_TT08_08_VW04_WG16_08_02
    SolutionIndex: 295
    SolutionNameMin: Cijk_Alik_Bljk_SB_MT032x016x16_GRVW02_GSU02_SNLL0_TT04_02_VW02_WG08_08_02
    SolutionIndex: 296
    SolutionNameMin: Cijk_Alik_Bljk_SB_MT032x032x16_GRVW04_GSU02_SNLL0_TT04_04_VW04_WG08_08_02
    SolutionIndex: 297
    SolutionNameMin: Cijk_Alik_Bljk_SB_MT064x032x16_GRVW04_GSU02_SNLL0_TT08_04_VW04_WG08_08_02
    SolutionIndex: 298
    SolutionNameMin: Cijk_Alik_Bljk_SB_MT016x016x16_GRVW02_GSU02_SNLL0_TT02_02_VW02_WG08_08_04
    SolutionIndex: 299
    SolutionNameMin: Cijk_Alik_Bljk_SB_MT032x016x16_GRVW02_GSU02_SNLL0_TT04_02_VW02_WG08_08_04
    SolutionIndex: 300
    SolutionNameMin: Cijk_Alik_Bljk_SB_MT032x016x16_GRVW02_GSU02_SNLL0_TT02_02_VW02_WG16_08_02
    SolutionIndex: 301
    SolutionNameMin: Cijk_Alik_Bljk_SB_MT128x064x16_GRVW04_GSU02_SNLL0_TT08_08_VW04_WG16_08_02
    SolutionIndex: 302
    SolutionNameMin: Cijk_Alik_Bljk_SB_MT064x016x16_GRVW04_GSU04_SNLL0_TT04_04_VW04_WG16_04_04
    SolutionIndex: 303
    SolutionNameMin: Cijk_Alik_Bljk_SB_MT032x032x16_GRVW04_GSU04_SNLL0_TT04_04_VW04_WG08_08_02
    SolutionIndex: 304
    SolutionNameMin: Cijk_Alik_Bljk_SB_MT064x032x16_GRVW04_GSU04_SNLL0_TT08_04_VW04_WG08_08_02
    SolutionIndex: 305
    SolutionNameMin: Cijk_Alik_Bljk_SB_MT016x016x16_GRVW02_GSU04_SNLL0_TT02_02_VW02_WG08_08_04
    SolutionIndex: 306
    SolutionNameMin: Cijk_Alik_Bljk_SB_MT032x016x16_GRVW02_GSU04_SNLL0_TT04_02_VW02_WG08_08_04
    SolutionIndex: 307
    SolutionNameMin: Cijk_Alik_Bljk_SB_MT032x016x16_GRVW02_GSU04_SNLL0_TT02_02_VW02_WG16_08_02
    SolutionIndex: 308
    SolutionNameMin: Cijk_Alik_Bljk_SB_MT032x016x16_GRVW02_GSU04_SNLL0_TT04_02_VW02_WG08_08_02
    SolutionIndex: 309
    SolutionNameMin: Cijk_Alik_Bljk_SB_MT032x032x16_GRVW04_GSU04_SNLL0_TT04_04_VW04_WG08_08_02
    SolutionIndex: 310
    SolutionNameMin: Cijk_Alik_Bljk_SB_MT064x032x16_GRVW04_GSU04_SNLL0_TT08_04_VW04_WG08_08_02
    SolutionIndex: 311
    SolutionNameMin: Cijk_Alik_Bljk_SB_MT016x016x16_GRVW02_GSU04_SNLL0_TT02_02_VW02_WG08_08_04
    SolutionIndex: 312
    SolutionNameMin: Cijk_Alik_Bljk_SB_MT032x016x16_GRVW02_GSU04_SNLL0_TT04_02_VW02_WG08_08_04
    SolutionIndex: 313
    SolutionNameMin: Cijk_Alik_Bljk_SB_MT032x016x16_GRVW02_GSU04_SNLL0_TT02_02_VW02_WG16_08_02
    SolutionIndex: 314
    SolutionNameMin: Cijk_Alik_Bljk_SB_MT128x064x16_GRVW04_GSU04_SNLL0_TT08_08_VW04_WG16_08_02
    SolutionIndex: 315
    SolutionNameMin: Cijk_Alik_Bljk_SB_MT016x016x16_GRVW02_GSU08_SNLL0_TT02_02_VW02_WG08_08_04
    SolutionIndex: 316
    SolutionNameMin: Cijk_Alik_Bljk_SB_MT016x016x16_GRVW02_GSU08_SNLL0_TT02_02_VW02_WG08_08_04
    SolutionIndex: 317
    SolutionNameMin: Cijk_Alik_Bljk_SB_MT032x016x16_GRVW02_GSU08_SNLL0_TT02_02_VW02_WG16_08_02
    SolutionIndex: 318
    SolutionNameMin: Cijk_Alik_Bljk_SB_MT064x064x24_GRVW04_GSU02_SNLL0_TT08_08_VW04_WG08_08_02
    SolutionIndex: 319
    SolutionNameMin: Cijk_Alik_Bljk_SB_MT064x064x24_GRVW04_GSU02_SNLL0_TT08_08_VW04_WG08_08_02
    SolutionIndex: 320
    SolutionNameMin: Cijk_Alik_Bljk_SB_MT064x064x24_GRVW04_GSU04_SNLL0_TT08_08_VW04_WG08_08_02
    SolutionIndex: 321
    SolutionNameMin: Cijk_Alik_Bljk_SB_MT064x064x24_GRVW04_GSU04_SNLL0_TT08_08_VW04_WG08_08_02
    SolutionIndex: 322
    SolutionNameMin: Cijk_Alik_Bljk_SB_MT032x032x32_GRVW04_GSU02_SNLL0_TT04_04_VW04_WG08_08_02
    SolutionIndex: 323
    SolutionNameMin: Cijk_Alik_Bljk_SB_MT032x032x32_GRVW04_GSU02_SNLL0_TT04_04_VW04_WG08_08_04
    SolutionIndex: 324
    SolutionNameMin: Cijk_Alik_Bljk_SB_MT064x032x32_GRVW04_GSU02_SNLL0_TT08_04_VW04_WG08_08_04
    SolutionIndex: 325
    SolutionNameMin: Cijk_Alik_Bljk_SB_MT128x032x32_GRVW04_GSU02_SNLL0_TT08_04_VW04_WG16_08_02
    SolutionIndex: 326
    SolutionNameMin: Cijk_Alik_Bljk_SB_MT032x032x32_GRVW04_GSU02_SNLL0_TT04_04_VW04_WG08_08_04
    SolutionIndex: 327
    SolutionNameMin: Cijk_Alik_Bljk_SB_MT064x032x32_GRVW04_GSU02_SNLL0_TT08_04_VW04_WG08_08_04
    SolutionIndex: 328
    SolutionNameMin: Cijk_Alik_Bljk_SB_MT064x064x32_GRVW04_GSU02_SNLL0_TT08_08_VW04_WG08_08_04
    SolutionIndex: 329
    SolutionNameMin: Cijk_Alik_Bljk_SB_MT064x032x32_GRVW04_GSU02_SNLL0_TT04_04_VW04_WG16_08_02
    SolutionIndex: 330
    SolutionNameMin: Cijk_Alik_Bljk_SB_MT032x008x32_GRVW02_GSU04_SNLL0_TT02_02_VW02_WG16_04_04
    SolutionIndex: 331
    SolutionNameMin: Cijk_Alik_Bljk_SB_MT064x064x32_GRVW04_GSU04_SNLL0_TT08_08_VW04_WG08_08_02
    SolutionIndex: 332
    SolutionNameMin: Cijk_Alik_Bljk_SB_MT032x032x32_GRVW04_GSU04_SNLL0_TT04_04_VW04_WG08_08_04
    SolutionIndex: 333
    SolutionNameMin: Cijk_Alik_Bljk_SB_MT032x032x32_GRVW04_GSU04_SNLL0_TT04_04_VW04_WG08_08_04
    SolutionIndex: 334
    SolutionNameMin: Cijk_Alik_Bljk_SB_MT064x032x32_GRVW04_GSU04_SNLL0_TT08_04_VW04_WG08_08_04
    SolutionIndex: 335
    SolutionNameMin: Cijk_Alik_Bljk_SB_MT064x032x32_GRVW04_GSU04_SNLL0_TT04_04_VW04_WG16_08_02
    SolutionIndex: 336
    SolutionNameMin: Cijk_Alik_Bljk_SB_MT064x064x16_GRVW04_GSU01_SNLL0_TT04_04_VW04_WG16_16_01
    SolutionIndex: 337
    SolutionNameMin: Cijk_Alik_Bljk_SB_MT064x128x16_GRVW04_GSU01_SNLL0_TT04_08_VW04_WG16_16_01
    SolutionIndex: 338
    SolutionNameMin: Cijk_Alik_Bljk_SB_MT096x128x16_GRVW02_GSU01_SNLL0_TT06_08_VW02_WG16_16_01
    SolutionIndex: 339
    SolutionNameMin: Cijk_Alik_Bljk_SB_MT128x064x16_GRVW04_GSU01_SNLL0_TT08_04_VW04_WG16_16_01
    SolutionIndex: 340
    SolutionNameMin: Cijk_Alik_Bljk_SB_MT064x064x16_GRVW04_GSU01_SNLL0_TT04_04_VW04_WG16_16_01
    SolutionIndex: 341
    SolutionNameMin: Cijk_Alik_Bljk_SB_MT064x128x16_GRVW04_GSU01_SNLL0_TT04_08_VW04_WG16_16_01
    SolutionIndex: 342
    SolutionNameMin: Cijk_Alik_Bljk_SB_MT128x064x16_GRVW04_GSU01_SNLL0_TT08_04_VW04_WG16_16_01
    SolutionIndex: 343
    SolutionNameMin: Cijk_Alik_Bljk_SB_MT064x064x32_GRVW04_GSU01_SNLL0_TT04_04_VW04_WG16_16_01
    SolutionIndex: 344
    SolutionNameMin: Cijk_Alik_Bljk_SB_MT064x064x32_GRVW04_GSU01_SNLL0_TT04_04_VW04_WG16_16_01
    SolutionIndex: 345
    SolutionNameMin: Cijk_Alik_Bljk_SB_MT128x128x08_GRVW04_GSU01_SNLL1_TT08_08_VW04_WG16_16_01
    SolutionIndex: 346
    SolutionNameMin: Cijk_Alik_Bljk_SB_MT128x128x08_GRVW04_GSU01_SNLL1_TT08_08_VW04_WG16_16_01
    SolutionIndex: 347
    SolutionNameMin: Cijk_Alik_Bljk_SB_MT064x064x16_GRVW04_GSU01_SNLL1_TT04_04_VW04_WG16_16_01
    SolutionIndex: 348
    SolutionNameMin: Cijk_Alik_Bljk_SB_MT064x128x16_GRVW04_GSU01_SNLL1_TT04_08_VW04_WG16_16_01
    SolutionIndex: 349
    SolutionNameMin: Cijk_Alik_Bljk_SB_MT096x128x16_GRVW02_GSU01_SNLL1_TT06_08_VW02_WG16_16_01
    SolutionIndex: 350
    SolutionNameMin: Cijk_Alik_Bljk_SB_MT128x064x16_GRVW04_GSU01_SNLL1_TT08_04_VW04_WG16_16_01
    SolutionIndex: 351
    SolutionNameMin: Cijk_Alik_Bljk_SB_MT128x096x16_GRVW02_GSU01_SNLL1_TT08_06_VW02_WG16_16_01
    SolutionIndex: 352
    SolutionNameMin: Cijk_Alik_Bljk_SB_MT128x128x16_GRVW04_GSU01_SNLL1_TT08_08_VW04_WG16_16_01
    SolutionIndex: 353
    SolutionNameMin: Cijk_Alik_Bljk_SB_MT064x064x16_GRVW04_GSU01_SNLL1_TT04_04_VW04_WG16_16_01
    SolutionIndex: 354
    SolutionNameMin: Cijk_Alik_Bljk_SB_MT064x128x16_GRVW04_GSU01_SNLL1_TT04_08_VW04_WG16_16_01
    SolutionIndex: 355
    SolutionNameMin: Cijk_Alik_Bljk_SB_MT096x128x16_GRVW02_GSU01_SNLL1_TT06_08_VW02_WG16_16_01
    SolutionIndex: 356
    SolutionNameMin: Cijk_Alik_Bljk_SB_MT128x064x16_GRVW04_GSU01_SNLL1_TT08_04_VW04_WG16_16_01
    SolutionIndex: 357
    SolutionNameMin: Cijk_Alik_Bljk_SB_MT128x096x16_GRVW02_GSU01_SNLL1_TT08_06_VW02_WG16_16_01
    SolutionIndex: 358
    SolutionNameMin: Cijk_Alik_Bljk_SB_MT128x128x16_GRVW04_GSU01_SNLL1_TT08_08_VW04_WG16_16_01
    SolutionIndex: 359
    SolutionNameMin: Cijk_Alik_Bljk_SB_MT128x128x24_GRVW04_GSU01_SNLL1_TT08_08_VW04_WG16_16_01
    SolutionIndex: 360
    SolutionNameMin: Cijk_Alik_Bljk_SB_MT128x128x24_GRVW04_GSU01_SNLL1_TT08_08_VW04_WG16_16_01
    SolutionIndex: 361
    SolutionNameMin: Cijk_Alik_Bljk_SB_MT064x064x32_GRVW04_GSU01_SNLL1_TT04_04_VW04_WG16_16_01
    SolutionIndex: 362
    SolutionNameMin: Cijk_Alik_Bljk_SB_MT064x128x32_GRVW04_GSU01_SNLL1_TT04_08_VW04_WG16_16_01
    SolutionIndex: 363
    SolutionNameMin: Cijk_Alik_Bljk_SB_MT128x128x32_GRVW04_GSU01_SNLL1_TT08_08_VW04_WG16_16_01
    SolutionIndex: 364
    SolutionNameMin: Cijk_Alik_Bljk_SB_MT064x064x32_GRVW04_GSU01_SNLL1_TT04_04_VW04_WG16_16_01
    SolutionIndex: 365
    SolutionNameMin: Cijk_Alik_Bljk_SB_MT064x128x32_GRVW04_GSU01_SNLL1_TT04_08_VW04_WG16_16_01
    SolutionIndex: 366
    SolutionNameMin: Cijk_Alik_Bljk_SB_MT128x128x32_GRVW04_GSU01_SNLL1_TT08_08_VW04_WG16_16_01
    SolutionIndex: 367
    SolutionNameMin: Cijk_Alik_Bljk_SB_MT016x016x04_GRVW02_GSU01_SNLL0_TT02_02_VW02_WG08_08_01
    SolutionIndex: 368
    SolutionNameMin: Cijk_Alik_Bljk_SB_MT032x032x02_GRVW04_GSU01_SNLL0_TT04_04_VW04_WG08_08_01
    SolutionIndex: 369
    SolutionNameMin: Cijk_Alik_Bljk_SB_MT016x016x16_GRVW02_GSU01_SNLL1_TT02_02_VW02_WG08_08_04
    SolutionIndex: 370
    SolutionNameMin: Cijk_Alik_Bljk_SB_MT008x008x08_GRVW02_GSU02_SNLL0_TT02_02_VW02_WG04_04_04
    SolutionIndex: 371
    SolutionNameMin: Cijk_Alik_Bljk_SB_MT008x008x08_GRVW02_GSU04_SNLL0_TT02_02_VW02_WG04_04_04
    SolutionIndex: 372
    SolutionNameMin: Cijk_Alik_Bljk_SB_MT008x008x08_GRVW02_GSU08_SNLL0_TT02_02_VW02_WG04_04_04
    SolutionIndex: 373
    SolutionNameMin: Cijk_Alik_Bljk_SB_MT008x008x08_GRVW02_GSU16_SNLL0_TT02_02_VW02_WG04_04_04
    SolutionIndex: 374
    SolutionNameMin: Cijk_Alik_Bljk_SB_MT016x016x16_GRVW02_GSU16_SNLL0_TT02_02_VW02_WG08_08_04
    SolutionIndex: 375
    SolutionNameMin: Cijk_Alik_Bljk_SB_MT064x032x16_GRVW01_GSU04_LPA01_LPB01_PGR1_PLR1_TT04_04_USFGRO01_VW01_WG16_08_02_WGM01
    SolutionIndex: 376
    SolutionNameMin: Cijk_Alik_Bljk_SB_MT064x016x16_GRVW01_GSU04_LPA01_LPB01_PGR1_PLR1_TT04_04_USFGRO01_VW01_WG16_04_04_WGM01
    SolutionIndex: 377
    SolutionNameMin: Cijk_Alik_Bljk_SB_MT064x016x32_GRVW01_GSU08_LPA01_LPB01_PGR1_PLR1_TT04_04_USFGRO01_VW01_WG16_04_04_WGM01
    SolutionIndex: 378
    SolutionNameMin: Cijk_Alik_Bljk_SB_MT064x016x32_GRVW01_GSU08_LPA01_LPB01_PGR1_PLR1_TT04_04_USFGRO01_VW01_WG16_04_04_WGM08
    SolutionIndex: 379
    SolutionNameMin: Cijk_Alik_Bljk_SB_MT064x032x32_GRVW01_GSU01_LPA02_LPB02_PGR1_PLR1_TT04_08_USFGRO01_VW02_WG16_04_04_WGM01
    SolutionIndex: 380
    SolutionNameMin: Cijk_Alik_Bljk_SB_MT032x008x32_GRVW01_GSU08_LPA02_LPB02_PGR1_PLR1_TT02_02_USFGRO01_VW02_WG16_04_04_WGM01
    SolutionIndex: 381
    SolutionNameMin: Cijk_Alik_Bljk_SB_MT064x032x16_GRVW01_GSU01_LPA04_LPB04_PGR1_PLR1_TT04_04_USFGRO01_VW04_WG16_08_02_WGM01
    SolutionIndex: 382
    SolutionNameMin: Cijk_Alik_Bljk_SB_MT128x064x16_GRVW01_GSU01_LPA04_LPB04_PGR1_PLR1_TT04_08_USFGRO01_VW04_WG32_08_01_WGM01
    SolutionIndex: 383
    SolutionNameMin: Cijk_Alik_Bljk_SB_MT128x064x16_GRVW04_GSU01_LPA04_LPB04_PGR1_PLR1_TT04_08_USFGRO0_VW04_WG32_08_01_WGM01
    SolutionIndex: 384
    SolutionNameMin: Cijk_Alik_Bljk_SB_MT128x128x16_EPS1_GSU1_LPA0_LPB0_PGR1_SNLL1_TT8_8_VW2_WG16_16_1_WGM1
    SolutionIndex: 385
    SolutionNameMin: Cijk_Alik_Bljk_SB_MT64x32x16_EPS1_GSU3_LPA0_LPB0_PGR1_SNLL0_TT4_4_VW2_WG16_8_1_WGM1
    SolutionIndex: 386
    SolutionNameMin: Cijk_Alik_Bljk_SB_MT64x64x16_EPS1_GSU3_LPA0_LPB0_PGR1_SNLL0_TT4_4_VW2_WG16_16_1_WGM1
    SolutionIndex: 387
    SolutionNameMin: Cijk_Alik_Bljk_SB_MT128x128x16_EPS1_GSU3_LPA0_LPB0_PGR1_SNLL0_TT8_8_VW2_WG16_16_1_WGM1
    SolutionIndex: 388
    SolutionNameMin: Cijk_Alik_Bljk_SB_MT64x64x16_EPS1_GSU5_LPA0_LPB0_PGR1_SNLL0_TT4_4_VW2_WG16_16_1_WGM1
    SolutionIndex: 389
    SolutionNameMin: Cijk_Alik_Bljk_SB_MT128x128x16_EPS1_GSU5_LPA0_LPB0_PGR1_SNLL0_TT8_8_VW2_WG16_16_1_WGM1
    SolutionIndex: 390
    SolutionNameMin: Cijk_Alik_Bljk_SB_MT64x64x16_EPS1_GSU5_LPA0_LPB0_PGR1_SNLL0_TT4_4_VW2_WG16_16_1_WGM8
    SolutionIndex: 391
    SolutionNameMin: Cijk_Alik_Bljk_SB_MT64x64x16_EPS1_GSU3_LPA0_LPB0_PGR1_SNLL0_TT4_4_VW2_WG16_16_1_WGM64
    SolutionIndex: 392
    SolutionNameMin: Cijk_Alik_Bljk_SB_MT32x128x16_EPS1_GSU5_LPA0_LPB0_PGR1_SNLL0_TT4_4_VW2_WG8_32_1_WGM64
    SolutionIndex: 393
    SolutionNameMin: Cijk_Alik_Bljk_SB_MT64x64x16_EPS1_GSU5_LPA0_LPB0_PGR1_SNLL0_TT4_4_VW2_WG16_16_1_WGM64
    SolutionIndex: 394
    SolutionNameMin: Cijk_Alik_Bljk_SB_MT128x32x8_EPS1_GSU1_LPA0_LPB0_PGR1_SNLL1_TT4_4_VW4_WG32_8_1_WGM1
    SolutionIndex: 395
    SolutionNameMin: Cijk_Alik_Bljk_SB_MT128x128x16_EPS1_GSU1_LPA0_LPB0_PGR1_SNLL1_TT8_8_VW4_WG16_16_1_WGM1
    SolutionIndex: 396
    SolutionNameMin: Cijk_Alik_Bljk_SB_MT64x64x16_EPS1_GSU3_LPA0_LPB0_PGR1_SNLL0_TT4_4_VW4_WG16_16_1_WGM1
    SolutionIndex: 397
    SolutionNameMin: Cijk_Alik_Bljk_SB_MT128x128x16_EPS1_GSU1_LPA0_LPB0_PGR1_SNLL1_TT8_8_VW4_WG16_16_1_WGM8
    SolutionIndex: 398
    SolutionNameMin: Cijk_Alik_Bljk_SB_MT128x64x16_EPS0_GSU1_LPA0_LPB0_PGR0_SNLL0_TT4_8_VW4_WG32_8_1_WGM8
    SolutionIndex: 399
    SolutionNameMin: Cijk_Alik_Bljk_SB_MT64x32x16_EPS1_GSU1_LPA0_LPB0_PGR1_SNLL1_TT4_4_VW4_WG16_8_1_WGM64
    SolutionIndex: 400
    SolutionNameMin: Cijk_Alik_Bljk_SB_MT128x128x16_EPS1_GSU1_LPA0_LPB0_PGR1_SNLL1_TT8_8_VW4_WG16_16_1_WGM64
    SolutionIndex: 401
    SolutionNameMin: Cijk_Alik_Bljk_SB_MT128x64x16_EPS1_GSU1_LPA0_LPB0_PGR1_SNLL1_TT4_8_VW4_WG32_8_1_WGM64
    SolutionIndex: 402
    SolutionNameMin: Cijk_Alik_Bljk_SB_MT64x64x8_EPS1_GSU1_LPA2_LPB0_PGR1_SNLL1_TT4_8_VW2_WG16_8_1_WGM8
    SolutionIndex: 403
    SolutionNameMin: Cijk_Alik_Bljk_SB_MT64x32x16_EPS1_GSU3_LPA2_LPB0_PGR1_SNLL0_TT4_4_VW2_WG16_8_1_WGM1
    SolutionIndex: 404
    SolutionNameMin: Cijk_Alik_Bljk_SB_MT128x32x16_EPS1_GSU3_LPA2_LPB0_PGR1_SNLL0_TT4_4_VW2_WG32_8_1_WGM1
    SolutionIndex: 405
    SolutionNameMin: Cijk_Alik_Bljk_SB_MT64x64x16_EPS1_GSU5_LPA2_LPB0_PGR1_SNLL0_TT4_4_VW2_WG16_16_1_WGM1
    SolutionIndex: 406
    SolutionNameMin: Cijk_Alik_Bljk_SB_MT64x32x16_EPS0_GSU1_LPA2_LPB0_PGR0_SNLL0_TT4_4_VW2_WG16_8_1_WGM8
    SolutionIndex: 407
    SolutionNameMin: Cijk_Alik_Bljk_SB_MT64x64x16_EPS0_GSU1_LPA2_LPB0_PGR0_SNLL0_TT4_4_VW2_WG16_16_1_WGM8
    SolutionIndex: 408
    SolutionNameMin: Cijk_Alik_Bljk_SB_MT64x32x16_EPS1_GSU3_LPA2_LPB0_PGR1_SNLL0_TT4_4_VW2_WG16_8_1_WGM8
    SolutionIndex: 409
    SolutionNameMin: Cijk_Alik_Bljk_SB_MT64x64x16_EPS1_GSU5_LPA2_LPB0_PGR1_SNLL0_TT4_4_VW2_WG16_16_1_WGM8
    SolutionIndex: 410
    SolutionNameMin: Cijk_Alik_Bljk_SB_MT128x32x16_EPS1_GSU1_LPA2_LPB0_PGR1_SNLL1_TT4_4_VW2_WG32_8_1_WGM64
    SolutionIndex: 411
    SolutionNameMin: Cijk_Alik_Bljk_SB_MT64x32x16_EPS1_GSU5_LPA2_LPB0_PGR1_SNLL0_TT4_4_VW2_WG16_8_1_WGM64
    SolutionIndex: 412
    SolutionNameMin: Cijk_Alik_Bljk_SB_MT256x64x8_EPS1_GSU1_LPA4_LPB0_PGR1_SNLL1_TT8_8_VW4_WG32_8_1_WGM1
    SolutionIndex: 413
    SolutionNameMin: Cijk_Alik_Bljk_SB_MT128x128x8_EPS1_GSU1_LPA4_LPB0_PGR1_SNLL1_TT8_8_VW4_WG16_16_1_WGM8
    SolutionIndex: 414
    SolutionNameMin: Cijk_Alik_Bljk_SB_MT64x64x16_EPS1_GSU5_LPA4_LPB0_PGR1_SNLL0_TT4_4_VW4_WG16_16_1_WGM1
    SolutionIndex: 415
    SolutionNameMin: Cijk_Alik_Bljk_SB_MT64x64x16_EPS1_GSU1_LPA4_LPB0_PGR1_SNLL1_TT4_4_VW4_WG16_16_1_WGM8
    SolutionIndex: 416
    SolutionNameMin: Cijk_Alik_Bljk_SB_MT128x64x16_EPS1_GSU1_LPA4_LPB0_PGR1_SNLL1_TT8_4_VW4_WG16_16_1_WGM8
    SolutionIndex: 417
    SolutionNameMin: Cijk_Alik_Bljk_SB_MT128x64x16_EPS0_GSU1_LPA4_LPB0_PGR0_SNLL0_TT4_8_VW4_WG32_8_1_WGM8
    SolutionIndex: 418
    SolutionNameMin: Cijk_Alik_Bljk_SB_MT128x64x16_EPS1_GSU1_LPA4_LPB0_PGR1_SNLL1_TT4_8_VW4_WG32_8_1_WGM8
    SolutionIndex: 419
    SolutionNameMin: Cijk_Alik_Bljk_SB_MT64x64x16_EPS1_GSU1_LPA4_LPB0_PGR1_SNLL1_TT4_4_VW4_WG16_16_1_WGM64
    SolutionIndex: 420
    SolutionNameMin: Cijk_Alik_Bljk_SB_MT128x32x16_EPS0_GSU1_LPA4_LPB0_PGR0_SNLL0_TT4_4_VW4_WG32_8_1_WGM64
    SolutionIndex: 421
    SolutionNameMin: Cijk_Alik_Bljk_SB_MT64x32x16_EPS1_GSU5_LPA4_LPB0_PGR1_SNLL0_TT4_4_VW4_WG16_8_1_WGM64
    SolutionIndex: 422
    SolutionNameMin: Cijk_Alik_Bljk_SB_MT32x128x32_EPS1_GSU1_LPA4_LPB0_PGR1_SNLL1_TT4_4_VW4_WG8_32_1_WGM64
    SolutionIndex: 423
    SolutionNameMin: Cijk_Alik_Bljk_SB_MT128x64x8_EPS1_GSU1_LPA0_LPB2_PGR1_SNLL1_TT8_4_VW2_WG16_16_1_WGM8
    SolutionIndex: 424
    SolutionNameMin: Cijk_Alik_Bljk_SB_MT64x32x16_EPS1_GSU5_LPA0_LPB2_PGR1_SNLL0_TT4_4_VW2_WG16_8_1_WGM1
    SolutionIndex: 425
    SolutionNameMin: Cijk_Alik_Bljk_SB_MT64x64x16_EPS1_GSU5_LPA0_LPB2_PGR1_SNLL0_TT4_4_VW2_WG16_16_1_WGM1
    SolutionIndex: 426
    SolutionNameMin: Cijk_Alik_Bljk_SB_MT64x64x16_EPS1_GSU3_LPA0_LPB2_PGR1_SNLL0_TT4_4_VW2_WG16_16_1_WGM64
    SolutionIndex: 427
    SolutionNameMin: Cijk_Alik_Bljk_SB_MT64x32x16_EPS1_GSU5_LPA0_LPB2_PGR1_SNLL0_TT4_4_VW2_WG16_8_1_WGM64
    SolutionIndex: 428
    SolutionNameMin: Cijk_Alik_Bljk_SB_MT128x64x8_EPS1_GSU1_LPA0_LPB4_PGR1_SNLL1_TT4_8_VW4_WG32_8_1_WGM8
    SolutionIndex: 429
    SolutionNameMin: Cijk_Alik_Bljk_SB_MT64x32x16_EPS1_GSU1_LPA0_LPB4_PGR1_SNLL1_TT4_4_VW4_WG16_8_1_WGM1
    SolutionIndex: 430
    SolutionNameMin: Cijk_Alik_Bljk_SB_MT128x64x16_EPS0_GSU1_LPA0_LPB4_PGR0_SNLL0_TT8_4_VW4_WG16_16_1_WGM1
    SolutionIndex: 431
    SolutionNameMin: Cijk_Alik_Bljk_SB_MT64x32x16_EPS1_GSU5_LPA0_LPB4_PGR1_SNLL0_TT4_4_VW4_WG16_8_1_WGM1
    SolutionIndex: 432
    SolutionNameMin: Cijk_Alik_Bljk_SB_MT64x64x16_EPS1_GSU5_LPA0_LPB4_PGR1_SNLL0_TT4_4_VW4_WG16_16_1_WGM1
    SolutionIndex: 433
    SolutionNameMin: Cijk_Alik_Bljk_SB_MT64x128x16_EPS1_GSU1_LPA0_LPB4_PGR1_SNLL1_TT8_4_VW4_WG8_32_1_WGM8
    SolutionIndex: 434
    SolutionNameMin: Cijk_Alik_Bljk_SB_MT64x256x16_EPS1_GSU1_LPA0_LPB4_PGR1_SNLL1_TT8_8_VW4_WG8_32_1_WGM8
    SolutionIndex: 435
    SolutionNameMin: Cijk_Alik_Bljk_SB_MT64x128x16_EPS1_GSU1_LPA0_LPB4_PGR1_SNLL1_TT4_8_VW4_WG16_16_1_WGM8
    SolutionIndex: 436
    SolutionNameMin: Cijk_Alik_Bljk_SB_MT128x32x16_EPS0_GSU1_LPA0_LPB4_PGR0_SNLL0_TT4_4_VW4_WG32_8_1_WGM8
    SolutionIndex: 437
    SolutionNameMin: Cijk_Alik_Bljk_SB_MT64x32x16_EPS1_GSU5_LPA0_LPB4_PGR1_SNLL0_TT4_4_VW4_WG16_8_1_WGM8
    SolutionIndex: 438
    SolutionNameMin: Cijk_Alik_Bljk_SB_MT64x64x16_EPS1_GSU5_LPA0_LPB4_PGR1_SNLL0_TT4_4_VW4_WG16_16_1_WGM8
    SolutionIndex: 439
    SolutionNameMin: Cijk_Alik_Bljk_SB_MT64x32x16_EPS1_GSU1_LPA0_LPB4_PGR1_SNLL1_TT4_4_VW4_WG16_8_1_WGM64
    SolutionIndex: 440
    SolutionNameMin: Cijk_Alik_Bljk_SB_MT32x256x16_EPS1_GSU1_LPA0_LPB4_PGR1_SNLL1_TT4_8_VW4_WG8_32_1_WGM64
    SolutionIndex: 441
    SolutionNameMin: Cijk_Alik_Bljk_SB_MT64x128x16_EPS1_GSU1_LPA0_LPB4_PGR1_SNLL1_TT8_4_VW4_WG8_32_1_WGM64
    SolutionIndex: 442
    SolutionNameMin: Cijk_Alik_Bljk_SB_MT64x128x16_EPS1_GSU1_LPA0_LPB4_PGR1_SNLL1_TT4_8_VW4_WG16_16_1_WGM64
    SolutionIndex: 443
    SolutionNameMin: Cijk_Alik_Bljk_SB_MT128x64x16_EPS1_GSU1_LPA0_LPB4_PGR1_SNLL1_TT4_8_VW4_WG32_8_1_WGM64
    SolutionIndex: 444
    SolutionNameMin: Cijk_Alik_Bljk_SB_MT64x32x16_EPS1_GSU5_LPA0_LPB4_PGR1_SNLL0_TT4_4_VW4_WG16_8_1_WGM64
    SolutionIndex: 445
    SolutionNameMin: Cijk_Alik_Bljk_SB_MT32x128x32_EPS1_GSU5_LPA0_LPB4_PGR1_SNLL0_TT4_4_VW4_WG8_32_1_WGM8
    SolutionIndex: 446
    SolutionNameMin: Cijk_Alik_Bljk_SB_MT32x128x32_EPS1_GSU1_LPA0_LPB4_PGR1_SNLL1_TT4_4_VW4_WG8_32_1_WGM64
    SolutionIndex: 447
    SolutionNameMin: Cijk_Alik_Bljk_SB_MT128x32x8_EPS1_GSU1_LPA2_LPB2_PGR1_SNLL1_TT4_4_VW2_WG32_8_1_WGM64
    SolutionIndex: 448
    SolutionNameMin: Cijk_Alik_Bljk_SB_MT64x32x16_EPS1_GSU3_LPA2_LPB2_PGR1_SNLL0_TT4_4_VW2_WG16_8_1_WGM1
    SolutionIndex: 449
    SolutionNameMin: Cijk_Alik_Bljk_SB_MT32x128x16_EPS1_GSU3_LPA2_LPB2_PGR1_SNLL0_TT4_4_VW2_WG8_32_1_WGM1
    SolutionIndex: 450
    SolutionNameMin: Cijk_Alik_Bljk_SB_MT64x64x16_EPS1_GSU3_LPA2_LPB2_PGR1_SNLL0_TT4_4_VW2_WG16_16_1_WGM1
    SolutionIndex: 451
    SolutionNameMin: Cijk_Alik_Bljk_SB_MT64x128x16_EPS1_GSU3_LPA2_LPB2_PGR1_SNLL0_TT4_8_VW2_WG16_16_1_WGM1
    SolutionIndex: 452
    SolutionNameMin: Cijk_Alik_Bljk_SB_MT128x32x16_EPS1_GSU3_LPA2_LPB2_PGR1_SNLL0_TT4_4_VW2_WG32_8_1_WGM1
    SolutionIndex: 453
    SolutionNameMin: Cijk_Alik_Bljk_SB_MT64x32x16_EPS1_GSU5_LPA2_LPB2_PGR1_SNLL0_TT4_4_VW2_WG16_8_1_WGM1
    SolutionIndex: 454
    SolutionNameMin: Cijk_Alik_Bljk_SB_MT64x64x16_EPS0_GSU5_LPA2_LPB2_PGR0_SNLL0_TT4_4_VW2_WG16_16_1_WGM1
    SolutionIndex: 455
    SolutionNameMin: Cijk_Alik_Bljk_SB_MT64x64x16_EPS1_GSU5_LPA2_LPB2_PGR1_SNLL0_TT4_4_VW2_WG16_16_1_WGM1
    SolutionIndex: 456
    SolutionNameMin: Cijk_Alik_Bljk_SB_MT128x64x16_EPS1_GSU5_LPA2_LPB2_PGR1_SNLL0_TT8_4_VW2_WG16_16_1_WGM1
    SolutionIndex: 457
    SolutionNameMin: Cijk_Alik_Bljk_SB_MT128x64x16_EPS1_GSU5_LPA2_LPB2_PGR1_SNLL0_TT4_8_VW2_WG32_8_1_WGM1
    SolutionIndex: 458
    SolutionNameMin: Cijk_Alik_Bljk_SB_MT64x32x16_EPS1_GSU1_LPA2_LPB2_PGR1_SNLL1_TT4_4_VW2_WG16_8_1_WGM8
    SolutionIndex: 459
    SolutionNameMin: Cijk_Alik_Bljk_SB_MT64x64x16_EPS1_GSU1_LPA2_LPB2_PGR1_SNLL1_TT4_4_VW2_WG16_16_1_WGM8
    SolutionIndex: 460
    SolutionNameMin: Cijk_Alik_Bljk_SB_MT128x64x16_EPS1_GSU1_LPA2_LPB2_PGR1_SNLL1_TT8_4_VW2_WG16_16_1_WGM8
    SolutionIndex: 461
    SolutionNameMin: Cijk_Alik_Bljk_SB_MT64x128x16_EPS1_GSU3_LPA2_LPB2_PGR1_SNLL0_TT8_4_VW2_WG8_32_1_WGM8
    SolutionIndex: 462
    SolutionNameMin: Cijk_Alik_Bljk_SB_MT32x128x16_EPS1_GSU5_LPA2_LPB2_PGR1_SNLL0_TT4_4_VW2_WG8_32_1_WGM8
    SolutionIndex: 463
    SolutionNameMin: Cijk_Alik_Bljk_SB_MT64x128x16_EPS1_GSU5_LPA2_LPB2_PGR1_SNLL0_TT8_4_VW2_WG8_32_1_WGM8
    SolutionIndex: 464
    SolutionNameMin: Cijk_Alik_Bljk_SB_MT64x64x16_EPS1_GSU5_LPA2_LPB2_PGR1_SNLL0_TT4_4_VW2_WG16_16_1_WGM8
    SolutionIndex: 465
    SolutionNameMin: Cijk_Alik_Bljk_SB_MT64x128x16_EPS1_GSU5_LPA2_LPB2_PGR1_SNLL0_TT4_8_VW2_WG16_16_1_WGM8
    SolutionIndex: 466
    SolutionNameMin: Cijk_Alik_Bljk_SB_MT64x64x16_EPS1_GSU1_LPA2_LPB2_PGR1_SNLL1_TT4_4_VW2_WG16_16_1_WGM64
    SolutionIndex: 467
    SolutionNameMin: Cijk_Alik_Bljk_SB_MT64x128x16_EPS1_GSU1_LPA2_LPB2_PGR1_SNLL1_TT4_8_VW2_WG16_16_1_WGM64
    SolutionIndex: 468
    SolutionNameMin: Cijk_Alik_Bljk_SB_MT64x128x16_EPS1_GSU3_LPA2_LPB2_PGR1_SNLL0_TT4_8_VW2_WG16_16_1_WGM64
    SolutionIndex: 469
    SolutionNameMin: Cijk_Alik_Bljk_SB_MT128x64x16_EPS1_GSU3_LPA2_LPB2_PGR1_SNLL0_TT8_4_VW2_WG16_16_1_WGM64
    SolutionIndex: 470
    SolutionNameMin: Cijk_Alik_Bljk_SB_MT64x32x16_EPS1_GSU5_LPA2_LPB2_PGR1_SNLL0_TT4_4_VW2_WG16_8_1_WGM64
    SolutionIndex: 471
    SolutionNameMin: Cijk_Alik_Bljk_SB_MT64x64x16_EPS1_GSU5_LPA2_LPB2_PGR1_SNLL0_TT4_4_VW2_WG16_16_1_WGM64
    SolutionIndex: 472
    SolutionNameMin: Cijk_Alik_Bljk_SB_MT32x128x32_EPS1_GSU5_LPA2_LPB2_PGR1_SNLL0_TT4_4_VW2_WG8_32_1_WGM1
    SolutionIndex: 473
    SolutionNameMin: Cijk_Alik_Bljk_SB_MT64x128x32_EPS1_GSU1_LPA2_LPB2_PGR1_SNLL1_TT8_4_VW2_WG8_32_1_WGM8
    SolutionIndex: 474
    SolutionNameMin: Cijk_Alik_Bljk_SB_MT64x64x32_EPS1_GSU5_LPA2_LPB2_PGR1_SNLL0_TT4_4_VW2_WG16_16_1_WGM64
    SolutionIndex: 475
    SolutionNameMin: Cijk_Alik_Bljk_SB_MT128x32x8_EPS1_GSU1_LPA4_LPB4_PGR1_SNLL1_TT4_4_VW4_WG32_8_1_WGM8
    SolutionIndex: 476
    SolutionNameMin: Cijk_Alik_Bljk_SB_MT128x64x8_EPS1_GSU1_LPA4_LPB4_PGR1_SNLL1_TT4_8_VW4_WG32_8_1_WGM8
    SolutionIndex: 477
    SolutionNameMin: Cijk_Alik_Bljk_SB_MT64x32x16_EPS1_GSU1_LPA4_LPB4_PGR1_SNLL1_TT4_4_VW4_WG16_8_1_WGM1
    SolutionIndex: 478
    SolutionNameMin: Cijk_Alik_Bljk_SB_MT32x128x16_EPS1_GSU1_LPA4_LPB4_PGR1_SNLL1_TT4_4_VW4_WG8_32_1_WGM1
    SolutionIndex: 479
    SolutionNameMin: Cijk_Alik_Bljk_SB_MT64x64x16_EPS1_GSU1_LPA4_LPB4_PGR1_SNLL1_TT4_4_VW4_WG16_16_1_WGM1
    SolutionIndex: 480
    SolutionNameMin: Cijk_Alik_Bljk_SB_MT128x64x16_EPS1_GSU1_LPA4_LPB4_PGR1_SNLL1_TT8_4_VW4_WG16_16_1_WGM1
    SolutionIndex: 481
    SolutionNameMin: Cijk_Alik_Bljk_SB_MT128x32x16_EPS1_GSU1_LPA4_LPB4_PGR1_SNLL1_TT4_4_VW4_WG32_8_1_WGM1
    SolutionIndex: 482
    SolutionNameMin: Cijk_Alik_Bljk_SB_MT128x64x16_EPS1_GSU1_LPA4_LPB4_PGR1_SNLL1_TT4_8_VW4_WG32_8_1_WGM1
    SolutionIndex: 483
    SolutionNameMin: Cijk_Alik_Bljk_SB_MT256x32x16_EPS0_GSU1_LPA4_LPB4_PGR0_SNLL0_TT8_4_VW4_WG32_8_1_WGM1
    SolutionIndex: 484
    SolutionNameMin: Cijk_Alik_Bljk_SB_MT128x64x16_EPS1_GSU3_LPA4_LPB4_PGR1_SNLL0_TT8_4_VW4_WG16_16_1_WGM1
    SolutionIndex: 485
    SolutionNameMin: Cijk_Alik_Bljk_SB_MT64x32x16_EPS1_GSU5_LPA4_LPB4_PGR1_SNLL0_TT4_4_VW4_WG16_8_1_WGM1
    SolutionIndex: 486
    SolutionNameMin: Cijk_Alik_Bljk_SB_MT64x128x16_EPS1_GSU1_LPA4_LPB4_PGR1_SNLL1_TT8_4_VW4_WG8_32_1_WGM8
    SolutionIndex: 487
    SolutionNameMin: Cijk_Alik_Bljk_SB_MT64x64x16_EPS1_GSU1_LPA4_LPB4_PGR1_SNLL1_TT4_4_VW4_WG16_16_1_WGM8
    SolutionIndex: 488
    SolutionNameMin: Cijk_Alik_Bljk_SB_MT64x128x16_EPS1_GSU1_LPA4_LPB4_PGR1_SNLL1_TT4_8_VW4_WG16_16_1_WGM8
    SolutionIndex: 489
    SolutionNameMin: Cijk_Alik_Bljk_SB_MT128x64x16_EPS1_GSU1_LPA4_LPB4_PGR1_SNLL1_TT8_4_VW4_WG16_16_1_WGM8
    SolutionIndex: 490
    SolutionNameMin: Cijk_Alik_Bljk_SB_MT128x128x16_EPS1_GSU1_LPA4_LPB4_PGR1_SNLL1_TT8_8_VW4_WG16_16_1_WGM8
    SolutionIndex: 491
    SolutionNameMin: Cijk_Alik_Bljk_SB_MT128x32x16_EPS0_GSU1_LPA4_LPB4_PGR0_SNLL0_TT4_4_VW4_WG32_8_1_WGM8
    SolutionIndex: 492
    SolutionNameMin: Cijk_Alik_Bljk_SB_MT128x32x16_EPS1_GSU1_LPA4_LPB4_PGR1_SNLL1_TT4_4_VW4_WG32_8_1_WGM8
    SolutionIndex: 493
    SolutionNameMin: Cijk_Alik_Bljk_SB_MT128x64x16_EPS1_GSU1_LPA4_LPB4_PGR1_SNLL1_TT4_8_VW4_WG32_8_1_WGM8
    SolutionIndex: 494
    SolutionNameMin: Cijk_Alik_Bljk_SB_MT64x32x16_EPS1_GSU5_LPA4_LPB4_PGR1_SNLL0_TT4_4_VW4_WG16_8_1_WGM8
    SolutionIndex: 495
    SolutionNameMin: Cijk_Alik_Bljk_SB_MT64x32x16_EPS1_GSU1_LPA4_LPB4_PGR1_SNLL1_TT4_4_VW4_WG16_8_1_WGM64
    SolutionIndex: 496
    SolutionNameMin: Cijk_Alik_Bljk_SB_MT32x128x16_EPS1_GSU1_LPA4_LPB4_PGR1_SNLL1_TT4_4_VW4_WG8_32_1_WGM64
    SolutionIndex: 497
    SolutionNameMin: Cijk_Alik_Bljk_SB_MT64x128x16_EPS1_GSU1_LPA4_LPB4_PGR1_SNLL1_TT8_4_VW4_WG8_32_1_WGM64
    SolutionIndex: 498
    SolutionNameMin: Cijk_Alik_Bljk_SB_MT64x64x16_EPS1_GSU1_LPA4_LPB4_PGR1_SNLL1_TT4_4_VW4_WG16_16_1_WGM64
    SolutionIndex: 499
    SolutionNameMin: Cijk_Alik_Bljk_SB_MT64x128x16_EPS1_GSU1_LPA4_LPB4_PGR1_SNLL1_TT4_8_VW4_WG16_16_1_WGM64
    SolutionIndex: 500
    SolutionNameMin: Cijk_Alik_Bljk_SB_MT128x64x16_EPS1_GSU1_LPA4_LPB4_PGR1_SNLL1_TT8_4_VW4_WG16_16_1_WGM64
    SolutionIndex: 501
    SolutionNameMin: Cijk_Alik_Bljk_SB_MT128x128x16_EPS1_GSU1_LPA4_LPB4_PGR1_SNLL1_TT8_8_VW4_WG16_16_1_WGM64
    SolutionIndex: 502
    SolutionNameMin: Cijk_Alik_Bljk_SB_MT128x32x16_EPS1_GSU1_LPA4_LPB4_PGR1_SNLL1_TT4_4_VW4_WG32_8_1_WGM64
    SolutionIndex: 503
    SolutionNameMin: Cijk_Alik_Bljk_SB_MT128x64x16_EPS1_GSU1_LPA4_LPB4_PGR1_SNLL1_TT4_8_VW4_WG32_8_1_WGM64
    SolutionIndex: 504
    SolutionNameMin: Cijk_Alik_Bljk_SB_MT32x128x16_EPS1_GSU5_LPA4_LPB4_PGR1_SNLL0_TT4_4_VW4_WG8_32_1_WGM64
    SolutionIndex: 505
    SolutionNameMin: Cijk_Alik_Bljk_SB_MT32x128x32_EPS1_GSU1_LPA4_LPB4_PGR1_SNLL1_TT4_4_VW4_WG8_32_1_WGM1
    SolutionIndex: 506
    SolutionNameMin: Cijk_Alik_Bljk_SB_MT64x64x32_EPS1_GSU1_LPA4_LPB4_PGR1_SNLL1_TT4_4_VW4_WG16_16_1_WGM1
    SolutionIndex: 507
    SolutionNameMin: Cijk_Alik_Bljk_SB_MT32x128x32_EPS1_GSU5_LPA4_LPB4_PGR1_SNLL0_TT4_4_VW4_WG8_32_1_WGM1
    SolutionIndex: 508
    SolutionNameMin: Cijk_Alik_Bljk_SB_MT64x64x32_EPS1_GSU1_LPA4_LPB4_PGR1_SNLL1_TT4_4_VW4_WG16_16_1_WGM8
    SolutionIndex: 509
    SolutionNameMin: Cijk_Alik_Bljk_SB_MT64x128x32_EPS1_GSU1_LPA4_LPB4_PGR1_SNLL1_TT4_8_VW4_WG16_16_1_WGM8
    SolutionIndex: 510
    SolutionNameMin: Cijk_Alik_Bljk_SB_MT64x64x32_EPS1_GSU1_LPA4_LPB4_PGR1_SNLL1_TT4_4_VW4_WG16_16_1_WGM64
    SolutionIndex: 511
    SolutionNameMin: Cijk_Alik_Bljk_SB_MT64x128x32_EPS1_GSU1_LPA4_LPB4_PGR1_SNLL1_TT4_8_VW4_WG16_16_1_WGM64
- - - [1024, 128, 1, 128]
    - [12, 896.219]
  - - [4, 704, 1, 1280]
    - [49, 328.876]
  - - [4, 1856, 1, 3328]
    - [59, 501.361]
  - - [1856, 448, 1, 3328]
    - [104, 5677.91]
  - - [2944, 4288, 1, 1280]
    - [90, 8412.39]
  - - [2368, 64, 1, 3328]
    - [40, 4913.92]
  - - [1760, 32, 1, 1760]
    - [67, 3312.94]
  - - [2368, 5888, 1, 256]
    - [90, 6489.72]
  - - [5888, 1856, 1, 256]
    - [102, 7791.88]
  - - [128, 64, 1, 256]
    - [74, 369.217]
  - - [512, 24000, 1, 1536]
    - [96, 8827.37]
  - - [128, 6784, 1, 3328]
    - [96, 6536.99]
  - - [5888, 1408, 1, 256]
    - [110, 6129.61]
  - - [5888, 1856, 1, 3328]
    - [96, 7969.17]
  - - [5056, 704, 1, 256]
    - [96, 6723.82]
  - - [2048, 400, 1, 512]
    - [102, 4531.44]
  - - [5888, 2944, 1, 3328]
    - [102, 8608.04]
  - - [1856, 4288, 1, 256]
    - [102, 6297.54]
  - - [1024, 5056, 1, 128]
    - [80, 3595.37]
  - - [5056, 5056, 1, 3328]
    - [96, 8559.16]
  - - [1408, 5888, 1, 1280]
    - [91, 6797.06]
  - - [2368, 448, 1, 128]
    - [80, 2814.9]
  - - [2368, 6784, 1, 128]
    - [84, 4781.98]
  - - [1024, 3584, 1, 3328]
    - [92, 8402.44]
  - - [512, 48000, 1, 2048]
    - [96, 8162.23]
  - - [128, 448, 1, 1280]
    - [67, 2903.49]
  - - [256, 4288, 1, 3328]
    - [97, 6345.94]
  - - [5888, 1408, 1, 1280]
    - [96, 8959.45]
  - - [704, 1856, 1, 3328]
    - [91, 6955.27]
  - - [4, 1408, 1, 128]
    - [111, 60.0747]
  - - [1024, 2368, 1, 256]
    - [98, 5927.78]
  - - [64, 4, 1, 256]
    - [116, 13.2129]
  - - [1408, 1856, 1, 1280]
    - [94, 8051.58]
  - - [1408, 64, 1, 1280]
    - [70, 3400.45]
  - - [448, 1024, 1, 1280]
    - [98, 5729.92]
  - - [6144, 24000, 1, 2048]
    - [102, 7738.3]
  - - [4096, 32, 1, 4096]
    - [40, 2381.43]
  - - [256, 1408, 1, 3328]
    - [98, 4844.78]
  - - [5056, 5056, 1, 1280]
    - [102, 9090.1]
  - - [448, 5056, 1, 256]
    - [108, 4961.18]
  - - [704, 1856, 1, 1280]
    - [94, 6456.44]
  - - [128, 5056, 1, 128]
    - [23, 2251.02]
  - - [2368, 128, 1, 256]
    - [91, 3403.27]
  - - [1760, 6400, 1, 1760]
    - [90, 8959.7]
  - - [1856, 1408, 1, 128]
    - [83, 3493.06]
  - - [64, 5056, 1, 256]
    - [92, 2582.22]
  - - [6784, 256, 1, 3328]
    - [90, 7323.54]
  - - [6784, 4288, 1, 3328]
    - [92, 8542.09]
  - - [4288, 448, 1, 256]
    - [108, 5030.5]
  - - [64, 704, 1, 128]
    - [25, 375.467]
  - - [1856, 2368, 1, 3328]
    - [101, 6742.34]
  - - [4288, 2944, 1, 1280]
    - [102, 8578.17]
  - - [704, 5056, 1, 1280]
    - [98, 8014.45]
  - - [2368, 704, 1, 3328]
    - [97, 6544.31]
  - - [256, 5888, 1, 256]
    - [95, 5932.9]
  - - [1856, 4288, 1, 3328]
    - [101, 7410.72]
  - - [256, 2944, 1, 256]
    - [97, 5013.98]
  - - [5888, 1024, 1, 256]
    - [102, 8069.34]
  - - [448, 64, 1, 1280]
    - [77, 2057.18]
  - - [3072, 64, 1, 1024]
    - [57, 2145.42]
  - - [3584, 4, 1, 1280]
    - [49, 498.643]
  - - [16384, 3200, 1, 4096]
    - [89, 6621.43]
  - - [2944, 64, 1, 256]
    - [97, 2554.79]
  - - [128, 4, 1, 1280]
    - [59, 87.1489]
  - - [1408, 2944, 1, 256]
    - [96, 8029.35]
  - - [256, 1856, 1, 1280]
    - [91, 6170.6]
  - - [6784, 5056, 1, 3328]
    - [100, 7134.19]
  - - [5056, 5056, 1, 256]
    - [108, 6246.8]
  - - [1408, 6784, 1, 128]
    - [85, 4329.45]
  - - [64, 1024, 1, 1280]
    - [67, 3206.65]
  - - [2944, 4, 1, 256]
    - [116, 333.48]
  - - [704, 5056, 1, 128]
    - [80, 4085.42]
  - - [4, 2368, 1, 1280]
    - [117, 394.667]
  - - [2368, 2944, 1, 1280]
    - [96, 8633.95]
  - - [128, 3584, 1, 1280]
    - [97, 6046.15]
  - - [6784, 6784, 1, 1280]
    - [102, 8847.41]
  - - [1408, 4288, 1, 1280]
    - [102, 8236.69]
  - - [3584, 4288, 1, 1280]
    - [97, 7399.88]
  - - [2368, 704, 1, 1280]
    - [90, 6754.4]
  - - [5056, 4288, 1, 3328]
    - [96, 8569.53]
  - - [3584, 2368, 1, 3328]
    - [101, 7942.38]
  - - [64, 704, 1, 1280]
    - [70, 2363.59]
  - - [4288, 256, 1, 256]
    - [98, 4591.8]
  - - [2944, 128, 1, 128]
    - [23, 1878.29]
  - - [6144, 32, 1, 2560]
    - [68, 3334.1]
  - - [6784, 448, 1, 1280]
    - [100, 7939.2]
  - - [1408, 2944, 1, 128]
    - [84, 4096.51]
  - - [4288, 2944, 1, 256]
    - [90, 8141.13]
  - - [5888, 704, 1, 1280]
    - [91, 7516.13]
  - - [5056, 4, 1, 3328]
    - [34, 552.409]
  - - [1856, 64, 1, 1280]
    - [40, 3870.76]
  - - [1760, 16, 1, 1760]
    - [52, 2181.41]
  - - [448, 5888, 1, 128]
    - [85, 3371.0]
  - - [5888, 64, 1, 3328]
    - [65, 5319.38]
  - - [2944, 256, 1, 3328]
    - [97, 7122.3]
  - - [1024, 64, 1, 128]
    - [12, 595.782]
  - - [5056, 2368, 1, 1280]
    - [91, 7778.19]
  - - [448, 3584, 1, 1280]
    - [96, 6500.52]
  - - [6784, 5888, 1, 256]
    - [96, 8918.58]
  - - [704, 1024, 1, 128]
    - [80, 2627.41]
  - - [704, 128, 1, 1280]
    - [67, 3408.49]
  - - [4, 3584, 1, 128]
    - [111, 140.721]
  - - [1408, 448, 1, 1280]
    - [91, 5881.44]
  - - [1024, 1408, 1, 256]
    - [95, 5647.17]
  - - [2368, 2368, 1, 3328]
    - [89, 7688.73]
  - - [1856, 6784, 1, 128]
    - [80, 4705.85]
  - - [5056, 704, 1, 3328]
    - [100, 8198.88]
  - - [1408, 1856, 1, 256]
    - [102, 6339.95]
  - - [1408, 704, 1, 3328]
    - [94, 7599.55]
  - - [2368, 5056, 1, 256]
    - [102, 8242.75]
  - - [1408, 256, 1, 1280]
    - [97, 4879.16]
  - - [3072, 128, 1, 1024]
    - [66, 2525.42]
  - - [3584, 2368, 1, 1280]
    - [98, 8132.62]
  - - [4288, 64, 1, 3328]
    - [53, 5156.43]
  - - [2368, 4, 1, 1280]
    - [115, 482.65]
  - - [704, 5888, 1, 256]
    - [105, 5398.65]
  - - [6784, 2944, 1, 128]
    - [81, 4748.89]
  - - [2560, 1600, 1, 2560]
    - [92, 7354.9]
  - - [4288, 6784, 1, 3328]
    - [89, 7409.31]
  - - [2944, 256, 1, 256]
    - [97, 5077.32]
  - - [2944, 6784, 1, 3328]
    - [102, 8067.95]
  - - [704, 1408, 1, 3328]
    - [97, 7239.33]
  - - [6144, 5984, 1, 2048]
    - [96, 7175.97]
  - - [3584, 704, 1, 3328]
    - [102, 6642.76]
  - - [2944, 256, 1, 128]
    - [81, 2644.44]
  - - [6784, 4, 1, 1280]
    - [113, 402.387]
  - - [1024, 64, 1, 1280]
    - [67, 2601.93]
  - - [2048, 1600, 1, 512]
    - [94, 5592.4]
  - - [448, 4288, 1, 256]
    - [92, 6128.89]
  - - [64, 3584, 1, 3328]
    - [33, 5534.83]
  - - [1856, 4288, 1, 128]
    - [83, 4400.01]
  - - [704, 2368, 1, 1280]
    - [108, 5734.92]
  - - [1856, 2368, 1, 1280]
    - [105, 6482.3]
  - - [2368, 128, 1, 3328]
    - [78, 4717.22]
  - - [2944, 128, 1, 256]
    - [105, 3276.8]
  - - [448, 1408, 1, 256]
    - [97, 4852.18]
  - - [1856, 4288, 1, 1280]
    - [92, 8132.86]
  - - [64, 5056, 1, 3328]
    - [68, 5096.96]
  - - [4, 704, 1, 256]
    - [115, 128.731]
  - - [1024, 448, 1, 128]
    - [80, 1816.84]
  - - [704, 4, 1, 1280]
    - [116, 328.876]
  - - [704, 256, 1, 128]
    - [84, 876.469]
  - - [704, 2944, 1, 128]
    - [84, 3734.37]
  - - [1408, 1024, 1, 1280]
    - [92, 7224.75]
  - - [704, 6784, 1, 256]
    - [96, 7354.67]
  - - [6784, 704, 1, 256]
    - [92, 6012.18]
  - - [5056, 1408, 1, 128]
    - [85, 4311.18]
  - - [2048, 7000, 1, 2048]
    - [96, 7231.97]
  - - [256, 3584, 1, 3328]
    - [100, 7005.9]
  - - [4, 5888, 1, 3328]
    - [118, 534.512]
  - - [128, 1408, 1, 128]
    - [10, 1176.97]
  - - [3584, 4288, 1, 3328]
    - [102, 7134.9]
  - - [5888, 1856, 1, 1280]
    - [90, 8394.93]
  - - [256, 1408, 1, 256]
    - [91, 3977.36]
  - - [5056, 64, 1, 1280]
    - [91, 4257.68]
  - - [1024, 704, 1, 256]
    - [91, 5036.83]
  - - [448, 128, 1, 128]
    - [12, 533.433]
  - - [2368, 3584, 1, 1280]
    - [96, 8272.33]
  - - [2368, 6784, 1, 1280]
    - [89, 8288.14]
  - - [1856, 4, 1, 1280]
    - [29, 464.0]
  - - [448, 448, 1, 256]
    - [91, 3058.35]
  - - [2944, 3584, 1, 3328]
    - [96, 8557.53]
  - - [7680, 32, 1, 2560]
    - [68, 3728.93]
  - - [128, 4288, 1, 128]
    - [11, 2116.1]
  - - [256, 256, 1, 3328]
    - [67, 4050.96]
  - - [128, 1024, 1, 3328]
    - [40, 5139.11]
  - - [4, 1408, 1, 3328]
    - [59, 502.771]
  - - [6784, 2944, 1, 256]
    - [90, 8445.96]
  - - [64, 1856, 1, 1280]
    - [32, 3870.76]
  - - [6784, 64, 1, 128]
    - [80, 1877.52]
  - - [4288, 2368, 1, 3328]
    - [100, 8419.3]
  - - [1856, 2368, 1, 256]
    - [94, 6887.38]
  - - [3584, 256, 1, 128]
    - [84, 2496.61]
  - - [3584, 6784, 1, 3328]
    - [96, 7626.08]
  - - [256, 1024, 1, 256]
    - [97, 3095.43]
  - - [4, 6784, 1, 3328]
    - [59, 589.174]
  - - [1024, 5888, 1, 3328]
    - [96, 7794.25]
  - - [1024, 128, 1, 1280]
    - [69, 3130.08]
  - - [3072, 32, 1, 1024]
    - [56, 1675.49]
  - - [6144, 24000, 1, 2560]
    - [96, 7256.04]
  - - [5056, 4288, 1, 1280]
    - [94, 8348.93]
  - - [5888, 64, 1, 256]
    - [43, 2593.25]
  - - [6784, 1856, 1, 3328]
    - [90, 8087.28]
  - - [1408, 5056, 1, 1280]
    - [92, 7802.53]
  - - [1856, 256, 1, 1280]
    - [97, 6150.63]
  - - [64, 5888, 1, 3328]
    - [64, 5301.39]
  - - [2368, 2368, 1, 1280]
    - [94, 8233.33]
  - - [2944, 5888, 1, 128]
    - [87, 3745.41]
  - - [704, 5888, 1, 1280]
    - [92, 8244.94]
  - - [2368, 3584, 1, 128]
    - [84, 4523.33]
  - - [1856, 5056, 1, 128]
    - [81, 4497.98]
  - - [704, 1024, 1, 1280]
    - [105, 5479.49]
  - - [448, 256, 1, 3328]
    - [48, 5048.7]
  - - [448, 1856, 1, 128]
    - [81, 2936.82]
  - - [8192, 3200, 1, 2048]
    - [90, 6713.02]
  - - [128, 1024, 1, 128]
    - [26, 998.644]
  - - [2944, 4, 1, 128]
    - [111, 98.6471]
  - - [1024, 704, 1, 1280]
    - [97, 5896.9]
  - - [128, 5888, 1, 256]
    - [97, 5013.98]
  - - [1024, 5056, 1, 1280]
    - [96, 8857.71]
  - - [4288, 1024, 1, 256]
    - [102, 6195.29]
  - - [2944, 2368, 1, 128]
    - [80, 4442.13]
  - - [704, 704, 1, 3328]
    - [97, 6764.3]
  - - [704, 1408, 1, 1280]
    - [98, 7383.48]
  - - [5888, 448, 1, 1280]
    - [96, 7299.39]
  - - [3584, 256, 1, 3328]
    - [94, 7061.62]
  - - [704, 5888, 1, 3328]
    - [98, 8142.32]
  - - [704, 1856, 1, 128]
    - [84, 3139.04]
  - - [448, 448, 1, 3328]
    - [62, 5063.24]
  - - [4, 4288, 1, 128]
    - [112, 64.8775]
  - - [128, 704, 1, 1280]
    - [32, 3400.45]
  - - [3584, 2944, 1, 256]
    - [102, 7982.04]
  - - [3584, 4, 1, 128]
    - [111, 105.218]
  - - [1856, 128, 1, 3328]
    - [63, 5442.09]
  - - [4, 64, 1, 1280]
    - [117, 42.2268]
  - - [2944, 448, 1, 128]
    - [80, 2926.85]
  - - [128, 2944, 1, 1280]
    - [91, 5109.59]
  - - [64, 64, 1, 3328]
    - [59, 1252.89]
  - - [448, 2944, 1, 1280]
    - [100, 6684.37]
  - - [512, 24000, 1, 2048]
    - [96, 7938.93]
  - - [128, 256, 1, 3328]
    - [77, 3276.8]
  - - [1408, 5056, 1, 3328]
    - [102, 8959.11]
  - - [1856, 1856, 1, 3328]
    - [92, 8006.07]
  - - [3584, 128, 1, 256]
    - [97, 4292.42]
  - - [2560, 800, 1, 2560]
    - [92, 6262.38]
  - - [448, 1408, 1, 3328]
    - [108, 4997.25]
  - - [2368, 2368, 1, 256]
    - [110, 4978.84]
  - - [4288, 4288, 1, 1280]
    - [89, 8617.68]
  - - [64, 448, 1, 1280]
    - [35, 2057.18]
  - - [5888, 1024, 1, 1280]
    - [107, 6848.07]
  - - [1408, 4288, 1, 256]
    - [90, 7076.91]
  - - [448, 4, 1, 256]
    - [115, 84.3294]
  - - [5888, 448, 1, 128]
    - [84, 3493.81]
  - - [512, 48000, 1, 2560]
    - [102, 8960.03]
  - - [35, 8457, 1, 1760]
    - [4, 3934.68]
  - - [704, 6784, 1, 3328]
    - [89, 8180.78]
  - - [2560, 6400, 1, 2560]
    - [90, 7822.14]
  - - [5056, 1024, 1, 1280]
    - [92, 8357.28]
  - - [448, 5888, 1, 3328]
    - [96, 7505.18]
  - - [128, 4, 1, 128]
    - [111, 0.562251]
  - - [1024, 2944, 1, 1280]
    - [96, 8406.14]
  - - [5056, 5888, 1, 1280]
    - [96, 8819.66]
  - - [4288, 5888, 1, 128]
    - [81, 3522.22]
  - - [256, 3584, 1, 256]
    - [92, 5883.79]
  - - [1408, 3584, 1, 128]
    - [80, 4283.31]
  - - [256, 2944, 1, 3328]
    - [100, 5670.53]
  - - [448, 3584, 1, 128]
    - [84, 3171.62]
  - - [5888, 2944, 1, 1280]
    - [102, 8198.76]
  - - [4, 6784, 1, 1280]
    - [49, 553.796]
  - - [2368, 5888, 1, 128]
    - [80, 4787.22]
  - - [8448, 16, 1, 2816]
    - [39, 2452.53]
  - - [64, 2944, 1, 128]
    - [12, 1376.56]
  - - [2368, 4, 1, 256]
    - [34, 278.077]
  - - [3584, 5888, 1, 256]
    - [110, 6233.56]
  - - [2368, 1024, 1, 128]
    - [81, 3781.41]
  - - [2368, 704, 1, 128]
    - [81, 3198.22]
  - - [3584, 2944, 1, 1280]
    - [92, 8045.58]
  - - [3584, 2368, 1, 128]
    - [81, 4188.47]
  - - [5056, 704, 1, 128]
    - [84, 4019.11]
  - - [448, 2368, 1, 128]
    - [86, 2522.11]
  - - [5056, 1408, 1, 3328]
    - [94, 8349.83]
  - - [1408, 704, 1, 256]
    - [100, 4741.32]
  - - [6784, 1024, 1, 3328]
    - [102, 8769.4]
  - - [6784, 2944, 1, 3328]
    - [99, 7319.64]
  - - [2944, 5056, 1, 3328]
    - [89, 8889.66]
  - - [1856, 1856, 1, 256]
    - [92, 6309.74]
  - - [1024, 5888, 1, 128]
    - [83, 3759.5]
  - - [6784, 2368, 1, 1280]
    - [92, 8298.3]
  - - [256, 4, 1, 128]
    - [111, 7.00171]
  - - [4288, 5888, 1, 1280]
    - [96, 8365.18]
  - - [4288, 4288, 1, 256]
    - [96, 6513.68]
  - - [8448, 32, 1, 2816]
    - [67, 4257.64]
  - - [448, 2944, 1, 3328]
    - [100, 6875.52]
  - - [5888, 4, 1, 128]
    - [111, 163.84]
  - - [4288, 1856, 1, 1280]
    - [96, 8402.81]
  - - [1856, 2944, 1, 3328]
    - [96, 6612.11]
  - - [256, 6784, 1, 3328]
    - [97, 7358.6]
  - - [64, 5888, 1, 256]
    - [91, 3358.95]
  - - [256, 5056, 1, 128]
    - [84, 2489.11]
  - - [5056, 1024, 1, 256]
    - [102, 8077.77]
  - - [704, 64, 1, 3328]
    - [46, 3288.3]
  - - [5056, 1856, 1, 3328]
    - [100, 8171.03]
  - - [4, 2944, 1, 3328]
    - [59, 546.743]
  - - [4, 5056, 1, 256]
    - [34, 378.461]
  - - [1856, 1408, 1, 256]
    - [102, 6320.78]
  - - [8448, 12000, 1, 2816]
    - [100, 7365.77]
  - - [6784, 128, 1, 3328]
    - [97, 6366.47]
  - - [4288, 1408, 1, 128]
    - [80, 4451.6]
  - - [1856, 5888, 1, 3328]
    - [98, 8619.66]
  - - [4288, 5056, 1, 256]
    - [102, 7288.95]
  - - [1408, 128, 1, 1280]
    - [40, 4291.05]
  - - [4096, 800, 1, 1024]
    - [91, 5867.79]
  - - [5056, 256, 1, 3328]
    - [97, 7527.51]
  - - [704, 704, 1, 256]
    - [97, 4417.75]
  - - [1024, 5888, 1, 1280]
    - [102, 8674.47]
  - - [6784, 2368, 1, 128]
    - [80, 4723.98]
  - - [4, 5056, 1, 1280]
    - [49, 540.207]
  - - [256, 64, 1, 1280]
    - [51, 1515.28]
  - - [128, 1856, 1, 1280]
    - [91, 4574.11]
  - - [1856, 1024, 1, 1280]
    - [96, 7741.51]
  - - [6784, 4288, 1, 1280]
    - [102, 8521.19]
  - - [2560, 64, 1, 2560]
    - [33, 3504.6]
  - - [1856, 1856, 1, 1280]
    - [92, 7779.21]
  - - [4096, 400, 1, 1024]
    - [102, 4157.71]
  - - [3072, 24000, 1, 1024]
    - [102, 8663.35]
  - - [128, 4288, 1, 3328]
    - [48, 5674.13]
  - - [4, 2368, 1, 3328]
    - [59, 525.38]
  - - [5888, 1856, 1, 128]
    - [84, 4099.64]
  - - [448, 704, 1, 1280]
    - [97, 4309.37]
  - - [128, 5056, 1, 1280]
    - [40, 5068.36]
  - - [1024, 448, 1, 3328]
    - [100, 6077.72]
  - - [1856, 704, 1, 1280]
    - [108, 6257.39]
  - - [5056, 3584, 1, 128]
    - [81, 4598.42]
  - - [5888, 5888, 1, 3328]
    - [102, 8058.15]
  - - [6784, 1024, 1, 256]
    - [102, 5120.89]
  - - [2944, 2368, 1, 256]
    - [93, 6522.93]
  - - [256, 448, 1, 256]
    - [43, 1816.84]
  - - [5056, 5888, 1, 3328]
    - [95, 6722.31]
  - - [1856, 1024, 1, 256]
    - [102, 6632.21]
  - - [512, 48000, 1, 1536]
    - [96, 8555.91]
  - - [3584, 448, 1, 1280]
    - [91, 6566.99]
  - - [8448, 5984, 1, 2816]
    - [96, 8990.56]
  - - [448, 5888, 1, 256]
    - [96, 6220.37]
  - - [704, 64, 1, 128]
    - [9, 450.56]
  - - [1408, 6784, 1, 3328]
    - [89, 8478.58]
  - - [448, 1024, 1, 128]
    - [88, 1844.23]
  - - [4288, 704, 1, 128]
    - [84, 3895.16]
  - - [128, 1856, 1, 128]
    - [15, 1456.36]
  - - [448, 2368, 1, 3328]
    - [94, 5537.94]
  - - [5056, 64, 1, 128]
    - [80, 1648.84]
  - - [5056, 2944, 1, 256]
    - [96, 8230.77]
  - - [6784, 5888, 1, 128]
    - [80, 4873.09]
  - - [1024, 700, 1, 512]
    - [94, 4445.27]
  - - [704, 1024, 1, 256]
    - [92, 4707.89]
  - - [1024, 4, 1, 256]
    - [34, 174.763]
  - - [2944, 704, 1, 128]
    - [84, 3483.32]
  - - [128, 6784, 1, 1280]
    - [92, 6522.83]
  - - [1408, 3584, 1, 3328]
    - [96, 8673.49]
  - - [2368, 6784, 1, 256]
    - [92, 7941.66]
  - - [5056, 1408, 1, 1280]
    - [96, 8800.91]
  - - [256, 256, 1, 128]
    - [21, 551.882]
  - - [5056, 4288, 1, 128]
    - [88, 3793.54]
  - - [1408, 1856, 1, 128]
    - [80, 3067.64]
  - - [1408, 5888, 1, 3328]
    - [96, 9148.87]
  - - [1856, 256, 1, 256]
    - [92, 4319.42]
  - - [6784, 6784, 1, 256]
    - [92, 7668.43]
  - - [64, 256, 1, 128]
    - [26, 131.072]
  - - [4288, 2368, 1, 128]
    - [81, 4582.89]
  - - [256, 4288, 1, 1280]
    - [91, 6058.51]
  - - [2368, 2944, 1, 256]
    - [96, 8015.97]
  - - [4, 1856, 1, 256]
    - [113, 252.732]
  - - [3584, 1856, 1, 1280]
    - [92, 7760.14]
  - - [6784, 6784, 1, 128]
    - [81, 4970.04]
  - - [256, 1856, 1, 128]
    - [87, 1580.49]
  - - [704, 64, 1, 1280]
    - [76, 2556.37]
  - - [5888, 5056, 1, 256]
    - [96, 8216.57]
  - - [8448, 48000, 1, 2816]
    - [102, 4082.79]
  - - [3584, 448, 1, 256]
    - [96, 5518.82]
  - - [448, 4288, 1, 128]
    - [84, 3415.15]
  - - [7680, 64, 1, 2560]
    - [45, 5162.0]
  - - [256, 6784, 1, 256]
    - [96, 6272.52]
  - - [1408, 4288, 1, 128]
    - [84, 4343.53]
  - - [2944, 704, 1, 3328]
    - [91, 7679.61]
  - - [128, 448, 1, 256]
    - [31, 1422.49]
  - - [5056, 256, 1, 1280]
    - [98, 5052.29]
  - - [2560, 32, 1, 2560]
    - [54, 3105.97]
  - - [3584, 3584, 1, 256]
    - [102, 8260.47]
  - - [448, 1408, 1, 128]
    - [80, 2397.28]
  - - [128, 256, 1, 1280]
    - [35, 2340.57]
  - - [3584, 5056, 1, 256]
    - [102, 7347.46]
  - - [6784, 128, 1, 256]
    - [92, 5591.0]
  - - [4288, 4, 1, 256]
    - [34, 354.106]
  - - [704, 448, 1, 256]
    - [97, 3492.23]
  - - [2944, 2368, 1, 1280]
    - [104, 6661.61]
  - - [448, 64, 1, 3328]
    - [76, 3058.35]
  - - [1408, 3584, 1, 256]
    - [102, 7966.49]
  - - [3584, 4, 1, 3328]
    - [115, 605.459]
  - - [6784, 3584, 1, 256]
    - [92, 7525.31]
  - - [256, 128, 1, 128]
    - [24, 275.941]
  - - [704, 1408, 1, 128]
    - [81, 3109.75]
  - - [4, 2368, 1, 256]
    - [115, 283.275]
  - - [4288, 128, 1, 1280]
    - [97, 5132.55]
  - - [128, 1408, 1, 256]
    - [91, 2733.25]
  - - [4, 2944, 1, 256]
    - [113, 314.027]
  - - [64, 128, 1, 3328]
    - [61, 1514.61]
  - - [5056, 2368, 1, 128]
    - [85, 3449.07]
  - - [2944, 2944, 1, 3328]
    - [89, 8168.93]
  - - [5056, 6784, 1, 256]
    - [109, 5792.67]
  - - [1856, 3584, 1, 128]
    - [86, 4213.4]
  - - [128, 2944, 1, 128]
    - [10, 1970.36]
  - - [35, 8457, 1, 2560]
    - [5, 3525.05]
  - - [1024, 704, 1, 3328]
    - [91, 6784.89]
  - - [6784, 448, 1, 256]
    - [100, 6544.78]
  - - [3584, 6784, 1, 128]
    - [80, 4623.5]
  - - [128, 4288, 1, 256]
    - [94, 3606.5]
  - - [704, 448, 1, 3328]
    - [91, 4477.91]
  - - [128, 128, 1, 3328]
    - [76, 2177.55]
  - - [5056, 1856, 1, 256]
    - [110, 5608.62]
  - - [4608, 5984, 1, 1536]
    - [99, 7859.75]
  - - [256, 128, 1, 256]
    - [35, 998.644]
  - - [1760, 3200, 1, 1760]
    - [92, 8179.54]
  - - [1024, 1856, 1, 256]
    - [102, 6143.17]
  - - [4096, 1600, 1, 1024]
    - [110, 5851.42]
  - - [4288, 64, 1, 128]
    - [15, 1372.16]
  - - [256, 448, 1, 3328]
    - [54, 4795.0]
  - - [1408, 6784, 1, 1280]
    - [96, 8426.4]
  - - [3584, 3584, 1, 1280]
    - [96, 7556.46]
  - - [7680, 24000, 1, 2560]
    - [89, 5019.09]
  - - [64, 2368, 1, 1280]
    - [40, 4061.7]
  - - [448, 2368, 1, 1280]
    - [91, 5928.67]
  - - [4608, 48000, 1, 1536]
    - [96, 6937.3]
  - - [5888, 5888, 1, 128]
    - [81, 3743.9]
  - - [64, 6784, 1, 3328]
    - [91, 5988.62]
  - - [2944, 256, 1, 1280]
    - [97, 6717.87]
  - - [2048, 16, 1, 2048]
    - [49, 1210.48]
  - - [256, 2368, 1, 128]
    - [84, 1935.97]
  - - [5056, 2368, 1, 3328]
    - [102, 8875.53]
  - - [2944, 4288, 1, 256]
    - [96, 8063.14]
  - - [1408, 3584, 1, 1280]
    - [92, 8196.97]
  - - [2368, 64, 1, 256]
    - [91, 2365.69]
  - - [64, 448, 1, 3328]
    - [77, 3027.3]
  - - [704, 128, 1, 3328]
    - [48, 4452.09]
  - - [8192, 1600, 1, 2048]
    - [96, 7229.83]
  - - [1856, 704, 1, 256]
    - [98, 5545.35]
  - - [4, 4288, 1, 1280]
    - [49, 523.725]
  - - [1408, 448, 1, 3328]
    - [103, 4789.3]
  - - [1024, 4, 1, 3328]
    - [29, 504.123]
  - - [512, 24000, 1, 2560]
    - [102, 8903.52]
  - - [2368, 6784, 1, 3328]
    - [102, 8311.04]
  - - [1856, 1408, 1, 1280]
    - [92, 8160.01]
  - - [1856, 448, 1, 1280]
    - [94, 6242.97]
  - - [6784, 704, 1, 128]
    - [80, 4068.95]
  - - [4, 4, 1, 256]
    - [49, 0.742029]
  - - [128, 5888, 1, 128]
    - [80, 2327.92]
  - - [1408, 5888, 1, 256]
    - [91, 6986.81]
  - - [704, 2944, 1, 1280]
    - [92, 7904.93]
  - - [4288, 64, 1, 1280]
    - [67, 3828.17]
  - - [256, 64, 1, 256]
    - [42, 655.36]
  - - [704, 1856, 1, 256]
    - [100, 5444.27]
  - - [704, 6784, 1, 128]
    - [80, 4319.67]
  - - [3584, 704, 1, 1280]
    - [100, 7726.33]
  - - [256, 128, 1, 1280]
    - [35, 2184.53]
  - - [5888, 2368, 1, 256]
    - [102, 8192.59]
  - - [256, 2368, 1, 1280]
    - [97, 5675.44]
  - - [2944, 6784, 1, 128]
    - [85, 4248.25]
  - - [3584, 448, 1, 3328]
    - [96, 6560.67]
  - - [1408, 4, 1, 256]
    - [114, 176.69]
  - - [704, 2368, 1, 3328]
    - [97, 7085.21]
  - - [2944, 448, 1, 256]
    - [93, 3411.9]
  - - [1856, 448, 1, 128]
    - [81, 2748.72]
  - - [4288, 4, 1, 3328]
    - [49, 553.548]
  - - [2368, 128, 1, 1280]
    - [70, 4173.55]
  - - [256, 5888, 1, 128]
    - [85, 2860.88]
  - - [64, 6784, 1, 256]
    - [98, 3637.08]
  - - [64, 5056, 1, 1280]
    - [97, 4289.43]
  - - [4, 6784, 1, 128]
    - [111, 160.806]
  - - [2048, 3200, 1, 512]
    - [98, 6926.99]
  - - [2944, 2944, 1, 1280]
    - [90, 6267.75]
  - - [5056, 448, 1, 3328]
    - [91, 7400.26]
  - - [4, 3584, 1, 1280]
    - [49, 499.73]
  - - [1408, 128, 1, 128]
    - [26, 1037.26]
  - - [6784, 704, 1, 3328]
    - [97, 7633.85]
  - - [128, 64, 1, 1280]
    - [49, 1170.29]
  - - [2368, 256, 1, 1280]
    - [97, 5609.79]
  - - [4, 448, 1, 3328]
    - [117, 358.4]
  - - [5888, 4288, 1, 128]
    - [85, 4521.64]
  - - [4, 5888, 1, 256]
    - [49, 353.833]
  - - [1408, 2944, 1, 3328]
    - [90, 8951.31]
  - - [3584, 704, 1, 128]
    - [80, 3395.31]
  - - [4608, 12000, 1, 1536]
    - [89, 6609.89]
  - - [64, 1024, 1, 256]
    - [35, 1588.75]
  - - [5056, 5056, 1, 128]
    - [80, 4080.71]
  - - [2368, 448, 1, 1280]
    - [91, 5422.94]
  - - [128, 3584, 1, 256]
    - [97, 4705.15]
  - - [704, 448, 1, 1280]
    - [94, 3960.97]
  - - [8192, 800, 1, 2048]
    - [92, 6306.26]
  - - [448, 5056, 1, 128]
    - [84, 3709.46]
  - - [256, 4, 1, 1280]
    - [116, 163.84]
  - - [5056, 3584, 1, 256]
    - [89, 7008.24]
  - - [2368, 4, 1, 3328]
    - [49, 496.266]
  - - [1408, 5056, 1, 128]
    - [84, 4175.27]
  - - [2944, 3584, 1, 128]
    - [80, 4659.69]
  - - [3584, 2368, 1, 256]
    - [102, 5851.77]
  - - [128, 3584, 1, 3328]
    - [92, 6104.94]
  - - [128, 1024, 1, 1280]
    - [32, 3847.99]
  - - [8448, 24000, 1, 2816]
    - [102, 5128.54]
  - - [64, 704, 1, 256]
    - [35, 1253.73]
  - - [4288, 256, 1, 1280]
    - [91, 5625.76]
  - - [3584, 3584, 1, 3328]
    - [96, 8206.05]
  - - [4, 704, 1, 128]
    - [111, 29.4484]
  - - [5888, 6784, 1, 256]
    - [98, 8248.65]
  - - [4288, 2944, 1, 3328]
    - [96, 8657.02]
  - - [2944, 64, 1, 128]
    - [15, 1240.6]
  - - [1024, 128, 1, 3328]
    - [40, 4433.0]
  - - [1024, 16, 1, 500000]
    - [3, 2571.05]
  - - [4288, 128, 1, 3328]
    - [40, 5716.75]
  - - [7680, 128, 1, 2560]
    - [38, 5488.0]
  - - [256, 5056, 1, 1280]
    - [98, 6379.96]
  - - [1408, 256, 1, 128]
    - [84, 1633.73]
  - - [2944, 5888, 1, 3328]
    - [93, 7848.92]
  - - [6784, 5888, 1, 1280]
    - [102, 9047.62]
  - - [2048, 800, 1, 512]
    - [97, 4841.07]
  - - [704, 128, 1, 256]
    - [42, 1567.17]
  - - [5888, 4288, 1, 1280]
    - [96, 7982.83]
  - - [1024, 24000, 1, 2048]
    - [98, 5774.3]
  - - [448, 256, 1, 1280]
    - [32, 3707.09]
  - - [5888, 3584, 1, 128]
    - [85, 3804.4]
  - - [1024, 2944, 1, 128]
    - [80, 3308.26]
  - - [5056, 4, 1, 1280]
    - [113, 468.962]
  - - [256, 1408, 1, 1280]
    - [91, 4899.89]
  - - [3072, 16, 1, 1024]
    - [49, 1233.62]
  - - [704, 3584, 1, 128]
    - [80, 3919.43]
  - - [5888, 448, 1, 3328]
    - [110, 6095.61]
  - - [2368, 4288, 1, 1280]
    - [92, 8338.3]
  - - [4288, 2944, 1, 128]
    - [84, 3946.5]
  - - [1024, 6784, 1, 3328]
    - [98, 7494.28]
  - - [128, 2368, 1, 256]
    - [97, 2895.32]
  - - [6784, 64, 1, 3328]
    - [91, 5964.89]
  - - [5056, 2944, 1, 3328]
    - [102, 6605.53]
  - - [448, 128, 1, 256]
    - [35, 1339.42]
  - - [2944, 3584, 1, 256]
    - [98, 7165.56]
  - - [1408, 1408, 1, 3328]
    - [102, 8332.86]
  - - [1856, 128, 1, 1280]
    - [97, 4498.33]
  - - [3584, 3584, 1, 128]
    - [81, 4000.01]
  - - [64, 3584, 1, 256]
    - [108, 2383.13]
  - - [1408, 4, 1, 3328]
    - [59, 422.908]
  - - [128, 2944, 1, 3328]
    - [64, 5429.93]
  - - [3584, 704, 1, 256]
    - [97, 6153.99]
  - - [2944, 448, 1, 3328]
    - [97, 6507.72]
  - - [3584, 1408, 1, 3328]
    - [102, 8829.63]
  - - [704, 3584, 1, 1280]
    - [92, 7860.23]
  - - [2944, 6784, 1, 1280]
    - [102, 8894.5]
  - - [1856, 6784, 1, 256]
    - [102, 8115.09]
  - - [4288, 448, 1, 3328]
    - [94, 6397.25]
  - - [6784, 4288, 1, 128]
    - [80, 4109.44]
  - - [6784, 704, 1, 1280]
    - [90, 7999.04]
  - - [256, 4288, 1, 256]
    - [94, 4603.84]
  - - [3584, 6784, 1, 256]
    - [102, 7361.55]
  - - [6144, 12000, 1, 2048]
    - [101, 6311.66]
  - - [6144, 16, 1, 2560]
    - [50, 2240.55]
  - - [3584, 64, 1, 128]
    - [21, 1292.26]
  - - [5888, 1024, 1, 3328]
    - [89, 8394.49]
  - - [448, 64, 1, 128]
    - [12, 262.144]
  - - [704, 6784, 1, 1280]
    - [96, 7740.56]
  - - [4, 1024, 1, 1280]
    - [49, 378.821]
  - - [5888, 128, 1, 256]
    - [97, 5003.58]
  - - [4096, 16, 1, 4096]
    - [49, 1585.75]
  - - [1856, 5056, 1, 3328]
    - [90, 8522.82]
  - - [4, 6784, 1, 256]
    - [34, 387.657]
  - - [1024, 3584, 1, 128]
    - [84, 3031.51]
  - - [1024, 1408, 1, 128]
    - [86, 2600.75]
  - - [2368, 2944, 1, 128]
    - [83, 4340.16]
  - - [5056, 64, 1, 256]
    - [97, 3109.52]
  - - [4, 448, 1, 1280]
    - [117, 253.735]
  - - [5056, 2944, 1, 128]
    - [88, 3739.91]
  - - [5888, 5056, 1, 3328]
    - [102, 9016.38]
  - - [1024, 704, 1, 128]
    - [84, 2363.56]
  - - [5888, 2368, 1, 128]
    - [87, 3651.73]
  - - [128, 5056, 1, 3328]
    - [91, 6243.54]
  - - [3584, 6784, 1, 1280]
    - [89, 9080.57]
  - - [448, 4, 1, 1280]
    - [117, 242.983]
  - - [1856, 5888, 1, 256]
    - [102, 8182.02]
  - - [256, 256, 1, 256]
    - [35, 1542.02]
  - - [256, 64, 1, 128]
    - [16, 135.126]
  - - [4288, 4288, 1, 3328]
    - [102, 8674.54]
  - - [4288, 1408, 1, 1280]
    - [90, 7867.08]
  - - [3584, 5056, 1, 128]
    - [80, 4457.73]
  - - [4, 1024, 1, 3328]
    - [29, 440.294]
  - - [4288, 2368, 1, 256]
    - [110, 5699.47]
  - - [2944, 5056, 1, 1280]
    - [102, 8236.46]
  - - [448, 6784, 1, 256]
    - [92, 6620.52]
  - - [64, 128, 1, 128]
    - [17, 67.5629]
  - - [1856, 2368, 1, 128]
    - [84, 4233.6]
  - - [6784, 2368, 1, 3328]
    - [102, 8269.8]
  - - [256, 1024, 1, 1280]
    - [91, 4882.78]
  - - [704, 4, 1, 128]
    - [111, 19.011]
  - - [256, 4, 1, 256]
    - [49, 46.8114]
  - - [4288, 128, 1, 256]
    - [97, 4273.39]
  - - [4288, 1856, 1, 3328]
    - [92, 8195.71]
  - - [3584, 448, 1, 128]
    - [85, 2750.55]
  - - [2048, 1600, 1, 2048]
    - [108, 5753.49]
  - - [256, 4, 1, 3328]
    - [118, 297.878]
  - - [4, 1408, 1, 1280]
    - [116, 402.286]
  - - [3584, 64, 1, 1280]
    - [105, 4096.0]
  - - [1408, 448, 1, 128]
    - [80, 2498.15]
  - - [3584, 1024, 1, 1280]
    - [102, 7252.08]
  - - [1856, 5056, 1, 256]
    - [96, 7711.49]
  - - [4, 3584, 1, 256]
    - [113, 314.214]
  - - [4, 2944, 1, 1280]
    - [49, 483.118]
  - - [1024, 4288, 1, 256]
    - [101, 6544.42]
  - - [5888, 3584, 1, 3328]
    - [90, 8105.05]
  - - [1856, 4, 1, 256]
    - [49, 252.732]
  - - [4, 256, 1, 256]
    - [34, 48.1882]
  - - [5056, 3584, 1, 3328]
    - [95, 7354.7]
  - - [704, 448, 1, 128]
    - [88, 1233.81]
  - - [2368, 1408, 1, 1280]
    - [96, 6654.14]
  - - [5056, 2944, 1, 1280]
    - [102, 8505.62]
  - - [4, 4, 1, 128]
    - [112, 0.0478505]
  - - [3584, 256, 1, 256]
    - [94, 4616.37]
  - - [1024, 6784, 1, 256]
    - [96, 7944.88]
  - - [4, 128, 1, 256]
    - [49, 29.2571]
  - - [64, 64, 1, 1280]
    - [60, 642.51]
  - - [5124, 9124, 1, 2048]
    - [102, 8019.3]
  - - [6784, 4, 1, 128]
    - [111, 192.967]
  - - [2944, 1408, 1, 128]
    - [80, 3827.03]
  - - [448, 128, 1, 3328]
    - [53, 4063.9]
  - - [3584, 1408, 1, 1280]
    - [102, 7180.73]
  - - [64, 4288, 1, 3328]
    - [48, 4786.74]
  - - [5056, 6784, 1, 3328]
    - [89, 7889.73]
  - - [128, 2944, 1, 256]
    - [92, 3599.59]
  - - [128, 6784, 1, 128]
    - [10, 2606.69]
  - - [3584, 4288, 1, 256]
    - [96, 7299.71]
  - - [448, 1856, 1, 256]
    - [92, 5206.97]
  - - [1856, 6784, 1, 3328]
    - [94, 8386.26]
  - - [3584, 128, 1, 3328]
    - [38, 5589.94]
  - - [64, 1856, 1, 256]
    - [31, 1949.28]
  - - [64, 448, 1, 256]
    - [36, 955.733]
  - - [5888, 4288, 1, 256]
    - [100, 7791.74]
  - - [4, 448, 1, 128]
    - [111, 8.74146]
  - - [5056, 1408, 1, 256]
    - [102, 5153.91]
  - - [35, 8457, 1, 2048]
    - [7, 3182.47]
  - - [64, 256, 1, 1280]
    - [56, 1713.36]
  - - [3584, 1024, 1, 256]
    - [92, 6528.08]
  - - [256, 704, 1, 256]
    - [91, 2720.36]
  - - [5888, 5888, 1, 256]
    - [100, 7992.16]
  - - [4288, 1024, 1, 1280]
    - [94, 7837.4]
  - - [5888, 128, 1, 3328]
    - [97, 7181.03]
  - - [448, 6784, 1, 3328]
    - [91, 7663.0]
  - - [2944, 1408, 1, 1280]
    - [100, 7903.04]
  - - [64, 128, 1, 1280]
    - [49, 1191.56]
  - - [2944, 1856, 1, 3328]
    - [90, 7844.31]
  - - [2368, 64, 1, 128]
    - [21, 997.873]
  - - [256, 1024, 1, 128]
    - [80, 1215.74]
  - - [3584, 5888, 1, 1280]
    - [89, 8958.84]
  - - [64, 4, 1, 128]
    - [112, 1.11608]
  - - [6784, 1856, 1, 1280]
    - [89, 6728.7]
  - - [2944, 5056, 1, 256]
    - [102, 8275.11]
  - - [4288, 4, 1, 128]
    - [111, 147.544]
  - - [5888, 256, 1, 3328]
    - [98, 7094.1]
  - - [2944, 4288, 1, 128]
    - [83, 4611.45]
  - - [3584, 1408, 1, 256]
    - [93, 6542.96]
  - - [704, 3584, 1, 3328]
    - [92, 8117.1]
  - - [4096, 3200, 1, 1024]
    - [107, 6656.03]
  - - [5056, 448, 1, 1280]
    - [105, 6096.1]
  - - [3584, 1856, 1, 3328]
    - [90, 8552.31]
  - - [4288, 6784, 1, 1280]
    - [96, 8212.36]
  - - [2560, 7000, 1, 2560]
    - [98, 7655.24]
  - - [1408, 704, 1, 1280]
    - [94, 5756.69]
  - - [2944, 1024, 1, 256]
    - [102, 6880.81]
  - - [6784, 64, 1, 256]
    - [97, 4438.86]
  - - [2368, 4288, 1, 3328]
    - [98, 8377.89]
  - - [4, 1408, 1, 256]
    - [115, 222.499]
  - - [1024, 1408, 1, 1280]
    - [92, 6339.28]
  - - [64, 64, 1, 256]
    - [49, 187.246]
  - - [704, 256, 1, 3328]
    - [91, 4046.04]
  - - [6784, 5056, 1, 256]
    - [102, 7972.07]
  - - [1856, 1856, 1, 128]
    - [86, 3716.51]
  - - [3584, 5056, 1, 3328]
    - [102, 8684.66]
  - - [448, 6784, 1, 128]
    - [84, 3828.95]
  - - [4, 704, 1, 3328]
    - [117, 393.106]
  - - [35, 8457, 1, 4096]
    - [6, 3173.14]
  - - [448, 2944, 1, 256]
    - [100, 5553.31]
  - - [4, 4288, 1, 3328]
    - [59, 573.111]
  - - [2944, 6784, 1, 256]
    - [96, 8565.96]
  - - [2944, 2944, 1, 128]
    - [80, 4540.73]
  - - [4, 4, 1, 1280]
    - [59, 3.04762]
  - - [1856, 3584, 1, 1280]
    - [96, 7306.26]
  - - [64, 2944, 1, 256]
    - [108, 2292.51]
  - - [448, 256, 1, 128]
    - [17, 797.83]
  - - [4288, 448, 1, 128]
    - [83, 3430.4]
  - - [4608, 24000, 1, 1536]
    - [101, 6820.14]
  - - [1856, 1408, 1, 3328]
    - [104, 6600.14]
  - - [128, 128, 1, 128]
    - [9, 161.817]
  - - [1024, 4288, 1, 3328]
    - [92, 7936.98]
  - - [448, 2368, 1, 256]
    - [100, 4526.35]
  - - [1024, 4, 1, 128]
    - [112, 16.8907]
  - - [64, 1408, 1, 1280]
    - [32, 3345.22]
  - - [64, 6784, 1, 1280]
    - [97, 5526.5]
  - - [5056, 448, 1, 256]
    - [91, 4216.55]
  - - [2944, 2368, 1, 3328]
    - [102, 7000.32]
  - - [704, 4288, 1, 3328]
    - [108, 6414.33]
  - - [1408, 128, 1, 256]
    - [91, 2720.36]
  - - [1024, 1856, 1, 1280]
    - [102, 7682.83]
  - - [2048, 6400, 1, 2048]
    - [98, 7418.12]
  - - [512, 48000, 1, 2816]
    - [102, 8884.67]
  - - [5124, 9124, 1, 2560]
    - [94, 6040.7]
  - - [128, 2368, 1, 3328]
    - [48, 5025.56]
  - - [1024, 5888, 1, 256]
    - [96, 7322.11]
  - - [64, 2944, 1, 1280]
    - [32, 4222.21]
  - - [5056, 64, 1, 3328]
    - [73, 4936.22]
  - - [128, 704, 1, 128]
    - [18, 683.314]
  - - [1408, 2368, 1, 256]
    - [97, 6404.12]
  - - [1408, 1408, 1, 256]
    - [102, 4537.83]
  - - [4, 64, 1, 128]
    - [111, 2.46747]
  - - [64, 1024, 1, 128]
    - [10, 532.272]
  - - [1024, 8, 1, 500000]
    - [0, 1684.98]
  - - [2368, 2368, 1, 128]
    - [81, 4334.23]
  - - [64, 5888, 1, 128]
    - [10, 2003.09]
  - - [5888, 4, 1, 3328]
    - [28, 339.018]
  - - [6784, 1408, 1, 128]
    - [84, 4431.13]
  - - [4288, 5888, 1, 256]
    - [102, 7800.78]
  - - [1408, 5056, 1, 256]
    - [96, 8153.28]
  - - [5056, 128, 1, 3328]
    - [53, 5829.83]
  - - [128, 128, 1, 1280]
    - [56, 1691.25]
  - - [448, 704, 1, 256]
    - [97, 3364.18]
  - - [4288, 3584, 1, 128]
    - [81, 2952.58]
  - - [2944, 128, 1, 3328]
    - [53, 5620.72]
  - - [64, 1408, 1, 3328]
    - [54, 4169.81]
  - - [3584, 5056, 1, 1280]
    - [99, 7780.66]
  - - [256, 448, 1, 1280]
    - [32, 3929.35]
  - - [704, 704, 1, 128]
    - [80, 2346.07]
  - - [5056, 4, 1, 128]
    - [111, 144.457]
  - - [704, 256, 1, 1280]
    - [100, 2283.12]
  - - [64, 2368, 1, 3328]
    - [32, 4921.59]
  - - [1856, 1024, 1, 128]
    - [81, 3459.47]
  - - [1856, 64, 1, 128]
    - [13, 918.137]
  - - [4096, 64, 1, 4096]
    - [58, 4000.52]
  - - [1024, 24000, 1, 1536]
    - [94, 8502.26]
  - - [704, 4288, 1, 256]
    - [98, 6003.73]
  - - [5888, 2368, 1, 1280]
    - [89, 8801.2]
  - - [128, 256, 1, 256]
    - [43, 1069.98]
  - - [64, 128, 1, 256]
    - [49, 374.491]
  - - [2368, 5888, 1, 1280]
    - [92, 8308.53]
  - - [5888, 256, 1, 1280]
    - [100, 7154.32]
  - - [1760, 128, 1, 1760]
    - [41, 5363.81]
  - - [4, 5888, 1, 1280]
    - [49, 542.204]
  - - [704, 128, 1, 128]
    - [21, 779.347]
  - - [1024, 4, 1, 1280]
    - [49, 392.431]
  - - [2368, 1856, 1, 3328]
    - [92, 7975.22]
  - - [2368, 128, 1, 128]
    - [14, 1584.86]
  - - [2944, 704, 1, 256]
    - [100, 4039.11]
  - - [5056, 128, 1, 128]
    - [80, 2575.79]
  - - [2368, 1024, 1, 3328]
    - [108, 6165.44]
  - - [256, 704, 1, 3328]
    - [91, 4028.64]
  - - [704, 3584, 1, 256]
    - [102, 6102.82]
  - - [704, 2944, 1, 3328]
    - [92, 8202.74]
  - - [6784, 1024, 1, 128]
    - [84, 4386.3]
  - - [256, 448, 1, 128]
    - [21, 834.095]
  - - [448, 1024, 1, 3328]
    - [109, 5412.38]
  - - [2944, 1024, 1, 3328]
    - [102, 6265.77]
  - - [2944, 5056, 1, 128]
    - [80, 4770.78]
  - - [2368, 256, 1, 256]
    - [97, 3975.13]
  - - [1408, 6784, 1, 256]
    - [96, 7986.92]
  - - [6784, 1408, 1, 3328]
    - [96, 8472.61]
  - - [4288, 6784, 1, 128]
    - [87, 3865.1]
  - - [704, 64, 1, 256]
    - [35, 1287.31]
  - - [5888, 4, 1, 1280]
    - [34, 509.922]
  - - [256, 2368, 1, 3328]
    - [97, 5837.55]
  - - [6784, 2944, 1, 1280]
    - [102, 8560.44]
  - - [4288, 1856, 1, 128]
    - [80, 4616.97]
  - - [1856, 2944, 1, 128]
    - [80, 4287.63]
  - - [6784, 448, 1, 128]
    - [84, 3893.33]
  - - [64, 3584, 1, 128]
    - [10, 1609.66]
  - - [448, 5056, 1, 1280]
    - [100, 7124.31]
  - - [2368, 1856, 1, 128]
    - [83, 4004.55]
  - - [64, 2944, 1, 3328]
    - [33, 5086.38]
  - - [4288, 704, 1, 256]
    - [98, 6176.47]
  - - [256, 3584, 1, 128]
    - [81, 2553.05]
  - - [5888, 704, 1, 256]
    - [97, 6781.41]
  - - [3584, 1024, 1, 128]
    - [84, 3660.85]
  - - [256, 5888, 1, 3328]
    - [100, 7772.03]
  - - [1408, 4288, 1, 3328]
    - [96, 8832.76]
  - - [6784, 4288, 1, 256]
    - [102, 8566.04]
  - - [4288, 256, 1, 128]
    - [82, 1953.69]
  - - [5888, 256, 1, 256]
    - [100, 3730.43]
  - - [6784, 1024, 1, 1280]
    - [96, 8578.29]
  - - [5888, 1024, 1, 128]
    - [81, 4092.86]
  - - [1024, 128, 1, 256]
    - [31, 1897.88]
  - - [512, 16, 1, 500000]
    - [2, 2363.69]
  - - [128, 64, 1, 3328]
    - [59, 1592.46]
  - - [448, 64, 1, 256]
    - [49, 976.068]
  - - [2368, 256, 1, 128]
    - [84, 2094.89]
  - - [6784, 3584, 1, 1280]
    - [96, 8570.06]
  - - [1024, 6784, 1, 1280]
    - [102, 8203.47]
  - - [2944, 64, 1, 1280]
    - [40, 4300.51]
  - - [1408, 2944, 1, 1280]
    - [92, 7349.54]
  - - [256, 1856, 1, 256]
    - [91, 4649.65]
  - - [2048, 800, 1, 2048]
    - [110, 4668.63]
  - - [1408, 2368, 1, 3328]
    - [100, 7537.64]
  - - [2944, 4, 1, 3328]
    - [49, 514.042]
  - - [128, 1408, 1, 3328]
    - [41, 4991.54]
  - - [2944, 1856, 1, 128]
    - [80, 4317.29]
  - - [256, 2944, 1, 128]
    - [80, 2258.17]
  - - [256, 6784, 1, 128]
    - [80, 3146.92]
  - - [2368, 4, 1, 128]
    - [112, 33.8286]
  - - [1408, 256, 1, 3328]
    - [91, 5077.75]
  - - [1856, 4, 1, 128]
    - [112, 21.4025]
  - - [5056, 6784, 1, 128]
    - [80, 4945.01]
  - - [4288, 5056, 1, 128]
    - [83, 4729.77]
  - - [1856, 5888, 1, 128]
    - [80, 4707.86]
  - - [2944, 5888, 1, 256]
    - [94, 8014.68]
  - - [3584, 1856, 1, 256]
    - [96, 7567.03]
  - - [4288, 3584, 1, 1280]
    - [89, 8726.33]
  - - [2368, 448, 1, 256]
    - [97, 4227.6]
  - - [4288, 256, 1, 3328]
    - [98, 5487.31]
  - - [1856, 704, 1, 128]
    - [84, 3124.96]
  - - [1408, 64, 1, 256]
    - [44, 1619.99]
  - - [64, 1856, 1, 128]
    - [8, 955.047]
  - - [4, 256, 1, 128]
    - [111, 10.7789]
  - - [2560, 16, 1, 2560]
    - [56, 2019.6]
  - - [704, 5888, 1, 128]
    - [85, 3976.16]
  - - [6784, 3584, 1, 128]
    - [84, 4018.81]
  - - [1024, 64, 1, 256]
    - [49, 1370.69]
  - - [64, 2368, 1, 256]
    - [91, 2255.66]
  - - [4288, 5056, 1, 3328]
    - [96, 8368.59]
  - - [4, 1856, 1, 1280]
    - [49, 392.026]
  - - [4288, 128, 1, 128]
    - [14, 2286.93]
  - - [1408, 1408, 1, 128]
    - [84, 3233.38]
  - - [7680, 16, 1, 2560]
    - [52, 2257.27]
  - - [1856, 128, 1, 128]
    - [14, 1532.7]
  - - [5056, 2368, 1, 256]
    - [96, 8167.19]
  - - [4288, 704, 1, 3328]
    - [102, 6411.06]
  - - [448, 3584, 1, 256]
    - [102, 5477.64]
  - - [2368, 64, 1, 1280]
    - [32, 3936.42]
  - - [2368, 1024, 1, 1280]
    - [98, 7688.72]
  - - [2944, 1408, 1, 3328]
    - [89, 7668.68]
  - - [1408, 448, 1, 256]
    - [91, 4863.88]
  - - [1024, 1408, 1, 3328]
    - [100, 7448.89]
  - - [2944, 5888, 1, 1280]
    - [90, 8208.47]
  - - [1408, 4, 1, 1280]
    - [29, 479.319]
  - - [5888, 3584, 1, 256]
    - [90, 8609.99]
  - - [2368, 5056, 1, 128]
    - [87, 3726.15]
  - - [1408, 1856, 1, 3328]
    - [91, 7829.38]
  - - [4, 4, 1, 3328]
    - [118, 4.29419]
  - - [6784, 1408, 1, 1280]
    - [91, 7690.7]
  - - [4096, 7000, 1, 4096]
    - [103, 6272.39]
  - - [704, 2944, 1, 256]
    - [92, 6095.81]
  - - [4288, 64, 1, 256]
    - [57, 2121.21]
  - - [6784, 5888, 1, 3328]
    - [96, 8955.5]
  - - [2368, 4288, 1, 128]
    - [80, 4699.55]
  - - [64, 4288, 1, 1280]
    - [70, 4013.63]
  - - [6784, 64, 1, 1280]
    - [91, 5418.73]
  - - [3584, 128, 1, 128]
    - [20, 2165.2]
  - - [1024, 6784, 1, 128]
    - [81, 3765.2]
  - - [4, 1856, 1, 128]
    - [112, 33.2728]
  - - [1408, 64, 1, 3328]
    - [53, 4489.41]
  - - [6784, 4, 1, 256]
    - [49, 400.162]
  - - [1408, 1408, 1, 1280]
    - [96, 8139.43]
  - - [16384, 400, 1, 4096]
    - [100, 6087.18]
  - - [256, 2368, 1, 256]
    - [91, 4766.25]
  - - [448, 4288, 1, 3328]
    - [98, 7576.98]
  - - [2368, 1408, 1, 256]
    - [94, 5284.43]
  - - [5888, 5056, 1, 128]
    - [81, 3643.5]
  - - [704, 2368, 1, 256]
    - [96, 5334.63]
  - - [1024, 24000, 1, 2560]
    - [104, 7437.96]
  - - [2944, 448, 1, 1280]
    - [105, 4937.43]
  - - [5888, 2368, 1, 3328]
    - [90, 8201.74]
  - - [5124, 9124, 1, 1760]
    - [97, 6763.96]
  - - [448, 1408, 1, 1280]
    - [91, 5881.44]
  - - [448, 1856, 1, 1280]
    - [98, 6225.46]
  - - [4288, 448, 1, 1280]
    - [100, 5626.27]
  - - [5888, 704, 1, 3328]
    - [94, 7873.52]
  - - [5056, 256, 1, 128]
    - [85, 2920.93]
  - - [1856, 256, 1, 128]
    - [87, 1995.32]
  - - [64, 1408, 1, 128]
    - [8, 758.838]
  - - [704, 4, 1, 256]
    - [49, 130.597]
  - - [1408, 5888, 1, 128]
    - [80, 4573.95]
  - - [7680, 12000, 1, 2560]
    - [96, 8747.03]
  - - [1408, 1024, 1, 256]
    - [93, 4609.13]
  - - [8192, 400, 1, 2048]
    - [105, 5283.15]
  - - [1024, 1856, 1, 128]
    - [80, 2686.28]
  - - [256, 704, 1, 128]
    - [80, 1004.73]
  - - [2560, 128, 1, 2560]
    - [58, 4259.04]
  - - [448, 1024, 1, 256]
    - [91, 4813.14]
  - - [128, 4, 1, 3328]
    - [117, 128.308]
  - - [5056, 6784, 1, 1280]
    - [99, 6579.75]
  - - [1408, 64, 1, 128]
    - [21, 819.2]
  - - [1024, 448, 1, 1280]
    - [100, 5703.21]
  - - [704, 5056, 1, 3328]
    - [92, 7574.39]
  - - [128, 5056, 1, 256]
    - [91, 5113.43]
  - - [64, 1024, 1, 3328]
    - [76, 3980.0]
  - - [1856, 4, 1, 3328]
    - [30, 433.153]
  - - [4, 2944, 1, 128]
    - [112, 46.5225]
  - - [2368, 2944, 1, 3328]
    - [90, 9002.03]
  - - [448, 448, 1, 1280]
    - [32, 3969.42]
  - - [2368, 3584, 1, 256]
    - [102, 7806.29]
  - - [5056, 3584, 1, 1280]
    - [89, 8971.46]
  - - [5124, 9124, 1, 4096]
    - [102, 7208.62]
  - - [7680, 48000, 1, 2560]
    - [96, 3835.81]
  - - [448, 4, 1, 3328]
    - [117, 409.6]
  - - [1856, 2944, 1, 1280]
    - [89, 7173.61]
  - - [1024, 48000, 1, 2816]
    - [96, 8976.16]
  - - [128, 1024, 1, 256]
    - [35, 1969.16]
  - - [2944, 1408, 1, 256]
    - [98, 4585.02]
  - - [4288, 1408, 1, 3328]
    - [92, 8237.17]
  - - [3584, 64, 1, 3328]
    - [38, 5183.06]
  - - [5888, 2944, 1, 128]
    - [87, 3674.46]
  - - [2944, 1024, 1, 128]
    - [84, 3834.22]
  - - [4288, 5056, 1, 1280]
    - [96, 8086.0]
  - - [5888, 6784, 1, 1280]
    - [90, 6941.22]
  - - [6784, 5056, 1, 128]
    - [81, 4860.05]
  - - [256, 1024, 1, 3328]
    - [105, 5156.12]
  - - [3584, 4, 1, 256]
    - [49, 332.429]
  - - [1760, 1600, 1, 1760]
    - [92, 6330.66]
  - - [1856, 64, 1, 3328]
    - [53, 4755.93]
  - - [4, 128, 1, 3328]
    - [117, 160.144]
  - - [5888, 1408, 1, 3328]
    - [90, 8722.64]
  - - [448, 2944, 1, 128]
    - [83, 2997.53]
  - - [2368, 1856, 1, 256]
    - [91, 6662.24]
  - - [256, 5056, 1, 256]
    - [93, 5256.19]
  - - [128, 3584, 1, 128]
    - [12, 2073.46]
  - - [448, 3584, 1, 3328]
    - [89, 6833.86]
  - - [4, 5056, 1, 3328]
    - [59, 581.423]
  - - [704, 2368, 1, 128]
    - [80, 3402.19]
  - - [5888, 256, 1, 128]
    - [85, 2977.44]
  - - [4, 5056, 1, 128]
    - [111, 65.1074]
  - - [448, 256, 1, 256]
    - [97, 1764.43]
  - - [704, 4, 1, 3328]
    - [49, 398.454]
  - - [1408, 256, 1, 256]
    - [92, 3463.76]
  - - [3584, 1856, 1, 128]
    - [88, 3228.09]
  - - [4288, 4288, 1, 128]
    - [84, 4853.83]
  - - [1856, 1024, 1, 3328]
    - [108, 5994.58]
  - - [128, 5888, 1, 3328]
    - [62, 6512.75]
  - - [1024, 5056, 1, 256]
    - [102, 7859.32]
  - - [5888, 5888, 1, 1280]
    - [102, 8131.34]
  - - [5056, 5888, 1, 128]
    - [81, 4920.61]
  - - [2368, 1408, 1, 3328]
    - [100, 7110.64]
  - - [1024, 48000, 1, 1536]
    - [100, 8590.72]
  - - [5888, 448, 1, 256]
    - [101, 3567.64]
  - - [2560, 3200, 1, 2560]
    - [91, 7638.21]
  - - [5888, 6784, 1, 128]
    - [81, 3910.82]
  - - [6144, 48000, 1, 2048]
    - [102, 3412.85]
  - - [6784, 5056, 1, 1280]
    - [93, 7890.12]
  - - [5056, 704, 1, 1280]
    - [97, 7664.96]
  - - [1024, 48000, 1, 2560]
    - [102, 8188.4]
  - - [4608, 32, 1, 1536]
    - [70, 2856.87]
  - - [1024, 2368, 1, 128]
    - [80, 3019.25]
  - - [128, 704, 1, 256]
    - [31, 1696.23]
  - - [2368, 448, 1, 3328]
    - [97, 5799.19]
  - - [128, 5888, 1, 1280]
    - [91, 6680.65]
  - - [16384, 800, 1, 4096]
    - [96, 6322.12]
  - - [448, 128, 1, 1280]
    - [70, 2849.39]
  - - [6784, 4, 1, 3328]
    - [49, 563.02]
  - - [5888, 5056, 1, 1280]
    - [96, 8631.23]
  - - [1024, 64, 1, 3328]
    - [71, 3481.86]
  - - [3072, 48000, 1, 1024]
    - [96, 9019.39]
  - - [64, 3584, 1, 1280]
    - [33, 4327.85]
  - - [6784, 1408, 1, 256]
    - [96, 6320.49]
  - - [3584, 5888, 1, 128]
    - [83, 4406.69]
  - - [5056, 5888, 1, 256]
    - [102, 8037.03]
  - - [2368, 1024, 1, 256]
    - [94, 4936.04]
  - - [2944, 1856, 1, 256]
    - [102, 7222.22]
  - - [1856, 6784, 1, 1280]
    - [92, 8251.71]
  - - [64, 5056, 1, 128]
    - [12, 1643.6]
  - - [64, 6784, 1, 128]
    - [10, 1929.67]
  - - [448, 704, 1, 128]
    - [82, 979.859]
  - - [4, 1024, 1, 128]
    - [111, 20.0416]
  - - [4288, 3584, 1, 256]
    - [96, 8444.04]
  - - [1408, 704, 1, 128]
    - [80, 3020.9]
  - - [64, 256, 1, 3328]
    - [76, 2227.37]
  - - [6784, 448, 1, 3328]
    - [102, 6573.01]
  - - [5056, 1856, 1, 1280]
    - [94, 7976.13]
  - - [1408, 1024, 1, 3328]
    - [92, 7470.23]
  - - [2368, 256, 1, 3328]
    - [97, 5394.27]
  - - [5888, 3584, 1, 1280]
    - [89, 9031.45]
  - - [1856, 3584, 1, 3328]
    - [104, 7272.5]
  - - [5888, 128, 1, 1280]
    - [97, 6684.38]
  - - [1024, 2944, 1, 256]
    - [102, 7414.99]
  - - [448, 6784, 1, 1280]
    - [98, 7923.68]
  - - [256, 3584, 1, 1280]
    - [94, 6901.77]
  - - [704, 5056, 1, 256]
    - [99, 5004.45]
  - - [3584, 1024, 1, 3328]
    - [91, 7894.53]
  - - [2944, 1856, 1, 1280]
    - [96, 7903.17]
  - - [128, 256, 1, 128]
    - [9, 325.645]
  - - [5056, 256, 1, 256]
    - [93, 3356.46]
  - - [2944, 4288, 1, 3328]
    - [102, 7813.83]
  - - [2368, 3584, 1, 3328]
    - [102, 8370.99]
  - - [2944, 704, 1, 1280]
    - [108, 5513.99]
  - - [128, 4, 1, 256]
    - [49, 25.2062]
  - - [2944, 3584, 1, 1280]
    - [96, 7738.73]
  - - [1856, 5888, 1, 1280]
    - [90, 8584.53]
  - - [256, 256, 1, 1280]
    - [70, 2962.08]
  - - [2048, 3200, 1, 2048]
    - [98, 6911.59]
  - - [4288, 1408, 1, 256]
    - [96, 7953.9]
  - - [3584, 64, 1, 256]
    - [97, 2780.32]
  - - [64, 1856, 1, 3328]
    - [32, 4911.94]
  - - [256, 1408, 1, 128]
    - [80, 1373.14]
  - - [5888, 1408, 1, 128]
    - [85, 4241.91]
  - - [4288, 2368, 1, 1280]
    - [94, 8012.6]
  - - [4, 4288, 1, 256]
    - [115, 301.574]
  - - [256, 4288, 1, 128]
    - [80, 2706.26]
  - - [2048, 128, 1, 2048]
    - [75, 2885.16]
  - - [256, 128, 1, 3328]
    - [77, 3170.11]
  - - [512, 8, 1, 500000]
    - [1, 1915.02]
  - - [6784, 2368, 1, 256]
    - [96, 8323.56]
  - - [5888, 128, 1, 128]
    - [84, 2465.98]
  - - [1024, 24000, 1, 2816]
    - [94, 8131.54]
  - - [7680, 5984, 1, 2560]
    - [98, 6040.67]
  - - [4288, 1856, 1, 256]
    - [110, 5818.43]
  - - [1856, 256, 1, 3328]
    - [91, 6531.93]
  - - [1856, 2944, 1, 256]
    - [96, 7312.82]
  - - [5056, 1024, 1, 128]
    - [86, 4102.9]
  - - [64, 5888, 1, 1280]
    - [91, 5058.15]
  - - [1760, 800, 1, 1760]
    - [94, 7279.9]
  - - [6784, 256, 1, 128]
    - [84, 3257.59]
  - - [5888, 704, 1, 128]
    - [80, 3813.83]
  - - [1408, 2368, 1, 128]
    - [81, 3561.17]
  - - [1024, 4288, 1, 1280]
    - [100, 7752.64]
  - - [2368, 5056, 1, 3328]
    - [103, 7711.81]
  - - [448, 4, 1, 128]
    - [111, 18.3795]
  - - [4, 256, 1, 3328]
    - [118, 269.61]
  - - [4288, 1024, 1, 3328]
    - [97, 7910.17]
  - - [6144, 48000, 1, 2560]
    - [96, 3540.99]
  - - [1024, 5056, 1, 3328]
    - [90, 8509.56]
  - - [1024, 1856, 1, 3328]
    - [96, 7907.83]
  - - [704, 704, 1, 1280]
    - [108, 5648.05]
  - - [128, 2368, 1, 1280]
    - [67, 4145.01]
  - - [1408, 128, 1, 3328]
    - [40, 4919.5]
  - - [3584, 256, 1, 1280]
    - [92, 5185.46]
  - - [4, 128, 1, 128]
    - [111, 2.97891]
  - - [5888, 64, 1, 1280]
    - [40, 4499.49]
  - - [3584, 128, 1, 1280]
    - [97, 5928.91]
  - - [4, 256, 1, 1280]
    - [116, 170.667]
  - - [128, 704, 1, 3328]
    - [40, 4379.27]
  - - [4288, 6784, 1, 256]
    - [90, 7180.99]
  - - [3584, 2944, 1, 3328]
    - [96, 8553.2]
  - - [128, 1856, 1, 256]
    - [97, 3207.67]
  - - [64, 4288, 1, 256]
    - [91, 2907.89]
  - - [4, 3584, 1, 3328]
    - [49, 560.505]
  - - [64, 4, 1, 3328]
    - [118, 67.4025]
  - - [4, 64, 1, 3328]
    - [118, 88.7467]
  - - [5888, 2944, 1, 256]
    - [96, 7255.67]
  - - [1856, 64, 1, 256]
    - [42, 1743.62]
  - - [5056, 128, 1, 1280]
    - [97, 6009.69]
  - - [448, 4288, 1, 1280]
    - [98, 6466.72]
  - - [448, 1856, 1, 3328]
    - [98, 6381.89]
  - - [1024, 4288, 1, 128]
    - [83, 3491.77]
  - - [4, 1024, 1, 256]
    - [116, 172.463]
  - - [5056, 4288, 1, 256]
    - [96, 8241.42]
  - - [1024, 448, 1, 256]
    - [100, 4218.41]
  - - [1024, 3584, 1, 256]
    - [96, 6513.59]
  - - [2944, 128, 1, 1280]
    - [40, 4710.38]
  - - [2048, 32, 1, 2048]
    - [55, 1779.13]
  - - [64, 256, 1, 256]
    - [49, 655.36]
  - - [1408, 4, 1, 128]
    - [112, 20.0249]
  - - [128, 2368, 1, 128]
    - [12, 1707.63]
  - - [256, 704, 1, 1280]
    - [91, 3735.21]
  - - [64, 2368, 1, 128]
    - [19, 1049.71]
  - - [6784, 6784, 1, 3328]
    - [96, 9277.84]
  - - [448, 5888, 1, 1280]
    - [102, 7319.65]
  - - [5056, 448, 1, 128]
    - [84, 3694.33]
  - - [4288, 704, 1, 1280]
    - [94, 7890.86]
  - - [3584, 2944, 1, 128]
    - [86, 4124.61]
  - - [6784, 256, 1, 1280]
    - [102, 7185.73]
  - - [256, 2944, 1, 1280]
    - [91, 6736.66]
  - - [64, 4288, 1, 128]
    - [10, 1614.31]
  - - [2368, 5888, 1, 3328]
    - [92, 8616.36]
  - - [4, 64, 1, 256]
    - [29, 11.3778]
  - - [704, 1024, 1, 3328]
    - [97, 6801.82]
  - - [2368, 1856, 1, 1280]
    - [94, 7853.47]
  - - [448, 5056, 1, 3328]
    - [97, 7452.94]
  - - [128, 448, 1, 128]
    - [12, 530.349]
  - - [128, 6784, 1, 256]
    - [92, 5557.45]
  - - [3584, 4288, 1, 128]
    - [83, 4462.63]
  - - [64, 448, 1, 128]
    - [12, 278.032]
  - - [5888, 4288, 1, 3328]
    - [89, 9153.45]
  - - [2368, 704, 1, 256]
    - [96, 5350.68]
  - - [256, 1856, 1, 3328]
    - [91, 6536.25]
  - - [1856, 128, 1, 256]
    - [105, 2847.26]
  - - [6784, 128, 1, 128]
    - [85, 2530.72]
  - - [3584, 1408, 1, 128]
    - [86, 3625.52]
  - - [1856, 5056, 1, 1280]
    - [92, 8123.29]
  - - [2944, 1024, 1, 1280]
    - [102, 8450.31]
  - - [5056, 4, 1, 256]
    - [116, 380.687]
  - - [3584, 5888, 1, 3328]
    - [94, 8567.89]
  - - [2368, 4288, 1, 256]
    - [98, 7857.97]
  - - [1024, 2368, 1, 3328]
    - [92, 6776.35]
  - - [64, 704, 1, 3328]
    - [47, 3503.42]
  - - [704, 1408, 1, 256]
    - [92, 6099.89]
  - - [4096, 128, 1, 4096]
    - [72, 4116.47]
  - - [1024, 3584, 1, 1280]
    - [102, 7231.55]
  - - [4288, 5888, 1, 3328]
    - [96, 8762.32]
  - - [4288, 4, 1, 1280]
    - [49, 492.697]
  - - [4608, 16, 1, 1536]
    - [50, 1892.48]
  - - [5888, 64, 1, 128]
    - [27, 1747.63]
  - - [4, 5888, 1, 128]
    - [112, 84.4915]
  - - [1024, 2944, 1, 3328]
    - [100, 6906.95]
  - - [6784, 1856, 1, 256]
    - [96, 6273.97]
  - - [2048, 64, 1, 2048]
    - [79, 2371.34]
  - - [256, 6784, 1, 1280]
    - [96, 7066.94]
  - - [1856, 3584, 1, 256]
    - [102, 7706.77]
  - - [128, 448, 1, 3328]
    - [47, 3995.83]
  - - [6784, 1856, 1, 128]
    - [84, 4458.99]
  - - [4, 448, 1, 256]
    - [49, 84.3294]
  - - [5056, 128, 1, 256]
    - [97, 4954.4]
  - - [512, 24000, 1, 2816]
    - [90, 8994.88]
  - - [256, 5888, 1, 1280]
    - [89, 6183.9]
  - - [4, 128, 1, 1280]
    - [117, 71.8597]
  - - [16384, 1600, 1, 4096]
    - [96, 6920.99]
  - - [6784, 128, 1, 1280]
    - [100, 6486.27]
  - - [64, 1408, 1, 256]
    - [37, 1647.76]
  - - [2368, 1408, 1, 128]
    - [84, 3937.0]
  - - [1856, 448, 1, 256]
    - [97, 4635.47]
  - - [1408, 1024, 1, 128]
    - [80, 3208.41]
  - - [128, 64, 1, 128]
    - [9, 70.092]
  - - [6784, 3584, 1, 3328]
    - [102, 8466.18]
  - - [1760, 7000, 1, 1760]
    - [100, 8149.11]
  - - [2944, 64, 1, 3328]
    - [33, 5017.99]
  - - [64, 64, 1, 128]
    - [9, 35.4249]
  - - [2368, 5056, 1, 1280]
    - [96, 8763.9]
  - - [64, 4, 1, 1280]
    - [118, 43.5745]
  - - [1408, 2368, 1, 1280]
    - [97, 7660.28]
  - - [128, 1408, 1, 1280]
    - [32, 4185.17]
  - - [256, 64, 1, 3328]
    - [57, 2071.65]
  - - [704, 4288, 1, 128]
    - [80, 4069.08]
  - - [128, 1856, 1, 3328]
    - [63, 5776.05]
  - - [2944, 2944, 1, 256]
    - [102, 7949.21]
  - - [2944, 4, 1, 1280]
    - [49, 483.118]
  - - [5888, 4, 1, 256]
    - [34, 396.665]
  - - [6784, 256, 1, 256]
    - [108, 4044.73]
  - - [256, 5056, 1, 3328]
    - [91, 7607.27]
  - - [128, 4288, 1, 1280]
    - [32, 4958.68]
  - - [5056, 1856, 1, 128]
    - [84, 4560.84]
  - - [5056, 1024, 1, 3328]
    - [96, 8634.08]
  - - [128, 128, 1, 256]
    - [34, 699.051]
  - - [1760, 64, 1, 1760]
    - [40, 4580.55]
  - - [4288, 3584, 1, 3328]
    - [102, 9143.66]
  - - [448, 704, 1, 3328]
    - [91, 4473.33]
  - - [448, 448, 1, 128]
    - [22, 1264.28]
  - - [1024, 2368, 1, 1280]
    - [100, 7452.41]
  - - [1856, 704, 1, 3328]
    - [91, 6103.24]
  - - [4, 2368, 1, 128]
    - [111, 95.919]
  - - [5888, 6784, 1, 3328]
    - [96, 9131.64]
  - - [704, 4288, 1, 1280]
    - [98, 7906.36]
  - - [704, 256, 1, 256]
    - [91, 2772.68]
  - - [1024, 48000, 1, 2048]
    - [95, 6513.35]
  - - [4288, 1024, 1, 128]
    - [80, 4291.67]
  - - [512, 2048, 1, 49]
    - [126, 4554.98]
  - - [512, 128, 1, 784]
    - [119, 3195.29]
  - - [2048, 512, 1, 49]
    - [127, 4253.33]
  - - [1024, 256, 1, 196]
    - [123, 4039.33]
  - - [256, 64, 1, 3136]
    - [121, 3015.27]
  - - [256, 1024, 1, 196]
    - [125, 4225.35]
  - - [64, 256, 1, 3136]
    - [122, 3058.35]
  - - [128, 512, 1, 784]
    - [120, 3380.28]
  - - [64, 64, 1, 3136]
    - [124, 1372.34]
  - - [1024, 1024, 1, 3328]
    - [237, 8705.0]
  - - [2048, 200, 1, 3200]
    - [242, 6173.32]
  - - [1024, 200, 1, 13312]
    - [140, 5213.21]
  - - [1024, 256, 1, 1536]
    - [242, 5859.33]
  - - [4096, 256, 1, 12288]
    - [247, 8807.42]
  - - [64, 200, 1, 1024]
    - [214, 366.532]
  - - [32, 512, 1, 1024]
    - [169, 452.949]
  - - [2048, 256, 1, 3328]
    - [231, 7876.63]
  - - [4096, 512, 1, 32]
    - [235, 3975.64]
  - - [2048, 256, 1, 13312]
    - [212, 7837.71]
  - - [4096, 200, 1, 11264]
    - [247, 6902.66]
  - - [2048, 512, 1, 1024]
    - [241, 8100.04]
  - - [2048, 1024, 1, 1664]
    - [141, 9081.98]
  - - [1024, 1024, 1, 64]
    - [237, 4258.18]
  - - [512, 1024, 1, 1536]
    - [231, 7597.23]
  - - [1024, 256, 1, 15360]
    - [132, 6735.14]
  - - [1, 512, 1, 1024]
    - [182, 15.0657]
  - - [4096, 512, 1, 1408]
    - [144, 9024.42]
  - - [1024, 200, 1, 1408]
    - [242, 4460.99]
  - - [1024, 512, 1, 512]
    - [236, 6528.1]
  - - [4096, 256, 1, 15360]
    - [243, 8823.93]
  - - [2048, 512, 1, 640]
    - [233, 7989.15]
  - - [4096, 1024, 1, 1280]
    - [139, 9421.44]
  - - [1024, 200, 1, 6144]
    - [231, 4966.42]
  - - [1024, 1024, 1, 512]
    - [233, 7731.44]
  - - [128, 512, 1, 2048]
    - [149, 2190.24]
  - - [2048, 1024, 1, 640]
    - [139, 8581.7]
  - - [1024, 256, 1, 3328]
    - [231, 6192.61]
  - - [4096, 1024, 1, 13312]
    - [144, 9642.49]
  - - [2048, 256, 1, 2048]
    - [231, 7485.65]
  - - [2048, 1024, 1, 13312]
    - [144, 9352.16]
  - - [2048, 512, 1, 16640]
    - [232, 8839.07]
  - - [1024, 512, 1, 128]
    - [236, 4279.9]
  - - [2048, 1024, 1, 3584]
    - [139, 9264.62]
  - - [2048, 512, 1, 256]
    - [247, 6990.51]
  - - [512, 256, 1, 3200]
    - [194, 4154.42]
  - - [4096, 1024, 1, 1920]
    - [139, 9535.22]
  - - [4096, 200, 1, 2560]
    - [244, 6754.55]
  - - [1024, 256, 1, 16384]
    - [134, 6289.5]
  - - [1024, 1024, 1, 1152]
    - [237, 8407.29]
  - - [2048, 200, 1, 32]
    - [180, 1412.41]
  - - [512, 1024, 1, 2816]
    - [231, 7843.15]
  - - [4096, 256, 1, 14336]
    - [243, 8844.67]
  - - [1024, 200, 1, 4608]
    - [242, 4931.64]
  - - [1024, 200, 1, 16384]
    - [137, 5135.05]
  - - [64, 256, 1, 1024]
    - [215, 460.913]
  - - [1, 200, 1, 1024]
    - [197, 7.39884]
  - - [2048, 200, 1, 2080]
    - [242, 6033.77]
  - - [512, 256, 1, 1792]
    - [152, 3153.61]
  - - [2048, 200, 1, 1024]
    - [242, 5711.2]
  - - [4096, 1024, 1, 12288]
    - [139, 9658.13]
  - - [4096, 200, 1, 4096]
    - [233, 6834.45]
  - - [1024, 512, 1, 11264]
    - [200, 7686.36]
  - - [128, 512, 1, 1024]
    - [170, 1458.89]
  - - [32, 256, 1, 2048]
    - [188, 384.799]
  - - [1024, 200, 1, 1792]
    - [242, 4638.54]
  - - [1024, 1024, 1, 1792]
    - [237, 8550.46]
  - - [32, 256, 1, 512]
    - [221, 161.319]
  - - [512, 200, 1, 2816]
    - [147, 3353.0]
  - - [512, 200, 1, 3072]
    - [132, 3298.79]
  - - [1024, 1024, 1, 8192]
    - [178, 8369.0]
  - - [1024, 256, 1, 12288]
    - [135, 6475.61]
  - - [4096, 200, 1, 768]
    - [237, 6367.87]
  - - [1024, 512, 1, 16384]
    - [253, 7367.02]
  - - [4096, 256, 1, 1024]
    - [233, 8214.06]
  - - [1024, 512, 1, 256]
    - [236, 5537.03]
  - - [4096, 1024, 1, 8320]
    - [139, 9674.16]
  - - [4096, 256, 1, 9216]
    - [241, 8790.92]
  - - [1024, 512, 1, 1408]
    - [231, 7459.55]
  - - [1024, 512, 1, 5632]
    - [242, 7997.81]
  - - [4096, 200, 1, 256]
    - [247, 5371.8]
  - - [1024, 200, 1, 128]
    - [225, 1998.05]
  - - [256, 200, 1, 1024]
    - [194, 1195.91]
  - - [1024, 200, 1, 5120]
    - [242, 4957.34]
  - - [512, 1024, 1, 3072]
    - [255, 7103.97]
  - - [4096, 1024, 1, 15360]
    - [139, 9668.94]
  - - [1, 256, 1, 2048]
    - [181, 13.8262]
  - - [1024, 1024, 1, 4160]
    - [233, 8759.2]
  - - [1024, 256, 1, 256]
    - [240, 3728.27]
  - - [2048, 256, 1, 384]
    - [242, 6123.07]
  - - [512, 256, 1, 2560]
    - [196, 3809.54]
  - - [4096, 512, 1, 3072]
    - [144, 9215.09]
  - - [1024, 256, 1, 4160]
    - [231, 6293.39]
  - - [4096, 512, 1, 13312]
    - [141, 9367.22]
  - - [4096, 1024, 1, 3840]
    - [139, 9631.47]
  - - [4096, 200, 1, 640]
    - [237, 6206.06]
  - - [32, 200, 1, 2048]
    - [175, 303.407]
  - - [1024, 200, 1, 512]
    - [231, 3713.09]
  - - [1024, 1024, 1, 7168]
    - [234, 8475.64]
  - - [2048, 1024, 1, 3200]
    - [139, 9271.24]
  - - [512, 512, 1, 1536]
    - [242, 5832.17]
  - - [4096, 256, 1, 768]
    - [247, 8065.97]
  - - [2048, 256, 1, 6656]
    - [231, 8034.77]
  - - [1024, 256, 1, 896]
    - [231, 5467.44]
  - - [2048, 256, 1, 512]
    - [242, 6465.21]
  - - [2048, 200, 1, 3072]
    - [242, 6165.68]
  - - [128, 200, 1, 1024]
    - [199, 692.77]
  - - [4096, 512, 1, 3840]
    - [144, 9272.6]
  - - [1024, 200, 1, 3200]
    - [242, 4838.75]
  - - [4096, 512, 1, 5632]
    - [139, 9335.42]
  - - [4096, 512, 1, 64]
    - [174, 5275.85]
  - - [1024, 512, 1, 2816]
    - [231, 7816.58]
  - - [4096, 256, 1, 7680]
    - [237, 8795.4]
  - - [4096, 200, 1, 1024]
    - [247, 6448.81]
  - - [1024, 512, 1, 12288]
    - [201, 7624.57]
  - - [2048, 1024, 1, 512]
    - [144, 8436.06]
  - - [128, 256, 1, 2048]
    - [218, 1342.18]
  - - [2048, 200, 1, 1792]
    - [242, 6020.37]
  - - [1024, 1024, 1, 2816]
    - [233, 8670.4]
  - - [2048, 512, 1, 1536]
    - [244, 8466.22]
  - - [4096, 256, 1, 3072]
    - [241, 8631.37]
  - - [1024, 200, 1, 1536]
    - [223, 4577.6]
  - - [1024, 256, 1, 1024]
    - [231, 5491.72]
  - - [4096, 512, 1, 8192]
    - [144, 9325.54]
  - - [128, 1024, 1, 512]
    - [242, 2534.32]
  - - [4096, 512, 1, 2304]
    - [139, 9192.99]
  - - [2048, 256, 1, 5632]
    - [242, 7999.54]
  - - [1024, 256, 1, 5120]
    - [242, 6307.22]
  - - [1024, 512, 1, 6656]
    - [242, 8028.85]
  - - [4096, 512, 1, 2816]
    - [139, 9234.4]
  - - [4096, 200, 1, 2080]
    - [226, 6697.86]
  - - [1024, 200, 1, 2304]
    - [242, 4752.81]
  - - [2048, 200, 1, 13312]
    - [231, 6346.13]
  - - [64, 1024, 1, 1024]
    - [215, 1359.58]
  - - [4096, 256, 1, 3584]
    - [237, 8668.8]
  - - [2048, 1024, 1, 7680]
    - [139, 9365.78]
  - - [1024, 256, 1, 1664]
    - [231, 5907.47]
  - - [1, 512, 1, 2048]
    - [158, 23.4057]
  - - [512, 512, 1, 1024]
    - [231, 5360.13]
  - - [2048, 256, 1, 8192]
    - [203, 7665.21]
  - - [2048, 512, 1, 512]
    - [233, 7767.23]
  - - [4096, 512, 1, 1920]
    - [139, 9132.94]
  - - [4096, 200, 1, 12288]
    - [247, 6910.65]
  - - [1024, 512, 1, 3072]
    - [177, 7310.33]
  - - [2048, 512, 1, 1152]
    - [237, 8342.26]
  - - [1024, 256, 1, 2080]
    - [231, 6010.36]
  - - [4096, 1024, 1, 32]
    - [227, 4793.49]
  - - [4096, 512, 1, 16640]
    - [139, 9365.31]
  - - [2048, 200, 1, 9216]
    - [231, 6315.88]
  - - [2048, 200, 1, 2560]
    - [231, 6119.14]
  - - [2048, 1024, 1, 1024]
    - [139, 8628.59]
  - - [2048, 256, 1, 4608]
    - [231, 7951.29]
  - - [512, 200, 1, 768]
    - [183, 2132.41]
  - - [128, 256, 1, 512]
    - [183, 670.017]
  - - [4096, 512, 1, 1792]
    - [144, 9126.91]
  - - [4096, 1024, 1, 8192]
    - [139, 9591.27]
  - - [1024, 256, 1, 2816]
    - [242, 6119.01]
  - - [1024, 1024, 1, 13312]
    - [234, 8529.27]
  - - [2048, 1024, 1, 4160]
    - [139, 9305.57]
  - - [2048, 256, 1, 3584]
    - [231, 7903.13]
  - - [128, 200, 1, 2048]
    - [199, 1135.81]
  - - [4096, 512, 1, 10240]
    - [141, 9339.49]
  - - [4096, 512, 1, 512]
    - [139, 8446.68]
  - - [2048, 1024, 1, 6656]
    - [139, 9331.65]
  - - [1024, 512, 1, 640]
    - [231, 6775.94]
  - - [2048, 512, 1, 768]
    - [233, 8085.41]
  - - [2048, 200, 1, 1408]
    - [231, 5880.07]
  - - [4096, 200, 1, 2048]
    - [247, 6691.61]
  - - [1024, 1024, 1, 5632]
    - [233, 8749.53]
  - - [2048, 512, 1, 3584]
    - [237, 8704.13]
  - - [64, 512, 1, 512]
    - [173, 667.883]
  - - [64, 200, 1, 512]
    - [183, 251.288]
  - - [1024, 200, 1, 64]
    - [138, 1310.72]
  - - [512, 512, 1, 2304]
    - [231, 6078.7]
  - - [2048, 1024, 1, 14336]
    - [139, 9321.84]
  - - [4096, 512, 1, 11264]
    - [141, 9339.85]
  - - [4096, 512, 1, 128]
    - [226, 6566.43]
  - - [1024, 512, 1, 64]
    - [246, 2953.74]
  - - [4096, 512, 1, 768]
    - [139, 8738.13]
  - - [4096, 1024, 1, 11264]
    - [139, 9637.68]
  - - [1, 256, 1, 1024]
    - [229, 8.83234]
  - - [4096, 200, 1, 7680]
    - [226, 6889.47]
  - - [1024, 200, 1, 12288]
    - [198, 5237.64]
  - - [1024, 1024, 1, 1280]
    - [233, 8418.07]
  - - [4096, 1024, 1, 16640]
    - [139, 9674.91]
  - - [2048, 1024, 1, 5632]
    - [139, 9327.75]
  - - [1024, 200, 1, 15360]
    - [198, 5386.53]
  - - [1, 1024, 1, 1024]
    - [248, 27.2499]
  - - [2048, 256, 1, 16384]
    - [209, 7652.65]
  - - [4096, 512, 1, 12288]
    - [141, 9359.41]
  - - [2048, 200, 1, 896]
    - [242, 5628.86]
  - - [4096, 1024, 1, 5632]
    - [139, 9626.68]
  - - [2048, 256, 1, 32]
    - [235, 1889.33]
  - - [2048, 256, 1, 1280]
    - [231, 7390.84]
  - - [4096, 256, 1, 4096]
    - [233, 8694.27]
  - - [2048, 256, 1, 11264]
    - [231, 8113.85]
  - - [4096, 200, 1, 9216]
    - [233, 6890.98]
  - - [1024, 512, 1, 4096]
    - [179, 7348.36]
  - - [2048, 1024, 1, 10240]
    - [141, 9095.81]
  - - [4096, 1024, 1, 640]
    - [139, 9115.58]
  - - [128, 1024, 1, 2048]
    - [132, 3270.41]
  - - [4096, 200, 1, 3840]
    - [226, 6836.16]
  - - [1024, 1024, 1, 1920]
    - [237, 8562.72]
  - - [2048, 200, 1, 7168]
    - [242, 6296.13]
  - - [2048, 512, 1, 16384]
    - [133, 8632.41]
  - - [2048, 1024, 1, 12288]
    - [139, 9157.98]
  - - [4096, 1024, 1, 10240]
    - [139, 9658.74]
  - - [1024, 1024, 1, 8320]
    - [241, 8799.48]
  - - [1024, 256, 1, 9216]
    - [231, 6375.13]
  - - [4096, 256, 1, 1152]
    - [226, 8300.99]
  - - [512, 200, 1, 2560]
    - [192, 3088.41]
  - - [2048, 256, 1, 1920]
    - [231, 7714.84]
  - - [2048, 1024, 1, 4608]
    - [139, 9305.6]
  - - [512, 256, 1, 1024]
    - [239, 2887.64]
  - - [1024, 256, 1, 1920]
    - [223, 5913.02]
  - - [4096, 512, 1, 3584]
    - [139, 9275.59]
  - - [2048, 512, 1, 4160]
    - [244, 8733.93]
  - - [2048, 512, 1, 5632]
    - [247, 8758.88]
  - - [4096, 1024, 1, 4608]
    - [139, 9657.12]
  - - [4096, 1024, 1, 3328]
    - [139, 9621.35]
  - - [4096, 256, 1, 7168]
    - [233, 8769.95]
  - - [4096, 200, 1, 128]
    - [247, 4458.23]
  - - [2048, 200, 1, 5120]
    - [231, 6176.81]
  - - [1024, 1024, 1, 6656]
    - [233, 8780.35]
  - - [512, 1024, 1, 3200]
    - [242, 7886.99]
  - - [512, 200, 1, 2304]
    - [132, 2990.99]
  - - [2048, 1024, 1, 9216]
    - [144, 9325.36]
  - - [2048, 256, 1, 1536]
    - [242, 7551.63]
  - - [4096, 256, 1, 256]
    - [247, 6932.73]
  - - [2048, 512, 1, 1408]
    - [244, 8430.76]
  - - [1024, 256, 1, 384]
    - [236, 4462.03]
  - - [2048, 1024, 1, 2304]
    - [139, 9174.84]
  - - [4096, 512, 1, 6144]
    - [141, 9284.15]
  - - [1024, 200, 1, 14336]
    - [130, 5268.47]
  - - [1024, 512, 1, 2080]
    - [242, 7736.37]
  - - [2048, 512, 1, 2304]
    - [244, 8615.97]
  - - [4096, 512, 1, 15360]
    - [144, 9362.07]
  - - [1024, 256, 1, 32]
    - [164, 1028.02]
  - - [1024, 200, 1, 2816]
    - [242, 4780.48]
  - - [4096, 200, 1, 512]
    - [233, 6054.13]
  - - [4096, 1024, 1, 7168]
    - [144, 9468.39]
  - - [2048, 256, 1, 14336]
    - [205, 7865.42]
  - - [1024, 200, 1, 3072]
    - [242, 4804.1]
  - - [2048, 200, 1, 1280]
    - [242, 5846.21]
  - - [1024, 1024, 1, 2304]
    - [233, 8633.22]
  - - [4096, 1024, 1, 9216]
    - [139, 9640.93]
  - - [2048, 512, 1, 4608]
    - [244, 8743.2]
  - - [4096, 1024, 1, 7680]
    - [139, 9684.76]
  - - [4096, 256, 1, 6144]
    - [244, 8757.14]
  - - [4096, 256, 1, 896]
    - [237, 8258.83]
  - - [512, 256, 1, 1536]
    - [221, 3065.26]
  - - [1024, 256, 1, 512]
    - [231, 4752.75]
  - - [2048, 256, 1, 640]
    - [231, 6775.94]
  - - [256, 256, 1, 2048]
    - [168, 2248.96]
  - - [2048, 1024, 1, 8192]
    - [139, 9178.07]
  - - [4096, 200, 1, 16640]
    - [131, 7009.49]
  - - [256, 512, 1, 512]
    - [143, 2511.56]
  - - [2048, 512, 1, 384]
    - [244, 7467.6]
  - - [2048, 200, 1, 16384]
    - [212, 6327.21]
  - - [4096, 200, 1, 10240]
    - [237, 6892.64]
  - - [1024, 512, 1, 9216]
    - [186, 7529.99]
  - - [4096, 1024, 1, 64]
    - [161, 6260.16]
  - - [4096, 200, 1, 1920]
    - [247, 6710.17]
  - - [2048, 1024, 1, 1280]
    - [139, 8998.24]
  - - [1024, 200, 1, 3840]
    - [231, 4873.77]
  - - [256, 1024, 1, 512]
    - [242, 4766.25]
  - - [2048, 1024, 1, 3328]
    - [139, 9275.1]
  - - [1024, 256, 1, 16640]
    - [196, 6837.12]
  - - [4096, 512, 1, 14336]
    - [144, 9354.32]
  - - [1024, 1024, 1, 16640]
    - [241, 8832.27]
  - - [1024, 256, 1, 1152]
    - [242, 5642.56]
  - - [512, 512, 1, 512]
    - [231, 4779.83]
  - - [4096, 512, 1, 8320]
    - [144, 9327.86]
  - - [2048, 512, 1, 7680]
    - [247, 8793.86]
  - - [4096, 1024, 1, 6656]
    - [139, 9666.93]
  - - [1024, 512, 1, 3584]
    - [242, 7900.47]
  - - [1024, 1024, 1, 32]
    - [227, 2974.68]
  - - [512, 512, 1, 2816]
    - [223, 6155.75]
  - - [2048, 512, 1, 1664]
    - [247, 8496.45]
  - - [1024, 1024, 1, 14336]
    - [133, 8624.64]
  - - [2048, 200, 1, 2048]
    - [242, 6029.76]
  - - [1024, 1024, 1, 3584]
    - [233, 8702.52]
  - - [512, 200, 1, 1280]
    - [147, 2350.65]
  - - [4096, 256, 1, 6656]
    - [247, 8788.31]
  - - [4096, 256, 1, 4160]
    - [224, 8728.34]
  - - [128, 256, 1, 1024]
    - [206, 859.489]
  - - [512, 200, 1, 3200]
    - [147, 3376.75]
  - - [2048, 512, 1, 9216]
    - [230, 8806.3]
  - - [2048, 1024, 1, 256]
    - [226, 7713.66]
  - - [1024, 256, 1, 2304]
    - [242, 6015.73]
  - - [1024, 200, 1, 8192]
    - [242, 5021.92]
  - - [2048, 256, 1, 3072]
    - [159, 7514.99]
  - - [2048, 256, 1, 8320]
    - [231, 8063.58]
  - - [4096, 512, 1, 1024]
    - [141, 8824.31]
  - - [1024, 512, 1, 3200]
    - [231, 7866.29]
  - - [1024, 512, 1, 896]
    - [223, 7161.01]
  - - [2048, 512, 1, 1280]
    - [237, 8384.42]
  - - [4096, 200, 1, 64]
    - [146, 3260.5]
  - - [1024, 256, 1, 6144]
    - [252, 6143.62]
  - - [1024, 200, 1, 2560]
    - [231, 4762.79]
  - - [1024, 1024, 1, 5120]
    - [160, 8454.13]
  - - [2048, 512, 1, 6656]
    - [237, 8798.95]
  - - [4096, 1024, 1, 1536]
    - [139, 9503.27]
  - - [1024, 1024, 1, 128]
    - [162, 5825.42]
  - - [512, 1024, 1, 1792]
    - [231, 7701.02]
  - - [2048, 1024, 1, 32]
    - [142, 3938.31]
  - - [4096, 256, 1, 2816]
    - [226, 8652.1]
  - - [1024, 1024, 1, 15360]
    - [133, 8719.6]
  - - [1024, 256, 1, 5632]
    - [231, 6344.08]
  - - [1024, 1024, 1, 4096]
    - [234, 8187.76]
  - - [2048, 200, 1, 4160]
    - [242, 6222.38]
  - - [512, 256, 1, 768]
    - [173, 2771.57]
  - - [4096, 512, 1, 640]
    - [144, 8590.48]
  - - [2048, 512, 1, 8192]
    - [186, 8494.8]
  - - [1024, 512, 1, 768]
    - [231, 7049.25]
  - - [4096, 200, 1, 8320]
    - [226, 6908.6]
  - - [2048, 512, 1, 896]
    - [233, 8224.13]
  - - [4096, 200, 1, 7168]
    - [244, 6878.49]
  - - [2048, 512, 1, 13312]
    - [232, 8802.94]
  - - [64, 512, 1, 1024]
    - [136, 843.924]
  - - [2048, 200, 1, 3840]
    - [231, 6192.38]
  - - [1024, 1024, 1, 768]
    - [224, 8098.41]
  - - [4096, 512, 1, 16384]
    - [144, 9345.63]
  - - [4096, 256, 1, 2304]
    - [224, 8596.35]
  - - [1, 256, 1, 4096]
    - [229, 19.8293]
  - - [1024, 1024, 1, 11264]
    - [234, 8491.38]
  - - [2048, 200, 1, 16640]
    - [228, 6510.54]
  - - [1024, 256, 1, 3072]
    - [242, 6179.45]
  - - [4096, 1024, 1, 512]
    - [139, 9032.15]
  - - [2048, 256, 1, 2816]
    - [231, 7793.47]
  - - [32, 512, 1, 512]
    - [143, 318.716]
  - - [256, 512, 1, 2048]
    - [194, 3368.92]
  - - [1024, 512, 1, 384]
    - [242, 6198.48]
  - - [2048, 200, 1, 7680]
    - [231, 6307.6]
  - - [1024, 512, 1, 4608]
    - [242, 7953.38]
  - - [2048, 256, 1, 768]
    - [242, 7059.14]
  - - [4096, 200, 1, 32]
    - [191, 2199.19]
  - - [4096, 200, 1, 3328]
    - [226, 6813.02]
  - - [1024, 200, 1, 1152]
    - [231, 4375.55]
  - - [1024, 1024, 1, 1408]
    - [233, 8457.81]
  - - [2048, 200, 1, 15360]
    - [207, 6333.0]
  - - [512, 1024, 1, 2048]
    - [217, 6280.66]
  - - [1024, 512, 1, 1024]
    - [242, 7064.09]
  - - [1024, 200, 1, 10240]
    - [231, 5030.59]
  - - [4096, 256, 1, 5632]
    - [244, 8765.12]
  - - [512, 512, 1, 3072]
    - [254, 5942.34]
  - - [2048, 256, 1, 1408]
    - [231, 7544.95]
  - - [2048, 256, 1, 6144]
    - [242, 7963.87]
  - - [4096, 256, 1, 3328]
    - [237, 8682.48]
  - - [1024, 200, 1, 1664]
    - [231, 4595.3]
  - - [2048, 1024, 1, 1152]
    - [139, 8942.55]
  - - [2048, 512, 1, 6144]
    - [232, 8729.61]
  - - [2048, 512, 1, 3200]
    - [233, 8696.46]
  - - [4096, 1024, 1, 2080]
    - [172, 9538.35]
  - - [4096, 1024, 1, 768]
    - [139, 9260.65]
  - - [4096, 1024, 1, 2560]
    - [139, 9567.17]
  - - [64, 200, 1, 2048]
    - [171, 583.061]
  - - [2048, 200, 1, 4608]
    - [242, 6243.18]
  - - [1024, 1024, 1, 6144]
    - [234, 8320.15]
  - - [4096, 256, 1, 1664]
    - [237, 8503.07]
  - - [2048, 200, 1, 384]
    - [242, 4939.9]
  - - [1, 200, 1, 2048]
    - [188, 11.2281]
  - - [4096, 256, 1, 1792]
    - [247, 8504.02]
  - - [2048, 1024, 1, 64]
    - [161, 5309.25]
  - - [4096, 1024, 1, 16384]
    - [128, 9428.51]
  - - [1024, 512, 1, 16640]
    - [242, 8122.45]
  - - [2048, 512, 1, 10240]
    - [232, 8766.11]
  - - [4096, 512, 1, 6656]
    - [139, 9351.65]
  - - [2048, 256, 1, 16640]
    - [231, 8135.17]
  - - [2048, 512, 1, 2816]
    - [233, 8660.22]
  - - [1024, 200, 1, 32]
    - [151, 780.191]
  - - [1, 512, 1, 4096]
    - [176, 34.7671]
  - - [256, 256, 1, 1024]
    - [183, 1489.98]
  - - [2048, 1024, 1, 128]
    - [156, 6605.2]
  - - [2048, 1024, 1, 2080]
    - [139, 9159.41]
  - - [2048, 1024, 1, 16640]
    - [139, 9371.55]
  - - [1024, 200, 1, 384]
    - [242, 3378.14]
  - - [4096, 256, 1, 384]
    - [187, 7369.2]
  - - [4096, 256, 1, 13312]
    - [241, 8776.38]
  - - [2048, 256, 1, 128]
    - [236, 4279.9]
  - - [512, 256, 1, 2304]
    - [148, 3584.88]
  - - [2048, 1024, 1, 3072]
    - [141, 9156.42]
  - - [1024, 1024, 1, 640]
    - [237, 7928.74]
  - - [256, 512, 1, 1024]
    - [242, 2843.6]
  - - [4096, 1024, 1, 1408]
    - [139, 9437.46]
  - - [4096, 200, 1, 5632]
    - [244, 6873.86]
  - - [4096, 1024, 1, 2048]
    - [139, 9437.0]
  - - [2048, 1024, 1, 2560]
    - [144, 9195.52]
  - - [4096, 1024, 1, 128]
    - [226, 7407.16]
  - - [1024, 200, 1, 3328]
    - [242, 4857.29]
  - - [2048, 200, 1, 1152]
    - [231, 5760.0]
  - - [1024, 200, 1, 9216]
    - [130, 5053.11]
  - - [4096, 256, 1, 512]
    - [224, 7617.35]
  - - [4096, 1024, 1, 14336]
    - [139, 9665.02]
  - - [1024, 1024, 1, 384]
    - [162, 7478.7]
  - - [2048, 200, 1, 512]
    - [231, 5150.18]
  - - [2048, 256, 1, 9216]
    - [210, 7717.61]
  - - [2048, 256, 1, 1792]
    - [231, 7655.84]
  - - [4096, 512, 1, 9216]
    - [141, 9331.12]
  - - [4096, 200, 1, 15360]
    - [131, 6958.04]
  - - [1024, 512, 1, 2048]
    - [230, 7067.81]
  - - [64, 256, 1, 2048]
    - [155, 723.156]
  - - [4096, 200, 1, 1792]
    - [233, 6699.55]
  - - [1, 200, 1, 4096]
    - [165, 15.5387]
  - - [2048, 1024, 1, 2048]
    - [144, 9071.83]
  - - [1024, 200, 1, 2080]
    - [223, 4679.09]
  - - [2048, 200, 1, 1536]
    - [242, 5939.82]
  - - [1024, 1024, 1, 3072]
    - [204, 8333.05]
  - - [512, 200, 1, 1792]
    - [129, 2679.63]
  - - [1024, 256, 1, 11264]
    - [132, 6470.88]
  - - [2048, 512, 1, 12288]
    - [179, 8729.14]
  - - [1024, 256, 1, 1792]
    - [242, 5931.34]
  - - [1024, 200, 1, 7168]
    - [242, 4970.23]
  - - [32, 256, 1, 1024]
    - [153, 237.234]
  - - [512, 256, 1, 3072]
    - [196, 3813.0]
  - - [1024, 1024, 1, 2080]
    - [233, 8600.31]
  - - [2048, 200, 1, 2304]
    - [242, 6093.22]
  - - [4096, 512, 1, 1536]
    - [139, 9074.9]
  - - [2048, 256, 1, 7168]
    - [242, 7895.16]
  - - [2048, 512, 1, 1792]
    - [244, 8531.82]
  - - [1024, 200, 1, 2048]
    - [231, 4685.33]
  - - [1024, 1024, 1, 4608]
    - [237, 8735.61]
  - - [4096, 256, 1, 8192]
    - [233, 8782.45]
  - - [512, 1024, 1, 1280]
    - [223, 7483.15]
  - - [2048, 1024, 1, 16384]
    - [133, 8878.86]
  - - [512, 512, 1, 1280]
    - [231, 5745.62]
  - - [1024, 200, 1, 1280]
    - [223, 4446.13]
  - - [4096, 512, 1, 4096]
    - [141, 9264.39]
  - - [2048, 256, 1, 3200]
    - [231, 7842.75]
  - - [2048, 512, 1, 15360]
    - [179, 8757.14]
  - - [1024, 512, 1, 3328]
    - [231, 7853.94]
  - - [1024, 512, 1, 4160]
    - [231, 7934.51]
  - - [4096, 200, 1, 6656]
    - [233, 6883.2]
  - - [4096, 1024, 1, 1024]
    - [139, 9229.34]
  - - [2048, 200, 1, 3328]
    - [242, 6182.64]
  - - [1024, 1024, 1, 256]
    - [162, 6932.73]
  - - [512, 200, 1, 512]
    - [183, 1910.67]
  - - [2048, 256, 1, 64]
    - [154, 2912.71]
  - - [1024, 256, 1, 2560]
    - [231, 6123.07]
  - - [2048, 512, 1, 11264]
    - [243, 8728.84]
  - - [32, 200, 1, 1024]
    - [238, 187.46]
  - - [32, 512, 1, 2048]
    - [182, 694.421]
  - - [2048, 256, 1, 2304]
    - [231, 7759.25]
  - - [2048, 256, 1, 12288]
    - [210, 7726.25]
  - - [4096, 200, 1, 8192]
    - [233, 6870.84]
  - - [1024, 512, 1, 7168]
    - [179, 7479.1]
  - - [1024, 512, 1, 1792]
    - [231, 7626.01]
  - - [4096, 1024, 1, 1664]
    - [139, 9503.44]
  - - [4096, 200, 1, 2816]
    - [226, 6775.34]
  - - [1024, 1024, 1, 896]
    - [233, 8229.89]
  - - [1024, 200, 1, 8320]
    - [194, 5173.48]
  - - [1024, 1024, 1, 12288]
    - [234, 8463.11]
  - - [1024, 256, 1, 8320]
    - [223, 6404.27]
  - - [1024, 200, 1, 1024]
    - [231, 4297.44]
  - - [1024, 200, 1, 16640]
    - [193, 5499.41]
  - - [4096, 256, 1, 5120]
    - [247, 8729.05]
  - - [1024, 256, 1, 3200]
    - [242, 6124.86]
  - - [512, 512, 1, 2560]
    - [242, 6109.69]
  - - [4096, 256, 1, 2048]
    - [247, 8510.95]
  - - [1024, 256, 1, 640]
    - [231, 5102.56]
  - - [2048, 256, 1, 5120]
    - [159, 7667.83]
  - - [2048, 256, 1, 7680]
    - [242, 8054.35]
  - - [4096, 512, 1, 384]
    - [237, 8190.67]
  - - [2048, 200, 1, 3584]
    - [231, 6166.02]
  - - [1024, 512, 1, 1536]
    - [231, 7517.8]
  - - [4096, 512, 1, 3328]
    - [139, 9259.35]
  - - [4096, 1024, 1, 256]
    - [139, 8341.69]
  - - [2048, 200, 1, 64]
    - [202, 2307.61]
  - - [2048, 200, 1, 4096]
    - [242, 6211.94]
  - - [1024, 1024, 1, 1536]
    - [233, 8484.05]
  - - [2048, 1024, 1, 7168]
    - [141, 9315.14]
  - - [1024, 256, 1, 3584]
    - [231, 6207.22]
  - - [4096, 256, 1, 32]
    - [235, 2892.62]
  - - [4096, 256, 1, 1280]
    - [244, 8392.8]
  - - [512, 512, 1, 3200]
    - [242, 6219.31]
  - - [2048, 1024, 1, 1536]
    - [141, 9052.45]
  - - [2048, 256, 1, 1024]
    - [231, 7192.8]
  - - [128, 200, 1, 512]
    - [221, 502.577]
  - - [4096, 512, 1, 7168]
    - [144, 9329.01]
  - - [1024, 512, 1, 1152]
    - [231, 7358.43]
  - - [64, 1024, 1, 2048]
    - [149, 2102.41]
  - - [2048, 512, 1, 3328]
    - [233, 8694.59]
  - - [4096, 1024, 1, 896]
    - [139, 9342.92]
  - - [1, 1024, 1, 2048]
    - [189, 40.8324]
  - - [4096, 200, 1, 3584]
    - [237, 6810.2]
  - - [4096, 1024, 1, 4096]
    - [139, 9347.46]
  - - [1024, 256, 1, 14336]
    - [132, 6625.7]
  - - [2048, 200, 1, 256]
    - [231, 4413.2]
  - - [4096, 256, 1, 16384]
    - [133, 8752.03]
  - - [4096, 256, 1, 1920]
    - [224, 8533.68]
  - - [32, 1024, 1, 512]
    - [222, 647.269]
  - - [1024, 256, 1, 7680]
    - [242, 6387.26]
  - - [2048, 256, 1, 1664]
    - [242, 7631.34]
  - - [512, 200, 1, 1536]
    - [147, 2576.78]
  - - [2048, 1024, 1, 6144]
    - [128, 9033.67]
  - - [512, 256, 1, 2816]
    - [194, 3977.36]
  - - [4096, 512, 1, 4160]
    - [141, 9288.92]
  - - [4096, 512, 1, 2080]
    - [220, 9150.18]
  - - [2048, 256, 1, 15360]
    - [205, 7963.87]
  - - [4096, 200, 1, 5120]
    - [244, 6861.52]
  - - [1024, 512, 1, 8192]
    - [230, 7473.15]
  - - [4096, 200, 1, 896]
    - [247, 6443.15]
  - - [2048, 512, 1, 8320]
    - [237, 8810.14]
  - - [1024, 1024, 1, 10240]
    - [245, 8436.6]
  - - [1024, 200, 1, 768]
    - [231, 4087.48]
  - - [2048, 200, 1, 640]
    - [242, 5416.2]
  - - [512, 200, 1, 2048]
    - [196, 2702.52]
  - - [1024, 1024, 1, 9216]
    - [234, 8498.98]
  - - [4096, 200, 1, 1408]
    - [244, 6613.72]
  - - [1024, 256, 1, 13312]
    - [132, 6643.44]
  - - [1024, 256, 1, 128]
    - [163, 2706.0]
  - - [2048, 200, 1, 5632]
    - [242, 6270.02]
  - - [64, 1024, 1, 512]
    - [221, 1310.72]
  - - [1024, 512, 1, 2560]
    - [242, 7731.44]
  - - [4096, 200, 1, 1280]
    - [224, 6566.73]
  - - [1024, 200, 1, 4096]
    - [242, 4911.36]
  - - [1024, 1024, 1, 2560]
    - [233, 8630.25]
  - - [2048, 512, 1, 64]
    - [237, 4152.78]
  - - [2048, 200, 1, 8192]
    - [231, 6234.11]
  - - [2048, 512, 1, 3072]
    - [241, 8614.75]
  - - [4096, 1024, 1, 5120]
    - [139, 9573.65]
  - - [4096, 256, 1, 640]
    - [226, 7913.78]
  - - [1024, 256, 1, 1280]
    - [231, 5706.54]
  - - [2048, 1024, 1, 1920]
    - [141, 9141.24]
  - - [2048, 256, 1, 4096]
    - [231, 7937.18]
  - - [2048, 1024, 1, 15360]
    - [144, 9351.86]
  - - [4096, 200, 1, 16384]
    - [133, 6975.11]
  - - [1, 1024, 1, 4096]
    - [251, 60.6815]
  - - [4096, 1024, 1, 2816]
    - [139, 9583.88]
  - - [4096, 200, 1, 1664]
    - [226, 6658.6]
  - - [4096, 512, 1, 256]
    - [157, 7731.44]
  - - [1024, 200, 1, 896]
    - [231, 4193.35]
  - - [2048, 200, 1, 6656]
    - [242, 6291.07]
  - - [2048, 1024, 1, 5120]
    - [141, 9270.47]
  - - [512, 1024, 1, 768]
    - [231, 7098.96]
  - - [2048, 512, 1, 14336]
    - [211, 8559.03]
  - - [2048, 200, 1, 8320]
    - [231, 6314.62]
  - - [4096, 256, 1, 3840]
    - [247, 8718.46]
  - - [2048, 1024, 1, 4096]
    - [128, 8973.28]
  - - [1024, 1024, 1, 3200]
    - [237, 8701.88]
  - - [1024, 256, 1, 4608]
    - [231, 6267.95]
  - - [4096, 512, 1, 4608]
    - [139, 9316.37]
  - - [2048, 512, 1, 2048]
    - [230, 8462.66]
  - - [4096, 512, 1, 1664]
    - [139, 9074.43]
  - - [4096, 256, 1, 4608]
    - [226, 8717.95]
  - - [1024, 512, 1, 32]
    - [219, 1807.89]
  - - [1024, 512, 1, 3840]
    - [231, 7936.24]
  - - [2048, 512, 1, 1920]
    - [247, 8548.17]
  - - [2048, 1024, 1, 896]
    - [139, 8843.41]
  - - [4096, 200, 1, 6144]
    - [247, 6864.66]
  - - [1024, 512, 1, 13312]
    - [200, 7763.09]
  - - [4096, 1024, 1, 4160]
    - [139, 9650.62]
  - - [2048, 200, 1, 2816]
    - [231, 6119.66]
  - - [1024, 1024, 1, 3840]
    - [226, 8709.4]
  - - [128, 1024, 1, 1024]
    - [249, 2577.15]
  - - [2048, 1024, 1, 11264]
    - [144, 9338.96]
  - - [2048, 1024, 1, 384]
    - [233, 8210.71]
  - - [1024, 256, 1, 2048]
    - [254, 5755.48]
  - - [2048, 1024, 1, 3840]
    - [141, 9288.86]
  - - [4096, 256, 1, 8320]
    - [247, 8812.28]
  - - [2048, 256, 1, 3840]
    - [223, 7856.95]
  - - [64, 256, 1, 512]
    - [221, 336.082]
  - - [4096, 512, 1, 1280]
    - [141, 8993.42]
  - - [512, 256, 1, 1280]
    - [173, 2995.93]
  - - [1024, 512, 1, 7680]
    - [231, 8041.49]
  - - [4096, 1024, 1, 1152]
    - [139, 9368.38]
  - - [256, 200, 1, 512]
    - [173, 992.97]
  - - [256, 1024, 1, 2048]
    - [250, 4759.49]
  - - [2048, 200, 1, 10240]
    - [242, 6328.93]
  - - [2048, 512, 1, 5120]
    - [243, 8732.46]
  - - [2048, 1024, 1, 1408]
    - [141, 9006.8]
  - - [512, 1024, 1, 512]
    - [231, 6528.1]
  - - [1024, 200, 1, 11264]
    - [198, 5194.72]
  - - [512, 1024, 1, 1024]
    - [184, 6337.0]
  - - [2048, 512, 1, 32]
    - [150, 2777.68]
  - - [4096, 256, 1, 2560]
    - [233, 8621.39]
  - - [4096, 256, 1, 64]
    - [167, 4194.3]
  - - [32, 1024, 1, 1024]
    - [168, 778.164]
  - - [2048, 200, 1, 768]
    - [242, 5507.23]
  - - [512, 512, 1, 2048]
    - [190, 5338.81]
  - - [2048, 512, 1, 2560]
    - [244, 8643.59]
  - - [512, 256, 1, 512]
    - [223, 2542.0]
  - - [1024, 200, 1, 7680]
    - [198, 5047.7]
  - - [4096, 512, 1, 896]
    - [139, 8856.75]
  - - [4096, 1024, 1, 3072]
    - [139, 9492.07]
  - - [4096, 200, 1, 13312]
    - [131, 6900.63]
  - - [2048, 512, 1, 7168]
    - [232, 8788.0]
  - - [2048, 1024, 1, 2816]
    - [144, 9229.78]
  - - [2048, 512, 1, 128]
    - [162, 5629.94]
  - - [1024, 256, 1, 8192]
    - [254, 6203.73]
  - - [4096, 1024, 1, 1792]
    - [139, 9510.32]
  - - [1024, 200, 1, 6656]
    - [223, 5002.75]
  - - [1024, 1024, 1, 1024]
    - [160, 8095.16]
  - - [4096, 200, 1, 2304]
    - [244, 6754.35]
  - - [4096, 512, 1, 1152]
    - [139, 8974.44]
  - - [512, 200, 1, 1024]
    - [221, 2232.91]
  - - [1024, 256, 1, 3840]
    - [242, 6244.62]
  - - [512, 512, 1, 768]
    - [231, 5331.74]
  - - [2048, 512, 1, 4096]
    - [241, 8621.66]
  - - [2048, 256, 1, 2560]
    - [231, 7770.83]
  - - [2048, 256, 1, 4160]
    - [242, 7922.98]
  - - [1024, 256, 1, 64]
    - [138, 1705.0]
  - - [4096, 512, 1, 7680]
    - [139, 9364.47]
  - - [1024, 512, 1, 1664]
    - [242, 7594.14]
  - - [2048, 512, 1, 2080]
    - [233, 8570.57]
  - - [2048, 512, 1, 3840]
    - [244, 8729.04]
  - - [4096, 1024, 1, 384]
    - [139, 8764.76]
  - - [4096, 200, 1, 3072]
    - [233, 6772.29]
  - - [1024, 512, 1, 14336]
    - [201, 7680.87]
  - - [1024, 200, 1, 1920]
    - [223, 4636.98]
  - - [1024, 1024, 1, 1664]
    - [237, 8506.39]
  - - [512, 1024, 1, 2304]
    - [231, 7775.23]
  - - [2048, 1024, 1, 1792]
    - [139, 9123.36]
  - - [32, 200, 1, 512]
    - [239, 125.644]
  - - [4096, 256, 1, 11264]
    - [244, 8822.21]
  - - [4096, 256, 1, 1408]
    - [244, 8419.22]
  - - [1024, 256, 1, 7168]
    - [231, 6377.44]
  - - [2048, 256, 1, 1152]
    - [242, 7401.71]
  - - [256, 256, 1, 512]
    - [221, 1314.83]
  - - [1024, 512, 1, 1280]
    - [231, 7410.43]
  - - [512, 512, 1, 1792]
    - [223, 5931.34]
  - - [2048, 200, 1, 12288]
    - [205, 6242.15]
  - - [2048, 200, 1, 1664]
    - [242, 5953.65]
  - - [4096, 200, 1, 4608]
    - [237, 6853.44]
  - - [512, 1024, 1, 2560]
    - [231, 7778.03]
  - - [4096, 200, 1, 384]
    - [224, 5765.63]
  - - [128, 512, 1, 512]
    - [221, 1302.58]
  - - [1024, 200, 1, 256]
    - [225, 2861.83]
  - - [256, 1024, 1, 1024]
    - [166, 4522.16]
  - - [2048, 200, 1, 128]
    - [231, 3309.9]
  - - [2048, 200, 1, 11264]
    - [212, 6168.1]
  - - [1024, 512, 1, 1920]
    - [242, 7649.19]
  - - [4096, 256, 1, 1536]
    - [237, 8427.23]
  - - [4096, 1024, 1, 3584]
    - [139, 9617.9]
  - - [2048, 256, 1, 256]
    - [231, 5464.89]
  - - [2048, 1024, 1, 768]
    - [139, 8726.77]
  - - [4096, 256, 1, 10240]
    - [233, 8790.79]
  - - [2048, 256, 1, 10240]
    - [213, 7665.21]
  - - [4096, 200, 1, 14336]
    - [247, 6916.08]
  - - [1024, 512, 1, 5120]
    - [185, 7420.26]
  - - [1024, 512, 1, 8320]
    - [242, 8061.21]
  - - [256, 200, 1, 2048]
    - [197, 1916.26]
  - - [1024, 200, 1, 640]
    - [225, 3873.29]
  - - [1024, 512, 1, 10240]
    - [230, 7526.8]
  - - [1024, 200, 1, 4160]
    - [242, 4928.09]
  - - [1024, 200, 1, 5632]
    - [223, 4978.56]
  - - [1024, 1024, 1, 2048]
    - [178, 7937.18]
  - - [1024, 256, 1, 6656]
    - [242, 6373.58]
  - - [2048, 1024, 1, 8320]
    - [139, 9333.05]
  - - [1024, 256, 1, 10240]
    - [231, 6407.19]
  - - [2048, 256, 1, 2080]
    - [231, 7714.48]
  - - [4096, 256, 1, 128]
    - [145, 5765.37]
  - - [1024, 256, 1, 768]
    - [236, 5210.32]
  - - [2048, 256, 1, 896]
    - [242, 7267.36]
  - - [64, 512, 1, 2048]
    - [208, 1296.54]
  - - [4096, 512, 1, 2048]
    - [141, 9121.15]
  - - [512, 256, 1, 2048]
    - [194, 3283.21]
  - - [4096, 256, 1, 16640]
    - [226, 8839.78]
  - - [4096, 512, 1, 2560]
    - [144, 9222.05]
  - - [1024, 512, 1, 15360]
    - [195, 7865.56]
  - - [4096, 1024, 1, 2304]
    - [139, 9558.16]
  - - [4096, 200, 1, 1152]
    - [244, 6531.83]
  - - [2048, 200, 1, 6144]
    - [242, 6277.65]
  - - [1024, 1024, 1, 7680]
    - [237, 8799.24]
  - - [2048, 200, 1, 1920]
    - [242, 6030.92]
  - - [32, 1024, 1, 2048]
    - [216, 1174.88]
  - - [1024, 200, 1, 3584]
    - [223, 4880.34]
  - - [4096, 256, 1, 2080]
    - [230, 8557.12]
  - - [1024, 1024, 1, 16384]
    - [131, 8618.55]
  - - [1024, 256, 1, 1408]
    - [242, 5803.44]
  - - [1024, 256, 1, 4096]
    - [252, 6037.68]
  - - [2048, 200, 1, 14336]
    - [242, 6364.38]
  - - [4096, 512, 1, 5120]
    - [141, 9301.95]
  - - [1024, 512, 1, 6144]
    - [177, 7468.99]
  - - [1024, 512, 1, 2304]
    - [242, 7759.25]
  - - [4096, 200, 1, 4160]
    - [226, 6843.12]
  - - [4096, 200, 1, 1536]
    - [237, 6628.17]
  - - [4096, 1024, 1, 6144]
    - [139, 9592.98]
  - - [1024, 128, 1, 128]
    - [268, 896.319]
  - - [4, 704, 1, 1280]
    - [305, 328.976]
  - - [4, 1856, 1, 3328]
    - [315, 501.461]
  - - [1856, 448, 1, 3328]
    - [360, 5678.01]
  - - [2944, 4288, 1, 1280]
    - [346, 8412.49]
  - - [2368, 64, 1, 3328]
    - [296, 4914.02]
  - - [1760, 32, 1, 1760]
    - [323, 3313.04]
  - - [2368, 5888, 1, 256]
    - [346, 6489.82]
  - - [5888, 1856, 1, 256]
    - [358, 7791.98]
  - - [128, 64, 1, 256]
    - [330, 369.317]
  - - [512, 24000, 1, 1536]
    - [352, 8827.47]
  - - [128, 6784, 1, 3328]
    - [352, 6537.09]
  - - [5888, 1408, 1, 256]
    - [366, 6129.71]
  - - [5888, 1856, 1, 3328]
    - [352, 7969.27]
  - - [5056, 704, 1, 256]
    - [352, 6723.92]
  - - [2048, 400, 1, 512]
    - [358, 4531.54]
  - - [5888, 2944, 1, 3328]
    - [358, 8608.14]
  - - [1856, 4288, 1, 256]
    - [358, 6297.64]
  - - [1024, 5056, 1, 128]
    - [336, 3595.47]
  - - [5056, 5056, 1, 3328]
    - [352, 8559.26]
  - - [1408, 5888, 1, 1280]
    - [347, 6797.16]
  - - [2368, 448, 1, 128]
    - [336, 2815.0]
  - - [2368, 6784, 1, 128]
    - [340, 4782.08]
  - - [1024, 3584, 1, 3328]
    - [348, 8402.54]
  - - [512, 48000, 1, 2048]
    - [352, 8162.33]
  - - [128, 448, 1, 1280]
    - [323, 2903.59]
  - - [256, 4288, 1, 3328]
    - [353, 6346.04]
  - - [5888, 1408, 1, 1280]
    - [352, 8959.55]
  - - [704, 1856, 1, 3328]
    - [347, 6955.37]
  - - [4, 1408, 1, 128]
    - [367, 60.1747]
  - - [1024, 2368, 1, 256]
    - [354, 5927.88]
  - - [64, 4, 1, 256]
    - [372, 13.3129]
  - - [1408, 1856, 1, 1280]
    - [350, 8051.68]
  - - [1408, 64, 1, 1280]
    - [326, 3400.55]
  - - [448, 1024, 1, 1280]
    - [354, 5730.02]
  - - [6144, 24000, 1, 2048]
    - [358, 7738.4]
  - - [4096, 32, 1, 4096]
    - [296, 2381.53]
  - - [256, 1408, 1, 3328]
    - [354, 4844.88]
  - - [5056, 5056, 1, 1280]
    - [358, 9090.2]
  - - [448, 5056, 1, 256]
    - [364, 4961.28]
  - - [704, 1856, 1, 1280]
    - [350, 6456.54]
  - - [128, 5056, 1, 128]
    - [279, 2251.12]
  - - [2368, 128, 1, 256]
    - [347, 3403.37]
  - - [1760, 6400, 1, 1760]
    - [346, 8959.8]
  - - [1856, 1408, 1, 128]
    - [339, 3493.16]
  - - [64, 5056, 1, 256]
    - [348, 2582.32]
  - - [6784, 256, 1, 3328]
    - [346, 7323.64]
  - - [6784, 4288, 1, 3328]
    - [348, 8542.19]
  - - [4288, 448, 1, 256]
    - [364, 5030.6]
  - - [64, 704, 1, 128]
    - [281, 375.567]
  - - [1856, 2368, 1, 3328]
    - [357, 6742.44]
  - - [4288, 2944, 1, 1280]
    - [358, 8578.27]
  - - [704, 5056, 1, 1280]
    - [354, 8014.55]
  - - [2368, 704, 1, 3328]
    - [353, 6544.41]
  - - [256, 5888, 1, 256]
    - [351, 5933.0]
  - - [1856, 4288, 1, 3328]
    - [357, 7410.82]
  - - [256, 2944, 1, 256]
    - [353, 5014.08]
  - - [5888, 1024, 1, 256]
    - [358, 8069.44]
  - - [448, 64, 1, 1280]
    - [333, 2057.28]
  - - [3072, 64, 1, 1024]
    - [313, 2145.52]
  - - [3584, 4, 1, 1280]
    - [305, 498.743]
  - - [16384, 3200, 1, 4096]
    - [345, 6621.53]
  - - [2944, 64, 1, 256]
    - [353, 2554.89]
  - - [128, 4, 1, 1280]
    - [315, 87.2489]
  - - [1408, 2944, 1, 256]
    - [352, 8029.45]
  - - [256, 1856, 1, 1280]
    - [347, 6170.7]
  - - [6784, 5056, 1, 3328]
    - [356, 7134.29]
  - - [5056, 5056, 1, 256]
    - [364, 6246.9]
  - - [1408, 6784, 1, 128]
    - [341, 4329.55]
  - - [64, 1024, 1, 1280]
    - [323, 3206.75]
  - - [2944, 4, 1, 256]
    - [372, 333.58]
  - - [704, 5056, 1, 128]
    - [336, 4085.52]
  - - [4, 2368, 1, 1280]
    - [373, 394.767]
  - - [2368, 2944, 1, 1280]
    - [352, 8634.05]
  - - [128, 3584, 1, 1280]
    - [353, 6046.25]
  - - [6784, 6784, 1, 1280]
    - [358, 8847.51]
  - - [1408, 4288, 1, 1280]
    - [358, 8236.79]
  - - [3584, 4288, 1, 1280]
    - [353, 7399.98]
  - - [2368, 704, 1, 1280]
    - [346, 6754.5]
  - - [5056, 4288, 1, 3328]
    - [352, 8569.63]
  - - [3584, 2368, 1, 3328]
    - [357, 7942.48]
  - - [64, 704, 1, 1280]
    - [326, 2363.69]
  - - [4288, 256, 1, 256]
    - [354, 4591.9]
  - - [2944, 128, 1, 128]
    - [279, 1878.39]
  - - [6144, 32, 1, 2560]
    - [324, 3334.2]
  - - [6784, 448, 1, 1280]
    - [356, 7939.3]
  - - [1408, 2944, 1, 128]
    - [340, 4096.61]
  - - [4288, 2944, 1, 256]
    - [346, 8141.23]
  - - [5888, 704, 1, 1280]
    - [347, 7516.23]
  - - [5056, 4, 1, 3328]
    - [290, 552.509]
  - - [1856, 64, 1, 1280]
    - [296, 3870.86]
  - - [1760, 16, 1, 1760]
    - [308, 2181.51]
  - - [448, 5888, 1, 128]
    - [341, 3371.1]
  - - [5888, 64, 1, 3328]
    - [321, 5319.48]
  - - [2944, 256, 1, 3328]
    - [353, 7122.4]
  - - [1024, 64, 1, 128]
    - [268, 595.882]
  - - [5056, 2368, 1, 1280]
    - [347, 7778.29]
  - - [448, 3584, 1, 1280]
    - [352, 6500.62]
  - - [6784, 5888, 1, 256]
    - [352, 8918.68]
  - - [704, 1024, 1, 128]
    - [336, 2627.51]
  - - [704, 128, 1, 1280]
    - [323, 3408.59]
  - - [4, 3584, 1, 128]
    - [367, 140.821]
  - - [1408, 448, 1, 1280]
    - [347, 5881.54]
  - - [1024, 1408, 1, 256]
    - [351, 5647.27]
  - - [2368, 2368, 1, 3328]
    - [345, 7688.83]
  - - [1856, 6784, 1, 128]
    - [336, 4705.95]
  - - [5056, 704, 1, 3328]
    - [356, 8198.98]
  - - [1408, 1856, 1, 256]
    - [358, 6340.05]
  - - [1408, 704, 1, 3328]
    - [350, 7599.65]
  - - [2368, 5056, 1, 256]
    - [358, 8242.85]
  - - [1408, 256, 1, 1280]
    - [353, 4879.26]
  - - [3072, 128, 1, 1024]
    - [322, 2525.52]
  - - [3584, 2368, 1, 1280]
    - [354, 8132.72]
  - - [4288, 64, 1, 3328]
    - [309, 5156.53]
  - - [2368, 4, 1, 1280]
    - [371, 482.75]
  - - [704, 5888, 1, 256]
    - [361, 5398.75]
  - - [6784, 2944, 1, 128]
    - [337, 4748.99]
  - - [2560, 1600, 1, 2560]
    - [348, 7355.0]
  - - [4288, 6784, 1, 3328]
    - [345, 7409.41]
  - - [2944, 256, 1, 256]
    - [353, 5077.42]
  - - [2944, 6784, 1, 3328]
    - [358, 8068.05]
  - - [704, 1408, 1, 3328]
    - [353, 7239.43]
  - - [6144, 5984, 1, 2048]
    - [352, 7176.07]
  - - [3584, 704, 1, 3328]
    - [358, 6642.86]
  - - [2944, 256, 1, 128]
    - [337, 2644.54]
  - - [6784, 4, 1, 1280]
    - [369, 402.487]
  - - [1024, 64, 1, 1280]
    - [323, 2602.03]
  - - [2048, 1600, 1, 512]
    - [350, 5592.5]
  - - [448, 4288, 1, 256]
    - [348, 6128.99]
  - - [64, 3584, 1, 3328]
    - [289, 5534.93]
  - - [1856, 4288, 1, 128]
    - [339, 4400.11]
  - - [704, 2368, 1, 1280]
    - [364, 5735.02]
  - - [1856, 2368, 1, 1280]
    - [361, 6482.4]
  - - [2368, 128, 1, 3328]
    - [334, 4717.32]
  - - [2944, 128, 1, 256]
    - [361, 3276.9]
  - - [448, 1408, 1, 256]
    - [353, 4852.28]
  - - [1856, 4288, 1, 1280]
    - [348, 8132.96]
  - - [64, 5056, 1, 3328]
    - [324, 5097.06]
  - - [4, 704, 1, 256]
    - [371, 128.831]
  - - [1024, 448, 1, 128]
    - [336, 1816.94]
  - - [704, 4, 1, 1280]
    - [372, 328.976]
  - - [704, 256, 1, 128]
    - [340, 876.569]
  - - [704, 2944, 1, 128]
    - [340, 3734.47]
  - - [1408, 1024, 1, 1280]
    - [348, 7224.85]
  - - [704, 6784, 1, 256]
    - [352, 7354.77]
  - - [6784, 704, 1, 256]
    - [348, 6012.28]
  - - [5056, 1408, 1, 128]
    - [341, 4311.28]
  - - [2048, 7000, 1, 2048]
    - [352, 7232.07]
  - - [256, 3584, 1, 3328]
    - [356, 7006.0]
  - - [4, 5888, 1, 3328]
    - [374, 534.612]
  - - [128, 1408, 1, 128]
    - [266, 1177.07]
  - - [3584, 4288, 1, 3328]
    - [358, 7135.0]
  - - [5888, 1856, 1, 1280]
    - [346, 8395.03]
  - - [256, 1408, 1, 256]
    - [347, 3977.46]
  - - [5056, 64, 1, 1280]
    - [347, 4257.78]
  - - [1024, 704, 1, 256]
    - [347, 5036.93]
  - - [448, 128, 1, 128]
    - [268, 533.533]
  - - [2368, 3584, 1, 1280]
    - [352, 8272.43]
  - - [2368, 6784, 1, 1280]
    - [345, 8288.24]
  - - [1856, 4, 1, 1280]
    - [285, 464.1]
  - - [448, 448, 1, 256]
    - [347, 3058.45]
  - - [2944, 3584, 1, 3328]
    - [352, 8557.63]
  - - [7680, 32, 1, 2560]
    - [324, 3729.03]
  - - [128, 4288, 1, 128]
    - [267, 2116.2]
  - - [256, 256, 1, 3328]
    - [323, 4051.06]
  - - [128, 1024, 1, 3328]
    - [296, 5139.21]
  - - [4, 1408, 1, 3328]
    - [315, 502.871]
  - - [6784, 2944, 1, 256]
    - [346, 8446.06]
  - - [64, 1856, 1, 1280]
    - [288, 3870.86]
  - - [6784, 64, 1, 128]
    - [336, 1877.62]
  - - [4288, 2368, 1, 3328]
    - [356, 8419.4]
  - - [1856, 2368, 1, 256]
    - [350, 6887.48]
  - - [3584, 256, 1, 128]
    - [340, 2496.71]
  - - [3584, 6784, 1, 3328]
    - [352, 7626.18]
  - - [256, 1024, 1, 256]
    - [353, 3095.53]
  - - [4, 6784, 1, 3328]
    - [315, 589.274]
  - - [1024, 5888, 1, 3328]
    - [352, 7794.35]
  - - [1024, 128, 1, 1280]
    - [325, 3130.18]
  - - [3072, 32, 1, 1024]
    - [312, 1675.59]
  - - [6144, 24000, 1, 2560]
    - [352, 7256.14]
  - - [5056, 4288, 1, 1280]
    - [350, 8349.03]
  - - [5888, 64, 1, 256]
    - [299, 2593.35]
  - - [6784, 1856, 1, 3328]
    - [346, 8087.38]
  - - [1408, 5056, 1, 1280]
    - [348, 7802.63]
  - - [1856, 256, 1, 1280]
    - [353, 6150.73]
  - - [64, 5888, 1, 3328]
    - [320, 5301.49]
  - - [2368, 2368, 1, 1280]
    - [350, 8233.43]
  - - [2944, 5888, 1, 128]
    - [343, 3745.51]
  - - [704, 5888, 1, 1280]
    - [348, 8245.04]
  - - [2368, 3584, 1, 128]
    - [340, 4523.43]
  - - [1856, 5056, 1, 128]
    - [337, 4498.08]
  - - [704, 1024, 1, 1280]
    - [361, 5479.59]
  - - [448, 256, 1, 3328]
    - [304, 5048.8]
  - - [448, 1856, 1, 128]
    - [337, 2936.92]
  - - [8192, 3200, 1, 2048]
    - [346, 6713.12]
  - - [128, 1024, 1, 128]
    - [282, 998.744]
  - - [2944, 4, 1, 128]
    - [367, 98.7471]
  - - [1024, 704, 1, 1280]
    - [353, 5897.0]
  - - [128, 5888, 1, 256]
    - [353, 5014.08]
  - - [1024, 5056, 1, 1280]
    - [352, 8857.81]
  - - [4288, 1024, 1, 256]
    - [358, 6195.39]
  - - [2944, 2368, 1, 128]
    - [336, 4442.23]
  - - [704, 704, 1, 3328]
    - [353, 6764.4]
  - - [704, 1408, 1, 1280]
    - [354, 7383.58]
  - - [5888, 448, 1, 1280]
    - [352, 7299.49]
  - - [3584, 256, 1, 3328]
    - [350, 7061.72]
  - - [704, 5888, 1, 3328]
    - [354, 8142.42]
  - - [704, 1856, 1, 128]
    - [340, 3139.14]
  - - [448, 448, 1, 3328]
    - [318, 5063.34]
  - - [4, 4288, 1, 128]
    - [368, 64.9775]
  - - [128, 704, 1, 1280]
    - [288, 3400.55]
  - - [3584, 2944, 1, 256]
    - [358, 7982.14]
  - - [3584, 4, 1, 128]
    - [367, 105.318]
  - - [1856, 128, 1, 3328]
    - [319, 5442.19]
  - - [4, 64, 1, 1280]
    - [373, 42.3268]
  - - [2944, 448, 1, 128]
    - [336, 2926.95]
  - - [128, 2944, 1, 1280]
    - [347, 5109.69]
  - - [64, 64, 1, 3328]
    - [315, 1252.99]
  - - [448, 2944, 1, 1280]
    - [356, 6684.47]
  - - [512, 24000, 1, 2048]
    - [352, 7939.03]
  - - [128, 256, 1, 3328]
    - [333, 3276.9]
  - - [1408, 5056, 1, 3328]
    - [358, 8959.21]
  - - [1856, 1856, 1, 3328]
    - [348, 8006.17]
  - - [3584, 128, 1, 256]
    - [353, 4292.52]
  - - [2560, 800, 1, 2560]
    - [348, 6262.48]
  - - [448, 1408, 1, 3328]
    - [364, 4997.35]
  - - [2368, 2368, 1, 256]
    - [366, 4978.94]
  - - [4288, 4288, 1, 1280]
    - [345, 8617.78]
  - - [64, 448, 1, 1280]
    - [291, 2057.28]
  - - [5888, 1024, 1, 1280]
    - [363, 6848.17]
  - - [1408, 4288, 1, 256]
    - [346, 7077.01]
  - - [448, 4, 1, 256]
    - [371, 84.4294]
  - - [5888, 448, 1, 128]
    - [340, 3493.91]
  - - [512, 48000, 1, 2560]
    - [358, 8960.13]
  - - [35, 8457, 1, 1760]
    - [260, 3934.78]
  - - [704, 6784, 1, 3328]
    - [345, 8180.88]
  - - [2560, 6400, 1, 2560]
    - [346, 7822.24]
  - - [5056, 1024, 1, 1280]
    - [348, 8357.38]
  - - [448, 5888, 1, 3328]
    - [352, 7505.28]
  - - [128, 4, 1, 128]
    - [367, 0.662251]
  - - [1024, 2944, 1, 1280]
    - [352, 8406.24]
  - - [5056, 5888, 1, 1280]
    - [352, 8819.76]
  - - [4288, 5888, 1, 128]
    - [337, 3522.32]
  - - [256, 3584, 1, 256]
    - [348, 5883.89]
  - - [1408, 3584, 1, 128]
    - [336, 4283.41]
  - - [256, 2944, 1, 3328]
    - [356, 5670.63]
  - - [448, 3584, 1, 128]
    - [340, 3171.72]
  - - [5888, 2944, 1, 1280]
    - [358, 8198.86]
  - - [4, 6784, 1, 1280]
    - [305, 553.896]
  - - [2368, 5888, 1, 128]
    - [336, 4787.32]
  - - [8448, 16, 1, 2816]
    - [295, 2452.63]
  - - [64, 2944, 1, 128]
    - [268, 1376.66]
  - - [2368, 4, 1, 256]
    - [290, 278.177]
  - - [3584, 5888, 1, 256]
    - [366, 6233.66]
  - - [2368, 1024, 1, 128]
    - [337, 3781.51]
  - - [2368, 704, 1, 128]
    - [337, 3198.32]
  - - [3584, 2944, 1, 1280]
    - [348, 8045.68]
  - - [3584, 2368, 1, 128]
    - [337, 4188.57]
  - - [5056, 704, 1, 128]
    - [340, 4019.21]
  - - [448, 2368, 1, 128]
    - [342, 2522.21]
  - - [5056, 1408, 1, 3328]
    - [350, 8349.93]
  - - [1408, 704, 1, 256]
    - [356, 4741.42]
  - - [6784, 1024, 1, 3328]
    - [358, 8769.5]
  - - [6784, 2944, 1, 3328]
    - [355, 7319.74]
  - - [2944, 5056, 1, 3328]
    - [345, 8889.76]
  - - [1856, 1856, 1, 256]
    - [348, 6309.84]
  - - [1024, 5888, 1, 128]
    - [339, 3759.6]
  - - [6784, 2368, 1, 1280]
    - [348, 8298.4]
  - - [256, 4, 1, 128]
    - [367, 7.10171]
  - - [4288, 5888, 1, 1280]
    - [352, 8365.28]
  - - [4288, 4288, 1, 256]
    - [352, 6513.78]
  - - [8448, 32, 1, 2816]
    - [323, 4257.74]
  - - [448, 2944, 1, 3328]
    - [356, 6875.62]
  - - [5888, 4, 1, 128]
    - [367, 163.94]
  - - [4288, 1856, 1, 1280]
    - [352, 8402.91]
  - - [1856, 2944, 1, 3328]
    - [352, 6612.21]
  - - [256, 6784, 1, 3328]
    - [353, 7358.7]
  - - [64, 5888, 1, 256]
    - [347, 3359.05]
  - - [256, 5056, 1, 128]
    - [340, 2489.21]
  - - [5056, 1024, 1, 256]
    - [358, 8077.87]
  - - [704, 64, 1, 3328]
    - [302, 3288.4]
  - - [5056, 1856, 1, 3328]
    - [356, 8171.13]
  - - [4, 2944, 1, 3328]
    - [315, 546.843]
  - - [4, 5056, 1, 256]
    - [290, 378.561]
  - - [1856, 1408, 1, 256]
    - [358, 6320.88]
  - - [8448, 12000, 1, 2816]
    - [356, 7365.87]
  - - [6784, 128, 1, 3328]
    - [353, 6366.57]
  - - [4288, 1408, 1, 128]
    - [336, 4451.7]
  - - [1856, 5888, 1, 3328]
    - [354, 8619.76]
  - - [4288, 5056, 1, 256]
    - [358, 7289.05]
  - - [1408, 128, 1, 1280]
    - [296, 4291.15]
  - - [4096, 800, 1, 1024]
    - [347, 5867.89]
  - - [5056, 256, 1, 3328]
    - [353, 7527.61]
  - - [704, 704, 1, 256]
    - [353, 4417.85]
  - - [1024, 5888, 1, 1280]
    - [358, 8674.57]
  - - [6784, 2368, 1, 128]
    - [336, 4724.08]
  - - [4, 5056, 1, 1280]
    - [305, 540.307]
  - - [256, 64, 1, 1280]
    - [307, 1515.38]
  - - [128, 1856, 1, 1280]
    - [347, 4574.21]
  - - [1856, 1024, 1, 1280]
    - [352, 7741.61]
  - - [6784, 4288, 1, 1280]
    - [358, 8521.29]
  - - [2560, 64, 1, 2560]
    - [289, 3504.7]
  - - [1856, 1856, 1, 1280]
    - [348, 7779.31]
  - - [4096, 400, 1, 1024]
    - [358, 4157.81]
  - - [3072, 24000, 1, 1024]
    - [358, 8663.45]
  - - [128, 4288, 1, 3328]
    - [304, 5674.23]
  - - [4, 2368, 1, 3328]
    - [315, 525.48]
  - - [5888, 1856, 1, 128]
    - [340, 4099.74]
  - - [448, 704, 1, 1280]
    - [353, 4309.47]
  - - [128, 5056, 1, 1280]
    - [296, 5068.46]
  - - [1024, 448, 1, 3328]
    - [356, 6077.82]
  - - [1856, 704, 1, 1280]
    - [364, 6257.49]
  - - [5056, 3584, 1, 128]
    - [337, 4598.52]
  - - [5888, 5888, 1, 3328]
    - [358, 8058.25]
  - - [6784, 1024, 1, 256]
    - [358, 5120.99]
  - - [2944, 2368, 1, 256]
    - [349, 6523.03]
  - - [256, 448, 1, 256]
    - [299, 1816.94]
  - - [5056, 5888, 1, 3328]
    - [351, 6722.41]
  - - [1856, 1024, 1, 256]
    - [358, 6632.31]
  - - [512, 48000, 1, 1536]
    - [352, 8556.01]
  - - [3584, 448, 1, 1280]
    - [347, 6567.09]
  - - [8448, 5984, 1, 2816]
    - [352, 8990.66]
  - - [448, 5888, 1, 256]
    - [352, 6220.47]
  - - [704, 64, 1, 128]
    - [265, 450.66]
  - - [1408, 6784, 1, 3328]
    - [345, 8478.68]
  - - [448, 1024, 1, 128]
    - [344, 1844.33]
  - - [4288, 704, 1, 128]
    - [340, 3895.26]
  - - [128, 1856, 1, 128]
    - [271, 1456.46]
  - - [448, 2368, 1, 3328]
    - [350, 5538.04]
  - - [5056, 64, 1, 128]
    - [336, 1648.94]
  - - [5056, 2944, 1, 256]
    - [352, 8230.87]
  - - [6784, 5888, 1, 128]
    - [336, 4873.19]
  - - [1024, 700, 1, 512]
    - [350, 4445.37]
  - - [704, 1024, 1, 256]
    - [348, 4707.99]
  - - [1024, 4, 1, 256]
    - [290, 174.863]
  - - [2944, 704, 1, 128]
    - [340, 3483.42]
  - - [128, 6784, 1, 1280]
    - [348, 6522.93]
  - - [1408, 3584, 1, 3328]
    - [352, 8673.59]
  - - [2368, 6784, 1, 256]
    - [348, 7941.76]
  - - [5056, 1408, 1, 1280]
    - [352, 8801.01]
  - - [256, 256, 1, 128]
    - [277, 551.982]
  - - [5056, 4288, 1, 128]
    - [344, 3793.64]
  - - [1408, 1856, 1, 128]
    - [336, 3067.74]
  - - [1408, 5888, 1, 3328]
    - [352, 9148.97]
  - - [1856, 256, 1, 256]
    - [348, 4319.52]
  - - [6784, 6784, 1, 256]
    - [348, 7668.53]
  - - [64, 256, 1, 128]
    - [282, 131.172]
  - - [4288, 2368, 1, 128]
    - [337, 4582.99]
  - - [256, 4288, 1, 1280]
    - [347, 6058.61]
  - - [2368, 2944, 1, 256]
    - [352, 8016.07]
  - - [4, 1856, 1, 256]
    - [369, 252.832]
  - - [3584, 1856, 1, 1280]
    - [348, 7760.24]
  - - [6784, 6784, 1, 128]
    - [337, 4970.14]
  - - [256, 1856, 1, 128]
    - [343, 1580.59]
  - - [704, 64, 1, 1280]
    - [332, 2556.47]
  - - [5888, 5056, 1, 256]
    - [352, 8216.67]
  - - [8448, 48000, 1, 2816]
    - [358, 4082.89]
  - - [3584, 448, 1, 256]
    - [352, 5518.92]
  - - [448, 4288, 1, 128]
    - [340, 3415.25]
  - - [7680, 64, 1, 2560]
    - [301, 5162.1]
  - - [256, 6784, 1, 256]
    - [352, 6272.62]
  - - [1408, 4288, 1, 128]
    - [340, 4343.63]
  - - [2944, 704, 1, 3328]
    - [347, 7679.71]
  - - [128, 448, 1, 256]
    - [287, 1422.59]
  - - [5056, 256, 1, 1280]
    - [354, 5052.39]
  - - [2560, 32, 1, 2560]
    - [310, 3106.07]
  - - [3584, 3584, 1, 256]
    - [358, 8260.57]
  - - [448, 1408, 1, 128]
    - [336, 2397.38]
  - - [128, 256, 1, 1280]
    - [291, 2340.67]
  - - [3584, 5056, 1, 256]
    - [358, 7347.56]
  - - [6784, 128, 1, 256]
    - [348, 5591.1]
  - - [4288, 4, 1, 256]
    - [290, 354.206]
  - - [704, 448, 1, 256]
    - [353, 3492.33]
  - - [2944, 2368, 1, 1280]
    - [360, 6661.71]
  - - [448, 64, 1, 3328]
    - [332, 3058.45]
  - - [1408, 3584, 1, 256]
    - [358, 7966.59]
  - - [3584, 4, 1, 3328]
    - [371, 605.559]
  - - [6784, 3584, 1, 256]
    - [348, 7525.41]
  - - [256, 128, 1, 128]
    - [280, 276.041]
  - - [704, 1408, 1, 128]
    - [337, 3109.85]
  - - [4, 2368, 1, 256]
    - [371, 283.375]
  - - [4288, 128, 1, 1280]
    - [353, 5132.65]
  - - [128, 1408, 1, 256]
    - [347, 2733.35]
  - - [4, 2944, 1, 256]
    - [369, 314.127]
  - - [64, 128, 1, 3328]
    - [317, 1514.71]
  - - [5056, 2368, 1, 128]
    - [341, 3449.17]
  - - [2944, 2944, 1, 3328]
    - [345, 8169.03]
  - - [5056, 6784, 1, 256]
    - [365, 5792.77]
  - - [1856, 3584, 1, 128]
    - [342, 4213.5]
  - - [128, 2944, 1, 128]
    - [266, 1970.46]
  - - [35, 8457, 1, 2560]
    - [261, 3525.15]
  - - [1024, 704, 1, 3328]
    - [347, 6784.99]
  - - [6784, 448, 1, 256]
    - [356, 6544.88]
  - - [3584, 6784, 1, 128]
    - [336, 4623.6]
  - - [128, 4288, 1, 256]
    - [350, 3606.6]
  - - [704, 448, 1, 3328]
    - [347, 4478.01]
  - - [128, 128, 1, 3328]
    - [332, 2177.65]
  - - [5056, 1856, 1, 256]
    - [366, 5608.72]
  - - [4608, 5984, 1, 1536]
    - [355, 7859.85]
  - - [256, 128, 1, 256]
    - [291, 998.744]
  - - [1760, 3200, 1, 1760]
    - [348, 8179.64]
  - - [1024, 1856, 1, 256]
    - [358, 6143.27]
  - - [4096, 1600, 1, 1024]
    - [366, 5851.52]
  - - [4288, 64, 1, 128]
    - [271, 1372.26]
  - - [256, 448, 1, 3328]
    - [310, 4795.1]
  - - [1408, 6784, 1, 1280]
    - [352, 8426.5]
  - - [3584, 3584, 1, 1280]
    - [352, 7556.56]
  - - [7680, 24000, 1, 2560]
    - [345, 5019.19]
  - - [64, 2368, 1, 1280]
    - [296, 4061.8]
  - - [448, 2368, 1, 1280]
    - [347, 5928.77]
  - - [4608, 48000, 1, 1536]
    - [352, 6937.4]
  - - [5888, 5888, 1, 128]
    - [337, 3744.0]
  - - [64, 6784, 1, 3328]
    - [347, 5988.72]
  - - [2944, 256, 1, 1280]
    - [353, 6717.97]
  - - [2048, 16, 1, 2048]
    - [305, 1210.58]
  - - [256, 2368, 1, 128]
    - [340, 1936.07]
  - - [5056, 2368, 1, 3328]
    - [358, 8875.63]
  - - [2944, 4288, 1, 256]
    - [352, 8063.24]
  - - [1408, 3584, 1, 1280]
    - [348, 8197.07]
  - - [2368, 64, 1, 256]
    - [347, 2365.79]
  - - [64, 448, 1, 3328]
    - [333, 3027.4]
  - - [704, 128, 1, 3328]
    - [304, 4452.19]
  - - [8192, 1600, 1, 2048]
    - [352, 7229.93]
  - - [1856, 704, 1, 256]
    - [354, 5545.45]
  - - [4, 4288, 1, 1280]
    - [305, 523.825]
  - - [1408, 448, 1, 3328]
    - [359, 4789.4]
  - - [1024, 4, 1, 3328]
    - [285, 504.223]
  - - [512, 24000, 1, 2560]
    - [358, 8903.62]
  - - [2368, 6784, 1, 3328]
    - [358, 8311.14]
  - - [1856, 1408, 1, 1280]
    - [348, 8160.11]
  - - [1856, 448, 1, 1280]
    - [350, 6243.07]
  - - [6784, 704, 1, 128]
    - [336, 4069.05]
  - - [4, 4, 1, 256]
    - [305, 0.842029]
  - - [128, 5888, 1, 128]
    - [336, 2328.02]
  - - [1408, 5888, 1, 256]
    - [347, 6986.91]
  - - [704, 2944, 1, 1280]
    - [348, 7905.03]
  - - [4288, 64, 1, 1280]
    - [323, 3828.27]
  - - [256, 64, 1, 256]
    - [298, 655.46]
  - - [704, 1856, 1, 256]
    - [356, 5444.37]
  - - [704, 6784, 1, 128]
    - [336, 4319.77]
  - - [3584, 704, 1, 1280]
    - [356, 7726.43]
  - - [256, 128, 1, 1280]
    - [291, 2184.63]
  - - [5888, 2368, 1, 256]
    - [358, 8192.69]
  - - [256, 2368, 1, 1280]
    - [353, 5675.54]
  - - [2944, 6784, 1, 128]
    - [341, 4248.35]
  - - [3584, 448, 1, 3328]
    - [352, 6560.77]
  - - [1408, 4, 1, 256]
    - [370, 176.79]
  - - [704, 2368, 1, 3328]
    - [353, 7085.31]
  - - [2944, 448, 1, 256]
    - [349, 3412.0]
  - - [1856, 448, 1, 128]
    - [337, 2748.82]
  - - [4288, 4, 1, 3328]
    - [305, 553.648]
  - - [2368, 128, 1, 1280]
    - [326, 4173.65]
  - - [256, 5888, 1, 128]
    - [341, 2860.98]
  - - [64, 6784, 1, 256]
    - [354, 3637.18]
  - - [64, 5056, 1, 1280]
    - [353, 4289.53]
  - - [4, 6784, 1, 128]
    - [367, 160.906]
  - - [2048, 3200, 1, 512]
    - [354, 6927.09]
  - - [2944, 2944, 1, 1280]
    - [346, 6267.85]
  - - [5056, 448, 1, 3328]
    - [347, 7400.36]
  - - [4, 3584, 1, 1280]
    - [305, 499.83]
  - - [1408, 128, 1, 128]
    - [282, 1037.36]
  - - [6784, 704, 1, 3328]
    - [353, 7633.95]
  - - [128, 64, 1, 1280]
    - [305, 1170.39]
  - - [2368, 256, 1, 1280]
    - [353, 5609.89]
  - - [4, 448, 1, 3328]
    - [373, 358.5]
  - - [5888, 4288, 1, 128]
    - [341, 4521.74]
  - - [4, 5888, 1, 256]
    - [305, 353.933]
  - - [1408, 2944, 1, 3328]
    - [346, 8951.41]
  - - [3584, 704, 1, 128]
    - [336, 3395.41]
  - - [4608, 12000, 1, 1536]
    - [345, 6609.99]
  - - [64, 1024, 1, 256]
    - [291, 1588.85]
  - - [5056, 5056, 1, 128]
    - [336, 4080.81]
  - - [2368, 448, 1, 1280]
    - [347, 5423.04]
  - - [128, 3584, 1, 256]
    - [353, 4705.25]
  - - [704, 448, 1, 1280]
    - [350, 3961.07]
  - - [8192, 800, 1, 2048]
    - [348, 6306.36]
  - - [448, 5056, 1, 128]
    - [340, 3709.56]
  - - [256, 4, 1, 1280]
    - [372, 163.94]
  - - [5056, 3584, 1, 256]
    - [345, 7008.34]
  - - [2368, 4, 1, 3328]
    - [305, 496.366]
  - - [1408, 5056, 1, 128]
    - [340, 4175.37]
  - - [2944, 3584, 1, 128]
    - [336, 4659.79]
  - - [3584, 2368, 1, 256]
    - [358, 5851.87]
  - - [128, 3584, 1, 3328]
    - [348, 6105.04]
  - - [128, 1024, 1, 1280]
    - [288, 3848.09]
  - - [8448, 24000, 1, 2816]
    - [358, 5128.64]
  - - [64, 704, 1, 256]
    - [291, 1253.83]
  - - [4288, 256, 1, 1280]
    - [347, 5625.86]
  - - [3584, 3584, 1, 3328]
    - [352, 8206.15]
  - - [4, 704, 1, 128]
    - [367, 29.5484]
  - - [5888, 6784, 1, 256]
    - [354, 8248.75]
  - - [4288, 2944, 1, 3328]
    - [352, 8657.12]
  - - [2944, 64, 1, 128]
    - [271, 1240.7]
  - - [1024, 128, 1, 3328]
    - [296, 4433.1]
  - - [1024, 16, 1, 500000]
    - [259, 2571.15]
  - - [4288, 128, 1, 3328]
    - [296, 5716.85]
  - - [7680, 128, 1, 2560]
    - [294, 5488.1]
  - - [256, 5056, 1, 1280]
    - [354, 6380.06]
  - - [1408, 256, 1, 128]
    - [340, 1633.83]
  - - [2944, 5888, 1, 3328]
    - [349, 7849.02]
  - - [6784, 5888, 1, 1280]
    - [358, 9047.72]
  - - [2048, 800, 1, 512]
    - [353, 4841.17]
  - - [704, 128, 1, 256]
    - [298, 1567.27]
  - - [5888, 4288, 1, 1280]
    - [352, 7982.93]
  - - [1024, 24000, 1, 2048]
    - [354, 5774.4]
  - - [448, 256, 1, 1280]
    - [288, 3707.19]
  - - [5888, 3584, 1, 128]
    - [341, 3804.5]
  - - [1024, 2944, 1, 128]
    - [336, 3308.36]
  - - [5056, 4, 1, 1280]
    - [369, 469.062]
  - - [256, 1408, 1, 1280]
    - [347, 4899.99]
  - - [3072, 16, 1, 1024]
    - [305, 1233.72]
  - - [704, 3584, 1, 128]
    - [336, 3919.53]
  - - [5888, 448, 1, 3328]
    - [366, 6095.71]
  - - [2368, 4288, 1, 1280]
    - [348, 8338.4]
  - - [4288, 2944, 1, 128]
    - [340, 3946.6]
  - - [1024, 6784, 1, 3328]
    - [354, 7494.38]
  - - [128, 2368, 1, 256]
    - [353, 2895.42]
  - - [6784, 64, 1, 3328]
    - [347, 5964.99]
  - - [5056, 2944, 1, 3328]
    - [358, 6605.63]
  - - [448, 128, 1, 256]
    - [291, 1339.52]
  - - [2944, 3584, 1, 256]
    - [354, 7165.66]
  - - [1408, 1408, 1, 3328]
    - [358, 8332.96]
  - - [1856, 128, 1, 1280]
    - [353, 4498.43]
  - - [3584, 3584, 1, 128]
    - [337, 4000.11]
  - - [64, 3584, 1, 256]
    - [364, 2383.23]
  - - [1408, 4, 1, 3328]
    - [315, 423.008]
  - - [128, 2944, 1, 3328]
    - [320, 5430.03]
  - - [3584, 704, 1, 256]
    - [353, 6154.09]
  - - [2944, 448, 1, 3328]
    - [353, 6507.82]
  - - [3584, 1408, 1, 3328]
    - [358, 8829.73]
  - - [704, 3584, 1, 1280]
    - [348, 7860.33]
  - - [2944, 6784, 1, 1280]
    - [358, 8894.6]
  - - [1856, 6784, 1, 256]
    - [358, 8115.19]
  - - [4288, 448, 1, 3328]
    - [350, 6397.35]
  - - [6784, 4288, 1, 128]
    - [336, 4109.54]
  - - [6784, 704, 1, 1280]
    - [346, 7999.14]
  - - [256, 4288, 1, 256]
    - [350, 4603.94]
  - - [3584, 6784, 1, 256]
    - [358, 7361.65]
  - - [6144, 12000, 1, 2048]
    - [357, 6311.76]
  - - [6144, 16, 1, 2560]
    - [306, 2240.65]
  - - [3584, 64, 1, 128]
    - [277, 1292.36]
  - - [5888, 1024, 1, 3328]
    - [345, 8394.59]
  - - [448, 64, 1, 128]
    - [268, 262.244]
  - - [704, 6784, 1, 1280]
    - [352, 7740.66]
  - - [4, 1024, 1, 1280]
    - [305, 378.921]
  - - [5888, 128, 1, 256]
    - [353, 5003.68]
  - - [4096, 16, 1, 4096]
    - [305, 1585.85]
  - - [1856, 5056, 1, 3328]
    - [346, 8522.92]
  - - [4, 6784, 1, 256]
    - [290, 387.757]
  - - [1024, 3584, 1, 128]
    - [340, 3031.61]
  - - [1024, 1408, 1, 128]
    - [342, 2600.85]
  - - [2368, 2944, 1, 128]
    - [339, 4340.26]
  - - [5056, 64, 1, 256]
    - [353, 3109.62]
  - - [4, 448, 1, 1280]
    - [373, 253.835]
  - - [5056, 2944, 1, 128]
    - [344, 3740.01]
  - - [5888, 5056, 1, 3328]
    - [358, 9016.48]
  - - [1024, 704, 1, 128]
    - [340, 2363.66]
  - - [5888, 2368, 1, 128]
    - [343, 3651.83]
  - - [128, 5056, 1, 3328]
    - [347, 6243.64]
  - - [3584, 6784, 1, 1280]
    - [345, 9080.67]
  - - [448, 4, 1, 1280]
    - [373, 243.083]
  - - [1856, 5888, 1, 256]
    - [358, 8182.12]
  - - [256, 256, 1, 256]
    - [291, 1542.12]
  - - [256, 64, 1, 128]
    - [272, 135.226]
  - - [4288, 4288, 1, 3328]
    - [358, 8674.64]
  - - [4288, 1408, 1, 1280]
    - [346, 7867.18]
  - - [3584, 5056, 1, 128]
    - [336, 4457.83]
  - - [4, 1024, 1, 3328]
    - [285, 440.394]
  - - [4288, 2368, 1, 256]
    - [366, 5699.57]
  - - [2944, 5056, 1, 1280]
    - [358, 8236.56]
  - - [448, 6784, 1, 256]
    - [348, 6620.62]
  - - [64, 128, 1, 128]
    - [273, 67.6629]
  - - [1856, 2368, 1, 128]
    - [340, 4233.7]
  - - [6784, 2368, 1, 3328]
    - [358, 8269.9]
  - - [256, 1024, 1, 1280]
    - [347, 4882.88]
  - - [704, 4, 1, 128]
    - [367, 19.111]
  - - [256, 4, 1, 256]
    - [305, 46.9114]
  - - [4288, 128, 1, 256]
    - [353, 4273.49]
  - - [4288, 1856, 1, 3328]
    - [348, 8195.81]
  - - [3584, 448, 1, 128]
    - [341, 2750.65]
  - - [2048, 1600, 1, 2048]
    - [364, 5753.59]
  - - [256, 4, 1, 3328]
    - [374, 297.978]
  - - [4, 1408, 1, 1280]
    - [372, 402.386]
  - - [3584, 64, 1, 1280]
    - [361, 4096.1]
  - - [1408, 448, 1, 128]
    - [336, 2498.25]
  - - [3584, 1024, 1, 1280]
    - [358, 7252.18]
  - - [1856, 5056, 1, 256]
    - [352, 7711.59]
  - - [4, 3584, 1, 256]
    - [369, 314.314]
  - - [4, 2944, 1, 1280]
    - [305, 483.218]
  - - [1024, 4288, 1, 256]
    - [357, 6544.52]
  - - [5888, 3584, 1, 3328]
    - [346, 8105.15]
  - - [1856, 4, 1, 256]
    - [305, 252.832]
  - - [4, 256, 1, 256]
    - [290, 48.2882]
  - - [5056, 3584, 1, 3328]
    - [351, 7354.8]
  - - [704, 448, 1, 128]
    - [344, 1233.91]
  - - [2368, 1408, 1, 1280]
    - [352, 6654.24]
  - - [5056, 2944, 1, 1280]
    - [358, 8505.72]
  - - [4, 4, 1, 128]
    - [368, 0.1478505]
  - - [3584, 256, 1, 256]
    - [350, 4616.47]
  - - [1024, 6784, 1, 256]
    - [352, 7944.98]
  - - [4, 128, 1, 256]
    - [305, 29.3571]
  - - [64, 64, 1, 1280]
    - [316, 642.61]
  - - [5124, 9124, 1, 2048]
    - [358, 8019.4]
  - - [6784, 4, 1, 128]
    - [367, 193.067]
  - - [2944, 1408, 1, 128]
    - [336, 3827.13]
  - - [448, 128, 1, 3328]
    - [309, 4064.0]
  - - [3584, 1408, 1, 1280]
    - [358, 7180.83]
  - - [64, 4288, 1, 3328]
    - [304, 4786.84]
  - - [5056, 6784, 1, 3328]
    - [345, 7889.83]
  - - [128, 2944, 1, 256]
    - [348, 3599.69]
  - - [128, 6784, 1, 128]
    - [266, 2606.79]
  - - [3584, 4288, 1, 256]
    - [352, 7299.81]
  - - [448, 1856, 1, 256]
    - [348, 5207.07]
  - - [1856, 6784, 1, 3328]
    - [350, 8386.36]
  - - [3584, 128, 1, 3328]
    - [294, 5590.04]
  - - [64, 1856, 1, 256]
    - [287, 1949.38]
  - - [64, 448, 1, 256]
    - [292, 955.833]
  - - [5888, 4288, 1, 256]
    - [356, 7791.84]
  - - [4, 448, 1, 128]
    - [367, 8.84146]
  - - [5056, 1408, 1, 256]
    - [358, 5154.01]
  - - [35, 8457, 1, 2048]
    - [263, 3182.57]
  - - [64, 256, 1, 1280]
    - [312, 1713.46]
  - - [3584, 1024, 1, 256]
    - [348, 6528.18]
  - - [256, 704, 1, 256]
    - [347, 2720.46]
  - - [5888, 5888, 1, 256]
    - [356, 7992.26]
  - - [4288, 1024, 1, 1280]
    - [350, 7837.5]
  - - [5888, 128, 1, 3328]
    - [353, 7181.13]
  - - [448, 6784, 1, 3328]
    - [347, 7663.1]
  - - [2944, 1408, 1, 1280]
    - [356, 7903.14]
  - - [64, 128, 1, 1280]
    - [305, 1191.66]
  - - [2944, 1856, 1, 3328]
    - [346, 7844.41]
  - - [2368, 64, 1, 128]
    - [277, 997.973]
  - - [256, 1024, 1, 128]
    - [336, 1215.84]
  - - [3584, 5888, 1, 1280]
    - [345, 8958.94]
  - - [64, 4, 1, 128]
    - [368, 1.21608]
  - - [6784, 1856, 1, 1280]
    - [345, 6728.8]
  - - [2944, 5056, 1, 256]
    - [358, 8275.21]
  - - [4288, 4, 1, 128]
    - [367, 147.644]
  - - [5888, 256, 1, 3328]
    - [354, 7094.2]
  - - [2944, 4288, 1, 128]
    - [339, 4611.55]
  - - [3584, 1408, 1, 256]
    - [349, 6543.06]
  - - [704, 3584, 1, 3328]
    - [348, 8117.2]
  - - [4096, 3200, 1, 1024]
    - [363, 6656.13]
  - - [5056, 448, 1, 1280]
    - [361, 6096.2]
  - - [3584, 1856, 1, 3328]
    - [346, 8552.41]
  - - [4288, 6784, 1, 1280]
    - [352, 8212.46]
  - - [2560, 7000, 1, 2560]
    - [354, 7655.34]
  - - [1408, 704, 1, 1280]
    - [350, 5756.79]
  - - [2944, 1024, 1, 256]
    - [358, 6880.91]
  - - [6784, 64, 1, 256]
    - [353, 4438.96]
  - - [2368, 4288, 1, 3328]
    - [354, 8377.99]
  - - [4, 1408, 1, 256]
    - [371, 222.599]
  - - [1024, 1408, 1, 1280]
    - [348, 6339.38]
  - - [64, 64, 1, 256]
    - [305, 187.346]
  - - [704, 256, 1, 3328]
    - [347, 4046.14]
  - - [6784, 5056, 1, 256]
    - [358, 7972.17]
  - - [1856, 1856, 1, 128]
    - [342, 3716.61]
  - - [3584, 5056, 1, 3328]
    - [358, 8684.76]
  - - [448, 6784, 1, 128]
    - [340, 3829.05]
  - - [4, 704, 1, 3328]
    - [373, 393.206]
  - - [35, 8457, 1, 4096]
    - [262, 3173.24]
  - - [448, 2944, 1, 256]
    - [356, 5553.41]
  - - [4, 4288, 1, 3328]
    - [315, 573.211]
  - - [2944, 6784, 1, 256]
    - [352, 8566.06]
  - - [2944, 2944, 1, 128]
    - [336, 4540.83]
  - - [4, 4, 1, 1280]
    - [315, 3.14762]
  - - [1856, 3584, 1, 1280]
    - [352, 7306.36]
  - - [64, 2944, 1, 256]
    - [364, 2292.61]
  - - [448, 256, 1, 128]
    - [273, 797.93]
  - - [4288, 448, 1, 128]
    - [339, 3430.5]
  - - [4608, 24000, 1, 1536]
    - [357, 6820.24]
  - - [1856, 1408, 1, 3328]
    - [360, 6600.24]
  - - [128, 128, 1, 128]
    - [265, 161.917]
  - - [1024, 4288, 1, 3328]
    - [348, 7937.08]
  - - [448, 2368, 1, 256]
    - [356, 4526.45]
  - - [1024, 4, 1, 128]
    - [368, 16.9907]
  - - [64, 1408, 1, 1280]
    - [288, 3345.32]
  - - [64, 6784, 1, 1280]
    - [353, 5526.6]
  - - [5056, 448, 1, 256]
    - [347, 4216.65]
  - - [2944, 2368, 1, 3328]
    - [358, 7000.42]
  - - [704, 4288, 1, 3328]
    - [364, 6414.43]
  - - [1408, 128, 1, 256]
    - [347, 2720.46]
  - - [1024, 1856, 1, 1280]
    - [358, 7682.93]
  - - [2048, 6400, 1, 2048]
    - [354, 7418.22]
  - - [512, 48000, 1, 2816]
    - [358, 8884.77]
  - - [5124, 9124, 1, 2560]
    - [350, 6040.8]
  - - [128, 2368, 1, 3328]
    - [304, 5025.66]
  - - [1024, 5888, 1, 256]
    - [352, 7322.21]
  - - [64, 2944, 1, 1280]
    - [288, 4222.31]
  - - [5056, 64, 1, 3328]
    - [329, 4936.32]
  - - [128, 704, 1, 128]
    - [274, 683.414]
  - - [1408, 2368, 1, 256]
    - [353, 6404.22]
  - - [1408, 1408, 1, 256]
    - [358, 4537.93]
  - - [4, 64, 1, 128]
    - [367, 2.56747]
  - - [64, 1024, 1, 128]
    - [266, 532.372]
  - - [1024, 8, 1, 500000]
    - [256, 1685.08]
  - - [2368, 2368, 1, 128]
    - [337, 4334.33]
  - - [64, 5888, 1, 128]
    - [266, 2003.19]
  - - [5888, 4, 1, 3328]
    - [284, 339.118]
  - - [6784, 1408, 1, 128]
    - [340, 4431.23]
  - - [4288, 5888, 1, 256]
    - [358, 7800.88]
  - - [1408, 5056, 1, 256]
    - [352, 8153.38]
  - - [5056, 128, 1, 3328]
    - [309, 5829.93]
  - - [128, 128, 1, 1280]
    - [312, 1691.35]
  - - [448, 704, 1, 256]
    - [353, 3364.28]
  - - [4288, 3584, 1, 128]
    - [337, 2952.68]
  - - [2944, 128, 1, 3328]
    - [309, 5620.82]
  - - [64, 1408, 1, 3328]
    - [310, 4169.91]
  - - [3584, 5056, 1, 1280]
    - [355, 7780.76]
  - - [256, 448, 1, 1280]
    - [288, 3929.45]
  - - [704, 704, 1, 128]
    - [336, 2346.17]
  - - [5056, 4, 1, 128]
    - [367, 144.557]
  - - [704, 256, 1, 1280]
    - [356, 2283.22]
  - - [64, 2368, 1, 3328]
    - [288, 4921.69]
  - - [1856, 1024, 1, 128]
    - [337, 3459.57]
  - - [1856, 64, 1, 128]
    - [269, 918.237]
  - - [4096, 64, 1, 4096]
    - [314, 4000.62]
  - - [1024, 24000, 1, 1536]
    - [350, 8502.36]
  - - [704, 4288, 1, 256]
    - [354, 6003.83]
  - - [5888, 2368, 1, 1280]
    - [345, 8801.3]
  - - [128, 256, 1, 256]
    - [299, 1070.08]
  - - [64, 128, 1, 256]
    - [305, 374.591]
  - - [2368, 5888, 1, 1280]
    - [348, 8308.63]
  - - [5888, 256, 1, 1280]
    - [356, 7154.42]
  - - [1760, 128, 1, 1760]
    - [297, 5363.91]
  - - [4, 5888, 1, 1280]
    - [305, 542.304]
  - - [704, 128, 1, 128]
    - [277, 779.447]
  - - [1024, 4, 1, 1280]
    - [305, 392.531]
  - - [2368, 1856, 1, 3328]
    - [348, 7975.32]
  - - [2368, 128, 1, 128]
    - [270, 1584.96]
  - - [2944, 704, 1, 256]
    - [356, 4039.21]
  - - [5056, 128, 1, 128]
    - [336, 2575.89]
  - - [2368, 1024, 1, 3328]
    - [364, 6165.54]
  - - [256, 704, 1, 3328]
    - [347, 4028.74]
  - - [704, 3584, 1, 256]
    - [358, 6102.92]
  - - [704, 2944, 1, 3328]
    - [348, 8202.84]
  - - [6784, 1024, 1, 128]
    - [340, 4386.4]
  - - [256, 448, 1, 128]
    - [277, 834.195]
  - - [448, 1024, 1, 3328]
    - [365, 5412.48]
  - - [2944, 1024, 1, 3328]
    - [358, 6265.87]
  - - [2944, 5056, 1, 128]
    - [336, 4770.88]
  - - [2368, 256, 1, 256]
    - [353, 3975.23]
  - - [1408, 6784, 1, 256]
    - [352, 7987.02]
  - - [6784, 1408, 1, 3328]
    - [352, 8472.71]
  - - [4288, 6784, 1, 128]
    - [343, 3865.2]
  - - [704, 64, 1, 256]
    - [291, 1287.41]
  - - [5888, 4, 1, 1280]
    - [290, 510.022]
  - - [256, 2368, 1, 3328]
    - [353, 5837.65]
  - - [6784, 2944, 1, 1280]
    - [358, 8560.54]
  - - [4288, 1856, 1, 128]
    - [336, 4617.07]
  - - [1856, 2944, 1, 128]
    - [336, 4287.73]
  - - [6784, 448, 1, 128]
    - [340, 3893.43]
  - - [64, 3584, 1, 128]
    - [266, 1609.76]
  - - [448, 5056, 1, 1280]
    - [356, 7124.41]
  - - [2368, 1856, 1, 128]
    - [339, 4004.65]
  - - [64, 2944, 1, 3328]
    - [289, 5086.48]
  - - [4288, 704, 1, 256]
    - [354, 6176.57]
  - - [256, 3584, 1, 128]
    - [337, 2553.15]
  - - [5888, 704, 1, 256]
    - [353, 6781.51]
  - - [3584, 1024, 1, 128]
    - [340, 3660.95]
  - - [256, 5888, 1, 3328]
    - [356, 7772.13]
  - - [1408, 4288, 1, 3328]
    - [352, 8832.86]
  - - [6784, 4288, 1, 256]
    - [358, 8566.14]
  - - [4288, 256, 1, 128]
    - [338, 1953.79]
  - - [5888, 256, 1, 256]
    - [356, 3730.53]
  - - [6784, 1024, 1, 1280]
    - [352, 8578.39]
  - - [5888, 1024, 1, 128]
    - [337, 4092.96]
  - - [1024, 128, 1, 256]
    - [287, 1897.98]
  - - [512, 16, 1, 500000]
    - [258, 2363.79]
  - - [128, 64, 1, 3328]
    - [315, 1592.56]
  - - [448, 64, 1, 256]
    - [305, 976.168]
  - - [2368, 256, 1, 128]
    - [340, 2094.99]
  - - [6784, 3584, 1, 1280]
    - [352, 8570.16]
  - - [1024, 6784, 1, 1280]
    - [358, 8203.57]
  - - [2944, 64, 1, 1280]
    - [296, 4300.61]
  - - [1408, 2944, 1, 1280]
    - [348, 7349.64]
  - - [256, 1856, 1, 256]
    - [347, 4649.75]
  - - [2048, 800, 1, 2048]
    - [366, 4668.73]
  - - [1408, 2368, 1, 3328]
    - [356, 7537.74]
  - - [2944, 4, 1, 3328]
    - [305, 514.142]
  - - [128, 1408, 1, 3328]
    - [297, 4991.64]
  - - [2944, 1856, 1, 128]
    - [336, 4317.39]
  - - [256, 2944, 1, 128]
    - [336, 2258.27]
  - - [256, 6784, 1, 128]
    - [336, 3147.02]
  - - [2368, 4, 1, 128]
    - [368, 33.9286]
  - - [1408, 256, 1, 3328]
    - [347, 5077.85]
  - - [1856, 4, 1, 128]
    - [368, 21.5025]
  - - [5056, 6784, 1, 128]
    - [336, 4945.11]
  - - [4288, 5056, 1, 128]
    - [339, 4729.87]
  - - [1856, 5888, 1, 128]
    - [336, 4707.96]
  - - [2944, 5888, 1, 256]
    - [350, 8014.78]
  - - [3584, 1856, 1, 256]
    - [352, 7567.13]
  - - [4288, 3584, 1, 1280]
    - [345, 8726.43]
  - - [2368, 448, 1, 256]
    - [353, 4227.7]
  - - [4288, 256, 1, 3328]
    - [354, 5487.41]
  - - [1856, 704, 1, 128]
    - [340, 3125.06]
  - - [1408, 64, 1, 256]
    - [300, 1620.09]
  - - [64, 1856, 1, 128]
    - [264, 955.147]
  - - [4, 256, 1, 128]
    - [367, 10.8789]
  - - [2560, 16, 1, 2560]
    - [312, 2019.7]
  - - [704, 5888, 1, 128]
    - [341, 3976.26]
  - - [6784, 3584, 1, 128]
    - [340, 4018.91]
  - - [1024, 64, 1, 256]
    - [305, 1370.79]
  - - [64, 2368, 1, 256]
    - [347, 2255.76]
  - - [4288, 5056, 1, 3328]
    - [352, 8368.69]
  - - [4, 1856, 1, 1280]
    - [305, 392.126]
  - - [4288, 128, 1, 128]
    - [270, 2287.03]
  - - [1408, 1408, 1, 128]
    - [340, 3233.48]
  - - [7680, 16, 1, 2560]
    - [308, 2257.37]
  - - [1856, 128, 1, 128]
    - [270, 1532.8]
  - - [5056, 2368, 1, 256]
    - [352, 8167.29]
  - - [4288, 704, 1, 3328]
    - [358, 6411.16]
  - - [448, 3584, 1, 256]
    - [358, 5477.74]
  - - [2368, 64, 1, 1280]
    - [288, 3936.52]
  - - [2368, 1024, 1, 1280]
    - [354, 7688.82]
  - - [2944, 1408, 1, 3328]
    - [345, 7668.78]
  - - [1408, 448, 1, 256]
    - [347, 4863.98]
  - - [1024, 1408, 1, 3328]
    - [356, 7448.99]
  - - [2944, 5888, 1, 1280]
    - [346, 8208.57]
  - - [1408, 4, 1, 1280]
    - [285, 479.419]
  - - [5888, 3584, 1, 256]
    - [346, 8610.09]
  - - [2368, 5056, 1, 128]
    - [343, 3726.25]
  - - [1408, 1856, 1, 3328]
    - [347, 7829.48]
  - - [4, 4, 1, 3328]
    - [374, 4.39419]
  - - [6784, 1408, 1, 1280]
    - [347, 7690.8]
  - - [4096, 7000, 1, 4096]
    - [359, 6272.49]
  - - [704, 2944, 1, 256]
    - [348, 6095.91]
  - - [4288, 64, 1, 256]
    - [313, 2121.31]
  - - [6784, 5888, 1, 3328]
    - [352, 8955.6]
  - - [2368, 4288, 1, 128]
    - [336, 4699.65]
  - - [64, 4288, 1, 1280]
    - [326, 4013.73]
  - - [6784, 64, 1, 1280]
    - [347, 5418.83]
  - - [3584, 128, 1, 128]
    - [276, 2165.3]
  - - [1024, 6784, 1, 128]
    - [337, 3765.3]
  - - [4, 1856, 1, 128]
    - [368, 33.3728]
  - - [1408, 64, 1, 3328]
    - [309, 4489.51]
  - - [6784, 4, 1, 256]
    - [305, 400.262]
  - - [1408, 1408, 1, 1280]
    - [352, 8139.53]
  - - [16384, 400, 1, 4096]
    - [356, 6087.28]
  - - [256, 2368, 1, 256]
    - [347, 4766.35]
  - - [448, 4288, 1, 3328]
    - [354, 7577.08]
  - - [2368, 1408, 1, 256]
    - [350, 5284.53]
  - - [5888, 5056, 1, 128]
    - [337, 3643.6]
  - - [704, 2368, 1, 256]
    - [352, 5334.73]
  - - [1024, 24000, 1, 2560]
    - [360, 7438.06]
  - - [2944, 448, 1, 1280]
    - [361, 4937.53]
  - - [5888, 2368, 1, 3328]
    - [346, 8201.84]
  - - [5124, 9124, 1, 1760]
    - [353, 6764.06]
  - - [448, 1408, 1, 1280]
    - [347, 5881.54]
  - - [448, 1856, 1, 1280]
    - [354, 6225.56]
  - - [4288, 448, 1, 1280]
    - [356, 5626.37]
  - - [5888, 704, 1, 3328]
    - [350, 7873.62]
  - - [5056, 256, 1, 128]
    - [341, 2921.03]
  - - [1856, 256, 1, 128]
    - [343, 1995.42]
  - - [64, 1408, 1, 128]
    - [264, 758.938]
  - - [704, 4, 1, 256]
    - [305, 130.697]
  - - [1408, 5888, 1, 128]
    - [336, 4574.05]
  - - [7680, 12000, 1, 2560]
    - [352, 8747.13]
  - - [1408, 1024, 1, 256]
    - [349, 4609.23]
  - - [8192, 400, 1, 2048]
    - [361, 5283.25]
  - - [1024, 1856, 1, 128]
    - [336, 2686.38]
  - - [256, 704, 1, 128]
    - [336, 1004.83]
  - - [2560, 128, 1, 2560]
    - [314, 4259.14]
  - - [448, 1024, 1, 256]
    - [347, 4813.24]
  - - [128, 4, 1, 3328]
    - [373, 128.408]
  - - [5056, 6784, 1, 1280]
    - [355, 6579.85]
  - - [1408, 64, 1, 128]
    - [277, 819.3]
  - - [1024, 448, 1, 1280]
    - [356, 5703.31]
  - - [704, 5056, 1, 3328]
    - [348, 7574.49]
  - - [128, 5056, 1, 256]
    - [347, 5113.53]
  - - [64, 1024, 1, 3328]
    - [332, 3980.1]
  - - [1856, 4, 1, 3328]
    - [286, 433.253]
  - - [4, 2944, 1, 128]
    - [368, 46.6225]
  - - [2368, 2944, 1, 3328]
    - [346, 9002.13]
  - - [448, 448, 1, 1280]
    - [288, 3969.52]
  - - [2368, 3584, 1, 256]
    - [358, 7806.39]
  - - [5056, 3584, 1, 1280]
    - [345, 8971.56]
  - - [5124, 9124, 1, 4096]
    - [358, 7208.72]
  - - [7680, 48000, 1, 2560]
    - [352, 3835.91]
  - - [448, 4, 1, 3328]
    - [373, 409.7]
  - - [1856, 2944, 1, 1280]
    - [345, 7173.71]
  - - [1024, 48000, 1, 2816]
    - [352, 8976.26]
  - - [128, 1024, 1, 256]
    - [291, 1969.26]
  - - [2944, 1408, 1, 256]
    - [354, 4585.12]
  - - [4288, 1408, 1, 3328]
    - [348, 8237.27]
  - - [3584, 64, 1, 3328]
    - [294, 5183.16]
  - - [5888, 2944, 1, 128]
    - [343, 3674.56]
  - - [2944, 1024, 1, 128]
    - [340, 3834.32]
  - - [4288, 5056, 1, 1280]
    - [352, 8086.1]
  - - [5888, 6784, 1, 1280]
    - [346, 6941.32]
  - - [6784, 5056, 1, 128]
    - [337, 4860.15]
  - - [256, 1024, 1, 3328]
    - [361, 5156.22]
  - - [3584, 4, 1, 256]
    - [305, 332.529]
  - - [1760, 1600, 1, 1760]
    - [348, 6330.76]
  - - [1856, 64, 1, 3328]
    - [309, 4756.03]
  - - [4, 128, 1, 3328]
    - [373, 160.244]
  - - [5888, 1408, 1, 3328]
    - [346, 8722.74]
  - - [448, 2944, 1, 128]
    - [339, 2997.63]
  - - [2368, 1856, 1, 256]
    - [347, 6662.34]
  - - [256, 5056, 1, 256]
    - [349, 5256.29]
  - - [128, 3584, 1, 128]
    - [268, 2073.56]
  - - [448, 3584, 1, 3328]
    - [345, 6833.96]
  - - [4, 5056, 1, 3328]
    - [315, 581.523]
  - - [704, 2368, 1, 128]
    - [336, 3402.29]
  - - [5888, 256, 1, 128]
    - [341, 2977.54]
  - - [4, 5056, 1, 128]
    - [367, 65.2074]
  - - [448, 256, 1, 256]
    - [353, 1764.53]
  - - [704, 4, 1, 3328]
    - [305, 398.554]
  - - [1408, 256, 1, 256]
    - [348, 3463.86]
  - - [3584, 1856, 1, 128]
    - [344, 3228.19]
  - - [4288, 4288, 1, 128]
    - [340, 4853.93]
  - - [1856, 1024, 1, 3328]
    - [364, 5994.68]
  - - [128, 5888, 1, 3328]
    - [318, 6512.85]
  - - [1024, 5056, 1, 256]
    - [358, 7859.42]
  - - [5888, 5888, 1, 1280]
    - [358, 8131.44]
  - - [5056, 5888, 1, 128]
    - [337, 4920.71]
  - - [2368, 1408, 1, 3328]
    - [356, 7110.74]
  - - [1024, 48000, 1, 1536]
    - [356, 8590.82]
  - - [5888, 448, 1, 256]
    - [357, 3567.74]
  - - [2560, 3200, 1, 2560]
    - [347, 7638.31]
  - - [5888, 6784, 1, 128]
    - [337, 3910.92]
  - - [6144, 48000, 1, 2048]
    - [358, 3412.95]
  - - [6784, 5056, 1, 1280]
    - [349, 7890.22]
  - - [5056, 704, 1, 1280]
    - [353, 7665.06]
  - - [1024, 48000, 1, 2560]
    - [358, 8188.5]
  - - [4608, 32, 1, 1536]
    - [326, 2856.97]
  - - [1024, 2368, 1, 128]
    - [336, 3019.35]
  - - [128, 704, 1, 256]
    - [287, 1696.33]
  - - [2368, 448, 1, 3328]
    - [353, 5799.29]
  - - [128, 5888, 1, 1280]
    - [347, 6680.75]
  - - [16384, 800, 1, 4096]
    - [352, 6322.22]
  - - [448, 128, 1, 1280]
    - [326, 2849.49]
  - - [6784, 4, 1, 3328]
    - [305, 563.12]
  - - [5888, 5056, 1, 1280]
    - [352, 8631.33]
  - - [1024, 64, 1, 3328]
    - [327, 3481.96]
  - - [3072, 48000, 1, 1024]
    - [352, 9019.49]
  - - [64, 3584, 1, 1280]
    - [289, 4327.95]
  - - [6784, 1408, 1, 256]
    - [352, 6320.59]
  - - [3584, 5888, 1, 128]
    - [339, 4406.79]
  - - [5056, 5888, 1, 256]
    - [358, 8037.13]
  - - [2368, 1024, 1, 256]
    - [350, 4936.14]
  - - [2944, 1856, 1, 256]
    - [358, 7222.32]
  - - [1856, 6784, 1, 1280]
    - [348, 8251.81]
  - - [64, 5056, 1, 128]
    - [268, 1643.7]
  - - [64, 6784, 1, 128]
    - [266, 1929.77]
  - - [448, 704, 1, 128]
    - [338, 979.959]
  - - [4, 1024, 1, 128]
    - [367, 20.1416]
  - - [4288, 3584, 1, 256]
    - [352, 8444.14]
  - - [1408, 704, 1, 128]
    - [336, 3021.0]
  - - [64, 256, 1, 3328]
    - [332, 2227.47]
  - - [6784, 448, 1, 3328]
    - [358, 6573.11]
  - - [5056, 1856, 1, 1280]
    - [350, 7976.23]
  - - [1408, 1024, 1, 3328]
    - [348, 7470.33]
  - - [2368, 256, 1, 3328]
    - [353, 5394.37]
  - - [5888, 3584, 1, 1280]
    - [345, 9031.55]
  - - [1856, 3584, 1, 3328]
    - [360, 7272.6]
  - - [5888, 128, 1, 1280]
    - [353, 6684.48]
  - - [1024, 2944, 1, 256]
    - [358, 7415.09]
  - - [448, 6784, 1, 1280]
    - [354, 7923.78]
  - - [256, 3584, 1, 1280]
    - [350, 6901.87]
  - - [704, 5056, 1, 256]
    - [355, 5004.55]
  - - [3584, 1024, 1, 3328]
    - [347, 7894.63]
  - - [2944, 1856, 1, 1280]
    - [352, 7903.27]
  - - [128, 256, 1, 128]
    - [265, 325.745]
  - - [5056, 256, 1, 256]
    - [349, 3356.56]
  - - [2944, 4288, 1, 3328]
    - [358, 7813.93]
  - - [2368, 3584, 1, 3328]
    - [358, 8371.09]
  - - [2944, 704, 1, 1280]
    - [364, 5514.09]
  - - [128, 4, 1, 256]
    - [305, 25.3062]
  - - [2944, 3584, 1, 1280]
    - [352, 7738.83]
  - - [1856, 5888, 1, 1280]
    - [346, 8584.63]
  - - [256, 256, 1, 1280]
    - [326, 2962.18]
  - - [2048, 3200, 1, 2048]
    - [354, 6911.69]
  - - [4288, 1408, 1, 256]
    - [352, 7954.0]
  - - [3584, 64, 1, 256]
    - [353, 2780.42]
  - - [64, 1856, 1, 3328]
    - [288, 4912.04]
  - - [256, 1408, 1, 128]
    - [336, 1373.24]
  - - [5888, 1408, 1, 128]
    - [341, 4242.01]
  - - [4288, 2368, 1, 1280]
    - [350, 8012.7]
  - - [4, 4288, 1, 256]
    - [371, 301.674]
  - - [256, 4288, 1, 128]
    - [336, 2706.36]
  - - [2048, 128, 1, 2048]
    - [331, 2885.26]
  - - [256, 128, 1, 3328]
    - [333, 3170.21]
  - - [512, 8, 1, 500000]
    - [257, 1915.12]
  - - [6784, 2368, 1, 256]
    - [352, 8323.66]
  - - [5888, 128, 1, 128]
    - [340, 2466.08]
  - - [1024, 24000, 1, 2816]
    - [350, 8131.64]
  - - [7680, 5984, 1, 2560]
    - [354, 6040.77]
  - - [4288, 1856, 1, 256]
    - [366, 5818.53]
  - - [1856, 256, 1, 3328]
    - [347, 6532.03]
  - - [1856, 2944, 1, 256]
    - [352, 7312.92]
  - - [5056, 1024, 1, 128]
    - [342, 4103.0]
  - - [64, 5888, 1, 1280]
    - [347, 5058.25]
  - - [1760, 800, 1, 1760]
    - [350, 7280.0]
  - - [6784, 256, 1, 128]
    - [340, 3257.69]
  - - [5888, 704, 1, 128]
    - [336, 3813.93]
  - - [1408, 2368, 1, 128]
    - [337, 3561.27]
  - - [1024, 4288, 1, 1280]
    - [356, 7752.74]
  - - [2368, 5056, 1, 3328]
    - [359, 7711.91]
  - - [448, 4, 1, 128]
    - [367, 18.4795]
  - - [4, 256, 1, 3328]
    - [374, 269.71]
  - - [4288, 1024, 1, 3328]
    - [353, 7910.27]
  - - [6144, 48000, 1, 2560]
    - [352, 3541.09]
  - - [1024, 5056, 1, 3328]
    - [346, 8509.66]
  - - [1024, 1856, 1, 3328]
    - [352, 7907.93]
  - - [704, 704, 1, 1280]
    - [364, 5648.15]
  - - [128, 2368, 1, 1280]
    - [323, 4145.11]
  - - [1408, 128, 1, 3328]
    - [296, 4919.6]
  - - [3584, 256, 1, 1280]
    - [348, 5185.56]
  - - [4, 128, 1, 128]
    - [367, 3.07891]
  - - [5888, 64, 1, 1280]
    - [296, 4499.59]
  - - [3584, 128, 1, 1280]
    - [353, 5929.01]
  - - [4, 256, 1, 1280]
    - [372, 170.767]
  - - [128, 704, 1, 3328]
    - [296, 4379.37]
  - - [4288, 6784, 1, 256]
    - [346, 7181.09]
  - - [3584, 2944, 1, 3328]
    - [352, 8553.3]
  - - [128, 1856, 1, 256]
    - [353, 3207.77]
  - - [64, 4288, 1, 256]
    - [347, 2907.99]
  - - [4, 3584, 1, 3328]
    - [305, 560.605]
  - - [64, 4, 1, 3328]
    - [374, 67.5025]
  - - [4, 64, 1, 3328]
    - [374, 88.8467]
  - - [5888, 2944, 1, 256]
    - [352, 7255.77]
  - - [1856, 64, 1, 256]
    - [298, 1743.72]
  - - [5056, 128, 1, 1280]
    - [353, 6009.79]
  - - [448, 4288, 1, 1280]
    - [354, 6466.82]
  - - [448, 1856, 1, 3328]
    - [354, 6381.99]
  - - [1024, 4288, 1, 128]
    - [339, 3491.87]
  - - [4, 1024, 1, 256]
    - [372, 172.563]
  - - [5056, 4288, 1, 256]
    - [352, 8241.52]
  - - [1024, 448, 1, 256]
    - [356, 4218.51]
  - - [1024, 3584, 1, 256]
    - [352, 6513.69]
  - - [2944, 128, 1, 1280]
    - [296, 4710.48]
  - - [2048, 32, 1, 2048]
    - [311, 1779.23]
  - - [64, 256, 1, 256]
    - [305, 655.46]
  - - [1408, 4, 1, 128]
    - [368, 20.1249]
  - - [128, 2368, 1, 128]
    - [268, 1707.73]
  - - [256, 704, 1, 1280]
    - [347, 3735.31]
  - - [64, 2368, 1, 128]
    - [275, 1049.81]
  - - [6784, 6784, 1, 3328]
    - [352, 9277.94]
  - - [448, 5888, 1, 1280]
    - [358, 7319.75]
  - - [5056, 448, 1, 128]
    - [340, 3694.43]
  - - [4288, 704, 1, 1280]
    - [350, 7890.96]
  - - [3584, 2944, 1, 128]
    - [342, 4124.71]
  - - [6784, 256, 1, 1280]
    - [358, 7185.83]
  - - [256, 2944, 1, 1280]
    - [347, 6736.76]
  - - [64, 4288, 1, 128]
    - [266, 1614.41]
  - - [2368, 5888, 1, 3328]
    - [348, 8616.46]
  - - [4, 64, 1, 256]
    - [285, 11.4778]
  - - [704, 1024, 1, 3328]
    - [353, 6801.92]
  - - [2368, 1856, 1, 1280]
    - [350, 7853.57]
  - - [448, 5056, 1, 3328]
    - [353, 7453.04]
  - - [128, 448, 1, 128]
    - [268, 530.449]
  - - [128, 6784, 1, 256]
    - [348, 5557.55]
  - - [3584, 4288, 1, 128]
    - [339, 4462.73]
  - - [64, 448, 1, 128]
    - [268, 278.132]
  - - [5888, 4288, 1, 3328]
    - [345, 9153.55]
  - - [2368, 704, 1, 256]
    - [352, 5350.78]
  - - [256, 1856, 1, 3328]
    - [347, 6536.35]
  - - [1856, 128, 1, 256]
    - [361, 2847.36]
  - - [6784, 128, 1, 128]
    - [341, 2530.82]
  - - [3584, 1408, 1, 128]
    - [342, 3625.62]
  - - [1856, 5056, 1, 1280]
    - [348, 8123.39]
  - - [2944, 1024, 1, 1280]
    - [358, 8450.41]
  - - [5056, 4, 1, 256]
    - [372, 380.787]
  - - [3584, 5888, 1, 3328]
    - [350, 8567.99]
  - - [2368, 4288, 1, 256]
    - [354, 7858.07]
  - - [1024, 2368, 1, 3328]
    - [348, 6776.45]
  - - [64, 704, 1, 3328]
    - [303, 3503.52]
  - - [704, 1408, 1, 256]
    - [348, 6099.99]
  - - [4096, 128, 1, 4096]
    - [328, 4116.57]
  - - [1024, 3584, 1, 1280]
    - [358, 7231.65]
  - - [4288, 5888, 1, 3328]
    - [352, 8762.42]
  - - [4288, 4, 1, 1280]
    - [305, 492.797]
  - - [4608, 16, 1, 1536]
    - [306, 1892.58]
  - - [5888, 64, 1, 128]
    - [283, 1747.73]
  - - [4, 5888, 1, 128]
    - [368, 84.5915]
  - - [1024, 2944, 1, 3328]
    - [356, 6907.05]
  - - [6784, 1856, 1, 256]
    - [352, 6274.07]
  - - [2048, 64, 1, 2048]
    - [335, 2371.44]
  - - [256, 6784, 1, 1280]
    - [352, 7067.04]
  - - [1856, 3584, 1, 256]
    - [358, 7706.87]
  - - [128, 448, 1, 3328]
    - [303, 3995.93]
  - - [6784, 1856, 1, 128]
    - [340, 4459.09]
  - - [4, 448, 1, 256]
    - [305, 84.4294]
  - - [5056, 128, 1, 256]
    - [353, 4954.5]
  - - [512, 24000, 1, 2816]
    - [346, 8994.98]
  - - [256, 5888, 1, 1280]
    - [345, 6184.0]
  - - [4, 128, 1, 1280]
    - [373, 71.9597]
  - - [16384, 1600, 1, 4096]
    - [352, 6921.09]
  - - [6784, 128, 1, 1280]
    - [356, 6486.37]
  - - [64, 1408, 1, 256]
    - [293, 1647.86]
  - - [2368, 1408, 1, 128]
    - [340, 3937.1]
  - - [1856, 448, 1, 256]
    - [353, 4635.57]
  - - [1408, 1024, 1, 128]
    - [336, 3208.51]
  - - [128, 64, 1, 128]
    - [265, 70.192]
  - - [6784, 3584, 1, 3328]
    - [358, 8466.28]
  - - [1760, 7000, 1, 1760]
    - [356, 8149.21]
  - - [2944, 64, 1, 3328]
    - [289, 5018.09]
  - - [64, 64, 1, 128]
    - [265, 35.5249]
  - - [2368, 5056, 1, 1280]
    - [352, 8764.0]
  - - [64, 4, 1, 1280]
    - [374, 43.6745]
  - - [1408, 2368, 1, 1280]
    - [353, 7660.38]
  - - [128, 1408, 1, 1280]
    - [288, 4185.27]
  - - [256, 64, 1, 3328]
    - [313, 2071.75]
  - - [704, 4288, 1, 128]
    - [336, 4069.18]
  - - [128, 1856, 1, 3328]
    - [319, 5776.15]
  - - [2944, 2944, 1, 256]
    - [358, 7949.31]
  - - [2944, 4, 1, 1280]
    - [305, 483.218]
  - - [5888, 4, 1, 256]
    - [290, 396.765]
  - - [6784, 256, 1, 256]
    - [364, 4044.83]
  - - [256, 5056, 1, 3328]
    - [347, 7607.37]
  - - [128, 4288, 1, 1280]
    - [288, 4958.78]
  - - [5056, 1856, 1, 128]
    - [340, 4560.94]
  - - [5056, 1024, 1, 3328]
    - [352, 8634.18]
  - - [128, 128, 1, 256]
    - [290, 699.151]
  - - [1760, 64, 1, 1760]
    - [296, 4580.65]
  - - [4288, 3584, 1, 3328]
    - [358, 9143.76]
  - - [448, 704, 1, 3328]
    - [347, 4473.43]
  - - [448, 448, 1, 128]
    - [278, 1264.38]
  - - [1024, 2368, 1, 1280]
    - [356, 7452.51]
  - - [1856, 704, 1, 3328]
    - [347, 6103.34]
  - - [4, 2368, 1, 128]
    - [367, 96.019]
  - - [5888, 6784, 1, 3328]
    - [352, 9131.74]
  - - [704, 4288, 1, 1280]
    - [354, 7906.46]
  - - [704, 256, 1, 256]
    - [347, 2772.78]
  - - [1024, 48000, 1, 2048]
    - [351, 6513.45]
  - - [4288, 1024, 1, 128]
    - [336, 4291.77]
  - - [512, 2048, 1, 49]
    - [382, 4555.08]
  - - [512, 128, 1, 784]
    - [375, 3195.39]
  - - [2048, 512, 1, 49]
    - [383, 4253.43]
  - - [1024, 256, 1, 196]
    - [379, 4039.43]
  - - [256, 64, 1, 3136]
    - [377, 3015.37]
  - - [256, 1024, 1, 196]
    - [381, 4225.45]
  - - [64, 256, 1, 3136]
    - [378, 3058.45]
  - - [128, 512, 1, 784]
    - [376, 3380.38]
  - - [64, 64, 1, 3136]
    - [380, 1372.44]
  - - [1024, 1024, 1, 3328]
    - [493, 8705.1]
  - - [2048, 200, 1, 3200]
    - [498, 6173.42]
  - - [1024, 200, 1, 13312]
    - [396, 5213.31]
  - - [1024, 256, 1, 1536]
    - [498, 5859.43]
  - - [4096, 256, 1, 12288]
    - [503, 8807.52]
  - - [64, 200, 1, 1024]
    - [470, 366.632]
  - - [32, 512, 1, 1024]
    - [425, 453.049]
  - - [2048, 256, 1, 3328]
    - [487, 7876.73]
  - - [4096, 512, 1, 32]
    - [491, 3975.74]
  - - [2048, 256, 1, 13312]
    - [468, 7837.81]
  - - [4096, 200, 1, 11264]
    - [503, 6902.76]
  - - [2048, 512, 1, 1024]
    - [497, 8100.14]
  - - [2048, 1024, 1, 1664]
    - [397, 9082.08]
  - - [1024, 1024, 1, 64]
    - [493, 4258.28]
  - - [512, 1024, 1, 1536]
    - [487, 7597.33]
  - - [1024, 256, 1, 15360]
    - [388, 6735.24]
  - - [1, 512, 1, 1024]
    - [438, 15.1657]
  - - [4096, 512, 1, 1408]
    - [400, 9024.52]
  - - [1024, 200, 1, 1408]
    - [498, 4461.09]
  - - [1024, 512, 1, 512]
    - [492, 6528.2]
  - - [4096, 256, 1, 15360]
    - [499, 8824.03]
  - - [2048, 512, 1, 640]
    - [489, 7989.25]
  - - [4096, 1024, 1, 1280]
    - [395, 9421.54]
  - - [1024, 200, 1, 6144]
    - [487, 4966.52]
  - - [1024, 1024, 1, 512]
    - [489, 7731.54]
  - - [128, 512, 1, 2048]
    - [405, 2190.34]
  - - [2048, 1024, 1, 640]
    - [395, 8581.8]
  - - [1024, 256, 1, 3328]
    - [487, 6192.71]
  - - [4096, 1024, 1, 13312]
    - [400, 9642.59]
  - - [2048, 256, 1, 2048]
    - [487, 7485.75]
  - - [2048, 1024, 1, 13312]
    - [400, 9352.26]
  - - [2048, 512, 1, 16640]
    - [488, 8839.17]
  - - [1024, 512, 1, 128]
    - [492, 4280.0]
  - - [2048, 1024, 1, 3584]
    - [395, 9264.72]
  - - [2048, 512, 1, 256]
    - [503, 6990.61]
  - - [512, 256, 1, 3200]
    - [450, 4154.52]
  - - [4096, 1024, 1, 1920]
    - [395, 9535.32]
  - - [4096, 200, 1, 2560]
    - [500, 6754.65]
  - - [1024, 256, 1, 16384]
    - [390, 6289.6]
  - - [1024, 1024, 1, 1152]
    - [493, 8407.39]
  - - [2048, 200, 1, 32]
    - [436, 1412.51]
  - - [512, 1024, 1, 2816]
    - [487, 7843.25]
  - - [4096, 256, 1, 14336]
    - [499, 8844.77]
  - - [1024, 200, 1, 4608]
    - [498, 4931.74]
  - - [1024, 200, 1, 16384]
    - [393, 5135.15]
  - - [64, 256, 1, 1024]
    - [471, 461.013]
  - - [1, 200, 1, 1024]
    - [453, 7.49884]
  - - [2048, 200, 1, 2080]
    - [498, 6033.87]
  - - [512, 256, 1, 1792]
    - [408, 3153.71]
  - - [2048, 200, 1, 1024]
    - [498, 5711.3]
  - - [4096, 1024, 1, 12288]
    - [395, 9658.23]
  - - [4096, 200, 1, 4096]
    - [489, 6834.55]
  - - [1024, 512, 1, 11264]
    - [456, 7686.46]
  - - [128, 512, 1, 1024]
    - [426, 1458.99]
  - - [32, 256, 1, 2048]
    - [444, 384.899]
  - - [1024, 200, 1, 1792]
    - [498, 4638.64]
  - - [1024, 1024, 1, 1792]
    - [493, 8550.56]
  - - [32, 256, 1, 512]
    - [477, 161.419]
  - - [512, 200, 1, 2816]
    - [403, 3353.1]
  - - [512, 200, 1, 3072]
    - [388, 3298.89]
  - - [1024, 1024, 1, 8192]
    - [434, 8369.1]
  - - [1024, 256, 1, 12288]
    - [391, 6475.71]
  - - [4096, 200, 1, 768]
    - [493, 6367.97]
  - - [1024, 512, 1, 16384]
    - [509, 7367.12]
  - - [4096, 256, 1, 1024]
    - [489, 8214.16]
  - - [1024, 512, 1, 256]
    - [492, 5537.13]
  - - [4096, 1024, 1, 8320]
    - [395, 9674.26]
  - - [4096, 256, 1, 9216]
    - [497, 8791.02]
  - - [1024, 512, 1, 1408]
    - [487, 7459.65]
  - - [1024, 512, 1, 5632]
    - [498, 7997.91]
  - - [4096, 200, 1, 256]
    - [503, 5371.9]
  - - [1024, 200, 1, 128]
    - [481, 1998.15]
  - - [256, 200, 1, 1024]
    - [450, 1196.01]
  - - [1024, 200, 1, 5120]
    - [498, 4957.44]
  - - [512, 1024, 1, 3072]
    - [511, 7104.07]
  - - [4096, 1024, 1, 15360]
    - [395, 9669.04]
  - - [1, 256, 1, 2048]
    - [437, 13.9262]
  - - [1024, 1024, 1, 4160]
    - [489, 8759.3]
  - - [1024, 256, 1, 256]
    - [496, 3728.37]
  - - [2048, 256, 1, 384]
    - [498, 6123.17]
  - - [512, 256, 1, 2560]
    - [452, 3809.64]
  - - [4096, 512, 1, 3072]
    - [400, 9215.19]
  - - [1024, 256, 1, 4160]
    - [487, 6293.49]
  - - [4096, 512, 1, 13312]
    - [397, 9367.32]
  - - [4096, 1024, 1, 3840]
    - [395, 9631.57]
  - - [4096, 200, 1, 640]
    - [493, 6206.16]
  - - [32, 200, 1, 2048]
    - [431, 303.507]
  - - [1024, 200, 1, 512]
    - [487, 3713.19]
  - - [1024, 1024, 1, 7168]
    - [490, 8475.74]
  - - [2048, 1024, 1, 3200]
    - [395, 9271.34]
  - - [512, 512, 1, 1536]
    - [498, 5832.27]
  - - [4096, 256, 1, 768]
    - [503, 8066.07]
  - - [2048, 256, 1, 6656]
    - [487, 8034.87]
  - - [1024, 256, 1, 896]
    - [487, 5467.54]
  - - [2048, 256, 1, 512]
    - [498, 6465.31]
  - - [2048, 200, 1, 3072]
    - [498, 6165.78]
  - - [128, 200, 1, 1024]
    - [455, 692.87]
  - - [4096, 512, 1, 3840]
    - [400, 9272.7]
  - - [1024, 200, 1, 3200]
    - [498, 4838.85]
  - - [4096, 512, 1, 5632]
    - [395, 9335.52]
  - - [4096, 512, 1, 64]
    - [430, 5275.95]
  - - [1024, 512, 1, 2816]
    - [487, 7816.68]
  - - [4096, 256, 1, 7680]
    - [493, 8795.5]
  - - [4096, 200, 1, 1024]
    - [503, 6448.91]
  - - [1024, 512, 1, 12288]
    - [457, 7624.67]
  - - [2048, 1024, 1, 512]
    - [400, 8436.16]
  - - [128, 256, 1, 2048]
    - [474, 1342.28]
  - - [2048, 200, 1, 1792]
    - [498, 6020.47]
  - - [1024, 1024, 1, 2816]
    - [489, 8670.5]
  - - [2048, 512, 1, 1536]
    - [500, 8466.32]
  - - [4096, 256, 1, 3072]
    - [497, 8631.47]
  - - [1024, 200, 1, 1536]
    - [479, 4577.7]
  - - [1024, 256, 1, 1024]
    - [487, 5491.82]
  - - [4096, 512, 1, 8192]
    - [400, 9325.64]
  - - [128, 1024, 1, 512]
    - [498, 2534.42]
  - - [4096, 512, 1, 2304]
    - [395, 9193.09]
  - - [2048, 256, 1, 5632]
    - [498, 7999.64]
  - - [1024, 256, 1, 5120]
    - [498, 6307.32]
  - - [1024, 512, 1, 6656]
    - [498, 8028.95]
  - - [4096, 512, 1, 2816]
    - [395, 9234.5]
  - - [4096, 200, 1, 2080]
    - [482, 6697.96]
  - - [1024, 200, 1, 2304]
    - [498, 4752.91]
  - - [2048, 200, 1, 13312]
    - [487, 6346.23]
  - - [64, 1024, 1, 1024]
    - [471, 1359.68]
  - - [4096, 256, 1, 3584]
    - [493, 8668.9]
  - - [2048, 1024, 1, 7680]
    - [395, 9365.88]
  - - [1024, 256, 1, 1664]
    - [487, 5907.57]
  - - [1, 512, 1, 2048]
    - [414, 23.5057]
  - - [512, 512, 1, 1024]
    - [487, 5360.23]
  - - [2048, 256, 1, 8192]
    - [459, 7665.31]
  - - [2048, 512, 1, 512]
    - [489, 7767.33]
  - - [4096, 512, 1, 1920]
    - [395, 9133.04]
  - - [4096, 200, 1, 12288]
    - [503, 6910.75]
  - - [1024, 512, 1, 3072]
    - [433, 7310.43]
  - - [2048, 512, 1, 1152]
    - [493, 8342.36]
  - - [1024, 256, 1, 2080]
    - [487, 6010.46]
  - - [4096, 1024, 1, 32]
    - [483, 4793.59]
  - - [4096, 512, 1, 16640]
    - [395, 9365.41]
  - - [2048, 200, 1, 9216]
    - [487, 6315.98]
  - - [2048, 200, 1, 2560]
    - [487, 6119.24]
  - - [2048, 1024, 1, 1024]
    - [395, 8628.69]
  - - [2048, 256, 1, 4608]
    - [487, 7951.39]
  - - [512, 200, 1, 768]
    - [439, 2132.51]
  - - [128, 256, 1, 512]
    - [439, 670.117]
  - - [4096, 512, 1, 1792]
    - [400, 9127.01]
  - - [4096, 1024, 1, 8192]
    - [395, 9591.37]
  - - [1024, 256, 1, 2816]
    - [498, 6119.11]
  - - [1024, 1024, 1, 13312]
    - [490, 8529.37]
  - - [2048, 1024, 1, 4160]
    - [395, 9305.67]
  - - [2048, 256, 1, 3584]
    - [487, 7903.23]
  - - [128, 200, 1, 2048]
    - [455, 1135.91]
  - - [4096, 512, 1, 10240]
    - [397, 9339.59]
  - - [4096, 512, 1, 512]
    - [395, 8446.78]
  - - [2048, 1024, 1, 6656]
    - [395, 9331.75]
  - - [1024, 512, 1, 640]
    - [487, 6776.04]
  - - [2048, 512, 1, 768]
    - [489, 8085.51]
  - - [2048, 200, 1, 1408]
    - [487, 5880.17]
  - - [4096, 200, 1, 2048]
    - [503, 6691.71]
  - - [1024, 1024, 1, 5632]
    - [489, 8749.63]
  - - [2048, 512, 1, 3584]
    - [493, 8704.23]
  - - [64, 512, 1, 512]
    - [429, 667.983]
  - - [64, 200, 1, 512]
    - [439, 251.388]
  - - [1024, 200, 1, 64]
    - [394, 1310.82]
  - - [512, 512, 1, 2304]
    - [487, 6078.8]
  - - [2048, 1024, 1, 14336]
    - [395, 9321.94]
  - - [4096, 512, 1, 11264]
    - [397, 9339.95]
  - - [4096, 512, 1, 128]
    - [482, 6566.53]
  - - [1024, 512, 1, 64]
    - [502, 2953.84]
  - - [4096, 512, 1, 768]
    - [395, 8738.23]
  - - [4096, 1024, 1, 11264]
    - [395, 9637.78]
  - - [1, 256, 1, 1024]
    - [485, 8.93234]
  - - [4096, 200, 1, 7680]
    - [482, 6889.57]
  - - [1024, 200, 1, 12288]
    - [454, 5237.74]
  - - [1024, 1024, 1, 1280]
    - [489, 8418.17]
  - - [4096, 1024, 1, 16640]
    - [395, 9675.01]
  - - [2048, 1024, 1, 5632]
    - [395, 9327.85]
  - - [1024, 200, 1, 15360]
    - [454, 5386.63]
  - - [1, 1024, 1, 1024]
    - [504, 27.3499]
  - - [2048, 256, 1, 16384]
    - [465, 7652.75]
  - - [4096, 512, 1, 12288]
    - [397, 9359.51]
  - - [2048, 200, 1, 896]
    - [498, 5628.96]
  - - [4096, 1024, 1, 5632]
    - [395, 9626.78]
  - - [2048, 256, 1, 32]
    - [491, 1889.43]
  - - [2048, 256, 1, 1280]
    - [487, 7390.94]
  - - [4096, 256, 1, 4096]
    - [489, 8694.37]
  - - [2048, 256, 1, 11264]
    - [487, 8113.95]
  - - [4096, 200, 1, 9216]
    - [489, 6891.08]
  - - [1024, 512, 1, 4096]
    - [435, 7348.46]
  - - [2048, 1024, 1, 10240]
    - [397, 9095.91]
  - - [4096, 1024, 1, 640]
    - [395, 9115.68]
  - - [128, 1024, 1, 2048]
    - [388, 3270.51]
  - - [4096, 200, 1, 3840]
    - [482, 6836.26]
  - - [1024, 1024, 1, 1920]
    - [493, 8562.82]
  - - [2048, 200, 1, 7168]
    - [498, 6296.23]
  - - [2048, 512, 1, 16384]
    - [389, 8632.51]
  - - [2048, 1024, 1, 12288]
    - [395, 9158.08]
  - - [4096, 1024, 1, 10240]
    - [395, 9658.84]
  - - [1024, 1024, 1, 8320]
    - [497, 8799.58]
  - - [1024, 256, 1, 9216]
    - [487, 6375.23]
  - - [4096, 256, 1, 1152]
    - [482, 8301.09]
  - - [512, 200, 1, 2560]
    - [448, 3088.51]
  - - [2048, 256, 1, 1920]
    - [487, 7714.94]
  - - [2048, 1024, 1, 4608]
    - [395, 9305.7]
  - - [512, 256, 1, 1024]
    - [495, 2887.74]
  - - [1024, 256, 1, 1920]
    - [479, 5913.12]
  - - [4096, 512, 1, 3584]
    - [395, 9275.69]
  - - [2048, 512, 1, 4160]
    - [500, 8734.03]
  - - [2048, 512, 1, 5632]
    - [503, 8758.98]
  - - [4096, 1024, 1, 4608]
    - [395, 9657.22]
  - - [4096, 1024, 1, 3328]
    - [395, 9621.45]
  - - [4096, 256, 1, 7168]
    - [489, 8770.05]
  - - [4096, 200, 1, 128]
    - [503, 4458.33]
  - - [2048, 200, 1, 5120]
    - [487, 6176.91]
  - - [1024, 1024, 1, 6656]
    - [489, 8780.45]
  - - [512, 1024, 1, 3200]
    - [498, 7887.09]
  - - [512, 200, 1, 2304]
    - [388, 2991.09]
  - - [2048, 1024, 1, 9216]
    - [400, 9325.46]
  - - [2048, 256, 1, 1536]
    - [498, 7551.73]
  - - [4096, 256, 1, 256]
    - [503, 6932.83]
  - - [2048, 512, 1, 1408]
    - [500, 8430.86]
  - - [1024, 256, 1, 384]
    - [492, 4462.13]
  - - [2048, 1024, 1, 2304]
    - [395, 9174.94]
  - - [4096, 512, 1, 6144]
    - [397, 9284.25]
  - - [1024, 200, 1, 14336]
    - [386, 5268.57]
  - - [1024, 512, 1, 2080]
    - [498, 7736.47]
  - - [2048, 512, 1, 2304]
    - [500, 8616.07]
  - - [4096, 512, 1, 15360]
    - [400, 9362.17]
  - - [1024, 256, 1, 32]
    - [420, 1028.12]
  - - [1024, 200, 1, 2816]
    - [498, 4780.58]
  - - [4096, 200, 1, 512]
    - [489, 6054.23]
  - - [4096, 1024, 1, 7168]
    - [400, 9468.49]
  - - [2048, 256, 1, 14336]
    - [461, 7865.52]
  - - [1024, 200, 1, 3072]
    - [498, 4804.2]
  - - [2048, 200, 1, 1280]
    - [498, 5846.31]
  - - [1024, 1024, 1, 2304]
    - [489, 8633.32]
  - - [4096, 1024, 1, 9216]
    - [395, 9641.03]
  - - [2048, 512, 1, 4608]
    - [500, 8743.3]
  - - [4096, 1024, 1, 7680]
    - [395, 9684.86]
  - - [4096, 256, 1, 6144]
    - [500, 8757.24]
  - - [4096, 256, 1, 896]
    - [493, 8258.93]
  - - [512, 256, 1, 1536]
    - [477, 3065.36]
  - - [1024, 256, 1, 512]
    - [487, 4752.85]
  - - [2048, 256, 1, 640]
    - [487, 6776.04]
  - - [256, 256, 1, 2048]
    - [424, 2249.06]
  - - [2048, 1024, 1, 8192]
    - [395, 9178.17]
  - - [4096, 200, 1, 16640]
    - [387, 7009.59]
  - - [256, 512, 1, 512]
    - [399, 2511.66]
  - - [2048, 512, 1, 384]
    - [500, 7467.7]
  - - [2048, 200, 1, 16384]
    - [468, 6327.31]
  - - [4096, 200, 1, 10240]
    - [493, 6892.74]
  - - [1024, 512, 1, 9216]
    - [442, 7530.09]
  - - [4096, 1024, 1, 64]
    - [417, 6260.26]
  - - [4096, 200, 1, 1920]
    - [503, 6710.27]
  - - [2048, 1024, 1, 1280]
    - [395, 8998.34]
  - - [1024, 200, 1, 3840]
    - [487, 4873.87]
  - - [256, 1024, 1, 512]
    - [498, 4766.35]
  - - [2048, 1024, 1, 3328]
    - [395, 9275.2]
  - - [1024, 256, 1, 16640]
    - [452, 6837.22]
  - - [4096, 512, 1, 14336]
    - [400, 9354.42]
  - - [1024, 1024, 1, 16640]
    - [497, 8832.37]
  - - [1024, 256, 1, 1152]
    - [498, 5642.66]
  - - [512, 512, 1, 512]
    - [487, 4779.93]
  - - [4096, 512, 1, 8320]
    - [400, 9327.96]
  - - [2048, 512, 1, 7680]
    - [503, 8793.96]
  - - [4096, 1024, 1, 6656]
    - [395, 9667.03]
  - - [1024, 512, 1, 3584]
    - [498, 7900.57]
  - - [1024, 1024, 1, 32]
    - [483, 2974.78]
  - - [512, 512, 1, 2816]
    - [479, 6155.85]
  - - [2048, 512, 1, 1664]
    - [503, 8496.55]
  - - [1024, 1024, 1, 14336]
    - [389, 8624.74]
  - - [2048, 200, 1, 2048]
    - [498, 6029.86]
  - - [1024, 1024, 1, 3584]
    - [489, 8702.62]
  - - [512, 200, 1, 1280]
    - [403, 2350.75]
  - - [4096, 256, 1, 6656]
    - [503, 8788.41]
  - - [4096, 256, 1, 4160]
    - [480, 8728.44]
  - - [128, 256, 1, 1024]
    - [462, 859.589]
  - - [512, 200, 1, 3200]
    - [403, 3376.85]
  - - [2048, 512, 1, 9216]
    - [486, 8806.4]
  - - [2048, 1024, 1, 256]
    - [482, 7713.76]
  - - [1024, 256, 1, 2304]
    - [498, 6015.83]
  - - [1024, 200, 1, 8192]
    - [498, 5022.02]
  - - [2048, 256, 1, 3072]
    - [415, 7515.09]
  - - [2048, 256, 1, 8320]
    - [487, 8063.68]
  - - [4096, 512, 1, 1024]
    - [397, 8824.41]
  - - [1024, 512, 1, 3200]
    - [487, 7866.39]
  - - [1024, 512, 1, 896]
    - [479, 7161.11]
  - - [2048, 512, 1, 1280]
    - [493, 8384.52]
  - - [4096, 200, 1, 64]
    - [402, 3260.6]
  - - [1024, 256, 1, 6144]
    - [508, 6143.72]
  - - [1024, 200, 1, 2560]
    - [487, 4762.89]
  - - [1024, 1024, 1, 5120]
    - [416, 8454.23]
  - - [2048, 512, 1, 6656]
    - [493, 8799.05]
  - - [4096, 1024, 1, 1536]
    - [395, 9503.37]
  - - [1024, 1024, 1, 128]
    - [418, 5825.52]
  - - [512, 1024, 1, 1792]
    - [487, 7701.12]
  - - [2048, 1024, 1, 32]
    - [398, 3938.41]
  - - [4096, 256, 1, 2816]
    - [482, 8652.2]
  - - [1024, 1024, 1, 15360]
    - [389, 8719.7]
  - - [1024, 256, 1, 5632]
    - [487, 6344.18]
  - - [1024, 1024, 1, 4096]
    - [490, 8187.86]
  - - [2048, 200, 1, 4160]
    - [498, 6222.48]
  - - [512, 256, 1, 768]
    - [429, 2771.67]
  - - [4096, 512, 1, 640]
    - [400, 8590.58]
  - - [2048, 512, 1, 8192]
    - [442, 8494.9]
  - - [1024, 512, 1, 768]
    - [487, 7049.35]
  - - [4096, 200, 1, 8320]
    - [482, 6908.7]
  - - [2048, 512, 1, 896]
    - [489, 8224.23]
  - - [4096, 200, 1, 7168]
    - [500, 6878.59]
  - - [2048, 512, 1, 13312]
    - [488, 8803.04]
  - - [64, 512, 1, 1024]
    - [392, 844.024]
  - - [2048, 200, 1, 3840]
    - [487, 6192.48]
  - - [1024, 1024, 1, 768]
    - [480, 8098.51]
  - - [4096, 512, 1, 16384]
    - [400, 9345.73]
  - - [4096, 256, 1, 2304]
    - [480, 8596.45]
  - - [1, 256, 1, 4096]
    - [485, 19.9293]
  - - [1024, 1024, 1, 11264]
    - [490, 8491.48]
  - - [2048, 200, 1, 16640]
    - [484, 6510.64]
  - - [1024, 256, 1, 3072]
    - [498, 6179.55]
  - - [4096, 1024, 1, 512]
    - [395, 9032.25]
  - - [2048, 256, 1, 2816]
    - [487, 7793.57]
  - - [32, 512, 1, 512]
    - [399, 318.816]
  - - [256, 512, 1, 2048]
    - [450, 3369.02]
  - - [1024, 512, 1, 384]
    - [498, 6198.58]
  - - [2048, 200, 1, 7680]
    - [487, 6307.7]
  - - [1024, 512, 1, 4608]
    - [498, 7953.48]
  - - [2048, 256, 1, 768]
    - [498, 7059.24]
  - - [4096, 200, 1, 32]
    - [447, 2199.29]
  - - [4096, 200, 1, 3328]
    - [482, 6813.12]
  - - [1024, 200, 1, 1152]
    - [487, 4375.65]
  - - [1024, 1024, 1, 1408]
    - [489, 8457.91]
  - - [2048, 200, 1, 15360]
    - [463, 6333.1]
  - - [512, 1024, 1, 2048]
    - [473, 6280.76]
  - - [1024, 512, 1, 1024]
    - [498, 7064.19]
  - - [1024, 200, 1, 10240]
    - [487, 5030.69]
  - - [4096, 256, 1, 5632]
    - [500, 8765.22]
  - - [512, 512, 1, 3072]
    - [510, 5942.44]
  - - [2048, 256, 1, 1408]
    - [487, 7545.05]
  - - [2048, 256, 1, 6144]
    - [498, 7963.97]
  - - [4096, 256, 1, 3328]
    - [493, 8682.58]
  - - [1024, 200, 1, 1664]
    - [487, 4595.4]
  - - [2048, 1024, 1, 1152]
    - [395, 8942.65]
  - - [2048, 512, 1, 6144]
    - [488, 8729.71]
  - - [2048, 512, 1, 3200]
    - [489, 8696.56]
  - - [4096, 1024, 1, 2080]
    - [428, 9538.45]
  - - [4096, 1024, 1, 768]
    - [395, 9260.75]
  - - [4096, 1024, 1, 2560]
    - [395, 9567.27]
  - - [64, 200, 1, 2048]
    - [427, 583.161]
  - - [2048, 200, 1, 4608]
    - [498, 6243.28]
  - - [1024, 1024, 1, 6144]
    - [490, 8320.25]
  - - [4096, 256, 1, 1664]
    - [493, 8503.17]
  - - [2048, 200, 1, 384]
    - [498, 4940.0]
  - - [1, 200, 1, 2048]
    - [444, 11.3281]
  - - [4096, 256, 1, 1792]
    - [503, 8504.12]
  - - [2048, 1024, 1, 64]
    - [417, 5309.35]
  - - [4096, 1024, 1, 16384]
    - [384, 9428.61]
  - - [1024, 512, 1, 16640]
    - [498, 8122.55]
  - - [2048, 512, 1, 10240]
    - [488, 8766.21]
  - - [4096, 512, 1, 6656]
    - [395, 9351.75]
  - - [2048, 256, 1, 16640]
    - [487, 8135.27]
  - - [2048, 512, 1, 2816]
    - [489, 8660.32]
  - - [1024, 200, 1, 32]
    - [407, 780.291]
  - - [1, 512, 1, 4096]
    - [432, 34.8671]
  - - [256, 256, 1, 1024]
    - [439, 1490.08]
  - - [2048, 1024, 1, 128]
    - [412, 6605.3]
  - - [2048, 1024, 1, 2080]
    - [395, 9159.51]
  - - [2048, 1024, 1, 16640]
    - [395, 9371.65]
  - - [1024, 200, 1, 384]
    - [498, 3378.24]
  - - [4096, 256, 1, 384]
    - [443, 7369.3]
  - - [4096, 256, 1, 13312]
    - [497, 8776.48]
  - - [2048, 256, 1, 128]
    - [492, 4280.0]
  - - [512, 256, 1, 2304]
    - [404, 3584.98]
  - - [2048, 1024, 1, 3072]
    - [397, 9156.52]
  - - [1024, 1024, 1, 640]
    - [493, 7928.84]
  - - [256, 512, 1, 1024]
    - [498, 2843.7]
  - - [4096, 1024, 1, 1408]
    - [395, 9437.56]
  - - [4096, 200, 1, 5632]
    - [500, 6873.96]
  - - [4096, 1024, 1, 2048]
    - [395, 9437.1]
  - - [2048, 1024, 1, 2560]
    - [400, 9195.62]
  - - [4096, 1024, 1, 128]
    - [482, 7407.26]
  - - [1024, 200, 1, 3328]
    - [498, 4857.39]
  - - [2048, 200, 1, 1152]
    - [487, 5760.1]
  - - [1024, 200, 1, 9216]
    - [386, 5053.21]
  - - [4096, 256, 1, 512]
    - [480, 7617.45]
  - - [4096, 1024, 1, 14336]
    - [395, 9665.12]
  - - [1024, 1024, 1, 384]
    - [418, 7478.8]
  - - [2048, 200, 1, 512]
    - [487, 5150.28]
  - - [2048, 256, 1, 9216]
    - [466, 7717.71]
  - - [2048, 256, 1, 1792]
    - [487, 7655.94]
  - - [4096, 512, 1, 9216]
    - [397, 9331.22]
  - - [4096, 200, 1, 15360]
    - [387, 6958.14]
  - - [1024, 512, 1, 2048]
    - [486, 7067.91]
  - - [64, 256, 1, 2048]
    - [411, 723.256]
  - - [4096, 200, 1, 1792]
    - [489, 6699.65]
  - - [1, 200, 1, 4096]
    - [421, 15.6387]
  - - [2048, 1024, 1, 2048]
    - [400, 9071.93]
  - - [1024, 200, 1, 2080]
    - [479, 4679.19]
  - - [2048, 200, 1, 1536]
    - [498, 5939.92]
  - - [1024, 1024, 1, 3072]
    - [460, 8333.15]
  - - [512, 200, 1, 1792]
    - [385, 2679.73]
  - - [1024, 256, 1, 11264]
    - [388, 6470.98]
  - - [2048, 512, 1, 12288]
    - [435, 8729.24]
  - - [1024, 256, 1, 1792]
    - [498, 5931.44]
  - - [1024, 200, 1, 7168]
    - [498, 4970.33]
  - - [32, 256, 1, 1024]
    - [409, 237.334]
  - - [512, 256, 1, 3072]
    - [452, 3813.1]
  - - [1024, 1024, 1, 2080]
    - [489, 8600.41]
  - - [2048, 200, 1, 2304]
    - [498, 6093.32]
  - - [4096, 512, 1, 1536]
    - [395, 9075.0]
  - - [2048, 256, 1, 7168]
    - [498, 7895.26]
  - - [2048, 512, 1, 1792]
    - [500, 8531.92]
  - - [1024, 200, 1, 2048]
    - [487, 4685.43]
  - - [1024, 1024, 1, 4608]
    - [493, 8735.71]
  - - [4096, 256, 1, 8192]
    - [489, 8782.55]
  - - [512, 1024, 1, 1280]
    - [479, 7483.25]
  - - [2048, 1024, 1, 16384]
    - [389, 8878.96]
  - - [512, 512, 1, 1280]
    - [487, 5745.72]
  - - [1024, 200, 1, 1280]
    - [479, 4446.23]
  - - [4096, 512, 1, 4096]
    - [397, 9264.49]
  - - [2048, 256, 1, 3200]
    - [487, 7842.85]
  - - [2048, 512, 1, 15360]
    - [435, 8757.24]
  - - [1024, 512, 1, 3328]
    - [487, 7854.04]
  - - [1024, 512, 1, 4160]
    - [487, 7934.61]
  - - [4096, 200, 1, 6656]
    - [489, 6883.3]
  - - [4096, 1024, 1, 1024]
    - [395, 9229.44]
  - - [2048, 200, 1, 3328]
    - [498, 6182.74]
  - - [1024, 1024, 1, 256]
    - [418, 6932.83]
  - - [512, 200, 1, 512]
    - [439, 1910.77]
  - - [2048, 256, 1, 64]
    - [410, 2912.81]
  - - [1024, 256, 1, 2560]
    - [487, 6123.17]
  - - [2048, 512, 1, 11264]
    - [499, 8728.94]
  - - [32, 200, 1, 1024]
    - [494, 187.56]
  - - [32, 512, 1, 2048]
    - [438, 694.521]
  - - [2048, 256, 1, 2304]
    - [487, 7759.35]
  - - [2048, 256, 1, 12288]
    - [466, 7726.35]
  - - [4096, 200, 1, 8192]
    - [489, 6870.94]
  - - [1024, 512, 1, 7168]
    - [435, 7479.2]
  - - [1024, 512, 1, 1792]
    - [487, 7626.11]
  - - [4096, 1024, 1, 1664]
    - [395, 9503.54]
  - - [4096, 200, 1, 2816]
    - [482, 6775.44]
  - - [1024, 1024, 1, 896]
    - [489, 8229.99]
  - - [1024, 200, 1, 8320]
    - [450, 5173.58]
  - - [1024, 1024, 1, 12288]
    - [490, 8463.21]
  - - [1024, 256, 1, 8320]
    - [479, 6404.37]
  - - [1024, 200, 1, 1024]
    - [487, 4297.54]
  - - [1024, 200, 1, 16640]
    - [449, 5499.51]
  - - [4096, 256, 1, 5120]
    - [503, 8729.15]
  - - [1024, 256, 1, 3200]
    - [498, 6124.96]
  - - [512, 512, 1, 2560]
    - [498, 6109.79]
  - - [4096, 256, 1, 2048]
    - [503, 8511.05]
  - - [1024, 256, 1, 640]
    - [487, 5102.66]
  - - [2048, 256, 1, 5120]
    - [415, 7667.93]
  - - [2048, 256, 1, 7680]
    - [498, 8054.45]
  - - [4096, 512, 1, 384]
    - [493, 8190.77]
  - - [2048, 200, 1, 3584]
    - [487, 6166.12]
  - - [1024, 512, 1, 1536]
    - [487, 7517.9]
  - - [4096, 512, 1, 3328]
    - [395, 9259.45]
  - - [4096, 1024, 1, 256]
    - [395, 8341.79]
  - - [2048, 200, 1, 64]
    - [458, 2307.71]
  - - [2048, 200, 1, 4096]
    - [498, 6212.04]
  - - [1024, 1024, 1, 1536]
    - [489, 8484.15]
  - - [2048, 1024, 1, 7168]
    - [397, 9315.24]
  - - [1024, 256, 1, 3584]
    - [487, 6207.32]
  - - [4096, 256, 1, 32]
    - [491, 2892.72]
  - - [4096, 256, 1, 1280]
    - [500, 8392.9]
  - - [512, 512, 1, 3200]
    - [498, 6219.41]
  - - [2048, 1024, 1, 1536]
    - [397, 9052.55]
  - - [2048, 256, 1, 1024]
    - [487, 7192.9]
  - - [128, 200, 1, 512]
    - [477, 502.677]
  - - [4096, 512, 1, 7168]
    - [400, 9329.11]
  - - [1024, 512, 1, 1152]
    - [487, 7358.53]
  - - [64, 1024, 1, 2048]
    - [405, 2102.51]
  - - [2048, 512, 1, 3328]
    - [489, 8694.69]
  - - [4096, 1024, 1, 896]
    - [395, 9343.02]
  - - [1, 1024, 1, 2048]
    - [445, 40.9324]
  - - [4096, 200, 1, 3584]
    - [493, 6810.3]
  - - [4096, 1024, 1, 4096]
    - [395, 9347.56]
  - - [1024, 256, 1, 14336]
    - [388, 6625.8]
  - - [2048, 200, 1, 256]
    - [487, 4413.3]
  - - [4096, 256, 1, 16384]
    - [389, 8752.13]
  - - [4096, 256, 1, 1920]
    - [480, 8533.78]
  - - [32, 1024, 1, 512]
    - [478, 647.369]
  - - [1024, 256, 1, 7680]
    - [498, 6387.36]
  - - [2048, 256, 1, 1664]
    - [498, 7631.44]
  - - [512, 200, 1, 1536]
    - [403, 2576.88]
  - - [2048, 1024, 1, 6144]
    - [384, 9033.77]
  - - [512, 256, 1, 2816]
    - [450, 3977.46]
  - - [4096, 512, 1, 4160]
    - [397, 9289.02]
  - - [4096, 512, 1, 2080]
    - [476, 9150.28]
  - - [2048, 256, 1, 15360]
    - [461, 7963.97]
  - - [4096, 200, 1, 5120]
    - [500, 6861.62]
  - - [1024, 512, 1, 8192]
    - [486, 7473.25]
  - - [4096, 200, 1, 896]
    - [503, 6443.25]
  - - [2048, 512, 1, 8320]
    - [493, 8810.24]
  - - [1024, 1024, 1, 10240]
    - [501, 8436.7]
  - - [1024, 200, 1, 768]
    - [487, 4087.58]
  - - [2048, 200, 1, 640]
    - [498, 5416.3]
  - - [512, 200, 1, 2048]
    - [452, 2702.62]
  - - [1024, 1024, 1, 9216]
    - [490, 8499.08]
  - - [4096, 200, 1, 1408]
    - [500, 6613.82]
  - - [1024, 256, 1, 13312]
    - [388, 6643.54]
  - - [1024, 256, 1, 128]
    - [419, 2706.1]
  - - [2048, 200, 1, 5632]
    - [498, 6270.12]
  - - [64, 1024, 1, 512]
    - [477, 1310.82]
  - - [1024, 512, 1, 2560]
    - [498, 7731.54]
  - - [4096, 200, 1, 1280]
    - [480, 6566.83]
  - - [1024, 200, 1, 4096]
    - [498, 4911.46]
  - - [1024, 1024, 1, 2560]
    - [489, 8630.35]
  - - [2048, 512, 1, 64]
    - [493, 4152.88]
  - - [2048, 200, 1, 8192]
    - [487, 6234.21]
  - - [2048, 512, 1, 3072]
    - [497, 8614.85]
  - - [4096, 1024, 1, 5120]
    - [395, 9573.75]
  - - [4096, 256, 1, 640]
    - [482, 7913.88]
  - - [1024, 256, 1, 1280]
    - [487, 5706.64]
  - - [2048, 1024, 1, 1920]
    - [397, 9141.34]
  - - [2048, 256, 1, 4096]
    - [487, 7937.28]
  - - [2048, 1024, 1, 15360]
    - [400, 9351.96]
  - - [4096, 200, 1, 16384]
    - [389, 6975.21]
  - - [1, 1024, 1, 4096]
    - [507, 60.7815]
  - - [4096, 1024, 1, 2816]
    - [395, 9583.98]
  - - [4096, 200, 1, 1664]
    - [482, 6658.7]
  - - [4096, 512, 1, 256]
    - [413, 7731.54]
  - - [1024, 200, 1, 896]
    - [487, 4193.45]
  - - [2048, 200, 1, 6656]
    - [498, 6291.17]
  - - [2048, 1024, 1, 5120]
    - [397, 9270.57]
  - - [512, 1024, 1, 768]
    - [487, 7099.06]
  - - [2048, 512, 1, 14336]
    - [467, 8559.13]
  - - [2048, 200, 1, 8320]
    - [487, 6314.72]
  - - [4096, 256, 1, 3840]
    - [503, 8718.56]
  - - [2048, 1024, 1, 4096]
    - [384, 8973.38]
  - - [1024, 1024, 1, 3200]
    - [493, 8701.98]
  - - [1024, 256, 1, 4608]
    - [487, 6268.05]
  - - [4096, 512, 1, 4608]
    - [395, 9316.47]
  - - [2048, 512, 1, 2048]
    - [486, 8462.76]
  - - [4096, 512, 1, 1664]
    - [395, 9074.53]
  - - [4096, 256, 1, 4608]
    - [482, 8718.05]
  - - [1024, 512, 1, 32]
    - [475, 1807.99]
  - - [1024, 512, 1, 3840]
    - [487, 7936.34]
  - - [2048, 512, 1, 1920]
    - [503, 8548.27]
  - - [2048, 1024, 1, 896]
    - [395, 8843.51]
  - - [4096, 200, 1, 6144]
    - [503, 6864.76]
  - - [1024, 512, 1, 13312]
    - [456, 7763.19]
  - - [4096, 1024, 1, 4160]
    - [395, 9650.72]
  - - [2048, 200, 1, 2816]
    - [487, 6119.76]
  - - [1024, 1024, 1, 3840]
    - [482, 8709.5]
  - - [128, 1024, 1, 1024]
    - [505, 2577.25]
  - - [2048, 1024, 1, 11264]
    - [400, 9339.06]
  - - [2048, 1024, 1, 384]
    - [489, 8210.81]
  - - [1024, 256, 1, 2048]
    - [510, 5755.58]
  - - [2048, 1024, 1, 3840]
    - [397, 9288.96]
  - - [4096, 256, 1, 8320]
    - [503, 8812.38]
  - - [2048, 256, 1, 3840]
    - [479, 7857.05]
  - - [64, 256, 1, 512]
    - [477, 336.182]
  - - [4096, 512, 1, 1280]
    - [397, 8993.52]
  - - [512, 256, 1, 1280]
    - [429, 2996.03]
  - - [1024, 512, 1, 7680]
    - [487, 8041.59]
  - - [4096, 1024, 1, 1152]
    - [395, 9368.48]
  - - [256, 200, 1, 512]
    - [429, 993.07]
  - - [256, 1024, 1, 2048]
    - [506, 4759.59]
  - - [2048, 200, 1, 10240]
    - [498, 6329.03]
  - - [2048, 512, 1, 5120]
    - [499, 8732.56]
  - - [2048, 1024, 1, 1408]
    - [397, 9006.9]
  - - [512, 1024, 1, 512]
    - [487, 6528.2]
  - - [1024, 200, 1, 11264]
    - [454, 5194.82]
  - - [512, 1024, 1, 1024]
    - [440, 6337.1]
  - - [2048, 512, 1, 32]
    - [406, 2777.78]
  - - [4096, 256, 1, 2560]
    - [489, 8621.49]
  - - [4096, 256, 1, 64]
    - [423, 4194.4]
  - - [32, 1024, 1, 1024]
    - [424, 778.264]
  - - [2048, 200, 1, 768]
    - [498, 5507.33]
  - - [512, 512, 1, 2048]
    - [446, 5338.91]
  - - [2048, 512, 1, 2560]
    - [500, 8643.69]
  - - [512, 256, 1, 512]
    - [479, 2542.1]
  - - [1024, 200, 1, 7680]
    - [454, 5047.8]
  - - [4096, 512, 1, 896]
    - [395, 8856.85]
  - - [4096, 1024, 1, 3072]
    - [395, 9492.17]
  - - [4096, 200, 1, 13312]
    - [387, 6900.73]
  - - [2048, 512, 1, 7168]
    - [488, 8788.1]
  - - [2048, 1024, 1, 2816]
    - [400, 9229.88]
  - - [2048, 512, 1, 128]
    - [418, 5630.04]
  - - [1024, 256, 1, 8192]
    - [510, 6203.83]
  - - [4096, 1024, 1, 1792]
    - [395, 9510.42]
  - - [1024, 200, 1, 6656]
    - [479, 5002.85]
  - - [1024, 1024, 1, 1024]
    - [416, 8095.26]
  - - [4096, 200, 1, 2304]
    - [500, 6754.45]
  - - [4096, 512, 1, 1152]
    - [395, 8974.54]
  - - [512, 200, 1, 1024]
    - [477, 2233.01]
  - - [1024, 256, 1, 3840]
    - [498, 6244.72]
  - - [512, 512, 1, 768]
    - [487, 5331.84]
  - - [2048, 512, 1, 4096]
    - [497, 8621.76]
  - - [2048, 256, 1, 2560]
    - [487, 7770.93]
  - - [2048, 256, 1, 4160]
    - [498, 7923.08]
  - - [1024, 256, 1, 64]
    - [394, 1705.1]
  - - [4096, 512, 1, 7680]
    - [395, 9364.57]
  - - [1024, 512, 1, 1664]
    - [498, 7594.24]
  - - [2048, 512, 1, 2080]
    - [489, 8570.67]
  - - [2048, 512, 1, 3840]
    - [500, 8729.14]
  - - [4096, 1024, 1, 384]
    - [395, 8764.86]
  - - [4096, 200, 1, 3072]
    - [489, 6772.39]
  - - [1024, 512, 1, 14336]
    - [457, 7680.97]
  - - [1024, 200, 1, 1920]
    - [479, 4637.08]
  - - [1024, 1024, 1, 1664]
    - [493, 8506.49]
  - - [512, 1024, 1, 2304]
    - [487, 7775.33]
  - - [2048, 1024, 1, 1792]
    - [395, 9123.46]
  - - [32, 200, 1, 512]
    - [495, 125.744]
  - - [4096, 256, 1, 11264]
    - [500, 8822.31]
  - - [4096, 256, 1, 1408]
    - [500, 8419.32]
  - - [1024, 256, 1, 7168]
    - [487, 6377.54]
  - - [2048, 256, 1, 1152]
    - [498, 7401.81]
  - - [256, 256, 1, 512]
    - [477, 1314.93]
  - - [1024, 512, 1, 1280]
    - [487, 7410.53]
  - - [512, 512, 1, 1792]
    - [479, 5931.44]
  - - [2048, 200, 1, 12288]
    - [461, 6242.25]
  - - [2048, 200, 1, 1664]
    - [498, 5953.75]
  - - [4096, 200, 1, 4608]
    - [493, 6853.54]
  - - [512, 1024, 1, 2560]
    - [487, 7778.13]
  - - [4096, 200, 1, 384]
    - [480, 5765.73]
  - - [128, 512, 1, 512]
    - [477, 1302.68]
  - - [1024, 200, 1, 256]
    - [481, 2861.93]
  - - [256, 1024, 1, 1024]
    - [422, 4522.26]
  - - [2048, 200, 1, 128]
    - [487, 3310.0]
  - - [2048, 200, 1, 11264]
    - [468, 6168.2]
  - - [1024, 512, 1, 1920]
    - [498, 7649.29]
  - - [4096, 256, 1, 1536]
    - [493, 8427.33]
  - - [4096, 1024, 1, 3584]
    - [395, 9618.0]
  - - [2048, 256, 1, 256]
    - [487, 5464.99]
  - - [2048, 1024, 1, 768]
    - [395, 8726.87]
  - - [4096, 256, 1, 10240]
    - [489, 8790.89]
  - - [2048, 256, 1, 10240]
    - [469, 7665.31]
  - - [4096, 200, 1, 14336]
    - [503, 6916.18]
  - - [1024, 512, 1, 5120]
    - [441, 7420.36]
  - - [1024, 512, 1, 8320]
    - [498, 8061.31]
  - - [256, 200, 1, 2048]
    - [453, 1916.36]
  - - [1024, 200, 1, 640]
    - [481, 3873.39]
  - - [1024, 512, 1, 10240]
    - [486, 7526.9]
  - - [1024, 200, 1, 4160]
    - [498, 4928.19]
  - - [1024, 200, 1, 5632]
    - [479, 4978.66]
  - - [1024, 1024, 1, 2048]
    - [434, 7937.28]
  - - [1024, 256, 1, 6656]
    - [498, 6373.68]
  - - [2048, 1024, 1, 8320]
    - [395, 9333.15]
  - - [1024, 256, 1, 10240]
    - [487, 6407.29]
  - - [2048, 256, 1, 2080]
    - [487, 7714.58]
  - - [4096, 256, 1, 128]
    - [401, 5765.47]
  - - [1024, 256, 1, 768]
    - [492, 5210.42]
  - - [2048, 256, 1, 896]
    - [498, 7267.46]
  - - [64, 512, 1, 2048]
    - [464, 1296.64]
  - - [4096, 512, 1, 2048]
    - [397, 9121.25]
  - - [512, 256, 1, 2048]
    - [450, 3283.31]
  - - [4096, 256, 1, 16640]
    - [482, 8839.88]
  - - [4096, 512, 1, 2560]
    - [400, 9222.15]
  - - [1024, 512, 1, 15360]
    - [451, 7865.66]
  - - [4096, 1024, 1, 2304]
    - [395, 9558.26]
  - - [4096, 200, 1, 1152]
    - [500, 6531.93]
  - - [2048, 200, 1, 6144]
    - [498, 6277.75]
  - - [1024, 1024, 1, 7680]
    - [493, 8799.34]
  - - [2048, 200, 1, 1920]
    - [498, 6031.02]
  - - [32, 1024, 1, 2048]
    - [472, 1174.98]
  - - [1024, 200, 1, 3584]
    - [479, 4880.44]
  - - [4096, 256, 1, 2080]
    - [486, 8557.22]
  - - [1024, 1024, 1, 16384]
    - [387, 8618.65]
  - - [1024, 256, 1, 1408]
    - [498, 5803.54]
  - - [1024, 256, 1, 4096]
    - [508, 6037.78]
  - - [2048, 200, 1, 14336]
    - [498, 6364.48]
  - - [4096, 512, 1, 5120]
    - [397, 9302.05]
  - - [1024, 512, 1, 6144]
    - [433, 7469.09]
  - - [1024, 512, 1, 2304]
    - [498, 7759.35]
  - - [4096, 200, 1, 4160]
    - [482, 6843.22]
  - - [4096, 200, 1, 1536]
    - [493, 6628.27]
  - - [4096, 1024, 1, 6144]
    - [395, 9593.08]
- null
