library/src/blas3/Tensile/Logic/asm_full/vega20_Cijk_Ailk_Bljk_DB.yaml
- {MinimumRequiredVersion: 4.2.0}
- vega20
- gfx906
- [Device 66a0, Device 66a7]
    SolutionIndex: 0
    SolutionNameMin: Cijk_Ailk_Bljk_DB_MT064x064x08_NLCA01_PBC0_TT04_04_USFGRO00_WG16_16_01
    SolutionIndex: 1
    SolutionNameMin: Cijk_Ailk_Bljk_DB_MT064x064x04_NLCA01_PBC0_TT04_04_USFGRO00_WG16_16_01
    SolutionIndex: 2
    SolutionNameMin: Cijk_Ailk_Bljk_DB_MT096x032x08_NLCA03_PBC0_TT06_04_USFGRO00_WG16_08_01
    SolutionIndex: 3
    SolutionNameMin: Cijk_Ailk_Bljk_DB_MT064x064x08_NLCA01_PBC0_TT04_04_USFGRO00_WG16_16_01
    SolutionIndex: 4
    SolutionNameMin: Cijk_Ailk_Bljk_DB_MT064x032x08_NLCA01_PBC0_TT04_04_USFGRO00_WG16_08_01
- - - [2084, 2084, 1, 384]
    - [3, 3692.89]
  - - [12324, 12324, 1, 384]
    - [3, 4048.66]
  - - [54308, 54308, 1, 384]
    - [2, 3759.19]
  - - [30756, 30756, 1, 384]
    - [2, 3787.5]
  - - [23588, 23588, 1, 384]
    - [2, 3769.6]
  - - [62500, 62500, 1, 384]
    - [2, 3784.85]
  - - [59428, 59428, 1, 384]
    - [2, 3764.43]
  - - [27684, 27684, 1, 384]
    - [2, 3770.09]
  - - [51236, 51236, 1, 384]
    - [2, 3762.38]
  - - [21540, 21540, 1, 384]
    - [2, 3774.74]
  - - [4132, 4132, 1, 384]
    - [3, 3958.33]
  - - [40996, 40996, 1, 384]
    - [2, 3774.09]
  - - [55332, 55332, 1, 384]
    - [2, 3770.58]
  - - [56356, 56356, 1, 384]
    - [2, 3781.09]
  - - [11300, 11300, 1, 384]
    - [3, 4042.07]
  - - [32804, 32804, 1, 384]
    - [2, 3780.4]
  - - [58404, 58404, 1, 384]
    - [2, 3756.05]
  - - [6180, 6180, 1, 384]
    - [3, 4021.21]
  - - [34852, 34852, 1, 384]
    - [2, 3787.61]
  - - [52260, 52260, 1, 384]
    - [2, 3765.92]
  - - [28708, 28708, 1, 384]
    - [2, 3767.21]
  - - [43044, 43044, 1, 384]
    - [2, 3782.62]
  - - [45092, 45092, 1, 384]
    - [2, 3773.66]
  - - [46116, 46116, 1, 384]
    - [2, 3761.39]
  - - [1060, 1060, 1, 384]
    - [3, 3256.77]
  - - [8228, 8228, 1, 384]
    - [3, 4036.01]
  - - [7204, 7204, 1, 384]
    - [3, 4027.89]
  - - [44068, 44068, 1, 384]
    - [2, 3780.81]
  - - [19492, 19492, 1, 384]
    - [2, 3748.83]
  - - [20516, 20516, 1, 384]
    - [2, 3775.76]
  - - [38948, 38948, 1, 384]
    - [2, 3776.97]
  - - [37924, 37924, 1, 384]
    - [2, 3752.82]
  - - [57380, 57380, 1, 384]
    - [2, 3763.27]
  - - [14372, 14372, 1, 384]
    - [3, 4050.62]
  - - [36900, 36900, 1, 384]
    - [2, 3787.03]
  - - [48164, 48164, 1, 384]
    - [2, 3788.0]
  - - [26660, 26660, 1, 384]
    - [2, 3762.44]
  - - [24612, 24612, 1, 384]
    - [2, 3751.41]
  - - [17444, 17444, 1, 384]
    - [2, 3756.2]
  - - [25636, 25636, 1, 384]
    - [2, 3748.69]
  - - [61476, 61476, 1, 384]
    - [2, 3756.14]
  - - [3108, 3108, 1, 384]
    - [3, 3924.81]
  - - [22564, 22564, 1, 384]
    - [2, 3757.2]
  - - [29732, 29732, 1, 384]
    - [2, 3767.67]
  - - [36, 36, 1, 384]
    - [4, 14.741]
  - - [35876, 35876, 1, 384]
    - [2, 3773.05]
  - - [42020, 42020, 1, 384]
    - [2, 3765.3]
  - - [31780, 31780, 1, 384]
    - [2, 3760.72]
  - - [15396, 15396, 1, 384]
    - [3, 4054.24]
  - - [5156, 5156, 1, 384]
    - [3, 3980.26]
  - - [18468, 18468, 1, 384]
    - [2, 3765.29]
  - - [60452, 60452, 1, 384]
    - [2, 3790.08]
  - - [9252, 9252, 1, 384]
    - [3, 4035.55]
  - - [49188, 49188, 1, 384]
    - [2, 3777.84]
  - - [10276, 10276, 1, 384]
    - [3, 4040.45]
  - - [50212, 50212, 1, 384]
    - [2, 3770.06]
  - - [39972, 39972, 1, 384]
    - [2, 3788.04]
  - - [33828, 33828, 1, 384]
    - [2, 3768.45]
  - - [53284, 53284, 1, 384]
    - [2, 3746.0]
  - - [13348, 13348, 1, 384]
    - [3, 4049.53]
  - - [47140, 47140, 1, 384]
    - [2, 3742.91]
  - - [16420, 16420, 1, 384]
    - [2, 3759.47]
- - - -1
    - - - -1
        - - - 1
            - - [-1, 1]
          - - -1
            - - [1, 1]
              - [-1, 0]
