library/src/blas3/Tensile/Logic/asm_full/vega10_Cijk_Alik_Bljk_SB.yaml
- {MinimumRequiredVersion: 4.0.2}
- vega10
- gfx900
- [Device 6863, Device 6862, Device 687f, Device 6860]
- - - [4096, 7000, 1, 4096]
    - [31, 8076.38]
  - - [7680, 12000, 1, 2560]
    - [40, 9929.53]
  - - [5124, 9124, 1, 1760]
    - [45, 11123.9]
  - - [1760, 32, 1, 1760]
    - [8, 3007.01]
  - - [512, 24000, 1, 1536]
    - [39, 9696.89]
  - - [3072, 24000, 1, 1024]
    - [40, 9294.78]
  - - [2048, 400, 1, 512]
    - [29, 4194.16]
  - - [2560, 7000, 1, 2560]
    - [42, 9601.47]
  - - [3072, 16, 1, 1024]
    - [17, 689.102]
  - - [512, 48000, 1, 2816]
    - [45, 11093.2]
  - - [512, 48000, 1, 2048]
    - [31, 8006.87]
  - - [1760, 64, 1, 1760]
    - [15, 4770.47]
  - - [35, 8457, 1, 4096]
    - [5, 3328.61]
  - - [2048, 1600, 1, 2048]
    - [33, 5714.26]
  - - [512, 48000, 1, 1536]
    - [39, 10655.6]
  - - [2560, 32, 1, 2560]
    - [14, 2543.62]
  - - [8448, 5984, 1, 2816]
    - [39, 11307.5]
  - - [4096, 3200, 1, 1024]
    - [40, 7989.24]
  - - [1024, 24000, 1, 2560]
    - [42, 9488.11]
  - - [1760, 6400, 1, 1760]
    - [43, 11198.6]
  - - [1024, 700, 1, 512]
    - [34, 4376.62]
  - - [4608, 32, 1, 1536]
    - [25, 2582.38]
  - - [3072, 64, 1, 1024]
    - [19, 2293.51]
  - - [16384, 3200, 1, 4096]
    - [40, 6857.7]
  - - [2560, 16, 1, 2560]
    - [26, 1435.63]
  - - [1024, 48000, 1, 2560]
    - [39, 9410.52]
  - - [35, 8457, 1, 2560]
    - [6, 3409.75]
  - - [8448, 48000, 1, 2816]
    - [39, 11577.4]
  - - [2048, 32, 1, 2048]
    - [13, 1795.71]
  - - [2560, 3200, 1, 2560]
    - [40, 9003.5]
  - - [16384, 800, 1, 4096]
    - [31, 6815.99]
  - - [4608, 24000, 1, 1536]
    - [41, 10701.6]
  - - [7680, 48000, 1, 2560]
    - [39, 10799.1]
  - - [3072, 48000, 1, 1024]
    - [40, 9474.68]
  - - [1760, 16, 1, 1760]
    - [9, 1585.46]
  - - [8192, 3200, 1, 2048]
    - [40, 8175.42]
  - - [512, 24000, 1, 2816]
    - [39, 10998.2]
  - - [4096, 400, 1, 1024]
    - [47, 4513.44]
  - - [6144, 48000, 1, 2560]
    - [39, 10282.7]
  - - [4608, 48000, 1, 1536]
    - [41, 10853.7]
  - - [35, 8457, 1, 2048]
    - [3, 3034.26]
  - - [4096, 128, 1, 4096]
    - [21, 4592.85]
  - - [2048, 800, 1, 512]
    - [39, 5581.21]
  - - [4608, 5984, 1, 1536]
    - [41, 9915.56]
  - - [2560, 128, 1, 2560]
    - [24, 4794.34]
  - - [6144, 5984, 1, 2048]
    - [40, 8375.82]
  - - [35, 8457, 1, 1760]
    - [4, 3876.85]
  - - [7680, 24000, 1, 2560]
    - [39, 10131.8]
  - - [6144, 48000, 1, 2048]
    - [40, 9043.94]
  - - [5124, 9124, 1, 2560]
    - [40, 9686.47]
  - - [2048, 3200, 1, 2048]
    - [31, 6662.05]
  - - [2048, 16, 1, 2048]
    - [12, 960.695]
  - - [1024, 24000, 1, 1536]
    - [39, 9341.04]
  - - [7680, 16, 1, 2560]
    - [17, 1688.51]
  - - [2560, 6400, 1, 2560]
    - [42, 9688.11]
  - - [2048, 128, 1, 2048]
    - [10, 3023.58]
  - - [512, 16, 1, 500000]
    - [1, 2240.35]
  - - [1024, 8, 1, 500000]
    - [0, 1166.2]
  - - [512, 24000, 1, 2560]
    - [41, 9482.6]
  - - [1024, 24000, 1, 2816]
    - [39, 10989.8]
  - - [7680, 5984, 1, 2560]
    - [41, 10001.6]
  - - [2048, 1600, 1, 512]
    - [48, 5494.54]
  - - [2048, 7000, 1, 2048]
    - [29, 7163.75]
  - - [1760, 800, 1, 1760]
    - [27, 8847.66]
  - - [5124, 9124, 1, 4096]
    - [28, 8007.33]
  - - [4096, 64, 1, 4096]
    - [21, 3394.62]
  - - [7680, 32, 1, 2560]
    - [25, 3094.06]
  - - [2560, 64, 1, 2560]
    - [16, 3833.53]
  - - [3072, 128, 1, 1024]
    - [25, 2748.05]
  - - [7680, 64, 1, 2560]
    - [22, 4861.58]
  - - [1760, 128, 1, 1760]
    - [15, 5875.36]
  - - [2560, 1600, 1, 2560]
    - [37, 8045.98]
  - - [2048, 3200, 1, 512]
    - [41, 6730.61]
  - - [2560, 800, 1, 2560]
    - [44, 7322.97]
  - - [3072, 32, 1, 1024]
    - [13, 1617.76]
  - - [6144, 32, 1, 2560]
    - [25, 2871.75]
  - - [4608, 12000, 1, 1536]
    - [41, 10327.9]
  - - [4096, 32, 1, 4096]
    - [22, 2017.12]
  - - [6144, 24000, 1, 2048]
    - [40, 8569.71]
  - - [8192, 800, 1, 2048]
    - [28, 6378.06]
  - - [4096, 1600, 1, 1024]
    - [40, 6644.22]
  - - [5124, 9124, 1, 2048]
    - [40, 7954.28]
  - - [8448, 24000, 1, 2816]
    - [39, 11559.9]
  - - [1024, 48000, 1, 1536]
    - [39, 10215.1]
  - - [7680, 128, 1, 2560]
    - [20, 5970.6]
  - - [8192, 1600, 1, 2048]
    - [40, 7296.11]
  - - [4096, 800, 1, 1024]
    - [47, 5423.49]
  - - [1024, 16, 1, 500000]
    - [2, 2304.84]
  - - [2048, 800, 1, 2048]
    - [33, 4900.15]
  - - [1760, 3200, 1, 1760]
    - [27, 10705.8]
  - - [512, 48000, 1, 2560]
    - [42, 9659.8]
  - - [8448, 16, 1, 2816]
    - [26, 1881.5]
  - - [2048, 64, 1, 2048]
    - [13, 2492.27]
  - - [512, 24000, 1, 2048]
    - [31, 7760.05]
  - - [16384, 1600, 1, 4096]
    - [31, 7076.09]
  - - [4608, 16, 1, 1536]
    - [13, 1356.5]
  - - [1024, 24000, 1, 2048]
    - [31, 7853.97]
  - - [8192, 400, 1, 2048]
    - [46, 5519.98]
  - - [2048, 6400, 1, 2048]
    - [29, 7255.21]
  - - [6144, 12000, 1, 2048]
    - [40, 8413.15]
  - - [512, 8, 1, 500000]
    - [0, 1155.04]
  - - [1760, 7000, 1, 1760]
    - [27, 10690.4]
  - - [1024, 48000, 1, 2816]
    - [39, 11357.8]
  - - [6144, 16, 1, 2560]
    - [7, 1641.2]
  - - [8448, 32, 1, 2816]
    - [8, 3461.35]
  - - [4096, 16, 1, 4096]
    - [22, 1093.14]
  - - [6144, 24000, 1, 2560]
    - [40, 9818.87]
  - - [1024, 1024, 1, 1024]
    - [40, 4401.77]
  - - [8448, 12000, 1, 2816]
    - [39, 11478.3]
  - - [16384, 400, 1, 4096]
    - [28, 5574.07]
  - - [1760, 1600, 1, 1760]
    - [43, 9642.02]
  - - [1024, 48000, 1, 2048]
    - [31, 7902.06]
- - - -1
    - - - -1
        - - - 4
            - - [1024, 18]
              - [1408, 12]
              - [4288, 18]
              - [-1, 12]
          - - 64
            - - [128, 18]
              - [256, 19]
              - [448, 8]
              - [1024, 24]
              - [1408, 15]
              - [1856, 23]
              - [2368, 14]
              - [5888, 23]
              - [-1, 36]
          - - 128
            - - [64, 18]
              - [128, 19]
              - [256, 8]
              - [704, 24]
              - [1408, 23]
              - [1856, 11]
              - [2368, 23]
              - [2944, 11]
              - [3584, 36]
              - [4288, 23]
              - [5056, 11]
              - [5888, 36]
              - [-1, 34]
          - - 256
            - - [4, 18]
              - [64, 19]
              - [128, 17]
              - [256, 7]
              - [448, 23]
              - [704, 32]
              - [2944, 36]
              - [3584, 30]
              - [5056, 36]
              - [5888, 35]
              - [-1, 36]
          - - 448
            - - [4, 18]
              - [64, 16]
              - [448, 24]
              - [704, 32]
              - [1024, 36]
              - [1408, 32]
              - [1856, 27]
              - [2368, 32]
              - [2944, 27]
              - [3584, 32]
              - [4288, 34]
              - [5056, 27]
              - [5888, 45]
              - [-1, 34]
          - - 704
            - - [4, 18]
              - [64, 24]
              - [128, 14]
              - [256, 36]
              - [448, 32]
              - [704, 36]
              - [1024, 32]
              - [1408, 34]
              - [1856, 36]
              - [2368, 32]
              - [2944, 29]
              - [5888, 34]
              - [-1, 43]
          - - 1024
            - - [4, 18]
              - [64, 8]
              - [128, 11]
              - [256, 32]
              - [704, 36]
              - [1408, 27]
              - [1856, 43]
              - [2368, 27]
              - [2944, 45]
              - [3584, 27]
              - [4288, 38]
              - [5888, 43]
              - [-1, 45]
          - - 1408
            - - [4, 12]
              - [64, 14]
              - [128, 23]
              - [256, 36]
              - [448, 32]
              - [704, 37]
              - [1024, 35]
              - [1408, 43]
              - [1856, 37]
              - [2368, 35]
              - [2944, 45]
              - [-1, 43]
          - - 1856
            - - [4, 12]
              - [64, 14]
              - [128, 11]
              - [256, 36]
              - [448, 27]
              - [704, 32]
              - [1024, 45]
              - [1856, 35]
              - [2944, 27]
              - [3584, 45]
              - [4288, 43]
              - [5056, 27]
              - [-1, 45]
          - - 2368
            - - [4, 18]
              - [128, 24]
              - [704, 32]
              - [1408, 35]
              - [1856, 37]
              - [2368, 45]
              - [2944, 43]
              - [-1, 45]
          - - 2944
            - - [4, 18]
              - [64, 23]
              - [128, 11]
              - [256, 36]
              - [448, 35]
              - [704, 27]
              - [1408, 45]
              - [1856, 27]
              - [2368, 45]
              - [2944, 43]
              - [3584, 27]
              - [4288, 45]
              - [5056, 27]
              - [5888, 45]
              - [-1, 27]
          - - 3584
            - - [4, 12]
              - [64, 11]
              - [128, 36]
              - [256, 37]
              - [448, 32]
              - [704, 27]
              - [1024, 35]
              - [1408, 43]
              - [-1, 45]
          - - 4288
            - - [4, 18]
              - [64, 24]
              - [128, 15]
              - [256, 32]
              - [448, 37]
              - [704, 27]
              - [1024, 35]
              - [1408, 43]
              - [1856, 45]
              - [2368, 35]
              - [-1, 45]
          - - 5056
            - - [4, 12]
              - [64, 23]
              - [128, 11]
              - [256, 32]
              - [448, 35]
              - [704, 27]
              - [1408, 45]
              - [1856, 35]
              - [2368, 45]
              - [2944, 30]
              - [-1, 45]
          - - 5888
            - - [4, 12]
              - [64, 23]
              - [128, 32]
              - [256, 35]
              - [448, 43]
              - [704, 27]
              - [1024, 43]
              - [-1, 45]
          - - -1
            - - [4, 12]
              - [64, 36]
              - [128, 27]
              - [256, 32]
              - [448, 37]
              - [1024, 45]
              - [1408, 35]
              - [1856, 30]
              - [2368, 45]
              - [3584, 30]
              - [5056, 45]
              - [5888, 43]
              - [-1, 45]
