library/src/blas3/Tensile/Logic/asm_full/vega10_Cijk_Ailk_Bjlk_HB.yaml
- {MinimumRequiredVersion: 4.3.0}
- vega10
- gfx900
- [Device 6863, Device 6862, Device 687f, Device 6860, Device 6861, 'Vega 10 XTX [Radeon
    SolutionIndex: 0
    SolutionNameMin: Cijk_Ailk_Bjlk_HB_MT032x016x16_PGR1_PLR1_TT02_02
    SolutionIndex: 1
    SolutionNameMin: Cijk_Ailk_Bjlk_HB_MT064x064x08_PGR1_PLR1_TT08_08
    SolutionIndex: 2
    SolutionNameMin: Cijk_Ailk_Bjlk_HB_MT032x008x16_PGR1_PLR1_TT02_02
    SolutionIndex: 3
    SolutionNameMin: Cijk_Ailk_Bjlk_HB_MT032x016x64_PGR1_PLR1_TT02_02
    SolutionIndex: 4
    SolutionNameMin: Cijk_Ailk_Bjlk_HB_MT064x128x16_PGR1_PLR1_TT04_08
    SolutionIndex: 5
    SolutionNameMin: Cijk_Ailk_Bjlk_HB_MT128x064x16_PGR1_PLR1_TT08_04
    SolutionIndex: 6
    SolutionNameMin: Cijk_Ailk_Bjlk_HB_MT064x064x16_PGR1_PLR1_TT04_04
    SolutionIndex: 7
    SolutionNameMin: Cijk_Ailk_Bjlk_HB_MT128x128x16_PGR1_PLR1_TT08_08
    SolutionIndex: 8
    SolutionNameMin: Cijk_Ailk_Bjlk_HB_MT064x064x16_PGR1_PLR1_TT04_04
    SolutionIndex: 9
    SolutionNameMin: Cijk_Ailk_Bjlk_HB_MT064x064x08_PGR0_PLR1_TT04_04
    SolutionIndex: 10
    SolutionNameMin: Cijk_Ailk_Bjlk_HB_MT064x064x16_PGR1_PLR1_TT04_04
    SolutionIndex: 11
    SolutionNameMin: Cijk_Ailk_Bjlk_HB_MT064x064x04_PGR0_PLR0_TT04_04
- - - [4096, 7133, 1, 4096]
    - [7, 22330.5]
  - - [512, 16, 1, 512]
    - [0, 355.31]
  - - [2048, 7133, 1, 2048]
    - [7, 21872.7]
  - - [2560, 7133, 1, 2560]
    - [4, 21562.3]
  - - [1024, 1024, 1, 1024]
    - [6, 16501.6]
  - - [3072, 7435, 1, 1024]
    - [1, 21603.5]
  - - [1024, 32, 1, 512]
    - [0, 1562.4]
  - - [1760, 7133, 1, 1760]
    - [5, 20701.7]
  - - [7680, 5481, 1, 2560]
    - [4, 22031.7]
  - - [1024, 16, 1, 512]
    - [2, 689.834]
  - - [512, 32, 1, 512]
    - [3, 819.174]
- - - -1
    - - - 1
        - - - 32
            - - [-1, 11]
          - - 64
            - - [32, 11]
              - [64, 10]
              - [128, 11]
              - [448, 10]
              - [-1, 11]
          - - 128
            - - [-1, 11]
          - - 256
            - - [1408, 11]
              - [1856, 10]
              - [-1, 11]
          - - -1
            - - [-1, 11]
      - - 32
        - - - 32
            - - [128, 9]
              - [256, 8]
              - [2944, 9]
              - [3584, 8]
              - [-1, 9]
          - - 64
            - - [128, 9]
              - [3584, 8]
              - [-1, 9]
          - - 128
            - - [64, 9]
              - [704, 8]
              - [1024, 9]
              - [2944, 8]
              - [-1, 9]
          - - 256
            - - [64, 9]
              - [128, 8]
              - [448, 9]
              - [1856, 8]
              - [-1, 9]
          - - 448
            - - [64, 9]
              - [256, 8]
              - [448, 9]
              - [704, 8]
              - [-1, 9]
          - - 704
            - - [64, 9]
              - [704, 8]
              - [-1, 9]
          - - 1024
            - - [128, 9]
              - [448, 8]
              - [-1, 9]
          - - 1408
            - - [64, 9]
              - [128, 8]
              - [256, 9]
              - [448, 8]
              - [-1, 9]
          - - 2944
            - - [64, 9]
              - [256, 8]
              - [-1, 9]
          - - 3584
            - - [64, 9]
              - [128, 8]
              - [-1, 9]
          - - -1
            - - [-1, 9]
      - - 256
        - - - 1
            - - [-1, 10]
          - - 32
            - - [-1, 8]
          - - 64
            - - [1, 10]
              - [32, 8]
              - [64, 2]
              - [256, 0]
              - [1408, 2]
              - [2368, 0]
              - [2944, 2]
              - [4288, 0]
              - [-1, 6]
          - - 128
            - - [1, 10]
              - [32, 8]
              - [64, 2]
              - [1856, 0]
              - [-1, 6]
          - - 256
            - - [1, 10]
              - [32, 8]
              - [64, 2]
              - [448, 0]
              - [-1, 6]
          - - 448
            - - [1, 10]
              - [32, 8]
              - [448, 0]
              - [5888, 6]
              - [-1, 4]
          - - 704
            - - [1, 10]
              - [32, 8]
              - [64, 0]
              - [128, 2]
              - [2368, 6]
              - [3584, 4]
              - [4288, 6]
              - [5056, 4]
              - [-1, 1]
          - - 1024
            - - [1, 10]
              - [32, 8]
              - [128, 0]
              - [1856, 6]
              - [3584, 5]
              - [4288, 6]
              - [5888, 1]
              - [-1, 7]
          - - 1408
            - - [1, 10]
              - [32, 8]
              - [128, 0]
              - [1024, 6]
              - [1408, 4]
              - [2368, 6]
              - [3584, 7]
              - [5888, 1]
              - [-1, 4]
          - - 1856
            - - [1, 10]
              - [32, 8]
              - [64, 2]
              - [128, 0]
              - [704, 6]
              - [1408, 4]
              - [1856, 5]
              - [2944, 6]
              - [3584, 4]
              - [-1, 1]
          - - 2368
            - - [1, 10]
              - [32, 8]
              - [64, 0]
              - [704, 6]
              - [1024, 4]
              - [1856, 6]
              - [2368, 4]
              - [2944, 1]
              - [3584, 4]
              - [-1, 1]
          - - 2944
            - - [1, 10]
              - [32, 8]
              - [64, 0]
              - [448, 6]
              - [1024, 5]
              - [1408, 1]
              - [1856, 6]
              - [2368, 1]
              - [2944, 5]
              - [3584, 7]
              - [5056, 1]
              - [-1, 7]
          - - 3584
            - - [1, 10]
              - [32, 8]
              - [448, 6]
              - [1024, 5]
              - [1408, 7]
              - [2944, 5]
              - [3584, 7]
              - [5056, 1]
              - [-1, 7]
          - - 4288
            - - [1, 10]
              - [32, 8]
              - [448, 6]
              - [704, 1]
              - [1024, 6]
              - [-1, 1]
          - - 5056
            - - [1, 10]
              - [32, 8]
              - [448, 6]
              - [704, 5]
              - [-1, 1]
          - - 5888
            - - [1, 10]
              - [32, 8]
              - [448, 6]
              - [704, 1]
              - [1408, 7]
              - [1856, 5]
              - [2368, 1]
              - [3584, 7]
              - [5056, 1]
              - [-1, 7]
          - - -1
            - - [1, 10]
              - [32, 8]
              - [256, 6]
              - [448, 5]
              - [704, 1]
              - [1024, 7]
              - [1408, 5]
              - [2944, 1]
              - [3584, 7]
              - [5056, 1]
              - [-1, 7]
      - - 1280
        - - - 1
            - - [-1, 10]
          - - 32
            - - [-1, 8]
          - - 64
            - - [1, 10]
              - [32, 8]
              - [64, 2]
              - [128, 3]
              - [2368, 0]
              - [-1, 6]
          - - 128
            - - [1, 10]
              - [32, 8]
              - [128, 3]
              - [1024, 0]
              - [5888, 6]
              - [-1, 4]
          - - 256
            - - [1, 10]
              - [32, 8]
              - [64, 3]
              - [128, 0]
              - [256, 2]
              - [448, 0]
              - [5056, 6]
              - [5888, 4]
              - [-1, 6]
          - - 448
            - - [1, 10]
              - [32, 8]
              - [256, 0]
              - [2368, 6]
              - [2944, 4]
              - [3584, 6]
              - [4288, 4]
              - [5888, 6]
              - [-1, 4]
          - - 704
            - - [1, 10]
              - [32, 8]
              - [64, 0]
              - [128, 3]
              - [2368, 6]
              - [3584, 4]
              - [4288, 1]
              - [5056, 4]
              - [-1, 1]
          - - 1024
            - - [1, 10]
              - [32, 8]
              - [128, 0]
              - [1024, 6]
              - [2368, 5]
              - [2944, 7]
              - [3584, 5]
              - [4288, 6]
              - [-1, 7]
          - - 1408
            - - [1, 10]
              - [32, 8]
              - [64, 0]
              - [704, 6]
              - [1408, 4]
              - [1856, 5]
              - [2368, 6]
              - [5888, 7]
              - [-1, 4]
          - - 1856
            - - [1, 10]
              - [32, 8]
              - [64, 0]
              - [704, 6]
              - [1856, 4]
              - [2368, 6]
              - [3584, 4]
              - [4288, 7]
              - [5056, 1]
              - [5888, 4]
              - [-1, 5]
          - - 2368
            - - [1, 10]
              - [32, 8]
              - [64, 0]
              - [704, 6]
              - [1024, 4]
              - [1856, 6]
              - [2368, 5]
              - [2944, 7]
              - [3584, 4]
              - [4288, 1]
              - [5056, 7]
              - [-1, 4]
          - - 2944
            - - [1, 10]
              - [32, 8]
              - [256, 6]
              - [704, 5]
              - [1408, 7]
              - [1856, 5]
              - [2368, 7]
              - [2944, 4]
              - [3584, 5]
              - [5056, 4]
              - [5888, 1]
              - [-1, 5]
          - - 3584
            - - [1, 10]
              - [32, 8]
              - [448, 6]
              - [704, 5]
              - [1024, 4]
              - [1408, 7]
              - [2944, 5]
              - [3584, 4]
              - [4288, 7]
              - [5888, 5]
              - [-1, 7]
          - - 4288
            - - [1, 10]
              - [32, 8]
              - [256, 6]
              - [1024, 5]
              - [1856, 7]
              - [2368, 1]
              - [2944, 4]
              - [3584, 7]
              - [5056, 1]
              - [5888, 5]
              - [-1, 1]
          - - 5056
            - - [1, 10]
              - [32, 8]
              - [448, 6]
              - [704, 5]
              - [1408, 7]
              - [1856, 1]
              - [2368, 7]
              - [3584, 4]
              - [4288, 1]
              - [5888, 7]
              - [-1, 1]
          - - 5888
            - - [1, 10]
              - [32, 8]
              - [128, 6]
              - [256, 4]
              - [448, 6]
              - [704, 1]
              - [1408, 7]
              - [2368, 5]
              - [2944, 7]
              - [4288, 5]
              - [-1, 7]
          - - -1
            - - [1, 10]
              - [32, 8]
              - [256, 6]
              - [448, 5]
              - [704, 1]
              - [1024, 7]
              - [1408, 4]
              - [2368, 5]
              - [2944, 4]
              - [3584, 7]
              - [5056, 1]
              - [-1, 7]
      - - -1
        - - - 1
            - - [-1, 10]
          - - 32
            - - [-1, 8]
          - - 64
            - - [1, 10]
              - [32, 8]
              - [1856, 3]
              - [2368, 0]
              - [-1, 6]
          - - 128
            - - [1, 10]
              - [32, 8]
              - [128, 3]
              - [256, 0]
              - [704, 3]
              - [1024, 0]
              - [5888, 6]
              - [-1, 5]
          - - 256
            - - [1, 10]
              - [32, 8]
              - [128, 0]
              - [448, 3]
              - [2944, 6]
              - [3584, 4]
              - [5056, 6]
              - [5888, 5]
              - [-1, 6]
          - - 448
            - - [1, 10]
              - [32, 8]
              - [128, 3]
              - [256, 0]
              - [1408, 6]
              - [1856, 4]
              - [2368, 6]
              - [2944, 4]
              - [3584, 6]
              - [4288, 4]
              - [5888, 6]
              - [-1, 4]
          - - 704
            - - [1, 10]
              - [32, 8]
              - [128, 3]
              - [1024, 6]
              - [1408, 4]
              - [2368, 6]
              - [5888, 4]
              - [-1, 7]
          - - 1024
            - - [1, 10]
              - [32, 8]
              - [128, 3]
              - [704, 6]
              - [1408, 4]
              - [2368, 5]
              - [2944, 7]
              - [3584, 4]
              - [4288, 6]
              - [-1, 7]
          - - 1408
            - - [1, 10]
              - [32, 8]
              - [64, 3]
              - [448, 6]
              - [1856, 5]
              - [2368, 6]
              - [5888, 7]
              - [-1, 5]
          - - 1856
            - - [1, 10]
              - [32, 8]
              - [64, 3]
              - [704, 6]
              - [1408, 4]
              - [1856, 5]
              - [2368, 6]
              - [3584, 4]
              - [4288, 7]
              - [5056, 1]
              - [5888, 4]
              - [-1, 5]
          - - 2368
            - - [1, 10]
              - [32, 8]
              - [64, 0]
              - [704, 6]
              - [1024, 4]
              - [1856, 6]
              - [2368, 4]
              - [2944, 7]
              - [3584, 4]
              - [4288, 1]
              - [5056, 7]
              - [-1, 4]
          - - 2944
            - - [1, 10]
              - [32, 8]
              - [256, 6]
              - [704, 5]
              - [1408, 7]
              - [1856, 6]
              - [2368, 7]
              - [3584, 4]
              - [5056, 5]
              - [-1, 7]
          - - 3584
            - - [1, 10]
              - [32, 8]
              - [128, 6]
              - [256, 4]
              - [448, 6]
              - [1024, 5]
              - [1408, 7]
              - [1856, 5]
              - [2368, 4]
              - [3584, 5]
              - [4288, 7]
              - [5056, 5]
              - [-1, 4]
          - - 4288
            - - [1, 10]
              - [32, 8]
              - [256, 6]
              - [704, 5]
              - [1024, 4]
              - [1856, 7]
              - [2368, 1]
              - [2944, 5]
              - [3584, 7]
              - [5056, 1]
              - [5888, 5]
              - [-1, 1]
          - - 5056
            - - [1, 10]
              - [32, 8]
              - [448, 6]
              - [704, 5]
              - [1408, 7]
              - [1856, 1]
              - [2368, 7]
              - [3584, 4]
              - [4288, 1]
              - [5888, 7]
              - [-1, 4]
          - - 5888
            - - [1, 10]
              - [32, 8]
              - [128, 6]
              - [256, 5]
              - [448, 6]
              - [704, 5]
              - [1408, 7]
              - [2368, 5]
              - [2944, 7]
              - [3584, 5]
              - [4288, 4]
              - [-1, 7]
          - - -1
            - - [1, 10]
              - [32, 8]
              - [64, 6]
              - [128, 5]
              - [256, 6]
              - [448, 5]
              - [1024, 7]
              - [1408, 4]
              - [2368, 5]
              - [3584, 4]
              - [5056, 1]
              - [-1, 7]
