library/src/blas3/Tensile/Logic/asm_full/vega10_Cijk_Ailk_Bljk_SB.yaml
- {MinimumRequiredVersion: 3.6.0}
- vega10
- gfx900
- [Device 6863, Device 6862]
- - - [4096, 7000, 1, 4096]
    - [62, 10131.3]
  - - [5124, 9124, 1, 1760]
    - [64, 10454.8]
  - - [5124, 9124, 1, 2560]
    - [62, 10310.5]
  - - [1760, 32, 1, 1760]
    - [46, 2830.68]
  - - [1024, 1500, 1, 1536]
    - [60, 8608.78]
  - - [512, 24000, 1, 1536]
    - [57, 9732.73]
  - - [3072, 24000, 1, 1024]
    - [61, 9621.12]
  - - [1024, 3000, 1, 2560]
    - [60, 9465.14]
  - - [512, 3136, 1, 2048]
    - [68, 6911.96]
  - - [7680, 4, 1, 2560]
    - [20, 570.386]
  - - [35, 1500, 1, 2048]
    - [15, 1864.88]
  - - [8448, 1500, 1, 2816]
    - [58, 10093.3]
  - - [2560, 7000, 1, 2560]
    - [60, 10211.3]
  - - [3072, 16, 1, 1024]
    - [30, 1602.41]
  - - [512, 48000, 1, 2048]
    - [59, 9797.64]
  - - [1760, 64, 1, 1760]
    - [34, 4662.85]
  - - [1024, 16, 1, 512]
    - [37, 644.452]
  - - [512, 48000, 1, 1536]
    - [57, 9910.97]
  - - [2560, 32, 1, 2560]
    - [24, 3524.95]
  - - [4608, 1500, 1, 1536]
    - [60, 9574.89]
  - - [2048, 128, 1, 2048]
    - [35, 5284.88]
  - - [1024, 24000, 1, 2560]
    - [62, 10326.1]
  - - [4608, 3000, 1, 1536]
    - [60, 9746.19]
  - - [5124, 9124, 1, 2048]
    - [62, 9705.43]
  - - [1024, 700, 1, 512]
    - [55, 5250.83]
  - - [3072, 1, 1, 128]
    - [27, 34.9588]
  - - [5124, 700, 1, 2560]
    - [55, 9258.67]
  - - [8448, 16, 1, 2816]
    - [39, 2194.34]
  - - [6144, 6000, 1, 2560]
    - [62, 10378.1]
  - - [4608, 32, 1, 1536]
    - [47, 3409.62]
  - - [35, 8457, 1, 2560]
    - [9, 3526.94]
  - - [3072, 64, 1, 1024]
    - [31, 3544.09]
  - - [512, 16, 1, 512]
    - [17, 368.266]
  - - [7680, 2, 1, 2560]
    - [20, 286.663]
  - - [4224, 1, 1, 128]
    - [26, 41.9929]
  - - [7680, 1, 1, 2560]
    - [20, 143.777]
  - - [128, 1500, 1, 1280]
    - [51, 4688.25]
  - - [35, 8457, 1, 4096]
    - [13, 3155.03]
  - - [1024, 1500, 1, 2816]
    - [60, 9168.16]
  - - [6144, 2, 1, 2560]
    - [26, 275.681]
  - - [8448, 48000, 1, 2816]
    - [62, 11070.5]
  - - [512, 6000, 1, 1536]
    - [59, 8972.4]
  - - [4224, 1500, 1, 176]
    - [55, 6974.9]
  - - [1024, 6000, 1, 2816]
    - [63, 9974.7]
  - - [512, 6000, 1, 2560]
    - [59, 9522.7]
  - - [512, 32, 1, 512]
    - [20, 693.446]
  - - [2560, 128, 1, 2560]
    - [50, 6606.09]
  - - [4608, 24000, 1, 1536]
    - [65, 10215.6]
  - - [512, 2, 1, 500000]
    - [1, 322.111]
  - - [7680, 48000, 1, 2560]
    - [62, 10963.6]
  - - [3072, 48000, 1, 1024]
    - [65, 9661.4]
  - - [1760, 16, 1, 1760]
    - [21, 1614.26]
  - - [512, 3000, 1, 2816]
    - [60, 9143.48]
  - - [1760, 7000, 1, 1760]
    - [60, 10247.0]
  - - [64, 193600, 1, 256]
    - [70, 5613.13]
  - - [1024, 3000, 1, 2048]
    - [59, 8957.94]
  - - [6144, 4, 1, 2560]
    - [53, 547.289]
  - - [1024, 6000, 1, 2048]
    - [61, 9393.16]
  - - [512, 24000, 1, 2816]
    - [63, 10330.1]
  - - [6144, 48000, 1, 2560]
    - [62, 10735.4]
  - - [8448, 3000, 1, 2816]
    - [63, 10453.2]
  - - [35, 1500, 1, 2560]
    - [11, 2392.75]
  - - [3072, 4, 1, 1024]
    - [29, 413.645]
  - - [4608, 48000, 1, 1536]
    - [62, 10366.1]
  - - [2048, 32, 1, 2048]
    - [38, 2905.44]
  - - [7680, 1500, 1, 2560]
    - [60, 10081.2]
  - - [4096, 128, 1, 4096]
    - [31, 7587.17]
  - - [4608, 16, 1, 1536]
    - [39, 1935.69]
  - - [1024, 1500, 1, 2048]
    - [60, 8294.58]
  - - [3072, 3000, 1, 1024]
    - [61, 8972.4]
  - - [3072, 2, 1, 1024]
    - [20, 210.248]
  - - [8448, 1, 1, 2816]
    - [38, 144.887]
  - - [1024, 48000, 1, 2560]
    - [62, 10649.4]
  - - [1024, 3000, 1, 2816]
    - [60, 9600.76]
  - - [128, 1, 1, 1408]
    - [40, 15.4401]
  - - [35, 8457, 1, 1760]
    - [10, 4079.79]
  - - [1024, 2, 1, 512]
    - [43, 88.2306]
  - - [1024, 4, 1, 500000]
    - [4, 641.807]
  - - [6144, 1, 1, 2560]
    - [25, 138.097]
  - - [1024, 48000, 1, 2816]
    - [63, 10730.7]
  - - [512, 48000, 1, 2816]
    - [62, 10499.9]
  - - [2048, 16, 1, 2048]
    - [32, 1806.92]
  - - [1024, 24000, 1, 1536]
    - [61, 9806.78]
  - - [64, 193600, 1, 64]
    - [69, 3092.26]
  - - [7680, 6000, 1, 2560]
    - [62, 10616.5]
  - - [1760, 128, 1, 1760]
    - [45, 5850.43]
  - - [35, 8457, 1, 2048]
    - [16, 3013.03]
  - - [512, 1500, 1, 2816]
    - [55, 8364.23]
  - - [512, 1, 1, 512]
    - [43, 23.3059]
  - - [512, 16, 1, 500000]
    - [1, 2429.81]
  - - [512, 8, 1, 500000]
    - [1, 1251.24]
  - - [512, 24000, 1, 2560]
    - [62, 10209.7]
  - - [6144, 3000, 1, 2560]
    - [62, 10184.1]
  - - [1024, 24000, 1, 2816]
    - [62, 10459.9]
  - - [2048, 7000, 1, 2048]
    - [65, 9601.33]
  - - [7680, 3000, 1, 2560]
    - [62, 10242.0]
  - - [1024, 4, 1, 512]
    - [22, 166.544]
  - - [5124, 700, 1, 2048]
    - [58, 8285.15]
  - - [5124, 9124, 1, 4096]
    - [62, 9792.33]
  - - [4096, 64, 1, 4096]
    - [36, 6228.2]
  - - [512, 6000, 1, 2048]
    - [59, 7744.2]
  - - [7680, 32, 1, 2560]
    - [34, 4257.27]
  - - [2560, 64, 1, 2560]
    - [50, 5375.3]
  - - [3072, 128, 1, 1024]
    - [55, 4807.27]
  - - [8448, 6000, 1, 2816]
    - [62, 10777.3]
  - - [7680, 64, 1, 2560]
    - [31, 6402.76]
  - - [5124, 1500, 1, 2560]
    - [62, 9483.67]
  - - [1024, 1500, 1, 2560]
    - [60, 9035.11]
  - - [512, 4, 1, 512]
    - [43, 95.0143]
  - - [1024, 6000, 1, 2560]
    - [60, 9820.06]
  - - [3072, 32, 1, 1024]
    - [47, 2582.48]
  - - [35, 700, 1, 2560]
    - [14, 1824.27]
  - - [512, 50176, 1, 128]
    - [73, 7066.43]
  - - [4608, 1, 1, 1536]
    - [8, 128.601]
  - - [4096, 32, 1, 4096]
    - [42, 3954.7]
  - - [7680, 24000, 1, 2560]
    - [62, 10901.4]
  - - [8448, 4, 1, 2816]
    - [44, 573.617]
  - - [64, 1, 1, 1216]
    - [48, 6.83306]
  - - [512, 1, 1, 500000]
    - [6, 162.772]
  - - [176, 1500, 1, 1408]
    - [34, 5233.48]
  - - [512, 3000, 1, 1536]
    - [55, 8356.41]
  - - [8448, 24000, 1, 2816]
    - [62, 10983.2]
  - - [4608, 2, 1, 1536]
    - [0, 255.885]
  - - [1024, 48000, 1, 1536]
    - [65, 10148.1]
  - - [7680, 128, 1, 2560]
    - [58, 8368.33]
  - - [3072, 6000, 1, 1024]
    - [61, 9246.02]
  - - [3072, 1500, 1, 128]
    - [54, 4665.7]
  - - [2048, 3136, 1, 512]
    - [67, 8466.84]
  - - [1024, 3000, 1, 1536]
    - [60, 9084.83]
  - - [512, 4, 1, 500000]
    - [6, 641.424]
  - - [35, 700, 1, 2048]
    - [12, 1412.91]
  - - [1024, 16, 1, 500000]
    - [5, 2448.26]
  - - [512, 24000, 1, 2048]
    - [59, 9082.36]
  - - [128, 50176, 1, 512]
    - [72, 7172.19]
  - - [1024, 32, 1, 512]
    - [32, 1108.2]
  - - [256, 193600, 1, 64]
    - [73, 4380.82]
  - - [1024, 12544, 1, 256]
    - [71, 8229.99]
  - - [512, 48000, 1, 2560]
    - [62, 10497.0]
  - - [2560, 16, 1, 2560]
    - [27, 1912.57]
  - - [2048, 64, 1, 2048]
    - [19, 4361.51]
  - - [512, 2, 1, 512]
    - [17, 48.1256]
  - - [1024, 1, 1, 512]
    - [23, 42.1087]
  - - [512, 1500, 1, 2560]
    - [57, 8032.38]
  - - [6144, 32, 1, 2560]
    - [28, 3860.43]
  - - [1024, 1, 1, 500000]
    - [7, 160.751]
  - - [6144, 16, 1, 2560]
    - [49, 2140.42]
  - - [1024, 24000, 1, 2048]
    - [61, 9991.23]
  - - [4096, 16, 1, 4096]
    - [33, 2138.98]
  - - [5124, 1500, 1, 2048]
    - [65, 8861.04]
  - - [3072, 1500, 1, 1024]
    - [61, 8409.08]
  - - [1024, 2, 1, 500000]
    - [4, 320.655]
  - - [1024, 8, 1, 500000]
    - [2, 1250.54]
  - - [7680, 16, 1, 2560]
    - [46, 2225.59]
  - - [6144, 1500, 1, 2560]
    - [63, 9952.07]
  - - [3072, 1, 1, 1024]
    - [20, 107.409]
  - - [512, 6000, 1, 2816]
    - [59, 9619.64]
  - - [8448, 2, 1, 2816]
    - [39, 288.779]
  - - [4608, 4, 1, 1536]
    - [3, 500.259]
  - - [1024, 6000, 1, 1536]
    - [60, 9520.53]
  - - [8448, 32, 1, 2816]
    - [52, 4031.87]
  - - [512, 3000, 1, 2048]
    - [66, 6834.8]
  - - [6144, 24000, 1, 2560]
    - [62, 10631.0]
  - - [512, 3000, 1, 2560]
    - [57, 8846.73]
  - - [4608, 6000, 1, 1536]
    - [65, 9940.51]
  - - [256, 12544, 1, 1024]
    - [68, 7195.5]
  - - [512, 1500, 1, 2048]
    - [59, 6148.68]
  - - [512, 1500, 1, 1536]
    - [55, 7457.61]
  - - [128, 1, 1, 1024]
    - [41, 11.4369]
  - - [1024, 48000, 1, 2048]
    - [61, 10232.6]
- - - -1
    - - - -1
        - - - 4
            - - [448, 43]
              - [704, 32]
              - [1024, 43]
              - [1856, 32]
              - [3584, 27]
              - [5056, 43]
              - [5888, 32]
              - [-1, 27]
          - - 64
            - - [4, 43]
              - [64, 40]
              - [128, 48]
              - [256, 17]
              - [1408, 18]
              - [1856, 51]
              - [2368, 34]
              - [2944, 51]
              - [3584, 45]
              - [4288, 51]
              - [5056, 50]
              - [-1, 51]
          - - 128
            - - [4, 43]
              - [64, 17]
              - [128, 44]
              - [704, 18]
              - [1408, 50]
              - [1856, 45]
              - [2368, 50]
              - [2944, 31]
              - [3584, 51]
              - [4288, 45]
              - [5056, 28]
              - [5888, 57]
              - [-1, 45]
          - - 256
            - - [4, 43]
              - [64, 17]
              - [256, 18]
              - [448, 35]
              - [2944, 57]
              - [3584, 59]
              - [5056, 57]
              - [5888, 58]
              - [-1, 55]
          - - 448
            - - [4, 43]
              - [128, 18]
              - [256, 51]
              - [448, 34]
              - [1408, 57]
              - [1856, 59]
              - [2368, 55]
              - [2944, 58]
              - [3584, 55]
              - [4288, 56]
              - [5056, 55]
              - [5888, 57]
              - [-1, 56]
          - - 704
            - - [4, 43]
              - [64, 39]
              - [128, 18]
              - [256, 57]
              - [704, 55]
              - [1408, 57]
              - [2368, 55]
              - [5888, 56]
              - [-1, 58]
          - - 1024
            - - [4, 43]
              - [64, 18]
              - [128, 34]
              - [704, 55]
              - [1024, 58]
              - [1408, 59]
              - [3584, 58]
              - [4288, 55]
              - [5888, 64]
              - [-1, 60]
          - - 1408
            - - [4, 32]
              - [64, 18]
              - [128, 50]
              - [256, 57]
              - [448, 55]
              - [704, 59]
              - [1408, 58]
              - [1856, 59]
              - [2368, 57]
              - [4288, 58]
              - [5056, 64]
              - [5888, 62]
              - [-1, 58]
          - - 1856
            - - [4, 43]
              - [64, 34]
              - [128, 45]
              - [256, 55]
              - [448, 58]
              - [704, 57]
              - [1024, 59]
              - [1408, 56]
              - [1856, 59]
              - [2944, 58]
              - [3584, 56]
              - [4288, 64]
              - [5056, 58]
              - [5888, 62]
              - [-1, 58]
          - - 2368
            - - [4, 43]
              - [64, 35]
              - [128, 50]
              - [256, 57]
              - [704, 55]
              - [1024, 58]
              - [1856, 55]
              - [4288, 58]
              - [-1, 62]
          - - 2944
            - - [4, 43]
              - [64, 50]
              - [128, 31]
              - [256, 55]
              - [448, 59]
              - [1856, 58]
              - [2368, 60]
              - [5056, 58]
              - [5888, 64]
              - [-1, 58]
          - - 3584
            - - [4, 27]
              - [64, 31]
              - [128, 55]
              - [256, 59]
              - [448, 55]
              - [704, 58]
              - [1024, 59]
              - [1856, 58]
              - [2368, 60]
              - [3584, 58]
              - [4288, 64]
              - [-1, 58]
          - - 4288
            - - [4, 43]
              - [128, 35]
              - [256, 55]
              - [704, 58]
              - [1024, 55]
              - [1856, 62]
              - [2944, 58]
              - [3584, 62]
              - [5056, 58]
              - [-1, 62]
          - - 5056
            - - [4, 32]
              - [64, 50]
              - [128, 31]
              - [448, 55]
              - [1024, 58]
              - [1408, 62]
              - [1856, 58]
              - [2368, 62]
              - [4288, 58]
              - [-1, 62]
          - - 5888
            - - [4, 32]
              - [64, 50]
              - [128, 55]
              - [256, 58]
              - [448, 55]
              - [704, 58]
              - [1408, 62]
              - [2368, 58]
              - [2944, 62]
              - [4288, 58]
              - [-1, 62]
          - - -1
            - - [4, 27]
              - [64, 55]
              - [128, 45]
              - [256, 55]
              - [448, 58]
              - [704, 64]
              - [1024, 62]
              - [5888, 58]
              - [-1, 62]
