library/src/blas3/Tensile/Logic/asm_full/vega20_Cijk_Ailk_Bljk_SB.yaml
- {MinimumRequiredVersion: 4.2.0}
- vega20
- gfx906
- [Device 66a0, Device 66a7]
    SolutionIndex: 0
    SolutionNameMin: Cijk_Ailk_Bljk_SB_MT064x004x64_DTL0_GRVW02_LPB00_PBC0_PGR0_TT04_02_USFGRO00_VW02_WG16_02_08
    SolutionIndex: 1
    SolutionNameMin: Cijk_Ailk_Bljk_SB_MT128x008x32_DTL0_GRVW02_LPB00_PBC0_PGR0_TT08_02_USFGRO00_VW02_WG16_04_04
    SolutionIndex: 2
    SolutionNameMin: Cijk_Ailk_Bljk_SB_MT032x008x64_DTL0_GRVW02_LPB00_PBC0_PGR0_TT02_02_USFGRO00_VW02_WG16_04_04
    SolutionIndex: 3
    SolutionNameMin: Cijk_Ailk_Bljk_SB_MT128x008x32_DTL0_GRVW02_LPB00_PBC0_PGR0_TT08_02_USFGRO00_VW02_WG16_04_04
    SolutionIndex: 4
    SolutionNameMin: Cijk_Ailk_Bljk_SB_MT128x008x32_DTL0_GRVW04_LPB00_PBC0_PGR0_TT04_04_USFGRO00_VW04_WG32_02_04
    SolutionIndex: 5
    SolutionNameMin: Cijk_Ailk_Bljk_SB_MT064x008x32_DTL0_GRVW02_LPB00_PBC0_PGR0_TT02_02_USFGRO00_VW02_WG32_04_02
    SolutionIndex: 6
    SolutionNameMin: Cijk_Ailk_Bljk_SB_MT128x008x32_DTL0_GRVW02_LPB00_PBC0_PGR0_TT04_02_USFGRO00_VW02_WG32_04_02
    SolutionIndex: 7
    SolutionNameMin: Cijk_Ailk_Bljk_SB_MT128x016x16_DTL0_GRVW04_LPB00_PBC0_PGR0_TT04_04_USFGRO00_VW04_WG32_04_02
    SolutionIndex: 8
    SolutionNameMin: Cijk_Ailk_Bljk_SB_MT064x008x32_DTL0_GRVW02_LPB00_PBC0_PGR0_TT04_02_USFGRO00_VW02_WG16_04_04
    SolutionIndex: 9
    SolutionNameMin: Cijk_Ailk_Bljk_SB_MT032x008x64_DTL0_GRVW02_LPB00_PBC0_PGR0_TT04_02_USFGRO00_VW02_WG08_04_08
    SolutionIndex: 10
    SolutionNameMin: Cijk_Ailk_Bljk_SB_MT128x016x16_DTL0_GRVW04_LPB00_PBC0_PGR0_TT04_04_USFGRO00_VW04_WG32_04_02
    SolutionIndex: 11
    SolutionNameMin: Cijk_Ailk_Bljk_SB_MT032x008x64_DTL0_GRVW02_LPB00_PBC0_PGR0_TT02_02_USFGRO00_VW02_WG16_04_04
    SolutionIndex: 12
    SolutionNameMin: Cijk_Ailk_Bljk_SB_MT036x048x16_DTL0_GRVW01_LPB00_PBC1_PGR1_TT03_03_USFGRO01_VW01_WG12_16_01
    SolutionIndex: 13
    SolutionNameMin: Cijk_Ailk_Bljk_SB_MT048x096x08_DTL0_GRVW02_LPB00_PBC0_PGR1_TT04_06_USFGRO00_VW02_WG12_16_01
    SolutionIndex: 14
    SolutionNameMin: Cijk_Ailk_Bljk_SB_MT048x048x16_DTL0_GRVW01_LPB00_PBC1_PGR1_TT03_03_USFGRO01_VW01_WG16_16_01
    SolutionIndex: 15
    SolutionNameMin: Cijk_Ailk_Bljk_SB_MT036x048x16_DTL0_GRVW01_LPB00_PBC1_PGR1_TT03_03_USFGRO01_VW01_WG12_16_01
    SolutionIndex: 16
    SolutionNameMin: Cijk_Ailk_Bljk_SB_MT048x036x16_DTL0_GRVW01_LPB00_PBC1_PGR1_TT06_03_USFGRO01_VW01_WG08_12_02
    SolutionIndex: 17
    SolutionNameMin: Cijk_Ailk_Bljk_SB_MT048x024x32_DTL0_GRVW02_LPB00_PBC0_PGR1_TT06_04_USFGRO00_VW02_WG08_06_04
    SolutionIndex: 18
    SolutionNameMin: Cijk_Ailk_Bljk_SB_MT128x032x16_DTL0_GRVW04_LPB00_PBC0_PGR1_TT08_04_USFGRO00_VW04_WG16_08_02
    SolutionIndex: 19
    SolutionNameMin: Cijk_Ailk_Bljk_SB_MT016x016x16_DTL0_GRVW02_LPB00_PBC1_PGR1_TT02_02_USFGRO01_VW02_WG08_08_04
    SolutionIndex: 20
    SolutionNameMin: Cijk_Ailk_Bljk_SB_MT128x032x16_DTL0_GRVW04_LPB00_PBC0_PGR1_TT08_04_USFGRO00_VW04_WG16_08_02
    SolutionIndex: 21
    SolutionNameMin: Cijk_Ailk_Bljk_SB_MT032x008x32_DTL0_GRVW02_LPB00_PBC0_PGR1_TT02_02_USFGRO00_VW02_WG16_04_04
    SolutionIndex: 22
    SolutionNameMin: Cijk_Ailk_Bljk_SB_MT032x008x32_DTL0_GRVW02_LPB00_PBC0_PGR1_TT02_02_USFGRO00_VW02_WG16_04_04
    SolutionIndex: 23
    SolutionNameMin: Cijk_Ailk_Bljk_SB_MT032x008x32_DTL0_GRVW02_LPB00_PBC0_PGR1_TT02_02_USFGRO00_VW02_WG16_04_04
    SolutionIndex: 24
    SolutionNameMin: Cijk_Ailk_Bljk_SB_MT128x032x32_DTL0_GRVW04_LPB00_PBC0_PGR1_TT08_08_USFGRO00_VW04_WG16_04_04
    SolutionIndex: 25
    SolutionNameMin: Cijk_Ailk_Bljk_SB_MT016x016x16_DTL0_GRVW02_LPB00_PBC1_PGR1_TT02_02_USFGRO01_VW02_WG08_08_04
    SolutionIndex: 26
    SolutionNameMin: Cijk_Ailk_Bljk_SB_MT016x016x08_DTL0_GRVW02_LPB00_PBC1_PGR1_TT02_02_USFGRO01_VW02_WG08_08_02
    SolutionIndex: 27
    SolutionNameMin: Cijk_Ailk_Bljk_SB_MT064x016x16_DTL0_GRVW02_LPB00_PBC0_PGR1_TT04_02_USFGRO00_VW02_WG16_08_02
    SolutionIndex: 28
    SolutionNameMin: Cijk_Ailk_Bljk_SB_MT128x016x16_DTL0_GRVW04_LPB00_PBC0_PGR1_TT04_04_USFGRO00_VW04_WG32_04_02
    SolutionIndex: 29
    SolutionNameMin: Cijk_Ailk_Bljk_SB_MT128x016x16_DTL0_GRVW04_LPB00_PBC0_PGR1_TT04_04_USFGRO00_VW04_WG32_04_02
    SolutionIndex: 30
    SolutionNameMin: Cijk_Ailk_Bljk_SB_MT064x016x16_DTL0_GRVW02_LPB00_PBC0_PGR1_TT04_02_USFGRO00_VW02_WG16_08_02
    SolutionIndex: 31
    SolutionNameMin: Cijk_Ailk_Bljk_SB_MT032x016x16_DTL0_GRVW02_LPB00_PBC0_PGR1_TT04_02_USFGRO00_VW02_WG08_08_02
    SolutionIndex: 32
    SolutionNameMin: Cijk_Ailk_Bljk_SB_MT016x016x08_DTL0_GRVW02_LPB00_PBC1_PGR1_TT02_02_USFGRO01_VW02_WG08_08_02
    SolutionIndex: 33
    SolutionNameMin: Cijk_Ailk_Bljk_SB_MT016x016x32_DTL0_GRVW02_LPB00_PBC0_PGR1_TT02_02_USFGRO00_VW02_WG08_08_04
    SolutionIndex: 34
    SolutionNameMin: Cijk_Ailk_Bljk_SB_MT064x032x16_DTL0_GRVW04_LPB00_PBC0_PGR1_TT04_04_USFGRO00_VW04_WG16_08_02
    SolutionIndex: 35
    SolutionNameMin: Cijk_Ailk_Bljk_SB_MT032x032x32_DTL0_GRVW04_LPB00_PBC0_PGR1_TT04_04_USFGRO00_VW04_WG08_08_04
    SolutionIndex: 36
    SolutionNameMin: Cijk_Ailk_Bljk_SB_MT032x016x16_DTL0_GRVW02_LPB00_PBC0_PGR1_TT02_02_USFGRO00_VW02_WG16_08_02
    SolutionIndex: 37
    SolutionNameMin: Cijk_Ailk_Bljk_SB_MT064x016x32_DTL0_GRVW02_LPB00_PBC0_PGR1_TT04_02_USFGRO00_VW02_WG16_08_02
    SolutionIndex: 38
    SolutionNameMin: Cijk_Ailk_Bljk_SB_MT064x032x16_DTL0_GRVW04_LPB00_PBC0_PGR1_TT04_04_USFGRO00_VW04_WG16_08_02
    SolutionIndex: 39
    SolutionNameMin: Cijk_Ailk_Bljk_SB_MT032x016x16_DTL0_GRVW02_LPB00_PBC0_PGR1_TT04_02_USFGRO00_VW02_WG08_08_04
    SolutionIndex: 40
    SolutionNameMin: Cijk_Ailk_Bljk_SB_MT032x032x16_DTL0_GRVW04_LPB00_PBC0_PGR1_TT04_04_USFGRO00_VW04_WG08_08_02
    SolutionIndex: 41
    SolutionNameMin: Cijk_Ailk_Bljk_SB_MT032x032x16_DTL0_GRVW04_LPB00_PBC0_PGR1_TT04_04_USFGRO00_VW04_WG08_08_02
    SolutionIndex: 42
    SolutionNameMin: Cijk_Ailk_Bljk_SB_MT032x016x16_DTL0_GRVW02_LPB00_PBC0_PGR1_TT04_02_USFGRO00_VW02_WG08_08_04
    SolutionIndex: 43
    SolutionNameMin: Cijk_Ailk_Bljk_SB_MT032x016x16_DTL0_GRVW02_LPB00_PBC0_PGR1_TT04_02_USFGRO00_VW02_WG08_08_02
    SolutionIndex: 44
    SolutionNameMin: Cijk_Ailk_Bljk_SB_MT032x016x16_DTL0_GRVW02_LPB00_PBC0_PGR1_TT04_02_USFGRO00_VW02_WG08_08_02
    SolutionIndex: 45
    SolutionNameMin: Cijk_Ailk_Bljk_SB_MT032x008x32_DTL0_GRVW02_LPB00_PBC0_PGR1_TT02_02_USFGRO00_VW02_WG16_04_04
    SolutionIndex: 46
    SolutionNameMin: Cijk_Ailk_Bljk_SB_MT128x064x08_DTL0_GRVW04_LPB00_PBC0_PGR1_TT08_04_USFGRO00_VW04_WG16_16_01
    SolutionIndex: 47
    SolutionNameMin: Cijk_Ailk_Bljk_SB_MT128x064x08_DTL0_GRVW04_LPB00_PBC0_PGR1_TT08_04_USFGRO00_VW04_WG16_16_01
    SolutionIndex: 48
    SolutionNameMin: Cijk_Ailk_Bljk_SB_MT128x064x16_DTL0_GRVW04_LPB00_PBC0_PGR1_TT08_04_USFGRO00_VW04_WG16_16_01
    SolutionIndex: 49
    SolutionNameMin: Cijk_Ailk_Bljk_SB_MT128x064x16_DTL0_GRVW04_LPB00_PBC0_PGR1_TT08_04_USFGRO00_VW04_WG16_16_01
    SolutionIndex: 50
    SolutionNameMin: Cijk_Ailk_Bljk_SB_MT128x128x16_DTL0_GRVW04_LPB00_PBC0_PGR1_TT08_08_USFGRO00_VW04_WG16_16_01
    SolutionIndex: 51
    SolutionNameMin: Cijk_Ailk_Bljk_SB_MT128x128x08_DTL0_GRVW04_LPB00_PBC0_PGR1_TT08_08_USFGRO00_VW04_WG16_16_01
    SolutionIndex: 52
    SolutionNameMin: Cijk_Ailk_Bljk_SB_MT128x128x08_DTL0_GRVW04_LPB00_PBC0_PGR1_TT08_08_USFGRO00_VW04_WG16_16_01
    SolutionIndex: 53
    SolutionNameMin: Cijk_Ailk_Bljk_SB_MT064x064x08_DTL0_GRVW04_LPB00_PBC0_PGR1_TT04_04_USFGRO00_VW04_WG16_16_01
    SolutionIndex: 54
    SolutionNameMin: Cijk_Ailk_Bljk_SB_MT128x064x08_DTL0_GRVW04_LPB00_PBC0_PGR0_TT08_04_USFGRO00_VW04_WG16_16_01
    SolutionIndex: 55
    SolutionNameMin: Cijk_Ailk_Bljk_SB_MT128x096x16_DTL0_GRVW02_LPB00_PBC0_PGR1_TT08_06_USFGRO00_VW02_WG16_16_01
    SolutionIndex: 56
    SolutionNameMin: Cijk_Ailk_Bljk_SB_MT128x096x16_DTL0_GRVW02_LPB00_PBC0_PGR1_TT08_06_USFGRO00_VW02_WG16_16_01
    SolutionIndex: 57
    SolutionNameMin: Cijk_Ailk_Bljk_SB_MT064x064x08_DTL0_GRVW04_LPB00_PBC0_PGR1_TT04_04_USFGRO00_VW04_WG16_16_01
    SolutionIndex: 58
    SolutionNameMin: Cijk_Ailk_Bljk_SB_MT064x128x08_DTL0_GRVW04_LPB00_PBC0_PGR1_TT04_08_USFGRO00_VW04_WG16_16_01
    SolutionIndex: 59
    SolutionNameMin: Cijk_Ailk_Bljk_SB_MT064x064x16_DTL0_GRVW04_LPB00_PBC0_PGR1_TT04_04_USFGRO00_VW04_WG16_16_01
    SolutionIndex: 60
    SolutionNameMin: Cijk_Ailk_Bljk_SB_MT064x064x16_DTL0_GRVW04_LPB00_PBC0_PGR1_TT04_04_USFGRO00_VW04_WG16_16_01
    SolutionIndex: 61
    SolutionNameMin: Cijk_Ailk_Bljk_SB_MT128x128x16_DTL0_GRVW04_LPB00_PBC0_PGR1_TT08_08_USFGRO00_VW04_WG16_16_01
    SolutionIndex: 62
    SolutionNameMin: Cijk_Ailk_Bljk_SB_MT128x064x08_DTL0_GRVW04_LPB00_PBC0_PGR1_TT04_08_USFGRO00_VW04_WG32_08_01
    SolutionIndex: 63
    SolutionNameMin: Cijk_Ailk_Bljk_SB_MT128x032x16_DTL0_GRVW04_LPB04_PBC0_PGR1_TT04_04_USFGRO00_VW04_WG32_08_01
    SolutionIndex: 64
    SolutionNameMin: Cijk_Ailk_Bljk_SB_MT128x064x16_DTL0_GRVW04_LPB04_PBC0_PGR1_TT04_04_USFGRO00_VW04_WG32_16_01
    SolutionIndex: 65
    SolutionNameMin: Cijk_Ailk_Bljk_SB_MT128x064x16_DTL0_GRVW04_LPB04_PBC0_PGR1_TT04_04_USFGRO00_VW04_WG32_16_01
    SolutionIndex: 66
    SolutionNameMin: Cijk_Ailk_Bljk_SB_MT128x032x16_DTL0_GRVW04_LPB04_PBC0_PGR1_TT04_04_USFGRO00_VW04_WG32_08_01
    SolutionIndex: 67
    SolutionNameMin: Cijk_Ailk_Bljk_SB_MT128x064x08_DTL0_GRVW04_LPB04_PBC0_PGR1_TT04_08_USFGRO00_VW04_WG32_08_01
    SolutionIndex: 68
    SolutionNameMin: Cijk_Ailk_Bljk_SB_MT064x064x16_DTL0_GRVW04_LPB00_PBC0_PGR0_TT04_04_USFGRO00_VW04_WG16_16_01
    SolutionIndex: 69
    SolutionNameMin: Cijk_Ailk_Bljk_SB_MT064x064x16_DTL0_GRVW01_LPB04_PBC1_PGR0_TT04_04_USFGRO01_VW04_WG16_16_01
    SolutionIndex: 70
    SolutionNameMin: Cijk_Ailk_Bljk_SB_MT064x064x16_DTL0_GRVW01_LPB04_PBC1_PGR0_TT04_04_USFGRO01_VW02_WG16_16_01
    SolutionIndex: 71
    SolutionNameMin: Cijk_Ailk_Bljk_SB_MT032x128x16_DTL0_GRVW01_LPB04_PBC1_PGR0_TT04_04_USFGRO01_VW04_WG08_32_01
    SolutionIndex: 72
    SolutionNameMin: Cijk_Ailk_Bljk_SB_MT064x064x16_DTL0_GRVW04_LPB04_PBC0_PGR0_TT04_04_USFGRO00_VW04_WG16_16_01
    SolutionIndex: 73
    SolutionNameMin: Cijk_Ailk_Bljk_SB_MT064x032x16_DTL0_GRVW01_LPB04_PBC1_PGR0_TT04_04_USFGRO01_VW04_WG16_08_01
    SolutionIndex: 74
    SolutionNameMin: Cijk_Ailk_Bljk_SB_MT128x032x16_DTL0_GRVW01_LPB04_PBC1_PGR0_TT04_04_USFGRO01_VW04_WG32_08_01
    SolutionIndex: 75
    SolutionNameMin: Cijk_Ailk_Bljk_SB_MT128x064x16_DTL0_GRVW04_LPB04_PBC0_PGR0_TT04_08_USFGRO00_VW04_WG32_08_01
    SolutionIndex: 76
    SolutionNameMin: Cijk_Ailk_Bljk_SB_MT128x032x16_DTL0_GRVW04_LPB02_PBC0_PGR0_TT04_04_USFGRO00_VW02_WG32_08_01
- - - [4096, 7000, 1, 4096]
    - [61, 8938.76]
  - - [5124, 9124, 1, 1760]
    - [58, 8979.92]
  - - [5124, 9124, 1, 2560]
    - [46, 8869.52]
  - - [1760, 32, 1, 1760]
    - [35, 3591.36]
  - - [1024, 1500, 1, 1536]
    - [47, 7046.79]
  - - [512, 24000, 1, 1536]
    - [61, 8856.09]
  - - [3072, 24000, 1, 1024]
    - [46, 8987.49]
  - - [1024, 3000, 1, 2560]
    - [46, 8245.48]
  - - [512, 3136, 1, 2048]
    - [66, 6761.57]
  - - [7680, 4, 1, 2560]
    - [28, 1225.72]
  - - [35, 1500, 1, 2048]
    - [14, 2106.56]
  - - [8448, 1500, 1, 2816]
    - [46, 8933.11]
  - - [784, 512, 64, 128]
    - [72, 7493.82]
  - - [2560, 7000, 1, 2560]
    - [46, 9005.46]
  - - [3072, 16, 1, 1024]
    - [36, 1990.93]
  - - [512, 48000, 1, 2048]
    - [46, 8510.47]
  - - [1760, 64, 1, 1760]
    - [41, 4606.04]
  - - [1024, 16, 1, 512]
    - [33, 936.229]
  - - [196, 256, 64, 1024]
    - [76, 5355.51]
  - - [512, 48000, 1, 1536]
    - [46, 8979.8]
  - - [2560, 32, 1, 2560]
    - [34, 4020.54]
  - - [4608, 1500, 1, 1536]
    - [61, 8411.52]
  - - [2048, 128, 1, 2048]
    - [40, 3881.31]
  - - [1024, 24000, 1, 2560]
    - [47, 9020.45]
  - - [4608, 3000, 1, 1536]
    - [46, 8872.96]
  - - [5124, 9124, 1, 2048]
    - [46, 8672.28]
  - - [1024, 700, 1, 512]
    - [60, 5777.64]
  - - [3072, 1, 1, 128]
    - [21, 58.5143]
  - - [5124, 700, 1, 2560]
    - [61, 7559.01]
  - - [8448, 16, 1, 2816]
    - [27, 3846.27]
  - - [6144, 6000, 1, 2560]
    - [47, 9080.65]
  - - [4608, 32, 1, 1536]
    - [41, 3611.11]
  - - [35, 8457, 1, 2560]
    - [12, 3730.48]
  - - [3072, 64, 1, 1024]
    - [18, 3087.78]
  - - [512, 16, 1, 512]
    - [33, 551.882]
  - - [7680, 2, 1, 2560]
    - [29, 617.478]
  - - [4224, 1, 1, 128]
    - [43, 72.671]
  - - [7680, 1, 1, 2560]
    - [28, 308.739]
  - - [128, 1500, 1, 1280]
    - [41, 4266.59]
  - - [35, 8457, 1, 4096]
    - [16, 3682.8]
  - - [1024, 1500, 1, 2816]
    - [54, 6904.15]
  - - [6144, 2, 1, 2560]
    - [6, 522.885]
  - - [8448, 48000, 1, 2816]
    - [51, 9342.89]
  - - [512, 6000, 1, 1536]
    - [48, 8086.32]
  - - [4224, 1500, 1, 176]
    - [47, 7713.89]
  - - [1024, 6000, 1, 2816]
    - [46, 8824.29]
  - - [512, 6000, 1, 2560]
    - [48, 8289.28]
  - - [512, 32, 1, 512]
    - [22, 970.904]
  - - [2560, 128, 1, 2560]
    - [18, 5208.96]
  - - [4608, 24000, 1, 1536]
    - [47, 9199.9]
  - - [512, 2, 1, 500000]
    - [4, 627.935]
  - - [7680, 48000, 1, 2560]
    - [51, 9310.53]
  - - [3072, 48000, 1, 1024]
    - [46, 9060.67]
  - - [1760, 16, 1, 1760]
    - [37, 2448.7]
  - - [512, 3000, 1, 2816]
    - [59, 7767.05]
  - - [1760, 7000, 1, 1760]
    - [47, 8706.31]
  - - [64, 193600, 1, 256]
    - [59, 7688.33]
  - - [1024, 3000, 1, 2048]
    - [49, 7938.03]
  - - [6144, 4, 1, 2560]
    - [1, 1010.82]
  - - [1024, 6000, 1, 2048]
    - [61, 8375.53]
  - - [512, 24000, 1, 2816]
    - [47, 9030.83]
  - - [6144, 48000, 1, 2560]
    - [51, 9292.64]
  - - [8448, 3000, 1, 2816]
    - [46, 9191.28]
  - - [35, 1500, 1, 2560]
    - [15, 2745.07]
  - - [3072, 4, 1, 1024]
    - [23, 695.958]
  - - [4608, 48000, 1, 1536]
    - [47, 9253.56]
  - - [2048, 32, 1, 2048]
    - [42, 2750.34]
  - - [7680, 1500, 1, 2560]
    - [46, 8672.74]
  - - [4096, 128, 1, 4096]
    - [49, 6348.91]
  - - [4608, 16, 1, 1536]
    - [31, 2836.79]
  - - [1024, 1500, 1, 2048]
    - [55, 6294.39]
  - - [3072, 3000, 1, 1024]
    - [46, 7941.51]
  - - [3072, 2, 1, 1024]
    - [22, 378.081]
  - - [8448, 1, 1, 2816]
    - [5, 309.756]
  - - [1024, 48000, 1, 2560]
    - [47, 9157.79]
  - - [1024, 3000, 1, 2816]
    - [47, 8575.85]
  - - [128, 1, 1, 1408]
    - [2, 23.7137]
  - - [35, 8457, 1, 1760]
    - [13, 3896.94]
  - - [1024, 2, 1, 512]
    - [23, 145.636]
  - - [1024, 4, 1, 500000]
    - [3, 1150.96]
  - - [6144, 1, 1, 2560]
    - [1, 267.492]
  - - [1024, 48000, 1, 2816]
    - [51, 9219.32]
  - - [512, 48000, 1, 2816]
    - [47, 9117.25]
  - - [2048, 16, 1, 2048]
    - [39, 2356.31]
  - - [1024, 24000, 1, 1536]
    - [47, 8948.8]
  - - [64, 193600, 1, 64]
    - [59, 6845.44]
  - - [7680, 6000, 1, 2560]
    - [47, 9180.12]
  - - [1760, 128, 1, 1760]
    - [41, 5057.24]
  - - [35, 8457, 1, 2048]
    - [14, 3294.51]
  - - [512, 1500, 1, 2816]
    - [57, 6658.43]
  - - [512, 1, 1, 512]
    - [2, 42.0103]
  - - [512, 16, 1, 500000]
    - [7, 4373.02]
  - - [512, 8, 1, 500000]
    - [4, 2425.13]
  - - [512, 24000, 1, 2560]
    - [61, 8907.25]
  - - [6144, 3000, 1, 2560]
    - [47, 8964.58]
  - - [1024, 24000, 1, 2816]
    - [46, 9058.63]
  - - [2048, 7000, 1, 2048]
    - [50, 8669.27]
  - - [7680, 3000, 1, 2560]
    - [46, 9041.7]
  - - [1024, 4, 1, 512]
    - [9, 254.509]
  - - [5124, 700, 1, 2048]
    - [50, 7340.38]
  - - [5124, 9124, 1, 4096]
    - [47, 8754.72]
  - - [4096, 64, 1, 4096]
    - [38, 5218.34]
  - - [256, 193600, 1, 64]
    - [62, 7800.26]
  - - [512, 6000, 1, 2048]
    - [49, 7763.29]
  - - [7680, 32, 1, 2560]
    - [20, 5698.71]
  - - [2560, 64, 1, 2560]
    - [38, 4511.9]
  - - [3136, 2048, 1, 512]
    - [75, 7660.01]
  - - [3072, 128, 1, 1024]
    - [49, 4509.95]
  - - [8448, 6000, 1, 2816]
    - [47, 9233.09]
  - - [7680, 64, 1, 2560]
    - [18, 5971.3]
  - - [5124, 1500, 1, 2560]
    - [61, 8283.32]
  - - [1024, 1500, 1, 2560]
    - [47, 7470.94]
  - - [3025, 64, 64, 64]
    - [69, 6594.94]
  - - [512, 4, 1, 512]
    - [0, 148.945]
  - - [1024, 6000, 1, 2560]
    - [61, 8755.91]
  - - [3072, 32, 1, 1024]
    - [24, 2481.81]
  - - [35, 700, 1, 2560]
    - [17, 2292.4]
  - - [3136, 512, 1, 2048]
    - [74, 5831.95]
  - - [196, 1024, 64, 256]
    - [71, 6327.52]
  - - [512, 50176, 1, 128]
    - [67, 8398.77]
  - - [4608, 1, 1, 1536]
    - [5, 241.727]
  - - [49, 512, 64, 2048]
    - [73, 3412.5]
  - - [4096, 32, 1, 4096]
    - [20, 4803.72]
  - - [7680, 24000, 1, 2560]
    - [47, 9292.37]
  - - [8448, 4, 1, 2816]
    - [8, 1194.24]
  - - [64, 1, 1, 1216]
    - [45, 10.6894]
  - - [512, 1, 1, 500000]
    - [4, 317.204]
  - - [176, 1500, 1, 1408]
    - [40, 4604.9]
  - - [512, 3000, 1, 1536]
    - [60, 7189.37]
  - - [8448, 24000, 1, 2816]
    - [47, 9318.61]
  - - [4608, 2, 1, 1536]
    - [5, 484.779]
  - - [1024, 48000, 1, 1536]
    - [47, 9082.12]
  - - [7680, 128, 1, 2560]
    - [48, 7496.87]
  - - [3072, 6000, 1, 1024]
    - [50, 8605.11]
  - - [3072, 1500, 1, 128]
    - [47, 6666.07]
  - - [2048, 3136, 1, 512]
    - [64, 8081.72]
  - - [3025, 256, 64, 64]
    - [68, 7334.21]
  - - [1024, 3000, 1, 1536]
    - [48, 8041.12]
  - - [512, 4, 1, 500000]
    - [4, 1237.77]
  - - [35, 700, 1, 2048]
    - [12, 1766.73]
  - - [1024, 16, 1, 500000]
    - [10, 3917.91]
  - - [512, 24000, 1, 2048]
    - [49, 8157.05]
  - - [128, 50176, 1, 512]
    - [65, 7904.54]
  - - [1024, 32, 1, 512]
    - [19, 1379.71]
  - - [256, 12544, 1, 1024]
    - [63, 7218.76]
  - - [1024, 12544, 1, 256]
    - [67, 8364.59]
  - - [512, 48000, 1, 2560]
    - [47, 9058.37]
  - - [2560, 16, 1, 2560]
    - [30, 2830.89]
  - - [2048, 64, 1, 2048]
    - [18, 3588.64]
  - - [512, 2, 1, 512]
    - [9, 76.2047]
  - - [1024, 1, 1, 512]
    - [23, 75.3287]
  - - [512, 1500, 1, 2560]
    - [55, 6288.55]
  - - [6144, 32, 1, 2560]
    - [20, 4329.92]
  - - [1024, 1, 1, 500000]
    - [3, 283.86]
  - - [6144, 16, 1, 2560]
    - [29, 3263.16]
  - - [1024, 24000, 1, 2048]
    - [61, 8825.78]
  - - [4096, 16, 1, 4096]
    - [44, 3195.62]
  - - [5124, 1500, 1, 2048]
    - [61, 7953.39]
  - - [3072, 1500, 1, 1024]
    - [48, 7287.07]
  - - [1024, 2, 1, 500000]
    - [3, 567.972]
  - - [1024, 8, 1, 500000]
    - [3, 2199.47]
  - - [7680, 16, 1, 2560]
    - [28, 4246.34]
  - - [6144, 1500, 1, 2560]
    - [52, 8543.35]
  - - [3072, 1, 1, 1024]
    - [21, 190.882]
  - - [512, 6000, 1, 2816]
    - [47, 8590.84]
  - - [8448, 2, 1, 2816]
    - [8, 612.49]
  - - [4608, 4, 1, 1536]
    - [0, 891.408]
  - - [1024, 6000, 1, 1536]
    - [61, 8680.14]
  - - [8448, 32, 1, 2816]
    - [34, 5342.89]
  - - [512, 3000, 1, 2048]
    - [56, 6275.3]
  - - [6144, 24000, 1, 2560]
    - [47, 9270.42]
  - - [512, 3000, 1, 2560]
    - [47, 7617.99]
  - - [4608, 6000, 1, 1536]
    - [46, 9006.96]
  - - [1024, 1024, 1, 1024]
    - [49, 6064.88]
  - - [512, 1500, 1, 2048]
    - [48, 5735.27]
  - - [512, 1500, 1, 1536]
    - [55, 6100.71]
  - - [128, 1, 1, 1024]
    - [11, 18.0044]
  - - [49, 2048, 64, 512]
    - [70, 5422.64]
  - - [1024, 48000, 1, 2048]
    - [47, 8958.81]
- - - -1
    - - - -1
        - - - 4
            - - [1024, 25]
              - [1408, 26]
              - [-1, 25]
          - - 64
            - - [4, 25]
              - [64, 45]
              - [128, 25]
              - [448, 37]
              - [704, 27]
              - [1408, 35]
              - [2368, 41]
              - [3584, 38]
              - [5056, 34]
              - [5888, 38]
              - [-1, 59]
          - - 128
            - - [64, 25]
              - [128, 37]
              - [256, 39]
              - [448, 35]
              - [704, 34]
              - [1024, 41]
              - [1408, 38]
              - [1856, 41]
              - [2368, 38]
              - [2944, 20]
              - [3584, 60]
              - [4288, 34]
              - [5056, 59]
              - [5888, 60]
              - [-1, 48]
          - - 256
            - - [4, 25]
              - [64, 37]
              - [128, 31]
              - [256, 35]
              - [448, 41]
              - [1024, 59]
              - [2368, 60]
              - [2944, 59]
              - [3584, 48]
              - [4288, 59]
              - [5888, 47]
              - [-1, 60]
          - - 448
            - - [4, 25]
              - [64, 37]
              - [128, 35]
              - [448, 41]
              - [1408, 59]
              - [1856, 48]
              - [2368, 60]
              - [2944, 46]
              - [3584, 59]
              - [4288, 58]
              - [5056, 60]
              - [5888, 59]
              - [-1, 58]
          - - 704
            - - [4, 25]
              - [128, 35]
              - [256, 59]
              - [1024, 60]
              - [1408, 58]
              - [1856, 47]
              - [2368, 59]
              - [2944, 53]
              - [5056, 58]
              - [5888, 60]
              - [-1, 58]
          - - 1024
            - - [4, 25]
              - [64, 43]
              - [128, 40]
              - [704, 60]
              - [1408, 46]
              - [1856, 47]
              - [2944, 46]
              - [3584, 54]
              - [5888, 46]
              - [-1, 47]
          - - 1408
            - - [4, 26]
              - [64, 34]
              - [128, 38]
              - [448, 59]
              - [1408, 47]
              - [1856, 53]
              - [2368, 47]
              - [2944, 52]
              - [-1, 47]
          - - 1856
            - - [4, 26]
              - [64, 41]
              - [128, 40]
              - [256, 59]
              - [448, 48]
              - [704, 46]
              - [1024, 47]
              - [1408, 53]
              - [2368, 46]
              - [2944, 47]
              - [3584, 58]
              - [5888, 47]
              - [-1, 58]
          - - 2368
            - - [4, 32]
              - [64, 34]
              - [128, 38]
              - [256, 60]
              - [704, 59]
              - [1856, 47]
              - [2368, 54]
              - [3584, 47]
              - [4288, 58]
              - [5056, 47]
              - [-1, 58]
          - - 2944
            - - [4, 32]
              - [64, 38]
              - [128, 20]
              - [256, 59]
              - [448, 47]
              - [704, 46]
              - [1024, 47]
              - [1408, 51]
              - [-1, 47]
          - - 3584
            - - [4, 26]
              - [64, 18]
              - [128, 59]
              - [256, 48]
              - [448, 59]
              - [704, 47]
              - [1024, 54]
              - [-1, 47]
          - - 4288
            - - [4, 26]
              - [128, 40]
              - [256, 60]
              - [448, 46]
              - [5056, 47]
              - [-1, 58]
          - - 5056
            - - [4, 26]
              - [64, 40]
              - [128, 59]
              - [256, 47]
              - [448, 60]
              - [704, 46]
              - [1024, 58]
              - [1408, 46]
              - [2944, 47]
              - [3584, 58]
              - [4288, 47]
              - [5888, 46]
              - [-1, 58]
          - - 5888
            - - [4, 32]
              - [64, 20]
              - [128, 59]
              - [448, 47]
              - [704, 54]
              - [-1, 47]
          - - -1
            - - [4, 32]
              - [64, 59]
              - [128, 48]
              - [256, 59]
              - [448, 46]
              - [704, 47]
              - [1856, 46]
              - [4288, 47]
              - [5888, 46]
              - [-1, 51]
