library/src/blas3/Tensile/Logic/asm_full/vega10_Cijk_Ailk_Bljk_CB_GB.yaml
- {MinimumRequiredVersion: 4.26.0}
- vega10
- gfx900
- [Device 6863, Device 6862, Device 687f, Device 6860, Device 6861, 'Vega 10 XTX [Radeon
    SolutionIndex: 0
    SolutionNameMin: Cijk_Ailk_Bljk_CB_GB_MT32x32x8_SN_AMAS3_GRVW2_LRVW2_TT4_4_VW2_WG8_8_1_WGM1
    SolutionIndex: 1
    SolutionNameMin: Cijk_Ailk_Bljk_CB_GB_MT64x32x8_SN_AMAS3_GRVW2_LRVW2_TT8_4_VW2_WG8_8_1_WGM1
    SolutionIndex: 2
    SolutionNameMin: Cijk_Ailk_Bljk_CB_GB_MT64x64x8_SN_AMAS3_GRVW2_LRVW2_TT4_4_VW2_WG16_16_1_WGM1
    SolutionIndex: 3
    SolutionNameMin: Cijk_Ailk_Bljk_CB_GB_MT128x64x8_SN_AMAS3_GRVW2_LRVW2_TT8_4_VW2_WG16_16_1_WGM1
    SolutionIndex: 4
    SolutionNameMin: Cijk_Ailk_Bljk_CB_GB_MT64x128x8_SN_AMAS3_GRVW2_LRVW2_TT4_8_VW2_WG16_16_1_WGM1
    SolutionIndex: 5
    SolutionNameMin: Cijk_Ailk_Bljk_CB_GB_MT32x32x16_SN_AMAS3_GRVW2_LRVW2_TT4_4_VW2_WG8_8_1_WGM1
    SolutionIndex: 6
    SolutionNameMin: Cijk_Ailk_Bljk_CB_GB_MT64x64x16_SN_AMAS3_GRVW2_LRVW2_TT4_4_VW2_WG16_16_1_WGM1
    SolutionIndex: 7
    SolutionNameMin: Cijk_Ailk_Bljk_CB_GB_MT64x64x8_SN_AMAS0_GRVW1_LRVW1_TT4_4_VW1_WG16_16_1_WGM1
    SolutionIndex: 8
    SolutionNameMin: Cijk_Ailk_Bljk_CB_GB_MT32x32x8_SN_AMAS3_GRVW2_LRVW2_TT4_4_VW2_WG8_8_1_WGM8
    SolutionIndex: 9
    SolutionNameMin: Cijk_Ailk_Bljk_CB_GB_MT64x64x8_SN_AMAS3_GRVW2_LRVW2_TT4_4_VW2_WG16_16_1_WGM8
    SolutionIndex: 10
    SolutionNameMin: Cijk_Ailk_Bljk_CB_GB_MT128x64x8_SN_AMAS3_GRVW2_LRVW2_TT8_4_VW2_WG16_16_1_WGM8
    SolutionIndex: 11
    SolutionNameMin: Cijk_Ailk_Bljk_CB_GB_MT32x32x16_SN_AMAS3_GRVW2_LRVW2_TT4_4_VW2_WG8_8_1_WGM8
    SolutionIndex: 12
    SolutionNameMin: Cijk_Ailk_Bljk_CB_GB_MT64x64x16_SN_AMAS3_GRVW2_LRVW2_TT4_4_VW2_WG16_16_1_WGM8
    SolutionIndex: 13
    SolutionNameMin: Cijk_Ailk_Bljk_CB_GB_MT32x32x8_SN_AMAS0_GRVW1_LRVW1_TT4_4_VW1_WG8_8_1_WGM8
    SolutionIndex: 14
    SolutionNameMin: Cijk_Ailk_Bljk_CB_GB_MT64x64x8_SN_AMAS0_GRVW1_LRVW1_TT4_4_VW1_WG16_16_1_WGM8
- - - [32, 32, 8, 32, 32, 32, 32, 32]
    - [0, 37.0]
  - - [32, 32, 8, 64, 32, 32, 32, 64]
    - [0, 50.0]
  - - [32, 32, 8, 128, 32, 32, 32, 128]
    - [0, 61.0]
  - - [32, 32, 8, 256, 32, 32, 32, 256]
    - [0, 68.0]
  - - [32, 32, 8, 512, 32, 32, 32, 512]
    - [0, 72.0]
  - - [32, 64, 8, 32, 32, 32, 32, 32]
    - [0, 81.0]
  - - [32, 64, 8, 64, 32, 32, 32, 64]
    - [0, 105.0]
  - - [32, 64, 8, 128, 32, 32, 32, 128]
    - [0, 125.0]
  - - [32, 64, 8, 256, 32, 32, 32, 256]
    - [8, 139.0]
  - - [32, 64, 8, 512, 32, 32, 32, 512]
    - [0, 144.0]
  - - [32, 128, 8, 32, 32, 32, 32, 32]
    - [0, 163.0]
  - - [32, 128, 8, 64, 32, 32, 32, 64]
    - [0, 213.0]
  - - [32, 128, 8, 128, 32, 32, 32, 128]
    - [0, 251.0]
  - - [32, 128, 8, 256, 32, 32, 32, 256]
    - [0, 276.0]
  - - [32, 128, 8, 512, 32, 32, 32, 512]
    - [5, 254.0]
  - - [32, 256, 8, 32, 32, 32, 32, 32]
    - [0, 318.0]
  - - [32, 256, 8, 64, 32, 32, 32, 64]
    - [8, 411.0]
  - - [32, 256, 8, 128, 32, 32, 32, 128]
    - [0, 447.0]
  - - [32, 256, 8, 256, 32, 32, 32, 256]
    - [5, 419.0]
  - - [32, 256, 8, 512, 32, 32, 32, 512]
    - [11, 379.0]
  - - [32, 512, 8, 32, 32, 32, 32, 32]
    - [5, 528.0]
  - - [32, 512, 8, 64, 32, 32, 32, 64]
    - [5, 613.0]
  - - [32, 512, 8, 128, 32, 32, 32, 128]
    - [8, 547.0]
  - - [32, 512, 8, 256, 32, 32, 32, 256]
    - [11, 467.0]
  - - [32, 512, 8, 512, 32, 32, 32, 512]
    - [11, 425.0]
  - - [64, 32, 8, 32, 64, 64, 64, 32]
    - [8, 78.0]
  - - [64, 32, 8, 64, 64, 64, 64, 64]
    - [0, 104.0]
  - - [64, 32, 8, 128, 64, 64, 64, 128]
    - [8, 126.0]
  - - [64, 32, 8, 256, 64, 64, 64, 256]
    - [0, 138.0]
  - - [64, 32, 8, 512, 64, 64, 64, 512]
    - [0, 145.0]
  - - [64, 64, 8, 32, 64, 64, 64, 32]
    - [0, 160.0]
  - - [64, 64, 8, 64, 64, 64, 64, 64]
    - [0, 211.0]
  - - [64, 64, 8, 128, 64, 64, 64, 128]
    - [0, 251.0]
  - - [64, 64, 8, 256, 64, 64, 64, 256]
    - [0, 277.0]
  - - [64, 64, 8, 512, 64, 64, 64, 512]
    - [8, 288.0]
  - - [64, 128, 8, 32, 64, 64, 64, 32]
    - [0, 312.0]
  - - [64, 128, 8, 64, 64, 64, 64, 64]
    - [2, 402.0]
  - - [64, 128, 8, 128, 64, 64, 64, 128]
    - [9, 481.0]
  - - [64, 128, 8, 256, 64, 64, 64, 256]
    - [9, 513.0]
  - - [64, 128, 8, 512, 64, 64, 64, 512]
    - [6, 462.0]
  - - [64, 256, 8, 32, 64, 64, 64, 32]
    - [2, 575.0]
  - - [64, 256, 8, 64, 64, 64, 64, 64]
    - [2, 670.0]
  - - [64, 256, 8, 128, 64, 64, 64, 128]
    - [9, 723.0]
  - - [64, 256, 8, 256, 64, 64, 64, 256]
    - [6, 680.0]
  - - [64, 256, 8, 512, 64, 64, 64, 512]
    - [6, 719.0]
  - - [64, 512, 8, 32, 64, 64, 64, 32]
    - [2, 770.0]
  - - [64, 512, 8, 64, 64, 64, 64, 64]
    - [2, 830.0]
  - - [64, 512, 8, 128, 64, 64, 64, 128]
    - [4, 736.0]
  - - [64, 512, 8, 256, 64, 64, 64, 256]
    - [9, 747.0]
  - - [64, 512, 8, 512, 64, 64, 64, 512]
    - [12, 708.0]
  - - [128, 32, 8, 32, 128, 128, 128, 32]
    - [0, 161.0]
  - - [128, 32, 8, 64, 128, 128, 128, 64]
    - [0, 211.0]
  - - [128, 32, 8, 128, 128, 128, 128, 128]
    - [0, 251.0]
  - - [128, 32, 8, 256, 128, 128, 128, 256]
    - [0, 277.0]
  - - [128, 32, 8, 512, 128, 128, 128, 512]
    - [0, 287.0]
  - - [128, 64, 8, 32, 128, 128, 128, 32]
    - [0, 305.0]
  - - [128, 64, 8, 64, 128, 128, 128, 64]
    - [2, 401.0]
  - - [128, 64, 8, 128, 128, 128, 128, 128]
    - [2, 480.0]
  - - [128, 64, 8, 256, 128, 128, 128, 256]
    - [9, 521.0]
  - - [128, 64, 8, 512, 128, 128, 128, 512]
    - [9, 519.0]
  - - [128, 128, 8, 32, 128, 128, 128, 32]
    - [2, 556.0]
  - - [128, 128, 8, 64, 128, 128, 128, 64]
    - [2, 671.0]
  - - [128, 128, 8, 128, 128, 128, 128, 128]
    - [12, 746.0]
  - - [128, 128, 8, 256, 128, 128, 128, 256]
    - [6, 876.0]
  - - [128, 128, 8, 512, 128, 128, 128, 512]
    - [12, 817.0]
  - - [128, 256, 8, 32, 128, 128, 128, 32]
    - [2, 785.0]
  - - [128, 256, 8, 64, 128, 128, 128, 64]
    - [2, 853.0]
  - - [128, 256, 8, 128, 128, 128, 128, 128]
    - [4, 853.0]
  - - [128, 256, 8, 256, 128, 128, 128, 256]
    - [10, 873.0]
  - - [128, 256, 8, 512, 128, 128, 128, 512]
    - [12, 873.0]
  - - [128, 512, 8, 32, 128, 128, 128, 32]
    - [2, 868.0]
  - - [128, 512, 8, 64, 128, 128, 128, 64]
    - [2, 973.0]
  - - [128, 512, 8, 128, 128, 128, 128, 128]
    - [2, 1068.0]
  - - [128, 512, 8, 256, 128, 128, 128, 256]
    - [9, 1075.0]
  - - [128, 512, 8, 512, 128, 128, 128, 512]
    - [2, 963.0]
  - - [256, 32, 8, 32, 256, 256, 256, 32]
    - [8, 297.0]
  - - [256, 32, 8, 64, 256, 256, 256, 64]
    - [0, 372.0]
  - - [256, 32, 8, 128, 256, 256, 256, 128]
    - [0, 420.0]
  - - [256, 32, 8, 256, 256, 256, 256, 256]
    - [8, 507.0]
  - - [256, 32, 8, 512, 256, 256, 256, 512]
    - [5, 523.0]
  - - [256, 64, 8, 32, 256, 256, 256, 32]
    - [2, 541.0]
  - - [256, 64, 8, 64, 256, 256, 256, 64]
    - [9, 666.0]
  - - [256, 64, 8, 128, 256, 256, 256, 128]
    - [9, 737.0]
  - - [256, 64, 8, 256, 256, 256, 256, 256]
    - [6, 778.0]
  - - [256, 64, 8, 512, 256, 256, 256, 512]
    - [12, 882.0]
  - - [256, 128, 8, 32, 256, 256, 256, 32]
    - [2, 772.0]
  - - [256, 128, 8, 64, 256, 256, 256, 64]
    - [0, 860.0]
  - - [256, 128, 8, 128, 256, 256, 256, 128]
    - [2, 850.0]
  - - [256, 128, 8, 256, 256, 256, 256, 256]
    - [10, 1008.0]
  - - [256, 128, 8, 512, 256, 256, 256, 512]
    - [3, 1022.0]
  - - [256, 256, 8, 32, 256, 256, 256, 32]
    - [2, 919.0]
  - - [256, 256, 8, 64, 256, 256, 256, 64]
    - [14, 951.0]
  - - [256, 256, 8, 128, 256, 256, 256, 128]
    - [9, 1082.0]
  - - [256, 256, 8, 256, 256, 256, 256, 256]
    - [2, 1142.0]
  - - [256, 256, 8, 512, 256, 256, 256, 512]
    - [9, 1136.0]
  - - [256, 512, 8, 32, 256, 256, 256, 32]
    - [9, 1035.0]
  - - [256, 512, 8, 64, 256, 256, 256, 64]
    - [2, 1163.0]
  - - [256, 512, 8, 128, 256, 256, 256, 128]
    - [2, 1230.0]
  - - [256, 512, 8, 256, 256, 256, 256, 256]
    - [9, 1405.0]
  - - [256, 512, 8, 512, 256, 256, 256, 512]
    - [9, 1230.0]
  - - [512, 32, 8, 32, 512, 512, 512, 32]
    - [8, 494.0]
  - - [512, 32, 8, 64, 512, 512, 512, 64]
    - [13, 576.0]
  - - [512, 32, 8, 128, 512, 512, 512, 128]
    - [5, 660.0]
  - - [512, 32, 8, 256, 512, 512, 512, 256]
    - [5, 764.0]
  - - [512, 32, 8, 512, 512, 512, 512, 512]
    - [5, 835.0]
  - - [512, 64, 8, 32, 512, 512, 512, 32]
    - [2, 746.0]
  - - [512, 64, 8, 64, 512, 512, 512, 64]
    - [12, 820.0]
  - - [512, 64, 8, 128, 512, 512, 512, 128]
    - [3, 844.0]
  - - [512, 64, 8, 256, 512, 512, 512, 256]
    - [3, 952.0]
  - - [512, 64, 8, 512, 512, 512, 512, 512]
    - [3, 1046.0]
  - - [512, 128, 8, 32, 512, 512, 512, 32]
    - [9, 824.0]
  - - [512, 128, 8, 64, 512, 512, 512, 64]
    - [2, 977.0]
  - - [512, 128, 8, 128, 512, 512, 512, 128]
    - [9, 1091.0]
  - - [512, 128, 8, 256, 512, 512, 512, 256]
    - [9, 1162.0]
  - - [512, 128, 8, 512, 512, 512, 512, 512]
    - [2, 1221.0]
  - - [512, 256, 8, 32, 512, 512, 512, 32]
    - [2, 939.0]
  - - [512, 256, 8, 64, 512, 512, 512, 64]
    - [7, 1147.0]
  - - [512, 256, 8, 128, 512, 512, 512, 128]
    - [9, 1325.0]
  - - [512, 256, 8, 256, 512, 512, 512, 256]
    - [9, 1380.0]
  - - [512, 256, 8, 512, 512, 512, 512, 512]
    - [14, 1464.0]
  - - [512, 512, 8, 32, 512, 512, 512, 32]
    - [6, 1039.0]
  - - [512, 512, 8, 64, 512, 512, 512, 64]
    - [12, 1259.0]
  - - [512, 512, 8, 128, 512, 512, 512, 128]
    - [1, 1405.0]
  - - [512, 512, 8, 256, 512, 512, 512, 256]
    - [9, 1482.0]
  - - [512, 512, 8, 512, 512, 512, 512, 512]
    - [7, 1528.0]
- null
