library/src/blas3/Tensile/Logic/asm_full/vega10_Cijk_Alik_Bljk_HB.yaml
- {MinimumRequiredVersion: 4.3.0}
- vega10
- gfx900
- [Device 6863, Device 6862, Device 687f, Device 6860, Device 6861, 'Vega 10 XTX [Radeon
    SolutionIndex: 0
    SolutionNameMin: Cijk_Alik_Bljk_HB_MT256x064x32_PGR1_PLR1_TT08_08
    SolutionIndex: 1
    SolutionNameMin: Cijk_Alik_Bljk_HB_MT032x016x16_PGR1_PLR1_TT02_02
    SolutionIndex: 2
    SolutionNameMin: Cijk_Alik_Bljk_HB_MT064x032x32_PGR1_PLR1_TT04_04
    SolutionIndex: 3
    SolutionNameMin: Cijk_Alik_Bljk_HB_MT016x016x32_PGR1_PLR1_TT02_02
    SolutionIndex: 4
    SolutionNameMin: Cijk_Alik_Bljk_HB_MT032x032x32_PGR1_PLR1_TT04_04
    SolutionIndex: 5
    SolutionNameMin: Cijk_Alik_Bljk_HB_MT016x016x16_PGR1_PLR1_TT02_02
    SolutionIndex: 6
    SolutionNameMin: Cijk_Alik_Bljk_HB_MT032x032x16_PGR1_PLR1_TT04_04
    SolutionIndex: 7
    SolutionNameMin: Cijk_Alik_Bljk_HB_MT048x032x24_PGR1_PLR1_TT06_04
    SolutionIndex: 8
    SolutionNameMin: Cijk_Alik_Bljk_HB_MT032x032x24_PGR1_PLR1_TT04_04
    SolutionIndex: 9
    SolutionNameMin: Cijk_Alik_Bljk_HB_MT032x016x24_PGR1_PLR1_TT04_02
    SolutionIndex: 10
    SolutionNameMin: Cijk_Alik_Bljk_HB_MT032x032x24_PGR1_PLR1_TT04_04
    SolutionIndex: 11
    SolutionNameMin: Cijk_Alik_Bljk_HB_MT128x032x32_PGR1_PLR1_TT04_04
    SolutionIndex: 12
    SolutionNameMin: Cijk_Alik_Bljk_HB_MT032x016x32_PGR1_PLR1_TT02_02
    SolutionIndex: 13
    SolutionNameMin: Cijk_Alik_Bljk_HB_MT064x064x32_PGR1_PLR1_TT08_08
    SolutionIndex: 14
    SolutionNameMin: Cijk_Alik_Bljk_HB_MT064x032x32_PGR1_PLR1_TT04_04
    SolutionIndex: 15
    SolutionNameMin: Cijk_Alik_Bljk_HB_MT016x016x24_PGR1_PLR1_TT02_02
    SolutionIndex: 16
    SolutionNameMin: Cijk_Alik_Bljk_HB_MT016x016x24_PGR1_PLR1_TT02_02
    SolutionIndex: 17
    SolutionNameMin: Cijk_Alik_Bljk_HB_MT032x032x16_PGR1_PLR1_TT04_04
    SolutionIndex: 18
    SolutionNameMin: Cijk_Alik_Bljk_HB_MT064x064x32_PGR1_PLR1_TT04_04
    SolutionIndex: 19
    SolutionNameMin: Cijk_Alik_Bljk_HB_MT128x128x32_PGR1_PLR1_TT08_08
    SolutionIndex: 20
    SolutionNameMin: Cijk_Alik_Bljk_HB_MT128x064x16_PGR1_PLR1_TT08_04
    SolutionIndex: 21
    SolutionNameMin: Cijk_Alik_Bljk_HB_MT128x064x08_PGR1_PLR1_TT08_04
    SolutionIndex: 22
    SolutionNameMin: Cijk_Alik_Bljk_HB_MT064x064x16_PGR1_PLR1_TT04_04
    SolutionIndex: 23
    SolutionNameMin: Cijk_Alik_Bljk_HB_MT128x128x08_PGR1_PLR1_TT08_08
    SolutionIndex: 24
    SolutionNameMin: Cijk_Alik_Bljk_HB_MT128x128x16_PGR1_PLR1_TT08_08
    SolutionIndex: 25
    SolutionNameMin: Cijk_Alik_Bljk_HB_MT064x064x04_PGR0_PLR0_TT04_04
    SolutionIndex: 26
    SolutionNameMin: Cijk_Alik_Bljk_HB_MT064x064x08_PGR1_PLR1_TT04_04
    SolutionIndex: 27
    SolutionNameMin: Cijk_Alik_Bljk_HB_MT064x064x08_PGR1_PLR1_TT04_04
    SolutionIndex: 28
    SolutionNameMin: Cijk_Alik_Bljk_HB_MT064x064x04_PGR0_PLR0_TT04_04
- - - [4096, 7000, 1, 4096]
    - [19, 16864.4]
  - - [7680, 12000, 1, 2560]
    - [24, 21726.0]
  - - [5124, 9124, 1, 1760]
    - [24, 20948.2]
  - - [1760, 32, 1, 1760]
    - [16, 2760.16]
  - - [512, 24000, 1, 1536]
    - [24, 18947.2]
  - - [3072, 24000, 1, 1024]
    - [24, 18948.5]
  - - [2048, 400, 1, 512]
    - [24, 8425.79]
  - - [2560, 7000, 1, 2560]
    - [24, 19710.9]
  - - [3072, 16, 1, 1024]
    - [16, 1361.08]
  - - [512, 48000, 1, 2816]
    - [24, 21280.4]
  - - [512, 48000, 1, 2048]
    - [19, 15888.7]
  - - [1760, 64, 1, 1760]
    - [16, 4518.25]
  - - [35, 8457, 1, 4096]
    - [7, 0.0]
  - - [2048, 1600, 1, 2048]
    - [18, 9594.24]
  - - [512, 48000, 1, 1536]
    - [24, 20139.6]
  - - [2560, 32, 1, 2560]
    - [16, 3273.08]
  - - [8448, 5984, 1, 2816]
    - [24, 21675.2]
  - - [4096, 3200, 1, 1024]
    - [19, 15427.3]
  - - [1024, 24000, 1, 2560]
    - [24, 19793.8]
  - - [1760, 6400, 1, 1760]
    - [23, 20963.7]
  - - [1024, 700, 1, 512]
    - [18, 8217.92]
  - - [4608, 32, 1, 1536]
    - [10, 3971.28]
  - - [3072, 64, 1, 1024]
    - [14, 3495.14]
  - - [16384, 3200, 1, 4096]
    - [19, 16083.7]
  - - [2560, 16, 1, 2560]
    - [16, 1836.25]
  - - [1024, 48000, 1, 2560]
    - [24, 21078.1]
  - - [35, 8457, 1, 2560]
    - [7, 0.0]
  - - [8448, 48000, 1, 2816]
    - [24, 22267.3]
  - - [2048, 32, 1, 2048]
    - [15, 1692.71]
  - - [2560, 3200, 1, 2560]
    - [19, 17560.0]
  - - [16384, 800, 1, 4096]
    - [19, 13902.3]
  - - [4608, 24000, 1, 1536]
    - [24, 21585.9]
  - - [7680, 48000, 1, 2560]
    - [24, 22177.9]
  - - [3072, 48000, 1, 1024]
    - [24, 20608.1]
  - - [1760, 16, 1, 1760]
    - [16, 1442.93]
  - - [8192, 3200, 1, 2048]
    - [19, 15254.6]
  - - [512, 24000, 1, 2816]
    - [24, 20855.5]
  - - [4096, 400, 1, 1024]
    - [19, 10439.0]
  - - [6144, 48000, 1, 2560]
    - [24, 21778.0]
  - - [4608, 48000, 1, 1536]
    - [24, 22055.0]
  - - [35, 8457, 1, 2048]
    - [7, 0.0]
  - - [4096, 128, 1, 4096]
    - [0, 4805.55]
  - - [2048, 800, 1, 512]
    - [24, 11097.0]
  - - [4608, 5984, 1, 1536]
    - [24, 20026.1]
  - - [2560, 128, 1, 2560]
    - [17, 6560.7]
  - - [6144, 5984, 1, 2048]
    - [19, 16407.4]
  - - [35, 8457, 1, 1760]
    - [7, 0.0]
  - - [7680, 24000, 1, 2560]
    - [24, 21973.8]
  - - [6144, 48000, 1, 2048]
    - [19, 18511.2]
  - - [5124, 9124, 1, 2560]
    - [24, 20348.1]
  - - [2048, 3200, 1, 2048]
    - [19, 11161.3]
  - - [2048, 16, 1, 2048]
    - [12, 900.467]
  - - [1024, 24000, 1, 1536]
    - [24, 19932.2]
  - - [7680, 16, 1, 2560]
    - [3, 2666.4]
  - - [2560, 6400, 1, 2560]
    - [19, 17927.0]
  - - [2048, 128, 1, 2048]
    - [11, 3182.77]
  - - [512, 16, 1, 500000]
    - [5, 464.315]
  - - [1024, 8, 1, 500000]
    - [5, 461.991]
  - - [512, 24000, 1, 2560]
    - [24, 19630.9]
  - - [1024, 24000, 1, 2816]
    - [24, 21325.0]
  - - [7680, 5984, 1, 2560]
    - [24, 21053.9]
  - - [2048, 1600, 1, 512]
    - [19, 11644.7]
  - - [2048, 7000, 1, 2048]
    - [19, 14042.8]
  - - [1760, 800, 1, 1760]
    - [21, 14188.5]
  - - [5124, 9124, 1, 4096]
    - [19, 17266.4]
  - - [4096, 64, 1, 4096]
    - [4, 3626.09]
  - - [7680, 32, 1, 2560]
    - [17, 4777.04]
  - - [2560, 64, 1, 2560]
    - [17, 5133.22]
  - - [3072, 128, 1, 1024]
    - [11, 5301.63]
  - - [7680, 64, 1, 2560]
    - [10, 7311.65]
  - - [1760, 128, 1, 1760]
    - [8, 7222.15]
  - - [2560, 1600, 1, 2560]
    - [24, 14294.9]
  - - [2048, 3200, 1, 512]
    - [19, 14186.5]
  - - [2560, 800, 1, 2560]
    - [24, 12510.7]
  - - [3072, 32, 1, 1024]
    - [3, 2164.42]
  - - [6144, 32, 1, 2560]
    - [6, 4482.38]
  - - [4608, 12000, 1, 1536]
    - [24, 21187.4]
  - - [4096, 32, 1, 4096]
    - [2, 2366.62]
  - - [6144, 24000, 1, 2048]
    - [19, 18237.3]
  - - [8192, 800, 1, 2048]
    - [19, 11788.0]
  - - [4096, 1600, 1, 1024]
    - [19, 13427.6]
  - - [5124, 9124, 1, 2048]
    - [19, 16372.0]
  - - [8448, 24000, 1, 2816]
    - [24, 22242.6]
  - - [1024, 48000, 1, 1536]
    - [24, 21011.8]
  - - [7680, 128, 1, 2560]
    - [13, 12967.5]
  - - [8192, 1600, 1, 2048]
    - [19, 13302.9]
  - - [4096, 800, 1, 1024]
    - [19, 11670.6]
  - - [1024, 16, 1, 500000]
    - [5, 923.338]
  - - [2048, 800, 1, 2048]
    - [18, 7529.04]
  - - [1760, 3200, 1, 1760]
    - [23, 18694.7]
  - - [512, 48000, 1, 2560]
    - [24, 20636.1]
  - - [8448, 16, 1, 2816]
    - [9, 3537.67]
  - - [2048, 64, 1, 2048]
    - [3, 2501.5]
  - - [512, 24000, 1, 2048]
    - [19, 13453.3]
  - - [16384, 1600, 1, 4096]
    - [19, 15082.3]
  - - [4608, 16, 1, 1536]
    - [15, 2345.32]
  - - [1024, 24000, 1, 2048]
    - [19, 15282.1]
  - - [8192, 400, 1, 2048]
    - [18, 8668.84]
  - - [2048, 6400, 1, 2048]
    - [19, 13576.1]
  - - [6144, 12000, 1, 2048]
    - [19, 17493.3]
  - - [512, 8, 1, 500000]
    - [5, 232.619]
  - - [1760, 7000, 1, 1760]
    - [23, 19435.6]
  - - [1024, 48000, 1, 2816]
    - [24, 22085.0]
  - - [6144, 16, 1, 2560]
    - [1, 2469.54]
  - - [8448, 32, 1, 2816]
    - [6, 5960.46]
  - - [4096, 16, 1, 4096]
    - [12, 1372.14]
  - - [6144, 24000, 1, 2560]
    - [24, 21485.2]
  - - [1024, 1024, 1, 1024]
    - [19, 9933.58]
  - - [8448, 12000, 1, 2816]
    - [24, 22202.5]
  - - [16384, 400, 1, 4096]
    - [19, 10824.9]
  - - [1760, 1600, 1, 1760]
    - [23, 17315.3]
  - - [1024, 48000, 1, 2048]
    - [19, 17211.0]
- - - -1
    - - - 1
        - - - 32
            - - [2368, 28]
              - [2944, 27]
              - [-1, 28]
          - - 64
            - - [128, 28]
              - [256, 27]
              - [-1, 28]
          - - 128
            - - [-1, 28]
          - - 256
            - - [704, 28]
              - [1024, 27]
              - [-1, 28]
          - - 448
            - - [32, 27]
              - [-1, 28]
          - - 704
            - - [32, 28]
              - [64, 27]
              - [-1, 28]
          - - 1856
            - - [-1, 28]
          - - 2368
            - - [64, 28]
              - [128, 27]
              - [-1, 28]
          - - -1
            - - [-1, 28]
      - - 32
        - - - 32
            - - [32, 25]
              - [2368, 26]
              - [2944, 25]
              - [3584, 26]
              - [4288, 25]
              - [5056, 26]
              - [-1, 25]
          - - 64
            - - [5056, 26]
              - [-1, 25]
          - - 128
            - - [5888, 26]
              - [-1, 25]
          - - 256
            - - [1408, 26]
              - [1856, 25]
              - [2944, 26]
              - [-1, 25]
          - - 448
            - - [32, 26]
              - [64, 25]
              - [648, 26]
              - [704, 25]
              - [1408, 26]
              - [-1, 25]
          - - 704
            - - [64, 25]
              - [704, 26]
              - [1024, 25]
              - [1408, 26]
              - [-1, 25]
          - - 1024
            - - [64, 25]
              - [128, 26]
              - [256, 25]
              - [704, 26]
              - [-1, 25]
          - - 1408
            - - [32, 25]
              - [704, 26]
              - [-1, 25]
          - - 1856
            - - [648, 26]
              - [-1, 25]
          - - 2368
            - - [256, 26]
              - [-1, 25]
          - - 3584
            - - [64, 25]
              - [128, 26]
              - [-1, 25]
          - - 4288
            - - [32, 26]
              - [64, 25]
              - [128, 26]
              - [-1, 25]
          - - 5056
            - - [32, 26]
              - [-1, 25]
          - - 5888
            - - [32, 26]
              - [64, 25]
              - [128, 26]
              - [-1, 25]
          - - -1
            - - [32, 25]
              - [64, 26]
              - [-1, 25]
      - - 256
        - - - 1
            - - [-1, 27]
          - - 32
            - - [-1, 26]
          - - 64
            - - [1, 27]
              - [32, 26]
              - [1856, 5]
              - [2368, 15]
              - [5056, 6]
              - [-1, 22]
          - - 128
            - - [1, 27]
              - [32, 26]
              - [1024, 5]
              - [1408, 15]
              - [2944, 6]
              - [5888, 22]
              - [-1, 20]
          - - 256
            - - [1, 27]
              - [32, 26]
              - [648, 5]
              - [704, 17]
              - [2944, 22]
              - [5888, 20]
              - [-1, 24]
          - - 448
            - - [1, 27]
              - [32, 26]
              - [128, 5]
              - [256, 16]
              - [648, 17]
              - [1408, 22]
              - [2944, 20]
              - [3584, 24]
              - [4288, 22]
              - [-1, 24]
          - - 704
            - - [1, 27]
              - [32, 26]
              - [64, 5]
              - [128, 1]
              - [256, 17]
              - [1408, 22]
              - [1856, 20]
              - [2368, 24]
              - [2944, 22]
              - [-1, 24]
          - - 1024
            - - [1, 27]
              - [32, 26]
              - [128, 5]
              - [704, 22]
              - [1408, 20]
              - [1856, 24]
              - [2368, 20]
              - [-1, 24]
          - - 1408
            - - [1, 27]
              - [32, 26]
              - [64, 1]
              - [128, 6]
              - [648, 22]
              - [1024, 20]
              - [-1, 24]
          - - 1856
            - - [1, 27]
              - [32, 26]
              - [64, 16]
              - [128, 17]
              - [256, 22]
              - [704, 20]
              - [-1, 24]
          - - 2368
            - - [1, 27]
              - [32, 26]
              - [64, 16]
              - [256, 22]
              - [648, 20]
              - [704, 24]
              - [1024, 20]
              - [-1, 24]
          - - 2944
            - - [1, 27]
              - [32, 26]
              - [64, 6]
              - [256, 22]
              - [704, 20]
              - [-1, 24]
          - - 3584
            - - [1, 27]
              - [32, 26]
              - [64, 17]
              - [128, 22]
              - [256, 20]
              - [648, 24]
              - [704, 20]
              - [-1, 24]
          - - 4288
            - - [1, 27]
              - [32, 26]
              - [64, 17]
              - [128, 22]
              - [704, 20]
              - [-1, 24]
          - - 5056
            - - [1, 27]
              - [32, 26]
              - [64, 17]
              - [256, 22]
              - [648, 20]
              - [-1, 24]
          - - 5888
            - - [1, 27]
              - [32, 26]
              - [128, 22]
              - [256, 20]
              - [648, 24]
              - [704, 20]
              - [-1, 24]
          - - -1
            - - [1, 27]
              - [32, 26]
              - [64, 22]
              - [128, 20]
              - [256, 24]
              - [648, 20]
              - [-1, 24]
      - - 1280
        - - - 1
            - - [-1, 27]
          - - 32
            - - [-1, 26]
          - - 64
            - - [1, 27]
              - [32, 26]
              - [64, 5]
              - [1856, 15]
              - [2368, 8]
              - [3584, 6]
              - [5056, 8]
              - [-1, 22]
          - - 128
            - - [1, 27]
              - [32, 26]
              - [256, 16]
              - [648, 15]
              - [704, 16]
              - [1024, 15]
              - [1408, 17]
              - [1856, 8]
              - [2368, 10]
              - [2944, 8]
              - [5888, 22]
              - [-1, 20]
          - - 256
            - - [1, 27]
              - [32, 26]
              - [128, 16]
              - [256, 15]
              - [648, 16]
              - [704, 10]
              - [1024, 17]
              - [2944, 22]
              - [3584, 20]
              - [5056, 22]
              - [5888, 20]
              - [-1, 24]
          - - 448
            - - [1, 27]
              - [32, 26]
              - [256, 16]
              - [648, 10]
              - [1408, 22]
              - [1856, 20]
              - [2368, 22]
              - [2944, 20]
              - [3584, 24]
              - [4288, 22]
              - [5056, 20]
              - [-1, 24]
          - - 704
            - - [1, 27]
              - [32, 26]
              - [128, 16]
              - [648, 17]
              - [1856, 22]
              - [2368, 24]
              - [2944, 22]
              - [-1, 24]
          - - 1024
            - - [1, 27]
              - [32, 26]
              - [64, 15]
              - [128, 16]
              - [256, 17]
              - [704, 22]
              - [1408, 20]
              - [1856, 24]
              - [2368, 20]
              - [-1, 24]
          - - 1408
            - - [1, 27]
              - [32, 26]
              - [64, 16]
              - [128, 17]
              - [256, 10]
              - [648, 22]
              - [1024, 20]
              - [1408, 24]
              - [1856, 20]
              - [-1, 24]
          - - 1856
            - - [1, 27]
              - [32, 26]
              - [64, 16]
              - [128, 10]
              - [256, 22]
              - [648, 20]
              - [704, 22]
              - [-1, 24]
          - - 2368
            - - [1, 27]
              - [32, 26]
              - [64, 6]
              - [128, 10]
              - [648, 22]
              - [704, 24]
              - [1024, 20]
              - [-1, 24]
          - - 2944
            - - [1, 27]
              - [32, 26]
              - [64, 17]
              - [256, 22]
              - [704, 20]
              - [-1, 24]
          - - 3584
            - - [1, 27]
              - [32, 26]
              - [64, 17]
              - [128, 22]
              - [256, 20]
              - [648, 24]
              - [704, 20]
              - [-1, 24]
          - - 4288
            - - [1, 27]
              - [32, 26]
              - [64, 10]
              - [256, 22]
              - [704, 20]
              - [-1, 24]
          - - 5056
            - - [1, 27]
              - [32, 26]
              - [64, 17]
              - [256, 22]
              - [648, 20]
              - [-1, 24]
          - - 5888
            - - [1, 27]
              - [32, 26]
              - [64, 17]
              - [128, 22]
              - [256, 20]
              - [648, 24]
              - [704, 20]
              - [-1, 24]
          - - -1
            - - [1, 27]
              - [32, 26]
              - [64, 22]
              - [128, 20]
              - [256, 24]
              - [648, 20]
              - [-1, 24]
      - - -1
        - - - 1
            - - [-1, 27]
          - - 32
            - - [-1, 26]
          - - 64
            - - [1, 27]
              - [32, 26]
              - [1024, 15]
              - [1408, 16]
              - [1856, 15]
              - [2944, 8]
              - [3584, 6]
              - [4288, 8]
              - [5056, 10]
              - [-1, 22]
          - - 128
            - - [1, 27]
              - [32, 26]
              - [1024, 15]
              - [2944, 8]
              - [5888, 22]
              - [-1, 24]
          - - 256
            - - [1, 27]
              - [32, 26]
              - [648, 15]
              - [1408, 10]
              - [2944, 22]
              - [3584, 24]
              - [5056, 22]
              - [5888, 20]
              - [-1, 24]
          - - 448
            - - [1, 27]
              - [32, 26]
              - [64, 15]
              - [256, 16]
              - [648, 17]
              - [704, 10]
              - [1408, 22]
              - [1856, 24]
              - [2368, 22]
              - [2944, 20]
              - [3584, 24]
              - [4288, 22]
              - [5056, 20]
              - [-1, 24]
          - - 704
            - - [1, 27]
              - [32, 26]
              - [64, 15]
              - [128, 16]
              - [648, 10]
              - [1024, 22]
              - [1408, 13]
              - [1856, 22]
              - [2368, 24]
              - [2944, 22]
              - [-1, 24]
          - - 1024
            - - [1, 27]
              - [32, 26]
              - [64, 15]
              - [128, 16]
              - [256, 10]
              - [704, 22]
              - [1024, 24]
              - [1408, 20]
              - [1856, 24]
              - [2368, 20]
              - [-1, 24]
          - - 1408
            - - [1, 27]
              - [32, 26]
              - [64, 16]
              - [256, 10]
              - [648, 22]
              - [1024, 20]
              - [1408, 24]
              - [1856, 20]
              - [-1, 24]
          - - 1856
            - - [1, 27]
              - [32, 26]
              - [64, 16]
              - [128, 10]
              - [256, 22]
              - [648, 24]
              - [704, 22]
              - [-1, 24]
          - - 2368
            - - [1, 27]
              - [32, 26]
              - [64, 8]
              - [128, 10]
              - [648, 22]
              - [704, 24]
              - [1024, 20]
              - [-1, 24]
          - - 2944
            - - [1, 27]
              - [32, 26]
              - [128, 10]
              - [256, 22]
              - [704, 20]
              - [-1, 24]
          - - 3584
            - - [1, 27]
              - [32, 26]
              - [64, 10]
              - [128, 22]
              - [648, 24]
              - [704, 20]
              - [-1, 24]
          - - 4288
            - - [1, 27]
              - [32, 26]
              - [64, 10]
              - [256, 22]
              - [704, 20]
              - [-1, 24]
          - - 5056
            - - [1, 27]
              - [32, 26]
              - [64, 10]
              - [256, 22]
              - [648, 20]
              - [-1, 24]
          - - 5888
            - - [1, 27]
              - [32, 26]
              - [64, 10]
              - [128, 22]
              - [256, 20]
              - [648, 24]
              - [704, 20]
              - [-1, 24]
          - - -1
            - - [1, 27]
              - [32, 26]
              - [64, 22]
              - [128, 20]
              - [256, 24]
              - [648, 20]
              - [-1, 24]
