library/src/blas3/Tensile/Logic/asm_full/vega10_Cijk_Ailk_Bljk_SB.yaml
- {MinimumRequiredVersion: 4.0.2}
- vega10
- gfx900
- [Device 6863, Device 6862, Device 687f, Device 6860]
- - - [4096, 7000, 1, 4096]
    - [61, 11422.1]
  - - [5124, 9124, 1, 1760]
    - [58, 11499.4]
  - - [5124, 9124, 1, 2560]
    - [61, 11315.3]
  - - [1760, 32, 1, 1760]
    - [50, 2908.97]
  - - [1024, 1500, 1, 1536]
    - [67, 9221.04]
  - - [512, 24000, 1, 1536]
    - [61, 11046.9]
  - - [3072, 24000, 1, 1024]
    - [61, 11231.3]
  - - [1024, 3000, 1, 2560]
    - [62, 10497.9]
  - - [512, 3136, 1, 2048]
    - [72, 477331.0]
  - - [7680, 4, 1, 2560]
    - [26, 546.116]
  - - [35, 1500, 1, 2048]
    - [28, 2027.19]
  - - [8448, 1500, 1, 2816]
    - [58, 11233.2]
  - - [784, 512, 64, 128]
    - [75, 7235.71]
  - - [2560, 7000, 1, 2560]
    - [58, 11337.2]
  - - [3072, 16, 1, 1024]
    - [36, 1591.21]
  - - [512, 48000, 1, 2048]
    - [56, 9833.93]
  - - [1760, 64, 1, 1760]
    - [15, 4779.04]
  - - [1024, 16, 1, 512]
    - [22, 674.054]
  - - [196, 256, 64, 1024]
    - [78, 5739.73]
  - - [512, 48000, 1, 1536]
    - [61, 11336.6]
  - - [2560, 32, 1, 2560]
    - [43, 3574.58]
  - - [4608, 1500, 1, 1536]
    - [61, 10282.9]
  - - [2048, 128, 1, 2048]
    - [19, 6090.39]
  - - [1024, 24000, 1, 2560]
    - [61, 11410.5]
  - - [4608, 3000, 1, 1536]
    - [62, 10709.7]
  - - [5124, 9124, 1, 2048]
    - [61, 10354.2]
  - - [1024, 700, 1, 512]
    - [53, 5801.39]
  - - [3072, 1, 1, 128]
    - [20, 34.923]
  - - [5124, 700, 1, 2560]
    - [53, 9994.02]
  - - [8448, 16, 1, 2816]
    - [48, 2091.32]
  - - [6144, 6000, 1, 2560]
    - [61, 11590.3]
  - - [4608, 32, 1, 1536]
    - [35, 3482.41]
  - - [35, 8457, 1, 2560]
    - [9, 3627.4]
  - - [3072, 64, 1, 1024]
    - [31, 3985.09]
  - - [512, 16, 1, 512]
    - [22, 390.495]
  - - [7680, 2, 1, 2560]
    - [25, 275.181]
  - - [4224, 1, 1, 128]
    - [49, 42.4356]
  - - [7680, 1, 1, 2560]
    - [20, 137.733]
  - - [128, 1500, 1, 1280]
    - [47, 5291.36]
  - - [35, 8457, 1, 4096]
    - [10, 3369.05]
  - - [1024, 1500, 1, 2816]
    - [58, 10128.5]
  - - [6144, 2, 1, 2560]
    - [38, 263.437]
  - - [8448, 48000, 1, 2816]
    - [61, 12070.7]
  - - [512, 6000, 1, 1536]
    - [55, 10003.0]
  - - [4224, 1500, 1, 176]
    - [59, 7087.5]
  - - [1024, 6000, 1, 2816]
    - [61, 11156.0]
  - - [512, 6000, 1, 2560]
    - [55, 10376.8]
  - - [512, 32, 1, 512]
    - [32, 740.128]
  - - [2560, 128, 1, 2560]
    - [46, 6955.93]
  - - [4608, 24000, 1, 1536]
    - [61, 11676.2]
  - - [512, 2, 1, 500000]
    - [0, 307.163]
  - - [7680, 48000, 1, 2560]
    - [61, 12096.8]
  - - [3072, 48000, 1, 1024]
    - [61, 11407.6]
  - - [1760, 16, 1, 1760]
    - [21, 1631.85]
  - - [512, 3000, 1, 2816]
    - [60, 10097.0]
  - - [1760, 7000, 1, 1760]
    - [60, 11067.9]
  - - [64, 193600, 1, 256]
    - [70, 308060.0]
  - - [1024, 3000, 1, 2048]
    - [55, 9122.65]
  - - [6144, 4, 1, 2560]
    - [44, 526.874]
  - - [1024, 6000, 1, 2048]
    - [66, 9499.15]
  - - [512, 24000, 1, 2816]
    - [61, 11523.2]
  - - [6144, 48000, 1, 2560]
    - [61, 11989.5]
  - - [8448, 3000, 1, 2816]
    - [58, 11590.6]
  - - [35, 1500, 1, 2560]
    - [12, 2584.52]
  - - [3072, 4, 1, 1024]
    - [21, 424.661]
  - - [4608, 48000, 1, 1536]
    - [61, 11827.6]
  - - [2048, 32, 1, 2048]
    - [37, 3040.07]
  - - [7680, 1500, 1, 2560]
    - [58, 11042.9]
  - - [4096, 128, 1, 4096]
    - [63, 7918.62]
  - - [4608, 16, 1, 1536]
    - [38, 1875.79]
  - - [1024, 1500, 1, 2048]
    - [56, 8489.81]
  - - [3072, 3000, 1, 1024]
    - [61, 9901.13]
  - - [3072, 2, 1, 1024]
    - [20, 211.798]
  - - [8448, 1, 1, 2816]
    - [45, 137.951]
  - - [1024, 48000, 1, 2560]
    - [61, 11776.7]
  - - [1024, 3000, 1, 2816]
    - [62, 10695.2]
  - - [128, 1, 1, 1408]
    - [4, 16.1123]
  - - [35, 8457, 1, 1760]
    - [11, 3995.81]
  - - [1024, 2, 1, 512]
    - [32, 87.3777]
  - - [1024, 4, 1, 500000]
    - [5, 596.563]
  - - [6144, 1, 1, 2560]
    - [27, 132.128]
  - - [1024, 48000, 1, 2816]
    - [61, 11942.5]
  - - [512, 48000, 1, 2816]
    - [58, 11778.7]
  - - [2048, 16, 1, 2048]
    - [33, 1759.1]
  - - [1024, 24000, 1, 1536]
    - [61, 11080.7]
  - - [64, 193600, 1, 64]
    - [72, 84961.2]
  - - [7680, 6000, 1, 2560]
    - [61, 11742.9]
  - - [1760, 128, 1, 1760]
    - [42, 6319.37]
  - - [35, 8457, 1, 2048]
    - [13, 3095.09]
  - - [512, 1500, 1, 2816]
    - [53, 9306.77]
  - - [512, 1, 1, 512]
    - [16, 24.7469]
  - - [512, 16, 1, 500000]
    - [0, 2302.97]
  - - [512, 8, 1, 500000]
    - [0, 1165.02]
  - - [512, 24000, 1, 2560]
    - [61, 11243.6]
  - - [6144, 3000, 1, 2560]
    - [61, 11354.7]
  - - [1024, 24000, 1, 2816]
    - [61, 11601.7]
  - - [2048, 7000, 1, 2048]
    - [61, 10766.8]
  - - [7680, 3000, 1, 2560]
    - [58, 11444.3]
  - - [1024, 4, 1, 512]
    - [22, 169.528]
  - - [5124, 700, 1, 2048]
    - [61, 8691.02]
  - - [5124, 9124, 1, 4096]
    - [65, 9704.26]
  - - [4096, 64, 1, 4096]
    - [31, 7126.38]
  - - [256, 193600, 1, 64]
    - [72, 144663.0]
  - - [512, 6000, 1, 2048]
    - [64, 8091.07]
  - - [7680, 32, 1, 2560]
    - [40, 3926.58]
  - - [2560, 64, 1, 2560]
    - [46, 5633.95]
  - - [3072, 128, 1, 1024]
    - [56, 4932.51]
  - - [8448, 6000, 1, 2816]
    - [61, 11848.0]
  - - [7680, 64, 1, 2560]
    - [31, 7022.09]
  - - [5124, 1500, 1, 2560]
    - [61, 10472.3]
  - - [1024, 1500, 1, 2560]
    - [55, 9602.47]
  - - [3025, 64, 64, 64]
    - [77, 2874.59]
  - - [512, 4, 1, 512]
    - [41, 99.6887]
  - - [1024, 6000, 1, 2560]
    - [61, 10960.1]
  - - [3072, 32, 1, 1024]
    - [37, 2588.41]
  - - [35, 700, 1, 2560]
    - [14, 2011.16]
  - - [196, 1024, 64, 256]
    - [74, 7705.45]
  - - [512, 50176, 1, 128]
    - [69, 230002.0]
  - - [4608, 1, 1, 1536]
    - [2, 126.221]
  - - [4096, 32, 1, 4096]
    - [23, 4108.57]
  - - [7680, 24000, 1, 2560]
    - [61, 11946.2]
  - - [8448, 4, 1, 2816]
    - [45, 548.035]
  - - [64, 1, 1, 1216]
    - [39, 7.34674]
  - - [512, 1, 1, 500000]
    - [0, 159.611]
  - - [176, 1500, 1, 1408]
    - [35, 5508.19]
  - - [512, 3000, 1, 1536]
    - [55, 9035.31]
  - - [8448, 24000, 1, 2816]
    - [61, 12063.3]
  - - [4608, 2, 1, 1536]
    - [3, 248.502]
  - - [1024, 48000, 1, 1536]
    - [61, 11394.8]
  - - [7680, 128, 1, 2560]
    - [55, 9137.37]
  - - [3072, 6000, 1, 1024]
    - [61, 10294.4]
  - - [3072, 1500, 1, 128]
    - [57, 5361.87]
  - - [2048, 3136, 1, 512]
    - [70, 392825.0]
  - - [3025, 256, 64, 64]
    - [76, 3995.13]
  - - [1024, 3000, 1, 1536]
    - [62, 9804.37]
  - - [512, 4, 1, 500000]
    - [0, 617.564]
  - - [35, 700, 1, 2048]
    - [9, 1447.35]
  - - [1024, 16, 1, 500000]
    - [8, 2300.48]
  - - [512, 24000, 1, 2048]
    - [56, 9875.52]
  - - [128, 50176, 1, 512]
    - [71, 382676.0]
  - - [1024, 32, 1, 512]
    - [30, 1149.68]
  - - [256, 12544, 1, 1024]
    - [73, 431003.0]
  - - [1024, 12544, 1, 256]
    - [70, 312609.0]
  - - [512, 48000, 1, 2560]
    - [60, 11643.3]
  - - [2560, 16, 1, 2560]
    - [34, 1879.86]
  - - [2048, 64, 1, 2048]
    - [18, 4639.92]
  - - [512, 2, 1, 512]
    - [32, 49.842]
  - - [1024, 1, 1, 512]
    - [36, 43.1566]
  - - [512, 1500, 1, 2560]
    - [53, 8820.62]
  - - [6144, 32, 1, 2560]
    - [29, 3774.74]
  - - [1024, 1, 1, 500000]
    - [7, 149.654]
  - - [6144, 16, 1, 2560]
    - [30, 2066.47]
  - - [1024, 24000, 1, 2048]
    - [57, 9818.29]
  - - [4096, 16, 1, 4096]
    - [24, 2057.79]
  - - [5124, 1500, 1, 2048]
    - [61, 9641.8]
  - - [3072, 1500, 1, 1024]
    - [67, 9011.03]
  - - [1024, 2, 1, 500000]
    - [1, 299.815]
  - - [1024, 8, 1, 500000]
    - [6, 1167.48]
  - - [7680, 16, 1, 2560]
    - [43, 2135.04]
  - - [6144, 1500, 1, 2560]
    - [61, 11058.1]
  - - [3072, 1, 1, 1024]
    - [20, 106.165]
  - - [512, 6000, 1, 2816]
    - [58, 10803.1]
  - - [8448, 2, 1, 2816]
    - [51, 276.614]
  - - [4608, 4, 1, 1536]
    - [3, 492.52]
  - - [1024, 6000, 1, 1536]
    - [61, 10368.5]
  - - [8448, 32, 1, 2816]
    - [17, 3891.24]
  - - [512, 3000, 1, 2048]
    - [64, 7615.84]
  - - [6144, 24000, 1, 2560]
    - [61, 11906.1]
  - - [512, 3000, 1, 2560]
    - [56, 9695.43]
  - - [4608, 6000, 1, 1536]
    - [58, 11266.6]
  - - [1024, 1024, 1, 1024]
    - [55, 6985.57]
  - - [512, 1500, 1, 2048]
    - [55, 6851.56]
  - - [512, 1500, 1, 1536]
    - [53, 7918.83]
  - - [128, 1, 1, 1024]
    - [39, 12.374]
  - - [1024, 48000, 1, 2048]
    - [68, 10899.3]
- - - -1
    - - - -1
        - - - 4
            - - [1024, 41]
              - [1856, 32]
              - [2944, 41]
              - [3584, 32]
              - [4288, 41]
              - [5056, 32]
              - [-1, 41]
          - - 64
            - - [4, 41]
              - [64, 39]
              - [128, 22]
              - [256, 16]
              - [1408, 17]
              - [1856, 15]
              - [2368, 35]
              - [3584, 47]
              - [4288, 17]
              - [5888, 15]
              - [-1, 53]
          - - 128
            - - [4, 41]
              - [64, 16]
              - [128, 26]
              - [704, 17]
              - [1024, 15]
              - [1408, 46]
              - [1856, 42]
              - [2368, 46]
              - [4288, 47]
              - [5056, 29]
              - [-1, 53]
          - - 256
            - - [4, 41]
              - [64, 26]
              - [256, 17]
              - [448, 47]
              - [5056, 53]
              - [5888, 52]
              - [-1, 53]
          - - 448
            - - [4, 41]
              - [64, 25]
              - [128, 17]
              - [448, 35]
              - [1408, 53]
              - [1856, 55]
              - [2368, 53]
              - [2944, 60]
              - [3584, 53]
              - [4288, 52]
              - [5888, 53]
              - [-1, 54]
          - - 704
            - - [4, 41]
              - [64, 17]
              - [128, 35]
              - [2368, 53]
              - [5888, 52]
              - [-1, 58]
          - - 1024
            - - [4, 41]
              - [64, 17]
              - [128, 35]
              - [704, 53]
              - [1024, 55]
              - [1408, 58]
              - [1856, 62]
              - [3584, 58]
              - [4288, 60]
              - [-1, 61]
          - - 1408
            - - [4, 32]
              - [64, 17]
              - [128, 46]
              - [448, 53]
              - [704, 56]
              - [1024, 52]
              - [1408, 61]
              - [1856, 60]
              - [2368, 53]
              - [2944, 52]
              - [5888, 61]
              - [-1, 52]
          - - 1856
            - - [4, 41]
              - [64, 35]
              - [128, 42]
              - [256, 53]
              - [448, 55]
              - [704, 53]
              - [1024, 60]
              - [1408, 52]
              - [1856, 60]
              - [2944, 58]
              - [3584, 52]
              - [5056, 58]
              - [5888, 52]
              - [-1, 58]
          - - 2368
            - - [4, 41]
              - [64, 35]
              - [128, 46]
              - [704, 53]
              - [1024, 60]
              - [1408, 58]
              - [1856, 60]
              - [2944, 58]
              - [3584, 60]
              - [5056, 58]
              - [-1, 52]
          - - 2944
            - - [4, 41]
              - [128, 46]
              - [256, 53]
              - [448, 52]
              - [704, 60]
              - [5888, 52]
              - [-1, 58]
          - - 3584
            - - [4, 41]
              - [64, 31]
              - [448, 53]
              - [1024, 58]
              - [1408, 61]
              - [-1, 58]
          - - 4288
            - - [4, 41]
              - [64, 15]
              - [128, 46]
              - [256, 53]
              - [5888, 58]
              - [-1, 54]
          - - 5056
            - - [4, 41]
              - [64, 15]
              - [128, 31]
              - [448, 53]
              - [5056, 58]
              - [-1, 54]
          - - 5888
            - - [4, 32]
              - [128, 53]
              - [256, 54]
              - [448, 53]
              - [2368, 58]
              - [2944, 62]
              - [5888, 58]
              - [-1, 61]
          - - -1
            - - [4, 41]
              - [64, 53]
              - [128, 56]
              - [256, 53]
              - [448, 58]
              - [704, 54]
              - [1024, 62]
              - [1856, 54]
              - [5888, 58]
              - [-1, 61]
