library/src/blas3/Tensile/Logic/asm_full/vega20_Cijk_Ailk_Bljk_DB.yaml
- {MinimumRequiredVersion: 4.6.0}
- vega20
- gfx906
- [Device 66a0, Device 66a1, Device 66a7]
    SolutionIndex: 0
    SolutionNameMin: Cijk_Ailk_Bljk_DB_MT064x064x08_NLCA01_TT04_04_USFGRO0_WG16_16_01
    SolutionIndex: 1
    SolutionNameMin: Cijk_Ailk_Bljk_DB_MT064x064x04_NLCA01_TT04_04_USFGRO01_WG16_16_01
    SolutionIndex: 2
    SolutionNameMin: Cijk_Ailk_Bljk_DB_MT064x032x04_NLCA01_TT04_04_USFGRO0_WG16_08_01
    SolutionIndex: 3
    SolutionNameMin: Cijk_Ailk_Bljk_DB_MT064x032x08_NLCA01_TT04_04_USFGRO0_WG16_08_01
    SolutionIndex: 4
    SolutionNameMin: Cijk_Ailk_Bljk_DB_MT096x032x08_NLCA03_TT06_04_USFGRO0_WG16_08_01
    SolutionIndex: 5
    SolutionNameMin: Cijk_Ailk_Bljk_DB_MT032x064x08_NLCA01_TT04_04_USFGRO0_WG08_16_01
    SolutionIndex: 6
    SolutionNameMin: Cijk_Ailk_Bljk_DB_MT032x096x08_NLCA01_TT04_06_USFGRO0_WG08_16_01
- - - [12324, 12324, 1, 384]
    - [4, 3788.96]
  - - [14372, 14372, 1, 384]
    - [4, 3681.42]
  - - [5156, 5156, 1, 384]
    - [4, 3342.58]
  - - [1, 1, 1, 64]
    - [1, 0.00613042]
  - - [36, 36, 1, 384]
    - [3, 14.9538]
  - - [1060, 1060, 1, 384]
    - [4, 3226.6]
  - - [4132, 4132, 1, 384]
    - [0, 4227.61]
  - - [15396, 15396, 1, 384]
    - [4, 3513.21]
  - - [1, 64, 1, 64]
    - [1, 0.0864144]
  - - [10276, 10276, 1, 384]
    - [4, 4091.08]
  - - [9252, 9252, 1, 384]
    - [4, 3858.96]
  - - [64, 64, 1, 64]
    - [0, 4.71819]
  - - [8228, 8228, 1, 384]
    - [4, 3847.06]
  - - [11300, 11300, 1, 384]
    - [6, 3910.25]
  - - [64, 1, 1, 64]
    - [1, 0.372381]
  - - [2084, 2084, 1, 384]
    - [2, 3594.56]
  - - [13348, 13348, 1, 384]
    - [0, 3886.76]
  - - [6180, 6180, 1, 384]
    - [6, 4173.22]
  - - [7204, 7204, 1, 384]
    - [2, 3723.37]
  - - [3108, 3108, 1, 384]
    - [5, 3460.04]
- null
