library/src/blas3/Tensile/Logic/asm_full/vega20_Cijk_Ailk_Bljk_DB.yaml
- {MinimumRequiredVersion: 4.7.1}
- vega20
- gfx906
- [Device 66a0, Device 66a1, Device 66a7]
    SolutionIndex: 0
    SolutionNameMin: Cijk_Ailk_Bljk_DB_MT064x064x08_NLCA01_TT04_04_WG16_16_01
    SolutionIndex: 1
    SolutionNameMin: Cijk_Ailk_Bljk_DB_MT064x064x04_NLCA01_TT04_04_WG16_16_01
    SolutionIndex: 2
    SolutionNameMin: Cijk_Ailk_Bljk_DB_MT096x032x08_NLCA03_TT06_04_WG16_08_01
    SolutionIndex: 3
    SolutionNameMin: Cijk_Ailk_Bljk_DB_MT064x064x08_NLCA01_TT04_04_WG16_16_01
- - - [4608, 4608, 1, 384]
    - [2, 4606.53]
  - - [7680, 7680, 1, 384]
    - [2, 4666.38]
  - - [35328, 35328, 1, 384]
    - [2, 4701.38]
  - - [41088, 41088, 1, 384]
    - [2, 4749.86]
  - - [44544, 44544, 1, 384]
    - [2, 4702.72]
  - - [1152, 1152, 1, 384]
    - [2, 3843.21]
  - - [43776, 43776, 1, 384]
    - [2, 4741.5]
  - - [20736, 20736, 1, 384]
    - [2, 4739.0]
  - - [2304, 2304, 1, 384]
    - [2, 4427.15]
  - - [31872, 31872, 1, 384]
    - [2, 4746.99]
  - - [2688, 2688, 1, 384]
    - [2, 4520.27]
  - - [22272, 22272, 1, 384]
    - [2, 4735.97]
  - - [26496, 26496, 1, 384]
    - [2, 4747.99]
  - - [8832, 8832, 1, 384]
    - [2, 4728.68]
  - - [29184, 29184, 1, 384]
    - [2, 4700.73]
  - - [6528, 6528, 1, 384]
    - [2, 4704.82]
  - - [11520, 11520, 1, 384]
    - [2, 4720.93]
  - - [39552, 39552, 1, 384]
    - [2, 4745.1]
  - - [12672, 12672, 1, 384]
    - [2, 4735.45]
  - - [1536, 1536, 1, 384]
    - [2, 4157.36]
  - - [24576, 24576, 1, 384]
    - [2, 4650.79]
  - - [38016, 38016, 1, 384]
    - [2, 4746.72]
  - - [12288, 12288, 1, 384]
    - [2, 4684.4]
  - - [5376, 5376, 1, 384]
    - [2, 4678.11]
  - - [36096, 36096, 1, 384]
    - [2, 4736.6]
  - - [41472, 41472, 1, 384]
    - [2, 4699.91]
  - - [34560, 34560, 1, 384]
    - [2, 4740.83]
  - - [40320, 40320, 1, 384]
    - [2, 4746.09]
  - - [1920, 1920, 1, 384]
    - [2, 4307.39]
  - - [39936, 39936, 1, 384]
    - [2, 4700.23]
  - - [31104, 31104, 1, 384]
    - [2, 4752.78]
  - - [384, 384, 1, 384]
    - [3, 1665.4]
  - - [38784, 38784, 1, 384]
    - [2, 4745.59]
  - - [43008, 43008, 1, 384]
    - [2, 4703.42]
  - - [29568, 29568, 1, 384]
    - [2, 4747.23]
  - - [3072, 3072, 1, 384]
    - [2, 4482.79]
  - - [10752, 10752, 1, 384]
    - [2, 4683.28]
  - - [4224, 4224, 1, 384]
    - [2, 4642.51]
  - - [28032, 28032, 1, 384]
    - [2, 4748.82]
  - - [15744, 15744, 1, 384]
    - [2, 4739.83]
  - - [16128, 16128, 1, 384]
    - [2, 4735.79]
  - - [21120, 21120, 1, 384]
    - [2, 4746.5]
  - - [18816, 18816, 1, 384]
    - [2, 4750.0]
  - - [32256, 32256, 1, 384]
    - [2, 4703.73]
  - - [21504, 21504, 1, 384]
    - [2, 4699.52]
  - - [44160, 44160, 1, 384]
    - [2, 4749.79]
  - - [25344, 25344, 1, 384]
    - [2, 4737.88]
  - - [14592, 14592, 1, 384]
    - [2, 4731.82]
  - - [21888, 21888, 1, 384]
    - [2, 4747.14]
  - - [27648, 27648, 1, 384]
    - [2, 4702.59]
  - - [13056, 13056, 1, 384]
    - [2, 4726.49]
  - - [19968, 19968, 1, 384]
    - [2, 4702.62]
  - - [25728, 25728, 1, 384]
    - [2, 4746.02]
  - - [22656, 22656, 1, 384]
    - [2, 4745.25]
  - - [17664, 17664, 1, 384]
    - [2, 4734.03]
  - - [38400, 38400, 1, 384]
    - [2, 4700.32]
  - - [13440, 13440, 1, 384]
    - [2, 4733.97]
  - - [32640, 32640, 1, 384]
    - [2, 4750.01]
  - - [11904, 11904, 1, 384]
    - [2, 4734.57]
  - - [28416, 28416, 1, 384]
    - [2, 4737.31]
  - - [13824, 13824, 1, 384]
    - [2, 4692.22]
  - - [42240, 42240, 1, 384]
    - [2, 4736.24]
  - - [10368, 10368, 1, 384]
    - [2, 4731.3]
  - - [27264, 27264, 1, 384]
    - [2, 4749.62]
  - - [29952, 29952, 1, 384]
    - [2, 4741.98]
  - - [37248, 37248, 1, 384]
    - [2, 4749.62]
  - - [31488, 31488, 1, 384]
    - [2, 4739.15]
  - - [26880, 26880, 1, 384]
    - [2, 4737.12]
  - - [14976, 14976, 1, 384]
    - [2, 4745.55]
  - - [33024, 33024, 1, 384]
    - [2, 4736.99]
  - - [23040, 23040, 1, 384]
    - [2, 4702.74]
  - - [24960, 24960, 1, 384]
    - [2, 4751.66]
  - - [17280, 17280, 1, 384]
    - [2, 4745.84]
  - - [5760, 5760, 1, 384]
    - [2, 4696.55]
  - - [15360, 15360, 1, 384]
    - [2, 4695.59]
  - - [26112, 26112, 1, 384]
    - [2, 4699.33]
  - - [43392, 43392, 1, 384]
    - [2, 4749.48]
  - - [9984, 9984, 1, 384]
    - [2, 4723.54]
  - - [28800, 28800, 1, 384]
    - [2, 4748.08]
  - - [23808, 23808, 1, 384]
    - [2, 4738.1]
  - - [42624, 42624, 1, 384]
    - [2, 4745.59]
  - - [18048, 18048, 1, 384]
    - [2, 4741.51]
  - - [30720, 30720, 1, 384]
    - [2, 4702.69]
  - - [20352, 20352, 1, 384]
    - [2, 4751.96]
  - - [30336, 30336, 1, 384]
    - [2, 4750.22]
  - - [35712, 35712, 1, 384]
    - [2, 4750.11]
  - - [11136, 11136, 1, 384]
    - [2, 4731.34]
  - - [41856, 41856, 1, 384]
    - [2, 4746.77]
  - - [6144, 6144, 1, 384]
    - [2, 4653.59]
  - - [16896, 16896, 1, 384]
    - [2, 4698.83]
  - - [33408, 33408, 1, 384]
    - [2, 4746.48]
  - - [16512, 16512, 1, 384]
    - [2, 4742.7]
  - - [3456, 3456, 1, 384]
    - [2, 4607.12]
  - - [33792, 33792, 1, 384]
    - [2, 4700.5]
  - - [9600, 9600, 1, 384]
    - [2, 4733.63]
  - - [3840, 3840, 1, 384]
    - [2, 4624.72]
  - - [36864, 36864, 1, 384]
    - [2, 4703.6]
  - - [44928, 44928, 1, 384]
    - [2, 4750.95]
  - - [14208, 14208, 1, 384]
    - [2, 4741.49]
  - - [34176, 34176, 1, 384]
    - [2, 4747.58]
  - - [36480, 36480, 1, 384]
    - [2, 4748.76]
  - - [8448, 8448, 1, 384]
    - [2, 4716.69]
  - - [18432, 18432, 1, 384]
    - [2, 4696.3]
  - - [9216, 9216, 1, 384]
    - [2, 4680.82]
  - - [7296, 7296, 1, 384]
    - [2, 4713.29]
  - - [19200, 19200, 1, 384]
    - [2, 4737.77]
  - - [34944, 34944, 1, 384]
    - [2, 4748.92]
  - - [768, 768, 1, 384]
    - [2, 3543.37]
  - - [6912, 6912, 1, 384]
    - [2, 4701.29]
  - - [23424, 23424, 1, 384]
    - [2, 4746.81]
  - - [19584, 19584, 1, 384]
    - [2, 4750.61]
  - - [37632, 37632, 1, 384]
    - [2, 4739.38]
  - - [24192, 24192, 1, 384]
    - [2, 4745.75]
  - - [4992, 4992, 1, 384]
    - [2, 4673.35]
  - - [39168, 39168, 1, 384]
    - [2, 4736.9]
  - - [40704, 40704, 1, 384]
    - [2, 4738.02]
  - - [8064, 8064, 1, 384]
    - [2, 4726.93]
- - - -1
    - - - -1
        - - - 1
            - - [-1, 1]
          - - -1
            - - [1, 1]
              - [-1, 0]
