library/src/blas3/Tensile/Logic/asm_full/vega20_Cijk_Alik_Bljk_HB.yaml
- {MinimumRequiredVersion: 4.4.0}
- vega20
- gfx906
- [Device 66a0, Device 66a7]
    SolutionIndex: 0
    SolutionNameMin: Cijk_Alik_Bljk_HB_MT032x032x16_PGR1_PLR1_TT04_04
    SolutionIndex: 1
    SolutionNameMin: Cijk_Alik_Bljk_HB_MT064x032x16_PGR1_PLR1_TT04_04
    SolutionIndex: 2
    SolutionNameMin: Cijk_Alik_Bljk_HB_MT016x016x32_PGR1_PLR1_TT02_02
    SolutionIndex: 3
    SolutionNameMin: Cijk_Alik_Bljk_HB_MT032x032x32_PGR1_PLR1_TT04_04
    SolutionIndex: 4
    SolutionNameMin: Cijk_Alik_Bljk_HB_MT064x032x32_PGR1_PLR1_TT04_04
    SolutionIndex: 5
    SolutionNameMin: Cijk_Alik_Bljk_HB_MT128x064x32_PGR1_PLR1_TT08_08
    SolutionIndex: 6
    SolutionNameMin: Cijk_Alik_Bljk_HB_MT064x016x32_PGR1_PLR1_TT02_02
    SolutionIndex: 7
    SolutionNameMin: Cijk_Alik_Bljk_HB_MT128x032x32_PGR1_PLR1_TT04_04
    SolutionIndex: 8
    SolutionNameMin: Cijk_Alik_Bljk_HB_MT256x064x32_PGR1_PLR1_TT08_08
    SolutionIndex: 9
    SolutionNameMin: Cijk_Alik_Bljk_HB_MT032x032x16_PGR1_PLR1_TT04_04
    SolutionIndex: 10
    SolutionNameMin: Cijk_Alik_Bljk_HB_MT016x016x24_PGR1_PLR1_TT02_02
    SolutionIndex: 11
    SolutionNameMin: Cijk_Alik_Bljk_HB_MT032x016x24_PGR1_PLR1_TT04_02
    SolutionIndex: 12
    SolutionNameMin: Cijk_Alik_Bljk_HB_MT032x032x24_PGR1_PLR1_TT04_04
    SolutionIndex: 13
    SolutionNameMin: Cijk_Alik_Bljk_HB_MT016x016x24_PGR1_PLR1_TT02_02
    SolutionIndex: 14
    SolutionNameMin: Cijk_Alik_Bljk_HB_MT032x016x24_PGR1_PLR1_TT04_02
    SolutionIndex: 15
    SolutionNameMin: Cijk_Alik_Bljk_HB_MT032x032x24_PGR1_PLR1_TT04_04
    SolutionIndex: 16
    SolutionNameMin: Cijk_Alik_Bljk_HB_MT032x032x32_PGR1_PLR1_TT04_04
    SolutionIndex: 17
    SolutionNameMin: Cijk_Alik_Bljk_HB_MT128x064x08_PGR1_PLR1_TT08_04
    SolutionIndex: 18
    SolutionNameMin: Cijk_Alik_Bljk_HB_MT128x128x08_PGR1_PLR1_TT08_08
    SolutionIndex: 19
    SolutionNameMin: Cijk_Alik_Bljk_HB_MT064x064x16_PGR1_PLR1_TT04_04
    SolutionIndex: 20
    SolutionNameMin: Cijk_Alik_Bljk_HB_MT128x064x16_PGR1_PLR1_TT08_04
    SolutionIndex: 21
    SolutionNameMin: Cijk_Alik_Bljk_HB_MT128x128x16_PGR1_PLR1_TT08_08
    SolutionIndex: 22
    SolutionNameMin: Cijk_Alik_Bljk_HB_MT064x064x32_PGR1_PLR1_TT04_04
    SolutionIndex: 23
    SolutionNameMin: Cijk_Alik_Bljk_HB_MT128x128x32_PGR1_PLR1_TT08_08
    SolutionIndex: 24
    SolutionNameMin: Cijk_Alik_Bljk_HB_MT064x128x08_PGR0_PLR0_TT04_08
    SolutionIndex: 25
    SolutionNameMin: Cijk_Alik_Bljk_HB_MT064x064x08_PGR1_PLR1_TT04_04
    SolutionIndex: 26
    SolutionNameMin: Cijk_Alik_Bljk_HB_MT064x128x04_PGR0_PLR1_TT04_08
    SolutionIndex: 27
    SolutionNameMin: Cijk_Alik_Bljk_HB_MT064x064x08_PGR1_PLR1_TT04_04
    SolutionIndex: 1
    SolutionNameMin: Cijk_Alik_Bljk_HB_MT064x016x24_GRVW08_GSU05_LPB04_PGR1_PLR1_TT04_04_VW04_WG16_04_04_WGM01
    SolutionIndex: 2
    SolutionNameMin: Cijk_Alik_Bljk_HB_MT064x032x16_GRVW08_GSU01_LPB04_PGR1_PLR1_TT04_04_VW04_WG16_08_02_WGM64
    SolutionIndex: 3
    SolutionNameMin: Cijk_Alik_Bljk_HB_MT064x016x32_GRVW08_GSU05_LPB04_PGR1_PLR1_TT04_04_VW04_WG16_04_04_WGM08
    SolutionIndex: 4
    SolutionNameMin: Cijk_Alik_Bljk_HB_MT064x016x32_GRVW08_GSU05_LPB04_PGR1_PLR1_TT04_04_VW04_WG16_04_04_WGM01
    SolutionIndex: 5
    SolutionNameMin: Cijk_Alik_Bljk_HB_MT064x032x16_GRVW08_GSU01_LPB04_PGR1_PLR1_TT04_04_VW04_WG16_08_02_WGM01
    SolutionIndex: 6
    SolutionNameMin: Cijk_Alik_Bljk_HB_MT064x016x32_GRVW08_GSU03_LPB04_PGR1_PLR1_TT04_04_VW04_WG16_04_04_WGM01
- - - [2560, 7000, 1, 2560]
    - [21, 17071.5]
  - - [7680, 12000, 1, 2560]
    - [21, 18518.8]
  - - [5124, 9124, 1, 1760]
    - [21, 17832.0]
  - - [1760, 32, 1, 1760]
    - [10, 2311.61]
  - - [512, 24000, 1, 1536]
    - [21, 16092.1]
  - - [3072, 24000, 1, 1024]
    - [21, 16823.0]
  - - [2048, 400, 1, 512]
    - [21, 7342.91]
  - - [2560, 128, 1, 2560]
    - [9, 5720.45]
  - - [3072, 16, 1, 1024]
    - [2, 1407.46]
  - - [512, 48000, 1, 2816]
    - [21, 18193.8]
  - - [512, 48000, 1, 2048]
    - [23, 13573.0]
  - - [1760, 64, 1, 1760]
    - [13, 3896.28]
  - - [2048, 1600, 1, 2048]
    - [22, 8064.3]
  - - [512, 48000, 1, 1536]
    - [21, 17336.7]
  - - [2560, 32, 1, 2560]
    - [13, 2727.79]
  - - [8448, 5984, 1, 2816]
    - [21, 18482.6]
  - - [4096, 3200, 1, 1024]
    - [23, 13703.3]
  - - [1024, 24000, 1, 2560]
    - [21, 17631.2]
  - - [1760, 6400, 1, 1760]
    - [18, 17846.9]
  - - [5124, 9124, 1, 2048]
    - [23, 14152.0]
  - - [1024, 700, 1, 512]
    - [21, 7014.49]
  - - [4608, 32, 1, 1536]
    - [15, 3749.84]
  - - [3072, 64, 1, 1024]
    - [16, 3423.89]
  - - [16384, 3200, 1, 4096]
    - [23, 15186.8]
  - - [2560, 16, 1, 2560]
    - [10, 1766.44]
  - - [1024, 48000, 1, 2560]
    - [21, 18372.6]
  - - [8448, 48000, 1, 2816]
    - [21, 18918.9]
  - - [2048, 32, 1, 2048]
    - [10, 1819.63]
  - - [2560, 3200, 1, 2560]
    - [21, 15509.4]
  - - [16384, 800, 1, 4096]
    - [23, 12773.9]
  - - [4608, 24000, 1, 1536]
    - [21, 18509.8]
  - - [7680, 48000, 1, 2560]
    - [21, 18850.1]
  - - [3072, 48000, 1, 1024]
    - [21, 17799.9]
  - - [1760, 16, 1, 1760]
    - [13, 1217.12]
  - - [8192, 3200, 1, 2048]
    - [23, 13846.1]
  - - [512, 24000, 1, 2816]
    - [21, 17868.0]
  - - [4096, 400, 1, 1024]
    - [23, 9446.5]
  - - [6144, 48000, 1, 2560]
    - [21, 18712.2]
  - - [4608, 48000, 1, 1536]
    - [21, 18709.4]
  - - [4096, 128, 1, 4096]
    - [5, 4163.02]
  - - [2048, 800, 1, 512]
    - [23, 9763.16]
  - - [4608, 5984, 1, 1536]
    - [21, 17246.6]
  - - [4096, 1600, 1, 1024]
    - [23, 11521.1]
  - - [6144, 5984, 1, 2048]
    - [23, 14125.0]
  - - [7680, 24000, 1, 2560]
    - [21, 18717.5]
  - - [6144, 48000, 1, 2048]
    - [21, 16320.8]
  - - [2048, 3200, 1, 2048]
    - [23, 9689.27]
  - - [5124, 9124, 1, 2560]
    - [21, 17633.0]
  - - [1024, 24000, 1, 1536]
    - [21, 17224.0]
  - - [7680, 16, 1, 2560]
    - [11, 2958.69]
  - - [2560, 6400, 1, 2560]
    - [21, 17170.4]
  - - [2048, 128, 1, 2048]
    - [3, 3114.06]
  - - [512, 16, 1, 500000]
    - [2, 378.838]
  - - [1024, 8, 1, 500000]
    - [2, 378.824]
  - - [512, 24000, 1, 2560]
    - [21, 16833.3]
  - - [1024, 24000, 1, 2816]
    - [21, 18173.6]
  - - [7680, 5984, 1, 2560]
    - [21, 18074.2]
  - - [2048, 1600, 1, 512]
    - [23, 10596.9]
  - - [2048, 7000, 1, 2048]
    - [23, 12170.7]
  - - [1760, 800, 1, 1760]
    - [17, 12142.5]
  - - [4096, 64, 1, 4096]
    - [7, 3351.21]
  - - [7680, 32, 1, 2560]
    - [7, 5184.04]
  - - [2560, 64, 1, 2560]
    - [15, 4428.04]
  - - [3072, 128, 1, 1024]
    - [7, 4712.65]
  - - [7680, 64, 1, 2560]
    - [7, 6575.43]
  - - [1760, 128, 1, 1760]
    - [12, 6297.44]
  - - [2560, 1600, 1, 2560]
    - [21, 12755.0]
  - - [2048, 3200, 1, 512]
    - [23, 12846.1]
  - - [2560, 800, 1, 2560]
    - [21, 10546.3]
  - - [3072, 32, 1, 1024]
    - [16, 2215.28]
  - - [6144, 32, 1, 2560]
    - [0, 4605.69]
  - - [4608, 12000, 1, 1536]
    - [21, 18216.0]
  - - [4096, 32, 1, 4096]
    - [4, 2153.66]
  - - [6144, 24000, 1, 2048]
    - [21, 15656.5]
  - - [8192, 800, 1, 2048]
    - [23, 10126.1]
  - - [5124, 9124, 1, 4096]
    - [23, 14626.5]
  - - [8448, 24000, 1, 2816]
    - [21, 18844.1]
  - - [1024, 48000, 1, 1536]
    - [21, 18170.2]
  - - [7680, 128, 1, 2560]
    - [8, 10817.3]
  - - [8192, 1600, 1, 2048]
    - [23, 11660.4]
  - - [4096, 800, 1, 1024]
    - [23, 10214.9]
  - - [1024, 16, 1, 500000]
    - [2, 757.654]
  - - [2048, 800, 1, 2048]
    - [22, 6609.27]
  - - [1760, 3200, 1, 1760]
    - [18, 15860.5]
  - - [512, 48000, 1, 2560]
    - [21, 17667.2]
  - - [8448, 16, 1, 2816]
    - [14, 3241.03]
  - - [2048, 64, 1, 2048]
    - [3, 2353.0]
  - - [512, 24000, 1, 2048]
    - [23, 11557.8]
  - - [16384, 1600, 1, 4096]
    - [23, 13905.2]
  - - [4608, 16, 1, 1536]
    - [10, 2505.42]
  - - [1024, 24000, 1, 2048]
    - [23, 13317.0]
  - - [8192, 400, 1, 2048]
    - [22, 7370.6]
  - - [2048, 6400, 1, 2048]
    - [23, 11455.4]
  - - [6144, 12000, 1, 2048]
    - [23, 15135.4]
  - - [512, 8, 1, 500000]
    - [2, 189.409]
  - - [1760, 7000, 1, 1760]
    - [18, 16650.4]
  - - [1024, 48000, 1, 2816]
    - [21, 18700.2]
  - - [6144, 16, 1, 2560]
    - [14, 2754.55]
  - - [8448, 32, 1, 2816]
    - [1, 5251.49]
  - - [4096, 7000, 1, 4096]
    - [23, 14529.2]
  - - [4096, 16, 1, 4096]
    - [6, 1289.05]
  - - [6144, 24000, 1, 2560]
    - [21, 18549.8]
  - - [1024, 1024, 1, 1024]
    - [23, 8841.6]
  - - [2048, 16, 1, 2048]
    - [10, 1021.74]
  - - [8448, 12000, 1, 2816]
    - [21, 18794.8]
  - - [16384, 400, 1, 4096]
    - [23, 9712.55]
  - - [1760, 1600, 1, 1760]
    - [21, 14652.6]
  - - [1024, 48000, 1, 2048]
    - [23, 14727.7]
  - - [512, 128, 1, 784]
    - [33, 4014.08]
  - - [1024, 256, 1, 196]
    - [29, 5179.46]
  - - [256, 64, 1, 3136]
    - [28, 3243.7]
  - - [256, 1024, 1, 196]
    - [32, 5264.37]
  - - [64, 256, 1, 3136]
    - [31, 3227.3]
  - - [128, 512, 1, 784]
    - [33, 4170.47]
  - - [64, 64, 1, 3136]
    - [30, 810.925]
- - - -1
    - - - 1
        - - - 64
            - - [-1, 27]
          - - 128
            - - [704, 27]
              - [1024, 26]
              - [1408, 27]
              - [1856, 26]
              - [5056, 27]
              - [5888, 26]
              - [-1, 27]
          - - 256
            - - [448, 27]
              - [1024, 26]
              - [3584, 27]
              - [4288, 26]
              - [-1, 27]
          - - 448
            - - [32, 26]
              - [1856, 27]
              - [5056, 26]
              - [5888, 27]
              - [-1, 26]
          - - 704
            - - [704, 27]
              - [2944, 26]
              - [3584, 27]
              - [-1, 26]
          - - 1024
            - - [128, 27]
              - [256, 26]
              - [704, 27]
              - [1856, 26]
              - [2944, 27]
              - [-1, 26]
          - - 1408
            - - [448, 27]
              - [1856, 26]
              - [2368, 27]
              - [-1, 26]
          - - 1856
            - - [256, 27]
              - [448, 26]
              - [704, 27]
              - [-1, 26]
          - - 2368
            - - [256, 27]
              - [704, 26]
              - [1024, 27]
              - [-1, 26]
          - - 2944
            - - [128, 27]
              - [256, 26]
              - [1024, 27]
              - [-1, 26]
          - - 3584
            - - [256, 27]
              - [448, 26]
              - [704, 27]
              - [-1, 26]
          - - 5056
            - - [128, 27]
              - [256, 26]
              - [448, 27]
              - [-1, 26]
          - - 5888
            - - [32, 27]
              - [256, 26]
              - [448, 27]
              - [-1, 26]
          - - -1
            - - [128, 27]
              - [256, 26]
              - [448, 27]
              - [-1, 26]
      - - 32
        - - - 32
            - - [32, 24]
              - [-1, 25]
          - - 64
            - - [704, 25]
              - [1024, 24]
              - [1408, 25]
              - [1856, 24]
              - [2368, 25]
              - [2944, 24]
              - [3584, 25]
              - [4288, 24]
              - [-1, 25]
          - - 128
            - - [-1, 25]
          - - 256
            - - [704, 25]
              - [1408, 24]
              - [3584, 25]
              - [-1, 24]
          - - 448
            - - [448, 25]
              - [704, 24]
              - [1856, 25]
              - [4288, 24]
              - [5056, 25]
              - [-1, 24]
          - - 704
            - - [1408, 25]
              - [-1, 24]
          - - 1024
            - - [1024, 25]
              - [-1, 24]
          - - 1408
            - - [704, 25]
              - [-1, 24]
          - - 1856
            - - [448, 25]
              - [-1, 24]
          - - 2368
            - - [64, 25]
              - [128, 24]
              - [256, 25]
              - [-1, 24]
          - - 2944
            - - [256, 25]
              - [448, 24]
              - [704, 25]
              - [-1, 24]
          - - 3584
            - - [256, 25]
              - [-1, 24]
          - - 4288
            - - [128, 25]
              - [256, 24]
              - [448, 25]
              - [-1, 24]
          - - 5056
            - - [128, 25]
              - [-1, 24]
          - - 5888
            - - [128, 25]
              - [256, 24]
              - [448, 25]
              - [-1, 24]
          - - -1
            - - [32, 25]
              - [64, 24]
              - [128, 25]
              - [-1, 24]
      - - 256
        - - - 1
            - - [-1, 27]
          - - 32
            - - [-1, 25]
          - - 64
            - - [1, 27]
              - [32, 25]
              - [64, 10]
              - [256, 2]
              - [1856, 10]
              - [3584, 0]
              - [5056, 1]
              - [5888, 0]
              - [-1, 19]
          - - 128
            - - [1, 27]
              - [32, 25]
              - [64, 10]
              - [128, 2]
              - [256, 10]
              - [448, 13]
              - [1024, 10]
              - [1408, 9]
              - [1856, 0]
              - [2368, 1]
              - [5888, 19]
              - [-1, 20]
          - - 256
            - - [1, 27]
              - [32, 25]
              - [64, 2]
              - [448, 10]
              - [704, 9]
              - [2944, 19]
              - [5888, 20]
              - [-1, 21]
          - - 448
            - - [1, 27]
              - [32, 25]
              - [64, 10]
              - [256, 13]
              - [1408, 19]
              - [2944, 20]
              - [3584, 21]
              - [4288, 19]
              - [5056, 20]
              - [-1, 21]
          - - 704
            - - [1, 27]
              - [32, 25]
              - [64, 10]
              - [128, 13]
              - [1408, 19]
              - [1856, 20]
              - [2368, 21]
              - [2944, 19]
              - [-1, 21]
          - - 1024
            - - [1, 27]
              - [32, 25]
              - [128, 10]
              - [704, 19]
              - [1408, 20]
              - [1856, 21]
              - [2368, 20]
              - [-1, 21]
          - - 1408
            - - [1, 27]
              - [32, 25]
              - [64, 13]
              - [128, 0]
              - [448, 19]
              - [1024, 20]
              - [-1, 21]
          - - 1856
            - - [1, 27]
              - [32, 25]
              - [64, 13]
              - [128, 9]
              - [256, 19]
              - [704, 20]
              - [-1, 21]
          - - 2368
            - - [1, 27]
              - [32, 25]
              - [64, 0]
              - [128, 9]
              - [256, 19]
              - [448, 20]
              - [-1, 21]
          - - 2944
            - - [1, 27]
              - [32, 25]
              - [64, 0]
              - [256, 19]
              - [704, 20]
              - [-1, 21]
          - - 3584
            - - [1, 27]
              - [32, 25]
              - [64, 9]
              - [128, 19]
              - [448, 20]
              - [-1, 21]
          - - 4288
            - - [1, 27]
              - [32, 25]
              - [64, 1]
              - [128, 19]
              - [704, 20]
              - [-1, 21]
          - - 5056
            - - [1, 27]
              - [32, 25]
              - [128, 19]
              - [448, 20]
              - [-1, 21]
          - - 5888
            - - [1, 27]
              - [32, 25]
              - [128, 19]
              - [256, 20]
              - [448, 21]
              - [704, 20]
              - [-1, 21]
          - - -1
            - - [1, 27]
              - [32, 25]
              - [64, 19]
              - [128, 20]
              - [256, 21]
              - [448, 20]
              - [-1, 21]
      - - 1280
        - - - 1
            - - [-1, 27]
          - - 32
            - - [-1, 25]
          - - 64
            - - [1, 27]
              - [32, 25]
              - [1856, 10]
              - [2368, 9]
              - [3584, 0]
              - [5056, 1]
              - [-1, 19]
          - - 128
            - - [1, 27]
              - [32, 25]
              - [128, 10]
              - [256, 13]
              - [704, 10]
              - [1024, 13]
              - [1408, 0]
              - [2368, 12]
              - [5888, 19]
              - [-1, 20]
          - - 256
            - - [1, 27]
              - [32, 25]
              - [128, 10]
              - [256, 13]
              - [448, 10]
              - [1024, 15]
              - [2944, 19]
              - [3584, 20]
              - [5056, 19]
              - [5888, 20]
              - [-1, 21]
          - - 448
            - - [1, 27]
              - [32, 25]
              - [128, 10]
              - [256, 13]
              - [448, 19]
              - [704, 9]
              - [1408, 19]
              - [1856, 20]
              - [2368, 19]
              - [2944, 20]
              - [3584, 21]
              - [4288, 19]
              - [5056, 20]
              - [-1, 21]
          - - 704
            - - [1, 27]
              - [32, 25]
              - [128, 13]
              - [448, 9]
              - [1856, 19]
              - [2368, 21]
              - [2944, 19]
              - [-1, 21]
          - - 1024
            - - [1, 27]
              - [32, 25]
              - [64, 10]
              - [128, 13]
              - [256, 15]
              - [704, 19]
              - [1408, 20]
              - [1856, 21]
              - [2368, 20]
              - [-1, 21]
          - - 1408
            - - [1, 27]
              - [32, 25]
              - [64, 13]
              - [128, 9]
              - [256, 15]
              - [448, 19]
              - [1024, 20]
              - [1408, 21]
              - [1856, 20]
              - [-1, 21]
          - - 1856
            - - [1, 27]
              - [32, 25]
              - [64, 13]
              - [128, 15]
              - [256, 19]
              - [448, 21]
              - [704, 19]
              - [-1, 21]
          - - 2368
            - - [1, 27]
              - [32, 25]
              - [64, 0]
              - [128, 1]
              - [448, 19]
              - [704, 21]
              - [1024, 20]
              - [-1, 21]
          - - 2944
            - - [1, 27]
              - [32, 25]
              - [64, 9]
              - [256, 19]
              - [704, 20]
              - [-1, 21]
          - - 3584
            - - [1, 27]
              - [32, 25]
              - [64, 0]
              - [128, 19]
              - [256, 20]
              - [448, 21]
              - [704, 20]
              - [-1, 21]
          - - 4288
            - - [1, 27]
              - [32, 25]
              - [64, 1]
              - [256, 19]
              - [704, 20]
              - [-1, 21]
          - - 5056
            - - [1, 27]
              - [32, 25]
              - [64, 1]
              - [256, 19]
              - [448, 20]
              - [-1, 21]
          - - 5888
            - - [1, 27]
              - [32, 25]
              - [128, 19]
              - [256, 20]
              - [448, 21]
              - [704, 20]
              - [-1, 21]
          - - -1
            - - [1, 27]
              - [32, 25]
              - [64, 19]
              - [128, 20]
              - [256, 21]
              - [448, 20]
              - [-1, 21]
      - - -1
        - - - 1
            - - [-1, 27]
          - - 32
            - - [-1, 25]
          - - 64
            - - [1, 27]
              - [32, 25]
              - [64, 13]
              - [1408, 10]
              - [1856, 13]
              - [2368, 15]
              - [2944, 0]
              - [3584, 9]
              - [5888, 1]
              - [-1, 19]
          - - 128
            - - [1, 27]
              - [32, 25]
              - [256, 10]
              - [448, 13]
              - [704, 10]
              - [1024, 13]
              - [1856, 15]
              - [2368, 12]
              - [2944, 1]
              - [5888, 19]
              - [-1, 21]
          - - 256
            - - [1, 27]
              - [32, 25]
              - [64, 10]
              - [448, 13]
              - [1408, 15]
              - [2944, 19]
              - [3584, 21]
              - [5056, 19]
              - [5888, 20]
              - [-1, 21]
          - - 448
            - - [1, 27]
              - [32, 25]
              - [128, 10]
              - [256, 13]
              - [448, 9]
              - [1408, 19]
              - [1856, 21]
              - [2368, 19]
              - [2944, 20]
              - [3584, 21]
              - [4288, 19]
              - [5056, 20]
              - [-1, 21]
          - - 704
            - - [1, 27]
              - [32, 25]
              - [64, 10]
              - [128, 13]
              - [256, 15]
              - [448, 9]
              - [1856, 19]
              - [2368, 21]
              - [2944, 19]
              - [-1, 21]
          - - 1024
            - - [1, 27]
              - [32, 25]
              - [128, 10]
              - [256, 15]
              - [704, 19]
              - [1024, 21]
              - [1408, 20]
              - [1856, 21]
              - [2368, 20]
              - [-1, 21]
          - - 1408
            - - [1, 27]
              - [32, 25]
              - [64, 13]
              - [256, 15]
              - [448, 19]
              - [1024, 20]
              - [1408, 21]
              - [1856, 20]
              - [-1, 21]
          - - 1856
            - - [1, 27]
              - [32, 25]
              - [64, 13]
              - [128, 15]
              - [256, 19]
              - [448, 21]
              - [704, 19]
              - [-1, 21]
          - - 2368
            - - [1, 27]
              - [32, 25]
              - [64, 12]
              - [128, 1]
              - [448, 19]
              - [704, 21]
              - [1024, 20]
              - [-1, 21]
          - - 2944
            - - [1, 27]
              - [32, 25]
              - [64, 12]
              - [128, 1]
              - [256, 19]
              - [704, 20]
              - [-1, 21]
          - - 3584
            - - [1, 27]
              - [32, 25]
              - [64, 0]
              - [128, 19]
              - [448, 21]
              - [704, 20]
              - [-1, 21]
          - - 4288
            - - [1, 27]
              - [32, 25]
              - [64, 1]
              - [256, 19]
              - [704, 20]
              - [-1, 21]
          - - 5056
            - - [1, 27]
              - [32, 25]
              - [64, 1]
              - [256, 19]
              - [448, 20]
              - [-1, 21]
          - - 5888
            - - [1, 27]
              - [32, 25]
              - [64, 1]
              - [128, 19]
              - [256, 20]
              - [448, 21]
              - [704, 20]
              - [-1, 21]
          - - -1
            - - [1, 27]
              - [32, 25]
              - [64, 19]
              - [256, 21]
              - [448, 20]
              - [-1, 21]
