library/src/blas3/Tensile/Logic/asm_full/vega20_Cijk_Ailk_Bjlk_SB.yaml
- {MinimumRequiredVersion: 4.2.0}
- vega20
- gfx906
- [Device 66a0, Device 66a7]
    SolutionIndex: 0
    SolutionNameMin: Cijk_Ailk_Bjlk_SB_MT016x016x16_GRVW02_GSU08_TT02_02_VW02_WG08_08_04
    SolutionIndex: 1
    SolutionNameMin: Cijk_Ailk_Bjlk_SB_MT016x016x08_GRVW02_GSU08_TT02_02_VW02_WG08_08_02
    SolutionIndex: 2
    SolutionNameMin: Cijk_Ailk_Bjlk_SB_MT016x016x08_GRVW02_GSU04_TT02_02_VW02_WG08_08_02
    SolutionIndex: 3
    SolutionNameMin: Cijk_Ailk_Bjlk_SB_MT016x016x32_GRVW02_GSU04_TT02_02_VW02_WG08_08_04
    SolutionIndex: 4
    SolutionNameMin: Cijk_Ailk_Bjlk_SB_MT032x032x32_GRVW04_GSU02_TT04_04_VW04_WG08_08_04
    SolutionIndex: 5
    SolutionNameMin: Cijk_Ailk_Bjlk_SB_MT032x032x32_GRVW04_GSU02_TT04_04_VW04_WG08_08_04
    SolutionIndex: 6
    SolutionNameMin: Cijk_Ailk_Bjlk_SB_MT016x016x32_GRVW02_GSU02_TT02_02_VW02_WG08_08_04
    SolutionIndex: 7
    SolutionNameMin: Cijk_Ailk_Bjlk_SB_MT064x032x16_GRVW04_GSU02_TT04_04_VW04_WG16_08_02
    SolutionIndex: 8
    SolutionNameMin: Cijk_Ailk_Bjlk_SB_MT032x032x16_GRVW04_GSU02_TT04_04_VW04_WG08_08_02
    SolutionIndex: 9
    SolutionNameMin: Cijk_Ailk_Bjlk_SB_MT032x032x32_GRVW04_GSU04_TT04_04_VW04_WG08_08_04
    SolutionIndex: 10
    SolutionNameMin: Cijk_Ailk_Bjlk_SB_MT064x064x08_GRVW04_GSU01_TT04_04_VW04_WG16_16_01
    SolutionIndex: 11
    SolutionNameMin: Cijk_Ailk_Bjlk_SB_MT064x064x16_GRVW04_GSU01_TT04_04_VW04_WG16_16_01
    SolutionIndex: 12
    SolutionNameMin: Cijk_Ailk_Bjlk_SB_MT064x064x16_GRVW04_GSU01_TT04_04_VW04_WG16_16_01
    SolutionIndex: 13
    SolutionNameMin: Cijk_Ailk_Bjlk_SB_MT128x128x16_GRVW04_GSU01_TT08_08_VW04_WG16_16_01
    SolutionIndex: 14
    SolutionNameMin: Cijk_Ailk_Bjlk_SB_MT128x128x16_GRVW04_GSU01_TT08_08_VW04_WG16_16_01
    SolutionIndex: 15
    SolutionNameMin: Cijk_Ailk_Bjlk_SB_MT128x128x08_GRVW04_GSU01_TT08_08_VW04_WG16_16_01
    SolutionIndex: 16
    SolutionNameMin: Cijk_Ailk_Bjlk_SB_MT064x128x08_GRVW04_GSU01_TT04_08_VW04_WG16_16_01
    SolutionIndex: 17
    SolutionNameMin: Cijk_Ailk_Bjlk_SB_MT128x128x08_GRVW04_GSU01_TT08_08_VW04_WG16_16_01
    SolutionIndex: 18
    SolutionNameMin: Cijk_Ailk_Bjlk_SB_MT064x128x08_GRVW04_GSU01_TT04_08_VW04_WG16_16_01
    SolutionIndex: 19
    SolutionNameMin: Cijk_Ailk_Bjlk_SB_MT128x064x08_GRVW04_GSU01_TT08_04_VW04_WG16_16_01
    SolutionIndex: 20
    SolutionNameMin: Cijk_Ailk_Bjlk_SB_MT128x064x08_GRVW04_GSU01_TT08_04_VW04_WG16_16_01
    SolutionIndex: 21
    SolutionNameMin: Cijk_Ailk_Bjlk_SB_MT016x016x16_GRVW02_GSU16_TT02_02_VW02_WG08_08_04
- - - [4096, 7133, 1, 4096]
    - [15, 9322.14]
  - - [512, 16, 1, 512]
    - [3, 602.63]
  - - [2048, 7133, 1, 2048]
    - [15, 9198.38]
  - - [2560, 7133, 1, 2560]
    - [14, 9084.97]
  - - [1024, 1024, 1, 1024]
    - [19, 7771.61]
  - - [3072, 7435, 1, 1024]
    - [20, 9014.58]
  - - [1024, 32, 1, 512]
    - [6, 1651.3]
  - - [1760, 7133, 1, 1760]
    - [16, 8921.6]
  - - [7680, 5481, 1, 2560]
    - [20, 9240.59]
  - - [1024, 16, 1, 512]
    - [3, 1059.17]
  - - [512, 32, 1, 512]
    - [3, 1038.19]
- - - -1
    - - - -1
        - - - 4
            - - [448, 21]
              - [1024, 0]
              - [1856, 1]
              - [3584, 2]
              - [5056, 1]
              - [-1, 2]
          - - 64
            - - [4, 21]
              - [128, 0]
              - [256, 3]
              - [704, 9]
              - [1856, 4]
              - [2368, 5]
              - [2944, 4]
              - [3584, 8]
              - [4288, 5]
              - [5056, 4]
              - [5888, 8]
              - [-1, 4]
          - - 128
            - - [4, 21]
              - [128, 3]
              - [256, 9]
              - [704, 5]
              - [1024, 7]
              - [1408, 5]
              - [1856, 8]
              - [2368, 4]
              - [2944, 8]
              - [3584, 12]
              - [4288, 8]
              - [-1, 11]
          - - 256
            - - [4, 21]
              - [64, 3]
              - [128, 6]
              - [256, 5]
              - [448, 4]
              - [4288, 11]
              - [5888, 12]
              - [-1, 11]
          - - 448
            - - [4, 21]
              - [64, 9]
              - [128, 4]
              - [256, 5]
              - [448, 4]
              - [704, 11]
              - [1024, 12]
              - [5888, 11]
              - [-1, 16]
          - - 704
            - - [4, 0]
              - [64, 9]
              - [128, 5]
              - [256, 11]
              - [1408, 12]
              - [2368, 11]
              - [5056, 16]
              - [5888, 12]
              - [-1, 11]
          - - 1024
            - - [4, 0]
              - [64, 4]
              - [128, 8]
              - [704, 12]
              - [1024, 19]
              - [1408, 12]
              - [1856, 13]
              - [2368, 20]
              - [2944, 13]
              - [3584, 12]
              - [4288, 11]
              - [5056, 19]
              - [5888, 13]
              - [-1, 11]
          - - 1408
            - - [4, 1]
              - [64, 4]
              - [128, 5]
              - [704, 11]
              - [1024, 20]
              - [1408, 12]
              - [1856, 10]
              - [2368, 11]
              - [2944, 17]
              - [5056, 13]
              - [5888, 20]
              - [-1, 16]
          - - 1856
            - - [4, 1]
              - [64, 4]
              - [128, 8]
              - [256, 11]
              - [704, 12]
              - [1024, 14]
              - [1408, 10]
              - [1856, 18]
              - [2368, 10]
              - [3584, 18]
              - [4288, 11]
              - [5056, 20]
              - [5888, 16]
              - [-1, 18]
          - - 2368
            - - [4, 0]
              - [128, 5]
              - [704, 11]
              - [1024, 18]
              - [1408, 12]
              - [1856, 10]
              - [2368, 11]
              - [2944, 12]
              - [4288, 18]
              - [5056, 11]
              - [-1, 18]
          - - 2944
            - - [4, 2]
              - [64, 5]
              - [128, 8]
              - [448, 11]
              - [704, 20]
              - [1024, 14]
              - [1408, 17]
              - [1856, 20]
              - [2368, 11]
              - [3584, 18]
              - [5056, 20]
              - [5888, 13]
              - [-1, 18]
          - - 3584
            - - [4, 1]
              - [64, 11]
              - [448, 12]
              - [704, 20]
              - [1024, 12]
              - [1408, 14]
              - [2368, 20]
              - [2944, 18]
              - [-1, 20]
          - - 4288
            - - [4, 1]
              - [64, 5]
              - [128, 8]
              - [448, 11]
              - [704, 20]
              - [1024, 18]
              - [1408, 13]
              - [1856, 12]
              - [2368, 20]
              - [-1, 18]
          - - 5056
            - - [4, 1]
              - [64, 5]
              - [256, 11]
              - [448, 12]
              - [704, 20]
              - [1024, 18]
              - [1408, 13]
              - [1856, 18]
              - [2368, 12]
              - [-1, 18]
          - - 5888
            - - [4, 2]
              - [64, 7]
              - [128, 11]
              - [256, 12]
              - [448, 11]
              - [704, 10]
              - [1024, 13]
              - [1408, 18]
              - [2368, 20]
              - [2944, 13]
              - [3584, 18]
              - [5056, 19]
              - [-1, 18]
          - - -1
            - - [4, 2]
              - [64, 7]
              - [128, 8]
              - [256, 12]
              - [448, 20]
              - [704, 11]
              - [1024, 13]
              - [1408, 18]
              - [2368, 19]
              - [3584, 18]
              - [5056, 19]
              - [5888, 18]
              - [-1, 17]
