library/src/blas3/Tensile/Logic/asm_full/vega10_Cijk_Ailk_Bljk_HBH.yaml
- {MinimumRequiredVersion: 4.6.0}
- vega10
- gfx900
- [Device 6863, Device 6862, Device 687f, Device 6860, Device 6861, 'Vega 10 XTX [Radeon
    SolutionIndex: 0
    SolutionNameMin: Cijk_Ailk_Bljk_HBH_MT064x016x08_PGR1_PLR1_TT04_02
    SolutionIndex: 1
    SolutionNameMin: Cijk_Ailk_Bljk_HBH_MT016x016x16_PGR1_PLR1_TT02_02
    SolutionIndex: 2
    SolutionNameMin: Cijk_Ailk_Bljk_HBH_MT032x016x16_PGR1_PLR1_TT04_02
    SolutionIndex: 3
    SolutionNameMin: Cijk_Ailk_Bljk_HBH_MT032x008x16_PGR1_PLR1_TT02_02
    SolutionIndex: 4
    SolutionNameMin: Cijk_Ailk_Bljk_HBH_MT032x016x16_PGR1_PLR1_TT02_02
    SolutionIndex: 5
    SolutionNameMin: Cijk_Ailk_Bljk_HBH_MT064x016x16_PGR1_PLR1_TT04_02
    SolutionIndex: 6
    SolutionNameMin: Cijk_Ailk_Bljk_HBH_MT064x032x16_PGR1_PLR1_TT04_04
    SolutionIndex: 7
    SolutionNameMin: Cijk_Ailk_Bljk_HBH_MT064x064x16_PGR1_PLR1_TT04_04
    SolutionIndex: 8
    SolutionNameMin: Cijk_Ailk_Bljk_HBH_MT064x016x16_PGR1_PLR1_TT02_02
    SolutionIndex: 9
    SolutionNameMin: Cijk_Ailk_Bljk_HBH_MT128x016x16_PGR1_PLR1_TT04_02
    SolutionIndex: 10
    SolutionNameMin: Cijk_Ailk_Bljk_HBH_MT128x032x16_PGR1_PLR1_TT04_04
    SolutionIndex: 11
    SolutionNameMin: Cijk_Ailk_Bljk_HBH_MT016x016x32_PGR1_PLR1_TT02_02
    SolutionIndex: 12
    SolutionNameMin: Cijk_Ailk_Bljk_HBH_MT032x008x32_PGR1_PLR1_TT02_02
    SolutionIndex: 13
    SolutionNameMin: Cijk_Ailk_Bljk_HBH_MT032x016x32_PGR1_PLR1_TT02_02
    SolutionIndex: 14
    SolutionNameMin: Cijk_Ailk_Bljk_HBH_MT064x008x32_PGR1_PLR1_TT02_02
    SolutionIndex: 15
    SolutionNameMin: Cijk_Ailk_Bljk_HBH_MT064x016x32_PGR1_PLR1_TT02_02
    SolutionIndex: 16
    SolutionNameMin: Cijk_Ailk_Bljk_HBH_MT128x016x32_PGR1_PLR1_TT04_02
    SolutionIndex: 17
    SolutionNameMin: Cijk_Ailk_Bljk_HBH_MT032x008x64_PGR1_PLR1_TT02_02
    SolutionIndex: 18
    SolutionNameMin: Cijk_Ailk_Bljk_HBH_MT064x008x64_PGR1_PLR1_TT02_02
    SolutionIndex: 19
    SolutionNameMin: Cijk_Ailk_Bljk_HBH_MT032x032x08_PGR1_PLR1_TT04_04
    SolutionIndex: 20
    SolutionNameMin: Cijk_Ailk_Bljk_HBH_MT064x032x08_PGR1_PLR1_TT08_04
    SolutionIndex: 21
    SolutionNameMin: Cijk_Ailk_Bljk_HBH_MT064x064x08_PGR1_PLR1_TT08_08
    SolutionIndex: 22
    SolutionNameMin: Cijk_Ailk_Bljk_HBH_MT032x016x16_PGR1_PLR1_TT04_02
    SolutionIndex: 23
    SolutionNameMin: Cijk_Ailk_Bljk_HBH_MT032x032x16_PGR1_PLR1_TT04_04
    SolutionIndex: 24
    SolutionNameMin: Cijk_Ailk_Bljk_HBH_MT064x032x16_PGR1_PLR1_TT08_04
    SolutionIndex: 25
    SolutionNameMin: Cijk_Ailk_Bljk_HBH_MT064x064x16_PGR1_PLR1_TT08_08
    SolutionIndex: 26
    SolutionNameMin: Cijk_Ailk_Bljk_HBH_MT032x016x16_PGR1_PLR1_TT02_02
    SolutionIndex: 27
    SolutionNameMin: Cijk_Ailk_Bljk_HBH_MT064x016x16_PGR1_PLR1_TT04_02
    SolutionIndex: 28
    SolutionNameMin: Cijk_Ailk_Bljk_HBH_MT064x016x16_PGR1_PLR1_TT02_02
    SolutionIndex: 29
    SolutionNameMin: Cijk_Ailk_Bljk_HBH_MT128x016x16_PGR1_PLR1_TT04_02
    SolutionIndex: 30
    SolutionNameMin: Cijk_Ailk_Bljk_HBH_MT128x032x16_PGR1_PLR1_TT04_04
    SolutionIndex: 31
    SolutionNameMin: Cijk_Ailk_Bljk_HBH_MT032x008x16_PGR1_PLR1_TT02_02
    SolutionIndex: 32
    SolutionNameMin: Cijk_Ailk_Bljk_HBH_MT064x016x16_PGR1_PLR1_TT04_04
    SolutionIndex: 33
    SolutionNameMin: Cijk_Ailk_Bljk_HBH_MT016x016x24_PGR1_PLR1_TT02_02
    SolutionIndex: 34
    SolutionNameMin: Cijk_Ailk_Bljk_HBH_MT032x016x24_PGR1_PLR1_TT04_02
    SolutionIndex: 35
    SolutionNameMin: Cijk_Ailk_Bljk_HBH_MT032x032x24_PGR1_PLR1_TT04_04
    SolutionIndex: 36
    SolutionNameMin: Cijk_Ailk_Bljk_HBH_MT032x016x32_PGR1_PLR1_TT02_02
    SolutionIndex: 37
    SolutionNameMin: Cijk_Ailk_Bljk_HBH_MT064x016x32_PGR1_PLR1_TT02_02
    SolutionIndex: 38
    SolutionNameMin: Cijk_Ailk_Bljk_HBH_MT128x016x32_PGR1_PLR1_TT04_02
    SolutionIndex: 39
    SolutionNameMin: Cijk_Ailk_Bljk_HBH_MT032x008x32_PGR1_PLR1_TT02_02
    SolutionIndex: 40
    SolutionNameMin: Cijk_Ailk_Bljk_HBH_MT064x008x32_PGR1_PLR1_TT02_02
    SolutionIndex: 41
    SolutionNameMin: Cijk_Ailk_Bljk_HBH_MT032x008x64_PGR1_PLR1_TT02_02
    SolutionIndex: 42
    SolutionNameMin: Cijk_Ailk_Bljk_HBH_MT064x008x64_PGR1_PLR1_TT02_02
    SolutionIndex: 43
    SolutionNameMin: Cijk_Ailk_Bljk_HBH_MT032x064x08_PGR1_PLR1_TT04_08
    SolutionIndex: 44
    SolutionNameMin: Cijk_Ailk_Bljk_HBH_MT064x048x08_PGR1_PLR1_TT08_06
    SolutionIndex: 45
    SolutionNameMin: Cijk_Ailk_Bljk_HBH_MT064x064x08_PGR0_PLR1_TT04_04
    SolutionIndex: 46
    SolutionNameMin: Cijk_Ailk_Bljk_HBH_MT064x064x08_PGR1_PLR1_TT04_04
    SolutionIndex: 47
    SolutionNameMin: Cijk_Ailk_Bljk_HBH_MT064x128x08_PGR1_PLR1_TT04_08
    SolutionIndex: 48
    SolutionNameMin: Cijk_Ailk_Bljk_HBH_MT128x064x08_PGR1_PLR1_TT08_04
    SolutionIndex: 49
    SolutionNameMin: Cijk_Ailk_Bljk_HBH_MT032x032x16_PGR0_PLR1_TT04_04
    SolutionIndex: 50
    SolutionNameMin: Cijk_Ailk_Bljk_HBH_MT064x032x16_PGR0_PLR1_TT08_04
    SolutionIndex: 51
    SolutionNameMin: Cijk_Ailk_Bljk_HBH_MT064x064x16_PGR0_PLR1_TT04_04
    SolutionIndex: 52
    SolutionNameMin: Cijk_Ailk_Bljk_HBH_MT064x064x16_PGR1_PLR1_TT04_04
    SolutionIndex: 53
    SolutionNameMin: Cijk_Ailk_Bljk_HBH_MT064x128x16_PGR1_PLR1_TT04_08
    SolutionIndex: 54
    SolutionNameMin: Cijk_Ailk_Bljk_HBH_MT128x064x16_PGR1_PLR1_TT08_04
    SolutionIndex: 55
    SolutionNameMin: Cijk_Ailk_Bljk_HBH_MT128x128x16_PGR1_PLR1_TT08_08
    SolutionIndex: 56
    SolutionNameMin: Cijk_Ailk_Bljk_HBH_MT032x032x24_PGR0_PLR1_TT04_04
    SolutionIndex: 57
    SolutionNameMin: Cijk_Ailk_Bljk_HBH_MT064x064x32_PGR1_PLR1_TT04_04
    SolutionIndex: 58
    SolutionNameMin: Cijk_Ailk_Bljk_HBH_MT128x064x32_PGR0_PLR1_TT08_04
    SolutionIndex: 59
    SolutionNameMin: Cijk_Ailk_Bljk_HBH_MT128x064x32_PGR1_PLR1_TT08_04
    SolutionIndex: 60
    SolutionNameMin: Cijk_Ailk_Bljk_HBH_MT128x128x32_PGR0_PLR1_TT08_08
    SolutionIndex: 61
    SolutionNameMin: Cijk_Ailk_Bljk_HBH_MT128x064x08_PGR1_PLR1_TT04_08
    SolutionIndex: 62
    SolutionNameMin: Cijk_Ailk_Bljk_HBH_MT064x032x32_PGR1_PLR1_TT04_02
    SolutionIndex: 63
    SolutionNameMin: Cijk_Ailk_Bljk_HBH_MT064x032x16_PGR1_PLR1_TT04_02
    SolutionIndex: 64
    SolutionNameMin: Cijk_Ailk_Bljk_HBH_MT064x064x16_PGR1_PLR1_TT04_04
    SolutionIndex: 65
    SolutionNameMin: Cijk_Ailk_Bljk_HBH_MT128x032x08_PGR1_PLR1_TT04_04
    SolutionIndex: 66
    SolutionNameMin: Cijk_Ailk_Bljk_HBH_MT064x064x16_PGR1_PLR1_TT04_04
    SolutionIndex: 67
    SolutionNameMin: Cijk_Ailk_Bljk_HBH_MT128x032x16_PGR1_PLR1_TT04_04
    SolutionIndex: 68
    SolutionNameMin: Cijk_Ailk_Bljk_HBH_MT128x064x16_PGR1_PLR1_TT04_08
    SolutionIndex: 69
    SolutionNameMin: Cijk_Ailk_Bljk_HBH_MT064x064x16_PGR1_PLR0_TT04_04
    SolutionIndex: 70
    SolutionNameMin: Cijk_Ailk_Bljk_HBH_MT128x032x16_PGR0_PLR0_TT04_04
    SolutionIndex: 71
    SolutionNameMin: Cijk_Ailk_Bljk_HBH_MT032x128x16_PGR0_PLR0_TT04_04
    SolutionIndex: 72
    SolutionNameMin: Cijk_Ailk_Bljk_HBH_MT128x032x16_PGR0_PLR0_TT04_04
    SolutionIndex: 73
    SolutionNameMin: Cijk_Ailk_Bljk_HBH_MT064x064x04_PGR0_PLR0_TT04_04
    SolutionIndex: 74
    SolutionNameMin: Cijk_Ailk_Bljk_HBH_MT064x128x04_PGR1_PLR0_TT04_08
    SolutionIndex: 75
    SolutionNameMin: Cijk_Ailk_Bljk_HBH_MT064x064x04_PGR0_PLR1_TT04_04
    SolutionIndex: 76
    SolutionNameMin: Cijk_Ailk_Bljk_HBH_MT064x064x04_PGR1_PLR1_TT04_04
    SolutionIndex: 77
    SolutionNameMin: Cijk_Ailk_Bljk_HBH_MT064x128x08_PGR0_PLR0_TT04_08
    SolutionIndex: 78
    SolutionNameMin: Cijk_Ailk_Bljk_HBH_MT064x064x08_PGR0_PLR0_TT04_04
    SolutionIndex: 79
    SolutionNameMin: Cijk_Ailk_Bljk_HBH_MT064x064x08_PGR1_PLR0_TT04_04
    SolutionIndex: 80
    SolutionNameMin: Cijk_Ailk_Bljk_HBH_MT064x128x08_PGR0_PLR1_TT04_08
    SolutionIndex: 81
    SolutionNameMin: Cijk_Ailk_Bljk_HBH_MT064x064x08_PGR0_PLR1_TT04_04
    SolutionIndex: 82
    SolutionNameMin: Cijk_Ailk_Bljk_HBH_MT064x128x08_PGR1_PLR1_TT04_08
    SolutionIndex: 83
    SolutionNameMin: Cijk_Ailk_Bljk_HBH_MT064x064x08_PGR1_PLR1_TT04_04
    SolutionIndex: 84
    SolutionNameMin: Cijk_Ailk_Bljk_HBH_MT064x128x16_PGR0_PLR0_TT04_08
    SolutionIndex: 85
    SolutionNameMin: Cijk_Ailk_Bljk_HBH_MT064x064x16_PGR0_PLR0_TT04_04
    SolutionIndex: 86
    SolutionNameMin: Cijk_Ailk_Bljk_HBH_MT064x064x16_PGR1_PLR0_TT04_04
    SolutionIndex: 87
    SolutionNameMin: Cijk_Ailk_Bljk_HBH_MT064x128x16_PGR0_PLR1_TT04_08
    SolutionIndex: 88
    SolutionNameMin: Cijk_Ailk_Bljk_HBH_MT064x128x16_PGR1_PLR1_TT04_08
    SolutionIndex: 89
    SolutionNameMin: Cijk_Ailk_Bljk_HBH_MT064x128x04_PGR0_PLR0_TT04_08
    SolutionIndex: 90
    SolutionNameMin: Cijk_Ailk_Bljk_HBH_MT064x064x04_PGR0_PLR0_TT04_04
    SolutionIndex: 91
    SolutionNameMin: Cijk_Ailk_Bljk_HBH_MT064x128x04_PGR1_PLR0_TT04_08
    SolutionIndex: 92
    SolutionNameMin: Cijk_Ailk_Bljk_HBH_MT064x064x04_PGR1_PLR0_TT04_04
    SolutionIndex: 93
    SolutionNameMin: Cijk_Ailk_Bljk_HBH_MT128x128x04_PGR0_PLR1_TT08_08
    SolutionIndex: 94
    SolutionNameMin: Cijk_Ailk_Bljk_HBH_MT064x128x04_PGR0_PLR1_TT04_08
    SolutionIndex: 95
    SolutionNameMin: Cijk_Ailk_Bljk_HBH_MT064x064x04_PGR0_PLR1_TT04_04
    SolutionIndex: 96
    SolutionNameMin: Cijk_Ailk_Bljk_HBH_MT064x128x04_PGR1_PLR1_TT04_08
    SolutionIndex: 97
    SolutionNameMin: Cijk_Ailk_Bljk_HBH_MT064x064x04_PGR1_PLR1_TT04_04
    SolutionIndex: 98
    SolutionNameMin: Cijk_Ailk_Bljk_HBH_MT064x128x08_PGR0_PLR0_TT04_08
    SolutionIndex: 99
    SolutionNameMin: Cijk_Ailk_Bljk_HBH_MT064x064x08_PGR0_PLR0_TT04_04
    SolutionIndex: 100
    SolutionNameMin: Cijk_Ailk_Bljk_HBH_MT064x128x08_PGR1_PLR0_TT04_08
    SolutionIndex: 101
    SolutionNameMin: Cijk_Ailk_Bljk_HBH_MT064x064x08_PGR1_PLR0_TT04_04
    SolutionIndex: 102
    SolutionNameMin: Cijk_Ailk_Bljk_HBH_MT064x128x08_PGR0_PLR1_TT04_08
    SolutionIndex: 103
    SolutionNameMin: Cijk_Ailk_Bljk_HBH_MT064x064x08_PGR0_PLR1_TT04_04
    SolutionIndex: 104
    SolutionNameMin: Cijk_Ailk_Bljk_HBH_MT128x128x08_PGR1_PLR1_TT08_08
    SolutionIndex: 105
    SolutionNameMin: Cijk_Ailk_Bljk_HBH_MT064x064x08_PGR1_PLR1_TT04_04
    SolutionIndex: 106
    SolutionNameMin: Cijk_Ailk_Bljk_HBH_MT064x064x16_PGR1_PLR0_TT04_04
    SolutionIndex: 107
    SolutionNameMin: Cijk_Ailk_Bljk_HBH_MT064x064x16_PGR0_PLR1_TT04_04
    SolutionIndex: 108
    SolutionNameMin: Cijk_Ailk_Bljk_HBH_MT064x064x16_PGR1_PLR1_TT04_04
- - - [1856, 3584, 1, 1]
    - [94, 189.047]
  - - [128, 256, 1, 1280]
    - [17, 1690.2]
  - - [1760, 32, 1, 1760]
    - [12, 2829.02]
  - - [448, 1, 1, 256]
    - [105, 3.36575]
  - - [5056, 1408, 1, 3328]
    - [48, 10264.0]
  - - [3072, 24000, 1, 1024]
    - [54, 9881.46]
  - - [5056, 1856, 1, 3328]
    - [46, 10237.2]
  - - [5888, 128, 1, 1]
    - [95, 82.0493]
  - - [448, 3584, 1, 3328]
    - [52, 9237.5]
  - - [704, 64, 1, 3328]
    - [12, 2364.73]
  - - [2560, 32, 1, 2560]
    - [40, 3794.99]
  - - [5056, 4288, 1, 32]
    - [78, 4105.88]
  - - [5888, 256, 1, 256]
    - [20, 9219.79]
  - - [32, 5056, 1, 1280]
    - [83, 1684.14]
  - - [1856, 256, 1, 1]
    - [90, 62.2721]
  - - [448, 1, 1, 1]
    - [93, 0.066459]
  - - [1408, 3584, 1, 3328]
    - [52, 10265.0]
  - - [448, 448, 1, 3328]
    - [16, 6192.97]
  - - [1024, 2368, 1, 3328]
    - [20, 10101.0]
  - - [4288, 64, 1, 3328]
    - [28, 6401.51]
  - - [1, 4288, 1, 1280]
    - [105, 39.496]
  - - [2368, 64, 1, 1]
    - [95, 14.0125]
  - - [6144, 32, 1, 2560]
    - [28, 6687.57]
  - - [256, 128, 1, 256]
    - [13, 1258.23]
  - - [448, 64, 1, 1]
    - [104, 3.30837]
  - - [32, 1408, 1, 32]
    - [75, 108.133]
  - - [448, 3584, 1, 32]
    - [78, 2468.36]
  - - [64, 1024, 1, 1280]
    - [15, 3198.95]
  - - [704, 128, 1, 1280]
    - [4, 3892.72]
  - - [1, 1408, 1, 3328]
    - [108, 16.581]
  - - [32, 3584, 1, 1280]
    - [83, 1651.45]
  - - [4288, 6784, 1, 3328]
    - [54, 9633.33]
  - - [128, 1, 1, 1408]
    - [31, 6.2867]
  - - [2944, 128, 1, 32]
    - [79, 1114.99]
  - - [64, 6784, 1, 1]
    - [90, 55.821]
  - - [448, 128, 1, 256]
    - [37, 2108.3]
  - - [64, 5056, 1, 3328]
    - [8, 7524.63]
  - - [5888, 4288, 1, 3328]
    - [54, 9717.34]
  - - [1, 2368, 1, 1280]
    - [106, 26.9372]
  - - [704, 1024, 1, 1]
    - [95, 79.1194]
  - - [2368, 1408, 1, 32]
    - [78, 3124.28]
  - - [256, 1856, 1, 1280]
    - [52, 8057.05]
  - - [1024, 2944, 1, 1]
    - [89, 149.074]
  - - [2368, 2944, 1, 1280]
    - [46, 10961.1]
  - - [3136, 512, 1, 2048]
    - [70, 8353.62]
  - - [1, 1024, 1, 3328]
    - [105, 12.3669]
  - - [3584, 1408, 1, 32]
    - [81, 3422.18]
  - - [6784, 1856, 1, 32]
    - [78, 3913.09]
  - - [5056, 256, 1, 256]
    - [52, 9073.23]
  - - [1856, 2368, 1, 256]
    - [46, 10606.7]
  - - [512, 6000, 1, 2816]
    - [54, 10653.3]
  - - [2368, 1024, 1, 3328]
    - [46, 9894.59]
  - - [3584, 4288, 1, 32]
    - [78, 4082.92]
  - - [1024, 1024, 1, 1280]
    - [52, 10105.3]
  - - [3584, 3584, 1, 1]
    - [89, 211.725]
  - - [512, 48000, 1, 2560]
    - [54, 10035.3]
  - - [32, 2944, 1, 3328]
    - [83, 1408.94]
  - - [704, 1408, 1, 3328]
    - [24, 9731.81]
  - - [1408, 704, 1, 256]
    - [52, 8458.23]
  - - [704, 64, 1, 32]
    - [81, 95.8798]
  - - [8448, 1, 1, 2816]
    - [14, 372.134]
  - - [2368, 32, 1, 256]
    - [83, 713.553]
  - - [7680, 2, 1, 2560]
    - [42, 744.502]
  - - [7680, 3000, 1, 2560]
    - [54, 9880.23]
  - - [256, 193600, 1, 64]
    - [61, 10633.2]
  - - [2944, 256, 1, 1]
    - [92, 84.0861]
  - - [1408, 2368, 1, 1]
    - [94, 149.533]
  - - [32, 448, 1, 3328]
    - [83, 213.409]
  - - [5056, 1, 1, 3328]
    - [101, 46.9899]
  - - [2944, 256, 1, 32]
    - [79, 1871.15]
  - - [5056, 6784, 1, 1280]
    - [44, 10040.0]
  - - [4288, 5056, 1, 1]
    - [89, 222.396]
  - - [5056, 4288, 1, 1]
    - [94, 222.059]
  - - [128, 4288, 1, 3328]
    - [5, 7964.68]
  - - [5056, 128, 1, 256]
    - [9, 7633.21]
  - - [1408, 4288, 1, 1280]
    - [20, 10741.9]
  - - [1856, 704, 1, 1280]
    - [52, 10457.5]
  - - [4288, 1024, 1, 3328]
    - [46, 10593.3]
  - - [1, 5888, 1, 3328]
    - [105, 55.7605]
  - - [1024, 128, 1, 32]
    - [75, 301.174]
  - - [1024, 2368, 1, 32]
    - [78, 2771.19]
  - - [256, 704, 1, 1]
    - [92, 16.5503]
  - - [128, 448, 1, 1280]
    - [12, 2799.08]
  - - [704, 3584, 1, 1280]
    - [47, 10551.4]
  - - [1856, 5056, 1, 256]
    - [20, 11198.2]
  - - [1408, 1024, 1, 1280]
    - [52, 9835.53]
  - - [2368, 3584, 1, 1]
    - [94, 196.182]
  - - [5056, 5888, 1, 3328]
    - [54, 9695.97]
  - - [1024, 6000, 1, 1536]
    - [54, 10721.9]
  - - [3584, 3584, 1, 1280]
    - [54, 10787.1]
  - - [2368, 3584, 1, 32]
    - [78, 3803.15]
  - - [2944, 2368, 1, 1]
    - [89, 185.988]
  - - [704, 4288, 1, 1]
    - [89, 148.729]
  - - [512, 32, 1, 512]
    - [17, 754.948]
  - - [1024, 6784, 1, 1280]
    - [44, 10759.9]
  - - [1024, 3584, 1, 1]
    - [94, 162.437]
  - - [6784, 128, 1, 256]
    - [9, 7835.26]
  - - [2944, 2368, 1, 1280]
    - [46, 11212.0]
  - - [32, 5056, 1, 32]
    - [79, 529.489]
  - - [5888, 32, 1, 32]
    - [79, 598.502]
  - - [64, 128, 1, 3328]
    - [12, 425.479]
  - - [256, 5056, 1, 32]
    - [81, 2431.03]
  - - [5056, 64, 1, 32]
    - [83, 970.722]
  - - [64, 1, 1, 1216]
    - [1, 2.88627]
  - - [128, 6784, 1, 32]
    - [79, 1923.66]
  - - [64, 128, 1, 1]
    - [90, 0.742231]
  - - [64, 2368, 1, 1280]
    - [4, 5055.49]
  - - [128, 704, 1, 32]
    - [73, 208.171]
  - - [64, 6784, 1, 3328]
    - [5, 7709.91]
  - - [2944, 256, 1, 1280]
    - [19, 9164.61]
  - - [5124, 9124, 1, 4096]
    - [54, 9336.34]
  - - [5056, 704, 1, 1]
    - [95, 150.161]
  - - [2944, 4288, 1, 256]
    - [46, 11117.9]
  - - [1024, 1024, 1, 3328]
    - [46, 10241.1]
  - - [1024, 1500, 1, 2816]
    - [54, 10072.6]
  - - [5888, 1, 1, 256]
    - [101, 45.5214]
  - - [5056, 704, 1, 32]
    - [78, 3144.41]
  - - [5056, 704, 1, 1280]
    - [54, 10951.7]
  - - [1856, 4288, 1, 3328]
    - [46, 10024.7]
  - - [1, 1856, 1, 256]
    - [105, 14.9515]
  - - [6784, 4288, 1, 32]
    - [78, 4184.61]
  - - [448, 5888, 1, 256]
    - [52, 9407.67]
  - - [1408, 64, 1, 256]
    - [15, 2910.51]
  - - [5888, 5056, 1, 256]
    - [54, 11135.5]
  - - [3584, 448, 1, 3328]
    - [52, 9757.29]
  - - [5124, 700, 1, 2560]
    - [52, 10099.9]
  - - [2944, 448, 1, 256]
    - [54, 8067.22]
  - - [3584, 2368, 1, 3328]
    - [46, 10206.6]
  - - [4288, 1856, 1, 1]
    - [94, 190.491]
  - - [1856, 2944, 1, 1]
    - [89, 176.465]
  - - [32, 4288, 1, 3328]
    - [83, 1492.65]
  - - [1, 3584, 1, 3328]
    - [105, 43.1334]
  - - [256, 32, 1, 3328]
    - [83, 128.103]
  - - [1856, 2368, 1, 32]
    - [78, 3360.34]
  - - [4288, 1856, 1, 32]
    - [78, 3708.73]
  - - [5056, 64, 1, 3328]
    - [28, 7478.18]
  - - [6784, 1, 1, 1280]
    - [105, 61.2456]
  - - [1408, 256, 1, 1280]
    - [52, 6172.8]
  - - [1408, 64, 1, 1]
    - [92, 8.50675]
  - - [6144, 4, 1, 2560]
    - [12, 1247.17]
  - - [1, 1, 1, 3328]
    - [105, 0.0126269]
  - - [5056, 2368, 1, 256]
    - [20, 11289.5]
  - - [704, 704, 1, 256]
    - [52, 7048.56]
  - - [5056, 6784, 1, 1]
    - [94, 230.595]
  - - [32, 448, 1, 1280]
    - [83, 212.268]
  - - [32, 448, 1, 32]
    - [79, 52.9309]
  - - [1856, 64, 1, 256]
    - [15, 3698.23]
  - - [1024, 1408, 1, 3328]
    - [46, 9513.13]
  - - [7680, 128, 1, 2560]
    - [52, 9742.7]
  - - [256, 5056, 1, 1280]
    - [52, 10349.6]
  - - [704, 2368, 1, 1]
    - [90, 120.995]
  - - [64, 1024, 1, 32]
    - [75, 141.551]
  - - [1024, 256, 1, 256]
    - [23, 5490.38]
  - - [128, 1, 1, 1]
    - [108, 0.0158524]
  - - [1024, 1500, 1, 1536]
    - [48, 10304.0]
  - - [3584, 4288, 1, 1280]
    - [46, 10769.9]
  - - [2368, 5888, 1, 32]
    - [81, 4026.12]
  - - [1856, 128, 1, 32]
    - [81, 777.478]
  - - [1856, 128, 1, 1280]
    - [16, 6830.35]
  - - [128, 2944, 1, 3328]
    - [29, 7978.25]
  - - [1024, 2, 1, 500000]
    - [17, 117.023]
  - - [1, 6784, 1, 3328]
    - [105, 66.6481]
  - - [3584, 2368, 1, 1]
    - [94, 195.51]
  - - [4288, 32, 1, 3328]
    - [83, 1499.19]
  - - [6144, 1, 1, 2560]
    - [12, 310.88]
  - - [32, 2944, 1, 256]
    - [83, 799.922]
  - - [256, 1856, 1, 1]
    - [92, 59.9465]
  - - [1408, 3584, 1, 1]
    - [89, 171.162]
  - - [704, 6784, 1, 1280]
    - [52, 11150.6]
  - - [2368, 4288, 1, 32]
    - [78, 3944.59]
  - - [1024, 3000, 1, 2560]
    - [52, 10748.7]
  - - [704, 5056, 1, 1280]
    - [46, 11064.0]
  - - [256, 3584, 1, 3328]
    - [24, 9002.05]
  - - [3584, 6784, 1, 32]
    - [78, 4219.86]
  - - [3584, 6784, 1, 1280]
    - [46, 10278.2]
  - - [4288, 4288, 1, 3328]
    - [48, 9726.05]
  - - [3584, 64, 1, 1280]
    - [16, 6572.97]
  - - [64, 1856, 1, 256]
    - [15, 3665.24]
  - - [3584, 64, 1, 32]
    - [76, 502.983]
  - - [448, 1, 1, 1280]
    - [108, 4.75211]
  - - [704, 128, 1, 3328]
    - [14, 4239.22]
  - - [64, 1856, 1, 1]
    - [95, 11.3729]
  - - [4288, 1856, 1, 3328]
    - [52, 10007.5]
  - - [1856, 2944, 1, 1280]
    - [52, 11519.8]
  - - [4288, 256, 1, 256]
    - [52, 7821.93]
  - - [128, 5888, 1, 32]
    - [81, 1860.4]
  - - [128, 5888, 1, 1280]
    - [52, 9295.44]
  - - [1408, 128, 1, 3328]
    - [37, 6209.25]
  - - [3584, 256, 1, 256]
    - [52, 7946.85]
  - - [32, 6784, 1, 3328]
    - [83, 2345.04]
  - - [64, 64, 1, 1280]
    - [1, 189.243]
  - - [32, 3584, 1, 256]
    - [83, 1234.73]
  - - [2944, 5056, 1, 3328]
    - [48, 9936.79]
  - - [704, 256, 1, 32]
    - [75, 418.563]
  - - [448, 128, 1, 3328]
    - [12, 2995.67]
  - - [64, 4288, 1, 3328]
    - [28, 6404.83]
  - - [5888, 32, 1, 256]
    - [83, 1603.81]
  - - [5056, 1024, 1, 3328]
    - [55, 10521.6]
  - - [2368, 64, 1, 3328]
    - [26, 5438.28]
  - - [1856, 256, 1, 256]
    - [52, 6785.2]
  - - [128, 1500, 1, 1280]
    - [8, 6307.28]
  - - [7680, 6000, 1, 2560]
    - [54, 9796.59]
  - - [256, 704, 1, 256]
    - [23, 3821.06]
  - - [5888, 5888, 1, 256]
    - [20, 10941.6]
  - - [3584, 704, 1, 32]
    - [81, 2860.8]
  - - [448, 6784, 1, 3328]
    - [46, 10194.3]
  - - [6784, 4288, 1, 1]
    - [94, 225.431]
  - - [3584, 6784, 1, 1]
    - [89, 226.207]
  - - [1408, 2368, 1, 32]
    - [81, 3137.93]
  - - [448, 5056, 1, 32]
    - [78, 2756.32]
  - - [2048, 128, 1, 2048]
    - [27, 7463.95]
  - - [6784, 1408, 1, 1]
    - [89, 199.607]
  - - [1856, 5888, 1, 3328]
    - [52, 9963.14]
  - - [5056, 5888, 1, 1]
    - [89, 228.6]
  - - [2944, 1024, 1, 256]
    - [20, 10075.7]
  - - [448, 1408, 1, 3328]
    - [52, 7364.61]
  - - [5056, 32, 1, 3328]
    - [83, 1772.01]
  - - [2368, 4288, 1, 3328]
    - [46, 10084.1]
  - - [1024, 704, 1, 32]
    - [78, 1800.13]
  - - [448, 2944, 1, 256]
    - [52, 7940.86]
  - - [2944, 6784, 1, 256]
    - [48, 11281.7]
  - - [2368, 2368, 1, 1280]
    - [52, 11371.1]
  - - [5888, 128, 1, 3328]
    - [10, 9537.93]
  - - [256, 256, 1, 32]
    - [73, 148.224]
  - - [1024, 1, 1, 256]
    - [105, 7.89923]
  - - [3584, 3584, 1, 32]
    - [78, 4006.43]
  - - [2944, 448, 1, 1]
    - [90, 105.353]
  - - [4608, 32, 1, 1536]
    - [4, 5020.61]
  - - [512, 48000, 1, 2816]
    - [48, 10038.6]
  - - [128, 32, 1, 32]
    - [75, 9.88514]
  - - [5056, 64, 1, 1280]
    - [28, 7131.82]
  - - [1024, 1, 1, 3328]
    - [108, 12.1129]
  - - [2944, 2944, 1, 1280]
    - [54, 10958.8]
  - - [1, 2368, 1, 256]
    - [105, 18.9873]
  - - [1408, 5056, 1, 1]
    - [89, 189.55]
  - - [2944, 32, 1, 1280]
    - [83, 1354.3]
  - - [64, 1408, 1, 3328]
    - [14, 4217.1]
  - - [256, 448, 1, 1280]
    - [15, 4821.83]
  - - [4096, 64, 1, 4096]
    - [38, 7959.95]
  - - [2368, 6784, 1, 1]
    - [89, 218.614]
  - - [6784, 4288, 1, 1280]
    - [54, 10125.6]
  - - [2944, 704, 1, 256]
    - [20, 9893.15]
  - - [5888, 1856, 1, 256]
    - [54, 11276.9]
  - - [704, 2944, 1, 3328]
    - [52, 10818.4]
  - - [5888, 256, 1, 1]
    - [89, 121.844]
  - - [512, 50176, 1, 128]
    - [68, 11263.9]
  - - [704, 704, 1, 32]
    - [79, 1436.89]
  - - [256, 4288, 1, 256]
    - [52, 7854.39]
  - - [5056, 6784, 1, 32]
    - [81, 4187.99]
  - - [5056, 128, 1, 1]
    - [95, 74.0382]
  - - [3072, 4, 1, 1024]
    - [12, 615.452]
  - - [448, 5056, 1, 1280]
    - [52, 10592.6]
  - - [448, 448, 1, 256]
    - [16, 4655.06]
  - - [256, 5888, 1, 3328]
    - [53, 10095.3]
  - - [704, 448, 1, 1280]
    - [52, 5379.86]
  - - [448, 64, 1, 256]
    - [12, 1113.39]
  - - [5888, 1024, 1, 1]
    - [89, 181.275]
  - - [5888, 448, 1, 32]
    - [81, 2834.61]
  - - [6784, 2944, 1, 256]
    - [48, 11261.4]
  - - [1024, 256, 1, 1]
    - [95, 37.6481]
  - - [5888, 256, 1, 32]
    - [77, 2504.39]
  - - [2368, 448, 1, 256]
    - [52, 7574.96]
  - - [4288, 256, 1, 3328]
    - [52, 8397.28]
  - - [4288, 2944, 1, 256]
    - [46, 11098.1]
  - - [4096, 16, 1, 4096]
    - [12, 3386.71]
  - - [448, 5888, 1, 3328]
    - [51, 9316.71]
  - - [512, 2, 1, 500000]
    - [17, 58.5131]
  - - [128, 256, 1, 3328]
    - [12, 1786.59]
  - - [2368, 5056, 1, 32]
    - [81, 3996.91]
  - - [32, 128, 1, 1280]
    - [83, 56.2613]
  - - [1408, 4288, 1, 1]
    - [94, 182.336]
  - - [1408, 1856, 1, 3328]
    - [54, 10783.9]
  - - [4288, 64, 1, 256]
    - [8, 5044.67]
  - - [3584, 1024, 1, 3328]
    - [54, 10587.0]
  - - [2944, 5888, 1, 3328]
    - [54, 9709.99]
  - - [128, 6784, 1, 3328]
    - [9, 8665.51]
  - - [448, 4288, 1, 3328]
    - [46, 10084.7]
  - - [704, 2368, 1, 256]
    - [52, 8836.19]
  - - [1, 64, 1, 3328]
    - [108, 0.755267]
  - - [4288, 128, 1, 1]
    - [90, 63.8734]
  - - [256, 2368, 1, 32]
    - [78, 1522.54]
  - - [4288, 3584, 1, 3328]
    - [54, 9868.51]
  - - [1024, 24000, 1, 2560]
    - [54, 9927.88]
  - - [1408, 1024, 1, 1]
    - [89, 117.252]
  - - [64, 1024, 1, 1]
    - [95, 6.23055]
  - - [1408, 1024, 1, 256]
    - [54, 8818.93]
  - - [5056, 3584, 1, 1]
    - [89, 220.578]
  - - [448, 1024, 1, 256]
    - [52, 6551.22]
  - - [6784, 6784, 1, 3328]
    - [55, 9754.5]
  - - [6784, 32, 1, 32]
    - [83, 694.682]
  - - [2368, 2944, 1, 3328]
    - [46, 10187.1]
  - - [128, 3584, 1, 3328]
    - [27, 8149.54]
  - - [5056, 3584, 1, 32]
    - [78, 4041.25]
  - - [5056, 3584, 1, 1280]
    - [54, 10231.9]
  - - [7680, 48000, 1, 2560]
    - [55, 9597.18]
  - - [1856, 1856, 1, 256]
    - [20, 10012.3]
  - - [32, 5888, 1, 256]
    - [83, 1561.49]
  - - [256, 1408, 1, 32]
    - [79, 1088.86]
  - - [2944, 1, 1, 3328]
    - [108, 34.8063]
  - - [32, 704, 1, 3328]
    - [83, 336.808]
  - - [5888, 4288, 1, 1]
    - [89, 225.419]
  - - [1024, 128, 1, 256]
    - [4, 3973.52]
  - - [32, 1856, 1, 3328]
    - [83, 901.447]
  - - [512, 16, 1, 512]
    - [3, 316.324]
  - - [5056, 704, 1, 256]
    - [20, 10354.4]
  - - [2368, 5056, 1, 256]
    - [20, 11314.2]
  - - [3584, 704, 1, 1]
    - [90, 143.116]
  - - [1024, 5056, 1, 256]
    - [54, 10791.5]
  - - [32, 1024, 1, 3328]
    - [83, 499.375]
  - - [5888, 448, 1, 256]
    - [52, 9466.3]
  - - [6784, 5056, 1, 1280]
    - [48, 10094.8]
  - - [1024, 48000, 1, 2560]
    - [54, 9890.6]
  - - [8448, 32, 1, 2816]
    - [26, 6164.82]
  - - [4288, 6784, 1, 1280]
    - [52, 10291.3]
  - - [64, 1, 1, 256]
    - [105, 0.4676]
  - - [2944, 3584, 1, 3328]
    - [46, 9896.74]
  - - [128, 1408, 1, 1]
    - [95, 16.3283]
  - - [1024, 64, 1, 32]
    - [73, 145.935]
  - - [1024, 64, 1, 3328]
    - [12, 3411.71]
  - - [704, 6784, 1, 3328]
    - [55, 9699.24]
  - - [2944, 1856, 1, 1]
    - [89, 175.626]
  - - [5888, 4288, 1, 1280]
    - [46, 10160.6]
  - - [5888, 3584, 1, 1280]
    - [46, 10314.0]
  - - [3584, 1408, 1, 1280]
    - [55, 11004.1]
  - - [1024, 2944, 1, 256]
    - [54, 10046.6]
  - - [1, 2944, 1, 1280]
    - [108, 32.7775]
  - - [32, 1024, 1, 256]
    - [83, 292.612]
  - - [2944, 1856, 1, 1280]
    - [46, 11110.4]
  - - [3584, 1, 1, 1280]
    - [108, 41.3691]
  - - [256, 3584, 1, 32]
    - [81, 2022.19]
  - - [1024, 2368, 1, 1]
    - [89, 144.844]
  - - [2944, 3584, 1, 1280]
    - [46, 10690.2]
  - - [64, 1, 1, 1]
    - [108, 0.00751262]
  - - [1856, 4288, 1, 256]
    - [46, 10875.4]
  - - [256, 128, 1, 3328]
    - [12, 1784.43]
  - - [1024, 1024, 1, 1024]
    - [54, 9682.73]
  - - [1, 1856, 1, 3328]
    - [108, 21.1849]
  - - [704, 5888, 1, 1]
    - [89, 166.539]
  - - [2368, 2944, 1, 32]
    - [81, 3708.8]
  - - [128, 4288, 1, 32]
    - [81, 1403.02]
  - - [448, 256, 1, 256]
    - [15, 3603.35]
  - - [64, 64, 1, 1]
    - [99, 0.371099]
  - - [1, 1408, 1, 1]
    - [95, 0.155804]
  - - [128, 2368, 1, 1280]
    - [8, 6723.33]
  - - [5888, 64, 1, 3328]
    - [29, 7944.54]
  - - [5124, 1500, 1, 2560]
    - [48, 9842.51]
  - - [4288, 704, 1, 256]
    - [48, 10070.0]
  - - [1856, 1024, 1, 256]
    - [54, 9097.08]
  - - [448, 1856, 1, 32]
    - [78, 1851.48]
  - - [448, 1856, 1, 3328]
    - [54, 8188.51]
  - - [448, 448, 1, 32]
    - [73, 456.324]
  - - [1024, 448, 1, 256]
    - [23, 6551.41]
  - - [6784, 1, 1, 256]
    - [101, 51.1894]
  - - [704, 6784, 1, 32]
    - [81, 3360.16]
  - - [1024, 4288, 1, 1]
    - [94, 165.573]
  - - [704, 256, 1, 3328]
    - [23, 4874.68]
  - - [704, 1856, 1, 32]
    - [78, 2454.11]
  - - [1408, 5888, 1, 1280]
    - [54, 10989.0]
  - - [32, 704, 1, 1280]
    - [83, 310.92]
  - - [5056, 1856, 1, 256]
    - [20, 11202.0]
  - - [6784, 704, 1, 1280]
    - [46, 11060.9]
  - - [704, 1408, 1, 32]
    - [79, 2130.32]
  - - [5888, 1024, 1, 256]
    - [46, 10920.7]
  - - [64, 2944, 1, 1]
    - [92, 17.1858]
  - - [7680, 16, 1, 2560]
    - [37, 5308.26]
  - - [6144, 2, 1, 2560]
    - [12, 622.67]
  - - [64, 2944, 1, 32]
    - [73, 419.562]
  - - [64, 2944, 1, 1280]
    - [8, 6166.12]
  - - [512, 1500, 1, 1536]
    - [52, 9524.39]
  - - [6784, 1856, 1, 3328]
    - [48, 9714.83]
  - - [512, 24000, 1, 2816]
    - [54, 10084.8]
  - - [2368, 5888, 1, 1280]
    - [44, 10596.1]
  - - [1, 6784, 1, 256]
    - [105, 52.5669]
  - - [6784, 6784, 1, 32]
    - [81, 4266.34]
  - - [256, 1, 1, 1280]
    - [105, 2.83197]
  - - [5888, 128, 1, 32]
    - [81, 1829.07]
  - - [6784, 256, 1, 256]
    - [52, 9163.15]
  - - [2368, 3584, 1, 3328]
    - [46, 10169.3]
  - - [128, 4288, 1, 1280]
    - [5, 7666.99]
  - - [128, 128, 1, 256]
    - [12, 650.835]
  - - [5888, 1024, 1, 1280]
    - [52, 11297.3]
  - - [1856, 704, 1, 3328]
    - [56, 9639.11]
  - - [1024, 1500, 1, 2048]
    - [59, 9401.37]
  - - [5888, 6784, 1, 3328]
    - [54, 9686.74]
  - - [6784, 448, 1, 1]
    - [90, 147.586]
  - - [6784, 1856, 1, 1]
    - [94, 208.557]
  - - [128, 32, 1, 1280]
    - [83, 59.2272]
  - - [32, 1856, 1, 32]
    - [75, 141.747]
  - - [128, 256, 1, 1]
    - [99, 4.861]
  - - [6784, 448, 1, 32]
    - [78, 2983.89]
  - - [6784, 448, 1, 3328]
    - [48, 10235.6]
  - - [1, 6784, 1, 1]
    - [103, 1.05268]
  - - [448, 3584, 1, 1280]
    - [46, 9430.48]
  - - [1408, 6784, 1, 1280]
    - [54, 10836.5]
  - - [3584, 1856, 1, 3328]
    - [48, 10448.1]
  - - [32, 2944, 1, 32]
    - [75, 226.096]
  - - [5888, 704, 1, 1]
    - [92, 157.628]
  - - [3584, 1856, 1, 1]
    - [89, 184.014]
  - - [1, 256, 1, 256]
    - [105, 2.5063]
  - - [5056, 2944, 1, 32]
    - [78, 4013.77]
  - - [32, 6784, 1, 256]
    - [83, 1786.27]
  - - [64, 5056, 1, 256]
    - [8, 5824.4]
  - - [4288, 6784, 1, 1]
    - [94, 228.447]
  - - [2944, 64, 1, 256]
    - [8, 4932.96]
  - - [512, 48000, 1, 2048]
    - [54, 9637.41]
  - - [1, 4288, 1, 3328]
    - [105, 41.3136]
  - - [1024, 6784, 1, 1]
    - [89, 187.935]
  - - [256, 32, 1, 1280]
    - [83, 118.653]
  - - [128, 3584, 1, 1280]
    - [27, 7779.17]
  - - [4608, 24000, 1, 1536]
    - [54, 9816.04]
  - - [1760, 16, 1, 1760]
    - [12, 1490.13]
  - - [1, 256, 1, 1]
    - [92, 0.0467025]
  - - [3584, 4288, 1, 1]
    - [94, 214.989]
  - - [5888, 1024, 1, 3328]
    - [46, 10458.1]
  - - [6784, 5888, 1, 256]
    - [48, 11006.4]
  - - [4288, 6784, 1, 256]
    - [48, 11090.0]
  - - [2368, 3584, 1, 256]
    - [46, 10931.7]
  - - [32, 3584, 1, 3328]
    - [83, 1757.35]
  - - [1024, 1, 1, 1280]
    - [106, 11.263]
  - - [4288, 2368, 1, 32]
    - [78, 3881.75]
  - - [704, 3584, 1, 1]
    - [89, 148.739]
  - - [704, 1856, 1, 3328]
    - [52, 10284.2]
  - - [2944, 128, 1, 1280]
    - [28, 7226.95]
  - - [512, 1500, 1, 2816]
    - [52, 9731.8]
  - - [4096, 7000, 1, 4096]
    - [54, 9609.98]
  - - [1, 2368, 1, 3328]
    - [108, 28.5218]
  - - [6784, 704, 1, 32]
    - [78, 3343.83]
  - - [4288, 1, 1, 1280]
    - [101, 38.6713]
  - - [704, 5888, 1, 256]
    - [52, 10556.5]
  - - [2368, 3584, 1, 1280]
    - [46, 11100.5]
  - - [256, 12544, 1, 1024]
    - [67, 10642.8]
  - - [64, 448, 1, 256]
    - [12, 1100.95]
  - - [1408, 448, 1, 1280]
    - [52, 7807.75]
  - - [1408, 128, 1, 32]
    - [75, 420.823]
  - - [3584, 5056, 1, 32]
    - [78, 4100.52]
  - - [1024, 32, 1, 1280]
    - [83, 475.41]
  - - [128, 2368, 1, 1]
    - [95, 40.9185]
  - - [8448, 4, 1, 2816]
    - [14, 1486.8]
  - - [448, 448, 1, 1280]
    - [16, 5799.45]
  - - [6784, 1856, 1, 1280]
    - [52, 10652.5]
  - - [6144, 48000, 1, 2560]
    - [54, 9583.72]
  - - [5056, 5056, 1, 3328]
    - [48, 9701.18]
  - - [128, 704, 1, 1280]
    - [14, 3952.01]
  - - [128, 2944, 1, 1280]
    - [29, 7606.88]
  - - [2368, 5056, 1, 1]
    - [94, 205.109]
  - - [5888, 1408, 1, 256]
    - [20, 11122.1]
  - - [2368, 1024, 1, 32]
    - [78, 2778.53]
  - - [256, 256, 1, 3328]
    - [12, 3431.6]
  - - [64, 4288, 1, 1]
    - [95, 37.0479]
  - - [6144, 16, 1, 2560]
    - [36, 4412.04]
  - - [4288, 1024, 1, 256]
    - [52, 10589.3]
  - - [3584, 32, 1, 32]
    - [81, 276.784]
  - - [5124, 700, 1, 2048]
    - [57, 9128.67]
  - - [3584, 64, 1, 1]
    - [97, 33.2936]
  - - [704, 32, 1, 1280]
    - [83, 326.57]
  - - [7680, 1, 1, 2560]
    - [18, 372.247]
  - - [64, 64, 1, 3328]
    - [33, 213.232]
  - - [64, 1408, 1, 1]
    - [90, 8.33213]
  - - [4288, 5888, 1, 1280]
    - [47, 10037.0]
  - - [1856, 2944, 1, 3328]
    - [46, 10446.5]
  - - [4608, 3000, 1, 1536]
    - [54, 10593.0]
  - - [256, 1024, 1, 256]
    - [23, 5490.6]
  - - [5056, 5888, 1, 256]
    - [20, 11190.0]
  - - [1408, 128, 1, 1280]
    - [28, 5965.91]
  - - [1024, 5888, 1, 1280]
    - [52, 11536.2]
  - - [1024, 448, 1, 1]
    - [92, 59.5472]
  - - [32, 32, 1, 32]
    - [73, 2.49908]
  - - [5056, 1, 1, 1280]
    - [101, 45.8368]
  - - [5888, 5056, 1, 1280]
    - [54, 10247.7]
  - - [5888, 2944, 1, 1]
    - [89, 217.073]
  - - [64, 4288, 1, 1280]
    - [8, 6079.54]
  - - [448, 704, 1, 1280]
    - [52, 5379.86]
  - - [1408, 4288, 1, 3328]
    - [52, 10128.6]
  - - [704, 2944, 1, 32]
    - [81, 2878.89]
  - - [1, 5888, 1, 1280]
    - [105, 54.9955]
  - - [2944, 4288, 1, 3328]
    - [48, 9848.54]
  - - [256, 2944, 1, 256]
    - [52, 8038.92]
  - - [704, 448, 1, 32]
    - [79, 952.756]
  - - [5056, 2944, 1, 256]
    - [46, 11278.3]
  - - [1024, 700, 1, 512]
    - [52, 8271.02]
  - - [704, 1024, 1, 256]
    - [52, 7713.02]
  - - [2368, 1856, 1, 256]
    - [46, 10614.1]
  - - [64, 3584, 1, 1]
    - [92, 20.2388]
  - - [1024, 128, 1, 1280]
    - [37, 5366.99]
  - - [2368, 4288, 1, 1280]
    - [52, 10985.2]
  - - [512, 6000, 1, 2048]
    - [60, 9333.2]
  - - [256, 6784, 1, 256]
    - [52, 9149.2]
  - - [1024, 32, 1, 32]
    - [75, 79.5249]
  - - [1024, 1408, 1, 1]
    - [89, 116.551]
  - - [128, 64, 1, 32]
    - [75, 17.6939]
  - - [64, 1, 1, 1280]
    - [108, 0.671453]
  - - [6784, 5888, 1, 3328]
    - [54, 9713.8]
  - - [256, 5888, 1, 1]
    - [91, 119.696]
  - - [2944, 2944, 1, 1]
    - [94, 199.325]
  - - [6784, 3584, 1, 256]
    - [52, 11256.0]
  - - [1408, 1856, 1, 256]
    - [54, 10262.7]
  - - [128, 1408, 1, 256]
    - [8, 4718.48]
  - - [2944, 2944, 1, 32]
    - [81, 3797.26]
  - - [2944, 2944, 1, 3328]
    - [46, 10053.6]
  - - [1, 2944, 1, 256]
    - [105, 23.2286]
  - - [448, 32, 1, 1280]
    - [83, 207.644]
  - - [3584, 1, 1, 256]
    - [108, 33.9339]
  - - [704, 32, 1, 3328]
    - [83, 352.282]
  - - [256, 448, 1, 3328]
    - [15, 5188.89]
  - - [5124, 9124, 1, 2048]
    - [54, 9575.52]
  - - [1024, 24000, 1, 1536]
    - [48, 10090.7]
  - - [2368, 64, 1, 256]
    - [4, 4028.8]
  - - [64, 448, 1, 1280]
    - [12, 1478.92]
  - - [1408, 448, 1, 3328]
    - [52, 8046.28]
  - - [2368, 6784, 1, 3328]
    - [52, 9769.26]
  - - [4288, 3584, 1, 32]
    - [81, 4026.0]
  - - [256, 2368, 1, 1]
    - [92, 69.3483]
  - - [32, 4288, 1, 1280]
    - [83, 1423.18]
  - - [6784, 704, 1, 256]
    - [46, 10413.3]
  - - [3584, 704, 1, 1280]
    - [46, 10759.7]
  - - [448, 5056, 1, 3328]
    - [46, 9954.3]
  - - [4288, 448, 1, 256]
    - [25, 9106.82]
  - - [5056, 256, 1, 1280]
    - [19, 10259.4]
  - - [704, 448, 1, 3328]
    - [52, 5582.95]
  - - [2944, 5888, 1, 32]
    - [81, 4087.43]
  - - [3584, 5056, 1, 256]
    - [53, 11170.7]
  - - [6784, 1, 1, 3328]
    - [101, 63.0497]
  - - [1024, 32, 1, 512]
    - [12, 1470.65]
  - - [4288, 256, 1, 1]
    - [95, 98.1385]
  - - [64, 256, 1, 1]
    - [95, 2.57185]
  - - [1856, 448, 1, 3328]
    - [52, 8290.27]
  - - [3584, 2368, 1, 256]
    - [46, 10923.6]
  - - [4288, 4288, 1, 256]
    - [54, 11214.8]
  - - [4288, 256, 1, 1280]
    - [52, 8789.68]
  - - [4288, 4288, 1, 1280]
    - [46, 10588.1]
  - - [4288, 704, 1, 1280]
    - [46, 10853.6]
  - - [128, 1856, 1, 32]
    - [83, 814.504]
  - - [256, 1856, 1, 32]
    - [83, 1386.88]
  - - [1408, 1856, 1, 1]
    - [90, 146.989]
  - - [2368, 704, 1, 1]
    - [95, 120.995]
  - - [128, 50176, 1, 512]
    - [63, 11244.0]
  - - [3584, 32, 1, 256]
    - [83, 1040.29]
  - - [6784, 128, 1, 3328]
    - [6, 8772.7]
  - - [3584, 256, 1, 1]
    - [90, 91.0719]
  - - [2048, 16, 1, 2048]
    - [39, 1728.9]
  - - [1408, 1856, 1, 1280]
    - [54, 11171.6]
  - - [3584, 4288, 1, 3328]
    - [48, 9857.94]
  - - [1024, 24000, 1, 2048]
    - [54, 9818.88]
  - - [448, 4288, 1, 32]
    - [81, 2711.93]
  - - [448, 4288, 1, 1280]
    - [52, 10111.0]
  - - [64, 3584, 1, 256]
    - [27, 5081.36]
  - - [6784, 1408, 1, 1280]
    - [48, 10787.7]
  - - [3584, 704, 1, 256]
    - [48, 9863.9]
  - - [1, 6784, 1, 1280]
    - [105, 64.1267]
  - - [5056, 1024, 1, 256]
    - [20, 10785.0]
  - - [2368, 448, 1, 32]
    - [81, 2102.22]
  - - [256, 1, 1, 256]
    - [108, 2.48515]
  - - [32, 2944, 1, 1280]
    - [83, 1309.62]
  - - [448, 3584, 1, 1]
    - [92, 116.536]
  - - [2368, 256, 1, 256]
    - [52, 6608.72]
  - - [1, 5056, 1, 1]
    - [97, 0.8324]
  - - [512, 3000, 1, 2048]
    - [59, 9187.81]
  - - [4288, 32, 1, 32]
    - [83, 470.446]
  - - [3072, 1500, 1, 1024]
    - [54, 10780.0]
  - - [1856, 3584, 1, 32]
    - [78, 3655.9]
  - - [5056, 3584, 1, 3328]
    - [54, 9920.2]
  - - [1856, 256, 1, 32]
    - [78, 1386.88]
  - - [4288, 5056, 1, 256]
    - [20, 11266.8]
  - - [1856, 5888, 1, 256]
    - [47, 11170.2]
  - - [256, 256, 1, 256]
    - [37, 2383.97]
  - - [128, 1856, 1, 1]
    - [92, 34.4826]
  - - [4288, 2368, 1, 256]
    - [46, 11125.9]
  - - [448, 1, 1, 3328]
    - [108, 5.22375]
  - - [1856, 256, 1, 1280]
    - [19, 7924.76]
  - - [256, 2944, 1, 1]
    - [90, 81.3936]
  - - [1408, 2944, 1, 3328]
    - [52, 10755.9]
  - - [4288, 128, 1, 256]
    - [5, 6655.42]
  - - [5888, 3584, 1, 1]
    - [94, 223.257]
  - - [256, 1, 1, 1]
    - [105, 0.0454707]
  - - [6784, 5056, 1, 3328]
    - [54, 9744.88]
  - - [6784, 5056, 1, 1]
    - [89, 228.096]
  - - [5888, 3584, 1, 32]
    - [81, 4121.17]
  - - [5888, 3584, 1, 3328]
    - [54, 9821.48]
  - - [32, 1024, 1, 1280]
    - [83, 455.521]
  - - [1, 256, 1, 3328]
    - [105, 3.05558]
  - - [1024, 6784, 1, 256]
    - [46, 10794.7]
  - - [6784, 5888, 1, 32]
    - [78, 4255.33]
  - - [1408, 1, 1, 1280]
    - [106, 15.4866]
  - - [2368, 6784, 1, 32]
    - [78, 4086.96]
  - - [6784, 64, 1, 1]
    - [97, 55.295]
  - - [2368, 32, 1, 32]
    - [78, 187.051]
  - - [8448, 6000, 1, 2816]
    - [48, 9763.5]
  - - [5056, 1408, 1, 1280]
    - [20, 10999.7]
  - - [3584, 1408, 1, 3328]
    - [21, 10277.1]
  - - [2944, 3584, 1, 1]
    - [89, 203.483]
  - - [2944, 1408, 1, 1280]
    - [20, 11381.8]
  - - [256, 1408, 1, 1]
    - [95, 48.1754]
  - - [3584, 1024, 1, 1]
    - [89, 162.44]
  - - [256, 32, 1, 256]
    - [85, 77.9915]
  - - [2944, 1856, 1, 3328]
    - [52, 10428.3]
  - - [128, 1024, 1, 3328]
    - [15, 5882.73]
  - - [1408, 128, 1, 1]
    - [92, 17.0135]
  - - [2944, 3584, 1, 32]
    - [78, 3912.46]
  - - [3584, 1024, 1, 32]
    - [78, 3262.1]
  - - [64, 193600, 1, 256]
    - [66, 11119.1]
  - - [6784, 64, 1, 256]
    - [5, 6304.54]
  - - [256, 128, 1, 1280]
    - [12, 1680.17]
  - - [6784, 5056, 1, 256]
    - [20, 11152.2]
  - - [1408, 32, 1, 3328]
    - [83, 699.452]
  - - [1856, 3584, 1, 1280]
    - [52, 11061.6]
  - - [256, 5888, 1, 256]
    - [54, 9138.89]
  - - [5056, 32, 1, 256]
    - [83, 1367.07]
  - - [1024, 4288, 1, 3328]
    - [51, 10218.5]
  - - [448, 2368, 1, 256]
    - [52, 7606.36]
  - - [64, 1408, 1, 1280]
    - [12, 3932.0]
  - - [1024, 48000, 1, 2816]
    - [54, 9879.11]
  - - [3584, 32, 1, 1280]
    - [83, 1643.24]
  - - [128, 2368, 1, 3328]
    - [8, 7085.02]
  - - [3584, 1024, 1, 256]
    - [54, 10694.1]
  - - [256, 64, 1, 256]
    - [12, 650.784]
  - - [32, 1408, 1, 256]
    - [83, 398.237]
  - - [2368, 448, 1, 3328]
    - [52, 8382.17]
  - - [2368, 1408, 1, 1]
    - [89, 149.533]
  - - [1, 1, 1, 1]
    - [90, 0.00011538]
  - - [1024, 1856, 1, 32]
    - [81, 2691.87]
  - - [32, 1024, 1, 32]
    - [82, 100.39]
  - - [4288, 1, 1, 256]
    - [105, 33.2262]
  - - [1856, 128, 1, 3328]
    - [16, 7260.65]
  - - [5888, 2368, 1, 1]
    - [89, 210.54]
  - - [2368, 2368, 1, 1]
    - [94, 179.803]
  - - [704, 256, 1, 1280]
    - [23, 4718.44]
  - - [704, 4288, 1, 256]
    - [46, 9973.74]
  - - [5888, 2368, 1, 32]
    - [81, 3978.27]
  - - [5888, 2368, 1, 1280]
    - [45, 10520.2]
  - - [128, 256, 1, 256]
    - [12, 1258.32]
  - - [32, 4288, 1, 32]
    - [79, 474.206]
  - - [6784, 704, 1, 3328]
    - [52, 10225.7]
  - - [1856, 1856, 1, 32]
    - [81, 3074.54]
  - - [4288, 2944, 1, 32]
    - [78, 3931.77]
  - - [256, 5056, 1, 1]
    - [97, 109.208]
  - - [704, 64, 1, 256]
    - [12, 1639.1]
  - - [256, 2368, 1, 3328]
    - [52, 7728.4]
  - - [704, 1, 1, 1]
    - [90, 0.08054]
  - - [64, 2944, 1, 3328]
    - [8, 6665.27]
  - - [5056, 5056, 1, 256]
    - [20, 11347.9]
  - - [1024, 4, 1, 500000]
    - [17, 234.03]
  - - [5888, 64, 1, 1]
    - [92, 49.3882]
  - - [6784, 6784, 1, 256]
    - [47, 10929.7]
  - - [256, 1856, 1, 256]
    - [52, 6870.47]
  - - [5888, 64, 1, 32]
    - [83, 1114.99]
  - - [2368, 2944, 1, 256]
    - [46, 10852.4]
  - - [448, 32, 1, 32]
    - [74, 40.7436]
  - - [704, 64, 1, 1]
    - [95, 4.19477]
  - - [3584, 704, 1, 3328]
    - [54, 10532.0]
  - - [4288, 704, 1, 3328]
    - [20, 10153.6]
  - - [4288, 2944, 1, 1280]
    - [52, 10828.2]
  - - [5124, 1500, 1, 2048]
    - [50, 9504.24]
  - - [448, 3584, 1, 256]
    - [52, 8563.1]
  - - [704, 32, 1, 256]
    - [83, 205.963]
  - - [6784, 256, 1, 32]
    - [78, 2595.97]
  - - [1856, 128, 1, 1]
    - [97, 34.8596]
  - - [1856, 32, 1, 32]
    - [73, 148.306]
  - - [2368, 5056, 1, 1280]
    - [52, 10895.3]
  - - [1408, 6784, 1, 3328]
    - [46, 10118.4]
  - - [6144, 1500, 1, 2560]
    - [52, 10221.6]
  - - [1408, 1408, 1, 1280]
    - [54, 10402.6]
  - - [448, 1024, 1, 3328]
    - [52, 8050.85]
  - - [32, 704, 1, 32]
    - [88, 63.6047]
  - - [1024, 5056, 1, 1]
    - [89, 176.943]
  - - [5888, 1856, 1, 32]
    - [78, 3898.27]
  - - [5888, 704, 1, 3328]
    - [46, 10705.8]
  - - [5056, 1, 1, 256]
    - [101, 39.0019]
  - - [448, 6784, 1, 256]
    - [52, 10031.8]
  - - [1024, 128, 1, 1]
    - [95, 11.9559]
  - - [128, 64, 1, 256]
    - [3, 250.541]
  - - [2560, 128, 1, 2560]
    - [28, 7509.47]
  - - [1024, 64, 1, 1280]
    - [37, 3189.95]
  - - [1024, 256, 1, 1280]
    - [52, 6770.88]
  - - [128, 5056, 1, 32]
    - [75, 1634.91]
  - - [128, 5056, 1, 1280]
    - [9, 8946.17]
  - - [1856, 1408, 1, 32]
    - [81, 2955.22]
  - - [64, 704, 1, 32]
    - [87, 120.895]
  - - [64, 704, 1, 3328]
    - [12, 2387.05]
  - - [64, 2368, 1, 32]
    - [75, 337.474]
  - - [2944, 32, 1, 3328]
    - [83, 1476.26]
  - - [2368, 256, 1, 1]
    - [92, 69.9444]
  - - [5888, 64, 1, 1280]
    - [22, 7251.07]
  - - [5056, 1, 1, 1]
    - [92, 0.853189]
  - - [5888, 2944, 1, 1280]
    - [46, 10571.7]
  - - [32, 2368, 1, 256]
    - [83, 666.334]
  - - [1024, 6000, 1, 2560]
    - [53, 10418.6]
  - - [4224, 1500, 1, 176]
    - [46, 10212.9]
  - - [3584, 1408, 1, 1]
    - [89, 172.46]
  - - [32, 6784, 1, 1280]
    - [83, 2226.21]
  - - [32, 6784, 1, 32]
    - [78, 689.544]
  - - [7680, 32, 1, 2560]
    - [16, 7197.64]
  - - [448, 5888, 1, 32]
    - [81, 2848.77]
  - - [8448, 48000, 1, 2816]
    - [55, 9588.5]
  - - [1856, 6784, 1, 1]
    - [89, 208.302]
  - - [5056, 64, 1, 1]
    - [92, 44.1241]
  - - [3072, 48000, 1, 1024]
    - [54, 9805.5]
  - - [1, 5888, 1, 1]
    - [97, 0.935123]
  - - [2368, 1024, 1, 256]
    - [20, 9511.91]
  - - [1856, 6784, 1, 32]
    - [81, 4008.23]
  - - [1856, 6784, 1, 1280]
    - [52, 10397.0]
  - - [64, 3584, 1, 3328]
    - [34, 6806.57]
  - - [1408, 448, 1, 256]
    - [52, 6855.04]
  - - [5888, 5056, 1, 3328]
    - [54, 9905.29]
  - - [4096, 128, 1, 4096]
    - [32, 9110.68]
  - - [1, 2944, 1, 3328]
    - [108, 35.4595]
  - - [1408, 6784, 1, 32]
    - [81, 3881.74]
  - - [32, 5888, 1, 1280]
    - [83, 1941.4]
  - - [448, 256, 1, 1]
    - [92, 10.7517]
  - - [3584, 5888, 1, 3328]
    - [54, 9864.5]
  - - [4288, 1408, 1, 256]
    - [20, 10667.2]
  - - [448, 64, 1, 1280]
    - [12, 1483.34]
  - - [128, 448, 1, 32]
    - [84, 156.785]
  - - [512, 3136, 1, 2048]
    - [62, 9473.12]
  - - [6784, 2368, 1, 256]
    - [52, 11163.7]
  - - [1024, 24000, 1, 2816]
    - [54, 9996.07]
  - - [1408, 448, 1, 32]
    - [79, 1593.52]
  - - [1856, 1408, 1, 1280]
    - [52, 11204.8]
  - - [448, 256, 1, 3328]
    - [15, 5188.89]
  - - [1856, 2368, 1, 1]
    - [89, 164.808]
  - - [1408, 5056, 1, 3328]
    - [54, 10354.0]
  - - [128, 704, 1, 3328]
    - [14, 4230.34]
  - - [5056, 128, 1, 1280]
    - [29, 8819.21]
  - - [5056, 4288, 1, 256]
    - [48, 11352.1]
  - - [5056, 5056, 1, 32]
    - [78, 4112.82]
  - - [1856, 704, 1, 256]
    - [52, 9103.91]
  - - [3072, 32, 1, 1024]
    - [40, 4068.6]
  - - [64, 256, 1, 256]
    - [17, 650.835]
  - - [1024, 4, 1, 512]
    - [11, 183.84]
  - - [448, 5888, 1, 1280]
    - [46, 10252.0]
  - - [704, 704, 1, 3328]
    - [35, 8482.42]
  - - [128, 6784, 1, 256]
    - [9, 7876.49]
  - - [512, 4, 1, 500000]
    - [17, 117.033]
  - - [5056, 448, 1, 256]
    - [52, 9628.43]
  - - [4288, 5888, 1, 1]
    - [94, 224.381]
  - - [1856, 5056, 1, 1280]
    - [52, 11222.2]
  - - [2368, 4288, 1, 1]
    - [94, 202.174]
  - - [2368, 32, 1, 3328]
    - [83, 1184.95]
  - - [3584, 1856, 1, 256]
    - [54, 10848.6]
  - - [256, 3584, 1, 256]
    - [52, 7848.47]
  - - [64, 704, 1, 1]
    - [94, 5.68458]
  - - [4288, 5888, 1, 32]
    - [81, 4140.72]
  - - [4288, 5888, 1, 3328]
    - [54, 9786.67]
  - - [1, 1024, 1, 1]
    - [90, 0.11148]
  - - [1024, 2944, 1, 3328]
    - [52, 10260.5]
  - - [6144, 24000, 1, 2560]
    - [55, 9639.3]
  - - [1024, 5888, 1, 1]
    - [94, 183.32]
  - - [6784, 128, 1, 1280]
    - [29, 8947.36]
  - - [2944, 2368, 1, 256]
    - [46, 10857.3]
  - - [1024, 1856, 1, 256]
    - [54, 9059.39]
  - - [1760, 7000, 1, 1760]
    - [43, 10489.7]
  - - [2944, 64, 1, 3328]
    - [28, 6654.8]
  - - [1024, 5888, 1, 32]
    - [81, 3642.74]
  - - [1024, 5888, 1, 3328]
    - [46, 10505.2]
  - - [5056, 2368, 1, 32]
    - [81, 3942.09]
  - - [1408, 2368, 1, 1280]
    - [46, 11109.2]
  - - [256, 1, 1, 3328]
    - [108, 3.09089]
  - - [128, 1024, 1, 32]
    - [75, 283.102]
  - - [5056, 6784, 1, 3328]
    - [54, 9708.17]
  - - [1024, 3000, 1, 1536]
    - [54, 11087.7]
  - - [32, 64, 1, 32]
    - [73, 4.70585]
  - - [448, 704, 1, 32]
    - [83, 952.801]
  - - [448, 704, 1, 3328]
    - [52, 5578.54]
  - - [1408, 2944, 1, 256]
    - [48, 10666.6]
  - - [64, 6784, 1, 256]
    - [5, 6278.19]
  - - [1024, 704, 1, 1]
    - [90, 80.4257]
  - - [2368, 128, 1, 32]
    - [83, 928.654]
  - - [3584, 448, 1, 256]
    - [52, 8602.98]
  - - [784, 512, 64, 128]
    - [71, 10268.6]
  - - [2368, 128, 1, 3328]
    - [28, 7033.82]
  - - [704, 1856, 1, 1280]
    - [52, 10496.4]
  - - [704, 5056, 1, 32]
    - [78, 3176.9]
  - - [32, 2368, 1, 32]
    - [75, 183.894]
  - - [1408, 1, 1, 256]
    - [105, 10.9346]
  - - [4288, 256, 1, 32]
    - [81, 2165.28]
  - - [448, 1408, 1, 1]
    - [92, 70.9623]
  - - [5056, 4288, 1, 1280]
    - [20, 10332.9]
  - - [5888, 1, 1, 3328]
    - [101, 54.9041]
  - - [1408, 256, 1, 256]
    - [19, 5212.08]
  - - [4288, 448, 1, 1]
    - [92, 127.123]
  - - [1024, 448, 1, 32]
    - [79, 1330.08]
  - - [5888, 6784, 1, 1280]
    - [54, 10064.9]
  - - [256, 256, 1, 1]
    - [92, 6.14381]
  - - [1856, 64, 1, 1280]
    - [15, 4981.85]
  - - [1408, 1, 1, 1]
    - [90, 0.166736]
  - - [448, 1408, 1, 256]
    - [46, 6749.03]
  - - [5888, 5888, 1, 1]
    - [89, 230.207]
  - - [4608, 16, 1, 1536]
    - [14, 3287.74]
  - - [128, 2944, 1, 32]
    - [79, 1130.46]
  - - [448, 32, 1, 3328]
    - [83, 224.257]
  - - [32, 256, 1, 32]
    - [83, 32.768]
  - - [2944, 704, 1, 1280]
    - [52, 10928.6]
  - - [1024, 3584, 1, 1280]
    - [46, 11411.9]
  - - [1856, 448, 1, 1]
    - [89, 83.7687]
  - - [2368, 2944, 1, 1]
    - [89, 187.099]
  - - [5056, 256, 1, 32]
    - [78, 2452.34]
  - - [4288, 1, 1, 3328]
    - [101, 40.0677]
  - - [5056, 1024, 1, 1280]
    - [20, 11156.2]
  - - [704, 704, 1, 1]
    - [92, 63.7202]
  - - [1856, 448, 1, 1280]
    - [23, 8022.16]
  - - [3584, 6784, 1, 256]
    - [20, 11425.9]
  - - [1856, 1024, 1, 1]
    - [94, 130.237]
  - - [64, 1856, 1, 1280]
    - [15, 4993.96]
  - - [1856, 1408, 1, 256]
    - [20, 10158.7]
  - - [4288, 4288, 1, 32]
    - [81, 4071.2]
  - - [128, 1, 1, 256]
    - [105, 0.957485]
  - - [32, 64, 1, 3328]
    - [83, 30.3462]
  - - [5888, 448, 1, 1]
    - [90, 140.752]
  - - [7680, 4, 1, 2560]
    - [18, 1468.39]
  - - [128, 5888, 1, 256]
    - [10, 8038.75]
  - - [3584, 256, 1, 3328]
    - [19, 9101.42]
  - - [5056, 5056, 1, 1280]
    - [52, 10133.5]
  - - [2368, 1, 1, 256]
    - [105, 18.1453]
  - - [6784, 1408, 1, 3328]
    - [54, 9927.2]
  - - [512, 24000, 1, 2048]
    - [58, 9550.71]
  - - [1408, 1408, 1, 1]
    - [89, 134.482]
  - - [32, 64, 1, 256]
    - [83, 17.7833]
  - - [2368, 1, 1, 1280]
    - [108, 25.7344]
  - - [32, 3584, 1, 32]
    - [83, 430.804]
  - - [128, 6784, 1, 1]
    - [94, 86.8352]
  - - [1, 3584, 1, 1]
    - [92, 0.597333]
  - - [3072, 2, 1, 1024]
    - [12, 307.726]
  - - [512, 24000, 1, 2560]
    - [52, 10377.1]
  - - [1, 128, 1, 3328]
    - [105, 1.49173]
  - - [32, 256, 1, 256]
    - [83, 94.3707]
  - - [4608, 1, 1, 1536]
    - [12, 231.914]
  - - [5888, 1408, 1, 32]
    - [78, 3757.91]
  - - [704, 256, 1, 1]
    - [95, 16.8955]
  - - [448, 2944, 1, 3328]
    - [52, 8795.35]
  - - [1, 448, 1, 1]
    - [102, 0.0711506]
  - - [64, 5888, 1, 256]
    - [2, 5973.87]
  - - [1856, 1, 1, 1]
    - [95, 0.214146]
  - - [1024, 256, 1, 3328]
    - [23, 7052.24]
  - - [512, 1500, 1, 2048]
    - [57, 8220.3]
  - - [448, 1024, 1, 32]
    - [78, 1330.08]
  - - [6784, 2368, 1, 1280]
    - [52, 10671.9]
  - - [128, 1856, 1, 1280]
    - [16, 6807.72]
  - - [256, 2368, 1, 256]
    - [52, 6446.07]
  - - [2944, 1408, 1, 1]
    - [89, 166.045]
  - - [6784, 1024, 1, 256]
    - [46, 10809.3]
  - - [5056, 1408, 1, 32]
    - [81, 3635.02]
  - - [2944, 1408, 1, 3328]
    - [47, 10637.3]
  - - [1856, 32, 1, 256]
    - [83, 548.794]
  - - [704, 2368, 1, 32]
    - [78, 2553.74]
  - - [448, 256, 1, 32]
    - [73, 263.528]
  - - [704, 6784, 1, 1]
    - [94, 167.462]
  - - [2368, 6784, 1, 256]
    - [47, 11284.0]
  - - [256, 1408, 1, 256]
    - [52, 5256.02]
  - - [256, 4288, 1, 1280]
    - [52, 8769.38]
  - - [6144, 6000, 1, 2560]
    - [48, 9846.27]
  - - [1856, 1856, 1, 1]
    - [89, 151.968]
  - - [1856, 3584, 1, 3328]
    - [20, 10241.2]
  - - [1, 704, 1, 3328]
    - [105, 8.66055]
  - - [256, 128, 1, 1]
    - [98, 4.13424]
  - - [4096, 32, 1, 4096]
    - [37, 5788.77]
  - - [64, 1, 1, 3328]
    - [108, 0.727188]
  - - [256, 2944, 1, 3328]
    - [52, 9586.52]
  - - [704, 1856, 1, 1]
    - [92, 108.881]
  - - [704, 448, 1, 256]
    - [52, 4638.12]
  - - [448, 64, 1, 3328]
    - [41, 1576.66]
  - - [704, 6784, 1, 256]
    - [46, 10393.6]
  - - [2368, 448, 1, 1280]
    - [46, 8447.55]
  - - [6784, 2944, 1, 32]
    - [81, 4094.77]
  - - [64, 4288, 1, 32]
    - [79, 852.894]
  - - [128, 704, 1, 1]
    - [92, 8.38954]
  - - [128, 448, 1, 3328]
    - [12, 3020.25]
  - - [5888, 2368, 1, 3328]
    - [54, 10003.4]
  - - [2368, 704, 1, 1280]
    - [46, 9818.04]
  - - [1024, 1408, 1, 1280]
    - [52, 9847.18]
  - - [3072, 6000, 1, 1024]
    - [54, 10562.8]
  - - [1408, 5888, 1, 256]
    - [48, 11126.4]
  - - [4288, 64, 1, 1280]
    - [28, 6063.96]
  - - [128, 5056, 1, 1]
    - [90, 72.2004]
  - - [2944, 5056, 1, 32]
    - [78, 4082.57]
  - - [7680, 64, 1, 2560]
    - [30, 8501.71]
  - - [448, 448, 1, 1]
    - [95, 18.3066]
  - - [256, 2368, 1, 1280]
    - [52, 7503.55]
  - - [704, 2368, 1, 3328]
    - [52, 9549.4]
  - - [3584, 2944, 1, 256]
    - [46, 11016.3]
  - - [5056, 256, 1, 3328]
    - [52, 9989.72]
  - - [3584, 1024, 1, 1280]
    - [48, 11393.4]
  - - [1408, 256, 1, 32]
    - [79, 1081.31]
  - - [64, 1024, 1, 256]
    - [39, 2383.97]
  - - [1408, 32, 1, 32]
    - [73, 109.347]
  - - [128, 3584, 1, 256]
    - [5, 6633.37]
  - - [704, 1408, 1, 1]
    - [94, 98.3902]
  - - [5056, 3584, 1, 256]
    - [48, 11361.2]
  - - [2368, 704, 1, 256]
    - [46, 8836.19]
  - - [1856, 1856, 1, 1280]
    - [53, 10437.2]
  - - [32, 5888, 1, 32]
    - [79, 611.989]
  - - [2368, 2368, 1, 3328]
    - [52, 10230.4]
  - - [4288, 704, 1, 1]
    - [90, 149.273]
  - - [3072, 1500, 1, 128]
    - [54, 9854.46]
  - - [2048, 3136, 1, 512]
    - [7, 11226.9]
  - - [4288, 2944, 1, 3328]
    - [48, 9780.94]
  - - [1024, 128, 1, 3328]
    - [37, 5876.87]
  - - [4288, 128, 1, 3328]
    - [27, 7964.66]
  - - [4288, 704, 1, 32]
    - [78, 2997.86]
  - - [1856, 1024, 1, 32]
    - [81, 2665.62]
  - - [1, 448, 1, 3328]
    - [105, 5.3701]
  - - [2944, 6784, 1, 1]
    - [89, 222.822]
  - - [6784, 2368, 1, 32]
    - [81, 4018.34]
  - - [5888, 5056, 1, 1]
    - [89, 227.179]
  - - [128, 6784, 1, 1280]
    - [0, 9033.53]
  - - [6784, 6784, 1, 1]
    - [94, 235.693]
  - - [1856, 32, 1, 1280]
    - [83, 859.513]
  - - [3072, 16, 1, 1024]
    - [12, 2351.07]
  - - [1024, 2, 1, 512]
    - [11, 92.5201]
  - - [5888, 448, 1, 3328]
    - [52, 9760.21]
  - - [704, 5888, 1, 32]
    - [81, 3340.76]
  - - [704, 5888, 1, 1280]
    - [46, 11344.0]
  - - [1024, 6784, 1, 3328]
    - [46, 10184.3]
  - - [704, 2944, 1, 1280]
    - [20, 10308.9]
  - - [3584, 256, 1, 32]
    - [78, 2011.93]
  - - [1408, 1408, 1, 32]
    - [78, 2780.52]
  - - [1024, 64, 1, 256]
    - [37, 2335.03]
  - - [4288, 64, 1, 32]
    - [83, 829.021]
  - - [5888, 6784, 1, 32]
    - [81, 4231.33]
  - - [5888, 128, 1, 256]
    - [10, 8063.78]
  - - [64, 704, 1, 1280]
    - [12, 2269.82]
  - - [2944, 1856, 1, 256]
    - [46, 10747.4]
  - - [128, 5056, 1, 3328]
    - [9, 9265.48]
  - - [4288, 2944, 1, 1]
    - [94, 208.844]
  - - [6784, 5056, 1, 32]
    - [81, 4219.0]
  - - [64, 1024, 1, 3328]
    - [12, 3423.6]
  - - [3584, 128, 1, 1]
    - [90, 58.9769]
  - - [2944, 4288, 1, 1280]
    - [52, 10653.7]
  - - [64, 32, 1, 3328]
    - [83, 31.9478]
  - - [1024, 4288, 1, 256]
    - [52, 10596.8]
  - - [128, 2368, 1, 256]
    - [8, 5601.49]
  - - [2368, 64, 1, 32]
    - [75, 337.462]
  - - [1408, 1, 1, 3328]
    - [108, 16.4731]
  - - [64, 1408, 1, 32]
    - [73, 204.88]
  - - [2368, 5888, 1, 1]
    - [89, 213.889]
  - - [1408, 1856, 1, 32]
    - [78, 2978.59]
  - - [256, 4288, 1, 32]
    - [81, 2165.34]
  - - [1856, 6784, 1, 3328]
    - [54, 9732.56]
  - - [3584, 128, 1, 256]
    - [10, 6633.56]
  - - [1024, 448, 1, 1280]
    - [23, 7651.55]
  - - [512, 6000, 1, 1536]
    - [52, 11101.3]
  - - [128, 5888, 1, 1]
    - [97, 81.3936]
  - - [32, 2368, 1, 1280]
    - [83, 1066.26]
  - - [64, 32, 1, 32]
    - [75, 4.88783]
  - - [1408, 704, 1, 1]
    - [97, 95.5819]
  - - [64, 448, 1, 1]
    - [92, 4.34885]
  - - [3584, 5888, 1, 32]
    - [78, 4170.19]
  - - [3584, 5888, 1, 1280]
    - [44, 10368.3]
  - - [448, 5888, 1, 1]
    - [92, 133.368]
  - - [64, 5056, 1, 32]
    - [78, 984.38]
  - - [2944, 64, 1, 1]
    - [92, 17.6634]
  - - [1408, 704, 1, 32]
    - [81, 2151.78]
  - - [1408, 704, 1, 1280]
    - [52, 9633.26]
  - - [2368, 5888, 1, 256]
    - [46, 11166.8]
  - - [2944, 64, 1, 32]
    - [76, 417.398]
  - - [1, 1408, 1, 256]
    - [105, 11.3956]
  - - [64, 2944, 1, 256]
    - [8, 4752.87]
  - - [5888, 5888, 1, 32]
    - [81, 4219.87]
  - - [1856, 1408, 1, 3328]
    - [20, 10596.1]
  - - [1024, 1024, 1, 32]
    - [79, 2276.19]
  - - [4288, 1024, 1, 1]
    - [94, 166.036]
  - - [704, 4288, 1, 3328]
    - [46, 10161.3]
  - - [2944, 5056, 1, 1280]
    - [46, 10560.1]
  - - [512, 3000, 1, 2816]
    - [20, 10217.1]
  - - [6784, 2944, 1, 1280]
    - [46, 10499.5]
  - - [6784, 256, 1, 3328]
    - [19, 9872.73]
  - - [5056, 128, 1, 3328]
    - [29, 9218.49]
  - - [128, 128, 1, 1280]
    - [17, 860.511]
  - - [128, 4288, 1, 1]
    - [90, 63.328]
  - - [1408, 5056, 1, 32]
    - [78, 3687.36]
  - - [2944, 128, 1, 3328]
    - [9, 7859.7]
  - - [5888, 1856, 1, 1280]
    - [54, 10954.4]
  - - [64, 128, 1, 256]
    - [1, 257.367]
  - - [5888, 256, 1, 1280]
    - [52, 10323.4]
  - - [1856, 5056, 1, 1]
    - [89, 195.796]
  - - [3584, 1856, 1, 1280]
    - [48, 10873.3]
  - - [704, 3584, 1, 256]
    - [46, 9786.41]
  - - [1856, 5056, 1, 32]
    - [81, 3886.59]
  - - [1856, 5056, 1, 3328]
    - [52, 10330.3]
  - - [1024, 2944, 1, 32]
    - [78, 3035.62]
  - - [1408, 6784, 1, 256]
    - [46, 11018.1]
  - - [1024, 2368, 1, 1280]
    - [52, 10407.3]
  - - [448, 6784, 1, 1]
    - [89, 148.654]
  - - [5888, 128, 1, 1280]
    - [52, 9282.2]
  - - [512, 4, 1, 512]
    - [1, 78.2053]
  - - [2944, 5888, 1, 1280]
    - [46, 10615.1]
  - - [1, 1856, 1, 1]
    - [90, 0.205378]
  - - [3584, 3584, 1, 256]
    - [52, 11235.4]
  - - [1856, 2368, 1, 3328]
    - [52, 10660.4]
  - - [5888, 704, 1, 256]
    - [54, 10658.6]
  - - [64, 448, 1, 32]
    - [86, 100.697]
  - - [6784, 4288, 1, 256]
    - [53, 11120.7]
  - - [128, 64, 1, 3328]
    - [12, 425.479]
  - - [2944, 64, 1, 1280]
    - [28, 6237.08]
  - - [1, 5056, 1, 1280]
    - [105, 47.0462]
  - - [32, 64, 1, 1280]
    - [83, 27.8211]
  - - [1408, 2368, 1, 3328]
    - [52, 10456.7]
  - - [1024, 3584, 1, 256]
    - [20, 10551.7]
  - - [2944, 128, 1, 256]
    - [9, 6352.5]
  - - [6784, 128, 1, 1]
    - [89, 86.1931]
  - - [1408, 256, 1, 3328]
    - [46, 6087.86]
  - - [1024, 16, 1, 512]
    - [12, 760.044]
  - - [448, 32, 1, 256]
    - [83, 134.63]
  - - [512, 24000, 1, 1536]
    - [54, 10532.3]
  - - [1, 5888, 1, 256]
    - [105, 45.6241]
  - - [64, 2368, 1, 256]
    - [4, 3967.82]
  - - [448, 1856, 1, 256]
    - [52, 7148.02]
  - - [2944, 256, 1, 256]
    - [52, 8063.78]
  - - [1, 128, 1, 256]
    - [105, 0.976502]
  - - [32, 256, 1, 1280]
    - [83, 121.193]
  - - [4224, 1, 1, 128]
    - [14, 117.717]
  - - [32, 128, 1, 3328]
    - [83, 61.0549]
  - - [1024, 3000, 1, 2048]
    - [54, 10017.9]
  - - [1024, 12544, 1, 256]
    - [65, 11402.8]
  - - [6784, 64, 1, 1280]
    - [52, 7420.72]
  - - [4288, 1024, 1, 32]
    - [78, 3345.34]
  - - [2944, 1, 1, 1280]
    - [106, 31.914]
  - - [1408, 64, 1, 3328]
    - [40, 4230.34]
  - - [2944, 448, 1, 1280]
    - [52, 9029.34]
  - - [6784, 32, 1, 1280]
    - [83, 2276.19]
  - - [1024, 704, 1, 1280]
    - [52, 8929.54]
  - - [704, 448, 1, 1]
    - [95, 42.5745]
  - - [32, 128, 1, 32]
    - [73, 9.4117]
  - - [1, 128, 1, 1]
    - [95, 0.0138236]
  - - [2560, 7000, 1, 2560]
    - [48, 9872.09]
  - - [5888, 1, 1, 1]
    - [92, 0.969298]
  - - [5888, 1856, 1, 3328]
    - [54, 9994.17]
  - - [32, 2368, 1, 3328]
    - [83, 1163.49]
  - - [196, 256, 64, 1024]
    - [72, 8040.41]
  - - [4288, 1408, 1, 3328]
    - [48, 10205.6]
  - - [1856, 64, 1, 1]
    - [90, 11.0589]
  - - [1856, 32, 1, 3328]
    - [83, 918.831]
  - - [2944, 32, 1, 256]
    - [83, 875.193]
  - - [128, 64, 1, 1]
    - [107, 0.937193]
  - - [256, 1024, 1, 3328]
    - [35, 7203.2]
  - - [32, 448, 1, 256]
    - [86, 132.47]
  - - [1856, 64, 1, 32]
    - [81, 259.15]
  - - [1856, 64, 1, 3328]
    - [37, 5325.91]
  - - [256, 5056, 1, 256]
    - [52, 9018.29]
  - - [5888, 2944, 1, 3328]
    - [48, 9768.69]
  - - [2368, 1408, 1, 3328]
    - [52, 10344.7]
  - - [5888, 704, 1, 32]
    - [78, 3297.7]
  - - [2944, 704, 1, 1]
    - [97, 133.87]
  - - [6784, 1856, 1, 256]
    - [46, 11091.9]
  - - [1, 704, 1, 256]
    - [105, 5.67126]
  - - [448, 5056, 1, 1]
    - [94, 136.509]
  - - [3584, 448, 1, 32]
    - [81, 2459.62]
  - - [2368, 1856, 1, 1]
    - [94, 164.349]
  - - [128, 704, 1, 256]
    - [4, 2910.32]
  - - [256, 1408, 1, 3328]
    - [52, 6352.97]
  - - [2944, 128, 1, 1]
    - [92, 50.3651]
  - - [32, 256, 1, 3328]
    - [83, 124.548]
  - - [2944, 704, 1, 3328]
    - [52, 10770.8]
  - - [704, 1024, 1, 32]
    - [79, 1800.13]
  - - [2368, 1856, 1, 32]
    - [78, 3378.26]
  - - [5056, 4288, 1, 3328]
    - [54, 9858.74]
  - - [64, 193600, 1, 64]
    - [64, 9541.0]
  - - [256, 32, 1, 32]
    - [78, 30.2462]
  - - [64, 256, 1, 3328]
    - [17, 905.386]
  - - [256, 6784, 1, 1]
    - [90, 122.748]
  - - [7680, 1500, 1, 2560]
    - [52, 10129.7]
  - - [704, 5056, 1, 256]
    - [52, 10259.4]
  - - [1024, 3584, 1, 32]
    - [81, 3262.1]
  - - [256, 6784, 1, 32]
    - [81, 2632.37]
  - - [2944, 1408, 1, 32]
    - [78, 3347.0]
  - - [1024, 32, 1, 256]
    - [83, 302.789]
  - - [4288, 3584, 1, 1]
    - [89, 215.434]
  - - [1, 704, 1, 1]
    - [96, 0.10924]
  - - [5056, 448, 1, 3328]
    - [46, 10634.6]
  - - [3584, 64, 1, 256]
    - [16, 5215.17]
  - - [64, 1856, 1, 32]
    - [75, 264.506]
  - - [64, 1856, 1, 3328]
    - [37, 5304.72]
  - - [5888, 5888, 1, 3328]
    - [54, 9697.41]
  - - [4288, 1856, 1, 256]
    - [46, 10888.3]
  - - [1856, 2944, 1, 256]
    - [46, 10821.3]
  - - [128, 448, 1, 1]
    - [100, 6.97403]
  - - [64, 128, 1, 32]
    - [75, 17.606]
  - - [704, 1, 1, 1280]
    - [108, 7.60773]
  - - [5056, 5888, 1, 1280]
    - [47, 10107.2]
  - - [2944, 5888, 1, 1]
    - [94, 218.492]
  - - [1024, 1856, 1, 3328]
    - [48, 9969.06]
  - - [5888, 1024, 1, 32]
    - [81, 3612.46]
  - - [3584, 256, 1, 1280]
    - [52, 8951.98]
  - - [1024, 1, 1, 1]
    - [90, 0.121255]
  - - [1408, 5056, 1, 1280]
    - [20, 11033.3]
  - - [3584, 128, 1, 1280]
    - [52, 7794.5]
  - - [5056, 6784, 1, 256]
    - [54, 10995.0]
  - - [64, 4288, 1, 256]
    - [8, 5126.58]
  - - [5888, 32, 1, 1280]
    - [83, 1976.76]
  - - [256, 128, 1, 32]
    - [80, 85.7871]
  - - [32, 1856, 1, 1280]
    - [83, 841.889]
  - - [2944, 5056, 1, 1]
    - [89, 214.22]
  - - [448, 128, 1, 1]
    - [92, 5.3388]
  - - [256, 704, 1, 32]
    - [73, 405.496]
  - - [1, 2368, 1, 1]
    - [90, 0.259891]
  - - [5888, 5888, 1, 1280]
    - [48, 10016.9]
  - - [256, 2944, 1, 1280]
    - [23, 9068.89]
  - - [2944, 256, 1, 3328]
    - [52, 8639.84]
  - - [5056, 2944, 1, 1280]
    - [47, 10593.2]
  - - [704, 1024, 1, 3328]
    - [52, 9177.5]
  - - [2368, 1856, 1, 1280]
    - [52, 11076.9]
  - - [1024, 6000, 1, 2816]
    - [47, 10567.0]
  - - [1856, 128, 1, 256]
    - [16, 5437.16]
  - - [6784, 2944, 1, 1]
    - [89, 220.815]
  - - [2944, 1024, 1, 32]
    - [78, 3021.55]
  - - [2944, 1024, 1, 1280]
    - [52, 10902.4]
  - - [1408, 64, 1, 32]
    - [73, 200.66]
  - - [5056, 5056, 1, 1]
    - [89, 224.231]
  - - [2368, 4288, 1, 256]
    - [46, 11125.9]
  - - [448, 1856, 1, 1280]
    - [52, 8085.36]
  - - [256, 3584, 1, 1]
    - [97, 91.0719]
  - - [448, 2944, 1, 32]
    - [79, 2208.31]
  - - [448, 2944, 1, 1280]
    - [52, 9032.94]
  - - [2944, 6784, 1, 1280]
    - [52, 10390.7]
  - - [2048, 64, 1, 2048]
    - [37, 5626.99]
  - - [8448, 2, 1, 2816]
    - [14, 740.831]
  - - [256, 6784, 1, 1280]
    - [52, 10319.6]
  - - [3136, 2048, 1, 512]
    - [69, 10877.5]
  - - [3584, 2368, 1, 32]
    - [78, 3807.07]
  - - [704, 32, 1, 32]
    - [75, 55.2962]
  - - [6784, 3584, 1, 3328]
    - [54, 9809.96]
  - - [128, 32, 1, 256]
    - [83, 37.3498]
  - - [128, 1408, 1, 1280]
    - [8, 5909.29]
  - - [6784, 3584, 1, 32]
    - [81, 4154.77]
  - - [128, 1856, 1, 3328]
    - [38, 7240.93]
  - - [2944, 2944, 1, 256]
    - [20, 10979.7]
  - - [1408, 1024, 1, 3328]
    - [46, 9911.99]
  - - [8448, 3000, 1, 2816]
    - [48, 9894.6]
  - - [1760, 64, 1, 1760]
    - [15, 4839.47]
  - - [5056, 2368, 1, 1280]
    - [46, 10901.1]
  - - [8448, 1500, 1, 2816]
    - [54, 9870.58]
  - - [448, 128, 1, 32]
    - [87, 151.048]
  - - [32, 5056, 1, 3328]
    - [83, 1618.52]
  - - [1024, 5056, 1, 1280]
    - [21, 11227.6]
  - - [2944, 1024, 1, 1]
    - [89, 159.594]
  - - [4608, 4, 1, 1536]
    - [12, 923.178]
  - - [2368, 128, 1, 1280]
    - [28, 6671.94]
  - - [196, 1024, 64, 256]
    - [71, 9481.24]
  - - [2368, 5888, 1, 3328]
    - [53, 9755.52]
  - - [448, 5056, 1, 256]
    - [46, 9330.05]
  - - [4288, 2368, 1, 1]
    - [94, 202.174]
  - - [1408, 3584, 1, 32]
    - [78, 3406.12]
  - - [2944, 4288, 1, 32]
    - [78, 3989.27]
  - - [5888, 1408, 1, 1280]
    - [54, 11155.8]
  - - [3584, 5056, 1, 1280]
    - [47, 10539.1]
  - - [2368, 448, 1, 1]
    - [92, 95.4744]
  - - [512, 6000, 1, 2560]
    - [48, 10705.4]
  - - [448, 704, 1, 1]
    - [97, 42.1563]
  - - [704, 128, 1, 32]
    - [75, 210.411]
  - - [3584, 2944, 1, 1]
    - [89, 203.483]
  - - [2944, 5888, 1, 256]
    - [20, 11211.9]
  - - [2944, 32, 1, 32]
    - [81, 233.885]
  - - [256, 4288, 1, 3328]
    - [46, 8636.99]
  - - [4288, 64, 1, 1]
    - [95, 38.1925]
  - - [1024, 1, 1, 512]
    - [11, 46.26]
  - - [1, 1408, 1, 1280]
    - [105, 16.3285]
  - - [6784, 1408, 1, 32]
    - [81, 3827.71]
  - - [1856, 704, 1, 32]
    - [78, 2464.82]
  - - [1024, 1856, 1, 1]
    - [89, 128.285]
  - - [704, 5056, 1, 3328]
    - [51, 10203.1]
  - - [1024, 3584, 1, 3328]
    - [52, 10595.8]
  - - [5888, 256, 1, 3328]
    - [19, 9980.71]
  - - [2368, 256, 1, 1280]
    - [52, 7541.37]
  - - [2048, 7000, 1, 2048]
    - [52, 9906.75]
  - - [1856, 1408, 1, 1]
    - [89, 154.731]
  - - [2944, 448, 1, 32]
    - [78, 2234.38]
  - - [128, 448, 1, 256]
    - [12, 2108.14]
  - - [128, 1024, 1, 1]
    - [99, 11.8757]
  - - [32, 32, 1, 256]
    - [83, 9.41187]
  - - [4288, 5056, 1, 1280]
    - [20, 10276.3]
  - - [1856, 1856, 1, 3328]
    - [46, 10297.4]
  - - [1024, 2368, 1, 256]
    - [20, 9501.07]
  - - [4288, 2368, 1, 3328]
    - [52, 10043.5]
  - - [256, 64, 1, 32]
    - [78, 55.7279]
  - - [1, 1024, 1, 1280]
    - [105, 11.804]
  - - [64, 32, 1, 1280]
    - [83, 29.0307]
  - - [1024, 32, 1, 3328]
    - [83, 507.991]
  - - [5888, 3584, 1, 256]
    - [52, 11285.7]
  - - [1024, 5056, 1, 32]
    - [81, 3446.14]
  - - [704, 5888, 1, 3328]
    - [52, 10789.6]
  - - [1024, 48000, 1, 1536]
    - [54, 9914.34]
  - - [1024, 1408, 1, 256]
    - [54, 8756.9]
  - - [3584, 2944, 1, 1280]
    - [46, 10810.6]
  - - [1, 5056, 1, 256]
    - [105, 40.1675]
  - - [256, 1024, 1, 1]
    - [97, 38.4657]
  - - [32, 32, 1, 3328]
    - [83, 15.8692]
  - - [5056, 128, 1, 32]
    - [78, 1634.91]
  - - [2368, 1, 1, 3328]
    - [108, 27.9083]
  - - [4288, 1856, 1, 1280]
    - [46, 10943.7]
  - - [3584, 5888, 1, 1]
    - [89, 222.734]
  - - [8448, 16, 1, 2816]
    - [40, 4654.33]
  - - [5888, 4288, 1, 256]
    - [20, 11395.3]
  - - [512, 2, 1, 512]
    - [4, 39.1026]
  - - [1024, 2944, 1, 1280]
    - [55, 10722.9]
  - - [6784, 1, 1, 1]
    - [92, 1.09024]
  - - [1408, 64, 1, 1280]
    - [40, 3922.11]
  - - [1, 256, 1, 1280]
    - [105, 2.97082]
  - - [2944, 3584, 1, 256]
    - [46, 11009.7]
  - - [1, 128, 1, 1280]
    - [105, 1.38843]
  - - [1024, 256, 1, 32]
    - [83, 913.294]
  - - [3072, 1, 1, 1024]
    - [12, 153.863]
  - - [2368, 32, 1, 1280]
    - [83, 1093.87]
  - - [5888, 1856, 1, 1]
    - [89, 202.923]
  - - [512, 3000, 1, 1536]
    - [54, 10418.5]
  - - [1408, 1408, 1, 3328]
    - [52, 10629.6]
  - - [1024, 1500, 1, 2560]
    - [48, 10176.9]
  - - [1024, 1, 1, 500000]
    - [17, 58.5121]
  - - [448, 2368, 1, 1280]
    - [46, 8408.79]
  - - [6784, 2368, 1, 3328]
    - [48, 9945.35]
  - - [1, 64, 1, 256]
    - [105, 0.490414]
  - - [704, 128, 1, 1]
    - [92, 8.21927]
  - - [1408, 4288, 1, 32]
    - [81, 3567.87]
  - - [256, 64, 1, 1280]
    - [17, 855.317]
  - - [256, 448, 1, 256]
    - [15, 3603.13]
  - - [1856, 1024, 1, 1280]
    - [20, 9948.62]
  - - [4288, 3584, 1, 1280]
    - [52, 10634.9]
  - - [448, 1024, 1, 1280]
    - [52, 7741.17]
  - - [1024, 448, 1, 3328]
    - [35, 7890.57]
  - - [512, 48000, 1, 1536]
    - [52, 10167.2]
  - - [5056, 1856, 1, 1]
    - [94, 194.593]
  - - [5888, 2368, 1, 256]
    - [48, 11273.9]
  - - [1408, 1024, 1, 32]
    - [78, 2423.5]
  - - [32, 704, 1, 256]
    - [83, 199.625]
  - - [2944, 1, 1, 256]
    - [105, 22.915]
  - - [32, 4288, 1, 256]
    - [83, 1173.79]
  - - [5056, 1856, 1, 32]
    - [81, 3795.63]
  - - [5056, 1856, 1, 1280]
    - [46, 10962.7]
  - - [1, 64, 1, 1]
    - [99, 0.00691182]
  - - [1408, 5888, 1, 3328]
    - [54, 10330.2]
  - - [1408, 704, 1, 3328]
    - [52, 9889.56]
  - - [5056, 704, 1, 3328]
    - [46, 10306.3]
  - - [704, 64, 1, 1280]
    - [39, 2218.06]
  - - [1, 704, 1, 1280]
    - [105, 8.08825]
  - - [5888, 6784, 1, 1]
    - [89, 231.728]
  - - [5888, 4288, 1, 32]
    - [81, 4139.15]
  - - [1408, 3584, 1, 256]
    - [48, 10569.3]
  - - [64, 5056, 1, 1]
    - [95, 43.6833]
  - - [6784, 256, 1, 1]
    - [90, 124.046]
  - - [2944, 1, 1, 1]
    - [90, 0.342604]
  - - [256, 1856, 1, 3328]
    - [52, 8361.24]
  - - [4288, 128, 1, 1280]
    - [27, 7648.42]
  - - [6784, 256, 1, 1280]
    - [52, 10340.9]
  - - [2048, 32, 1, 2048]
    - [15, 3247.11]
  - - [128, 4288, 1, 256]
    - [5, 6655.42]
  - - [2368, 6784, 1, 1280]
    - [52, 10669.4]
  - - [128, 128, 1, 32]
    - [83, 60.4924]
  - - [128, 1408, 1, 32]
    - [75, 399.25]
  - - [6784, 128, 1, 32]
    - [79, 1913.86]
  - - [1408, 448, 1, 1]
    - [92, 70.9623]
  - - [2368, 1024, 1, 1]
    - [89, 146.136]
  - - [1024, 3000, 1, 2816]
    - [55, 10480.3]
  - - [2368, 704, 1, 3328]
    - [52, 9521.47]
  - - [5888, 1, 1, 1280]
    - [101, 53.2956]
  - - [4608, 6000, 1, 1536]
    - [54, 10184.4]
  - - [2944, 1856, 1, 32]
    - [81, 3538.83]
  - - [1024, 64, 1, 1]
    - [92, 6.23025]
  - - [1408, 32, 1, 1280]
    - [83, 655.338]
  - - [704, 1, 1, 256]
    - [105, 5.41856]
  - - [2368, 1408, 1, 256]
    - [51, 9882.03]
  - - [128, 3584, 1, 1]
    - [95, 58.9807]
  - - [4288, 1408, 1, 1]
    - [89, 181.929]
  - - [5888, 64, 1, 256]
    - [9, 6291.39]
  - - [64, 5056, 1, 1280]
    - [8, 7113.69]
  - - [1408, 2944, 1, 1]
    - [89, 166.542]
  - - [4288, 1408, 1, 32]
    - [81, 3524.49]
  - - [5888, 2944, 1, 256]
    - [46, 11235.1]
  - - [128, 64, 1, 1280]
    - [1, 387.816]
  - - [1408, 2944, 1, 32]
    - [78, 3340.8]
  - - [1, 3584, 1, 1280]
    - [108, 41.3691]
  - - [64, 64, 1, 32]
    - [76, 8.84695]
  - - [448, 1408, 1, 32]
    - [79, 1584.26]
  - - [128, 5056, 1, 256]
    - [9, 7633.21]
  - - [1, 1, 1, 1280]
    - [105, 0.0116282]
  - - [3072, 3000, 1, 1024]
    - [54, 10993.0]
  - - [8448, 24000, 1, 2816]
    - [55, 9596.96]
  - - [64, 704, 1, 256]
    - [39, 1638.98]
  - - [3072, 128, 1, 1024]
    - [29, 7688.33]
  - - [5888, 6784, 1, 256]
    - [20, 11059.4]
  - - [6784, 5888, 1, 1]
    - [94, 232.126]
  - - [1024, 16, 1, 500000]
    - [17, 936.899]
  - - [1, 448, 1, 1280]
    - [105, 5.06622]
  - - [1024, 1024, 1, 1]
    - [89, 103.323]
  - - [1856, 704, 1, 1]
    - [90, 109.556]
  - - [6784, 5888, 1, 1280]
    - [48, 10055.4]
  - - [1024, 4288, 1, 32]
    - [78, 3381.12]
  - - [1856, 1, 1, 1280]
    - [108, 20.1702]
  - - [3584, 5888, 1, 256]
    - [54, 11348.9]
  - - [5056, 2368, 1, 1]
    - [94, 204.33]
  - - [256, 1408, 1, 1280]
    - [52, 6191.23]
  - - [2560, 16, 1, 2560]
    - [12, 2128.61]
  - - [64, 256, 1, 32]
    - [83, 60.4924]
  - - [64, 5888, 1, 3328]
    - [28, 7564.71]
  - - [6784, 64, 1, 3328]
    - [30, 7575.17]
  - - [5056, 448, 1, 1]
    - [90, 137.12]
  - - [2944, 448, 1, 3328]
    - [19, 8657.83]
  - - [2368, 1024, 1, 1280]
    - [54, 10332.9]
  - - [1856, 6784, 1, 256]
    - [46, 11089.1]
  - - [4288, 32, 1, 1280]
    - [83, 1459.99]
  - - [448, 1408, 1, 1280]
    - [52, 7807.75]
  - - [5056, 448, 1, 32]
    - [78, 2740.89]
  - - [3584, 2944, 1, 32]
    - [78, 3899.06]
  - - [2368, 128, 1, 1]
    - [90, 41.3314]
  - - [3584, 1856, 1, 32]
    - [81, 3623.63]
  - - [128, 128, 1, 3328]
    - [17, 905.386]
  - - [5056, 64, 1, 256]
    - [8, 5916.96]
  - - [4608, 1500, 1, 1536]
    - [46, 10761.6]
  - - [512, 1, 1, 500000]
    - [17, 29.2563]
  - - [64, 448, 1, 3328]
    - [17, 1576.68]
  - - [4288, 1408, 1, 1280]
    - [48, 10748.5]
  - - [32, 5056, 1, 256]
    - [83, 1357.12]
  - - [704, 128, 1, 256]
    - [14, 2937.75]
  - - [704, 5056, 1, 1]
    - [89, 157.031]
  - - [256, 1024, 1, 32]
    - [83, 905.946]
  - - [256, 1024, 1, 1280]
    - [23, 6770.88]
  - - [2368, 128, 1, 256]
    - [8, 5571.72]
  - - [2368, 1408, 1, 1280]
    - [46, 11089.9]
  - - [128, 256, 1, 32]
    - [79, 114.156]
  - - [64, 6784, 1, 32]
    - [78, 1258.77]
  - - [6784, 32, 1, 256]
    - [83, 1834.32]
  - - [256, 4288, 1, 1]
    - [95, 96.8569]
  - - [5888, 1408, 1, 1]
    - [89, 198.081]
  - - [1024, 4288, 1, 1280]
    - [49, 10912.2]
  - - [1856, 4288, 1, 1]
    - [94, 190.829]
  - - [128, 2944, 1, 256]
    - [9, 6321.9]
  - - [3584, 4288, 1, 256]
    - [46, 11261.8]
  - - [3584, 128, 1, 32]
    - [83, 1338.99]
  - - [3584, 128, 1, 3328]
    - [28, 8117.45]
  - - [4288, 448, 1, 3328]
    - [48, 10014.5]
  - - [1856, 4288, 1, 32]
    - [81, 3761.45]
  - - [64, 256, 1, 1280]
    - [41, 857.906]
  - - [1024, 6000, 1, 2048]
    - [54, 9835.79]
  - - [4288, 1024, 1, 1280]
    - [52, 11069.8]
  - - [1, 4288, 1, 256]
    - [105, 33.833]
  - - [64, 2368, 1, 1]
    - [92, 13.9179]
  - - [4288, 6784, 1, 32]
    - [78, 4179.04]
  - - [256, 6784, 1, 3328]
    - [52, 9954.62]
  - - [128, 2944, 1, 1]
    - [103, 49.8752]
  - - [3584, 1408, 1, 256]
    - [54, 10575.7]
  - - [704, 3584, 1, 3328]
    - [52, 10199.4]
  - - [5056, 448, 1, 1280]
    - [52, 10108.3]
  - - [1408, 2944, 1, 1280]
    - [54, 11403.6]
  - - [5888, 704, 1, 1280]
    - [21, 11188.1]
  - - [64, 64, 1, 256]
    - [1, 122.027]
  - - [704, 1408, 1, 1280]
    - [25, 9494.45]
  - - [4288, 5888, 1, 256]
    - [20, 11393.8]
  - - [6784, 64, 1, 32]
    - [83, 1258.77]
  - - [3584, 3584, 1, 3328]
    - [54, 9947.16]
  - - [2944, 6784, 1, 32]
    - [81, 4153.92]
  - - [448, 64, 1, 32]
    - [74, 77.4102]
  - - [5056, 256, 1, 1]
    - [90, 109.204]
  - - [64, 6784, 1, 1280]
    - [27, 7369.7]
  - - [2944, 2368, 1, 3328]
    - [52, 10274.3]
  - - [1, 4288, 1, 1]
    - [95, 0.697406]
  - - [1408, 128, 1, 256]
    - [8, 4648.13]
  - - [1024, 1856, 1, 1280]
    - [20, 9942.6]
  - - [5124, 9124, 1, 2560]
    - [54, 9592.97]
  - - [1024, 5888, 1, 256]
    - [46, 10920.7]
  - - [704, 1408, 1, 256]
    - [52, 8479.29]
  - - [6784, 2944, 1, 3328]
    - [54, 9688.26]
  - - [1408, 2368, 1, 256]
    - [52, 10251.3]
  - - [64, 128, 1, 1280]
    - [1, 383.616]
  - - [1024, 8, 1, 500000]
    - [17, 468.132]
  - - [5888, 32, 1, 3328]
    - [83, 1888.22]
  - - [1408, 5056, 1, 256]
    - [48, 10857.0]
  - - [1024, 1408, 1, 32]
    - [81, 2404.8]
  - - [4288, 128, 1, 32]
    - [79, 1402.96]
  - - [6784, 704, 1, 1]
    - [89, 164.054]
  - - [448, 704, 1, 256]
    - [52, 4599.02]
  - - [704, 3584, 1, 32]
    - [78, 2883.48]
  - - [1856, 256, 1, 3328]
    - [19, 8222.74]
  - - [6784, 448, 1, 256]
    - [54, 10187.4]
  - - [4288, 4288, 1, 1]
    - [94, 218.307]
  - - [5056, 2944, 1, 1]
    - [94, 213.994]
  - - [64, 2368, 1, 3328]
    - [4, 5420.95]
  - - [256, 704, 1, 3328]
    - [23, 4868.82]
  - - [1, 2944, 1, 1]
    - [90, 0.312925]
  - - [1024, 1024, 1, 256]
    - [52, 8838.55]
  - - [2560, 64, 1, 2560]
    - [26, 5789.52]
  - - [3584, 1, 1, 1]
    - [103, 0.604792]
  - - [256, 2944, 1, 32]
    - [79, 1860.47]
  - - [6784, 4288, 1, 3328]
    - [54, 9781.27]
  - - [5056, 2944, 1, 3328]
    - [54, 9783.14]
  - - [1760, 128, 1, 1760]
    - [16, 6673.9]
  - - [704, 1024, 1, 1280]
    - [52, 8891.29]
  - - [256, 3584, 1, 1280]
    - [52, 8916.73]
  - - [2368, 1856, 1, 3328]
    - [46, 10404.8]
  - - [1856, 4288, 1, 1280]
    - [52, 10861.6]
  - - [1, 1024, 1, 256]
    - [105, 8.2491]
  - - [3584, 448, 1, 1]
    - [97, 116.532]
  - - [2944, 1024, 1, 3328]
    - [20, 10152.8]
  - - [32, 1408, 1, 3328]
    - [83, 687.106]
  - - [128, 1, 1, 3328]
    - [108, 1.49134]
  - - [5888, 5056, 1, 32]
    - [78, 4208.15]
  - - [704, 2944, 1, 1]
    - [89, 139.892]
  - - [3584, 448, 1, 1280]
    - [19, 9123.46]
  - - [2944, 6784, 1, 3328]
    - [54, 9808.36]
  - - [1856, 2368, 1, 1280]
    - [46, 10706.8]
  - - [6784, 1024, 1, 1280]
    - [52, 10795.7]
  - - [512, 16, 1, 500000]
    - [17, 468.156]
  - - [6784, 3584, 1, 1280]
    - [52, 10294.5]
  - - [1, 5056, 1, 3328]
    - [105, 48.5361]
  - - [448, 1856, 1, 1]
    - [91, 82.538]
  - - [128, 2368, 1, 32]
    - [83, 922.121]
  - - [128, 1408, 1, 3328]
    - [8, 6410.84]
  - - [704, 1856, 1, 256]
    - [52, 9140.85]
  - - [448, 2368, 1, 1]
    - [95, 94.8428]
  - - [1408, 4288, 1, 256]
    - [20, 10650.8]
  - - [7680, 24000, 1, 2560]
    - [54, 9613.52]
  - - [256, 5056, 1, 3328]
    - [52, 10345.2]
  - - [2368, 64, 1, 1280]
    - [26, 5084.97]
  - - [1856, 448, 1, 32]
    - [78, 1851.48]
  - - [512, 1, 1, 512]
    - [4, 19.444]
  - - [32, 128, 1, 256]
    - [83, 35.477]
  - - [448, 1024, 1, 1]
    - [95, 58.4249]
  - - [128, 1024, 1, 1280]
    - [15, 5431.28]
  - - [512, 3000, 1, 2560]
    - [52, 9850.17]
  - - [704, 2944, 1, 256]
    - [52, 9825.27]
  - - [1408, 1408, 1, 256]
    - [48, 9476.0]
  - - [3072, 1, 1, 128]
    - [12, 88.4625]
  - - [448, 6784, 1, 32]
    - [81, 3039.14]
  - - [5124, 9124, 1, 1760]
    - [48, 9638.57]
  - - [1, 64, 1, 1280]
    - [105, 0.694652]
  - - [448, 2944, 1, 1]
    - [94, 107.259]
  - - [4288, 448, 1, 32]
    - [81, 2668.32]
  - - [4288, 448, 1, 1280]
    - [20, 10065.0]
  - - [2944, 704, 1, 32]
    - [78, 2878.83]
  - - [5888, 448, 1, 1280]
    - [52, 10247.4]
  - - [448, 4288, 1, 1]
    - [94, 129.668]
  - - [3584, 5056, 1, 1]
    - [94, 219.984]
  - - [64, 5888, 1, 1]
    - [92, 49.8719]
  - - [1408, 3584, 1, 1280]
    - [54, 11132.0]
  - - [6784, 448, 1, 1280]
    - [20, 10940.9]
  - - [3584, 5056, 1, 3328]
    - [54, 9813.77]
  - - [2368, 2368, 1, 32]
    - [78, 3536.27]
  - - [64, 5888, 1, 32]
    - [78, 1130.46]
  - - [1856, 448, 1, 256]
    - [52, 7201.83]
  - - [3584, 2368, 1, 1280]
    - [46, 10988.3]
  - - [128, 1024, 1, 256]
    - [4, 4080.81]
  - - [3584, 64, 1, 3328]
    - [38, 6944.15]
  - - [5888, 2944, 1, 32]
    - [78, 4032.4]
  - - [128, 1, 1, 1024]
    - [12, 6.55344]
  - - [1856, 2944, 1, 32]
    - [78, 3565.57]
  - - [5056, 1408, 1, 1]
    - [94, 189.175]
  - - [5888, 1408, 1, 3328]
    - [55, 10322.2]
  - - [448, 4288, 1, 256]
    - [52, 9069.46]
  - - [6784, 1024, 1, 1]
    - [89, 186.439]
  - - [256, 448, 1, 1]
    - [92, 10.6045]
  - - [128, 5888, 1, 3328]
    - [52, 9594.66]
  - - [6784, 1024, 1, 32]
    - [81, 3659.65]
  - - [256, 448, 1, 32]
    - [75, 259.393]
  - - [6784, 3584, 1, 1]
    - [89, 225.741]
  - - [2944, 2368, 1, 32]
    - [81, 3708.8]
  - - [3584, 6784, 1, 3328]
    - [54, 9767.41]
  - - [5056, 1024, 1, 1]
    - [94, 176.496]
  - - [448, 128, 1, 1280]
    - [37, 2807.0]
  - - [64, 3584, 1, 32]
    - [83, 786.418]
  - - [64, 3584, 1, 1280]
    - [27, 6444.7]
  - - [6784, 1408, 1, 256]
    - [46, 11014.4]
  - - [5056, 1024, 1, 32]
    - [81, 3430.3]
  - - [256, 704, 1, 1280]
    - [23, 4732.81]
  - - [4288, 3584, 1, 256]
    - [48, 11197.7]
  - - [4608, 48000, 1, 1536]
    - [54, 9651.55]
  - - [2368, 256, 1, 32]
    - [79, 1531.43]
  - - [2368, 256, 1, 3328]
    - [52, 7741.58]
  - - [448, 6784, 1, 1280]
    - [46, 10895.5]
  - - [1856, 5888, 1, 1]
    - [94, 207.783]
  - - [256, 5888, 1, 32]
    - [80, 2494.87]
  - - [3584, 1, 1, 3328]
    - [108, 43.2724]
  - - [4288, 32, 1, 256]
    - [83, 1179.6]
  - - [256, 64, 1, 1]
    - [105, 2.45748]
  - - [4288, 5056, 1, 32]
    - [81, 4116.71]
  - - [4288, 5056, 1, 3328]
    - [54, 9790.37]
  - - [1856, 5888, 1, 32]
    - [81, 3960.41]
  - - [1856, 5888, 1, 1280]
    - [46, 10966.5]
  - - [256, 256, 1, 1280]
    - [12, 3208.0]
  - - [704, 2368, 1, 1280]
    - [52, 9905.82]
  - - [5056, 32, 1, 1280]
    - [83, 1703.64]
  - - [4288, 2368, 1, 1280]
    - [46, 11102.7]
  - - [2944, 5056, 1, 256]
    - [46, 11270.9]
  - - [512, 8, 1, 500000]
    - [17, 234.064]
  - - [32, 1856, 1, 256]
    - [83, 522.271]
  - - [64, 5888, 1, 1280]
    - [8, 7187.06]
  - - [1, 1856, 1, 1280]
    - [106, 20.8929]
  - - [2944, 4288, 1, 1]
    - [94, 208.334]
  - - [5056, 5888, 1, 32]
    - [78, 4157.81]
  - - [704, 1, 1, 3328]
    - [108, 7.97688]
  - - [448, 256, 1, 1280]
    - [15, 4786.85]
  - - [1408, 256, 1, 1]
    - [92, 48.6599]
  - - [2368, 5056, 1, 3328]
    - [20, 9814.95]
  - - [1024, 5056, 1, 3328]
    - [55, 10517.8]
  - - [704, 704, 1, 1280]
    - [52, 8429.12]
  - - [128, 32, 1, 3328]
    - [83, 63.433]
  - - [1024, 6784, 1, 32]
    - [78, 3704.85]
  - - [3072, 64, 1, 1024]
    - [28, 6262.3]
  - - [3584, 2944, 1, 3328]
    - [48, 9884.56]
  - - [128, 1856, 1, 256]
    - [16, 5437.16]
  - - [32, 32, 1, 1280]
    - [83, 14.6718]
  - - [1408, 5888, 1, 1]
    - [89, 197.732]
  - - [1, 3584, 1, 256]
    - [105, 34.6941]
  - - [704, 4288, 1, 32]
    - [81, 3011.69]
  - - [1408, 5888, 1, 32]
    - [78, 3818.0]
  - - [6784, 1024, 1, 3328]
    - [52, 9997.66]
  - - [6784, 2368, 1, 1]
    - [89, 214.292]
  - - [1856, 1, 1, 3328]
    - [108, 21.9316]
  - - [5056, 1408, 1, 256]
    - [20, 10828.3]
  - - [176, 1500, 1, 1408]
    - [8, 5882.73]
  - - [1, 1, 1, 256]
    - [90, 0.00855415]
  - - [2944, 1408, 1, 256]
    - [20, 10674.5]
  - - [4288, 1, 1, 1]
    - [97, 0.723591]
  - - [4608, 2, 1, 1536]
    - [12, 462.705]
  - - [2368, 2368, 1, 256]
    - [20, 10718.3]
  - - [1, 448, 1, 256]
    - [105, 3.58389]
  - - [1408, 6784, 1, 1]
    - [94, 200.226]
  - - [3584, 32, 1, 3328]
    - [83, 1792.19]
  - - [1856, 1, 1, 256]
    - [105, 14.3815]
  - - [6784, 6784, 1, 1280]
    - [21, 9974.75]
  - - [128, 128, 1, 1]
    - [92, 2.54232]
  - - [6784, 32, 1, 3328]
    - [83, 2381.11]
  - - [1408, 32, 1, 256]
    - [83, 415.225]
  - - [128, 3584, 1, 32]
    - [79, 1339.06]
  - - [1856, 3584, 1, 256]
    - [20, 10858.9]
  - - [1024, 704, 1, 256]
    - [52, 7761.19]
  - - [2368, 704, 1, 32]
    - [78, 2553.74]
  - - [256, 5888, 1, 1280]
    - [52, 10274.5]
  - - [448, 2368, 1, 32]
    - [78, 2092.56]
  - - [448, 2368, 1, 3328]
    - [52, 8371.87]
  - - [64, 1408, 1, 256]
    - [14, 2937.94]
  - - [5056, 32, 1, 32]
    - [83, 537.654]
  - - [1024, 704, 1, 3328]
    - [52, 8315.14]
  - - [32, 5888, 1, 3328]
    - [83, 2040.71]
  - - [256, 64, 1, 3328]
    - [17, 903.166]
  - - [32, 1408, 1, 1280]
    - [83, 628.362]
  - - [64, 32, 1, 256]
    - [83, 18.528]
  - - [1856, 1024, 1, 3328]
    - [20, 9948.15]
  - - [6144, 3000, 1, 2560]
    - [55, 9923.51]
  - - [2368, 1, 1, 1]
    - [90, 0.280403]
  - - [5056, 2368, 1, 3328]
    - [46, 9762.75]
  - - [512, 1500, 1, 2560]
    - [23, 9405.15]
  - - [128, 1, 1, 1280]
    - [106, 1.37206]
  - - [704, 4288, 1, 1280]
    - [52, 10919.5]
  - - [704, 256, 1, 256]
    - [23, 3844.62]
  - - [1024, 48000, 1, 2048]
    - [54, 9822.42]
- null
