library/src/blas3/Tensile/Logic/asm_full/navi32/navi32_Cijk_Alik_Bljk_I8II_BH_GB.yaml
- {MinimumRequiredVersion: 4.35.0}
- navi32
- gfx1101
- [Device 73f0]
    SolutionIndex: 0
    SolutionNameMin: Cijk_Alik_Bljk_I8II_BH_MT32x32x16_MI16x16x16x1_SN_1LDSB0_AMAS0_GRVW4_IU1_LPA0_LPB0_SIA1_SU0_SUS0_SVW1_TT1_16_VW1_WGM4
    SolutionIndex: 1
    SolutionNameMin: Cijk_Alik_Bljk_I8II_BH_MT32x32x16_MI16x16x16x1_SN_1LDSB0_AMAS0_GRVW8_IU1_LPA0_LPB0_SIA1_SU0_SUS0_SVW1_TT1_16_VW1_WGM4
    SolutionIndex: 2
    SolutionNameMin: Cijk_Alik_Bljk_I8II_BH_MT32x32x16_MI16x16x16x1_SN_1LDSB1_AMAS0_GRVW4_IU1_LPA0_LPB0_SIA2_SU0_SUS0_SVW1_TT1_16_VW1_WGM4
    SolutionIndex: 3
    SolutionNameMin: Cijk_Alik_Bljk_I8II_BH_MT32x32x16_MI16x16x16x1_SN_1LDSB1_AMAS0_GRVW8_IU1_LPA0_LPB0_SIA2_SU0_SUS0_SVW1_TT1_16_VW1_WGM4
    SolutionIndex: 4
    SolutionNameMin: Cijk_Alik_Bljk_I8II_BH_MT32x32x16_MI16x16x16x1_SN_1LDSB0_AMAS0_GRVW4_IU1_LPA0_LPB0_SIA3_SU0_SUS0_SVW1_TT1_16_VW1_WGM4
    SolutionIndex: 5
    SolutionNameMin: Cijk_Alik_Bljk_I8II_BH_MT32x32x16_MI16x16x16x1_SN_1LDSB1_AMAS0_GRVW8_IU1_LPA0_LPB0_SIA2_SU32_SUS128_SVW1_TT1_16_VW1_WGM4
    SolutionIndex: 6
    SolutionNameMin: Cijk_Alik_Bljk_I8II_BH_MT32x32x16_MI16x16x16x1_SN_1LDSB0_AMAS0_GRVW4_IU1_LPA0_LPB0_SIA1_SU0_SUS0_SVW1_TT1_16_VW1_WGM8
    SolutionIndex: 7
    SolutionNameMin: Cijk_Alik_Bljk_I8II_BH_MT32x32x16_MI16x16x16x1_SN_1LDSB1_AMAS0_GRVW4_IU1_LPA0_LPB0_SIA2_SU0_SUS0_SVW1_TT1_16_VW1_WGM8
    SolutionIndex: 8
    SolutionNameMin: Cijk_Alik_Bljk_I8II_BH_MT32x32x16_MI16x16x16x1_SN_1LDSB1_AMAS0_GRVW8_IU1_LPA0_LPB0_SIA2_SU0_SUS0_SVW1_TT1_16_VW1_WGM8
    SolutionIndex: 9
    SolutionNameMin: Cijk_Alik_Bljk_I8II_BH_MT32x32x16_MI16x16x16x1_SN_1LDSB0_AMAS0_GRVW4_IU1_LPA0_LPB0_SIA3_SU0_SUS0_SVW1_TT1_16_VW1_WGM8
    SolutionIndex: 10
    SolutionNameMin: Cijk_Alik_Bljk_I8II_BH_MT32x32x16_MI16x16x16x1_SN_1LDSB0_AMAS0_GRVW8_IU1_LPA0_LPB0_SIA3_SU0_SUS0_SVW1_TT1_16_VW1_WGM8
    SolutionIndex: 11
    SolutionNameMin: Cijk_Alik_Bljk_I8II_BH_MT32x32x16_MI16x16x16x1_SN_1LDSB0_AMAS0_GRVW4_IU1_LPA0_LPB0_SIA1_SU32_SUS128_SVW1_TT1_16_VW1_WGM8
    SolutionIndex: 12
    SolutionNameMin: Cijk_Alik_Bljk_I8II_BH_MT32x32x16_MI16x16x16x1_SN_1LDSB1_AMAS0_GRVW4_IU1_LPA0_LPB0_SIA2_SU32_SUS128_SVW1_TT1_16_VW1_WGM8
    SolutionIndex: 13
    SolutionNameMin: Cijk_Alik_Bljk_I8II_BH_MT32x32x16_MI16x16x16x1_SN_1LDSB1_AMAS0_GRVW4_IU1_LPA0_LPB0_SIA2_SU32_SUS256_SVW1_TT1_16_VW1_WGM8
    SolutionIndex: 14
    SolutionNameMin: Cijk_Alik_Bljk_I8II_BH_MT64x64x16_MI16x16x16x1_SN_1LDSB1_AMAS0_GRVW4_IU1_LPA0_LPB0_SIA2_SU0_SUS0_SVW1_TT2_32_VW1_WGM4
    SolutionIndex: 15
    SolutionNameMin: Cijk_Alik_Bljk_I8II_BH_MT64x64x16_MI16x16x16x1_SN_1LDSB1_AMAS0_GRVW8_IU1_LPA0_LPB0_SIA2_SU0_SUS0_SVW1_TT2_32_VW1_WGM4
    SolutionIndex: 16
    SolutionNameMin: Cijk_Alik_Bljk_I8II_BH_MT64x64x16_MI16x16x16x1_SN_1LDSB1_AMAS3_GRVW8_IU1_LPA0_LPB0_SIA2_SU0_SUS0_SVW2_TT2_32_VW2_WGM4
    SolutionIndex: 17
    SolutionNameMin: Cijk_Alik_Bljk_I8II_BH_MT64x64x16_MI16x16x16x1_SN_1LDSB0_AMAS0_GRVW8_IU1_LPA0_LPB0_SIA3_SU0_SUS0_SVW1_TT2_32_VW1_WGM4
    SolutionIndex: 18
    SolutionNameMin: Cijk_Alik_Bljk_I8II_BH_MT64x64x16_MI16x16x16x1_SN_1LDSB0_AMAS3_GRVW8_IU1_LPA0_LPB0_SIA3_SU0_SUS0_SVW2_TT2_32_VW2_WGM4
    SolutionIndex: 19
    SolutionNameMin: Cijk_Alik_Bljk_I8II_BH_MT64x64x16_MI16x16x16x1_SN_1LDSB0_AMAS0_GRVW4_IU1_LPA0_LPB0_SIA1_SU32_SUS128_SVW1_TT2_32_VW1_WGM4
    SolutionIndex: 20
    SolutionNameMin: Cijk_Alik_Bljk_I8II_BH_MT64x64x16_MI16x16x16x1_SN_1LDSB1_AMAS0_GRVW8_IU1_LPA0_LPB0_SIA2_SU32_SUS128_SVW1_TT2_32_VW1_WGM4
    SolutionIndex: 21
    SolutionNameMin: Cijk_Alik_Bljk_I8II_BH_MT64x64x16_MI16x16x16x1_SN_1LDSB0_AMAS0_GRVW4_IU1_LPA0_LPB0_SIA1_SU32_SUS256_SVW1_TT2_32_VW1_WGM4
    SolutionIndex: 22
    SolutionNameMin: Cijk_Alik_Bljk_I8II_BH_MT64x64x16_MI16x16x16x1_SN_1LDSB1_AMAS0_GRVW8_IU1_LPA0_LPB0_SIA2_SU32_SUS256_SVW1_TT2_32_VW1_WGM4
    SolutionIndex: 23
    SolutionNameMin: Cijk_Alik_Bljk_I8II_BH_MT64x64x16_MI16x16x16x1_SN_1LDSB0_AMAS0_GRVW8_IU1_LPA0_LPB0_SIA3_SU32_SUS256_SVW1_TT2_32_VW1_WGM4
    SolutionIndex: 24
    SolutionNameMin: Cijk_Alik_Bljk_I8II_BH_MT64x64x16_MI16x16x16x1_SN_1LDSB0_AMAS0_GRVW4_IU1_LPA0_LPB0_SIA1_SU0_SUS0_SVW1_TT2_32_VW1_WGM8
    SolutionIndex: 25
    SolutionNameMin: Cijk_Alik_Bljk_I8II_BH_MT64x64x16_MI16x16x16x1_SN_1LDSB0_AMAS0_GRVW8_IU1_LPA0_LPB0_SIA1_SU0_SUS0_SVW1_TT2_32_VW1_WGM8
    SolutionIndex: 26
    SolutionNameMin: Cijk_Alik_Bljk_I8II_BH_MT64x64x16_MI16x16x16x1_SN_1LDSB1_AMAS0_GRVW4_IU1_LPA0_LPB0_SIA2_SU0_SUS0_SVW1_TT2_32_VW1_WGM8
    SolutionIndex: 27
    SolutionNameMin: Cijk_Alik_Bljk_I8II_BH_MT64x64x16_MI16x16x16x1_SN_1LDSB1_AMAS0_GRVW8_IU1_LPA0_LPB0_SIA2_SU0_SUS0_SVW1_TT2_32_VW1_WGM8
    SolutionIndex: 28
    SolutionNameMin: Cijk_Alik_Bljk_I8II_BH_MT64x64x16_MI16x16x16x1_SN_1LDSB0_AMAS0_GRVW8_IU1_LPA0_LPB0_SIA3_SU0_SUS0_SVW1_TT2_32_VW1_WGM8
    SolutionIndex: 29
    SolutionNameMin: Cijk_Alik_Bljk_I8II_BH_MT64x64x16_MI16x16x16x1_SN_1LDSB0_AMAS3_GRVW8_IU1_LPA0_LPB0_SIA3_SU0_SUS0_SVW2_TT2_32_VW2_WGM8
    SolutionIndex: 30
    SolutionNameMin: Cijk_Alik_Bljk_I8II_BH_MT64x64x16_MI16x16x16x1_SN_1LDSB0_AMAS0_GRVW8_IU1_LPA0_LPB0_SIA3_SU32_SUS128_SVW1_TT2_32_VW1_WGM8
    SolutionIndex: 31
    SolutionNameMin: Cijk_Alik_Bljk_I8II_BH_MT64x64x16_MI16x16x16x1_SN_1LDSB0_AMAS0_GRVW4_IU1_LPA0_LPB0_SIA1_SU32_SUS256_SVW1_TT2_32_VW1_WGM8
    SolutionIndex: 32
    SolutionNameMin: Cijk_Alik_Bljk_I8II_BH_MT64x64x16_MI16x16x16x1_SN_1LDSB1_AMAS0_GRVW4_IU1_LPA0_LPB0_SIA2_SU32_SUS256_SVW1_TT2_32_VW1_WGM8
    SolutionIndex: 33
    SolutionNameMin: Cijk_Alik_Bljk_I8II_BH_MT64x64x16_MI16x16x16x1_SN_1LDSB1_AMAS0_GRVW8_IU1_LPA0_LPB0_SIA2_SU32_SUS256_SVW1_TT2_32_VW1_WGM8
    SolutionIndex: 34
    SolutionNameMin: Cijk_Alik_Bljk_I8II_BH_MT64x64x16_MI16x16x16x1_SN_1LDSB0_AMAS0_GRVW8_IU1_LPA0_LPB0_SIA3_SU32_SUS256_SVW1_TT2_32_VW1_WGM8
    SolutionIndex: 35
    SolutionNameMin: Cijk_Alik_Bljk_I8II_BH_MT32x32x32_MI16x16x16x1_SN_1LDSB0_AMAS0_GRVW4_IU1_LPA0_LPB0_SIA1_SU0_SUS0_SVW1_TT1_16_VW1_WGM4
    SolutionIndex: 36
    SolutionNameMin: Cijk_Alik_Bljk_I8II_BH_MT32x32x32_MI16x16x16x1_SN_1LDSB0_AMAS0_GRVW8_IU1_LPA0_LPB0_SIA1_SU0_SUS0_SVW1_TT1_16_VW1_WGM4
    SolutionIndex: 37
    SolutionNameMin: Cijk_Alik_Bljk_I8II_BH_MT32x32x32_MI16x16x16x1_SN_1LDSB1_AMAS0_GRVW4_IU2_LPA0_LPB0_SIA2_SU0_SUS0_SVW1_TT1_16_VW1_WGM4
    SolutionIndex: 38
    SolutionNameMin: Cijk_Alik_Bljk_I8II_BH_MT32x32x32_MI16x16x16x1_SN_1LDSB1_AMAS0_GRVW8_IU2_LPA0_LPB0_SIA2_SU0_SUS0_SVW1_TT1_16_VW1_WGM4
    SolutionIndex: 39
    SolutionNameMin: Cijk_Alik_Bljk_I8II_BH_MT32x32x32_MI16x16x16x1_SN_1LDSB0_AMAS0_GRVW4_IU1_LPA0_LPB0_SIA3_SU0_SUS0_SVW1_TT1_16_VW1_WGM4
    SolutionIndex: 40
    SolutionNameMin: Cijk_Alik_Bljk_I8II_BH_MT32x32x32_MI16x16x16x1_SN_1LDSB0_AMAS0_GRVW8_IU1_LPA0_LPB0_SIA3_SU0_SUS0_SVW1_TT1_16_VW1_WGM4
    SolutionIndex: 41
    SolutionNameMin: Cijk_Alik_Bljk_I8II_BH_MT32x32x32_MI16x16x16x1_SN_1LDSB0_AMAS0_GRVW4_IU1_LPA0_LPB0_SIA1_SU32_SUS128_SVW1_TT1_16_VW1_WGM4
    SolutionIndex: 42
    SolutionNameMin: Cijk_Alik_Bljk_I8II_BH_MT32x32x32_MI16x16x16x1_SN_1LDSB0_AMAS0_GRVW8_IU1_LPA0_LPB0_SIA1_SU32_SUS128_SVW1_TT1_16_VW1_WGM4
    SolutionIndex: 43
    SolutionNameMin: Cijk_Alik_Bljk_I8II_BH_MT32x32x32_MI16x16x16x1_SN_1LDSB1_AMAS0_GRVW4_IU2_LPA0_LPB0_SIA2_SU32_SUS128_SVW1_TT1_16_VW1_WGM4
    SolutionIndex: 44
    SolutionNameMin: Cijk_Alik_Bljk_I8II_BH_MT32x32x32_MI16x16x16x1_SN_1LDSB1_AMAS0_GRVW8_IU2_LPA0_LPB0_SIA2_SU32_SUS128_SVW1_TT1_16_VW1_WGM4
    SolutionIndex: 45
    SolutionNameMin: Cijk_Alik_Bljk_I8II_BH_MT32x32x32_MI16x16x16x1_SN_1LDSB0_AMAS0_GRVW4_IU1_LPA0_LPB0_SIA3_SU32_SUS128_SVW1_TT1_16_VW1_WGM4
    SolutionIndex: 46
    SolutionNameMin: Cijk_Alik_Bljk_I8II_BH_MT32x32x32_MI16x16x16x1_SN_1LDSB0_AMAS0_GRVW8_IU1_LPA0_LPB0_SIA3_SU32_SUS128_SVW1_TT1_16_VW1_WGM4
    SolutionIndex: 47
    SolutionNameMin: Cijk_Alik_Bljk_I8II_BH_MT32x32x32_MI16x16x16x1_SN_1LDSB0_AMAS0_GRVW4_IU1_LPA0_LPB0_SIA1_SU32_SUS256_SVW1_TT1_16_VW1_WGM4
    SolutionIndex: 48
    SolutionNameMin: Cijk_Alik_Bljk_I8II_BH_MT32x32x32_MI16x16x16x1_SN_1LDSB0_AMAS0_GRVW8_IU1_LPA0_LPB0_SIA1_SU32_SUS256_SVW1_TT1_16_VW1_WGM4
    SolutionIndex: 49
    SolutionNameMin: Cijk_Alik_Bljk_I8II_BH_MT32x32x32_MI16x16x16x1_SN_1LDSB1_AMAS0_GRVW4_IU2_LPA0_LPB0_SIA2_SU32_SUS256_SVW1_TT1_16_VW1_WGM4
    SolutionIndex: 50
    SolutionNameMin: Cijk_Alik_Bljk_I8II_BH_MT32x32x32_MI16x16x16x1_SN_1LDSB1_AMAS0_GRVW8_IU2_LPA0_LPB0_SIA2_SU32_SUS256_SVW1_TT1_16_VW1_WGM4
    SolutionIndex: 51
    SolutionNameMin: Cijk_Alik_Bljk_I8II_BH_MT32x32x32_MI16x16x16x1_SN_1LDSB0_AMAS0_GRVW4_IU1_LPA0_LPB0_SIA1_SU0_SUS0_SVW1_TT1_16_VW1_WGM8
    SolutionIndex: 52
    SolutionNameMin: Cijk_Alik_Bljk_I8II_BH_MT32x32x32_MI16x16x16x1_SN_1LDSB0_AMAS0_GRVW8_IU1_LPA0_LPB0_SIA1_SU0_SUS0_SVW1_TT1_16_VW1_WGM8
    SolutionIndex: 53
    SolutionNameMin: Cijk_Alik_Bljk_I8II_BH_MT32x32x32_MI16x16x16x1_SN_1LDSB1_AMAS0_GRVW4_IU2_LPA0_LPB0_SIA2_SU0_SUS0_SVW1_TT1_16_VW1_WGM8
    SolutionIndex: 54
    SolutionNameMin: Cijk_Alik_Bljk_I8II_BH_MT32x32x32_MI16x16x16x1_SN_1LDSB1_AMAS0_GRVW8_IU2_LPA0_LPB0_SIA2_SU0_SUS0_SVW1_TT1_16_VW1_WGM8
    SolutionIndex: 55
    SolutionNameMin: Cijk_Alik_Bljk_I8II_BH_MT32x32x32_MI16x16x16x1_SN_1LDSB0_AMAS0_GRVW4_IU1_LPA0_LPB0_SIA3_SU0_SUS0_SVW1_TT1_16_VW1_WGM8
    SolutionIndex: 56
    SolutionNameMin: Cijk_Alik_Bljk_I8II_BH_MT32x32x32_MI16x16x16x1_SN_1LDSB0_AMAS0_GRVW8_IU1_LPA0_LPB0_SIA3_SU0_SUS0_SVW1_TT1_16_VW1_WGM8
    SolutionIndex: 57
    SolutionNameMin: Cijk_Alik_Bljk_I8II_BH_MT32x32x32_MI16x16x16x1_SN_1LDSB0_AMAS0_GRVW8_IU1_LPA0_LPB0_SIA1_SU32_SUS128_SVW1_TT1_16_VW1_WGM8
    SolutionIndex: 58
    SolutionNameMin: Cijk_Alik_Bljk_I8II_BH_MT32x32x32_MI16x16x16x1_SN_1LDSB1_AMAS0_GRVW4_IU2_LPA0_LPB0_SIA2_SU32_SUS128_SVW1_TT1_16_VW1_WGM8
    SolutionIndex: 59
    SolutionNameMin: Cijk_Alik_Bljk_I8II_BH_MT32x32x32_MI16x16x16x1_SN_1LDSB1_AMAS0_GRVW8_IU2_LPA0_LPB0_SIA2_SU32_SUS128_SVW1_TT1_16_VW1_WGM8
    SolutionIndex: 60
    SolutionNameMin: Cijk_Alik_Bljk_I8II_BH_MT32x32x32_MI16x16x16x1_SN_1LDSB0_AMAS0_GRVW8_IU1_LPA0_LPB0_SIA3_SU32_SUS128_SVW1_TT1_16_VW1_WGM8
    SolutionIndex: 61
    SolutionNameMin: Cijk_Alik_Bljk_I8II_BH_MT32x32x32_MI16x16x16x1_SN_1LDSB0_AMAS0_GRVW4_IU1_LPA0_LPB0_SIA1_SU32_SUS256_SVW1_TT1_16_VW1_WGM8
    SolutionIndex: 62
    SolutionNameMin: Cijk_Alik_Bljk_I8II_BH_MT32x32x32_MI16x16x16x1_SN_1LDSB0_AMAS0_GRVW8_IU1_LPA0_LPB0_SIA1_SU32_SUS256_SVW1_TT1_16_VW1_WGM8
    SolutionIndex: 63
    SolutionNameMin: Cijk_Alik_Bljk_I8II_BH_MT32x32x32_MI16x16x16x1_SN_1LDSB1_AMAS0_GRVW4_IU2_LPA0_LPB0_SIA2_SU32_SUS256_SVW1_TT1_16_VW1_WGM8
    SolutionIndex: 64
    SolutionNameMin: Cijk_Alik_Bljk_I8II_BH_MT32x32x32_MI16x16x16x1_SN_1LDSB1_AMAS0_GRVW8_IU2_LPA0_LPB0_SIA2_SU32_SUS256_SVW1_TT1_16_VW1_WGM8
    SolutionIndex: 65
    SolutionNameMin: Cijk_Alik_Bljk_I8II_BH_MT32x32x32_MI16x16x16x1_SN_1LDSB0_AMAS0_GRVW4_IU1_LPA0_LPB0_SIA3_SU32_SUS256_SVW1_TT1_16_VW1_WGM8
    SolutionIndex: 66
    SolutionNameMin: Cijk_Alik_Bljk_I8II_BH_MT32x32x32_MI16x16x16x1_SN_1LDSB0_AMAS0_GRVW8_IU1_LPA0_LPB0_SIA3_SU32_SUS256_SVW1_TT1_16_VW1_WGM8
    SolutionIndex: 67
    SolutionNameMin: Cijk_Alik_Bljk_I8II_BH_MT64x64x32_MI16x16x16x1_SN_1LDSB0_AMAS0_GRVW4_IU1_LPA0_LPB0_SIA1_SU0_SUS0_SVW1_TT2_32_VW1_WGM4
    SolutionIndex: 68
    SolutionNameMin: Cijk_Alik_Bljk_I8II_BH_MT64x64x32_MI16x16x16x1_SN_1LDSB0_AMAS3_GRVW4_IU1_LPA0_LPB0_SIA1_SU0_SUS0_SVW2_TT2_32_VW2_WGM4
    SolutionIndex: 69
    SolutionNameMin: Cijk_Alik_Bljk_I8II_BH_MT64x64x32_MI16x16x16x1_SN_1LDSB0_AMAS0_GRVW8_IU1_LPA0_LPB0_SIA1_SU0_SUS0_SVW1_TT2_32_VW1_WGM4
    SolutionIndex: 70
    SolutionNameMin: Cijk_Alik_Bljk_I8II_BH_MT64x64x32_MI16x16x16x1_SN_1LDSB1_AMAS0_GRVW4_IU2_LPA0_LPB0_SIA2_SU0_SUS0_SVW1_TT2_32_VW1_WGM4
    SolutionIndex: 71
    SolutionNameMin: Cijk_Alik_Bljk_I8II_BH_MT64x64x32_MI16x16x16x1_SN_1LDSB1_AMAS0_GRVW8_IU2_LPA0_LPB0_SIA2_SU0_SUS0_SVW1_TT2_32_VW1_WGM4
    SolutionIndex: 72
    SolutionNameMin: Cijk_Alik_Bljk_I8II_BH_MT64x64x32_MI16x16x16x1_SN_1LDSB0_AMAS0_GRVW4_IU1_LPA0_LPB0_SIA3_SU0_SUS0_SVW1_TT2_32_VW1_WGM4
    SolutionIndex: 73
    SolutionNameMin: Cijk_Alik_Bljk_I8II_BH_MT64x64x32_MI16x16x16x1_SN_1LDSB0_AMAS0_GRVW8_IU1_LPA0_LPB0_SIA3_SU0_SUS0_SVW1_TT2_32_VW1_WGM4
    SolutionIndex: 74
    SolutionNameMin: Cijk_Alik_Bljk_I8II_BH_MT64x64x32_MI16x16x16x1_SN_1LDSB0_AMAS3_GRVW4_IU1_LPA0_LPB0_SIA1_SU32_SUS128_SVW2_TT2_32_VW2_WGM4
    SolutionIndex: 75
    SolutionNameMin: Cijk_Alik_Bljk_I8II_BH_MT64x64x32_MI16x16x16x1_SN_1LDSB1_AMAS0_GRVW4_IU2_LPA0_LPB0_SIA2_SU32_SUS128_SVW1_TT2_32_VW1_WGM4
    SolutionIndex: 76
    SolutionNameMin: Cijk_Alik_Bljk_I8II_BH_MT64x64x32_MI16x16x16x1_SN_1LDSB1_AMAS0_GRVW8_IU2_LPA0_LPB0_SIA2_SU32_SUS128_SVW1_TT2_32_VW1_WGM4
    SolutionIndex: 77
    SolutionNameMin: Cijk_Alik_Bljk_I8II_BH_MT64x64x32_MI16x16x16x1_SN_1LDSB0_AMAS3_GRVW4_IU1_LPA0_LPB0_SIA1_SU32_SUS256_SVW2_TT2_32_VW2_WGM4
    SolutionIndex: 78
    SolutionNameMin: Cijk_Alik_Bljk_I8II_BH_MT64x64x32_MI16x16x16x1_SN_1LDSB0_AMAS0_GRVW8_IU1_LPA0_LPB0_SIA1_SU32_SUS256_SVW1_TT2_32_VW1_WGM4
    SolutionIndex: 79
    SolutionNameMin: Cijk_Alik_Bljk_I8II_BH_MT64x64x32_MI16x16x16x1_SN_1LDSB1_AMAS0_GRVW4_IU2_LPA0_LPB0_SIA2_SU32_SUS256_SVW1_TT2_32_VW1_WGM4
    SolutionIndex: 80
    SolutionNameMin: Cijk_Alik_Bljk_I8II_BH_MT64x64x32_MI16x16x16x1_SN_1LDSB0_AMAS0_GRVW8_IU1_LPA0_LPB0_SIA3_SU32_SUS256_SVW1_TT2_32_VW1_WGM4
    SolutionIndex: 81
    SolutionNameMin: Cijk_Alik_Bljk_I8II_BH_MT64x64x32_MI16x16x16x1_SN_1LDSB0_AMAS0_GRVW4_IU1_LPA0_LPB0_SIA1_SU0_SUS0_SVW1_TT2_32_VW1_WGM8
    SolutionIndex: 82
    SolutionNameMin: Cijk_Alik_Bljk_I8II_BH_MT64x64x32_MI16x16x16x1_SN_1LDSB0_AMAS3_GRVW4_IU1_LPA0_LPB0_SIA1_SU0_SUS0_SVW2_TT2_32_VW2_WGM8
    SolutionIndex: 83
    SolutionNameMin: Cijk_Alik_Bljk_I8II_BH_MT64x64x32_MI16x16x16x1_SN_1LDSB0_AMAS0_GRVW8_IU1_LPA0_LPB0_SIA1_SU0_SUS0_SVW1_TT2_32_VW1_WGM8
    SolutionIndex: 84
    SolutionNameMin: Cijk_Alik_Bljk_I8II_BH_MT64x64x32_MI16x16x16x1_SN_1LDSB1_AMAS0_GRVW4_IU2_LPA0_LPB0_SIA2_SU0_SUS0_SVW1_TT2_32_VW1_WGM8
    SolutionIndex: 85
    SolutionNameMin: Cijk_Alik_Bljk_I8II_BH_MT64x64x32_MI16x16x16x1_SN_1LDSB1_AMAS0_GRVW8_IU2_LPA0_LPB0_SIA2_SU0_SUS0_SVW1_TT2_32_VW1_WGM8
    SolutionIndex: 86
    SolutionNameMin: Cijk_Alik_Bljk_I8II_BH_MT64x64x32_MI16x16x16x1_SN_1LDSB0_AMAS0_GRVW4_IU1_LPA0_LPB0_SIA3_SU0_SUS0_SVW1_TT2_32_VW1_WGM8
    SolutionIndex: 87
    SolutionNameMin: Cijk_Alik_Bljk_I8II_BH_MT64x64x32_MI16x16x16x1_SN_1LDSB0_AMAS0_GRVW8_IU1_LPA0_LPB0_SIA3_SU0_SUS0_SVW1_TT2_32_VW1_WGM8
    SolutionIndex: 88
    SolutionNameMin: Cijk_Alik_Bljk_I8II_BH_MT64x64x32_MI16x16x16x1_SN_1LDSB0_AMAS0_GRVW4_IU1_LPA0_LPB0_SIA1_SU32_SUS128_SVW1_TT2_32_VW1_WGM8
    SolutionIndex: 89
    SolutionNameMin: Cijk_Alik_Bljk_I8II_BH_MT64x64x32_MI16x16x16x1_SN_1LDSB0_AMAS0_GRVW8_IU1_LPA0_LPB0_SIA1_SU32_SUS128_SVW1_TT2_32_VW1_WGM8
    SolutionIndex: 90
    SolutionNameMin: Cijk_Alik_Bljk_I8II_BH_MT64x64x32_MI16x16x16x1_SN_1LDSB0_AMAS0_GRVW8_IU1_LPA0_LPB0_SIA3_SU32_SUS128_SVW1_TT2_32_VW1_WGM8
    SolutionIndex: 91
    SolutionNameMin: Cijk_Alik_Bljk_I8II_BH_MT64x64x32_MI16x16x16x1_SN_1LDSB0_AMAS0_GRVW4_IU1_LPA0_LPB0_SIA1_SU32_SUS256_SVW1_TT2_32_VW1_WGM8
    SolutionIndex: 92
    SolutionNameMin: Cijk_Alik_Bljk_I8II_BH_MT64x64x32_MI16x16x16x1_SN_1LDSB0_AMAS3_GRVW4_IU1_LPA0_LPB0_SIA1_SU32_SUS256_SVW2_TT2_32_VW2_WGM8
    SolutionIndex: 93
    SolutionNameMin: Cijk_Alik_Bljk_I8II_BH_MT64x64x32_MI16x16x16x1_SN_1LDSB0_AMAS0_GRVW8_IU1_LPA0_LPB0_SIA1_SU32_SUS256_SVW1_TT2_32_VW1_WGM8
    SolutionIndex: 94
    SolutionNameMin: Cijk_Alik_Bljk_I8II_BH_MT64x64x32_MI16x16x16x1_SN_1LDSB1_AMAS0_GRVW4_IU2_LPA0_LPB0_SIA2_SU32_SUS256_SVW1_TT2_32_VW1_WGM8
    SolutionIndex: 95
    SolutionNameMin: Cijk_Alik_Bljk_I8II_BH_MT64x64x32_MI16x16x16x1_SN_1LDSB0_AMAS0_GRVW4_IU1_LPA0_LPB0_SIA3_SU32_SUS256_SVW1_TT2_32_VW1_WGM8
    SolutionIndex: 96
    SolutionNameMin: Cijk_Alik_Bljk_I8II_BH_MT128x128x32_MI16x16x16x1_SN_1LDSB0_AMAS0_GRVW8_IU1_LPA0_LPB0_SIA1_SU0_SUS0_SVW1_TT4_64_VW1_WGM4
    SolutionIndex: 97
    SolutionNameMin: Cijk_Alik_Bljk_I8II_BH_MT128x128x32_MI16x16x16x1_SN_1LDSB0_AMAS0_GRVW8_IU1_LPA0_LPB0_SIA3_SU0_SUS0_SVW1_TT4_64_VW1_WGM4
    SolutionIndex: 98
    SolutionNameMin: Cijk_Alik_Bljk_I8II_BH_MT128x128x32_MI16x16x16x1_SN_1LDSB0_AMAS0_GRVW8_IU1_LPA0_LPB0_SIA1_SU0_SUS0_SVW1_TT4_64_VW1_WGM8
    SolutionIndex: 99
    SolutionNameMin: Cijk_Alik_Bljk_I8II_BH_MT128x128x32_MI16x16x16x1_SN_1LDSB0_AMAS0_GRVW8_IU1_LPA0_LPB0_SIA3_SU0_SUS0_SVW1_TT4_64_VW1_WGM8
- - - [64, 64, 1, 64, 96, 96, 96, 96]
    - [52, 0.094]
  - - [64, 64, 1, 128, 96, 96, 160, 160]
    - [65, 0.184]
  - - [64, 64, 1, 256, 96, 96, 288, 288]
    - [52, 0.332]
  - - [64, 64, 1, 512, 96, 96, 544, 544]
    - [54, 0.579]
  - - [64, 64, 1, 1024, 96, 96, 1056, 1056]
    - [54, 0.908]
  - - [64, 64, 1, 2048, 96, 96, 2080, 2080]
    - [54, 1.261]
  - - [64, 64, 1, 4096, 96, 96, 4128, 4128]
    - [54, 1.562]
  - - [64, 128, 1, 64, 96, 96, 96, 96]
    - [0, 0.192]
  - - [64, 128, 1, 128, 96, 96, 160, 160]
    - [52, 0.372]
  - - [64, 128, 1, 256, 96, 96, 288, 288]
    - [59, 0.674]
  - - [64, 128, 1, 512, 96, 96, 544, 544]
    - [64, 1.165]
  - - [64, 128, 1, 1024, 96, 96, 1056, 1056]
    - [44, 1.825]
  - - [64, 128, 1, 2048, 96, 96, 2080, 2080]
    - [64, 2.54]
  - - [64, 128, 1, 4096, 96, 96, 4128, 4128]
    - [54, 3.128]
  - - [64, 256, 1, 64, 96, 96, 96, 96]
    - [56, 0.384]
  - - [64, 256, 1, 128, 96, 96, 160, 160]
    - [42, 0.746]
  - - [64, 256, 1, 256, 96, 96, 288, 288]
    - [50, 1.353]
  - - [64, 256, 1, 512, 96, 96, 544, 544]
    - [43, 2.34]
  - - [64, 256, 1, 1024, 96, 96, 1056, 1056]
    - [63, 3.684]
  - - [64, 256, 1, 2048, 96, 96, 2080, 2080]
    - [50, 5.085]
  - - [64, 256, 1, 4096, 96, 96, 4128, 4128]
    - [58, 6.268]
  - - [64, 512, 1, 64, 96, 96, 96, 96]
    - [35, 0.774]
  - - [64, 512, 1, 128, 96, 96, 160, 160]
    - [61, 1.472]
  - - [64, 512, 1, 256, 96, 96, 288, 288]
    - [38, 2.698]
  - - [64, 512, 1, 512, 96, 96, 544, 544]
    - [38, 4.645]
  - - [64, 512, 1, 1024, 96, 96, 1056, 1056]
    - [54, 7.274]
  - - [64, 512, 1, 2048, 96, 96, 2080, 2080]
    - [54, 10.108]
  - - [64, 512, 1, 4096, 96, 96, 4128, 4128]
    - [58, 12.478]
  - - [64, 1024, 1, 64, 96, 96, 96, 96]
    - [38, 1.502]
  - - [64, 1024, 1, 128, 96, 96, 160, 160]
    - [51, 2.847]
  - - [64, 1024, 1, 256, 96, 96, 288, 288]
    - [57, 5.168]
  - - [64, 1024, 1, 512, 96, 96, 544, 544]
    - [66, 8.63]
  - - [64, 1024, 1, 1024, 96, 96, 1056, 1056]
    - [54, 13.163]
  - - [64, 1024, 1, 2048, 96, 96, 2080, 2080]
    - [54, 17.714]
  - - [64, 1024, 1, 4096, 96, 96, 4128, 4128]
    - [59, 21.385]
  - - [64, 2048, 1, 64, 96, 96, 96, 96]
    - [38, 2.879]
  - - [64, 2048, 1, 128, 96, 96, 160, 160]
    - [8, 5.365]
  - - [64, 2048, 1, 256, 96, 96, 288, 288]
    - [62, 9.423]
  - - [64, 2048, 1, 512, 96, 96, 544, 544]
    - [76, 15.309]
  - - [64, 2048, 1, 1024, 96, 96, 1056, 1056]
    - [85, 22.325]
  - - [64, 2048, 1, 2048, 96, 96, 2080, 2080]
    - [71, 28.821]
  - - [64, 2048, 1, 4096, 96, 96, 4128, 4128]
    - [85, 33.789]
  - - [64, 4096, 1, 64, 96, 96, 96, 96]
    - [36, 5.364]
  - - [64, 4096, 1, 128, 96, 96, 160, 160]
    - [31, 9.913]
  - - [64, 4096, 1, 256, 96, 96, 288, 288]
    - [14, 17.269]
  - - [64, 4096, 1, 512, 96, 96, 544, 544]
    - [15, 27.478]
  - - [64, 4096, 1, 1024, 96, 96, 1056, 1056]
    - [78, 38.108]
  - - [64, 4096, 1, 2048, 96, 96, 2080, 2080]
    - [2, 48.4]
  - - [64, 4096, 1, 4096, 96, 96, 4128, 4128]
    - [2, 55.489]
  - - [128, 64, 1, 64, 160, 160, 96, 96]
    - [55, 0.192]
  - - [128, 64, 1, 128, 160, 160, 160, 160]
    - [52, 0.372]
  - - [128, 64, 1, 256, 160, 160, 288, 288]
    - [54, 0.673]
  - - [128, 64, 1, 512, 160, 160, 544, 544]
    - [63, 1.157]
  - - [128, 64, 1, 1024, 160, 160, 1056, 1056]
    - [54, 1.814]
  - - [128, 64, 1, 2048, 160, 160, 2080, 2080]
    - [54, 2.526]
  - - [128, 64, 1, 4096, 160, 160, 4128, 4128]
    - [38, 3.109]
  - - [128, 128, 1, 64, 160, 160, 96, 96]
    - [62, 0.385]
  - - [128, 128, 1, 128, 160, 160, 160, 160]
    - [46, 0.744]
  - - [128, 128, 1, 256, 160, 160, 288, 288]
    - [63, 1.351]
  - - [128, 128, 1, 512, 160, 160, 544, 544]
    - [43, 2.327]
  - - [128, 128, 1, 1024, 160, 160, 1056, 1056]
    - [64, 3.655]
  - - [128, 128, 1, 2048, 160, 160, 2080, 2080]
    - [64, 5.066]
  - - [128, 128, 1, 4096, 160, 160, 4128, 4128]
    - [49, 6.262]
  - - [128, 256, 1, 64, 160, 160, 96, 96]
    - [4, 0.764]
  - - [128, 256, 1, 128, 160, 160, 160, 160]
    - [55, 1.473]
  - - [128, 256, 1, 256, 160, 160, 288, 288]
    - [44, 2.69]
  - - [128, 256, 1, 512, 160, 160, 544, 544]
    - [63, 4.646]
  - - [128, 256, 1, 1024, 160, 160, 1056, 1056]
    - [54, 7.324]
  - - [128, 256, 1, 2048, 160, 160, 2080, 2080]
    - [54, 10.193]
  - - [128, 256, 1, 4096, 160, 160, 4128, 4128]
    - [53, 12.611]
  - - [128, 512, 1, 64, 160, 160, 96, 96]
    - [10, 1.499]
  - - [128, 512, 1, 128, 160, 160, 160, 160]
    - [52, 2.867]
  - - [128, 512, 1, 256, 160, 160, 288, 288]
    - [35, 5.142]
  - - [128, 512, 1, 512, 160, 160, 544, 544]
    - [38, 8.666]
  - - [128, 512, 1, 1024, 160, 160, 1056, 1056]
    - [38, 13.068]
  - - [128, 512, 1, 2048, 160, 160, 2080, 2080]
    - [38, 17.91]
  - - [128, 512, 1, 4096, 160, 160, 4128, 4128]
    - [54, 21.58]
  - - [128, 1024, 1, 64, 160, 160, 96, 96]
    - [65, 2.871]
  - - [128, 1024, 1, 128, 160, 160, 160, 160]
    - [9, 5.404]
  - - [128, 1024, 1, 256, 160, 160, 288, 288]
    - [51, 9.51]
  - - [128, 1024, 1, 512, 160, 160, 544, 544]
    - [12, 15.522]
  - - [128, 1024, 1, 1024, 160, 160, 1056, 1056]
    - [13, 22.431]
  - - [128, 1024, 1, 2048, 160, 160, 2080, 2080]
    - [85, 28.848]
  - - [128, 1024, 1, 4096, 160, 160, 4128, 4128]
    - [85, 33.776]
  - - [128, 2048, 1, 64, 160, 160, 96, 96]
    - [81, 5.358]
  - - [128, 2048, 1, 128, 160, 160, 160, 160]
    - [25, 10.032]
  - - [128, 2048, 1, 256, 160, 160, 288, 288]
    - [15, 17.396]
  - - [128, 2048, 1, 512, 160, 160, 544, 544]
    - [26, 27.892]
  - - [128, 2048, 1, 1024, 160, 160, 1056, 1056]
    - [26, 39.798]
  - - [128, 2048, 1, 2048, 160, 160, 2080, 2080]
    - [27, 50.393]
  - - [128, 2048, 1, 4096, 160, 160, 4128, 4128]
    - [27, 58.163]
  - - [128, 4096, 1, 64, 160, 160, 96, 96]
    - [91, 8.991]
  - - [128, 4096, 1, 128, 160, 160, 160, 160]
    - [17, 16.251]
  - - [128, 4096, 1, 256, 160, 160, 288, 288]
    - [30, 27.558]
  - - [128, 4096, 1, 512, 160, 160, 544, 544]
    - [23, 41.389]
  - - [128, 4096, 1, 1024, 160, 160, 1056, 1056]
    - [28, 55.607]
  - - [128, 4096, 1, 2048, 160, 160, 2080, 2080]
    - [28, 67.11]
  - - [128, 4096, 1, 4096, 160, 160, 4128, 4128]
    - [17, 71.537]
  - - [256, 64, 1, 64, 288, 288, 96, 96]
    - [11, 0.384]
  - - [256, 64, 1, 128, 288, 288, 160, 160]
    - [40, 0.75]
  - - [256, 64, 1, 256, 288, 288, 288, 288]
    - [54, 1.352]
  - - [256, 64, 1, 512, 288, 288, 544, 544]
    - [54, 2.318]
  - - [256, 64, 1, 1024, 288, 288, 1056, 1056]
    - [58, 3.64]
  - - [256, 64, 1, 2048, 288, 288, 2080, 2080]
    - [58, 5.034]
  - - [256, 64, 1, 4096, 288, 288, 4128, 4128]
    - [49, 6.212]
  - - [256, 128, 1, 64, 288, 288, 96, 96]
    - [1, 0.769]
  - - [256, 128, 1, 128, 288, 288, 160, 160]
    - [62, 1.472]
  - - [256, 128, 1, 256, 288, 288, 288, 288]
    - [63, 2.69]
  - - [256, 128, 1, 512, 288, 288, 544, 544]
    - [54, 4.664]
  - - [256, 128, 1, 1024, 288, 288, 1056, 1056]
    - [50, 7.263]
  - - [256, 128, 1, 2048, 288, 288, 2080, 2080]
    - [64, 10.124]
  - - [256, 128, 1, 4096, 288, 288, 4128, 4128]
    - [53, 12.509]
  - - [256, 256, 1, 64, 288, 288, 96, 96]
    - [4, 1.503]
  - - [256, 256, 1, 128, 288, 288, 160, 160]
    - [6, 2.861]
  - - [256, 256, 1, 256, 288, 288, 288, 288]
    - [41, 5.166]
  - - [256, 256, 1, 512, 288, 288, 544, 544]
    - [54, 8.609]
  - - [256, 256, 1, 1024, 288, 288, 1056, 1056]
    - [54, 13.241]
  - - [256, 256, 1, 2048, 288, 288, 2080, 2080]
    - [54, 17.888]
  - - [256, 256, 1, 4096, 288, 288, 4128, 4128]
    - [54, 21.629]
  - - [256, 512, 1, 64, 288, 288, 96, 96]
    - [39, 2.896]
  - - [256, 512, 1, 128, 288, 288, 160, 160]
    - [9, 5.366]
  - - [256, 512, 1, 256, 288, 288, 288, 288]
    - [12, 9.506]
  - - [256, 512, 1, 512, 288, 288, 544, 544]
    - [5, 15.471]
  - - [256, 512, 1, 1024, 288, 288, 1056, 1056]
    - [5, 22.257]
  - - [256, 512, 1, 2048, 288, 288, 2080, 2080]
    - [6, 29.059]
  - - [256, 512, 1, 4096, 288, 288, 4128, 4128]
    - [6, 34.367]
  - - [256, 1024, 1, 64, 288, 288, 96, 96]
    - [38, 5.341]
  - - [256, 1024, 1, 128, 288, 288, 160, 160]
    - [25, 9.96]
  - - [256, 1024, 1, 256, 288, 288, 288, 288]
    - [22, 17.299]
  - - [256, 1024, 1, 512, 288, 288, 544, 544]
    - [15, 27.751]
  - - [256, 1024, 1, 1024, 288, 288, 1056, 1056]
    - [15, 39.755]
  - - [256, 1024, 1, 2048, 288, 288, 2080, 2080]
    - [3, 50.673]
  - - [256, 1024, 1, 4096, 288, 288, 4128, 4128]
    - [7, 59.475]
  - - [256, 2048, 1, 64, 288, 288, 96, 96]
    - [78, 9.072]
  - - [256, 2048, 1, 128, 288, 288, 160, 160]
    - [29, 16.198]
  - - [256, 2048, 1, 256, 288, 288, 288, 288]
    - [30, 27.475]
  - - [256, 2048, 1, 512, 288, 288, 544, 544]
    - [34, 41.507]
  - - [256, 2048, 1, 1024, 288, 288, 1056, 1056]
    - [34, 55.667]
  - - [256, 2048, 1, 2048, 288, 288, 2080, 2080]
    - [30, 67.126]
  - - [256, 2048, 1, 4096, 288, 288, 4128, 4128]
    - [28, 71.388]
  - - [256, 4096, 1, 64, 288, 288, 96, 96]
    - [74, 15.401]
  - - [256, 4096, 1, 128, 288, 288, 160, 160]
    - [83, 27.134]
  - - [256, 4096, 1, 256, 288, 288, 288, 288]
    - [89, 41.488]
  - - [256, 4096, 1, 512, 288, 288, 544, 544]
    - [83, 56.557]
  - - [256, 4096, 1, 1024, 288, 288, 1056, 1056]
    - [90, 69.762]
  - - [256, 4096, 1, 2048, 288, 288, 2080, 2080]
    - [73, 76.061]
  - - [256, 4096, 1, 4096, 288, 288, 4128, 4128]
    - [90, 82.888]
  - - [384, 64, 1, 64, 416, 416, 96, 96]
    - [56, 0.576]
  - - [384, 64, 1, 128, 416, 416, 160, 160]
    - [45, 1.112]
  - - [384, 64, 1, 256, 416, 416, 288, 288]
    - [59, 2.026]
  - - [384, 64, 1, 512, 416, 416, 544, 544]
    - [38, 3.482]
  - - [384, 64, 1, 1024, 416, 416, 1056, 1056]
    - [44, 5.458]
  - - [384, 64, 1, 2048, 416, 416, 2080, 2080]
    - [43, 7.587]
  - - [384, 64, 1, 4096, 416, 416, 4128, 4128]
    - [49, 9.368]
  - - [384, 128, 1, 64, 416, 416, 96, 96]
    - [52, 1.146]
  - - [384, 128, 1, 128, 416, 416, 160, 160]
    - [48, 2.183]
  - - [384, 128, 1, 256, 416, 416, 288, 288]
    - [38, 4.002]
  - - [384, 128, 1, 512, 416, 416, 544, 544]
    - [63, 6.917]
  - - [384, 128, 1, 1024, 416, 416, 1056, 1056]
    - [37, 10.856]
  - - [384, 128, 1, 2048, 416, 416, 2080, 2080]
    - [54, 15.152]
  - - [384, 128, 1, 4096, 416, 416, 4128, 4128]
    - [53, 18.757]
  - - [384, 256, 1, 64, 416, 416, 96, 96]
    - [66, 2.192]
  - - [384, 256, 1, 128, 416, 416, 160, 160]
    - [1, 4.177]
  - - [384, 256, 1, 256, 416, 416, 288, 288]
    - [2, 7.451]
  - - [384, 256, 1, 512, 416, 416, 544, 544]
    - [52, 12.384]
  - - [384, 256, 1, 1024, 416, 416, 1056, 1056]
    - [52, 18.446]
  - - [384, 256, 1, 2048, 416, 416, 2080, 2080]
    - [36, 24.406]
  - - [384, 256, 1, 4096, 416, 416, 4128, 4128]
    - [36, 28.975]
  - - [384, 512, 1, 64, 416, 416, 96, 96]
    - [52, 4.192]
  - - [384, 512, 1, 128, 416, 416, 160, 160]
    - [19, 7.738]
  - - [384, 512, 1, 256, 416, 416, 288, 288]
    - [70, 13.713]
  - - [384, 512, 1, 512, 416, 416, 544, 544]
    - [84, 22.352]
  - - [384, 512, 1, 1024, 416, 416, 1056, 1056]
    - [84, 32.771]
  - - [384, 512, 1, 2048, 416, 416, 2080, 2080]
    - [70, 42.542]
  - - [384, 512, 1, 4096, 416, 416, 4128, 4128]
    - [84, 50.025]
  - - [384, 1024, 1, 64, 416, 416, 96, 96]
    - [83, 7.343]
  - - [384, 1024, 1, 128, 416, 416, 160, 160]
    - [14, 13.449]
  - - [384, 1024, 1, 256, 416, 416, 288, 288]
    - [32, 23.005]
  - - [384, 1024, 1, 512, 416, 416, 544, 544]
    - [25, 35.847]
  - - [384, 1024, 1, 1024, 416, 416, 1056, 1056]
    - [25, 49.135]
  - - [384, 1024, 1, 2048, 416, 416, 2080, 2080]
    - [25, 60.443]
  - - [384, 1024, 1, 4096, 416, 416, 4128, 4128]
    - [78, 64.722]
  - - [384, 2048, 1, 64, 416, 416, 96, 96]
    - [90, 12.403]
  - - [384, 2048, 1, 128, 416, 416, 160, 160]
    - [81, 21.877]
  - - [384, 2048, 1, 256, 416, 416, 288, 288]
    - [93, 35.042]
  - - [384, 2048, 1, 512, 416, 416, 544, 544]
    - [86, 50.346]
  - - [384, 2048, 1, 1024, 416, 416, 1056, 1056]
    - [80, 64.736]
  - - [384, 2048, 1, 2048, 416, 416, 2080, 2080]
    - [80, 67.978]
  - - [384, 2048, 1, 4096, 416, 416, 4128, 4128]
    - [90, 78.335]
  - - [384, 4096, 1, 64, 416, 416, 96, 96]
    - [68, 20.534]
  - - [384, 4096, 1, 128, 416, 416, 160, 160]
    - [81, 34.837]
  - - [384, 4096, 1, 256, 416, 416, 288, 288]
    - [81, 50.937]
  - - [384, 4096, 1, 512, 416, 416, 544, 544]
    - [83, 65.687]
  - - [384, 4096, 1, 1024, 416, 416, 1056, 1056]
    - [83, 77.024]
  - - [384, 4096, 1, 2048, 416, 416, 2080, 2080]
    - [86, 80.679]
  - - [384, 4096, 1, 4096, 416, 416, 4128, 4128]
    - [87, 81.198]
  - - [768, 64, 1, 64, 800, 800, 96, 96]
    - [45, 1.14]
  - - [768, 64, 1, 128, 800, 800, 160, 160]
    - [47, 2.174]
  - - [768, 64, 1, 256, 800, 800, 288, 288]
    - [37, 4.018]
  - - [768, 64, 1, 512, 800, 800, 544, 544]
    - [37, 6.861]
  - - [768, 64, 1, 1024, 800, 800, 1056, 1056]
    - [37, 10.813]
  - - [768, 64, 1, 2048, 800, 800, 2080, 2080]
    - [38, 15.02]
  - - [768, 64, 1, 4096, 800, 800, 4128, 4128]
    - [53, 18.453]
  - - [768, 128, 1, 64, 800, 800, 96, 96]
    - [60, 2.2]
  - - [768, 128, 1, 128, 800, 800, 160, 160]
    - [54, 4.142]
  - - [768, 128, 1, 256, 800, 800, 288, 288]
    - [54, 7.374]
  - - [768, 128, 1, 512, 800, 800, 544, 544]
    - [64, 12.19]
  - - [768, 128, 1, 1024, 800, 800, 1056, 1056]
    - [53, 18.233]
  - - [768, 128, 1, 2048, 800, 800, 2080, 2080]
    - [37, 24.183]
  - - [768, 128, 1, 4096, 800, 800, 4128, 4128]
    - [37, 28.966]
  - - [768, 256, 1, 64, 800, 800, 96, 96]
    - [54, 4.169]
  - - [768, 256, 1, 128, 800, 800, 160, 160]
    - [21, 7.733]
  - - [768, 256, 1, 256, 800, 800, 288, 288]
    - [75, 13.631]
  - - [768, 256, 1, 512, 800, 800, 544, 544]
    - [79, 22.17]
  - - [768, 256, 1, 1024, 800, 800, 1056, 1056]
    - [85, 32.508]
  - - [768, 256, 1, 2048, 800, 800, 2080, 2080]
    - [84, 42.539]
  - - [768, 256, 1, 4096, 800, 800, 4128, 4128]
    - [70, 49.968]
  - - [768, 512, 1, 64, 800, 800, 96, 96]
    - [88, 7.273]
  - - [768, 512, 1, 128, 800, 800, 160, 160]
    - [24, 13.348]
  - - [768, 512, 1, 256, 800, 800, 288, 288]
    - [26, 23.161]
  - - [768, 512, 1, 512, 800, 800, 544, 544]
    - [25, 35.82]
  - - [768, 512, 1, 1024, 800, 800, 1056, 1056]
    - [25, 49.205]
  - - [768, 512, 1, 2048, 800, 800, 2080, 2080]
    - [93, 59.995]
  - - [768, 512, 1, 4096, 800, 800, 4128, 4128]
    - [17, 64.356]
  - - [768, 1024, 1, 64, 800, 800, 96, 96]
    - [83, 12.513]
  - - [768, 1024, 1, 128, 800, 800, 160, 160]
    - [81, 22.001]
  - - [768, 1024, 1, 256, 800, 800, 288, 288]
    - [83, 35.14]
  - - [768, 1024, 1, 512, 800, 800, 544, 544]
    - [87, 50.358]
  - - [768, 1024, 1, 1024, 800, 800, 1056, 1056]
    - [90, 64.453]
  - - [768, 1024, 1, 2048, 800, 800, 2080, 2080]
    - [87, 68.116]
  - - [768, 1024, 1, 4096, 800, 800, 4128, 4128]
    - [87, 78.365]
  - - [768, 2048, 1, 64, 800, 800, 96, 96]
    - [82, 20.439]
  - - [768, 2048, 1, 128, 800, 800, 160, 160]
    - [81, 34.664]
  - - [768, 2048, 1, 256, 800, 800, 288, 288]
    - [83, 51.216]
  - - [768, 2048, 1, 512, 800, 800, 544, 544]
    - [83, 65.756]
  - - [768, 2048, 1, 1024, 800, 800, 1056, 1056]
    - [83, 76.979]
  - - [768, 2048, 1, 2048, 800, 800, 2080, 2080]
    - [86, 80.594]
  - - [768, 2048, 1, 4096, 800, 800, 4128, 4128]
    - [95, 80.204]
  - - [768, 4096, 1, 64, 800, 800, 96, 96]
    - [92, 29.689]
  - - [768, 4096, 1, 128, 800, 800, 160, 160]
    - [81, 47.298]
  - - [768, 4096, 1, 256, 800, 800, 288, 288]
    - [83, 63.571]
  - - [768, 4096, 1, 512, 800, 800, 544, 544]
    - [87, 68.149]
  - - [768, 4096, 1, 1024, 800, 800, 1056, 1056]
    - [87, 80.716]
  - - [768, 4096, 1, 2048, 800, 800, 2080, 2080]
    - [86, 85.332]
  - - [768, 4096, 1, 4096, 800, 800, 4128, 4128]
    - [97, 85.394]
  - - [1536, 64, 1, 64, 1568, 1568, 96, 96]
    - [37, 2.204]
  - - [1536, 64, 1, 128, 1568, 1568, 160, 160]
    - [6, 4.117]
  - - [1536, 64, 1, 256, 1568, 1568, 288, 288]
    - [38, 7.378]
  - - [1536, 64, 1, 512, 1568, 1568, 544, 544]
    - [37, 12.223]
  - - [1536, 64, 1, 1024, 1568, 1568, 1056, 1056]
    - [54, 18.13]
  - - [1536, 64, 1, 2048, 1568, 1568, 2080, 2080]
    - [53, 23.988]
  - - [1536, 64, 1, 4096, 1568, 1568, 4128, 4128]
    - [37, 28.712]
  - - [1536, 128, 1, 64, 1568, 1568, 96, 96]
    - [37, 4.136]
  - - [1536, 128, 1, 128, 1568, 1568, 160, 160]
    - [89, 7.702]
  - - [1536, 128, 1, 256, 1568, 1568, 288, 288]
    - [84, 13.713]
  - - [1536, 128, 1, 512, 1568, 1568, 544, 544]
    - [85, 22.273]
  - - [1536, 128, 1, 1024, 1568, 1568, 1056, 1056]
    - [70, 32.765]
  - - [1536, 128, 1, 2048, 1568, 1568, 2080, 2080]
    - [84, 42.487]
  - - [1536, 128, 1, 4096, 1568, 1568, 4128, 4128]
    - [70, 50.046]
  - - [1536, 256, 1, 64, 1568, 1568, 96, 96]
    - [25, 7.262]
  - - [1536, 256, 1, 128, 1568, 1568, 160, 160]
    - [33, 13.399]
  - - [1536, 256, 1, 256, 1568, 1568, 288, 288]
    - [33, 23.096]
  - - [1536, 256, 1, 512, 1568, 1568, 544, 544]
    - [16, 35.341]
  - - [1536, 256, 1, 1024, 1568, 1568, 1056, 1056]
    - [78, 48.668]
  - - [1536, 256, 1, 2048, 1568, 1568, 2080, 2080]
    - [83, 59.795]
  - - [1536, 256, 1, 4096, 1568, 1568, 4128, 4128]
    - [89, 64.755]
  - - [1536, 512, 1, 64, 1568, 1568, 96, 96]
    - [83, 12.408]
  - - [1536, 512, 1, 128, 1568, 1568, 160, 160]
    - [91, 21.962]
  - - [1536, 512, 1, 256, 1568, 1568, 288, 288]
    - [69, 34.99]
  - - [1536, 512, 1, 512, 1568, 1568, 544, 544]
    - [80, 50.188]
  - - [1536, 512, 1, 1024, 1568, 1568, 1056, 1056]
    - [87, 64.304]
  - - [1536, 512, 1, 2048, 1568, 1568, 2080, 2080]
    - [73, 74.642]
  - - [1536, 512, 1, 4096, 1568, 1568, 4128, 4128]
    - [87, 78.559]
  - - [1536, 1024, 1, 64, 1568, 1568, 96, 96]
    - [68, 20.421]
  - - [1536, 1024, 1, 128, 1568, 1568, 160, 160]
    - [81, 34.686]
  - - [1536, 1024, 1, 256, 1568, 1568, 288, 288]
    - [69, 51.092]
  - - [1536, 1024, 1, 512, 1568, 1568, 544, 544]
    - [83, 65.806]
  - - [1536, 1024, 1, 1024, 1568, 1568, 1056, 1056]
    - [83, 76.954]
  - - [1536, 1024, 1, 2048, 1568, 1568, 2080, 2080]
    - [86, 80.527]
  - - [1536, 1024, 1, 4096, 1568, 1568, 4128, 4128]
    - [72, 80.456]
  - - [1536, 2048, 1, 64, 1568, 1568, 96, 96]
    - [77, 29.862]
  - - [1536, 2048, 1, 128, 1568, 1568, 160, 160]
    - [69, 47.51]
  - - [1536, 2048, 1, 256, 1568, 1568, 288, 288]
    - [69, 63.751]
  - - [1536, 2048, 1, 512, 1568, 1568, 544, 544]
    - [86, 69.047]
  - - [1536, 2048, 1, 1024, 1568, 1568, 1056, 1056]
    - [73, 80.539]
  - - [1536, 2048, 1, 2048, 1568, 1568, 2080, 2080]
    - [72, 84.956]
  - - [1536, 2048, 1, 4096, 1568, 1568, 4128, 4128]
    - [97, 85.394]
  - - [1536, 4096, 1, 64, 1568, 1568, 96, 96]
    - [74, 38.634]
  - - [1536, 4096, 1, 128, 1568, 1568, 160, 160]
    - [69, 58.501]
  - - [1536, 4096, 1, 256, 1568, 1568, 288, 288]
    - [78, 71.992]
  - - [1536, 4096, 1, 512, 1568, 1568, 544, 544]
    - [98, 78.552]
  - - [1536, 4096, 1, 1024, 1568, 1568, 1056, 1056]
    - [98, 85.969]
  - - [1536, 4096, 1, 2048, 1568, 1568, 2080, 2080]
    - [98, 89.889]
  - - [1536, 4096, 1, 4096, 1568, 1568, 4128, 4128]
    - [96, 91.218]
  - - [3072, 64, 1, 64, 3104, 3104, 96, 96]
    - [52, 4.148]
  - - [3072, 64, 1, 128, 3104, 3104, 160, 160]
    - [78, 7.799]
  - - [3072, 64, 1, 256, 3104, 3104, 288, 288]
    - [94, 13.72]
  - - [3072, 64, 1, 512, 3104, 3104, 544, 544]
    - [70, 22.379]
  - - [3072, 64, 1, 1024, 3104, 3104, 1056, 1056]
    - [70, 32.738]
  - - [3072, 64, 1, 2048, 3104, 3104, 2080, 2080]
    - [84, 42.401]
  - - [3072, 64, 1, 4096, 3104, 3104, 4128, 4128]
    - [84, 50.044]
  - - [3072, 128, 1, 64, 3104, 3104, 96, 96]
    - [81, 7.288]
  - - [3072, 128, 1, 128, 3104, 3104, 160, 160]
    - [26, 13.423]
  - - [3072, 128, 1, 256, 3104, 3104, 288, 288]
    - [20, 23.05]
  - - [3072, 128, 1, 512, 3104, 3104, 544, 544]
    - [83, 35.459]
  - - [3072, 128, 1, 1024, 3104, 3104, 1056, 1056]
    - [83, 48.915]
  - - [3072, 128, 1, 2048, 3104, 3104, 2080, 2080]
    - [83, 59.847]
  - - [3072, 128, 1, 4096, 3104, 3104, 4128, 4128]
    - [83, 64.715]
  - - [3072, 256, 1, 64, 3104, 3104, 96, 96]
    - [81, 12.435]
  - - [3072, 256, 1, 128, 3104, 3104, 160, 160]
    - [89, 21.977]
  - - [3072, 256, 1, 256, 3104, 3104, 288, 288]
    - [81, 35.035]
  - - [3072, 256, 1, 512, 3104, 3104, 544, 544]
    - [18, 50.3]
  - - [3072, 256, 1, 1024, 3104, 3104, 1056, 1056]
    - [73, 64.475]
  - - [3072, 256, 1, 2048, 3104, 3104, 2080, 2080]
    - [18, 75.25]
  - - [3072, 256, 1, 4096, 3104, 3104, 4128, 4128]
    - [29, 79.192]
  - - [3072, 512, 1, 64, 3104, 3104, 96, 96]
    - [68, 20.575]
  - - [3072, 512, 1, 128, 3104, 3104, 160, 160]
    - [69, 34.833]
  - - [3072, 512, 1, 256, 3104, 3104, 288, 288]
    - [83, 51.052]
  - - [3072, 512, 1, 512, 3104, 3104, 544, 544]
    - [83, 65.789]
  - - [3072, 512, 1, 1024, 3104, 3104, 1056, 1056]
    - [83, 76.997]
  - - [3072, 512, 1, 2048, 3104, 3104, 2080, 2080]
    - [86, 80.547]
  - - [3072, 512, 1, 4096, 3104, 3104, 4128, 4128]
    - [72, 82.932]
  - - [3072, 1024, 1, 64, 3104, 3104, 96, 96]
    - [77, 30.143]
  - - [3072, 1024, 1, 128, 3104, 3104, 160, 160]
    - [67, 47.645]
  - - [3072, 1024, 1, 256, 3104, 3104, 288, 288]
    - [69, 63.639]
  - - [3072, 1024, 1, 512, 3104, 3104, 544, 544]
    - [83, 73.841]
  - - [3072, 1024, 1, 1024, 3104, 3104, 1056, 1056]
    - [87, 81.001]
  - - [3072, 1024, 1, 2048, 3104, 3104, 2080, 2080]
    - [86, 85.473]
  - - [3072, 1024, 1, 4096, 3104, 3104, 4128, 4128]
    - [99, 85.428]
  - - [3072, 2048, 1, 64, 3104, 3104, 96, 96]
    - [74, 39.098]
  - - [3072, 2048, 1, 128, 3104, 3104, 160, 160]
    - [67, 58.314]
  - - [3072, 2048, 1, 256, 3104, 3104, 288, 288]
    - [93, 72.053]
  - - [3072, 2048, 1, 512, 3104, 3104, 544, 544]
    - [98, 78.63]
  - - [3072, 2048, 1, 1024, 3104, 3104, 1056, 1056]
    - [98, 85.983]
  - - [3072, 2048, 1, 2048, 3104, 3104, 2080, 2080]
    - [98, 89.99]
  - - [3072, 2048, 1, 4096, 3104, 3104, 4128, 4128]
    - [96, 91.2]
  - - [3072, 4096, 1, 64, 3104, 3104, 96, 96]
    - [68, 46.132]
  - - [3072, 4096, 1, 128, 3104, 3104, 160, 160]
    - [69, 63.126]
  - - [3072, 4096, 1, 256, 3104, 3104, 288, 288]
    - [93, 76.812]
  - - [3072, 4096, 1, 512, 3104, 3104, 544, 544]
    - [98, 84.611]
  - - [3072, 4096, 1, 1024, 3104, 3104, 1056, 1056]
    - [96, 89.547]
  - - [3072, 4096, 1, 2048, 3104, 3104, 2080, 2080]
    - [98, 91.419]
  - - [3072, 4096, 1, 4096, 3104, 3104, 4128, 4128]
    - [96, 92.993]
- null
- null
- DeviceEfficiency
