library/src/blas3/Tensile/Logic/asm_full/navi32/navi32_Cijk_Ailk_Bjlk_HHS_BH.yaml
- {MinimumRequiredVersion: 4.35.0}
- navi32
- gfx1101
- [Device 73f0]
    SolutionIndex: 0
    SolutionNameMin: Cijk_Ailk_Bjlk_HHS_BH_MT64x64x16_MI16x16x16x1_SN_1LDSB1_AMAS3_GRVW8_IU1_LPA0_LPB8_NLCA1_NLCB1_SIA2_SU0_SUS0_SVW2_TT2_32_VW2_WGM4
    SolutionIndex: 1
    SolutionNameMin: Cijk_Ailk_Bjlk_HHS_BH_MT64x64x16_MI16x16x16x1_SN_1LDSB0_AMAS3_GRVW8_IU1_LPA0_LPB0_NLCA1_NLCB1_SIA1_SU0_SUS0_SVW2_TT2_32_VW2_WGM8
    SolutionIndex: 2
    SolutionNameMin: Cijk_Ailk_Bjlk_HHS_BH_MT64x64x16_MI16x16x16x1_SN_1LDSB0_AMAS3_GRVW8_IU1_LPA8_LPB0_NLCA1_NLCB1_SIA1_SU0_SUS0_SVW2_TT2_32_VW2_WGM8
    SolutionIndex: 3
    SolutionNameMin: Cijk_Ailk_Bjlk_HHS_BH_MT64x64x16_MI16x16x16x1_SN_1LDSB1_AMAS3_GRVW4_IU1_LPA8_LPB0_NLCA1_NLCB1_SIA2_SU0_SUS0_SVW2_TT2_32_VW2_WGM8
    SolutionIndex: 4
    SolutionNameMin: Cijk_Ailk_Bjlk_HHS_BH_MT128x128x16_MI16x16x16x1_SN_1LDSB0_AMAS3_GRVW4_IU1_LPA0_LPB0_NLCA1_NLCB1_SIA1_SU0_SUS0_SVW2_TT4_64_VW2_WGM4
    SolutionIndex: 5
    SolutionNameMin: Cijk_Ailk_Bjlk_HHS_BH_MT128x128x16_MI16x16x16x1_SN_1LDSB0_AMAS3_GRVW4_IU1_LPA8_LPB0_NLCA1_NLCB1_SIA1_SU0_SUS0_SVW2_TT4_64_VW2_WGM4
    SolutionIndex: 6
    SolutionNameMin: Cijk_Ailk_Bjlk_HHS_BH_MT128x128x16_MI16x16x16x1_SN_1LDSB0_AMAS3_GRVW4_IU1_LPA0_LPB8_NLCA1_NLCB1_SIA1_SU0_SUS0_SVW2_TT4_64_VW2_WGM4
    SolutionIndex: 7
    SolutionNameMin: Cijk_Ailk_Bjlk_HHS_BH_MT128x128x16_MI16x16x16x1_SN_1LDSB0_AMAS3_GRVW8_IU1_LPA0_LPB0_NLCA1_NLCB1_SIA1_SU0_SUS0_SVW2_TT4_64_VW2_WGM4
    SolutionIndex: 8
    SolutionNameMin: Cijk_Ailk_Bjlk_HHS_BH_MT128x128x16_MI16x16x16x1_SN_1LDSB0_AMAS3_GRVW8_IU1_LPA8_LPB0_NLCA1_NLCB1_SIA1_SU0_SUS0_SVW2_TT4_64_VW2_WGM4
    SolutionIndex: 9
    SolutionNameMin: Cijk_Ailk_Bjlk_HHS_BH_MT128x128x16_MI16x16x16x1_SN_1LDSB0_AMAS3_GRVW8_IU1_LPA0_LPB8_NLCA1_NLCB1_SIA1_SU0_SUS0_SVW2_TT4_64_VW2_WGM4
    SolutionIndex: 10
    SolutionNameMin: Cijk_Ailk_Bjlk_HHS_BH_MT128x128x16_MI16x16x16x1_SN_1LDSB0_AMAS3_GRVW8_IU1_LPA8_LPB8_NLCA1_NLCB1_SIA1_SU0_SUS0_SVW2_TT4_64_VW2_WGM4
    SolutionIndex: 11
    SolutionNameMin: Cijk_Ailk_Bjlk_HHS_BH_MT128x128x16_MI16x16x16x1_SN_1LDSB1_AMAS3_GRVW4_IU1_LPA0_LPB0_NLCA1_NLCB1_SIA2_SU0_SUS0_SVW2_TT4_64_VW2_WGM4
    SolutionIndex: 12
    SolutionNameMin: Cijk_Ailk_Bjlk_HHS_BH_MT128x128x16_MI16x16x16x1_SN_1LDSB1_AMAS3_GRVW4_IU1_LPA0_LPB8_NLCA1_NLCB1_SIA2_SU0_SUS0_SVW2_TT4_64_VW2_WGM4
    SolutionIndex: 13
    SolutionNameMin: Cijk_Ailk_Bjlk_HHS_BH_MT128x128x16_MI16x16x16x1_SN_1LDSB1_AMAS3_GRVW4_IU1_LPA8_LPB8_NLCA1_NLCB1_SIA2_SU0_SUS0_SVW2_TT4_64_VW2_WGM4
    SolutionIndex: 14
    SolutionNameMin: Cijk_Ailk_Bjlk_HHS_BH_MT128x128x16_MI16x16x16x1_SN_1LDSB1_AMAS3_GRVW8_IU1_LPA0_LPB0_NLCA1_NLCB1_SIA2_SU0_SUS0_SVW2_TT4_64_VW2_WGM4
    SolutionIndex: 15
    SolutionNameMin: Cijk_Ailk_Bjlk_HHS_BH_MT128x128x16_MI16x16x16x1_SN_1LDSB1_AMAS3_GRVW8_IU1_LPA8_LPB0_NLCA1_NLCB1_SIA2_SU0_SUS0_SVW2_TT4_64_VW2_WGM4
    SolutionIndex: 16
    SolutionNameMin: Cijk_Ailk_Bjlk_HHS_BH_MT128x128x16_MI16x16x16x1_SN_1LDSB1_AMAS3_GRVW8_IU1_LPA0_LPB8_NLCA1_NLCB1_SIA2_SU0_SUS0_SVW2_TT4_64_VW2_WGM4
    SolutionIndex: 17
    SolutionNameMin: Cijk_Ailk_Bjlk_HHS_BH_MT128x128x16_MI16x16x16x1_SN_1LDSB1_AMAS3_GRVW8_IU1_LPA8_LPB8_NLCA1_NLCB1_SIA2_SU0_SUS0_SVW2_TT4_64_VW2_WGM4
    SolutionIndex: 18
    SolutionNameMin: Cijk_Ailk_Bjlk_HHS_BH_MT128x128x16_MI16x16x16x1_SN_1LDSB0_AMAS3_GRVW8_IU1_LPA0_LPB0_NLCA1_NLCB1_SIA3_SU0_SUS0_SVW2_TT4_64_VW2_WGM4
    SolutionIndex: 19
    SolutionNameMin: Cijk_Ailk_Bjlk_HHS_BH_MT128x128x16_MI16x16x16x1_SN_1LDSB1_AMAS3_GRVW4_IU1_LPA8_LPB0_NLCA1_NLCB1_SIA2_SU32_SUS128_SVW2_TT4_64_VW2_WGM4
    SolutionIndex: 20
    SolutionNameMin: Cijk_Ailk_Bjlk_HHS_BH_MT128x128x16_MI16x16x16x1_SN_1LDSB1_AMAS3_GRVW8_IU1_LPA0_LPB0_NLCA1_NLCB1_SIA2_SU32_SUS128_SVW2_TT4_64_VW2_WGM4
    SolutionIndex: 21
    SolutionNameMin: Cijk_Ailk_Bjlk_HHS_BH_MT128x128x16_MI16x16x16x1_SN_1LDSB1_AMAS3_GRVW8_IU1_LPA8_LPB0_NLCA1_NLCB1_SIA2_SU32_SUS128_SVW2_TT4_64_VW2_WGM4
    SolutionIndex: 22
    SolutionNameMin: Cijk_Ailk_Bjlk_HHS_BH_MT128x128x16_MI16x16x16x1_SN_1LDSB1_AMAS3_GRVW8_IU1_LPA8_LPB8_NLCA1_NLCB1_SIA2_SU32_SUS128_SVW2_TT4_64_VW2_WGM4
    SolutionIndex: 23
    SolutionNameMin: Cijk_Ailk_Bjlk_HHS_BH_MT128x128x16_MI16x16x16x1_SN_1LDSB1_AMAS3_GRVW8_IU1_LPA0_LPB0_NLCA1_NLCB1_SIA2_SU32_SUS256_SVW2_TT4_64_VW2_WGM4
    SolutionIndex: 24
    SolutionNameMin: Cijk_Ailk_Bjlk_HHS_BH_MT128x128x16_MI16x16x16x1_SN_1LDSB1_AMAS3_GRVW8_IU1_LPA8_LPB0_NLCA1_NLCB1_SIA2_SU32_SUS256_SVW2_TT4_64_VW2_WGM4
    SolutionIndex: 25
    SolutionNameMin: Cijk_Ailk_Bjlk_HHS_BH_MT128x128x16_MI16x16x16x1_SN_1LDSB1_AMAS3_GRVW8_IU1_LPA0_LPB8_NLCA1_NLCB1_SIA2_SU32_SUS256_SVW2_TT4_64_VW2_WGM4
    SolutionIndex: 26
    SolutionNameMin: Cijk_Ailk_Bjlk_HHS_BH_MT128x128x16_MI16x16x16x1_SN_1LDSB0_AMAS3_GRVW4_IU1_LPA8_LPB0_NLCA1_NLCB1_SIA1_SU0_SUS0_SVW2_TT4_64_VW2_WGM8
    SolutionIndex: 27
    SolutionNameMin: Cijk_Ailk_Bjlk_HHS_BH_MT128x128x16_MI16x16x16x1_SN_1LDSB0_AMAS3_GRVW8_IU1_LPA0_LPB0_NLCA1_NLCB1_SIA1_SU0_SUS0_SVW2_TT4_64_VW2_WGM8
    SolutionIndex: 28
    SolutionNameMin: Cijk_Ailk_Bjlk_HHS_BH_MT128x128x16_MI16x16x16x1_SN_1LDSB0_AMAS3_GRVW8_IU1_LPA8_LPB0_NLCA1_NLCB1_SIA1_SU0_SUS0_SVW2_TT4_64_VW2_WGM8
    SolutionIndex: 29
    SolutionNameMin: Cijk_Ailk_Bjlk_HHS_BH_MT128x128x16_MI16x16x16x1_SN_1LDSB0_AMAS3_GRVW8_IU1_LPA0_LPB8_NLCA1_NLCB1_SIA1_SU0_SUS0_SVW2_TT4_64_VW2_WGM8
    SolutionIndex: 30
    SolutionNameMin: Cijk_Ailk_Bjlk_HHS_BH_MT128x128x16_MI16x16x16x1_SN_1LDSB0_AMAS3_GRVW8_IU1_LPA8_LPB8_NLCA1_NLCB1_SIA1_SU0_SUS0_SVW2_TT4_64_VW2_WGM8
    SolutionIndex: 31
    SolutionNameMin: Cijk_Ailk_Bjlk_HHS_BH_MT128x128x16_MI16x16x16x1_SN_1LDSB1_AMAS3_GRVW4_IU1_LPA0_LPB0_NLCA1_NLCB1_SIA2_SU0_SUS0_SVW2_TT4_64_VW2_WGM8
    SolutionIndex: 32
    SolutionNameMin: Cijk_Ailk_Bjlk_HHS_BH_MT128x128x16_MI16x16x16x1_SN_1LDSB1_AMAS3_GRVW4_IU1_LPA8_LPB0_NLCA1_NLCB1_SIA2_SU0_SUS0_SVW2_TT4_64_VW2_WGM8
    SolutionIndex: 33
    SolutionNameMin: Cijk_Ailk_Bjlk_HHS_BH_MT128x128x16_MI16x16x16x1_SN_1LDSB1_AMAS3_GRVW4_IU1_LPA0_LPB8_NLCA1_NLCB1_SIA2_SU0_SUS0_SVW2_TT4_64_VW2_WGM8
    SolutionIndex: 34
    SolutionNameMin: Cijk_Ailk_Bjlk_HHS_BH_MT128x128x16_MI16x16x16x1_SN_1LDSB1_AMAS3_GRVW4_IU1_LPA8_LPB8_NLCA1_NLCB1_SIA2_SU0_SUS0_SVW2_TT4_64_VW2_WGM8
    SolutionIndex: 35
    SolutionNameMin: Cijk_Ailk_Bjlk_HHS_BH_MT128x128x16_MI16x16x16x1_SN_1LDSB1_AMAS3_GRVW8_IU1_LPA0_LPB0_NLCA1_NLCB1_SIA2_SU0_SUS0_SVW2_TT4_64_VW2_WGM8
    SolutionIndex: 36
    SolutionNameMin: Cijk_Ailk_Bjlk_HHS_BH_MT128x128x16_MI16x16x16x1_SN_1LDSB1_AMAS3_GRVW8_IU1_LPA8_LPB0_NLCA1_NLCB1_SIA2_SU0_SUS0_SVW2_TT4_64_VW2_WGM8
    SolutionIndex: 37
    SolutionNameMin: Cijk_Ailk_Bjlk_HHS_BH_MT128x128x16_MI16x16x16x1_SN_1LDSB1_AMAS3_GRVW8_IU1_LPA0_LPB8_NLCA1_NLCB1_SIA2_SU0_SUS0_SVW2_TT4_64_VW2_WGM8
    SolutionIndex: 38
    SolutionNameMin: Cijk_Ailk_Bjlk_HHS_BH_MT128x128x16_MI16x16x16x1_SN_1LDSB1_AMAS3_GRVW8_IU1_LPA8_LPB8_NLCA1_NLCB1_SIA2_SU0_SUS0_SVW2_TT4_64_VW2_WGM8
    SolutionIndex: 39
    SolutionNameMin: Cijk_Ailk_Bjlk_HHS_BH_MT128x128x16_MI16x16x16x1_SN_1LDSB0_AMAS3_GRVW8_IU1_LPA8_LPB0_NLCA1_NLCB1_SIA3_SU0_SUS0_SVW2_TT4_64_VW2_WGM8
    SolutionIndex: 40
    SolutionNameMin: Cijk_Ailk_Bjlk_HHS_BH_MT128x128x16_MI16x16x16x1_SN_1LDSB0_AMAS3_GRVW8_IU1_LPA0_LPB8_NLCA1_NLCB1_SIA3_SU0_SUS0_SVW2_TT4_64_VW2_WGM8
    SolutionIndex: 41
    SolutionNameMin: Cijk_Ailk_Bjlk_HHS_BH_MT128x128x16_MI16x16x16x1_SN_1LDSB0_AMAS3_GRVW8_IU1_LPA0_LPB0_NLCA1_NLCB1_SIA1_SU32_SUS128_SVW2_TT4_64_VW2_WGM8
    SolutionIndex: 42
    SolutionNameMin: Cijk_Ailk_Bjlk_HHS_BH_MT128x128x16_MI16x16x16x1_SN_1LDSB0_AMAS3_GRVW8_IU1_LPA8_LPB0_NLCA1_NLCB1_SIA1_SU32_SUS128_SVW2_TT4_64_VW2_WGM8
    SolutionIndex: 43
    SolutionNameMin: Cijk_Ailk_Bjlk_HHS_BH_MT128x128x16_MI16x16x16x1_SN_1LDSB0_AMAS3_GRVW8_IU1_LPA0_LPB8_NLCA1_NLCB1_SIA1_SU32_SUS128_SVW2_TT4_64_VW2_WGM8
    SolutionIndex: 44
    SolutionNameMin: Cijk_Ailk_Bjlk_HHS_BH_MT128x128x16_MI16x16x16x1_SN_1LDSB0_AMAS3_GRVW8_IU1_LPA8_LPB8_NLCA1_NLCB1_SIA1_SU32_SUS128_SVW2_TT4_64_VW2_WGM8
    SolutionIndex: 45
    SolutionNameMin: Cijk_Ailk_Bjlk_HHS_BH_MT128x128x16_MI16x16x16x1_SN_1LDSB1_AMAS3_GRVW2_IU1_LPA0_LPB8_NLCA2_NLCB2_SIA2_SU32_SUS128_SVW2_TT4_64_VW2_WGM8
    SolutionIndex: 46
    SolutionNameMin: Cijk_Ailk_Bjlk_HHS_BH_MT128x128x16_MI16x16x16x1_SN_1LDSB1_AMAS3_GRVW4_IU1_LPA8_LPB0_NLCA1_NLCB1_SIA2_SU32_SUS128_SVW2_TT4_64_VW2_WGM8
    SolutionIndex: 47
    SolutionNameMin: Cijk_Ailk_Bjlk_HHS_BH_MT128x128x16_MI16x16x16x1_SN_1LDSB1_AMAS3_GRVW4_IU1_LPA8_LPB8_NLCA1_NLCB1_SIA2_SU32_SUS128_SVW2_TT4_64_VW2_WGM8
    SolutionIndex: 48
    SolutionNameMin: Cijk_Ailk_Bjlk_HHS_BH_MT128x128x16_MI16x16x16x1_SN_1LDSB1_AMAS3_GRVW8_IU1_LPA8_LPB0_NLCA1_NLCB1_SIA2_SU32_SUS128_SVW2_TT4_64_VW2_WGM8
    SolutionIndex: 49
    SolutionNameMin: Cijk_Ailk_Bjlk_HHS_BH_MT128x128x16_MI16x16x16x1_SN_1LDSB1_AMAS3_GRVW8_IU1_LPA0_LPB8_NLCA1_NLCB1_SIA2_SU32_SUS128_SVW2_TT4_64_VW2_WGM8
    SolutionIndex: 50
    SolutionNameMin: Cijk_Ailk_Bjlk_HHS_BH_MT128x128x16_MI16x16x16x1_SN_1LDSB1_AMAS3_GRVW8_IU1_LPA8_LPB8_NLCA1_NLCB1_SIA2_SU32_SUS128_SVW2_TT4_64_VW2_WGM8
    SolutionIndex: 51
    SolutionNameMin: Cijk_Ailk_Bjlk_HHS_BH_MT128x128x16_MI16x16x16x1_SN_1LDSB0_AMAS3_GRVW8_IU1_LPA8_LPB0_NLCA1_NLCB1_SIA1_SU32_SUS256_SVW2_TT4_64_VW2_WGM8
    SolutionIndex: 52
    SolutionNameMin: Cijk_Ailk_Bjlk_HHS_BH_MT128x128x16_MI16x16x16x1_SN_1LDSB0_AMAS3_GRVW8_IU1_LPA0_LPB8_NLCA1_NLCB1_SIA1_SU32_SUS256_SVW2_TT4_64_VW2_WGM8
    SolutionIndex: 53
    SolutionNameMin: Cijk_Ailk_Bjlk_HHS_BH_MT128x128x16_MI16x16x16x1_SN_1LDSB0_AMAS3_GRVW8_IU1_LPA8_LPB8_NLCA1_NLCB1_SIA1_SU32_SUS256_SVW2_TT4_64_VW2_WGM8
    SolutionIndex: 54
    SolutionNameMin: Cijk_Ailk_Bjlk_HHS_BH_MT128x128x16_MI16x16x16x1_SN_1LDSB1_AMAS3_GRVW4_IU1_LPA0_LPB0_NLCA1_NLCB1_SIA2_SU32_SUS256_SVW2_TT4_64_VW2_WGM8
    SolutionIndex: 55
    SolutionNameMin: Cijk_Ailk_Bjlk_HHS_BH_MT128x128x16_MI16x16x16x1_SN_1LDSB1_AMAS3_GRVW8_IU1_LPA0_LPB0_NLCA1_NLCB1_SIA2_SU32_SUS256_SVW2_TT4_64_VW2_WGM8
    SolutionIndex: 56
    SolutionNameMin: Cijk_Ailk_Bjlk_HHS_BH_MT128x128x16_MI16x16x16x1_SN_1LDSB1_AMAS3_GRVW8_IU1_LPA8_LPB0_NLCA1_NLCB1_SIA2_SU32_SUS256_SVW2_TT4_64_VW2_WGM8
    SolutionIndex: 57
    SolutionNameMin: Cijk_Ailk_Bjlk_HHS_BH_MT128x128x16_MI16x16x16x1_SN_1LDSB1_AMAS3_GRVW8_IU1_LPA8_LPB8_NLCA1_NLCB1_SIA2_SU32_SUS256_SVW2_TT4_64_VW2_WGM8
    SolutionIndex: 58
    SolutionNameMin: Cijk_Ailk_Bjlk_HHS_BH_MT32x32x32_MI16x16x16x1_SN_1LDSB0_AMAS0_GRVW4_IU1_LPA0_LPB0_NLCA1_NLCB1_SIA1_SU0_SUS0_SVW1_TT1_16_VW1_WGM4
    SolutionIndex: 59
    SolutionNameMin: Cijk_Ailk_Bjlk_HHS_BH_MT32x32x32_MI16x16x16x1_SN_1LDSB0_AMAS0_GRVW4_IU1_LPA8_LPB0_NLCA1_NLCB1_SIA1_SU0_SUS0_SVW1_TT1_16_VW1_WGM4
    SolutionIndex: 60
    SolutionNameMin: Cijk_Ailk_Bjlk_HHS_BH_MT32x32x32_MI16x16x16x1_SN_1LDSB0_AMAS0_GRVW8_IU1_LPA0_LPB0_NLCA1_NLCB1_SIA1_SU0_SUS0_SVW1_TT1_16_VW1_WGM4
    SolutionIndex: 61
    SolutionNameMin: Cijk_Ailk_Bjlk_HHS_BH_MT32x32x32_MI16x16x16x1_SN_1LDSB1_AMAS0_GRVW4_IU2_LPA0_LPB0_NLCA1_NLCB1_SIA2_SU0_SUS0_SVW1_TT1_16_VW1_WGM4
    SolutionIndex: 62
    SolutionNameMin: Cijk_Ailk_Bjlk_HHS_BH_MT32x32x32_MI16x16x16x1_SN_1LDSB1_AMAS0_GRVW4_IU2_LPA0_LPB8_NLCA1_NLCB1_SIA2_SU0_SUS0_SVW1_TT1_16_VW1_WGM4
    SolutionIndex: 63
    SolutionNameMin: Cijk_Ailk_Bjlk_HHS_BH_MT32x32x32_MI16x16x16x1_SN_1LDSB1_AMAS0_GRVW8_IU2_LPA0_LPB0_NLCA1_NLCB1_SIA2_SU0_SUS0_SVW1_TT1_16_VW1_WGM4
    SolutionIndex: 64
    SolutionNameMin: Cijk_Ailk_Bjlk_HHS_BH_MT32x32x32_MI16x16x16x1_SN_1LDSB1_AMAS0_GRVW8_IU2_LPA8_LPB0_NLCA1_NLCB1_SIA2_SU0_SUS0_SVW1_TT1_16_VW1_WGM4
    SolutionIndex: 65
    SolutionNameMin: Cijk_Ailk_Bjlk_HHS_BH_MT32x32x32_MI16x16x16x1_SN_1LDSB1_AMAS0_GRVW8_IU2_LPA0_LPB8_NLCA1_NLCB1_SIA2_SU0_SUS0_SVW1_TT1_16_VW1_WGM4
    SolutionIndex: 66
    SolutionNameMin: Cijk_Ailk_Bjlk_HHS_BH_MT32x32x32_MI16x16x16x1_SN_1LDSB1_AMAS0_GRVW8_IU2_LPA8_LPB8_NLCA1_NLCB1_SIA2_SU0_SUS0_SVW1_TT1_16_VW1_WGM4
    SolutionIndex: 67
    SolutionNameMin: Cijk_Ailk_Bjlk_HHS_BH_MT32x32x32_MI16x16x16x1_SN_1LDSB0_AMAS0_GRVW4_IU1_LPA0_LPB8_NLCA1_NLCB1_SIA3_SU0_SUS0_SVW1_TT1_16_VW1_WGM4
    SolutionIndex: 68
    SolutionNameMin: Cijk_Ailk_Bjlk_HHS_BH_MT32x32x32_MI16x16x16x1_SN_1LDSB0_AMAS0_GRVW8_IU1_LPA0_LPB0_NLCA1_NLCB1_SIA3_SU0_SUS0_SVW1_TT1_16_VW1_WGM4
    SolutionIndex: 69
    SolutionNameMin: Cijk_Ailk_Bjlk_HHS_BH_MT32x32x32_MI16x16x16x1_SN_1LDSB0_AMAS0_GRVW8_IU1_LPA0_LPB0_NLCA1_NLCB1_SIA1_SU32_SUS128_SVW1_TT1_16_VW1_WGM4
    SolutionIndex: 70
    SolutionNameMin: Cijk_Ailk_Bjlk_HHS_BH_MT32x32x32_MI16x16x16x1_SN_1LDSB1_AMAS0_GRVW4_IU2_LPA8_LPB0_NLCA1_NLCB1_SIA2_SU32_SUS128_SVW1_TT1_16_VW1_WGM4
    SolutionIndex: 71
    SolutionNameMin: Cijk_Ailk_Bjlk_HHS_BH_MT32x32x32_MI16x16x16x1_SN_1LDSB1_AMAS0_GRVW8_IU2_LPA0_LPB0_NLCA1_NLCB1_SIA2_SU32_SUS128_SVW1_TT1_16_VW1_WGM4
    SolutionIndex: 72
    SolutionNameMin: Cijk_Ailk_Bjlk_HHS_BH_MT32x32x32_MI16x16x16x1_SN_1LDSB0_AMAS0_GRVW8_IU1_LPA0_LPB0_NLCA1_NLCB1_SIA1_SU32_SUS256_SVW1_TT1_16_VW1_WGM4
    SolutionIndex: 73
    SolutionNameMin: Cijk_Ailk_Bjlk_HHS_BH_MT32x32x32_MI16x16x16x1_SN_1LDSB0_AMAS0_GRVW8_IU1_LPA8_LPB8_NLCA1_NLCB1_SIA1_SU32_SUS256_SVW1_TT1_16_VW1_WGM4
    SolutionIndex: 74
    SolutionNameMin: Cijk_Ailk_Bjlk_HHS_BH_MT32x32x32_MI16x16x16x1_SN_1LDSB1_AMAS0_GRVW8_IU2_LPA0_LPB0_NLCA1_NLCB1_SIA2_SU32_SUS256_SVW1_TT1_16_VW1_WGM4
    SolutionIndex: 75
    SolutionNameMin: Cijk_Ailk_Bjlk_HHS_BH_MT32x32x32_MI16x16x16x1_SN_1LDSB1_AMAS0_GRVW8_IU2_LPA8_LPB0_NLCA1_NLCB1_SIA2_SU32_SUS256_SVW1_TT1_16_VW1_WGM4
    SolutionIndex: 76
    SolutionNameMin: Cijk_Ailk_Bjlk_HHS_BH_MT32x32x32_MI16x16x16x1_SN_1LDSB0_AMAS0_GRVW4_IU1_LPA0_LPB0_NLCA1_NLCB1_SIA1_SU0_SUS0_SVW1_TT1_16_VW1_WGM8
    SolutionIndex: 77
    SolutionNameMin: Cijk_Ailk_Bjlk_HHS_BH_MT32x32x32_MI16x16x16x1_SN_1LDSB0_AMAS0_GRVW8_IU1_LPA0_LPB0_NLCA1_NLCB1_SIA1_SU0_SUS0_SVW1_TT1_16_VW1_WGM8
    SolutionIndex: 78
    SolutionNameMin: Cijk_Ailk_Bjlk_HHS_BH_MT32x32x32_MI16x16x16x1_SN_1LDSB1_AMAS0_GRVW4_IU2_LPA0_LPB0_NLCA1_NLCB1_SIA2_SU0_SUS0_SVW1_TT1_16_VW1_WGM8
    SolutionIndex: 79
    SolutionNameMin: Cijk_Ailk_Bjlk_HHS_BH_MT32x32x32_MI16x16x16x1_SN_1LDSB1_AMAS0_GRVW4_IU2_LPA8_LPB0_NLCA1_NLCB1_SIA2_SU0_SUS0_SVW1_TT1_16_VW1_WGM8
    SolutionIndex: 80
    SolutionNameMin: Cijk_Ailk_Bjlk_HHS_BH_MT32x32x32_MI16x16x16x1_SN_1LDSB1_AMAS0_GRVW8_IU2_LPA0_LPB0_NLCA1_NLCB1_SIA2_SU0_SUS0_SVW1_TT1_16_VW1_WGM8
    SolutionIndex: 81
    SolutionNameMin: Cijk_Ailk_Bjlk_HHS_BH_MT32x32x32_MI16x16x16x1_SN_1LDSB1_AMAS0_GRVW8_IU2_LPA8_LPB0_NLCA1_NLCB1_SIA2_SU0_SUS0_SVW1_TT1_16_VW1_WGM8
    SolutionIndex: 82
    SolutionNameMin: Cijk_Ailk_Bjlk_HHS_BH_MT32x32x32_MI16x16x16x1_SN_1LDSB1_AMAS0_GRVW8_IU2_LPA0_LPB8_NLCA1_NLCB1_SIA2_SU0_SUS0_SVW1_TT1_16_VW1_WGM8
    SolutionIndex: 83
    SolutionNameMin: Cijk_Ailk_Bjlk_HHS_BH_MT32x32x32_MI16x16x16x1_SN_1LDSB1_AMAS0_GRVW8_IU2_LPA8_LPB8_NLCA1_NLCB1_SIA2_SU0_SUS0_SVW1_TT1_16_VW1_WGM8
    SolutionIndex: 84
    SolutionNameMin: Cijk_Ailk_Bjlk_HHS_BH_MT32x32x32_MI16x16x16x1_SN_1LDSB0_AMAS0_GRVW4_IU1_LPA0_LPB0_NLCA1_NLCB1_SIA1_SU32_SUS128_SVW1_TT1_16_VW1_WGM8
    SolutionIndex: 85
    SolutionNameMin: Cijk_Ailk_Bjlk_HHS_BH_MT32x32x32_MI16x16x16x1_SN_1LDSB0_AMAS0_GRVW8_IU1_LPA8_LPB8_NLCA1_NLCB1_SIA1_SU32_SUS128_SVW1_TT1_16_VW1_WGM8
    SolutionIndex: 86
    SolutionNameMin: Cijk_Ailk_Bjlk_HHS_BH_MT32x32x32_MI16x16x16x1_SN_1LDSB1_AMAS0_GRVW4_IU2_LPA0_LPB0_NLCA1_NLCB1_SIA2_SU32_SUS128_SVW1_TT1_16_VW1_WGM8
    SolutionIndex: 87
    SolutionNameMin: Cijk_Ailk_Bjlk_HHS_BH_MT32x32x32_MI16x16x16x1_SN_1LDSB1_AMAS0_GRVW8_IU2_LPA0_LPB8_NLCA1_NLCB1_SIA2_SU32_SUS128_SVW1_TT1_16_VW1_WGM8
    SolutionIndex: 88
    SolutionNameMin: Cijk_Ailk_Bjlk_HHS_BH_MT32x32x32_MI16x16x16x1_SN_1LDSB1_AMAS0_GRVW8_IU2_LPA8_LPB0_NLCA1_NLCB1_SIA2_SU32_SUS256_SVW1_TT1_16_VW1_WGM8
    SolutionIndex: 89
    SolutionNameMin: Cijk_Ailk_Bjlk_HHS_BH_MT32x32x32_MI16x16x16x1_SN_1LDSB1_AMAS0_GRVW8_IU2_LPA0_LPB8_NLCA1_NLCB1_SIA2_SU32_SUS256_SVW1_TT1_16_VW1_WGM8
    SolutionIndex: 90
    SolutionNameMin: Cijk_Ailk_Bjlk_HHS_BH_MT64x64x32_MI16x16x16x1_SN_1LDSB0_AMAS3_GRVW4_IU1_LPA0_LPB8_NLCA1_NLCB1_SIA1_SU0_SUS0_SVW2_TT2_32_VW2_WGM4
    SolutionIndex: 91
    SolutionNameMin: Cijk_Ailk_Bjlk_HHS_BH_MT64x64x32_MI16x16x16x1_SN_1LDSB0_AMAS0_GRVW8_IU1_LPA0_LPB0_NLCA1_NLCB1_SIA1_SU0_SUS0_SVW1_TT2_32_VW1_WGM4
    SolutionIndex: 92
    SolutionNameMin: Cijk_Ailk_Bjlk_HHS_BH_MT64x64x32_MI16x16x16x1_SN_1LDSB0_AMAS3_GRVW8_IU1_LPA0_LPB0_NLCA1_NLCB1_SIA1_SU0_SUS0_SVW2_TT2_32_VW2_WGM4
    SolutionIndex: 93
    SolutionNameMin: Cijk_Ailk_Bjlk_HHS_BH_MT64x64x32_MI16x16x16x1_SN_1LDSB0_AMAS3_GRVW8_IU1_LPA8_LPB0_NLCA1_NLCB1_SIA1_SU0_SUS0_SVW2_TT2_32_VW2_WGM4
    SolutionIndex: 94
    SolutionNameMin: Cijk_Ailk_Bjlk_HHS_BH_MT64x64x32_MI16x16x16x1_SN_1LDSB0_AMAS3_GRVW8_IU1_LPA8_LPB8_NLCA1_NLCB1_SIA1_SU0_SUS0_SVW2_TT2_32_VW2_WGM4
    SolutionIndex: 95
    SolutionNameMin: Cijk_Ailk_Bjlk_HHS_BH_MT64x64x32_MI16x16x16x1_SN_1LDSB1_AMAS3_GRVW8_IU2_LPA8_LPB0_NLCA1_NLCB1_SIA2_SU0_SUS0_SVW2_TT2_32_VW2_WGM4
    SolutionIndex: 96
    SolutionNameMin: Cijk_Ailk_Bjlk_HHS_BH_MT64x64x32_MI16x16x16x1_SN_1LDSB1_AMAS3_GRVW8_IU2_LPA0_LPB8_NLCA1_NLCB1_SIA2_SU0_SUS0_SVW2_TT2_32_VW2_WGM4
    SolutionIndex: 97
    SolutionNameMin: Cijk_Ailk_Bjlk_HHS_BH_MT64x64x32_MI16x16x16x1_SN_1LDSB0_AMAS3_GRVW8_IU1_LPA0_LPB0_NLCA1_NLCB1_SIA3_SU0_SUS0_SVW2_TT2_32_VW2_WGM4
    SolutionIndex: 98
    SolutionNameMin: Cijk_Ailk_Bjlk_HHS_BH_MT64x64x32_MI16x16x16x1_SN_1LDSB0_AMAS3_GRVW8_IU1_LPA8_LPB0_NLCA1_NLCB1_SIA3_SU0_SUS0_SVW2_TT2_32_VW2_WGM4
    SolutionIndex: 99
    SolutionNameMin: Cijk_Ailk_Bjlk_HHS_BH_MT64x64x32_MI16x16x16x1_SN_1LDSB0_AMAS3_GRVW8_IU1_LPA0_LPB8_NLCA1_NLCB1_SIA3_SU0_SUS0_SVW2_TT2_32_VW2_WGM4
    SolutionIndex: 100
    SolutionNameMin: Cijk_Ailk_Bjlk_HHS_BH_MT64x64x32_MI16x16x16x1_SN_1LDSB0_AMAS3_GRVW8_IU1_LPA8_LPB8_NLCA1_NLCB1_SIA3_SU0_SUS0_SVW2_TT2_32_VW2_WGM4
    SolutionIndex: 101
    SolutionNameMin: Cijk_Ailk_Bjlk_HHS_BH_MT64x64x32_MI16x16x16x1_SN_1LDSB0_AMAS3_GRVW4_IU1_LPA8_LPB0_NLCA1_NLCB1_SIA1_SU32_SUS128_SVW2_TT2_32_VW2_WGM4
    SolutionIndex: 102
    SolutionNameMin: Cijk_Ailk_Bjlk_HHS_BH_MT64x64x32_MI16x16x16x1_SN_1LDSB0_AMAS3_GRVW8_IU1_LPA0_LPB0_NLCA1_NLCB1_SIA1_SU32_SUS128_SVW2_TT2_32_VW2_WGM4
    SolutionIndex: 103
    SolutionNameMin: Cijk_Ailk_Bjlk_HHS_BH_MT64x64x32_MI16x16x16x1_SN_1LDSB0_AMAS3_GRVW8_IU1_LPA8_LPB0_NLCA1_NLCB1_SIA1_SU32_SUS128_SVW2_TT2_32_VW2_WGM4
    SolutionIndex: 104
    SolutionNameMin: Cijk_Ailk_Bjlk_HHS_BH_MT64x64x32_MI16x16x16x1_SN_1LDSB0_AMAS3_GRVW8_IU1_LPA0_LPB8_NLCA1_NLCB1_SIA3_SU32_SUS128_SVW2_TT2_32_VW2_WGM4
    SolutionIndex: 105
    SolutionNameMin: Cijk_Ailk_Bjlk_HHS_BH_MT64x64x32_MI16x16x16x1_SN_1LDSB0_AMAS3_GRVW4_IU1_LPA0_LPB0_NLCA1_NLCB1_SIA1_SU32_SUS256_SVW2_TT2_32_VW2_WGM4
    SolutionIndex: 106
    SolutionNameMin: Cijk_Ailk_Bjlk_HHS_BH_MT64x64x32_MI16x16x16x1_SN_1LDSB0_AMAS3_GRVW4_IU1_LPA0_LPB8_NLCA1_NLCB1_SIA1_SU32_SUS256_SVW2_TT2_32_VW2_WGM4
    SolutionIndex: 107
    SolutionNameMin: Cijk_Ailk_Bjlk_HHS_BH_MT64x64x32_MI16x16x16x1_SN_1LDSB0_AMAS3_GRVW8_IU1_LPA0_LPB0_NLCA1_NLCB1_SIA1_SU32_SUS256_SVW2_TT2_32_VW2_WGM4
    SolutionIndex: 108
    SolutionNameMin: Cijk_Ailk_Bjlk_HHS_BH_MT64x64x32_MI16x16x16x1_SN_1LDSB0_AMAS3_GRVW8_IU1_LPA8_LPB0_NLCA1_NLCB1_SIA1_SU32_SUS256_SVW2_TT2_32_VW2_WGM4
    SolutionIndex: 109
    SolutionNameMin: Cijk_Ailk_Bjlk_HHS_BH_MT64x64x32_MI16x16x16x1_SN_1LDSB0_AMAS3_GRVW8_IU1_LPA0_LPB8_NLCA1_NLCB1_SIA1_SU32_SUS256_SVW2_TT2_32_VW2_WGM4
    SolutionIndex: 110
    SolutionNameMin: Cijk_Ailk_Bjlk_HHS_BH_MT64x64x32_MI16x16x16x1_SN_1LDSB0_AMAS3_GRVW8_IU1_LPA8_LPB8_NLCA1_NLCB1_SIA1_SU32_SUS256_SVW2_TT2_32_VW2_WGM4
    SolutionIndex: 111
    SolutionNameMin: Cijk_Ailk_Bjlk_HHS_BH_MT64x64x32_MI16x16x16x1_SN_1LDSB0_AMAS3_GRVW8_IU1_LPA8_LPB0_NLCA1_NLCB1_SIA3_SU32_SUS256_SVW2_TT2_32_VW2_WGM4
    SolutionIndex: 112
    SolutionNameMin: Cijk_Ailk_Bjlk_HHS_BH_MT64x64x32_MI16x16x16x1_SN_1LDSB0_AMAS3_GRVW8_IU1_LPA0_LPB8_NLCA1_NLCB1_SIA3_SU32_SUS256_SVW2_TT2_32_VW2_WGM4
    SolutionIndex: 113
    SolutionNameMin: Cijk_Ailk_Bjlk_HHS_BH_MT64x64x32_MI16x16x16x1_SN_1LDSB0_AMAS3_GRVW4_IU1_LPA0_LPB0_NLCA1_NLCB1_SIA1_SU0_SUS0_SVW2_TT2_32_VW2_WGM8
    SolutionIndex: 114
    SolutionNameMin: Cijk_Ailk_Bjlk_HHS_BH_MT64x64x32_MI16x16x16x1_SN_1LDSB0_AMAS3_GRVW4_IU1_LPA8_LPB8_NLCA1_NLCB1_SIA1_SU0_SUS0_SVW2_TT2_32_VW2_WGM8
    SolutionIndex: 115
    SolutionNameMin: Cijk_Ailk_Bjlk_HHS_BH_MT64x64x32_MI16x16x16x1_SN_1LDSB0_AMAS3_GRVW8_IU1_LPA0_LPB0_NLCA1_NLCB1_SIA1_SU0_SUS0_SVW2_TT2_32_VW2_WGM8
    SolutionIndex: 116
    SolutionNameMin: Cijk_Ailk_Bjlk_HHS_BH_MT64x64x32_MI16x16x16x1_SN_1LDSB0_AMAS3_GRVW8_IU1_LPA8_LPB0_NLCA1_NLCB1_SIA1_SU0_SUS0_SVW2_TT2_32_VW2_WGM8
    SolutionIndex: 117
    SolutionNameMin: Cijk_Ailk_Bjlk_HHS_BH_MT64x64x32_MI16x16x16x1_SN_1LDSB0_AMAS3_GRVW8_IU1_LPA0_LPB8_NLCA1_NLCB1_SIA1_SU0_SUS0_SVW2_TT2_32_VW2_WGM8
    SolutionIndex: 118
    SolutionNameMin: Cijk_Ailk_Bjlk_HHS_BH_MT64x64x32_MI16x16x16x1_SN_1LDSB0_AMAS3_GRVW8_IU1_LPA8_LPB8_NLCA1_NLCB1_SIA1_SU0_SUS0_SVW2_TT2_32_VW2_WGM8
    SolutionIndex: 119
    SolutionNameMin: Cijk_Ailk_Bjlk_HHS_BH_MT64x64x32_MI16x16x16x1_SN_1LDSB1_AMAS3_GRVW8_IU2_LPA0_LPB0_NLCA1_NLCB1_SIA2_SU0_SUS0_SVW2_TT2_32_VW2_WGM8
    SolutionIndex: 120
    SolutionNameMin: Cijk_Ailk_Bjlk_HHS_BH_MT64x64x32_MI16x16x16x1_SN_1LDSB1_AMAS3_GRVW8_IU2_LPA8_LPB0_NLCA1_NLCB1_SIA2_SU0_SUS0_SVW2_TT2_32_VW2_WGM8
    SolutionIndex: 121
    SolutionNameMin: Cijk_Ailk_Bjlk_HHS_BH_MT64x64x32_MI16x16x16x1_SN_1LDSB1_AMAS3_GRVW8_IU2_LPA0_LPB8_NLCA1_NLCB1_SIA2_SU0_SUS0_SVW2_TT2_32_VW2_WGM8
    SolutionIndex: 122
    SolutionNameMin: Cijk_Ailk_Bjlk_HHS_BH_MT64x64x32_MI16x16x16x1_SN_1LDSB1_AMAS3_GRVW8_IU2_LPA8_LPB8_NLCA1_NLCB1_SIA2_SU0_SUS0_SVW2_TT2_32_VW2_WGM8
    SolutionIndex: 123
    SolutionNameMin: Cijk_Ailk_Bjlk_HHS_BH_MT64x64x32_MI16x16x16x1_SN_1LDSB0_AMAS3_GRVW4_IU1_LPA0_LPB0_NLCA1_NLCB1_SIA3_SU0_SUS0_SVW2_TT2_32_VW2_WGM8
    SolutionIndex: 124
    SolutionNameMin: Cijk_Ailk_Bjlk_HHS_BH_MT64x64x32_MI16x16x16x1_SN_1LDSB0_AMAS3_GRVW8_IU1_LPA0_LPB0_NLCA1_NLCB1_SIA3_SU0_SUS0_SVW2_TT2_32_VW2_WGM8
    SolutionIndex: 125
    SolutionNameMin: Cijk_Ailk_Bjlk_HHS_BH_MT64x64x32_MI16x16x16x1_SN_1LDSB0_AMAS3_GRVW8_IU1_LPA8_LPB0_NLCA1_NLCB1_SIA3_SU0_SUS0_SVW2_TT2_32_VW2_WGM8
    SolutionIndex: 126
    SolutionNameMin: Cijk_Ailk_Bjlk_HHS_BH_MT64x64x32_MI16x16x16x1_SN_1LDSB0_AMAS3_GRVW8_IU1_LPA0_LPB8_NLCA1_NLCB1_SIA3_SU0_SUS0_SVW2_TT2_32_VW2_WGM8
    SolutionIndex: 127
    SolutionNameMin: Cijk_Ailk_Bjlk_HHS_BH_MT64x64x32_MI16x16x16x1_SN_1LDSB0_AMAS3_GRVW8_IU1_LPA8_LPB8_NLCA1_NLCB1_SIA3_SU0_SUS0_SVW2_TT2_32_VW2_WGM8
    SolutionIndex: 128
    SolutionNameMin: Cijk_Ailk_Bjlk_HHS_BH_MT64x64x32_MI16x16x16x1_SN_1LDSB0_AMAS3_GRVW8_IU1_LPA0_LPB0_NLCA1_NLCB1_SIA1_SU32_SUS128_SVW2_TT2_32_VW2_WGM8
    SolutionIndex: 129
    SolutionNameMin: Cijk_Ailk_Bjlk_HHS_BH_MT64x64x32_MI16x16x16x1_SN_1LDSB0_AMAS3_GRVW8_IU1_LPA0_LPB0_NLCA1_NLCB1_SIA3_SU32_SUS128_SVW2_TT2_32_VW2_WGM8
    SolutionIndex: 130
    SolutionNameMin: Cijk_Ailk_Bjlk_HHS_BH_MT64x64x32_MI16x16x16x1_SN_1LDSB0_AMAS3_GRVW8_IU1_LPA8_LPB0_NLCA1_NLCB1_SIA3_SU32_SUS128_SVW2_TT2_32_VW2_WGM8
    SolutionIndex: 131
    SolutionNameMin: Cijk_Ailk_Bjlk_HHS_BH_MT64x64x32_MI16x16x16x1_SN_1LDSB0_AMAS3_GRVW4_IU1_LPA0_LPB8_NLCA1_NLCB1_SIA1_SU32_SUS256_SVW2_TT2_32_VW2_WGM8
    SolutionIndex: 132
    SolutionNameMin: Cijk_Ailk_Bjlk_HHS_BH_MT64x64x32_MI16x16x16x1_SN_1LDSB0_AMAS0_GRVW8_IU1_LPA0_LPB8_NLCA1_NLCB1_SIA1_SU32_SUS256_SVW1_TT2_32_VW1_WGM8
    SolutionIndex: 133
    SolutionNameMin: Cijk_Ailk_Bjlk_HHS_BH_MT64x64x32_MI16x16x16x1_SN_1LDSB0_AMAS3_GRVW8_IU1_LPA8_LPB0_NLCA1_NLCB1_SIA1_SU32_SUS256_SVW2_TT2_32_VW2_WGM8
    SolutionIndex: 134
    SolutionNameMin: Cijk_Ailk_Bjlk_HHS_BH_MT64x64x32_MI16x16x16x1_SN_1LDSB0_AMAS3_GRVW8_IU1_LPA0_LPB8_NLCA1_NLCB1_SIA1_SU32_SUS256_SVW2_TT2_32_VW2_WGM8
    SolutionIndex: 135
    SolutionNameMin: Cijk_Ailk_Bjlk_HHS_BH_MT64x64x32_MI16x16x16x1_SN_1LDSB1_AMAS3_GRVW8_IU2_LPA0_LPB8_NLCA1_NLCB1_SIA2_SU32_SUS256_SVW2_TT2_32_VW2_WGM8
    SolutionIndex: 136
    SolutionNameMin: Cijk_Ailk_Bjlk_HHS_BH_MT64x64x32_MI16x16x16x1_SN_1LDSB0_AMAS3_GRVW8_IU1_LPA0_LPB0_NLCA1_NLCB1_SIA3_SU32_SUS256_SVW2_TT2_32_VW2_WGM8
    SolutionIndex: 137
    SolutionNameMin: Cijk_Ailk_Bjlk_HHS_BH_MT64x64x32_MI16x16x16x1_SN_1LDSB0_AMAS3_GRVW8_IU1_LPA8_LPB0_NLCA1_NLCB1_SIA3_SU32_SUS256_SVW2_TT2_32_VW2_WGM8
- - - [64, 64, 1, 64, 96, 96, 96, 96]
    - [65, 0.09]
  - - [64, 64, 1, 128, 96, 96, 160, 160]
    - [79, 0.171]
  - - [64, 64, 1, 256, 96, 96, 288, 288]
    - [82, 0.315]
  - - [64, 64, 1, 512, 96, 96, 544, 544]
    - [64, 0.54]
  - - [64, 64, 1, 1024, 96, 96, 1056, 1056]
    - [80, 0.849]
  - - [64, 64, 1, 2048, 96, 96, 2080, 2080]
    - [80, 1.178]
  - - [64, 64, 1, 4096, 96, 96, 4128, 4128]
    - [80, 1.462]
  - - [64, 128, 1, 64, 96, 96, 96, 128]
    - [82, 0.185]
  - - [64, 128, 1, 128, 96, 96, 160, 160]
    - [63, 0.352]
  - - [64, 128, 1, 256, 96, 96, 288, 288]
    - [87, 0.643]
  - - [64, 128, 1, 512, 96, 96, 544, 544]
    - [74, 1.103]
  - - [64, 128, 1, 1024, 96, 96, 1056, 1056]
    - [63, 1.723]
  - - [64, 128, 1, 2048, 96, 96, 2080, 2080]
    - [80, 2.383]
  - - [64, 128, 1, 4096, 96, 96, 4128, 4128]
    - [63, 2.946]
  - - [64, 256, 1, 64, 96, 96, 96, 256]
    - [70, 0.373]
  - - [64, 256, 1, 128, 96, 96, 160, 256]
    - [81, 0.711]
  - - [64, 256, 1, 256, 96, 96, 288, 288]
    - [62, 1.303]
  - - [64, 256, 1, 512, 96, 96, 544, 544]
    - [71, 2.224]
  - - [64, 256, 1, 1024, 96, 96, 1056, 1056]
    - [78, 3.459]
  - - [64, 256, 1, 2048, 96, 96, 2080, 2080]
    - [63, 4.764]
  - - [64, 256, 1, 4096, 96, 96, 4128, 4128]
    - [63, 5.904]
  - - [64, 512, 1, 64, 96, 96, 96, 512]
    - [86, 0.731]
  - - [64, 512, 1, 128, 96, 96, 160, 512]
    - [85, 1.363]
  - - [64, 512, 1, 256, 96, 96, 288, 512]
    - [63, 2.42]
  - - [64, 512, 1, 512, 96, 96, 544, 544]
    - [63, 3.947]
  - - [64, 512, 1, 1024, 96, 96, 1056, 1056]
    - [80, 5.763]
  - - [64, 512, 1, 2048, 96, 96, 2080, 2080]
    - [80, 7.442]
  - - [64, 512, 1, 4096, 96, 96, 4128, 4128]
    - [63, 8.723]
  - - [64, 1024, 1, 64, 96, 96, 96, 1024]
    - [58, 1.424]
  - - [64, 1024, 1, 128, 96, 96, 160, 1024]
    - [58, 2.582]
  - - [64, 1024, 1, 256, 96, 96, 288, 1024]
    - [60, 4.455]
  - - [64, 1024, 1, 512, 96, 96, 544, 1024]
    - [77, 6.88]
  - - [64, 1024, 1, 1024, 96, 96, 1056, 1056]
    - [58, 9.48]
  - - [64, 1024, 1, 2048, 96, 96, 2080, 2080]
    - [77, 11.697]
  - - [64, 1024, 1, 4096, 96, 96, 4128, 4128]
    - [76, 13.218]
  - - [64, 2048, 1, 64, 96, 96, 96, 2048]
    - [108, 2.679]
  - - [64, 2048, 1, 128, 96, 96, 160, 2048]
    - [103, 4.82]
  - - [64, 2048, 1, 256, 96, 96, 288, 2048]
    - [103, 7.926]
  - - [64, 2048, 1, 512, 96, 96, 544, 2048]
    - [109, 11.843]
  - - [64, 2048, 1, 1024, 96, 96, 1056, 2048]
    - [117, 15.776]
  - - [64, 2048, 1, 2048, 96, 96, 2080, 2080]
    - [90, 18.94]
  - - [64, 2048, 1, 4096, 96, 96, 4128, 4128]
    - [106, 20.187]
  - - [64, 4096, 1, 64, 96, 96, 96, 4096]
    - [3, 5.054]
  - - [64, 4096, 1, 128, 96, 96, 160, 4096]
    - [125, 8.723]
  - - [64, 4096, 1, 256, 96, 96, 288, 4096]
    - [125, 13.653]
  - - [64, 4096, 1, 512, 96, 96, 544, 4096]
    - [127, 18.827]
  - - [64, 4096, 1, 1024, 96, 96, 1056, 4096]
    - [134, 23.453]
  - - [64, 4096, 1, 2048, 96, 96, 2080, 4096]
    - [117, 26.746]
  - - [64, 4096, 1, 4096, 96, 96, 4128, 4128]
    - [101, 27.972]
  - - [128, 64, 1, 64, 160, 160, 128, 96]
    - [64, 0.185]
  - - [128, 64, 1, 128, 160, 160, 160, 160]
    - [83, 0.353]
  - - [128, 64, 1, 256, 160, 160, 288, 288]
    - [82, 0.649]
  - - [128, 64, 1, 512, 160, 160, 544, 544]
    - [63, 1.109]
  - - [128, 64, 1, 1024, 160, 160, 1056, 1056]
    - [63, 1.72]
  - - [128, 64, 1, 2048, 160, 160, 2080, 2080]
    - [80, 2.378]
  - - [128, 64, 1, 4096, 160, 160, 4128, 4128]
    - [63, 2.945]
  - - [128, 128, 1, 64, 160, 160, 128, 128]
    - [70, 0.375]
  - - [128, 128, 1, 128, 160, 160, 160, 160]
    - [63, 0.717]
  - - [128, 128, 1, 256, 160, 160, 288, 288]
    - [82, 1.296]
  - - [128, 128, 1, 512, 160, 160, 544, 544]
    - [64, 2.232]
  - - [128, 128, 1, 1024, 160, 160, 1056, 1056]
    - [80, 3.459]
  - - [128, 128, 1, 2048, 160, 160, 2080, 2080]
    - [63, 4.789]
  - - [128, 128, 1, 4096, 160, 160, 4128, 4128]
    - [80, 5.894]
  - - [128, 256, 1, 64, 160, 160, 128, 256]
    - [67, 0.733]
  - - [128, 256, 1, 128, 160, 160, 160, 256]
    - [59, 1.37]
  - - [128, 256, 1, 256, 160, 160, 288, 288]
    - [63, 2.452]
  - - [128, 256, 1, 512, 160, 160, 544, 544]
    - [78, 3.957]
  - - [128, 256, 1, 1024, 160, 160, 1056, 1056]
    - [63, 5.771]
  - - [128, 256, 1, 2048, 160, 160, 2080, 2080]
    - [80, 7.438]
  - - [128, 256, 1, 4096, 160, 160, 4128, 4128]
    - [63, 8.728]
  - - [128, 512, 1, 64, 160, 160, 128, 512]
    - [60, 1.428]
  - - [128, 512, 1, 128, 160, 160, 160, 512]
    - [68, 2.604]
  - - [128, 512, 1, 256, 160, 160, 288, 512]
    - [76, 4.471]
  - - [128, 512, 1, 512, 160, 160, 544, 544]
    - [77, 6.924]
  - - [128, 512, 1, 1024, 160, 160, 1056, 1056]
    - [60, 9.468]
  - - [128, 512, 1, 2048, 160, 160, 2080, 2080]
    - [58, 11.715]
  - - [128, 512, 1, 4096, 160, 160, 4128, 4128]
    - [72, 13.204]
  - - [128, 1024, 1, 64, 160, 160, 128, 1024]
    - [121, 2.717]
  - - [128, 1024, 1, 128, 160, 160, 160, 1024]
    - [94, 4.847]
  - - [128, 1024, 1, 256, 160, 160, 288, 1024]
    - [115, 8.025]
  - - [128, 1024, 1, 512, 160, 160, 544, 1024]
    - [116, 11.923]
  - - [128, 1024, 1, 1024, 160, 160, 1056, 1056]
    - [118, 15.714]
  - - [128, 1024, 1, 2048, 160, 160, 2080, 2080]
    - [115, 18.632]
  - - [128, 1024, 1, 4096, 160, 160, 4128, 4128]
    - [91, 19.452]
  - - [128, 2048, 1, 64, 160, 160, 128, 2048]
    - [97, 5.069]
  - - [128, 2048, 1, 128, 160, 160, 160, 2048]
    - [99, 8.813]
  - - [128, 2048, 1, 256, 160, 160, 288, 2048]
    - [97, 13.791]
  - - [128, 2048, 1, 512, 160, 160, 544, 2048]
    - [98, 19.312]
  - - [128, 2048, 1, 1024, 160, 160, 1056, 2048]
    - [100, 24.04]
  - - [128, 2048, 1, 2048, 160, 160, 2080, 2080]
    - [129, 26.929]
  - - [128, 2048, 1, 4096, 160, 160, 4128, 4128]
    - [132, 28.109]
  - - [128, 4096, 1, 64, 160, 160, 128, 4096]
    - [93, 9.171]
  - - [128, 4096, 1, 128, 160, 160, 160, 4096]
    - [128, 14.84]
  - - [128, 4096, 1, 256, 160, 160, 288, 4096]
    - [37, 22.214]
  - - [128, 4096, 1, 512, 160, 160, 544, 4096]
    - [14, 29.637]
  - - [128, 4096, 1, 1024, 160, 160, 1056, 4096]
    - [55, 35.642]
  - - [128, 4096, 1, 2048, 160, 160, 2080, 4096]
    - [16, 38.088]
  - - [128, 4096, 1, 4096, 160, 160, 4128, 4128]
    - [32, 41.068]
  - - [256, 64, 1, 64, 288, 288, 256, 96]
    - [88, 0.374]
  - - [256, 64, 1, 128, 288, 288, 256, 160]
    - [89, 0.71]
  - - [256, 64, 1, 256, 288, 288, 288, 288]
    - [74, 1.301]
  - - [256, 64, 1, 512, 288, 288, 544, 544]
    - [78, 2.23]
  - - [256, 64, 1, 1024, 288, 288, 1056, 1056]
    - [65, 3.454]
  - - [256, 64, 1, 2048, 288, 288, 2080, 2080]
    - [80, 4.768]
  - - [256, 64, 1, 4096, 288, 288, 4128, 4128]
    - [63, 5.899]
  - - [256, 128, 1, 64, 288, 288, 256, 128]
    - [73, 0.736]
  - - [256, 128, 1, 128, 288, 288, 256, 160]
    - [66, 1.37]
  - - [256, 128, 1, 256, 288, 288, 288, 288]
    - [61, 2.421]
  - - [256, 128, 1, 512, 288, 288, 544, 544]
    - [61, 3.961]
  - - [256, 128, 1, 1024, 288, 288, 1056, 1056]
    - [80, 5.763]
  - - [256, 128, 1, 2048, 288, 288, 2080, 2080]
    - [78, 7.433]
  - - [256, 128, 1, 4096, 288, 288, 4128, 4128]
    - [78, 8.724]
  - - [256, 256, 1, 64, 288, 288, 256, 256]
    - [63, 1.417]
  - - [256, 256, 1, 128, 288, 288, 256, 256]
    - [84, 2.607]
  - - [256, 256, 1, 256, 288, 288, 288, 288]
    - [60, 4.446]
  - - [256, 256, 1, 512, 288, 288, 544, 544]
    - [60, 6.957]
  - - [256, 256, 1, 1024, 288, 288, 1056, 1056]
    - [69, 9.445]
  - - [256, 256, 1, 2048, 288, 288, 2080, 2080]
    - [69, 11.696]
  - - [256, 256, 1, 4096, 288, 288, 4128, 4128]
    - [69, 13.254]
  - - [256, 512, 1, 64, 288, 288, 256, 512]
    - [2, 2.706]
  - - [256, 512, 1, 128, 288, 288, 256, 512]
    - [125, 4.842]
  - - [256, 512, 1, 256, 288, 288, 288, 512]
    - [118, 8.003]
  - - [256, 512, 1, 512, 288, 288, 544, 544]
    - [115, 11.97]
  - - [256, 512, 1, 1024, 288, 288, 1056, 1056]
    - [115, 15.767]
  - - [256, 512, 1, 2048, 288, 288, 2080, 2080]
    - [110, 18.856]
  - - [256, 512, 1, 4096, 288, 288, 4128, 4128]
    - [110, 20.462]
  - - [256, 1024, 1, 64, 288, 288, 256, 1024]
    - [1, 5.068]
  - - [256, 1024, 1, 128, 288, 288, 256, 1024]
    - [97, 8.793]
  - - [256, 1024, 1, 256, 288, 288, 288, 1024]
    - [136, 13.758]
  - - [256, 1024, 1, 512, 288, 288, 544, 1024]
    - [98, 19.225]
  - - [256, 1024, 1, 1024, 288, 288, 1056, 1056]
    - [124, 24.026]
  - - [256, 1024, 1, 2048, 288, 288, 2080, 2080]
    - [124, 27.407]
  - - [256, 1024, 1, 4096, 288, 288, 4128, 4128]
    - [133, 28.095]
  - - [256, 2048, 1, 64, 288, 288, 256, 2048]
    - [127, 9.142]
  - - [256, 2048, 1, 128, 288, 288, 256, 2048]
    - [115, 14.82]
  - - [256, 2048, 1, 256, 288, 288, 288, 2048]
    - [28, 22.3]
  - - [256, 2048, 1, 512, 288, 288, 544, 2048]
    - [9, 29.725]
  - - [256, 2048, 1, 1024, 288, 288, 1056, 2048]
    - [14, 35.625]
  - - [256, 2048, 1, 2048, 288, 288, 2080, 2080]
    - [6, 38.418]
  - - [256, 2048, 1, 4096, 288, 288, 4128, 4128]
    - [12, 41.075]
  - - [256, 4096, 1, 64, 288, 288, 256, 4096]
    - [97, 14.847]
  - - [256, 4096, 1, 128, 288, 288, 256, 4096]
    - [14, 22.944]
  - - [256, 4096, 1, 256, 288, 288, 288, 4096]
    - [15, 32.754]
  - - [256, 4096, 1, 512, 288, 288, 544, 4096]
    - [49, 41.043]
  - - [256, 4096, 1, 1024, 288, 288, 1056, 4096]
    - [45, 46.624]
  - - [256, 4096, 1, 2048, 288, 288, 2080, 4096]
    - [17, 50.484]
  - - [256, 4096, 1, 4096, 288, 288, 4128, 4128]
    - [36, 53.943]
  - - [384, 64, 1, 64, 416, 416, 384, 96]
    - [89, 0.562]
  - - [384, 64, 1, 128, 416, 416, 384, 160]
    - [62, 1.066]
  - - [384, 64, 1, 256, 416, 416, 384, 288]
    - [63, 1.94]
  - - [384, 64, 1, 512, 416, 416, 544, 544]
    - [61, 3.34]
  - - [384, 64, 1, 1024, 416, 416, 1056, 1056]
    - [78, 5.17]
  - - [384, 64, 1, 2048, 416, 416, 2080, 2080]
    - [63, 7.142]
  - - [384, 64, 1, 4096, 416, 416, 4128, 4128]
    - [63, 8.829]
  - - [384, 128, 1, 64, 416, 416, 384, 128]
    - [68, 1.093]
  - - [384, 128, 1, 128, 416, 416, 384, 160]
    - [60, 2.044]
  - - [384, 128, 1, 256, 416, 416, 384, 288]
    - [77, 3.605]
  - - [384, 128, 1, 512, 416, 416, 544, 544]
    - [63, 5.889]
  - - [384, 128, 1, 1024, 416, 416, 1056, 1056]
    - [80, 8.568]
  - - [384, 128, 1, 2048, 416, 416, 2080, 2080]
    - [80, 11.075]
  - - [384, 128, 1, 4096, 416, 416, 4128, 4128]
    - [63, 12.994]
  - - [384, 256, 1, 64, 416, 416, 384, 256]
    - [118, 2.094]
  - - [384, 256, 1, 128, 416, 416, 384, 256]
    - [92, 3.83]
  - - [384, 256, 1, 256, 416, 416, 384, 288]
    - [122, 6.528]
  - - [384, 256, 1, 512, 416, 416, 544, 544]
    - [119, 10.084]
  - - [384, 256, 1, 1024, 416, 416, 1056, 1056]
    - [121, 13.931]
  - - [384, 256, 1, 2048, 416, 416, 2080, 2080]
    - [96, 17.127]
  - - [384, 256, 1, 4096, 416, 416, 4128, 4128]
    - [122, 19.371]
  - - [384, 512, 1, 64, 416, 416, 384, 512]
    - [93, 3.994]
  - - [384, 512, 1, 128, 416, 416, 384, 512]
    - [115, 7.201]
  - - [384, 512, 1, 256, 416, 416, 384, 512]
    - [92, 11.912]
  - - [384, 512, 1, 512, 416, 416, 544, 544]
    - [118, 17.803]
  - - [384, 512, 1, 1024, 416, 416, 1056, 1056]
    - [116, 23.604]
  - - [384, 512, 1, 2048, 416, 416, 2080, 2080]
    - [117, 28.09]
  - - [384, 512, 1, 4096, 416, 416, 4128, 4128]
    - [131, 29.465]
  - - [384, 1024, 1, 64, 416, 416, 384, 1024]
    - [0, 7.246]
  - - [384, 1024, 1, 128, 416, 416, 384, 1024]
    - [126, 12.059]
  - - [384, 1024, 1, 256, 416, 416, 384, 1024]
    - [125, 18.154]
  - - [384, 1024, 1, 512, 416, 416, 544, 1024]
    - [126, 24.247]
  - - [384, 1024, 1, 1024, 416, 416, 1056, 1056]
    - [124, 29.119]
  - - [384, 1024, 1, 2048, 416, 416, 2080, 2080]
    - [136, 30.861]
  - - [384, 1024, 1, 4096, 416, 416, 4128, 4128]
    - [137, 33.083]
  - - [384, 2048, 1, 64, 416, 416, 384, 2048]
    - [48, 12.334]
  - - [384, 2048, 1, 128, 416, 416, 384, 2048]
    - [38, 20.823]
  - - [384, 2048, 1, 256, 416, 416, 384, 2048]
    - [37, 31.792]
  - - [384, 2048, 1, 512, 416, 416, 544, 2048]
    - [35, 43.073]
  - - [384, 2048, 1, 1024, 416, 416, 1056, 2048]
    - [38, 52.343]
  - - [384, 2048, 1, 2048, 416, 416, 2080, 2080]
    - [11, 56.37]
  - - [384, 2048, 1, 4096, 416, 416, 4128, 4128]
    - [47, 61.016]
  - - [384, 4096, 1, 64, 416, 416, 384, 4096]
    - [10, 19.958]
  - - [384, 4096, 1, 128, 416, 416, 384, 4096]
    - [38, 30.945]
  - - [384, 4096, 1, 256, 416, 416, 384, 4096]
    - [33, 43.361]
  - - [384, 4096, 1, 512, 416, 416, 544, 4096]
    - [50, 54.119]
  - - [384, 4096, 1, 1024, 416, 416, 1056, 4096]
    - [37, 59.084]
  - - [384, 4096, 1, 2048, 416, 416, 2080, 4096]
    - [25, 64.526]
  - - [384, 4096, 1, 4096, 416, 416, 4128, 4128]
    - [48, 67.513]
  - - [768, 64, 1, 64, 800, 800, 768, 96]
    - [85, 1.092]
  - - [768, 64, 1, 128, 800, 800, 768, 160]
    - [75, 2.036]
  - - [768, 64, 1, 256, 800, 800, 768, 288]
    - [71, 3.602]
  - - [768, 64, 1, 512, 800, 800, 768, 544]
    - [61, 5.878]
  - - [768, 64, 1, 1024, 800, 800, 1056, 1056]
    - [80, 8.565]
  - - [768, 64, 1, 2048, 800, 800, 2080, 2080]
    - [61, 11.064]
  - - [768, 64, 1, 4096, 800, 800, 4128, 4128]
    - [80, 12.968]
  - - [768, 128, 1, 64, 800, 800, 768, 128]
    - [102, 2.091]
  - - [768, 128, 1, 128, 800, 800, 768, 160]
    - [95, 3.815]
  - - [768, 128, 1, 256, 800, 800, 768, 288]
    - [120, 6.492]
  - - [768, 128, 1, 512, 800, 800, 768, 544]
    - [119, 10.11]
  - - [768, 128, 1, 1024, 800, 800, 1056, 1056]
    - [119, 13.924]
  - - [768, 128, 1, 2048, 800, 800, 2080, 2080]
    - [120, 17.133]
  - - [768, 128, 1, 4096, 800, 800, 4128, 4128]
    - [120, 19.359]
  - - [768, 256, 1, 64, 800, 800, 768, 256]
    - [2, 4.003]
  - - [768, 256, 1, 128, 800, 800, 768, 256]
    - [94, 7.186]
  - - [768, 256, 1, 256, 800, 800, 768, 288]
    - [92, 11.954]
  - - [768, 256, 1, 512, 800, 800, 768, 544]
    - [93, 17.851]
  - - [768, 256, 1, 1024, 800, 800, 1056, 1056]
    - [116, 23.582]
  - - [768, 256, 1, 2048, 800, 800, 2080, 2080]
    - [94, 28.023]
  - - [768, 256, 1, 4096, 800, 800, 4128, 4128]
    - [107, 29.834]
  - - [768, 512, 1, 64, 800, 800, 768, 512]
    - [116, 7.228]
  - - [768, 512, 1, 128, 800, 800, 768, 512]
    - [127, 12.051]
  - - [768, 512, 1, 256, 800, 800, 768, 512]
    - [123, 18.08]
  - - [768, 512, 1, 512, 800, 800, 768, 544]
    - [98, 24.237]
  - - [768, 512, 1, 1024, 800, 800, 1056, 1056]
    - [136, 29.13]
  - - [768, 512, 1, 2048, 800, 800, 2080, 2080]
    - [129, 30.868]
  - - [768, 512, 1, 4096, 800, 800, 4128, 4128]
    - [104, 33.28]
  - - [768, 1024, 1, 64, 800, 800, 768, 1024]
    - [22, 12.386]
  - - [768, 1024, 1, 128, 800, 800, 768, 1024]
    - [15, 20.89]
  - - [768, 1024, 1, 256, 800, 800, 768, 1024]
    - [48, 31.773]
  - - [768, 1024, 1, 512, 800, 800, 768, 1024]
    - [15, 43.084]
  - - [768, 1024, 1, 1024, 800, 800, 1056, 1056]
    - [37, 52.36]
  - - [768, 1024, 1, 2048, 800, 800, 2080, 2080]
    - [31, 56.387]
  - - [768, 1024, 1, 4096, 800, 800, 4128, 4128]
    - [33, 61.002]
  - - [768, 2048, 1, 64, 800, 800, 768, 2048]
    - [7, 19.903]
  - - [768, 2048, 1, 128, 800, 800, 768, 2048]
    - [17, 30.937]
  - - [768, 2048, 1, 256, 800, 800, 768, 2048]
    - [35, 43.135]
  - - [768, 2048, 1, 512, 800, 800, 768, 2048]
    - [37, 54.008]
  - - [768, 2048, 1, 1024, 800, 800, 1056, 2048]
    - [38, 59.268]
  - - [768, 2048, 1, 2048, 800, 800, 2080, 2080]
    - [14, 64.811]
  - - [768, 2048, 1, 4096, 800, 800, 4128, 4128]
    - [37, 68.223]
  - - [768, 4096, 1, 64, 800, 800, 768, 4096]
    - [4, 30.004]
  - - [768, 4096, 1, 128, 800, 800, 768, 4096]
    - [30, 44.278]
  - - [768, 4096, 1, 256, 800, 800, 768, 4096]
    - [27, 56.606]
  - - [768, 4096, 1, 512, 800, 800, 768, 4096]
    - [51, 62.763]
  - - [768, 4096, 1, 1024, 800, 800, 1056, 4096]
    - [41, 69.23]
  - - [768, 4096, 1, 2048, 800, 800, 2080, 4096]
    - [46, 73.838]
  - - [768, 4096, 1, 4096, 800, 800, 4128, 4128]
    - [19, 76.496]
  - - [1536, 64, 1, 64, 1568, 1568, 1536, 96]
    - [94, 2.083]
  - - [1536, 64, 1, 128, 1568, 1568, 1536, 160]
    - [119, 3.808]
  - - [1536, 64, 1, 256, 1568, 1568, 1536, 288]
    - [135, 6.498]
  - - [1536, 64, 1, 512, 1568, 1568, 1536, 544]
    - [95, 10.112]
  - - [1536, 64, 1, 1024, 1568, 1568, 1536, 1056]
    - [119, 13.924]
  - - [1536, 64, 1, 2048, 1568, 1568, 2080, 2080]
    - [95, 17.117]
  - - [1536, 64, 1, 4096, 1568, 1568, 4128, 4128]
    - [120, 19.343]
  - - [1536, 128, 1, 64, 1568, 1568, 1536, 128]
    - [93, 4.029]
  - - [1536, 128, 1, 128, 1568, 1568, 1536, 160]
    - [118, 7.226]
  - - [1536, 128, 1, 256, 1568, 1568, 1536, 288]
    - [92, 11.98]
  - - [1536, 128, 1, 512, 1568, 1568, 1536, 544]
    - [92, 17.888]
  - - [1536, 128, 1, 1024, 1568, 1568, 1536, 1056]
    - [93, 23.666]
  - - [1536, 128, 1, 2048, 1568, 1568, 2080, 2080]
    - [114, 28.197]
  - - [1536, 128, 1, 4096, 1568, 1568, 4128, 4128]
    - [92, 29.901]
  - - [1536, 256, 1, 64, 1568, 1568, 1536, 256]
    - [130, 7.195]
  - - [1536, 256, 1, 128, 1568, 1568, 1536, 256]
    - [116, 12.036]
  - - [1536, 256, 1, 256, 1568, 1568, 1536, 288]
    - [97, 18.052]
  - - [1536, 256, 1, 512, 1568, 1568, 1536, 544]
    - [125, 24.131]
  - - [1536, 256, 1, 1024, 1568, 1568, 1536, 1056]
    - [98, 28.915]
  - - [1536, 256, 1, 2048, 1568, 1568, 2080, 2080]
    - [111, 30.709]
  - - [1536, 256, 1, 4096, 1568, 1568, 4128, 4128]
    - [105, 33.203]
  - - [1536, 512, 1, 64, 1568, 1568, 1536, 512]
    - [37, 12.229]
  - - [1536, 512, 1, 128, 1568, 1568, 1536, 512]
    - [20, 20.697]
  - - [1536, 512, 1, 256, 1568, 1568, 1536, 512]
    - [35, 31.654]
  - - [1536, 512, 1, 512, 1568, 1568, 1536, 544]
    - [15, 42.865]
  - - [1536, 512, 1, 1024, 1568, 1568, 1536, 1056]
    - [37, 52.251]
  - - [1536, 512, 1, 2048, 1568, 1568, 2080, 2080]
    - [31, 56.262]
  - - [1536, 512, 1, 4096, 1568, 1568, 4128, 4128]
    - [11, 60.993]
  - - [1536, 1024, 1, 64, 1568, 1568, 1536, 1024]
    - [44, 19.714]
  - - [1536, 1024, 1, 128, 1568, 1568, 1536, 1024]
    - [14, 30.808]
  - - [1536, 1024, 1, 256, 1568, 1568, 1536, 1024]
    - [14, 43.138]
  - - [1536, 1024, 1, 512, 1568, 1568, 1536, 1024]
    - [49, 54.209]
  - - [1536, 1024, 1, 1024, 1568, 1568, 1536, 1056]
    - [22, 59.192]
  - - [1536, 1024, 1, 2048, 1568, 1568, 2080, 2080]
    - [49, 64.685]
  - - [1536, 1024, 1, 4096, 1568, 1568, 4128, 4128]
    - [38, 68.002]
  - - [1536, 2048, 1, 64, 1568, 1568, 1536, 2048]
    - [26, 29.676]
  - - [1536, 2048, 1, 128, 1568, 1568, 1536, 2048]
    - [27, 44.138]
  - - [1536, 2048, 1, 256, 1568, 1568, 1536, 2048]
    - [30, 56.611]
  - - [1536, 2048, 1, 512, 1568, 1568, 1536, 2048]
    - [42, 62.681]
  - - [1536, 2048, 1, 1024, 1568, 1568, 1536, 2048]
    - [53, 69.267]
  - - [1536, 2048, 1, 2048, 1568, 1568, 2080, 2080]
    - [32, 73.927]
  - - [1536, 2048, 1, 4096, 1568, 1568, 4128, 4128]
    - [34, 76.552]
  - - [1536, 4096, 1, 64, 1568, 1568, 1536, 4096]
    - [39, 40.522]
  - - [1536, 4096, 1, 128, 1568, 1568, 1536, 4096]
    - [5, 56.244]
  - - [1536, 4096, 1, 256, 1568, 1568, 1536, 4096]
    - [8, 65.685]
  - - [1536, 4096, 1, 512, 1568, 1568, 1536, 4096]
    - [9, 74.726]
  - - [1536, 4096, 1, 1024, 1568, 1568, 1536, 4096]
    - [10, 80.085]
  - - [1536, 4096, 1, 2048, 1568, 1568, 2080, 4096]
    - [10, 83.109]
  - - [1536, 4096, 1, 4096, 1568, 1568, 4128, 4128]
    - [57, 83.905]
  - - [3072, 64, 1, 64, 3104, 3104, 3072, 96]
    - [115, 3.996]
  - - [3072, 64, 1, 128, 3104, 3104, 3072, 160]
    - [116, 7.163]
  - - [3072, 64, 1, 256, 3104, 3104, 3072, 288]
    - [110, 11.777]
  - - [3072, 64, 1, 512, 3104, 3104, 3072, 544]
    - [117, 17.6]
  - - [3072, 64, 1, 1024, 3104, 3104, 3072, 1056]
    - [116, 23.283]
  - - [3072, 64, 1, 2048, 3104, 3104, 3072, 2080]
    - [113, 27.859]
  - - [3072, 64, 1, 4096, 3104, 3104, 4128, 4128]
    - [114, 29.877]
  - - [3072, 128, 1, 64, 3104, 3104, 3072, 128]
    - [107, 7.21]
  - - [3072, 128, 1, 128, 3104, 3104, 3072, 160]
    - [124, 12.035]
  - - [3072, 128, 1, 256, 3104, 3104, 3072, 288]
    - [98, 18.032]
  - - [3072, 128, 1, 512, 3104, 3104, 3072, 544]
    - [100, 24.029]
  - - [3072, 128, 1, 1024, 3104, 3104, 3072, 1056]
    - [127, 28.76]
  - - [3072, 128, 1, 2048, 3104, 3104, 3072, 2080]
    - [127, 30.582]
  - - [3072, 128, 1, 4096, 3104, 3104, 4128, 4128]
    - [112, 33.071]
  - - [3072, 256, 1, 64, 3104, 3104, 3072, 256]
    - [36, 12.324]
  - - [3072, 256, 1, 128, 3104, 3104, 3072, 256]
    - [36, 20.708]
  - - [3072, 256, 1, 256, 3104, 3104, 3072, 288]
    - [38, 31.632]
  - - [3072, 256, 1, 512, 3104, 3104, 3072, 544]
    - [15, 42.991]
  - - [3072, 256, 1, 1024, 3104, 3104, 3072, 1056]
    - [14, 52.272]
  - - [3072, 256, 1, 2048, 3104, 3104, 3072, 2080]
    - [11, 56.301]
  - - [3072, 256, 1, 4096, 3104, 3104, 4128, 4128]
    - [13, 61.017]
  - - [3072, 512, 1, 64, 3104, 3104, 3072, 512]
    - [15, 19.647]
  - - [3072, 512, 1, 128, 3104, 3104, 3072, 512]
    - [36, 30.699]
  - - [3072, 512, 1, 256, 3104, 3104, 3072, 512]
    - [57, 43.118]
  - - [3072, 512, 1, 512, 3104, 3104, 3072, 544]
    - [22, 54.05]
  - - [3072, 512, 1, 1024, 3104, 3104, 3072, 1056]
    - [21, 59.245]
  - - [3072, 512, 1, 2048, 3104, 3104, 3072, 2080]
    - [23, 64.504]
  - - [3072, 512, 1, 4096, 3104, 3104, 4128, 4128]
    - [50, 67.654]
  - - [3072, 1024, 1, 64, 3104, 3104, 3072, 1024]
    - [6, 29.716]
  - - [3072, 1024, 1, 128, 3104, 3104, 3072, 1024]
    - [7, 44.218]
  - - [3072, 1024, 1, 256, 3104, 3104, 3072, 1024]
    - [42, 56.748]
  - - [3072, 1024, 1, 512, 3104, 3104, 3072, 1024]
    - [51, 63.045]
  - - [3072, 1024, 1, 1024, 3104, 3104, 3072, 1056]
    - [52, 69.656]
  - - [3072, 1024, 1, 2048, 3104, 3104, 3072, 2080]
    - [54, 73.88]
  - - [3072, 1024, 1, 4096, 3104, 3104, 4128, 4128]
    - [33, 76.491]
  - - [3072, 2048, 1, 64, 3104, 3104, 3072, 2048]
    - [18, 40.534]
  - - [3072, 2048, 1, 128, 3104, 3104, 3072, 2048]
    - [42, 56.239]
  - - [3072, 2048, 1, 256, 3104, 3104, 3072, 2048]
    - [28, 65.644]
  - - [3072, 2048, 1, 512, 3104, 3104, 3072, 2048]
    - [29, 74.691]
  - - [3072, 2048, 1, 1024, 3104, 3104, 3072, 2048]
    - [42, 79.975]
  - - [3072, 2048, 1, 2048, 3104, 3104, 3072, 2080]
    - [10, 82.969]
  - - [3072, 2048, 1, 4096, 3104, 3104, 4128, 4128]
    - [9, 84.093]
  - - [3072, 4096, 1, 64, 3104, 3104, 3072, 4096]
    - [40, 49.166]
  - - [3072, 4096, 1, 128, 3104, 3104, 3072, 4096]
    - [28, 61.807]
  - - [3072, 4096, 1, 256, 3104, 3104, 3072, 4096]
    - [30, 72.915]
  - - [3072, 4096, 1, 512, 3104, 3104, 3072, 4096]
    - [8, 80.129]
  - - [3072, 4096, 1, 1024, 3104, 3104, 3072, 4096]
    - [43, 83.878]
  - - [3072, 4096, 1, 2048, 3104, 3104, 3072, 4096]
    - [56, 85.105]
  - - [3072, 4096, 1, 4096, 3104, 3104, 4128, 4128]
    - [24, 86.965]
- null
- null
- DeviceEfficiency
