library/src/blas3/Tensile/Logic/asm_full/navi32/navi32_Cijk_Ailk_Bjlk_BBS_BH_GB.yaml
- {MinimumRequiredVersion: 4.35.0}
- navi32
- gfx1101
- [Device 73f0]
    SolutionIndex: 0
    SolutionNameMin: Cijk_Ailk_Bjlk_BBS_BH_MT32x32x16_MI16x16x16x1_SN_1LDSB0_AMAS0_GRVW8_IU1_LPA0_LPB0_NLCA1_NLCB1_SIA1_SU0_SUS0_SVW1_TT1_16_VW1_WGM4
    SolutionIndex: 1
    SolutionNameMin: Cijk_Ailk_Bjlk_BBS_BH_MT32x32x16_MI16x16x16x1_SN_1LDSB0_AMAS0_GRVW8_IU1_LPA8_LPB0_NLCA1_NLCB1_SIA1_SU0_SUS0_SVW1_TT1_16_VW1_WGM4
    SolutionIndex: 2
    SolutionNameMin: Cijk_Ailk_Bjlk_BBS_BH_MT64x64x16_MI16x16x16x1_SN_1LDSB0_AMAS3_GRVW8_IU1_LPA0_LPB8_NLCA1_NLCB1_SIA1_SU0_SUS0_SVW2_TT2_32_VW2_WGM4
    SolutionIndex: 3
    SolutionNameMin: Cijk_Ailk_Bjlk_BBS_BH_MT64x64x16_MI16x16x16x1_SN_1LDSB0_AMAS3_GRVW8_IU1_LPA8_LPB8_NLCA1_NLCB1_SIA1_SU0_SUS0_SVW2_TT2_32_VW2_WGM4
    SolutionIndex: 4
    SolutionNameMin: Cijk_Ailk_Bjlk_BBS_BH_MT64x64x16_MI16x16x16x1_SN_1LDSB1_AMAS3_GRVW4_IU1_LPA0_LPB8_NLCA1_NLCB1_SIA2_SU0_SUS0_SVW2_TT2_32_VW2_WGM4
    SolutionIndex: 5
    SolutionNameMin: Cijk_Ailk_Bjlk_BBS_BH_MT64x64x16_MI16x16x16x1_SN_1LDSB1_AMAS3_GRVW8_IU1_LPA0_LPB0_NLCA1_NLCB1_SIA2_SU0_SUS0_SVW2_TT2_32_VW2_WGM4
    SolutionIndex: 6
    SolutionNameMin: Cijk_Ailk_Bjlk_BBS_BH_MT64x64x16_MI16x16x16x1_SN_1LDSB1_AMAS3_GRVW8_IU1_LPA8_LPB0_NLCA1_NLCB1_SIA2_SU0_SUS0_SVW2_TT2_32_VW2_WGM4
    SolutionIndex: 7
    SolutionNameMin: Cijk_Ailk_Bjlk_BBS_BH_MT64x64x16_MI16x16x16x1_SN_1LDSB1_AMAS3_GRVW8_IU1_LPA0_LPB8_NLCA1_NLCB1_SIA2_SU0_SUS0_SVW2_TT2_32_VW2_WGM4
    SolutionIndex: 8
    SolutionNameMin: Cijk_Ailk_Bjlk_BBS_BH_MT64x64x16_MI16x16x16x1_SN_1LDSB1_AMAS3_GRVW8_IU1_LPA8_LPB8_NLCA1_NLCB1_SIA2_SU0_SUS0_SVW2_TT2_32_VW2_WGM4
    SolutionIndex: 9
    SolutionNameMin: Cijk_Ailk_Bjlk_BBS_BH_MT64x64x16_MI16x16x16x1_SN_1LDSB1_AMAS3_GRVW8_IU1_LPA0_LPB0_NLCA1_NLCB1_SIA2_SU0_SUS0_SVW2_TT2_32_VW2_WGM8
    SolutionIndex: 10
    SolutionNameMin: Cijk_Ailk_Bjlk_BBS_BH_MT64x64x16_MI16x16x16x1_SN_1LDSB1_AMAS3_GRVW8_IU1_LPA0_LPB8_NLCA1_NLCB1_SIA2_SU0_SUS0_SVW2_TT2_32_VW2_WGM8
    SolutionIndex: 11
    SolutionNameMin: Cijk_Ailk_Bjlk_BBS_BH_MT64x64x16_MI16x16x16x1_SN_1LDSB1_AMAS3_GRVW8_IU1_LPA8_LPB8_NLCA1_NLCB1_SIA2_SU0_SUS0_SVW2_TT2_32_VW2_WGM8
    SolutionIndex: 12
    SolutionNameMin: Cijk_Ailk_Bjlk_BBS_BH_MT64x64x16_MI16x16x16x1_SN_1LDSB0_AMAS3_GRVW4_IU1_LPA8_LPB0_NLCA1_NLCB1_SIA1_SU32_SUS128_SVW2_TT2_32_VW2_WGM8
    SolutionIndex: 13
    SolutionNameMin: Cijk_Ailk_Bjlk_BBS_BH_MT64x64x16_MI16x16x16x1_SN_1LDSB1_AMAS3_GRVW8_IU1_LPA0_LPB8_NLCA1_NLCB1_SIA2_SU32_SUS128_SVW2_TT2_32_VW2_WGM8
    SolutionIndex: 14
    SolutionNameMin: Cijk_Ailk_Bjlk_BBS_BH_MT64x64x16_MI16x16x16x1_SN_1LDSB1_AMAS3_GRVW8_IU1_LPA0_LPB0_NLCA1_NLCB1_SIA2_SU32_SUS256_SVW2_TT2_32_VW2_WGM8
    SolutionIndex: 15
    SolutionNameMin: Cijk_Ailk_Bjlk_BBS_BH_MT128x128x16_MI16x16x16x1_SN_1LDSB0_AMAS3_GRVW4_IU1_LPA0_LPB0_NLCA1_NLCB1_SIA1_SU0_SUS0_SVW2_TT4_64_VW2_WGM4
    SolutionIndex: 16
    SolutionNameMin: Cijk_Ailk_Bjlk_BBS_BH_MT128x128x16_MI16x16x16x1_SN_1LDSB0_AMAS3_GRVW4_IU1_LPA0_LPB8_NLCA1_NLCB1_SIA1_SU0_SUS0_SVW2_TT4_64_VW2_WGM4
    SolutionIndex: 17
    SolutionNameMin: Cijk_Ailk_Bjlk_BBS_BH_MT128x128x16_MI16x16x16x1_SN_1LDSB0_AMAS3_GRVW4_IU1_LPA8_LPB8_NLCA1_NLCB1_SIA1_SU0_SUS0_SVW2_TT4_64_VW2_WGM4
    SolutionIndex: 18
    SolutionNameMin: Cijk_Ailk_Bjlk_BBS_BH_MT128x128x16_MI16x16x16x1_SN_1LDSB0_AMAS3_GRVW8_IU1_LPA0_LPB0_NLCA1_NLCB1_SIA1_SU0_SUS0_SVW2_TT4_64_VW2_WGM4
    SolutionIndex: 19
    SolutionNameMin: Cijk_Ailk_Bjlk_BBS_BH_MT128x128x16_MI16x16x16x1_SN_1LDSB0_AMAS3_GRVW8_IU1_LPA8_LPB0_NLCA1_NLCB1_SIA1_SU0_SUS0_SVW2_TT4_64_VW2_WGM4
    SolutionIndex: 20
    SolutionNameMin: Cijk_Ailk_Bjlk_BBS_BH_MT128x128x16_MI16x16x16x1_SN_1LDSB0_AMAS3_GRVW8_IU1_LPA0_LPB8_NLCA1_NLCB1_SIA1_SU0_SUS0_SVW2_TT4_64_VW2_WGM4
    SolutionIndex: 21
    SolutionNameMin: Cijk_Ailk_Bjlk_BBS_BH_MT128x128x16_MI16x16x16x1_SN_1LDSB0_AMAS3_GRVW8_IU1_LPA8_LPB8_NLCA1_NLCB1_SIA1_SU0_SUS0_SVW2_TT4_64_VW2_WGM4
    SolutionIndex: 22
    SolutionNameMin: Cijk_Ailk_Bjlk_BBS_BH_MT128x128x16_MI16x16x16x1_SN_1LDSB1_AMAS0_GRVW4_IU1_LPA8_LPB0_NLCA1_NLCB1_SIA2_SU0_SUS0_SVW1_TT4_64_VW1_WGM4
    SolutionIndex: 23
    SolutionNameMin: Cijk_Ailk_Bjlk_BBS_BH_MT128x128x16_MI16x16x16x1_SN_1LDSB1_AMAS0_GRVW4_IU1_LPA0_LPB8_NLCA1_NLCB1_SIA2_SU0_SUS0_SVW1_TT4_64_VW1_WGM4
    SolutionIndex: 24
    SolutionNameMin: Cijk_Ailk_Bjlk_BBS_BH_MT128x128x16_MI16x16x16x1_SN_1LDSB1_AMAS3_GRVW4_IU1_LPA0_LPB0_NLCA1_NLCB1_SIA2_SU0_SUS0_SVW2_TT4_64_VW2_WGM4
    SolutionIndex: 25
    SolutionNameMin: Cijk_Ailk_Bjlk_BBS_BH_MT128x128x16_MI16x16x16x1_SN_1LDSB1_AMAS3_GRVW4_IU1_LPA8_LPB0_NLCA1_NLCB1_SIA2_SU0_SUS0_SVW2_TT4_64_VW2_WGM4
    SolutionIndex: 26
    SolutionNameMin: Cijk_Ailk_Bjlk_BBS_BH_MT128x128x16_MI16x16x16x1_SN_1LDSB1_AMAS3_GRVW4_IU1_LPA8_LPB8_NLCA1_NLCB1_SIA2_SU0_SUS0_SVW2_TT4_64_VW2_WGM4
    SolutionIndex: 27
    SolutionNameMin: Cijk_Ailk_Bjlk_BBS_BH_MT128x128x16_MI16x16x16x1_SN_1LDSB1_AMAS0_GRVW8_IU1_LPA8_LPB0_NLCA1_NLCB1_SIA2_SU0_SUS0_SVW1_TT4_64_VW1_WGM4
    SolutionIndex: 28
    SolutionNameMin: Cijk_Ailk_Bjlk_BBS_BH_MT128x128x16_MI16x16x16x1_SN_1LDSB1_AMAS0_GRVW8_IU1_LPA0_LPB8_NLCA1_NLCB1_SIA2_SU0_SUS0_SVW1_TT4_64_VW1_WGM4
    SolutionIndex: 29
    SolutionNameMin: Cijk_Ailk_Bjlk_BBS_BH_MT128x128x16_MI16x16x16x1_SN_1LDSB1_AMAS3_GRVW8_IU1_LPA0_LPB0_NLCA1_NLCB1_SIA2_SU0_SUS0_SVW2_TT4_64_VW2_WGM4
    SolutionIndex: 30
    SolutionNameMin: Cijk_Ailk_Bjlk_BBS_BH_MT128x128x16_MI16x16x16x1_SN_1LDSB1_AMAS3_GRVW8_IU1_LPA8_LPB0_NLCA1_NLCB1_SIA2_SU0_SUS0_SVW2_TT4_64_VW2_WGM4
    SolutionIndex: 31
    SolutionNameMin: Cijk_Ailk_Bjlk_BBS_BH_MT128x128x16_MI16x16x16x1_SN_1LDSB1_AMAS3_GRVW8_IU1_LPA0_LPB8_NLCA1_NLCB1_SIA2_SU0_SUS0_SVW2_TT4_64_VW2_WGM4
    SolutionIndex: 32
    SolutionNameMin: Cijk_Ailk_Bjlk_BBS_BH_MT128x128x16_MI16x16x16x1_SN_1LDSB1_AMAS3_GRVW8_IU1_LPA8_LPB8_NLCA1_NLCB1_SIA2_SU0_SUS0_SVW2_TT4_64_VW2_WGM4
    SolutionIndex: 33
    SolutionNameMin: Cijk_Ailk_Bjlk_BBS_BH_MT128x128x16_MI16x16x16x1_SN_1LDSB1_AMAS0_GRVW4_IU1_LPA0_LPB8_NLCA1_NLCB1_SIA2_SU32_SUS128_SVW1_TT4_64_VW1_WGM4
    SolutionIndex: 34
    SolutionNameMin: Cijk_Ailk_Bjlk_BBS_BH_MT128x128x16_MI16x16x16x1_SN_1LDSB1_AMAS3_GRVW4_IU1_LPA8_LPB8_NLCA1_NLCB1_SIA2_SU32_SUS128_SVW2_TT4_64_VW2_WGM4
    SolutionIndex: 35
    SolutionNameMin: Cijk_Ailk_Bjlk_BBS_BH_MT128x128x16_MI16x16x16x1_SN_1LDSB1_AMAS0_GRVW8_IU1_LPA0_LPB0_NLCA1_NLCB1_SIA2_SU32_SUS128_SVW1_TT4_64_VW1_WGM4
    SolutionIndex: 36
    SolutionNameMin: Cijk_Ailk_Bjlk_BBS_BH_MT128x128x16_MI16x16x16x1_SN_1LDSB1_AMAS3_GRVW8_IU1_LPA0_LPB0_NLCA1_NLCB1_SIA2_SU32_SUS128_SVW2_TT4_64_VW2_WGM4
    SolutionIndex: 37
    SolutionNameMin: Cijk_Ailk_Bjlk_BBS_BH_MT128x128x16_MI16x16x16x1_SN_1LDSB1_AMAS3_GRVW8_IU1_LPA8_LPB0_NLCA1_NLCB1_SIA2_SU32_SUS128_SVW2_TT4_64_VW2_WGM4
    SolutionIndex: 38
    SolutionNameMin: Cijk_Ailk_Bjlk_BBS_BH_MT128x128x16_MI16x16x16x1_SN_1LDSB1_AMAS3_GRVW8_IU1_LPA0_LPB8_NLCA1_NLCB1_SIA2_SU32_SUS256_SVW2_TT4_64_VW2_WGM4
    SolutionIndex: 39
    SolutionNameMin: Cijk_Ailk_Bjlk_BBS_BH_MT128x128x16_MI16x16x16x1_SN_1LDSB1_AMAS3_GRVW8_IU1_LPA8_LPB8_NLCA1_NLCB1_SIA2_SU32_SUS256_SVW2_TT4_64_VW2_WGM4
    SolutionIndex: 40
    SolutionNameMin: Cijk_Ailk_Bjlk_BBS_BH_MT128x128x16_MI16x16x16x1_SN_1LDSB0_AMAS3_GRVW4_IU1_LPA0_LPB0_NLCA1_NLCB1_SIA1_SU0_SUS0_SVW2_TT4_64_VW2_WGM8
    SolutionIndex: 41
    SolutionNameMin: Cijk_Ailk_Bjlk_BBS_BH_MT128x128x16_MI16x16x16x1_SN_1LDSB0_AMAS3_GRVW4_IU1_LPA8_LPB8_NLCA1_NLCB1_SIA1_SU0_SUS0_SVW2_TT4_64_VW2_WGM8
    SolutionIndex: 42
    SolutionNameMin: Cijk_Ailk_Bjlk_BBS_BH_MT128x128x16_MI16x16x16x1_SN_1LDSB0_AMAS3_GRVW8_IU1_LPA0_LPB0_NLCA1_NLCB1_SIA1_SU0_SUS0_SVW2_TT4_64_VW2_WGM8
    SolutionIndex: 43
    SolutionNameMin: Cijk_Ailk_Bjlk_BBS_BH_MT128x128x16_MI16x16x16x1_SN_1LDSB0_AMAS3_GRVW8_IU1_LPA8_LPB0_NLCA1_NLCB1_SIA1_SU0_SUS0_SVW2_TT4_64_VW2_WGM8
    SolutionIndex: 44
    SolutionNameMin: Cijk_Ailk_Bjlk_BBS_BH_MT128x128x16_MI16x16x16x1_SN_1LDSB0_AMAS3_GRVW8_IU1_LPA0_LPB8_NLCA1_NLCB1_SIA1_SU0_SUS0_SVW2_TT4_64_VW2_WGM8
    SolutionIndex: 45
    SolutionNameMin: Cijk_Ailk_Bjlk_BBS_BH_MT128x128x16_MI16x16x16x1_SN_1LDSB1_AMAS0_GRVW4_IU1_LPA0_LPB0_NLCA1_NLCB1_SIA2_SU0_SUS0_SVW1_TT4_64_VW1_WGM8
    SolutionIndex: 46
    SolutionNameMin: Cijk_Ailk_Bjlk_BBS_BH_MT128x128x16_MI16x16x16x1_SN_1LDSB1_AMAS0_GRVW4_IU1_LPA8_LPB0_NLCA1_NLCB1_SIA2_SU0_SUS0_SVW1_TT4_64_VW1_WGM8
    SolutionIndex: 47
    SolutionNameMin: Cijk_Ailk_Bjlk_BBS_BH_MT128x128x16_MI16x16x16x1_SN_1LDSB1_AMAS3_GRVW4_IU1_LPA0_LPB0_NLCA1_NLCB1_SIA2_SU0_SUS0_SVW2_TT4_64_VW2_WGM8
    SolutionIndex: 48
    SolutionNameMin: Cijk_Ailk_Bjlk_BBS_BH_MT128x128x16_MI16x16x16x1_SN_1LDSB1_AMAS3_GRVW4_IU1_LPA8_LPB0_NLCA1_NLCB1_SIA2_SU0_SUS0_SVW2_TT4_64_VW2_WGM8
    SolutionIndex: 49
    SolutionNameMin: Cijk_Ailk_Bjlk_BBS_BH_MT128x128x16_MI16x16x16x1_SN_1LDSB1_AMAS3_GRVW4_IU1_LPA0_LPB8_NLCA1_NLCB1_SIA2_SU0_SUS0_SVW2_TT4_64_VW2_WGM8
    SolutionIndex: 50
    SolutionNameMin: Cijk_Ailk_Bjlk_BBS_BH_MT128x128x16_MI16x16x16x1_SN_1LDSB1_AMAS3_GRVW4_IU1_LPA8_LPB8_NLCA1_NLCB1_SIA2_SU0_SUS0_SVW2_TT4_64_VW2_WGM8
    SolutionIndex: 51
    SolutionNameMin: Cijk_Ailk_Bjlk_BBS_BH_MT128x128x16_MI16x16x16x1_SN_1LDSB1_AMAS3_GRVW8_IU1_LPA0_LPB0_NLCA1_NLCB1_SIA2_SU0_SUS0_SVW2_TT4_64_VW2_WGM8
    SolutionIndex: 52
    SolutionNameMin: Cijk_Ailk_Bjlk_BBS_BH_MT128x128x16_MI16x16x16x1_SN_1LDSB1_AMAS3_GRVW8_IU1_LPA8_LPB0_NLCA1_NLCB1_SIA2_SU0_SUS0_SVW2_TT4_64_VW2_WGM8
    SolutionIndex: 53
    SolutionNameMin: Cijk_Ailk_Bjlk_BBS_BH_MT128x128x16_MI16x16x16x1_SN_1LDSB1_AMAS3_GRVW8_IU1_LPA0_LPB8_NLCA1_NLCB1_SIA2_SU0_SUS0_SVW2_TT4_64_VW2_WGM8
    SolutionIndex: 54
    SolutionNameMin: Cijk_Ailk_Bjlk_BBS_BH_MT128x128x16_MI16x16x16x1_SN_1LDSB1_AMAS3_GRVW8_IU1_LPA8_LPB8_NLCA1_NLCB1_SIA2_SU0_SUS0_SVW2_TT4_64_VW2_WGM8
    SolutionIndex: 55
    SolutionNameMin: Cijk_Ailk_Bjlk_BBS_BH_MT128x128x16_MI16x16x16x1_SN_1LDSB0_AMAS3_GRVW8_IU1_LPA0_LPB0_NLCA1_NLCB1_SIA1_SU32_SUS128_SVW2_TT4_64_VW2_WGM8
    SolutionIndex: 56
    SolutionNameMin: Cijk_Ailk_Bjlk_BBS_BH_MT128x128x16_MI16x16x16x1_SN_1LDSB0_AMAS3_GRVW8_IU1_LPA8_LPB8_NLCA1_NLCB1_SIA1_SU32_SUS128_SVW2_TT4_64_VW2_WGM8
    SolutionIndex: 57
    SolutionNameMin: Cijk_Ailk_Bjlk_BBS_BH_MT128x128x16_MI16x16x16x1_SN_1LDSB1_AMAS3_GRVW4_IU1_LPA0_LPB0_NLCA1_NLCB1_SIA2_SU32_SUS128_SVW2_TT4_64_VW2_WGM8
    SolutionIndex: 58
    SolutionNameMin: Cijk_Ailk_Bjlk_BBS_BH_MT128x128x16_MI16x16x16x1_SN_1LDSB1_AMAS3_GRVW4_IU1_LPA0_LPB8_NLCA1_NLCB1_SIA2_SU32_SUS128_SVW2_TT4_64_VW2_WGM8
    SolutionIndex: 59
    SolutionNameMin: Cijk_Ailk_Bjlk_BBS_BH_MT128x128x16_MI16x16x16x1_SN_1LDSB1_AMAS3_GRVW4_IU1_LPA8_LPB8_NLCA1_NLCB1_SIA2_SU32_SUS128_SVW2_TT4_64_VW2_WGM8
    SolutionIndex: 60
    SolutionNameMin: Cijk_Ailk_Bjlk_BBS_BH_MT128x128x16_MI16x16x16x1_SN_1LDSB1_AMAS3_GRVW8_IU1_LPA0_LPB0_NLCA1_NLCB1_SIA2_SU32_SUS128_SVW2_TT4_64_VW2_WGM8
    SolutionIndex: 61
    SolutionNameMin: Cijk_Ailk_Bjlk_BBS_BH_MT128x128x16_MI16x16x16x1_SN_1LDSB1_AMAS3_GRVW8_IU1_LPA0_LPB8_NLCA1_NLCB1_SIA2_SU32_SUS128_SVW2_TT4_64_VW2_WGM8
    SolutionIndex: 62
    SolutionNameMin: Cijk_Ailk_Bjlk_BBS_BH_MT128x128x16_MI16x16x16x1_SN_1LDSB1_AMAS0_GRVW8_IU1_LPA0_LPB0_NLCA1_NLCB1_SIA2_SU32_SUS256_SVW1_TT4_64_VW1_WGM8
    SolutionIndex: 63
    SolutionNameMin: Cijk_Ailk_Bjlk_BBS_BH_MT128x128x16_MI16x16x16x1_SN_1LDSB1_AMAS3_GRVW8_IU1_LPA0_LPB0_NLCA1_NLCB1_SIA2_SU32_SUS256_SVW2_TT4_64_VW2_WGM8
    SolutionIndex: 64
    SolutionNameMin: Cijk_Ailk_Bjlk_BBS_BH_MT128x128x16_MI16x16x16x1_SN_1LDSB1_AMAS3_GRVW8_IU1_LPA8_LPB0_NLCA1_NLCB1_SIA2_SU32_SUS256_SVW2_TT4_64_VW2_WGM8
    SolutionIndex: 65
    SolutionNameMin: Cijk_Ailk_Bjlk_BBS_BH_MT128x128x16_MI16x16x16x1_SN_1LDSB1_AMAS3_GRVW8_IU1_LPA0_LPB8_NLCA1_NLCB1_SIA2_SU32_SUS256_SVW2_TT4_64_VW2_WGM8
    SolutionIndex: 66
    SolutionNameMin: Cijk_Ailk_Bjlk_BBS_BH_MT128x128x16_MI16x16x16x1_SN_1LDSB1_AMAS3_GRVW8_IU1_LPA8_LPB8_NLCA1_NLCB1_SIA2_SU32_SUS256_SVW2_TT4_64_VW2_WGM8
    SolutionIndex: 67
    SolutionNameMin: Cijk_Ailk_Bjlk_BBS_BH_MT32x32x32_MI16x16x16x1_SN_1LDSB0_AMAS0_GRVW2_IU1_LPA0_LPB0_NLCA1_NLCB1_SIA1_SU0_SUS0_SVW1_TT1_16_VW1_WGM4
    SolutionIndex: 68
    SolutionNameMin: Cijk_Ailk_Bjlk_BBS_BH_MT32x32x32_MI16x16x16x1_SN_1LDSB0_AMAS0_GRVW8_IU1_LPA0_LPB0_NLCA1_NLCB1_SIA1_SU0_SUS0_SVW1_TT1_16_VW1_WGM4
    SolutionIndex: 69
    SolutionNameMin: Cijk_Ailk_Bjlk_BBS_BH_MT32x32x32_MI16x16x16x1_SN_1LDSB0_AMAS0_GRVW8_IU1_LPA8_LPB8_NLCA1_NLCB1_SIA1_SU0_SUS0_SVW1_TT1_16_VW1_WGM4
    SolutionIndex: 70
    SolutionNameMin: Cijk_Ailk_Bjlk_BBS_BH_MT32x32x32_MI16x16x16x1_SN_1LDSB1_AMAS0_GRVW4_IU2_LPA0_LPB0_NLCA1_NLCB1_SIA2_SU0_SUS0_SVW1_TT1_16_VW1_WGM4
    SolutionIndex: 71
    SolutionNameMin: Cijk_Ailk_Bjlk_BBS_BH_MT32x32x32_MI16x16x16x1_SN_1LDSB1_AMAS0_GRVW4_IU2_LPA8_LPB0_NLCA1_NLCB1_SIA2_SU0_SUS0_SVW1_TT1_16_VW1_WGM4
    SolutionIndex: 72
    SolutionNameMin: Cijk_Ailk_Bjlk_BBS_BH_MT32x32x32_MI16x16x16x1_SN_1LDSB1_AMAS0_GRVW4_IU2_LPA0_LPB8_NLCA1_NLCB1_SIA2_SU0_SUS0_SVW1_TT1_16_VW1_WGM4
    SolutionIndex: 73
    SolutionNameMin: Cijk_Ailk_Bjlk_BBS_BH_MT32x32x32_MI16x16x16x1_SN_1LDSB1_AMAS0_GRVW8_IU2_LPA0_LPB0_NLCA1_NLCB1_SIA2_SU0_SUS0_SVW1_TT1_16_VW1_WGM4
    SolutionIndex: 74
    SolutionNameMin: Cijk_Ailk_Bjlk_BBS_BH_MT32x32x32_MI16x16x16x1_SN_1LDSB1_AMAS0_GRVW8_IU2_LPA8_LPB8_NLCA1_NLCB1_SIA2_SU0_SUS0_SVW1_TT1_16_VW1_WGM4
    SolutionIndex: 75
    SolutionNameMin: Cijk_Ailk_Bjlk_BBS_BH_MT32x32x32_MI16x16x16x1_SN_1LDSB0_AMAS0_GRVW4_IU1_LPA0_LPB0_NLCA1_NLCB1_SIA1_SU32_SUS128_SVW1_TT1_16_VW1_WGM4
    SolutionIndex: 76
    SolutionNameMin: Cijk_Ailk_Bjlk_BBS_BH_MT32x32x32_MI16x16x16x1_SN_1LDSB0_AMAS0_GRVW8_IU1_LPA0_LPB0_NLCA1_NLCB1_SIA1_SU32_SUS128_SVW1_TT1_16_VW1_WGM4
    SolutionIndex: 77
    SolutionNameMin: Cijk_Ailk_Bjlk_BBS_BH_MT32x32x32_MI16x16x16x1_SN_1LDSB0_AMAS0_GRVW8_IU1_LPA8_LPB0_NLCA1_NLCB1_SIA1_SU32_SUS128_SVW1_TT1_16_VW1_WGM4
    SolutionIndex: 78
    SolutionNameMin: Cijk_Ailk_Bjlk_BBS_BH_MT32x32x32_MI16x16x16x1_SN_1LDSB1_AMAS0_GRVW4_IU2_LPA0_LPB0_NLCA1_NLCB1_SIA2_SU32_SUS128_SVW1_TT1_16_VW1_WGM4
    SolutionIndex: 79
    SolutionNameMin: Cijk_Ailk_Bjlk_BBS_BH_MT32x32x32_MI16x16x16x1_SN_1LDSB1_AMAS0_GRVW8_IU2_LPA0_LPB0_NLCA1_NLCB1_SIA2_SU32_SUS128_SVW1_TT1_16_VW1_WGM4
    SolutionIndex: 80
    SolutionNameMin: Cijk_Ailk_Bjlk_BBS_BH_MT32x32x32_MI16x16x16x1_SN_1LDSB1_AMAS0_GRVW8_IU2_LPA8_LPB0_NLCA1_NLCB1_SIA2_SU32_SUS128_SVW1_TT1_16_VW1_WGM4
    SolutionIndex: 81
    SolutionNameMin: Cijk_Ailk_Bjlk_BBS_BH_MT32x32x32_MI16x16x16x1_SN_1LDSB0_AMAS0_GRVW2_IU1_LPA0_LPB0_NLCA1_NLCB1_SIA1_SU32_SUS256_SVW1_TT1_16_VW1_WGM4
    SolutionIndex: 82
    SolutionNameMin: Cijk_Ailk_Bjlk_BBS_BH_MT32x32x32_MI16x16x16x1_SN_1LDSB0_AMAS0_GRVW4_IU1_LPA0_LPB0_NLCA1_NLCB1_SIA1_SU32_SUS256_SVW1_TT1_16_VW1_WGM4
    SolutionIndex: 83
    SolutionNameMin: Cijk_Ailk_Bjlk_BBS_BH_MT32x32x32_MI16x16x16x1_SN_1LDSB0_AMAS0_GRVW8_IU1_LPA0_LPB0_NLCA1_NLCB1_SIA1_SU32_SUS256_SVW1_TT1_16_VW1_WGM4
    SolutionIndex: 84
    SolutionNameMin: Cijk_Ailk_Bjlk_BBS_BH_MT32x32x32_MI16x16x16x1_SN_1LDSB0_AMAS0_GRVW8_IU1_LPA8_LPB0_NLCA1_NLCB1_SIA1_SU32_SUS256_SVW1_TT1_16_VW1_WGM4
    SolutionIndex: 85
    SolutionNameMin: Cijk_Ailk_Bjlk_BBS_BH_MT32x32x32_MI16x16x16x1_SN_1LDSB1_AMAS0_GRVW4_IU2_LPA0_LPB0_NLCA1_NLCB1_SIA2_SU32_SUS256_SVW1_TT1_16_VW1_WGM4
    SolutionIndex: 86
    SolutionNameMin: Cijk_Ailk_Bjlk_BBS_BH_MT32x32x32_MI16x16x16x1_SN_1LDSB1_AMAS0_GRVW8_IU2_LPA8_LPB0_NLCA1_NLCB1_SIA2_SU32_SUS256_SVW1_TT1_16_VW1_WGM4
    SolutionIndex: 87
    SolutionNameMin: Cijk_Ailk_Bjlk_BBS_BH_MT32x32x32_MI16x16x16x1_SN_1LDSB1_AMAS0_GRVW8_IU2_LPA0_LPB8_NLCA1_NLCB1_SIA2_SU32_SUS256_SVW1_TT1_16_VW1_WGM4
    SolutionIndex: 88
    SolutionNameMin: Cijk_Ailk_Bjlk_BBS_BH_MT32x32x32_MI16x16x16x1_SN_1LDSB0_AMAS0_GRVW2_IU1_LPA0_LPB0_NLCA1_NLCB1_SIA1_SU0_SUS0_SVW1_TT1_16_VW1_WGM8
    SolutionIndex: 89
    SolutionNameMin: Cijk_Ailk_Bjlk_BBS_BH_MT32x32x32_MI16x16x16x1_SN_1LDSB0_AMAS0_GRVW4_IU1_LPA0_LPB0_NLCA1_NLCB1_SIA1_SU0_SUS0_SVW1_TT1_16_VW1_WGM8
    SolutionIndex: 90
    SolutionNameMin: Cijk_Ailk_Bjlk_BBS_BH_MT32x32x32_MI16x16x16x1_SN_1LDSB0_AMAS0_GRVW4_IU1_LPA0_LPB8_NLCA1_NLCB1_SIA1_SU0_SUS0_SVW1_TT1_16_VW1_WGM8
    SolutionIndex: 91
    SolutionNameMin: Cijk_Ailk_Bjlk_BBS_BH_MT32x32x32_MI16x16x16x1_SN_1LDSB0_AMAS0_GRVW8_IU1_LPA0_LPB0_NLCA1_NLCB1_SIA1_SU0_SUS0_SVW1_TT1_16_VW1_WGM8
    SolutionIndex: 92
    SolutionNameMin: Cijk_Ailk_Bjlk_BBS_BH_MT32x32x32_MI16x16x16x1_SN_1LDSB1_AMAS0_GRVW4_IU2_LPA0_LPB0_NLCA1_NLCB1_SIA2_SU0_SUS0_SVW1_TT1_16_VW1_WGM8
    SolutionIndex: 93
    SolutionNameMin: Cijk_Ailk_Bjlk_BBS_BH_MT32x32x32_MI16x16x16x1_SN_1LDSB1_AMAS0_GRVW8_IU2_LPA0_LPB0_NLCA1_NLCB1_SIA2_SU0_SUS0_SVW1_TT1_16_VW1_WGM8
    SolutionIndex: 94
    SolutionNameMin: Cijk_Ailk_Bjlk_BBS_BH_MT32x32x32_MI16x16x16x1_SN_1LDSB1_AMAS0_GRVW8_IU2_LPA8_LPB0_NLCA1_NLCB1_SIA2_SU0_SUS0_SVW1_TT1_16_VW1_WGM8
    SolutionIndex: 95
    SolutionNameMin: Cijk_Ailk_Bjlk_BBS_BH_MT32x32x32_MI16x16x16x1_SN_1LDSB1_AMAS0_GRVW8_IU2_LPA0_LPB8_NLCA1_NLCB1_SIA2_SU0_SUS0_SVW1_TT1_16_VW1_WGM8
    SolutionIndex: 96
    SolutionNameMin: Cijk_Ailk_Bjlk_BBS_BH_MT32x32x32_MI16x16x16x1_SN_1LDSB1_AMAS0_GRVW8_IU2_LPA8_LPB8_NLCA1_NLCB1_SIA2_SU0_SUS0_SVW1_TT1_16_VW1_WGM8
    SolutionIndex: 97
    SolutionNameMin: Cijk_Ailk_Bjlk_BBS_BH_MT32x32x32_MI16x16x16x1_SN_1LDSB0_AMAS0_GRVW8_IU1_LPA0_LPB0_NLCA1_NLCB1_SIA1_SU32_SUS128_SVW1_TT1_16_VW1_WGM8
    SolutionIndex: 98
    SolutionNameMin: Cijk_Ailk_Bjlk_BBS_BH_MT32x32x32_MI16x16x16x1_SN_1LDSB0_AMAS0_GRVW8_IU1_LPA8_LPB0_NLCA1_NLCB1_SIA1_SU32_SUS128_SVW1_TT1_16_VW1_WGM8
    SolutionIndex: 99
    SolutionNameMin: Cijk_Ailk_Bjlk_BBS_BH_MT32x32x32_MI16x16x16x1_SN_1LDSB1_AMAS0_GRVW4_IU2_LPA0_LPB0_NLCA1_NLCB1_SIA2_SU32_SUS128_SVW1_TT1_16_VW1_WGM8
    SolutionIndex: 100
    SolutionNameMin: Cijk_Ailk_Bjlk_BBS_BH_MT32x32x32_MI16x16x16x1_SN_1LDSB1_AMAS0_GRVW8_IU2_LPA0_LPB8_NLCA1_NLCB1_SIA2_SU32_SUS128_SVW1_TT1_16_VW1_WGM8
    SolutionIndex: 101
    SolutionNameMin: Cijk_Ailk_Bjlk_BBS_BH_MT32x32x32_MI16x16x16x1_SN_1LDSB0_AMAS0_GRVW4_IU1_LPA8_LPB8_NLCA1_NLCB1_SIA1_SU32_SUS256_SVW1_TT1_16_VW1_WGM8
    SolutionIndex: 102
    SolutionNameMin: Cijk_Ailk_Bjlk_BBS_BH_MT32x32x32_MI16x16x16x1_SN_1LDSB0_AMAS0_GRVW8_IU1_LPA0_LPB0_NLCA1_NLCB1_SIA1_SU32_SUS256_SVW1_TT1_16_VW1_WGM8
    SolutionIndex: 103
    SolutionNameMin: Cijk_Ailk_Bjlk_BBS_BH_MT32x32x32_MI16x16x16x1_SN_1LDSB0_AMAS0_GRVW8_IU1_LPA0_LPB8_NLCA1_NLCB1_SIA1_SU32_SUS256_SVW1_TT1_16_VW1_WGM8
    SolutionIndex: 104
    SolutionNameMin: Cijk_Ailk_Bjlk_BBS_BH_MT32x32x32_MI16x16x16x1_SN_1LDSB0_AMAS0_GRVW8_IU1_LPA8_LPB8_NLCA1_NLCB1_SIA1_SU32_SUS256_SVW1_TT1_16_VW1_WGM8
    SolutionIndex: 105
    SolutionNameMin: Cijk_Ailk_Bjlk_BBS_BH_MT32x32x32_MI16x16x16x1_SN_1LDSB1_AMAS0_GRVW4_IU2_LPA8_LPB8_NLCA1_NLCB1_SIA2_SU32_SUS256_SVW1_TT1_16_VW1_WGM8
    SolutionIndex: 106
    SolutionNameMin: Cijk_Ailk_Bjlk_BBS_BH_MT64x64x32_MI16x16x16x1_SN_1LDSB0_AMAS3_GRVW4_IU1_LPA0_LPB8_NLCA1_NLCB1_SIA1_SU0_SUS0_SVW2_TT2_32_VW2_WGM4
    SolutionIndex: 107
    SolutionNameMin: Cijk_Ailk_Bjlk_BBS_BH_MT64x64x32_MI16x16x16x1_SN_1LDSB0_AMAS3_GRVW8_IU1_LPA0_LPB0_NLCA1_NLCB1_SIA1_SU0_SUS0_SVW2_TT2_32_VW2_WGM4
    SolutionIndex: 108
    SolutionNameMin: Cijk_Ailk_Bjlk_BBS_BH_MT64x64x32_MI16x16x16x1_SN_1LDSB0_AMAS3_GRVW8_IU1_LPA8_LPB0_NLCA1_NLCB1_SIA1_SU0_SUS0_SVW2_TT2_32_VW2_WGM4
    SolutionIndex: 109
    SolutionNameMin: Cijk_Ailk_Bjlk_BBS_BH_MT64x64x32_MI16x16x16x1_SN_1LDSB0_AMAS3_GRVW8_IU1_LPA0_LPB8_NLCA1_NLCB1_SIA1_SU0_SUS0_SVW2_TT2_32_VW2_WGM4
    SolutionIndex: 110
    SolutionNameMin: Cijk_Ailk_Bjlk_BBS_BH_MT64x64x32_MI16x16x16x1_SN_1LDSB0_AMAS3_GRVW8_IU1_LPA8_LPB8_NLCA1_NLCB1_SIA1_SU0_SUS0_SVW2_TT2_32_VW2_WGM4
    SolutionIndex: 111
    SolutionNameMin: Cijk_Ailk_Bjlk_BBS_BH_MT64x64x32_MI16x16x16x1_SN_1LDSB1_AMAS3_GRVW8_IU2_LPA0_LPB0_NLCA1_NLCB1_SIA2_SU0_SUS0_SVW2_TT2_32_VW2_WGM4
    SolutionIndex: 112
    SolutionNameMin: Cijk_Ailk_Bjlk_BBS_BH_MT64x64x32_MI16x16x16x1_SN_1LDSB1_AMAS3_GRVW8_IU2_LPA8_LPB0_NLCA1_NLCB1_SIA2_SU0_SUS0_SVW2_TT2_32_VW2_WGM4
    SolutionIndex: 113
    SolutionNameMin: Cijk_Ailk_Bjlk_BBS_BH_MT64x64x32_MI16x16x16x1_SN_1LDSB1_AMAS3_GRVW8_IU2_LPA0_LPB8_NLCA1_NLCB1_SIA2_SU0_SUS0_SVW2_TT2_32_VW2_WGM4
    SolutionIndex: 114
    SolutionNameMin: Cijk_Ailk_Bjlk_BBS_BH_MT64x64x32_MI16x16x16x1_SN_1LDSB1_AMAS3_GRVW8_IU2_LPA8_LPB8_NLCA1_NLCB1_SIA2_SU0_SUS0_SVW2_TT2_32_VW2_WGM4
    SolutionIndex: 115
    SolutionNameMin: Cijk_Ailk_Bjlk_BBS_BH_MT64x64x32_MI16x16x16x1_SN_1LDSB0_AMAS3_GRVW8_IU1_LPA0_LPB0_NLCA1_NLCB1_SIA3_SU0_SUS0_SVW2_TT2_32_VW2_WGM4
    SolutionIndex: 116
    SolutionNameMin: Cijk_Ailk_Bjlk_BBS_BH_MT64x64x32_MI16x16x16x1_SN_1LDSB0_AMAS3_GRVW8_IU1_LPA8_LPB0_NLCA1_NLCB1_SIA3_SU0_SUS0_SVW2_TT2_32_VW2_WGM4
    SolutionIndex: 117
    SolutionNameMin: Cijk_Ailk_Bjlk_BBS_BH_MT64x64x32_MI16x16x16x1_SN_1LDSB0_AMAS3_GRVW8_IU1_LPA0_LPB8_NLCA1_NLCB1_SIA3_SU0_SUS0_SVW2_TT2_32_VW2_WGM4
    SolutionIndex: 118
    SolutionNameMin: Cijk_Ailk_Bjlk_BBS_BH_MT64x64x32_MI16x16x16x1_SN_1LDSB0_AMAS3_GRVW8_IU1_LPA8_LPB8_NLCA1_NLCB1_SIA3_SU0_SUS0_SVW2_TT2_32_VW2_WGM4
    SolutionIndex: 119
    SolutionNameMin: Cijk_Ailk_Bjlk_BBS_BH_MT64x64x32_MI16x16x16x1_SN_1LDSB0_AMAS3_GRVW8_IU1_LPA8_LPB0_NLCA1_NLCB1_SIA1_SU32_SUS128_SVW2_TT2_32_VW2_WGM4
    SolutionIndex: 120
    SolutionNameMin: Cijk_Ailk_Bjlk_BBS_BH_MT64x64x32_MI16x16x16x1_SN_1LDSB1_AMAS3_GRVW8_IU2_LPA8_LPB8_NLCA1_NLCB1_SIA2_SU32_SUS128_SVW2_TT2_32_VW2_WGM4
    SolutionIndex: 121
    SolutionNameMin: Cijk_Ailk_Bjlk_BBS_BH_MT64x64x32_MI16x16x16x1_SN_1LDSB0_AMAS3_GRVW8_IU1_LPA0_LPB0_NLCA1_NLCB1_SIA3_SU32_SUS128_SVW2_TT2_32_VW2_WGM4
    SolutionIndex: 122
    SolutionNameMin: Cijk_Ailk_Bjlk_BBS_BH_MT64x64x32_MI16x16x16x1_SN_1LDSB0_AMAS3_GRVW4_IU1_LPA0_LPB0_NLCA1_NLCB1_SIA1_SU32_SUS256_SVW2_TT2_32_VW2_WGM4
    SolutionIndex: 123
    SolutionNameMin: Cijk_Ailk_Bjlk_BBS_BH_MT64x64x32_MI16x16x16x1_SN_1LDSB0_AMAS3_GRVW8_IU1_LPA8_LPB0_NLCA1_NLCB1_SIA1_SU32_SUS256_SVW2_TT2_32_VW2_WGM4
    SolutionIndex: 124
    SolutionNameMin: Cijk_Ailk_Bjlk_BBS_BH_MT64x64x32_MI16x16x16x1_SN_1LDSB0_AMAS3_GRVW8_IU1_LPA0_LPB8_NLCA1_NLCB1_SIA1_SU32_SUS256_SVW2_TT2_32_VW2_WGM4
    SolutionIndex: 125
    SolutionNameMin: Cijk_Ailk_Bjlk_BBS_BH_MT64x64x32_MI16x16x16x1_SN_1LDSB0_AMAS3_GRVW8_IU1_LPA0_LPB0_NLCA1_NLCB1_SIA3_SU32_SUS256_SVW2_TT2_32_VW2_WGM4
    SolutionIndex: 126
    SolutionNameMin: Cijk_Ailk_Bjlk_BBS_BH_MT64x64x32_MI16x16x16x1_SN_1LDSB0_AMAS3_GRVW8_IU1_LPA0_LPB8_NLCA1_NLCB1_SIA3_SU32_SUS256_SVW2_TT2_32_VW2_WGM4
    SolutionIndex: 127
    SolutionNameMin: Cijk_Ailk_Bjlk_BBS_BH_MT64x64x32_MI16x16x16x1_SN_1LDSB0_AMAS3_GRVW4_IU1_LPA8_LPB0_NLCA1_NLCB1_SIA1_SU0_SUS0_SVW2_TT2_32_VW2_WGM8
    SolutionIndex: 128
    SolutionNameMin: Cijk_Ailk_Bjlk_BBS_BH_MT64x64x32_MI16x16x16x1_SN_1LDSB0_AMAS3_GRVW4_IU1_LPA0_LPB8_NLCA1_NLCB1_SIA1_SU0_SUS0_SVW2_TT2_32_VW2_WGM8
    SolutionIndex: 129
    SolutionNameMin: Cijk_Ailk_Bjlk_BBS_BH_MT64x64x32_MI16x16x16x1_SN_1LDSB0_AMAS3_GRVW8_IU1_LPA0_LPB0_NLCA1_NLCB1_SIA1_SU0_SUS0_SVW2_TT2_32_VW2_WGM8
    SolutionIndex: 130
    SolutionNameMin: Cijk_Ailk_Bjlk_BBS_BH_MT64x64x32_MI16x16x16x1_SN_1LDSB0_AMAS3_GRVW8_IU1_LPA8_LPB0_NLCA1_NLCB1_SIA1_SU0_SUS0_SVW2_TT2_32_VW2_WGM8
    SolutionIndex: 131
    SolutionNameMin: Cijk_Ailk_Bjlk_BBS_BH_MT64x64x32_MI16x16x16x1_SN_1LDSB0_AMAS3_GRVW8_IU1_LPA0_LPB8_NLCA1_NLCB1_SIA1_SU0_SUS0_SVW2_TT2_32_VW2_WGM8
    SolutionIndex: 132
    SolutionNameMin: Cijk_Ailk_Bjlk_BBS_BH_MT64x64x32_MI16x16x16x1_SN_1LDSB0_AMAS3_GRVW8_IU1_LPA8_LPB8_NLCA1_NLCB1_SIA1_SU0_SUS0_SVW2_TT2_32_VW2_WGM8
    SolutionIndex: 133
    SolutionNameMin: Cijk_Ailk_Bjlk_BBS_BH_MT64x64x32_MI16x16x16x1_SN_1LDSB1_AMAS3_GRVW8_IU2_LPA8_LPB0_NLCA1_NLCB1_SIA2_SU0_SUS0_SVW2_TT2_32_VW2_WGM8
    SolutionIndex: 134
    SolutionNameMin: Cijk_Ailk_Bjlk_BBS_BH_MT64x64x32_MI16x16x16x1_SN_1LDSB1_AMAS3_GRVW8_IU2_LPA8_LPB8_NLCA1_NLCB1_SIA2_SU0_SUS0_SVW2_TT2_32_VW2_WGM8
    SolutionIndex: 135
    SolutionNameMin: Cijk_Ailk_Bjlk_BBS_BH_MT64x64x32_MI16x16x16x1_SN_1LDSB0_AMAS3_GRVW8_IU1_LPA0_LPB0_NLCA1_NLCB1_SIA3_SU0_SUS0_SVW2_TT2_32_VW2_WGM8
    SolutionIndex: 136
    SolutionNameMin: Cijk_Ailk_Bjlk_BBS_BH_MT64x64x32_MI16x16x16x1_SN_1LDSB0_AMAS3_GRVW8_IU1_LPA8_LPB0_NLCA1_NLCB1_SIA3_SU0_SUS0_SVW2_TT2_32_VW2_WGM8
    SolutionIndex: 137
    SolutionNameMin: Cijk_Ailk_Bjlk_BBS_BH_MT64x64x32_MI16x16x16x1_SN_1LDSB0_AMAS3_GRVW8_IU1_LPA0_LPB8_NLCA1_NLCB1_SIA3_SU0_SUS0_SVW2_TT2_32_VW2_WGM8
    SolutionIndex: 138
    SolutionNameMin: Cijk_Ailk_Bjlk_BBS_BH_MT64x64x32_MI16x16x16x1_SN_1LDSB0_AMAS3_GRVW8_IU1_LPA8_LPB8_NLCA1_NLCB1_SIA3_SU0_SUS0_SVW2_TT2_32_VW2_WGM8
    SolutionIndex: 139
    SolutionNameMin: Cijk_Ailk_Bjlk_BBS_BH_MT64x64x32_MI16x16x16x1_SN_1LDSB0_AMAS3_GRVW8_IU1_LPA0_LPB0_NLCA1_NLCB1_SIA1_SU32_SUS128_SVW2_TT2_32_VW2_WGM8
    SolutionIndex: 140
    SolutionNameMin: Cijk_Ailk_Bjlk_BBS_BH_MT64x64x32_MI16x16x16x1_SN_1LDSB0_AMAS3_GRVW8_IU1_LPA8_LPB0_NLCA1_NLCB1_SIA1_SU32_SUS128_SVW2_TT2_32_VW2_WGM8
    SolutionIndex: 141
    SolutionNameMin: Cijk_Ailk_Bjlk_BBS_BH_MT64x64x32_MI16x16x16x1_SN_1LDSB0_AMAS3_GRVW8_IU1_LPA8_LPB8_NLCA1_NLCB1_SIA1_SU32_SUS128_SVW2_TT2_32_VW2_WGM8
    SolutionIndex: 142
    SolutionNameMin: Cijk_Ailk_Bjlk_BBS_BH_MT64x64x32_MI16x16x16x1_SN_1LDSB0_AMAS3_GRVW8_IU1_LPA0_LPB8_NLCA1_NLCB1_SIA3_SU32_SUS128_SVW2_TT2_32_VW2_WGM8
    SolutionIndex: 143
    SolutionNameMin: Cijk_Ailk_Bjlk_BBS_BH_MT64x64x32_MI16x16x16x1_SN_1LDSB0_AMAS3_GRVW8_IU1_LPA8_LPB8_NLCA1_NLCB1_SIA3_SU32_SUS128_SVW2_TT2_32_VW2_WGM8
    SolutionIndex: 144
    SolutionNameMin: Cijk_Ailk_Bjlk_BBS_BH_MT64x64x32_MI16x16x16x1_SN_1LDSB0_AMAS3_GRVW4_IU1_LPA0_LPB8_NLCA1_NLCB1_SIA1_SU32_SUS256_SVW2_TT2_32_VW2_WGM8
    SolutionIndex: 145
    SolutionNameMin: Cijk_Ailk_Bjlk_BBS_BH_MT64x64x32_MI16x16x16x1_SN_1LDSB0_AMAS3_GRVW8_IU1_LPA0_LPB0_NLCA1_NLCB1_SIA1_SU32_SUS256_SVW2_TT2_32_VW2_WGM8
    SolutionIndex: 146
    SolutionNameMin: Cijk_Ailk_Bjlk_BBS_BH_MT64x64x32_MI16x16x16x1_SN_1LDSB0_AMAS3_GRVW8_IU1_LPA8_LPB0_NLCA1_NLCB1_SIA1_SU32_SUS256_SVW2_TT2_32_VW2_WGM8
    SolutionIndex: 147
    SolutionNameMin: Cijk_Ailk_Bjlk_BBS_BH_MT64x64x32_MI16x16x16x1_SN_1LDSB0_AMAS3_GRVW8_IU1_LPA0_LPB8_NLCA1_NLCB1_SIA1_SU32_SUS256_SVW2_TT2_32_VW2_WGM8
    SolutionIndex: 148
    SolutionNameMin: Cijk_Ailk_Bjlk_BBS_BH_MT64x64x32_MI16x16x16x1_SN_1LDSB1_AMAS3_GRVW8_IU2_LPA8_LPB8_NLCA1_NLCB1_SIA2_SU32_SUS256_SVW2_TT2_32_VW2_WGM8
    SolutionIndex: 149
    SolutionNameMin: Cijk_Ailk_Bjlk_BBS_BH_MT64x64x32_MI16x16x16x1_SN_1LDSB0_AMAS3_GRVW8_IU1_LPA0_LPB0_NLCA1_NLCB1_SIA3_SU32_SUS256_SVW2_TT2_32_VW2_WGM8
    SolutionIndex: 150
    SolutionNameMin: Cijk_Ailk_Bjlk_BBS_BH_MT64x64x32_MI16x16x16x1_SN_1LDSB0_AMAS3_GRVW8_IU1_LPA8_LPB0_NLCA1_NLCB1_SIA3_SU32_SUS256_SVW2_TT2_32_VW2_WGM8
    SolutionIndex: 151
    SolutionNameMin: Cijk_Ailk_Bjlk_BBS_BH_MT64x64x32_MI16x16x16x1_SN_1LDSB0_AMAS3_GRVW8_IU1_LPA0_LPB8_NLCA1_NLCB1_SIA3_SU32_SUS256_SVW2_TT2_32_VW2_WGM8
- - - [64, 64, 1, 64, 96, 96, 96, 96]
    - [0, 0.086]
  - - [64, 64, 1, 128, 96, 96, 160, 160]
    - [96, 0.163]
  - - [64, 64, 1, 256, 96, 96, 288, 288]
    - [93, 0.306]
  - - [64, 64, 1, 512, 96, 96, 544, 544]
    - [93, 0.52]
  - - [64, 64, 1, 1024, 96, 96, 1056, 1056]
    - [93, 0.823]
  - - [64, 64, 1, 2048, 96, 96, 2080, 2080]
    - [73, 1.151]
  - - [64, 64, 1, 4096, 96, 96, 4128, 4128]
    - [93, 1.44]
  - - [64, 128, 1, 64, 96, 96, 96, 128]
    - [93, 0.177]
  - - [64, 128, 1, 128, 96, 96, 160, 160]
    - [93, 0.335]
  - - [64, 128, 1, 256, 96, 96, 288, 288]
    - [93, 0.619]
  - - [64, 128, 1, 512, 96, 96, 544, 544]
    - [95, 1.06]
  - - [64, 128, 1, 1024, 96, 96, 1056, 1056]
    - [73, 1.673]
  - - [64, 128, 1, 2048, 96, 96, 2080, 2080]
    - [93, 2.325]
  - - [64, 128, 1, 4096, 96, 96, 4128, 4128]
    - [93, 2.898]
  - - [64, 256, 1, 64, 96, 96, 96, 256]
    - [105, 0.352]
  - - [64, 256, 1, 128, 96, 96, 160, 256]
    - [95, 0.674]
  - - [64, 256, 1, 256, 96, 96, 288, 288]
    - [93, 1.243]
  - - [64, 256, 1, 512, 96, 96, 544, 544]
    - [73, 2.132]
  - - [64, 256, 1, 1024, 96, 96, 1056, 1056]
    - [93, 3.36]
  - - [64, 256, 1, 2048, 96, 96, 2080, 2080]
    - [70, 4.661]
  - - [64, 256, 1, 4096, 96, 96, 4128, 4128]
    - [93, 5.807]
  - - [64, 512, 1, 64, 96, 96, 96, 512]
    - [103, 0.693]
  - - [64, 512, 1, 128, 96, 96, 160, 512]
    - [98, 1.301]
  - - [64, 512, 1, 256, 96, 96, 288, 512]
    - [70, 2.308]
  - - [64, 512, 1, 512, 96, 96, 544, 544]
    - [73, 3.811]
  - - [64, 512, 1, 1024, 96, 96, 1056, 1056]
    - [70, 5.592]
  - - [64, 512, 1, 2048, 96, 96, 2080, 2080]
    - [70, 7.273]
  - - [64, 512, 1, 4096, 96, 96, 4128, 4128]
    - [88, 8.57]
  - - [64, 1024, 1, 64, 96, 96, 96, 1024]
    - [83, 1.344]
  - - [64, 1024, 1, 128, 96, 96, 160, 1024]
    - [91, 2.48]
  - - [64, 1024, 1, 256, 96, 96, 288, 1024]
    - [89, 4.228]
  - - [64, 1024, 1, 512, 96, 96, 544, 1024]
    - [91, 6.651]
  - - [64, 1024, 1, 1024, 96, 96, 1056, 1056]
    - [91, 9.182]
  - - [64, 1024, 1, 2048, 96, 96, 2080, 2080]
    - [67, 11.37]
  - - [64, 1024, 1, 4096, 96, 96, 4128, 4128]
    - [102, 12.831]
  - - [64, 2048, 1, 64, 96, 96, 96, 2048]
    - [104, 2.531]
  - - [64, 2048, 1, 128, 96, 96, 160, 2048]
    - [131, 4.508]
  - - [64, 2048, 1, 256, 96, 96, 288, 2048]
    - [131, 7.594]
  - - [64, 2048, 1, 512, 96, 96, 544, 2048]
    - [107, 11.528]
  - - [64, 2048, 1, 1024, 96, 96, 1056, 2048]
    - [108, 15.572]
  - - [64, 2048, 1, 2048, 96, 96, 2080, 2080]
    - [109, 18.865]
  - - [64, 2048, 1, 4096, 96, 96, 4128, 4128]
    - [110, 20.234]
  - - [64, 4096, 1, 64, 96, 96, 96, 4096]
    - [13, 4.719]
  - - [64, 4096, 1, 128, 96, 96, 160, 4096]
    - [134, 8.204]
  - - [64, 4096, 1, 256, 96, 96, 288, 4096]
    - [135, 12.971]
  - - [64, 4096, 1, 512, 96, 96, 544, 4096]
    - [137, 18.226]
  - - [64, 4096, 1, 1024, 96, 96, 1056, 4096]
    - [137, 22.842]
  - - [64, 4096, 1, 2048, 96, 96, 2080, 4096]
    - [138, 26.193]
  - - [64, 4096, 1, 4096, 96, 96, 4128, 4128]
    - [143, 27.578]
  - - [128, 64, 1, 64, 160, 160, 128, 96]
    - [92, 0.176]
  - - [128, 64, 1, 128, 160, 160, 160, 160]
    - [100, 0.334]
  - - [128, 64, 1, 256, 160, 160, 288, 288]
    - [94, 0.616]
  - - [128, 64, 1, 512, 160, 160, 544, 544]
    - [80, 1.061]
  - - [128, 64, 1, 1024, 160, 160, 1056, 1056]
    - [70, 1.668]
  - - [128, 64, 1, 2048, 160, 160, 2080, 2080]
    - [93, 2.321]
  - - [128, 64, 1, 4096, 160, 160, 4128, 4128]
    - [93, 2.899]
  - - [128, 128, 1, 64, 160, 160, 128, 128]
    - [86, 0.353]
  - - [128, 128, 1, 128, 160, 160, 160, 160]
    - [94, 0.68]
  - - [128, 128, 1, 256, 160, 160, 288, 288]
    - [93, 1.248]
  - - [128, 128, 1, 512, 160, 160, 544, 544]
    - [93, 2.141]
  - - [128, 128, 1, 1024, 160, 160, 1056, 1056]
    - [73, 3.362]
  - - [128, 128, 1, 2048, 160, 160, 2080, 2080]
    - [93, 4.678]
  - - [128, 128, 1, 4096, 160, 160, 4128, 4128]
    - [93, 5.817]
  - - [128, 256, 1, 64, 160, 160, 128, 256]
    - [69, 0.698]
  - - [128, 256, 1, 128, 160, 160, 160, 256]
    - [97, 1.303]
  - - [128, 256, 1, 256, 160, 160, 288, 288]
    - [97, 2.33]
  - - [128, 256, 1, 512, 160, 160, 544, 544]
    - [92, 3.804]
  - - [128, 256, 1, 1024, 160, 160, 1056, 1056]
    - [93, 5.601]
  - - [128, 256, 1, 2048, 160, 160, 2080, 2080]
    - [88, 7.305]
  - - [128, 256, 1, 4096, 160, 160, 4128, 4128]
    - [67, 8.669]
  - - [128, 512, 1, 64, 160, 160, 128, 512]
    - [77, 1.334]
  - - [128, 512, 1, 128, 160, 160, 160, 512]
    - [68, 2.491]
  - - [128, 512, 1, 256, 160, 160, 288, 512]
    - [89, 4.287]
  - - [128, 512, 1, 512, 160, 160, 544, 544]
    - [91, 6.654]
  - - [128, 512, 1, 1024, 160, 160, 1056, 1056]
    - [68, 9.196]
  - - [128, 512, 1, 2048, 160, 160, 2080, 2080]
    - [82, 11.371]
  - - [128, 512, 1, 4096, 160, 160, 4128, 4128]
    - [102, 13.059]
  - - [128, 1024, 1, 64, 160, 160, 128, 1024]
    - [84, 2.553]
  - - [128, 1024, 1, 128, 160, 160, 160, 1024]
    - [109, 4.523]
  - - [128, 1024, 1, 256, 160, 160, 288, 1024]
    - [110, 7.582]
  - - [128, 1024, 1, 512, 160, 160, 544, 1024]
    - [144, 11.362]
  - - [128, 1024, 1, 1024, 160, 160, 1056, 1056]
    - [107, 15.223]
  - - [128, 1024, 1, 2048, 160, 160, 2080, 2080]
    - [131, 18.187]
  - - [128, 1024, 1, 4096, 160, 160, 4128, 4128]
    - [128, 19.173]
  - - [128, 2048, 1, 64, 160, 160, 128, 2048]
    - [112, 4.723]
  - - [128, 2048, 1, 128, 160, 160, 160, 2048]
    - [148, 8.189]
  - - [128, 2048, 1, 256, 160, 160, 288, 2048]
    - [136, 13.157]
  - - [128, 2048, 1, 512, 160, 160, 544, 2048]
    - [118, 18.63]
  - - [128, 2048, 1, 1024, 160, 160, 1056, 2048]
    - [136, 23.43]
  - - [128, 2048, 1, 2048, 160, 160, 2080, 2080]
    - [137, 26.395]
  - - [128, 2048, 1, 4096, 160, 160, 4128, 4128]
    - [139, 27.721]
  - - [128, 4096, 1, 64, 160, 160, 128, 4096]
    - [10, 8.497]
  - - [128, 4096, 1, 128, 160, 160, 160, 4096]
    - [135, 14.032]
  - - [128, 4096, 1, 256, 160, 160, 288, 4096]
    - [129, 20.791]
  - - [128, 4096, 1, 512, 160, 160, 544, 4096]
    - [26, 27.657]
  - - [128, 4096, 1, 1024, 160, 160, 1056, 4096]
    - [32, 33.961]
  - - [128, 4096, 1, 2048, 160, 160, 2080, 4096]
    - [26, 36.801]
  - - [128, 4096, 1, 4096, 160, 160, 4128, 4128]
    - [31, 40.003]
  - - [256, 64, 1, 64, 288, 288, 256, 96]
    - [87, 0.356]
  - - [256, 64, 1, 128, 288, 288, 256, 160]
    - [74, 0.67]
  - - [256, 64, 1, 256, 288, 288, 288, 288]
    - [72, 1.245]
  - - [256, 64, 1, 512, 288, 288, 544, 544]
    - [92, 2.119]
  - - [256, 64, 1, 1024, 288, 288, 1056, 1056]
    - [79, 3.326]
  - - [256, 64, 1, 2048, 288, 288, 2080, 2080]
    - [93, 4.668]
  - - [256, 64, 1, 4096, 288, 288, 4128, 4128]
    - [93, 5.812]
  - - [256, 128, 1, 64, 288, 288, 256, 128]
    - [78, 0.696]
  - - [256, 128, 1, 128, 288, 288, 256, 160]
    - [74, 1.31]
  - - [256, 128, 1, 256, 288, 288, 288, 288]
    - [92, 2.33]
  - - [256, 128, 1, 512, 288, 288, 544, 544]
    - [73, 3.798]
  - - [256, 128, 1, 1024, 288, 288, 1056, 1056]
    - [81, 5.59]
  - - [256, 128, 1, 2048, 288, 288, 2080, 2080]
    - [67, 7.307]
  - - [256, 128, 1, 4096, 288, 288, 4128, 4128]
    - [67, 8.672]
  - - [256, 256, 1, 64, 288, 288, 256, 256]
    - [89, 1.347]
  - - [256, 256, 1, 128, 288, 288, 256, 256]
    - [82, 2.479]
  - - [256, 256, 1, 256, 288, 288, 288, 288]
    - [83, 4.281]
  - - [256, 256, 1, 512, 288, 288, 544, 544]
    - [68, 6.726]
  - - [256, 256, 1, 1024, 288, 288, 1056, 1056]
    - [102, 9.209]
  - - [256, 256, 1, 2048, 288, 288, 2080, 2080]
    - [75, 11.364]
  - - [256, 256, 1, 4096, 288, 288, 4128, 4128]
    - [76, 13.116]
  - - [256, 512, 1, 64, 288, 288, 256, 512]
    - [102, 2.549]
  - - [256, 512, 1, 128, 288, 288, 256, 512]
    - [12, 4.525]
  - - [256, 512, 1, 256, 288, 288, 288, 512]
    - [130, 7.589]
  - - [256, 512, 1, 512, 288, 288, 544, 544]
    - [132, 11.442]
  - - [256, 512, 1, 1024, 288, 288, 1056, 1056]
    - [132, 15.288]
  - - [256, 512, 1, 2048, 288, 288, 2080, 2080]
    - [124, 18.605]
  - - [256, 512, 1, 4096, 288, 288, 4128, 4128]
    - [145, 20.291]
  - - [256, 1024, 1, 64, 288, 288, 256, 1024]
    - [133, 4.719]
  - - [256, 1024, 1, 128, 288, 288, 256, 1024]
    - [143, 8.211]
  - - [256, 1024, 1, 256, 288, 288, 288, 1024]
    - [115, 13.152]
  - - [256, 1024, 1, 512, 288, 288, 544, 1024]
    - [118, 18.579]
  - - [256, 1024, 1, 1024, 288, 288, 1056, 1056]
    - [117, 23.37]
  - - [256, 1024, 1, 2048, 288, 288, 2080, 2080]
    - [117, 26.87]
  - - [256, 1024, 1, 4096, 288, 288, 4128, 4128]
    - [150, 27.779]
  - - [256, 2048, 1, 64, 288, 288, 256, 2048]
    - [9, 8.475]
  - - [256, 2048, 1, 128, 288, 288, 256, 2048]
    - [129, 14.039]
  - - [256, 2048, 1, 256, 288, 288, 288, 2048]
    - [106, 20.701]
  - - [256, 2048, 1, 512, 288, 288, 544, 2048]
    - [19, 28.474]
  - - [256, 2048, 1, 1024, 288, 288, 1056, 2048]
    - [40, 35.273]
  - - [256, 2048, 1, 2048, 288, 288, 2080, 2080]
    - [41, 38.595]
  - - [256, 2048, 1, 4096, 288, 288, 4128, 4128]
    - [17, 42.082]
  - - [256, 4096, 1, 64, 288, 288, 256, 4096]
    - [6, 13.737]
  - - [256, 4096, 1, 128, 288, 288, 256, 4096]
    - [135, 21.58]
  - - [256, 4096, 1, 256, 288, 288, 288, 4096]
    - [29, 30.701]
  - - [256, 4096, 1, 512, 288, 288, 544, 4096]
    - [27, 40.618]
  - - [256, 4096, 1, 1024, 288, 288, 1056, 4096]
    - [59, 46.08]
  - - [256, 4096, 1, 2048, 288, 288, 2080, 4096]
    - [51, 52.81]
  - - [256, 4096, 1, 4096, 288, 288, 4128, 4128]
    - [28, 56.658]
  - - [384, 64, 1, 64, 416, 416, 384, 96]
    - [87, 0.528]
  - - [384, 64, 1, 128, 416, 416, 384, 160]
    - [71, 1.016]
  - - [384, 64, 1, 256, 416, 416, 384, 288]
    - [92, 1.869]
  - - [384, 64, 1, 512, 416, 416, 544, 544]
    - [94, 3.205]
  - - [384, 64, 1, 1024, 416, 416, 1056, 1056]
    - [73, 5.018]
  - - [384, 64, 1, 2048, 416, 416, 2080, 2080]
    - [73, 6.989]
  - - [384, 64, 1, 4096, 416, 416, 4128, 4128]
    - [73, 8.707]
  - - [384, 128, 1, 64, 416, 416, 384, 128]
    - [90, 1.037]
  - - [384, 128, 1, 128, 416, 416, 384, 160]
    - [68, 1.948]
  - - [384, 128, 1, 256, 416, 416, 384, 288]
    - [89, 3.461]
  - - [384, 128, 1, 512, 416, 416, 544, 544]
    - [99, 5.657]
  - - [384, 128, 1, 1024, 416, 416, 1056, 1056]
    - [70, 8.318]
  - - [384, 128, 1, 2048, 416, 416, 2080, 2080]
    - [67, 10.832]
  - - [384, 128, 1, 4096, 416, 416, 4128, 4128]
    - [88, 12.791]
  - - [384, 256, 1, 64, 416, 416, 384, 256]
    - [89, 1.96]
  - - [384, 256, 1, 128, 416, 416, 384, 256]
    - [113, 3.604]
  - - [384, 256, 1, 256, 416, 416, 384, 288]
    - [114, 6.172]
  - - [384, 256, 1, 512, 416, 416, 544, 544]
    - [133, 9.679]
  - - [384, 256, 1, 1024, 416, 416, 1056, 1056]
    - [114, 13.52]
  - - [384, 256, 1, 2048, 416, 416, 2080, 2080]
    - [113, 16.784]
  - - [384, 256, 1, 4096, 416, 416, 4128, 4128]
    - [113, 18.994]
  - - [384, 512, 1, 64, 416, 416, 384, 512]
    - [3, 3.774]
  - - [384, 512, 1, 128, 416, 416, 384, 512]
    - [141, 6.713]
  - - [384, 512, 1, 256, 416, 416, 384, 512]
    - [110, 11.313]
  - - [384, 512, 1, 512, 416, 416, 544, 544]
    - [131, 16.994]
  - - [384, 512, 1, 1024, 416, 416, 1056, 1056]
    - [130, 22.732]
  - - [384, 512, 1, 2048, 416, 416, 2080, 2080]
    - [130, 27.249]
  - - [384, 512, 1, 4096, 416, 416, 4128, 4128]
    - [146, 29.086]
  - - [384, 1024, 1, 64, 416, 416, 384, 1024]
    - [8, 6.699]
  - - [384, 1024, 1, 128, 416, 416, 384, 1024]
    - [135, 11.356]
  - - [384, 1024, 1, 256, 416, 416, 384, 1024]
    - [137, 17.363]
  - - [384, 1024, 1, 512, 416, 416, 544, 1024]
    - [135, 23.496]
  - - [384, 1024, 1, 1024, 416, 416, 1056, 1056]
    - [135, 28.453]
  - - [384, 1024, 1, 2048, 416, 416, 2080, 2080]
    - [151, 30.363]
  - - [384, 1024, 1, 4096, 416, 416, 4128, 4128]
    - [151, 32.742]
  - - [384, 2048, 1, 64, 416, 416, 384, 2048]
    - [2, 11.268]
  - - [384, 2048, 1, 128, 416, 416, 384, 2048]
    - [53, 19.111]
  - - [384, 2048, 1, 256, 416, 416, 384, 2048]
    - [58, 29.641]
  - - [384, 2048, 1, 512, 416, 416, 544, 2048]
    - [32, 40.718]
  - - [384, 2048, 1, 1024, 416, 416, 1056, 2048]
    - [47, 50.153]
  - - [384, 2048, 1, 2048, 416, 416, 2080, 2080]
    - [25, 54.629]
  - - [384, 2048, 1, 4096, 416, 416, 4128, 4128]
    - [24, 59.485]
  - - [384, 4096, 1, 64, 416, 416, 384, 4096]
    - [10, 17.844]
  - - [384, 4096, 1, 128, 416, 416, 384, 4096]
    - [49, 26.85]
  - - [384, 4096, 1, 256, 416, 416, 384, 4096]
    - [54, 38.873]
  - - [384, 4096, 1, 512, 416, 416, 544, 4096]
    - [52, 50.039]
  - - [384, 4096, 1, 1024, 416, 416, 1056, 4096]
    - [24, 56.174]
  - - [384, 4096, 1, 2048, 416, 416, 2080, 4096]
    - [49, 62.26]
  - - [384, 4096, 1, 4096, 416, 416, 4128, 4128]
    - [23, 65.867]
  - - [768, 64, 1, 64, 800, 800, 768, 96]
    - [101, 1.035]
  - - [768, 64, 1, 128, 800, 800, 768, 160]
    - [91, 1.949]
  - - [768, 64, 1, 256, 800, 800, 768, 288]
    - [85, 3.438]
  - - [768, 64, 1, 512, 800, 800, 768, 544]
    - [93, 5.657]
  - - [768, 64, 1, 1024, 800, 800, 1056, 1056]
    - [70, 8.293]
  - - [768, 64, 1, 2048, 800, 800, 2080, 2080]
    - [70, 10.816]
  - - [768, 64, 1, 4096, 800, 800, 4128, 4128]
    - [92, 12.723]
  - - [768, 128, 1, 64, 800, 800, 768, 128]
    - [1, 1.953]
  - - [768, 128, 1, 128, 800, 800, 768, 160]
    - [134, 3.582]
  - - [768, 128, 1, 256, 800, 800, 768, 288]
    - [134, 6.153]
  - - [768, 128, 1, 512, 800, 800, 768, 544]
    - [111, 9.665]
  - - [768, 128, 1, 1024, 800, 800, 1056, 1056]
    - [113, 13.466]
  - - [768, 128, 1, 2048, 800, 800, 2080, 2080]
    - [112, 16.781]
  - - [768, 128, 1, 4096, 800, 800, 4128, 4128]
    - [114, 19.112]
  - - [768, 256, 1, 64, 800, 800, 768, 256]
    - [140, 3.726]
  - - [768, 256, 1, 128, 800, 800, 768, 256]
    - [110, 6.716]
  - - [768, 256, 1, 256, 800, 800, 768, 288]
    - [109, 11.33]
  - - [768, 256, 1, 512, 800, 800, 768, 544]
    - [131, 17.068]
  - - [768, 256, 1, 1024, 800, 800, 1056, 1056]
    - [108, 22.882]
  - - [768, 256, 1, 2048, 800, 800, 2080, 2080]
    - [110, 27.504]
  - - [768, 256, 1, 4096, 800, 800, 4128, 4128]
    - [124, 29.697]
  - - [768, 512, 1, 64, 800, 800, 768, 512]
    - [4, 6.692]
  - - [768, 512, 1, 128, 800, 800, 768, 512]
    - [140, 11.357]
  - - [768, 512, 1, 256, 800, 800, 768, 512]
    - [147, 17.332]
  - - [768, 512, 1, 512, 800, 800, 768, 544]
    - [117, 23.464]
  - - [768, 512, 1, 1024, 800, 800, 1056, 1056]
    - [116, 28.495]
  - - [768, 512, 1, 2048, 800, 800, 2080, 2080]
    - [119, 30.379]
  - - [768, 512, 1, 4096, 800, 800, 4128, 4128]
    - [121, 32.856]
  - - [768, 1024, 1, 64, 800, 800, 768, 1024]
    - [10, 11.234]
  - - [768, 1024, 1, 128, 800, 800, 768, 1024]
    - [29, 19.064]
  - - [768, 1024, 1, 256, 800, 800, 768, 1024]
    - [61, 29.576]
  - - [768, 1024, 1, 512, 800, 800, 768, 1024]
    - [18, 41.114]
  - - [768, 1024, 1, 1024, 800, 800, 1056, 1056]
    - [15, 51.008]
  - - [768, 1024, 1, 2048, 800, 800, 2080, 2080]
    - [16, 56.228]
  - - [768, 1024, 1, 4096, 800, 800, 4128, 4128]
    - [16, 61.554]
  - - [768, 2048, 1, 64, 800, 800, 768, 2048]
    - [5, 17.814]
  - - [768, 2048, 1, 128, 800, 800, 768, 2048]
    - [49, 26.765]
  - - [768, 2048, 1, 256, 800, 800, 768, 2048]
    - [60, 38.753]
  - - [768, 2048, 1, 512, 800, 800, 768, 2048]
    - [52, 49.928]
  - - [768, 2048, 1, 1024, 800, 800, 1056, 2048]
    - [26, 56.097]
  - - [768, 2048, 1, 2048, 800, 800, 2080, 2080]
    - [46, 62.362]
  - - [768, 2048, 1, 4096, 800, 800, 4128, 4128]
    - [22, 65.867]
  - - [768, 4096, 1, 64, 800, 800, 768, 4096]
    - [63, 24.24]
  - - [768, 4096, 1, 128, 800, 800, 768, 4096]
    - [54, 37.211]
  - - [768, 4096, 1, 256, 800, 800, 768, 4096]
    - [20, 51.302]
  - - [768, 4096, 1, 512, 800, 800, 768, 4096]
    - [56, 59.72]
  - - [768, 4096, 1, 1024, 800, 800, 1056, 4096]
    - [54, 67.791]
  - - [768, 4096, 1, 2048, 800, 800, 2080, 4096]
    - [66, 73.699]
  - - [768, 4096, 1, 4096, 800, 800, 4128, 4128]
    - [38, 76.623]
  - - [1536, 64, 1, 64, 1568, 1568, 1536, 96]
    - [75, 1.953]
  - - [1536, 64, 1, 128, 1568, 1568, 1536, 160]
    - [112, 3.58]
  - - [1536, 64, 1, 256, 1568, 1568, 1536, 288]
    - [120, 6.134]
  - - [1536, 64, 1, 512, 1568, 1568, 1536, 544]
    - [111, 9.656]
  - - [1536, 64, 1, 1024, 1568, 1568, 1536, 1056]
    - [111, 13.487]
  - - [1536, 64, 1, 2048, 1568, 1568, 2080, 2080]
    - [114, 16.813]
  - - [1536, 64, 1, 4096, 1568, 1568, 4128, 4128]
    - [114, 19.111]
  - - [1536, 128, 1, 64, 1568, 1568, 1536, 128]
    - [141, 3.72]
  - - [1536, 128, 1, 128, 1568, 1568, 1536, 160]
    - [109, 6.71]
  - - [1536, 128, 1, 256, 1568, 1568, 1536, 288]
    - [109, 11.348]
  - - [1536, 128, 1, 512, 1568, 1568, 1536, 544]
    - [132, 17.163]
  - - [1536, 128, 1, 1024, 1568, 1568, 1536, 1056]
    - [109, 23.354]
  - - [1536, 128, 1, 2048, 1568, 1568, 2080, 2080]
    - [110, 28.249]
  - - [1536, 128, 1, 4096, 1568, 1568, 4128, 4128]
    - [109, 30.44]
  - - [1536, 256, 1, 64, 1568, 1568, 1536, 256]
    - [132, 6.676]
  - - [1536, 256, 1, 128, 1568, 1568, 1536, 256]
    - [126, 11.362]
  - - [1536, 256, 1, 256, 1568, 1568, 1536, 288]
    - [118, 17.263]
  - - [1536, 256, 1, 512, 1568, 1568, 1536, 544]
    - [135, 23.404]
  - - [1536, 256, 1, 1024, 1568, 1568, 1536, 1056]
    - [137, 28.297]
  - - [1536, 256, 1, 2048, 1568, 1568, 2080, 2080]
    - [149, 30.224]
  - - [1536, 256, 1, 4096, 1568, 1568, 4128, 4128]
    - [122, 32.851]
  - - [1536, 512, 1, 64, 1568, 1568, 1536, 512]
    - [11, 11.271]
  - - [1536, 512, 1, 128, 1568, 1568, 1536, 512]
    - [31, 19.016]
  - - [1536, 512, 1, 256, 1568, 1568, 1536, 512]
    - [39, 29.668]
  - - [1536, 512, 1, 512, 1568, 1568, 1536, 544]
    - [53, 40.738]
  - - [1536, 512, 1, 1024, 1568, 1568, 1536, 1056]
    - [54, 50.107]
  - - [1536, 512, 1, 2048, 1568, 1568, 2080, 2080]
    - [47, 54.577]
  - - [1536, 512, 1, 4096, 1568, 1568, 4128, 4128]
    - [25, 59.473]
  - - [1536, 1024, 1, 64, 1568, 1568, 1536, 1024]
    - [5, 17.797]
  - - [1536, 1024, 1, 128, 1568, 1568, 1536, 1024]
    - [125, 26.732]
  - - [1536, 1024, 1, 256, 1568, 1568, 1536, 1024]
    - [54, 38.687]
  - - [1536, 1024, 1, 512, 1568, 1568, 1536, 1024]
    - [52, 50.0]
  - - [1536, 1024, 1, 1024, 1568, 1568, 1536, 1056]
    - [57, 56.401]
  - - [1536, 1024, 1, 2048, 1568, 1568, 2080, 2080]
    - [47, 62.377]
  - - [1536, 1024, 1, 4096, 1568, 1568, 4128, 4128]
    - [50, 65.857]
  - - [1536, 2048, 1, 64, 1568, 1568, 1536, 2048]
    - [38, 24.154]
  - - [1536, 2048, 1, 128, 1568, 1568, 1536, 2048]
    - [53, 37.095]
  - - [1536, 2048, 1, 256, 1568, 1568, 1536, 2048]
    - [44, 51.226]
  - - [1536, 2048, 1, 512, 1568, 1568, 1536, 2048]
    - [55, 59.639]
  - - [1536, 2048, 1, 1024, 1568, 1568, 1536, 2048]
    - [30, 67.701]
  - - [1536, 2048, 1, 2048, 1568, 1568, 2080, 2080]
    - [52, 73.715]
  - - [1536, 2048, 1, 4096, 1568, 1568, 4128, 4128]
    - [64, 76.674]
  - - [1536, 4096, 1, 64, 1568, 1568, 1536, 4096]
    - [53, 31.201]
  - - [1536, 4096, 1, 128, 1568, 1568, 1536, 4096]
    - [21, 46.258]
  - - [1536, 4096, 1, 256, 1568, 1568, 1536, 4096]
    - [19, 58.675]
  - - [1536, 4096, 1, 512, 1568, 1568, 1536, 4096]
    - [20, 70.614]
  - - [1536, 4096, 1, 1024, 1568, 1568, 1536, 4096]
    - [20, 77.651]
  - - [1536, 4096, 1, 2048, 1568, 1568, 2080, 4096]
    - [19, 81.616]
  - - [1536, 4096, 1, 4096, 1568, 1568, 4128, 4128]
    - [37, 83.01]
  - - [3072, 64, 1, 64, 3104, 3104, 3072, 96]
    - [140, 3.702]
  - - [3072, 64, 1, 128, 3104, 3104, 3072, 160]
    - [123, 6.686]
  - - [3072, 64, 1, 256, 3104, 3104, 3072, 288]
    - [147, 11.277]
  - - [3072, 64, 1, 512, 3104, 3104, 3072, 544]
    - [130, 17.156]
  - - [3072, 64, 1, 1024, 3104, 3104, 3072, 1056]
    - [132, 23.25]
  - - [3072, 64, 1, 2048, 3104, 3104, 3072, 2080]
    - [110, 28.236]
  - - [3072, 64, 1, 4096, 3104, 3104, 4128, 4128]
    - [109, 30.261]
  - - [3072, 128, 1, 64, 3104, 3104, 3072, 128]
    - [10, 6.688]
  - - [3072, 128, 1, 128, 3104, 3104, 3072, 160]
    - [142, 11.348]
  - - [3072, 128, 1, 256, 3104, 3104, 3072, 288]
    - [118, 17.29]
  - - [3072, 128, 1, 512, 3104, 3104, 3072, 544]
    - [115, 23.297]
  - - [3072, 128, 1, 1024, 3104, 3104, 3072, 1056]
    - [107, 28.203]
  - - [3072, 128, 1, 2048, 3104, 3104, 3072, 2080]
    - [129, 30.252]
  - - [3072, 128, 1, 4096, 3104, 3104, 4128, 4128]
    - [127, 32.691]
  - - [3072, 256, 1, 64, 3104, 3104, 3072, 256]
    - [14, 11.259]
  - - [3072, 256, 1, 128, 3104, 3104, 3072, 256]
    - [32, 19.047]
  - - [3072, 256, 1, 256, 3104, 3104, 3072, 288]
    - [31, 29.55]
  - - [3072, 256, 1, 512, 3104, 3104, 3072, 544]
    - [32, 40.705]
  - - [3072, 256, 1, 1024, 3104, 3104, 3072, 1056]
    - [26, 50.1]
  - - [3072, 256, 1, 2048, 3104, 3104, 3072, 2080]
    - [31, 54.528]
  - - [3072, 256, 1, 4096, 3104, 3104, 4128, 4128]
    - [48, 59.473]
  - - [3072, 512, 1, 64, 3104, 3104, 3072, 512]
    - [7, 17.871]
  - - [3072, 512, 1, 128, 3104, 3104, 3072, 512]
    - [115, 26.76]
  - - [3072, 512, 1, 256, 3104, 3104, 3072, 512]
    - [61, 38.632]
  - - [3072, 512, 1, 512, 3104, 3104, 3072, 544]
    - [31, 49.985]
  - - [3072, 512, 1, 1024, 3104, 3104, 3072, 1056]
    - [34, 56.235]
  - - [3072, 512, 1, 2048, 3104, 3104, 3072, 2080]
    - [33, 62.249]
  - - [3072, 512, 1, 4096, 3104, 3104, 4128, 4128]
    - [45, 65.859]
  - - [3072, 1024, 1, 64, 3104, 3104, 3072, 1024]
    - [36, 24.174]
  - - [3072, 1024, 1, 128, 3104, 3104, 3072, 1024]
    - [32, 37.329]
  - - [3072, 1024, 1, 256, 3104, 3104, 3072, 1024]
    - [56, 51.2]
  - - [3072, 1024, 1, 512, 3104, 3104, 3072, 1024]
    - [55, 60.038]
  - - [3072, 1024, 1, 1024, 3104, 3104, 3072, 1056]
    - [30, 68.0]
  - - [3072, 1024, 1, 2048, 3104, 3104, 3072, 2080]
    - [65, 73.803]
  - - [3072, 1024, 1, 4096, 3104, 3104, 4128, 4128]
    - [62, 76.611]
  - - [3072, 2048, 1, 64, 3104, 3104, 3072, 2048]
    - [64, 31.145]
  - - [3072, 2048, 1, 128, 3104, 3104, 3072, 2048]
    - [42, 46.259]
  - - [3072, 2048, 1, 256, 3104, 3104, 3072, 2048]
    - [19, 58.659]
  - - [3072, 2048, 1, 512, 3104, 3104, 3072, 2048]
    - [44, 70.518]
  - - [3072, 2048, 1, 1024, 3104, 3104, 3072, 2048]
    - [56, 77.653]
  - - [3072, 2048, 1, 2048, 3104, 3104, 3072, 2080]
    - [19, 81.504]
  - - [3072, 2048, 1, 4096, 3104, 3104, 4128, 4128]
    - [35, 82.985]
  - - [3072, 4096, 1, 64, 3104, 3104, 3072, 4096]
    - [43, 32.975]
  - - [3072, 4096, 1, 128, 3104, 3104, 3072, 4096]
    - [18, 49.621]
  - - [3072, 4096, 1, 256, 3104, 3104, 3072, 4096]
    - [42, 64.382]
  - - [3072, 4096, 1, 512, 3104, 3104, 3072, 4096]
    - [21, 75.382]
  - - [3072, 4096, 1, 1024, 3104, 3104, 3072, 4096]
    - [19, 81.299]
  - - [3072, 4096, 1, 2048, 3104, 3104, 3072, 4096]
    - [20, 83.669]
  - - [3072, 4096, 1, 4096, 3104, 3104, 4128, 4128]
    - [19, 85.829]
- null
- null
- DeviceEfficiency
