library/src/blas3/Tensile/Logic/asm_full/navi32/navi32_Cijk_Ailk_Bljk_BBS_BH.yaml
- {MinimumRequiredVersion: 4.35.0}
- navi32
- gfx1101
- [Device 73f0]
    SolutionIndex: 0
    SolutionNameMin: Cijk_Ailk_Bljk_BBS_BH_MT32x32x16_MI16x16x16x1_SN_1LDSB1_AMAS0_GRVW4_IU1_NLCA1_SIA2_SU0_SUS0_SVW1_TT1_16_VW1_WGM4
    SolutionIndex: 1
    SolutionNameMin: Cijk_Ailk_Bljk_BBS_BH_MT64x64x16_MI16x16x16x1_SN_1LDSB0_AMAS3_GRVW8_IU1_NLCA1_SIA1_SU0_SUS0_SVW2_TT2_32_VW2_WGM4
    SolutionIndex: 2
    SolutionNameMin: Cijk_Ailk_Bljk_BBS_BH_MT64x64x16_MI16x16x16x1_SN_1LDSB1_AMAS3_GRVW8_IU1_NLCA1_SIA2_SU0_SUS0_SVW2_TT2_32_VW2_WGM4
    SolutionIndex: 3
    SolutionNameMin: Cijk_Ailk_Bljk_BBS_BH_MT64x64x16_MI16x16x16x1_SN_1LDSB1_AMAS3_GRVW8_IU1_NLCA1_SIA2_SU32_SUS128_SVW2_TT2_32_VW2_WGM4
    SolutionIndex: 4
    SolutionNameMin: Cijk_Ailk_Bljk_BBS_BH_MT64x64x16_MI16x16x16x1_SN_1LDSB0_AMAS3_GRVW8_IU1_NLCA1_SIA1_SU32_SUS256_SVW2_TT2_32_VW2_WGM4
    SolutionIndex: 5
    SolutionNameMin: Cijk_Ailk_Bljk_BBS_BH_MT64x64x16_MI16x16x16x1_SN_1LDSB1_AMAS3_GRVW8_IU1_NLCA1_SIA2_SU32_SUS256_SVW2_TT2_32_VW2_WGM4
    SolutionIndex: 6
    SolutionNameMin: Cijk_Ailk_Bljk_BBS_BH_MT64x64x16_MI16x16x16x1_SN_1LDSB0_AMAS3_GRVW8_IU1_NLCA1_SIA1_SU0_SUS0_SVW2_TT2_32_VW2_WGM8
    SolutionIndex: 7
    SolutionNameMin: Cijk_Ailk_Bljk_BBS_BH_MT64x64x16_MI16x16x16x1_SN_1LDSB1_AMAS3_GRVW8_IU1_NLCA1_SIA2_SU0_SUS0_SVW2_TT2_32_VW2_WGM8
    SolutionIndex: 8
    SolutionNameMin: Cijk_Ailk_Bljk_BBS_BH_MT64x64x16_MI16x16x16x1_SN_1LDSB0_AMAS3_GRVW8_IU1_NLCA1_SIA1_SU32_SUS128_SVW2_TT2_32_VW2_WGM8
    SolutionIndex: 9
    SolutionNameMin: Cijk_Ailk_Bljk_BBS_BH_MT64x64x16_MI16x16x16x1_SN_1LDSB1_AMAS3_GRVW4_IU1_NLCA1_SIA2_SU32_SUS128_SVW2_TT2_32_VW2_WGM8
    SolutionIndex: 10
    SolutionNameMin: Cijk_Ailk_Bljk_BBS_BH_MT64x64x16_MI16x16x16x1_SN_1LDSB0_AMAS3_GRVW8_IU1_NLCA1_SIA1_SU32_SUS256_SVW2_TT2_32_VW2_WGM8
    SolutionIndex: 11
    SolutionNameMin: Cijk_Ailk_Bljk_BBS_BH_MT64x64x16_MI16x16x16x1_SN_1LDSB1_AMAS3_GRVW8_IU1_NLCA1_SIA2_SU32_SUS256_SVW2_TT2_32_VW2_WGM8
    SolutionIndex: 12
    SolutionNameMin: Cijk_Ailk_Bljk_BBS_BH_MT128x128x16_MI16x16x16x1_SN_1LDSB0_AMAS3_GRVW4_IU1_NLCA1_SIA1_SU0_SUS0_SVW2_TT4_64_VW2_WGM4
    SolutionIndex: 13
    SolutionNameMin: Cijk_Ailk_Bljk_BBS_BH_MT128x128x16_MI16x16x16x1_SN_1LDSB0_AMAS3_GRVW8_IU1_NLCA1_SIA1_SU0_SUS0_SVW2_TT4_64_VW2_WGM4
    SolutionIndex: 14
    SolutionNameMin: Cijk_Ailk_Bljk_BBS_BH_MT128x128x16_MI16x16x16x1_SN_1LDSB1_AMAS3_GRVW4_IU1_NLCA1_SIA2_SU0_SUS0_SVW2_TT4_64_VW2_WGM4
    SolutionIndex: 15
    SolutionNameMin: Cijk_Ailk_Bljk_BBS_BH_MT128x128x16_MI16x16x16x1_SN_1LDSB1_AMAS3_GRVW8_IU1_NLCA1_SIA2_SU0_SUS0_SVW2_TT4_64_VW2_WGM4
    SolutionIndex: 16
    SolutionNameMin: Cijk_Ailk_Bljk_BBS_BH_MT128x128x16_MI16x16x16x1_SN_1LDSB0_AMAS0_GRVW2_IU1_NLCA2_SIA3_SU0_SUS0_SVW1_TT4_64_VW1_WGM4
    SolutionIndex: 17
    SolutionNameMin: Cijk_Ailk_Bljk_BBS_BH_MT128x128x16_MI16x16x16x1_SN_1LDSB0_AMAS3_GRVW2_IU1_NLCA2_SIA3_SU0_SUS0_SVW2_TT4_64_VW2_WGM4
    SolutionIndex: 18
    SolutionNameMin: Cijk_Ailk_Bljk_BBS_BH_MT128x128x16_MI16x16x16x1_SN_1LDSB0_AMAS3_GRVW8_IU1_NLCA1_SIA1_SU32_SUS128_SVW2_TT4_64_VW2_WGM4
    SolutionIndex: 19
    SolutionNameMin: Cijk_Ailk_Bljk_BBS_BH_MT128x128x16_MI16x16x16x1_SN_1LDSB0_AMAS3_GRVW2_IU1_NLCA2_SIA3_SU32_SUS128_SVW2_TT4_64_VW2_WGM4
    SolutionIndex: 20
    SolutionNameMin: Cijk_Ailk_Bljk_BBS_BH_MT128x128x16_MI16x16x16x1_SN_1LDSB0_AMAS3_GRVW8_IU1_NLCA1_SIA1_SU32_SUS256_SVW2_TT4_64_VW2_WGM4
    SolutionIndex: 21
    SolutionNameMin: Cijk_Ailk_Bljk_BBS_BH_MT128x128x16_MI16x16x16x1_SN_1LDSB1_AMAS3_GRVW8_IU1_NLCA1_SIA2_SU32_SUS256_SVW2_TT4_64_VW2_WGM4
    SolutionIndex: 22
    SolutionNameMin: Cijk_Ailk_Bljk_BBS_BH_MT128x128x16_MI16x16x16x1_SN_1LDSB0_AMAS0_GRVW2_IU1_NLCA2_SIA3_SU32_SUS256_SVW1_TT4_64_VW1_WGM4
    SolutionIndex: 23
    SolutionNameMin: Cijk_Ailk_Bljk_BBS_BH_MT128x128x16_MI16x16x16x1_SN_1LDSB0_AMAS3_GRVW2_IU1_NLCA2_SIA3_SU32_SUS256_SVW2_TT4_64_VW2_WGM4
    SolutionIndex: 24
    SolutionNameMin: Cijk_Ailk_Bljk_BBS_BH_MT128x128x16_MI16x16x16x1_SN_1LDSB0_AMAS3_GRVW4_IU1_NLCA1_SIA1_SU0_SUS0_SVW2_TT4_64_VW2_WGM8
    SolutionIndex: 25
    SolutionNameMin: Cijk_Ailk_Bljk_BBS_BH_MT128x128x16_MI16x16x16x1_SN_1LDSB0_AMAS3_GRVW8_IU1_NLCA1_SIA1_SU0_SUS0_SVW2_TT4_64_VW2_WGM8
    SolutionIndex: 26
    SolutionNameMin: Cijk_Ailk_Bljk_BBS_BH_MT128x128x16_MI16x16x16x1_SN_1LDSB1_AMAS3_GRVW4_IU1_NLCA1_SIA2_SU0_SUS0_SVW2_TT4_64_VW2_WGM8
    SolutionIndex: 27
    SolutionNameMin: Cijk_Ailk_Bljk_BBS_BH_MT128x128x16_MI16x16x16x1_SN_1LDSB1_AMAS3_GRVW8_IU1_NLCA1_SIA2_SU0_SUS0_SVW2_TT4_64_VW2_WGM8
    SolutionIndex: 28
    SolutionNameMin: Cijk_Ailk_Bljk_BBS_BH_MT128x128x16_MI16x16x16x1_SN_1LDSB0_AMAS0_GRVW2_IU1_NLCA2_SIA3_SU0_SUS0_SVW1_TT4_64_VW1_WGM8
    SolutionIndex: 29
    SolutionNameMin: Cijk_Ailk_Bljk_BBS_BH_MT128x128x16_MI16x16x16x1_SN_1LDSB0_AMAS3_GRVW8_IU1_NLCA1_SIA3_SU0_SUS0_SVW2_TT4_64_VW2_WGM8
    SolutionIndex: 30
    SolutionNameMin: Cijk_Ailk_Bljk_BBS_BH_MT128x128x16_MI16x16x16x1_SN_1LDSB0_AMAS3_GRVW4_IU1_NLCA1_SIA1_SU32_SUS128_SVW2_TT4_64_VW2_WGM8
    SolutionIndex: 31
    SolutionNameMin: Cijk_Ailk_Bljk_BBS_BH_MT128x128x16_MI16x16x16x1_SN_1LDSB0_AMAS3_GRVW8_IU1_NLCA1_SIA1_SU32_SUS128_SVW2_TT4_64_VW2_WGM8
    SolutionIndex: 32
    SolutionNameMin: Cijk_Ailk_Bljk_BBS_BH_MT128x128x16_MI16x16x16x1_SN_1LDSB0_AMAS3_GRVW8_IU1_NLCA1_SIA1_SU32_SUS256_SVW2_TT4_64_VW2_WGM8
    SolutionIndex: 33
    SolutionNameMin: Cijk_Ailk_Bljk_BBS_BH_MT32x32x32_MI16x16x16x1_SN_1LDSB0_AMAS0_GRVW4_IU1_NLCA1_SIA1_SU0_SUS0_SVW1_TT1_16_VW1_WGM4
    SolutionIndex: 34
    SolutionNameMin: Cijk_Ailk_Bljk_BBS_BH_MT32x32x32_MI16x16x16x1_SN_1LDSB0_AMAS0_GRVW8_IU1_NLCA1_SIA1_SU0_SUS0_SVW1_TT1_16_VW1_WGM4
    SolutionIndex: 35
    SolutionNameMin: Cijk_Ailk_Bljk_BBS_BH_MT32x32x32_MI16x16x16x1_SN_1LDSB1_AMAS0_GRVW4_IU2_NLCA1_SIA2_SU0_SUS0_SVW1_TT1_16_VW1_WGM4
    SolutionIndex: 36
    SolutionNameMin: Cijk_Ailk_Bljk_BBS_BH_MT32x32x32_MI16x16x16x1_SN_1LDSB1_AMAS0_GRVW8_IU2_NLCA1_SIA2_SU0_SUS0_SVW1_TT1_16_VW1_WGM4
    SolutionIndex: 37
    SolutionNameMin: Cijk_Ailk_Bljk_BBS_BH_MT32x32x32_MI16x16x16x1_SN_1LDSB0_AMAS0_GRVW4_IU1_NLCA1_SIA1_SU32_SUS128_SVW1_TT1_16_VW1_WGM4
    SolutionIndex: 38
    SolutionNameMin: Cijk_Ailk_Bljk_BBS_BH_MT32x32x32_MI16x16x16x1_SN_1LDSB0_AMAS0_GRVW8_IU1_NLCA1_SIA1_SU32_SUS128_SVW1_TT1_16_VW1_WGM4
    SolutionIndex: 39
    SolutionNameMin: Cijk_Ailk_Bljk_BBS_BH_MT32x32x32_MI16x16x16x1_SN_1LDSB1_AMAS0_GRVW4_IU2_NLCA1_SIA2_SU32_SUS128_SVW1_TT1_16_VW1_WGM4
    SolutionIndex: 40
    SolutionNameMin: Cijk_Ailk_Bljk_BBS_BH_MT32x32x32_MI16x16x16x1_SN_1LDSB1_AMAS0_GRVW8_IU2_NLCA1_SIA2_SU32_SUS128_SVW1_TT1_16_VW1_WGM4
    SolutionIndex: 41
    SolutionNameMin: Cijk_Ailk_Bljk_BBS_BH_MT32x32x32_MI16x16x16x1_SN_1LDSB0_AMAS0_GRVW4_IU1_NLCA1_SIA1_SU32_SUS256_SVW1_TT1_16_VW1_WGM4
    SolutionIndex: 42
    SolutionNameMin: Cijk_Ailk_Bljk_BBS_BH_MT32x32x32_MI16x16x16x1_SN_1LDSB0_AMAS0_GRVW8_IU1_NLCA1_SIA1_SU32_SUS256_SVW1_TT1_16_VW1_WGM4
    SolutionIndex: 43
    SolutionNameMin: Cijk_Ailk_Bljk_BBS_BH_MT32x32x32_MI16x16x16x1_SN_1LDSB1_AMAS0_GRVW4_IU2_NLCA1_SIA2_SU32_SUS256_SVW1_TT1_16_VW1_WGM4
    SolutionIndex: 44
    SolutionNameMin: Cijk_Ailk_Bljk_BBS_BH_MT32x32x32_MI16x16x16x1_SN_1LDSB1_AMAS0_GRVW8_IU2_NLCA1_SIA2_SU32_SUS256_SVW1_TT1_16_VW1_WGM4
    SolutionIndex: 45
    SolutionNameMin: Cijk_Ailk_Bljk_BBS_BH_MT32x32x32_MI16x16x16x1_SN_1LDSB0_AMAS0_GRVW8_IU1_NLCA1_SIA3_SU32_SUS256_SVW1_TT1_16_VW1_WGM4
    SolutionIndex: 46
    SolutionNameMin: Cijk_Ailk_Bljk_BBS_BH_MT32x32x32_MI16x16x16x1_SN_1LDSB0_AMAS0_GRVW4_IU1_NLCA1_SIA1_SU0_SUS0_SVW1_TT1_16_VW1_WGM8
    SolutionIndex: 47
    SolutionNameMin: Cijk_Ailk_Bljk_BBS_BH_MT32x32x32_MI16x16x16x1_SN_1LDSB0_AMAS0_GRVW8_IU1_NLCA1_SIA1_SU0_SUS0_SVW1_TT1_16_VW1_WGM8
    SolutionIndex: 48
    SolutionNameMin: Cijk_Ailk_Bljk_BBS_BH_MT32x32x32_MI16x16x16x1_SN_1LDSB1_AMAS0_GRVW4_IU2_NLCA1_SIA2_SU0_SUS0_SVW1_TT1_16_VW1_WGM8
    SolutionIndex: 49
    SolutionNameMin: Cijk_Ailk_Bljk_BBS_BH_MT32x32x32_MI16x16x16x1_SN_1LDSB1_AMAS0_GRVW8_IU2_NLCA1_SIA2_SU0_SUS0_SVW1_TT1_16_VW1_WGM8
    SolutionIndex: 50
    SolutionNameMin: Cijk_Ailk_Bljk_BBS_BH_MT32x32x32_MI16x16x16x1_SN_1LDSB0_AMAS0_GRVW8_IU1_NLCA1_SIA3_SU0_SUS0_SVW1_TT1_16_VW1_WGM8
    SolutionIndex: 51
    SolutionNameMin: Cijk_Ailk_Bljk_BBS_BH_MT32x32x32_MI16x16x16x1_SN_1LDSB1_AMAS0_GRVW4_IU2_NLCA1_SIA2_SU32_SUS128_SVW1_TT1_16_VW1_WGM8
    SolutionIndex: 52
    SolutionNameMin: Cijk_Ailk_Bljk_BBS_BH_MT32x32x32_MI16x16x16x1_SN_1LDSB1_AMAS0_GRVW8_IU2_NLCA1_SIA2_SU32_SUS128_SVW1_TT1_16_VW1_WGM8
    SolutionIndex: 53
    SolutionNameMin: Cijk_Ailk_Bljk_BBS_BH_MT32x32x32_MI16x16x16x1_SN_1LDSB1_AMAS0_GRVW4_IU2_NLCA1_SIA2_SU32_SUS256_SVW1_TT1_16_VW1_WGM8
    SolutionIndex: 54
    SolutionNameMin: Cijk_Ailk_Bljk_BBS_BH_MT32x32x32_MI16x16x16x1_SN_1LDSB1_AMAS0_GRVW8_IU2_NLCA1_SIA2_SU32_SUS256_SVW1_TT1_16_VW1_WGM8
    SolutionIndex: 55
    SolutionNameMin: Cijk_Ailk_Bljk_BBS_BH_MT64x64x32_MI16x16x16x1_SN_1LDSB0_AMAS3_GRVW4_IU1_NLCA1_SIA1_SU0_SUS0_SVW2_TT2_32_VW2_WGM4
    SolutionIndex: 56
    SolutionNameMin: Cijk_Ailk_Bljk_BBS_BH_MT64x64x32_MI16x16x16x1_SN_1LDSB0_AMAS3_GRVW8_IU1_NLCA1_SIA1_SU0_SUS0_SVW2_TT2_32_VW2_WGM4
    SolutionIndex: 57
    SolutionNameMin: Cijk_Ailk_Bljk_BBS_BH_MT64x64x32_MI16x16x16x1_SN_1LDSB1_AMAS3_GRVW8_IU2_NLCA1_SIA2_SU0_SUS0_SVW2_TT2_32_VW2_WGM4
    SolutionIndex: 58
    SolutionNameMin: Cijk_Ailk_Bljk_BBS_BH_MT64x64x32_MI16x16x16x1_SN_1LDSB0_AMAS3_GRVW8_IU1_NLCA1_SIA3_SU0_SUS0_SVW2_TT2_32_VW2_WGM4
    SolutionIndex: 59
    SolutionNameMin: Cijk_Ailk_Bljk_BBS_BH_MT64x64x32_MI16x16x16x1_SN_1LDSB1_AMAS3_GRVW8_IU2_NLCA1_SIA2_SU32_SUS128_SVW2_TT2_32_VW2_WGM4
    SolutionIndex: 60
    SolutionNameMin: Cijk_Ailk_Bljk_BBS_BH_MT64x64x32_MI16x16x16x1_SN_1LDSB0_AMAS3_GRVW4_IU1_NLCA1_SIA1_SU32_SUS256_SVW2_TT2_32_VW2_WGM4
    SolutionIndex: 61
    SolutionNameMin: Cijk_Ailk_Bljk_BBS_BH_MT64x64x32_MI16x16x16x1_SN_1LDSB0_AMAS3_GRVW8_IU1_NLCA1_SIA1_SU32_SUS256_SVW2_TT2_32_VW2_WGM4
    SolutionIndex: 62
    SolutionNameMin: Cijk_Ailk_Bljk_BBS_BH_MT64x64x32_MI16x16x16x1_SN_1LDSB0_AMAS3_GRVW8_IU1_NLCA1_SIA3_SU32_SUS256_SVW2_TT2_32_VW2_WGM4
    SolutionIndex: 63
    SolutionNameMin: Cijk_Ailk_Bljk_BBS_BH_MT64x64x32_MI16x16x16x1_SN_1LDSB0_AMAS3_GRVW4_IU1_NLCA1_SIA1_SU0_SUS0_SVW2_TT2_32_VW2_WGM8
    SolutionIndex: 64
    SolutionNameMin: Cijk_Ailk_Bljk_BBS_BH_MT64x64x32_MI16x16x16x1_SN_1LDSB0_AMAS0_GRVW8_IU1_NLCA1_SIA1_SU0_SUS0_SVW1_TT2_32_VW1_WGM8
    SolutionIndex: 65
    SolutionNameMin: Cijk_Ailk_Bljk_BBS_BH_MT64x64x32_MI16x16x16x1_SN_1LDSB0_AMAS3_GRVW8_IU1_NLCA1_SIA1_SU0_SUS0_SVW2_TT2_32_VW2_WGM8
    SolutionIndex: 66
    SolutionNameMin: Cijk_Ailk_Bljk_BBS_BH_MT64x64x32_MI16x16x16x1_SN_1LDSB1_AMAS3_GRVW8_IU2_NLCA1_SIA2_SU0_SUS0_SVW2_TT2_32_VW2_WGM8
    SolutionIndex: 67
    SolutionNameMin: Cijk_Ailk_Bljk_BBS_BH_MT64x64x32_MI16x16x16x1_SN_1LDSB0_AMAS0_GRVW8_IU1_NLCA1_SIA3_SU0_SUS0_SVW1_TT2_32_VW1_WGM8
    SolutionIndex: 68
    SolutionNameMin: Cijk_Ailk_Bljk_BBS_BH_MT64x64x32_MI16x16x16x1_SN_1LDSB0_AMAS3_GRVW8_IU1_NLCA1_SIA3_SU0_SUS0_SVW2_TT2_32_VW2_WGM8
    SolutionIndex: 69
    SolutionNameMin: Cijk_Ailk_Bljk_BBS_BH_MT64x64x32_MI16x16x16x1_SN_1LDSB0_AMAS0_GRVW4_IU1_NLCA1_SIA1_SU32_SUS128_SVW1_TT2_32_VW1_WGM8
    SolutionIndex: 70
    SolutionNameMin: Cijk_Ailk_Bljk_BBS_BH_MT64x64x32_MI16x16x16x1_SN_1LDSB0_AMAS3_GRVW8_IU1_NLCA1_SIA1_SU32_SUS128_SVW2_TT2_32_VW2_WGM8
    SolutionIndex: 71
    SolutionNameMin: Cijk_Ailk_Bljk_BBS_BH_MT64x64x32_MI16x16x16x1_SN_1LDSB1_AMAS3_GRVW8_IU2_NLCA1_SIA2_SU32_SUS128_SVW2_TT2_32_VW2_WGM8
    SolutionIndex: 72
    SolutionNameMin: Cijk_Ailk_Bljk_BBS_BH_MT64x64x32_MI16x16x16x1_SN_1LDSB0_AMAS3_GRVW8_IU1_NLCA1_SIA3_SU32_SUS128_SVW2_TT2_32_VW2_WGM8
    SolutionIndex: 73
    SolutionNameMin: Cijk_Ailk_Bljk_BBS_BH_MT64x64x32_MI16x16x16x1_SN_1LDSB0_AMAS0_GRVW8_IU1_NLCA1_SIA1_SU32_SUS256_SVW1_TT2_32_VW1_WGM8
    SolutionIndex: 74
    SolutionNameMin: Cijk_Ailk_Bljk_BBS_BH_MT64x64x32_MI16x16x16x1_SN_1LDSB0_AMAS3_GRVW8_IU1_NLCA1_SIA1_SU32_SUS256_SVW2_TT2_32_VW2_WGM8
    SolutionIndex: 75
    SolutionNameMin: Cijk_Ailk_Bljk_BBS_BH_MT64x64x32_MI16x16x16x1_SN_1LDSB1_AMAS3_GRVW8_IU2_NLCA1_SIA2_SU32_SUS256_SVW2_TT2_32_VW2_WGM8
    SolutionIndex: 76
    SolutionNameMin: Cijk_Ailk_Bljk_BBS_BH_MT64x64x32_MI16x16x16x1_SN_1LDSB0_AMAS3_GRVW8_IU1_NLCA1_SIA3_SU32_SUS256_SVW2_TT2_32_VW2_WGM8
- - - [64, 64, 1, 64, 96, 96, 96, 96]
    - [49, 0.09]
  - - [64, 64, 1, 128, 96, 96, 160, 160]
    - [49, 0.174]
  - - [64, 64, 1, 256, 96, 96, 288, 288]
    - [35, 0.316]
  - - [64, 64, 1, 512, 96, 96, 544, 544]
    - [48, 0.543]
  - - [64, 64, 1, 1024, 96, 96, 1056, 1056]
    - [51, 0.86]
  - - [64, 64, 1, 2048, 96, 96, 2080, 2080]
    - [48, 1.205]
  - - [64, 64, 1, 4096, 96, 96, 4128, 4128]
    - [39, 1.501]
  - - [64, 128, 1, 64, 96, 96, 96, 96]
    - [51, 0.184]
  - - [64, 128, 1, 128, 96, 96, 160, 160]
    - [43, 0.351]
  - - [64, 128, 1, 256, 96, 96, 288, 288]
    - [35, 0.646]
  - - [64, 128, 1, 512, 96, 96, 544, 544]
    - [44, 1.115]
  - - [64, 128, 1, 1024, 96, 96, 1056, 1056]
    - [51, 1.74]
  - - [64, 128, 1, 2048, 96, 96, 2080, 2080]
    - [51, 2.418]
  - - [64, 128, 1, 4096, 96, 96, 4128, 4128]
    - [39, 3.011]
  - - [64, 256, 1, 64, 96, 96, 96, 96]
    - [35, 0.374]
  - - [64, 256, 1, 128, 96, 96, 160, 160]
    - [35, 0.708]
  - - [64, 256, 1, 256, 96, 96, 288, 288]
    - [36, 1.312]
  - - [64, 256, 1, 512, 96, 96, 544, 544]
    - [44, 2.237]
  - - [64, 256, 1, 1024, 96, 96, 1056, 1056]
    - [53, 3.511]
  - - [64, 256, 1, 2048, 96, 96, 2080, 2080]
    - [48, 4.838]
  - - [64, 256, 1, 4096, 96, 96, 4128, 4128]
    - [48, 6.011]
  - - [64, 512, 1, 64, 96, 96, 96, 96]
    - [48, 0.736]
  - - [64, 512, 1, 128, 96, 96, 160, 160]
    - [37, 1.391]
  - - [64, 512, 1, 256, 96, 96, 288, 288]
    - [35, 2.52]
  - - [64, 512, 1, 512, 96, 96, 544, 544]
    - [49, 4.22]
  - - [64, 512, 1, 1024, 96, 96, 1056, 1056]
    - [36, 6.408]
  - - [64, 512, 1, 2048, 96, 96, 2080, 2080]
    - [36, 8.592]
  - - [64, 512, 1, 4096, 96, 96, 4128, 4128]
    - [36, 10.34]
  - - [64, 1024, 1, 64, 96, 96, 96, 96]
    - [50, 1.417]
  - - [64, 1024, 1, 128, 96, 96, 160, 160]
    - [41, 2.68]
  - - [64, 1024, 1, 256, 96, 96, 288, 288]
    - [47, 4.73]
  - - [64, 1024, 1, 512, 96, 96, 544, 544]
    - [34, 7.763]
  - - [64, 1024, 1, 1024, 96, 96, 1056, 1056]
    - [34, 11.234]
  - - [64, 1024, 1, 2048, 96, 96, 2080, 2080]
    - [34, 14.5]
  - - [64, 1024, 1, 4096, 96, 96, 4128, 4128]
    - [47, 16.826]
  - - [64, 2048, 1, 64, 96, 96, 96, 96]
    - [47, 2.73]
  - - [64, 2048, 1, 128, 96, 96, 160, 160]
    - [49, 4.915]
  - - [64, 2048, 1, 256, 96, 96, 288, 288]
    - [66, 8.321]
  - - [64, 2048, 1, 512, 96, 96, 544, 544]
    - [74, 12.928]
  - - [64, 2048, 1, 1024, 96, 96, 1056, 1056]
    - [65, 17.983]
  - - [64, 2048, 1, 2048, 96, 96, 2080, 2080]
    - [70, 22.366]
  - - [64, 2048, 1, 4096, 96, 96, 4128, 4128]
    - [60, 25.559]
  - - [64, 4096, 1, 64, 96, 96, 96, 96]
    - [36, 4.985]
  - - [64, 4096, 1, 128, 96, 96, 160, 160]
    - [66, 8.892]
  - - [64, 4096, 1, 256, 96, 96, 288, 288]
    - [75, 14.6]
  - - [64, 4096, 1, 512, 96, 96, 544, 544]
    - [74, 21.409]
  - - [64, 4096, 1, 1024, 96, 96, 1056, 1056]
    - [65, 28.171]
  - - [64, 4096, 1, 2048, 96, 96, 2080, 2080]
    - [70, 33.34]
  - - [64, 4096, 1, 4096, 96, 96, 4128, 4128]
    - [70, 35.406]
  - - [128, 64, 1, 64, 160, 160, 128, 96]
    - [48, 0.186]
  - - [128, 64, 1, 128, 160, 160, 160, 160]
    - [35, 0.351]
  - - [128, 64, 1, 256, 160, 160, 288, 288]
    - [44, 0.644]
  - - [128, 64, 1, 512, 160, 160, 544, 544]
    - [51, 1.107]
  - - [128, 64, 1, 1024, 160, 160, 1056, 1056]
    - [48, 1.745]
  - - [128, 64, 1, 2048, 160, 160, 2080, 2080]
    - [53, 2.424]
  - - [128, 64, 1, 4096, 160, 160, 4128, 4128]
    - [35, 3.018]
  - - [128, 128, 1, 64, 160, 160, 128, 96]
    - [51, 0.371]
  - - [128, 128, 1, 128, 160, 160, 160, 160]
    - [53, 0.707]
  - - [128, 128, 1, 256, 160, 160, 288, 288]
    - [54, 1.312]
  - - [128, 128, 1, 512, 160, 160, 544, 544]
    - [43, 2.247]
  - - [128, 128, 1, 1024, 160, 160, 1056, 1056]
    - [48, 3.521]
  - - [128, 128, 1, 2048, 160, 160, 2080, 2080]
    - [48, 4.891]
  - - [128, 128, 1, 4096, 160, 160, 4128, 4128]
    - [35, 6.066]
  - - [128, 256, 1, 64, 160, 160, 128, 96]
    - [51, 0.736]
  - - [128, 256, 1, 128, 160, 160, 160, 160]
    - [54, 1.392]
  - - [128, 256, 1, 256, 160, 160, 288, 288]
    - [36, 2.523]
  - - [128, 256, 1, 512, 160, 160, 544, 544]
    - [36, 4.221]
  - - [128, 256, 1, 1024, 160, 160, 1056, 1056]
    - [36, 6.411]
  - - [128, 256, 1, 2048, 160, 160, 2080, 2080]
    - [49, 8.576]
  - - [128, 256, 1, 4096, 160, 160, 4128, 4128]
    - [36, 10.351]
  - - [128, 512, 1, 64, 160, 160, 128, 96]
    - [41, 1.425]
  - - [128, 512, 1, 128, 160, 160, 160, 160]
    - [50, 2.68]
  - - [128, 512, 1, 256, 160, 160, 288, 288]
    - [42, 4.758]
  - - [128, 512, 1, 512, 160, 160, 544, 544]
    - [33, 7.68]
  - - [128, 512, 1, 1024, 160, 160, 1056, 1056]
    - [34, 11.205]
  - - [128, 512, 1, 2048, 160, 160, 2080, 2080]
    - [34, 14.448]
  - - [128, 512, 1, 4096, 160, 160, 4128, 4128]
    - [34, 16.832]
  - - [128, 1024, 1, 64, 160, 160, 128, 96]
    - [35, 2.734]
  - - [128, 1024, 1, 128, 160, 160, 160, 160]
    - [36, 4.91]
  - - [128, 1024, 1, 256, 160, 160, 288, 288]
    - [65, 8.402]
  - - [128, 1024, 1, 512, 160, 160, 544, 544]
    - [65, 13.341]
  - - [128, 1024, 1, 1024, 160, 160, 1056, 1056]
    - [56, 18.801]
  - - [128, 1024, 1, 2048, 160, 160, 2080, 2080]
    - [65, 23.559]
  - - [128, 1024, 1, 4096, 160, 160, 4128, 4128]
    - [64, 27.011]
  - - [128, 2048, 1, 64, 160, 160, 128, 96]
    - [38, 4.998]
  - - [128, 2048, 1, 128, 160, 160, 160, 160]
    - [75, 8.885]
  - - [128, 2048, 1, 256, 160, 160, 288, 288]
    - [1, 14.701]
  - - [128, 2048, 1, 512, 160, 160, 544, 544]
    - [58, 21.747]
  - - [128, 2048, 1, 1024, 160, 160, 1056, 1056]
    - [68, 28.532]
  - - [128, 2048, 1, 2048, 160, 160, 2080, 2080]
    - [65, 33.802]
  - - [128, 2048, 1, 4096, 160, 160, 4128, 4128]
    - [61, 35.588]
  - - [128, 4096, 1, 64, 160, 160, 128, 96]
    - [59, 8.928]
  - - [128, 4096, 1, 128, 160, 160, 160, 160]
    - [2, 15.419]
  - - [128, 4096, 1, 256, 160, 160, 288, 288]
    - [65, 23.719]
  - - [128, 4096, 1, 512, 160, 160, 544, 544]
    - [63, 32.199]
  - - [128, 4096, 1, 1024, 160, 160, 1056, 1056]
    - [65, 39.366]
  - - [128, 4096, 1, 2048, 160, 160, 2080, 2080]
    - [27, 42.489]
  - - [128, 4096, 1, 4096, 160, 160, 4128, 4128]
    - [27, 46.702]
  - - [256, 64, 1, 64, 288, 288, 256, 96]
    - [49, 0.369]
  - - [256, 64, 1, 128, 288, 288, 256, 160]
    - [36, 0.712]
  - - [256, 64, 1, 256, 288, 288, 288, 288]
    - [35, 1.306]
  - - [256, 64, 1, 512, 288, 288, 544, 544]
    - [54, 2.244]
  - - [256, 64, 1, 1024, 288, 288, 1056, 1056]
    - [35, 3.521]
  - - [256, 64, 1, 2048, 288, 288, 2080, 2080]
    - [48, 4.885]
  - - [256, 64, 1, 4096, 288, 288, 4128, 4128]
    - [51, 6.072]
  - - [256, 128, 1, 64, 288, 288, 256, 96]
    - [35, 0.73]
  - - [256, 128, 1, 128, 288, 288, 256, 160]
    - [35, 1.397]
  - - [256, 128, 1, 256, 288, 288, 288, 288]
    - [36, 2.513]
  - - [256, 128, 1, 512, 288, 288, 544, 544]
    - [35, 4.243]
  - - [256, 128, 1, 1024, 288, 288, 1056, 1056]
    - [49, 6.396]
  - - [256, 128, 1, 2048, 288, 288, 2080, 2080]
    - [35, 8.583]
  - - [256, 128, 1, 4096, 288, 288, 4128, 4128]
    - [36, 10.341]
  - - [256, 256, 1, 64, 288, 288, 256, 96]
    - [46, 1.418]
  - - [256, 256, 1, 128, 288, 288, 256, 160]
    - [42, 2.672]
  - - [256, 256, 1, 256, 288, 288, 288, 288]
    - [47, 4.765]
  - - [256, 256, 1, 512, 288, 288, 544, 544]
    - [34, 7.772]
  - - [256, 256, 1, 1024, 288, 288, 1056, 1056]
    - [34, 11.185]
  - - [256, 256, 1, 2048, 288, 288, 2080, 2080]
    - [34, 14.441]
  - - [256, 256, 1, 4096, 288, 288, 4128, 4128]
    - [34, 16.859]
  - - [256, 512, 1, 64, 288, 288, 256, 96]
    - [45, 2.706]
  - - [256, 512, 1, 128, 288, 288, 256, 160]
    - [44, 4.867]
  - - [256, 512, 1, 256, 288, 288, 288, 288]
    - [65, 8.471]
  - - [256, 512, 1, 512, 288, 288, 544, 544]
    - [65, 13.471]
  - - [256, 512, 1, 1024, 288, 288, 1056, 1056]
    - [65, 19.007]
  - - [256, 512, 1, 2048, 288, 288, 2080, 2080]
    - [56, 23.89]
  - - [256, 512, 1, 4096, 288, 288, 4128, 4128]
    - [56, 27.614]
  - - [256, 1024, 1, 64, 288, 288, 256, 96]
    - [42, 4.993]
  - - [256, 1024, 1, 128, 288, 288, 256, 160]
    - [8, 8.882]
  - - [256, 1024, 1, 256, 288, 288, 288, 288]
    - [6, 14.675]
  - - [256, 1024, 1, 512, 288, 288, 544, 544]
    - [6, 21.869]
  - - [256, 1024, 1, 1024, 288, 288, 1056, 1056]
    - [65, 28.526]
  - - [256, 1024, 1, 2048, 288, 288, 2080, 2080]
    - [58, 33.653]
  - - [256, 1024, 1, 4096, 288, 288, 4128, 4128]
    - [74, 35.516]
  - - [256, 2048, 1, 64, 288, 288, 256, 96]
    - [7, 8.919]
  - - [256, 2048, 1, 128, 288, 288, 256, 160]
    - [66, 15.382]
  - - [256, 2048, 1, 256, 288, 288, 288, 288]
    - [63, 23.812]
  - - [256, 2048, 1, 512, 288, 288, 544, 544]
    - [63, 32.361]
  - - [256, 2048, 1, 1024, 288, 288, 1056, 1056]
    - [56, 39.407]
  - - [256, 2048, 1, 2048, 288, 288, 2080, 2080]
    - [24, 42.654]
  - - [256, 2048, 1, 4096, 288, 288, 4128, 4128]
    - [12, 47.033]
  - - [256, 4096, 1, 64, 288, 288, 256, 96]
    - [2, 14.299]
  - - [256, 4096, 1, 128, 288, 288, 256, 160]
    - [3, 24.019]
  - - [256, 4096, 1, 256, 288, 288, 288, 288]
    - [10, 34.272]
  - - [256, 4096, 1, 512, 288, 288, 544, 544]
    - [65, 43.032]
  - - [256, 4096, 1, 1024, 288, 288, 1056, 1056]
    - [69, 45.399]
  - - [256, 4096, 1, 2048, 288, 288, 2080, 2080]
    - [17, 52.753]
  - - [256, 4096, 1, 4096, 288, 288, 4128, 4128]
    - [28, 56.404]
  - - [384, 64, 1, 64, 416, 416, 384, 96]
    - [36, 0.558]
  - - [384, 64, 1, 128, 416, 416, 384, 160]
    - [48, 1.062]
  - - [384, 64, 1, 256, 416, 416, 384, 288]
    - [51, 1.961]
  - - [384, 64, 1, 512, 416, 416, 544, 544]
    - [48, 3.38]
  - - [384, 64, 1, 1024, 416, 416, 1056, 1056]
    - [35, 5.274]
  - - [384, 64, 1, 2048, 416, 416, 2080, 2080]
    - [51, 7.307]
  - - [384, 64, 1, 4096, 416, 416, 4128, 4128]
    - [35, 9.099]
  - - [384, 128, 1, 64, 416, 416, 384, 96]
    - [52, 1.098]
  - - [384, 128, 1, 128, 416, 416, 384, 160]
    - [44, 2.075]
  - - [384, 128, 1, 256, 416, 416, 384, 288]
    - [35, 3.761]
  - - [384, 128, 1, 512, 416, 416, 544, 544]
    - [40, 6.312]
  - - [384, 128, 1, 1024, 416, 416, 1056, 1056]
    - [36, 9.54]
  - - [384, 128, 1, 2048, 416, 416, 2080, 2080]
    - [48, 12.793]
  - - [384, 128, 1, 4096, 416, 416, 4128, 4128]
    - [49, 15.403]
  - - [384, 256, 1, 64, 416, 416, 384, 96]
    - [53, 2.084]
  - - [384, 256, 1, 128, 416, 416, 384, 160]
    - [38, 3.837]
  - - [384, 256, 1, 256, 416, 416, 384, 288]
    - [66, 6.662]
  - - [384, 256, 1, 512, 416, 416, 544, 544]
    - [66, 10.61]
  - - [384, 256, 1, 1024, 416, 416, 1056, 1056]
    - [66, 15.131]
  - - [384, 256, 1, 2048, 416, 416, 2080, 2080]
    - [57, 19.148]
  - - [384, 256, 1, 4096, 416, 416, 4128, 4128]
    - [66, 22.098]
  - - [384, 512, 1, 64, 416, 416, 384, 96]
    - [75, 3.953]
  - - [384, 512, 1, 128, 416, 416, 384, 160]
    - [66, 7.266]
  - - [384, 512, 1, 256, 416, 416, 384, 288]
    - [65, 12.582]
  - - [384, 512, 1, 512, 416, 416, 544, 544]
    - [56, 19.709]
  - - [384, 512, 1, 1024, 416, 416, 1056, 1056]
    - [55, 27.809]
  - - [384, 512, 1, 2048, 416, 416, 2080, 2080]
    - [65, 34.747]
  - - [384, 512, 1, 4096, 416, 416, 4128, 4128]
    - [55, 39.763]
  - - [384, 1024, 1, 64, 416, 416, 384, 96]
    - [9, 7.064]
  - - [384, 1024, 1, 128, 416, 416, 384, 160]
    - [11, 12.444]
  - - [384, 1024, 1, 256, 416, 416, 384, 288]
    - [7, 19.629]
  - - [384, 1024, 1, 512, 416, 416, 544, 544]
    - [58, 27.72]
  - - [384, 1024, 1, 1024, 416, 416, 1056, 1056]
    - [68, 35.008]
  - - [384, 1024, 1, 2048, 416, 416, 2080, 2080]
    - [72, 39.639]
  - - [384, 1024, 1, 4096, 416, 416, 4128, 4128]
    - [62, 41.422]
  - - [384, 2048, 1, 64, 416, 416, 384, 96]
    - [57, 11.845]
  - - [384, 2048, 1, 128, 416, 416, 384, 160]
    - [26, 20.212]
  - - [384, 2048, 1, 256, 416, 416, 384, 288]
    - [15, 32.066]
  - - [384, 2048, 1, 512, 416, 416, 544, 544]
    - [27, 45.278]
  - - [384, 2048, 1, 1024, 416, 416, 1056, 1056]
    - [27, 57.119]
  - - [384, 2048, 1, 2048, 416, 416, 2080, 2080]
    - [27, 62.84]
  - - [384, 2048, 1, 4096, 416, 416, 4128, 4128]
    - [24, 69.503]
  - - [384, 4096, 1, 64, 416, 416, 384, 96]
    - [7, 18.094]
  - - [384, 4096, 1, 128, 416, 416, 384, 160]
    - [7, 29.884]
  - - [384, 4096, 1, 256, 416, 416, 384, 288]
    - [10, 40.721]
  - - [384, 4096, 1, 512, 416, 416, 544, 544]
    - [30, 51.356]
  - - [384, 4096, 1, 1024, 416, 416, 1056, 1056]
    - [12, 57.973]
  - - [384, 4096, 1, 2048, 416, 416, 2080, 2080]
    - [13, 64.288]
  - - [384, 4096, 1, 4096, 416, 416, 4128, 4128]
    - [22, 68.783]
  - - [768, 64, 1, 64, 800, 800, 768, 96]
    - [35, 1.09]
  - - [768, 64, 1, 128, 800, 800, 768, 160]
    - [35, 2.069]
  - - [768, 64, 1, 256, 800, 800, 768, 288]
    - [52, 3.747]
  - - [768, 64, 1, 512, 800, 800, 768, 544]
    - [54, 6.301]
  - - [768, 64, 1, 1024, 800, 800, 1056, 1056]
    - [49, 9.549]
  - - [768, 64, 1, 2048, 800, 800, 2080, 2080]
    - [49, 12.8]
  - - [768, 64, 1, 4096, 800, 800, 4128, 4128]
    - [49, 15.413]
  - - [768, 128, 1, 64, 800, 800, 768, 96]
    - [0, 2.062]
  - - [768, 128, 1, 128, 800, 800, 768, 160]
    - [47, 3.819]
  - - [768, 128, 1, 256, 800, 800, 768, 288]
    - [66, 6.673]
  - - [768, 128, 1, 512, 800, 800, 768, 544]
    - [57, 10.621]
  - - [768, 128, 1, 1024, 800, 800, 1056, 1056]
    - [66, 15.089]
  - - [768, 128, 1, 2048, 800, 800, 2080, 2080]
    - [66, 19.132]
  - - [768, 128, 1, 4096, 800, 800, 4128, 4128]
    - [66, 22.104]
  - - [768, 256, 1, 64, 800, 800, 768, 96]
    - [2, 3.971]
  - - [768, 256, 1, 128, 800, 800, 768, 160]
    - [75, 7.265]
  - - [768, 256, 1, 256, 800, 800, 768, 288]
    - [65, 12.564]
  - - [768, 256, 1, 512, 800, 800, 768, 544]
    - [65, 19.685]
  - - [768, 256, 1, 1024, 800, 800, 1056, 1056]
    - [55, 27.425]
  - - [768, 256, 1, 2048, 800, 800, 2080, 2080]
    - [56, 34.342]
  - - [768, 256, 1, 4096, 800, 800, 4128, 4128]
    - [56, 39.218]
  - - [768, 512, 1, 64, 800, 800, 768, 96]
    - [7, 7.072]
  - - [768, 512, 1, 128, 800, 800, 768, 160]
    - [2, 12.354]
  - - [768, 512, 1, 256, 800, 800, 768, 288]
    - [2, 19.598]
  - - [768, 512, 1, 512, 800, 800, 768, 544]
    - [58, 27.624]
  - - [768, 512, 1, 1024, 800, 800, 1056, 1056]
    - [68, 34.977]
  - - [768, 512, 1, 2048, 800, 800, 2080, 2080]
    - [76, 39.848]
  - - [768, 512, 1, 4096, 800, 800, 4128, 4128]
    - [76, 41.629]
  - - [768, 1024, 1, 64, 800, 800, 768, 96]
    - [57, 11.874]
  - - [768, 1024, 1, 128, 800, 800, 768, 160]
    - [27, 20.235]
  - - [768, 1024, 1, 256, 800, 800, 768, 288]
    - [27, 32.132]
  - - [768, 1024, 1, 512, 800, 800, 768, 544]
    - [27, 45.375]
  - - [768, 1024, 1, 1024, 800, 800, 1056, 1056]
    - [15, 57.216]
  - - [768, 1024, 1, 2048, 800, 800, 2080, 2080]
    - [12, 63.097]
  - - [768, 1024, 1, 4096, 800, 800, 4128, 4128]
    - [24, 69.624]
  - - [768, 2048, 1, 64, 800, 800, 768, 96]
    - [2, 18.082]
  - - [768, 2048, 1, 128, 800, 800, 768, 160]
    - [2, 29.881]
  - - [768, 2048, 1, 256, 800, 800, 768, 288]
    - [10, 40.544]
  - - [768, 2048, 1, 512, 800, 800, 768, 544]
    - [20, 51.556]
  - - [768, 2048, 1, 1024, 800, 800, 1056, 1056]
    - [30, 58.262]
  - - [768, 2048, 1, 2048, 800, 800, 2080, 2080]
    - [12, 64.525]
  - - [768, 2048, 1, 4096, 800, 800, 4128, 4128]
    - [19, 69.963]
  - - [768, 4096, 1, 64, 800, 800, 768, 96]
    - [25, 24.725]
  - - [768, 4096, 1, 128, 800, 800, 768, 160]
    - [7, 38.076]
  - - [768, 4096, 1, 256, 800, 800, 768, 288]
    - [25, 52.641]
  - - [768, 4096, 1, 512, 800, 800, 768, 544]
    - [25, 62.172]
  - - [768, 4096, 1, 1024, 800, 800, 1056, 1056]
    - [13, 71.695]
  - - [768, 4096, 1, 2048, 800, 800, 2080, 2080]
    - [25, 77.49]
  - - [768, 4096, 1, 4096, 800, 800, 4128, 4128]
    - [25, 80.944]
  - - [1536, 64, 1, 64, 1568, 1568, 1536, 96]
    - [52, 2.083]
  - - [1536, 64, 1, 128, 1568, 1568, 1536, 160]
    - [66, 3.834]
  - - [1536, 64, 1, 256, 1568, 1568, 1536, 288]
    - [71, 6.633]
  - - [1536, 64, 1, 512, 1568, 1568, 1536, 544]
    - [66, 10.595]
  - - [1536, 64, 1, 1024, 1568, 1568, 1536, 1056]
    - [57, 15.158]
  - - [1536, 64, 1, 2048, 1568, 1568, 2080, 2080]
    - [66, 19.159]
  - - [1536, 64, 1, 4096, 1568, 1568, 4128, 4128]
    - [57, 22.105]
  - - [1536, 128, 1, 64, 1568, 1568, 1536, 96]
    - [11, 3.995]
  - - [1536, 128, 1, 128, 1568, 1568, 1536, 160]
    - [57, 7.301]
  - - [1536, 128, 1, 256, 1568, 1568, 1536, 288]
    - [65, 12.442]
  - - [1536, 128, 1, 512, 1568, 1568, 1536, 544]
    - [65, 19.449]
  - - [1536, 128, 1, 1024, 1568, 1568, 1536, 1056]
    - [63, 26.96]
  - - [1536, 128, 1, 2048, 1568, 1568, 2080, 2080]
    - [63, 33.491]
  - - [1536, 128, 1, 4096, 1568, 1568, 4128, 4128]
    - [55, 38.197]
  - - [1536, 256, 1, 64, 1568, 1568, 1536, 96]
    - [57, 7.037]
  - - [1536, 256, 1, 128, 1568, 1568, 1536, 160]
    - [7, 12.465]
  - - [1536, 256, 1, 256, 1568, 1568, 1536, 288]
    - [68, 19.577]
  - - [1536, 256, 1, 512, 1568, 1568, 1536, 544]
    - [67, 27.636]
  - - [1536, 256, 1, 1024, 1568, 1568, 1536, 1056]
    - [68, 34.841]
  - - [1536, 256, 1, 2048, 1568, 1568, 2080, 2080]
    - [68, 39.887]
  - - [1536, 256, 1, 4096, 1568, 1568, 4128, 4128]
    - [58, 41.646]
  - - [1536, 512, 1, 64, 1568, 1568, 1536, 96]
    - [5, 11.787]
  - - [1536, 512, 1, 128, 1568, 1568, 1536, 160]
    - [27, 20.297]
  - - [1536, 512, 1, 256, 1568, 1568, 1536, 288]
    - [27, 32.201]
  - - [1536, 512, 1, 512, 1568, 1568, 1536, 544]
    - [15, 45.445]
  - - [1536, 512, 1, 1024, 1568, 1568, 1536, 1056]
    - [15, 57.174]
  - - [1536, 512, 1, 2048, 1568, 1568, 2080, 2080]
    - [15, 62.81]
  - - [1536, 512, 1, 4096, 1568, 1568, 4128, 4128]
    - [27, 69.29]
  - - [1536, 1024, 1, 64, 1568, 1568, 1536, 96]
    - [2, 18.0]
  - - [1536, 1024, 1, 128, 1568, 1568, 1536, 160]
    - [2, 29.887]
  - - [1536, 1024, 1, 256, 1568, 1568, 1536, 288]
    - [4, 40.479]
  - - [1536, 1024, 1, 512, 1568, 1568, 1536, 544]
    - [25, 51.421]
  - - [1536, 1024, 1, 1024, 1568, 1568, 1536, 1056]
    - [23, 59.22]
  - - [1536, 1024, 1, 2048, 1568, 1568, 2080, 2080]
    - [16, 64.575]
  - - [1536, 1024, 1, 4096, 1568, 1568, 4128, 4128]
    - [25, 68.299]
  - - [1536, 2048, 1, 64, 1568, 1568, 1536, 96]
    - [25, 24.762]
  - - [1536, 2048, 1, 128, 1568, 1568, 1536, 160]
    - [2, 38.209]
  - - [1536, 2048, 1, 256, 1568, 1568, 1536, 288]
    - [13, 52.62]
  - - [1536, 2048, 1, 512, 1568, 1568, 1536, 544]
    - [13, 62.33]
  - - [1536, 2048, 1, 1024, 1568, 1568, 1536, 1056]
    - [31, 71.544]
  - - [1536, 2048, 1, 2048, 1568, 1568, 2080, 2080]
    - [13, 77.525]
  - - [1536, 2048, 1, 4096, 1568, 1568, 4128, 4128]
    - [13, 81.03]
  - - [1536, 4096, 1, 64, 1568, 1568, 1536, 96]
    - [32, 31.759]
  - - [1536, 4096, 1, 128, 1568, 1568, 1536, 160]
    - [13, 47.207]
  - - [1536, 4096, 1, 256, 1568, 1568, 1536, 288]
    - [25, 59.779]
  - - [1536, 4096, 1, 512, 1568, 1568, 1536, 544]
    - [13, 72.73]
  - - [1536, 4096, 1, 1024, 1568, 1568, 1536, 1056]
    - [25, 81.636]
  - - [1536, 4096, 1, 2048, 1568, 1568, 2080, 2080]
    - [25, 87.148]
  - - [1536, 4096, 1, 4096, 1568, 1568, 4128, 4128]
    - [13, 89.169]
  - - [3072, 64, 1, 64, 3104, 3104, 3072, 96]
    - [2, 3.988]
  - - [3072, 64, 1, 128, 3104, 3104, 3072, 160]
    - [57, 7.317]
  - - [3072, 64, 1, 256, 3104, 3104, 3072, 288]
    - [57, 12.48]
  - - [3072, 64, 1, 512, 3104, 3104, 3072, 544]
    - [65, 19.25]
  - - [3072, 64, 1, 1024, 3104, 3104, 3072, 1056]
    - [65, 26.591]
  - - [3072, 64, 1, 2048, 3104, 3104, 3072, 2080]
    - [63, 32.871]
  - - [3072, 64, 1, 4096, 3104, 3104, 4128, 4128]
    - [73, 34.522]
  - - [3072, 128, 1, 64, 3104, 3104, 3072, 96]
    - [7, 7.098]
  - - [3072, 128, 1, 128, 3104, 3104, 3072, 160]
    - [2, 12.386]
  - - [3072, 128, 1, 256, 3104, 3104, 3072, 288]
    - [7, 19.533]
  - - [3072, 128, 1, 512, 3104, 3104, 3072, 544]
    - [68, 27.736]
  - - [3072, 128, 1, 1024, 3104, 3104, 3072, 1056]
    - [58, 34.666]
  - - [3072, 128, 1, 2048, 3104, 3104, 3072, 2080]
    - [58, 39.713]
  - - [3072, 128, 1, 4096, 3104, 3104, 4128, 4128]
    - [68, 41.61]
  - - [3072, 256, 1, 64, 3104, 3104, 3072, 96]
    - [11, 11.847]
  - - [3072, 256, 1, 128, 3104, 3104, 3072, 160]
    - [21, 20.345]
  - - [3072, 256, 1, 256, 3104, 3104, 3072, 288]
    - [14, 32.119]
  - - [3072, 256, 1, 512, 3104, 3104, 3072, 544]
    - [27, 45.394]
  - - [3072, 256, 1, 1024, 3104, 3104, 3072, 1056]
    - [27, 57.327]
  - - [3072, 256, 1, 2048, 3104, 3104, 3072, 2080]
    - [15, 63.057]
  - - [3072, 256, 1, 4096, 3104, 3104, 4128, 4128]
    - [27, 69.354]
  - - [3072, 512, 1, 64, 3104, 3104, 3072, 96]
    - [2, 18.062]
  - - [3072, 512, 1, 128, 3104, 3104, 3072, 160]
    - [5, 29.884]
  - - [3072, 512, 1, 256, 3104, 3104, 3072, 288]
    - [1, 40.432]
  - - [3072, 512, 1, 512, 3104, 3104, 3072, 544]
    - [25, 51.268]
  - - [3072, 512, 1, 1024, 3104, 3104, 3072, 1056]
    - [13, 57.887]
  - - [3072, 512, 1, 2048, 3104, 3104, 3072, 2080]
    - [18, 63.762]
  - - [3072, 512, 1, 4096, 3104, 3104, 4128, 4128]
    - [25, 68.091]
  - - [3072, 1024, 1, 64, 3104, 3104, 3072, 96]
    - [25, 24.734]
  - - [3072, 1024, 1, 128, 3104, 3104, 3072, 160]
    - [2, 38.213]
  - - [3072, 1024, 1, 256, 3104, 3104, 3072, 288]
    - [13, 52.574]
  - - [3072, 1024, 1, 512, 3104, 3104, 3072, 544]
    - [13, 62.165]
  - - [3072, 1024, 1, 1024, 3104, 3104, 3072, 1056]
    - [13, 71.546]
  - - [3072, 1024, 1, 2048, 3104, 3104, 3072, 2080]
    - [25, 77.496]
  - - [3072, 1024, 1, 4096, 3104, 3104, 4128, 4128]
    - [13, 81.051]
  - - [3072, 2048, 1, 64, 3104, 3104, 3072, 96]
    - [29, 31.826]
  - - [3072, 2048, 1, 128, 3104, 3104, 3072, 160]
    - [25, 47.267]
  - - [3072, 2048, 1, 256, 3104, 3104, 3072, 288]
    - [25, 59.813]
  - - [3072, 2048, 1, 512, 3104, 3104, 3072, 544]
    - [25, 72.701]
  - - [3072, 2048, 1, 1024, 3104, 3104, 3072, 1056]
    - [25, 81.669]
  - - [3072, 2048, 1, 2048, 3104, 3104, 3072, 2080]
    - [25, 87.145]
  - - [3072, 2048, 1, 4096, 3104, 3104, 4128, 4128]
    - [25, 89.231]
  - - [3072, 4096, 1, 64, 3104, 3104, 3072, 96]
    - [31, 35.858]
  - - [3072, 4096, 1, 128, 3104, 3104, 3072, 160]
    - [13, 50.178]
  - - [3072, 4096, 1, 256, 3104, 3104, 3072, 288]
    - [13, 65.342]
  - - [3072, 4096, 1, 512, 3104, 3104, 3072, 544]
    - [25, 77.251]
  - - [3072, 4096, 1, 1024, 3104, 3104, 3072, 1056]
    - [25, 84.851]
  - - [3072, 4096, 1, 2048, 3104, 3104, 3072, 2080]
    - [25, 88.66]
  - - [3072, 4096, 1, 4096, 3104, 3104, 4128, 4128]
    - [25, 91.355]
- null
- null
- DeviceEfficiency
