library/src/blas3/Tensile/Logic/asm_full/navi32/navi32_Cijk_Alik_Bjlk_I8II_BH_GB.yaml
- {MinimumRequiredVersion: 4.35.0}
- navi32
- gfx1101
- [Device 73f0]
    SolutionIndex: 0
    SolutionNameMin: Cijk_Alik_Bjlk_I8II_BH_MT32x32x16_MI16x16x16x1_SN_1LDSB1_AMAS0_GRVW4_IU1_LPA0_LPB0_SIA2_SU0_SUS0_SVW1_TT1_16_VW1_WGM8
    SolutionIndex: 1
    SolutionNameMin: Cijk_Alik_Bjlk_I8II_BH_MT32x32x16_MI16x16x16x1_SN_1LDSB1_AMAS0_GRVW8_IU1_LPA0_LPB0_SIA2_SU0_SUS0_SVW1_TT1_16_VW1_WGM8
    SolutionIndex: 2
    SolutionNameMin: Cijk_Alik_Bjlk_I8II_BH_MT64x64x16_MI16x16x16x1_SN_1LDSB0_AMAS0_GRVW8_IU1_LPA0_LPB0_SIA1_SU0_SUS0_SVW1_TT2_32_VW1_WGM4
    SolutionIndex: 3
    SolutionNameMin: Cijk_Alik_Bjlk_I8II_BH_MT64x64x16_MI16x16x16x1_SN_1LDSB1_AMAS0_GRVW4_IU1_LPA0_LPB0_SIA2_SU0_SUS0_SVW1_TT2_32_VW1_WGM4
    SolutionIndex: 4
    SolutionNameMin: Cijk_Alik_Bjlk_I8II_BH_MT64x64x16_MI16x16x16x1_SN_1LDSB1_AMAS0_GRVW8_IU1_LPA0_LPB0_SIA2_SU0_SUS0_SVW1_TT2_32_VW1_WGM4
    SolutionIndex: 5
    SolutionNameMin: Cijk_Alik_Bjlk_I8II_BH_MT64x64x16_MI16x16x16x1_SN_1LDSB1_AMAS0_GRVW8_IU1_LPA0_LPB8_SIA2_SU0_SUS0_SVW1_TT2_32_VW1_WGM4
    SolutionIndex: 6
    SolutionNameMin: Cijk_Alik_Bjlk_I8II_BH_MT64x64x16_MI16x16x16x1_SN_1LDSB0_AMAS0_GRVW8_IU1_LPA0_LPB0_SIA1_SU32_SUS128_SVW1_TT2_32_VW1_WGM4
    SolutionIndex: 7
    SolutionNameMin: Cijk_Alik_Bjlk_I8II_BH_MT64x64x16_MI16x16x16x1_SN_1LDSB1_AMAS0_GRVW8_IU1_LPA0_LPB0_SIA2_SU32_SUS128_SVW1_TT2_32_VW1_WGM4
    SolutionIndex: 8
    SolutionNameMin: Cijk_Alik_Bjlk_I8II_BH_MT64x64x16_MI16x16x16x1_SN_1LDSB0_AMAS0_GRVW8_IU1_LPA0_LPB0_SIA1_SU32_SUS256_SVW1_TT2_32_VW1_WGM4
    SolutionIndex: 9
    SolutionNameMin: Cijk_Alik_Bjlk_I8II_BH_MT64x64x16_MI16x16x16x1_SN_1LDSB1_AMAS0_GRVW8_IU1_LPA0_LPB0_SIA2_SU32_SUS256_SVW1_TT2_32_VW1_WGM4
    SolutionIndex: 10
    SolutionNameMin: Cijk_Alik_Bjlk_I8II_BH_MT64x64x16_MI16x16x16x1_SN_1LDSB1_AMAS3_GRVW8_IU1_LPA0_LPB0_SIA2_SU32_SUS256_SVW2_TT2_32_VW2_WGM4
    SolutionIndex: 11
    SolutionNameMin: Cijk_Alik_Bjlk_I8II_BH_MT64x64x16_MI16x16x16x1_SN_1LDSB0_AMAS0_GRVW4_IU1_LPA0_LPB0_SIA1_SU0_SUS0_SVW1_TT2_32_VW1_WGM8
    SolutionIndex: 12
    SolutionNameMin: Cijk_Alik_Bjlk_I8II_BH_MT64x64x16_MI16x16x16x1_SN_1LDSB0_AMAS0_GRVW4_IU1_LPA0_LPB8_SIA1_SU0_SUS0_SVW1_TT2_32_VW1_WGM8
    SolutionIndex: 13
    SolutionNameMin: Cijk_Alik_Bjlk_I8II_BH_MT64x64x16_MI16x16x16x1_SN_1LDSB0_AMAS0_GRVW8_IU1_LPA0_LPB0_SIA1_SU0_SUS0_SVW1_TT2_32_VW1_WGM8
    SolutionIndex: 14
    SolutionNameMin: Cijk_Alik_Bjlk_I8II_BH_MT64x64x16_MI16x16x16x1_SN_1LDSB1_AMAS0_GRVW4_IU1_LPA0_LPB0_SIA2_SU0_SUS0_SVW1_TT2_32_VW1_WGM8
    SolutionIndex: 15
    SolutionNameMin: Cijk_Alik_Bjlk_I8II_BH_MT64x64x16_MI16x16x16x1_SN_1LDSB1_AMAS0_GRVW8_IU1_LPA0_LPB0_SIA2_SU0_SUS0_SVW1_TT2_32_VW1_WGM8
    SolutionIndex: 16
    SolutionNameMin: Cijk_Alik_Bjlk_I8II_BH_MT64x64x16_MI16x16x16x1_SN_1LDSB1_AMAS0_GRVW8_IU1_LPA0_LPB8_SIA2_SU0_SUS0_SVW1_TT2_32_VW1_WGM8
    SolutionIndex: 17
    SolutionNameMin: Cijk_Alik_Bjlk_I8II_BH_MT64x64x16_MI16x16x16x1_SN_1LDSB0_AMAS0_GRVW8_IU1_LPA0_LPB0_SIA1_SU32_SUS128_SVW1_TT2_32_VW1_WGM8
    SolutionIndex: 18
    SolutionNameMin: Cijk_Alik_Bjlk_I8II_BH_MT64x64x16_MI16x16x16x1_SN_1LDSB1_AMAS0_GRVW8_IU1_LPA0_LPB0_SIA2_SU32_SUS128_SVW1_TT2_32_VW1_WGM8
    SolutionIndex: 19
    SolutionNameMin: Cijk_Alik_Bjlk_I8II_BH_MT64x64x16_MI16x16x16x1_SN_1LDSB0_AMAS0_GRVW8_IU1_LPA0_LPB0_SIA1_SU32_SUS256_SVW1_TT2_32_VW1_WGM8
    SolutionIndex: 20
    SolutionNameMin: Cijk_Alik_Bjlk_I8II_BH_MT64x64x16_MI16x16x16x1_SN_1LDSB1_AMAS0_GRVW4_IU1_LPA0_LPB0_SIA2_SU32_SUS256_SVW1_TT2_32_VW1_WGM8
    SolutionIndex: 21
    SolutionNameMin: Cijk_Alik_Bjlk_I8II_BH_MT64x64x16_MI16x16x16x1_SN_1LDSB1_AMAS0_GRVW8_IU1_LPA0_LPB0_SIA2_SU32_SUS256_SVW1_TT2_32_VW1_WGM8
    SolutionIndex: 22
    SolutionNameMin: Cijk_Alik_Bjlk_I8II_BH_MT64x64x16_MI16x16x16x1_SN_1LDSB1_AMAS3_GRVW8_IU1_LPA0_LPB0_SIA2_SU32_SUS256_SVW2_TT2_32_VW2_WGM8
    SolutionIndex: 23
    SolutionNameMin: Cijk_Alik_Bjlk_I8II_BH_MT128x128x16_MI16x16x16x1_SN_1LDSB0_AMAS0_GRVW8_IU1_LPA0_LPB0_SIA1_SU0_SUS0_SVW1_TT4_64_VW1_WGM4
    SolutionIndex: 24
    SolutionNameMin: Cijk_Alik_Bjlk_I8II_BH_MT128x128x16_MI16x16x16x1_SN_1LDSB0_AMAS0_GRVW8_IU1_LPA0_LPB8_SIA1_SU0_SUS0_SVW1_TT4_64_VW1_WGM4
    SolutionIndex: 25
    SolutionNameMin: Cijk_Alik_Bjlk_I8II_BH_MT128x128x16_MI16x16x16x1_SN_1LDSB0_AMAS0_GRVW8_IU1_LPA0_LPB0_SIA1_SU32_SUS128_SVW1_TT4_64_VW1_WGM4
    SolutionIndex: 26
    SolutionNameMin: Cijk_Alik_Bjlk_I8II_BH_MT128x128x16_MI16x16x16x1_SN_1LDSB0_AMAS0_GRVW8_IU1_LPA0_LPB8_SIA1_SU32_SUS128_SVW1_TT4_64_VW1_WGM4
    SolutionIndex: 27
    SolutionNameMin: Cijk_Alik_Bjlk_I8II_BH_MT128x128x16_MI16x16x16x1_SN_1LDSB1_AMAS0_GRVW4_IU1_LPA0_LPB0_SIA2_SU32_SUS128_SVW1_TT4_64_VW1_WGM4
    SolutionIndex: 28
    SolutionNameMin: Cijk_Alik_Bjlk_I8II_BH_MT128x128x16_MI16x16x16x1_SN_1LDSB1_AMAS0_GRVW4_IU1_LPA0_LPB0_SIA2_SU32_SUS256_SVW1_TT4_64_VW1_WGM4
    SolutionIndex: 29
    SolutionNameMin: Cijk_Alik_Bjlk_I8II_BH_MT128x128x16_MI16x16x16x1_SN_1LDSB1_AMAS0_GRVW4_IU1_LPA0_LPB8_SIA2_SU32_SUS256_SVW1_TT4_64_VW1_WGM4
    SolutionIndex: 30
    SolutionNameMin: Cijk_Alik_Bjlk_I8II_BH_MT128x128x16_MI16x16x16x1_SN_1LDSB0_AMAS0_GRVW8_IU1_LPA0_LPB0_SIA1_SU0_SUS0_SVW1_TT4_64_VW1_WGM8
    SolutionIndex: 31
    SolutionNameMin: Cijk_Alik_Bjlk_I8II_BH_MT128x128x16_MI16x16x16x1_SN_1LDSB0_AMAS0_GRVW8_IU1_LPA0_LPB8_SIA1_SU0_SUS0_SVW1_TT4_64_VW1_WGM8
    SolutionIndex: 32
    SolutionNameMin: Cijk_Alik_Bjlk_I8II_BH_MT128x128x16_MI16x16x16x1_SN_1LDSB0_AMAS0_GRVW8_IU1_LPA0_LPB0_SIA1_SU32_SUS128_SVW1_TT4_64_VW1_WGM8
    SolutionIndex: 33
    SolutionNameMin: Cijk_Alik_Bjlk_I8II_BH_MT128x128x16_MI16x16x16x1_SN_1LDSB0_AMAS0_GRVW8_IU1_LPA0_LPB8_SIA1_SU32_SUS128_SVW1_TT4_64_VW1_WGM8
    SolutionIndex: 34
    SolutionNameMin: Cijk_Alik_Bjlk_I8II_BH_MT128x128x16_MI16x16x16x1_SN_1LDSB1_AMAS0_GRVW4_IU1_LPA0_LPB8_SIA2_SU32_SUS128_SVW1_TT4_64_VW1_WGM8
    SolutionIndex: 35
    SolutionNameMin: Cijk_Alik_Bjlk_I8II_BH_MT128x128x16_MI16x16x16x1_SN_1LDSB0_AMAS0_GRVW8_IU1_LPA0_LPB0_SIA1_SU32_SUS256_SVW1_TT4_64_VW1_WGM8
    SolutionIndex: 36
    SolutionNameMin: Cijk_Alik_Bjlk_I8II_BH_MT128x128x16_MI16x16x16x1_SN_1LDSB0_AMAS0_GRVW8_IU1_LPA0_LPB8_SIA1_SU32_SUS256_SVW1_TT4_64_VW1_WGM8
    SolutionIndex: 37
    SolutionNameMin: Cijk_Alik_Bjlk_I8II_BH_MT128x128x16_MI16x16x16x1_SN_1LDSB1_AMAS0_GRVW4_IU1_LPA0_LPB0_SIA2_SU32_SUS256_SVW1_TT4_64_VW1_WGM8
    SolutionIndex: 38
    SolutionNameMin: Cijk_Alik_Bjlk_I8II_BH_MT128x128x16_MI16x16x16x1_SN_1LDSB1_AMAS0_GRVW4_IU1_LPA0_LPB8_SIA2_SU32_SUS256_SVW1_TT4_64_VW1_WGM8
    SolutionIndex: 39
    SolutionNameMin: Cijk_Alik_Bjlk_I8II_BH_MT32x32x32_MI16x16x16x1_SN_1LDSB0_AMAS0_GRVW4_IU1_LPA0_LPB8_SIA1_SU0_SUS0_SVW1_TT1_16_VW1_WGM4
    SolutionIndex: 40
    SolutionNameMin: Cijk_Alik_Bjlk_I8II_BH_MT32x32x32_MI16x16x16x1_SN_1LDSB0_AMAS0_GRVW8_IU1_LPA0_LPB0_SIA1_SU0_SUS0_SVW1_TT1_16_VW1_WGM4
    SolutionIndex: 41
    SolutionNameMin: Cijk_Alik_Bjlk_I8II_BH_MT32x32x32_MI16x16x16x1_SN_1LDSB1_AMAS0_GRVW4_IU2_LPA0_LPB0_SIA2_SU0_SUS0_SVW1_TT1_16_VW1_WGM4
    SolutionIndex: 42
    SolutionNameMin: Cijk_Alik_Bjlk_I8II_BH_MT32x32x32_MI16x16x16x1_SN_1LDSB1_AMAS0_GRVW4_IU2_LPA0_LPB8_SIA2_SU0_SUS0_SVW1_TT1_16_VW1_WGM4
    SolutionIndex: 43
    SolutionNameMin: Cijk_Alik_Bjlk_I8II_BH_MT32x32x32_MI16x16x16x1_SN_1LDSB1_AMAS0_GRVW8_IU2_LPA0_LPB0_SIA2_SU0_SUS0_SVW1_TT1_16_VW1_WGM4
    SolutionIndex: 44
    SolutionNameMin: Cijk_Alik_Bjlk_I8II_BH_MT32x32x32_MI16x16x16x1_SN_1LDSB1_AMAS0_GRVW8_IU2_LPA0_LPB8_SIA2_SU0_SUS0_SVW1_TT1_16_VW1_WGM4
    SolutionIndex: 45
    SolutionNameMin: Cijk_Alik_Bjlk_I8II_BH_MT32x32x32_MI16x16x16x1_SN_1LDSB0_AMAS0_GRVW4_IU1_LPA0_LPB0_SIA3_SU0_SUS0_SVW1_TT1_16_VW1_WGM4
    SolutionIndex: 46
    SolutionNameMin: Cijk_Alik_Bjlk_I8II_BH_MT32x32x32_MI16x16x16x1_SN_1LDSB0_AMAS0_GRVW8_IU1_LPA0_LPB0_SIA3_SU0_SUS0_SVW1_TT1_16_VW1_WGM4
    SolutionIndex: 47
    SolutionNameMin: Cijk_Alik_Bjlk_I8II_BH_MT32x32x32_MI16x16x16x1_SN_1LDSB0_AMAS0_GRVW8_IU1_LPA0_LPB8_SIA3_SU0_SUS0_SVW1_TT1_16_VW1_WGM4
    SolutionIndex: 48
    SolutionNameMin: Cijk_Alik_Bjlk_I8II_BH_MT32x32x32_MI16x16x16x1_SN_1LDSB0_AMAS0_GRVW8_IU1_LPA0_LPB0_SIA1_SU32_SUS128_SVW1_TT1_16_VW1_WGM4
    SolutionIndex: 49
    SolutionNameMin: Cijk_Alik_Bjlk_I8II_BH_MT32x32x32_MI16x16x16x1_SN_1LDSB1_AMAS0_GRVW4_IU2_LPA0_LPB8_SIA2_SU32_SUS128_SVW1_TT1_16_VW1_WGM4
    SolutionIndex: 50
    SolutionNameMin: Cijk_Alik_Bjlk_I8II_BH_MT32x32x32_MI16x16x16x1_SN_1LDSB1_AMAS0_GRVW8_IU2_LPA0_LPB0_SIA2_SU32_SUS128_SVW1_TT1_16_VW1_WGM4
    SolutionIndex: 51
    SolutionNameMin: Cijk_Alik_Bjlk_I8II_BH_MT32x32x32_MI16x16x16x1_SN_1LDSB1_AMAS0_GRVW8_IU2_LPA0_LPB8_SIA2_SU32_SUS128_SVW1_TT1_16_VW1_WGM4
    SolutionIndex: 52
    SolutionNameMin: Cijk_Alik_Bjlk_I8II_BH_MT32x32x32_MI16x16x16x1_SN_1LDSB1_AMAS0_GRVW8_IU2_LPA0_LPB0_SIA2_SU32_SUS256_SVW1_TT1_16_VW1_WGM4
    SolutionIndex: 53
    SolutionNameMin: Cijk_Alik_Bjlk_I8II_BH_MT32x32x32_MI16x16x16x1_SN_1LDSB1_AMAS0_GRVW8_IU2_LPA0_LPB8_SIA2_SU32_SUS256_SVW1_TT1_16_VW1_WGM4
    SolutionIndex: 54
    SolutionNameMin: Cijk_Alik_Bjlk_I8II_BH_MT32x32x32_MI16x16x16x1_SN_1LDSB0_AMAS0_GRVW4_IU1_LPA0_LPB0_SIA1_SU0_SUS0_SVW1_TT1_16_VW1_WGM8
    SolutionIndex: 55
    SolutionNameMin: Cijk_Alik_Bjlk_I8II_BH_MT32x32x32_MI16x16x16x1_SN_1LDSB0_AMAS0_GRVW4_IU1_LPA0_LPB8_SIA1_SU0_SUS0_SVW1_TT1_16_VW1_WGM8
    SolutionIndex: 56
    SolutionNameMin: Cijk_Alik_Bjlk_I8II_BH_MT32x32x32_MI16x16x16x1_SN_1LDSB0_AMAS0_GRVW8_IU1_LPA0_LPB0_SIA1_SU0_SUS0_SVW1_TT1_16_VW1_WGM8
    SolutionIndex: 57
    SolutionNameMin: Cijk_Alik_Bjlk_I8II_BH_MT32x32x32_MI16x16x16x1_SN_1LDSB0_AMAS0_GRVW8_IU1_LPA0_LPB8_SIA1_SU0_SUS0_SVW1_TT1_16_VW1_WGM8
    SolutionIndex: 58
    SolutionNameMin: Cijk_Alik_Bjlk_I8II_BH_MT32x32x32_MI16x16x16x1_SN_1LDSB1_AMAS0_GRVW4_IU2_LPA0_LPB0_SIA2_SU0_SUS0_SVW1_TT1_16_VW1_WGM8
    SolutionIndex: 59
    SolutionNameMin: Cijk_Alik_Bjlk_I8II_BH_MT32x32x32_MI16x16x16x1_SN_1LDSB1_AMAS0_GRVW4_IU2_LPA0_LPB8_SIA2_SU0_SUS0_SVW1_TT1_16_VW1_WGM8
    SolutionIndex: 60
    SolutionNameMin: Cijk_Alik_Bjlk_I8II_BH_MT32x32x32_MI16x16x16x1_SN_1LDSB1_AMAS0_GRVW8_IU2_LPA0_LPB0_SIA2_SU0_SUS0_SVW1_TT1_16_VW1_WGM8
    SolutionIndex: 61
    SolutionNameMin: Cijk_Alik_Bjlk_I8II_BH_MT32x32x32_MI16x16x16x1_SN_1LDSB1_AMAS0_GRVW8_IU2_LPA0_LPB8_SIA2_SU0_SUS0_SVW1_TT1_16_VW1_WGM8
    SolutionIndex: 62
    SolutionNameMin: Cijk_Alik_Bjlk_I8II_BH_MT32x32x32_MI16x16x16x1_SN_1LDSB0_AMAS0_GRVW4_IU1_LPA0_LPB0_SIA3_SU0_SUS0_SVW1_TT1_16_VW1_WGM8
    SolutionIndex: 63
    SolutionNameMin: Cijk_Alik_Bjlk_I8II_BH_MT32x32x32_MI16x16x16x1_SN_1LDSB0_AMAS0_GRVW8_IU1_LPA0_LPB0_SIA3_SU0_SUS0_SVW1_TT1_16_VW1_WGM8
    SolutionIndex: 64
    SolutionNameMin: Cijk_Alik_Bjlk_I8II_BH_MT32x32x32_MI16x16x16x1_SN_1LDSB1_AMAS0_GRVW4_IU2_LPA0_LPB8_SIA2_SU32_SUS128_SVW1_TT1_16_VW1_WGM8
    SolutionIndex: 65
    SolutionNameMin: Cijk_Alik_Bjlk_I8II_BH_MT32x32x32_MI16x16x16x1_SN_1LDSB1_AMAS0_GRVW8_IU2_LPA0_LPB0_SIA2_SU32_SUS128_SVW1_TT1_16_VW1_WGM8
    SolutionIndex: 66
    SolutionNameMin: Cijk_Alik_Bjlk_I8II_BH_MT32x32x32_MI16x16x16x1_SN_1LDSB1_AMAS0_GRVW8_IU2_LPA0_LPB8_SIA2_SU32_SUS128_SVW1_TT1_16_VW1_WGM8
    SolutionIndex: 67
    SolutionNameMin: Cijk_Alik_Bjlk_I8II_BH_MT32x32x32_MI16x16x16x1_SN_1LDSB0_AMAS0_GRVW8_IU1_LPA0_LPB0_SIA1_SU32_SUS256_SVW1_TT1_16_VW1_WGM8
    SolutionIndex: 68
    SolutionNameMin: Cijk_Alik_Bjlk_I8II_BH_MT32x32x32_MI16x16x16x1_SN_1LDSB1_AMAS0_GRVW4_IU2_LPA0_LPB0_SIA2_SU32_SUS256_SVW1_TT1_16_VW1_WGM8
    SolutionIndex: 69
    SolutionNameMin: Cijk_Alik_Bjlk_I8II_BH_MT32x32x32_MI16x16x16x1_SN_1LDSB1_AMAS0_GRVW8_IU2_LPA0_LPB0_SIA2_SU32_SUS256_SVW1_TT1_16_VW1_WGM8
    SolutionIndex: 70
    SolutionNameMin: Cijk_Alik_Bjlk_I8II_BH_MT32x32x32_MI16x16x16x1_SN_1LDSB1_AMAS0_GRVW8_IU2_LPA0_LPB8_SIA2_SU32_SUS256_SVW1_TT1_16_VW1_WGM8
    SolutionIndex: 71
    SolutionNameMin: Cijk_Alik_Bjlk_I8II_BH_MT64x64x32_MI16x16x16x1_SN_1LDSB0_AMAS0_GRVW8_IU1_LPA0_LPB0_SIA1_SU0_SUS0_SVW1_TT2_32_VW1_WGM4
    SolutionIndex: 72
    SolutionNameMin: Cijk_Alik_Bjlk_I8II_BH_MT64x64x32_MI16x16x16x1_SN_1LDSB0_AMAS0_GRVW8_IU1_LPA0_LPB8_SIA1_SU0_SUS0_SVW1_TT2_32_VW1_WGM4
    SolutionIndex: 73
    SolutionNameMin: Cijk_Alik_Bjlk_I8II_BH_MT64x64x32_MI16x16x16x1_SN_1LDSB1_AMAS0_GRVW8_IU2_LPA0_LPB0_SIA2_SU0_SUS0_SVW1_TT2_32_VW1_WGM4
    SolutionIndex: 74
    SolutionNameMin: Cijk_Alik_Bjlk_I8II_BH_MT64x64x32_MI16x16x16x1_SN_1LDSB1_AMAS0_GRVW8_IU2_LPA0_LPB8_SIA2_SU0_SUS0_SVW1_TT2_32_VW1_WGM4
    SolutionIndex: 75
    SolutionNameMin: Cijk_Alik_Bjlk_I8II_BH_MT64x64x32_MI16x16x16x1_SN_1LDSB0_AMAS0_GRVW8_IU1_LPA0_LPB0_SIA1_SU32_SUS128_SVW1_TT2_32_VW1_WGM4
    SolutionIndex: 76
    SolutionNameMin: Cijk_Alik_Bjlk_I8II_BH_MT64x64x32_MI16x16x16x1_SN_1LDSB1_AMAS0_GRVW8_IU2_LPA0_LPB8_SIA2_SU32_SUS128_SVW1_TT2_32_VW1_WGM4
    SolutionIndex: 77
    SolutionNameMin: Cijk_Alik_Bjlk_I8II_BH_MT64x64x32_MI16x16x16x1_SN_1LDSB0_AMAS0_GRVW8_IU1_LPA0_LPB0_SIA1_SU32_SUS256_SVW1_TT2_32_VW1_WGM4
    SolutionIndex: 78
    SolutionNameMin: Cijk_Alik_Bjlk_I8II_BH_MT64x64x32_MI16x16x16x1_SN_1LDSB0_AMAS0_GRVW8_IU1_LPA0_LPB0_SIA1_SU0_SUS0_SVW1_TT2_32_VW1_WGM8
    SolutionIndex: 79
    SolutionNameMin: Cijk_Alik_Bjlk_I8II_BH_MT64x64x32_MI16x16x16x1_SN_1LDSB0_AMAS0_GRVW8_IU1_LPA0_LPB8_SIA1_SU0_SUS0_SVW1_TT2_32_VW1_WGM8
    SolutionIndex: 80
    SolutionNameMin: Cijk_Alik_Bjlk_I8II_BH_MT64x64x32_MI16x16x16x1_SN_1LDSB1_AMAS0_GRVW8_IU2_LPA0_LPB0_SIA2_SU0_SUS0_SVW1_TT2_32_VW1_WGM8
    SolutionIndex: 81
    SolutionNameMin: Cijk_Alik_Bjlk_I8II_BH_MT64x64x32_MI16x16x16x1_SN_1LDSB1_AMAS0_GRVW8_IU2_LPA0_LPB8_SIA2_SU0_SUS0_SVW1_TT2_32_VW1_WGM8
    SolutionIndex: 82
    SolutionNameMin: Cijk_Alik_Bjlk_I8II_BH_MT64x64x32_MI16x16x16x1_SN_1LDSB0_AMAS0_GRVW8_IU1_LPA0_LPB0_SIA1_SU32_SUS128_SVW1_TT2_32_VW1_WGM8
    SolutionIndex: 83
    SolutionNameMin: Cijk_Alik_Bjlk_I8II_BH_MT64x64x32_MI16x16x16x1_SN_1LDSB0_AMAS0_GRVW8_IU1_LPA0_LPB8_SIA1_SU32_SUS128_SVW1_TT2_32_VW1_WGM8
    SolutionIndex: 84
    SolutionNameMin: Cijk_Alik_Bjlk_I8II_BH_MT64x64x32_MI16x16x16x1_SN_1LDSB1_AMAS0_GRVW8_IU2_LPA0_LPB0_SIA2_SU32_SUS128_SVW1_TT2_32_VW1_WGM8
    SolutionIndex: 85
    SolutionNameMin: Cijk_Alik_Bjlk_I8II_BH_MT64x64x32_MI16x16x16x1_SN_1LDSB0_AMAS0_GRVW8_IU1_LPA0_LPB0_SIA1_SU32_SUS256_SVW1_TT2_32_VW1_WGM8
- - - [64, 64, 1, 64, 96, 96, 96, 96]
    - [43, 0.091]
  - - [64, 64, 1, 128, 96, 96, 160, 160]
    - [65, 0.176]
  - - [64, 64, 1, 256, 96, 96, 288, 288]
    - [50, 0.322]
  - - [64, 64, 1, 512, 96, 96, 544, 544]
    - [53, 0.554]
  - - [64, 64, 1, 1024, 96, 96, 1056, 1056]
    - [65, 0.877]
  - - [64, 64, 1, 2048, 96, 96, 2080, 2080]
    - [59, 1.229]
  - - [64, 64, 1, 4096, 96, 96, 4128, 4128]
    - [59, 1.533]
  - - [64, 128, 1, 64, 96, 96, 96, 128]
    - [58, 0.188]
  - - [64, 128, 1, 128, 96, 96, 160, 160]
    - [50, 0.36]
  - - [64, 128, 1, 256, 96, 96, 288, 288]
    - [41, 0.663]
  - - [64, 128, 1, 512, 96, 96, 544, 544]
    - [70, 1.14]
  - - [64, 128, 1, 1024, 96, 96, 1056, 1056]
    - [59, 1.779]
  - - [64, 128, 1, 2048, 96, 96, 2080, 2080]
    - [59, 2.48]
  - - [64, 128, 1, 4096, 96, 96, 4128, 4128]
    - [58, 3.09]
  - - [64, 256, 1, 64, 96, 96, 96, 256]
    - [55, 0.377]
  - - [64, 256, 1, 128, 96, 96, 160, 256]
    - [41, 0.728]
  - - [64, 256, 1, 256, 96, 96, 288, 288]
    - [65, 1.338]
  - - [64, 256, 1, 512, 96, 96, 544, 544]
    - [42, 2.295]
  - - [64, 256, 1, 1024, 96, 96, 1056, 1056]
    - [58, 3.578]
  - - [64, 256, 1, 2048, 96, 96, 2080, 2080]
    - [41, 4.977]
  - - [64, 256, 1, 4096, 96, 96, 4128, 4128]
    - [58, 6.192]
  - - [64, 512, 1, 64, 96, 96, 96, 512]
    - [44, 0.755]
  - - [64, 512, 1, 128, 96, 96, 160, 512]
    - [60, 1.419]
  - - [64, 512, 1, 256, 96, 96, 288, 512]
    - [69, 2.583]
  - - [64, 512, 1, 512, 96, 96, 544, 544]
    - [58, 4.352]
  - - [64, 512, 1, 1024, 96, 96, 1056, 1056]
    - [58, 6.601]
  - - [64, 512, 1, 2048, 96, 96, 2080, 2080]
    - [41, 8.923]
  - - [64, 512, 1, 4096, 96, 96, 4128, 4128]
    - [41, 10.785]
  - - [64, 1024, 1, 64, 96, 96, 96, 1024]
    - [47, 1.459]
  - - [64, 1024, 1, 128, 96, 96, 160, 1024]
    - [60, 2.72]
  - - [64, 1024, 1, 256, 96, 96, 288, 1024]
    - [45, 4.79]
  - - [64, 1024, 1, 512, 96, 96, 544, 1024]
    - [39, 7.715]
  - - [64, 1024, 1, 1024, 96, 96, 1056, 1056]
    - [60, 11.156]
  - - [64, 1024, 1, 2048, 96, 96, 2080, 2080]
    - [43, 14.285]
  - - [64, 1024, 1, 4096, 96, 96, 4128, 4128]
    - [43, 16.579]
  - - [64, 2048, 1, 64, 96, 96, 96, 2048]
    - [76, 2.786]
  - - [64, 2048, 1, 128, 96, 96, 160, 2048]
    - [4, 5.132]
  - - [64, 2048, 1, 256, 96, 96, 288, 2048]
    - [15, 8.857]
  - - [64, 2048, 1, 512, 96, 96, 544, 2048]
    - [4, 13.866]
  - - [64, 2048, 1, 1024, 96, 96, 1056, 2048]
    - [3, 19.23]
  - - [64, 2048, 1, 2048, 96, 96, 2080, 2080]
    - [15, 23.869]
  - - [64, 2048, 1, 4096, 96, 96, 4128, 4128]
    - [15, 27.111]
  - - [64, 4096, 1, 64, 96, 96, 96, 4096]
    - [18, 5.235]
  - - [64, 4096, 1, 128, 96, 96, 160, 4096]
    - [16, 9.39]
  - - [64, 4096, 1, 256, 96, 96, 288, 4096]
    - [16, 15.651]
  - - [64, 4096, 1, 512, 96, 96, 544, 4096]
    - [21, 23.464]
  - - [64, 4096, 1, 1024, 96, 96, 1056, 4096]
    - [18, 31.096]
  - - [64, 4096, 1, 2048, 96, 96, 2080, 4096]
    - [21, 37.224]
  - - [64, 4096, 1, 4096, 96, 96, 4128, 4128]
    - [7, 39.146]
  - - [128, 64, 1, 64, 160, 160, 96, 96]
    - [64, 0.187]
  - - [128, 64, 1, 128, 160, 160, 160, 160]
    - [59, 0.357]
  - - [128, 64, 1, 256, 160, 160, 288, 288]
    - [65, 0.662]
  - - [128, 64, 1, 512, 160, 160, 544, 544]
    - [65, 1.136]
  - - [128, 64, 1, 1024, 160, 160, 1056, 1056]
    - [52, 1.784]
  - - [128, 64, 1, 2048, 160, 160, 2080, 2080]
    - [42, 2.481]
  - - [128, 64, 1, 4096, 160, 160, 4128, 4128]
    - [59, 3.073]
  - - [128, 128, 1, 64, 160, 160, 96, 128]
    - [43, 0.378]
  - - [128, 128, 1, 128, 160, 160, 160, 160]
    - [43, 0.723]
  - - [128, 128, 1, 256, 160, 160, 288, 288]
    - [68, 1.333]
  - - [128, 128, 1, 512, 160, 160, 544, 544]
    - [49, 2.295]
  - - [128, 128, 1, 1024, 160, 160, 1056, 1056]
    - [64, 3.591]
  - - [128, 128, 1, 2048, 160, 160, 2080, 2080]
    - [42, 4.99]
  - - [128, 128, 1, 4096, 160, 160, 4128, 4128]
    - [59, 6.191]
  - - [128, 256, 1, 64, 160, 160, 96, 256]
    - [57, 0.752]
  - - [128, 256, 1, 128, 160, 160, 160, 256]
    - [66, 1.424]
  - - [128, 256, 1, 256, 160, 160, 288, 288]
    - [41, 2.583]
  - - [128, 256, 1, 512, 160, 160, 544, 544]
    - [43, 4.363]
  - - [128, 256, 1, 1024, 160, 160, 1056, 1056]
    - [58, 6.627]
  - - [128, 256, 1, 2048, 160, 160, 2080, 2080]
    - [60, 8.927]
  - - [128, 256, 1, 4096, 160, 160, 4128, 4128]
    - [58, 10.789]
  - - [128, 512, 1, 64, 160, 160, 96, 512]
    - [63, 1.46]
  - - [128, 512, 1, 128, 160, 160, 160, 512]
    - [46, 2.699]
  - - [128, 512, 1, 256, 160, 160, 288, 512]
    - [56, 4.842]
  - - [128, 512, 1, 512, 160, 160, 544, 544]
    - [40, 7.791]
  - - [128, 512, 1, 1024, 160, 160, 1056, 1056]
    - [56, 11.326]
  - - [128, 512, 1, 2048, 160, 160, 2080, 2080]
    - [63, 14.709]
  - - [128, 512, 1, 4096, 160, 160, 4128, 4128]
    - [56, 17.152]
  - - [128, 1024, 1, 64, 160, 160, 96, 1024]
    - [80, 2.791]
  - - [128, 1024, 1, 128, 160, 160, 160, 1024]
    - [81, 5.113]
  - - [128, 1024, 1, 256, 160, 160, 288, 1024]
    - [16, 8.82]
  - - [128, 1024, 1, 512, 160, 160, 544, 1024]
    - [15, 13.844]
  - - [128, 1024, 1, 1024, 160, 160, 1056, 1056]
    - [3, 19.288]
  - - [128, 1024, 1, 2048, 160, 160, 2080, 2080]
    - [4, 23.965]
  - - [128, 1024, 1, 4096, 160, 160, 4128, 4128]
    - [4, 27.201]
  - - [128, 2048, 1, 64, 160, 160, 96, 2048]
    - [82, 5.24]
  - - [128, 2048, 1, 128, 160, 160, 160, 2048]
    - [5, 9.432]
  - - [128, 2048, 1, 256, 160, 160, 288, 2048]
    - [16, 15.77]
  - - [128, 2048, 1, 512, 160, 160, 544, 2048]
    - [19, 23.752]
  - - [128, 2048, 1, 1024, 160, 160, 1056, 2048]
    - [21, 30.977]
  - - [128, 2048, 1, 2048, 160, 160, 2080, 2080]
    - [13, 37.049]
  - - [128, 2048, 1, 4096, 160, 160, 4128, 4128]
    - [12, 39.545]
  - - [128, 4096, 1, 64, 160, 160, 96, 4096]
    - [77, 8.954]
  - - [128, 4096, 1, 128, 160, 160, 160, 4096]
    - [5, 15.651]
  - - [128, 4096, 1, 256, 160, 160, 288, 4096]
    - [15, 25.112]
  - - [128, 4096, 1, 512, 160, 160, 544, 4096]
    - [15, 35.677]
  - - [128, 4096, 1, 1024, 160, 160, 1056, 4096]
    - [15, 44.618]
  - - [128, 4096, 1, 2048, 160, 160, 2080, 4096]
    - [18, 51.199]
  - - [128, 4096, 1, 4096, 160, 160, 4128, 4128]
    - [9, 53.566]
  - - [256, 64, 1, 64, 288, 288, 96, 96]
    - [61, 0.38]
  - - [256, 64, 1, 128, 288, 288, 160, 160]
    - [61, 0.726]
  - - [256, 64, 1, 256, 288, 288, 288, 288]
    - [69, 1.329]
  - - [256, 64, 1, 512, 288, 288, 544, 544]
    - [60, 2.295]
  - - [256, 64, 1, 1024, 288, 288, 1056, 1056]
    - [66, 3.585]
  - - [256, 64, 1, 2048, 288, 288, 2080, 2080]
    - [42, 4.98]
  - - [256, 64, 1, 4096, 288, 288, 4128, 4128]
    - [58, 6.148]
  - - [256, 128, 1, 64, 288, 288, 96, 128]
    - [57, 0.748]
  - - [256, 128, 1, 128, 288, 288, 160, 160]
    - [69, 1.421]
  - - [256, 128, 1, 256, 288, 288, 288, 288]
    - [68, 2.559]
  - - [256, 128, 1, 512, 288, 288, 544, 544]
    - [43, 4.35]
  - - [256, 128, 1, 1024, 288, 288, 1056, 1056]
    - [58, 6.605]
  - - [256, 128, 1, 2048, 288, 288, 2080, 2080]
    - [41, 8.917]
  - - [256, 128, 1, 4096, 288, 288, 4128, 4128]
    - [60, 10.789]
  - - [256, 256, 1, 64, 288, 288, 96, 256]
    - [67, 1.454]
  - - [256, 256, 1, 128, 288, 288, 160, 256]
    - [62, 2.722]
  - - [256, 256, 1, 256, 288, 288, 288, 288]
    - [48, 4.816]
  - - [256, 256, 1, 512, 288, 288, 544, 544]
    - [40, 7.803]
  - - [256, 256, 1, 1024, 288, 288, 1056, 1056]
    - [46, 11.344]
  - - [256, 256, 1, 2048, 288, 288, 2080, 2080]
    - [46, 14.609]
  - - [256, 256, 1, 4096, 288, 288, 4128, 4128]
    - [46, 17.153]
  - - [256, 512, 1, 64, 288, 288, 96, 512]
    - [74, 2.778]
  - - [256, 512, 1, 128, 288, 288, 160, 512]
    - [4, 5.106]
  - - [256, 512, 1, 256, 288, 288, 288, 512]
    - [9, 8.779]
  - - [256, 512, 1, 512, 288, 288, 544, 544]
    - [15, 13.902]
  - - [256, 512, 1, 1024, 288, 288, 1056, 1056]
    - [4, 19.296]
  - - [256, 512, 1, 2048, 288, 288, 2080, 2080]
    - [4, 23.92]
  - - [256, 512, 1, 4096, 288, 288, 4128, 4128]
    - [15, 27.19]
  - - [256, 1024, 1, 64, 288, 288, 96, 1024]
    - [83, 5.218]
  - - [256, 1024, 1, 128, 288, 288, 160, 1024]
    - [3, 9.424]
  - - [256, 1024, 1, 256, 288, 288, 288, 1024]
    - [6, 15.711]
  - - [256, 1024, 1, 512, 288, 288, 544, 1024]
    - [19, 23.859]
  - - [256, 1024, 1, 1024, 288, 288, 1056, 1056]
    - [19, 32.277]
  - - [256, 1024, 1, 2048, 288, 288, 2080, 2080]
    - [11, 37.396]
  - - [256, 1024, 1, 4096, 288, 288, 4128, 4128]
    - [12, 39.927]
  - - [256, 2048, 1, 64, 288, 288, 96, 2048]
    - [78, 8.982]
  - - [256, 2048, 1, 128, 288, 288, 160, 2048]
    - [21, 15.718]
  - - [256, 2048, 1, 256, 288, 288, 288, 2048]
    - [15, 25.301]
  - - [256, 2048, 1, 512, 288, 288, 544, 2048]
    - [15, 35.645]
  - - [256, 2048, 1, 1024, 288, 288, 1056, 2048]
    - [18, 44.63]
  - - [256, 2048, 1, 2048, 288, 288, 2080, 2080]
    - [18, 51.44]
  - - [256, 2048, 1, 4096, 288, 288, 4128, 4128]
    - [21, 53.488]
  - - [256, 4096, 1, 64, 288, 288, 96, 4096]
    - [80, 15.445]
  - - [256, 4096, 1, 128, 288, 288, 160, 4096]
    - [15, 25.988]
  - - [256, 4096, 1, 256, 288, 288, 288, 4096]
    - [15, 37.554]
  - - [256, 4096, 1, 512, 288, 288, 544, 4096]
    - [15, 48.729]
  - - [256, 4096, 1, 1024, 288, 288, 1056, 4096]
    - [4, 57.769]
  - - [256, 4096, 1, 2048, 288, 288, 2080, 4096]
    - [21, 61.837]
  - - [256, 4096, 1, 4096, 288, 288, 4128, 4128]
    - [15, 65.91]
  - - [384, 64, 1, 64, 416, 416, 96, 96]
    - [60, 0.566]
  - - [384, 64, 1, 128, 416, 416, 160, 160]
    - [60, 1.091]
  - - [384, 64, 1, 256, 416, 416, 288, 288]
    - [43, 1.993]
  - - [384, 64, 1, 512, 416, 416, 544, 544]
    - [53, 3.44]
  - - [384, 64, 1, 1024, 416, 416, 1056, 1056]
    - [53, 5.349]
  - - [384, 64, 1, 2048, 416, 416, 2080, 2080]
    - [58, 7.457]
  - - [384, 64, 1, 4096, 416, 416, 4128, 4128]
    - [59, 9.197]
  - - [384, 128, 1, 64, 416, 416, 96, 128]
    - [41, 1.12]
  - - [384, 128, 1, 128, 416, 416, 160, 160]
    - [69, 2.12]
  - - [384, 128, 1, 256, 416, 416, 288, 288]
    - [51, 3.832]
  - - [384, 128, 1, 512, 416, 416, 544, 544]
    - [58, 6.473]
  - - [384, 128, 1, 1024, 416, 416, 1056, 1056]
    - [58, 9.815]
  - - [384, 128, 1, 2048, 416, 416, 2080, 2080]
    - [43, 13.302]
  - - [384, 128, 1, 4096, 416, 416, 4128, 4128]
    - [60, 16.068]
  - - [384, 256, 1, 64, 416, 416, 96, 256]
    - [56, 2.134]
  - - [384, 256, 1, 128, 416, 416, 160, 256]
    - [63, 3.92]
  - - [384, 256, 1, 256, 416, 416, 288, 288]
    - [0, 6.823]
  - - [384, 256, 1, 512, 416, 416, 544, 544]
    - [73, 10.787]
  - - [384, 256, 1, 1024, 416, 416, 1056, 1056]
    - [73, 15.262]
  - - [384, 256, 1, 2048, 416, 416, 2080, 2080]
    - [73, 19.187]
  - - [384, 256, 1, 4096, 416, 416, 4128, 4128]
    - [73, 22.076]
  - - [384, 512, 1, 64, 416, 416, 96, 512]
    - [71, 4.087]
  - - [384, 512, 1, 128, 416, 416, 160, 512]
    - [14, 7.506]
  - - [384, 512, 1, 256, 416, 416, 288, 512]
    - [14, 12.97]
  - - [384, 512, 1, 512, 416, 416, 544, 544]
    - [15, 20.342]
  - - [384, 512, 1, 1024, 416, 416, 1056, 1056]
    - [15, 28.452]
  - - [384, 512, 1, 2048, 416, 416, 2080, 2080]
    - [15, 35.417]
  - - [384, 512, 1, 4096, 416, 416, 4128, 4128]
    - [15, 40.343]
  - - [384, 1024, 1, 64, 416, 416, 96, 1024]
    - [79, 7.226]
  - - [384, 1024, 1, 128, 416, 416, 160, 1024]
    - [15, 12.876]
  - - [384, 1024, 1, 256, 416, 416, 288, 1024]
    - [9, 21.021]
  - - [384, 1024, 1, 512, 416, 416, 544, 1024]
    - [4, 30.234]
  - - [384, 1024, 1, 1024, 416, 416, 1056, 1056]
    - [19, 39.52]
  - - [384, 1024, 1, 2048, 416, 416, 2080, 2080]
    - [17, 45.528]
  - - [384, 1024, 1, 4096, 416, 416, 4128, 4128]
    - [19, 50.228]
  - - [384, 2048, 1, 64, 416, 416, 96, 2048]
    - [73, 12.41]
  - - [384, 2048, 1, 128, 416, 416, 160, 2048]
    - [4, 21.292]
  - - [384, 2048, 1, 256, 416, 416, 288, 2048]
    - [15, 32.563]
  - - [384, 2048, 1, 512, 416, 416, 544, 2048]
    - [38, 44.287]
  - - [384, 2048, 1, 1024, 416, 416, 1056, 2048]
    - [27, 55.992]
  - - [384, 2048, 1, 2048, 416, 416, 2080, 2080]
    - [28, 61.53]
  - - [384, 2048, 1, 4096, 416, 416, 4128, 4128]
    - [38, 67.778]
  - - [384, 4096, 1, 64, 416, 416, 96, 4096]
    - [10, 20.23]
  - - [384, 4096, 1, 128, 416, 416, 160, 4096]
    - [15, 33.328]
  - - [384, 4096, 1, 256, 416, 416, 288, 4096]
    - [4, 45.612]
  - - [384, 4096, 1, 512, 416, 416, 544, 4096]
    - [17, 56.351]
  - - [384, 4096, 1, 1024, 416, 416, 1056, 4096]
    - [13, 60.703]
  - - [384, 4096, 1, 2048, 416, 416, 2080, 4096]
    - [13, 66.112]
  - - [384, 4096, 1, 4096, 416, 416, 4128, 4128]
    - [17, 69.036]
  - - [768, 64, 1, 64, 800, 800, 96, 96]
    - [62, 1.126]
  - - [768, 64, 1, 128, 800, 800, 160, 160]
    - [44, 2.11]
  - - [768, 64, 1, 256, 800, 800, 288, 288]
    - [43, 3.861]
  - - [768, 64, 1, 512, 800, 800, 544, 544]
    - [60, 6.455]
  - - [768, 64, 1, 1024, 800, 800, 1056, 1056]
    - [43, 9.867]
  - - [768, 64, 1, 2048, 800, 800, 2080, 2080]
    - [43, 13.305]
  - - [768, 64, 1, 4096, 800, 800, 4128, 4128]
    - [60, 16.072]
  - - [768, 128, 1, 64, 800, 800, 96, 128]
    - [44, 2.138]
  - - [768, 128, 1, 128, 800, 800, 160, 160]
    - [54, 3.881]
  - - [768, 128, 1, 256, 800, 800, 288, 288]
    - [83, 6.81]
  - - [768, 128, 1, 512, 800, 800, 544, 544]
    - [74, 10.77]
  - - [768, 128, 1, 1024, 800, 800, 1056, 1056]
    - [80, 15.259]
  - - [768, 128, 1, 2048, 800, 800, 2080, 2080]
    - [80, 19.225]
  - - [768, 128, 1, 4096, 800, 800, 4128, 4128]
    - [80, 22.079]
  - - [768, 256, 1, 64, 800, 800, 96, 256]
    - [4, 4.088]
  - - [768, 256, 1, 128, 800, 800, 160, 256]
    - [84, 7.473]
  - - [768, 256, 1, 256, 800, 800, 288, 288]
    - [15, 12.931]
  - - [768, 256, 1, 512, 800, 800, 544, 544]
    - [4, 20.307]
  - - [768, 256, 1, 1024, 800, 800, 1056, 1056]
    - [4, 28.307]
  - - [768, 256, 1, 2048, 800, 800, 2080, 2080]
    - [15, 35.427]
  - - [768, 256, 1, 4096, 800, 800, 4128, 4128]
    - [15, 40.358]
  - - [768, 512, 1, 64, 800, 800, 96, 512]
    - [80, 7.199]
  - - [768, 512, 1, 128, 800, 800, 160, 512]
    - [15, 12.872]
  - - [768, 512, 1, 256, 800, 800, 288, 512]
    - [21, 21.108]
  - - [768, 512, 1, 512, 800, 800, 544, 544]
    - [21, 30.434]
  - - [768, 512, 1, 1024, 800, 800, 1056, 1056]
    - [6, 39.116]
  - - [768, 512, 1, 2048, 800, 800, 2080, 2080]
    - [8, 45.687]
  - - [768, 512, 1, 4096, 800, 800, 4128, 4128]
    - [19, 50.14]
  - - [768, 1024, 1, 64, 800, 800, 96, 1024]
    - [85, 12.455]
  - - [768, 1024, 1, 128, 800, 800, 160, 1024]
    - [15, 21.375]
  - - [768, 1024, 1, 256, 800, 800, 288, 1024]
    - [15, 32.354]
  - - [768, 1024, 1, 512, 800, 800, 544, 1024]
    - [28, 43.978]
  - - [768, 1024, 1, 1024, 800, 800, 1056, 1056]
    - [38, 55.735]
  - - [768, 1024, 1, 2048, 800, 800, 2080, 2080]
    - [34, 61.506]
  - - [768, 1024, 1, 4096, 800, 800, 4128, 4128]
    - [27, 67.675]
  - - [768, 2048, 1, 64, 800, 800, 96, 2048]
    - [22, 20.147]
  - - [768, 2048, 1, 128, 800, 800, 160, 2048]
    - [15, 33.334]
  - - [768, 2048, 1, 256, 800, 800, 288, 2048]
    - [15, 45.704]
  - - [768, 2048, 1, 512, 800, 800, 544, 2048]
    - [19, 56.577]
  - - [768, 2048, 1, 1024, 800, 800, 1056, 2048]
    - [19, 61.168]
  - - [768, 2048, 1, 2048, 800, 800, 2080, 2080]
    - [2, 66.699]
  - - [768, 2048, 1, 4096, 800, 800, 4128, 4128]
    - [17, 69.54]
  - - [768, 4096, 1, 64, 800, 800, 96, 4096]
    - [81, 29.436]
  - - [768, 4096, 1, 128, 800, 800, 160, 4096]
    - [15, 45.297]
  - - [768, 4096, 1, 256, 800, 800, 288, 4096]
    - [17, 57.289]
  - - [768, 4096, 1, 512, 800, 800, 544, 4096]
    - [24, 64.109]
  - - [768, 4096, 1, 1024, 800, 800, 1056, 4096]
    - [26, 71.785]
  - - [768, 4096, 1, 2048, 800, 800, 2080, 4096]
    - [24, 76.574]
  - - [768, 4096, 1, 4096, 800, 800, 4128, 4128]
    - [23, 79.5]
  - - [1536, 64, 1, 64, 1568, 1568, 96, 96]
    - [41, 2.132]
  - - [1536, 64, 1, 128, 1568, 1568, 160, 160]
    - [1, 3.923]
  - - [1536, 64, 1, 256, 1568, 1568, 288, 288]
    - [0, 6.801]
  - - [1536, 64, 1, 512, 1568, 1568, 544, 544]
    - [80, 10.769]
  - - [1536, 64, 1, 1024, 1568, 1568, 1056, 1056]
    - [73, 15.254]
  - - [1536, 64, 1, 2048, 1568, 1568, 2080, 2080]
    - [74, 19.125]
  - - [1536, 64, 1, 4096, 1568, 1568, 4128, 4128]
    - [80, 22.075]
  - - [1536, 128, 1, 64, 1568, 1568, 96, 128]
    - [72, 4.095]
  - - [1536, 128, 1, 128, 1568, 1568, 160, 160]
    - [15, 7.489]
  - - [1536, 128, 1, 256, 1568, 1568, 288, 288]
    - [15, 12.87]
  - - [1536, 128, 1, 512, 1568, 1568, 544, 544]
    - [3, 20.242]
  - - [1536, 128, 1, 1024, 1568, 1568, 1056, 1056]
    - [15, 28.361]
  - - [1536, 128, 1, 2048, 1568, 1568, 2080, 2080]
    - [15, 35.337]
  - - [1536, 128, 1, 4096, 1568, 1568, 4128, 4128]
    - [15, 40.317]
  - - [1536, 256, 1, 64, 1568, 1568, 96, 256]
    - [71, 7.23]
  - - [1536, 256, 1, 128, 1568, 1568, 160, 256]
    - [15, 12.828]
  - - [1536, 256, 1, 256, 1568, 1568, 288, 288]
    - [14, 20.887]
  - - [1536, 256, 1, 512, 1568, 1568, 544, 544]
    - [9, 30.245]
  - - [1536, 256, 1, 1024, 1568, 1568, 1056, 1056]
    - [6, 38.87]
  - - [1536, 256, 1, 2048, 1568, 1568, 2080, 2080]
    - [8, 45.476]
  - - [1536, 256, 1, 4096, 1568, 1568, 4128, 4128]
    - [8, 49.237]
  - - [1536, 512, 1, 64, 1568, 1568, 96, 512]
    - [78, 12.41]
  - - [1536, 512, 1, 128, 1568, 1568, 160, 512]
    - [4, 21.264]
  - - [1536, 512, 1, 256, 1568, 1568, 288, 512]
    - [15, 32.676]
  - - [1536, 512, 1, 512, 1568, 1568, 544, 544]
    - [29, 43.904]
  - - [1536, 512, 1, 1024, 1568, 1568, 1056, 1056]
    - [37, 55.626]
  - - [1536, 512, 1, 2048, 1568, 1568, 2080, 2080]
    - [29, 61.326]
  - - [1536, 512, 1, 4096, 1568, 1568, 4128, 4128]
    - [37, 67.678]
  - - [1536, 1024, 1, 64, 1568, 1568, 96, 1024]
    - [80, 19.99]
  - - [1536, 1024, 1, 128, 1568, 1568, 160, 1024]
    - [18, 32.989]
  - - [1536, 1024, 1, 256, 1568, 1568, 288, 1024]
    - [15, 45.619]
  - - [1536, 1024, 1, 512, 1568, 1568, 544, 1024]
    - [17, 56.428]
  - - [1536, 1024, 1, 1024, 1568, 1568, 1056, 1056]
    - [17, 61.213]
  - - [1536, 1024, 1, 2048, 1568, 1568, 2080, 2080]
    - [13, 66.637]
  - - [1536, 1024, 1, 4096, 1568, 1568, 4128, 4128]
    - [17, 68.659]
  - - [1536, 2048, 1, 64, 1568, 1568, 96, 2048]
    - [73, 29.51]
  - - [1536, 2048, 1, 128, 1568, 1568, 160, 2048]
    - [14, 44.628]
  - - [1536, 2048, 1, 256, 1568, 1568, 288, 2048]
    - [13, 56.79]
  - - [1536, 2048, 1, 512, 1568, 1568, 544, 2048]
    - [26, 63.942]
  - - [1536, 2048, 1, 1024, 1568, 1568, 1056, 2048]
    - [33, 71.839]
  - - [1536, 2048, 1, 2048, 1568, 1568, 2080, 2080]
    - [26, 76.912]
  - - [1536, 2048, 1, 4096, 1568, 1568, 4128, 4128]
    - [23, 79.735]
  - - [1536, 4096, 1, 64, 1568, 1568, 96, 4096]
    - [80, 38.229]
  - - [1536, 4096, 1, 128, 1568, 1568, 160, 4096]
    - [24, 54.771]
  - - [1536, 4096, 1, 256, 1568, 1568, 288, 4096]
    - [24, 65.485]
  - - [1536, 4096, 1, 512, 1568, 1568, 544, 4096]
    - [24, 75.933]
  - - [1536, 4096, 1, 1024, 1568, 1568, 1056, 4096]
    - [32, 82.509]
  - - [1536, 4096, 1, 2048, 1568, 1568, 2080, 4096]
    - [31, 86.284]
  - - [1536, 4096, 1, 4096, 1568, 1568, 4128, 4128]
    - [32, 87.416]
  - - [3072, 64, 1, 64, 3104, 3104, 96, 96]
    - [79, 4.096]
  - - [3072, 64, 1, 128, 3104, 3104, 160, 160]
    - [4, 7.426]
  - - [3072, 64, 1, 256, 3104, 3104, 288, 288]
    - [4, 12.86]
  - - [3072, 64, 1, 512, 3104, 3104, 544, 544]
    - [15, 20.182]
  - - [3072, 64, 1, 1024, 3104, 3104, 1056, 1056]
    - [15, 28.221]
  - - [3072, 64, 1, 2048, 3104, 3104, 2080, 2080]
    - [15, 35.246]
  - - [3072, 64, 1, 4096, 3104, 3104, 4128, 4128]
    - [4, 40.269]
  - - [3072, 128, 1, 64, 3104, 3104, 96, 128]
    - [75, 7.239]
  - - [3072, 128, 1, 128, 3104, 3104, 160, 160]
    - [4, 12.864]
  - - [3072, 128, 1, 256, 3104, 3104, 288, 288]
    - [4, 20.89]
  - - [3072, 128, 1, 512, 3104, 3104, 544, 544]
    - [4, 30.248]
  - - [3072, 128, 1, 1024, 3104, 3104, 1056, 1056]
    - [15, 38.751]
  - - [3072, 128, 1, 2048, 3104, 3104, 2080, 2080]
    - [9, 45.679]
  - - [3072, 128, 1, 4096, 3104, 3104, 4128, 4128]
    - [4, 47.726]
  - - [3072, 256, 1, 64, 3104, 3104, 96, 256]
    - [78, 12.549]
  - - [3072, 256, 1, 128, 3104, 3104, 160, 256]
    - [4, 21.333]
  - - [3072, 256, 1, 256, 3104, 3104, 288, 288]
    - [18, 32.569]
  - - [3072, 256, 1, 512, 3104, 3104, 544, 544]
    - [15, 44.111]
  - - [3072, 256, 1, 1024, 3104, 3104, 1056, 1056]
    - [28, 55.485]
  - - [3072, 256, 1, 2048, 3104, 3104, 2080, 2080]
    - [38, 61.366]
  - - [3072, 256, 1, 4096, 3104, 3104, 4128, 4128]
    - [29, 67.607]
  - - [3072, 512, 1, 64, 3104, 3104, 96, 512]
    - [73, 20.29]
  - - [3072, 512, 1, 128, 3104, 3104, 160, 512]
    - [15, 33.139]
  - - [3072, 512, 1, 256, 3104, 3104, 288, 512]
    - [17, 45.974]
  - - [3072, 512, 1, 512, 3104, 3104, 544, 544]
    - [17, 56.736]
  - - [3072, 512, 1, 1024, 3104, 3104, 1056, 1056]
    - [19, 61.349]
  - - [3072, 512, 1, 2048, 3104, 3104, 2080, 2080]
    - [13, 66.605]
  - - [3072, 512, 1, 4096, 3104, 3104, 4128, 4128]
    - [13, 68.598]
  - - [3072, 1024, 1, 64, 3104, 3104, 96, 1024]
    - [80, 29.595]
  - - [3072, 1024, 1, 128, 3104, 3104, 160, 1024]
    - [20, 43.227]
  - - [3072, 1024, 1, 256, 3104, 3104, 288, 1024]
    - [25, 56.167]
  - - [3072, 1024, 1, 512, 3104, 3104, 544, 1024]
    - [33, 64.299]
  - - [3072, 1024, 1, 1024, 3104, 3104, 1056, 1056]
    - [26, 72.098]
  - - [3072, 1024, 1, 2048, 3104, 3104, 2080, 2080]
    - [36, 76.777]
  - - [3072, 1024, 1, 4096, 3104, 3104, 4128, 4128]
    - [23, 79.477]
  - - [3072, 2048, 1, 64, 3104, 3104, 96, 2048]
    - [80, 38.607]
  - - [3072, 2048, 1, 128, 3104, 3104, 160, 2048]
    - [24, 54.549]
  - - [3072, 2048, 1, 256, 3104, 3104, 288, 2048]
    - [25, 65.541]
  - - [3072, 2048, 1, 512, 3104, 3104, 544, 2048]
    - [33, 76.001]
  - - [3072, 2048, 1, 1024, 3104, 3104, 1056, 2048]
    - [31, 82.645]
  - - [3072, 2048, 1, 2048, 3104, 3104, 2080, 2080]
    - [33, 86.393]
  - - [3072, 2048, 1, 4096, 3104, 3104, 4128, 4128]
    - [24, 87.394]
  - - [3072, 4096, 1, 64, 3104, 3104, 96, 4096]
    - [81, 44.951]
  - - [3072, 4096, 1, 128, 3104, 3104, 160, 4096]
    - [23, 60.749]
  - - [3072, 4096, 1, 256, 3104, 3104, 288, 4096]
    - [30, 73.611]
  - - [3072, 4096, 1, 512, 3104, 3104, 544, 4096]
    - [33, 81.56]
  - - [3072, 4096, 1, 1024, 3104, 3104, 1056, 4096]
    - [33, 86.437]
  - - [3072, 4096, 1, 2048, 3104, 3104, 2080, 4096]
    - [33, 88.122]
  - - [3072, 4096, 1, 4096, 3104, 3104, 4128, 4128]
    - [35, 89.712]
- null
- null
- DeviceEfficiency
