library/src/blas3/Tensile/Logic/asm_full/navi32/navi32_Cijk_Alik_Bjlk_HHS_BH_GB.yaml
- {MinimumRequiredVersion: 4.35.0}
- navi32
- gfx1101
- [Device 73f0]
    SolutionIndex: 0
    SolutionNameMin: Cijk_Alik_Bjlk_HHS_BH_MT64x64x16_MI16x16x16x1_SN_1LDSB0_AMAS3_GRVW4_IU1_LPA8_LPB8_NLCB1_SIA1_SU0_SUS0_SVW2_TT2_32_VW2_WGM4
    SolutionIndex: 1
    SolutionNameMin: Cijk_Alik_Bjlk_HHS_BH_MT64x64x16_MI16x16x16x1_SN_1LDSB0_AMAS3_GRVW8_IU1_LPA8_LPB0_NLCB1_SIA1_SU0_SUS0_SVW2_TT2_32_VW2_WGM4
    SolutionIndex: 2
    SolutionNameMin: Cijk_Alik_Bjlk_HHS_BH_MT64x64x16_MI16x16x16x1_SN_1LDSB0_AMAS3_GRVW8_IU1_LPA8_LPB8_NLCB1_SIA1_SU0_SUS0_SVW2_TT2_32_VW2_WGM4
    SolutionIndex: 3
    SolutionNameMin: Cijk_Alik_Bjlk_HHS_BH_MT64x64x16_MI16x16x16x1_SN_1LDSB1_AMAS3_GRVW8_IU1_LPA8_LPB0_NLCB1_SIA2_SU0_SUS0_SVW2_TT2_32_VW2_WGM4
    SolutionIndex: 4
    SolutionNameMin: Cijk_Alik_Bjlk_HHS_BH_MT64x64x16_MI16x16x16x1_SN_1LDSB1_AMAS3_GRVW8_IU1_LPA8_LPB8_NLCB1_SIA2_SU0_SUS0_SVW2_TT2_32_VW2_WGM4
    SolutionIndex: 5
    SolutionNameMin: Cijk_Alik_Bjlk_HHS_BH_MT64x64x16_MI16x16x16x1_SN_1LDSB1_AMAS3_GRVW8_IU1_LPA8_LPB8_NLCB1_SIA2_SU32_SUS128_SVW2_TT2_32_VW2_WGM4
    SolutionIndex: 6
    SolutionNameMin: Cijk_Alik_Bjlk_HHS_BH_MT64x64x16_MI16x16x16x1_SN_1LDSB1_AMAS3_GRVW4_IU1_LPA8_LPB0_NLCB1_SIA2_SU32_SUS256_SVW2_TT2_32_VW2_WGM4
    SolutionIndex: 7
    SolutionNameMin: Cijk_Alik_Bjlk_HHS_BH_MT64x64x16_MI16x16x16x1_SN_1LDSB0_AMAS3_GRVW8_IU1_LPA8_LPB0_NLCB1_SIA1_SU0_SUS0_SVW2_TT2_32_VW2_WGM8
    SolutionIndex: 8
    SolutionNameMin: Cijk_Alik_Bjlk_HHS_BH_MT64x64x16_MI16x16x16x1_SN_1LDSB1_AMAS3_GRVW4_IU1_LPA8_LPB8_NLCB1_SIA2_SU0_SUS0_SVW2_TT2_32_VW2_WGM8
    SolutionIndex: 9
    SolutionNameMin: Cijk_Alik_Bjlk_HHS_BH_MT64x64x16_MI16x16x16x1_SN_1LDSB1_AMAS3_GRVW8_IU1_LPA8_LPB0_NLCB1_SIA2_SU0_SUS0_SVW2_TT2_32_VW2_WGM8
    SolutionIndex: 10
    SolutionNameMin: Cijk_Alik_Bjlk_HHS_BH_MT64x64x16_MI16x16x16x1_SN_1LDSB1_AMAS3_GRVW8_IU1_LPA8_LPB8_NLCB1_SIA2_SU0_SUS0_SVW2_TT2_32_VW2_WGM8
    SolutionIndex: 11
    SolutionNameMin: Cijk_Alik_Bjlk_HHS_BH_MT64x64x16_MI16x16x16x1_SN_1LDSB1_AMAS3_GRVW8_IU1_LPA8_LPB0_NLCB1_SIA2_SU32_SUS128_SVW2_TT2_32_VW2_WGM8
    SolutionIndex: 12
    SolutionNameMin: Cijk_Alik_Bjlk_HHS_BH_MT64x64x16_MI16x16x16x1_SN_1LDSB0_AMAS3_GRVW8_IU1_LPA8_LPB8_NLCB1_SIA1_SU32_SUS256_SVW2_TT2_32_VW2_WGM8
    SolutionIndex: 13
    SolutionNameMin: Cijk_Alik_Bjlk_HHS_BH_MT64x64x16_MI16x16x16x1_SN_1LDSB1_AMAS3_GRVW8_IU1_LPA8_LPB0_NLCB1_SIA2_SU32_SUS256_SVW2_TT2_32_VW2_WGM8
    SolutionIndex: 14
    SolutionNameMin: Cijk_Alik_Bjlk_HHS_BH_MT128x128x16_MI16x16x16x1_SN_1LDSB0_AMAS3_GRVW4_IU1_LPA8_LPB0_NLCB1_SIA1_SU0_SUS0_SVW2_TT4_64_VW2_WGM4
    SolutionIndex: 15
    SolutionNameMin: Cijk_Alik_Bjlk_HHS_BH_MT128x128x16_MI16x16x16x1_SN_1LDSB0_AMAS3_GRVW4_IU1_LPA8_LPB8_NLCB1_SIA1_SU0_SUS0_SVW2_TT4_64_VW2_WGM4
    SolutionIndex: 16
    SolutionNameMin: Cijk_Alik_Bjlk_HHS_BH_MT128x128x16_MI16x16x16x1_SN_1LDSB0_AMAS3_GRVW8_IU1_LPA8_LPB0_NLCB1_SIA1_SU0_SUS0_SVW2_TT4_64_VW2_WGM4
    SolutionIndex: 17
    SolutionNameMin: Cijk_Alik_Bjlk_HHS_BH_MT128x128x16_MI16x16x16x1_SN_1LDSB0_AMAS3_GRVW8_IU1_LPA8_LPB8_NLCB1_SIA1_SU0_SUS0_SVW2_TT4_64_VW2_WGM4
    SolutionIndex: 18
    SolutionNameMin: Cijk_Alik_Bjlk_HHS_BH_MT128x128x16_MI16x16x16x1_SN_1LDSB1_AMAS3_GRVW4_IU1_LPA8_LPB8_NLCB1_SIA2_SU0_SUS0_SVW2_TT4_64_VW2_WGM4
    SolutionIndex: 19
    SolutionNameMin: Cijk_Alik_Bjlk_HHS_BH_MT128x128x16_MI16x16x16x1_SN_1LDSB1_AMAS3_GRVW8_IU1_LPA8_LPB0_NLCB1_SIA2_SU0_SUS0_SVW2_TT4_64_VW2_WGM4
    SolutionIndex: 20
    SolutionNameMin: Cijk_Alik_Bjlk_HHS_BH_MT128x128x16_MI16x16x16x1_SN_1LDSB1_AMAS3_GRVW8_IU1_LPA8_LPB8_NLCB1_SIA2_SU0_SUS0_SVW2_TT4_64_VW2_WGM4
    SolutionIndex: 21
    SolutionNameMin: Cijk_Alik_Bjlk_HHS_BH_MT128x128x16_MI16x16x16x1_SN_1LDSB0_AMAS3_GRVW8_IU1_LPA8_LPB0_NLCB1_SIA1_SU32_SUS128_SVW2_TT4_64_VW2_WGM4
    SolutionIndex: 22
    SolutionNameMin: Cijk_Alik_Bjlk_HHS_BH_MT128x128x16_MI16x16x16x1_SN_1LDSB0_AMAS3_GRVW8_IU1_LPA8_LPB8_NLCB1_SIA1_SU32_SUS128_SVW2_TT4_64_VW2_WGM4
    SolutionIndex: 23
    SolutionNameMin: Cijk_Alik_Bjlk_HHS_BH_MT128x128x16_MI16x16x16x1_SN_1LDSB1_AMAS3_GRVW8_IU1_LPA8_LPB0_NLCB1_SIA2_SU32_SUS128_SVW2_TT4_64_VW2_WGM4
    SolutionIndex: 24
    SolutionNameMin: Cijk_Alik_Bjlk_HHS_BH_MT128x128x16_MI16x16x16x1_SN_1LDSB0_AMAS3_GRVW8_IU1_LPA8_LPB0_NLCB1_SIA3_SU32_SUS128_SVW2_TT4_64_VW2_WGM4
    SolutionIndex: 25
    SolutionNameMin: Cijk_Alik_Bjlk_HHS_BH_MT128x128x16_MI16x16x16x1_SN_1LDSB1_AMAS3_GRVW8_IU1_LPA8_LPB0_NLCB1_SIA2_SU32_SUS256_SVW2_TT4_64_VW2_WGM4
    SolutionIndex: 26
    SolutionNameMin: Cijk_Alik_Bjlk_HHS_BH_MT128x128x16_MI16x16x16x1_SN_1LDSB1_AMAS3_GRVW8_IU1_LPA8_LPB8_NLCB1_SIA2_SU32_SUS256_SVW2_TT4_64_VW2_WGM4
    SolutionIndex: 27
    SolutionNameMin: Cijk_Alik_Bjlk_HHS_BH_MT128x128x16_MI16x16x16x1_SN_1LDSB0_AMAS3_GRVW8_IU1_LPA8_LPB0_NLCB1_SIA3_SU32_SUS256_SVW2_TT4_64_VW2_WGM4
    SolutionIndex: 28
    SolutionNameMin: Cijk_Alik_Bjlk_HHS_BH_MT128x128x16_MI16x16x16x1_SN_1LDSB0_AMAS3_GRVW8_IU1_LPA8_LPB8_NLCB1_SIA3_SU32_SUS256_SVW2_TT4_64_VW2_WGM4
    SolutionIndex: 29
    SolutionNameMin: Cijk_Alik_Bjlk_HHS_BH_MT128x128x16_MI16x16x16x1_SN_1LDSB0_AMAS3_GRVW8_IU1_LPA8_LPB0_NLCB1_SIA1_SU0_SUS0_SVW2_TT4_64_VW2_WGM8
    SolutionIndex: 30
    SolutionNameMin: Cijk_Alik_Bjlk_HHS_BH_MT128x128x16_MI16x16x16x1_SN_1LDSB0_AMAS3_GRVW8_IU1_LPA8_LPB8_NLCB1_SIA1_SU0_SUS0_SVW2_TT4_64_VW2_WGM8
    SolutionIndex: 31
    SolutionNameMin: Cijk_Alik_Bjlk_HHS_BH_MT128x128x16_MI16x16x16x1_SN_1LDSB1_AMAS0_GRVW4_IU1_LPA0_LPB0_NLCB1_SIA2_SU0_SUS0_SVW1_TT4_64_VW1_WGM8
    SolutionIndex: 32
    SolutionNameMin: Cijk_Alik_Bjlk_HHS_BH_MT128x128x16_MI16x16x16x1_SN_1LDSB1_AMAS0_GRVW4_IU1_LPA0_LPB8_NLCB1_SIA2_SU0_SUS0_SVW1_TT4_64_VW1_WGM8
    SolutionIndex: 33
    SolutionNameMin: Cijk_Alik_Bjlk_HHS_BH_MT128x128x16_MI16x16x16x1_SN_1LDSB1_AMAS3_GRVW4_IU1_LPA8_LPB8_NLCB1_SIA2_SU0_SUS0_SVW2_TT4_64_VW2_WGM8
    SolutionIndex: 34
    SolutionNameMin: Cijk_Alik_Bjlk_HHS_BH_MT128x128x16_MI16x16x16x1_SN_1LDSB1_AMAS3_GRVW8_IU1_LPA8_LPB0_NLCB1_SIA2_SU0_SUS0_SVW2_TT4_64_VW2_WGM8
    SolutionIndex: 35
    SolutionNameMin: Cijk_Alik_Bjlk_HHS_BH_MT128x128x16_MI16x16x16x1_SN_1LDSB1_AMAS3_GRVW8_IU1_LPA8_LPB8_NLCB1_SIA2_SU0_SUS0_SVW2_TT4_64_VW2_WGM8
    SolutionIndex: 36
    SolutionNameMin: Cijk_Alik_Bjlk_HHS_BH_MT128x128x16_MI16x16x16x1_SN_1LDSB0_AMAS3_GRVW8_IU1_LPA8_LPB0_NLCB1_SIA3_SU0_SUS0_SVW2_TT4_64_VW2_WGM8
    SolutionIndex: 37
    SolutionNameMin: Cijk_Alik_Bjlk_HHS_BH_MT128x128x16_MI16x16x16x1_SN_1LDSB0_AMAS3_GRVW8_IU1_LPA8_LPB8_NLCB1_SIA3_SU0_SUS0_SVW2_TT4_64_VW2_WGM8
    SolutionIndex: 38
    SolutionNameMin: Cijk_Alik_Bjlk_HHS_BH_MT128x128x16_MI16x16x16x1_SN_1LDSB0_AMAS3_GRVW4_IU1_LPA8_LPB0_NLCB1_SIA1_SU32_SUS128_SVW2_TT4_64_VW2_WGM8
    SolutionIndex: 39
    SolutionNameMin: Cijk_Alik_Bjlk_HHS_BH_MT128x128x16_MI16x16x16x1_SN_1LDSB0_AMAS3_GRVW8_IU1_LPA8_LPB0_NLCB1_SIA1_SU32_SUS128_SVW2_TT4_64_VW2_WGM8
    SolutionIndex: 40
    SolutionNameMin: Cijk_Alik_Bjlk_HHS_BH_MT128x128x16_MI16x16x16x1_SN_1LDSB0_AMAS3_GRVW8_IU1_LPA8_LPB8_NLCB1_SIA1_SU32_SUS128_SVW2_TT4_64_VW2_WGM8
    SolutionIndex: 41
    SolutionNameMin: Cijk_Alik_Bjlk_HHS_BH_MT128x128x16_MI16x16x16x1_SN_1LDSB1_AMAS0_GRVW2_IU1_LPA8_LPB8_NLCB2_SIA2_SU32_SUS128_SVW1_TT4_64_VW1_WGM8
    SolutionIndex: 42
    SolutionNameMin: Cijk_Alik_Bjlk_HHS_BH_MT128x128x16_MI16x16x16x1_SN_1LDSB1_AMAS0_GRVW4_IU1_LPA0_LPB0_NLCB1_SIA2_SU32_SUS128_SVW1_TT4_64_VW1_WGM8
    SolutionIndex: 43
    SolutionNameMin: Cijk_Alik_Bjlk_HHS_BH_MT128x128x16_MI16x16x16x1_SN_1LDSB1_AMAS3_GRVW4_IU1_LPA8_LPB8_NLCB1_SIA2_SU32_SUS128_SVW2_TT4_64_VW2_WGM8
    SolutionIndex: 44
    SolutionNameMin: Cijk_Alik_Bjlk_HHS_BH_MT128x128x16_MI16x16x16x1_SN_1LDSB1_AMAS0_GRVW8_IU1_LPA0_LPB0_NLCB1_SIA2_SU32_SUS128_SVW1_TT4_64_VW1_WGM8
    SolutionIndex: 45
    SolutionNameMin: Cijk_Alik_Bjlk_HHS_BH_MT128x128x16_MI16x16x16x1_SN_1LDSB1_AMAS0_GRVW8_IU1_LPA0_LPB8_NLCB1_SIA2_SU32_SUS128_SVW1_TT4_64_VW1_WGM8
    SolutionIndex: 46
    SolutionNameMin: Cijk_Alik_Bjlk_HHS_BH_MT128x128x16_MI16x16x16x1_SN_1LDSB0_AMAS3_GRVW8_IU1_LPA8_LPB0_NLCB1_SIA3_SU32_SUS128_SVW2_TT4_64_VW2_WGM8
    SolutionIndex: 47
    SolutionNameMin: Cijk_Alik_Bjlk_HHS_BH_MT128x128x16_MI16x16x16x1_SN_1LDSB0_AMAS3_GRVW8_IU1_LPA8_LPB0_NLCB1_SIA1_SU32_SUS256_SVW2_TT4_64_VW2_WGM8
    SolutionIndex: 48
    SolutionNameMin: Cijk_Alik_Bjlk_HHS_BH_MT128x128x16_MI16x16x16x1_SN_1LDSB0_AMAS3_GRVW8_IU1_LPA8_LPB8_NLCB1_SIA1_SU32_SUS256_SVW2_TT4_64_VW2_WGM8
    SolutionIndex: 49
    SolutionNameMin: Cijk_Alik_Bjlk_HHS_BH_MT128x128x16_MI16x16x16x1_SN_1LDSB1_AMAS0_GRVW4_IU1_LPA0_LPB8_NLCB1_SIA2_SU32_SUS256_SVW1_TT4_64_VW1_WGM8
    SolutionIndex: 50
    SolutionNameMin: Cijk_Alik_Bjlk_HHS_BH_MT128x128x16_MI16x16x16x1_SN_1LDSB1_AMAS0_GRVW8_IU1_LPA0_LPB0_NLCB1_SIA2_SU32_SUS256_SVW1_TT4_64_VW1_WGM8
    SolutionIndex: 51
    SolutionNameMin: Cijk_Alik_Bjlk_HHS_BH_MT128x128x16_MI16x16x16x1_SN_1LDSB1_AMAS0_GRVW8_IU1_LPA0_LPB8_NLCB1_SIA2_SU32_SUS256_SVW1_TT4_64_VW1_WGM8
    SolutionIndex: 52
    SolutionNameMin: Cijk_Alik_Bjlk_HHS_BH_MT128x128x16_MI16x16x16x1_SN_1LDSB1_AMAS3_GRVW8_IU1_LPA8_LPB0_NLCB1_SIA2_SU32_SUS256_SVW2_TT4_64_VW2_WGM8
    SolutionIndex: 53
    SolutionNameMin: Cijk_Alik_Bjlk_HHS_BH_MT128x128x16_MI16x16x16x1_SN_1LDSB1_AMAS3_GRVW8_IU1_LPA8_LPB8_NLCB1_SIA2_SU32_SUS256_SVW2_TT4_64_VW2_WGM8
    SolutionIndex: 54
    SolutionNameMin: Cijk_Alik_Bjlk_HHS_BH_MT128x128x16_MI16x16x16x1_SN_1LDSB0_AMAS3_GRVW8_IU1_LPA8_LPB0_NLCB1_SIA3_SU32_SUS256_SVW2_TT4_64_VW2_WGM8
    SolutionIndex: 55
    SolutionNameMin: Cijk_Alik_Bjlk_HHS_BH_MT32x32x32_MI16x16x16x1_SN_1LDSB0_AMAS0_GRVW2_IU1_LPA8_LPB0_NLCB1_SIA1_SU0_SUS0_SVW1_TT1_16_VW1_WGM4
    SolutionIndex: 56
    SolutionNameMin: Cijk_Alik_Bjlk_HHS_BH_MT32x32x32_MI16x16x16x1_SN_1LDSB0_AMAS0_GRVW4_IU1_LPA8_LPB0_NLCB1_SIA1_SU0_SUS0_SVW1_TT1_16_VW1_WGM4
    SolutionIndex: 57
    SolutionNameMin: Cijk_Alik_Bjlk_HHS_BH_MT32x32x32_MI16x16x16x1_SN_1LDSB0_AMAS0_GRVW8_IU1_LPA8_LPB0_NLCB1_SIA1_SU0_SUS0_SVW1_TT1_16_VW1_WGM4
    SolutionIndex: 58
    SolutionNameMin: Cijk_Alik_Bjlk_HHS_BH_MT32x32x32_MI16x16x16x1_SN_1LDSB0_AMAS0_GRVW8_IU1_LPA8_LPB8_NLCB1_SIA1_SU0_SUS0_SVW1_TT1_16_VW1_WGM4
    SolutionIndex: 59
    SolutionNameMin: Cijk_Alik_Bjlk_HHS_BH_MT32x32x32_MI16x16x16x1_SN_1LDSB1_AMAS0_GRVW4_IU2_LPA8_LPB0_NLCB1_SIA2_SU0_SUS0_SVW1_TT1_16_VW1_WGM4
    SolutionIndex: 60
    SolutionNameMin: Cijk_Alik_Bjlk_HHS_BH_MT32x32x32_MI16x16x16x1_SN_1LDSB1_AMAS0_GRVW4_IU2_LPA8_LPB8_NLCB1_SIA2_SU0_SUS0_SVW1_TT1_16_VW1_WGM4
    SolutionIndex: 61
    SolutionNameMin: Cijk_Alik_Bjlk_HHS_BH_MT32x32x32_MI16x16x16x1_SN_1LDSB1_AMAS0_GRVW8_IU2_LPA8_LPB0_NLCB1_SIA2_SU0_SUS0_SVW1_TT1_16_VW1_WGM4
    SolutionIndex: 62
    SolutionNameMin: Cijk_Alik_Bjlk_HHS_BH_MT32x32x32_MI16x16x16x1_SN_1LDSB1_AMAS0_GRVW8_IU2_LPA8_LPB8_NLCB1_SIA2_SU0_SUS0_SVW1_TT1_16_VW1_WGM4
    SolutionIndex: 63
    SolutionNameMin: Cijk_Alik_Bjlk_HHS_BH_MT32x32x32_MI16x16x16x1_SN_1LDSB0_AMAS0_GRVW8_IU1_LPA8_LPB0_NLCB1_SIA3_SU0_SUS0_SVW1_TT1_16_VW1_WGM4
    SolutionIndex: 64
    SolutionNameMin: Cijk_Alik_Bjlk_HHS_BH_MT32x32x32_MI16x16x16x1_SN_1LDSB0_AMAS0_GRVW8_IU1_LPA8_LPB0_NLCB1_SIA1_SU32_SUS128_SVW1_TT1_16_VW1_WGM4
    SolutionIndex: 65
    SolutionNameMin: Cijk_Alik_Bjlk_HHS_BH_MT32x32x32_MI16x16x16x1_SN_1LDSB1_AMAS0_GRVW4_IU2_LPA8_LPB0_NLCB1_SIA2_SU32_SUS128_SVW1_TT1_16_VW1_WGM4
    SolutionIndex: 66
    SolutionNameMin: Cijk_Alik_Bjlk_HHS_BH_MT32x32x32_MI16x16x16x1_SN_1LDSB1_AMAS0_GRVW4_IU2_LPA8_LPB8_NLCB1_SIA2_SU32_SUS128_SVW1_TT1_16_VW1_WGM4
    SolutionIndex: 67
    SolutionNameMin: Cijk_Alik_Bjlk_HHS_BH_MT32x32x32_MI16x16x16x1_SN_1LDSB1_AMAS0_GRVW8_IU2_LPA8_LPB0_NLCB1_SIA2_SU32_SUS128_SVW1_TT1_16_VW1_WGM4
    SolutionIndex: 68
    SolutionNameMin: Cijk_Alik_Bjlk_HHS_BH_MT32x32x32_MI16x16x16x1_SN_1LDSB0_AMAS0_GRVW4_IU1_LPA8_LPB0_NLCB1_SIA1_SU32_SUS256_SVW1_TT1_16_VW1_WGM4
    SolutionIndex: 69
    SolutionNameMin: Cijk_Alik_Bjlk_HHS_BH_MT32x32x32_MI16x16x16x1_SN_1LDSB1_AMAS0_GRVW4_IU2_LPA8_LPB0_NLCB1_SIA2_SU32_SUS256_SVW1_TT1_16_VW1_WGM4
    SolutionIndex: 70
    SolutionNameMin: Cijk_Alik_Bjlk_HHS_BH_MT32x32x32_MI16x16x16x1_SN_1LDSB1_AMAS0_GRVW4_IU2_LPA8_LPB8_NLCB1_SIA2_SU32_SUS256_SVW1_TT1_16_VW1_WGM4
    SolutionIndex: 71
    SolutionNameMin: Cijk_Alik_Bjlk_HHS_BH_MT32x32x32_MI16x16x16x1_SN_1LDSB1_AMAS0_GRVW8_IU2_LPA8_LPB0_NLCB1_SIA2_SU32_SUS256_SVW1_TT1_16_VW1_WGM4
    SolutionIndex: 72
    SolutionNameMin: Cijk_Alik_Bjlk_HHS_BH_MT32x32x32_MI16x16x16x1_SN_1LDSB0_AMAS0_GRVW4_IU1_LPA8_LPB0_NLCB1_SIA1_SU0_SUS0_SVW1_TT1_16_VW1_WGM8
    SolutionIndex: 73
    SolutionNameMin: Cijk_Alik_Bjlk_HHS_BH_MT32x32x32_MI16x16x16x1_SN_1LDSB0_AMAS0_GRVW8_IU1_LPA8_LPB0_NLCB1_SIA1_SU0_SUS0_SVW1_TT1_16_VW1_WGM8
    SolutionIndex: 74
    SolutionNameMin: Cijk_Alik_Bjlk_HHS_BH_MT32x32x32_MI16x16x16x1_SN_1LDSB1_AMAS0_GRVW4_IU2_LPA8_LPB0_NLCB1_SIA2_SU0_SUS0_SVW1_TT1_16_VW1_WGM8
    SolutionIndex: 75
    SolutionNameMin: Cijk_Alik_Bjlk_HHS_BH_MT32x32x32_MI16x16x16x1_SN_1LDSB1_AMAS0_GRVW4_IU2_LPA8_LPB8_NLCB1_SIA2_SU0_SUS0_SVW1_TT1_16_VW1_WGM8
    SolutionIndex: 76
    SolutionNameMin: Cijk_Alik_Bjlk_HHS_BH_MT32x32x32_MI16x16x16x1_SN_1LDSB1_AMAS0_GRVW8_IU2_LPA8_LPB0_NLCB1_SIA2_SU0_SUS0_SVW1_TT1_16_VW1_WGM8
    SolutionIndex: 77
    SolutionNameMin: Cijk_Alik_Bjlk_HHS_BH_MT32x32x32_MI16x16x16x1_SN_1LDSB1_AMAS0_GRVW8_IU2_LPA8_LPB8_NLCB1_SIA2_SU0_SUS0_SVW1_TT1_16_VW1_WGM8
    SolutionIndex: 78
    SolutionNameMin: Cijk_Alik_Bjlk_HHS_BH_MT32x32x32_MI16x16x16x1_SN_1LDSB0_AMAS0_GRVW8_IU1_LPA8_LPB0_NLCB1_SIA1_SU32_SUS128_SVW1_TT1_16_VW1_WGM8
    SolutionIndex: 79
    SolutionNameMin: Cijk_Alik_Bjlk_HHS_BH_MT32x32x32_MI16x16x16x1_SN_1LDSB1_AMAS0_GRVW4_IU2_LPA8_LPB0_NLCB1_SIA2_SU32_SUS128_SVW1_TT1_16_VW1_WGM8
    SolutionIndex: 80
    SolutionNameMin: Cijk_Alik_Bjlk_HHS_BH_MT32x32x32_MI16x16x16x1_SN_1LDSB1_AMAS0_GRVW4_IU2_LPA8_LPB8_NLCB1_SIA2_SU32_SUS128_SVW1_TT1_16_VW1_WGM8
    SolutionIndex: 81
    SolutionNameMin: Cijk_Alik_Bjlk_HHS_BH_MT32x32x32_MI16x16x16x1_SN_1LDSB1_AMAS0_GRVW8_IU2_LPA8_LPB0_NLCB1_SIA2_SU32_SUS128_SVW1_TT1_16_VW1_WGM8
    SolutionIndex: 82
    SolutionNameMin: Cijk_Alik_Bjlk_HHS_BH_MT32x32x32_MI16x16x16x1_SN_1LDSB1_AMAS0_GRVW8_IU2_LPA8_LPB8_NLCB1_SIA2_SU32_SUS128_SVW1_TT1_16_VW1_WGM8
    SolutionIndex: 83
    SolutionNameMin: Cijk_Alik_Bjlk_HHS_BH_MT32x32x32_MI16x16x16x1_SN_1LDSB0_AMAS0_GRVW8_IU1_LPA8_LPB0_NLCB1_SIA1_SU32_SUS256_SVW1_TT1_16_VW1_WGM8
    SolutionIndex: 84
    SolutionNameMin: Cijk_Alik_Bjlk_HHS_BH_MT32x32x32_MI16x16x16x1_SN_1LDSB1_AMAS0_GRVW2_IU2_LPA8_LPB0_NLCB1_SIA2_SU32_SUS256_SVW1_TT1_16_VW1_WGM8
    SolutionIndex: 85
    SolutionNameMin: Cijk_Alik_Bjlk_HHS_BH_MT32x32x32_MI16x16x16x1_SN_1LDSB1_AMAS0_GRVW8_IU2_LPA8_LPB0_NLCB1_SIA2_SU32_SUS256_SVW1_TT1_16_VW1_WGM8
    SolutionIndex: 86
    SolutionNameMin: Cijk_Alik_Bjlk_HHS_BH_MT32x32x32_MI16x16x16x1_SN_1LDSB1_AMAS0_GRVW8_IU2_LPA8_LPB8_NLCB1_SIA2_SU32_SUS256_SVW1_TT1_16_VW1_WGM8
    SolutionIndex: 87
    SolutionNameMin: Cijk_Alik_Bjlk_HHS_BH_MT64x64x32_MI16x16x16x1_SN_1LDSB0_AMAS3_GRVW4_IU1_LPA8_LPB0_NLCB1_SIA1_SU0_SUS0_SVW2_TT2_32_VW2_WGM4
    SolutionIndex: 88
    SolutionNameMin: Cijk_Alik_Bjlk_HHS_BH_MT64x64x32_MI16x16x16x1_SN_1LDSB0_AMAS3_GRVW4_IU1_LPA8_LPB8_NLCB1_SIA1_SU0_SUS0_SVW2_TT2_32_VW2_WGM4
    SolutionIndex: 89
    SolutionNameMin: Cijk_Alik_Bjlk_HHS_BH_MT64x64x32_MI16x16x16x1_SN_1LDSB0_AMAS3_GRVW8_IU1_LPA8_LPB0_NLCB1_SIA1_SU0_SUS0_SVW2_TT2_32_VW2_WGM4
    SolutionIndex: 90
    SolutionNameMin: Cijk_Alik_Bjlk_HHS_BH_MT64x64x32_MI16x16x16x1_SN_1LDSB0_AMAS3_GRVW8_IU1_LPA8_LPB8_NLCB1_SIA1_SU0_SUS0_SVW2_TT2_32_VW2_WGM4
    SolutionIndex: 91
    SolutionNameMin: Cijk_Alik_Bjlk_HHS_BH_MT64x64x32_MI16x16x16x1_SN_1LDSB1_AMAS3_GRVW4_IU2_LPA8_LPB0_NLCB1_SIA2_SU0_SUS0_SVW2_TT2_32_VW2_WGM4
    SolutionIndex: 92
    SolutionNameMin: Cijk_Alik_Bjlk_HHS_BH_MT64x64x32_MI16x16x16x1_SN_1LDSB1_AMAS3_GRVW4_IU2_LPA8_LPB8_NLCB1_SIA2_SU0_SUS0_SVW2_TT2_32_VW2_WGM4
    SolutionIndex: 93
    SolutionNameMin: Cijk_Alik_Bjlk_HHS_BH_MT64x64x32_MI16x16x16x1_SN_1LDSB1_AMAS3_GRVW8_IU2_LPA8_LPB0_NLCB1_SIA2_SU0_SUS0_SVW2_TT2_32_VW2_WGM4
    SolutionIndex: 94
    SolutionNameMin: Cijk_Alik_Bjlk_HHS_BH_MT64x64x32_MI16x16x16x1_SN_1LDSB1_AMAS3_GRVW8_IU2_LPA8_LPB8_NLCB1_SIA2_SU0_SUS0_SVW2_TT2_32_VW2_WGM4
    SolutionIndex: 95
    SolutionNameMin: Cijk_Alik_Bjlk_HHS_BH_MT64x64x32_MI16x16x16x1_SN_1LDSB0_AMAS3_GRVW8_IU1_LPA8_LPB0_NLCB1_SIA3_SU0_SUS0_SVW2_TT2_32_VW2_WGM4
    SolutionIndex: 96
    SolutionNameMin: Cijk_Alik_Bjlk_HHS_BH_MT64x64x32_MI16x16x16x1_SN_1LDSB0_AMAS3_GRVW8_IU1_LPA8_LPB8_NLCB1_SIA3_SU0_SUS0_SVW2_TT2_32_VW2_WGM4
    SolutionIndex: 97
    SolutionNameMin: Cijk_Alik_Bjlk_HHS_BH_MT64x64x32_MI16x16x16x1_SN_1LDSB0_AMAS3_GRVW8_IU1_LPA8_LPB8_NLCB1_SIA1_SU32_SUS128_SVW2_TT2_32_VW2_WGM4
    SolutionIndex: 98
    SolutionNameMin: Cijk_Alik_Bjlk_HHS_BH_MT64x64x32_MI16x16x16x1_SN_1LDSB1_AMAS3_GRVW8_IU2_LPA8_LPB0_NLCB1_SIA2_SU32_SUS128_SVW2_TT2_32_VW2_WGM4
    SolutionIndex: 99
    SolutionNameMin: Cijk_Alik_Bjlk_HHS_BH_MT64x64x32_MI16x16x16x1_SN_1LDSB1_AMAS3_GRVW8_IU2_LPA8_LPB8_NLCB1_SIA2_SU32_SUS128_SVW2_TT2_32_VW2_WGM4
    SolutionIndex: 100
    SolutionNameMin: Cijk_Alik_Bjlk_HHS_BH_MT64x64x32_MI16x16x16x1_SN_1LDSB1_AMAS3_GRVW8_IU2_LPA8_LPB0_NLCB1_SIA2_SU32_SUS256_SVW2_TT2_32_VW2_WGM4
    SolutionIndex: 101
    SolutionNameMin: Cijk_Alik_Bjlk_HHS_BH_MT64x64x32_MI16x16x16x1_SN_1LDSB1_AMAS3_GRVW8_IU2_LPA8_LPB8_NLCB1_SIA2_SU32_SUS256_SVW2_TT2_32_VW2_WGM4
    SolutionIndex: 102
    SolutionNameMin: Cijk_Alik_Bjlk_HHS_BH_MT64x64x32_MI16x16x16x1_SN_1LDSB0_AMAS3_GRVW8_IU1_LPA8_LPB0_NLCB1_SIA3_SU32_SUS256_SVW2_TT2_32_VW2_WGM4
    SolutionIndex: 103
    SolutionNameMin: Cijk_Alik_Bjlk_HHS_BH_MT64x64x32_MI16x16x16x1_SN_1LDSB0_AMAS3_GRVW4_IU1_LPA8_LPB0_NLCB1_SIA1_SU0_SUS0_SVW2_TT2_32_VW2_WGM8
    SolutionIndex: 104
    SolutionNameMin: Cijk_Alik_Bjlk_HHS_BH_MT64x64x32_MI16x16x16x1_SN_1LDSB0_AMAS3_GRVW4_IU1_LPA8_LPB8_NLCB1_SIA1_SU0_SUS0_SVW2_TT2_32_VW2_WGM8
    SolutionIndex: 105
    SolutionNameMin: Cijk_Alik_Bjlk_HHS_BH_MT64x64x32_MI16x16x16x1_SN_1LDSB0_AMAS3_GRVW8_IU1_LPA8_LPB0_NLCB1_SIA1_SU0_SUS0_SVW2_TT2_32_VW2_WGM8
    SolutionIndex: 106
    SolutionNameMin: Cijk_Alik_Bjlk_HHS_BH_MT64x64x32_MI16x16x16x1_SN_1LDSB0_AMAS3_GRVW8_IU1_LPA8_LPB8_NLCB1_SIA1_SU0_SUS0_SVW2_TT2_32_VW2_WGM8
    SolutionIndex: 107
    SolutionNameMin: Cijk_Alik_Bjlk_HHS_BH_MT64x64x32_MI16x16x16x1_SN_1LDSB1_AMAS3_GRVW4_IU2_LPA8_LPB0_NLCB1_SIA2_SU0_SUS0_SVW2_TT2_32_VW2_WGM8
    SolutionIndex: 108
    SolutionNameMin: Cijk_Alik_Bjlk_HHS_BH_MT64x64x32_MI16x16x16x1_SN_1LDSB1_AMAS3_GRVW4_IU2_LPA8_LPB8_NLCB1_SIA2_SU0_SUS0_SVW2_TT2_32_VW2_WGM8
    SolutionIndex: 109
    SolutionNameMin: Cijk_Alik_Bjlk_HHS_BH_MT64x64x32_MI16x16x16x1_SN_1LDSB1_AMAS3_GRVW8_IU2_LPA8_LPB0_NLCB1_SIA2_SU0_SUS0_SVW2_TT2_32_VW2_WGM8
    SolutionIndex: 110
    SolutionNameMin: Cijk_Alik_Bjlk_HHS_BH_MT64x64x32_MI16x16x16x1_SN_1LDSB1_AMAS3_GRVW8_IU2_LPA8_LPB8_NLCB1_SIA2_SU0_SUS0_SVW2_TT2_32_VW2_WGM8
    SolutionIndex: 111
    SolutionNameMin: Cijk_Alik_Bjlk_HHS_BH_MT64x64x32_MI16x16x16x1_SN_1LDSB0_AMAS3_GRVW8_IU1_LPA8_LPB0_NLCB1_SIA3_SU0_SUS0_SVW2_TT2_32_VW2_WGM8
    SolutionIndex: 112
    SolutionNameMin: Cijk_Alik_Bjlk_HHS_BH_MT64x64x32_MI16x16x16x1_SN_1LDSB0_AMAS3_GRVW8_IU1_LPA8_LPB8_NLCB1_SIA3_SU0_SUS0_SVW2_TT2_32_VW2_WGM8
    SolutionIndex: 113
    SolutionNameMin: Cijk_Alik_Bjlk_HHS_BH_MT64x64x32_MI16x16x16x1_SN_1LDSB0_AMAS3_GRVW8_IU1_LPA8_LPB0_NLCB1_SIA1_SU32_SUS128_SVW2_TT2_32_VW2_WGM8
    SolutionIndex: 114
    SolutionNameMin: Cijk_Alik_Bjlk_HHS_BH_MT64x64x32_MI16x16x16x1_SN_1LDSB1_AMAS3_GRVW4_IU2_LPA8_LPB0_NLCB1_SIA2_SU32_SUS128_SVW2_TT2_32_VW2_WGM8
    SolutionIndex: 115
    SolutionNameMin: Cijk_Alik_Bjlk_HHS_BH_MT64x64x32_MI16x16x16x1_SN_1LDSB1_AMAS3_GRVW8_IU2_LPA8_LPB0_NLCB1_SIA2_SU32_SUS128_SVW2_TT2_32_VW2_WGM8
    SolutionIndex: 116
    SolutionNameMin: Cijk_Alik_Bjlk_HHS_BH_MT64x64x32_MI16x16x16x1_SN_1LDSB1_AMAS3_GRVW8_IU2_LPA8_LPB8_NLCB1_SIA2_SU32_SUS128_SVW2_TT2_32_VW2_WGM8
    SolutionIndex: 117
    SolutionNameMin: Cijk_Alik_Bjlk_HHS_BH_MT64x64x32_MI16x16x16x1_SN_1LDSB0_AMAS3_GRVW8_IU1_LPA8_LPB0_NLCB1_SIA3_SU32_SUS128_SVW2_TT2_32_VW2_WGM8
    SolutionIndex: 118
    SolutionNameMin: Cijk_Alik_Bjlk_HHS_BH_MT64x64x32_MI16x16x16x1_SN_1LDSB1_AMAS3_GRVW4_IU2_LPA8_LPB8_NLCB1_SIA2_SU32_SUS256_SVW2_TT2_32_VW2_WGM8
    SolutionIndex: 119
    SolutionNameMin: Cijk_Alik_Bjlk_HHS_BH_MT64x64x32_MI16x16x16x1_SN_1LDSB1_AMAS0_GRVW8_IU2_LPA8_LPB8_NLCB1_SIA2_SU32_SUS256_SVW1_TT2_32_VW1_WGM8
    SolutionIndex: 120
    SolutionNameMin: Cijk_Alik_Bjlk_HHS_BH_MT64x64x32_MI16x16x16x1_SN_1LDSB1_AMAS3_GRVW8_IU2_LPA8_LPB0_NLCB1_SIA2_SU32_SUS256_SVW2_TT2_32_VW2_WGM8
    SolutionIndex: 121
    SolutionNameMin: Cijk_Alik_Bjlk_HHS_BH_MT64x64x32_MI16x16x16x1_SN_1LDSB1_AMAS3_GRVW8_IU2_LPA8_LPB8_NLCB1_SIA2_SU32_SUS256_SVW2_TT2_32_VW2_WGM8
    SolutionIndex: 122
    SolutionNameMin: Cijk_Alik_Bjlk_HHS_BH_MT64x64x32_MI16x16x16x1_SN_1LDSB0_AMAS3_GRVW8_IU1_LPA8_LPB0_NLCB1_SIA3_SU32_SUS256_SVW2_TT2_32_VW2_WGM8
    SolutionIndex: 123
    SolutionNameMin: Cijk_Alik_Bjlk_HHS_BH_MT64x64x32_MI16x16x16x1_SN_1LDSB0_AMAS3_GRVW8_IU1_LPA8_LPB8_NLCB1_SIA3_SU32_SUS256_SVW2_TT2_32_VW2_WGM8
- - - [64, 64, 1, 64, 96, 96, 96, 96]
    - [63, 0.091]
  - - [64, 64, 1, 128, 96, 96, 160, 160]
    - [82, 0.176]
  - - [64, 64, 1, 256, 96, 96, 288, 288]
    - [74, 0.324]
  - - [64, 64, 1, 512, 96, 96, 544, 544]
    - [74, 0.556]
  - - [64, 64, 1, 1024, 96, 96, 1056, 1056]
    - [75, 0.873]
  - - [64, 64, 1, 2048, 96, 96, 2080, 2080]
    - [60, 1.213]
  - - [64, 64, 1, 4096, 96, 96, 4128, 4128]
    - [59, 1.507]
  - - [64, 128, 1, 64, 96, 96, 96, 128]
    - [60, 0.187]
  - - [64, 128, 1, 128, 96, 96, 160, 160]
    - [81, 0.355]
  - - [64, 128, 1, 256, 96, 96, 288, 288]
    - [85, 0.659]
  - - [64, 128, 1, 512, 96, 96, 544, 544]
    - [86, 1.129]
  - - [64, 128, 1, 1024, 96, 96, 1056, 1056]
    - [74, 1.764]
  - - [64, 128, 1, 2048, 96, 96, 2080, 2080]
    - [75, 2.447]
  - - [64, 128, 1, 4096, 96, 96, 4128, 4128]
    - [65, 3.043]
  - - [64, 256, 1, 64, 96, 96, 96, 256]
    - [60, 0.372]
  - - [64, 256, 1, 128, 96, 96, 160, 256]
    - [77, 0.722]
  - - [64, 256, 1, 256, 96, 96, 288, 288]
    - [81, 1.329]
  - - [64, 256, 1, 512, 96, 96, 544, 544]
    - [85, 2.264]
  - - [64, 256, 1, 1024, 96, 96, 1056, 1056]
    - [69, 3.535]
  - - [64, 256, 1, 2048, 96, 96, 2080, 2080]
    - [65, 4.891]
  - - [64, 256, 1, 4096, 96, 96, 4128, 4128]
    - [66, 6.073]
  - - [64, 512, 1, 64, 96, 96, 96, 512]
    - [74, 0.744]
  - - [64, 512, 1, 128, 96, 96, 160, 512]
    - [61, 1.401]
  - - [64, 512, 1, 256, 96, 96, 288, 512]
    - [76, 2.537]
  - - [64, 512, 1, 512, 96, 96, 544, 544]
    - [81, 4.249]
  - - [64, 512, 1, 1024, 96, 96, 1056, 1056]
    - [61, 6.397]
  - - [64, 512, 1, 2048, 96, 96, 2080, 2080]
    - [59, 8.551]
  - - [64, 512, 1, 4096, 96, 96, 4128, 4128]
    - [76, 10.277]
  - - [64, 1024, 1, 64, 96, 96, 96, 1024]
    - [58, 1.452]
  - - [64, 1024, 1, 128, 96, 96, 160, 1024]
    - [68, 2.699]
  - - [64, 1024, 1, 256, 96, 96, 288, 1024]
    - [56, 4.768]
  - - [64, 1024, 1, 512, 96, 96, 544, 1024]
    - [56, 7.681]
  - - [64, 1024, 1, 1024, 96, 96, 1056, 1056]
    - [57, 11.138]
  - - [64, 1024, 1, 2048, 96, 96, 2080, 2080]
    - [57, 14.244]
  - - [64, 1024, 1, 4096, 96, 96, 4128, 4128]
    - [57, 16.562]
  - - [64, 2048, 1, 64, 96, 96, 96, 2048]
    - [9, 2.76]
  - - [64, 2048, 1, 128, 96, 96, 160, 2048]
    - [10, 4.998]
  - - [64, 2048, 1, 256, 96, 96, 288, 2048]
    - [115, 8.491]
  - - [64, 2048, 1, 512, 96, 96, 544, 2048]
    - [109, 13.036]
  - - [64, 2048, 1, 1024, 96, 96, 1056, 2048]
    - [93, 17.729]
  - - [64, 2048, 1, 2048, 96, 96, 2080, 2080]
    - [109, 21.634]
  - - [64, 2048, 1, 4096, 96, 96, 4128, 4128]
    - [97, 23.46]
  - - [64, 4096, 1, 64, 96, 96, 96, 4096]
    - [4, 5.168]
  - - [64, 4096, 1, 128, 96, 96, 160, 4096]
    - [0, 9.193]
  - - [64, 4096, 1, 256, 96, 96, 288, 4096]
    - [111, 14.96]
  - - [64, 4096, 1, 512, 96, 96, 544, 4096]
    - [1, 21.573]
  - - [64, 4096, 1, 1024, 96, 96, 1056, 4096]
    - [2, 27.853]
  - - [64, 4096, 1, 2048, 96, 96, 2080, 4096]
    - [2, 32.809]
  - - [64, 4096, 1, 4096, 96, 96, 4128, 4128]
    - [12, 34.955]
  - - [128, 64, 1, 64, 160, 160, 96, 96]
    - [82, 0.186]
  - - [128, 64, 1, 128, 160, 160, 160, 160]
    - [67, 0.358]
  - - [128, 64, 1, 256, 160, 160, 288, 288]
    - [75, 0.655]
  - - [128, 64, 1, 512, 160, 160, 544, 544]
    - [81, 1.126]
  - - [128, 64, 1, 1024, 160, 160, 1056, 1056]
    - [75, 1.76]
  - - [128, 64, 1, 2048, 160, 160, 2080, 2080]
    - [59, 2.434]
  - - [128, 64, 1, 4096, 160, 160, 4128, 4128]
    - [74, 3.016]
  - - [128, 128, 1, 64, 160, 160, 96, 128]
    - [77, 0.378]
  - - [128, 128, 1, 128, 160, 160, 160, 160]
    - [67, 0.72]
  - - [128, 128, 1, 256, 160, 160, 288, 288]
    - [81, 1.324]
  - - [128, 128, 1, 512, 160, 160, 544, 544]
    - [67, 2.27]
  - - [128, 128, 1, 1024, 160, 160, 1056, 1056]
    - [69, 3.557]
  - - [128, 128, 1, 2048, 160, 160, 2080, 2080]
    - [70, 4.922]
  - - [128, 128, 1, 4096, 160, 160, 4128, 4128]
    - [65, 6.106]
  - - [128, 256, 1, 64, 160, 160, 96, 256]
    - [81, 0.743]
  - - [128, 256, 1, 128, 160, 160, 160, 256]
    - [74, 1.414]
  - - [128, 256, 1, 256, 160, 160, 288, 288]
    - [74, 2.556]
  - - [128, 256, 1, 512, 160, 160, 544, 544]
    - [61, 4.263]
  - - [128, 256, 1, 1024, 160, 160, 1056, 1056]
    - [76, 6.405]
  - - [128, 256, 1, 2048, 160, 160, 2080, 2080]
    - [61, 8.561]
  - - [128, 256, 1, 4096, 160, 160, 4128, 4128]
    - [76, 10.287]
  - - [128, 512, 1, 64, 160, 160, 96, 512]
    - [73, 1.441]
  - - [128, 512, 1, 128, 160, 160, 160, 512]
    - [83, 2.684]
  - - [128, 512, 1, 256, 160, 160, 288, 512]
    - [55, 4.728]
  - - [128, 512, 1, 512, 160, 160, 544, 544]
    - [57, 7.752]
  - - [128, 512, 1, 1024, 160, 160, 1056, 1056]
    - [73, 11.135]
  - - [128, 512, 1, 2048, 160, 160, 2080, 2080]
    - [57, 14.233]
  - - [128, 512, 1, 4096, 160, 160, 4128, 4128]
    - [78, 16.623]
  - - [128, 1024, 1, 64, 160, 160, 96, 1024]
    - [107, 2.751]
  - - [128, 1024, 1, 128, 160, 160, 160, 1024]
    - [115, 5.015]
  - - [128, 1024, 1, 256, 160, 160, 288, 1024]
    - [106, 8.547]
  - - [128, 1024, 1, 512, 160, 160, 544, 1024]
    - [90, 13.311]
  - - [128, 1024, 1, 1024, 160, 160, 1056, 1056]
    - [88, 18.118]
  - - [128, 1024, 1, 2048, 160, 160, 2080, 2080]
    - [87, 22.477]
  - - [128, 1024, 1, 4096, 160, 160, 4128, 4128]
    - [88, 25.45]
  - - [128, 2048, 1, 64, 160, 160, 96, 2048]
    - [8, 5.22]
  - - [128, 2048, 1, 128, 160, 160, 160, 2048]
    - [7, 9.264]
  - - [128, 2048, 1, 256, 160, 160, 288, 2048]
    - [111, 15.147]
  - - [128, 2048, 1, 512, 160, 160, 544, 2048]
    - [111, 22.095]
  - - [128, 2048, 1, 1024, 160, 160, 1056, 2048]
    - [111, 28.644]
  - - [128, 2048, 1, 2048, 160, 160, 2080, 2080]
    - [112, 33.644]
  - - [128, 2048, 1, 4096, 160, 160, 4128, 4128]
    - [7, 35.091]
  - - [128, 4096, 1, 64, 160, 160, 96, 4096]
    - [9, 9.536]
  - - [128, 4096, 1, 128, 160, 160, 160, 4096]
    - [10, 15.887]
  - - [128, 4096, 1, 256, 160, 160, 288, 4096]
    - [117, 24.035]
  - - [128, 4096, 1, 512, 160, 160, 544, 4096]
    - [20, 32.508]
  - - [128, 4096, 1, 1024, 160, 160, 1056, 4096]
    - [52, 39.9]
  - - [128, 4096, 1, 2048, 160, 160, 2080, 4096]
    - [53, 42.964]
  - - [128, 4096, 1, 4096, 160, 160, 4128, 4128]
    - [52, 46.846]
  - - [256, 64, 1, 64, 288, 288, 96, 96]
    - [61, 0.376]
  - - [256, 64, 1, 128, 288, 288, 160, 160]
    - [76, 0.724]
  - - [256, 64, 1, 256, 288, 288, 288, 288]
    - [71, 1.317]
  - - [256, 64, 1, 512, 288, 288, 544, 544]
    - [59, 2.254]
  - - [256, 64, 1, 1024, 288, 288, 1056, 1056]
    - [60, 3.531]
  - - [256, 64, 1, 2048, 288, 288, 2080, 2080]
    - [74, 4.871]
  - - [256, 64, 1, 4096, 288, 288, 4128, 4128]
    - [66, 6.007]
  - - [256, 128, 1, 64, 288, 288, 96, 128]
    - [62, 0.744]
  - - [256, 128, 1, 128, 288, 288, 160, 160]
    - [76, 1.407]
  - - [256, 128, 1, 256, 288, 288, 288, 288]
    - [76, 2.554]
  - - [256, 128, 1, 512, 288, 288, 544, 544]
    - [76, 4.259]
  - - [256, 128, 1, 1024, 288, 288, 1056, 1056]
    - [59, 6.389]
  - - [256, 128, 1, 2048, 288, 288, 2080, 2080]
    - [76, 8.564]
  - - [256, 128, 1, 4096, 288, 288, 4128, 4128]
    - [76, 10.286]
  - - [256, 256, 1, 64, 288, 288, 96, 256]
    - [73, 1.462]
  - - [256, 256, 1, 128, 288, 288, 160, 256]
    - [56, 2.706]
  - - [256, 256, 1, 256, 288, 288, 288, 288]
    - [72, 4.77]
  - - [256, 256, 1, 512, 288, 288, 544, 544]
    - [64, 7.717]
  - - [256, 256, 1, 1024, 288, 288, 1056, 1056]
    - [73, 11.181]
  - - [256, 256, 1, 2048, 288, 288, 2080, 2080]
    - [73, 14.26]
  - - [256, 256, 1, 4096, 288, 288, 4128, 4128]
    - [57, 16.606]
  - - [256, 512, 1, 64, 288, 288, 96, 512]
    - [11, 2.761]
  - - [256, 512, 1, 128, 288, 288, 160, 512]
    - [94, 5.018]
  - - [256, 512, 1, 256, 288, 288, 288, 512]
    - [103, 8.528]
  - - [256, 512, 1, 512, 288, 288, 544, 544]
    - [105, 13.275]
  - - [256, 512, 1, 1024, 288, 288, 1056, 1056]
    - [104, 18.226]
  - - [256, 512, 1, 2048, 288, 288, 2080, 2080]
    - [106, 22.559]
  - - [256, 512, 1, 4096, 288, 288, 4128, 4128]
    - [104, 25.589]
  - - [256, 1024, 1, 64, 288, 288, 96, 1024]
    - [1, 5.205]
  - - [256, 1024, 1, 128, 288, 288, 160, 1024]
    - [1, 9.304]
  - - [256, 1024, 1, 256, 288, 288, 288, 1024]
    - [1, 15.215]
  - - [256, 1024, 1, 512, 288, 288, 544, 1024]
    - [96, 22.01]
  - - [256, 1024, 1, 1024, 288, 288, 1056, 1056]
    - [95, 28.58]
  - - [256, 1024, 1, 2048, 288, 288, 2080, 2080]
    - [96, 33.577]
  - - [256, 1024, 1, 4096, 288, 288, 4128, 4128]
    - [117, 35.057]
  - - [256, 2048, 1, 64, 288, 288, 96, 2048]
    - [9, 9.531]
  - - [256, 2048, 1, 128, 288, 288, 160, 2048]
    - [10, 15.881]
  - - [256, 2048, 1, 256, 288, 288, 288, 2048]
    - [111, 23.953]
  - - [256, 2048, 1, 512, 288, 288, 544, 2048]
    - [25, 32.501]
  - - [256, 2048, 1, 1024, 288, 288, 1056, 2048]
    - [53, 39.889]
  - - [256, 2048, 1, 2048, 288, 288, 2080, 2080]
    - [23, 42.972]
  - - [256, 2048, 1, 4096, 288, 288, 4128, 4128]
    - [26, 46.842]
  - - [256, 4096, 1, 64, 288, 288, 96, 4096]
    - [5, 15.703]
  - - [256, 4096, 1, 128, 288, 288, 160, 4096]
    - [7, 24.534]
  - - [256, 4096, 1, 256, 288, 288, 288, 4096]
    - [36, 34.213]
  - - [256, 4096, 1, 512, 288, 288, 544, 4096]
    - [37, 43.769]
  - - [256, 4096, 1, 1024, 288, 288, 1056, 4096]
    - [27, 50.799]
  - - [256, 4096, 1, 2048, 288, 288, 2080, 4096]
    - [27, 53.514]
  - - [256, 4096, 1, 4096, 288, 288, 4128, 4128]
    - [41, 56.906]
  - - [384, 64, 1, 64, 416, 416, 96, 96]
    - [62, 0.566]
  - - [384, 64, 1, 128, 416, 416, 160, 160]
    - [77, 1.079]
  - - [384, 64, 1, 256, 416, 416, 288, 288]
    - [81, 1.964]
  - - [384, 64, 1, 512, 416, 416, 544, 544]
    - [60, 3.391]
  - - [384, 64, 1, 1024, 416, 416, 1056, 1056]
    - [74, 5.295]
  - - [384, 64, 1, 2048, 416, 416, 2080, 2080]
    - [80, 7.277]
  - - [384, 64, 1, 4096, 416, 416, 4128, 4128]
    - [80, 8.99]
  - - [384, 128, 1, 64, 416, 416, 96, 128]
    - [77, 1.119]
  - - [384, 128, 1, 128, 416, 416, 160, 160]
    - [79, 2.094]
  - - [384, 128, 1, 256, 416, 416, 288, 288]
    - [74, 3.794]
  - - [384, 128, 1, 512, 416, 416, 544, 544]
    - [81, 6.333]
  - - [384, 128, 1, 1024, 416, 416, 1056, 1056]
    - [67, 9.547]
  - - [384, 128, 1, 2048, 416, 416, 2080, 2080]
    - [84, 12.505]
  - - [384, 128, 1, 4096, 416, 416, 4128, 4128]
    - [74, 15.359]
  - - [384, 256, 1, 64, 416, 416, 96, 256]
    - [109, 2.11]
  - - [384, 256, 1, 128, 416, 416, 160, 256]
    - [91, 3.88]
  - - [384, 256, 1, 256, 416, 416, 288, 288]
    - [94, 6.731]
  - - [384, 256, 1, 512, 416, 416, 544, 544]
    - [110, 10.763]
  - - [384, 256, 1, 1024, 416, 416, 1056, 1056]
    - [109, 15.193]
  - - [384, 256, 1, 2048, 416, 416, 2080, 2080]
    - [120, 19.092]
  - - [384, 256, 1, 4096, 416, 416, 4128, 4128]
    - [110, 21.918]
  - - [384, 512, 1, 64, 416, 416, 96, 512]
    - [109, 4.097]
  - - [384, 512, 1, 128, 416, 416, 160, 512]
    - [100, 7.458]
  - - [384, 512, 1, 256, 416, 416, 288, 512]
    - [118, 12.613]
  - - [384, 512, 1, 512, 416, 416, 544, 544]
    - [93, 19.451]
  - - [384, 512, 1, 1024, 416, 416, 1056, 1056]
    - [89, 26.756]
  - - [384, 512, 1, 2048, 416, 416, 2080, 2080]
    - [90, 32.981]
  - - [384, 512, 1, 4096, 416, 416, 4128, 4128]
    - [113, 36.386]
  - - [384, 1024, 1, 64, 416, 416, 96, 1024]
    - [9, 7.462]
  - - [384, 1024, 1, 128, 416, 416, 160, 1024]
    - [10, 12.796]
  - - [384, 1024, 1, 256, 416, 416, 288, 1024]
    - [117, 19.973]
  - - [384, 1024, 1, 512, 416, 416, 544, 1024]
    - [102, 28.091]
  - - [384, 1024, 1, 1024, 416, 416, 1056, 1056]
    - [95, 35.046]
  - - [384, 1024, 1, 2048, 416, 416, 2080, 2080]
    - [96, 39.684]
  - - [384, 1024, 1, 4096, 416, 416, 4128, 4128]
    - [123, 41.315]
  - - [384, 2048, 1, 64, 416, 416, 96, 2048]
    - [9, 12.748]
  - - [384, 2048, 1, 128, 416, 416, 160, 2048]
    - [34, 21.561]
  - - [384, 2048, 1, 256, 416, 416, 288, 2048]
    - [52, 33.687]
  - - [384, 2048, 1, 512, 416, 416, 544, 2048]
    - [34, 46.888]
  - - [384, 2048, 1, 1024, 416, 416, 1056, 2048]
    - [19, 58.246]
  - - [384, 2048, 1, 2048, 416, 416, 2080, 2080]
    - [52, 63.416]
  - - [384, 2048, 1, 4096, 416, 416, 4128, 4128]
    - [34, 69.458]
  - - [384, 4096, 1, 64, 416, 416, 96, 4096]
    - [11, 20.645]
  - - [384, 4096, 1, 128, 416, 416, 160, 4096]
    - [29, 31.306]
  - - [384, 4096, 1, 256, 416, 416, 288, 4096]
    - [16, 43.266]
  - - [384, 4096, 1, 512, 416, 416, 544, 4096]
    - [39, 53.564]
  - - [384, 4096, 1, 1024, 416, 416, 1056, 4096]
    - [45, 58.38]
  - - [384, 4096, 1, 2048, 416, 416, 2080, 4096]
    - [51, 64.269]
  - - [384, 4096, 1, 4096, 416, 416, 4128, 4128]
    - [44, 67.794]
  - - [768, 64, 1, 64, 800, 800, 96, 96]
    - [80, 1.11]
  - - [768, 64, 1, 128, 800, 800, 160, 160]
    - [77, 2.096]
  - - [768, 64, 1, 256, 800, 800, 288, 288]
    - [67, 3.798]
  - - [768, 64, 1, 512, 800, 800, 544, 544]
    - [76, 6.336]
  - - [768, 64, 1, 1024, 800, 800, 1056, 1056]
    - [76, 9.581]
  - - [768, 64, 1, 2048, 800, 800, 2080, 2080]
    - [74, 12.811]
  - - [768, 64, 1, 4096, 800, 800, 4128, 4128]
    - [76, 15.324]
  - - [768, 128, 1, 64, 800, 800, 96, 128]
    - [110, 2.112]
  - - [768, 128, 1, 128, 800, 800, 160, 160]
    - [116, 3.879]
  - - [768, 128, 1, 256, 800, 800, 288, 288]
    - [93, 6.79]
  - - [768, 128, 1, 512, 800, 800, 544, 544]
    - [94, 10.742]
  - - [768, 128, 1, 1024, 800, 800, 1056, 1056]
    - [115, 15.155]
  - - [768, 128, 1, 2048, 800, 800, 2080, 2080]
    - [107, 19.09]
  - - [768, 128, 1, 4096, 800, 800, 4128, 4128]
    - [93, 21.914]
  - - [768, 256, 1, 64, 800, 800, 96, 256]
    - [10, 4.076]
  - - [768, 256, 1, 128, 800, 800, 160, 256]
    - [94, 7.449]
  - - [768, 256, 1, 256, 800, 800, 288, 288]
    - [109, 12.661]
  - - [768, 256, 1, 512, 800, 800, 544, 544]
    - [94, 19.403]
  - - [768, 256, 1, 1024, 800, 800, 1056, 1056]
    - [110, 26.516]
  - - [768, 256, 1, 2048, 800, 800, 2080, 2080]
    - [110, 32.336]
  - - [768, 256, 1, 4096, 800, 800, 4128, 4128]
    - [119, 34.657]
  - - [768, 512, 1, 64, 800, 800, 96, 512]
    - [9, 7.464]
  - - [768, 512, 1, 128, 800, 800, 160, 512]
    - [9, 12.79]
  - - [768, 512, 1, 256, 800, 800, 288, 512]
    - [111, 20.042]
  - - [768, 512, 1, 512, 800, 800, 544, 544]
    - [123, 28.031]
  - - [768, 512, 1, 1024, 800, 800, 1056, 1056]
    - [95, 35.051]
  - - [768, 512, 1, 2048, 800, 800, 2080, 2080]
    - [122, 39.659]
  - - [768, 512, 1, 4096, 800, 800, 4128, 4128]
    - [123, 41.247]
  - - [768, 1024, 1, 64, 800, 800, 96, 1024]
    - [109, 12.77]
  - - [768, 1024, 1, 128, 800, 800, 160, 1024]
    - [52, 21.609]
  - - [768, 1024, 1, 256, 800, 800, 288, 1024]
    - [34, 33.809]
  - - [768, 1024, 1, 512, 800, 800, 544, 1024]
    - [34, 47.023]
  - - [768, 1024, 1, 1024, 800, 800, 1056, 1056]
    - [52, 58.239]
  - - [768, 1024, 1, 2048, 800, 800, 2080, 2080]
    - [34, 63.425]
  - - [768, 1024, 1, 4096, 800, 800, 4128, 4128]
    - [35, 69.51]
  - - [768, 2048, 1, 64, 800, 800, 96, 2048]
    - [13, 20.604]
  - - [768, 2048, 1, 128, 800, 800, 160, 2048]
    - [39, 31.06]
  - - [768, 2048, 1, 256, 800, 800, 288, 2048]
    - [15, 43.352]
  - - [768, 2048, 1, 512, 800, 800, 544, 2048]
    - [47, 53.375]
  - - [768, 2048, 1, 1024, 800, 800, 1056, 2048]
    - [51, 58.324]
  - - [768, 2048, 1, 2048, 800, 800, 2080, 2080]
    - [31, 64.328]
  - - [768, 2048, 1, 4096, 800, 800, 4128, 4128]
    - [42, 67.697]
  - - [768, 4096, 1, 64, 800, 800, 96, 4096]
    - [22, 30.405]
  - - [768, 4096, 1, 128, 800, 800, 160, 4096]
    - [30, 45.347]
  - - [768, 4096, 1, 256, 800, 800, 288, 4096]
    - [29, 58.593]
  - - [768, 4096, 1, 512, 800, 800, 544, 4096]
    - [17, 64.57]
  - - [768, 4096, 1, 1024, 800, 800, 1056, 4096]
    - [40, 71.843]
  - - [768, 4096, 1, 2048, 800, 800, 2080, 4096]
    - [28, 75.946]
  - - [768, 4096, 1, 4096, 800, 800, 4128, 4128]
    - [17, 78.679]
  - - [1536, 64, 1, 64, 1568, 1568, 96, 96]
    - [109, 2.117]
  - - [1536, 64, 1, 128, 1568, 1568, 160, 160]
    - [99, 3.887]
  - - [1536, 64, 1, 256, 1568, 1568, 288, 288]
    - [110, 6.794]
  - - [1536, 64, 1, 512, 1568, 1568, 544, 544]
    - [93, 10.739]
  - - [1536, 64, 1, 1024, 1568, 1568, 1056, 1056]
    - [93, 15.18]
  - - [1536, 64, 1, 2048, 1568, 1568, 2080, 2080]
    - [110, 19.083]
  - - [1536, 64, 1, 4096, 1568, 1568, 4128, 4128]
    - [109, 21.915]
  - - [1536, 128, 1, 64, 1568, 1568, 96, 128]
    - [94, 4.09]
  - - [1536, 128, 1, 128, 1568, 1568, 160, 160]
    - [107, 7.418]
  - - [1536, 128, 1, 256, 1568, 1568, 288, 288]
    - [92, 12.589]
  - - [1536, 128, 1, 512, 1568, 1568, 544, 544]
    - [109, 19.341]
  - - [1536, 128, 1, 1024, 1568, 1568, 1056, 1056]
    - [93, 26.456]
  - - [1536, 128, 1, 2048, 1568, 1568, 2080, 2080]
    - [110, 32.284]
  - - [1536, 128, 1, 4096, 1568, 1568, 4128, 4128]
    - [108, 34.132]
  - - [1536, 256, 1, 64, 1568, 1568, 96, 256]
    - [101, 7.443]
  - - [1536, 256, 1, 128, 1568, 1568, 160, 256]
    - [95, 12.798]
  - - [1536, 256, 1, 256, 1568, 1568, 288, 288]
    - [112, 20.098]
  - - [1536, 256, 1, 512, 1568, 1568, 544, 544]
    - [96, 28.023]
  - - [1536, 256, 1, 1024, 1568, 1568, 1056, 1056]
    - [95, 34.939]
  - - [1536, 256, 1, 2048, 1568, 1568, 2080, 2080]
    - [96, 39.727]
  - - [1536, 256, 1, 4096, 1568, 1568, 4128, 4128]
    - [96, 41.356]
  - - [1536, 512, 1, 64, 1568, 1568, 96, 512]
    - [121, 12.669]
  - - [1536, 512, 1, 128, 1568, 1568, 160, 512]
    - [34, 21.278]
  - - [1536, 512, 1, 256, 1568, 1568, 288, 512]
    - [34, 33.478]
  - - [1536, 512, 1, 512, 1568, 1568, 544, 544]
    - [34, 46.691]
  - - [1536, 512, 1, 1024, 1568, 1568, 1056, 1056]
    - [20, 58.001]
  - - [1536, 512, 1, 2048, 1568, 1568, 2080, 2080]
    - [20, 63.254]
  - - [1536, 512, 1, 4096, 1568, 1568, 4128, 4128]
    - [34, 69.381]
  - - [1536, 1024, 1, 64, 1568, 1568, 96, 1024]
    - [3, 20.529]
  - - [1536, 1024, 1, 128, 1568, 1568, 160, 1024]
    - [1, 30.96]
  - - [1536, 1024, 1, 256, 1568, 1568, 288, 1024]
    - [39, 43.17]
  - - [1536, 1024, 1, 512, 1568, 1568, 544, 1024]
    - [47, 54.03]
  - - [1536, 1024, 1, 1024, 1568, 1568, 1056, 1056]
    - [38, 58.644]
  - - [1536, 1024, 1, 2048, 1568, 1568, 2080, 2080]
    - [49, 64.146]
  - - [1536, 1024, 1, 4096, 1568, 1568, 4128, 4128]
    - [50, 67.393]
  - - [1536, 2048, 1, 64, 1568, 1568, 96, 2048]
    - [4, 29.914]
  - - [1536, 2048, 1, 128, 1568, 1568, 160, 2048]
    - [30, 45.241]
  - - [1536, 2048, 1, 256, 1568, 1568, 288, 2048]
    - [30, 58.608]
  - - [1536, 2048, 1, 512, 1568, 1568, 544, 2048]
    - [29, 65.935]
  - - [1536, 2048, 1, 1024, 1568, 1568, 1056, 2048]
    - [47, 72.534]
  - - [1536, 2048, 1, 2048, 1568, 1568, 2080, 2080]
    - [21, 77.123]
  - - [1536, 2048, 1, 4096, 1568, 1568, 4128, 4128]
    - [17, 79.3]
  - - [1536, 4096, 1, 64, 1568, 1568, 96, 4096]
    - [14, 40.71]
  - - [1536, 4096, 1, 128, 1568, 1568, 160, 4096]
    - [37, 57.129]
  - - [1536, 4096, 1, 256, 1568, 1568, 288, 4096]
    - [17, 70.581]
  - - [1536, 4096, 1, 512, 1568, 1568, 544, 4096]
    - [17, 77.669]
  - - [1536, 4096, 1, 1024, 1568, 1568, 1056, 4096]
    - [16, 83.868]
  - - [1536, 4096, 1, 2048, 1568, 1568, 2080, 4096]
    - [17, 87.507]
  - - [1536, 4096, 1, 4096, 1568, 1568, 4128, 4128]
    - [29, 88.42]
  - - [3072, 64, 1, 64, 3104, 3104, 96, 96]
    - [9, 4.069]
  - - [3072, 64, 1, 128, 3104, 3104, 160, 160]
    - [6, 7.364]
  - - [3072, 64, 1, 256, 3104, 3104, 288, 288]
    - [108, 12.522]
  - - [3072, 64, 1, 512, 3104, 3104, 544, 544]
    - [91, 19.321]
  - - [3072, 64, 1, 1024, 3104, 3104, 1056, 1056]
    - [108, 26.424]
  - - [3072, 64, 1, 2048, 3104, 3104, 2080, 2080]
    - [93, 32.315]
  - - [3072, 64, 1, 4096, 3104, 3104, 4128, 4128]
    - [114, 35.57]
  - - [3072, 128, 1, 64, 3104, 3104, 96, 128]
    - [98, 7.494]
  - - [3072, 128, 1, 128, 3104, 3104, 160, 160]
    - [9, 12.822]
  - - [3072, 128, 1, 256, 3104, 3104, 288, 288]
    - [96, 20.128]
  - - [3072, 128, 1, 512, 3104, 3104, 544, 544]
    - [96, 28.009]
  - - [3072, 128, 1, 1024, 3104, 3104, 1056, 1056]
    - [112, 35.04]
  - - [3072, 128, 1, 2048, 3104, 3104, 2080, 2080]
    - [112, 39.87]
  - - [3072, 128, 1, 4096, 3104, 3104, 4128, 4128]
    - [111, 41.628]
  - - [3072, 256, 1, 64, 3104, 3104, 96, 256]
    - [109, 12.744]
  - - [3072, 256, 1, 128, 3104, 3104, 160, 256]
    - [43, 21.124]
  - - [3072, 256, 1, 256, 3104, 3104, 288, 288]
    - [18, 33.166]
  - - [3072, 256, 1, 512, 3104, 3104, 544, 544]
    - [18, 45.807]
  - - [3072, 256, 1, 1024, 3104, 3104, 1056, 1056]
    - [33, 56.837]
  - - [3072, 256, 1, 2048, 3104, 3104, 2080, 2080]
    - [33, 61.833]
  - - [3072, 256, 1, 4096, 3104, 3104, 4128, 4128]
    - [52, 67.743]
  - - [3072, 512, 1, 64, 3104, 3104, 96, 512]
    - [5, 20.781]
  - - [3072, 512, 1, 128, 3104, 3104, 160, 512]
    - [1, 30.963]
  - - [3072, 512, 1, 256, 3104, 3104, 288, 512]
    - [39, 43.017]
  - - [3072, 512, 1, 512, 3104, 3104, 544, 544]
    - [48, 53.588]
  - - [3072, 512, 1, 1024, 3104, 3104, 1056, 1056]
    - [39, 58.262]
  - - [3072, 512, 1, 2048, 3104, 3104, 2080, 2080]
    - [32, 63.803]
  - - [3072, 512, 1, 4096, 3104, 3104, 4128, 4128]
    - [31, 67.159]
  - - [3072, 1024, 1, 64, 3104, 3104, 96, 1024]
    - [39, 30.181]
  - - [3072, 1024, 1, 128, 3104, 3104, 160, 1024]
    - [29, 45.294]
  - - [3072, 1024, 1, 256, 3104, 3104, 288, 1024]
    - [29, 58.983]
  - - [3072, 1024, 1, 512, 3104, 3104, 544, 1024]
    - [30, 65.991]
  - - [3072, 1024, 1, 1024, 3104, 3104, 1056, 1056]
    - [40, 72.945]
  - - [3072, 1024, 1, 2048, 3104, 3104, 2080, 2080]
    - [21, 77.174]
  - - [3072, 1024, 1, 4096, 3104, 3104, 4128, 4128]
    - [17, 79.629]
  - - [3072, 2048, 1, 64, 3104, 3104, 96, 2048]
    - [54, 40.916]
  - - [3072, 2048, 1, 128, 3104, 3104, 160, 2048]
    - [46, 57.167]
  - - [3072, 2048, 1, 256, 3104, 3104, 288, 2048]
    - [17, 70.596]
  - - [3072, 2048, 1, 512, 3104, 3104, 544, 2048]
    - [30, 77.636]
  - - [3072, 2048, 1, 1024, 3104, 3104, 1056, 2048]
    - [40, 84.017]
  - - [3072, 2048, 1, 2048, 3104, 3104, 2080, 2080]
    - [17, 87.819]
  - - [3072, 2048, 1, 4096, 3104, 3104, 4128, 4128]
    - [17, 88.799]
  - - [3072, 4096, 1, 64, 3104, 3104, 96, 4096]
    - [24, 49.877]
  - - [3072, 4096, 1, 128, 3104, 3104, 160, 4096]
    - [30, 62.777]
  - - [3072, 4096, 1, 256, 3104, 3104, 288, 4096]
    - [30, 75.069]
  - - [3072, 4096, 1, 512, 3104, 3104, 544, 4096]
    - [30, 83.068]
  - - [3072, 4096, 1, 1024, 3104, 3104, 1056, 4096]
    - [17, 87.82]
  - - [3072, 4096, 1, 2048, 3104, 3104, 2080, 4096]
    - [16, 89.792]
  - - [3072, 4096, 1, 4096, 3104, 3104, 4128, 4128]
    - [29, 91.267]
- null
- null
- DeviceEfficiency
