library/src/blas3/Tensile/Logic/asm_full/navi32/navi32_Cijk_Alik_Bljk_HB_GB.yaml
- {MinimumRequiredVersion: 4.35.0}
- navi32
- gfx1101
- [Device 73f0]
    SolutionIndex: 0
    SolutionNameMin: Cijk_Alik_Bljk_HB_MT64x64x16_MI16x16x16x1_SN_1LDSB0_AMAS3_GRVW4_IU1_LPA8_LPB8_SIA1_SU0_SUS0_SVW2_TT2_32_VW2_WGM4
    SolutionIndex: 1
    SolutionNameMin: Cijk_Alik_Bljk_HB_MT64x64x16_MI16x16x16x1_SN_1LDSB0_AMAS3_GRVW8_IU1_LPA8_LPB8_SIA1_SU0_SUS0_SVW2_TT2_32_VW2_WGM4
    SolutionIndex: 2
    SolutionNameMin: Cijk_Alik_Bljk_HB_MT64x64x16_MI16x16x16x1_SN_1LDSB1_AMAS3_GRVW4_IU1_LPA8_LPB8_SIA2_SU0_SUS0_SVW2_TT2_32_VW2_WGM4
    SolutionIndex: 3
    SolutionNameMin: Cijk_Alik_Bljk_HB_MT64x64x16_MI16x16x16x1_SN_1LDSB1_AMAS3_GRVW8_IU1_LPA8_LPB0_SIA2_SU0_SUS0_SVW2_TT2_32_VW2_WGM4
    SolutionIndex: 4
    SolutionNameMin: Cijk_Alik_Bljk_HB_MT64x64x16_MI16x16x16x1_SN_1LDSB1_AMAS3_GRVW8_IU1_LPA8_LPB8_SIA2_SU0_SUS0_SVW2_TT2_32_VW2_WGM4
    SolutionIndex: 5
    SolutionNameMin: Cijk_Alik_Bljk_HB_MT64x64x16_MI16x16x16x1_SN_1LDSB0_AMAS3_GRVW8_IU1_LPA8_LPB8_SIA3_SU0_SUS0_SVW2_TT2_32_VW2_WGM4
    SolutionIndex: 6
    SolutionNameMin: Cijk_Alik_Bljk_HB_MT64x64x16_MI16x16x16x1_SN_1LDSB1_AMAS3_GRVW4_IU1_LPA8_LPB8_SIA2_SU32_SUS128_SVW2_TT2_32_VW2_WGM4
    SolutionIndex: 7
    SolutionNameMin: Cijk_Alik_Bljk_HB_MT64x64x16_MI16x16x16x1_SN_1LDSB1_AMAS3_GRVW8_IU1_LPA8_LPB8_SIA2_SU32_SUS128_SVW2_TT2_32_VW2_WGM4
    SolutionIndex: 8
    SolutionNameMin: Cijk_Alik_Bljk_HB_MT64x64x16_MI16x16x16x1_SN_1LDSB1_AMAS3_GRVW2_IU1_LPA8_LPB8_SIA2_SU32_SUS256_SVW2_TT2_32_VW2_WGM4
    SolutionIndex: 9
    SolutionNameMin: Cijk_Alik_Bljk_HB_MT64x64x16_MI16x16x16x1_SN_1LDSB1_AMAS3_GRVW4_IU1_LPA8_LPB8_SIA2_SU32_SUS256_SVW2_TT2_32_VW2_WGM4
    SolutionIndex: 10
    SolutionNameMin: Cijk_Alik_Bljk_HB_MT64x64x16_MI16x16x16x1_SN_1LDSB1_AMAS3_GRVW8_IU1_LPA8_LPB8_SIA2_SU32_SUS256_SVW2_TT2_32_VW2_WGM4
    SolutionIndex: 11
    SolutionNameMin: Cijk_Alik_Bljk_HB_MT64x64x16_MI16x16x16x1_SN_1LDSB0_AMAS3_GRVW8_IU1_LPA8_LPB8_SIA3_SU32_SUS256_SVW2_TT2_32_VW2_WGM4
    SolutionIndex: 12
    SolutionNameMin: Cijk_Alik_Bljk_HB_MT64x64x16_MI16x16x16x1_SN_1LDSB0_AMAS3_GRVW8_IU1_LPA8_LPB8_SIA1_SU0_SUS0_SVW2_TT2_32_VW2_WGM8
    SolutionIndex: 13
    SolutionNameMin: Cijk_Alik_Bljk_HB_MT64x64x16_MI16x16x16x1_SN_1LDSB1_AMAS3_GRVW4_IU1_LPA8_LPB8_SIA2_SU0_SUS0_SVW2_TT2_32_VW2_WGM8
    SolutionIndex: 14
    SolutionNameMin: Cijk_Alik_Bljk_HB_MT64x64x16_MI16x16x16x1_SN_1LDSB1_AMAS3_GRVW8_IU1_LPA8_LPB8_SIA2_SU0_SUS0_SVW2_TT2_32_VW2_WGM8
    SolutionIndex: 15
    SolutionNameMin: Cijk_Alik_Bljk_HB_MT64x64x16_MI16x16x16x1_SN_1LDSB0_AMAS3_GRVW8_IU1_LPA8_LPB8_SIA3_SU0_SUS0_SVW2_TT2_32_VW2_WGM8
    SolutionIndex: 16
    SolutionNameMin: Cijk_Alik_Bljk_HB_MT64x64x16_MI16x16x16x1_SN_1LDSB0_AMAS3_GRVW4_IU1_LPA8_LPB8_SIA1_SU32_SUS128_SVW2_TT2_32_VW2_WGM8
    SolutionIndex: 17
    SolutionNameMin: Cijk_Alik_Bljk_HB_MT64x64x16_MI16x16x16x1_SN_1LDSB1_AMAS3_GRVW4_IU1_LPA8_LPB8_SIA2_SU32_SUS128_SVW2_TT2_32_VW2_WGM8
    SolutionIndex: 18
    SolutionNameMin: Cijk_Alik_Bljk_HB_MT64x64x16_MI16x16x16x1_SN_1LDSB1_AMAS3_GRVW8_IU1_LPA8_LPB8_SIA2_SU32_SUS128_SVW2_TT2_32_VW2_WGM8
    SolutionIndex: 19
    SolutionNameMin: Cijk_Alik_Bljk_HB_MT64x64x16_MI16x16x16x1_SN_1LDSB0_AMAS3_GRVW8_IU1_LPA8_LPB8_SIA3_SU32_SUS128_SVW2_TT2_32_VW2_WGM8
    SolutionIndex: 20
    SolutionNameMin: Cijk_Alik_Bljk_HB_MT64x64x16_MI16x16x16x1_SN_1LDSB1_AMAS3_GRVW2_IU1_LPA8_LPB8_SIA2_SU32_SUS256_SVW2_TT2_32_VW2_WGM8
    SolutionIndex: 21
    SolutionNameMin: Cijk_Alik_Bljk_HB_MT64x64x16_MI16x16x16x1_SN_1LDSB1_AMAS3_GRVW8_IU1_LPA8_LPB8_SIA2_SU32_SUS256_SVW2_TT2_32_VW2_WGM8
    SolutionIndex: 22
    SolutionNameMin: Cijk_Alik_Bljk_HB_MT128x128x16_MI16x16x16x1_SN_1LDSB0_AMAS0_GRVW2_IU1_LPA8_LPB0_SIA1_SU0_SUS0_SVW1_TT4_64_VW1_WGM4
    SolutionIndex: 23
    SolutionNameMin: Cijk_Alik_Bljk_HB_MT128x128x16_MI16x16x16x1_SN_1LDSB0_AMAS3_GRVW2_IU1_LPA8_LPB0_SIA1_SU0_SUS0_SVW2_TT4_64_VW2_WGM4
    SolutionIndex: 24
    SolutionNameMin: Cijk_Alik_Bljk_HB_MT128x128x16_MI16x16x16x1_SN_1LDSB0_AMAS3_GRVW8_IU1_LPA8_LPB8_SIA1_SU0_SUS0_SVW2_TT4_64_VW2_WGM4
    SolutionIndex: 25
    SolutionNameMin: Cijk_Alik_Bljk_HB_MT128x128x16_MI16x16x16x1_SN_1LDSB0_AMAS0_GRVW2_IU1_LPA8_LPB0_SIA3_SU0_SUS0_SVW1_TT4_64_VW1_WGM4
    SolutionIndex: 26
    SolutionNameMin: Cijk_Alik_Bljk_HB_MT128x128x16_MI16x16x16x1_SN_1LDSB0_AMAS0_GRVW2_IU1_LPA8_LPB8_SIA3_SU0_SUS0_SVW1_TT4_64_VW1_WGM4
    SolutionIndex: 27
    SolutionNameMin: Cijk_Alik_Bljk_HB_MT128x128x16_MI16x16x16x1_SN_1LDSB0_AMAS3_GRVW2_IU1_LPA8_LPB0_SIA3_SU0_SUS0_SVW2_TT4_64_VW2_WGM4
    SolutionIndex: 28
    SolutionNameMin: Cijk_Alik_Bljk_HB_MT128x128x16_MI16x16x16x1_SN_1LDSB0_AMAS3_GRVW2_IU1_LPA8_LPB8_SIA3_SU0_SUS0_SVW2_TT4_64_VW2_WGM4
    SolutionIndex: 29
    SolutionNameMin: Cijk_Alik_Bljk_HB_MT128x128x16_MI16x16x16x1_SN_1LDSB0_AMAS3_GRVW8_IU1_LPA8_LPB8_SIA3_SU0_SUS0_SVW2_TT4_64_VW2_WGM4
    SolutionIndex: 30
    SolutionNameMin: Cijk_Alik_Bljk_HB_MT128x128x16_MI16x16x16x1_SN_1LDSB0_AMAS3_GRVW2_IU1_LPA8_LPB0_SIA1_SU32_SUS128_SVW2_TT4_64_VW2_WGM4
    SolutionIndex: 31
    SolutionNameMin: Cijk_Alik_Bljk_HB_MT128x128x16_MI16x16x16x1_SN_1LDSB0_AMAS3_GRVW2_IU1_LPA8_LPB0_SIA1_SU0_SUS0_SVW2_TT4_64_VW2_WGM8
    SolutionIndex: 32
    SolutionNameMin: Cijk_Alik_Bljk_HB_MT128x128x16_MI16x16x16x1_SN_1LDSB0_AMAS3_GRVW4_IU1_LPA8_LPB8_SIA1_SU0_SUS0_SVW2_TT4_64_VW2_WGM8
    SolutionIndex: 33
    SolutionNameMin: Cijk_Alik_Bljk_HB_MT128x128x16_MI16x16x16x1_SN_1LDSB0_AMAS3_GRVW8_IU1_LPA8_LPB8_SIA1_SU0_SUS0_SVW2_TT4_64_VW2_WGM8
    SolutionIndex: 34
    SolutionNameMin: Cijk_Alik_Bljk_HB_MT128x128x16_MI16x16x16x1_SN_1LDSB0_AMAS0_GRVW4_IU1_LPA8_LPB8_SIA3_SU0_SUS0_SVW1_TT4_64_VW1_WGM8
    SolutionIndex: 35
    SolutionNameMin: Cijk_Alik_Bljk_HB_MT128x128x16_MI16x16x16x1_SN_1LDSB0_AMAS3_GRVW8_IU1_LPA8_LPB8_SIA3_SU0_SUS0_SVW2_TT4_64_VW2_WGM8
    SolutionIndex: 36
    SolutionNameMin: Cijk_Alik_Bljk_HB_MT128x128x16_MI16x16x16x1_SN_1LDSB0_AMAS3_GRVW2_IU1_LPA8_LPB0_SIA1_SU32_SUS128_SVW2_TT4_64_VW2_WGM8
    SolutionIndex: 37
    SolutionNameMin: Cijk_Alik_Bljk_HB_MT128x128x16_MI16x16x16x1_SN_1LDSB0_AMAS3_GRVW2_IU1_LPA8_LPB8_SIA1_SU32_SUS128_SVW2_TT4_64_VW2_WGM8
    SolutionIndex: 38
    SolutionNameMin: Cijk_Alik_Bljk_HB_MT128x128x16_MI16x16x16x1_SN_1LDSB0_AMAS3_GRVW2_IU1_LPA8_LPB0_SIA1_SU32_SUS256_SVW2_TT4_64_VW2_WGM8
    SolutionIndex: 39
    SolutionNameMin: Cijk_Alik_Bljk_HB_MT128x128x16_MI16x16x16x1_SN_1LDSB0_AMAS3_GRVW8_IU1_LPA8_LPB8_SIA1_SU32_SUS256_SVW2_TT4_64_VW2_WGM8
    SolutionIndex: 40
    SolutionNameMin: Cijk_Alik_Bljk_HB_MT128x128x16_MI16x16x16x1_SN_1LDSB0_AMAS0_GRVW8_IU1_LPA8_LPB8_SIA3_SU32_SUS256_SVW1_TT4_64_VW1_WGM8
    SolutionIndex: 41
    SolutionNameMin: Cijk_Alik_Bljk_HB_MT32x32x32_MI16x16x16x1_SN_1LDSB0_AMAS0_GRVW8_IU1_LPA8_LPB8_SIA1_SU0_SUS0_SVW1_TT1_16_VW1_WGM4
    SolutionIndex: 42
    SolutionNameMin: Cijk_Alik_Bljk_HB_MT32x32x32_MI16x16x16x1_SN_1LDSB1_AMAS0_GRVW2_IU2_LPA8_LPB8_SIA2_SU0_SUS0_SVW1_TT1_16_VW1_WGM4
    SolutionIndex: 43
    SolutionNameMin: Cijk_Alik_Bljk_HB_MT32x32x32_MI16x16x16x1_SN_1LDSB1_AMAS0_GRVW4_IU2_LPA8_LPB8_SIA2_SU0_SUS0_SVW1_TT1_16_VW1_WGM4
    SolutionIndex: 44
    SolutionNameMin: Cijk_Alik_Bljk_HB_MT32x32x32_MI16x16x16x1_SN_1LDSB1_AMAS0_GRVW8_IU2_LPA8_LPB8_SIA2_SU0_SUS0_SVW1_TT1_16_VW1_WGM4
    SolutionIndex: 45
    SolutionNameMin: Cijk_Alik_Bljk_HB_MT32x32x32_MI16x16x16x1_SN_1LDSB0_AMAS0_GRVW2_IU1_LPA8_LPB8_SIA3_SU0_SUS0_SVW1_TT1_16_VW1_WGM4
    SolutionIndex: 46
    SolutionNameMin: Cijk_Alik_Bljk_HB_MT32x32x32_MI16x16x16x1_SN_1LDSB0_AMAS0_GRVW4_IU1_LPA8_LPB8_SIA1_SU32_SUS128_SVW1_TT1_16_VW1_WGM4
    SolutionIndex: 47
    SolutionNameMin: Cijk_Alik_Bljk_HB_MT32x32x32_MI16x16x16x1_SN_1LDSB1_AMAS0_GRVW2_IU2_LPA8_LPB8_SIA2_SU32_SUS128_SVW1_TT1_16_VW1_WGM4
    SolutionIndex: 48
    SolutionNameMin: Cijk_Alik_Bljk_HB_MT32x32x32_MI16x16x16x1_SN_1LDSB1_AMAS0_GRVW4_IU2_LPA8_LPB8_SIA2_SU32_SUS128_SVW1_TT1_16_VW1_WGM4
    SolutionIndex: 49
    SolutionNameMin: Cijk_Alik_Bljk_HB_MT32x32x32_MI16x16x16x1_SN_1LDSB1_AMAS0_GRVW8_IU2_LPA8_LPB8_SIA2_SU32_SUS128_SVW1_TT1_16_VW1_WGM4
    SolutionIndex: 50
    SolutionNameMin: Cijk_Alik_Bljk_HB_MT32x32x32_MI16x16x16x1_SN_1LDSB1_AMAS0_GRVW4_IU2_LPA8_LPB8_SIA2_SU32_SUS256_SVW1_TT1_16_VW1_WGM4
    SolutionIndex: 51
    SolutionNameMin: Cijk_Alik_Bljk_HB_MT32x32x32_MI16x16x16x1_SN_1LDSB1_AMAS0_GRVW8_IU2_LPA8_LPB8_SIA2_SU32_SUS256_SVW1_TT1_16_VW1_WGM4
    SolutionIndex: 52
    SolutionNameMin: Cijk_Alik_Bljk_HB_MT32x32x32_MI16x16x16x1_SN_1LDSB0_AMAS0_GRVW4_IU1_LPA8_LPB8_SIA1_SU0_SUS0_SVW1_TT1_16_VW1_WGM8
    SolutionIndex: 53
    SolutionNameMin: Cijk_Alik_Bljk_HB_MT32x32x32_MI16x16x16x1_SN_1LDSB1_AMAS0_GRVW2_IU2_LPA8_LPB8_SIA2_SU0_SUS0_SVW1_TT1_16_VW1_WGM8
    SolutionIndex: 54
    SolutionNameMin: Cijk_Alik_Bljk_HB_MT32x32x32_MI16x16x16x1_SN_1LDSB1_AMAS0_GRVW4_IU2_LPA8_LPB8_SIA2_SU0_SUS0_SVW1_TT1_16_VW1_WGM8
    SolutionIndex: 55
    SolutionNameMin: Cijk_Alik_Bljk_HB_MT32x32x32_MI16x16x16x1_SN_1LDSB1_AMAS0_GRVW8_IU2_LPA8_LPB8_SIA2_SU0_SUS0_SVW1_TT1_16_VW1_WGM8
    SolutionIndex: 56
    SolutionNameMin: Cijk_Alik_Bljk_HB_MT32x32x32_MI16x16x16x1_SN_1LDSB0_AMAS0_GRVW2_IU1_LPA0_LPB8_SIA3_SU0_SUS0_SVW1_TT1_16_VW1_WGM8
    SolutionIndex: 57
    SolutionNameMin: Cijk_Alik_Bljk_HB_MT32x32x32_MI16x16x16x1_SN_1LDSB0_AMAS0_GRVW4_IU1_LPA8_LPB8_SIA3_SU0_SUS0_SVW1_TT1_16_VW1_WGM8
    SolutionIndex: 58
    SolutionNameMin: Cijk_Alik_Bljk_HB_MT32x32x32_MI16x16x16x1_SN_1LDSB0_AMAS0_GRVW8_IU1_LPA8_LPB8_SIA3_SU0_SUS0_SVW1_TT1_16_VW1_WGM8
    SolutionIndex: 59
    SolutionNameMin: Cijk_Alik_Bljk_HB_MT32x32x32_MI16x16x16x1_SN_1LDSB1_AMAS0_GRVW4_IU2_LPA8_LPB8_SIA2_SU32_SUS128_SVW1_TT1_16_VW1_WGM8
    SolutionIndex: 60
    SolutionNameMin: Cijk_Alik_Bljk_HB_MT32x32x32_MI16x16x16x1_SN_1LDSB1_AMAS0_GRVW8_IU2_LPA8_LPB8_SIA2_SU32_SUS128_SVW1_TT1_16_VW1_WGM8
    SolutionIndex: 61
    SolutionNameMin: Cijk_Alik_Bljk_HB_MT32x32x32_MI16x16x16x1_SN_1LDSB0_AMAS0_GRVW8_IU1_LPA8_LPB8_SIA3_SU32_SUS128_SVW1_TT1_16_VW1_WGM8
    SolutionIndex: 62
    SolutionNameMin: Cijk_Alik_Bljk_HB_MT32x32x32_MI16x16x16x1_SN_1LDSB1_AMAS0_GRVW2_IU2_LPA8_LPB8_SIA2_SU32_SUS256_SVW1_TT1_16_VW1_WGM8
    SolutionIndex: 63
    SolutionNameMin: Cijk_Alik_Bljk_HB_MT32x32x32_MI16x16x16x1_SN_1LDSB1_AMAS0_GRVW4_IU2_LPA8_LPB8_SIA2_SU32_SUS256_SVW1_TT1_16_VW1_WGM8
    SolutionIndex: 64
    SolutionNameMin: Cijk_Alik_Bljk_HB_MT32x32x32_MI16x16x16x1_SN_1LDSB1_AMAS0_GRVW8_IU2_LPA8_LPB8_SIA2_SU32_SUS256_SVW1_TT1_16_VW1_WGM8
    SolutionIndex: 65
    SolutionNameMin: Cijk_Alik_Bljk_HB_MT64x64x32_MI16x16x16x1_SN_1LDSB0_AMAS0_GRVW4_IU1_LPA8_LPB8_SIA1_SU0_SUS0_SVW1_TT2_32_VW1_WGM4
    SolutionIndex: 66
    SolutionNameMin: Cijk_Alik_Bljk_HB_MT64x64x32_MI16x16x16x1_SN_1LDSB0_AMAS0_GRVW8_IU1_LPA8_LPB8_SIA1_SU0_SUS0_SVW1_TT2_32_VW1_WGM4
    SolutionIndex: 67
    SolutionNameMin: Cijk_Alik_Bljk_HB_MT64x64x32_MI16x16x16x1_SN_1LDSB0_AMAS3_GRVW8_IU1_LPA8_LPB8_SIA1_SU0_SUS0_SVW2_TT2_32_VW2_WGM4
    SolutionIndex: 68
    SolutionNameMin: Cijk_Alik_Bljk_HB_MT64x64x32_MI16x16x16x1_SN_1LDSB1_AMAS0_GRVW4_IU2_LPA8_LPB8_SIA2_SU0_SUS0_SVW1_TT2_32_VW1_WGM4
    SolutionIndex: 69
    SolutionNameMin: Cijk_Alik_Bljk_HB_MT64x64x32_MI16x16x16x1_SN_1LDSB1_AMAS3_GRVW4_IU2_LPA8_LPB8_SIA2_SU0_SUS0_SVW2_TT2_32_VW2_WGM4
    SolutionIndex: 70
    SolutionNameMin: Cijk_Alik_Bljk_HB_MT64x64x32_MI16x16x16x1_SN_1LDSB1_AMAS0_GRVW8_IU2_LPA8_LPB8_SIA2_SU0_SUS0_SVW1_TT2_32_VW1_WGM4
    SolutionIndex: 71
    SolutionNameMin: Cijk_Alik_Bljk_HB_MT64x64x32_MI16x16x16x1_SN_1LDSB1_AMAS3_GRVW8_IU2_LPA8_LPB8_SIA2_SU0_SUS0_SVW2_TT2_32_VW2_WGM4
    SolutionIndex: 72
    SolutionNameMin: Cijk_Alik_Bljk_HB_MT64x64x32_MI16x16x16x1_SN_1LDSB1_AMAS3_GRVW4_IU2_LPA8_LPB8_SIA2_SU32_SUS128_SVW2_TT2_32_VW2_WGM4
    SolutionIndex: 73
    SolutionNameMin: Cijk_Alik_Bljk_HB_MT64x64x32_MI16x16x16x1_SN_1LDSB1_AMAS3_GRVW8_IU2_LPA8_LPB8_SIA2_SU32_SUS128_SVW2_TT2_32_VW2_WGM4
    SolutionIndex: 74
    SolutionNameMin: Cijk_Alik_Bljk_HB_MT64x64x32_MI16x16x16x1_SN_1LDSB0_AMAS0_GRVW4_IU1_LPA8_LPB8_SIA1_SU32_SUS256_SVW1_TT2_32_VW1_WGM4
    SolutionIndex: 75
    SolutionNameMin: Cijk_Alik_Bljk_HB_MT64x64x32_MI16x16x16x1_SN_1LDSB0_AMAS0_GRVW8_IU1_LPA8_LPB8_SIA1_SU32_SUS256_SVW1_TT2_32_VW1_WGM4
    SolutionIndex: 76
    SolutionNameMin: Cijk_Alik_Bljk_HB_MT64x64x32_MI16x16x16x1_SN_1LDSB1_AMAS0_GRVW4_IU2_LPA8_LPB8_SIA2_SU32_SUS256_SVW1_TT2_32_VW1_WGM4
    SolutionIndex: 77
    SolutionNameMin: Cijk_Alik_Bljk_HB_MT64x64x32_MI16x16x16x1_SN_1LDSB1_AMAS3_GRVW8_IU2_LPA8_LPB8_SIA2_SU32_SUS256_SVW2_TT2_32_VW2_WGM4
    SolutionIndex: 78
    SolutionNameMin: Cijk_Alik_Bljk_HB_MT64x64x32_MI16x16x16x1_SN_1LDSB0_AMAS0_GRVW4_IU1_LPA8_LPB8_SIA1_SU0_SUS0_SVW1_TT2_32_VW1_WGM8
    SolutionIndex: 79
    SolutionNameMin: Cijk_Alik_Bljk_HB_MT64x64x32_MI16x16x16x1_SN_1LDSB0_AMAS3_GRVW4_IU1_LPA8_LPB8_SIA1_SU0_SUS0_SVW2_TT2_32_VW2_WGM8
    SolutionIndex: 80
    SolutionNameMin: Cijk_Alik_Bljk_HB_MT64x64x32_MI16x16x16x1_SN_1LDSB0_AMAS0_GRVW8_IU1_LPA8_LPB8_SIA1_SU0_SUS0_SVW1_TT2_32_VW1_WGM8
    SolutionIndex: 81
    SolutionNameMin: Cijk_Alik_Bljk_HB_MT64x64x32_MI16x16x16x1_SN_1LDSB0_AMAS3_GRVW8_IU1_LPA8_LPB8_SIA1_SU0_SUS0_SVW2_TT2_32_VW2_WGM8
    SolutionIndex: 82
    SolutionNameMin: Cijk_Alik_Bljk_HB_MT64x64x32_MI16x16x16x1_SN_1LDSB1_AMAS3_GRVW2_IU2_LPA8_LPB8_SIA2_SU0_SUS0_SVW2_TT2_32_VW2_WGM8
    SolutionIndex: 83
    SolutionNameMin: Cijk_Alik_Bljk_HB_MT64x64x32_MI16x16x16x1_SN_1LDSB1_AMAS0_GRVW4_IU2_LPA8_LPB8_SIA2_SU0_SUS0_SVW1_TT2_32_VW1_WGM8
    SolutionIndex: 84
    SolutionNameMin: Cijk_Alik_Bljk_HB_MT64x64x32_MI16x16x16x1_SN_1LDSB1_AMAS3_GRVW4_IU2_LPA8_LPB8_SIA2_SU0_SUS0_SVW2_TT2_32_VW2_WGM8
    SolutionIndex: 85
    SolutionNameMin: Cijk_Alik_Bljk_HB_MT64x64x32_MI16x16x16x1_SN_1LDSB1_AMAS0_GRVW8_IU2_LPA8_LPB8_SIA2_SU0_SUS0_SVW1_TT2_32_VW1_WGM8
    SolutionIndex: 86
    SolutionNameMin: Cijk_Alik_Bljk_HB_MT64x64x32_MI16x16x16x1_SN_1LDSB1_AMAS3_GRVW8_IU2_LPA8_LPB8_SIA2_SU0_SUS0_SVW2_TT2_32_VW2_WGM8
    SolutionIndex: 87
    SolutionNameMin: Cijk_Alik_Bljk_HB_MT64x64x32_MI16x16x16x1_SN_1LDSB0_AMAS0_GRVW8_IU1_LPA8_LPB8_SIA3_SU0_SUS0_SVW1_TT2_32_VW1_WGM8
    SolutionIndex: 88
    SolutionNameMin: Cijk_Alik_Bljk_HB_MT64x64x32_MI16x16x16x1_SN_1LDSB0_AMAS3_GRVW8_IU1_LPA8_LPB8_SIA3_SU0_SUS0_SVW2_TT2_32_VW2_WGM8
    SolutionIndex: 89
    SolutionNameMin: Cijk_Alik_Bljk_HB_MT64x64x32_MI16x16x16x1_SN_1LDSB0_AMAS0_GRVW4_IU1_LPA8_LPB8_SIA1_SU32_SUS128_SVW1_TT2_32_VW1_WGM8
    SolutionIndex: 90
    SolutionNameMin: Cijk_Alik_Bljk_HB_MT64x64x32_MI16x16x16x1_SN_1LDSB0_AMAS0_GRVW8_IU1_LPA8_LPB8_SIA1_SU32_SUS128_SVW1_TT2_32_VW1_WGM8
    SolutionIndex: 91
    SolutionNameMin: Cijk_Alik_Bljk_HB_MT64x64x32_MI16x16x16x1_SN_1LDSB0_AMAS3_GRVW8_IU1_LPA8_LPB8_SIA1_SU32_SUS128_SVW2_TT2_32_VW2_WGM8
    SolutionIndex: 92
    SolutionNameMin: Cijk_Alik_Bljk_HB_MT64x64x32_MI16x16x16x1_SN_1LDSB1_AMAS0_GRVW4_IU2_LPA8_LPB8_SIA2_SU32_SUS128_SVW1_TT2_32_VW1_WGM8
    SolutionIndex: 93
    SolutionNameMin: Cijk_Alik_Bljk_HB_MT64x64x32_MI16x16x16x1_SN_1LDSB1_AMAS0_GRVW8_IU2_LPA8_LPB8_SIA2_SU32_SUS128_SVW1_TT2_32_VW1_WGM8
    SolutionIndex: 94
    SolutionNameMin: Cijk_Alik_Bljk_HB_MT64x64x32_MI16x16x16x1_SN_1LDSB1_AMAS3_GRVW8_IU2_LPA8_LPB8_SIA2_SU32_SUS128_SVW2_TT2_32_VW2_WGM8
    SolutionIndex: 95
    SolutionNameMin: Cijk_Alik_Bljk_HB_MT64x64x32_MI16x16x16x1_SN_1LDSB1_AMAS0_GRVW4_IU2_LPA8_LPB8_SIA2_SU32_SUS256_SVW1_TT2_32_VW1_WGM8
    SolutionIndex: 96
    SolutionNameMin: Cijk_Alik_Bljk_HB_MT64x64x32_MI16x16x16x1_SN_1LDSB1_AMAS3_GRVW4_IU2_LPA8_LPB8_SIA2_SU32_SUS256_SVW2_TT2_32_VW2_WGM8
- - - [64, 64, 1, 64, 96, 96, 96, 96]
    - [43, 0.093]
  - - [64, 64, 1, 128, 96, 96, 160, 160]
    - [55, 0.178]
  - - [64, 64, 1, 256, 96, 96, 288, 288]
    - [55, 0.329]
  - - [64, 64, 1, 512, 96, 96, 544, 544]
    - [44, 0.567]
  - - [64, 64, 1, 1024, 96, 96, 1056, 1056]
    - [55, 0.89]
  - - [64, 64, 1, 2048, 96, 96, 2080, 2080]
    - [63, 1.226]
  - - [64, 64, 1, 4096, 96, 96, 4128, 4128]
    - [54, 1.527]
  - - [64, 128, 1, 64, 96, 96, 96, 96]
    - [45, 0.188]
  - - [64, 128, 1, 128, 96, 96, 160, 160]
    - [48, 0.359]
  - - [64, 128, 1, 256, 96, 96, 288, 288]
    - [43, 0.668]
  - - [64, 128, 1, 512, 96, 96, 544, 544]
    - [64, 1.143]
  - - [64, 128, 1, 1024, 96, 96, 1056, 1056]
    - [63, 1.792]
  - - [64, 128, 1, 2048, 96, 96, 2080, 2080]
    - [43, 2.469]
  - - [64, 128, 1, 4096, 96, 96, 4128, 4128]
    - [48, 3.062]
  - - [64, 256, 1, 64, 96, 96, 96, 96]
    - [56, 0.377]
  - - [64, 256, 1, 128, 96, 96, 160, 160]
    - [55, 0.722]
  - - [64, 256, 1, 256, 96, 96, 288, 288]
    - [59, 1.327]
  - - [64, 256, 1, 512, 96, 96, 544, 544]
    - [64, 2.303]
  - - [64, 256, 1, 1024, 96, 96, 1056, 1056]
    - [50, 3.589]
  - - [64, 256, 1, 2048, 96, 96, 2080, 2080]
    - [43, 4.936]
  - - [64, 256, 1, 4096, 96, 96, 4128, 4128]
    - [48, 6.117]
  - - [64, 512, 1, 64, 96, 96, 96, 96]
    - [55, 0.764]
  - - [64, 512, 1, 128, 96, 96, 160, 160]
    - [50, 1.445]
  - - [64, 512, 1, 256, 96, 96, 288, 288]
    - [55, 2.659]
  - - [64, 512, 1, 512, 96, 96, 544, 544]
    - [51, 4.519]
  - - [64, 512, 1, 1024, 96, 96, 1056, 1056]
    - [54, 7.095]
  - - [64, 512, 1, 2048, 96, 96, 2080, 2080]
    - [48, 9.823]
  - - [64, 512, 1, 4096, 96, 96, 4128, 4128]
    - [43, 12.184]
  - - [64, 1024, 1, 64, 96, 96, 96, 96]
    - [43, 1.465]
  - - [64, 1024, 1, 128, 96, 96, 160, 160]
    - [51, 2.79]
  - - [64, 1024, 1, 256, 96, 96, 288, 288]
    - [55, 5.096]
  - - [64, 1024, 1, 512, 96, 96, 544, 544]
    - [64, 8.606]
  - - [64, 1024, 1, 1024, 96, 96, 1056, 1056]
    - [55, 13.153]
  - - [64, 1024, 1, 2048, 96, 96, 2080, 2080]
    - [51, 17.687]
  - - [64, 1024, 1, 4096, 96, 96, 4128, 4128]
    - [55, 21.544]
  - - [64, 2048, 1, 64, 96, 96, 96, 96]
    - [0, 2.823]
  - - [64, 2048, 1, 128, 96, 96, 160, 160]
    - [76, 5.233]
  - - [64, 2048, 1, 256, 96, 96, 288, 288]
    - [85, 9.266]
  - - [64, 2048, 1, 512, 96, 96, 544, 544]
    - [95, 14.895]
  - - [64, 2048, 1, 1024, 96, 96, 1056, 1056]
    - [76, 21.348]
  - - [64, 2048, 1, 2048, 96, 96, 2080, 2080]
    - [95, 27.264]
  - - [64, 2048, 1, 4096, 96, 96, 4128, 4128]
    - [92, 31.682]
  - - [64, 4096, 1, 64, 96, 96, 96, 96]
    - [86, 5.412]
  - - [64, 4096, 1, 128, 96, 96, 160, 160]
    - [83, 9.807]
  - - [64, 4096, 1, 256, 96, 96, 288, 288]
    - [67, 16.789]
  - - [64, 4096, 1, 512, 96, 96, 544, 544]
    - [89, 26.053]
  - - [64, 4096, 1, 1024, 96, 96, 1056, 1056]
    - [80, 36.183]
  - - [64, 4096, 1, 2048, 96, 96, 2080, 2080]
    - [90, 44.896]
  - - [64, 4096, 1, 4096, 96, 96, 4128, 4128]
    - [75, 51.0]
  - - [128, 64, 1, 64, 160, 160, 96, 96]
    - [54, 0.188]
  - - [128, 64, 1, 128, 160, 160, 160, 160]
    - [44, 0.36]
  - - [128, 64, 1, 256, 160, 160, 288, 288]
    - [43, 0.667]
  - - [128, 64, 1, 512, 160, 160, 544, 544]
    - [50, 1.142]
  - - [128, 64, 1, 1024, 160, 160, 1056, 1056]
    - [54, 1.788]
  - - [128, 64, 1, 2048, 160, 160, 2080, 2080]
    - [50, 2.472]
  - - [128, 64, 1, 4096, 160, 160, 4128, 4128]
    - [63, 3.056]
  - - [128, 128, 1, 64, 160, 160, 96, 96]
    - [50, 0.379]
  - - [128, 128, 1, 128, 160, 160, 160, 160]
    - [42, 0.723]
  - - [128, 128, 1, 256, 160, 160, 288, 288]
    - [59, 1.338]
  - - [128, 128, 1, 512, 160, 160, 544, 544]
    - [62, 2.293]
  - - [128, 128, 1, 1024, 160, 160, 1056, 1056]
    - [59, 3.597]
  - - [128, 128, 1, 2048, 160, 160, 2080, 2080]
    - [63, 4.978]
  - - [128, 128, 1, 4096, 160, 160, 4128, 4128]
    - [59, 6.15]
  - - [128, 256, 1, 64, 160, 160, 96, 96]
    - [41, 0.755]
  - - [128, 256, 1, 128, 160, 160, 160, 160]
    - [43, 1.438]
  - - [128, 256, 1, 256, 160, 160, 288, 288]
    - [47, 2.642]
  - - [128, 256, 1, 512, 160, 160, 544, 544]
    - [63, 4.565]
  - - [128, 256, 1, 1024, 160, 160, 1056, 1056]
    - [53, 7.168]
  - - [128, 256, 1, 2048, 160, 160, 2080, 2080]
    - [53, 9.908]
  - - [128, 256, 1, 4096, 160, 160, 4128, 4128]
    - [53, 12.329]
  - - [128, 512, 1, 64, 160, 160, 96, 96]
    - [44, 1.467]
  - - [128, 512, 1, 128, 160, 160, 160, 160]
    - [58, 2.8]
  - - [128, 512, 1, 256, 160, 160, 288, 288]
    - [44, 5.044]
  - - [128, 512, 1, 512, 160, 160, 544, 544]
    - [60, 8.571]
  - - [128, 512, 1, 1024, 160, 160, 1056, 1056]
    - [55, 13.078]
  - - [128, 512, 1, 2048, 160, 160, 2080, 2080]
    - [55, 17.759]
  - - [128, 512, 1, 4096, 160, 160, 4128, 4128]
    - [51, 21.533]
  - - [128, 1024, 1, 64, 160, 160, 96, 96]
    - [58, 2.844]
  - - [128, 1024, 1, 128, 160, 160, 160, 160]
    - [85, 5.262]
  - - [128, 1024, 1, 256, 160, 160, 288, 288]
    - [76, 9.252]
  - - [128, 1024, 1, 512, 160, 160, 544, 544]
    - [95, 14.895]
  - - [128, 1024, 1, 1024, 160, 160, 1056, 1056]
    - [83, 21.377]
  - - [128, 1024, 1, 2048, 160, 160, 2080, 2080]
    - [76, 27.276]
  - - [128, 1024, 1, 4096, 160, 160, 4128, 4128]
    - [68, 31.661]
  - - [128, 2048, 1, 64, 160, 160, 96, 96]
    - [86, 5.437]
  - - [128, 2048, 1, 128, 160, 160, 160, 160]
    - [1, 9.964]
  - - [128, 2048, 1, 256, 160, 160, 288, 288]
    - [78, 16.913]
  - - [128, 2048, 1, 512, 160, 160, 544, 544]
    - [66, 26.237]
  - - [128, 2048, 1, 1024, 160, 160, 1056, 1056]
    - [66, 36.385]
  - - [128, 2048, 1, 2048, 160, 160, 2080, 2080]
    - [80, 45.353]
  - - [128, 2048, 1, 4096, 160, 160, 4128, 4128]
    - [66, 50.914]
  - - [128, 4096, 1, 64, 160, 160, 96, 96]
    - [72, 9.867]
  - - [128, 4096, 1, 128, 160, 160, 160, 160]
    - [13, 17.357]
  - - [128, 4096, 1, 256, 160, 160, 288, 288]
    - [88, 27.789]
  - - [128, 4096, 1, 512, 160, 160, 544, 544]
    - [88, 39.762]
  - - [128, 4096, 1, 1024, 160, 160, 1056, 1056]
    - [12, 51.407]
  - - [128, 4096, 1, 2048, 160, 160, 2080, 2080]
    - [1, 59.795]
  - - [128, 4096, 1, 4096, 160, 160, 4128, 4128]
    - [87, 63.125]
  - - [256, 64, 1, 64, 288, 288, 96, 96]
    - [46, 0.378]
  - - [256, 64, 1, 128, 288, 288, 160, 160]
    - [42, 0.722]
  - - [256, 64, 1, 256, 288, 288, 288, 288]
    - [48, 1.328]
  - - [256, 64, 1, 512, 288, 288, 544, 544]
    - [62, 2.267]
  - - [256, 64, 1, 1024, 288, 288, 1056, 1056]
    - [54, 3.558]
  - - [256, 64, 1, 2048, 288, 288, 2080, 2080]
    - [50, 4.9]
  - - [256, 64, 1, 4096, 288, 288, 4128, 4128]
    - [48, 6.048]
  - - [256, 128, 1, 64, 288, 288, 96, 96]
    - [43, 0.761]
  - - [256, 128, 1, 128, 288, 288, 160, 160]
    - [49, 1.436]
  - - [256, 128, 1, 256, 288, 288, 288, 288]
    - [55, 2.651]
  - - [256, 128, 1, 512, 288, 288, 544, 544]
    - [44, 4.547]
  - - [256, 128, 1, 1024, 288, 288, 1056, 1056]
    - [51, 7.128]
  - - [256, 128, 1, 2048, 288, 288, 2080, 2080]
    - [54, 9.846]
  - - [256, 128, 1, 4096, 288, 288, 4128, 4128]
    - [54, 12.193]
  - - [256, 256, 1, 64, 288, 288, 96, 96]
    - [57, 1.479]
  - - [256, 256, 1, 128, 288, 288, 160, 160]
    - [54, 2.815]
  - - [256, 256, 1, 256, 288, 288, 288, 288]
    - [55, 5.11]
  - - [256, 256, 1, 512, 288, 288, 544, 544]
    - [44, 8.58]
  - - [256, 256, 1, 1024, 288, 288, 1056, 1056]
    - [44, 13.119]
  - - [256, 256, 1, 2048, 288, 288, 2080, 2080]
    - [55, 17.753]
  - - [256, 256, 1, 4096, 288, 288, 4128, 4128]
    - [55, 21.555]
  - - [256, 512, 1, 64, 288, 288, 96, 96]
    - [41, 2.833]
  - - [256, 512, 1, 128, 288, 288, 160, 160]
    - [85, 5.267]
  - - [256, 512, 1, 256, 288, 288, 288, 288]
    - [68, 9.245]
  - - [256, 512, 1, 512, 288, 288, 544, 544]
    - [83, 14.843]
  - - [256, 512, 1, 1024, 288, 288, 1056, 1056]
    - [92, 21.402]
  - - [256, 512, 1, 2048, 288, 288, 2080, 2080]
    - [93, 27.341]
  - - [256, 512, 1, 4096, 288, 288, 4128, 4128]
    - [85, 31.698]
  - - [256, 1024, 1, 64, 288, 288, 96, 96]
    - [88, 5.408]
  - - [256, 1024, 1, 128, 288, 288, 160, 160]
    - [16, 9.833]
  - - [256, 1024, 1, 256, 288, 288, 288, 288]
    - [80, 16.929]
  - - [256, 1024, 1, 512, 288, 288, 544, 544]
    - [80, 26.297]
  - - [256, 1024, 1, 1024, 288, 288, 1056, 1056]
    - [66, 36.476]
  - - [256, 1024, 1, 2048, 288, 288, 2080, 2080]
    - [80, 45.028]
  - - [256, 1024, 1, 4096, 288, 288, 4128, 4128]
    - [66, 50.28]
  - - [256, 2048, 1, 64, 288, 288, 96, 96]
    - [5, 9.828]
  - - [256, 2048, 1, 128, 288, 288, 160, 160]
    - [14, 17.423]
  - - [256, 2048, 1, 256, 288, 288, 288, 288]
    - [88, 27.924]
  - - [256, 2048, 1, 512, 288, 288, 544, 544]
    - [12, 39.762]
  - - [256, 2048, 1, 1024, 288, 288, 1056, 1056]
    - [1, 51.328]
  - - [256, 2048, 1, 2048, 288, 288, 2080, 2080]
    - [1, 59.74]
  - - [256, 2048, 1, 4096, 288, 288, 4128, 4128]
    - [1, 63.0]
  - - [256, 4096, 1, 64, 288, 288, 96, 96]
    - [86, 16.189]
  - - [256, 4096, 1, 128, 288, 288, 160, 160]
    - [20, 27.191]
  - - [256, 4096, 1, 256, 288, 288, 288, 288]
    - [95, 40.673]
  - - [256, 4096, 1, 512, 288, 288, 544, 544]
    - [84, 52.923]
  - - [256, 4096, 1, 1024, 288, 288, 1056, 1056]
    - [78, 62.639]
  - - [256, 4096, 1, 2048, 288, 288, 2080, 2080]
    - [89, 66.374]
  - - [256, 4096, 1, 4096, 288, 288, 4128, 4128]
    - [89, 70.682]
  - - [384, 64, 1, 64, 416, 416, 96, 96]
    - [61, 0.566]
  - - [384, 64, 1, 128, 416, 416, 160, 160]
    - [49, 1.086]
  - - [384, 64, 1, 256, 416, 416, 288, 288]
    - [60, 2.002]
  - - [384, 64, 1, 512, 416, 416, 544, 544]
    - [43, 3.428]
  - - [384, 64, 1, 1024, 416, 416, 1056, 1056]
    - [54, 5.343]
  - - [384, 64, 1, 2048, 416, 416, 2080, 2080]
    - [50, 7.388]
  - - [384, 64, 1, 4096, 416, 416, 4128, 4128]
    - [59, 9.094]
  - - [384, 128, 1, 64, 416, 416, 96, 96]
    - [55, 1.119]
  - - [384, 128, 1, 128, 416, 416, 160, 160]
    - [49, 2.14]
  - - [384, 128, 1, 256, 416, 416, 288, 288]
    - [59, 3.961]
  - - [384, 128, 1, 512, 416, 416, 544, 544]
    - [48, 6.771]
  - - [384, 128, 1, 1024, 416, 416, 1056, 1056]
    - [50, 10.6]
  - - [384, 128, 1, 2048, 416, 416, 2080, 2080]
    - [43, 14.693]
  - - [384, 128, 1, 4096, 416, 416, 4128, 4128]
    - [54, 18.2]
  - - [384, 256, 1, 64, 416, 416, 96, 96]
    - [81, 2.174]
  - - [384, 256, 1, 128, 416, 416, 160, 160]
    - [52, 4.067]
  - - [384, 256, 1, 256, 416, 416, 288, 288]
    - [52, 7.283]
  - - [384, 256, 1, 512, 416, 416, 544, 544]
    - [41, 11.926]
  - - [384, 256, 1, 1024, 416, 416, 1056, 1056]
    - [41, 17.51]
  - - [384, 256, 1, 2048, 416, 416, 2080, 2080]
    - [52, 22.939]
  - - [384, 256, 1, 4096, 416, 416, 4128, 4128]
    - [52, 27.171]
  - - [384, 512, 1, 64, 416, 416, 96, 96]
    - [82, 4.156]
  - - [384, 512, 1, 128, 416, 416, 160, 160]
    - [86, 7.747]
  - - [384, 512, 1, 256, 416, 416, 288, 288]
    - [77, 13.683]
  - - [384, 512, 1, 512, 416, 416, 544, 544]
    - [84, 22.069]
  - - [384, 512, 1, 1024, 416, 416, 1056, 1056]
    - [84, 31.703]
  - - [384, 512, 1, 2048, 416, 416, 2080, 2080]
    - [85, 40.524]
  - - [384, 512, 1, 4096, 416, 416, 4128, 4128]
    - [92, 46.967]
  - - [384, 1024, 1, 64, 416, 416, 96, 96]
    - [14, 7.815]
  - - [384, 1024, 1, 128, 416, 416, 160, 160]
    - [13, 13.982]
  - - [384, 1024, 1, 256, 416, 416, 288, 288]
    - [1, 22.992]
  - - [384, 1024, 1, 512, 416, 416, 544, 544]
    - [12, 34.222]
  - - [384, 1024, 1, 1024, 416, 416, 1056, 1056]
    - [12, 45.247]
  - - [384, 1024, 1, 2048, 416, 416, 2080, 2080]
    - [75, 54.041]
  - - [384, 1024, 1, 4096, 416, 416, 4128, 4128]
    - [80, 57.69]
  - - [384, 2048, 1, 64, 416, 416, 96, 96]
    - [11, 13.092]
  - - [384, 2048, 1, 128, 416, 416, 160, 160]
    - [14, 22.462]
  - - [384, 2048, 1, 256, 416, 416, 288, 288]
    - [15, 34.305]
  - - [384, 2048, 1, 512, 416, 416, 544, 544]
    - [78, 47.138]
  - - [384, 2048, 1, 1024, 416, 416, 1056, 1056]
    - [23, 57.802]
  - - [384, 2048, 1, 2048, 416, 416, 2080, 2080]
    - [23, 63.47]
  - - [384, 2048, 1, 4096, 416, 416, 4128, 4128]
    - [23, 69.511]
  - - [384, 4096, 1, 64, 416, 416, 96, 96]
    - [13, 21.256]
  - - [384, 4096, 1, 128, 416, 416, 160, 160]
    - [14, 33.74]
  - - [384, 4096, 1, 256, 416, 416, 288, 288]
    - [74, 47.353]
  - - [384, 4096, 1, 512, 416, 416, 544, 544]
    - [78, 60.634]
  - - [384, 4096, 1, 1024, 416, 416, 1056, 1056]
    - [80, 66.797]
  - - [384, 4096, 1, 2048, 416, 416, 2080, 2080]
    - [67, 73.708]
  - - [384, 4096, 1, 4096, 416, 416, 4128, 4128]
    - [67, 77.672]
  - - [768, 64, 1, 64, 800, 800, 96, 96]
    - [64, 1.126]
  - - [768, 64, 1, 128, 800, 800, 160, 160]
    - [54, 2.137]
  - - [768, 64, 1, 256, 800, 800, 288, 288]
    - [55, 3.944]
  - - [768, 64, 1, 512, 800, 800, 544, 544]
    - [59, 6.722]
  - - [768, 64, 1, 1024, 800, 800, 1056, 1056]
    - [63, 10.499]
  - - [768, 64, 1, 2048, 800, 800, 2080, 2080]
    - [43, 14.445]
  - - [768, 64, 1, 4096, 800, 800, 4128, 4128]
    - [43, 17.786]
  - - [768, 128, 1, 64, 800, 800, 96, 96]
    - [63, 2.154]
  - - [768, 128, 1, 128, 800, 800, 160, 160]
    - [44, 4.044]
  - - [768, 128, 1, 256, 800, 800, 288, 288]
    - [55, 7.239]
  - - [768, 128, 1, 512, 800, 800, 544, 544]
    - [55, 11.799]
  - - [768, 128, 1, 1024, 800, 800, 1056, 1056]
    - [60, 17.263]
  - - [768, 128, 1, 2048, 800, 800, 2080, 2080]
    - [55, 22.711]
  - - [768, 128, 1, 4096, 800, 800, 4128, 4128]
    - [44, 26.653]
  - - [768, 256, 1, 64, 800, 800, 96, 96]
    - [94, 4.174]
  - - [768, 256, 1, 128, 800, 800, 160, 160]
    - [96, 7.791]
  - - [768, 256, 1, 256, 800, 800, 288, 288]
    - [84, 13.665]
  - - [768, 256, 1, 512, 800, 800, 544, 544]
    - [84, 22.039]
  - - [768, 256, 1, 1024, 800, 800, 1056, 1056]
    - [86, 31.703]
  - - [768, 256, 1, 2048, 800, 800, 2080, 2080]
    - [85, 40.467]
  - - [768, 256, 1, 4096, 800, 800, 4128, 4128]
    - [70, 46.939]
  - - [768, 512, 1, 64, 800, 800, 96, 96]
    - [4, 7.725]
  - - [768, 512, 1, 128, 800, 800, 160, 160]
    - [13, 13.963]
  - - [768, 512, 1, 256, 800, 800, 288, 288]
    - [0, 22.927]
  - - [768, 512, 1, 512, 800, 800, 544, 544]
    - [12, 34.19]
  - - [768, 512, 1, 1024, 800, 800, 1056, 1056]
    - [12, 45.328]
  - - [768, 512, 1, 2048, 800, 800, 2080, 2080]
    - [66, 54.006]
  - - [768, 512, 1, 4096, 800, 800, 4128, 4128]
    - [66, 57.606]
  - - [768, 1024, 1, 64, 800, 800, 96, 96]
    - [19, 13.12]
  - - [768, 1024, 1, 128, 800, 800, 160, 160]
    - [13, 22.53]
  - - [768, 1024, 1, 256, 800, 800, 288, 288]
    - [15, 34.298]
  - - [768, 1024, 1, 512, 800, 800, 544, 544]
    - [80, 46.959]
  - - [768, 1024, 1, 1024, 800, 800, 1056, 1056]
    - [31, 58.732]
  - - [768, 1024, 1, 2048, 800, 800, 2080, 2080]
    - [38, 62.952]
  - - [768, 1024, 1, 4096, 800, 800, 4128, 4128]
    - [22, 69.291]
  - - [768, 2048, 1, 64, 800, 800, 96, 96]
    - [14, 21.195]
  - - [768, 2048, 1, 128, 800, 800, 160, 160]
    - [21, 33.389]
  - - [768, 2048, 1, 256, 800, 800, 288, 288]
    - [65, 47.479]
  - - [768, 2048, 1, 512, 800, 800, 544, 544]
    - [80, 60.802]
  - - [768, 2048, 1, 1024, 800, 800, 1056, 1056]
    - [80, 66.88]
  - - [768, 2048, 1, 2048, 800, 800, 2080, 2080]
    - [81, 73.746]
  - - [768, 2048, 1, 4096, 800, 800, 4128, 4128]
    - [81, 77.701]
  - - [768, 4096, 1, 64, 800, 800, 96, 96]
    - [18, 30.521]
  - - [768, 4096, 1, 128, 800, 800, 160, 160]
    - [39, 45.498]
  - - [768, 4096, 1, 256, 800, 800, 288, 288]
    - [29, 59.809]
  - - [768, 4096, 1, 512, 800, 800, 544, 544]
    - [78, 65.2]
  - - [768, 4096, 1, 1024, 800, 800, 1056, 1056]
    - [40, 74.376]
  - - [768, 4096, 1, 2048, 800, 800, 2080, 2080]
    - [35, 78.965]
  - - [768, 4096, 1, 4096, 800, 800, 4128, 4128]
    - [34, 79.693]
  - - [1536, 64, 1, 64, 1568, 1568, 96, 96]
    - [45, 2.157]
  - - [1536, 64, 1, 128, 1568, 1568, 160, 160]
    - [44, 4.095]
  - - [1536, 64, 1, 256, 1568, 1568, 288, 288]
    - [55, 7.181]
  - - [1536, 64, 1, 512, 1568, 1568, 544, 544]
    - [44, 11.765]
  - - [1536, 64, 1, 1024, 1568, 1568, 1056, 1056]
    - [44, 17.402]
  - - [1536, 64, 1, 2048, 1568, 1568, 2080, 2080]
    - [44, 22.683]
  - - [1536, 64, 1, 4096, 1568, 1568, 4128, 4128]
    - [55, 26.633]
  - - [1536, 128, 1, 64, 1568, 1568, 96, 96]
    - [13, 4.122]
  - - [1536, 128, 1, 128, 1568, 1568, 160, 160]
    - [77, 7.78]
  - - [1536, 128, 1, 256, 1568, 1568, 288, 288]
    - [86, 13.701]
  - - [1536, 128, 1, 512, 1568, 1568, 544, 544]
    - [86, 22.021]
  - - [1536, 128, 1, 1024, 1568, 1568, 1056, 1056]
    - [71, 31.663]
  - - [1536, 128, 1, 2048, 1568, 1568, 2080, 2080]
    - [71, 40.399]
  - - [1536, 128, 1, 4096, 1568, 1568, 4128, 4128]
    - [86, 46.919]
  - - [1536, 256, 1, 64, 1568, 1568, 96, 96]
    - [10, 7.765]
  - - [1536, 256, 1, 128, 1568, 1568, 160, 160]
    - [14, 13.911]
  - - [1536, 256, 1, 256, 1568, 1568, 288, 288]
    - [1, 22.927]
  - - [1536, 256, 1, 512, 1568, 1568, 544, 544]
    - [66, 33.971]
  - - [1536, 256, 1, 1024, 1568, 1568, 1056, 1056]
    - [66, 45.197]
  - - [1536, 256, 1, 2048, 1568, 1568, 2080, 2080]
    - [66, 53.99]
  - - [1536, 256, 1, 4096, 1568, 1568, 4128, 4128]
    - [66, 57.495]
  - - [1536, 512, 1, 64, 1568, 1568, 96, 96]
    - [86, 13.097]
  - - [1536, 512, 1, 128, 1568, 1568, 160, 160]
    - [4, 22.49]
  - - [1536, 512, 1, 256, 1568, 1568, 288, 288]
    - [4, 34.771]
  - - [1536, 512, 1, 512, 1568, 1568, 544, 544]
    - [12, 46.888]
  - - [1536, 512, 1, 1024, 1568, 1568, 1056, 1056]
    - [31, 58.272]
  - - [1536, 512, 1, 2048, 1568, 1568, 2080, 2080]
    - [38, 63.132]
  - - [1536, 512, 1, 4096, 1568, 1568, 4128, 4128]
    - [38, 69.693]
  - - [1536, 1024, 1, 64, 1568, 1568, 96, 96]
    - [9, 21.062]
  - - [1536, 1024, 1, 128, 1568, 1568, 160, 160]
    - [2, 33.771]
  - - [1536, 1024, 1, 256, 1568, 1568, 288, 288]
    - [65, 47.094]
  - - [1536, 1024, 1, 512, 1568, 1568, 544, 544]
    - [65, 60.221]
  - - [1536, 1024, 1, 1024, 1568, 1568, 1056, 1056]
    - [75, 67.827]
  - - [1536, 1024, 1, 2048, 1568, 1568, 2080, 2080]
    - [81, 73.724]
  - - [1536, 1024, 1, 4096, 1568, 1568, 4128, 4128]
    - [81, 77.673]
  - - [1536, 2048, 1, 64, 1568, 1568, 96, 96]
    - [8, 30.522]
  - - [1536, 2048, 1, 128, 1568, 1568, 160, 160]
    - [69, 45.539]
  - - [1536, 2048, 1, 256, 1568, 1568, 288, 288]
    - [69, 59.648]
  - - [1536, 2048, 1, 512, 1568, 1568, 544, 544]
    - [65, 64.863]
  - - [1536, 2048, 1, 1024, 1568, 1568, 1056, 1056]
    - [32, 74.371]
  - - [1536, 2048, 1, 2048, 1568, 1568, 2080, 2080]
    - [35, 78.863]
  - - [1536, 2048, 1, 4096, 1568, 1568, 4128, 4128]
    - [34, 79.557]
  - - [1536, 4096, 1, 64, 1568, 1568, 96, 96]
    - [10, 40.196]
  - - [1536, 4096, 1, 128, 1568, 1568, 160, 160]
    - [71, 55.569]
  - - [1536, 4096, 1, 256, 1568, 1568, 288, 288]
    - [29, 70.448]
  - - [1536, 4096, 1, 512, 1568, 1568, 544, 544]
    - [28, 73.43]
  - - [1536, 4096, 1, 1024, 1568, 1568, 1056, 1056]
    - [37, 82.425]
  - - [1536, 4096, 1, 2048, 1568, 1568, 2080, 2080]
    - [26, 86.499]
  - - [1536, 4096, 1, 4096, 1568, 1568, 4128, 4128]
    - [26, 88.35]
  - - [3072, 64, 1, 64, 3104, 3104, 96, 96]
    - [72, 4.167]
  - - [3072, 64, 1, 128, 3104, 3104, 160, 160]
    - [73, 7.811]
  - - [3072, 64, 1, 256, 3104, 3104, 288, 288]
    - [71, 13.574]
  - - [3072, 64, 1, 512, 3104, 3104, 544, 544]
    - [86, 21.939]
  - - [3072, 64, 1, 1024, 3104, 3104, 1056, 1056]
    - [71, 31.596]
  - - [3072, 64, 1, 2048, 3104, 3104, 2080, 2080]
    - [86, 40.412]
  - - [3072, 64, 1, 4096, 3104, 3104, 4128, 4128]
    - [83, 46.877]
  - - [3072, 128, 1, 64, 3104, 3104, 96, 96]
    - [7, 7.746]
  - - [3072, 128, 1, 128, 3104, 3104, 160, 160]
    - [6, 13.911]
  - - [3072, 128, 1, 256, 3104, 3104, 288, 288]
    - [66, 22.797]
  - - [3072, 128, 1, 512, 3104, 3104, 544, 544]
    - [67, 33.82]
  - - [3072, 128, 1, 1024, 3104, 3104, 1056, 1056]
    - [66, 45.332]
  - - [3072, 128, 1, 2048, 3104, 3104, 2080, 2080]
    - [80, 54.119]
  - - [3072, 128, 1, 4096, 3104, 3104, 4128, 4128]
    - [80, 57.57]
  - - [3072, 256, 1, 64, 3104, 3104, 96, 96]
    - [86, 13.118]
  - - [3072, 256, 1, 128, 3104, 3104, 160, 160]
    - [4, 22.506]
  - - [3072, 256, 1, 256, 3104, 3104, 288, 288]
    - [4, 34.789]
  - - [3072, 256, 1, 512, 3104, 3104, 544, 544]
    - [14, 46.798]
  - - [3072, 256, 1, 1024, 3104, 3104, 1056, 1056]
    - [36, 57.359]
  - - [3072, 256, 1, 2048, 3104, 3104, 2080, 2080]
    - [38, 62.736]
  - - [3072, 256, 1, 4096, 3104, 3104, 4128, 4128]
    - [30, 69.019]
  - - [3072, 512, 1, 64, 3104, 3104, 96, 96]
    - [2, 21.165]
  - - [3072, 512, 1, 128, 3104, 3104, 160, 160]
    - [17, 34.269]
  - - [3072, 512, 1, 256, 3104, 3104, 288, 288]
    - [78, 47.016]
  - - [3072, 512, 1, 512, 3104, 3104, 544, 544]
    - [79, 60.349]
  - - [3072, 512, 1, 1024, 3104, 3104, 1056, 1056]
    - [91, 69.538]
  - - [3072, 512, 1, 2048, 3104, 3104, 2080, 2080]
    - [81, 73.72]
  - - [3072, 512, 1, 4096, 3104, 3104, 4128, 4128]
    - [81, 77.669]
  - - [3072, 1024, 1, 64, 3104, 3104, 96, 96]
    - [3, 30.596]
  - - [3072, 1024, 1, 128, 3104, 3104, 160, 160]
    - [86, 45.423]
  - - [3072, 1024, 1, 256, 3104, 3104, 288, 288]
    - [35, 59.85]
  - - [3072, 1024, 1, 512, 3104, 3104, 544, 544]
    - [78, 64.979]
  - - [3072, 1024, 1, 1024, 3104, 3104, 1056, 1056]
    - [33, 74.59]
  - - [3072, 1024, 1, 2048, 3104, 3104, 2080, 2080]
    - [35, 79.039]
  - - [3072, 1024, 1, 4096, 3104, 3104, 4128, 4128]
    - [34, 79.6]
  - - [3072, 2048, 1, 64, 3104, 3104, 96, 96]
    - [2, 40.502]
  - - [3072, 2048, 1, 128, 3104, 3104, 160, 160]
    - [33, 56.232]
  - - [3072, 2048, 1, 256, 3104, 3104, 288, 288]
    - [83, 66.757]
  - - [3072, 2048, 1, 512, 3104, 3104, 544, 544]
    - [27, 71.795]
  - - [3072, 2048, 1, 1024, 3104, 3104, 1056, 1056]
    - [36, 82.104]
  - - [3072, 2048, 1, 2048, 3104, 3104, 2080, 2080]
    - [26, 86.115]
  - - [3072, 2048, 1, 4096, 3104, 3104, 4128, 4128]
    - [25, 87.561]
  - - [3072, 4096, 1, 64, 3104, 3104, 96, 96]
    - [29, 49.773]
  - - [3072, 4096, 1, 128, 3104, 3104, 160, 160]
    - [24, 63.268]
  - - [3072, 4096, 1, 256, 3104, 3104, 288, 288]
    - [32, 74.94]
  - - [3072, 4096, 1, 512, 3104, 3104, 544, 544]
    - [80, 75.796]
  - - [3072, 4096, 1, 1024, 3104, 3104, 1056, 1056]
    - [37, 85.866]
  - - [3072, 4096, 1, 2048, 3104, 3104, 2080, 2080]
    - [38, 82.834]
  - - [3072, 4096, 1, 4096, 3104, 3104, 4128, 4128]
    - [26, 83.679]
- null
- null
- DeviceEfficiency
