library/src/blas3/Tensile/Logic/asm_full/navi32/navi32_Cijk_Ailk_Bjlk_HB_GB.yaml
- {MinimumRequiredVersion: 4.35.0}
- navi32
- gfx1101
- [Device 73f0]
    SolutionIndex: 0
    SolutionNameMin: Cijk_Ailk_Bjlk_HB_MT64x64x16_MI16x16x16x1_SN_1LDSB0_AMAS3_GRVW8_IU1_LPA0_LPB0_NLCA1_NLCB1_SIA1_SU0_SUS0_SVW2_TT2_32_VW2_WGM4
    SolutionIndex: 1
    SolutionNameMin: Cijk_Ailk_Bjlk_HB_MT64x64x16_MI16x16x16x1_SN_1LDSB1_AMAS3_GRVW8_IU1_LPA8_LPB0_NLCA1_NLCB1_SIA2_SU0_SUS0_SVW2_TT2_32_VW2_WGM4
    SolutionIndex: 2
    SolutionNameMin: Cijk_Ailk_Bjlk_HB_MT64x64x16_MI16x16x16x1_SN_1LDSB0_AMAS3_GRVW8_IU1_LPA8_LPB8_NLCA1_NLCB1_SIA1_SU0_SUS0_SVW2_TT2_32_VW2_WGM8
    SolutionIndex: 3
    SolutionNameMin: Cijk_Ailk_Bjlk_HB_MT64x64x16_MI16x16x16x1_SN_1LDSB1_AMAS0_GRVW8_IU1_LPA0_LPB8_NLCA1_NLCB1_SIA2_SU0_SUS0_SVW1_TT2_32_VW1_WGM8
    SolutionIndex: 4
    SolutionNameMin: Cijk_Ailk_Bjlk_HB_MT64x64x16_MI16x16x16x1_SN_1LDSB0_AMAS3_GRVW8_IU1_LPA8_LPB8_NLCA1_NLCB1_SIA1_SU32_SUS256_SVW2_TT2_32_VW2_WGM8
    SolutionIndex: 5
    SolutionNameMin: Cijk_Ailk_Bjlk_HB_MT128x128x16_MI16x16x16x1_SN_1LDSB0_AMAS3_GRVW4_IU1_LPA0_LPB0_NLCA1_NLCB1_SIA1_SU0_SUS0_SVW2_TT4_64_VW2_WGM4
    SolutionIndex: 6
    SolutionNameMin: Cijk_Ailk_Bjlk_HB_MT128x128x16_MI16x16x16x1_SN_1LDSB0_AMAS3_GRVW4_IU1_LPA8_LPB8_NLCA1_NLCB1_SIA1_SU0_SUS0_SVW2_TT4_64_VW2_WGM4
    SolutionIndex: 7
    SolutionNameMin: Cijk_Ailk_Bjlk_HB_MT128x128x16_MI16x16x16x1_SN_1LDSB0_AMAS3_GRVW8_IU1_LPA0_LPB0_NLCA1_NLCB1_SIA1_SU0_SUS0_SVW2_TT4_64_VW2_WGM4
    SolutionIndex: 8
    SolutionNameMin: Cijk_Ailk_Bjlk_HB_MT128x128x16_MI16x16x16x1_SN_1LDSB0_AMAS3_GRVW8_IU1_LPA8_LPB0_NLCA1_NLCB1_SIA1_SU0_SUS0_SVW2_TT4_64_VW2_WGM4
    SolutionIndex: 9
    SolutionNameMin: Cijk_Ailk_Bjlk_HB_MT128x128x16_MI16x16x16x1_SN_1LDSB0_AMAS3_GRVW8_IU1_LPA0_LPB8_NLCA1_NLCB1_SIA1_SU0_SUS0_SVW2_TT4_64_VW2_WGM4
    SolutionIndex: 10
    SolutionNameMin: Cijk_Ailk_Bjlk_HB_MT128x128x16_MI16x16x16x1_SN_1LDSB0_AMAS3_GRVW8_IU1_LPA8_LPB8_NLCA1_NLCB1_SIA1_SU0_SUS0_SVW2_TT4_64_VW2_WGM4
    SolutionIndex: 11
    SolutionNameMin: Cijk_Ailk_Bjlk_HB_MT128x128x16_MI16x16x16x1_SN_1LDSB1_AMAS0_GRVW4_IU1_LPA0_LPB8_NLCA1_NLCB1_SIA2_SU0_SUS0_SVW1_TT4_64_VW1_WGM4
    SolutionIndex: 12
    SolutionNameMin: Cijk_Ailk_Bjlk_HB_MT128x128x16_MI16x16x16x1_SN_1LDSB1_AMAS0_GRVW8_IU1_LPA8_LPB0_NLCA1_NLCB1_SIA2_SU0_SUS0_SVW1_TT4_64_VW1_WGM4
    SolutionIndex: 13
    SolutionNameMin: Cijk_Ailk_Bjlk_HB_MT128x128x16_MI16x16x16x1_SN_1LDSB1_AMAS0_GRVW8_IU1_LPA0_LPB8_NLCA1_NLCB1_SIA2_SU0_SUS0_SVW1_TT4_64_VW1_WGM4
    SolutionIndex: 14
    SolutionNameMin: Cijk_Ailk_Bjlk_HB_MT128x128x16_MI16x16x16x1_SN_1LDSB1_AMAS3_GRVW8_IU1_LPA0_LPB0_NLCA1_NLCB1_SIA2_SU0_SUS0_SVW2_TT4_64_VW2_WGM4
    SolutionIndex: 15
    SolutionNameMin: Cijk_Ailk_Bjlk_HB_MT128x128x16_MI16x16x16x1_SN_1LDSB1_AMAS3_GRVW8_IU1_LPA8_LPB0_NLCA1_NLCB1_SIA2_SU0_SUS0_SVW2_TT4_64_VW2_WGM4
    SolutionIndex: 16
    SolutionNameMin: Cijk_Ailk_Bjlk_HB_MT128x128x16_MI16x16x16x1_SN_1LDSB1_AMAS3_GRVW8_IU1_LPA0_LPB8_NLCA1_NLCB1_SIA2_SU0_SUS0_SVW2_TT4_64_VW2_WGM4
    SolutionIndex: 17
    SolutionNameMin: Cijk_Ailk_Bjlk_HB_MT128x128x16_MI16x16x16x1_SN_1LDSB1_AMAS3_GRVW8_IU1_LPA8_LPB8_NLCA1_NLCB1_SIA2_SU0_SUS0_SVW2_TT4_64_VW2_WGM4
    SolutionIndex: 18
    SolutionNameMin: Cijk_Ailk_Bjlk_HB_MT128x128x16_MI16x16x16x1_SN_1LDSB0_AMAS3_GRVW4_IU1_LPA0_LPB8_NLCA1_NLCB1_SIA1_SU32_SUS128_SVW2_TT4_64_VW2_WGM4
    SolutionIndex: 19
    SolutionNameMin: Cijk_Ailk_Bjlk_HB_MT128x128x16_MI16x16x16x1_SN_1LDSB1_AMAS0_GRVW4_IU1_LPA8_LPB8_NLCA1_NLCB1_SIA2_SU32_SUS128_SVW1_TT4_64_VW1_WGM4
    SolutionIndex: 20
    SolutionNameMin: Cijk_Ailk_Bjlk_HB_MT128x128x16_MI16x16x16x1_SN_1LDSB1_AMAS3_GRVW4_IU1_LPA8_LPB0_NLCA1_NLCB1_SIA2_SU32_SUS128_SVW2_TT4_64_VW2_WGM4
    SolutionIndex: 21
    SolutionNameMin: Cijk_Ailk_Bjlk_HB_MT128x128x16_MI16x16x16x1_SN_1LDSB1_AMAS0_GRVW8_IU1_LPA0_LPB0_NLCA1_NLCB1_SIA2_SU32_SUS128_SVW1_TT4_64_VW1_WGM4
    SolutionIndex: 22
    SolutionNameMin: Cijk_Ailk_Bjlk_HB_MT128x128x16_MI16x16x16x1_SN_1LDSB1_AMAS3_GRVW8_IU1_LPA0_LPB0_NLCA1_NLCB1_SIA2_SU32_SUS128_SVW2_TT4_64_VW2_WGM4
    SolutionIndex: 23
    SolutionNameMin: Cijk_Ailk_Bjlk_HB_MT128x128x16_MI16x16x16x1_SN_1LDSB1_AMAS3_GRVW8_IU1_LPA8_LPB0_NLCA1_NLCB1_SIA2_SU32_SUS128_SVW2_TT4_64_VW2_WGM4
    SolutionIndex: 24
    SolutionNameMin: Cijk_Ailk_Bjlk_HB_MT128x128x16_MI16x16x16x1_SN_1LDSB1_AMAS3_GRVW8_IU1_LPA8_LPB8_NLCA1_NLCB1_SIA2_SU32_SUS128_SVW2_TT4_64_VW2_WGM4
    SolutionIndex: 25
    SolutionNameMin: Cijk_Ailk_Bjlk_HB_MT128x128x16_MI16x16x16x1_SN_1LDSB0_AMAS0_GRVW4_IU1_LPA0_LPB8_NLCA1_NLCB1_SIA1_SU32_SUS256_SVW1_TT4_64_VW1_WGM4
    SolutionIndex: 26
    SolutionNameMin: Cijk_Ailk_Bjlk_HB_MT128x128x16_MI16x16x16x1_SN_1LDSB0_AMAS3_GRVW8_IU1_LPA0_LPB0_NLCA1_NLCB1_SIA1_SU32_SUS256_SVW2_TT4_64_VW2_WGM4
    SolutionIndex: 27
    SolutionNameMin: Cijk_Ailk_Bjlk_HB_MT128x128x16_MI16x16x16x1_SN_1LDSB0_AMAS3_GRVW8_IU1_LPA8_LPB0_NLCA1_NLCB1_SIA1_SU32_SUS256_SVW2_TT4_64_VW2_WGM4
    SolutionIndex: 28
    SolutionNameMin: Cijk_Ailk_Bjlk_HB_MT128x128x16_MI16x16x16x1_SN_1LDSB1_AMAS3_GRVW4_IU1_LPA0_LPB8_NLCA1_NLCB1_SIA2_SU32_SUS256_SVW2_TT4_64_VW2_WGM4
    SolutionIndex: 29
    SolutionNameMin: Cijk_Ailk_Bjlk_HB_MT128x128x16_MI16x16x16x1_SN_1LDSB1_AMAS3_GRVW4_IU1_LPA8_LPB8_NLCA1_NLCB1_SIA2_SU32_SUS256_SVW2_TT4_64_VW2_WGM4
    SolutionIndex: 30
    SolutionNameMin: Cijk_Ailk_Bjlk_HB_MT128x128x16_MI16x16x16x1_SN_1LDSB1_AMAS0_GRVW8_IU1_LPA0_LPB0_NLCA1_NLCB1_SIA2_SU32_SUS256_SVW1_TT4_64_VW1_WGM4
    SolutionIndex: 31
    SolutionNameMin: Cijk_Ailk_Bjlk_HB_MT128x128x16_MI16x16x16x1_SN_1LDSB1_AMAS0_GRVW8_IU1_LPA0_LPB8_NLCA1_NLCB1_SIA2_SU32_SUS256_SVW1_TT4_64_VW1_WGM4
    SolutionIndex: 32
    SolutionNameMin: Cijk_Ailk_Bjlk_HB_MT128x128x16_MI16x16x16x1_SN_1LDSB1_AMAS3_GRVW8_IU1_LPA8_LPB0_NLCA1_NLCB1_SIA2_SU32_SUS256_SVW2_TT4_64_VW2_WGM4
    SolutionIndex: 33
    SolutionNameMin: Cijk_Ailk_Bjlk_HB_MT128x128x16_MI16x16x16x1_SN_1LDSB1_AMAS3_GRVW8_IU1_LPA0_LPB8_NLCA1_NLCB1_SIA2_SU32_SUS256_SVW2_TT4_64_VW2_WGM4
    SolutionIndex: 34
    SolutionNameMin: Cijk_Ailk_Bjlk_HB_MT128x128x16_MI16x16x16x1_SN_1LDSB0_AMAS0_GRVW4_IU1_LPA8_LPB0_NLCA1_NLCB1_SIA1_SU0_SUS0_SVW1_TT4_64_VW1_WGM8
    SolutionIndex: 35
    SolutionNameMin: Cijk_Ailk_Bjlk_HB_MT128x128x16_MI16x16x16x1_SN_1LDSB0_AMAS3_GRVW4_IU1_LPA0_LPB0_NLCA1_NLCB1_SIA1_SU0_SUS0_SVW2_TT4_64_VW2_WGM8
    SolutionIndex: 36
    SolutionNameMin: Cijk_Ailk_Bjlk_HB_MT128x128x16_MI16x16x16x1_SN_1LDSB0_AMAS3_GRVW4_IU1_LPA8_LPB8_NLCA1_NLCB1_SIA1_SU0_SUS0_SVW2_TT4_64_VW2_WGM8
    SolutionIndex: 37
    SolutionNameMin: Cijk_Ailk_Bjlk_HB_MT128x128x16_MI16x16x16x1_SN_1LDSB0_AMAS3_GRVW8_IU1_LPA0_LPB0_NLCA1_NLCB1_SIA1_SU0_SUS0_SVW2_TT4_64_VW2_WGM8
    SolutionIndex: 38
    SolutionNameMin: Cijk_Ailk_Bjlk_HB_MT128x128x16_MI16x16x16x1_SN_1LDSB0_AMAS3_GRVW8_IU1_LPA8_LPB0_NLCA1_NLCB1_SIA1_SU0_SUS0_SVW2_TT4_64_VW2_WGM8
    SolutionIndex: 39
    SolutionNameMin: Cijk_Ailk_Bjlk_HB_MT128x128x16_MI16x16x16x1_SN_1LDSB0_AMAS3_GRVW8_IU1_LPA0_LPB8_NLCA1_NLCB1_SIA1_SU0_SUS0_SVW2_TT4_64_VW2_WGM8
    SolutionIndex: 40
    SolutionNameMin: Cijk_Ailk_Bjlk_HB_MT128x128x16_MI16x16x16x1_SN_1LDSB0_AMAS3_GRVW8_IU1_LPA8_LPB8_NLCA1_NLCB1_SIA1_SU0_SUS0_SVW2_TT4_64_VW2_WGM8
    SolutionIndex: 41
    SolutionNameMin: Cijk_Ailk_Bjlk_HB_MT128x128x16_MI16x16x16x1_SN_1LDSB1_AMAS0_GRVW4_IU1_LPA8_LPB0_NLCA1_NLCB1_SIA2_SU0_SUS0_SVW1_TT4_64_VW1_WGM8
    SolutionIndex: 42
    SolutionNameMin: Cijk_Ailk_Bjlk_HB_MT128x128x16_MI16x16x16x1_SN_1LDSB1_AMAS0_GRVW8_IU1_LPA8_LPB0_NLCA1_NLCB1_SIA2_SU0_SUS0_SVW1_TT4_64_VW1_WGM8
    SolutionIndex: 43
    SolutionNameMin: Cijk_Ailk_Bjlk_HB_MT128x128x16_MI16x16x16x1_SN_1LDSB1_AMAS0_GRVW8_IU1_LPA0_LPB8_NLCA1_NLCB1_SIA2_SU0_SUS0_SVW1_TT4_64_VW1_WGM8
    SolutionIndex: 44
    SolutionNameMin: Cijk_Ailk_Bjlk_HB_MT128x128x16_MI16x16x16x1_SN_1LDSB1_AMAS3_GRVW8_IU1_LPA0_LPB0_NLCA1_NLCB1_SIA2_SU0_SUS0_SVW2_TT4_64_VW2_WGM8
    SolutionIndex: 45
    SolutionNameMin: Cijk_Ailk_Bjlk_HB_MT128x128x16_MI16x16x16x1_SN_1LDSB1_AMAS3_GRVW8_IU1_LPA8_LPB0_NLCA1_NLCB1_SIA2_SU0_SUS0_SVW2_TT4_64_VW2_WGM8
    SolutionIndex: 46
    SolutionNameMin: Cijk_Ailk_Bjlk_HB_MT128x128x16_MI16x16x16x1_SN_1LDSB1_AMAS3_GRVW8_IU1_LPA0_LPB8_NLCA1_NLCB1_SIA2_SU0_SUS0_SVW2_TT4_64_VW2_WGM8
    SolutionIndex: 47
    SolutionNameMin: Cijk_Ailk_Bjlk_HB_MT128x128x16_MI16x16x16x1_SN_1LDSB1_AMAS3_GRVW8_IU1_LPA8_LPB8_NLCA1_NLCB1_SIA2_SU0_SUS0_SVW2_TT4_64_VW2_WGM8
    SolutionIndex: 48
    SolutionNameMin: Cijk_Ailk_Bjlk_HB_MT128x128x16_MI16x16x16x1_SN_1LDSB0_AMAS3_GRVW8_IU1_LPA0_LPB0_NLCA1_NLCB1_SIA3_SU0_SUS0_SVW2_TT4_64_VW2_WGM8
    SolutionIndex: 49
    SolutionNameMin: Cijk_Ailk_Bjlk_HB_MT128x128x16_MI16x16x16x1_SN_1LDSB0_AMAS3_GRVW8_IU1_LPA8_LPB0_NLCA1_NLCB1_SIA3_SU0_SUS0_SVW2_TT4_64_VW2_WGM8
    SolutionIndex: 50
    SolutionNameMin: Cijk_Ailk_Bjlk_HB_MT128x128x16_MI16x16x16x1_SN_1LDSB0_AMAS3_GRVW8_IU1_LPA8_LPB0_NLCA1_NLCB1_SIA1_SU32_SUS128_SVW2_TT4_64_VW2_WGM8
    SolutionIndex: 51
    SolutionNameMin: Cijk_Ailk_Bjlk_HB_MT128x128x16_MI16x16x16x1_SN_1LDSB0_AMAS3_GRVW8_IU1_LPA0_LPB8_NLCA1_NLCB1_SIA1_SU32_SUS128_SVW2_TT4_64_VW2_WGM8
    SolutionIndex: 52
    SolutionNameMin: Cijk_Ailk_Bjlk_HB_MT128x128x16_MI16x16x16x1_SN_1LDSB0_AMAS3_GRVW8_IU1_LPA8_LPB8_NLCA1_NLCB1_SIA1_SU32_SUS128_SVW2_TT4_64_VW2_WGM8
    SolutionIndex: 53
    SolutionNameMin: Cijk_Ailk_Bjlk_HB_MT128x128x16_MI16x16x16x1_SN_1LDSB1_AMAS0_GRVW4_IU1_LPA8_LPB8_NLCA1_NLCB1_SIA2_SU32_SUS128_SVW1_TT4_64_VW1_WGM8
    SolutionIndex: 54
    SolutionNameMin: Cijk_Ailk_Bjlk_HB_MT128x128x16_MI16x16x16x1_SN_1LDSB1_AMAS3_GRVW8_IU1_LPA0_LPB0_NLCA1_NLCB1_SIA2_SU32_SUS128_SVW2_TT4_64_VW2_WGM8
    SolutionIndex: 55
    SolutionNameMin: Cijk_Ailk_Bjlk_HB_MT128x128x16_MI16x16x16x1_SN_1LDSB1_AMAS3_GRVW8_IU1_LPA8_LPB0_NLCA1_NLCB1_SIA2_SU32_SUS128_SVW2_TT4_64_VW2_WGM8
    SolutionIndex: 56
    SolutionNameMin: Cijk_Ailk_Bjlk_HB_MT128x128x16_MI16x16x16x1_SN_1LDSB1_AMAS3_GRVW8_IU1_LPA8_LPB8_NLCA1_NLCB1_SIA2_SU32_SUS128_SVW2_TT4_64_VW2_WGM8
    SolutionIndex: 57
    SolutionNameMin: Cijk_Ailk_Bjlk_HB_MT128x128x16_MI16x16x16x1_SN_1LDSB0_AMAS3_GRVW4_IU1_LPA8_LPB0_NLCA1_NLCB1_SIA1_SU32_SUS256_SVW2_TT4_64_VW2_WGM8
    SolutionIndex: 58
    SolutionNameMin: Cijk_Ailk_Bjlk_HB_MT128x128x16_MI16x16x16x1_SN_1LDSB0_AMAS3_GRVW8_IU1_LPA8_LPB0_NLCA1_NLCB1_SIA1_SU32_SUS256_SVW2_TT4_64_VW2_WGM8
    SolutionIndex: 59
    SolutionNameMin: Cijk_Ailk_Bjlk_HB_MT128x128x16_MI16x16x16x1_SN_1LDSB0_AMAS3_GRVW8_IU1_LPA0_LPB8_NLCA1_NLCB1_SIA1_SU32_SUS256_SVW2_TT4_64_VW2_WGM8
    SolutionIndex: 60
    SolutionNameMin: Cijk_Ailk_Bjlk_HB_MT128x128x16_MI16x16x16x1_SN_1LDSB0_AMAS3_GRVW8_IU1_LPA8_LPB8_NLCA1_NLCB1_SIA1_SU32_SUS256_SVW2_TT4_64_VW2_WGM8
    SolutionIndex: 61
    SolutionNameMin: Cijk_Ailk_Bjlk_HB_MT128x128x16_MI16x16x16x1_SN_1LDSB1_AMAS3_GRVW4_IU1_LPA0_LPB0_NLCA1_NLCB1_SIA2_SU32_SUS256_SVW2_TT4_64_VW2_WGM8
    SolutionIndex: 62
    SolutionNameMin: Cijk_Ailk_Bjlk_HB_MT128x128x16_MI16x16x16x1_SN_1LDSB1_AMAS3_GRVW4_IU1_LPA8_LPB8_NLCA1_NLCB1_SIA2_SU32_SUS256_SVW2_TT4_64_VW2_WGM8
    SolutionIndex: 63
    SolutionNameMin: Cijk_Ailk_Bjlk_HB_MT128x128x16_MI16x16x16x1_SN_1LDSB1_AMAS0_GRVW8_IU1_LPA0_LPB0_NLCA1_NLCB1_SIA2_SU32_SUS256_SVW1_TT4_64_VW1_WGM8
    SolutionIndex: 64
    SolutionNameMin: Cijk_Ailk_Bjlk_HB_MT128x128x16_MI16x16x16x1_SN_1LDSB1_AMAS3_GRVW8_IU1_LPA0_LPB0_NLCA1_NLCB1_SIA2_SU32_SUS256_SVW2_TT4_64_VW2_WGM8
    SolutionIndex: 65
    SolutionNameMin: Cijk_Ailk_Bjlk_HB_MT128x128x16_MI16x16x16x1_SN_1LDSB1_AMAS3_GRVW8_IU1_LPA8_LPB0_NLCA1_NLCB1_SIA2_SU32_SUS256_SVW2_TT4_64_VW2_WGM8
    SolutionIndex: 66
    SolutionNameMin: Cijk_Ailk_Bjlk_HB_MT32x32x32_MI16x16x16x1_SN_1LDSB0_AMAS0_GRVW4_IU1_LPA0_LPB0_NLCA1_NLCB1_SIA1_SU0_SUS0_SVW1_TT1_16_VW1_WGM4
    SolutionIndex: 67
    SolutionNameMin: Cijk_Ailk_Bjlk_HB_MT32x32x32_MI16x16x16x1_SN_1LDSB0_AMAS0_GRVW8_IU1_LPA0_LPB0_NLCA1_NLCB1_SIA1_SU0_SUS0_SVW1_TT1_16_VW1_WGM4
    SolutionIndex: 68
    SolutionNameMin: Cijk_Ailk_Bjlk_HB_MT32x32x32_MI16x16x16x1_SN_1LDSB0_AMAS0_GRVW8_IU1_LPA0_LPB8_NLCA1_NLCB1_SIA1_SU0_SUS0_SVW1_TT1_16_VW1_WGM4
    SolutionIndex: 69
    SolutionNameMin: Cijk_Ailk_Bjlk_HB_MT32x32x32_MI16x16x16x1_SN_1LDSB1_AMAS0_GRVW4_IU2_LPA0_LPB0_NLCA1_NLCB1_SIA2_SU0_SUS0_SVW1_TT1_16_VW1_WGM4
    SolutionIndex: 70
    SolutionNameMin: Cijk_Ailk_Bjlk_HB_MT32x32x32_MI16x16x16x1_SN_1LDSB1_AMAS0_GRVW8_IU2_LPA0_LPB0_NLCA1_NLCB1_SIA2_SU0_SUS0_SVW1_TT1_16_VW1_WGM4
    SolutionIndex: 71
    SolutionNameMin: Cijk_Ailk_Bjlk_HB_MT32x32x32_MI16x16x16x1_SN_1LDSB1_AMAS0_GRVW8_IU2_LPA8_LPB0_NLCA1_NLCB1_SIA2_SU0_SUS0_SVW1_TT1_16_VW1_WGM4
    SolutionIndex: 72
    SolutionNameMin: Cijk_Ailk_Bjlk_HB_MT32x32x32_MI16x16x16x1_SN_1LDSB1_AMAS0_GRVW8_IU2_LPA0_LPB8_NLCA1_NLCB1_SIA2_SU0_SUS0_SVW1_TT1_16_VW1_WGM4
    SolutionIndex: 73
    SolutionNameMin: Cijk_Ailk_Bjlk_HB_MT32x32x32_MI16x16x16x1_SN_1LDSB0_AMAS0_GRVW8_IU1_LPA0_LPB0_NLCA1_NLCB1_SIA3_SU0_SUS0_SVW1_TT1_16_VW1_WGM4
    SolutionIndex: 74
    SolutionNameMin: Cijk_Ailk_Bjlk_HB_MT32x32x32_MI16x16x16x1_SN_1LDSB0_AMAS0_GRVW8_IU1_LPA0_LPB0_NLCA1_NLCB1_SIA1_SU32_SUS128_SVW1_TT1_16_VW1_WGM4
    SolutionIndex: 75
    SolutionNameMin: Cijk_Ailk_Bjlk_HB_MT32x32x32_MI16x16x16x1_SN_1LDSB1_AMAS0_GRVW4_IU2_LPA0_LPB0_NLCA1_NLCB1_SIA2_SU32_SUS128_SVW1_TT1_16_VW1_WGM4
    SolutionIndex: 76
    SolutionNameMin: Cijk_Ailk_Bjlk_HB_MT32x32x32_MI16x16x16x1_SN_1LDSB1_AMAS0_GRVW4_IU2_LPA0_LPB8_NLCA1_NLCB1_SIA2_SU32_SUS128_SVW1_TT1_16_VW1_WGM4
    SolutionIndex: 77
    SolutionNameMin: Cijk_Ailk_Bjlk_HB_MT32x32x32_MI16x16x16x1_SN_1LDSB1_AMAS0_GRVW8_IU2_LPA0_LPB8_NLCA1_NLCB1_SIA2_SU32_SUS128_SVW1_TT1_16_VW1_WGM4
    SolutionIndex: 78
    SolutionNameMin: Cijk_Ailk_Bjlk_HB_MT32x32x32_MI16x16x16x1_SN_1LDSB0_AMAS0_GRVW4_IU1_LPA0_LPB0_NLCA1_NLCB1_SIA1_SU32_SUS256_SVW1_TT1_16_VW1_WGM4
    SolutionIndex: 79
    SolutionNameMin: Cijk_Ailk_Bjlk_HB_MT32x32x32_MI16x16x16x1_SN_1LDSB0_AMAS0_GRVW4_IU1_LPA8_LPB8_NLCA1_NLCB1_SIA1_SU32_SUS256_SVW1_TT1_16_VW1_WGM4
    SolutionIndex: 80
    SolutionNameMin: Cijk_Ailk_Bjlk_HB_MT32x32x32_MI16x16x16x1_SN_1LDSB0_AMAS0_GRVW8_IU1_LPA0_LPB0_NLCA1_NLCB1_SIA1_SU32_SUS256_SVW1_TT1_16_VW1_WGM4
    SolutionIndex: 81
    SolutionNameMin: Cijk_Ailk_Bjlk_HB_MT32x32x32_MI16x16x16x1_SN_1LDSB1_AMAS0_GRVW4_IU2_LPA8_LPB0_NLCA1_NLCB1_SIA2_SU32_SUS256_SVW1_TT1_16_VW1_WGM4
    SolutionIndex: 82
    SolutionNameMin: Cijk_Ailk_Bjlk_HB_MT32x32x32_MI16x16x16x1_SN_1LDSB1_AMAS0_GRVW8_IU2_LPA0_LPB0_NLCA1_NLCB1_SIA2_SU32_SUS256_SVW1_TT1_16_VW1_WGM4
    SolutionIndex: 83
    SolutionNameMin: Cijk_Ailk_Bjlk_HB_MT32x32x32_MI16x16x16x1_SN_1LDSB0_AMAS0_GRVW4_IU1_LPA0_LPB0_NLCA1_NLCB1_SIA1_SU0_SUS0_SVW1_TT1_16_VW1_WGM8
    SolutionIndex: 84
    SolutionNameMin: Cijk_Ailk_Bjlk_HB_MT32x32x32_MI16x16x16x1_SN_1LDSB0_AMAS0_GRVW4_IU1_LPA0_LPB8_NLCA1_NLCB1_SIA1_SU0_SUS0_SVW1_TT1_16_VW1_WGM8
    SolutionIndex: 85
    SolutionNameMin: Cijk_Ailk_Bjlk_HB_MT32x32x32_MI16x16x16x1_SN_1LDSB0_AMAS0_GRVW8_IU1_LPA0_LPB0_NLCA1_NLCB1_SIA1_SU0_SUS0_SVW1_TT1_16_VW1_WGM8
    SolutionIndex: 86
    SolutionNameMin: Cijk_Ailk_Bjlk_HB_MT32x32x32_MI16x16x16x1_SN_1LDSB0_AMAS0_GRVW8_IU1_LPA8_LPB0_NLCA1_NLCB1_SIA1_SU0_SUS0_SVW1_TT1_16_VW1_WGM8
    SolutionIndex: 87
    SolutionNameMin: Cijk_Ailk_Bjlk_HB_MT32x32x32_MI16x16x16x1_SN_1LDSB0_AMAS0_GRVW8_IU1_LPA8_LPB8_NLCA1_NLCB1_SIA1_SU0_SUS0_SVW1_TT1_16_VW1_WGM8
    SolutionIndex: 88
    SolutionNameMin: Cijk_Ailk_Bjlk_HB_MT32x32x32_MI16x16x16x1_SN_1LDSB1_AMAS0_GRVW4_IU2_LPA0_LPB0_NLCA1_NLCB1_SIA2_SU0_SUS0_SVW1_TT1_16_VW1_WGM8
    SolutionIndex: 89
    SolutionNameMin: Cijk_Ailk_Bjlk_HB_MT32x32x32_MI16x16x16x1_SN_1LDSB1_AMAS0_GRVW4_IU2_LPA0_LPB8_NLCA1_NLCB1_SIA2_SU0_SUS0_SVW1_TT1_16_VW1_WGM8
    SolutionIndex: 90
    SolutionNameMin: Cijk_Ailk_Bjlk_HB_MT32x32x32_MI16x16x16x1_SN_1LDSB1_AMAS0_GRVW4_IU2_LPA8_LPB8_NLCA1_NLCB1_SIA2_SU0_SUS0_SVW1_TT1_16_VW1_WGM8
    SolutionIndex: 91
    SolutionNameMin: Cijk_Ailk_Bjlk_HB_MT32x32x32_MI16x16x16x1_SN_1LDSB1_AMAS0_GRVW8_IU2_LPA0_LPB0_NLCA1_NLCB1_SIA2_SU0_SUS0_SVW1_TT1_16_VW1_WGM8
    SolutionIndex: 92
    SolutionNameMin: Cijk_Ailk_Bjlk_HB_MT32x32x32_MI16x16x16x1_SN_1LDSB1_AMAS0_GRVW8_IU2_LPA8_LPB0_NLCA1_NLCB1_SIA2_SU0_SUS0_SVW1_TT1_16_VW1_WGM8
    SolutionIndex: 93
    SolutionNameMin: Cijk_Ailk_Bjlk_HB_MT32x32x32_MI16x16x16x1_SN_1LDSB1_AMAS0_GRVW8_IU2_LPA0_LPB8_NLCA1_NLCB1_SIA2_SU0_SUS0_SVW1_TT1_16_VW1_WGM8
    SolutionIndex: 94
    SolutionNameMin: Cijk_Ailk_Bjlk_HB_MT32x32x32_MI16x16x16x1_SN_1LDSB0_AMAS0_GRVW8_IU1_LPA0_LPB0_NLCA1_NLCB1_SIA1_SU32_SUS128_SVW1_TT1_16_VW1_WGM8
    SolutionIndex: 95
    SolutionNameMin: Cijk_Ailk_Bjlk_HB_MT32x32x32_MI16x16x16x1_SN_1LDSB1_AMAS0_GRVW8_IU2_LPA0_LPB0_NLCA1_NLCB1_SIA2_SU32_SUS128_SVW1_TT1_16_VW1_WGM8
    SolutionIndex: 96
    SolutionNameMin: Cijk_Ailk_Bjlk_HB_MT32x32x32_MI16x16x16x1_SN_1LDSB1_AMAS0_GRVW8_IU2_LPA8_LPB0_NLCA1_NLCB1_SIA2_SU32_SUS128_SVW1_TT1_16_VW1_WGM8
    SolutionIndex: 97
    SolutionNameMin: Cijk_Ailk_Bjlk_HB_MT32x32x32_MI16x16x16x1_SN_1LDSB1_AMAS0_GRVW8_IU2_LPA0_LPB8_NLCA1_NLCB1_SIA2_SU32_SUS128_SVW1_TT1_16_VW1_WGM8
    SolutionIndex: 98
    SolutionNameMin: Cijk_Ailk_Bjlk_HB_MT32x32x32_MI16x16x16x1_SN_1LDSB0_AMAS0_GRVW8_IU1_LPA0_LPB0_NLCA1_NLCB1_SIA1_SU32_SUS256_SVW1_TT1_16_VW1_WGM8
    SolutionIndex: 99
    SolutionNameMin: Cijk_Ailk_Bjlk_HB_MT32x32x32_MI16x16x16x1_SN_1LDSB1_AMAS0_GRVW8_IU2_LPA8_LPB0_NLCA1_NLCB1_SIA2_SU32_SUS256_SVW1_TT1_16_VW1_WGM8
    SolutionIndex: 100
    SolutionNameMin: Cijk_Ailk_Bjlk_HB_MT32x32x32_MI16x16x16x1_SN_1LDSB1_AMAS0_GRVW8_IU2_LPA0_LPB8_NLCA1_NLCB1_SIA2_SU32_SUS256_SVW1_TT1_16_VW1_WGM8
    SolutionIndex: 101
    SolutionNameMin: Cijk_Ailk_Bjlk_HB_MT32x32x32_MI16x16x16x1_SN_1LDSB1_AMAS0_GRVW8_IU2_LPA8_LPB8_NLCA1_NLCB1_SIA2_SU32_SUS256_SVW1_TT1_16_VW1_WGM8
    SolutionIndex: 102
    SolutionNameMin: Cijk_Ailk_Bjlk_HB_MT64x64x32_MI16x16x16x1_SN_1LDSB0_AMAS0_GRVW4_IU1_LPA0_LPB8_NLCA1_NLCB1_SIA1_SU0_SUS0_SVW1_TT2_32_VW1_WGM4
    SolutionIndex: 103
    SolutionNameMin: Cijk_Ailk_Bjlk_HB_MT64x64x32_MI16x16x16x1_SN_1LDSB0_AMAS3_GRVW4_IU1_LPA8_LPB8_NLCA1_NLCB1_SIA1_SU0_SUS0_SVW2_TT2_32_VW2_WGM4
    SolutionIndex: 104
    SolutionNameMin: Cijk_Ailk_Bjlk_HB_MT64x64x32_MI16x16x16x1_SN_1LDSB0_AMAS0_GRVW8_IU1_LPA0_LPB0_NLCA1_NLCB1_SIA1_SU0_SUS0_SVW1_TT2_32_VW1_WGM4
    SolutionIndex: 105
    SolutionNameMin: Cijk_Ailk_Bjlk_HB_MT64x64x32_MI16x16x16x1_SN_1LDSB0_AMAS0_GRVW8_IU1_LPA8_LPB0_NLCA1_NLCB1_SIA1_SU0_SUS0_SVW1_TT2_32_VW1_WGM4
    SolutionIndex: 106
    SolutionNameMin: Cijk_Ailk_Bjlk_HB_MT64x64x32_MI16x16x16x1_SN_1LDSB0_AMAS0_GRVW8_IU1_LPA0_LPB8_NLCA1_NLCB1_SIA1_SU0_SUS0_SVW1_TT2_32_VW1_WGM4
    SolutionIndex: 107
    SolutionNameMin: Cijk_Ailk_Bjlk_HB_MT64x64x32_MI16x16x16x1_SN_1LDSB0_AMAS0_GRVW8_IU1_LPA8_LPB8_NLCA1_NLCB1_SIA1_SU0_SUS0_SVW1_TT2_32_VW1_WGM4
    SolutionIndex: 108
    SolutionNameMin: Cijk_Ailk_Bjlk_HB_MT64x64x32_MI16x16x16x1_SN_1LDSB0_AMAS3_GRVW8_IU1_LPA8_LPB0_NLCA1_NLCB1_SIA1_SU0_SUS0_SVW2_TT2_32_VW2_WGM4
    SolutionIndex: 109
    SolutionNameMin: Cijk_Ailk_Bjlk_HB_MT64x64x32_MI16x16x16x1_SN_1LDSB0_AMAS3_GRVW8_IU1_LPA0_LPB8_NLCA1_NLCB1_SIA1_SU0_SUS0_SVW2_TT2_32_VW2_WGM4
    SolutionIndex: 110
    SolutionNameMin: Cijk_Ailk_Bjlk_HB_MT64x64x32_MI16x16x16x1_SN_1LDSB1_AMAS0_GRVW8_IU2_LPA0_LPB0_NLCA1_NLCB1_SIA2_SU0_SUS0_SVW1_TT2_32_VW1_WGM4
    SolutionIndex: 111
    SolutionNameMin: Cijk_Ailk_Bjlk_HB_MT64x64x32_MI16x16x16x1_SN_1LDSB1_AMAS0_GRVW8_IU2_LPA8_LPB8_NLCA1_NLCB1_SIA2_SU0_SUS0_SVW1_TT2_32_VW1_WGM4
    SolutionIndex: 112
    SolutionNameMin: Cijk_Ailk_Bjlk_HB_MT64x64x32_MI16x16x16x1_SN_1LDSB1_AMAS3_GRVW8_IU2_LPA0_LPB0_NLCA1_NLCB1_SIA2_SU0_SUS0_SVW2_TT2_32_VW2_WGM4
    SolutionIndex: 113
    SolutionNameMin: Cijk_Ailk_Bjlk_HB_MT64x64x32_MI16x16x16x1_SN_1LDSB1_AMAS3_GRVW8_IU2_LPA8_LPB8_NLCA1_NLCB1_SIA2_SU0_SUS0_SVW2_TT2_32_VW2_WGM4
    SolutionIndex: 114
    SolutionNameMin: Cijk_Ailk_Bjlk_HB_MT64x64x32_MI16x16x16x1_SN_1LDSB0_AMAS0_GRVW8_IU1_LPA0_LPB0_NLCA1_NLCB1_SIA3_SU0_SUS0_SVW1_TT2_32_VW1_WGM4
    SolutionIndex: 115
    SolutionNameMin: Cijk_Ailk_Bjlk_HB_MT64x64x32_MI16x16x16x1_SN_1LDSB0_AMAS0_GRVW8_IU1_LPA0_LPB8_NLCA1_NLCB1_SIA3_SU0_SUS0_SVW1_TT2_32_VW1_WGM4
    SolutionIndex: 116
    SolutionNameMin: Cijk_Ailk_Bjlk_HB_MT64x64x32_MI16x16x16x1_SN_1LDSB0_AMAS0_GRVW8_IU1_LPA8_LPB8_NLCA1_NLCB1_SIA3_SU0_SUS0_SVW1_TT2_32_VW1_WGM4
    SolutionIndex: 117
    SolutionNameMin: Cijk_Ailk_Bjlk_HB_MT64x64x32_MI16x16x16x1_SN_1LDSB0_AMAS3_GRVW8_IU1_LPA0_LPB0_NLCA1_NLCB1_SIA3_SU0_SUS0_SVW2_TT2_32_VW2_WGM4
    SolutionIndex: 118
    SolutionNameMin: Cijk_Ailk_Bjlk_HB_MT64x64x32_MI16x16x16x1_SN_1LDSB0_AMAS3_GRVW8_IU1_LPA8_LPB0_NLCA1_NLCB1_SIA3_SU0_SUS0_SVW2_TT2_32_VW2_WGM4
    SolutionIndex: 119
    SolutionNameMin: Cijk_Ailk_Bjlk_HB_MT64x64x32_MI16x16x16x1_SN_1LDSB0_AMAS3_GRVW8_IU1_LPA0_LPB8_NLCA1_NLCB1_SIA3_SU0_SUS0_SVW2_TT2_32_VW2_WGM4
    SolutionIndex: 120
    SolutionNameMin: Cijk_Ailk_Bjlk_HB_MT64x64x32_MI16x16x16x1_SN_1LDSB0_AMAS3_GRVW8_IU1_LPA8_LPB8_NLCA1_NLCB1_SIA3_SU0_SUS0_SVW2_TT2_32_VW2_WGM4
    SolutionIndex: 121
    SolutionNameMin: Cijk_Ailk_Bjlk_HB_MT64x64x32_MI16x16x16x1_SN_1LDSB0_AMAS3_GRVW8_IU1_LPA0_LPB0_NLCA1_NLCB1_SIA1_SU32_SUS128_SVW2_TT2_32_VW2_WGM4
    SolutionIndex: 122
    SolutionNameMin: Cijk_Ailk_Bjlk_HB_MT64x64x32_MI16x16x16x1_SN_1LDSB1_AMAS3_GRVW8_IU2_LPA8_LPB0_NLCA1_NLCB1_SIA2_SU32_SUS128_SVW2_TT2_32_VW2_WGM4
    SolutionIndex: 123
    SolutionNameMin: Cijk_Ailk_Bjlk_HB_MT64x64x32_MI16x16x16x1_SN_1LDSB0_AMAS0_GRVW8_IU1_LPA0_LPB0_NLCA1_NLCB1_SIA3_SU32_SUS128_SVW1_TT2_32_VW1_WGM4
    SolutionIndex: 124
    SolutionNameMin: Cijk_Ailk_Bjlk_HB_MT64x64x32_MI16x16x16x1_SN_1LDSB0_AMAS0_GRVW8_IU1_LPA0_LPB8_NLCA1_NLCB1_SIA1_SU32_SUS256_SVW1_TT2_32_VW1_WGM4
    SolutionIndex: 125
    SolutionNameMin: Cijk_Ailk_Bjlk_HB_MT64x64x32_MI16x16x16x1_SN_1LDSB0_AMAS0_GRVW8_IU1_LPA8_LPB8_NLCA1_NLCB1_SIA1_SU32_SUS256_SVW1_TT2_32_VW1_WGM4
    SolutionIndex: 126
    SolutionNameMin: Cijk_Ailk_Bjlk_HB_MT64x64x32_MI16x16x16x1_SN_1LDSB0_AMAS3_GRVW8_IU1_LPA0_LPB8_NLCA1_NLCB1_SIA1_SU32_SUS256_SVW2_TT2_32_VW2_WGM4
    SolutionIndex: 127
    SolutionNameMin: Cijk_Ailk_Bjlk_HB_MT64x64x32_MI16x16x16x1_SN_1LDSB0_AMAS0_GRVW8_IU1_LPA0_LPB0_NLCA1_NLCB1_SIA3_SU32_SUS256_SVW1_TT2_32_VW1_WGM4
    SolutionIndex: 128
    SolutionNameMin: Cijk_Ailk_Bjlk_HB_MT64x64x32_MI16x16x16x1_SN_1LDSB0_AMAS0_GRVW8_IU1_LPA8_LPB0_NLCA1_NLCB1_SIA3_SU32_SUS256_SVW1_TT2_32_VW1_WGM4
    SolutionIndex: 129
    SolutionNameMin: Cijk_Ailk_Bjlk_HB_MT64x64x32_MI16x16x16x1_SN_1LDSB0_AMAS3_GRVW8_IU1_LPA0_LPB0_NLCA1_NLCB1_SIA3_SU32_SUS256_SVW2_TT2_32_VW2_WGM4
    SolutionIndex: 130
    SolutionNameMin: Cijk_Ailk_Bjlk_HB_MT64x64x32_MI16x16x16x1_SN_1LDSB0_AMAS3_GRVW8_IU1_LPA8_LPB8_NLCA1_NLCB1_SIA3_SU32_SUS256_SVW2_TT2_32_VW2_WGM4
    SolutionIndex: 131
    SolutionNameMin: Cijk_Ailk_Bjlk_HB_MT64x64x32_MI16x16x16x1_SN_1LDSB0_AMAS0_GRVW8_IU1_LPA0_LPB0_NLCA1_NLCB1_SIA1_SU0_SUS0_SVW1_TT2_32_VW1_WGM8
    SolutionIndex: 132
    SolutionNameMin: Cijk_Ailk_Bjlk_HB_MT64x64x32_MI16x16x16x1_SN_1LDSB0_AMAS0_GRVW8_IU1_LPA8_LPB0_NLCA1_NLCB1_SIA1_SU0_SUS0_SVW1_TT2_32_VW1_WGM8
    SolutionIndex: 133
    SolutionNameMin: Cijk_Ailk_Bjlk_HB_MT64x64x32_MI16x16x16x1_SN_1LDSB0_AMAS0_GRVW8_IU1_LPA0_LPB8_NLCA1_NLCB1_SIA1_SU0_SUS0_SVW1_TT2_32_VW1_WGM8
    SolutionIndex: 134
    SolutionNameMin: Cijk_Ailk_Bjlk_HB_MT64x64x32_MI16x16x16x1_SN_1LDSB0_AMAS0_GRVW8_IU1_LPA8_LPB8_NLCA1_NLCB1_SIA1_SU0_SUS0_SVW1_TT2_32_VW1_WGM8
    SolutionIndex: 135
    SolutionNameMin: Cijk_Ailk_Bjlk_HB_MT64x64x32_MI16x16x16x1_SN_1LDSB0_AMAS3_GRVW8_IU1_LPA0_LPB0_NLCA1_NLCB1_SIA1_SU0_SUS0_SVW2_TT2_32_VW2_WGM8
    SolutionIndex: 136
    SolutionNameMin: Cijk_Ailk_Bjlk_HB_MT64x64x32_MI16x16x16x1_SN_1LDSB0_AMAS3_GRVW8_IU1_LPA8_LPB0_NLCA1_NLCB1_SIA1_SU0_SUS0_SVW2_TT2_32_VW2_WGM8
    SolutionIndex: 137
    SolutionNameMin: Cijk_Ailk_Bjlk_HB_MT64x64x32_MI16x16x16x1_SN_1LDSB0_AMAS3_GRVW8_IU1_LPA0_LPB8_NLCA1_NLCB1_SIA1_SU0_SUS0_SVW2_TT2_32_VW2_WGM8
    SolutionIndex: 138
    SolutionNameMin: Cijk_Ailk_Bjlk_HB_MT64x64x32_MI16x16x16x1_SN_1LDSB0_AMAS3_GRVW8_IU1_LPA8_LPB8_NLCA1_NLCB1_SIA1_SU0_SUS0_SVW2_TT2_32_VW2_WGM8
    SolutionIndex: 139
    SolutionNameMin: Cijk_Ailk_Bjlk_HB_MT64x64x32_MI16x16x16x1_SN_1LDSB1_AMAS0_GRVW8_IU2_LPA0_LPB0_NLCA1_NLCB1_SIA2_SU0_SUS0_SVW1_TT2_32_VW1_WGM8
    SolutionIndex: 140
    SolutionNameMin: Cijk_Ailk_Bjlk_HB_MT64x64x32_MI16x16x16x1_SN_1LDSB1_AMAS0_GRVW8_IU2_LPA0_LPB8_NLCA1_NLCB1_SIA2_SU0_SUS0_SVW1_TT2_32_VW1_WGM8
    SolutionIndex: 141
    SolutionNameMin: Cijk_Ailk_Bjlk_HB_MT64x64x32_MI16x16x16x1_SN_1LDSB1_AMAS0_GRVW8_IU2_LPA8_LPB8_NLCA1_NLCB1_SIA2_SU0_SUS0_SVW1_TT2_32_VW1_WGM8
    SolutionIndex: 142
    SolutionNameMin: Cijk_Ailk_Bjlk_HB_MT64x64x32_MI16x16x16x1_SN_1LDSB1_AMAS3_GRVW8_IU2_LPA0_LPB0_NLCA1_NLCB1_SIA2_SU0_SUS0_SVW2_TT2_32_VW2_WGM8
    SolutionIndex: 143
    SolutionNameMin: Cijk_Ailk_Bjlk_HB_MT64x64x32_MI16x16x16x1_SN_1LDSB1_AMAS3_GRVW8_IU2_LPA8_LPB0_NLCA1_NLCB1_SIA2_SU0_SUS0_SVW2_TT2_32_VW2_WGM8
    SolutionIndex: 144
    SolutionNameMin: Cijk_Ailk_Bjlk_HB_MT64x64x32_MI16x16x16x1_SN_1LDSB1_AMAS3_GRVW8_IU2_LPA0_LPB8_NLCA1_NLCB1_SIA2_SU0_SUS0_SVW2_TT2_32_VW2_WGM8
    SolutionIndex: 145
    SolutionNameMin: Cijk_Ailk_Bjlk_HB_MT64x64x32_MI16x16x16x1_SN_1LDSB0_AMAS0_GRVW8_IU1_LPA0_LPB0_NLCA1_NLCB1_SIA3_SU0_SUS0_SVW1_TT2_32_VW1_WGM8
    SolutionIndex: 146
    SolutionNameMin: Cijk_Ailk_Bjlk_HB_MT64x64x32_MI16x16x16x1_SN_1LDSB0_AMAS0_GRVW8_IU1_LPA8_LPB8_NLCA1_NLCB1_SIA3_SU0_SUS0_SVW1_TT2_32_VW1_WGM8
    SolutionIndex: 147
    SolutionNameMin: Cijk_Ailk_Bjlk_HB_MT64x64x32_MI16x16x16x1_SN_1LDSB0_AMAS3_GRVW8_IU1_LPA0_LPB0_NLCA1_NLCB1_SIA3_SU0_SUS0_SVW2_TT2_32_VW2_WGM8
    SolutionIndex: 148
    SolutionNameMin: Cijk_Ailk_Bjlk_HB_MT64x64x32_MI16x16x16x1_SN_1LDSB0_AMAS3_GRVW8_IU1_LPA8_LPB0_NLCA1_NLCB1_SIA3_SU0_SUS0_SVW2_TT2_32_VW2_WGM8
    SolutionIndex: 149
    SolutionNameMin: Cijk_Ailk_Bjlk_HB_MT64x64x32_MI16x16x16x1_SN_1LDSB0_AMAS3_GRVW8_IU1_LPA0_LPB8_NLCA1_NLCB1_SIA3_SU0_SUS0_SVW2_TT2_32_VW2_WGM8
    SolutionIndex: 150
    SolutionNameMin: Cijk_Ailk_Bjlk_HB_MT64x64x32_MI16x16x16x1_SN_1LDSB0_AMAS3_GRVW8_IU1_LPA8_LPB8_NLCA1_NLCB1_SIA3_SU0_SUS0_SVW2_TT2_32_VW2_WGM8
    SolutionIndex: 151
    SolutionNameMin: Cijk_Ailk_Bjlk_HB_MT64x64x32_MI16x16x16x1_SN_1LDSB0_AMAS0_GRVW8_IU1_LPA0_LPB8_NLCA1_NLCB1_SIA1_SU32_SUS128_SVW1_TT2_32_VW1_WGM8
    SolutionIndex: 152
    SolutionNameMin: Cijk_Ailk_Bjlk_HB_MT64x64x32_MI16x16x16x1_SN_1LDSB0_AMAS0_GRVW8_IU1_LPA8_LPB8_NLCA1_NLCB1_SIA1_SU32_SUS128_SVW1_TT2_32_VW1_WGM8
    SolutionIndex: 153
    SolutionNameMin: Cijk_Ailk_Bjlk_HB_MT64x64x32_MI16x16x16x1_SN_1LDSB0_AMAS3_GRVW8_IU1_LPA0_LPB0_NLCA1_NLCB1_SIA1_SU32_SUS128_SVW2_TT2_32_VW2_WGM8
    SolutionIndex: 154
    SolutionNameMin: Cijk_Ailk_Bjlk_HB_MT64x64x32_MI16x16x16x1_SN_1LDSB0_AMAS3_GRVW8_IU1_LPA8_LPB0_NLCA1_NLCB1_SIA1_SU32_SUS128_SVW2_TT2_32_VW2_WGM8
    SolutionIndex: 155
    SolutionNameMin: Cijk_Ailk_Bjlk_HB_MT64x64x32_MI16x16x16x1_SN_1LDSB0_AMAS3_GRVW8_IU1_LPA8_LPB0_NLCA1_NLCB1_SIA3_SU32_SUS128_SVW2_TT2_32_VW2_WGM8
    SolutionIndex: 156
    SolutionNameMin: Cijk_Ailk_Bjlk_HB_MT64x64x32_MI16x16x16x1_SN_1LDSB0_AMAS0_GRVW4_IU1_LPA0_LPB0_NLCA1_NLCB1_SIA1_SU32_SUS256_SVW1_TT2_32_VW1_WGM8
    SolutionIndex: 157
    SolutionNameMin: Cijk_Ailk_Bjlk_HB_MT64x64x32_MI16x16x16x1_SN_1LDSB0_AMAS0_GRVW4_IU1_LPA0_LPB8_NLCA1_NLCB1_SIA1_SU32_SUS256_SVW1_TT2_32_VW1_WGM8
    SolutionIndex: 158
    SolutionNameMin: Cijk_Ailk_Bjlk_HB_MT64x64x32_MI16x16x16x1_SN_1LDSB0_AMAS3_GRVW4_IU1_LPA8_LPB8_NLCA1_NLCB1_SIA1_SU32_SUS256_SVW2_TT2_32_VW2_WGM8
    SolutionIndex: 159
    SolutionNameMin: Cijk_Ailk_Bjlk_HB_MT64x64x32_MI16x16x16x1_SN_1LDSB0_AMAS0_GRVW8_IU1_LPA8_LPB0_NLCA1_NLCB1_SIA1_SU32_SUS256_SVW1_TT2_32_VW1_WGM8
    SolutionIndex: 160
    SolutionNameMin: Cijk_Ailk_Bjlk_HB_MT64x64x32_MI16x16x16x1_SN_1LDSB0_AMAS0_GRVW8_IU1_LPA0_LPB8_NLCA1_NLCB1_SIA1_SU32_SUS256_SVW1_TT2_32_VW1_WGM8
    SolutionIndex: 161
    SolutionNameMin: Cijk_Ailk_Bjlk_HB_MT64x64x32_MI16x16x16x1_SN_1LDSB0_AMAS3_GRVW8_IU1_LPA0_LPB0_NLCA1_NLCB1_SIA1_SU32_SUS256_SVW2_TT2_32_VW2_WGM8
    SolutionIndex: 162
    SolutionNameMin: Cijk_Ailk_Bjlk_HB_MT64x64x32_MI16x16x16x1_SN_1LDSB0_AMAS3_GRVW8_IU1_LPA0_LPB8_NLCA1_NLCB1_SIA1_SU32_SUS256_SVW2_TT2_32_VW2_WGM8
    SolutionIndex: 163
    SolutionNameMin: Cijk_Ailk_Bjlk_HB_MT64x64x32_MI16x16x16x1_SN_1LDSB0_AMAS3_GRVW8_IU1_LPA8_LPB8_NLCA1_NLCB1_SIA1_SU32_SUS256_SVW2_TT2_32_VW2_WGM8
    SolutionIndex: 164
    SolutionNameMin: Cijk_Ailk_Bjlk_HB_MT64x64x32_MI16x16x16x1_SN_1LDSB0_AMAS3_GRVW8_IU1_LPA0_LPB0_NLCA1_NLCB1_SIA3_SU32_SUS256_SVW2_TT2_32_VW2_WGM8
    SolutionIndex: 165
    SolutionNameMin: Cijk_Ailk_Bjlk_HB_MT64x64x32_MI16x16x16x1_SN_1LDSB0_AMAS3_GRVW8_IU1_LPA8_LPB0_NLCA1_NLCB1_SIA3_SU32_SUS256_SVW2_TT2_32_VW2_WGM8
    SolutionIndex: 166
    SolutionNameMin: Cijk_Ailk_Bjlk_HB_MT64x64x32_MI16x16x16x1_SN_1LDSB0_AMAS3_GRVW8_IU1_LPA0_LPB8_NLCA1_NLCB1_SIA3_SU32_SUS256_SVW2_TT2_32_VW2_WGM8
- - - [64, 64, 1, 64, 96, 96, 96, 96]
    - [88, 0.09]
  - - [64, 64, 1, 128, 96, 96, 160, 160]
    - [100, 0.172]
  - - [64, 64, 1, 256, 96, 96, 288, 288]
    - [71, 0.317]
  - - [64, 64, 1, 512, 96, 96, 544, 544]
    - [92, 0.541]
  - - [64, 64, 1, 1024, 96, 96, 1056, 1056]
    - [91, 0.852]
  - - [64, 64, 1, 2048, 96, 96, 2080, 2080]
    - [91, 1.185]
  - - [64, 64, 1, 4096, 96, 96, 4128, 4128]
    - [91, 1.468]
  - - [64, 128, 1, 64, 96, 96, 96, 128]
    - [99, 0.186]
  - - [64, 128, 1, 128, 96, 96, 160, 160]
    - [77, 0.352]
  - - [64, 128, 1, 256, 96, 96, 288, 288]
    - [69, 0.641]
  - - [64, 128, 1, 512, 96, 96, 544, 544]
    - [71, 1.105]
  - - [64, 128, 1, 1024, 96, 96, 1056, 1056]
    - [70, 1.729]
  - - [64, 128, 1, 2048, 96, 96, 2080, 2080]
    - [91, 2.39]
  - - [64, 128, 1, 4096, 96, 96, 4128, 4128]
    - [91, 2.954]
  - - [64, 256, 1, 64, 96, 96, 96, 256]
    - [81, 0.374]
  - - [64, 256, 1, 128, 96, 96, 160, 256]
    - [69, 0.712]
  - - [64, 256, 1, 256, 96, 96, 288, 288]
    - [96, 1.303]
  - - [64, 256, 1, 512, 96, 96, 544, 544]
    - [93, 2.233]
  - - [64, 256, 1, 1024, 96, 96, 1056, 1056]
    - [91, 3.467]
  - - [64, 256, 1, 2048, 96, 96, 2080, 2080]
    - [70, 4.786]
  - - [64, 256, 1, 4096, 96, 96, 4128, 4128]
    - [91, 5.906]
  - - [64, 512, 1, 64, 96, 96, 96, 512]
    - [91, 0.735]
  - - [64, 512, 1, 128, 96, 96, 160, 512]
    - [93, 1.371]
  - - [64, 512, 1, 256, 96, 96, 288, 512]
    - [93, 2.435]
  - - [64, 512, 1, 512, 96, 96, 544, 544]
    - [70, 3.943]
  - - [64, 512, 1, 1024, 96, 96, 1056, 1056]
    - [70, 5.787]
  - - [64, 512, 1, 2048, 96, 96, 2080, 2080]
    - [88, 7.427]
  - - [64, 512, 1, 4096, 96, 96, 4128, 4128]
    - [70, 8.731]
  - - [64, 1024, 1, 64, 96, 96, 96, 1024]
    - [68, 1.429]
  - - [64, 1024, 1, 128, 96, 96, 160, 1024]
    - [73, 2.602]
  - - [64, 1024, 1, 256, 96, 96, 288, 1024]
    - [83, 4.434]
  - - [64, 1024, 1, 512, 96, 96, 544, 1024]
    - [67, 6.892]
  - - [64, 1024, 1, 1024, 96, 96, 1056, 1056]
    - [83, 9.487]
  - - [64, 1024, 1, 2048, 96, 96, 2080, 2080]
    - [83, 11.682]
  - - [64, 1024, 1, 4096, 96, 96, 4128, 4128]
    - [85, 13.234]
  - - [64, 2048, 1, 64, 96, 96, 96, 2048]
    - [128, 2.693]
  - - [64, 2048, 1, 128, 96, 96, 160, 2048]
    - [134, 4.866]
  - - [64, 2048, 1, 256, 96, 96, 288, 2048]
    - [106, 8.059]
  - - [64, 2048, 1, 512, 96, 96, 544, 2048]
    - [104, 11.967]
  - - [64, 2048, 1, 1024, 96, 96, 1056, 2048]
    - [131, 15.868]
  - - [64, 2048, 1, 2048, 96, 96, 2080, 2080]
    - [102, 18.902]
  - - [64, 2048, 1, 4096, 96, 96, 4128, 4128]
    - [157, 20.184]
  - - [64, 4096, 1, 64, 96, 96, 96, 4096]
    - [145, 5.112]
  - - [64, 4096, 1, 128, 96, 96, 160, 4096]
    - [3, 8.765]
  - - [64, 4096, 1, 256, 96, 96, 288, 4096]
    - [114, 13.701]
  - - [64, 4096, 1, 512, 96, 96, 544, 4096]
    - [119, 18.914]
  - - [64, 4096, 1, 1024, 96, 96, 1056, 4096]
    - [159, 23.486]
  - - [64, 4096, 1, 2048, 96, 96, 2080, 4096]
    - [107, 26.781]
  - - [64, 4096, 1, 4096, 96, 96, 4128, 4128]
    - [107, 27.995]
  - - [128, 64, 1, 64, 160, 160, 128, 96]
    - [88, 0.186]
  - - [128, 64, 1, 128, 160, 160, 160, 160]
    - [72, 0.353]
  - - [128, 64, 1, 256, 160, 160, 288, 288]
    - [69, 0.645]
  - - [128, 64, 1, 512, 160, 160, 544, 544]
    - [71, 1.111]
  - - [128, 64, 1, 1024, 160, 160, 1056, 1056]
    - [70, 1.73]
  - - [128, 64, 1, 2048, 160, 160, 2080, 2080]
    - [91, 2.392]
  - - [128, 64, 1, 4096, 160, 160, 4128, 4128]
    - [91, 2.958]
  - - [128, 128, 1, 64, 160, 160, 128, 128]
    - [76, 0.375]
  - - [128, 128, 1, 128, 160, 160, 160, 160]
    - [100, 0.715]
  - - [128, 128, 1, 256, 160, 160, 288, 288]
    - [82, 1.306]
  - - [128, 128, 1, 512, 160, 160, 544, 544]
    - [92, 2.232]
  - - [128, 128, 1, 1024, 160, 160, 1056, 1056]
    - [91, 3.47]
  - - [128, 128, 1, 2048, 160, 160, 2080, 2080]
    - [91, 4.791]
  - - [128, 128, 1, 4096, 160, 160, 4128, 4128]
    - [91, 5.906]
  - - [128, 256, 1, 64, 160, 160, 128, 256]
    - [90, 0.737]
  - - [128, 256, 1, 128, 160, 160, 160, 256]
    - [86, 1.379]
  - - [128, 256, 1, 256, 160, 160, 288, 288]
    - [69, 2.446]
  - - [128, 256, 1, 512, 160, 160, 544, 544]
    - [78, 3.955]
  - - [128, 256, 1, 1024, 160, 160, 1056, 1056]
    - [91, 5.758]
  - - [128, 256, 1, 2048, 160, 160, 2080, 2080]
    - [75, 7.398]
  - - [128, 256, 1, 4096, 160, 160, 4128, 4128]
    - [70, 8.72]
  - - [128, 512, 1, 64, 160, 160, 128, 512]
    - [85, 1.424]
  - - [128, 512, 1, 128, 160, 160, 160, 512]
    - [67, 2.624]
  - - [128, 512, 1, 256, 160, 160, 288, 512]
    - [80, 4.458]
  - - [128, 512, 1, 512, 160, 160, 544, 544]
    - [66, 6.877]
  - - [128, 512, 1, 1024, 160, 160, 1056, 1056]
    - [67, 9.47]
  - - [128, 512, 1, 2048, 160, 160, 2080, 2080]
    - [67, 11.682]
  - - [128, 512, 1, 4096, 160, 160, 4128, 4128]
    - [80, 13.233]
  - - [128, 1024, 1, 64, 160, 160, 128, 1024]
    - [4, 2.72]
  - - [128, 1024, 1, 128, 160, 160, 160, 1024]
    - [160, 4.87]
  - - [128, 1024, 1, 256, 160, 160, 288, 1024]
    - [131, 8.057]
  - - [128, 1024, 1, 512, 160, 160, 544, 1024]
    - [106, 11.982]
  - - [128, 1024, 1, 1024, 160, 160, 1056, 1056]
    - [133, 15.794]
  - - [128, 1024, 1, 2048, 160, 160, 2080, 2080]
    - [133, 18.732]
  - - [128, 1024, 1, 4096, 160, 160, 4128, 4128]
    - [133, 19.535]
  - - [128, 2048, 1, 64, 160, 160, 128, 2048]
    - [124, 5.112]
  - - [128, 2048, 1, 128, 160, 160, 160, 2048]
    - [118, 8.836]
  - - [128, 2048, 1, 256, 160, 160, 288, 2048]
    - [146, 13.881]
  - - [128, 2048, 1, 512, 160, 160, 544, 2048]
    - [115, 19.366]
  - - [128, 2048, 1, 1024, 160, 160, 1056, 2048]
    - [116, 24.106]
  - - [128, 2048, 1, 2048, 160, 160, 2080, 2080]
    - [116, 26.989]
  - - [128, 2048, 1, 4096, 160, 160, 4128, 4128]
    - [151, 28.153]
  - - [128, 4096, 1, 64, 160, 160, 128, 4096]
    - [2, 9.213]
  - - [128, 4096, 1, 128, 160, 160, 160, 4096]
    - [131, 14.853]
  - - [128, 4096, 1, 256, 160, 160, 288, 4096]
    - [14, 22.268]
  - - [128, 4096, 1, 512, 160, 160, 544, 4096]
    - [15, 29.705]
  - - [128, 4096, 1, 1024, 160, 160, 1056, 4096]
    - [17, 35.673]
  - - [128, 4096, 1, 2048, 160, 160, 2080, 4096]
    - [24, 38.075]
  - - [128, 4096, 1, 4096, 160, 160, 4128, 4128]
    - [17, 41.099]
  - - [256, 64, 1, 64, 288, 288, 256, 96]
    - [101, 0.374]
  - - [256, 64, 1, 128, 288, 288, 256, 160]
    - [72, 0.718]
  - - [256, 64, 1, 256, 288, 288, 288, 288]
    - [71, 1.31]
  - - [256, 64, 1, 512, 288, 288, 544, 544]
    - [89, 2.232]
  - - [256, 64, 1, 1024, 288, 288, 1056, 1056]
    - [91, 3.467]
  - - [256, 64, 1, 2048, 288, 288, 2080, 2080]
    - [70, 4.779]
  - - [256, 64, 1, 4096, 288, 288, 4128, 4128]
    - [91, 5.912]
  - - [256, 128, 1, 64, 288, 288, 256, 128]
    - [87, 0.737]
  - - [256, 128, 1, 128, 288, 288, 256, 160]
    - [88, 1.378]
  - - [256, 128, 1, 256, 288, 288, 288, 288]
    - [69, 2.452]
  - - [256, 128, 1, 512, 288, 288, 544, 544]
    - [91, 3.959]
  - - [256, 128, 1, 1024, 288, 288, 1056, 1056]
    - [91, 5.79]
  - - [256, 128, 1, 2048, 288, 288, 2080, 2080]
    - [69, 7.452]
  - - [256, 128, 1, 4096, 288, 288, 4128, 4128]
    - [70, 8.739]
  - - [256, 256, 1, 64, 288, 288, 256, 256]
    - [79, 1.424]
  - - [256, 256, 1, 128, 288, 288, 256, 256]
    - [66, 2.639]
  - - [256, 256, 1, 256, 288, 288, 288, 288]
    - [66, 4.502]
  - - [256, 256, 1, 512, 288, 288, 544, 544]
    - [67, 6.924]
  - - [256, 256, 1, 1024, 288, 288, 1056, 1056]
    - [94, 9.466]
  - - [256, 256, 1, 2048, 288, 288, 2080, 2080]
    - [74, 11.658]
  - - [256, 256, 1, 4096, 288, 288, 4128, 4128]
    - [74, 13.227]
  - - [256, 512, 1, 64, 288, 288, 256, 512]
    - [147, 2.727]
  - - [256, 512, 1, 128, 288, 288, 256, 512]
    - [106, 4.909]
  - - [256, 512, 1, 256, 288, 288, 288, 512]
    - [133, 8.093]
  - - [256, 512, 1, 512, 288, 288, 544, 544]
    - [133, 12.072]
  - - [256, 512, 1, 1024, 288, 288, 1056, 1056]
    - [133, 15.864]
  - - [256, 512, 1, 2048, 288, 288, 2080, 2080]
    - [125, 18.941]
  - - [256, 512, 1, 4096, 288, 288, 4128, 4128]
    - [125, 20.477]
  - - [256, 1024, 1, 64, 288, 288, 256, 1024]
    - [152, 5.115]
  - - [256, 1024, 1, 128, 288, 288, 256, 1024]
    - [117, 8.857]
  - - [256, 1024, 1, 256, 288, 288, 288, 1024]
    - [116, 13.854]
  - - [256, 1024, 1, 512, 288, 288, 544, 1024]
    - [146, 19.341]
  - - [256, 1024, 1, 1024, 288, 288, 1056, 1056]
    - [146, 24.079]
  - - [256, 1024, 1, 2048, 288, 288, 2080, 2080]
    - [115, 27.429]
  - - [256, 1024, 1, 4096, 288, 288, 4128, 4128]
    - [154, 28.127]
  - - [256, 2048, 1, 64, 288, 288, 256, 2048]
    - [163, 9.202]
  - - [256, 2048, 1, 128, 288, 288, 256, 2048]
    - [5, 14.891]
  - - [256, 2048, 1, 256, 288, 288, 288, 2048]
    - [37, 22.408]
  - - [256, 2048, 1, 512, 288, 288, 544, 2048]
    - [35, 30.024]
  - - [256, 2048, 1, 1024, 288, 288, 1056, 2048]
    - [8, 36.13]
  - - [256, 2048, 1, 2048, 288, 288, 2080, 2080]
    - [34, 39.295]
  - - [256, 2048, 1, 4096, 288, 288, 4128, 4128]
    - [25, 41.764]
  - - [256, 4096, 1, 64, 288, 288, 256, 4096]
    - [164, 14.958]
  - - [256, 4096, 1, 128, 288, 288, 256, 4096]
    - [14, 23.08]
  - - [256, 4096, 1, 256, 288, 288, 288, 4096]
    - [42, 33.041]
  - - [256, 4096, 1, 512, 288, 288, 544, 4096]
    - [43, 42.154]
  - - [256, 4096, 1, 1024, 288, 288, 1056, 4096]
    - [30, 48.063]
  - - [256, 4096, 1, 2048, 288, 288, 2080, 4096]
    - [21, 51.125]
  - - [256, 4096, 1, 4096, 288, 288, 4128, 4128]
    - [44, 54.539]
  - - [384, 64, 1, 64, 416, 416, 384, 96]
    - [97, 0.565]
  - - [384, 64, 1, 128, 416, 416, 384, 160]
    - [70, 1.078]
  - - [384, 64, 1, 256, 416, 416, 384, 288]
    - [95, 1.949]
  - - [384, 64, 1, 512, 416, 416, 544, 544]
    - [91, 3.347]
  - - [384, 64, 1, 1024, 416, 416, 1056, 1056]
    - [70, 5.213]
  - - [384, 64, 1, 2048, 416, 416, 2080, 2080]
    - [91, 7.168]
  - - [384, 64, 1, 4096, 416, 416, 4128, 4128]
    - [91, 8.859]
  - - [384, 128, 1, 64, 416, 416, 384, 128]
    - [98, 1.106]
  - - [384, 128, 1, 128, 416, 416, 384, 160]
    - [84, 2.051]
  - - [384, 128, 1, 256, 416, 416, 384, 288]
    - [67, 3.615]
  - - [384, 128, 1, 512, 416, 416, 544, 544]
    - [82, 5.873]
  - - [384, 128, 1, 1024, 416, 416, 1056, 1056]
    - [69, 8.571]
  - - [384, 128, 1, 2048, 416, 416, 2080, 2080]
    - [66, 11.058]
  - - [384, 128, 1, 4096, 416, 416, 4128, 4128]
    - [70, 12.934]
  - - [384, 256, 1, 64, 416, 416, 384, 256]
    - [109, 2.09]
  - - [384, 256, 1, 128, 416, 416, 384, 256]
    - [131, 3.819]
  - - [384, 256, 1, 256, 416, 416, 384, 288]
    - [143, 6.54]
  - - [384, 256, 1, 512, 416, 416, 544, 544]
    - [144, 10.135]
  - - [384, 256, 1, 1024, 416, 416, 1056, 1056]
    - [142, 13.985]
  - - [384, 256, 1, 2048, 416, 416, 2080, 2080]
    - [141, 17.201]
  - - [384, 256, 1, 4096, 416, 416, 4128, 4128]
    - [141, 19.429]
  - - [384, 512, 1, 64, 416, 416, 384, 512]
    - [0, 4.043]
  - - [384, 512, 1, 128, 416, 416, 384, 512]
    - [108, 7.22]
  - - [384, 512, 1, 256, 416, 416, 384, 512]
    - [153, 11.999]
  - - [384, 512, 1, 512, 416, 416, 544, 544]
    - [136, 17.892]
  - - [384, 512, 1, 1024, 416, 416, 1056, 1056]
    - [134, 23.586]
  - - [384, 512, 1, 2048, 416, 416, 2080, 2080]
    - [133, 27.99]
  - - [384, 512, 1, 4096, 416, 416, 4128, 4128]
    - [132, 29.444]
  - - [384, 1024, 1, 64, 416, 416, 384, 1024]
    - [1, 7.283]
  - - [384, 1024, 1, 128, 416, 416, 384, 1024]
    - [136, 12.147]
  - - [384, 1024, 1, 256, 416, 416, 384, 1024]
    - [132, 18.176]
  - - [384, 1024, 1, 512, 416, 416, 544, 1024]
    - [148, 24.255]
  - - [384, 1024, 1, 1024, 416, 416, 1056, 1056]
    - [120, 29.172]
  - - [384, 1024, 1, 2048, 416, 416, 2080, 2080]
    - [165, 30.864]
  - - [384, 1024, 1, 4096, 416, 416, 4128, 4128]
    - [18, 33.181]
  - - [384, 2048, 1, 64, 416, 416, 384, 2048]
    - [59, 12.384]
  - - [384, 2048, 1, 128, 416, 416, 384, 2048]
    - [65, 20.874]
  - - [384, 2048, 1, 256, 416, 416, 384, 2048]
    - [14, 31.922]
  - - [384, 2048, 1, 512, 416, 416, 544, 2048]
    - [45, 43.144]
  - - [384, 2048, 1, 1024, 416, 416, 1056, 2048]
    - [47, 52.359]
  - - [384, 2048, 1, 2048, 416, 416, 2080, 2080]
    - [46, 56.219]
  - - [384, 2048, 1, 4096, 416, 416, 4128, 4128]
    - [33, 60.831]
  - - [384, 4096, 1, 64, 416, 416, 384, 4096]
    - [8, 20.277]
  - - [384, 4096, 1, 128, 416, 416, 384, 4096]
    - [23, 31.074]
  - - [384, 4096, 1, 256, 416, 416, 384, 4096]
    - [54, 43.401]
  - - [384, 4096, 1, 512, 416, 416, 544, 4096]
    - [16, 54.209]
  - - [384, 4096, 1, 1024, 416, 416, 1056, 4096]
    - [28, 59.202]
  - - [384, 4096, 1, 2048, 416, 416, 2080, 4096]
    - [62, 64.41]
  - - [384, 4096, 1, 4096, 416, 416, 4128, 4128]
    - [14, 68.31]
  - - [768, 64, 1, 64, 800, 800, 768, 96]
    - [86, 1.102]
  - - [768, 64, 1, 128, 800, 800, 768, 160]
    - [87, 2.045]
  - - [768, 64, 1, 256, 800, 800, 768, 288]
    - [91, 3.626]
  - - [768, 64, 1, 512, 800, 800, 768, 544]
    - [66, 5.862]
  - - [768, 64, 1, 1024, 800, 800, 1056, 1056]
    - [69, 8.56]
  - - [768, 64, 1, 2048, 800, 800, 2080, 2080]
    - [69, 11.044]
  - - [768, 64, 1, 4096, 800, 800, 4128, 4128]
    - [69, 12.925]
  - - [768, 128, 1, 64, 800, 800, 768, 128]
    - [121, 2.092]
  - - [768, 128, 1, 128, 800, 800, 768, 160]
    - [135, 3.828]
  - - [768, 128, 1, 256, 800, 800, 768, 288]
    - [143, 6.558]
  - - [768, 128, 1, 512, 800, 800, 768, 544]
    - [142, 10.145]
  - - [768, 128, 1, 1024, 800, 800, 1056, 1056]
    - [110, 13.984]
  - - [768, 128, 1, 2048, 800, 800, 2080, 2080]
    - [141, 17.212]
  - - [768, 128, 1, 4096, 800, 800, 4128, 4128]
    - [111, 19.445]
  - - [768, 256, 1, 64, 800, 800, 768, 256]
    - [161, 4.042]
  - - [768, 256, 1, 128, 800, 800, 768, 256]
    - [126, 7.21]
  - - [768, 256, 1, 256, 800, 800, 768, 288]
    - [138, 12.005]
  - - [768, 256, 1, 512, 800, 800, 768, 544]
    - [104, 17.916]
  - - [768, 256, 1, 1024, 800, 800, 1056, 1056]
    - [133, 23.651]
  - - [768, 256, 1, 2048, 800, 800, 2080, 2080]
    - [105, 28.003]
  - - [768, 256, 1, 4096, 800, 800, 4128, 4128]
    - [158, 29.839]
  - - [768, 512, 1, 64, 800, 800, 768, 512]
    - [108, 7.277]
  - - [768, 512, 1, 128, 800, 800, 768, 512]
    - [137, 12.165]
  - - [768, 512, 1, 256, 800, 800, 768, 512]
    - [149, 18.18]
  - - [768, 512, 1, 512, 800, 800, 768, 544]
    - [117, 24.265]
  - - [768, 512, 1, 1024, 800, 800, 1056, 1056]
    - [120, 29.171]
  - - [768, 512, 1, 2048, 800, 800, 2080, 2080]
    - [155, 30.913]
  - - [768, 512, 1, 4096, 800, 800, 4128, 4128]
    - [123, 33.335]
  - - [768, 1024, 1, 64, 800, 800, 768, 1024]
    - [37, 12.448]
  - - [768, 1024, 1, 128, 800, 800, 768, 1024]
    - [46, 20.959]
  - - [768, 1024, 1, 256, 800, 800, 768, 1024]
    - [14, 31.832]
  - - [768, 1024, 1, 512, 800, 800, 768, 1024]
    - [17, 43.133]
  - - [768, 1024, 1, 1024, 800, 800, 1056, 1056]
    - [44, 52.357]
  - - [768, 1024, 1, 2048, 800, 800, 2080, 2080]
    - [65, 56.18]
  - - [768, 1024, 1, 4096, 800, 800, 4128, 4128]
    - [61, 60.614]
  - - [768, 2048, 1, 64, 800, 800, 768, 2048]
    - [27, 20.115]
  - - [768, 2048, 1, 128, 800, 800, 768, 2048]
    - [17, 31.08]
  - - [768, 2048, 1, 256, 800, 800, 768, 2048]
    - [15, 43.436]
  - - [768, 2048, 1, 512, 800, 800, 768, 2048]
    - [17, 54.5]
  - - [768, 2048, 1, 1024, 800, 800, 1056, 2048]
    - [62, 59.199]
  - - [768, 2048, 1, 2048, 800, 800, 2080, 2080]
    - [13, 64.425]
  - - [768, 2048, 1, 4096, 800, 800, 4128, 4128]
    - [12, 67.709]
  - - [768, 4096, 1, 64, 800, 800, 768, 4096]
    - [18, 30.321]
  - - [768, 4096, 1, 128, 800, 800, 768, 4096]
    - [40, 44.591]
  - - [768, 4096, 1, 256, 800, 800, 768, 4096]
    - [37, 57.015]
  - - [768, 4096, 1, 512, 800, 800, 768, 4096]
    - [37, 63.114]
  - - [768, 4096, 1, 1024, 800, 800, 1056, 4096]
    - [52, 69.471]
  - - [768, 4096, 1, 2048, 800, 800, 2080, 4096]
    - [11, 74.048]
  - - [768, 4096, 1, 4096, 800, 800, 4128, 4128]
    - [61, 76.553]
  - - [1536, 64, 1, 64, 1568, 1568, 1536, 96]
    - [112, 2.095]
  - - [1536, 64, 1, 128, 1568, 1568, 1536, 160]
    - [122, 3.822]
  - - [1536, 64, 1, 256, 1568, 1568, 1536, 288]
    - [113, 6.553]
  - - [1536, 64, 1, 512, 1568, 1568, 1536, 544]
    - [113, 10.149]
  - - [1536, 64, 1, 1024, 1568, 1568, 1536, 1056]
    - [112, 13.976]
  - - [1536, 64, 1, 2048, 1568, 1568, 2080, 2080]
    - [140, 17.181]
  - - [1536, 64, 1, 4096, 1568, 1568, 4128, 4128]
    - [139, 19.423]
  - - [1536, 128, 1, 64, 1568, 1568, 1536, 128]
    - [121, 4.037]
  - - [1536, 128, 1, 128, 1568, 1568, 1536, 160]
    - [136, 7.182]
  - - [1536, 128, 1, 256, 1568, 1568, 1536, 288]
    - [133, 11.945]
  - - [1536, 128, 1, 512, 1568, 1568, 1536, 544]
    - [135, 17.867]
  - - [1536, 128, 1, 1024, 1568, 1568, 1536, 1056]
    - [107, 23.678]
  - - [1536, 128, 1, 2048, 1568, 1568, 2080, 2080]
    - [109, 28.237]
  - - [1536, 128, 1, 4096, 1568, 1568, 4128, 4128]
    - [107, 29.963]
  - - [1536, 256, 1, 64, 1568, 1568, 1536, 256]
    - [130, 7.268]
  - - [1536, 256, 1, 128, 1568, 1568, 1536, 256]
    - [147, 12.118]
  - - [1536, 256, 1, 256, 1568, 1568, 1536, 288]
    - [150, 18.162]
  - - [1536, 256, 1, 512, 1568, 1568, 1536, 544]
    - [148, 24.187]
  - - [1536, 256, 1, 1024, 1568, 1568, 1536, 1056]
    - [114, 28.943]
  - - [1536, 256, 1, 2048, 1568, 1568, 2080, 2080]
    - [129, 30.742]
  - - [1536, 256, 1, 4096, 1568, 1568, 4128, 4128]
    - [156, 33.186]
  - - [1536, 512, 1, 64, 1568, 1568, 1536, 512]
    - [161, 12.263]
  - - [1536, 512, 1, 128, 1568, 1568, 1536, 512]
    - [32, 20.834]
  - - [1536, 512, 1, 256, 1568, 1568, 1536, 512]
    - [15, 31.666]
  - - [1536, 512, 1, 512, 1568, 1568, 1536, 544]
    - [16, 42.924]
  - - [1536, 512, 1, 1024, 1568, 1568, 1536, 1056]
    - [44, 52.24]
  - - [1536, 512, 1, 2048, 1568, 1568, 2080, 2080]
    - [14, 56.125]
  - - [1536, 512, 1, 4096, 1568, 1568, 4128, 4128]
    - [44, 60.598]
  - - [1536, 1024, 1, 64, 1568, 1568, 1536, 1024]
    - [38, 19.816]
  - - [1536, 1024, 1, 128, 1568, 1568, 1536, 1024]
    - [16, 31.125]
  - - [1536, 1024, 1, 256, 1568, 1568, 1536, 1024]
    - [46, 43.326]
  - - [1536, 1024, 1, 512, 1568, 1568, 1536, 1024]
    - [56, 54.283]
  - - [1536, 1024, 1, 1024, 1568, 1568, 1536, 1056]
    - [55, 59.393]
  - - [1536, 1024, 1, 2048, 1568, 1568, 2080, 2080]
    - [65, 64.73]
  - - [1536, 1024, 1, 4096, 1568, 1568, 4128, 4128]
    - [64, 67.645]
  - - [1536, 2048, 1, 64, 1568, 1568, 1536, 2048]
    - [57, 29.735]
  - - [1536, 2048, 1, 128, 1568, 1568, 1536, 2048]
    - [39, 44.488]
  - - [1536, 2048, 1, 256, 1568, 1568, 1536, 2048]
    - [7, 56.817]
  - - [1536, 2048, 1, 512, 1568, 1568, 1536, 2048]
    - [50, 62.926]
  - - [1536, 2048, 1, 1024, 1568, 1568, 1536, 2048]
    - [58, 69.458]
  - - [1536, 2048, 1, 2048, 1568, 1568, 2080, 2080]
    - [41, 74.048]
  - - [1536, 2048, 1, 4096, 1568, 1568, 4128, 4128]
    - [29, 76.549]
  - - [1536, 4096, 1, 64, 1568, 1568, 1536, 4096]
    - [49, 41.186]
  - - [1536, 4096, 1, 128, 1568, 1568, 1536, 4096]
    - [6, 56.452]
  - - [1536, 4096, 1, 256, 1568, 1568, 1536, 4096]
    - [10, 66.066]
  - - [1536, 4096, 1, 512, 1568, 1568, 1536, 4096]
    - [40, 75.015]
  - - [1536, 4096, 1, 1024, 1568, 1568, 1536, 4096]
    - [8, 80.264]
  - - [1536, 4096, 1, 2048, 1568, 1568, 2080, 4096]
    - [9, 83.214]
  - - [1536, 4096, 1, 4096, 1568, 1568, 4128, 4128]
    - [43, 84.071]
  - - [3072, 64, 1, 64, 3104, 3104, 3072, 96]
    - [163, 4.018]
  - - [3072, 64, 1, 128, 3104, 3104, 3072, 160]
    - [162, 7.218]
  - - [3072, 64, 1, 256, 3104, 3104, 3072, 288]
    - [132, 11.847]
  - - [3072, 64, 1, 512, 3104, 3104, 3072, 544]
    - [131, 17.642]
  - - [3072, 64, 1, 1024, 3104, 3104, 3072, 1056]
    - [104, 23.279]
  - - [3072, 64, 1, 2048, 3104, 3104, 3072, 2080]
    - [103, 27.707]
  - - [3072, 64, 1, 4096, 3104, 3104, 4128, 4128]
    - [103, 29.878]
  - - [3072, 128, 1, 64, 3104, 3104, 3072, 128]
    - [147, 7.297]
  - - [3072, 128, 1, 128, 3104, 3104, 3072, 160]
    - [166, 12.147]
  - - [3072, 128, 1, 256, 3104, 3104, 3072, 288]
    - [117, 18.132]
  - - [3072, 128, 1, 512, 3104, 3104, 3072, 544]
    - [117, 24.105]
  - - [3072, 128, 1, 1024, 3104, 3104, 3072, 1056]
    - [120, 28.821]
  - - [3072, 128, 1, 2048, 3104, 3104, 3072, 2080]
    - [146, 30.603]
  - - [3072, 128, 1, 4096, 3104, 3104, 4128, 4128]
    - [127, 33.104]
  - - [3072, 256, 1, 64, 3104, 3104, 3072, 256]
    - [44, 12.371]
  - - [3072, 256, 1, 128, 3104, 3104, 3072, 256]
    - [44, 20.855]
  - - [3072, 256, 1, 256, 3104, 3104, 3072, 288]
    - [45, 31.669]
  - - [3072, 256, 1, 512, 3104, 3104, 3072, 544]
    - [17, 42.912]
  - - [3072, 256, 1, 1024, 3104, 3104, 3072, 1056]
    - [45, 52.276]
  - - [3072, 256, 1, 2048, 3104, 3104, 3072, 2080]
    - [44, 56.141]
  - - [3072, 256, 1, 4096, 3104, 3104, 4128, 4128]
    - [15, 60.626]
  - - [3072, 512, 1, 64, 3104, 3104, 3072, 512]
    - [26, 19.802]
  - - [3072, 512, 1, 128, 3104, 3104, 3072, 512]
    - [44, 30.898]
  - - [3072, 512, 1, 256, 3104, 3104, 3072, 512]
    - [22, 43.215]
  - - [3072, 512, 1, 512, 3104, 3104, 3072, 544]
    - [20, 54.224]
  - - [3072, 512, 1, 1024, 3104, 3104, 3072, 1056]
    - [24, 59.117]
  - - [3072, 512, 1, 2048, 3104, 3104, 3072, 2080]
    - [55, 64.439]
  - - [3072, 512, 1, 4096, 3104, 3104, 4128, 4128]
    - [64, 67.785]
  - - [3072, 1024, 1, 64, 3104, 3104, 3072, 1024]
    - [36, 29.77]
  - - [3072, 1024, 1, 128, 3104, 3104, 3072, 1024]
    - [38, 44.485]
  - - [3072, 1024, 1, 256, 3104, 3104, 3072, 1024]
    - [39, 56.926]
  - - [3072, 1024, 1, 512, 3104, 3104, 3072, 1024]
    - [59, 63.162]
  - - [3072, 1024, 1, 1024, 3104, 3104, 3072, 1056]
    - [60, 69.738]
  - - [3072, 1024, 1, 2048, 3104, 3104, 3072, 2080]
    - [53, 73.999]
  - - [3072, 1024, 1, 4096, 3104, 3104, 4128, 4128]
    - [19, 76.464]
  - - [3072, 2048, 1, 64, 3104, 3104, 3072, 2048]
    - [48, 41.181]
  - - [3072, 2048, 1, 128, 3104, 3104, 3072, 2048]
    - [8, 56.414]
  - - [3072, 2048, 1, 256, 3104, 3104, 3072, 2048]
    - [9, 67.797]
  - - [3072, 2048, 1, 512, 3104, 3104, 3072, 2048]
    - [40, 74.978]
  - - [3072, 2048, 1, 1024, 3104, 3104, 3072, 2048]
    - [51, 80.124]
  - - [3072, 2048, 1, 2048, 3104, 3104, 3072, 2080]
    - [9, 83.115]
  - - [3072, 2048, 1, 4096, 3104, 3104, 4128, 4128]
    - [31, 84.014]
  - - [3072, 4096, 1, 64, 3104, 3104, 3072, 4096]
    - [48, 49.771]
  - - [3072, 4096, 1, 128, 3104, 3104, 3072, 4096]
    - [40, 62.277]
  - - [3072, 4096, 1, 256, 3104, 3104, 3072, 4096]
    - [39, 73.244]
  - - [3072, 4096, 1, 512, 3104, 3104, 3072, 4096]
    - [8, 80.463]
  - - [3072, 4096, 1, 1024, 3104, 3104, 3072, 4096]
    - [52, 84.069]
  - - [3072, 4096, 1, 2048, 3104, 3104, 3072, 4096]
    - [8, 85.297]
  - - [3072, 4096, 1, 4096, 3104, 3104, 4128, 4128]
    - [63, 87.018]
- null
- null
- DeviceEfficiency
