library/src/blas3/Tensile/Logic/asm_full/navi32/navi32_Cijk_Ailk_Bjlk_I8II_BH.yaml
- {MinimumRequiredVersion: 4.35.0}
- navi32
- gfx1101
- [Device 73f0]
    SolutionIndex: 0
    SolutionNameMin: Cijk_Ailk_Bjlk_I8II_BH_MT32x32x16_MI16x16x16x1_SN_1LDSB1_AMAS0_GRVW4_IU1_LPA0_LPB8_SIA2_SU0_SUS0_SVW1_TT1_16_VW1_WGM4
    SolutionIndex: 1
    SolutionNameMin: Cijk_Ailk_Bjlk_I8II_BH_MT64x64x16_MI16x16x16x1_SN_1LDSB1_AMAS3_GRVW4_IU1_LPA0_LPB0_SIA2_SU0_SUS0_SVW2_TT2_32_VW2_WGM4
    SolutionIndex: 2
    SolutionNameMin: Cijk_Ailk_Bjlk_I8II_BH_MT64x64x16_MI16x16x16x1_SN_1LDSB1_AMAS3_GRVW8_IU1_LPA0_LPB0_SIA2_SU0_SUS0_SVW2_TT2_32_VW2_WGM8
    SolutionIndex: 3
    SolutionNameMin: Cijk_Ailk_Bjlk_I8II_BH_MT64x64x16_MI16x16x16x1_SN_1LDSB1_AMAS3_GRVW8_IU1_LPA0_LPB0_SIA2_SU32_SUS128_SVW2_TT2_32_VW2_WGM8
    SolutionIndex: 4
    SolutionNameMin: Cijk_Ailk_Bjlk_I8II_BH_MT128x128x16_MI16x16x16x1_SN_1LDSB0_AMAS3_GRVW4_IU1_LPA8_LPB0_SIA1_SU0_SUS0_SVW2_TT4_64_VW2_WGM4
    SolutionIndex: 5
    SolutionNameMin: Cijk_Ailk_Bjlk_I8II_BH_MT128x128x16_MI16x16x16x1_SN_1LDSB0_AMAS0_GRVW8_IU1_LPA0_LPB0_SIA1_SU0_SUS0_SVW1_TT4_64_VW1_WGM4
    SolutionIndex: 6
    SolutionNameMin: Cijk_Ailk_Bjlk_I8II_BH_MT128x128x16_MI16x16x16x1_SN_1LDSB0_AMAS0_GRVW8_IU1_LPA8_LPB0_SIA1_SU0_SUS0_SVW1_TT4_64_VW1_WGM4
    SolutionIndex: 7
    SolutionNameMin: Cijk_Ailk_Bjlk_I8II_BH_MT128x128x16_MI16x16x16x1_SN_1LDSB0_AMAS0_GRVW8_IU1_LPA8_LPB8_SIA1_SU0_SUS0_SVW1_TT4_64_VW1_WGM4
    SolutionIndex: 8
    SolutionNameMin: Cijk_Ailk_Bjlk_I8II_BH_MT128x128x16_MI16x16x16x1_SN_1LDSB0_AMAS3_GRVW8_IU1_LPA0_LPB0_SIA1_SU0_SUS0_SVW2_TT4_64_VW2_WGM4
    SolutionIndex: 9
    SolutionNameMin: Cijk_Ailk_Bjlk_I8II_BH_MT128x128x16_MI16x16x16x1_SN_1LDSB0_AMAS3_GRVW8_IU1_LPA8_LPB0_SIA1_SU0_SUS0_SVW2_TT4_64_VW2_WGM4
    SolutionIndex: 10
    SolutionNameMin: Cijk_Ailk_Bjlk_I8II_BH_MT128x128x16_MI16x16x16x1_SN_1LDSB0_AMAS3_GRVW8_IU1_LPA0_LPB8_SIA1_SU0_SUS0_SVW2_TT4_64_VW2_WGM4
    SolutionIndex: 11
    SolutionNameMin: Cijk_Ailk_Bjlk_I8II_BH_MT128x128x16_MI16x16x16x1_SN_1LDSB0_AMAS3_GRVW8_IU1_LPA8_LPB8_SIA1_SU0_SUS0_SVW2_TT4_64_VW2_WGM4
    SolutionIndex: 12
    SolutionNameMin: Cijk_Ailk_Bjlk_I8II_BH_MT128x128x16_MI16x16x16x1_SN_1LDSB1_AMAS0_GRVW8_IU1_LPA0_LPB0_SIA2_SU0_SUS0_SVW1_TT4_64_VW1_WGM4
    SolutionIndex: 13
    SolutionNameMin: Cijk_Ailk_Bjlk_I8II_BH_MT128x128x16_MI16x16x16x1_SN_1LDSB1_AMAS0_GRVW8_IU1_LPA8_LPB0_SIA2_SU0_SUS0_SVW1_TT4_64_VW1_WGM4
    SolutionIndex: 14
    SolutionNameMin: Cijk_Ailk_Bjlk_I8II_BH_MT128x128x16_MI16x16x16x1_SN_1LDSB1_AMAS0_GRVW8_IU1_LPA8_LPB8_SIA2_SU0_SUS0_SVW1_TT4_64_VW1_WGM4
    SolutionIndex: 15
    SolutionNameMin: Cijk_Ailk_Bjlk_I8II_BH_MT128x128x16_MI16x16x16x1_SN_1LDSB1_AMAS3_GRVW8_IU1_LPA0_LPB0_SIA2_SU0_SUS0_SVW2_TT4_64_VW2_WGM4
    SolutionIndex: 16
    SolutionNameMin: Cijk_Ailk_Bjlk_I8II_BH_MT128x128x16_MI16x16x16x1_SN_1LDSB1_AMAS3_GRVW8_IU1_LPA0_LPB8_SIA2_SU0_SUS0_SVW2_TT4_64_VW2_WGM4
    SolutionIndex: 17
    SolutionNameMin: Cijk_Ailk_Bjlk_I8II_BH_MT128x128x16_MI16x16x16x1_SN_1LDSB1_AMAS3_GRVW8_IU1_LPA8_LPB8_SIA2_SU0_SUS0_SVW2_TT4_64_VW2_WGM4
    SolutionIndex: 18
    SolutionNameMin: Cijk_Ailk_Bjlk_I8II_BH_MT128x128x16_MI16x16x16x1_SN_1LDSB1_AMAS0_GRVW8_IU1_LPA8_LPB0_SIA2_SU32_SUS128_SVW1_TT4_64_VW1_WGM4
    SolutionIndex: 19
    SolutionNameMin: Cijk_Ailk_Bjlk_I8II_BH_MT128x128x16_MI16x16x16x1_SN_1LDSB1_AMAS0_GRVW8_IU1_LPA8_LPB8_SIA2_SU32_SUS128_SVW1_TT4_64_VW1_WGM4
    SolutionIndex: 20
    SolutionNameMin: Cijk_Ailk_Bjlk_I8II_BH_MT128x128x16_MI16x16x16x1_SN_1LDSB1_AMAS3_GRVW8_IU1_LPA8_LPB0_SIA2_SU32_SUS128_SVW2_TT4_64_VW2_WGM4
    SolutionIndex: 21
    SolutionNameMin: Cijk_Ailk_Bjlk_I8II_BH_MT128x128x16_MI16x16x16x1_SN_1LDSB0_AMAS0_GRVW8_IU1_LPA8_LPB8_SIA1_SU32_SUS256_SVW1_TT4_64_VW1_WGM4
    SolutionIndex: 22
    SolutionNameMin: Cijk_Ailk_Bjlk_I8II_BH_MT128x128x16_MI16x16x16x1_SN_1LDSB1_AMAS0_GRVW4_IU1_LPA0_LPB8_SIA2_SU32_SUS256_SVW1_TT4_64_VW1_WGM4
    SolutionIndex: 23
    SolutionNameMin: Cijk_Ailk_Bjlk_I8II_BH_MT128x128x16_MI16x16x16x1_SN_1LDSB1_AMAS0_GRVW8_IU1_LPA8_LPB0_SIA2_SU32_SUS256_SVW1_TT4_64_VW1_WGM4
    SolutionIndex: 24
    SolutionNameMin: Cijk_Ailk_Bjlk_I8II_BH_MT128x128x16_MI16x16x16x1_SN_1LDSB1_AMAS0_GRVW8_IU1_LPA8_LPB8_SIA2_SU32_SUS256_SVW1_TT4_64_VW1_WGM4
    SolutionIndex: 25
    SolutionNameMin: Cijk_Ailk_Bjlk_I8II_BH_MT128x128x16_MI16x16x16x1_SN_1LDSB1_AMAS3_GRVW8_IU1_LPA0_LPB0_SIA2_SU32_SUS256_SVW2_TT4_64_VW2_WGM4
    SolutionIndex: 26
    SolutionNameMin: Cijk_Ailk_Bjlk_I8II_BH_MT128x128x16_MI16x16x16x1_SN_1LDSB1_AMAS3_GRVW8_IU1_LPA0_LPB8_SIA2_SU32_SUS256_SVW2_TT4_64_VW2_WGM4
    SolutionIndex: 27
    SolutionNameMin: Cijk_Ailk_Bjlk_I8II_BH_MT128x128x16_MI16x16x16x1_SN_1LDSB1_AMAS3_GRVW8_IU1_LPA8_LPB8_SIA2_SU32_SUS256_SVW2_TT4_64_VW2_WGM4
    SolutionIndex: 28
    SolutionNameMin: Cijk_Ailk_Bjlk_I8II_BH_MT128x128x16_MI16x16x16x1_SN_1LDSB0_AMAS0_GRVW4_IU1_LPA8_LPB8_SIA1_SU0_SUS0_SVW1_TT4_64_VW1_WGM8
    SolutionIndex: 29
    SolutionNameMin: Cijk_Ailk_Bjlk_I8II_BH_MT128x128x16_MI16x16x16x1_SN_1LDSB0_AMAS3_GRVW4_IU1_LPA8_LPB0_SIA1_SU0_SUS0_SVW2_TT4_64_VW2_WGM8
    SolutionIndex: 30
    SolutionNameMin: Cijk_Ailk_Bjlk_I8II_BH_MT128x128x16_MI16x16x16x1_SN_1LDSB0_AMAS3_GRVW4_IU1_LPA8_LPB8_SIA1_SU0_SUS0_SVW2_TT4_64_VW2_WGM8
    SolutionIndex: 31
    SolutionNameMin: Cijk_Ailk_Bjlk_I8II_BH_MT128x128x16_MI16x16x16x1_SN_1LDSB0_AMAS0_GRVW8_IU1_LPA0_LPB8_SIA1_SU0_SUS0_SVW1_TT4_64_VW1_WGM8
    SolutionIndex: 32
    SolutionNameMin: Cijk_Ailk_Bjlk_I8II_BH_MT128x128x16_MI16x16x16x1_SN_1LDSB0_AMAS3_GRVW8_IU1_LPA0_LPB0_SIA1_SU0_SUS0_SVW2_TT4_64_VW2_WGM8
    SolutionIndex: 33
    SolutionNameMin: Cijk_Ailk_Bjlk_I8II_BH_MT128x128x16_MI16x16x16x1_SN_1LDSB0_AMAS3_GRVW8_IU1_LPA8_LPB0_SIA1_SU0_SUS0_SVW2_TT4_64_VW2_WGM8
    SolutionIndex: 34
    SolutionNameMin: Cijk_Ailk_Bjlk_I8II_BH_MT128x128x16_MI16x16x16x1_SN_1LDSB0_AMAS3_GRVW8_IU1_LPA0_LPB8_SIA1_SU0_SUS0_SVW2_TT4_64_VW2_WGM8
    SolutionIndex: 35
    SolutionNameMin: Cijk_Ailk_Bjlk_I8II_BH_MT128x128x16_MI16x16x16x1_SN_1LDSB0_AMAS3_GRVW8_IU1_LPA8_LPB8_SIA1_SU0_SUS0_SVW2_TT4_64_VW2_WGM8
    SolutionIndex: 36
    SolutionNameMin: Cijk_Ailk_Bjlk_I8II_BH_MT128x128x16_MI16x16x16x1_SN_1LDSB1_AMAS0_GRVW4_IU1_LPA0_LPB0_SIA2_SU0_SUS0_SVW1_TT4_64_VW1_WGM8
    SolutionIndex: 37
    SolutionNameMin: Cijk_Ailk_Bjlk_I8II_BH_MT128x128x16_MI16x16x16x1_SN_1LDSB1_AMAS3_GRVW4_IU1_LPA0_LPB8_SIA2_SU0_SUS0_SVW2_TT4_64_VW2_WGM8
    SolutionIndex: 38
    SolutionNameMin: Cijk_Ailk_Bjlk_I8II_BH_MT128x128x16_MI16x16x16x1_SN_1LDSB1_AMAS0_GRVW8_IU1_LPA0_LPB0_SIA2_SU0_SUS0_SVW1_TT4_64_VW1_WGM8
    SolutionIndex: 39
    SolutionNameMin: Cijk_Ailk_Bjlk_I8II_BH_MT128x128x16_MI16x16x16x1_SN_1LDSB1_AMAS0_GRVW8_IU1_LPA0_LPB8_SIA2_SU0_SUS0_SVW1_TT4_64_VW1_WGM8
    SolutionIndex: 40
    SolutionNameMin: Cijk_Ailk_Bjlk_I8II_BH_MT128x128x16_MI16x16x16x1_SN_1LDSB1_AMAS0_GRVW8_IU1_LPA8_LPB8_SIA2_SU0_SUS0_SVW1_TT4_64_VW1_WGM8
    SolutionIndex: 41
    SolutionNameMin: Cijk_Ailk_Bjlk_I8II_BH_MT128x128x16_MI16x16x16x1_SN_1LDSB1_AMAS3_GRVW8_IU1_LPA0_LPB0_SIA2_SU0_SUS0_SVW2_TT4_64_VW2_WGM8
    SolutionIndex: 42
    SolutionNameMin: Cijk_Ailk_Bjlk_I8II_BH_MT128x128x16_MI16x16x16x1_SN_1LDSB1_AMAS3_GRVW8_IU1_LPA8_LPB0_SIA2_SU0_SUS0_SVW2_TT4_64_VW2_WGM8
    SolutionIndex: 43
    SolutionNameMin: Cijk_Ailk_Bjlk_I8II_BH_MT128x128x16_MI16x16x16x1_SN_1LDSB1_AMAS3_GRVW8_IU1_LPA0_LPB8_SIA2_SU0_SUS0_SVW2_TT4_64_VW2_WGM8
    SolutionIndex: 44
    SolutionNameMin: Cijk_Ailk_Bjlk_I8II_BH_MT128x128x16_MI16x16x16x1_SN_1LDSB1_AMAS3_GRVW8_IU1_LPA8_LPB8_SIA2_SU0_SUS0_SVW2_TT4_64_VW2_WGM8
    SolutionIndex: 45
    SolutionNameMin: Cijk_Ailk_Bjlk_I8II_BH_MT128x128x16_MI16x16x16x1_SN_1LDSB0_AMAS0_GRVW8_IU1_LPA0_LPB0_SIA1_SU32_SUS128_SVW1_TT4_64_VW1_WGM8
    SolutionIndex: 46
    SolutionNameMin: Cijk_Ailk_Bjlk_I8II_BH_MT128x128x16_MI16x16x16x1_SN_1LDSB0_AMAS0_GRVW8_IU1_LPA8_LPB0_SIA1_SU32_SUS128_SVW1_TT4_64_VW1_WGM8
    SolutionIndex: 47
    SolutionNameMin: Cijk_Ailk_Bjlk_I8II_BH_MT128x128x16_MI16x16x16x1_SN_1LDSB0_AMAS0_GRVW8_IU1_LPA8_LPB8_SIA1_SU32_SUS128_SVW1_TT4_64_VW1_WGM8
    SolutionIndex: 48
    SolutionNameMin: Cijk_Ailk_Bjlk_I8II_BH_MT128x128x16_MI16x16x16x1_SN_1LDSB0_AMAS3_GRVW8_IU1_LPA0_LPB0_SIA1_SU32_SUS128_SVW2_TT4_64_VW2_WGM8
    SolutionIndex: 49
    SolutionNameMin: Cijk_Ailk_Bjlk_I8II_BH_MT128x128x16_MI16x16x16x1_SN_1LDSB0_AMAS3_GRVW8_IU1_LPA8_LPB8_SIA1_SU32_SUS128_SVW2_TT4_64_VW2_WGM8
    SolutionIndex: 50
    SolutionNameMin: Cijk_Ailk_Bjlk_I8II_BH_MT128x128x16_MI16x16x16x1_SN_1LDSB1_AMAS0_GRVW8_IU1_LPA0_LPB0_SIA2_SU32_SUS128_SVW1_TT4_64_VW1_WGM8
    SolutionIndex: 51
    SolutionNameMin: Cijk_Ailk_Bjlk_I8II_BH_MT128x128x16_MI16x16x16x1_SN_1LDSB1_AMAS0_GRVW8_IU1_LPA8_LPB0_SIA2_SU32_SUS128_SVW1_TT4_64_VW1_WGM8
    SolutionIndex: 52
    SolutionNameMin: Cijk_Ailk_Bjlk_I8II_BH_MT128x128x16_MI16x16x16x1_SN_1LDSB1_AMAS0_GRVW8_IU1_LPA0_LPB8_SIA2_SU32_SUS128_SVW1_TT4_64_VW1_WGM8
    SolutionIndex: 53
    SolutionNameMin: Cijk_Ailk_Bjlk_I8II_BH_MT128x128x16_MI16x16x16x1_SN_1LDSB1_AMAS3_GRVW8_IU1_LPA0_LPB8_SIA2_SU32_SUS128_SVW2_TT4_64_VW2_WGM8
    SolutionIndex: 54
    SolutionNameMin: Cijk_Ailk_Bjlk_I8II_BH_MT128x128x16_MI16x16x16x1_SN_1LDSB1_AMAS3_GRVW8_IU1_LPA8_LPB8_SIA2_SU32_SUS128_SVW2_TT4_64_VW2_WGM8
    SolutionIndex: 55
    SolutionNameMin: Cijk_Ailk_Bjlk_I8II_BH_MT128x128x16_MI16x16x16x1_SN_1LDSB0_AMAS0_GRVW8_IU1_LPA0_LPB8_SIA1_SU32_SUS256_SVW1_TT4_64_VW1_WGM8
    SolutionIndex: 56
    SolutionNameMin: Cijk_Ailk_Bjlk_I8II_BH_MT128x128x16_MI16x16x16x1_SN_1LDSB1_AMAS3_GRVW4_IU1_LPA8_LPB0_SIA2_SU32_SUS256_SVW2_TT4_64_VW2_WGM8
    SolutionIndex: 57
    SolutionNameMin: Cijk_Ailk_Bjlk_I8II_BH_MT128x128x16_MI16x16x16x1_SN_1LDSB1_AMAS3_GRVW4_IU1_LPA0_LPB8_SIA2_SU32_SUS256_SVW2_TT4_64_VW2_WGM8
    SolutionIndex: 58
    SolutionNameMin: Cijk_Ailk_Bjlk_I8II_BH_MT128x128x16_MI16x16x16x1_SN_1LDSB1_AMAS0_GRVW8_IU1_LPA0_LPB0_SIA2_SU32_SUS256_SVW1_TT4_64_VW1_WGM8
    SolutionIndex: 59
    SolutionNameMin: Cijk_Ailk_Bjlk_I8II_BH_MT128x128x16_MI16x16x16x1_SN_1LDSB1_AMAS0_GRVW8_IU1_LPA8_LPB0_SIA2_SU32_SUS256_SVW1_TT4_64_VW1_WGM8
    SolutionIndex: 60
    SolutionNameMin: Cijk_Ailk_Bjlk_I8II_BH_MT128x128x16_MI16x16x16x1_SN_1LDSB1_AMAS0_GRVW8_IU1_LPA0_LPB8_SIA2_SU32_SUS256_SVW1_TT4_64_VW1_WGM8
    SolutionIndex: 61
    SolutionNameMin: Cijk_Ailk_Bjlk_I8II_BH_MT128x128x16_MI16x16x16x1_SN_1LDSB1_AMAS0_GRVW8_IU1_LPA8_LPB8_SIA2_SU32_SUS256_SVW1_TT4_64_VW1_WGM8
    SolutionIndex: 62
    SolutionNameMin: Cijk_Ailk_Bjlk_I8II_BH_MT128x128x16_MI16x16x16x1_SN_1LDSB1_AMAS3_GRVW8_IU1_LPA0_LPB0_SIA2_SU32_SUS256_SVW2_TT4_64_VW2_WGM8
    SolutionIndex: 63
    SolutionNameMin: Cijk_Ailk_Bjlk_I8II_BH_MT128x128x16_MI16x16x16x1_SN_1LDSB1_AMAS3_GRVW8_IU1_LPA8_LPB0_SIA2_SU32_SUS256_SVW2_TT4_64_VW2_WGM8
    SolutionIndex: 64
    SolutionNameMin: Cijk_Ailk_Bjlk_I8II_BH_MT32x32x32_MI16x16x16x1_SN_1LDSB0_AMAS0_GRVW4_IU1_LPA0_LPB0_SIA1_SU0_SUS0_SVW1_TT1_16_VW1_WGM4
    SolutionIndex: 65
    SolutionNameMin: Cijk_Ailk_Bjlk_I8II_BH_MT32x32x32_MI16x16x16x1_SN_1LDSB0_AMAS0_GRVW4_IU1_LPA0_LPB8_SIA1_SU0_SUS0_SVW1_TT1_16_VW1_WGM4
    SolutionIndex: 66
    SolutionNameMin: Cijk_Ailk_Bjlk_I8II_BH_MT32x32x32_MI16x16x16x1_SN_1LDSB0_AMAS0_GRVW8_IU1_LPA0_LPB0_SIA1_SU0_SUS0_SVW1_TT1_16_VW1_WGM4
    SolutionIndex: 67
    SolutionNameMin: Cijk_Ailk_Bjlk_I8II_BH_MT32x32x32_MI16x16x16x1_SN_1LDSB0_AMAS0_GRVW8_IU1_LPA8_LPB0_SIA1_SU0_SUS0_SVW1_TT1_16_VW1_WGM4
    SolutionIndex: 68
    SolutionNameMin: Cijk_Ailk_Bjlk_I8II_BH_MT32x32x32_MI16x16x16x1_SN_1LDSB0_AMAS0_GRVW8_IU1_LPA8_LPB8_SIA1_SU0_SUS0_SVW1_TT1_16_VW1_WGM4
    SolutionIndex: 69
    SolutionNameMin: Cijk_Ailk_Bjlk_I8II_BH_MT32x32x32_MI16x16x16x1_SN_1LDSB1_AMAS0_GRVW4_IU2_LPA0_LPB0_SIA2_SU0_SUS0_SVW1_TT1_16_VW1_WGM4
    SolutionIndex: 70
    SolutionNameMin: Cijk_Ailk_Bjlk_I8II_BH_MT32x32x32_MI16x16x16x1_SN_1LDSB1_AMAS0_GRVW4_IU2_LPA8_LPB0_SIA2_SU0_SUS0_SVW1_TT1_16_VW1_WGM4
    SolutionIndex: 71
    SolutionNameMin: Cijk_Ailk_Bjlk_I8II_BH_MT32x32x32_MI16x16x16x1_SN_1LDSB1_AMAS0_GRVW4_IU2_LPA0_LPB8_SIA2_SU0_SUS0_SVW1_TT1_16_VW1_WGM4
    SolutionIndex: 72
    SolutionNameMin: Cijk_Ailk_Bjlk_I8II_BH_MT32x32x32_MI16x16x16x1_SN_1LDSB1_AMAS0_GRVW8_IU2_LPA0_LPB0_SIA2_SU0_SUS0_SVW1_TT1_16_VW1_WGM4
    SolutionIndex: 73
    SolutionNameMin: Cijk_Ailk_Bjlk_I8II_BH_MT32x32x32_MI16x16x16x1_SN_1LDSB1_AMAS0_GRVW8_IU2_LPA8_LPB0_SIA2_SU0_SUS0_SVW1_TT1_16_VW1_WGM4
    SolutionIndex: 74
    SolutionNameMin: Cijk_Ailk_Bjlk_I8II_BH_MT32x32x32_MI16x16x16x1_SN_1LDSB1_AMAS0_GRVW8_IU2_LPA0_LPB8_SIA2_SU0_SUS0_SVW1_TT1_16_VW1_WGM4
    SolutionIndex: 75
    SolutionNameMin: Cijk_Ailk_Bjlk_I8II_BH_MT32x32x32_MI16x16x16x1_SN_1LDSB0_AMAS0_GRVW8_IU1_LPA8_LPB0_SIA3_SU0_SUS0_SVW1_TT1_16_VW1_WGM4
    SolutionIndex: 76
    SolutionNameMin: Cijk_Ailk_Bjlk_I8II_BH_MT32x32x32_MI16x16x16x1_SN_1LDSB0_AMAS0_GRVW4_IU1_LPA0_LPB8_SIA1_SU32_SUS128_SVW1_TT1_16_VW1_WGM4
    SolutionIndex: 77
    SolutionNameMin: Cijk_Ailk_Bjlk_I8II_BH_MT32x32x32_MI16x16x16x1_SN_1LDSB1_AMAS0_GRVW8_IU2_LPA0_LPB8_SIA2_SU32_SUS128_SVW1_TT1_16_VW1_WGM4
    SolutionIndex: 78
    SolutionNameMin: Cijk_Ailk_Bjlk_I8II_BH_MT32x32x32_MI16x16x16x1_SN_1LDSB0_AMAS0_GRVW4_IU1_LPA0_LPB0_SIA1_SU32_SUS256_SVW1_TT1_16_VW1_WGM4
    SolutionIndex: 79
    SolutionNameMin: Cijk_Ailk_Bjlk_I8II_BH_MT32x32x32_MI16x16x16x1_SN_1LDSB0_AMAS0_GRVW4_IU1_LPA0_LPB8_SIA1_SU32_SUS256_SVW1_TT1_16_VW1_WGM4
    SolutionIndex: 80
    SolutionNameMin: Cijk_Ailk_Bjlk_I8II_BH_MT32x32x32_MI16x16x16x1_SN_1LDSB0_AMAS0_GRVW8_IU1_LPA0_LPB0_SIA1_SU32_SUS256_SVW1_TT1_16_VW1_WGM4
    SolutionIndex: 81
    SolutionNameMin: Cijk_Ailk_Bjlk_I8II_BH_MT32x32x32_MI16x16x16x1_SN_1LDSB1_AMAS0_GRVW4_IU2_LPA0_LPB0_SIA2_SU32_SUS256_SVW1_TT1_16_VW1_WGM4
    SolutionIndex: 82
    SolutionNameMin: Cijk_Ailk_Bjlk_I8II_BH_MT32x32x32_MI16x16x16x1_SN_1LDSB1_AMAS0_GRVW4_IU2_LPA0_LPB8_SIA2_SU32_SUS256_SVW1_TT1_16_VW1_WGM4
    SolutionIndex: 83
    SolutionNameMin: Cijk_Ailk_Bjlk_I8II_BH_MT32x32x32_MI16x16x16x1_SN_1LDSB1_AMAS0_GRVW4_IU2_LPA8_LPB8_SIA2_SU32_SUS256_SVW1_TT1_16_VW1_WGM4
    SolutionIndex: 84
    SolutionNameMin: Cijk_Ailk_Bjlk_I8II_BH_MT32x32x32_MI16x16x16x1_SN_1LDSB1_AMAS0_GRVW8_IU2_LPA0_LPB0_SIA2_SU32_SUS256_SVW1_TT1_16_VW1_WGM4
    SolutionIndex: 85
    SolutionNameMin: Cijk_Ailk_Bjlk_I8II_BH_MT32x32x32_MI16x16x16x1_SN_1LDSB0_AMAS0_GRVW4_IU1_LPA0_LPB0_SIA1_SU0_SUS0_SVW1_TT1_16_VW1_WGM8
    SolutionIndex: 86
    SolutionNameMin: Cijk_Ailk_Bjlk_I8II_BH_MT32x32x32_MI16x16x16x1_SN_1LDSB0_AMAS0_GRVW4_IU1_LPA0_LPB8_SIA1_SU0_SUS0_SVW1_TT1_16_VW1_WGM8
    SolutionIndex: 87
    SolutionNameMin: Cijk_Ailk_Bjlk_I8II_BH_MT32x32x32_MI16x16x16x1_SN_1LDSB0_AMAS0_GRVW4_IU1_LPA8_LPB8_SIA1_SU0_SUS0_SVW1_TT1_16_VW1_WGM8
    SolutionIndex: 88
    SolutionNameMin: Cijk_Ailk_Bjlk_I8II_BH_MT32x32x32_MI16x16x16x1_SN_1LDSB0_AMAS0_GRVW8_IU1_LPA0_LPB0_SIA1_SU0_SUS0_SVW1_TT1_16_VW1_WGM8
    SolutionIndex: 89
    SolutionNameMin: Cijk_Ailk_Bjlk_I8II_BH_MT32x32x32_MI16x16x16x1_SN_1LDSB0_AMAS0_GRVW8_IU1_LPA8_LPB0_SIA1_SU0_SUS0_SVW1_TT1_16_VW1_WGM8
    SolutionIndex: 90
    SolutionNameMin: Cijk_Ailk_Bjlk_I8II_BH_MT32x32x32_MI16x16x16x1_SN_1LDSB0_AMAS0_GRVW8_IU1_LPA0_LPB8_SIA1_SU0_SUS0_SVW1_TT1_16_VW1_WGM8
    SolutionIndex: 91
    SolutionNameMin: Cijk_Ailk_Bjlk_I8II_BH_MT32x32x32_MI16x16x16x1_SN_1LDSB1_AMAS0_GRVW4_IU2_LPA0_LPB0_SIA2_SU0_SUS0_SVW1_TT1_16_VW1_WGM8
    SolutionIndex: 92
    SolutionNameMin: Cijk_Ailk_Bjlk_I8II_BH_MT32x32x32_MI16x16x16x1_SN_1LDSB1_AMAS0_GRVW4_IU2_LPA8_LPB0_SIA2_SU0_SUS0_SVW1_TT1_16_VW1_WGM8
    SolutionIndex: 93
    SolutionNameMin: Cijk_Ailk_Bjlk_I8II_BH_MT32x32x32_MI16x16x16x1_SN_1LDSB1_AMAS0_GRVW4_IU2_LPA8_LPB8_SIA2_SU0_SUS0_SVW1_TT1_16_VW1_WGM8
    SolutionIndex: 94
    SolutionNameMin: Cijk_Ailk_Bjlk_I8II_BH_MT32x32x32_MI16x16x16x1_SN_1LDSB1_AMAS0_GRVW8_IU2_LPA0_LPB0_SIA2_SU0_SUS0_SVW1_TT1_16_VW1_WGM8
    SolutionIndex: 95
    SolutionNameMin: Cijk_Ailk_Bjlk_I8II_BH_MT32x32x32_MI16x16x16x1_SN_1LDSB1_AMAS0_GRVW8_IU2_LPA8_LPB0_SIA2_SU0_SUS0_SVW1_TT1_16_VW1_WGM8
    SolutionIndex: 96
    SolutionNameMin: Cijk_Ailk_Bjlk_I8II_BH_MT32x32x32_MI16x16x16x1_SN_1LDSB1_AMAS0_GRVW8_IU2_LPA0_LPB8_SIA2_SU0_SUS0_SVW1_TT1_16_VW1_WGM8
    SolutionIndex: 97
    SolutionNameMin: Cijk_Ailk_Bjlk_I8II_BH_MT32x32x32_MI16x16x16x1_SN_1LDSB1_AMAS0_GRVW8_IU2_LPA8_LPB8_SIA2_SU0_SUS0_SVW1_TT1_16_VW1_WGM8
    SolutionIndex: 98
    SolutionNameMin: Cijk_Ailk_Bjlk_I8II_BH_MT32x32x32_MI16x16x16x1_SN_1LDSB0_AMAS0_GRVW4_IU1_LPA0_LPB0_SIA1_SU32_SUS128_SVW1_TT1_16_VW1_WGM8
    SolutionIndex: 99
    SolutionNameMin: Cijk_Ailk_Bjlk_I8II_BH_MT32x32x32_MI16x16x16x1_SN_1LDSB0_AMAS0_GRVW4_IU1_LPA0_LPB8_SIA1_SU32_SUS128_SVW1_TT1_16_VW1_WGM8
    SolutionIndex: 100
    SolutionNameMin: Cijk_Ailk_Bjlk_I8II_BH_MT32x32x32_MI16x16x16x1_SN_1LDSB1_AMAS0_GRVW8_IU2_LPA0_LPB8_SIA2_SU32_SUS128_SVW1_TT1_16_VW1_WGM8
    SolutionIndex: 101
    SolutionNameMin: Cijk_Ailk_Bjlk_I8II_BH_MT32x32x32_MI16x16x16x1_SN_1LDSB0_AMAS0_GRVW4_IU1_LPA8_LPB0_SIA1_SU32_SUS256_SVW1_TT1_16_VW1_WGM8
    SolutionIndex: 102
    SolutionNameMin: Cijk_Ailk_Bjlk_I8II_BH_MT64x64x32_MI16x16x16x1_SN_1LDSB0_AMAS0_GRVW4_IU1_LPA0_LPB0_SIA1_SU0_SUS0_SVW1_TT2_32_VW1_WGM4
    SolutionIndex: 103
    SolutionNameMin: Cijk_Ailk_Bjlk_I8II_BH_MT64x64x32_MI16x16x16x1_SN_1LDSB0_AMAS0_GRVW4_IU1_LPA8_LPB0_SIA1_SU0_SUS0_SVW1_TT2_32_VW1_WGM4
    SolutionIndex: 104
    SolutionNameMin: Cijk_Ailk_Bjlk_I8II_BH_MT64x64x32_MI16x16x16x1_SN_1LDSB0_AMAS3_GRVW4_IU1_LPA0_LPB0_SIA1_SU0_SUS0_SVW2_TT2_32_VW2_WGM4
    SolutionIndex: 105
    SolutionNameMin: Cijk_Ailk_Bjlk_I8II_BH_MT64x64x32_MI16x16x16x1_SN_1LDSB0_AMAS0_GRVW8_IU1_LPA0_LPB0_SIA1_SU0_SUS0_SVW1_TT2_32_VW1_WGM4
    SolutionIndex: 106
    SolutionNameMin: Cijk_Ailk_Bjlk_I8II_BH_MT64x64x32_MI16x16x16x1_SN_1LDSB0_AMAS0_GRVW8_IU1_LPA8_LPB0_SIA1_SU0_SUS0_SVW1_TT2_32_VW1_WGM4
    SolutionIndex: 107
    SolutionNameMin: Cijk_Ailk_Bjlk_I8II_BH_MT64x64x32_MI16x16x16x1_SN_1LDSB0_AMAS3_GRVW8_IU1_LPA0_LPB0_SIA1_SU0_SUS0_SVW2_TT2_32_VW2_WGM4
    SolutionIndex: 108
    SolutionNameMin: Cijk_Ailk_Bjlk_I8II_BH_MT64x64x32_MI16x16x16x1_SN_1LDSB0_AMAS3_GRVW8_IU1_LPA8_LPB0_SIA1_SU0_SUS0_SVW2_TT2_32_VW2_WGM4
    SolutionIndex: 109
    SolutionNameMin: Cijk_Ailk_Bjlk_I8II_BH_MT64x64x32_MI16x16x16x1_SN_1LDSB0_AMAS3_GRVW8_IU1_LPA0_LPB8_SIA1_SU0_SUS0_SVW2_TT2_32_VW2_WGM4
    SolutionIndex: 110
    SolutionNameMin: Cijk_Ailk_Bjlk_I8II_BH_MT64x64x32_MI16x16x16x1_SN_1LDSB1_AMAS0_GRVW8_IU2_LPA0_LPB0_SIA2_SU0_SUS0_SVW1_TT2_32_VW1_WGM4
    SolutionIndex: 111
    SolutionNameMin: Cijk_Ailk_Bjlk_I8II_BH_MT64x64x32_MI16x16x16x1_SN_1LDSB1_AMAS3_GRVW8_IU2_LPA0_LPB0_SIA2_SU0_SUS0_SVW2_TT2_32_VW2_WGM4
    SolutionIndex: 112
    SolutionNameMin: Cijk_Ailk_Bjlk_I8II_BH_MT64x64x32_MI16x16x16x1_SN_1LDSB0_AMAS0_GRVW8_IU1_LPA0_LPB0_SIA3_SU0_SUS0_SVW1_TT2_32_VW1_WGM4
    SolutionIndex: 113
    SolutionNameMin: Cijk_Ailk_Bjlk_I8II_BH_MT64x64x32_MI16x16x16x1_SN_1LDSB0_AMAS3_GRVW8_IU1_LPA0_LPB0_SIA3_SU0_SUS0_SVW2_TT2_32_VW2_WGM4
    SolutionIndex: 114
    SolutionNameMin: Cijk_Ailk_Bjlk_I8II_BH_MT64x64x32_MI16x16x16x1_SN_1LDSB0_AMAS0_GRVW4_IU1_LPA8_LPB0_SIA1_SU32_SUS128_SVW1_TT2_32_VW1_WGM4
    SolutionIndex: 115
    SolutionNameMin: Cijk_Ailk_Bjlk_I8II_BH_MT64x64x32_MI16x16x16x1_SN_1LDSB0_AMAS0_GRVW8_IU1_LPA0_LPB0_SIA1_SU32_SUS128_SVW1_TT2_32_VW1_WGM4
    SolutionIndex: 116
    SolutionNameMin: Cijk_Ailk_Bjlk_I8II_BH_MT64x64x32_MI16x16x16x1_SN_1LDSB0_AMAS3_GRVW8_IU1_LPA0_LPB0_SIA1_SU32_SUS128_SVW2_TT2_32_VW2_WGM4
    SolutionIndex: 117
    SolutionNameMin: Cijk_Ailk_Bjlk_I8II_BH_MT64x64x32_MI16x16x16x1_SN_1LDSB0_AMAS3_GRVW8_IU1_LPA0_LPB0_SIA3_SU32_SUS128_SVW2_TT2_32_VW2_WGM4
    SolutionIndex: 118
    SolutionNameMin: Cijk_Ailk_Bjlk_I8II_BH_MT64x64x32_MI16x16x16x1_SN_1LDSB0_AMAS3_GRVW4_IU1_LPA0_LPB0_SIA1_SU32_SUS256_SVW2_TT2_32_VW2_WGM4
    SolutionIndex: 119
    SolutionNameMin: Cijk_Ailk_Bjlk_I8II_BH_MT64x64x32_MI16x16x16x1_SN_1LDSB0_AMAS0_GRVW8_IU1_LPA0_LPB8_SIA1_SU32_SUS256_SVW1_TT2_32_VW1_WGM4
    SolutionIndex: 120
    SolutionNameMin: Cijk_Ailk_Bjlk_I8II_BH_MT64x64x32_MI16x16x16x1_SN_1LDSB0_AMAS0_GRVW8_IU1_LPA8_LPB8_SIA1_SU32_SUS256_SVW1_TT2_32_VW1_WGM4
    SolutionIndex: 121
    SolutionNameMin: Cijk_Ailk_Bjlk_I8II_BH_MT64x64x32_MI16x16x16x1_SN_1LDSB0_AMAS3_GRVW8_IU1_LPA8_LPB0_SIA1_SU32_SUS256_SVW2_TT2_32_VW2_WGM4
    SolutionIndex: 122
    SolutionNameMin: Cijk_Ailk_Bjlk_I8II_BH_MT64x64x32_MI16x16x16x1_SN_1LDSB1_AMAS3_GRVW8_IU2_LPA0_LPB0_SIA2_SU32_SUS256_SVW2_TT2_32_VW2_WGM4
    SolutionIndex: 123
    SolutionNameMin: Cijk_Ailk_Bjlk_I8II_BH_MT64x64x32_MI16x16x16x1_SN_1LDSB0_AMAS0_GRVW8_IU1_LPA0_LPB0_SIA3_SU32_SUS256_SVW1_TT2_32_VW1_WGM4
    SolutionIndex: 124
    SolutionNameMin: Cijk_Ailk_Bjlk_I8II_BH_MT64x64x32_MI16x16x16x1_SN_1LDSB0_AMAS3_GRVW8_IU1_LPA0_LPB0_SIA3_SU32_SUS256_SVW2_TT2_32_VW2_WGM4
    SolutionIndex: 125
    SolutionNameMin: Cijk_Ailk_Bjlk_I8II_BH_MT64x64x32_MI16x16x16x1_SN_1LDSB0_AMAS3_GRVW4_IU1_LPA0_LPB0_SIA1_SU0_SUS0_SVW2_TT2_32_VW2_WGM8
    SolutionIndex: 126
    SolutionNameMin: Cijk_Ailk_Bjlk_I8II_BH_MT64x64x32_MI16x16x16x1_SN_1LDSB0_AMAS0_GRVW8_IU1_LPA0_LPB0_SIA1_SU0_SUS0_SVW1_TT2_32_VW1_WGM8
    SolutionIndex: 127
    SolutionNameMin: Cijk_Ailk_Bjlk_I8II_BH_MT64x64x32_MI16x16x16x1_SN_1LDSB0_AMAS0_GRVW8_IU1_LPA8_LPB0_SIA1_SU0_SUS0_SVW1_TT2_32_VW1_WGM8
    SolutionIndex: 128
    SolutionNameMin: Cijk_Ailk_Bjlk_I8II_BH_MT64x64x32_MI16x16x16x1_SN_1LDSB0_AMAS0_GRVW8_IU1_LPA0_LPB8_SIA1_SU0_SUS0_SVW1_TT2_32_VW1_WGM8
    SolutionIndex: 129
    SolutionNameMin: Cijk_Ailk_Bjlk_I8II_BH_MT64x64x32_MI16x16x16x1_SN_1LDSB0_AMAS3_GRVW8_IU1_LPA0_LPB0_SIA1_SU0_SUS0_SVW2_TT2_32_VW2_WGM8
    SolutionIndex: 130
    SolutionNameMin: Cijk_Ailk_Bjlk_I8II_BH_MT64x64x32_MI16x16x16x1_SN_1LDSB0_AMAS3_GRVW8_IU1_LPA0_LPB8_SIA1_SU0_SUS0_SVW2_TT2_32_VW2_WGM8
    SolutionIndex: 131
    SolutionNameMin: Cijk_Ailk_Bjlk_I8II_BH_MT64x64x32_MI16x16x16x1_SN_1LDSB1_AMAS0_GRVW8_IU2_LPA0_LPB0_SIA2_SU0_SUS0_SVW1_TT2_32_VW1_WGM8
    SolutionIndex: 132
    SolutionNameMin: Cijk_Ailk_Bjlk_I8II_BH_MT64x64x32_MI16x16x16x1_SN_1LDSB1_AMAS0_GRVW8_IU2_LPA8_LPB0_SIA2_SU0_SUS0_SVW1_TT2_32_VW1_WGM8
    SolutionIndex: 133
    SolutionNameMin: Cijk_Ailk_Bjlk_I8II_BH_MT64x64x32_MI16x16x16x1_SN_1LDSB1_AMAS3_GRVW8_IU2_LPA0_LPB0_SIA2_SU0_SUS0_SVW2_TT2_32_VW2_WGM8
    SolutionIndex: 134
    SolutionNameMin: Cijk_Ailk_Bjlk_I8II_BH_MT64x64x32_MI16x16x16x1_SN_1LDSB0_AMAS3_GRVW4_IU1_LPA0_LPB0_SIA3_SU0_SUS0_SVW2_TT2_32_VW2_WGM8
    SolutionIndex: 135
    SolutionNameMin: Cijk_Ailk_Bjlk_I8II_BH_MT64x64x32_MI16x16x16x1_SN_1LDSB0_AMAS0_GRVW8_IU1_LPA0_LPB0_SIA3_SU0_SUS0_SVW1_TT2_32_VW1_WGM8
    SolutionIndex: 136
    SolutionNameMin: Cijk_Ailk_Bjlk_I8II_BH_MT64x64x32_MI16x16x16x1_SN_1LDSB0_AMAS3_GRVW8_IU1_LPA0_LPB0_SIA3_SU0_SUS0_SVW2_TT2_32_VW2_WGM8
    SolutionIndex: 137
    SolutionNameMin: Cijk_Ailk_Bjlk_I8II_BH_MT64x64x32_MI16x16x16x1_SN_1LDSB0_AMAS3_GRVW4_IU1_LPA0_LPB0_SIA1_SU32_SUS128_SVW2_TT2_32_VW2_WGM8
    SolutionIndex: 138
    SolutionNameMin: Cijk_Ailk_Bjlk_I8II_BH_MT64x64x32_MI16x16x16x1_SN_1LDSB0_AMAS3_GRVW8_IU1_LPA0_LPB0_SIA1_SU32_SUS128_SVW2_TT2_32_VW2_WGM8
    SolutionIndex: 139
    SolutionNameMin: Cijk_Ailk_Bjlk_I8II_BH_MT64x64x32_MI16x16x16x1_SN_1LDSB0_AMAS3_GRVW8_IU1_LPA8_LPB8_SIA1_SU32_SUS128_SVW2_TT2_32_VW2_WGM8
    SolutionIndex: 140
    SolutionNameMin: Cijk_Ailk_Bjlk_I8II_BH_MT64x64x32_MI16x16x16x1_SN_1LDSB1_AMAS0_GRVW8_IU2_LPA0_LPB8_SIA2_SU32_SUS128_SVW1_TT2_32_VW1_WGM8
    SolutionIndex: 141
    SolutionNameMin: Cijk_Ailk_Bjlk_I8II_BH_MT64x64x32_MI16x16x16x1_SN_1LDSB0_AMAS0_GRVW8_IU1_LPA0_LPB0_SIA3_SU32_SUS128_SVW1_TT2_32_VW1_WGM8
    SolutionIndex: 142
    SolutionNameMin: Cijk_Ailk_Bjlk_I8II_BH_MT64x64x32_MI16x16x16x1_SN_1LDSB0_AMAS3_GRVW8_IU1_LPA0_LPB0_SIA3_SU32_SUS128_SVW2_TT2_32_VW2_WGM8
    SolutionIndex: 143
    SolutionNameMin: Cijk_Ailk_Bjlk_I8II_BH_MT64x64x32_MI16x16x16x1_SN_1LDSB0_AMAS0_GRVW4_IU1_LPA0_LPB0_SIA1_SU32_SUS256_SVW1_TT2_32_VW1_WGM8
    SolutionIndex: 144
    SolutionNameMin: Cijk_Ailk_Bjlk_I8II_BH_MT64x64x32_MI16x16x16x1_SN_1LDSB0_AMAS3_GRVW4_IU1_LPA0_LPB8_SIA1_SU32_SUS256_SVW2_TT2_32_VW2_WGM8
    SolutionIndex: 145
    SolutionNameMin: Cijk_Ailk_Bjlk_I8II_BH_MT64x64x32_MI16x16x16x1_SN_1LDSB0_AMAS0_GRVW8_IU1_LPA0_LPB0_SIA1_SU32_SUS256_SVW1_TT2_32_VW1_WGM8
    SolutionIndex: 146
    SolutionNameMin: Cijk_Ailk_Bjlk_I8II_BH_MT64x64x32_MI16x16x16x1_SN_1LDSB0_AMAS0_GRVW8_IU1_LPA0_LPB8_SIA1_SU32_SUS256_SVW1_TT2_32_VW1_WGM8
    SolutionIndex: 147
    SolutionNameMin: Cijk_Ailk_Bjlk_I8II_BH_MT64x64x32_MI16x16x16x1_SN_1LDSB0_AMAS3_GRVW8_IU1_LPA8_LPB0_SIA1_SU32_SUS256_SVW2_TT2_32_VW2_WGM8
    SolutionIndex: 148
    SolutionNameMin: Cijk_Ailk_Bjlk_I8II_BH_MT64x64x32_MI16x16x16x1_SN_1LDSB0_AMAS3_GRVW8_IU1_LPA0_LPB8_SIA1_SU32_SUS256_SVW2_TT2_32_VW2_WGM8
    SolutionIndex: 149
    SolutionNameMin: Cijk_Ailk_Bjlk_I8II_BH_MT64x64x32_MI16x16x16x1_SN_1LDSB0_AMAS0_GRVW8_IU1_LPA0_LPB0_SIA3_SU32_SUS256_SVW1_TT2_32_VW1_WGM8
    SolutionIndex: 150
    SolutionNameMin: Cijk_Ailk_Bjlk_I8II_BH_MT64x64x32_MI16x16x16x1_SN_1LDSB0_AMAS3_GRVW8_IU1_LPA0_LPB0_SIA3_SU32_SUS256_SVW2_TT2_32_VW2_WGM8
- - - [64, 64, 1, 64, 96, 96, 96, 96]
    - [0, 0.088]
  - - [64, 64, 1, 128, 96, 96, 160, 160]
    - [95, 0.164]
  - - [64, 64, 1, 256, 96, 96, 288, 288]
    - [93, 0.301]
  - - [64, 64, 1, 512, 96, 96, 544, 544]
    - [95, 0.522]
  - - [64, 64, 1, 1024, 96, 96, 1056, 1056]
    - [72, 0.817]
  - - [64, 64, 1, 2048, 96, 96, 2080, 2080]
    - [96, 1.133]
  - - [64, 64, 1, 4096, 96, 96, 4128, 4128]
    - [72, 1.412]
  - - [64, 128, 1, 64, 96, 96, 96, 128]
    - [83, 0.177]
  - - [64, 128, 1, 128, 96, 96, 160, 160]
    - [77, 0.338]
  - - [64, 128, 1, 256, 96, 96, 288, 288]
    - [97, 0.619]
  - - [64, 128, 1, 512, 96, 96, 544, 544]
    - [100, 1.062]
  - - [64, 128, 1, 1024, 96, 96, 1056, 1056]
    - [97, 1.655]
  - - [64, 128, 1, 2048, 96, 96, 2080, 2080]
    - [91, 2.291]
  - - [64, 128, 1, 4096, 96, 96, 4128, 4128]
    - [94, 2.84]
  - - [64, 256, 1, 64, 96, 96, 96, 256]
    - [81, 0.359]
  - - [64, 256, 1, 128, 96, 96, 160, 256]
    - [97, 0.683]
  - - [64, 256, 1, 256, 96, 96, 288, 288]
    - [96, 1.249]
  - - [64, 256, 1, 512, 96, 96, 544, 544]
    - [91, 2.15]
  - - [64, 256, 1, 1024, 96, 96, 1056, 1056]
    - [96, 3.329]
  - - [64, 256, 1, 2048, 96, 96, 2080, 2080]
    - [94, 4.617]
  - - [64, 256, 1, 4096, 96, 96, 4128, 4128]
    - [73, 5.679]
  - - [64, 512, 1, 64, 96, 96, 96, 512]
    - [75, 0.71]
  - - [64, 512, 1, 128, 96, 96, 160, 512]
    - [101, 1.323]
  - - [64, 512, 1, 256, 96, 96, 288, 512]
    - [69, 2.36]
  - - [64, 512, 1, 512, 96, 96, 544, 544]
    - [91, 3.903]
  - - [64, 512, 1, 1024, 96, 96, 1056, 1056]
    - [91, 5.761]
  - - [64, 512, 1, 2048, 96, 96, 2080, 2080]
    - [91, 7.556]
  - - [64, 512, 1, 4096, 96, 96, 4128, 4128]
    - [69, 8.908]
  - - [64, 1024, 1, 64, 96, 96, 96, 1024]
    - [79, 1.362]
  - - [64, 1024, 1, 128, 96, 96, 160, 1024]
    - [78, 2.537]
  - - [64, 1024, 1, 256, 96, 96, 288, 1024]
    - [64, 4.413]
  - - [64, 1024, 1, 512, 96, 96, 544, 1024]
    - [85, 6.866]
  - - [64, 1024, 1, 1024, 96, 96, 1056, 1056]
    - [66, 9.56]
  - - [64, 1024, 1, 2048, 96, 96, 2080, 2080]
    - [66, 11.911]
  - - [64, 1024, 1, 4096, 96, 96, 4128, 4128]
    - [88, 13.428]
  - - [64, 2048, 1, 64, 96, 96, 96, 2048]
    - [103, 2.599]
  - - [64, 2048, 1, 128, 96, 96, 160, 2048]
    - [2, 4.676]
  - - [64, 2048, 1, 256, 96, 96, 288, 2048]
    - [125, 7.765]
  - - [64, 2048, 1, 512, 96, 96, 544, 2048]
    - [107, 11.796]
  - - [64, 2048, 1, 1024, 96, 96, 1056, 2048]
    - [104, 16.005]
  - - [64, 2048, 1, 2048, 96, 96, 2080, 2080]
    - [129, 19.415]
  - - [64, 2048, 1, 4096, 96, 96, 4128, 4128]
    - [108, 20.458]
  - - [64, 4096, 1, 64, 96, 96, 96, 4096]
    - [140, 4.82]
  - - [64, 4096, 1, 128, 96, 96, 160, 4096]
    - [136, 8.434]
  - - [64, 4096, 1, 256, 96, 96, 288, 4096]
    - [133, 13.445]
  - - [64, 4096, 1, 512, 96, 96, 544, 4096]
    - [136, 18.988]
  - - [64, 4096, 1, 1024, 96, 96, 1056, 4096]
    - [111, 23.837]
  - - [64, 4096, 1, 2048, 96, 96, 2080, 4096]
    - [141, 27.312]
  - - [64, 4096, 1, 4096, 96, 96, 4128, 4128]
    - [122, 28.511]
  - - [128, 64, 1, 64, 160, 160, 128, 96]
    - [97, 0.176]
  - - [128, 64, 1, 128, 160, 160, 160, 160]
    - [91, 0.337]
  - - [128, 64, 1, 256, 160, 160, 288, 288]
    - [72, 0.621]
  - - [128, 64, 1, 512, 160, 160, 544, 544]
    - [70, 1.059]
  - - [128, 64, 1, 1024, 160, 160, 1056, 1056]
    - [94, 1.656]
  - - [128, 64, 1, 2048, 160, 160, 2080, 2080]
    - [96, 2.292]
  - - [128, 64, 1, 4096, 160, 160, 4128, 4128]
    - [72, 2.843]
  - - [128, 128, 1, 64, 160, 160, 128, 128]
    - [92, 0.357]
  - - [128, 128, 1, 128, 160, 160, 160, 160]
    - [71, 0.681]
  - - [128, 128, 1, 256, 160, 160, 288, 288]
    - [97, 1.25]
  - - [128, 128, 1, 512, 160, 160, 544, 544]
    - [94, 2.151]
  - - [128, 128, 1, 1024, 160, 160, 1056, 1056]
    - [72, 3.352]
  - - [128, 128, 1, 2048, 160, 160, 2080, 2080]
    - [72, 4.607]
  - - [128, 128, 1, 4096, 160, 160, 4128, 4128]
    - [72, 5.697]
  - - [128, 256, 1, 64, 160, 160, 128, 256]
    - [71, 0.708]
  - - [128, 256, 1, 128, 160, 160, 160, 256]
    - [74, 1.331]
  - - [128, 256, 1, 256, 160, 160, 288, 288]
    - [70, 2.361]
  - - [128, 256, 1, 512, 160, 160, 544, 544]
    - [91, 3.905]
  - - [128, 256, 1, 1024, 160, 160, 1056, 1056]
    - [91, 5.735]
  - - [128, 256, 1, 2048, 160, 160, 2080, 2080]
    - [91, 7.559]
  - - [128, 256, 1, 4096, 160, 160, 4128, 4128]
    - [91, 8.922]
  - - [128, 512, 1, 64, 160, 160, 128, 512]
    - [64, 1.367]
  - - [128, 512, 1, 128, 160, 160, 160, 512]
    - [67, 2.526]
  - - [128, 512, 1, 256, 160, 160, 288, 512]
    - [88, 4.386]
  - - [128, 512, 1, 512, 160, 160, 544, 544]
    - [66, 6.914]
  - - [128, 512, 1, 1024, 160, 160, 1056, 1056]
    - [66, 9.585]
  - - [128, 512, 1, 2048, 160, 160, 2080, 2080]
    - [66, 11.928]
  - - [128, 512, 1, 4096, 160, 160, 4128, 4128]
    - [80, 13.715]
  - - [128, 1024, 1, 64, 160, 160, 128, 1024]
    - [110, 2.604]
  - - [128, 1024, 1, 128, 160, 160, 160, 1024]
    - [1, 4.692]
  - - [128, 1024, 1, 256, 160, 160, 288, 1024]
    - [107, 7.772]
  - - [128, 1024, 1, 512, 160, 160, 544, 1024]
    - [104, 11.773]
  - - [128, 1024, 1, 1024, 160, 160, 1056, 1056]
    - [125, 15.756]
  - - [128, 1024, 1, 2048, 160, 160, 2080, 2080]
    - [104, 19.17]
  - - [128, 1024, 1, 4096, 160, 160, 4128, 4128]
    - [125, 20.387]
  - - [128, 2048, 1, 64, 160, 160, 128, 2048]
    - [141, 4.868]
  - - [128, 2048, 1, 128, 160, 160, 160, 2048]
    - [141, 8.433]
  - - [128, 2048, 1, 256, 160, 160, 288, 2048]
    - [112, 13.49]
  - - [128, 2048, 1, 512, 160, 160, 544, 2048]
    - [136, 19.156]
  - - [128, 2048, 1, 1024, 160, 160, 1056, 2048]
    - [113, 24.165]
  - - [128, 2048, 1, 2048, 160, 160, 2080, 2080]
    - [136, 27.793]
  - - [128, 2048, 1, 4096, 160, 160, 4128, 4128]
    - [149, 28.693]
  - - [128, 4096, 1, 64, 160, 160, 128, 4096]
    - [129, 8.348]
  - - [128, 4096, 1, 128, 160, 160, 160, 4096]
    - [123, 13.706]
  - - [128, 4096, 1, 256, 160, 160, 288, 4096]
    - [116, 20.583]
  - - [128, 4096, 1, 512, 160, 160, 544, 4096]
    - [44, 28.284]
  - - [128, 4096, 1, 1024, 160, 160, 1056, 4096]
    - [43, 34.923]
  - - [128, 4096, 1, 2048, 160, 160, 2080, 4096]
    - [42, 38.045]
  - - [128, 4096, 1, 4096, 160, 160, 4128, 4128]
    - [39, 41.387]
  - - [256, 64, 1, 64, 288, 288, 256, 96]
    - [95, 0.355]
  - - [256, 64, 1, 128, 288, 288, 256, 160]
    - [95, 0.686]
  - - [256, 64, 1, 256, 288, 288, 288, 288]
    - [95, 1.254]
  - - [256, 64, 1, 512, 288, 288, 544, 544]
    - [97, 2.137]
  - - [256, 64, 1, 1024, 288, 288, 1056, 1056]
    - [94, 3.329]
  - - [256, 64, 1, 2048, 288, 288, 2080, 2080]
    - [73, 4.601]
  - - [256, 64, 1, 4096, 288, 288, 4128, 4128]
    - [94, 5.702]
  - - [256, 128, 1, 64, 288, 288, 256, 128]
    - [86, 0.707]
  - - [256, 128, 1, 128, 288, 288, 256, 160]
    - [82, 1.318]
  - - [256, 128, 1, 256, 288, 288, 288, 288]
    - [74, 2.37]
  - - [256, 128, 1, 512, 288, 288, 544, 544]
    - [91, 3.908]
  - - [256, 128, 1, 1024, 288, 288, 1056, 1056]
    - [69, 5.754]
  - - [256, 128, 1, 2048, 288, 288, 2080, 2080]
    - [91, 7.559]
  - - [256, 128, 1, 4096, 288, 288, 4128, 4128]
    - [91, 8.924]
  - - [256, 256, 1, 64, 288, 288, 256, 256]
    - [90, 1.376]
  - - [256, 256, 1, 128, 288, 288, 256, 256]
    - [67, 2.534]
  - - [256, 256, 1, 256, 288, 288, 288, 288]
    - [88, 4.388]
  - - [256, 256, 1, 512, 288, 288, 544, 544]
    - [85, 6.898]
  - - [256, 256, 1, 1024, 288, 288, 1056, 1056]
    - [80, 9.544]
  - - [256, 256, 1, 2048, 288, 288, 2080, 2080]
    - [88, 11.95]
  - - [256, 256, 1, 4096, 288, 288, 4128, 4128]
    - [98, 13.45]
  - - [256, 512, 1, 64, 288, 288, 256, 512]
    - [109, 2.604]
  - - [256, 512, 1, 128, 288, 288, 256, 512]
    - [1, 4.7]
  - - [256, 512, 1, 256, 288, 288, 288, 512]
    - [129, 7.815]
  - - [256, 512, 1, 512, 288, 288, 544, 544]
    - [129, 11.749]
  - - [256, 512, 1, 1024, 288, 288, 1056, 1056]
    - [105, 15.971]
  - - [256, 512, 1, 2048, 288, 288, 2080, 2080]
    - [105, 19.369]
  - - [256, 512, 1, 4096, 288, 288, 4128, 4128]
    - [115, 20.546]
  - - [256, 1024, 1, 64, 288, 288, 256, 1024]
    - [134, 4.853]
  - - [256, 1024, 1, 128, 288, 288, 256, 1024]
    - [135, 8.471]
  - - [256, 1024, 1, 256, 288, 288, 288, 1024]
    - [150, 13.533]
  - - [256, 1024, 1, 512, 288, 288, 544, 1024]
    - [113, 19.1]
  - - [256, 1024, 1, 1024, 288, 288, 1056, 1056]
    - [136, 24.204]
  - - [256, 1024, 1, 2048, 288, 288, 2080, 2080]
    - [112, 27.804]
  - - [256, 1024, 1, 4096, 288, 288, 4128, 4128]
    - [150, 28.876]
  - - [256, 2048, 1, 64, 288, 288, 256, 2048]
    - [118, 8.361]
  - - [256, 2048, 1, 128, 288, 288, 256, 2048]
    - [136, 13.8]
  - - [256, 2048, 1, 256, 288, 288, 288, 2048]
    - [48, 20.799]
  - - [256, 2048, 1, 512, 288, 288, 544, 2048]
    - [35, 28.881]
  - - [256, 2048, 1, 1024, 288, 288, 1056, 2048]
    - [34, 35.606]
  - - [256, 2048, 1, 2048, 288, 288, 2080, 2080]
    - [29, 38.62]
  - - [256, 2048, 1, 4096, 288, 288, 4128, 4128]
    - [4, 42.085]
  - - [256, 4096, 1, 64, 288, 288, 256, 4096]
    - [137, 14.228]
  - - [256, 4096, 1, 128, 288, 288, 256, 4096]
    - [150, 21.754]
  - - [256, 4096, 1, 256, 288, 288, 288, 4096]
    - [13, 33.009]
  - - [256, 4096, 1, 512, 288, 288, 544, 4096]
    - [14, 42.731]
  - - [256, 4096, 1, 1024, 288, 288, 1056, 4096]
    - [40, 50.13]
  - - [256, 4096, 1, 2048, 288, 288, 2080, 4096]
    - [38, 53.238]
  - - [256, 4096, 1, 4096, 288, 288, 4128, 4128]
    - [57, 56.893]
  - - [384, 64, 1, 64, 416, 416, 384, 96]
    - [73, 0.535]
  - - [384, 64, 1, 128, 416, 416, 384, 160]
    - [74, 1.026]
  - - [384, 64, 1, 256, 416, 416, 384, 288]
    - [84, 1.87]
  - - [384, 64, 1, 512, 416, 416, 544, 544]
    - [73, 3.212]
  - - [384, 64, 1, 1024, 416, 416, 1056, 1056]
    - [95, 5.004]
  - - [384, 64, 1, 2048, 416, 416, 2080, 2080]
    - [94, 6.935]
  - - [384, 64, 1, 4096, 416, 416, 4128, 4128]
    - [94, 8.545]
  - - [384, 128, 1, 64, 416, 416, 384, 128]
    - [87, 1.049]
  - - [384, 128, 1, 128, 416, 416, 384, 160]
    - [99, 1.955]
  - - [384, 128, 1, 256, 416, 416, 384, 288]
    - [65, 3.5]
  - - [384, 128, 1, 512, 416, 416, 544, 544]
    - [91, 5.761]
  - - [384, 128, 1, 1024, 416, 416, 1056, 1056]
    - [72, 8.534]
  - - [384, 128, 1, 2048, 416, 416, 2080, 2080]
    - [69, 11.212]
  - - [384, 128, 1, 4096, 416, 416, 4128, 4128]
    - [91, 13.244]
  - - [384, 256, 1, 64, 416, 416, 384, 256]
    - [119, 2.001]
  - - [384, 256, 1, 128, 416, 416, 384, 256]
    - [126, 3.657]
  - - [384, 256, 1, 256, 416, 416, 384, 288]
    - [114, 6.394]
  - - [384, 256, 1, 512, 416, 416, 544, 544]
    - [132, 9.707]
  - - [384, 256, 1, 1024, 416, 416, 1056, 1056]
    - [110, 13.518]
  - - [384, 256, 1, 2048, 416, 416, 2080, 2080]
    - [110, 16.731]
  - - [384, 256, 1, 4096, 416, 416, 4128, 4128]
    - [111, 18.949]
  - - [384, 512, 1, 64, 416, 416, 384, 512]
    - [121, 3.83]
  - - [384, 512, 1, 128, 416, 416, 384, 512]
    - [106, 6.933]
  - - [384, 512, 1, 256, 416, 416, 384, 512]
    - [126, 11.544]
  - - [384, 512, 1, 512, 416, 416, 544, 544]
    - [129, 17.339]
  - - [384, 512, 1, 1024, 416, 416, 1056, 1056]
    - [125, 23.324]
  - - [384, 512, 1, 2048, 416, 416, 2080, 2080]
    - [125, 28.168]
  - - [384, 512, 1, 4096, 416, 416, 4128, 4128]
    - [125, 29.765]
  - - [384, 1024, 1, 64, 416, 416, 384, 1024]
    - [105, 6.73]
  - - [384, 1024, 1, 128, 416, 416, 384, 1024]
    - [2, 11.337]
  - - [384, 1024, 1, 256, 416, 416, 384, 1024]
    - [134, 17.433]
  - - [384, 1024, 1, 512, 416, 416, 544, 1024]
    - [141, 23.904]
  - - [384, 1024, 1, 1024, 416, 416, 1056, 1056]
    - [123, 29.442]
  - - [384, 1024, 1, 2048, 416, 416, 2080, 2080]
    - [136, 31.638]
  - - [384, 1024, 1, 4096, 416, 416, 4128, 4128]
    - [141, 34.121]
  - - [384, 2048, 1, 64, 416, 416, 384, 2048]
    - [138, 11.519]
  - - [384, 2048, 1, 128, 416, 416, 384, 2048]
    - [31, 18.965]
  - - [384, 2048, 1, 256, 416, 416, 384, 2048]
    - [32, 30.029]
  - - [384, 2048, 1, 512, 416, 416, 544, 2048]
    - [33, 42.178]
  - - [384, 2048, 1, 1024, 416, 416, 1056, 2048]
    - [32, 52.777]
  - - [384, 2048, 1, 2048, 416, 416, 2080, 2080]
    - [30, 57.63]
  - - [384, 2048, 1, 4096, 416, 416, 4128, 4128]
    - [28, 63.799]
  - - [384, 4096, 1, 64, 416, 416, 384, 4096]
    - [113, 18.83]
  - - [384, 4096, 1, 128, 416, 416, 384, 4096]
    - [41, 29.161]
  - - [384, 4096, 1, 256, 416, 416, 384, 4096]
    - [44, 42.421]
  - - [384, 4096, 1, 512, 416, 416, 544, 4096]
    - [50, 54.276]
  - - [384, 4096, 1, 1024, 416, 416, 1056, 4096]
    - [19, 59.722]
  - - [384, 4096, 1, 2048, 416, 416, 2080, 4096]
    - [51, 65.628]
  - - [384, 4096, 1, 4096, 416, 416, 4128, 4128]
    - [54, 68.889]
  - - [768, 64, 1, 64, 800, 800, 768, 96]
    - [89, 1.058]
  - - [768, 64, 1, 128, 800, 800, 768, 160]
    - [68, 1.976]
  - - [768, 64, 1, 256, 800, 800, 768, 288]
    - [94, 3.512]
  - - [768, 64, 1, 512, 800, 800, 768, 544]
    - [91, 5.784]
  - - [768, 64, 1, 1024, 800, 800, 1056, 1056]
    - [94, 8.506]
  - - [768, 64, 1, 2048, 800, 800, 2080, 2080]
    - [91, 11.203]
  - - [768, 64, 1, 4096, 800, 800, 4128, 4128]
    - [69, 13.237]
  - - [768, 128, 1, 64, 800, 800, 768, 128]
    - [76, 1.985]
  - - [768, 128, 1, 128, 800, 800, 768, 160]
    - [105, 3.646]
  - - [768, 128, 1, 256, 800, 800, 768, 288]
    - [139, 6.337]
  - - [768, 128, 1, 512, 800, 800, 768, 544]
    - [143, 9.866]
  - - [768, 128, 1, 1024, 800, 800, 1056, 1056]
    - [110, 13.499]
  - - [768, 128, 1, 2048, 800, 800, 2080, 2080]
    - [110, 16.736]
  - - [768, 128, 1, 4096, 800, 800, 4128, 4128]
    - [110, 18.867]
  - - [768, 256, 1, 64, 800, 800, 768, 256]
    - [106, 3.839]
  - - [768, 256, 1, 128, 800, 800, 768, 256]
    - [146, 6.885]
  - - [768, 256, 1, 256, 800, 800, 768, 288]
    - [138, 11.522]
  - - [768, 256, 1, 512, 800, 800, 768, 544]
    - [126, 17.437]
  - - [768, 256, 1, 1024, 800, 800, 1056, 1056]
    - [126, 23.441]
  - - [768, 256, 1, 2048, 800, 800, 2080, 2080]
    - [125, 28.346]
  - - [768, 256, 1, 4096, 800, 800, 4128, 4128]
    - [125, 29.828]
  - - [768, 512, 1, 64, 800, 800, 768, 512]
    - [126, 6.741]
  - - [768, 512, 1, 128, 800, 800, 768, 512]
    - [135, 11.363]
  - - [768, 512, 1, 256, 800, 800, 768, 512]
    - [136, 17.574]
  - - [768, 512, 1, 512, 800, 800, 768, 544]
    - [142, 23.943]
  - - [768, 512, 1, 1024, 800, 800, 1056, 1056]
    - [149, 29.425]
  - - [768, 512, 1, 2048, 800, 800, 2080, 2080]
    - [149, 31.607]
  - - [768, 512, 1, 4096, 800, 800, 4128, 4128]
    - [141, 33.934]
  - - [768, 1024, 1, 64, 800, 800, 768, 1024]
    - [130, 11.546]
  - - [768, 1024, 1, 128, 800, 800, 768, 1024]
    - [11, 18.904]
  - - [768, 1024, 1, 256, 800, 800, 768, 1024]
    - [10, 30.01]
  - - [768, 1024, 1, 512, 800, 800, 768, 1024]
    - [8, 42.462]
  - - [768, 1024, 1, 1024, 800, 800, 1056, 1056]
    - [10, 53.503]
  - - [768, 1024, 1, 2048, 800, 800, 2080, 2080]
    - [9, 59.027]
  - - [768, 1024, 1, 4096, 800, 800, 4128, 4128]
    - [8, 65.005]
  - - [768, 2048, 1, 64, 800, 800, 768, 2048]
    - [145, 18.924]
  - - [768, 2048, 1, 128, 800, 800, 768, 2048]
    - [40, 28.784]
  - - [768, 2048, 1, 256, 800, 800, 768, 2048]
    - [44, 42.104]
  - - [768, 2048, 1, 512, 800, 800, 768, 2048]
    - [52, 54.07]
  - - [768, 2048, 1, 1024, 800, 800, 1056, 2048]
    - [24, 59.667]
  - - [768, 2048, 1, 2048, 800, 800, 2080, 2080]
    - [59, 65.658]
  - - [768, 2048, 1, 4096, 800, 800, 4128, 4128]
    - [52, 68.863]
  - - [768, 4096, 1, 64, 800, 800, 768, 4096]
    - [136, 27.722]
  - - [768, 4096, 1, 128, 800, 800, 768, 4096]
    - [62, 41.293]
  - - [768, 4096, 1, 256, 800, 800, 768, 4096]
    - [63, 55.116]
  - - [768, 4096, 1, 512, 800, 800, 768, 4096]
    - [37, 62.633]
  - - [768, 4096, 1, 1024, 800, 800, 1056, 4096]
    - [17, 69.106]
  - - [768, 4096, 1, 2048, 800, 800, 2080, 4096]
    - [43, 74.262]
  - - [768, 4096, 1, 4096, 800, 800, 4128, 4128]
    - [42, 76.486]
  - - [1536, 64, 1, 64, 1568, 1568, 1536, 96]
    - [128, 1.99]
  - - [1536, 64, 1, 128, 1568, 1568, 1536, 160]
    - [107, 3.651]
  - - [1536, 64, 1, 256, 1568, 1568, 1536, 288]
    - [115, 6.309]
  - - [1536, 64, 1, 512, 1568, 1568, 1536, 544]
    - [120, 9.852]
  - - [1536, 64, 1, 1024, 1568, 1568, 1536, 1056]
    - [110, 13.516]
  - - [1536, 64, 1, 2048, 1568, 1568, 2080, 2080]
    - [131, 16.723]
  - - [1536, 64, 1, 4096, 1568, 1568, 4128, 4128]
    - [131, 18.861]
  - - [1536, 128, 1, 64, 1568, 1568, 1536, 128]
    - [127, 3.827]
  - - [1536, 128, 1, 128, 1568, 1568, 1536, 160]
    - [147, 6.876]
  - - [1536, 128, 1, 256, 1568, 1568, 1536, 288]
    - [129, 11.501]
  - - [1536, 128, 1, 512, 1568, 1568, 1536, 544]
    - [107, 17.383]
  - - [1536, 128, 1, 1024, 1568, 1568, 1536, 1056]
    - [129, 23.61]
  - - [1536, 128, 1, 2048, 1568, 1568, 2080, 2080]
    - [107, 28.888]
  - - [1536, 128, 1, 4096, 1568, 1568, 4128, 4128]
    - [104, 30.963]
  - - [1536, 256, 1, 64, 1568, 1568, 1536, 256]
    - [126, 6.718]
  - - [1536, 256, 1, 128, 1568, 1568, 1536, 256]
    - [3, 11.321]
  - - [1536, 256, 1, 256, 1568, 1568, 1536, 288]
    - [136, 17.591]
  - - [1536, 256, 1, 512, 1568, 1568, 1536, 544]
    - [113, 23.99]
  - - [1536, 256, 1, 1024, 1568, 1568, 1536, 1056]
    - [149, 29.362]
  - - [1536, 256, 1, 2048, 1568, 1568, 2080, 2080]
    - [102, 31.413]
  - - [1536, 256, 1, 4096, 1568, 1568, 4128, 4128]
    - [135, 33.976]
  - - [1536, 512, 1, 64, 1568, 1568, 1536, 512]
    - [138, 11.62]
  - - [1536, 512, 1, 128, 1568, 1568, 1536, 512]
    - [49, 18.68]
  - - [1536, 512, 1, 256, 1568, 1568, 1536, 512]
    - [44, 29.241]
  - - [1536, 512, 1, 512, 1568, 1568, 1536, 544]
    - [16, 40.972]
  - - [1536, 512, 1, 1024, 1568, 1568, 1536, 1056]
    - [17, 51.054]
  - - [1536, 512, 1, 2048, 1568, 1568, 2080, 2080]
    - [43, 55.913]
  - - [1536, 512, 1, 4096, 1568, 1568, 4128, 4128]
    - [41, 61.13]
  - - [1536, 1024, 1, 64, 1568, 1568, 1536, 1024]
    - [141, 18.86]
  - - [1536, 1024, 1, 128, 1568, 1568, 1536, 1024]
    - [60, 28.771]
  - - [1536, 1024, 1, 256, 1568, 1568, 1536, 1024]
    - [16, 42.118]
  - - [1536, 1024, 1, 512, 1568, 1568, 1536, 1024]
    - [61, 54.037]
  - - [1536, 1024, 1, 1024, 1568, 1568, 1536, 1056]
    - [50, 59.745]
  - - [1536, 1024, 1, 2048, 1568, 1568, 2080, 2080]
    - [51, 65.544]
  - - [1536, 1024, 1, 4096, 1568, 1568, 4128, 4128]
    - [44, 68.835]
  - - [1536, 2048, 1, 64, 1568, 1568, 1536, 2048]
    - [124, 27.84]
  - - [1536, 2048, 1, 128, 1568, 1568, 1536, 2048]
    - [26, 41.536]
  - - [1536, 2048, 1, 256, 1568, 1568, 1536, 2048]
    - [25, 55.044]
  - - [1536, 2048, 1, 512, 1568, 1568, 1536, 2048]
    - [56, 62.646]
  - - [1536, 2048, 1, 1024, 1568, 1568, 1536, 2048]
    - [61, 69.876]
  - - [1536, 2048, 1, 2048, 1568, 1568, 2080, 2080]
    - [15, 74.336]
  - - [1536, 2048, 1, 4096, 1568, 1568, 4128, 4128]
    - [18, 77.162]
  - - [1536, 4096, 1, 64, 1568, 1568, 1536, 4096]
    - [55, 36.571]
  - - [1536, 4096, 1, 128, 1568, 1568, 1536, 4096]
    - [6, 53.296]
  - - [1536, 4096, 1, 256, 1568, 1568, 1536, 4096]
    - [12, 63.451]
  - - [1536, 4096, 1, 512, 1568, 1568, 1536, 4096]
    - [39, 72.697]
  - - [1536, 4096, 1, 1024, 1568, 1568, 1536, 4096]
    - [40, 79.138]
  - - [1536, 4096, 1, 2048, 1568, 1568, 2080, 4096]
    - [12, 82.028]
  - - [1536, 4096, 1, 4096, 1568, 1568, 4128, 4128]
    - [5, 82.595]
  - - [3072, 64, 1, 64, 3104, 3104, 3072, 96]
    - [144, 3.812]
  - - [3072, 64, 1, 128, 3104, 3104, 3072, 160]
    - [148, 6.889]
  - - [3072, 64, 1, 256, 3104, 3104, 3072, 288]
    - [109, 11.509]
  - - [3072, 64, 1, 512, 3104, 3104, 3072, 544]
    - [126, 17.515]
  - - [3072, 64, 1, 1024, 3104, 3104, 3072, 1056]
    - [126, 23.717]
  - - [3072, 64, 1, 2048, 3104, 3104, 3072, 2080]
    - [126, 29.005]
  - - [3072, 64, 1, 4096, 3104, 3104, 4128, 4128]
    - [107, 30.561]
  - - [3072, 128, 1, 64, 3104, 3104, 3072, 128]
    - [107, 6.738]
  - - [3072, 128, 1, 128, 3104, 3104, 3072, 160]
    - [142, 11.337]
  - - [3072, 128, 1, 256, 3104, 3104, 3072, 288]
    - [124, 17.456]
  - - [3072, 128, 1, 512, 3104, 3104, 3072, 544]
    - [136, 23.897]
  - - [3072, 128, 1, 1024, 3104, 3104, 3072, 1056]
    - [105, 29.168]
  - - [3072, 128, 1, 2048, 3104, 3104, 3072, 2080]
    - [102, 31.439]
  - - [3072, 128, 1, 4096, 3104, 3104, 4128, 4128]
    - [135, 34.066]
  - - [3072, 256, 1, 64, 3104, 3104, 3072, 256]
    - [105, 11.589]
  - - [3072, 256, 1, 128, 3104, 3104, 3072, 256]
    - [26, 18.695]
  - - [3072, 256, 1, 256, 3104, 3104, 3072, 288]
    - [43, 29.359]
  - - [3072, 256, 1, 512, 3104, 3104, 3072, 544]
    - [16, 40.847]
  - - [3072, 256, 1, 1024, 3104, 3104, 3072, 1056]
    - [41, 50.923]
  - - [3072, 256, 1, 2048, 3104, 3104, 3072, 2080]
    - [41, 55.889]
  - - [3072, 256, 1, 4096, 3104, 3104, 4128, 4128]
    - [44, 61.108]
  - - [3072, 512, 1, 64, 3104, 3104, 3072, 512]
    - [117, 18.941]
  - - [3072, 512, 1, 128, 3104, 3104, 3072, 512]
    - [17, 29.049]
  - - [3072, 512, 1, 256, 3104, 3104, 3072, 512]
    - [41, 42.36]
  - - [3072, 512, 1, 512, 3104, 3104, 3072, 544]
    - [43, 54.171]
  - - [3072, 512, 1, 1024, 3104, 3104, 3072, 1056]
    - [18, 59.699]
  - - [3072, 512, 1, 2048, 3104, 3104, 3072, 2080]
    - [50, 65.621]
  - - [3072, 512, 1, 4096, 3104, 3104, 4128, 4128]
    - [60, 68.794]
  - - [3072, 1024, 1, 64, 3104, 3104, 3072, 1024]
    - [117, 27.732]
  - - [3072, 1024, 1, 128, 3104, 3104, 3072, 1024]
    - [62, 41.47]
  - - [3072, 1024, 1, 256, 3104, 3104, 3072, 1024]
    - [20, 55.188]
  - - [3072, 1024, 1, 512, 3104, 3104, 3072, 1024]
    - [58, 62.522]
  - - [3072, 1024, 1, 1024, 3104, 3104, 3072, 1056]
    - [58, 69.183]
  - - [3072, 1024, 1, 2048, 3104, 3104, 3072, 2080]
    - [51, 73.916]
  - - [3072, 1024, 1, 4096, 3104, 3104, 4128, 4128]
    - [23, 77.112]
  - - [3072, 2048, 1, 64, 3104, 3104, 3072, 2048]
    - [21, 36.853]
  - - [3072, 2048, 1, 128, 3104, 3104, 3072, 2048]
    - [7, 53.514]
  - - [3072, 2048, 1, 256, 3104, 3104, 3072, 2048]
    - [12, 63.559]
  - - [3072, 2048, 1, 512, 3104, 3104, 3072, 2048]
    - [46, 72.52]
  - - [3072, 2048, 1, 1024, 3104, 3104, 3072, 2048]
    - [12, 78.835]
  - - [3072, 2048, 1, 2048, 3104, 3104, 3072, 2080]
    - [45, 82.262]
  - - [3072, 2048, 1, 4096, 3104, 3104, 4128, 4128]
    - [7, 82.508]
  - - [3072, 4096, 1, 64, 3104, 3104, 3072, 4096]
    - [47, 44.544]
  - - [3072, 4096, 1, 128, 3104, 3104, 3072, 4096]
    - [53, 59.939]
  - - [3072, 4096, 1, 256, 3104, 3104, 3072, 4096]
    - [27, 72.074]
  - - [3072, 4096, 1, 512, 3104, 3104, 3072, 4096]
    - [40, 79.122]
  - - [3072, 4096, 1, 1024, 3104, 3104, 3072, 4096]
    - [39, 83.12]
  - - [3072, 4096, 1, 2048, 3104, 3104, 3072, 4096]
    - [22, 84.801]
  - - [3072, 4096, 1, 4096, 3104, 3104, 4128, 4128]
    - [36, 86.205]
- null
- null
- DeviceEfficiency
