library/src/blas3/Tensile/Logic/asm_full/navi32/navi32_Cijk_Ailk_Bljk_HHS_BH.yaml
- {MinimumRequiredVersion: 4.35.0}
- navi32
- gfx1101
- [Device 73f0]
    SolutionIndex: 0
    SolutionNameMin: Cijk_Ailk_Bljk_HHS_BH_MT64x64x16_MI16x16x16x1_SN_1LDSB0_AMAS3_GRVW8_IU1_NLCA1_SIA1_SU0_SUS0_SVW2_TT2_32_VW2_WGM4
    SolutionIndex: 1
    SolutionNameMin: Cijk_Ailk_Bljk_HHS_BH_MT64x64x16_MI16x16x16x1_SN_1LDSB1_AMAS3_GRVW4_IU1_NLCA1_SIA2_SU0_SUS0_SVW2_TT2_32_VW2_WGM4
    SolutionIndex: 2
    SolutionNameMin: Cijk_Ailk_Bljk_HHS_BH_MT64x64x16_MI16x16x16x1_SN_1LDSB1_AMAS3_GRVW8_IU1_NLCA1_SIA2_SU0_SUS0_SVW2_TT2_32_VW2_WGM4
    SolutionIndex: 3
    SolutionNameMin: Cijk_Ailk_Bljk_HHS_BH_MT64x64x16_MI16x16x16x1_SN_1LDSB1_AMAS3_GRVW8_IU1_NLCA1_SIA2_SU32_SUS256_SVW2_TT2_32_VW2_WGM4
    SolutionIndex: 4
    SolutionNameMin: Cijk_Ailk_Bljk_HHS_BH_MT64x64x16_MI16x16x16x1_SN_1LDSB0_AMAS3_GRVW4_IU1_NLCA1_SIA1_SU0_SUS0_SVW2_TT2_32_VW2_WGM8
    SolutionIndex: 5
    SolutionNameMin: Cijk_Ailk_Bljk_HHS_BH_MT64x64x16_MI16x16x16x1_SN_1LDSB0_AMAS3_GRVW8_IU1_NLCA1_SIA1_SU0_SUS0_SVW2_TT2_32_VW2_WGM8
    SolutionIndex: 6
    SolutionNameMin: Cijk_Ailk_Bljk_HHS_BH_MT64x64x16_MI16x16x16x1_SN_1LDSB1_AMAS3_GRVW4_IU1_NLCA1_SIA2_SU0_SUS0_SVW2_TT2_32_VW2_WGM8
    SolutionIndex: 7
    SolutionNameMin: Cijk_Ailk_Bljk_HHS_BH_MT64x64x16_MI16x16x16x1_SN_1LDSB1_AMAS3_GRVW8_IU1_NLCA1_SIA2_SU0_SUS0_SVW2_TT2_32_VW2_WGM8
    SolutionIndex: 8
    SolutionNameMin: Cijk_Ailk_Bljk_HHS_BH_MT64x64x16_MI16x16x16x1_SN_1LDSB0_AMAS3_GRVW4_IU1_NLCA1_SIA1_SU32_SUS256_SVW2_TT2_32_VW2_WGM8
    SolutionIndex: 9
    SolutionNameMin: Cijk_Ailk_Bljk_HHS_BH_MT64x64x16_MI16x16x16x1_SN_1LDSB1_AMAS3_GRVW8_IU1_NLCA1_SIA2_SU32_SUS256_SVW2_TT2_32_VW2_WGM8
    SolutionIndex: 10
    SolutionNameMin: Cijk_Ailk_Bljk_HHS_BH_MT128x128x16_MI16x16x16x1_SN_1LDSB0_AMAS3_GRVW4_IU1_NLCA1_SIA1_SU0_SUS0_SVW2_TT4_64_VW2_WGM4
    SolutionIndex: 11
    SolutionNameMin: Cijk_Ailk_Bljk_HHS_BH_MT128x128x16_MI16x16x16x1_SN_1LDSB0_AMAS3_GRVW8_IU1_NLCA1_SIA1_SU0_SUS0_SVW2_TT4_64_VW2_WGM4
    SolutionIndex: 12
    SolutionNameMin: Cijk_Ailk_Bljk_HHS_BH_MT128x128x16_MI16x16x16x1_SN_1LDSB1_AMAS3_GRVW4_IU1_NLCA1_SIA2_SU0_SUS0_SVW2_TT4_64_VW2_WGM4
    SolutionIndex: 13
    SolutionNameMin: Cijk_Ailk_Bljk_HHS_BH_MT128x128x16_MI16x16x16x1_SN_1LDSB1_AMAS3_GRVW8_IU1_NLCA1_SIA2_SU0_SUS0_SVW2_TT4_64_VW2_WGM4
    SolutionIndex: 14
    SolutionNameMin: Cijk_Ailk_Bljk_HHS_BH_MT128x128x16_MI16x16x16x1_SN_1LDSB0_AMAS3_GRVW2_IU1_NLCA2_SIA3_SU0_SUS0_SVW2_TT4_64_VW2_WGM4
    SolutionIndex: 15
    SolutionNameMin: Cijk_Ailk_Bljk_HHS_BH_MT128x128x16_MI16x16x16x1_SN_1LDSB0_AMAS3_GRVW8_IU1_NLCA1_SIA3_SU0_SUS0_SVW2_TT4_64_VW2_WGM4
    SolutionIndex: 16
    SolutionNameMin: Cijk_Ailk_Bljk_HHS_BH_MT128x128x16_MI16x16x16x1_SN_1LDSB0_AMAS3_GRVW8_IU1_NLCA1_SIA1_SU32_SUS128_SVW2_TT4_64_VW2_WGM4
    SolutionIndex: 17
    SolutionNameMin: Cijk_Ailk_Bljk_HHS_BH_MT128x128x16_MI16x16x16x1_SN_1LDSB0_AMAS0_GRVW2_IU1_NLCA2_SIA3_SU32_SUS128_SVW1_TT4_64_VW1_WGM4
    SolutionIndex: 18
    SolutionNameMin: Cijk_Ailk_Bljk_HHS_BH_MT128x128x16_MI16x16x16x1_SN_1LDSB0_AMAS3_GRVW2_IU1_NLCA2_SIA3_SU32_SUS128_SVW2_TT4_64_VW2_WGM4
    SolutionIndex: 19
    SolutionNameMin: Cijk_Ailk_Bljk_HHS_BH_MT128x128x16_MI16x16x16x1_SN_1LDSB0_AMAS0_GRVW2_IU1_NLCA2_SIA3_SU32_SUS256_SVW1_TT4_64_VW1_WGM4
    SolutionIndex: 20
    SolutionNameMin: Cijk_Ailk_Bljk_HHS_BH_MT128x128x16_MI16x16x16x1_SN_1LDSB0_AMAS3_GRVW2_IU1_NLCA2_SIA3_SU32_SUS256_SVW2_TT4_64_VW2_WGM4
    SolutionIndex: 21
    SolutionNameMin: Cijk_Ailk_Bljk_HHS_BH_MT128x128x16_MI16x16x16x1_SN_1LDSB0_AMAS3_GRVW8_IU1_NLCA1_SIA3_SU32_SUS256_SVW2_TT4_64_VW2_WGM4
    SolutionIndex: 22
    SolutionNameMin: Cijk_Ailk_Bljk_HHS_BH_MT128x128x16_MI16x16x16x1_SN_1LDSB0_AMAS3_GRVW8_IU1_NLCA1_SIA1_SU0_SUS0_SVW2_TT4_64_VW2_WGM8
    SolutionIndex: 23
    SolutionNameMin: Cijk_Ailk_Bljk_HHS_BH_MT128x128x16_MI16x16x16x1_SN_1LDSB1_AMAS3_GRVW4_IU1_NLCA1_SIA2_SU0_SUS0_SVW2_TT4_64_VW2_WGM8
    SolutionIndex: 24
    SolutionNameMin: Cijk_Ailk_Bljk_HHS_BH_MT128x128x16_MI16x16x16x1_SN_1LDSB1_AMAS3_GRVW8_IU1_NLCA1_SIA2_SU0_SUS0_SVW2_TT4_64_VW2_WGM8
    SolutionIndex: 25
    SolutionNameMin: Cijk_Ailk_Bljk_HHS_BH_MT128x128x16_MI16x16x16x1_SN_1LDSB0_AMAS3_GRVW2_IU1_NLCA2_SIA3_SU0_SUS0_SVW2_TT4_64_VW2_WGM8
    SolutionIndex: 26
    SolutionNameMin: Cijk_Ailk_Bljk_HHS_BH_MT128x128x16_MI16x16x16x1_SN_1LDSB0_AMAS3_GRVW8_IU1_NLCA1_SIA3_SU0_SUS0_SVW2_TT4_64_VW2_WGM8
    SolutionIndex: 27
    SolutionNameMin: Cijk_Ailk_Bljk_HHS_BH_MT128x128x16_MI16x16x16x1_SN_1LDSB0_AMAS3_GRVW4_IU1_NLCA1_SIA1_SU32_SUS128_SVW2_TT4_64_VW2_WGM8
    SolutionIndex: 28
    SolutionNameMin: Cijk_Ailk_Bljk_HHS_BH_MT128x128x16_MI16x16x16x1_SN_1LDSB0_AMAS3_GRVW8_IU1_NLCA1_SIA1_SU32_SUS128_SVW2_TT4_64_VW2_WGM8
    SolutionIndex: 29
    SolutionNameMin: Cijk_Ailk_Bljk_HHS_BH_MT128x128x16_MI16x16x16x1_SN_1LDSB0_AMAS3_GRVW2_IU1_NLCA2_SIA3_SU32_SUS128_SVW2_TT4_64_VW2_WGM8
    SolutionIndex: 30
    SolutionNameMin: Cijk_Ailk_Bljk_HHS_BH_MT128x128x16_MI16x16x16x1_SN_1LDSB0_AMAS3_GRVW4_IU1_NLCA1_SIA1_SU32_SUS256_SVW2_TT4_64_VW2_WGM8
    SolutionIndex: 31
    SolutionNameMin: Cijk_Ailk_Bljk_HHS_BH_MT128x128x16_MI16x16x16x1_SN_1LDSB0_AMAS3_GRVW8_IU1_NLCA1_SIA1_SU32_SUS256_SVW2_TT4_64_VW2_WGM8
    SolutionIndex: 32
    SolutionNameMin: Cijk_Ailk_Bljk_HHS_BH_MT128x128x16_MI16x16x16x1_SN_1LDSB1_AMAS3_GRVW8_IU1_NLCA1_SIA2_SU32_SUS256_SVW2_TT4_64_VW2_WGM8
    SolutionIndex: 33
    SolutionNameMin: Cijk_Ailk_Bljk_HHS_BH_MT128x128x16_MI16x16x16x1_SN_1LDSB0_AMAS3_GRVW2_IU1_NLCA2_SIA3_SU32_SUS256_SVW2_TT4_64_VW2_WGM8
    SolutionIndex: 34
    SolutionNameMin: Cijk_Ailk_Bljk_HHS_BH_MT128x128x16_MI16x16x16x1_SN_1LDSB0_AMAS3_GRVW8_IU1_NLCA1_SIA3_SU32_SUS256_SVW2_TT4_64_VW2_WGM8
    SolutionIndex: 35
    SolutionNameMin: Cijk_Ailk_Bljk_HHS_BH_MT32x32x32_MI16x16x16x1_SN_1LDSB0_AMAS0_GRVW4_IU1_NLCA1_SIA1_SU0_SUS0_SVW1_TT1_16_VW1_WGM4
    SolutionIndex: 36
    SolutionNameMin: Cijk_Ailk_Bljk_HHS_BH_MT32x32x32_MI16x16x16x1_SN_1LDSB0_AMAS0_GRVW8_IU1_NLCA1_SIA1_SU0_SUS0_SVW1_TT1_16_VW1_WGM4
    SolutionIndex: 37
    SolutionNameMin: Cijk_Ailk_Bljk_HHS_BH_MT32x32x32_MI16x16x16x1_SN_1LDSB1_AMAS0_GRVW4_IU2_NLCA1_SIA2_SU0_SUS0_SVW1_TT1_16_VW1_WGM4
    SolutionIndex: 38
    SolutionNameMin: Cijk_Ailk_Bljk_HHS_BH_MT32x32x32_MI16x16x16x1_SN_1LDSB1_AMAS0_GRVW8_IU2_NLCA1_SIA2_SU0_SUS0_SVW1_TT1_16_VW1_WGM4
    SolutionIndex: 39
    SolutionNameMin: Cijk_Ailk_Bljk_HHS_BH_MT32x32x32_MI16x16x16x1_SN_1LDSB0_AMAS0_GRVW8_IU1_NLCA1_SIA3_SU0_SUS0_SVW1_TT1_16_VW1_WGM4
    SolutionIndex: 40
    SolutionNameMin: Cijk_Ailk_Bljk_HHS_BH_MT32x32x32_MI16x16x16x1_SN_1LDSB0_AMAS0_GRVW8_IU1_NLCA1_SIA1_SU32_SUS128_SVW1_TT1_16_VW1_WGM4
    SolutionIndex: 41
    SolutionNameMin: Cijk_Ailk_Bljk_HHS_BH_MT32x32x32_MI16x16x16x1_SN_1LDSB1_AMAS0_GRVW4_IU2_NLCA1_SIA2_SU32_SUS128_SVW1_TT1_16_VW1_WGM4
    SolutionIndex: 42
    SolutionNameMin: Cijk_Ailk_Bljk_HHS_BH_MT32x32x32_MI16x16x16x1_SN_1LDSB1_AMAS0_GRVW8_IU2_NLCA1_SIA2_SU32_SUS128_SVW1_TT1_16_VW1_WGM4
    SolutionIndex: 43
    SolutionNameMin: Cijk_Ailk_Bljk_HHS_BH_MT32x32x32_MI16x16x16x1_SN_1LDSB0_AMAS0_GRVW4_IU1_NLCA1_SIA1_SU32_SUS256_SVW1_TT1_16_VW1_WGM4
    SolutionIndex: 44
    SolutionNameMin: Cijk_Ailk_Bljk_HHS_BH_MT32x32x32_MI16x16x16x1_SN_1LDSB0_AMAS0_GRVW8_IU1_NLCA1_SIA1_SU32_SUS256_SVW1_TT1_16_VW1_WGM4
    SolutionIndex: 45
    SolutionNameMin: Cijk_Ailk_Bljk_HHS_BH_MT32x32x32_MI16x16x16x1_SN_1LDSB1_AMAS0_GRVW4_IU2_NLCA1_SIA2_SU32_SUS256_SVW1_TT1_16_VW1_WGM4
    SolutionIndex: 46
    SolutionNameMin: Cijk_Ailk_Bljk_HHS_BH_MT32x32x32_MI16x16x16x1_SN_1LDSB1_AMAS0_GRVW8_IU2_NLCA1_SIA2_SU32_SUS256_SVW1_TT1_16_VW1_WGM4
    SolutionIndex: 47
    SolutionNameMin: Cijk_Ailk_Bljk_HHS_BH_MT32x32x32_MI16x16x16x1_SN_1LDSB0_AMAS0_GRVW4_IU1_NLCA1_SIA1_SU0_SUS0_SVW1_TT1_16_VW1_WGM8
    SolutionIndex: 48
    SolutionNameMin: Cijk_Ailk_Bljk_HHS_BH_MT32x32x32_MI16x16x16x1_SN_1LDSB0_AMAS0_GRVW8_IU1_NLCA1_SIA1_SU0_SUS0_SVW1_TT1_16_VW1_WGM8
    SolutionIndex: 49
    SolutionNameMin: Cijk_Ailk_Bljk_HHS_BH_MT32x32x32_MI16x16x16x1_SN_1LDSB1_AMAS0_GRVW4_IU2_NLCA1_SIA2_SU0_SUS0_SVW1_TT1_16_VW1_WGM8
    SolutionIndex: 50
    SolutionNameMin: Cijk_Ailk_Bljk_HHS_BH_MT32x32x32_MI16x16x16x1_SN_1LDSB1_AMAS0_GRVW8_IU2_NLCA1_SIA2_SU0_SUS0_SVW1_TT1_16_VW1_WGM8
    SolutionIndex: 51
    SolutionNameMin: Cijk_Ailk_Bljk_HHS_BH_MT32x32x32_MI16x16x16x1_SN_1LDSB0_AMAS0_GRVW4_IU1_NLCA1_SIA1_SU32_SUS128_SVW1_TT1_16_VW1_WGM8
    SolutionIndex: 52
    SolutionNameMin: Cijk_Ailk_Bljk_HHS_BH_MT32x32x32_MI16x16x16x1_SN_1LDSB0_AMAS0_GRVW8_IU1_NLCA1_SIA1_SU32_SUS128_SVW1_TT1_16_VW1_WGM8
    SolutionIndex: 53
    SolutionNameMin: Cijk_Ailk_Bljk_HHS_BH_MT32x32x32_MI16x16x16x1_SN_1LDSB1_AMAS0_GRVW4_IU2_NLCA1_SIA2_SU32_SUS128_SVW1_TT1_16_VW1_WGM8
    SolutionIndex: 54
    SolutionNameMin: Cijk_Ailk_Bljk_HHS_BH_MT32x32x32_MI16x16x16x1_SN_1LDSB1_AMAS0_GRVW8_IU2_NLCA1_SIA2_SU32_SUS128_SVW1_TT1_16_VW1_WGM8
    SolutionIndex: 55
    SolutionNameMin: Cijk_Ailk_Bljk_HHS_BH_MT32x32x32_MI16x16x16x1_SN_1LDSB1_AMAS0_GRVW4_IU2_NLCA1_SIA2_SU32_SUS256_SVW1_TT1_16_VW1_WGM8
    SolutionIndex: 56
    SolutionNameMin: Cijk_Ailk_Bljk_HHS_BH_MT32x32x32_MI16x16x16x1_SN_1LDSB1_AMAS0_GRVW8_IU2_NLCA1_SIA2_SU32_SUS256_SVW1_TT1_16_VW1_WGM8
    SolutionIndex: 57
    SolutionNameMin: Cijk_Ailk_Bljk_HHS_BH_MT32x32x32_MI16x16x16x1_SN_1LDSB0_AMAS0_GRVW8_IU1_NLCA1_SIA3_SU32_SUS256_SVW1_TT1_16_VW1_WGM8
    SolutionIndex: 58
    SolutionNameMin: Cijk_Ailk_Bljk_HHS_BH_MT64x64x32_MI16x16x16x1_SN_1LDSB0_AMAS3_GRVW4_IU1_NLCA1_SIA1_SU0_SUS0_SVW2_TT2_32_VW2_WGM4
    SolutionIndex: 59
    SolutionNameMin: Cijk_Ailk_Bljk_HHS_BH_MT64x64x32_MI16x16x16x1_SN_1LDSB0_AMAS0_GRVW8_IU1_NLCA1_SIA1_SU0_SUS0_SVW1_TT2_32_VW1_WGM4
    SolutionIndex: 60
    SolutionNameMin: Cijk_Ailk_Bljk_HHS_BH_MT64x64x32_MI16x16x16x1_SN_1LDSB0_AMAS3_GRVW8_IU1_NLCA1_SIA1_SU0_SUS0_SVW2_TT2_32_VW2_WGM4
    SolutionIndex: 61
    SolutionNameMin: Cijk_Ailk_Bljk_HHS_BH_MT64x64x32_MI16x16x16x1_SN_1LDSB1_AMAS3_GRVW8_IU2_NLCA1_SIA2_SU0_SUS0_SVW2_TT2_32_VW2_WGM4
    SolutionIndex: 62
    SolutionNameMin: Cijk_Ailk_Bljk_HHS_BH_MT64x64x32_MI16x16x16x1_SN_1LDSB0_AMAS3_GRVW8_IU1_NLCA1_SIA3_SU0_SUS0_SVW2_TT2_32_VW2_WGM4
    SolutionIndex: 63
    SolutionNameMin: Cijk_Ailk_Bljk_HHS_BH_MT64x64x32_MI16x16x16x1_SN_1LDSB0_AMAS3_GRVW4_IU1_NLCA1_SIA1_SU32_SUS128_SVW2_TT2_32_VW2_WGM4
    SolutionIndex: 64
    SolutionNameMin: Cijk_Ailk_Bljk_HHS_BH_MT64x64x32_MI16x16x16x1_SN_1LDSB0_AMAS3_GRVW8_IU1_NLCA1_SIA1_SU32_SUS128_SVW2_TT2_32_VW2_WGM4
    SolutionIndex: 65
    SolutionNameMin: Cijk_Ailk_Bljk_HHS_BH_MT64x64x32_MI16x16x16x1_SN_1LDSB1_AMAS3_GRVW8_IU2_NLCA1_SIA2_SU32_SUS128_SVW2_TT2_32_VW2_WGM4
    SolutionIndex: 66
    SolutionNameMin: Cijk_Ailk_Bljk_HHS_BH_MT64x64x32_MI16x16x16x1_SN_1LDSB0_AMAS3_GRVW8_IU1_NLCA1_SIA3_SU32_SUS128_SVW2_TT2_32_VW2_WGM4
    SolutionIndex: 67
    SolutionNameMin: Cijk_Ailk_Bljk_HHS_BH_MT64x64x32_MI16x16x16x1_SN_1LDSB0_AMAS3_GRVW4_IU1_NLCA1_SIA1_SU32_SUS256_SVW2_TT2_32_VW2_WGM4
    SolutionIndex: 68
    SolutionNameMin: Cijk_Ailk_Bljk_HHS_BH_MT64x64x32_MI16x16x16x1_SN_1LDSB0_AMAS3_GRVW8_IU1_NLCA1_SIA1_SU32_SUS256_SVW2_TT2_32_VW2_WGM4
    SolutionIndex: 69
    SolutionNameMin: Cijk_Ailk_Bljk_HHS_BH_MT64x64x32_MI16x16x16x1_SN_1LDSB1_AMAS3_GRVW8_IU2_NLCA1_SIA2_SU32_SUS256_SVW2_TT2_32_VW2_WGM4
    SolutionIndex: 70
    SolutionNameMin: Cijk_Ailk_Bljk_HHS_BH_MT64x64x32_MI16x16x16x1_SN_1LDSB0_AMAS3_GRVW8_IU1_NLCA1_SIA3_SU32_SUS256_SVW2_TT2_32_VW2_WGM4
    SolutionIndex: 71
    SolutionNameMin: Cijk_Ailk_Bljk_HHS_BH_MT64x64x32_MI16x16x16x1_SN_1LDSB0_AMAS3_GRVW4_IU1_NLCA1_SIA1_SU0_SUS0_SVW2_TT2_32_VW2_WGM8
    SolutionIndex: 72
    SolutionNameMin: Cijk_Ailk_Bljk_HHS_BH_MT64x64x32_MI16x16x16x1_SN_1LDSB0_AMAS3_GRVW8_IU1_NLCA1_SIA1_SU0_SUS0_SVW2_TT2_32_VW2_WGM8
    SolutionIndex: 73
    SolutionNameMin: Cijk_Ailk_Bljk_HHS_BH_MT64x64x32_MI16x16x16x1_SN_1LDSB1_AMAS3_GRVW4_IU2_NLCA1_SIA2_SU0_SUS0_SVW2_TT2_32_VW2_WGM8
    SolutionIndex: 74
    SolutionNameMin: Cijk_Ailk_Bljk_HHS_BH_MT64x64x32_MI16x16x16x1_SN_1LDSB1_AMAS3_GRVW8_IU2_NLCA1_SIA2_SU0_SUS0_SVW2_TT2_32_VW2_WGM8
    SolutionIndex: 75
    SolutionNameMin: Cijk_Ailk_Bljk_HHS_BH_MT64x64x32_MI16x16x16x1_SN_1LDSB0_AMAS3_GRVW8_IU1_NLCA1_SIA3_SU0_SUS0_SVW2_TT2_32_VW2_WGM8
    SolutionIndex: 76
    SolutionNameMin: Cijk_Ailk_Bljk_HHS_BH_MT64x64x32_MI16x16x16x1_SN_1LDSB0_AMAS3_GRVW4_IU1_NLCA1_SIA1_SU32_SUS128_SVW2_TT2_32_VW2_WGM8
    SolutionIndex: 77
    SolutionNameMin: Cijk_Ailk_Bljk_HHS_BH_MT64x64x32_MI16x16x16x1_SN_1LDSB0_AMAS3_GRVW8_IU1_NLCA1_SIA1_SU32_SUS128_SVW2_TT2_32_VW2_WGM8
    SolutionIndex: 78
    SolutionNameMin: Cijk_Ailk_Bljk_HHS_BH_MT64x64x32_MI16x16x16x1_SN_1LDSB1_AMAS3_GRVW8_IU2_NLCA1_SIA2_SU32_SUS128_SVW2_TT2_32_VW2_WGM8
    SolutionIndex: 79
    SolutionNameMin: Cijk_Ailk_Bljk_HHS_BH_MT64x64x32_MI16x16x16x1_SN_1LDSB0_AMAS3_GRVW8_IU1_NLCA1_SIA3_SU32_SUS128_SVW2_TT2_32_VW2_WGM8
    SolutionIndex: 80
    SolutionNameMin: Cijk_Ailk_Bljk_HHS_BH_MT64x64x32_MI16x16x16x1_SN_1LDSB0_AMAS3_GRVW8_IU1_NLCA1_SIA1_SU32_SUS256_SVW2_TT2_32_VW2_WGM8
    SolutionIndex: 81
    SolutionNameMin: Cijk_Ailk_Bljk_HHS_BH_MT64x64x32_MI16x16x16x1_SN_1LDSB1_AMAS0_GRVW4_IU2_NLCA1_SIA2_SU32_SUS256_SVW1_TT2_32_VW1_WGM8
    SolutionIndex: 82
    SolutionNameMin: Cijk_Ailk_Bljk_HHS_BH_MT64x64x32_MI16x16x16x1_SN_1LDSB1_AMAS3_GRVW8_IU2_NLCA1_SIA2_SU32_SUS256_SVW2_TT2_32_VW2_WGM8
    SolutionIndex: 83
    SolutionNameMin: Cijk_Ailk_Bljk_HHS_BH_MT64x64x32_MI16x16x16x1_SN_1LDSB0_AMAS3_GRVW8_IU1_NLCA1_SIA3_SU32_SUS256_SVW2_TT2_32_VW2_WGM8
- - - [64, 64, 1, 64, 96, 96, 96, 96]
    - [49, 0.092]
  - - [64, 64, 1, 128, 96, 96, 160, 160]
    - [50, 0.175]
  - - [64, 64, 1, 256, 96, 96, 288, 288]
    - [37, 0.323]
  - - [64, 64, 1, 512, 96, 96, 544, 544]
    - [56, 0.552]
  - - [64, 64, 1, 1024, 96, 96, 1056, 1056]
    - [49, 0.867]
  - - [64, 64, 1, 2048, 96, 96, 2080, 2080]
    - [49, 1.207]
  - - [64, 64, 1, 4096, 96, 96, 4128, 4128]
    - [49, 1.501]
  - - [64, 128, 1, 64, 96, 96, 96, 96]
    - [37, 0.187]
  - - [64, 128, 1, 128, 96, 96, 160, 160]
    - [54, 0.356]
  - - [64, 128, 1, 256, 96, 96, 288, 288]
    - [55, 0.654]
  - - [64, 128, 1, 512, 96, 96, 544, 544]
    - [46, 1.12]
  - - [64, 128, 1, 1024, 96, 96, 1056, 1056]
    - [37, 1.754]
  - - [64, 128, 1, 2048, 96, 96, 2080, 2080]
    - [37, 2.435]
  - - [64, 128, 1, 4096, 96, 96, 4128, 4128]
    - [49, 3.025]
  - - [64, 256, 1, 64, 96, 96, 96, 96]
    - [39, 0.374]
  - - [64, 256, 1, 128, 96, 96, 160, 160]
    - [46, 0.719]
  - - [64, 256, 1, 256, 96, 96, 288, 288]
    - [50, 1.316]
  - - [64, 256, 1, 512, 96, 96, 544, 544]
    - [46, 2.244]
  - - [64, 256, 1, 1024, 96, 96, 1056, 1056]
    - [49, 3.538]
  - - [64, 256, 1, 2048, 96, 96, 2080, 2080]
    - [49, 4.88]
  - - [64, 256, 1, 4096, 96, 96, 4128, 4128]
    - [49, 6.048]
  - - [64, 512, 1, 64, 96, 96, 96, 96]
    - [46, 0.742]
  - - [64, 512, 1, 128, 96, 96, 160, 160]
    - [45, 1.406]
  - - [64, 512, 1, 256, 96, 96, 288, 288]
    - [50, 2.54]
  - - [64, 512, 1, 512, 96, 96, 544, 544]
    - [54, 4.239]
  - - [64, 512, 1, 1024, 96, 96, 1056, 1056]
    - [50, 6.433]
  - - [64, 512, 1, 2048, 96, 96, 2080, 2080]
    - [46, 8.586]
  - - [64, 512, 1, 4096, 96, 96, 4128, 4128]
    - [50, 10.331]
  - - [64, 1024, 1, 64, 96, 96, 96, 96]
    - [48, 1.446]
  - - [64, 1024, 1, 128, 96, 96, 160, 160]
    - [47, 2.706]
  - - [64, 1024, 1, 256, 96, 96, 288, 288]
    - [48, 4.813]
  - - [64, 1024, 1, 512, 96, 96, 544, 544]
    - [35, 7.786]
  - - [64, 1024, 1, 1024, 96, 96, 1056, 1056]
    - [35, 11.262]
  - - [64, 1024, 1, 2048, 96, 96, 2080, 2080]
    - [36, 14.538]
  - - [64, 1024, 1, 4096, 96, 96, 4128, 4128]
    - [36, 16.879]
  - - [64, 2048, 1, 64, 96, 96, 96, 96]
    - [52, 2.753]
  - - [64, 2048, 1, 128, 96, 96, 160, 160]
    - [74, 4.989]
  - - [64, 2048, 1, 256, 96, 96, 288, 288]
    - [63, 8.482]
  - - [64, 2048, 1, 512, 96, 96, 544, 544]
    - [68, 13.149]
  - - [64, 2048, 1, 1024, 96, 96, 1056, 1056]
    - [68, 18.178]
  - - [64, 2048, 1, 2048, 96, 96, 2080, 2080]
    - [67, 22.599]
  - - [64, 2048, 1, 4096, 96, 96, 4128, 4128]
    - [76, 25.629]
  - - [64, 4096, 1, 64, 96, 96, 96, 96]
    - [6, 5.211]
  - - [64, 4096, 1, 128, 96, 96, 160, 160]
    - [79, 9.186]
  - - [64, 4096, 1, 256, 96, 96, 288, 288]
    - [66, 14.973]
  - - [64, 4096, 1, 512, 96, 96, 544, 544]
    - [64, 21.769]
  - - [64, 4096, 1, 1024, 96, 96, 1056, 1056]
    - [60, 28.344]
  - - [64, 4096, 1, 2048, 96, 96, 2080, 2080]
    - [72, 33.491]
  - - [64, 4096, 1, 4096, 96, 96, 4128, 4128]
    - [77, 35.402]
  - - [128, 64, 1, 64, 160, 160, 128, 96]
    - [56, 0.185]
  - - [128, 64, 1, 128, 160, 160, 160, 160]
    - [54, 0.358]
  - - [128, 64, 1, 256, 160, 160, 288, 288]
    - [55, 0.651]
  - - [128, 64, 1, 512, 160, 160, 544, 544]
    - [53, 1.121]
  - - [128, 64, 1, 1024, 160, 160, 1056, 1056]
    - [37, 1.751]
  - - [128, 64, 1, 2048, 160, 160, 2080, 2080]
    - [49, 2.423]
  - - [128, 64, 1, 4096, 160, 160, 4128, 4128]
    - [37, 3.012]
  - - [128, 128, 1, 64, 160, 160, 128, 96]
    - [56, 0.372]
  - - [128, 128, 1, 128, 160, 160, 160, 160]
    - [41, 0.713]
  - - [128, 128, 1, 256, 160, 160, 288, 288]
    - [54, 1.319]
  - - [128, 128, 1, 512, 160, 160, 544, 544]
    - [55, 2.264]
  - - [128, 128, 1, 1024, 160, 160, 1056, 1056]
    - [37, 3.526]
  - - [128, 128, 1, 2048, 160, 160, 2080, 2080]
    - [49, 4.883]
  - - [128, 128, 1, 4096, 160, 160, 4128, 4128]
    - [49, 6.068]
  - - [128, 256, 1, 64, 160, 160, 128, 96]
    - [40, 0.738]
  - - [128, 256, 1, 128, 160, 160, 160, 160]
    - [50, 1.4]
  - - [128, 256, 1, 256, 160, 160, 288, 288]
    - [55, 2.54]
  - - [128, 256, 1, 512, 160, 160, 544, 544]
    - [50, 4.234]
  - - [128, 256, 1, 1024, 160, 160, 1056, 1056]
    - [50, 6.42]
  - - [128, 256, 1, 2048, 160, 160, 2080, 2080]
    - [50, 8.596]
  - - [128, 256, 1, 4096, 160, 160, 4128, 4128]
    - [38, 10.333]
  - - [128, 512, 1, 64, 160, 160, 128, 96]
    - [57, 1.447]
  - - [128, 512, 1, 128, 160, 160, 160, 160]
    - [35, 2.722]
  - - [128, 512, 1, 256, 160, 160, 288, 288]
    - [36, 4.806]
  - - [128, 512, 1, 512, 160, 160, 544, 544]
    - [36, 7.759]
  - - [128, 512, 1, 1024, 160, 160, 1056, 1056]
    - [36, 11.279]
  - - [128, 512, 1, 2048, 160, 160, 2080, 2080]
    - [36, 14.456]
  - - [128, 512, 1, 4096, 160, 160, 4128, 4128]
    - [52, 16.949]
  - - [128, 1024, 1, 64, 160, 160, 128, 96]
    - [46, 2.773]
  - - [128, 1024, 1, 128, 160, 160, 160, 160]
    - [60, 5.017]
  - - [128, 1024, 1, 256, 160, 160, 288, 288]
    - [72, 8.688]
  - - [128, 1024, 1, 512, 160, 160, 544, 544]
    - [72, 13.531]
  - - [128, 1024, 1, 1024, 160, 160, 1056, 1056]
    - [60, 18.959]
  - - [128, 1024, 1, 2048, 160, 160, 2080, 2080]
    - [72, 23.614]
  - - [128, 1024, 1, 4096, 160, 160, 4128, 4128]
    - [72, 26.855]
  - - [128, 2048, 1, 64, 160, 160, 128, 96]
    - [1, 5.215]
  - - [128, 2048, 1, 128, 160, 160, 160, 160]
    - [75, 9.274]
  - - [128, 2048, 1, 256, 160, 160, 288, 288]
    - [62, 15.095]
  - - [128, 2048, 1, 512, 160, 160, 544, 544]
    - [0, 22.14]
  - - [128, 2048, 1, 1024, 160, 160, 1056, 1056]
    - [62, 28.776]
  - - [128, 2048, 1, 2048, 160, 160, 2080, 2080]
    - [60, 33.841]
  - - [128, 2048, 1, 4096, 160, 160, 4128, 4128]
    - [60, 35.649]
  - - [128, 4096, 1, 64, 160, 160, 128, 96]
    - [72, 9.431]
  - - [128, 4096, 1, 128, 160, 160, 160, 160]
    - [72, 15.945]
  - - [128, 4096, 1, 256, 160, 160, 288, 288]
    - [72, 24.205]
  - - [128, 4096, 1, 512, 160, 160, 544, 544]
    - [71, 32.566]
  - - [128, 4096, 1, 1024, 160, 160, 1056, 1056]
    - [13, 39.818]
  - - [128, 4096, 1, 2048, 160, 160, 2080, 2080]
    - [23, 42.837]
  - - [128, 4096, 1, 4096, 160, 160, 4128, 4128]
    - [12, 46.659]
  - - [256, 64, 1, 64, 288, 288, 256, 96]
    - [50, 0.372]
  - - [256, 64, 1, 128, 288, 288, 256, 160]
    - [50, 0.717]
  - - [256, 64, 1, 256, 288, 288, 288, 288]
    - [46, 1.311]
  - - [256, 64, 1, 512, 288, 288, 544, 544]
    - [46, 2.258]
  - - [256, 64, 1, 1024, 288, 288, 1056, 1056]
    - [49, 3.523]
  - - [256, 64, 1, 2048, 288, 288, 2080, 2080]
    - [55, 4.855]
  - - [256, 64, 1, 4096, 288, 288, 4128, 4128]
    - [53, 6.025]
  - - [256, 128, 1, 64, 288, 288, 256, 96]
    - [54, 0.747]
  - - [256, 128, 1, 128, 288, 288, 256, 160]
    - [49, 1.404]
  - - [256, 128, 1, 256, 288, 288, 288, 288]
    - [54, 2.54]
  - - [256, 128, 1, 512, 288, 288, 544, 544]
    - [56, 4.239]
  - - [256, 128, 1, 1024, 288, 288, 1056, 1056]
    - [50, 6.421]
  - - [256, 128, 1, 2048, 288, 288, 2080, 2080]
    - [49, 8.555]
  - - [256, 128, 1, 4096, 288, 288, 4128, 4128]
    - [38, 10.3]
  - - [256, 256, 1, 64, 288, 288, 256, 96]
    - [44, 1.434]
  - - [256, 256, 1, 128, 288, 288, 256, 160]
    - [43, 2.703]
  - - [256, 256, 1, 256, 288, 288, 288, 288]
    - [43, 4.792]
  - - [256, 256, 1, 512, 288, 288, 544, 544]
    - [36, 7.795]
  - - [256, 256, 1, 1024, 288, 288, 1056, 1056]
    - [44, 11.261]
  - - [256, 256, 1, 2048, 288, 288, 2080, 2080]
    - [51, 14.458]
  - - [256, 256, 1, 4096, 288, 288, 4128, 4128]
    - [52, 16.974]
  - - [256, 512, 1, 64, 288, 288, 256, 96]
    - [36, 2.749]
  - - [256, 512, 1, 128, 288, 288, 256, 160]
    - [72, 5.012]
  - - [256, 512, 1, 256, 288, 288, 288, 288]
    - [60, 8.714]
  - - [256, 512, 1, 512, 288, 288, 544, 544]
    - [72, 13.722]
  - - [256, 512, 1, 1024, 288, 288, 1056, 1056]
    - [59, 19.107]
  - - [256, 512, 1, 2048, 288, 288, 2080, 2080]
    - [72, 23.847]
  - - [256, 512, 1, 4096, 288, 288, 4128, 4128]
    - [60, 27.152]
  - - [256, 1024, 1, 64, 288, 288, 256, 96]
    - [2, 5.204]
  - - [256, 1024, 1, 128, 288, 288, 256, 160]
    - [8, 9.255]
  - - [256, 1024, 1, 256, 288, 288, 288, 288]
    - [5, 15.198]
  - - [256, 1024, 1, 512, 288, 288, 544, 544]
    - [5, 22.343]
  - - [256, 1024, 1, 1024, 288, 288, 1056, 1056]
    - [5, 28.808]
  - - [256, 1024, 1, 2048, 288, 288, 2080, 2080]
    - [62, 33.669]
  - - [256, 1024, 1, 4096, 288, 288, 4128, 4128]
    - [80, 35.472]
  - - [256, 2048, 1, 64, 288, 288, 256, 96]
    - [79, 9.423]
  - - [256, 2048, 1, 128, 288, 288, 256, 160]
    - [80, 15.976]
  - - [256, 2048, 1, 256, 288, 288, 288, 288]
    - [60, 24.34]
  - - [256, 2048, 1, 512, 288, 288, 544, 544]
    - [72, 32.798]
  - - [256, 2048, 1, 1024, 288, 288, 1056, 1056]
    - [22, 40.028]
  - - [256, 2048, 1, 2048, 288, 288, 2080, 2080]
    - [10, 43.4]
  - - [256, 2048, 1, 4096, 288, 288, 4128, 4128]
    - [11, 47.5]
  - - [256, 4096, 1, 64, 288, 288, 256, 96]
    - [3, 15.746]
  - - [256, 4096, 1, 128, 288, 288, 256, 160]
    - [5, 24.997]
  - - [256, 4096, 1, 256, 288, 288, 288, 288]
    - [80, 35.011]
  - - [256, 4096, 1, 512, 288, 288, 544, 544]
    - [77, 43.445]
  - - [256, 4096, 1, 1024, 288, 288, 1056, 1056]
    - [25, 50.807]
  - - [256, 4096, 1, 2048, 288, 288, 2080, 2080]
    - [14, 53.775]
  - - [256, 4096, 1, 4096, 288, 288, 4128, 4128]
    - [25, 56.799]
  - - [384, 64, 1, 64, 416, 416, 384, 96]
    - [50, 0.563]
  - - [384, 64, 1, 128, 416, 416, 384, 160]
    - [49, 1.078]
  - - [384, 64, 1, 256, 416, 416, 384, 288]
    - [56, 1.974]
  - - [384, 64, 1, 512, 416, 416, 544, 544]
    - [49, 3.369]
  - - [384, 64, 1, 1024, 416, 416, 1056, 1056]
    - [50, 5.296]
  - - [384, 64, 1, 2048, 416, 416, 2080, 2080]
    - [37, 7.342]
  - - [384, 64, 1, 4096, 416, 416, 4128, 4128]
    - [37, 9.099]
  - - [384, 128, 1, 64, 416, 416, 384, 96]
    - [52, 1.104]
  - - [384, 128, 1, 128, 416, 416, 384, 160]
    - [45, 2.088]
  - - [384, 128, 1, 256, 416, 416, 384, 288]
    - [37, 3.785]
  - - [384, 128, 1, 512, 416, 416, 544, 544]
    - [37, 6.33]
  - - [384, 128, 1, 1024, 416, 416, 1056, 1056]
    - [49, 9.581]
  - - [384, 128, 1, 2048, 416, 416, 2080, 2080]
    - [49, 12.802]
  - - [384, 128, 1, 4096, 416, 416, 4128, 4128]
    - [37, 15.344]
  - - [384, 256, 1, 64, 416, 416, 384, 96]
    - [77, 2.104]
  - - [384, 256, 1, 128, 416, 416, 384, 160]
    - [61, 3.892]
  - - [384, 256, 1, 256, 416, 416, 384, 288]
    - [61, 6.804]
  - - [384, 256, 1, 512, 416, 416, 544, 544]
    - [74, 10.739]
  - - [384, 256, 1, 1024, 416, 416, 1056, 1056]
    - [74, 15.211]
  - - [384, 256, 1, 2048, 416, 416, 2080, 2080]
    - [69, 19.089]
  - - [384, 256, 1, 4096, 416, 416, 4128, 4128]
    - [73, 21.961]
  - - [384, 512, 1, 64, 416, 416, 384, 96]
    - [74, 4.076]
  - - [384, 512, 1, 128, 416, 416, 384, 160]
    - [61, 7.469]
  - - [384, 512, 1, 256, 416, 416, 384, 288]
    - [60, 12.868]
  - - [384, 512, 1, 512, 416, 416, 544, 544]
    - [60, 20.076]
  - - [384, 512, 1, 1024, 416, 416, 1056, 1056]
    - [60, 27.895]
  - - [384, 512, 1, 2048, 416, 416, 2080, 2080]
    - [60, 34.651]
  - - [384, 512, 1, 4096, 416, 416, 4128, 4128]
    - [60, 39.326]
  - - [384, 1024, 1, 64, 416, 416, 384, 96]
    - [65, 7.484]
  - - [384, 1024, 1, 128, 416, 416, 384, 160]
    - [79, 12.79]
  - - [384, 1024, 1, 256, 416, 416, 384, 288]
    - [75, 20.123]
  - - [384, 1024, 1, 512, 416, 416, 544, 544]
    - [83, 28.127]
  - - [384, 1024, 1, 1024, 416, 416, 1056, 1056]
    - [75, 35.227]
  - - [384, 1024, 1, 2048, 416, 416, 2080, 2080]
    - [70, 39.752]
  - - [384, 1024, 1, 4096, 416, 416, 4128, 4128]
    - [70, 41.379]
  - - [384, 2048, 1, 64, 416, 416, 384, 96]
    - [78, 12.794]
  - - [384, 2048, 1, 128, 416, 416, 384, 160]
    - [13, 21.493]
  - - [384, 2048, 1, 256, 416, 416, 384, 288]
    - [13, 33.632]
  - - [384, 2048, 1, 512, 416, 416, 544, 544]
    - [13, 46.888]
  - - [384, 2048, 1, 1024, 416, 416, 1056, 1056]
    - [13, 58.467]
  - - [384, 2048, 1, 2048, 416, 416, 2080, 2080]
    - [13, 63.433]
  - - [384, 2048, 1, 4096, 416, 416, 4128, 4128]
    - [23, 69.267]
  - - [384, 4096, 1, 64, 416, 416, 384, 96]
    - [7, 20.834]
  - - [384, 4096, 1, 128, 416, 416, 384, 160]
    - [21, 31.384]
  - - [384, 4096, 1, 256, 416, 416, 384, 288]
    - [11, 43.667]
  - - [384, 4096, 1, 512, 416, 416, 544, 544]
    - [27, 54.828]
  - - [384, 4096, 1, 1024, 416, 416, 1056, 1056]
    - [29, 60.26]
  - - [384, 4096, 1, 2048, 416, 416, 2080, 2080]
    - [14, 66.061]
  - - [384, 4096, 1, 4096, 416, 416, 4128, 4128]
    - [19, 70.694]
  - - [768, 64, 1, 64, 800, 800, 768, 96]
    - [42, 1.112]
  - - [768, 64, 1, 128, 800, 800, 768, 160]
    - [49, 2.102]
  - - [768, 64, 1, 256, 800, 800, 768, 288]
    - [45, 3.8]
  - - [768, 64, 1, 512, 800, 800, 768, 544]
    - [38, 6.366]
  - - [768, 64, 1, 1024, 800, 800, 1056, 1056]
    - [37, 9.567]
  - - [768, 64, 1, 2048, 800, 800, 2080, 2080]
    - [37, 12.802]
  - - [768, 64, 1, 4096, 800, 800, 4128, 4128]
    - [37, 15.335]
  - - [768, 128, 1, 64, 800, 800, 768, 96]
    - [68, 2.113]
  - - [768, 128, 1, 128, 800, 800, 768, 160]
    - [82, 3.905]
  - - [768, 128, 1, 256, 800, 800, 768, 288]
    - [74, 6.793]
  - - [768, 128, 1, 512, 800, 800, 768, 544]
    - [74, 10.772]
  - - [768, 128, 1, 1024, 800, 800, 1056, 1056]
    - [74, 15.238]
  - - [768, 128, 1, 2048, 800, 800, 2080, 2080]
    - [61, 19.143]
  - - [768, 128, 1, 4096, 800, 800, 4128, 4128]
    - [74, 21.984]
  - - [768, 256, 1, 64, 800, 800, 768, 96]
    - [74, 4.103]
  - - [768, 256, 1, 128, 800, 800, 768, 160]
    - [80, 7.473]
  - - [768, 256, 1, 256, 800, 800, 768, 288]
    - [68, 12.718]
  - - [768, 256, 1, 512, 800, 800, 768, 544]
    - [60, 19.854]
  - - [768, 256, 1, 1024, 800, 800, 1056, 1056]
    - [60, 27.402]
  - - [768, 256, 1, 2048, 800, 800, 2080, 2080]
    - [72, 33.905]
  - - [768, 256, 1, 4096, 800, 800, 4128, 4128]
    - [72, 37.158]
  - - [768, 512, 1, 64, 800, 800, 768, 96]
    - [3, 7.459]
  - - [768, 512, 1, 128, 800, 800, 768, 160]
    - [72, 12.808]
  - - [768, 512, 1, 256, 800, 800, 768, 288]
    - [62, 20.081]
  - - [768, 512, 1, 512, 800, 800, 768, 544]
    - [83, 28.091]
  - - [768, 512, 1, 1024, 800, 800, 1056, 1056]
    - [83, 35.174]
  - - [768, 512, 1, 2048, 800, 800, 2080, 2080]
    - [83, 39.902]
  - - [768, 512, 1, 4096, 800, 800, 4128, 4128]
    - [83, 41.613]
  - - [768, 1024, 1, 64, 800, 800, 768, 96]
    - [61, 12.872]
  - - [768, 1024, 1, 128, 800, 800, 768, 160]
    - [32, 21.618]
  - - [768, 1024, 1, 256, 800, 800, 768, 288]
    - [24, 33.618]
  - - [768, 1024, 1, 512, 800, 800, 768, 544]
    - [24, 47.013]
  - - [768, 1024, 1, 1024, 800, 800, 1056, 1056]
    - [13, 58.459]
  - - [768, 1024, 1, 2048, 800, 800, 2080, 2080]
    - [11, 64.0]
  - - [768, 1024, 1, 4096, 800, 800, 4128, 4128]
    - [11, 69.976]
  - - [768, 2048, 1, 64, 800, 800, 768, 96]
    - [9, 20.723]
  - - [768, 2048, 1, 128, 800, 800, 768, 160]
    - [26, 31.321]
  - - [768, 2048, 1, 256, 800, 800, 768, 288]
    - [11, 43.792]
  - - [768, 2048, 1, 512, 800, 800, 768, 544]
    - [30, 55.137]
  - - [768, 2048, 1, 1024, 800, 800, 1056, 1056]
    - [28, 60.408]
  - - [768, 2048, 1, 2048, 800, 800, 2080, 2080]
    - [14, 66.891]
  - - [768, 2048, 1, 4096, 800, 800, 4128, 4128]
    - [29, 71.678]
  - - [768, 4096, 1, 64, 800, 800, 768, 96]
    - [28, 30.638]
  - - [768, 4096, 1, 128, 800, 800, 768, 160]
    - [22, 45.219]
  - - [768, 4096, 1, 256, 800, 800, 768, 288]
    - [22, 59.67]
  - - [768, 4096, 1, 512, 800, 800, 768, 544]
    - [22, 66.889]
  - - [768, 4096, 1, 1024, 800, 800, 1056, 1056]
    - [28, 73.996]
  - - [768, 4096, 1, 2048, 800, 800, 2080, 2080]
    - [31, 78.576]
  - - [768, 4096, 1, 4096, 800, 800, 4128, 4128]
    - [22, 81.484]
  - - [1536, 64, 1, 64, 1568, 1568, 1536, 96]
    - [67, 2.098]
  - - [1536, 64, 1, 128, 1568, 1568, 1536, 160]
    - [74, 3.896]
  - - [1536, 64, 1, 256, 1568, 1568, 1536, 288]
    - [82, 6.798]
  - - [1536, 64, 1, 512, 1568, 1568, 1536, 544]
    - [74, 10.799]
  - - [1536, 64, 1, 1024, 1568, 1568, 1536, 1056]
    - [61, 15.238]
  - - [1536, 64, 1, 2048, 1568, 1568, 2080, 2080]
    - [74, 19.142]
  - - [1536, 64, 1, 4096, 1568, 1568, 4128, 4128]
    - [61, 21.961]
  - - [1536, 128, 1, 64, 1568, 1568, 1536, 96]
    - [74, 4.086]
  - - [1536, 128, 1, 128, 1568, 1568, 1536, 160]
    - [72, 7.453]
  - - [1536, 128, 1, 256, 1568, 1568, 1536, 288]
    - [68, 12.756]
  - - [1536, 128, 1, 512, 1568, 1568, 1536, 544]
    - [71, 19.664]
  - - [1536, 128, 1, 1024, 1568, 1568, 1536, 1056]
    - [72, 27.247]
  - - [1536, 128, 1, 2048, 1568, 1568, 2080, 2080]
    - [60, 33.584]
  - - [1536, 128, 1, 4096, 1568, 1568, 4128, 4128]
    - [60, 38.113]
  - - [1536, 256, 1, 64, 1568, 1568, 1536, 96]
    - [69, 7.469]
  - - [1536, 256, 1, 128, 1568, 1568, 1536, 160]
    - [4, 12.746]
  - - [1536, 256, 1, 256, 1568, 1568, 1536, 288]
    - [62, 20.101]
  - - [1536, 256, 1, 512, 1568, 1568, 1536, 544]
    - [75, 28.124]
  - - [1536, 256, 1, 1024, 1568, 1568, 1536, 1056]
    - [62, 35.016]
  - - [1536, 256, 1, 2048, 1568, 1568, 2080, 2080]
    - [75, 39.911]
  - - [1536, 256, 1, 4096, 1568, 1568, 4128, 4128]
    - [75, 41.62]
  - - [1536, 512, 1, 64, 1568, 1568, 1536, 96]
    - [82, 12.732]
  - - [1536, 512, 1, 128, 1568, 1568, 1536, 160]
    - [13, 21.392]
  - - [1536, 512, 1, 256, 1568, 1568, 1536, 288]
    - [13, 33.522]
  - - [1536, 512, 1, 512, 1568, 1568, 1536, 544]
    - [24, 46.758]
  - - [1536, 512, 1, 1024, 1568, 1568, 1536, 1056]
    - [13, 58.436]
  - - [1536, 512, 1, 2048, 1568, 1568, 2080, 2080]
    - [13, 63.41]
  - - [1536, 512, 1, 4096, 1568, 1568, 4128, 4128]
    - [12, 69.241]
  - - [1536, 1024, 1, 64, 1568, 1568, 1536, 96]
    - [2, 20.715]
  - - [1536, 1024, 1, 128, 1568, 1568, 1536, 160]
    - [21, 31.354]
  - - [1536, 1024, 1, 256, 1568, 1568, 1536, 288]
    - [22, 43.772]
  - - [1536, 1024, 1, 512, 1568, 1568, 1536, 544]
    - [22, 54.874]
  - - [1536, 1024, 1, 1024, 1568, 1568, 1536, 1056]
    - [20, 61.123]
  - - [1536, 1024, 1, 2048, 1568, 1568, 2080, 2080]
    - [14, 67.339]
  - - [1536, 1024, 1, 4096, 1568, 1568, 4128, 4128]
    - [14, 70.765]
  - - [1536, 2048, 1, 64, 1568, 1568, 1536, 96]
    - [30, 30.139]
  - - [1536, 2048, 1, 128, 1568, 1568, 1536, 160]
    - [22, 45.454]
  - - [1536, 2048, 1, 256, 1568, 1568, 1536, 288]
    - [22, 59.57]
  - - [1536, 2048, 1, 512, 1568, 1568, 1536, 544]
    - [22, 66.977]
  - - [1536, 2048, 1, 1024, 1568, 1568, 1536, 1056]
    - [31, 74.161]
  - - [1536, 2048, 1, 2048, 1568, 1568, 2080, 2080]
    - [30, 78.586]
  - - [1536, 2048, 1, 4096, 1568, 1568, 4128, 4128]
    - [22, 81.408]
  - - [1536, 4096, 1, 64, 1568, 1568, 1536, 96]
    - [16, 41.233]
  - - [1536, 4096, 1, 128, 1568, 1568, 1536, 160]
    - [15, 57.525]
  - - [1536, 4096, 1, 256, 1568, 1568, 1536, 288]
    - [30, 67.314]
  - - [1536, 4096, 1, 512, 1568, 1568, 1536, 544]
    - [22, 78.833]
  - - [1536, 4096, 1, 1024, 1568, 1568, 1536, 1056]
    - [22, 85.264]
  - - [1536, 4096, 1, 2048, 1568, 1568, 2080, 2080]
    - [22, 89.174]
  - - [1536, 4096, 1, 4096, 1568, 1568, 4128, 4128]
    - [11, 90.064]
  - - [3072, 64, 1, 64, 3104, 3104, 3072, 96]
    - [61, 4.119]
  - - [3072, 64, 1, 128, 3104, 3104, 3072, 160]
    - [69, 7.451]
  - - [3072, 64, 1, 256, 3104, 3104, 3072, 288]
    - [68, 12.634]
  - - [3072, 64, 1, 512, 3104, 3104, 3072, 544]
    - [72, 19.523]
  - - [3072, 64, 1, 1024, 3104, 3104, 3072, 1056]
    - [58, 26.643]
  - - [3072, 64, 1, 2048, 3104, 3104, 3072, 2080]
    - [72, 32.619]
  - - [3072, 64, 1, 4096, 3104, 3104, 4128, 4128]
    - [81, 34.093]
  - - [3072, 128, 1, 64, 3104, 3104, 3072, 96]
    - [65, 7.488]
  - - [3072, 128, 1, 128, 3104, 3104, 3072, 160]
    - [9, 12.83]
  - - [3072, 128, 1, 256, 3104, 3104, 3072, 288]
    - [62, 20.044]
  - - [3072, 128, 1, 512, 3104, 3104, 3072, 544]
    - [75, 28.105]
  - - [3072, 128, 1, 1024, 3104, 3104, 3072, 1056]
    - [75, 34.908]
  - - [3072, 128, 1, 2048, 3104, 3104, 3072, 2080]
    - [62, 39.77]
  - - [3072, 128, 1, 4096, 3104, 3104, 4128, 4128]
    - [62, 41.613]
  - - [3072, 256, 1, 64, 3104, 3104, 3072, 96]
    - [2, 12.742]
  - - [3072, 256, 1, 128, 3104, 3104, 3072, 160]
    - [12, 21.501]
  - - [3072, 256, 1, 256, 3104, 3104, 3072, 288]
    - [12, 33.57]
  - - [3072, 256, 1, 512, 3104, 3104, 3072, 544]
    - [13, 46.996]
  - - [3072, 256, 1, 1024, 3104, 3104, 3072, 1056]
    - [24, 58.396]
  - - [3072, 256, 1, 2048, 3104, 3104, 3072, 2080]
    - [13, 63.56]
  - - [3072, 256, 1, 4096, 3104, 3104, 4128, 4128]
    - [13, 69.313]
  - - [3072, 512, 1, 64, 3104, 3104, 3072, 96]
    - [2, 20.776]
  - - [3072, 512, 1, 128, 3104, 3104, 3072, 160]
    - [34, 31.264]
  - - [3072, 512, 1, 256, 3104, 3104, 3072, 288]
    - [22, 43.551]
  - - [3072, 512, 1, 512, 3104, 3104, 3072, 544]
    - [11, 54.697]
  - - [3072, 512, 1, 1024, 3104, 3104, 3072, 1056]
    - [33, 60.541]
  - - [3072, 512, 1, 2048, 3104, 3104, 3072, 2080]
    - [18, 66.026]
  - - [3072, 512, 1, 4096, 3104, 3104, 4128, 4128]
    - [17, 70.572]
  - - [3072, 1024, 1, 64, 3104, 3104, 3072, 96]
    - [16, 30.293]
  - - [3072, 1024, 1, 128, 3104, 3104, 3072, 160]
    - [11, 45.404]
  - - [3072, 1024, 1, 256, 3104, 3104, 3072, 288]
    - [11, 59.548]
  - - [3072, 1024, 1, 512, 3104, 3104, 3072, 544]
    - [11, 68.462]
  - - [3072, 1024, 1, 1024, 3104, 3104, 3072, 1056]
    - [31, 74.108]
  - - [3072, 1024, 1, 2048, 3104, 3104, 3072, 2080]
    - [22, 78.513]
  - - [3072, 1024, 1, 4096, 3104, 3104, 4128, 4128]
    - [11, 81.444]
  - - [3072, 2048, 1, 64, 3104, 3104, 3072, 96]
    - [27, 40.809]
  - - [3072, 2048, 1, 128, 3104, 3104, 3072, 160]
    - [26, 57.664]
  - - [3072, 2048, 1, 256, 3104, 3104, 3072, 288]
    - [31, 67.375]
  - - [3072, 2048, 1, 512, 3104, 3104, 3072, 544]
    - [22, 78.925]
  - - [3072, 2048, 1, 1024, 3104, 3104, 3072, 1056]
    - [22, 85.35]
  - - [3072, 2048, 1, 2048, 3104, 3104, 3072, 2080]
    - [22, 89.179]
  - - [3072, 2048, 1, 4096, 3104, 3104, 4128, 4128]
    - [22, 90.221]
  - - [3072, 4096, 1, 64, 3104, 3104, 3072, 96]
    - [15, 50.063]
  - - [3072, 4096, 1, 128, 3104, 3104, 3072, 160]
    - [11, 62.544]
  - - [3072, 4096, 1, 256, 3104, 3104, 3072, 288]
    - [11, 75.821]
  - - [3072, 4096, 1, 512, 3104, 3104, 3072, 544]
    - [22, 84.118]
  - - [3072, 4096, 1, 1024, 3104, 3104, 3072, 1056]
    - [22, 88.98]
  - - [3072, 4096, 1, 2048, 3104, 3104, 3072, 2080]
    - [22, 90.823]
  - - [3072, 4096, 1, 4096, 3104, 3104, 4128, 4128]
    - [11, 92.516]
- null
- null
- DeviceEfficiency
