library/src/blas3/Tensile/Logic/asm_full/navi32/navi32_Cijk_Ailk_Bljk_HB_GB.yaml
- {MinimumRequiredVersion: 4.35.0}
- navi32
- gfx1101
- [Device 73f0]
    SolutionIndex: 0
    SolutionNameMin: Cijk_Ailk_Bljk_HB_MT64x64x16_MI16x16x16x1_SN_1LDSB0_AMAS3_GRVW8_IU1_NLCA1_SIA1_SU0_SUS0_SVW2_TT2_32_VW2_WGM4
    SolutionIndex: 1
    SolutionNameMin: Cijk_Ailk_Bljk_HB_MT64x64x16_MI16x16x16x1_SN_1LDSB1_AMAS3_GRVW4_IU1_NLCA1_SIA2_SU0_SUS0_SVW2_TT2_32_VW2_WGM4
    SolutionIndex: 2
    SolutionNameMin: Cijk_Ailk_Bljk_HB_MT64x64x16_MI16x16x16x1_SN_1LDSB1_AMAS3_GRVW8_IU1_NLCA1_SIA2_SU0_SUS0_SVW2_TT2_32_VW2_WGM4
    SolutionIndex: 3
    SolutionNameMin: Cijk_Ailk_Bljk_HB_MT64x64x16_MI16x16x16x1_SN_1LDSB1_AMAS3_GRVW4_IU1_NLCA1_SIA2_SU32_SUS128_SVW2_TT2_32_VW2_WGM4
    SolutionIndex: 4
    SolutionNameMin: Cijk_Ailk_Bljk_HB_MT64x64x16_MI16x16x16x1_SN_1LDSB1_AMAS3_GRVW8_IU1_NLCA1_SIA2_SU32_SUS128_SVW2_TT2_32_VW2_WGM4
    SolutionIndex: 5
    SolutionNameMin: Cijk_Ailk_Bljk_HB_MT64x64x16_MI16x16x16x1_SN_1LDSB1_AMAS3_GRVW8_IU1_NLCA1_SIA2_SU32_SUS256_SVW2_TT2_32_VW2_WGM4
    SolutionIndex: 6
    SolutionNameMin: Cijk_Ailk_Bljk_HB_MT64x64x16_MI16x16x16x1_SN_1LDSB0_AMAS3_GRVW4_IU1_NLCA1_SIA1_SU0_SUS0_SVW2_TT2_32_VW2_WGM8
    SolutionIndex: 7
    SolutionNameMin: Cijk_Ailk_Bljk_HB_MT64x64x16_MI16x16x16x1_SN_1LDSB0_AMAS3_GRVW8_IU1_NLCA1_SIA1_SU0_SUS0_SVW2_TT2_32_VW2_WGM8
    SolutionIndex: 8
    SolutionNameMin: Cijk_Ailk_Bljk_HB_MT64x64x16_MI16x16x16x1_SN_1LDSB1_AMAS3_GRVW8_IU1_NLCA1_SIA2_SU32_SUS128_SVW2_TT2_32_VW2_WGM8
    SolutionIndex: 9
    SolutionNameMin: Cijk_Ailk_Bljk_HB_MT64x64x16_MI16x16x16x1_SN_1LDSB1_AMAS3_GRVW8_IU1_NLCA1_SIA2_SU32_SUS256_SVW2_TT2_32_VW2_WGM8
    SolutionIndex: 10
    SolutionNameMin: Cijk_Ailk_Bljk_HB_MT128x128x16_MI16x16x16x1_SN_1LDSB0_AMAS3_GRVW4_IU1_NLCA1_SIA1_SU0_SUS0_SVW2_TT4_64_VW2_WGM4
    SolutionIndex: 11
    SolutionNameMin: Cijk_Ailk_Bljk_HB_MT128x128x16_MI16x16x16x1_SN_1LDSB0_AMAS3_GRVW8_IU1_NLCA1_SIA1_SU0_SUS0_SVW2_TT4_64_VW2_WGM4
    SolutionIndex: 12
    SolutionNameMin: Cijk_Ailk_Bljk_HB_MT128x128x16_MI16x16x16x1_SN_1LDSB1_AMAS3_GRVW8_IU1_NLCA1_SIA2_SU0_SUS0_SVW2_TT4_64_VW2_WGM4
    SolutionIndex: 13
    SolutionNameMin: Cijk_Ailk_Bljk_HB_MT128x128x16_MI16x16x16x1_SN_1LDSB0_AMAS3_GRVW2_IU1_NLCA2_SIA3_SU0_SUS0_SVW2_TT4_64_VW2_WGM4
    SolutionIndex: 14
    SolutionNameMin: Cijk_Ailk_Bljk_HB_MT128x128x16_MI16x16x16x1_SN_1LDSB0_AMAS3_GRVW8_IU1_NLCA1_SIA3_SU0_SUS0_SVW2_TT4_64_VW2_WGM4
    SolutionIndex: 15
    SolutionNameMin: Cijk_Ailk_Bljk_HB_MT128x128x16_MI16x16x16x1_SN_1LDSB0_AMAS3_GRVW8_IU1_NLCA1_SIA1_SU32_SUS128_SVW2_TT4_64_VW2_WGM4
    SolutionIndex: 16
    SolutionNameMin: Cijk_Ailk_Bljk_HB_MT128x128x16_MI16x16x16x1_SN_1LDSB0_AMAS0_GRVW2_IU1_NLCA2_SIA3_SU32_SUS128_SVW1_TT4_64_VW1_WGM4
    SolutionIndex: 17
    SolutionNameMin: Cijk_Ailk_Bljk_HB_MT128x128x16_MI16x16x16x1_SN_1LDSB0_AMAS3_GRVW8_IU1_NLCA1_SIA1_SU32_SUS256_SVW2_TT4_64_VW2_WGM4
    SolutionIndex: 18
    SolutionNameMin: Cijk_Ailk_Bljk_HB_MT128x128x16_MI16x16x16x1_SN_1LDSB1_AMAS3_GRVW8_IU1_NLCA1_SIA2_SU32_SUS256_SVW2_TT4_64_VW2_WGM4
    SolutionIndex: 19
    SolutionNameMin: Cijk_Ailk_Bljk_HB_MT128x128x16_MI16x16x16x1_SN_1LDSB0_AMAS3_GRVW2_IU1_NLCA2_SIA3_SU32_SUS256_SVW2_TT4_64_VW2_WGM4
    SolutionIndex: 20
    SolutionNameMin: Cijk_Ailk_Bljk_HB_MT128x128x16_MI16x16x16x1_SN_1LDSB0_AMAS3_GRVW4_IU1_NLCA1_SIA1_SU0_SUS0_SVW2_TT4_64_VW2_WGM8
    SolutionIndex: 21
    SolutionNameMin: Cijk_Ailk_Bljk_HB_MT128x128x16_MI16x16x16x1_SN_1LDSB0_AMAS3_GRVW8_IU1_NLCA1_SIA1_SU0_SUS0_SVW2_TT4_64_VW2_WGM8
    SolutionIndex: 22
    SolutionNameMin: Cijk_Ailk_Bljk_HB_MT128x128x16_MI16x16x16x1_SN_1LDSB1_AMAS3_GRVW8_IU1_NLCA1_SIA2_SU0_SUS0_SVW2_TT4_64_VW2_WGM8
    SolutionIndex: 23
    SolutionNameMin: Cijk_Ailk_Bljk_HB_MT128x128x16_MI16x16x16x1_SN_1LDSB0_AMAS0_GRVW2_IU1_NLCA2_SIA3_SU0_SUS0_SVW1_TT4_64_VW1_WGM8
    SolutionIndex: 24
    SolutionNameMin: Cijk_Ailk_Bljk_HB_MT128x128x16_MI16x16x16x1_SN_1LDSB0_AMAS3_GRVW2_IU1_NLCA2_SIA3_SU0_SUS0_SVW2_TT4_64_VW2_WGM8
    SolutionIndex: 25
    SolutionNameMin: Cijk_Ailk_Bljk_HB_MT128x128x16_MI16x16x16x1_SN_1LDSB0_AMAS3_GRVW8_IU1_NLCA1_SIA3_SU0_SUS0_SVW2_TT4_64_VW2_WGM8
    SolutionIndex: 26
    SolutionNameMin: Cijk_Ailk_Bljk_HB_MT128x128x16_MI16x16x16x1_SN_1LDSB0_AMAS3_GRVW4_IU1_NLCA1_SIA1_SU32_SUS128_SVW2_TT4_64_VW2_WGM8
    SolutionIndex: 27
    SolutionNameMin: Cijk_Ailk_Bljk_HB_MT128x128x16_MI16x16x16x1_SN_1LDSB0_AMAS3_GRVW8_IU1_NLCA1_SIA1_SU32_SUS128_SVW2_TT4_64_VW2_WGM8
    SolutionIndex: 28
    SolutionNameMin: Cijk_Ailk_Bljk_HB_MT128x128x16_MI16x16x16x1_SN_1LDSB1_AMAS3_GRVW8_IU1_NLCA1_SIA2_SU32_SUS128_SVW2_TT4_64_VW2_WGM8
    SolutionIndex: 29
    SolutionNameMin: Cijk_Ailk_Bljk_HB_MT128x128x16_MI16x16x16x1_SN_1LDSB0_AMAS0_GRVW2_IU1_NLCA2_SIA3_SU32_SUS128_SVW1_TT4_64_VW1_WGM8
    SolutionIndex: 30
    SolutionNameMin: Cijk_Ailk_Bljk_HB_MT128x128x16_MI16x16x16x1_SN_1LDSB0_AMAS3_GRVW4_IU1_NLCA1_SIA1_SU32_SUS256_SVW2_TT4_64_VW2_WGM8
    SolutionIndex: 31
    SolutionNameMin: Cijk_Ailk_Bljk_HB_MT128x128x16_MI16x16x16x1_SN_1LDSB0_AMAS3_GRVW8_IU1_NLCA1_SIA1_SU32_SUS256_SVW2_TT4_64_VW2_WGM8
    SolutionIndex: 32
    SolutionNameMin: Cijk_Ailk_Bljk_HB_MT128x128x16_MI16x16x16x1_SN_1LDSB1_AMAS3_GRVW8_IU1_NLCA1_SIA2_SU32_SUS256_SVW2_TT4_64_VW2_WGM8
    SolutionIndex: 33
    SolutionNameMin: Cijk_Ailk_Bljk_HB_MT128x128x16_MI16x16x16x1_SN_1LDSB0_AMAS3_GRVW2_IU1_NLCA2_SIA3_SU32_SUS256_SVW2_TT4_64_VW2_WGM8
    SolutionIndex: 34
    SolutionNameMin: Cijk_Ailk_Bljk_HB_MT32x32x32_MI16x16x16x1_SN_1LDSB0_AMAS0_GRVW4_IU1_NLCA1_SIA1_SU0_SUS0_SVW1_TT1_16_VW1_WGM4
    SolutionIndex: 35
    SolutionNameMin: Cijk_Ailk_Bljk_HB_MT32x32x32_MI16x16x16x1_SN_1LDSB0_AMAS0_GRVW8_IU1_NLCA1_SIA1_SU0_SUS0_SVW1_TT1_16_VW1_WGM4
    SolutionIndex: 36
    SolutionNameMin: Cijk_Ailk_Bljk_HB_MT32x32x32_MI16x16x16x1_SN_1LDSB1_AMAS0_GRVW4_IU2_NLCA1_SIA2_SU0_SUS0_SVW1_TT1_16_VW1_WGM4
    SolutionIndex: 37
    SolutionNameMin: Cijk_Ailk_Bljk_HB_MT32x32x32_MI16x16x16x1_SN_1LDSB1_AMAS0_GRVW8_IU2_NLCA1_SIA2_SU0_SUS0_SVW1_TT1_16_VW1_WGM4
    SolutionIndex: 38
    SolutionNameMin: Cijk_Ailk_Bljk_HB_MT32x32x32_MI16x16x16x1_SN_1LDSB1_AMAS0_GRVW4_IU2_NLCA1_SIA2_SU32_SUS128_SVW1_TT1_16_VW1_WGM4
    SolutionIndex: 39
    SolutionNameMin: Cijk_Ailk_Bljk_HB_MT32x32x32_MI16x16x16x1_SN_1LDSB1_AMAS0_GRVW8_IU2_NLCA1_SIA2_SU32_SUS128_SVW1_TT1_16_VW1_WGM4
    SolutionIndex: 40
    SolutionNameMin: Cijk_Ailk_Bljk_HB_MT32x32x32_MI16x16x16x1_SN_1LDSB0_AMAS0_GRVW8_IU1_NLCA1_SIA3_SU32_SUS128_SVW1_TT1_16_VW1_WGM4
    SolutionIndex: 41
    SolutionNameMin: Cijk_Ailk_Bljk_HB_MT32x32x32_MI16x16x16x1_SN_1LDSB0_AMAS0_GRVW8_IU1_NLCA1_SIA1_SU32_SUS256_SVW1_TT1_16_VW1_WGM4
    SolutionIndex: 42
    SolutionNameMin: Cijk_Ailk_Bljk_HB_MT32x32x32_MI16x16x16x1_SN_1LDSB1_AMAS0_GRVW4_IU2_NLCA1_SIA2_SU32_SUS256_SVW1_TT1_16_VW1_WGM4
    SolutionIndex: 43
    SolutionNameMin: Cijk_Ailk_Bljk_HB_MT32x32x32_MI16x16x16x1_SN_1LDSB1_AMAS0_GRVW8_IU2_NLCA1_SIA2_SU32_SUS256_SVW1_TT1_16_VW1_WGM4
    SolutionIndex: 44
    SolutionNameMin: Cijk_Ailk_Bljk_HB_MT32x32x32_MI16x16x16x1_SN_1LDSB0_AMAS0_GRVW4_IU1_NLCA1_SIA1_SU0_SUS0_SVW1_TT1_16_VW1_WGM8
    SolutionIndex: 45
    SolutionNameMin: Cijk_Ailk_Bljk_HB_MT32x32x32_MI16x16x16x1_SN_1LDSB0_AMAS0_GRVW8_IU1_NLCA1_SIA1_SU0_SUS0_SVW1_TT1_16_VW1_WGM8
    SolutionIndex: 46
    SolutionNameMin: Cijk_Ailk_Bljk_HB_MT32x32x32_MI16x16x16x1_SN_1LDSB1_AMAS0_GRVW4_IU2_NLCA1_SIA2_SU0_SUS0_SVW1_TT1_16_VW1_WGM8
    SolutionIndex: 47
    SolutionNameMin: Cijk_Ailk_Bljk_HB_MT32x32x32_MI16x16x16x1_SN_1LDSB1_AMAS0_GRVW8_IU2_NLCA1_SIA2_SU0_SUS0_SVW1_TT1_16_VW1_WGM8
    SolutionIndex: 48
    SolutionNameMin: Cijk_Ailk_Bljk_HB_MT32x32x32_MI16x16x16x1_SN_1LDSB0_AMAS0_GRVW8_IU1_NLCA1_SIA3_SU0_SUS0_SVW1_TT1_16_VW1_WGM8
    SolutionIndex: 49
    SolutionNameMin: Cijk_Ailk_Bljk_HB_MT32x32x32_MI16x16x16x1_SN_1LDSB0_AMAS0_GRVW8_IU1_NLCA1_SIA1_SU32_SUS128_SVW1_TT1_16_VW1_WGM8
    SolutionIndex: 50
    SolutionNameMin: Cijk_Ailk_Bljk_HB_MT32x32x32_MI16x16x16x1_SN_1LDSB1_AMAS0_GRVW4_IU2_NLCA1_SIA2_SU32_SUS128_SVW1_TT1_16_VW1_WGM8
    SolutionIndex: 51
    SolutionNameMin: Cijk_Ailk_Bljk_HB_MT32x32x32_MI16x16x16x1_SN_1LDSB1_AMAS0_GRVW8_IU2_NLCA1_SIA2_SU32_SUS128_SVW1_TT1_16_VW1_WGM8
    SolutionIndex: 52
    SolutionNameMin: Cijk_Ailk_Bljk_HB_MT32x32x32_MI16x16x16x1_SN_1LDSB0_AMAS0_GRVW4_IU1_NLCA1_SIA1_SU32_SUS256_SVW1_TT1_16_VW1_WGM8
    SolutionIndex: 53
    SolutionNameMin: Cijk_Ailk_Bljk_HB_MT32x32x32_MI16x16x16x1_SN_1LDSB0_AMAS0_GRVW8_IU1_NLCA1_SIA1_SU32_SUS256_SVW1_TT1_16_VW1_WGM8
    SolutionIndex: 54
    SolutionNameMin: Cijk_Ailk_Bljk_HB_MT32x32x32_MI16x16x16x1_SN_1LDSB1_AMAS0_GRVW8_IU2_NLCA1_SIA2_SU32_SUS256_SVW1_TT1_16_VW1_WGM8
    SolutionIndex: 55
    SolutionNameMin: Cijk_Ailk_Bljk_HB_MT64x64x32_MI16x16x16x1_SN_1LDSB0_AMAS0_GRVW4_IU1_NLCA1_SIA1_SU0_SUS0_SVW1_TT2_32_VW1_WGM4
    SolutionIndex: 56
    SolutionNameMin: Cijk_Ailk_Bljk_HB_MT64x64x32_MI16x16x16x1_SN_1LDSB0_AMAS3_GRVW4_IU1_NLCA1_SIA1_SU0_SUS0_SVW2_TT2_32_VW2_WGM4
    SolutionIndex: 57
    SolutionNameMin: Cijk_Ailk_Bljk_HB_MT64x64x32_MI16x16x16x1_SN_1LDSB0_AMAS0_GRVW8_IU1_NLCA1_SIA1_SU0_SUS0_SVW1_TT2_32_VW1_WGM4
    SolutionIndex: 58
    SolutionNameMin: Cijk_Ailk_Bljk_HB_MT64x64x32_MI16x16x16x1_SN_1LDSB0_AMAS3_GRVW8_IU1_NLCA1_SIA1_SU0_SUS0_SVW2_TT2_32_VW2_WGM4
    SolutionIndex: 59
    SolutionNameMin: Cijk_Ailk_Bljk_HB_MT64x64x32_MI16x16x16x1_SN_1LDSB1_AMAS3_GRVW8_IU2_NLCA1_SIA2_SU0_SUS0_SVW2_TT2_32_VW2_WGM4
    SolutionIndex: 60
    SolutionNameMin: Cijk_Ailk_Bljk_HB_MT64x64x32_MI16x16x16x1_SN_1LDSB0_AMAS0_GRVW8_IU1_NLCA1_SIA3_SU0_SUS0_SVW1_TT2_32_VW1_WGM4
    SolutionIndex: 61
    SolutionNameMin: Cijk_Ailk_Bljk_HB_MT64x64x32_MI16x16x16x1_SN_1LDSB0_AMAS3_GRVW8_IU1_NLCA1_SIA3_SU0_SUS0_SVW2_TT2_32_VW2_WGM4
    SolutionIndex: 62
    SolutionNameMin: Cijk_Ailk_Bljk_HB_MT64x64x32_MI16x16x16x1_SN_1LDSB0_AMAS0_GRVW4_IU1_NLCA1_SIA1_SU32_SUS128_SVW1_TT2_32_VW1_WGM4
    SolutionIndex: 63
    SolutionNameMin: Cijk_Ailk_Bljk_HB_MT64x64x32_MI16x16x16x1_SN_1LDSB1_AMAS3_GRVW8_IU2_NLCA1_SIA2_SU32_SUS128_SVW2_TT2_32_VW2_WGM4
    SolutionIndex: 64
    SolutionNameMin: Cijk_Ailk_Bljk_HB_MT64x64x32_MI16x16x16x1_SN_1LDSB0_AMAS3_GRVW8_IU1_NLCA1_SIA3_SU32_SUS128_SVW2_TT2_32_VW2_WGM4
    SolutionIndex: 65
    SolutionNameMin: Cijk_Ailk_Bljk_HB_MT64x64x32_MI16x16x16x1_SN_1LDSB0_AMAS0_GRVW4_IU1_NLCA1_SIA1_SU32_SUS256_SVW1_TT2_32_VW1_WGM4
    SolutionIndex: 66
    SolutionNameMin: Cijk_Ailk_Bljk_HB_MT64x64x32_MI16x16x16x1_SN_1LDSB0_AMAS3_GRVW8_IU1_NLCA1_SIA1_SU32_SUS256_SVW2_TT2_32_VW2_WGM4
    SolutionIndex: 67
    SolutionNameMin: Cijk_Ailk_Bljk_HB_MT64x64x32_MI16x16x16x1_SN_1LDSB1_AMAS3_GRVW8_IU2_NLCA1_SIA2_SU32_SUS256_SVW2_TT2_32_VW2_WGM4
    SolutionIndex: 68
    SolutionNameMin: Cijk_Ailk_Bljk_HB_MT64x64x32_MI16x16x16x1_SN_1LDSB0_AMAS0_GRVW8_IU1_NLCA1_SIA3_SU32_SUS256_SVW1_TT2_32_VW1_WGM4
    SolutionIndex: 69
    SolutionNameMin: Cijk_Ailk_Bljk_HB_MT64x64x32_MI16x16x16x1_SN_1LDSB0_AMAS0_GRVW4_IU1_NLCA1_SIA1_SU0_SUS0_SVW1_TT2_32_VW1_WGM8
    SolutionIndex: 70
    SolutionNameMin: Cijk_Ailk_Bljk_HB_MT64x64x32_MI16x16x16x1_SN_1LDSB0_AMAS3_GRVW4_IU1_NLCA1_SIA1_SU0_SUS0_SVW2_TT2_32_VW2_WGM8
    SolutionIndex: 71
    SolutionNameMin: Cijk_Ailk_Bljk_HB_MT64x64x32_MI16x16x16x1_SN_1LDSB0_AMAS0_GRVW8_IU1_NLCA1_SIA1_SU0_SUS0_SVW1_TT2_32_VW1_WGM8
    SolutionIndex: 72
    SolutionNameMin: Cijk_Ailk_Bljk_HB_MT64x64x32_MI16x16x16x1_SN_1LDSB0_AMAS3_GRVW8_IU1_NLCA1_SIA1_SU0_SUS0_SVW2_TT2_32_VW2_WGM8
    SolutionIndex: 73
    SolutionNameMin: Cijk_Ailk_Bljk_HB_MT64x64x32_MI16x16x16x1_SN_1LDSB1_AMAS3_GRVW8_IU2_NLCA1_SIA2_SU0_SUS0_SVW2_TT2_32_VW2_WGM8
    SolutionIndex: 74
    SolutionNameMin: Cijk_Ailk_Bljk_HB_MT64x64x32_MI16x16x16x1_SN_1LDSB0_AMAS0_GRVW8_IU1_NLCA1_SIA3_SU0_SUS0_SVW1_TT2_32_VW1_WGM8
    SolutionIndex: 75
    SolutionNameMin: Cijk_Ailk_Bljk_HB_MT64x64x32_MI16x16x16x1_SN_1LDSB0_AMAS3_GRVW8_IU1_NLCA1_SIA3_SU0_SUS0_SVW2_TT2_32_VW2_WGM8
    SolutionIndex: 76
    SolutionNameMin: Cijk_Ailk_Bljk_HB_MT64x64x32_MI16x16x16x1_SN_1LDSB0_AMAS0_GRVW8_IU1_NLCA1_SIA1_SU32_SUS128_SVW1_TT2_32_VW1_WGM8
    SolutionIndex: 77
    SolutionNameMin: Cijk_Ailk_Bljk_HB_MT64x64x32_MI16x16x16x1_SN_1LDSB0_AMAS3_GRVW8_IU1_NLCA1_SIA1_SU32_SUS128_SVW2_TT2_32_VW2_WGM8
    SolutionIndex: 78
    SolutionNameMin: Cijk_Ailk_Bljk_HB_MT64x64x32_MI16x16x16x1_SN_1LDSB1_AMAS3_GRVW4_IU2_NLCA1_SIA2_SU32_SUS128_SVW2_TT2_32_VW2_WGM8
    SolutionIndex: 79
    SolutionNameMin: Cijk_Ailk_Bljk_HB_MT64x64x32_MI16x16x16x1_SN_1LDSB1_AMAS3_GRVW8_IU2_NLCA1_SIA2_SU32_SUS128_SVW2_TT2_32_VW2_WGM8
    SolutionIndex: 80
    SolutionNameMin: Cijk_Ailk_Bljk_HB_MT64x64x32_MI16x16x16x1_SN_1LDSB0_AMAS0_GRVW8_IU1_NLCA1_SIA3_SU32_SUS128_SVW1_TT2_32_VW1_WGM8
    SolutionIndex: 81
    SolutionNameMin: Cijk_Ailk_Bljk_HB_MT64x64x32_MI16x16x16x1_SN_1LDSB0_AMAS3_GRVW4_IU1_NLCA1_SIA1_SU32_SUS256_SVW2_TT2_32_VW2_WGM8
    SolutionIndex: 82
    SolutionNameMin: Cijk_Ailk_Bljk_HB_MT64x64x32_MI16x16x16x1_SN_1LDSB0_AMAS0_GRVW8_IU1_NLCA1_SIA1_SU32_SUS256_SVW1_TT2_32_VW1_WGM8
    SolutionIndex: 83
    SolutionNameMin: Cijk_Ailk_Bljk_HB_MT64x64x32_MI16x16x16x1_SN_1LDSB0_AMAS3_GRVW8_IU1_NLCA1_SIA1_SU32_SUS256_SVW2_TT2_32_VW2_WGM8
    SolutionIndex: 84
    SolutionNameMin: Cijk_Ailk_Bljk_HB_MT64x64x32_MI16x16x16x1_SN_1LDSB1_AMAS3_GRVW8_IU2_NLCA1_SIA2_SU32_SUS256_SVW2_TT2_32_VW2_WGM8
    SolutionIndex: 85
    SolutionNameMin: Cijk_Ailk_Bljk_HB_MT64x64x32_MI16x16x16x1_SN_1LDSB0_AMAS0_GRVW8_IU1_NLCA1_SIA3_SU32_SUS256_SVW1_TT2_32_VW1_WGM8
- - - [64, 64, 1, 64, 96, 96, 96, 96]
    - [43, 0.091]
  - - [64, 64, 1, 128, 96, 96, 160, 160]
    - [50, 0.175]
  - - [64, 64, 1, 256, 96, 96, 288, 288]
    - [37, 0.323]
  - - [64, 64, 1, 512, 96, 96, 544, 544]
    - [54, 0.555]
  - - [64, 64, 1, 1024, 96, 96, 1056, 1056]
    - [39, 0.869]
  - - [64, 64, 1, 2048, 96, 96, 2080, 2080]
    - [50, 1.207]
  - - [64, 64, 1, 4096, 96, 96, 4128, 4128]
    - [38, 1.504]
  - - [64, 128, 1, 64, 96, 96, 96, 96]
    - [45, 0.188]
  - - [64, 128, 1, 128, 96, 96, 160, 160]
    - [43, 0.355]
  - - [64, 128, 1, 256, 96, 96, 288, 288]
    - [43, 0.653]
  - - [64, 128, 1, 512, 96, 96, 544, 544]
    - [46, 1.125]
  - - [64, 128, 1, 1024, 96, 96, 1056, 1056]
    - [38, 1.757]
  - - [64, 128, 1, 2048, 96, 96, 2080, 2080]
    - [36, 2.436]
  - - [64, 128, 1, 4096, 96, 96, 4128, 4128]
    - [36, 3.026]
  - - [64, 256, 1, 64, 96, 96, 96, 96]
    - [37, 0.376]
  - - [64, 256, 1, 128, 96, 96, 160, 160]
    - [38, 0.718]
  - - [64, 256, 1, 256, 96, 96, 288, 288]
    - [39, 1.318]
  - - [64, 256, 1, 512, 96, 96, 544, 544]
    - [42, 2.26]
  - - [64, 256, 1, 1024, 96, 96, 1056, 1056]
    - [46, 3.536]
  - - [64, 256, 1, 2048, 96, 96, 2080, 2080]
    - [46, 4.876]
  - - [64, 256, 1, 4096, 96, 96, 4128, 4128]
    - [46, 6.047]
  - - [64, 512, 1, 64, 96, 96, 96, 96]
    - [52, 0.743]
  - - [64, 512, 1, 128, 96, 96, 160, 160]
    - [38, 1.411]
  - - [64, 512, 1, 256, 96, 96, 288, 288]
    - [37, 2.568]
  - - [64, 512, 1, 512, 96, 96, 544, 544]
    - [37, 4.259]
  - - [64, 512, 1, 1024, 96, 96, 1056, 1056]
    - [47, 6.427]
  - - [64, 512, 1, 2048, 96, 96, 2080, 2080]
    - [37, 8.613]
  - - [64, 512, 1, 4096, 96, 96, 4128, 4128]
    - [47, 10.342]
  - - [64, 1024, 1, 64, 96, 96, 96, 96]
    - [40, 1.45]
  - - [64, 1024, 1, 128, 96, 96, 160, 160]
    - [53, 2.696]
  - - [64, 1024, 1, 256, 96, 96, 288, 288]
    - [34, 4.771]
  - - [64, 1024, 1, 512, 96, 96, 544, 544]
    - [35, 7.797]
  - - [64, 1024, 1, 1024, 96, 96, 1056, 1056]
    - [35, 11.297]
  - - [64, 1024, 1, 2048, 96, 96, 2080, 2080]
    - [44, 14.572]
  - - [64, 1024, 1, 4096, 96, 96, 4128, 4128]
    - [44, 16.889]
  - - [64, 2048, 1, 64, 96, 96, 96, 96]
    - [54, 2.757]
  - - [64, 2048, 1, 128, 96, 96, 160, 160]
    - [84, 4.999]
  - - [64, 2048, 1, 256, 96, 96, 288, 288]
    - [62, 8.561]
  - - [64, 2048, 1, 512, 96, 96, 544, 544]
    - [71, 13.268]
  - - [64, 2048, 1, 1024, 96, 96, 1056, 1056]
    - [82, 18.3]
  - - [64, 2048, 1, 2048, 96, 96, 2080, 2080]
    - [65, 22.631]
  - - [64, 2048, 1, 4096, 96, 96, 4128, 4128]
    - [65, 25.678]
  - - [64, 4096, 1, 64, 96, 96, 96, 96]
    - [75, 5.224]
  - - [64, 4096, 1, 128, 96, 96, 160, 160]
    - [2, 9.26]
  - - [64, 4096, 1, 256, 96, 96, 288, 288]
    - [80, 15.047]
  - - [64, 4096, 1, 512, 96, 96, 544, 544]
    - [82, 21.854]
  - - [64, 4096, 1, 1024, 96, 96, 1056, 1056]
    - [76, 28.45]
  - - [64, 4096, 1, 2048, 96, 96, 2080, 2080]
    - [76, 33.527]
  - - [64, 4096, 1, 4096, 96, 96, 4128, 4128]
    - [57, 35.461]
  - - [128, 64, 1, 64, 160, 160, 128, 96]
    - [54, 0.186]
  - - [128, 64, 1, 128, 160, 160, 160, 160]
    - [37, 0.355]
  - - [128, 64, 1, 256, 160, 160, 288, 288]
    - [39, 0.654]
  - - [128, 64, 1, 512, 160, 160, 544, 544]
    - [42, 1.121]
  - - [128, 64, 1, 1024, 160, 160, 1056, 1056]
    - [46, 1.749]
  - - [128, 64, 1, 2048, 160, 160, 2080, 2080]
    - [46, 2.432]
  - - [128, 64, 1, 4096, 160, 160, 4128, 4128]
    - [46, 3.011]
  - - [128, 128, 1, 64, 160, 160, 128, 96]
    - [36, 0.373]
  - - [128, 128, 1, 128, 160, 160, 160, 160]
    - [42, 0.714]
  - - [128, 128, 1, 256, 160, 160, 288, 288]
    - [36, 1.316]
  - - [128, 128, 1, 512, 160, 160, 544, 544]
    - [38, 2.264]
  - - [128, 128, 1, 1024, 160, 160, 1056, 1056]
    - [42, 3.533]
  - - [128, 128, 1, 2048, 160, 160, 2080, 2080]
    - [36, 4.905]
  - - [128, 128, 1, 4096, 160, 160, 4128, 4128]
    - [36, 6.08]
  - - [128, 256, 1, 64, 160, 160, 128, 96]
    - [36, 0.748]
  - - [128, 256, 1, 128, 160, 160, 160, 160]
    - [37, 1.412]
  - - [128, 256, 1, 256, 160, 160, 288, 288]
    - [43, 2.529]
  - - [128, 256, 1, 512, 160, 160, 544, 544]
    - [37, 4.245]
  - - [128, 256, 1, 1024, 160, 160, 1056, 1056]
    - [47, 6.441]
  - - [128, 256, 1, 2048, 160, 160, 2080, 2080]
    - [37, 8.608]
  - - [128, 256, 1, 4096, 160, 160, 4128, 4128]
    - [37, 10.36]
  - - [128, 512, 1, 64, 160, 160, 128, 96]
    - [52, 1.456]
  - - [128, 512, 1, 128, 160, 160, 160, 160]
    - [48, 2.711]
  - - [128, 512, 1, 256, 160, 160, 288, 288]
    - [35, 4.837]
  - - [128, 512, 1, 512, 160, 160, 544, 544]
    - [45, 7.755]
  - - [128, 512, 1, 1024, 160, 160, 1056, 1056]
    - [34, 11.28]
  - - [128, 512, 1, 2048, 160, 160, 2080, 2080]
    - [35, 14.551]
  - - [128, 512, 1, 4096, 160, 160, 4128, 4128]
    - [35, 16.933]
  - - [128, 1024, 1, 64, 160, 160, 128, 96]
    - [48, 2.765]
  - - [128, 1024, 1, 128, 160, 160, 160, 160]
    - [57, 5.029]
  - - [128, 1024, 1, 256, 160, 160, 288, 288]
    - [71, 8.744]
  - - [128, 1024, 1, 512, 160, 160, 544, 544]
    - [57, 13.688]
  - - [128, 1024, 1, 1024, 160, 160, 1056, 1056]
    - [71, 19.05]
  - - [128, 1024, 1, 2048, 160, 160, 2080, 2080]
    - [71, 23.651]
  - - [128, 1024, 1, 4096, 160, 160, 4128, 4128]
    - [57, 26.838]
  - - [128, 2048, 1, 64, 160, 160, 128, 96]
    - [7, 5.24]
  - - [128, 2048, 1, 128, 160, 160, 160, 160]
    - [61, 9.283]
  - - [128, 2048, 1, 256, 160, 160, 288, 288]
    - [61, 15.23]
  - - [128, 2048, 1, 512, 160, 160, 544, 544]
    - [74, 22.271]
  - - [128, 2048, 1, 1024, 160, 160, 1056, 1056]
    - [75, 28.9]
  - - [128, 2048, 1, 2048, 160, 160, 2080, 2080]
    - [57, 33.963]
  - - [128, 2048, 1, 4096, 160, 160, 4128, 4128]
    - [82, 35.655]
  - - [128, 4096, 1, 64, 160, 160, 128, 96]
    - [58, 9.539]
  - - [128, 4096, 1, 128, 160, 160, 160, 160]
    - [82, 16.023]
  - - [128, 4096, 1, 256, 160, 160, 288, 288]
    - [69, 24.343]
  - - [128, 4096, 1, 512, 160, 160, 544, 544]
    - [71, 32.734]
  - - [128, 4096, 1, 1024, 160, 160, 1056, 1056]
    - [18, 39.9]
  - - [128, 4096, 1, 2048, 160, 160, 2080, 2080]
    - [28, 43.098]
  - - [128, 4096, 1, 4096, 160, 160, 4128, 4128]
    - [12, 47.056]
  - - [256, 64, 1, 64, 288, 288, 256, 96]
    - [39, 0.375]
  - - [256, 64, 1, 128, 288, 288, 256, 160]
    - [38, 0.721]
  - - [256, 64, 1, 256, 288, 288, 288, 288]
    - [37, 1.321]
  - - [256, 64, 1, 512, 288, 288, 544, 544]
    - [50, 2.262]
  - - [256, 64, 1, 1024, 288, 288, 1056, 1056]
    - [36, 3.532]
  - - [256, 64, 1, 2048, 288, 288, 2080, 2080]
    - [42, 4.91]
  - - [256, 64, 1, 4096, 288, 288, 4128, 4128]
    - [36, 6.072]
  - - [256, 128, 1, 64, 288, 288, 256, 96]
    - [47, 0.741]
  - - [256, 128, 1, 128, 288, 288, 256, 160]
    - [39, 1.414]
  - - [256, 128, 1, 256, 288, 288, 288, 288]
    - [36, 2.537]
  - - [256, 128, 1, 512, 288, 288, 544, 544]
    - [47, 4.281]
  - - [256, 128, 1, 1024, 288, 288, 1056, 1056]
    - [37, 6.414]
  - - [256, 128, 1, 2048, 288, 288, 2080, 2080]
    - [37, 8.615]
  - - [256, 128, 1, 4096, 288, 288, 4128, 4128]
    - [37, 10.343]
  - - [256, 256, 1, 64, 288, 288, 256, 96]
    - [40, 1.448]
  - - [256, 256, 1, 128, 288, 288, 256, 160]
    - [41, 2.722]
  - - [256, 256, 1, 256, 288, 288, 288, 288]
    - [35, 4.812]
  - - [256, 256, 1, 512, 288, 288, 544, 544]
    - [35, 7.842]
  - - [256, 256, 1, 1024, 288, 288, 1056, 1056]
    - [35, 11.286]
  - - [256, 256, 1, 2048, 288, 288, 2080, 2080]
    - [35, 14.484]
  - - [256, 256, 1, 4096, 288, 288, 4128, 4128]
    - [49, 16.998]
  - - [256, 512, 1, 64, 288, 288, 256, 96]
    - [5, 2.765]
  - - [256, 512, 1, 128, 288, 288, 256, 160]
    - [58, 5.043]
  - - [256, 512, 1, 256, 288, 288, 288, 288]
    - [58, 8.732]
  - - [256, 512, 1, 512, 288, 288, 544, 544]
    - [71, 13.725]
  - - [256, 512, 1, 1024, 288, 288, 1056, 1056]
    - [58, 19.329]
  - - [256, 512, 1, 2048, 288, 288, 2080, 2080]
    - [57, 24.109]
  - - [256, 512, 1, 4096, 288, 288, 4128, 4128]
    - [57, 27.604]
  - - [256, 1024, 1, 64, 288, 288, 256, 96]
    - [2, 5.215]
  - - [256, 1024, 1, 128, 288, 288, 256, 160]
    - [60, 9.323]
  - - [256, 1024, 1, 256, 288, 288, 288, 288]
    - [74, 15.183]
  - - [256, 1024, 1, 512, 288, 288, 544, 544]
    - [0, 22.255]
  - - [256, 1024, 1, 1024, 288, 288, 1056, 1056]
    - [60, 28.875]
  - - [256, 1024, 1, 2048, 288, 288, 2080, 2080]
    - [60, 33.727]
  - - [256, 1024, 1, 4096, 288, 288, 4128, 4128]
    - [82, 35.574]
  - - [256, 2048, 1, 64, 288, 288, 256, 96]
    - [9, 9.551]
  - - [256, 2048, 1, 128, 288, 288, 256, 160]
    - [81, 16.056]
  - - [256, 2048, 1, 256, 288, 288, 288, 288]
    - [57, 24.457]
  - - [256, 2048, 1, 512, 288, 288, 544, 544]
    - [72, 32.82]
  - - [256, 2048, 1, 1024, 288, 288, 1056, 1056]
    - [20, 40.203]
  - - [256, 2048, 1, 2048, 288, 288, 2080, 2080]
    - [11, 43.526]
  - - [256, 2048, 1, 4096, 288, 288, 4128, 4128]
    - [21, 47.622]
  - - [256, 4096, 1, 64, 288, 288, 256, 96]
    - [2, 15.764]
  - - [256, 4096, 1, 128, 288, 288, 256, 160]
    - [6, 25.032]
  - - [256, 4096, 1, 256, 288, 288, 288, 288]
    - [83, 35.197]
  - - [256, 4096, 1, 512, 288, 288, 544, 544]
    - [72, 43.59]
  - - [256, 4096, 1, 1024, 288, 288, 1056, 1056]
    - [24, 50.945]
  - - [256, 4096, 1, 2048, 288, 288, 2080, 2080]
    - [13, 53.911]
  - - [256, 4096, 1, 4096, 288, 288, 4128, 4128]
    - [23, 56.855]
  - - [384, 64, 1, 64, 416, 416, 384, 96]
    - [50, 0.56]
  - - [384, 64, 1, 128, 416, 416, 384, 160]
    - [46, 1.078]
  - - [384, 64, 1, 256, 416, 416, 384, 288]
    - [43, 1.964]
  - - [384, 64, 1, 512, 416, 416, 544, 544]
    - [36, 3.356]
  - - [384, 64, 1, 1024, 416, 416, 1056, 1056]
    - [47, 5.27]
  - - [384, 64, 1, 2048, 416, 416, 2080, 2080]
    - [46, 7.354]
  - - [384, 64, 1, 4096, 416, 416, 4128, 4128]
    - [46, 9.1]
  - - [384, 128, 1, 64, 416, 416, 384, 96]
    - [43, 1.109]
  - - [384, 128, 1, 128, 416, 416, 384, 160]
    - [54, 2.109]
  - - [384, 128, 1, 256, 416, 416, 384, 288]
    - [37, 3.827]
  - - [384, 128, 1, 512, 416, 416, 544, 544]
    - [37, 6.381]
  - - [384, 128, 1, 1024, 416, 416, 1056, 1056]
    - [36, 9.582]
  - - [384, 128, 1, 2048, 416, 416, 2080, 2080]
    - [46, 12.841]
  - - [384, 128, 1, 4096, 416, 416, 4128, 4128]
    - [36, 15.417]
  - - [384, 256, 1, 64, 416, 416, 384, 96]
    - [45, 2.128]
  - - [384, 256, 1, 128, 416, 416, 384, 160]
    - [73, 3.918]
  - - [384, 256, 1, 256, 416, 416, 384, 288]
    - [73, 6.82]
  - - [384, 256, 1, 512, 416, 416, 544, 544]
    - [73, 10.789]
  - - [384, 256, 1, 1024, 416, 416, 1056, 1056]
    - [73, 15.351]
  - - [384, 256, 1, 2048, 416, 416, 2080, 2080]
    - [73, 19.338]
  - - [384, 256, 1, 4096, 416, 416, 4128, 4128]
    - [73, 22.224]
  - - [384, 512, 1, 64, 416, 416, 384, 96]
    - [1, 4.08]
  - - [384, 512, 1, 128, 416, 416, 384, 160]
    - [77, 7.52]
  - - [384, 512, 1, 256, 416, 416, 384, 288]
    - [83, 12.858]
  - - [384, 512, 1, 512, 416, 416, 544, 544]
    - [58, 20.16]
  - - [384, 512, 1, 1024, 416, 416, 1056, 1056]
    - [56, 27.902]
  - - [384, 512, 1, 2048, 416, 416, 2080, 2080]
    - [56, 34.938]
  - - [384, 512, 1, 4096, 416, 416, 4128, 4128]
    - [55, 39.691]
  - - [384, 1024, 1, 64, 416, 416, 384, 96]
    - [63, 7.494]
  - - [384, 1024, 1, 128, 416, 416, 384, 160]
    - [75, 12.88]
  - - [384, 1024, 1, 256, 416, 416, 384, 288]
    - [64, 20.12]
  - - [384, 1024, 1, 512, 416, 416, 544, 544]
    - [61, 28.214]
  - - [384, 1024, 1, 1024, 416, 416, 1056, 1056]
    - [74, 35.23]
  - - [384, 1024, 1, 2048, 416, 416, 2080, 2080]
    - [64, 39.839]
  - - [384, 1024, 1, 4096, 416, 416, 4128, 4128]
    - [80, 41.481]
  - - [384, 2048, 1, 64, 416, 416, 384, 96]
    - [79, 12.925]
  - - [384, 2048, 1, 128, 416, 416, 384, 160]
    - [12, 21.569]
  - - [384, 2048, 1, 256, 416, 416, 384, 288]
    - [32, 33.705]
  - - [384, 2048, 1, 512, 416, 416, 544, 544]
    - [22, 46.949]
  - - [384, 2048, 1, 1024, 416, 416, 1056, 1056]
    - [22, 58.451]
  - - [384, 2048, 1, 2048, 416, 416, 2080, 2080]
    - [12, 63.76]
  - - [384, 2048, 1, 4096, 416, 416, 4128, 4128]
    - [22, 69.822]
  - - [384, 4096, 1, 64, 416, 416, 384, 96]
    - [9, 20.954]
  - - [384, 4096, 1, 128, 416, 416, 384, 160]
    - [31, 31.816]
  - - [384, 4096, 1, 256, 416, 416, 384, 288]
    - [21, 44.609]
  - - [384, 4096, 1, 512, 416, 416, 544, 544]
    - [26, 55.412]
  - - [384, 4096, 1, 1024, 416, 416, 1056, 1056]
    - [30, 60.438]
  - - [384, 4096, 1, 2048, 416, 416, 2080, 2080]
    - [33, 66.132]
  - - [384, 4096, 1, 4096, 416, 416, 4128, 4128]
    - [19, 71.061]
  - - [768, 64, 1, 64, 800, 800, 768, 96]
    - [53, 1.104]
  - - [768, 64, 1, 128, 800, 800, 768, 160]
    - [51, 2.1]
  - - [768, 64, 1, 256, 800, 800, 768, 288]
    - [51, 3.788]
  - - [768, 64, 1, 512, 800, 800, 768, 544]
    - [39, 6.348]
  - - [768, 64, 1, 1024, 800, 800, 1056, 1056]
    - [47, 9.606]
  - - [768, 64, 1, 2048, 800, 800, 2080, 2080]
    - [37, 12.814]
  - - [768, 64, 1, 4096, 800, 800, 4128, 4128]
    - [36, 15.422]
  - - [768, 128, 1, 64, 800, 800, 768, 96]
    - [48, 2.135]
  - - [768, 128, 1, 128, 800, 800, 768, 160]
    - [67, 3.922]
  - - [768, 128, 1, 256, 800, 800, 768, 288]
    - [67, 6.808]
  - - [768, 128, 1, 512, 800, 800, 768, 544]
    - [73, 10.859]
  - - [768, 128, 1, 1024, 800, 800, 1056, 1056]
    - [59, 15.347]
  - - [768, 128, 1, 2048, 800, 800, 2080, 2080]
    - [59, 19.308]
  - - [768, 128, 1, 4096, 800, 800, 4128, 4128]
    - [59, 22.204]
  - - [768, 256, 1, 64, 800, 800, 768, 96]
    - [9, 4.079]
  - - [768, 256, 1, 128, 800, 800, 768, 160]
    - [66, 7.451]
  - - [768, 256, 1, 256, 800, 800, 768, 288]
    - [58, 12.81]
  - - [768, 256, 1, 512, 800, 800, 768, 544]
    - [72, 19.927]
  - - [768, 256, 1, 1024, 800, 800, 1056, 1056]
    - [57, 27.327]
  - - [768, 256, 1, 2048, 800, 800, 2080, 2080]
    - [71, 33.792]
  - - [768, 256, 1, 4096, 800, 800, 4128, 4128]
    - [57, 37.47]
  - - [768, 512, 1, 64, 800, 800, 768, 96]
    - [78, 7.491]
  - - [768, 512, 1, 128, 800, 800, 768, 160]
    - [75, 12.85]
  - - [768, 512, 1, 256, 800, 800, 768, 288]
    - [61, 20.217]
  - - [768, 512, 1, 512, 800, 800, 768, 544]
    - [60, 28.19]
  - - [768, 512, 1, 1024, 800, 800, 1056, 1056]
    - [74, 35.23]
  - - [768, 512, 1, 2048, 800, 800, 2080, 2080]
    - [60, 40.021]
  - - [768, 512, 1, 4096, 800, 800, 4128, 4128]
    - [85, 41.614]
  - - [768, 1024, 1, 64, 800, 800, 768, 96]
    - [73, 12.95]
  - - [768, 1024, 1, 128, 800, 800, 768, 160]
    - [17, 21.595]
  - - [768, 1024, 1, 256, 800, 800, 768, 288]
    - [12, 33.774]
  - - [768, 1024, 1, 512, 800, 800, 768, 544]
    - [11, 47.179]
  - - [768, 1024, 1, 1024, 800, 800, 1056, 1056]
    - [10, 58.668]
  - - [768, 1024, 1, 2048, 800, 800, 2080, 2080]
    - [10, 64.098]
  - - [768, 1024, 1, 4096, 800, 800, 4128, 4128]
    - [11, 70.268]
  - - [768, 2048, 1, 64, 800, 800, 768, 96]
    - [8, 20.909]
  - - [768, 2048, 1, 128, 800, 800, 768, 160]
    - [21, 31.947]
  - - [768, 2048, 1, 256, 800, 800, 768, 288]
    - [17, 44.731]
  - - [768, 2048, 1, 512, 800, 800, 768, 544]
    - [11, 55.664]
  - - [768, 2048, 1, 1024, 800, 800, 1056, 1056]
    - [26, 60.707]
  - - [768, 2048, 1, 2048, 800, 800, 2080, 2080]
    - [13, 66.603]
  - - [768, 2048, 1, 4096, 800, 800, 4128, 4128]
    - [16, 72.357]
  - - [768, 4096, 1, 64, 800, 800, 768, 96]
    - [8, 30.687]
  - - [768, 4096, 1, 128, 800, 800, 768, 160]
    - [11, 45.752]
  - - [768, 4096, 1, 256, 800, 800, 768, 288]
    - [21, 60.213]
  - - [768, 4096, 1, 512, 800, 800, 768, 544]
    - [17, 67.225]
  - - [768, 4096, 1, 1024, 800, 800, 1056, 1056]
    - [21, 74.583]
  - - [768, 4096, 1, 2048, 800, 800, 2080, 2080]
    - [17, 78.984]
  - - [768, 4096, 1, 4096, 800, 800, 4128, 4128]
    - [21, 81.824]
  - - [1536, 64, 1, 64, 1568, 1568, 1536, 96]
    - [5, 2.114]
  - - [1536, 64, 1, 128, 1568, 1568, 1536, 160]
    - [59, 3.882]
  - - [1536, 64, 1, 256, 1568, 1568, 1536, 288]
    - [73, 6.781]
  - - [1536, 64, 1, 512, 1568, 1568, 1536, 544]
    - [73, 10.852]
  - - [1536, 64, 1, 1024, 1568, 1568, 1536, 1056]
    - [59, 15.374]
  - - [1536, 64, 1, 2048, 1568, 1568, 2080, 2080]
    - [73, 19.319]
  - - [1536, 64, 1, 4096, 1568, 1568, 4128, 4128]
    - [73, 22.215]
  - - [1536, 128, 1, 64, 1568, 1568, 1536, 96]
    - [83, 4.087]
  - - [1536, 128, 1, 128, 1568, 1568, 1536, 160]
    - [70, 7.444]
  - - [1536, 128, 1, 256, 1568, 1568, 1536, 288]
    - [58, 12.752]
  - - [1536, 128, 1, 512, 1568, 1568, 1536, 544]
    - [83, 19.718]
  - - [1536, 128, 1, 1024, 1568, 1568, 1536, 1056]
    - [58, 27.191]
  - - [1536, 128, 1, 2048, 1568, 1568, 2080, 2080]
    - [70, 33.462]
  - - [1536, 128, 1, 4096, 1568, 1568, 4128, 4128]
    - [70, 36.887]
  - - [1536, 256, 1, 64, 1568, 1568, 1536, 96]
    - [84, 7.451]
  - - [1536, 256, 1, 128, 1568, 1568, 1536, 160]
    - [61, 12.802]
  - - [1536, 256, 1, 256, 1568, 1568, 1536, 288]
    - [75, 20.245]
  - - [1536, 256, 1, 512, 1568, 1568, 1536, 544]
    - [61, 28.192]
  - - [1536, 256, 1, 1024, 1568, 1568, 1536, 1056]
    - [75, 35.121]
  - - [1536, 256, 1, 2048, 1568, 1568, 2080, 2080]
    - [68, 39.977]
  - - [1536, 256, 1, 4096, 1568, 1568, 4128, 4128]
    - [61, 41.665]
  - - [1536, 512, 1, 64, 1568, 1568, 1536, 96]
    - [8, 12.744]
  - - [1536, 512, 1, 128, 1568, 1568, 1536, 160]
    - [12, 21.311]
  - - [1536, 512, 1, 256, 1568, 1568, 1536, 288]
    - [18, 33.45]
  - - [1536, 512, 1, 512, 1568, 1568, 1536, 544]
    - [22, 46.929]
  - - [1536, 512, 1, 1024, 1568, 1568, 1536, 1056]
    - [12, 58.404]
  - - [1536, 512, 1, 2048, 1568, 1568, 2080, 2080]
    - [12, 63.608]
  - - [1536, 512, 1, 4096, 1568, 1568, 4128, 4128]
    - [22, 69.839]
  - - [1536, 1024, 1, 64, 1568, 1568, 1536, 96]
    - [2, 20.855]
  - - [1536, 1024, 1, 128, 1568, 1568, 1536, 160]
    - [14, 31.58]
  - - [1536, 1024, 1, 256, 1568, 1568, 1536, 288]
    - [31, 44.266]
  - - [1536, 1024, 1, 512, 1568, 1568, 1536, 544]
    - [31, 55.496]
  - - [1536, 1024, 1, 1024, 1568, 1568, 1536, 1056]
    - [19, 61.296]
  - - [1536, 1024, 1, 2048, 1568, 1568, 2080, 2080]
    - [13, 67.125]
  - - [1536, 1024, 1, 4096, 1568, 1568, 4128, 4128]
    - [13, 70.513]
  - - [1536, 2048, 1, 64, 1568, 1568, 1536, 96]
    - [8, 30.739]
  - - [1536, 2048, 1, 128, 1568, 1568, 1536, 160]
    - [20, 45.416]
  - - [1536, 2048, 1, 256, 1568, 1568, 1536, 288]
    - [21, 60.326]
  - - [1536, 2048, 1, 512, 1568, 1568, 1536, 544]
    - [11, 70.552]
  - - [1536, 2048, 1, 1024, 1568, 1568, 1536, 1056]
    - [31, 74.635]
  - - [1536, 2048, 1, 2048, 1568, 1568, 2080, 2080]
    - [11, 78.95]
  - - [1536, 2048, 1, 4096, 1568, 1568, 4128, 4128]
    - [15, 81.645]
  - - [1536, 4096, 1, 64, 1568, 1568, 1536, 96]
    - [15, 40.559]
  - - [1536, 4096, 1, 128, 1568, 1568, 1536, 160]
    - [25, 57.83]
  - - [1536, 4096, 1, 256, 1568, 1568, 1536, 288]
    - [21, 71.285]
  - - [1536, 4096, 1, 512, 1568, 1568, 1536, 544]
    - [11, 79.33]
  - - [1536, 4096, 1, 1024, 1568, 1568, 1536, 1056]
    - [21, 85.717]
  - - [1536, 4096, 1, 2048, 1568, 1568, 2080, 2080]
    - [21, 89.451]
  - - [1536, 4096, 1, 4096, 1568, 1568, 4128, 4128]
    - [11, 90.331]
  - - [3072, 64, 1, 64, 3104, 3104, 3072, 96]
    - [58, 4.096]
  - - [3072, 64, 1, 128, 3104, 3104, 3072, 160]
    - [77, 7.473]
  - - [3072, 64, 1, 256, 3104, 3104, 3072, 288]
    - [72, 12.689]
  - - [3072, 64, 1, 512, 3104, 3104, 3072, 544]
    - [58, 19.591]
  - - [3072, 64, 1, 1024, 3104, 3104, 3072, 1056]
    - [72, 26.78]
  - - [3072, 64, 1, 2048, 3104, 3104, 3072, 2080]
    - [58, 32.845]
  - - [3072, 64, 1, 4096, 3104, 3104, 4128, 4128]
    - [71, 33.958]
  - - [3072, 128, 1, 64, 3104, 3104, 3072, 96]
    - [61, 7.509]
  - - [3072, 128, 1, 128, 3104, 3104, 3072, 160]
    - [75, 12.852]
  - - [3072, 128, 1, 256, 3104, 3104, 3072, 288]
    - [75, 20.185]
  - - [3072, 128, 1, 512, 3104, 3104, 3072, 544]
    - [75, 28.18]
  - - [3072, 128, 1, 1024, 3104, 3104, 3072, 1056]
    - [60, 35.012]
  - - [3072, 128, 1, 2048, 3104, 3104, 3072, 2080]
    - [74, 39.843]
  - - [3072, 128, 1, 4096, 3104, 3104, 4128, 4128]
    - [61, 41.646]
  - - [3072, 256, 1, 64, 3104, 3104, 3072, 96]
    - [3, 12.798]
  - - [3072, 256, 1, 128, 3104, 3104, 3072, 160]
    - [12, 21.467]
  - - [3072, 256, 1, 256, 3104, 3104, 3072, 288]
    - [12, 33.643]
  - - [3072, 256, 1, 512, 3104, 3104, 3072, 544]
    - [22, 47.013]
  - - [3072, 256, 1, 1024, 3104, 3104, 3072, 1056]
    - [22, 58.451]
  - - [3072, 256, 1, 2048, 3104, 3104, 3072, 2080]
    - [12, 63.721]
  - - [3072, 256, 1, 4096, 3104, 3104, 4128, 4128]
    - [22, 69.885]
  - - [3072, 512, 1, 64, 3104, 3104, 3072, 96]
    - [2, 20.818]
  - - [3072, 512, 1, 128, 3104, 3104, 3072, 160]
    - [17, 31.605]
  - - [3072, 512, 1, 256, 3104, 3104, 3072, 288]
    - [21, 44.29]
  - - [3072, 512, 1, 512, 3104, 3104, 3072, 544]
    - [21, 55.155]
  - - [3072, 512, 1, 1024, 3104, 3104, 3072, 1056]
    - [19, 60.836]
  - - [3072, 512, 1, 2048, 3104, 3104, 3072, 2080]
    - [19, 66.002]
  - - [3072, 512, 1, 4096, 3104, 3104, 4128, 4128]
    - [29, 70.908]
  - - [3072, 1024, 1, 64, 3104, 3104, 3072, 96]
    - [4, 30.777]
  - - [3072, 1024, 1, 128, 3104, 3104, 3072, 160]
    - [31, 45.58]
  - - [3072, 1024, 1, 256, 3104, 3104, 3072, 288]
    - [11, 60.382]
  - - [3072, 1024, 1, 512, 3104, 3104, 3072, 544]
    - [21, 67.034]
  - - [3072, 1024, 1, 1024, 3104, 3104, 3072, 1056]
    - [31, 74.361]
  - - [3072, 1024, 1, 2048, 3104, 3104, 3072, 2080]
    - [31, 78.819]
  - - [3072, 1024, 1, 4096, 3104, 3104, 4128, 4128]
    - [11, 81.676]
  - - [3072, 2048, 1, 64, 3104, 3104, 3072, 96]
    - [27, 40.574]
  - - [3072, 2048, 1, 128, 3104, 3104, 3072, 160]
    - [25, 58.135]
  - - [3072, 2048, 1, 256, 3104, 3104, 3072, 288]
    - [17, 71.786]
  - - [3072, 2048, 1, 512, 3104, 3104, 3072, 544]
    - [21, 79.436]
  - - [3072, 2048, 1, 1024, 3104, 3104, 3072, 1056]
    - [21, 85.754]
  - - [3072, 2048, 1, 2048, 3104, 3104, 3072, 2080]
    - [21, 89.425]
  - - [3072, 2048, 1, 4096, 3104, 3104, 4128, 4128]
    - [11, 90.448]
  - - [3072, 4096, 1, 64, 3104, 3104, 3072, 96]
    - [14, 50.535]
  - - [3072, 4096, 1, 128, 3104, 3104, 3072, 160]
    - [21, 63.925]
  - - [3072, 4096, 1, 256, 3104, 3104, 3072, 288]
    - [21, 76.69]
  - - [3072, 4096, 1, 512, 3104, 3104, 3072, 544]
    - [21, 84.746]
  - - [3072, 4096, 1, 1024, 3104, 3104, 3072, 1056]
    - [21, 89.368]
  - - [3072, 4096, 1, 2048, 3104, 3104, 3072, 2080]
    - [21, 91.175]
  - - [3072, 4096, 1, 4096, 3104, 3104, 4128, 4128]
    - [11, 92.721]
- null
- null
- DeviceEfficiency
