library/src/blas3/Tensile/Logic/asm_full/navi32/navi32_Cijk_Alik_Bljk_HHS_BH.yaml
- {MinimumRequiredVersion: 4.35.0}
- navi32
- gfx1101
- [Device 73f0]
    SolutionIndex: 0
    SolutionNameMin: Cijk_Alik_Bljk_HHS_BH_MT64x64x16_MI16x16x16x1_SN_1LDSB0_AMAS3_GRVW8_IU1_LPA8_LPB8_SIA1_SU0_SUS0_SVW2_TT2_32_VW2_WGM4
    SolutionIndex: 1
    SolutionNameMin: Cijk_Alik_Bljk_HHS_BH_MT64x64x16_MI16x16x16x1_SN_1LDSB1_AMAS3_GRVW2_IU1_LPA8_LPB0_SIA2_SU0_SUS0_SVW2_TT2_32_VW2_WGM4
    SolutionIndex: 2
    SolutionNameMin: Cijk_Alik_Bljk_HHS_BH_MT64x64x16_MI16x16x16x1_SN_1LDSB1_AMAS3_GRVW2_IU1_LPA8_LPB8_SIA2_SU0_SUS0_SVW2_TT2_32_VW2_WGM4
    SolutionIndex: 3
    SolutionNameMin: Cijk_Alik_Bljk_HHS_BH_MT64x64x16_MI16x16x16x1_SN_1LDSB1_AMAS3_GRVW4_IU1_LPA8_LPB8_SIA2_SU0_SUS0_SVW2_TT2_32_VW2_WGM4
    SolutionIndex: 4
    SolutionNameMin: Cijk_Alik_Bljk_HHS_BH_MT64x64x16_MI16x16x16x1_SN_1LDSB1_AMAS3_GRVW8_IU1_LPA8_LPB8_SIA2_SU0_SUS0_SVW2_TT2_32_VW2_WGM4
    SolutionIndex: 5
    SolutionNameMin: Cijk_Alik_Bljk_HHS_BH_MT64x64x16_MI16x16x16x1_SN_1LDSB0_AMAS3_GRVW8_IU1_LPA8_LPB8_SIA1_SU32_SUS256_SVW2_TT2_32_VW2_WGM4
    SolutionIndex: 6
    SolutionNameMin: Cijk_Alik_Bljk_HHS_BH_MT64x64x16_MI16x16x16x1_SN_1LDSB1_AMAS3_GRVW4_IU1_LPA8_LPB0_SIA2_SU32_SUS256_SVW2_TT2_32_VW2_WGM4
    SolutionIndex: 7
    SolutionNameMin: Cijk_Alik_Bljk_HHS_BH_MT64x64x16_MI16x16x16x1_SN_1LDSB1_AMAS3_GRVW4_IU1_LPA8_LPB8_SIA2_SU32_SUS256_SVW2_TT2_32_VW2_WGM4
    SolutionIndex: 8
    SolutionNameMin: Cijk_Alik_Bljk_HHS_BH_MT64x64x16_MI16x16x16x1_SN_1LDSB1_AMAS3_GRVW8_IU1_LPA8_LPB8_SIA2_SU32_SUS256_SVW2_TT2_32_VW2_WGM4
    SolutionIndex: 9
    SolutionNameMin: Cijk_Alik_Bljk_HHS_BH_MT64x64x16_MI16x16x16x1_SN_1LDSB0_AMAS3_GRVW8_IU1_LPA8_LPB8_SIA3_SU32_SUS256_SVW2_TT2_32_VW2_WGM4
    SolutionIndex: 10
    SolutionNameMin: Cijk_Alik_Bljk_HHS_BH_MT64x64x16_MI16x16x16x1_SN_1LDSB0_AMAS3_GRVW4_IU1_LPA8_LPB8_SIA1_SU0_SUS0_SVW2_TT2_32_VW2_WGM8
    SolutionIndex: 11
    SolutionNameMin: Cijk_Alik_Bljk_HHS_BH_MT64x64x16_MI16x16x16x1_SN_1LDSB0_AMAS3_GRVW8_IU1_LPA8_LPB8_SIA1_SU0_SUS0_SVW2_TT2_32_VW2_WGM8
    SolutionIndex: 12
    SolutionNameMin: Cijk_Alik_Bljk_HHS_BH_MT64x64x16_MI16x16x16x1_SN_1LDSB1_AMAS3_GRVW2_IU1_LPA8_LPB8_SIA2_SU0_SUS0_SVW2_TT2_32_VW2_WGM8
    SolutionIndex: 13
    SolutionNameMin: Cijk_Alik_Bljk_HHS_BH_MT64x64x16_MI16x16x16x1_SN_1LDSB1_AMAS3_GRVW4_IU1_LPA8_LPB8_SIA2_SU0_SUS0_SVW2_TT2_32_VW2_WGM8
    SolutionIndex: 14
    SolutionNameMin: Cijk_Alik_Bljk_HHS_BH_MT64x64x16_MI16x16x16x1_SN_1LDSB1_AMAS3_GRVW8_IU1_LPA8_LPB8_SIA2_SU0_SUS0_SVW2_TT2_32_VW2_WGM8
    SolutionIndex: 15
    SolutionNameMin: Cijk_Alik_Bljk_HHS_BH_MT64x64x16_MI16x16x16x1_SN_1LDSB0_AMAS3_GRVW8_IU1_LPA8_LPB8_SIA3_SU0_SUS0_SVW2_TT2_32_VW2_WGM8
    SolutionIndex: 16
    SolutionNameMin: Cijk_Alik_Bljk_HHS_BH_MT64x64x16_MI16x16x16x1_SN_1LDSB1_AMAS3_GRVW2_IU1_LPA8_LPB0_SIA2_SU32_SUS128_SVW2_TT2_32_VW2_WGM8
    SolutionIndex: 17
    SolutionNameMin: Cijk_Alik_Bljk_HHS_BH_MT64x64x16_MI16x16x16x1_SN_1LDSB0_AMAS3_GRVW8_IU1_LPA8_LPB8_SIA3_SU32_SUS128_SVW2_TT2_32_VW2_WGM8
    SolutionIndex: 18
    SolutionNameMin: Cijk_Alik_Bljk_HHS_BH_MT64x64x16_MI16x16x16x1_SN_1LDSB0_AMAS3_GRVW8_IU1_LPA8_LPB8_SIA1_SU32_SUS256_SVW2_TT2_32_VW2_WGM8
    SolutionIndex: 19
    SolutionNameMin: Cijk_Alik_Bljk_HHS_BH_MT64x64x16_MI16x16x16x1_SN_1LDSB1_AMAS3_GRVW4_IU1_LPA8_LPB8_SIA2_SU32_SUS256_SVW2_TT2_32_VW2_WGM8
    SolutionIndex: 20
    SolutionNameMin: Cijk_Alik_Bljk_HHS_BH_MT128x128x16_MI16x16x16x1_SN_1LDSB0_AMAS3_GRVW2_IU1_LPA8_LPB0_SIA1_SU0_SUS0_SVW2_TT4_64_VW2_WGM4
    SolutionIndex: 21
    SolutionNameMin: Cijk_Alik_Bljk_HHS_BH_MT128x128x16_MI16x16x16x1_SN_1LDSB0_AMAS3_GRVW8_IU1_LPA8_LPB8_SIA1_SU0_SUS0_SVW2_TT4_64_VW2_WGM4
    SolutionIndex: 22
    SolutionNameMin: Cijk_Alik_Bljk_HHS_BH_MT128x128x16_MI16x16x16x1_SN_1LDSB1_AMAS3_GRVW8_IU1_LPA8_LPB0_SIA2_SU0_SUS0_SVW2_TT4_64_VW2_WGM4
    SolutionIndex: 23
    SolutionNameMin: Cijk_Alik_Bljk_HHS_BH_MT128x128x16_MI16x16x16x1_SN_1LDSB0_AMAS3_GRVW2_IU1_LPA8_LPB0_SIA3_SU0_SUS0_SVW2_TT4_64_VW2_WGM4
    SolutionIndex: 24
    SolutionNameMin: Cijk_Alik_Bljk_HHS_BH_MT128x128x16_MI16x16x16x1_SN_1LDSB0_AMAS3_GRVW2_IU1_LPA8_LPB8_SIA3_SU0_SUS0_SVW2_TT4_64_VW2_WGM4
    SolutionIndex: 25
    SolutionNameMin: Cijk_Alik_Bljk_HHS_BH_MT128x128x16_MI16x16x16x1_SN_1LDSB0_AMAS3_GRVW8_IU1_LPA8_LPB8_SIA3_SU0_SUS0_SVW2_TT4_64_VW2_WGM4
    SolutionIndex: 26
    SolutionNameMin: Cijk_Alik_Bljk_HHS_BH_MT128x128x16_MI16x16x16x1_SN_1LDSB0_AMAS3_GRVW8_IU1_LPA8_LPB8_SIA1_SU32_SUS256_SVW2_TT4_64_VW2_WGM4
    SolutionIndex: 27
    SolutionNameMin: Cijk_Alik_Bljk_HHS_BH_MT128x128x16_MI16x16x16x1_SN_1LDSB0_AMAS3_GRVW4_IU1_LPA8_LPB8_SIA3_SU32_SUS256_SVW2_TT4_64_VW2_WGM4
    SolutionIndex: 28
    SolutionNameMin: Cijk_Alik_Bljk_HHS_BH_MT128x128x16_MI16x16x16x1_SN_1LDSB0_AMAS3_GRVW8_IU1_LPA8_LPB8_SIA3_SU32_SUS256_SVW2_TT4_64_VW2_WGM4
    SolutionIndex: 29
    SolutionNameMin: Cijk_Alik_Bljk_HHS_BH_MT128x128x16_MI16x16x16x1_SN_1LDSB0_AMAS3_GRVW2_IU1_LPA8_LPB0_SIA1_SU0_SUS0_SVW2_TT4_64_VW2_WGM8
    SolutionIndex: 30
    SolutionNameMin: Cijk_Alik_Bljk_HHS_BH_MT128x128x16_MI16x16x16x1_SN_1LDSB0_AMAS3_GRVW4_IU1_LPA8_LPB8_SIA1_SU0_SUS0_SVW2_TT4_64_VW2_WGM8
    SolutionIndex: 31
    SolutionNameMin: Cijk_Alik_Bljk_HHS_BH_MT128x128x16_MI16x16x16x1_SN_1LDSB0_AMAS3_GRVW8_IU1_LPA8_LPB8_SIA1_SU0_SUS0_SVW2_TT4_64_VW2_WGM8
    SolutionIndex: 32
    SolutionNameMin: Cijk_Alik_Bljk_HHS_BH_MT128x128x16_MI16x16x16x1_SN_1LDSB1_AMAS3_GRVW8_IU1_LPA8_LPB0_SIA2_SU0_SUS0_SVW2_TT4_64_VW2_WGM8
    SolutionIndex: 33
    SolutionNameMin: Cijk_Alik_Bljk_HHS_BH_MT128x128x16_MI16x16x16x1_SN_1LDSB0_AMAS0_GRVW8_IU1_LPA8_LPB8_SIA3_SU0_SUS0_SVW1_TT4_64_VW1_WGM8
    SolutionIndex: 34
    SolutionNameMin: Cijk_Alik_Bljk_HHS_BH_MT128x128x16_MI16x16x16x1_SN_1LDSB0_AMAS3_GRVW8_IU1_LPA8_LPB0_SIA3_SU0_SUS0_SVW2_TT4_64_VW2_WGM8
    SolutionIndex: 35
    SolutionNameMin: Cijk_Alik_Bljk_HHS_BH_MT128x128x16_MI16x16x16x1_SN_1LDSB0_AMAS3_GRVW8_IU1_LPA8_LPB8_SIA3_SU0_SUS0_SVW2_TT4_64_VW2_WGM8
    SolutionIndex: 36
    SolutionNameMin: Cijk_Alik_Bljk_HHS_BH_MT128x128x16_MI16x16x16x1_SN_1LDSB0_AMAS3_GRVW2_IU1_LPA8_LPB0_SIA1_SU32_SUS128_SVW2_TT4_64_VW2_WGM8
    SolutionIndex: 37
    SolutionNameMin: Cijk_Alik_Bljk_HHS_BH_MT128x128x16_MI16x16x16x1_SN_1LDSB0_AMAS3_GRVW4_IU1_LPA8_LPB8_SIA1_SU32_SUS128_SVW2_TT4_64_VW2_WGM8
    SolutionIndex: 38
    SolutionNameMin: Cijk_Alik_Bljk_HHS_BH_MT128x128x16_MI16x16x16x1_SN_1LDSB0_AMAS3_GRVW2_IU1_LPA8_LPB0_SIA1_SU32_SUS256_SVW2_TT4_64_VW2_WGM8
    SolutionIndex: 39
    SolutionNameMin: Cijk_Alik_Bljk_HHS_BH_MT128x128x16_MI16x16x16x1_SN_1LDSB0_AMAS3_GRVW4_IU1_LPA8_LPB8_SIA1_SU32_SUS256_SVW2_TT4_64_VW2_WGM8
    SolutionIndex: 40
    SolutionNameMin: Cijk_Alik_Bljk_HHS_BH_MT32x32x32_MI16x16x16x1_SN_1LDSB0_AMAS0_GRVW8_IU1_LPA8_LPB8_SIA1_SU0_SUS0_SVW1_TT1_16_VW1_WGM4
    SolutionIndex: 41
    SolutionNameMin: Cijk_Alik_Bljk_HHS_BH_MT32x32x32_MI16x16x16x1_SN_1LDSB1_AMAS0_GRVW2_IU2_LPA8_LPB8_SIA2_SU0_SUS0_SVW1_TT1_16_VW1_WGM4
    SolutionIndex: 42
    SolutionNameMin: Cijk_Alik_Bljk_HHS_BH_MT32x32x32_MI16x16x16x1_SN_1LDSB1_AMAS0_GRVW4_IU2_LPA8_LPB8_SIA2_SU0_SUS0_SVW1_TT1_16_VW1_WGM4
    SolutionIndex: 43
    SolutionNameMin: Cijk_Alik_Bljk_HHS_BH_MT32x32x32_MI16x16x16x1_SN_1LDSB1_AMAS0_GRVW8_IU2_LPA8_LPB8_SIA2_SU0_SUS0_SVW1_TT1_16_VW1_WGM4
    SolutionIndex: 44
    SolutionNameMin: Cijk_Alik_Bljk_HHS_BH_MT32x32x32_MI16x16x16x1_SN_1LDSB0_AMAS0_GRVW2_IU1_LPA8_LPB8_SIA3_SU0_SUS0_SVW1_TT1_16_VW1_WGM4
    SolutionIndex: 45
    SolutionNameMin: Cijk_Alik_Bljk_HHS_BH_MT32x32x32_MI16x16x16x1_SN_1LDSB0_AMAS0_GRVW8_IU1_LPA8_LPB8_SIA1_SU32_SUS128_SVW1_TT1_16_VW1_WGM4
    SolutionIndex: 46
    SolutionNameMin: Cijk_Alik_Bljk_HHS_BH_MT32x32x32_MI16x16x16x1_SN_1LDSB1_AMAS0_GRVW2_IU2_LPA8_LPB8_SIA2_SU32_SUS128_SVW1_TT1_16_VW1_WGM4
    SolutionIndex: 47
    SolutionNameMin: Cijk_Alik_Bljk_HHS_BH_MT32x32x32_MI16x16x16x1_SN_1LDSB1_AMAS0_GRVW4_IU2_LPA8_LPB8_SIA2_SU32_SUS128_SVW1_TT1_16_VW1_WGM4
    SolutionIndex: 48
    SolutionNameMin: Cijk_Alik_Bljk_HHS_BH_MT32x32x32_MI16x16x16x1_SN_1LDSB1_AMAS0_GRVW8_IU2_LPA8_LPB8_SIA2_SU32_SUS128_SVW1_TT1_16_VW1_WGM4
    SolutionIndex: 49
    SolutionNameMin: Cijk_Alik_Bljk_HHS_BH_MT32x32x32_MI16x16x16x1_SN_1LDSB0_AMAS0_GRVW8_IU1_LPA8_LPB8_SIA1_SU32_SUS256_SVW1_TT1_16_VW1_WGM4
    SolutionIndex: 50
    SolutionNameMin: Cijk_Alik_Bljk_HHS_BH_MT32x32x32_MI16x16x16x1_SN_1LDSB1_AMAS0_GRVW2_IU2_LPA8_LPB8_SIA2_SU32_SUS256_SVW1_TT1_16_VW1_WGM4
    SolutionIndex: 51
    SolutionNameMin: Cijk_Alik_Bljk_HHS_BH_MT32x32x32_MI16x16x16x1_SN_1LDSB1_AMAS0_GRVW4_IU2_LPA8_LPB8_SIA2_SU32_SUS256_SVW1_TT1_16_VW1_WGM4
    SolutionIndex: 52
    SolutionNameMin: Cijk_Alik_Bljk_HHS_BH_MT32x32x32_MI16x16x16x1_SN_1LDSB1_AMAS0_GRVW8_IU2_LPA8_LPB8_SIA2_SU32_SUS256_SVW1_TT1_16_VW1_WGM4
    SolutionIndex: 53
    SolutionNameMin: Cijk_Alik_Bljk_HHS_BH_MT32x32x32_MI16x16x16x1_SN_1LDSB0_AMAS0_GRVW4_IU1_LPA8_LPB8_SIA1_SU0_SUS0_SVW1_TT1_16_VW1_WGM8
    SolutionIndex: 54
    SolutionNameMin: Cijk_Alik_Bljk_HHS_BH_MT32x32x32_MI16x16x16x1_SN_1LDSB0_AMAS0_GRVW8_IU1_LPA8_LPB8_SIA1_SU0_SUS0_SVW1_TT1_16_VW1_WGM8
    SolutionIndex: 55
    SolutionNameMin: Cijk_Alik_Bljk_HHS_BH_MT32x32x32_MI16x16x16x1_SN_1LDSB1_AMAS0_GRVW2_IU2_LPA8_LPB8_SIA2_SU0_SUS0_SVW1_TT1_16_VW1_WGM8
    SolutionIndex: 56
    SolutionNameMin: Cijk_Alik_Bljk_HHS_BH_MT32x32x32_MI16x16x16x1_SN_1LDSB1_AMAS0_GRVW4_IU2_LPA8_LPB8_SIA2_SU0_SUS0_SVW1_TT1_16_VW1_WGM8
    SolutionIndex: 57
    SolutionNameMin: Cijk_Alik_Bljk_HHS_BH_MT32x32x32_MI16x16x16x1_SN_1LDSB1_AMAS0_GRVW8_IU2_LPA8_LPB8_SIA2_SU0_SUS0_SVW1_TT1_16_VW1_WGM8
    SolutionIndex: 58
    SolutionNameMin: Cijk_Alik_Bljk_HHS_BH_MT32x32x32_MI16x16x16x1_SN_1LDSB0_AMAS0_GRVW4_IU1_LPA8_LPB8_SIA3_SU0_SUS0_SVW1_TT1_16_VW1_WGM8
    SolutionIndex: 59
    SolutionNameMin: Cijk_Alik_Bljk_HHS_BH_MT32x32x32_MI16x16x16x1_SN_1LDSB0_AMAS0_GRVW8_IU1_LPA8_LPB8_SIA3_SU0_SUS0_SVW1_TT1_16_VW1_WGM8
    SolutionIndex: 60
    SolutionNameMin: Cijk_Alik_Bljk_HHS_BH_MT32x32x32_MI16x16x16x1_SN_1LDSB0_AMAS0_GRVW4_IU1_LPA8_LPB8_SIA1_SU32_SUS128_SVW1_TT1_16_VW1_WGM8
    SolutionIndex: 61
    SolutionNameMin: Cijk_Alik_Bljk_HHS_BH_MT32x32x32_MI16x16x16x1_SN_1LDSB1_AMAS0_GRVW2_IU2_LPA8_LPB8_SIA2_SU32_SUS128_SVW1_TT1_16_VW1_WGM8
    SolutionIndex: 62
    SolutionNameMin: Cijk_Alik_Bljk_HHS_BH_MT32x32x32_MI16x16x16x1_SN_1LDSB1_AMAS0_GRVW4_IU2_LPA8_LPB8_SIA2_SU32_SUS128_SVW1_TT1_16_VW1_WGM8
    SolutionIndex: 63
    SolutionNameMin: Cijk_Alik_Bljk_HHS_BH_MT32x32x32_MI16x16x16x1_SN_1LDSB1_AMAS0_GRVW8_IU2_LPA8_LPB8_SIA2_SU32_SUS128_SVW1_TT1_16_VW1_WGM8
    SolutionIndex: 64
    SolutionNameMin: Cijk_Alik_Bljk_HHS_BH_MT32x32x32_MI16x16x16x1_SN_1LDSB0_AMAS0_GRVW8_IU1_LPA8_LPB8_SIA3_SU32_SUS128_SVW1_TT1_16_VW1_WGM8
    SolutionIndex: 65
    SolutionNameMin: Cijk_Alik_Bljk_HHS_BH_MT32x32x32_MI16x16x16x1_SN_1LDSB0_AMAS0_GRVW8_IU1_LPA8_LPB8_SIA1_SU32_SUS256_SVW1_TT1_16_VW1_WGM8
    SolutionIndex: 66
    SolutionNameMin: Cijk_Alik_Bljk_HHS_BH_MT32x32x32_MI16x16x16x1_SN_1LDSB1_AMAS0_GRVW4_IU2_LPA8_LPB8_SIA2_SU32_SUS256_SVW1_TT1_16_VW1_WGM8
    SolutionIndex: 67
    SolutionNameMin: Cijk_Alik_Bljk_HHS_BH_MT32x32x32_MI16x16x16x1_SN_1LDSB1_AMAS0_GRVW8_IU2_LPA8_LPB8_SIA2_SU32_SUS256_SVW1_TT1_16_VW1_WGM8
    SolutionIndex: 68
    SolutionNameMin: Cijk_Alik_Bljk_HHS_BH_MT32x32x32_MI16x16x16x1_SN_1LDSB0_AMAS0_GRVW4_IU1_LPA8_LPB8_SIA3_SU32_SUS256_SVW1_TT1_16_VW1_WGM8
    SolutionIndex: 69
    SolutionNameMin: Cijk_Alik_Bljk_HHS_BH_MT64x64x32_MI16x16x16x1_SN_1LDSB0_AMAS0_GRVW4_IU1_LPA8_LPB8_SIA1_SU0_SUS0_SVW1_TT2_32_VW1_WGM4
    SolutionIndex: 70
    SolutionNameMin: Cijk_Alik_Bljk_HHS_BH_MT64x64x32_MI16x16x16x1_SN_1LDSB0_AMAS3_GRVW4_IU1_LPA8_LPB8_SIA1_SU0_SUS0_SVW2_TT2_32_VW2_WGM4
    SolutionIndex: 71
    SolutionNameMin: Cijk_Alik_Bljk_HHS_BH_MT64x64x32_MI16x16x16x1_SN_1LDSB0_AMAS0_GRVW8_IU1_LPA8_LPB8_SIA1_SU0_SUS0_SVW1_TT2_32_VW1_WGM4
    SolutionIndex: 72
    SolutionNameMin: Cijk_Alik_Bljk_HHS_BH_MT64x64x32_MI16x16x16x1_SN_1LDSB0_AMAS3_GRVW8_IU1_LPA8_LPB8_SIA1_SU0_SUS0_SVW2_TT2_32_VW2_WGM4
    SolutionIndex: 73
    SolutionNameMin: Cijk_Alik_Bljk_HHS_BH_MT64x64x32_MI16x16x16x1_SN_1LDSB1_AMAS3_GRVW4_IU2_LPA8_LPB8_SIA2_SU0_SUS0_SVW2_TT2_32_VW2_WGM4
    SolutionIndex: 74
    SolutionNameMin: Cijk_Alik_Bljk_HHS_BH_MT64x64x32_MI16x16x16x1_SN_1LDSB1_AMAS3_GRVW8_IU2_LPA8_LPB8_SIA2_SU0_SUS0_SVW2_TT2_32_VW2_WGM4
    SolutionIndex: 75
    SolutionNameMin: Cijk_Alik_Bljk_HHS_BH_MT64x64x32_MI16x16x16x1_SN_1LDSB0_AMAS3_GRVW8_IU1_LPA8_LPB8_SIA3_SU0_SUS0_SVW2_TT2_32_VW2_WGM4
    SolutionIndex: 76
    SolutionNameMin: Cijk_Alik_Bljk_HHS_BH_MT64x64x32_MI16x16x16x1_SN_1LDSB0_AMAS3_GRVW4_IU1_LPA8_LPB8_SIA1_SU32_SUS128_SVW2_TT2_32_VW2_WGM4
    SolutionIndex: 77
    SolutionNameMin: Cijk_Alik_Bljk_HHS_BH_MT64x64x32_MI16x16x16x1_SN_1LDSB0_AMAS3_GRVW8_IU1_LPA8_LPB8_SIA1_SU32_SUS128_SVW2_TT2_32_VW2_WGM4
    SolutionIndex: 78
    SolutionNameMin: Cijk_Alik_Bljk_HHS_BH_MT64x64x32_MI16x16x16x1_SN_1LDSB1_AMAS3_GRVW4_IU2_LPA8_LPB8_SIA2_SU32_SUS128_SVW2_TT2_32_VW2_WGM4
    SolutionIndex: 79
    SolutionNameMin: Cijk_Alik_Bljk_HHS_BH_MT64x64x32_MI16x16x16x1_SN_1LDSB0_AMAS3_GRVW8_IU1_LPA8_LPB8_SIA1_SU32_SUS256_SVW2_TT2_32_VW2_WGM4
    SolutionIndex: 80
    SolutionNameMin: Cijk_Alik_Bljk_HHS_BH_MT64x64x32_MI16x16x16x1_SN_1LDSB1_AMAS3_GRVW4_IU2_LPA8_LPB8_SIA2_SU32_SUS256_SVW2_TT2_32_VW2_WGM4
    SolutionIndex: 81
    SolutionNameMin: Cijk_Alik_Bljk_HHS_BH_MT64x64x32_MI16x16x16x1_SN_1LDSB1_AMAS3_GRVW8_IU2_LPA8_LPB8_SIA2_SU32_SUS256_SVW2_TT2_32_VW2_WGM4
    SolutionIndex: 82
    SolutionNameMin: Cijk_Alik_Bljk_HHS_BH_MT64x64x32_MI16x16x16x1_SN_1LDSB0_AMAS3_GRVW4_IU1_LPA8_LPB8_SIA1_SU0_SUS0_SVW2_TT2_32_VW2_WGM8
    SolutionIndex: 83
    SolutionNameMin: Cijk_Alik_Bljk_HHS_BH_MT64x64x32_MI16x16x16x1_SN_1LDSB0_AMAS0_GRVW8_IU1_LPA8_LPB8_SIA1_SU0_SUS0_SVW1_TT2_32_VW1_WGM8
    SolutionIndex: 84
    SolutionNameMin: Cijk_Alik_Bljk_HHS_BH_MT64x64x32_MI16x16x16x1_SN_1LDSB0_AMAS3_GRVW8_IU1_LPA8_LPB8_SIA1_SU0_SUS0_SVW2_TT2_32_VW2_WGM8
    SolutionIndex: 85
    SolutionNameMin: Cijk_Alik_Bljk_HHS_BH_MT64x64x32_MI16x16x16x1_SN_1LDSB1_AMAS3_GRVW2_IU2_LPA8_LPB8_SIA2_SU0_SUS0_SVW2_TT2_32_VW2_WGM8
    SolutionIndex: 86
    SolutionNameMin: Cijk_Alik_Bljk_HHS_BH_MT64x64x32_MI16x16x16x1_SN_1LDSB1_AMAS3_GRVW4_IU2_LPA8_LPB8_SIA2_SU0_SUS0_SVW2_TT2_32_VW2_WGM8
    SolutionIndex: 87
    SolutionNameMin: Cijk_Alik_Bljk_HHS_BH_MT64x64x32_MI16x16x16x1_SN_1LDSB1_AMAS3_GRVW8_IU2_LPA8_LPB8_SIA2_SU0_SUS0_SVW2_TT2_32_VW2_WGM8
    SolutionIndex: 88
    SolutionNameMin: Cijk_Alik_Bljk_HHS_BH_MT64x64x32_MI16x16x16x1_SN_1LDSB0_AMAS3_GRVW8_IU1_LPA8_LPB8_SIA3_SU0_SUS0_SVW2_TT2_32_VW2_WGM8
    SolutionIndex: 89
    SolutionNameMin: Cijk_Alik_Bljk_HHS_BH_MT64x64x32_MI16x16x16x1_SN_1LDSB0_AMAS3_GRVW2_IU1_LPA8_LPB8_SIA1_SU32_SUS128_SVW2_TT2_32_VW2_WGM8
    SolutionIndex: 90
    SolutionNameMin: Cijk_Alik_Bljk_HHS_BH_MT64x64x32_MI16x16x16x1_SN_1LDSB0_AMAS3_GRVW4_IU1_LPA8_LPB8_SIA1_SU32_SUS128_SVW2_TT2_32_VW2_WGM8
    SolutionIndex: 91
    SolutionNameMin: Cijk_Alik_Bljk_HHS_BH_MT64x64x32_MI16x16x16x1_SN_1LDSB1_AMAS3_GRVW2_IU2_LPA8_LPB8_SIA2_SU32_SUS128_SVW2_TT2_32_VW2_WGM8
    SolutionIndex: 92
    SolutionNameMin: Cijk_Alik_Bljk_HHS_BH_MT64x64x32_MI16x16x16x1_SN_1LDSB1_AMAS3_GRVW4_IU2_LPA8_LPB8_SIA2_SU32_SUS128_SVW2_TT2_32_VW2_WGM8
    SolutionIndex: 93
    SolutionNameMin: Cijk_Alik_Bljk_HHS_BH_MT64x64x32_MI16x16x16x1_SN_1LDSB1_AMAS3_GRVW8_IU2_LPA8_LPB8_SIA2_SU32_SUS128_SVW2_TT2_32_VW2_WGM8
    SolutionIndex: 94
    SolutionNameMin: Cijk_Alik_Bljk_HHS_BH_MT64x64x32_MI16x16x16x1_SN_1LDSB0_AMAS3_GRVW8_IU1_LPA8_LPB8_SIA1_SU32_SUS256_SVW2_TT2_32_VW2_WGM8
    SolutionIndex: 95
    SolutionNameMin: Cijk_Alik_Bljk_HHS_BH_MT64x64x32_MI16x16x16x1_SN_1LDSB1_AMAS3_GRVW4_IU2_LPA8_LPB8_SIA2_SU32_SUS256_SVW2_TT2_32_VW2_WGM8
    SolutionIndex: 96
    SolutionNameMin: Cijk_Alik_Bljk_HHS_BH_MT64x64x32_MI16x16x16x1_SN_1LDSB1_AMAS3_GRVW8_IU2_LPA8_LPB8_SIA2_SU32_SUS256_SVW2_TT2_32_VW2_WGM8
- - - [64, 64, 1, 64, 96, 96, 96, 96]
    - [57, 0.093]
  - - [64, 64, 1, 128, 96, 96, 160, 160]
    - [42, 0.177]
  - - [64, 64, 1, 256, 96, 96, 288, 288]
    - [57, 0.324]
  - - [64, 64, 1, 512, 96, 96, 544, 544]
    - [56, 0.564]
  - - [64, 64, 1, 1024, 96, 96, 1056, 1056]
    - [56, 0.889]
  - - [64, 64, 1, 2048, 96, 96, 2080, 2080]
    - [42, 1.227]
  - - [64, 64, 1, 4096, 96, 96, 4128, 4128]
    - [56, 1.524]
  - - [64, 128, 1, 64, 96, 96, 96, 96]
    - [57, 0.188]
  - - [64, 128, 1, 128, 96, 96, 160, 160]
    - [42, 0.36]
  - - [64, 128, 1, 256, 96, 96, 288, 288]
    - [57, 0.655]
  - - [64, 128, 1, 512, 96, 96, 544, 544]
    - [67, 1.134]
  - - [64, 128, 1, 1024, 96, 96, 1056, 1056]
    - [56, 1.789]
  - - [64, 128, 1, 2048, 96, 96, 2080, 2080]
    - [42, 2.465]
  - - [64, 128, 1, 4096, 96, 96, 4128, 4128]
    - [42, 3.063]
  - - [64, 256, 1, 64, 96, 96, 96, 96]
    - [52, 0.378]
  - - [64, 256, 1, 128, 96, 96, 160, 160]
    - [51, 0.722]
  - - [64, 256, 1, 256, 96, 96, 288, 288]
    - [62, 1.328]
  - - [64, 256, 1, 512, 96, 96, 544, 544]
    - [67, 2.289]
  - - [64, 256, 1, 1024, 96, 96, 1056, 1056]
    - [52, 3.577]
  - - [64, 256, 1, 2048, 96, 96, 2080, 2080]
    - [56, 4.921]
  - - [64, 256, 1, 4096, 96, 96, 4128, 4128]
    - [56, 6.126]
  - - [64, 512, 1, 64, 96, 96, 96, 96]
    - [65, 0.751]
  - - [64, 512, 1, 128, 96, 96, 160, 160]
    - [66, 1.439]
  - - [64, 512, 1, 256, 96, 96, 288, 288]
    - [67, 2.632]
  - - [64, 512, 1, 512, 96, 96, 544, 544]
    - [42, 4.553]
  - - [64, 512, 1, 1024, 96, 96, 1056, 1056]
    - [55, 7.074]
  - - [64, 512, 1, 2048, 96, 96, 2080, 2080]
    - [56, 9.856]
  - - [64, 512, 1, 4096, 96, 96, 4128, 4128]
    - [56, 12.167]
  - - [64, 1024, 1, 64, 96, 96, 96, 96]
    - [42, 1.48]
  - - [64, 1024, 1, 128, 96, 96, 160, 160]
    - [63, 2.775]
  - - [64, 1024, 1, 256, 96, 96, 288, 288]
    - [43, 5.077]
  - - [64, 1024, 1, 512, 96, 96, 544, 544]
    - [56, 8.654]
  - - [64, 1024, 1, 1024, 96, 96, 1056, 1056]
    - [56, 13.23]
  - - [64, 1024, 1, 2048, 96, 96, 2080, 2080]
    - [42, 18.023]
  - - [64, 1024, 1, 4096, 96, 96, 4128, 4128]
    - [56, 21.912]
  - - [64, 2048, 1, 64, 96, 96, 96, 96]
    - [42, 2.826]
  - - [64, 2048, 1, 128, 96, 96, 160, 160]
    - [87, 5.205]
  - - [64, 2048, 1, 256, 96, 96, 288, 288]
    - [86, 9.072]
  - - [64, 2048, 1, 512, 96, 96, 544, 544]
    - [74, 14.76]
  - - [64, 2048, 1, 1024, 96, 96, 1056, 1056]
    - [95, 21.109]
  - - [64, 2048, 1, 2048, 96, 96, 2080, 2080]
    - [74, 26.973]
  - - [64, 2048, 1, 4096, 96, 96, 4128, 4128]
    - [96, 31.348]
  - - [64, 4096, 1, 64, 96, 96, 96, 96]
    - [80, 5.378]
  - - [64, 4096, 1, 128, 96, 96, 160, 160]
    - [87, 9.853]
  - - [64, 4096, 1, 256, 96, 96, 288, 288]
    - [74, 16.735]
  - - [64, 4096, 1, 512, 96, 96, 544, 544]
    - [79, 25.905]
  - - [64, 4096, 1, 1024, 96, 96, 1056, 1056]
    - [76, 35.927]
  - - [64, 4096, 1, 2048, 96, 96, 2080, 2080]
    - [77, 44.674]
  - - [64, 4096, 1, 4096, 96, 96, 4128, 4128]
    - [94, 50.757]
  - - [128, 64, 1, 64, 160, 160, 96, 96]
    - [60, 0.187]
  - - [128, 64, 1, 128, 160, 160, 160, 160]
    - [42, 0.36]
  - - [128, 64, 1, 256, 160, 160, 288, 288]
    - [56, 0.663]
  - - [128, 64, 1, 512, 160, 160, 544, 544]
    - [66, 1.126]
  - - [128, 64, 1, 1024, 160, 160, 1056, 1056]
    - [66, 1.771]
  - - [128, 64, 1, 2048, 160, 160, 2080, 2080]
    - [42, 2.446]
  - - [128, 64, 1, 4096, 160, 160, 4128, 4128]
    - [56, 3.027]
  - - [128, 128, 1, 64, 160, 160, 96, 96]
    - [68, 0.378]
  - - [128, 128, 1, 128, 160, 160, 160, 160]
    - [57, 0.728]
  - - [128, 128, 1, 256, 160, 160, 288, 288]
    - [57, 1.33]
  - - [128, 128, 1, 512, 160, 160, 544, 544]
    - [66, 2.266]
  - - [128, 128, 1, 1024, 160, 160, 1056, 1056]
    - [51, 3.567]
  - - [128, 128, 1, 2048, 160, 160, 2080, 2080]
    - [42, 4.915]
  - - [128, 128, 1, 4096, 160, 160, 4128, 4128]
    - [62, 6.078]
  - - [128, 256, 1, 64, 160, 160, 96, 96]
    - [50, 0.751]
  - - [128, 256, 1, 128, 160, 160, 160, 160]
    - [44, 1.425]
  - - [128, 256, 1, 256, 160, 160, 288, 288]
    - [47, 2.633]
  - - [128, 256, 1, 512, 160, 160, 544, 544]
    - [62, 4.534]
  - - [128, 256, 1, 1024, 160, 160, 1056, 1056]
    - [57, 7.119]
  - - [128, 256, 1, 2048, 160, 160, 2080, 2080]
    - [56, 9.902]
  - - [128, 256, 1, 4096, 160, 160, 4128, 4128]
    - [56, 12.309]
  - - [128, 512, 1, 64, 160, 160, 96, 96]
    - [54, 1.474]
  - - [128, 512, 1, 128, 160, 160, 160, 160]
    - [45, 2.785]
  - - [128, 512, 1, 256, 160, 160, 288, 288]
    - [62, 5.073]
  - - [128, 512, 1, 512, 160, 160, 544, 544]
    - [56, 8.655]
  - - [128, 512, 1, 1024, 160, 160, 1056, 1056]
    - [56, 13.233]
  - - [128, 512, 1, 2048, 160, 160, 2080, 2080]
    - [42, 17.972]
  - - [128, 512, 1, 4096, 160, 160, 4128, 4128]
    - [56, 22.01]
  - - [128, 1024, 1, 64, 160, 160, 96, 96]
    - [54, 2.797]
  - - [128, 1024, 1, 128, 160, 160, 160, 160]
    - [53, 5.221]
  - - [128, 1024, 1, 256, 160, 160, 288, 288]
    - [40, 9.145]
  - - [128, 1024, 1, 512, 160, 160, 544, 544]
    - [73, 14.75]
  - - [128, 1024, 1, 1024, 160, 160, 1056, 1056]
    - [73, 21.186]
  - - [128, 1024, 1, 2048, 160, 160, 2080, 2080]
    - [74, 27.004]
  - - [128, 1024, 1, 4096, 160, 160, 4128, 4128]
    - [73, 31.385]
  - - [128, 2048, 1, 64, 160, 160, 96, 96]
    - [8, 5.388]
  - - [128, 2048, 1, 128, 160, 160, 160, 160]
    - [5, 9.844]
  - - [128, 2048, 1, 256, 160, 160, 288, 288]
    - [0, 16.916]
  - - [128, 2048, 1, 512, 160, 160, 544, 544]
    - [0, 26.2]
  - - [128, 2048, 1, 1024, 160, 160, 1056, 1056]
    - [0, 35.98]
  - - [128, 2048, 1, 2048, 160, 160, 2080, 2080]
    - [72, 44.701]
  - - [128, 2048, 1, 4096, 160, 160, 4128, 4128]
    - [77, 50.058]
  - - [128, 4096, 1, 64, 160, 160, 96, 96]
    - [86, 9.822]
  - - [128, 4096, 1, 128, 160, 160, 160, 160]
    - [8, 17.228]
  - - [128, 4096, 1, 256, 160, 160, 288, 288]
    - [0, 27.631]
  - - [128, 4096, 1, 512, 160, 160, 544, 544]
    - [0, 39.69]
  - - [128, 4096, 1, 1024, 160, 160, 1056, 1056]
    - [88, 51.238]
  - - [128, 4096, 1, 2048, 160, 160, 2080, 2080]
    - [88, 59.832]
  - - [128, 4096, 1, 4096, 160, 160, 4128, 4128]
    - [88, 62.972]
  - - [256, 64, 1, 64, 288, 288, 96, 96]
    - [42, 0.375]
  - - [256, 64, 1, 128, 288, 288, 160, 160]
    - [66, 0.725]
  - - [256, 64, 1, 256, 288, 288, 288, 288]
    - [61, 1.317]
  - - [256, 64, 1, 512, 288, 288, 544, 544]
    - [66, 2.265]
  - - [256, 64, 1, 1024, 288, 288, 1056, 1056]
    - [47, 3.556]
  - - [256, 64, 1, 2048, 288, 288, 2080, 2080]
    - [51, 4.901]
  - - [256, 64, 1, 4096, 288, 288, 4128, 4128]
    - [62, 6.059]
  - - [256, 128, 1, 64, 288, 288, 96, 96]
    - [56, 0.753]
  - - [256, 128, 1, 128, 288, 288, 160, 160]
    - [67, 1.424]
  - - [256, 128, 1, 256, 288, 288, 288, 288]
    - [46, 2.634]
  - - [256, 128, 1, 512, 288, 288, 544, 544]
    - [52, 4.535]
  - - [256, 128, 1, 1024, 288, 288, 1056, 1056]
    - [42, 7.13]
  - - [256, 128, 1, 2048, 288, 288, 2080, 2080]
    - [42, 9.831]
  - - [256, 128, 1, 4096, 288, 288, 4128, 4128]
    - [56, 12.19]
  - - [256, 256, 1, 64, 288, 288, 96, 96]
    - [40, 1.468]
  - - [256, 256, 1, 128, 288, 288, 160, 160]
    - [57, 2.788]
  - - [256, 256, 1, 256, 288, 288, 288, 288]
    - [56, 5.069]
  - - [256, 256, 1, 512, 288, 288, 544, 544]
    - [57, 8.576]
  - - [256, 256, 1, 1024, 288, 288, 1056, 1056]
    - [42, 13.233]
  - - [256, 256, 1, 2048, 288, 288, 2080, 2080]
    - [56, 17.99]
  - - [256, 256, 1, 4096, 288, 288, 4128, 4128]
    - [56, 22.053]
  - - [256, 512, 1, 64, 288, 288, 96, 96]
    - [57, 2.821]
  - - [256, 512, 1, 128, 288, 288, 160, 160]
    - [87, 5.227]
  - - [256, 512, 1, 256, 288, 288, 288, 288]
    - [87, 9.13]
  - - [256, 512, 1, 512, 288, 288, 544, 544]
    - [73, 14.636]
  - - [256, 512, 1, 1024, 288, 288, 1056, 1056]
    - [86, 21.162]
  - - [256, 512, 1, 2048, 288, 288, 2080, 2080]
    - [93, 26.976]
  - - [256, 512, 1, 4096, 288, 288, 4128, 4128]
    - [86, 31.332]
  - - [256, 1024, 1, 64, 288, 288, 96, 96]
    - [10, 5.409]
  - - [256, 1024, 1, 128, 288, 288, 160, 160]
    - [96, 9.935]
  - - [256, 1024, 1, 256, 288, 288, 288, 288]
    - [11, 16.776]
  - - [256, 1024, 1, 512, 288, 288, 544, 544]
    - [11, 25.978]
  - - [256, 1024, 1, 1024, 288, 288, 1056, 1056]
    - [11, 35.956]
  - - [256, 1024, 1, 2048, 288, 288, 2080, 2080]
    - [11, 44.582]
  - - [256, 1024, 1, 4096, 288, 288, 4128, 4128]
    - [94, 49.238]
  - - [256, 2048, 1, 64, 288, 288, 96, 96]
    - [19, 9.768]
  - - [256, 2048, 1, 128, 288, 288, 160, 160]
    - [14, 17.28]
  - - [256, 2048, 1, 256, 288, 288, 288, 288]
    - [14, 27.708]
  - - [256, 2048, 1, 512, 288, 288, 544, 544]
    - [88, 39.661]
  - - [256, 2048, 1, 1024, 288, 288, 1056, 1056]
    - [75, 51.304]
  - - [256, 2048, 1, 2048, 288, 288, 2080, 2080]
    - [88, 59.848]
  - - [256, 2048, 1, 4096, 288, 288, 4128, 4128]
    - [5, 62.916]
  - - [256, 4096, 1, 64, 288, 288, 96, 96]
    - [87, 15.988]
  - - [256, 4096, 1, 128, 288, 288, 160, 160]
    - [12, 27.02]
  - - [256, 4096, 1, 256, 288, 288, 288, 288]
    - [78, 40.268]
  - - [256, 4096, 1, 512, 288, 288, 544, 544]
    - [87, 52.639]
  - - [256, 4096, 1, 1024, 288, 288, 1056, 1056]
    - [92, 62.012]
  - - [256, 4096, 1, 2048, 288, 288, 2080, 2080]
    - [90, 65.263]
  - - [256, 4096, 1, 4096, 288, 288, 4128, 4128]
    - [90, 69.842]
  - - [384, 64, 1, 64, 416, 416, 96, 96]
    - [54, 0.567]
  - - [384, 64, 1, 128, 416, 416, 160, 160]
    - [56, 1.084]
  - - [384, 64, 1, 256, 416, 416, 288, 288]
    - [42, 1.976]
  - - [384, 64, 1, 512, 416, 416, 544, 544]
    - [56, 3.401]
  - - [384, 64, 1, 1024, 416, 416, 1056, 1056]
    - [66, 5.305]
  - - [384, 64, 1, 2048, 416, 416, 2080, 2080]
    - [66, 7.319]
  - - [384, 64, 1, 4096, 416, 416, 4128, 4128]
    - [56, 9.049]
  - - [384, 128, 1, 64, 416, 416, 96, 96]
    - [41, 1.119]
  - - [384, 128, 1, 128, 416, 416, 160, 160]
    - [67, 2.138]
  - - [384, 128, 1, 256, 416, 416, 288, 288]
    - [42, 3.92]
  - - [384, 128, 1, 512, 416, 416, 544, 544]
    - [43, 6.729]
  - - [384, 128, 1, 1024, 416, 416, 1056, 1056]
    - [42, 10.536]
  - - [384, 128, 1, 2048, 416, 416, 2080, 2080]
    - [56, 14.542]
  - - [384, 128, 1, 4096, 416, 416, 4128, 4128]
    - [42, 17.986]
  - - [384, 256, 1, 64, 416, 416, 96, 96]
    - [53, 2.151]
  - - [384, 256, 1, 128, 416, 416, 160, 160]
    - [42, 4.047]
  - - [384, 256, 1, 256, 416, 416, 288, 288]
    - [43, 7.206]
  - - [384, 256, 1, 512, 416, 416, 544, 544]
    - [57, 11.773]
  - - [384, 256, 1, 1024, 416, 416, 1056, 1056]
    - [49, 17.38]
  - - [384, 256, 1, 2048, 416, 416, 2080, 2080]
    - [58, 22.748]
  - - [384, 256, 1, 4096, 416, 416, 4128, 4128]
    - [64, 26.98]
  - - [384, 512, 1, 64, 416, 416, 96, 96]
    - [75, 4.144]
  - - [384, 512, 1, 128, 416, 416, 160, 160]
    - [80, 7.718]
  - - [384, 512, 1, 256, 416, 416, 288, 288]
    - [74, 13.649]
  - - [384, 512, 1, 512, 416, 416, 544, 544]
    - [86, 21.901]
  - - [384, 512, 1, 1024, 416, 416, 1056, 1056]
    - [74, 31.547]
  - - [384, 512, 1, 2048, 416, 416, 2080, 2080]
    - [86, 40.283]
  - - [384, 512, 1, 4096, 416, 416, 4128, 4128]
    - [74, 46.688]
  - - [384, 1024, 1, 64, 416, 416, 96, 96]
    - [4, 7.709]
  - - [384, 1024, 1, 128, 416, 416, 160, 160]
    - [13, 13.812]
  - - [384, 1024, 1, 256, 416, 416, 288, 288]
    - [12, 22.822]
  - - [384, 1024, 1, 512, 416, 416, 544, 544]
    - [11, 34.002]
  - - [384, 1024, 1, 1024, 416, 416, 1056, 1056]
    - [88, 44.823]
  - - [384, 1024, 1, 2048, 416, 416, 2080, 2080]
    - [79, 53.822]
  - - [384, 1024, 1, 4096, 416, 416, 4128, 4128]
    - [94, 57.582]
  - - [384, 2048, 1, 64, 416, 416, 96, 96]
    - [15, 13.086]
  - - [384, 2048, 1, 128, 416, 416, 160, 160]
    - [3, 22.264]
  - - [384, 2048, 1, 256, 416, 416, 288, 288]
    - [15, 34.087]
  - - [384, 2048, 1, 512, 416, 416, 544, 544]
    - [29, 46.898]
  - - [384, 2048, 1, 1024, 416, 416, 1056, 1056]
    - [22, 58.491]
  - - [384, 2048, 1, 2048, 416, 416, 2080, 2080]
    - [29, 64.237]
  - - [384, 2048, 1, 4096, 416, 416, 4128, 4128]
    - [29, 70.248]
  - - [384, 4096, 1, 64, 416, 416, 96, 96]
    - [3, 20.8]
  - - [384, 4096, 1, 128, 416, 416, 160, 160]
    - [13, 33.601]
  - - [384, 4096, 1, 256, 416, 416, 288, 288]
    - [85, 47.128]
  - - [384, 4096, 1, 512, 416, 416, 544, 544]
    - [82, 59.968]
  - - [384, 4096, 1, 1024, 416, 416, 1056, 1056]
    - [84, 66.48]
  - - [384, 4096, 1, 2048, 416, 416, 2080, 2080]
    - [72, 73.43]
  - - [384, 4096, 1, 4096, 416, 416, 4128, 4128]
    - [84, 77.427]
  - - [768, 64, 1, 64, 800, 800, 96, 96]
    - [56, 1.12]
  - - [768, 64, 1, 128, 800, 800, 160, 160]
    - [63, 2.115]
  - - [768, 64, 1, 256, 800, 800, 288, 288]
    - [48, 3.946]
  - - [768, 64, 1, 512, 800, 800, 544, 544]
    - [48, 6.696]
  - - [768, 64, 1, 1024, 800, 800, 1056, 1056]
    - [56, 10.501]
  - - [768, 64, 1, 2048, 800, 800, 2080, 2080]
    - [56, 14.484]
  - - [768, 64, 1, 4096, 800, 800, 4128, 4128]
    - [56, 17.863]
  - - [768, 128, 1, 64, 800, 800, 96, 96]
    - [62, 2.143]
  - - [768, 128, 1, 128, 800, 800, 160, 160]
    - [59, 4.028]
  - - [768, 128, 1, 256, 800, 800, 288, 288]
    - [43, 7.214]
  - - [768, 128, 1, 512, 800, 800, 544, 544]
    - [57, 11.836]
  - - [768, 128, 1, 1024, 800, 800, 1056, 1056]
    - [43, 17.4]
  - - [768, 128, 1, 2048, 800, 800, 2080, 2080]
    - [43, 22.729]
  - - [768, 128, 1, 4096, 800, 800, 4128, 4128]
    - [43, 26.773]
  - - [768, 256, 1, 64, 800, 800, 96, 96]
    - [86, 4.144]
  - - [768, 256, 1, 128, 800, 800, 160, 160]
    - [86, 7.728]
  - - [768, 256, 1, 256, 800, 800, 288, 288]
    - [87, 13.649]
  - - [768, 256, 1, 512, 800, 800, 544, 544]
    - [74, 21.895]
  - - [768, 256, 1, 1024, 800, 800, 1056, 1056]
    - [87, 31.429]
  - - [768, 256, 1, 2048, 800, 800, 2080, 2080]
    - [86, 40.174]
  - - [768, 256, 1, 4096, 800, 800, 4128, 4128]
    - [74, 46.66]
  - - [768, 512, 1, 64, 800, 800, 96, 96]
    - [14, 7.724]
  - - [768, 512, 1, 128, 800, 800, 160, 160]
    - [14, 13.958]
  - - [768, 512, 1, 256, 800, 800, 288, 288]
    - [3, 22.825]
  - - [768, 512, 1, 512, 800, 800, 544, 544]
    - [11, 34.009]
  - - [768, 512, 1, 1024, 800, 800, 1056, 1056]
    - [88, 44.958]
  - - [768, 512, 1, 2048, 800, 800, 2080, 2080]
    - [18, 53.791]
  - - [768, 512, 1, 4096, 800, 800, 4128, 4128]
    - [72, 57.469]
  - - [768, 1024, 1, 64, 800, 800, 96, 96]
    - [17, 13.078]
  - - [768, 1024, 1, 128, 800, 800, 160, 160]
    - [15, 22.225]
  - - [768, 1024, 1, 256, 800, 800, 288, 288]
    - [15, 34.144]
  - - [768, 1024, 1, 512, 800, 800, 544, 544]
    - [32, 46.825]
  - - [768, 1024, 1, 1024, 800, 800, 1056, 1056]
    - [20, 58.491]
  - - [768, 1024, 1, 2048, 800, 800, 2080, 2080]
    - [20, 64.204]
  - - [768, 1024, 1, 4096, 800, 800, 4128, 4128]
    - [29, 70.156]
  - - [768, 2048, 1, 64, 800, 800, 96, 96]
    - [13, 20.842]
  - - [768, 2048, 1, 128, 800, 800, 160, 160]
    - [14, 33.396]
  - - [768, 2048, 1, 256, 800, 800, 288, 288]
    - [70, 46.705]
  - - [768, 2048, 1, 512, 800, 800, 544, 544]
    - [82, 59.861]
  - - [768, 2048, 1, 1024, 800, 800, 1056, 1056]
    - [84, 66.392]
  - - [768, 2048, 1, 2048, 800, 800, 2080, 2080]
    - [84, 73.392]
  - - [768, 2048, 1, 4096, 800, 800, 4128, 4128]
    - [84, 77.4]
  - - [768, 4096, 1, 64, 800, 800, 96, 96]
    - [16, 29.719]
  - - [768, 4096, 1, 128, 800, 800, 160, 160]
    - [30, 44.927]
  - - [768, 4096, 1, 256, 800, 800, 288, 288]
    - [25, 59.438]
  - - [768, 4096, 1, 512, 800, 800, 544, 544]
    - [82, 64.341]
  - - [768, 4096, 1, 1024, 800, 800, 1056, 1056]
    - [37, 74.217]
  - - [768, 4096, 1, 2048, 800, 800, 2080, 2080]
    - [35, 78.343]
  - - [768, 4096, 1, 4096, 800, 800, 4128, 4128]
    - [27, 79.816]
  - - [1536, 64, 1, 64, 1568, 1568, 96, 96]
    - [53, 2.159]
  - - [1536, 64, 1, 128, 1568, 1568, 160, 160]
    - [42, 4.041]
  - - [1536, 64, 1, 256, 1568, 1568, 288, 288]
    - [57, 7.238]
  - - [1536, 64, 1, 512, 1568, 1568, 544, 544]
    - [43, 11.797]
  - - [1536, 64, 1, 1024, 1568, 1568, 1056, 1056]
    - [57, 17.378]
  - - [1536, 64, 1, 2048, 1568, 1568, 2080, 2080]
    - [57, 22.754]
  - - [1536, 64, 1, 4096, 1568, 1568, 4128, 4128]
    - [67, 26.711]
  - - [1536, 128, 1, 64, 1568, 1568, 96, 96]
    - [96, 4.127]
  - - [1536, 128, 1, 128, 1568, 1568, 160, 160]
    - [86, 7.695]
  - - [1536, 128, 1, 256, 1568, 1568, 288, 288]
    - [93, 13.514]
  - - [1536, 128, 1, 512, 1568, 1568, 544, 544]
    - [87, 21.892]
  - - [1536, 128, 1, 1024, 1568, 1568, 1056, 1056]
    - [87, 31.486]
  - - [1536, 128, 1, 2048, 1568, 1568, 2080, 2080]
    - [86, 40.208]
  - - [1536, 128, 1, 4096, 1568, 1568, 4128, 4128]
    - [73, 46.703]
  - - [1536, 256, 1, 64, 1568, 1568, 96, 96]
    - [14, 7.714]
  - - [1536, 256, 1, 128, 1568, 1568, 160, 160]
    - [14, 13.878]
  - - [1536, 256, 1, 256, 1568, 1568, 288, 288]
    - [0, 22.819]
  - - [1536, 256, 1, 512, 1568, 1568, 544, 544]
    - [11, 33.778]
  - - [1536, 256, 1, 1024, 1568, 1568, 1056, 1056]
    - [84, 44.854]
  - - [1536, 256, 1, 2048, 1568, 1568, 2080, 2080]
    - [71, 53.742]
  - - [1536, 256, 1, 4096, 1568, 1568, 4128, 4128]
    - [84, 57.525]
  - - [1536, 512, 1, 64, 1568, 1568, 96, 96]
    - [9, 12.974]
  - - [1536, 512, 1, 128, 1568, 1568, 160, 160]
    - [86, 22.191]
  - - [1536, 512, 1, 256, 1568, 1568, 288, 288]
    - [3, 34.319]
  - - [1536, 512, 1, 512, 1568, 1568, 544, 544]
    - [11, 46.549]
  - - [1536, 512, 1, 1024, 1568, 1568, 1056, 1056]
    - [22, 58.308]
  - - [1536, 512, 1, 2048, 1568, 1568, 2080, 2080]
    - [29, 63.911]
  - - [1536, 512, 1, 4096, 1568, 1568, 4128, 4128]
    - [20, 70.047]
  - - [1536, 1024, 1, 64, 1568, 1568, 96, 96]
    - [6, 20.64]
  - - [1536, 1024, 1, 128, 1568, 1568, 160, 160]
    - [3, 33.667]
  - - [1536, 1024, 1, 256, 1568, 1568, 288, 288]
    - [91, 46.721]
  - - [1536, 1024, 1, 512, 1568, 1568, 544, 544]
    - [82, 59.861]
  - - [1536, 1024, 1, 1024, 1568, 1568, 1056, 1056]
    - [69, 67.232]
  - - [1536, 1024, 1, 2048, 1568, 1568, 2080, 2080]
    - [84, 73.414]
  - - [1536, 1024, 1, 4096, 1568, 1568, 4128, 4128]
    - [83, 77.267]
  - - [1536, 2048, 1, 64, 1568, 1568, 96, 96]
    - [1, 29.996]
  - - [1536, 2048, 1, 128, 1568, 1568, 160, 160]
    - [39, 44.798]
  - - [1536, 2048, 1, 256, 1568, 1568, 288, 288]
    - [35, 59.255]
  - - [1536, 2048, 1, 512, 1568, 1568, 544, 544]
    - [89, 62.979]
  - - [1536, 2048, 1, 1024, 1568, 1568, 1056, 1056]
    - [31, 74.166]
  - - [1536, 2048, 1, 2048, 1568, 1568, 2080, 2080]
    - [33, 78.678]
  - - [1536, 2048, 1, 4096, 1568, 1568, 4128, 4128]
    - [82, 79.018]
  - - [1536, 4096, 1, 64, 1568, 1568, 96, 96]
    - [28, 39.692]
  - - [1536, 4096, 1, 128, 1568, 1568, 160, 160]
    - [31, 56.073]
  - - [1536, 4096, 1, 256, 1568, 1568, 288, 288]
    - [21, 67.051]
  - - [1536, 4096, 1, 512, 1568, 1568, 544, 544]
    - [24, 74.105]
  - - [1536, 4096, 1, 1024, 1568, 1568, 1056, 1056]
    - [36, 82.012]
  - - [1536, 4096, 1, 2048, 1568, 1568, 2080, 2080]
    - [24, 85.931]
  - - [1536, 4096, 1, 4096, 1568, 1568, 4128, 4128]
    - [23, 86.633]
  - - [3072, 64, 1, 64, 3104, 3104, 96, 96]
    - [87, 4.113]
  - - [3072, 64, 1, 128, 3104, 3104, 160, 160]
    - [81, 7.736]
  - - [3072, 64, 1, 256, 3104, 3104, 288, 288]
    - [74, 13.536]
  - - [3072, 64, 1, 512, 3104, 3104, 544, 544]
    - [74, 21.854]
  - - [3072, 64, 1, 1024, 3104, 3104, 1056, 1056]
    - [74, 31.405]
  - - [3072, 64, 1, 2048, 3104, 3104, 2080, 2080]
    - [74, 40.157]
  - - [3072, 64, 1, 4096, 3104, 3104, 4128, 4128]
    - [73, 46.701]
  - - [3072, 128, 1, 64, 3104, 3104, 96, 96]
    - [7, 7.696]
  - - [3072, 128, 1, 128, 3104, 3104, 160, 160]
    - [19, 13.859]
  - - [3072, 128, 1, 256, 3104, 3104, 288, 288]
    - [13, 22.803]
  - - [3072, 128, 1, 512, 3104, 3104, 544, 544]
    - [72, 33.522]
  - - [3072, 128, 1, 1024, 3104, 3104, 1056, 1056]
    - [84, 44.949]
  - - [3072, 128, 1, 2048, 3104, 3104, 2080, 2080]
    - [84, 54.01]
  - - [3072, 128, 1, 4096, 3104, 3104, 4128, 4128]
    - [72, 57.458]
  - - [3072, 256, 1, 64, 3104, 3104, 96, 96]
    - [0, 12.935]
  - - [3072, 256, 1, 128, 3104, 3104, 160, 160]
    - [3, 22.264]
  - - [3072, 256, 1, 256, 3104, 3104, 288, 288]
    - [14, 34.485]
  - - [3072, 256, 1, 512, 3104, 3104, 544, 544]
    - [22, 46.605]
  - - [3072, 256, 1, 1024, 3104, 3104, 1056, 1056]
    - [22, 58.373]
  - - [3072, 256, 1, 2048, 3104, 3104, 2080, 2080]
    - [29, 63.696]
  - - [3072, 256, 1, 4096, 3104, 3104, 4128, 4128]
    - [29, 70.079]
  - - [3072, 512, 1, 64, 3104, 3104, 96, 96]
    - [2, 20.781]
  - - [3072, 512, 1, 128, 3104, 3104, 160, 160]
    - [8, 33.883]
  - - [3072, 512, 1, 256, 3104, 3104, 288, 288]
    - [73, 46.768]
  - - [3072, 512, 1, 512, 3104, 3104, 544, 544]
    - [84, 60.017]
  - - [3072, 512, 1, 1024, 3104, 3104, 1056, 1056]
    - [70, 69.012]
  - - [3072, 512, 1, 2048, 3104, 3104, 2080, 2080]
    - [84, 73.337]
  - - [3072, 512, 1, 4096, 3104, 3104, 4128, 4128]
    - [84, 77.319]
  - - [3072, 1024, 1, 64, 3104, 3104, 96, 96]
    - [1, 30.054]
  - - [3072, 1024, 1, 128, 3104, 3104, 160, 160]
    - [31, 44.903]
  - - [3072, 1024, 1, 256, 3104, 3104, 288, 288]
    - [35, 59.252]
  - - [3072, 1024, 1, 512, 3104, 3104, 544, 544]
    - [34, 64.42]
  - - [3072, 1024, 1, 1024, 3104, 3104, 1056, 1056]
    - [30, 74.411]
  - - [3072, 1024, 1, 2048, 3104, 3104, 2080, 2080]
    - [33, 79.127]
  - - [3072, 1024, 1, 4096, 3104, 3104, 4128, 4128]
    - [82, 78.954]
  - - [3072, 2048, 1, 64, 3104, 3104, 96, 96]
    - [26, 39.508]
  - - [3072, 2048, 1, 128, 3104, 3104, 160, 160]
    - [30, 56.716]
  - - [3072, 2048, 1, 256, 3104, 3104, 288, 288]
    - [31, 69.743]
  - - [3072, 2048, 1, 512, 3104, 3104, 544, 544]
    - [82, 70.675]
  - - [3072, 2048, 1, 1024, 3104, 3104, 1056, 1056]
    - [36, 82.107]
  - - [3072, 2048, 1, 2048, 3104, 3104, 2080, 2080]
    - [24, 85.207]
  - - [3072, 2048, 1, 4096, 3104, 3104, 4128, 4128]
    - [24, 86.876]
  - - [3072, 4096, 1, 64, 3104, 3104, 96, 96]
    - [28, 49.372]
  - - [3072, 4096, 1, 128, 3104, 3104, 160, 160]
    - [31, 62.465]
  - - [3072, 4096, 1, 256, 3104, 3104, 288, 288]
    - [31, 74.781]
  - - [3072, 4096, 1, 512, 3104, 3104, 544, 544]
    - [82, 74.834]
  - - [3072, 4096, 1, 1024, 3104, 3104, 1056, 1056]
    - [37, 85.957]
  - - [3072, 4096, 1, 2048, 3104, 3104, 2080, 2080]
    - [38, 83.56]
  - - [3072, 4096, 1, 4096, 3104, 3104, 4128, 4128]
    - [23, 82.526]
- null
- null
- DeviceEfficiency
