library/src/blas3/Tensile/Logic/asm_full/navi32/navi32_Cijk_Alik_Bjlk_BBS_BH_GB.yaml
- {MinimumRequiredVersion: 4.35.0}
- navi32
- gfx1101
- [Device 73f0]
    SolutionIndex: 0
    SolutionNameMin: Cijk_Alik_Bjlk_BBS_BH_MT64x64x16_MI16x16x16x1_SN_1LDSB0_AMAS3_GRVW4_IU1_LPA8_LPB0_NLCB1_SIA1_SU0_SUS0_SVW2_TT2_32_VW2_WGM4
    SolutionIndex: 1
    SolutionNameMin: Cijk_Alik_Bjlk_BBS_BH_MT64x64x16_MI16x16x16x1_SN_1LDSB0_AMAS3_GRVW8_IU1_LPA8_LPB0_NLCB1_SIA1_SU0_SUS0_SVW2_TT2_32_VW2_WGM4
    SolutionIndex: 2
    SolutionNameMin: Cijk_Alik_Bjlk_BBS_BH_MT64x64x16_MI16x16x16x1_SN_1LDSB0_AMAS3_GRVW8_IU1_LPA8_LPB8_NLCB1_SIA1_SU0_SUS0_SVW2_TT2_32_VW2_WGM4
    SolutionIndex: 3
    SolutionNameMin: Cijk_Alik_Bjlk_BBS_BH_MT64x64x16_MI16x16x16x1_SN_1LDSB1_AMAS3_GRVW4_IU1_LPA8_LPB0_NLCB1_SIA2_SU0_SUS0_SVW2_TT2_32_VW2_WGM4
    SolutionIndex: 4
    SolutionNameMin: Cijk_Alik_Bjlk_BBS_BH_MT64x64x16_MI16x16x16x1_SN_1LDSB1_AMAS3_GRVW4_IU1_LPA8_LPB8_NLCB1_SIA2_SU0_SUS0_SVW2_TT2_32_VW2_WGM4
    SolutionIndex: 5
    SolutionNameMin: Cijk_Alik_Bjlk_BBS_BH_MT64x64x16_MI16x16x16x1_SN_1LDSB1_AMAS0_GRVW8_IU1_LPA8_LPB8_NLCB1_SIA2_SU0_SUS0_SVW1_TT2_32_VW1_WGM4
    SolutionIndex: 6
    SolutionNameMin: Cijk_Alik_Bjlk_BBS_BH_MT64x64x16_MI16x16x16x1_SN_1LDSB1_AMAS3_GRVW8_IU1_LPA8_LPB0_NLCB1_SIA2_SU0_SUS0_SVW2_TT2_32_VW2_WGM4
    SolutionIndex: 7
    SolutionNameMin: Cijk_Alik_Bjlk_BBS_BH_MT64x64x16_MI16x16x16x1_SN_1LDSB1_AMAS3_GRVW8_IU1_LPA8_LPB8_NLCB1_SIA2_SU0_SUS0_SVW2_TT2_32_VW2_WGM4
    SolutionIndex: 8
    SolutionNameMin: Cijk_Alik_Bjlk_BBS_BH_MT64x64x16_MI16x16x16x1_SN_1LDSB1_AMAS3_GRVW8_IU1_LPA8_LPB0_NLCB1_SIA2_SU32_SUS128_SVW2_TT2_32_VW2_WGM4
    SolutionIndex: 9
    SolutionNameMin: Cijk_Alik_Bjlk_BBS_BH_MT64x64x16_MI16x16x16x1_SN_1LDSB1_AMAS3_GRVW8_IU1_LPA8_LPB8_NLCB1_SIA2_SU32_SUS128_SVW2_TT2_32_VW2_WGM4
    SolutionIndex: 10
    SolutionNameMin: Cijk_Alik_Bjlk_BBS_BH_MT64x64x16_MI16x16x16x1_SN_1LDSB1_AMAS3_GRVW8_IU1_LPA8_LPB0_NLCB1_SIA2_SU32_SUS256_SVW2_TT2_32_VW2_WGM4
    SolutionIndex: 11
    SolutionNameMin: Cijk_Alik_Bjlk_BBS_BH_MT64x64x16_MI16x16x16x1_SN_1LDSB1_AMAS3_GRVW4_IU1_LPA8_LPB0_NLCB1_SIA2_SU0_SUS0_SVW2_TT2_32_VW2_WGM8
    SolutionIndex: 12
    SolutionNameMin: Cijk_Alik_Bjlk_BBS_BH_MT64x64x16_MI16x16x16x1_SN_1LDSB1_AMAS3_GRVW4_IU1_LPA8_LPB8_NLCB1_SIA2_SU0_SUS0_SVW2_TT2_32_VW2_WGM8
    SolutionIndex: 13
    SolutionNameMin: Cijk_Alik_Bjlk_BBS_BH_MT64x64x16_MI16x16x16x1_SN_1LDSB1_AMAS3_GRVW8_IU1_LPA8_LPB0_NLCB1_SIA2_SU0_SUS0_SVW2_TT2_32_VW2_WGM8
    SolutionIndex: 14
    SolutionNameMin: Cijk_Alik_Bjlk_BBS_BH_MT64x64x16_MI16x16x16x1_SN_1LDSB1_AMAS3_GRVW8_IU1_LPA8_LPB8_NLCB1_SIA2_SU0_SUS0_SVW2_TT2_32_VW2_WGM8
    SolutionIndex: 15
    SolutionNameMin: Cijk_Alik_Bjlk_BBS_BH_MT64x64x16_MI16x16x16x1_SN_1LDSB0_AMAS3_GRVW8_IU1_LPA8_LPB8_NLCB1_SIA1_SU32_SUS128_SVW2_TT2_32_VW2_WGM8
    SolutionIndex: 16
    SolutionNameMin: Cijk_Alik_Bjlk_BBS_BH_MT64x64x16_MI16x16x16x1_SN_1LDSB1_AMAS3_GRVW8_IU1_LPA8_LPB0_NLCB1_SIA2_SU32_SUS128_SVW2_TT2_32_VW2_WGM8
    SolutionIndex: 17
    SolutionNameMin: Cijk_Alik_Bjlk_BBS_BH_MT64x64x16_MI16x16x16x1_SN_1LDSB0_AMAS3_GRVW8_IU1_LPA8_LPB0_NLCB1_SIA1_SU32_SUS256_SVW2_TT2_32_VW2_WGM8
    SolutionIndex: 18
    SolutionNameMin: Cijk_Alik_Bjlk_BBS_BH_MT64x64x16_MI16x16x16x1_SN_1LDSB1_AMAS3_GRVW8_IU1_LPA8_LPB0_NLCB1_SIA2_SU32_SUS256_SVW2_TT2_32_VW2_WGM8
    SolutionIndex: 19
    SolutionNameMin: Cijk_Alik_Bjlk_BBS_BH_MT64x64x16_MI16x16x16x1_SN_1LDSB1_AMAS3_GRVW8_IU1_LPA8_LPB8_NLCB1_SIA2_SU32_SUS256_SVW2_TT2_32_VW2_WGM8
    SolutionIndex: 20
    SolutionNameMin: Cijk_Alik_Bjlk_BBS_BH_MT128x128x16_MI16x16x16x1_SN_1LDSB0_AMAS3_GRVW8_IU1_LPA8_LPB0_NLCB1_SIA1_SU0_SUS0_SVW2_TT4_64_VW2_WGM4
    SolutionIndex: 21
    SolutionNameMin: Cijk_Alik_Bjlk_BBS_BH_MT128x128x16_MI16x16x16x1_SN_1LDSB0_AMAS3_GRVW8_IU1_LPA8_LPB8_NLCB1_SIA1_SU0_SUS0_SVW2_TT4_64_VW2_WGM4
    SolutionIndex: 22
    SolutionNameMin: Cijk_Alik_Bjlk_BBS_BH_MT128x128x16_MI16x16x16x1_SN_1LDSB1_AMAS3_GRVW4_IU1_LPA8_LPB0_NLCB1_SIA2_SU0_SUS0_SVW2_TT4_64_VW2_WGM4
    SolutionIndex: 23
    SolutionNameMin: Cijk_Alik_Bjlk_BBS_BH_MT128x128x16_MI16x16x16x1_SN_1LDSB1_AMAS3_GRVW4_IU1_LPA8_LPB8_NLCB1_SIA2_SU0_SUS0_SVW2_TT4_64_VW2_WGM4
    SolutionIndex: 24
    SolutionNameMin: Cijk_Alik_Bjlk_BBS_BH_MT128x128x16_MI16x16x16x1_SN_1LDSB1_AMAS3_GRVW8_IU1_LPA8_LPB8_NLCB1_SIA2_SU0_SUS0_SVW2_TT4_64_VW2_WGM4
    SolutionIndex: 25
    SolutionNameMin: Cijk_Alik_Bjlk_BBS_BH_MT128x128x16_MI16x16x16x1_SN_1LDSB0_AMAS3_GRVW8_IU1_LPA8_LPB8_NLCB1_SIA3_SU0_SUS0_SVW2_TT4_64_VW2_WGM4
    SolutionIndex: 26
    SolutionNameMin: Cijk_Alik_Bjlk_BBS_BH_MT128x128x16_MI16x16x16x1_SN_1LDSB0_AMAS3_GRVW8_IU1_LPA8_LPB0_NLCB1_SIA1_SU32_SUS128_SVW2_TT4_64_VW2_WGM4
    SolutionIndex: 27
    SolutionNameMin: Cijk_Alik_Bjlk_BBS_BH_MT128x128x16_MI16x16x16x1_SN_1LDSB0_AMAS3_GRVW8_IU1_LPA8_LPB8_NLCB1_SIA1_SU32_SUS128_SVW2_TT4_64_VW2_WGM4
    SolutionIndex: 28
    SolutionNameMin: Cijk_Alik_Bjlk_BBS_BH_MT128x128x16_MI16x16x16x1_SN_1LDSB1_AMAS3_GRVW2_IU1_LPA8_LPB8_NLCB2_SIA2_SU32_SUS128_SVW2_TT4_64_VW2_WGM4
    SolutionIndex: 29
    SolutionNameMin: Cijk_Alik_Bjlk_BBS_BH_MT128x128x16_MI16x16x16x1_SN_1LDSB1_AMAS0_GRVW4_IU1_LPA0_LPB8_NLCB1_SIA2_SU32_SUS128_SVW1_TT4_64_VW1_WGM4
    SolutionIndex: 30
    SolutionNameMin: Cijk_Alik_Bjlk_BBS_BH_MT128x128x16_MI16x16x16x1_SN_1LDSB1_AMAS3_GRVW4_IU1_LPA8_LPB0_NLCB1_SIA2_SU32_SUS128_SVW2_TT4_64_VW2_WGM4
    SolutionIndex: 31
    SolutionNameMin: Cijk_Alik_Bjlk_BBS_BH_MT128x128x16_MI16x16x16x1_SN_1LDSB1_AMAS3_GRVW4_IU1_LPA8_LPB8_NLCB1_SIA2_SU32_SUS128_SVW2_TT4_64_VW2_WGM4
    SolutionIndex: 32
    SolutionNameMin: Cijk_Alik_Bjlk_BBS_BH_MT128x128x16_MI16x16x16x1_SN_1LDSB1_AMAS0_GRVW8_IU1_LPA0_LPB0_NLCB1_SIA2_SU32_SUS128_SVW1_TT4_64_VW1_WGM4
    SolutionIndex: 33
    SolutionNameMin: Cijk_Alik_Bjlk_BBS_BH_MT128x128x16_MI16x16x16x1_SN_1LDSB1_AMAS0_GRVW8_IU1_LPA8_LPB8_NLCB1_SIA2_SU32_SUS128_SVW1_TT4_64_VW1_WGM4
    SolutionIndex: 34
    SolutionNameMin: Cijk_Alik_Bjlk_BBS_BH_MT128x128x16_MI16x16x16x1_SN_1LDSB1_AMAS3_GRVW8_IU1_LPA8_LPB0_NLCB1_SIA2_SU32_SUS128_SVW2_TT4_64_VW2_WGM4
    SolutionIndex: 35
    SolutionNameMin: Cijk_Alik_Bjlk_BBS_BH_MT128x128x16_MI16x16x16x1_SN_1LDSB0_AMAS3_GRVW8_IU1_LPA8_LPB8_NLCB1_SIA3_SU32_SUS128_SVW2_TT4_64_VW2_WGM4
    SolutionIndex: 36
    SolutionNameMin: Cijk_Alik_Bjlk_BBS_BH_MT128x128x16_MI16x16x16x1_SN_1LDSB0_AMAS3_GRVW8_IU1_LPA8_LPB0_NLCB1_SIA1_SU32_SUS256_SVW2_TT4_64_VW2_WGM4
    SolutionIndex: 37
    SolutionNameMin: Cijk_Alik_Bjlk_BBS_BH_MT128x128x16_MI16x16x16x1_SN_1LDSB0_AMAS3_GRVW8_IU1_LPA8_LPB8_NLCB1_SIA1_SU32_SUS256_SVW2_TT4_64_VW2_WGM4
    SolutionIndex: 38
    SolutionNameMin: Cijk_Alik_Bjlk_BBS_BH_MT128x128x16_MI16x16x16x1_SN_1LDSB1_AMAS0_GRVW4_IU1_LPA0_LPB0_NLCB1_SIA2_SU32_SUS256_SVW1_TT4_64_VW1_WGM4
    SolutionIndex: 39
    SolutionNameMin: Cijk_Alik_Bjlk_BBS_BH_MT128x128x16_MI16x16x16x1_SN_1LDSB1_AMAS3_GRVW8_IU1_LPA8_LPB0_NLCB1_SIA2_SU32_SUS256_SVW2_TT4_64_VW2_WGM4
    SolutionIndex: 40
    SolutionNameMin: Cijk_Alik_Bjlk_BBS_BH_MT128x128x16_MI16x16x16x1_SN_1LDSB0_AMAS3_GRVW8_IU1_LPA8_LPB0_NLCB1_SIA1_SU0_SUS0_SVW2_TT4_64_VW2_WGM8
    SolutionIndex: 41
    SolutionNameMin: Cijk_Alik_Bjlk_BBS_BH_MT128x128x16_MI16x16x16x1_SN_1LDSB0_AMAS3_GRVW8_IU1_LPA8_LPB8_NLCB1_SIA1_SU0_SUS0_SVW2_TT4_64_VW2_WGM8
    SolutionIndex: 42
    SolutionNameMin: Cijk_Alik_Bjlk_BBS_BH_MT128x128x16_MI16x16x16x1_SN_1LDSB1_AMAS3_GRVW4_IU1_LPA8_LPB0_NLCB1_SIA2_SU0_SUS0_SVW2_TT4_64_VW2_WGM8
    SolutionIndex: 43
    SolutionNameMin: Cijk_Alik_Bjlk_BBS_BH_MT128x128x16_MI16x16x16x1_SN_1LDSB1_AMAS3_GRVW4_IU1_LPA8_LPB8_NLCB1_SIA2_SU0_SUS0_SVW2_TT4_64_VW2_WGM8
    SolutionIndex: 44
    SolutionNameMin: Cijk_Alik_Bjlk_BBS_BH_MT128x128x16_MI16x16x16x1_SN_1LDSB1_AMAS3_GRVW8_IU1_LPA8_LPB8_NLCB1_SIA2_SU0_SUS0_SVW2_TT4_64_VW2_WGM8
    SolutionIndex: 45
    SolutionNameMin: Cijk_Alik_Bjlk_BBS_BH_MT128x128x16_MI16x16x16x1_SN_1LDSB0_AMAS3_GRVW8_IU1_LPA8_LPB0_NLCB1_SIA3_SU0_SUS0_SVW2_TT4_64_VW2_WGM8
    SolutionIndex: 46
    SolutionNameMin: Cijk_Alik_Bjlk_BBS_BH_MT128x128x16_MI16x16x16x1_SN_1LDSB0_AMAS3_GRVW8_IU1_LPA8_LPB8_NLCB1_SIA3_SU0_SUS0_SVW2_TT4_64_VW2_WGM8
    SolutionIndex: 47
    SolutionNameMin: Cijk_Alik_Bjlk_BBS_BH_MT128x128x16_MI16x16x16x1_SN_1LDSB0_AMAS3_GRVW8_IU1_LPA8_LPB0_NLCB1_SIA1_SU32_SUS128_SVW2_TT4_64_VW2_WGM8
    SolutionIndex: 48
    SolutionNameMin: Cijk_Alik_Bjlk_BBS_BH_MT128x128x16_MI16x16x16x1_SN_1LDSB0_AMAS3_GRVW8_IU1_LPA8_LPB8_NLCB1_SIA1_SU32_SUS128_SVW2_TT4_64_VW2_WGM8
    SolutionIndex: 49
    SolutionNameMin: Cijk_Alik_Bjlk_BBS_BH_MT128x128x16_MI16x16x16x1_SN_1LDSB1_AMAS3_GRVW2_IU1_LPA8_LPB8_NLCB2_SIA2_SU32_SUS128_SVW2_TT4_64_VW2_WGM8
    SolutionIndex: 50
    SolutionNameMin: Cijk_Alik_Bjlk_BBS_BH_MT128x128x16_MI16x16x16x1_SN_1LDSB1_AMAS0_GRVW4_IU1_LPA8_LPB0_NLCB1_SIA2_SU32_SUS128_SVW1_TT4_64_VW1_WGM8
    SolutionIndex: 51
    SolutionNameMin: Cijk_Alik_Bjlk_BBS_BH_MT128x128x16_MI16x16x16x1_SN_1LDSB1_AMAS3_GRVW4_IU1_LPA8_LPB0_NLCB1_SIA2_SU32_SUS128_SVW2_TT4_64_VW2_WGM8
    SolutionIndex: 52
    SolutionNameMin: Cijk_Alik_Bjlk_BBS_BH_MT128x128x16_MI16x16x16x1_SN_1LDSB1_AMAS3_GRVW4_IU1_LPA8_LPB8_NLCB1_SIA2_SU32_SUS128_SVW2_TT4_64_VW2_WGM8
    SolutionIndex: 53
    SolutionNameMin: Cijk_Alik_Bjlk_BBS_BH_MT128x128x16_MI16x16x16x1_SN_1LDSB1_AMAS0_GRVW8_IU1_LPA0_LPB0_NLCB1_SIA2_SU32_SUS128_SVW1_TT4_64_VW1_WGM8
    SolutionIndex: 54
    SolutionNameMin: Cijk_Alik_Bjlk_BBS_BH_MT128x128x16_MI16x16x16x1_SN_1LDSB1_AMAS3_GRVW8_IU1_LPA8_LPB8_NLCB1_SIA2_SU32_SUS128_SVW2_TT4_64_VW2_WGM8
    SolutionIndex: 55
    SolutionNameMin: Cijk_Alik_Bjlk_BBS_BH_MT128x128x16_MI16x16x16x1_SN_1LDSB0_AMAS3_GRVW8_IU1_LPA8_LPB8_NLCB1_SIA3_SU32_SUS128_SVW2_TT4_64_VW2_WGM8
    SolutionIndex: 56
    SolutionNameMin: Cijk_Alik_Bjlk_BBS_BH_MT128x128x16_MI16x16x16x1_SN_1LDSB0_AMAS3_GRVW8_IU1_LPA8_LPB0_NLCB1_SIA1_SU32_SUS256_SVW2_TT4_64_VW2_WGM8
    SolutionIndex: 57
    SolutionNameMin: Cijk_Alik_Bjlk_BBS_BH_MT128x128x16_MI16x16x16x1_SN_1LDSB0_AMAS3_GRVW8_IU1_LPA8_LPB8_NLCB1_SIA1_SU32_SUS256_SVW2_TT4_64_VW2_WGM8
    SolutionIndex: 58
    SolutionNameMin: Cijk_Alik_Bjlk_BBS_BH_MT128x128x16_MI16x16x16x1_SN_1LDSB1_AMAS0_GRVW4_IU1_LPA0_LPB0_NLCB1_SIA2_SU32_SUS256_SVW1_TT4_64_VW1_WGM8
    SolutionIndex: 59
    SolutionNameMin: Cijk_Alik_Bjlk_BBS_BH_MT128x128x16_MI16x16x16x1_SN_1LDSB1_AMAS0_GRVW8_IU1_LPA0_LPB0_NLCB1_SIA2_SU32_SUS256_SVW1_TT4_64_VW1_WGM8
    SolutionIndex: 60
    SolutionNameMin: Cijk_Alik_Bjlk_BBS_BH_MT128x128x16_MI16x16x16x1_SN_1LDSB1_AMAS3_GRVW8_IU1_LPA8_LPB8_NLCB1_SIA2_SU32_SUS256_SVW2_TT4_64_VW2_WGM8
    SolutionIndex: 61
    SolutionNameMin: Cijk_Alik_Bjlk_BBS_BH_MT32x32x32_MI16x16x16x1_SN_1LDSB0_AMAS0_GRVW4_IU1_LPA8_LPB0_NLCB1_SIA1_SU0_SUS0_SVW1_TT1_16_VW1_WGM4
    SolutionIndex: 62
    SolutionNameMin: Cijk_Alik_Bjlk_BBS_BH_MT32x32x32_MI16x16x16x1_SN_1LDSB0_AMAS0_GRVW8_IU1_LPA8_LPB0_NLCB1_SIA1_SU0_SUS0_SVW1_TT1_16_VW1_WGM4
    SolutionIndex: 63
    SolutionNameMin: Cijk_Alik_Bjlk_BBS_BH_MT32x32x32_MI16x16x16x1_SN_1LDSB1_AMAS0_GRVW4_IU2_LPA8_LPB0_NLCB1_SIA2_SU0_SUS0_SVW1_TT1_16_VW1_WGM4
    SolutionIndex: 64
    SolutionNameMin: Cijk_Alik_Bjlk_BBS_BH_MT32x32x32_MI16x16x16x1_SN_1LDSB1_AMAS0_GRVW8_IU2_LPA8_LPB0_NLCB1_SIA2_SU0_SUS0_SVW1_TT1_16_VW1_WGM4
    SolutionIndex: 65
    SolutionNameMin: Cijk_Alik_Bjlk_BBS_BH_MT32x32x32_MI16x16x16x1_SN_1LDSB1_AMAS0_GRVW8_IU2_LPA8_LPB8_NLCB1_SIA2_SU0_SUS0_SVW1_TT1_16_VW1_WGM4
    SolutionIndex: 66
    SolutionNameMin: Cijk_Alik_Bjlk_BBS_BH_MT32x32x32_MI16x16x16x1_SN_1LDSB1_AMAS0_GRVW4_IU2_LPA8_LPB0_NLCB1_SIA2_SU32_SUS128_SVW1_TT1_16_VW1_WGM4
    SolutionIndex: 67
    SolutionNameMin: Cijk_Alik_Bjlk_BBS_BH_MT32x32x32_MI16x16x16x1_SN_1LDSB1_AMAS0_GRVW4_IU2_LPA8_LPB8_NLCB1_SIA2_SU32_SUS128_SVW1_TT1_16_VW1_WGM4
    SolutionIndex: 68
    SolutionNameMin: Cijk_Alik_Bjlk_BBS_BH_MT32x32x32_MI16x16x16x1_SN_1LDSB1_AMAS0_GRVW8_IU2_LPA8_LPB0_NLCB1_SIA2_SU32_SUS128_SVW1_TT1_16_VW1_WGM4
    SolutionIndex: 69
    SolutionNameMin: Cijk_Alik_Bjlk_BBS_BH_MT32x32x32_MI16x16x16x1_SN_1LDSB1_AMAS0_GRVW8_IU2_LPA8_LPB8_NLCB1_SIA2_SU32_SUS128_SVW1_TT1_16_VW1_WGM4
    SolutionIndex: 70
    SolutionNameMin: Cijk_Alik_Bjlk_BBS_BH_MT32x32x32_MI16x16x16x1_SN_1LDSB1_AMAS0_GRVW4_IU2_LPA8_LPB8_NLCB1_SIA2_SU32_SUS256_SVW1_TT1_16_VW1_WGM4
    SolutionIndex: 71
    SolutionNameMin: Cijk_Alik_Bjlk_BBS_BH_MT32x32x32_MI16x16x16x1_SN_1LDSB1_AMAS0_GRVW8_IU2_LPA8_LPB0_NLCB1_SIA2_SU32_SUS256_SVW1_TT1_16_VW1_WGM4
    SolutionIndex: 72
    SolutionNameMin: Cijk_Alik_Bjlk_BBS_BH_MT32x32x32_MI16x16x16x1_SN_1LDSB1_AMAS0_GRVW8_IU2_LPA8_LPB8_NLCB1_SIA2_SU32_SUS256_SVW1_TT1_16_VW1_WGM4
    SolutionIndex: 73
    SolutionNameMin: Cijk_Alik_Bjlk_BBS_BH_MT32x32x32_MI16x16x16x1_SN_1LDSB0_AMAS0_GRVW4_IU1_LPA8_LPB0_NLCB1_SIA1_SU0_SUS0_SVW1_TT1_16_VW1_WGM8
    SolutionIndex: 74
    SolutionNameMin: Cijk_Alik_Bjlk_BBS_BH_MT32x32x32_MI16x16x16x1_SN_1LDSB0_AMAS0_GRVW8_IU1_LPA8_LPB0_NLCB1_SIA1_SU0_SUS0_SVW1_TT1_16_VW1_WGM8
    SolutionIndex: 75
    SolutionNameMin: Cijk_Alik_Bjlk_BBS_BH_MT32x32x32_MI16x16x16x1_SN_1LDSB1_AMAS0_GRVW2_IU2_LPA8_LPB8_NLCB1_SIA2_SU0_SUS0_SVW1_TT1_16_VW1_WGM8
    SolutionIndex: 76
    SolutionNameMin: Cijk_Alik_Bjlk_BBS_BH_MT32x32x32_MI16x16x16x1_SN_1LDSB1_AMAS0_GRVW4_IU2_LPA8_LPB0_NLCB1_SIA2_SU0_SUS0_SVW1_TT1_16_VW1_WGM8
    SolutionIndex: 77
    SolutionNameMin: Cijk_Alik_Bjlk_BBS_BH_MT32x32x32_MI16x16x16x1_SN_1LDSB1_AMAS0_GRVW4_IU2_LPA8_LPB8_NLCB1_SIA2_SU0_SUS0_SVW1_TT1_16_VW1_WGM8
    SolutionIndex: 78
    SolutionNameMin: Cijk_Alik_Bjlk_BBS_BH_MT32x32x32_MI16x16x16x1_SN_1LDSB1_AMAS0_GRVW8_IU2_LPA8_LPB0_NLCB1_SIA2_SU0_SUS0_SVW1_TT1_16_VW1_WGM8
    SolutionIndex: 79
    SolutionNameMin: Cijk_Alik_Bjlk_BBS_BH_MT32x32x32_MI16x16x16x1_SN_1LDSB1_AMAS0_GRVW8_IU2_LPA8_LPB8_NLCB1_SIA2_SU0_SUS0_SVW1_TT1_16_VW1_WGM8
    SolutionIndex: 80
    SolutionNameMin: Cijk_Alik_Bjlk_BBS_BH_MT32x32x32_MI16x16x16x1_SN_1LDSB0_AMAS0_GRVW8_IU1_LPA8_LPB0_NLCB1_SIA1_SU32_SUS128_SVW1_TT1_16_VW1_WGM8
    SolutionIndex: 81
    SolutionNameMin: Cijk_Alik_Bjlk_BBS_BH_MT32x32x32_MI16x16x16x1_SN_1LDSB1_AMAS0_GRVW4_IU2_LPA8_LPB0_NLCB1_SIA2_SU32_SUS128_SVW1_TT1_16_VW1_WGM8
    SolutionIndex: 82
    SolutionNameMin: Cijk_Alik_Bjlk_BBS_BH_MT32x32x32_MI16x16x16x1_SN_1LDSB1_AMAS0_GRVW4_IU2_LPA8_LPB8_NLCB1_SIA2_SU32_SUS128_SVW1_TT1_16_VW1_WGM8
    SolutionIndex: 83
    SolutionNameMin: Cijk_Alik_Bjlk_BBS_BH_MT32x32x32_MI16x16x16x1_SN_1LDSB1_AMAS0_GRVW8_IU2_LPA8_LPB8_NLCB1_SIA2_SU32_SUS128_SVW1_TT1_16_VW1_WGM8
    SolutionIndex: 84
    SolutionNameMin: Cijk_Alik_Bjlk_BBS_BH_MT32x32x32_MI16x16x16x1_SN_1LDSB0_AMAS0_GRVW8_IU1_LPA8_LPB0_NLCB1_SIA1_SU32_SUS256_SVW1_TT1_16_VW1_WGM8
    SolutionIndex: 85
    SolutionNameMin: Cijk_Alik_Bjlk_BBS_BH_MT32x32x32_MI16x16x16x1_SN_1LDSB1_AMAS0_GRVW4_IU2_LPA8_LPB0_NLCB1_SIA2_SU32_SUS256_SVW1_TT1_16_VW1_WGM8
    SolutionIndex: 86
    SolutionNameMin: Cijk_Alik_Bjlk_BBS_BH_MT32x32x32_MI16x16x16x1_SN_1LDSB1_AMAS0_GRVW8_IU2_LPA8_LPB0_NLCB1_SIA2_SU32_SUS256_SVW1_TT1_16_VW1_WGM8
    SolutionIndex: 87
    SolutionNameMin: Cijk_Alik_Bjlk_BBS_BH_MT32x32x32_MI16x16x16x1_SN_1LDSB1_AMAS0_GRVW8_IU2_LPA8_LPB8_NLCB1_SIA2_SU32_SUS256_SVW1_TT1_16_VW1_WGM8
    SolutionIndex: 88
    SolutionNameMin: Cijk_Alik_Bjlk_BBS_BH_MT64x64x32_MI16x16x16x1_SN_1LDSB0_AMAS3_GRVW2_IU1_LPA8_LPB0_NLCB1_SIA1_SU0_SUS0_SVW2_TT2_32_VW2_WGM4
    SolutionIndex: 89
    SolutionNameMin: Cijk_Alik_Bjlk_BBS_BH_MT64x64x32_MI16x16x16x1_SN_1LDSB0_AMAS3_GRVW4_IU1_LPA8_LPB0_NLCB1_SIA1_SU0_SUS0_SVW2_TT2_32_VW2_WGM4
    SolutionIndex: 90
    SolutionNameMin: Cijk_Alik_Bjlk_BBS_BH_MT64x64x32_MI16x16x16x1_SN_1LDSB0_AMAS3_GRVW8_IU1_LPA8_LPB0_NLCB1_SIA1_SU0_SUS0_SVW2_TT2_32_VW2_WGM4
    SolutionIndex: 91
    SolutionNameMin: Cijk_Alik_Bjlk_BBS_BH_MT64x64x32_MI16x16x16x1_SN_1LDSB0_AMAS3_GRVW8_IU1_LPA8_LPB8_NLCB1_SIA1_SU0_SUS0_SVW2_TT2_32_VW2_WGM4
    SolutionIndex: 92
    SolutionNameMin: Cijk_Alik_Bjlk_BBS_BH_MT64x64x32_MI16x16x16x1_SN_1LDSB1_AMAS0_GRVW8_IU2_LPA8_LPB0_NLCB1_SIA2_SU0_SUS0_SVW1_TT2_32_VW1_WGM4
    SolutionIndex: 93
    SolutionNameMin: Cijk_Alik_Bjlk_BBS_BH_MT64x64x32_MI16x16x16x1_SN_1LDSB1_AMAS3_GRVW8_IU2_LPA8_LPB0_NLCB1_SIA2_SU0_SUS0_SVW2_TT2_32_VW2_WGM4
    SolutionIndex: 94
    SolutionNameMin: Cijk_Alik_Bjlk_BBS_BH_MT64x64x32_MI16x16x16x1_SN_1LDSB1_AMAS3_GRVW8_IU2_LPA8_LPB8_NLCB1_SIA2_SU0_SUS0_SVW2_TT2_32_VW2_WGM4
    SolutionIndex: 95
    SolutionNameMin: Cijk_Alik_Bjlk_BBS_BH_MT64x64x32_MI16x16x16x1_SN_1LDSB0_AMAS0_GRVW4_IU1_LPA8_LPB8_NLCB1_SIA3_SU0_SUS0_SVW1_TT2_32_VW1_WGM4
    SolutionIndex: 96
    SolutionNameMin: Cijk_Alik_Bjlk_BBS_BH_MT64x64x32_MI16x16x16x1_SN_1LDSB0_AMAS3_GRVW4_IU1_LPA8_LPB8_NLCB1_SIA3_SU0_SUS0_SVW2_TT2_32_VW2_WGM4
    SolutionIndex: 97
    SolutionNameMin: Cijk_Alik_Bjlk_BBS_BH_MT64x64x32_MI16x16x16x1_SN_1LDSB0_AMAS3_GRVW8_IU1_LPA8_LPB0_NLCB1_SIA3_SU0_SUS0_SVW2_TT2_32_VW2_WGM4
    SolutionIndex: 98
    SolutionNameMin: Cijk_Alik_Bjlk_BBS_BH_MT64x64x32_MI16x16x16x1_SN_1LDSB0_AMAS3_GRVW8_IU1_LPA8_LPB8_NLCB1_SIA3_SU0_SUS0_SVW2_TT2_32_VW2_WGM4
    SolutionIndex: 99
    SolutionNameMin: Cijk_Alik_Bjlk_BBS_BH_MT64x64x32_MI16x16x16x1_SN_1LDSB1_AMAS3_GRVW8_IU2_LPA8_LPB0_NLCB1_SIA2_SU32_SUS128_SVW2_TT2_32_VW2_WGM4
    SolutionIndex: 100
    SolutionNameMin: Cijk_Alik_Bjlk_BBS_BH_MT64x64x32_MI16x16x16x1_SN_1LDSB1_AMAS3_GRVW8_IU2_LPA8_LPB8_NLCB1_SIA2_SU32_SUS128_SVW2_TT2_32_VW2_WGM4
    SolutionIndex: 101
    SolutionNameMin: Cijk_Alik_Bjlk_BBS_BH_MT64x64x32_MI16x16x16x1_SN_1LDSB1_AMAS3_GRVW4_IU2_LPA8_LPB0_NLCB1_SIA2_SU32_SUS256_SVW2_TT2_32_VW2_WGM4
    SolutionIndex: 102
    SolutionNameMin: Cijk_Alik_Bjlk_BBS_BH_MT64x64x32_MI16x16x16x1_SN_1LDSB0_AMAS3_GRVW8_IU1_LPA8_LPB8_NLCB1_SIA3_SU32_SUS256_SVW2_TT2_32_VW2_WGM4
    SolutionIndex: 103
    SolutionNameMin: Cijk_Alik_Bjlk_BBS_BH_MT64x64x32_MI16x16x16x1_SN_1LDSB0_AMAS3_GRVW2_IU1_LPA8_LPB8_NLCB1_SIA1_SU0_SUS0_SVW2_TT2_32_VW2_WGM8
    SolutionIndex: 104
    SolutionNameMin: Cijk_Alik_Bjlk_BBS_BH_MT64x64x32_MI16x16x16x1_SN_1LDSB0_AMAS0_GRVW4_IU1_LPA8_LPB8_NLCB1_SIA1_SU0_SUS0_SVW1_TT2_32_VW1_WGM8
    SolutionIndex: 105
    SolutionNameMin: Cijk_Alik_Bjlk_BBS_BH_MT64x64x32_MI16x16x16x1_SN_1LDSB0_AMAS3_GRVW4_IU1_LPA8_LPB0_NLCB1_SIA1_SU0_SUS0_SVW2_TT2_32_VW2_WGM8
    SolutionIndex: 106
    SolutionNameMin: Cijk_Alik_Bjlk_BBS_BH_MT64x64x32_MI16x16x16x1_SN_1LDSB0_AMAS3_GRVW4_IU1_LPA8_LPB8_NLCB1_SIA1_SU0_SUS0_SVW2_TT2_32_VW2_WGM8
    SolutionIndex: 107
    SolutionNameMin: Cijk_Alik_Bjlk_BBS_BH_MT64x64x32_MI16x16x16x1_SN_1LDSB0_AMAS3_GRVW8_IU1_LPA8_LPB0_NLCB1_SIA1_SU0_SUS0_SVW2_TT2_32_VW2_WGM8
    SolutionIndex: 108
    SolutionNameMin: Cijk_Alik_Bjlk_BBS_BH_MT64x64x32_MI16x16x16x1_SN_1LDSB0_AMAS3_GRVW8_IU1_LPA8_LPB8_NLCB1_SIA1_SU0_SUS0_SVW2_TT2_32_VW2_WGM8
    SolutionIndex: 109
    SolutionNameMin: Cijk_Alik_Bjlk_BBS_BH_MT64x64x32_MI16x16x16x1_SN_1LDSB1_AMAS0_GRVW8_IU2_LPA8_LPB8_NLCB1_SIA2_SU0_SUS0_SVW1_TT2_32_VW1_WGM8
    SolutionIndex: 110
    SolutionNameMin: Cijk_Alik_Bjlk_BBS_BH_MT64x64x32_MI16x16x16x1_SN_1LDSB1_AMAS3_GRVW8_IU2_LPA8_LPB0_NLCB1_SIA2_SU0_SUS0_SVW2_TT2_32_VW2_WGM8
    SolutionIndex: 111
    SolutionNameMin: Cijk_Alik_Bjlk_BBS_BH_MT64x64x32_MI16x16x16x1_SN_1LDSB1_AMAS3_GRVW8_IU2_LPA8_LPB8_NLCB1_SIA2_SU0_SUS0_SVW2_TT2_32_VW2_WGM8
    SolutionIndex: 112
    SolutionNameMin: Cijk_Alik_Bjlk_BBS_BH_MT64x64x32_MI16x16x16x1_SN_1LDSB0_AMAS0_GRVW8_IU1_LPA8_LPB0_NLCB1_SIA3_SU0_SUS0_SVW1_TT2_32_VW1_WGM8
    SolutionIndex: 113
    SolutionNameMin: Cijk_Alik_Bjlk_BBS_BH_MT64x64x32_MI16x16x16x1_SN_1LDSB0_AMAS3_GRVW8_IU1_LPA8_LPB0_NLCB1_SIA3_SU0_SUS0_SVW2_TT2_32_VW2_WGM8
    SolutionIndex: 114
    SolutionNameMin: Cijk_Alik_Bjlk_BBS_BH_MT64x64x32_MI16x16x16x1_SN_1LDSB0_AMAS3_GRVW8_IU1_LPA8_LPB8_NLCB1_SIA3_SU0_SUS0_SVW2_TT2_32_VW2_WGM8
    SolutionIndex: 115
    SolutionNameMin: Cijk_Alik_Bjlk_BBS_BH_MT64x64x32_MI16x16x16x1_SN_1LDSB1_AMAS3_GRVW8_IU2_LPA8_LPB0_NLCB1_SIA2_SU32_SUS128_SVW2_TT2_32_VW2_WGM8
    SolutionIndex: 116
    SolutionNameMin: Cijk_Alik_Bjlk_BBS_BH_MT64x64x32_MI16x16x16x1_SN_1LDSB0_AMAS3_GRVW8_IU1_LPA8_LPB0_NLCB1_SIA3_SU32_SUS128_SVW2_TT2_32_VW2_WGM8
    SolutionIndex: 117
    SolutionNameMin: Cijk_Alik_Bjlk_BBS_BH_MT64x64x32_MI16x16x16x1_SN_1LDSB0_AMAS3_GRVW8_IU1_LPA8_LPB8_NLCB1_SIA3_SU32_SUS128_SVW2_TT2_32_VW2_WGM8
    SolutionIndex: 118
    SolutionNameMin: Cijk_Alik_Bjlk_BBS_BH_MT64x64x32_MI16x16x16x1_SN_1LDSB0_AMAS3_GRVW8_IU1_LPA8_LPB8_NLCB1_SIA1_SU32_SUS256_SVW2_TT2_32_VW2_WGM8
    SolutionIndex: 119
    SolutionNameMin: Cijk_Alik_Bjlk_BBS_BH_MT64x64x32_MI16x16x16x1_SN_1LDSB1_AMAS3_GRVW8_IU2_LPA8_LPB0_NLCB1_SIA2_SU32_SUS256_SVW2_TT2_32_VW2_WGM8
    SolutionIndex: 120
    SolutionNameMin: Cijk_Alik_Bjlk_BBS_BH_MT64x64x32_MI16x16x16x1_SN_1LDSB1_AMAS3_GRVW8_IU2_LPA8_LPB8_NLCB1_SIA2_SU32_SUS256_SVW2_TT2_32_VW2_WGM8
    SolutionIndex: 121
    SolutionNameMin: Cijk_Alik_Bjlk_BBS_BH_MT64x64x32_MI16x16x16x1_SN_1LDSB0_AMAS3_GRVW8_IU1_LPA8_LPB0_NLCB1_SIA3_SU32_SUS256_SVW2_TT2_32_VW2_WGM8
    SolutionIndex: 122
    SolutionNameMin: Cijk_Alik_Bjlk_BBS_BH_MT64x64x32_MI16x16x16x1_SN_1LDSB0_AMAS3_GRVW8_IU1_LPA8_LPB8_NLCB1_SIA3_SU32_SUS256_SVW2_TT2_32_VW2_WGM8
- - - [64, 64, 1, 64, 96, 96, 96, 96]
    - [77, 0.091]
  - - [64, 64, 1, 128, 96, 96, 160, 160]
    - [64, 0.173]
  - - [64, 64, 1, 256, 96, 96, 288, 288]
    - [77, 0.32]
  - - [64, 64, 1, 512, 96, 96, 544, 544]
    - [68, 0.553]
  - - [64, 64, 1, 1024, 96, 96, 1056, 1056]
    - [67, 0.865]
  - - [64, 64, 1, 2048, 96, 96, 2080, 2080]
    - [77, 1.209]
  - - [64, 64, 1, 4096, 96, 96, 4128, 4128]
    - [77, 1.505]
  - - [64, 128, 1, 64, 96, 96, 96, 128]
    - [72, 0.186]
  - - [64, 128, 1, 128, 96, 96, 160, 160]
    - [64, 0.355]
  - - [64, 128, 1, 256, 96, 96, 288, 288]
    - [76, 0.648]
  - - [64, 128, 1, 512, 96, 96, 544, 544]
    - [86, 1.119]
  - - [64, 128, 1, 1024, 96, 96, 1056, 1056]
    - [72, 1.754]
  - - [64, 128, 1, 2048, 96, 96, 2080, 2080]
    - [77, 2.443]
  - - [64, 128, 1, 4096, 96, 96, 4128, 4128]
    - [67, 3.041]
  - - [64, 256, 1, 64, 96, 96, 96, 256]
    - [87, 0.373]
  - - [64, 256, 1, 128, 96, 96, 160, 256]
    - [78, 0.714]
  - - [64, 256, 1, 256, 96, 96, 288, 288]
    - [72, 1.313]
  - - [64, 256, 1, 512, 96, 96, 544, 544]
    - [71, 2.243]
  - - [64, 256, 1, 1024, 96, 96, 1056, 1056]
    - [72, 3.511]
  - - [64, 256, 1, 2048, 96, 96, 2080, 2080]
    - [77, 4.89]
  - - [64, 256, 1, 4096, 96, 96, 4128, 4128]
    - [82, 6.067]
  - - [64, 512, 1, 64, 96, 96, 96, 512]
    - [77, 0.734]
  - - [64, 512, 1, 128, 96, 96, 160, 512]
    - [79, 1.397]
  - - [64, 512, 1, 256, 96, 96, 288, 512]
    - [64, 2.523]
  - - [64, 512, 1, 512, 96, 96, 544, 544]
    - [86, 4.234]
  - - [64, 512, 1, 1024, 96, 96, 1056, 1056]
    - [64, 6.43]
  - - [64, 512, 1, 2048, 96, 96, 2080, 2080]
    - [63, 8.611]
  - - [64, 512, 1, 4096, 96, 96, 4128, 4128]
    - [78, 10.399]
  - - [64, 1024, 1, 64, 96, 96, 96, 1024]
    - [64, 1.428]
  - - [64, 1024, 1, 128, 96, 96, 160, 1024]
    - [78, 2.671]
  - - [64, 1024, 1, 256, 96, 96, 288, 1024]
    - [74, 4.716]
  - - [64, 1024, 1, 512, 96, 96, 544, 1024]
    - [62, 7.645]
  - - [64, 1024, 1, 1024, 96, 96, 1056, 1056]
    - [61, 11.01]
  - - [64, 1024, 1, 2048, 96, 96, 2080, 2080]
    - [62, 14.324]
  - - [64, 1024, 1, 4096, 96, 96, 4128, 4128]
    - [62, 16.749]
  - - [64, 2048, 1, 64, 96, 96, 96, 2048]
    - [78, 2.699]
  - - [64, 2048, 1, 128, 96, 96, 160, 2048]
    - [94, 4.857]
  - - [64, 2048, 1, 256, 96, 96, 288, 2048]
    - [93, 8.271]
  - - [64, 2048, 1, 512, 96, 96, 544, 2048]
    - [119, 12.838]
  - - [64, 2048, 1, 1024, 96, 96, 1056, 2048]
    - [111, 17.647]
  - - [64, 2048, 1, 2048, 96, 96, 2080, 2080]
    - [111, 21.707]
  - - [64, 2048, 1, 4096, 96, 96, 4128, 4128]
    - [110, 22.801]
  - - [64, 4096, 1, 64, 96, 96, 96, 4096]
    - [9, 4.98]
  - - [64, 4096, 1, 128, 96, 96, 160, 4096]
    - [93, 8.952]
  - - [64, 4096, 1, 256, 96, 96, 288, 4096]
    - [110, 14.657]
  - - [64, 4096, 1, 512, 96, 96, 544, 4096]
    - [93, 21.423]
  - - [64, 4096, 1, 1024, 96, 96, 1056, 4096]
    - [111, 27.837]
  - - [64, 4096, 1, 2048, 96, 96, 2080, 4096]
    - [109, 32.612]
  - - [64, 4096, 1, 4096, 96, 96, 4128, 4128]
    - [15, 34.989]
  - - [128, 64, 1, 64, 160, 160, 96, 96]
    - [62, 0.185]
  - - [128, 64, 1, 128, 160, 160, 160, 160]
    - [65, 0.354]
  - - [128, 64, 1, 256, 160, 160, 288, 288]
    - [86, 0.651]
  - - [128, 64, 1, 512, 160, 160, 544, 544]
    - [64, 1.118]
  - - [128, 64, 1, 1024, 160, 160, 1056, 1056]
    - [76, 1.753]
  - - [128, 64, 1, 2048, 160, 160, 2080, 2080]
    - [63, 2.435]
  - - [128, 64, 1, 4096, 160, 160, 4128, 4128]
    - [63, 3.023]
  - - [128, 128, 1, 64, 160, 160, 96, 128]
    - [86, 0.373]
  - - [128, 128, 1, 128, 160, 160, 160, 160]
    - [66, 0.71]
  - - [128, 128, 1, 256, 160, 160, 288, 288]
    - [76, 1.315]
  - - [128, 128, 1, 512, 160, 160, 544, 544]
    - [64, 2.253]
  - - [128, 128, 1, 1024, 160, 160, 1056, 1056]
    - [86, 3.533]
  - - [128, 128, 1, 2048, 160, 160, 2080, 2080]
    - [63, 4.905]
  - - [128, 128, 1, 4096, 160, 160, 4128, 4128]
    - [77, 6.088]
  - - [128, 256, 1, 64, 160, 160, 96, 256]
    - [76, 0.741]
  - - [128, 256, 1, 128, 160, 160, 160, 256]
    - [68, 1.382]
  - - [128, 256, 1, 256, 160, 160, 288, 288]
    - [78, 2.527]
  - - [128, 256, 1, 512, 160, 160, 544, 544]
    - [63, 4.239]
  - - [128, 256, 1, 1024, 160, 160, 1056, 1056]
    - [78, 6.427]
  - - [128, 256, 1, 2048, 160, 160, 2080, 2080]
    - [64, 8.63]
  - - [128, 256, 1, 4096, 160, 160, 4128, 4128]
    - [78, 10.401]
  - - [128, 512, 1, 64, 160, 160, 96, 512]
    - [64, 1.427]
  - - [128, 512, 1, 128, 160, 160, 160, 512]
    - [73, 2.656]
  - - [128, 512, 1, 256, 160, 160, 288, 512]
    - [62, 4.689]
  - - [128, 512, 1, 512, 160, 160, 544, 544]
    - [74, 7.706]
  - - [128, 512, 1, 1024, 160, 160, 1056, 1056]
    - [74, 11.19]
  - - [128, 512, 1, 2048, 160, 160, 2080, 2080]
    - [62, 14.411]
  - - [128, 512, 1, 4096, 160, 160, 4128, 4128]
    - [74, 16.778]
  - - [128, 1024, 1, 64, 160, 160, 96, 1024]
    - [86, 2.719]
  - - [128, 1024, 1, 128, 160, 160, 160, 1024]
    - [62, 4.891]
  - - [128, 1024, 1, 256, 160, 160, 288, 1024]
    - [105, 8.328]
  - - [128, 1024, 1, 512, 160, 160, 544, 1024]
    - [108, 13.061]
  - - [128, 1024, 1, 1024, 160, 160, 1056, 1056]
    - [90, 17.93]
  - - [128, 1024, 1, 2048, 160, 160, 2080, 2080]
    - [89, 22.153]
  - - [128, 1024, 1, 4096, 160, 160, 4128, 4128]
    - [88, 23.551]
  - - [128, 2048, 1, 64, 160, 160, 96, 2048]
    - [5, 4.968]
  - - [128, 2048, 1, 128, 160, 160, 160, 2048]
    - [93, 8.885]
  - - [128, 2048, 1, 256, 160, 160, 288, 2048]
    - [114, 14.618]
  - - [128, 2048, 1, 512, 160, 160, 544, 2048]
    - [113, 21.689]
  - - [128, 2048, 1, 1024, 160, 160, 1056, 2048]
    - [97, 28.302]
  - - [128, 2048, 1, 2048, 160, 160, 2080, 2080]
    - [98, 33.397]
  - - [128, 2048, 1, 4096, 160, 160, 4128, 4128]
    - [116, 34.731]
  - - [128, 4096, 1, 64, 160, 160, 96, 4096]
    - [14, 8.93]
  - - [128, 4096, 1, 128, 160, 160, 160, 4096]
    - [100, 15.356]
  - - [128, 4096, 1, 256, 160, 160, 288, 4096]
    - [7, 23.629]
  - - [128, 4096, 1, 512, 160, 160, 544, 4096]
    - [114, 32.052]
  - - [128, 4096, 1, 1024, 160, 160, 1056, 4096]
    - [18, 38.637]
  - - [128, 4096, 1, 2048, 160, 160, 2080, 4096]
    - [44, 41.43]
  - - [128, 4096, 1, 4096, 160, 160, 4128, 4128]
    - [24, 45.511]
  - - [256, 64, 1, 64, 288, 288, 96, 96]
    - [78, 0.37]
  - - [256, 64, 1, 128, 288, 288, 160, 160]
    - [85, 0.712]
  - - [256, 64, 1, 256, 288, 288, 288, 288]
    - [72, 1.306]
  - - [256, 64, 1, 512, 288, 288, 544, 544]
    - [83, 2.245]
  - - [256, 64, 1, 1024, 288, 288, 1056, 1056]
    - [63, 3.53]
  - - [256, 64, 1, 2048, 288, 288, 2080, 2080]
    - [70, 4.877]
  - - [256, 64, 1, 4096, 288, 288, 4128, 4128]
    - [82, 6.046]
  - - [256, 128, 1, 64, 288, 288, 96, 128]
    - [75, 0.738]
  - - [256, 128, 1, 128, 288, 288, 160, 160]
    - [86, 1.393]
  - - [256, 128, 1, 256, 288, 288, 288, 288]
    - [68, 2.527]
  - - [256, 128, 1, 512, 288, 288, 544, 544]
    - [78, 4.247]
  - - [256, 128, 1, 1024, 288, 288, 1056, 1056]
    - [78, 6.395]
  - - [256, 128, 1, 2048, 288, 288, 2080, 2080]
    - [78, 8.633]
  - - [256, 128, 1, 4096, 288, 288, 4128, 4128]
    - [78, 10.373]
  - - [256, 256, 1, 64, 288, 288, 96, 256]
    - [64, 1.432]
  - - [256, 256, 1, 128, 288, 288, 160, 256]
    - [84, 2.665]
  - - [256, 256, 1, 256, 288, 288, 288, 288]
    - [74, 4.725]
  - - [256, 256, 1, 512, 288, 288, 544, 544]
    - [74, 7.695]
  - - [256, 256, 1, 1024, 288, 288, 1056, 1056]
    - [62, 11.284]
  - - [256, 256, 1, 2048, 288, 288, 2080, 2080]
    - [62, 14.553]
  - - [256, 256, 1, 4096, 288, 288, 4128, 4128]
    - [62, 16.923]
  - - [256, 512, 1, 64, 288, 288, 96, 512]
    - [79, 2.71]
  - - [256, 512, 1, 128, 288, 288, 160, 512]
    - [78, 4.892]
  - - [256, 512, 1, 256, 288, 288, 288, 512]
    - [90, 8.372]
  - - [256, 512, 1, 512, 288, 288, 544, 544]
    - [107, 13.092]
  - - [256, 512, 1, 1024, 288, 288, 1056, 1056]
    - [103, 17.872]
  - - [256, 512, 1, 2048, 288, 288, 2080, 2080]
    - [104, 22.275]
  - - [256, 512, 1, 4096, 288, 288, 4128, 4128]
    - [106, 24.418]
  - - [256, 1024, 1, 64, 288, 288, 96, 1024]
    - [12, 4.983]
  - - [256, 1024, 1, 128, 288, 288, 160, 1024]
    - [99, 8.905]
  - - [256, 1024, 1, 256, 288, 288, 288, 1024]
    - [1, 14.632]
  - - [256, 1024, 1, 512, 288, 288, 544, 1024]
    - [96, 21.533]
  - - [256, 1024, 1, 1024, 288, 288, 1056, 1056]
    - [113, 28.2]
  - - [256, 1024, 1, 2048, 288, 288, 2080, 2080]
    - [98, 33.301]
  - - [256, 1024, 1, 4096, 288, 288, 4128, 4128]
    - [117, 34.915]
  - - [256, 2048, 1, 64, 288, 288, 96, 2048]
    - [19, 8.905]
  - - [256, 2048, 1, 128, 288, 288, 160, 2048]
    - [19, 15.347]
  - - [256, 2048, 1, 256, 288, 288, 288, 2048]
    - [14, 23.52]
  - - [256, 2048, 1, 512, 288, 288, 544, 2048]
    - [97, 31.931]
  - - [256, 2048, 1, 1024, 288, 288, 1056, 2048]
    - [98, 38.898]
  - - [256, 2048, 1, 2048, 288, 288, 2080, 2080]
    - [98, 41.578]
  - - [256, 2048, 1, 4096, 288, 288, 4128, 4128]
    - [34, 45.351]
  - - [256, 4096, 1, 64, 288, 288, 96, 4096]
    - [7, 14.193]
  - - [256, 4096, 1, 128, 288, 288, 160, 4096]
    - [93, 23.794]
  - - [256, 4096, 1, 256, 288, 288, 288, 4096]
    - [17, 33.725]
  - - [256, 4096, 1, 512, 288, 288, 544, 4096]
    - [108, 42.354]
  - - [256, 4096, 1, 1024, 288, 288, 1056, 4096]
    - [45, 46.632]
  - - [256, 4096, 1, 2048, 288, 288, 2080, 4096]
    - [46, 52.375]
  - - [256, 4096, 1, 4096, 288, 288, 4128, 4128]
    - [25, 56.181]
  - - [384, 64, 1, 64, 416, 416, 96, 96]
    - [76, 0.557]
  - - [384, 64, 1, 128, 416, 416, 160, 160]
    - [64, 1.068]
  - - [384, 64, 1, 256, 416, 416, 288, 288]
    - [76, 1.963]
  - - [384, 64, 1, 512, 416, 416, 544, 544]
    - [72, 3.359]
  - - [384, 64, 1, 1024, 416, 416, 1056, 1056]
    - [81, 5.271]
  - - [384, 64, 1, 2048, 416, 416, 2080, 2080]
    - [77, 7.301]
  - - [384, 64, 1, 4096, 416, 416, 4128, 4128]
    - [85, 9.039]
  - - [384, 128, 1, 64, 416, 416, 96, 128]
    - [69, 1.095]
  - - [384, 128, 1, 128, 416, 416, 160, 160]
    - [78, 2.072]
  - - [384, 128, 1, 256, 416, 416, 288, 288]
    - [86, 3.781]
  - - [384, 128, 1, 512, 416, 416, 544, 544]
    - [78, 6.348]
  - - [384, 128, 1, 1024, 416, 416, 1056, 1056]
    - [78, 9.576]
  - - [384, 128, 1, 2048, 416, 416, 2080, 2080]
    - [63, 12.824]
  - - [384, 128, 1, 4096, 416, 416, 4128, 4128]
    - [63, 15.404]
  - - [384, 256, 1, 64, 416, 416, 96, 256]
    - [74, 2.094]
  - - [384, 256, 1, 128, 416, 416, 160, 256]
    - [86, 3.806]
  - - [384, 256, 1, 256, 416, 416, 288, 288]
    - [120, 6.625]
  - - [384, 256, 1, 512, 416, 416, 544, 544]
    - [93, 10.593]
  - - [384, 256, 1, 1024, 416, 416, 1056, 1056]
    - [111, 15.049]
  - - [384, 256, 1, 2048, 416, 416, 2080, 2080]
    - [93, 19.029]
  - - [384, 256, 1, 4096, 416, 416, 4128, 4128]
    - [111, 21.931]
  - - [384, 512, 1, 64, 416, 416, 96, 512]
    - [120, 3.983]
  - - [384, 512, 1, 128, 416, 416, 160, 512]
    - [118, 7.234]
  - - [384, 512, 1, 256, 416, 416, 288, 512]
    - [93, 12.406]
  - - [384, 512, 1, 512, 416, 416, 544, 544]
    - [107, 19.21]
  - - [384, 512, 1, 1024, 416, 416, 1056, 1056]
    - [107, 26.843]
  - - [384, 512, 1, 2048, 416, 416, 2080, 2080]
    - [107, 33.074]
  - - [384, 512, 1, 4096, 416, 416, 4128, 4128]
    - [108, 34.502]
  - - [384, 1024, 1, 64, 416, 416, 96, 1024]
    - [8, 7.062]
  - - [384, 1024, 1, 128, 416, 416, 160, 1024]
    - [111, 12.285]
  - - [384, 1024, 1, 256, 416, 416, 288, 1024]
    - [114, 19.528]
  - - [384, 1024, 1, 512, 416, 416, 544, 1024]
    - [95, 27.25]
  - - [384, 1024, 1, 1024, 416, 416, 1056, 1056]
    - [112, 34.813]
  - - [384, 1024, 1, 2048, 416, 416, 2080, 2080]
    - [98, 39.894]
  - - [384, 1024, 1, 4096, 416, 416, 4128, 4128]
    - [122, 41.446]
  - - [384, 2048, 1, 64, 416, 416, 96, 2048]
    - [14, 11.748]
  - - [384, 2048, 1, 128, 416, 416, 160, 2048]
    - [30, 19.985]
  - - [384, 2048, 1, 256, 416, 416, 288, 2048]
    - [52, 31.693]
  - - [384, 2048, 1, 512, 416, 416, 544, 2048]
    - [34, 44.631]
  - - [384, 2048, 1, 1024, 416, 416, 1056, 2048]
    - [34, 55.894]
  - - [384, 2048, 1, 2048, 416, 416, 2080, 2080]
    - [33, 60.764]
  - - [384, 2048, 1, 4096, 416, 416, 4128, 4128]
    - [39, 67.269]
  - - [384, 4096, 1, 64, 416, 416, 96, 4096]
    - [14, 18.01]
  - - [384, 4096, 1, 128, 416, 416, 160, 4096]
    - [7, 29.633]
  - - [384, 4096, 1, 256, 416, 416, 288, 4096]
    - [17, 39.963]
  - - [384, 4096, 1, 512, 416, 416, 544, 4096]
    - [48, 51.06]
  - - [384, 4096, 1, 1024, 416, 416, 1056, 4096]
    - [59, 56.756]
  - - [384, 4096, 1, 2048, 416, 416, 2080, 4096]
    - [38, 62.625]
  - - [384, 4096, 1, 4096, 416, 416, 4128, 4128]
    - [29, 66.085]
  - - [768, 64, 1, 64, 800, 800, 96, 96]
    - [67, 1.095]
  - - [768, 64, 1, 128, 800, 800, 160, 160]
    - [68, 2.084]
  - - [768, 64, 1, 256, 800, 800, 288, 288]
    - [86, 3.771]
  - - [768, 64, 1, 512, 800, 800, 544, 544]
    - [78, 6.341]
  - - [768, 64, 1, 1024, 800, 800, 1056, 1056]
    - [78, 9.568]
  - - [768, 64, 1, 2048, 800, 800, 2080, 2080]
    - [78, 12.82]
  - - [768, 64, 1, 4096, 800, 800, 4128, 4128]
    - [63, 15.414]
  - - [768, 128, 1, 64, 800, 800, 96, 128]
    - [83, 2.087]
  - - [768, 128, 1, 128, 800, 800, 160, 160]
    - [80, 3.822]
  - - [768, 128, 1, 256, 800, 800, 288, 288]
    - [111, 6.62]
  - - [768, 128, 1, 512, 800, 800, 544, 544]
    - [111, 10.561]
  - - [768, 128, 1, 1024, 800, 800, 1056, 1056]
    - [111, 15.055]
  - - [768, 128, 1, 2048, 800, 800, 2080, 2080]
    - [111, 19.052]
  - - [768, 128, 1, 4096, 800, 800, 4128, 4128]
    - [94, 21.928]
  - - [768, 256, 1, 64, 800, 800, 96, 256]
    - [4, 3.977]
  - - [768, 256, 1, 128, 800, 800, 160, 256]
    - [4, 7.226]
  - - [768, 256, 1, 256, 800, 800, 288, 288]
    - [107, 12.302]
  - - [768, 256, 1, 512, 800, 800, 544, 544]
    - [91, 19.042]
  - - [768, 256, 1, 1024, 800, 800, 1056, 1056]
    - [91, 26.353]
  - - [768, 256, 1, 2048, 800, 800, 2080, 2080]
    - [90, 32.628]
  - - [768, 256, 1, 4096, 800, 800, 4128, 4128]
    - [111, 34.046]
  - - [768, 512, 1, 64, 800, 800, 96, 512]
    - [14, 7.075]
  - - [768, 512, 1, 128, 800, 800, 160, 512]
    - [16, 12.254]
  - - [768, 512, 1, 256, 800, 800, 288, 512]
    - [116, 19.535]
  - - [768, 512, 1, 512, 800, 800, 544, 544]
    - [116, 27.713]
  - - [768, 512, 1, 1024, 800, 800, 1056, 1056]
    - [114, 34.999]
  - - [768, 512, 1, 2048, 800, 800, 2080, 2080]
    - [98, 39.783]
  - - [768, 512, 1, 4096, 800, 800, 4128, 4128]
    - [116, 41.447]
  - - [768, 1024, 1, 64, 800, 800, 96, 1024]
    - [11, 11.741]
  - - [768, 1024, 1, 128, 800, 800, 160, 1024]
    - [51, 20.081]
  - - [768, 1024, 1, 256, 800, 800, 288, 1024]
    - [54, 31.77]
  - - [768, 1024, 1, 512, 800, 800, 544, 1024]
    - [60, 43.522]
  - - [768, 1024, 1, 1024, 800, 800, 1056, 1056]
    - [54, 55.925]
  - - [768, 1024, 1, 2048, 800, 800, 2080, 2080]
    - [60, 61.138]
  - - [768, 1024, 1, 4096, 800, 800, 4128, 4128]
    - [60, 67.297]
  - - [768, 2048, 1, 64, 800, 800, 96, 2048]
    - [14, 17.99]
  - - [768, 2048, 1, 128, 800, 800, 160, 2048]
    - [14, 29.77]
  - - [768, 2048, 1, 256, 800, 800, 288, 2048]
    - [0, 39.939]
  - - [768, 2048, 1, 512, 800, 800, 544, 2048]
    - [57, 50.957]
  - - [768, 2048, 1, 1024, 800, 800, 1056, 2048]
    - [47, 56.854]
  - - [768, 2048, 1, 2048, 800, 800, 2080, 2080]
    - [56, 62.802]
  - - [768, 2048, 1, 4096, 800, 800, 4128, 4128]
    - [58, 65.739]
  - - [768, 4096, 1, 64, 800, 800, 96, 4096]
    - [47, 24.74]
  - - [768, 4096, 1, 128, 800, 800, 160, 4096]
    - [40, 38.029]
  - - [768, 4096, 1, 256, 800, 800, 288, 4096]
    - [40, 52.303]
  - - [768, 4096, 1, 512, 800, 800, 544, 4096]
    - [57, 61.393]
  - - [768, 4096, 1, 1024, 800, 800, 1056, 4096]
    - [57, 69.919]
  - - [768, 4096, 1, 2048, 800, 800, 2080, 4096]
    - [27, 74.868]
  - - [768, 4096, 1, 4096, 800, 800, 4128, 4128]
    - [27, 78.439]
  - - [1536, 64, 1, 64, 1568, 1568, 96, 96]
    - [65, 2.077]
  - - [1536, 64, 1, 128, 1568, 1568, 160, 160]
    - [111, 3.817]
  - - [1536, 64, 1, 256, 1568, 1568, 288, 288]
    - [115, 6.627]
  - - [1536, 64, 1, 512, 1568, 1568, 544, 544]
    - [110, 10.573]
  - - [1536, 64, 1, 1024, 1568, 1568, 1056, 1056]
    - [111, 15.044]
  - - [1536, 64, 1, 2048, 1568, 1568, 2080, 2080]
    - [110, 19.017]
  - - [1536, 64, 1, 4096, 1568, 1568, 4128, 4128]
    - [93, 21.926]
  - - [1536, 128, 1, 64, 1568, 1568, 96, 128]
    - [19, 3.963]
  - - [1536, 128, 1, 128, 1568, 1568, 160, 160]
    - [10, 7.207]
  - - [1536, 128, 1, 256, 1568, 1568, 288, 288]
    - [111, 12.278]
  - - [1536, 128, 1, 512, 1568, 1568, 544, 544]
    - [110, 19.047]
  - - [1536, 128, 1, 1024, 1568, 1568, 1056, 1056]
    - [110, 26.185]
  - - [1536, 128, 1, 2048, 1568, 1568, 2080, 2080]
    - [111, 32.122]
  - - [1536, 128, 1, 4096, 1568, 1568, 4128, 4128]
    - [101, 34.461]
  - - [1536, 256, 1, 64, 1568, 1568, 96, 256]
    - [8, 7.061]
  - - [1536, 256, 1, 128, 1568, 1568, 160, 256]
    - [110, 12.295]
  - - [1536, 256, 1, 256, 1568, 1568, 288, 288]
    - [117, 19.472]
  - - [1536, 256, 1, 512, 1568, 1568, 544, 544]
    - [113, 27.671]
  - - [1536, 256, 1, 1024, 1568, 1568, 1056, 1056]
    - [114, 34.82]
  - - [1536, 256, 1, 2048, 1568, 1568, 2080, 2080]
    - [113, 39.778]
  - - [1536, 256, 1, 4096, 1568, 1568, 4128, 4128]
    - [113, 41.344]
  - - [1536, 512, 1, 64, 1568, 1568, 96, 512]
    - [14, 11.789]
  - - [1536, 512, 1, 128, 1568, 1568, 160, 512]
    - [120, 19.934]
  - - [1536, 512, 1, 256, 1568, 1568, 288, 512]
    - [49, 31.151]
  - - [1536, 512, 1, 512, 1568, 1568, 544, 544]
    - [31, 44.377]
  - - [1536, 512, 1, 1024, 1568, 1568, 1056, 1056]
    - [51, 55.503]
  - - [1536, 512, 1, 2048, 1568, 1568, 2080, 2080]
    - [50, 60.068]
  - - [1536, 512, 1, 4096, 1568, 1568, 4128, 4128]
    - [28, 65.344]
  - - [1536, 1024, 1, 64, 1568, 1568, 96, 1024]
    - [13, 18.048]
  - - [1536, 1024, 1, 128, 1568, 1568, 160, 1024]
    - [14, 29.773]
  - - [1536, 1024, 1, 256, 1568, 1568, 288, 1024]
    - [2, 40.112]
  - - [1536, 1024, 1, 512, 1568, 1568, 544, 1024]
    - [57, 51.312]
  - - [1536, 1024, 1, 1024, 1568, 1568, 1056, 1056]
    - [47, 57.337]
  - - [1536, 1024, 1, 2048, 1568, 1568, 2080, 2080]
    - [53, 62.941]
  - - [1536, 1024, 1, 4096, 1568, 1568, 4128, 4128]
    - [59, 66.322]
  - - [1536, 2048, 1, 64, 1568, 1568, 96, 2048]
    - [40, 24.686]
  - - [1536, 2048, 1, 128, 1568, 1568, 160, 2048]
    - [14, 37.99]
  - - [1536, 2048, 1, 256, 1568, 1568, 288, 2048]
    - [40, 52.471]
  - - [1536, 2048, 1, 512, 1568, 1568, 544, 2048]
    - [40, 61.402]
  - - [1536, 2048, 1, 1024, 1568, 1568, 1056, 2048]
    - [57, 70.21]
  - - [1536, 2048, 1, 2048, 1568, 1568, 2080, 2080]
    - [26, 76.011]
  - - [1536, 2048, 1, 4096, 1568, 1568, 4128, 4128]
    - [20, 78.91]
  - - [1536, 4096, 1, 64, 1568, 1568, 96, 4096]
    - [45, 31.727]
  - - [1536, 4096, 1, 128, 1568, 1568, 160, 4096]
    - [21, 47.018]
  - - [1536, 4096, 1, 256, 1568, 1568, 288, 4096]
    - [21, 59.674]
  - - [1536, 4096, 1, 512, 1568, 1568, 544, 4096]
    - [20, 72.278]
  - - [1536, 4096, 1, 1024, 1568, 1568, 1056, 4096]
    - [21, 80.746]
  - - [1536, 4096, 1, 2048, 1568, 1568, 2080, 4096]
    - [20, 85.916]
  - - [1536, 4096, 1, 4096, 1568, 1568, 4128, 4128]
    - [41, 87.562]
  - - [3072, 64, 1, 64, 3104, 3104, 96, 96]
    - [14, 3.947]
  - - [3072, 64, 1, 128, 3104, 3104, 160, 160]
    - [94, 7.202]
  - - [3072, 64, 1, 256, 3104, 3104, 288, 288]
    - [110, 12.282]
  - - [3072, 64, 1, 512, 3104, 3104, 544, 544]
    - [111, 19.098]
  - - [3072, 64, 1, 1024, 3104, 3104, 1056, 1056]
    - [110, 26.106]
  - - [3072, 64, 1, 2048, 3104, 3104, 2080, 2080]
    - [111, 32.113]
  - - [3072, 64, 1, 4096, 3104, 3104, 4128, 4128]
    - [92, 34.005]
  - - [3072, 128, 1, 64, 3104, 3104, 96, 128]
    - [16, 7.069]
  - - [3072, 128, 1, 128, 3104, 3104, 160, 160]
    - [94, 12.33]
  - - [3072, 128, 1, 256, 3104, 3104, 288, 288]
    - [102, 19.502]
  - - [3072, 128, 1, 512, 3104, 3104, 544, 544]
    - [121, 27.483]
  - - [3072, 128, 1, 1024, 3104, 3104, 1056, 1056]
    - [114, 34.662]
  - - [3072, 128, 1, 2048, 3104, 3104, 2080, 2080]
    - [114, 39.715]
  - - [3072, 128, 1, 4096, 3104, 3104, 4128, 4128]
    - [114, 41.428]
  - - [3072, 256, 1, 64, 3104, 3104, 96, 256]
    - [93, 11.772]
  - - [3072, 256, 1, 128, 3104, 3104, 160, 256]
    - [42, 20.11]
  - - [3072, 256, 1, 256, 3104, 3104, 288, 288]
    - [23, 31.697]
  - - [3072, 256, 1, 512, 3104, 3104, 544, 544]
    - [22, 44.455]
  - - [3072, 256, 1, 1024, 3104, 3104, 1056, 1056]
    - [22, 55.645]
  - - [3072, 256, 1, 2048, 3104, 3104, 2080, 2080]
    - [43, 60.89]
  - - [3072, 256, 1, 4096, 3104, 3104, 4128, 4128]
    - [34, 67.153]
  - - [3072, 512, 1, 64, 3104, 3104, 96, 512]
    - [6, 18.174]
  - - [3072, 512, 1, 128, 3104, 3104, 160, 512]
    - [3, 29.843]
  - - [3072, 512, 1, 256, 3104, 3104, 288, 512]
    - [17, 40.164]
  - - [3072, 512, 1, 512, 3104, 3104, 544, 544]
    - [37, 50.874]
  - - [3072, 512, 1, 1024, 3104, 3104, 1056, 1056]
    - [56, 56.934]
  - - [3072, 512, 1, 2048, 3104, 3104, 2080, 2080]
    - [32, 62.781]
  - - [3072, 512, 1, 4096, 3104, 3104, 4128, 4128]
    - [29, 66.298]
  - - [3072, 1024, 1, 64, 3104, 3104, 96, 1024]
    - [41, 24.717]
  - - [3072, 1024, 1, 128, 3104, 3104, 160, 1024]
    - [41, 38.111]
  - - [3072, 1024, 1, 256, 3104, 3104, 288, 1024]
    - [47, 52.578]
  - - [3072, 1024, 1, 512, 3104, 3104, 544, 1024]
    - [56, 61.739]
  - - [3072, 1024, 1, 1024, 3104, 3104, 1056, 1056]
    - [36, 70.712]
  - - [3072, 1024, 1, 2048, 3104, 3104, 2080, 2080]
    - [27, 75.844]
  - - [3072, 1024, 1, 4096, 3104, 3104, 4128, 4128]
    - [21, 79.014]
  - - [3072, 2048, 1, 64, 3104, 3104, 96, 2048]
    - [55, 31.704]
  - - [3072, 2048, 1, 128, 3104, 3104, 160, 2048]
    - [41, 47.158]
  - - [3072, 2048, 1, 256, 3104, 3104, 288, 2048]
    - [40, 59.54]
  - - [3072, 2048, 1, 512, 3104, 3104, 544, 2048]
    - [40, 72.242]
  - - [3072, 2048, 1, 1024, 3104, 3104, 1056, 2048]
    - [21, 80.589]
  - - [3072, 2048, 1, 2048, 3104, 3104, 2080, 2080]
    - [20, 85.947]
  - - [3072, 2048, 1, 4096, 3104, 3104, 4128, 4128]
    - [41, 87.578]
  - - [3072, 4096, 1, 64, 3104, 3104, 96, 4096]
    - [35, 33.759]
  - - [3072, 4096, 1, 128, 3104, 3104, 160, 4096]
    - [40, 50.115]
  - - [3072, 4096, 1, 256, 3104, 3104, 288, 4096]
    - [41, 65.078]
  - - [3072, 4096, 1, 512, 3104, 3104, 544, 4096]
    - [20, 76.697]
  - - [3072, 4096, 1, 1024, 3104, 3104, 1056, 4096]
    - [20, 84.105]
  - - [3072, 4096, 1, 2048, 3104, 3104, 2080, 4096]
    - [20, 87.614]
  - - [3072, 4096, 1, 4096, 3104, 3104, 4128, 4128]
    - [41, 90.125]
- null
- null
- DeviceEfficiency
