library/src/blas3/Tensile/Logic/asm_full/navi32/navi32_Cijk_Alik_Bjlk_HB_GB.yaml
- {MinimumRequiredVersion: 4.35.0}
- navi32
- gfx1101
- [Device 73f0]
    SolutionIndex: 0
    SolutionNameMin: Cijk_Alik_Bjlk_HB_MT64x64x16_MI16x16x16x1_SN_1LDSB0_AMAS3_GRVW8_IU1_LPA8_LPB0_NLCB1_SIA1_SU0_SUS0_SVW2_TT2_32_VW2_WGM4
    SolutionIndex: 1
    SolutionNameMin: Cijk_Alik_Bjlk_HB_MT64x64x16_MI16x16x16x1_SN_1LDSB1_AMAS3_GRVW4_IU1_LPA8_LPB0_NLCB1_SIA2_SU0_SUS0_SVW2_TT2_32_VW2_WGM4
    SolutionIndex: 2
    SolutionNameMin: Cijk_Alik_Bjlk_HB_MT64x64x16_MI16x16x16x1_SN_1LDSB1_AMAS0_GRVW8_IU1_LPA8_LPB8_NLCB1_SIA2_SU0_SUS0_SVW1_TT2_32_VW1_WGM4
    SolutionIndex: 3
    SolutionNameMin: Cijk_Alik_Bjlk_HB_MT64x64x16_MI16x16x16x1_SN_1LDSB1_AMAS3_GRVW8_IU1_LPA8_LPB0_NLCB1_SIA2_SU0_SUS0_SVW2_TT2_32_VW2_WGM4
    SolutionIndex: 4
    SolutionNameMin: Cijk_Alik_Bjlk_HB_MT64x64x16_MI16x16x16x1_SN_1LDSB1_AMAS3_GRVW8_IU1_LPA8_LPB8_NLCB1_SIA2_SU0_SUS0_SVW2_TT2_32_VW2_WGM4
    SolutionIndex: 5
    SolutionNameMin: Cijk_Alik_Bjlk_HB_MT64x64x16_MI16x16x16x1_SN_1LDSB1_AMAS3_GRVW4_IU1_LPA8_LPB0_NLCB1_SIA2_SU32_SUS128_SVW2_TT2_32_VW2_WGM4
    SolutionIndex: 6
    SolutionNameMin: Cijk_Alik_Bjlk_HB_MT64x64x16_MI16x16x16x1_SN_1LDSB1_AMAS3_GRVW8_IU1_LPA8_LPB8_NLCB1_SIA2_SU32_SUS128_SVW2_TT2_32_VW2_WGM4
    SolutionIndex: 7
    SolutionNameMin: Cijk_Alik_Bjlk_HB_MT64x64x16_MI16x16x16x1_SN_1LDSB0_AMAS3_GRVW8_IU1_LPA8_LPB8_NLCB1_SIA1_SU0_SUS0_SVW2_TT2_32_VW2_WGM8
    SolutionIndex: 8
    SolutionNameMin: Cijk_Alik_Bjlk_HB_MT64x64x16_MI16x16x16x1_SN_1LDSB1_AMAS0_GRVW8_IU1_LPA8_LPB8_NLCB1_SIA2_SU0_SUS0_SVW1_TT2_32_VW1_WGM8
    SolutionIndex: 9
    SolutionNameMin: Cijk_Alik_Bjlk_HB_MT64x64x16_MI16x16x16x1_SN_1LDSB1_AMAS3_GRVW8_IU1_LPA8_LPB0_NLCB1_SIA2_SU0_SUS0_SVW2_TT2_32_VW2_WGM8
    SolutionIndex: 10
    SolutionNameMin: Cijk_Alik_Bjlk_HB_MT64x64x16_MI16x16x16x1_SN_1LDSB1_AMAS3_GRVW8_IU1_LPA8_LPB8_NLCB1_SIA2_SU0_SUS0_SVW2_TT2_32_VW2_WGM8
    SolutionIndex: 11
    SolutionNameMin: Cijk_Alik_Bjlk_HB_MT64x64x16_MI16x16x16x1_SN_1LDSB0_AMAS0_GRVW8_IU1_LPA8_LPB8_NLCB1_SIA1_SU32_SUS128_SVW1_TT2_32_VW1_WGM8
    SolutionIndex: 12
    SolutionNameMin: Cijk_Alik_Bjlk_HB_MT64x64x16_MI16x16x16x1_SN_1LDSB1_AMAS0_GRVW8_IU1_LPA8_LPB0_NLCB1_SIA2_SU32_SUS128_SVW1_TT2_32_VW1_WGM8
    SolutionIndex: 13
    SolutionNameMin: Cijk_Alik_Bjlk_HB_MT64x64x16_MI16x16x16x1_SN_1LDSB1_AMAS3_GRVW8_IU1_LPA8_LPB0_NLCB1_SIA2_SU32_SUS256_SVW2_TT2_32_VW2_WGM8
    SolutionIndex: 14
    SolutionNameMin: Cijk_Alik_Bjlk_HB_MT128x128x16_MI16x16x16x1_SN_1LDSB0_AMAS0_GRVW8_IU1_LPA8_LPB8_NLCB1_SIA1_SU0_SUS0_SVW1_TT4_64_VW1_WGM4
    SolutionIndex: 15
    SolutionNameMin: Cijk_Alik_Bjlk_HB_MT128x128x16_MI16x16x16x1_SN_1LDSB0_AMAS3_GRVW8_IU1_LPA8_LPB0_NLCB1_SIA1_SU0_SUS0_SVW2_TT4_64_VW2_WGM4
    SolutionIndex: 16
    SolutionNameMin: Cijk_Alik_Bjlk_HB_MT128x128x16_MI16x16x16x1_SN_1LDSB0_AMAS3_GRVW8_IU1_LPA8_LPB8_NLCB1_SIA1_SU0_SUS0_SVW2_TT4_64_VW2_WGM4
    SolutionIndex: 17
    SolutionNameMin: Cijk_Alik_Bjlk_HB_MT128x128x16_MI16x16x16x1_SN_1LDSB1_AMAS3_GRVW4_IU1_LPA8_LPB0_NLCB1_SIA2_SU0_SUS0_SVW2_TT4_64_VW2_WGM4
    SolutionIndex: 18
    SolutionNameMin: Cijk_Alik_Bjlk_HB_MT128x128x16_MI16x16x16x1_SN_1LDSB1_AMAS3_GRVW4_IU1_LPA8_LPB8_NLCB1_SIA2_SU0_SUS0_SVW2_TT4_64_VW2_WGM4
    SolutionIndex: 19
    SolutionNameMin: Cijk_Alik_Bjlk_HB_MT128x128x16_MI16x16x16x1_SN_1LDSB1_AMAS3_GRVW8_IU1_LPA8_LPB8_NLCB1_SIA2_SU0_SUS0_SVW2_TT4_64_VW2_WGM4
    SolutionIndex: 20
    SolutionNameMin: Cijk_Alik_Bjlk_HB_MT128x128x16_MI16x16x16x1_SN_1LDSB0_AMAS3_GRVW2_IU1_LPA8_LPB0_NLCB2_SIA3_SU0_SUS0_SVW2_TT4_64_VW2_WGM4
    SolutionIndex: 21
    SolutionNameMin: Cijk_Alik_Bjlk_HB_MT128x128x16_MI16x16x16x1_SN_1LDSB0_AMAS3_GRVW8_IU1_LPA8_LPB0_NLCB1_SIA3_SU0_SUS0_SVW2_TT4_64_VW2_WGM4
    SolutionIndex: 22
    SolutionNameMin: Cijk_Alik_Bjlk_HB_MT128x128x16_MI16x16x16x1_SN_1LDSB0_AMAS3_GRVW8_IU1_LPA8_LPB8_NLCB1_SIA3_SU0_SUS0_SVW2_TT4_64_VW2_WGM4
    SolutionIndex: 23
    SolutionNameMin: Cijk_Alik_Bjlk_HB_MT128x128x16_MI16x16x16x1_SN_1LDSB0_AMAS0_GRVW8_IU1_LPA8_LPB0_NLCB1_SIA1_SU32_SUS128_SVW1_TT4_64_VW1_WGM4
    SolutionIndex: 24
    SolutionNameMin: Cijk_Alik_Bjlk_HB_MT128x128x16_MI16x16x16x1_SN_1LDSB0_AMAS3_GRVW8_IU1_LPA8_LPB0_NLCB1_SIA1_SU32_SUS128_SVW2_TT4_64_VW2_WGM4
    SolutionIndex: 25
    SolutionNameMin: Cijk_Alik_Bjlk_HB_MT128x128x16_MI16x16x16x1_SN_1LDSB0_AMAS3_GRVW8_IU1_LPA8_LPB8_NLCB1_SIA1_SU32_SUS128_SVW2_TT4_64_VW2_WGM4
    SolutionIndex: 26
    SolutionNameMin: Cijk_Alik_Bjlk_HB_MT128x128x16_MI16x16x16x1_SN_1LDSB1_AMAS3_GRVW2_IU1_LPA8_LPB0_NLCB2_SIA2_SU32_SUS128_SVW2_TT4_64_VW2_WGM4
    SolutionIndex: 27
    SolutionNameMin: Cijk_Alik_Bjlk_HB_MT128x128x16_MI16x16x16x1_SN_1LDSB1_AMAS0_GRVW4_IU1_LPA0_LPB8_NLCB1_SIA2_SU32_SUS128_SVW1_TT4_64_VW1_WGM4
    SolutionIndex: 28
    SolutionNameMin: Cijk_Alik_Bjlk_HB_MT128x128x16_MI16x16x16x1_SN_1LDSB1_AMAS3_GRVW4_IU1_LPA8_LPB0_NLCB1_SIA2_SU32_SUS128_SVW2_TT4_64_VW2_WGM4
    SolutionIndex: 29
    SolutionNameMin: Cijk_Alik_Bjlk_HB_MT128x128x16_MI16x16x16x1_SN_1LDSB1_AMAS3_GRVW4_IU1_LPA8_LPB8_NLCB1_SIA2_SU32_SUS128_SVW2_TT4_64_VW2_WGM4
    SolutionIndex: 30
    SolutionNameMin: Cijk_Alik_Bjlk_HB_MT128x128x16_MI16x16x16x1_SN_1LDSB1_AMAS3_GRVW8_IU1_LPA8_LPB0_NLCB1_SIA2_SU32_SUS128_SVW2_TT4_64_VW2_WGM4
    SolutionIndex: 31
    SolutionNameMin: Cijk_Alik_Bjlk_HB_MT128x128x16_MI16x16x16x1_SN_1LDSB1_AMAS3_GRVW8_IU1_LPA8_LPB8_NLCB1_SIA2_SU32_SUS128_SVW2_TT4_64_VW2_WGM4
    SolutionIndex: 32
    SolutionNameMin: Cijk_Alik_Bjlk_HB_MT128x128x16_MI16x16x16x1_SN_1LDSB0_AMAS0_GRVW8_IU1_LPA8_LPB0_NLCB1_SIA3_SU32_SUS128_SVW1_TT4_64_VW1_WGM4
    SolutionIndex: 33
    SolutionNameMin: Cijk_Alik_Bjlk_HB_MT128x128x16_MI16x16x16x1_SN_1LDSB0_AMAS3_GRVW8_IU1_LPA8_LPB0_NLCB1_SIA1_SU32_SUS256_SVW2_TT4_64_VW2_WGM4
    SolutionIndex: 34
    SolutionNameMin: Cijk_Alik_Bjlk_HB_MT128x128x16_MI16x16x16x1_SN_1LDSB1_AMAS0_GRVW4_IU1_LPA0_LPB0_NLCB1_SIA2_SU32_SUS256_SVW1_TT4_64_VW1_WGM4
    SolutionIndex: 35
    SolutionNameMin: Cijk_Alik_Bjlk_HB_MT128x128x16_MI16x16x16x1_SN_1LDSB1_AMAS3_GRVW8_IU1_LPA8_LPB0_NLCB1_SIA2_SU32_SUS256_SVW2_TT4_64_VW2_WGM4
    SolutionIndex: 36
    SolutionNameMin: Cijk_Alik_Bjlk_HB_MT128x128x16_MI16x16x16x1_SN_1LDSB1_AMAS3_GRVW8_IU1_LPA8_LPB8_NLCB1_SIA2_SU32_SUS256_SVW2_TT4_64_VW2_WGM4
    SolutionIndex: 37
    SolutionNameMin: Cijk_Alik_Bjlk_HB_MT128x128x16_MI16x16x16x1_SN_1LDSB0_AMAS3_GRVW4_IU1_LPA8_LPB0_NLCB1_SIA1_SU0_SUS0_SVW2_TT4_64_VW2_WGM8
    SolutionIndex: 38
    SolutionNameMin: Cijk_Alik_Bjlk_HB_MT128x128x16_MI16x16x16x1_SN_1LDSB0_AMAS3_GRVW8_IU1_LPA8_LPB0_NLCB1_SIA1_SU0_SUS0_SVW2_TT4_64_VW2_WGM8
    SolutionIndex: 39
    SolutionNameMin: Cijk_Alik_Bjlk_HB_MT128x128x16_MI16x16x16x1_SN_1LDSB0_AMAS3_GRVW8_IU1_LPA8_LPB8_NLCB1_SIA1_SU0_SUS0_SVW2_TT4_64_VW2_WGM8
    SolutionIndex: 40
    SolutionNameMin: Cijk_Alik_Bjlk_HB_MT128x128x16_MI16x16x16x1_SN_1LDSB1_AMAS3_GRVW4_IU1_LPA8_LPB0_NLCB1_SIA2_SU0_SUS0_SVW2_TT4_64_VW2_WGM8
    SolutionIndex: 41
    SolutionNameMin: Cijk_Alik_Bjlk_HB_MT128x128x16_MI16x16x16x1_SN_1LDSB1_AMAS3_GRVW8_IU1_LPA8_LPB8_NLCB1_SIA2_SU0_SUS0_SVW2_TT4_64_VW2_WGM8
    SolutionIndex: 42
    SolutionNameMin: Cijk_Alik_Bjlk_HB_MT128x128x16_MI16x16x16x1_SN_1LDSB0_AMAS3_GRVW8_IU1_LPA8_LPB0_NLCB1_SIA3_SU0_SUS0_SVW2_TT4_64_VW2_WGM8
    SolutionIndex: 43
    SolutionNameMin: Cijk_Alik_Bjlk_HB_MT128x128x16_MI16x16x16x1_SN_1LDSB0_AMAS3_GRVW8_IU1_LPA8_LPB8_NLCB1_SIA3_SU0_SUS0_SVW2_TT4_64_VW2_WGM8
    SolutionIndex: 44
    SolutionNameMin: Cijk_Alik_Bjlk_HB_MT128x128x16_MI16x16x16x1_SN_1LDSB0_AMAS0_GRVW8_IU1_LPA8_LPB8_NLCB1_SIA1_SU32_SUS128_SVW1_TT4_64_VW1_WGM8
    SolutionIndex: 45
    SolutionNameMin: Cijk_Alik_Bjlk_HB_MT128x128x16_MI16x16x16x1_SN_1LDSB0_AMAS3_GRVW8_IU1_LPA8_LPB0_NLCB1_SIA1_SU32_SUS128_SVW2_TT4_64_VW2_WGM8
    SolutionIndex: 46
    SolutionNameMin: Cijk_Alik_Bjlk_HB_MT128x128x16_MI16x16x16x1_SN_1LDSB0_AMAS3_GRVW8_IU1_LPA8_LPB8_NLCB1_SIA1_SU32_SUS128_SVW2_TT4_64_VW2_WGM8
    SolutionIndex: 47
    SolutionNameMin: Cijk_Alik_Bjlk_HB_MT128x128x16_MI16x16x16x1_SN_1LDSB1_AMAS0_GRVW4_IU1_LPA0_LPB8_NLCB1_SIA2_SU32_SUS128_SVW1_TT4_64_VW1_WGM8
    SolutionIndex: 48
    SolutionNameMin: Cijk_Alik_Bjlk_HB_MT128x128x16_MI16x16x16x1_SN_1LDSB1_AMAS3_GRVW4_IU1_LPA8_LPB0_NLCB1_SIA2_SU32_SUS128_SVW2_TT4_64_VW2_WGM8
    SolutionIndex: 49
    SolutionNameMin: Cijk_Alik_Bjlk_HB_MT128x128x16_MI16x16x16x1_SN_1LDSB1_AMAS3_GRVW4_IU1_LPA8_LPB8_NLCB1_SIA2_SU32_SUS128_SVW2_TT4_64_VW2_WGM8
    SolutionIndex: 50
    SolutionNameMin: Cijk_Alik_Bjlk_HB_MT128x128x16_MI16x16x16x1_SN_1LDSB1_AMAS0_GRVW8_IU1_LPA0_LPB0_NLCB1_SIA2_SU32_SUS128_SVW1_TT4_64_VW1_WGM8
    SolutionIndex: 51
    SolutionNameMin: Cijk_Alik_Bjlk_HB_MT128x128x16_MI16x16x16x1_SN_1LDSB1_AMAS0_GRVW8_IU1_LPA0_LPB8_NLCB1_SIA2_SU32_SUS128_SVW1_TT4_64_VW1_WGM8
    SolutionIndex: 52
    SolutionNameMin: Cijk_Alik_Bjlk_HB_MT128x128x16_MI16x16x16x1_SN_1LDSB1_AMAS3_GRVW8_IU1_LPA8_LPB0_NLCB1_SIA2_SU32_SUS128_SVW2_TT4_64_VW2_WGM8
    SolutionIndex: 53
    SolutionNameMin: Cijk_Alik_Bjlk_HB_MT128x128x16_MI16x16x16x1_SN_1LDSB1_AMAS3_GRVW8_IU1_LPA8_LPB8_NLCB1_SIA2_SU32_SUS128_SVW2_TT4_64_VW2_WGM8
    SolutionIndex: 54
    SolutionNameMin: Cijk_Alik_Bjlk_HB_MT128x128x16_MI16x16x16x1_SN_1LDSB0_AMAS0_GRVW8_IU1_LPA8_LPB8_NLCB1_SIA1_SU32_SUS256_SVW1_TT4_64_VW1_WGM8
    SolutionIndex: 55
    SolutionNameMin: Cijk_Alik_Bjlk_HB_MT128x128x16_MI16x16x16x1_SN_1LDSB0_AMAS3_GRVW8_IU1_LPA8_LPB0_NLCB1_SIA1_SU32_SUS256_SVW2_TT4_64_VW2_WGM8
    SolutionIndex: 56
    SolutionNameMin: Cijk_Alik_Bjlk_HB_MT128x128x16_MI16x16x16x1_SN_1LDSB0_AMAS3_GRVW8_IU1_LPA8_LPB8_NLCB1_SIA1_SU32_SUS256_SVW2_TT4_64_VW2_WGM8
    SolutionIndex: 57
    SolutionNameMin: Cijk_Alik_Bjlk_HB_MT128x128x16_MI16x16x16x1_SN_1LDSB1_AMAS3_GRVW2_IU1_LPA8_LPB0_NLCB2_SIA2_SU32_SUS256_SVW2_TT4_64_VW2_WGM8
    SolutionIndex: 58
    SolutionNameMin: Cijk_Alik_Bjlk_HB_MT128x128x16_MI16x16x16x1_SN_1LDSB1_AMAS3_GRVW4_IU1_LPA8_LPB0_NLCB1_SIA2_SU32_SUS256_SVW2_TT4_64_VW2_WGM8
    SolutionIndex: 59
    SolutionNameMin: Cijk_Alik_Bjlk_HB_MT128x128x16_MI16x16x16x1_SN_1LDSB1_AMAS3_GRVW4_IU1_LPA8_LPB8_NLCB1_SIA2_SU32_SUS256_SVW2_TT4_64_VW2_WGM8
    SolutionIndex: 60
    SolutionNameMin: Cijk_Alik_Bjlk_HB_MT128x128x16_MI16x16x16x1_SN_1LDSB1_AMAS0_GRVW8_IU1_LPA0_LPB0_NLCB1_SIA2_SU32_SUS256_SVW1_TT4_64_VW1_WGM8
    SolutionIndex: 61
    SolutionNameMin: Cijk_Alik_Bjlk_HB_MT128x128x16_MI16x16x16x1_SN_1LDSB1_AMAS3_GRVW8_IU1_LPA8_LPB0_NLCB1_SIA2_SU32_SUS256_SVW2_TT4_64_VW2_WGM8
    SolutionIndex: 62
    SolutionNameMin: Cijk_Alik_Bjlk_HB_MT128x128x16_MI16x16x16x1_SN_1LDSB1_AMAS3_GRVW8_IU1_LPA8_LPB8_NLCB1_SIA2_SU32_SUS256_SVW2_TT4_64_VW2_WGM8
    SolutionIndex: 63
    SolutionNameMin: Cijk_Alik_Bjlk_HB_MT128x128x16_MI16x16x16x1_SN_1LDSB0_AMAS3_GRVW8_IU1_LPA8_LPB8_NLCB1_SIA3_SU32_SUS256_SVW2_TT4_64_VW2_WGM8
    SolutionIndex: 64
    SolutionNameMin: Cijk_Alik_Bjlk_HB_MT32x32x32_MI16x16x16x1_SN_1LDSB0_AMAS0_GRVW2_IU1_LPA8_LPB0_NLCB1_SIA1_SU0_SUS0_SVW1_TT1_16_VW1_WGM4
    SolutionIndex: 65
    SolutionNameMin: Cijk_Alik_Bjlk_HB_MT32x32x32_MI16x16x16x1_SN_1LDSB0_AMAS0_GRVW8_IU1_LPA8_LPB0_NLCB1_SIA1_SU0_SUS0_SVW1_TT1_16_VW1_WGM4
    SolutionIndex: 66
    SolutionNameMin: Cijk_Alik_Bjlk_HB_MT32x32x32_MI16x16x16x1_SN_1LDSB1_AMAS0_GRVW4_IU2_LPA8_LPB0_NLCB1_SIA2_SU0_SUS0_SVW1_TT1_16_VW1_WGM4
    SolutionIndex: 67
    SolutionNameMin: Cijk_Alik_Bjlk_HB_MT32x32x32_MI16x16x16x1_SN_1LDSB1_AMAS0_GRVW4_IU2_LPA8_LPB8_NLCB1_SIA2_SU0_SUS0_SVW1_TT1_16_VW1_WGM4
    SolutionIndex: 68
    SolutionNameMin: Cijk_Alik_Bjlk_HB_MT32x32x32_MI16x16x16x1_SN_1LDSB1_AMAS0_GRVW8_IU2_LPA8_LPB0_NLCB1_SIA2_SU0_SUS0_SVW1_TT1_16_VW1_WGM4
    SolutionIndex: 69
    SolutionNameMin: Cijk_Alik_Bjlk_HB_MT32x32x32_MI16x16x16x1_SN_1LDSB1_AMAS0_GRVW4_IU2_LPA8_LPB8_NLCB1_SIA2_SU32_SUS128_SVW1_TT1_16_VW1_WGM4
    SolutionIndex: 70
    SolutionNameMin: Cijk_Alik_Bjlk_HB_MT32x32x32_MI16x16x16x1_SN_1LDSB1_AMAS0_GRVW8_IU2_LPA8_LPB8_NLCB1_SIA2_SU32_SUS128_SVW1_TT1_16_VW1_WGM4
    SolutionIndex: 71
    SolutionNameMin: Cijk_Alik_Bjlk_HB_MT32x32x32_MI16x16x16x1_SN_1LDSB1_AMAS0_GRVW4_IU2_LPA8_LPB0_NLCB1_SIA2_SU32_SUS256_SVW1_TT1_16_VW1_WGM4
    SolutionIndex: 72
    SolutionNameMin: Cijk_Alik_Bjlk_HB_MT32x32x32_MI16x16x16x1_SN_1LDSB1_AMAS0_GRVW4_IU2_LPA8_LPB8_NLCB1_SIA2_SU32_SUS256_SVW1_TT1_16_VW1_WGM4
    SolutionIndex: 73
    SolutionNameMin: Cijk_Alik_Bjlk_HB_MT32x32x32_MI16x16x16x1_SN_1LDSB1_AMAS0_GRVW8_IU2_LPA8_LPB0_NLCB1_SIA2_SU32_SUS256_SVW1_TT1_16_VW1_WGM4
    SolutionIndex: 74
    SolutionNameMin: Cijk_Alik_Bjlk_HB_MT32x32x32_MI16x16x16x1_SN_1LDSB0_AMAS0_GRVW4_IU1_LPA8_LPB0_NLCB1_SIA1_SU0_SUS0_SVW1_TT1_16_VW1_WGM8
    SolutionIndex: 75
    SolutionNameMin: Cijk_Alik_Bjlk_HB_MT32x32x32_MI16x16x16x1_SN_1LDSB0_AMAS0_GRVW8_IU1_LPA8_LPB0_NLCB1_SIA1_SU0_SUS0_SVW1_TT1_16_VW1_WGM8
    SolutionIndex: 76
    SolutionNameMin: Cijk_Alik_Bjlk_HB_MT32x32x32_MI16x16x16x1_SN_1LDSB1_AMAS0_GRVW4_IU2_LPA8_LPB0_NLCB1_SIA2_SU0_SUS0_SVW1_TT1_16_VW1_WGM8
    SolutionIndex: 77
    SolutionNameMin: Cijk_Alik_Bjlk_HB_MT32x32x32_MI16x16x16x1_SN_1LDSB1_AMAS0_GRVW4_IU2_LPA8_LPB8_NLCB1_SIA2_SU0_SUS0_SVW1_TT1_16_VW1_WGM8
    SolutionIndex: 78
    SolutionNameMin: Cijk_Alik_Bjlk_HB_MT32x32x32_MI16x16x16x1_SN_1LDSB1_AMAS0_GRVW8_IU2_LPA8_LPB0_NLCB1_SIA2_SU0_SUS0_SVW1_TT1_16_VW1_WGM8
    SolutionIndex: 79
    SolutionNameMin: Cijk_Alik_Bjlk_HB_MT32x32x32_MI16x16x16x1_SN_1LDSB0_AMAS0_GRVW8_IU1_LPA8_LPB0_NLCB1_SIA3_SU0_SUS0_SVW1_TT1_16_VW1_WGM8
    SolutionIndex: 80
    SolutionNameMin: Cijk_Alik_Bjlk_HB_MT32x32x32_MI16x16x16x1_SN_1LDSB0_AMAS0_GRVW8_IU1_LPA8_LPB0_NLCB1_SIA1_SU32_SUS128_SVW1_TT1_16_VW1_WGM8
    SolutionIndex: 81
    SolutionNameMin: Cijk_Alik_Bjlk_HB_MT32x32x32_MI16x16x16x1_SN_1LDSB0_AMAS0_GRVW8_IU1_LPA8_LPB8_NLCB1_SIA1_SU32_SUS128_SVW1_TT1_16_VW1_WGM8
    SolutionIndex: 82
    SolutionNameMin: Cijk_Alik_Bjlk_HB_MT32x32x32_MI16x16x16x1_SN_1LDSB1_AMAS0_GRVW4_IU2_LPA8_LPB0_NLCB1_SIA2_SU32_SUS128_SVW1_TT1_16_VW1_WGM8
    SolutionIndex: 83
    SolutionNameMin: Cijk_Alik_Bjlk_HB_MT32x32x32_MI16x16x16x1_SN_1LDSB1_AMAS0_GRVW4_IU2_LPA8_LPB8_NLCB1_SIA2_SU32_SUS128_SVW1_TT1_16_VW1_WGM8
    SolutionIndex: 84
    SolutionNameMin: Cijk_Alik_Bjlk_HB_MT32x32x32_MI16x16x16x1_SN_1LDSB1_AMAS0_GRVW8_IU2_LPA8_LPB0_NLCB1_SIA2_SU32_SUS128_SVW1_TT1_16_VW1_WGM8
    SolutionIndex: 85
    SolutionNameMin: Cijk_Alik_Bjlk_HB_MT32x32x32_MI16x16x16x1_SN_1LDSB1_AMAS0_GRVW4_IU2_LPA8_LPB0_NLCB1_SIA2_SU32_SUS256_SVW1_TT1_16_VW1_WGM8
    SolutionIndex: 86
    SolutionNameMin: Cijk_Alik_Bjlk_HB_MT32x32x32_MI16x16x16x1_SN_1LDSB1_AMAS0_GRVW8_IU2_LPA8_LPB8_NLCB1_SIA2_SU32_SUS256_SVW1_TT1_16_VW1_WGM8
    SolutionIndex: 87
    SolutionNameMin: Cijk_Alik_Bjlk_HB_MT64x64x32_MI16x16x16x1_SN_1LDSB0_AMAS0_GRVW4_IU1_LPA8_LPB0_NLCB1_SIA1_SU0_SUS0_SVW1_TT2_32_VW1_WGM4
    SolutionIndex: 88
    SolutionNameMin: Cijk_Alik_Bjlk_HB_MT64x64x32_MI16x16x16x1_SN_1LDSB0_AMAS0_GRVW8_IU1_LPA8_LPB0_NLCB1_SIA1_SU0_SUS0_SVW1_TT2_32_VW1_WGM4
    SolutionIndex: 89
    SolutionNameMin: Cijk_Alik_Bjlk_HB_MT64x64x32_MI16x16x16x1_SN_1LDSB0_AMAS0_GRVW8_IU1_LPA8_LPB8_NLCB1_SIA1_SU0_SUS0_SVW1_TT2_32_VW1_WGM4
    SolutionIndex: 90
    SolutionNameMin: Cijk_Alik_Bjlk_HB_MT64x64x32_MI16x16x16x1_SN_1LDSB0_AMAS3_GRVW8_IU1_LPA8_LPB0_NLCB1_SIA1_SU0_SUS0_SVW2_TT2_32_VW2_WGM4
    SolutionIndex: 91
    SolutionNameMin: Cijk_Alik_Bjlk_HB_MT64x64x32_MI16x16x16x1_SN_1LDSB0_AMAS3_GRVW8_IU1_LPA8_LPB8_NLCB1_SIA1_SU0_SUS0_SVW2_TT2_32_VW2_WGM4
    SolutionIndex: 92
    SolutionNameMin: Cijk_Alik_Bjlk_HB_MT64x64x32_MI16x16x16x1_SN_1LDSB1_AMAS0_GRVW2_IU2_LPA8_LPB0_NLCB1_SIA2_SU0_SUS0_SVW1_TT2_32_VW1_WGM4
    SolutionIndex: 93
    SolutionNameMin: Cijk_Alik_Bjlk_HB_MT64x64x32_MI16x16x16x1_SN_1LDSB1_AMAS3_GRVW4_IU2_LPA8_LPB8_NLCB1_SIA2_SU0_SUS0_SVW2_TT2_32_VW2_WGM4
    SolutionIndex: 94
    SolutionNameMin: Cijk_Alik_Bjlk_HB_MT64x64x32_MI16x16x16x1_SN_1LDSB1_AMAS0_GRVW8_IU2_LPA8_LPB0_NLCB1_SIA2_SU0_SUS0_SVW1_TT2_32_VW1_WGM4
    SolutionIndex: 95
    SolutionNameMin: Cijk_Alik_Bjlk_HB_MT64x64x32_MI16x16x16x1_SN_1LDSB1_AMAS0_GRVW8_IU2_LPA8_LPB8_NLCB1_SIA2_SU0_SUS0_SVW1_TT2_32_VW1_WGM4
    SolutionIndex: 96
    SolutionNameMin: Cijk_Alik_Bjlk_HB_MT64x64x32_MI16x16x16x1_SN_1LDSB1_AMAS3_GRVW8_IU2_LPA8_LPB0_NLCB1_SIA2_SU0_SUS0_SVW2_TT2_32_VW2_WGM4
    SolutionIndex: 97
    SolutionNameMin: Cijk_Alik_Bjlk_HB_MT64x64x32_MI16x16x16x1_SN_1LDSB1_AMAS3_GRVW8_IU2_LPA8_LPB8_NLCB1_SIA2_SU0_SUS0_SVW2_TT2_32_VW2_WGM4
    SolutionIndex: 98
    SolutionNameMin: Cijk_Alik_Bjlk_HB_MT64x64x32_MI16x16x16x1_SN_1LDSB0_AMAS3_GRVW4_IU1_LPA8_LPB8_NLCB1_SIA3_SU0_SUS0_SVW2_TT2_32_VW2_WGM4
    SolutionIndex: 99
    SolutionNameMin: Cijk_Alik_Bjlk_HB_MT64x64x32_MI16x16x16x1_SN_1LDSB0_AMAS0_GRVW8_IU1_LPA8_LPB0_NLCB1_SIA3_SU0_SUS0_SVW1_TT2_32_VW1_WGM4
    SolutionIndex: 100
    SolutionNameMin: Cijk_Alik_Bjlk_HB_MT64x64x32_MI16x16x16x1_SN_1LDSB0_AMAS0_GRVW8_IU1_LPA8_LPB8_NLCB1_SIA3_SU0_SUS0_SVW1_TT2_32_VW1_WGM4
    SolutionIndex: 101
    SolutionNameMin: Cijk_Alik_Bjlk_HB_MT64x64x32_MI16x16x16x1_SN_1LDSB0_AMAS3_GRVW8_IU1_LPA8_LPB0_NLCB1_SIA3_SU0_SUS0_SVW2_TT2_32_VW2_WGM4
    SolutionIndex: 102
    SolutionNameMin: Cijk_Alik_Bjlk_HB_MT64x64x32_MI16x16x16x1_SN_1LDSB0_AMAS3_GRVW8_IU1_LPA8_LPB8_NLCB1_SIA3_SU0_SUS0_SVW2_TT2_32_VW2_WGM4
    SolutionIndex: 103
    SolutionNameMin: Cijk_Alik_Bjlk_HB_MT64x64x32_MI16x16x16x1_SN_1LDSB1_AMAS3_GRVW8_IU2_LPA8_LPB8_NLCB1_SIA2_SU32_SUS128_SVW2_TT2_32_VW2_WGM4
    SolutionIndex: 104
    SolutionNameMin: Cijk_Alik_Bjlk_HB_MT64x64x32_MI16x16x16x1_SN_1LDSB0_AMAS0_GRVW8_IU1_LPA8_LPB8_NLCB1_SIA3_SU32_SUS128_SVW1_TT2_32_VW1_WGM4
    SolutionIndex: 105
    SolutionNameMin: Cijk_Alik_Bjlk_HB_MT64x64x32_MI16x16x16x1_SN_1LDSB0_AMAS3_GRVW8_IU1_LPA8_LPB0_NLCB1_SIA3_SU32_SUS128_SVW2_TT2_32_VW2_WGM4
    SolutionIndex: 106
    SolutionNameMin: Cijk_Alik_Bjlk_HB_MT64x64x32_MI16x16x16x1_SN_1LDSB0_AMAS3_GRVW8_IU1_LPA8_LPB0_NLCB1_SIA1_SU32_SUS256_SVW2_TT2_32_VW2_WGM4
    SolutionIndex: 107
    SolutionNameMin: Cijk_Alik_Bjlk_HB_MT64x64x32_MI16x16x16x1_SN_1LDSB1_AMAS3_GRVW8_IU2_LPA8_LPB8_NLCB1_SIA2_SU32_SUS256_SVW2_TT2_32_VW2_WGM4
    SolutionIndex: 108
    SolutionNameMin: Cijk_Alik_Bjlk_HB_MT64x64x32_MI16x16x16x1_SN_1LDSB0_AMAS0_GRVW8_IU1_LPA8_LPB0_NLCB1_SIA3_SU32_SUS256_SVW1_TT2_32_VW1_WGM4
    SolutionIndex: 109
    SolutionNameMin: Cijk_Alik_Bjlk_HB_MT64x64x32_MI16x16x16x1_SN_1LDSB0_AMAS0_GRVW4_IU1_LPA8_LPB0_NLCB1_SIA1_SU0_SUS0_SVW1_TT2_32_VW1_WGM8
    SolutionIndex: 110
    SolutionNameMin: Cijk_Alik_Bjlk_HB_MT64x64x32_MI16x16x16x1_SN_1LDSB0_AMAS0_GRVW4_IU1_LPA8_LPB8_NLCB1_SIA1_SU0_SUS0_SVW1_TT2_32_VW1_WGM8
    SolutionIndex: 111
    SolutionNameMin: Cijk_Alik_Bjlk_HB_MT64x64x32_MI16x16x16x1_SN_1LDSB0_AMAS0_GRVW8_IU1_LPA8_LPB0_NLCB1_SIA1_SU0_SUS0_SVW1_TT2_32_VW1_WGM8
    SolutionIndex: 112
    SolutionNameMin: Cijk_Alik_Bjlk_HB_MT64x64x32_MI16x16x16x1_SN_1LDSB0_AMAS0_GRVW8_IU1_LPA8_LPB8_NLCB1_SIA1_SU0_SUS0_SVW1_TT2_32_VW1_WGM8
    SolutionIndex: 113
    SolutionNameMin: Cijk_Alik_Bjlk_HB_MT64x64x32_MI16x16x16x1_SN_1LDSB0_AMAS3_GRVW8_IU1_LPA8_LPB0_NLCB1_SIA1_SU0_SUS0_SVW2_TT2_32_VW2_WGM8
    SolutionIndex: 114
    SolutionNameMin: Cijk_Alik_Bjlk_HB_MT64x64x32_MI16x16x16x1_SN_1LDSB0_AMAS3_GRVW8_IU1_LPA8_LPB8_NLCB1_SIA1_SU0_SUS0_SVW2_TT2_32_VW2_WGM8
    SolutionIndex: 115
    SolutionNameMin: Cijk_Alik_Bjlk_HB_MT64x64x32_MI16x16x16x1_SN_1LDSB1_AMAS3_GRVW4_IU2_LPA8_LPB0_NLCB1_SIA2_SU0_SUS0_SVW2_TT2_32_VW2_WGM8
    SolutionIndex: 116
    SolutionNameMin: Cijk_Alik_Bjlk_HB_MT64x64x32_MI16x16x16x1_SN_1LDSB1_AMAS3_GRVW4_IU2_LPA8_LPB8_NLCB1_SIA2_SU0_SUS0_SVW2_TT2_32_VW2_WGM8
    SolutionIndex: 117
    SolutionNameMin: Cijk_Alik_Bjlk_HB_MT64x64x32_MI16x16x16x1_SN_1LDSB1_AMAS0_GRVW8_IU2_LPA8_LPB0_NLCB1_SIA2_SU0_SUS0_SVW1_TT2_32_VW1_WGM8
    SolutionIndex: 118
    SolutionNameMin: Cijk_Alik_Bjlk_HB_MT64x64x32_MI16x16x16x1_SN_1LDSB1_AMAS0_GRVW8_IU2_LPA8_LPB8_NLCB1_SIA2_SU0_SUS0_SVW1_TT2_32_VW1_WGM8
    SolutionIndex: 119
    SolutionNameMin: Cijk_Alik_Bjlk_HB_MT64x64x32_MI16x16x16x1_SN_1LDSB1_AMAS3_GRVW8_IU2_LPA8_LPB0_NLCB1_SIA2_SU0_SUS0_SVW2_TT2_32_VW2_WGM8
    SolutionIndex: 120
    SolutionNameMin: Cijk_Alik_Bjlk_HB_MT64x64x32_MI16x16x16x1_SN_1LDSB1_AMAS3_GRVW8_IU2_LPA8_LPB8_NLCB1_SIA2_SU0_SUS0_SVW2_TT2_32_VW2_WGM8
    SolutionIndex: 121
    SolutionNameMin: Cijk_Alik_Bjlk_HB_MT64x64x32_MI16x16x16x1_SN_1LDSB0_AMAS0_GRVW8_IU1_LPA8_LPB8_NLCB1_SIA3_SU0_SUS0_SVW1_TT2_32_VW1_WGM8
    SolutionIndex: 122
    SolutionNameMin: Cijk_Alik_Bjlk_HB_MT64x64x32_MI16x16x16x1_SN_1LDSB0_AMAS3_GRVW8_IU1_LPA8_LPB0_NLCB1_SIA3_SU0_SUS0_SVW2_TT2_32_VW2_WGM8
    SolutionIndex: 123
    SolutionNameMin: Cijk_Alik_Bjlk_HB_MT64x64x32_MI16x16x16x1_SN_1LDSB0_AMAS0_GRVW8_IU1_LPA8_LPB0_NLCB1_SIA1_SU32_SUS128_SVW1_TT2_32_VW1_WGM8
    SolutionIndex: 124
    SolutionNameMin: Cijk_Alik_Bjlk_HB_MT64x64x32_MI16x16x16x1_SN_1LDSB0_AMAS3_GRVW8_IU1_LPA8_LPB0_NLCB1_SIA1_SU32_SUS128_SVW2_TT2_32_VW2_WGM8
    SolutionIndex: 125
    SolutionNameMin: Cijk_Alik_Bjlk_HB_MT64x64x32_MI16x16x16x1_SN_1LDSB1_AMAS3_GRVW8_IU2_LPA8_LPB0_NLCB1_SIA2_SU32_SUS128_SVW2_TT2_32_VW2_WGM8
    SolutionIndex: 126
    SolutionNameMin: Cijk_Alik_Bjlk_HB_MT64x64x32_MI16x16x16x1_SN_1LDSB1_AMAS3_GRVW8_IU2_LPA8_LPB8_NLCB1_SIA2_SU32_SUS128_SVW2_TT2_32_VW2_WGM8
    SolutionIndex: 127
    SolutionNameMin: Cijk_Alik_Bjlk_HB_MT64x64x32_MI16x16x16x1_SN_1LDSB0_AMAS3_GRVW8_IU1_LPA8_LPB0_NLCB1_SIA3_SU32_SUS128_SVW2_TT2_32_VW2_WGM8
    SolutionIndex: 128
    SolutionNameMin: Cijk_Alik_Bjlk_HB_MT64x64x32_MI16x16x16x1_SN_1LDSB0_AMAS3_GRVW8_IU1_LPA8_LPB8_NLCB1_SIA3_SU32_SUS128_SVW2_TT2_32_VW2_WGM8
    SolutionIndex: 129
    SolutionNameMin: Cijk_Alik_Bjlk_HB_MT64x64x32_MI16x16x16x1_SN_1LDSB1_AMAS0_GRVW8_IU2_LPA8_LPB0_NLCB1_SIA2_SU32_SUS256_SVW1_TT2_32_VW1_WGM8
    SolutionIndex: 130
    SolutionNameMin: Cijk_Alik_Bjlk_HB_MT64x64x32_MI16x16x16x1_SN_1LDSB1_AMAS3_GRVW8_IU2_LPA8_LPB0_NLCB1_SIA2_SU32_SUS256_SVW2_TT2_32_VW2_WGM8
    SolutionIndex: 131
    SolutionNameMin: Cijk_Alik_Bjlk_HB_MT64x64x32_MI16x16x16x1_SN_1LDSB0_AMAS0_GRVW8_IU1_LPA8_LPB8_NLCB1_SIA3_SU32_SUS256_SVW1_TT2_32_VW1_WGM8
    SolutionIndex: 132
    SolutionNameMin: Cijk_Alik_Bjlk_HB_MT64x64x32_MI16x16x16x1_SN_1LDSB0_AMAS3_GRVW8_IU1_LPA8_LPB0_NLCB1_SIA3_SU32_SUS256_SVW2_TT2_32_VW2_WGM8
- - - [64, 64, 1, 64, 96, 96, 96, 96]
    - [67, 0.091]
  - - [64, 64, 1, 128, 96, 96, 160, 160]
    - [83, 0.175]
  - - [64, 64, 1, 256, 96, 96, 288, 288]
    - [68, 0.323]
  - - [64, 64, 1, 512, 96, 96, 544, 544]
    - [70, 0.557]
  - - [64, 64, 1, 1024, 96, 96, 1056, 1056]
    - [84, 0.872]
  - - [64, 64, 1, 2048, 96, 96, 2080, 2080]
    - [67, 1.215]
  - - [64, 64, 1, 4096, 96, 96, 4128, 4128]
    - [67, 1.512]
  - - [64, 128, 1, 64, 96, 96, 96, 128]
    - [68, 0.187]
  - - [64, 128, 1, 128, 96, 96, 160, 160]
    - [82, 0.36]
  - - [64, 128, 1, 256, 96, 96, 288, 288]
    - [78, 0.66]
  - - [64, 128, 1, 512, 96, 96, 544, 544]
    - [84, 1.131]
  - - [64, 128, 1, 1024, 96, 96, 1056, 1056]
    - [85, 1.767]
  - - [64, 128, 1, 2048, 96, 96, 2080, 2080]
    - [83, 2.453]
  - - [64, 128, 1, 4096, 96, 96, 4128, 4128]
    - [69, 3.046]
  - - [64, 256, 1, 64, 96, 96, 96, 256]
    - [86, 0.376]
  - - [64, 256, 1, 128, 96, 96, 160, 256]
    - [82, 0.724]
  - - [64, 256, 1, 256, 96, 96, 288, 288]
    - [73, 1.333]
  - - [64, 256, 1, 512, 96, 96, 544, 544]
    - [71, 2.273]
  - - [64, 256, 1, 1024, 96, 96, 1056, 1056]
    - [71, 3.545]
  - - [64, 256, 1, 2048, 96, 96, 2080, 2080]
    - [67, 4.907]
  - - [64, 256, 1, 4096, 96, 96, 4128, 4128]
    - [83, 6.08]
  - - [64, 512, 1, 64, 96, 96, 96, 512]
    - [85, 0.741]
  - - [64, 512, 1, 128, 96, 96, 160, 512]
    - [78, 1.412]
  - - [64, 512, 1, 256, 96, 96, 288, 512]
    - [66, 2.545]
  - - [64, 512, 1, 512, 96, 96, 544, 544]
    - [68, 4.302]
  - - [64, 512, 1, 1024, 96, 96, 1056, 1056]
    - [68, 6.472]
  - - [64, 512, 1, 2048, 96, 96, 2080, 2080]
    - [76, 8.65]
  - - [64, 512, 1, 4096, 96, 96, 4128, 4128]
    - [68, 10.408]
  - - [64, 1024, 1, 64, 96, 96, 96, 1024]
    - [64, 1.442]
  - - [64, 1024, 1, 128, 96, 96, 160, 1024]
    - [74, 2.702]
  - - [64, 1024, 1, 256, 96, 96, 288, 1024]
    - [75, 4.793]
  - - [64, 1024, 1, 512, 96, 96, 544, 1024]
    - [75, 7.737]
  - - [64, 1024, 1, 1024, 96, 96, 1056, 1056]
    - [65, 11.257]
  - - [64, 1024, 1, 2048, 96, 96, 2080, 2080]
    - [65, 14.439]
  - - [64, 1024, 1, 4096, 96, 96, 4128, 4128]
    - [65, 16.77]
  - - [64, 2048, 1, 64, 96, 96, 96, 2048]
    - [95, 2.784]
  - - [64, 2048, 1, 128, 96, 96, 160, 2048]
    - [2, 5.051]
  - - [64, 2048, 1, 256, 96, 96, 288, 2048]
    - [118, 8.525]
  - - [64, 2048, 1, 512, 96, 96, 544, 2048]
    - [129, 13.123]
  - - [64, 2048, 1, 1024, 96, 96, 1056, 2048]
    - [94, 17.888]
  - - [64, 2048, 1, 2048, 96, 96, 2080, 2080]
    - [96, 21.895]
  - - [64, 2048, 1, 4096, 96, 96, 4128, 4128]
    - [103, 24.397]
  - - [64, 4096, 1, 64, 96, 96, 96, 4096]
    - [1, 5.236]
  - - [64, 4096, 1, 128, 96, 96, 160, 4096]
    - [96, 9.315]
  - - [64, 4096, 1, 256, 96, 96, 288, 4096]
    - [95, 15.143]
  - - [64, 4096, 1, 512, 96, 96, 544, 4096]
    - [118, 21.915]
  - - [64, 4096, 1, 1024, 96, 96, 1056, 4096]
    - [95, 28.2]
  - - [64, 4096, 1, 2048, 96, 96, 2080, 4096]
    - [117, 32.998]
  - - [64, 4096, 1, 4096, 96, 96, 4128, 4128]
    - [11, 35.156]
  - - [128, 64, 1, 64, 160, 160, 96, 96]
    - [73, 0.187]
  - - [128, 64, 1, 128, 160, 160, 160, 160]
    - [66, 0.358]
  - - [128, 64, 1, 256, 160, 160, 288, 288]
    - [67, 0.659]
  - - [128, 64, 1, 512, 160, 160, 544, 544]
    - [73, 1.129]
  - - [128, 64, 1, 1024, 160, 160, 1056, 1056]
    - [71, 1.768]
  - - [128, 64, 1, 2048, 160, 160, 2080, 2080]
    - [76, 2.441]
  - - [128, 64, 1, 4096, 160, 160, 4128, 4128]
    - [67, 3.025]
  - - [128, 128, 1, 64, 160, 160, 96, 128]
    - [79, 0.376]
  - - [128, 128, 1, 128, 160, 160, 160, 160]
    - [72, 0.721]
  - - [128, 128, 1, 256, 160, 160, 288, 288]
    - [86, 1.333]
  - - [128, 128, 1, 512, 160, 160, 544, 544]
    - [73, 2.281]
  - - [128, 128, 1, 1024, 160, 160, 1056, 1056]
    - [72, 3.573]
  - - [128, 128, 1, 2048, 160, 160, 2080, 2080]
    - [72, 4.928]
  - - [128, 128, 1, 4096, 160, 160, 4128, 4128]
    - [72, 6.101]
  - - [128, 256, 1, 64, 160, 160, 96, 256]
    - [68, 0.748]
  - - [128, 256, 1, 128, 160, 160, 160, 256]
    - [78, 1.413]
  - - [128, 256, 1, 256, 160, 160, 288, 288]
    - [78, 2.569]
  - - [128, 256, 1, 512, 160, 160, 544, 544]
    - [78, 4.286]
  - - [128, 256, 1, 1024, 160, 160, 1056, 1056]
    - [84, 6.449]
  - - [128, 256, 1, 2048, 160, 160, 2080, 2080]
    - [78, 8.655]
  - - [128, 256, 1, 4096, 160, 160, 4128, 4128]
    - [76, 10.411]
  - - [128, 512, 1, 64, 160, 160, 96, 512]
    - [75, 1.458]
  - - [128, 512, 1, 128, 160, 160, 160, 512]
    - [78, 2.695]
  - - [128, 512, 1, 256, 160, 160, 288, 512]
    - [75, 4.786]
  - - [128, 512, 1, 512, 160, 160, 544, 544]
    - [74, 7.766]
  - - [128, 512, 1, 1024, 160, 160, 1056, 1056]
    - [75, 11.27]
  - - [128, 512, 1, 2048, 160, 160, 2080, 2080]
    - [75, 14.498]
  - - [128, 512, 1, 4096, 160, 160, 4128, 4128]
    - [80, 16.825]
  - - [128, 1024, 1, 64, 160, 160, 96, 1024]
    - [129, 2.777]
  - - [128, 1024, 1, 128, 160, 160, 160, 1024]
    - [94, 5.082]
  - - [128, 1024, 1, 256, 160, 160, 288, 1024]
    - [88, 8.632]
  - - [128, 1024, 1, 512, 160, 160, 544, 1024]
    - [111, 13.345]
  - - [128, 1024, 1, 1024, 160, 160, 1056, 1056]
    - [90, 18.268]
  - - [128, 1024, 1, 2048, 160, 160, 2080, 2080]
    - [91, 22.364]
  - - [128, 1024, 1, 4096, 160, 160, 4128, 4128]
    - [89, 24.32]
  - - [128, 2048, 1, 64, 160, 160, 96, 2048]
    - [128, 5.241]
  - - [128, 2048, 1, 128, 160, 160, 160, 2048]
    - [0, 9.345]
  - - [128, 2048, 1, 256, 160, 160, 288, 2048]
    - [100, 15.287]
  - - [128, 2048, 1, 512, 160, 160, 544, 2048]
    - [121, 22.209]
  - - [128, 2048, 1, 1024, 160, 160, 1056, 2048]
    - [99, 28.746]
  - - [128, 2048, 1, 2048, 160, 160, 2080, 2080]
    - [121, 33.692]
  - - [128, 2048, 1, 4096, 160, 160, 4128, 4128]
    - [132, 34.821]
  - - [128, 4096, 1, 64, 160, 160, 96, 4096]
    - [3, 9.544]
  - - [128, 4096, 1, 128, 160, 160, 160, 4096]
    - [4, 16.079]
  - - [128, 4096, 1, 256, 160, 160, 288, 4096]
    - [8, 24.318]
  - - [128, 4096, 1, 512, 160, 160, 544, 4096]
    - [122, 32.673]
  - - [128, 4096, 1, 1024, 160, 160, 1056, 4096]
    - [41, 39.322]
  - - [128, 4096, 1, 2048, 160, 160, 2080, 4096]
    - [19, 42.14]
  - - [128, 4096, 1, 4096, 160, 160, 4128, 4128]
    - [41, 46.045]
  - - [256, 64, 1, 64, 288, 288, 96, 96]
    - [77, 0.377]
  - - [256, 64, 1, 128, 288, 288, 160, 160]
    - [82, 0.725]
  - - [256, 64, 1, 256, 288, 288, 288, 288]
    - [76, 1.323]
  - - [256, 64, 1, 512, 288, 288, 544, 544]
    - [68, 2.267]
  - - [256, 64, 1, 1024, 288, 288, 1056, 1056]
    - [72, 3.55]
  - - [256, 64, 1, 2048, 288, 288, 2080, 2080]
    - [83, 4.897]
  - - [256, 64, 1, 4096, 288, 288, 4128, 4128]
    - [82, 6.053]
  - - [256, 128, 1, 64, 288, 288, 96, 128]
    - [81, 0.746]
  - - [256, 128, 1, 128, 288, 288, 160, 160]
    - [68, 1.417]
  - - [256, 128, 1, 256, 288, 288, 288, 288]
    - [68, 2.555]
  - - [256, 128, 1, 512, 288, 288, 544, 544]
    - [68, 4.289]
  - - [256, 128, 1, 1024, 288, 288, 1056, 1056]
    - [68, 6.48]
  - - [256, 128, 1, 2048, 288, 288, 2080, 2080]
    - [78, 8.652]
  - - [256, 128, 1, 4096, 288, 288, 4128, 4128]
    - [78, 10.398]
  - - [256, 256, 1, 64, 288, 288, 96, 256]
    - [75, 1.453]
  - - [256, 256, 1, 128, 288, 288, 160, 256]
    - [75, 2.728]
  - - [256, 256, 1, 256, 288, 288, 288, 288]
    - [64, 4.781]
  - - [256, 256, 1, 512, 288, 288, 544, 544]
    - [65, 7.844]
  - - [256, 256, 1, 1024, 288, 288, 1056, 1056]
    - [65, 11.362]
  - - [256, 256, 1, 2048, 288, 288, 2080, 2080]
    - [65, 14.635]
  - - [256, 256, 1, 4096, 288, 288, 4128, 4128]
    - [65, 17.009]
  - - [256, 512, 1, 64, 288, 288, 96, 512]
    - [95, 2.781]
  - - [256, 512, 1, 128, 288, 288, 160, 512]
    - [112, 5.088]
  - - [256, 512, 1, 256, 288, 288, 288, 512]
    - [111, 8.676]
  - - [256, 512, 1, 512, 288, 288, 544, 544]
    - [112, 13.425]
  - - [256, 512, 1, 1024, 288, 288, 1056, 1056]
    - [112, 18.411]
  - - [256, 512, 1, 2048, 288, 288, 2080, 2080]
    - [110, 22.621]
  - - [256, 512, 1, 4096, 288, 288, 4128, 4128]
    - [123, 24.77]
  - - [256, 1024, 1, 64, 288, 288, 96, 1024]
    - [5, 5.226]
  - - [256, 1024, 1, 128, 288, 288, 160, 1024]
    - [0, 9.334]
  - - [256, 1024, 1, 256, 288, 288, 288, 1024]
    - [108, 15.196]
  - - [256, 1024, 1, 512, 288, 288, 544, 1024]
    - [99, 22.155]
  - - [256, 1024, 1, 1024, 288, 288, 1056, 1056]
    - [99, 28.717]
  - - [256, 1024, 1, 2048, 288, 288, 2080, 2080]
    - [102, 33.578]
  - - [256, 1024, 1, 4096, 288, 288, 4128, 4128]
    - [127, 35.073]
  - - [256, 2048, 1, 64, 288, 288, 96, 2048]
    - [128, 9.538]
  - - [256, 2048, 1, 128, 288, 288, 160, 2048]
    - [9, 16.112]
  - - [256, 2048, 1, 256, 288, 288, 288, 2048]
    - [10, 24.246]
  - - [256, 2048, 1, 512, 288, 288, 544, 2048]
    - [102, 32.593]
  - - [256, 2048, 1, 1024, 288, 288, 1056, 2048]
    - [101, 39.311]
  - - [256, 2048, 1, 2048, 288, 288, 2080, 2080]
    - [17, 42.94]
  - - [256, 2048, 1, 4096, 288, 288, 4128, 4128]
    - [61, 45.794]
  - - [256, 4096, 1, 64, 288, 288, 96, 4096]
    - [6, 15.793]
  - - [256, 4096, 1, 128, 288, 288, 160, 4096]
    - [12, 24.681]
  - - [256, 4096, 1, 256, 288, 288, 288, 4096]
    - [7, 34.337]
  - - [256, 4096, 1, 512, 288, 288, 544, 4096]
    - [22, 43.632]
  - - [256, 4096, 1, 1024, 288, 288, 1056, 4096]
    - [43, 50.468]
  - - [256, 4096, 1, 2048, 288, 288, 2080, 4096]
    - [21, 53.345]
  - - [256, 4096, 1, 4096, 288, 288, 4128, 4128]
    - [20, 56.584]
  - - [384, 64, 1, 64, 416, 416, 96, 96]
    - [75, 0.563]
  - - [384, 64, 1, 128, 416, 416, 160, 160]
    - [82, 1.079]
  - - [384, 64, 1, 256, 416, 416, 288, 288]
    - [78, 1.979]
  - - [384, 64, 1, 512, 416, 416, 544, 544]
    - [68, 3.396]
  - - [384, 64, 1, 1024, 416, 416, 1056, 1056]
    - [66, 5.335]
  - - [384, 64, 1, 2048, 416, 416, 2080, 2080]
    - [83, 7.358]
  - - [384, 64, 1, 4096, 416, 416, 4128, 4128]
    - [71, 9.088]
  - - [384, 128, 1, 64, 416, 416, 96, 128]
    - [75, 1.108]
  - - [384, 128, 1, 128, 416, 416, 160, 160]
    - [68, 2.121]
  - - [384, 128, 1, 256, 416, 416, 288, 288]
    - [76, 3.824]
  - - [384, 128, 1, 512, 416, 416, 544, 544]
    - [73, 6.355]
  - - [384, 128, 1, 1024, 416, 416, 1056, 1056]
    - [73, 9.598]
  - - [384, 128, 1, 2048, 416, 416, 2080, 2080]
    - [76, 12.886]
  - - [384, 128, 1, 4096, 416, 416, 4128, 4128]
    - [78, 15.451]
  - - [384, 256, 1, 64, 416, 416, 96, 256]
    - [124, 2.125]
  - - [384, 256, 1, 128, 416, 416, 160, 256]
    - [125, 3.918]
  - - [384, 256, 1, 256, 416, 416, 288, 288]
    - [107, 6.822]
  - - [384, 256, 1, 512, 416, 416, 544, 544]
    - [96, 10.812]
  - - [384, 256, 1, 1024, 416, 416, 1056, 1056]
    - [119, 15.281]
  - - [384, 256, 1, 2048, 416, 416, 2080, 2080]
    - [94, 19.224]
  - - [384, 256, 1, 4096, 416, 416, 4128, 4128]
    - [117, 22.044]
  - - [384, 512, 1, 64, 416, 416, 96, 512]
    - [126, 4.068]
  - - [384, 512, 1, 128, 416, 416, 160, 512]
    - [113, 7.432]
  - - [384, 512, 1, 256, 416, 416, 288, 512]
    - [114, 12.663]
  - - [384, 512, 1, 512, 416, 416, 544, 544]
    - [114, 19.607]
  - - [384, 512, 1, 1024, 416, 416, 1056, 1056]
    - [111, 27.112]
  - - [384, 512, 1, 2048, 416, 416, 2080, 2080]
    - [109, 33.357]
  - - [384, 512, 1, 4096, 416, 416, 4128, 4128]
    - [113, 35.298]
  - - [384, 1024, 1, 64, 416, 416, 96, 1024]
    - [3, 7.496]
  - - [384, 1024, 1, 128, 416, 416, 160, 1024]
    - [9, 12.874]
  - - [384, 1024, 1, 256, 416, 416, 288, 1024]
    - [105, 20.265]
  - - [384, 1024, 1, 512, 416, 416, 544, 1024]
    - [131, 28.341]
  - - [384, 1024, 1, 1024, 416, 416, 1056, 1056]
    - [99, 35.373]
  - - [384, 1024, 1, 2048, 416, 416, 2080, 2080]
    - [100, 40.206]
  - - [384, 1024, 1, 4096, 416, 416, 4128, 4128]
    - [131, 41.615]
  - - [384, 2048, 1, 64, 416, 416, 96, 2048]
    - [10, 12.895]
  - - [384, 2048, 1, 128, 416, 416, 160, 2048]
    - [48, 21.339]
  - - [384, 2048, 1, 256, 416, 416, 288, 2048]
    - [31, 33.311]
  - - [384, 2048, 1, 512, 416, 416, 544, 2048]
    - [36, 46.42]
  - - [384, 2048, 1, 1024, 416, 416, 1056, 2048]
    - [35, 57.216]
  - - [384, 2048, 1, 2048, 416, 416, 2080, 2080]
    - [59, 61.62]
  - - [384, 2048, 1, 4096, 416, 416, 4128, 4128]
    - [35, 67.934]
  - - [384, 4096, 1, 64, 416, 416, 96, 4096]
    - [10, 20.949]
  - - [384, 4096, 1, 128, 416, 416, 160, 4096]
    - [38, 31.847]
  - - [384, 4096, 1, 256, 416, 416, 288, 4096]
    - [16, 43.72]
  - - [384, 4096, 1, 512, 416, 416, 544, 4096]
    - [45, 54.588]
  - - [384, 4096, 1, 1024, 416, 416, 1056, 4096]
    - [54, 58.816]
  - - [384, 4096, 1, 2048, 416, 416, 2080, 4096]
    - [47, 63.884]
  - - [384, 4096, 1, 4096, 416, 416, 4128, 4128]
    - [27, 66.742]
  - - [768, 64, 1, 64, 800, 800, 96, 96]
    - [68, 1.115]
  - - [768, 64, 1, 128, 800, 800, 160, 160]
    - [68, 2.109]
  - - [768, 64, 1, 256, 800, 800, 288, 288]
    - [73, 3.824]
  - - [768, 64, 1, 512, 800, 800, 544, 544]
    - [66, 6.406]
  - - [768, 64, 1, 1024, 800, 800, 1056, 1056]
    - [68, 9.625]
  - - [768, 64, 1, 2048, 800, 800, 2080, 2080]
    - [68, 12.868]
  - - [768, 64, 1, 4096, 800, 800, 4128, 4128]
    - [76, 15.464]
  - - [768, 128, 1, 64, 800, 800, 96, 128]
    - [124, 2.131]
  - - [768, 128, 1, 128, 800, 800, 160, 160]
    - [96, 3.932]
  - - [768, 128, 1, 256, 800, 800, 288, 288]
    - [130, 6.759]
  - - [768, 128, 1, 512, 800, 800, 544, 544]
    - [120, 10.809]
  - - [768, 128, 1, 1024, 800, 800, 1056, 1056]
    - [117, 15.272]
  - - [768, 128, 1, 2048, 800, 800, 2080, 2080]
    - [117, 19.238]
  - - [768, 128, 1, 4096, 800, 800, 4128, 4128]
    - [117, 22.058]
  - - [768, 256, 1, 64, 800, 800, 96, 256]
    - [97, 4.106]
  - - [768, 256, 1, 128, 800, 800, 160, 256]
    - [90, 7.464]
  - - [768, 256, 1, 256, 800, 800, 288, 288]
    - [106, 12.715]
  - - [768, 256, 1, 512, 800, 800, 544, 544]
    - [114, 19.558]
  - - [768, 256, 1, 1024, 800, 800, 1056, 1056]
    - [89, 26.883]
  - - [768, 256, 1, 2048, 800, 800, 2080, 2080]
    - [87, 33.029]
  - - [768, 256, 1, 4096, 800, 800, 4128, 4128]
    - [92, 35.215]
  - - [768, 512, 1, 64, 800, 800, 96, 512]
    - [125, 7.538]
  - - [768, 512, 1, 128, 800, 800, 160, 512]
    - [9, 12.958]
  - - [768, 512, 1, 256, 800, 800, 288, 512]
    - [127, 20.265]
  - - [768, 512, 1, 512, 800, 800, 544, 544]
    - [131, 28.383]
  - - [768, 512, 1, 1024, 800, 800, 1056, 1056]
    - [131, 35.429]
  - - [768, 512, 1, 2048, 800, 800, 2080, 2080]
    - [99, 40.026]
  - - [768, 512, 1, 4096, 800, 800, 4128, 4128]
    - [104, 41.582]
  - - [768, 1024, 1, 64, 800, 800, 96, 1024]
    - [13, 12.86]
  - - [768, 1024, 1, 128, 800, 800, 160, 1024]
    - [49, 21.355]
  - - [768, 1024, 1, 256, 800, 800, 288, 1024]
    - [52, 33.519]
  - - [768, 1024, 1, 512, 800, 800, 544, 1024]
    - [61, 46.499]
  - - [768, 1024, 1, 1024, 800, 800, 1056, 1056]
    - [53, 57.299]
  - - [768, 1024, 1, 2048, 800, 800, 2080, 2080]
    - [61, 62.06]
  - - [768, 1024, 1, 4096, 800, 800, 4128, 4128]
    - [61, 67.939]
  - - [768, 2048, 1, 64, 800, 800, 96, 2048]
    - [13, 20.871]
  - - [768, 2048, 1, 128, 800, 800, 160, 2048]
    - [56, 31.444]
  - - [768, 2048, 1, 256, 800, 800, 288, 2048]
    - [33, 43.816]
  - - [768, 2048, 1, 512, 800, 800, 544, 2048]
    - [45, 54.238]
  - - [768, 2048, 1, 1024, 800, 800, 1056, 2048]
    - [24, 59.117]
  - - [768, 2048, 1, 2048, 800, 800, 2080, 2080]
    - [34, 64.171]
  - - [768, 2048, 1, 4096, 800, 800, 4128, 4128]
    - [47, 66.486]
  - - [768, 4096, 1, 64, 800, 800, 96, 4096]
    - [9, 30.753]
  - - [768, 4096, 1, 128, 800, 800, 160, 4096]
    - [39, 45.852]
  - - [768, 4096, 1, 256, 800, 800, 288, 4096]
    - [39, 59.255]
  - - [768, 4096, 1, 512, 800, 800, 544, 4096]
    - [39, 66.009]
  - - [768, 4096, 1, 1024, 800, 800, 1056, 4096]
    - [44, 73.096]
  - - [768, 4096, 1, 2048, 800, 800, 2080, 4096]
    - [32, 76.628]
  - - [768, 4096, 1, 4096, 800, 800, 4128, 4128]
    - [14, 79.474]
  - - [1536, 64, 1, 64, 1568, 1568, 96, 96]
    - [76, 2.121]
  - - [1536, 64, 1, 128, 1568, 1568, 160, 160]
    - [96, 3.923]
  - - [1536, 64, 1, 256, 1568, 1568, 288, 288]
    - [125, 6.823]
  - - [1536, 64, 1, 512, 1568, 1568, 544, 544]
    - [97, 10.787]
  - - [1536, 64, 1, 1024, 1568, 1568, 1056, 1056]
    - [120, 15.269]
  - - [1536, 64, 1, 2048, 1568, 1568, 2080, 2080]
    - [118, 19.173]
  - - [1536, 64, 1, 4096, 1568, 1568, 4128, 4128]
    - [117, 22.047]
  - - [1536, 128, 1, 64, 1568, 1568, 96, 128]
    - [10, 4.105]
  - - [1536, 128, 1, 128, 1568, 1568, 160, 160]
    - [4, 7.411]
  - - [1536, 128, 1, 256, 1568, 1568, 288, 288]
    - [119, 12.663]
  - - [1536, 128, 1, 512, 1568, 1568, 544, 544]
    - [119, 19.461]
  - - [1536, 128, 1, 1024, 1568, 1568, 1056, 1056]
    - [96, 26.535]
  - - [1536, 128, 1, 2048, 1568, 1568, 2080, 2080]
    - [96, 32.416]
  - - [1536, 128, 1, 4096, 1568, 1568, 4128, 4128]
    - [95, 36.474]
  - - [1536, 256, 1, 64, 1568, 1568, 96, 256]
    - [107, 7.511]
  - - [1536, 256, 1, 128, 1568, 1568, 160, 256]
    - [98, 12.88]
  - - [1536, 256, 1, 256, 1568, 1568, 288, 288]
    - [101, 20.255]
  - - [1536, 256, 1, 512, 1568, 1568, 544, 544]
    - [102, 28.243]
  - - [1536, 256, 1, 1024, 1568, 1568, 1056, 1056]
    - [101, 35.17]
  - - [1536, 256, 1, 2048, 1568, 1568, 2080, 2080]
    - [122, 39.99]
  - - [1536, 256, 1, 4096, 1568, 1568, 4128, 4128]
    - [122, 41.591]
  - - [1536, 512, 1, 64, 1568, 1568, 96, 512]
    - [3, 12.852]
  - - [1536, 512, 1, 128, 1568, 1568, 160, 512]
    - [26, 21.008]
  - - [1536, 512, 1, 256, 1568, 1568, 288, 512]
    - [57, 32.547]
  - - [1536, 512, 1, 512, 1568, 1568, 544, 544]
    - [48, 45.759]
  - - [1536, 512, 1, 1024, 1568, 1568, 1056, 1056]
    - [62, 57.02]
  - - [1536, 512, 1, 2048, 1568, 1568, 2080, 2080]
    - [29, 61.373]
  - - [1536, 512, 1, 4096, 1568, 1568, 4128, 4128]
    - [58, 67.327]
  - - [1536, 1024, 1, 64, 1568, 1568, 96, 1024]
    - [3, 20.914]
  - - [1536, 1024, 1, 128, 1568, 1568, 160, 1024]
    - [38, 31.408]
  - - [1536, 1024, 1, 256, 1568, 1568, 288, 1024]
    - [45, 43.895]
  - - [1536, 1024, 1, 512, 1568, 1568, 544, 1024]
    - [55, 54.975]
  - - [1536, 1024, 1, 1024, 1568, 1568, 1056, 1056]
    - [45, 59.547]
  - - [1536, 1024, 1, 2048, 1568, 1568, 2080, 2080]
    - [60, 64.179]
  - - [1536, 1024, 1, 4096, 1568, 1568, 4128, 4128]
    - [51, 67.214]
  - - [1536, 2048, 1, 64, 1568, 1568, 96, 2048]
    - [9, 30.931]
  - - [1536, 2048, 1, 128, 1568, 1568, 160, 2048]
    - [16, 45.597]
  - - [1536, 2048, 1, 256, 1568, 1568, 288, 2048]
    - [15, 59.249]
  - - [1536, 2048, 1, 512, 1568, 1568, 544, 2048]
    - [37, 67.334]
  - - [1536, 2048, 1, 1024, 1568, 1568, 1056, 2048]
    - [55, 72.765]
  - - [1536, 2048, 1, 2048, 1568, 1568, 2080, 2080]
    - [25, 77.612]
  - - [1536, 2048, 1, 4096, 1568, 1568, 4128, 4128]
    - [15, 79.788]
  - - [1536, 4096, 1, 64, 1568, 1568, 96, 4096]
    - [45, 40.615]
  - - [1536, 4096, 1, 128, 1568, 1568, 160, 4096]
    - [43, 57.553]
  - - [1536, 4096, 1, 256, 1568, 1568, 288, 4096]
    - [46, 69.072]
  - - [1536, 4096, 1, 512, 1568, 1568, 544, 4096]
    - [15, 78.292]
  - - [1536, 4096, 1, 1024, 1568, 1568, 1056, 4096]
    - [45, 84.454]
  - - [1536, 4096, 1, 2048, 1568, 1568, 2080, 4096]
    - [15, 87.955]
  - - [1536, 4096, 1, 4096, 1568, 1568, 4128, 4128]
    - [38, 88.844]
  - - [3072, 64, 1, 64, 3104, 3104, 96, 96]
    - [93, 4.095]
  - - [3072, 64, 1, 128, 3104, 3104, 160, 160]
    - [4, 7.41]
  - - [3072, 64, 1, 256, 3104, 3104, 288, 288]
    - [119, 12.644]
  - - [3072, 64, 1, 512, 3104, 3104, 544, 544]
    - [120, 19.484]
  - - [3072, 64, 1, 1024, 3104, 3104, 1056, 1056]
    - [119, 26.556]
  - - [3072, 64, 1, 2048, 3104, 3104, 2080, 2080]
    - [116, 32.464]
  - - [3072, 64, 1, 4096, 3104, 3104, 4128, 4128]
    - [115, 36.341]
  - - [3072, 128, 1, 64, 3104, 3104, 96, 128]
    - [96, 7.511]
  - - [3072, 128, 1, 128, 3104, 3104, 160, 160]
    - [101, 12.933]
  - - [3072, 128, 1, 256, 3104, 3104, 288, 288]
    - [122, 20.205]
  - - [3072, 128, 1, 512, 3104, 3104, 544, 544]
    - [101, 28.079]
  - - [3072, 128, 1, 1024, 3104, 3104, 1056, 1056]
    - [99, 35.05]
  - - [3072, 128, 1, 2048, 3104, 3104, 2080, 2080]
    - [99, 39.888]
  - - [3072, 128, 1, 4096, 3104, 3104, 4128, 4128]
    - [122, 41.582]
  - - [3072, 256, 1, 64, 3104, 3104, 96, 256]
    - [3, 12.878]
  - - [3072, 256, 1, 128, 3104, 3104, 160, 256]
    - [40, 21.344]
  - - [3072, 256, 1, 256, 3104, 3104, 288, 288]
    - [18, 33.129]
  - - [3072, 256, 1, 512, 3104, 3104, 544, 544]
    - [28, 45.784]
  - - [3072, 256, 1, 1024, 3104, 3104, 1056, 1056]
    - [17, 56.958]
  - - [3072, 256, 1, 2048, 3104, 3104, 2080, 2080]
    - [30, 61.91]
  - - [3072, 256, 1, 4096, 3104, 3104, 4128, 4128]
    - [53, 67.793]
  - - [3072, 512, 1, 64, 3104, 3104, 96, 512]
    - [3, 21.021]
  - - [3072, 512, 1, 128, 3104, 3104, 160, 512]
    - [33, 31.228]
  - - [3072, 512, 1, 256, 3104, 3104, 288, 512]
    - [24, 43.554]
  - - [3072, 512, 1, 512, 3104, 3104, 544, 544]
    - [33, 54.294]
  - - [3072, 512, 1, 1024, 3104, 3104, 1056, 1056]
    - [33, 58.973]
  - - [3072, 512, 1, 2048, 3104, 3104, 2080, 2080]
    - [50, 63.881]
  - - [3072, 512, 1, 4096, 3104, 3104, 4128, 4128]
    - [60, 67.326]
  - - [3072, 1024, 1, 64, 3104, 3104, 96, 1024]
    - [9, 30.855]
  - - [3072, 1024, 1, 128, 3104, 3104, 160, 1024]
    - [15, 45.749]
  - - [3072, 1024, 1, 256, 3104, 3104, 288, 1024]
    - [46, 59.373]
  - - [3072, 1024, 1, 512, 3104, 3104, 544, 1024]
    - [55, 66.461]
  - - [3072, 1024, 1, 1024, 3104, 3104, 1056, 1056]
    - [46, 73.532]
  - - [3072, 1024, 1, 2048, 3104, 3104, 2080, 2080]
    - [23, 77.484]
  - - [3072, 1024, 1, 4096, 3104, 3104, 4128, 4128]
    - [15, 79.741]
  - - [3072, 2048, 1, 64, 3104, 3104, 96, 2048]
    - [9, 40.592]
  - - [3072, 2048, 1, 128, 3104, 3104, 160, 2048]
    - [42, 57.697]
  - - [3072, 2048, 1, 256, 3104, 3104, 288, 2048]
    - [16, 67.268]
  - - [3072, 2048, 1, 512, 3104, 3104, 544, 2048]
    - [38, 78.206]
  - - [3072, 2048, 1, 1024, 3104, 3104, 1056, 2048]
    - [46, 84.343]
  - - [3072, 2048, 1, 2048, 3104, 3104, 2080, 2080]
    - [16, 88.104]
  - - [3072, 2048, 1, 4096, 3104, 3104, 4128, 4128]
    - [38, 88.91]
  - - [3072, 4096, 1, 64, 3104, 3104, 96, 4096]
    - [63, 50.482]
  - - [3072, 4096, 1, 128, 3104, 3104, 160, 4096]
    - [39, 63.49]
  - - [3072, 4096, 1, 256, 3104, 3104, 288, 4096]
    - [38, 75.633]
  - - [3072, 4096, 1, 512, 3104, 3104, 544, 4096]
    - [38, 83.664]
  - - [3072, 4096, 1, 1024, 3104, 3104, 1056, 4096]
    - [46, 88.318]
  - - [3072, 4096, 1, 2048, 3104, 3104, 2080, 4096]
    - [15, 90.041]
  - - [3072, 4096, 1, 4096, 3104, 3104, 4128, 4128]
    - [38, 91.497]
- null
- null
- DeviceEfficiency
