library/src/blas3/Tensile/Logic/asm_full/navi32/navi32_Cijk_Alik_Bljk_BBS_BH.yaml
- {MinimumRequiredVersion: 4.35.0}
- navi32
- gfx1101
- [Device 73f0]
    SolutionIndex: 0
    SolutionNameMin: Cijk_Alik_Bljk_BBS_BH_MT32x32x16_MI16x16x16x1_SN_1LDSB0_AMAS0_GRVW4_IU1_LPA8_LPB8_SIA1_SU0_SUS0_SVW1_TT1_16_VW1_WGM4
    SolutionIndex: 1
    SolutionNameMin: Cijk_Alik_Bljk_BBS_BH_MT32x32x16_MI16x16x16x1_SN_1LDSB0_AMAS0_GRVW8_IU1_LPA8_LPB8_SIA1_SU0_SUS0_SVW1_TT1_16_VW1_WGM4
    SolutionIndex: 2
    SolutionNameMin: Cijk_Alik_Bljk_BBS_BH_MT32x32x16_MI16x16x16x1_SN_1LDSB0_AMAS0_GRVW4_IU1_LPA8_LPB8_SIA1_SU0_SUS0_SVW1_TT1_16_VW1_WGM8
    SolutionIndex: 3
    SolutionNameMin: Cijk_Alik_Bljk_BBS_BH_MT64x64x16_MI16x16x16x1_SN_1LDSB0_AMAS3_GRVW4_IU1_LPA8_LPB8_SIA1_SU0_SUS0_SVW2_TT2_32_VW2_WGM4
    SolutionIndex: 4
    SolutionNameMin: Cijk_Alik_Bljk_BBS_BH_MT64x64x16_MI16x16x16x1_SN_1LDSB0_AMAS0_GRVW8_IU1_LPA8_LPB8_SIA1_SU0_SUS0_SVW1_TT2_32_VW1_WGM4
    SolutionIndex: 5
    SolutionNameMin: Cijk_Alik_Bljk_BBS_BH_MT64x64x16_MI16x16x16x1_SN_1LDSB0_AMAS3_GRVW8_IU1_LPA8_LPB8_SIA1_SU0_SUS0_SVW2_TT2_32_VW2_WGM4
    SolutionIndex: 6
    SolutionNameMin: Cijk_Alik_Bljk_BBS_BH_MT64x64x16_MI16x16x16x1_SN_1LDSB1_AMAS3_GRVW2_IU1_LPA8_LPB8_SIA2_SU0_SUS0_SVW2_TT2_32_VW2_WGM4
    SolutionIndex: 7
    SolutionNameMin: Cijk_Alik_Bljk_BBS_BH_MT64x64x16_MI16x16x16x1_SN_1LDSB1_AMAS3_GRVW8_IU1_LPA8_LPB8_SIA2_SU0_SUS0_SVW2_TT2_32_VW2_WGM4
    SolutionIndex: 8
    SolutionNameMin: Cijk_Alik_Bljk_BBS_BH_MT64x64x16_MI16x16x16x1_SN_1LDSB0_AMAS3_GRVW4_IU1_LPA8_LPB8_SIA1_SU32_SUS128_SVW2_TT2_32_VW2_WGM4
    SolutionIndex: 9
    SolutionNameMin: Cijk_Alik_Bljk_BBS_BH_MT64x64x16_MI16x16x16x1_SN_1LDSB1_AMAS3_GRVW8_IU1_LPA8_LPB8_SIA2_SU32_SUS128_SVW2_TT2_32_VW2_WGM4
    SolutionIndex: 10
    SolutionNameMin: Cijk_Alik_Bljk_BBS_BH_MT64x64x16_MI16x16x16x1_SN_1LDSB0_AMAS3_GRVW8_IU1_LPA8_LPB8_SIA3_SU32_SUS128_SVW2_TT2_32_VW2_WGM4
    SolutionIndex: 11
    SolutionNameMin: Cijk_Alik_Bljk_BBS_BH_MT64x64x16_MI16x16x16x1_SN_1LDSB0_AMAS3_GRVW8_IU1_LPA8_LPB8_SIA1_SU32_SUS256_SVW2_TT2_32_VW2_WGM4
    SolutionIndex: 12
    SolutionNameMin: Cijk_Alik_Bljk_BBS_BH_MT64x64x16_MI16x16x16x1_SN_1LDSB1_AMAS3_GRVW8_IU1_LPA8_LPB8_SIA2_SU32_SUS256_SVW2_TT2_32_VW2_WGM4
    SolutionIndex: 13
    SolutionNameMin: Cijk_Alik_Bljk_BBS_BH_MT64x64x16_MI16x16x16x1_SN_1LDSB0_AMAS0_GRVW4_IU1_LPA8_LPB8_SIA1_SU0_SUS0_SVW1_TT2_32_VW1_WGM8
    SolutionIndex: 14
    SolutionNameMin: Cijk_Alik_Bljk_BBS_BH_MT64x64x16_MI16x16x16x1_SN_1LDSB0_AMAS3_GRVW4_IU1_LPA8_LPB8_SIA1_SU0_SUS0_SVW2_TT2_32_VW2_WGM8
    SolutionIndex: 15
    SolutionNameMin: Cijk_Alik_Bljk_BBS_BH_MT64x64x16_MI16x16x16x1_SN_1LDSB0_AMAS0_GRVW8_IU1_LPA8_LPB8_SIA1_SU0_SUS0_SVW1_TT2_32_VW1_WGM8
    SolutionIndex: 16
    SolutionNameMin: Cijk_Alik_Bljk_BBS_BH_MT64x64x16_MI16x16x16x1_SN_1LDSB0_AMAS3_GRVW8_IU1_LPA8_LPB8_SIA1_SU0_SUS0_SVW2_TT2_32_VW2_WGM8
    SolutionIndex: 17
    SolutionNameMin: Cijk_Alik_Bljk_BBS_BH_MT64x64x16_MI16x16x16x1_SN_1LDSB1_AMAS3_GRVW2_IU1_LPA8_LPB8_SIA2_SU0_SUS0_SVW2_TT2_32_VW2_WGM8
    SolutionIndex: 18
    SolutionNameMin: Cijk_Alik_Bljk_BBS_BH_MT64x64x16_MI16x16x16x1_SN_1LDSB1_AMAS3_GRVW4_IU1_LPA8_LPB8_SIA2_SU0_SUS0_SVW2_TT2_32_VW2_WGM8
    SolutionIndex: 19
    SolutionNameMin: Cijk_Alik_Bljk_BBS_BH_MT64x64x16_MI16x16x16x1_SN_1LDSB1_AMAS0_GRVW8_IU1_LPA8_LPB8_SIA2_SU0_SUS0_SVW1_TT2_32_VW1_WGM8
    SolutionIndex: 20
    SolutionNameMin: Cijk_Alik_Bljk_BBS_BH_MT64x64x16_MI16x16x16x1_SN_1LDSB1_AMAS3_GRVW8_IU1_LPA8_LPB8_SIA2_SU0_SUS0_SVW2_TT2_32_VW2_WGM8
    SolutionIndex: 21
    SolutionNameMin: Cijk_Alik_Bljk_BBS_BH_MT64x64x16_MI16x16x16x1_SN_1LDSB0_AMAS3_GRVW4_IU1_LPA8_LPB8_SIA3_SU0_SUS0_SVW2_TT2_32_VW2_WGM8
    SolutionIndex: 22
    SolutionNameMin: Cijk_Alik_Bljk_BBS_BH_MT64x64x16_MI16x16x16x1_SN_1LDSB0_AMAS0_GRVW8_IU1_LPA8_LPB8_SIA1_SU32_SUS128_SVW1_TT2_32_VW1_WGM8
    SolutionIndex: 23
    SolutionNameMin: Cijk_Alik_Bljk_BBS_BH_MT64x64x16_MI16x16x16x1_SN_1LDSB1_AMAS3_GRVW4_IU1_LPA8_LPB8_SIA2_SU32_SUS256_SVW2_TT2_32_VW2_WGM8
    SolutionIndex: 24
    SolutionNameMin: Cijk_Alik_Bljk_BBS_BH_MT64x64x16_MI16x16x16x1_SN_1LDSB1_AMAS3_GRVW8_IU1_LPA8_LPB8_SIA2_SU32_SUS256_SVW2_TT2_32_VW2_WGM8
    SolutionIndex: 25
    SolutionNameMin: Cijk_Alik_Bljk_BBS_BH_MT128x128x16_MI16x16x16x1_SN_1LDSB0_AMAS3_GRVW2_IU1_LPA8_LPB0_SIA1_SU0_SUS0_SVW2_TT4_64_VW2_WGM4
    SolutionIndex: 26
    SolutionNameMin: Cijk_Alik_Bljk_BBS_BH_MT128x128x16_MI16x16x16x1_SN_1LDSB0_AMAS3_GRVW2_IU1_LPA8_LPB8_SIA3_SU0_SUS0_SVW2_TT4_64_VW2_WGM4
    SolutionIndex: 27
    SolutionNameMin: Cijk_Alik_Bljk_BBS_BH_MT128x128x16_MI16x16x16x1_SN_1LDSB0_AMAS3_GRVW4_IU1_LPA8_LPB8_SIA3_SU0_SUS0_SVW2_TT4_64_VW2_WGM4
    SolutionIndex: 28
    SolutionNameMin: Cijk_Alik_Bljk_BBS_BH_MT128x128x16_MI16x16x16x1_SN_1LDSB0_AMAS3_GRVW8_IU1_LPA8_LPB8_SIA3_SU0_SUS0_SVW2_TT4_64_VW2_WGM4
    SolutionIndex: 29
    SolutionNameMin: Cijk_Alik_Bljk_BBS_BH_MT128x128x16_MI16x16x16x1_SN_1LDSB0_AMAS3_GRVW2_IU1_LPA8_LPB0_SIA1_SU32_SUS128_SVW2_TT4_64_VW2_WGM4
    SolutionIndex: 30
    SolutionNameMin: Cijk_Alik_Bljk_BBS_BH_MT128x128x16_MI16x16x16x1_SN_1LDSB0_AMAS3_GRVW8_IU1_LPA8_LPB8_SIA3_SU32_SUS128_SVW2_TT4_64_VW2_WGM4
    SolutionIndex: 31
    SolutionNameMin: Cijk_Alik_Bljk_BBS_BH_MT128x128x16_MI16x16x16x1_SN_1LDSB0_AMAS3_GRVW8_IU1_LPA8_LPB8_SIA3_SU32_SUS256_SVW2_TT4_64_VW2_WGM4
    SolutionIndex: 32
    SolutionNameMin: Cijk_Alik_Bljk_BBS_BH_MT128x128x16_MI16x16x16x1_SN_1LDSB0_AMAS3_GRVW2_IU1_LPA8_LPB8_SIA1_SU0_SUS0_SVW2_TT4_64_VW2_WGM8
    SolutionIndex: 33
    SolutionNameMin: Cijk_Alik_Bljk_BBS_BH_MT128x128x16_MI16x16x16x1_SN_1LDSB0_AMAS3_GRVW4_IU1_LPA8_LPB8_SIA1_SU0_SUS0_SVW2_TT4_64_VW2_WGM8
    SolutionIndex: 34
    SolutionNameMin: Cijk_Alik_Bljk_BBS_BH_MT128x128x16_MI16x16x16x1_SN_1LDSB0_AMAS3_GRVW8_IU1_LPA8_LPB8_SIA1_SU0_SUS0_SVW2_TT4_64_VW2_WGM8
    SolutionIndex: 35
    SolutionNameMin: Cijk_Alik_Bljk_BBS_BH_MT128x128x16_MI16x16x16x1_SN_1LDSB0_AMAS3_GRVW2_IU1_LPA8_LPB0_SIA3_SU0_SUS0_SVW2_TT4_64_VW2_WGM8
    SolutionIndex: 36
    SolutionNameMin: Cijk_Alik_Bljk_BBS_BH_MT128x128x16_MI16x16x16x1_SN_1LDSB0_AMAS3_GRVW2_IU1_LPA8_LPB8_SIA3_SU0_SUS0_SVW2_TT4_64_VW2_WGM8
    SolutionIndex: 37
    SolutionNameMin: Cijk_Alik_Bljk_BBS_BH_MT128x128x16_MI16x16x16x1_SN_1LDSB0_AMAS3_GRVW4_IU1_LPA8_LPB8_SIA3_SU0_SUS0_SVW2_TT4_64_VW2_WGM8
    SolutionIndex: 38
    SolutionNameMin: Cijk_Alik_Bljk_BBS_BH_MT128x128x16_MI16x16x16x1_SN_1LDSB0_AMAS3_GRVW8_IU1_LPA8_LPB8_SIA3_SU0_SUS0_SVW2_TT4_64_VW2_WGM8
    SolutionIndex: 39
    SolutionNameMin: Cijk_Alik_Bljk_BBS_BH_MT128x128x16_MI16x16x16x1_SN_1LDSB1_AMAS3_GRVW2_IU1_LPA8_LPB8_SIA2_SU32_SUS128_SVW2_TT4_64_VW2_WGM8
    SolutionIndex: 40
    SolutionNameMin: Cijk_Alik_Bljk_BBS_BH_MT128x128x16_MI16x16x16x1_SN_1LDSB0_AMAS0_GRVW2_IU1_LPA0_LPB8_SIA1_SU32_SUS256_SVW1_TT4_64_VW1_WGM8
    SolutionIndex: 41
    SolutionNameMin: Cijk_Alik_Bljk_BBS_BH_MT128x128x16_MI16x16x16x1_SN_1LDSB0_AMAS3_GRVW2_IU1_LPA8_LPB0_SIA1_SU32_SUS256_SVW2_TT4_64_VW2_WGM8
    SolutionIndex: 42
    SolutionNameMin: Cijk_Alik_Bljk_BBS_BH_MT128x128x16_MI16x16x16x1_SN_1LDSB0_AMAS3_GRVW8_IU1_LPA8_LPB8_SIA3_SU32_SUS256_SVW2_TT4_64_VW2_WGM8
    SolutionIndex: 43
    SolutionNameMin: Cijk_Alik_Bljk_BBS_BH_MT32x32x32_MI16x16x16x1_SN_1LDSB0_AMAS0_GRVW4_IU1_LPA8_LPB8_SIA1_SU0_SUS0_SVW1_TT1_16_VW1_WGM4
    SolutionIndex: 44
    SolutionNameMin: Cijk_Alik_Bljk_BBS_BH_MT32x32x32_MI16x16x16x1_SN_1LDSB0_AMAS0_GRVW8_IU1_LPA8_LPB8_SIA1_SU0_SUS0_SVW1_TT1_16_VW1_WGM4
    SolutionIndex: 45
    SolutionNameMin: Cijk_Alik_Bljk_BBS_BH_MT32x32x32_MI16x16x16x1_SN_1LDSB1_AMAS0_GRVW2_IU2_LPA8_LPB8_SIA2_SU0_SUS0_SVW1_TT1_16_VW1_WGM4
    SolutionIndex: 46
    SolutionNameMin: Cijk_Alik_Bljk_BBS_BH_MT32x32x32_MI16x16x16x1_SN_1LDSB1_AMAS0_GRVW4_IU2_LPA8_LPB8_SIA2_SU0_SUS0_SVW1_TT1_16_VW1_WGM4
    SolutionIndex: 47
    SolutionNameMin: Cijk_Alik_Bljk_BBS_BH_MT32x32x32_MI16x16x16x1_SN_1LDSB1_AMAS0_GRVW8_IU2_LPA8_LPB8_SIA2_SU0_SUS0_SVW1_TT1_16_VW1_WGM4
    SolutionIndex: 48
    SolutionNameMin: Cijk_Alik_Bljk_BBS_BH_MT32x32x32_MI16x16x16x1_SN_1LDSB0_AMAS0_GRVW4_IU1_LPA8_LPB8_SIA3_SU0_SUS0_SVW1_TT1_16_VW1_WGM4
    SolutionIndex: 49
    SolutionNameMin: Cijk_Alik_Bljk_BBS_BH_MT32x32x32_MI16x16x16x1_SN_1LDSB0_AMAS0_GRVW8_IU1_LPA8_LPB8_SIA3_SU0_SUS0_SVW1_TT1_16_VW1_WGM4
    SolutionIndex: 50
    SolutionNameMin: Cijk_Alik_Bljk_BBS_BH_MT32x32x32_MI16x16x16x1_SN_1LDSB1_AMAS0_GRVW2_IU2_LPA8_LPB8_SIA2_SU32_SUS128_SVW1_TT1_16_VW1_WGM4
    SolutionIndex: 51
    SolutionNameMin: Cijk_Alik_Bljk_BBS_BH_MT32x32x32_MI16x16x16x1_SN_1LDSB1_AMAS0_GRVW4_IU2_LPA8_LPB8_SIA2_SU32_SUS128_SVW1_TT1_16_VW1_WGM4
    SolutionIndex: 52
    SolutionNameMin: Cijk_Alik_Bljk_BBS_BH_MT32x32x32_MI16x16x16x1_SN_1LDSB1_AMAS0_GRVW8_IU2_LPA8_LPB8_SIA2_SU32_SUS128_SVW1_TT1_16_VW1_WGM4
    SolutionIndex: 53
    SolutionNameMin: Cijk_Alik_Bljk_BBS_BH_MT32x32x32_MI16x16x16x1_SN_1LDSB0_AMAS0_GRVW8_IU1_LPA8_LPB8_SIA3_SU32_SUS128_SVW1_TT1_16_VW1_WGM4
    SolutionIndex: 54
    SolutionNameMin: Cijk_Alik_Bljk_BBS_BH_MT32x32x32_MI16x16x16x1_SN_1LDSB0_AMAS0_GRVW4_IU1_LPA8_LPB8_SIA1_SU32_SUS256_SVW1_TT1_16_VW1_WGM4
    SolutionIndex: 55
    SolutionNameMin: Cijk_Alik_Bljk_BBS_BH_MT32x32x32_MI16x16x16x1_SN_1LDSB0_AMAS0_GRVW8_IU1_LPA8_LPB8_SIA1_SU32_SUS256_SVW1_TT1_16_VW1_WGM4
    SolutionIndex: 56
    SolutionNameMin: Cijk_Alik_Bljk_BBS_BH_MT32x32x32_MI16x16x16x1_SN_1LDSB1_AMAS0_GRVW4_IU2_LPA8_LPB8_SIA2_SU32_SUS256_SVW1_TT1_16_VW1_WGM4
    SolutionIndex: 57
    SolutionNameMin: Cijk_Alik_Bljk_BBS_BH_MT32x32x32_MI16x16x16x1_SN_1LDSB1_AMAS0_GRVW8_IU2_LPA8_LPB8_SIA2_SU32_SUS256_SVW1_TT1_16_VW1_WGM4
    SolutionIndex: 58
    SolutionNameMin: Cijk_Alik_Bljk_BBS_BH_MT32x32x32_MI16x16x16x1_SN_1LDSB0_AMAS0_GRVW8_IU1_LPA8_LPB8_SIA3_SU32_SUS256_SVW1_TT1_16_VW1_WGM4
    SolutionIndex: 59
    SolutionNameMin: Cijk_Alik_Bljk_BBS_BH_MT32x32x32_MI16x16x16x1_SN_1LDSB0_AMAS0_GRVW4_IU1_LPA8_LPB8_SIA1_SU0_SUS0_SVW1_TT1_16_VW1_WGM8
    SolutionIndex: 60
    SolutionNameMin: Cijk_Alik_Bljk_BBS_BH_MT32x32x32_MI16x16x16x1_SN_1LDSB0_AMAS0_GRVW8_IU1_LPA8_LPB8_SIA1_SU0_SUS0_SVW1_TT1_16_VW1_WGM8
    SolutionIndex: 61
    SolutionNameMin: Cijk_Alik_Bljk_BBS_BH_MT32x32x32_MI16x16x16x1_SN_1LDSB1_AMAS0_GRVW4_IU2_LPA8_LPB8_SIA2_SU0_SUS0_SVW1_TT1_16_VW1_WGM8
    SolutionIndex: 62
    SolutionNameMin: Cijk_Alik_Bljk_BBS_BH_MT32x32x32_MI16x16x16x1_SN_1LDSB1_AMAS0_GRVW8_IU2_LPA8_LPB8_SIA2_SU0_SUS0_SVW1_TT1_16_VW1_WGM8
    SolutionIndex: 63
    SolutionNameMin: Cijk_Alik_Bljk_BBS_BH_MT32x32x32_MI16x16x16x1_SN_1LDSB0_AMAS0_GRVW4_IU1_LPA8_LPB8_SIA3_SU0_SUS0_SVW1_TT1_16_VW1_WGM8
    SolutionIndex: 64
    SolutionNameMin: Cijk_Alik_Bljk_BBS_BH_MT32x32x32_MI16x16x16x1_SN_1LDSB0_AMAS0_GRVW4_IU1_LPA8_LPB8_SIA1_SU32_SUS128_SVW1_TT1_16_VW1_WGM8
    SolutionIndex: 65
    SolutionNameMin: Cijk_Alik_Bljk_BBS_BH_MT32x32x32_MI16x16x16x1_SN_1LDSB1_AMAS0_GRVW2_IU2_LPA8_LPB8_SIA2_SU32_SUS128_SVW1_TT1_16_VW1_WGM8
    SolutionIndex: 66
    SolutionNameMin: Cijk_Alik_Bljk_BBS_BH_MT32x32x32_MI16x16x16x1_SN_1LDSB1_AMAS0_GRVW4_IU2_LPA8_LPB8_SIA2_SU32_SUS128_SVW1_TT1_16_VW1_WGM8
    SolutionIndex: 67
    SolutionNameMin: Cijk_Alik_Bljk_BBS_BH_MT32x32x32_MI16x16x16x1_SN_1LDSB1_AMAS0_GRVW8_IU2_LPA8_LPB8_SIA2_SU32_SUS128_SVW1_TT1_16_VW1_WGM8
    SolutionIndex: 68
    SolutionNameMin: Cijk_Alik_Bljk_BBS_BH_MT32x32x32_MI16x16x16x1_SN_1LDSB1_AMAS0_GRVW2_IU2_LPA8_LPB8_SIA2_SU32_SUS256_SVW1_TT1_16_VW1_WGM8
    SolutionIndex: 69
    SolutionNameMin: Cijk_Alik_Bljk_BBS_BH_MT32x32x32_MI16x16x16x1_SN_1LDSB1_AMAS0_GRVW4_IU2_LPA8_LPB8_SIA2_SU32_SUS256_SVW1_TT1_16_VW1_WGM8
    SolutionIndex: 70
    SolutionNameMin: Cijk_Alik_Bljk_BBS_BH_MT32x32x32_MI16x16x16x1_SN_1LDSB1_AMAS0_GRVW8_IU2_LPA8_LPB8_SIA2_SU32_SUS256_SVW1_TT1_16_VW1_WGM8
    SolutionIndex: 71
    SolutionNameMin: Cijk_Alik_Bljk_BBS_BH_MT64x64x32_MI16x16x16x1_SN_1LDSB0_AMAS3_GRVW4_IU1_LPA8_LPB8_SIA1_SU0_SUS0_SVW2_TT2_32_VW2_WGM4
    SolutionIndex: 72
    SolutionNameMin: Cijk_Alik_Bljk_BBS_BH_MT64x64x32_MI16x16x16x1_SN_1LDSB0_AMAS0_GRVW8_IU1_LPA8_LPB8_SIA1_SU0_SUS0_SVW1_TT2_32_VW1_WGM4
    SolutionIndex: 73
    SolutionNameMin: Cijk_Alik_Bljk_BBS_BH_MT64x64x32_MI16x16x16x1_SN_1LDSB0_AMAS3_GRVW8_IU1_LPA8_LPB8_SIA1_SU0_SUS0_SVW2_TT2_32_VW2_WGM4
    SolutionIndex: 74
    SolutionNameMin: Cijk_Alik_Bljk_BBS_BH_MT64x64x32_MI16x16x16x1_SN_1LDSB1_AMAS0_GRVW2_IU2_LPA8_LPB8_SIA2_SU0_SUS0_SVW1_TT2_32_VW1_WGM4
    SolutionIndex: 75
    SolutionNameMin: Cijk_Alik_Bljk_BBS_BH_MT64x64x32_MI16x16x16x1_SN_1LDSB1_AMAS3_GRVW4_IU2_LPA8_LPB8_SIA2_SU0_SUS0_SVW2_TT2_32_VW2_WGM4
    SolutionIndex: 76
    SolutionNameMin: Cijk_Alik_Bljk_BBS_BH_MT64x64x32_MI16x16x16x1_SN_1LDSB1_AMAS0_GRVW8_IU2_LPA8_LPB8_SIA2_SU0_SUS0_SVW1_TT2_32_VW1_WGM4
    SolutionIndex: 77
    SolutionNameMin: Cijk_Alik_Bljk_BBS_BH_MT64x64x32_MI16x16x16x1_SN_1LDSB1_AMAS3_GRVW8_IU2_LPA8_LPB8_SIA2_SU0_SUS0_SVW2_TT2_32_VW2_WGM4
    SolutionIndex: 78
    SolutionNameMin: Cijk_Alik_Bljk_BBS_BH_MT64x64x32_MI16x16x16x1_SN_1LDSB0_AMAS3_GRVW8_IU1_LPA8_LPB8_SIA1_SU32_SUS128_SVW2_TT2_32_VW2_WGM4
    SolutionIndex: 79
    SolutionNameMin: Cijk_Alik_Bljk_BBS_BH_MT64x64x32_MI16x16x16x1_SN_1LDSB1_AMAS3_GRVW4_IU2_LPA8_LPB8_SIA2_SU32_SUS128_SVW2_TT2_32_VW2_WGM4
    SolutionIndex: 80
    SolutionNameMin: Cijk_Alik_Bljk_BBS_BH_MT64x64x32_MI16x16x16x1_SN_1LDSB0_AMAS0_GRVW8_IU1_LPA8_LPB8_SIA1_SU32_SUS256_SVW1_TT2_32_VW1_WGM4
    SolutionIndex: 81
    SolutionNameMin: Cijk_Alik_Bljk_BBS_BH_MT64x64x32_MI16x16x16x1_SN_1LDSB0_AMAS3_GRVW8_IU1_LPA8_LPB8_SIA1_SU32_SUS256_SVW2_TT2_32_VW2_WGM4
    SolutionIndex: 82
    SolutionNameMin: Cijk_Alik_Bljk_BBS_BH_MT64x64x32_MI16x16x16x1_SN_1LDSB1_AMAS3_GRVW2_IU2_LPA8_LPB8_SIA2_SU32_SUS256_SVW2_TT2_32_VW2_WGM4
    SolutionIndex: 83
    SolutionNameMin: Cijk_Alik_Bljk_BBS_BH_MT64x64x32_MI16x16x16x1_SN_1LDSB1_AMAS3_GRVW8_IU2_LPA8_LPB8_SIA2_SU32_SUS256_SVW2_TT2_32_VW2_WGM4
    SolutionIndex: 84
    SolutionNameMin: Cijk_Alik_Bljk_BBS_BH_MT64x64x32_MI16x16x16x1_SN_1LDSB0_AMAS3_GRVW2_IU1_LPA8_LPB8_SIA1_SU0_SUS0_SVW2_TT2_32_VW2_WGM8
    SolutionIndex: 85
    SolutionNameMin: Cijk_Alik_Bljk_BBS_BH_MT64x64x32_MI16x16x16x1_SN_1LDSB0_AMAS3_GRVW4_IU1_LPA8_LPB8_SIA1_SU0_SUS0_SVW2_TT2_32_VW2_WGM8
    SolutionIndex: 86
    SolutionNameMin: Cijk_Alik_Bljk_BBS_BH_MT64x64x32_MI16x16x16x1_SN_1LDSB0_AMAS0_GRVW8_IU1_LPA8_LPB8_SIA1_SU0_SUS0_SVW1_TT2_32_VW1_WGM8
    SolutionIndex: 87
    SolutionNameMin: Cijk_Alik_Bljk_BBS_BH_MT64x64x32_MI16x16x16x1_SN_1LDSB0_AMAS3_GRVW8_IU1_LPA8_LPB8_SIA1_SU0_SUS0_SVW2_TT2_32_VW2_WGM8
    SolutionIndex: 88
    SolutionNameMin: Cijk_Alik_Bljk_BBS_BH_MT64x64x32_MI16x16x16x1_SN_1LDSB1_AMAS0_GRVW4_IU2_LPA8_LPB8_SIA2_SU0_SUS0_SVW1_TT2_32_VW1_WGM8
    SolutionIndex: 89
    SolutionNameMin: Cijk_Alik_Bljk_BBS_BH_MT64x64x32_MI16x16x16x1_SN_1LDSB1_AMAS3_GRVW4_IU2_LPA8_LPB8_SIA2_SU0_SUS0_SVW2_TT2_32_VW2_WGM8
    SolutionIndex: 90
    SolutionNameMin: Cijk_Alik_Bljk_BBS_BH_MT64x64x32_MI16x16x16x1_SN_1LDSB1_AMAS3_GRVW8_IU2_LPA8_LPB8_SIA2_SU0_SUS0_SVW2_TT2_32_VW2_WGM8
    SolutionIndex: 91
    SolutionNameMin: Cijk_Alik_Bljk_BBS_BH_MT64x64x32_MI16x16x16x1_SN_1LDSB0_AMAS3_GRVW4_IU1_LPA8_LPB8_SIA1_SU32_SUS128_SVW2_TT2_32_VW2_WGM8
    SolutionIndex: 92
    SolutionNameMin: Cijk_Alik_Bljk_BBS_BH_MT64x64x32_MI16x16x16x1_SN_1LDSB0_AMAS0_GRVW8_IU1_LPA8_LPB8_SIA1_SU32_SUS128_SVW1_TT2_32_VW1_WGM8
    SolutionIndex: 93
    SolutionNameMin: Cijk_Alik_Bljk_BBS_BH_MT64x64x32_MI16x16x16x1_SN_1LDSB1_AMAS3_GRVW8_IU2_LPA8_LPB8_SIA2_SU32_SUS128_SVW2_TT2_32_VW2_WGM8
    SolutionIndex: 94
    SolutionNameMin: Cijk_Alik_Bljk_BBS_BH_MT64x64x32_MI16x16x16x1_SN_1LDSB1_AMAS3_GRVW4_IU2_LPA8_LPB8_SIA2_SU32_SUS256_SVW2_TT2_32_VW2_WGM8
    SolutionIndex: 95
    SolutionNameMin: Cijk_Alik_Bljk_BBS_BH_MT64x64x32_MI16x16x16x1_SN_1LDSB1_AMAS0_GRVW8_IU2_LPA8_LPB8_SIA2_SU32_SUS256_SVW1_TT2_32_VW1_WGM8
    SolutionIndex: 96
    SolutionNameMin: Cijk_Alik_Bljk_BBS_BH_MT64x64x32_MI16x16x16x1_SN_1LDSB1_AMAS3_GRVW8_IU2_LPA8_LPB8_SIA2_SU32_SUS256_SVW2_TT2_32_VW2_WGM8
- - - [64, 64, 1, 64, 96, 96, 96, 96]
    - [2, 0.091]
  - - [64, 64, 1, 128, 96, 96, 160, 160]
    - [61, 0.176]
  - - [64, 64, 1, 256, 96, 96, 288, 288]
    - [47, 0.326]
  - - [64, 64, 1, 512, 96, 96, 544, 544]
    - [69, 0.555]
  - - [64, 64, 1, 1024, 96, 96, 1056, 1056]
    - [61, 0.881]
  - - [64, 64, 1, 2048, 96, 96, 2080, 2080]
    - [46, 1.224]
  - - [64, 64, 1, 4096, 96, 96, 4128, 4128]
    - [46, 1.523]
  - - [64, 128, 1, 64, 96, 96, 96, 96]
    - [48, 0.187]
  - - [64, 128, 1, 128, 96, 96, 160, 160]
    - [66, 0.357]
  - - [64, 128, 1, 256, 96, 96, 288, 288]
    - [50, 0.654]
  - - [64, 128, 1, 512, 96, 96, 544, 544]
    - [56, 1.135]
  - - [64, 128, 1, 1024, 96, 96, 1056, 1056]
    - [51, 1.777]
  - - [64, 128, 1, 2048, 96, 96, 2080, 2080]
    - [69, 2.456]
  - - [64, 128, 1, 4096, 96, 96, 4128, 4128]
    - [56, 3.047]
  - - [64, 256, 1, 64, 96, 96, 96, 96]
    - [43, 0.374]
  - - [64, 256, 1, 128, 96, 96, 160, 160]
    - [61, 0.723]
  - - [64, 256, 1, 256, 96, 96, 288, 288]
    - [67, 1.327]
  - - [64, 256, 1, 512, 96, 96, 544, 544]
    - [70, 2.274]
  - - [64, 256, 1, 1024, 96, 96, 1056, 1056]
    - [56, 3.571]
  - - [64, 256, 1, 2048, 96, 96, 2080, 2080]
    - [61, 4.899]
  - - [64, 256, 1, 4096, 96, 96, 4128, 4128]
    - [46, 6.08]
  - - [64, 512, 1, 64, 96, 96, 96, 96]
    - [49, 0.74]
  - - [64, 512, 1, 128, 96, 96, 160, 160]
    - [56, 1.416]
  - - [64, 512, 1, 256, 96, 96, 288, 288]
    - [46, 2.629]
  - - [64, 512, 1, 512, 96, 96, 544, 544]
    - [51, 4.481]
  - - [64, 512, 1, 1024, 96, 96, 1056, 1056]
    - [46, 7.089]
  - - [64, 512, 1, 2048, 96, 96, 2080, 2080]
    - [46, 9.787]
  - - [64, 512, 1, 4096, 96, 96, 4128, 4128]
    - [46, 12.097]
  - - [64, 1024, 1, 64, 96, 96, 96, 96]
    - [0, 1.441]
  - - [64, 1024, 1, 128, 96, 96, 160, 160]
    - [47, 2.738]
  - - [64, 1024, 1, 256, 96, 96, 288, 288]
    - [62, 5.029]
  - - [64, 1024, 1, 512, 96, 96, 544, 544]
    - [57, 8.458]
  - - [64, 1024, 1, 1024, 96, 96, 1056, 1056]
    - [47, 13.003]
  - - [64, 1024, 1, 2048, 96, 96, 2080, 2080]
    - [70, 17.603]
  - - [64, 1024, 1, 4096, 96, 96, 4128, 4128]
    - [47, 21.454]
  - - [64, 2048, 1, 64, 96, 96, 96, 96]
    - [69, 2.764]
  - - [64, 2048, 1, 128, 96, 96, 160, 160]
    - [57, 5.137]
  - - [64, 2048, 1, 256, 96, 96, 288, 288]
    - [60, 8.947]
  - - [64, 2048, 1, 512, 96, 96, 544, 544]
    - [96, 14.436]
  - - [64, 2048, 1, 1024, 96, 96, 1056, 1056]
    - [90, 20.887]
  - - [64, 2048, 1, 2048, 96, 96, 2080, 2080]
    - [75, 26.896]
  - - [64, 2048, 1, 4096, 96, 96, 4128, 4128]
    - [94, 31.388]
  - - [64, 4096, 1, 64, 96, 96, 96, 96]
    - [95, 5.083]
  - - [64, 4096, 1, 128, 96, 96, 160, 160]
    - [76, 9.278]
  - - [64, 4096, 1, 256, 96, 96, 288, 288]
    - [72, 15.95]
  - - [64, 4096, 1, 512, 96, 96, 544, 544]
    - [81, 24.995]
  - - [64, 4096, 1, 1024, 96, 96, 1056, 1056]
    - [78, 35.104]
  - - [64, 4096, 1, 2048, 96, 96, 2080, 2080]
    - [92, 43.976]
  - - [64, 4096, 1, 4096, 96, 96, 4128, 4128]
    - [80, 48.739]
  - - [128, 64, 1, 64, 160, 160, 96, 96]
    - [62, 0.185]
  - - [128, 64, 1, 128, 160, 160, 160, 160]
    - [52, 0.355]
  - - [128, 64, 1, 256, 160, 160, 288, 288]
    - [61, 0.657]
  - - [128, 64, 1, 512, 160, 160, 544, 544]
    - [67, 1.125]
  - - [128, 64, 1, 1024, 160, 160, 1056, 1056]
    - [51, 1.77]
  - - [128, 64, 1, 2048, 160, 160, 2080, 2080]
    - [46, 2.451]
  - - [128, 64, 1, 4096, 160, 160, 4128, 4128]
    - [46, 3.043]
  - - [128, 128, 1, 64, 160, 160, 96, 96]
    - [1, 0.372]
  - - [128, 128, 1, 128, 160, 160, 160, 160]
    - [47, 0.713]
  - - [128, 128, 1, 256, 160, 160, 288, 288]
    - [47, 1.326]
  - - [128, 128, 1, 512, 160, 160, 544, 544]
    - [56, 2.282]
  - - [128, 128, 1, 1024, 160, 160, 1056, 1056]
    - [69, 3.582]
  - - [128, 128, 1, 2048, 160, 160, 2080, 2080]
    - [69, 4.978]
  - - [128, 128, 1, 4096, 160, 160, 4128, 4128]
    - [69, 6.156]
  - - [128, 256, 1, 64, 160, 160, 96, 96]
    - [55, 0.741]
  - - [128, 256, 1, 128, 160, 160, 160, 160]
    - [64, 1.412]
  - - [128, 256, 1, 256, 160, 160, 288, 288]
    - [67, 2.64]
  - - [128, 256, 1, 512, 160, 160, 544, 544]
    - [69, 4.546]
  - - [128, 256, 1, 1024, 160, 160, 1056, 1056]
    - [45, 7.098]
  - - [128, 256, 1, 2048, 160, 160, 2080, 2080]
    - [61, 9.848]
  - - [128, 256, 1, 4096, 160, 160, 4128, 4128]
    - [61, 12.193]
  - - [128, 512, 1, 64, 160, 160, 96, 96]
    - [63, 1.45]
  - - [128, 512, 1, 128, 160, 160, 160, 160]
    - [61, 2.758]
  - - [128, 512, 1, 256, 160, 160, 288, 288]
    - [70, 4.989]
  - - [128, 512, 1, 512, 160, 160, 544, 544]
    - [62, 8.5]
  - - [128, 512, 1, 1024, 160, 160, 1056, 1056]
    - [62, 13.026]
  - - [128, 512, 1, 2048, 160, 160, 2080, 2080]
    - [62, 17.651]
  - - [128, 512, 1, 4096, 160, 160, 4128, 4128]
    - [62, 21.466]
  - - [128, 1024, 1, 64, 160, 160, 96, 96]
    - [70, 2.776]
  - - [128, 1024, 1, 128, 160, 160, 160, 160]
    - [57, 5.16]
  - - [128, 1024, 1, 256, 160, 160, 288, 288]
    - [61, 9.026]
  - - [128, 1024, 1, 512, 160, 160, 544, 544]
    - [79, 14.452]
  - - [128, 1024, 1, 1024, 160, 160, 1056, 1056]
    - [75, 20.933]
  - - [128, 1024, 1, 2048, 160, 160, 2080, 2080]
    - [89, 26.918]
  - - [128, 1024, 1, 4096, 160, 160, 4128, 4128]
    - [75, 31.413]
  - - [128, 2048, 1, 64, 160, 160, 96, 96]
    - [7, 5.102]
  - - [128, 2048, 1, 128, 160, 160, 160, 160]
    - [11, 9.32]
  - - [128, 2048, 1, 256, 160, 160, 288, 288]
    - [3, 15.971]
  - - [128, 2048, 1, 512, 160, 160, 544, 544]
    - [4, 25.231]
  - - [128, 2048, 1, 1024, 160, 160, 1056, 1056]
    - [87, 35.26]
  - - [128, 2048, 1, 2048, 160, 160, 2080, 2080]
    - [72, 44.453]
  - - [128, 2048, 1, 4096, 160, 160, 4128, 4128]
    - [73, 47.37]
  - - [128, 4096, 1, 64, 160, 160, 96, 96]
    - [20, 9.102]
  - - [128, 4096, 1, 128, 160, 160, 160, 160]
    - [20, 16.103]
  - - [128, 4096, 1, 256, 160, 160, 288, 288]
    - [90, 26.237]
  - - [128, 4096, 1, 512, 160, 160, 544, 544]
    - [75, 38.128]
  - - [128, 4096, 1, 1024, 160, 160, 1056, 1056]
    - [16, 49.855]
  - - [128, 4096, 1, 2048, 160, 160, 2080, 2080]
    - [16, 58.789]
  - - [128, 4096, 1, 4096, 160, 160, 4128, 4128]
    - [5, 62.295]
  - - [256, 64, 1, 64, 288, 288, 96, 96]
    - [61, 0.376]
  - - [256, 64, 1, 128, 288, 288, 160, 160]
    - [61, 0.724]
  - - [256, 64, 1, 256, 288, 288, 288, 288]
    - [56, 1.318]
  - - [256, 64, 1, 512, 288, 288, 544, 544]
    - [61, 2.268]
  - - [256, 64, 1, 1024, 288, 288, 1056, 1056]
    - [68, 3.544]
  - - [256, 64, 1, 2048, 288, 288, 2080, 2080]
    - [69, 4.914]
  - - [256, 64, 1, 4096, 288, 288, 4128, 4128]
    - [61, 6.085]
  - - [256, 128, 1, 64, 288, 288, 96, 96]
    - [54, 0.743]
  - - [256, 128, 1, 128, 288, 288, 160, 160]
    - [47, 1.422]
  - - [256, 128, 1, 256, 288, 288, 288, 288]
    - [61, 2.618]
  - - [256, 128, 1, 512, 288, 288, 544, 544]
    - [56, 4.525]
  - - [256, 128, 1, 1024, 288, 288, 1056, 1056]
    - [61, 7.136]
  - - [256, 128, 1, 2048, 288, 288, 2080, 2080]
    - [61, 9.905]
  - - [256, 128, 1, 4096, 288, 288, 4128, 4128]
    - [61, 12.326]
  - - [256, 256, 1, 64, 288, 288, 96, 96]
    - [51, 1.439]
  - - [256, 256, 1, 128, 288, 288, 160, 160]
    - [61, 2.762]
  - - [256, 256, 1, 256, 288, 288, 288, 288]
    - [62, 5.01]
  - - [256, 256, 1, 512, 288, 288, 544, 544]
    - [62, 8.533]
  - - [256, 256, 1, 1024, 288, 288, 1056, 1056]
    - [47, 13.023]
  - - [256, 256, 1, 2048, 288, 288, 2080, 2080]
    - [62, 17.656]
  - - [256, 256, 1, 4096, 288, 288, 4128, 4128]
    - [62, 21.429]
  - - [256, 512, 1, 64, 288, 288, 96, 96]
    - [52, 2.784]
  - - [256, 512, 1, 128, 288, 288, 160, 160]
    - [62, 5.181]
  - - [256, 512, 1, 256, 288, 288, 288, 288]
    - [47, 8.974]
  - - [256, 512, 1, 512, 288, 288, 544, 544]
    - [90, 14.419]
  - - [256, 512, 1, 1024, 288, 288, 1056, 1056]
    - [96, 20.901]
  - - [256, 512, 1, 2048, 288, 288, 2080, 2080]
    - [89, 26.923]
  - - [256, 512, 1, 4096, 288, 288, 4128, 4128]
    - [75, 31.407]
  - - [256, 1024, 1, 64, 288, 288, 96, 96]
    - [24, 5.09]
  - - [256, 1024, 1, 128, 288, 288, 160, 160]
    - [15, 9.385]
  - - [256, 1024, 1, 256, 288, 288, 288, 288]
    - [16, 16.084]
  - - [256, 1024, 1, 512, 288, 288, 544, 544]
    - [15, 25.211]
  - - [256, 1024, 1, 1024, 288, 288, 1056, 1056]
    - [72, 35.386]
  - - [256, 1024, 1, 2048, 288, 288, 2080, 2080]
    - [73, 44.154]
  - - [256, 1024, 1, 4096, 288, 288, 4128, 4128]
    - [73, 47.371]
  - - [256, 2048, 1, 64, 288, 288, 96, 96]
    - [9, 9.048]
  - - [256, 2048, 1, 128, 288, 288, 160, 160]
    - [23, 16.096]
  - - [256, 2048, 1, 256, 288, 288, 288, 288]
    - [96, 26.178]
  - - [256, 2048, 1, 512, 288, 288, 544, 544]
    - [90, 38.224]
  - - [256, 2048, 1, 1024, 288, 288, 1056, 1056]
    - [16, 49.918]
  - - [256, 2048, 1, 2048, 288, 288, 2080, 2080]
    - [5, 58.807]
  - - [256, 2048, 1, 4096, 288, 288, 4128, 4128]
    - [22, 62.289]
  - - [256, 4096, 1, 64, 288, 288, 96, 96]
    - [18, 14.397]
  - - [256, 4096, 1, 128, 288, 288, 160, 160]
    - [96, 24.34]
  - - [256, 4096, 1, 256, 288, 288, 288, 288]
    - [74, 37.71]
  - - [256, 4096, 1, 512, 288, 288, 544, 544]
    - [88, 51.482]
  - - [256, 4096, 1, 1024, 288, 288, 1056, 1056]
    - [90, 61.834]
  - - [256, 4096, 1, 2048, 288, 288, 2080, 2080]
    - [83, 65.194]
  - - [256, 4096, 1, 4096, 288, 288, 4128, 4128]
    - [91, 69.806]
  - - [384, 64, 1, 64, 416, 416, 96, 96]
    - [58, 0.559]
  - - [384, 64, 1, 128, 416, 416, 160, 160]
    - [47, 1.064]
  - - [384, 64, 1, 256, 416, 416, 288, 288]
    - [69, 1.969]
  - - [384, 64, 1, 512, 416, 416, 544, 544]
    - [56, 3.39]
  - - [384, 64, 1, 1024, 416, 416, 1056, 1056]
    - [51, 5.319]
  - - [384, 64, 1, 2048, 416, 416, 2080, 2080]
    - [69, 7.346]
  - - [384, 64, 1, 4096, 416, 416, 4128, 4128]
    - [66, 9.092]
  - - [384, 128, 1, 64, 416, 416, 96, 96]
    - [65, 1.106]
  - - [384, 128, 1, 128, 416, 416, 160, 160]
    - [62, 2.13]
  - - [384, 128, 1, 256, 416, 416, 288, 288]
    - [45, 3.885]
  - - [384, 128, 1, 512, 416, 416, 544, 544]
    - [61, 6.722]
  - - [384, 128, 1, 1024, 416, 416, 1056, 1056]
    - [56, 10.528]
  - - [384, 128, 1, 2048, 416, 416, 2080, 2080]
    - [46, 14.591]
  - - [384, 128, 1, 4096, 416, 416, 4128, 4128]
    - [46, 18.136]
  - - [384, 256, 1, 64, 416, 416, 96, 96]
    - [53, 2.114]
  - - [384, 256, 1, 128, 416, 416, 160, 160]
    - [47, 3.984]
  - - [384, 256, 1, 256, 416, 416, 288, 288]
    - [46, 7.072]
  - - [384, 256, 1, 512, 416, 416, 544, 544]
    - [43, 11.696]
  - - [384, 256, 1, 1024, 416, 416, 1056, 1056]
    - [59, 17.372]
  - - [384, 256, 1, 2048, 416, 416, 2080, 2080]
    - [59, 22.806]
  - - [384, 256, 1, 4096, 416, 416, 4128, 4128]
    - [59, 27.024]
  - - [384, 512, 1, 64, 416, 416, 96, 96]
    - [11, 4.063]
  - - [384, 512, 1, 128, 416, 416, 160, 160]
    - [75, 7.566]
  - - [384, 512, 1, 256, 416, 416, 288, 288]
    - [90, 13.359]
  - - [384, 512, 1, 512, 416, 416, 544, 544]
    - [89, 21.507]
  - - [384, 512, 1, 1024, 416, 416, 1056, 1056]
    - [77, 31.11]
  - - [384, 512, 1, 2048, 416, 416, 2080, 2080]
    - [90, 39.988]
  - - [384, 512, 1, 4096, 416, 416, 4128, 4128]
    - [90, 46.545]
  - - [384, 1024, 1, 64, 416, 416, 96, 96]
    - [17, 7.211]
  - - [384, 1024, 1, 128, 416, 416, 160, 160]
    - [20, 12.985]
  - - [384, 1024, 1, 256, 416, 416, 288, 288]
    - [16, 21.681]
  - - [384, 1024, 1, 512, 416, 416, 544, 544]
    - [13, 32.67]
  - - [384, 1024, 1, 1024, 416, 416, 1056, 1056]
    - [87, 43.945]
  - - [384, 1024, 1, 2048, 416, 416, 2080, 2080]
    - [87, 53.096]
  - - [384, 1024, 1, 4096, 416, 416, 4128, 4128]
    - [87, 57.051]
  - - [384, 2048, 1, 64, 416, 416, 96, 96]
    - [89, 11.828]
  - - [384, 2048, 1, 128, 416, 416, 160, 160]
    - [12, 20.63]
  - - [384, 2048, 1, 256, 416, 416, 288, 288]
    - [21, 31.894]
  - - [384, 2048, 1, 512, 416, 416, 544, 544]
    - [90, 45.9]
  - - [384, 2048, 1, 1024, 416, 416, 1056, 1056]
    - [83, 56.825]
  - - [384, 2048, 1, 2048, 416, 416, 2080, 2080]
    - [25, 62.221]
  - - [384, 2048, 1, 4096, 416, 416, 4128, 4128]
    - [25, 68.618]
  - - [384, 4096, 1, 64, 416, 416, 96, 96]
    - [9, 18.142]
  - - [384, 4096, 1, 128, 416, 416, 160, 160]
    - [18, 30.273]
  - - [384, 4096, 1, 256, 416, 416, 288, 288]
    - [85, 43.17]
  - - [384, 4096, 1, 512, 416, 416, 544, 544]
    - [89, 58.025]
  - - [384, 4096, 1, 1024, 416, 416, 1056, 1056]
    - [85, 65.097]
  - - [384, 4096, 1, 2048, 416, 416, 2080, 2080]
    - [87, 72.799]
  - - [384, 4096, 1, 4096, 416, 416, 4128, 4128]
    - [87, 77.06]
  - - [768, 64, 1, 64, 800, 800, 96, 96]
    - [67, 1.108]
  - - [768, 64, 1, 128, 800, 800, 160, 160]
    - [47, 2.11]
  - - [768, 64, 1, 256, 800, 800, 288, 288]
    - [46, 3.869]
  - - [768, 64, 1, 512, 800, 800, 544, 544]
    - [51, 6.675]
  - - [768, 64, 1, 1024, 800, 800, 1056, 1056]
    - [61, 10.465]
  - - [768, 64, 1, 2048, 800, 800, 2080, 2080]
    - [66, 14.369]
  - - [768, 64, 1, 4096, 800, 800, 4128, 4128]
    - [66, 17.785]
  - - [768, 128, 1, 64, 800, 800, 96, 96]
    - [44, 2.121]
  - - [768, 128, 1, 128, 800, 800, 160, 160]
    - [61, 4.003]
  - - [768, 128, 1, 256, 800, 800, 288, 288]
    - [62, 7.182]
  - - [768, 128, 1, 512, 800, 800, 544, 544]
    - [62, 11.721]
  - - [768, 128, 1, 1024, 800, 800, 1056, 1056]
    - [70, 17.127]
  - - [768, 128, 1, 2048, 800, 800, 2080, 2080]
    - [47, 22.47]
  - - [768, 128, 1, 4096, 800, 800, 4128, 4128]
    - [62, 26.609]
  - - [768, 256, 1, 64, 800, 800, 96, 96]
    - [77, 4.029]
  - - [768, 256, 1, 128, 800, 800, 160, 160]
    - [83, 7.595]
  - - [768, 256, 1, 256, 800, 800, 288, 288]
    - [75, 13.34]
  - - [768, 256, 1, 512, 800, 800, 544, 544]
    - [89, 21.51]
  - - [768, 256, 1, 1024, 800, 800, 1056, 1056]
    - [77, 31.095]
  - - [768, 256, 1, 2048, 800, 800, 2080, 2080]
    - [89, 39.881]
  - - [768, 256, 1, 4096, 800, 800, 4128, 4128]
    - [77, 46.489]
  - - [768, 512, 1, 64, 800, 800, 96, 96]
    - [20, 7.229]
  - - [768, 512, 1, 128, 800, 800, 160, 160]
    - [18, 13.011]
  - - [768, 512, 1, 256, 800, 800, 288, 288]
    - [14, 21.724]
  - - [768, 512, 1, 512, 800, 800, 544, 544]
    - [16, 32.774]
  - - [768, 512, 1, 1024, 800, 800, 1056, 1056]
    - [16, 43.987]
  - - [768, 512, 1, 2048, 800, 800, 2080, 2080]
    - [87, 53.091]
  - - [768, 512, 1, 4096, 800, 800, 4128, 4128]
    - [73, 56.999]
  - - [768, 1024, 1, 64, 800, 800, 96, 96]
    - [96, 11.818]
  - - [768, 1024, 1, 128, 800, 800, 160, 160]
    - [20, 20.585]
  - - [768, 1024, 1, 256, 800, 800, 288, 288]
    - [74, 32.341]
  - - [768, 1024, 1, 512, 800, 800, 544, 544]
    - [90, 45.711]
  - - [768, 1024, 1, 1024, 800, 800, 1056, 1056]
    - [93, 56.736]
  - - [768, 1024, 1, 2048, 800, 800, 2080, 2080]
    - [25, 62.027]
  - - [768, 1024, 1, 4096, 800, 800, 4128, 4128]
    - [25, 68.494]
  - - [768, 2048, 1, 64, 800, 800, 96, 96]
    - [90, 18.138]
  - - [768, 2048, 1, 128, 800, 800, 160, 160]
    - [20, 30.029]
  - - [768, 2048, 1, 256, 800, 800, 288, 288]
    - [71, 42.997]
  - - [768, 2048, 1, 512, 800, 800, 544, 544]
    - [88, 57.968]
  - - [768, 2048, 1, 1024, 800, 800, 1056, 1056]
    - [85, 65.066]
  - - [768, 2048, 1, 2048, 800, 800, 2080, 2080]
    - [87, 72.779]
  - - [768, 2048, 1, 4096, 800, 800, 4128, 4128]
    - [86, 77.179]
  - - [768, 4096, 1, 64, 800, 800, 96, 96]
    - [38, 24.79]
  - - [768, 4096, 1, 128, 800, 800, 160, 160]
    - [42, 38.428]
  - - [768, 4096, 1, 256, 800, 800, 288, 288]
    - [30, 53.208]
  - - [768, 4096, 1, 512, 800, 800, 544, 544]
    - [84, 61.091]
  - - [768, 4096, 1, 1024, 800, 800, 1056, 1056]
    - [31, 72.249]
  - - [768, 4096, 1, 2048, 800, 800, 2080, 2080]
    - [38, 77.547]
  - - [768, 4096, 1, 4096, 800, 800, 4128, 4128]
    - [37, 79.296]
  - - [1536, 64, 1, 64, 1568, 1568, 96, 96]
    - [49, 2.118]
  - - [1536, 64, 1, 128, 1568, 1568, 160, 160]
    - [47, 3.977]
  - - [1536, 64, 1, 256, 1568, 1568, 288, 288]
    - [62, 7.121]
  - - [1536, 64, 1, 512, 1568, 1568, 544, 544]
    - [47, 11.63]
  - - [1536, 64, 1, 1024, 1568, 1568, 1056, 1056]
    - [47, 17.201]
  - - [1536, 64, 1, 2048, 1568, 1568, 2080, 2080]
    - [47, 22.485]
  - - [1536, 64, 1, 4096, 1568, 1568, 4128, 4128]
    - [67, 26.504]
  - - [1536, 128, 1, 64, 1568, 1568, 96, 96]
    - [96, 4.061]
  - - [1536, 128, 1, 128, 1568, 1568, 160, 160]
    - [96, 7.573]
  - - [1536, 128, 1, 256, 1568, 1568, 288, 288]
    - [90, 13.357]
  - - [1536, 128, 1, 512, 1568, 1568, 544, 544]
    - [90, 21.501]
  - - [1536, 128, 1, 1024, 1568, 1568, 1056, 1056]
    - [77, 31.101]
  - - [1536, 128, 1, 2048, 1568, 1568, 2080, 2080]
    - [75, 39.827]
  - - [1536, 128, 1, 4096, 1568, 1568, 4128, 4128]
    - [77, 46.501]
  - - [1536, 256, 1, 64, 1568, 1568, 96, 96]
    - [6, 7.213]
  - - [1536, 256, 1, 128, 1568, 1568, 160, 160]
    - [14, 12.974]
  - - [1536, 256, 1, 256, 1568, 1568, 288, 288]
    - [5, 21.672]
  - - [1536, 256, 1, 512, 1568, 1568, 544, 544]
    - [16, 32.386]
  - - [1536, 256, 1, 1024, 1568, 1568, 1056, 1056]
    - [87, 43.834]
  - - [1536, 256, 1, 2048, 1568, 1568, 2080, 2080]
    - [73, 53.145]
  - - [1536, 256, 1, 4096, 1568, 1568, 4128, 4128]
    - [73, 56.972]
  - - [1536, 512, 1, 64, 1568, 1568, 96, 96]
    - [90, 11.812]
  - - [1536, 512, 1, 128, 1568, 1568, 160, 160]
    - [7, 20.65]
  - - [1536, 512, 1, 256, 1568, 1568, 288, 288]
    - [82, 32.281]
  - - [1536, 512, 1, 512, 1568, 1568, 544, 544]
    - [90, 45.922]
  - - [1536, 512, 1, 1024, 1568, 1568, 1056, 1056]
    - [90, 56.825]
  - - [1536, 512, 1, 2048, 1568, 1568, 2080, 2080]
    - [41, 61.78]
  - - [1536, 512, 1, 4096, 1568, 1568, 4128, 4128]
    - [29, 68.693]
  - - [1536, 1024, 1, 64, 1568, 1568, 96, 96]
    - [77, 18.064]
  - - [1536, 1024, 1, 128, 1568, 1568, 160, 160]
    - [7, 30.162]
  - - [1536, 1024, 1, 256, 1568, 1568, 288, 288]
    - [5, 43.355]
  - - [1536, 1024, 1, 512, 1568, 1568, 544, 544]
    - [89, 58.073]
  - - [1536, 1024, 1, 1024, 1568, 1568, 1056, 1056]
    - [71, 64.884]
  - - [1536, 1024, 1, 2048, 1568, 1568, 2080, 2080]
    - [87, 72.869]
  - - [1536, 1024, 1, 4096, 1568, 1568, 4128, 4128]
    - [87, 77.126]
  - - [1536, 2048, 1, 64, 1568, 1568, 96, 96]
    - [28, 24.71]
  - - [1536, 2048, 1, 128, 1568, 1568, 160, 160]
    - [38, 38.329]
  - - [1536, 2048, 1, 256, 1568, 1568, 288, 288]
    - [38, 53.108]
  - - [1536, 2048, 1, 512, 1568, 1568, 544, 544]
    - [71, 61.076]
  - - [1536, 2048, 1, 1024, 1568, 1568, 1056, 1056]
    - [93, 71.805]
  - - [1536, 2048, 1, 2048, 1568, 1568, 2080, 2080]
    - [38, 77.768]
  - - [1536, 2048, 1, 4096, 1568, 1568, 4128, 4128]
    - [37, 79.334]
  - - [1536, 4096, 1, 64, 1568, 1568, 96, 96]
    - [28, 31.889]
  - - [1536, 4096, 1, 128, 1568, 1568, 160, 160]
    - [36, 47.094]
  - - [1536, 4096, 1, 256, 1568, 1568, 288, 288]
    - [34, 59.799]
  - - [1536, 4096, 1, 512, 1568, 1568, 544, 544]
    - [35, 70.276]
  - - [1536, 4096, 1, 1024, 1568, 1568, 1056, 1056]
    - [27, 81.801]
  - - [1536, 4096, 1, 2048, 1568, 1568, 2080, 2080]
    - [37, 87.548]
  - - [1536, 4096, 1, 4096, 1568, 1568, 4128, 4128]
    - [27, 89.477]
  - - [3072, 64, 1, 64, 3104, 3104, 96, 96]
    - [8, 4.013]
  - - [3072, 64, 1, 128, 3104, 3104, 160, 160]
    - [90, 7.609]
  - - [3072, 64, 1, 256, 3104, 3104, 288, 288]
    - [77, 13.386]
  - - [3072, 64, 1, 512, 3104, 3104, 544, 544]
    - [89, 21.524]
  - - [3072, 64, 1, 1024, 3104, 3104, 1056, 1056]
    - [89, 31.004]
  - - [3072, 64, 1, 2048, 3104, 3104, 2080, 2080]
    - [75, 39.856]
  - - [3072, 64, 1, 4096, 3104, 3104, 4128, 4128]
    - [90, 46.537]
  - - [3072, 128, 1, 64, 3104, 3104, 96, 96]
    - [7, 7.183]
  - - [3072, 128, 1, 128, 3104, 3104, 160, 160]
    - [18, 12.935]
  - - [3072, 128, 1, 256, 3104, 3104, 288, 288]
    - [5, 21.546]
  - - [3072, 128, 1, 512, 3104, 3104, 544, 544]
    - [87, 32.306]
  - - [3072, 128, 1, 1024, 3104, 3104, 1056, 1056]
    - [87, 43.934]
  - - [3072, 128, 1, 2048, 3104, 3104, 2080, 2080]
    - [87, 53.177]
  - - [3072, 128, 1, 4096, 3104, 3104, 4128, 4128]
    - [87, 57.081]
  - - [3072, 256, 1, 64, 3104, 3104, 96, 96]
    - [10, 11.775]
  - - [3072, 256, 1, 128, 3104, 3104, 160, 160]
    - [7, 20.655]
  - - [3072, 256, 1, 256, 3104, 3104, 288, 288]
    - [19, 32.354]
  - - [3072, 256, 1, 512, 3104, 3104, 544, 544]
    - [90, 45.711]
  - - [3072, 256, 1, 1024, 3104, 3104, 1056, 1056]
    - [83, 56.643]
  - - [3072, 256, 1, 2048, 3104, 3104, 2080, 2080]
    - [41, 61.6]
  - - [3072, 256, 1, 4096, 3104, 3104, 4128, 4128]
    - [25, 68.448]
  - - [3072, 512, 1, 64, 3104, 3104, 96, 96]
    - [7, 18.21]
  - - [3072, 512, 1, 128, 3104, 3104, 160, 160]
    - [18, 30.14]
  - - [3072, 512, 1, 256, 3104, 3104, 288, 288]
    - [85, 43.17]
  - - [3072, 512, 1, 512, 3104, 3104, 544, 544]
    - [89, 58.42]
  - - [3072, 512, 1, 1024, 3104, 3104, 1056, 1056]
    - [85, 64.983]
  - - [3072, 512, 1, 2048, 3104, 3104, 2080, 2080]
    - [87, 72.79]
  - - [3072, 512, 1, 4096, 3104, 3104, 4128, 4128]
    - [86, 77.19]
  - - [3072, 1024, 1, 64, 3104, 3104, 96, 96]
    - [28, 24.649]
  - - [3072, 1024, 1, 128, 3104, 3104, 160, 160]
    - [38, 38.426]
  - - [3072, 1024, 1, 256, 3104, 3104, 288, 288]
    - [28, 53.055]
  - - [3072, 1024, 1, 512, 3104, 3104, 544, 544]
    - [85, 61.106]
  - - [3072, 1024, 1, 1024, 3104, 3104, 1056, 1056]
    - [38, 71.838]
  - - [3072, 1024, 1, 2048, 3104, 3104, 2080, 2080]
    - [38, 77.422]
  - - [3072, 1024, 1, 4096, 3104, 3104, 4128, 4128]
    - [37, 79.393]
  - - [3072, 2048, 1, 64, 3104, 3104, 96, 96]
    - [42, 31.986]
  - - [3072, 2048, 1, 128, 3104, 3104, 160, 160]
    - [37, 47.286]
  - - [3072, 2048, 1, 256, 3104, 3104, 288, 288]
    - [34, 59.925]
  - - [3072, 2048, 1, 512, 3104, 3104, 544, 544]
    - [26, 68.68]
  - - [3072, 2048, 1, 1024, 3104, 3104, 1056, 1056]
    - [27, 81.861]
  - - [3072, 2048, 1, 2048, 3104, 3104, 2080, 2080]
    - [37, 87.678]
  - - [3072, 2048, 1, 4096, 3104, 3104, 4128, 4128]
    - [27, 89.858]
  - - [3072, 4096, 1, 64, 3104, 3104, 96, 96]
    - [39, 36.049]
  - - [3072, 4096, 1, 128, 3104, 3104, 160, 160]
    - [33, 50.159]
  - - [3072, 4096, 1, 256, 3104, 3104, 288, 288]
    - [34, 65.383]
  - - [3072, 4096, 1, 512, 3104, 3104, 544, 544]
    - [85, 70.995]
  - - [3072, 4096, 1, 1024, 3104, 3104, 1056, 1056]
    - [32, 83.545]
  - - [3072, 4096, 1, 2048, 3104, 3104, 2080, 2080]
    - [40, 82.198]
  - - [3072, 4096, 1, 4096, 3104, 3104, 4128, 4128]
    - [26, 82.551]
- null
- null
- DeviceEfficiency
