library/src/blas3/Tensile/Logic/asm_full/navi32/navi32_Cijk_Ailk_Bljk_I8II_BH.yaml
- {MinimumRequiredVersion: 4.35.0}
- navi32
- gfx1101
- [Device 73f0]
    SolutionIndex: 0
    SolutionNameMin: Cijk_Ailk_Bljk_I8II_BH_MT32x32x16_MI16x16x16x1_SN_1LDSB0_AMAS0_GRVW4_IU1_SIA1_SU0_SUS0_SVW1_TT1_16_VW1_WGM4
    SolutionIndex: 1
    SolutionNameMin: Cijk_Ailk_Bljk_I8II_BH_MT32x32x16_MI16x16x16x1_SN_1LDSB1_AMAS0_GRVW4_IU1_SIA2_SU0_SUS0_SVW1_TT1_16_VW1_WGM4
    SolutionIndex: 2
    SolutionNameMin: Cijk_Ailk_Bljk_I8II_BH_MT32x32x16_MI16x16x16x1_SN_1LDSB1_AMAS0_GRVW8_IU1_SIA2_SU0_SUS0_SVW1_TT1_16_VW1_WGM4
    SolutionIndex: 3
    SolutionNameMin: Cijk_Ailk_Bljk_I8II_BH_MT32x32x16_MI16x16x16x1_SN_1LDSB0_AMAS0_GRVW8_IU1_SIA3_SU0_SUS0_SVW1_TT1_16_VW1_WGM4
    SolutionIndex: 4
    SolutionNameMin: Cijk_Ailk_Bljk_I8II_BH_MT32x32x16_MI16x16x16x1_SN_1LDSB1_AMAS0_GRVW4_IU1_SIA2_SU32_SUS128_SVW1_TT1_16_VW1_WGM4
    SolutionIndex: 5
    SolutionNameMin: Cijk_Ailk_Bljk_I8II_BH_MT32x32x16_MI16x16x16x1_SN_1LDSB1_AMAS0_GRVW4_IU1_SIA2_SU0_SUS0_SVW1_TT1_16_VW1_WGM8
    SolutionIndex: 6
    SolutionNameMin: Cijk_Ailk_Bljk_I8II_BH_MT32x32x16_MI16x16x16x1_SN_1LDSB1_AMAS0_GRVW8_IU1_SIA2_SU0_SUS0_SVW1_TT1_16_VW1_WGM8
    SolutionIndex: 7
    SolutionNameMin: Cijk_Ailk_Bljk_I8II_BH_MT32x32x16_MI16x16x16x1_SN_1LDSB0_AMAS0_GRVW8_IU1_SIA3_SU0_SUS0_SVW1_TT1_16_VW1_WGM8
    SolutionIndex: 8
    SolutionNameMin: Cijk_Ailk_Bljk_I8II_BH_MT32x32x16_MI16x16x16x1_SN_1LDSB1_AMAS0_GRVW4_IU1_SIA2_SU32_SUS128_SVW1_TT1_16_VW1_WGM8
    SolutionIndex: 9
    SolutionNameMin: Cijk_Ailk_Bljk_I8II_BH_MT32x32x16_MI16x16x16x1_SN_1LDSB1_AMAS0_GRVW8_IU1_SIA2_SU32_SUS128_SVW1_TT1_16_VW1_WGM8
    SolutionIndex: 10
    SolutionNameMin: Cijk_Ailk_Bljk_I8II_BH_MT32x32x16_MI16x16x16x1_SN_1LDSB1_AMAS0_GRVW4_IU1_SIA2_SU32_SUS256_SVW1_TT1_16_VW1_WGM8
    SolutionIndex: 11
    SolutionNameMin: Cijk_Ailk_Bljk_I8II_BH_MT32x32x16_MI16x16x16x1_SN_1LDSB1_AMAS0_GRVW8_IU1_SIA2_SU32_SUS256_SVW1_TT1_16_VW1_WGM8
    SolutionIndex: 12
    SolutionNameMin: Cijk_Ailk_Bljk_I8II_BH_MT64x64x16_MI16x16x16x1_SN_1LDSB0_AMAS0_GRVW4_IU1_SIA1_SU0_SUS0_SVW1_TT2_32_VW1_WGM4
    SolutionIndex: 13
    SolutionNameMin: Cijk_Ailk_Bljk_I8II_BH_MT64x64x16_MI16x16x16x1_SN_1LDSB0_AMAS3_GRVW4_IU1_SIA1_SU0_SUS0_SVW2_TT2_32_VW2_WGM4
    SolutionIndex: 14
    SolutionNameMin: Cijk_Ailk_Bljk_I8II_BH_MT64x64x16_MI16x16x16x1_SN_1LDSB0_AMAS0_GRVW8_IU1_SIA1_SU0_SUS0_SVW1_TT2_32_VW1_WGM4
    SolutionIndex: 15
    SolutionNameMin: Cijk_Ailk_Bljk_I8II_BH_MT64x64x16_MI16x16x16x1_SN_1LDSB0_AMAS3_GRVW8_IU1_SIA1_SU0_SUS0_SVW2_TT2_32_VW2_WGM4
    SolutionIndex: 16
    SolutionNameMin: Cijk_Ailk_Bljk_I8II_BH_MT64x64x16_MI16x16x16x1_SN_1LDSB1_AMAS0_GRVW4_IU1_SIA2_SU0_SUS0_SVW1_TT2_32_VW1_WGM4
    SolutionIndex: 17
    SolutionNameMin: Cijk_Ailk_Bljk_I8II_BH_MT64x64x16_MI16x16x16x1_SN_1LDSB1_AMAS0_GRVW8_IU1_SIA2_SU0_SUS0_SVW1_TT2_32_VW1_WGM4
    SolutionIndex: 18
    SolutionNameMin: Cijk_Ailk_Bljk_I8II_BH_MT64x64x16_MI16x16x16x1_SN_1LDSB1_AMAS3_GRVW8_IU1_SIA2_SU0_SUS0_SVW2_TT2_32_VW2_WGM4
    SolutionIndex: 19
    SolutionNameMin: Cijk_Ailk_Bljk_I8II_BH_MT64x64x16_MI16x16x16x1_SN_1LDSB0_AMAS0_GRVW4_IU1_SIA1_SU32_SUS128_SVW1_TT2_32_VW1_WGM4
    SolutionIndex: 20
    SolutionNameMin: Cijk_Ailk_Bljk_I8II_BH_MT64x64x16_MI16x16x16x1_SN_1LDSB0_AMAS3_GRVW4_IU1_SIA1_SU32_SUS128_SVW2_TT2_32_VW2_WGM4
    SolutionIndex: 21
    SolutionNameMin: Cijk_Ailk_Bljk_I8II_BH_MT64x64x16_MI16x16x16x1_SN_1LDSB0_AMAS0_GRVW8_IU1_SIA1_SU32_SUS128_SVW1_TT2_32_VW1_WGM4
    SolutionIndex: 22
    SolutionNameMin: Cijk_Ailk_Bljk_I8II_BH_MT64x64x16_MI16x16x16x1_SN_1LDSB0_AMAS3_GRVW8_IU1_SIA1_SU32_SUS128_SVW2_TT2_32_VW2_WGM4
    SolutionIndex: 23
    SolutionNameMin: Cijk_Ailk_Bljk_I8II_BH_MT64x64x16_MI16x16x16x1_SN_1LDSB0_AMAS0_GRVW4_IU1_SIA1_SU32_SUS256_SVW1_TT2_32_VW1_WGM4
    SolutionIndex: 24
    SolutionNameMin: Cijk_Ailk_Bljk_I8II_BH_MT64x64x16_MI16x16x16x1_SN_1LDSB0_AMAS3_GRVW4_IU1_SIA1_SU32_SUS256_SVW2_TT2_32_VW2_WGM4
    SolutionIndex: 25
    SolutionNameMin: Cijk_Ailk_Bljk_I8II_BH_MT64x64x16_MI16x16x16x1_SN_1LDSB0_AMAS0_GRVW8_IU1_SIA1_SU32_SUS256_SVW1_TT2_32_VW1_WGM4
    SolutionIndex: 26
    SolutionNameMin: Cijk_Ailk_Bljk_I8II_BH_MT64x64x16_MI16x16x16x1_SN_1LDSB0_AMAS3_GRVW8_IU1_SIA1_SU32_SUS256_SVW2_TT2_32_VW2_WGM4
    SolutionIndex: 27
    SolutionNameMin: Cijk_Ailk_Bljk_I8II_BH_MT64x64x16_MI16x16x16x1_SN_1LDSB0_AMAS0_GRVW4_IU1_SIA1_SU0_SUS0_SVW1_TT2_32_VW1_WGM8
    SolutionIndex: 28
    SolutionNameMin: Cijk_Ailk_Bljk_I8II_BH_MT64x64x16_MI16x16x16x1_SN_1LDSB0_AMAS3_GRVW4_IU1_SIA1_SU0_SUS0_SVW2_TT2_32_VW2_WGM8
    SolutionIndex: 29
    SolutionNameMin: Cijk_Ailk_Bljk_I8II_BH_MT64x64x16_MI16x16x16x1_SN_1LDSB0_AMAS0_GRVW8_IU1_SIA1_SU0_SUS0_SVW1_TT2_32_VW1_WGM8
    SolutionIndex: 30
    SolutionNameMin: Cijk_Ailk_Bljk_I8II_BH_MT64x64x16_MI16x16x16x1_SN_1LDSB0_AMAS3_GRVW8_IU1_SIA1_SU0_SUS0_SVW2_TT2_32_VW2_WGM8
    SolutionIndex: 31
    SolutionNameMin: Cijk_Ailk_Bljk_I8II_BH_MT64x64x16_MI16x16x16x1_SN_1LDSB1_AMAS3_GRVW4_IU1_SIA2_SU0_SUS0_SVW2_TT2_32_VW2_WGM8
    SolutionIndex: 32
    SolutionNameMin: Cijk_Ailk_Bljk_I8II_BH_MT64x64x16_MI16x16x16x1_SN_1LDSB1_AMAS0_GRVW8_IU1_SIA2_SU0_SUS0_SVW1_TT2_32_VW1_WGM8
    SolutionIndex: 33
    SolutionNameMin: Cijk_Ailk_Bljk_I8II_BH_MT64x64x16_MI16x16x16x1_SN_1LDSB1_AMAS3_GRVW8_IU1_SIA2_SU0_SUS0_SVW2_TT2_32_VW2_WGM8
    SolutionIndex: 34
    SolutionNameMin: Cijk_Ailk_Bljk_I8II_BH_MT64x64x16_MI16x16x16x1_SN_1LDSB0_AMAS0_GRVW4_IU1_SIA1_SU32_SUS128_SVW1_TT2_32_VW1_WGM8
    SolutionIndex: 35
    SolutionNameMin: Cijk_Ailk_Bljk_I8II_BH_MT64x64x16_MI16x16x16x1_SN_1LDSB0_AMAS3_GRVW4_IU1_SIA1_SU32_SUS128_SVW2_TT2_32_VW2_WGM8
    SolutionIndex: 36
    SolutionNameMin: Cijk_Ailk_Bljk_I8II_BH_MT64x64x16_MI16x16x16x1_SN_1LDSB0_AMAS3_GRVW8_IU1_SIA1_SU32_SUS128_SVW2_TT2_32_VW2_WGM8
    SolutionIndex: 37
    SolutionNameMin: Cijk_Ailk_Bljk_I8II_BH_MT64x64x16_MI16x16x16x1_SN_1LDSB1_AMAS3_GRVW8_IU1_SIA2_SU32_SUS128_SVW2_TT2_32_VW2_WGM8
    SolutionIndex: 38
    SolutionNameMin: Cijk_Ailk_Bljk_I8II_BH_MT64x64x16_MI16x16x16x1_SN_1LDSB0_AMAS0_GRVW4_IU1_SIA1_SU32_SUS256_SVW1_TT2_32_VW1_WGM8
    SolutionIndex: 39
    SolutionNameMin: Cijk_Ailk_Bljk_I8II_BH_MT64x64x16_MI16x16x16x1_SN_1LDSB0_AMAS3_GRVW4_IU1_SIA1_SU32_SUS256_SVW2_TT2_32_VW2_WGM8
    SolutionIndex: 40
    SolutionNameMin: Cijk_Ailk_Bljk_I8II_BH_MT64x64x16_MI16x16x16x1_SN_1LDSB0_AMAS0_GRVW8_IU1_SIA1_SU32_SUS256_SVW1_TT2_32_VW1_WGM8
    SolutionIndex: 41
    SolutionNameMin: Cijk_Ailk_Bljk_I8II_BH_MT64x64x16_MI16x16x16x1_SN_1LDSB0_AMAS3_GRVW8_IU1_SIA1_SU32_SUS256_SVW2_TT2_32_VW2_WGM8
    SolutionIndex: 42
    SolutionNameMin: Cijk_Ailk_Bljk_I8II_BH_MT128x128x16_MI16x16x16x1_SN_1LDSB0_AMAS0_GRVW4_IU1_SIA1_SU0_SUS0_SVW1_TT4_64_VW1_WGM4
    SolutionIndex: 43
    SolutionNameMin: Cijk_Ailk_Bljk_I8II_BH_MT128x128x16_MI16x16x16x1_SN_1LDSB0_AMAS3_GRVW4_IU1_SIA1_SU0_SUS0_SVW2_TT4_64_VW2_WGM4
    SolutionIndex: 44
    SolutionNameMin: Cijk_Ailk_Bljk_I8II_BH_MT128x128x16_MI16x16x16x1_SN_1LDSB0_AMAS0_GRVW8_IU1_SIA1_SU0_SUS0_SVW1_TT4_64_VW1_WGM4
    SolutionIndex: 45
    SolutionNameMin: Cijk_Ailk_Bljk_I8II_BH_MT128x128x16_MI16x16x16x1_SN_1LDSB0_AMAS3_GRVW8_IU1_SIA1_SU0_SUS0_SVW2_TT4_64_VW2_WGM4
    SolutionIndex: 46
    SolutionNameMin: Cijk_Ailk_Bljk_I8II_BH_MT128x128x16_MI16x16x16x1_SN_1LDSB1_AMAS3_GRVW4_IU1_SIA2_SU0_SUS0_SVW2_TT4_64_VW2_WGM4
    SolutionIndex: 47
    SolutionNameMin: Cijk_Ailk_Bljk_I8II_BH_MT128x128x16_MI16x16x16x1_SN_1LDSB1_AMAS0_GRVW8_IU1_SIA2_SU0_SUS0_SVW1_TT4_64_VW1_WGM4
    SolutionIndex: 48
    SolutionNameMin: Cijk_Ailk_Bljk_I8II_BH_MT128x128x16_MI16x16x16x1_SN_1LDSB1_AMAS3_GRVW8_IU1_SIA2_SU0_SUS0_SVW2_TT4_64_VW2_WGM4
    SolutionIndex: 49
    SolutionNameMin: Cijk_Ailk_Bljk_I8II_BH_MT128x128x16_MI16x16x16x1_SN_1LDSB0_AMAS3_GRVW4_IU1_SIA1_SU32_SUS128_SVW2_TT4_64_VW2_WGM4
    SolutionIndex: 50
    SolutionNameMin: Cijk_Ailk_Bljk_I8II_BH_MT128x128x16_MI16x16x16x1_SN_1LDSB0_AMAS3_GRVW8_IU1_SIA1_SU32_SUS128_SVW2_TT4_64_VW2_WGM4
    SolutionIndex: 51
    SolutionNameMin: Cijk_Ailk_Bljk_I8II_BH_MT128x128x16_MI16x16x16x1_SN_1LDSB1_AMAS3_GRVW8_IU1_SIA2_SU32_SUS128_SVW2_TT4_64_VW2_WGM4
    SolutionIndex: 52
    SolutionNameMin: Cijk_Ailk_Bljk_I8II_BH_MT128x128x16_MI16x16x16x1_SN_1LDSB0_AMAS0_GRVW4_IU1_SIA1_SU32_SUS256_SVW1_TT4_64_VW1_WGM4
    SolutionIndex: 53
    SolutionNameMin: Cijk_Ailk_Bljk_I8II_BH_MT128x128x16_MI16x16x16x1_SN_1LDSB0_AMAS3_GRVW4_IU1_SIA1_SU32_SUS256_SVW2_TT4_64_VW2_WGM4
    SolutionIndex: 54
    SolutionNameMin: Cijk_Ailk_Bljk_I8II_BH_MT128x128x16_MI16x16x16x1_SN_1LDSB0_AMAS0_GRVW8_IU1_SIA1_SU32_SUS256_SVW1_TT4_64_VW1_WGM4
    SolutionIndex: 55
    SolutionNameMin: Cijk_Ailk_Bljk_I8II_BH_MT128x128x16_MI16x16x16x1_SN_1LDSB0_AMAS3_GRVW8_IU1_SIA1_SU32_SUS256_SVW2_TT4_64_VW2_WGM4
    SolutionIndex: 56
    SolutionNameMin: Cijk_Ailk_Bljk_I8II_BH_MT128x128x16_MI16x16x16x1_SN_1LDSB1_AMAS0_GRVW8_IU1_SIA2_SU32_SUS256_SVW1_TT4_64_VW1_WGM4
    SolutionIndex: 57
    SolutionNameMin: Cijk_Ailk_Bljk_I8II_BH_MT128x128x16_MI16x16x16x1_SN_1LDSB1_AMAS3_GRVW8_IU1_SIA2_SU32_SUS256_SVW2_TT4_64_VW2_WGM4
    SolutionIndex: 58
    SolutionNameMin: Cijk_Ailk_Bljk_I8II_BH_MT128x128x16_MI16x16x16x1_SN_1LDSB0_AMAS0_GRVW4_IU1_SIA1_SU0_SUS0_SVW1_TT4_64_VW1_WGM8
    SolutionIndex: 59
    SolutionNameMin: Cijk_Ailk_Bljk_I8II_BH_MT128x128x16_MI16x16x16x1_SN_1LDSB0_AMAS3_GRVW4_IU1_SIA1_SU0_SUS0_SVW2_TT4_64_VW2_WGM8
    SolutionIndex: 60
    SolutionNameMin: Cijk_Ailk_Bljk_I8II_BH_MT128x128x16_MI16x16x16x1_SN_1LDSB0_AMAS0_GRVW8_IU1_SIA1_SU0_SUS0_SVW1_TT4_64_VW1_WGM8
    SolutionIndex: 61
    SolutionNameMin: Cijk_Ailk_Bljk_I8II_BH_MT128x128x16_MI16x16x16x1_SN_1LDSB0_AMAS3_GRVW8_IU1_SIA1_SU0_SUS0_SVW2_TT4_64_VW2_WGM8
    SolutionIndex: 62
    SolutionNameMin: Cijk_Ailk_Bljk_I8II_BH_MT128x128x16_MI16x16x16x1_SN_1LDSB1_AMAS0_GRVW4_IU1_SIA2_SU0_SUS0_SVW1_TT4_64_VW1_WGM8
    SolutionIndex: 63
    SolutionNameMin: Cijk_Ailk_Bljk_I8II_BH_MT128x128x16_MI16x16x16x1_SN_1LDSB1_AMAS3_GRVW4_IU1_SIA2_SU0_SUS0_SVW2_TT4_64_VW2_WGM8
    SolutionIndex: 64
    SolutionNameMin: Cijk_Ailk_Bljk_I8II_BH_MT128x128x16_MI16x16x16x1_SN_1LDSB1_AMAS0_GRVW8_IU1_SIA2_SU0_SUS0_SVW1_TT4_64_VW1_WGM8
    SolutionIndex: 65
    SolutionNameMin: Cijk_Ailk_Bljk_I8II_BH_MT128x128x16_MI16x16x16x1_SN_1LDSB1_AMAS3_GRVW8_IU1_SIA2_SU0_SUS0_SVW2_TT4_64_VW2_WGM8
    SolutionIndex: 66
    SolutionNameMin: Cijk_Ailk_Bljk_I8II_BH_MT128x128x16_MI16x16x16x1_SN_1LDSB0_AMAS0_GRVW4_IU1_SIA1_SU32_SUS128_SVW1_TT4_64_VW1_WGM8
    SolutionIndex: 67
    SolutionNameMin: Cijk_Ailk_Bljk_I8II_BH_MT128x128x16_MI16x16x16x1_SN_1LDSB0_AMAS0_GRVW8_IU1_SIA1_SU32_SUS128_SVW1_TT4_64_VW1_WGM8
    SolutionIndex: 68
    SolutionNameMin: Cijk_Ailk_Bljk_I8II_BH_MT128x128x16_MI16x16x16x1_SN_1LDSB0_AMAS3_GRVW8_IU1_SIA1_SU32_SUS128_SVW2_TT4_64_VW2_WGM8
    SolutionIndex: 69
    SolutionNameMin: Cijk_Ailk_Bljk_I8II_BH_MT128x128x16_MI16x16x16x1_SN_1LDSB1_AMAS3_GRVW4_IU1_SIA2_SU32_SUS128_SVW2_TT4_64_VW2_WGM8
    SolutionIndex: 70
    SolutionNameMin: Cijk_Ailk_Bljk_I8II_BH_MT128x128x16_MI16x16x16x1_SN_1LDSB1_AMAS3_GRVW8_IU1_SIA2_SU32_SUS128_SVW2_TT4_64_VW2_WGM8
    SolutionIndex: 71
    SolutionNameMin: Cijk_Ailk_Bljk_I8II_BH_MT128x128x16_MI16x16x16x1_SN_1LDSB0_AMAS3_GRVW8_IU1_SIA1_SU32_SUS256_SVW2_TT4_64_VW2_WGM8
    SolutionIndex: 72
    SolutionNameMin: Cijk_Ailk_Bljk_I8II_BH_MT128x128x16_MI16x16x16x1_SN_1LDSB1_AMAS3_GRVW4_IU1_SIA2_SU32_SUS256_SVW2_TT4_64_VW2_WGM8
    SolutionIndex: 73
    SolutionNameMin: Cijk_Ailk_Bljk_I8II_BH_MT128x128x16_MI16x16x16x1_SN_1LDSB1_AMAS3_GRVW8_IU1_SIA2_SU32_SUS256_SVW2_TT4_64_VW2_WGM8
    SolutionIndex: 74
    SolutionNameMin: Cijk_Ailk_Bljk_I8II_BH_MT32x32x32_MI16x16x16x1_SN_1LDSB0_AMAS0_GRVW4_IU1_SIA1_SU0_SUS0_SVW1_TT1_16_VW1_WGM4
    SolutionIndex: 75
    SolutionNameMin: Cijk_Ailk_Bljk_I8II_BH_MT32x32x32_MI16x16x16x1_SN_1LDSB0_AMAS0_GRVW8_IU1_SIA1_SU0_SUS0_SVW1_TT1_16_VW1_WGM4
    SolutionIndex: 76
    SolutionNameMin: Cijk_Ailk_Bljk_I8II_BH_MT32x32x32_MI16x16x16x1_SN_1LDSB1_AMAS0_GRVW4_IU2_SIA2_SU0_SUS0_SVW1_TT1_16_VW1_WGM4
    SolutionIndex: 77
    SolutionNameMin: Cijk_Ailk_Bljk_I8II_BH_MT32x32x32_MI16x16x16x1_SN_1LDSB1_AMAS0_GRVW8_IU2_SIA2_SU0_SUS0_SVW1_TT1_16_VW1_WGM4
    SolutionIndex: 78
    SolutionNameMin: Cijk_Ailk_Bljk_I8II_BH_MT32x32x32_MI16x16x16x1_SN_1LDSB0_AMAS0_GRVW8_IU1_SIA3_SU0_SUS0_SVW1_TT1_16_VW1_WGM4
    SolutionIndex: 79
    SolutionNameMin: Cijk_Ailk_Bljk_I8II_BH_MT32x32x32_MI16x16x16x1_SN_1LDSB0_AMAS0_GRVW8_IU1_SIA1_SU32_SUS128_SVW1_TT1_16_VW1_WGM4
    SolutionIndex: 80
    SolutionNameMin: Cijk_Ailk_Bljk_I8II_BH_MT32x32x32_MI16x16x16x1_SN_1LDSB0_AMAS0_GRVW4_IU1_SIA3_SU32_SUS128_SVW1_TT1_16_VW1_WGM4
    SolutionIndex: 81
    SolutionNameMin: Cijk_Ailk_Bljk_I8II_BH_MT32x32x32_MI16x16x16x1_SN_1LDSB0_AMAS0_GRVW8_IU1_SIA3_SU32_SUS128_SVW1_TT1_16_VW1_WGM4
    SolutionIndex: 82
    SolutionNameMin: Cijk_Ailk_Bljk_I8II_BH_MT32x32x32_MI16x16x16x1_SN_1LDSB0_AMAS0_GRVW8_IU1_SIA3_SU32_SUS256_SVW1_TT1_16_VW1_WGM4
    SolutionIndex: 83
    SolutionNameMin: Cijk_Ailk_Bljk_I8II_BH_MT32x32x32_MI16x16x16x1_SN_1LDSB0_AMAS0_GRVW4_IU1_SIA1_SU0_SUS0_SVW1_TT1_16_VW1_WGM8
    SolutionIndex: 84
    SolutionNameMin: Cijk_Ailk_Bljk_I8II_BH_MT32x32x32_MI16x16x16x1_SN_1LDSB0_AMAS0_GRVW8_IU1_SIA1_SU0_SUS0_SVW1_TT1_16_VW1_WGM8
    SolutionIndex: 85
    SolutionNameMin: Cijk_Ailk_Bljk_I8II_BH_MT32x32x32_MI16x16x16x1_SN_1LDSB1_AMAS0_GRVW4_IU2_SIA2_SU0_SUS0_SVW1_TT1_16_VW1_WGM8
    SolutionIndex: 86
    SolutionNameMin: Cijk_Ailk_Bljk_I8II_BH_MT32x32x32_MI16x16x16x1_SN_1LDSB1_AMAS0_GRVW8_IU2_SIA2_SU0_SUS0_SVW1_TT1_16_VW1_WGM8
    SolutionIndex: 87
    SolutionNameMin: Cijk_Ailk_Bljk_I8II_BH_MT32x32x32_MI16x16x16x1_SN_1LDSB0_AMAS0_GRVW8_IU1_SIA3_SU0_SUS0_SVW1_TT1_16_VW1_WGM8
    SolutionIndex: 88
    SolutionNameMin: Cijk_Ailk_Bljk_I8II_BH_MT32x32x32_MI16x16x16x1_SN_1LDSB1_AMAS0_GRVW8_IU2_SIA2_SU32_SUS128_SVW1_TT1_16_VW1_WGM8
    SolutionIndex: 89
    SolutionNameMin: Cijk_Ailk_Bljk_I8II_BH_MT32x32x32_MI16x16x16x1_SN_1LDSB1_AMAS0_GRVW8_IU2_SIA2_SU32_SUS256_SVW1_TT1_16_VW1_WGM8
    SolutionIndex: 90
    SolutionNameMin: Cijk_Ailk_Bljk_I8II_BH_MT32x32x32_MI16x16x16x1_SN_1LDSB0_AMAS0_GRVW8_IU1_SIA3_SU32_SUS256_SVW1_TT1_16_VW1_WGM8
    SolutionIndex: 91
    SolutionNameMin: Cijk_Ailk_Bljk_I8II_BH_MT64x64x32_MI16x16x16x1_SN_1LDSB0_AMAS0_GRVW4_IU1_SIA1_SU0_SUS0_SVW1_TT2_32_VW1_WGM4
    SolutionIndex: 92
    SolutionNameMin: Cijk_Ailk_Bljk_I8II_BH_MT64x64x32_MI16x16x16x1_SN_1LDSB0_AMAS3_GRVW4_IU1_SIA1_SU0_SUS0_SVW2_TT2_32_VW2_WGM4
    SolutionIndex: 93
    SolutionNameMin: Cijk_Ailk_Bljk_I8II_BH_MT64x64x32_MI16x16x16x1_SN_1LDSB0_AMAS0_GRVW8_IU1_SIA1_SU0_SUS0_SVW1_TT2_32_VW1_WGM4
    SolutionIndex: 94
    SolutionNameMin: Cijk_Ailk_Bljk_I8II_BH_MT64x64x32_MI16x16x16x1_SN_1LDSB0_AMAS3_GRVW8_IU1_SIA1_SU0_SUS0_SVW2_TT2_32_VW2_WGM4
    SolutionIndex: 95
    SolutionNameMin: Cijk_Ailk_Bljk_I8II_BH_MT64x64x32_MI16x16x16x1_SN_1LDSB0_AMAS3_GRVW4_IU1_SIA1_SU32_SUS128_SVW2_TT2_32_VW2_WGM4
    SolutionIndex: 96
    SolutionNameMin: Cijk_Ailk_Bljk_I8II_BH_MT64x64x32_MI16x16x16x1_SN_1LDSB0_AMAS3_GRVW8_IU1_SIA1_SU32_SUS128_SVW2_TT2_32_VW2_WGM4
    SolutionIndex: 97
    SolutionNameMin: Cijk_Ailk_Bljk_I8II_BH_MT64x64x32_MI16x16x16x1_SN_1LDSB0_AMAS3_GRVW4_IU1_SIA1_SU32_SUS256_SVW2_TT2_32_VW2_WGM4
    SolutionIndex: 98
    SolutionNameMin: Cijk_Ailk_Bljk_I8II_BH_MT64x64x32_MI16x16x16x1_SN_1LDSB0_AMAS0_GRVW8_IU1_SIA1_SU32_SUS256_SVW1_TT2_32_VW1_WGM4
    SolutionIndex: 99
    SolutionNameMin: Cijk_Ailk_Bljk_I8II_BH_MT64x64x32_MI16x16x16x1_SN_1LDSB0_AMAS3_GRVW8_IU1_SIA1_SU32_SUS256_SVW2_TT2_32_VW2_WGM4
    SolutionIndex: 100
    SolutionNameMin: Cijk_Ailk_Bljk_I8II_BH_MT64x64x32_MI16x16x16x1_SN_1LDSB0_AMAS0_GRVW4_IU1_SIA1_SU0_SUS0_SVW1_TT2_32_VW1_WGM8
    SolutionIndex: 101
    SolutionNameMin: Cijk_Ailk_Bljk_I8II_BH_MT64x64x32_MI16x16x16x1_SN_1LDSB0_AMAS3_GRVW4_IU1_SIA1_SU0_SUS0_SVW2_TT2_32_VW2_WGM8
    SolutionIndex: 102
    SolutionNameMin: Cijk_Ailk_Bljk_I8II_BH_MT64x64x32_MI16x16x16x1_SN_1LDSB0_AMAS0_GRVW8_IU1_SIA1_SU0_SUS0_SVW1_TT2_32_VW1_WGM8
    SolutionIndex: 103
    SolutionNameMin: Cijk_Ailk_Bljk_I8II_BH_MT64x64x32_MI16x16x16x1_SN_1LDSB0_AMAS3_GRVW8_IU1_SIA1_SU0_SUS0_SVW2_TT2_32_VW2_WGM8
    SolutionIndex: 104
    SolutionNameMin: Cijk_Ailk_Bljk_I8II_BH_MT64x64x32_MI16x16x16x1_SN_1LDSB0_AMAS0_GRVW4_IU1_SIA1_SU32_SUS128_SVW1_TT2_32_VW1_WGM8
    SolutionIndex: 105
    SolutionNameMin: Cijk_Ailk_Bljk_I8II_BH_MT64x64x32_MI16x16x16x1_SN_1LDSB0_AMAS3_GRVW8_IU1_SIA1_SU32_SUS128_SVW2_TT2_32_VW2_WGM8
    SolutionIndex: 106
    SolutionNameMin: Cijk_Ailk_Bljk_I8II_BH_MT64x64x32_MI16x16x16x1_SN_1LDSB0_AMAS3_GRVW4_IU1_SIA1_SU32_SUS256_SVW2_TT2_32_VW2_WGM8
- - - [64, 64, 1, 64, 96, 96, 96, 96]
    - [87, 0.091]
  - - [64, 64, 1, 128, 96, 96, 160, 160]
    - [85, 0.171]
  - - [64, 64, 1, 256, 96, 96, 288, 288]
    - [89, 0.305]
  - - [64, 64, 1, 512, 96, 96, 544, 544]
    - [77, 0.506]
  - - [64, 64, 1, 1024, 96, 96, 1056, 1056]
    - [86, 0.758]
  - - [64, 64, 1, 2048, 96, 96, 2080, 2080]
    - [77, 1.003]
  - - [64, 64, 1, 4096, 96, 96, 4128, 4128]
    - [77, 1.195]
  - - [64, 128, 1, 64, 96, 96, 96, 96]
    - [75, 0.186]
  - - [64, 128, 1, 128, 96, 96, 160, 160]
    - [89, 0.348]
  - - [64, 128, 1, 256, 96, 96, 288, 288]
    - [77, 0.62]
  - - [64, 128, 1, 512, 96, 96, 544, 544]
    - [86, 1.029]
  - - [64, 128, 1, 1024, 96, 96, 1056, 1056]
    - [77, 1.526]
  - - [64, 128, 1, 2048, 96, 96, 2080, 2080]
    - [86, 2.011]
  - - [64, 128, 1, 4096, 96, 96, 4128, 4128]
    - [77, 2.394]
  - - [64, 256, 1, 64, 96, 96, 96, 96]
    - [79, 0.373]
  - - [64, 256, 1, 128, 96, 96, 160, 160]
    - [84, 0.705]
  - - [64, 256, 1, 256, 96, 96, 288, 288]
    - [88, 1.249]
  - - [64, 256, 1, 512, 96, 96, 544, 544]
    - [77, 2.068]
  - - [64, 256, 1, 1024, 96, 96, 1056, 1056]
    - [77, 3.05]
  - - [64, 256, 1, 2048, 96, 96, 2080, 2080]
    - [77, 4.033]
  - - [64, 256, 1, 4096, 96, 96, 4128, 4128]
    - [86, 4.783]
  - - [64, 512, 1, 64, 96, 96, 96, 96]
    - [6, 0.729]
  - - [64, 512, 1, 128, 96, 96, 160, 160]
    - [83, 1.341]
  - - [64, 512, 1, 256, 96, 96, 288, 288]
    - [8, 2.326]
  - - [64, 512, 1, 512, 96, 96, 544, 544]
    - [10, 3.682]
  - - [64, 512, 1, 1024, 96, 96, 1056, 1056]
    - [87, 5.14]
  - - [64, 512, 1, 2048, 96, 96, 2080, 2080]
    - [74, 6.437]
  - - [64, 512, 1, 4096, 96, 96, 4128, 4128]
    - [83, 7.366]
  - - [64, 1024, 1, 64, 96, 96, 96, 96]
    - [7, 1.419]
  - - [64, 1024, 1, 128, 96, 96, 160, 160]
    - [3, 2.563]
  - - [64, 1024, 1, 256, 96, 96, 288, 288]
    - [5, 4.338]
  - - [64, 1024, 1, 512, 96, 96, 544, 544]
    - [102, 6.597]
  - - [64, 1024, 1, 1024, 96, 96, 1056, 1056]
    - [1, 8.862]
  - - [64, 1024, 1, 2048, 96, 96, 2080, 2080]
    - [1, 10.8]
  - - [64, 1024, 1, 4096, 96, 96, 4128, 4128]
    - [98, 11.79]
  - - [64, 2048, 1, 64, 96, 96, 96, 96]
    - [15, 2.713]
  - - [64, 2048, 1, 128, 96, 96, 160, 160]
    - [41, 4.854]
  - - [64, 2048, 1, 256, 96, 96, 288, 288]
    - [27, 8.022]
  - - [64, 2048, 1, 512, 96, 96, 544, 544]
    - [28, 11.905]
  - - [64, 2048, 1, 1024, 96, 96, 1056, 1056]
    - [30, 15.572]
  - - [64, 2048, 1, 2048, 96, 96, 2080, 2080]
    - [26, 18.478]
  - - [64, 2048, 1, 4096, 96, 96, 4128, 4128]
    - [34, 19.517]
  - - [64, 4096, 1, 64, 96, 96, 96, 96]
    - [33, 5.107]
  - - [64, 4096, 1, 128, 96, 96, 160, 160]
    - [26, 8.739]
  - - [64, 4096, 1, 256, 96, 96, 288, 288]
    - [22, 13.81]
  - - [64, 4096, 1, 512, 96, 96, 544, 544]
    - [15, 19.092]
  - - [64, 4096, 1, 1024, 96, 96, 1056, 1056]
    - [26, 23.603]
  - - [64, 4096, 1, 2048, 96, 96, 2080, 2080]
    - [36, 26.833]
  - - [64, 4096, 1, 4096, 96, 96, 4128, 4128]
    - [25, 28.095]
  - - [128, 64, 1, 64, 160, 160, 128, 96]
    - [81, 0.186]
  - - [128, 64, 1, 128, 160, 160, 160, 160]
    - [75, 0.346]
  - - [128, 64, 1, 256, 160, 160, 288, 288]
    - [76, 0.618]
  - - [128, 64, 1, 512, 160, 160, 544, 544]
    - [85, 1.025]
  - - [128, 64, 1, 1024, 160, 160, 1056, 1056]
    - [77, 1.53]
  - - [128, 64, 1, 2048, 160, 160, 2080, 2080]
    - [77, 2.016]
  - - [128, 64, 1, 4096, 160, 160, 4128, 4128]
    - [77, 2.394]
  - - [128, 128, 1, 64, 160, 160, 128, 96]
    - [90, 0.374]
  - - [128, 128, 1, 128, 160, 160, 160, 160]
    - [89, 0.699]
  - - [128, 128, 1, 256, 160, 160, 288, 288]
    - [89, 1.248]
  - - [128, 128, 1, 512, 160, 160, 544, 544]
    - [86, 2.068]
  - - [128, 128, 1, 1024, 160, 160, 1056, 1056]
    - [86, 3.059]
  - - [128, 128, 1, 2048, 160, 160, 2080, 2080]
    - [77, 4.028]
  - - [128, 128, 1, 4096, 160, 160, 4128, 4128]
    - [77, 4.781]
  - - [128, 256, 1, 64, 160, 160, 128, 96]
    - [2, 0.731]
  - - [128, 256, 1, 128, 160, 160, 160, 160]
    - [8, 1.351]
  - - [128, 256, 1, 256, 160, 160, 288, 288]
    - [9, 2.335]
  - - [128, 256, 1, 512, 160, 160, 544, 544]
    - [8, 3.685]
  - - [128, 256, 1, 1024, 160, 160, 1056, 1056]
    - [11, 5.127]
  - - [128, 256, 1, 2048, 160, 160, 2080, 2080]
    - [2, 6.382]
  - - [128, 256, 1, 4096, 160, 160, 4128, 4128]
    - [10, 7.324]
  - - [128, 512, 1, 64, 160, 160, 128, 96]
    - [4, 1.405]
  - - [128, 512, 1, 128, 160, 160, 160, 160]
    - [1, 2.594]
  - - [128, 512, 1, 256, 160, 160, 288, 288]
    - [105, 4.408]
  - - [128, 512, 1, 512, 160, 160, 544, 544]
    - [106, 6.805]
  - - [128, 512, 1, 1024, 160, 160, 1056, 1056]
    - [98, 9.11]
  - - [128, 512, 1, 2048, 160, 160, 2080, 2080]
    - [93, 11.034]
  - - [128, 512, 1, 4096, 160, 160, 4128, 4128]
    - [98, 11.43]
  - - [128, 1024, 1, 64, 160, 160, 128, 96]
    - [41, 2.706]
  - - [128, 1024, 1, 128, 160, 160, 160, 160]
    - [14, 4.86]
  - - [128, 1024, 1, 256, 160, 160, 288, 288]
    - [24, 8.088]
  - - [128, 1024, 1, 512, 160, 160, 544, 544]
    - [34, 12.076]
  - - [128, 1024, 1, 1024, 160, 160, 1056, 1056]
    - [39, 16.021]
  - - [128, 1024, 1, 2048, 160, 160, 2080, 2080]
    - [39, 19.155]
  - - [128, 1024, 1, 4096, 160, 160, 4128, 4128]
    - [27, 20.302]
  - - [128, 2048, 1, 64, 160, 160, 128, 96]
    - [16, 5.07]
  - - [128, 2048, 1, 128, 160, 160, 160, 160]
    - [26, 8.746]
  - - [128, 2048, 1, 256, 160, 160, 288, 288]
    - [15, 13.847]
  - - [128, 2048, 1, 512, 160, 160, 544, 544]
    - [25, 19.238]
  - - [128, 2048, 1, 1024, 160, 160, 1056, 1056]
    - [15, 24.052]
  - - [128, 2048, 1, 2048, 160, 160, 2080, 2080]
    - [14, 27.458]
  - - [128, 2048, 1, 4096, 160, 160, 4128, 4128]
    - [22, 28.429]
  - - [128, 4096, 1, 64, 160, 160, 128, 96]
    - [18, 8.59]
  - - [128, 4096, 1, 128, 160, 160, 160, 160]
    - [39, 14.125]
  - - [128, 4096, 1, 256, 160, 160, 288, 288]
    - [50, 21.771]
  - - [128, 4096, 1, 512, 160, 160, 544, 544]
    - [49, 30.183]
  - - [128, 4096, 1, 1024, 160, 160, 1056, 1056]
    - [52, 37.24]
  - - [128, 4096, 1, 2048, 160, 160, 2080, 2080]
    - [52, 40.513]
  - - [128, 4096, 1, 4096, 160, 160, 4128, 4128]
    - [66, 44.334]
  - - [256, 64, 1, 64, 288, 288, 256, 96]
    - [84, 0.372]
  - - [256, 64, 1, 128, 288, 288, 256, 160]
    - [78, 0.696]
  - - [256, 64, 1, 256, 288, 288, 288, 288]
    - [85, 1.246]
  - - [256, 64, 1, 512, 288, 288, 544, 544]
    - [77, 2.051]
  - - [256, 64, 1, 1024, 288, 288, 1056, 1056]
    - [77, 3.047]
  - - [256, 64, 1, 2048, 288, 288, 2080, 2080]
    - [86, 4.023]
  - - [256, 64, 1, 4096, 288, 288, 4128, 4128]
    - [77, 4.785]
  - - [256, 128, 1, 64, 288, 288, 256, 96]
    - [82, 0.729]
  - - [256, 128, 1, 128, 288, 288, 256, 160]
    - [8, 1.344]
  - - [256, 128, 1, 256, 288, 288, 288, 288]
    - [8, 2.331]
  - - [256, 128, 1, 512, 288, 288, 544, 544]
    - [1, 3.652]
  - - [256, 128, 1, 1024, 288, 288, 1056, 1056]
    - [80, 5.098]
  - - [256, 128, 1, 2048, 288, 288, 2080, 2080]
    - [2, 6.372]
  - - [256, 128, 1, 4096, 288, 288, 4128, 4128]
    - [2, 7.301]
  - - [256, 256, 1, 64, 288, 288, 256, 96]
    - [4, 1.405]
  - - [256, 256, 1, 128, 288, 288, 256, 160]
    - [0, 2.591]
  - - [256, 256, 1, 256, 288, 288, 288, 288]
    - [92, 4.414]
  - - [256, 256, 1, 512, 288, 288, 544, 544]
    - [91, 6.834]
  - - [256, 256, 1, 1024, 288, 288, 1056, 1056]
    - [100, 9.429]
  - - [256, 256, 1, 2048, 288, 288, 2080, 2080]
    - [101, 11.694]
  - - [256, 256, 1, 4096, 288, 288, 4128, 4128]
    - [101, 13.078]
  - - [256, 512, 1, 64, 288, 288, 256, 96]
    - [15, 2.718]
  - - [256, 512, 1, 128, 288, 288, 256, 160]
    - [36, 4.861]
  - - [256, 512, 1, 256, 288, 288, 288, 288]
    - [35, 8.173]
  - - [256, 512, 1, 512, 288, 288, 544, 544]
    - [35, 12.087]
  - - [256, 512, 1, 1024, 288, 288, 1056, 1056]
    - [35, 15.93]
  - - [256, 512, 1, 2048, 288, 288, 2080, 2080]
    - [27, 19.116]
  - - [256, 512, 1, 4096, 288, 288, 4128, 4128]
    - [28, 20.357]
  - - [256, 1024, 1, 64, 288, 288, 256, 96]
    - [31, 5.057]
  - - [256, 1024, 1, 128, 288, 288, 256, 160]
    - [26, 8.712]
  - - [256, 1024, 1, 256, 288, 288, 288, 288]
    - [26, 13.837]
  - - [256, 1024, 1, 512, 288, 288, 544, 544]
    - [29, 19.259]
  - - [256, 1024, 1, 1024, 288, 288, 1056, 1056]
    - [26, 24.01]
  - - [256, 1024, 1, 2048, 288, 288, 2080, 2080]
    - [14, 27.433]
  - - [256, 1024, 1, 4096, 288, 288, 4128, 4128]
    - [40, 28.427]
  - - [256, 2048, 1, 64, 288, 288, 256, 96]
    - [26, 8.579]
  - - [256, 2048, 1, 128, 288, 288, 256, 160]
    - [36, 14.196]
  - - [256, 2048, 1, 256, 288, 288, 288, 288]
    - [67, 21.76]
  - - [256, 2048, 1, 512, 288, 288, 544, 544]
    - [61, 30.269]
  - - [256, 2048, 1, 1024, 288, 288, 1056, 1056]
    - [61, 37.451]
  - - [256, 2048, 1, 2048, 288, 288, 2080, 2080]
    - [61, 40.658]
  - - [256, 2048, 1, 4096, 288, 288, 4128, 4128]
    - [45, 44.596]
  - - [256, 4096, 1, 64, 288, 288, 256, 96]
    - [26, 14.452]
  - - [256, 4096, 1, 128, 288, 288, 256, 160]
    - [64, 22.872]
  - - [256, 4096, 1, 256, 288, 288, 288, 288]
    - [65, 33.837]
  - - [256, 4096, 1, 512, 288, 288, 544, 544]
    - [64, 43.586]
  - - [256, 4096, 1, 1024, 288, 288, 1056, 1056]
    - [48, 51.28]
  - - [256, 4096, 1, 2048, 288, 288, 2080, 2080]
    - [65, 54.255]
  - - [256, 4096, 1, 4096, 288, 288, 4128, 4128]
    - [64, 57.451]
  - - [384, 64, 1, 64, 416, 416, 384, 96]
    - [83, 0.556]
  - - [384, 64, 1, 128, 416, 416, 384, 160]
    - [78, 1.043]
  - - [384, 64, 1, 256, 416, 416, 384, 288]
    - [80, 1.873]
  - - [384, 64, 1, 512, 416, 416, 544, 544]
    - [86, 3.085]
  - - [384, 64, 1, 1024, 416, 416, 1056, 1056]
    - [77, 4.576]
  - - [384, 64, 1, 2048, 416, 416, 2080, 2080]
    - [77, 6.033]
  - - [384, 64, 1, 4096, 416, 416, 4128, 4128]
    - [77, 7.161]
  - - [384, 128, 1, 64, 416, 416, 384, 96]
    - [84, 1.088]
  - - [384, 128, 1, 128, 416, 416, 384, 160]
    - [84, 1.999]
  - - [384, 128, 1, 256, 416, 416, 384, 288]
    - [8, 3.476]
  - - [384, 128, 1, 512, 416, 416, 544, 544]
    - [2, 5.437]
  - - [384, 128, 1, 1024, 416, 416, 1056, 1056]
    - [5, 7.588]
  - - [384, 128, 1, 2048, 416, 416, 2080, 2080]
    - [2, 9.519]
  - - [384, 128, 1, 4096, 416, 416, 4128, 4128]
    - [6, 10.904]
  - - [384, 256, 1, 64, 416, 416, 384, 96]
    - [94, 2.081]
  - - [384, 256, 1, 128, 416, 416, 384, 160]
    - [93, 3.842]
  - - [384, 256, 1, 256, 416, 416, 384, 288]
    - [104, 6.595]
  - - [384, 256, 1, 512, 416, 416, 544, 544]
    - [104, 10.239]
  - - [384, 256, 1, 1024, 416, 416, 1056, 1056]
    - [106, 14.071]
  - - [384, 256, 1, 2048, 416, 416, 2080, 2080]
    - [106, 17.296]
  - - [384, 256, 1, 4096, 416, 416, 4128, 4128]
    - [103, 18.446]
  - - [384, 512, 1, 64, 416, 416, 384, 96]
    - [13, 3.945]
  - - [384, 512, 1, 128, 416, 416, 384, 160]
    - [22, 7.121]
  - - [384, 512, 1, 256, 416, 416, 384, 288]
    - [21, 11.838]
  - - [384, 512, 1, 512, 416, 416, 544, 544]
    - [24, 17.822]
  - - [384, 512, 1, 1024, 416, 416, 1056, 1056]
    - [26, 23.481]
  - - [384, 512, 1, 2048, 416, 416, 2080, 2080]
    - [15, 27.97]
  - - [384, 512, 1, 4096, 416, 416, 4128, 4128]
    - [14, 29.758]
  - - [384, 1024, 1, 64, 416, 416, 384, 96]
    - [31, 6.907]
  - - [384, 1024, 1, 128, 416, 416, 384, 160]
    - [30, 11.698]
  - - [384, 1024, 1, 256, 416, 416, 384, 288]
    - [30, 17.789]
  - - [384, 1024, 1, 512, 416, 416, 544, 544]
    - [55, 24.406]
  - - [384, 1024, 1, 1024, 416, 416, 1056, 1056]
    - [54, 30.236]
  - - [384, 1024, 1, 2048, 416, 416, 2080, 2080]
    - [45, 32.443]
  - - [384, 1024, 1, 4096, 416, 416, 4128, 4128]
    - [43, 35.935]
  - - [384, 2048, 1, 64, 416, 416, 384, 96]
    - [36, 11.753]
  - - [384, 2048, 1, 128, 416, 416, 384, 160]
    - [44, 19.47]
  - - [384, 2048, 1, 256, 416, 416, 384, 288]
    - [71, 30.428]
  - - [384, 2048, 1, 512, 416, 416, 544, 544]
    - [71, 42.7]
  - - [384, 2048, 1, 1024, 416, 416, 1056, 1056]
    - [45, 53.948]
  - - [384, 2048, 1, 2048, 416, 416, 2080, 2080]
    - [61, 59.31]
  - - [384, 2048, 1, 4096, 416, 416, 4128, 4128]
    - [49, 65.286]
  - - [384, 4096, 1, 64, 416, 416, 384, 96]
    - [30, 18.98]
  - - [384, 4096, 1, 128, 416, 416, 384, 160]
    - [57, 29.26]
  - - [384, 4096, 1, 256, 416, 416, 384, 288]
    - [48, 42.178]
  - - [384, 4096, 1, 512, 416, 416, 544, 544]
    - [73, 52.785]
  - - [384, 4096, 1, 1024, 416, 416, 1056, 1056]
    - [63, 57.769]
  - - [384, 4096, 1, 2048, 416, 416, 2080, 2080]
    - [72, 63.101]
  - - [384, 4096, 1, 4096, 416, 416, 4128, 4128]
    - [63, 66.054]
  - - [768, 64, 1, 64, 800, 800, 768, 96]
    - [79, 1.077]
  - - [768, 64, 1, 128, 800, 800, 768, 160]
    - [79, 2.002]
  - - [768, 64, 1, 256, 800, 800, 768, 288]
    - [4, 3.482]
  - - [768, 64, 1, 512, 800, 800, 768, 544]
    - [8, 5.498]
  - - [768, 64, 1, 1024, 800, 800, 1056, 1056]
    - [6, 7.551]
  - - [768, 64, 1, 2048, 800, 800, 2080, 2080]
    - [6, 9.461]
  - - [768, 64, 1, 4096, 800, 800, 4128, 4128]
    - [5, 10.838]
  - - [768, 128, 1, 64, 800, 800, 768, 96]
    - [100, 2.09]
  - - [768, 128, 1, 128, 800, 800, 768, 160]
    - [104, 3.829]
  - - [768, 128, 1, 256, 800, 800, 768, 288]
    - [100, 6.593]
  - - [768, 128, 1, 512, 800, 800, 768, 544]
    - [100, 10.259]
  - - [768, 128, 1, 1024, 800, 800, 1056, 1056]
    - [102, 13.679]
  - - [768, 128, 1, 2048, 800, 800, 2080, 2080]
    - [102, 16.672]
  - - [768, 128, 1, 4096, 800, 800, 4128, 4128]
    - [101, 18.02]
  - - [768, 256, 1, 64, 800, 800, 768, 96]
    - [31, 3.943]
  - - [768, 256, 1, 128, 800, 800, 768, 160]
    - [27, 7.08]
  - - [768, 256, 1, 256, 800, 800, 768, 288]
    - [19, 11.824]
  - - [768, 256, 1, 512, 800, 800, 768, 544]
    - [24, 17.67]
  - - [768, 256, 1, 1024, 800, 800, 1056, 1056]
    - [26, 23.081]
  - - [768, 256, 1, 2048, 800, 800, 2080, 2080]
    - [14, 27.564]
  - - [768, 256, 1, 4096, 800, 800, 4128, 4128]
    - [14, 29.35]
  - - [768, 512, 1, 64, 800, 800, 768, 96]
    - [37, 6.924]
  - - [768, 512, 1, 128, 800, 800, 768, 160]
    - [30, 11.688]
  - - [768, 512, 1, 256, 800, 800, 768, 288]
    - [40, 17.758]
  - - [768, 512, 1, 512, 800, 800, 768, 544]
    - [44, 24.115]
  - - [768, 512, 1, 1024, 800, 800, 1056, 1056]
    - [44, 29.851]
  - - [768, 512, 1, 2048, 800, 800, 2080, 2080]
    - [42, 32.386]
  - - [768, 512, 1, 4096, 800, 800, 4128, 4128]
    - [43, 35.355]
  - - [768, 1024, 1, 64, 800, 800, 768, 96]
    - [38, 11.73]
  - - [768, 1024, 1, 128, 800, 800, 768, 160]
    - [45, 19.327]
  - - [768, 1024, 1, 256, 800, 800, 768, 288]
    - [45, 30.647]
  - - [768, 1024, 1, 512, 800, 800, 768, 544]
    - [60, 42.672]
  - - [768, 1024, 1, 1024, 800, 800, 1056, 1056]
    - [61, 53.93]
  - - [768, 1024, 1, 2048, 800, 800, 2080, 2080]
    - [45, 59.359]
  - - [768, 1024, 1, 4096, 800, 800, 4128, 4128]
    - [61, 65.146]
  - - [768, 2048, 1, 64, 800, 800, 768, 96]
    - [30, 18.967]
  - - [768, 2048, 1, 128, 800, 800, 768, 160]
    - [64, 28.881]
  - - [768, 2048, 1, 256, 800, 800, 768, 288]
    - [51, 41.857]
  - - [768, 2048, 1, 512, 800, 800, 768, 544]
    - [63, 52.612]
  - - [768, 2048, 1, 1024, 800, 800, 1056, 1056]
    - [62, 57.723]
  - - [768, 2048, 1, 2048, 800, 800, 2080, 2080]
    - [63, 63.052]
  - - [768, 2048, 1, 4096, 800, 800, 4128, 4128]
    - [62, 66.086]
  - - [768, 4096, 1, 64, 800, 800, 768, 96]
    - [41, 27.117]
  - - [768, 4096, 1, 128, 800, 800, 768, 160]
    - [64, 41.846]
  - - [768, 4096, 1, 256, 800, 800, 768, 288]
    - [65, 56.102]
  - - [768, 4096, 1, 512, 800, 800, 768, 544]
    - [65, 62.964]
  - - [768, 4096, 1, 1024, 800, 800, 1056, 1056]
    - [65, 70.277]
  - - [768, 4096, 1, 2048, 800, 800, 2080, 2080]
    - [65, 74.752]
  - - [768, 4096, 1, 4096, 800, 800, 4128, 4128]
    - [64, 77.111]
  - - [1536, 64, 1, 64, 1568, 1568, 1536, 96]
    - [97, 2.075]
  - - [1536, 64, 1, 128, 1568, 1568, 1536, 160]
    - [96, 3.814]
  - - [1536, 64, 1, 256, 1568, 1568, 1536, 288]
    - [104, 6.534]
  - - [1536, 64, 1, 512, 1568, 1568, 1536, 544]
    - [99, 10.091]
  - - [1536, 64, 1, 1024, 1568, 1568, 1536, 1056]
    - [94, 13.499]
  - - [1536, 64, 1, 2048, 1568, 1568, 2080, 2080]
    - [92, 16.306]
  - - [1536, 64, 1, 4096, 1568, 1568, 4128, 4128]
    - [95, 16.963]
  - - [1536, 128, 1, 64, 1568, 1568, 1536, 96]
    - [32, 3.943]
  - - [1536, 128, 1, 128, 1568, 1568, 1536, 160]
    - [13, 7.049]
  - - [1536, 128, 1, 256, 1568, 1568, 1536, 288]
    - [21, 11.686]
  - - [1536, 128, 1, 512, 1568, 1568, 1536, 544]
    - [23, 17.443]
  - - [1536, 128, 1, 1024, 1568, 1568, 1536, 1056]
    - [20, 23.043]
  - - [1536, 128, 1, 2048, 1568, 1568, 2080, 2080]
    - [13, 26.461]
  - - [1536, 128, 1, 4096, 1568, 1568, 4128, 4128]
    - [12, 28.023]
  - - [1536, 256, 1, 64, 1568, 1568, 1536, 96]
    - [33, 6.928]
  - - [1536, 256, 1, 128, 1568, 1568, 1536, 160]
    - [26, 11.674]
  - - [1536, 256, 1, 256, 1568, 1568, 1536, 288]
    - [30, 17.693]
  - - [1536, 256, 1, 512, 1568, 1568, 1536, 544]
    - [15, 23.828]
  - - [1536, 256, 1, 1024, 1568, 1568, 1536, 1056]
    - [45, 28.962]
  - - [1536, 256, 1, 2048, 1568, 1568, 2080, 2080]
    - [58, 31.196]
  - - [1536, 256, 1, 4096, 1568, 1568, 4128, 4128]
    - [42, 34.357]
  - - [1536, 512, 1, 64, 1568, 1568, 1536, 96]
    - [15, 11.745]
  - - [1536, 512, 1, 128, 1568, 1568, 1536, 160]
    - [53, 19.212]
  - - [1536, 512, 1, 256, 1568, 1568, 1536, 288]
    - [55, 30.465]
  - - [1536, 512, 1, 512, 1568, 1568, 1536, 544]
    - [43, 42.786]
  - - [1536, 512, 1, 1024, 1568, 1568, 1536, 1056]
    - [61, 54.017]
  - - [1536, 512, 1, 2048, 1568, 1568, 2080, 2080]
    - [45, 59.3]
  - - [1536, 512, 1, 4096, 1568, 1568, 4128, 4128]
    - [44, 65.021]
  - - [1536, 1024, 1, 64, 1568, 1568, 1536, 96]
    - [22, 18.976]
  - - [1536, 1024, 1, 128, 1568, 1568, 1536, 160]
    - [56, 29.014]
  - - [1536, 1024, 1, 256, 1568, 1568, 1536, 288]
    - [47, 41.876]
  - - [1536, 1024, 1, 512, 1568, 1568, 1536, 544]
    - [48, 52.732]
  - - [1536, 1024, 1, 1024, 1568, 1568, 1536, 1056]
    - [63, 57.751]
  - - [1536, 1024, 1, 2048, 1568, 1568, 2080, 2080]
    - [63, 63.052]
  - - [1536, 1024, 1, 4096, 1568, 1568, 4128, 4128]
    - [46, 66.11]
  - - [1536, 2048, 1, 64, 1568, 1568, 1536, 96]
    - [54, 27.245]
  - - [1536, 2048, 1, 128, 1568, 1568, 1536, 160]
    - [65, 42.151]
  - - [1536, 2048, 1, 256, 1568, 1568, 1536, 288]
    - [48, 56.181]
  - - [1536, 2048, 1, 512, 1568, 1568, 1536, 544]
    - [48, 62.992]
  - - [1536, 2048, 1, 1024, 1568, 1568, 1536, 1056]
    - [65, 70.4]
  - - [1536, 2048, 1, 2048, 1568, 1568, 2080, 2080]
    - [48, 74.759]
  - - [1536, 2048, 1, 4096, 1568, 1568, 4128, 4128]
    - [48, 77.146]
  - - [1536, 4096, 1, 64, 1568, 1568, 1536, 96]
    - [43, 36.415]
  - - [1536, 4096, 1, 128, 1568, 1568, 1536, 160]
    - [65, 54.402]
  - - [1536, 4096, 1, 256, 1568, 1568, 1536, 288]
    - [51, 63.171]
  - - [1536, 4096, 1, 512, 1568, 1568, 1536, 544]
    - [44, 74.227]
  - - [1536, 4096, 1, 1024, 1568, 1568, 1536, 1056]
    - [54, 80.004]
  - - [1536, 4096, 1, 2048, 1568, 1568, 2080, 2080]
    - [44, 83.176]
  - - [1536, 4096, 1, 4096, 1568, 1568, 4128, 4128]
    - [60, 83.974]
  - - [3072, 64, 1, 64, 3104, 3104, 3072, 96]
    - [17, 3.939]
  - - [3072, 64, 1, 128, 3104, 3104, 3072, 160]
    - [28, 7.022]
  - - [3072, 64, 1, 256, 3104, 3104, 3072, 288]
    - [19, 11.728]
  - - [3072, 64, 1, 512, 3104, 3104, 3072, 544]
    - [23, 17.382]
  - - [3072, 64, 1, 1024, 3104, 3104, 3072, 1056]
    - [26, 22.343]
  - - [3072, 64, 1, 2048, 3104, 3104, 3072, 2080]
    - [12, 25.681]
  - - [3072, 64, 1, 4096, 3104, 3104, 4128, 4128]
    - [13, 27.352]
  - - [3072, 128, 1, 64, 3104, 3104, 3072, 96]
    - [33, 6.877]
  - - [3072, 128, 1, 128, 3104, 3104, 3072, 160]
    - [18, 11.595]
  - - [3072, 128, 1, 256, 3104, 3104, 3072, 288]
    - [19, 17.54]
  - - [3072, 128, 1, 512, 3104, 3104, 3072, 544]
    - [26, 23.741]
  - - [3072, 128, 1, 1024, 3104, 3104, 3072, 1056]
    - [61, 28.734]
  - - [3072, 128, 1, 2048, 3104, 3104, 3072, 2080]
    - [45, 31.015]
  - - [3072, 128, 1, 4096, 3104, 3104, 4128, 4128]
    - [59, 34.046]
  - - [3072, 256, 1, 64, 3104, 3104, 3072, 96]
    - [13, 11.762]
  - - [3072, 256, 1, 128, 3104, 3104, 3072, 160]
    - [55, 19.364]
  - - [3072, 256, 1, 256, 3104, 3104, 3072, 288]
    - [71, 30.762]
  - - [3072, 256, 1, 512, 3104, 3104, 3072, 544]
    - [45, 42.884]
  - - [3072, 256, 1, 1024, 3104, 3104, 3072, 1056]
    - [45, 53.645]
  - - [3072, 256, 1, 2048, 3104, 3104, 3072, 2080]
    - [45, 59.19]
  - - [3072, 256, 1, 4096, 3104, 3104, 4128, 4128]
    - [61, 64.97]
  - - [3072, 512, 1, 64, 3104, 3104, 3072, 96]
    - [26, 18.978]
  - - [3072, 512, 1, 128, 3104, 3104, 3072, 160]
    - [44, 28.916]
  - - [3072, 512, 1, 256, 3104, 3104, 3072, 288]
    - [63, 42.034]
  - - [3072, 512, 1, 512, 3104, 3104, 3072, 544]
    - [65, 52.711]
  - - [3072, 512, 1, 1024, 3104, 3104, 3072, 1056]
    - [63, 57.688]
  - - [3072, 512, 1, 2048, 3104, 3104, 3072, 2080]
    - [62, 63.047]
  - - [3072, 512, 1, 4096, 3104, 3104, 4128, 4128]
    - [46, 66.173]
  - - [3072, 1024, 1, 64, 3104, 3104, 3072, 96]
    - [54, 27.229]
  - - [3072, 1024, 1, 128, 3104, 3104, 3072, 160]
    - [48, 42.459]
  - - [3072, 1024, 1, 256, 3104, 3104, 3072, 288]
    - [48, 56.372]
  - - [3072, 1024, 1, 512, 3104, 3104, 3072, 544]
    - [48, 63.13]
  - - [3072, 1024, 1, 1024, 3104, 3104, 3072, 1056]
    - [65, 70.424]
  - - [3072, 1024, 1, 2048, 3104, 3104, 3072, 2080]
    - [48, 74.834]
  - - [3072, 1024, 1, 4096, 3104, 3104, 4128, 4128]
    - [48, 77.194]
  - - [3072, 2048, 1, 64, 3104, 3104, 3072, 96]
    - [71, 36.637]
  - - [3072, 2048, 1, 128, 3104, 3104, 3072, 160]
    - [65, 54.729]
  - - [3072, 2048, 1, 256, 3104, 3104, 3072, 288]
    - [70, 64.892]
  - - [3072, 2048, 1, 512, 3104, 3104, 3072, 544]
    - [60, 74.071]
  - - [3072, 2048, 1, 1024, 3104, 3104, 3072, 1056]
    - [60, 79.987]
  - - [3072, 2048, 1, 2048, 3104, 3104, 3072, 2080]
    - [60, 83.271]
  - - [3072, 2048, 1, 4096, 3104, 3104, 4128, 4128]
    - [44, 84.052]
  - - [3072, 4096, 1, 64, 3104, 3104, 3072, 96]
    - [69, 44.263]
  - - [3072, 4096, 1, 128, 3104, 3104, 3072, 160]
    - [48, 61.336]
  - - [3072, 4096, 1, 256, 3104, 3104, 3072, 288]
    - [48, 72.577]
  - - [3072, 4096, 1, 512, 3104, 3104, 3072, 544]
    - [44, 79.558]
  - - [3072, 4096, 1, 1024, 3104, 3104, 3072, 1056]
    - [44, 83.57]
  - - [3072, 4096, 1, 2048, 3104, 3104, 3072, 2080]
    - [68, 84.963]
  - - [3072, 4096, 1, 4096, 3104, 3104, 4128, 4128]
    - [44, 86.15]
- null
- null
- DeviceEfficiency
