library/src/blas3/Tensile/Logic/asm_full/aquavanjaram/aquavanjaram_Cijk_Alik_Bljk_SB.yaml
- {MinimumRequiredVersion: 4.20.0}
- aquavanjaram
- gfx940
- [Device 0049]
    SolutionIndex: 0
    SolutionNameMin: Cijk_Alik_Bljk_SB_MT128x128x16_MI32x32x2x1_SN_GRVW4_GLS0_LPA4_LPB4_LRVW4_NEPBS4_NLCB1_PLR9_SU32_SUS256_SVW4_TT4_32_VW4_WG32_8_1_WGM24
    SolutionIndex: 1
    SolutionNameMin: Cijk_Alik_Bljk_SB_MT128x128x16_MI32x32x2x1_SN_GRVW2_GLS1_LPA2_LPB2_LRVW2_NEPBS4_NLCB1_PLR9_SU0_SUS0_SVW2_TT4_32_VW2_WG32_8_1_WGM42
    SolutionIndex: 2
    SolutionNameMin: Cijk_Alik_Bljk_SB_MT256x128x16_MI16x16x4x1_SN_GRVW2_GLS1_LPA2_LPB2_LRVW1_NEPBS4_NLCB1_PLR5_SU32_SUS256_SVW4_TT4_128_VW4_WG64_4_1_WGM36
    SolutionIndex: 3
    SolutionNameMin: Cijk_Alik_Bljk_SB_MT256x128x16_MI16x16x4x1_SN_GRVW2_GLS1_LPA2_LPB2_LRVW1_NEPBS4_NLCB2_PLR5_SU0_SUS0_SVW4_TT4_128_VW4_WG64_4_1_WGM42
    SolutionIndex: 4
    SolutionNameMin: Cijk_Alik_Bljk_SB_MT256x128x16_MI16x16x4x1_SN_GRVW2_GLS1_LPA2_LPB2_LRVW2_NEPBS4_NLCB1_PLR5_SU32_SUS256_SVW4_TT4_128_VW4_WG64_4_1_WGM36
    SolutionIndex: 5
    SolutionNameMin: Cijk_Alik_Bljk_SB_MT128x64x32_MI16x16x4x1_SN_GRVW2_GLS1_LPA2_LPB2_LRVW1_NEPBS0_PLR9_SU0_SUS0_SVW2_TT2_64_VW2_WG64_4_1_WGM42
    SolutionIndex: 6
    SolutionNameMin: Cijk_Alik_Bljk_SB_MT128x64x32_MI16x16x4x1_SN_GRVW2_GLS1_LPA2_LPB2_LRVW1_NEPBS4_PLR9_SU0_SUS0_SVW2_TT2_64_VW2_WG64_4_1_WGM36
    SolutionIndex: 7
    SolutionNameMin: Cijk_Alik_Bljk_SB_MT128x64x16_MI16x16x4x1_SN_GRVW4_LPA4_LPB4_LRVW1_NEPBS0_PLR5_SU32_SUS256_SVW2_TT2_64_VW2_WG64_4_1_WGM36
    SolutionIndex: 8
    SolutionNameMin: Cijk_Alik_Bljk_SB_MT64x64x16_MI16x16x4x1_SN_GRVW4_LPA4_LPB4_LRVW1_NEPBS0_PLR5_SU0_SUS0_SVW2_TT2_32_VW2_WG32_8_1_WGM18
    SolutionIndex: 9
    SolutionNameMin: Cijk_Alik_Bljk_SB_MT64x32x32_MI16x16x4x1_SN_GRVW4_LPA8_LPB8_LRVW4_MIAV0_NEPBS0_PLR9_SS0_SU0_SUS0_SVW4_TT2_16_VW4_WG32_8_1_WGM36
    SolutionIndex: 10
    SolutionNameMin: Cijk_Alik_Bljk_SB_MT64x32x32_MI16x16x4x1_SN_GRVW2_LPA2_LPB2_LRVW2_MIAV0_NEPBS0_PLR9_SS0_SU4_SUS512_SVW4_TT2_16_VW2_WG32_8_1_WGM18
    SolutionIndex: 11
    SolutionNameMin: Cijk_Alik_Bljk_SB_MT64x32x32_MI16x16x4x1_SN_GRVW4_LPA8_LPB8_LRVW4_MIAV1_NEPBS0_PLR9_SS1_SU0_SUS0_SVW2_TT2_16_VW2_WG32_8_1_WGM36
    SolutionIndex: 12
    SolutionNameMin: Cijk_Alik_Bljk_SB_MT64x32x32_MI16x16x4x1_SN_GRVW4_LPA8_LPB8_LRVW4_MIAV0_NEPBS4_PLR9_SS0_SU0_SUS0_SVW4_TT2_16_VW4_WG32_8_1_WGM36
    SolutionIndex: 13
    SolutionNameMin: Cijk_Alik_Bljk_SB_MT64x32x32_MI16x16x4x1_SN_GRVW4_LPA4_LPB4_LRVW1_MIAV0_NEPBS4_PLR9_SS0_SU32_SUS256_SVW4_TT2_16_VW4_WG32_8_1_WGM18
    SolutionIndex: 14
    SolutionNameMin: Cijk_Alik_Bljk_SB_MT64x32x32_MI16x16x4x1_SN_AMAS0_GRVW2_LBSPP0_LPA1_LPB1_LRVW1_NEPBS0_PLR9_SS1_SVW1_TT2_16_TLDS0_UMLDSA0_UMLDSB0_VW1_WG32_8_1_WGM6
    SolutionIndex: 15
    SolutionNameMin: Cijk_Alik_Bljk_SB_MT32x64x32_MI16x16x4x1_SN_AMAS0_GRVW2_LBSPP0_LPA1_LPB1_LRVW1_NEPBS0_PLR9_SS0_SVW4_TT2_16_TLDS0_UMLDSA0_UMLDSB0_VW1_WG16_16_1_WGM12
    SolutionIndex: 16
    SolutionNameMin: Cijk_Alik_Bljk_SB_MT64x32x32_MI16x16x4x1_SN_AMAS0_GRVW1_LBSPP0_LPA1_LPB1_LRVW1_NEPBS0_PLR9_SS1_SVW1_TT1_32_TLDS0_UMLDSA0_UMLDSB0_VW1_WG64_4_1_WGM6
    SolutionIndex: 17
    SolutionNameMin: Cijk_Alik_Bljk_SB_MT64x64x16_MI32x32x2x1_SN_AMAS0_GRVW1_LBSPP0_LPA1_LPB1_LRVW1_NEPBS0_PLR9_SS1_SVW1_TT1_32_TLDS0_UMLDSA0_UMLDSB0_VW1_WG64_4_1_WGM12
    SolutionIndex: 18
    SolutionNameMin: Cijk_Alik_Bljk_SB_MT64x64x16_MI32x32x2x1_SN_AMAS0_GRVW2_LBSPP128_LPA2_LPB2_LRVW2_NEPBS4_PLR9_SS1_SVW1_TT1_32_TLDS1_UMLDSA1_UMLDSB1_VW1_WG64_4_1_WGM6
    SolutionIndex: 19
    SolutionNameMin: Cijk_Alik_Bljk_SB_MT64x64x16_MI32x32x2x1_SN_AMAS0_GRVW1_LBSPP0_LPA1_LPB1_LRVW1_NEPBS0_PLR9_SS1_SVW1_TT1_32_TLDS0_UMLDSA0_UMLDSB0_VW1_WG64_4_1_WGM6
    SolutionIndex: 20
    SolutionNameMin: Cijk_Alik_Bljk_SB_MT32x64x16_MI16x16x4x1_SN_AMAS0_GRVW1_LBSPP128_LPA2_LPB2_LRVW2_NEPBS4_PLR5_SS1_SVW1_TT1_32_TLDS1_UMLDSA1_UMLDSB1_VW1_WG32_8_1_WGM6
    SolutionIndex: 21
    SolutionNameMin: Cijk_Alik_Bljk_SB_MT32x64x32_MI16x16x4x1_SN_AMAS3_GRVW1_LBSPP128_LPA2_LPB2_LRVW1_NEPBS0_PLR9_SS1_SVW2_TT2_16_TLDS1_UMLDSA1_UMLDSB1_VW2_WG16_16_1_WGM6
    SolutionIndex: 22
    SolutionNameMin: Cijk_Alik_Bljk_SB_MT32x64x32_MI16x16x4x1_SN_AMAS0_GRVW1_LBSPP128_LPA2_LPB2_LRVW2_NEPBS4_PLR9_SS1_SVW1_TT1_32_TLDS1_UMLDSA1_UMLDSB1_VW1_WG32_8_1_WGM6
    SolutionIndex: 23
    SolutionNameMin: Cijk_Alik_Bljk_SB_MT32x64x32_MI16x16x4x1_SN_AMAS0_GRVW1_LBSPP0_LPA1_LPB1_LRVW1_NEPBS4_PLR9_SS1_SVW1_TT2_16_TLDS0_UMLDSA0_UMLDSB0_VW1_WG16_16_1_WGM12
    SolutionIndex: 24
    SolutionNameMin: Cijk_Alik_Bljk_SB_MT64x32x32_MI16x16x4x1_SN_AMAS0_GRVW1_LBSPP128_LPA2_LPB2_LRVW1_NEPBS4_PLR9_SS1_SVW1_TT1_32_TLDS1_UMLDSA1_UMLDSB1_VW1_WG64_4_1_WGM6
    SolutionIndex: 25
    SolutionNameMin: Cijk_Alik_Bljk_SB_MT32x64x32_MI16x16x4x1_SN_AMAS0_GRVW1_LBSPP128_LPA2_LPB2_LRVW2_NEPBS0_PLR9_SS1_SVW1_TT2_16_TLDS1_UMLDSA1_UMLDSB1_VW1_WG16_16_1_WGM12
    SolutionIndex: 26
    SolutionNameMin: Cijk_Alik_Bljk_SB_MT128x64x16_MI32x32x2x1_SN_AMAS0_GRVW1_LBSPP0_LPA1_LPB1_LRVW1_NEPBS0_PLR9_SS1_SVW1_TT2_32_TLDS0_UMLDSA0_UMLDSB0_VW1_WG64_4_1_WGM6
    SolutionIndex: 27
    SolutionNameMin: Cijk_Alik_Bljk_SB_MT32x64x32_MI16x16x4x1_SN_AMAS3_GRVW1_LBSPP0_LPA2_LPB2_LRVW1_NEPBS4_PLR9_SS1_SVW2_TT2_16_TLDS0_UMLDSA0_UMLDSB0_VW2_WG16_16_1_WGM12
    SolutionIndex: 28
    SolutionNameMin: Cijk_Alik_Bljk_SB_MT32x64x32_MI16x16x4x1_SN_AMAS3_GRVW1_LBSPP0_LPA2_LPB2_LRVW1_NEPBS0_PLR9_SS1_SVW2_TT2_16_TLDS0_UMLDSA0_UMLDSB0_VW2_WG16_16_1_WGM6
    SolutionIndex: 29
    SolutionNameMin: Cijk_Alik_Bljk_SB_MT64x64x16_MI32x32x2x1_SN_AMAS0_GRVW1_LBSPP128_LPA2_LPB2_LRVW2_NEPBS0_PLR9_SS1_SVW1_TT1_32_TLDS1_UMLDSA1_UMLDSB1_VW1_WG64_4_1_WGM6
    SolutionIndex: 30
    SolutionNameMin: Cijk_Alik_Bljk_SB_MT64x32x32_MI16x16x4x1_SN_AMAS3_GRVW1_LBSPP128_LPA2_LPB2_LRVW2_NEPBS0_PLR9_SS1_SVW2_TT2_16_TLDS1_UMLDSA1_UMLDSB1_VW2_WG32_8_1_WGM6
    SolutionIndex: 31
    SolutionNameMin: Cijk_Alik_Bljk_SB_MT32x64x32_MI16x16x4x1_SN_AMAS3_GRVW1_LBSPP0_LPA2_LPB2_LRVW1_NEPBS4_PLR9_SS1_SVW2_TT2_16_TLDS0_UMLDSA0_UMLDSB0_VW2_WG16_16_1_WGM6
    SolutionIndex: 32
    SolutionNameMin: Cijk_Alik_Bljk_SB_MT32x64x32_MI16x16x4x1_SN_AMAS3_GRVW4_LBSPP0_LPA2_LPB2_LRVW1_NEPBS0_PLR9_SS1_SVW2_TT2_16_TLDS0_UMLDSA0_UMLDSB0_VW2_WG16_16_1_WGM6
    SolutionIndex: 33
    SolutionNameMin: Cijk_Alik_Bljk_SB_MT64x64x16_MI16x16x4x1_SN_AMAS3_GRVW1_LBSPP128_LPA2_LPB2_LRVW1_NEPBS0_PLR5_SS1_SVW2_TT2_32_TLDS1_UMLDSA1_UMLDSB1_VW2_WG32_8_1_WGM12
    SolutionIndex: 34
    SolutionNameMin: Cijk_Alik_Bljk_SB_MT64x64x16_MI16x16x4x1_SN_AMAS3_GRVW1_LBSPP128_LPA2_LPB2_LRVW2_NEPBS0_PLR5_SS1_SVW2_TT2_32_TLDS1_UMLDSA1_UMLDSB1_VW2_WG32_8_1_WGM12
    SolutionIndex: 35
    SolutionNameMin: Cijk_Alik_Bljk_SB_MT64x64x16_MI16x16x4x1_SN_AMAS3_GRVW2_LBSPP128_LPA2_LPB2_LRVW2_NEPBS4_PLR5_SS1_SVW2_TT2_32_TLDS1_UMLDSA1_UMLDSB1_VW2_WG32_8_1_WGM6
    SolutionIndex: 36
    SolutionNameMin: Cijk_Alik_Bljk_SB_MT64x64x16_MI16x16x4x1_SN_AMAS3_GRVW1_LBSPP0_LPA2_LPB2_LRVW1_NEPBS0_PLR5_SS1_SVW2_TT2_32_TLDS0_UMLDSA0_UMLDSB0_VW2_WG32_8_1_WGM6
    SolutionIndex: 37
    SolutionNameMin: Cijk_Alik_Bljk_SB_MT32x64x16_MI16x16x4x1_SN_AMAS3_GRVW2_LBSPP128_LPA2_LPB2_LRVW2_NEPBS4_PLR5_SS1_SVW2_TT2_16_TLDS1_UMLDSA1_UMLDSB1_VW2_WG16_16_1_WGM12
    SolutionIndex: 38
    SolutionNameMin: Cijk_Alik_Bljk_SB_MT64x64x32_MI16x16x4x1_SN_AMAS3_GRVW4_LBSPP0_LPA2_LPB2_LRVW1_NEPBS0_PLR9_SS1_SVW2_TT2_32_TLDS0_UMLDSA0_UMLDSB0_VW2_WG32_8_1_WGM6
    SolutionIndex: 39
    SolutionNameMin: Cijk_Alik_Bljk_SB_MT32x64x32_MI16x16x4x1_SN_AMAS3_GRVW1_LBSPP0_LPA2_LPB2_LRVW1_NEPBS0_PLR9_SS1_SVW2_TT2_16_TLDS0_UMLDSA0_UMLDSB0_VW2_WG16_16_1_WGM12
    SolutionIndex: 40
    SolutionNameMin: Cijk_Alik_Bljk_SB_MT32x64x32_MI16x16x4x1_SN_AMAS3_GRVW2_LBSPP128_LPA2_LPB2_LRVW1_NEPBS4_PLR9_SS1_SVW2_TT2_16_TLDS1_UMLDSA1_UMLDSB1_VW2_WG16_16_1_WGM6
    SolutionIndex: 41
    SolutionNameMin: Cijk_Alik_Bljk_SB_MT32x64x16_MI16x16x4x1_SN_AMAS3_GRVW2_LBSPP128_LPA2_LPB2_LRVW2_NEPBS0_PLR5_SS1_SVW2_TT2_16_TLDS1_UMLDSA1_UMLDSB1_VW2_WG16_16_1_WGM12
    SolutionIndex: 42
    SolutionNameMin: Cijk_Alik_Bljk_SB_MT32x64x16_MI16x16x4x1_SN_AMAS3_GRVW1_LBSPP128_LPA2_LPB2_LRVW2_NEPBS0_PLR5_SS1_SVW2_TT2_16_TLDS1_UMLDSA1_UMLDSB1_VW2_WG16_16_1_WGM6
    SolutionIndex: 43
    SolutionNameMin: Cijk_Alik_Bljk_SB_MT32x64x32_MI16x16x4x1_SN_AMAS0_GRVW4_LBSPP128_LPA4_LPB4_LRVW2_NEPBS0_PLR9_SS1_SVW1_TT2_16_TLDS1_UMLDSA1_UMLDSB1_VW1_WG16_16_1_WGM12
    SolutionIndex: 44
    SolutionNameMin: Cijk_Alik_Bljk_SB_MT32x64x16_MI16x16x4x1_SN_AMAS3_GRVW2_LBSPP128_LPA2_LPB2_LRVW2_NEPBS4_PLR5_SS1_SVW2_TT2_16_TLDS1_UMLDSA1_UMLDSB1_VW2_WG16_16_1_WGM6
    SolutionIndex: 45
    SolutionNameMin: Cijk_Alik_Bljk_SB_MT128x64x16_MI32x32x2x1_SN_AMAS3_GRVW2_LBSPP0_LPA2_LPB2_LRVW1_NEPBS0_PLR9_SS1_SVW2_TT2_32_TLDS0_UMLDSA0_UMLDSB0_VW2_WG64_4_1_WGM12
    SolutionIndex: 46
    SolutionNameMin: Cijk_Alik_Bljk_SB_MT128x64x32_MI16x16x4x1_SN_AMAS3_GRVW2_LBSPP128_LPA2_LPB2_LRVW1_NEPBS0_PLR9_SS1_SVW2_TT2_64_TLDS1_UMLDSA1_UMLDSB1_VW2_WG64_4_1_WGM12
    SolutionIndex: 47
    SolutionNameMin: Cijk_Alik_Bljk_SB_MT32x64x32_MI16x16x4x1_SN_AMAS3_GRVW2_LBSPP0_LPA2_LPB2_LRVW1_NEPBS0_PLR9_SS1_SVW2_TT2_16_TLDS0_UMLDSA0_UMLDSB0_VW2_WG16_16_1_WGM12
    SolutionIndex: 48
    SolutionNameMin: Cijk_Alik_Bljk_SB_MT32x64x32_MI16x16x4x1_SN_AMAS0_GRVW4_LBSPP0_LPA1_LPB1_LRVW1_NEPBS0_PLR9_SS1_SVW1_TT1_32_TLDS0_UMLDSA0_UMLDSB0_VW1_WG32_8_1_WGM6
    SolutionIndex: 49
    SolutionNameMin: Cijk_Alik_Bljk_SB_MT64x32x32_MI16x16x4x1_SN_AMAS3_GRVW2_LBSPP128_LPA2_LPB2_LRVW1_NEPBS0_PLR9_SS1_SVW2_TT2_16_TLDS1_UMLDSA1_UMLDSB1_VW2_WG32_8_1_WGM6
    SolutionIndex: 50
    SolutionNameMin: Cijk_Alik_Bljk_SB_MT64x32x32_MI16x16x4x1_SN_AMAS3_GRVW1_LBSPP128_LPA2_LPB2_LRVW1_NEPBS0_PLR9_SS1_SVW2_TT2_16_TLDS1_UMLDSA1_UMLDSB1_VW2_WG32_8_1_WGM12
    SolutionIndex: 51
    SolutionNameMin: Cijk_Alik_Bljk_SB_MT64x32x32_MI16x16x4x1_SN_AMAS3_GRVW4_LBSPP0_LPA2_LPB2_LRVW1_NEPBS0_PLR9_SS1_SVW2_TT2_16_TLDS0_UMLDSA0_UMLDSB0_VW2_WG32_8_1_WGM6
    SolutionIndex: 52
    SolutionNameMin: Cijk_Alik_Bljk_SB_MT64x64x16_MI32x32x2x1_SN_AMAS0_GRVW2_LBSPP128_LPA2_LPB2_LRVW1_NEPBS0_PLR9_SS1_SVW1_TT1_32_TLDS1_UMLDSA1_UMLDSB1_VW1_WG64_4_1_WGM12
    SolutionIndex: 53
    SolutionNameMin: Cijk_Alik_Bljk_SB_MT128x128x32_MI16x16x4x1_SN_AMAS3_GRVW4_GLS0_LPA8_LPB8_LRVW4_MIAV0_NEPBS0_PLR9_SS0_SU0_SUS0_SVW4_TT8_32_VW4_WG16_16_1_WGM4
    SolutionIndex: 54
    SolutionNameMin: Cijk_Alik_Bljk_SB_MT128x128x32_MI16x16x4x1_SN_AMAS3_GRVW4_GLS1_LPA4_LPB4_LRVW1_MIAV0_NEPBS4_PLR9_SS0_SU0_SUS0_SVW4_TT4_64_VW4_WG32_8_1_WGM4
    SolutionIndex: 55
    SolutionNameMin: Cijk_Alik_Bljk_SB_MT128x128x32_MI16x16x4x1_SN_AMAS3_GRVW4_GLS1_LPA8_LPB8_LRVW4_MIAV0_NEPBS4_PLR9_SS0_SU0_SUS0_SVW4_TT2_128_VW2_WG64_4_1_WGM10
    SolutionIndex: 56
    SolutionNameMin: Cijk_Alik_Bljk_SB_MT128x128x32_MI16x16x4x1_SN_AMAS3_GRVW4_GLS1_LPA8_LPB8_LRVW4_MIAV1_NEPBS4_PLR9_SS0_SU0_SUS0_SVW4_TT2_128_VW4_WG64_4_1_WGM36
    SolutionIndex: 57
    SolutionNameMin: Cijk_Alik_Bljk_SB_MT128x128x32_MI16x16x4x1_SN_AMAS3_GRVW4_GLS0_LPA8_LPB8_LRVW4_MIAV1_NEPBS0_PLR9_SS0_SU0_SUS0_SVW4_TT4_64_VW2_WG32_8_1_WGM2
    SolutionIndex: 58
    SolutionNameMin: Cijk_Alik_Bljk_SB_MT128x128x32_MI16x16x4x1_SN_AMAS3_GRVW4_GLS1_LPA8_LPB8_LRVW4_MIAV1_NEPBS4_PLR9_SS0_SU0_SUS0_SVW4_TT2_128_VW2_WG64_4_1_WGM2
    SolutionIndex: 59
    SolutionNameMin: Cijk_Alik_Bljk_SB_MT128x128x32_MI16x16x4x1_SN_AMAS0_GRVW4_GLS0_LPA8_LPB8_LRVW4_MIAV1_NEPBS4_PLR9_SS0_SU0_SUS0_SVW4_TT2_128_VW1_WG64_4_1_WGM42
    SolutionIndex: 60
    SolutionNameMin: Cijk_Alik_Bljk_SB_MT128x128x32_MI16x16x4x1_SN_AMAS3_GRVW4_GLS1_LPA8_LPB8_LRVW4_MIAV1_NEPBS4_PLR9_SS0_SU32_SUS256_SVW4_TT4_64_VW4_WG32_8_1_WGM30
    SolutionIndex: 61
    SolutionNameMin: Cijk_Alik_Bljk_SB_MT256x256x16_MI16x16x4x1_SN_1LDSB1_AMAS3_GRVW4_LPA4_LPB4_LRVW1_PLR5_SS1_SU32_SUS256_SPO0_SSO0_SVW2_TT8_128_VW2_WG32_8_1_WGM36
    SolutionIndex: 62
    SolutionNameMin: Cijk_Alik_Bljk_SB_MT256x256x16_MI16x16x4x1_SN_1LDSB1_AMAS3_GRVW4_LPA4_LPB4_LRVW1_PLR5_SS1_SU32_SUS256_SPO1_SSO8_SVW2_TT8_128_VW2_WG32_8_1_WGM6
    SolutionIndex: 63
    SolutionNameMin: Cijk_Alik_Bljk_SB_MT256x256x16_MI16x16x4x1_SN_1LDSB1_AMAS0_GRVW4_LPA4_LPB4_LRVW1_PLR5_SS0_SU32_SUS256_SPO0_SSO8_SVW4_TT8_128_VW1_WG32_8_1_WGM36
    SolutionIndex: 64
    SolutionNameMin: Cijk_Alik_Bljk_SB_MT256x128x32_MI16x16x4x1_SN_1LDSB1_AMAS3_GRVW4_LPA8_LPB8_LRVW4_PLR9_SS1_SU0_SUS0_SPO1_SSO8_SVW2_TT4_128_VW2_WG64_4_1_WGM42
    SolutionIndex: 65
    SolutionNameMin: Cijk_Alik_Bljk_SB_MT256x256x16_MI16x16x4x1_SN_1LDSB1_AMAS3_GRVW4_LPA4_LPB4_LRVW1_PLR1_SS1_SU32_SUS256_SPO0_SSO8_SVW2_TT8_128_VW2_WG32_8_1_WGM6
    SolutionIndex: 66
    SolutionNameMin: Cijk_Alik_Bljk_SB_MT256x256x16_MI16x16x4x1_SN_1LDSB1_AMAS0_GRVW4_LPA4_LPB4_LRVW1_PLR1_SS1_SU32_SUS256_SPO0_SSO0_SVW1_TT8_128_VW1_WG32_8_1_WGM18
    SolutionIndex: 67
    SolutionNameMin: Cijk_Alik_Bljk_SB_MT256x256x16_MI16x16x4x1_SN_1LDSB1_AMAS0_GRVW4_LPA4_LPB4_LRVW1_PLR1_SS1_SU0_SUS0_SPO0_SSO0_SVW1_TT8_128_VW1_WG32_8_1_WGM18
    SolutionIndex: 68
    SolutionNameMin: Cijk_Alik_Bljk_SB_MT128x256x32_MI16x16x4x1_SN_1LDSB1_AMAS3_GRVW4_LPA8_LPB8_LRVW4_PLR9_SS0_SU0_SUS0_SPO1_SSO8_SVW4_TT8_64_VW4_WG16_16_1_WGM36
- - - [6144, 4864, 1, 512]
    - [0, 91.517]
  - - [4864, 3072, 1, 4096]
    - [68, 95.79]
  - - [7296, 4608, 1, 4096]
    - [1, 98.076]
  - - [9728, 6144, 1, 4096]
    - [2, 98.629]
  - - [16384, 16384, 1, 4096]
    - [3, 98.811]
  - - [19456, 18432, 1, 512]
    - [4, 95.586]
  - - [4094, 4094, 1, 2046]
    - [5, 93.773]
  - - [4096, 4096, 1, 2048]
    - [6, 96.249]
  - - [1031, 1031, 1, 1031]
    - [13, 43.762]
  - - [2047, 2047, 1, 2047]
    - [8, 72.991]
  - - [4095, 4095, 1, 2047]
    - [7, 87.798]
  - - [1030, 1030, 1, 1030]
    - [9, 49.297]
  - - [1032, 1032, 1, 1032]
    - [10, 48.448]
  - - [2046, 2046, 1, 2046]
    - [11, 82.284]
  - - [2048, 2048, 1, 2048]
    - [12, 87.964]
  - - [64, 1, 1000, 64]
    - [14, 0.563]
  - - [1, 64, 1000, 64]
    - [15, 0.553]
  - - [31, 31, 1000, 31]
    - [16, 4.234]
  - - [33, 33, 1000, 33]
    - [17, 3.928]
  - - [47, 47, 1000, 47]
    - [18, 8.473]
  - - [49, 49, 1000, 49]
    - [19, 9.39]
  - - [63, 63, 128, 63]
    - [20, 5.66]
  - - [65, 65, 128, 65]
    - [21, 5.078]
  - - [79, 79, 128, 79]
    - [22, 7.845]
  - - [81, 81, 128, 81]
    - [23, 8.003]
  - - [95, 95, 64, 95]
    - [24, 8.235]
  - - [97, 97, 64, 97]
    - [25, 8.005]
  - - [127, 127, 64, 127]
    - [26, 14.748]
  - - [129, 129, 64, 129]
    - [27, 13.355]
  - - [255, 255, 16, 255]
    - [28, 23.422]
  - - [257, 257, 16, 257]
    - [29, 22.283]
  - - [511, 511, 16, 511]
    - [19, 59.256]
  - - [513, 513, 16, 513]
    - [30, 52.642]
  - - [30, 30, 1000, 30]
    - [31, 4.49]
  - - [32, 32, 1000, 32]
    - [32, 5.778]
  - - [34, 34, 1000, 34]
    - [33, 4.633]
  - - [46, 46, 1000, 46]
    - [34, 8.68]
  - - [48, 48, 1000, 48]
    - [35, 10.994]
  - - [50, 50, 1000, 50]
    - [36, 10.108]
  - - [62, 62, 128, 62]
    - [37, 5.723]
  - - [64, 64, 128, 64]
    - [38, 6.814]
  - - [66, 66, 128, 66]
    - [39, 5.591]
  - - [78, 78, 128, 78]
    - [40, 8.27]
  - - [80, 80, 128, 80]
    - [41, 9.444]
  - - [82, 82, 128, 82]
    - [40, 9.26]
  - - [94, 94, 64, 94]
    - [42, 8.793]
  - - [96, 96, 64, 96]
    - [43, 9.927]
  - - [98, 98, 64, 98]
    - [44, 9.063]
  - - [126, 126, 64, 126]
    - [45, 15.883]
  - - [128, 128, 64, 128]
    - [46, 17.686]
  - - [130, 130, 64, 130]
    - [47, 14.64]
  - - [254, 254, 16, 254]
    - [31, 22.565]
  - - [256, 256, 16, 256]
    - [48, 27.53]
  - - [258, 258, 16, 258]
    - [49, 21.03]
  - - [510, 510, 16, 510]
    - [50, 61.838]
  - - [512, 512, 16, 512]
    - [51, 67.078]
  - - [514, 514, 16, 514]
    - [52, 55.847]
  - - [4864, 768, 1, 4096]
    - [53, 94.6]
  - - [4864, 768, 1, 8192]
    - [54, 97.35]
  - - [2432, 1536, 1, 4096]
    - [55, 94.8]
  - - [2432, 1536, 1, 8192]
    - [56, 96.69]
  - - [1536, 2432, 1, 4096]
    - [57, 94.24]
  - - [1536, 2432, 1, 8192]
    - [58, 97.18]
  - - [768, 4864, 1, 4096]
    - [59, 94.8]
  - - [768, 4864, 1, 8192]
    - [60, 97.0]
  - - [4864, 3072, 1, 2048]
    - [61, 94.37]
  - - [4864, 3072, 1, 6144]
    - [62, 97.8]
  - - [4864, 3072, 1, 8192]
    - [63, 98.13]
  - - [3072, 4864, 1, 2048]
    - [64, 93.01]
  - - [3072, 4864, 1, 4096]
    - [65, 96.82]
  - - [3072, 4864, 1, 6144]
    - [66, 96.84]
  - - [3072, 4864, 1, 8192]
    - [67, 97.33]
- null
