library/src/blas3/Tensile/Logic/asm_full/aquavanjaram/aquavanjaram_Cijk_Ailk_Bljk_SB_GB.yaml
- {MinimumRequiredVersion: 4.37.0}
- aquavanjaram
- gfx940
- [Device 0049, Device 0050]
    SolutionIndex: 0
    SolutionNameMin: Cijk_Ailk_Bljk_SB_GB_MT64x64x16_MI32x32x2x1_SN_AMAS0_DTVA0_GRVW2_LBSPP128_LPB2_LRVW1_NEPBS0_NLCA1_PLR9_SVW1_TT1_32_TLDS1_UMLDSB1_VW1_WG64_4_1_WGM6
    SolutionIndex: 1
    SolutionNameMin: Cijk_Ailk_Bljk_SB_GB_MT128x128x16_MI32x32x2x1_SN_AMAS3_DTVA0_GRVW1_LBSPP128_LPB2_LRVW2_NEPBS0_NLCA1_PLR9_SVW2_TT2_64_TLDS1_UMLDSB1_VW2_WG64_4_1_WGM6
    SolutionIndex: 2
    SolutionNameMin: Cijk_Ailk_Bljk_SB_GB_MT64x64x32_MI32x32x2x1_SN_AMAS0_DTVA0_GRVW1_LBSPP128_LPB2_LRVW2_NEPBS0_NLCA1_PLR17_SVW1_TT1_32_TLDS1_UMLDSB1_VW1_WG64_4_1_WGM12
    SolutionIndex: 3
    SolutionNameMin: Cijk_Ailk_Bljk_SB_GB_MT128x64x32_MI32x32x2x1_SN_AMAS3_DTVA0_GRVW1_LBSPP128_LPB1_LRVW1_NEPBS0_NLCA1_PLR17_SVW2_TT2_32_TLDS1_UMLDSB1_VW2_WG64_4_1_WGM12
    SolutionIndex: 4
    SolutionNameMin: Cijk_Ailk_Bljk_SB_GB_MT64x64x16_MI32x32x2x1_SN_AMAS0_DTVA0_GRVW1_LBSPP128_LPB1_LRVW1_NEPBS4_NLCA1_PLR9_SVW1_TT1_32_TLDS1_UMLDSB1_VW1_WG64_4_1_WGM6
    SolutionIndex: 5
    SolutionNameMin: Cijk_Ailk_Bljk_SB_GB_MT64x64x16_MI32x32x2x1_SN_AMAS0_DTVA0_GRVW4_LBSPP128_LPB4_LRVW1_NEPBS4_NLCA1_PLR9_SVW1_TT1_32_TLDS1_UMLDSB1_VW1_WG64_4_1_WGM18
    SolutionIndex: 6
    SolutionNameMin: Cijk_Ailk_Bljk_SB_GB_MT128x128x16_MI32x32x2x1_SN_AMAS3_DTVA0_GRVW1_LBSPP128_LPB4_LRVW4_NEPBS4_NLCA1_PLR9_SVW2_TT2_64_TLDS1_UMLDSB1_VW2_WG64_4_1_WGM6
    SolutionIndex: 7
    SolutionNameMin: Cijk_Ailk_Bljk_SB_GB_MT64x64x16_MI32x32x2x1_SN_AMAS0_DTVA0_GRVW1_LBSPP128_LPB4_LRVW4_NEPBS0_NLCA1_PLR9_SVW1_TT1_32_TLDS1_UMLDSB1_VW1_WG64_4_1_WGM6
    SolutionIndex: 8
    SolutionNameMin: Cijk_Ailk_Bljk_SB_GB_MT64x64x16_MI32x32x2x1_SN_AMAS0_DTVA0_GRVW1_LBSPP0_LPB1_LRVW1_NEPBS0_NLCA1_PLR9_SVW1_TT1_32_TLDS0_UMLDSB0_VW1_WG64_4_1_WGM6
    SolutionIndex: 9
    SolutionNameMin: Cijk_Ailk_Bljk_SB_GB_MT128x64x32_MI32x32x2x1_SN_AMAS3_DTVA0_GRVW2_LBSPP0_LPB2_LRVW1_NEPBS0_NLCA1_PLR17_SVW2_TT2_32_TLDS0_UMLDSB0_VW2_WG64_4_1_WGM12
    SolutionIndex: 10
    SolutionNameMin: Cijk_Ailk_Bljk_SB_GB_MT64x64x16_MI32x32x2x1_SN_AMAS0_DTVA0_GRVW4_LBSPP128_LPB4_LRVW1_NEPBS4_NLCA1_PLR9_SVW1_TT1_32_TLDS1_UMLDSB1_VW1_WG64_4_1_WGM12
    SolutionIndex: 11
    SolutionNameMin: Cijk_Ailk_Bljk_SB_GB_MT128x128x16_MI32x32x2x1_SN_AMAS3_DTVA0_GRVW2_LBSPP128_LPB2_LRVW2_NEPBS0_NLCA1_PLR9_SVW2_TT2_64_TLDS1_UMLDSB1_VW2_WG64_4_1_WGM12
    SolutionIndex: 12
    SolutionNameMin: Cijk_Ailk_Bljk_SB_GB_MT64x64x16_MI32x32x2x1_SN_AMAS0_DTVA0_GRVW1_LBSPP0_LPB1_LRVW1_NEPBS4_NLCA1_PLR9_SVW1_TT1_32_TLDS0_UMLDSB0_VW1_WG64_4_1_WGM18
    SolutionIndex: 13
    SolutionNameMin: Cijk_Ailk_Bljk_SB_GB_MT128x128x16_MI16x16x4x1_SN_AMAS3_DTVA0_GRVW2_LBSPP0_LPB2_LRVW1_NEPBS4_NLCA1_PLR1_SVW2_TT4_64_TLDS0_UMLDSB0_VW2_WG32_8_1_WGM12
    SolutionIndex: 14
    SolutionNameMin: Cijk_Ailk_Bljk_SB_GB_MT64x64x16_MI32x32x2x1_SN_AMAS0_DTVA0_GRVW4_LBSPP128_LPB4_LRVW1_NEPBS4_NLCA1_PLR9_SVW1_TT1_32_TLDS1_UMLDSB1_VW1_WG64_4_1_WGM18
    SolutionIndex: 15
    SolutionNameMin: Cijk_Ailk_Bljk_SB_GB_MT64x64x16_MI32x32x2x1_SN_AMAS0_DTVA0_GRVW1_LBSPP128_LPB1_LRVW1_NEPBS0_NLCA1_PLR9_SVW1_TT1_32_TLDS1_UMLDSB1_VW1_WG64_4_1_WGM6
    SolutionIndex: 16
    SolutionNameMin: Cijk_Ailk_Bljk_SB_GB_MT64x64x16_MI32x32x2x1_SN_AMAS0_DTVA0_GRVW4_LBSPP128_LPB4_LRVW1_NEPBS0_NLCA1_PLR9_SVW1_TT1_32_TLDS1_UMLDSB1_VW1_WG64_4_1_WGM6
    SolutionIndex: 17
    SolutionNameMin: Cijk_Ailk_Bljk_SB_GB_MT64x64x16_MI32x32x2x1_SN_AMAS0_DTVA0_GRVW1_LBSPP0_LPB1_LRVW1_NEPBS0_NLCA1_PLR9_SVW1_TT1_32_TLDS0_UMLDSB0_VW1_WG64_4_1_WGM6
    SolutionIndex: 18
    SolutionNameMin: Cijk_Ailk_Bljk_SB_GB_MT128x64x32_MI32x32x2x1_SN_AMAS3_DTVA0_GRVW4_LBSPP0_LPB2_LRVW1_NEPBS0_NLCA1_PLR17_SVW2_TT2_32_TLDS0_UMLDSB0_VW2_WG64_4_1_WGM12
    SolutionIndex: 19
    SolutionNameMin: Cijk_Ailk_Bljk_SB_GB_MT128x64x16_MI32x32x2x1_SN_AMAS0_DTVA0_GRVW4_LBSPP128_LPB4_LRVW1_NEPBS0_NLCA1_PLR9_SVW1_TT2_32_TLDS1_UMLDSB1_VW1_WG64_4_1_WGM6
    SolutionIndex: 20
    SolutionNameMin: Cijk_Ailk_Bljk_SB_GB_MT64x64x16_MI32x32x2x1_SN_AMAS0_DTVA0_GRVW4_LBSPP128_LPB4_LRVW1_NEPBS4_NLCA1_PLR9_SVW1_TT1_32_TLDS1_UMLDSB1_VW1_WG64_4_1_WGM6
    SolutionIndex: 21
    SolutionNameMin: Cijk_Ailk_Bljk_SB_GB_MT128x128x16_MI32x32x2x1_SN_AMAS3_DTVA0_GRVW1_LBSPP128_LPB2_LRVW2_NEPBS0_NLCA1_PLR9_SVW2_TT2_64_TLDS1_UMLDSB1_VW2_WG64_4_1_WGM12
    SolutionIndex: 22
    SolutionNameMin: Cijk_Ailk_Bljk_SB_GB_MT128x128x16_MI16x16x4x1_SN_AMAS3_DTVA0_GRVW4_LBSPP128_LPB4_LRVW1_NEPBS4_NLCA1_PLR1_SVW2_TT8_32_TLDS1_UMLDSB1_VW2_WG16_16_1_WGM12
    SolutionIndex: 23
    SolutionNameMin: Cijk_Ailk_Bljk_SB_GB_MT64x64x16_MI32x32x2x1_SN_AMAS0_DTVA0_GRVW4_LBSPP128_LPB4_LRVW1_NEPBS0_NLCA1_PLR9_SVW1_TT1_32_TLDS1_UMLDSB1_VW1_WG64_4_1_WGM18
    SolutionIndex: 24
    SolutionNameMin: Cijk_Ailk_Bljk_SB_GB_MT128x128x16_MI16x16x4x1_SN_AMAS3_DTVA0_GRVW2_LBSPP0_LPB2_LRVW1_NEPBS4_NLCA1_PLR1_SVW2_TT4_64_TLDS0_UMLDSB0_VW2_WG32_8_1_WGM12
    SolutionIndex: 25
    SolutionNameMin: Cijk_Ailk_Bljk_SB_GB_MT128x128x16_MI16x16x4x1_SN_AMAS3_DTVA0_GRVW4_LBSPP128_LPB4_LRVW2_NEPBS4_NLCA1_PLR5_SVW2_TT8_32_TLDS1_UMLDSB1_VW2_WG16_16_1_WGM12
    SolutionIndex: 26
    SolutionNameMin: Cijk_Ailk_Bljk_SB_GB_MT64x32x16_MI16x16x4x1_SN_AMAS0_DTVA1_GRVW1_LBSPP128_LPB2_LRVW2_NEPBS0_NLCA1_PLR5_SS0_SVW4_TT1_32_TLDS1_UMLDSB1_VW1_WG64_4_1_WGM12
    SolutionIndex: 27
    SolutionNameMin: Cijk_Ailk_Bljk_SB_GB_MT32x64x32_MI16x16x4x1_SN_AMAS0_DTVA0_GRVW1_LBSPP0_LPB1_LRVW1_NEPBS4_NLCA1_PLR9_SS0_SVW4_TT2_16_TLDS0_UMLDSB0_VW1_WG16_16_1_WGM12
    SolutionIndex: 28
    SolutionNameMin: Cijk_Ailk_Bljk_SB_GB_MT32x64x32_MI16x16x4x1_SN_AMAS0_DTVA0_GRVW1_LBSPP0_LPB1_LRVW1_NEPBS4_NLCA1_PLR9_SS1_SVW1_TT2_16_TLDS0_UMLDSB0_VW1_WG16_16_1_WGM6
    SolutionIndex: 29
    SolutionNameMin: Cijk_Ailk_Bljk_SB_GB_MT64x64x16_MI32x32x2x1_SN_AMAS0_DTVA0_GRVW1_LBSPP128_LPB2_LRVW2_NEPBS4_NLCA1_PLR9_SS1_SVW1_TT1_32_TLDS1_UMLDSB1_VW1_WG64_4_1_WGM12
    SolutionIndex: 30
    SolutionNameMin: Cijk_Ailk_Bljk_SB_GB_MT64x64x16_MI32x32x2x1_SN_AMAS0_DTVA0_GRVW1_LBSPP128_LPB1_LRVW1_NEPBS4_NLCA1_PLR9_SS1_SVW1_TT1_32_TLDS1_UMLDSB1_VW1_WG64_4_1_WGM12
    SolutionIndex: 31
    SolutionNameMin: Cijk_Ailk_Bljk_SB_GB_MT64x64x16_MI32x32x2x1_SN_AMAS0_DTVA0_GRVW1_LBSPP128_LPB1_LRVW1_NEPBS0_NLCA1_PLR9_SS1_SVW1_TT1_32_TLDS1_UMLDSB1_VW1_WG64_4_1_WGM6
    SolutionIndex: 32
    SolutionNameMin: Cijk_Ailk_Bljk_SB_GB_MT64x32x32_MI16x16x4x1_SN_AMAS0_DTVA0_GRVW1_LBSPP128_LPB2_LRVW2_NEPBS0_NLCA1_PLR9_SS1_SVW1_TT1_32_TLDS1_UMLDSB1_VW1_WG64_4_1_WGM6
    SolutionIndex: 33
    SolutionNameMin: Cijk_Ailk_Bljk_SB_GB_MT64x32x32_MI16x16x4x1_SN_AMAS3_DTVA0_GRVW1_LBSPP128_LPB2_LRVW1_NEPBS0_NLCA1_PLR9_SS1_SVW2_TT2_16_TLDS1_UMLDSB1_VW2_WG32_8_1_WGM6
    SolutionIndex: 34
    SolutionNameMin: Cijk_Ailk_Bljk_SB_GB_MT64x64x16_MI16x16x4x1_SN_AMAS0_DTVA1_GRVW1_LBSPP128_LPB2_LRVW2_NEPBS4_NLCA1_PLR5_SS1_SVW1_TT1_64_TLDS1_UMLDSB1_VW1_WG64_4_1_WGM6
    SolutionIndex: 35
    SolutionNameMin: Cijk_Ailk_Bljk_SB_GB_MT64x64x16_MI16x16x4x1_SN_AMAS0_DTVA0_GRVW2_LBSPP128_LPB2_LRVW1_NEPBS0_NLCA1_PLR5_SS1_SVW1_TT2_32_TLDS1_UMLDSB1_VW1_WG32_8_1_WGM6
    SolutionIndex: 36
    SolutionNameMin: Cijk_Ailk_Bljk_SB_GB_MT32x64x16_MI16x16x4x1_SN_AMAS0_DTVA0_GRVW1_LBSPP128_LPB2_LRVW2_NEPBS0_NLCA1_PLR5_SS1_SVW1_TT1_32_TLDS1_UMLDSB1_VW1_WG32_8_1_WGM12
    SolutionIndex: 37
    SolutionNameMin: Cijk_Ailk_Bljk_SB_GB_MT128x64x16_MI32x32x2x1_SN_AMAS0_DTVA0_GRVW1_LBSPP128_LPB2_LRVW2_NEPBS0_NLCA1_PLR9_SS1_SVW1_TT2_32_TLDS1_UMLDSB1_VW1_WG64_4_1_WGM6
    SolutionIndex: 38
    SolutionNameMin: Cijk_Ailk_Bljk_SB_GB_MT64x64x16_MI32x32x2x1_SN_AMAS0_DTVA0_GRVW1_LBSPP0_LPB1_LRVW1_NEPBS0_NLCA1_PLR9_SS1_SVW1_TT1_32_TLDS0_UMLDSB0_VW1_WG64_4_1_WGM6
    SolutionIndex: 39
    SolutionNameMin: Cijk_Ailk_Bljk_SB_GB_MT64x64x16_MI32x32x2x1_SN_AMAS0_DTVA0_GRVW1_LBSPP0_LPB1_LRVW1_NEPBS0_NLCA1_PLR9_SS1_SVW1_TT1_32_TLDS0_UMLDSB0_VW1_WG64_4_1_WGM12
    SolutionIndex: 40
    SolutionNameMin: Cijk_Ailk_Bljk_SB_GB_MT64x32x16_MI16x16x4x1_SN_AMAS0_DTVA0_GRVW4_LBSPP128_LPB4_LRVW2_NEPBS0_NLCA1_PLR5_SS1_SVW1_TT1_32_TLDS1_UMLDSB1_VW1_WG64_4_1_WGM6
    SolutionIndex: 41
    SolutionNameMin: Cijk_Ailk_Bljk_SB_GB_MT64x32x32_MI16x16x4x1_SN_AMAS3_DTVA0_GRVW2_LBSPP128_LPB2_LRVW2_NEPBS4_NLCA1_PLR9_SS1_SVW2_TT2_16_TLDS1_UMLDSB1_VW2_WG32_8_1_WGM12
    SolutionIndex: 42
    SolutionNameMin: Cijk_Ailk_Bljk_SB_GB_MT64x32x32_MI16x16x4x1_SN_AMAS3_DTVA0_GRVW1_LBSPP128_LPB2_LRVW1_NEPBS4_NLCA1_PLR9_SS1_SVW2_TT2_16_TLDS1_UMLDSB1_VW2_WG32_8_1_WGM6
    SolutionIndex: 43
    SolutionNameMin: Cijk_Ailk_Bljk_SB_GB_MT64x64x16_MI16x16x4x1_SN_AMAS3_DTVA0_GRVW2_LBSPP0_LPB2_LRVW1_NEPBS0_NLCA1_PLR5_SS1_SVW2_TT2_32_TLDS0_UMLDSB0_VW2_WG32_8_1_WGM12
    SolutionIndex: 44
    SolutionNameMin: Cijk_Ailk_Bljk_SB_GB_MT64x64x16_MI16x16x4x1_SN_AMAS3_DTVA0_GRVW2_LBSPP128_LPB2_LRVW2_NEPBS0_NLCA1_PLR5_SS1_SVW2_TT2_32_TLDS1_UMLDSB1_VW2_WG32_8_1_WGM6
    SolutionIndex: 45
    SolutionNameMin: Cijk_Ailk_Bljk_SB_GB_MT64x64x16_MI16x16x4x1_SN_AMAS3_DTVA0_GRVW4_LBSPP128_LPB4_LRVW1_NEPBS0_NLCA1_PLR5_SS1_SVW2_TT2_32_TLDS1_UMLDSB1_VW2_WG32_8_1_WGM12
    SolutionIndex: 46
    SolutionNameMin: Cijk_Ailk_Bljk_SB_GB_MT64x64x16_MI16x16x4x1_SN_AMAS3_DTVA0_GRVW2_LBSPP128_LPB2_LRVW2_NEPBS4_NLCA1_PLR5_SS1_SVW2_TT2_32_TLDS1_UMLDSB1_VW2_WG32_8_1_WGM12
    SolutionIndex: 47
    SolutionNameMin: Cijk_Ailk_Bljk_SB_GB_MT32x64x32_MI16x16x4x1_SN_AMAS3_DTVA0_GRVW1_LBSPP128_LPB2_LRVW2_NEPBS4_NLCA1_PLR9_SS1_SVW2_TT2_16_TLDS1_UMLDSB1_VW2_WG16_16_1_WGM12
    SolutionIndex: 48
    SolutionNameMin: Cijk_Ailk_Bljk_SB_GB_MT32x64x32_MI16x16x4x1_SN_AMAS0_DTVA0_GRVW1_LBSPP128_LPB2_LRVW2_NEPBS0_NLCA1_PLR9_SS0_SVW4_TT1_32_TLDS1_UMLDSB1_VW1_WG32_8_1_WGM6
    SolutionIndex: 49
    SolutionNameMin: Cijk_Ailk_Bljk_SB_GB_MT64x64x16_MI16x16x4x1_SN_AMAS3_DTVA0_GRVW2_LBSPP0_LPB2_LRVW1_NEPBS0_NLCA1_PLR5_SS1_SVW2_TT2_32_TLDS0_UMLDSB0_VW2_WG32_8_1_WGM6
    SolutionIndex: 50
    SolutionNameMin: Cijk_Ailk_Bljk_SB_GB_MT64x64x16_MI16x16x4x1_SN_AMAS3_DTVA0_GRVW4_LBSPP0_LPB2_LRVW1_NEPBS4_NLCA1_PLR5_SS1_SVW2_TT2_32_TLDS0_UMLDSB0_VW2_WG32_8_1_WGM12
    SolutionIndex: 51
    SolutionNameMin: Cijk_Ailk_Bljk_SB_GB_MT32x64x32_MI16x16x4x1_SN_AMAS3_DTVA0_GRVW2_LBSPP0_LPB2_LRVW1_NEPBS0_NLCA1_PLR9_SS1_SVW2_TT2_16_TLDS0_UMLDSB0_VW2_WG16_16_1_WGM12
    SolutionIndex: 52
    SolutionNameMin: Cijk_Ailk_Bljk_SB_GB_MT32x64x32_MI16x16x4x1_SN_AMAS3_DTVA0_GRVW4_LBSPP128_LPB4_LRVW1_NEPBS4_NLCA1_PLR9_SS1_SVW2_TT2_16_TLDS1_UMLDSB1_VW2_WG16_16_1_WGM6
    SolutionIndex: 53
    SolutionNameMin: Cijk_Ailk_Bljk_SB_GB_MT128x64x16_MI32x32x2x1_SN_AMAS3_DTVA0_GRVW2_LBSPP0_LPB2_LRVW1_NEPBS0_NLCA1_PLR9_SS1_SVW2_TT2_32_TLDS0_UMLDSB0_VW2_WG64_4_1_WGM12
    SolutionIndex: 54
    SolutionNameMin: Cijk_Ailk_Bljk_SB_GB_MT128x64x16_MI32x32x2x1_SN_AMAS3_DTVA0_GRVW1_LBSPP128_LPB1_LRVW1_NEPBS0_NLCA1_PLR9_SS1_SVW2_TT2_32_TLDS1_UMLDSB1_VW2_WG64_4_1_WGM12
    SolutionIndex: 55
    SolutionNameMin: Cijk_Ailk_Bljk_SB_GB_MT128x64x16_MI32x32x2x1_SN_AMAS0_DTVA0_GRVW1_LBSPP128_LPB2_LRVW2_NEPBS0_NLCA1_PLR9_SS1_SVW1_TT2_32_TLDS1_UMLDSB1_VW1_WG64_4_1_WGM6
    SolutionIndex: 56
    SolutionNameMin: Cijk_Ailk_Bljk_SB_GB_MT64x32x32_MI16x16x4x1_SN_AMAS3_DTVA0_GRVW1_LBSPP128_LPB2_LRVW2_NEPBS0_NLCA1_PLR9_SS1_SVW2_TT2_16_TLDS1_UMLDSB1_VW2_WG32_8_1_WGM6
    SolutionIndex: 57
    SolutionNameMin: Cijk_Ailk_Bljk_SB_GB_MT128x64x16_MI32x32x2x1_SN_AMAS0_DTVA0_GRVW2_LBSPP0_LPB1_LRVW1_NEPBS0_NLCA1_PLR9_SS1_SVW1_TT2_32_TLDS0_UMLDSB0_VW1_WG64_4_1_WGM6
    SolutionIndex: 58
    SolutionNameMin: Cijk_Ailk_Bljk_SB_GB_MT64x32x32_MI16x16x4x1_SN_AMAS3_DTVA0_GRVW2_LBSPP128_LPB2_LRVW2_NEPBS0_NLCA1_PLR9_SS1_SVW2_TT2_16_TLDS1_UMLDSB1_VW2_WG32_8_1_WGM6
    SolutionIndex: 59
    SolutionNameMin: Cijk_Ailk_Bljk_SB_GB_MT16x128x16_MI16x16x4x1_SN_AMAS0_LBSPP128_LPB2_LRVW2_NEPBS0_PLR5_SVW1_TT1_32_TLDS1_UMLDSB1_VW1_WG16_16_1_WGM18
    SolutionIndex: 60
    SolutionNameMin: Cijk_Ailk_Bljk_SB_GB_MT128x64x16_MI32x32x2x1_SN_AMAS3_DTVA0_GRVW4_LBSPP128_LPB4_LRVW1_NEPBS4_NLCA1_PLR9_SVW2_TT2_32_TLDS1_UMLDSB1_VW2_WG64_4_1_WGM12
    SolutionIndex: 61
    SolutionNameMin: Cijk_Ailk_Bljk_SB_GB_MT64x64x32_MI32x32x2x1_SN_AMAS0_DTVA0_GRVW1_LBSPP128_LPB1_LRVW1_NEPBS0_NLCA1_PLR17_SVW1_TT1_32_TLDS1_UMLDSB1_VW1_WG64_4_1_WGM12
    SolutionIndex: 62
    SolutionNameMin: Cijk_Ailk_Bljk_SB_GB_MT64x64x16_MI32x32x2x1_SN_AMAS0_DTVA0_GRVW4_LBSPP128_LPB4_LRVW1_NEPBS4_NLCA1_PLR9_SVW1_TT1_32_TLDS1_UMLDSB1_VW1_WG64_4_1_WGM12
    SolutionIndex: 63
    SolutionNameMin: Cijk_Ailk_Bljk_SB_GB_MT32x64x32_MI16x16x4x1_SN_AMAS3_DTVA0_GRVW2_LBSPP128_LPB2_LRVW1_NEPBS0_NLCA1_PLR9_SVW2_TT2_16_TLDS1_UMLDSB1_VW2_WG16_16_1_WGM12
    SolutionIndex: 64
    SolutionNameMin: Cijk_Ailk_Bljk_SB_GB_MT16x128x16_MI16x16x4x1_SN_AMAS0_DTVA0_GRVW2_LBSPP128_LPB2_LRVW2_NEPBS4_NLCA1_PLR5_SVW1_TT1_32_TLDS1_UMLDSB1_VW1_WG16_16_1_WGM18
    SolutionIndex: 65
    SolutionNameMin: Cijk_Ailk_Bljk_SB_GB_MT16x128x16_MI16x16x4x1_SN_AMAS0_DTVA0_GRVW2_LBSPP128_LPB2_LRVW2_NEPBS0_NLCA1_PLR5_SVW1_TT1_32_TLDS1_UMLDSB1_VW1_WG16_16_1_WGM18
- - - [511, 511, 16, 511]
    - [4, 62.232]
  - - [513, 513, 16, 513]
    - [0, 55.802]
  - - [1023, 1023, 16, 1023]
    - [3, 88.058]
  - - [1025, 1025, 16, 1025]
    - [2, 77.357]
  - - [2047, 2047, 16, 2047]
    - [6, 96.521]
  - - [2049, 2049, 16, 2049]
    - [5, 90.3]
  - - [4095, 2047, 16, 2047]
    - [1, 97.46]
  - - [4097, 2049, 16, 2049]
    - [5, 92.431]
  - - [510, 510, 16, 510]
    - [7, 63.245]
  - - [514, 514, 16, 514]
    - [8, 57.136]
  - - [1022, 1022, 16, 1022]
    - [9, 91.056]
  - - [1026, 1026, 16, 1026]
    - [10, 78.96]
  - - [2046, 2046, 16, 2046]
    - [11, 97.284]
  - - [2050, 2050, 16, 2050]
    - [12, 91.314]
  - - [4094, 2046, 16, 2046]
    - [13, 97.769]
  - - [4098, 2050, 16, 2050]
    - [14, 93.165]
  - - [508, 508, 16, 508]
    - [15, 60.768]
  - - [512, 512, 16, 512]
    - [16, 68.933]
  - - [516, 516, 16, 516]
    - [17, 55.369]
  - - [1020, 1020, 16, 1020]
    - [18, 91.426]
  - - [1024, 1024, 16, 1024]
    - [19, 94.204]
  - - [1028, 1028, 16, 1028]
    - [20, 80.065]
  - - [2044, 2044, 16, 2044]
    - [21, 97.18]
  - - [2048, 2048, 16, 2048]
    - [22, 98.007]
  - - [2052, 2052, 16, 2052]
    - [23, 91.725]
  - - [4092, 2044, 16, 2044]
    - [24, 97.734]
  - - [4096, 2048, 16, 2048]
    - [25, 98.325]
  - - [4100, 2052, 16, 2052]
    - [23, 93.715]
  - - [64, 1, 1000, 64]
    - [26, 0.503]
  - - [1, 64, 1000, 64]
    - [27, 0.502]
  - - [31, 31, 1000, 31]
    - [28, 3.884]
  - - [33, 33, 1000, 33]
    - [29, 3.704]
  - - [47, 47, 1000, 47]
    - [30, 8.428]
  - - [49, 49, 1000, 49]
    - [31, 9.341]
  - - [63, 63, 128, 63]
    - [32, 5.266]
  - - [65, 65, 128, 65]
    - [33, 4.488]
  - - [79, 79, 128, 79]
    - [34, 6.922]
  - - [81, 81, 128, 81]
    - [35, 7.461]
  - - [95, 95, 64, 95]
    - [36, 7.852]
  - - [97, 97, 64, 97]
    - [37, 7.599]
  - - [127, 127, 64, 127]
    - [38, 14.911]
  - - [129, 129, 64, 129]
    - [39, 12.433]
  - - [255, 255, 16, 255]
    - [40, 23.902]
  - - [257, 257, 16, 257]
    - [33, 22.8]
  - - [30, 30, 1000, 30]
    - [41, 4.092]
  - - [32, 32, 1000, 32]
    - [42, 5.079]
  - - [34, 34, 1000, 34]
    - [43, 4.405]
  - - [46, 46, 1000, 46]
    - [44, 8.98]
  - - [48, 48, 1000, 48]
    - [45, 10.836]
  - - [50, 50, 1000, 50]
    - [46, 10.242]
  - - [62, 62, 128, 62]
    - [47, 5.333]
  - - [64, 64, 128, 64]
    - [48, 6.295]
  - - [66, 66, 128, 66]
    - [43, 4.955]
  - - [78, 78, 128, 78]
    - [49, 7.272]
  - - [80, 80, 128, 80]
    - [50, 8.437]
  - - [82, 82, 128, 82]
    - [43, 8.368]
  - - [94, 94, 64, 94]
    - [51, 7.939]
  - - [96, 96, 64, 96]
    - [52, 9.417]
  - - [98, 98, 64, 98]
    - [53, 8.183]
  - - [126, 126, 64, 126]
    - [54, 15.416]
  - - [128, 128, 64, 128]
    - [55, 18.394]
  - - [130, 130, 64, 130]
    - [49, 13.23]
  - - [254, 254, 16, 254]
    - [56, 24.52]
  - - [256, 256, 16, 256]
    - [57, 26.902]
  - - [258, 258, 16, 258]
    - [58, 23.915]
  - - [1, 1536, 256, 31]
    - [59, 0.855]
  - - [1536, 1536, 256, 64]
    - [60, 52.539]
  - - [1536, 64, 256, 64]
    - [61, 33.28]
  - - [1536, 1536, 256, 32]
    - [62, 28.87]
  - - [32, 1536, 256, 32]
    - [63, 14.223]
  - - [1, 1536, 256, 30]
    - [64, 0.81]
  - - [1, 1536, 256, 32]
    - [65, 0.861]
- null
- null
- DeviceEfficiency
