library/src/blas3/Tensile/Logic/asm_full/aquavanjaram/aquavanjaram_Cijk_Ailk_Bljk_F8F8S_BH.yaml
- {MinimumRequiredVersion: 4.36.0}
- aquavanjaram
- gfx940
- [Device 0049, Device 0050]
    SolutionIndex: 0
    SolutionNameMin: Cijk_Ailk_Bljk_F8F8S_BH_MT256x256x64_MI32x32x16x1_SN_GRVW16_GLS0_LPB16_NLCA1_SU0_SUM0_SUS0_SRVW16_SSO0_TLDS0_WGM4
    SolutionIndex: 1
    SolutionNameMin: Cijk_Ailk_Bljk_F8F8S_BH_MT256x256x64_MI32x32x16x1_SN_GRVW16_GLS0_LPB16_NLCA1_SU0_SUM0_SUS0_SRVW16_SSO0_TLDS1_WGM4
    SolutionIndex: 2
    SolutionNameMin: Cijk_Ailk_Bljk_F8F8S_BH_MT256x256x64_MI32x32x16x1_SN_GRVW16_GLS0_LPB16_NLCA2_SU0_SUM0_SUS0_SRVW16_SSO0_TLDS1_WGM4
    SolutionIndex: 3
    SolutionNameMin: Cijk_Ailk_Bljk_F8F8S_BH_MT256x256x64_MI32x32x16x1_SN_GRVW16_GLS0_LPB16_NLCA2_SU32_SUM2_SUS128_SRVW16_SSO0_TLDS0_WGM4
    SolutionIndex: 4
    SolutionNameMin: Cijk_Ailk_Bljk_F8F8S_BH_MT256x256x64_MI32x32x16x1_SN_GRVW16_GLS0_LPB16_NLCA2_SU32_SUM2_SUS128_SRVW16_SSO0_TLDS1_WGM4
    SolutionIndex: 5
    SolutionNameMin: Cijk_Ailk_Bljk_F8F8S_BH_MT256x256x64_MI32x32x16x1_SN_GRVW16_GLS0_LPB16_NLCA1_SU0_SUM0_SUS0_SRVW16_SSO0_TLDS1_WGM6
    SolutionIndex: 6
    SolutionNameMin: Cijk_Ailk_Bljk_F8F8S_BH_MT256x256x64_MI32x32x16x1_SN_GRVW16_GLS0_LPB16_NLCA2_SU32_SUM2_SUS128_SRVW16_SSO0_TLDS0_WGM6
    SolutionIndex: 7
    SolutionNameMin: Cijk_Ailk_Bljk_F8F8S_BH_MT256x256x64_MI32x32x16x1_SN_GRVW16_GLS0_LPB16_NLCA1_SU0_SUM0_SUS0_SRVW16_SSO0_TLDS0_WGM12
    SolutionIndex: 8
    SolutionNameMin: Cijk_Ailk_Bljk_F8F8S_BH_MT256x256x64_MI32x32x16x1_SN_GRVW16_GLS0_LPB16_NLCA1_SU0_SUM0_SUS0_SRVW16_SSO0_TLDS1_WGM12
    SolutionIndex: 9
    SolutionNameMin: Cijk_Ailk_Bljk_F8F8S_BH_MT256x256x64_MI32x32x16x1_SN_GRVW16_GLS0_LPB16_NLCA2_SU32_SUM2_SUS128_SRVW16_SSO0_TLDS0_WGM19
    SolutionIndex: 10
    SolutionNameMin: Cijk_Ailk_Bljk_F8F8S_BH_MT256x256x64_MI32x32x16x1_SN_GRVW16_GLS0_LPB16_NLCA1_SU0_SUM0_SUS0_SRVW16_SSO0_TLDS0_WGM29
    SolutionIndex: 11
    SolutionNameMin: Cijk_Ailk_Bljk_F8F8S_BH_MT256x256x64_MI32x32x16x1_SN_GRVW16_GLS0_LPB16_NLCA1_SU0_SUM0_SUS0_SRVW16_SSO8_TLDS1_WGM4
    SolutionIndex: 12
    SolutionNameMin: Cijk_Ailk_Bljk_F8F8S_BH_MT64x64x64_MI32x32x16x1_SN_GRVW4_LPA0_NEPBS0_NLCA1_PGR2_SU0_SUM0_SUS0_TSGRA1_TSGRB0_UMLDSA0_WGM1
    SolutionIndex: 13
    SolutionNameMin: Cijk_Ailk_Bljk_F8F8S_BH_MT64x64x64_MI32x32x16x1_SN_GRVW4_LPA0_NEPBS0_NLCA2_PGR1_SU0_SUM0_SUS0_TSGRA1_TSGRB1_UMLDSA0_WGM1
    SolutionIndex: 14
    SolutionNameMin: Cijk_Ailk_Bljk_F8F8S_BH_MT64x64x64_MI32x32x16x1_SN_GRVW16_LPA16_NEPBS8_NLCA1_PGR2_SU0_SUM0_SUS0_TSGRA1_TSGRB0_UMLDSA1_WGM1
    SolutionIndex: 15
    SolutionNameMin: Cijk_Ailk_Bljk_F8F8S_BH_MT64x64x64_MI32x32x16x1_SN_GRVW4_LPA16_NEPBS8_NLCA2_PGR1_SU0_SUM0_SUS0_TSGRA0_TSGRB0_UMLDSA1_WGM1
    SolutionIndex: 16
    SolutionNameMin: Cijk_Ailk_Bljk_F8F8S_BH_MT64x64x64_MI32x32x16x1_SN_GRVW16_LPA16_NEPBS0_NLCA1_PGR1_SU32_SUM2_SUS64_TSGRA0_TSGRB0_UMLDSA1_WGM4
- - - [6144, 4864, 1, 4096]
    - [4, 59.955]
  - - [6144, 4864, 1, 8192]
    - [0, 65.634]
  - - [6144, 4864, 1, 16384]
    - [2, 68.996]
  - - [6144, 9728, 1, 4096]
    - [6, 60.626]
  - - [6144, 9728, 1, 8192]
    - [8, 65.968]
  - - [6144, 9728, 1, 16384]
    - [5, 68.854]
  - - [9216, 4864, 1, 4096]
    - [3, 60.463]
  - - [9216, 4864, 1, 8192]
    - [7, 65.826]
  - - [9216, 4864, 1, 16384]
    - [11, 68.88]
  - - [6144, 4864, 1, 4352]
    - [9, 60.805]
  - - [6144, 4864, 1, 8448]
    - [1, 65.894]
  - - [6144, 4864, 1, 16640]
    - [10, 69.032]
  - - [4864, 3072, 1, 4096]
    - [3, 59.485]
  - - [4, 4, 1, 16]
    - [12, 0.0]
  - - [4, 64, 1, 64]
    - [13, 0.0]
  - - [16, 64, 1, 64]
    - [14, 0.001]
  - - [64, 4, 1, 64]
    - [15, 0.0]
  - - [64, 16, 1, 64]
    - [16, 0.001]
- null
- null
- DeviceEfficiency
