library/src/blas3/Tensile/Logic/asm_full/aquavanjaram/aquavanjaram_Cijk_Ailk_Bljk_DB.yaml
- {MinimumRequiredVersion: 4.7.2}
- aquavanjaram
- gfx940
- [Device 0049]
    SolutionIndex: 0
    SolutionNameMin: Cijk_Ailk_Bljk_DB_MT128x64x16_MI16x16x4x1_SN_LBSPP128_LPB2_LRVW1_NEPBS2_PLR5_SU0_SUS0_TT2_64_TLDS1_UMLDSB1_WGM36
    SolutionIndex: 1
    SolutionNameMin: Cijk_Ailk_Bljk_DB_MT128x128x16_MI16x16x4x1_SN_LBSPP128_LPB4_LRVW2_NEPBS4_PLR5_SU4_SUS512_TT2_128_TLDS1_UMLDSB1_WGM18
    SolutionIndex: 2
    SolutionNameMin: Cijk_Ailk_Bljk_DB_MT128x128x16_MI16x16x4x1_SN_LBSPP128_LPB4_LRVW2_NEPBS4_PLR5_SU32_SUS512_TT2_128_TLDS1_UMLDSB1_WGM12
    SolutionIndex: 3
    SolutionNameMin: Cijk_Ailk_Bljk_DB_MT128x128x16_MI16x16x4x1_SN_ASGT332_LBSPP128_LPB4_LRVW2_PLR5_SU4_SUS512_TLDS1_UMLDSB1_WGM30
    SolutionIndex: 4
    SolutionNameMin: Cijk_Ailk_Bljk_DB_MT128x128x16_MI16x16x4x1_SN_ASGT_LBSPP128_LPB4_LRVW2_PLR5_SU0_SUS0_TLDS1_UMLDSB1_WGM36
    SolutionIndex: 5
    SolutionNameMin: Cijk_Ailk_Bljk_DB_MT128x128x16_MI16x16x4x1_SN_ASGT332_LBSPP128_LPB4_LRVW2_PLR5_SU4_SUS256_TLDS1_UMLDSB1_WGM36
    SolutionIndex: 6
    SolutionNameMin: Cijk_Ailk_Bljk_DB_MT128x128x16_MI16x16x4x1_SN_ASGT332_LBSPP0_LPB2_LRVW1_PLR5_SU4_SUS512_TLDS0_UMLDSB0_WGM12
    SolutionIndex: 7
    SolutionNameMin: Cijk_Ailk_Bljk_DB_MT128x128x16_MI16x16x4x1_SN_ASGT_LBSPP128_LPB4_LRVW2_PLR5_SU4_SUS512_TLDS1_UMLDSB1_WGM24
    SolutionIndex: 8
    SolutionNameMin: Cijk_Ailk_Bljk_DB_MT128x128x16_MI16x16x4x1_SN_ASGT_LBSPP0_LPB2_LRVW1_PLR5_SU4_SUS512_TLDS0_UMLDSB0_WGM12
    SolutionIndex: 9
    SolutionNameMin: Cijk_Ailk_Bljk_DB_MT64x32x16_MI16x16x4x1_SN_AMAS0_DTVA0_LBSPP128_MIAV1_NEPBS0_PLR5_SU4_SUS512_SVW1_TT1_32_VW1_WG64_4_1_WGM18
    SolutionIndex: 10
    SolutionNameMin: Cijk_Ailk_Bljk_DB_MT64x32x16_MI16x16x4x1_SN_AMAS0_DTVA0_LBSPP128_MIAV0_NEPBS0_PLR5_SU4_SUS256_SVW1_TT1_32_VW1_WG64_4_1_WGM18
    SolutionIndex: 11
    SolutionNameMin: Cijk_Ailk_Bljk_DB_MT64x64x16_MI16x16x4x1_SN_AMAS0_DTVA0_LBSPP128_MIAV1_NEPBS4_PLR5_SU4_SUS256_SVW1_TT2_32_VW1_WG32_8_1_WGM30
    SolutionIndex: 12
    SolutionNameMin: Cijk_Ailk_Bljk_DB_MT64x64x16_MI16x16x4x1_SN_AMAS0_DTVA0_LBSPP128_MIAV1_NEPBS0_PLR5_SU4_SUS256_SVW1_TT2_32_VW1_WG32_8_1_WGM30
    SolutionIndex: 13
    SolutionNameMin: Cijk_Ailk_Bljk_DB_MT128x64x16_MI16x16x4x1_SN_LBSPP128_LPB2_LRVW1_NEPBS4_PLR5_SU0_SUS0_TT2_64_TLDS1_UMLDSB1_WGM30
    SolutionIndex: 14
    SolutionNameMin: Cijk_Ailk_Bljk_DB_MT64x32x16_MI16x16x4x1_SN_AMAS0_DTVA0_EPS0_MIAV1_NEPBS4_SU32_SUS512_SVW1_TT1_32_VW1_WG64_4_1_WGM18
    SolutionIndex: 15
    SolutionNameMin: Cijk_Ailk_Bljk_DB_MT64x64x16_MI16x16x4x1_SN_AMAS3_DTVA0_EPS0_MIAV0_NEPBS0_SU4_SUS512_SVW2_TT2_32_VW2_WG32_8_1_WGM30
    SolutionIndex: 16
    SolutionNameMin: Cijk_Ailk_Bljk_DB_MT128x64x16_MI16x16x4x1_SN_AMAS3_DTVA1_EPS1_MIAV0_NEPBS2_SU32_SUS512_SVW2_TT2_64_VW2_WG64_4_1_WGM30
    SolutionIndex: 17
    SolutionNameMin: Cijk_Ailk_Bljk_DB_MT1024x16x8_MI16x16x4x1_SN_NEPBS0_PLR3_WGM1
    SolutionIndex: 18
    SolutionNameMin: Cijk_Ailk_Bljk_DB_MT1024x16x8_MI16x16x4x1_SN_NEPBS4_PLR1_WGM1
    SolutionIndex: 19
    SolutionNameMin: Cijk_Ailk_Bljk_DB_MT1024x16x8_MI16x16x4x1_SN_NEPBS4_PLR3_WGM0
    SolutionIndex: 20
    SolutionNameMin: Cijk_Ailk_Bljk_DB_MT1024x16x8_MI16x16x4x1_SN_NEPBS4_PLR1_WGM0
    SolutionIndex: 21
    SolutionNameMin: Cijk_Ailk_Bljk_DB_MT1024x16x8_MI16x16x4x1_SN_NEPBS4_PLR3_WGM1
    SolutionIndex: 22
    SolutionNameMin: Cijk_Ailk_Bljk_DB_MT128x128x8_MI16x16x4x1_SN_AF0EM2_LPB2_LRVW1_MIAV1_NEPBS0_PLR3
    SolutionIndex: 23
    SolutionNameMin: Cijk_Ailk_Bljk_DB_MT64x32x16_MI16x16x4x1_SN_AMAS0_DTVA1_GRVW1_LBSPP128_LPB4_LRVW2_NEPBS0_NLCA1_PLR5_SVW1_TT1_32_TLDS1_UMLDSB1_VW1_WG64_4_1_WGM6
    SolutionIndex: 24
    SolutionNameMin: Cijk_Ailk_Bljk_DB_MT32x64x16_MI16x16x4x1_SN_AMAS0_DTVA0_GRVW1_LBSPP128_LPB4_LRVW2_NEPBS0_NLCA1_PLR5_SVW1_TT1_32_TLDS1_UMLDSB1_VW1_WG32_8_1_WGM12
    SolutionIndex: 25
    SolutionNameMin: Cijk_Ailk_Bljk_DB_MT64x32x16_MI16x16x4x1_SN_AMAS0_DTVA1_GRVW1_LBSPP128_LPB4_LRVW2_NEPBS4_NLCA1_PLR5_SVW1_TT1_32_TLDS1_UMLDSB1_VW1_WG64_4_1_WGM12
    SolutionIndex: 26
    SolutionNameMin: Cijk_Ailk_Bljk_DB_MT64x64x16_MI16x16x4x1_SN_AMAS0_DTVA0_GRVW1_LBSPP128_LPB1_LRVW1_NEPBS0_NLCA1_PLR5_SVW1_TT2_32_TLDS1_UMLDSB1_VW1_WG32_8_1_WGM6
    SolutionIndex: 27
    SolutionNameMin: Cijk_Ailk_Bljk_DB_MT64x64x32_MI16x16x4x1_SN_AMAS0_DTVA1_GRVW1_LBSPP256_LPB1_LRVW1_NEPBS0_NLCA1_PLR9_SVW1_TT1_64_TLDS1_UMLDSB1_VW1_WG64_4_1_WGM12
    SolutionIndex: 28
    SolutionNameMin: Cijk_Ailk_Bljk_DB_MT64x64x32_MI16x16x4x1_SN_AMAS0_DTVA1_GRVW1_LBSPP256_LPB4_LRVW2_NEPBS0_NLCA1_PLR9_SVW1_TT1_64_TLDS1_UMLDSB1_VW1_WG64_4_1_WGM6
    SolutionIndex: 29
    SolutionNameMin: Cijk_Ailk_Bljk_DB_MT64x64x16_MI16x16x4x1_SN_AMAS0_DTVA1_GRVW1_LBSPP128_LPB4_LRVW2_NEPBS0_NLCA1_PLR5_SVW1_TT1_64_TLDS1_UMLDSB1_VW1_WG64_4_1_WGM6
    SolutionIndex: 30
    SolutionNameMin: Cijk_Ailk_Bljk_DB_MT64x64x16_MI16x16x4x1_SN_AMAS3_DTVA0_GRVW2_LBSPP128_LPB4_LRVW2_NEPBS0_NLCA1_PLR5_SVW2_TT2_32_TLDS1_UMLDSB1_VW2_WG32_8_1_WGM12
    SolutionIndex: 31
    SolutionNameMin: Cijk_Ailk_Bljk_DB_MT128x64x16_MI16x16x4x1_SN_AMAS0_DTVA1_GRVW1_LBSPP128_LPB1_LRVW1_NEPBS0_NLCA2_PLR1_SVW1_TT2_64_TLDS1_UMLDSB1_VW1_WG64_4_1_WGM6
    SolutionIndex: 32
    SolutionNameMin: Cijk_Ailk_Bljk_DB_MT128x64x16_MI16x16x4x1_SN_AMAS0_DTVA1_GRVW1_LBSPP128_LPB1_LRVW1_NEPBS0_NLCA2_PLR5_SVW1_TT2_64_TLDS1_UMLDSB1_VW1_WG64_4_1_WGM12
    SolutionIndex: 33
    SolutionNameMin: Cijk_Ailk_Bljk_DB_MT128x64x16_MI16x16x4x1_SN_AMAS0_DTVA0_GRVW1_LBSPP128_LPB1_LRVW1_NEPBS0_NLCA1_PLR5_SVW1_TT4_32_TLDS1_UMLDSB1_VW1_WG32_8_1_WGM6
    SolutionIndex: 34
    SolutionNameMin: Cijk_Ailk_Bljk_DB_MT128x64x16_MI16x16x4x1_SN_AMAS0_DTVA0_GRVW1_LBSPP128_LPB1_LRVW1_NEPBS0_NLCA1_PLR5_SVW1_TT4_32_TLDS1_UMLDSB1_VW1_WG32_8_1_WGM12
    SolutionIndex: 35
    SolutionNameMin: Cijk_Ailk_Bljk_DB_MT64x32x32_MI16x16x4x1_SN_AMAS3_DTVA0_GRVW1_LBSPP256_LPB4_LRVW2_NEPBS0_NLCA1_PLR9_SVW2_TT2_16_TLDS1_UMLDSB1_VW2_WG32_8_1_WGM6
    SolutionIndex: 36
    SolutionNameMin: Cijk_Ailk_Bljk_DB_MT64x64x16_MI16x16x4x1_SN_AMAS0_DTVA0_GRVW2_LBSPP0_LPB1_LRVW1_NEPBS4_NLCA1_PLR5_SVW1_TT2_32_TLDS0_UMLDSB0_VW1_WG32_8_1_WGM6
    SolutionIndex: 37
    SolutionNameMin: Cijk_Ailk_Bljk_DB_MT64x64x16_MI16x16x4x1_SN_AMAS3_DTVA0_GRVW2_LBSPP0_LPB2_LRVW1_NEPBS4_NLCA1_PLR5_SVW2_TT2_32_TLDS0_UMLDSB0_VW2_WG32_8_1_WGM6
    SolutionIndex: 38
    SolutionNameMin: Cijk_Ailk_Bljk_DB_MT32x64x32_MI16x16x4x1_SN_AMAS3_DTVA0_GRVW2_LBSPP256_LPB4_LRVW2_NEPBS0_NLCA1_PLR9_SVW2_TT2_16_TLDS1_UMLDSB1_VW2_WG16_16_1_WGM6
    SolutionIndex: 39
    SolutionNameMin: Cijk_Ailk_Bljk_DB_MT64x32x16_MI16x16x4x1_SN_AMAS0_DTVA1_GRVW1_LBSPP128_LPB4_LRVW2_NEPBS0_NLCA1_PLR5_SVW1_TT1_32_TLDS1_UMLDSB1_VW1_WG64_4_1_WGM12
    SolutionIndex: 40
    SolutionNameMin: Cijk_Ailk_Bljk_DB_MT64x64x16_MI16x16x4x1_SN_AMAS3_DTVA0_GRVW2_LBSPP128_LPB4_LRVW2_NEPBS0_NLCA1_PLR5_SVW2_TT2_32_TLDS1_UMLDSB1_VW2_WG32_8_1_WGM6
    SolutionIndex: 41
    SolutionNameMin: Cijk_Ailk_Bljk_DB_MT64x64x32_MI16x16x4x1_SN_AMAS0_DTVA1_GRVW1_LBSPP0_LPB1_LRVW1_NEPBS0_NLCA1_PLR9_SVW1_TT1_64_TLDS0_UMLDSB0_VW1_WG64_4_1_WGM6
    SolutionIndex: 42
    SolutionNameMin: Cijk_Ailk_Bljk_DB_MT64x64x16_MI16x16x4x1_SN_AMAS0_DTVA1_GRVW1_LBSPP128_LPB4_LRVW2_NEPBS0_NLCA1_PLR5_SVW1_TT1_64_TLDS1_UMLDSB1_VW1_WG64_4_1_WGM6
    SolutionIndex: 43
    SolutionNameMin: Cijk_Ailk_Bljk_DB_MT64x64x16_MI16x16x4x1_SN_AMAS3_DTVA0_GRVW1_LBSPP0_LPB2_LRVW1_NEPBS0_NLCA1_PLR5_SVW2_TT2_32_TLDS0_UMLDSB0_VW2_WG32_8_1_WGM12
    SolutionIndex: 44
    SolutionNameMin: Cijk_Ailk_Bljk_DB_MT64x64x16_MI16x16x4x1_SN_AMAS3_DTVA0_GRVW2_LBSPP0_LPB2_LRVW1_NEPBS4_NLCA1_PLR5_SVW2_TT2_32_TLDS0_UMLDSB0_VW2_WG32_8_1_WGM6
    SolutionIndex: 45
    SolutionNameMin: Cijk_Ailk_Bljk_DB_MT64x64x32_MI16x16x4x1_SN_AMAS0_DTVA0_GRVW1_LBSPP0_LPB1_LRVW1_NEPBS0_NLCA1_PLR9_SVW1_TT2_32_TLDS0_UMLDSB0_VW1_WG32_8_1_WGM6
    SolutionIndex: 46
    SolutionNameMin: Cijk_Ailk_Bljk_DB_MT128x64x16_MI16x16x4x1_SN_AMAS3_DTVA1_GRVW2_LBSPP0_LPB2_LRVW1_NEPBS0_NLCA1_PLR5_SVW2_TT2_64_TLDS0_UMLDSB0_VW2_WG64_4_1_WGM12
    SolutionIndex: 47
    SolutionNameMin: Cijk_Ailk_Bljk_DB_MT128x64x16_MI16x16x4x1_SN_AMAS3_DTVA0_GRVW2_LBSPP0_LPB2_LRVW1_NEPBS0_NLCA1_PLR5_SVW2_TT4_32_TLDS0_UMLDSB0_VW2_WG32_8_1_WGM12
    SolutionIndex: 48
    SolutionNameMin: Cijk_Ailk_Bljk_DB_MT128x64x16_MI16x16x4x1_SN_AMAS3_DTVA0_GRVW2_LBSPP0_LPB2_LRVW1_NEPBS0_NLCA1_PLR1_SVW2_TT2_64_TLDS0_UMLDSB0_VW2_WG64_4_1_WGM6
    SolutionIndex: 49
    SolutionNameMin: Cijk_Ailk_Bljk_DB_MT128x64x16_MI16x16x4x1_SN_AMAS3_DTVA0_GRVW1_LBSPP128_LPB1_LRVW1_NEPBS0_NLCA1_PLR5_SVW2_TT4_32_TLDS1_UMLDSB1_VW2_WG32_8_1_WGM6
    SolutionIndex: 50
    SolutionNameMin: Cijk_Ailk_Bljk_DB_MT128x64x16_MI16x16x4x1_SN_AMAS3_DTVA0_GRVW2_LBSPP0_LPB2_LRVW1_NEPBS0_NLCA1_PLR5_SVW2_TT2_64_TLDS0_UMLDSB0_VW2_WG64_4_1_WGM6
    SolutionIndex: 51
    SolutionNameMin: Cijk_Ailk_Bljk_DB_MT128x64x16_MI16x16x4x1_SN_AMAS0_DTVA0_GRVW2_LBSPP128_LPB2_LRVW1_NEPBS0_NLCA1_PLR5_SVW1_TT2_64_TLDS1_UMLDSB1_VW1_WG64_4_1_WGM12
    SolutionIndex: 52
    SolutionNameMin: Cijk_Ailk_Bljk_DB_MT128x64x16_MI16x16x4x1_SN_AMAS3_DTVA1_GRVW2_LBSPP0_LPB2_LRVW1_NEPBS4_NLCA1_PLR5_SVW2_TT2_64_TLDS0_UMLDSB0_VW2_WG64_4_1_WGM6
    SolutionIndex: 53
    SolutionNameMin: Cijk_Ailk_Bljk_DB_MT128x64x16_MI16x16x4x1_SN_AMAS3_DTVA0_GRVW2_LBSPP128_LPB2_LRVW1_NEPBS4_NLCA1_PLR1_SVW2_TT4_32_TLDS1_UMLDSB1_VW2_WG32_8_1_WGM6
    SolutionIndex: 54
    SolutionNameMin: Cijk_Ailk_Bljk_DB_MT64x64x16_MI16x16x4x1_SN_AMAS3_DTVA0_GRVW2_LBSPP128_LPB2_LRVW1_NEPBS4_NLCA1_PLR5_SVW2_TT2_32_TLDS1_UMLDSB1_VW2_WG32_8_1_WGM6
    SolutionIndex: 55
    SolutionNameMin: Cijk_Ailk_Bljk_DB_MT128x64x16_MI16x16x4x1_SN_AMAS3_DTVA1_GRVW2_LBSPP0_LPB2_LRVW1_NEPBS4_NLCA1_PLR1_SVW2_TT2_64_TLDS0_UMLDSB0_VW2_WG64_4_1_WGM12
    SolutionIndex: 56
    SolutionNameMin: Cijk_Ailk_Bljk_DB_MT128x64x16_MI16x16x4x1_SN_AMAS3_DTVA1_GRVW2_LBSPP128_LPB2_LRVW1_NEPBS0_NLCA1_PLR1_SVW2_TT2_64_TLDS1_UMLDSB1_VW2_WG64_4_1_WGM6
    SolutionIndex: 57
    SolutionNameMin: Cijk_Ailk_Bljk_DB_MT64x32x32_MI16x16x4x1_SN_AMAS3_DTVA0_GRVW2_LBSPP256_LPB4_LRVW2_NEPBS0_NLCA1_PLR9_SVW2_TT2_16_TLDS1_UMLDSB1_VW2_WG32_8_1_WGM6
    SolutionIndex: 58
    SolutionNameMin: Cijk_Ailk_Bljk_DB_MT64x64x16_MI16x16x4x1_SN_AMAS3_DTVA0_GRVW2_LBSPP128_LPB4_LRVW2_NEPBS4_NLCA1_PLR5_SVW2_TT2_32_TLDS1_UMLDSB1_VW2_WG32_8_1_WGM6
    SolutionIndex: 59
    SolutionNameMin: Cijk_Ailk_Bljk_DB_MT32x64x32_MI16x16x4x1_SN_AMAS0_DTVA0_GRVW2_LBSPP256_LPB4_LRVW2_NEPBS0_NLCA1_PLR9_SVW1_TT2_16_TLDS1_UMLDSB1_VW1_WG16_16_1_WGM6
- - - [6144, 4864, 1, 512]
    - [1, 86.729]
  - - [4864, 3072, 1, 4096]
    - [3, 96.81]
  - - [7296, 4096, 1, 4096]
    - [4, 97.502]
  - - [7296, 4608, 1, 4096]
    - [5, 97.774]
  - - [7296, 4608, 1, 8192]
    - [6, 98.174]
  - - [9728, 6144, 1, 4096]
    - [7, 98.136]
  - - [9728, 6144, 1, 8192]
    - [8, 98.455]
  - - [16384, 16384, 1, 4096]
    - [1, 98.329]
  - - [14592, 15360, 1, 512]
    - [2, 92.172]
  - - [19456, 18432, 1, 512]
    - [1, 92.118]
  - - [4094, 4094, 1, 2046]
    - [0, 90.36]
  - - [4096, 4096, 1, 2048]
    - [13, 91.863]
  - - [1030, 1030, 1, 1030]
    - [9, 38.98]
  - - [1032, 1032, 1, 1032]
    - [10, 40.45]
  - - [2046, 2046, 1, 2046]
    - [11, 66.118]
  - - [2048, 2048, 1, 2048]
    - [12, 69.267]
  - - [1031, 1031, 1, 1031]
    - [14, 37.382]
  - - [2047, 2047, 1, 2047]
    - [15, 61.602]
  - - [4095, 4095, 1, 2047]
    - [16, 82.879]
  - - [1000000, 9, 1, 250]
    - [17, 7.76]
  - - [2000000, 9, 1, 250]
    - [17, 7.867]
  - - [4000000, 9, 1, 250]
    - [17, 7.915]
  - - [8000000, 9, 1, 250]
    - [18, 7.926]
  - - [12000000, 9, 1, 250]
    - [19, 7.928]
  - - [16000000, 9, 1, 250]
    - [20, 7.912]
  - - [24000000, 9, 1, 250]
    - [21, 7.927]
  - - [1000000, 250, 1, 250]
    - [22, 53.861]
  - - [64, 1, 1000, 64]
    - [23, 0.445]
  - - [1, 64, 1000, 64]
    - [24, 0.384]
  - - [31, 31, 1000, 31]
    - [25, 3.297]
  - - [33, 33, 1000, 33]
    - [26, 3.076]
  - - [47, 47, 1000, 47]
    - [27, 5.787]
  - - [49, 49, 1000, 49]
    - [28, 5.778]
  - - [63, 63, 128, 63]
    - [29, 4.863]
  - - [65, 65, 128, 65]
    - [30, 3.742]
  - - [79, 79, 128, 79]
    - [31, 5.984]
  - - [81, 81, 128, 81]
    - [32, 6.102]
  - - [95, 95, 64, 95]
    - [33, 6.739]
  - - [97, 97, 64, 97]
    - [33, 6.912]
  - - [127, 127, 64, 127]
    - [34, 11.691]
  - - [129, 129, 64, 129]
    - [30, 8.37]
  - - [255, 255, 16, 255]
    - [32, 17.404]
  - - [257, 257, 16, 257]
    - [35, 15.248]
  - - [511, 511, 16, 511]
    - [36, 37.343]
  - - [513, 513, 16, 513]
    - [37, 36.984]
  - - [30, 30, 1000, 30]
    - [38, 3.183]
  - - [32, 32, 1000, 32]
    - [39, 4.041]
  - - [34, 34, 1000, 34]
    - [40, 3.515]
  - - [46, 46, 1000, 46]
    - [41, 5.832]
  - - [48, 48, 1000, 48]
    - [42, 7.664]
  - - [50, 50, 1000, 50]
    - [43, 6.724]
  - - [62, 62, 128, 62]
    - [44, 4.94]
  - - [64, 64, 128, 64]
    - [45, 5.657]
  - - [66, 66, 128, 66]
    - [46, 4.449]
  - - [78, 78, 128, 78]
    - [47, 6.615]
  - - [80, 80, 128, 80]
    - [48, 7.413]
  - - [82, 82, 128, 82]
    - [49, 7.299]
  - - [94, 94, 64, 94]
    - [50, 7.096]
  - - [96, 96, 64, 96]
    - [51, 7.955]
  - - [98, 98, 64, 98]
    - [50, 7.771]
  - - [126, 126, 64, 126]
    - [52, 12.851]
  - - [128, 128, 64, 128]
    - [53, 14.962]
  - - [130, 130, 64, 130]
    - [54, 9.394]
  - - [254, 254, 16, 254]
    - [55, 18.609]
  - - [256, 256, 16, 256]
    - [56, 21.452]
  - - [258, 258, 16, 258]
    - [57, 15.569]
  - - [510, 510, 16, 510]
    - [58, 40.148]
  - - [512, 512, 16, 512]
    - [59, 42.205]
  - - [514, 514, 16, 514]
    - [44, 38.156]
- null
