library/src/blas3/Tensile/Logic/asm_full/aquavanjaram/aquavanjaram_Cijk_Ailk_Bjlk_SB_GB.yaml
- {MinimumRequiredVersion: 4.37.0}
- aquavanjaram
- gfx940
- [Device 0049, Device 0050]
    SolutionIndex: 0
    SolutionNameMin: Cijk_Ailk_Bjlk_SB_GB_MT64x64x16_MI32x32x2x1_SN_AMAS0_DTVA0_GRVW1_NEPBS0_NLCA1_PLR9_SVW1_TT1_32_VW1_WG64_4_1_WGM6
    SolutionIndex: 1
    SolutionNameMin: Cijk_Ailk_Bjlk_SB_GB_MT64x64x32_MI32x32x2x1_SN_AMAS0_DTVA0_GRVW4_NEPBS0_NLCA1_PLR17_SVW1_TT1_32_VW1_WG64_4_1_WGM6
    SolutionIndex: 2
    SolutionNameMin: Cijk_Ailk_Bjlk_SB_GB_MT64x64x32_MI32x32x2x1_SN_AMAS0_DTVA0_GRVW2_NEPBS0_NLCA1_PLR17_SVW1_TT1_32_VW1_WG64_4_1_WGM12
    SolutionIndex: 3
    SolutionNameMin: Cijk_Ailk_Bjlk_SB_GB_MT64x64x32_MI32x32x2x1_SN_AMAS0_DTVA0_GRVW2_NEPBS0_NLCA1_PLR17_SVW1_TT1_32_VW1_WG64_4_1_WGM18
    SolutionIndex: 4
    SolutionNameMin: Cijk_Ailk_Bjlk_SB_GB_MT128x64x32_MI32x32x2x1_SN_AMAS0_DTVA0_GRVW1_NEPBS0_NLCA1_PLR17_SVW1_TT2_32_VW1_WG64_4_1_WGM18
    SolutionIndex: 5
    SolutionNameMin: Cijk_Ailk_Bjlk_SB_GB_MT64x64x16_MI32x32x2x1_SN_AMAS0_DTVA0_GRVW1_NEPBS4_NLCA1_PLR9_SVW1_TT1_32_VW1_WG64_4_1_WGM6
    SolutionIndex: 6
    SolutionNameMin: Cijk_Ailk_Bjlk_SB_GB_MT128x64x32_MI32x32x2x1_SN_AMAS3_DTVA0_GRVW1_NEPBS4_NLCA1_PLR17_SVW2_TT2_32_VW2_WG64_4_1_WGM12
    SolutionIndex: 7
    SolutionNameMin: Cijk_Ailk_Bjlk_SB_GB_MT128x64x32_MI32x32x2x1_SN_AMAS0_DTVA0_GRVW1_NEPBS4_NLCA1_PLR17_SVW1_TT2_32_VW1_WG64_4_1_WGM18
    SolutionIndex: 8
    SolutionNameMin: Cijk_Ailk_Bjlk_SB_GB_MT64x64x16_MI32x32x2x1_SN_AMAS0_DTVA0_GRVW2_NEPBS0_NLCA1_PLR9_SVW1_TT1_32_VW1_WG64_4_1_WGM6
    SolutionIndex: 9
    SolutionNameMin: Cijk_Ailk_Bjlk_SB_GB_MT64x64x16_MI32x32x2x1_SN_AMAS0_DTVA0_GRVW1_NEPBS4_NLCA1_PLR9_SVW1_TT1_32_VW1_WG64_4_1_WGM6
    SolutionIndex: 10
    SolutionNameMin: Cijk_Ailk_Bjlk_SB_GB_MT128x64x32_MI32x32x2x1_SN_AMAS3_DTVA0_GRVW2_NEPBS4_NLCA1_PLR17_SVW2_TT2_32_VW2_WG64_4_1_WGM12
    SolutionIndex: 11
    SolutionNameMin: Cijk_Ailk_Bjlk_SB_GB_MT128x64x32_MI32x32x2x1_SN_AMAS3_DTVA0_GRVW2_NEPBS4_NLCA1_PLR17_SVW2_TT2_32_VW2_WG64_4_1_WGM6
    SolutionIndex: 12
    SolutionNameMin: Cijk_Ailk_Bjlk_SB_GB_MT128x128x32_MI32x32x2x1_SN_AMAS3_DTVA0_GRVW2_NEPBS0_NLCA1_PLR17_SVW2_TT2_64_VW2_WG64_4_1_WGM12
    SolutionIndex: 13
    SolutionNameMin: Cijk_Ailk_Bjlk_SB_GB_MT64x64x8_MI32x32x2x1_SN_AMAS0_DTVA0_GRVW1_NEPBS0_NLCA1_PLR5_SVW1_TT1_32_VW1_WG64_4_1_WGM18
    SolutionIndex: 14
    SolutionNameMin: Cijk_Ailk_Bjlk_SB_GB_MT128x128x16_MI16x16x4x1_SN_AMAS3_DTVA1_GRVW2_NEPBS4_NLCA1_PLR5_SVW2_TT2_128_VW2_WG64_4_1_WGM12
    SolutionIndex: 15
    SolutionNameMin: Cijk_Ailk_Bjlk_SB_GB_MT128x64x16_MI16x16x4x1_SN_AMAS3_DTVA0_GRVW4_NEPBS4_NLCA1_PLR1_SVW2_TT4_32_VW2_WG32_8_1_WGM18
    SolutionIndex: 16
    SolutionNameMin: Cijk_Ailk_Bjlk_SB_GB_MT64x64x16_MI32x32x2x1_SN_AMAS0_DTVA0_GRVW1_NEPBS0_NLCA1_PLR9_SVW1_TT1_32_VW1_WG64_4_1_WGM6
    SolutionIndex: 17
    SolutionNameMin: Cijk_Ailk_Bjlk_SB_GB_MT64x64x16_MI32x32x2x1_SN_AMAS0_DTVA0_GRVW4_NEPBS0_NLCA1_PLR9_SVW1_TT1_32_VW1_WG64_4_1_WGM6
    SolutionIndex: 18
    SolutionNameMin: Cijk_Ailk_Bjlk_SB_GB_MT128x64x32_MI32x32x2x1_SN_AMAS3_DTVA0_GRVW4_NEPBS4_NLCA1_PLR17_SVW2_TT2_32_VW2_WG64_4_1_WGM6
    SolutionIndex: 19
    SolutionNameMin: Cijk_Ailk_Bjlk_SB_GB_MT128x64x32_MI16x16x4x1_SN_AMAS3_DTVA0_GRVW2_NEPBS4_NLCA1_PLR9_SVW2_TT4_32_VW2_WG32_8_1_WGM18
    SolutionIndex: 20
    SolutionNameMin: Cijk_Ailk_Bjlk_SB_GB_MT128x128x32_MI32x32x2x1_SN_AMAS3_DTVA0_GRVW2_NEPBS0_NLCA1_PLR17_SVW2_TT2_64_VW2_WG64_4_1_WGM12
    SolutionIndex: 21
    SolutionNameMin: Cijk_Ailk_Bjlk_SB_GB_MT128x128x16_MI32x32x2x1_SN_AMAS3_DTVA0_GRVW4_NEPBS4_NLCA1_PLR1_SVW2_TT2_64_VW2_WG64_4_1_WGM18
    SolutionIndex: 22
    SolutionNameMin: Cijk_Ailk_Bjlk_SB_GB_MT64x64x32_MI32x32x2x1_SN_AMAS0_DTVA0_GRVW1_NEPBS0_NLCA1_PLR17_SVW1_TT1_32_VW1_WG64_4_1_WGM18
    SolutionIndex: 23
    SolutionNameMin: Cijk_Ailk_Bjlk_SB_GB_MT128x128x16_MI16x16x4x1_SN_AMAS3_DTVA1_GRVW2_NEPBS4_NLCA1_PLR5_SVW2_TT2_128_VW2_WG64_4_1_WGM12
    SolutionIndex: 24
    SolutionNameMin: Cijk_Ailk_Bjlk_SB_GB_MT128x128x16_MI32x32x2x1_SN_AMAS3_DTVA0_GRVW4_NEPBS4_NLCA1_PLR1_SVW2_TT2_64_VW2_WG64_4_1_WGM12
    SolutionIndex: 25
    SolutionNameMin: Cijk_Ailk_Bjlk_SB_GB_MT128x64x16_MI16x16x4x1_SN_AMAS3_DTVA0_GRVW4_NEPBS4_NLCA1_PLR1_SVW2_TT2_64_VW2_WG64_4_1_WGM18
    SolutionIndex: 26
    SolutionNameMin: Cijk_Ailk_Bjlk_SB_GB_MT64x32x32_MI16x16x4x1_SN_AMAS0_DTVA0_GRVW1_NEPBS0_NLCA1_PLR9_SVW1_TT1_32_VW1_WG64_4_1_WGM6
    SolutionIndex: 27
    SolutionNameMin: Cijk_Ailk_Bjlk_SB_GB_MT32x64x32_MI16x16x4x1_SN_AMAS0_DTVA0_GRVW1_NEPBS0_NLCA1_PLR9_SVW1_TT1_32_VW1_WG32_8_1_WGM12
    SolutionIndex: 28
    SolutionNameMin: Cijk_Ailk_Bjlk_SB_GB_MT64x32x32_MI16x16x4x1_SN_AMAS0_DTVA0_GRVW1_NEPBS0_NLCA1_PLR9_SVW1_TT2_16_VW1_WG32_8_1_WGM12
    SolutionIndex: 29
    SolutionNameMin: Cijk_Ailk_Bjlk_SB_GB_MT64x64x16_MI32x32x2x1_SN_AMAS0_DTVA0_GRVW1_NEPBS4_NLCA1_PLR9_SVW1_TT1_32_VW1_WG64_4_1_WGM12
    SolutionIndex: 30
    SolutionNameMin: Cijk_Ailk_Bjlk_SB_GB_MT64x64x16_MI32x32x2x1_SN_AMAS0_DTVA0_GRVW4_NEPBS4_NLCA1_PLR9_SVW1_TT1_32_VW1_WG64_4_1_WGM12
    SolutionIndex: 31
    SolutionNameMin: Cijk_Ailk_Bjlk_SB_GB_MT64x64x16_MI32x32x2x1_SN_AMAS0_DTVA0_GRVW1_NEPBS0_NLCA1_PLR9_SVW1_TT1_32_VW1_WG64_4_1_WGM12
    SolutionIndex: 32
    SolutionNameMin: Cijk_Ailk_Bjlk_SB_GB_MT32x64x32_MI16x16x4x1_SN_AMAS3_DTVA0_GRVW2_NEPBS0_NLCA1_PLR9_SVW2_TT2_16_VW2_WG16_16_1_WGM6
    SolutionIndex: 33
    SolutionNameMin: Cijk_Ailk_Bjlk_SB_GB_MT128x64x16_MI16x16x4x1_SN_AMAS0_DTVA1_GRVW1_NEPBS0_NLCA2_PLR5_SVW1_TT2_64_VW1_WG64_4_1_WGM12
    SolutionIndex: 34
    SolutionNameMin: Cijk_Ailk_Bjlk_SB_GB_MT128x64x16_MI32x32x2x1_SN_AMAS0_DTVA0_GRVW1_NEPBS0_NLCA1_PLR9_SVW1_TT2_32_VW1_WG64_4_1_WGM6
    SolutionIndex: 35
    SolutionNameMin: Cijk_Ailk_Bjlk_SB_GB_MT64x128x16_MI32x32x2x1_SN_AMAS0_DTVA0_GRVW1_NEPBS0_NLCA1_PLR9_SVW1_TT1_64_VW1_WG64_4_1_WGM6
    SolutionIndex: 36
    SolutionNameMin: Cijk_Ailk_Bjlk_SB_GB_MT128x64x16_MI32x32x2x1_SN_AMAS0_DTVA0_GRVW1_NEPBS0_NLCA1_PLR9_SVW1_TT2_32_VW1_WG64_4_1_WGM12
    SolutionIndex: 37
    SolutionNameMin: Cijk_Ailk_Bjlk_SB_GB_MT64x64x16_MI32x32x2x1_SN_AMAS0_DTVA0_GRVW4_NEPBS0_NLCA1_PLR9_SVW1_TT1_32_VW1_WG64_4_1_WGM12
    SolutionIndex: 38
    SolutionNameMin: Cijk_Ailk_Bjlk_SB_GB_MT64x32x32_MI16x16x4x1_SN_AMAS3_DTVA0_GRVW2_NEPBS4_NLCA1_PLR9_SVW2_TT2_16_VW2_WG32_8_1_WGM12
    SolutionIndex: 39
    SolutionNameMin: Cijk_Ailk_Bjlk_SB_GB_MT32x64x32_MI16x16x4x1_SN_AMAS3_DTVA0_GRVW2_NEPBS4_NLCA1_PLR9_SVW2_TT2_16_VW2_WG16_16_1_WGM6
    SolutionIndex: 40
    SolutionNameMin: Cijk_Ailk_Bjlk_SB_GB_MT64x64x16_MI16x16x4x1_SN_AMAS3_DTVA0_GRVW2_NEPBS0_NLCA1_PLR5_SVW2_TT2_32_VW2_WG32_8_1_WGM6
    SolutionIndex: 41
    SolutionNameMin: Cijk_Ailk_Bjlk_SB_GB_MT64x64x16_MI16x16x4x1_SN_AMAS3_DTVA0_GRVW1_NEPBS4_NLCA1_PLR5_SVW2_TT2_32_VW2_WG32_8_1_WGM6
    SolutionIndex: 42
    SolutionNameMin: Cijk_Ailk_Bjlk_SB_GB_MT64x64x16_MI32x32x2x1_SN_AMAS0_DTVA0_GRVW2_NEPBS0_NLCA1_PLR9_SVW1_TT1_32_VW1_WG64_4_1_WGM12
    SolutionIndex: 43
    SolutionNameMin: Cijk_Ailk_Bjlk_SB_GB_MT64x64x32_MI16x16x4x1_SN_AMAS3_DTVA0_GRVW2_NEPBS0_NLCA1_PLR9_SVW2_TT2_32_VW2_WG32_8_1_WGM6
    SolutionIndex: 44
    SolutionNameMin: Cijk_Ailk_Bjlk_SB_GB_MT64x64x32_MI16x16x4x1_SN_AMAS3_DTVA0_GRVW1_NEPBS0_NLCA1_PLR9_SVW2_TT2_32_VW2_WG32_8_1_WGM12
    SolutionIndex: 45
    SolutionNameMin: Cijk_Ailk_Bjlk_SB_GB_MT64x64x16_MI16x16x4x1_SN_AMAS3_DTVA0_GRVW1_NEPBS0_NLCA1_PLR5_SVW2_TT2_32_VW2_WG32_8_1_WGM12
    SolutionIndex: 46
    SolutionNameMin: Cijk_Ailk_Bjlk_SB_GB_MT64x64x16_MI16x16x4x1_SN_AMAS3_DTVA0_GRVW4_NEPBS0_NLCA1_PLR5_SVW2_TT2_32_VW2_WG32_8_1_WGM6
    SolutionIndex: 47
    SolutionNameMin: Cijk_Ailk_Bjlk_SB_GB_MT128x64x16_MI32x32x2x1_SN_AMAS3_DTVA0_GRVW2_NEPBS4_NLCA1_PLR9_SVW2_TT2_32_VW2_WG64_4_1_WGM12
    SolutionIndex: 48
    SolutionNameMin: Cijk_Ailk_Bjlk_SB_GB_MT128x64x16_MI32x32x2x1_SN_AMAS3_DTVA0_GRVW2_NEPBS0_NLCA1_PLR9_SVW2_TT2_32_VW2_WG64_4_1_WGM12
    SolutionIndex: 49
    SolutionNameMin: Cijk_Ailk_Bjlk_SB_GB_MT64x32x32_MI16x16x4x1_SN_AMAS0_DTVA0_GRVW4_NEPBS0_NLCA1_PLR9_SVW1_TT2_16_VW1_WG32_8_1_WGM6
    SolutionIndex: 50
    SolutionNameMin: Cijk_Ailk_Bjlk_SB_GB_MT64x64x16_MI16x16x4x1_SN_AMAS3_DTVA0_GRVW2_NEPBS4_NLCA1_PLR5_SVW2_TT2_32_VW2_WG32_8_1_WGM12
    SolutionIndex: 51
    SolutionNameMin: Cijk_Ailk_Bjlk_SB_GB_MT128x64x16_MI32x32x2x1_SN_AMAS0_DTVA0_GRVW4_NEPBS0_NLCA1_PLR9_SVW1_TT2_32_VW1_WG64_4_1_WGM12
    SolutionIndex: 52
    SolutionNameMin: Cijk_Ailk_Bjlk_SB_GB_MT64x64x16_MI16x16x4x1_SN_AMAS3_DTVA0_GRVW4_NEPBS4_NLCA1_PLR5_SVW2_TT2_32_VW2_WG32_8_1_WGM12
- - - [511, 511, 16, 511]
    - [0, 62.557]
  - - [513, 513, 16, 513]
    - [5, 55.826]
  - - [1023, 1023, 16, 1023]
    - [6, 87.416]
  - - [1025, 1025, 16, 1025]
    - [1, 75.613]
  - - [2047, 2047, 16, 2047]
    - [4, 96.231]
  - - [2049, 2049, 16, 2049]
    - [2, 89.925]
  - - [4095, 2047, 16, 2047]
    - [7, 96.687]
  - - [4097, 2049, 16, 2049]
    - [3, 91.689]
  - - [510, 510, 16, 510]
    - [8, 63.032]
  - - [514, 514, 16, 514]
    - [9, 56.128]
  - - [1022, 1022, 16, 1022]
    - [10, 91.373]
  - - [1026, 1026, 16, 1026]
    - [11, 76.216]
  - - [2046, 2046, 16, 2046]
    - [12, 96.874]
  - - [2050, 2050, 16, 2050]
    - [13, 90.762]
  - - [4094, 2046, 16, 2046]
    - [14, 97.431]
  - - [4098, 2050, 16, 2050]
    - [15, 91.602]
  - - [508, 508, 16, 508]
    - [16, 63.022]
  - - [512, 512, 16, 512]
    - [16, 70.401]
  - - [516, 516, 16, 516]
    - [17, 57.437]
  - - [1020, 1020, 16, 1020]
    - [18, 91.578]
  - - [1024, 1024, 16, 1024]
    - [19, 93.619]
  - - [1028, 1028, 16, 1028]
    - [18, 76.849]
  - - [2044, 2044, 16, 2044]
    - [20, 96.761]
  - - [2048, 2048, 16, 2048]
    - [21, 98.15]
  - - [2052, 2052, 16, 2052]
    - [22, 90.958]
  - - [4092, 2044, 16, 2044]
    - [23, 97.625]
  - - [4096, 2048, 16, 2048]
    - [24, 98.459]
  - - [4100, 2052, 16, 2052]
    - [25, 91.987]
  - - [64, 1, 1000, 64]
    - [26, 0.477]
  - - [1, 64, 1000, 64]
    - [27, 0.473]
  - - [31, 31, 1000, 31]
    - [28, 3.867]
  - - [33, 33, 1000, 33]
    - [29, 3.71]
  - - [47, 47, 1000, 47]
    - [29, 8.351]
  - - [49, 49, 1000, 49]
    - [30, 9.341]
  - - [63, 63, 128, 63]
    - [31, 5.323]
  - - [65, 65, 128, 65]
    - [32, 4.176]
  - - [79, 79, 128, 79]
    - [33, 6.696]
  - - [81, 81, 128, 81]
    - [34, 7.192]
  - - [95, 95, 64, 95]
    - [35, 7.184]
  - - [97, 97, 64, 97]
    - [35, 7.551]
  - - [127, 127, 64, 127]
    - [36, 14.535]
  - - [129, 129, 64, 129]
    - [37, 11.807]
  - - [255, 255, 16, 255]
    - [0, 23.058]
  - - [257, 257, 16, 257]
    - [31, 22.106]
  - - [30, 30, 1000, 30]
    - [38, 3.994]
  - - [32, 32, 1000, 32]
    - [39, 5.21]
  - - [34, 34, 1000, 34]
    - [40, 4.311]
  - - [46, 46, 1000, 46]
    - [41, 8.401]
  - - [48, 48, 1000, 48]
    - [41, 10.717]
  - - [50, 50, 1000, 50]
    - [42, 9.786]
  - - [62, 62, 128, 62]
    - [43, 5.473]
  - - [64, 64, 128, 64]
    - [44, 6.276]
  - - [66, 66, 128, 66]
    - [45, 4.602]
  - - [78, 78, 128, 78]
    - [46, 6.96]
  - - [80, 80, 128, 80]
    - [47, 7.923]
  - - [82, 82, 128, 82]
    - [48, 7.939]
  - - [94, 94, 64, 94]
    - [48, 7.468]
  - - [96, 96, 64, 96]
    - [49, 9.291]
  - - [98, 98, 64, 98]
    - [48, 8.311]
  - - [126, 126, 64, 126]
    - [48, 16.045]
  - - [128, 128, 64, 128]
    - [8, 17.954]
  - - [130, 130, 64, 130]
    - [50, 12.343]
  - - [254, 254, 16, 254]
    - [42, 23.692]
  - - [256, 256, 16, 256]
    - [51, 27.808]
  - - [258, 258, 16, 258]
    - [52, 23.353]
- null
- null
- DeviceEfficiency
