library/src/blas3/Tensile/Logic/asm_full/aquavanjaram/aquavanjaram_Cijk_Alik_Bjlk_DB_GB.yaml
- {MinimumRequiredVersion: 4.37.0}
- aquavanjaram
- gfx940
- [Device 0049, Device 0050]
    SolutionIndex: 0
    SolutionNameMin: Cijk_Alik_Bjlk_DB_GB_MT128x128x8_MI16x16x4x1_SN_AMAS3_DTVB0_GRVW2_LBSPP128_LPA2_LRVW1_NEPBS0_NLCB1_PLR1_SVW2_TT4_64_TLDS1_UMLDSA1_VW2_WG32_8_1_WGM12
    SolutionIndex: 1
    SolutionNameMin: Cijk_Alik_Bjlk_DB_GB_MT64x128x8_MI16x16x4x1_SN_AMAS0_DTVB0_GRVW2_LBSPP128_LPA2_LRVW1_NEPBS0_NLCB1_PLR1_SVW1_TT4_32_TLDS1_UMLDSA1_VW1_WG16_16_1_WGM18
    SolutionIndex: 2
    SolutionNameMin: Cijk_Alik_Bjlk_DB_GB_MT128x128x8_MI16x16x4x1_SN_AMAS0_DTVB0_GRVW2_LBSPP0_LPA1_LRVW1_NEPBS4_NLCB1_PLR1_SVW1_TT2_128_TLDS0_UMLDSA0_VW1_WG64_4_1_WGM12
    SolutionIndex: 3
    SolutionNameMin: Cijk_Alik_Bjlk_DB_GB_MT128x128x8_MI16x16x4x1_SN_AMAS3_DTVB0_GRVW2_LBSPP0_LPA2_LRVW1_NEPBS4_NLCB1_PLR3_SVW2_TT4_64_TLDS0_UMLDSA0_VW2_WG32_8_1_WGM12
    SolutionIndex: 4
    SolutionNameMin: Cijk_Alik_Bjlk_DB_GB_MT128x128x8_MI16x16x4x1_SN_AMAS3_DTVB0_GRVW1_LBSPP128_LPA1_LRVW1_NEPBS4_NLCB1_PLR1_SVW2_TT8_32_TLDS1_UMLDSA1_VW2_WG16_16_1_WGM12
    SolutionIndex: 5
    SolutionNameMin: Cijk_Alik_Bjlk_DB_GB_MT128x128x8_MI16x16x4x1_SN_AMAS3_DTVB0_GRVW2_LBSPP128_LPA2_LRVW1_NEPBS4_NLCB1_PLR3_SVW2_TT8_32_TLDS1_UMLDSA1_VW2_WG16_16_1_WGM12
    SolutionIndex: 6
    SolutionNameMin: Cijk_Alik_Bjlk_DB_GB_MT64x128x8_MI16x16x4x1_SN_AMAS0_DTVB0_GRVW2_LBSPP0_LPA1_LRVW1_NEPBS4_NLCB1_PLR1_SVW1_TT4_32_TLDS0_UMLDSA0_VW1_WG16_16_1_WGM6
    SolutionIndex: 7
    SolutionNameMin: Cijk_Alik_Bjlk_DB_GB_MT64x128x8_MI16x16x4x1_SN_AMAS3_DTVB0_GRVW2_LBSPP0_LPA2_LRVW1_NEPBS4_NLCB1_PLR1_SVW2_TT4_32_TLDS0_UMLDSA0_VW2_WG16_16_1_WGM6
    SolutionIndex: 8
    SolutionNameMin: Cijk_Alik_Bjlk_DB_GB_MT64x128x8_MI16x16x4x1_SN_AMAS3_DTVB0_GRVW2_LBSPP128_LPA2_LRVW1_NEPBS0_NLCB1_PLR3_SVW2_TT4_32_TLDS1_UMLDSA1_VW2_WG16_16_1_WGM18
    SolutionIndex: 9
    SolutionNameMin: Cijk_Alik_Bjlk_DB_GB_MT64x128x16_MI16x16x4x1_SN_AMAS3_DTVB1_GRVW2_LBSPP128_LPA4_LRVW2_NEPBS0_NLCB1_PLR5_SVW2_TT4_32_TLDS1_UMLDSA1_VW2_WG16_16_1_WGM12
    SolutionIndex: 10
    SolutionNameMin: Cijk_Alik_Bjlk_DB_GB_MT128x64x16_MI16x16x4x1_SN_AMAS3_DTVB0_GRVW2_LBSPP128_LPA2_LRVW1_NEPBS4_NLCB1_PLR5_SVW2_TT2_64_TLDS1_UMLDSA1_VW2_WG64_4_1_WGM6
    SolutionIndex: 11
    SolutionNameMin: Cijk_Alik_Bjlk_DB_GB_MT64x128x16_MI16x16x4x1_SN_AMAS3_DTVB1_GRVW2_LBSPP0_LPA2_LRVW1_NEPBS4_NLCB1_PLR1_SVW2_TT4_32_TLDS0_UMLDSA0_VW2_WG16_16_1_WGM6
    SolutionIndex: 12
    SolutionNameMin: Cijk_Alik_Bjlk_DB_GB_MT64x128x16_MI16x16x4x1_SN_AMAS0_DTVB0_GRVW2_LBSPP0_LPA1_LRVW1_NEPBS4_NLCB1_PLR5_SVW1_TT4_32_TLDS0_UMLDSA0_VW1_WG16_16_1_WGM6
    SolutionIndex: 13
    SolutionNameMin: Cijk_Alik_Bjlk_DB_GB_MT64x128x16_MI16x16x4x1_SN_AMAS3_DTVB1_GRVW2_LBSPP0_LPA2_LRVW1_NEPBS4_NLCB1_PLR5_SVW2_TT4_32_TLDS0_UMLDSA0_VW2_WG16_16_1_WGM6
    SolutionIndex: 14
    SolutionNameMin: Cijk_Alik_Bjlk_DB_GB_MT64x128x16_MI16x16x4x1_SN_AMAS3_DTVB1_GRVW2_LBSPP0_LPA2_LRVW1_NEPBS4_NLCB1_PLR1_SVW2_TT4_32_TLDS0_UMLDSA0_VW2_WG16_16_1_WGM12
    SolutionIndex: 15
    SolutionNameMin: Cijk_Alik_Bjlk_DB_GB_MT128x128x16_MI16x16x4x1_SN_AMAS3_DTVB1_GRVW2_LBSPP128_LPA4_LRVW2_NEPBS4_NLCB1_PLR5_SVW2_TT8_32_TLDS1_UMLDSA1_VW2_WG16_16_1_WGM12
    SolutionIndex: 16
    SolutionNameMin: Cijk_Alik_Bjlk_DB_GB_MT128x128x8_MI16x16x4x1_SN_AMAS3_DTVB0_GRVW1_LBSPP128_LPA1_LRVW1_NEPBS4_NLCB1_PLR1_SVW2_TT2_128_TLDS1_UMLDSA1_VW2_WG64_4_1_WGM12
    SolutionIndex: 17
    SolutionNameMin: Cijk_Alik_Bjlk_DB_GB_MT128x128x16_MI16x16x4x1_SN_AMAS3_DTVB1_GRVW2_LBSPP128_LPA4_LRVW2_NEPBS0_NLCB1_PLR5_SVW2_TT8_32_TLDS1_UMLDSA1_VW2_WG16_16_1_WGM12
    SolutionIndex: 18
    SolutionNameMin: Cijk_Alik_Bjlk_DB_GB_MT128x64x16_MI16x16x4x1_SN_AMAS0_DTVB0_GRVW2_LBSPP128_LPA2_LRVW1_NEPBS0_NLCB1_PLR1_SVW1_TT4_32_TLDS1_UMLDSA1_VW1_WG32_8_1_WGM18
    SolutionIndex: 19
    SolutionNameMin: Cijk_Alik_Bjlk_DB_GB_MT64x32x16_MI16x16x4x1_SN_AMAS3_DTVB0_GRVW1_LBSPP128_LPA4_LRVW2_NEPBS4_NLCB1_PLR5_SVW2_TT2_16_TLDS1_UMLDSA1_VW2_WG32_8_1_WGM12
    SolutionIndex: 20
    SolutionNameMin: Cijk_Alik_Bjlk_DB_GB_MT32x64x16_MI16x16x4x1_SN_AMAS0_DTVB1_GRVW1_LBSPP128_LPA4_LRVW2_NEPBS4_NLCB1_PLR5_SVW1_TT2_16_TLDS1_UMLDSA1_VW1_WG16_16_1_WGM6
    SolutionIndex: 21
    SolutionNameMin: Cijk_Alik_Bjlk_DB_GB_MT32x64x32_MI16x16x4x1_SN_AMAS0_DTVB1_GRVW1_LBSPP0_LPA1_LRVW1_NEPBS0_NLCB1_PLR9_SVW1_TT2_16_TLDS0_UMLDSA0_VW1_WG16_16_1_WGM6
    SolutionIndex: 22
    SolutionNameMin: Cijk_Alik_Bjlk_DB_GB_MT64x64x16_MI16x16x4x1_SN_AMAS0_DTVB0_GRVW1_LBSPP0_LPA1_LRVW1_NEPBS0_NLCB1_PLR5_SVW1_TT4_16_TLDS0_UMLDSA0_VW1_WG16_16_1_WGM6
    SolutionIndex: 23
    SolutionNameMin: Cijk_Alik_Bjlk_DB_GB_MT64x64x16_MI16x16x4x1_SN_AMAS0_DTVB0_GRVW1_LBSPP0_LPA1_LRVW1_NEPBS0_NLCB1_PLR5_SVW1_TT1_64_TLDS0_UMLDSA0_VW1_WG64_4_1_WGM6
    SolutionIndex: 24
    SolutionNameMin: Cijk_Alik_Bjlk_DB_GB_MT64x64x32_MI16x16x4x1_SN_AMAS0_DTVB1_GRVW1_LBSPP256_LPA1_LRVW1_NEPBS4_NLCB1_PLR9_SVW1_TT4_16_TLDS1_UMLDSA1_VW1_WG16_16_1_WGM12
    SolutionIndex: 25
    SolutionNameMin: Cijk_Alik_Bjlk_DB_GB_MT32x64x16_MI16x16x4x1_SN_AMAS0_DTVB0_GRVW1_LBSPP128_LPA4_LRVW2_NEPBS4_NLCB1_PLR5_SVW1_TT2_16_TLDS1_UMLDSA1_VW1_WG16_16_1_WGM6
    SolutionIndex: 26
    SolutionNameMin: Cijk_Alik_Bjlk_DB_GB_MT64x64x16_MI16x16x4x1_SN_AMAS3_DTVB0_GRVW2_LBSPP0_LPA2_LRVW1_NEPBS0_NLCB1_PLR5_SVW2_TT2_32_TLDS0_UMLDSA0_VW2_WG32_8_1_WGM6
    SolutionIndex: 27
    SolutionNameMin: Cijk_Alik_Bjlk_DB_GB_MT64x128x16_MI16x16x4x1_SN_AMAS0_DTVB1_GRVW1_LBSPP0_LPA1_LRVW1_NEPBS0_NLCB2_PLR1_SVW1_TT4_32_TLDS0_UMLDSA0_VW1_WG16_16_1_WGM12
    SolutionIndex: 28
    SolutionNameMin: Cijk_Alik_Bjlk_DB_GB_MT64x128x16_MI16x16x4x1_SN_AMAS0_DTVB0_GRVW1_LBSPP0_LPA1_LRVW1_NEPBS0_NLCB1_PLR1_SVW1_TT4_32_TLDS0_UMLDSA0_VW1_WG16_16_1_WGM12
    SolutionIndex: 29
    SolutionNameMin: Cijk_Alik_Bjlk_DB_GB_MT64x128x16_MI16x16x4x1_SN_AMAS0_DTVB0_GRVW1_LBSPP128_LPA1_LRVW1_NEPBS0_NLCB1_PLR5_SVW1_TT4_32_TLDS1_UMLDSA1_VW1_WG16_16_1_WGM6
    SolutionIndex: 30
    SolutionNameMin: Cijk_Alik_Bjlk_DB_GB_MT64x128x16_MI16x16x4x1_SN_AMAS0_DTVB0_GRVW1_LBSPP0_LPA1_LRVW1_NEPBS0_NLCB1_PLR5_SVW1_TT4_32_TLDS0_UMLDSA0_VW1_WG16_16_1_WGM12
    SolutionIndex: 31
    SolutionNameMin: Cijk_Alik_Bjlk_DB_GB_MT64x128x16_MI16x16x4x1_SN_AMAS3_DTVB0_GRVW2_LBSPP0_LPA2_LRVW1_NEPBS4_NLCB1_PLR5_SVW2_TT4_32_TLDS0_UMLDSA0_VW2_WG16_16_1_WGM6
    SolutionIndex: 32
    SolutionNameMin: Cijk_Alik_Bjlk_DB_GB_MT64x128x16_MI16x16x4x1_SN_AMAS3_DTVB0_GRVW2_LBSPP0_LPA2_LRVW1_NEPBS0_NLCB1_PLR5_SVW2_TT4_32_TLDS0_UMLDSA0_VW2_WG16_16_1_WGM12
    SolutionIndex: 33
    SolutionNameMin: Cijk_Alik_Bjlk_DB_GB_MT64x32x16_MI16x16x4x1_SN_AMAS3_DTVB0_GRVW2_LBSPP128_LPA4_LRVW2_NEPBS0_NLCB1_PLR5_SVW2_TT2_16_TLDS1_UMLDSA1_VW2_WG32_8_1_WGM6
    SolutionIndex: 34
    SolutionNameMin: Cijk_Alik_Bjlk_DB_GB_MT32x64x16_MI16x16x4x1_SN_AMAS0_DTVB1_GRVW1_LBSPP128_LPA4_LRVW2_NEPBS0_NLCB1_PLR5_SVW1_TT2_16_TLDS1_UMLDSA1_VW1_WG16_16_1_WGM6
    SolutionIndex: 35
    SolutionNameMin: Cijk_Alik_Bjlk_DB_GB_MT64x64x16_MI16x16x4x1_SN_AMAS3_DTVB0_GRVW1_LBSPP0_LPA2_LRVW1_NEPBS0_NLCB1_PLR5_SVW2_TT4_16_TLDS0_UMLDSA0_VW2_WG16_16_1_WGM6
    SolutionIndex: 36
    SolutionNameMin: Cijk_Alik_Bjlk_DB_GB_MT64x64x16_MI16x16x4x1_SN_AMAS3_DTVB0_GRVW2_LBSPP128_LPA4_LRVW2_NEPBS4_NLCB1_PLR5_SVW2_TT4_16_TLDS1_UMLDSA1_VW2_WG16_16_1_WGM6
    SolutionIndex: 37
    SolutionNameMin: Cijk_Alik_Bjlk_DB_GB_MT64x64x16_MI16x16x4x1_SN_AMAS0_DTVB0_GRVW1_LBSPP0_LPA1_LRVW1_NEPBS0_NLCB1_PLR5_SVW1_TT1_64_TLDS0_UMLDSA0_VW1_WG64_4_1_WGM12
    SolutionIndex: 38
    SolutionNameMin: Cijk_Alik_Bjlk_DB_GB_MT64x64x16_MI16x16x4x1_SN_AMAS3_DTVB0_GRVW1_LBSPP128_LPA1_LRVW1_NEPBS0_NLCB1_PLR5_SVW2_TT2_32_TLDS1_UMLDSA1_VW2_WG32_8_1_WGM6
    SolutionIndex: 39
    SolutionNameMin: Cijk_Alik_Bjlk_DB_GB_MT64x64x16_MI16x16x4x1_SN_AMAS3_DTVB0_GRVW2_LBSPP0_LPA2_LRVW1_NEPBS4_NLCB1_PLR5_SVW2_TT2_32_TLDS0_UMLDSA0_VW2_WG32_8_1_WGM6
    SolutionIndex: 40
    SolutionNameMin: Cijk_Alik_Bjlk_DB_GB_MT64x64x32_MI16x16x4x1_SN_AMAS0_DTVB0_GRVW2_LBSPP256_LPA4_LRVW2_NEPBS0_NLCB1_PLR9_SVW1_TT2_32_TLDS1_UMLDSA1_VW1_WG32_8_1_WGM12
    SolutionIndex: 41
    SolutionNameMin: Cijk_Alik_Bjlk_DB_GB_MT64x128x16_MI16x16x4x1_SN_AMAS3_DTVB1_GRVW2_LBSPP128_LPA4_LRVW2_NEPBS0_NLCB1_PLR5_SVW2_TT4_32_TLDS1_UMLDSA1_VW2_WG16_16_1_WGM6
    SolutionIndex: 42
    SolutionNameMin: Cijk_Alik_Bjlk_DB_GB_MT64x128x16_MI16x16x4x1_SN_AMAS3_DTVB1_GRVW2_LBSPP0_LPA2_LRVW1_NEPBS0_NLCB1_PLR5_SVW2_TT4_32_TLDS0_UMLDSA0_VW2_WG16_16_1_WGM6
    SolutionIndex: 43
    SolutionNameMin: Cijk_Alik_Bjlk_DB_GB_MT64x128x16_MI16x16x4x1_SN_AMAS3_DTVB1_GRVW2_LBSPP0_LPA2_LRVW2_NEPBS0_NLCB1_PLR5_SVW2_TT4_32_TLDS0_UMLDSA0_VW2_WG16_16_1_WGM12
    SolutionIndex: 44
    SolutionNameMin: Cijk_Alik_Bjlk_DB_GB_MT128x64x16_MI16x16x4x1_SN_AMAS3_DTVB0_GRVW2_LBSPP0_LPA2_LRVW1_NEPBS0_NLCB1_PLR5_SVW2_TT4_32_TLDS0_UMLDSA0_VW2_WG32_8_1_WGM6
    SolutionIndex: 45
    SolutionNameMin: Cijk_Alik_Bjlk_DB_GB_MT64x128x16_MI16x16x4x1_SN_AMAS3_DTVB1_GRVW2_LBSPP0_LPA2_LRVW1_NEPBS0_NLCB1_PLR1_SVW2_TT4_32_TLDS0_UMLDSA0_VW2_WG16_16_1_WGM6
    SolutionIndex: 46
    SolutionNameMin: Cijk_Alik_Bjlk_DB_GB_MT64x128x16_MI16x16x4x1_SN_AMAS3_DTVB1_GRVW2_LBSPP128_LPA4_LRVW2_NEPBS4_NLCB1_PLR5_SVW2_TT4_32_TLDS1_UMLDSA1_VW2_WG16_16_1_WGM12
    SolutionIndex: 47
    SolutionNameMin: Cijk_Alik_Bjlk_DB_GB_MT64x64x16_MI16x16x4x1_SN_AMAS3_DTVB0_GRVW2_LBSPP0_LPA2_LRVW1_NEPBS0_NLCB1_PLR5_SVW2_TT2_32_TLDS0_UMLDSA0_VW2_WG32_8_1_WGM12
    SolutionIndex: 48
    SolutionNameMin: Cijk_Alik_Bjlk_DB_GB_MT128x128x16_MI16x16x4x1_SN_AMAS3_DTVB1_GRVW2_LBSPP0_LPA2_LRVW1_NEPBS0_NLCB1_PLR1_SVW2_TT8_32_TLDS0_UMLDSA0_VW2_WG16_16_1_WGM6
- - - [511, 511, 16, 511]
    - [1, 35.903]
  - - [513, 513, 16, 513]
    - [5, 32.917]
  - - [1023, 1023, 16, 1023]
    - [6, 71.394]
  - - [1025, 1025, 16, 1025]
    - [7, 65.27]
  - - [2047, 2047, 16, 2047]
    - [4, 88.471]
  - - [2049, 2049, 16, 2049]
    - [0, 76.791]
  - - [4095, 2047, 16, 2047]
    - [2, 90.782]
  - - [4097, 2049, 16, 2049]
    - [3, 77.176]
  - - [510, 510, 16, 510]
    - [8, 38.812]
  - - [512, 512, 16, 512]
    - [9, 39.293]
  - - [514, 514, 16, 514]
    - [10, 32.801]
  - - [1022, 1022, 16, 1022]
    - [11, 77.328]
  - - [1024, 1024, 16, 1024]
    - [12, 79.93]
  - - [1026, 1026, 16, 1026]
    - [13, 66.987]
  - - [2046, 2046, 16, 2046]
    - [14, 91.681]
  - - [2048, 2048, 16, 2048]
    - [15, 91.834]
  - - [2050, 2050, 16, 2050]
    - [16, 77.377]
  - - [4094, 2046, 16, 2046]
    - [15, 92.608]
  - - [4096, 2048, 16, 2048]
    - [17, 92.673]
  - - [4098, 2050, 16, 2050]
    - [18, 76.086]
  - - [64, 1, 1000, 64]
    - [19, 0.38]
  - - [1, 64, 1000, 64]
    - [20, 0.403]
  - - [31, 31, 1000, 31]
    - [21, 2.942]
  - - [33, 33, 1000, 33]
    - [22, 2.868]
  - - [47, 47, 1000, 47]
    - [23, 5.84]
  - - [49, 49, 1000, 49]
    - [24, 5.678]
  - - [63, 63, 128, 63]
    - [25, 4.612]
  - - [65, 65, 128, 65]
    - [26, 3.723]
  - - [79, 79, 128, 79]
    - [27, 5.822]
  - - [81, 81, 128, 81]
    - [28, 5.887]
  - - [95, 95, 64, 95]
    - [29, 6.481]
  - - [97, 97, 64, 97]
    - [29, 6.547]
  - - [127, 127, 64, 127]
    - [30, 11.189]
  - - [129, 129, 64, 129]
    - [31, 7.931]
  - - [255, 255, 16, 255]
    - [30, 17.573]
  - - [257, 257, 16, 257]
    - [32, 14.175]
  - - [30, 30, 1000, 30]
    - [33, 3.026]
  - - [32, 32, 1000, 32]
    - [34, 3.885]
  - - [34, 34, 1000, 34]
    - [35, 3.392]
  - - [46, 46, 1000, 46]
    - [36, 6.093]
  - - [48, 48, 1000, 48]
    - [37, 7.681]
  - - [50, 50, 1000, 50]
    - [38, 6.783]
  - - [62, 62, 128, 62]
    - [39, 4.777]
  - - [64, 64, 128, 64]
    - [40, 5.462]
  - - [66, 66, 128, 66]
    - [41, 4.225]
  - - [78, 78, 128, 78]
    - [42, 6.335]
  - - [80, 80, 128, 80]
    - [43, 7.175]
  - - [82, 82, 128, 82]
    - [42, 7.131]
  - - [94, 94, 64, 94]
    - [41, 6.815]
  - - [96, 96, 64, 96]
    - [44, 7.289]
  - - [98, 98, 64, 98]
    - [45, 7.384]
  - - [126, 126, 64, 126]
    - [46, 12.936]
  - - [128, 128, 64, 128]
    - [45, 14.54]
  - - [130, 130, 64, 130]
    - [47, 8.775]
  - - [254, 254, 16, 254]
    - [41, 19.162]
  - - [256, 256, 16, 256]
    - [41, 22.91]
  - - [258, 258, 16, 258]
    - [48, 14.008]
- null
- null
- DeviceEfficiency
