library/src/blas3/Tensile/Logic/asm_full/aquavanjaram/aquavanjaram_Cijk_Alik_Bjlk_F8B8B8S_BH.yaml
- {MinimumRequiredVersion: 4.36.0}
- aquavanjaram
- gfx940
- [Device 0049, Device 0050]
    SolutionIndex: 0
    SolutionNameMin: Cijk_Alik_Bjlk_F8B8B8S_BH_MT256x256x32_MI32x32x16x1_SN_1LDSB0_FL2_GRVW4_LPB8_PLR3_SU0_SUS0_SRVW16_WGM4
    SolutionIndex: 1
    SolutionNameMin: Cijk_Alik_Bjlk_F8B8B8S_BH_MT256x256x32_MI32x32x16x1_SN_1LDSB0_FL2_GRVW4_LPB8_PLR3_SU0_SUS0_SRVW16_WGM12
    SolutionIndex: 2
    SolutionNameMin: Cijk_Alik_Bjlk_F8B8B8S_BH_MT256x256x32_MI32x32x16x1_SN_1LDSB0_FL2_GRVW4_LPB8_PLR3_SU0_SUS0_SRVW16_WGM19
    SolutionIndex: 3
    SolutionNameMin: Cijk_Alik_Bjlk_F8B8B8S_BH_MT256x256x32_MI32x32x16x1_SN_1LDSB0_FL2_GRVW4_LPB8_PLR3_SU32_SUS256_SRVW16_WGM19
    SolutionIndex: 4
    SolutionNameMin: Cijk_Alik_Bjlk_F8B8B8S_BH_MT256x256x32_MI32x32x16x1_SN_1LDSB0_FL1_GRVW4_LPB8_PLR3_SU32_SUS256_SRVW16_WGM20
    SolutionIndex: 5
    SolutionNameMin: Cijk_Alik_Bjlk_F8B8B8S_BH_MT256x256x32_MI32x32x16x1_SN_1LDSB0_FL2_GRVW4_LPB8_PLR3_SU32_SUS256_SRVW16_WGM20
    SolutionIndex: 6
    SolutionNameMin: Cijk_Alik_Bjlk_F8B8B8S_BH_MT64x64x64_MI32x32x16x1_SN_GRVW4_LPB16_NEPBS8_NLCA2_SU0_SUM0_SUS0_TSGRA0_TSGRB2_UMLDSB1_WGM1
    SolutionIndex: 7
    SolutionNameMin: Cijk_Alik_Bjlk_F8B8B8S_BH_MT64x64x64_MI32x32x16x1_SN_GRVW16_LPB16_NEPBS0_NLCA1_SU0_SUM0_SUS0_TSGRA0_TSGRB1_UMLDSB1_WGM4
    SolutionIndex: 8
    SolutionNameMin: Cijk_Alik_Bjlk_F8B8B8S_BH_MT64x64x64_MI32x32x16x1_SN_GRVW16_LPB16_NEPBS8_NLCA1_SU32_SUM0_SUS128_TSGRA0_TSGRB0_UMLDSB1_WGM12
    SolutionIndex: 9
    SolutionNameMin: Cijk_Alik_Bjlk_F8B8B8S_BH_MT64x64x64_MI32x32x16x1_SN_GRVW4_LPB16_NEPBS8_NLCA1_SU32_SUM2_SUS128_TSGRA1_TSGRB0_UMLDSB1_WGM12
    SolutionIndex: 10
    SolutionNameMin: Cijk_Alik_Bjlk_F8B8B8S_BH_MT64x64x64_MI32x32x16x1_SN_GRVW16_LPB16_NEPBS0_NLCA1_SU0_SUM0_SUS0_TSGRA0_TSGRB1_UMLDSB1_WGM12
- - - [6144, 4864, 1, 4096]
    - [3, 49.611]
  - - [6144, 4864, 1, 8192]
    - [5, 52.266]
  - - [6144, 4864, 1, 12288]
    - [5, 52.707]
  - - [6144, 4864, 1, 16384]
    - [4, 54.092]
  - - [5376, 4864, 1, 4096]
    - [3, 43.872]
  - - [4864, 3072, 1, 4096]
    - [3, 48.632]
  - - [6144, 4864, 1, 4352]
    - [0, 53.404]
  - - [6144, 4864, 1, 8448]
    - [2, 55.709]
  - - [6144, 4864, 1, 16640]
    - [1, 56.814]
  - - [4, 4, 1, 16]
    - [6, 0.0]
  - - [4, 64, 1, 64]
    - [7, 0.0]
  - - [16, 64, 1, 64]
    - [8, 0.001]
  - - [64, 4, 1, 64]
    - [9, 0.0]
  - - [64, 16, 1, 64]
    - [10, 0.001]
- null
- null
- DeviceEfficiency
