library/src/blas3/Tensile/Logic/asm_full/aquavanjaram/aquavanjaram_Cijk_Ailk_Bljk_DB_GB.yaml
- {MinimumRequiredVersion: 4.37.0}
- aquavanjaram
- gfx940
- [Device 0049, Device 0050]
    SolutionIndex: 0
    SolutionNameMin: Cijk_Ailk_Bljk_DB_GB_MT128x64x16_MI16x16x4x1_SN_AMAS3_DTVA0_GRVW2_LBSPP128_LPB4_LRVW2_MIAV0_NEPBS4_NLCA1_PLR5_SVW2_TT2_64_TLDS1_UMLDSB1_VW2_WG64_4_1_WGM18
    SolutionIndex: 1
    SolutionNameMin: Cijk_Ailk_Bljk_DB_GB_MT128x64x16_MI16x16x4x1_SN_AMAS0_DTVA0_GRVW2_LBSPP0_LPB1_LRVW1_MIAV0_NEPBS4_NLCA1_PLR5_SVW1_TT4_32_TLDS0_UMLDSB0_VW1_WG32_8_1_WGM12
    SolutionIndex: 2
    SolutionNameMin: Cijk_Ailk_Bljk_DB_GB_MT128x64x8_MI16x16x4x1_SN_AMAS0_DTVA0_GRVW2_LBSPP0_LPB1_LRVW1_MIAV1_NEPBS0_NLCA1_PLR3_SVW1_TT2_64_TLDS0_UMLDSB0_VW1_WG64_4_1_WGM6
    SolutionIndex: 3
    SolutionNameMin: Cijk_Ailk_Bljk_DB_GB_MT128x64x16_MI16x16x4x1_SN_AMAS3_DTVA0_GRVW2_LBSPP128_LPB4_LRVW2_MIAV1_NEPBS0_NLCA1_PLR5_SVW2_TT2_64_TLDS1_UMLDSB1_VW2_WG64_4_1_WGM18
    SolutionIndex: 4
    SolutionNameMin: Cijk_Ailk_Bljk_DB_GB_MT128x128x16_MI16x16x4x1_SN_AMAS3_DTVA1_GRVW2_LBSPP0_LPB2_LRVW1_MIAV1_NEPBS4_NLCA1_PLR5_SVW2_TT2_128_TLDS0_UMLDSB0_VW2_WG64_4_1_WGM6
    SolutionIndex: 5
    SolutionNameMin: Cijk_Ailk_Bljk_DB_GB_MT128x128x16_MI16x16x4x1_SN_AMAS3_DTVA1_GRVW2_LBSPP0_LPB2_LRVW1_MIAV1_NEPBS4_NLCA1_PLR5_SVW2_TT2_128_TLDS0_UMLDSB0_VW2_WG64_4_1_WGM12
    SolutionIndex: 6
    SolutionNameMin: Cijk_Ailk_Bljk_DB_GB_MT128x64x16_MI16x16x4x1_SN_AMAS3_DTVA0_GRVW2_LBSPP128_LPB4_LRVW2_MIAV1_NEPBS4_NLCA1_PLR5_SVW2_TT4_32_TLDS1_UMLDSB1_VW2_WG32_8_1_WGM6
    SolutionIndex: 7
    SolutionNameMin: Cijk_Ailk_Bljk_DB_GB_MT128x64x8_MI16x16x4x1_SN_AMAS3_DTVA0_LBSPP128_LPB2_LRVW1_MIAV1_NEPBS4_PLR1_SVW2_TT4_32_TLDS1_UMLDSB1_VW2_WG32_8_1_WGM6
    SolutionIndex: 8
    SolutionNameMin: Cijk_Ailk_Bljk_DB_GB_MT128x64x8_MI16x16x4x1_SN_AMAS3_DTVA1_LBSPP0_LPB2_LRVW1_MIAV0_NEPBS0_PLR1_SVW2_TT2_64_TLDS0_UMLDSB0_VW2_WG64_4_1_WGM6
    SolutionIndex: 9
    SolutionNameMin: Cijk_Ailk_Bljk_DB_GB_MT128x64x8_MI16x16x4x1_SN_AMAS3_DTVA0_LBSPP0_LPB2_LRVW1_MIAV1_NEPBS4_PLR1_SVW2_TT4_32_TLDS0_UMLDSB0_VW2_WG32_8_1_WGM6
    SolutionIndex: 10
    SolutionNameMin: Cijk_Ailk_Bljk_DB_GB_MT128x128x16_MI16x16x4x1_SN_AMAS3_DTVA1_LBSPP128_LPB4_LRVW2_MIAV0_NEPBS4_PLR5_SVW2_TT2_128_TLDS1_UMLDSB1_VW2_WG64_4_1_WGM6
    SolutionIndex: 11
    SolutionNameMin: Cijk_Ailk_Bljk_DB_GB_MT128x64x16_MI16x16x4x1_SN_AMAS0_DTVA0_LBSPP0_LPB1_LRVW1_MIAV0_NEPBS4_PLR5_SVW1_TT4_32_TLDS0_UMLDSB0_VW1_WG32_8_1_WGM12
    SolutionIndex: 12
    SolutionNameMin: Cijk_Ailk_Bljk_DB_GB_MT128x128x16_MI16x16x4x1_SN_AMAS3_DTVA1_LBSPP128_LPB4_LRVW2_MIAV1_NEPBS4_PLR5_SVW2_TT2_128_TLDS1_UMLDSB1_VW2_WG64_4_1_WGM6
    SolutionIndex: 13
    SolutionNameMin: Cijk_Ailk_Bljk_DB_GB_MT128x128x16_MI16x16x4x1_SN_AMAS3_DTVA1_LBSPP128_LPB4_LRVW2_MIAV1_NEPBS4_PLR5_SVW2_TT2_128_TLDS1_UMLDSB1_VW2_WG64_4_1_WGM12
    SolutionIndex: 14
    SolutionNameMin: Cijk_Ailk_Bljk_DB_GB_MT128x64x16_MI16x16x4x1_SN_AMAS3_DTVA0_LBSPP128_LPB4_LRVW2_MIAV1_NEPBS4_PLR5_SVW2_TT2_64_TLDS1_UMLDSB1_VW2_WG64_4_1_WGM18
    SolutionIndex: 15
    SolutionNameMin: Cijk_Ailk_Bljk_DB_GB_MT128x128x16_MI16x16x4x1_SN_AMAS3_DTVA1_LBSPP0_LPB2_LRVW1_MIAV1_NEPBS4_PLR5_SVW2_TT2_128_TLDS0_UMLDSB0_VW2_WG64_4_1_WGM18
    SolutionIndex: 16
    SolutionNameMin: Cijk_Ailk_Bljk_DB_GB_MT64x32x16_MI16x16x4x1_SN_AMAS0_GRVW1_LBSPP128_LPB4_LRVW2_NEPBS0_PLR5_SVW1_TT1_32_TLDS1_UMLDSB1_VW1_WG64_4_1_WGM12
    SolutionIndex: 17
    SolutionNameMin: Cijk_Ailk_Bljk_DB_GB_MT32x64x16_MI16x16x4x1_SN_AMAS0_GRVW1_LBSPP128_LPB4_LRVW2_NEPBS0_PLR5_SVW1_TT1_32_TLDS1_UMLDSB1_VW1_WG32_8_1_WGM6
    SolutionIndex: 18
    SolutionNameMin: Cijk_Ailk_Bljk_DB_GB_MT64x32x32_MI16x16x4x1_SN_AMAS0_GRVW1_LBSPP0_LPB1_LRVW1_NEPBS0_PLR9_SVW1_TT2_16_TLDS0_UMLDSB0_VW1_WG32_8_1_WGM12
    SolutionIndex: 19
    SolutionNameMin: Cijk_Ailk_Bljk_DB_GB_MT64x64x16_MI16x16x4x1_SN_AMAS0_GRVW1_LBSPP0_LPB1_LRVW1_NEPBS0_PLR5_SVW1_TT1_64_TLDS0_UMLDSB0_VW1_WG64_4_1_WGM12
    SolutionIndex: 20
    SolutionNameMin: Cijk_Ailk_Bljk_DB_GB_MT64x64x16_MI16x16x4x1_SN_AMAS0_GRVW1_LBSPP0_LPB1_LRVW1_NEPBS4_PLR5_SVW1_TT1_64_TLDS0_UMLDSB0_VW1_WG64_4_1_WGM12
    SolutionIndex: 21
    SolutionNameMin: Cijk_Ailk_Bljk_DB_GB_MT64x64x16_MI16x16x4x1_SN_AMAS0_GRVW1_LBSPP128_LPB1_LRVW1_NEPBS0_PLR5_SVW1_TT1_64_TLDS1_UMLDSB1_VW1_WG64_4_1_WGM6
    SolutionIndex: 22
    SolutionNameMin: Cijk_Ailk_Bljk_DB_GB_MT64x64x16_MI16x16x4x1_SN_AMAS0_GRVW1_LBSPP128_LPB4_LRVW2_NEPBS0_PLR5_SVW1_TT2_32_TLDS1_UMLDSB1_VW1_WG32_8_1_WGM12
    SolutionIndex: 23
    SolutionNameMin: Cijk_Ailk_Bljk_DB_GB_MT64x64x16_MI16x16x4x1_SN_AMAS3_GRVW2_LBSPP128_LPB2_LRVW1_NEPBS0_PLR5_SVW2_TT2_32_TLDS1_UMLDSB1_VW2_WG32_8_1_WGM12
    SolutionIndex: 24
    SolutionNameMin: Cijk_Ailk_Bljk_DB_GB_MT128x64x16_MI16x16x4x1_SN_AMAS0_GRVW1_LBSPP128_LPB1_LRVW1_NEPBS0_PLR5_SVW1_TT4_32_TLDS1_UMLDSB1_VW1_WG32_8_1_WGM6
    SolutionIndex: 25
    SolutionNameMin: Cijk_Ailk_Bljk_DB_GB_MT128x64x16_MI16x16x4x1_SN_AMAS0_GRVW1_LBSPP128_LPB1_LRVW1_NEPBS0_PLR5_SVW1_TT2_64_TLDS1_UMLDSB1_VW1_WG64_4_1_WGM6
    SolutionIndex: 26
    SolutionNameMin: Cijk_Ailk_Bljk_DB_GB_MT128x64x16_MI16x16x4x1_SN_AMAS0_GRVW1_LBSPP128_LPB1_LRVW1_NEPBS0_PLR5_SVW1_TT4_32_TLDS1_UMLDSB1_VW1_WG32_8_1_WGM12
    SolutionIndex: 27
    SolutionNameMin: Cijk_Ailk_Bljk_DB_GB_MT128x64x16_MI16x16x4x1_SN_AMAS0_GRVW1_LBSPP128_LPB4_LRVW2_NEPBS0_PLR5_SVW1_TT4_32_TLDS1_UMLDSB1_VW1_WG32_8_1_WGM6
    SolutionIndex: 28
    SolutionNameMin: Cijk_Ailk_Bljk_DB_GB_MT64x64x16_MI16x16x4x1_SN_AMAS3_GRVW1_LBSPP128_LPB1_LRVW1_NEPBS0_PLR5_SVW2_TT2_32_TLDS1_UMLDSB1_VW2_WG32_8_1_WGM12
    SolutionIndex: 29
    SolutionNameMin: Cijk_Ailk_Bljk_DB_GB_MT128x64x16_MI16x16x4x1_SN_AMAS0_GRVW1_LBSPP0_LPB1_LRVW1_NEPBS0_PLR5_SVW1_TT2_64_TLDS0_UMLDSB0_VW1_WG64_4_1_WGM6
    SolutionIndex: 30
    SolutionNameMin: Cijk_Ailk_Bljk_DB_GB_MT64x32x32_MI16x16x4x1_SN_AMAS3_GRVW1_LBSPP256_LPB1_LRVW1_NEPBS0_PLR9_SVW2_TT2_16_TLDS1_UMLDSB1_VW2_WG32_8_1_WGM6
    SolutionIndex: 31
    SolutionNameMin: Cijk_Ailk_Bljk_DB_GB_MT64x64x16_MI16x16x4x1_SN_AMAS3_GRVW2_LBSPP128_LPB4_LRVW2_NEPBS0_PLR5_SVW2_TT2_32_TLDS1_UMLDSB1_VW2_WG32_8_1_WGM12
    SolutionIndex: 32
    SolutionNameMin: Cijk_Ailk_Bljk_DB_GB_MT64x32x16_MI16x16x4x1_SN_AMAS0_GRVW1_LBSPP128_LPB4_LRVW2_NEPBS0_PLR5_SVW1_TT1_32_TLDS1_UMLDSB1_VW1_WG64_4_1_WGM12
    SolutionIndex: 33
    SolutionNameMin: Cijk_Ailk_Bljk_DB_GB_MT64x64x16_MI16x16x4x1_SN_AMAS3_GRVW2_LBSPP128_LPB2_LRVW1_NEPBS0_PLR5_SVW2_TT2_32_TLDS1_UMLDSB1_VW2_WG32_8_1_WGM12
    SolutionIndex: 34
    SolutionNameMin: Cijk_Ailk_Bljk_DB_GB_MT64x64x16_MI16x16x4x1_SN_AMAS3_GRVW1_LBSPP128_LPB4_LRVW2_NEPBS0_PLR5_SVW2_TT2_32_TLDS1_UMLDSB1_VW2_WG32_8_1_WGM12
    SolutionIndex: 35
    SolutionNameMin: Cijk_Ailk_Bljk_DB_GB_MT64x64x16_MI16x16x4x1_SN_AMAS3_GRVW1_LBSPP0_LPB2_LRVW1_NEPBS4_PLR5_SVW2_TT2_32_TLDS0_UMLDSB0_VW2_WG32_8_1_WGM6
    SolutionIndex: 36
    SolutionNameMin: Cijk_Ailk_Bljk_DB_GB_MT64x64x16_MI16x16x4x1_SN_AMAS3_GRVW1_LBSPP128_LPB1_LRVW1_NEPBS0_PLR5_SVW2_TT2_32_TLDS1_UMLDSB1_VW2_WG32_8_1_WGM12
    SolutionIndex: 37
    SolutionNameMin: Cijk_Ailk_Bljk_DB_GB_MT64x64x16_MI16x16x4x1_SN_AMAS3_GRVW2_LBSPP128_LPB4_LRVW2_NEPBS4_PLR5_SVW2_TT2_32_TLDS1_UMLDSB1_VW2_WG32_8_1_WGM6
    SolutionIndex: 38
    SolutionNameMin: Cijk_Ailk_Bljk_DB_GB_MT64x64x16_MI16x16x4x1_SN_AMAS3_GRVW2_LBSPP128_LPB4_LRVW2_NEPBS4_PLR5_SVW2_TT2_32_TLDS1_UMLDSB1_VW2_WG32_8_1_WGM12
    SolutionIndex: 39
    SolutionNameMin: Cijk_Ailk_Bljk_DB_GB_MT128x64x16_MI16x16x4x1_SN_AMAS3_GRVW2_LBSPP0_LPB2_LRVW1_NEPBS0_PLR5_SVW2_TT2_64_TLDS0_UMLDSB0_VW2_WG64_4_1_WGM6
    SolutionIndex: 40
    SolutionNameMin: Cijk_Ailk_Bljk_DB_GB_MT128x64x16_MI16x16x4x1_SN_AMAS3_GRVW2_LBSPP0_LPB2_LRVW1_NEPBS0_PLR5_SVW2_TT4_32_TLDS0_UMLDSB0_VW2_WG32_8_1_WGM12
    SolutionIndex: 41
    SolutionNameMin: Cijk_Ailk_Bljk_DB_GB_MT128x64x16_MI16x16x4x1_SN_AMAS3_GRVW2_LBSPP0_LPB2_LRVW1_NEPBS0_PLR5_SVW2_TT2_64_TLDS0_UMLDSB0_VW2_WG64_4_1_WGM12
    SolutionIndex: 42
    SolutionNameMin: Cijk_Ailk_Bljk_DB_GB_MT128x64x16_MI16x16x4x1_SN_AMAS3_GRVW2_LBSPP128_LPB4_LRVW2_NEPBS4_PLR5_SVW2_TT2_64_TLDS1_UMLDSB1_VW2_WG64_4_1_WGM12
    SolutionIndex: 43
    SolutionNameMin: Cijk_Ailk_Bljk_DB_GB_MT128x64x16_MI16x16x4x1_SN_AMAS3_GRVW2_LBSPP0_LPB2_LRVW1_NEPBS0_PLR5_SVW2_TT4_32_TLDS0_UMLDSB0_VW2_WG32_8_1_WGM6
    SolutionIndex: 44
    SolutionNameMin: Cijk_Ailk_Bljk_DB_GB_MT64x32x32_MI16x16x4x1_SN_AMAS0_GRVW2_LBSPP256_LPB4_LRVW2_NEPBS0_PLR9_SVW1_TT2_16_TLDS1_UMLDSB1_VW1_WG32_8_1_WGM6
- - - [511, 511, 16, 511]
    - [2, 35.835]
  - - [513, 513, 16, 513]
    - [6, 35.006]
  - - [1023, 1023, 16, 1023]
    - [1, 69.037]
  - - [1025, 1025, 16, 1025]
    - [4, 62.766]
  - - [2047, 2047, 16, 2047]
    - [5, 91.315]
  - - [2049, 2049, 16, 2049]
    - [0, 79.121]
  - - [4095, 2047, 16, 2047]
    - [5, 93.131]
  - - [4097, 2049, 16, 2049]
    - [3, 84.191]
  - - [510, 510, 16, 510]
    - [7, 38.176]
  - - [512, 512, 16, 512]
    - [8, 40.129]
  - - [514, 514, 16, 514]
    - [9, 36.401]
  - - [1022, 1022, 16, 1022]
    - [10, 73.934]
  - - [1024, 1024, 16, 1024]
    - [11, 77.114]
  - - [1026, 1026, 16, 1026]
    - [12, 65.851]
  - - [2046, 2046, 16, 2046]
    - [13, 94.102]
  - - [2048, 2048, 16, 2048]
    - [13, 94.353]
  - - [2050, 2050, 16, 2050]
    - [14, 80.79]
  - - [4094, 2046, 16, 2046]
    - [15, 94.472]
  - - [4096, 2048, 16, 2048]
    - [13, 95.231]
  - - [4098, 2050, 16, 2050]
    - [14, 85.198]
  - - [64, 1, 1000, 64]
    - [16, 0.372]
  - - [1, 64, 1000, 64]
    - [17, 0.383]
  - - [31, 31, 1000, 31]
    - [18, 2.838]
  - - [33, 33, 1000, 33]
    - [19, 2.891]
  - - [47, 47, 1000, 47]
    - [20, 5.479]
  - - [49, 49, 1000, 49]
    - [21, 5.323]
  - - [63, 63, 128, 63]
    - [22, 4.559]
  - - [65, 65, 128, 65]
    - [23, 3.697]
  - - [79, 79, 128, 79]
    - [24, 5.719]
  - - [81, 81, 128, 81]
    - [25, 5.971]
  - - [95, 95, 64, 95]
    - [24, 6.431]
  - - [97, 97, 64, 97]
    - [26, 6.656]
  - - [127, 127, 64, 127]
    - [27, 11.005]
  - - [129, 129, 64, 129]
    - [28, 8.256]
  - - [255, 255, 16, 255]
    - [29, 17.059]
  - - [257, 257, 16, 257]
    - [30, 14.962]
  - - [30, 30, 1000, 30]
    - [31, 2.983]
  - - [32, 32, 1000, 32]
    - [32, 3.569]
  - - [34, 34, 1000, 34]
    - [33, 3.455]
  - - [46, 46, 1000, 46]
    - [34, 6.226]
  - - [48, 48, 1000, 48]
    - [35, 7.381]
  - - [50, 50, 1000, 50]
    - [36, 7.089]
  - - [62, 62, 128, 62]
    - [37, 4.74]
  - - [64, 64, 128, 64]
    - [38, 5.55]
  - - [66, 66, 128, 66]
    - [39, 4.256]
  - - [78, 78, 128, 78]
    - [40, 6.346]
  - - [80, 80, 128, 80]
    - [41, 7.1]
  - - [82, 82, 128, 82]
    - [39, 7.19]
  - - [94, 94, 64, 94]
    - [39, 6.872]
  - - [96, 96, 64, 96]
    - [39, 7.509]
  - - [98, 98, 64, 98]
    - [41, 7.413]
  - - [126, 126, 64, 126]
    - [40, 12.406]
  - - [128, 128, 64, 128]
    - [42, 13.811]
  - - [130, 130, 64, 130]
    - [34, 9.195]
  - - [254, 254, 16, 254]
    - [43, 17.385]
  - - [256, 256, 16, 256]
    - [39, 20.342]
  - - [258, 258, 16, 258]
    - [44, 15.097]
- null
- null
- DeviceEfficiency
