library/src/blas3/Tensile/Logic/asm_full/aquavanjaram/aquavanjaram_Cijk_Ailk_Bjlk_DB_GB.yaml
- {MinimumRequiredVersion: 4.37.0}
- aquavanjaram
- gfx940
- [Device 0049, Device 0050]
    SolutionIndex: 0
    SolutionNameMin: Cijk_Ailk_Bjlk_DB_GB_MT128x64x8_MI16x16x4x1_SN_AMAS3_DTVA0_GRVW2_MIAV0_NEPBS4_NLCA1_PLR3_SVW2_TT4_32_VW2_WG32_8_1_WGM6
    SolutionIndex: 1
    SolutionNameMin: Cijk_Ailk_Bjlk_DB_GB_MT128x128x16_MI16x16x4x1_SN_AMAS0_DTVA0_GRVW2_MIAV0_NEPBS4_NLCA1_PLR1_SVW1_TT8_32_VW1_WG16_16_1_WGM6
    SolutionIndex: 2
    SolutionNameMin: Cijk_Ailk_Bjlk_DB_GB_MT128x64x8_MI16x16x4x1_SN_AMAS0_DTVA0_GRVW2_MIAV1_NEPBS0_NLCA1_PLR1_SVW1_TT2_64_VW1_WG64_4_1_WGM6
    SolutionIndex: 3
    SolutionNameMin: Cijk_Ailk_Bjlk_DB_GB_MT128x128x16_MI16x16x4x1_SN_AMAS3_DTVA0_GRVW2_MIAV1_NEPBS0_NLCA1_PLR1_SVW2_TT4_64_VW2_WG32_8_1_WGM6
    SolutionIndex: 4
    SolutionNameMin: Cijk_Ailk_Bjlk_DB_GB_MT128x64x16_MI16x16x4x1_SN_AMAS3_DTVA0_GRVW2_MIAV1_NEPBS0_NLCA1_PLR5_SVW2_TT2_64_VW2_WG64_4_1_WGM18
    SolutionIndex: 5
    SolutionNameMin: Cijk_Ailk_Bjlk_DB_GB_MT128x128x8_MI16x16x4x1_SN_AMAS3_DTVA0_GRVW2_MIAV1_NEPBS4_NLCA1_PLR1_SVW2_TT2_128_VW2_WG64_4_1_WGM12
    SolutionIndex: 6
    SolutionNameMin: Cijk_Ailk_Bjlk_DB_GB_MT128x128x16_MI16x16x4x1_SN_AMAS3_DTVA0_GRVW2_MIAV1_NEPBS4_NLCA1_PLR5_SVW2_TT2_128_VW2_WG64_4_1_WGM12
    SolutionIndex: 7
    SolutionNameMin: Cijk_Ailk_Bjlk_DB_GB_MT128x128x16_MI16x16x4x1_SN_AMAS3_DTVA0_GRVW2_MIAV1_NEPBS4_NLCA1_PLR1_SVW2_TT4_64_VW2_WG32_8_1_WGM12
    SolutionIndex: 8
    SolutionNameMin: Cijk_Ailk_Bjlk_DB_GB_MT128x64x8_MI16x16x4x1_SN_AMAS3_DTVA0_MIAV0_NEPBS4_PLR3_SVW2_TT4_32_VW2_WG32_8_1_WGM6
    SolutionIndex: 9
    SolutionNameMin: Cijk_Ailk_Bjlk_DB_GB_MT128x64x8_MI16x16x4x1_SN_AMAS3_DTVA0_MIAV1_NEPBS0_PLR3_SVW2_TT4_32_VW2_WG32_8_1_WGM6
    SolutionIndex: 10
    SolutionNameMin: Cijk_Ailk_Bjlk_DB_GB_MT128x64x8_MI16x16x4x1_SN_AMAS3_DTVA0_MIAV1_NEPBS4_PLR3_SVW2_TT4_32_VW2_WG32_8_1_WGM6
    SolutionIndex: 11
    SolutionNameMin: Cijk_Ailk_Bjlk_DB_GB_MT128x128x16_MI16x16x4x1_SN_AMAS3_DTVA1_MIAV1_NEPBS4_PLR5_SVW2_TT2_128_VW2_WG64_4_1_WGM6
    SolutionIndex: 12
    SolutionNameMin: Cijk_Ailk_Bjlk_DB_GB_MT128x128x16_MI16x16x4x1_SN_AMAS0_DTVA0_MIAV1_NEPBS4_PLR5_SVW1_TT2_128_VW1_WG64_4_1_WGM6
    SolutionIndex: 13
    SolutionNameMin: Cijk_Ailk_Bjlk_DB_GB_MT128x128x16_MI16x16x4x1_SN_AMAS3_DTVA1_MIAV1_NEPBS4_PLR5_SVW2_TT2_128_VW2_WG64_4_1_WGM12
    SolutionIndex: 14
    SolutionNameMin: Cijk_Ailk_Bjlk_DB_GB_MT128x128x16_MI16x16x4x1_SN_AMAS0_DTVA0_MIAV1_NEPBS4_PLR5_SVW1_TT2_128_VW1_WG64_4_1_WGM12
    SolutionIndex: 15
    SolutionNameMin: Cijk_Ailk_Bjlk_DB_GB_MT128x128x16_MI16x16x4x1_SN_AMAS3_DTVA0_MIAV1_NEPBS4_PLR1_SVW2_TT4_64_VW2_WG32_8_1_WGM12
    SolutionIndex: 16
    SolutionNameMin: Cijk_Ailk_Bjlk_DB_GB_MT128x128x16_MI16x16x4x1_SN_AMAS3_DTVA0_MIAV1_NEPBS4_PLR1_SVW2_TT4_64_VW2_WG32_8_1_WGM18
    SolutionIndex: 17
    SolutionNameMin: Cijk_Ailk_Bjlk_DB_GB_MT128x64x16_MI16x16x4x1_SN_AMAS3_DTVA0_MIAV1_NEPBS4_PLR5_SVW2_TT2_64_VW2_WG64_4_1_WGM18
    SolutionIndex: 18
    SolutionNameMin: Cijk_Ailk_Bjlk_DB_GB_MT64x32x32_MI16x16x4x1_SN_AMAS0_DTVA1_GRVW1_NEPBS0_NLCA1_PLR9_SVW1_TT1_32_VW1_WG64_4_1_WGM12
    SolutionIndex: 19
    SolutionNameMin: Cijk_Ailk_Bjlk_DB_GB_MT32x64x32_MI16x16x4x1_SN_AMAS0_DTVA0_GRVW1_NEPBS0_NLCA1_PLR9_SVW1_TT2_16_VW1_WG16_16_1_WGM12
    SolutionIndex: 20
    SolutionNameMin: Cijk_Ailk_Bjlk_DB_GB_MT64x64x16_MI16x16x4x1_SN_AMAS0_DTVA0_GRVW1_NEPBS0_NLCA1_PLR5_SVW1_TT2_32_VW1_WG32_8_1_WGM12
    SolutionIndex: 21
    SolutionNameMin: Cijk_Ailk_Bjlk_DB_GB_MT64x64x16_MI16x16x4x1_SN_AMAS0_DTVA0_GRVW1_NEPBS0_NLCA1_PLR5_SVW1_TT2_32_VW1_WG32_8_1_WGM6
    SolutionIndex: 22
    SolutionNameMin: Cijk_Ailk_Bjlk_DB_GB_MT64x64x32_MI16x16x4x1_SN_AMAS0_DTVA0_GRVW1_NEPBS0_NLCA1_PLR9_SVW1_TT2_32_VW1_WG32_8_1_WGM12
    SolutionIndex: 23
    SolutionNameMin: Cijk_Ailk_Bjlk_DB_GB_MT64x64x16_MI16x16x4x1_SN_AMAS3_DTVA0_GRVW2_NEPBS0_NLCA1_PLR5_SVW2_TT2_32_VW2_WG32_8_1_WGM12
    SolutionIndex: 24
    SolutionNameMin: Cijk_Ailk_Bjlk_DB_GB_MT128x64x16_MI16x16x4x1_SN_AMAS0_DTVA1_GRVW1_NEPBS0_NLCA2_PLR5_SVW1_TT2_64_VW1_WG64_4_1_WGM12
    SolutionIndex: 25
    SolutionNameMin: Cijk_Ailk_Bjlk_DB_GB_MT128x64x16_MI16x16x4x1_SN_AMAS0_DTVA0_GRVW1_NEPBS0_NLCA1_PLR5_SVW1_TT2_64_VW1_WG64_4_1_WGM6
    SolutionIndex: 26
    SolutionNameMin: Cijk_Ailk_Bjlk_DB_GB_MT128x64x16_MI16x16x4x1_SN_AMAS0_DTVA0_GRVW1_NEPBS0_NLCA1_PLR5_SVW1_TT4_32_VW1_WG32_8_1_WGM12
    SolutionIndex: 27
    SolutionNameMin: Cijk_Ailk_Bjlk_DB_GB_MT128x64x16_MI16x16x4x1_SN_AMAS0_DTVA0_GRVW1_NEPBS0_NLCA1_PLR1_SVW1_TT2_64_VW1_WG64_4_1_WGM12
    SolutionIndex: 28
    SolutionNameMin: Cijk_Ailk_Bjlk_DB_GB_MT64x64x16_MI16x16x4x1_SN_AMAS3_DTVA0_GRVW2_NEPBS0_NLCA1_PLR5_SVW2_TT2_32_VW2_WG32_8_1_WGM6
    SolutionIndex: 29
    SolutionNameMin: Cijk_Ailk_Bjlk_DB_GB_MT64x32x32_MI16x16x4x1_SN_AMAS0_DTVA0_GRVW1_NEPBS0_NLCA1_PLR9_SVW1_TT1_32_VW1_WG64_4_1_WGM6
    SolutionIndex: 30
    SolutionNameMin: Cijk_Ailk_Bjlk_DB_GB_MT64x64x16_MI16x16x4x1_SN_AMAS3_DTVA0_GRVW1_NEPBS0_NLCA1_PLR5_SVW2_TT2_32_VW2_WG32_8_1_WGM12
    SolutionIndex: 31
    SolutionNameMin: Cijk_Ailk_Bjlk_DB_GB_MT64x64x16_MI16x16x4x1_SN_AMAS3_DTVA0_GRVW1_NEPBS0_NLCA1_PLR5_SVW2_TT2_32_VW2_WG32_8_1_WGM6
    SolutionIndex: 32
    SolutionNameMin: Cijk_Ailk_Bjlk_DB_GB_MT64x64x16_MI16x16x4x1_SN_AMAS3_DTVA0_GRVW2_NEPBS0_NLCA1_PLR5_SVW2_TT2_32_VW2_WG32_8_1_WGM12
    SolutionIndex: 33
    SolutionNameMin: Cijk_Ailk_Bjlk_DB_GB_MT64x64x16_MI16x16x4x1_SN_AMAS3_DTVA0_GRVW2_NEPBS0_NLCA1_PLR5_SVW2_TT2_32_VW2_WG32_8_1_WGM6
    SolutionIndex: 34
    SolutionNameMin: Cijk_Ailk_Bjlk_DB_GB_MT64x64x32_MI16x16x4x1_SN_AMAS3_DTVA0_GRVW1_NEPBS0_NLCA1_PLR9_SVW2_TT2_32_VW2_WG32_8_1_WGM12
    SolutionIndex: 35
    SolutionNameMin: Cijk_Ailk_Bjlk_DB_GB_MT128x64x16_MI16x16x4x1_SN_AMAS3_DTVA1_GRVW2_NEPBS0_NLCA1_PLR1_SVW2_TT2_64_VW2_WG64_4_1_WGM6
    SolutionIndex: 36
    SolutionNameMin: Cijk_Ailk_Bjlk_DB_GB_MT128x64x16_MI16x16x4x1_SN_AMAS3_DTVA0_GRVW2_NEPBS0_NLCA1_PLR5_SVW2_TT2_64_VW2_WG64_4_1_WGM6
    SolutionIndex: 37
    SolutionNameMin: Cijk_Ailk_Bjlk_DB_GB_MT128x64x16_MI16x16x4x1_SN_AMAS3_DTVA1_GRVW2_NEPBS0_NLCA1_PLR1_SVW2_TT2_64_VW2_WG64_4_1_WGM12
    SolutionIndex: 38
    SolutionNameMin: Cijk_Ailk_Bjlk_DB_GB_MT128x64x16_MI16x16x4x1_SN_AMAS0_DTVA0_GRVW2_NEPBS0_NLCA1_PLR5_SVW1_TT2_64_VW1_WG64_4_1_WGM12
    SolutionIndex: 39
    SolutionNameMin: Cijk_Ailk_Bjlk_DB_GB_MT128x64x16_MI16x16x4x1_SN_AMAS0_DTVA0_GRVW1_NEPBS0_NLCA1_PLR5_SVW1_TT4_32_VW1_WG32_8_1_WGM12
    SolutionIndex: 40
    SolutionNameMin: Cijk_Ailk_Bjlk_DB_GB_MT128x64x16_MI16x16x4x1_SN_AMAS3_DTVA1_GRVW2_NEPBS0_NLCA1_PLR5_SVW2_TT2_64_VW2_WG64_4_1_WGM12
    SolutionIndex: 41
    SolutionNameMin: Cijk_Ailk_Bjlk_DB_GB_MT128x64x16_MI16x16x4x1_SN_AMAS3_DTVA0_GRVW2_NEPBS4_NLCA1_PLR5_SVW2_TT2_64_VW2_WG64_4_1_WGM6
    SolutionIndex: 42
    SolutionNameMin: Cijk_Ailk_Bjlk_DB_GB_MT128x64x16_MI16x16x4x1_SN_AMAS3_DTVA0_GRVW2_NEPBS0_NLCA1_PLR1_SVW2_TT2_64_VW2_WG64_4_1_WGM6
    SolutionIndex: 43
    SolutionNameMin: Cijk_Ailk_Bjlk_DB_GB_MT128x64x16_MI16x16x4x1_SN_AMAS3_DTVA1_GRVW2_NEPBS4_NLCA1_PLR5_SVW2_TT2_64_VW2_WG64_4_1_WGM6
    SolutionIndex: 44
    SolutionNameMin: Cijk_Ailk_Bjlk_DB_GB_MT64x32x32_MI16x16x4x1_SN_AMAS3_DTVA0_GRVW1_NEPBS0_NLCA1_PLR9_SVW2_TT2_16_VW2_WG32_8_1_WGM6
- - - [511, 511, 16, 511]
    - [2, 35.835]
  - - [513, 513, 16, 513]
    - [0, 34.417]
  - - [1023, 1023, 16, 1023]
    - [1, 69.414]
  - - [1025, 1025, 16, 1025]
    - [3, 63.844]
  - - [2047, 2047, 16, 2047]
    - [7, 91.203]
  - - [2049, 2049, 16, 2049]
    - [5, 76.785]
  - - [4095, 2047, 16, 2047]
    - [6, 91.62]
  - - [4097, 2049, 16, 2049]
    - [4, 81.839]
  - - [510, 510, 16, 510]
    - [8, 39.102]
  - - [512, 512, 16, 512]
    - [9, 43.814]
  - - [514, 514, 16, 514]
    - [10, 36.371]
  - - [1022, 1022, 16, 1022]
    - [11, 73.608]
  - - [1024, 1024, 16, 1024]
    - [12, 77.835]
  - - [1026, 1026, 16, 1026]
    - [11, 65.277]
  - - [2046, 2046, 16, 2046]
    - [13, 94.8]
  - - [2048, 2048, 16, 2048]
    - [14, 97.187]
  - - [2050, 2050, 16, 2050]
    - [15, 79.467]
  - - [4094, 2046, 16, 2046]
    - [16, 94.769]
  - - [4096, 2048, 16, 2048]
    - [14, 97.483]
  - - [4098, 2050, 16, 2050]
    - [17, 83.897]
  - - [64, 1, 1000, 64]
    - [18, 0.396]
  - - [1, 64, 1000, 64]
    - [19, 0.352]
  - - [31, 31, 1000, 31]
    - [18, 2.91]
  - - [33, 33, 1000, 33]
    - [20, 2.921]
  - - [47, 47, 1000, 47]
    - [21, 5.575]
  - - [49, 49, 1000, 49]
    - [21, 5.59]
  - - [63, 63, 128, 63]
    - [22, 4.723]
  - - [65, 65, 128, 65]
    - [23, 3.569]
  - - [79, 79, 128, 79]
    - [24, 5.349]
  - - [81, 81, 128, 81]
    - [24, 5.443]
  - - [95, 95, 64, 95]
    - [25, 6.264]
  - - [97, 97, 64, 97]
    - [26, 6.218]
  - - [127, 127, 64, 127]
    - [27, 11.189]
  - - [129, 129, 64, 129]
    - [28, 8.565]
  - - [255, 255, 16, 255]
    - [25, 16.988]
  - - [257, 257, 16, 257]
    - [29, 14.139]
  - - [30, 30, 1000, 30]
    - [30, 3.004]
  - - [32, 32, 1000, 32]
    - [30, 3.459]
  - - [34, 34, 1000, 34]
    - [31, 3.455]
  - - [46, 46, 1000, 46]
    - [30, 5.948]
  - - [48, 48, 1000, 48]
    - [30, 7.52]
  - - [50, 50, 1000, 50]
    - [32, 6.735]
  - - [62, 62, 128, 62]
    - [33, 4.888]
  - - [64, 64, 128, 64]
    - [34, 5.551]
  - - [66, 66, 128, 66]
    - [35, 4.015]
  - - [78, 78, 128, 78]
    - [36, 5.831]
  - - [80, 80, 128, 80]
    - [36, 6.666]
  - - [82, 82, 128, 82]
    - [37, 6.491]
  - - [94, 94, 64, 94]
    - [38, 6.516]
  - - [96, 96, 64, 96]
    - [39, 7.608]
  - - [98, 98, 64, 98]
    - [40, 7.114]
  - - [126, 126, 64, 126]
    - [41, 12.605]
  - - [128, 128, 64, 128]
    - [42, 13.928]
  - - [130, 130, 64, 130]
    - [33, 8.766]
  - - [254, 254, 16, 254]
    - [43, 18.375]
  - - [256, 256, 16, 256]
    - [37, 21.177]
  - - [258, 258, 16, 258]
    - [44, 14.806]
- null
- null
- DeviceEfficiency
