library/src/blas3/Tensile/Logic/mi25_full/Tensile_Cijk_Ailk_Bjlk_SB.yaml
- {MinimumRequiredVersion: 3.3.5}
- Tensile
- default
- AssignedDerivedParameters: true
- - - [4096, 7133, 1, 4096]
    - [31, 11060.0]
  - - [512, 16, 1, 512]
    - [14, 333.224]
  - - [1760, 7133, 1, 1760]
    - [33, 9878.17]
  - - [2560, 7133, 1, 2560]
    - [31, 10577.9]
  - - [1024, 32, 1, 512]
    - [12, 1107.64]
  - - [3072, 7435, 1, 1024]
    - [31, 9803.42]
  - - [512, 32, 1, 512]
    - [10, 630.821]
  - - [2048, 7133, 1, 2048]
    - [31, 10565.9]
  - - [7680, 5481, 1, 2560]
    - [33, 10860.8]
  - - [1024, 16, 1, 512]
    - [7, 592.777]
- - - -1
    - - - -1
        - - - 4
            - - [-1, 22]
          - - 64
            - - [4, 37]
              - [64, 13]
              - [128, 2]
              - [256, 23]
              - [448, 16]
              - [704, 6]
              - [1024, 3]
              - [1408, 4]
              - [1856, 0]
              - [2368, 3]
              - [2944, 20]
              - [4288, 3]
              - [5888, 19]
              - [-1, 20]
          - - 128
            - - [4, 37]
              - [64, 15]
              - [128, 21]
              - [256, 8]
              - [704, 3]
              - [1024, 0]
              - [1408, 19]
              - [1856, 4]
              - [2944, 20]
              - [3584, 19]
              - [4288, 3]
              - [5056, 20]
              - [5888, 27]
              - [-1, 26]
          - - 256
            - - [4, 37]
              - [64, 5]
              - [128, 8]
              - [256, 17]
              - [448, 0]
              - [704, 25]
              - [2944, 27]
              - [3584, 24]
              - [5056, 27]
              - [5888, 26]
              - [-1, 27]
          - - 448
            - - [4, 37]
              - [64, 6]
              - [128, 3]
              - [256, 1]
              - [448, 4]
              - [704, 25]
              - [1408, 27]
              - [1856, 29]
              - [2368, 27]
              - [2944, 29]
              - [5056, 27]
              - [5888, 25]
              - [-1, 24]
          - - 704
            - - [4, 14]
              - [64, 8]
              - [128, 4]
              - [256, 25]
              - [704, 27]
              - [1024, 25]
              - [1408, 24]
              - [1856, 27]
              - [2368, 25]
              - [5888, 24]
              - [-1, 27]
          - - 1024
            - - [4, 14]
              - [64, 4]
              - [128, 1]
              - [256, 25]
              - [704, 27]
              - [1408, 28]
              - [1856, 33]
              - [2368, 26]
              - [2944, 33]
              - [3584, 24]
              - [4288, 27]
              - [5056, 31]
              - [-1, 33]
          - - 1408
            - - [4, 22]
              - [128, 4]
              - [256, 25]
              - [448, 27]
              - [704, 28]
              - [1024, 26]
              - [1408, 33]
              - [2368, 25]
              - [5888, 33]
              - [-1, 27]
          - - 1856
            - - [4, 22]
              - [64, 1]
              - [128, 4]
              - [256, 27]
              - [448, 26]
              - [704, 27]
              - [1024, 33]
              - [1408, 26]
              - [1856, 28]
              - [2368, 25]
              - [2944, 27]
              - [3584, 26]
              - [4288, 33]
              - [5056, 25]
              - [5888, 24]
              - [-1, 33]
          - - 2368
            - - [4, 34]
              - [128, 4]
              - [448, 25]
              - [704, 27]
              - [1024, 26]
              - [1408, 25]
              - [1856, 27]
              - [2368, 24]
              - [2944, 33]
              - [3584, 32]
              - [4288, 25]
              - [-1, 33]
          - - 2944
            - - [4, 11]
              - [64, 4]
              - [128, 19]
              - [256, 25]
              - [448, 27]
              - [704, 25]
              - [1408, 33]
              - [1856, 25]
              - [2368, 33]
              - [2944, 24]
              - [3584, 25]
              - [-1, 33]
          - - 3584
            - - [4, 11]
              - [64, 1]
              - [128, 19]
              - [256, 24]
              - [448, 25]
              - [704, 29]
              - [1024, 26]
              - [1408, 33]
              - [1856, 28]
              - [2368, 30]
              - [2944, 25]
              - [5888, 33]
              - [-1, 31]
          - - 4288
            - - [4, 35]
              - [128, 4]
              - [256, 25]
              - [448, 28]
              - [704, 29]
              - [1024, 25]
              - [1856, 33]
              - [2368, 26]
              - [2944, 33]
              - [3584, 31]
              - [5056, 28]
              - [-1, 33]
          - - 5056
            - - [4, 35]
              - [128, 19]
              - [448, 25]
              - [704, 29]
              - [1408, 33]
              - [1856, 27]
              - [3584, 33]
              - [4288, 24]
              - [-1, 33]
          - - 5888
            - - [4, 35]
              - [64, 19]
              - [128, 27]
              - [448, 25]
              - [704, 29]
              - [2368, 33]
              - [2944, 31]
              - [-1, 33]
          - - -1
            - - [4, 18]
              - [64, 19]
              - [128, 4]
              - [256, 25]
              - [448, 28]
              - [704, 25]
              - [1024, 33]
              - [1856, 25]
              - [-1, 33]
