library/src/blas3/Tensile/Logic/asm_full/navi21/navi21_Cijk_Alik_Bjlk_I8II_BH.yaml
---
- {MinimumRequiredVersion: 4.27.0}
- navi21
- gfx1030
    SolutionIndex: 0
    SolutionNameMin: Cijk_Alik_Bjlk_I8II_BH_MT32x64x16_SN_EPS1_GRVW4_LRVW4_SU32_SUM0_SUS128_TT4_4_VW4_WG8_16_1_WGM1
    SolutionIndex: 1
    SolutionNameMin: Cijk_Alik_Bjlk_I8II_BH_MT32x32x16_SN_EPS1_GRVW4_LRVW4_SU32_SUM0_SUS128_TT4_4_VW4_WG8_8_1_WGM1
    SolutionIndex: 2
    SolutionNameMin: Cijk_Alik_Bjlk_I8II_BH_MT32x64x16_SN_EPS1_GRVW4_LRVW4_SU32_SUM3_SUS128_TT4_4_VW4_WG8_16_1_WGM1
    SolutionIndex: 3
    SolutionNameMin: Cijk_Alik_Bjlk_I8II_BH_MT64x64x8_SN_EPS1_GRVW4_LRVW4_SU32_SUM3_SUS256_TT8_8_VW4_WG8_8_1_WGM1
    SolutionIndex: 4
    SolutionNameMin: Cijk_Alik_Bjlk_I8II_BH_MT32x64x16_SN_EPS1_GRVW4_LRVW4_SU0_SUM0_SUS128_TT4_4_VW4_WG8_16_1_WGM4
    SolutionIndex: 5
    SolutionNameMin: Cijk_Alik_Bjlk_I8II_BH_MT32x64x16_SN_EPS1_GRVW4_LRVW4_SU0_SUM0_SUS256_TT4_4_VW4_WG8_16_1_WGM4
    SolutionIndex: 6
    SolutionNameMin: Cijk_Alik_Bjlk_I8II_BH_MT32x64x16_SN_EPS1_GRVW4_LRVW4_SU32_SUM0_SUS128_TT4_4_VW4_WG8_16_1_WGM4
    SolutionIndex: 7
    SolutionNameMin: Cijk_Alik_Bjlk_I8II_BH_MT32x64x16_SN_EPS1_GRVW4_LRVW4_SU32_SUM3_SUS128_TT4_4_VW4_WG8_16_1_WGM4
    SolutionIndex: 8
    SolutionNameMin: Cijk_Alik_Bjlk_I8II_BH_MT32x32x8_SN_EPS1_GRVW4_LRVW4_SU0_SUM0_SUS128_TT4_4_VW4_WG8_8_1_WGM8
    SolutionIndex: 9
    SolutionNameMin: Cijk_Alik_Bjlk_I8II_BH_MT32x64x16_SN_EPS1_GRVW4_LRVW4_SU0_SUM0_SUS256_TT4_4_VW4_WG8_16_1_WGM8
    SolutionIndex: 10
    SolutionNameMin: Cijk_Alik_Bjlk_I8II_BH_MT32x64x16_SN_EPS1_GRVW4_LRVW4_SU32_SUM0_SUS128_TT4_4_VW4_WG8_16_1_WGM8
    SolutionIndex: 11
    SolutionNameMin: Cijk_Alik_Bjlk_I8II_BH_MT32x32x8_SN_EPS0_GRVW4_LRVW4_SU0_SUM0_SUS128_TT4_4_VW4_WG8_8_1_WGM1
    SolutionIndex: 12
    SolutionNameMin: Cijk_Alik_Bjlk_I8II_BH_MT64x32x8_SN_EPS0_GRVW4_LRVW4_SU0_SUM0_SUS128_TT8_4_VW4_WG8_8_1_WGM1
    SolutionIndex: 13
    SolutionNameMin: Cijk_Alik_Bjlk_I8II_BH_MT64x64x8_SN_EPS0_GRVW4_LRVW4_SU0_SUM0_SUS128_TT8_8_VW4_WG8_8_1_WGM1
    SolutionIndex: 14
    SolutionNameMin: Cijk_Alik_Bjlk_I8II_BH_MT32x64x16_SN_EPS0_GRVW4_LRVW4_SU0_SUM0_SUS128_TT4_4_VW4_WG8_16_1_WGM1
    SolutionIndex: 15
    SolutionNameMin: Cijk_Alik_Bjlk_I8II_BH_MT32x32x16_SN_EPS0_GRVW4_LRVW4_SU0_SUM0_SUS128_TT4_4_VW4_WG8_8_1_WGM1
    SolutionIndex: 16
    SolutionNameMin: Cijk_Alik_Bjlk_I8II_BH_MT32x64x16_SN_EPS0_GRVW4_LRVW4_SU0_SUM0_SUS128_TT4_8_VW4_WG8_8_1_WGM1
    SolutionIndex: 17
    SolutionNameMin: Cijk_Alik_Bjlk_I8II_BH_MT64x64x16_SN_EPS0_GRVW4_LRVW4_SU0_SUM0_SUS128_TT4_4_VW4_WG16_16_1_WGM1
    SolutionIndex: 18
    SolutionNameMin: Cijk_Alik_Bjlk_I8II_BH_MT32x64x32_SN_EPS0_GRVW4_LRVW4_SU0_SUM0_SUS128_TT4_4_VW4_WG8_16_1_WGM1
    SolutionIndex: 19
    SolutionNameMin: Cijk_Alik_Bjlk_I8II_BH_MT32x32x32_SN_EPS0_GRVW4_LRVW4_SU0_SUM0_SUS128_TT4_4_VW4_WG8_8_1_WGM1
    SolutionIndex: 20
    SolutionNameMin: Cijk_Alik_Bjlk_I8II_BH_MT32x32x16_SN_EPS0_GRVW4_LRVW4_SU0_SUM0_SUS256_TT4_4_VW4_WG8_8_1_WGM1
    SolutionIndex: 21
    SolutionNameMin: Cijk_Alik_Bjlk_I8II_BH_MT32x64x16_SN_EPS0_GRVW4_LRVW4_SU0_SUM0_SUS256_TT4_8_VW4_WG8_8_1_WGM1
    SolutionIndex: 22
    SolutionNameMin: Cijk_Alik_Bjlk_I8II_BH_MT64x64x16_SN_EPS0_GRVW4_LRVW4_SU0_SUM0_SUS256_TT4_4_VW4_WG16_16_1_WGM1
    SolutionIndex: 23
    SolutionNameMin: Cijk_Alik_Bjlk_I8II_BH_MT32x64x32_SN_EPS0_GRVW4_LRVW4_SU0_SUM0_SUS256_TT4_4_VW4_WG8_16_1_WGM1
    SolutionIndex: 24
    SolutionNameMin: Cijk_Alik_Bjlk_I8II_BH_MT32x32x32_SN_EPS0_GRVW4_LRVW4_SU0_SUM0_SUS256_TT4_4_VW4_WG8_8_1_WGM1
    SolutionIndex: 25
    SolutionNameMin: Cijk_Alik_Bjlk_I8II_BH_MT32x32x16_SN_EPS0_GRVW4_LRVW4_SU32_SUM0_SUS128_TT4_4_VW4_WG8_8_1_WGM1
    SolutionIndex: 26
    SolutionNameMin: Cijk_Alik_Bjlk_I8II_BH_MT32x64x32_SN_EPS0_GRVW4_LRVW4_SU32_SUM0_SUS128_TT4_4_VW4_WG8_16_1_WGM1
    SolutionIndex: 27
    SolutionNameMin: Cijk_Alik_Bjlk_I8II_BH_MT32x32x32_SN_EPS0_GRVW4_LRVW4_SU32_SUM0_SUS128_TT4_4_VW4_WG8_8_1_WGM1
    SolutionIndex: 28
    SolutionNameMin: Cijk_Alik_Bjlk_I8II_BH_MT64x128x16_SN_EPS0_GRVW8_LRVW8_SU32_SUM0_SUS128_TT8_8_VW8_WG8_16_1_WGM1
    SolutionIndex: 29
    SolutionNameMin: Cijk_Alik_Bjlk_I8II_BH_MT64x64x16_SN_EPS0_GRVW8_LRVW8_SU32_SUM0_SUS128_TT8_8_VW8_WG8_8_1_WGM1
    SolutionIndex: 30
    SolutionNameMin: Cijk_Alik_Bjlk_I8II_BH_MT32x64x16_SN_EPS0_GRVW4_LRVW4_SU32_SUM3_SUS128_TT4_4_VW4_WG8_16_1_WGM1
    SolutionIndex: 31
    SolutionNameMin: Cijk_Alik_Bjlk_I8II_BH_MT32x32x16_SN_EPS0_GRVW4_LRVW4_SU32_SUM3_SUS128_TT4_4_VW4_WG8_8_1_WGM1
    SolutionIndex: 32
    SolutionNameMin: Cijk_Alik_Bjlk_I8II_BH_MT32x64x32_SN_EPS0_GRVW4_LRVW4_SU32_SUM3_SUS128_TT4_4_VW4_WG8_16_1_WGM1
    SolutionIndex: 33
    SolutionNameMin: Cijk_Alik_Bjlk_I8II_BH_MT32x32x32_SN_EPS0_GRVW4_LRVW4_SU32_SUM3_SUS128_TT4_4_VW4_WG8_8_1_WGM1
    SolutionIndex: 34
    SolutionNameMin: Cijk_Alik_Bjlk_I8II_BH_MT32x64x32_SN_EPS0_GRVW4_LRVW4_SU32_SUM0_SUS256_TT4_4_VW4_WG8_16_1_WGM1
    SolutionIndex: 35
    SolutionNameMin: Cijk_Alik_Bjlk_I8II_BH_MT32x32x32_SN_EPS0_GRVW4_LRVW4_SU32_SUM0_SUS256_TT4_4_VW4_WG8_8_1_WGM1
    SolutionIndex: 36
    SolutionNameMin: Cijk_Alik_Bjlk_I8II_BH_MT64x128x16_SN_EPS0_GRVW8_LRVW8_SU32_SUM0_SUS256_TT8_8_VW8_WG8_16_1_WGM1
    SolutionIndex: 37
    SolutionNameMin: Cijk_Alik_Bjlk_I8II_BH_MT64x128x16_SN_EPS0_GRVW8_LRVW8_SU32_SUM0_SUS256_TT8_16_VW8_WG8_8_1_WGM1
    SolutionIndex: 38
    SolutionNameMin: Cijk_Alik_Bjlk_I8II_BH_MT32x32x32_SN_EPS0_GRVW4_LRVW4_SU32_SUM3_SUS256_TT4_4_VW4_WG8_8_1_WGM1
    SolutionIndex: 39
    SolutionNameMin: Cijk_Alik_Bjlk_I8II_BH_MT64x128x16_SN_EPS0_GRVW8_LRVW8_SU32_SUM3_SUS256_TT8_8_VW8_WG8_16_1_WGM1
    SolutionIndex: 40
    SolutionNameMin: Cijk_Alik_Bjlk_I8II_BH_MT64x64x16_SN_EPS0_GRVW8_LRVW8_SU32_SUM3_SUS256_TT8_8_VW8_WG8_8_1_WGM1
    SolutionIndex: 41
    SolutionNameMin: Cijk_Alik_Bjlk_I8II_BH_MT64x128x16_SN_EPS0_GRVW8_LRVW8_SU32_SUM3_SUS256_TT8_16_VW8_WG8_8_1_WGM1
    SolutionIndex: 42
    SolutionNameMin: Cijk_Alik_Bjlk_I8II_BH_MT32x64x16_SN_EPS0_GRVW4_LRVW4_SU0_SUM0_SUS128_TT4_4_VW4_WG8_16_1_WGM4
    SolutionIndex: 43
    SolutionNameMin: Cijk_Alik_Bjlk_I8II_BH_MT32x128x16_SN_EPS0_GRVW4_LRVW4_SU0_SUM0_SUS128_TT4_8_VW4_WG8_16_1_WGM4
    SolutionIndex: 44
    SolutionNameMin: Cijk_Alik_Bjlk_I8II_BH_MT32x64x16_SN_EPS0_GRVW4_LRVW4_SU0_SUM0_SUS256_TT4_4_VW4_WG8_16_1_WGM4
    SolutionIndex: 45
    SolutionNameMin: Cijk_Alik_Bjlk_I8II_BH_MT32x128x16_SN_EPS0_GRVW4_LRVW4_SU0_SUM0_SUS256_TT4_8_VW4_WG8_16_1_WGM4
    SolutionIndex: 46
    SolutionNameMin: Cijk_Alik_Bjlk_I8II_BH_MT32x64x32_SN_EPS0_GRVW4_LRVW4_SU0_SUM0_SUS256_TT4_4_VW4_WG8_16_1_WGM4
    SolutionIndex: 47
    SolutionNameMin: Cijk_Alik_Bjlk_I8II_BH_MT32x64x16_SN_EPS0_GRVW4_LRVW4_SU32_SUM0_SUS128_TT4_4_VW4_WG8_16_1_WGM4
    SolutionIndex: 48
    SolutionNameMin: Cijk_Alik_Bjlk_I8II_BH_MT32x128x16_SN_EPS0_GRVW4_LRVW4_SU32_SUM0_SUS128_TT4_8_VW4_WG8_16_1_WGM4
    SolutionIndex: 49
    SolutionNameMin: Cijk_Alik_Bjlk_I8II_BH_MT32x128x16_SN_EPS0_GRVW4_LRVW4_SU32_SUM3_SUS128_TT4_8_VW4_WG8_16_1_WGM4
    SolutionIndex: 50
    SolutionNameMin: Cijk_Alik_Bjlk_I8II_BH_MT32x32x32_SN_EPS0_GRVW4_LRVW4_SU32_SUM3_SUS128_TT4_4_VW4_WG8_8_1_WGM4
    SolutionIndex: 51
    SolutionNameMin: Cijk_Alik_Bjlk_I8II_BH_MT32x128x16_SN_EPS0_GRVW4_LRVW4_SU32_SUM3_SUS256_TT4_8_VW4_WG8_16_1_WGM4
    SolutionIndex: 52
    SolutionNameMin: Cijk_Alik_Bjlk_I8II_BH_MT128x256x16_SN_EPS0_GRVW8_LRVW8_SU32_SUM3_SUS256_TT8_16_VW8_WG16_16_1_WGM4
    SolutionIndex: 53
    SolutionNameMin: Cijk_Alik_Bjlk_I8II_BH_MT32x64x16_SN_EPS0_GRVW4_LRVW4_SU0_SUM0_SUS128_TT4_4_VW4_WG8_16_1_WGM8
    SolutionIndex: 54
    SolutionNameMin: Cijk_Alik_Bjlk_I8II_BH_MT32x32x8_SN_EPS0_GRVW4_LRVW4_SU0_SUM0_SUS256_TT4_4_VW4_WG8_8_1_WGM8
    SolutionIndex: 55
    SolutionNameMin: Cijk_Alik_Bjlk_I8II_BH_MT32x128x16_SN_EPS0_GRVW4_LRVW4_SU0_SUM0_SUS256_TT4_8_VW4_WG8_16_1_WGM8
    SolutionIndex: 56
    SolutionNameMin: Cijk_Alik_Bjlk_I8II_BH_MT32x32x32_SN_EPS0_GRVW4_LRVW4_SU0_SUM0_SUS256_TT4_4_VW4_WG8_8_1_WGM8
    SolutionIndex: 57
    SolutionNameMin: Cijk_Alik_Bjlk_I8II_BH_MT32x64x16_SN_EPS0_GRVW4_LRVW4_SU32_SUM0_SUS128_TT4_4_VW4_WG8_16_1_WGM8
    SolutionIndex: 58
    SolutionNameMin: Cijk_Alik_Bjlk_I8II_BH_MT32x64x16_SN_EPS0_GRVW4_LRVW4_SU32_SUM3_SUS128_TT4_4_VW4_WG8_16_1_WGM8
- - - [768, 1024, 1, 1024, 768, 768, 1024, 1024]
    - [28, 26231.0]
  - - [1536, 2048, 1, 2048, 1536, 1536, 2048, 2048]
    - [52, 33253.0]
  - - [32, 32, 1, 32, 32, 32, 32, 32]
    - [11, 20.0]
  - - [32, 32, 1, 64, 32, 32, 64, 32]
    - [15, 34.0]
  - - [32, 32, 1, 128, 32, 32, 128, 32]
    - [15, 52.0]
  - - [32, 32, 1, 256, 32, 32, 256, 32]
    - [24, 75.0]
  - - [32, 32, 1, 512, 32, 32, 512, 32]
    - [24, 100.0]
  - - [32, 32, 1, 1024, 32, 32, 1024, 32]
    - [24, 122.0]
  - - [32, 64, 1, 32, 32, 32, 32, 64]
    - [14, 40.0]
  - - [32, 64, 1, 64, 32, 32, 64, 64]
    - [20, 68.0]
  - - [32, 64, 1, 128, 32, 32, 128, 64]
    - [20, 104.0]
  - - [32, 64, 1, 256, 32, 32, 256, 64]
    - [34, 153.0]
  - - [32, 64, 1, 512, 32, 32, 512, 64]
    - [33, 207.0]
  - - [32, 64, 1, 1024, 32, 32, 1024, 64]
    - [38, 250.0]
  - - [32, 128, 1, 32, 32, 32, 32, 128]
    - [20, 81.0]
  - - [32, 128, 1, 64, 32, 32, 64, 128]
    - [20, 137.0]
  - - [32, 128, 1, 128, 32, 32, 128, 128]
    - [20, 206.0]
  - - [32, 128, 1, 256, 32, 32, 256, 128]
    - [32, 303.0]
  - - [32, 128, 1, 512, 32, 32, 512, 128]
    - [33, 425.0]
  - - [32, 128, 1, 1024, 32, 32, 1024, 128]
    - [38, 512.0]
  - - [32, 256, 1, 32, 32, 32, 32, 256]
    - [20, 160.0]
  - - [32, 256, 1, 64, 32, 32, 64, 256]
    - [20, 270.0]
  - - [32, 256, 1, 128, 32, 32, 128, 256]
    - [20, 413.0]
  - - [32, 256, 1, 256, 32, 32, 256, 256]
    - [32, 617.0]
  - - [32, 256, 1, 512, 32, 32, 512, 256]
    - [33, 853.0]
  - - [32, 256, 1, 1024, 32, 32, 1024, 256]
    - [50, 1023.0]
  - - [32, 512, 1, 32, 32, 32, 32, 512]
    - [14, 320.0]
  - - [32, 512, 1, 64, 32, 32, 64, 512]
    - [20, 546.0]
  - - [32, 512, 1, 128, 32, 32, 128, 512]
    - [20, 839.0]
  - - [32, 512, 1, 256, 32, 32, 256, 512]
    - [32, 1234.0]
  - - [32, 512, 1, 512, 32, 32, 512, 512]
    - [33, 1698.0]
  - - [32, 512, 1, 1024, 32, 32, 1024, 512]
    - [38, 2026.0]
  - - [32, 1024, 1, 32, 32, 32, 32, 1024]
    - [20, 639.0]
  - - [32, 1024, 1, 64, 32, 32, 64, 1024]
    - [20, 1092.0]
  - - [32, 1024, 1, 128, 32, 32, 128, 1024]
    - [15, 1678.0]
  - - [32, 1024, 1, 256, 32, 32, 256, 1024]
    - [32, 2453.0]
  - - [32, 1024, 1, 512, 32, 32, 512, 1024]
    - [32, 3316.0]
  - - [32, 1024, 1, 1024, 32, 32, 1024, 1024]
    - [32, 3966.0]
  - - [64, 32, 1, 32, 64, 64, 32, 32]
    - [15, 39.0]
  - - [64, 32, 1, 64, 64, 64, 64, 32]
    - [25, 66.0]
  - - [64, 32, 1, 128, 64, 64, 128, 32]
    - [25, 103.0]
  - - [64, 32, 1, 256, 64, 64, 256, 32]
    - [19, 152.0]
  - - [64, 32, 1, 512, 64, 64, 512, 32]
    - [19, 202.0]
  - - [64, 32, 1, 1024, 64, 64, 1024, 32]
    - [19, 245.0]
  - - [64, 64, 1, 32, 64, 64, 32, 64]
    - [11, 79.0]
  - - [64, 64, 1, 64, 64, 64, 64, 64]
    - [20, 134.0]
  - - [64, 64, 1, 128, 64, 64, 128, 64]
    - [20, 206.0]
  - - [64, 64, 1, 256, 64, 64, 256, 64]
    - [18, 303.0]
  - - [64, 64, 1, 512, 64, 64, 512, 64]
    - [33, 421.0]
  - - [64, 64, 1, 1024, 64, 64, 1024, 64]
    - [38, 510.0]
  - - [64, 128, 1, 32, 64, 64, 32, 128]
    - [14, 158.0]
  - - [64, 128, 1, 64, 64, 64, 64, 128]
    - [20, 267.0]
  - - [64, 128, 1, 128, 64, 64, 128, 128]
    - [20, 410.0]
  - - [64, 128, 1, 256, 64, 64, 256, 128]
    - [19, 613.0]
  - - [64, 128, 1, 512, 64, 64, 512, 128]
    - [33, 842.0]
  - - [64, 128, 1, 1024, 64, 64, 1024, 128]
    - [38, 1018.0]
  - - [64, 256, 1, 32, 64, 64, 32, 256]
    - [22, 324.0]
  - - [64, 256, 1, 64, 64, 64, 64, 256]
    - [20, 541.0]
  - - [64, 256, 1, 128, 64, 64, 128, 256]
    - [20, 826.0]
  - - [64, 256, 1, 256, 64, 64, 256, 256]
    - [27, 1219.0]
  - - [64, 256, 1, 512, 64, 64, 512, 256]
    - [33, 1684.0]
  - - [64, 256, 1, 1024, 64, 64, 1024, 256]
    - [33, 2046.0]
  - - [64, 512, 1, 32, 64, 64, 32, 512]
    - [20, 632.0]
  - - [64, 512, 1, 64, 64, 64, 64, 512]
    - [20, 1081.0]
  - - [64, 512, 1, 128, 64, 64, 128, 512]
    - [15, 1638.0]
  - - [64, 512, 1, 256, 64, 64, 256, 512]
    - [26, 2397.0]
  - - [64, 512, 1, 512, 64, 64, 512, 512]
    - [32, 3251.0]
  - - [64, 512, 1, 1024, 64, 64, 1024, 512]
    - [32, 3976.0]
  - - [64, 1024, 1, 32, 64, 64, 32, 1024]
    - [17, 1205.0]
  - - [64, 1024, 1, 64, 64, 64, 64, 1024]
    - [15, 2076.0]
  - - [64, 1024, 1, 128, 64, 64, 128, 1024]
    - [15, 3178.0]
  - - [64, 1024, 1, 256, 64, 64, 256, 1024]
    - [26, 4534.0]
  - - [64, 1024, 1, 512, 64, 64, 512, 1024]
    - [34, 5746.0]
  - - [64, 1024, 1, 1024, 64, 64, 1024, 1024]
    - [18, 6592.0]
  - - [128, 32, 1, 32, 128, 128, 32, 32]
    - [20, 78.0]
  - - [128, 32, 1, 64, 128, 128, 64, 32]
    - [20, 135.0]
  - - [128, 32, 1, 128, 128, 128, 128, 32]
    - [20, 208.0]
  - - [128, 32, 1, 256, 128, 128, 256, 32]
    - [19, 301.0]
  - - [128, 32, 1, 512, 128, 128, 512, 32]
    - [35, 410.0]
  - - [128, 32, 1, 1024, 128, 128, 1024, 32]
    - [35, 498.0]
  - - [128, 64, 1, 32, 128, 128, 32, 64]
    - [17, 158.0]
  - - [128, 64, 1, 64, 128, 128, 64, 64]
    - [20, 270.0]
  - - [128, 64, 1, 128, 128, 128, 128, 64]
    - [20, 419.0]
  - - [128, 64, 1, 256, 128, 128, 256, 64]
    - [24, 610.0]
  - - [128, 64, 1, 512, 128, 128, 512, 64]
    - [27, 842.0]
  - - [128, 64, 1, 1024, 128, 128, 1024, 64]
    - [33, 1016.0]
  - - [128, 128, 1, 32, 128, 128, 32, 128]
    - [17, 320.0]
  - - [128, 128, 1, 64, 128, 128, 64, 128]
    - [20, 541.0]
  - - [128, 128, 1, 128, 128, 128, 128, 128]
    - [20, 826.0]
  - - [128, 128, 1, 256, 128, 128, 256, 128]
    - [27, 1219.0]
  - - [128, 128, 1, 512, 128, 128, 512, 128]
    - [27, 1671.0]
  - - [128, 128, 1, 1024, 128, 128, 1024, 128]
    - [33, 2021.0]
  - - [128, 256, 1, 32, 128, 128, 32, 256]
    - [20, 639.0]
  - - [128, 256, 1, 64, 128, 128, 64, 256]
    - [20, 1070.0]
  - - [128, 256, 1, 128, 128, 128, 128, 256]
    - [20, 1651.0]
  - - [128, 256, 1, 256, 128, 128, 256, 256]
    - [19, 2397.0]
  - - [128, 256, 1, 512, 128, 128, 512, 256]
    - [26, 3251.0]
  - - [128, 256, 1, 1024, 128, 128, 1024, 256]
    - [32, 3995.0]
  - - [128, 512, 1, 32, 128, 128, 32, 512]
    - [42, 1219.0]
  - - [128, 512, 1, 64, 128, 128, 64, 512]
    - [20, 2056.0]
  - - [128, 512, 1, 128, 128, 128, 128, 512]
    - [20, 3226.0]
  - - [128, 512, 1, 256, 128, 128, 256, 512]
    - [46, 4584.0]
  - - [128, 512, 1, 512, 128, 128, 512, 512]
    - [32, 5746.0]
  - - [128, 512, 1, 1024, 128, 128, 1024, 512]
    - [23, 6566.0]
  - - [128, 1024, 1, 32, 128, 128, 32, 1024]
    - [42, 2280.0]
  - - [128, 1024, 1, 64, 128, 128, 64, 1024]
    - [20, 3920.0]
  - - [128, 1024, 1, 128, 128, 128, 128, 1024]
    - [20, 5746.0]
  - - [128, 1024, 1, 256, 128, 128, 256, 1024]
    - [58, 7914.0]
  - - [128, 1024, 1, 512, 128, 128, 512, 1024]
    - [10, 9726.0]
  - - [128, 1024, 1, 1024, 128, 128, 1024, 1024]
    - [2, 10948.0]
  - - [256, 32, 1, 32, 256, 256, 32, 32]
    - [20, 160.0]
  - - [256, 32, 1, 64, 256, 256, 64, 32]
    - [20, 273.0]
  - - [256, 32, 1, 128, 256, 256, 128, 32]
    - [20, 419.0]
  - - [256, 32, 1, 256, 256, 256, 256, 32]
    - [19, 603.0]
  - - [256, 32, 1, 512, 256, 256, 512, 32]
    - [35, 819.0]
  - - [256, 32, 1, 1024, 256, 256, 1024, 32]
    - [35, 999.0]
  - - [256, 64, 1, 32, 256, 256, 32, 64]
    - [22, 316.0]
  - - [256, 64, 1, 64, 256, 256, 64, 64]
    - [20, 535.0]
  - - [256, 64, 1, 128, 256, 256, 128, 64]
    - [20, 832.0]
  - - [256, 64, 1, 256, 256, 256, 256, 64]
    - [27, 1219.0]
  - - [256, 64, 1, 512, 256, 256, 512, 64]
    - [27, 1678.0]
  - - [256, 64, 1, 1024, 256, 256, 1024, 64]
    - [27, 2002.0]
  - - [256, 128, 1, 32, 256, 256, 32, 128]
    - [20, 624.0]
  - - [256, 128, 1, 64, 256, 256, 64, 128]
    - [20, 1059.0]
  - - [256, 128, 1, 128, 256, 256, 128, 128]
    - [15, 1626.0]
  - - [256, 128, 1, 256, 256, 256, 256, 128]
    - [38, 2397.0]
  - - [256, 128, 1, 512, 256, 256, 512, 128]
    - [24, 3226.0]
  - - [256, 128, 1, 1024, 256, 256, 1024, 128]
    - [38, 3948.0]
  - - [256, 256, 1, 32, 256, 256, 32, 256]
    - [20, 1192.0]
  - - [256, 256, 1, 64, 256, 256, 64, 256]
    - [20, 2076.0]
  - - [256, 256, 1, 128, 256, 256, 128, 256]
    - [20, 3178.0]
  - - [256, 256, 1, 256, 256, 256, 256, 256]
    - [25, 4534.0]
  - - [256, 256, 1, 512, 256, 256, 512, 256]
    - [23, 5668.0]
  - - [256, 256, 1, 1024, 256, 256, 1024, 256]
    - [26, 6503.0]
  - - [256, 512, 1, 32, 256, 256, 32, 512]
    - [44, 2231.0]
  - - [256, 512, 1, 64, 256, 256, 64, 512]
    - [15, 3779.0]
  - - [256, 512, 1, 128, 256, 256, 128, 512]
    - [42, 5785.0]
  - - [256, 512, 1, 256, 256, 256, 256, 512]
    - [57, 7877.0]
  - - [256, 512, 1, 512, 256, 256, 512, 512]
    - [6, 9698.0]
  - - [256, 512, 1, 1024, 256, 256, 1024, 512]
    - [2, 10930.0]
  - - [256, 1024, 1, 32, 256, 256, 32, 1024]
    - [53, 3920.0]
  - - [256, 1024, 1, 64, 256, 256, 64, 1024]
    - [9, 6355.0]
  - - [256, 1024, 1, 128, 256, 256, 128, 1024]
    - [43, 8972.0]
  - - [256, 1024, 1, 256, 256, 256, 256, 1024]
    - [43, 12114.0]
  - - [256, 1024, 1, 512, 256, 256, 512, 1024]
    - [43, 14589.0]
  - - [256, 1024, 1, 1024, 256, 256, 1024, 1024]
    - [43, 16132.0]
  - - [512, 32, 1, 32, 512, 512, 32, 32]
    - [20, 316.0]
  - - [512, 32, 1, 64, 512, 512, 64, 32]
    - [20, 541.0]
  - - [512, 32, 1, 128, 512, 512, 128, 32]
    - [20, 846.0]
  - - [512, 32, 1, 256, 512, 512, 256, 32]
    - [19, 1219.0]
  - - [512, 32, 1, 512, 512, 512, 512, 32]
    - [33, 1664.0]
  - - [512, 32, 1, 1024, 512, 512, 1024, 32]
    - [27, 2002.0]
  - - [512, 64, 1, 32, 512, 512, 32, 64]
    - [20, 632.0]
  - - [512, 64, 1, 64, 512, 512, 64, 64]
    - [20, 1081.0]
  - - [512, 64, 1, 128, 512, 512, 128, 64]
    - [20, 1664.0]
  - - [512, 64, 1, 256, 512, 512, 256, 64]
    - [24, 2383.0]
  - - [512, 64, 1, 512, 512, 512, 512, 64]
    - [32, 3226.0]
  - - [512, 64, 1, 1024, 512, 512, 1024, 64]
    - [26, 3902.0]
  - - [512, 128, 1, 32, 512, 512, 32, 128]
    - [20, 1205.0]
  - - [512, 128, 1, 64, 512, 512, 64, 128]
    - [20, 2056.0]
  - - [512, 128, 1, 128, 512, 512, 128, 128]
    - [20, 3202.0]
  - - [512, 128, 1, 256, 512, 512, 256, 128]
    - [25, 4534.0]
  - - [512, 128, 1, 512, 512, 512, 512, 128]
    - [1, 5668.0]
  - - [512, 128, 1, 1024, 512, 512, 1024, 128]
    - [32, 6490.0]
  - - [512, 256, 1, 32, 512, 512, 32, 256]
    - [42, 2280.0]
  - - [512, 256, 1, 64, 512, 512, 64, 256]
    - [20, 3848.0]
  - - [512, 256, 1, 128, 512, 512, 128, 256]
    - [20, 5668.0]
  - - [512, 256, 1, 256, 512, 512, 256, 256]
    - [47, 7661.0]
  - - [512, 256, 1, 512, 512, 512, 512, 256]
    - [7, 9840.0]
  - - [512, 256, 1, 1024, 512, 512, 1024, 256]
    - [0, 11129.0]
  - - [512, 512, 1, 32, 512, 512, 32, 512]
    - [8, 3920.0]
  - - [512, 512, 1, 64, 512, 512, 64, 512]
    - [4, 6355.0]
  - - [512, 512, 1, 128, 512, 512, 128, 512]
    - [43, 9020.0]
  - - [512, 512, 1, 256, 512, 512, 256, 512]
    - [43, 12114.0]
  - - [512, 512, 1, 512, 512, 512, 512, 512]
    - [48, 14557.0]
  - - [512, 512, 1, 1024, 512, 512, 1024, 512]
    - [45, 16074.0]
  - - [512, 1024, 1, 32, 512, 512, 32, 1024]
    - [54, 6453.0]
  - - [512, 1024, 1, 64, 512, 512, 64, 1024]
    - [5, 9479.0]
  - - [512, 1024, 1, 128, 512, 512, 128, 1024]
    - [13, 12807.0]
  - - [512, 1024, 1, 256, 512, 512, 256, 1024]
    - [29, 16570.0]
  - - [512, 1024, 1, 512, 512, 512, 512, 1024]
    - [36, 19284.0]
  - - [512, 1024, 1, 1024, 512, 512, 1024, 1024]
    - [39, 22075.0]
  - - [1024, 32, 1, 32, 1024, 1024, 32, 32]
    - [20, 632.0]
  - - [1024, 32, 1, 64, 1024, 1024, 64, 32]
    - [15, 1081.0]
  - - [1024, 32, 1, 128, 1024, 1024, 128, 32]
    - [15, 1678.0]
  - - [1024, 32, 1, 256, 1024, 1024, 256, 32]
    - [31, 2356.0]
  - - [1024, 32, 1, 512, 1024, 1024, 512, 32]
    - [56, 3118.0]
  - - [1024, 32, 1, 1024, 1024, 1024, 1024, 32]
    - [56, 3804.0]
  - - [1024, 64, 1, 32, 1024, 1024, 32, 64]
    - [20, 1219.0]
  - - [1024, 64, 1, 64, 1024, 1024, 64, 64]
    - [20, 2097.0]
  - - [1024, 64, 1, 128, 1024, 1024, 128, 64]
    - [20, 3277.0]
  - - [1024, 64, 1, 256, 1024, 1024, 256, 64]
    - [25, 4559.0]
  - - [1024, 64, 1, 512, 1024, 1024, 512, 64]
    - [25, 5611.0]
  - - [1024, 64, 1, 1024, 1024, 1024, 1024, 64]
    - [18, 6416.0]
  - - [1024, 128, 1, 32, 1024, 1024, 32, 128]
    - [20, 2231.0]
  - - [1024, 128, 1, 64, 1024, 1024, 64, 128]
    - [20, 3779.0]
  - - [1024, 128, 1, 128, 1024, 1024, 128, 128]
    - [20, 5707.0]
  - - [1024, 128, 1, 256, 1024, 1024, 256, 128]
    - [57, 7696.0]
  - - [1024, 128, 1, 512, 1024, 1024, 512, 128]
    - [30, 9642.0]
  - - [1024, 128, 1, 1024, 1024, 1024, 1024, 128]
    - [30, 10983.0]
  - - [1024, 256, 1, 32, 1024, 1024, 32, 256]
    - [20, 3884.0]
  - - [1024, 256, 1, 64, 1024, 1024, 64, 256]
    - [9, 6168.0]
  - - [1024, 256, 1, 128, 1024, 1024, 128, 256]
    - [16, 8830.0]
  - - [1024, 256, 1, 256, 1024, 1024, 256, 256]
    - [49, 11899.0]
  - - [1024, 256, 1, 512, 1024, 1024, 512, 256]
    - [55, 14432.0]
  - - [1024, 256, 1, 1024, 1024, 1024, 1024, 256]
    - [51, 15940.0]
  - - [1024, 512, 1, 32, 1024, 1024, 32, 512]
    - [44, 6214.0]
  - - [1024, 512, 1, 64, 1024, 1024, 64, 512]
    - [21, 9168.0]
  - - [1024, 512, 1, 128, 1024, 1024, 128, 512]
    - [13, 12662.0]
  - - [1024, 512, 1, 256, 1024, 1024, 256, 512]
    - [40, 15753.0]
  - - [1024, 512, 1, 512, 1024, 1024, 512, 512]
    - [28, 18984.0]
  - - [1024, 512, 1, 1024, 1024, 1024, 1024, 512]
    - [36, 21931.0]
  - - [1024, 1024, 1, 32, 1024, 1024, 32, 1024]
    - [12, 8784.0]
  - - [1024, 1024, 1, 64, 1024, 1024, 64, 1024]
    - [13, 13006.0]
  - - [1024, 1024, 1, 128, 1024, 1024, 128, 1024]
    - [3, 16368.0]
  - - [1024, 1024, 1, 256, 1024, 1024, 256, 1024]
    - [37, 21037.0]
  - - [1024, 1024, 1, 512, 1024, 1024, 512, 1024]
    - [41, 24249.0]
  - - [1024, 1024, 1, 1024, 1024, 1024, 1024, 1024]
    - [37, 25923.0]
- null
- null
- DeviceEfficiency
...
