library/src/blas3/Tensile/Logic/asm_full/navi21/navi21_Cijk_Ailk_Bjlk_HB_GB.yaml
- {MinimumRequiredVersion: 4.26.0}
- navi21
- gfx1030
- [Device 73a2]
    SolutionIndex: 0
    SolutionNameMin: Cijk_Ailk_Bjlk_HB_MT128x128x8_SN_SU0_SUM0_TT8_16_WG16_8_1_WGM1
    SolutionIndex: 1
    SolutionNameMin: Cijk_Ailk_Bjlk_HB_MT256x128x8_SN_SU0_SUM0_TT16_16_WG16_8_1_WGM1
    SolutionIndex: 2
    SolutionNameMin: Cijk_Ailk_Bjlk_HB_MT128x64x16_SN_SU0_SUM0_TT8_8_WG16_8_1_WGM1
    SolutionIndex: 3
    SolutionNameMin: Cijk_Ailk_Bjlk_HB_MT128x128x16_SN_SU0_SUM0_TT8_16_WG16_8_1_WGM1
    SolutionIndex: 4
    SolutionNameMin: Cijk_Ailk_Bjlk_HB_MT128x128x16_SN_SU0_SUM0_TT8_8_WG16_16_1_WGM1
    SolutionIndex: 5
    SolutionNameMin: Cijk_Ailk_Bjlk_HB_MT128x256x16_SN_SU0_SUM0_TT8_16_WG16_16_1_WGM1
    SolutionIndex: 6
    SolutionNameMin: Cijk_Ailk_Bjlk_HB_MT128x128x32_SN_SU0_SUM0_TT8_8_WG16_16_1_WGM1
    SolutionIndex: 7
    SolutionNameMin: Cijk_Ailk_Bjlk_HB_MT128x128x8_SN_SU32_SUM3_TT8_16_WG16_8_1_WGM1
    SolutionIndex: 8
    SolutionNameMin: Cijk_Ailk_Bjlk_HB_MT128x64x16_SN_SU32_SUM3_TT8_8_WG16_8_1_WGM1
    SolutionIndex: 9
    SolutionNameMin: Cijk_Ailk_Bjlk_HB_MT128x128x16_SN_SU32_SUM3_TT8_16_WG16_8_1_WGM1
    SolutionIndex: 10
    SolutionNameMin: Cijk_Ailk_Bjlk_HB_MT128x128x16_SN_SU32_SUM3_TT8_8_WG16_16_1_WGM1
    SolutionIndex: 11
    SolutionNameMin: Cijk_Ailk_Bjlk_HB_MT128x128x8_SN_SU0_SUM0_TT8_16_WG16_8_1_WGM4
    SolutionIndex: 12
    SolutionNameMin: Cijk_Ailk_Bjlk_HB_MT128x64x16_SN_SU0_SUM0_TT8_8_WG16_8_1_WGM4
    SolutionIndex: 13
    SolutionNameMin: Cijk_Ailk_Bjlk_HB_MT128x128x16_SN_SU0_SUM0_TT8_16_WG16_8_1_WGM4
    SolutionIndex: 14
    SolutionNameMin: Cijk_Ailk_Bjlk_HB_MT128x128x16_SN_SU0_SUM0_TT8_8_WG16_16_1_WGM4
    SolutionIndex: 15
    SolutionNameMin: Cijk_Ailk_Bjlk_HB_MT128x256x16_SN_SU0_SUM0_TT8_16_WG16_16_1_WGM4
    SolutionIndex: 16
    SolutionNameMin: Cijk_Ailk_Bjlk_HB_MT128x128x32_SN_SU0_SUM0_TT8_8_WG16_16_1_WGM4
    SolutionIndex: 17
    SolutionNameMin: Cijk_Ailk_Bjlk_HB_MT128x128x8_SN_SU32_SUM3_TT8_16_WG16_8_1_WGM4
    SolutionIndex: 18
    SolutionNameMin: Cijk_Ailk_Bjlk_HB_MT128x64x16_SN_SU32_SUM3_TT8_8_WG16_8_1_WGM4
    SolutionIndex: 19
    SolutionNameMin: Cijk_Ailk_Bjlk_HB_MT128x256x16_SN_SU32_SUM3_TT8_16_WG16_16_1_WGM4
    SolutionIndex: 20
    SolutionNameMin: Cijk_Ailk_Bjlk_HB_MT128x128x8_SN_SU0_SUM0_TT8_16_WG16_8_1_WGM8
    SolutionIndex: 21
    SolutionNameMin: Cijk_Ailk_Bjlk_HB_MT256x128x8_SN_SU0_SUM0_TT16_16_WG16_8_1_WGM8
    SolutionIndex: 22
    SolutionNameMin: Cijk_Ailk_Bjlk_HB_MT128x64x16_SN_SU0_SUM0_TT8_8_WG16_8_1_WGM8
    SolutionIndex: 23
    SolutionNameMin: Cijk_Ailk_Bjlk_HB_MT128x128x16_SN_SU0_SUM0_TT8_16_WG16_8_1_WGM8
    SolutionIndex: 24
    SolutionNameMin: Cijk_Ailk_Bjlk_HB_MT128x128x16_SN_SU0_SUM0_TT8_8_WG16_16_1_WGM8
    SolutionIndex: 25
    SolutionNameMin: Cijk_Ailk_Bjlk_HB_MT128x256x16_SN_SU0_SUM0_TT8_16_WG16_16_1_WGM8
    SolutionIndex: 26
    SolutionNameMin: Cijk_Ailk_Bjlk_HB_MT128x128x32_SN_SU0_SUM0_TT8_8_WG16_16_1_WGM8
    SolutionIndex: 27
    SolutionNameMin: Cijk_Ailk_Bjlk_HB_MT128x128x8_SN_SU32_SUM3_TT8_16_WG16_8_1_WGM8
    SolutionIndex: 28
    SolutionNameMin: Cijk_Ailk_Bjlk_HB_MT128x64x16_SN_SU32_SUM3_TT8_8_WG16_8_1_WGM8
    SolutionIndex: 29
    SolutionNameMin: Cijk_Ailk_Bjlk_HB_MT64x64x8_SN_SU0_SUM0_TT8_8_WG8_8_1_WGM1
    SolutionIndex: 30
    SolutionNameMin: Cijk_Ailk_Bjlk_HB_MT64x64x16_SN_SU0_SUM0_TT8_8_WG8_8_1_WGM1
    SolutionIndex: 31
    SolutionNameMin: Cijk_Ailk_Bjlk_HB_MT128x64x16_SN_SU0_SUM0_TT8_8_WG16_8_1_WGM1
    SolutionIndex: 32
    SolutionNameMin: Cijk_Ailk_Bjlk_HB_MT128x128x16_SN_SU0_SUM0_TT8_8_WG16_16_1_WGM1
    SolutionIndex: 33
    SolutionNameMin: Cijk_Ailk_Bjlk_HB_MT64x64x8_SN_SU32_SUM3_TT8_8_WG8_8_1_WGM1
    SolutionIndex: 34
    SolutionNameMin: Cijk_Ailk_Bjlk_HB_MT64x64x16_SN_SU32_SUM3_TT8_8_WG8_8_1_WGM1
    SolutionIndex: 35
    SolutionNameMin: Cijk_Ailk_Bjlk_HB_MT64x64x8_SN_SU0_SUM0_TT8_8_WG8_8_1_WGM4
    SolutionIndex: 36
    SolutionNameMin: Cijk_Ailk_Bjlk_HB_MT64x64x16_SN_SU0_SUM0_TT8_8_WG8_8_1_WGM4
    SolutionIndex: 37
    SolutionNameMin: Cijk_Ailk_Bjlk_HB_MT128x64x16_SN_SU0_SUM0_TT8_8_WG16_8_1_WGM4
    SolutionIndex: 38
    SolutionNameMin: Cijk_Ailk_Bjlk_HB_MT128x128x16_SN_SU0_SUM0_TT8_8_WG16_16_1_WGM4
    SolutionIndex: 39
    SolutionNameMin: Cijk_Ailk_Bjlk_HB_MT64x64x8_SN_SU32_SUM3_TT8_8_WG8_8_1_WGM4
    SolutionIndex: 40
    SolutionNameMin: Cijk_Ailk_Bjlk_HB_MT64x64x8_SN_SU0_SUM0_TT8_8_WG8_8_1_WGM8
    SolutionIndex: 41
    SolutionNameMin: Cijk_Ailk_Bjlk_HB_MT64x64x16_SN_SU0_SUM0_TT8_8_WG8_8_1_WGM8
    SolutionIndex: 42
    SolutionNameMin: Cijk_Ailk_Bjlk_HB_MT128x64x16_SN_SU0_SUM0_TT8_8_WG16_8_1_WGM8
    SolutionIndex: 43
    SolutionNameMin: Cijk_Ailk_Bjlk_HB_MT128x128x16_SN_SU0_SUM0_TT8_8_WG16_16_1_WGM8
    SolutionIndex: 44
    SolutionNameMin: Cijk_Ailk_Bjlk_HB_MT64x64x8_SN_SU32_SUM3_TT8_8_WG8_8_1_WGM8
    SolutionIndex: 45
    SolutionNameMin: Cijk_Ailk_Bjlk_HB_MT32x32x16_SN_SU0_SUM0_TT4_4_WG8_8_1_WGM1
    SolutionIndex: 46
    SolutionNameMin: Cijk_Ailk_Bjlk_HB_MT32x16x16_SN_SU0_SUM0_TT2_2_WG16_8_1_WGM1
    SolutionIndex: 47
    SolutionNameMin: Cijk_Ailk_Bjlk_HB_MT64x32x16_SN_SU0_SUM0_TT4_4_WG16_8_1_WGM1
    SolutionIndex: 48
    SolutionNameMin: Cijk_Ailk_Bjlk_HB_MT32x32x16_SN_SU0_SUM0_TT2_2_WG16_16_1_WGM1
    SolutionIndex: 49
    SolutionNameMin: Cijk_Ailk_Bjlk_HB_MT64x64x16_SN_SU0_SUM0_TT4_4_WG16_16_1_WGM1
    SolutionIndex: 50
    SolutionNameMin: Cijk_Ailk_Bjlk_HB_MT32x16x32_SN_SU0_SUM0_TT2_2_WG16_8_1_WGM1
    SolutionIndex: 51
    SolutionNameMin: Cijk_Ailk_Bjlk_HB_MT64x32x32_SN_SU0_SUM0_TT4_4_WG16_8_1_WGM1
    SolutionIndex: 52
    SolutionNameMin: Cijk_Ailk_Bjlk_HB_MT32x32x32_SN_SU0_SUM0_TT2_2_WG16_16_1_WGM1
    SolutionIndex: 53
    SolutionNameMin: Cijk_Ailk_Bjlk_HB_MT64x64x32_SN_SU0_SUM0_TT4_4_WG16_16_1_WGM1
    SolutionIndex: 54
    SolutionNameMin: Cijk_Ailk_Bjlk_HB_MT32x32x16_SN_SU32_SUM3_TT4_4_WG8_8_1_WGM1
    SolutionIndex: 55
    SolutionNameMin: Cijk_Ailk_Bjlk_HB_MT32x32x16_SN_SU32_SUM3_TT2_2_WG16_16_1_WGM1
    SolutionIndex: 56
    SolutionNameMin: Cijk_Ailk_Bjlk_HB_MT32x32x16_SN_SU0_SUM0_TT4_4_WG8_8_1_WGM4
    SolutionIndex: 57
    SolutionNameMin: Cijk_Ailk_Bjlk_HB_MT32x16x16_SN_SU0_SUM0_TT2_2_WG16_8_1_WGM4
    SolutionIndex: 58
    SolutionNameMin: Cijk_Ailk_Bjlk_HB_MT64x32x16_SN_SU0_SUM0_TT4_4_WG16_8_1_WGM4
    SolutionIndex: 59
    SolutionNameMin: Cijk_Ailk_Bjlk_HB_MT64x64x16_SN_SU0_SUM0_TT4_4_WG16_16_1_WGM4
    SolutionIndex: 60
    SolutionNameMin: Cijk_Ailk_Bjlk_HB_MT32x32x32_SN_SU0_SUM0_TT2_2_WG16_16_1_WGM4
    SolutionIndex: 61
    SolutionNameMin: Cijk_Ailk_Bjlk_HB_MT64x64x32_SN_SU0_SUM0_TT4_4_WG16_16_1_WGM4
    SolutionIndex: 62
    SolutionNameMin: Cijk_Ailk_Bjlk_HB_MT64x32x8_SN_SU32_SUM3_TT4_4_WG16_8_1_WGM4
    SolutionIndex: 63
    SolutionNameMin: Cijk_Ailk_Bjlk_HB_MT64x32x16_SN_SU32_SUM3_TT4_4_WG16_8_1_WGM4
    SolutionIndex: 64
    SolutionNameMin: Cijk_Ailk_Bjlk_HB_MT32x32x16_SN_SU0_SUM0_TT4_4_WG8_8_1_WGM8
    SolutionIndex: 65
    SolutionNameMin: Cijk_Ailk_Bjlk_HB_MT32x16x16_SN_SU0_SUM0_TT2_2_WG16_8_1_WGM8
    SolutionIndex: 66
    SolutionNameMin: Cijk_Ailk_Bjlk_HB_MT64x32x16_SN_SU0_SUM0_TT4_4_WG16_8_1_WGM8
    SolutionIndex: 67
    SolutionNameMin: Cijk_Ailk_Bjlk_HB_MT32x32x16_SN_SU0_SUM0_TT2_2_WG16_16_1_WGM8
    SolutionIndex: 68
    SolutionNameMin: Cijk_Ailk_Bjlk_HB_MT64x64x16_SN_SU0_SUM0_TT4_4_WG16_16_1_WGM8
    SolutionIndex: 69
    SolutionNameMin: Cijk_Ailk_Bjlk_HB_MT32x32x32_SN_SU0_SUM0_TT2_2_WG16_16_1_WGM8
    SolutionIndex: 70
    SolutionNameMin: Cijk_Ailk_Bjlk_HB_MT64x64x32_SN_SU0_SUM0_TT4_4_WG16_16_1_WGM8
    SolutionIndex: 71
    SolutionNameMin: Cijk_Ailk_Bjlk_HB_MT32x32x8_SN_SU32_SUM3_TT4_4_WG8_8_1_WGM8
    SolutionIndex: 72
    SolutionNameMin: Cijk_Ailk_Bjlk_HB_MT64x32x8_SN_SU32_SUM3_TT4_4_WG16_8_1_WGM8
    SolutionIndex: 73
    SolutionNameMin: Cijk_Ailk_Bjlk_HB_MT64x64x8_SN_SU32_SUM3_TT4_4_WG16_16_1_WGM8
- - - [2944, 4288, 1, 1280, 2944, 2944, 2944, 4288]
    - [11, 39959.0]
  - - [2368, 5888, 1, 256, 2368, 2368, 2368, 5888]
    - [7, 38265.0]
  - - [1024, 5056, 1, 3328, 1024, 1024, 1024, 5056]
    - [20, 39363.0]
  - - [5888, 1024, 1, 1280, 5888, 5888, 5888, 1024]
    - [12, 37872.0]
  - - [5888, 1856, 1, 3328, 5888, 5888, 5888, 1856]
    - [12, 38647.0]
  - - [5056, 704, 1, 256, 5056, 5056, 5056, 704]
    - [18, 32872.0]
  - - [5888, 2944, 1, 3328, 5888, 5888, 5888, 2944]
    - [3, 41101.0]
  - - [1856, 4288, 1, 256, 1856, 1856, 1856, 4288]
    - [22, 35656.0]
  - - [5056, 5056, 1, 3328, 5056, 5056, 5056, 5056]
    - [13, 40526.0]
  - - [1408, 5888, 1, 1280, 1408, 1408, 1408, 5888]
    - [20, 38537.0]
  - - [448, 3584, 1, 3328, 448, 448, 448, 3584]
    - [2, 29241.0]
  - - [5888, 1408, 1, 1280, 5888, 5888, 5888, 1408]
    - [3, 38557.0]
  - - [3584, 1856, 1, 3328, 3584, 3584, 3584, 1856]
    - [20, 38452.0]
  - - [5056, 6784, 1, 1280, 5056, 5056, 5056, 6784]
    - [9, 41394.0]
  - - [5056, 5056, 1, 1280, 5056, 5056, 5056, 5056]
    - [23, 40351.0]
  - - [448, 5056, 1, 256, 448, 448, 448, 5056]
    - [22, 28508.0]
  - - [6784, 448, 1, 256, 6784, 6784, 6784, 448]
    - [8, 32636.0]
  - - [5888, 704, 1, 1280, 5888, 5888, 5888, 704]
    - [12, 36118.0]
  - - [3584, 1024, 1, 256, 3584, 3584, 3584, 1024]
    - [22, 34592.0]
  - - [6784, 4288, 1, 3328, 6784, 6784, 6784, 4288]
    - [23, 40761.0]
  - - [1856, 2368, 1, 3328, 1856, 1856, 1856, 2368]
    - [20, 37216.0]
  - - [5888, 2944, 1, 1280, 5888, 5888, 5888, 2944]
    - [13, 40892.0]
  - - [5888, 1024, 1, 256, 5888, 5888, 5888, 1024]
    - [2, 36575.0]
  - - [1408, 2944, 1, 256, 1408, 1408, 1408, 2944]
    - [2, 34543.0]
  - - [6784, 5056, 1, 3328, 6784, 6784, 6784, 5056]
    - [23, 41560.0]
  - - [5056, 5056, 1, 256, 5056, 5056, 5056, 5056]
    - [17, 38921.0]
  - - [1024, 3584, 1, 1280, 1024, 1024, 1024, 3584]
    - [22, 36574.0]
  - - [2368, 2944, 1, 1280, 2368, 2368, 2368, 2944]
    - [2, 36898.0]
  - - [1408, 4288, 1, 1280, 1408, 1408, 1408, 4288]
    - [12, 37942.0]
  - - [3584, 4288, 1, 1280, 3584, 3584, 3584, 4288]
    - [23, 39979.0]
  - - [2368, 704, 1, 1280, 2368, 2368, 2368, 704]
    - [12, 33300.0]
  - - [5056, 4288, 1, 3328, 5056, 5056, 5056, 4288]
    - [25, 40708.0]
  - - [3584, 2368, 1, 3328, 3584, 3584, 3584, 2368]
    - [13, 39462.0]
  - - [6784, 448, 1, 1280, 6784, 6784, 6784, 448]
    - [22, 35514.0]
  - - [4288, 2944, 1, 256, 4288, 4288, 4288, 2944]
    - [0, 38768.0]
  - - [5056, 2368, 1, 1280, 5056, 5056, 5056, 2368]
    - [12, 38192.0]
  - - [448, 3584, 1, 1280, 448, 448, 448, 3584]
    - [12, 28529.0]
  - - [6784, 5888, 1, 256, 6784, 6784, 6784, 5888]
    - [0, 41313.0]
  - - [1024, 1408, 1, 256, 1024, 1024, 1024, 1408]
    - [2, 29247.0]
  - - [2368, 2368, 1, 3328, 2368, 2368, 2368, 2368]
    - [12, 37165.0]
  - - [5056, 704, 1, 3328, 5056, 5056, 5056, 704]
    - [2, 35768.0]
  - - [1408, 1856, 1, 256, 1408, 1408, 1408, 1856]
    - [2, 34413.0]
  - - [5888, 1856, 1, 256, 5888, 5888, 5888, 1856]
    - [2, 37775.0]
  - - [704, 5888, 1, 256, 704, 704, 704, 5888]
    - [24, 32333.0]
  - - [4288, 6784, 1, 3328, 4288, 4288, 4288, 6784]
    - [23, 40740.0]
  - - [3584, 704, 1, 3328, 3584, 3584, 3584, 704]
    - [2, 36210.0]
  - - [1408, 1408, 1, 256, 1408, 1408, 1408, 1408]
    - [22, 31839.0]
  - - [448, 4288, 1, 256, 448, 448, 448, 4288]
    - [2, 26525.0]
  - - [704, 2368, 1, 1280, 704, 704, 704, 2368]
    - [12, 29678.0]
  - - [1856, 2368, 1, 1280, 1856, 1856, 1856, 2368]
    - [11, 36749.0]
  - - [1408, 1024, 1, 1280, 1408, 1408, 1408, 1024]
    - [2, 34457.0]
  - - [6784, 704, 1, 256, 6784, 6784, 6784, 704]
    - [2, 35296.0]
  - - [1408, 3584, 1, 256, 1408, 1408, 1408, 3584]
    - [11, 36534.0]
  - - [3584, 4288, 1, 3328, 3584, 3584, 3584, 4288]
    - [13, 40307.0]
  - - [5888, 1856, 1, 1280, 5888, 5888, 5888, 1856]
    - [12, 38551.0]
  - - [5056, 1024, 1, 3328, 5056, 5056, 5056, 1024]
    - [11, 39319.0]
  - - [2368, 3584, 1, 1280, 2368, 2368, 2368, 3584]
    - [3, 39062.0]
  - - [2944, 3584, 1, 3328, 2944, 2944, 2944, 3584]
    - [15, 41556.0]
  - - [6784, 2944, 1, 256, 6784, 6784, 6784, 2944]
    - [0, 40694.0]
  - - [1024, 2368, 1, 256, 1024, 1024, 1024, 2368]
    - [2, 32097.0]
  - - [4288, 2368, 1, 3328, 4288, 4288, 4288, 2368]
    - [3, 39561.0]
  - - [1856, 2368, 1, 256, 1856, 1856, 1856, 2368]
    - [2, 33808.0]
  - - [3584, 6784, 1, 3328, 3584, 3584, 3584, 6784]
    - [15, 41354.0]
  - - [6784, 1856, 1, 3328, 6784, 6784, 6784, 1856]
    - [22, 39318.0]
  - - [5056, 4288, 1, 1280, 5056, 5056, 5056, 4288]
    - [23, 40339.0]
  - - [1408, 5056, 1, 1280, 1408, 1408, 1408, 5056]
    - [20, 37835.0]
  - - [6784, 5888, 1, 3328, 6784, 6784, 6784, 5888]
    - [15, 42229.0]
  - - [2368, 5056, 1, 1280, 2368, 2368, 2368, 5056]
    - [2, 38040.0]
  - - [1024, 5056, 1, 1280, 1024, 1024, 1024, 5056]
    - [20, 38836.0]
  - - [4288, 1024, 1, 256, 4288, 4288, 4288, 1024]
    - [8, 33797.0]
  - - [2368, 1408, 1, 256, 2368, 2368, 2368, 1408]
    - [24, 33006.0]
  - - [5888, 448, 1, 1280, 5888, 5888, 5888, 448]
    - [22, 33503.0]
  - - [704, 5888, 1, 3328, 704, 704, 704, 5888]
    - [5, 35831.0]
  - - [1024, 6784, 1, 1280, 1024, 1024, 1024, 6784]
    - [3, 39921.0]
  - - [6784, 2368, 1, 1280, 6784, 6784, 6784, 2368]
    - [11, 40325.0]
  - - [3584, 2944, 1, 1280, 3584, 3584, 3584, 2944]
    - [23, 40998.0]
  - - [2368, 1024, 1, 3328, 2368, 2368, 2368, 1024]
    - [12, 34643.0]
  - - [1408, 5056, 1, 3328, 1408, 1408, 1408, 5056]
    - [13, 38211.0]
  - - [1856, 1856, 1, 3328, 1856, 1856, 1856, 1856]
    - [12, 34674.0]
  - - [2368, 2368, 1, 256, 2368, 2368, 2368, 2368]
    - [2, 35218.0]
  - - [4288, 4288, 1, 1280, 4288, 4288, 4288, 4288]
    - [23, 39436.0]
  - - [704, 6784, 1, 3328, 704, 704, 704, 6784]
    - [11, 36438.0]
  - - [5888, 5888, 1, 3328, 5888, 5888, 5888, 5888]
    - [13, 42047.0]
  - - [5056, 1024, 1, 1280, 5056, 5056, 5056, 1024]
    - [4, 38368.0]
  - - [448, 5888, 1, 3328, 448, 448, 448, 5888]
    - [8, 31075.0]
  - - [5056, 5888, 1, 1280, 5056, 5056, 5056, 5888]
    - [5, 40850.0]
  - - [448, 6784, 1, 256, 448, 448, 448, 6784]
    - [14, 30512.0]
  - - [3584, 5888, 1, 256, 3584, 3584, 3584, 5888]
    - [3, 40563.0]
  - - [2944, 3584, 1, 256, 2944, 2944, 2944, 3584]
    - [20, 39641.0]
  - - [6784, 2944, 1, 3328, 6784, 6784, 6784, 2944]
    - [13, 41842.0]
  - - [2944, 5056, 1, 3328, 2944, 2944, 2944, 5056]
    - [15, 40709.0]
  - - [2048, 7133, 1, 2048, 2048, 2048, 2048, 7133]
    - [20, 41123.0]
  - - [4288, 5888, 1, 1280, 4288, 4288, 4288, 5888]
    - [15, 40843.0]
  - - [4288, 4288, 1, 256, 4288, 4288, 4288, 4288]
    - [20, 38225.0]
  - - [4288, 1856, 1, 1280, 4288, 4288, 4288, 1856]
    - [8, 37560.0]
  - - [1856, 2944, 1, 3328, 1856, 1856, 1856, 2944]
    - [15, 37842.0]
  - - [256, 6784, 1, 3328, 256, 256, 256, 6784]
    - [6, 37609.0]
  - - [5056, 1024, 1, 256, 5056, 5056, 5056, 1024]
    - [4, 36412.0]
  - - [5056, 1856, 1, 3328, 5056, 5056, 5056, 1856]
    - [3, 38652.0]
  - - [1856, 1408, 1, 256, 1856, 1856, 1856, 1408]
    - [24, 29919.0]
  - - [5056, 256, 1, 3328, 5056, 5056, 5056, 256]
    - [22, 31460.0]
  - - [5056, 3584, 1, 256, 5056, 5056, 5056, 3584]
    - [0, 39187.0]
  - - [1856, 1024, 1, 1280, 1856, 1856, 1856, 1024]
    - [2, 33306.0]
  - - [1856, 1856, 1, 1280, 1856, 1856, 1856, 1856]
    - [2, 34426.0]
  - - [6784, 6784, 1, 1280, 6784, 6784, 6784, 6784]
    - [13, 41691.0]
  - - [1856, 1024, 1, 3328, 1856, 1856, 1856, 1024]
    - [12, 34211.0]
  - - [6784, 1024, 1, 256, 6784, 6784, 6784, 1024]
    - [11, 38212.0]
  - - [5056, 5888, 1, 3328, 5056, 5056, 5056, 5888]
    - [15, 41051.0]
  - - [1856, 1024, 1, 256, 1856, 1856, 1856, 1024]
    - [2, 27771.0]
  - - [5056, 1408, 1, 3328, 5056, 5056, 5056, 1408]
    - [0, 38187.0]
  - - [4288, 1024, 1, 3328, 4288, 4288, 4288, 1024]
    - [25, 37779.0]
  - - [2944, 1408, 1, 3328, 2944, 2944, 2944, 1408]
    - [22, 36439.0]
  - - [2944, 4288, 1, 3328, 2944, 2944, 2944, 4288]
    - [15, 40544.0]
  - - [5056, 2944, 1, 256, 5056, 5056, 5056, 2944]
    - [0, 39114.0]
  - - [2368, 1856, 1, 256, 2368, 2368, 2368, 1856]
    - [18, 33869.0]
  - - [1408, 3584, 1, 3328, 1408, 1408, 1408, 3584]
    - [0, 38651.0]
  - - [2368, 6784, 1, 256, 2368, 2368, 2368, 6784]
    - [7, 38270.0]
  - - [5056, 1408, 1, 1280, 5056, 5056, 5056, 1408]
    - [0, 37825.0]
  - - [1408, 5888, 1, 3328, 1408, 1408, 1408, 5888]
    - [23, 38821.0]
  - - [1856, 5056, 1, 256, 1856, 1856, 1856, 5056]
    - [17, 36587.0]
  - - [6784, 6784, 1, 256, 6784, 6784, 6784, 6784]
    - [0, 41109.0]
  - - [2368, 4288, 1, 1280, 2368, 2368, 2368, 4288]
    - [20, 39134.0]
  - - [3584, 1856, 1, 1280, 3584, 3584, 3584, 1856]
    - [22, 38264.0]
  - - [5888, 5056, 1, 256, 5888, 5888, 5888, 5056]
    - [0, 39743.0]
  - - [3584, 448, 1, 256, 3584, 3584, 3584, 448]
    - [2, 28865.0]
  - - [3072, 7435, 1, 1024, 3072, 3072, 3072, 7435]
    - [15, 40434.0]
  - - [256, 6784, 1, 256, 256, 256, 256, 6784]
    - [14, 31398.0]
  - - [1856, 3584, 1, 3328, 1856, 1856, 1856, 3584]
    - [15, 38676.0]
  - - [5056, 256, 1, 1280, 5056, 5056, 5056, 256]
    - [8, 30079.0]
  - - [3584, 3584, 1, 256, 3584, 3584, 3584, 3584]
    - [7, 39676.0]
  - - [6784, 4288, 1, 1280, 6784, 6784, 6784, 4288]
    - [13, 40635.0]
  - - [704, 5056, 1, 256, 704, 704, 704, 5056]
    - [24, 30826.0]
  - - [2944, 2368, 1, 1280, 2944, 2944, 2944, 2368]
    - [12, 38413.0]
  - - [6784, 3584, 1, 256, 6784, 6784, 6784, 3584]
    - [0, 40423.0]
  - - [704, 6784, 1, 256, 704, 704, 704, 6784]
    - [0, 33278.0]
  - - [1024, 3584, 1, 3328, 1024, 1024, 1024, 3584]
    - [12, 36953.0]
  - - [2944, 2944, 1, 3328, 2944, 2944, 2944, 2944]
    - [13, 40508.0]
  - - [5056, 6784, 1, 256, 5056, 5056, 5056, 6784]
    - [27, 40524.0]
  - - [1408, 4288, 1, 3328, 1408, 1408, 1408, 4288]
    - [12, 38163.0]
  - - [6784, 256, 1, 1280, 6784, 6784, 6784, 256]
    - [14, 36659.0]
  - - [2368, 704, 1, 3328, 2368, 2368, 2368, 704]
    - [22, 34498.0]
  - - [3584, 6784, 1, 256, 3584, 3584, 3584, 6784]
    - [27, 40344.0]
  - - [5056, 1856, 1, 256, 5056, 5056, 5056, 1856]
    - [2, 37153.0]
  - - [704, 4288, 1, 256, 704, 704, 704, 4288]
    - [24, 29792.0]
  - - [1408, 6784, 1, 1280, 1408, 1408, 1408, 6784]
    - [3, 39311.0]
  - - [3584, 3584, 1, 1280, 3584, 3584, 3584, 3584]
    - [25, 41220.0]
  - - [5056, 2368, 1, 3328, 5056, 5056, 5056, 2368]
    - [3, 38485.0]
  - - [2944, 4288, 1, 256, 2944, 2944, 2944, 4288]
    - [22, 38629.0]
  - - [1408, 3584, 1, 1280, 1408, 1408, 1408, 3584]
    - [0, 38361.0]
  - - [1024, 1408, 1, 1280, 1024, 1024, 1024, 1408]
    - [2, 34431.0]
  - - [2368, 6784, 1, 3328, 2368, 2368, 2368, 6784]
    - [3, 40630.0]
  - - [5056, 704, 1, 1280, 5056, 5056, 5056, 704]
    - [2, 35461.0]
  - - [1856, 4288, 1, 3328, 1856, 1856, 1856, 4288]
    - [22, 37915.0]
  - - [1408, 5888, 1, 256, 1408, 1408, 1408, 5888]
    - [0, 37325.0]
  - - [4096, 7133, 1, 4096, 4096, 4096, 4096, 7133]
    - [15, 41713.0]
  - - [3584, 704, 1, 1280, 3584, 3584, 3584, 704]
    - [22, 35296.0]
  - - [3584, 448, 1, 3328, 3584, 3584, 3584, 448]
    - [22, 33582.0]
  - - [704, 2368, 1, 3328, 704, 704, 704, 2368]
    - [12, 30337.0]
  - - [448, 5056, 1, 3328, 448, 448, 448, 5056]
    - [2, 32475.0]
  - - [4288, 448, 1, 256, 4288, 4288, 4288, 448]
    - [2, 27879.0]
  - - [448, 5888, 1, 256, 448, 448, 448, 5888]
    - [2, 27835.0]
  - - [5888, 2368, 1, 256, 5888, 5888, 5888, 2368]
    - [2, 38421.0]
  - - [6784, 704, 1, 3328, 6784, 6784, 6784, 704]
    - [22, 37207.0]
  - - [1408, 2944, 1, 3328, 1408, 1408, 1408, 2944]
    - [12, 36424.0]
  - - [2368, 704, 1, 256, 2368, 2368, 2368, 704]
    - [12, 26977.0]
  - - [3584, 2368, 1, 256, 3584, 3584, 3584, 2368]
    - [2, 37917.0]
  - - [5888, 5056, 1, 1280, 5888, 5888, 5888, 5056]
    - [3, 40749.0]
  - - [3584, 3584, 1, 3328, 3584, 3584, 3584, 3584]
    - [25, 41448.0]
  - - [5888, 6784, 1, 256, 5888, 5888, 5888, 6784]
    - [27, 41273.0]
  - - [4288, 2944, 1, 3328, 4288, 4288, 4288, 2944]
    - [0, 40494.0]
  - - [4288, 704, 1, 1280, 4288, 4288, 4288, 704]
    - [2, 34773.0]
  - - [256, 5056, 1, 1280, 256, 256, 256, 5056]
    - [22, 31037.0]
  - - [6784, 5888, 1, 1280, 6784, 6784, 6784, 5888]
    - [5, 42050.0]
  - - [5888, 4288, 1, 1280, 5888, 5888, 5888, 4288]
    - [23, 40665.0]
  - - [1408, 1856, 1, 1280, 1408, 1408, 1408, 1856]
    - [12, 37100.0]
  - - [5888, 448, 1, 3328, 5888, 5888, 5888, 448]
    - [22, 33992.0]
  - - [704, 5888, 1, 1280, 704, 704, 704, 5888]
    - [5, 34989.0]
  - - [1024, 6784, 1, 3328, 1024, 1024, 1024, 6784]
    - [3, 40301.0]
  - - [704, 2944, 1, 1280, 704, 704, 704, 2944]
    - [6, 33294.0]
  - - [5056, 2944, 1, 3328, 5056, 5056, 5056, 2944]
    - [3, 40523.0]
  - - [1408, 1408, 1, 3328, 1408, 1408, 1408, 1408]
    - [22, 36041.0]
  - - [448, 4288, 1, 1280, 448, 448, 448, 4288]
    - [16, 30432.0]
  - - [3584, 704, 1, 256, 3584, 3584, 3584, 704]
    - [12, 33158.0]
  - - [3584, 1408, 1, 3328, 3584, 3584, 3584, 1408]
    - [11, 38671.0]
  - - [2368, 1024, 1, 1280, 2368, 2368, 2368, 1024]
    - [2, 33936.0]
  - - [1856, 6784, 1, 256, 1856, 1856, 1856, 6784]
    - [0, 37542.0]
  - - [4288, 448, 1, 3328, 4288, 4288, 4288, 448]
    - [28, 34491.0]
  - - [4288, 3584, 1, 1280, 4288, 4288, 4288, 3584]
    - [0, 40109.0]
  - - [1760, 7133, 1, 1760, 1760, 1760, 1760, 7133]
    - [25, 40065.0]
  - - [5888, 1024, 1, 3328, 5888, 5888, 5888, 1024]
    - [22, 38140.0]
  - - [704, 6784, 1, 1280, 704, 704, 704, 6784]
    - [7, 35897.0]
  - - [1024, 2944, 1, 3328, 1024, 1024, 1024, 2944]
    - [2, 35618.0]
  - - [704, 5056, 1, 1280, 704, 704, 704, 5056]
    - [24, 33634.0]
  - - [1024, 5888, 1, 1280, 1024, 1024, 1024, 5888]
    - [22, 37924.0]
  - - [2944, 1856, 1, 256, 2944, 2944, 2944, 1856]
    - [2, 36276.0]
  - - [3584, 5056, 1, 256, 3584, 3584, 3584, 5056]
    - [22, 38884.0]
  - - [5888, 5056, 1, 3328, 5888, 5888, 5888, 5056]
    - [15, 40976.0]
  - - [3584, 6784, 1, 1280, 3584, 3584, 3584, 6784]
    - [23, 41130.0]
  - - [1856, 5888, 1, 256, 1856, 1856, 1856, 5888]
    - [17, 36811.0]
  - - [4288, 4288, 1, 3328, 4288, 4288, 4288, 4288]
    - [3, 39659.0]
  - - [4288, 1408, 1, 1280, 4288, 4288, 4288, 1408]
    - [8, 37668.0]
  - - [4288, 2368, 1, 256, 4288, 4288, 4288, 2368]
    - [24, 36871.0]
  - - [2944, 5056, 1, 1280, 2944, 2944, 2944, 5056]
    - [23, 40262.0]
  - - [6784, 2368, 1, 3328, 6784, 6784, 6784, 2368]
    - [13, 40540.0]
  - - [4288, 1856, 1, 3328, 4288, 4288, 4288, 1856]
    - [2, 37819.0]
  - - [1856, 2944, 1, 1280, 1856, 1856, 1856, 2944]
    - [15, 36974.0]
  - - [2944, 5888, 1, 1280, 2944, 2944, 2944, 5888]
    - [5, 41041.0]
  - - [3584, 1024, 1, 1280, 3584, 3584, 3584, 1024]
    - [22, 36535.0]
  - - [1024, 4288, 1, 256, 1024, 1024, 1024, 4288]
    - [22, 36260.0]
  - - [5888, 3584, 1, 3328, 5888, 5888, 5888, 3584]
    - [5, 41874.0]
  - - [5056, 3584, 1, 3328, 5056, 5056, 5056, 3584]
    - [15, 40365.0]
  - - [2368, 1408, 1, 1280, 2368, 2368, 2368, 1408]
    - [24, 36620.0]
  - - [5056, 2944, 1, 1280, 5056, 5056, 5056, 2944]
    - [0, 40287.0]
  - - [1024, 6784, 1, 256, 1024, 1024, 1024, 6784]
    - [14, 38081.0]
  - - [3584, 2944, 1, 256, 3584, 3584, 3584, 2944]
    - [27, 39525.0]
  - - [3584, 1408, 1, 1280, 3584, 3584, 3584, 1408]
    - [20, 38302.0]
  - - [5056, 6784, 1, 3328, 5056, 5056, 5056, 6784]
    - [0, 41502.0]
  - - [3584, 4288, 1, 256, 3584, 3584, 3584, 4288]
    - [22, 38005.0]
  - - [1856, 6784, 1, 3328, 1856, 1856, 1856, 6784]
    - [3, 38614.0]
  - - [5056, 1408, 1, 256, 5056, 5056, 5056, 1408]
    - [2, 36174.0]
  - - [5888, 5888, 1, 256, 5888, 5888, 5888, 5888]
    - [0, 41218.0]
  - - [4288, 1024, 1, 1280, 4288, 4288, 4288, 1024]
    - [5, 36496.0]
  - - [448, 6784, 1, 3328, 448, 448, 448, 6784]
    - [25, 34072.0]
  - - [2944, 1408, 1, 1280, 2944, 2944, 2944, 1408]
    - [12, 36187.0]
  - - [2944, 1856, 1, 3328, 2944, 2944, 2944, 1856]
    - [12, 38011.0]
  - - [3584, 5888, 1, 1280, 3584, 3584, 3584, 5888]
    - [25, 41667.0]
  - - [6784, 1856, 1, 1280, 6784, 6784, 6784, 1856]
    - [22, 39139.0]
  - - [5888, 256, 1, 3328, 5888, 5888, 5888, 256]
    - [26, 32813.0]
  - - [1856, 5888, 1, 3328, 1856, 1856, 1856, 5888]
    - [25, 38647.0]
  - - [3584, 1408, 1, 256, 3584, 3584, 3584, 1408]
    - [17, 36267.0]
  - - [704, 3584, 1, 3328, 704, 704, 704, 3584]
    - [14, 33653.0]
  - - [5056, 448, 1, 1280, 5056, 5056, 5056, 448]
    - [2, 35058.0]
  - - [4288, 704, 1, 256, 4288, 4288, 4288, 704]
    - [2, 32335.0]
  - - [2944, 1024, 1, 256, 2944, 2944, 2944, 1024]
    - [22, 33009.0]
  - - [2368, 4288, 1, 3328, 2368, 2368, 2368, 4288]
    - [5, 39775.0]
  - - [6784, 5056, 1, 256, 6784, 6784, 6784, 5056]
    - [17, 40234.0]
  - - [3584, 5056, 1, 3328, 3584, 3584, 3584, 5056]
    - [19, 40366.0]
  - - [4288, 5888, 1, 256, 4288, 4288, 4288, 5888]
    - [3, 39765.0]
  - - [2944, 6784, 1, 256, 2944, 2944, 2944, 6784]
    - [11, 40701.0]
  - - [2368, 2368, 1, 1280, 2368, 2368, 2368, 2368]
    - [8, 36635.0]
  - - [1856, 3584, 1, 1280, 1856, 1856, 1856, 3584]
    - [5, 37974.0]
  - - [5056, 3584, 1, 1280, 5056, 5056, 5056, 3584]
    - [5, 40057.0]
  - - [256, 5888, 1, 256, 256, 256, 256, 5888]
    - [24, 27841.0]
  - - [1856, 1408, 1, 3328, 1856, 1856, 1856, 1408]
    - [24, 34765.0]
  - - [1024, 4288, 1, 3328, 1024, 1024, 1024, 4288]
    - [22, 38469.0]
  - - [2944, 2368, 1, 3328, 2944, 2944, 2944, 2368]
    - [22, 38668.0]
  - - [1024, 1856, 1, 1280, 1024, 1024, 1024, 1856]
    - [22, 34024.0]
  - - [6784, 1856, 1, 256, 6784, 6784, 6784, 1856]
    - [22, 38547.0]
  - - [1024, 5888, 1, 256, 1024, 1024, 1024, 5888]
    - [22, 36680.0]
  - - [1408, 2368, 1, 256, 1408, 1408, 1408, 2368]
    - [12, 33817.0]
  - - [2944, 704, 1, 3328, 2944, 2944, 2944, 704]
    - [26, 34282.0]
  - - [2944, 2944, 1, 1280, 2944, 2944, 2944, 2944]
    - [13, 40219.0]
  - - [6784, 256, 1, 3328, 6784, 6784, 6784, 256]
    - [16, 37614.0]
  - - [1408, 5056, 1, 256, 1408, 1408, 1408, 5056]
    - [12, 36683.0]
  - - [5056, 256, 1, 256, 5056, 5056, 5056, 256]
    - [8, 23500.0]
  - - [1408, 4288, 1, 256, 1408, 1408, 1408, 4288]
    - [22, 36713.0]
  - - [5888, 2368, 1, 1280, 5888, 5888, 5888, 2368]
    - [3, 39234.0]
  - - [2368, 5888, 1, 1280, 2368, 2368, 2368, 5888]
    - [0, 39248.0]
  - - [5888, 256, 1, 1280, 5888, 5888, 5888, 256]
    - [24, 31859.0]
  - - [2368, 1856, 1, 3328, 2368, 2368, 2368, 1856]
    - [3, 37326.0]
  - - [2944, 704, 1, 256, 2944, 2944, 2944, 704]
    - [22, 30388.0]
  - - [2368, 6784, 1, 1280, 2368, 2368, 2368, 6784]
    - [11, 40263.0]
  - - [1856, 4288, 1, 1280, 1856, 1856, 1856, 4288]
    - [22, 37637.0]
  - - [704, 3584, 1, 256, 704, 704, 704, 3584]
    - [14, 29575.0]
  - - [704, 2944, 1, 3328, 704, 704, 704, 2944]
    - [6, 34320.0]
  - - [1856, 5056, 1, 3328, 1856, 1856, 1856, 5056]
    - [11, 38721.0]
  - - [3584, 5056, 1, 1280, 3584, 3584, 3584, 5056]
    - [25, 39967.0]
  - - [2944, 1024, 1, 3328, 2944, 2944, 2944, 1024]
    - [22, 35625.0]
  - - [1408, 6784, 1, 256, 1408, 1408, 1408, 6784]
    - [0, 38077.0]
  - - [6784, 1408, 1, 3328, 6784, 6784, 6784, 1408]
    - [3, 39561.0]
  - - [1024, 2368, 1, 1280, 1024, 1024, 1024, 2368]
    - [12, 34479.0]
  - - [6784, 2944, 1, 1280, 6784, 6784, 6784, 2944]
    - [13, 41656.0]
  - - [3584, 448, 1, 1280, 3584, 3584, 3584, 448]
    - [22, 32894.0]
  - - [2944, 6784, 1, 3328, 2944, 2944, 2944, 6784]
    - [3, 41804.0]
  - - [448, 5056, 1, 1280, 448, 448, 448, 5056]
    - [22, 31910.0]
  - - [5888, 704, 1, 256, 5888, 5888, 5888, 704]
    - [2, 34543.0]
  - - [256, 5888, 1, 3328, 256, 256, 256, 5888]
    - [6, 32847.0]
  - - [6784, 4288, 1, 256, 6784, 6784, 6784, 4288]
    - [17, 39658.0]
  - - [5888, 256, 1, 256, 5888, 5888, 5888, 256]
    - [22, 27367.0]
  - - [6784, 1024, 1, 1280, 6784, 6784, 6784, 1024]
    - [5, 40235.0]
  - - [2944, 704, 1, 1280, 2944, 2944, 2944, 704]
    - [26, 33294.0]
  - - [6784, 3584, 1, 1280, 6784, 6784, 6784, 3584]
    - [5, 41375.0]
  - - [1408, 2944, 1, 1280, 1408, 1408, 1408, 2944]
    - [2, 36133.0]
  - - [1408, 2368, 1, 3328, 1408, 1408, 1408, 2368]
    - [14, 37227.0]
  - - [1024, 3584, 1, 256, 1024, 1024, 1024, 3584]
    - [12, 34643.0]
  - - [2368, 2944, 1, 256, 2368, 2368, 2368, 2944]
    - [12, 35707.0]
  - - [2944, 5888, 1, 256, 2944, 2944, 2944, 5888]
    - [11, 39993.0]
  - - [3584, 1856, 1, 256, 3584, 3584, 3584, 1856]
    - [2, 37019.0]
  - - [704, 4288, 1, 3328, 704, 704, 704, 4288]
    - [15, 33950.0]
  - - [4288, 2944, 1, 1280, 4288, 4288, 4288, 2944]
    - [7, 40179.0]
  - - [4288, 5056, 1, 3328, 4288, 4288, 4288, 5056]
    - [15, 40650.0]
  - - [256, 5056, 1, 3328, 256, 256, 256, 5056]
    - [22, 31809.0]
  - - [5056, 2368, 1, 256, 5056, 5056, 5056, 2368]
    - [8, 37506.0]
  - - [4288, 704, 1, 3328, 4288, 4288, 4288, 704]
    - [2, 35540.0]
  - - [448, 3584, 1, 256, 448, 448, 448, 3584]
    - [2, 24762.0]
  - - [1024, 1408, 1, 3328, 1024, 1024, 1024, 1408]
    - [12, 35333.0]
  - - [2560, 7133, 1, 2560, 2560, 2560, 2560, 7133]
    - [15, 40522.0]
  - - [5888, 3584, 1, 256, 5888, 5888, 5888, 3584]
    - [3, 40612.0]
  - - [1408, 1856, 1, 3328, 1408, 1408, 1408, 1856]
    - [22, 37545.0]
  - - [6784, 1408, 1, 1280, 6784, 6784, 6784, 1408]
    - [3, 39313.0]
  - - [704, 2944, 1, 256, 704, 704, 704, 2944]
    - [2, 28930.0]
  - - [2944, 5888, 1, 3328, 2944, 2944, 2944, 5888]
    - [5, 41300.0]
  - - [1408, 6784, 1, 3328, 1408, 1408, 1408, 6784]
    - [13, 39560.0]
  - - [1408, 1408, 1, 1280, 1408, 1408, 1408, 1408]
    - [22, 35421.0]
  - - [448, 4288, 1, 3328, 448, 448, 448, 4288]
    - [16, 31584.0]
  - - [704, 2368, 1, 256, 704, 704, 704, 2368]
    - [2, 25771.0]
  - - [5888, 2368, 1, 3328, 5888, 5888, 5888, 2368]
    - [3, 39501.0]
  - - [4288, 5056, 1, 256, 4288, 4288, 4288, 5056]
    - [27, 39030.0]
  - - [4288, 448, 1, 1280, 4288, 4288, 4288, 448]
    - [2, 33546.0]
  - - [5888, 704, 1, 3328, 5888, 5888, 5888, 704]
    - [22, 36450.0]
  - - [4288, 3584, 1, 3328, 4288, 4288, 4288, 3584]
    - [3, 40332.0]
  - - [6784, 6784, 1, 3328, 6784, 6784, 6784, 6784]
    - [13, 41714.0]
  - - [704, 5056, 1, 3328, 704, 704, 704, 5056]
    - [14, 34199.0]
  - - [2368, 2944, 1, 3328, 2368, 2368, 2368, 2944]
    - [3, 37347.0]
  - - [2368, 3584, 1, 256, 2368, 2368, 2368, 3584]
    - [10, 37089.0]
  - - [3584, 2368, 1, 1280, 3584, 3584, 3584, 2368]
    - [11, 39037.0]
  - - [1856, 1856, 1, 256, 1856, 1856, 1856, 1856]
    - [22, 31974.0]
  - - [4288, 1408, 1, 3328, 4288, 4288, 4288, 1408]
    - [2, 38124.0]
  - - [4288, 5056, 1, 1280, 4288, 4288, 4288, 5056]
    - [23, 40335.0]
  - - [5888, 6784, 1, 1280, 5888, 5888, 5888, 6784]
    - [1, 42008.0]
  - - [5888, 1408, 1, 3328, 5888, 5888, 5888, 1408]
    - [23, 38751.0]
  - - [256, 5056, 1, 256, 256, 256, 256, 5056]
    - [2, 26593.0]
  - - [1408, 1024, 1, 256, 1408, 1408, 1408, 1024]
    - [2, 29575.0]
  - - [2368, 5056, 1, 256, 2368, 2368, 2368, 5056]
    - [8, 37178.0]
  - - [1024, 5056, 1, 256, 1024, 1024, 1024, 5056]
    - [2, 36292.0]
  - - [2368, 1408, 1, 3328, 2368, 2368, 2368, 1408]
    - [24, 37197.0]
  - - [5888, 448, 1, 256, 5888, 5888, 5888, 448]
    - [22, 31234.0]
  - - [6784, 5056, 1, 1280, 6784, 6784, 6784, 5056]
    - [13, 41417.0]
  - - [4288, 6784, 1, 1280, 4288, 4288, 4288, 6784]
    - [0, 40571.0]
  - - [6784, 1408, 1, 256, 6784, 6784, 6784, 1408]
    - [20, 38088.0]
  - - [5888, 4288, 1, 256, 5888, 5888, 5888, 4288]
    - [7, 39459.0]
  - - [5056, 5888, 1, 256, 5056, 5056, 5056, 5888]
    - [9, 39872.0]
  - - [2368, 1024, 1, 256, 2368, 2368, 2368, 1024]
    - [8, 29673.0]
  - - [1856, 6784, 1, 1280, 1856, 1856, 1856, 6784]
    - [11, 38472.0]
  - - [4288, 3584, 1, 256, 4288, 4288, 4288, 3584]
    - [0, 39241.0]
  - - [5056, 1856, 1, 1280, 5056, 5056, 5056, 1856]
    - [11, 38346.0]
  - - [1408, 1024, 1, 3328, 1408, 1408, 1408, 1024]
    - [22, 35359.0]
  - - [5888, 3584, 1, 1280, 5888, 5888, 5888, 3584]
    - [15, 41780.0]
  - - [1024, 2944, 1, 256, 1024, 1024, 1024, 2944]
    - [22, 32925.0]
  - - [448, 6784, 1, 1280, 448, 448, 448, 6784]
    - [14, 33565.0]
  - - [3584, 1024, 1, 3328, 3584, 3584, 3584, 1024]
    - [22, 36949.0]
  - - [2944, 1856, 1, 1280, 2944, 2944, 2944, 1856]
    - [22, 37781.0]
  - - [2368, 3584, 1, 3328, 2368, 2368, 2368, 3584]
    - [3, 39475.0]
  - - [3584, 5888, 1, 3328, 3584, 3584, 3584, 5888]
    - [15, 41945.0]
  - - [2944, 3584, 1, 1280, 2944, 2944, 2944, 3584]
    - [5, 41244.0]
  - - [1856, 5888, 1, 1280, 1856, 1856, 1856, 5888]
    - [25, 38275.0]
  - - [5056, 448, 1, 3328, 5056, 5056, 5056, 448]
    - [22, 36120.0]
  - - [4288, 1408, 1, 256, 4288, 4288, 4288, 1408]
    - [8, 36078.0]
  - - [4288, 2368, 1, 1280, 4288, 4288, 4288, 2368]
    - [11, 39169.0]
  - - [2944, 5056, 1, 256, 2944, 2944, 2944, 5056]
    - [27, 38756.0]
  - - [6784, 2368, 1, 256, 6784, 6784, 6784, 2368]
    - [20, 38827.0]
  - - [4288, 1856, 1, 256, 4288, 4288, 4288, 1856]
    - [2, 36434.0]
  - - [1856, 2944, 1, 256, 1856, 1856, 1856, 2944]
    - [8, 34623.0]
  - - [1856, 1408, 1, 1280, 1856, 1856, 1856, 1408]
    - [14, 34014.0]
  - - [1024, 4288, 1, 1280, 1024, 1024, 1024, 4288]
    - [22, 38171.0]
  - - [2368, 5056, 1, 3328, 2368, 2368, 2368, 5056]
    - [15, 38651.0]
  - - [1024, 1856, 1, 3328, 1024, 1024, 1024, 1856]
    - [2, 34616.0]
  - - [704, 3584, 1, 1280, 704, 704, 704, 3584]
    - [14, 33077.0]
  - - [4288, 6784, 1, 256, 4288, 4288, 4288, 6784]
    - [11, 39506.0]
  - - [3584, 2944, 1, 3328, 3584, 3584, 3584, 2944]
    - [13, 41290.0]
  - - [5888, 2944, 1, 256, 5888, 5888, 5888, 2944]
    - [20, 39978.0]
  - - [5056, 4288, 1, 256, 5056, 5056, 5056, 4288]
    - [11, 39080.0]
  - - [6784, 1024, 1, 3328, 6784, 6784, 6784, 1024]
    - [25, 40669.0]
  - - [5888, 5888, 1, 1280, 5888, 5888, 5888, 5888]
    - [13, 41908.0]
  - - [448, 5888, 1, 1280, 448, 448, 448, 5888]
    - [2, 30661.0]
  - - [2944, 1408, 1, 256, 2944, 2944, 2944, 1408]
    - [2, 34476.0]
  - - [1024, 2944, 1, 1280, 1024, 1024, 1024, 2944]
    - [2, 35291.0]
  - - [2368, 5888, 1, 3328, 2368, 2368, 2368, 5888]
    - [0, 39466.0]
  - - [2368, 1856, 1, 1280, 2368, 2368, 2368, 1856]
    - [20, 36730.0]
  - - [5888, 4288, 1, 3328, 5888, 5888, 5888, 4288]
    - [5, 41008.0]
  - - [6784, 704, 1, 1280, 6784, 6784, 6784, 704]
    - [2, 36858.0]
  - - [5056, 448, 1, 256, 5056, 5056, 5056, 448]
    - [8, 30328.0]
  - - [1856, 5056, 1, 1280, 1856, 1856, 1856, 5056]
    - [20, 38336.0]
  - - [2944, 1024, 1, 1280, 2944, 2944, 2944, 1024]
    - [12, 35272.0]
  - - [2368, 4288, 1, 256, 2368, 2368, 2368, 4288]
    - [4, 36924.0]
  - - [1024, 2368, 1, 3328, 1024, 1024, 1024, 2368]
    - [22, 34940.0]
  - - [4288, 5888, 1, 3328, 4288, 4288, 4288, 5888]
    - [5, 41100.0]
  - - [2944, 6784, 1, 1280, 2944, 2944, 2944, 6784]
    - [3, 41656.0]
  - - [256, 6784, 1, 1280, 256, 256, 256, 6784]
    - [14, 36622.0]
  - - [1856, 3584, 1, 256, 1856, 1856, 1856, 3584]
    - [11, 35941.0]
  - - [256, 5888, 1, 1280, 256, 256, 256, 5888]
    - [24, 31964.0]
  - - [7680, 5481, 1, 2560, 7680, 7680, 7680, 5481]
    - [21, 41803.0]
  - - [2944, 2368, 1, 256, 2944, 2944, 2944, 2368]
    - [2, 36333.0]
  - - [1024, 1856, 1, 256, 1024, 1024, 1024, 1856]
    - [2, 30600.0]
  - - [6784, 3584, 1, 3328, 6784, 6784, 6784, 3584]
    - [5, 41499.0]
  - - [1024, 5888, 1, 3328, 1024, 1024, 1024, 5888]
    - [12, 38111.0]
  - - [1408, 2368, 1, 1280, 1408, 1408, 1408, 2368]
    - [14, 36520.0]
  - - [2944, 2944, 1, 256, 2944, 2944, 2944, 2944]
    - [11, 38776.0]
  - - [6784, 256, 1, 256, 6784, 6784, 6784, 256]
    - [14, 31666.0]
  - - [5888, 1408, 1, 256, 5888, 5888, 5888, 1408]
    - [20, 37352.0]
  - - [5888, 6784, 1, 3328, 5888, 5888, 5888, 6784]
    - [1, 42117.0]
  - - [704, 4288, 1, 1280, 704, 704, 704, 4288]
    - [24, 32774.0]
  - - [6784, 448, 1, 3328, 6784, 6784, 6784, 448]
    - [12, 35849.0]
  - - [3136, 256, 64, 64, 3136, 3136, 3136, 256]
    - [27, 37240.0]
  - - [784, 512, 64, 128, 784, 784, 784, 512]
    - [24, 33637.0]
  - - [784, 128, 64, 512, 784, 784, 784, 128]
    - [20, 33189.0]
  - - [196, 256, 128, 1024, 196, 196, 196, 256]
    - [2, 29222.0]
  - - [196, 256, 64, 1024, 196, 196, 196, 256]
    - [2, 27703.0]
  - - [196, 1024, 128, 256, 196, 196, 196, 1024]
    - [27, 29869.0]
  - - [784, 128, 256, 512, 784, 784, 784, 128]
    - [0, 34458.0]
  - - [3136, 256, 256, 64, 3136, 3136, 3136, 256]
    - [0, 18835.0]
  - - [784, 128, 128, 512, 784, 784, 784, 128]
    - [24, 34676.0]
  - - [784, 512, 128, 128, 784, 784, 784, 512]
    - [17, 34650.0]
  - - [784, 512, 256, 128, 784, 784, 784, 512]
    - [6, 31762.0]
  - - [196, 1024, 64, 256, 196, 196, 196, 1024]
    - [14, 28421.0]
  - - [196, 1024, 256, 256, 196, 196, 196, 1024]
    - [2, 29299.0]
  - - [196, 256, 256, 1024, 196, 196, 196, 256]
    - [3, 30610.0]
  - - [3136, 256, 128, 64, 3136, 3136, 3136, 256]
    - [0, 24371.0]
  - - [1024, 1024, 1, 3328, 1024, 1024, 1024, 1024]
    - [38, 31747.0]
  - - [64, 6784, 1, 256, 64, 64, 64, 6784]
    - [29, 13999.0]
  - - [128, 6784, 1, 3328, 128, 128, 128, 6784]
    - [32, 27059.0]
  - - [256, 4288, 1, 3328, 256, 256, 256, 4288]
    - [32, 33157.0]
  - - [704, 1856, 1, 3328, 704, 704, 704, 1856]
    - [37, 31625.0]
  - - [448, 1024, 1, 1280, 448, 448, 448, 1024]
    - [35, 22125.0]
  - - [2368, 128, 1, 256, 2368, 2368, 2368, 128]
    - [33, 10571.0]
  - - [256, 1856, 1, 1280, 256, 256, 256, 1856]
    - [40, 22676.0]
  - - [448, 704, 1, 1280, 448, 448, 448, 704]
    - [35, 15623.0]
  - - [128, 3584, 1, 1280, 128, 128, 128, 3584]
    - [29, 21652.0]
  - - [4288, 256, 1, 256, 4288, 4288, 4288, 256]
    - [29, 25640.0]
  - - [5888, 64, 1, 3328, 5888, 5888, 5888, 64]
    - [36, 19793.0]
  - - [2944, 256, 1, 3328, 2944, 2944, 2944, 256]
    - [42, 28296.0]
  - - [256, 4288, 1, 1280, 256, 256, 256, 4288]
    - [31, 31059.0]
  - - [1408, 448, 1, 1280, 1408, 1408, 1408, 448]
    - [35, 23003.0]
  - - [6784, 128, 1, 1280, 6784, 6784, 6784, 128]
    - [32, 25765.0]
  - - [2368, 128, 1, 3328, 2368, 2368, 2368, 128]
    - [29, 16249.0]
  - - [2944, 128, 1, 256, 2944, 2944, 2944, 128]
    - [33, 12828.0]
  - - [448, 1408, 1, 256, 448, 448, 448, 1408]
    - [33, 17706.0]
  - - [64, 5056, 1, 3328, 64, 64, 64, 5056]
    - [36, 17055.0]
  - - [2368, 256, 1, 1280, 2368, 2368, 2368, 256]
    - [29, 22031.0]
  - - [256, 3584, 1, 3328, 256, 256, 256, 3584]
    - [32, 28521.0]
  - - [5056, 64, 1, 1280, 5056, 5056, 5056, 64]
    - [40, 15665.0]
  - - [1024, 704, 1, 256, 1024, 1024, 1024, 704]
    - [40, 19759.0]
  - - [4288, 128, 1, 1280, 4288, 4288, 4288, 128]
    - [29, 26117.0]
  - - [5888, 64, 1, 256, 5888, 5888, 5888, 64]
    - [33, 12794.0]
  - - [1856, 256, 1, 1280, 1856, 1856, 1856, 256]
    - [35, 22761.0]
  - - [64, 5888, 1, 3328, 64, 64, 64, 5888]
    - [36, 19812.0]
  - - [256, 1408, 1, 3328, 256, 256, 256, 1408]
    - [36, 18963.0]
  - - [6784, 128, 1, 3328, 6784, 6784, 6784, 128]
    - [32, 27064.0]
  - - [704, 704, 1, 3328, 704, 704, 704, 704]
    - [30, 25290.0]
  - - [3584, 256, 1, 3328, 3584, 3584, 3584, 256]
    - [38, 28478.0]
  - - [128, 3584, 1, 3328, 128, 128, 128, 3584]
    - [32, 23840.0]
  - - [128, 2944, 1, 1280, 128, 128, 128, 2944]
    - [36, 18092.0]
  - - [448, 1856, 1, 1280, 448, 448, 448, 1856]
    - [40, 29368.0]
  - - [3584, 128, 1, 256, 3584, 3584, 3584, 128]
    - [33, 14904.0]
  - - [448, 1408, 1, 3328, 448, 448, 448, 1408]
    - [36, 23931.0]
  - - [256, 3584, 1, 256, 256, 256, 256, 3584]
    - [29, 21668.0]
  - - [256, 2944, 1, 3328, 256, 256, 256, 2944]
    - [37, 28296.0]
  - - [1408, 704, 1, 256, 1408, 1408, 1408, 704]
    - [29, 23452.0]
  - - [448, 2944, 1, 3328, 448, 448, 448, 2944]
    - [36, 31623.0]
  - - [64, 5888, 1, 256, 64, 64, 64, 5888]
    - [33, 12432.0]
  - - [448, 2368, 1, 1280, 448, 448, 448, 2368]
    - [29, 29791.0]
  - - [128, 4288, 1, 3328, 128, 128, 128, 4288]
    - [30, 27896.0]
  - - [256, 2368, 1, 256, 256, 256, 256, 2368]
    - [33, 16868.0]
  - - [1024, 448, 1, 3328, 1024, 1024, 1024, 448]
    - [30, 23430.0]
  - - [1856, 704, 1, 1280, 1856, 1856, 1856, 704]
    - [29, 30299.0]
  - - [1024, 1024, 1, 1280, 1024, 1024, 1024, 1024]
    - [38, 30868.0]
  - - [256, 2944, 1, 256, 256, 256, 256, 2944]
    - [29, 20613.0]
  - - [128, 6784, 1, 1280, 128, 128, 128, 6784]
    - [32, 25717.0]
  - - [1408, 704, 1, 3328, 1408, 1408, 1408, 704]
    - [43, 30337.0]
  - - [128, 5888, 1, 1280, 128, 128, 128, 5888]
    - [35, 26693.0]
  - - [704, 1408, 1, 3328, 704, 704, 704, 1408]
    - [32, 30443.0]
  - - [6784, 128, 1, 256, 6784, 6784, 6784, 128]
    - [29, 20698.0]
  - - [704, 448, 1, 256, 704, 704, 704, 448]
    - [33, 11030.0]
  - - [256, 1856, 1, 3328, 256, 256, 256, 1856]
    - [30, 24334.0]
  - - [128, 4288, 1, 256, 128, 128, 128, 4288]
    - [44, 18295.0]
  - - [64, 6784, 1, 3328, 64, 64, 64, 6784]
    - [36, 22257.0]
  - - [2944, 256, 1, 1280, 2944, 2944, 2944, 256]
    - [35, 26693.0]
  - - [1856, 704, 1, 256, 1856, 1856, 1856, 704]
    - [29, 26297.0]
  - - [1408, 448, 1, 3328, 1408, 1408, 1408, 448]
    - [36, 23937.0]
  - - [2368, 256, 1, 256, 2368, 2368, 2368, 256]
    - [29, 17054.0]
  - - [704, 1856, 1, 256, 704, 704, 704, 1856]
    - [29, 26380.0]
  - - [5888, 64, 1, 1280, 5888, 5888, 5888, 64]
    - [36, 18133.0]
  - - [256, 2368, 1, 1280, 256, 256, 256, 2368]
    - [40, 22019.0]
  - - [2944, 448, 1, 256, 2944, 2944, 2944, 448]
    - [29, 26586.0]
  - - [2368, 128, 1, 1280, 2368, 2368, 2368, 128]
    - [29, 15179.0]
  - - [64, 5056, 1, 1280, 64, 64, 64, 5056]
    - [36, 15548.0]
  - - [704, 448, 1, 3328, 704, 704, 704, 448]
    - [34, 16587.0]
  - - [5056, 64, 1, 3328, 5056, 5056, 5056, 64]
    - [30, 17066.0]
  - - [2368, 448, 1, 1280, 2368, 2368, 2368, 448]
    - [29, 29923.0]
  - - [128, 3584, 1, 256, 128, 128, 128, 3584]
    - [44, 15453.0]
  - - [1856, 448, 1, 3328, 1856, 1856, 1856, 448]
    - [41, 30988.0]
  - - [128, 5056, 1, 256, 128, 128, 128, 5056]
    - [44, 17930.0]
  - - [4288, 256, 1, 1280, 4288, 4288, 4288, 256]
    - [29, 30665.0]
  - - [704, 704, 1, 256, 704, 704, 704, 704]
    - [33, 16917.0]
  - - [4288, 128, 1, 3328, 4288, 4288, 4288, 128]
    - [36, 27904.0]
  - - [256, 1408, 1, 1280, 256, 256, 256, 1408]
    - [29, 17332.0]
  - - [6784, 64, 1, 3328, 6784, 6784, 6784, 64]
    - [36, 22230.0]
  - - [128, 2944, 1, 3328, 128, 128, 128, 2944]
    - [30, 19824.0]
  - - [2944, 448, 1, 3328, 2944, 2944, 2944, 448]
    - [42, 32128.0]
  - - [2368, 448, 1, 3328, 2368, 2368, 2368, 448]
    - [37, 31002.0]
  - - [5056, 64, 1, 256, 5056, 5056, 5056, 64]
    - [33, 10786.0]
  - - [128, 5056, 1, 3328, 128, 128, 128, 5056]
    - [30, 24536.0]
  - - [6784, 64, 1, 256, 6784, 6784, 6784, 64]
    - [39, 14287.0]
  - - [128, 2368, 1, 256, 128, 128, 128, 2368]
    - [33, 10346.0]
  - - [3584, 256, 1, 256, 3584, 3584, 3584, 256]
    - [29, 21431.0]
  - - [128, 2944, 1, 256, 128, 128, 128, 2944]
    - [33, 12660.0]
  - - [3584, 128, 1, 3328, 3584, 3584, 3584, 128]
    - [29, 23641.0]
  - - [1024, 448, 1, 1280, 1024, 1024, 1024, 448]
    - [44, 21993.0]
  - - [5888, 128, 1, 3328, 5888, 5888, 5888, 128]
    - [37, 28277.0]
  - - [1408, 704, 1, 1280, 1408, 1408, 1408, 704]
    - [43, 28397.0]
  - - [448, 1408, 1, 1280, 448, 448, 448, 1408]
    - [35, 22977.0]
  - - [704, 1408, 1, 1280, 704, 704, 704, 1408]
    - [32, 28589.0]
  - - [448, 2944, 1, 256, 448, 448, 448, 2944]
    - [35, 26420.0]
  - - [448, 2368, 1, 256, 448, 448, 448, 2368]
    - [29, 24644.0]
  - - [64, 5056, 1, 256, 64, 64, 64, 5056]
    - [29, 10486.0]
  - - [5056, 128, 1, 3328, 5056, 5056, 5056, 128]
    - [36, 24564.0]
  - - [448, 704, 1, 256, 448, 448, 448, 704]
    - [33, 11060.0]
  - - [1856, 256, 1, 3328, 1856, 1856, 1856, 256]
    - [30, 24260.0]
  - - [2944, 128, 1, 3328, 2944, 2944, 2944, 128]
    - [29, 19843.0]
  - - [64, 6784, 1, 1280, 64, 64, 64, 6784]
    - [35, 20568.0]
  - - [704, 1024, 1, 1280, 704, 704, 704, 1024]
    - [35, 26125.0]
  - - [256, 4288, 1, 256, 256, 256, 256, 4288]
    - [29, 25226.0]
  - - [256, 2368, 1, 3328, 256, 256, 256, 2368]
    - [34, 23051.0]
  - - [1408, 256, 1, 1280, 1408, 1408, 1408, 256]
    - [29, 18107.0]
  - - [704, 448, 1, 1280, 704, 704, 704, 448]
    - [35, 15807.0]
  - - [1024, 704, 1, 1280, 1024, 1024, 1024, 704]
    - [40, 26037.0]
  - - [256, 1856, 1, 256, 256, 256, 256, 1856]
    - [33, 15594.0]
  - - [704, 1856, 1, 1280, 704, 704, 704, 1856]
    - [40, 30464.0]
  - - [1408, 256, 1, 3328, 1408, 1408, 1408, 256]
    - [36, 18981.0]
  - - [5888, 128, 1, 256, 5888, 5888, 5888, 128]
    - [29, 20791.0]
  - - [2368, 448, 1, 256, 2368, 2368, 2368, 448]
    - [35, 24916.0]
  - - [4288, 256, 1, 3328, 4288, 4288, 4288, 256]
    - [32, 33193.0]
  - - [2944, 256, 1, 256, 2944, 2944, 2944, 256]
    - [29, 20881.0]
  - - [1408, 448, 1, 256, 1408, 1408, 1408, 448]
    - [33, 17784.0]
  - - [6784, 64, 1, 1280, 6784, 6784, 6784, 64]
    - [40, 20706.0]
  - - [448, 1024, 1, 3328, 448, 448, 448, 1024]
    - [30, 23481.0]
  - - [2944, 448, 1, 1280, 2944, 2944, 2944, 448]
    - [37, 31045.0]
  - - [5056, 128, 1, 256, 5056, 5056, 5056, 128]
    - [39, 18008.0]
  - - [448, 1024, 1, 256, 448, 448, 448, 1024]
    - [33, 15828.0]
  - - [128, 5056, 1, 1280, 128, 128, 128, 5056]
    - [36, 23100.0]
  - - [1408, 256, 1, 256, 1408, 1408, 1408, 256]
    - [33, 12271.0]
  - - [128, 5888, 1, 3328, 128, 128, 128, 5888]
    - [42, 28296.0]
  - - [3584, 128, 1, 1280, 3584, 3584, 3584, 128]
    - [29, 22276.0]
  - - [4288, 128, 1, 256, 4288, 4288, 4288, 128]
    - [39, 18391.0]
  - - [2368, 256, 1, 3328, 2368, 2368, 2368, 256]
    - [36, 23015.0]
  - - [5888, 128, 1, 1280, 5888, 5888, 5888, 128]
    - [37, 26619.0]
  - - [256, 3584, 1, 1280, 256, 256, 256, 3584]
    - [32, 27148.0]
  - - [128, 5888, 1, 256, 128, 128, 128, 5888]
    - [29, 20657.0]
  - - [1024, 1024, 1, 256, 1024, 1024, 1024, 1024]
    - [29, 24403.0]
  - - [1024, 1024, 1, 1024, 1024, 1024, 1024, 1024]
    - [38, 30229.0]
  - - [64, 5888, 1, 1280, 64, 64, 64, 5888]
    - [36, 18052.0]
  - - [704, 1024, 1, 256, 704, 704, 704, 1024]
    - [29, 20060.0]
  - - [704, 704, 1, 1280, 704, 704, 704, 704]
    - [35, 23689.0]
  - - [128, 2368, 1, 1280, 128, 128, 128, 2368]
    - [35, 14618.0]
  - - [3584, 256, 1, 1280, 3584, 3584, 3584, 256]
    - [38, 27085.0]
  - - [5056, 128, 1, 1280, 5056, 5056, 5056, 128]
    - [41, 23100.0]
  - - [448, 1856, 1, 3328, 448, 448, 448, 1856]
    - [41, 31022.0]
  - - [1024, 448, 1, 256, 1024, 1024, 1024, 448]
    - [44, 15213.0]
  - - [2944, 128, 1, 1280, 2944, 2944, 2944, 128]
    - [29, 18623.0]
  - - [256, 2944, 1, 1280, 256, 256, 256, 2944]
    - [29, 26619.0]
  - - [704, 1024, 1, 3328, 704, 704, 704, 1024]
    - [36, 27282.0]
  - - [1856, 448, 1, 1280, 1856, 1856, 1856, 448]
    - [35, 29829.0]
  - - [128, 6784, 1, 256, 128, 128, 128, 6784]
    - [35, 20660.0]
  - - [704, 1408, 1, 256, 704, 704, 704, 1408]
    - [35, 23496.0]
  - - [256, 1408, 1, 256, 256, 256, 256, 1408]
    - [33, 11984.0]
  - - [448, 2944, 1, 1280, 448, 448, 448, 2944]
    - [40, 30684.0]
  - - [1856, 256, 1, 256, 1856, 1856, 1856, 256]
    - [33, 16089.0]
  - - [128, 2368, 1, 3328, 128, 128, 128, 2368]
    - [36, 16037.0]
  - - [448, 2368, 1, 3328, 448, 448, 448, 2368]
    - [30, 30926.0]
  - - [1856, 448, 1, 256, 1856, 1856, 1856, 448]
    - [29, 22987.0]
  - - [1024, 704, 1, 3328, 1024, 1024, 1024, 704]
    - [36, 27269.0]
  - - [128, 4288, 1, 1280, 128, 128, 128, 4288]
    - [29, 25867.0]
  - - [448, 704, 1, 3328, 448, 448, 448, 704]
    - [35, 16783.0]
  - - [448, 1856, 1, 256, 448, 448, 448, 1856]
    - [33, 22839.0]
  - - [1856, 704, 1, 3328, 1856, 1856, 1856, 704]
    - [37, 31488.0]
  - - [3136, 64, 128, 64, 3136, 3136, 3136, 64]
    - [44, 34382.0]
  - - [3136, 64, 64, 256, 3136, 3136, 3136, 64]
    - [40, 37047.0]
  - - [3136, 64, 256, 256, 3136, 3136, 3136, 64]
    - [29, 21987.0]
  - - [3136, 64, 128, 256, 3136, 3136, 3136, 64]
    - [31, 18920.0]
  - - [3136, 64, 64, 64, 3136, 3136, 3136, 64]
    - [44, 31045.0]
  - - [3136, 64, 256, 64, 3136, 3136, 3136, 64]
    - [29, 18080.0]
  - - [2368, 64, 1, 3328, 2368, 2368, 2368, 64]
    - [51, 11702.0]
  - - [1408, 64, 1, 1280, 1408, 1408, 1408, 64]
    - [57, 8494.0]
  - - [2944, 64, 1, 256, 2944, 2944, 2944, 64]
    - [47, 8867.0]
  - - [1024, 256, 1, 3328, 1024, 1024, 1024, 256]
    - [49, 16713.0]
  - - [1856, 64, 1, 1280, 1856, 1856, 1856, 64]
    - [49, 9912.0]
  - - [704, 128, 1, 1280, 704, 704, 704, 128]
    - [65, 8481.0]
  - - [4288, 64, 1, 3328, 4288, 4288, 4288, 64]
    - [49, 17470.0]
  - - [1856, 128, 1, 256, 1856, 1856, 1856, 128]
    - [71, 10378.0]
  - - [2944, 64, 1, 1280, 2944, 2944, 2944, 64]
    - [47, 13398.0]
  - - [64, 3584, 1, 3328, 64, 64, 64, 3584]
    - [45, 14748.0]
  - - [1024, 256, 1, 256, 1024, 1024, 1024, 256]
    - [73, 11222.0]
  - - [448, 448, 1, 256, 448, 448, 448, 448]
    - [72, 9550.0]
  - - [128, 1024, 1, 3328, 128, 128, 128, 1024]
    - [53, 12322.0]
  - - [64, 1856, 1, 1280, 64, 64, 64, 1856]
    - [49, 9937.0]
  - - [1024, 128, 1, 1280, 1024, 1024, 1024, 128]
    - [59, 10908.0]
  - - [448, 256, 1, 3328, 448, 448, 448, 256]
    - [61, 10806.0]
  - - [128, 704, 1, 1280, 128, 128, 128, 704]
    - [46, 8494.0]
  - - [1856, 128, 1, 3328, 1856, 1856, 1856, 128]
    - [64, 15245.0]
  - - [256, 448, 1, 256, 256, 256, 256, 448]
    - [57, 6168.0]
  - - [256, 1024, 1, 256, 256, 256, 256, 1024]
    - [59, 11260.0]
  - - [448, 448, 1, 3328, 448, 448, 448, 448]
    - [47, 15447.0]
  - - [1408, 128, 1, 1280, 1408, 1408, 1408, 128]
    - [58, 12844.0]
  - - [128, 1856, 1, 1280, 128, 128, 128, 1856]
    - [49, 14384.0]
  - - [64, 1408, 1, 3328, 64, 64, 64, 1408]
    - [65, 9160.0]
  - - [256, 448, 1, 3328, 256, 256, 256, 448]
    - [70, 10806.0]
  - - [64, 2368, 1, 1280, 64, 64, 64, 2368]
    - [66, 10898.0]
  - - [2368, 64, 1, 256, 2368, 2368, 2368, 64]
    - [47, 7185.0]
  - - [4288, 64, 1, 1280, 4288, 4288, 4288, 64]
    - [49, 16507.0]
  - - [128, 1024, 1, 1280, 128, 128, 128, 1024]
    - [49, 11009.0]
  - - [1856, 64, 1, 256, 1856, 1856, 1856, 64]
    - [57, 6362.0]
  - - [704, 128, 1, 256, 704, 704, 704, 128]
    - [57, 5825.0]
  - - [448, 256, 1, 1280, 448, 448, 448, 256]
    - [49, 9620.0]
  - - [1856, 128, 1, 1280, 1856, 1856, 1856, 128]
    - [59, 14344.0]
  - - [64, 3584, 1, 256, 64, 64, 64, 3584]
    - [49, 10021.0]
  - - [64, 1856, 1, 256, 64, 64, 64, 1856]
    - [46, 6415.0]
  - - [256, 1024, 1, 1280, 256, 256, 256, 1024]
    - [68, 15738.0]
  - - [3584, 64, 1, 1280, 3584, 3584, 3584, 64]
    - [56, 13836.0]
  - - [1408, 128, 1, 3328, 1408, 1408, 1408, 128]
    - [51, 13877.0]
  - - [64, 4288, 1, 3328, 64, 64, 64, 4288]
    - [49, 17510.0]
  - - [256, 704, 1, 256, 256, 256, 256, 704]
    - [58, 8450.0]
  - - [128, 1024, 1, 256, 128, 128, 128, 1024]
    - [48, 6658.0]
  - - [64, 2944, 1, 256, 64, 64, 64, 2944]
    - [47, 8834.0]
  - - [64, 1408, 1, 1280, 64, 64, 64, 1408]
    - [46, 8506.0]
  - - [704, 128, 1, 3328, 704, 704, 704, 128]
    - [46, 9171.0]
  - - [1408, 128, 1, 256, 1408, 1408, 1408, 128]
    - [47, 8512.0]
  - - [64, 2944, 1, 1280, 64, 64, 64, 2944]
    - [47, 13413.0]
  - - [704, 256, 1, 1280, 704, 704, 704, 256]
    - [47, 12902.0]
  - - [256, 448, 1, 1280, 256, 256, 256, 448]
    - [59, 9582.0]
  - - [64, 2368, 1, 3328, 64, 64, 64, 2368]
    - [47, 11757.0]
  - - [256, 704, 1, 3328, 256, 256, 256, 704]
    - [47, 13910.0]
  - - [64, 2944, 1, 3328, 64, 64, 64, 2944]
    - [47, 14515.0]
  - - [128, 1408, 1, 256, 128, 128, 128, 1408]
    - [47, 8512.0]
  - - [128, 1408, 1, 3328, 128, 128, 128, 1408]
    - [47, 13929.0]
  - - [1408, 64, 1, 256, 1408, 1408, 1408, 64]
    - [57, 5796.0]
  - - [64, 2368, 1, 256, 64, 64, 64, 2368]
    - [47, 7211.0]
  - - [1024, 128, 1, 3328, 1024, 1024, 1024, 128]
    - [70, 12315.0]
  - - [2368, 64, 1, 1280, 2368, 2368, 2368, 64]
    - [63, 10813.0]
  - - [4288, 64, 1, 256, 4288, 4288, 4288, 64]
    - [49, 11908.0]
  - - [64, 4288, 1, 1280, 64, 64, 64, 4288]
    - [49, 16492.0]
  - - [1408, 64, 1, 3328, 1408, 1408, 1408, 64]
    - [57, 9171.0]
  - - [448, 448, 1, 1280, 448, 448, 448, 448]
    - [47, 14304.0]
  - - [1024, 256, 1, 1280, 1024, 1024, 1024, 256]
    - [49, 15753.0]
  - - [3584, 64, 1, 3328, 3584, 3584, 3584, 64]
    - [64, 14828.0]
  - - [256, 1024, 1, 3328, 256, 256, 256, 1024]
    - [49, 16732.0]
  - - [1856, 64, 1, 3328, 1856, 1856, 1856, 64]
    - [70, 11192.0]
  - - [448, 256, 1, 256, 448, 448, 448, 256]
    - [57, 6220.0]
  - - [128, 704, 1, 256, 128, 128, 128, 704]
    - [57, 5796.0]
  - - [1024, 128, 1, 256, 1024, 1024, 1024, 128]
    - [48, 6605.0]
  - - [64, 3584, 1, 1280, 64, 64, 64, 3584]
    - [54, 13875.0]
  - - [3584, 64, 1, 256, 3584, 3584, 3584, 64]
    - [66, 9787.0]
  - - [64, 1856, 1, 3328, 64, 64, 64, 1856]
    - [53, 11180.0]
  - - [2944, 64, 1, 3328, 2944, 2944, 2944, 64]
    - [47, 14495.0]
  - - [128, 704, 1, 3328, 128, 128, 128, 704]
    - [46, 9171.0]
  - - [128, 1856, 1, 256, 128, 128, 128, 1856]
    - [62, 10522.0]
  - - [64, 4288, 1, 256, 64, 64, 64, 4288]
    - [49, 11867.0]
  - - [704, 256, 1, 3328, 704, 704, 704, 256]
    - [47, 13903.0]
  - - [256, 704, 1, 1280, 256, 256, 256, 704]
    - [58, 12844.0]
  - - [64, 1408, 1, 256, 64, 64, 64, 1408]
    - [57, 5796.0]
  - - [128, 1408, 1, 1280, 128, 128, 128, 1408]
    - [66, 12844.0]
  - - [128, 1856, 1, 3328, 128, 128, 128, 1856]
    - [64, 15281.0]
  - - [704, 256, 1, 256, 704, 704, 704, 256]
    - [62, 8640.0]
  - - [448, 64, 1, 1280, 448, 448, 448, 64]
    - [52, 3361.0]
  - - [64, 1024, 1, 1280, 64, 64, 64, 1024]
    - [52, 7061.0]
  - - [64, 704, 1, 1280, 64, 64, 64, 704]
    - [50, 5015.0]
  - - [64, 64, 1, 1280, 64, 64, 64, 64]
    - [60, 483.0]
  - - [128, 448, 1, 256, 128, 128, 128, 448]
    - [48, 4055.0]
  - - [256, 256, 1, 3328, 256, 256, 256, 256]
    - [60, 7840.0]
  - - [64, 448, 1, 1280, 64, 64, 64, 448]
    - [52, 3355.0]
  - - [64, 64, 1, 3328, 64, 64, 64, 64]
    - [52, 547.0]
  - - [256, 64, 1, 1280, 256, 256, 256, 64]
    - [60, 1928.0]
  - - [128, 448, 1, 1280, 128, 128, 128, 448]
    - [52, 6210.0]
  - - [704, 64, 1, 1280, 704, 704, 704, 64]
    - [50, 5015.0]
  - - [512, 32, 1, 512, 512, 512, 512, 32]
    - [48, 1548.0]
  - - [448, 64, 1, 3328, 448, 448, 448, 64]
    - [52, 3808.0]
  - - [64, 128, 1, 3328, 64, 64, 64, 128]
    - [52, 1094.0]
  - - [128, 128, 1, 3328, 128, 128, 128, 128]
    - [60, 2184.0]
  - - [256, 128, 1, 256, 256, 256, 256, 128]
    - [48, 2356.0]
  - - [64, 448, 1, 3328, 64, 64, 64, 448]
    - [52, 3808.0]
  - - [256, 64, 1, 256, 256, 256, 256, 64]
    - [48, 1178.0]
  - - [256, 128, 1, 1280, 256, 256, 256, 128]
    - [52, 3834.0]
  - - [128, 64, 1, 1280, 128, 128, 128, 64]
    - [69, 964.0]
  - - [64, 1024, 1, 256, 64, 64, 64, 1024]
    - [48, 4584.0]
  - - [64, 704, 1, 256, 64, 64, 64, 704]
    - [48, 3186.0]
  - - [704, 64, 1, 3328, 704, 704, 704, 64]
    - [50, 5587.0]
  - - [512, 16, 1, 512, 512, 512, 512, 16]
    - [57, 746.0]
  - - [448, 128, 1, 256, 448, 448, 448, 128]
    - [48, 4033.0]
  - - [256, 256, 1, 256, 256, 256, 256, 256]
    - [48, 4584.0]
  - - [448, 128, 1, 3328, 448, 448, 448, 128]
    - [52, 6880.0]
  - - [128, 256, 1, 1280, 128, 128, 128, 256]
    - [52, 3827.0]
  - - [64, 256, 1, 1280, 64, 64, 64, 256]
    - [52, 1924.0]
  - - [1024, 32, 1, 512, 1024, 1024, 1024, 32]
    - [55, 3017.0]
  - - [64, 448, 1, 256, 64, 64, 64, 448]
    - [48, 2062.0]
  - - [64, 64, 1, 256, 64, 64, 64, 64]
    - [48, 296.0]
  - - [128, 256, 1, 3328, 128, 128, 128, 256]
    - [52, 4345.0]
  - - [64, 128, 1, 1280, 64, 64, 64, 128]
    - [60, 964.0]
  - - [128, 128, 1, 1280, 128, 128, 128, 128]
    - [52, 1920.0]
  - - [128, 256, 1, 256, 128, 128, 128, 256]
    - [48, 2356.0]
  - - [64, 128, 1, 256, 64, 64, 64, 128]
    - [67, 589.0]
  - - [704, 64, 1, 256, 704, 704, 704, 64]
    - [48, 3186.0]
  - - [128, 64, 1, 3328, 128, 128, 128, 64]
    - [60, 1093.0]
  - - [448, 64, 1, 256, 448, 448, 448, 64]
    - [48, 2050.0]
  - - [1024, 16, 1, 512, 1024, 1024, 1024, 16]
    - [46, 1472.0]
  - - [1024, 64, 1, 256, 1024, 1024, 1024, 64]
    - [48, 4559.0]
  - - [128, 64, 1, 256, 128, 128, 128, 64]
    - [48, 586.0]
  - - [1024, 64, 1, 1280, 1024, 1024, 1024, 64]
    - [52, 7073.0]
  - - [64, 1024, 1, 3328, 64, 64, 64, 1024]
    - [52, 7851.0]
  - - [448, 128, 1, 1280, 448, 448, 448, 128]
    - [52, 6178.0]
  - - [1024, 64, 1, 3328, 1024, 1024, 1024, 64]
    - [52, 7845.0]
  - - [64, 256, 1, 3328, 64, 64, 64, 256]
    - [52, 2183.0]
  - - [256, 256, 1, 1280, 256, 256, 256, 256]
    - [52, 7085.0]
  - - [256, 128, 1, 3328, 256, 256, 256, 128]
    - [60, 4348.0]
  - - [64, 256, 1, 256, 64, 64, 64, 256]
    - [67, 1185.0]
  - - [64, 704, 1, 3328, 64, 64, 64, 704]
    - [50, 5591.0]
  - - [128, 448, 1, 3328, 128, 128, 128, 448]
    - [52, 6875.0]
  - - [256, 64, 1, 3328, 256, 256, 256, 64]
    - [52, 2185.0]
  - - [128, 128, 1, 256, 128, 128, 128, 128]
    - [67, 1185.0]
- null
