library/src/blas3/Tensile/Logic/asm_full/navi21/navi21_Cijk_Ailk_Bljk_HHS_BH.yaml
- {MinimumRequiredVersion: 4.26.0}
- navi21
- gfx1030
- [Device 73a2]
    SolutionIndex: 0
    SolutionNameMin: Cijk_Ailk_Bljk_HHS_BH_MT128x64x8_SN_SU0_SUM0_TT8_8_WG16_8_1_WGM1
    SolutionIndex: 1
    SolutionNameMin: Cijk_Ailk_Bljk_HHS_BH_MT128x128x8_SN_SU0_SUM0_TT8_16_WG16_8_1_WGM1
    SolutionIndex: 2
    SolutionNameMin: Cijk_Ailk_Bljk_HHS_BH_MT128x64x16_SN_SU0_SUM0_TT8_8_WG16_8_1_WGM1
    SolutionIndex: 3
    SolutionNameMin: Cijk_Ailk_Bljk_HHS_BH_MT128x128x16_SN_SU0_SUM0_TT8_16_WG16_8_1_WGM1
    SolutionIndex: 4
    SolutionNameMin: Cijk_Ailk_Bljk_HHS_BH_MT128x128x16_SN_SU0_SUM0_TT8_8_WG16_16_1_WGM1
    SolutionIndex: 5
    SolutionNameMin: Cijk_Ailk_Bljk_HHS_BH_MT128x256x16_SN_SU0_SUM0_TT8_16_WG16_16_1_WGM1
    SolutionIndex: 6
    SolutionNameMin: Cijk_Ailk_Bljk_HHS_BH_MT128x128x32_SN_SU0_SUM0_TT8_16_WG16_8_1_WGM1
    SolutionIndex: 7
    SolutionNameMin: Cijk_Ailk_Bljk_HHS_BH_MT128x64x8_SN_SU32_SUM3_TT8_8_WG16_8_1_WGM1
    SolutionIndex: 8
    SolutionNameMin: Cijk_Ailk_Bljk_HHS_BH_MT128x128x8_SN_SU32_SUM3_TT8_16_WG16_8_1_WGM1
    SolutionIndex: 9
    SolutionNameMin: Cijk_Ailk_Bljk_HHS_BH_MT128x64x16_SN_SU32_SUM3_TT8_8_WG16_8_1_WGM1
    SolutionIndex: 10
    SolutionNameMin: Cijk_Ailk_Bljk_HHS_BH_MT128x128x16_SN_SU32_SUM3_TT8_16_WG16_8_1_WGM1
    SolutionIndex: 11
    SolutionNameMin: Cijk_Ailk_Bljk_HHS_BH_MT128x256x16_SN_SU32_SUM3_TT8_16_WG16_16_1_WGM1
    SolutionIndex: 12
    SolutionNameMin: Cijk_Ailk_Bljk_HHS_BH_MT128x128x32_SN_SU32_SUM3_TT8_16_WG16_8_1_WGM1
    SolutionIndex: 13
    SolutionNameMin: Cijk_Ailk_Bljk_HHS_BH_MT128x128x8_SN_SU0_SUM0_TT8_16_WG16_8_1_WGM4
    SolutionIndex: 14
    SolutionNameMin: Cijk_Ailk_Bljk_HHS_BH_MT128x64x16_SN_SU0_SUM0_TT8_8_WG16_8_1_WGM4
    SolutionIndex: 15
    SolutionNameMin: Cijk_Ailk_Bljk_HHS_BH_MT128x128x16_SN_SU0_SUM0_TT8_16_WG16_8_1_WGM4
    SolutionIndex: 16
    SolutionNameMin: Cijk_Ailk_Bljk_HHS_BH_MT128x128x16_SN_SU0_SUM0_TT8_8_WG16_16_1_WGM4
    SolutionIndex: 17
    SolutionNameMin: Cijk_Ailk_Bljk_HHS_BH_MT128x256x16_SN_SU0_SUM0_TT8_16_WG16_16_1_WGM4
    SolutionIndex: 18
    SolutionNameMin: Cijk_Ailk_Bljk_HHS_BH_MT128x128x8_SN_SU32_SUM3_TT8_16_WG16_8_1_WGM4
    SolutionIndex: 19
    SolutionNameMin: Cijk_Ailk_Bljk_HHS_BH_MT128x64x16_SN_SU32_SUM3_TT8_8_WG16_8_1_WGM4
    SolutionIndex: 20
    SolutionNameMin: Cijk_Ailk_Bljk_HHS_BH_MT128x128x16_SN_SU32_SUM3_TT8_16_WG16_8_1_WGM4
    SolutionIndex: 21
    SolutionNameMin: Cijk_Ailk_Bljk_HHS_BH_MT128x256x16_SN_SU32_SUM3_TT8_16_WG16_16_1_WGM4
    SolutionIndex: 22
    SolutionNameMin: Cijk_Ailk_Bljk_HHS_BH_MT128x64x8_SN_SU0_SUM0_TT8_8_WG16_8_1_WGM8
    SolutionIndex: 23
    SolutionNameMin: Cijk_Ailk_Bljk_HHS_BH_MT128x128x8_SN_SU0_SUM0_TT8_16_WG16_8_1_WGM8
    SolutionIndex: 24
    SolutionNameMin: Cijk_Ailk_Bljk_HHS_BH_MT128x64x16_SN_SU0_SUM0_TT8_8_WG16_8_1_WGM8
    SolutionIndex: 25
    SolutionNameMin: Cijk_Ailk_Bljk_HHS_BH_MT128x128x16_SN_SU0_SUM0_TT8_16_WG16_8_1_WGM8
    SolutionIndex: 26
    SolutionNameMin: Cijk_Ailk_Bljk_HHS_BH_MT128x128x16_SN_SU0_SUM0_TT8_8_WG16_16_1_WGM8
    SolutionIndex: 27
    SolutionNameMin: Cijk_Ailk_Bljk_HHS_BH_MT128x256x16_SN_SU0_SUM0_TT8_16_WG16_16_1_WGM8
    SolutionIndex: 28
    SolutionNameMin: Cijk_Ailk_Bljk_HHS_BH_MT128x64x8_SN_SU32_SUM3_TT8_8_WG16_8_1_WGM8
    SolutionIndex: 29
    SolutionNameMin: Cijk_Ailk_Bljk_HHS_BH_MT128x128x8_SN_SU32_SUM3_TT8_16_WG16_8_1_WGM8
    SolutionIndex: 30
    SolutionNameMin: Cijk_Ailk_Bljk_HHS_BH_MT128x128x16_SN_SU32_SUM3_TT8_16_WG16_8_1_WGM8
    SolutionIndex: 31
    SolutionNameMin: Cijk_Ailk_Bljk_HHS_BH_MT128x128x16_SN_SU32_SUM3_TT8_8_WG16_16_1_WGM8
    SolutionIndex: 32
    SolutionNameMin: Cijk_Ailk_Bljk_HHS_BH_MT128x256x16_SN_SU32_SUM3_TT8_16_WG16_16_1_WGM8
    SolutionIndex: 33
    SolutionNameMin: Cijk_Ailk_Bljk_HHS_BH_MT128x128x8_SN_SU0_SUM0_TT8_16_WG16_8_1_WGM1
    SolutionIndex: 34
    SolutionNameMin: Cijk_Ailk_Bljk_HHS_BH_MT128x64x16_SN_SU0_SUM0_TT8_8_WG16_8_1_WGM1
    SolutionIndex: 35
    SolutionNameMin: Cijk_Ailk_Bljk_HHS_BH_MT128x128x16_SN_SU0_SUM0_TT8_16_WG16_8_1_WGM1
    SolutionIndex: 36
    SolutionNameMin: Cijk_Ailk_Bljk_HHS_BH_MT128x256x16_SN_SU0_SUM0_TT8_16_WG16_16_1_WGM1
    SolutionIndex: 37
    SolutionNameMin: Cijk_Ailk_Bljk_HHS_BH_MT128x128x16_SN_SU32_SUM3_TT8_16_WG16_8_1_WGM1
    SolutionIndex: 38
    SolutionNameMin: Cijk_Ailk_Bljk_HHS_BH_MT128x128x8_SN_SU0_SUM0_TT8_16_WG16_8_1_WGM4
    SolutionIndex: 39
    SolutionNameMin: Cijk_Ailk_Bljk_HHS_BH_MT128x64x16_SN_SU0_SUM0_TT8_8_WG16_8_1_WGM4
    SolutionIndex: 40
    SolutionNameMin: Cijk_Ailk_Bljk_HHS_BH_MT128x256x16_SN_SU0_SUM0_TT8_16_WG16_16_1_WGM4
    SolutionIndex: 41
    SolutionNameMin: Cijk_Ailk_Bljk_HHS_BH_MT128x128x8_SN_SU0_SUM0_TT8_16_WG16_8_1_WGM8
    SolutionIndex: 42
    SolutionNameMin: Cijk_Ailk_Bljk_HHS_BH_MT128x256x16_SN_SU0_SUM0_TT8_16_WG16_16_1_WGM8
    SolutionIndex: 43
    SolutionNameMin: Cijk_Ailk_Bljk_HHS_BH_MT128x128x8_SN_SU32_SUM3_TT8_16_WG16_8_1_WGM8
    SolutionIndex: 44
    SolutionNameMin: Cijk_Ailk_Bljk_HHS_BH_MT64x64x8_SN_SU0_SUM0_TT8_8_WG8_8_1_WGM1
    SolutionIndex: 45
    SolutionNameMin: Cijk_Ailk_Bljk_HHS_BH_MT128x64x8_SN_SU0_SUM0_TT8_8_WG16_8_1_WGM1
    SolutionIndex: 46
    SolutionNameMin: Cijk_Ailk_Bljk_HHS_BH_MT64x64x16_SN_SU0_SUM0_TT8_8_WG8_8_1_WGM1
    SolutionIndex: 47
    SolutionNameMin: Cijk_Ailk_Bljk_HHS_BH_MT128x64x16_SN_SU0_SUM0_TT8_8_WG16_8_1_WGM1
    SolutionIndex: 48
    SolutionNameMin: Cijk_Ailk_Bljk_HHS_BH_MT128x128x16_SN_SU0_SUM0_TT8_8_WG16_16_1_WGM1
    SolutionIndex: 49
    SolutionNameMin: Cijk_Ailk_Bljk_HHS_BH_MT128x64x32_SN_SU0_SUM0_TT8_8_WG16_8_1_WGM1
    SolutionIndex: 50
    SolutionNameMin: Cijk_Ailk_Bljk_HHS_BH_MT64x64x8_SN_SU32_SUM3_TT8_8_WG8_8_1_WGM1
    SolutionIndex: 51
    SolutionNameMin: Cijk_Ailk_Bljk_HHS_BH_MT128x64x8_SN_SU32_SUM3_TT8_8_WG16_8_1_WGM1
    SolutionIndex: 52
    SolutionNameMin: Cijk_Ailk_Bljk_HHS_BH_MT64x64x16_SN_SU32_SUM3_TT8_8_WG8_8_1_WGM1
    SolutionIndex: 53
    SolutionNameMin: Cijk_Ailk_Bljk_HHS_BH_MT128x64x16_SN_SU32_SUM3_TT8_8_WG16_8_1_WGM1
    SolutionIndex: 54
    SolutionNameMin: Cijk_Ailk_Bljk_HHS_BH_MT128x128x16_SN_SU32_SUM3_TT8_8_WG16_16_1_WGM1
    SolutionIndex: 55
    SolutionNameMin: Cijk_Ailk_Bljk_HHS_BH_MT64x64x32_SN_SU32_SUM3_TT8_8_WG8_8_1_WGM1
    SolutionIndex: 56
    SolutionNameMin: Cijk_Ailk_Bljk_HHS_BH_MT128x64x8_SN_SU0_SUM0_TT8_8_WG16_8_1_WGM4
    SolutionIndex: 57
    SolutionNameMin: Cijk_Ailk_Bljk_HHS_BH_MT64x64x16_SN_SU0_SUM0_TT8_8_WG8_8_1_WGM4
    SolutionIndex: 58
    SolutionNameMin: Cijk_Ailk_Bljk_HHS_BH_MT128x64x16_SN_SU0_SUM0_TT8_8_WG16_8_1_WGM4
    SolutionIndex: 59
    SolutionNameMin: Cijk_Ailk_Bljk_HHS_BH_MT128x128x16_SN_SU0_SUM0_TT8_8_WG16_16_1_WGM4
    SolutionIndex: 60
    SolutionNameMin: Cijk_Ailk_Bljk_HHS_BH_MT64x64x32_SN_SU0_SUM0_TT8_8_WG8_8_1_WGM4
    SolutionIndex: 61
    SolutionNameMin: Cijk_Ailk_Bljk_HHS_BH_MT128x64x8_SN_SU32_SUM3_TT8_8_WG16_8_1_WGM4
    SolutionIndex: 62
    SolutionNameMin: Cijk_Ailk_Bljk_HHS_BH_MT64x64x16_SN_SU32_SUM3_TT8_8_WG8_8_1_WGM4
    SolutionIndex: 63
    SolutionNameMin: Cijk_Ailk_Bljk_HHS_BH_MT128x64x16_SN_SU32_SUM3_TT8_8_WG16_8_1_WGM4
    SolutionIndex: 64
    SolutionNameMin: Cijk_Ailk_Bljk_HHS_BH_MT128x128x16_SN_SU32_SUM3_TT8_8_WG16_16_1_WGM4
    SolutionIndex: 65
    SolutionNameMin: Cijk_Ailk_Bljk_HHS_BH_MT64x64x32_SN_SU32_SUM3_TT8_8_WG8_8_1_WGM4
    SolutionIndex: 66
    SolutionNameMin: Cijk_Ailk_Bljk_HHS_BH_MT64x64x8_SN_SU0_SUM0_TT8_8_WG8_8_1_WGM8
    SolutionIndex: 67
    SolutionNameMin: Cijk_Ailk_Bljk_HHS_BH_MT128x64x8_SN_SU0_SUM0_TT8_8_WG16_8_1_WGM8
    SolutionIndex: 68
    SolutionNameMin: Cijk_Ailk_Bljk_HHS_BH_MT64x64x16_SN_SU0_SUM0_TT8_8_WG8_8_1_WGM8
    SolutionIndex: 69
    SolutionNameMin: Cijk_Ailk_Bljk_HHS_BH_MT128x64x16_SN_SU0_SUM0_TT8_8_WG16_8_1_WGM8
    SolutionIndex: 70
    SolutionNameMin: Cijk_Ailk_Bljk_HHS_BH_MT128x128x16_SN_SU0_SUM0_TT8_8_WG16_16_1_WGM8
    SolutionIndex: 71
    SolutionNameMin: Cijk_Ailk_Bljk_HHS_BH_MT64x64x32_SN_SU0_SUM0_TT8_8_WG8_8_1_WGM8
    SolutionIndex: 72
    SolutionNameMin: Cijk_Ailk_Bljk_HHS_BH_MT128x64x32_SN_SU0_SUM0_TT8_8_WG16_8_1_WGM8
    SolutionIndex: 73
    SolutionNameMin: Cijk_Ailk_Bljk_HHS_BH_MT64x64x8_SN_SU32_SUM3_TT8_8_WG8_8_1_WGM8
    SolutionIndex: 74
    SolutionNameMin: Cijk_Ailk_Bljk_HHS_BH_MT128x64x8_SN_SU32_SUM3_TT8_8_WG16_8_1_WGM8
    SolutionIndex: 75
    SolutionNameMin: Cijk_Ailk_Bljk_HHS_BH_MT64x64x16_SN_SU32_SUM3_TT8_8_WG8_8_1_WGM8
    SolutionIndex: 76
    SolutionNameMin: Cijk_Ailk_Bljk_HHS_BH_MT128x64x16_SN_SU32_SUM3_TT8_8_WG16_8_1_WGM8
    SolutionIndex: 77
    SolutionNameMin: Cijk_Ailk_Bljk_HHS_BH_MT128x128x16_SN_SU32_SUM3_TT8_8_WG16_16_1_WGM8
    SolutionIndex: 78
    SolutionNameMin: Cijk_Ailk_Bljk_HHS_BH_MT64x64x32_SN_SU32_SUM3_TT8_8_WG8_8_1_WGM8
    SolutionIndex: 79
    SolutionNameMin: Cijk_Ailk_Bljk_HHS_BH_MT128x64x16_SN_SU0_SUM0_TT8_8_WG16_8_1_WGM1
    SolutionIndex: 80
    SolutionNameMin: Cijk_Ailk_Bljk_HHS_BH_MT128x128x16_SN_SU0_SUM0_TT8_8_WG16_16_1_WGM1
    SolutionIndex: 81
    SolutionNameMin: Cijk_Ailk_Bljk_HHS_BH_MT128x64x16_SN_SU32_SUM3_TT8_8_WG16_8_1_WGM1
    SolutionIndex: 82
    SolutionNameMin: Cijk_Ailk_Bljk_HHS_BH_MT16x16x8_SN_SU0_SUM0_TT2_2_WG8_8_1_WGM1
    SolutionIndex: 83
    SolutionNameMin: Cijk_Ailk_Bljk_HHS_BH_MT32x16x8_SN_SU0_SUM0_TT2_2_WG16_8_1_WGM1
    SolutionIndex: 84
    SolutionNameMin: Cijk_Ailk_Bljk_HHS_BH_MT64x32x8_SN_SU0_SUM0_TT4_4_WG16_8_1_WGM1
    SolutionIndex: 85
    SolutionNameMin: Cijk_Ailk_Bljk_HHS_BH_MT32x32x8_SN_SU0_SUM0_TT2_2_WG16_16_1_WGM1
    SolutionIndex: 86
    SolutionNameMin: Cijk_Ailk_Bljk_HHS_BH_MT64x64x8_SN_SU0_SUM0_TT4_4_WG16_16_1_WGM1
    SolutionIndex: 87
    SolutionNameMin: Cijk_Ailk_Bljk_HHS_BH_MT16x16x16_SN_SU0_SUM0_TT2_2_WG8_8_1_WGM1
    SolutionIndex: 88
    SolutionNameMin: Cijk_Ailk_Bljk_HHS_BH_MT32x16x16_SN_SU0_SUM0_TT2_2_WG16_8_1_WGM1
    SolutionIndex: 89
    SolutionNameMin: Cijk_Ailk_Bljk_HHS_BH_MT64x32x16_SN_SU0_SUM0_TT4_4_WG16_8_1_WGM1
    SolutionIndex: 90
    SolutionNameMin: Cijk_Ailk_Bljk_HHS_BH_MT32x32x16_SN_SU0_SUM0_TT2_2_WG16_16_1_WGM1
    SolutionIndex: 91
    SolutionNameMin: Cijk_Ailk_Bljk_HHS_BH_MT16x16x32_SN_SU0_SUM0_TT2_2_WG8_8_1_WGM1
    SolutionIndex: 92
    SolutionNameMin: Cijk_Ailk_Bljk_HHS_BH_MT32x16x32_SN_SU0_SUM0_TT2_2_WG16_8_1_WGM1
    SolutionIndex: 93
    SolutionNameMin: Cijk_Ailk_Bljk_HHS_BH_MT64x32x32_SN_SU0_SUM0_TT4_4_WG16_8_1_WGM1
    SolutionIndex: 94
    SolutionNameMin: Cijk_Ailk_Bljk_HHS_BH_MT32x32x8_SN_SU32_SUM3_TT4_4_WG8_8_1_WGM1
    SolutionIndex: 95
    SolutionNameMin: Cijk_Ailk_Bljk_HHS_BH_MT32x16x8_SN_SU32_SUM3_TT2_2_WG16_8_1_WGM1
    SolutionIndex: 96
    SolutionNameMin: Cijk_Ailk_Bljk_HHS_BH_MT64x32x8_SN_SU32_SUM3_TT4_4_WG16_8_1_WGM1
    SolutionIndex: 97
    SolutionNameMin: Cijk_Ailk_Bljk_HHS_BH_MT64x64x8_SN_SU32_SUM3_TT4_4_WG16_16_1_WGM1
    SolutionIndex: 98
    SolutionNameMin: Cijk_Ailk_Bljk_HHS_BH_MT16x16x16_SN_SU32_SUM3_TT2_2_WG8_8_1_WGM1
    SolutionIndex: 99
    SolutionNameMin: Cijk_Ailk_Bljk_HHS_BH_MT32x32x16_SN_SU32_SUM3_TT4_4_WG8_8_1_WGM1
    SolutionIndex: 100
    SolutionNameMin: Cijk_Ailk_Bljk_HHS_BH_MT32x16x16_SN_SU32_SUM3_TT2_2_WG16_8_1_WGM1
    SolutionIndex: 101
    SolutionNameMin: Cijk_Ailk_Bljk_HHS_BH_MT64x32x16_SN_SU32_SUM3_TT4_4_WG16_8_1_WGM1
    SolutionIndex: 102
    SolutionNameMin: Cijk_Ailk_Bljk_HHS_BH_MT32x16x32_SN_SU32_SUM3_TT2_2_WG16_8_1_WGM1
    SolutionIndex: 103
    SolutionNameMin: Cijk_Ailk_Bljk_HHS_BH_MT64x32x8_SN_SU0_SUM0_TT4_4_WG16_8_1_WGM4
    SolutionIndex: 104
    SolutionNameMin: Cijk_Ailk_Bljk_HHS_BH_MT32x32x8_SN_SU0_SUM0_TT2_2_WG16_16_1_WGM4
    SolutionIndex: 105
    SolutionNameMin: Cijk_Ailk_Bljk_HHS_BH_MT32x16x16_SN_SU0_SUM0_TT2_2_WG16_8_1_WGM4
    SolutionIndex: 106
    SolutionNameMin: Cijk_Ailk_Bljk_HHS_BH_MT64x32x16_SN_SU0_SUM0_TT4_4_WG16_8_1_WGM4
    SolutionIndex: 107
    SolutionNameMin: Cijk_Ailk_Bljk_HHS_BH_MT32x16x32_SN_SU0_SUM0_TT2_2_WG16_8_1_WGM4
    SolutionIndex: 108
    SolutionNameMin: Cijk_Ailk_Bljk_HHS_BH_MT64x32x8_SN_SU32_SUM3_TT4_4_WG16_8_1_WGM4
    SolutionIndex: 109
    SolutionNameMin: Cijk_Ailk_Bljk_HHS_BH_MT32x32x8_SN_SU32_SUM3_TT2_2_WG16_16_1_WGM4
    SolutionIndex: 110
    SolutionNameMin: Cijk_Ailk_Bljk_HHS_BH_MT16x16x16_SN_SU32_SUM3_TT2_2_WG8_8_1_WGM4
    SolutionIndex: 111
    SolutionNameMin: Cijk_Ailk_Bljk_HHS_BH_MT32x16x16_SN_SU32_SUM3_TT2_2_WG16_8_1_WGM4
    SolutionIndex: 112
    SolutionNameMin: Cijk_Ailk_Bljk_HHS_BH_MT64x32x16_SN_SU32_SUM3_TT4_4_WG16_8_1_WGM4
    SolutionIndex: 113
    SolutionNameMin: Cijk_Ailk_Bljk_HHS_BH_MT32x16x32_SN_SU32_SUM3_TT2_2_WG16_8_1_WGM4
    SolutionIndex: 114
    SolutionNameMin: Cijk_Ailk_Bljk_HHS_BH_MT32x32x8_SN_SU0_SUM0_TT4_4_WG8_8_1_WGM8
    SolutionIndex: 115
    SolutionNameMin: Cijk_Ailk_Bljk_HHS_BH_MT64x32x8_SN_SU0_SUM0_TT4_4_WG16_8_1_WGM8
    SolutionIndex: 116
    SolutionNameMin: Cijk_Ailk_Bljk_HHS_BH_MT32x32x8_SN_SU0_SUM0_TT2_2_WG16_16_1_WGM8
    SolutionIndex: 117
    SolutionNameMin: Cijk_Ailk_Bljk_HHS_BH_MT16x16x16_SN_SU0_SUM0_TT2_2_WG8_8_1_WGM8
    SolutionIndex: 118
    SolutionNameMin: Cijk_Ailk_Bljk_HHS_BH_MT32x16x16_SN_SU0_SUM0_TT2_2_WG16_8_1_WGM8
    SolutionIndex: 119
    SolutionNameMin: Cijk_Ailk_Bljk_HHS_BH_MT64x32x16_SN_SU0_SUM0_TT4_4_WG16_8_1_WGM8
    SolutionIndex: 120
    SolutionNameMin: Cijk_Ailk_Bljk_HHS_BH_MT32x32x16_SN_SU0_SUM0_TT2_2_WG16_16_1_WGM8
    SolutionIndex: 121
    SolutionNameMin: Cijk_Ailk_Bljk_HHS_BH_MT32x16x32_SN_SU0_SUM0_TT2_2_WG16_8_1_WGM8
    SolutionIndex: 122
    SolutionNameMin: Cijk_Ailk_Bljk_HHS_BH_MT64x32x8_SN_SU32_SUM3_TT4_4_WG16_8_1_WGM8
    SolutionIndex: 123
    SolutionNameMin: Cijk_Ailk_Bljk_HHS_BH_MT32x32x8_SN_SU32_SUM3_TT2_2_WG16_16_1_WGM8
    SolutionIndex: 124
    SolutionNameMin: Cijk_Ailk_Bljk_HHS_BH_MT16x16x16_SN_SU32_SUM3_TT2_2_WG8_8_1_WGM8
    SolutionIndex: 125
    SolutionNameMin: Cijk_Ailk_Bljk_HHS_BH_MT32x16x16_SN_SU32_SUM3_TT2_2_WG16_8_1_WGM8
    SolutionIndex: 126
    SolutionNameMin: Cijk_Ailk_Bljk_HHS_BH_MT64x32x16_SN_SU32_SUM3_TT4_4_WG16_8_1_WGM8
    SolutionIndex: 127
    SolutionNameMin: Cijk_Ailk_Bljk_HHS_BH_MT32x16x32_SN_SU32_SUM3_TT2_2_WG16_8_1_WGM8
    SolutionIndex: 128
    SolutionNameMin: Cijk_Ailk_Bljk_HHS_BH_MT32x8x8_SN_SU0_SUM0_TT2_2_WG16_4_1_WGM1
    SolutionIndex: 129
    SolutionNameMin: Cijk_Ailk_Bljk_HHS_BH_MT64x8x8_SN_SU0_SUM0_TT4_2_WG16_4_1_WGM1
    SolutionIndex: 130
    SolutionNameMin: Cijk_Ailk_Bljk_HHS_BH_MT32x8x16_SN_SU0_SUM0_TT2_2_WG16_4_1_WGM1
    SolutionIndex: 131
    SolutionNameMin: Cijk_Ailk_Bljk_HHS_BH_MT64x16x16_SN_SU0_SUM0_TT4_2_WG16_8_1_WGM1
    SolutionIndex: 132
    SolutionNameMin: Cijk_Ailk_Bljk_HHS_BH_MT64x8x16_SN_SU0_SUM0_TT2_2_WG32_4_1_WGM1
    SolutionIndex: 133
    SolutionNameMin: Cijk_Ailk_Bljk_HHS_BH_MT128x8x16_SN_SU0_SUM0_TT4_2_WG32_4_1_WGM1
    SolutionIndex: 134
    SolutionNameMin: Cijk_Ailk_Bljk_HHS_BH_MT32x8x32_SN_SU0_SUM0_TT2_2_WG16_4_1_WGM1
    SolutionIndex: 135
    SolutionNameMin: Cijk_Ailk_Bljk_HHS_BH_MT64x8x32_SN_SU0_SUM0_TT4_2_WG16_4_1_WGM1
    SolutionIndex: 136
    SolutionNameMin: Cijk_Ailk_Bljk_HHS_BH_MT64x16x32_SN_SU0_SUM0_TT4_2_WG16_8_1_WGM1
    SolutionIndex: 137
    SolutionNameMin: Cijk_Ailk_Bljk_HHS_BH_MT64x8x32_SN_SU0_SUM0_TT2_2_WG32_4_1_WGM1
    SolutionIndex: 138
    SolutionNameMin: Cijk_Ailk_Bljk_HHS_BH_MT128x8x32_SN_SU0_SUM0_TT4_2_WG32_4_1_WGM1
    SolutionIndex: 139
    SolutionNameMin: Cijk_Ailk_Bljk_HHS_BH_MT64x8x8_SN_SU32_SUM3_TT4_2_WG16_4_1_WGM1
    SolutionIndex: 140
    SolutionNameMin: Cijk_Ailk_Bljk_HHS_BH_MT64x8x16_SN_SU32_SUM3_TT4_2_WG16_4_1_WGM1
    SolutionIndex: 141
    SolutionNameMin: Cijk_Ailk_Bljk_HHS_BH_MT64x16x16_SN_SU32_SUM3_TT4_2_WG16_8_1_WGM1
    SolutionIndex: 142
    SolutionNameMin: Cijk_Ailk_Bljk_HHS_BH_MT128x8x16_SN_SU32_SUM3_TT4_2_WG32_4_1_WGM1
    SolutionIndex: 143
    SolutionNameMin: Cijk_Ailk_Bljk_HHS_BH_MT64x8x32_SN_SU32_SUM3_TT2_2_WG32_4_1_WGM1
    SolutionIndex: 144
    SolutionNameMin: Cijk_Ailk_Bljk_HHS_BH_MT64x8x16_SN_SU0_SUM0_TT2_2_WG32_4_1_WGM4
    SolutionIndex: 145
    SolutionNameMin: Cijk_Ailk_Bljk_HHS_BH_MT128x8x16_SN_SU0_SUM0_TT4_2_WG32_4_1_WGM4
    SolutionIndex: 146
    SolutionNameMin: Cijk_Ailk_Bljk_HHS_BH_MT64x8x32_SN_SU0_SUM0_TT4_2_WG16_4_1_WGM4
    SolutionIndex: 147
    SolutionNameMin: Cijk_Ailk_Bljk_HHS_BH_MT64x8x32_SN_SU0_SUM0_TT2_2_WG32_4_1_WGM4
    SolutionIndex: 148
    SolutionNameMin: Cijk_Ailk_Bljk_HHS_BH_MT64x8x16_SN_SU32_SUM3_TT4_2_WG16_4_1_WGM4
    SolutionIndex: 149
    SolutionNameMin: Cijk_Ailk_Bljk_HHS_BH_MT64x8x8_SN_SU0_SUM0_TT4_2_WG16_4_1_WGM8
    SolutionIndex: 150
    SolutionNameMin: Cijk_Ailk_Bljk_HHS_BH_MT32x8x16_SN_SU0_SUM0_TT2_2_WG16_4_1_WGM8
    SolutionIndex: 151
    SolutionNameMin: Cijk_Ailk_Bljk_HHS_BH_MT64x8x32_SN_SU0_SUM0_TT4_2_WG16_4_1_WGM8
    SolutionIndex: 152
    SolutionNameMin: Cijk_Ailk_Bljk_HHS_BH_MT64x16x32_SN_SU0_SUM0_TT4_2_WG16_8_1_WGM8
    SolutionIndex: 153
    SolutionNameMin: Cijk_Ailk_Bljk_HHS_BH_MT64x8x32_SN_SU0_SUM0_TT2_2_WG32_4_1_WGM8
    SolutionIndex: 154
    SolutionNameMin: Cijk_Ailk_Bljk_HHS_BH_MT32x16x32_SN_SU32_SUM3_TT2_2_WG16_8_1_WGM1
    SolutionIndex: 155
    SolutionNameMin: Cijk_Ailk_Bljk_HHS_BH_MT32x16x32_SN_SU0_SUM0_TT2_2_WG16_8_1_WGM4
    SolutionIndex: 156
    SolutionNameMin: Cijk_Ailk_Bljk_HHS_BH_MT32x16x32_SN_SU32_SUM3_TT2_2_WG16_8_1_WGM4
    SolutionIndex: 157
    SolutionNameMin: Cijk_Ailk_Bljk_HHS_BH_MT32x16x32_SN_SU0_SUM0_TT2_2_WG16_8_1_WGM8
    SolutionIndex: 158
    SolutionNameMin: Cijk_Ailk_Bljk_HHS_BH_MT64x32x16_SN_SU32_SUM3_TT4_4_WG16_8_1_WGM8
    SolutionIndex: 159
    SolutionNameMin: Cijk_Ailk_Bljk_HHS_BH_MT32x16x32_SN_SU32_SUM3_TT2_2_WG16_8_1_WGM8
    SolutionIndex: 160
    SolutionNameMin: Cijk_Ailk_Bljk_HHS_BH_MT64x32x16_SN_SU0_SUM0_SUS0_TT4_8_WG16_4_1_WGM8
    SolutionIndex: 161
    SolutionNameMin: Cijk_Ailk_Bljk_HHS_BH_MT64x32x16_SN_SU32_SUM3_SUS128_TT4_8_WG16_4_1_WGM4
    SolutionIndex: 162
    SolutionNameMin: Cijk_Ailk_Bljk_HHS_BH_MT64x32x8_SN_SU0_SUM0_SUS0_TT4_8_WG16_4_1_WGM1
    SolutionIndex: 163
    SolutionNameMin: Cijk_Ailk_Bljk_HHS_BH_MT64x32x8_SN_SU0_SUM0_SUS0_TT4_8_WG16_4_1_WGM8
    SolutionIndex: 164
    SolutionNameMin: Cijk_Ailk_Bljk_HHS_BH_MT64x128x16_SN_SU32_SUM3_SUS128_TT8_16_WG8_8_1_WGM4
    SolutionIndex: 165
    SolutionNameMin: Cijk_Ailk_Bljk_HHS_BH_MT64x32x8_SN_SU0_SUM0_SUS0_TT4_8_WG16_4_1_WGM4
    SolutionIndex: 166
    SolutionNameMin: Cijk_Ailk_Bljk_HHS_BH_MT64x64x16_SN_SU0_SUM0_SUS0_TT8_8_WG8_8_1_WGM4
    SolutionIndex: 167
    SolutionNameMin: Cijk_Ailk_Bljk_HHS_BH_MT64x64x32_SN_SU32_SUM3_SUS128_TT8_8_WG8_8_1_WGM4
    SolutionIndex: 168
    SolutionNameMin: Cijk_Ailk_Bljk_HHS_BH_MT64x32x16_SN_SU32_SUM3_SUS128_TT4_8_WG16_4_1_WGM4
    SolutionIndex: 169
    SolutionNameMin: Cijk_Ailk_Bljk_HHS_BH_MT64x32x16_SN_SU32_SUM3_SUS128_TT4_8_WG16_4_1_WGM8
    SolutionIndex: 170
    SolutionNameMin: Cijk_Ailk_Bljk_HHS_BH_MT64x64x32_SN_SU32_SUM3_SUS128_TT8_8_WG8_8_1_WGM1
    SolutionIndex: 171
    SolutionNameMin: Cijk_Ailk_Bljk_HHS_BH_MT64x32x32_SN_SU32_SUM3_SUS128_TT4_8_WG16_4_1_WGM1
    SolutionIndex: 172
    SolutionNameMin: Cijk_Ailk_Bljk_HHS_BH_MT64x32x32_SN_SU32_SUM3_SUS128_TT4_8_WG16_4_1_WGM4
    SolutionIndex: 173
    SolutionNameMin: Cijk_Ailk_Bljk_HHS_BH_MT64x64x16_SN_SU0_SUM0_SUS0_TT8_8_WG8_8_1_WGM4
    SolutionIndex: 174
    SolutionNameMin: Cijk_Ailk_Bljk_HHS_BH_MT64x64x16_SN_SU0_SUM0_SUS0_TT8_8_WG8_8_1_WGM8
    SolutionIndex: 175
    SolutionNameMin: Cijk_Ailk_Bljk_HHS_BH_MT64x64x16_SN_SU0_SUM0_SUS0_TT8_8_WG8_8_1_WGM4
    SolutionIndex: 176
    SolutionNameMin: Cijk_Ailk_Bljk_HHS_BH_MT64x32x16_SN_SU0_SUM0_SUS0_TT4_8_WG16_4_1_WGM8
    SolutionIndex: 177
    SolutionNameMin: Cijk_Ailk_Bljk_HHS_BH_MT64x64x32_SN_SU0_SUM0_SUS0_TT8_8_WG8_8_1_WGM8
    SolutionIndex: 178
    SolutionNameMin: Cijk_Ailk_Bljk_HHS_BH_MT64x64x32_SN_SU0_SUM0_SUS0_TT8_8_WG8_8_1_WGM4
    SolutionIndex: 179
    SolutionNameMin: Cijk_Ailk_Bljk_HHS_BH_MT64x64x32_SN_SU0_SUM0_SUS0_TT8_8_WG8_8_1_WGM1
    SolutionIndex: 180
    SolutionNameMin: Cijk_Ailk_Bljk_HHS_BH_MT64x64x32_SN_SU32_SUM3_SUS128_TT8_8_WG8_8_1_WGM8
    SolutionIndex: 181
    SolutionNameMin: Cijk_Ailk_Bljk_HHS_BH_MT64x64x32_SN_SU32_SUM3_SUS128_TT8_8_WG8_8_1_WGM1
    SolutionIndex: 182
    SolutionNameMin: Cijk_Ailk_Bljk_HHS_BH_MT64x64x32_SN_SU32_SUM3_SUS128_TT8_8_WG8_8_1_WGM4
    SolutionIndex: 183
    SolutionNameMin: Cijk_Ailk_Bljk_HHS_BH_MT16x16x8_SN_SU0_SUM0_SUS0_TT2_2_WG8_8_1_WGM1
    SolutionIndex: 184
    SolutionNameMin: Cijk_Ailk_Bljk_HHS_BH_MT64x8x16_SN_SU0_SUM0_SUS0_TT2_2_WG32_4_1_WGM4
    SolutionIndex: 185
    SolutionNameMin: Cijk_Ailk_Bljk_HHS_BH_MT64x8x16_SN_SU0_SUM0_SUS0_TT2_2_WG32_4_1_WGM8
    SolutionIndex: 186
    SolutionNameMin: Cijk_Ailk_Bljk_HHS_BH_MT32x32x8_SN_SU0_SUM0_SUS0_TT2_2_WG16_16_1_WGM1
    SolutionIndex: 187
    SolutionNameMin: Cijk_Ailk_Bljk_HHS_BH_MT32x8x8_SN_SU32_SUM3_SUS128_TT2_2_WG16_4_1_WGM1
    SolutionIndex: 188
    SolutionNameMin: Cijk_Ailk_Bljk_HHS_BH_MT64x16x8_SN_SU0_SUM0_SUS0_TT4_4_WG16_4_1_WGM8
    SolutionIndex: 189
    SolutionNameMin: Cijk_Ailk_Bljk_HHS_BH_MT64x32x8_SN_SU0_SUM0_SUS0_TT4_4_WG16_8_1_WGM8
    SolutionIndex: 190
    SolutionNameMin: Cijk_Ailk_Bljk_HHS_BH_MT64x16x8_SN_SU0_SUM0_SUS0_TT4_4_WG16_4_1_WGM1
    SolutionIndex: 191
    SolutionNameMin: Cijk_Ailk_Bljk_HHS_BH_MT64x32x8_SN_SU0_SUM0_SUS0_TT4_4_WG16_8_1_WGM8
    SolutionIndex: 192
    SolutionNameMin: Cijk_Ailk_Bljk_HHS_BH_MT128x16x8_SN_SU0_SUM0_SUS0_TT4_4_WG32_4_1_WGM1
    SolutionIndex: 193
    SolutionNameMin: Cijk_Ailk_Bljk_HHS_BH_MT128x16x8_SN_SU32_SUM3_SUS128_TT4_4_WG32_4_1_WGM8
    SolutionIndex: 194
    SolutionNameMin: Cijk_Ailk_Bljk_HHS_BH_MT128x32x8_SN_SU32_SUM3_SUS128_TT4_8_WG32_4_1_WGM8
    SolutionIndex: 195
    SolutionNameMin: Cijk_Ailk_Bljk_HHS_BH_MT64x64x8_SN_SU0_SUM0_SUS0_TT4_4_WG16_16_1_WGM4
    SolutionIndex: 196
    SolutionNameMin: Cijk_Ailk_Bljk_HHS_BH_MT128x16x8_SN_SU0_SUM0_SUS0_TT4_4_WG32_4_1_WGM1
    SolutionIndex: 197
    SolutionNameMin: Cijk_Ailk_Bljk_HHS_BH_MT128x128x32_SN_SU0_SUM0_SUS0_TT8_8_WG16_16_1_WGM8
    SolutionIndex: 198
    SolutionNameMin: Cijk_Ailk_Bljk_HHS_BH_MT128x16x8_SN_SU32_SUM3_SUS128_TT4_4_WG32_4_1_WGM8
    SolutionIndex: 199
    SolutionNameMin: Cijk_Ailk_Bljk_HHS_BH_MT32x16x32_SN_SU32_SUM3_SUS128_TT2_2_WG16_8_1_WGM4
    SolutionIndex: 200
    SolutionNameMin: Cijk_Ailk_Bljk_HHS_BH_MT64x8x32_SN_SU32_SUM3_SUS128_TT2_2_WG32_4_1_WGM1
    SolutionIndex: 201
    SolutionNameMin: Cijk_Ailk_Bljk_HHS_BH_MT64x32x16_SN_SU32_SUM3_SUS128_TT4_4_WG16_8_1_WGM8
    SolutionIndex: 202
    SolutionNameMin: Cijk_Ailk_Bljk_HHS_BH_MT128x16x32_SN_SU32_SUM3_SUS128_TT4_4_WG32_4_1_WGM1
    SolutionIndex: 203
    SolutionNameMin: Cijk_Ailk_Bljk_HHS_BH_MT64x32x16_SN_SU0_SUM0_SUS0_TT4_8_WG16_4_1_WGM4
    SolutionIndex: 204
    SolutionNameMin: Cijk_Ailk_Bljk_HHS_BH_MT128x128x16_SN_SU0_SUM0_SUS0_TT8_8_WG16_16_1_WGM4
    SolutionIndex: 205
    SolutionNameMin: Cijk_Ailk_Bljk_HHS_BH_MT128x128x16_SN_SU0_SUM0_SUS0_TT8_8_WG16_16_1_WGM8
    SolutionIndex: 206
    SolutionNameMin: Cijk_Ailk_Bljk_HHS_BH_MT128x64x16_SN_SU32_SUM3_SUS128_TT8_8_WG16_8_1_WGM1
    SolutionIndex: 207
    SolutionNameMin: Cijk_Ailk_Bljk_HHS_BH_MT128x256x16_SN_SU0_SUM0_SUS0_TT8_16_WG16_16_1_WGM4
    SolutionIndex: 208
    SolutionNameMin: Cijk_Ailk_Bljk_HHS_BH_MT128x256x16_SN_SU0_SUM0_SUS0_TT8_16_WG16_16_1_WGM1
    SolutionIndex: 209
    SolutionNameMin: Cijk_Ailk_Bljk_HHS_BH_MT128x128x16_SN_SU0_SUM0_SUS0_TT8_16_WG16_8_1_WGM1
    SolutionIndex: 210
    SolutionNameMin: Cijk_Ailk_Bljk_HHS_BH_MT128x256x16_SN_SU0_SUM0_SUS0_TT8_16_WG16_16_1_WGM4
    SolutionIndex: 211
    SolutionNameMin: Cijk_Ailk_Bljk_HHS_BH_MT32x16x32_SN_SU32_SUM3_SUS128_TT2_2_WG16_8_1_WGM1
    SolutionIndex: 212
    SolutionNameMin: Cijk_Ailk_Bljk_HHS_BH_MT32x16x32_SN_SU0_SUM0_SUS0_TT2_2_WG16_8_1_WGM1
    SolutionIndex: 213
    SolutionNameMin: Cijk_Ailk_Bljk_HHS_BH_MT64x8x32_SN_SU0_SUM0_SUS0_TT2_2_WG32_4_1_WGM1
    SolutionIndex: 214
    SolutionNameMin: Cijk_Ailk_Bljk_HHS_BH_MT64x16x32_SN_SU0_SUM0_SUS0_TT4_4_WG16_4_1_WGM1
    SolutionIndex: 215
    SolutionNameMin: Cijk_Ailk_Bljk_HHS_BH_MT64x32x16_SN_SU0_SUM0_SUS0_TT4_4_WG16_8_1_WGM1
    SolutionIndex: 216
    SolutionNameMin: Cijk_Ailk_Bljk_HHS_BH_MT128x32x16_SN_SU0_SUM0_SUS0_TT4_8_WG32_4_1_WGM1
    SolutionIndex: 217
    SolutionNameMin: Cijk_Ailk_Bljk_HHS_BH_MT128x128x16_SN_SU32_SUM3_SUS128_TT8_8_WG16_16_1_WGM4
    SolutionIndex: 218
    SolutionNameMin: Cijk_Ailk_Bljk_HHS_BH_MT128x128x16_SN_SU32_SUM3_SUS128_TT8_8_WG16_16_1_WGM1
    SolutionIndex: 219
    SolutionNameMin: Cijk_Ailk_Bljk_HHS_BH_MT128x64x16_SN_SU0_SUM0_SUS0_TT8_8_WG16_8_1_WGM8
    SolutionIndex: 220
    SolutionNameMin: Cijk_Ailk_Bljk_HHS_BH_MT128x128x16_SN_SU32_SUM3_SUS128_TT8_16_WG16_8_1_WGM1
    SolutionIndex: 221
    SolutionNameMin: Cijk_Ailk_Bljk_HHS_BH_MT128x256x16_SN_SU32_SUM3_SUS128_TT8_16_WG16_16_1_WGM1
    SolutionIndex: 222
    SolutionNameMin: Cijk_Ailk_Bljk_HHS_BH_MT128x256x16_SN_SU32_SUM3_SUS128_TT8_16_WG16_16_1_WGM1
    SolutionIndex: 223
    SolutionNameMin: Cijk_Ailk_Bljk_HHS_BH_MT128x256x16_SN_SU32_SUM3_SUS128_TT8_16_WG16_16_1_WGM8
    SolutionIndex: 224
    SolutionNameMin: Cijk_Ailk_Bljk_HHS_BH_MT128x128x16_SN_SU32_SUM3_SUS128_TT8_16_WG16_8_1_WGM4
    SolutionIndex: 225
    SolutionNameMin: Cijk_Ailk_Bljk_HHS_BH_MT128x256x16_SN_SU32_SUM3_SUS128_TT8_16_WG16_16_1_WGM4
    SolutionIndex: 226
    SolutionNameMin: Cijk_Ailk_Bljk_HHS_BH_MT128x128x16_SN_SU32_SUM3_SUS128_TT8_16_WG16_8_1_WGM8
    SolutionIndex: 227
    SolutionNameMin: Cijk_Ailk_Bljk_HHS_BH_MT128x256x16_SN_SU32_SUM3_SUS128_TT8_16_WG16_16_1_WGM8
    SolutionIndex: 228
    SolutionNameMin: Cijk_Ailk_Bljk_HHS_BH_MT32x16x32_SN_SU0_SUM0_SUS0_TT2_2_WG16_8_1_WGM4
    SolutionIndex: 229
    SolutionNameMin: Cijk_Ailk_Bljk_HHS_BH_MT64x32x32_SN_SU0_SUM0_SUS0_TT4_4_WG16_8_1_WGM8
    SolutionIndex: 230
    SolutionNameMin: Cijk_Ailk_Bljk_HHS_BH_MT64x32x32_SN_SU0_SUM0_SUS0_TT4_4_WG16_8_1_WGM1
    SolutionIndex: 231
    SolutionNameMin: Cijk_Ailk_Bljk_HHS_BH_MT128x64x16_SN_SU32_SUM3_SUS128_TT8_8_WG16_8_1_WGM4
    SolutionIndex: 232
    SolutionNameMin: Cijk_Ailk_Bljk_HHS_BH_MT128x128x16_SN_SU32_SUM3_SUS128_TT8_16_WG16_8_1_WGM1
    SolutionIndex: 233
    SolutionNameMin: Cijk_Ailk_Bljk_HHS_BH_MT32x8x8_SN_SU32_SUM3_SUS128_TT2_2_WG16_4_1_WGM1
    SolutionIndex: 234
    SolutionNameMin: Cijk_Ailk_Bljk_HHS_BH_MT32x8x16_SN_SU0_SUM0_SUS0_TT2_2_WG16_4_1_WGM8
    SolutionIndex: 235
    SolutionNameMin: Cijk_Ailk_Bljk_HHS_BH_MT32x8x16_SN_SU0_SUM0_SUS0_TT2_2_WG16_4_1_WGM4
    SolutionIndex: 236
    SolutionNameMin: Cijk_Ailk_Bljk_HHS_BH_MT32x32x8_SN_SU32_SUM3_SUS128_TT2_2_WG16_16_1_WGM8
    SolutionIndex: 237
    SolutionNameMin: Cijk_Ailk_Bljk_HHS_BH_MT64x16x8_SN_SU32_SUM3_SUS128_TT4_4_WG16_4_1_WGM1
    SolutionIndex: 238
    SolutionNameMin: Cijk_Ailk_Bljk_HHS_BH_MT128x32x8_SN_SU32_SUM3_SUS128_TT4_8_WG32_4_1_WGM1
    SolutionIndex: 239
    SolutionNameMin: Cijk_Ailk_Bljk_HHS_BH_MT128x16x8_SN_SU0_SUM0_SUS0_TT4_4_WG32_4_1_WGM1
    SolutionIndex: 240
    SolutionNameMin: Cijk_Ailk_Bljk_HHS_BH_MT128x16x8_SN_SU0_SUM0_SUS0_TT4_4_WG32_4_1_WGM1
    SolutionIndex: 241
    SolutionNameMin: Cijk_Ailk_Bljk_HHS_BH_MT128x128x32_SN_SU0_SUM0_SUS0_TT8_8_WG16_16_1_WGM4
    SolutionIndex: 242
    SolutionNameMin: Cijk_Ailk_Bljk_HHS_BH_MT128x16x8_SN_SU32_SUM3_SUS128_TT4_4_WG32_4_1_WGM1
    SolutionIndex: 243
    SolutionNameMin: Cijk_Ailk_Bljk_HHS_BH_MT16x16x8_SN_SU0_SUM0_SUS0_TT2_2_WG8_8_1_WGM1
    SolutionIndex: 244
    SolutionNameMin: Cijk_Ailk_Bljk_HHS_BH_MT128x32x32_SN_SU32_SUM3_SUS128_TT4_8_WG32_4_1_WGM1
    SolutionIndex: 245
    SolutionNameMin: Cijk_Ailk_Bljk_HHS_BH_MT128x32x32_SN_SU32_SUM3_SUS128_TT4_8_WG32_4_1_WGM1
    SolutionIndex: 246
    SolutionNameMin: Cijk_Ailk_Bljk_HHS_BH_MT128x32x32_SN_SU0_SUM0_SUS0_TT4_8_WG32_4_1_WGM1
    SolutionIndex: 247
    SolutionNameMin: Cijk_Ailk_Bljk_HHS_BH_MT128x16x16_SN_SU32_SUM3_SUS128_TT4_4_WG32_4_1_WGM4
    SolutionIndex: 248
    SolutionNameMin: Cijk_Ailk_Bljk_HHS_BH_MT64x8x16_SN_SU32_SUM3_SUS128_TT2_2_WG32_4_1_WGM4
    SolutionIndex: 249
    SolutionNameMin: Cijk_Ailk_Bljk_HHS_BH_MT64x8x32_SN_SU0_SUM0_SUS0_TT2_2_WG32_4_1_WGM8
    SolutionIndex: 250
    SolutionNameMin: Cijk_Ailk_Bljk_HHS_BH_MT64x32x32_SN_SU0_SUM0_SUS0_TT4_4_WG16_8_1_WGM4
    SolutionIndex: 251
    SolutionNameMin: Cijk_Ailk_Bljk_HHS_BH_MT64x32x16_SN_SU0_SUM0_SUS0_TT4_8_WG16_4_1_WGM1
    SolutionIndex: 252
    SolutionNameMin: Cijk_Ailk_Bljk_HHS_BH_MT128x128x16_SN_SU0_SUM0_SUS0_TT8_8_WG16_16_1_WGM1
    SolutionIndex: 253
    SolutionNameMin: Cijk_Ailk_Bljk_HHS_BH_MT128x256x16_SN_SU0_SUM0_SUS0_TT8_16_WG16_16_1_WGM8
    SolutionIndex: 254
    SolutionNameMin: Cijk_Ailk_Bljk_HHS_BH_MT128x256x16_SN_SU0_SUM0_SUS0_TT8_16_WG16_16_1_WGM8
    SolutionIndex: 255
    SolutionNameMin: Cijk_Ailk_Bljk_HHS_BH_MT128x256x16_SN_SU0_SUM0_SUS0_TT8_16_WG16_16_1_WGM1
    SolutionIndex: 256
    SolutionNameMin: Cijk_Ailk_Bljk_HHS_BH_MT32x16x8_SN_SU0_SUM0_SUS0_TT2_2_WG16_8_1_WGM1
    SolutionIndex: 257
    SolutionNameMin: Cijk_Ailk_Bljk_HHS_BH_MT64x64x8_SN_SU0_SUM0_SUS0_TT4_4_WG16_16_1_WGM8
    SolutionIndex: 258
    SolutionNameMin: Cijk_Ailk_Bljk_HHS_BH_MT64x64x8_SN_SU0_SUM0_SUS0_TT4_4_WG16_16_1_WGM8
    SolutionIndex: 259
    SolutionNameMin: Cijk_Ailk_Bljk_HHS_BH_MT64x32x8_SN_SU0_SUM0_SUS0_TT4_4_WG16_8_1_WGM4
    SolutionIndex: 260
    SolutionNameMin: Cijk_Ailk_Bljk_HHS_BH_MT64x32x8_SN_SU32_SUM3_SUS128_TT4_4_WG16_8_1_WGM8
    SolutionIndex: 261
    SolutionNameMin: Cijk_Ailk_Bljk_HHS_BH_MT128x32x8_SN_SU0_SUM0_SUS0_TT4_8_WG32_4_1_WGM8
    SolutionIndex: 262
    SolutionNameMin: Cijk_Ailk_Bljk_HHS_BH_MT64x32x8_SN_SU32_SUM3_SUS128_TT4_4_WG16_8_1_WGM4
    SolutionIndex: 263
    SolutionNameMin: Cijk_Ailk_Bljk_HHS_BH_MT128x32x8_SN_SU32_SUM3_SUS128_TT4_8_WG32_4_1_WGM8
    SolutionIndex: 264
    SolutionNameMin: Cijk_Ailk_Bljk_HHS_BH_MT128x16x8_SN_SU32_SUM3_SUS128_TT4_4_WG32_4_1_WGM8
    SolutionIndex: 265
    SolutionNameMin: Cijk_Ailk_Bljk_HHS_BH_MT128x16x8_SN_SU0_SUM0_SUS0_TT4_4_WG32_4_1_WGM8
    SolutionIndex: 266
    SolutionNameMin: Cijk_Ailk_Bljk_HHS_BH_MT128x16x8_SN_SU0_SUM0_SUS0_TT4_4_WG32_4_1_WGM8
    SolutionIndex: 267
    SolutionNameMin: Cijk_Ailk_Bljk_HHS_BH_MT128x16x16_SN_SU0_SUM0_SUS0_TT4_4_WG32_4_1_WGM1
    SolutionIndex: 268
    SolutionNameMin: Cijk_Ailk_Bljk_HHS_BH_MT128x16x16_SN_SU0_SUM0_SUS0_TT4_4_WG32_4_1_WGM1
    SolutionIndex: 269
    SolutionNameMin: Cijk_Ailk_Bljk_HHS_BH_MT64x16x32_SN_SU0_SUM0_SUS0_TT4_4_WG16_4_1_WGM8
    SolutionIndex: 270
    SolutionNameMin: Cijk_Ailk_Bljk_HHS_BH_MT128x64x16_SN_SU0_SUM0_SUS0_TT8_8_WG16_8_1_WGM1
    SolutionIndex: 271
    SolutionNameMin: Cijk_Ailk_Bljk_HHS_BH_MT128x128x16_SN_SU0_SUM0_SUS0_TT8_16_WG16_8_1_WGM8
    SolutionIndex: 272
    SolutionNameMin: Cijk_Ailk_Bljk_HHS_BH_MT128x128x16_SN_SU32_SUM3_SUS128_TT8_16_WG16_8_1_WGM8
    SolutionIndex: 273
    SolutionNameMin: Cijk_Ailk_Bljk_HHS_BH_MT128x256x16_SN_SU32_SUM3_SUS128_TT8_16_WG16_16_1_WGM4
    SolutionIndex: 274
    SolutionNameMin: Cijk_Ailk_Bljk_HHS_BH_MT64x8x32_SN_SU0_SUM0_SUS0_TT2_2_WG32_4_1_WGM4
    SolutionIndex: 275
    SolutionNameMin: Cijk_Ailk_Bljk_HHS_BH_MT64x64x8_SN_SU32_SUM3_SUS128_TT8_8_WG8_8_1_WGM1
    SolutionIndex: 276
    SolutionNameMin: Cijk_Ailk_Bljk_HHS_BH_MT64x64x8_SN_SU32_SUM3_SUS128_TT8_8_WG8_8_1_WGM4
    SolutionIndex: 277
    SolutionNameMin: Cijk_Ailk_Bljk_HHS_BH_MT64x64x8_SN_SU32_SUM3_SUS128_TT8_8_WG8_8_1_WGM8
    SolutionIndex: 278
    SolutionNameMin: Cijk_Ailk_Bljk_HHS_BH_MT64x64x8_SN_SU0_SUM0_SUS0_TT8_8_WG8_8_1_WGM1
    SolutionIndex: 279
    SolutionNameMin: Cijk_Ailk_Bljk_HHS_BH_MT64x64x16_SN_SU0_SUM0_SUS0_TT8_8_WG8_8_1_WGM1
    SolutionIndex: 280
    SolutionNameMin: Cijk_Ailk_Bljk_HHS_BH_MT64x64x32_SN_SU0_SUM0_SUS0_TT8_8_WG8_8_1_WGM8
    SolutionIndex: 281
    SolutionNameMin: Cijk_Ailk_Bljk_HHS_BH_MT128x64x8_SN_SU0_SUM0_SUS0_TT8_8_WG16_8_1_WGM1
    SolutionIndex: 282
    SolutionNameMin: Cijk_Ailk_Bljk_HHS_BH_MT128x64x8_SN_SU0_SUM0_SUS0_TT8_8_WG16_8_1_WGM8
    SolutionIndex: 283
    SolutionNameMin: Cijk_Ailk_Bljk_HHS_BH_MT64x64x8_SN_SU0_SUM0_SUS0_TT8_8_WG8_8_1_WGM8
    SolutionIndex: 284
    SolutionNameMin: Cijk_Ailk_Bljk_HHS_BH_MT128x128x32_SN_SU0_SUM0_SUS0_TT8_8_WG16_16_1_WGM8
    SolutionIndex: 285
    SolutionNameMin: Cijk_Ailk_Bljk_HHS_BH_MT128x64x32_SN_SU0_SUM0_SUS0_TT8_8_WG16_8_1_WGM1
    SolutionIndex: 286
    SolutionNameMin: Cijk_Ailk_Bljk_HHS_BH_MT128x128x32_SN_SU0_SUM0_SUS0_TT8_8_WG16_16_1_WGM1
    SolutionIndex: 287
    SolutionNameMin: Cijk_Ailk_Bljk_HHS_BH_MT128x64x16_SN_SU32_SUM3_SUS128_TT8_8_WG16_8_1_WGM8
    SolutionIndex: 288
    SolutionNameMin: Cijk_Ailk_Bljk_HHS_BH_MT128x64x16_SN_SU0_SUM0_SUS0_TT8_8_WG16_8_1_WGM4
    SolutionIndex: 289
    SolutionNameMin: Cijk_Ailk_Bljk_HHS_BH_MT128x64x8_SN_SU0_SUM0_SUS0_TT8_8_WG16_8_1_WGM4
    SolutionIndex: 290
    SolutionNameMin: Cijk_Ailk_Bljk_HHS_BH_MT128x64x8_SN_SU32_SUM3_SUS128_TT8_8_WG16_8_1_WGM4
    SolutionIndex: 291
    SolutionNameMin: Cijk_Ailk_Bljk_HHS_BH_MT128x64x32_SN_SU0_SUM0_SUS0_TT8_8_WG16_8_1_WGM8
    SolutionIndex: 292
    SolutionNameMin: Cijk_Ailk_Bljk_HHS_BH_MT128x64x16_SN_SU0_SUM0_SUS0_TT8_8_WG16_8_1_WGM8
    SolutionIndex: 293
    SolutionNameMin: Cijk_Ailk_Bljk_HHS_BH_MT128x64x8_SN_SU32_SUM3_SUS128_TT8_8_WG16_8_1_WGM8
    SolutionIndex: 294
    SolutionNameMin: Cijk_Ailk_Bljk_HHS_BH_MT64x64x16_SN_SU32_SUM3_SUS128_TT8_8_WG8_8_1_WGM1
    SolutionIndex: 295
    SolutionNameMin: Cijk_Ailk_Bljk_HHS_BH_MT64x64x16_SN_SU32_SUM3_SUS128_TT8_8_WG8_8_1_WGM8
    SolutionIndex: 296
    SolutionNameMin: Cijk_Ailk_Bljk_HHS_BH_MT64x64x32_SN_SU32_SUM3_SUS128_TT8_8_WG8_8_1_WGM8
    SolutionIndex: 297
    SolutionNameMin: Cijk_Ailk_Bljk_HHS_BH_MT128x64x8_SN_SU0_SUM0_SUS0_TT8_8_WG16_8_1_WGM4
    SolutionIndex: 298
    SolutionNameMin: Cijk_Ailk_Bljk_HHS_BH_MT128x64x8_SN_SU0_SUM0_SUS0_TT8_8_WG16_8_1_WGM8
    SolutionIndex: 299
    SolutionNameMin: Cijk_Ailk_Bljk_HHS_BH_MT128x64x8_SN_SU32_SUM3_SUS128_TT8_8_WG16_8_1_WGM8
    SolutionIndex: 300
    SolutionNameMin: Cijk_Ailk_Bljk_HHS_BH_MT128x64x8_SN_SU0_SUM0_SUS0_TT8_8_WG16_8_1_WGM1
    SolutionIndex: 301
    SolutionNameMin: Cijk_Ailk_Bljk_HHS_BH_MT128x64x8_SN_SU32_SUM3_SUS128_TT8_8_WG16_8_1_WGM1
    SolutionIndex: 302
    SolutionNameMin: Cijk_Ailk_Bljk_HHS_BH_MT128x128x8_SN_SU0_SUM0_SUS0_TT8_16_WG16_8_1_WGM1
    SolutionIndex: 303
    SolutionNameMin: Cijk_Ailk_Bljk_HHS_BH_MT32x32x16_SN_SU0_SUM0_SUS0_TT2_2_WG16_16_1_WGM1
    SolutionIndex: 304
    SolutionNameMin: Cijk_Ailk_Bljk_HHS_BH_MT16x16x16_SN_SU0_SUM0_SUS0_TT2_2_WG8_8_1_WGM8
    SolutionIndex: 305
    SolutionNameMin: Cijk_Ailk_Bljk_HHS_BH_MT128x64x16_SN_SU32_SUM3_SUS128_TT8_8_WG16_8_1_WGM1
    SolutionIndex: 306
    SolutionNameMin: Cijk_Ailk_Bljk_HHS_BH_MT128x128x16_SN_SU32_SUM3_SUS128_TT8_8_WG16_16_1_WGM1
    SolutionIndex: 307
    SolutionNameMin: Cijk_Ailk_Bljk_HHS_BH_MT128x128x16_SN_SU32_SUM3_SUS128_TT8_16_WG16_8_1_WGM4
- - - [2944, 4288, 1, 1280]
    - [5, 78.712]
  - - [2368, 5888, 1, 256]
    - [20, 74.308]
  - - [5888, 1856, 1, 3328]
    - [25, 76.717]
  - - [5888, 2944, 1, 3328]
    - [25, 81.536]
  - - [1856, 4288, 1, 256]
    - [25, 68.434]
  - - [5056, 5056, 1, 3328]
    - [15, 78.948]
  - - [1408, 5888, 1, 1280]
    - [10, 77.365]
  - - [1024, 3584, 1, 3328]
    - [20, 71.594]
  - - [448, 3584, 1, 3328]
    - [11, 53.996]
  - - [5888, 1408, 1, 1280]
    - [10, 77.46]
  - - [1024, 2368, 1, 256]
    - [2, 56.602]
  - - [5056, 6784, 1, 1280]
    - [3, 80.491]
  - - [5056, 5056, 1, 1280]
    - [15, 78.479]
  - - [4288, 6784, 1, 256]
    - [3, 77.897]
  - - [6784, 448, 1, 256]
    - [2, 59.097]
  - - [5056, 256, 1, 1280]
    - [2, 54.087]
  - - [5888, 704, 1, 1280]
    - [25, 68.544]
  - - [3584, 1024, 1, 256]
    - [25, 66.273]
  - - [6784, 4288, 1, 3328]
    - [25, 80.665]
  - - [1856, 2368, 1, 3328]
    - [3, 73.473]
  - - [5888, 2944, 1, 1280]
    - [15, 81.001]
  - - [5888, 1024, 1, 256]
    - [3, 71.881]
  - - [1408, 2944, 1, 256]
    - [25, 66.866]
  - - [6784, 5056, 1, 3328]
    - [5, 81.186]
  - - [5056, 5056, 1, 256]
    - [3, 75.213]
  - - [1024, 3584, 1, 1280]
    - [25, 70.809]
  - - [2368, 2944, 1, 1280]
    - [25, 73.699]
  - - [6784, 6784, 1, 1280]
    - [25, 81.777]
  - - [1408, 4288, 1, 1280]
    - [15, 73.564]
  - - [3584, 4288, 1, 1280]
    - [15, 78.116]
  - - [2368, 704, 1, 1280]
    - [2, 59.812]
  - - [5056, 4288, 1, 3328]
    - [17, 80.329]
  - - [3584, 2368, 1, 3328]
    - [15, 77.232]
  - - [5888, 6784, 1, 1280]
    - [20, 81.924]
  - - [6784, 448, 1, 1280]
    - [20, 65.716]
  - - [2944, 5888, 1, 256]
    - [15, 78.305]
  - - [4288, 2944, 1, 256]
    - [10, 74.863]
  - - [5056, 2368, 1, 1280]
    - [3, 75.82]
  - - [448, 3584, 1, 1280]
    - [5, 52.41]
  - - [6784, 5888, 1, 256]
    - [20, 79.697]
  - - [1024, 1408, 1, 256]
    - [2, 55.657]
  - - [2368, 2368, 1, 3328]
    - [30, 71.301]
  - - [5056, 704, 1, 3328]
    - [15, 67.834]
  - - [1408, 1856, 1, 256]
    - [2, 60.608]
  - - [5888, 1856, 1, 256]
    - [20, 72.391]
  - - [704, 5888, 1, 256]
    - [20, 61.664]
  - - [3584, 704, 1, 3328]
    - [15, 66.074]
  - - [1408, 1408, 1, 256]
    - [10, 58.952]
  - - [448, 4288, 1, 256]
    - [27, 51.314]
  - - [704, 2368, 1, 1280]
    - [5, 54.319]
  - - [1856, 2368, 1, 1280]
    - [3, 72.327]
  - - [1408, 1408, 1, 3328]
    - [27, 66.367]
  - - [1408, 1024, 1, 1280]
    - [24, 61.08]
  - - [704, 6784, 1, 256]
    - [30, 64.112]
  - - [6784, 704, 1, 256]
    - [15, 63.992]
  - - [5056, 704, 1, 256]
    - [15, 59.478]
  - - [1408, 3584, 1, 256]
    - [3, 71.218]
  - - [3584, 4288, 1, 3328]
    - [3, 78.628]
  - - [5888, 1856, 1, 1280]
    - [25, 76.183]
  - - [2368, 3584, 1, 1280]
    - [3, 76.652]
  - - [2944, 3584, 1, 3328]
    - [3, 80.273]
  - - [6784, 2944, 1, 256]
    - [10, 78.493]
  - - [1856, 2368, 1, 256]
    - [3, 65.113]
  - - [3584, 6784, 1, 3328]
    - [17, 82.052]
  - - [5056, 4288, 1, 1280]
    - [17, 79.704]
  - - [6784, 1856, 1, 3328]
    - [3, 77.259]
  - - [1408, 5056, 1, 1280]
    - [30, 75.567]
  - - [6784, 5888, 1, 3328]
    - [11, 82.222]
  - - [2368, 5056, 1, 1280]
    - [15, 75.565]
  - - [1024, 5056, 1, 1280]
    - [15, 76.018]
  - - [4288, 1024, 1, 256]
    - [5, 66.277]
  - - [2368, 1408, 1, 256]
    - [3, 63.505]
  - - [5888, 448, 1, 1280]
    - [9, 59.46]
  - - [704, 5888, 1, 3328]
    - [5, 71.254]
  - - [1024, 6784, 1, 1280]
    - [27, 78.743]
  - - [3584, 2944, 1, 1280]
    - [25, 79.747]
  - - [1408, 5056, 1, 3328]
    - [15, 76.253]
  - - [1856, 1856, 1, 3328]
    - [20, 66.904]
  - - [2368, 2368, 1, 256]
    - [20, 64.946]
  - - [4288, 4288, 1, 1280]
    - [30, 78.4]
  - - [5888, 1024, 1, 1280]
    - [3, 75.531]
  - - [704, 6784, 1, 3328]
    - [10, 71.416]
  - - [5888, 5888, 1, 3328]
    - [11, 82.03]
  - - [5056, 1024, 1, 1280]
    - [10, 75.878]
  - - [448, 5888, 1, 3328]
    - [5, 59.783]
  - - [1024, 2944, 1, 1280]
    - [3, 66.266]
  - - [5056, 5888, 1, 1280]
    - [17, 80.57]
  - - [448, 6784, 1, 256]
    - [3, 58.312]
  - - [3584, 5888, 1, 256]
    - [23, 79.176]
  - - [2944, 3584, 1, 256]
    - [3, 76.956]
  - - [6784, 1024, 1, 3328]
    - [3, 78.734]
  - - [6784, 2944, 1, 3328]
    - [3, 81.272]
  - - [6784, 2368, 1, 1280]
    - [25, 78.421]
  - - [4288, 3584, 1, 256]
    - [3, 76.077]
  - - [4288, 5888, 1, 1280]
    - [17, 80.688]
  - - [4288, 1856, 1, 1280]
    - [15, 73.329]
  - - [1856, 2944, 1, 3328]
    - [10, 73.834]
  - - [256, 6784, 1, 3328]
    - [16, 67.403]
  - - [5056, 1024, 1, 256]
    - [3, 71.053]
  - - [5056, 1856, 1, 3328]
    - [15, 75.553]
  - - [5056, 256, 1, 3328]
    - [14, 55.494]
  - - [1024, 5888, 1, 1280]
    - [3, 75.47]
  - - [5056, 3584, 1, 256]
    - [3, 76.451]
  - - [1856, 1024, 1, 1280]
    - [3, 61.592]
  - - [1856, 1856, 1, 1280]
    - [20, 65.472]
  - - [1856, 1024, 1, 3328]
    - [17, 63.909]
  - - [6784, 1024, 1, 256]
    - [3, 74.678]
  - - [5056, 5888, 1, 3328]
    - [17, 81.064]
  - - [1856, 1024, 1, 256]
    - [2, 52.767]
  - - [5056, 1408, 1, 3328]
    - [3, 76.201]
  - - [448, 5888, 1, 256]
    - [15, 51.395]
  - - [1408, 6784, 1, 3328]
    - [15, 78.815]
  - - [2944, 1408, 1, 3328]
    - [25, 71.497]
  - - [2944, 4288, 1, 3328]
    - [17, 79.679]
  - - [5056, 2944, 1, 256]
    - [10, 76.004]
  - - [2368, 1856, 1, 256]
    - [25, 65.246]
  - - [1408, 3584, 1, 3328]
    - [3, 75.734]
  - - [2368, 6784, 1, 256]
    - [3, 75.303]
  - - [4288, 2368, 1, 3328]
    - [25, 77.189]
  - - [704, 3584, 1, 1280]
    - [25, 64.852]
  - - [1408, 5888, 1, 3328]
    - [20, 78.03]
  - - [1856, 5056, 1, 256]
    - [20, 70.692]
  - - [6784, 6784, 1, 256]
    - [25, 79.675]
  - - [2368, 4288, 1, 1280]
    - [15, 76.314]
  - - [3584, 1856, 1, 1280]
    - [25, 74.707]
  - - [3584, 448, 1, 256]
    - [24, 53.536]
  - - [3584, 3584, 1, 1280]
    - [17, 81.667]
  - - [256, 6784, 1, 256]
    - [16, 60.058]
  - - [1856, 3584, 1, 3328]
    - [17, 77.279]
  - - [3584, 3584, 1, 256]
    - [23, 78.348]
  - - [6784, 4288, 1, 1280]
    - [10, 80.2]
  - - [3584, 5056, 1, 256]
    - [23, 77.049]
  - - [2944, 2368, 1, 1280]
    - [15, 73.958]
  - - [6784, 3584, 1, 256]
    - [25, 79.248]
  - - [1856, 1408, 1, 256]
    - [23, 58.905]
  - - [2944, 2944, 1, 3328]
    - [3, 78.982]
  - - [5056, 6784, 1, 256]
    - [3, 78.039]
  - - [1408, 4288, 1, 3328]
    - [3, 74.597]
  - - [6784, 256, 1, 1280]
    - [16, 66.631]
  - - [2368, 704, 1, 3328]
    - [14, 60.532]
  - - [3584, 6784, 1, 256]
    - [23, 79.445]
  - - [5056, 1856, 1, 256]
    - [20, 70.933]
  - - [704, 4288, 1, 256]
    - [3, 57.233]
  - - [1408, 6784, 1, 1280]
    - [25, 78.373]
  - - [5056, 2368, 1, 3328]
    - [3, 76.611]
  - - [2944, 4288, 1, 256]
    - [20, 74.087]
  - - [1408, 3584, 1, 1280]
    - [25, 75.224]
  - - [2368, 6784, 1, 3328]
    - [15, 79.003]
  - - [5056, 704, 1, 1280]
    - [20, 66.532]
  - - [1856, 4288, 1, 3328]
    - [15, 74.069]
  - - [1408, 5888, 1, 256]
    - [30, 73.929]
  - - [704, 2944, 1, 1280]
    - [17, 66.555]
  - - [3584, 704, 1, 1280]
    - [30, 64.382]
  - - [5888, 5056, 1, 256]
    - [23, 79.97]
  - - [3584, 448, 1, 3328]
    - [2, 58.704]
  - - [704, 2368, 1, 3328]
    - [17, 56.063]
  - - [448, 5056, 1, 3328]
    - [3, 59.575]
  - - [4288, 448, 1, 256]
    - [2, 53.387]
  - - [5888, 2368, 1, 256]
    - [23, 74.845]
  - - [6784, 704, 1, 3328]
    - [25, 71.303]
  - - [1408, 2944, 1, 3328]
    - [15, 71.468]
  - - [4288, 4288, 1, 256]
    - [20, 75.073]
  - - [2368, 704, 1, 256]
    - [9, 52.438]
  - - [3584, 2368, 1, 256]
    - [23, 72.224]
  - - [5888, 5056, 1, 1280]
    - [5, 80.593]
  - - [3584, 3584, 1, 3328]
    - [17, 82.47]
  - - [5888, 6784, 1, 256]
    - [23, 81.367]
  - - [4288, 2944, 1, 3328]
    - [3, 78.8]
  - - [256, 5056, 1, 1280]
    - [2, 54.993]
  - - [6784, 5888, 1, 1280]
    - [17, 81.872]
  - - [5888, 4288, 1, 1280]
    - [17, 80.516]
  - - [1408, 1856, 1, 1280]
    - [30, 67.324]
  - - [5888, 448, 1, 3328]
    - [19, 59.785]
  - - [704, 5888, 1, 1280]
    - [17, 69.758]
  - - [5056, 2944, 1, 3328]
    - [10, 79.059]
  - - [448, 4288, 1, 1280]
    - [27, 61.743]
  - - [3584, 704, 1, 256]
    - [2, 58.567]
  - - [3584, 1408, 1, 3328]
    - [20, 75.781]
  - - [2368, 1024, 1, 1280]
    - [10, 62.729]
  - - [2944, 6784, 1, 1280]
    - [25, 80.818]
  - - [1856, 6784, 1, 256]
    - [20, 73.108]
  - - [4288, 448, 1, 3328]
    - [27, 63.927]
  - - [6784, 704, 1, 1280]
    - [25, 70.439]
  - - [5888, 1024, 1, 3328]
    - [25, 76.196]
  - - [704, 6784, 1, 1280]
    - [25, 70.548]
  - - [5056, 1024, 1, 3328]
    - [3, 77.654]
  - - [704, 5056, 1, 1280]
    - [25, 66.541]
  - - [2944, 1856, 1, 256]
    - [25, 67.744]
  - - [5888, 5056, 1, 3328]
    - [5, 81.247]
  - - [3584, 6784, 1, 1280]
    - [3, 81.473]
  - - [1856, 5888, 1, 256]
    - [3, 72.573]
  - - [4288, 4288, 1, 3328]
    - [20, 78.872]
  - - [4288, 1408, 1, 1280]
    - [10, 75.319]
  - - [4288, 2368, 1, 256]
    - [30, 72.057]
  - - [2944, 5056, 1, 1280]
    - [5, 79.709]
  - - [6784, 2368, 1, 3328]
    - [25, 79.023]
  - - [4288, 1856, 1, 3328]
    - [3, 74.094]
  - - [1856, 2944, 1, 1280]
    - [3, 73.146]
  - - [4288, 6784, 1, 3328]
    - [3, 80.74]
  - - [3584, 1024, 1, 1280]
    - [15, 70.611]
  - - [1024, 4288, 1, 256]
    - [2, 63.584]
  - - [5888, 3584, 1, 3328]
    - [17, 82.569]
  - - [5056, 3584, 1, 3328]
    - [3, 80.101]
  - - [2368, 1408, 1, 1280]
    - [15, 72.05]
  - - [5056, 2944, 1, 1280]
    - [30, 78.339]
  - - [1024, 6784, 1, 256]
    - [3, 74.734]
  - - [2944, 5056, 1, 3328]
    - [5, 80.597]
  - - [3584, 2944, 1, 256]
    - [10, 76.821]
  - - [5056, 6784, 1, 3328]
    - [27, 80.97]
  - - [3584, 4288, 1, 256]
    - [23, 74.908]
  - - [1856, 6784, 1, 3328]
    - [3, 77.198]
  - - [5056, 1408, 1, 1280]
    - [3, 75.438]
  - - [5888, 5888, 1, 256]
    - [23, 80.821]
  - - [4288, 1024, 1, 1280]
    - [25, 72.235]
  - - [448, 6784, 1, 3328]
    - [17, 68.233]
  - - [2944, 1408, 1, 1280]
    - [3, 70.866]
  - - [2944, 1856, 1, 3328]
    - [25, 73.945]
  - - [448, 5056, 1, 256]
    - [2, 50.662]
  - - [3584, 5888, 1, 1280]
    - [17, 82.567]
  - - [6784, 1856, 1, 1280]
    - [10, 76.505]
  - - [5888, 256, 1, 3328]
    - [3, 64.006]
  - - [1856, 5888, 1, 3328]
    - [17, 76.923]
  - - [3584, 1408, 1, 256]
    - [3, 71.148]
  - - [704, 3584, 1, 3328]
    - [15, 66.288]
  - - [5056, 448, 1, 1280]
    - [2, 62.255]
  - - [3584, 1856, 1, 3328]
    - [30, 75.296]
  - - [2944, 1024, 1, 256]
    - [15, 62.941]
  - - [2368, 4288, 1, 3328]
    - [15, 77.137]
  - - [1024, 1408, 1, 1280]
    - [2, 61.044]
  - - [6784, 5056, 1, 256]
    - [10, 77.678]
  - - [4288, 5888, 1, 256]
    - [3, 77.13]
  - - [2944, 6784, 1, 256]
    - [25, 78.461]
  - - [2368, 2368, 1, 1280]
    - [10, 70.209]
  - - [1856, 3584, 1, 1280]
    - [17, 76.117]
  - - [3584, 1408, 1, 1280]
    - [15, 75.093]
  - - [5056, 3584, 1, 1280]
    - [15, 79.418]
  - - [256, 5888, 1, 256]
    - [3, 54.815]
  - - [1856, 1408, 1, 3328]
    - [3, 68.984]
  - - [1024, 4288, 1, 3328]
    - [17, 75.037]
  - - [2944, 2368, 1, 3328]
    - [3, 74.739]
  - - [704, 4288, 1, 3328]
    - [27, 68.077]
  - - [1024, 1856, 1, 1280]
    - [17, 61.662]
  - - [6784, 1856, 1, 256]
    - [3, 73.316]
  - - [1024, 5888, 1, 256]
    - [15, 71.822]
  - - [1408, 2368, 1, 256]
    - [20, 63.128]
  - - [2944, 704, 1, 3328]
    - [27, 69.149]
  - - [2944, 2944, 1, 1280]
    - [15, 78.457]
  - - [6784, 256, 1, 3328]
    - [16, 67.536]
  - - [1408, 5056, 1, 256]
    - [25, 70.735]
  - - [1408, 4288, 1, 256]
    - [25, 67.94]
  - - [5888, 2368, 1, 1280]
    - [15, 78.06]
  - - [2368, 5888, 1, 1280]
    - [15, 77.872]
  - - [5888, 256, 1, 1280]
    - [15, 62.517]
  - - [2368, 1856, 1, 3328]
    - [15, 73.559]
  - - [2944, 704, 1, 256]
    - [30, 56.997]
  - - [2368, 6784, 1, 1280]
    - [15, 78.518]
  - - [2368, 1024, 1, 3328]
    - [15, 64.563]
  - - [1856, 4288, 1, 1280]
    - [25, 73.302]
  - - [704, 3584, 1, 256]
    - [29, 56.173]
  - - [704, 2944, 1, 3328]
    - [5, 69.21]
  - - [1856, 5056, 1, 3328]
    - [25, 75.486]
  - - [3584, 5056, 1, 1280]
    - [25, 79.596]
  - - [2944, 1024, 1, 3328]
    - [25, 68.186]
  - - [1408, 6784, 1, 256]
    - [25, 75.152]
  - - [6784, 1408, 1, 3328]
    - [3, 78.881]
  - - [1024, 2368, 1, 1280]
    - [25, 62.988]
  - - [6784, 2944, 1, 1280]
    - [3, 80.823]
  - - [3584, 448, 1, 1280]
    - [14, 58.041]
  - - [2944, 6784, 1, 3328]
    - [3, 81.29]
  - - [448, 5056, 1, 1280]
    - [3, 58.158]
  - - [4288, 5056, 1, 1280]
    - [27, 79.882]
  - - [4288, 704, 1, 256]
    - [9, 57.612]
  - - [5888, 704, 1, 256]
    - [30, 62.763]
  - - [256, 5888, 1, 3328]
    - [10, 63.848]
  - - [6784, 4288, 1, 256]
    - [15, 77.66]
  - - [5888, 256, 1, 256]
    - [10, 54.885]
  - - [6784, 1024, 1, 1280]
    - [3, 78.154]
  - - [2944, 704, 1, 1280]
    - [17, 66.717]
  - - [6784, 3584, 1, 1280]
    - [10, 81.556]
  - - [1408, 2944, 1, 1280]
    - [3, 70.94]
  - - [1408, 2368, 1, 3328]
    - [3, 73.521]
  - - [2368, 2944, 1, 256]
    - [3, 70.482]
  - - [3584, 1856, 1, 256]
    - [15, 69.871]
  - - [4288, 3584, 1, 1280]
    - [3, 78.314]
  - - [4288, 2944, 1, 1280]
    - [3, 78.43]
  - - [5056, 448, 1, 3328]
    - [14, 62.778]
  - - [4288, 5056, 1, 3328]
    - [27, 80.785]
  - - [256, 5056, 1, 3328]
    - [2, 55.738]
  - - [5056, 2368, 1, 256]
    - [20, 72.355]
  - - [4288, 704, 1, 3328]
    - [3, 66.692]
  - - [448, 3584, 1, 256]
    - [2, 45.498]
  - - [1024, 1408, 1, 3328]
    - [24, 61.923]
  - - [2944, 5888, 1, 1280]
    - [15, 81.069]
  - - [5888, 3584, 1, 256]
    - [23, 80.771]
  - - [1408, 1856, 1, 3328]
    - [25, 68.867]
  - - [6784, 1408, 1, 1280]
    - [25, 78.391]
  - - [704, 2944, 1, 256]
    - [3, 57.324]
  - - [2944, 5888, 1, 3328]
    - [5, 81.849]
  - - [1408, 1408, 1, 1280]
    - [3, 64.29]
  - - [448, 4288, 1, 3328]
    - [17, 64.303]
  - - [704, 2368, 1, 256]
    - [19, 47.896]
  - - [5888, 2368, 1, 3328]
    - [15, 78.605]
  - - [4288, 5056, 1, 256]
    - [15, 75.596]
  - - [4288, 448, 1, 1280]
    - [17, 60.956]
  - - [5888, 704, 1, 3328]
    - [25, 69.688]
  - - [4288, 3584, 1, 3328]
    - [3, 80.146]
  - - [1024, 6784, 1, 3328]
    - [17, 80.315]
  - - [1408, 1024, 1, 256]
    - [2, 55.731]
  - - [6784, 6784, 1, 3328]
    - [3, 82.109]
  - - [704, 5056, 1, 3328]
    - [15, 67.683]
  - - [3584, 5056, 1, 3328]
    - [25, 79.945]
  - - [2368, 2944, 1, 3328]
    - [25, 74.563]
  - - [2368, 3584, 1, 256]
    - [10, 72.332]
  - - [3584, 2368, 1, 1280]
    - [25, 76.447]
  - - [1856, 1856, 1, 256]
    - [3, 58.303]
  - - [4288, 1408, 1, 3328]
    - [30, 75.693]
  - - [5888, 1408, 1, 3328]
    - [10, 78.03]
  - - [256, 5056, 1, 256]
    - [2, 50.506]
  - - [2368, 5056, 1, 256]
    - [10, 71.888]
  - - [1024, 5056, 1, 256]
    - [25, 69.212]
  - - [2368, 1408, 1, 3328]
    - [3, 73.539]
  - - [5888, 448, 1, 256]
    - [14, 56.419]
  - - [6784, 5056, 1, 1280]
    - [25, 80.645]
  - - [4288, 6784, 1, 1280]
    - [25, 80.309]
  - - [6784, 1408, 1, 256]
    - [10, 75.213]
  - - [5888, 4288, 1, 256]
    - [23, 78.265]
  - - [5056, 5888, 1, 256]
    - [3, 77.96]
  - - [2368, 1024, 1, 256]
    - [1, 55.393]
  - - [1856, 6784, 1, 1280]
    - [3, 76.722]
  - - [6784, 448, 1, 3328]
    - [30, 67.037]
  - - [5056, 1856, 1, 1280]
    - [15, 74.843]
  - - [1408, 1024, 1, 3328]
    - [2, 61.917]
  - - [5888, 3584, 1, 1280]
    - [5, 82.021]
  - - [1024, 2944, 1, 256]
    - [25, 62.896]
  - - [448, 6784, 1, 1280]
    - [17, 66.695]
  - - [704, 5056, 1, 256]
    - [25, 59.101]
  - - [3584, 1024, 1, 3328]
    - [3, 71.752]
  - - [2944, 1856, 1, 1280]
    - [30, 72.991]
  - - [5056, 256, 1, 256]
    - [2, 47.915]
  - - [2368, 3584, 1, 3328]
    - [3, 77.234]
  - - [3584, 5888, 1, 3328]
    - [17, 83.174]
  - - [2944, 3584, 1, 1280]
    - [15, 79.83]
  - - [1856, 5888, 1, 1280]
    - [3, 76.171]
  - - [4288, 1408, 1, 256]
    - [10, 68.824]
  - - [4288, 2368, 1, 1280]
    - [3, 76.453]
  - - [2944, 5056, 1, 256]
    - [20, 75.377]
  - - [6784, 2368, 1, 256]
    - [15, 75.01]
  - - [4288, 1856, 1, 256]
    - [15, 69.28]
  - - [1856, 2944, 1, 256]
    - [10, 67.11]
  - - [1856, 1408, 1, 1280]
    - [3, 67.579]
  - - [1024, 4288, 1, 1280]
    - [17, 72.549]
  - - [2368, 5056, 1, 3328]
    - [3, 76.596]
  - - [4288, 1024, 1, 3328]
    - [3, 73.995]
  - - [1024, 5056, 1, 3328]
    - [30, 77.487]
  - - [1024, 1856, 1, 3328]
    - [17, 63.834]
  - - [3584, 2944, 1, 3328]
    - [3, 80.313]
  - - [5888, 2944, 1, 256]
    - [20, 78.366]
  - - [5056, 4288, 1, 256]
    - [15, 75.459]
  - - [1024, 3584, 1, 256]
    - [3, 66.067]
  - - [5056, 1408, 1, 256]
    - [10, 72.201]
  - - [5888, 5888, 1, 1280]
    - [15, 81.75]
  - - [448, 5888, 1, 1280]
    - [17, 57.976]
  - - [4288, 704, 1, 1280]
    - [3, 65.341]
  - - [2944, 1408, 1, 256]
    - [25, 66.792]
  - - [2368, 5888, 1, 3328]
    - [20, 78.488]
  - - [2368, 1856, 1, 1280]
    - [15, 72.244]
  - - [5888, 4288, 1, 3328]
    - [17, 81.173]
  - - [5056, 448, 1, 256]
    - [2, 55.806]
  - - [1856, 5056, 1, 1280]
    - [15, 74.883]
  - - [2944, 1024, 1, 1280]
    - [3, 67.344]
  - - [2368, 4288, 1, 256]
    - [25, 72.039]
  - - [1024, 2368, 1, 3328]
    - [15, 64.836]
  - - [4288, 5888, 1, 3328]
    - [17, 81.36]
  - - [1024, 2944, 1, 3328]
    - [17, 68.269]
  - - [256, 6784, 1, 1280]
    - [26, 66.334]
  - - [1856, 3584, 1, 256]
    - [3, 69.744]
  - - [256, 5888, 1, 1280]
    - [3, 62.517]
  - - [2944, 2368, 1, 256]
    - [25, 68.445]
  - - [1024, 1856, 1, 256]
    - [2, 55.772]
  - - [6784, 3584, 1, 3328]
    - [5, 82.059]
  - - [1024, 5888, 1, 3328]
    - [3, 76.187]
  - - [1408, 2368, 1, 1280]
    - [3, 71.793]
  - - [2944, 2944, 1, 256]
    - [25, 75.54]
  - - [6784, 256, 1, 256]
    - [16, 60.712]
  - - [5888, 1408, 1, 256]
    - [23, 74.482]
  - - [5888, 6784, 1, 3328]
    - [20, 82.321]
  - - [704, 4288, 1, 1280]
    - [27, 65.648]
  - - [4096, 7000, 1, 4096]
    - [10, 81.161]
  - - [5124, 9124, 1, 1760]
    - [23, 84.435]
  - - [1024, 1500, 1, 1536]
    - [15, 61.247]
  - - [512, 24000, 1, 2048]
    - [30, 79.652]
  - - [3072, 24000, 1, 1024]
    - [10, 81.847]
  - - [1024, 3000, 1, 2560]
    - [17, 68.635]
  - - [512, 3136, 1, 2048]
    - [20, 65.763]
  - - [8448, 1500, 1, 2816]
    - [15, 79.05]
  - - [2560, 7000, 1, 2560]
    - [15, 79.824]
  - - [512, 48000, 1, 2048]
    - [20, 80.518]
  - - [196, 256, 64, 1024]
    - [10, 52.239]
  - - [512, 48000, 1, 1536]
    - [21, 80.631]
  - - [4608, 1500, 1, 1536]
    - [30, 76.907]
  - - [1024, 24000, 1, 2560]
    - [17, 81.904]
  - - [4608, 3000, 1, 1536]
    - [17, 79.4]
  - - [5124, 9124, 1, 2048]
    - [21, 79.442]
  - - [5124, 700, 1, 2560]
    - [15, 67.604]
  - - [6144, 6000, 1, 2560]
    - [25, 81.829]
  - - [1024, 1500, 1, 2816]
    - [30, 63.351]
  - - [8448, 48000, 1, 2816]
    - [21, 83.539]
  - - [512, 6000, 1, 2048]
    - [32, 67.913]
  - - [4224, 1500, 1, 176]
    - [23, 67.66]
  - - [1024, 6000, 1, 2816]
    - [25, 75.612]
  - - [1024, 48000, 1, 1536]
    - [15, 81.922]
  - - [1024, 48000, 1, 2560]
    - [17, 82.508]
  - - [4608, 24000, 1, 1536]
    - [17, 83.264]
  - - [7680, 48000, 1, 2560]
    - [5, 83.74]
  - - [3072, 48000, 1, 1024]
    - [15, 82.321]
  - - [1024, 1500, 1, 2048]
    - [30, 62.14]
  - - [1024, 3000, 1, 2048]
    - [32, 68.129]
  - - [1024, 6000, 1, 2048]
    - [30, 75.165]
  - - [512, 24000, 1, 2816]
    - [20, 79.869]
  - - [6144, 48000, 1, 2560]
    - [5, 83.476]
  - - [1760, 7000, 1, 1760]
    - [23, 81.446]
  - - [8448, 3000, 1, 2816]
    - [15, 79.72]
  - - [4608, 48000, 1, 1536]
    - [21, 83.289]
  - - [7680, 1500, 1, 2560]
    - [21, 78.906]
  - - [512, 3000, 1, 1536]
    - [30, 62.232]
  - - [1024, 3000, 1, 2816]
    - [27, 69.237]
  - - [5124, 9124, 1, 2560]
    - [17, 79.278]
  - - [512, 48000, 1, 2816]
    - [17, 82.24]
  - - [512, 3000, 1, 2816]
    - [30, 63.286]
  - - [1024, 24000, 1, 1536]
    - [21, 81.488]
  - - [7680, 6000, 1, 2560]
    - [3, 81.786]
  - - [512, 6000, 1, 2560]
    - [32, 68.328]
  - - [512, 24000, 1, 2560]
    - [30, 79.713]
  - - [6144, 3000, 1, 2560]
    - [17, 80.268]
  - - [1024, 24000, 1, 2816]
    - [17, 82.244]
  - - [2048, 7000, 1, 2048]
    - [20, 78.666]
  - - [7680, 3000, 1, 2560]
    - [17, 80.69]
  - - [5124, 700, 1, 2048]
    - [20, 67.477]
  - - [5124, 9124, 1, 4096]
    - [32, 79.289]
  - - [256, 193600, 1, 64]
    - [8, 71.655]
  - - [8448, 6000, 1, 2816]
    - [20, 81.75]
  - - [5124, 1500, 1, 2560]
    - [17, 75.28]
  - - [1024, 1500, 1, 2560]
    - [20, 63.55]
  - - [1024, 6000, 1, 2560]
    - [25, 75.429]
  - - [196, 1024, 64, 256]
    - [3, 56.931]
  - - [512, 50176, 1, 128]
    - [23, 80.282]
  - - [7680, 24000, 1, 2560]
    - [17, 83.501]
  - - [512, 3000, 1, 2560]
    - [25, 62.609]
  - - [8448, 24000, 1, 2816]
    - [5, 83.291]
  - - [512, 6000, 1, 1536]
    - [32, 66.988]
  - - [3072, 6000, 1, 1024]
    - [21, 79.706]
  - - [3072, 1500, 1, 128]
    - [24, 58.307]
  - - [2048, 3136, 1, 512]
    - [20, 71.053]
  - - [1024, 3000, 1, 1536]
    - [17, 68.007]
  - - [512, 6000, 1, 2816]
    - [17, 69.201]
  - - [128, 50176, 1, 512]
    - [20, 76.568]
  - - [256, 12544, 1, 1024]
    - [21, 70.904]
  - - [1024, 12544, 1, 256]
    - [23, 77.595]
  - - [512, 48000, 1, 2560]
    - [21, 81.525]
  - - [512, 24000, 1, 1536]
    - [10, 79.138]
  - - [1024, 24000, 1, 2048]
    - [21, 81.337]
  - - [5124, 1500, 1, 2048]
    - [21, 74.775]
  - - [3072, 1500, 1, 1024]
    - [25, 74.908]
  - - [6144, 1500, 1, 2560]
    - [25, 78.328]
  - - [1024, 48000, 1, 2816]
    - [17, 83.027]
  - - [1024, 6000, 1, 1536]
    - [20, 74.358]
  - - [512, 3000, 1, 2048]
    - [10, 63.011]
  - - [6144, 24000, 1, 2560]
    - [5, 83.23]
  - - [4608, 6000, 1, 1536]
    - [3, 80.938]
  - - [3072, 3000, 1, 1024]
    - [20, 77.419]
  - - [1024, 48000, 1, 2048]
    - [20, 81.042]
  - - [784, 512, 64, 128]
    - [1, 68.28]
  - - [3136, 256, 64, 64]
    - [8, 72.104]
  - - [12544, 1024, 1, 256]
    - [23, 79.032]
  - - [784, 128, 128, 512]
    - [10, 66.404]
  - - [784, 512, 256, 128]
    - [3, 63.636]
  - - [3136, 512, 1, 2048]
    - [10, 64.202]
  - - [12544, 256, 1, 1024]
    - [3, 70.245]
  - - [3136, 2048, 1, 512]
    - [3, 71.163]
  - - [3136, 256, 256, 64]
    - [0, 42.922]
  - - [784, 128, 64, 512]
    - [20, 63.762]
  - - [784, 512, 128, 128]
    - [1, 66.108]
  - - [784, 128, 256, 512]
    - [10, 62.99]
  - - [3136, 256, 128, 64]
    - [0, 54.066]
  - - [128, 128, 512, 64]
    - [7, 54.504]
  - - [512, 512, 64, 64]
    - [8, 67.396]
  - - [1024, 2048, 1, 2]
    - [22, 2.529]
  - - [1024, 2048, 1, 1024]
    - [21, 68.578]
  - - [1024, 2048, 1, 4096]
    - [21, 70.613]
  - - [1024, 2048, 1, 30528]
    - [5, 71.678]
  - - [1024, 4096, 1, 1024]
    - [30, 70.047]
  - - [1024, 4096, 1, 4096]
    - [32, 72.386]
  - - [1024, 4096, 1, 30528]
    - [5, 73.2]
  - - [4096, 2048, 1, 1024]
    - [20, 75.547]
  - - [4096, 4096, 1, 1024]
    - [10, 79.361]
  - - [256, 8976, 1, 1536]
    - [11, 72.03]
  - - [256, 8976, 1, 2048]
    - [11, 75.603]
  - - [256, 8976, 1, 2304]
    - [17, 75.946]
  - - [256, 8976, 1, 2560]
    - [32, 75.526]
  - - [256, 8976, 1, 2816]
    - [32, 76.16]
  - - [256, 8976, 1, 3072]
    - [21, 76.323]
  - - [256, 8976, 1, 4352]
    - [5, 77.178]
  - - [256, 8976, 1, 4864]
    - [27, 77.322]
  - - [256, 8976, 1, 5376]
    - [11, 77.121]
  - - [256, 8976, 1, 5632]
    - [11, 77.094]
  - - [256, 8976, 1, 5888]
    - [21, 77.218]
  - - [256, 8976, 1, 6144]
    - [32, 76.954]
  - - [256, 8976, 1, 6656]
    - [21, 77.108]
  - - [256, 8976, 1, 7168]
    - [32, 75.783]
  - - [256, 8976, 1, 7424]
    - [11, 76.505]
  - - [256, 8976, 1, 8192]
    - [10, 72.887]
  - - [256, 8976, 1, 8448]
    - [32, 76.032]
  - - [256, 8976, 1, 8960]
    - [21, 75.774]
  - - [256, 8976, 1, 9472]
    - [32, 76.007]
  - - [256, 8976, 1, 9728]
    - [32, 75.163]
  - - [256, 8976, 1, 9984]
    - [32, 75.858]
  - - [256, 8976, 1, 10240]
    - [20, 71.303]
  - - [256, 8976, 1, 10496]
    - [21, 75.849]
  - - [256, 8976, 1, 11008]
    - [32, 75.35]
  - - [256, 8976, 1, 11520]
    - [11, 75.459]
  - - [256, 8976, 1, 12288]
    - [30, 68.619]
  - - [256, 8976, 1, 14336]
    - [30, 68.829]
  - - [256, 8976, 1, 14848]
    - [30, 74.829]
  - - [256, 8976, 1, 15104]
    - [5, 75.752]
  - - [256, 8976, 1, 15872]
    - [20, 74.698]
  - - [256, 8976, 1, 17152]
    - [21, 75.452]
  - - [256, 8976, 1, 19712]
    - [11, 75.589]
  - - [256, 8976, 1, 19968]
    - [10, 75.01]
  - - [256, 8976, 1, 20480]
    - [20, 68.538]
  - - [256, 8976, 1, 20992]
    - [10, 74.804]
  - - [256, 8976, 1, 22016]
    - [10, 74.944]
  - - [256, 8976, 1, 26112]
    - [30, 74.261]
  - - [256, 8976, 1, 33536]
    - [20, 74.827]
  - - [256, 8976, 1, 44505]
    - [27, 78.109]
  - - [256, 32768, 1, 128]
    - [23, 71.493]
  - - [480, 32768, 1, 1024]
    - [30, 73.846]
  - - [512, 32768, 1, 256]
    - [25, 77.128]
  - - [1024, 1600, 1, 1]
    - [22, 1.112]
  - - [1024, 1600, 1, 1024]
    - [30, 64.17]
  - - [1024, 1792, 1, 256]
    - [17, 54.964]
  - - [1024, 2048, 1, 256]
    - [17, 62.045]
  - - [1024, 2560, 1, 256]
    - [25, 62.817]
  - - [1024, 3072, 1, 256]
    - [3, 64.879]
  - - [1024, 3328, 1, 256]
    - [15, 69.007]
  - - [1024, 3840, 1, 256]
    - [25, 69.828]
  - - [1024, 4096, 1, 256]
    - [25, 66.435]
  - - [1024, 4608, 1, 256]
    - [17, 73.967]
  - - [1024, 4864, 1, 256]
    - [3, 70.326]
  - - [1024, 5120, 1, 256]
    - [3, 73.383]
  - - [1024, 5632, 1, 256]
    - [25, 73.521]
  - - [1024, 6144, 1, 256]
    - [25, 73.37]
  - - [1024, 6400, 1, 256]
    - [3, 72.034]
  - - [1024, 7168, 1, 256]
    - [3, 73.261]
  - - [1024, 7424, 1, 256]
    - [3, 75.51]
  - - [1024, 7680, 1, 256]
    - [23, 74.161]
  - - [1024, 7936, 1, 256]
    - [3, 75.305]
  - - [1024, 8192, 1, 256]
    - [23, 73.579]
  - - [1024, 8448, 1, 256]
    - [3, 75.012]
  - - [1024, 8704, 1, 256]
    - [15, 74.446]
  - - [1024, 8960, 1, 256]
    - [23, 75.199]
  - - [1024, 9728, 1, 256]
    - [3, 76.744]
  - - [1024, 9984, 1, 256]
    - [23, 75.098]
  - - [1024, 10240, 1, 256]
    - [23, 76.363]
  - - [1024, 10496, 1, 256]
    - [23, 75.824]
  - - [1024, 11008, 1, 256]
    - [15, 75.959]
  - - [1024, 11264, 1, 256]
    - [23, 76.794]
  - - [1024, 11520, 1, 256]
    - [17, 77.714]
  - - [1024, 12288, 1, 256]
    - [23, 77.076]
  - - [1024, 13312, 1, 256]
    - [23, 77.268]
  - - [1024, 13568, 1, 256]
    - [23, 77.002]
  - - [1024, 14336, 1, 256]
    - [15, 77.762]
  - - [1024, 14592, 1, 256]
    - [23, 77.823]
  - - [1024, 14848, 1, 256]
    - [23, 78.411]
  - - [1024, 15104, 1, 256]
    - [23, 77.439]
  - - [1024, 16128, 1, 256]
    - [17, 78.718]
  - - [1024, 17152, 1, 256]
    - [17, 78.19]
  - - [1024, 18944, 1, 256]
    - [23, 79.014]
  - - [1024, 19712, 1, 256]
    - [23, 79.438]
  - - [1024, 19968, 1, 256]
    - [23, 79.314]
  - - [1024, 20480, 1, 256]
    - [23, 79.594]
  - - [1024, 20992, 1, 256]
    - [23, 79.079]
  - - [1024, 21504, 1, 256]
    - [23, 79.727]
  - - [1024, 22016, 1, 256]
    - [23, 79.474]
  - - [1024, 23552, 1, 256]
    - [23, 79.724]
  - - [1024, 28672, 1, 256]
    - [23, 80.07]
  - - [1024, 32768, 1, 512]
    - [25, 80.523]
  - - [1024, 32768, 1, 1024]
    - [20, 81.055]
  - - [1024, 33536, 1, 256]
    - [23, 80.329]
  - - [1024, 40448, 1, 256]
    - [23, 81.06]
  - - [2048, 960, 1, 2048]
    - [27, 64.493]
  - - [2048, 1024, 1, 1]
    - [16, 1.286]
  - - [2048, 1024, 1, 256]
    - [3, 61.666]
  - - [3200, 1024, 1, 2048]
    - [30, 72.111]
  - - [4096, 1024, 1, 1]
    - [22, 1.46]
  - - [1024, 3840, 1, 1024]
    - [20, 73.764]
  - - [1024, 3840, 1, 4096]
    - [20, 75.127]
  - - [1024, 3968, 1, 1024]
    - [30, 76.174]
  - - [1024, 3968, 1, 4096]
    - [20, 77.602]
  - - [1024, 3968, 1, 42720]
    - [8, 79.208]
  - - [1024, 6528, 1, 1024]
    - [10, 74.495]
  - - [1024, 6528, 1, 4096]
    - [21, 77.367]
  - - [1024, 6528, 1, 42720]
    - [23, 79.431]
  - - [1024, 7104, 1, 1024]
    - [10, 74.157]
  - - [1024, 7104, 1, 4096]
    - [20, 76.054]
  - - [1024, 7104, 1, 42720]
    - [13, 80.056]
  - - [1024, 7200, 1, 1024]
    - [30, 74.067]
  - - [1024, 7200, 1, 4096]
    - [20, 77.234]
  - - [1024, 7200, 1, 42720]
    - [13, 80.703]
  - - [1024, 8064, 1, 1024]
    - [10, 78.854]
  - - [1024, 8064, 1, 4096]
    - [20, 80.381]
  - - [1024, 8160, 1, 1024]
    - [30, 75.215]
  - - [1024, 8160, 1, 4096]
    - [10, 75.998]
  - - [1024, 9216, 1, 1024]
    - [21, 80.685]
  - - [1024, 9216, 1, 4096]
    - [21, 82.583]
  - - [1024, 9520, 1, 1024]
    - [30, 77.22]
  - - [1024, 9520, 1, 4096]
    - [20, 78.558]
  - - [1024, 9520, 1, 42720]
    - [23, 82.323]
  - - [1024, 10064, 1, 1024]
    - [21, 77.985]
  - - [1024, 10064, 1, 4096]
    - [21, 80.3]
  - - [1024, 10080, 1, 1024]
    - [21, 78.274]
  - - [1024, 10080, 1, 4096]
    - [21, 80.367]
  - - [1024, 10080, 1, 42720]
    - [13, 82.788]
  - - [1024, 10200, 1, 1024]
    - [21, 78.301]
  - - [1024, 10200, 1, 4096]
    - [21, 81.161]
  - - [4096, 3840, 1, 1024]
    - [25, 79.372]
  - - [4096, 3968, 1, 1024]
    - [20, 79.424]
  - - [4096, 6528, 1, 1024]
    - [10, 80.153]
  - - [4096, 7104, 1, 1024]
    - [15, 80.013]
  - - [4096, 7200, 1, 1024]
    - [20, 79.533]
  - - [4096, 8064, 1, 1024]
    - [10, 81.213]
  - - [4096, 8160, 1, 1024]
    - [20, 80.606]
  - - [4096, 9216, 1, 1024]
    - [17, 81.737]
  - - [4096, 9520, 1, 1024]
    - [15, 80.3]
  - - [4096, 10064, 1, 1024]
    - [15, 80.981]
  - - [4096, 10080, 1, 1024]
    - [20, 80.94]
  - - [4096, 10200, 1, 1024]
    - [20, 81.069]
  - - [1024, 3240, 1, 1024]
    - [20, 70.739]
  - - [1024, 3240, 1, 4096]
    - [21, 74.358]
  - - [1024, 3960, 1, 1024]
    - [30, 74.626]
  - - [1024, 3960, 1, 4096]
    - [20, 77.171]
  - - [1024, 3960, 1, 42720]
    - [1, 79.23]
  - - [4096, 3240, 1, 1024]
    - [20, 76.632]
  - - [4096, 3960, 1, 1024]
    - [20, 79.104]
  - - [289, 128, 64, 768]
    - [15, 50.033]
  - - [289, 160, 64, 768]
    - [2, 41.003]
  - - [289, 192, 64, 768]
    - [2, 49.173]
  - - [3136, 256, 32, 64]
    - [8, 71.299]
  - - [784, 512, 32, 128]
    - [1, 64.527]
  - - [784, 128, 32, 512]
    - [30, 57.845]
  - - [196, 1024, 32, 256]
    - [3, 53.644]
  - - [3136, 128, 64, 64]
    - [29, 70.809]
  - - [3136, 256, 64, 128]
    - [1, 71.136]
  - - [784, 512, 64, 256]
    - [15, 67.597]
  - - [3136, 128, 64, 256]
    - [10, 71.436]
  - - [3136, 256, 64, 256]
    - [3, 76.411]
  - - [196, 1024, 64, 512]
    - [30, 58.65]
  - - [784, 256, 64, 512]
    - [30, 67.601]
  - - [784, 512, 64, 512]
    - [27, 69.505]
  - - [196, 512, 64, 1024]
    - [10, 57.026]
  - - [196, 1024, 64, 1024]
    - [30, 58.506]
  - - [3136, 128, 32, 64]
    - [29, 62.397]
  - - [3136, 256, 32, 128]
    - [1, 77.11]
  - - [784, 512, 32, 256]
    - [15, 66.769]
  - - [3136, 128, 32, 256]
    - [10, 72.84]
  - - [3136, 256, 32, 256]
    - [3, 76.004]
  - - [196, 1024, 32, 512]
    - [10, 55.959]
  - - [784, 256, 32, 512]
    - [20, 64.504]
  - - [784, 512, 32, 512]
    - [20, 68.596]
  - - [196, 512, 32, 1024]
    - [10, 53.191]
  - - [196, 1024, 32, 1024]
    - [20, 57.335]
  - - [7680, 8192, 1, 8192]
    - [21, 82.632]
  - - [3840, 4096, 1, 4096]
    - [30, 80.41]
  - - [1920, 2048, 1, 2048]
    - [30, 74.617]
  - - [8192, 7680, 1, 8192]
    - [5, 82.177]
  - - [4096, 3840, 1, 4096]
    - [10, 80.392]
  - - [2048, 1920, 1, 2048]
    - [20, 74.662]
  - - [8192, 8192, 1, 8192]
    - [11, 82.447]
  - - [4096, 4096, 1, 4096]
    - [10, 80.013]
  - - [2048, 2048, 1, 2048]
    - [11, 71.504]
  - - [1024, 4096, 1, 2]
    - [22, 3.142]
  - - [4096, 512, 1, 1024]
    - [17, 69.029]
  - - [1024, 1280, 1, 2]
    - [16, 1.908]
  - - [1024, 1280, 1, 1024]
    - [24, 55.172]
  - - [1024, 1280, 1, 4096]
    - [9, 56.435]
  - - [4096, 1024, 1, 1024]
    - [10, 70.773]
  - - [4096, 1280, 1, 1024]
    - [10, 77.042]
  - - [1024, 4992, 1, 2]
    - [28, 3.709]
  - - [1024, 4992, 1, 1024]
    - [20, 75.413]
  - - [1024, 4992, 1, 4096]
    - [20, 76.751]
  - - [4096, 4992, 1, 1024]
    - [20, 80.207]
  - - [1024, 5120, 1, 2]
    - [22, 3.673]
  - - [1024, 5120, 1, 1024]
    - [20, 77.387]
  - - [1024, 5120, 1, 4096]
    - [30, 78.576]
  - - [4096, 5120, 1, 1024]
    - [10, 79.964]
  - - [1024, 5248, 1, 2]
    - [22, 3.754]
  - - [1024, 5248, 1, 1024]
    - [30, 73.291]
  - - [1024, 5248, 1, 4096]
    - [30, 74.374]
  - - [4096, 5248, 1, 1024]
    - [3, 79.934]
  - - [1024, 2560, 1, 2]
    - [22, 3.063]
  - - [1024, 2560, 1, 1024]
    - [20, 67.599]
  - - [1024, 2560, 1, 4096]
    - [10, 69.21]
  - - [4096, 2560, 1, 1024]
    - [17, 79.391]
  - - [1024, 3072, 1, 2]
    - [22, 3.113]
  - - [1024, 3072, 1, 1024]
    - [21, 69.523]
  - - [1024, 3072, 1, 4096]
    - [32, 71.297]
  - - [4096, 3072, 1, 1024]
    - [10, 78.175]
  - - [1024, 1152, 1, 2]
    - [16, 1.787]
  - - [1024, 1152, 1, 1024]
    - [20, 66.755]
  - - [1024, 1152, 1, 4096]
    - [20, 70.687]
  - - [4096, 1152, 1, 1024]
    - [20, 77.8]
  - - [479, 32768, 1, 1024]
    - [30, 73.503]
  - - [1024, 8192, 1, 1024]
    - [30, 75.795]
  - - [1024, 8192, 1, 4096]
    - [30, 76.79]
  - - [1024, 8192, 1, 33712]
    - [13, 80.767]
  - - [1024, 9600, 1, 1024]
    - [10, 77.981]
  - - [1024, 9600, 1, 4096]
    - [10, 79.206]
  - - [1024, 9600, 1, 33712]
    - [13, 83.417]
  - - [4096, 8192, 1, 1024]
    - [10, 81.096]
  - - [4096, 9600, 1, 1024]
    - [10, 81.103]
  - - [1024, 1024, 64, 64]
    - [1, 67.48]
  - - [1024, 16384, 1, 3072]
    - [20, 79.878]
  - - [1024, 2048, 1, 30592]
    - [17, 71.698]
  - - [640, 2048, 1, 2560]
    - [24, 55.986]
  - - [1024, 1024, 64, 96]
    - [1, 74.15]
  - - [1536, 4096, 1, 4608]
    - [30, 77.64]
  - - [512, 512, 256, 64]
    - [0, 55.51]
  - - [2048, 1024, 1, 8192]
    - [11, 70.832]
  - - [4096, 16384, 1, 1024]
    - [5, 81.599]
  - - [1024, 8192, 1, 50304]
    - [25, 76.932]
  - - [1536, 8192, 1, 50304]
    - [17, 81.137]
  - - [6144, 8192, 1, 1536]
    - [11, 82.163]
  - - [1024, 4096, 1, 30592]
    - [17, 73.024]
  - - [1536, 4096, 1, 6144]
    - [30, 77.638]
  - - [1024, 16384, 1, 4096]
    - [20, 79.894]
  - - [1024, 16384, 1, 50304]
    - [25, 80.121]
  - - [1024, 4096, 1, 3072]
    - [21, 71.901]
  - - [1536, 8192, 1, 1536]
    - [21, 79.853]
  - - [1024, 2048, 1, 3072]
    - [21, 70.455]
  - - [2560, 2048, 1, 7680]
    - [30, 78.833]
  - - [2048, 1024, 1, 2048]
    - [11, 69.365]
  - - [2048, 1024, 1, 30592]
    - [17, 71.666]
  - - [8192, 1024, 1, 2048]
    - [3, 76.09]
  - - [2560, 2048, 1, 2560]
    - [3, 78.371]
  - - [1536, 8192, 1, 4608]
    - [32, 80.735]
  - - [1024, 2048, 1, 50304]
    - [5, 71.703]
  - - [1024, 1024, 32, 64]
    - [23, 74.279]
  - - [1536, 8192, 1, 6144]
    - [32, 80.638]
  - - [1024, 1024, 256, 64]
    - [0, 53.99]
  - - [512, 512, 40, 64]
    - [31, 60.265]
  - - [1536, 4096, 1, 50304]
    - [3, 77.976]
  - - [1024, 1024, 128, 96]
    - [6, 64.378]
  - - [1024, 8192, 1, 3072]
    - [10, 76.291]
  - - [1024, 1024, 128, 64]
    - [0, 56.363]
  - - [1024, 4096, 1, 50304]
    - [27, 73.232]
  - - [6144, 4096, 1, 1536]
    - [3, 80.767]
  - - [1024, 16384, 1, 1024]
    - [30, 79.255]
  - - [2560, 2048, 1, 1920]
    - [23, 81.567]
  - - [2048, 1024, 1, 6144]
    - [11, 70.696]
  - - [512, 512, 128, 64]
    - [1, 70.929]
  - - [1024, 8192, 1, 30592]
    - [3, 76.753]
  - - [1536, 4096, 1, 1536]
    - [10, 76.659]
  - - [128, 128, 1024, 64]
    - [29, 62.817]
  - - [1024, 8192, 1, 30528]
    - [13, 80.71]
  - - [1024, 3456, 1, 1024]
    - [30, 75.61]
  - - [1024, 3456, 1, 512]
    - [30, 74.29]
  - - [1024, 4096, 1, 512]
    - [21, 69.029]
  - - [1024, 6912, 1, 1024]
    - [21, 80.162]
  - - [1024, 6912, 1, 512]
    - [30, 77.798]
  - - [256, 55296, 1, 128]
    - [1, 78.484]
  - - [256, 6912, 1, 128]
    - [16, 55.296]
  - - [480, 3456, 1, 1024]
    - [31, 61.391]
  - - [480, 4096, 1, 1024]
    - [21, 61.842]
  - - [480, 6912, 1, 1024]
    - [21, 71.069]
  - - [512, 3456, 1, 256]
    - [16, 61.411]
  - - [512, 4096, 1, 256]
    - [17, 62.235]
  - - [512, 55296, 1, 256]
    - [17, 79.4]
  - - [512, 6912, 1, 256]
    - [25, 71.509]
  - - [1024, 1280, 1, 30528]
    - [14, 56.931]
  - - [1024, 1600, 1, 30528]
    - [20, 69.972]
  - - [1024, 10240, 1, 1024]
    - [21, 79.578]
  - - [1024, 10240, 1, 4096]
    - [21, 81.804]
  - - [4096, 10240, 1, 1024]
    - [11, 81.243]
  - - [128, 128, 1280, 64]
    - [20, 64.283]
  - - [1024, 1640, 1, 30528]
    - [20, 71.682]
  - - [1024, 10496, 1, 1024]
    - [10, 76.717]
  - - [1024, 10496, 1, 4096]
    - [20, 77.89]
  - - [4096, 10496, 1, 1024]
    - [3, 81.243]
  - - [128, 128, 1312, 64]
    - [13, 65.034]
  - - [1024, 6144, 1, 4096]
    - [20, 77.541]
  - - [4096, 6144, 1, 1024]
    - [15, 80.426]
  - - [1024, 6144, 1, 1024]
    - [20, 76.499]
  - - [512, 512, 192, 64]
    - [18, 71.159]
  - - [256, 6912, 1, 1]
    - [29, 0.907]
  - - [1024, 10224, 1, 1024]
    - [17, 78.281]
  - - [1024, 10192, 1, 1024]
    - [21, 78.775]
  - - [1024, 10208, 1, 1024]
    - [21, 78.962]
  - - [1024, 10224, 1, 4096]
    - [21, 81.254]
  - - [1024, 10224, 1, 3072]
    - [21, 81.031]
  - - [4096, 10224, 1, 1024]
    - [11, 80.539]
  - - [1024, 10240, 1, 3072]
    - [21, 81.434]
  - - [1024, 10192, 1, 3072]
    - [32, 80.83]
  - - [4096, 10192, 1, 1024]
    - [11, 80.286]
  - - [1024, 10192, 1, 4096]
    - [21, 80.988]
  - - [1024, 10200, 1, 3072]
    - [32, 80.821]
  - - [1024, 10184, 1, 1024]
    - [21, 79.039]
  - - [4096, 10208, 1, 1024]
    - [11, 80.505]
  - - [1024, 10208, 1, 3072]
    - [21, 80.758]
  - - [1024, 10208, 1, 4096]
    - [21, 81.288]
  - - [1024, 10224, 1, 2048]
    - [21, 80.518]
  - - [1024, 10240, 1, 2048]
    - [21, 80.931]
  - - [1024, 10120, 1, 1024]
    - [21, 78.393]
  - - [1024, 10192, 1, 2048]
    - [21, 80.119]
  - - [1024, 10152, 1, 1024]
    - [21, 78.319]
  - - [1024, 10080, 1, 3072]
    - [21, 80.121]
  - - [100352, 512, 1, 256]
    - [15, 78.903]
  - - [12544, 2048, 1, 1024]
    - [17, 81.085]
  - - [200704, 512, 1, 256]
    - [15, 79.206]
  - - [25088, 1024, 1, 512]
    - [17, 80.259]
  - - [50176, 1024, 1, 512]
    - [17, 81.218]
  - - [6272, 2048, 1, 1024]
    - [3, 79.35]
  - - [3136, 128, 128, 256]
    - [30, 65.576]
  - - [3136, 128, 256, 256]
    - [25, 65.544]
  - - [784, 256, 128, 512]
    - [10, 67.597]
  - - [784, 256, 256, 512]
    - [3, 69.018]
  - - [128, 128, 2048, 64]
    - [23, 68.192]
  - - [1024, 2560, 1, 30528]
    - [13, 71.233]
  - - [128, 128, 1536, 64]
    - [13, 67.11]
  - - [1024, 12288, 1, 4096]
    - [21, 80.275]
  - - [1024, 12288, 1, 1024]
    - [21, 78.96]
  - - [4096, 12288, 1, 1024]
    - [11, 81.71]
  - - [1024, 1920, 1, 30528]
    - [17, 67.211]
  - - [128, 128, 192, 64]
    - [7, 43.089]
  - - [768, 2048, 1, 2]
    - [22, 2.111]
  - - [3072, 2048, 1, 768]
    - [3, 76.438]
  - - [768, 2048, 1, 3072]
    - [20, 66.343]
  - - [768, 2048, 1, 768]
    - [3, 63.667]
  - - [384, 384, 144, 64]
    - [8, 72.609]
  - - [768, 4608, 1, 2]
    - [7, 3.194]
  - - [3072, 4608, 1, 768]
    - [17, 81.723]
  - - [768, 4608, 1, 3072]
    - [21, 79.713]
  - - [768, 4608, 1, 768]
    - [17, 77.848]
  - - [512, 512, 48, 64]
    - [8, 65.727]
  - - [128, 128, 256, 64]
    - [0, 49.392]
  - - [384, 384, 192, 64]
    - [8, 74.344]
  - - [1024, 4608, 1, 2]
    - [22, 3.67]
  - - [4096, 4608, 1, 1024]
    - [17, 80.909]
  - - [1024, 4608, 1, 4096]
    - [21, 81.107]
  - - [1024, 4608, 1, 1024]
    - [21, 78.917]
  - - [8192, 1024, 1, 1024]
    - [10, 75.937]
  - - [8192, 4096, 1, 1024]
    - [3, 81.258]
  - - [196, 1024, 128, 256]
    - [3, 57.655]
  - - [196, 1024, 256, 256]
    - [3, 54.569]
  - - [196, 256, 128, 1024]
    - [10, 57.177]
  - - [196, 256, 256, 1024]
    - [20, 54.427]
  - - [196, 512, 128, 1024]
    - [20, 56.956]
  - - [196, 512, 256, 1024]
    - [30, 58.303]
  - - [3072, 256, 2, 1024]
    - [10, 62.794]
  - - [768, 2048, 2, 512]
    - [32, 67.583]
  - - [2904, 256, 2, 1024]
    - [3, 59.054]
  - - [864, 2048, 2, 512]
    - [25, 63.746]
  - - [2992, 256, 2, 1024]
    - [3, 61.736]
  - - [3400, 256, 2, 1024]
    - [26, 65.048]
  - - [4032, 256, 2, 1024]
    - [5, 64.899]
  - - [15200, 128, 2, 512]
    - [3, 67.971]
  - - [12288, 128, 2, 512]
    - [3, 67.283]
  - - [888, 2048, 2, 512]
    - [25, 65.6]
  - - [13600, 128, 2, 512]
    - [3, 69.765]
  - - [12880, 128, 2, 512]
    - [3, 65.819]
  - - [3456, 256, 2, 1024]
    - [16, 67.162]
  - - [2944, 256, 2, 1024]
    - [3, 61.802]
  - - [2688, 256, 2, 1024]
    - [2, 57.908]
  - - [13824, 128, 2, 512]
    - [20, 75.138]
  - - [3168, 256, 2, 1024]
    - [10, 63.744]
  - - [3360, 256, 2, 1024]
    - [26, 64.45]
  - - [3552, 256, 2, 1024]
    - [17, 57.597]
  - - [11616, 128, 2, 512]
    - [20, 60.173]
  - - [4200, 256, 2, 1024]
    - [10, 68.328]
  - - [840, 2048, 2, 512]
    - [25, 61.689]
  - - [14208, 128, 2, 512]
    - [3, 67.583]
  - - [11968, 128, 2, 512]
    - [15, 62.192]
  - - [3264, 256, 2, 1024]
    - [25, 65.788]
  - - [13600, 256, 2, 512]
    - [25, 74.633]
  - - [12880, 256, 2, 512]
    - [17, 71.937]
  - - [12288, 256, 2, 512]
    - [3, 75.538]
  - - [2816, 256, 2, 1024]
    - [24, 60.577]
  - - [672, 2048, 2, 512]
    - [17, 57.405]
  - - [13440, 128, 2, 512]
    - [3, 73.347]
  - - [13824, 256, 2, 512]
    - [3, 78.154]
  - - [15200, 256, 2, 512]
    - [17, 73.69]
  - - [3600, 256, 2, 1024]
    - [17, 58.567]
  - - [4032, 1024, 2, 256]
    - [3, 70.606]
  - - [16128, 128, 2, 512]
    - [10, 68.991]
  - - [15200, 128, 1, 512]
    - [24, 56.832]
  - - [13600, 128, 1, 512]
    - [16, 60.89]
  - - [2904, 1024, 2, 256]
    - [3, 66.69]
  - - [2992, 1024, 2, 256]
    - [3, 69.823]
  - - [1536, 2048, 1, 1024]
    - [21, 69.697]
  - - [24576, 128, 1, 256]
    - [3, 64.558]
  - - [24576, 512, 1, 256]
    - [13, 76.106]
  - - [25760, 128, 1, 256]
    - [15, 59.654]
  - - [25760, 512, 1, 256]
    - [25, 74.441]
  - - [6144, 256, 1, 512]
    - [3, 61.79]
  - - [6440, 256, 1, 512]
    - [4, 60.874]
  - - [13600, 512, 1, 128]
    - [1, 67.881]
  - - [9408, 512, 2, 128]
    - [1, 71.328]
  - - [56000, 256, 2, 64]
    - [1, 71.495]
  - - [2816, 1024, 2, 256]
    - [23, 73.882]
  - - [60800, 256, 1, 64]
    - [13, 72.255]
  - - [2944, 1024, 2, 256]
    - [15, 70.742]
  - - [11776, 512, 2, 128]
    - [13, 75.826]
  - - [11616, 512, 2, 128]
    - [1, 72.063]
  - - [4200, 1024, 2, 256]
    - [10, 73.397]
  - - [54400, 256, 1, 64]
    - [1, 71.348]
  - - [15200, 512, 1, 128]
    - [8, 66.839]
  - - [2688, 1024, 2, 256]
    - [3, 70.46]
  - - [12672, 512, 2, 128]
    - [23, 78.781]
  - - [11968, 512, 2, 128]
    - [1, 74.218]
  - - [46464, 256, 2, 64]
    - [23, 74.601]
  - - [2400, 256, 2, 1024]
    - [2, 51.628]
  - - [2520, 256, 2, 1024]
    - [2, 53.394]
  - - [2400, 1024, 2, 256]
    - [10, 67.231]
  - - [10752, 128, 2, 512]
    - [3, 69.293]
  - - [45632, 256, 2, 64]
    - [1, 69.981]
  - - [2520, 1024, 2, 256]
    - [3, 69.183]
  - - [53760, 256, 2, 64]
    - [1, 72.97]
  - - [2352, 256, 2, 1024]
    - [2, 49.816]
  - - [47872, 256, 2, 64]
    - [8, 74.218]
  - - [47104, 256, 2, 64]
    - [1, 72.33]
  - - [50688, 256, 2, 64]
    - [8, 72.925]
  - - [45056, 256, 2, 64]
    - [1, 71.903]
  - - [13440, 512, 2, 128]
    - [23, 77.435]
  - - [2352, 1024, 2, 256]
    - [10, 64.752]
  - - [11264, 512, 2, 128]
    - [18, 76.354]
  - - [10560, 128, 2, 512]
    - [10, 64.22]
  - - [16128, 512, 2, 128]
    - [23, 79.533]
  - - [37632, 256, 2, 64]
    - [1, 73.591]
  - - [51520, 256, 2, 64]
    - [1, 72.986]
  - - [14000, 512, 2, 128]
    - [1, 73.92]
  - - [10560, 512, 2, 128]
    - [1, 74.732]
  - - [64512, 256, 2, 64]
    - [8, 73.841]
  - - [54400, 256, 2, 64]
    - [1, 75.276]
  - - [3264, 1024, 2, 256]
    - [3, 70.446]
  - - [10752, 512, 2, 128]
    - [13, 76.02]
  - - [3168, 1024, 2, 256]
    - [10, 69.027]
  - - [55296, 256, 2, 256]
    - [3, 78.651]
  - - [51520, 256, 2, 256]
    - [15, 77.367]
  - - [11408, 128, 2, 512]
    - [4, 64.594]
  - - [60800, 256, 2, 256]
    - [25, 78.89]
  - - [54400, 256, 2, 256]
    - [5, 78.809]
  - - [60800, 256, 2, 64]
    - [23, 76.097]
  - - [3800, 1024, 1, 256]
    - [3, 65.939]
  - - [3400, 1024, 1, 256]
    - [20, 66.052]
  - - [3072, 1024, 2, 256]
    - [3, 73.37]
  - - [3600, 1024, 2, 256]
    - [3, 70.963]
  - - [12288, 512, 2, 128]
    - [13, 75.693]
  - - [49152, 256, 2, 256]
    - [3, 78.515]
  - - [12880, 512, 2, 128]
    - [8, 73.435]
  - - [11408, 512, 2, 128]
    - [1, 74.037]
  - - [42240, 256, 2, 64]
    - [1, 73.99]
  - - [1008, 2048, 2, 512]
    - [10, 66.771]
  - - [3360, 1024, 2, 256]
    - [10, 70.762]
  - - [14208, 512, 2, 128]
    - [13, 78.583]
  - - [56832, 256, 2, 64]
    - [8, 73.521]
  - - [43008, 256, 2, 64]
    - [8, 71.569]
  - - [13600, 512, 2, 128]
    - [1, 74.328]
  - - [2640, 1024, 2, 256]
    - [3, 67.033]
  - - [13824, 512, 2, 128]
    - [18, 78.005]
  - - [3800, 256, 2, 1024]
    - [17, 61.515]
  - - [55296, 256, 2, 64]
    - [8, 73.094]
  - - [2640, 256, 2, 1024]
    - [2, 55.997]
  - - [15200, 512, 2, 128]
    - [1, 74.583]
  - - [3552, 1024, 2, 256]
    - [10, 72.357]
  - - [3456, 1024, 2, 256]
    - [25, 75.862]
  - - [49152, 256, 2, 64]
    - [8, 71.86]
  - - [3400, 1024, 2, 256]
    - [10, 71.4]
  - - [3800, 1024, 2, 256]
    - [3, 71.001]
  - - [6912, 256, 1, 512]
    - [16, 64.797]
  - - [6800, 256, 1, 512]
    - [4, 62.557]
  - - [27648, 128, 1, 256]
    - [15, 71.61]
  - - [27200, 128, 1, 256]
    - [25, 63.227]
  - - [30400, 128, 1, 256]
    - [10, 62.422]
  - - [7600, 256, 1, 512]
    - [2, 57.619]
  - - [6144, 1024, 1, 512]
    - [3, 75.82]
  - - [6912, 1024, 1, 512]
    - [3, 78.154]
  - - [6440, 1024, 1, 512]
    - [5, 72.17]
  - - [27648, 512, 1, 256]
    - [30, 77.915]
  - - [1728, 2048, 1, 1024]
    - [25, 65.652]
  - - [27200, 512, 1, 256]
    - [27, 74.773]
  - - [6800, 1024, 1, 512]
    - [10, 74.786]
  - - [7600, 1024, 1, 512]
    - [15, 73.126]
  - - [30400, 512, 1, 256]
    - [25, 74.694]
  - - [12544, 1024, 1, 1024]
    - [3, 79.691]
  - - [173280, 128, 1, 64]
    - [23, 69.343]
  - - [231040, 128, 1, 64]
    - [8, 75.276]
  - - [25992, 128, 1, 64]
    - [7, 46.274]
  - - [2852, 256, 2, 1024]
    - [3, 57.797]
  - - [3220, 256, 2, 1024]
    - [3, 64.136]
  - - [850, 2048, 2, 512]
    - [10, 62.733]
  - - [805, 2048, 2, 512]
    - [20, 59.284]
  - - [3036, 256, 2, 1024]
    - [10, 62.6]
  - - [713, 2048, 2, 512]
    - [17, 60.755]
  - - [850, 2048, 1, 512]
    - [10, 53.36]
  - - [660, 2048, 2, 512]
    - [17, 56.137]
  - - [726, 2048, 2, 512]
    - [17, 61.463]
  - - [3500, 256, 2, 1024]
    - [10, 56.769]
  - - [3700, 256, 2, 1024]
    - [5, 59.539]
  - - [748, 2048, 2, 512]
    - [30, 63.417]
  - - [3036, 1024, 2, 256]
    - [3, 70.599]
  - - [2852, 1024, 2, 256]
    - [3, 68.587]
  - - [950, 2048, 1, 512]
    - [11, 58.007]
  - - [3700, 1024, 2, 256]
    - [3, 72.691]
  - - [3500, 1024, 2, 256]
    - [3, 69.972]
  - - [3220, 1024, 2, 256]
    - [10, 68.718]
  - - [950, 2048, 2, 512]
    - [10, 62.823]
  - - [1610, 2048, 1, 1024]
    - [20, 70.083]
  - - [1700, 2048, 1, 1024]
    - [10, 64.339]
  - - [1900, 2048, 1, 1024]
    - [10, 71.736]
  - - [1444, 256, 120, 128]
    - [3, 69.902]
  - - [1444, 256, 139, 128]
    - [3, 64.795]
  - - [1444, 256, 160, 128]
    - [2, 59.178]
  - - [1444, 256, 18, 128]
    - [8, 62.79]
  - - [1444, 256, 19, 128]
    - [13, 66.018]
  - - [1444, 256, 120, 256]
    - [3, 72.086]
  - - [1444, 256, 139, 256]
    - [3, 72.061]
  - - [1444, 256, 160, 256]
    - [3, 72.485]
  - - [1444, 256, 18, 256]
    - [25, 65.934]
  - - [1444, 256, 19, 256]
    - [15, 67.874]
  - - [361, 256, 120, 512]
    - [20, 72.695]
  - - [361, 256, 139, 512]
    - [30, 71.161]
  - - [361, 256, 160, 512]
    - [10, 72.086]
  - - [361, 256, 18, 512]
    - [31, 57.215]
  - - [361, 256, 19, 512]
    - [10, 52.46]
  - - [200716, 128, 1, 64]
    - [18, 69.435]
  - - [27436, 128, 1, 64]
    - [2, 45.677]
  - - [1024, 1024, 160, 96]
    - [12, 64.669]
  - - [1920, 16384, 1, 25216]
    - [1, 85.675]
  - - [3840, 16384, 1, 1920]
    - [23, 87.392]
  - - [1920, 16384, 1, 3840]
    - [27, 82.49]
  - - [960, 16384, 1, 1920]
    - [23, 79.3]
  - - [1920, 16384, 1, 2880]
    - [23, 86.551]
  - - [1024, 1024, 40, 96]
    - [23, 79.246]
  - - [1920, 4096, 1, 25216]
    - [13, 80.471]
  - - [3840, 4096, 1, 1920]
    - [23, 85.005]
  - - [1920, 4096, 1, 3840]
    - [5, 78.608]
  - - [960, 4096, 1, 1920]
    - [13, 68.244]
  - - [1920, 4096, 1, 2880]
    - [23, 81.103]
  - - [1024, 1024, 80, 96]
    - [1, 70.974]
  - - [1920, 8192, 1, 25216]
    - [1, 84.796]
  - - [3840, 8192, 1, 1920]
    - [23, 86.332]
  - - [1920, 8192, 1, 3840]
    - [25, 80.478]
  - - [960, 8192, 1, 1920]
    - [13, 75.312]
  - - [1920, 8192, 1, 2880]
    - [23, 85.635]
  - - [1024, 1024, 96, 96]
    - [1, 65.916]
  - - [2304, 16384, 1, 12672]
    - [23, 86.797]
  - - [2304, 16384, 1, 2304]
    - [27, 83.708]
  - - [576, 16384, 1, 2304]
    - [11, 71.673]
  - - [2304, 16384, 1, 1728]
    - [23, 87.439]
  - - [1024, 1024, 24, 96]
    - [23, 77.437]
  - - [2304, 4096, 1, 12672]
    - [23, 84.43]
  - - [2304, 4096, 1, 2304]
    - [17, 82.544]
  - - [576, 4096, 1, 2304]
    - [3, 61.601]
  - - [2304, 4096, 1, 1728]
    - [23, 85.235]
  - - [1024, 1024, 48, 96]
    - [23, 80.194]
  - - [2304, 8192, 1, 12672]
    - [23, 86.07]
  - - [2304, 8192, 1, 2304]
    - [17, 83.41]
  - - [576, 8192, 1, 2304]
    - [10, 70.232]
  - - [2304, 8192, 1, 1728]
    - [1, 86.675]
  - - [1024, 1024, 16, 96]
    - [23, 76.043]
  - - [3072, 4096, 1, 6400]
    - [17, 81.085]
  - - [1536, 4096, 1, 3072]
    - [20, 77.475]
  - - [3072, 4096, 1, 1536]
    - [21, 79.896]
  - - [384, 4096, 1, 3072]
    - [30, 66.334]
  - - [3072, 4096, 1, 1152]
    - [23, 83.122]
  - - [1024, 1024, 32, 96]
    - [23, 79.088]
  - - [3072, 8192, 1, 6400]
    - [15, 81.292]
  - - [1536, 8192, 1, 3072]
    - [21, 80.261]
  - - [3072, 8192, 1, 1536]
    - [25, 80.859]
  - - [384, 8192, 1, 3072]
    - [21, 71.089]
  - - [3072, 8192, 1, 1152]
    - [23, 86.034]
  - - [2048, 4096, 1, 2048]
    - [20, 76.341]
  - - [2048, 4096, 1, 4096]
    - [10, 76.508]
  - - [4096, 4096, 1, 2048]
    - [10, 79.774]
  - - [1024, 2283, 1, 29000]
    - [5, 79.334]
  - - [1024, 2296, 1, 29000]
    - [17, 79.824]
  - - [1024, 2306, 1, 29000]
    - [1, 64.479]
  - - [1024, 2309, 1, 29000]
    - [1, 64.509]
  - - [1024, 2318, 1, 29000]
    - [1, 64.669]
  - - [1024, 2320, 1, 29000]
    - [1, 64.705]
  - - [1024, 2324, 1, 29000]
    - [1, 64.833]
  - - [1024, 2325, 1, 29000]
    - [1, 64.899]
  - - [1024, 2329, 1, 29000]
    - [1, 64.89]
  - - [1024, 2338, 1, 29000]
    - [8, 65.12]
  - - [1024, 2345, 1, 29000]
    - [18, 65.242]
  - - [1024, 2350, 1, 29000]
    - [13, 65.323]
  - - [1024, 2362, 1, 29000]
    - [13, 65.858]
  - - [1024, 2366, 1, 29000]
    - [18, 65.853]
  - - [1024, 2368, 1, 29000]
    - [23, 65.898]
  - - [1024, 2374, 1, 29000]
    - [23, 66.374]
  - - [1024, 2390, 1, 29000]
    - [23, 66.787]
  - - [512, 512, 320, 64]
    - [0, 62.485]
  - - [512, 512, 80, 64]
    - [8, 66.868]
  - - [2560, 1024, 1, 2560]
    - [15, 68.939]
  - - [2560, 1024, 1, 4096]
    - [20, 69.056]
  - - [4096, 1024, 1, 2560]
    - [3, 70.676]
  - - [1024, 1024, 512, 64]
    - [2, 51.152]
  - - [1024, 32768, 1, 3072]
    - [20, 81.547]
  - - [1024, 32768, 1, 4096]
    - [20, 81.493]
  - - [1024, 32768, 1, 50304]
    - [17, 82.517]
  - - [4096, 32768, 1, 1024]
    - [255, 82.154]
  - - [1024, 1024, 24, 128]
    - [23, 79.503]
  - - [128, 1024, 24, 1024]
    - [21, 69.088]
  - - [1024, 780, 1, 30522]
    - [38, 61.084]
  - - [1024, 308, 1, 30522]
    - [39, 53.013]
  - - [1024, 800, 1, 30522]
    - [38, 62.781]
  - - [1024, 820, 1, 30522]
    - [33, 64.357]
  - - [1024, 385, 1, 30522]
    - [36, 51.515]
  - - [1024, 462, 1, 30522]
    - [36, 61.039]
  - - [1024, 640, 1, 30528]
    - [33, 69.808]
  - - [2048, 199, 1, 29000]
    - [35, 51.925]
  - - [2048, 221, 1, 29000]
    - [35, 57.574]
  - - [2048, 224, 1, 29000]
    - [36, 58.361]
  - - [2048, 229, 1, 29000]
    - [35, 59.431]
  - - [2048, 234, 1, 29000]
    - [40, 60.647]
  - - [2048, 242, 1, 29000]
    - [35, 62.652]
  - - [2048, 246, 1, 29000]
    - [37, 63.631]
  - - [2048, 247, 1, 29000]
    - [40, 63.836]
  - - [2048, 256, 1, 29000]
    - [36, 68.45]
  - - [2048, 262, 1, 29000]
    - [34, 51.555]
  - - [2048, 264, 1, 29000]
    - [34, 51.989]
  - - [2048, 265, 1, 29000]
    - [34, 52.16]
  - - [2048, 274, 1, 29000]
    - [34, 53.895]
  - - [2048, 277, 1, 29000]
    - [34, 54.429]
  - - [2048, 279, 1, 29000]
    - [34, 54.874]
  - - [2048, 288, 1, 29000]
    - [34, 56.532]
  - - [2048, 296, 1, 29000]
    - [34, 58.07]
  - - [2048, 315, 1, 29000]
    - [34, 61.621]
  - - [2048, 335, 1, 29000]
    - [35, 59.451]
  - - [1024, 561, 1, 29000]
    - [34, 62.348]
  - - [1024, 574, 1, 29000]
    - [39, 63.762]
  - - [1024, 600, 1, 29000]
    - [41, 65.404]
  - - [1024, 608, 1, 29000]
    - [33, 66.146]
  - - [1024, 615, 1, 29000]
    - [33, 66.997]
  - - [1024, 622, 1, 29000]
    - [43, 67.504]
  - - [1024, 625, 1, 29000]
    - [41, 67.784]
  - - [1024, 626, 1, 29000]
    - [33, 68.109]
  - - [1024, 628, 1, 29000]
    - [33, 68.066]
  - - [1024, 636, 1, 29000]
    - [33, 69.034]
  - - [1024, 651, 1, 29000]
    - [36, 59.174]
  - - [1024, 658, 1, 29000]
    - [41, 59.832]
  - - [1024, 669, 1, 29000]
    - [36, 60.757]
  - - [1024, 670, 1, 29000]
    - [41, 60.863]
  - - [1024, 672, 1, 29000]
    - [41, 61.066]
  - - [1024, 684, 1, 29000]
    - [41, 62.081]
  - - [1024, 716, 1, 29000]
    - [40, 64.831]
  - - [1024, 730, 1, 29000]
    - [42, 65.867]
  - - [1024, 1024, 1, 3328]
    - [70, 59.71]
  - - [128, 6784, 1, 3328]
    - [70, 50.1]
  - - [256, 4288, 1, 3328]
    - [48, 61.436]
  - - [704, 1856, 1, 3328]
    - [47, 55.889]
  - - [448, 1024, 1, 1280]
    - [59, 43.261]
  - - [1024, 704, 1, 256]
    - [69, 40.655]
  - - [256, 1856, 1, 1280]
    - [69, 44.894]
  - - [256, 2944, 1, 3328]
    - [47, 52.14]
  - - [128, 3584, 1, 1280]
    - [77, 44.601]
  - - [4288, 256, 1, 256]
    - [54, 49.142]
  - - [5888, 64, 1, 3328]
    - [57, 37.56]
  - - [2944, 256, 1, 3328]
    - [61, 52.575]
  - - [1408, 448, 1, 1280]
    - [69, 42.636]
  - - [1408, 256, 1, 1280]
    - [70, 35.913]
  - - [6784, 64, 1, 256]
    - [69, 31.42]
  - - [2368, 128, 1, 3328]
    - [70, 31.729]
  - - [2944, 128, 1, 256]
    - [51, 27.758]
  - - [448, 1408, 1, 256]
    - [68, 34.045]
  - - [64, 5056, 1, 3328]
    - [52, 31.672]
  - - [256, 3584, 1, 3328]
    - [70, 52.961]
  - - [256, 1408, 1, 256]
    - [74, 27.104]
  - - [5056, 64, 1, 1280]
    - [46, 31.104]
  - - [2368, 128, 1, 256]
    - [46, 22.047]
  - - [4288, 128, 1, 1280]
    - [70, 51.589]
  - - [5888, 64, 1, 256]
    - [45, 27.339]
  - - [1856, 256, 1, 1280]
    - [70, 44.747]
  - - [64, 5888, 1, 3328]
    - [52, 36.674]
  - - [1024, 704, 1, 1280]
    - [69, 48.521]
  - - [256, 1408, 1, 3328]
    - [70, 38.494]
  - - [6784, 128, 1, 3328]
    - [48, 50.17]
  - - [704, 704, 1, 3328]
    - [70, 51.208]
  - - [3584, 256, 1, 3328]
    - [59, 52.97]
  - - [128, 3584, 1, 3328]
    - [77, 48.156]
  - - [128, 2944, 1, 1280]
    - [64, 36.784]
  - - [448, 1856, 1, 1280]
    - [46, 49.239]
  - - [3584, 128, 1, 256]
    - [45, 32.548]
  - - [448, 1408, 1, 3328]
    - [47, 43.367]
  - - [704, 1024, 1, 256]
    - [57, 38.835]
  - - [256, 3584, 1, 256]
    - [59, 44.826]
  - - [1408, 704, 1, 256]
    - [47, 45.943]
  - - [448, 2944, 1, 3328]
    - [59, 51.019]
  - - [64, 5888, 1, 256]
    - [52, 26.603]
  - - [448, 2368, 1, 1280]
    - [46, 47.908]
  - - [704, 704, 1, 256]
    - [57, 33.36]
  - - [128, 4288, 1, 3328]
    - [70, 56.663]
  - - [256, 2368, 1, 256]
    - [67, 34.799]
  - - [1024, 448, 1, 3328]
    - [59, 47.583]
  - - [1856, 704, 1, 1280]
    - [58, 54.475]
  - - [1024, 1024, 1, 1280]
    - [59, 59.045]
  - - [256, 2944, 1, 256]
    - [45, 42.67]
  - - [128, 6784, 1, 1280]
    - [59, 48.801]
  - - [1408, 704, 1, 3328]
    - [70, 56.694]
  - - [128, 5888, 1, 1280]
    - [69, 50.563]
  - - [704, 1408, 1, 3328]
    - [48, 56.694]
  - - [448, 704, 1, 1280]
    - [52, 29.917]
  - - [6784, 128, 1, 256]
    - [48, 42.426]
  - - [704, 448, 1, 256]
    - [57, 22.881]
  - - [256, 1856, 1, 3328]
    - [48, 49.433]
  - - [1024, 704, 1, 3328]
    - [69, 49.945]
  - - [128, 4288, 1, 256]
    - [51, 38.654]
  - - [64, 6784, 1, 3328]
    - [52, 38.575]
  - - [2944, 256, 1, 1280]
    - [69, 50.728]
  - - [1856, 704, 1, 256]
    - [69, 46.926]
  - - [704, 1856, 1, 256]
    - [47, 48.124]
  - - [2944, 448, 1, 256]
    - [69, 51.05]
  - - [2368, 128, 1, 1280]
    - [62, 28.922]
  - - [64, 6784, 1, 256]
    - [52, 29.222]
  - - [64, 5056, 1, 1280]
    - [62, 30.102]
  - - [704, 448, 1, 3328]
    - [59, 32.996]
  - - [2368, 256, 1, 1280]
    - [74, 40.276]
  - - [2368, 448, 1, 1280]
    - [47, 53.759]
  - - [128, 3584, 1, 256]
    - [61, 32.789]
  - - [1856, 448, 1, 3328]
    - [58, 56.728]
  - - [128, 5056, 1, 256]
    - [63, 36.353]
  - - [4288, 256, 1, 1280]
    - [48, 59.492]
  - - [4288, 128, 1, 3328]
    - [59, 56.884]
  - - [448, 2368, 1, 3328]
    - [46, 48.713]
  - - [256, 1408, 1, 1280]
    - [59, 35.963]
  - - [128, 2368, 1, 256]
    - [69, 22.047]
  - - [6784, 64, 1, 3328]
    - [47, 43.026]
  - - [128, 2944, 1, 3328]
    - [77, 39.723]
  - - [2944, 448, 1, 3328]
    - [69, 56.71]
  - - [5888, 128, 1, 256]
    - [45, 43.265]
  - - [5056, 64, 1, 256]
    - [57, 23.477]
  - - [128, 5056, 1, 3328]
    - [47, 44.847]
  - - [256, 4288, 1, 1280]
    - [48, 59.424]
  - - [4288, 128, 1, 256]
    - [57, 36.942]
  - - [3584, 256, 1, 256]
    - [59, 44.377]
  - - [128, 2944, 1, 256]
    - [69, 27.271]
  - - [3584, 128, 1, 3328]
    - [59, 48.427]
  - - [5888, 128, 1, 3328]
    - [47, 52.063]
  - - [1408, 704, 1, 1280]
    - [70, 54.831]
  - - [448, 1408, 1, 1280]
    - [47, 41.603]
  - - [704, 1408, 1, 1280]
    - [48, 54.914]
  - - [448, 2944, 1, 256]
    - [46, 45.884]
  - - [448, 2368, 1, 256]
    - [68, 43.698]
  - - [64, 6784, 1, 1280]
    - [52, 37.025]
  - - [128, 2368, 1, 3328]
    - [70, 31.675]
  - - [5056, 64, 1, 3328]
    - [68, 32.766]
  - - [5056, 128, 1, 3328]
    - [61, 45.011]
  - - [448, 704, 1, 256]
    - [46, 22.71]
  - - [1856, 256, 1, 3328]
    - [70, 49.406]
  - - [2944, 128, 1, 3328]
    - [48, 40.003]
  - - [1024, 1024, 1, 256]
    - [59, 51.145]
  - - [704, 1024, 1, 1280]
    - [58, 47.524]
  - - [256, 4288, 1, 256]
    - [47, 50.635]
  - - [2368, 256, 1, 256]
    - [57, 33.026]
  - - [256, 2368, 1, 3328]
    - [47, 42.101]
  - - [704, 448, 1, 1280]
    - [75, 29.976]
  - - [256, 1856, 1, 256]
    - [74, 35.178]
  - - [64, 5056, 1, 256]
    - [52, 22.845]
  - - [1408, 256, 1, 3328]
    - [59, 38.429]
  - - [2368, 448, 1, 256]
    - [47, 44.849]
  - - [4288, 256, 1, 3328]
    - [70, 62.386]
  - - [2944, 256, 1, 256]
    - [45, 42.839]
  - - [6784, 64, 1, 1280]
    - [69, 40.971]
  - - [704, 1856, 1, 1280]
    - [47, 54.743]
  - - [448, 1024, 1, 3328]
    - [59, 47.583]
  - - [2944, 448, 1, 1280]
    - [69, 55.957]
  - - [448, 1024, 1, 256]
    - [68, 31.169]
  - - [1024, 448, 1, 1280]
    - [56, 43.746]
  - - [256, 2368, 1, 1280]
    - [47, 40.955]
  - - [128, 5056, 1, 1280]
    - [47, 43.498]
  - - [1408, 256, 1, 256]
    - [74, 26.824]
  - - [128, 5888, 1, 3328]
    - [69, 52.081]
  - - [2368, 448, 1, 3328]
    - [58, 55.309]
  - - [3584, 128, 1, 1280]
    - [48, 44.63]
  - - [1408, 448, 1, 256]
    - [67, 36.211]
  - - [2368, 256, 1, 3328]
    - [61, 41.898]
  - - [5888, 128, 1, 1280]
    - [47, 50.633]
  - - [256, 3584, 1, 1280]
    - [59, 51.783]
  - - [128, 5888, 1, 256]
    - [74, 42.011]
  - - [1408, 448, 1, 3328]
    - [69, 43.816]
  - - [64, 5888, 1, 1280]
    - [62, 34.831]
  - - [704, 704, 1, 1280]
    - [70, 46.554]
  - - [128, 2368, 1, 1280]
    - [46, 28.789]
  - - [3584, 256, 1, 1280]
    - [70, 51.765]
  - - [5888, 64, 1, 1280]
    - [57, 35.769]
  - - [5056, 128, 1, 1280]
    - [51, 43.317]
  - - [448, 1856, 1, 3328]
    - [68, 50.317]
  - - [1024, 448, 1, 256]
    - [56, 33.283]
  - - [2944, 128, 1, 1280]
    - [48, 37.111]
  - - [256, 2944, 1, 1280]
    - [69, 50.703]
  - - [704, 1024, 1, 3328]
    - [58, 49.471]
  - - [1856, 448, 1, 1280]
    - [45, 54.344]
  - - [128, 6784, 1, 256]
    - [54, 41.93]
  - - [704, 1408, 1, 256]
    - [54, 45.002]
  - - [448, 2944, 1, 1280]
    - [59, 49.717]
  - - [1856, 256, 1, 256]
    - [46, 32.13]
  - - [5056, 128, 1, 256]
    - [46, 34.864]
  - - [6784, 128, 1, 1280]
    - [48, 49.106]
  - - [1856, 448, 1, 256]
    - [57, 42.873]
  - - [128, 4288, 1, 1280]
    - [47, 51.357]
  - - [448, 704, 1, 3328]
    - [70, 32.868]
  - - [448, 1856, 1, 256]
    - [46, 42.494]
  - - [1856, 704, 1, 3328]
    - [58, 55.945]
  - - [64, 193600, 1, 64]
    - [52, 49.225]
  - - [1024, 700, 1, 512]
    - [69, 42.027]
  - - [2560, 128, 1, 2560]
    - [59, 34.332]
  - - [64, 193600, 1, 256]
    - [75, 48.361]
  - - [4096, 128, 1, 4096]
    - [77, 54.116]
  - - [512, 1500, 1, 2816]
    - [69, 51.957]
  - - [3072, 128, 1, 1024]
    - [59, 37.104]
  - - [7680, 64, 1, 2560]
    - [58, 48.142]
  - - [7680, 128, 1, 2560]
    - [48, 56.009]
  - - [512, 1500, 1, 2560]
    - [69, 51.765]
  - - [1024, 1024, 1, 1024]
    - [59, 58.395]
  - - [512, 1500, 1, 2048]
    - [53, 50.863]
  - - [512, 1500, 1, 1536]
    - [69, 50.804]
  - - [3136, 64, 128, 64]
    - [73, 63.575]
  - - [3136, 64, 64, 256]
    - [58, 64.236]
  - - [3136, 64, 128, 256]
    - [49, 43.087]
  - - [3136, 64, 256, 64]
    - [44, 34.713]
  - - [3136, 64, 64, 64]
    - [66, 60.29]
  - - [3136, 64, 256, 256]
    - [72, 43.662]
  - - [64, 128, 512, 128]
    - [57, 36.701]
  - - [64, 512, 64, 512]
    - [78, 38.05]
  - - [512, 1600, 1, 32]
    - [66, 17.496]
  - - [512, 1600, 1, 512]
    - [69, 50.761]
  - - [560, 1600, 1, 1024]
    - [54, 48.359]
  - - [1024, 512, 1, 1]
    - [66, 0.465]
  - - [1024, 512, 1, 64]
    - [66, 19.509]
  - - [1024, 512, 1, 1024]
    - [59, 50.335]
  - - [1024, 960, 1, 64]
    - [66, 30.068]
  - - [1024, 960, 1, 1024]
    - [70, 53.08]
  - - [1600, 512, 1, 1024]
    - [58, 52.334]
  - - [2048, 512, 1, 1]
    - [66, 0.896]
  - - [2048, 512, 1, 2048]
    - [59, 59.485]
  - - [64, 192, 64, 1280]
    - [52, 46.099]
  - - [64, 320, 64, 1280]
    - [62, 48.571]
  - - [64, 384, 64, 1280]
    - [62, 46.523]
  - - [64, 448, 64, 1280]
    - [52, 41.169]
  - - [64, 192, 64, 2048]
    - [52, 46.737]
  - - [64, 320, 64, 2048]
    - [75, 46.992]
  - - [64, 384, 64, 2048]
    - [75, 42.841]
  - - [64, 448, 64, 2048]
    - [78, 39.552]
  - - [1225, 64, 64, 192]
    - [47, 58.991]
  - - [1225, 64, 64, 256]
    - [47, 60.367]
  - - [1225, 64, 64, 288]
    - [69, 60.435]
  - - [5329, 80, 64, 64]
    - [58, 39.033]
  - - [64, 192, 32, 1280]
    - [52, 36.044]
  - - [64, 320, 32, 1280]
    - [75, 40.732]
  - - [64, 384, 32, 1280]
    - [52, 46.062]
  - - [64, 448, 32, 1280]
    - [75, 42.69]
  - - [64, 192, 32, 2048]
    - [75, 36.94]
  - - [64, 320, 32, 2048]
    - [52, 41.578]
  - - [64, 384, 32, 2048]
    - [62, 46.712]
  - - [64, 448, 32, 2048]
    - [62, 43.369]
  - - [1225, 64, 32, 192]
    - [58, 53.265]
  - - [1225, 64, 32, 256]
    - [69, 55.853]
  - - [1225, 64, 32, 288]
    - [47, 55.972]
  - - [5329, 80, 32, 64]
    - [53, 37.646]
  - - [289, 128, 32, 768]
    - [48, 43.971]
  - - [289, 160, 32, 768]
    - [47, 39.696]
  - - [289, 192, 32, 768]
    - [47, 47.59]
  - - [3136, 64, 32, 64]
    - [44, 57.238]
  - - [3136, 64, 32, 256]
    - [63, 61.468]
  - - [196, 256, 32, 1024]
    - [54, 45.198]
  - - [960, 1024, 1, 1024]
    - [59, 52.983]
  - - [64, 512, 16, 512]
    - [75, 39.735]
  - - [64, 512, 128, 512]
    - [78, 42.435]
  - - [1024, 512, 1, 2]
    - [70, 0.932]
  - - [1024, 512, 1, 4096]
    - [64, 55.44]
  - - [1024, 616, 1, 1024]
    - [69, 40.497]
  - - [64, 128, 128, 128]
    - [68, 36.568]
  - - [64, 128, 160, 128]
    - [68, 39.017]
  - - [1024, 1024, 1, 2]
    - [66, 1.82]
  - - [1024, 1024, 1, 4096]
    - [64, 60.306]
  - - [64, 128, 624, 128]
    - [60, 40.066]
  - - [1024, 780, 1, 1024]
    - [76, 50.743]
  - - [64, 128, 640, 128]
    - [55, 39.241]
  - - [1024, 800, 1, 1024]
    - [76, 52.016]
  - - [64, 128, 656, 128]
    - [60, 39.87]
  - - [1024, 820, 1, 1024]
    - [69, 53.259]
  - - [64, 512, 80, 512]
    - [65, 39.651]
  - - [1024, 385, 1, 1024]
    - [48, 36.11]
  - - [64, 512, 96, 512]
    - [55, 41.503]
  - - [1024, 462, 1, 1024]
    - [70, 42.925]
  - - [64, 128, 144, 128]
    - [68, 39.886]
  - - [64, 1024, 32, 1024]
    - [78, 40.615]
  - - [96, 1024, 64, 1024]
    - [64, 49.543]
  - - [64, 1024, 256, 1024]
    - [78, 42.636]
  - - [64, 512, 256, 512]
    - [55, 43.161]
  - - [64, 1024, 64, 1024]
    - [65, 41.636]
  - - [64, 1024, 128, 1024]
    - [65, 41.95]
  - - [96, 1024, 128, 1024]
    - [53, 48.783]
  - - [64, 512, 40, 512]
    - [52, 40.827]
  - - [64, 128, 1024, 128]
    - [163, 43.897]
  - - [1024, 864, 1, 1024]
    - [77, 47.529]
  - - [1024, 864, 1, 512]
    - [77, 43.743]
  - - [256, 3456, 1, 128]
    - [59, 37.348]
  - - [256, 4096, 1, 128]
    - [59, 43.254]
  - - [480, 864, 1, 1024]
    - [64, 37.393]
  - - [512, 864, 1, 256]
    - [51, 27.352]
  - - [64, 128, 1280, 128]
    - [65, 42.85]
  - - [64, 128, 1312, 128]
    - [55, 42.936]
  - - [64, 512, 192, 512]
    - [161, 44.094]
  - - [256, 4096, 1, 1]
    - [70, 0.699]
  - - [12544, 64, 1, 147]
    - [67, 37.391]
  - - [64, 128, 2048, 128]
    - [165, 46.815]
  - - [64, 128, 1536, 128]
    - [164, 46.343]
  - - [64, 128, 192, 128]
    - [68, 40.551]
  - - [64, 384, 144, 384]
    - [71, 41.63]
  - - [64, 512, 48, 512]
    - [52, 37.348]
  - - [64, 128, 256, 128]
    - [46, 37.15]
  - - [64, 384, 192, 384]
    - [174, 52.363]
  - - [3400, 256, 1, 1024]
    - [70, 46.714]
  - - [3800, 256, 1, 1024]
    - [70, 52.043]
  - - [864, 512, 2, 2048]
    - [54, 49.379]
  - - [888, 512, 2, 2048]
    - [77, 50.59]
  - - [51520, 64, 2, 256]
    - [53, 61.984]
  - - [46464, 64, 2, 256]
    - [47, 62.905]
  - - [49152, 64, 2, 256]
    - [76, 63.563]
  - - [1536, 512, 1, 1024]
    - [69, 52.083]
  - - [1728, 512, 1, 1024]
    - [48, 47.975]
  - - [1024, 1024, 1, 320]
    - [59, 52.857]
  - - [51520, 64, 2, 64]
    - [50, 56.739]
  - - [55296, 64, 2, 64]
    - [44, 57.732]
  - - [49152, 64, 2, 64]
    - [44, 56.279]
  - - [54400, 64, 2, 64]
    - [50, 57.446]
  - - [42240, 64, 2, 256]
    - [76, 62.826]
  - - [672, 512, 2, 2048]
    - [53, 46.236]
  - - [54400, 64, 2, 256]
    - [53, 64.608]
  - - [56832, 64, 2, 256]
    - [47, 64.791]
  - - [55296, 64, 2, 256]
    - [69, 65.443]
  - - [60800, 64, 2, 64]
    - [66, 58.278]
  - - [768, 512, 2, 2048]
    - [76, 53.385]
  - - [43008, 64, 2, 256]
    - [47, 63.915]
  - - [864, 256, 2, 2048]
    - [64, 43.895]
  - - [768, 256, 2, 2048]
    - [54, 40.335]
  - - [45632, 64, 2, 256]
    - [47, 62.165]
  - - [60800, 64, 2, 256]
    - [47, 64.61]
  - - [1024, 1024, 1, 81]
    - [66, 34.837]
  - - [950, 512, 2, 2048]
    - [54, 53.992]
  - - [850, 512, 2, 2048]
    - [54, 48.472]
  - - [805, 512, 2, 2048]
    - [62, 48.086]
  - - [950, 256, 2, 2048]
    - [77, 47.854]
  - - [1900, 512, 1, 1024]
    - [48, 52.652]
  - - [1700, 512, 1, 1024]
    - [48, 47.197]
  - - [1610, 512, 1, 1024]
    - [47, 52.573]
  - - [660, 512, 2, 2048]
    - [53, 45.343]
  - - [726, 512, 2, 2048]
    - [53, 49.936]
  - - [713, 512, 2, 2048]
    - [53, 48.986]
  - - [805, 256, 2, 2048]
    - [54, 40.915]
  - - [850, 256, 2, 2048]
    - [54, 43.146]
  - - [100, 128, 120, 512]
    - [76, 44.352]
  - - [100, 128, 139, 512]
    - [76, 45.465]
  - - [100, 128, 160, 512]
    - [76, 46.877]
  - - [22500, 64, 1, 147]
    - [45, 42.866]
  - - [96, 1024, 160, 1024]
    - [76, 49.408]
  - - [96, 1024, 40, 1024]
    - [54, 50.989]
  - - [96, 1024, 80, 1024]
    - [63, 48.943]
  - - [96, 1024, 96, 1024]
    - [53, 48.431]
  - - [96, 1024, 24, 1024]
    - [63, 46.814]
  - - [96, 1024, 48, 1024]
    - [54, 51.001]
  - - [96, 1024, 16, 1024]
    - [64, 44.213]
  - - [96, 1024, 32, 1024]
    - [53, 46.694]
  - - [64, 512, 320, 512]
    - [65, 41.296]
  - - [64, 1024, 512, 1024]
    - [78, 43.423]
  - - [1024, 77, 1, 30522]
    - [80, 31.147]
  - - [1024, 200, 1, 30522]
    - [80, 45.329]
  - - [1024, 160, 1, 30522]
    - [79, 43.66]
  - - [1024, 180, 1, 30522]
    - [79, 49.049]
  - - [1024, 160, 1, 30528]
    - [79, 43.752]
  - - [1024, 240, 1, 30528]
    - [80, 53.784]
  - - [2560, 109, 1, 29000]
    - [79, 45.977]
  - - [2560, 121, 1, 29000]
    - [79, 51.046]
  - - [2560, 65, 1, 29000]
    - [81, 27.713]
  - - [2560, 66, 1, 29000]
    - [79, 28.189]
  - - [2560, 67, 1, 29000]
    - [79, 28.631]
  - - [2560, 69, 1, 29000]
    - [79, 29.425]
  - - [2560, 70, 1, 29000]
    - [79, 29.929]
  - - [2560, 71, 1, 29000]
    - [79, 30.28]
  - - [2560, 73, 1, 29000]
    - [79, 31.144]
  - - [2560, 74, 1, 29000]
    - [79, 31.55]
  - - [2560, 75, 1, 29000]
    - [79, 32.047]
  - - [2560, 77, 1, 29000]
    - [79, 32.985]
  - - [2560, 78, 1, 29000]
    - [79, 33.405]
  - - [2560, 80, 1, 29000]
    - [79, 34.19]
  - - [2560, 81, 1, 29000]
    - [79, 34.533]
  - - [2560, 82, 1, 29000]
    - [79, 35.045]
  - - [2560, 83, 1, 29000]
    - [79, 35.39]
  - - [2560, 84, 1, 29000]
    - [79, 35.821]
  - - [2560, 88, 1, 29000]
    - [79, 37.499]
  - - [2560, 89, 1, 29000]
    - [81, 37.768]
  - - [2560, 90, 1, 29000]
    - [79, 38.28]
  - - [2560, 92, 1, 29000]
    - [79, 39.148]
  - - [2560, 95, 1, 29000]
    - [79, 40.457]
  - - [2560, 98, 1, 29000]
    - [79, 41.652]
  - - [2368, 64, 1, 3328]
    - [89, 19.536]
  - - [256, 704, 1, 1280]
    - [96, 22.726]
  - - [1408, 64, 1, 1280]
    - [89, 16.021]
  - - [1024, 256, 1, 3328]
    - [122, 29.243]
  - - [704, 128, 1, 1280]
    - [89, 16.141]
  - - [64, 3584, 1, 3328]
    - [96, 24.573]
  - - [1024, 256, 1, 256]
    - [122, 22.8]
  - - [448, 448, 1, 256]
    - [89, 19.448]
  - - [128, 1024, 1, 3328]
    - [106, 25.09]
  - - [64, 1856, 1, 1280]
    - [89, 20.991]
  - - [448, 256, 1, 256]
    - [101, 13.799]
  - - [256, 1024, 1, 256]
    - [108, 22.527]
  - - [1024, 128, 1, 1280]
    - [126, 22.107]
  - - [448, 256, 1, 3328]
    - [89, 21.931]
  - - [128, 704, 1, 1280]
    - [119, 16.003]
  - - [1856, 128, 1, 3328]
    - [84, 26.707]
  - - [256, 448, 1, 256]
    - [106, 13.684]
  - - [448, 448, 1, 3328]
    - [89, 26.159]
  - - [1408, 128, 1, 1280]
    - [89, 22.471]
  - - [128, 1856, 1, 1280]
    - [96, 24.981]
  - - [64, 1408, 1, 3328]
    - [126, 17.266]
  - - [256, 704, 1, 256]
    - [106, 17.58]
  - - [128, 1408, 1, 256]
    - [106, 17.521]
  - - [256, 448, 1, 3328]
    - [89, 21.931]
  - - [64, 2368, 1, 1280]
    - [96, 19.177]
  - - [2368, 64, 1, 256]
    - [89, 14.884]
  - - [704, 128, 1, 3328]
    - [89, 17.275]
  - - [4288, 64, 1, 1280]
    - [115, 28.816]
  - - [128, 1024, 1, 1280]
    - [89, 23.134]
  - - [128, 1024, 1, 256]
    - [101, 15.448]
  - - [1856, 64, 1, 256]
    - [101, 13.61]
  - - [704, 128, 1, 256]
    - [88, 12.046]
  - - [448, 256, 1, 1280]
    - [89, 20.366]
  - - [1856, 128, 1, 1280]
    - [103, 25.633]
  - - [64, 3584, 1, 256]
    - [108, 19.197]
  - - [64, 1856, 1, 256]
    - [101, 13.943]
  - - [256, 1024, 1, 1280]
    - [103, 28.056]
  - - [3584, 64, 1, 1280]
    - [84, 24.751]
  - - [1408, 128, 1, 3328]
    - [89, 23.368]
  - - [64, 2944, 1, 3328]
    - [106, 24.499]
  - - [64, 4288, 1, 3328]
    - [96, 29.191]
  - - [64, 2944, 1, 256]
    - [96, 18.135]
  - - [64, 1408, 1, 1280]
    - [101, 15.886]
  - - [64, 2944, 1, 1280]
    - [108, 23.592]
  - - [704, 256, 1, 256]
    - [89, 17.58]
  - - [256, 448, 1, 1280]
    - [106, 20.391]
  - - [704, 256, 1, 1280]
    - [89, 22.547]
  - - [64, 2368, 1, 3328]
    - [106, 19.766]
  - - [256, 704, 1, 3328]
    - [106, 23.556]
  - - [2944, 64, 1, 1280]
    - [89, 23.47]
  - - [128, 1408, 1, 3328]
    - [106, 23.531]
  - - [1408, 64, 1, 256]
    - [88, 11.936]
  - - [64, 2368, 1, 256]
    - [108, 15.089]
  - - [1024, 128, 1, 3328]
    - [112, 23.896]
  - - [2368, 64, 1, 1280]
    - [89, 19.01]
  - - [4288, 64, 1, 256]
    - [103, 23.585]
  - - [64, 4288, 1, 1280]
    - [122, 27.941]
  - - [1408, 64, 1, 3328]
    - [89, 17.248]
  - - [2944, 64, 1, 256]
    - [89, 18.257]
  - - [448, 448, 1, 1280]
    - [96, 25.198]
  - - [1024, 256, 1, 1280]
    - [122, 28.223]
  - - [3584, 64, 1, 3328]
    - [84, 25.566]
  - - [256, 1024, 1, 3328]
    - [96, 28.539]
  - - [1856, 64, 1, 3328]
    - [89, 20.24]
  - - [1856, 64, 1, 1280]
    - [89, 19.012]
  - - [1024, 128, 1, 256]
    - [119, 15.261]
  - - [64, 3584, 1, 1280]
    - [108, 23.621]
  - - [3584, 64, 1, 256]
    - [103, 19.829]
  - - [64, 1856, 1, 3328]
    - [101, 22.692]
  - - [1408, 128, 1, 256]
    - [106, 17.58]
  - - [128, 704, 1, 256]
    - [88, 11.99]
  - - [128, 704, 1, 3328]
    - [119, 17.205]
  - - [128, 1856, 1, 256]
    - [122, 20.118]
  - - [64, 4288, 1, 256]
    - [108, 22.64]
  - - [704, 256, 1, 3328]
    - [89, 23.522]
  - - [1856, 128, 1, 256]
    - [103, 20.914]
  - - [4288, 64, 1, 3328]
    - [103, 29.773]
  - - [64, 1408, 1, 256]
    - [88, 11.773]
  - - [2944, 64, 1, 3328]
    - [89, 24.329]
  - - [128, 1408, 1, 1280]
    - [96, 22.744]
  - - [128, 1856, 1, 3328]
    - [122, 25.924]
  - - [1760, 64, 1, 1760]
    - [89, 18.791]
  - - [2560, 32, 1, 2560]
    - [88, 14.821]
  - - [2048, 128, 1, 2048]
    - [115, 28.417]
  - - [4608, 32, 1, 1536]
    - [89, 24.875]
  - - [3072, 64, 1, 1024]
    - [89, 23.98]
  - - [128, 1500, 1, 1280]
    - [96, 24.19]
  - - [4096, 32, 1, 4096]
    - [106, 23.026]
  - - [1760, 128, 1, 1760]
    - [84, 24.668]
  - - [4096, 64, 1, 4096]
    - [84, 28.891]
  - - [7680, 32, 1, 2560]
    - [115, 26.488]
  - - [2560, 64, 1, 2560]
    - [89, 21.252]
  - - [3072, 32, 1, 1024]
    - [89, 15.879]
  - - [6144, 32, 1, 2560]
    - [106, 24.954]
  - - [176, 1500, 1, 1408]
    - [103, 27.84]
  - - [2048, 64, 1, 2048]
    - [101, 21.219]
  - - [8448, 32, 1, 2816]
    - [103, 28.931]
  - - [512, 512, 1, 64]
    - [115, 12.874]
  - - [32, 33, 1600, 33]
    - [94, 11.647]
  - - [256, 1024, 1, 1]
    - [104, 0.336]
  - - [257, 1024, 1, 4096]
    - [108, 23.359]
  - - [512, 200, 1, 1]
    - [95, 0.14]
  - - [512, 200, 1, 32]
    - [123, 3.623]
  - - [512, 215, 1, 2048]
    - [89, 19.834]
  - - [512, 256, 1, 2048]
    - [89, 23.973]
  - - [560, 200, 1, 1024]
    - [89, 18.48]
  - - [768, 215, 1, 2048]
    - [106, 20.889]
  - - [768, 256, 1, 2048]
    - [96, 25.218]
  - - [1024, 200, 1, 1]
    - [116, 0.266]
  - - [64, 32, 4608, 32]
    - [115, 30.118]
  - - [64, 34, 4736, 34]
    - [108, 17.327]
  - - [64, 35, 4608, 32]
    - [84, 18.516]
  - - [64, 35, 4608, 35]
    - [96, 17.625]
  - - [64, 33, 1920, 27]
    - [84, 15.153]
  - - [64, 33, 1920, 33]
    - [96, 15.385]
  - - [1225, 32, 64, 192]
    - [103, 31.442]
  - - [1225, 48, 64, 192]
    - [122, 24.503]
  - - [1225, 48, 64, 256]
    - [103, 24.652]
  - - [1225, 48, 64, 288]
    - [108, 24.756]
  - - [1225, 32, 32, 192]
    - [103, 29.432]
  - - [1225, 48, 32, 192]
    - [108, 23.691]
  - - [1225, 48, 32, 256]
    - [84, 23.883]
  - - [1225, 48, 32, 288]
    - [84, 24.075]
  - - [49, 2048, 64, 512]
    - [101, 24.158]
  - - [49, 512, 64, 2048]
    - [101, 23.393]
  - - [49, 2048, 32, 512]
    - [101, 23.808]
  - - [49, 512, 32, 2048]
    - [126, 22.06]
  - - [49, 2048, 64, 1024]
    - [126, 24.289]
  - - [49, 1024, 64, 2048]
    - [101, 24.14]
  - - [49, 2048, 32, 1024]
    - [101, 23.962]
  - - [49, 1024, 32, 2048]
    - [126, 23.409]
  - - [480, 512, 1, 512]
    - [115, 21.471]
  - - [512, 480, 1, 512]
    - [115, 24.054]
  - - [512, 512, 1, 512]
    - [115, 25.703]
  - - [1024, 160, 1, 1024]
    - [106, 20.088]
  - - [1024, 200, 1, 1024]
    - [108, 21.681]
  - - [1024, 308, 1, 1024]
    - [115, 26.687]
  - - [1024, 180, 1, 1024]
    - [126, 22.06]
  - - [256, 864, 1, 128]
    - [108, 15.653]
  - - [3136, 64, 1, 576]
    - [89, 22.958]
  - - [784, 128, 1, 1152]
    - [89, 17.248]
  - - [1024, 128, 1, 1024]
    - [101, 21.056]
  - - [1024, 128, 1, 2]
    - [85, 0.374]
  - - [1024, 96, 1, 1024]
    - [89, 16.772]
  - - [1024, 96, 1, 2]
    - [85, 0.28]
  - - [49, 2048, 128, 512]
    - [101, 24.429]
  - - [49, 2048, 256, 512]
    - [96, 24.966]
  - - [49, 512, 128, 2048]
    - [126, 23.905]
  - - [49, 512, 256, 2048]
    - [112, 24.505]
  - - [100, 128, 18, 512]
    - [108, 20.19]
  - - [100, 128, 19, 512]
    - [108, 19.161]
  - - [1444, 128, 1, 576]
    - [89, 20.632]
  - - [361, 512, 1, 2304]
    - [122, 23.91]
  - - [2560, 35, 1, 29000]
    - [119, 11.679]
  - - [2560, 36, 1, 29000]
    - [119, 11.963]
  - - [2560, 39, 1, 29000]
    - [119, 12.989]
  - - [2560, 40, 1, 29000]
    - [119, 13.301]
  - - [2560, 42, 1, 29000]
    - [119, 14.018]
  - - [2560, 43, 1, 29000]
    - [119, 14.331]
  - - [2560, 44, 1, 29000]
    - [119, 14.663]
  - - [2560, 46, 1, 29000]
    - [119, 15.342]
  - - [2560, 48, 1, 29000]
    - [119, 16.01]
  - - [2560, 49, 1, 29000]
    - [106, 16.281]
  - - [2560, 50, 1, 29000]
    - [119, 16.599]
  - - [2560, 51, 1, 29000]
    - [106, 16.93]
  - - [2560, 53, 1, 29000]
    - [126, 17.584]
  - - [2560, 54, 1, 29000]
    - [106, 17.954]
  - - [2560, 55, 1, 29000]
    - [119, 18.282]
  - - [2560, 56, 1, 29000]
    - [119, 18.638]
  - - [2560, 57, 1, 29000]
    - [119, 18.942]
  - - [2560, 58, 1, 29000]
    - [106, 19.263]
  - - [2560, 59, 1, 29000]
    - [119, 19.655]
  - - [2560, 61, 1, 29000]
    - [112, 20.249]
  - - [2560, 63, 1, 29000]
    - [126, 20.97]
  - - [1909283, 40, 1, 40]
    - [97, 17.178]
  - - [3818566, 40, 1, 40]
    - [86, 16.211]
  - - [1760, 32, 1, 1760]
    - [130, 12.734]
  - - [7680, 4, 1, 2560]
    - [135, 6.716]
  - - [3072, 16, 1, 1024]
    - [147, 12.261]
  - - [2048, 16, 1, 2048]
    - [153, 10.187]
  - - [3072, 1, 1, 128]
    - [100, 0.314]
  - - [8448, 16, 1, 2816]
    - [138, 21.192]
  - - [7680, 2, 1, 2560]
    - [146, 3.373]
  - - [4224, 1, 1, 128]
    - [132, 0.424]
  - - [7680, 1, 1, 2560]
    - [151, 1.674]
  - - [6144, 2, 1, 2560]
    - [137, 3.176]
  - - [1760, 16, 1, 1760]
    - [92, 8.762]
  - - [6144, 4, 1, 2560]
    - [137, 6.364]
  - - [3072, 4, 1, 1024]
    - [134, 3.278]
  - - [2048, 32, 1, 2048]
    - [136, 15.787]
  - - [4608, 16, 1, 1536]
    - [138, 16.741]
  - - [3072, 2, 1, 1024]
    - [134, 1.651]
  - - [8448, 1, 1, 2816]
    - [135, 1.983]
  - - [6144, 1, 1, 2560]
    - [143, 1.606]
  - - [4608, 1, 1, 1536]
    - [147, 1.257]
  - - [8448, 4, 1, 2816]
    - [146, 7.927]
  - - [4608, 2, 1, 1536]
    - [147, 2.518]
  - - [2560, 16, 1, 2560]
    - [137, 11.618]
  - - [6144, 16, 1, 2560]
    - [138, 18.897]
  - - [4096, 16, 1, 4096]
    - [152, 16.563]
  - - [7680, 16, 1, 2560]
    - [138, 18.814]
  - - [3072, 1, 1, 1024]
    - [153, 0.823]
  - - [8448, 2, 1, 2816]
    - [151, 3.966]
  - - [4608, 4, 1, 1536]
    - [147, 5.022]
  - - [2048, 2, 1, 2048]
    - [137, 1.302]
  - - [2048, 2, 1, 2]
    - [128, 0.011]
  - - [2560, 4, 1, 2]
    - [128, 0.027]
  - - [2560, 4, 1, 2560]
    - [137, 3.264]
  - - [2048, 1, 1, 512]
    - [92, 0.449]
  - - [12288, 12, 2, 256]
    - [133, 15.315]
  - - [12288, 3, 2, 256]
    - [133, 5.849]
  - - [51520, 12, 2, 256]
    - [141, 18.471]
  - - [51520, 3, 2, 256]
    - [148, 7.501]
  - - [15200, 12, 2, 256]
    - [131, 15.514]
  - - [15200, 3, 2, 256]
    - [129, 6.314]
  - - [3456, 3, 2, 256]
    - [137, 2.892]
  - - [13600, 12, 2, 256]
    - [131, 15.683]
  - - [12880, 3, 2, 256]
    - [129, 5.998]
  - - [3400, 3, 2, 256]
    - [150, 2.818]
  - - [12880, 12, 2, 256]
    - [131, 15.026]
  - - [13824, 12, 2, 256]
    - [131, 16.046]
  - - [13824, 3, 2, 256]
    - [129, 6.404]
  - - [13600, 3, 2, 256]
    - [129, 6.368]
  - - [3456, 12, 2, 256]
    - [147, 9.581]
  - - [3800, 3, 2, 256]
    - [144, 3.12]
  - - [3400, 12, 2, 256]
    - [132, 9.351]
  - - [3800, 12, 2, 256]
    - [131, 9.937]
  - - [55296, 3, 2, 256]
    - [133, 7.341]
  - - [3072, 3, 2, 256]
    - [130, 2.635]
  - - [3072, 12, 2, 256]
    - [131, 8.908]
  - - [54400, 3, 2, 256]
    - [142, 7.618]
  - - [60800, 12, 2, 256]
    - [145, 18.536]
  - - [60800, 3, 2, 256]
    - [140, 7.792]
  - - [3220, 3, 2, 256]
    - [130, 2.707]
  - - [3220, 12, 2, 256]
    - [131, 9.337]
  - - [2048, 8, 1, 2]
    - [128, 0.045]
  - - [2048, 8, 1, 2048]
    - [137, 5.236]
  - - [2560, 2, 1, 2]
    - [128, 0.014]
  - - [2560, 2, 1, 2560]
    - [147, 1.631]
  - - [2560, 27, 1, 29000]
    - [138, 14.117]
  - - [1909283, 11, 1, 11]
    - [149, 9.071]
  - - [3818566, 11, 1, 11]
    - [139, 7.149]
  - - [512, 16, 1, 500000]
    - [159, 8.852]
  - - [512, 2, 1, 500000]
    - [156, 1.105]
  - - [1024, 16, 1, 500000]
    - [157, 11.081]
  - - [1024, 4, 1, 500000]
    - [157, 2.727]
  - - [512, 8, 1, 500000]
    - [156, 4.435]
  - - [512, 1, 1, 500000]
    - [154, 0.55]
  - - [512, 4, 1, 500000]
    - [156, 2.211]
  - - [1024, 1, 1, 500000]
    - [154, 0.675]
  - - [1024, 2, 1, 500000]
    - [155, 1.356]
  - - [1024, 8, 1, 500000]
    - [159, 5.437]
  - - [49, 512, 1, 4608]
    - [158, 9.908]
  - - [448, 64, 1, 1280]
    - [92, 7.855]
  - - [64, 1024, 1, 1280]
    - [88, 14.018]
  - - [64, 704, 1, 1280]
    - [100, 11.636]
  - - [256, 128, 1, 256]
    - [98, 5.734]
  - - [64, 1024, 1, 3328]
    - [88, 14.999]
  - - [1024, 64, 1, 1280]
    - [105, 13.975]
  - - [256, 256, 1, 3328]
    - [88, 14.963]
  - - [64, 448, 1, 1280]
    - [92, 8.536]
  - - [64, 64, 1, 3328]
    - [102, 1.527]
  - - [704, 64, 1, 3328]
    - [107, 11.624]
  - - [64, 128, 1, 256]
    - [100, 1.527]
  - - [704, 64, 1, 1280]
    - [100, 11.157]
  - - [128, 448, 1, 256]
    - [88, 8.807]
  - - [448, 64, 1, 3328]
    - [92, 9.583]
  - - [64, 128, 1, 3328]
    - [113, 3.041]
  - - [128, 128, 1, 3328]
    - [102, 6.084]
  - - [256, 256, 1, 256]
    - [88, 10.012]
  - - [128, 64, 1, 1280]
    - [102, 2.657]
  - - [64, 1024, 1, 256]
    - [88, 9.908]
  - - [64, 704, 1, 256]
    - [100, 7.652]
  - - [1, 1, 1, 1280]
    - [85, 0.0]
  - - [256, 64, 1, 3328]
    - [107, 6.102]
  - - [448, 128, 1, 256]
    - [88, 8.902]
  - - [64, 704, 1, 3328]
    - [111, 13.01]
  - - [64, 448, 1, 3328]
    - [107, 9.533]
  - - [448, 128, 1, 3328]
    - [88, 13.158]
  - - [128, 256, 1, 1280]
    - [107, 9.693]
  - - [64, 448, 1, 256]
    - [111, 5.207]
  - - [64, 256, 1, 1280]
    - [102, 5.292]
  - - [64, 128, 1, 1280]
    - [102, 2.664]
  - - [64, 64, 1, 256]
    - [100, 0.762]
  - - [256, 128, 1, 1280]
    - [107, 9.714]
  - - [128, 256, 1, 3328]
    - [92, 10.952]
  - - [256, 64, 1, 256]
    - [98, 3.032]
  - - [128, 128, 1, 1280]
    - [102, 5.281]
  - - [128, 256, 1, 256]
    - [98, 5.77]
  - - [256, 64, 1, 1280]
    - [121, 5.315]
  - - [704, 64, 1, 256]
    - [100, 7.609]
  - - [128, 448, 1, 1280]
    - [88, 12.358]
  - - [64, 64, 1, 1280]
    - [102, 1.317]
  - - [128, 64, 1, 3328]
    - [92, 3.03]
  - - [448, 64, 1, 256]
    - [100, 5.08]
  - - [1024, 64, 1, 256]
    - [88, 9.96]
  - - [1, 1, 1, 1]
    - [109, 0.0]
  - - [448, 128, 1, 1280]
    - [88, 12.394]
  - - [1024, 64, 1, 3328]
    - [118, 14.9]
  - - [128, 64, 1, 256]
    - [98, 1.527]
  - - [64, 256, 1, 3328]
    - [113, 6.077]
  - - [256, 256, 1, 1280]
    - [88, 13.955]
  - - [256, 128, 1, 3328]
    - [92, 10.963]
  - - [64, 256, 1, 256]
    - [100, 3.032]
  - - [1, 1, 1, 256]
    - [85, 0.0]
  - - [128, 448, 1, 3328]
    - [105, 13.174]
  - - [128, 128, 1, 256]
    - [98, 3.032]
  - - [1024, 16, 1, 512]
    - [92, 4.009]
  - - [512, 16, 1, 512]
    - [107, 2.005]
  - - [128, 1, 1, 1408]
    - [91, 0.038]
  - - [64, 1, 1, 1216]
    - [91, 0.02]
  - - [1024, 2, 1, 512]
    - [92, 0.474]
  - - [512, 1, 1, 512]
    - [91, 0.117]
  - - [1024, 4, 1, 512]
    - [92, 0.95]
  - - [512, 4, 1, 512]
    - [91, 0.465]
  - - [1024, 32, 1, 512]
    - [107, 7.568]
  - - [512, 2, 1, 512]
    - [91, 0.235]
  - - [1024, 1, 1, 512]
    - [92, 0.235]
  - - [512, 32, 1, 512]
    - [107, 3.993]
  - - [128, 1, 1, 1024]
    - [102, 0.038]
  - - [64, 14, 1, 14]
    - [120, 0.018]
  - - [64, 14, 1, 15]
    - [87, 0.016]
  - - [64, 15, 1, 15]
    - [90, 0.02]
  - - [64, 15, 1, 17]
    - [82, 0.02]
  - - [64, 17, 1, 17]
    - [85, 0.027]
  - - [64, 17, 1, 21]
    - [82, 0.027]
  - - [64, 21, 1, 21]
    - [82, 0.034]
  - - [64, 24, 1, 24]
    - [85, 0.043]
  - - [64, 24, 1, 34]
    - [87, 0.056]
  - - [64, 30, 1, 30]
    - [82, 0.063]
  - - [64, 31, 1, 30]
    - [82, 0.065]
  - - [64, 31, 1, 31]
    - [82, 0.068]
  - - [64, 32, 1, 32]
    - [87, 0.088]
  - - [64, 34, 1, 34]
    - [91, 0.088]
  - - [64, 35, 1, 32]
    - [90, 0.079]
  - - [64, 35, 1, 35]
    - [87, 0.083]
  - - [64, 512, 1, 512]
    - [111, 7.6]
  - - [1024, 4, 1, 2]
    - [82, 0.011]
  - - [1024, 4, 1, 1024]
    - [92, 1.22]
  - - [1024, 32, 1, 2]
    - [85, 0.095]
  - - [1024, 32, 1, 1024]
    - [107, 9.231]
  - - [32, 200, 1, 1]
    - [82, 0.009]
  - - [64, 3, 512, 3]
    - [114, 0.273]
  - - [64, 5, 512, 5]
    - [114, 0.717]
  - - [64, 5, 960, 5]
    - [114, 0.932]
  - - [64, 9, 512, 9]
    - [103, 2.186]
  - - [64, 512, 1, 1]
    - [117, 0.047]
  - - [67, 512, 1, 2048]
    - [125, 9.445]
  - - [74, 512, 1, 2048]
    - [125, 10.456]
  - - [74, 960, 1, 2048]
    - [101, 12.8]
  - - [100, 512, 1, 2048]
    - [100, 11.329]
  - - [128, 27, 32768, 27]
    - [93, 10.239]
  - - [64, 14, 10880, 14]
    - [96, 9.836]
  - - [64, 14, 10880, 15]
    - [96, 10.289]
  - - [64, 15, 7680, 15]
    - [96, 10.697]
  - - [64, 15, 10880, 15]
    - [96, 11.018]
  - - [64, 15, 7680, 17]
    - [108, 11.78]
  - - [64, 17, 6144, 17]
    - [108, 13.039]
  - - [64, 17, 7680, 17]
    - [108, 13.407]
  - - [64, 17, 6144, 21]
    - [84, 14.113]
  - - [64, 21, 6144, 21]
    - [108, 17.127]
  - - [64, 24, 4736, 24]
    - [108, 21.76]
  - - [64, 24, 4736, 34]
    - [84, 22.847]
  - - [64, 30, 2048, 30]
    - [84, 22.861]
  - - [64, 31, 2048, 30]
    - [84, 23.382]
  - - [64, 31, 2048, 31]
    - [103, 23.68]
  - - [64, 27, 1920, 27]
    - [108, 19.43]
  - - [1024, 8, 1, 1024]
    - [102, 2.269]
  - - [1024, 77, 1, 1024]
    - [88, 13.373]
  - - [1024, 10, 1, 2]
    - [83, 0.027]
  - - [1024, 10, 1, 1024]
    - [102, 3.016]
  - - [1024, 39, 1, 2]
    - [85, 0.111]
  - - [1024, 39, 1, 1024]
    - [107, 9.098]
  - - [1024, 40, 1, 2]
    - [85, 0.115]
  - - [1024, 40, 1, 1024]
    - [107, 9.33]
  - - [1024, 41, 1, 2]
    - [95, 0.117]
  - - [1024, 41, 1, 1024]
    - [121, 9.545]
  - - [1024, 5, 1, 2]
    - [82, 0.014]
  - - [1024, 5, 1, 1024]
    - [92, 1.516]
  - - [1024, 6, 1, 2]
    - [85, 0.018]
  - - [1024, 6, 1, 1024]
    - [92, 1.82]
  - - [1024, 8, 1, 2]
    - [85, 0.023]
  - - [1024, 9, 1, 2]
    - [83, 0.025]
  - - [1024, 9, 1, 1024]
    - [92, 2.716]
  - - [64, 4, 32768, 4]
    - [84, 1.198]
  - - [64, 4, 38400, 4]
    - [84, 1.2]
  - - [128, 128, 1, 64]
    - [88, 1.22]
  - - [64, 128, 1, 128]
    - [100, 0.995]
  - - [64, 5, 1, 5]
    - [82, 0.002]
  - - [32, 33, 1, 33]
    - [85, 0.043]
  - - [1024, 16, 1, 2]
    - [85, 0.052]
  - - [1024, 16, 1, 1024]
    - [92, 4.992]
  - - [1024, 1, 1, 2]
    - [82, 0.002]
  - - [1024, 1, 1, 1024]
    - [92, 0.305]
  - - [1024, 1, 1, 200]
    - [100, 0.142]
  - - [1024, 1, 1, 1600]
    - [92, 0.334]
  - - [1024, 64, 1, 2]
    - [123, 0.187]
  - - [1024, 64, 1, 1024]
    - [88, 13.614]
  - - [1024, 80, 1, 1024]
    - [88, 14.038]
  - - [1024, 80, 1, 2]
    - [123, 0.23]
  - - [1024, 82, 1, 1024]
    - [89, 13.914]
  - - [1024, 82, 1, 2]
    - [109, 0.237]
  - - [1024, 12, 1, 1024]
    - [92, 3.621]
  - - [1024, 12, 1, 2]
    - [85, 0.034]
  - - [64, 24, 6816, 24]
    - [96, 23.231]
  - - [64, 26, 6272, 26]
    - [115, 23.874]
  - - [196, 256, 1, 2304]
    - [124, 12.231]
  - - [768, 3, 2, 256]
    - [98, 0.744]
  - - [768, 12, 2, 256]
    - [98, 2.957]
  - - [864, 12, 2, 256]
    - [92, 3.271]
  - - [864, 3, 2, 256]
    - [92, 0.823]
  - - [216, 3, 2, 256]
    - [100, 0.212]
  - - [176, 12, 2, 256]
    - [110, 0.681]
  - - [176, 3, 2, 256]
    - [98, 0.171]
  - - [192, 12, 2, 256]
    - [124, 0.769]
  - - [192, 3, 2, 256]
    - [98, 0.192]
  - - [216, 12, 2, 256]
    - [100, 0.846]
  - - [850, 3, 2, 256]
    - [100, 0.814]
  - - [850, 12, 2, 256]
    - [100, 3.237]
  - - [805, 12, 2, 256]
    - [92, 3.066]
  - - [805, 3, 2, 256]
    - [92, 0.767]
  - - [247, 3, 2, 256]
    - [98, 0.244]
  - - [950, 3, 2, 256]
    - [92, 0.9]
  - - [187, 12, 2, 256]
    - [98, 0.733]
  - - [247, 12, 2, 256]
    - [124, 0.984]
  - - [187, 3, 2, 256]
    - [98, 0.183]
  - - [228, 12, 2, 256]
    - [124, 0.898]
  - - [221, 12, 2, 256]
    - [100, 0.875]
  - - [950, 12, 2, 256]
    - [92, 3.578]
  - - [228, 3, 2, 256]
    - [98, 0.223]
  - - [221, 3, 2, 256]
    - [100, 0.217]
  - - [25, 128, 120, 256]
    - [99, 14.668]
  - - [25, 128, 139, 256]
    - [99, 14.9]
  - - [25, 128, 160, 256]
    - [99, 14.934]
  - - [25, 128, 18, 256]
    - [100, 7.808]
  - - [25, 128, 19, 256]
    - [88, 7.6]
  - - [9, 128, 120, 256]
    - [110, 6.481]
  - - [9, 128, 139, 256]
    - [98, 5.989]
  - - [9, 128, 160, 256]
    - [110, 6.174]
  - - [9, 128, 18, 256]
    - [98, 3.118]
  - - [9, 128, 19, 256]
    - [124, 3.309]
  - - [100, 512, 1, 2304]
    - [88, 11.55]
  - - [25, 256, 1, 1152]
    - [127, 1.924]
  - - [9, 256, 1, 1152]
    - [92, 0.693]
  - - [1024, 20, 1, 1024]
    - [107, 5.633]
  - - [1024, 20, 1, 2]
    - [85, 0.056]
  - - [64, 64, 1536, 64]
    - [160, 34.75]
  - - [64, 64, 2048, 64]
    - [161, 38.205]
  - - [64, 64, 3072, 64]
    - [160, 41.269]
  - - [64, 128, 768, 128]
    - [162, 41.135]
  - - [64, 128, 3072, 128]
    - [166, 30.085]
  - - [64, 256, 192, 256]
    - [167, 36.319]
  - - [64, 256, 256, 256]
    - [168, 39.398]
  - - [64, 256, 384, 256]
    - [169, 41.401]
  - - [64, 256, 512, 256]
    - [168, 43.596]
  - - [64, 256, 768, 256]
    - [170, 41.955]
  - - [64, 256, 1024, 256]
    - [171, 35.998]
  - - [64, 256, 1536, 256]
    - [171, 36.492]
  - - [64, 256, 2048, 256]
    - [171, 36.659]
  - - [64, 256, 3072, 256]
    - [172, 36.712]
  - - [64, 384, 128, 384]
    - [173, 47.441]
  - - [64, 384, 256, 384]
    - [175, 52.556]
  - - [64, 384, 384, 384]
    - [176, 45.553]
  - - [64, 384, 512, 384]
    - [177, 41.448]
  - - [64, 384, 768, 384]
    - [178, 41.099]
  - - [64, 384, 1024, 384]
    - [177, 41.36]
  - - [64, 384, 1536, 384]
    - [179, 41.415]
  - - [64, 384, 2048, 384]
    - [177, 41.553]
  - - [64, 384, 3072, 384]
    - [179, 41.582]
  - - [64, 512, 384, 512]
    - [180, 41.29]
  - - [64, 512, 512, 512]
    - [181, 41.725]
  - - [64, 512, 768, 512]
    - [170, 42.161]
  - - [64, 512, 1024, 512]
    - [180, 42.619]
  - - [64, 512, 1536, 512]
    - [182, 42.678]
  - - [64, 512, 2048, 512]
    - [167, 42.767]
  - - [64, 512, 3072, 512]
    - [181, 42.946]
  - - [768, 1, 1, 1]
    - [183, 0.0]
  - - [768, 2, 1, 1]
    - [184, 0.001]
  - - [768, 4, 1, 1]
    - [185, 0.001]
  - - [768, 8, 1, 1]
    - [184, 0.002]
  - - [768, 16, 1, 1]
    - [184, 0.004]
  - - [768, 32, 1, 1]
    - [184, 0.009]
  - - [768, 64, 1, 1]
    - [184, 0.018]
  - - [768, 128, 1, 1]
    - [186, 0.035]
  - - [768, 256, 1, 1]
    - [187, 0.067]
  - - [768, 384, 1, 1]
    - [186, 0.099]
  - - [768, 512, 1, 1]
    - [188, 0.124]
  - - [768, 768, 1, 1]
    - [189, 0.172]
  - - [768, 1024, 1, 1]
    - [190, 0.223]
  - - [768, 1536, 1, 1]
    - [191, 0.314]
  - - [768, 2048, 1, 1]
    - [192, 0.385]
  - - [768, 3072, 1, 1]
    - [193, 0.511]
  - - [768, 4096, 1, 1]
    - [194, 0.596]
  - - [768, 6144, 1, 1]
    - [195, 0.736]
  - - [768, 8192, 1, 1]
    - [196, 0.83]
  - - [768, 12288, 1, 1]
    - [197, 1.47]
  - - [768, 16384, 1, 1]
    - [198, 1.783]
  - - [768, 16, 1, 768]
    - [199, 1.446]
  - - [768, 32, 1, 768]
    - [200, 3.627]
  - - [768, 64, 1, 768]
    - [200, 6.89]
  - - [768, 128, 1, 768]
    - [201, 11.219]
  - - [768, 256, 1, 768]
    - [202, 17.871]
  - - [768, 384, 1, 768]
    - [203, 26.639]
  - - [768, 512, 1, 768]
    - [204, 28.197]
  - - [768, 768, 1, 768]
    - [205, 41.438]
  - - [768, 1024, 1, 768]
    - [206, 42.106]
  - - [768, 1536, 1, 768]
    - [204, 54.067]
  - - [768, 3072, 1, 768]
    - [207, 67.562]
  - - [768, 4096, 1, 768]
    - [208, 63.832]
  - - [768, 6144, 1, 768]
    - [207, 74.958]
  - - [768, 8192, 1, 768]
    - [209, 74.474]
  - - [768, 12288, 1, 768]
    - [207, 79.748]
  - - [768, 16384, 1, 768]
    - [210, 78.423]
  - - [768, 24576, 1, 768]
    - [207, 81.566]
  - - [768, 32768, 1, 768]
    - [209, 79.73]
  - - [768, 49152, 1, 768]
    - [210, 81.491]
  - - [768, 65536, 1, 768]
    - [210, 80.937]
  - - [768, 98304, 1, 768]
    - [210, 82.004]
  - - [768, 131072, 1, 768]
    - [208, 81.856]
  - - [768, 16, 1, 3072]
    - [211, 2.733]
  - - [768, 32, 1, 3072]
    - [212, 6.229]
  - - [768, 64, 1, 3072]
    - [213, 11.469]
  - - [768, 128, 1, 3072]
    - [214, 17.203]
  - - [768, 256, 1, 3072]
    - [215, 27.12]
  - - [768, 384, 1, 3072]
    - [216, 36.877]
  - - [768, 512, 1, 3072]
    - [217, 36.974]
  - - [768, 768, 1, 3072]
    - [218, 54.456]
  - - [768, 1024, 1, 3072]
    - [219, 51.337]
  - - [768, 1536, 1, 3072]
    - [220, 65.832]
  - - [768, 3072, 1, 3072]
    - [221, 75.919]
  - - [768, 4096, 1, 3072]
    - [222, 70.033]
  - - [768, 6144, 1, 3072]
    - [223, 78.985]
  - - [768, 8192, 1, 3072]
    - [224, 76.685]
  - - [768, 12288, 1, 3072]
    - [225, 81.733]
  - - [768, 16384, 1, 3072]
    - [225, 80.112]
  - - [768, 24576, 1, 3072]
    - [223, 81.889]
  - - [768, 32768, 1, 3072]
    - [226, 80.769]
  - - [768, 49152, 1, 3072]
    - [225, 82.645]
  - - [768, 65536, 1, 3072]
    - [227, 82.53]
  - - [768, 98304, 1, 3072]
    - [227, 83.082]
  - - [768, 131072, 1, 3072]
    - [227, 81.571]
  - - [1024, 16, 1, 4096]
    - [211, 3.965]
  - - [1024, 32, 1, 4096]
    - [228, 8.369]
  - - [1024, 64, 1, 4096]
    - [229, 14.662]
  - - [1024, 128, 1, 4096]
    - [230, 22.912]
  - - [1024, 256, 1, 4096]
    - [216, 34.096]
  - - [1024, 384, 1, 4096]
    - [231, 37.052]
  - - [1024, 768, 1, 4096]
    - [206, 51.764]
  - - [1024, 1536, 1, 4096]
    - [226, 63.86]
  - - [1024, 24576, 1, 4096]
    - [232, 80.788]
  - - [1024, 49152, 1, 4096]
    - [225, 81.902]
  - - [1024, 65536, 1, 4096]
    - [225, 82.301]
  - - [2304, 16, 1, 1]
    - [233, 0.013]
  - - [2304, 32, 1, 1]
    - [234, 0.026]
  - - [2304, 64, 1, 1]
    - [235, 0.052]
  - - [2304, 128, 1, 1]
    - [236, 0.1]
  - - [2304, 256, 1, 1]
    - [191, 0.174]
  - - [2304, 384, 1, 1]
    - [191, 0.244]
  - - [2304, 512, 1, 1]
    - [189, 0.318]
  - - [2304, 768, 1, 1]
    - [237, 0.418]
  - - [2304, 1024, 1, 1]
    - [196, 0.513]
  - - [2304, 1536, 1, 1]
    - [238, 0.638]
  - - [2304, 2048, 1, 1]
    - [239, 0.739]
  - - [2304, 3072, 1, 1]
    - [240, 0.876]
  - - [2304, 4096, 1, 1]
    - [241, 1.438]
  - - [2304, 6144, 1, 1]
    - [242, 1.85]
  - - [2304, 8192, 1, 1]
    - [242, 2.022]
  - - [2304, 12288, 1, 1]
    - [242, 2.227]
  - - [2304, 16384, 1, 1]
    - [242, 2.323]
  - - [2304, 24576, 1, 1]
    - [242, 2.444]
  - - [2304, 32768, 1, 1]
    - [243, 0.988]
  - - [2304, 49152, 1, 1]
    - [244, 0.96]
  - - [2304, 65536, 1, 1]
    - [245, 0.961]
  - - [2304, 98304, 1, 1]
    - [246, 0.963]
  - - [2304, 131072, 1, 1]
    - [247, 0.959]
  - - [2304, 16, 1, 768]
    - [248, 3.775]
  - - [2304, 32, 1, 768]
    - [249, 9.034]
  - - [2304, 64, 1, 768]
    - [250, 16.524]
  - - [2304, 128, 1, 768]
    - [251, 26.175]
  - - [2304, 256, 1, 768]
    - [217, 41.006]
  - - [2304, 384, 1, 768]
    - [209, 41.382]
  - - [2304, 512, 1, 768]
    - [205, 54.124]
  - - [2304, 768, 1, 768]
    - [252, 59.296]
  - - [2304, 1024, 1, 768]
    - [207, 67.831]
  - - [2304, 1536, 1, 768]
    - [253, 72.302]
  - - [2304, 2048, 1, 768]
    - [253, 76.444]
  - - [2304, 3072, 1, 768]
    - [210, 78.515]
  - - [2304, 4096, 1, 768]
    - [207, 79.725]
  - - [2304, 6144, 1, 768]
    - [210, 80.946]
  - - [2304, 8192, 1, 768]
    - [254, 81.558]
  - - [2304, 12288, 1, 768]
    - [210, 82.161]
  - - [2304, 16384, 1, 768]
    - [207, 82.455]
  - - [2304, 24576, 1, 768]
    - [207, 82.509]
  - - [2304, 32768, 1, 768]
    - [210, 82.716]
  - - [2304, 49152, 1, 768]
    - [210, 82.958]
  - - [2304, 65536, 1, 768]
    - [210, 83.011]
  - - [2304, 98304, 1, 768]
    - [210, 83.001]
  - - [2304, 131072, 1, 768]
    - [255, 83.084]
  - - [3072, 16, 1, 1]
    - [183, 0.02]
  - - [3072, 32, 1, 1]
    - [256, 0.035]
  - - [3072, 64, 1, 1]
    - [184, 0.068]
  - - [3072, 128, 1, 1]
    - [257, 0.123]
  - - [3072, 256, 1, 1]
    - [258, 0.22]
  - - [3072, 384, 1, 1]
    - [259, 0.312]
  - - [3072, 512, 1, 1]
    - [191, 0.386]
  - - [3072, 768, 1, 1]
    - [188, 0.502]
  - - [3072, 1024, 1, 1]
    - [260, 0.593]
  - - [3072, 1536, 1, 1]
    - [261, 0.734]
  - - [3072, 2048, 1, 1]
    - [262, 0.836]
  - - [3072, 3072, 1, 1]
    - [241, 1.408]
  - - [3072, 4096, 1, 1]
    - [263, 1.761]
  - - [3072, 6144, 1, 1]
    - [264, 1.991]
  - - [3072, 8192, 1, 1]
    - [262, 2.155]
  - - [3072, 12288, 1, 1]
    - [265, 2.319]
  - - [3072, 16384, 1, 1]
    - [266, 2.414]
  - - [3072, 24576, 1, 1]
    - [243, 1.015]
  - - [3072, 32768, 1, 1]
    - [267, 0.944]
  - - [3072, 49152, 1, 1]
    - [268, 0.954]
  - - [3072, 65536, 1, 1]
    - [268, 0.959]
  - - [3072, 16, 1, 768]
    - [228, 4.888]
  - - [3072, 32, 1, 768]
    - [269, 11.088]
  - - [3072, 64, 1, 768]
    - [215, 19.289]
  - - [3072, 128, 1, 768]
    - [270, 27.783]
  - - [3072, 256, 1, 768]
    - [270, 42.658]
  - - [3072, 384, 1, 768]
    - [204, 53.726]
  - - [3072, 512, 1, 768]
    - [220, 55.794]
  - - [3072, 768, 1, 768]
    - [253, 67.606]
  - - [3072, 1024, 1, 768]
    - [207, 64.497]
  - - [3072, 1536, 1, 768]
    - [253, 76.018]
  - - [3072, 3072, 1, 768]
    - [207, 79.477]
  - - [3072, 4096, 1, 768]
    - [207, 78.428]
  - - [3072, 6144, 1, 768]
    - [207, 81.465]
  - - [3072, 8192, 1, 768]
    - [271, 80.003]
  - - [3072, 12288, 1, 768]
    - [207, 82.403]
  - - [3072, 24576, 1, 768]
    - [210, 82.65]
  - - [3072, 32768, 1, 768]
    - [210, 82.585]
  - - [3072, 49152, 1, 768]
    - [210, 82.866]
  - - [3072, 65536, 1, 768]
    - [210, 82.851]
  - - [3072, 98304, 1, 768]
    - [210, 82.719]
  - - [3072, 131072, 1, 768]
    - [207, 81.576]
  - - [3072, 256, 1, 1024]
    - [270, 40.032]
  - - [3072, 384, 1, 1024]
    - [272, 55.454]
  - - [3072, 768, 1, 1024]
    - [220, 68.691]
  - - [3072, 1536, 1, 1024]
    - [220, 75.141]
  - - [3072, 3072, 1, 1024]
    - [273, 79.754]
  - - [3072, 16384, 1, 1024]
    - [225, 81.814]
  - - [3072, 24576, 1, 1024]
    - [255, 81.46]
  - - [3072, 32768, 1, 1024]
    - [208, 81.967]
  - - [3072, 49152, 1, 1024]
    - [208, 82.403]
  - - [3072, 65536, 1, 1024]
    - [208, 82.559]
  - - [4096, 16, 1, 1024]
    - [274, 7.081]
  - - [4096, 32, 1, 1024]
    - [250, 15.754]
  - - [4096, 64, 1, 1024]
    - [251, 25.231]
  - - [4096, 128, 1, 1024]
    - [270, 40.103]
  - - [4096, 256, 1, 1024]
    - [205, 50.887]
  - - [4096, 384, 1, 1024]
    - [220, 57.417]
  - - [4096, 768, 1, 1024]
    - [224, 64.159]
  - - [4096, 1536, 1, 1024]
    - [220, 74.499]
  - - [4096, 24576, 1, 1024]
    - [255, 82.272]
  - - [4096, 49152, 1, 1024]
    - [208, 82.703]
  - - [4096, 65536, 1, 1024]
    - [208, 82.575]
  - - [1280, 4096, 1, 1280]
    - [209, 75.914]
  - - [1280, 4096, 1, 5120]
    - [272, 77.757]
  - - [3840, 4096, 1, 1280]
    - [209, 79.214]
  - - [5120, 4096, 1, 1280]
    - [210, 80.982]
  - - [64, 128, 12, 128]
    - [275, 3.339]
  - - [64, 128, 16, 128]
    - [276, 3.604]
  - - [64, 128, 24, 128]
    - [276, 5.366]
  - - [64, 128, 32, 128]
    - [277, 6.919]
  - - [64, 128, 48, 128]
    - [278, 9.557]
  - - [64, 128, 64, 128]
    - [278, 12.053]
  - - [64, 128, 96, 128]
    - [279, 15.281]
  - - [64, 128, 384, 128]
    - [280, 25.148]
  - - [64, 64, 12, 64]
    - [277, 0.778]
  - - [64, 64, 16, 64]
    - [278, 1.047]
  - - [64, 64, 24, 64]
    - [278, 1.56]
  - - [64, 64, 32, 64]
    - [278, 2.035]
  - - [64, 64, 48, 64]
    - [278, 3.02]
  - - [64, 64, 64, 64]
    - [278, 3.976]
  - - [64, 64, 96, 64]
    - [278, 5.555]
  - - [64, 64, 128, 64]
    - [276, 7.061]
  - - [64, 64, 192, 64]
    - [277, 9.231]
  - - [64, 64, 256, 64]
    - [278, 11.4]
  - - [64, 64, 384, 64]
    - [277, 13.172]
  - - [64, 64, 512, 64]
    - [280, 13.096]
  - - [64, 64, 768, 64]
    - [182, 16.22]
  - - [64, 64, 1024, 64]
    - [280, 18.912]
  - - [16, 16, 12, 64]
    - [281, 0.04]
  - - [16, 16, 24, 64]
    - [282, 0.08]
  - - [16, 16, 48, 64]
    - [283, 0.161]
  - - [16, 16, 96, 64]
    - [281, 0.318]
  - - [16, 16, 192, 64]
    - [278, 0.622]
  - - [16, 16, 384, 64]
    - [275, 1.15]
  - - [32, 32, 12, 64]
    - [278, 0.16]
  - - [32, 32, 24, 64]
    - [281, 0.323]
  - - [32, 32, 48, 64]
    - [278, 0.637]
  - - [32, 32, 96, 64]
    - [276, 1.228]
  - - [32, 32, 192, 64]
    - [277, 2.239]
  - - [32, 32, 384, 64]
    - [278, 3.579]
  - - [64, 16, 12, 16]
    - [284, 0.047]
  - - [64, 16, 16, 16]
    - [285, 0.063]
  - - [64, 16, 24, 16]
    - [285, 0.096]
  - - [64, 16, 32, 16]
    - [285, 0.127]
  - - [64, 16, 48, 16]
    - [286, 0.188]
  - - [64, 16, 64, 16]
    - [284, 0.246]
  - - [64, 16, 96, 16]
    - [281, 0.354]
  - - [64, 16, 128, 16]
    - [283, 0.46]
  - - [64, 16, 192, 16]
    - [281, 0.632]
  - - [64, 16, 384, 16]
    - [278, 0.982]
  - - [64, 16, 512, 16]
    - [287, 1.139]
  - - [64, 16, 768, 16]
    - [288, 1.46]
  - - [64, 16, 1024, 16]
    - [289, 1.735]
  - - [64, 16, 1536, 16]
    - [277, 2.211]
  - - [64, 16, 2048, 16]
    - [277, 2.61]
  - - [64, 16, 3072, 16]
    - [277, 3.347]
  - - [64, 32, 12, 32]
    - [290, 0.169]
  - - [64, 32, 16, 32]
    - [278, 0.225]
  - - [64, 32, 24, 32]
    - [278, 0.341]
  - - [64, 32, 32, 32]
    - [283, 0.456]
  - - [64, 32, 48, 32]
    - [283, 0.662]
  - - [64, 32, 64, 32]
    - [283, 0.843]
  - - [64, 32, 96, 32]
    - [278, 1.224]
  - - [64, 32, 128, 32]
    - [290, 1.472]
  - - [64, 32, 192, 32]
    - [276, 1.928]
  - - [64, 32, 256, 32]
    - [278, 2.313]
  - - [64, 32, 384, 32]
    - [291, 2.616]
  - - [64, 32, 512, 32]
    - [292, 3.112]
  - - [64, 32, 768, 32]
    - [293, 3.896]
  - - [64, 32, 1024, 32]
    - [181, 4.69]
  - - [64, 32, 1536, 32]
    - [181, 5.995]
  - - [64, 32, 2048, 32]
    - [181, 6.925]
  - - [64, 32, 3072, 32]
    - [181, 8.511]
  - - [64, 256, 12, 256]
    - [294, 8.983]
  - - [64, 256, 16, 256]
    - [295, 11.018]
  - - [64, 256, 24, 256]
    - [294, 14.823]
  - - [64, 256, 32, 256]
    - [294, 18.441]
  - - [64, 256, 48, 256]
    - [294, 22.219]
  - - [64, 256, 64, 256]
    - [296, 23.326]
  - - [64, 256, 96, 256]
    - [182, 22.406]
  - - [64, 256, 128, 256]
    - [182, 26.226]
  - - [64, 384, 12, 384]
    - [279, 14.836]
  - - [64, 384, 16, 384]
    - [175, 19.442]
  - - [64, 384, 24, 384]
    - [279, 26.337]
  - - [64, 384, 32, 384]
    - [279, 29.088]
  - - [64, 384, 48, 384]
    - [279, 36.211]
  - - [64, 384, 64, 384]
    - [175, 32.926]
  - - [64, 384, 96, 384]
    - [182, 34.71]
  - - [64, 512, 12, 512]
    - [294, 20.949]
  - - [64, 512, 24, 512]
    - [295, 29.095]
  - - [64, 512, 32, 512]
    - [296, 29.772]
  - - [64, 64, 1280, 64]
    - [280, 21.085]
  - - [128, 128, 12, 64]
    - [297, 3.487]
  - - [128, 128, 24, 64]
    - [298, 5.889]
  - - [128, 128, 48, 64]
    - [299, 10.247]
  - - [128, 128, 96, 64]
    - [298, 16.846]
  - - [128, 128, 384, 64]
    - [271, 32.627]
  - - [256, 256, 12, 64]
    - [300, 11.977]
  - - [256, 256, 24, 64]
    - [299, 17.388]
  - - [256, 256, 48, 64]
    - [301, 26.653]
  - - [256, 256, 96, 64]
    - [301, 36.333]
  - - [256, 256, 192, 64]
    - [270, 50.917]
  - - [256, 256, 384, 64]
    - [302, 66.036]
  - - [384, 384, 12, 64]
    - [252, 26.501]
  - - [384, 384, 24, 64]
    - [298, 29.949]
  - - [384, 384, 48, 64]
    - [298, 41.171]
  - - [384, 384, 96, 64]
    - [302, 60.609]
  - - [384, 384, 384, 64]
    - [300, 61.181]
  - - [512, 512, 12, 64]
    - [298, 32.256]
  - - [512, 512, 24, 64]
    - [219, 42.248]
  - - [512, 512, 96, 64]
    - [220, 63.676]
  - - [512, 512, 384, 64]
    - [300, 58.997]
  - - [1024, 1, 1, 1]
    - [303, 0.0]
  - - [1024, 2, 1, 1]
    - [186, 0.001]
  - - [1024, 4, 1, 1]
    - [186, 0.001]
  - - [1024, 8, 1, 1]
    - [186, 0.003]
  - - [1024, 16, 1, 1]
    - [304, 0.006]
  - - [1024, 32, 1, 1]
    - [186, 0.012]
  - - [1024, 64, 1, 1]
    - [186, 0.024]
  - - [1024, 128, 1, 1]
    - [186, 0.046]
  - - [1024, 256, 1, 1024]
    - [305, 25.79]
  - - [1024, 384, 1, 1024]
    - [288, 29.434]
  - - [1024, 768, 1, 1024]
    - [305, 44.158]
  - - [1024, 1536, 1, 1024]
    - [306, 53.7]
  - - [1024, 24576, 1, 1024]
    - [307, 79.985]
  - - [1024, 49152, 1, 1024]
    - [220, 80.629]
  - - [1024, 65536, 1, 1024]
    - [220, 81.067]
- null
