library/src/blas3/Tensile/Logic/asm_full/navi21/navi21_Cijk_Ailk_Bljk_HB_GB.yaml
- {MinimumRequiredVersion: 4.26.0}
- navi21
- gfx1030
- [Device 73a2]
    SolutionIndex: 0
    SolutionNameMin: Cijk_Ailk_Bljk_HB_MT128x64x8_SN_SU0_SUM0_TT8_8_WG16_8_1_WGM1
    SolutionIndex: 1
    SolutionNameMin: Cijk_Ailk_Bljk_HB_MT128x128x8_SN_SU0_SUM0_TT8_16_WG16_8_1_WGM1
    SolutionIndex: 2
    SolutionNameMin: Cijk_Ailk_Bljk_HB_MT256x128x8_SN_SU0_SUM0_TT16_16_WG16_8_1_WGM1
    SolutionIndex: 3
    SolutionNameMin: Cijk_Ailk_Bljk_HB_MT128x64x16_SN_SU0_SUM0_TT8_8_WG16_8_1_WGM1
    SolutionIndex: 4
    SolutionNameMin: Cijk_Ailk_Bljk_HB_MT128x128x16_SN_SU0_SUM0_TT8_16_WG16_8_1_WGM1
    SolutionIndex: 5
    SolutionNameMin: Cijk_Ailk_Bljk_HB_MT256x128x16_SN_SU0_SUM0_TT16_16_WG16_8_1_WGM1
    SolutionIndex: 6
    SolutionNameMin: Cijk_Ailk_Bljk_HB_MT128x128x16_SN_SU0_SUM0_TT8_8_WG16_16_1_WGM1
    SolutionIndex: 7
    SolutionNameMin: Cijk_Ailk_Bljk_HB_MT128x256x16_SN_SU0_SUM0_TT8_16_WG16_16_1_WGM1
    SolutionIndex: 8
    SolutionNameMin: Cijk_Ailk_Bljk_HB_MT128x64x16_SN_SU32_SUM3_TT8_8_WG16_8_1_WGM1
    SolutionIndex: 9
    SolutionNameMin: Cijk_Ailk_Bljk_HB_MT128x128x16_SN_SU32_SUM3_TT8_16_WG16_8_1_WGM1
    SolutionIndex: 10
    SolutionNameMin: Cijk_Ailk_Bljk_HB_MT256x128x16_SN_SU32_SUM3_TT16_16_WG16_8_1_WGM1
    SolutionIndex: 11
    SolutionNameMin: Cijk_Ailk_Bljk_HB_MT128x128x16_SN_SU32_SUM3_TT8_8_WG16_16_1_WGM1
    SolutionIndex: 12
    SolutionNameMin: Cijk_Ailk_Bljk_HB_MT128x256x16_SN_SU32_SUM3_TT8_16_WG16_16_1_WGM1
    SolutionIndex: 13
    SolutionNameMin: Cijk_Ailk_Bljk_HB_MT128x64x8_SN_SU0_SUM0_TT8_8_WG16_8_1_WGM4
    SolutionIndex: 14
    SolutionNameMin: Cijk_Ailk_Bljk_HB_MT256x128x8_SN_SU0_SUM0_TT16_16_WG16_8_1_WGM4
    SolutionIndex: 15
    SolutionNameMin: Cijk_Ailk_Bljk_HB_MT128x64x16_SN_SU0_SUM0_TT8_8_WG16_8_1_WGM4
    SolutionIndex: 16
    SolutionNameMin: Cijk_Ailk_Bljk_HB_MT128x128x16_SN_SU0_SUM0_TT8_16_WG16_8_1_WGM4
    SolutionIndex: 17
    SolutionNameMin: Cijk_Ailk_Bljk_HB_MT256x128x16_SN_SU0_SUM0_TT16_16_WG16_8_1_WGM4
    SolutionIndex: 18
    SolutionNameMin: Cijk_Ailk_Bljk_HB_MT128x128x16_SN_SU0_SUM0_TT8_8_WG16_16_1_WGM4
    SolutionIndex: 19
    SolutionNameMin: Cijk_Ailk_Bljk_HB_MT128x256x16_SN_SU0_SUM0_TT8_16_WG16_16_1_WGM4
    SolutionIndex: 20
    SolutionNameMin: Cijk_Ailk_Bljk_HB_MT128x128x32_SN_SU0_SUM0_TT8_16_WG16_8_1_WGM4
    SolutionIndex: 21
    SolutionNameMin: Cijk_Ailk_Bljk_HB_MT128x64x8_SN_SU32_SUM3_TT8_8_WG16_8_1_WGM4
    SolutionIndex: 22
    SolutionNameMin: Cijk_Ailk_Bljk_HB_MT128x64x16_SN_SU32_SUM3_TT8_8_WG16_8_1_WGM4
    SolutionIndex: 23
    SolutionNameMin: Cijk_Ailk_Bljk_HB_MT128x128x16_SN_SU32_SUM3_TT8_16_WG16_8_1_WGM4
    SolutionIndex: 24
    SolutionNameMin: Cijk_Ailk_Bljk_HB_MT256x128x16_SN_SU32_SUM3_TT16_16_WG16_8_1_WGM4
    SolutionIndex: 25
    SolutionNameMin: Cijk_Ailk_Bljk_HB_MT128x128x16_SN_SU32_SUM3_TT8_8_WG16_16_1_WGM4
    SolutionIndex: 26
    SolutionNameMin: Cijk_Ailk_Bljk_HB_MT128x256x16_SN_SU32_SUM3_TT8_16_WG16_16_1_WGM4
    SolutionIndex: 27
    SolutionNameMin: Cijk_Ailk_Bljk_HB_MT128x64x8_SN_SU0_SUM0_TT8_8_WG16_8_1_WGM8
    SolutionIndex: 28
    SolutionNameMin: Cijk_Ailk_Bljk_HB_MT128x128x8_SN_SU0_SUM0_TT8_16_WG16_8_1_WGM8
    SolutionIndex: 29
    SolutionNameMin: Cijk_Ailk_Bljk_HB_MT256x128x8_SN_SU0_SUM0_TT16_16_WG16_8_1_WGM8
    SolutionIndex: 30
    SolutionNameMin: Cijk_Ailk_Bljk_HB_MT128x64x16_SN_SU0_SUM0_TT8_8_WG16_8_1_WGM8
    SolutionIndex: 31
    SolutionNameMin: Cijk_Ailk_Bljk_HB_MT128x128x16_SN_SU0_SUM0_TT8_16_WG16_8_1_WGM8
    SolutionIndex: 32
    SolutionNameMin: Cijk_Ailk_Bljk_HB_MT256x128x16_SN_SU0_SUM0_TT16_16_WG16_8_1_WGM8
    SolutionIndex: 33
    SolutionNameMin: Cijk_Ailk_Bljk_HB_MT128x128x16_SN_SU0_SUM0_TT8_8_WG16_16_1_WGM8
    SolutionIndex: 34
    SolutionNameMin: Cijk_Ailk_Bljk_HB_MT128x256x16_SN_SU0_SUM0_TT8_16_WG16_16_1_WGM8
    SolutionIndex: 35
    SolutionNameMin: Cijk_Ailk_Bljk_HB_MT128x128x32_SN_SU0_SUM0_TT8_8_WG16_16_1_WGM8
    SolutionIndex: 36
    SolutionNameMin: Cijk_Ailk_Bljk_HB_MT128x64x8_SN_SU32_SUM3_TT8_8_WG16_8_1_WGM8
    SolutionIndex: 37
    SolutionNameMin: Cijk_Ailk_Bljk_HB_MT128x128x8_SN_SU32_SUM3_TT8_16_WG16_8_1_WGM8
    SolutionIndex: 38
    SolutionNameMin: Cijk_Ailk_Bljk_HB_MT128x64x16_SN_SU32_SUM3_TT8_8_WG16_8_1_WGM8
    SolutionIndex: 39
    SolutionNameMin: Cijk_Ailk_Bljk_HB_MT128x128x16_SN_SU32_SUM3_TT8_16_WG16_8_1_WGM8
    SolutionIndex: 40
    SolutionNameMin: Cijk_Ailk_Bljk_HB_MT256x128x16_SN_SU32_SUM3_TT16_16_WG16_8_1_WGM8
    SolutionIndex: 41
    SolutionNameMin: Cijk_Ailk_Bljk_HB_MT128x128x16_SN_SU32_SUM3_TT8_8_WG16_16_1_WGM8
    SolutionIndex: 42
    SolutionNameMin: Cijk_Ailk_Bljk_HB_MT128x256x16_SN_SU32_SUM3_TT8_16_WG16_16_1_WGM8
    SolutionIndex: 43
    SolutionNameMin: Cijk_Ailk_Bljk_HB_MT64x64x8_SN_SU0_SUM0_TT8_8_WG8_8_1_WGM1
    SolutionIndex: 44
    SolutionNameMin: Cijk_Ailk_Bljk_HB_MT128x64x8_SN_SU0_SUM0_TT8_8_WG16_8_1_WGM1
    SolutionIndex: 45
    SolutionNameMin: Cijk_Ailk_Bljk_HB_MT64x64x16_SN_SU0_SUM0_TT8_8_WG8_8_1_WGM1
    SolutionIndex: 46
    SolutionNameMin: Cijk_Ailk_Bljk_HB_MT128x64x16_SN_SU0_SUM0_TT8_8_WG16_8_1_WGM1
    SolutionIndex: 47
    SolutionNameMin: Cijk_Ailk_Bljk_HB_MT128x128x16_SN_SU0_SUM0_TT8_8_WG16_16_1_WGM1
    SolutionIndex: 48
    SolutionNameMin: Cijk_Ailk_Bljk_HB_MT128x64x32_SN_SU0_SUM0_TT8_8_WG16_8_1_WGM1
    SolutionIndex: 49
    SolutionNameMin: Cijk_Ailk_Bljk_HB_MT64x64x8_SN_SU32_SUM3_TT8_8_WG8_8_1_WGM1
    SolutionIndex: 50
    SolutionNameMin: Cijk_Ailk_Bljk_HB_MT128x64x8_SN_SU32_SUM3_TT8_8_WG16_8_1_WGM1
    SolutionIndex: 51
    SolutionNameMin: Cijk_Ailk_Bljk_HB_MT64x64x16_SN_SU32_SUM3_TT8_8_WG8_8_1_WGM1
    SolutionIndex: 52
    SolutionNameMin: Cijk_Ailk_Bljk_HB_MT128x64x16_SN_SU32_SUM3_TT8_8_WG16_8_1_WGM1
    SolutionIndex: 53
    SolutionNameMin: Cijk_Ailk_Bljk_HB_MT128x128x16_SN_SU32_SUM3_TT8_8_WG16_16_1_WGM1
    SolutionIndex: 54
    SolutionNameMin: Cijk_Ailk_Bljk_HB_MT64x64x32_SN_SU32_SUM3_TT8_8_WG8_8_1_WGM1
    SolutionIndex: 55
    SolutionNameMin: Cijk_Ailk_Bljk_HB_MT64x64x8_SN_SU0_SUM0_TT8_8_WG8_8_1_WGM4
    SolutionIndex: 56
    SolutionNameMin: Cijk_Ailk_Bljk_HB_MT128x64x8_SN_SU0_SUM0_TT8_8_WG16_8_1_WGM4
    SolutionIndex: 57
    SolutionNameMin: Cijk_Ailk_Bljk_HB_MT64x64x16_SN_SU0_SUM0_TT8_8_WG8_8_1_WGM4
    SolutionIndex: 58
    SolutionNameMin: Cijk_Ailk_Bljk_HB_MT128x64x16_SN_SU0_SUM0_TT8_8_WG16_8_1_WGM4
    SolutionIndex: 59
    SolutionNameMin: Cijk_Ailk_Bljk_HB_MT128x128x16_SN_SU0_SUM0_TT8_8_WG16_16_1_WGM4
    SolutionIndex: 60
    SolutionNameMin: Cijk_Ailk_Bljk_HB_MT64x64x8_SN_SU32_SUM3_TT8_8_WG8_8_1_WGM4
    SolutionIndex: 61
    SolutionNameMin: Cijk_Ailk_Bljk_HB_MT128x64x8_SN_SU32_SUM3_TT8_8_WG16_8_1_WGM4
    SolutionIndex: 62
    SolutionNameMin: Cijk_Ailk_Bljk_HB_MT64x64x16_SN_SU32_SUM3_TT8_8_WG8_8_1_WGM4
    SolutionIndex: 63
    SolutionNameMin: Cijk_Ailk_Bljk_HB_MT128x64x16_SN_SU32_SUM3_TT8_8_WG16_8_1_WGM4
    SolutionIndex: 64
    SolutionNameMin: Cijk_Ailk_Bljk_HB_MT128x128x16_SN_SU32_SUM3_TT8_8_WG16_16_1_WGM4
    SolutionIndex: 65
    SolutionNameMin: Cijk_Ailk_Bljk_HB_MT128x64x8_SN_SU0_SUM0_TT8_8_WG16_8_1_WGM8
    SolutionIndex: 66
    SolutionNameMin: Cijk_Ailk_Bljk_HB_MT128x64x16_SN_SU0_SUM0_TT8_8_WG16_8_1_WGM8
    SolutionIndex: 67
    SolutionNameMin: Cijk_Ailk_Bljk_HB_MT128x128x16_SN_SU0_SUM0_TT8_8_WG16_16_1_WGM8
    SolutionIndex: 68
    SolutionNameMin: Cijk_Ailk_Bljk_HB_MT128x64x8_SN_SU32_SUM3_TT8_8_WG16_8_1_WGM8
    SolutionIndex: 69
    SolutionNameMin: Cijk_Ailk_Bljk_HB_MT64x64x16_SN_SU32_SUM3_TT8_8_WG8_8_1_WGM8
    SolutionIndex: 70
    SolutionNameMin: Cijk_Ailk_Bljk_HB_MT128x64x16_SN_SU32_SUM3_TT8_8_WG16_8_1_WGM8
    SolutionIndex: 71
    SolutionNameMin: Cijk_Ailk_Bljk_HB_MT128x128x16_SN_SU32_SUM3_TT8_8_WG16_16_1_WGM8
    SolutionIndex: 72
    SolutionNameMin: Cijk_Ailk_Bljk_HB_MT32x16x8_SN_SU0_SUM0_TT2_2_WG16_8_1_WGM1
    SolutionIndex: 73
    SolutionNameMin: Cijk_Ailk_Bljk_HB_MT64x32x8_SN_SU0_SUM0_TT4_4_WG16_8_1_WGM1
    SolutionIndex: 74
    SolutionNameMin: Cijk_Ailk_Bljk_HB_MT64x64x8_SN_SU0_SUM0_TT4_4_WG16_16_1_WGM1
    SolutionIndex: 75
    SolutionNameMin: Cijk_Ailk_Bljk_HB_MT16x16x16_SN_SU0_SUM0_TT2_2_WG8_8_1_WGM1
    SolutionIndex: 76
    SolutionNameMin: Cijk_Ailk_Bljk_HB_MT32x16x16_SN_SU0_SUM0_TT2_2_WG16_8_1_WGM1
    SolutionIndex: 77
    SolutionNameMin: Cijk_Ailk_Bljk_HB_MT64x32x16_SN_SU0_SUM0_TT4_4_WG16_8_1_WGM1
    SolutionIndex: 78
    SolutionNameMin: Cijk_Ailk_Bljk_HB_MT16x16x32_SN_SU0_SUM0_TT2_2_WG8_8_1_WGM1
    SolutionIndex: 79
    SolutionNameMin: Cijk_Ailk_Bljk_HB_MT32x16x32_SN_SU0_SUM0_TT2_2_WG16_8_1_WGM1
    SolutionIndex: 80
    SolutionNameMin: Cijk_Ailk_Bljk_HB_MT32x16x8_SN_SU32_SUM3_TT2_2_WG16_8_1_WGM1
    SolutionIndex: 81
    SolutionNameMin: Cijk_Ailk_Bljk_HB_MT64x32x8_SN_SU32_SUM3_TT4_4_WG16_8_1_WGM1
    SolutionIndex: 82
    SolutionNameMin: Cijk_Ailk_Bljk_HB_MT64x64x8_SN_SU32_SUM3_TT4_4_WG16_16_1_WGM1
    SolutionIndex: 83
    SolutionNameMin: Cijk_Ailk_Bljk_HB_MT32x16x16_SN_SU32_SUM3_TT2_2_WG16_8_1_WGM1
    SolutionIndex: 84
    SolutionNameMin: Cijk_Ailk_Bljk_HB_MT64x32x8_SN_SU0_SUM0_TT4_4_WG16_8_1_WGM4
    SolutionIndex: 85
    SolutionNameMin: Cijk_Ailk_Bljk_HB_MT64x64x8_SN_SU0_SUM0_TT4_4_WG16_16_1_WGM4
    SolutionIndex: 86
    SolutionNameMin: Cijk_Ailk_Bljk_HB_MT32x16x16_SN_SU0_SUM0_TT2_2_WG16_8_1_WGM4
    SolutionIndex: 87
    SolutionNameMin: Cijk_Ailk_Bljk_HB_MT64x32x16_SN_SU0_SUM0_TT4_4_WG16_8_1_WGM4
    SolutionIndex: 88
    SolutionNameMin: Cijk_Ailk_Bljk_HB_MT32x16x32_SN_SU0_SUM0_TT2_2_WG16_8_1_WGM4
    SolutionIndex: 89
    SolutionNameMin: Cijk_Ailk_Bljk_HB_MT32x16x8_SN_SU32_SUM3_TT2_2_WG16_8_1_WGM4
    SolutionIndex: 90
    SolutionNameMin: Cijk_Ailk_Bljk_HB_MT64x32x8_SN_SU32_SUM3_TT4_4_WG16_8_1_WGM4
    SolutionIndex: 91
    SolutionNameMin: Cijk_Ailk_Bljk_HB_MT64x64x8_SN_SU32_SUM3_TT4_4_WG16_16_1_WGM4
    SolutionIndex: 92
    SolutionNameMin: Cijk_Ailk_Bljk_HB_MT64x32x8_SN_SU0_SUM0_TT4_4_WG16_8_1_WGM8
    SolutionIndex: 93
    SolutionNameMin: Cijk_Ailk_Bljk_HB_MT64x64x8_SN_SU0_SUM0_TT4_4_WG16_16_1_WGM8
    SolutionIndex: 94
    SolutionNameMin: Cijk_Ailk_Bljk_HB_MT32x16x16_SN_SU0_SUM0_TT2_2_WG16_8_1_WGM8
    SolutionIndex: 95
    SolutionNameMin: Cijk_Ailk_Bljk_HB_MT64x32x16_SN_SU0_SUM0_TT4_4_WG16_8_1_WGM8
    SolutionIndex: 96
    SolutionNameMin: Cijk_Ailk_Bljk_HB_MT64x32x8_SN_SU32_SUM3_TT4_4_WG16_8_1_WGM8
    SolutionIndex: 97
    SolutionNameMin: Cijk_Ailk_Bljk_HB_MT64x64x8_SN_SU32_SUM3_TT4_4_WG16_16_1_WGM8
    SolutionIndex: 98
    SolutionNameMin: Cijk_Ailk_Bljk_HB_MT32x16x16_SN_SU32_SUM3_TT2_2_WG16_8_1_WGM8
    SolutionIndex: 99
    SolutionNameMin: Cijk_Ailk_Bljk_HB_MT64x8x32_SN_SU0_SUM0_TT2_2_WG32_4_1_WGM1
    SolutionIndex: 100
    SolutionNameMin: Cijk_Ailk_Bljk_HB_MT128x8x32_SN_SU0_SUM0_TT4_2_WG32_4_1_WGM1
    SolutionIndex: 101
    SolutionNameMin: Cijk_Ailk_Bljk_HB_MT64x8x32_SN_SU0_SUM0_TT2_2_WG32_4_1_WGM4
    SolutionIndex: 102
    SolutionNameMin: Cijk_Ailk_Bljk_HB_MT64x8x32_SN_SU0_SUM0_TT2_2_WG32_4_1_WGM8
    SolutionIndex: 103
    SolutionNameMin: Cijk_Ailk_Bljk_HB_MT128x8x32_SN_SU0_SUM0_TT4_2_WG32_4_1_WGM8
    SolutionIndex: 104
    SolutionNameMin: Cijk_Ailk_Bljk_HB_GB_MT32x32x8_SN_EPS0_GRVW2_LRVW2_NLCA1_SU0_SUM0_SUS0_TT2_2_VW2_WG16_16_1_WGM1
    SolutionIndex: 105
    SolutionNameMin: Cijk_Ailk_Bljk_HB_GB_MT32x16x16_SN_EPS1_GRVW2_LRVW2_NLCA1_SU32_SUM3_SUS128_TT2_2_VW2_WG16_8_1_WGM1
    SolutionIndex: 106
    SolutionNameMin: Cijk_Ailk_Bljk_HB_GB_MT32x32x16_SN_EPS0_GRVW2_LRVW2_NLCA1_SU0_SUM0_SUS0_TT2_2_VW2_WG16_16_1_WGM1
    SolutionIndex: 107
    SolutionNameMin: Cijk_Ailk_Bljk_HB_GB_MT32x32x16_SN_EPS1_GRVW2_LRVW2_NLCA1_SU0_SUM0_SUS0_TT2_2_VW2_WG16_16_1_WGM1
    SolutionIndex: 108
    SolutionNameMin: Cijk_Ailk_Bljk_HB_GB_MT32x32x8_SN_EPS1_GRVW2_LRVW2_NLCA1_SU0_SUM0_SUS0_TT2_2_VW2_WG16_16_1_WGM8
    SolutionIndex: 109
    SolutionNameMin: Cijk_Ailk_Bljk_HB_GB_MT32x64x8_SN_EPS1_GRVW2_LRVW2_NLCA1_SU0_SUM0_SUS0_TT4_8_VW2_WG8_8_1_WGM4
    SolutionIndex: 110
    SolutionNameMin: Cijk_Ailk_Bljk_HB_GB_MT32x16x16_SN_EPS1_GRVW2_LRVW2_NLCA1_SU0_SUM0_SUS0_TT2_2_VW2_WG16_8_1_WGM1
    SolutionIndex: 111
    SolutionNameMin: Cijk_Ailk_Bljk_HB_GB_MT16x16x16_SN_EPS0_GRVW2_LRVW2_NLCA1_SU0_SUM0_SUS0_TT2_2_VW2_WG8_8_1_WGM8
    SolutionIndex: 112
    SolutionNameMin: Cijk_Ailk_Bljk_HB_GB_MT64x32x16_SN_EPS1_GRVW2_LRVW2_NLCA1_SU0_SUM0_SUS0_TT4_4_VW2_WG16_8_1_WGM8
    SolutionIndex: 113
    SolutionNameMin: Cijk_Ailk_Bljk_HB_GB_MT128x16x8_SN_EPS0_GRVW2_LRVW2_NLCA1_SU0_SUM0_SUS0_TT4_4_VW2_WG32_4_1_WGM1
    SolutionIndex: 114
    SolutionNameMin: Cijk_Ailk_Bljk_HB_GB_MT64x32x8_SN_EPS1_GRVW2_LRVW2_NLCA1_SU0_SUM0_SUS0_TT4_4_VW2_WG16_8_1_WGM8
    SolutionIndex: 115
    SolutionNameMin: Cijk_Ailk_Bljk_HB_GB_MT128x16x8_SN_EPS0_GRVW2_LRVW2_NLCA1_SU0_SUM0_SUS0_TT4_4_VW2_WG32_4_1_WGM8
    SolutionIndex: 116
    SolutionNameMin: Cijk_Ailk_Bljk_HB_GB_MT64x32x8_SN_EPS0_GRVW2_LRVW2_NLCA1_SU32_SUM3_SUS128_TT4_8_VW2_WG16_4_1_WGM1
    SolutionIndex: 117
    SolutionNameMin: Cijk_Ailk_Bljk_HB_GB_MT128x16x8_SN_EPS1_GRVW2_LRVW2_NLCA1_SU0_SUM0_SUS0_TT4_4_VW2_WG32_4_1_WGM8
    SolutionIndex: 118
    SolutionNameMin: Cijk_Ailk_Bljk_HB_GB_MT128x32x8_SN_EPS0_GRVW2_LRVW2_NLCA1_SU0_SUM0_SUS0_TT4_8_VW2_WG32_4_1_WGM1
    SolutionIndex: 119
    SolutionNameMin: Cijk_Ailk_Bljk_HB_GB_MT256x32x8_SN_EPS1_GRVW2_LRVW2_NLCA1_SU0_SUM0_SUS0_TT8_8_VW2_WG32_4_1_WGM8
    SolutionIndex: 120
    SolutionNameMin: Cijk_Ailk_Bljk_HB_GB_MT128x128x32_SN_EPS0_GRVW8_LRVW8_NLCA1_SU0_SUM0_SUS0_TT8_8_VW8_WG16_16_1_WGM8
    SolutionIndex: 121
    SolutionNameMin: Cijk_Ailk_Bljk_HB_GB_MT128x32x8_SN_EPS0_GRVW2_LRVW2_NLCA1_SU0_SUM0_SUS0_TT4_8_VW2_WG32_4_1_WGM8
    SolutionIndex: 122
    SolutionNameMin: Cijk_Ailk_Bljk_HB_GB_MT16x16x16_SN_EPS0_GRVW2_LRVW2_NLCA1_SU32_SUM3_SUS128_TT2_2_VW2_WG8_8_1_WGM8
    SolutionIndex: 123
    SolutionNameMin: Cijk_Ailk_Bljk_HB_GB_MT64x8x32_SN_EPS0_GRVW2_LRVW2_NLCA1_SU32_SUM3_SUS128_TT2_2_VW2_WG32_4_1_WGM4
    SolutionIndex: 124
    SolutionNameMin: Cijk_Ailk_Bljk_HB_GB_MT64x8x32_SN_EPS0_GRVW2_LRVW2_NLCA1_SU0_SUM0_SUS0_TT2_2_VW2_WG32_4_1_WGM8
    SolutionIndex: 125
    SolutionNameMin: Cijk_Ailk_Bljk_HB_GB_MT128x16x16_SN_EPS0_GRVW2_LRVW2_NLCA1_SU32_SUM3_SUS128_TT4_4_VW2_WG32_4_1_WGM8
    SolutionIndex: 126
    SolutionNameMin: Cijk_Ailk_Bljk_HB_GB_MT128x16x16_SN_EPS0_GRVW2_LRVW2_NLCA1_SU0_SUM0_SUS0_TT4_4_VW2_WG32_4_1_WGM4
    SolutionIndex: 127
    SolutionNameMin: Cijk_Ailk_Bljk_HB_GB_MT128x32x16_SN_EPS0_GRVW8_LRVW8_NLCA1_SU32_SUM3_SUS128_TT8_8_VW8_WG16_4_1_WGM1
    SolutionIndex: 128
    SolutionNameMin: Cijk_Ailk_Bljk_HB_GB_MT256x32x16_SN_EPS0_GRVW8_LRVW8_NLCA1_SU0_SUM0_SUS0_TT8_8_VW8_WG32_4_1_WGM1
    SolutionIndex: 129
    SolutionNameMin: Cijk_Ailk_Bljk_HB_GB_MT128x64x8_SN_EPS0_GRVW8_LRVW8_NLCA1_SU32_SUM3_SUS128_TT8_8_VW8_WG16_8_1_WGM1
    SolutionIndex: 130
    SolutionNameMin: Cijk_Ailk_Bljk_HB_GB_MT128x128x16_SN_EPS0_GRVW8_LRVW8_NLCA1_SU0_SUM0_SUS0_TT8_8_VW8_WG16_16_1_WGM8
    SolutionIndex: 131
    SolutionNameMin: Cijk_Ailk_Bljk_HB_GB_MT256x64x8_SN_EPS0_GRVW8_LRVW8_NLCA1_SU32_SUM3_SUS128_TT8_16_VW8_WG32_4_1_WGM8
    SolutionIndex: 132
    SolutionNameMin: Cijk_Ailk_Bljk_HB_GB_MT256x64x8_SN_EPS0_GRVW8_LRVW8_NLCA1_SU32_SUM3_SUS128_TT8_16_VW8_WG32_4_1_WGM1
    SolutionIndex: 133
    SolutionNameMin: Cijk_Ailk_Bljk_HB_GB_MT256x64x8_SN_EPS0_GRVW8_LRVW8_NLCA1_SU0_SUM0_SUS0_TT8_16_VW8_WG32_4_1_WGM1
    SolutionIndex: 134
    SolutionNameMin: Cijk_Ailk_Bljk_HB_GB_MT128x256x16_SN_EPS0_GRVW8_LRVW8_NLCA1_SU0_SUM0_SUS0_TT8_16_VW8_WG16_16_1_WGM4
    SolutionIndex: 135
    SolutionNameMin: Cijk_Ailk_Bljk_HB_GB_MT32x16x32_SN_EPS0_GRVW2_LRVW2_NLCA1_SU32_SUM3_SUS128_TT2_2_VW2_WG16_8_1_WGM8
    SolutionIndex: 136
    SolutionNameMin: Cijk_Ailk_Bljk_HB_GB_MT64x8x32_SN_EPS0_GRVW2_LRVW2_NLCA1_SU0_SUM0_SUS0_TT2_2_VW2_WG32_4_1_WGM1
    SolutionIndex: 137
    SolutionNameMin: Cijk_Ailk_Bljk_HB_GB_MT64x8x32_SN_EPS0_GRVW2_LRVW2_NLCA1_SU0_SUM0_SUS0_TT2_2_VW2_WG32_4_1_WGM4
    SolutionIndex: 138
    SolutionNameMin: Cijk_Ailk_Bljk_HB_GB_MT128x16x16_SN_EPS0_GRVW2_LRVW2_NLCA1_SU0_SUM0_SUS0_TT4_4_VW2_WG32_4_1_WGM8
    SolutionIndex: 139
    SolutionNameMin: Cijk_Ailk_Bljk_HB_GB_MT128x32x16_SN_EPS0_GRVW8_LRVW8_NLCA1_SU0_SUM0_SUS0_TT8_8_VW8_WG16_4_1_WGM1
    SolutionIndex: 140
    SolutionNameMin: Cijk_Ailk_Bljk_HB_GB_MT128x64x16_SN_EPS0_GRVW8_LRVW8_NLCA1_SU32_SUM3_SUS128_TT8_8_VW8_WG16_8_1_WGM8
    SolutionIndex: 141
    SolutionNameMin: Cijk_Ailk_Bljk_HB_GB_MT128x128x16_SN_EPS0_GRVW8_LRVW8_NLCA1_SU32_SUM3_SUS128_TT8_8_VW8_WG16_16_1_WGM1
    SolutionIndex: 142
    SolutionNameMin: Cijk_Ailk_Bljk_HB_GB_MT256x64x16_SN_EPS0_GRVW8_LRVW8_NLCA1_SU32_SUM3_SUS128_TT8_16_VW8_WG32_4_1_WGM8
    SolutionIndex: 143
    SolutionNameMin: Cijk_Ailk_Bljk_HB_GB_MT256x64x8_SN_EPS0_GRVW8_LRVW8_NLCA1_SU32_SUM3_SUS128_TT8_16_VW8_WG32_4_1_WGM4
    SolutionIndex: 144
    SolutionNameMin: Cijk_Ailk_Bljk_HB_GB_MT128x256x16_SN_EPS0_GRVW8_LRVW8_NLCA1_SU32_SUM3_SUS128_TT8_16_VW8_WG16_16_1_WGM1
    SolutionIndex: 145
    SolutionNameMin: Cijk_Ailk_Bljk_HB_GB_MT256x64x8_SN_EPS1_GRVW8_LRVW8_NLCA1_SU32_SUM3_SUS128_TT8_16_VW8_WG32_4_1_WGM8
    SolutionIndex: 146
    SolutionNameMin: Cijk_Ailk_Bljk_HB_GB_MT32x16x8_SN_EPS1_GRVW2_LRVW2_NLCA1_SU0_SUM0_SUS0_TT2_2_VW2_WG16_8_1_WGM1
    SolutionIndex: 147
    SolutionNameMin: Cijk_Ailk_Bljk_HB_GB_MT32x16x16_SN_EPS1_GRVW2_LRVW2_NLCA1_SU0_SUM0_SUS0_TT2_2_VW2_WG16_8_1_WGM4
    SolutionIndex: 148
    SolutionNameMin: Cijk_Ailk_Bljk_HB_GB_MT32x16x32_SN_EPS0_GRVW2_LRVW2_NLCA1_SU0_SUM0_SUS0_TT2_2_VW2_WG16_8_1_WGM1
    SolutionIndex: 149
    SolutionNameMin: Cijk_Ailk_Bljk_HB_GB_MT128x16x32_SN_EPS0_GRVW2_LRVW2_NLCA1_SU0_SUM0_SUS0_TT4_4_VW2_WG32_4_1_WGM8
    SolutionIndex: 150
    SolutionNameMin: Cijk_Ailk_Bljk_HB_GB_MT256x32x16_SN_EPS0_GRVW8_LRVW8_NLCA1_SU0_SUM0_SUS0_TT8_8_VW8_WG32_4_1_WGM8
    SolutionIndex: 151
    SolutionNameMin: Cijk_Ailk_Bljk_HB_GB_MT256x32x8_SN_EPS0_GRVW8_LRVW8_NLCA1_SU32_SUM3_SUS128_TT8_8_VW8_WG32_4_1_WGM1
    SolutionIndex: 152
    SolutionNameMin: Cijk_Ailk_Bljk_HB_GB_MT128x16x32_SN_EPS0_GRVW2_LRVW2_NLCA1_SU0_SUM0_SUS0_TT4_4_VW2_WG32_4_1_WGM1
    SolutionIndex: 153
    SolutionNameMin: Cijk_Ailk_Bljk_HB_GB_MT128x64x16_SN_EPS0_GRVW8_LRVW8_NLCA1_SU32_SUM3_SUS128_TT8_8_VW8_WG16_8_1_WGM4
    SolutionIndex: 154
    SolutionNameMin: Cijk_Ailk_Bljk_HB_GB_MT256x64x16_SN_EPS0_GRVW8_LRVW8_NLCA1_SU32_SUM3_SUS128_TT8_16_VW8_WG32_4_1_WGM4
    SolutionIndex: 155
    SolutionNameMin: Cijk_Ailk_Bljk_HB_GB_MT256x64x16_SN_EPS0_GRVW8_LRVW8_NLCA1_SU32_SUM3_SUS128_TT8_16_VW8_WG32_4_1_WGM1
    SolutionIndex: 156
    SolutionNameMin: Cijk_Ailk_Bljk_HB_GB_MT256x256x16_SN_EPS0_GRVW8_LRVW8_NLCA1_SU32_SUM3_SUS128_TT16_16_VW8_WG16_16_1_WGM4
    SolutionIndex: 157
    SolutionNameMin: Cijk_Ailk_Bljk_HB_GB_MT32x16x8_SN_EPS0_GRVW2_LRVW2_NLCA1_SU0_SUM0_SUS0_TT2_2_VW2_WG16_8_1_WGM1
    SolutionIndex: 158
    SolutionNameMin: Cijk_Ailk_Bljk_HB_GB_MT64x16x8_SN_EPS0_GRVW2_LRVW2_NLCA1_SU0_SUM0_SUS0_TT4_4_VW2_WG16_4_1_WGM1
    SolutionIndex: 159
    SolutionNameMin: Cijk_Ailk_Bljk_HB_GB_MT64x16x8_SN_EPS1_GRVW2_LRVW2_NLCA1_SU0_SUM0_SUS0_TT4_4_VW2_WG16_4_1_WGM1
    SolutionIndex: 160
    SolutionNameMin: Cijk_Ailk_Bljk_HB_GB_MT64x16x8_SN_EPS0_GRVW2_LRVW2_NLCA1_SU32_SUM3_SUS128_TT4_4_VW2_WG16_4_1_WGM1
    SolutionIndex: 161
    SolutionNameMin: Cijk_Ailk_Bljk_HB_GB_MT128x16x8_SN_EPS1_GRVW2_LRVW2_NLCA1_SU32_SUM3_SUS128_TT4_4_VW2_WG32_4_1_WGM8
    SolutionIndex: 162
    SolutionNameMin: Cijk_Ailk_Bljk_HB_GB_MT128x16x8_SN_EPS0_GRVW2_LRVW2_NLCA1_SU32_SUM3_SUS128_TT4_4_VW2_WG32_4_1_WGM8
    SolutionIndex: 163
    SolutionNameMin: Cijk_Ailk_Bljk_HB_GB_MT256x32x8_SN_EPS0_GRVW8_LRVW8_NLCA1_SU0_SUM0_SUS0_TT8_8_VW8_WG32_4_1_WGM8
    SolutionIndex: 164
    SolutionNameMin: Cijk_Ailk_Bljk_HB_GB_MT128x16x16_SN_EPS0_GRVW2_LRVW2_NLCA1_SU0_SUM0_SUS0_TT4_4_VW2_WG32_4_1_WGM1
    SolutionIndex: 165
    SolutionNameMin: Cijk_Ailk_Bljk_HB_GB_MT16x16x8_SN_EPS0_GRVW2_LRVW2_NLCA1_SU0_SUM0_SUS0_TT2_2_VW2_WG8_8_1_WGM1
    SolutionIndex: 166
    SolutionNameMin: Cijk_Ailk_Bljk_HB_GB_MT128x16x16_SN_EPS1_GRVW2_LRVW2_NLCA1_SU32_SUM3_SUS128_TT4_4_VW2_WG32_4_1_WGM1
    SolutionIndex: 167
    SolutionNameMin: Cijk_Ailk_Bljk_HB_GB_MT128x32x32_SN_EPS1_GRVW2_LRVW2_NLCA1_SU32_SUM3_SUS128_TT4_8_VW2_WG32_4_1_WGM1
    SolutionIndex: 168
    SolutionNameMin: Cijk_Ailk_Bljk_HB_GB_MT128x32x32_SN_EPS0_GRVW2_LRVW2_NLCA1_SU32_SUM3_SUS128_TT4_8_VW2_WG32_4_1_WGM1
    SolutionIndex: 169
    SolutionNameMin: Cijk_Ailk_Bljk_HB_GB_MT16x16x8_SN_EPS0_GRVW2_LRVW2_NLCA1_SU32_SUM3_SUS128_TT2_2_VW2_WG8_8_1_WGM1
    SolutionIndex: 170
    SolutionNameMin: Cijk_Ailk_Bljk_HB_GB_MT64x8x32_SN_EPS1_GRVW2_LRVW2_NLCA1_SU0_SUM0_SUS0_TT2_2_VW2_WG32_4_1_WGM4
    SolutionIndex: 171
    SolutionNameMin: Cijk_Ailk_Bljk_HB_GB_MT128x64x16_SN_EPS0_GRVW8_LRVW8_NLCA1_SU0_SUM0_SUS0_TT8_8_VW8_WG16_8_1_WGM8
    SolutionIndex: 172
    SolutionNameMin: Cijk_Ailk_Bljk_HB_GB_MT128x128x16_SN_EPS0_GRVW8_LRVW8_NLCA1_SU0_SUM0_SUS0_TT8_8_VW8_WG16_16_1_WGM1
    SolutionIndex: 173
    SolutionNameMin: Cijk_Ailk_Bljk_HB_GB_MT128x64x8_SN_EPS0_GRVW8_LRVW8_NLCA1_SU0_SUM0_SUS0_TT8_8_VW8_WG16_8_1_WGM1
    SolutionIndex: 174
    SolutionNameMin: Cijk_Ailk_Bljk_HB_GB_MT128x128x16_SN_EPS0_GRVW8_LRVW8_NLCA1_SU0_SUM0_SUS0_TT8_8_VW8_WG16_16_1_WGM4
    SolutionIndex: 175
    SolutionNameMin: Cijk_Ailk_Bljk_HB_GB_MT256x64x8_SN_EPS0_GRVW8_LRVW8_NLCA1_SU0_SUM0_SUS0_TT8_16_VW8_WG32_4_1_WGM4
    SolutionIndex: 176
    SolutionNameMin: Cijk_Ailk_Bljk_HB_GB_MT256x64x8_SN_EPS1_GRVW8_LRVW8_NLCA1_SU0_SUM0_SUS0_TT8_16_VW8_WG32_4_1_WGM8
    SolutionIndex: 177
    SolutionNameMin: Cijk_Ailk_Bljk_HB_GB_MT64x64x8_SN_EPS0_GRVW2_LRVW2_NLCA1_SU0_SUM0_SUS0_TT4_4_VW2_WG16_16_1_WGM8
    SolutionIndex: 178
    SolutionNameMin: Cijk_Ailk_Bljk_HB_GB_MT64x32x16_SN_EPS0_GRVW2_LRVW2_NLCA1_SU0_SUM0_SUS0_TT4_4_VW2_WG16_8_1_WGM4
    SolutionIndex: 179
    SolutionNameMin: Cijk_Ailk_Bljk_HB_GB_MT64x32x16_SN_EPS0_GRVW2_LRVW2_NLCA1_SU0_SUM0_SUS0_TT4_4_VW2_WG16_8_1_WGM8
    SolutionIndex: 180
    SolutionNameMin: Cijk_Ailk_Bljk_HB_GB_MT128x32x8_SN_EPS1_GRVW2_LRVW2_NLCA1_SU0_SUM0_SUS0_TT4_8_VW2_WG32_4_1_WGM8
    SolutionIndex: 181
    SolutionNameMin: Cijk_Ailk_Bljk_HB_GB_MT128x32x8_SN_EPS1_GRVW8_LRVW8_NLCA1_SU0_SUM0_SUS0_TT8_8_VW8_WG16_4_1_WGM1
    SolutionIndex: 182
    SolutionNameMin: Cijk_Ailk_Bljk_HB_GB_MT128x16x16_SN_EPS1_GRVW2_LRVW2_NLCA1_SU0_SUM0_SUS0_TT4_4_VW2_WG32_4_1_WGM8
    SolutionIndex: 183
    SolutionNameMin: Cijk_Ailk_Bljk_HB_GB_MT128x16x16_SN_EPS0_GRVW2_LRVW2_NLCA1_SU32_SUM3_SUS128_TT4_4_VW2_WG32_4_1_WGM1
    SolutionIndex: 184
    SolutionNameMin: Cijk_Ailk_Bljk_HB_GB_MT128x16x16_SN_EPS1_GRVW2_LRVW2_NLCA1_SU0_SUM0_SUS0_TT4_4_VW2_WG32_4_1_WGM1
    SolutionIndex: 185
    SolutionNameMin: Cijk_Ailk_Bljk_HB_GB_MT32x16x8_SN_EPS1_GRVW2_LRVW2_NLCA1_SU32_SUM3_SUS128_TT2_2_VW2_WG16_8_1_WGM1
    SolutionIndex: 186
    SolutionNameMin: Cijk_Ailk_Bljk_HB_GB_MT128x16x32_SN_EPS0_GRVW2_LRVW2_NLCA1_SU32_SUM3_SUS128_TT4_4_VW2_WG32_4_1_WGM1
    SolutionIndex: 187
    SolutionNameMin: Cijk_Ailk_Bljk_HB_GB_MT256x32x8_SN_EPS0_GRVW8_LRVW8_NLCA1_SU0_SUM0_SUS0_TT8_8_VW8_WG32_4_1_WGM1
    SolutionIndex: 188
    SolutionNameMin: Cijk_Ailk_Bljk_HB_GB_MT128x64x16_SN_EPS0_GRVW8_LRVW8_NLCA1_SU0_SUM0_SUS0_TT8_8_VW8_WG16_8_1_WGM1
    SolutionIndex: 189
    SolutionNameMin: Cijk_Ailk_Bljk_HB_GB_MT256x64x8_SN_EPS1_GRVW8_LRVW8_NLCA1_SU0_SUM0_SUS0_TT8_16_VW8_WG32_4_1_WGM1
    SolutionIndex: 190
    SolutionNameMin: Cijk_Ailk_Bljk_HB_GB_MT256x64x16_SN_EPS0_GRVW8_LRVW8_NLCA1_SU0_SUM0_SUS0_TT8_16_VW8_WG32_4_1_WGM1
    SolutionIndex: 191
    SolutionNameMin: Cijk_Ailk_Bljk_HB_GB_MT128x256x16_SN_EPS0_GRVW8_LRVW8_NLCA1_SU32_SUM3_SUS128_TT8_16_VW8_WG16_16_1_WGM4
    SolutionIndex: 192
    SolutionNameMin: Cijk_Ailk_Bljk_HB_GB_MT128x128x16_SN_EPS0_GRVW8_LRVW8_NLCA1_SU32_SUM3_SUS128_TT8_16_VW8_WG16_8_1_WGM1
    SolutionIndex: 193
    SolutionNameMin: Cijk_Ailk_Bljk_HB_GB_MT256x64x8_SN_EPS1_GRVW8_LRVW8_NLCA1_SU32_SUM3_SUS128_TT8_16_VW8_WG32_4_1_WGM4
- - - [2944, 4288, 1, 1280]
    - [16, 88.811]
  - - [2368, 5888, 1, 256]
    - [9, 84.331]
  - - [512, 24000, 1, 1536]
    - [23, 90.591]
  - - [5888, 1856, 1, 3328]
    - [4, 85.957]
  - - [5888, 2944, 1, 3328]
    - [31, 91.638]
  - - [1856, 4288, 1, 256]
    - [30, 76.499]
  - - [5056, 5056, 1, 3328]
    - [4, 90.503]
  - - [1408, 5888, 1, 1280]
    - [31, 85.707]
  - - [6144, 6000, 1, 2560]
    - [23, 93.278]
  - - [1024, 3584, 1, 3328]
    - [31, 78.847]
  - - [512, 48000, 1, 2048]
    - [10, 92.059]
  - - [448, 3584, 1, 3328]
    - [3, 60.971]
  - - [5888, 1408, 1, 1280]
    - [4, 85.838]
  - - [1024, 2368, 1, 256]
    - [30, 68.109]
  - - [5056, 6784, 1, 1280]
    - [16, 92.477]
  - - [5056, 5056, 1, 1280]
    - [16, 90.043]
  - - [4288, 6784, 1, 256]
    - [4, 88.829]
  - - [6784, 448, 1, 256]
    - [3, 70.714]
  - - [5056, 256, 1, 1280]
    - [3, 63.604]
  - - [5888, 704, 1, 1280]
    - [31, 77.072]
  - - [3584, 1024, 1, 256]
    - [3, 73.185]
  - - [6784, 4288, 1, 3328]
    - [4, 91.053]
  - - [1856, 2368, 1, 3328]
    - [4, 82.585]
  - - [5888, 2944, 1, 1280]
    - [4, 91.198]
  - - [5888, 1024, 1, 256]
    - [4, 79.934]
  - - [1408, 2944, 1, 256]
    - [4, 73.974]
  - - [6784, 5056, 1, 3328]
    - [31, 92.784]
  - - [5056, 5056, 1, 256]
    - [23, 85.969]
  - - [1024, 3584, 1, 1280]
    - [31, 78.116]
  - - [2368, 2944, 1, 1280]
    - [31, 81.789]
  - - [6784, 6784, 1, 1280]
    - [4, 93.126]
  - - [1408, 4288, 1, 1280]
    - [31, 82.819]
  - - [3584, 4288, 1, 1280]
    - [31, 89.195]
  - - [512, 6000, 1, 2560]
    - [42, 76.063]
  - - [2368, 704, 1, 1280]
    - [3, 70.356]
  - - [5056, 4288, 1, 3328]
    - [19, 90.688]
  - - [3584, 2368, 1, 3328]
    - [31, 87.956]
  - - [5888, 6784, 1, 1280]
    - [2, 93.966]
  - - [6784, 448, 1, 1280]
    - [3, 74.498]
  - - [2944, 5888, 1, 256]
    - [4, 88.967]
  - - [4288, 2944, 1, 256]
    - [4, 85.168]
  - - [6144, 24000, 1, 2560]
    - [17, 94.656]
  - - [5056, 2368, 1, 1280]
    - [4, 84.791]
  - - [448, 3584, 1, 1280]
    - [3, 60.274]
  - - [6784, 5888, 1, 256]
    - [4, 92.168]
  - - [1024, 1408, 1, 256]
    - [27, 62.417]
  - - [2368, 2368, 1, 3328]
    - [4, 78.662]
  - - [5056, 704, 1, 3328]
    - [16, 76.111]
  - - [1408, 1856, 1, 256]
    - [30, 73.047]
  - - [5888, 1856, 1, 256]
    - [4, 81.369]
  - - [704, 5888, 1, 256]
    - [4, 69.185]
  - - [3584, 704, 1, 3328]
    - [30, 76.092]
  - - [1408, 1408, 1, 256]
    - [3, 68.147]
  - - [448, 4288, 1, 256]
    - [3, 57.125]
  - - [704, 2368, 1, 1280]
    - [3, 62.483]
  - - [1856, 2368, 1, 1280]
    - [4, 81.38]
  - - [1408, 1408, 1, 3328]
    - [30, 75.704]
  - - [256, 193600, 1, 64]
    - [27, 78.962]
  - - [1408, 1024, 1, 1280]
    - [27, 71.829]
  - - [704, 6784, 1, 256]
    - [3, 69.368]
  - - [6784, 704, 1, 256]
    - [30, 74.746]
  - - [2048, 7000, 1, 2048]
    - [23, 89.833]
  - - [5056, 704, 1, 256]
    - [3, 70.252]
  - - [1408, 3584, 1, 256]
    - [39, 79.018]
  - - [3584, 4288, 1, 3328]
    - [31, 89.939]
  - - [5888, 1856, 1, 1280]
    - [4, 85.256]
  - - [2368, 3584, 1, 1280]
    - [4, 86.993]
  - - [2944, 3584, 1, 3328]
    - [19, 92.396]
  - - [6784, 2944, 1, 256]
    - [4, 90.69]
  - - [1024, 1500, 1, 2560]
    - [39, 67.507]
  - - [1856, 2368, 1, 256]
    - [4, 71.739]
  - - [3584, 6784, 1, 3328]
    - [2, 92.337]
  - - [5056, 4288, 1, 1280]
    - [31, 90.108]
  - - [6784, 1856, 1, 3328]
    - [4, 86.409]
  - - [1408, 5056, 1, 1280]
    - [31, 84.024]
  - - [196, 1024, 64, 256]
    - [4, 62.62]
  - - [6784, 5888, 1, 3328]
    - [7, 94.047]
  - - [2368, 5056, 1, 1280]
    - [34, 84.658]
  - - [1024, 5056, 1, 1280]
    - [39, 84.719]
  - - [4288, 1024, 1, 256]
    - [9, 72.368]
  - - [2368, 1408, 1, 256]
    - [3, 70.322]
  - - [5888, 448, 1, 1280]
    - [27, 71.29]
  - - [704, 5888, 1, 3328]
    - [7, 79.745]
  - - [1024, 6784, 1, 1280]
    - [4, 88.836]
  - - [3584, 2944, 1, 1280]
    - [4, 91.333]
  - - [512, 6000, 1, 2816]
    - [19, 76.546]
  - - [512, 24000, 1, 2048]
    - [39, 90.476]
  - - [1408, 5056, 1, 3328]
    - [23, 84.744]
  - - [1856, 1856, 1, 3328]
    - [16, 73.882]
  - - [2368, 2368, 1, 256]
    - [15, 74.238]
  - - [4288, 4288, 1, 1280]
    - [4, 87.927]
  - - [5888, 1024, 1, 1280]
    - [4, 84.128]
  - - [1024, 12544, 1, 256]
    - [4, 88.017]
  - - [512, 48000, 1, 2560]
    - [40, 92.653]
  - - [704, 6784, 1, 3328]
    - [4, 80.117]
  - - [5888, 5888, 1, 3328]
    - [31, 93.86]
  - - [5056, 1024, 1, 1280]
    - [4, 84.403]
  - - [448, 5888, 1, 3328]
    - [12, 66.334]
  - - [1024, 2944, 1, 1280]
    - [15, 74.134]
  - - [5056, 5888, 1, 1280]
    - [4, 90.97]
  - - [448, 6784, 1, 256]
    - [18, 63.683]
  - - [3584, 5888, 1, 256]
    - [4, 90.246]
  - - [2944, 3584, 1, 256]
    - [4, 88.053]
  - - [3072, 1500, 1, 1024]
    - [39, 83.814]
  - - [6784, 1024, 1, 3328]
    - [7, 90.212]
  - - [6784, 2944, 1, 3328]
    - [4, 93.327]
  - - [6784, 2368, 1, 1280]
    - [16, 89.907]
  - - [4288, 3584, 1, 256]
    - [4, 85.867]
  - - [4288, 5888, 1, 1280]
    - [19, 90.97]
  - - [1024, 6000, 1, 1536]
    - [23, 84.333]
  - - [4288, 1856, 1, 1280]
    - [4, 81.682]
  - - [1856, 2944, 1, 3328]
    - [19, 84.243]
  - - [256, 6784, 1, 3328]
    - [41, 77.647]
  - - [512, 3000, 1, 1536]
    - [33, 66.065]
  - - [5056, 1024, 1, 256]
    - [6, 76.002]
  - - [5056, 1856, 1, 3328]
    - [4, 86.205]
  - - [4096, 7000, 1, 4096]
    - [9, 92.989]
  - - [5056, 256, 1, 3328]
    - [8, 65.621]
  - - [1024, 5888, 1, 1280]
    - [31, 83.733]
  - - [5056, 3584, 1, 256]
    - [7, 86.643]
  - - [1856, 1024, 1, 1280]
    - [3, 70.302]
  - - [1856, 1856, 1, 1280]
    - [4, 72.172]
  - - [3072, 24000, 1, 1024]
    - [40, 93.201]
  - - [1856, 1024, 1, 3328]
    - [3, 71.924]
  - - [6784, 1024, 1, 256]
    - [39, 84.281]
  - - [5056, 5888, 1, 3328]
    - [19, 91.491]
  - - [1856, 1024, 1, 256]
    - [3, 58.63]
  - - [512, 48000, 1, 1536]
    - [39, 92.265]
  - - [5056, 1408, 1, 3328]
    - [4, 84.597]
  - - [448, 5888, 1, 256]
    - [15, 59.228]
  - - [1408, 6784, 1, 3328]
    - [4, 88.1]
  - - [1024, 24000, 1, 2560]
    - [23, 92.224]
  - - [2944, 1408, 1, 3328]
    - [34, 79.174]
  - - [2944, 4288, 1, 3328]
    - [19, 90.359]
  - - [5056, 2944, 1, 256]
    - [9, 86.133]
  - - [2368, 1856, 1, 256]
    - [15, 71.942]
  - - [1408, 3584, 1, 3328]
    - [4, 85.754]
  - - [2368, 6784, 1, 256]
    - [4, 84.723]
  - - [4288, 2368, 1, 3328]
    - [4, 88.188]
  - - [704, 3584, 1, 1280]
    - [31, 70.996]
  - - [1408, 5888, 1, 3328]
    - [4, 86.469]
  - - [1856, 5056, 1, 256]
    - [23, 79.483]
  - - [6784, 6784, 1, 256]
    - [4, 91.34]
  - - [2368, 4288, 1, 1280]
    - [16, 87.069]
  - - [3584, 1856, 1, 1280]
    - [31, 84.117]
  - - [8448, 48000, 1, 2816]
    - [5, 95.455]
  - - [512, 6000, 1, 2048]
    - [42, 74.534]
  - - [3584, 448, 1, 256]
    - [30, 61.817]
  - - [3584, 3584, 1, 1280]
    - [19, 91.735]
  - - [256, 6784, 1, 256]
    - [3, 66.419]
  - - [1856, 3584, 1, 3328]
    - [34, 86.147]
  - - [3584, 3584, 1, 256]
    - [4, 88.141]
  - - [6784, 4288, 1, 1280]
    - [4, 90.731]
  - - [3584, 5056, 1, 256]
    - [31, 85.763]
  - - [2944, 2368, 1, 1280]
    - [31, 82.016]
  - - [6784, 3584, 1, 256]
    - [4, 90.043]
  - - [1856, 1408, 1, 256]
    - [0, 64.274]
  - - [2944, 2944, 1, 3328]
    - [4, 90.241]
  - - [5056, 6784, 1, 256]
    - [31, 89.67]
  - - [1408, 4288, 1, 3328]
    - [16, 84.288]
  - - [6784, 256, 1, 1280]
    - [6, 76.49]
  - - [2368, 704, 1, 3328]
    - [30, 72.519]
  - - [3584, 6784, 1, 256]
    - [4, 89.998]
  - - [5056, 1856, 1, 256]
    - [39, 79.228]
  - - [1024, 3000, 1, 2816]
    - [34, 76.44]
  - - [704, 4288, 1, 256]
    - [30, 63.812]
  - - [1408, 6784, 1, 1280]
    - [4, 87.624]
  - - [7680, 24000, 1, 2560]
    - [17, 94.931]
  - - [4608, 48000, 1, 1536]
    - [5, 95.136]
  - - [1024, 24000, 1, 1536]
    - [39, 91.94]
  - - [5056, 2368, 1, 3328]
    - [4, 85.538]
  - - [2944, 4288, 1, 256]
    - [16, 83.873]
  - - [1408, 3584, 1, 1280]
    - [4, 84.922]
  - - [1024, 1500, 1, 2816]
    - [4, 68.062]
  - - [1024, 6000, 1, 2048]
    - [39, 84.798]
  - - [512, 24000, 1, 2560]
    - [39, 90.803]
  - - [6144, 3000, 1, 2560]
    - [16, 90.823]
  - - [2368, 6784, 1, 3328]
    - [39, 90.442]
  - - [5056, 704, 1, 1280]
    - [3, 74.306]
  - - [1856, 4288, 1, 3328]
    - [4, 82.693]
  - - [1408, 5888, 1, 256]
    - [4, 82.632]
  - - [704, 2944, 1, 1280]
    - [4, 70.408]
  - - [3584, 704, 1, 1280]
    - [30, 75.31]
  - - [5888, 5056, 1, 256]
    - [4, 88.391]
  - - [3584, 448, 1, 3328]
    - [15, 70.493]
  - - [704, 2368, 1, 3328]
    - [15, 63.9]
  - - [448, 5056, 1, 3328]
    - [30, 68.118]
  - - [4288, 448, 1, 256]
    - [21, 61.156]
  - - [5888, 2368, 1, 256]
    - [4, 83.823]
  - - [6784, 704, 1, 3328]
    - [16, 80.53]
  - - [1408, 2944, 1, 3328]
    - [19, 79.465]
  - - [4288, 4288, 1, 256]
    - [23, 84.838]
  - - [2368, 704, 1, 256]
    - [13, 59.649]
  - - [3584, 2368, 1, 256]
    - [23, 80.295]
  - - [5888, 5056, 1, 1280]
    - [4, 91.071]
  - - [8448, 24000, 1, 2816]
    - [32, 94.845]
  - - [3584, 3584, 1, 3328]
    - [7, 92.163]
  - - [3072, 1500, 1, 128]
    - [30, 64.03]
  - - [2048, 3136, 1, 512]
    - [15, 79.729]
  - - [5888, 6784, 1, 256]
    - [4, 92.197]
  - - [4288, 2944, 1, 3328]
    - [16, 90.149]
  - - [256, 5056, 1, 1280]
    - [30, 65.066]
  - - [6784, 5888, 1, 1280]
    - [4, 93.801]
  - - [5888, 4288, 1, 1280]
    - [16, 90.877]
  - - [1024, 24000, 1, 2048]
    - [39, 92.206]
  - - [1408, 1856, 1, 1280]
    - [30, 76.934]
  - - [5888, 448, 1, 3328]
    - [3, 71.066]
  - - [704, 5888, 1, 1280]
    - [7, 77.843]
  - - [5056, 2944, 1, 3328]
    - [4, 90.449]
  - - [448, 4288, 1, 1280]
    - [16, 64.59]
  - - [3584, 704, 1, 256]
    - [3, 70.597]
  - - [3584, 1408, 1, 3328]
    - [4, 85.768]
  - - [2368, 1024, 1, 1280]
    - [3, 71.315]
  - - [2944, 6784, 1, 1280]
    - [4, 92.971]
  - - [1856, 6784, 1, 256]
    - [4, 83.406]
  - - [4288, 448, 1, 3328]
    - [15, 72.876]
  - - [6784, 704, 1, 1280]
    - [16, 79.129]
  - - [5888, 1024, 1, 3328]
    - [4, 84.814]
  - - [704, 6784, 1, 1280]
    - [31, 78.355]
  - - [512, 3000, 1, 2048]
    - [11, 67.035]
  - - [5056, 1024, 1, 3328]
    - [4, 87.791]
  - - [704, 5056, 1, 1280]
    - [31, 74.272]
  - - [2944, 1856, 1, 256]
    - [15, 76.74]
  - - [5888, 5056, 1, 3328]
    - [19, 91.462]
  - - [3584, 6784, 1, 1280]
    - [4, 91.992]
  - - [1856, 5888, 1, 256]
    - [4, 80.498]
  - - [4288, 4288, 1, 3328]
    - [31, 88.457]
  - - [4288, 1408, 1, 1280]
    - [4, 83.088]
  - - [4288, 2368, 1, 256]
    - [4, 79.587]
  - - [2944, 5056, 1, 1280]
    - [4, 89.684]
  - - [6784, 2368, 1, 3328]
    - [16, 90.663]
  - - [4288, 1856, 1, 3328]
    - [4, 82.682]
  - - [1856, 2944, 1, 1280]
    - [34, 82.158]
  - - [4288, 6784, 1, 3328]
    - [4, 90.99]
  - - [3584, 1024, 1, 1280]
    - [39, 77.545]
  - - [1024, 4288, 1, 256]
    - [30, 76.562]
  - - [5888, 3584, 1, 3328]
    - [19, 93.311]
  - - [5056, 3584, 1, 3328]
    - [7, 90.156]
  - - [2368, 1408, 1, 1280]
    - [4, 79.763]
  - - [5056, 2944, 1, 1280]
    - [4, 89.743]
  - - [8448, 6000, 1, 2816]
    - [4, 93.293]
  - - [1024, 6784, 1, 256]
    - [31, 79.79]
  - - [2944, 5056, 1, 3328]
    - [34, 90.566]
  - - [3584, 2944, 1, 256]
    - [23, 87.424]
  - - [5056, 6784, 1, 3328]
    - [4, 92.844]
  - - [3584, 4288, 1, 256]
    - [28, 82.867]
  - - [1856, 6784, 1, 3328]
    - [4, 86.187]
  - - [512, 6000, 1, 1536]
    - [38, 74.448]
  - - [5056, 1408, 1, 1280]
    - [4, 83.9]
  - - [5888, 5888, 1, 256]
    - [39, 91.814]
  - - [4288, 1024, 1, 1280]
    - [7, 81.378]
  - - [448, 6784, 1, 3328]
    - [34, 75.75]
  - - [2944, 1408, 1, 1280]
    - [4, 78.486]
  - - [3072, 6000, 1, 1024]
    - [39, 90.262]
  - - [2944, 1856, 1, 3328]
    - [31, 83.616]
  - - [448, 5056, 1, 256]
    - [30, 61.644]
  - - [3584, 5888, 1, 1280]
    - [19, 92.91]
  - - [6784, 1856, 1, 1280]
    - [4, 85.905]
  - - [5888, 256, 1, 3328]
    - [4, 69.095]
  - - [1856, 5888, 1, 3328]
    - [7, 86.253]
  - - [3584, 1408, 1, 256]
    - [39, 79.104]
  - - [704, 3584, 1, 3328]
    - [4, 73.329]
  - - [5056, 448, 1, 1280]
    - [3, 74.34]
  - - [3584, 1856, 1, 3328]
    - [16, 85.328]
  - - [1024, 3000, 1, 2048]
    - [26, 75.118]
  - - [2944, 1024, 1, 256]
    - [3, 69.975]
  - - [2368, 4288, 1, 3328]
    - [7, 88.509]
  - - [1024, 1408, 1, 1280]
    - [3, 72.151]
  - - [6784, 5056, 1, 256]
    - [23, 89.646]
  - - [4288, 5888, 1, 256]
    - [4, 88.646]
  - - [2944, 6784, 1, 256]
    - [4, 90.661]
  - - [2368, 2368, 1, 1280]
    - [16, 77.775]
  - - [1856, 3584, 1, 1280]
    - [19, 84.57]
  - - [3584, 1408, 1, 1280]
    - [4, 84.705]
  - - [5056, 3584, 1, 1280]
    - [4, 89.585]
  - - [256, 5888, 1, 256]
    - [18, 58.188]
  - - [1856, 1408, 1, 3328]
    - [16, 75.684]
  - - [1024, 4288, 1, 3328]
    - [19, 83.365]
  - - [2944, 2368, 1, 3328]
    - [16, 83.235]
  - - [704, 4288, 1, 3328]
    - [19, 75.373]
  - - [1024, 48000, 1, 2816]
    - [2, 93.882]
  - - [1024, 1856, 1, 1280]
    - [3, 70.482]
  - - [6784, 1856, 1, 256]
    - [16, 82.217]
  - - [512, 48000, 1, 2816]
    - [4, 92.926]
  - - [512, 3000, 1, 2816]
    - [41, 67.45]
  - - [1024, 5888, 1, 256]
    - [4, 79.715]
  - - [1408, 2368, 1, 256]
    - [30, 71.847]
  - - [2944, 704, 1, 3328]
    - [34, 74.484]
  - - [2944, 2944, 1, 1280]
    - [4, 89.61]
  - - [6784, 256, 1, 3328]
    - [6, 78.148]
  - - [1408, 5056, 1, 256]
    - [39, 78.969]
  - - [512, 50176, 1, 128]
    - [31, 87.997]
  - - [1408, 4288, 1, 256]
    - [3, 77.105]
  - - [5888, 2368, 1, 1280]
    - [9, 87.482]
  - - [2368, 5888, 1, 1280]
    - [4, 87.41]
  - - [5888, 256, 1, 1280]
    - [4, 66.672]
  - - [2368, 1856, 1, 3328]
    - [4, 83.007]
  - - [2944, 704, 1, 256]
    - [30, 64.908]
  - - [2368, 6784, 1, 1280]
    - [31, 89.743]
  - - [2368, 1024, 1, 3328]
    - [15, 72.736]
  - - [1856, 4288, 1, 1280]
    - [4, 81.599]
  - - [704, 3584, 1, 256]
    - [6, 62.217]
  - - [704, 2944, 1, 3328]
    - [19, 74.103]
  - - [1856, 5056, 1, 3328]
    - [4, 86.185]
  - - [196, 256, 64, 1024]
    - [26, 58.799]
  - - [3584, 5056, 1, 1280]
    - [9, 89.314]
  - - [2944, 1024, 1, 3328]
    - [7, 76.607]
  - - [1408, 6784, 1, 256]
    - [4, 84.423]
  - - [6784, 1408, 1, 3328]
    - [31, 88.055]
  - - [1024, 2368, 1, 1280]
    - [30, 72.481]
  - - [6784, 2944, 1, 1280]
    - [4, 92.937]
  - - [3584, 448, 1, 1280]
    - [15, 69.156]
  - - [2944, 6784, 1, 3328]
    - [4, 93.262]
  - - [448, 5056, 1, 1280]
    - [3, 67.08]
  - - [4288, 5056, 1, 1280]
    - [4, 90.113]
  - - [4288, 704, 1, 256]
    - [3, 69.07]
  - - [5888, 704, 1, 256]
    - [3, 73.072]
  - - [256, 5888, 1, 3328]
    - [4, 68.917]
  - - [6784, 4288, 1, 256]
    - [4, 88.615]
  - - [5888, 256, 1, 256]
    - [0, 58.501]
  - - [6784, 1024, 1, 1280]
    - [7, 89.35]
  - - [2944, 704, 1, 1280]
    - [31, 70.356]
  - - [6784, 3584, 1, 1280]
    - [19, 92.017]
  - - [1408, 2944, 1, 1280]
    - [4, 78.477]
  - - [1408, 2368, 1, 3328]
    - [4, 81.904]
  - - [2368, 2944, 1, 256]
    - [4, 79.095]
  - - [3584, 1856, 1, 256]
    - [3, 77.951]
  - - [4288, 3584, 1, 1280]
    - [31, 89.219]
  - - [4288, 2944, 1, 1280]
    - [4, 89.438]
  - - [5056, 448, 1, 3328]
    - [15, 75.896]
  - - [5124, 1500, 1, 2048]
    - [12, 84.042]
  - - [4288, 5056, 1, 3328]
    - [7, 90.826]
  - - [256, 5056, 1, 3328]
    - [30, 66.566]
  - - [5056, 2368, 1, 256]
    - [9, 80.417]
  - - [4288, 704, 1, 3328]
    - [19, 75.409]
  - - [448, 3584, 1, 256]
    - [3, 53.351]
  - - [6144, 1500, 1, 2560]
    - [39, 89.242]
  - - [1024, 1408, 1, 3328]
    - [3, 73.895]
  - - [2944, 5888, 1, 1280]
    - [7, 91.484]
  - - [5888, 3584, 1, 256]
    - [4, 90.688]
  - - [1408, 1856, 1, 3328]
    - [30, 78.709]
  - - [7680, 6000, 1, 2560]
    - [4, 93.233]
  - - [6784, 1408, 1, 1280]
    - [4, 87.006]
  - - [512, 3000, 1, 2560]
    - [41, 67.425]
  - - [704, 2944, 1, 256]
    - [3, 61.953]
  - - [2944, 5888, 1, 3328]
    - [34, 91.904]
  - - [1024, 1500, 1, 1536]
    - [18, 66.034]
  - - [1408, 1408, 1, 1280]
    - [30, 74.615]
  - - [3072, 3000, 1, 1024]
    - [23, 87.92]
  - - [448, 4288, 1, 3328]
    - [34, 68.781]
  - - [704, 2368, 1, 256]
    - [3, 55.844]
  - - [5888, 2368, 1, 3328]
    - [16, 88.055]
  - - [5124, 9124, 1, 1760]
    - [9, 90.839]
  - - [4288, 5056, 1, 256]
    - [4, 85.452]
  - - [4288, 448, 1, 1280]
    - [3, 70.59]
  - - [5888, 704, 1, 3328]
    - [34, 79.057]
  - - [4288, 3584, 1, 3328]
    - [16, 89.874]
  - - [1024, 6784, 1, 3328]
    - [31, 89.504]
  - - [512, 3136, 1, 2048]
    - [22, 69.796]
  - - [1408, 1024, 1, 256]
    - [27, 63.559]
  - - [8448, 1500, 1, 2816]
    - [4, 90.365]
  - - [2560, 7000, 1, 2560]
    - [31, 91.324]
  - - [6784, 6784, 1, 3328]
    - [16, 93.296]
  - - [704, 5056, 1, 3328]
    - [16, 75.56]
  - - [3584, 5056, 1, 3328]
    - [19, 89.989]
  - - [2368, 2944, 1, 3328]
    - [4, 83.117]
  - - [2368, 3584, 1, 256]
    - [9, 76.844]
  - - [4608, 3000, 1, 1536]
    - [39, 90.0]
  - - [5124, 9124, 1, 4096]
    - [12, 90.823]
  - - [7680, 48000, 1, 2560]
    - [5, 95.346]
  - - [4608, 1500, 1, 1536]
    - [39, 86.6]
  - - [3584, 2368, 1, 1280]
    - [31, 86.772]
  - - [5124, 9124, 1, 2560]
    - [16, 90.844]
  - - [1856, 1856, 1, 256]
    - [3, 66.266]
  - - [4288, 1408, 1, 3328]
    - [4, 84.191]
  - - [5124, 9124, 1, 2048]
    - [12, 90.688]
  - - [5124, 700, 1, 2048]
    - [23, 74.705]
  - - [256, 12544, 1, 1024]
    - [12, 78.168]
  - - [5888, 1408, 1, 3328]
    - [4, 86.51]
  - - [256, 5056, 1, 256]
    - [36, 57.06]
  - - [2368, 5056, 1, 256]
    - [4, 80.191]
  - - [1024, 6000, 1, 2560]
    - [9, 85.06]
  - - [1024, 5056, 1, 256]
    - [30, 76.429]
  - - [4224, 1500, 1, 176]
    - [30, 74.249]
  - - [2368, 1408, 1, 3328]
    - [4, 81.615]
  - - [1024, 48000, 1, 1536]
    - [32, 93.167]
  - - [5888, 448, 1, 256]
    - [27, 64.822]
  - - [6784, 5056, 1, 1280]
    - [4, 92.177]
  - - [1024, 48000, 1, 2560]
    - [5, 93.503]
  - - [4288, 6784, 1, 1280]
    - [4, 90.395]
  - - [3072, 48000, 1, 1024]
    - [23, 94.275]
  - - [6784, 1408, 1, 256]
    - [4, 81.649]
  - - [5888, 4288, 1, 256]
    - [31, 87.13]
  - - [5056, 5888, 1, 256]
    - [23, 89.059]
  - - [2368, 1024, 1, 256]
    - [30, 63.536]
  - - [1856, 6784, 1, 1280]
    - [4, 85.885]
  - - [8448, 3000, 1, 2816]
    - [29, 91.651]
  - - [6784, 448, 1, 3328]
    - [7, 75.111]
  - - [5056, 1856, 1, 1280]
    - [4, 85.202]
  - - [1408, 1024, 1, 3328]
    - [30, 73.965]
  - - [7680, 1500, 1, 2560]
    - [31, 89.779]
  - - [5888, 3584, 1, 1280]
    - [16, 92.775]
  - - [1024, 2944, 1, 256]
    - [30, 70.144]
  - - [448, 6784, 1, 1280]
    - [34, 73.058]
  - - [704, 5056, 1, 256]
    - [3, 65.215]
  - - [3584, 1024, 1, 3328]
    - [4, 79.361]
  - - [2944, 1856, 1, 1280]
    - [31, 82.003]
  - - [5056, 256, 1, 256]
    - [0, 53.238]
  - - [2368, 3584, 1, 3328]
    - [4, 88.026]
  - - [3584, 5888, 1, 3328]
    - [19, 93.199]
  - - [2944, 3584, 1, 1280]
    - [19, 91.541]
  - - [1856, 5888, 1, 1280]
    - [19, 85.299]
  - - [4608, 24000, 1, 1536]
    - [24, 94.354]
  - - [4288, 1408, 1, 256]
    - [28, 74.152]
  - - [4288, 2368, 1, 1280]
    - [16, 87.11]
  - - [2944, 5056, 1, 256]
    - [39, 85.874]
  - - [6784, 2368, 1, 256]
    - [23, 85.806]
  - - [1024, 24000, 1, 2816]
    - [34, 92.72]
  - - [4288, 1856, 1, 256]
    - [8, 75.025]
  - - [1856, 2944, 1, 256]
    - [9, 77.002]
  - - [4608, 6000, 1, 1536]
    - [16, 91.398]
  - - [7680, 3000, 1, 2560]
    - [4, 91.283]
  - - [5124, 700, 1, 2560]
    - [4, 76.131]
  - - [1856, 1408, 1, 1280]
    - [4, 73.216]
  - - [1024, 4288, 1, 1280]
    - [4, 80.561]
  - - [2368, 5056, 1, 3328]
    - [19, 85.896]
  - - [4288, 1024, 1, 3328]
    - [19, 84.108]
  - - [6144, 48000, 1, 2560]
    - [17, 95.315]
  - - [1024, 5056, 1, 3328]
    - [31, 86.548]
  - - [1024, 1856, 1, 3328]
    - [15, 72.673]
  - - [5124, 1500, 1, 2560]
    - [42, 85.084]
  - - [3584, 2944, 1, 3328]
    - [4, 91.996]
  - - [5888, 2944, 1, 256]
    - [4, 89.061]
  - - [5056, 4288, 1, 256]
    - [23, 86.634]
  - - [1024, 3584, 1, 256]
    - [15, 73.034]
  - - [5056, 1408, 1, 256]
    - [9, 80.737]
  - - [5888, 5888, 1, 1280]
    - [4, 93.643]
  - - [448, 5888, 1, 1280]
    - [30, 64.538]
  - - [1024, 3000, 1, 2560]
    - [26, 75.815]
  - - [4288, 704, 1, 1280]
    - [3, 73.995]
  - - [2944, 1408, 1, 256]
    - [4, 73.929]
  - - [2368, 5888, 1, 3328]
    - [4, 87.999]
  - - [2368, 1856, 1, 1280]
    - [4, 81.069]
  - - [1024, 6000, 1, 2816]
    - [31, 85.445]
  - - [5888, 4288, 1, 3328]
    - [31, 91.263]
  - - [5056, 448, 1, 256]
    - [3, 64.757]
  - - [1856, 5056, 1, 1280]
    - [4, 85.202]
  - - [2944, 1024, 1, 1280]
    - [34, 75.183]
  - - [2368, 4288, 1, 256]
    - [39, 79.652]
  - - [1024, 2368, 1, 3328]
    - [15, 73.275]
  - - [4288, 5888, 1, 3328]
    - [7, 91.392]
  - - [1024, 2944, 1, 3328]
    - [34, 75.402]
  - - [256, 6784, 1, 1280]
    - [33, 75.982]
  - - [1856, 3584, 1, 256]
    - [19, 76.952]
  - - [1024, 1500, 1, 2048]
    - [25, 66.783]
  - - [512, 24000, 1, 2816]
    - [4, 90.932]
  - - [256, 5888, 1, 1280]
    - [18, 65.215]
  - - [2944, 2368, 1, 256]
    - [30, 78.508]
  - - [1024, 1856, 1, 256]
    - [3, 65.409]
  - - [6784, 3584, 1, 3328]
    - [7, 92.436]
  - - [1760, 7000, 1, 1760]
    - [7, 87.954]
  - - [1024, 5888, 1, 3328]
    - [4, 84.602]
  - - [1408, 2368, 1, 1280]
    - [16, 79.46]
  - - [2944, 2944, 1, 256]
    - [4, 85.912]
  - - [6784, 256, 1, 256]
    - [18, 67.042]
  - - [1024, 3000, 1, 1536]
    - [30, 74.583]
  - - [5888, 1408, 1, 256]
    - [4, 82.689]
  - - [5888, 6784, 1, 3328]
    - [14, 94.191]
  - - [704, 4288, 1, 1280]
    - [19, 71.006]
  - - [128, 50176, 1, 512]
    - [26, 80.16]
  - - [1024, 48000, 1, 2048]
    - [23, 93.298]
  - - [784, 512, 64, 128]
    - [1, 74.628]
  - - [3136, 256, 64, 64]
    - [37, 82.921]
  - - [12544, 1024, 1, 256]
    - [9, 87.933]
  - - [784, 128, 128, 512]
    - [20, 68.432]
  - - [784, 512, 256, 128]
    - [0, 70.55]
  - - [3136, 512, 1, 2048]
    - [11, 68.813]
  - - [12544, 256, 1, 1024]
    - [7, 78.732]
  - - [3136, 2048, 1, 512]
    - [39, 78.933]
  - - [3136, 256, 256, 64]
    - [0, 42.329]
  - - [784, 128, 64, 512]
    - [38, 68.711]
  - - [784, 512, 128, 128]
    - [31, 75.788]
  - - [784, 128, 256, 512]
    - [35, 66.543]
  - - [3136, 256, 128, 64]
    - [0, 55.296]
  - - [1024, 1024, 1, 3328]
    - [59, 67.261]
  - - [128, 6784, 1, 3328]
    - [59, 57.076]
  - - [256, 4288, 1, 3328]
    - [53, 69.995]
  - - [704, 1856, 1, 3328]
    - [46, 66.433]
  - - [448, 1024, 1, 1280]
    - [65, 44.813]
  - - [1024, 704, 1, 256]
    - [44, 42.744]
  - - [256, 1856, 1, 1280]
    - [44, 48.478]
  - - [256, 2944, 1, 3328]
    - [44, 60.854]
  - - [128, 3584, 1, 1280]
    - [61, 46.187]
  - - [4288, 256, 1, 256]
    - [44, 50.714]
  - - [5888, 64, 1, 3328]
    - [45, 41.519]
  - - [2944, 256, 1, 3328]
    - [58, 60.398]
  - - [1408, 448, 1, 1280]
    - [56, 49.494]
  - - [1408, 256, 1, 1280]
    - [44, 36.96]
  - - [3072, 128, 1, 1024]
    - [44, 39.085]
  - - [6784, 64, 1, 256]
    - [44, 30.208]
  - - [2368, 128, 1, 3328]
    - [57, 33.396]
  - - [2944, 128, 1, 256]
    - [61, 27.476]
  - - [448, 1408, 1, 256]
    - [45, 34.3]
  - - [64, 5056, 1, 3328]
    - [51, 35.056]
  - - [512, 1500, 1, 2816]
    - [65, 60.953]
  - - [256, 3584, 1, 3328]
    - [59, 60.232]
  - - [256, 1408, 1, 256]
    - [68, 26.348]
  - - [5056, 64, 1, 1280]
    - [45, 32.807]
  - - [2368, 128, 1, 256]
    - [43, 19.407]
  - - [4288, 128, 1, 1280]
    - [65, 52.688]
  - - [5888, 64, 1, 256]
    - [44, 27.0]
  - - [1856, 256, 1, 1280]
    - [44, 46.475]
  - - [64, 5888, 1, 3328]
    - [51, 40.612]
  - - [1024, 704, 1, 1280]
    - [56, 56.198]
  - - [256, 1408, 1, 3328]
    - [59, 40.436]
  - - [6784, 128, 1, 3328]
    - [67, 57.076]
  - - [704, 704, 1, 3328]
    - [59, 53.692]
  - - [3584, 256, 1, 3328]
    - [67, 60.286]
  - - [128, 3584, 1, 3328]
    - [59, 50.5]
  - - [128, 2944, 1, 1280]
    - [50, 38.126]
  - - [448, 1856, 1, 1280]
    - [45, 59.399]
  - - [3584, 128, 1, 256]
    - [44, 32.87]
  - - [448, 1408, 1, 3328]
    - [44, 50.572]
  - - [704, 1024, 1, 256]
    - [44, 41.219]
  - - [256, 3584, 1, 256]
    - [44, 45.916]
  - - [1408, 704, 1, 256]
    - [56, 50.213]
  - - [448, 2944, 1, 3328]
    - [45, 62.948]
  - - [64, 5888, 1, 256]
    - [49, 23.005]
  - - [512, 1500, 1, 2048]
    - [68, 59.474]
  - - [448, 2368, 1, 1280]
    - [45, 59.09]
  - - [704, 704, 1, 256]
    - [50, 31.111]
  - - [64, 193600, 1, 64]
    - [51, 48.742]
  - - [128, 4288, 1, 3328]
    - [70, 59.478]
  - - [256, 2368, 1, 256]
    - [44, 37.086]
  - - [1024, 448, 1, 3328]
    - [58, 50.089]
  - - [1856, 704, 1, 1280]
    - [46, 64.121]
  - - [1024, 1024, 1, 1280]
    - [59, 65.393]
  - - [256, 2944, 1, 256]
    - [44, 45.338]
  - - [1024, 700, 1, 512]
    - [68, 45.841]
  - - [128, 6784, 1, 1280]
    - [53, 54.154]
  - - [1408, 704, 1, 3328]
    - [67, 64.075]
  - - [128, 5888, 1, 1280]
    - [68, 57.572]
  - - [704, 1408, 1, 3328]
    - [47, 64.118]
  - - [7680, 64, 1, 2560]
    - [66, 52.525]
  - - [448, 704, 1, 1280]
    - [45, 32.022]
  - - [6784, 128, 1, 256]
    - [44, 45.016]
  - - [704, 448, 1, 256]
    - [60, 21.277]
  - - [256, 1856, 1, 3328]
    - [46, 51.878]
  - - [1024, 704, 1, 3328]
    - [58, 57.773]
  - - [128, 4288, 1, 256]
    - [50, 39.035]
  - - [64, 6784, 1, 3328]
    - [69, 44.86]
  - - [2944, 256, 1, 1280]
    - [56, 58.0]
  - - [1856, 704, 1, 256]
    - [44, 52.257]
  - - [704, 1856, 1, 256]
    - [45, 51.612]
  - - [2944, 448, 1, 256]
    - [44, 57.27]
  - - [2368, 128, 1, 1280]
    - [45, 30.905]
  - - [64, 6784, 1, 256]
    - [51, 26.394]
  - - [64, 5056, 1, 1280]
    - [51, 32.173]
  - - [704, 448, 1, 3328]
    - [51, 34.749]
  - - [2368, 256, 1, 1280]
    - [44, 45.99]
  - - [2368, 448, 1, 1280]
    - [56, 63.29]
  - - [128, 3584, 1, 256]
    - [50, 33.116]
  - - [1856, 448, 1, 3328]
    - [56, 65.792]
  - - [128, 5056, 1, 256]
    - [61, 39.013]
  - - [4288, 256, 1, 1280]
    - [59, 65.032]
  - - [4288, 128, 1, 3328]
    - [59, 59.649]
  - - [7680, 128, 1, 2560]
    - [67, 63.205]
  - - [448, 2368, 1, 3328]
    - [45, 61.217]
  - - [256, 1408, 1, 1280]
    - [50, 36.881]
  - - [128, 2368, 1, 256]
    - [50, 22.615]
  - - [6784, 64, 1, 3328]
    - [66, 47.432]
  - - [128, 2944, 1, 3328]
    - [53, 41.763]
  - - [2944, 448, 1, 3328]
    - [58, 67.441]
  - - [5888, 128, 1, 256]
    - [44, 46.205]
  - - [5056, 64, 1, 256]
    - [51, 20.535]
  - - [512, 1500, 1, 1536]
    - [68, 58.77]
  - - [128, 5056, 1, 3328]
    - [61, 52.131]
  - - [256, 4288, 1, 1280]
    - [44, 66.591]
  - - [4288, 128, 1, 256]
    - [45, 34.379]
  - - [3584, 256, 1, 256]
    - [44, 45.835]
  - - [128, 2944, 1, 256]
    - [50, 27.686]
  - - [3584, 128, 1, 3328]
    - [67, 50.649]
  - - [5888, 128, 1, 3328]
    - [46, 60.322]
  - - [64, 193600, 1, 256]
    - [54, 55.598]
  - - [1408, 704, 1, 1280]
    - [71, 59.307]
  - - [448, 1408, 1, 1280]
    - [44, 47.881]
  - - [704, 1408, 1, 1280]
    - [47, 60.41]
  - - [448, 2944, 1, 256]
    - [45, 52.027]
  - - [448, 2368, 1, 256]
    - [45, 47.565]
  - - [64, 6784, 1, 1280]
    - [62, 41.375]
  - - [128, 2368, 1, 3328]
    - [45, 33.375]
  - - [5056, 64, 1, 3328]
    - [45, 35.548]
  - - [5056, 128, 1, 3328]
    - [52, 51.865]
  - - [448, 704, 1, 256]
    - [49, 20.84]
  - - [1856, 256, 1, 3328]
    - [59, 51.892]
  - - [2944, 128, 1, 3328]
    - [59, 42.236]
  - - [1024, 1024, 1, 256]
    - [44, 51.492]
  - - [704, 1024, 1, 1280]
    - [44, 55.068]
  - - [256, 4288, 1, 256]
    - [44, 55.318]
  - - [2368, 256, 1, 256]
    - [44, 33.278]
  - - [256, 2368, 1, 3328]
    - [68, 49.297]
  - - [704, 448, 1, 1280]
    - [45, 32.112]
  - - [256, 1856, 1, 256]
    - [44, 34.646]
  - - [64, 5056, 1, 256]
    - [49, 20.81]
  - - [1408, 256, 1, 3328]
    - [59, 40.45]
  - - [2368, 448, 1, 256]
    - [44, 48.393]
  - - [4288, 256, 1, 3328]
    - [59, 70.317]
  - - [2944, 256, 1, 256]
    - [44, 45.623]
  - - [6784, 64, 1, 1280]
    - [46, 43.743]
  - - [704, 1856, 1, 1280]
    - [44, 64.339]
  - - [448, 1024, 1, 3328]
    - [59, 49.699]
  - - [2944, 448, 1, 1280]
    - [56, 65.526]
  - - [448, 1024, 1, 256]
    - [45, 28.548]
  - - [1024, 448, 1, 1280]
    - [56, 46.841]
  - - [256, 2368, 1, 1280]
    - [65, 47.644]
  - - [128, 5056, 1, 1280]
    - [50, 49.859]
  - - [1408, 256, 1, 256]
    - [61, 26.551]
  - - [128, 5888, 1, 3328]
    - [61, 60.347]
  - - [2368, 448, 1, 3328]
    - [56, 65.637]
  - - [3584, 128, 1, 1280]
    - [44, 46.48]
  - - [1408, 448, 1, 256]
    - [44, 38.753]
  - - [2368, 256, 1, 3328]
    - [65, 48.109]
  - - [5888, 128, 1, 1280]
    - [44, 57.879]
  - - [256, 3584, 1, 1280]
    - [59, 57.394]
  - - [128, 5888, 1, 256]
    - [68, 44.413]
  - - [1024, 1024, 1, 1024]
    - [64, 63.742]
  - - [1408, 448, 1, 3328]
    - [56, 51.262]
  - - [64, 5888, 1, 1280]
    - [51, 37.265]
  - - [704, 704, 1, 1280]
    - [44, 48.316]
  - - [128, 2368, 1, 1280]
    - [50, 30.926]
  - - [3584, 256, 1, 1280]
    - [67, 57.344]
  - - [5888, 64, 1, 1280]
    - [45, 38.259]
  - - [5056, 128, 1, 1280]
    - [44, 49.099]
  - - [448, 1856, 1, 3328]
    - [45, 62.237]
  - - [1024, 448, 1, 256]
    - [56, 33.283]
  - - [2944, 128, 1, 1280]
    - [44, 38.503]
  - - [256, 2944, 1, 1280]
    - [44, 58.407]
  - - [2560, 128, 1, 2560]
    - [59, 35.692]
  - - [704, 1024, 1, 3328]
    - [56, 57.687]
  - - [1856, 448, 1, 1280]
    - [56, 62.819]
  - - [128, 6784, 1, 256]
    - [50, 43.531]
  - - [704, 1408, 1, 256]
    - [44, 47.784]
  - - [4096, 128, 1, 4096]
    - [53, 57.949]
  - - [448, 2944, 1, 1280]
    - [45, 61.267]
  - - [1856, 256, 1, 256]
    - [50, 30.353]
  - - [5056, 128, 1, 256]
    - [44, 35.663]
  - - [6784, 128, 1, 1280]
    - [59, 54.578]
  - - [1856, 448, 1, 256]
    - [56, 44.544]
  - - [128, 4288, 1, 1280]
    - [52, 54.802]
  - - [448, 704, 1, 3328]
    - [51, 34.718]
  - - [448, 1856, 1, 256]
    - [45, 43.892]
  - - [1856, 704, 1, 3328]
    - [58, 66.074]
  - - [512, 1500, 1, 2560]
    - [61, 59.837]
  - - [3136, 64, 128, 64]
    - [55, 75.756]
  - - [3136, 64, 64, 256]
    - [66, 76.553]
  - - [3136, 64, 128, 256]
    - [63, 42.153]
  - - [3136, 64, 256, 64]
    - [43, 33.554]
  - - [3136, 64, 64, 64]
    - [55, 68.585]
  - - [3136, 64, 256, 256]
    - [48, 43.139]
  - - [2368, 64, 1, 3328]
    - [87, 20.553]
  - - [256, 704, 1, 1280]
    - [81, 24.781]
  - - [1408, 64, 1, 1280]
    - [76, 16.614]
  - - [4096, 32, 1, 4096]
    - [95, 21.751]
  - - [3072, 64, 1, 1024]
    - [87, 24.445]
  - - [1024, 256, 1, 3328]
    - [74, 32.022]
  - - [6144, 32, 1, 2560]
    - [77, 26.15]
  - - [704, 128, 1, 1280]
    - [94, 16.551]
  - - [64, 3584, 1, 3328]
    - [85, 27.891]
  - - [1024, 256, 1, 256]
    - [82, 23.804]
  - - [448, 448, 1, 256]
    - [81, 20.846]
  - - [7680, 32, 1, 2560]
    - [84, 29.083]
  - - [128, 1024, 1, 3328]
    - [77, 21.618]
  - - [64, 1856, 1, 1280]
    - [96, 18.263]
  - - [448, 256, 1, 256]
    - [89, 12.987]
  - - [256, 1024, 1, 256]
    - [85, 24.183]
  - - [1024, 128, 1, 1280]
    - [95, 20.131]
  - - [3072, 32, 1, 1024]
    - [76, 15.02]
  - - [448, 256, 1, 3328]
    - [77, 19.024]
  - - [128, 704, 1, 1280]
    - [94, 16.551]
  - - [1856, 128, 1, 3328]
    - [73, 28.907]
  - - [256, 448, 1, 256]
    - [89, 13.089]
  - - [8448, 32, 1, 2816]
    - [92, 32.171]
  - - [448, 448, 1, 3328]
    - [77, 26.985]
  - - [1408, 128, 1, 1280]
    - [81, 23.569]
  - - [128, 1856, 1, 1280]
    - [74, 27.952]
  - - [2048, 128, 1, 2048]
    - [74, 30.975]
  - - [64, 1408, 1, 3328]
    - [76, 17.553]
  - - [256, 704, 1, 256]
    - [84, 17.174]
  - - [128, 1408, 1, 256]
    - [96, 18.133]
  - - [256, 448, 1, 3328]
    - [77, 18.999]
  - - [64, 2368, 1, 1280]
    - [90, 21.514]
  - - [2368, 64, 1, 256]
    - [81, 14.586]
  - - [704, 128, 1, 3328]
    - [94, 17.571]
  - - [4288, 64, 1, 1280]
    - [73, 30.738]
  - - [2560, 64, 1, 2560]
    - [77, 21.913]
  - - [128, 1024, 1, 1280]
    - [77, 20.068]
  - - [128, 1024, 1, 256]
    - [96, 13.763]
  - - [1856, 64, 1, 256]
    - [80, 13.242]
  - - [704, 128, 1, 256]
    - [94, 11.99]
  - - [448, 256, 1, 1280]
    - [77, 17.709]
  - - [1856, 128, 1, 1280]
    - [73, 27.661]
  - - [64, 3584, 1, 256]
    - [82, 20.894]
  - - [64, 1856, 1, 256]
    - [80, 13.091]
  - - [256, 1024, 1, 1280]
    - [93, 31.201]
  - - [3584, 64, 1, 1280]
    - [73, 26.621]
  - - [1408, 128, 1, 3328]
    - [77, 24.309]
  - - [64, 2944, 1, 3328]
    - [87, 25.322]
  - - [64, 4288, 1, 3328]
    - [82, 33.382]
  - - [128, 1500, 1, 1280]
    - [96, 26.249]
  - - [64, 2944, 1, 256]
    - [81, 19.157]
  - - [64, 1408, 1, 1280]
    - [94, 16.511]
  - - [64, 2944, 1, 1280]
    - [81, 25.956]
  - - [704, 256, 1, 256]
    - [81, 18.992]
  - - [256, 448, 1, 1280]
    - [77, 17.69]
  - - [704, 256, 1, 1280]
    - [81, 24.296]
  - - [64, 2368, 1, 3328]
    - [87, 20.492]
  - - [256, 704, 1, 3328]
    - [73, 24.352]
  - - [4096, 64, 1, 4096]
    - [81, 30.668]
  - - [1760, 128, 1, 1760]
    - [82, 26.667]
  - - [2944, 64, 1, 1280]
    - [95, 24.029]
  - - [128, 1408, 1, 3328]
    - [77, 24.3]
  - - [1408, 64, 1, 256]
    - [94, 11.99]
  - - [64, 2368, 1, 256]
    - [81, 15.572]
  - - [1024, 128, 1, 3328]
    - [77, 21.751]
  - - [2368, 64, 1, 1280]
    - [77, 19.466]
  - - [4288, 64, 1, 256]
    - [81, 24.307]
  - - [64, 4288, 1, 1280]
    - [82, 31.851]
  - - [1408, 64, 1, 3328]
    - [94, 17.562]
  - - [2944, 64, 1, 256]
    - [81, 18.76]
  - - [448, 448, 1, 1280]
    - [81, 27.756]
  - - [1024, 256, 1, 1280]
    - [74, 30.447]
  - - [3584, 64, 1, 3328]
    - [84, 27.837]
  - - [256, 1024, 1, 3328]
    - [93, 32.66]
  - - [1856, 64, 1, 3328]
    - [77, 19.712]
  - - [1856, 64, 1, 1280]
    - [77, 18.322]
  - - [4608, 32, 1, 1536]
    - [77, 22.87]
  - - [1024, 128, 1, 256]
    - [72, 13.713]
  - - [64, 3584, 1, 1280]
    - [97, 26.707]
  - - [3584, 64, 1, 256]
    - [84, 20.894]
  - - [64, 1856, 1, 3328]
    - [77, 19.547]
  - - [1408, 128, 1, 256]
    - [81, 18.133]
  - - [128, 704, 1, 256]
    - [94, 11.99]
  - - [128, 704, 1, 3328]
    - [94, 17.571]
  - - [128, 1856, 1, 256]
    - [85, 21.708]
  - - [64, 4288, 1, 256]
    - [82, 24.232]
  - - [2560, 32, 1, 2560]
    - [76, 15.823]
  - - [704, 256, 1, 3328]
    - [77, 24.318]
  - - [176, 1500, 1, 1408]
    - [91, 30.761]
  - - [1856, 128, 1, 256]
    - [73, 21.708]
  - - [4288, 64, 1, 3328]
    - [73, 32.243]
  - - [2048, 64, 1, 2048]
    - [77, 21.04]
  - - [64, 1408, 1, 256]
    - [94, 11.99]
  - - [2944, 64, 1, 3328]
    - [87, 25.387]
  - - [128, 1408, 1, 1280]
    - [90, 24.853]
  - - [128, 1856, 1, 3328]
    - [85, 29.229]
  - - [1760, 64, 1, 1760]
    - [77, 17.718]
  - - [1760, 32, 1, 1760]
    - [101, 12.563]
  - - [2560, 16, 1, 2560]
    - [102, 10.239]
  - - [1760, 16, 1, 1760]
    - [99, 6.894]
  - - [8448, 4, 1, 2816]
    - [102, 7.839]
  - - [7680, 16, 1, 2560]
    - [100, 22.01]
  - - [4608, 1, 1, 1536]
    - [102, 1.096]
  - - [7680, 4, 1, 2560]
    - [100, 6.871]
  - - [8448, 16, 1, 2816]
    - [103, 24.463]
  - - [3072, 2, 1, 1024]
    - [102, 1.363]
  - - [6144, 16, 1, 2560]
    - [100, 20.276]
  - - [7680, 1, 1, 2560]
    - [100, 1.73]
  - - [4608, 4, 1, 1536]
    - [102, 4.374]
  - - [3072, 1, 1, 128]
    - [86, 0.296]
  - - [2048, 32, 1, 2048]
    - [99, 14.959]
  - - [2048, 16, 1, 2048]
    - [99, 8.281]
  - - [8448, 1, 1, 2816]
    - [102, 1.963]
  - - [6144, 4, 1, 2560]
    - [102, 6.075]
  - - [3072, 1, 1, 1024]
    - [102, 0.681]
  - - [3072, 16, 1, 1024]
    - [99, 10.812]
  - - [4096, 16, 1, 4096]
    - [102, 15.687]
  - - [6144, 1, 1, 2560]
    - [102, 1.52]
  - - [3072, 4, 1, 1024]
    - [102, 2.718]
  - - [7680, 2, 1, 2560]
    - [100, 3.447]
  - - [4224, 1, 1, 128]
    - [86, 0.402]
  - - [8448, 2, 1, 2816]
    - [101, 3.923]
  - - [4608, 2, 1, 1536]
    - [102, 2.193]
  - - [4608, 16, 1, 1536]
    - [99, 16.147]
  - - [6144, 2, 1, 2560]
    - [102, 3.032]
  - - [1024, 1, 1, 500000]
    - [79, 0.296]
  - - [1024, 16, 1, 500000]
    - [79, 4.737]
  - - [1024, 2, 1, 500000]
    - [79, 0.593]
  - - [512, 1, 1, 500000]
    - [78, 0.151]
  - - [1024, 8, 1, 500000]
    - [88, 2.371]
  - - [1024, 4, 1, 500000]
    - [79, 1.184]
  - - [512, 16, 1, 500000]
    - [79, 2.38]
  - - [512, 2, 1, 500000]
    - [78, 0.3]
  - - [512, 8, 1, 500000]
    - [79, 1.191]
  - - [512, 4, 1, 500000]
    - [78, 0.598]
  - - [512, 4, 1, 512]
    - [94, 0.395]
  - - [448, 64, 1, 1280]
    - [76, 6.865]
  - - [64, 1024, 1, 1280]
    - [94, 13.998]
  - - [64, 704, 1, 1280]
    - [94, 10.424]
  - - [256, 128, 1, 256]
    - [94, 5.087]
  - - [64, 1024, 1, 3328]
    - [94, 15.121]
  - - [128, 1, 1, 1408]
    - [83, 0.032]
  - - [1024, 64, 1, 1280]
    - [94, 14.059]
  - - [256, 256, 1, 3328]
    - [94, 15.13]
  - - [64, 448, 1, 1280]
    - [76, 6.876]
  - - [512, 32, 1, 512]
    - [94, 3.273]
  - - [64, 64, 1, 3328]
    - [78, 1.11]
  - - [512, 1, 1, 512]
    - [94, 0.099]
  - - [512, 2, 1, 512]
    - [75, 0.196]
  - - [704, 64, 1, 3328]
    - [86, 11.297]
  - - [64, 128, 1, 256]
    - [94, 1.293]
  - - [704, 64, 1, 1280]
    - [94, 10.424]
  - - [128, 448, 1, 256]
    - [94, 8.448]
  - - [448, 64, 1, 3328]
    - [76, 7.51]
  - - [64, 128, 1, 3328]
    - [78, 2.218]
  - - [128, 128, 1, 3328]
    - [79, 4.406]
  - - [64, 1, 1, 1216]
    - [76, 0.016]
  - - [256, 256, 1, 256]
    - [94, 9.754]
  - - [128, 64, 1, 1280]
    - [83, 1.992]
  - - [64, 1024, 1, 256]
    - [94, 9.508]
  - - [64, 704, 1, 256]
    - [94, 6.883]
  - - [1024, 2, 1, 512]
    - [76, 0.397]
  - - [256, 64, 1, 3328]
    - [79, 4.415]
  - - [448, 128, 1, 256]
    - [94, 8.448]
  - - [64, 704, 1, 3328]
    - [94, 11.313]
  - - [64, 448, 1, 3328]
    - [76, 7.485]
  - - [448, 128, 1, 3328]
    - [94, 13.28]
  - - [128, 256, 1, 1280]
    - [76, 7.846]
  - - [64, 448, 1, 256]
    - [94, 4.451]
  - - [64, 256, 1, 1280]
    - [98, 3.968]
  - - [64, 128, 1, 1280]
    - [83, 1.987]
  - - [1024, 32, 1, 512]
    - [94, 6.549]
  - - [64, 64, 1, 256]
    - [94, 0.645]
  - - [256, 128, 1, 1280]
    - [94, 7.952]
  - - [128, 256, 1, 3328]
    - [76, 8.554]
  - - [256, 64, 1, 256]
    - [94, 2.572]
  - - [128, 128, 1, 1280]
    - [98, 3.975]
  - - [128, 256, 1, 256]
    - [94, 5.087]
  - - [256, 64, 1, 1280]
    - [94, 4.015]
  - - [704, 64, 1, 256]
    - [94, 6.883]
  - - [128, 448, 1, 1280]
    - [94, 12.337]
  - - [64, 64, 1, 1280]
    - [94, 1.002]
  - - [128, 64, 1, 3328]
    - [78, 2.22]
  - - [448, 64, 1, 256]
    - [94, 4.451]
  - - [1024, 16, 1, 512]
    - [76, 3.273]
  - - [512, 16, 1, 512]
    - [94, 1.642]
  - - [1024, 64, 1, 256]
    - [94, 9.705]
  - - [128, 1, 1, 1024]
    - [76, 0.029]
  - - [448, 128, 1, 1280]
    - [94, 12.412]
  - - [1024, 64, 1, 3328]
    - [94, 15.139]
  - - [128, 64, 1, 256]
    - [94, 1.299]
  - - [64, 256, 1, 3328]
    - [79, 4.408]
  - - [256, 256, 1, 1280]
    - [94, 14.059]
  - - [256, 128, 1, 3328]
    - [94, 8.595]
  - - [64, 256, 1, 256]
    - [94, 2.558]
  - - [1024, 4, 1, 512]
    - [94, 0.79]
  - - [128, 448, 1, 3328]
    - [94, 13.287]
  - - [1024, 1, 1, 512]
    - [94, 0.199]
  - - [128, 128, 1, 256]
    - [94, 2.558]
  - - [768, 1, 1, 1]
    - [104, 0.0]
  - - [768, 2, 1, 1]
    - [105, 0.001]
  - - [768, 4, 1, 1]
    - [106, 0.001]
  - - [768, 8, 1, 1]
    - [104, 0.002]
  - - [768, 16, 1, 1]
    - [107, 0.004]
  - - [768, 32, 1, 1]
    - [108, 0.008]
  - - [768, 64, 1, 1]
    - [109, 0.018]
  - - [768, 128, 1, 1]
    - [110, 0.033]
  - - [768, 256, 1, 1]
    - [111, 0.065]
  - - [768, 384, 1, 1]
    - [110, 0.094]
  - - [768, 512, 1, 1]
    - [112, 0.117]
  - - [768, 768, 1, 1]
    - [113, 0.171]
  - - [768, 1024, 1, 1]
    - [114, 0.213]
  - - [768, 1536, 1, 1]
    - [115, 0.312]
  - - [768, 2048, 1, 1]
    - [116, 0.375]
  - - [768, 3072, 1, 1]
    - [117, 0.496]
  - - [768, 4096, 1, 1]
    - [118, 0.588]
  - - [768, 6144, 1, 1]
    - [119, 0.72]
  - - [768, 8192, 1, 1]
    - [115, 0.839]
  - - [768, 12288, 1, 1]
    - [120, 1.532]
  - - [768, 16384, 1, 1]
    - [121, 1.763]
  - - [768, 16, 1, 768]
    - [122, 1.353]
  - - [768, 32, 1, 768]
    - [123, 3.113]
  - - [768, 64, 1, 768]
    - [124, 6.234]
  - - [768, 128, 1, 768]
    - [124, 10.605]
  - - [768, 256, 1, 768]
    - [125, 18.392]
  - - [768, 384, 1, 768]
    - [126, 24.683]
  - - [768, 512, 1, 768]
    - [127, 29.039]
  - - [768, 768, 1, 768]
    - [128, 41.914]
  - - [768, 1024, 1, 768]
    - [129, 46.155]
  - - [768, 1536, 1, 768]
    - [130, 57.831]
  - - [768, 2048, 1, 768]
    - [131, 59.995]
  - - [768, 3072, 1, 768]
    - [132, 72.319]
  - - [768, 4096, 1, 768]
    - [133, 71.074]
  - - [768, 6144, 1, 768]
    - [134, 84.926]
  - - [768, 16, 1, 3072]
    - [135, 2.698]
  - - [768, 32, 1, 3072]
    - [136, 5.349]
  - - [768, 64, 1, 3072]
    - [137, 10.398]
  - - [768, 128, 1, 3072]
    - [137, 15.755]
  - - [768, 256, 1, 3072]
    - [126, 25.873]
  - - [768, 384, 1, 3072]
    - [138, 33.178]
  - - [768, 512, 1, 3072]
    - [139, 40.346]
  - - [768, 768, 1, 3072]
    - [140, 57.651]
  - - [768, 1024, 1, 3072]
    - [140, 58.652]
  - - [768, 1536, 1, 3072]
    - [141, 71.186]
  - - [768, 2048, 1, 3072]
    - [142, 69.109]
  - - [768, 3072, 1, 3072]
    - [143, 81.795]
  - - [768, 4096, 1, 3072]
    - [144, 76.117]
  - - [768, 6144, 1, 3072]
    - [145, 87.2]
  - - [1024, 1, 1, 1]
    - [146, 0.0]
  - - [1024, 2, 1, 1]
    - [106, 0.001]
  - - [1024, 4, 1, 1]
    - [106, 0.001]
  - - [1024, 8, 1, 1]
    - [147, 0.003]
  - - [1024, 16, 1, 1]
    - [110, 0.006]
  - - [1024, 32, 1, 1]
    - [106, 0.011]
  - - [1024, 64, 1, 1]
    - [108, 0.022]
  - - [1024, 128, 1, 1]
    - [108, 0.044]
  - - [1024, 16, 1, 1024]
    - [148, 2.405]
  - - [1024, 32, 1, 1024]
    - [136, 4.865]
  - - [1024, 64, 1, 1024]
    - [137, 9.322]
  - - [1024, 128, 1, 1024]
    - [149, 14.148]
  - - [1024, 256, 1, 1024]
    - [126, 24.222]
  - - [1024, 384, 1, 1024]
    - [139, 32.074]
  - - [1024, 512, 1, 1024]
    - [150, 40.559]
  - - [1024, 768, 1, 1024]
    - [151, 49.635]
  - - [1024, 1536, 1, 1024]
    - [143, 61.875]
  - - [1024, 2048, 1, 1024]
    - [143, 67.06]
  - - [1024, 3072, 1, 1024]
    - [132, 72.754]
  - - [1024, 4096, 1, 1024]
    - [131, 77.091]
  - - [1024, 6144, 1, 1024]
    - [131, 85.54]
  - - [1024, 16, 1, 4096]
    - [137, 3.811]
  - - [1024, 32, 1, 4096]
    - [124, 7.51]
  - - [1024, 64, 1, 4096]
    - [124, 13.731]
  - - [1024, 128, 1, 4096]
    - [152, 20.098]
  - - [1024, 256, 1, 4096]
    - [153, 32.253]
  - - [1024, 384, 1, 4096]
    - [139, 41.505]
  - - [1024, 512, 1, 4096]
    - [127, 53.108]
  - - [1024, 768, 1, 4096]
    - [140, 60.016]
  - - [1024, 1024, 1, 4096]
    - [154, 63.987]
  - - [1024, 1536, 1, 4096]
    - [154, 70.605]
  - - [1024, 2048, 1, 4096]
    - [155, 73.456]
  - - [1024, 3072, 1, 4096]
    - [131, 76.366]
  - - [1024, 4096, 1, 4096]
    - [156, 78.082]
  - - [2304, 16, 1, 1]
    - [157, 0.013]
  - - [2304, 32, 1, 1]
    - [104, 0.025]
  - - [2304, 64, 1, 1]
    - [106, 0.049]
  - - [2304, 128, 1, 1]
    - [158, 0.096]
  - - [2304, 256, 1, 1]
    - [115, 0.171]
  - - [2304, 384, 1, 1]
    - [159, 0.238]
  - - [2304, 512, 1, 1]
    - [160, 0.307]
  - - [2304, 768, 1, 1]
    - [158, 0.408]
  - - [2304, 1024, 1, 1]
    - [159, 0.496]
  - - [2304, 1536, 1, 1]
    - [117, 0.631]
  - - [2304, 2048, 1, 1]
    - [161, 0.727]
  - - [2304, 3072, 1, 1]
    - [162, 0.859]
  - - [2304, 4096, 1, 1]
    - [162, 0.965]
  - - [2304, 6144, 1, 1]
    - [163, 1.842]
  - - [2304, 8192, 1, 1]
    - [164, 2.016]
  - - [2304, 12288, 1, 1]
    - [164, 2.215]
  - - [2304, 16384, 1, 1]
    - [164, 2.337]
  - - [2304, 24576, 1, 1]
    - [164, 2.47]
  - - [2304, 32768, 1, 1]
    - [165, 1.04]
  - - [2304, 49152, 1, 1]
    - [166, 0.949]
  - - [2304, 65536, 1, 1]
    - [167, 0.96]
  - - [2304, 98304, 1, 1]
    - [168, 0.969]
  - - [2304, 131072, 1, 1]
    - [167, 0.957]
  - - [2304, 16, 1, 768]
    - [169, 3.843]
  - - [2304, 32, 1, 768]
    - [170, 8.786]
  - - [2304, 64, 1, 768]
    - [124, 13.915]
  - - [2304, 128, 1, 768]
    - [138, 24.353]
  - - [2304, 256, 1, 768]
    - [171, 41.573]
  - - [2304, 384, 1, 768]
    - [172, 44.379]
  - - [2304, 512, 1, 768]
    - [173, 58.695]
  - - [2304, 768, 1, 768]
    - [174, 65.786]
  - - [2304, 1024, 1, 768]
    - [133, 72.55]
  - - [2304, 1536, 1, 768]
    - [175, 80.063]
  - - [2304, 2048, 1, 768]
    - [134, 84.838]
  - - [2304, 3072, 1, 768]
    - [175, 88.283]
  - - [2304, 4096, 1, 768]
    - [133, 89.884]
  - - [2304, 6144, 1, 768]
    - [176, 91.661]
  - - [3072, 16, 1, 1]
    - [104, 0.021]
  - - [3072, 32, 1, 1]
    - [106, 0.034]
  - - [3072, 64, 1, 1]
    - [104, 0.066]
  - - [3072, 128, 1, 1]
    - [177, 0.12]
  - - [3072, 256, 1, 1]
    - [178, 0.215]
  - - [3072, 384, 1, 1]
    - [179, 0.304]
  - - [3072, 512, 1, 1]
    - [163, 0.376]
  - - [3072, 768, 1, 1]
    - [162, 0.498]
  - - [3072, 1024, 1, 1]
    - [151, 0.584]
  - - [3072, 1536, 1, 1]
    - [180, 0.73]
  - - [3072, 2048, 1, 1]
    - [181, 0.82]
  - - [3072, 3072, 1, 1]
    - [162, 0.954]
  - - [3072, 4096, 1, 1]
    - [117, 1.774]
  - - [3072, 6144, 1, 1]
    - [117, 2.005]
  - - [3072, 8192, 1, 1]
    - [162, 2.154]
  - - [3072, 12288, 1, 1]
    - [182, 2.318]
  - - [3072, 16384, 1, 1]
    - [117, 2.407]
  - - [3072, 24576, 1, 1]
    - [165, 1.049]
  - - [3072, 32768, 1, 1]
    - [183, 0.945]
  - - [3072, 49152, 1, 1]
    - [184, 0.953]
  - - [3072, 65536, 1, 1]
    - [166, 0.96]
  - - [3072, 16, 1, 768]
    - [185, 4.838]
  - - [3072, 32, 1, 768]
    - [137, 10.513]
  - - [3072, 64, 1, 768]
    - [186, 17.486]
  - - [3072, 128, 1, 768]
    - [139, 28.866]
  - - [3072, 256, 1, 768]
    - [187, 46.406]
  - - [3072, 384, 1, 768]
    - [173, 57.962]
  - - [3072, 512, 1, 768]
    - [133, 58.426]
  - - [3072, 768, 1, 768]
    - [133, 71.062]
  - - [3072, 1024, 1, 768]
    - [188, 71.335]
  - - [3072, 1536, 1, 768]
    - [133, 83.248]
  - - [3072, 2048, 1, 768]
    - [133, 84.719]
  - - [3072, 3072, 1, 768]
    - [133, 89.51]
  - - [3072, 4096, 1, 768]
    - [176, 88.726]
  - - [3072, 6144, 1, 768]
    - [189, 92.519]
  - - [3072, 256, 1, 1024]
    - [188, 49.554]
  - - [3072, 384, 1, 1024]
    - [128, 61.346]
  - - [3072, 512, 1, 1024]
    - [190, 61.146]
  - - [3072, 768, 1, 1024]
    - [190, 73.648]
  - - [3072, 1024, 1, 1024]
    - [171, 72.783]
  - - [3072, 1536, 1, 1024]
    - [191, 85.558]
  - - [3072, 2048, 1, 1024]
    - [131, 85.621]
  - - [3072, 3072, 1, 1024]
    - [145, 90.097]
  - - [3072, 4096, 1, 1024]
    - [145, 89.238]
  - - [4096, 16, 1, 1024]
    - [137, 8.968]
  - - [4096, 32, 1, 1024]
    - [152, 14.07]
  - - [4096, 64, 1, 1024]
    - [126, 24.106]
  - - [4096, 128, 1, 1024]
    - [188, 41.11]
  - - [4096, 256, 1, 1024]
    - [128, 54.579]
  - - [4096, 384, 1, 1024]
    - [155, 61.167]
  - - [4096, 512, 1, 1024]
    - [155, 66.199]
  - - [4096, 768, 1, 1024]
    - [171, 72.87]
  - - [4096, 1024, 1, 1024]
    - [192, 75.096]
  - - [4096, 1536, 1, 1024]
    - [192, 83.247]
  - - [4096, 2048, 1, 1024]
    - [193, 85.493]
  - - [4096, 3072, 1, 1024]
    - [193, 88.959]
- null
