library/src/blas3/Tensile/Logic/asm_full/navi21/navi21_Cijk_Alik_Bljk_SB.yaml
- {MinimumRequiredVersion: 4.26.0}
- navi21
- gfx1030
- [Device 73a2]
    SolutionIndex: 0
    SolutionNameMin: Cijk_Alik_Bljk_SB_MT128x64x8_SN_SU0_SUM0_TT8_8_WG16_8_1_WGM1
    SolutionIndex: 1
    SolutionNameMin: Cijk_Alik_Bljk_SB_MT128x128x8_SN_SU0_SUM0_TT8_16_WG16_8_1_WGM1
    SolutionIndex: 2
    SolutionNameMin: Cijk_Alik_Bljk_SB_MT128x128x8_SN_SU0_SUM0_TT8_8_WG16_16_1_WGM1
    SolutionIndex: 3
    SolutionNameMin: Cijk_Alik_Bljk_SB_MT128x256x8_SN_SU0_SUM0_TT8_16_WG16_16_1_WGM1
    SolutionIndex: 4
    SolutionNameMin: Cijk_Alik_Bljk_SB_MT128x64x16_SN_SU0_SUM0_TT8_8_WG16_8_1_WGM1
    SolutionIndex: 5
    SolutionNameMin: Cijk_Alik_Bljk_SB_MT128x128x16_SN_SU0_SUM0_TT8_16_WG16_8_1_WGM1
    SolutionIndex: 6
    SolutionNameMin: Cijk_Alik_Bljk_SB_MT128x128x16_SN_SU0_SUM0_TT8_8_WG16_16_1_WGM1
    SolutionIndex: 7
    SolutionNameMin: Cijk_Alik_Bljk_SB_MT128x256x16_SN_SU0_SUM0_TT8_16_WG16_16_1_WGM1
    SolutionIndex: 8
    SolutionNameMin: Cijk_Alik_Bljk_SB_MT128x64x8_SN_SU32_SUM3_TT8_8_WG16_8_1_WGM1
    SolutionIndex: 9
    SolutionNameMin: Cijk_Alik_Bljk_SB_MT128x128x8_SN_SU32_SUM3_TT8_16_WG16_8_1_WGM1
    SolutionIndex: 10
    SolutionNameMin: Cijk_Alik_Bljk_SB_MT128x128x8_SN_SU32_SUM3_TT8_8_WG16_16_1_WGM1
    SolutionIndex: 11
    SolutionNameMin: Cijk_Alik_Bljk_SB_MT128x256x8_SN_SU32_SUM3_TT8_16_WG16_16_1_WGM1
    SolutionIndex: 12
    SolutionNameMin: Cijk_Alik_Bljk_SB_MT128x64x16_SN_SU32_SUM3_TT8_8_WG16_8_1_WGM1
    SolutionIndex: 13
    SolutionNameMin: Cijk_Alik_Bljk_SB_MT128x128x16_SN_SU32_SUM3_TT8_16_WG16_8_1_WGM1
    SolutionIndex: 14
    SolutionNameMin: Cijk_Alik_Bljk_SB_MT128x128x16_SN_SU32_SUM3_TT8_8_WG16_16_1_WGM1
    SolutionIndex: 15
    SolutionNameMin: Cijk_Alik_Bljk_SB_MT128x256x16_SN_SU32_SUM3_TT8_16_WG16_16_1_WGM1
    SolutionIndex: 16
    SolutionNameMin: Cijk_Alik_Bljk_SB_MT128x128x32_SN_SU32_SUM3_TT8_16_WG16_8_1_WGM1
    SolutionIndex: 17
    SolutionNameMin: Cijk_Alik_Bljk_SB_MT128x64x8_SN_SU0_SUM0_TT8_8_WG16_8_1_WGM4
    SolutionIndex: 18
    SolutionNameMin: Cijk_Alik_Bljk_SB_MT128x128x8_SN_SU0_SUM0_TT8_16_WG16_8_1_WGM4
    SolutionIndex: 19
    SolutionNameMin: Cijk_Alik_Bljk_SB_MT128x128x8_SN_SU0_SUM0_TT8_8_WG16_16_1_WGM4
    SolutionIndex: 20
    SolutionNameMin: Cijk_Alik_Bljk_SB_MT128x256x8_SN_SU0_SUM0_TT8_16_WG16_16_1_WGM4
    SolutionIndex: 21
    SolutionNameMin: Cijk_Alik_Bljk_SB_MT128x64x16_SN_SU0_SUM0_TT8_8_WG16_8_1_WGM4
    SolutionIndex: 22
    SolutionNameMin: Cijk_Alik_Bljk_SB_MT128x128x16_SN_SU0_SUM0_TT8_16_WG16_8_1_WGM4
    SolutionIndex: 23
    SolutionNameMin: Cijk_Alik_Bljk_SB_MT128x128x16_SN_SU0_SUM0_TT8_8_WG16_16_1_WGM4
    SolutionIndex: 24
    SolutionNameMin: Cijk_Alik_Bljk_SB_MT128x256x16_SN_SU0_SUM0_TT8_16_WG16_16_1_WGM4
    SolutionIndex: 25
    SolutionNameMin: Cijk_Alik_Bljk_SB_MT128x64x8_SN_SU32_SUM3_TT8_8_WG16_8_1_WGM4
    SolutionIndex: 26
    SolutionNameMin: Cijk_Alik_Bljk_SB_MT128x128x8_SN_SU32_SUM3_TT8_16_WG16_8_1_WGM4
    SolutionIndex: 27
    SolutionNameMin: Cijk_Alik_Bljk_SB_MT128x128x8_SN_SU32_SUM3_TT8_8_WG16_16_1_WGM4
    SolutionIndex: 28
    SolutionNameMin: Cijk_Alik_Bljk_SB_MT128x256x8_SN_SU32_SUM3_TT8_16_WG16_16_1_WGM4
    SolutionIndex: 29
    SolutionNameMin: Cijk_Alik_Bljk_SB_MT128x64x16_SN_SU32_SUM3_TT8_8_WG16_8_1_WGM4
    SolutionIndex: 30
    SolutionNameMin: Cijk_Alik_Bljk_SB_MT128x128x16_SN_SU32_SUM3_TT8_16_WG16_8_1_WGM4
    SolutionIndex: 31
    SolutionNameMin: Cijk_Alik_Bljk_SB_MT128x128x16_SN_SU32_SUM3_TT8_8_WG16_16_1_WGM4
    SolutionIndex: 32
    SolutionNameMin: Cijk_Alik_Bljk_SB_MT128x256x16_SN_SU32_SUM3_TT8_16_WG16_16_1_WGM4
    SolutionIndex: 33
    SolutionNameMin: Cijk_Alik_Bljk_SB_MT128x64x32_SN_SU32_SUM3_TT8_8_WG16_8_1_WGM4
    SolutionIndex: 34
    SolutionNameMin: Cijk_Alik_Bljk_SB_MT128x128x32_SN_SU32_SUM3_TT8_16_WG16_8_1_WGM4
    SolutionIndex: 35
    SolutionNameMin: Cijk_Alik_Bljk_SB_MT128x128x32_SN_SU32_SUM3_TT8_8_WG16_16_1_WGM4
    SolutionIndex: 36
    SolutionNameMin: Cijk_Alik_Bljk_SB_MT128x64x8_SN_SU0_SUM0_TT8_8_WG16_8_1_WGM8
    SolutionIndex: 37
    SolutionNameMin: Cijk_Alik_Bljk_SB_MT128x128x8_SN_SU0_SUM0_TT8_16_WG16_8_1_WGM8
    SolutionIndex: 38
    SolutionNameMin: Cijk_Alik_Bljk_SB_MT128x128x8_SN_SU0_SUM0_TT8_8_WG16_16_1_WGM8
    SolutionIndex: 39
    SolutionNameMin: Cijk_Alik_Bljk_SB_MT128x256x8_SN_SU0_SUM0_TT8_16_WG16_16_1_WGM8
    SolutionIndex: 40
    SolutionNameMin: Cijk_Alik_Bljk_SB_MT128x64x16_SN_SU0_SUM0_TT8_8_WG16_8_1_WGM8
    SolutionIndex: 41
    SolutionNameMin: Cijk_Alik_Bljk_SB_MT128x128x16_SN_SU0_SUM0_TT8_16_WG16_8_1_WGM8
    SolutionIndex: 42
    SolutionNameMin: Cijk_Alik_Bljk_SB_MT128x128x16_SN_SU0_SUM0_TT8_8_WG16_16_1_WGM8
    SolutionIndex: 43
    SolutionNameMin: Cijk_Alik_Bljk_SB_MT128x256x16_SN_SU0_SUM0_TT8_16_WG16_16_1_WGM8
    SolutionIndex: 44
    SolutionNameMin: Cijk_Alik_Bljk_SB_MT128x128x32_SN_SU0_SUM0_TT8_16_WG16_8_1_WGM8
    SolutionIndex: 45
    SolutionNameMin: Cijk_Alik_Bljk_SB_MT128x64x8_SN_SU32_SUM3_TT8_8_WG16_8_1_WGM8
    SolutionIndex: 46
    SolutionNameMin: Cijk_Alik_Bljk_SB_MT128x128x8_SN_SU32_SUM3_TT8_16_WG16_8_1_WGM8
    SolutionIndex: 47
    SolutionNameMin: Cijk_Alik_Bljk_SB_MT128x128x8_SN_SU32_SUM3_TT8_8_WG16_16_1_WGM8
    SolutionIndex: 48
    SolutionNameMin: Cijk_Alik_Bljk_SB_MT128x64x16_SN_SU32_SUM3_TT8_8_WG16_8_1_WGM8
    SolutionIndex: 49
    SolutionNameMin: Cijk_Alik_Bljk_SB_MT128x128x16_SN_SU32_SUM3_TT8_16_WG16_8_1_WGM8
    SolutionIndex: 50
    SolutionNameMin: Cijk_Alik_Bljk_SB_MT128x128x16_SN_SU32_SUM3_TT8_8_WG16_16_1_WGM8
    SolutionIndex: 51
    SolutionNameMin: Cijk_Alik_Bljk_SB_MT128x256x16_SN_SU32_SUM3_TT8_16_WG16_16_1_WGM8
    SolutionIndex: 52
    SolutionNameMin: Cijk_Alik_Bljk_SB_MT128x64x32_SN_SU32_SUM3_TT8_8_WG16_8_1_WGM8
    SolutionIndex: 53
    SolutionNameMin: Cijk_Alik_Bljk_SB_MT128x128x32_SN_SU32_SUM3_TT8_16_WG16_8_1_WGM8
    SolutionIndex: 54
    SolutionNameMin: Cijk_Alik_Bljk_SB_MT128x128x16_SN_SU0_SUM0_TT8_16_WG16_8_1_WGM1
    SolutionIndex: 55
    SolutionNameMin: Cijk_Alik_Bljk_SB_MT128x256x16_SN_SU0_SUM0_TT8_16_WG16_16_1_WGM1
    SolutionIndex: 56
    SolutionNameMin: Cijk_Alik_Bljk_SB_MT128x256x16_SN_SU32_SUM3_TT8_16_WG16_16_1_WGM1
    SolutionIndex: 57
    SolutionNameMin: Cijk_Alik_Bljk_SB_MT128x128x32_SN_SU32_SUM3_TT8_8_WG16_16_1_WGM1
    SolutionIndex: 58
    SolutionNameMin: Cijk_Alik_Bljk_SB_MT128x128x16_SN_SU32_SUM3_TT8_16_WG16_8_1_WGM4
    SolutionIndex: 59
    SolutionNameMin: Cijk_Alik_Bljk_SB_MT128x128x16_SN_SU32_SUM3_TT8_8_WG16_16_1_WGM4
    SolutionIndex: 60
    SolutionNameMin: Cijk_Alik_Bljk_SB_MT128x256x16_SN_SU32_SUM3_TT8_16_WG16_16_1_WGM4
    SolutionIndex: 61
    SolutionNameMin: Cijk_Alik_Bljk_SB_MT128x64x32_SN_SU32_SUM3_TT8_8_WG16_8_1_WGM4
    SolutionIndex: 62
    SolutionNameMin: Cijk_Alik_Bljk_SB_MT128x128x32_SN_SU32_SUM3_TT8_8_WG16_16_1_WGM4
    SolutionIndex: 63
    SolutionNameMin: Cijk_Alik_Bljk_SB_MT128x256x16_SN_SU0_SUM0_TT8_16_WG16_16_1_WGM8
    SolutionIndex: 64
    SolutionNameMin: Cijk_Alik_Bljk_SB_MT128x64x32_SN_SU0_SUM0_TT8_8_WG16_8_1_WGM8
    SolutionIndex: 65
    SolutionNameMin: Cijk_Alik_Bljk_SB_MT128x128x32_SN_SU0_SUM0_TT8_16_WG16_8_1_WGM8
    SolutionIndex: 66
    SolutionNameMin: Cijk_Alik_Bljk_SB_MT128x128x16_SN_SU32_SUM3_TT8_8_WG16_16_1_WGM8
    SolutionIndex: 67
    SolutionNameMin: Cijk_Alik_Bljk_SB_MT128x256x16_SN_SU32_SUM3_TT8_16_WG16_16_1_WGM8
    SolutionIndex: 68
    SolutionNameMin: Cijk_Alik_Bljk_SB_MT128x128x32_SN_SU32_SUM3_TT8_8_WG16_16_1_WGM8
    SolutionIndex: 69
    SolutionNameMin: Cijk_Alik_Bljk_SB_MT32x32x8_SN_SU0_SUM0_TT4_4_WG8_8_1_WGM1
    SolutionIndex: 70
    SolutionNameMin: Cijk_Alik_Bljk_SB_MT32x64x8_SN_SU0_SUM0_TT4_8_WG8_8_1_WGM1
    SolutionIndex: 71
    SolutionNameMin: Cijk_Alik_Bljk_SB_MT64x64x8_SN_SU0_SUM0_TT8_8_WG8_8_1_WGM1
    SolutionIndex: 72
    SolutionNameMin: Cijk_Alik_Bljk_SB_MT64x64x8_SN_SU0_SUM0_TT4_8_WG16_8_1_WGM1
    SolutionIndex: 73
    SolutionNameMin: Cijk_Alik_Bljk_SB_MT128x64x8_SN_SU0_SUM0_TT8_8_WG16_8_1_WGM1
    SolutionIndex: 74
    SolutionNameMin: Cijk_Alik_Bljk_SB_MT128x128x8_SN_SU0_SUM0_TT8_8_WG16_16_1_WGM1
    SolutionIndex: 75
    SolutionNameMin: Cijk_Alik_Bljk_SB_MT64x64x16_SN_SU0_SUM0_TT8_8_WG8_8_1_WGM1
    SolutionIndex: 76
    SolutionNameMin: Cijk_Alik_Bljk_SB_MT64x64x16_SN_SU0_SUM0_TT4_8_WG16_8_1_WGM1
    SolutionIndex: 77
    SolutionNameMin: Cijk_Alik_Bljk_SB_MT128x64x16_SN_SU0_SUM0_TT8_8_WG16_8_1_WGM1
    SolutionIndex: 78
    SolutionNameMin: Cijk_Alik_Bljk_SB_MT128x128x16_SN_SU0_SUM0_TT8_8_WG16_16_1_WGM1
    SolutionIndex: 79
    SolutionNameMin: Cijk_Alik_Bljk_SB_MT64x64x8_SN_SU32_SUM3_TT8_8_WG8_8_1_WGM1
    SolutionIndex: 80
    SolutionNameMin: Cijk_Alik_Bljk_SB_MT64x64x8_SN_SU32_SUM3_TT4_8_WG16_8_1_WGM1
    SolutionIndex: 81
    SolutionNameMin: Cijk_Alik_Bljk_SB_MT128x64x8_SN_SU32_SUM3_TT8_8_WG16_8_1_WGM1
    SolutionIndex: 82
    SolutionNameMin: Cijk_Alik_Bljk_SB_MT128x128x8_SN_SU32_SUM3_TT8_8_WG16_16_1_WGM1
    SolutionIndex: 83
    SolutionNameMin: Cijk_Alik_Bljk_SB_MT64x64x16_SN_SU32_SUM3_TT8_8_WG8_8_1_WGM1
    SolutionIndex: 84
    SolutionNameMin: Cijk_Alik_Bljk_SB_MT64x64x16_SN_SU32_SUM3_TT4_8_WG16_8_1_WGM1
    SolutionIndex: 85
    SolutionNameMin: Cijk_Alik_Bljk_SB_MT128x64x16_SN_SU32_SUM3_TT8_8_WG16_8_1_WGM1
    SolutionIndex: 86
    SolutionNameMin: Cijk_Alik_Bljk_SB_MT64x128x16_SN_SU32_SUM3_TT4_8_WG16_16_1_WGM1
    SolutionIndex: 87
    SolutionNameMin: Cijk_Alik_Bljk_SB_MT128x128x16_SN_SU32_SUM3_TT8_8_WG16_16_1_WGM1
    SolutionIndex: 88
    SolutionNameMin: Cijk_Alik_Bljk_SB_MT64x64x32_SN_SU32_SUM3_TT8_8_WG8_8_1_WGM1
    SolutionIndex: 89
    SolutionNameMin: Cijk_Alik_Bljk_SB_MT64x64x32_SN_SU32_SUM3_TT4_4_WG16_16_1_WGM1
    SolutionIndex: 90
    SolutionNameMin: Cijk_Alik_Bljk_SB_MT128x128x32_SN_SU32_SUM3_TT8_8_WG16_16_1_WGM1
    SolutionIndex: 91
    SolutionNameMin: Cijk_Alik_Bljk_SB_MT32x32x8_SN_SU0_SUM0_TT4_4_WG8_8_1_WGM4
    SolutionIndex: 92
    SolutionNameMin: Cijk_Alik_Bljk_SB_MT32x64x8_SN_SU0_SUM0_TT4_8_WG8_8_1_WGM4
    SolutionIndex: 93
    SolutionNameMin: Cijk_Alik_Bljk_SB_MT64x64x8_SN_SU0_SUM0_TT8_8_WG8_8_1_WGM4
    SolutionIndex: 94
    SolutionNameMin: Cijk_Alik_Bljk_SB_MT64x64x8_SN_SU0_SUM0_TT4_8_WG16_8_1_WGM4
    SolutionIndex: 95
    SolutionNameMin: Cijk_Alik_Bljk_SB_MT128x64x8_SN_SU0_SUM0_TT8_8_WG16_8_1_WGM4
    SolutionIndex: 96
    SolutionNameMin: Cijk_Alik_Bljk_SB_MT128x128x8_SN_SU0_SUM0_TT8_8_WG16_16_1_WGM4
    SolutionIndex: 97
    SolutionNameMin: Cijk_Alik_Bljk_SB_MT64x64x16_SN_SU0_SUM0_TT8_8_WG8_8_1_WGM4
    SolutionIndex: 98
    SolutionNameMin: Cijk_Alik_Bljk_SB_MT64x64x16_SN_SU0_SUM0_TT4_8_WG16_8_1_WGM4
    SolutionIndex: 99
    SolutionNameMin: Cijk_Alik_Bljk_SB_MT128x64x16_SN_SU0_SUM0_TT8_8_WG16_8_1_WGM4
    SolutionIndex: 100
    SolutionNameMin: Cijk_Alik_Bljk_SB_MT128x128x16_SN_SU0_SUM0_TT8_8_WG16_16_1_WGM4
    SolutionIndex: 101
    SolutionNameMin: Cijk_Alik_Bljk_SB_MT64x64x8_SN_SU32_SUM3_TT8_8_WG8_8_1_WGM4
    SolutionIndex: 102
    SolutionNameMin: Cijk_Alik_Bljk_SB_MT64x64x8_SN_SU32_SUM3_TT4_8_WG16_8_1_WGM4
    SolutionIndex: 103
    SolutionNameMin: Cijk_Alik_Bljk_SB_MT128x64x8_SN_SU32_SUM3_TT8_8_WG16_8_1_WGM4
    SolutionIndex: 104
    SolutionNameMin: Cijk_Alik_Bljk_SB_MT64x128x8_SN_SU32_SUM3_TT4_8_WG16_16_1_WGM4
    SolutionIndex: 105
    SolutionNameMin: Cijk_Alik_Bljk_SB_MT128x128x8_SN_SU32_SUM3_TT8_8_WG16_16_1_WGM4
    SolutionIndex: 106
    SolutionNameMin: Cijk_Alik_Bljk_SB_MT64x64x16_SN_SU32_SUM3_TT8_8_WG8_8_1_WGM4
    SolutionIndex: 107
    SolutionNameMin: Cijk_Alik_Bljk_SB_MT64x64x16_SN_SU32_SUM3_TT4_8_WG16_8_1_WGM4
    SolutionIndex: 108
    SolutionNameMin: Cijk_Alik_Bljk_SB_MT128x64x16_SN_SU32_SUM3_TT8_8_WG16_8_1_WGM4
    SolutionIndex: 109
    SolutionNameMin: Cijk_Alik_Bljk_SB_MT64x128x16_SN_SU32_SUM3_TT4_8_WG16_16_1_WGM4
    SolutionIndex: 110
    SolutionNameMin: Cijk_Alik_Bljk_SB_MT128x128x16_SN_SU32_SUM3_TT8_8_WG16_16_1_WGM4
    SolutionIndex: 111
    SolutionNameMin: Cijk_Alik_Bljk_SB_MT64x64x32_SN_SU32_SUM3_TT8_8_WG8_8_1_WGM4
    SolutionIndex: 112
    SolutionNameMin: Cijk_Alik_Bljk_SB_MT64x32x32_SN_SU32_SUM3_TT4_4_WG16_8_1_WGM4
    SolutionIndex: 113
    SolutionNameMin: Cijk_Alik_Bljk_SB_MT128x128x32_SN_SU32_SUM3_TT8_8_WG16_16_1_WGM4
    SolutionIndex: 114
    SolutionNameMin: Cijk_Alik_Bljk_SB_MT32x32x8_SN_SU0_SUM0_TT4_4_WG8_8_1_WGM8
    SolutionIndex: 115
    SolutionNameMin: Cijk_Alik_Bljk_SB_MT32x64x8_SN_SU0_SUM0_TT4_8_WG8_8_1_WGM8
    SolutionIndex: 116
    SolutionNameMin: Cijk_Alik_Bljk_SB_MT64x64x8_SN_SU0_SUM0_TT8_8_WG8_8_1_WGM8
    SolutionIndex: 117
    SolutionNameMin: Cijk_Alik_Bljk_SB_MT64x64x8_SN_SU0_SUM0_TT4_8_WG16_8_1_WGM8
    SolutionIndex: 118
    SolutionNameMin: Cijk_Alik_Bljk_SB_MT128x64x8_SN_SU0_SUM0_TT8_8_WG16_8_1_WGM8
    SolutionIndex: 119
    SolutionNameMin: Cijk_Alik_Bljk_SB_MT64x64x8_SN_SU0_SUM0_TT4_4_WG16_16_1_WGM8
    SolutionIndex: 120
    SolutionNameMin: Cijk_Alik_Bljk_SB_MT64x128x8_SN_SU0_SUM0_TT4_8_WG16_16_1_WGM8
    SolutionIndex: 121
    SolutionNameMin: Cijk_Alik_Bljk_SB_MT128x128x8_SN_SU0_SUM0_TT8_8_WG16_16_1_WGM8
    SolutionIndex: 122
    SolutionNameMin: Cijk_Alik_Bljk_SB_MT64x64x16_SN_SU0_SUM0_TT8_8_WG8_8_1_WGM8
    SolutionIndex: 123
    SolutionNameMin: Cijk_Alik_Bljk_SB_MT64x32x16_SN_SU0_SUM0_TT4_4_WG16_8_1_WGM8
    SolutionIndex: 124
    SolutionNameMin: Cijk_Alik_Bljk_SB_MT64x64x16_SN_SU0_SUM0_TT4_8_WG16_8_1_WGM8
    SolutionIndex: 125
    SolutionNameMin: Cijk_Alik_Bljk_SB_MT128x64x16_SN_SU0_SUM0_TT8_8_WG16_8_1_WGM8
    SolutionIndex: 126
    SolutionNameMin: Cijk_Alik_Bljk_SB_MT128x128x16_SN_SU0_SUM0_TT8_8_WG16_16_1_WGM8
    SolutionIndex: 127
    SolutionNameMin: Cijk_Alik_Bljk_SB_MT128x64x32_SN_SU0_SUM0_TT8_8_WG16_8_1_WGM8
    SolutionIndex: 128
    SolutionNameMin: Cijk_Alik_Bljk_SB_MT32x32x8_SN_SU32_SUM3_TT4_4_WG8_8_1_WGM8
    SolutionIndex: 129
    SolutionNameMin: Cijk_Alik_Bljk_SB_MT64x64x8_SN_SU32_SUM3_TT4_8_WG16_8_1_WGM8
    SolutionIndex: 130
    SolutionNameMin: Cijk_Alik_Bljk_SB_MT128x64x8_SN_SU32_SUM3_TT8_8_WG16_8_1_WGM8
    SolutionIndex: 131
    SolutionNameMin: Cijk_Alik_Bljk_SB_MT128x128x8_SN_SU32_SUM3_TT8_8_WG16_16_1_WGM8
    SolutionIndex: 132
    SolutionNameMin: Cijk_Alik_Bljk_SB_MT64x64x16_SN_SU32_SUM3_TT8_8_WG8_8_1_WGM8
    SolutionIndex: 133
    SolutionNameMin: Cijk_Alik_Bljk_SB_MT64x64x16_SN_SU32_SUM3_TT4_8_WG16_8_1_WGM8
    SolutionIndex: 134
    SolutionNameMin: Cijk_Alik_Bljk_SB_MT128x64x16_SN_SU32_SUM3_TT8_8_WG16_8_1_WGM8
    SolutionIndex: 135
    SolutionNameMin: Cijk_Alik_Bljk_SB_MT64x128x16_SN_SU32_SUM3_TT4_8_WG16_16_1_WGM8
    SolutionIndex: 136
    SolutionNameMin: Cijk_Alik_Bljk_SB_MT128x128x16_SN_SU32_SUM3_TT8_8_WG16_16_1_WGM8
    SolutionIndex: 137
    SolutionNameMin: Cijk_Alik_Bljk_SB_MT64x64x32_SN_SU32_SUM3_TT8_8_WG8_8_1_WGM8
    SolutionIndex: 138
    SolutionNameMin: Cijk_Alik_Bljk_SB_MT128x64x32_SN_SU32_SUM3_TT8_8_WG16_8_1_WGM8
    SolutionIndex: 139
    SolutionNameMin: Cijk_Alik_Bljk_SB_MT64x128x32_SN_SU32_SUM3_TT4_8_WG16_16_1_WGM8
    SolutionIndex: 140
    SolutionNameMin: Cijk_Alik_Bljk_SB_MT128x128x32_SN_SU32_SUM3_TT8_8_WG16_16_1_WGM8
    SolutionIndex: 141
    SolutionNameMin: Cijk_Alik_Bljk_SB_MT64x64x8_SN_SU0_SUM0_TT4_8_WG16_8_1_WGM1
    SolutionIndex: 142
    SolutionNameMin: Cijk_Alik_Bljk_SB_MT128x64x8_SN_SU0_SUM0_TT8_8_WG16_8_1_WGM1
    SolutionIndex: 143
    SolutionNameMin: Cijk_Alik_Bljk_SB_MT64x32x16_SN_SU0_SUM0_TT4_4_WG16_8_1_WGM1
    SolutionIndex: 144
    SolutionNameMin: Cijk_Alik_Bljk_SB_MT128x64x16_SN_SU0_SUM0_TT8_8_WG16_8_1_WGM1
    SolutionIndex: 145
    SolutionNameMin: Cijk_Alik_Bljk_SB_MT64x64x16_SN_SU32_SUM3_TT4_8_WG16_8_1_WGM1
    SolutionIndex: 146
    SolutionNameMin: Cijk_Alik_Bljk_SB_MT128x64x16_SN_SU32_SUM3_TT8_8_WG16_8_1_WGM1
    SolutionIndex: 147
    SolutionNameMin: Cijk_Alik_Bljk_SB_MT128x128x16_SN_SU32_SUM3_TT8_8_WG16_16_1_WGM1
    SolutionIndex: 148
    SolutionNameMin: Cijk_Alik_Bljk_SB_MT128x128x32_SN_SU32_SUM3_TT8_8_WG16_16_1_WGM1
    SolutionIndex: 149
    SolutionNameMin: Cijk_Alik_Bljk_SB_MT128x128x8_SN_SU0_SUM0_TT8_8_WG16_16_1_WGM4
    SolutionIndex: 150
    SolutionNameMin: Cijk_Alik_Bljk_SB_MT128x64x16_SN_SU0_SUM0_TT8_8_WG16_8_1_WGM4
    SolutionIndex: 151
    SolutionNameMin: Cijk_Alik_Bljk_SB_MT64x64x16_SN_SU0_SUM0_TT4_4_WG16_16_1_WGM4
    SolutionIndex: 152
    SolutionNameMin: Cijk_Alik_Bljk_SB_MT128x128x8_SN_SU32_SUM3_TT8_8_WG16_16_1_WGM4
    SolutionIndex: 153
    SolutionNameMin: Cijk_Alik_Bljk_SB_MT32x64x16_SN_SU32_SUM3_TT4_8_WG8_8_1_WGM4
    SolutionIndex: 154
    SolutionNameMin: Cijk_Alik_Bljk_SB_MT128x64x16_SN_SU32_SUM3_TT8_8_WG16_8_1_WGM4
    SolutionIndex: 155
    SolutionNameMin: Cijk_Alik_Bljk_SB_MT64x128x16_SN_SU32_SUM3_TT4_8_WG16_16_1_WGM4
    SolutionIndex: 156
    SolutionNameMin: Cijk_Alik_Bljk_SB_MT128x128x16_SN_SU32_SUM3_TT8_8_WG16_16_1_WGM4
    SolutionIndex: 157
    SolutionNameMin: Cijk_Alik_Bljk_SB_MT64x64x32_SN_SU32_SUM3_TT4_4_WG16_16_1_WGM4
    SolutionIndex: 158
    SolutionNameMin: Cijk_Alik_Bljk_SB_MT128x64x8_SN_SU0_SUM0_TT8_8_WG16_8_1_WGM8
    SolutionIndex: 159
    SolutionNameMin: Cijk_Alik_Bljk_SB_MT128x128x8_SN_SU0_SUM0_TT8_8_WG16_16_1_WGM8
    SolutionIndex: 160
    SolutionNameMin: Cijk_Alik_Bljk_SB_MT64x64x16_SN_SU0_SUM0_TT8_8_WG8_8_1_WGM8
    SolutionIndex: 161
    SolutionNameMin: Cijk_Alik_Bljk_SB_MT64x64x16_SN_SU0_SUM0_TT4_8_WG16_8_1_WGM8
    SolutionIndex: 162
    SolutionNameMin: Cijk_Alik_Bljk_SB_MT128x128x16_SN_SU0_SUM0_TT8_8_WG16_16_1_WGM8
    SolutionIndex: 163
    SolutionNameMin: Cijk_Alik_Bljk_SB_MT32x64x16_SN_SU32_SUM3_TT4_8_WG8_8_1_WGM8
    SolutionIndex: 164
    SolutionNameMin: Cijk_Alik_Bljk_SB_MT64x64x16_SN_SU32_SUM3_TT8_8_WG8_8_1_WGM8
    SolutionIndex: 165
    SolutionNameMin: Cijk_Alik_Bljk_SB_MT128x64x16_SN_SU32_SUM3_TT8_8_WG16_8_1_WGM8
    SolutionIndex: 166
    SolutionNameMin: Cijk_Alik_Bljk_SB_MT128x128x16_SN_SU32_SUM3_TT8_8_WG16_16_1_WGM8
    SolutionIndex: 167
    SolutionNameMin: Cijk_Alik_Bljk_SB_MT64x64x32_SN_SU32_SUM3_TT8_8_WG8_8_1_WGM8
    SolutionIndex: 168
    SolutionNameMin: Cijk_Alik_Bljk_SB_MT128x64x32_SN_SU32_SUM3_TT8_8_WG16_8_1_WGM8
    SolutionIndex: 169
    SolutionNameMin: Cijk_Alik_Bljk_SB_MT16x16x8_SN_SU0_SUM0_TT2_2_WG8_8_1_WGM1
    SolutionIndex: 170
    SolutionNameMin: Cijk_Alik_Bljk_SB_MT32x32x8_SN_SU0_SUM0_TT4_4_WG8_8_1_WGM1
    SolutionIndex: 171
    SolutionNameMin: Cijk_Alik_Bljk_SB_MT32x16x8_SN_SU0_SUM0_TT2_2_WG16_8_1_WGM1
    SolutionIndex: 172
    SolutionNameMin: Cijk_Alik_Bljk_SB_MT64x32x8_SN_SU0_SUM0_TT4_4_WG16_8_1_WGM1
    SolutionIndex: 173
    SolutionNameMin: Cijk_Alik_Bljk_SB_MT32x32x8_SN_SU0_SUM0_TT2_2_WG16_16_1_WGM1
    SolutionIndex: 174
    SolutionNameMin: Cijk_Alik_Bljk_SB_MT64x64x8_SN_SU0_SUM0_TT4_4_WG16_16_1_WGM1
    SolutionIndex: 175
    SolutionNameMin: Cijk_Alik_Bljk_SB_MT16x16x16_SN_SU0_SUM0_TT2_2_WG8_8_1_WGM1
    SolutionIndex: 176
    SolutionNameMin: Cijk_Alik_Bljk_SB_MT32x32x16_SN_SU0_SUM0_TT4_4_WG8_8_1_WGM1
    SolutionIndex: 177
    SolutionNameMin: Cijk_Alik_Bljk_SB_MT16x16x32_SN_SU0_SUM0_TT2_2_WG8_8_1_WGM1
    SolutionIndex: 178
    SolutionNameMin: Cijk_Alik_Bljk_SB_MT16x16x8_SN_SU32_SUM3_TT2_2_WG8_8_1_WGM1
    SolutionIndex: 179
    SolutionNameMin: Cijk_Alik_Bljk_SB_MT32x32x8_SN_SU32_SUM3_TT4_4_WG8_8_1_WGM1
    SolutionIndex: 180
    SolutionNameMin: Cijk_Alik_Bljk_SB_MT32x16x8_SN_SU32_SUM3_TT2_2_WG16_8_1_WGM1
    SolutionIndex: 181
    SolutionNameMin: Cijk_Alik_Bljk_SB_MT64x32x8_SN_SU32_SUM3_TT4_4_WG16_8_1_WGM1
    SolutionIndex: 182
    SolutionNameMin: Cijk_Alik_Bljk_SB_MT32x32x8_SN_SU32_SUM3_TT2_2_WG16_16_1_WGM1
    SolutionIndex: 183
    SolutionNameMin: Cijk_Alik_Bljk_SB_MT64x64x8_SN_SU32_SUM3_TT4_4_WG16_16_1_WGM1
    SolutionIndex: 184
    SolutionNameMin: Cijk_Alik_Bljk_SB_MT16x16x16_SN_SU32_SUM3_TT2_2_WG8_8_1_WGM1
    SolutionIndex: 186
    SolutionNameMin: Cijk_Alik_Bljk_SB_MT16x16x32_SN_SU32_SUM3_TT2_2_WG8_8_1_WGM1
    SolutionIndex: 187
    SolutionNameMin: Cijk_Alik_Bljk_SB_MT16x16x8_SN_SU0_SUM0_TT2_2_WG8_8_1_WGM4
    SolutionIndex: 188
    SolutionNameMin: Cijk_Alik_Bljk_SB_MT32x32x8_SN_SU0_SUM0_TT4_4_WG8_8_1_WGM4
    SolutionIndex: 189
    SolutionNameMin: Cijk_Alik_Bljk_SB_MT64x32x8_SN_SU0_SUM0_TT4_4_WG16_8_1_WGM4
    SolutionIndex: 190
    SolutionNameMin: Cijk_Alik_Bljk_SB_MT32x32x8_SN_SU0_SUM0_TT2_2_WG16_16_1_WGM4
    SolutionIndex: 191
    SolutionNameMin: Cijk_Alik_Bljk_SB_MT64x64x8_SN_SU0_SUM0_TT4_4_WG16_16_1_WGM4
    SolutionIndex: 193
    SolutionNameMin: Cijk_Alik_Bljk_SB_MT16x16x32_SN_SU0_SUM0_TT2_2_WG8_8_1_WGM4
    SolutionIndex: 194
    SolutionNameMin: Cijk_Alik_Bljk_SB_MT16x16x8_SN_SU32_SUM3_TT2_2_WG8_8_1_WGM4
    SolutionIndex: 195
    SolutionNameMin: Cijk_Alik_Bljk_SB_MT32x32x8_SN_SU32_SUM3_TT4_4_WG8_8_1_WGM4
    SolutionIndex: 196
    SolutionNameMin: Cijk_Alik_Bljk_SB_MT32x16x8_SN_SU32_SUM3_TT2_2_WG16_8_1_WGM4
    SolutionIndex: 197
    SolutionNameMin: Cijk_Alik_Bljk_SB_MT64x32x8_SN_SU32_SUM3_TT4_4_WG16_8_1_WGM4
    SolutionIndex: 198
    SolutionNameMin: Cijk_Alik_Bljk_SB_MT32x32x8_SN_SU32_SUM3_TT2_2_WG16_16_1_WGM4
    SolutionIndex: 199
    SolutionNameMin: Cijk_Alik_Bljk_SB_MT64x64x8_SN_SU32_SUM3_TT4_4_WG16_16_1_WGM4
    SolutionIndex: 200
    SolutionNameMin: Cijk_Alik_Bljk_SB_MT16x16x16_SN_SU32_SUM3_TT2_2_WG8_8_1_WGM4
    SolutionIndex: 201
    SolutionNameMin: Cijk_Alik_Bljk_SB_MT32x32x16_SN_SU32_SUM3_TT4_4_WG8_8_1_WGM4
    SolutionIndex: 202
    SolutionNameMin: Cijk_Alik_Bljk_SB_MT16x16x8_SN_SU0_SUM0_TT2_2_WG8_8_1_WGM8
    SolutionIndex: 203
    SolutionNameMin: Cijk_Alik_Bljk_SB_MT32x32x8_SN_SU0_SUM0_TT4_4_WG8_8_1_WGM8
    SolutionIndex: 204
    SolutionNameMin: Cijk_Alik_Bljk_SB_MT64x32x8_SN_SU0_SUM0_TT4_4_WG16_8_1_WGM8
    SolutionIndex: 205
    SolutionNameMin: Cijk_Alik_Bljk_SB_MT32x32x8_SN_SU0_SUM0_TT2_2_WG16_16_1_WGM8
    SolutionIndex: 206
    SolutionNameMin: Cijk_Alik_Bljk_SB_MT64x64x8_SN_SU0_SUM0_TT4_4_WG16_16_1_WGM8
    SolutionIndex: 207
    SolutionNameMin: Cijk_Alik_Bljk_SB_MT16x16x16_SN_SU0_SUM0_TT2_2_WG8_8_1_WGM8
    SolutionIndex: 208
    SolutionNameMin: Cijk_Alik_Bljk_SB_MT32x32x16_SN_SU0_SUM0_TT4_4_WG8_8_1_WGM8
    SolutionIndex: 209
    SolutionNameMin: Cijk_Alik_Bljk_SB_MT64x32x16_SN_SU0_SUM0_TT4_4_WG16_8_1_WGM8
    SolutionIndex: 210
    SolutionNameMin: Cijk_Alik_Bljk_SB_MT16x16x8_SN_SU32_SUM3_TT2_2_WG8_8_1_WGM8
    SolutionIndex: 211
    SolutionNameMin: Cijk_Alik_Bljk_SB_MT32x32x8_SN_SU32_SUM3_TT4_4_WG8_8_1_WGM8
    SolutionIndex: 212
    SolutionNameMin: Cijk_Alik_Bljk_SB_MT32x16x8_SN_SU32_SUM3_TT2_2_WG16_8_1_WGM8
    SolutionIndex: 213
    SolutionNameMin: Cijk_Alik_Bljk_SB_MT64x32x8_SN_SU32_SUM3_TT4_4_WG16_8_1_WGM8
    SolutionIndex: 214
    SolutionNameMin: Cijk_Alik_Bljk_SB_MT32x32x8_SN_SU32_SUM3_TT2_2_WG16_16_1_WGM8
    SolutionIndex: 215
    SolutionNameMin: Cijk_Alik_Bljk_SB_MT64x64x8_SN_SU32_SUM3_TT4_4_WG16_16_1_WGM8
    SolutionIndex: 216
    SolutionNameMin: Cijk_Alik_Bljk_SB_MT16x16x16_SN_SU32_SUM3_TT2_2_WG8_8_1_WGM8
    SolutionIndex: 217
    SolutionNameMin: Cijk_Alik_Bljk_SB_MT32x32x16_SN_SU32_SUM3_TT4_4_WG8_8_1_WGM8
    SolutionIndex: 218
    SolutionNameMin: Cijk_Alik_Bljk_SB_MT32x16x8_SN_SU0_SUM0_TT2_2_WG16_8_1_WGM1
    SolutionIndex: 219
    SolutionNameMin: Cijk_Alik_Bljk_SB_MT64x32x8_SN_SU0_SUM0_TT4_4_WG16_8_1_WGM1
    SolutionIndex: 220
    SolutionNameMin: Cijk_Alik_Bljk_SB_MT64x64x8_SN_SU0_SUM0_TT4_4_WG16_16_1_WGM1
    SolutionIndex: 221
    SolutionNameMin: Cijk_Alik_Bljk_SB_MT16x16x16_SN_SU0_SUM0_TT2_2_WG8_8_1_WGM1
    SolutionIndex: 222
    SolutionNameMin: Cijk_Alik_Bljk_SB_MT16x16x32_SN_SU0_SUM0_TT2_2_WG8_8_1_WGM1
    SolutionIndex: 223
    SolutionNameMin: Cijk_Alik_Bljk_SB_MT32x32x8_SN_SU32_SUM3_TT4_4_WG8_8_1_WGM1
    SolutionIndex: 224
    SolutionNameMin: Cijk_Alik_Bljk_SB_MT64x64x8_SN_SU32_SUM3_TT4_4_WG16_16_1_WGM1
    SolutionIndex: 225
    SolutionNameMin: Cijk_Alik_Bljk_SB_MT16x16x16_SN_SU32_SUM3_TT2_2_WG8_8_1_WGM1
    SolutionIndex: 226
    SolutionNameMin: Cijk_Alik_Bljk_SB_MT64x64x8_SN_SU0_SUM0_TT4_4_WG16_16_1_WGM4
    SolutionIndex: 227
    SolutionNameMin: Cijk_Alik_Bljk_SB_MT16x16x16_SN_SU0_SUM0_TT2_2_WG8_8_1_WGM4
    SolutionIndex: 228
    SolutionNameMin: Cijk_Alik_Bljk_SB_MT32x32x16_SN_SU0_SUM0_TT4_4_WG8_8_1_WGM4
    SolutionIndex: 229
    SolutionNameMin: Cijk_Alik_Bljk_SB_MT64x32x8_SN_SU32_SUM3_TT4_4_WG16_8_1_WGM4
    SolutionIndex: 230
    SolutionNameMin: Cijk_Alik_Bljk_SB_MT64x64x8_SN_SU32_SUM3_TT4_4_WG16_16_1_WGM4
    SolutionIndex: 231
    SolutionNameMin: Cijk_Alik_Bljk_SB_MT32x32x16_SN_SU32_SUM3_TT4_4_WG8_8_1_WGM4
    SolutionIndex: 232
    SolutionNameMin: Cijk_Alik_Bljk_SB_MT16x16x8_SN_SU0_SUM0_TT2_2_WG8_8_1_WGM8
    SolutionIndex: 233
    SolutionNameMin: Cijk_Alik_Bljk_SB_MT64x32x8_SN_SU0_SUM0_TT4_4_WG16_8_1_WGM8
    SolutionIndex: 234
    SolutionNameMin: Cijk_Alik_Bljk_SB_MT32x32x8_SN_SU0_SUM0_TT2_2_WG16_16_1_WGM8
    SolutionIndex: 235
    SolutionNameMin: Cijk_Alik_Bljk_SB_MT64x64x8_SN_SU0_SUM0_TT4_4_WG16_16_1_WGM8
    SolutionIndex: 236
    SolutionNameMin: Cijk_Alik_Bljk_SB_MT16x16x16_SN_SU0_SUM0_TT2_2_WG8_8_1_WGM8
    SolutionIndex: 237
    SolutionNameMin: Cijk_Alik_Bljk_SB_MT64x64x8_SN_SU32_SUM3_TT4_4_WG16_16_1_WGM8
    SolutionIndex: 238
    SolutionNameMin: Cijk_Alik_Bljk_SB_MT16x16x16_SN_SU32_SUM3_TT2_2_WG8_8_1_WGM8
    SolutionIndex: 239
    SolutionNameMin: Cijk_Alik_Bljk_SB_MT32x32x16_SN_SU32_SUM3_TT4_4_WG8_8_1_WGM8
    SolutionIndex: 240
    SolutionNameMin: Cijk_Alik_Bljk_SB_MT64x64x16_SN_SU32_SUM3_TT4_4_WG16_16_1_WGM8
    SolutionIndex: 241
    SolutionNameMin: Cijk_Alik_Bljk_SB_MT64x16x8_SN_SU0_SUM0_TT4_2_WG16_8_1_WGM1
    SolutionIndex: 242
    SolutionNameMin: Cijk_Alik_Bljk_SB_MT32x8x8_SN_SU32_SUM3_TT2_2_WG16_4_1_WGM1
    SolutionIndex: 243
    SolutionNameMin: Cijk_Alik_Bljk_SB_MT64x16x8_SN_SU32_SUM3_TT4_2_WG16_8_1_WGM1
    SolutionIndex: 244
    SolutionNameMin: Cijk_Alik_Bljk_SB_MT64x4x16_SN_SU32_SUM3_TT4_1_WG16_4_1_WGM1
    SolutionIndex: 245
    SolutionNameMin: Cijk_Alik_Bljk_SB_MT32x8x8_SN_SU32_SUM3_TT2_2_WG16_4_1_WGM4
    SolutionIndex: 246
    SolutionNameMin: Cijk_Alik_Bljk_SB_MT32x8x8_SN_SU32_SUM3_TT2_2_WG16_4_1_WGM8
    SolutionIndex: 247
    SolutionNameMin: Cijk_Alik_Bljk_SB_MT64x16x8_SN_SU32_SUM3_TT4_2_WG16_8_1_WGM8
    SolutionIndex: 248
    SolutionNameMin: Cijk_Alik_Bljk_SB_MT8x32x8_SN_SU32_SUM3_TT1_4_WG8_8_1_WGM1
    SolutionIndex: 249
    SolutionNameMin: Cijk_Alik_Bljk_SB_MT8x32x8_SN_SU32_SUM3_TT1_4_WG8_8_1_WGM4
    SolutionIndex: 250
    SolutionNameMin: Cijk_Alik_Bljk_SB_MT8x32x8_SN_SU32_SUM3_TT1_4_WG8_8_1_WGM8
    SolutionIndex: 251
    SolutionNameMin: Cijk_Alik_Bljk_SB_MT128x64x16_SN_SU0_SUM0_SUS0_TT8_8_WG16_8_1_WGM4
    SolutionIndex: 252
    SolutionNameMin: Cijk_Alik_Bljk_SB_MT64x64x16_SN_SU0_SUM0_SUS0_TT4_8_WG16_8_1_WGM4
    SolutionIndex: 263
    SolutionNameMin: Cijk_Alik_Bljk_SB_MT128x128x8_SN_SU0_SUM0_SUS0_TT8_16_WG16_8_1_WGM4
    SolutionIndex: 264
    SolutionNameMin: Cijk_Alik_Bljk_SB_MT128x128x8_SN_SU0_SUM0_SUS0_TT8_16_WG16_8_1_WGM1
    SolutionIndex: 265
    SolutionNameMin: Cijk_Alik_Bljk_SB_MT128x64x8_SN_SU0_SUM0_SUS0_TT8_16_WG16_4_1_WGM4
- - - [1024, 4096, 1, 1024]
    - [32, 77.958]
  - - [4096, 4096, 1, 1024]
    - [13, 87.004]
  - - [1024, 4096, 1, 4096]
    - [32, 80.855]
  - - [30528, 4096, 1, 1024]
    - [51, 90.275]
  - - [1024, 2048, 1, 1024]
    - [32, 75.26]
  - - [4096, 2048, 1, 1024]
    - [13, 82.772]
  - - [1024, 2048, 1, 4096]
    - [32, 79.298]
  - - [30528, 2048, 1, 1024]
    - [51, 89.603]
  - - [30522, 320, 1, 768]
    - [30, 72.183]
  - - [3072, 4096, 1, 768]
    - [15, 86.418]
  - - [768, 4096, 1, 3072]
    - [32, 79.862]
  - - [768, 4096, 1, 768]
    - [32, 77.182]
  - - [30522, 160, 1, 768]
    - [29, 59.6]
  - - [30522, 640, 1, 768]
    - [49, 86.147]
  - - [30522, 1280, 1, 768]
    - [43, 88.249]
  - - [1024, 3072, 1, 1024]
    - [32, 76.645]
  - - [1024, 2048, 1, 3072]
    - [32, 78.901]
  - - [1024, 3072, 1, 3072]
    - [15, 79.713]
  - - [3072, 2048, 1, 1024]
    - [30, 83.557]
  - - [3072, 3072, 1, 1024]
    - [32, 89.129]
  - - [3072, 512, 1, 1024]
    - [13, 70.22]
  - - [30522, 160, 1, 1024]
    - [12, 58.251]
  - - [128, 128, 512, 64]
    - [38, 62.366]
  - - [512, 512, 64, 64]
    - [38, 78.188]
  - - [256, 256, 192, 64]
    - [1, 74.606]
  - - [256, 256, 96, 64]
    - [5, 65.113]
  - - [128, 128, 384, 64]
    - [21, 60.353]
  - - [128, 128, 96, 64]
    - [19, 48.109]
  - - [512, 512, 16, 64]
    - [0, 65.113]
  - - [512, 512, 96, 64]
    - [38, 79.33]
  - - [512, 512, 128, 64]
    - [264, 67.527]
  - - [2944, 4288, 1, 1280]
    - [15, 87.658]
  - - [2368, 5888, 1, 256]
    - [30, 80.958]
  - - [5888, 1856, 1, 256]
    - [30, 79.285]
  - - [512, 24000, 1, 1536]
    - [49, 87.117]
  - - [5888, 1408, 1, 256]
    - [13, 78.603]
  - - [5888, 1856, 1, 3328]
    - [30, 82.578]
  - - [5056, 704, 1, 256]
    - [27, 65.885]
  - - [5888, 2944, 1, 3328]
    - [13, 87.753]
  - - [1856, 4288, 1, 256]
    - [13, 72.697]
  - - [1024, 5056, 1, 128]
    - [49, 71.326]
  - - [5056, 5056, 1, 3328]
    - [30, 86.571]
  - - [1408, 5888, 1, 1280]
    - [13, 82.587]
  - - [2368, 6784, 1, 128]
    - [22, 79.921]
  - - [1024, 3584, 1, 3328]
    - [49, 76.848]
  - - [512, 48000, 1, 2048]
    - [51, 89.883]
  - - [5888, 1408, 1, 1280]
    - [49, 82.456]
  - - [1024, 2368, 1, 256]
    - [29, 62.74]
  - - [1408, 1856, 1, 1280]
    - [49, 73.126]
  - - [6144, 24000, 1, 2048]
    - [13, 89.576]
  - - [5056, 5056, 1, 1280]
    - [13, 86.075]
  - - [448, 5056, 1, 256]
    - [10, 57.727]
  - - [1760, 6400, 1, 1760]
    - [37, 87.952]
  - - [1856, 1408, 1, 128]
    - [27, 63.146]
  - - [6784, 256, 1, 3328]
    - [14, 75.77]
  - - [6784, 4288, 1, 3328]
    - [7, 87.884]
  - - [4288, 448, 1, 256]
    - [27, 58.603]
  - - [1856, 2368, 1, 3328]
    - [13, 80.634]
  - - [4288, 2944, 1, 1280]
    - [30, 86.088]
  - - [704, 5056, 1, 1280]
    - [49, 73.329]
  - - [2368, 704, 1, 3328]
    - [29, 66.295]
  - - [256, 5888, 1, 256]
    - [10, 62.357]
  - - [1856, 4288, 1, 3328]
    - [30, 79.429]
  - - [5888, 1024, 1, 256]
    - [13, 77.119]
  - - [16384, 3200, 1, 4096]
    - [43, 79.727]
  - - [1408, 2944, 1, 256]
    - [47, 70.243]
  - - [6784, 5056, 1, 3328]
    - [32, 89.68]
  - - [5056, 5056, 1, 256]
    - [30, 83.616]
  - - [1408, 6784, 1, 128]
    - [22, 79.005]
  - - [704, 5056, 1, 128]
    - [10, 64.355]
  - - [2368, 2944, 1, 1280]
    - [49, 79.361]
  - - [6784, 6784, 1, 1280]
    - [41, 89.111]
  - - [1408, 4288, 1, 1280]
    - [49, 80.295]
  - - [3584, 4288, 1, 1280]
    - [30, 85.628]
  - - [2368, 704, 1, 1280]
    - [48, 64.987]
  - - [5056, 4288, 1, 3328]
    - [24, 88.457]
  - - [3584, 2368, 1, 3328]
    - [49, 84.577]
  - - [6784, 448, 1, 1280]
    - [30, 71.966]
  - - [1408, 2944, 1, 128]
    - [46, 69.711]
  - - [4288, 2944, 1, 256]
    - [13, 82.425]
  - - [5888, 704, 1, 1280]
    - [49, 75.025]
  - - [448, 5888, 1, 128]
    - [25, 58.86]
  - - [5056, 2368, 1, 1280]
    - [30, 81.919]
  - - [448, 3584, 1, 1280]
    - [15, 59.379]
  - - [6784, 5888, 1, 256]
    - [13, 86.512]
  - - [1024, 1408, 1, 256]
    - [12, 59.686]
  - - [2368, 2368, 1, 3328]
    - [30, 76.248]
  - - [1856, 6784, 1, 128]
    - [26, 77.751]
  - - [5056, 704, 1, 3328]
    - [30, 74.299]
  - - [1408, 1856, 1, 256]
    - [29, 66.868]
  - - [2368, 5056, 1, 256]
    - [30, 78.892]
  - - [3584, 2368, 1, 1280]
    - [49, 84.022]
  - - [704, 5888, 1, 256]
    - [15, 70.202]
  - - [6784, 2944, 1, 128]
    - [41, 84.956]
  - - [2560, 1600, 1, 2560]
    - [32, 78.093]
  - - [4288, 6784, 1, 3328]
    - [7, 87.753]
  - - [2944, 6784, 1, 3328]
    - [30, 89.039]
  - - [6144, 5984, 1, 2048]
    - [13, 88.335]
  - - [3584, 704, 1, 3328]
    - [13, 71.971]
  - - [2048, 1600, 1, 512]
    - [30, 73.433]
  - - [448, 4288, 1, 256]
    - [10, 60.687]
  - - [1856, 4288, 1, 128]
    - [46, 72.585]
  - - [704, 2368, 1, 1280]
    - [24, 60.886]
  - - [1856, 2368, 1, 1280]
    - [30, 79.46]
  - - [1856, 4288, 1, 1280]
    - [30, 78.883]
  - - [704, 2944, 1, 128]
    - [10, 61.066]
  - - [1408, 1024, 1, 1280]
    - [29, 66.931]
  - - [704, 6784, 1, 256]
    - [49, 71.845]
  - - [6784, 704, 1, 256]
    - [30, 71.75]
  - - [5056, 1408, 1, 128]
    - [9, 75.765]
  - - [2048, 7000, 1, 2048]
    - [13, 86.061]
  - - [3584, 4288, 1, 3328]
    - [49, 86.196]
  - - [5888, 1856, 1, 1280]
    - [49, 81.784]
  - - [2368, 3584, 1, 1280]
    - [49, 84.013]
  - - [2368, 6784, 1, 1280]
    - [30, 86.336]
  - - [2944, 3584, 1, 3328]
    - [13, 88.01]
  - - [6784, 2944, 1, 256]
    - [30, 85.804]
  - - [4288, 2368, 1, 3328]
    - [49, 84.658]
  - - [1856, 2368, 1, 256]
    - [13, 69.499]
  - - [3584, 6784, 1, 3328]
    - [24, 90.433]
  - - [1024, 5888, 1, 3328]
    - [30, 81.441]
  - - [6144, 24000, 1, 2560]
    - [15, 91.588]
  - - [5056, 4288, 1, 1280]
    - [24, 87.681]
  - - [6784, 1856, 1, 3328]
    - [49, 82.93]
  - - [1408, 5056, 1, 1280]
    - [49, 80.764]
  - - [2368, 2368, 1, 1280]
    - [49, 75.49]
  - - [2944, 5888, 1, 128]
    - [41, 83.517]
  - - [704, 5888, 1, 1280]
    - [32, 77.647]
  - - [2368, 3584, 1, 128]
    - [5, 75.707]
  - - [1856, 5056, 1, 128]
    - [46, 75.31]
  - - [8192, 3200, 1, 2048]
    - [13, 88.087]
  - - [1024, 5056, 1, 1280]
    - [13, 82.474]
  - - [4288, 1024, 1, 256]
    - [13, 73.649]
  - - [2944, 2368, 1, 128]
    - [41, 73.735]
  - - [5888, 448, 1, 1280]
    - [48, 64.509]
  - - [704, 5888, 1, 3328]
    - [32, 79.303]
  - - [3584, 2944, 1, 256]
    - [49, 83.99]
  - - [512, 24000, 1, 2048]
    - [49, 87.261]
  - - [1408, 5056, 1, 3328]
    - [49, 81.658]
  - - [1856, 1856, 1, 3328]
    - [30, 71.953]
  - - [2560, 800, 1, 2560]
    - [13, 71.985]
  - - [2368, 2368, 1, 256]
    - [30, 72.413]
  - - [4288, 4288, 1, 1280]
    - [30, 84.369]
  - - [5888, 1024, 1, 1280]
    - [30, 80.674]
  - - [1408, 4288, 1, 256]
    - [30, 76.212]
  - - [5888, 448, 1, 128]
    - [12, 60.164]
  - - [512, 48000, 1, 2560]
    - [32, 90.956]
  - - [704, 6784, 1, 3328]
    - [49, 78.206]
  - - [2560, 6400, 1, 2560]
    - [32, 90.573]
  - - [5056, 1024, 1, 1280]
    - [30, 83.047]
  - - [448, 5888, 1, 3328]
    - [15, 67.031]
  - - [1024, 2944, 1, 1280]
    - [32, 74.132]
  - - [5056, 5888, 1, 1280]
    - [7, 88.398]
  - - [4288, 5888, 1, 128]
    - [46, 82.127]
  - - [1408, 3584, 1, 128]
    - [26, 74.457]
  - - [448, 3584, 1, 128]
    - [8, 52.444]
  - - [5888, 2944, 1, 1280]
    - [49, 87.365]
  - - [2368, 5888, 1, 128]
    - [22, 78.68]
  - - [3584, 5888, 1, 256]
    - [13, 86.738]
  - - [2368, 1024, 1, 128]
    - [27, 58.788]
  - - [2368, 704, 1, 128]
    - [12, 54.763]
  - - [3584, 2944, 1, 1280]
    - [13, 87.564]
  - - [3584, 2368, 1, 128]
    - [41, 75.752]
  - - [5056, 704, 1, 128]
    - [45, 64.558]
  - - [5056, 1408, 1, 3328]
    - [13, 81.829]
  - - [6784, 1024, 1, 3328]
    - [15, 86.738]
  - - [6784, 2944, 1, 3328]
    - [30, 89.012]
  - - [2944, 5056, 1, 3328]
    - [32, 88.75]
  - - [1856, 1856, 1, 256]
    - [47, 64.928]
  - - [1024, 5888, 1, 128]
    - [9, 74.592]
  - - [6784, 2368, 1, 1280]
    - [13, 86.273]
  - - [4288, 5888, 1, 1280]
    - [24, 88.403]
  - - [4288, 4288, 1, 256]
    - [13, 81.401]
  - - [4288, 1856, 1, 1280]
    - [49, 79.018]
  - - [1856, 2944, 1, 3328]
    - [13, 80.967]
  - - [256, 6784, 1, 3328]
    - [14, 75.81]
  - - [256, 5056, 1, 128]
    - [8, 55.616]
  - - [5056, 1024, 1, 256]
    - [13, 77.678]
  - - [5056, 1856, 1, 3328]
    - [30, 82.781]
  - - [1856, 1408, 1, 256]
    - [47, 64.436]
  - - [8448, 12000, 1, 2816]
    - [7, 91.719]
  - - [4288, 1408, 1, 128]
    - [10, 72.07]
  - - [1856, 5888, 1, 3328]
    - [51, 85.01]
  - - [4288, 5056, 1, 256]
    - [15, 83.151]
  - - [4096, 800, 1, 1024]
    - [13, 66.886]
  - - [5056, 256, 1, 3328]
    - [12, 61.03]
  - - [1024, 5888, 1, 1280]
    - [30, 80.9]
  - - [6784, 2368, 1, 128]
    - [9, 79.659]
  - - [1856, 1024, 1, 1280]
    - [43, 69.255]
  - - [6784, 4288, 1, 1280]
    - [7, 87.234]
  - - [1856, 1856, 1, 1280]
    - [30, 70.239]
  - - [4096, 400, 1, 1024]
    - [32, 57.827]
  - - [3072, 24000, 1, 1024]
    - [30, 88.52]
  - - [5888, 1856, 1, 128]
    - [47, 74.177]
  - - [5056, 3584, 1, 128]
    - [46, 81.022]
  - - [5888, 5888, 1, 3328]
    - [24, 90.735]
  - - [6784, 1024, 1, 256]
    - [13, 80.3]
  - - [2944, 2368, 1, 256]
    - [30, 75.878]
  - - [5056, 5888, 1, 3328]
    - [24, 89.233]
  - - [1856, 1024, 1, 256]
    - [27, 58.287]
  - - [512, 48000, 1, 1536]
    - [32, 90.289]
  - - [3584, 448, 1, 1280]
    - [12, 62.993]
  - - [8448, 5984, 1, 2816]
    - [13, 88.935]
  - - [448, 5888, 1, 256]
    - [10, 58.977]
  - - [1408, 6784, 1, 3328]
    - [49, 84.437]
  - - [4288, 704, 1, 128]
    - [47, 61.82]
  - - [5056, 2944, 1, 256]
    - [30, 83.052]
  - - [6784, 5888, 1, 128]
    - [49, 83.909]
  - - [2944, 704, 1, 128]
    - [47, 59.843]
  - - [1408, 3584, 1, 3328]
    - [30, 82.853]
  - - [2368, 6784, 1, 256]
    - [49, 81.694]
  - - [5056, 1408, 1, 1280]
    - [13, 81.098]
  - - [5056, 4288, 1, 128]
    - [22, 81.789]
  - - [1408, 1856, 1, 128]
    - [12, 64.166]
  - - [1408, 5888, 1, 3328]
    - [49, 83.138]
  - - [6784, 6784, 1, 256]
    - [30, 86.878]
  - - [4288, 2368, 1, 128]
    - [27, 75.468]
  - - [2368, 2944, 1, 256]
    - [30, 74.624]
  - - [3584, 1856, 1, 1280]
    - [49, 81.694]
  - - [6784, 6784, 1, 128]
    - [13, 83.968]
  - - [5888, 5056, 1, 256]
    - [13, 84.757]
  - - [8448, 48000, 1, 2816]
    - [7, 92.193]
  - - [3584, 448, 1, 256]
    - [48, 57.737]
  - - [448, 4288, 1, 128]
    - [8, 55.747]
  - - [256, 6784, 1, 256]
    - [10, 70.433]
  - - [1408, 4288, 1, 128]
    - [27, 72.278]
  - - [2944, 704, 1, 3328]
    - [32, 77.606]
  - - [5056, 256, 1, 1280]
    - [48, 59.541]
  - - [3584, 3584, 1, 256]
    - [49, 85.452]
  - - [3584, 5056, 1, 256]
    - [30, 83.485]
  - - [2944, 2368, 1, 1280]
    - [49, 79.727]
  - - [1408, 3584, 1, 256]
    - [30, 76.934]
  - - [6784, 3584, 1, 256]
    - [24, 86.864]
  - - [5056, 2368, 1, 128]
    - [46, 77.322]
  - - [2944, 2944, 1, 3328]
    - [13, 86.431]
  - - [5056, 6784, 1, 256]
    - [30, 85.957]
  - - [1856, 3584, 1, 128]
    - [27, 72.616]
  - - [6784, 448, 1, 256]
    - [30, 66.056]
  - - [3584, 6784, 1, 128]
    - [41, 84.82]
  - - [5056, 1856, 1, 256]
    - [30, 79.253]
  - - [4608, 5984, 1, 1536]
    - [32, 88.263]
  - - [1760, 3200, 1, 1760]
    - [18, 86.183]
  - - [1024, 1856, 1, 256]
    - [12, 62.257]
  - - [4096, 1600, 1, 1024]
    - [13, 79.546]
  - - [1408, 6784, 1, 1280]
    - [30, 84.026]
  - - [3584, 3584, 1, 1280]
    - [32, 89.896]
  - - [7680, 24000, 1, 2560]
    - [32, 92.098]
  - - [4608, 48000, 1, 1536]
    - [32, 91.863]
  - - [5888, 5888, 1, 128]
    - [49, 84.843]
  - - [5056, 2368, 1, 3328]
    - [30, 82.136]
  - - [2944, 4288, 1, 256]
    - [30, 81.622]
  - - [1408, 3584, 1, 1280]
    - [49, 82.276]
  - - [8192, 1600, 1, 2048]
    - [13, 82.673]
  - - [512, 24000, 1, 2560]
    - [30, 87.83]
  - - [2368, 6784, 1, 3328]
    - [13, 86.738]
  - - [1856, 1408, 1, 1280]
    - [13, 72.057]
  - - [6784, 704, 1, 128]
    - [46, 67.401]
  - - [1408, 5888, 1, 256]
    - [49, 79.889]
  - - [704, 2944, 1, 1280]
    - [15, 74.854]
  - - [704, 6784, 1, 128]
    - [27, 68.574]
  - - [3584, 704, 1, 1280]
    - [13, 70.46]
  - - [5888, 2368, 1, 256]
    - [49, 81.333]
  - - [2944, 6784, 1, 128]
    - [22, 85.096]
  - - [3584, 448, 1, 3328]
    - [12, 64.238]
  - - [704, 2368, 1, 3328]
    - [15, 62.74]
  - - [256, 5888, 1, 128]
    - [27, 58.188]
  - - [2048, 3200, 1, 512]
    - [30, 79.871]
  - - [2944, 2944, 1, 1280]
    - [49, 86.088]
  - - [5056, 448, 1, 3328]
    - [12, 68.619]
  - - [6784, 704, 1, 3328]
    - [49, 78.188]
  - - [5888, 4288, 1, 128]
    - [37, 81.328]
  - - [1408, 2944, 1, 3328]
    - [32, 79.257]
  - - [3584, 704, 1, 128]
    - [12, 61.328]
  - - [4608, 12000, 1, 1536]
    - [32, 91.132]
  - - [5056, 5056, 1, 128]
    - [26, 81.707]
  - - [8192, 800, 1, 2048]
    - [13, 74.899]
  - - [448, 5056, 1, 128]
    - [8, 56.139]
  - - [5056, 3584, 1, 256]
    - [13, 83.219]
  - - [1408, 5056, 1, 128]
    - [46, 74.994]
  - - [2944, 3584, 1, 128]
    - [22, 82.411]
  - - [3584, 2368, 1, 256]
    - [30, 80.214]
  - - [8448, 24000, 1, 2816]
    - [7, 92.138]
  - - [3584, 3584, 1, 3328]
    - [51, 90.704]
  - - [5888, 6784, 1, 256]
    - [13, 86.449]
  - - [4288, 2944, 1, 3328]
    - [30, 86.476]
  - - [256, 5056, 1, 1280]
    - [48, 59.979]
  - - [2944, 5888, 1, 3328]
    - [24, 90.162]
  - - [6784, 5888, 1, 1280]
    - [32, 90.383]
  - - [2048, 800, 1, 512]
    - [12, 58.806]
  - - [5888, 4288, 1, 1280]
    - [24, 88.538]
  - - [1024, 24000, 1, 2048]
    - [15, 89.102]
  - - [5888, 3584, 1, 128]
    - [41, 82.871]
  - - [1024, 2944, 1, 128]
    - [8, 66.652]
  - - [704, 3584, 1, 128]
    - [47, 60.61]
  - - [5888, 448, 1, 3328]
    - [12, 65.032]
  - - [2368, 4288, 1, 1280]
    - [13, 83.819]
  - - [4288, 2944, 1, 128]
    - [13, 78.712]
  - - [1024, 6784, 1, 3328]
    - [15, 88.782]
  - - [5056, 2944, 1, 3328]
    - [13, 86.769]
  - - [2944, 3584, 1, 256]
    - [30, 83.494]
  - - [1408, 1408, 1, 3328]
    - [51, 74.651]
  - - [3584, 3584, 1, 128]
    - [41, 82.294]
  - - [3584, 704, 1, 256]
    - [29, 65.077]
  - - [3584, 1408, 1, 3328]
    - [30, 82.921]
  - - [704, 3584, 1, 1280]
    - [49, 70.802]
  - - [2944, 6784, 1, 1280]
    - [13, 88.592]
  - - [1856, 6784, 1, 256]
    - [30, 78.518]
  - - [4288, 448, 1, 3328]
    - [32, 71.407]
  - - [6784, 4288, 1, 128]
    - [46, 83.016]
  - - [6784, 704, 1, 1280]
    - [30, 77.114]
  - - [3584, 6784, 1, 256]
    - [30, 85.723]
  - - [6144, 12000, 1, 2048]
    - [13, 89.282]
  - - [5888, 1024, 1, 3328]
    - [30, 81.41]
  - - [704, 6784, 1, 1280]
    - [49, 76.943]
  - - [1856, 5056, 1, 3328]
    - [49, 82.894]
  - - [1024, 3584, 1, 128]
    - [8, 66.48]
  - - [1024, 1408, 1, 128]
    - [8, 61.044]
  - - [2368, 2944, 1, 128]
    - [27, 72.201]
  - - [5056, 2944, 1, 128]
    - [5, 80.593]
  - - [5888, 5056, 1, 3328]
    - [7, 89.738]
  - - [5888, 2368, 1, 128]
    - [46, 77.096]
  - - [3584, 6784, 1, 1280]
    - [7, 88.741]
  - - [1856, 5888, 1, 256]
    - [15, 77.236]
  - - [4288, 4288, 1, 3328]
    - [49, 84.856]
  - - [4288, 1408, 1, 1280]
    - [30, 80.196]
  - - [3584, 5056, 1, 128]
    - [41, 80.746]
  - - [4288, 2368, 1, 256]
    - [30, 80.44]
  - - [2944, 5056, 1, 1280]
    - [15, 87.771]
  - - [448, 6784, 1, 256]
    - [10, 65.835]
  - - [1856, 2368, 1, 128]
    - [47, 69.273]
  - - [6784, 2368, 1, 3328]
    - [13, 86.684]
  - - [4288, 1856, 1, 3328]
    - [49, 79.415]
  - - [3584, 448, 1, 128]
    - [25, 57.664]
  - - [2048, 1600, 1, 2048]
    - [13, 78.373]
  - - [3584, 1024, 1, 1280]
    - [30, 76.131]
  - - [1856, 5056, 1, 256]
    - [49, 78.278]
  - - [1024, 4288, 1, 256]
    - [13, 71.976]
  - - [5888, 3584, 1, 3328]
    - [51, 91.191]
  - - [5056, 3584, 1, 3328]
    - [43, 87.509]
  - - [2368, 1408, 1, 1280]
    - [13, 78.251]
  - - [5056, 2944, 1, 1280]
    - [13, 86.129]
  - - [1024, 6784, 1, 256]
    - [30, 81.676]
  - - [5124, 9124, 1, 2048]
    - [32, 87.081]
  - - [2944, 1408, 1, 128]
    - [47, 68.709]
  - - [3584, 1408, 1, 1280]
    - [30, 82.168]
  - - [5056, 6784, 1, 3328]
    - [7, 89.192]
  - - [3584, 4288, 1, 256]
    - [49, 82.407]
  - - [1856, 6784, 1, 3328]
    - [30, 82.962]
  - - [5888, 4288, 1, 256]
    - [13, 84.401]
  - - [5056, 1408, 1, 256]
    - [13, 76.614]
  - - [3584, 1024, 1, 256]
    - [49, 72.684]
  - - [5888, 5888, 1, 256]
    - [49, 86.666]
  - - [4288, 1024, 1, 1280]
    - [15, 79.145]
  - - [448, 6784, 1, 3328]
    - [51, 76.487]
  - - [2944, 1408, 1, 1280]
    - [51, 77.886]
  - - [2944, 1856, 1, 3328]
    - [13, 80.791]
  - - [3584, 5888, 1, 1280]
    - [32, 90.771]
  - - [6784, 1856, 1, 1280]
    - [13, 82.465]
  - - [2944, 5056, 1, 256]
    - [30, 83.449]
  - - [5888, 256, 1, 3328]
    - [49, 69.052]
  - - [2944, 4288, 1, 128]
    - [26, 79.19]
  - - [3584, 1408, 1, 256]
    - [49, 78.594]
  - - [704, 3584, 1, 3328]
    - [49, 72.314]
  - - [4096, 3200, 1, 1024]
    - [13, 85.497]
  - - [5056, 448, 1, 1280]
    - [12, 67.586]
  - - [3584, 1856, 1, 3328]
    - [49, 82.411]
  - - [4288, 6784, 1, 1280]
    - [7, 87.0]
  - - [2560, 7000, 1, 2560]
    - [30, 87.469]
  - - [2944, 1024, 1, 256]
    - [26, 65.375]
  - - [2368, 4288, 1, 3328]
    - [49, 84.667]
  - - [1024, 1408, 1, 1280]
    - [12, 66.503]
  - - [6784, 5056, 1, 256]
    - [13, 85.339]
  - - [1856, 1856, 1, 128]
    - [47, 61.436]
  - - [3584, 5056, 1, 3328]
    - [7, 87.518]
  - - [448, 6784, 1, 128]
    - [47, 60.944]
  - - [2944, 6784, 1, 256]
    - [30, 86.35]
  - - [2944, 2944, 1, 128]
    - [41, 80.367]
  - - [1856, 3584, 1, 1280]
    - [51, 84.062]
  - - [4288, 448, 1, 128]
    - [12, 56.834]
  - - [4608, 24000, 1, 1536]
    - [32, 91.629]
  - - [1856, 1408, 1, 3328]
    - [13, 74.543]
  - - [1024, 4288, 1, 3328]
    - [32, 83.796]
  - - [5056, 448, 1, 256]
    - [12, 63.313]
  - - [2944, 2368, 1, 3328]
    - [30, 80.088]
  - - [704, 4288, 1, 3328]
    - [15, 76.275]
  - - [1024, 1856, 1, 1280]
    - [43, 69.187]
  - - [2048, 6400, 1, 2048]
    - [13, 86.093]
  - - [512, 48000, 1, 2816]
    - [24, 91.168]
  - - [5124, 9124, 1, 2560]
    - [15, 87.428]
  - - [1024, 5888, 1, 256]
    - [13, 75.973]
  - - [1408, 2368, 1, 256]
    - [30, 70.017]
  - - [1408, 1408, 1, 256]
    - [29, 64.283]
  - - [2368, 2368, 1, 128]
    - [46, 70.306]
  - - [6784, 1408, 1, 128]
    - [41, 79.438]
  - - [4288, 5888, 1, 256]
    - [15, 85.263]
  - - [1408, 5056, 1, 256]
    - [49, 76.844]
  - - [4288, 3584, 1, 128]
    - [5, 80.015]
  - - [3584, 5056, 1, 1280]
    - [32, 86.688]
  - - [1856, 1024, 1, 128]
    - [27, 55.156]
  - - [1024, 24000, 1, 1536]
    - [15, 89.517]
  - - [704, 4288, 1, 256]
    - [47, 63.669]
  - - [5888, 2368, 1, 1280]
    - [13, 84.148]
  - - [2368, 5888, 1, 1280]
    - [30, 84.076]
  - - [5888, 256, 1, 1280]
    - [30, 67.965]
  - - [2368, 1856, 1, 3328]
    - [49, 80.782]
  - - [2944, 704, 1, 256]
    - [51, 65.479]
  - - [2368, 1024, 1, 3328]
    - [30, 69.738]
  - - [704, 3584, 1, 256]
    - [27, 64.504]
  - - [704, 2944, 1, 3328]
    - [32, 77.43]
  - - [6784, 1024, 1, 128]
    - [46, 79.474]
  - - [2944, 1024, 1, 3328]
    - [13, 73.153]
  - - [2944, 5056, 1, 128]
    - [22, 80.76]
  - - [1408, 6784, 1, 256]
    - [49, 81.734]
  - - [6784, 1408, 1, 3328]
    - [49, 84.401]
  - - [4288, 6784, 1, 128]
    - [46, 82.934]
  - - [6784, 2944, 1, 1280]
    - [30, 88.664]
  - - [4288, 1856, 1, 128]
    - [26, 71.479]
  - - [1856, 2944, 1, 128]
    - [27, 71.488]
  - - [6784, 448, 1, 128]
    - [21, 62.596]
  - - [448, 5056, 1, 1280]
    - [30, 63.827]
  - - [2368, 1856, 1, 128]
    - [47, 69.575]
  - - [4288, 704, 1, 256]
    - [30, 65.443]
  - - [5888, 704, 1, 256]
    - [30, 69.345]
  - - [3584, 1024, 1, 128]
    - [27, 68.903]
  - - [256, 5888, 1, 3328]
    - [49, 69.485]
  - - [1408, 4288, 1, 3328]
    - [49, 81.567]
  - - [6784, 4288, 1, 256]
    - [30, 84.649]
  - - [5888, 256, 1, 256]
    - [47, 61.432]
  - - [6784, 1024, 1, 1280]
    - [32, 85.885]
  - - [5888, 1024, 1, 128]
    - [49, 74.655]
  - - [6784, 3584, 1, 1280]
    - [32, 89.928]
  - - [1024, 6784, 1, 1280]
    - [32, 86.35]
  - - [1408, 2944, 1, 1280]
    - [32, 77.782]
  - - [2048, 800, 1, 2048]
    - [12, 64.17]
  - - [1408, 2368, 1, 3328]
    - [13, 80.57]
  - - [2944, 1856, 1, 128]
    - [27, 71.619]
  - - [256, 6784, 1, 128]
    - [27, 65.465]
  - - [5056, 6784, 1, 128]
    - [22, 83.291]
  - - [4288, 5056, 1, 128]
    - [22, 80.25]
  - - [1856, 5888, 1, 128]
    - [30, 75.797]
  - - [2944, 5888, 1, 256]
    - [15, 85.56]
  - - [3584, 1856, 1, 256]
    - [49, 77.372]
  - - [4288, 3584, 1, 1280]
    - [30, 85.89]
  - - [704, 5888, 1, 128]
    - [10, 67.053]
  - - [6784, 3584, 1, 128]
    - [46, 84.189]
  - - [4288, 5056, 1, 3328]
    - [7, 89.125]
  - - [1408, 1408, 1, 128]
    - [47, 59.257]
  - - [5056, 2368, 1, 256]
    - [13, 79.42]
  - - [4288, 704, 1, 3328]
    - [13, 72.946]
  - - [448, 3584, 1, 256]
    - [26, 53.32]
  - - [2368, 1024, 1, 1280]
    - [30, 67.938]
  - - [2944, 1408, 1, 3328]
    - [51, 79.366]
  - - [1024, 1408, 1, 3328]
    - [29, 67.929]
  - - [2944, 5888, 1, 1280]
    - [15, 89.391]
  - - [5888, 3584, 1, 256]
    - [13, 86.35]
  - - [2368, 5056, 1, 128]
    - [22, 75.829]
  - - [1408, 1856, 1, 3328]
    - [30, 74.881]
  - - [6784, 1408, 1, 1280]
    - [13, 84.004]
  - - [4096, 7000, 1, 4096]
    - [13, 86.711]
  - - [704, 2944, 1, 256]
    - [27, 64.418]
  - - [6784, 5888, 1, 3328]
    - [7, 90.889]
  - - [2368, 4288, 1, 128]
    - [27, 75.391]
  - - [1024, 6784, 1, 128]
    - [5, 77.958]
  - - [1408, 1408, 1, 1280]
    - [51, 72.932]
  - - [16384, 400, 1, 4096]
    - [32, 60.719]
  - - [448, 4288, 1, 3328]
    - [51, 71.574]
  - - [2368, 1408, 1, 256]
    - [30, 71.633]
  - - [5888, 5056, 1, 128]
    - [13, 81.969]
  - - [704, 2368, 1, 256]
    - [27, 53.784]
  - - [1024, 24000, 1, 2560]
    - [15, 90.803]
  - - [5888, 2368, 1, 3328]
    - [13, 84.527]
  - - [5124, 9124, 1, 1760]
    - [37, 89.973]
  - - [4288, 448, 1, 1280]
    - [32, 68.127]
  - - [5888, 704, 1, 3328]
    - [30, 76.032]
  - - [5056, 256, 1, 128]
    - [8, 51.267]
  - - [1408, 5888, 1, 128]
    - [22, 77.976]
  - - [7680, 12000, 1, 2560]
    - [15, 91.462]
  - - [1408, 1024, 1, 256]
    - [29, 59.221]
  - - [8192, 400, 1, 2048]
    - [12, 61.707]
  - - [1024, 1856, 1, 128]
    - [8, 62.366]
  - - [5056, 6784, 1, 1280]
    - [24, 88.592]
  - - [704, 5056, 1, 3328]
    - [13, 74.222]
  - - [2368, 2944, 1, 3328]
    - [49, 80.088]
  - - [2368, 3584, 1, 256]
    - [13, 78.558]
  - - [5056, 3584, 1, 1280]
    - [32, 86.891]
  - - [5124, 9124, 1, 4096]
    - [32, 87.099]
  - - [7680, 48000, 1, 2560]
    - [32, 92.143]
  - - [1856, 2944, 1, 1280]
    - [49, 79.654]
  - - [1024, 48000, 1, 2816]
    - [7, 91.633]
  - - [2944, 1408, 1, 256]
    - [30, 69.647]
  - - [4288, 1408, 1, 3328]
    - [30, 81.54]
  - - [5888, 2944, 1, 128]
    - [41, 81.892]
  - - [2944, 1024, 1, 128]
    - [27, 65.501]
  - - [4288, 5056, 1, 1280]
    - [15, 88.168]
  - - [5888, 6784, 1, 1280]
    - [49, 89.4]
  - - [6784, 5056, 1, 128]
    - [46, 82.673]
  - - [1760, 1600, 1, 1760]
    - [17, 76.483]
  - - [5888, 1408, 1, 3328]
    - [49, 83.183]
  - - [2368, 1856, 1, 256]
    - [30, 73.04]
  - - [256, 5056, 1, 256]
    - [29, 56.712]
  - - [448, 3584, 1, 3328]
    - [15, 60.755]
  - - [704, 2368, 1, 128]
    - [25, 55.778]
  - - [5888, 256, 1, 128]
    - [9, 55.873]
  - - [3584, 1856, 1, 128]
    - [41, 73.424]
  - - [4288, 4288, 1, 128]
    - [46, 80.48]
  - - [1856, 1024, 1, 3328]
    - [43, 71.533]
  - - [1024, 5056, 1, 256]
    - [49, 76.528]
  - - [5888, 5888, 1, 1280]
    - [7, 90.009]
  - - [5056, 5888, 1, 128]
    - [26, 83.674]
  - - [2368, 1408, 1, 3328]
    - [13, 80.385]
  - - [1024, 48000, 1, 1536]
    - [15, 90.356]
  - - [5888, 448, 1, 256]
    - [12, 60.448]
  - - [2560, 3200, 1, 2560]
    - [13, 87.279]
  - - [5888, 6784, 1, 128]
    - [49, 82.19]
  - - [6144, 48000, 1, 2048]
    - [13, 89.887]
  - - [6784, 5056, 1, 1280]
    - [7, 89.003]
  - - [5056, 704, 1, 1280]
    - [49, 72.603]
  - - [1024, 48000, 1, 2560]
    - [32, 91.367]
  - - [1024, 2368, 1, 128]
    - [8, 62.46]
  - - [16384, 800, 1, 4096]
    - [41, 70.617]
  - - [5888, 5056, 1, 1280]
    - [7, 88.845]
  - - [3072, 48000, 1, 1024]
    - [30, 89.377]
  - - [6784, 1408, 1, 256]
    - [30, 80.363]
  - - [3584, 5888, 1, 128]
    - [41, 84.843]
  - - [5056, 5888, 1, 256]
    - [13, 84.811]
  - - [2368, 1024, 1, 256]
    - [14, 60.412]
  - - [2944, 1856, 1, 256]
    - [30, 74.953]
  - - [1856, 6784, 1, 1280]
    - [30, 82.556]
  - - [4288, 3584, 1, 256]
    - [13, 82.759]
  - - [6784, 448, 1, 3328]
    - [13, 73.234]
  - - [5056, 1856, 1, 1280]
    - [30, 82.181]
  - - [1408, 1024, 1, 3328]
    - [29, 67.897]
  - - [5888, 3584, 1, 1280]
    - [51, 90.627]
  - - [1856, 3584, 1, 3328]
    - [15, 85.461]
  - - [1024, 2944, 1, 256]
    - [13, 68.059]
  - - [448, 6784, 1, 1280]
    - [32, 74.953]
  - - [704, 5056, 1, 256]
    - [49, 67.527]
  - - [3584, 1024, 1, 3328]
    - [30, 76.826]
  - - [2944, 1856, 1, 1280]
    - [49, 80.065]
  - - [5056, 256, 1, 256]
    - [12, 54.321]
  - - [2944, 4288, 1, 3328]
    - [51, 88.732]
  - - [2368, 3584, 1, 3328]
    - [49, 84.694]
  - - [2944, 704, 1, 1280]
    - [32, 75.391]
  - - [2944, 3584, 1, 1280]
    - [49, 87.658]
  - - [1856, 5888, 1, 1280]
    - [15, 84.144]
  - - [2048, 3200, 1, 2048]
    - [15, 83.48]
  - - [4288, 1408, 1, 256]
    - [13, 76.397]
  - - [5888, 1408, 1, 128]
    - [49, 77.85]
  - - [4288, 2368, 1, 1280]
    - [49, 84.135]
  - - [6784, 2368, 1, 256]
    - [13, 82.781]
  - - [1024, 24000, 1, 2816]
    - [7, 91.119]
  - - [7680, 5984, 1, 2560]
    - [32, 89.422]
  - - [4288, 1856, 1, 256]
    - [30, 74.155]
  - - [1856, 2944, 1, 256]
    - [30, 74.935]
  - - [5056, 1024, 1, 128]
    - [9, 74.822]
  - - [1760, 800, 1, 1760]
    - [18, 66.304]
  - - [6784, 256, 1, 128]
    - [27, 66.155]
  - - [5888, 704, 1, 128]
    - [47, 65.298]
  - - [1408, 2368, 1, 128]
    - [27, 68.917]
  - - [1024, 4288, 1, 1280]
    - [32, 81.432]
  - - [2368, 5056, 1, 3328]
    - [32, 84.468]
  - - [4288, 1024, 1, 3328]
    - [30, 80.606]
  - - [6144, 48000, 1, 2560]
    - [15, 91.886]
  - - [1024, 5056, 1, 3328]
    - [30, 84.595]
  - - [1024, 1856, 1, 3328]
    - [32, 71.353]
  - - [4288, 6784, 1, 256]
    - [13, 84.491]
  - - [3584, 2944, 1, 3328]
    - [13, 87.965]
  - - [5888, 2944, 1, 256]
    - [13, 84.432]
  - - [448, 4288, 1, 1280]
    - [51, 69.616]
  - - [1024, 4288, 1, 128]
    - [8, 70.437]
  - - [5056, 4288, 1, 256]
    - [30, 84.035]
  - - [1024, 3584, 1, 256]
    - [13, 72.26]
  - - [6784, 6784, 1, 3328]
    - [7, 89.734]
  - - [448, 5888, 1, 1280]
    - [15, 65.127]
  - - [5056, 448, 1, 128]
    - [25, 62.889]
  - - [4288, 704, 1, 1280]
    - [49, 71.66]
  - - [3584, 2944, 1, 128]
    - [49, 81.504]
  - - [6784, 256, 1, 1280]
    - [50, 74.949]
  - - [2368, 5888, 1, 3328]
    - [30, 84.396]
  - - [2368, 1856, 1, 1280]
    - [49, 78.915]
  - - [448, 5056, 1, 3328]
    - [49, 65.095]
  - - [3584, 4288, 1, 128]
    - [49, 79.411]
  - - [5888, 4288, 1, 3328]
    - [7, 89.63]
  - - [2368, 704, 1, 256]
    - [27, 51.731]
  - - [3584, 1408, 1, 128]
    - [41, 74.231]
  - - [1856, 5056, 1, 1280]
    - [49, 82.371]
  - - [2944, 1024, 1, 1280]
    - [49, 72.427]
  - - [3584, 5888, 1, 3328]
    - [24, 91.507]
  - - [2368, 4288, 1, 256]
    - [30, 78.996]
  - - [1024, 2368, 1, 3328]
    - [30, 69.693]
  - - [1024, 3584, 1, 1280]
    - [30, 76.189]
  - - [4288, 5888, 1, 3328]
    - [32, 89.116]
  - - [1024, 2944, 1, 3328]
    - [32, 75.995]
  - - [6784, 1856, 1, 256]
    - [13, 80.074]
  - - [256, 6784, 1, 1280]
    - [31, 74.89]
  - - [1856, 3584, 1, 256]
    - [24, 76.844]
  - - [6784, 1856, 1, 128]
    - [9, 77.85]
  - - [512, 24000, 1, 2816]
    - [49, 87.87]
  - - [256, 5888, 1, 1280]
    - [49, 67.004]
  - - [16384, 1600, 1, 4096]
    - [51, 77.751]
  - - [2368, 1408, 1, 128]
    - [47, 68.474]
  - - [1408, 1024, 1, 128]
    - [40, 57.583]
  - - [6784, 3584, 1, 3328]
    - [24, 90.618]
  - - [1760, 7000, 1, 1760]
    - [37, 87.591]
  - - [2368, 5056, 1, 1280]
    - [32, 83.841]
  - - [1408, 2368, 1, 1280]
    - [30, 78.797]
  - - [704, 4288, 1, 128]
    - [27, 61.996]
  - - [2944, 2944, 1, 256]
    - [30, 83.449]
  - - [6784, 256, 1, 256]
    - [47, 72.314]
  - - [256, 5056, 1, 3328]
    - [29, 61.292]
  - - [5056, 1856, 1, 128]
    - [26, 76.695]
  - - [5056, 1024, 1, 3328]
    - [30, 84.563]
  - - [4288, 3584, 1, 3328]
    - [49, 86.16]
  - - [1024, 2368, 1, 1280]
    - [49, 67.31]
  - - [5888, 6784, 1, 3328]
    - [13, 89.765]
  - - [704, 4288, 1, 1280]
    - [15, 73.347]
  - - [1024, 48000, 1, 2048]
    - [32, 90.307]
  - - [4288, 1024, 1, 128]
    - [27, 69.666]
  - - [4096, 512, 1, 32]
    - [0, 43.628]
  - - [2048, 1024, 1, 1664]
    - [24, 78.518]
  - - [4096, 512, 1, 1408]
    - [24, 77.714]
  - - [4096, 1024, 1, 1280]
    - [30, 76.781]
  - - [2048, 1024, 1, 640]
    - [43, 75.621]
  - - [4096, 1024, 1, 13312]
    - [49, 74.29]
  - - [2048, 1024, 1, 13312]
    - [13, 71.912]
  - - [2048, 1024, 1, 3584]
    - [15, 78.536]
  - - [4096, 1024, 1, 1920]
    - [46, 78.134]
  - - [4096, 1024, 1, 12288]
    - [32, 72.932]
  - - [4096, 1024, 1, 8320]
    - [24, 77.723]
  - - [4096, 1024, 1, 15360]
    - [49, 72.377]
  - - [4096, 512, 1, 3072]
    - [15, 78.238]
  - - [4096, 512, 1, 13312]
    - [13, 66.074]
  - - [4096, 1024, 1, 3840]
    - [49, 77.295]
  - - [2048, 1024, 1, 3200]
    - [24, 79.411]
  - - [4096, 512, 1, 3840]
    - [43, 79.285]
  - - [4096, 512, 1, 5632]
    - [32, 79.501]
  - - [4096, 512, 1, 64]
    - [0, 57.127]
  - - [2048, 1024, 1, 512]
    - [32, 72.846]
  - - [4096, 512, 1, 8192]
    - [15, 73.997]
  - - [4096, 512, 1, 2304]
    - [15, 77.723]
  - - [4096, 512, 1, 2816]
    - [15, 78.757]
  - - [2048, 1024, 1, 7680]
    - [15, 79.596]
  - - [4096, 512, 1, 1920]
    - [24, 78.432]
  - - [4096, 1024, 1, 32]
    - [8, 54.163]
  - - [4096, 512, 1, 16640]
    - [51, 79.812]
  - - [2048, 1024, 1, 1024]
    - [51, 75.355]
  - - [4096, 512, 1, 1792]
    - [51, 77.778]
  - - [4096, 1024, 1, 8192]
    - [32, 70.405]
  - - [2048, 1024, 1, 4160]
    - [43, 79.375]
  - - [4096, 512, 1, 10240]
    - [51, 71.154]
  - - [4096, 512, 1, 512]
    - [28, 70.825]
  - - [2048, 1024, 1, 6656]
    - [15, 79.406]
  - - [2048, 1024, 1, 14336]
    - [13, 71.741]
  - - [4096, 512, 1, 11264]
    - [13, 68.565]
  - - [4096, 512, 1, 128]
    - [27, 60.859]
  - - [4096, 512, 1, 768]
    - [15, 75.332]
  - - [4096, 1024, 1, 11264]
    - [49, 72.413]
  - - [4096, 1024, 1, 16640]
    - [49, 77.683]
  - - [2048, 1024, 1, 5632]
    - [15, 79.122]
  - - [4096, 512, 1, 12288]
    - [14, 64.477]
  - - [4096, 1024, 1, 5632]
    - [30, 77.466]
  - - [2048, 1024, 1, 10240]
    - [15, 79.406]
  - - [4096, 1024, 1, 640]
    - [46, 76.208]
  - - [2048, 1024, 1, 12288]
    - [15, 76.411]
  - - [4096, 1024, 1, 10240]
    - [51, 73.379]
  - - [2048, 1024, 1, 4608]
    - [15, 78.869]
  - - [4096, 512, 1, 3584]
    - [15, 78.842]
  - - [4096, 1024, 1, 4608]
    - [30, 77.444]
  - - [4096, 1024, 1, 3328]
    - [30, 77.448]
  - - [2048, 1024, 1, 9216]
    - [15, 79.682]
  - - [2048, 1024, 1, 2304]
    - [32, 78.54]
  - - [4096, 512, 1, 6144]
    - [15, 79.289]
  - - [4096, 512, 1, 15360]
    - [30, 66.683]
  - - [4096, 1024, 1, 7168]
    - [15, 77.538]
  - - [4096, 1024, 1, 9216]
    - [32, 72.81]
  - - [4096, 1024, 1, 7680]
    - [32, 77.39]
  - - [2048, 1024, 1, 8192]
    - [15, 78.712]
  - - [4096, 1024, 1, 64]
    - [0, 66.11]
  - - [2048, 1024, 1, 1280]
    - [24, 77.597]
  - - [2048, 1024, 1, 3328]
    - [51, 79.154]
  - - [4096, 512, 1, 14336]
    - [30, 68.05]
  - - [4096, 512, 1, 8320]
    - [24, 79.668]
  - - [4096, 1024, 1, 6656]
    - [30, 77.538]
  - - [2048, 1024, 1, 256]
    - [11, 64.87]
  - - [4096, 512, 1, 1024]
    - [15, 76.302]
  - - [4096, 1024, 1, 1536]
    - [30, 76.812]
  - - [2048, 1024, 1, 32]
    - [0, 40.696]
  - - [4096, 512, 1, 640]
    - [15, 74.89]
  - - [4096, 512, 1, 16384]
    - [51, 68.659]
  - - [4096, 1024, 1, 512]
    - [30, 74.186]
  - - [2048, 1024, 1, 1152]
    - [43, 77.936]
  - - [4096, 1024, 1, 2080]
    - [37, 80.246]
  - - [4096, 1024, 1, 768]
    - [30, 76.162]
  - - [4096, 1024, 1, 2560]
    - [30, 77.029]
  - - [2048, 1024, 1, 64]
    - [8, 58.562]
  - - [4096, 1024, 1, 16384]
    - [51, 69.219]
  - - [4096, 512, 1, 6656]
    - [32, 79.393]
  - - [2048, 1024, 1, 128]
    - [10, 60.556]
  - - [2048, 1024, 1, 2080]
    - [43, 78.887]
  - - [2048, 1024, 1, 16640]
    - [15, 79.551]
  - - [2048, 1024, 1, 3072]
    - [15, 78.202]
  - - [4096, 1024, 1, 1408]
    - [26, 77.976]
  - - [4096, 1024, 1, 2048]
    - [13, 76.817]
  - - [2048, 1024, 1, 2560]
    - [51, 78.567]
  - - [4096, 1024, 1, 128]
    - [9, 69.129]
  - - [4096, 1024, 1, 14336]
    - [51, 74.286]
  - - [4096, 512, 1, 9216]
    - [13, 72.192]
  - - [2048, 1024, 1, 2048]
    - [51, 77.507]
  - - [4096, 512, 1, 1536]
    - [51, 77.403]
  - - [2048, 1024, 1, 16384]
    - [32, 71.105]
  - - [4096, 1024, 1, 1024]
    - [13, 75.287]
  - - [4096, 1024, 1, 1664]
    - [26, 78.454]
  - - [4096, 512, 1, 384]
    - [7, 71.691]
  - - [4096, 512, 1, 3328]
    - [15, 78.901]
  - - [4096, 1024, 1, 256]
    - [13, 73.203]
  - - [2048, 1024, 1, 7168]
    - [15, 79.618]
  - - [2048, 1024, 1, 1536]
    - [32, 77.629]
  - - [4096, 512, 1, 7168]
    - [15, 79.298]
  - - [4096, 1024, 1, 896]
    - [26, 76.866]
  - - [4096, 1024, 1, 4096]
    - [15, 77.11]
  - - [2048, 1024, 1, 6144]
    - [15, 79.515]
  - - [4096, 512, 1, 4160]
    - [7, 79.519]
  - - [4096, 512, 1, 2080]
    - [24, 78.68]
  - - [4096, 1024, 1, 5120]
    - [15, 77.358]
  - - [2048, 1024, 1, 1920]
    - [43, 78.554]
  - - [2048, 1024, 1, 15360]
    - [13, 69.408]
  - - [4096, 1024, 1, 2816]
    - [13, 77.06]
  - - [4096, 512, 1, 256]
    - [30, 67.545]
  - - [2048, 1024, 1, 5120]
    - [15, 79.312]
  - - [2048, 1024, 1, 4096]
    - [15, 79.145]
  - - [4096, 512, 1, 4608]
    - [51, 79.262]
  - - [4096, 512, 1, 1664]
    - [24, 78.143]
  - - [2048, 1024, 1, 896]
    - [24, 77.029]
  - - [4096, 1024, 1, 4160]
    - [37, 80.412]
  - - [2048, 1024, 1, 11264]
    - [51, 79.406]
  - - [2048, 1024, 1, 384]
    - [9, 69.819]
  - - [2048, 1024, 1, 3840]
    - [43, 79.447]
  - - [4096, 512, 1, 1280]
    - [43, 77.119]
  - - [4096, 1024, 1, 1152]
    - [26, 77.917]
  - - [2048, 1024, 1, 1408]
    - [24, 78.22]
  - - [4096, 512, 1, 896]
    - [43, 76.641]
  - - [4096, 1024, 1, 3072]
    - [13, 77.29]
  - - [2048, 1024, 1, 2816]
    - [51, 78.901]
  - - [4096, 1024, 1, 1792]
    - [13, 77.011]
  - - [4096, 512, 1, 1152]
    - [24, 77.227]
  - - [4096, 512, 1, 7680]
    - [51, 79.474]
  - - [4096, 1024, 1, 384]
    - [26, 74.804]
  - - [2048, 1024, 1, 1792]
    - [51, 78.143]
  - - [4096, 1024, 1, 3584]
    - [13, 77.43]
  - - [2048, 1024, 1, 768]
    - [32, 76.09]
  - - [2048, 1024, 1, 8320]
    - [24, 79.921]
  - - [4096, 512, 1, 2048]
    - [15, 78.035]
  - - [4096, 512, 1, 2560]
    - [51, 78.504]
  - - [4096, 1024, 1, 2304]
    - [43, 77.295]
  - - [4096, 512, 1, 5120]
    - [15, 79.294]
  - - [4096, 1024, 1, 6144]
    - [13, 77.254]
  - - [1024, 3392, 1, 4096]
    - [31, 76.135]
  - - [1024, 3301, 1, 4096]
    - [32, 85.303]
  - - [1024, 3443, 1, 4096]
    - [31, 75.107]
  - - [132, 134, 480, 64]
    - [36, 28.284]
  - - [162, 162, 400, 64]
    - [0, 39.532]
  - - [4096, 3548, 1, 1024]
    - [13, 86.323]
  - - [4096, 2977, 1, 1024]
    - [15, 83.485]
  - - [132, 135, 480, 64]
    - [36, 28.469]
  - - [1024, 2985, 1, 4096]
    - [15, 77.448]
  - - [33708, 3681, 1, 1024]
    - [49, 88.308]
  - - [4096, 3443, 1, 1024]
    - [13, 87.13]
  - - [1024, 3400, 1, 4096]
    - [13, 78.734]
  - - [4096, 3995, 1, 1024]
    - [13, 84.726]
  - - [4096, 3190, 1, 1024]
    - [13, 84.987]
  - - [4096, 3594, 1, 1024]
    - [13, 84.586]
  - - [159, 162, 400, 64]
    - [0, 39.216]
  - - [1024, 3565, 1, 4096]
    - [30, 70.288]
  - - [4096, 3422, 1, 1024]
    - [13, 86.291]
  - - [1024, 3214, 1, 4096]
    - [51, 83.11]
  - - [33708, 3584, 1, 1024]
    - [51, 89.562]
  - - [33708, 3640, 1, 1024]
    - [49, 87.365]
  - - [4096, 3263, 1, 1024]
    - [15, 83.905]
  - - [4096, 3296, 1, 1024]
    - [15, 85.123]
  - - [1024, 3557, 1, 4096]
    - [13, 75.373]
  - - [4096, 3463, 1, 1024]
    - [13, 84.265]
  - - [4096, 3528, 1, 1024]
    - [13, 86.057]
  - - [4096, 3226, 1, 1024]
    - [15, 83.205]
  - - [4096, 3439, 1, 1024]
    - [13, 87.216]
  - - [1024, 3523, 1, 4096]
    - [13, 72.878]
  - - [1024, 3098, 1, 4096]
    - [51, 80.399]
  - - [4096, 3121, 1, 1024]
    - [13, 82.772]
  - - [33708, 3894, 1, 1024]
    - [49, 87.225]
  - - [1024, 3548, 1, 4096]
    - [13, 72.436]
  - - [1024, 3451, 1, 4096]
    - [30, 73.121]
  - - [4096, 3353, 1, 1024]
    - [13, 84.441]
  - - [4096, 3402, 1, 1024]
    - [13, 86.323]
  - - [4096, 3939, 1, 1024]
    - [13, 86.264]
  - - [133, 133, 480, 64]
    - [17, 28.239]
  - - [1024, 3559, 1, 4096]
    - [13, 75.856]
  - - [1024, 2977, 1, 4096]
    - [32, 77.335]
  - - [1024, 3478, 1, 4096]
    - [30, 74.516]
  - - [134, 134, 480, 64]
    - [17, 28.758]
  - - [1024, 3368, 1, 4096]
    - [31, 75.662]
  - - [4096, 4012, 1, 1024]
    - [13, 85.118]
  - - [4096, 3486, 1, 1024]
    - [13, 85.154]
  - - [1024, 3479, 1, 4096]
    - [30, 71.7]
  - - [1024, 3505, 1, 4096]
    - [13, 73.559]
  - - [4096, 3381, 1, 1024]
    - [13, 85.515]
  - - [4096, 3430, 1, 1024]
    - [13, 87.013]
  - - [1024, 3554, 1, 4096]
    - [30, 70.013]
  - - [4096, 3271, 1, 1024]
    - [15, 84.356]
  - - [1024, 3063, 1, 4096]
    - [15, 79.384]
  - - [1024, 3209, 1, 4096]
    - [32, 83.165]
  - - [4096, 3503, 1, 1024]
    - [13, 85.303]
  - - [4096, 3344, 1, 1024]
    - [13, 84.55]
  - - [1024, 3147, 1, 4096]
    - [15, 81.536]
  - - [1024, 3322, 1, 4096]
    - [32, 85.822]
  - - [1024, 3341, 1, 4096]
    - [31, 74.43]
  - - [1024, 3516, 1, 4096]
    - [13, 67.414]
  - - [1024, 3454, 1, 4096]
    - [31, 77.277]
  - - [4096, 3969, 1, 1024]
    - [13, 84.238]
  - - [4096, 3466, 1, 1024]
    - [13, 84.721]
  - - [1024, 3999, 1, 1024]
    - [32, 75.955]
  - - [1024, 4032, 1, 1024]
    - [32, 76.704]
  - - [1024, 3403, 1, 4096]
    - [30, 81.062]
  - - [4096, 3361, 1, 1024]
    - [13, 85.393]
  - - [1024, 3527, 1, 4096]
    - [13, 75.332]
  - - [1024, 3822, 1, 4096]
    - [13, 78.075]
  - - [4096, 3315, 1, 1024]
    - [15, 85.511]
  - - [232, 232, 272, 64]
    - [42, 47.585]
  - - [1024, 3336, 1, 4096]
    - [13, 77.665]
  - - [228, 232, 272, 64]
    - [6, 45.207]
  - - [4096, 3547, 1, 1024]
    - [13, 86.562]
  - - [4096, 3340, 1, 1024]
    - [13, 84.92]
  - - [1024, 3906, 1, 1024]
    - [30, 81.234]
  - - [1024, 3295, 1, 4096]
    - [15, 85.109]
  - - [4096, 3294, 1, 1024]
    - [15, 84.807]
  - - [33708, 3968, 1, 1024]
    - [49, 89.021]
  - - [1024, 3473, 1, 4096]
    - [13, 72.151]
  - - [1024, 3072, 1, 4096]
    - [15, 80.052]
  - - [4096, 3189, 1, 1024]
    - [13, 84.771]
  - - [4096, 3494, 1, 1024]
    - [13, 85.1]
  - - [1024, 3522, 1, 4096]
    - [30, 75.436]
  - - [33708, 3944, 1, 1024]
    - [49, 88.371]
  - - [135, 135, 480, 64]
    - [45, 28.848]
  - - [4096, 3421, 1, 1024]
    - [13, 86.914]
  - - [4096, 3311, 1, 1024]
    - [15, 85.461]
  - - [1024, 3990, 1, 1024]
    - [32, 75.856]
  - - [1024, 3290, 1, 4096]
    - [51, 84.978]
  - - [4096, 3565, 1, 1024]
    - [13, 86.724]
  - - [1024, 3484, 1, 4096]
    - [13, 72.697]
  - - [4096, 3384, 1, 1024]
    - [13, 85.673]
  - - [1024, 3422, 1, 4096]
    - [13, 77.94]
  - - [4096, 3681, 1, 1024]
    - [13, 86.418]
  - - [1024, 3584, 1, 1024]
    - [30, 75.756]
  - - [4096, 4050, 1, 1024]
    - [13, 85.741]
  - - [1024, 3996, 1, 4096]
    - [32, 78.378]
  - - [4096, 3169, 1, 1024]
    - [13, 84.202]
  - - [4096, 3538, 1, 1024]
    - [13, 86.323]
  - - [1024, 3495, 1, 4096]
    - [13, 68.975]
  - - [4096, 3401, 1, 1024]
    - [13, 86.106]
  - - [1024, 3560, 1, 4096]
    - [13, 76.162]
  - - [133, 135, 480, 64]
    - [17, 28.564]
  - - [1024, 3263, 1, 4096]
    - [51, 84.45]
  - - [1024, 3870, 1, 4096]
    - [13, 79.749]
  - - [4096, 3555, 1, 1024]
    - [13, 86.756]
  - - [4096, 3412, 1, 1024]
    - [13, 86.729]
  - - [1024, 3296, 1, 4096]
    - [51, 85.168]
  - - [1024, 3379, 1, 4096]
    - [31, 75.12]
  - - [4096, 3302, 1, 1024]
    - [15, 85.032]
  - - [1024, 3490, 1, 4096]
    - [13, 72.03]
  - - [1024, 3428, 1, 4096]
    - [13, 76.469]
  - - [1024, 3976, 1, 4096]
    - [32, 78.202]
  - - [4096, 3485, 1, 1024]
    - [13, 84.902]
  - - [4096, 3534, 1, 1024]
    - [13, 86.246]
  - - [1024, 3064, 1, 4096]
    - [32, 79.366]
  - - [4096, 3216, 1, 1024]
    - [15, 83.029]
  - - [1024, 3450, 1, 4096]
    - [14, 76.478]
  - - [1024, 3533, 1, 4096]
    - [13, 71.213]
  - - [1024, 4030, 1, 1024]
    - [32, 76.591]
  - - [1024, 3311, 1, 4096]
    - [15, 85.565]
  - - [1024, 3468, 1, 4096]
    - [30, 69.909]
  - - [4096, 3359, 1, 1024]
    - [13, 85.127]
  - - [4096, 3392, 1, 1024]
    - [13, 86.102]
  - - [1024, 3925, 1, 1024]
    - [30, 81.734]
  - - [4096, 3233, 1, 1024]
    - [15, 83.354]
  - - [4096, 3956, 1, 1024]
    - [13, 86.679]
  - - [1024, 3463, 1, 4096]
    - [30, 74.34]
  - - [1024, 3126, 1, 4096]
    - [32, 81.143]
  - - [1024, 3363, 1, 4096]
    - [30, 81.337]
  - - [4096, 3465, 1, 1024]
    - [13, 84.432]
  - - [33708, 3996, 1, 1024]
    - [51, 88.024]
  - - [1024, 3231, 1, 4096]
    - [51, 83.196]
  - - [33708, 3978, 1, 1024]
    - [51, 87.275]
  - - [4096, 3476, 1, 1024]
    - [13, 84.563]
  - - [4096, 3339, 1, 1024]
    - [13, 84.563]
  - - [4096, 3452, 1, 1024]
    - [13, 87.532]
  - - [1024, 3396, 1, 4096]
    - [13, 81.707]
  - - [4096, 3293, 1, 1024]
    - [15, 84.581]
  - - [1024, 3432, 1, 4096]
    - [13, 79.316]
  - - [4096, 3493, 1, 1024]
    - [13, 85.254]
  - - [4096, 3350, 1, 1024]
    - [13, 85.105]
  - - [1024, 3079, 1, 4096]
    - [51, 79.867]
  - - [1024, 3101, 1, 4096]
    - [32, 80.516]
  - - [33708, 3939, 1, 1024]
    - [49, 88.213]
  - - [4096, 3256, 1, 1024]
    - [15, 83.643]
  - - [1024, 3439, 1, 4096]
    - [13, 76.474]
  - - [1024, 3510, 1, 4096]
    - [13, 71.123]
  - - [4096, 3900, 1, 1024]
    - [13, 85.217]
  - - [1024, 3470, 1, 4096]
    - [30, 69.228]
  - - [4096, 3456, 1, 1024]
    - [13, 87.478]
  - - [4096, 3014, 1, 1024]
    - [15, 84.455]
  - - [4096, 3367, 1, 1024]
    - [13, 85.393]
  - - [4096, 3432, 1, 1024]
    - [13, 86.837]
  - - [33708, 4026, 1, 1024]
    - [51, 88.231]
  - - [4096, 3273, 1, 1024]
    - [15, 83.963]
  - - [4096, 3130, 1, 1024]
    - [13, 83.282]
  - - [1024, 3496, 1, 4096]
    - [13, 73.713]
  - - [1024, 3995, 1, 4096]
    - [32, 78.563]
  - - [1024, 3939, 1, 4096]
    - [13, 78.585]
  - - [1024, 3121, 1, 4096]
    - [32, 80.927]
  - - [1024, 3232, 1, 4096]
    - [15, 83.688]
  - - [4096, 3147, 1, 1024]
    - [13, 83.76]
  - - [4096, 3516, 1, 1024]
    - [13, 85.745]
  - - [1024, 3969, 1, 1024]
    - [32, 75.174]
  - - [1024, 3364, 1, 4096]
    - [31, 74.705]
  - - [4096, 3411, 1, 1024]
    - [13, 86.35]
  - - [147, 147, 432, 64]
    - [0, 33.888]
  - - [4096, 3301, 1, 1024]
    - [15, 84.897]
  - - [1024, 3513, 1, 4096]
    - [30, 71.303]
  - - [1024, 3469, 1, 4096]
    - [13, 71.574]
  - - [1024, 3095, 1, 4096]
    - [15, 80.268]
  - - [4096, 3533, 1, 1024]
    - [13, 85.633]
  - - [4096, 3390, 1, 1024]
    - [13, 85.881]
  - - [4096, 3582, 1, 1024]
    - [13, 87.622]
  - - [1024, 3956, 1, 1024]
    - [30, 82.267]
  - - [4096, 3585, 1, 1024]
    - [13, 84.45]
  - - [4096, 3231, 1, 1024]
    - [15, 83.201]
  - - [1024, 3205, 1, 4096]
    - [15, 82.957]
  - - [4096, 3496, 1, 1024]
    - [13, 85.163]
  - - [1024, 3143, 1, 4096]
    - [15, 81.464]
  - - [1024, 3318, 1, 4096]
    - [32, 85.786]
  - - [1024, 3353, 1, 4096]
    - [13, 79.88]
  - - [1024, 3464, 1, 4096]
    - [30, 72.102]
  - - [4096, 2736, 1, 1024]
    - [15, 84.216]
  - - [1024, 3402, 1, 4096]
    - [13, 81.888]
  - - [4096, 3138, 1, 1024]
    - [13, 83.738]
  - - [1024, 3860, 1, 4096]
    - [32, 75.914]
  - - [148, 148, 432, 64]
    - [0, 34.258]
  - - [1024, 3539, 1, 4096]
    - [13, 73.049]
  - - [4096, 3211, 1, 1024]
    - [15, 82.759]
  - - [1024, 3332, 1, 4096]
    - [13, 76.663]
  - - [1024, 3466, 1, 4096]
    - [13, 71.682]
  - - [4096, 3475, 1, 1024]
    - [13, 84.518]
  - - [4096, 3524, 1, 1024]
    - [13, 85.763]
  - - [4096, 2985, 1, 1024]
    - [15, 83.512]
  - - [4096, 3222, 1, 1024]
    - [15, 83.088]
  - - [4096, 3451, 1, 1024]
    - [13, 87.324]
  - - [1024, 3181, 1, 4096]
    - [32, 82.325]
  - - [1024, 3640, 1, 4096]
    - [13, 75.702]
  - - [1024, 3375, 1, 4096]
    - [30, 82.916]
  - - [1024, 3550, 1, 4096]
    - [13, 75.95]
  - - [1024, 4020, 1, 1024]
    - [15, 76.126]
  - - [4096, 3349, 1, 1024]
    - [13, 84.947]
  - - [4096, 3398, 1, 1024]
    - [13, 86.345]
  - - [33708, 3976, 1, 1024]
    - [51, 87.279]
  - - [1024, 2917, 1, 4096]
    - [32, 75.553]
  - - [33708, 3910, 1, 1024]
    - [49, 87.667]
  - - [4096, 3860, 1, 1024]
    - [13, 84.238]
  - - [4096, 3304, 1, 1024]
    - [15, 84.987]
  - - [1024, 3286, 1, 4096]
    - [51, 85.154]
  - - [1024, 3460, 1, 4096]
    - [13, 73.762]
  - - [1024, 4026, 1, 4096]
    - [32, 79.235]
  - - [4096, 3471, 1, 1024]
    - [13, 84.572]
  - - [193, 193, 320, 64]
    - [37, 38.846]
  - - [1024, 3894, 1, 1024]
    - [30, 80.999]
  - - [1024, 3506, 1, 4096]
    - [13, 74.886]
  - - [1024, 4000, 1, 1024]
    - [32, 75.955]
  - - [1024, 3900, 1, 4096]
    - [13, 81.27]
  - - [1024, 3445, 1, 4096]
    - [13, 83.368]
  - - [4096, 3442, 1, 1024]
    - [13, 87.221]
  - - [1024, 3358, 1, 4096]
    - [30, 73.32]
  - - [1024, 3211, 1, 4096]
    - [32, 83.277]
  - - [4096, 3515, 1, 1024]
    - [13, 85.538]
  - - [1024, 3564, 1, 4096]
    - [30, 71.394]
  - - [4096, 3057, 1, 1024]
    - [15, 85.623]
  - - [1024, 3343, 1, 4096]
    - [13, 80.516]
  - - [4096, 3262, 1, 1024]
    - [15, 84.071]
  - - [1024, 3518, 1, 4096]
    - [13, 71.001]
  - - [33708, 3876, 1, 1024]
    - [49, 86.905]
  - - [4096, 3462, 1, 1024]
    - [13, 84.459]
  - - [1024, 3265, 1, 4096]
    - [51, 84.563]
  - - [4096, 3389, 1, 1024]
    - [13, 85.47]
  - - [4096, 3438, 1, 1024]
    - [13, 87.248]
  - - [1024, 3955, 1, 1024]
    - [30, 82.289]
  - - [1024, 3545, 1, 4096]
    - [13, 72.643]
  - - [1024, 3144, 1, 4096]
    - [15, 81.473]
  - - [1024, 3417, 1, 4096]
    - [13, 82.763]
  - - [4096, 3543, 1, 1024]
    - [13, 86.639]
  - - [4096, 3352, 1, 1024]
    - [13, 84.996]
  - - [33708, 3975, 1, 1024]
    - [32, 87.207]
  - - [148, 147, 432, 64]
    - [36, 33.888]
  - - [4096, 3137, 1, 1024]
    - [13, 83.413]
  - - [4096, 3506, 1, 1024]
    - [13, 85.276]
  - - [1024, 3975, 1, 1024]
    - [32, 75.711]
  - - [1024, 3859, 1, 4096]
    - [32, 75.82]
  - - [4096, 3369, 1, 1024]
    - [13, 85.168]
  - - [1024, 3434, 1, 4096]
    - [31, 77.205]
  - - [1024, 3292, 1, 4096]
    - [15, 85.001]
  - - [4096, 3523, 1, 1024]
    - [13, 85.484]
  - - [4096, 3380, 1, 1024]
    - [13, 85.926]
  - - [1024, 3408, 1, 4096]
    - [30, 82.208]
  - - [4096, 3221, 1, 1024]
    - [15, 83.07]
  - - [4096, 3270, 1, 1024]
    - [15, 84.414]
  - - [143, 143, 432, 64]
    - [0, 32.254]
  - - [1024, 3303, 1, 4096]
    - [32, 85.457]
  - - [4096, 3502, 1, 1024]
    - [13, 85.402]
  - - [1024, 3222, 1, 4096]
    - [51, 83.309]
  - - [4096, 2505, 1, 1024]
    - [15, 85.551]
  - - [4096, 3397, 1, 1024]
    - [13, 86.102]
  - - [4096, 3562, 1, 1024]
    - [13, 86.688]
  - - [4096, 3095, 1, 1024]
    - [13, 82.506]
  - - [1024, 3226, 1, 4096]
    - [32, 83.485]
  - - [177, 177, 352, 64]
    - [17, 42.04]
  - - [4096, 3360, 1, 1024]
    - [13, 85.294]
  - - [1024, 3942, 1, 1024]
    - [30, 81.897]
  - - [1024, 3298, 1, 4096]
    - [51, 85.127]
  - - [1024, 3381, 1, 4096]
    - [13, 76.726]
  - - [4096, 3314, 1, 1024]
    - [15, 85.466]
  - - [1024, 3492, 1, 4096]
    - [13, 69.377]
  - - [1024, 3430, 1, 4096]
    - [31, 76.902]
  - - [4096, 3977, 1, 1024]
    - [13, 83.914]
  - - [4096, 3546, 1, 1024]
    - [13, 86.327]
  - - [4096, 3640, 1, 1024]
    - [13, 85.601]
  - - [4096, 3441, 1, 1024]
    - [13, 87.031]
  - - [33708, 4059, 1, 1024]
    - [32, 88.994]
  - - [1024, 3978, 1, 1024]
    - [32, 74.872]
  - - [1024, 3376, 1, 4096]
    - [13, 76.37]
  - - [1024, 3482, 1, 4096]
    - [13, 71.926]
  - - [1024, 3563, 1, 4096]
    - [30, 74.042]
  - - [4096, 4020, 1, 1024]
    - [13, 84.902]
  - - [1024, 3271, 1, 4096]
    - [51, 84.608]
  - - [1024, 3291, 1, 4096]
    - [32, 85.15]
  - - [1024, 3431, 1, 4096]
    - [14, 76.158]
  - - [1024, 3481, 1, 4096]
    - [13, 73.722]
  - - [4096, 3461, 1, 1024]
    - [13, 83.877]
  - - [1024, 3574, 1, 4096]
    - [49, 70.081]
  - - [1024, 4059, 1, 1024]
    - [32, 76.794]
  - - [1024, 3421, 1, 4096]
    - [13, 75.995]
  - - [4096, 3224, 1, 1024]
    - [15, 83.106]
  - - [4096, 3437, 1, 1024]
    - [13, 87.099]
  - - [4096, 3168, 1, 1024]
    - [13, 84.378]
  - - [33708, 3990, 1, 1024]
    - [51, 87.672]
  - - [1024, 3349, 1, 4096]
    - [30, 75.585]
  - - [4096, 3335, 1, 1024]
    - [13, 84.699]
  - - [4096, 3400, 1, 1024]
    - [13, 86.4]
  - - [160, 159, 400, 64]
    - [17, 39.694]
  - - [1024, 3398, 1, 4096]
    - [14, 76.614]
  - - [1024, 3780, 1, 4096]
    - [30, 76.875]
  - - [4096, 3098, 1, 1024]
    - [13, 82.47]
  - - [1024, 4012, 1, 4096]
    - [15, 78.761]
  - - [4096, 3505, 1, 1024]
    - [13, 85.362]
  - - [4096, 3554, 1, 1024]
    - [13, 86.661]
  - - [4096, 3063, 1, 1024]
    - [15, 85.953]
  - - [1024, 3503, 1, 4096]
    - [13, 70.915]
  - - [1024, 3166, 1, 4096]
    - [32, 82.113]
  - - [1024, 3425, 1, 4096]
    - [31, 76.911]
  - - [1024, 3344, 1, 4096]
    - [49, 73.072]
  - - [4096, 3484, 1, 1024]
    - [13, 84.712]
  - - [1024, 3681, 1, 1024]
    - [30, 76.722]
  - - [1024, 4050, 1, 1024]
    - [32, 76.74]
  - - [4096, 3379, 1, 1024]
    - [13, 85.538]
  - - [4096, 3428, 1, 1024]
    - [13, 86.932]
  - - [1024, 3304, 1, 4096]
    - [32, 85.362]
  - - [1024, 3387, 1, 4096]
    - [30, 79.262]
  - - [4096, 3126, 1, 1024]
    - [13, 83.413]
  - - [1024, 3498, 1, 4096]
    - [30, 74.809]
  - - [1024, 3436, 1, 4096]
    - [13, 82.596]
  - - [4096, 3501, 1, 1024]
    - [13, 85.452]
  - - [4096, 3358, 1, 1024]
    - [13, 85.402]
  - - [4096, 3232, 1, 1024]
    - [15, 83.449]
  - - [1024, 3585, 1, 4096]
    - [13, 76.253]
  - - [4096, 3143, 1, 1024]
    - [13, 83.724]
  - - [4096, 3464, 1, 1024]
    - [13, 84.473]
  - - [1024, 3366, 1, 4096]
    - [13, 76.889]
  - - [4096, 3375, 1, 1024]
    - [13, 85.655]
  - - [4096, 2917, 1, 1024]
    - [13, 84.856]
  - - [4096, 4026, 1, 1024]
    - [13, 85.416]
  - - [1024, 3277, 1, 4096]
    - [51, 84.685]
  - - [1024, 3103, 1, 4096]
    - [15, 80.561]
  - - [33708, 3995, 1, 1024]
    - [32, 87.676]
  - - [1024, 3297, 1, 4096]
    - [32, 84.604]
  - - [4096, 3545, 1, 1024]
    - [13, 86.467]
  - - [1024, 3399, 1, 4096]
    - [30, 83.607]
  - - [33708, 3796, 1, 1024]
    - [51, 88.592]
  - - [4096, 3292, 1, 1024]
    - [15, 84.545]
  - - [33708, 3859, 1, 1024]
    - [49, 86.625]
  - - [4096, 3566, 1, 1024]
    - [13, 86.648]
  - - [4096, 3894, 1, 1024]
    - [13, 85.163]
  - - [4096, 3492, 1, 1024]
    - [13, 85.087]
  - - [1024, 3977, 1, 1024]
    - [32, 75.874]
  - - [1024, 3272, 1, 4096]
    - [32, 84.45]
  - - [135, 134, 480, 64]
    - [17, 28.699]
  - - [1024, 3355, 1, 4096]
    - [13, 74.272]
  - - [4096, 3419, 1, 1024]
    - [13, 86.39]
  - - [1024, 3404, 1, 4096]
    - [30, 79.37]
  - - [4096, 3999, 1, 1024]
    - [13, 84.608]
  - - [4096, 3166, 1, 1024]
    - [13, 84.523]
  - - [33708, 3840, 1, 1024]
    - [51, 89.792]
  - - [4096, 4032, 1, 1024]
    - [13, 85.339]
  - - [1024, 3573, 1, 4096]
    - [30, 73.591]
  - - [4096, 3366, 1, 1024]
    - [13, 85.181]
  - - [1024, 3541, 1, 4096]
    - [13, 74.299]
  - - [4096, 3207, 1, 1024]
    - [15, 82.497]
  - - [4096, 3272, 1, 1024]
    - [15, 84.491]
  - - [1024, 3334, 1, 4096]
    - [13, 74.8]
  - - [228, 228, 272, 64]
    - [4, 46.06]
  - - [4096, 3183, 1, 1024]
    - [13, 84.703]
  - - [4096, 3536, 1, 1024]
    - [13, 85.799]
  - - [1024, 4005, 1, 1024]
    - [32, 76.027]
  - - [1024, 3245, 1, 4096]
    - [15, 83.868]
  - - [4096, 3447, 1, 1024]
    - [13, 86.927]
  - - [1024, 3183, 1, 4096]
    - [32, 82.312]
  - - [1024, 3361, 1, 4096]
    - [49, 72.747]
  - - [33708, 3870, 1, 1024]
    - [30, 86.63]
  - - [1024, 3321, 1, 4096]
    - [15, 85.384]
  - - [1024, 3486, 1, 4096]
    - [30, 74.507]
  - - [4096, 4005, 1, 1024]
    - [13, 84.969]
  - - [4096, 3410, 1, 1024]
    - [13, 86.332]
  - - [1024, 3944, 1, 1024]
    - [30, 82.213]
  - - [4096, 3300, 1, 1024]
    - [15, 85.231]
  - - [4096, 3579, 1, 1024]
    - [13, 87.117]
  - - [4096, 3483, 1, 1024]
    - [13, 84.996]
  - - [4096, 3532, 1, 1024]
    - [13, 85.885]
  - - [1024, 3140, 1, 4096]
    - [15, 81.337]
  - - [1024, 3372, 1, 4096]
    - [13, 77.421]
  - - [1024, 3224, 1, 4096]
    - [32, 83.535]
  - - [4096, 3230, 1, 1024]
    - [15, 83.413]
  - - [4096, 3427, 1, 1024]
    - [13, 86.747]
  - - [1024, 3796, 1, 1024]
    - [30, 79.072]
  - - [143, 148, 432, 64]
    - [17, 33.098]
  - - [1024, 3616, 1, 4096]
    - [13, 73.812]
  - - [1024, 3315, 1, 4096]
    - [32, 85.651]
  - - [1024, 3476, 1, 4096]
    - [49, 71.055]
  - - [1024, 3509, 1, 4096]
    - [13, 75.116]
  - - [4096, 3357, 1, 1024]
    - [13, 85.195]
  - - [4096, 3406, 1, 1024]
    - [13, 86.679]
  - - [1024, 3558, 1, 4096]
    - [13, 75.959]
  - - [4096, 3593, 1, 1024]
    - [13, 84.459]
  - - [4096, 3247, 1, 1024]
    - [15, 83.855]
  - - [4096, 3088, 1, 1024]
    - [13, 82.389]
  - - [1024, 3213, 1, 4096]
    - [32, 83.183]
  - - [4096, 3511, 1, 1024]
    - [13, 85.605]
  - - [1024, 3365, 1, 4096]
    - [13, 75.838]
  - - [1024, 3504, 1, 4096]
    - [30, 71.448]
  - - [1024, 3442, 1, 4096]
    - [13, 84.284]
  - - [4096, 3474, 1, 1024]
    - [13, 84.577]
  - - [4096, 2984, 1, 1024]
    - [15, 83.683]
  - - [1024, 3876, 1, 4096]
    - [32, 76.235]
  - - [4096, 3337, 1, 1024]
    - [13, 84.302]
  - - [4096, 3450, 1, 1024]
    - [13, 87.23]
  - - [1024, 3547, 1, 4096]
    - [13, 71.777]
  - - [4096, 3291, 1, 1024]
    - [15, 84.649]
  - - [1024, 3340, 1, 4096]
    - [30, 73.843]
  - - [4096, 3491, 1, 1024]
    - [13, 84.983]
  - - [4096, 3348, 1, 1024]
    - [13, 84.911]
  - - [4096, 3906, 1, 1024]
    - [13, 85.439]
  - - [1024, 3477, 1, 4096]
    - [49, 71.213]
  - - [1024, 3397, 1, 4096]
    - [13, 83.151]
  - - [4096, 3165, 1, 1024]
    - [13, 83.972]
  - - [4096, 3470, 1, 1024]
    - [13, 84.726]
  - - [1024, 3526, 1, 4096]
    - [30, 72.824]
  - - [4096, 3365, 1, 1024]
    - [13, 85.362]
  - - [4096, 3319, 1, 1024]
    - [15, 85.511]
  - - [1024, 3401, 1, 4096]
    - [30, 83.638]
  - - [1024, 3294, 1, 4096]
    - [15, 85.159]
  - - [159, 159, 400, 64]
    - [0, 38.778]
  - - [1024, 3472, 1, 4096]
    - [13, 70.775]
  - - [4096, 3328, 1, 1024]
    - [15, 85.984]
  - - [1024, 3861, 1, 1024]
    - [30, 79.763]
  - - [1024, 3910, 1, 1024]
    - [30, 81.423]
  - - [1024, 3410, 1, 4096]
    - [31, 76.469]
  - - [1024, 3395, 1, 4096]
    - [13, 79.366]
  - - [4096, 3282, 1, 1024]
    - [15, 84.496]
  - - [1024, 3751, 1, 1024]
    - [49, 78.12]
  - - [4096, 3145, 1, 1024]
    - [13, 83.512]
  - - [4096, 3514, 1, 1024]
    - [13, 85.529]
  - - [4096, 3944, 1, 1024]
    - [13, 86.386]
  - - [1024, 3515, 1, 4096]
    - [13, 70.694]
  - - [4096, 3409, 1, 1024]
    - [13, 86.052]
  - - [4096, 3564, 1, 1024]
    - [13, 86.819]
  - - [4096, 3299, 1, 1024]
    - [15, 85.028]
  - - [1024, 3057, 1, 4096]
    - [51, 79.14]
  - - [4096, 3531, 1, 1024]
    - [13, 85.795]
  - - [4096, 3388, 1, 1024]
    - [13, 85.998]
  - - [1024, 3189, 1, 4096]
    - [32, 82.637]
  - - [1024, 3300, 1, 4096]
    - [15, 85.33]
  - - [1024, 3720, 1, 4096]
    - [13, 79.438]
  - - [1024, 3383, 1, 4096]
    - [30, 77.15]
  - - [1024, 3494, 1, 4096]
    - [30, 73.776]
  - - [1024, 3448, 1, 4096]
    - [13, 84.193]
  - - [4096, 3542, 1, 1024]
    - [13, 86.341]
  - - [1024, 3488, 1, 4096]
    - [13, 74.114]
  - - [4096, 3405, 1, 1024]
    - [13, 86.219]
  - - [1024, 3262, 1, 4096]
    - [51, 84.396]
  - - [33708, 4005, 1, 1024]
    - [51, 87.965]
  - - [1024, 3594, 1, 4096]
    - [30, 71.123]
  - - [4096, 3103, 1, 1024]
    - [13, 82.362]
  - - [4096, 3136, 1, 1024]
    - [13, 83.498]
  - - [1024, 3378, 1, 4096]
    - [31, 75.314]
  - - [4096, 3559, 1, 1024]
    - [13, 86.702]
  - - [4096, 3368, 1, 1024]
    - [13, 85.479]
  - - [4096, 3209, 1, 1024]
    - [15, 82.795]
  - - [4096, 3322, 1, 1024]
    - [15, 85.7]
  - - [1024, 3483, 1, 4096]
    - [13, 73.424]
  - - [4096, 3473, 1, 1024]
    - [13, 84.509]
  - - [4096, 3522, 1, 1024]
    - [13, 85.845]
  - - [1024, 3532, 1, 4096]
    - [30, 72.788]
  - - [4096, 3449, 1, 1024]
    - [13, 87.37]
  - - [1024, 3351, 1, 4096]
    - [31, 74.443]
  - - [1024, 3462, 1, 4096]
    - [13, 72.991]
  - - [4096, 3396, 1, 1024]
    - [13, 86.187]
  - - [132, 132, 480, 64]
    - [0, 27.756]
  - - [1024, 3416, 1, 4096]
    - [13, 78.251]
  - - [4096, 3469, 1, 1024]
    - [13, 84.419]
  - - [1024, 3582, 1, 4096]
    - [13, 74.849]
  - - [1024, 3230, 1, 4096]
    - [32, 83.715]
  - - [1024, 3489, 1, 4096]
    - [30, 71.087]
  - - [1024, 3427, 1, 4096]
    - [14, 76.347]
  - - [1024, 3346, 1, 4096]
    - [13, 73.789]
  - - [33708, 3977, 1, 1024]
    - [51, 87.176]
  - - [4096, 3796, 1, 1024]
    - [13, 85.975]
  - - [4096, 3176, 1, 1024]
    - [13, 84.55]
  - - [4096, 3990, 1, 1024]
    - [13, 84.496]
  - - [1024, 3257, 1, 4096]
    - [51, 84.035]
  - - [4096, 3343, 1, 1024]
    - [13, 84.387]
  - - [4096, 3440, 1, 1024]
    - [13, 87.365]
  - - [33708, 4030, 1, 1024]
    - [32, 88.326]
  - - [1024, 3190, 1, 4096]
    - [51, 82.204]
  - - [1024, 3389, 1, 4096]
    - [30, 75.021]
  - - [1024, 3500, 1, 4096]
    - [13, 72.12]
  - - [1024, 3471, 1, 4096]
    - [30, 68.632]
  - - [1024, 3438, 1, 4096]
    - [13, 80.755]
  - - [4096, 3513, 1, 1024]
    - [13, 85.502]
  - - [1024, 3562, 1, 4096]
    - [13, 72.567]
  - - [4096, 3616, 1, 1024]
    - [13, 84.658]
  - - [4096, 3955, 1, 1024]
    - [13, 86.422]
  - - [1024, 3441, 1, 4096]
    - [30, 84.401]
  - - [1024, 3236, 1, 4096]
    - [32, 83.787]
  - - [1024, 3524, 1, 4096]
    - [30, 75.165]
  - - [4096, 3460, 1, 1024]
    - [13, 84.396]
  - - [1024, 3384, 1, 4096]
    - [30, 79.97]
  - - [4096, 3387, 1, 1024]
    - [13, 86.07]
  - - [4096, 3436, 1, 1024]
    - [13, 87.067]
  - - [4096, 3277, 1, 1024]
    - [15, 84.554]
  - - [1024, 3457, 1, 4096]
    - [13, 73.55]
  - - [1024, 3999, 1, 4096]
    - [32, 78.662]
  - - [1024, 4032, 1, 4096]
    - [32, 79.303]
  - - [4096, 3541, 1, 1024]
    - [13, 86.183]
  - - [4096, 3334, 1, 1024]
    - [13, 84.649]
  - - [1024, 3393, 1, 4096]
    - [31, 76.469]
  - - [1024, 3411, 1, 4096]
    - [31, 76.573]
  - - [1024, 3822, 1, 1024]
    - [30, 79.456]
  - - [1024, 3593, 1, 4096]
    - [32, 70.802]
  - - [33708, 3822, 1, 1024]
    - [51, 89.332]
  - - [4096, 3504, 1, 1024]
    - [13, 85.285]
  - - [1024, 3163, 1, 4096]
    - [51, 81.829]
  - - [1024, 3357, 1, 4096]
    - [13, 81.68]
  - - [1024, 3906, 1, 4096]
    - [32, 77.024]
  - - [4096, 3415, 1, 1024]
    - [13, 86.702]
  - - [1024, 3406, 1, 4096]
    - [30, 82.74]
  - - [4096, 3321, 1, 1024]
    - [15, 85.402]
  - - [4096, 3584, 1, 1024]
    - [13, 87.46]
  - - [1024, 2736, 1, 4096]
    - [13, 74.024]
  - - [1024, 3110, 1, 4096]
    - [15, 80.697]
  - - [33708, 3999, 1, 1024]
    - [51, 87.812]
  - - [1024, 3093, 1, 4096]
    - [51, 79.88]
  - - [4096, 3378, 1, 1024]
    - [13, 85.439]
  - - [1024, 3543, 1, 4096]
    - [13, 73.41]
  - - [33708, 3925, 1, 1024]
    - [49, 87.888]
  - - [1024, 3352, 1, 4096]
    - [14, 73.049]
  - - [4096, 3780, 1, 1024]
    - [13, 85.294]
  - - [1024, 3990, 1, 4096]
    - [32, 78.328]
  - - [4096, 3500, 1, 1024]
    - [13, 85.014]
  - - [4096, 3996, 1, 1024]
    - [13, 84.712]
  - - [1024, 3247, 1, 4096]
    - [15, 83.859]
  - - [4096, 3395, 1, 1024]
    - [13, 86.192]
  - - [1024, 3169, 1, 4096]
    - [15, 82.055]
  - - [1024, 3088, 1, 4096]
    - [15, 80.16]
  - - [1024, 3584, 1, 4096]
    - [30, 71.263]
  - - [4096, 3093, 1, 1024]
    - [13, 82.244]
  - - [1024, 3538, 1, 4096]
    - [30, 71.578]
  - - [1024, 3996, 1, 1024]
    - [32, 76.05]
  - - [1024, 3581, 1, 4096]
    - [13, 74.529]
  - - [4096, 3374, 1, 1024]
    - [13, 85.393]
  - - [33708, 3751, 1, 1024]
    - [51, 87.712]
  - - [4096, 3215, 1, 1024]
    - [15, 82.718]
  - - [4096, 3312, 1, 1024]
    - [15, 85.461]
  - - [4096, 3581, 1, 1024]
    - [13, 87.415]
  - - [4096, 3479, 1, 1024]
    - [13, 85.154]
  - - [4096, 3544, 1, 1024]
    - [13, 86.557]
  - - [1024, 3870, 1, 1024]
    - [30, 80.462]
  - - [1024, 3374, 1, 4096]
    - [14, 76.09]
  - - [1024, 2967, 1, 4096]
    - [15, 77.096]
  - - [4096, 3455, 1, 1024]
    - [13, 87.536]
  - - [4096, 3942, 1, 1024]
    - [13, 86.409]
  - - [1024, 3528, 1, 4096]
    - [13, 73.04]
  - - [4096, 3186, 1, 1024]
    - [13, 84.712]
  - - [1024, 3976, 1, 1024]
    - [32, 75.621]
  - - [1024, 3511, 1, 4096]
    - [13, 71.163]
  - - [4096, 3573, 1, 1024]
    - [13, 86.819]
  - - [4096, 3561, 1, 1024]
    - [13, 86.733]
  - - [4096, 3418, 1, 1024]
    - [13, 86.553]
  - - [33708, 3906, 1, 1024]
    - [49, 87.618]
  - - [4096, 3259, 1, 1024]
    - [15, 83.891]
  - - [4096, 3308, 1, 1024]
    - [15, 85.29]
  - - [1024, 3419, 1, 4096]
    - [13, 80.913]
  - - [1024, 3215, 1, 4096]
    - [15, 83.277]
  - - [1024, 4030, 1, 4096]
    - [32, 79.253]
  - - [4096, 3459, 1, 1024]
    - [13, 84.238]
  - - [1024, 3572, 1, 4096]
    - [30, 73.555]
  - - [1024, 3137, 1, 4096]
    - [51, 81.342]
  - - [1024, 3312, 1, 4096]
    - [32, 85.551]
  - - [1024, 3925, 1, 4096]
    - [30, 80.421]
  - - [1024, 3453, 1, 4096]
    - [13, 81.509]
  - - [4096, 3435, 1, 1024]
    - [13, 86.747]
  - - [1024, 3176, 1, 4096]
    - [32, 82.226]
  - - [1024, 3444, 1, 4096]
    - [13, 78.048]
  - - [4096, 3975, 1, 1024]
    - [13, 84.18]
  - - [4096, 3182, 1, 1024]
    - [13, 84.468]
  - - [1024, 3475, 1, 4096]
    - [13, 71.61]
  - - [33708, 3955, 1, 1024]
    - [49, 88.552]
  - - [4096, 3446, 1, 1024]
    - [13, 87.139]
  - - [1024, 3138, 1, 4096]
    - [51, 81.166]
  - - [1024, 3549, 1, 4096]
    - [13, 75.201]
  - - [4096, 3287, 1, 1024]
    - [15, 84.726]
  - - [1024, 3342, 1, 4096]
    - [13, 79.203]
  - - [4096, 3519, 1, 1024]
    - [13, 85.669]
  - - [4096, 3552, 1, 1024]
    - [13, 86.594]
  - - [4096, 3859, 1, 1024]
    - [13, 84.55]
  - - [33708, 3969, 1, 1024]
    - [51, 87.203]
  - - [1024, 3369, 1, 4096]
    - [31, 74.349]
  - - [4096, 3482, 1, 1024]
    - [13, 84.649]
  - - [1024, 3306, 1, 4096]
    - [32, 85.082]
  - - [1024, 3474, 1, 4096]
    - [30, 70.306]
  - - [4096, 3377, 1, 1024]
    - [13, 85.461]
  - - [4096, 3426, 1, 1024]
    - [13, 86.575]
  - - [4096, 2935, 1, 1024]
    - [13, 84.861]
  - - [4096, 3267, 1, 1024]
    - [15, 84.279]
  - - [1024, 3299, 1, 4096]
    - [51, 85.384]
  - - [1024, 3456, 1, 4096]
    - [13, 84.478]
  - - [1024, 3280, 1, 4096]
    - [32, 84.82]
  - - [1024, 3555, 1, 4096]
    - [13, 75.215]
  - - [4096, 3499, 1, 1024]
    - [13, 85.195]
  - - [4096, 3356, 1, 1024]
    - [13, 85.168]
  - - [1024, 3412, 1, 4096]
    - [14, 76.717]
  - - [1024, 2984, 1, 4096]
    - [32, 77.547]
  - - [4096, 3141, 1, 1024]
    - [13, 83.688]
  - - [4096, 3510, 1, 1024]
    - [13, 85.429]
  - - [1024, 3995, 1, 1024]
    - [32, 75.58]
  - - [1024, 3517, 1, 4096]
    - [13, 74.628]
  - - [1024, 3455, 1, 4096]
    - [13, 80.042]
  - - [1024, 3939, 1, 1024]
    - [30, 82.019]
  - - [1024, 3447, 1, 4096]
    - [31, 77.196]
  - - [1024, 3969, 1, 4096]
    - [15, 77.994]
  - - [4096, 3527, 1, 1024]
    - [13, 85.723]
  - - [4096, 3336, 1, 1024]
    - [13, 84.64]
  - - [1024, 3191, 1, 4096]
    - [32, 82.601]
  - - [1024, 3302, 1, 4096]
    - [15, 85.235]
  - - [1024, 3337, 1, 4096]
    - [31, 75.237]
  - - [4096, 3290, 1, 1024]
    - [15, 84.563]
  - - [1024, 3512, 1, 4096]
    - [13, 72.079]
  - - [1024, 3433, 1, 4096]
    - [31, 74.881]
  - - [4096, 3876, 1, 1024]
    - [13, 84.938]
  - - [4096, 3490, 1, 1024]
    - [13, 85.19]
  - - [4096, 3064, 1, 1024]
    - [15, 85.903]
  - - [1024, 3508, 1, 4096]
    - [13, 73.902]
  - - [1024, 3956, 1, 4096]
    - [13, 80.593]
  - - [4096, 3417, 1, 1024]
    - [13, 86.639]
  - - [1024, 3248, 1, 4096]
    - [51, 84.035]
  - - [1024, 2499, 1, 4096]
    - [13, 70.762]
  - - [1024, 3186, 1, 4096]
    - [51, 82.596]
  - - [1024, 3180, 1, 4096]
    - [15, 82.501]
  - - [4096, 3364, 1, 1024]
    - [13, 84.983]
  - - [4096, 3976, 1, 1024]
    - [13, 84.279]
  - - [4096, 3205, 1, 1024]
    - [15, 82.781]
  - - [4096, 3318, 1, 1024]
    - [15, 85.705]
  - - [1024, 3377, 1, 4096]
    - [31, 74.782]
  - - [1024, 3485, 1, 4096]
    - [49, 69.742]
  - - [4096, 3181, 1, 1024]
    - [13, 84.45]
  - - [4096, 3550, 1, 1024]
    - [13, 86.354]
  - - [1024, 3534, 1, 4096]
    - [30, 69.995]
  - - [1024, 3860, 1, 1024]
    - [30, 80.169]
  - - [160, 160, 400, 64]
    - [36, 40.01]
  - - [4096, 3445, 1, 1024]
    - [13, 87.329]
  - - [1024, 3391, 1, 4096]
    - [13, 75.874]
  - - [1024, 3221, 1, 4096]
    - [15, 83.395]
  - - [4096, 3079, 1, 1024]
    - [13, 81.888]
  - - [4096, 3144, 1, 1024]
    - [13, 83.607]
  - - [1024, 3270, 1, 4096]
    - [32, 84.518]
  - - [1024, 3561, 1, 4096]
    - [13, 73.428]
  - - [1024, 3480, 1, 4096]
    - [13, 73.785]
  - - [4096, 3408, 1, 1024]
    - [13, 86.354]
  - - [1024, 3418, 1, 4096]
    - [30, 79.659]
  - - [4096, 3298, 1, 1024]
    - [15, 84.906]
  - - [1024, 3640, 1, 1024]
    - [49, 76.05]
  - - [1024, 3449, 1, 4096]
    - [31, 77.358]
  - - [1024, 4020, 1, 4096]
    - [32, 79.063]
  - - [4096, 3481, 1, 1024]
    - [13, 84.771]
  - - [4096, 3530, 1, 1024]
    - [13, 86.219]
  - - [1024, 3216, 1, 4096]
    - [32, 83.065]
  - - [1024, 3491, 1, 4096]
    - [30, 72.345]
  - - [1024, 3154, 1, 4096]
    - [51, 81.743]
  - - [4096, 3425, 1, 1024]
    - [13, 86.688]
  - - [1024, 3348, 1, 4096]
    - [13, 75.747]
  - - [1024, 3415, 1, 4096]
    - [13, 77.101]
  - - [1024, 4026, 1, 1024]
    - [32, 76.108]
  - - [1024, 3367, 1, 4096]
    - [13, 77.769]
  - - [1024, 3259, 1, 4096]
    - [32, 84.378]
  - - [1024, 3894, 1, 4096]
    - [13, 78.292]
  - - [4096, 3355, 1, 1024]
    - [13, 84.762]
  - - [4096, 3404, 1, 1024]
    - [13, 86.278]
  - - [1024, 3308, 1, 4096]
    - [15, 85.389]
  - - [4096, 3245, 1, 1024]
    - [15, 83.656]
  - - [1024, 3502, 1, 4096]
    - [13, 74.863]
  - - [33708, 4032, 1, 1024]
    - [51, 88.506]
  - - [1024, 3424, 1, 4096]
    - [13, 77.809]
  - - [4096, 3509, 1, 1024]
    - [13, 85.457]
  - - [4096, 3558, 1, 1024]
    - [13, 86.729]
  - - [1024, 3900, 1, 1024]
    - [30, 81.071]
  - - [1024, 2505, 1, 4096]
    - [13, 71.574]
  - - [4096, 3472, 1, 1024]
    - [13, 84.617]
  - - [1024, 3386, 1, 4096]
    - [31, 75.806]
  - - [4096, 3383, 1, 1024]
    - [13, 85.691]
  - - [4096, 3448, 1, 1024]
    - [13, 87.148]
  - - [4096, 4030, 1, 1024]
    - [13, 85.484]
  - - [4096, 3289, 1, 1024]
    - [15, 84.753]
  - - [1024, 3459, 1, 4096]
    - [13, 69.684]
  - - [1024, 2918, 1, 4096]
    - [15, 75.919]
  - - [4096, 3489, 1, 1024]
    - [13, 84.96]
  - - [4096, 3346, 1, 1024]
    - [13, 84.902]
  - - [4096, 3572, 1, 1024]
    - [13, 87.203]
  - - [1024, 3955, 1, 4096]
    - [13, 83.823]
  - - [4096, 3236, 1, 1024]
    - [15, 83.413]
  - - [4096, 3163, 1, 1024]
    - [13, 84.356]
  - - [4096, 3468, 1, 1024]
    - [13, 84.676]
  - - [1024, 3165, 1, 4096]
    - [15, 81.987]
  - - [1024, 3276, 1, 4096]
    - [32, 84.902]
  - - [1024, 3359, 1, 4096]
    - [14, 75.684]
  - - [4096, 3363, 1, 1024]
    - [13, 85.06]
  - - [1024, 3385, 1, 4096]
    - [30, 79.772]
  - - [1024, 3207, 1, 4096]
    - [32, 83.097]
  - - [1024, 3458, 1, 4096]
    - [13, 70.816]
  - - [4096, 3110, 1, 1024]
    - [13, 82.695]
  - - [4096, 3925, 1, 1024]
    - [13, 85.935]
  - - [1024, 3975, 1, 4096]
    - [32, 78.139]
  - - [4096, 3549, 1, 1024]
    - [13, 86.282]
  - - [4096, 3342, 1, 1024]
    - [13, 84.712]
  - - [1024, 3859, 1, 1024]
    - [30, 80.354]
  - - [1024, 3497, 1, 4096]
    - [13, 71.394]
  - - [4096, 3280, 1, 1024]
    - [15, 84.184]
  - - [1024, 3435, 1, 4096]
    - [31, 77.078]
  - - [1024, 3354, 1, 4096]
    - [31, 75.459]
  - - [4096, 3191, 1, 1024]
    - [13, 84.838]
  - - [4096, 3512, 1, 1024]
    - [13, 85.714]
  - - [1024, 3055, 1, 4096]
    - [32, 79.091]
  - - [4096, 2499, 1, 1024]
    - [15, 85.105]
  - - [1024, 3233, 1, 4096]
    - [32, 83.787]
  - - [4096, 3423, 1, 1024]
    - [13, 86.661]
  - - [1024, 3319, 1, 4096]
    - [51, 85.646]
  - - [4096, 3297, 1, 1024]
    - [15, 84.942]
  - - [4096, 3154, 1, 1024]
    - [13, 83.918]
  - - [1024, 3540, 1, 4096]
    - [13, 72.977]
  - - [1024, 3289, 1, 4096]
    - [32, 85.114]
  - - [4096, 3529, 1, 1024]
    - [13, 85.971]
  - - [4096, 3386, 1, 1024]
    - [13, 85.822]
  - - [4096, 3276, 1, 1024]
    - [15, 84.261]
  - - [1024, 3244, 1, 4096]
    - [32, 83.914]
  - - [1024, 3182, 1, 4096]
    - [32, 82.47]
  - - [4096, 3540, 1, 1024]
    - [13, 86.187]
  - - [1024, 3360, 1, 4096]
    - [13, 74.723]
  - - [1024, 3942, 1, 4096]
    - [13, 79.221]
  - - [4096, 3403, 1, 1024]
    - [13, 86.007]
  - - [4096, 3101, 1, 1024]
    - [13, 82.61]
  - - [4096, 2918, 1, 1024]
    - [13, 84.667]
  - - [1024, 3465, 1, 4096]
    - [13, 67.919]
  - - [33708, 3780, 1, 1024]
    - [51, 88.403]
  - - [4096, 3557, 1, 1024]
    - [13, 86.544]
  - - [4096, 3414, 1, 1024]
    - [13, 86.657]
  - - [1024, 3948, 1, 1024]
    - [30, 82.019]
  - - [4096, 3320, 1, 1024]
    - [15, 85.637]
  - - [4096, 2765, 1, 1024]
    - [15, 84.879]
  - - [1024, 3978, 1, 4096]
    - [32, 78.107]
  - - [4096, 3487, 1, 1024]
    - [13, 84.825]
  - - [4096, 3520, 1, 1024]
    - [13, 85.736]
  - - [1024, 3139, 1, 4096]
    - [51, 81.396]
  - - [1024, 3314, 1, 4096]
    - [32, 85.678]
  - - [4096, 3431, 1, 1024]
    - [13, 86.571]
  - - [1024, 3446, 1, 4096]
    - [13, 78.748]
  - - [1024, 4059, 1, 4096]
    - [32, 79.695]
  - - [4096, 3345, 1, 1024]
    - [13, 84.834]
  - - [4096, 3394, 1, 1024]
    - [13, 86.021]
  - - [1024, 3927, 1, 1024]
    - [30, 81.617]
  - - [4096, 3235, 1, 1024]
    - [15, 83.444]
  - - [1024, 3328, 1, 4096]
    - [15, 86.354]
  - - [33708, 3956, 1, 1024]
    - [49, 88.601]
  - - [4096, 3467, 1, 1024]
    - [13, 84.265]
  - - [1024, 3287, 1, 4096]
    - [51, 84.902]
  - - [4096, 3214, 1, 1024]
    - [15, 82.722]
  - - [4096, 3910, 1, 1024]
    - [13, 85.678]
  - - [1024, 3780, 1, 1024]
    - [30, 78.522]
  - - [1024, 3371, 1, 4096]
    - [14, 75.589]
  - - [4096, 3478, 1, 1024]
    - [13, 84.599]
  - - [1024, 3546, 1, 4096]
    - [13, 70.694]
  - - [1024, 4012, 1, 1024]
    - [32, 76.068]
  - - [4096, 3341, 1, 1024]
    - [13, 84.514]
  - - [4096, 3454, 1, 1024]
    - [13, 87.446]
  - - [4096, 3295, 1, 1024]
    - [15, 84.87]
  - - [4096, 3072, 1, 1024]
    - [15, 86.467]
  - - [1024, 3282, 1, 4096]
    - [15, 84.766]
  - - [33708, 3720, 1, 1024]
    - [51, 87.13]
  - - [1024, 3681, 1, 4096]
    - [13, 75.671]
  - - [1024, 4050, 1, 4096]
    - [32, 79.546]
  - - [4096, 3495, 1, 1024]
    - [13, 85.217]
  - - [4096, 3560, 1, 1024]
    - [13, 86.972]
  - - [4096, 3751, 1, 1024]
    - [13, 85.118]
  - - [1024, 3414, 1, 4096]
    - [31, 76.812]
  - - [33708, 3860, 1, 1024]
    - [49, 86.589]
  - - [1024, 3325, 1, 4096]
    - [15, 85.308]
  - - [4096, 3458, 1, 1024]
    - [13, 84.085]
  - - [4096, 2967, 1, 1024]
    - [15, 83.264]
  - - [1024, 3519, 1, 4096]
    - [13, 71.881]
  - - [4096, 3385, 1, 1024]
    - [13, 85.312]
  - - [4096, 3434, 1, 1024]
    - [13, 87.004]
  - - [1024, 3552, 1, 4096]
    - [13, 73.049]
  - - [4096, 3822, 1, 1024]
    - [13, 86.363]
  - - [1024, 3544, 1, 4096]
    - [13, 72.58]
  - - [4096, 3539, 1, 1024]
    - [13, 85.917]
  - - [4096, 3332, 1, 1024]
    - [13, 84.55]
  - - [1024, 3145, 1, 4096]
    - [51, 81.54]
  - - [1024, 3535, 1, 4096]
    - [13, 75.616]
  - - [1024, 3320, 1, 4096]
    - [32, 85.804]
  - - [33708, 4012, 1, 1024]
    - [32, 88.191]
  - - [4096, 3286, 1, 1024]
    - [15, 84.369]
  - - [1024, 3514, 1, 4096]
    - [13, 71.475]
  - - [1024, 2765, 1, 4096]
    - [13, 79.361]
  - - [1024, 3452, 1, 4096]
    - [13, 79.054]
  - - [4096, 3518, 1, 1024]
    - [13, 85.52]
  - - [1024, 3529, 1, 4096]
    - [13, 70.324]
  - - [4096, 3413, 1, 1024]
    - [13, 86.043]
  - - [33708, 4050, 1, 1024]
    - [51, 88.773]
  - - [1024, 3525, 1, 4096]
    - [30, 75.219]
  - - [4096, 3303, 1, 1024]
    - [15, 84.811]
  - - [1024, 3382, 1, 4096]
    - [30, 79.465]
  - - [1024, 3390, 1, 4096]
    - [30, 79.14]
  - - [1024, 3977, 1, 4096]
    - [32, 78.211]
  - - [1024, 3184, 1, 4096]
    - [32, 82.65]
  - - [4096, 3535, 1, 1024]
    - [13, 86.066]
  - - [4096, 3376, 1, 1024]
    - [13, 85.623]
  - - [4096, 3978, 1, 1024]
    - [13, 84.414]
  - - [1024, 3136, 1, 4096]
    - [51, 81.315]
  - - [1024, 3293, 1, 4096]
    - [32, 85.168]
  - - [4096, 3266, 1, 1024]
    - [15, 84.08]
  - - [1024, 3487, 1, 4096]
    - [13, 70.699]
  - - [1024, 3409, 1, 4096]
    - [30, 73.063]
  - - [4096, 3498, 1, 1024]
    - [13, 85.141]
  - - [1024, 3520, 1, 4096]
    - [13, 73.586]
  - - [1024, 3530, 1, 4096]
    - [14, 68.79]
  - - [4096, 3393, 1, 1024]
    - [13, 85.867]
  - - [4096, 3140, 1, 1024]
    - [13, 83.656]
  - - [1024, 3536, 1, 4096]
    - [13, 71.633]
  - - [1024, 3288, 1, 4096]
    - [15, 84.969]
  - - [1024, 4005, 1, 4096]
    - [51, 78.684]
  - - [1024, 3579, 1, 4096]
    - [13, 74.001]
  - - [4096, 3372, 1, 1024]
    - [13, 85.781]
  - - [1024, 3440, 1, 4096]
    - [30, 84.82]
  - - [4096, 3213, 1, 1024]
    - [15, 82.74]
  - - [4096, 3477, 1, 1024]
    - [13, 84.784]
  - - [4096, 3526, 1, 1024]
    - [13, 85.962]
  - - [1024, 3493, 1, 4096]
    - [13, 73.004]
  - - [1024, 3944, 1, 4096]
    - [13, 82.222]
  - - [4096, 3453, 1, 1024]
    - [13, 87.496]
  - - [1024, 3350, 1, 4096]
    - [13, 78.73]
  - - [4096, 3184, 1, 1024]
    - [13, 84.847]
  - - [1024, 3423, 1, 4096]
    - [13, 77.814]
  - - [4096, 3351, 1, 1024]
    - [13, 84.884]
  - - [4096, 3416, 1, 1024]
    - [13, 86.607]
  - - [1024, 3796, 1, 4096]
    - [30, 74.994]
  - - [4096, 3257, 1, 1024]
    - [15, 83.882]
  - - [4096, 3306, 1, 1024]
    - [15, 85.285]
  - - [33708, 4020, 1, 1024]
    - [51, 88.06]
  - - [1024, 3426, 1, 4096]
    - [30, 78.346]
  - - [4096, 3457, 1, 1024]
    - [13, 84.135]
  - - [1024, 2935, 1, 4096]
    - [51, 76.167]
  - - [1024, 3046, 1, 4096]
    - [15, 79.041]
  - - [4096, 3433, 1, 1024]
    - [13, 86.918]
  - - [1024, 3256, 1, 4096]
    - [51, 84.171]
  - - [1024, 3531, 1, 4096]
    - [13, 74.579]
  - - [4096, 3180, 1, 1024]
    - [13, 84.514]
  - - [1024, 3388, 1, 4096]
    - [13, 82.98]
  - - [4096, 3444, 1, 1024]
    - [13, 87.121]
  - - [1024, 3501, 1, 4096]
    - [30, 69.602]
  - - [1024, 3266, 1, 4096]
    - [32, 84.568]
  - - [1024, 3267, 1, 4096]
    - [32, 84.509]
  - - [1024, 3461, 1, 4096]
    - [13, 71.772]
  - - [4096, 3870, 1, 1024]
    - [13, 84.649]
  - - [4096, 3517, 1, 1024]
    - [13, 85.881]
  - - [1024, 3566, 1, 4096]
    - [30, 72.679]
  - - [4096, 3574, 1, 1024]
    - [13, 86.923]
  - - [1024, 3876, 1, 1024]
    - [30, 80.44]
  - - [4096, 3720, 1, 1024]
    - [13, 84.252]
  - - [4096, 3248, 1, 1024]
    - [15, 83.914]
  - - [4096, 4059, 1, 1024]
    - [13, 85.885]
  - - [1024, 3380, 1, 4096]
    - [30, 71.245]
  - - [4096, 3480, 1, 1024]
    - [13, 84.838]
  - - [1024, 3335, 1, 4096]
    - [31, 75.31]
  - - [1024, 3345, 1, 4096]
    - [13, 82.086]
  - - [4096, 3391, 1, 1024]
    - [13, 85.998]
  - - [4096, 3424, 1, 1024]
    - [13, 86.706]
  - - [1024, 3394, 1, 4096]
    - [13, 83.616]
  - - [4096, 3265, 1, 1024]
    - [15, 84.148]
  - - [1024, 3014, 1, 4096]
    - [15, 78.215]
  - - [4096, 3497, 1, 1024]
    - [13, 85.073]
  - - [4096, 3354, 1, 1024]
    - [13, 85.15]
  - - [4096, 3055, 1, 1024]
    - [15, 85.587]
  - - [1024, 3499, 1, 4096]
    - [13, 74.371]
  - - [1024, 3162, 1, 4096]
    - [32, 81.996]
  - - [4096, 3244, 1, 1024]
    - [15, 83.584]
  - - [1024, 3437, 1, 4096]
    - [31, 77.042]
  - - [1024, 3356, 1, 4096]
    - [31, 74.692]
  - - [4096, 3139, 1, 1024]
    - [13, 83.422]
  - - [4096, 3508, 1, 1024]
    - [13, 85.488]
  - - [1024, 3235, 1, 4096]
    - [32, 83.611]
  - - [1024, 3910, 1, 4096]
    - [32, 76.934]
  - - [4096, 3371, 1, 1024]
    - [13, 85.272]
  - - [1024, 3751, 1, 4096]
    - [13, 74.028]
  - - [4096, 3325, 1, 1024]
    - [15, 85.425]
  - - [1024, 3413, 1, 4096]
    - [13, 76.492]
  - - [1024, 3542, 1, 4096]
    - [30, 69.287]
  - - [33708, 3900, 1, 1024]
    - [30, 87.234]
  - - [4096, 3525, 1, 1024]
    - [13, 85.714]
  - - [4096, 3382, 1, 1024]
    - [13, 85.493]
  - - [1024, 3339, 1, 4096]
    - [14, 74.831]
  - - [4096, 3288, 1, 1024]
    - [15, 84.586]
  - - [1024, 3141, 1, 4096]
    - [15, 81.355]
  - - [1024, 3168, 1, 4096]
    - [51, 82.095]
  - - [4096, 3488, 1, 1024]
    - [13, 84.726]
  - - [4096, 3046, 1, 1024]
    - [15, 85.105]
  - - [1024, 3362, 1, 4096]
    - [13, 76.731]
  - - [33708, 3942, 1, 1024]
    - [49, 88.317]
  - - [4096, 3399, 1, 1024]
    - [13, 85.953]
  - - [1024, 3720, 1, 1024]
    - [30, 77.322]
  - - [4096, 3563, 1, 1024]
    - [13, 87.045]
  - - [1024, 3273, 1, 4096]
    - [51, 84.586]
  - - [4096, 3162, 1, 1024]
    - [13, 84.198]
  - - [1024, 3467, 1, 4096]
    - [30, 73.992]
  - - [1024, 3130, 1, 4096]
    - [15, 81.17]
  - - [1024, 3405, 1, 4096]
    - [30, 77.949]
  - - [4096, 3362, 1, 1024]
    - [13, 85.398]
  - - [1024, 3960, 1, 1024]
    - [30, 82.276]
  - - [1024, 3712, 1, 36548]
    - [1, 81.725]
  - - [1024, 3712, 1, 1024]
    - [30, 77.547]
  - - [4032, 384, 1, 64]
    - [0, 47.662]
  - - [1024, 2048, 1, 49]
    - [8, 51.059]
  - - [4608, 512, 1, 49]
    - [36, 51.948]
  - - [9216, 512, 1, 4096]
    - [32, 82.966]
  - - [3456, 384, 1, 289]
    - [36, 63.615]
  - - [3456, 384, 1, 169]
    - [36, 61.477]
  - - [4096, 512, 1, 1001]
    - [7, 76.244]
  - - [384, 448, 49, 512]
    - [49, 72.323]
  - - [384, 448, 64, 256]
    - [13, 71.073]
  - - [384, 448, 36, 256]
    - [12, 68.714]
  - - [384, 448, 49, 256]
    - [29, 70.55]
  - - [384, 448, 64, 512]
    - [49, 72.909]
  - - [384, 448, 36, 512]
    - [13, 73.131]
  - - [1024, 6400, 1, 65]
    - [0, 70.193]
  - - [4096, 6400, 1, 256]
    - [13, 86.061]
  - - [512, 3194, 1, 2048]
    - [49, 71.398]
  - - [512, 3222, 1, 2048]
    - [30, 74.046]
  - - [512, 3234, 1, 2048]
    - [30, 74.29]
  - - [512, 3242, 1, 2048]
    - [30, 74.331]
  - - [512, 3257, 1, 2048]
    - [30, 74.886]
  - - [512, 3332, 1, 2048]
    - [31, 73.943]
  - - [512, 3336, 1, 2048]
    - [14, 74.128]
  - - [512, 3378, 1, 2048]
    - [50, 74.696]
  - - [512, 3396, 1, 2048]
    - [50, 75.201]
  - - [512, 3399, 1, 2048]
    - [31, 75.283]
  - - [512, 3451, 1, 2048]
    - [31, 76.284]
  - - [512, 3456, 1, 2048]
    - [31, 76.862]
  - - [512, 3458, 1, 2048]
    - [51, 65.876]
  - - [512, 3467, 1, 2048]
    - [32, 66.011]
  - - [512, 3468, 1, 2048]
    - [51, 65.979]
  - - [512, 3470, 1, 2048]
    - [15, 66.079]
  - - [512, 3477, 1, 2048]
    - [15, 66.259]
  - - [512, 3478, 1, 2048]
    - [15, 66.182]
  - - [512, 3495, 1, 2048]
    - [15, 66.566]
  - - [512, 3507, 1, 2048]
    - [15, 66.769]
  - - [512, 3515, 1, 2048]
    - [15, 66.909]
  - - [512, 3517, 1, 2048]
    - [51, 66.927]
  - - [2048, 2864, 1, 512]
    - [13, 76.487]
  - - [2048, 3287, 1, 512]
    - [13, 80.498]
  - - [2048, 3412, 1, 512]
    - [30, 83.264]
  - - [2048, 3456, 1, 512]
    - [13, 85.317]
  - - [2048, 3466, 1, 512]
    - [30, 79.451]
  - - [2048, 3476, 1, 512]
    - [30, 79.573]
  - - [2048, 3999, 1, 512]
    - [30, 80.458]
  - - [33708, 189, 1, 512]
    - [29, 70.333]
  - - [33708, 2496, 1, 512]
    - [13, 86.458]
  - - [33708, 3864, 1, 512]
    - [13, 86.828]
  - - [33708, 3969, 1, 512]
    - [13, 86.413]
  - - [33708, 3995, 1, 512]
    - [13, 86.914]
  - - [134, 134, 240, 64]
    - [17, 27.061]
  - - [135, 134, 240, 64]
    - [36, 27.688]
  - - [135, 135, 240, 64]
    - [25, 27.675]
  - - [512, 2790, 1, 2048]
    - [48, 66.53]
  - - [512, 2864, 1, 2048]
    - [30, 66.07]
  - - [512, 3092, 1, 2048]
    - [13, 71.181]
  - - [512, 3113, 1, 2048]
    - [30, 71.524]
  - - [512, 3137, 1, 2048]
    - [13, 72.084]
  - - [512, 3165, 1, 2048]
    - [13, 72.666]
  - - [512, 3166, 1, 2048]
    - [49, 72.675]
  - - [512, 3219, 1, 2048]
    - [13, 74.046]
  - - [512, 3237, 1, 2048]
    - [49, 74.317]
  - - [512, 3246, 1, 2048]
    - [13, 74.371]
  - - [512, 3249, 1, 2048]
    - [30, 74.678]
  - - [512, 3251, 1, 2048]
    - [49, 74.944]
  - - [512, 3262, 1, 2048]
    - [30, 75.016]
  - - [512, 3268, 1, 2048]
    - [13, 75.161]
  - - [512, 3282, 1, 2048]
    - [13, 75.314]
  - - [512, 3286, 1, 2048]
    - [30, 75.698]
  - - [512, 3287, 1, 2048]
    - [30, 75.531]
  - - [512, 3293, 1, 2048]
    - [30, 75.684]
  - - [512, 3297, 1, 2048]
    - [30, 75.644]
  - - [512, 3307, 1, 2048]
    - [13, 75.977]
  - - [512, 3314, 1, 2048]
    - [49, 76.027]
  - - [512, 3315, 1, 2048]
    - [49, 76.05]
  - - [512, 3319, 1, 2048]
    - [30, 76.054]
  - - [512, 3322, 1, 2048]
    - [49, 76.559]
  - - [512, 3323, 1, 2048]
    - [30, 76.329]
  - - [512, 3324, 1, 2048]
    - [49, 76.189]
  - - [512, 3325, 1, 2048]
    - [49, 76.316]
  - - [512, 3327, 1, 2048]
    - [49, 76.442]
  - - [512, 3329, 1, 2048]
    - [31, 73.92]
  - - [512, 3339, 1, 2048]
    - [50, 74.051]
  - - [512, 3342, 1, 2048]
    - [31, 74.164]
  - - [512, 3344, 1, 2048]
    - [50, 74.222]
  - - [512, 3358, 1, 2048]
    - [14, 74.637]
  - - [512, 3360, 1, 2048]
    - [50, 74.714]
  - - [512, 3364, 1, 2048]
    - [31, 74.633]
  - - [512, 3365, 1, 2048]
    - [31, 74.678]
  - - [512, 3369, 1, 2048]
    - [50, 74.786]
  - - [512, 3371, 1, 2048]
    - [50, 74.922]
  - - [512, 3374, 1, 2048]
    - [31, 74.764]
  - - [512, 3376, 1, 2048]
    - [31, 74.989]
  - - [512, 3377, 1, 2048]
    - [50, 74.759]
  - - [512, 3381, 1, 2048]
    - [50, 75.057]
  - - [512, 3382, 1, 2048]
    - [31, 75.129]
  - - [512, 3383, 1, 2048]
    - [31, 75.048]
  - - [512, 3384, 1, 2048]
    - [31, 75.17]
  - - [512, 3385, 1, 2048]
    - [50, 75.134]
  - - [512, 3386, 1, 2048]
    - [50, 75.057]
  - - [512, 3388, 1, 2048]
    - [50, 75.179]
  - - [512, 3390, 1, 2048]
    - [50, 75.188]
  - - [512, 3391, 1, 2048]
    - [31, 75.35]
  - - [512, 3402, 1, 2048]
    - [31, 75.391]
  - - [512, 3410, 1, 2048]
    - [31, 75.616]
  - - [512, 3412, 1, 2048]
    - [14, 75.612]
  - - [512, 3414, 1, 2048]
    - [50, 75.684]
  - - [512, 3415, 1, 2048]
    - [50, 75.752]
  - - [512, 3418, 1, 2048]
    - [14, 75.761]
  - - [512, 3420, 1, 2048]
    - [14, 75.774]
  - - [512, 3422, 1, 2048]
    - [50, 75.928]
  - - [512, 3425, 1, 2048]
    - [31, 75.941]
  - - [512, 3426, 1, 2048]
    - [31, 75.851]
  - - [512, 3427, 1, 2048]
    - [31, 75.797]
  - - [512, 3428, 1, 2048]
    - [50, 75.869]
  - - [512, 3430, 1, 2048]
    - [14, 76.004]
  - - [512, 3431, 1, 2048]
    - [50, 75.842]
  - - [512, 3432, 1, 2048]
    - [50, 76.004]
  - - [512, 3438, 1, 2048]
    - [50, 76.059]
  - - [512, 3439, 1, 2048]
    - [50, 76.198]
  - - [512, 3440, 1, 2048]
    - [31, 76.149]
  - - [512, 3443, 1, 2048]
    - [31, 76.271]
  - - [512, 3445, 1, 2048]
    - [31, 76.185]
  - - [512, 3447, 1, 2048]
    - [31, 76.325]
  - - [512, 3448, 1, 2048]
    - [31, 76.374]
  - - [512, 3450, 1, 2048]
    - [50, 76.42]
  - - [512, 3452, 1, 2048]
    - [31, 76.379]
  - - [512, 3453, 1, 2048]
    - [31, 76.501]
  - - [512, 3455, 1, 2048]
    - [31, 76.492]
  - - [512, 3457, 1, 2048]
    - [15, 65.781]
  - - [512, 3459, 1, 2048]
    - [15, 65.925]
  - - [512, 3460, 1, 2048]
    - [51, 65.934]
  - - [512, 3461, 1, 2048]
    - [15, 65.894]
  - - [512, 3462, 1, 2048]
    - [51, 65.948]
  - - [512, 3466, 1, 2048]
    - [32, 66.016]
  - - [512, 3471, 1, 2048]
    - [51, 65.975]
  - - [512, 3472, 1, 2048]
    - [32, 65.993]
  - - [512, 3475, 1, 2048]
    - [15, 66.237]
  - - [512, 3476, 1, 2048]
    - [15, 66.124]
  - - [512, 3479, 1, 2048]
    - [51, 66.25]
  - - [512, 3480, 1, 2048]
    - [51, 66.219]
  - - [512, 3481, 1, 2048]
    - [51, 66.264]
  - - [512, 3483, 1, 2048]
    - [51, 66.395]
  - - [512, 3484, 1, 2048]
    - [32, 66.3]
  - - [512, 3487, 1, 2048]
    - [51, 66.367]
  - - [512, 3489, 1, 2048]
    - [15, 66.413]
  - - [512, 3490, 1, 2048]
    - [51, 66.367]
  - - [512, 3491, 1, 2048]
    - [15, 66.498]
  - - [512, 3493, 1, 2048]
    - [51, 66.58]
  - - [512, 3494, 1, 2048]
    - [51, 66.476]
  - - [512, 3497, 1, 2048]
    - [15, 66.62]
  - - [512, 3498, 1, 2048]
    - [51, 66.534]
  - - [512, 3499, 1, 2048]
    - [51, 66.634]
  - - [512, 3501, 1, 2048]
    - [51, 66.634]
  - - [512, 3503, 1, 2048]
    - [51, 66.616]
  - - [512, 3508, 1, 2048]
    - [15, 66.764]
  - - [512, 3509, 1, 2048]
    - [15, 66.67]
  - - [512, 3511, 1, 2048]
    - [51, 66.755]
  - - [512, 3514, 1, 2048]
    - [15, 66.958]
  - - [512, 3518, 1, 2048]
    - [15, 67.044]
  - - [512, 3519, 1, 2048]
    - [15, 67.031]
  - - [512, 3520, 1, 2048]
    - [15, 67.098]
  - - [512, 3523, 1, 2048]
    - [15, 67.107]
  - - [512, 3528, 1, 2048]
    - [15, 67.035]
  - - [512, 3529, 1, 2048]
    - [15, 67.044]
  - - [512, 3530, 1, 2048]
    - [15, 67.18]
  - - [512, 3532, 1, 2048]
    - [51, 67.378]
  - - [512, 3533, 1, 2048]
    - [15, 67.279]
  - - [512, 3534, 1, 2048]
    - [15, 67.265]
  - - [512, 3538, 1, 2048]
    - [15, 67.378]
  - - [512, 3539, 1, 2048]
    - [32, 67.365]
  - - [512, 3541, 1, 2048]
    - [15, 67.319]
  - - [512, 3547, 1, 2048]
    - [15, 67.477]
  - - [512, 3548, 1, 2048]
    - [15, 67.423]
  - - [512, 3552, 1, 2048]
    - [15, 67.577]
  - - [512, 3564, 1, 2048]
    - [15, 67.789]
  - - [512, 3575, 1, 2048]
    - [15, 67.847]
  - - [512, 3598, 1, 2048]
    - [51, 68.402]
  - - [512, 3599, 1, 2048]
    - [32, 68.483]
  - - [512, 3608, 1, 2048]
    - [51, 68.623]
  - - [512, 3780, 1, 512]
    - [15, 66.173]
  - - [512, 3780, 1, 2048]
    - [32, 71.985]
  - - [512, 3796, 1, 512]
    - [15, 66.025]
  - - [512, 3796, 1, 2048]
    - [51, 72.048]
  - - [512, 3822, 1, 512]
    - [15, 66.552]
  - - [512, 3822, 1, 2048]
    - [15, 72.652]
  - - [512, 3840, 1, 512]
    - [32, 70.067]
  - - [512, 3840, 1, 2048]
    - [32, 73.78]
  - - [512, 3859, 1, 512]
    - [11, 68.019]
  - - [512, 3859, 1, 2048]
    - [15, 73.207]
  - - [512, 3870, 1, 512]
    - [11, 67.969]
  - - [512, 3870, 1, 2048]
    - [51, 73.491]
  - - [512, 3876, 1, 512]
    - [11, 68.321]
  - - [512, 3876, 1, 2048]
    - [32, 73.595]
  - - [512, 3906, 1, 512]
    - [28, 68.438]
  - - [512, 3906, 1, 2048]
    - [15, 74.064]
  - - [512, 3910, 1, 512]
    - [15, 68.249]
  - - [512, 3910, 1, 2048]
    - [15, 74.132]
  - - [512, 3925, 1, 512]
    - [11, 68.65]
  - - [512, 3925, 1, 2048]
    - [15, 74.398]
  - - [512, 3927, 1, 512]
    - [51, 68.705]
  - - [512, 3942, 1, 512]
    - [11, 68.542]
  - - [512, 3942, 1, 2048]
    - [32, 74.782]
  - - [512, 3944, 1, 512]
    - [11, 68.962]
  - - [512, 3944, 1, 2048]
    - [15, 74.809]
  - - [512, 3955, 1, 512]
    - [51, 68.79]
  - - [512, 3955, 1, 2048]
    - [32, 75.089]
  - - [512, 3968, 1, 512]
    - [26, 70.193]
  - - [512, 3968, 1, 2048]
    - [51, 75.283]
  - - [512, 3969, 1, 512]
    - [11, 69.359]
  - - [512, 3969, 1, 2048]
    - [15, 75.197]
  - - [512, 3976, 1, 512]
    - [11, 69.521]
  - - [512, 3976, 1, 2048]
    - [15, 75.332]
  - - [512, 3977, 1, 512]
    - [11, 69.643]
  - - [512, 3977, 1, 2048]
    - [15, 75.395]
  - - [512, 3978, 1, 512]
    - [15, 69.228]
  - - [512, 3978, 1, 2048]
    - [15, 75.337]
  - - [512, 3990, 1, 512]
    - [51, 69.417]
  - - [512, 3990, 1, 2048]
    - [15, 75.68]
  - - [512, 3995, 1, 512]
    - [32, 69.282]
  - - [512, 3995, 1, 2048]
    - [15, 75.792]
  - - [512, 3996, 1, 512]
    - [51, 69.462]
  - - [512, 3996, 1, 2048]
    - [51, 75.756]
  - - [512, 3999, 1, 512]
    - [11, 70.175]
  - - [512, 3999, 1, 2048]
    - [15, 75.68]
  - - [512, 4005, 1, 512]
    - [51, 69.72]
  - - [512, 4005, 1, 2048]
    - [15, 75.779]
  - - [512, 4012, 1, 512]
    - [51, 69.656]
  - - [512, 4012, 1, 2048]
    - [15, 76.05]
  - - [512, 4020, 1, 512]
    - [26, 69.918]
  - - [512, 4020, 1, 2048]
    - [51, 76.126]
  - - [512, 4026, 1, 512]
    - [11, 70.148]
  - - [512, 4026, 1, 2048]
    - [15, 76.302]
  - - [512, 4030, 1, 512]
    - [11, 70.216]
  - - [512, 4030, 1, 2048]
    - [15, 76.447]
  - - [512, 4032, 1, 512]
    - [28, 70.026]
  - - [512, 4032, 1, 2048]
    - [15, 76.379]
  - - [512, 4050, 1, 512]
    - [51, 70.505]
  - - [512, 4059, 1, 512]
    - [15, 70.41]
  - - [2048, 2790, 1, 512]
    - [13, 80.818]
  - - [2048, 3092, 1, 512]
    - [15, 76.379]
  - - [2048, 3113, 1, 512]
    - [30, 77.178]
  - - [2048, 3137, 1, 512]
    - [13, 77.76]
  - - [2048, 3165, 1, 512]
    - [30, 78.206]
  - - [2048, 3166, 1, 512]
    - [30, 78.436]
  - - [2048, 3194, 1, 512]
    - [30, 79.005]
  - - [2048, 3219, 1, 512]
    - [30, 78.847]
  - - [2048, 3222, 1, 512]
    - [30, 79.014]
  - - [2048, 3234, 1, 512]
    - [15, 79.248]
  - - [2048, 3237, 1, 512]
    - [30, 79.659]
  - - [2048, 3242, 1, 512]
    - [30, 79.749]
  - - [2048, 3246, 1, 512]
    - [30, 79.51]
  - - [2048, 3249, 1, 512]
    - [30, 80.038]
  - - [2048, 3251, 1, 512]
    - [30, 80.006]
  - - [2048, 3257, 1, 512]
    - [15, 79.93]
  - - [2048, 3262, 1, 512]
    - [30, 80.061]
  - - [2048, 3268, 1, 512]
    - [30, 80.313]
  - - [2048, 3282, 1, 512]
    - [30, 80.467]
  - - [2048, 3286, 1, 512]
    - [30, 80.724]
  - - [2048, 3293, 1, 512]
    - [30, 80.927]
  - - [2048, 3297, 1, 512]
    - [30, 81.003]
  - - [2048, 3307, 1, 512]
    - [30, 81.071]
  - - [2048, 3314, 1, 512]
    - [13, 80.832]
  - - [2048, 3315, 1, 512]
    - [30, 81.486]
  - - [2048, 3319, 1, 512]
    - [30, 81.256]
  - - [2048, 3322, 1, 512]
    - [30, 81.319]
  - - [2048, 3323, 1, 512]
    - [30, 81.134]
  - - [2048, 3324, 1, 512]
    - [30, 81.64]
  - - [2048, 3325, 1, 512]
    - [30, 81.387]
  - - [2048, 3327, 1, 512]
    - [13, 81.333]
  - - [2048, 3329, 1, 512]
    - [13, 81.148]
  - - [2048, 3332, 1, 512]
    - [13, 81.387]
  - - [2048, 3336, 1, 512]
    - [30, 81.73]
  - - [2048, 3339, 1, 512]
    - [13, 81.225]
  - - [2048, 3342, 1, 512]
    - [30, 81.558]
  - - [2048, 3344, 1, 512]
    - [13, 81.667]
  - - [2048, 3358, 1, 512]
    - [30, 82.195]
  - - [2048, 3360, 1, 512]
    - [30, 82.294]
  - - [2048, 3364, 1, 512]
    - [13, 82.154]
  - - [2048, 3365, 1, 512]
    - [30, 82.1]
  - - [2048, 3369, 1, 512]
    - [30, 82.393]
  - - [2048, 3371, 1, 512]
    - [30, 82.443]
  - - [2048, 3374, 1, 512]
    - [13, 82.348]
  - - [2048, 3376, 1, 512]
    - [30, 82.695]
  - - [2048, 3377, 1, 512]
    - [30, 82.515]
  - - [2048, 3378, 1, 512]
    - [30, 82.777]
  - - [2048, 3381, 1, 512]
    - [30, 82.655]
  - - [2048, 3382, 1, 512]
    - [30, 82.745]
  - - [2048, 3383, 1, 512]
    - [30, 82.677]
  - - [2048, 3384, 1, 512]
    - [30, 83.106]
  - - [2048, 3385, 1, 512]
    - [30, 82.853]
  - - [2048, 3386, 1, 512]
    - [13, 82.501]
  - - [2048, 3388, 1, 512]
    - [30, 83.101]
  - - [2048, 3390, 1, 512]
    - [30, 82.975]
  - - [2048, 3391, 1, 512]
    - [30, 82.957]
  - - [2048, 3396, 1, 512]
    - [30, 83.192]
  - - [2048, 3399, 1, 512]
    - [13, 82.898]
  - - [2048, 3402, 1, 512]
    - [30, 83.435]
  - - [2048, 3410, 1, 512]
    - [13, 83.25]
  - - [2048, 3414, 1, 512]
    - [30, 83.868]
  - - [2048, 3415, 1, 512]
    - [30, 83.769]
  - - [2048, 3418, 1, 512]
    - [13, 83.566]
  - - [2048, 3420, 1, 512]
    - [30, 83.674]
  - - [2048, 3422, 1, 512]
    - [30, 83.796]
  - - [2048, 3425, 1, 512]
    - [30, 83.711]
  - - [2048, 3426, 1, 512]
    - [30, 83.652]
  - - [2048, 3427, 1, 512]
    - [13, 83.58]
  - - [2048, 3428, 1, 512]
    - [30, 83.81]
  - - [2048, 3430, 1, 512]
    - [13, 83.539]
  - - [2048, 3431, 1, 512]
    - [30, 84.058]
  - - [2048, 3432, 1, 512]
    - [13, 83.674]
  - - [2048, 3438, 1, 512]
    - [30, 83.692]
  - - [2048, 3439, 1, 512]
    - [13, 83.882]
  - - [2048, 3440, 1, 512]
    - [13, 83.647]
  - - [2048, 3443, 1, 512]
    - [13, 83.738]
  - - [2048, 3445, 1, 512]
    - [30, 83.742]
  - - [2048, 3447, 1, 512]
    - [30, 84.302]
  - - [2048, 3448, 1, 512]
    - [30, 84.089]
  - - [2048, 3450, 1, 512]
    - [30, 83.864]
  - - [2048, 3451, 1, 512]
    - [30, 84.184]
  - - [2048, 3452, 1, 512]
    - [30, 84.284]
  - - [2048, 3453, 1, 512]
    - [30, 84.094]
  - - [2048, 3455, 1, 512]
    - [30, 84.514]
  - - [2048, 3457, 1, 512]
    - [30, 78.991]
  - - [2048, 3458, 1, 512]
    - [30, 79.077]
  - - [2048, 3459, 1, 512]
    - [30, 79.077]
  - - [2048, 3460, 1, 512]
    - [30, 78.689]
  - - [2048, 3461, 1, 512]
    - [30, 79.185]
  - - [2048, 3462, 1, 512]
    - [13, 78.657]
  - - [2048, 3467, 1, 512]
    - [30, 79.244]
  - - [2048, 3468, 1, 512]
    - [30, 79.406]
  - - [2048, 3470, 1, 512]
    - [30, 79.537]
  - - [2048, 3471, 1, 512]
    - [30, 79.054]
  - - [2048, 3472, 1, 512]
    - [30, 79.384]
  - - [2048, 3475, 1, 512]
    - [30, 79.312]
  - - [2048, 3477, 1, 512]
    - [30, 79.506]
  - - [2048, 3478, 1, 512]
    - [30, 80.083]
  - - [2048, 3479, 1, 512]
    - [13, 79.077]
  - - [2048, 3480, 1, 512]
    - [30, 79.605]
  - - [2048, 3481, 1, 512]
    - [30, 79.573]
  - - [2048, 3483, 1, 512]
    - [30, 79.366]
  - - [2048, 3484, 1, 512]
    - [30, 79.695]
  - - [2048, 3487, 1, 512]
    - [30, 79.6]
  - - [2048, 3489, 1, 512]
    - [30, 79.379]
  - - [2048, 3490, 1, 512]
    - [30, 79.916]
  - - [2048, 3491, 1, 512]
    - [30, 79.433]
  - - [2048, 3493, 1, 512]
    - [30, 80.133]
  - - [2048, 3494, 1, 512]
    - [30, 79.993]
  - - [2048, 3495, 1, 512]
    - [30, 80.006]
  - - [2048, 3497, 1, 512]
    - [30, 80.083]
  - - [2048, 3498, 1, 512]
    - [30, 80.015]
  - - [2048, 3499, 1, 512]
    - [30, 79.83]
  - - [2048, 3501, 1, 512]
    - [13, 79.636]
  - - [2048, 3503, 1, 512]
    - [30, 80.097]
  - - [2048, 3507, 1, 512]
    - [30, 80.029]
  - - [2048, 3508, 1, 512]
    - [30, 80.498]
  - - [2048, 3509, 1, 512]
    - [30, 80.615]
  - - [2048, 3511, 1, 512]
    - [30, 80.498]
  - - [2048, 3514, 1, 512]
    - [30, 80.164]
  - - [2048, 3515, 1, 512]
    - [30, 80.467]
  - - [2048, 3517, 1, 512]
    - [30, 80.403]
  - - [2048, 3518, 1, 512]
    - [30, 80.512]
  - - [2048, 3519, 1, 512]
    - [30, 80.525]
  - - [2048, 3520, 1, 512]
    - [30, 80.471]
  - - [2048, 3523, 1, 512]
    - [30, 80.733]
  - - [2048, 3528, 1, 512]
    - [30, 80.593]
  - - [2048, 3529, 1, 512]
    - [30, 80.593]
  - - [2048, 3530, 1, 512]
    - [30, 80.787]
  - - [2048, 3532, 1, 512]
    - [30, 80.692]
  - - [2048, 3533, 1, 512]
    - [30, 80.823]
  - - [2048, 3534, 1, 512]
    - [30, 80.34]
  - - [2048, 3538, 1, 512]
    - [30, 80.688]
  - - [2048, 3539, 1, 512]
    - [30, 80.665]
  - - [2048, 3541, 1, 512]
    - [30, 80.647]
  - - [2048, 3547, 1, 512]
    - [30, 81.184]
  - - [2048, 3548, 1, 512]
    - [30, 80.597]
  - - [2048, 3552, 1, 512]
    - [30, 81.085]
  - - [2048, 3564, 1, 512]
    - [30, 81.477]
  - - [2048, 3575, 1, 512]
    - [30, 81.734]
  - - [2048, 3598, 1, 512]
    - [30, 81.419]
  - - [2048, 3599, 1, 512]
    - [13, 81.495]
  - - [2048, 3608, 1, 512]
    - [13, 81.649]
  - - [2048, 3780, 1, 512]
    - [30, 80.399]
  - - [2048, 3796, 1, 512]
    - [13, 80.746]
  - - [2048, 3822, 1, 512]
    - [30, 80.918]
  - - [2048, 3840, 1, 512]
    - [15, 82.628]
  - - [2048, 3859, 1, 512]
    - [30, 81.883]
  - - [2048, 3870, 1, 512]
    - [30, 82.005]
  - - [2048, 3876, 1, 512]
    - [30, 82.05]
  - - [2048, 3906, 1, 512]
    - [30, 82.916]
  - - [2048, 3910, 1, 512]
    - [13, 82.515]
  - - [2048, 3925, 1, 512]
    - [13, 82.844]
  - - [2048, 3942, 1, 512]
    - [13, 83.106]
  - - [2048, 3944, 1, 512]
    - [30, 83.53]
  - - [2048, 3955, 1, 512]
    - [30, 83.747]
  - - [2048, 3968, 1, 512]
    - [30, 84.468]
  - - [2048, 3969, 1, 512]
    - [30, 79.086]
  - - [2048, 3976, 1, 512]
    - [30, 79.456]
  - - [2048, 3977, 1, 512]
    - [30, 79.546]
  - - [2048, 3978, 1, 512]
    - [30, 79.447]
  - - [2048, 3990, 1, 512]
    - [30, 80.079]
  - - [2048, 3995, 1, 512]
    - [30, 79.876]
  - - [2048, 3996, 1, 512]
    - [30, 80.43]
  - - [2048, 4005, 1, 512]
    - [30, 80.061]
  - - [2048, 4012, 1, 512]
    - [30, 80.182]
  - - [2048, 4020, 1, 512]
    - [30, 80.259]
  - - [2048, 4026, 1, 512]
    - [30, 80.638]
  - - [2048, 4030, 1, 512]
    - [30, 80.471]
  - - [2048, 4032, 1, 512]
    - [30, 80.494]
  - - [33708, 184, 1, 512]
    - [48, 68.596]
  - - [33708, 208, 1, 512]
    - [13, 68.073]
  - - [33708, 246, 1, 512]
    - [49, 80.106]
  - - [33708, 264, 1, 512]
    - [30, 59.812]
  - - [33708, 465, 1, 512]
    - [49, 77.489]
  - - [33708, 468, 1, 512]
    - [49, 77.881]
  - - [33708, 493, 1, 512]
    - [30, 81.96]
  - - [33708, 540, 1, 512]
    - [30, 73.568]
  - - [33708, 550, 1, 512]
    - [30, 74.971]
  - - [33708, 560, 1, 512]
    - [30, 76.217]
  - - [33708, 644, 1, 512]
    - [49, 73.586]
  - - [33708, 714, 1, 512]
    - [49, 81.391]
  - - [33708, 720, 1, 512]
    - [49, 81.942]
  - - [33708, 781, 1, 512]
    - [49, 75.865]
  - - [33708, 936, 1, 512]
    - [49, 80.083]
  - - [33708, 980, 1, 512]
    - [30, 83.665]
  - - [33708, 1232, 1, 512]
    - [13, 84.153]
  - - [33708, 1290, 1, 512]
    - [13, 80.624]
  - - [33708, 1350, 1, 512]
    - [13, 84.297]
  - - [33708, 1424, 1, 512]
    - [13, 81.509]
  - - [33708, 1458, 1, 512]
    - [13, 83.674]
  - - [33708, 1462, 1, 512]
    - [13, 83.801]
  - - [33708, 1520, 1, 512]
    - [13, 86.959]
  - - [33708, 1596, 1, 512]
    - [13, 84.491]
  - - [33708, 1599, 1, 512]
    - [13, 84.604]
  - - [33708, 1615, 1, 512]
    - [13, 85.434]
  - - [33708, 1680, 1, 512]
    - [13, 82.772]
  - - [33708, 1917, 1, 512]
    - [13, 88.371]
  - - [33708, 2205, 1, 512]
    - [13, 84.897]
  - - [33708, 2418, 1, 512]
    - [13, 88.24]
  - - [33708, 3776, 1, 512]
    - [13, 87.771]
  - - [33708, 3780, 1, 512]
    - [13, 87.843]
  - - [33708, 3796, 1, 512]
    - [13, 88.24]
  - - [33708, 3822, 1, 512]
    - [13, 88.723]
  - - [33708, 3835, 1, 512]
    - [13, 89.102]
  - - [33708, 3840, 1, 512]
    - [13, 89.17]
  - - [33708, 3859, 1, 512]
    - [13, 86.756]
  - - [33708, 3870, 1, 512]
    - [13, 86.945]
  - - [33708, 3876, 1, 512]
    - [13, 87.085]
  - - [33708, 3906, 1, 512]
    - [13, 87.649]
  - - [33708, 3910, 1, 512]
    - [13, 87.852]
  - - [33708, 3925, 1, 512]
    - [13, 88.209]
  - - [33708, 3942, 1, 512]
    - [13, 88.556]
  - - [33708, 3944, 1, 512]
    - [13, 88.583]
  - - [33708, 3955, 1, 512]
    - [13, 88.885]
  - - [33708, 3968, 1, 512]
    - [30, 89.125]
  - - [33708, 3976, 1, 512]
    - [13, 86.652]
  - - [33708, 3977, 1, 512]
    - [13, 86.584]
  - - [33708, 3978, 1, 512]
    - [13, 86.436]
  - - [33708, 3990, 1, 512]
    - [13, 86.873]
  - - [33708, 3996, 1, 512]
    - [13, 86.991]
  - - [33708, 3999, 1, 512]
    - [13, 87.09]
  - - [33708, 4005, 1, 512]
    - [13, 87.293]
  - - [33708, 4012, 1, 512]
    - [13, 87.428]
  - - [33708, 4020, 1, 512]
    - [13, 87.586]
  - - [33708, 4026, 1, 512]
    - [13, 87.708]
  - - [33708, 4030, 1, 512]
    - [13, 87.83]
  - - [33708, 4032, 1, 512]
    - [13, 87.83]
  - - [3072, 512, 1, 3072]
    - [13, 71.795]
  - - [511, 8192, 1, 8192]
    - [51, 73.067]
  - - [4096, 4096, 1, 4096]
    - [13, 86.788]
  - - [8192, 8193, 1, 8192]
    - [51, 81.076]
  - - [3072, 3072, 1, 3071]
    - [24, 91.295]
  - - [8192, 8192, 1, 8193]
    - [7, 92.188]
  - - [7681, 8192, 1, 8192]
    - [51, 87.6]
  - - [7680, 8192, 1, 8193]
    - [24, 91.281]
  - - [513, 4096, 1, 4096]
    - [13, 59.212]
  - - [3073, 512, 1, 3072]
    - [13, 71.321]
  - - [7680, 8192, 1, 8192]
    - [51, 89.165]
  - - [4096, 4096, 1, 4097]
    - [41, 87.73]
  - - [8192, 8191, 1, 8192]
    - [51, 82.907]
  - - [8192, 512, 1, 8193]
    - [43, 77.557]
  - - [2880, 3071, 1, 3072]
    - [51, 85.041]
  - - [2880, 3072, 1, 3072]
    - [15, 85.19]
  - - [4096, 511, 1, 4096]
    - [15, 77.367]
  - - [512, 3072, 1, 3072]
    - [13, 72.336]
  - - [512, 8191, 1, 8192]
    - [32, 71.962]
  - - [4096, 4095, 1, 4096]
    - [13, 87.221]
  - - [8192, 511, 1, 8192]
    - [51, 68.335]
  - - [8192, 512, 1, 8192]
    - [51, 71.412]
  - - [511, 3072, 1, 3072]
    - [49, 71.082]
  - - [7680, 8193, 1, 8192]
    - [51, 86.436]
  - - [2048, 2048, 1, 2048]
    - [15, 79.357]
  - - [3072, 512, 1, 3073]
    - [37, 73.744]
  - - [513, 8192, 1, 8192]
    - [32, 62.875]
  - - [7679, 8192, 1, 8192]
    - [51, 89.486]
  - - [3840, 4096, 1, 4097]
    - [22, 88.24]
  - - [512, 3072, 1, 3071]
    - [37, 74.637]
  - - [7680, 8192, 1, 8191]
    - [24, 91.295]
  - - [3072, 511, 1, 3072]
    - [30, 70.888]
  - - [8193, 8192, 1, 8192]
    - [51, 85.254]
  - - [512, 4096, 1, 4095]
    - [43, 79.14]
  - - [512, 3071, 1, 3072]
    - [49, 71.479]
  - - [3073, 3072, 1, 3072]
    - [13, 83.259]
  - - [512, 3073, 1, 3072]
    - [49, 71.366]
  - - [4096, 4096, 1, 4095]
    - [22, 87.911]
  - - [1920, 2048, 1, 2047]
    - [37, 84.468]
  - - [1920, 2049, 1, 2048]
    - [13, 72.021]
  - - [512, 8192, 1, 8191]
    - [7, 81.112]
  - - [3840, 4096, 1, 4096]
    - [15, 86.887]
  - - [8191, 512, 1, 8192]
    - [32, 68.366]
  - - [2881, 3072, 1, 3072]
    - [32, 85.172]
  - - [512, 4096, 1, 4096]
    - [15, 78.928]
  - - [3841, 4096, 1, 4096]
    - [15, 85.786]
  - - [2880, 3072, 1, 3073]
    - [7, 85.168]
  - - [4095, 512, 1, 4096]
    - [15, 78.188]
  - - [1919, 2048, 1, 2048]
    - [13, 81.297]
  - - [1920, 2048, 1, 2048]
    - [13, 81.671]
  - - [8192, 8192, 1, 8192]
    - [51, 82.592]
  - - [511, 4096, 1, 4096]
    - [51, 78.256]
  - - [8192, 513, 1, 8192]
    - [44, 56.257]
  - - [513, 3072, 1, 3072]
    - [51, 58.842]
  - - [7680, 8191, 1, 8192]
    - [51, 89.292]
  - - [512, 4097, 1, 4096]
    - [32, 77.972]
  - - [2047, 2048, 1, 2048]
    - [15, 79.51]
  - - [2049, 2048, 1, 2048]
    - [13, 76.478]
  - - [3840, 4095, 1, 4096]
    - [15, 85.642]
  - - [2880, 3072, 1, 3071]
    - [24, 85.272]
  - - [3072, 3072, 1, 3073]
    - [7, 91.295]
  - - [2880, 3073, 1, 3072]
    - [13, 82.605]
  - - [4096, 513, 1, 4096]
    - [13, 60.331]
  - - [4097, 512, 1, 4096]
    - [15, 78.603]
  - - [8192, 512, 1, 8191]
    - [24, 77.566]
  - - [1921, 2048, 1, 2048]
    - [15, 74.38]
  - - [512, 3072, 1, 3073]
    - [37, 74.854]
  - - [2048, 2049, 1, 2048]
    - [15, 79.285]
  - - [3072, 512, 1, 3071]
    - [18, 74.89]
  - - [3071, 3072, 1, 3072]
    - [32, 91.101]
  - - [3840, 4097, 1, 4096]
    - [15, 81.595]
  - - [2048, 2047, 1, 2048]
    - [32, 78.617]
  - - [2879, 3072, 1, 3072]
    - [32, 85.231]
  - - [3072, 513, 1, 3072]
    - [51, 59.198]
  - - [512, 4095, 1, 4096]
    - [51, 78.342]
  - - [3071, 512, 1, 3072]
    - [13, 71.588]
  - - [4096, 512, 1, 4096]
    - [15, 79.127]
  - - [4097, 4096, 1, 4096]
    - [15, 84.5]
  - - [2048, 2048, 1, 2047]
    - [24, 79.858]
  - - [3839, 4096, 1, 4096]
    - [15, 86.129]
  - - [512, 4096, 1, 4097]
    - [43, 79.081]
  - - [3072, 3073, 1, 3072]
    - [13, 83.201]
  - - [2048, 2048, 1, 2049]
    - [24, 80.142]
  - - [8191, 8192, 1, 8192]
    - [51, 82.42]
  - - [3072, 3071, 1, 3072]
    - [32, 90.78]
  - - [4096, 512, 1, 4097]
    - [43, 78.964]
  - - [3840, 4096, 1, 4095]
    - [5, 88.249]
  - - [1920, 2047, 1, 2048]
    - [13, 80.43]
  - - [8192, 8192, 1, 8191]
    - [7, 92.202]
  - - [3072, 3072, 1, 3072]
    - [32, 91.155]
  - - [512, 8193, 1, 8192]
    - [32, 73.149]
  - - [4096, 512, 1, 4095]
    - [43, 78.915]
  - - [8193, 512, 1, 8192]
    - [32, 68.659]
  - - [4095, 4096, 1, 4096]
    - [13, 86.864]
  - - [4096, 4097, 1, 4096]
    - [13, 84.487]
  - - [512, 8192, 1, 8192]
    - [32, 74.511]
  - - [512, 8192, 1, 8193]
    - [24, 81.13]
  - - [1920, 2048, 1, 2049]
    - [37, 84.103]
  - - [479, 3072, 1, 3072]
    - [13, 67.315]
  - - [479, 4096, 1, 4096]
    - [32, 73.825]
  - - [479, 8192, 1, 8192]
    - [32, 68.538]
  - - [480, 3072, 1, 3071]
    - [37, 70.135]
  - - [480, 3072, 1, 3073]
    - [1, 70.13]
  - - [480, 3073, 1, 3072]
    - [13, 67.468]
  - - [480, 4095, 1, 4096]
    - [32, 73.839]
  - - [480, 4096, 1, 4095]
    - [24, 74.461]
  - - [480, 4096, 1, 4097]
    - [43, 74.416]
  - - [480, 4097, 1, 4096]
    - [32, 73.965]
  - - [480, 8191, 1, 8192]
    - [32, 68.488]
  - - [480, 8192, 1, 8191]
    - [43, 76.054]
  - - [480, 8192, 1, 8193]
    - [7, 76.045]
  - - [480, 8193, 1, 8192]
    - [51, 68.813]
  - - [481, 3072, 1, 3072]
    - [13, 67.008]
  - - [481, 4096, 1, 4096]
    - [51, 74.096]
  - - [481, 8192, 1, 8192]
    - [51, 70.708]
  - - [3072, 479, 1, 3072]
    - [30, 66.778]
  - - [3072, 480, 1, 3071]
    - [37, 70.076]
  - - [3072, 480, 1, 3073]
    - [18, 69.715]
  - - [3072, 481, 1, 3072]
    - [30, 67.392]
  - - [3073, 480, 1, 3072]
    - [49, 67.229]
  - - [480, 3072, 1, 3072]
    - [30, 67.265]
  - - [480, 4096, 1, 4096]
    - [51, 74.096]
  - - [480, 8192, 1, 8192]
    - [32, 69.706]
  - - [3072, 480, 1, 3072]
    - [49, 66.859]
  - - [4096, 480, 1, 4096]
    - [15, 72.991]
  - - [8192, 480, 1, 8192]
    - [51, 65.303]
  - - [1024, 3840, 1, 1024]
    - [13, 79.844]
  - - [1024, 3840, 1, 4096]
    - [32, 75.693]
  - - [1024, 3968, 1, 1024]
    - [30, 83.106]
  - - [1024, 3968, 1, 4096]
    - [13, 84.27]
  - - [1024, 7200, 1, 1024]
    - [30, 82.826]
  - - [1024, 7200, 1, 4096]
    - [13, 82.492]
  - - [1024, 8160, 1, 1024]
    - [49, 82.131]
  - - [1024, 8160, 1, 4096]
    - [15, 78.725]
  - - [1024, 9520, 1, 1024]
    - [30, 84.455]
  - - [1024, 9520, 1, 4096]
    - [15, 82.768]
  - - [1024, 10200, 1, 1024]
    - [32, 87.117]
  - - [1024, 10200, 1, 4096]
    - [15, 87.121]
  - - [4096, 3840, 1, 1024]
    - [13, 87.009]
  - - [4096, 3968, 1, 1024]
    - [13, 87.103]
  - - [4096, 7200, 1, 1024]
    - [13, 86.224]
  - - [4096, 8160, 1, 1024]
    - [13, 87.081]
  - - [4096, 9520, 1, 1024]
    - [13, 86.246]
  - - [4096, 10200, 1, 1024]
    - [13, 86.815]
  - - [42720, 3968, 1, 1024]
    - [49, 89.819]
  - - [42720, 7200, 1, 1024]
    - [51, 88.714]
  - - [42720, 9520, 1, 1024]
    - [51, 89.58]
  - - [2048, 960, 1, 2048]
    - [51, 72.034]
  - - [2048, 960, 1, 74]
    - [0, 57.985]
  - - [1600, 1024, 1, 960]
    - [18, 75.156]
  - - [2048, 2048, 1, 960]
    - [24, 79.33]
  - - [4096, 1024, 1, 257]
    - [18, 73.464]
  - - [10240, 8976, 1, 256]
    - [13, 86.612]
  - - [1024, 1600, 1, 1024]
    - [49, 69.472]
  - - [1024, 1600, 1, 560]
    - [38, 72.855]
  - - [10496, 8976, 1, 256]
    - [13, 87.108]
  - - [11264, 8976, 1, 256]
    - [13, 86.598]
  - - [11776, 8976, 1, 256]
    - [13, 87.248]
  - - [12544, 8976, 1, 256]
    - [13, 87.284]
  - - [1280, 8976, 1, 256]
    - [49, 80.661]
  - - [13312, 8976, 1, 256]
    - [13, 87.225]
  - - [13568, 8976, 1, 256]
    - [13, 87.487]
  - - [13824, 8976, 1, 256]
    - [13, 87.293]
  - - [15104, 8976, 1, 256]
    - [13, 87.518]
  - - [15360, 8976, 1, 256]
    - [13, 87.234]
  - - [15872, 8976, 1, 256]
    - [13, 87.451]
  - - [16128, 8976, 1, 256]
    - [13, 87.649]
  - - [17152, 8976, 1, 256]
    - [13, 87.735]
  - - [1792, 8976, 1, 256]
    - [49, 82.402]
  - - [18176, 8976, 1, 256]
    - [13, 87.739]
  - - [18688, 8976, 1, 256]
    - [13, 87.789]
  - - [18944, 8976, 1, 256]
    - [13, 87.717]
  - - [19712, 8976, 1, 256]
    - [13, 87.712]
  - - [19968, 8976, 1, 256]
    - [13, 87.69]
  - - [20480, 8976, 1, 256]
    - [13, 87.487]
  - - [2048, 1536, 1, 512]
    - [15, 72.697]
  - - [2048, 1536, 1, 768]
    - [32, 76.911]
  - - [2048, 684, 1, 512]
    - [29, 62.208]
  - - [2048, 684, 1, 768]
    - [29, 63.665]
  - - [2048, 8976, 1, 256]
    - [30, 84.089]
  - - [20992, 8976, 1, 256]
    - [13, 87.735]
  - - [21248, 8976, 1, 256]
    - [13, 87.73]
  - - [2304, 8976, 1, 256]
    - [24, 83.706]
  - - [23552, 8976, 1, 256]
    - [13, 87.609]
  - - [2560, 8976, 1, 256]
    - [30, 84.414]
  - - [256, 10496, 1, 1024]
    - [49, 75.071]
  - - [256, 11264, 1, 1024]
    - [49, 81.459]
  - - [256, 11520, 1, 1024]
    - [14, 77.178]
  - - [256, 11776, 1, 1024]
    - [51, 74.809]
  - - [256, 12544, 1, 1024]
    - [51, 79.388]
  - - [256, 13312, 1, 1024]
    - [32, 83.738]
  - - [256, 14336, 1, 1024]
    - [30, 76.0]
  - - [256, 14592, 1, 1024]
    - [30, 77.421]
  - - [256, 14848, 1, 1024]
    - [30, 78.693]
  - - [256, 15104, 1, 1024]
    - [49, 80.015]
  - - [256, 16128, 1, 1024]
    - [14, 77.773]
  - - [256, 18176, 1, 1024]
    - [32, 86.625]
  - - [256, 18944, 1, 1024]
    - [49, 79.054]
  - - [256, 19200, 1, 1024]
    - [49, 80.101]
  - - [256, 20480, 1, 1024]
    - [49, 85.258]
  - - [256, 20992, 1, 1024]
    - [51, 80.927]
  - - [256, 21248, 1, 1024]
    - [51, 81.996]
  - - [256, 21504, 1, 1024]
    - [32, 82.894]
  - - [256, 22016, 1, 1024]
    - [51, 84.712]
  - - [256, 22344, 1, 1024]
    - [32, 84.166]
  - - [256, 23296, 1, 1024]
    - [30, 80.142]
  - - [256, 23552, 1, 1024]
    - [30, 80.895]
  - - [256, 31488, 1, 1024]
    - [32, 85.096]
  - - [256, 33536, 1, 1024]
    - [49, 84.103]
  - - [256, 44505, 1, 1024]
    - [51, 83.453]
  - - [256, 4608, 1, 1024]
    - [32, 72.336]
  - - [256, 4864, 1, 1024]
    - [45, 59.848]
  - - [256, 5376, 1, 1024]
    - [48, 64.098]
  - - [256, 5888, 1, 1024]
    - [49, 67.942]
  - - [256, 6144, 1, 1024]
    - [13, 70.784]
  - - [256, 6400, 1, 1024]
    - [30, 73.505]
  - - [256, 6656, 1, 1024]
    - [13, 76.311]
  - - [256, 7168, 1, 1024]
    - [51, 67.965]
  - - [256, 7424, 1, 1024]
    - [32, 70.356]
  - - [256, 7936, 1, 1024]
    - [32, 74.755]
  - - [256, 8192, 1, 1024]
    - [32, 76.69]
  - - [256, 8448, 1, 1024]
    - [32, 79.339]
  - - [256, 8960, 1, 1024]
    - [51, 83.507]
  - - [256, 9984, 1, 1024]
    - [49, 72.684]
  - - [2816, 8976, 1, 256]
    - [49, 84.446]
  - - [28672, 8976, 1, 256]
    - [13, 87.767]
  - - [3072, 8976, 1, 256]
    - [30, 84.847]
  - - [31488, 8976, 1, 256]
    - [13, 88.024]
  - - [3328, 8976, 1, 256]
    - [49, 85.023]
  - - [33536, 8976, 1, 256]
    - [13, 88.091]
  - - [3840, 8976, 1, 256]
    - [30, 84.866]
  - - [4096, 8976, 1, 256]
    - [30, 84.505]
  - - [4352, 8976, 1, 256]
    - [13, 85.466]
  - - [44505, 8976, 1, 256]
    - [13, 87.924]
  - - [4608, 8976, 1, 256]
    - [30, 85.272]
  - - [4864, 8976, 1, 256]
    - [30, 85.614]
  - - [5120, 8976, 1, 256]
    - [13, 83.819]
  - - [5376, 8976, 1, 256]
    - [41, 85.89]
  - - [5632, 8976, 1, 256]
    - [30, 85.799]
  - - [5888, 8976, 1, 256]
    - [13, 86.052]
  - - [6144, 8976, 1, 256]
    - [13, 84.947]
  - - [6400, 8976, 1, 256]
    - [13, 86.314]
  - - [684, 8976, 1, 256]
    - [49, 69.548]
  - - [7168, 8976, 1, 256]
    - [13, 85.727]
  - - [7936, 8976, 1, 256]
    - [13, 86.548]
  - - [8192, 8976, 1, 256]
    - [5, 84.568]
  - - [8448, 8976, 1, 256]
    - [13, 86.941]
  - - [8960, 8976, 1, 256]
    - [13, 86.982]
  - - [9472, 8976, 1, 256]
    - [13, 86.991]
  - - [9728, 8976, 1, 256]
    - [13, 86.932]
  - - [9984, 8976, 1, 256]
    - [13, 87.036]
  - - [512, 32768, 1, 13]
    - [36, 29.164]
  - - [256, 32768, 1, 512]
    - [49, 81.983]
  - - [128, 32768, 1, 512]
    - [15, 76.699]
  - - [1024, 32768, 1, 479]
    - [1, 89.03]
  - - [1024, 32768, 1, 1024]
    - [30, 88.028]
  - - [512, 32768, 1, 1024]
    - [49, 86.684]
  - - [1023, 2048, 1, 4096]
    - [32, 78.378]
  - - [1025, 2048, 1, 4096]
    - [32, 78.878]
  - - [1024, 2047, 1, 4096]
    - [15, 78.527]
  - - [1024, 2049, 1, 4096]
    - [15, 78.73]
  - - [1024, 2048, 1, 4095]
    - [24, 79.497]
  - - [1024, 2048, 1, 4097]
    - [24, 79.433]
  - - [1023, 3072, 1, 1024]
    - [32, 76.456]
  - - [1025, 3072, 1, 1024]
    - [32, 77.092]
  - - [1024, 3071, 1, 1024]
    - [32, 76.135]
  - - [1024, 3073, 1, 1024]
    - [15, 76.469]
  - - [1024, 3072, 1, 1023]
    - [1, 77.868]
  - - [1024, 3072, 1, 1025]
    - [24, 77.963]
  - - [3071, 512, 1, 1024]
    - [13, 68.235]
  - - [3073, 512, 1, 1024]
    - [49, 68.177]
  - - [3072, 511, 1, 1024]
    - [49, 68.344]
  - - [3072, 513, 1, 1024]
    - [48, 61.368]
  - - [3072, 512, 1, 1023]
    - [37, 73.225]
  - - [3072, 512, 1, 1025]
    - [18, 72.431]
  - - [128, 32768, 1, 256]
    - [30, 73.18]
  - - [1024, 4096, 1, 480]
    - [1, 78.305]
  - - [512, 4096, 1, 1024]
    - [32, 77.191]
  - - [512, 55296, 1, 13]
    - [39, 30.603]
  - - [256, 55296, 1, 512]
    - [49, 86.345]
  - - [128, 55296, 1, 256]
    - [30, 81.879]
  - - [1024, 6912, 1, 480]
    - [1, 88.633]
  - - [1024, 6912, 1, 1024]
    - [32, 88.425]
  - - [512, 6912, 1, 1024]
    - [15, 86.49]
  - - [256, 6912, 1, 512]
    - [10, 74.317]
  - - [1151, 1152, 1, 1152]
    - [48, 60.728]
  - - [1153, 1152, 1, 1152]
    - [46, 60.516]
  - - [1152, 1151, 1, 1152]
    - [40, 61.183]
  - - [1152, 1153, 1, 1152]
    - [21, 61.486]
  - - [1152, 1152, 1, 1151]
    - [17, 68.533]
  - - [1152, 1152, 1, 1153]
    - [17, 68.804]
  - - [1535, 1536, 1, 1536]
    - [15, 85.267]
  - - [1537, 1536, 1, 1536]
    - [49, 66.742]
  - - [1536, 1535, 1, 1536]
    - [51, 84.216]
  - - [1536, 1537, 1, 1536]
    - [49, 66.904]
  - - [1536, 1536, 1, 1535]
    - [24, 86.918]
  - - [1536, 1536, 1, 1537]
    - [7, 86.729]
  - - [1919, 1920, 1, 1920]
    - [5, 76.726]
  - - [1921, 1920, 1, 1920]
    - [49, 76.69]
  - - [1920, 1919, 1, 1920]
    - [41, 76.753]
  - - [1920, 1921, 1, 1920]
    - [41, 76.713]
  - - [1920, 1920, 1, 1919]
    - [37, 79.749]
  - - [1920, 1920, 1, 1921]
    - [18, 79.492]
  - - [2303, 2304, 1, 2304]
    - [32, 81.148]
  - - [2305, 2304, 1, 2304]
    - [51, 81.36]
  - - [2304, 2303, 1, 2304]
    - [32, 80.823]
  - - [2304, 2305, 1, 2304]
    - [51, 81.301]
  - - [2304, 2304, 1, 2303]
    - [19, 83.963]
  - - [2304, 2304, 1, 2305]
    - [38, 83.828]
  - - [2687, 2688, 1, 2688]
    - [22, 83.11]
  - - [2689, 2688, 1, 2688]
    - [41, 83.101]
  - - [2688, 2687, 1, 2688]
    - [41, 83.147]
  - - [2688, 2689, 1, 2688]
    - [41, 83.106]
  - - [2688, 2688, 1, 2687]
    - [37, 85.998]
  - - [2688, 2688, 1, 2689]
    - [37, 85.772]
  - - [3455, 3456, 1, 3456]
    - [41, 86.142]
  - - [3457, 3456, 1, 3456]
    - [24, 84.699]
  - - [3456, 3455, 1, 3456]
    - [22, 86.219]
  - - [3456, 3457, 1, 3456]
    - [24, 84.117]
  - - [3456, 3456, 1, 3455]
    - [37, 88.971]
  - - [3456, 3456, 1, 3457]
    - [18, 88.858]
  - - [3839, 3840, 1, 3840]
    - [15, 87.23]
  - - [3841, 3840, 1, 3840]
    - [7, 87.252]
  - - [3840, 3839, 1, 3840]
    - [32, 87.252]
  - - [3840, 3841, 1, 3840]
    - [41, 85.763]
  - - [3840, 3840, 1, 3839]
    - [3, 87.415]
  - - [3840, 3840, 1, 3841]
    - [24, 87.261]
  - - [4223, 4224, 1, 4224]
    - [22, 87.622]
  - - [4225, 4224, 1, 4224]
    - [22, 85.019]
  - - [4224, 4223, 1, 4224]
    - [5, 87.649]
  - - [4224, 4225, 1, 4224]
    - [24, 87.437]
  - - [4224, 4224, 1, 4223]
    - [18, 90.397]
  - - [4224, 4224, 1, 4225]
    - [18, 90.338]
  - - [4607, 4608, 1, 4608]
    - [32, 91.953]
  - - [4609, 4608, 1, 4608]
    - [32, 87.46]
  - - [4608, 4607, 1, 4608]
    - [51, 91.935]
  - - [4608, 4609, 1, 4608]
    - [32, 87.315]
  - - [4608, 4608, 1, 4607]
    - [24, 92.332]
  - - [4608, 4608, 1, 4609]
    - [24, 92.319]
  - - [4991, 4992, 1, 4992]
    - [24, 88.813]
  - - [4993, 4992, 1, 4992]
    - [22, 86.485]
  - - [4992, 4991, 1, 4992]
    - [24, 88.831]
  - - [4992, 4993, 1, 4992]
    - [7, 88.908]
  - - [4992, 4992, 1, 4991]
    - [18, 91.218]
  - - [4992, 4992, 1, 4993]
    - [18, 91.096]
  - - [5375, 5376, 1, 5376]
    - [7, 90.726]
  - - [5377, 5376, 1, 5376]
    - [24, 87.451]
  - - [5376, 5375, 1, 5376]
    - [7, 90.613]
  - - [5376, 5377, 1, 5376]
    - [51, 86.954]
  - - [5376, 5376, 1, 5375]
    - [24, 90.604]
  - - [5376, 5376, 1, 5377]
    - [24, 90.595]
  - - [5759, 5760, 1, 5760]
    - [24, 89.607]
  - - [5761, 5760, 1, 5760]
    - [30, 87.446]
  - - [5760, 5759, 1, 5760]
    - [43, 89.562]
  - - [5760, 5761, 1, 5760]
    - [43, 89.585]
  - - [5760, 5760, 1, 5759]
    - [37, 90.284]
  - - [5760, 5760, 1, 5761]
    - [24, 89.413]
  - - [6143, 6144, 1, 6144]
    - [51, 88.931]
  - - [6145, 6144, 1, 6144]
    - [51, 87.875]
  - - [6144, 6143, 1, 6144]
    - [51, 88.615]
  - - [6144, 6145, 1, 6144]
    - [51, 85.082]
  - - [6144, 6144, 1, 6143]
    - [24, 92.08]
  - - [6144, 6144, 1, 6145]
    - [7, 92.066]
  - - [6527, 6528, 1, 6528]
    - [24, 89.526]
  - - [6529, 6528, 1, 6528]
    - [22, 88.123]
  - - [6528, 6527, 1, 6528]
    - [43, 89.467]
  - - [6528, 6529, 1, 6528]
    - [24, 89.558]
  - - [6528, 6528, 1, 6527]
    - [24, 89.228]
  - - [6528, 6528, 1, 6529]
    - [7, 89.219]
  - - [6911, 6912, 1, 6912]
    - [32, 91.498]
  - - [6913, 6912, 1, 6912]
    - [24, 89.504]
  - - [6912, 6911, 1, 6912]
    - [32, 91.57]
  - - [6912, 6913, 1, 6912]
    - [30, 88.123]
  - - [6912, 6912, 1, 6911]
    - [24, 91.547]
  - - [6912, 6912, 1, 6913]
    - [7, 91.561]
  - - [7295, 7296, 1, 7296]
    - [30, 89.571]
  - - [7297, 7296, 1, 7296]
    - [24, 88.845]
  - - [7296, 7295, 1, 7296]
    - [41, 89.621]
  - - [7296, 7297, 1, 7296]
    - [43, 89.648]
  - - [7296, 7296, 1, 7295]
    - [37, 90.162]
  - - [7296, 7296, 1, 7297]
    - [5, 89.49]
  - - [7679, 7680, 1, 7680]
    - [51, 91.981]
  - - [7681, 7680, 1, 7680]
    - [51, 89.44]
  - - [7680, 7679, 1, 7680]
    - [51, 91.845]
  - - [7680, 7681, 1, 7680]
    - [51, 88.461]
  - - [7680, 7680, 1, 7679]
    - [7, 92.296]
  - - [7680, 7680, 1, 7681]
    - [24, 92.319]
  - - [1152, 1152, 1, 1152]
    - [40, 61.093]
  - - [1536, 1536, 1, 1536]
    - [32, 86.49]
  - - [1920, 1920, 1, 1920]
    - [18, 77.331]
  - - [2304, 2304, 1, 2304]
    - [51, 81.653]
  - - [2688, 2688, 1, 2688]
    - [22, 83.129]
  - - [3456, 3456, 1, 3456]
    - [41, 86.16]
  - - [3840, 3840, 1, 3840]
    - [51, 87.234]
  - - [4224, 4224, 1, 4224]
    - [41, 87.708]
  - - [4608, 4608, 1, 4608]
    - [32, 92.152]
  - - [4992, 4992, 1, 4992]
    - [24, 88.822]
  - - [5376, 5376, 1, 5376]
    - [7, 90.618]
  - - [5760, 5760, 1, 5760]
    - [7, 89.576]
  - - [6144, 6144, 1, 6144]
    - [51, 88.601]
  - - [6528, 6528, 1, 6528]
    - [43, 89.571]
  - - [6912, 6912, 1, 6912]
    - [51, 91.57]
  - - [7296, 7296, 1, 7296]
    - [13, 89.616]
  - - [7680, 7680, 1, 7680]
    - [51, 91.777]
  - - [256, 128, 49, 1152]
    - [13, 70.721]
  - - [256, 128, 121, 120]
    - [2, 68.276]
  - - [256, 128, 169, 120]
    - [26, 72.526]
  - - [256, 128, 36, 120]
    - [17, 55.057]
  - - [256, 128, 49, 120]
    - [17, 58.188]
  - - [256, 128, 64, 120]
    - [18, 61.91]
  - - [256, 128, 36, 12000]
    - [19, 73.428]
  - - [256, 128, 49, 1216]
    - [18, 74.286]
  - - [256, 128, 121, 18]
    - [8, 25.356]
  - - [256, 128, 169, 18]
    - [4, 31.275]
  - - [256, 128, 36, 18]
    - [0, 18.71]
  - - [256, 128, 49, 18]
    - [0, 21.733]
  - - [256, 128, 64, 18]
    - [8, 23.921]
  - - [256, 128, 36, 1800]
    - [47, 79.226]
  - - [256, 128, 121, 19]
    - [4, 29.15]
  - - [256, 128, 169, 19]
    - [4, 32.471]
  - - [256, 128, 36, 19]
    - [8, 19.297]
  - - [256, 128, 49, 19]
    - [8, 22.712]
  - - [256, 128, 64, 19]
    - [0, 24.9]
  - - [256, 128, 36, 1900]
    - [19, 79.361]
  - - [256, 128, 49, 480]
    - [37, 71.078]
  - - [256, 128, 81, 480]
    - [22, 73.076]
  - - [256, 128, 64, 5880]
    - [23, 64.897]
  - - [256, 128, 49, 72]
    - [36, 46.159]
  - - [256, 128, 81, 72]
    - [38, 53.288]
  - - [256, 128, 49, 76]
    - [0, 47.545]
  - - [256, 128, 81, 76]
    - [36, 49.895]
  - - [256, 128, 49, 7680]
    - [35, 54.145]
  - - [256, 128, 64, 882]
    - [18, 74.272]
  - - [256, 128, 64, 931]
    - [37, 75.314]
  - - [256, 256, 49, 1152]
    - [15, 78.454]
  - - [256, 256, 36, 12000]
    - [7, 89.07]
  - - [256, 256, 49, 1216]
    - [7, 79.023]
  - - [256, 256, 36, 1800]
    - [7, 85.872]
  - - [256, 256, 36, 1900]
    - [43, 86.048]
  - - [256, 256, 64, 5880]
    - [24, 80.552]
  - - [256, 256, 49, 7680]
    - [34, 64.847]
  - - [256, 256, 64, 882]
    - [1, 77.308]
  - - [256, 256, 64, 931]
    - [1, 77.277]
  - - [340, 256, 49, 1152]
    - [49, 68.461]
  - - [340, 256, 36, 120]
    - [36, 57.822]
  - - [340, 256, 49, 120]
    - [38, 62.307]
  - - [340, 256, 64, 120]
    - [38, 65.339]
  - - [340, 256, 36, 12000]
    - [24, 79.848]
  - - [340, 256, 49, 1216]
    - [1, 69.963]
  - - [340, 256, 36, 18]
    - [36, 19.017]
  - - [340, 256, 49, 18]
    - [19, 23.659]
  - - [340, 256, 64, 18]
    - [45, 24.693]
  - - [340, 256, 36, 1800]
    - [7, 77.313]
  - - [340, 256, 36, 19]
    - [25, 19.955]
  - - [340, 256, 49, 19]
    - [25, 24.278]
  - - [340, 256, 64, 19]
    - [25, 25.87]
  - - [340, 256, 36, 1900]
    - [7, 77.272]
  - - [340, 256, 64, 5880]
    - [18, 77.529]
  - - [340, 256, 49, 7680]
    - [16, 58.905]
  - - [340, 256, 64, 882]
    - [18, 74.809]
  - - [340, 256, 64, 931]
    - [37, 74.705]
  - - [510, 256, 49, 120]
    - [47, 64.549]
  - - [510, 256, 64, 120]
    - [19, 68.835]
  - - [510, 256, 49, 18]
    - [38, 19.4]
  - - [510, 256, 64, 18]
    - [36, 20.303]
  - - [510, 256, 49, 19]
    - [25, 20.176]
  - - [510, 256, 64, 19]
    - [17, 21.345]
  - - [510, 256, 36, 480]
    - [1, 83.72]
  - - [510, 256, 36, 72]
    - [19, 51.131]
  - - [510, 256, 36, 76]
    - [50, 50.617]
  - - [510, 512, 36, 1080]
    - [37, 88.673]
  - - [510, 512, 36, 162]
    - [38, 73.216]
  - - [510, 512, 36, 171]
    - [13, 74.674]
  - - [510, 512, 49, 1920]
    - [51, 88.015]
  - - [510, 512, 64, 1920]
    - [22, 86.797]
  - - [510, 512, 49, 288]
    - [22, 82.921]
  - - [510, 512, 64, 288]
    - [1, 84.554]
  - - [510, 512, 36, 3000]
    - [24, 90.072]
  - - [510, 512, 49, 304]
    - [37, 82.925]
  - - [510, 512, 64, 304]
    - [18, 84.793]
  - - [510, 512, 36, 450]
    - [22, 83.562]
  - - [510, 512, 36, 475]
    - [41, 84.432]
  - - [510, 512, 49, 480]
    - [1, 87.36]
  - - [510, 512, 64, 480]
    - [1, 85.745]
  - - [510, 512, 49, 72]
    - [19, 64.062]
  - - [510, 512, 64, 72]
    - [50, 66.318]
  - - [510, 512, 49, 76]
    - [23, 67.166]
  - - [510, 512, 64, 76]
    - [23, 69.02]
  - - [512, 256, 81, 1080]
    - [37, 88.543]
  - - [512, 256, 25, 12000]
    - [7, 83.864]
  - - [512, 256, 81, 162]
    - [1, 79.086]
  - - [512, 256, 81, 171]
    - [5, 81.698]
  - - [512, 256, 25, 1800]
    - [7, 81.41]
  - - [512, 256, 25, 1900]
    - [43, 81.604]
  - - [512, 256, 121, 1920]
    - [5, 87.365]
  - - [512, 256, 169, 1920]
    - [32, 89.287]
  - - [512, 256, 49, 1920]
    - [41, 83.986]
  - - [512, 256, 121, 288]
    - [22, 79.442]
  - - [512, 256, 169, 288]
    - [5, 79.415]
  - - [512, 256, 49, 288]
    - [1, 84.297]
  - - [512, 256, 25, 3000]
    - [7, 82.474]
  - - [512, 256, 81, 3000]
    - [7, 91.096]
  - - [512, 256, 121, 304]
    - [22, 82.001]
  - - [512, 256, 169, 304]
    - [5, 79.654]
  - - [512, 256, 49, 304]
    - [1, 84.378]
  - - [512, 256, 25, 450]
    - [1, 77.611]
  - - [512, 256, 81, 450]
    - [5, 84.681]
  - - [512, 256, 25, 475]
    - [37, 76.916]
  - - [512, 256, 81, 475]
    - [1, 84.342]
  - - [512, 256, 121, 480]
    - [41, 85.457]
  - - [512, 256, 169, 480]
    - [41, 86.291]
  - - [512, 256, 49, 5880]
    - [37, 88.479]
  - - [512, 256, 121, 72]
    - [1, 75.499]
  - - [512, 256, 169, 72]
    - [9, 78.229]
  - - [512, 256, 121, 76]
    - [19, 72.743]
  - - [512, 256, 169, 76]
    - [13, 74.935]
  - - [512, 256, 49, 882]
    - [1, 85.66]
  - - [512, 256, 49, 931]
    - [1, 85.971]
  - - [2304, 512, 1, 100]
    - [38, 51.375]
  - - [2304, 512, 1, 361]
    - [38, 73.5]
  - - [4608, 510, 1, 100]
    - [0, 58.711]
  - - [4608, 510, 1, 361]
    - [1, 75.228]
  - - [8192, 7680, 1, 8192]
    - [32, 81.937]
  - - [4096, 3840, 1, 4096]
    - [15, 84.432]
  - - [2048, 1920, 1, 2048]
    - [13, 81.211]
  - - [30522, 616, 1, 1024]
    - [13, 82.619]
  - - [128, 128, 128, 64]
    - [19, 47.757]
  - - [128, 128, 160, 64]
    - [6, 50.396]
  - - [1024, 1280, 1, 1024]
    - [29, 60.895]
  - - [1024, 1280, 1, 4096]
    - [30, 60.651]
  - - [4096, 1280, 1, 1024]
    - [13, 84.211]
  - - [30522, 200, 1, 1024]
    - [15, 64.179]
  - - [128, 128, 624, 64]
    - [27, 61.197]
  - - [1024, 4992, 1, 1024]
    - [30, 82.479]
  - - [1024, 4992, 1, 4096]
    - [32, 78.883]
  - - [4096, 4992, 1, 1024]
    - [13, 87.622]
  - - [30522, 780, 1, 1024]
    - [13, 76.28]
  - - [30522, 308, 1, 1024]
    - [13, 69.494]
  - - [128, 128, 640, 64]
    - [10, 64.698]
  - - [1024, 5120, 1, 1024]
    - [30, 84.496]
  - - [1024, 5120, 1, 4096]
    - [32, 80.918]
  - - [4096, 5120, 1, 1024]
    - [15, 88.669]
  - - [30522, 800, 1, 1024]
    - [13, 78.148]
  - - [128, 128, 656, 64]
    - [4, 61.332]
  - - [1024, 5248, 1, 1024]
    - [32, 80.169]
  - - [1024, 5248, 1, 4096]
    - [51, 82.551]
  - - [4096, 5248, 1, 1024]
    - [13, 87.568]
  - - [30522, 820, 1, 1024]
    - [13, 80.006]
  - - [512, 512, 80, 64]
    - [38, 77.994]
  - - [1024, 2560, 1, 1024]
    - [30, 74.128]
  - - [1024, 2560, 1, 4096]
    - [13, 72.21]
  - - [4096, 2560, 1, 1024]
    - [15, 87.947]
  - - [30522, 385, 1, 1024]
    - [13, 65.082]
  - - [30522, 462, 1, 1024]
    - [13, 77.732]
  - - [128, 128, 144, 64]
    - [50, 46.092]
  - - [1024, 1152, 1, 1024]
    - [13, 73.234]
  - - [1024, 1152, 1, 4096]
    - [30, 76.848]
  - - [4096, 1152, 1, 1024]
    - [13, 84.369]
  - - [30522, 180, 1, 1024]
    - [12, 65.776]
  - - [1024, 8192, 1, 1024]
    - [30, 82.551]
  - - [1024, 8192, 1, 4096]
    - [15, 79.023]
  - - [1024, 9600, 1, 1024]
    - [13, 85.605]
  - - [1024, 9600, 1, 4096]
    - [15, 82.402]
  - - [4096, 8192, 1, 1024]
    - [13, 87.794]
  - - [4096, 9600, 1, 1024]
    - [13, 86.905]
  - - [33712, 8192, 1, 1024]
    - [51, 90.952]
  - - [33712, 9600, 1, 1024]
    - [51, 89.63]
  - - [1024, 10064, 1, 1024]
    - [32, 86.192]
  - - [1024, 10064, 1, 4096]
    - [32, 86.242]
  - - [1024, 10080, 1, 1024]
    - [32, 86.314]
  - - [1024, 10080, 1, 4096]
    - [15, 85.899]
  - - [1024, 6528, 1, 1024]
    - [32, 82.407]
  - - [1024, 6528, 1, 4096]
    - [15, 84.527]
  - - [1024, 7104, 1, 1024]
    - [30, 81.364]
  - - [1024, 7104, 1, 4096]
    - [15, 80.327]
  - - [1024, 8064, 1, 1024]
    - [13, 86.395]
  - - [1024, 8064, 1, 4096]
    - [15, 79.248]
  - - [1024, 9216, 1, 1024]
    - [32, 88.691]
  - - [1024, 9216, 1, 4096]
    - [15, 88.538]
  - - [4096, 10064, 1, 1024]
    - [13, 86.431]
  - - [4096, 10080, 1, 1024]
    - [13, 86.472]
  - - [4096, 6528, 1, 1024]
    - [13, 87.297]
  - - [4096, 7104, 1, 1024]
    - [15, 87.293]
  - - [4096, 8064, 1, 1024]
    - [13, 87.685]
  - - [4096, 9216, 1, 1024]
    - [13, 87.252]
  - - [42720, 10080, 1, 1024]
    - [51, 90.099]
  - - [42720, 6528, 1, 1024]
    - [49, 89.833]
  - - [42720, 7104, 1, 1024]
    - [51, 90.0]
  - - [1024, 32768, 1, 480]
    - [1, 91.277]
  - - [30592, 1024, 1, 2048]
    - [49, 87.983]
  - - [6144, 1024, 1, 2048]
    - [13, 84.351]
  - - [8192, 1024, 1, 2048]
    - [13, 83.557]
  - - [30592, 8192, 1, 1024]
    - [51, 91.01]
  - - [3072, 8192, 1, 1024]
    - [30, 88.168]
  - - [512, 512, 256, 64]
    - [265, 58.96]
  - - [30592, 2048, 1, 1024]
    - [51, 89.467]
  - - [30592, 4096, 1, 1024]
    - [51, 90.618]
  - - [3072, 4096, 1, 1024]
    - [32, 87.203]
  - - [1920, 2048, 1, 2560]
    - [13, 81.987]
  - - [2560, 2048, 1, 2560]
    - [30, 85.858]
  - - [2560, 2048, 1, 640]
    - [41, 84.708]
  - - [7680, 2048, 1, 2560]
    - [13, 87.943]
  - - [512, 512, 40, 64]
    - [38, 74.064]
  - - [1536, 4096, 1, 1536]
    - [30, 84.572]
  - - [1536, 4096, 1, 6144]
    - [13, 82.795]
  - - [4608, 4096, 1, 1536]
    - [32, 91.385]
  - - [50304, 4096, 1, 1536]
    - [32, 91.759]
  - - [6144, 4096, 1, 1536]
    - [13, 88.276]
  - - [1024, 1024, 64, 96]
    - [0, 64.206]
  - - [1536, 8192, 1, 1536]
    - [32, 88.331]
  - - [1536, 8192, 1, 6144]
    - [32, 88.349]
  - - [4608, 8192, 1, 1536]
    - [32, 91.155]
  - - [50304, 8192, 1, 1536]
    - [32, 91.863]
  - - [6144, 8192, 1, 1536]
    - [15, 89.472]
  - - [1024, 1024, 128, 96]
    - [0, 62.767]
  - - [1024, 16384, 1, 1024]
    - [30, 86.851]
  - - [1024, 16384, 1, 4096]
    - [32, 85.235]
  - - [3072, 16384, 1, 1024]
    - [30, 88.173]
  - - [4096, 16384, 1, 1024]
    - [13, 87.78]
  - - [50304, 16384, 1, 1024]
    - [51, 91.398]
  - - [1024, 1024, 256, 64]
    - [12, 48.235]
  - - [50304, 2048, 1, 1024]
    - [51, 90.767]
  - - [1024, 1024, 32, 64]
    - [0, 72.53]
  - - [50304, 4096, 1, 1024]
    - [51, 91.236]
  - - [1024, 1024, 64, 64]
    - [0, 58.81]
  - - [50304, 8192, 1, 1024]
    - [51, 91.426]
  - - [1024, 1024, 128, 64]
    - [0, 50.4]
  - - [30528, 8192, 1, 1024]
    - [51, 90.871]
  - - [128, 128, 1024, 64]
    - [14, 68.461]
  - - [1024, 3456, 1, 1024]
    - [30, 82.56]
  - - [1024, 3456, 1, 480]
    - [1, 85.669]
  - - [512, 3456, 1, 1024]
    - [14, 76.131]
  - - [512, 3456, 1, 13]
    - [31, 19.008]
  - - [512, 4096, 1, 13]
    - [31, 20.637]
  - - [512, 6912, 1, 13]
    - [36, 23.375]
  - - [30528, 640, 1, 1024]
    - [13, 86.165]
  - - [30528, 1280, 1, 1024]
    - [13, 88.38]
  - - [30528, 1600, 1, 1024]
    - [13, 85.285]
  - - [1024, 10240, 1, 1024]
    - [32, 88.051]
  - - [4096, 10240, 1, 1024]
    - [13, 87.555]
  - - [1024, 10240, 1, 4096]
    - [32, 86.986]
  - - [128, 128, 1280, 64]
    - [0, 31.541]
  - - [1024, 10496, 1, 4096]
    - [15, 82.786]
  - - [30528, 1640, 1, 1024]
    - [13, 87.527]
  - - [4096, 10496, 1, 1024]
    - [13, 87.203]
  - - [1024, 10496, 1, 1024]
    - [13, 84.324]
  - - [128, 128, 1312, 64]
    - [0, 34.086]
  - - [30528, 160, 1, 1024]
    - [12, 59.32]
  - - [30528, 240, 1, 1024]
    - [30, 76.803]
  - - [1024, 6144, 1, 1024]
    - [30, 83.435]
  - - [4096, 6144, 1, 1024]
    - [13, 87.988]
  - - [1024, 6144, 1, 4096]
    - [32, 81.256]
  - - [512, 512, 192, 64]
    - [265, 64.719]
  - - [1024, 10224, 1, 1024]
    - [32, 87.329]
  - - [1024, 10192, 1, 1024]
    - [32, 87.6]
  - - [1024, 10208, 1, 1024]
    - [32, 87.87]
  - - [1024, 10224, 1, 4096]
    - [32, 87.604]
  - - [4096, 10224, 1, 1024]
    - [13, 87.13]
  - - [3072, 10224, 1, 1024]
    - [30, 87.487]
  - - [3072, 10240, 1, 1024]
    - [30, 87.406]
  - - [1024, 10192, 1, 4096]
    - [32, 86.914]
  - - [4096, 10192, 1, 1024]
    - [13, 87.171]
  - - [3072, 10192, 1, 1024]
    - [30, 86.837]
  - - [3072, 10200, 1, 1024]
    - [32, 87.23]
  - - [1024, 10184, 1, 1024]
    - [32, 87.049]
  - - [3072, 10208, 1, 1024]
    - [30, 87.176]
  - - [1024, 10208, 1, 4096]
    - [15, 84.396]
  - - [4096, 10208, 1, 1024]
    - [13, 86.828]
  - - [2048, 10224, 1, 1024]
    - [15, 88.759]
  - - [2048, 10240, 1, 1024]
    - [15, 89.355]
  - - [1024, 10120, 1, 1024]
    - [32, 86.684]
  - - [2048, 10192, 1, 1024]
    - [15, 88.534]
  - - [1024, 10152, 1, 1024]
    - [32, 86.842]
  - - [3072, 10080, 1, 1024]
    - [13, 87.279]
  - - [256, 256, 25, 12544]
    - [13, 69.138]
  - - [256, 256, 49, 3200]
    - [32, 77.399]
  - - [256, 256, 25, 6272]
    - [30, 74.164]
  - - [256, 256, 49, 6400]
    - [32, 70.27]
  - - [512, 512, 49, 1152]
    - [24, 87.92]
  - - [512, 512, 25, 2048]
    - [13, 69.264]
  - - [512, 512, 49, 2304]
    - [51, 89.526]
  - - [512, 512, 25, 4096]
    - [53, 65.943]
  - - [128, 128, 2048, 64]
    - [252, 34.519]
  - - [30528, 2560, 1, 1024]
    - [13, 89.377]
  - - [128, 128, 1536, 64]
    - [251, 38.611]
  - - [1024, 12288, 1, 1024]
    - [32, 87.243]
  - - [1024, 12288, 1, 4096]
    - [32, 86.855]
  - - [30528, 1920, 1, 1024]
    - [13, 89.007]
  - - [4096, 12288, 1, 1024]
    - [13, 87.207]
  - - [128, 128, 81, 12544]
    - [33, 47.626]
  - - [128, 128, 121, 9216]
    - [52, 40.957]
  - - [128, 128, 169, 6400]
    - [52, 50.915]
  - - [256, 256, 36, 4096]
    - [34, 57.024]
  - - [256, 256, 49, 2304]
    - [15, 74.637]
  - - [256, 256, 64, 2304]
    - [51, 72.048]
  - - [256, 256, 81, 4096]
    - [53, 53.847]
  - - [256, 256, 121, 2304]
    - [32, 74.29]
  - - [256, 256, 169, 2304]
    - [32, 75.179]
  - - [512, 512, 81, 1024]
    - [49, 76.911]
  - - [512, 512, 121, 1024]
    - [13, 77.498]
  - - [512, 512, 169, 1024]
    - [49, 78.806]
  - - [512, 512, 36, 1024]
    - [13, 74.191]
  - - [512, 512, 49, 1024]
    - [30, 72.03]
  - - [512, 512, 64, 1024]
    - [30, 73.875]
  - - [128, 128, 192, 64]
    - [42, 46.723]
  - - [768, 2048, 1, 768]
    - [49, 69.819]
  - - [3072, 2048, 1, 768]
    - [30, 83.846]
  - - [768, 2048, 1, 3072]
    - [49, 72.237]
  - - [384, 384, 144, 64]
    - [18, 80.042]
  - - [768, 4608, 1, 768]
    - [32, 85.727]
  - - [3072, 4608, 1, 768]
    - [15, 89.481]
  - - [768, 4608, 1, 3072]
    - [32, 89.098]
  - - [512, 512, 48, 64]
    - [38, 76.587]
  - - [128, 128, 256, 64]
    - [21, 56.437]
  - - [384, 384, 192, 64]
    - [263, 69.034]
  - - [1024, 4608, 1, 1024]
    - [15, 86.002]
  - - [4096, 4608, 1, 1024]
    - [15, 90.108]
  - - [1024, 4608, 1, 4096]
    - [15, 89.968]
  - - [256, 256, 36, 432]
    - [1, 81.184]
  - - [256, 256, 36, 456]
    - [1, 82.38]
  - - [256, 256, 36, 504]
    - [1, 82.84]
  - - [256, 256, 49, 1120]
    - [37, 79.217]
  - - [256, 256, 36, 442]
    - [1, 78.572]
  - - [256, 256, 49, 950]
    - [18, 78.725]
  - - [256, 256, 64, 616]
    - [1, 78.287]
  - - [256, 256, 64, 660]
    - [1, 77.845]
  - - [256, 256, 36, 408]
    - [1, 81.116]
  - - [256, 256, 49, 1008]
    - [37, 79.767]
  - - [256, 256, 36, 462]
    - [1, 80.462]
  - - [256, 256, 36, 468]
    - [1, 81.292]
  - - [256, 256, 36, 494]
    - [1, 81.576]
  - - [512, 512, 64, 48]
    - [38, 73.577]
  - - [256, 256, 64, 140]
    - [38, 68.601]
  - - [512, 512, 64, 56]
    - [27, 77.042]
  - - [512, 512, 49, 90]
    - [19, 76.884]
  - - [512, 512, 49, 60]
    - [19, 72.201]
  - - [256, 256, 49, 864]
    - [43, 78.572]
  - - [256, 256, 64, 224]
    - [17, 74.263]
  - - [256, 256, 64, 176]
    - [1, 73.392]
  - - [256, 256, 64, 154]
    - [1, 70.527]
  - - [512, 512, 49, 80]
    - [1, 80.074]
  - - [256, 256, 49, 1200]
    - [18, 79.294]
  - - [256, 256, 64, 704]
    - [37, 77.755]
  - - [256, 256, 64, 768]
    - [51, 77.232]
  - - [256, 256, 49, 1160]
    - [20, 78.278]
  - - [256, 256, 49, 320]
    - [18, 73.406]
  - - [512, 512, 49, 70]
    - [19, 73.546]
  - - [256, 256, 49, 1240]
    - [24, 78.59]
  - - [256, 256, 36, 384]
    - [32, 74.642]
  - - [1024, 2048, 1, 888]
    - [24, 76.884]
  - - [1024, 2048, 1, 713]
    - [24, 75.955]
  - - [1024, 2048, 1, 660]
    - [20, 75.603]
  - - [1024, 2048, 1, 726]
    - [24, 75.72]
  - - [1024, 2048, 1, 672]
    - [24, 76.239]
  - - [1024, 2048, 1, 850]
    - [24, 76.451]
  - - [1024, 2048, 1, 805]
    - [24, 76.014]
  - - [1024, 2048, 1, 864]
    - [24, 77.15]
  - - [1024, 2048, 1, 768]
    - [32, 75.774]
  - - [1024, 2048, 1, 950]
    - [24, 76.956]
  - - [1024, 1024, 160, 96]
    - [0, 65.988]
  - - [2880, 16384, 1, 1920]
    - [7, 89.066]
  - - [1920, 16384, 1, 960]
    - [37, 91.421]
  - - [3840, 16384, 1, 1920]
    - [24, 91.516]
  - - [1920, 16384, 1, 3840]
    - [24, 91.308]
  - - [25216, 16384, 1, 1920]
    - [24, 92.071]
  - - [1024, 1024, 40, 96]
    - [0, 80.169]
  - - [2880, 4096, 1, 1920]
    - [22, 84.532]
  - - [1920, 4096, 1, 960]
    - [37, 86.58]
  - - [3840, 4096, 1, 1920]
    - [5, 88.06]
  - - [1920, 4096, 1, 3840]
    - [51, 86.963]
  - - [25216, 4096, 1, 1920]
    - [24, 91.737]
  - - [1024, 1024, 80, 96]
    - [0, 71.696]
  - - [2880, 8192, 1, 1920]
    - [24, 87.821]
  - - [1920, 8192, 1, 960]
    - [37, 90.731]
  - - [3840, 8192, 1, 1920]
    - [24, 90.988]
  - - [1920, 8192, 1, 3840]
    - [30, 88.326]
  - - [25216, 8192, 1, 1920]
    - [43, 91.922]
  - - [1024, 1024, 96, 96]
    - [0, 68.908]
  - - [1728, 16384, 1, 2304]
    - [43, 87.703]
  - - [2304, 16384, 1, 576]
    - [1, 91.723]
  - - [2304, 16384, 1, 2304]
    - [51, 92.053]
  - - [12672, 16384, 1, 2304]
    - [7, 92.084]
  - - [1024, 1024, 24, 96]
    - [9, 83.512]
  - - [1728, 4096, 1, 2304]
    - [13, 81.094]
  - - [2304, 4096, 1, 576]
    - [37, 90.343]
  - - [2304, 4096, 1, 2304]
    - [32, 91.182]
  - - [12672, 4096, 1, 2304]
    - [7, 90.659]
  - - [1024, 1024, 48, 96]
    - [0, 78.739]
  - - [1728, 8192, 1, 2304]
    - [13, 85.258]
  - - [2304, 8192, 1, 576]
    - [37, 91.34]
  - - [2304, 8192, 1, 2304]
    - [24, 91.538]
  - - [12672, 8192, 1, 2304]
    - [24, 91.732]
  - - [1024, 1024, 16, 96]
    - [1, 81.739]
  - - [1152, 4096, 1, 3072]
    - [32, 89.919]
  - - [3072, 4096, 1, 384]
    - [24, 85.384]
  - - [1536, 4096, 1, 3072]
    - [49, 84.572]
  - - [3072, 4096, 1, 1536]
    - [15, 88.218]
  - - [6400, 4096, 1, 3072]
    - [15, 89.034]
  - - [1024, 1024, 32, 96]
    - [0, 80.408]
  - - [1152, 8192, 1, 3072]
    - [51, 91.186]
  - - [3072, 8192, 1, 384]
    - [5, 87.388]
  - - [1536, 8192, 1, 3072]
    - [51, 88.687]
  - - [3072, 8192, 1, 1536]
    - [30, 88.213]
  - - [6400, 8192, 1, 3072]
    - [32, 90.835]
  - - [2048, 4096, 1, 2048]
    - [13, 83.318]
  - - [2048, 4096, 1, 4096]
    - [13, 82.704]
  - - [29000, 199, 1, 2048]
    - [51, 59.311]
  - - [29000, 221, 1, 2048]
    - [51, 61.387]
  - - [29000, 224, 1, 2048]
    - [32, 64.265]
  - - [29000, 229, 1, 2048]
    - [51, 63.706]
  - - [29000, 234, 1, 2048]
    - [51, 67.428]
  - - [29000, 242, 1, 2048]
    - [32, 70.387]
  - - [29000, 246, 1, 2048]
    - [51, 69.792]
  - - [29000, 247, 1, 2048]
    - [51, 69.968]
  - - [29000, 256, 1, 2048]
    - [32, 71.633]
  - - [29000, 262, 1, 2048]
    - [22, 50.125]
  - - [29000, 264, 1, 2048]
    - [30, 50.558]
  - - [29000, 265, 1, 2048]
    - [48, 50.355]
  - - [29000, 274, 1, 2048]
    - [48, 51.411]
  - - [29000, 277, 1, 2048]
    - [30, 52.747]
  - - [29000, 279, 1, 2048]
    - [30, 52.774]
  - - [29000, 288, 1, 2048]
    - [30, 55.156]
  - - [29000, 296, 1, 2048]
    - [30, 54.781]
  - - [29000, 315, 1, 2048]
    - [40, 59.302]
  - - [29000, 335, 1, 2048]
    - [30, 62.745]
  - - [4096, 4096, 1, 2048]
    - [13, 87.649]
  - - [29000, 2283, 1, 1024]
    - [13, 88.376]
  - - [29000, 2296, 1, 1024]
    - [15, 89.517]
  - - [29000, 2306, 1, 1024]
    - [13, 84.802]
  - - [29000, 2309, 1, 1024]
    - [13, 84.861]
  - - [29000, 2318, 1, 1024]
    - [13, 85.226]
  - - [29000, 2320, 1, 1024]
    - [13, 85.321]
  - - [29000, 2324, 1, 1024]
    - [13, 85.439]
  - - [29000, 2325, 1, 1024]
    - [13, 85.457]
  - - [29000, 2329, 1, 1024]
    - [13, 85.596]
  - - [29000, 2338, 1, 1024]
    - [13, 85.944]
  - - [29000, 2345, 1, 1024]
    - [13, 86.205]
  - - [29000, 2350, 1, 1024]
    - [13, 86.395]
  - - [29000, 2362, 1, 1024]
    - [13, 86.815]
  - - [29000, 2366, 1, 1024]
    - [13, 86.932]
  - - [29000, 2368, 1, 1024]
    - [13, 87.054]
  - - [29000, 2374, 1, 1024]
    - [13, 87.261]
  - - [29000, 2390, 1, 1024]
    - [13, 87.848]
  - - [512, 512, 320, 64]
    - [0, 47.824]
  - - [29000, 561, 1, 1024]
    - [13, 76.194]
  - - [29000, 574, 1, 1024]
    - [13, 77.872]
  - - [29000, 600, 1, 1024]
    - [13, 81.202]
  - - [29000, 608, 1, 1024]
    - [13, 82.325]
  - - [29000, 615, 1, 1024]
    - [13, 83.237]
  - - [29000, 622, 1, 1024]
    - [13, 84.189]
  - - [29000, 625, 1, 1024]
    - [13, 84.446]
  - - [29000, 626, 1, 1024]
    - [13, 84.816]
  - - [29000, 628, 1, 1024]
    - [13, 84.992]
  - - [29000, 636, 1, 1024]
    - [13, 85.885]
  - - [29000, 651, 1, 1024]
    - [15, 74.881]
  - - [29000, 658, 1, 1024]
    - [13, 75.292]
  - - [29000, 669, 1, 1024]
    - [15, 76.943]
  - - [29000, 670, 1, 1024]
    - [13, 76.893]
  - - [29000, 672, 1, 1024]
    - [15, 77.087]
  - - [29000, 684, 1, 1024]
    - [15, 78.599]
  - - [29000, 716, 1, 1024]
    - [15, 82.213]
  - - [29000, 730, 1, 1024]
    - [15, 83.638]
  - - [2560, 1024, 1, 2560]
    - [49, 74.895]
  - - [2560, 1024, 1, 4096]
    - [49, 73.821]
  - - [1024, 1024, 512, 64]
    - [12, 48.284]
  - - [1024, 32768, 1, 4096]
    - [32, 89.684]
  - - [3072, 32768, 1, 1024]
    - [30, 89.084]
  - - [4096, 32768, 1, 1024]
    - [13, 88.407]
  - - [50304, 32768, 1, 1024]
    - [51, 89.761]
  - - [1024, 1024, 24, 128]
    - [5, 83.756]
  - - [128, 1024, 24, 1024]
    - [51, 76.686]
  - - [4096, 256, 1, 12288]
    - [34, 62.406]
  - - [2048, 256, 1, 13312]
    - [56, 72.733]
  - - [4096, 256, 1, 15360]
    - [53, 62.239]
  - - [2048, 512, 1, 16640]
    - [67, 76.591]
  - - [4096, 256, 1, 14336]
    - [53, 62.551]
  - - [1024, 1024, 1, 8192]
    - [51, 74.078]
  - - [1024, 512, 1, 16384]
    - [56, 68.014]
  - - [4096, 256, 1, 9216]
    - [67, 64.36]
  - - [1024, 512, 1, 12288]
    - [56, 70.852]
  - - [4096, 200, 1, 12288]
    - [59, 49.124]
  - - [1024, 1024, 1, 13312]
    - [56, 75.49]
  - - [2048, 256, 1, 16384]
    - [67, 62.221]
  - - [2048, 512, 1, 16384]
    - [60, 67.13]
  - - [1024, 1024, 1, 8320]
    - [24, 74.218]
  - - [2048, 256, 1, 14336]
    - [60, 72.242]
  - - [4096, 200, 1, 16640]
    - [58, 59.031]
  - - [1024, 1024, 1, 16640]
    - [56, 76.537]
  - - [1024, 1024, 1, 14336]
    - [56, 75.725]
  - - [2048, 512, 1, 9216]
    - [32, 74.168]
  - - [1024, 1024, 1, 15360]
    - [56, 76.041]
  - - [2048, 512, 1, 8192]
    - [32, 74.078]
  - - [2048, 512, 1, 13312]
    - [60, 75.517]
  - - [1024, 1024, 1, 11264]
    - [56, 74.619]
  - - [1024, 512, 1, 16640]
    - [55, 73.428]
  - - [2048, 512, 1, 10240]
    - [51, 74.732]
  - - [2048, 256, 1, 16640]
    - [56, 73.297]
  - - [4096, 256, 1, 13312]
    - [66, 62.311]
  - - [4096, 200, 1, 15360]
    - [59, 50.067]
  - - [2048, 512, 1, 12288]
    - [56, 75.075]
  - - [4096, 256, 1, 8192]
    - [51, 73.879]
  - - [2048, 512, 1, 15360]
    - [67, 73.464]
  - - [2048, 512, 1, 11264]
    - [56, 74.737]
  - - [2048, 256, 1, 12288]
    - [60, 72.269]
  - - [1024, 1024, 1, 12288]
    - [56, 75.138]
  - - [4096, 256, 1, 16384]
    - [53, 60.94]
  - - [2048, 256, 1, 15360]
    - [67, 72.571]
  - - [2048, 512, 1, 8320]
    - [24, 74.182]
  - - [1024, 1024, 1, 10240]
    - [51, 74.728]
  - - [1024, 1024, 1, 9216]
    - [32, 74.818]
  - - [4096, 200, 1, 16384]
    - [34, 48.632]
  - - [2048, 512, 1, 14336]
    - [60, 75.481]
  - - [1024, 512, 1, 13312]
    - [67, 72.124]
  - - [4096, 256, 1, 8320]
    - [15, 74.01]
  - - [4096, 200, 1, 13312]
    - [59, 51.163]
  - - [1024, 512, 1, 14336]
    - [67, 72.458]
  - - [4096, 256, 1, 11264]
    - [53, 62.081]
  - - [4096, 256, 1, 10240]
    - [34, 62.74]
  - - [4096, 200, 1, 14336]
    - [66, 48.934]
  - - [4096, 256, 1, 16640]
    - [58, 74.046]
  - - [1024, 512, 1, 15360]
    - [56, 73.704]
  - - [1024, 1024, 1, 16384]
    - [15, 74.344]
  - - [224, 192, 36, 10368]
    - [4, 60.556]
  - - [320, 256, 9, 19584]
    - [56, 71.953]
  - - [256, 256, 11, 13056]
    - [65, 65.361]
  - - [320, 256, 9, 9792]
    - [63, 69.453]
  - - [320, 256, 11, 13056]
    - [60, 64.536]
  - - [256, 256, 9, 9792]
    - [54, 77.936]
  - - [256, 224, 9, 19584]
    - [56, 66.909]
  - - [256, 256, 9, 19584]
    - [54, 75.341]
  - - [128, 128, 36, 12000]
    - [47, 56.866]
  - - [128, 128, 49, 12800]
    - [57, 49.597]
  - - [128, 128, 25, 25088]
    - [64, 46.746]
  - - [128, 128, 49, 25600]
    - [62, 43.628]
  - - [128, 128, 25, 50176]
    - [61, 43.534]
  - - [128, 128, 36, 12544]
    - [35, 56.365]
  - - [128, 128, 49, 9216]
    - [68, 40.493]
  - - [1024, 1024, 1, 12544]
    - [56, 75.188]
  - - [1024, 1000, 1, 12544]
    - [56, 73.69]
  - - [1024, 512, 1, 1600]
    - [121, 62.023]
  - - [2048, 512, 1, 100]
    - [73, 48.871]
  - - [768, 640, 1, 768]
    - [110, 51.393]
  - - [768, 1280, 1, 768]
    - [110, 60.137]
  - - [1024, 512, 1, 1024]
    - [110, 56.726]
  - - [1024, 512, 1, 3072]
    - [110, 61.396]
  - - [30522, 120, 1, 1024]
    - [87, 68.005]
  - - [30522, 80, 1, 1024]
    - [105, 46.877]
  - - [64, 128, 512, 128]
    - [86, 48.059]
  - - [64, 512, 64, 512]
    - [83, 49.435]
  - - [64, 64, 768, 64]
    - [76, 40.227]
  - - [64, 64, 96, 64]
    - [72, 24.575]
  - - [1856, 448, 1, 3328]
    - [108, 63.972]
  - - [128, 6784, 1, 3328]
    - [105, 55.882]
  - - [2048, 400, 1, 512]
    - [82, 51.005]
  - - [2368, 448, 1, 128]
    - [97, 49.011]
  - - [256, 4288, 1, 3328]
    - [136, 69.377]
  - - [704, 1856, 1, 3328]
    - [108, 61.45]
  - - [448, 1024, 1, 1280]
    - [136, 49.76]
  - - [256, 1408, 1, 3328]
    - [110, 42.758]
  - - [704, 1856, 1, 1280]
    - [85, 59.974]
  - - [128, 5056, 1, 128]
    - [103, 40.8]
  - - [2368, 128, 1, 256]
    - [129, 31.37]
  - - [64, 5056, 1, 256]
    - [133, 30.635]
  - - [256, 2944, 1, 256]
    - [85, 50.202]
  - - [256, 1856, 1, 1280]
    - [87, 51.871]
  - - [128, 3584, 1, 1280]
    - [110, 50.87]
  - - [4288, 256, 1, 256]
    - [105, 61.134]
  - - [2944, 128, 1, 128]
    - [102, 32.872]
  - - [5888, 64, 1, 3328]
    - [106, 41.012]
  - - [2944, 256, 1, 3328]
    - [108, 58.264]
  - - [704, 1024, 1, 128]
    - [129, 43.637]
  - - [1408, 448, 1, 1280]
    - [85, 47.955]
  - - [1408, 704, 1, 3328]
    - [136, 62.821]
  - - [1408, 256, 1, 1280]
    - [110, 40.199]
  - - [3072, 128, 1, 1024]
    - [87, 42.487]
  - - [2944, 256, 1, 256]
    - [85, 49.516]
  - - [704, 1408, 1, 3328]
    - [87, 62.884]
  - - [2944, 256, 1, 128]
    - [130, 45.244]
  - - [2368, 128, 1, 3328]
    - [110, 35.71]
  - - [2944, 128, 1, 256]
    - [102, 38.584]
  - - [448, 1408, 1, 256]
    - [103, 42.758]
  - - [64, 5056, 1, 3328]
    - [106, 35.782]
  - - [1024, 448, 1, 128]
    - [79, 35.322]
  - - [256, 3584, 1, 3328]
    - [82, 59.898]
  - - [256, 1408, 1, 256]
    - [102, 36.265]
  - - [5056, 64, 1, 1280]
    - [84, 34.555]
  - - [1024, 704, 1, 256]
    - [130, 47.689]
  - - [128, 4288, 1, 128]
    - [81, 41.49]
  - - [6784, 64, 1, 128]
    - [80, 32.313]
  - - [3584, 256, 1, 128]
    - [103, 47.648]
  - - [5888, 64, 1, 256]
    - [133, 35.273]
  - - [1856, 256, 1, 1280]
    - [87, 51.772]
  - - [64, 5888, 1, 3328]
    - [83, 41.517]
  - - [704, 1024, 1, 1280]
    - [85, 54.321]
  - - [448, 1856, 1, 128]
    - [83, 45.045]
  - - [1024, 704, 1, 1280]
    - [85, 54.691]
  - - [128, 5888, 1, 256]
    - [85, 49.516]
  - - [704, 704, 1, 3328]
    - [136, 57.57]
  - - [704, 1408, 1, 1280]
    - [105, 61.923]
  - - [3584, 256, 1, 3328]
    - [105, 60.832]
  - - [704, 1856, 1, 128]
    - [103, 53.59]
  - - [2944, 448, 1, 128]
    - [125, 51.393]
  - - [128, 2944, 1, 1280]
    - [110, 41.819]
  - - [448, 2944, 1, 1280]
    - [105, 59.275]
  - - [3584, 128, 1, 256]
    - [85, 38.12]
  - - [448, 1408, 1, 3328]
    - [85, 49.024]
  - - [256, 3584, 1, 256]
    - [136, 51.894]
  - - [256, 2944, 1, 3328]
    - [134, 58.368]
  - - [448, 2368, 1, 128]
    - [83, 48.857]
  - - [1408, 704, 1, 256]
    - [131, 55.201]
  - - [448, 2944, 1, 3328]
    - [87, 57.786]
  - - [64, 5888, 1, 256]
    - [133, 35.503]
  - - [6784, 128, 1, 3328]
    - [110, 55.269]
  - - [704, 704, 1, 256]
    - [82, 40.484]
  - - [128, 4288, 1, 3328]
    - [87, 63.304]
  - - [448, 704, 1, 1280]
    - [136, 34.316]
  - - [128, 5056, 1, 1280]
    - [85, 49.254]
  - - [1024, 448, 1, 3328]
    - [136, 53.338]
  - - [1856, 704, 1, 1280]
    - [85, 59.744]
  - - [448, 1024, 1, 128]
    - [129, 33.364]
  - - [448, 2368, 1, 3328]
    - [132, 58.594]
  - - [5056, 64, 1, 128]
    - [80, 29.2]
  - - [1024, 700, 1, 512]
    - [108, 49.782]
  - - [704, 1024, 1, 256]
    - [85, 46.674]
  - - [128, 6784, 1, 1280]
    - [82, 56.572]
  - - [1856, 256, 1, 256]
    - [101, 40.529]
  - - [256, 4288, 1, 1280]
    - [87, 67.685]
  - - [256, 1856, 1, 128]
    - [130, 36.978]
  - - [7680, 64, 1, 2560]
    - [134, 52.71]
  - - [448, 1408, 1, 128]
    - [102, 38.345]
  - - [6784, 128, 1, 256]
    - [131, 51.118]
  - - [704, 448, 1, 256]
    - [102, 30.107]
  - - [704, 1408, 1, 128]
    - [82, 48.925]
  - - [4288, 128, 1, 1280]
    - [87, 59.537]
  - - [128, 2944, 1, 128]
    - [80, 34.109]
  - - [1024, 704, 1, 3328]
    - [85, 55.95]
  - - [128, 4288, 1, 256]
    - [85, 45.74]
  - - [704, 448, 1, 3328]
    - [87, 37.041]
  - - [448, 2368, 1, 1280]
    - [132, 57.777]
  - - [64, 6784, 1, 3328]
    - [132, 44.513]
  - - [2944, 256, 1, 1280]
    - [134, 56.672]
  - - [256, 2368, 1, 128]
    - [81, 38.557]
  - - [1856, 704, 1, 256]
    - [131, 52.805]
  - - [1408, 448, 1, 3328]
    - [108, 49.065]
  - - [1856, 448, 1, 1280]
    - [134, 61.296]
  - - [128, 5888, 1, 128]
    - [103, 47.102]
  - - [704, 1856, 1, 256]
    - [134, 53.784]
  - - [256, 2368, 1, 1280]
    - [103, 46.981]
  - - [2944, 448, 1, 256]
    - [85, 56.297]
  - - [1856, 448, 1, 128]
    - [103, 45.993]
  - - [2368, 128, 1, 1280]
    - [102, 34.014]
  - - [64, 6784, 1, 256]
    - [83, 35.164]
  - - [64, 5056, 1, 1280]
    - [107, 34.542]
  - - [2368, 256, 1, 1280]
    - [85, 45.383]
  - - [2368, 448, 1, 1280]
    - [134, 60.985]
  - - [128, 3584, 1, 256]
    - [85, 38.395]
  - - [704, 448, 1, 1280]
    - [129, 35.449]
  - - [128, 3584, 1, 3328]
    - [87, 53.915]
  - - [4288, 256, 1, 1280]
    - [131, 69.282]
  - - [4288, 128, 1, 3328]
    - [136, 63.512]
  - - [7680, 128, 1, 2560]
    - [87, 62.126]
  - - [1408, 256, 1, 128]
    - [129, 31.253]
  - - [256, 1408, 1, 1280]
    - [110, 40.389]
  - - [128, 2368, 1, 256]
    - [102, 31.708]
  - - [6784, 64, 1, 3328]
    - [108, 47.247]
  - - [128, 2944, 1, 3328]
    - [110, 44.567]
  - - [2944, 448, 1, 3328]
    - [85, 62.311]
  - - [256, 4288, 1, 256]
    - [82, 61.31]
  - - [5888, 128, 1, 256]
    - [85, 49.07]
  - - [5056, 64, 1, 256]
    - [133, 30.635]
  - - [1024, 704, 1, 128]
    - [81, 44.197]
  - - [128, 5056, 1, 3328]
    - [85, 50.342]
  - - [4288, 128, 1, 256]
    - [104, 44.084]
  - - [1408, 448, 1, 128]
    - [101, 38.106]
  - - [704, 448, 1, 128]
    - [102, 28.194]
  - - [3584, 256, 1, 256]
    - [131, 53.094]
  - - [128, 2944, 1, 256]
    - [102, 36.635]
  - - [128, 6784, 1, 128]
    - [81, 46.177]
  - - [448, 1856, 1, 256]
    - [132, 50.707]
  - - [3584, 128, 1, 3328]
    - [136, 53.856]
  - - [5888, 128, 1, 3328]
    - [85, 58.246]
  - - [1408, 704, 1, 1280]
    - [131, 63.746]
  - - [6784, 64, 1, 256]
    - [85, 36.18]
  - - [448, 2944, 1, 256]
    - [82, 54.407]
  - - [448, 2368, 1, 256]
    - [132, 53.229]
  - - [64, 6784, 1, 1280]
    - [106, 43.258]
  - - [128, 2368, 1, 3328]
    - [87, 35.701]
  - - [5056, 64, 1, 3328]
    - [83, 35.773]
  - - [64, 5888, 1, 128]
    - [80, 33.689]
  - - [5056, 128, 1, 3328]
    - [85, 50.03]
  - - [448, 704, 1, 256]
    - [129, 31.19]
  - - [2944, 128, 1, 3328]
    - [87, 44.571]
  - - [704, 704, 1, 128]
    - [117, 36.049]
  - - [2368, 128, 1, 128]
    - [80, 27.264]
  - - [5056, 128, 1, 128]
    - [129, 39.423]
  - - [448, 1024, 1, 3328]
    - [110, 53.437]
  - - [2368, 256, 1, 256]
    - [129, 40.38]
  - - [256, 2368, 1, 3328]
    - [85, 47.233]
  - - [256, 3584, 1, 128]
    - [105, 48.433]
  - - [4288, 256, 1, 128]
    - [82, 53.094]
  - - [2368, 256, 1, 128]
    - [101, 37.971]
  - - [256, 1856, 1, 256]
    - [85, 40.353]
  - - [256, 2944, 1, 128]
    - [103, 46.011]
  - - [1408, 256, 1, 3328]
    - [87, 42.676]
  - - [2368, 448, 1, 256]
    - [106, 52.273]
  - - [4288, 256, 1, 3328]
    - [87, 69.611]
  - - [1856, 704, 1, 128]
    - [102, 48.307]
  - - [4288, 128, 1, 128]
    - [129, 39.721]
  - - [1408, 448, 1, 256]
    - [85, 41.585]
  - - [6784, 64, 1, 1280]
    - [85, 45.523]
  - - [3584, 128, 1, 128]
    - [80, 33.707]
  - - [256, 2368, 1, 256]
    - [103, 43.543]
  - - [2944, 448, 1, 1280]
    - [108, 61.247]
  - - [448, 1408, 1, 1280]
    - [85, 47.716]
  - - [448, 1856, 1, 1280]
    - [132, 57.069]
  - - [1856, 256, 1, 128]
    - [101, 35.358]
  - - [2560, 128, 1, 2560]
    - [136, 38.336]
  - - [448, 1024, 1, 256]
    - [103, 39.96]
  - - [1024, 448, 1, 1280]
    - [110, 49.575]
  - - [128, 5056, 1, 256]
    - [85, 42.911]
  - - [448, 2944, 1, 128]
    - [73, 50.175]
  - - [128, 3584, 1, 128]
    - [103, 35.417]
  - - [1408, 256, 1, 256]
    - [102, 36.139]
  - - [128, 5888, 1, 3328]
    - [134, 58.206]
  - - [2368, 448, 1, 3328]
    - [108, 62.79]
  - - [128, 5888, 1, 1280]
    - [85, 57.132]
  - - [64, 5056, 1, 128]
    - [80, 29.38]
  - - [64, 6784, 1, 128]
    - [129, 32.99]
  - - [448, 704, 1, 128]
    - [129, 28.37]
  - - [1408, 704, 1, 128]
    - [131, 49.011]
  - - [2368, 256, 1, 3328]
    - [108, 46.958]
  - - [5888, 128, 1, 1280]
    - [108, 56.803]
  - - [256, 3584, 1, 1280]
    - [87, 57.43]
  - - [256, 1408, 1, 128]
    - [129, 30.883]
  - - [256, 4288, 1, 128]
    - [81, 54.84]
  - - [5888, 128, 1, 128]
    - [103, 43.177]
  - - [1856, 256, 1, 3328]
    - [87, 55.467]
  - - [64, 5888, 1, 1280]
    - [133, 40.136]
  - - [704, 704, 1, 1280]
    - [87, 53.721]
  - - [128, 2368, 1, 1280]
    - [129, 35.164]
  - - [3584, 256, 1, 1280]
    - [131, 60.254]
  - - [5888, 64, 1, 1280]
    - [133, 40.033]
  - - [3584, 128, 1, 1280]
    - [87, 50.694]
  - - [5056, 128, 1, 1280]
    - [85, 48.474]
  - - [448, 1856, 1, 3328]
    - [106, 57.967]
  - - [1024, 448, 1, 256]
    - [103, 41.72]
  - - [2944, 128, 1, 1280]
    - [129, 42.225]
  - - [128, 2368, 1, 128]
    - [80, 27.783]
  - - [256, 2944, 1, 1280]
    - [85, 57.028]
  - - [704, 1024, 1, 3328]
    - [108, 55.738]
  - - [128, 6784, 1, 256]
    - [105, 51.33]
  - - [256, 1856, 1, 3328]
    - [136, 55.517]
  - - [6784, 128, 1, 128]
    - [131, 45.424]
  - - [704, 1408, 1, 256]
    - [105, 56.397]
  - - [4096, 128, 1, 4096]
    - [110, 61.689]
  - - [5888, 64, 1, 128]
    - [129, 31.0]
  - - [5056, 128, 1, 256]
    - [102, 42.469]
  - - [6784, 128, 1, 1280]
    - [105, 56.018]
  - - [1856, 448, 1, 256]
    - [106, 50.761]
  - - [128, 4288, 1, 1280]
    - [136, 59.559]
  - - [448, 704, 1, 3328]
    - [126, 36.996]
  - - [1856, 704, 1, 3328]
    - [85, 61.689]
  - - [1024, 1024, 1, 3328]
    - [87, 66.625]
  - - [2048, 200, 1, 3200]
    - [78, 47.337]
  - - [2048, 256, 1, 3328]
    - [110, 61.368]
  - - [4096, 200, 1, 11264]
    - [87, 47.838]
  - - [2048, 512, 1, 1024]
    - [105, 64.351]
  - - [1024, 1024, 1, 64]
    - [71, 44.657]
  - - [512, 1024, 1, 1536]
    - [110, 59.0]
  - - [1024, 512, 1, 512]
    - [85, 50.044]
  - - [2048, 512, 1, 640]
    - [105, 67.825]
  - - [1024, 1024, 1, 512]
    - [82, 63.11]
  - - [2048, 256, 1, 2048]
    - [110, 59.853]
  - - [1024, 512, 1, 128]
    - [81, 39.735]
  - - [2048, 512, 1, 256]
    - [82, 59.78]
  - - [4096, 200, 1, 2560]
    - [105, 54.371]
  - - [1024, 1024, 1, 1152]
    - [105, 68.691]
  - - [2048, 200, 1, 32]
    - [128, 17.393]
  - - [512, 1024, 1, 2816]
    - [110, 61.098]
  - - [2048, 200, 1, 2080]
    - [74, 48.894]
  - - [2048, 200, 1, 1024]
    - [87, 42.036]
  - - [4096, 200, 1, 4096]
    - [105, 52.002]
  - - [1024, 512, 1, 11264]
    - [110, 63.209]
  - - [1024, 1024, 1, 1792]
    - [105, 65.975]
  - - [4096, 200, 1, 768]
    - [131, 50.996]
  - - [4096, 256, 1, 1024]
    - [82, 66.038]
  - - [1024, 512, 1, 256]
    - [103, 45.46]
  - - [1024, 512, 1, 1408]
    - [126, 58.553]
  - - [1024, 512, 1, 5632]
    - [136, 62.469]
  - - [4096, 200, 1, 256]
    - [108, 43.723]
  - - [512, 1024, 1, 3072]
    - [110, 61.31]
  - - [1024, 1024, 1, 4160]
    - [96, 72.535]
  - - [2048, 256, 1, 384]
    - [130, 52.566]
  - - [4096, 200, 1, 640]
    - [82, 50.116]
  - - [1024, 1024, 1, 7168]
    - [87, 67.022]
  - - [4096, 256, 1, 768]
    - [105, 67.211]
  - - [2048, 256, 1, 6656]
    - [110, 62.578]
  - - [2048, 200, 1, 3072]
    - [87, 47.098]
  - - [1024, 512, 1, 2816]
    - [110, 61.12]
  - - [4096, 256, 1, 7680]
    - [136, 66.503]
  - - [4096, 200, 1, 1024]
    - [105, 51.646]
  - - [2048, 200, 1, 1792]
    - [87, 45.415]
  - - [1024, 1024, 1, 2816]
    - [110, 66.458]
  - - [2048, 512, 1, 1536]
    - [136, 65.704]
  - - [4096, 256, 1, 3072]
    - [110, 66.458]
  - - [2048, 256, 1, 5632]
    - [136, 62.37]
  - - [1024, 512, 1, 6656]
    - [136, 62.681]
  - - [4096, 200, 1, 2080]
    - [74, 55.449]
  - - [2048, 200, 1, 13312]
    - [87, 49.327]
  - - [4096, 256, 1, 3584]
    - [131, 67.008]
  - - [2048, 256, 1, 8192]
    - [136, 63.015]
  - - [2048, 512, 1, 512]
    - [82, 62.717]
  - - [2048, 512, 1, 1152]
    - [131, 68.745]
  - - [2048, 200, 1, 9216]
    - [87, 49.051]
  - - [2048, 200, 1, 2560]
    - [110, 46.39]
  - - [2048, 256, 1, 4608]
    - [110, 62.081]
  - - [2048, 256, 1, 3584]
    - [87, 61.621]
  - - [1024, 512, 1, 640]
    - [81, 54.655]
  - - [2048, 512, 1, 768]
    - [131, 66.228]
  - - [2048, 200, 1, 1408]
    - [131, 44.77]
  - - [4096, 200, 1, 2048]
    - [131, 53.36]
  - - [1024, 1024, 1, 5632]
    - [110, 66.968]
  - - [2048, 512, 1, 3584]
    - [87, 66.629]
  - - [1024, 512, 1, 64]
    - [120, 29.917]
  - - [4096, 200, 1, 7680]
    - [110, 52.133]
  - - [1024, 1024, 1, 1280]
    - [110, 65.154]
  - - [2048, 200, 1, 896]
    - [130, 44.896]
  - - [2048, 256, 1, 32]
    - [114, 21.503]
  - - [2048, 256, 1, 1280]
    - [136, 57.583]
  - - [4096, 256, 1, 4096]
    - [87, 66.534]
  - - [2048, 256, 1, 11264]
    - [136, 63.187]
  - - [4096, 200, 1, 9216]
    - [87, 51.33]
  - - [1024, 512, 1, 4096]
    - [110, 60.75]
  - - [4096, 200, 1, 3840]
    - [131, 52.313]
  - - [1024, 1024, 1, 1920]
    - [74, 69.359]
  - - [2048, 200, 1, 7168]
    - [87, 48.727]
  - - [4096, 256, 1, 1152]
    - [131, 69.002]
  - - [2048, 256, 1, 1920]
    - [110, 59.631]
  - - [2048, 512, 1, 4160]
    - [96, 72.661]
  - - [2048, 512, 1, 5632]
    - [87, 66.913]
  - - [4096, 256, 1, 7168]
    - [136, 65.533]
  - - [4096, 200, 1, 128]
    - [130, 40.091]
  - - [2048, 200, 1, 5120]
    - [110, 48.122]
  - - [1024, 1024, 1, 6656]
    - [87, 66.931]
  - - [512, 1024, 1, 3200]
    - [100, 61.522]
  - - [2048, 256, 1, 1536]
    - [110, 58.679]
  - - [4096, 256, 1, 256]
    - [131, 59.898]
  - - [2048, 512, 1, 1408]
    - [105, 69.255]
  - - [1024, 512, 1, 2080]
    - [96, 64.874]
  - - [2048, 512, 1, 2304]
    - [105, 67.035]
  - - [4096, 200, 1, 512]
    - [82, 48.474]
  - - [2048, 200, 1, 1280]
    - [87, 43.917]
  - - [1024, 1024, 1, 2304]
    - [105, 66.886]
  - - [2048, 512, 1, 4608]
    - [110, 66.796]
  - - [4096, 256, 1, 6144]
    - [87, 66.634]
  - - [4096, 256, 1, 896]
    - [105, 68.059]
  - - [2048, 256, 1, 640]
    - [130, 55.738]
  - - [2048, 512, 1, 384]
    - [105, 65.158]
  - - [2048, 200, 1, 16384]
    - [90, 41.923]
  - - [4096, 200, 1, 10240]
    - [110, 49.394]
  - - [1024, 512, 1, 9216]
    - [136, 62.496]
  - - [4096, 200, 1, 1920]
    - [131, 54.096]
  - - [2048, 512, 1, 7680]
    - [136, 67.031]
  - - [1024, 512, 1, 3584]
    - [110, 61.72]
  - - [1024, 1024, 1, 32]
    - [73, 30.156]
  - - [2048, 512, 1, 1664]
    - [105, 70.026]
  - - [2048, 200, 1, 2048]
    - [87, 45.708]
  - - [1024, 1024, 1, 3584]
    - [110, 66.679]
  - - [4096, 256, 1, 6656]
    - [110, 66.936]
  - - [4096, 256, 1, 4160]
    - [96, 72.553]
  - - [2048, 256, 1, 3072]
    - [110, 61.238]
  - - [2048, 256, 1, 8320]
    - [100, 62.988]
  - - [1024, 512, 1, 3200]
    - [126, 61.522]
  - - [1024, 512, 1, 896]
    - [105, 56.852]
  - - [2048, 512, 1, 1280]
    - [105, 67.419]
  - - [4096, 200, 1, 64]
    - [95, 32.313]
  - - [1024, 1024, 1, 5120]
    - [87, 66.859]
  - - [2048, 512, 1, 6656]
    - [87, 66.981]
  - - [1024, 1024, 1, 128]
    - [105, 53.685]
  - - [512, 1024, 1, 1792]
    - [126, 59.668]
  - - [4096, 256, 1, 2816]
    - [105, 69.53]
  - - [1024, 1024, 1, 4096]
    - [110, 66.616]
  - - [2048, 200, 1, 4160]
    - [74, 50.973]
  - - [1024, 512, 1, 768]
    - [136, 54.75]
  - - [4096, 200, 1, 8320]
    - [131, 53.288]
  - - [2048, 512, 1, 896]
    - [105, 67.432]
  - - [4096, 200, 1, 7168]
    - [82, 52.192]
  - - [2048, 200, 1, 3840]
    - [126, 47.102]
  - - [1024, 1024, 1, 768]
    - [105, 65.822]
  - - [4096, 256, 1, 2304]
    - [131, 68.876]
  - - [2048, 200, 1, 16640]
    - [85, 45.099]
  - - [2048, 256, 1, 2816]
    - [110, 59.189]
  - - [1024, 512, 1, 384]
    - [81, 53.432]
  - - [2048, 200, 1, 7680]
    - [87, 48.587]
  - - [1024, 512, 1, 4608]
    - [136, 62.221]
  - - [4096, 200, 1, 32]
    - [114, 24.138]
  - - [4096, 200, 1, 3328]
    - [131, 53.401]
  - - [1024, 1024, 1, 1408]
    - [105, 68.885]
  - - [2048, 200, 1, 15360]
    - [134, 43.854]
  - - [512, 1024, 1, 2048]
    - [110, 57.822]
  - - [4096, 256, 1, 5632]
    - [110, 66.697]
  - - [2048, 256, 1, 1408]
    - [105, 58.106]
  - - [2048, 256, 1, 6144]
    - [110, 62.596]
  - - [4096, 256, 1, 3328]
    - [131, 69.431]
  - - [2048, 512, 1, 6144]
    - [110, 66.999]
  - - [2048, 512, 1, 3200]
    - [105, 70.658]
  - - [2048, 200, 1, 4608]
    - [87, 47.648]
  - - [1024, 1024, 1, 6144]
    - [110, 66.954]
  - - [4096, 256, 1, 1664]
    - [131, 69.765]
  - - [2048, 200, 1, 384]
    - [103, 40.091]
  - - [4096, 256, 1, 1792]
    - [87, 65.831]
  - - [2048, 512, 1, 2816]
    - [105, 66.846]
  - - [4096, 256, 1, 384]
    - [131, 64.148]
  - - [2048, 256, 1, 128]
    - [81, 39.117]
  - - [1024, 1024, 1, 640]
    - [105, 66.868]
  - - [4096, 200, 1, 5632]
    - [82, 54.1]
  - - [2048, 200, 1, 1152]
    - [103, 44.152]
  - - [4096, 256, 1, 512]
    - [131, 64.558]
  - - [1024, 1024, 1, 384]
    - [105, 64.833]
  - - [2048, 200, 1, 512]
    - [130, 39.261]
  - - [2048, 256, 1, 9216]
    - [136, 63.06]
  - - [2048, 256, 1, 1792]
    - [110, 59.302]
  - - [4096, 200, 1, 1792]
    - [105, 54.023]
  - - [2048, 200, 1, 1536]
    - [87, 44.449]
  - - [1024, 1024, 1, 3072]
    - [87, 66.494]
  - - [1024, 1024, 1, 2080]
    - [96, 72.079]
  - - [2048, 200, 1, 2304]
    - [87, 46.232]
  - - [2048, 256, 1, 7168]
    - [136, 62.781]
  - - [2048, 512, 1, 1792]
    - [136, 65.903]
  - - [1024, 1024, 1, 4608]
    - [110, 66.873]
  - - [512, 1024, 1, 1280]
    - [136, 58.093]
  - - [2048, 256, 1, 3200]
    - [110, 61.319]
  - - [1024, 512, 1, 3328]
    - [110, 61.567]
  - - [1024, 512, 1, 4160]
    - [121, 66.219]
  - - [4096, 200, 1, 6656]
    - [82, 52.913]
  - - [2048, 200, 1, 3328]
    - [87, 47.134]
  - - [1024, 1024, 1, 256]
    - [82, 59.428]
  - - [2048, 256, 1, 64]
    - [80, 29.917]
  - - [2048, 256, 1, 2304]
    - [136, 60.25]
  - - [4096, 200, 1, 8192]
    - [136, 48.645]
  - - [1024, 512, 1, 7168]
    - [110, 62.131]
  - - [1024, 512, 1, 1792]
    - [110, 59.55]
  - - [4096, 200, 1, 2816]
    - [131, 54.664]
  - - [1024, 1024, 1, 896]
    - [131, 68.041]
  - - [4096, 256, 1, 5120]
    - [87, 66.778]
  - - [4096, 256, 1, 2048]
    - [110, 65.984]
  - - [2048, 256, 1, 5120]
    - [110, 62.248]
  - - [2048, 256, 1, 7680]
    - [110, 62.875]
  - - [2048, 200, 1, 3584]
    - [87, 47.382]
  - - [1024, 512, 1, 1536]
    - [110, 58.887]
  - - [2048, 200, 1, 64]
    - [117, 23.655]
  - - [2048, 200, 1, 4096]
    - [87, 47.761]
  - - [1024, 1024, 1, 1536]
    - [110, 65.691]
  - - [4096, 256, 1, 32]
    - [73, 29.683]
  - - [4096, 256, 1, 1280]
    - [105, 67.658]
  - - [2048, 256, 1, 1024]
    - [110, 56.252]
  - - [1024, 512, 1, 1152]
    - [100, 57.416]
  - - [2048, 512, 1, 3328]
    - [87, 66.629]
  - - [4096, 200, 1, 3584]
    - [131, 54.389]
  - - [2048, 200, 1, 256]
    - [103, 35.358]
  - - [4096, 256, 1, 1920]
    - [96, 69.72]
  - - [2048, 256, 1, 1664]
    - [78, 58.959]
  - - [4096, 200, 1, 5120]
    - [87, 52.034]
  - - [1024, 512, 1, 8192]
    - [136, 63.087]
  - - [4096, 200, 1, 896]
    - [105, 51.876]
  - - [2048, 200, 1, 640]
    - [103, 43.258]
  - - [4096, 200, 1, 1408]
    - [131, 53.581]
  - - [2048, 200, 1, 5632]
    - [87, 48.348]
  - - [1024, 512, 1, 2560]
    - [136, 60.845]
  - - [4096, 200, 1, 1280]
    - [105, 52.801]
  - - [1024, 1024, 1, 2560]
    - [87, 66.291]
  - - [2048, 512, 1, 64]
    - [71, 44.395]
  - - [2048, 200, 1, 8192]
    - [87, 48.961]
  - - [2048, 512, 1, 3072]
    - [136, 66.557]
  - - [4096, 256, 1, 640]
    - [105, 67.044]
  - - [2048, 256, 1, 4096]
    - [136, 61.892]
  - - [4096, 200, 1, 1664]
    - [105, 54.109]
  - - [2048, 200, 1, 6656]
    - [87, 48.65]
  - - [512, 1024, 1, 768]
    - [110, 54.849]
  - - [2048, 200, 1, 8320]
    - [78, 48.993]
  - - [4096, 256, 1, 3840]
    - [110, 66.701]
  - - [1024, 1024, 1, 3200]
    - [105, 70.387]
  - - [4096, 256, 1, 4608]
    - [87, 66.742]
  - - [1024, 512, 1, 32]
    - [115, 21.503]
  - - [1024, 512, 1, 3840]
    - [136, 61.86]
  - - [2048, 512, 1, 1920]
    - [121, 69.828]
  - - [4096, 200, 1, 6144]
    - [82, 52.304]
  - - [2048, 200, 1, 2816]
    - [87, 46.723]
  - - [1024, 1024, 1, 3840]
    - [110, 66.724]
  - - [2048, 256, 1, 3840]
    - [110, 61.756]
  - - [1024, 512, 1, 7680]
    - [110, 62.916]
  - - [2048, 200, 1, 10240]
    - [87, 49.115]
  - - [2048, 512, 1, 5120]
    - [110, 66.936]
  - - [512, 1024, 1, 512]
    - [110, 50.802]
  - - [2048, 512, 1, 32]
    - [96, 29.57]
  - - [4096, 256, 1, 2560]
    - [136, 66.313]
  - - [4096, 256, 1, 64]
    - [73, 44.265]
  - - [2048, 200, 1, 768]
    - [82, 41.404]
  - - [2048, 512, 1, 2560]
    - [87, 66.363]
  - - [2048, 512, 1, 7168]
    - [110, 67.053]
  - - [2048, 512, 1, 128]
    - [103, 52.566]
  - - [4096, 200, 1, 2304]
    - [105, 54.321]
  - - [2048, 512, 1, 4096]
    - [87, 66.67]
  - - [2048, 256, 1, 2560]
    - [110, 60.606]
  - - [2048, 256, 1, 4160]
    - [74, 66.061]
  - - [1024, 512, 1, 1664]
    - [136, 59.424]
  - - [2048, 512, 1, 2080]
    - [96, 72.102]
  - - [2048, 512, 1, 3840]
    - [136, 66.733]
  - - [4096, 200, 1, 3072]
    - [87, 51.61]
  - - [1024, 1024, 1, 1664]
    - [131, 69.58]
  - - [512, 1024, 1, 2304]
    - [136, 60.665]
  - - [4096, 256, 1, 1408]
    - [105, 69.503]
  - - [2048, 256, 1, 1152]
    - [131, 57.588]
  - - [1024, 512, 1, 1280]
    - [110, 58.093]
  - - [2048, 200, 1, 12288]
    - [136, 49.318]
  - - [2048, 200, 1, 1664]
    - [105, 45.383]
  - - [4096, 200, 1, 4608]
    - [105, 52.823]
  - - [512, 1024, 1, 2560]
    - [110, 60.922]
  - - [4096, 200, 1, 384]
    - [130, 49.178]
  - - [2048, 200, 1, 128]
    - [129, 29.421]
  - - [2048, 200, 1, 11264]
    - [87, 49.241]
  - - [1024, 512, 1, 1920]
    - [100, 59.884]
  - - [4096, 256, 1, 1536]
    - [131, 67.987]
  - - [2048, 256, 1, 256]
    - [130, 45.257]
  - - [2048, 256, 1, 10240]
    - [110, 63.196]
  - - [1024, 512, 1, 5120]
    - [110, 62.37]
  - - [1024, 512, 1, 8320]
    - [126, 63.096]
  - - [1024, 512, 1, 10240]
    - [110, 63.196]
  - - [1024, 1024, 1, 2048]
    - [110, 66.146]
  - - [2048, 256, 1, 2080]
    - [74, 64.536]
  - - [4096, 256, 1, 128]
    - [130, 51.934]
  - - [2048, 256, 1, 896]
    - [103, 57.159]
  - - [4096, 200, 1, 1152]
    - [105, 52.877]
  - - [2048, 200, 1, 6144]
    - [87, 48.506]
  - - [1024, 1024, 1, 7680]
    - [110, 66.977]
  - - [2048, 200, 1, 1920]
    - [78, 45.108]
  - - [4096, 256, 1, 2080]
    - [121, 71.786]
  - - [2048, 200, 1, 14336]
    - [136, 49.051]
  - - [1024, 512, 1, 6144]
    - [136, 61.802]
  - - [1024, 512, 1, 2304]
    - [110, 60.286]
  - - [4096, 200, 1, 4160]
    - [74, 56.333]
  - - [4096, 200, 1, 1536]
    - [105, 53.414]
  - - [2048, 320, 1, 64]
    - [115, 32.742]
  - - [2048, 384, 1, 64]
    - [71, 37.226]
  - - [1024, 384, 1, 289]
    - [94, 40.308]
  - - [2048, 448, 1, 64]
    - [71, 39.541]
  - - [102, 101, 624, 64]
    - [100, 35.223]
  - - [101, 101, 624, 64]
    - [110, 34.84]
  - - [85, 85, 752, 64]
    - [116, 28.722]
  - - [112, 111, 576, 64]
    - [75, 41.106]
  - - [65, 65, 992, 64]
    - [116, 19.229]
  - - [77, 77, 816, 64]
    - [71, 26.1]
  - - [111, 111, 576, 64]
    - [75, 38.007]
  - - [84, 85, 752, 64]
    - [71, 28.916]
  - - [84, 84, 752, 64]
    - [71, 28.907]
  - - [71, 71, 896, 64]
    - [116, 22.635]
  - - [122, 122, 528, 64]
    - [124, 40.362]
  - - [78, 78, 816, 64]
    - [116, 26.515]
  - - [112, 112, 576, 64]
    - [75, 41.512]
  - - [77, 78, 816, 64]
    - [93, 25.911]
  - - [111, 112, 576, 64]
    - [122, 37.772]
  - - [92, 93, 688, 64]
    - [78, 31.772]
  - - [102, 102, 624, 64]
    - [110, 35.449]
  - - [99, 99, 624, 64]
    - [78, 34.695]
  - - [100, 102, 624, 64]
    - [100, 35.223]
  - - [123, 122, 528, 64]
    - [98, 40.308]
  - - [99, 102, 624, 64]
    - [136, 34.695]
  - - [93, 93, 688, 64]
    - [78, 31.596]
  - - [123, 123, 528, 64]
    - [98, 40.281]
  - - [100, 100, 624, 64]
    - [87, 34.203]
  - - [101, 102, 624, 64]
    - [78, 35.128]
  - - [102, 100, 624, 64]
    - [87, 35.142]
  - - [92, 92, 688, 64]
    - [136, 31.537]
  - - [3072, 128, 1, 4096]
    - [136, 46.678]
  - - [1728, 320, 1, 64]
    - [72, 33.545]
  - - [1440, 320, 1, 196]
    - [73, 39.487]
  - - [2592, 384, 1, 289]
    - [74, 59.695]
  - - [192, 80, 36, 10368]
    - [136, 34.515]
  - - [1280, 384, 1, 64]
    - [123, 25.076]
  - - [1280, 448, 1, 64]
    - [129, 32.34]
  - - [3456, 256, 1, 169]
    - [118, 49.751]
  - - [2304, 256, 1, 196]
    - [95, 49.39]
  - - [224, 192, 36, 2592]
    - [77, 60.98]
  - - [192, 128, 36, 1568]
    - [131, 58.418]
  - - [1296, 288, 1, 196]
    - [72, 35.34]
  - - [192, 64, 36, 6272]
    - [85, 40.781]
  - - [1728, 224, 1, 1225]
    - [73, 44.034]
  - - [1152, 384, 1, 64]
    - [80, 28.383]
  - - [1792, 256, 1, 289]
    - [73, 45.108]
  - - [1728, 384, 1, 169]
    - [93, 44.071]
  - - [1568, 256, 1, 289]
    - [72, 41.607]
  - - [1152, 448, 1, 64]
    - [72, 32.119]
  - - [1536, 256, 1, 64]
    - [70, 25.69]
  - - [1440, 320, 1, 49]
    - [92, 24.49]
  - - [1344, 512, 1, 64]
    - [117, 36.658]
  - - [1152, 256, 1, 196]
    - [72, 37.15]
  - - [1728, 192, 1, 1225]
    - [92, 39.69]
  - - [2048, 512, 1, 49]
    - [73, 36.68]
  - - [512, 2048, 1, 49]
    - [71, 37.267]
  - - [1728, 192, 1, 64]
    - [92, 24.314]
  - - [1536, 384, 1, 64]
    - [120, 33.134]
  - - [2048, 192, 1, 64]
    - [92, 26.903]
  - - [128, 96, 36, 1568]
    - [95, 51.389]
  - - [128, 128, 36, 3136]
    - [121, 72.783]
  - - [1280, 320, 1, 64]
    - [129, 26.637]
  - - [1792, 320, 1, 289]
    - [73, 54.899]
  - - [2880, 320, 1, 64]
    - [93, 40.813]
  - - [1728, 384, 1, 49]
    - [94, 29.94]
  - - [512, 1024, 1, 196]
    - [73, 46.922]
  - - [224, 192, 36, 5184]
    - [125, 61.684]
  - - [192, 80, 36, 20736]
    - [136, 32.705]
  - - [224, 192, 64, 4608]
    - [108, 50.793]
  - - [224, 192, 64, 2304]
    - [108, 57.299]
  - - [192, 80, 49, 14400]
    - [96, 34.393]
  - - [224, 192, 49, 6272]
    - [134, 56.419]
  - - [224, 192, 49, 3136]
    - [77, 56.757]
  - - [192, 80, 36, 41472]
    - [140, 31.293]
  - - [192, 80, 49, 28800]
    - [87, 33.148]
  - - [192, 80, 64, 9216]
    - [137, 26.29]
  - - [256, 224, 9, 9792]
    - [87, 60.732]
  - - [256, 256, 9, 4896]
    - [74, 73.352]
  - - [320, 256, 9, 4896]
    - [93, 55.476]
  - - [224, 192, 9, 19584]
    - [136, 46.141]
  - - [192, 192, 11, 3264]
    - [72, 49.286]
  - - [192, 192, 11, 6528]
    - [122, 45.244]
  - - [192, 192, 9, 4896]
    - [74, 41.539]
  - - [224, 192, 11, 6528]
    - [125, 51.898]
  - - [192, 192, 9, 19584]
    - [110, 39.599]
  - - [256, 224, 11, 13056]
    - [85, 46.638]
  - - [224, 192, 11, 13056]
    - [108, 47.549]
  - - [256, 256, 11, 3264]
    - [118, 61.021]
  - - [320, 256, 11, 6528]
    - [136, 57.173]
  - - [192, 192, 9, 9792]
    - [129, 40.962]
  - - [224, 224, 9, 9792]
    - [87, 53.473]
  - - [224, 192, 11, 3264]
    - [95, 55.932]
  - - [224, 224, 11, 6528]
    - [85, 43.087]
  - - [224, 224, 9, 19584]
    - [78, 52.756]
  - - [192, 192, 11, 13056]
    - [133, 43.304]
  - - [224, 224, 9, 4896]
    - [74, 55.792]
  - - [320, 256, 11, 3264]
    - [121, 61.95]
  - - [256, 256, 11, 6528]
    - [77, 55.417]
  - - [224, 192, 9, 4896]
    - [74, 47.874]
  - - [224, 224, 11, 13056]
    - [134, 41.936]
  - - [224, 224, 11, 3264]
    - [95, 46.687]
  - - [256, 224, 11, 6528]
    - [99, 48.988]
  - - [256, 224, 11, 3264]
    - [95, 53.338]
  - - [224, 192, 9, 9792]
    - [100, 45.898]
  - - [256, 224, 9, 4896]
    - [74, 63.056]
  - - [64, 64, 496, 64]
    - [76, 34.673]
  - - [135, 135, 32, 64]
    - [93, 22.879]
  - - [64, 65, 496, 64]
    - [72, 25.884]
  - - [65, 65, 472, 64]
    - [93, 18.074]
  - - [65, 65, 496, 64]
    - [71, 17.925]
  - - [70, 70, 216, 64]
    - [91, 17.957]
  - - [70, 71, 216, 64]
    - [93, 18.584]
  - - [71, 71, 216, 64]
    - [70, 18.345]
  - - [71, 71, 448, 64]
    - [116, 21.322]
  - - [77, 77, 248, 64]
    - [93, 22.297]
  - - [77, 77, 408, 64]
    - [116, 23.953]
  - - [77, 78, 248, 64]
    - [71, 22.035]
  - - [77, 78, 408, 64]
    - [116, 24.332]
  - - [78, 78, 248, 64]
    - [116, 22.365]
  - - [78, 78, 408, 64]
    - [93, 24.616]
  - - [80, 80, 152, 64]
    - [115, 21.476]
  - - [80, 84, 152, 64]
    - [116, 22.41]
  - - [84, 84, 152, 64]
    - [93, 22.121]
  - - [85, 85, 376, 64]
    - [116, 27.124]
  - - [93, 93, 344, 64]
    - [116, 29.006]
  - - [102, 102, 312, 64]
    - [100, 30.955]
  - - [112, 112, 288, 64]
    - [122, 36.834]
  - - [122, 122, 264, 64]
    - [98, 36.252]
  - - [123, 122, 264, 64]
    - [124, 36.947]
  - - [123, 123, 264, 64]
    - [124, 36.965]
  - - [511, 2048, 1, 2048]
    - [110, 65.212]
  - - [1024, 512, 1, 1025]
    - [73, 60.525]
  - - [512, 1023, 1, 1024]
    - [87, 55.196]
  - - [1025, 1024, 1, 1024]
    - [110, 64.414]
  - - [2048, 513, 1, 2048]
    - [108, 61.558]
  - - [1024, 1024, 1, 1025]
    - [96, 69.751]
  - - [960, 1024, 1, 1023]
    - [96, 65.208]
  - - [1024, 1024, 1, 1024]
    - [105, 64.802]
  - - [960, 1025, 1, 1024]
    - [82, 60.565]
  - - [2049, 512, 1, 2048]
    - [87, 65.285]
  - - [513, 1024, 1, 1024]
    - [106, 49.169]
  - - [512, 2048, 1, 2048]
    - [82, 66.728]
  - - [1024, 511, 1, 1024]
    - [110, 53.699]
  - - [1024, 512, 1, 1023]
    - [73, 60.588]
  - - [960, 1024, 1, 1025]
    - [74, 65.203]
  - - [959, 1024, 1, 1024]
    - [82, 60.538]
  - - [2048, 512, 1, 2049]
    - [96, 71.551]
  - - [511, 1024, 1, 1024]
    - [110, 54.917]
  - - [512, 2049, 1, 2048]
    - [87, 65.781]
  - - [1024, 513, 1, 1024]
    - [85, 52.169]
  - - [2048, 512, 1, 2047]
    - [121, 71.502]
  - - [1025, 512, 1, 1024]
    - [87, 55.634]
  - - [1024, 1024, 1, 1023]
    - [96, 70.058]
  - - [513, 2048, 1, 2048]
    - [106, 55.395]
  - - [1024, 1025, 1, 1024]
    - [82, 65.352]
  - - [512, 2048, 1, 2049]
    - [96, 71.434]
  - - [1024, 1023, 1, 1024]
    - [105, 63.967]
  - - [960, 1023, 1, 1024]
    - [105, 59.843]
  - - [2048, 511, 1, 2048]
    - [105, 64.906]
  - - [1023, 512, 1, 1024]
    - [136, 54.998]
  - - [2047, 512, 1, 2048]
    - [131, 65.853]
  - - [512, 1024, 1, 1024]
    - [136, 56.726]
  - - [512, 1024, 1, 1025]
    - [73, 60.768]
  - - [512, 2047, 1, 2048]
    - [87, 65.461]
  - - [512, 1025, 1, 1024]
    - [87, 55.612]
  - - [512, 2048, 1, 2047]
    - [121, 71.533]
  - - [960, 1024, 1, 1024]
    - [82, 62.248]
  - - [961, 1024, 1, 1024]
    - [105, 61.373]
  - - [512, 1024, 1, 1023]
    - [73, 60.588]
  - - [1023, 1024, 1, 1024]
    - [105, 64.721]
  - - [479, 1024, 1, 1024]
    - [136, 51.668]
  - - [479, 2048, 1, 2048]
    - [105, 61.477]
  - - [480, 1023, 1, 1024]
    - [110, 51.443]
  - - [480, 1024, 1, 1023]
    - [73, 56.045]
  - - [480, 1024, 1, 1025]
    - [73, 56.374]
  - - [480, 1025, 1, 1024]
    - [110, 51.871]
  - - [480, 2047, 1, 2048]
    - [82, 63.223]
  - - [480, 2048, 1, 2047]
    - [121, 66.823]
  - - [480, 2048, 1, 2049]
    - [96, 66.823]
  - - [480, 2049, 1, 2048]
    - [136, 61.63]
  - - [480, 3071, 1, 3072]
    - [87, 64.342]
  - - [481, 1024, 1, 1024]
    - [110, 51.88]
  - - [481, 2048, 1, 2048]
    - [136, 61.558]
  - - [1023, 480, 1, 1024]
    - [110, 50.82]
  - - [1024, 479, 1, 1024]
    - [110, 50.991]
  - - [1024, 480, 1, 1023]
    - [73, 55.986]
  - - [1024, 480, 1, 1025]
    - [73, 55.932]
  - - [1024, 481, 1, 1024]
    - [87, 50.816]
  - - [1025, 480, 1, 1024]
    - [87, 51.289]
  - - [2047, 480, 1, 2048]
    - [105, 62.293]
  - - [2048, 479, 1, 2048]
    - [131, 62.239]
  - - [2048, 480, 1, 2047]
    - [121, 66.124]
  - - [2048, 480, 1, 2049]
    - [96, 66.119]
  - - [2048, 481, 1, 2048]
    - [105, 62.704]
  - - [2049, 480, 1, 2048]
    - [136, 60.967]
  - - [3071, 480, 1, 3072]
    - [110, 63.94]
  - - [480, 1024, 1, 1024]
    - [110, 51.989]
  - - [480, 2048, 1, 2048]
    - [105, 63.133]
  - - [1024, 480, 1, 1024]
    - [110, 50.87]
  - - [2048, 480, 1, 2048]
    - [136, 61.382]
  - - [1024, 512, 1, 2048]
    - [110, 60.164]
  - - [1024, 960, 1, 1024]
    - [82, 61.892]
  - - [1024, 960, 1, 1600]
    - [121, 66.534]
  - - [1024, 1024, 1, 960]
    - [96, 70.261]
  - - [2048, 215, 1, 512]
    - [103, 41.756]
  - - [2048, 215, 1, 768]
    - [134, 43.123]
  - - [2048, 256, 1, 512]
    - [131, 51.447]
  - - [2048, 256, 1, 768]
    - [105, 54.885]
  - - [2048, 512, 1, 2048]
    - [136, 66.119]
  - - [2048, 512, 1, 67]
    - [71, 42.491]
  - - [2048, 512, 1, 74]
    - [71, 45.0]
  - - [256, 1280, 1, 1024]
    - [102, 38.174]
  - - [256, 1536, 1, 1024]
    - [102, 45.144]
  - - [256, 2304, 1, 1024]
    - [110, 63.345]
  - - [256, 2560, 1, 1024]
    - [130, 49.489]
  - - [256, 2816, 1, 1024]
    - [85, 54.281]
  - - [256, 3328, 1, 1024]
    - [85, 63.566]
  - - [256, 3584, 1, 1024]
    - [82, 58.973]
  - - [512, 1600, 1, 512]
    - [85, 58.842]
  - - [767, 1280, 1, 768]
    - [82, 59.555]
  - - [769, 1280, 1, 768]
    - [131, 62.217]
  - - [768, 1279, 1, 768]
    - [82, 59.902]
  - - [768, 1281, 1, 768]
    - [105, 61.224]
  - - [768, 1280, 1, 767]
    - [96, 64.626]
  - - [768, 1280, 1, 769]
    - [96, 64.572]
  - - [256, 4096, 1, 512]
    - [82, 62.916]
  - - [767, 768, 1, 768]
    - [110, 58.616]
  - - [769, 768, 1, 768]
    - [130, 43.543]
  - - [768, 767, 1, 768]
    - [87, 57.561]
  - - [768, 769, 1, 768]
    - [134, 43.263]
  - - [768, 768, 1, 767]
    - [118, 65.461]
  - - [768, 768, 1, 769]
    - [118, 65.506]
  - - [768, 768, 1, 768]
    - [136, 61.188]
  - - [128, 128, 49, 1152]
    - [85, 60.317]
  - - [128, 128, 49, 1216]
    - [95, 65.817]
  - - [128, 128, 36, 1800]
    - [74, 71.533]
  - - [128, 128, 36, 1900]
    - [96, 70.933]
  - - [128, 128, 64, 5880]
    - [131, 54.957]
  - - [128, 128, 49, 7680]
    - [113, 40.136]
  - - [128, 128, 64, 882]
    - [74, 67.563]
  - - [128, 128, 64, 931]
    - [96, 68.908]
  - - [128, 64, 121, 1152]
    - [85, 57.552]
  - - [128, 64, 81, 12000]
    - [72, 34.348]
  - - [128, 64, 121, 1216]
    - [125, 56.415]
  - - [128, 64, 81, 1800]
    - [134, 50.342]
  - - [128, 64, 81, 1900]
    - [95, 55.386]
  - - [128, 64, 49, 20280]
    - [117, 37.465]
  - - [128, 64, 49, 3042]
    - [117, 48.19]
  - - [128, 64, 49, 3211]
    - [118, 48.623]
  - - [128, 64, 169, 5880]
    - [130, 36.694]
  - - [128, 64, 121, 7680]
    - [138, 32.196]
  - - [128, 64, 169, 882]
    - [98, 45.817]
  - - [128, 64, 169, 931]
    - [127, 46.25]
  - - [256, 128, 25, 1080]
    - [118, 66.706]
  - - [256, 128, 25, 162]
    - [73, 50.148]
  - - [256, 128, 25, 171]
    - [118, 50.4]
  - - [1152, 256, 1, 1]
    - [69, 0.749]
  - - [1152, 256, 1, 1444]
    - [72, 51.731]
  - - [1152, 256, 1, 25]
    - [69, 13.098]
  - - [1152, 256, 1, 9]
    - [69, 5.649]
  - - [2304, 256, 1, 1444]
    - [96, 69.841]
  - - [2304, 340, 1, 1]
    - [128, 1.263]
  - - [2304, 340, 1, 1444]
    - [121, 52.494]
  - - [2304, 340, 1, 9]
    - [114, 9.637]
  - - [2304, 510, 1, 25]
    - [114, 23.416]
  - - [30522, 77, 1, 1024]
    - [105, 45.383]
  - - [1024, 780, 1, 1024]
    - [134, 58.368]
  - - [1024, 800, 1, 1024]
    - [134, 60.092]
  - - [1024, 820, 1, 1024]
    - [134, 61.517]
  - - [1024, 385, 1, 1024]
    - [87, 41.95]
  - - [1024, 462, 1, 1024]
    - [87, 49.448]
  - - [64, 512, 256, 512]
    - [88, 41.061]
  - - [64, 512, 128, 512]
    - [135, 46.529]
  - - [64, 512, 40, 512]
    - [135, 45.902]
  - - [96, 1024, 64, 1024]
    - [85, 46.538]
  - - [96, 1024, 128, 1024]
    - [108, 47.504]
  - - [64, 1024, 256, 1024]
    - [111, 42.18]
  - - [64, 1024, 32, 1024]
    - [86, 45.185]
  - - [64, 1024, 64, 1024]
    - [88, 40.497]
  - - [64, 1024, 128, 1024]
    - [137, 42.121]
  - - [64, 128, 1024, 128]
    - [135, 51.014]
  - - [1024, 864, 1, 1024]
    - [82, 54.312]
  - - [1024, 864, 1, 480]
    - [96, 54.93]
  - - [128, 3456, 1, 256]
    - [105, 37.903]
  - - [128, 4096, 1, 256]
    - [85, 43.692]
  - - [128, 6912, 1, 256]
    - [82, 51.768]
  - - [256, 3456, 1, 512]
    - [82, 54.502]
  - - [512, 864, 1, 1024]
    - [136, 46.895]
  - - [512, 864, 1, 13]
    - [114, 9.754]
  - - [64, 128, 1280, 128]
    - [137, 30.31]
  - - [64, 128, 1312, 128]
    - [89, 29.362]
  - - [64, 512, 192, 512]
    - [137, 40.975]
  - - [1024, 512, 1, 196]
    - [73, 41.174]
  - - [64, 128, 2048, 128]
    - [112, 26.579]
  - - [64, 128, 1536, 128]
    - [139, 26.8]
  - - [128, 128, 64, 6400]
    - [113, 52.115]
  - - [64, 128, 192, 128]
    - [109, 41.327]
  - - [64, 384, 144, 384]
    - [132, 57.723]
  - - [64, 512, 48, 512]
    - [86, 46.353]
  - - [64, 128, 256, 128]
    - [107, 44.923]
  - - [64, 384, 192, 384]
    - [86, 49.683]
  - - [128, 128, 49, 1120]
    - [95, 64.576]
  - - [128, 128, 49, 1064]
    - [95, 65.948]
  - - [128, 128, 49, 1040]
    - [73, 65.88]
  - - [128, 128, 64, 600]
    - [121, 68.104]
  - - [128, 128, 64, 616]
    - [74, 68.059]
  - - [128, 128, 49, 950]
    - [95, 65.023]
  - - [128, 128, 49, 972]
    - [118, 65.172]
  - - [128, 128, 64, 560]
    - [96, 67.586]
  - - [128, 128, 49, 1008]
    - [95, 65.808]
  - - [128, 128, 64, 532]
    - [74, 66.476]
  - - [128, 128, 49, 1080]
    - [95, 65.988]
  - - [128, 128, 64, 588]
    - [121, 67.062]
  - - [128, 128, 49, 1160]
    - [95, 66.106]
  - - [128, 128, 49, 988]
    - [118, 65.23]
  - - [128, 128, 49, 936]
    - [73, 65.501]
  - - [512, 1024, 1, 3800]
    - [74, 65.966]
  - - [512, 1024, 1, 3400]
    - [121, 65.772]
  - - [512, 1024, 1, 3456]
    - [126, 61.707]
  - - [2048, 512, 1, 950]
    - [96, 70.026]
  - - [512, 1024, 1, 3552]
    - [96, 65.907]
  - - [512, 1024, 1, 3220]
    - [96, 65.325]
  - - [2048, 512, 1, 850]
    - [96, 69.526]
  - - [512, 2048, 1, 864]
    - [121, 70.279]
  - - [512, 2048, 1, 768]
    - [136, 64.328]
  - - [2048, 512, 1, 805]
    - [96, 69.395]
  - - [512, 1024, 1, 2852]
    - [121, 65.091]
  - - [512, 2048, 1, 888]
    - [121, 70.509]
  - - [2048, 512, 1, 864]
    - [96, 70.229]
  - - [2048, 512, 1, 888]
    - [96, 70.297]
  - - [2048, 256, 1, 950]
    - [73, 60.051]
  - - [2048, 512, 1, 713]
    - [96, 68.781]
  - - [512, 1024, 1, 2688]
    - [126, 61.089]
  - - [512, 1024, 1, 2640]
    - [121, 65.375]
  - - [512, 1024, 1, 2904]
    - [96, 65.47]
  - - [1024, 512, 1, 950]
    - [96, 60.601]
  - - [512, 2048, 1, 672]
    - [96, 69.656]
  - - [512, 2048, 1, 660]
    - [96, 68.899]
  - - [512, 2048, 1, 1008]
    - [96, 70.753]
  - - [2048, 256, 1, 850]
    - [73, 59.875]
  - - [2048, 512, 1, 726]
    - [121, 69.025]
  - - [1024, 512, 1, 850]
    - [73, 60.164]
  - - [2048, 512, 1, 660]
    - [121, 68.443]
  - - [2048, 512, 1, 672]
    - [96, 69.503]
  - - [512, 2048, 1, 840]
    - [121, 70.063]
  - - [2048, 512, 1, 1008]
    - [96, 70.73]
  - - [512, 2048, 1, 792]
    - [121, 70.085]
  - - [1024, 512, 1, 805]
    - [73, 59.618]
  - - [512, 2048, 1, 1050]
    - [121, 70.442]
  - - [2048, 512, 1, 748]
    - [96, 69.359]
  - - [2048, 256, 1, 864]
    - [74, 60.43]
  - - [1024, 512, 1, 864]
    - [96, 61.116]
  - - [2048, 512, 1, 875]
    - [96, 69.688]
  - - [2048, 512, 1, 840]
    - [96, 69.963]
  - - [2048, 512, 1, 792]
    - [96, 69.905]
  - - [512, 2048, 1, 736]
    - [96, 69.832]
  - - [2048, 256, 1, 888]
    - [73, 60.462]
  - - [512, 2048, 1, 704]
    - [121, 69.503]
  - - [512, 2048, 1, 588]
    - [96, 68.348]
  - - [1024, 512, 1, 888]
    - [121, 61.026]
  - - [512, 2048, 1, 816]
    - [121, 70.139]
  - - [1024, 512, 1, 713]
    - [73, 59.054]
  - - [2048, 512, 1, 736]
    - [121, 69.557]
  - - [2048, 512, 1, 588]
    - [96, 68.244]
  - - [2048, 512, 1, 704]
    - [96, 69.3]
  - - [1024, 512, 1, 660]
    - [73, 58.648]
  - - [2048, 256, 1, 660]
    - [73, 58.341]
  - - [2048, 256, 1, 672]
    - [73, 59.049]
  - - [1024, 512, 1, 672]
    - [73, 59.18]
  - - [1024, 512, 1, 726]
    - [73, 59.013]
  - - [512, 2048, 1, 630]
    - [96, 68.641]
  - - [512, 2048, 1, 600]
    - [121, 69.133]
  - - [2048, 256, 1, 805]
    - [73, 59.392]
  - - [2048, 256, 1, 713]
    - [73, 58.887]
  - - [2048, 256, 1, 726]
    - [73, 58.734]
  - - [320, 1024, 1, 1024]
    - [129, 36.513]
  - - [1024, 1000, 1, 1024]
    - [105, 63.299]
  - - [320, 1000, 1, 1024]
    - [102, 36.324]
  - - [128, 128, 49, 1280]
    - [85, 59.979]
  - - [128, 128, 49, 1360]
    - [95, 66.494]
  - - [128, 128, 49, 1200]
    - [118, 66.237]
  - - [128, 128, 49, 1240]
    - [95, 66.246]
  - - [2304, 256, 1, 704]
    - [74, 65.686]
  - - [2304, 256, 1, 736]
    - [73, 66.169]
  - - [2304, 256, 1, 792]
    - [74, 66.737]
  - - [2304, 256, 1, 748]
    - [95, 65.479]
  - - [2304, 256, 1, 726]
    - [73, 65.312]
  - - [2304, 256, 1, 713]
    - [73, 65.113]
  - - [2304, 256, 1, 768]
    - [87, 60.394]
  - - [512, 2048, 1, 759]
    - [121, 69.345]
  - - [512, 2048, 1, 925]
    - [96, 69.995]
  - - [2304, 256, 1, 805]
    - [73, 66.115]
  - - [512, 2048, 1, 900]
    - [121, 69.959]
  - - [512, 2048, 1, 875]
    - [96, 69.972]
  - - [512, 2048, 1, 748]
    - [96, 69.413]
  - - [512, 2048, 1, 726]
    - [121, 69.025]
  - - [512, 2048, 1, 713]
    - [96, 69.065]
  - - [512, 2048, 1, 805]
    - [96, 69.548]
  - - [512, 2048, 1, 850]
    - [121, 69.548]
  - - [512, 2048, 1, 950]
    - [96, 70.049]
  - - [96, 1024, 160, 1024]
    - [85, 47.865]
  - - [96, 1024, 40, 1024]
    - [85, 49.737]
  - - [96, 1024, 80, 1024]
    - [85, 46.552]
  - - [96, 1024, 96, 1024]
    - [87, 47.662]
  - - [96, 1024, 24, 1024]
    - [87, 51.488]
  - - [96, 1024, 48, 1024]
    - [134, 47.003]
  - - [96, 1024, 16, 1024]
    - [110, 50.667]
  - - [96, 1024, 32, 1024]
    - [136, 50.807]
  - - [64, 512, 320, 512]
    - [88, 41.512]
  - - [64, 512, 80, 512]
    - [86, 51.79]
  - - [29000, 109, 1, 2560]
    - [87, 54.235]
  - - [29000, 121, 1, 2560]
    - [110, 62.239]
  - - [29000, 65, 1, 2560]
    - [87, 34.763]
  - - [29000, 66, 1, 2560]
    - [136, 35.566]
  - - [29000, 67, 1, 2560]
    - [136, 35.625]
  - - [29000, 69, 1, 2560]
    - [87, 37.028]
  - - [29000, 70, 1, 2560]
    - [110, 37.736]
  - - [29000, 71, 1, 2560]
    - [110, 38.034]
  - - [29000, 73, 1, 2560]
    - [87, 39.153]
  - - [29000, 74, 1, 2560]
    - [110, 39.103]
  - - [29000, 75, 1, 2560]
    - [87, 39.369]
  - - [29000, 77, 1, 2560]
    - [87, 41.188]
  - - [29000, 78, 1, 2560]
    - [136, 41.539]
  - - [29000, 80, 1, 2560]
    - [87, 42.189]
  - - [29000, 81, 1, 2560]
    - [110, 43.358]
  - - [29000, 82, 1, 2560]
    - [136, 42.911]
  - - [29000, 83, 1, 2560]
    - [87, 44.404]
  - - [29000, 84, 1, 2560]
    - [136, 44.418]
  - - [29000, 88, 1, 2560]
    - [87, 46.516]
  - - [29000, 89, 1, 2560]
    - [110, 47.111]
  - - [29000, 90, 1, 2560]
    - [87, 47.102]
  - - [29000, 92, 1, 2560]
    - [87, 48.912]
  - - [29000, 95, 1, 2560]
    - [136, 48.691]
  - - [29000, 98, 1, 2560]
    - [136, 49.904]
  - - [64, 1024, 512, 1024]
    - [111, 42.758]
  - - [1024, 200, 1, 13312]
    - [147, 48.018]
  - - [1024, 256, 1, 15360]
    - [147, 61.531]
  - - [1024, 256, 1, 16384]
    - [148, 54.899]
  - - [1024, 200, 1, 16384]
    - [147, 44.788]
  - - [1024, 256, 1, 12288]
    - [147, 60.254]
  - - [1024, 200, 1, 12288]
    - [147, 47.472]
  - - [1024, 200, 1, 15360]
    - [147, 48.844]
  - - [1024, 256, 1, 9216]
    - [147, 58.743]
  - - [1024, 200, 1, 14336]
    - [147, 48.528]
  - - [1024, 256, 1, 16640]
    - [156, 62.32]
  - - [1024, 200, 1, 8192]
    - [147, 45.14]
  - - [1024, 200, 1, 10240]
    - [147, 46.809]
  - - [1024, 200, 1, 9216]
    - [147, 46.588]
  - - [1024, 256, 1, 11264]
    - [147, 60.511]
  - - [1024, 200, 1, 8320]
    - [147, 45.983]
  - - [1024, 256, 1, 8320]
    - [162, 58.007]
  - - [1024, 200, 1, 16640]
    - [162, 49.349]
  - - [1024, 256, 1, 14336]
    - [147, 61.242]
  - - [1024, 256, 1, 13312]
    - [147, 60.737]
  - - [1024, 200, 1, 11264]
    - [147, 47.603]
  - - [1024, 256, 1, 8192]
    - [147, 54.33]
  - - [1024, 256, 1, 10240]
    - [147, 59.054]
  - - [96, 64, 64, 18432]
    - [138, 28.252]
  - - [96, 64, 36, 10368]
    - [84, 32.782]
  - - [96, 64, 36, 20736]
    - [154, 32.71]
  - - [96, 96, 36, 10368]
    - [87, 35.945]
  - - [96, 64, 49, 28800]
    - [168, 32.114]
  - - [96, 64, 36, 41472]
    - [168, 32.43]
  - - [64, 64, 11, 233600]
    - [167, 24.467]
  - - [64, 64, 11, 116800]
    - [153, 25.293]
  - - [64, 64, 9, 172864]
    - [143, 28.988]
  - - [64, 64, 11, 58400]
    - [164, 27.702]
  - - [192, 160, 9, 19584]
    - [160, 39.103]
  - - [128, 128, 9, 9792]
    - [149, 57.619]
  - - [192, 160, 11, 13056]
    - [154, 38.314]
  - - [64, 64, 9, 86432]
    - [151, 28.104]
  - - [128, 128, 9, 19584]
    - [148, 52.832]
  - - [160, 160, 11, 13056]
    - [165, 33.224]
  - - [160, 160, 9, 19584]
    - [150, 36.053]
  - - [192, 128, 9, 19584]
    - [162, 48.839]
  - - [192, 160, 9, 9792]
    - [158, 46.593]
  - - [64, 64, 9, 345728]
    - [157, 28.577]
  - - [128, 128, 11, 13056]
    - [146, 47.08]
  - - [160, 160, 9, 9792]
    - [158, 39.374]
  - - [192, 128, 11, 13056]
    - [155, 43.836]
  - - [192, 128, 9, 9792]
    - [159, 53.852]
  - - [128, 64, 25, 43320]
    - [161, 36.816]
  - - [64, 64, 64, 20280]
    - [119, 28.401]
  - - [64, 64, 49, 27000]
    - [97, 27.919]
  - - [64, 64, 36, 43320]
    - [163, 28.713]
  - - [64, 64, 36, 50176]
    - [157, 28.072]
  - - [64, 64, 49, 36864]
    - [88, 27.088]
  - - [64, 64, 64, 25600]
    - [137, 26.949]
  - - [256, 256, 1, 60800]
    - [150, 44.364]
  - - [256, 256, 1, 54400]
    - [144, 44.359]
  - - [256, 256, 1, 51520]
    - [141, 46.047]
  - - [256, 256, 1, 55296]
    - [154, 44.305]
  - - [256, 256, 1, 56832]
    - [146, 44.495]
  - - [256, 256, 1, 45632]
    - [141, 45.758]
  - - [256, 256, 1, 49152]
    - [145, 40.299]
  - - [256, 512, 1, 13600]
    - [149, 56.798]
  - - [256, 256, 1, 43008]
    - [146, 43.773]
  - - [256, 512, 1, 15200]
    - [152, 57.538]
  - - [256, 512, 1, 12880]
    - [142, 55.981]
  - - [256, 512, 1, 13824]
    - [162, 52.954]
  - - [512, 256, 1, 13824]
    - [166, 52.255]
  - - [256, 512, 1, 14208]
    - [156, 53.784]
  - - [512, 256, 1, 14208]
    - [166, 53.468]
  - - [512, 256, 1, 15200]
    - [142, 57.619]
  - - [256, 512, 1, 12288]
    - [156, 51.434]
  - - [512, 256, 1, 12288]
    - [147, 51.122]
  - - [1024, 200, 1, 560]
    - [191, 20.402]
  - - [768, 320, 1, 768]
    - [215, 25.649]
  - - [1024, 120, 1, 1024]
    - [215, 20.966]
  - - [1024, 128, 1, 128]
    - [213, 15.078]
  - - [2368, 64, 1, 3328]
    - [197, 18.53]
  - - [1408, 64, 1, 1280]
    - [215, 15.904]
  - - [4096, 32, 1, 4096]
    - [179, 21.02]
  - - [3072, 64, 1, 1024]
    - [197, 22.035]
  - - [2944, 64, 1, 256]
    - [197, 19.712]
  - - [6144, 32, 1, 2560]
    - [181, 21.467]
  - - [1856, 64, 1, 1280]
    - [183, 20.501]
  - - [704, 128, 1, 1280]
    - [203, 16.563]
  - - [4288, 64, 1, 3328]
    - [199, 29.2]
  - - [64, 3584, 1, 3328]
    - [215, 24.742]
  - - [704, 256, 1, 128]
    - [213, 16.68]
  - - [128, 1408, 1, 128]
    - [181, 17.063]
  - - [448, 448, 1, 256]
    - [213, 21.034]
  - - [7680, 32, 1, 2560]
    - [213, 21.936]
  - - [128, 1024, 1, 3328]
    - [183, 24.287]
  - - [64, 1856, 1, 1280]
    - [199, 21.372]
  - - [256, 1024, 1, 256]
    - [199, 24.9]
  - - [1024, 128, 1, 1280]
    - [215, 23.118]
  - - [3072, 32, 1, 1024]
    - [179, 16.784]
  - - [448, 256, 1, 3328]
    - [199, 21.128]
  - - [128, 1024, 1, 128]
    - [181, 15.448]
  - - [448, 448, 1, 3328]
    - [197, 23.971]
  - - [128, 704, 1, 1280]
    - [211, 17.095]
  - - [1856, 128, 1, 3328]
    - [199, 25.609]
  - - [35, 8457, 1, 1760]
    - [174, 16.12]
  - - [64, 2944, 1, 128]
    - [181, 17.839]
  - - [8448, 32, 1, 2816]
    - [181, 23.303]
  - - [1408, 128, 1, 1280]
    - [213, 21.39]
  - - [128, 1856, 1, 1280]
    - [183, 25.117]
  - - [2560, 64, 1, 2560]
    - [213, 19.73]
  - - [256, 448, 1, 256]
    - [199, 16.896]
  - - [128, 1856, 1, 128]
    - [199, 20.357]
  - - [2560, 32, 1, 2560]
    - [211, 14.893]
  - - [128, 1408, 1, 256]
    - [181, 19.382]
  - - [35, 8457, 1, 2560]
    - [215, 16.12]
  - - [4288, 64, 1, 128]
    - [199, 23.24]
  - - [256, 448, 1, 3328]
    - [174, 21.183]
  - - [64, 2368, 1, 1280]
    - [204, 18.182]
  - - [2368, 64, 1, 256]
    - [197, 16.03]
  - - [704, 128, 1, 3328]
    - [188, 16.946]
  - - [4288, 64, 1, 1280]
    - [199, 28.825]
  - - [1408, 128, 1, 128]
    - [181, 16.734]
  - - [128, 1024, 1, 1280]
    - [183, 23.136]
  - - [2944, 64, 1, 128]
    - [181, 17.325]
  - - [1024, 128, 1, 3328]
    - [199, 23.971]
  - - [704, 128, 1, 256]
    - [199, 13.413]
  - - [448, 256, 1, 1280]
    - [183, 20.813]
  - - [1856, 128, 1, 1280]
    - [199, 25.144]
  - - [64, 3584, 1, 256]
    - [199, 22.04]
  - - [3584, 64, 1, 128]
    - [199, 18.245]
  - - [256, 1024, 1, 1280]
    - [199, 27.657]
  - - [3584, 64, 1, 1280]
    - [215, 24.075]
  - - [64, 4288, 1, 3328]
    - [183, 29.268]
  - - [64, 1856, 1, 256]
    - [199, 17.411]
  - - [35, 8457, 1, 2048]
    - [183, 16.098]
  - - [256, 704, 1, 256]
    - [197, 19.166]
  - - [2368, 64, 1, 128]
    - [181, 14.253]
  - - [256, 1024, 1, 128]
    - [215, 22.004]
  - - [704, 256, 1, 3328]
    - [213, 22.04]
  - - [35, 8457, 1, 4096]
    - [199, 15.593]
  - - [64, 2944, 1, 256]
    - [213, 18.827]
  - - [448, 256, 1, 128]
    - [199, 13.63]
  - - [64, 1408, 1, 1280]
    - [179, 16.851]
  - - [1408, 128, 1, 256]
    - [197, 18.958]
  - - [64, 2944, 1, 1280]
    - [189, 22.153]
  - - [128, 704, 1, 128]
    - [178, 11.121]
  - - [64, 1408, 1, 3328]
    - [179, 17.325]
  - - [256, 448, 1, 1280]
    - [215, 20.673]
  - - [704, 256, 1, 1280]
    - [197, 21.548]
  - - [64, 2368, 1, 3328]
    - [204, 18.724]
  - - [1856, 64, 1, 128]
    - [181, 13.828]
  - - [4096, 64, 1, 4096]
    - [183, 27.9]
  - - [1760, 128, 1, 1760]
    - [174, 24.052]
  - - [704, 128, 1, 128]
    - [178, 11.216]
  - - [256, 704, 1, 3328]
    - [197, 22.229]
  - - [256, 448, 1, 128]
    - [199, 13.301]
  - - [64, 3584, 1, 128]
    - [199, 19.712]
  - - [64, 2944, 1, 3328]
    - [172, 22.744]
  - - [1024, 128, 1, 256]
    - [215, 18.597]
  - - [2944, 64, 1, 1280]
    - [197, 22.324]
  - - [128, 1408, 1, 3328]
    - [197, 22.193]
  - - [1408, 64, 1, 256]
    - [178, 13.012]
  - - [64, 1856, 1, 128]
    - [181, 14.059]
  - - [64, 2368, 1, 256]
    - [181, 16.36]
  - - [1856, 128, 1, 128]
    - [183, 20.294]
  - - [2368, 64, 1, 1280]
    - [197, 18.25]
  - - [4288, 64, 1, 256]
    - [183, 26.109]
  - - [64, 4288, 1, 1280]
    - [215, 28.92]
  - - [1408, 64, 1, 3328]
    - [188, 16.693]
  - - [64, 1408, 1, 128]
    - [169, 11.027]
  - - [256, 704, 1, 128]
    - [181, 16.68]
  - - [1408, 64, 1, 128]
    - [178, 11.027]
  - - [448, 448, 1, 1280]
    - [197, 23.975]
  - - [128, 1024, 1, 256]
    - [183, 19.017]
  - - [3584, 64, 1, 3328]
    - [215, 24.625]
  - - [256, 1024, 1, 3328]
    - [183, 28.009]
  - - [1856, 64, 1, 3328]
    - [183, 21.422]
  - - [448, 256, 1, 256]
    - [199, 17.072]
  - - [4608, 32, 1, 1536]
    - [179, 22.739]
  - - [128, 704, 1, 256]
    - [179, 13.346]
  - - [64, 3584, 1, 1280]
    - [199, 24.341]
  - - [3584, 64, 1, 256]
    - [199, 21.435]
  - - [64, 1856, 1, 3328]
    - [215, 21.625]
  - - [2048, 128, 1, 2048]
    - [199, 27.855]
  - - [1408, 128, 1, 3328]
    - [197, 22.022]
  - - [128, 704, 1, 3328]
    - [211, 17.799]
  - - [128, 1856, 1, 256]
    - [183, 22.527]
  - - [64, 4288, 1, 256]
    - [199, 26.281]
  - - [1856, 64, 1, 256]
    - [199, 16.978]
  - - [256, 704, 1, 1280]
    - [197, 21.774]
  - - [64, 2368, 1, 128]
    - [181, 14.442]
  - - [64, 4288, 1, 128]
    - [199, 23.515]
  - - [1856, 128, 1, 256]
    - [199, 22.983]
  - - [2048, 64, 1, 2048]
    - [197, 23.032]
  - - [64, 1408, 1, 256]
    - [179, 13.445]
  - - [2944, 64, 1, 3328]
    - [197, 22.87]
  - - [128, 1408, 1, 1280]
    - [213, 21.71]
  - - [128, 1856, 1, 3328]
    - [183, 25.514]
  - - [1760, 64, 1, 1760]
    - [191, 20.939]
  - - [448, 448, 1, 128]
    - [181, 18.457]
  - - [704, 256, 1, 256]
    - [213, 18.958]
  - - [256, 1024, 1, 196]
    - [191, 23.655]
  - - [1024, 256, 1, 1536]
    - [215, 27.607]
  - - [1024, 200, 1, 1408]
    - [191, 21.805]
  - - [1024, 200, 1, 6144]
    - [183, 22.04]
  - - [1024, 256, 1, 3328]
    - [199, 28.185]
  - - [512, 256, 1, 3200]
    - [174, 24.819]
  - - [1024, 200, 1, 4608]
    - [199, 22.148]
  - - [512, 256, 1, 1792]
    - [215, 23.583]
  - - [1024, 200, 1, 1792]
    - [199, 21.904]
  - - [512, 200, 1, 2816]
    - [174, 19.08]
  - - [512, 200, 1, 3072]
    - [215, 18.864]
  - - [1024, 200, 1, 128]
    - [191, 17.343]
  - - [1024, 200, 1, 5120]
    - [215, 22.116]
  - - [1024, 256, 1, 256]
    - [199, 24.778]
  - - [512, 256, 1, 2560]
    - [215, 23.664]
  - - [1024, 256, 1, 4160]
    - [191, 28.442]
  - - [1024, 200, 1, 512]
    - [215, 20.898]
  - - [512, 512, 1, 1536]
    - [199, 27.77]
  - - [1024, 256, 1, 896]
    - [215, 27.413]
  - - [1024, 200, 1, 3200]
    - [215, 22.121]
  - - [1024, 200, 1, 1536]
    - [215, 21.787]
  - - [1024, 256, 1, 1024]
    - [215, 27.291]
  - - [128, 1024, 1, 512]
    - [183, 21.656]
  - - [1024, 256, 1, 5120]
    - [183, 27.923]
  - - [1024, 200, 1, 2304]
    - [199, 21.99]
  - - [1024, 256, 1, 1664]
    - [199, 27.964]
  - - [512, 512, 1, 1024]
    - [199, 27.436]
  - - [1024, 256, 1, 2080]
    - [191, 28.18]
  - - [512, 200, 1, 768]
    - [183, 17.83]
  - - [1024, 256, 1, 2816]
    - [199, 28.14]
  - - [1024, 200, 1, 64]
    - [191, 14.424]
  - - [512, 512, 1, 2304]
    - [199, 27.873]
  - - [128, 1024, 1, 2048]
    - [183, 23.56]
  - - [512, 200, 1, 2560]
    - [183, 18.931]
  - - [512, 256, 1, 1024]
    - [183, 23.434]
  - - [1024, 256, 1, 1920]
    - [199, 27.995]
  - - [512, 200, 1, 2304]
    - [174, 18.769]
  - - [1024, 256, 1, 384]
    - [199, 26.132]
  - - [1024, 256, 1, 32]
    - [191, 13.233]
  - - [1024, 200, 1, 2816]
    - [215, 22.089]
  - - [1024, 200, 1, 3072]
    - [199, 21.999]
  - - [512, 256, 1, 1536]
    - [183, 23.506]
  - - [1024, 256, 1, 512]
    - [215, 26.488]
  - - [256, 512, 1, 512]
    - [199, 21.877]
  - - [1024, 200, 1, 3840]
    - [199, 21.936]
  - - [256, 1024, 1, 512]
    - [199, 26.745]
  - - [1024, 256, 1, 1152]
    - [199, 27.684]
  - - [512, 512, 1, 2816]
    - [199, 27.977]
  - - [512, 200, 1, 1280]
    - [199, 18.597]
  - - [512, 200, 1, 3200]
    - [191, 19.274]
  - - [1024, 256, 1, 2304]
    - [199, 28.031]
  - - [1024, 256, 1, 6144]
    - [183, 28.085]
  - - [1024, 200, 1, 2560]
    - [215, 22.031]
  - - [1024, 256, 1, 5632]
    - [215, 28.117]
  - - [512, 256, 1, 768]
    - [199, 22.938]
  - - [1024, 256, 1, 3072]
    - [215, 27.968]
  - - [256, 512, 1, 2048]
    - [183, 23.574]
  - - [1024, 200, 1, 1152]
    - [215, 21.715]
  - - [512, 512, 1, 3072]
    - [183, 28.049]
  - - [1024, 200, 1, 1664]
    - [215, 21.895]
  - - [1024, 200, 1, 32]
    - [191, 9.727]
  - - [1024, 200, 1, 384]
    - [215, 20.533]
  - - [512, 256, 1, 2304]
    - [215, 23.813]
  - - [256, 512, 1, 1024]
    - [183, 23.29]
  - - [1024, 200, 1, 3328]
    - [215, 22.125]
  - - [1024, 200, 1, 2080]
    - [191, 22.067]
  - - [512, 200, 1, 1792]
    - [174, 18.629]
  - - [1024, 256, 1, 1792]
    - [199, 27.91]
  - - [1024, 200, 1, 7168]
    - [183, 22.076]
  - - [512, 256, 1, 3072]
    - [215, 23.669]
  - - [1024, 200, 1, 2048]
    - [215, 21.909]
  - - [512, 512, 1, 1280]
    - [199, 27.657]
  - - [1024, 200, 1, 1280]
    - [215, 21.679]
  - - [512, 200, 1, 512]
    - [183, 16.896]
  - - [1024, 256, 1, 2560]
    - [199, 27.964]
  - - [1024, 200, 1, 1024]
    - [183, 21.417]
  - - [1024, 256, 1, 3200]
    - [199, 28.266]
  - - [512, 512, 1, 2560]
    - [199, 28.022]
  - - [1024, 256, 1, 640]
    - [199, 26.994]
  - - [1024, 256, 1, 3584]
    - [199, 28.063]
  - - [512, 512, 1, 3200]
    - [191, 28.289]
  - - [1024, 256, 1, 7680]
    - [215, 27.639]
  - - [512, 200, 1, 1536]
    - [183, 18.539]
  - - [512, 256, 1, 2816]
    - [215, 23.993]
  - - [1024, 200, 1, 768]
    - [215, 21.386]
  - - [512, 200, 1, 2048]
    - [183, 18.584]
  - - [1024, 256, 1, 128]
    - [215, 21.814]
  - - [1024, 200, 1, 4096]
    - [215, 22.058]
  - - [1024, 256, 1, 1280]
    - [199, 27.648]
  - - [1024, 200, 1, 896]
    - [199, 21.525]
  - - [1024, 256, 1, 4608]
    - [215, 27.995]
  - - [128, 1024, 1, 1024]
    - [183, 23.059]
  - - [1024, 256, 1, 2048]
    - [199, 27.846]
  - - [512, 256, 1, 1280]
    - [183, 23.565]
  - - [256, 1024, 1, 2048]
    - [183, 27.86]
  - - [512, 512, 1, 2048]
    - [183, 27.81]
  - - [512, 256, 1, 512]
    - [199, 22.198]
  - - [1024, 200, 1, 7680]
    - [215, 21.922]
  - - [1024, 200, 1, 6656]
    - [199, 22.162]
  - - [512, 200, 1, 1024]
    - [183, 18.381]
  - - [1024, 256, 1, 3840]
    - [215, 27.837]
  - - [512, 512, 1, 768]
    - [199, 27.341]
  - - [1024, 256, 1, 64]
    - [191, 18.552]
  - - [1024, 200, 1, 1920]
    - [174, 21.904]
  - - [1024, 256, 1, 7168]
    - [183, 28.09]
  - - [512, 512, 1, 1792]
    - [199, 27.779]
  - - [1024, 200, 1, 256]
    - [215, 19.68]
  - - [256, 1024, 1, 1024]
    - [199, 27.377]
  - - [1024, 200, 1, 640]
    - [215, 21.241]
  - - [1024, 200, 1, 4160]
    - [191, 22.238]
  - - [1024, 200, 1, 5632]
    - [199, 22.157]
  - - [1024, 256, 1, 6656]
    - [183, 28.144]
  - - [1024, 256, 1, 768]
    - [215, 27.21]
  - - [512, 256, 1, 2048]
    - [183, 23.673]
  - - [1024, 200, 1, 3584]
    - [215, 22.121]
  - - [1024, 256, 1, 1408]
    - [191, 27.828]
  - - [1024, 256, 1, 4096]
    - [183, 27.891]
  - - [1024, 128, 1, 289]
    - [191, 18.949]
  - - [768, 192, 1, 289]
    - [191, 21.507]
  - - [32, 32, 1984, 64]
    - [176, 16.847]
  - - [54, 54, 1184, 64]
    - [183, 22.175]
  - - [35, 35, 1808, 64]
    - [215, 9.624]
  - - [45, 45, 1424, 64]
    - [191, 15.8]
  - - [49, 49, 1296, 64]
    - [183, 18.444]
  - - [59, 59, 1088, 64]
    - [174, 26.312]
  - - [41, 41, 1552, 64]
    - [191, 13.107]
  - - [38, 38, 1680, 64]
    - [183, 11.383]
  - - [2048, 128, 1, 4096]
    - [199, 27.991]
  - - [1024, 128, 1, 1024]
    - [199, 22.816]
  - - [1152, 128, 1, 784]
    - [199, 25.32]
  - - [864, 96, 1, 1225]
    - [170, 15.498]
  - - [896, 192, 1, 289]
    - [204, 18.755]
  - - [768, 128, 1, 289]
    - [170, 14.501]
  - - [1344, 192, 1, 289]
    - [174, 24.999]
  - - [384, 192, 1, 1225]
    - [205, 15.529]
  - - [832, 192, 1, 49]
    - [204, 10.206]
  - - [1280, 192, 1, 64]
    - [191, 17.307]
  - - [512, 256, 1, 196]
    - [172, 16.896]
  - - [864, 96, 1, 289]
    - [170, 12.782]
  - - [896, 128, 1, 289]
    - [215, 16.878]
  - - [1200, 64, 1, 1225]
    - [188, 14.546]
  - - [1024, 256, 1, 289]
    - [191, 24.986]
  - - [1024, 256, 1, 196]
    - [191, 23.849]
  - - [1120, 192, 1, 289]
    - [174, 20.957]
  - - [800, 96, 1, 784]
    - [188, 14.343]
  - - [864, 128, 1, 784]
    - [199, 18.972]
  - - [1344, 224, 1, 289]
    - [204, 20.749]
  - - [1152, 192, 1, 784]
    - [174, 23.244]
  - - [800, 128, 1, 196]
    - [188, 13.806]
  - - [864, 208, 1, 196]
    - [204, 18.142]
  - - [720, 192, 1, 5041]
    - [174, 25.347]
  - - [576, 192, 1, 3136]
    - [174, 21.264]
  - - [832, 256, 1, 49]
    - [204, 13.228]
  - - [1200, 128, 1, 49]
    - [174, 9.538]
  - - [528, 256, 1, 196]
    - [215, 17.474]
  - - [256, 512, 1, 784]
    - [199, 23.114]
  - - [480, 192, 1, 196]
    - [179, 12.615]
  - - [96, 64, 36, 2592]
    - [206, 23.777]
  - - [96, 96, 36, 2592]
    - [170, 21.634]
  - - [1024, 192, 1, 289]
    - [204, 21.151]
  - - [528, 160, 1, 196]
    - [169, 11.6]
  - - [512, 160, 1, 196]
    - [169, 11.685]
  - - [768, 160, 1, 289]
    - [172, 17.722]
  - - [64, 32, 36, 43808]
    - [187, 13.454]
  - - [832, 160, 1, 49]
    - [173, 8.315]
  - - [2048, 64, 1, 1001]
    - [191, 21.417]
  - - [2048, 128, 1, 1001]
    - [191, 27.129]
  - - [1536, 64, 1, 1001]
    - [203, 18.02]
  - - [96, 96, 49, 3136]
    - [203, 22.189]
  - - [64, 32, 49, 57600]
    - [217, 13.003]
  - - [96, 64, 49, 6272]
    - [183, 20.009]
  - - [64, 32, 49, 115200]
    - [201, 11.961]
  - - [96, 96, 64, 2304]
    - [197, 20.632]
  - - [96, 96, 49, 6272]
    - [189, 18.787]
  - - [96, 64, 36, 5184]
    - [199, 23.858]
  - - [64, 32, 64, 40000]
    - [189, 18.381]
  - - [96, 64, 64, 4608]
    - [215, 19.486]
  - - [96, 96, 36, 5184]
    - [188, 21.701]
  - - [96, 64, 64, 2304]
    - [215, 21.219]
  - - [96, 64, 49, 3136]
    - [191, 21.765]
  - - [64, 32, 36, 87616]
    - [214, 13.296]
  - - [64, 32, 64, 80000]
    - [209, 15.263]
  - - [96, 96, 64, 4608]
    - [197, 18.119]
  - - [64, 32, 36, 175232]
    - [198, 12.362]
  - - [128, 128, 11, 3264]
    - [188, 22.211]
  - - [192, 128, 11, 6528]
    - [191, 29.128]
  - - [128, 128, 11, 6528]
    - [189, 22.283]
  - - [160, 160, 9, 4896]
    - [172, 21.318]
  - - [192, 160, 11, 6528]
    - [189, 24.963]
  - - [192, 128, 9, 4896]
    - [191, 24.079]
  - - [128, 128, 9, 4896]
    - [191, 28.334]
  - - [192, 128, 11, 3264]
    - [174, 29.213]
  - - [160, 160, 11, 3264]
    - [203, 22.929]
  - - [192, 160, 9, 4896]
    - [204, 25.55]
  - - [192, 160, 11, 3264]
    - [172, 24.95]
  - - [160, 160, 11, 6528]
    - [195, 22.879]
  - - [4096, 64, 1, 1024]
    - [215, 27.156]
  - - [49, 49, 160, 64]
    - [191, 13.269]
  - - [54, 54, 592, 64]
    - [183, 20.736]
  - - [59, 59, 512, 64]
    - [206, 24.183]
  - - [104, 104, 16, 64]
    - [174, 11.568]
  - - [32, 32, 624, 64]
    - [173, 14.063]
  - - [32, 32, 992, 64]
    - [176, 15.182]
  - - [35, 35, 384, 64]
    - [183, 8.509]
  - - [35, 35, 904, 64]
    - [183, 9.362]
  - - [38, 38, 320, 64]
    - [199, 9.899]
  - - [38, 38, 840, 64]
    - [191, 11.027]
  - - [41, 41, 312, 64]
    - [174, 11.252]
  - - [41, 41, 776, 64]
    - [174, 12.488]
  - - [45, 45, 392, 64]
    - [183, 14.063]
  - - [45, 45, 712, 64]
    - [199, 15.006]
  - - [49, 49, 648, 64]
    - [215, 17.591]
  - - [54, 54, 200, 64]
    - [215, 17.045]
  - - [59, 59, 544, 64]
    - [206, 24.675]
  - - [91, 91, 40, 64]
    - [203, 14.582]
  - - [91, 93, 40, 64]
    - [203, 15.038]
  - - [93, 93, 40, 64]
    - [203, 15.227]
  - - [102, 102, 56, 64]
    - [174, 15.75]
  - - [103, 103, 16, 64]
    - [174, 11.189]
  - - [103, 104, 16, 64]
    - [191, 11.351]
  - - [112, 112, 16, 64]
    - [191, 13.603]
  - - [112, 123, 16, 64]
    - [191, 15.011]
  - - [119, 119, 32, 64]
    - [174, 18.909]
  - - [119, 135, 32, 64]
    - [189, 17.713]
  - - [123, 123, 16, 64]
    - [174, 15.263]
  - - [512, 512, 1, 512]
    - [199, 26.867]
  - - [513, 512, 1, 512]
    - [183, 25.839]
  - - [512, 512, 1, 513]
    - [199, 26.565]
  - - [512, 512, 1, 511]
    - [191, 26.813]
  - - [512, 513, 1, 512]
    - [215, 26.132]
  - - [512, 511, 1, 512]
    - [199, 26.321]
  - - [511, 512, 1, 512]
    - [183, 26.231]
  - - [479, 512, 1, 512]
    - [199, 24.783]
  - - [480, 511, 1, 512]
    - [215, 24.787]
  - - [480, 512, 1, 511]
    - [174, 25.162]
  - - [480, 512, 1, 513]
    - [174, 25.058]
  - - [480, 513, 1, 512]
    - [183, 24.905]
  - - [481, 512, 1, 512]
    - [183, 24.887]
  - - [511, 480, 1, 512]
    - [183, 24.508]
  - - [512, 479, 1, 512]
    - [199, 24.805]
  - - [512, 480, 1, 511]
    - [191, 25.004]
  - - [512, 480, 1, 513]
    - [191, 25.036]
  - - [512, 481, 1, 512]
    - [199, 24.95]
  - - [513, 480, 1, 512]
    - [199, 24.499]
  - - [480, 512, 1, 512]
    - [183, 24.923]
  - - [512, 480, 1, 512]
    - [199, 24.724]
  - - [512, 512, 1, 64]
    - [191, 18.462]
  - - [2048, 114, 1, 512]
    - [199, 23.551]
  - - [2048, 114, 1, 768]
    - [199, 24.192]
  - - [256, 684, 1, 1024]
    - [213, 20.903]
  - - [33, 33, 1600, 32]
    - [191, 8.27]
  - - [383, 384, 1, 384]
    - [215, 22.874]
  - - [385, 384, 1, 384]
    - [181, 16.459]
  - - [384, 383, 1, 384]
    - [215, 22.956]
  - - [384, 385, 1, 384]
    - [181, 16.459]
  - - [384, 384, 1, 383]
    - [215, 23.335]
  - - [384, 384, 1, 385]
    - [215, 23.371]
  - - [384, 384, 1, 384]
    - [199, 23.741]
  - - [128, 64, 25, 6498]
    - [204, 25.23]
  - - [128, 64, 25, 6859]
    - [189, 24.819]
  - - [64, 64, 64, 3042]
    - [191, 28.076]
  - - [64, 64, 64, 3211]
    - [183, 27.837]
  - - [64, 64, 49, 4050]
    - [189, 24.539]
  - - [64, 64, 49, 4275]
    - [204, 24.58]
  - - [64, 64, 36, 6498]
    - [215, 27.738]
  - - [64, 64, 36, 6859]
    - [215, 25.979]
  - - [1152, 128, 1, 1444]
    - [174, 25.387]
  - - [512, 256, 1, 361]
    - [172, 19.838]
  - - [576, 128, 1, 1444]
    - [190, 15.583]
  - - [1024, 308, 1, 1024]
    - [197, 22.45]
  - - [1024, 160, 1, 1024]
    - [179, 19.581]
  - - [1024, 180, 1, 1024]
    - [213, 21.48]
  - - [32, 32, 4608, 64]
    - [208, 17.636]
  - - [32, 35, 4608, 64]
    - [203, 14.298]
  - - [34, 34, 4736, 64]
    - [199, 9.29]
  - - [35, 35, 4608, 64]
    - [174, 9.863]
  - - [128, 864, 1, 256]
    - [197, 15.85]
  - - [256, 864, 1, 512]
    - [199, 22.098]
  - - [512, 256, 1, 784]
    - [199, 23.159]
  - - [1024, 96, 1, 1024]
    - [179, 18.151]
  - - [1024, 256, 1, 3800]
    - [199, 27.991]
  - - [1024, 256, 1, 3400]
    - [199, 27.955]
  - - [256, 1024, 1, 3400]
    - [183, 28.162]
  - - [1024, 256, 1, 3220]
    - [215, 28.004]
  - - [256, 1024, 1, 3220]
    - [191, 28.162]
  - - [1024, 256, 1, 3456]
    - [199, 28.248]
  - - [256, 1024, 1, 3456]
    - [199, 28.221]
  - - [256, 1024, 1, 3072]
    - [199, 27.788]
  - - [1024, 256, 1, 3552]
    - [191, 28.388]
  - - [256, 1024, 1, 3552]
    - [191, 28.415]
  - - [256, 1024, 1, 2852]
    - [191, 28.122]
  - - [1024, 256, 1, 2852]
    - [215, 27.964]
  - - [256, 512, 1, 10752]
    - [213, 24.124]
  - - [256, 1024, 1, 3800]
    - [183, 28.207]
  - - [256, 512, 1, 10560]
    - [191, 25.536]
  - - [256, 1024, 1, 2992]
    - [191, 28.293]
  - - [256, 1024, 1, 2688]
    - [206, 28.185]
  - - [1024, 256, 1, 2688]
    - [215, 28.176]
  - - [256, 1024, 1, 2904]
    - [191, 28.085]
  - - [1024, 256, 1, 2904]
    - [215, 27.905]
  - - [256, 1024, 1, 2640]
    - [191, 28.23]
  - - [1024, 256, 1, 2640]
    - [191, 28.149]
  - - [1024, 256, 1, 4032]
    - [191, 28.424]
  - - [1024, 256, 1, 2992]
    - [199, 28.18]
  - - [256, 1024, 1, 3360]
    - [191, 28.406]
  - - [1024, 256, 1, 3360]
    - [191, 28.361]
  - - [1024, 256, 1, 3500]
    - [199, 27.919]
  - - [256, 1024, 1, 3500]
    - [199, 28.081]
  - - [1024, 256, 1, 3168]
    - [191, 28.334]
  - - [256, 1024, 1, 3168]
    - [191, 28.401]
  - - [256, 1024, 1, 3036]
    - [191, 28.234]
  - - [1024, 256, 1, 4200]
    - [199, 28.013]
  - - [1024, 256, 1, 3600]
    - [199, 28.234]
  - - [256, 1024, 1, 3600]
    - [199, 28.311]
  - - [256, 1024, 1, 2944]
    - [191, 28.221]
  - - [1024, 256, 1, 2944]
    - [215, 28.198]
  - - [1024, 256, 1, 3700]
    - [191, 28.054]
  - - [256, 1024, 1, 2352]
    - [191, 28.248]
  - - [1024, 256, 1, 2352]
    - [191, 28.104]
  - - [256, 1024, 1, 3700]
    - [183, 28.171]
  - - [256, 1024, 1, 2816]
    - [199, 27.855]
  - - [256, 512, 1, 11408]
    - [191, 24.787]
  - - [1024, 256, 1, 3036]
    - [191, 28.09]
  - - [1024, 256, 1, 3264]
    - [191, 28.343]
  - - [256, 1024, 1, 3264]
    - [191, 28.352]
  - - [1024, 256, 1, 3864]
    - [199, 27.991]
  - - [256, 1024, 1, 4032]
    - [215, 28.428]
  - - [1024, 256, 1, 3128]
    - [199, 27.941]
  - - [256, 1024, 1, 3128]
    - [183, 28.149]
  - - [256, 1024, 1, 3200]
    - [191, 28.252]
  - - [256, 512, 1, 11616]
    - [206, 25.518]
  - - [1024, 256, 1, 4000]
    - [199, 28.41]
  - - [256, 1024, 1, 2520]
    - [191, 28.122]
  - - [1024, 256, 1, 2520]
    - [199, 27.864]
  - - [256, 1024, 1, 2976]
    - [191, 28.361]
  - - [256, 1024, 1, 2400]
    - [191, 28.329]
  - - [1024, 256, 1, 2400]
    - [191, 28.239]
  - - [1024, 256, 1, 3696]
    - [191, 28.239]
  - - [1024, 256, 1, 3900]
    - [191, 28.203]
  - - [1024, 256, 1, 3772]
    - [191, 28.158]
  - - [256, 1024, 1, 3696]
    - [183, 28.325]
  - - [256, 1024, 1, 2728]
    - [191, 28.126]
  - - [1024, 256, 1, 2728]
    - [191, 27.878]
  - - [1024, 256, 1, 2480]
    - [191, 28.117]
  - - [256, 1024, 1, 2480]
    - [191, 28.275]
  - - [1024, 256, 1, 2880]
    - [191, 28.307]
  - - [512, 256, 1, 3220]
    - [172, 23.623]
  - - [256, 1024, 1, 2880]
    - [191, 28.379]
  - - [256, 1024, 1, 4200]
    - [183, 28.216]
  - - [1024, 256, 1, 3648]
    - [191, 28.374]
  - - [1024, 256, 1, 3312]
    - [191, 28.203]
  - - [256, 1024, 1, 3648]
    - [191, 28.406]
  - - [1024, 256, 1, 3300]
    - [215, 28.031]
  - - [1024, 256, 1, 3528]
    - [199, 27.982]
  - - [256, 1024, 1, 2604]
    - [191, 28.054]
  - - [1024, 256, 1, 2604]
    - [191, 27.828]
  - - [512, 256, 1, 11408]
    - [206, 24.778]
  - - [256, 1024, 1, 3312]
    - [191, 28.302]
  - - [256, 1024, 1, 3300]
    - [183, 28.081]
  - - [256, 1024, 1, 3528]
    - [183, 28.167]
  - - [1024, 256, 1, 2976]
    - [191, 28.325]
  - - [1024, 256, 1, 2760]
    - [191, 27.891]
  - - [512, 256, 1, 3800]
    - [172, 23.799]
  - - [256, 1024, 1, 2760]
    - [191, 28.185]
  - - [1024, 256, 1, 2160]
    - [191, 28.063]
  - - [256, 1024, 1, 2160]
    - [191, 28.239]
  - - [512, 256, 1, 11616]
    - [206, 25.536]
  - - [512, 256, 1, 2852]
    - [172, 23.547]
  - - [256, 1024, 1, 3864]
    - [199, 28.153]
  - - [512, 256, 1, 2640]
    - [191, 24.16]
  - - [256, 1024, 1, 4000]
    - [199, 28.442]
  - - [512, 256, 1, 2904]
    - [172, 23.673]
  - - [256, 1024, 1, 3900]
    - [183, 28.261]
  - - [512, 256, 1, 2688]
    - [191, 24.314]
  - - [256, 1024, 1, 3772]
    - [183, 28.252]
  - - [512, 256, 1, 3400]
    - [172, 23.759]
  - - [512, 256, 1, 3456]
    - [191, 24.377]
  - - [512, 256, 1, 3552]
    - [191, 25.108]
  - - [29000, 35, 1, 2560]
    - [215, 16.793]
  - - [29000, 36, 1, 2560]
    - [199, 17.325]
  - - [29000, 39, 1, 2560]
    - [199, 18.733]
  - - [29000, 40, 1, 2560]
    - [183, 19.161]
  - - [29000, 42, 1, 2560]
    - [199, 20.113]
  - - [29000, 43, 1, 2560]
    - [215, 20.619]
  - - [29000, 44, 1, 2560]
    - [199, 21.079]
  - - [29000, 46, 1, 2560]
    - [215, 22.031]
  - - [29000, 48, 1, 2560]
    - [183, 22.915]
  - - [29000, 49, 1, 2560]
    - [183, 23.479]
  - - [29000, 50, 1, 2560]
    - [199, 23.853]
  - - [29000, 51, 1, 2560]
    - [215, 24.359]
  - - [29000, 53, 1, 2560]
    - [199, 25.324]
  - - [29000, 54, 1, 2560]
    - [215, 25.721]
  - - [29000, 55, 1, 2560]
    - [215, 26.177]
  - - [29000, 56, 1, 2560]
    - [215, 26.655]
  - - [29000, 57, 1, 2560]
    - [199, 27.129]
  - - [29000, 58, 1, 2560]
    - [199, 27.612]
  - - [29000, 59, 1, 2560]
    - [183, 28.09]
  - - [29000, 61, 1, 2560]
    - [183, 28.938]
  - - [29000, 63, 1, 2560]
    - [199, 29.94]
  - - [288, 64, 1, 21609]
    - [232, 14.812]
  - - [32, 32, 36, 43808]
    - [223, 13.869]
  - - [32, 32, 64, 40000]
    - [234, 13.224]
  - - [32, 32, 49, 115200]
    - [239, 13.765]
  - - [32, 32, 36, 175232]
    - [231, 14.298]
  - - [32, 32, 49, 57600]
    - [239, 13.58]
  - - [32, 32, 36, 87616]
    - [223, 14.361]
  - - [32, 32, 64, 80000]
    - [228, 13.165]
  - - [256, 128, 1, 13600]
    - [219, 21.273]
  - - [256, 128, 1, 12880]
    - [219, 21.246]
  - - [128, 512, 1, 15200]
    - [237, 26.389]
  - - [512, 128, 1, 15200]
    - [237, 26.294]
  - - [128, 512, 1, 11408]
    - [224, 25.924]
  - - [256, 128, 1, 13824]
    - [219, 20.713]
  - - [128, 512, 1, 11616]
    - [224, 25.924]
  - - [256, 128, 1, 14208]
    - [233, 21.115]
  - - [128, 512, 1, 14208]
    - [220, 26.15]
  - - [256, 128, 1, 15200]
    - [219, 21.543]
  - - [512, 128, 1, 11408]
    - [230, 25.852]
  - - [512, 128, 1, 16800]
    - [230, 26.439]
  - - [128, 512, 1, 11264]
    - [230, 25.297]
  - - [512, 128, 1, 11616]
    - [235, 25.807]
  - - [512, 128, 1, 16128]
    - [237, 26.236]
  - - [512, 128, 1, 11968]
    - [237, 25.861]
  - - [128, 512, 1, 11968]
    - [224, 26.015]
  - - [512, 128, 1, 12288]
    - [237, 24.81]
  - - [128, 512, 1, 12288]
    - [230, 25.166]
  - - [128, 512, 1, 12672]
    - [220, 25.965]
  - - [512, 128, 1, 11776]
    - [237, 25.618]
  - - [512, 128, 1, 12144]
    - [226, 25.942]
  - - [512, 128, 1, 11264]
    - [230, 25.18]
  - - [128, 512, 1, 12144]
    - [224, 26.028]
  - - [512, 128, 1, 12672]
    - [230, 25.762]
  - - [128, 512, 1, 12512]
    - [230, 26.073]
  - - [128, 512, 1, 11776]
    - [224, 25.636]
  - - [256, 128, 1, 12288]
    - [240, 18.304]
  - - [40, 40, 1, 1909283]
    - [222, 1.999]
  - - [40, 40, 1, 3818566]
    - [222, 1.999]
  - - [30522, 20, 1, 1024]
    - [196, 9.524]
  - - [1760, 32, 1, 1760]
    - [241, 12.998]
  - - [3584, 4, 1, 1280]
    - [242, 3.645]
  - - [2944, 4, 1, 256]
    - [245, 2.454]
  - - [5056, 4, 1, 3328]
    - [245, 4.25]
  - - [1760, 16, 1, 1760]
    - [196, 8.55]
  - - [2368, 4, 1, 1280]
    - [246, 2.621]
  - - [6784, 4, 1, 1280]
    - [245, 4.426]
  - - [1856, 4, 1, 1280]
    - [245, 2.301]
  - - [2944, 4, 1, 128]
    - [245, 1.908]
  - - [3584, 4, 1, 128]
    - [245, 2.202]
  - - [8448, 16, 1, 2816]
    - [243, 12.804]
  - - [2368, 4, 1, 256]
    - [245, 2.035]
  - - [5888, 4, 1, 128]
    - [245, 3.104]
  - - [4288, 4, 1, 256]
    - [245, 3.208]
  - - [3584, 4, 1, 3328]
    - [245, 3.979]
  - - [2048, 16, 1, 2048]
    - [180, 9.032]
  - - [1408, 4, 1, 256]
    - [246, 1.29]
  - - [4288, 4, 1, 3328]
    - [242, 4.399]
  - - [2368, 4, 1, 3328]
    - [242, 2.811]
  - - [5056, 4, 1, 1280]
    - [245, 4.237]
  - - [3072, 16, 1, 1024]
    - [196, 11.067]
  - - [1408, 4, 1, 3328]
    - [245, 1.863]
  - - [6144, 16, 1, 2560]
    - [243, 12.953]
  - - [4096, 16, 1, 4096]
    - [212, 12.267]
  - - [1856, 4, 1, 256]
    - [245, 1.674]
  - - [6784, 4, 1, 128]
    - [245, 3.212]
  - - [4288, 4, 1, 128]
    - [246, 2.54]
  - - [5888, 4, 1, 3328]
    - [242, 4.782]
  - - [5056, 4, 1, 128]
    - [245, 2.793]
  - - [5888, 4, 1, 1280]
    - [245, 4.512]
  - - [2944, 4, 1, 3328]
    - [242, 3.442]
  - - [2368, 4, 1, 128]
    - [246, 1.57]
  - - [1856, 4, 1, 128]
    - [245, 1.241]
  - - [2560, 16, 1, 2560]
    - [180, 9.98]
  - - [7680, 16, 1, 2560]
    - [247, 13.675]
  - - [1408, 4, 1, 1280]
    - [245, 1.751]
  - - [6784, 4, 1, 256]
    - [245, 3.212]
  - - [1856, 4, 1, 3328]
    - [242, 2.459]
  - - [3584, 4, 1, 256]
    - [245, 2.806]
  - - [6784, 4, 1, 3328]
    - [245, 4.575]
  - - [2048, 32, 1, 2048]
    - [247, 14.153]
  - - [1408, 4, 1, 128]
    - [242, 0.947]
  - - [5056, 4, 1, 256]
    - [246, 3.271]
  - - [4288, 4, 1, 1280]
    - [245, 4.065]
  - - [4608, 16, 1, 1536]
    - [196, 12.448]
  - - [2944, 4, 1, 1280]
    - [246, 3.181]
  - - [5888, 4, 1, 256]
    - [245, 3.515]
  - - [2048, 32, 1, 1001]
    - [243, 12.913]
  - - [1536, 32, 1, 1001]
    - [180, 10.954]
  - - [1600, 1, 1, 1024]
    - [246, 0.496]
  - - [32768, 1, 1, 256]
    - [244, 1.128]
  - - [2048, 2, 1, 2048]
    - [242, 1.29]
  - - [2560, 4, 1, 2560]
    - [246, 2.897]
  - - [3456, 1, 1, 256]
    - [245, 0.69]
  - - [4096, 1, 1, 256]
    - [245, 0.776]
  - - [6912, 1, 1, 256]
    - [246, 0.848]
  - - [2048, 8, 1, 2048]
    - [246, 4.999]
  - - [2560, 2, 1, 2560]
    - [242, 1.453]
  - - [29000, 27, 1, 2560]
    - [212, 12.073]
  - - [4, 1856, 1, 3328]
    - [194, 2.4]
  - - [4, 1408, 1, 128]
    - [178, 0.993]
  - - [4, 2368, 1, 1280]
    - [178, 2.603]
  - - [4, 3584, 1, 128]
    - [249, 2.143]
  - - [4, 5888, 1, 3328]
    - [249, 4.282]
  - - [4, 1408, 1, 3328]
    - [184, 1.904]
  - - [4, 6784, 1, 3328]
    - [250, 4.11]
  - - [4, 4288, 1, 128]
    - [249, 2.49]
  - - [4, 6784, 1, 1280]
    - [250, 4.079]
  - - [4, 2944, 1, 3328]
    - [178, 3.253]
  - - [4, 5056, 1, 256]
    - [249, 3.181]
  - - [4, 5056, 1, 1280]
    - [249, 3.781]
  - - [4, 2368, 1, 3328]
    - [210, 2.761]
  - - [4, 1856, 1, 256]
    - [178, 1.737]
  - - [4, 2368, 1, 256]
    - [194, 2.026]
  - - [4, 2944, 1, 256]
    - [250, 2.405]
  - - [4, 4288, 1, 1280]
    - [249, 3.871]
  - - [4, 6784, 1, 128]
    - [249, 3.014]
  - - [4, 3584, 1, 1280]
    - [249, 3.429]
  - - [4, 5888, 1, 256]
    - [248, 3.46]
  - - [4, 6784, 1, 256]
    - [250, 3.257]
  - - [4, 1408, 1, 1280]
    - [184, 1.814]
  - - [4, 3584, 1, 256]
    - [249, 2.725]
  - - [4, 2944, 1, 1280]
    - [178, 3.091]
  - - [4, 1408, 1, 256]
    - [178, 1.367]
  - - [4, 4288, 1, 3328]
    - [248, 4.124]
  - - [4, 5888, 1, 1280]
    - [248, 4.079]
  - - [4, 1856, 1, 1280]
    - [178, 2.292]
  - - [4, 1856, 1, 128]
    - [178, 1.286]
  - - [4, 2944, 1, 128]
    - [249, 1.877]
  - - [4, 5056, 1, 3328]
    - [250, 3.921]
  - - [4, 5056, 1, 128]
    - [250, 2.703]
  - - [4, 4288, 1, 256]
    - [250, 3.036]
  - - [4, 3584, 1, 3328]
    - [250, 3.668]
  - - [4, 5888, 1, 128]
    - [249, 2.906]
  - - [4, 2368, 1, 128]
    - [178, 1.588]
  - - [32, 1600, 1, 512]
    - [178, 12.118]
  - - [2, 2048, 1, 1024]
    - [178, 1.236]
  - - [1, 4096, 1, 256]
    - [249, 0.749]
  - - [1, 6912, 1, 256]
    - [210, 0.835]
  - - [2, 2048, 1, 768]
    - [178, 1.2]
  - - [2, 4608, 1, 768]
    - [250, 2.012]
  - - [2, 4608, 1, 1024]
    - [248, 2.003]
  - - [1024, 16, 1, 500000]
    - [238, 10.72]
  - - [1024, 8, 1, 500000]
    - [236, 5.364]
  - - [512, 16, 1, 500000]
    - [225, 8.505]
  - - [512, 8, 1, 500000]
    - [225, 4.241]
  - - [64, 80, 1, 5329]
    - [236, 5.017]
  - - [576, 96, 1, 5329]
    - [219, 17.853]
  - - [288, 32, 1, 21609]
    - [221, 10.44]
  - - [576, 96, 1, 5041]
    - [219, 18.602]
  - - [27, 32, 1, 22201]
    - [222, 1.335]
  - - [160, 64, 1, 5329]
    - [218, 7.634]
  - - [448, 64, 1, 5329]
    - [233, 16.026]
  - - [147, 64, 1, 12544]
    - [236, 8.279]
  - - [147, 64, 1, 22500]
    - [218, 9.213]
  - - [576, 64, 1, 5625]
    - [219, 20.339]
  - - [256, 128, 1, 10752]
    - [229, 19.333]
  - - [256, 128, 1, 10560]
    - [219, 20.668]
  - - [256, 128, 1, 11408]
    - [219, 20.957]
  - - [256, 12, 1, 11408]
    - [227, 3.912]
  - - [256, 128, 1, 11616]
    - [219, 20.943]
  - - [256, 12, 1, 11616]
    - [227, 3.939]
  - - [256, 12, 1, 12288]
    - [238, 3.939]
  - - [11, 11, 1, 1909283]
    - [222, 0.208]
  - - [11, 11, 1, 3818566]
    - [222, 0.208]
  - - [768, 32, 1, 768]
    - [178, 7.548]
  - - [768, 64, 1, 768]
    - [178, 12.904]
  - - [1024, 80, 1, 1024]
    - [179, 15.101]
  - - [1024, 20, 1, 1024]
    - [178, 6.334]
  - - [768, 16, 1, 768]
    - [210, 4.079]
  - - [1024, 4, 1, 1024]
    - [194, 1.381]
  - - [1024, 6, 1, 1024]
    - [194, 2.075]
  - - [4, 704, 1, 1280]
    - [194, 0.993]
  - - [128, 64, 1, 256]
    - [212, 2.139]
  - - [128, 448, 1, 1280]
    - [197, 13.089]
  - - [64, 4, 1, 256]
    - [169, 0.059]
  - - [64, 704, 1, 128]
    - [169, 7.886]
  - - [448, 64, 1, 1280]
    - [178, 9.375]
  - - [128, 4, 1, 1280]
    - [184, 0.194]
  - - [64, 1024, 1, 1280]
    - [204, 14.176]
  - - [64, 704, 1, 1280]
    - [178, 12.931]
  - - [1024, 64, 1, 128]
    - [182, 9.461]
  - - [1024, 64, 1, 1280]
    - [197, 13.883]
  - - [4, 704, 1, 256]
    - [210, 0.686]
  - - [704, 4, 1, 1280]
    - [210, 0.988]
  - - [448, 128, 1, 128]
    - [178, 8.762]
  - - [256, 256, 1, 3328]
    - [197, 15.191]
  - - [4, 64, 1, 1280]
    - [169, 0.09]
  - - [64, 64, 1, 3328]
    - [186, 1.651]
  - - [128, 256, 1, 3328]
    - [202, 11.388]
  - - [64, 448, 1, 1280]
    - [178, 9.538]
  - - [448, 4, 1, 256]
    - [184, 0.438]
  - - [128, 4, 1, 128]
    - [169, 0.09]
  - - [256, 4, 1, 128]
    - [169, 0.176]
  - - [704, 64, 1, 3328]
    - [178, 13.224]
  - - [256, 64, 1, 1280]
    - [178, 6.01]
  - - [704, 64, 1, 128]
    - [178, 7.792]
  - - [1024, 4, 1, 256]
    - [194, 0.993]
  - - [256, 256, 1, 128]
    - [178, 9.556]
  - - [64, 256, 1, 128]
    - [178, 3.154]
  - - [704, 64, 1, 1280]
    - [178, 12.998]
  - - [128, 448, 1, 256]
    - [178, 10.548]
  - - [128, 256, 1, 1280]
    - [178, 10.715]
  - - [448, 64, 1, 3328]
    - [187, 9.993]
  - - [256, 128, 1, 128]
    - [187, 5.879]
  - - [64, 128, 1, 3328]
    - [193, 3.298]
  - - [128, 128, 1, 3328]
    - [169, 6.222]
  - - [256, 128, 1, 256]
    - [178, 7.95]
  - - [64, 448, 1, 3328]
    - [178, 10.079]
  - - [1024, 4, 1, 3328]
    - [210, 1.529]
  - - [4, 4, 1, 256]
    - [169, 0.005]
  - - [256, 64, 1, 256]
    - [178, 4.133]
  - - [256, 128, 1, 1280]
    - [178, 10.9]
  - - [128, 64, 1, 1280]
    - [184, 3.036]
  - - [4, 448, 1, 3328]
    - [186, 0.717]
  - - [64, 1024, 1, 256]
    - [181, 11.469]
  - - [256, 4, 1, 1280]
    - [184, 0.383]
  - - [64, 704, 1, 256]
    - [178, 9.818]
  - - [4, 704, 1, 128]
    - [178, 0.492]
  - - [448, 128, 1, 256]
    - [210, 10.445]
  - - [448, 64, 1, 128]
    - [178, 5.342]
  - - [4, 1024, 1, 1280]
    - [194, 1.439]
  - - [4, 448, 1, 1280]
    - [184, 0.645]
  - - [448, 4, 1, 1280]
    - [184, 0.677]
  - - [256, 256, 1, 256]
    - [198, 11.541]
  - - [256, 64, 1, 128]
    - [212, 3.091]
  - - [4, 1024, 1, 3328]
    - [194, 1.534]
  - - [64, 128, 1, 128]
    - [212, 1.588]
  - - [704, 4, 1, 128]
    - [178, 0.492]
  - - [256, 4, 1, 256]
    - [178, 0.248]
  - - [256, 4, 1, 3328]
    - [184, 0.42]
  - - [4, 256, 1, 256]
    - [178, 0.248]
  - - [4, 4, 1, 128]
    - [169, 0.005]
  - - [4, 128, 1, 256]
    - [178, 0.131]
  - - [64, 64, 1, 1280]
    - [200, 1.507]
  - - [448, 128, 1, 3328]
    - [213, 13.364]
  - - [64, 448, 1, 256]
    - [178, 7.169]
  - - [4, 448, 1, 128]
    - [169, 0.316]
  - - [64, 256, 1, 1280]
    - [178, 5.825]
  - - [64, 128, 1, 1280]
    - [184, 3.005]
  - - [64, 4, 1, 128]
    - [169, 0.045]
  - - [64, 64, 1, 256]
    - [178, 1.114]
  - - [4, 704, 1, 3328]
    - [194, 1.06]
  - - [4, 4, 1, 1280]
    - [169, 0.005]
  - - [128, 128, 1, 128]
    - [171, 3.194]
  - - [1024, 4, 1, 128]
    - [178, 0.713]
  - - [4, 64, 1, 128]
    - [169, 0.045]
  - - [64, 1024, 1, 128]
    - [190, 9.556]
  - - [128, 128, 1, 1280]
    - [178, 5.883]
  - - [128, 256, 1, 256]
    - [178, 8.193]
  - - [64, 128, 1, 256]
    - [178, 2.202]
  - - [1024, 4, 1, 1280]
    - [178, 1.426]
  - - [704, 64, 1, 256]
    - [178, 9.93]
  - - [128, 64, 1, 3328]
    - [186, 3.294]
  - - [448, 64, 1, 256]
    - [178, 7.106]
  - - [4, 256, 1, 128]
    - [178, 0.18]
  - - [1024, 64, 1, 256]
    - [182, 11.401]
  - - [4, 4, 1, 3328]
    - [169, 0.005]
  - - [704, 4, 1, 256]
    - [169, 0.681]
  - - [128, 4, 1, 3328]
    - [184, 0.212]
  - - [64, 1024, 1, 3328]
    - [213, 15.119]
  - - [448, 4, 1, 3328]
    - [184, 0.735]
  - - [4, 128, 1, 3328]
    - [177, 0.203]
  - - [704, 4, 1, 3328]
    - [202, 1.056]
  - - [448, 128, 1, 1280]
    - [197, 13.089]
  - - [1024, 64, 1, 3328]
    - [189, 14.713]
  - - [4, 1024, 1, 128]
    - [178, 0.713]
  - - [64, 256, 1, 3328]
    - [169, 6.204]
  - - [128, 256, 1, 128]
    - [178, 5.987]
  - - [128, 4, 1, 256]
    - [169, 0.122]
  - - [256, 256, 1, 1280]
    - [197, 15.02]
  - - [256, 128, 1, 3328]
    - [187, 11.351]
  - - [448, 4, 1, 128]
    - [178, 0.316]
  - - [4, 256, 1, 3328]
    - [186, 0.411]
  - - [4, 128, 1, 128]
    - [169, 0.09]
  - - [4, 256, 1, 1280]
    - [184, 0.37]
  - - [64, 4, 1, 3328]
    - [175, 0.104]
  - - [4, 64, 1, 3328]
    - [177, 0.104]
  - - [4, 1024, 1, 256]
    - [178, 0.997]
  - - [64, 256, 1, 256]
    - [178, 4.358]
  - - [4, 64, 1, 256]
    - [178, 0.063]
  - - [128, 448, 1, 128]
    - [178, 8.807]
  - - [64, 448, 1, 128]
    - [178, 5.342]
  - - [64, 704, 1, 3328]
    - [178, 13.774]
  - - [128, 448, 1, 3328]
    - [213, 13.54]
  - - [4, 448, 1, 256]
    - [210, 0.438]
  - - [4, 128, 1, 1280]
    - [184, 0.185]
  - - [128, 64, 1, 128]
    - [178, 1.579]
  - - [64, 64, 1, 128]
    - [212, 0.803]
  - - [64, 4, 1, 1280]
    - [216, 0.099]
  - - [256, 64, 1, 3328]
    - [169, 6.217]
  - - [128, 128, 1, 256]
    - [196, 4.264]
  - - [256, 64, 1, 3136]
    - [187, 6.199]
  - - [64, 200, 1, 1024]
    - [178, 4.458]
  - - [32, 512, 1, 1024]
    - [178, 5.707]
  - - [1, 512, 1, 1024]
    - [184, 0.18]
  - - [128, 512, 1, 2048]
    - [197, 15.123]
  - - [64, 256, 1, 1024]
    - [178, 5.725]
  - - [1, 200, 1, 1024]
    - [184, 0.072]
  - - [128, 512, 1, 1024]
    - [213, 14.726]
  - - [32, 256, 1, 2048]
    - [186, 3.172]
  - - [32, 256, 1, 512]
    - [178, 2.594]
  - - [256, 200, 1, 1024]
    - [178, 13.364]
  - - [1, 256, 1, 2048]
    - [186, 0.099]
  - - [32, 200, 1, 2048]
    - [184, 2.454]
  - - [128, 200, 1, 1024]
    - [178, 8.387]
  - - [128, 256, 1, 2048]
    - [178, 11.121]
  - - [64, 1024, 1, 1024]
    - [179, 14.298]
  - - [1, 512, 1, 2048]
    - [184, 0.194]
  - - [128, 256, 1, 512]
    - [178, 9.533]
  - - [128, 200, 1, 2048]
    - [210, 8.906]
  - - [64, 200, 1, 512]
    - [178, 4.006]
  - - [1, 256, 1, 1024]
    - [178, 0.09]
  - - [1, 1024, 1, 1024]
    - [178, 0.352]
  - - [256, 256, 1, 2048]
    - [197, 15.146]
  - - [128, 256, 1, 1024]
    - [178, 10.512]
  - - [1, 256, 1, 4096]
    - [177, 0.104]
  - - [32, 512, 1, 512]
    - [178, 5.157]
  - - [64, 200, 1, 2048]
    - [210, 4.733]
  - - [1, 200, 1, 2048]
    - [177, 0.077]
  - - [1, 512, 1, 4096]
    - [186, 0.208]
  - - [256, 256, 1, 1024]
    - [213, 14.902]
  - - [64, 256, 1, 2048]
    - [194, 6.068]
  - - [1, 200, 1, 4096]
    - [177, 0.081]
  - - [32, 256, 1, 1024]
    - [200, 2.928]
  - - [32, 200, 1, 1024]
    - [200, 2.301]
  - - [32, 512, 1, 2048]
    - [194, 6.037]
  - - [128, 200, 1, 512]
    - [210, 7.467]
  - - [64, 1024, 1, 2048]
    - [179, 14.771]
  - - [1, 1024, 1, 2048]
    - [178, 0.374]
  - - [32, 1024, 1, 512]
    - [178, 9.163]
  - - [64, 1024, 1, 512]
    - [179, 13.098]
  - - [1, 1024, 1, 4096]
    - [178, 0.388]
  - - [64, 256, 1, 512]
    - [178, 5.184]
  - - [256, 200, 1, 512]
    - [178, 12.398]
  - - [32, 1024, 1, 1024]
    - [178, 10.052]
  - - [32, 200, 1, 512]
    - [178, 1.994]
  - - [256, 256, 1, 512]
    - [197, 13.661]
  - - [128, 512, 1, 512]
    - [213, 13.661]
  - - [256, 200, 1, 2048]
    - [178, 14.045]
  - - [64, 512, 1, 2048]
    - [178, 11.036]
  - - [32, 1024, 1, 2048]
    - [210, 10.661]
  - - [256, 64, 1, 1225]
    - [207, 5.549]
  - - [384, 64, 1, 1225]
    - [175, 8.311]
  - - [288, 64, 1, 1225]
    - [207, 6.235]
  - - [384, 96, 1, 1225]
    - [175, 10.557]
  - - [11, 11, 5456, 64]
    - [202, 7.422]
  - - [14, 14, 4368, 64]
    - [202, 10.557]
  - - [23, 23, 2720, 64]
    - [201, 8.978]
  - - [13, 13, 4672, 64]
    - [169, 9.619]
  - - [29, 29, 2176, 64]
    - [201, 13.783]
  - - [12, 12, 5040, 64]
    - [194, 8.653]
  - - [27, 27, 2336, 64]
    - [217, 12.227]
  - - [10, 10, 5952, 64]
    - [169, 6.037]
  - - [7, 7, 8192, 64]
    - [202, 3.072]
  - - [16, 16, 3840, 64]
    - [175, 12.637]
  - - [17, 17, 3632, 64]
    - [179, 7.16]
  - - [9, 9, 6544, 64]
    - [210, 5.121]
  - - [8, 8, 7280, 64]
    - [178, 4.11]
  - - [21, 21, 2976, 64]
    - [195, 8.929]
  - - [19, 19, 3264, 64]
    - [179, 8.879]
  - - [25, 25, 2512, 64]
    - [201, 10.485]
  - - [18, 18, 3440, 64]
    - [179, 7.945]
  - - [15, 15, 4096, 64]
    - [216, 11.108]
  - - [2, 16, 1, 768]
    - [169, 0.009]
  - - [2, 8, 1, 768]
    - [169, 0.005]
  - - [2, 64, 1, 768]
    - [187, 0.045]
  - - [256, 128, 1, 784]
    - [169, 9.628]
  - - [192, 48, 1, 1225]
    - [175, 3.127]
  - - [64, 256, 1, 3136]
    - [169, 6.24]
  - - [512, 144, 1, 196]
    - [187, 11.767]
  - - [400, 32, 1, 784]
    - [175, 4.178]
  - - [832, 48, 1, 49]
    - [169, 3.803]
  - - [192, 32, 1, 784]
    - [184, 2.111]
