library/src/blas3/Tensile/Logic/asm_full/navi21/navi21_Cijk_Ailk_Bljk_SB_GB.yaml
- {MinimumRequiredVersion: 4.26.0}
- navi21
- gfx1030
- [Device 73a2]
    SolutionIndex: 0
    SolutionNameMin: Cijk_Ailk_Bljk_SB_MT128x64x8_SN_SU0_SUM0_TT8_8_WG16_8_1_WGM1
    SolutionIndex: 1
    SolutionNameMin: Cijk_Ailk_Bljk_SB_MT128x128x8_SN_SU0_SUM0_TT8_16_WG16_8_1_WGM1
    SolutionIndex: 2
    SolutionNameMin: Cijk_Ailk_Bljk_SB_MT128x128x8_SN_SU0_SUM0_TT8_8_WG16_16_1_WGM1
    SolutionIndex: 3
    SolutionNameMin: Cijk_Ailk_Bljk_SB_MT128x64x16_SN_SU0_SUM0_TT8_8_WG16_8_1_WGM1
    SolutionIndex: 4
    SolutionNameMin: Cijk_Ailk_Bljk_SB_MT128x128x16_SN_SU0_SUM0_TT8_16_WG16_8_1_WGM1
    SolutionIndex: 5
    SolutionNameMin: Cijk_Ailk_Bljk_SB_MT128x256x16_SN_SU0_SUM0_TT8_16_WG16_16_1_WGM1
    SolutionIndex: 6
    SolutionNameMin: Cijk_Ailk_Bljk_SB_MT128x64x8_SN_SU32_SUM3_TT8_8_WG16_8_1_WGM1
    SolutionIndex: 7
    SolutionNameMin: Cijk_Ailk_Bljk_SB_MT128x128x8_SN_SU32_SUM3_TT8_16_WG16_8_1_WGM1
    SolutionIndex: 8
    SolutionNameMin: Cijk_Ailk_Bljk_SB_MT128x128x8_SN_SU32_SUM3_TT8_8_WG16_16_1_WGM1
    SolutionIndex: 9
    SolutionNameMin: Cijk_Ailk_Bljk_SB_MT128x256x8_SN_SU32_SUM3_TT8_16_WG16_16_1_WGM1
    SolutionIndex: 10
    SolutionNameMin: Cijk_Ailk_Bljk_SB_MT128x64x16_SN_SU32_SUM3_TT8_8_WG16_8_1_WGM1
    SolutionIndex: 11
    SolutionNameMin: Cijk_Ailk_Bljk_SB_MT128x128x16_SN_SU32_SUM3_TT8_16_WG16_8_1_WGM1
    SolutionIndex: 12
    SolutionNameMin: Cijk_Ailk_Bljk_SB_MT128x128x16_SN_SU32_SUM3_TT8_8_WG16_16_1_WGM1
    SolutionIndex: 13
    SolutionNameMin: Cijk_Ailk_Bljk_SB_MT128x256x16_SN_SU32_SUM3_TT8_16_WG16_16_1_WGM1
    SolutionIndex: 14
    SolutionNameMin: Cijk_Ailk_Bljk_SB_MT128x64x8_SN_SU0_SUM0_TT8_8_WG16_8_1_WGM4
    SolutionIndex: 15
    SolutionNameMin: Cijk_Ailk_Bljk_SB_MT128x128x8_SN_SU0_SUM0_TT8_16_WG16_8_1_WGM4
    SolutionIndex: 16
    SolutionNameMin: Cijk_Ailk_Bljk_SB_MT128x128x8_SN_SU0_SUM0_TT8_8_WG16_16_1_WGM4
    SolutionIndex: 17
    SolutionNameMin: Cijk_Ailk_Bljk_SB_MT128x256x8_SN_SU0_SUM0_TT8_16_WG16_16_1_WGM4
    SolutionIndex: 18
    SolutionNameMin: Cijk_Ailk_Bljk_SB_MT128x64x16_SN_SU0_SUM0_TT8_8_WG16_8_1_WGM4
    SolutionIndex: 19
    SolutionNameMin: Cijk_Ailk_Bljk_SB_MT128x128x16_SN_SU0_SUM0_TT8_16_WG16_8_1_WGM4
    SolutionIndex: 20
    SolutionNameMin: Cijk_Ailk_Bljk_SB_MT128x128x16_SN_SU0_SUM0_TT8_8_WG16_16_1_WGM4
    SolutionIndex: 21
    SolutionNameMin: Cijk_Ailk_Bljk_SB_MT128x256x16_SN_SU0_SUM0_TT8_16_WG16_16_1_WGM4
    SolutionIndex: 22
    SolutionNameMin: Cijk_Ailk_Bljk_SB_MT128x64x8_SN_SU32_SUM3_TT8_8_WG16_8_1_WGM4
    SolutionIndex: 23
    SolutionNameMin: Cijk_Ailk_Bljk_SB_MT128x128x8_SN_SU32_SUM3_TT8_16_WG16_8_1_WGM4
    SolutionIndex: 24
    SolutionNameMin: Cijk_Ailk_Bljk_SB_MT128x128x8_SN_SU32_SUM3_TT8_8_WG16_16_1_WGM4
    SolutionIndex: 25
    SolutionNameMin: Cijk_Ailk_Bljk_SB_MT128x256x8_SN_SU32_SUM3_TT8_16_WG16_16_1_WGM4
    SolutionIndex: 26
    SolutionNameMin: Cijk_Ailk_Bljk_SB_MT128x64x16_SN_SU32_SUM3_TT8_8_WG16_8_1_WGM4
    SolutionIndex: 27
    SolutionNameMin: Cijk_Ailk_Bljk_SB_MT128x128x16_SN_SU32_SUM3_TT8_16_WG16_8_1_WGM4
    SolutionIndex: 28
    SolutionNameMin: Cijk_Ailk_Bljk_SB_MT128x256x16_SN_SU32_SUM3_TT8_16_WG16_16_1_WGM4
    SolutionIndex: 29
    SolutionNameMin: Cijk_Ailk_Bljk_SB_MT128x64x8_SN_SU0_SUM0_TT8_8_WG16_8_1_WGM8
    SolutionIndex: 30
    SolutionNameMin: Cijk_Ailk_Bljk_SB_MT128x128x8_SN_SU0_SUM0_TT8_16_WG16_8_1_WGM8
    SolutionIndex: 31
    SolutionNameMin: Cijk_Ailk_Bljk_SB_MT128x128x8_SN_SU0_SUM0_TT8_8_WG16_16_1_WGM8
    SolutionIndex: 32
    SolutionNameMin: Cijk_Ailk_Bljk_SB_MT128x64x16_SN_SU0_SUM0_TT8_8_WG16_8_1_WGM8
    SolutionIndex: 33
    SolutionNameMin: Cijk_Ailk_Bljk_SB_MT128x128x16_SN_SU0_SUM0_TT8_16_WG16_8_1_WGM8
    SolutionIndex: 34
    SolutionNameMin: Cijk_Ailk_Bljk_SB_MT128x256x16_SN_SU0_SUM0_TT8_16_WG16_16_1_WGM8
    SolutionIndex: 35
    SolutionNameMin: Cijk_Ailk_Bljk_SB_MT128x64x8_SN_SU32_SUM3_TT8_8_WG16_8_1_WGM8
    SolutionIndex: 36
    SolutionNameMin: Cijk_Ailk_Bljk_SB_MT128x128x8_SN_SU32_SUM3_TT8_16_WG16_8_1_WGM8
    SolutionIndex: 37
    SolutionNameMin: Cijk_Ailk_Bljk_SB_MT128x128x8_SN_SU32_SUM3_TT8_8_WG16_16_1_WGM8
    SolutionIndex: 38
    SolutionNameMin: Cijk_Ailk_Bljk_SB_MT128x64x16_SN_SU32_SUM3_TT8_8_WG16_8_1_WGM8
    SolutionIndex: 39
    SolutionNameMin: Cijk_Ailk_Bljk_SB_MT128x128x16_SN_SU32_SUM3_TT8_16_WG16_8_1_WGM8
    SolutionIndex: 40
    SolutionNameMin: Cijk_Ailk_Bljk_SB_MT128x256x16_SN_SU32_SUM3_TT8_16_WG16_16_1_WGM8
    SolutionIndex: 41
    SolutionNameMin: Cijk_Ailk_Bljk_SB_MT128x64x8_SN_SU0_SUM0_TT8_8_WG16_8_1_WGM1
    SolutionIndex: 42
    SolutionNameMin: Cijk_Ailk_Bljk_SB_MT128x128x8_SN_SU0_SUM0_TT8_16_WG16_8_1_WGM1
    SolutionIndex: 43
    SolutionNameMin: Cijk_Ailk_Bljk_SB_MT128x256x16_SN_SU0_SUM0_TT8_16_WG16_16_1_WGM1
    SolutionIndex: 44
    SolutionNameMin: Cijk_Ailk_Bljk_SB_MT128x64x8_SN_SU0_SUM0_TT8_8_WG16_8_1_WGM4
    SolutionIndex: 45
    SolutionNameMin: Cijk_Ailk_Bljk_SB_MT128x128x8_SN_SU0_SUM0_TT8_8_WG16_16_1_WGM4
    SolutionIndex: 46
    SolutionNameMin: Cijk_Ailk_Bljk_SB_MT128x256x16_SN_SU0_SUM0_TT8_16_WG16_16_1_WGM4
    SolutionIndex: 47
    SolutionNameMin: Cijk_Ailk_Bljk_SB_MT128x64x8_SN_SU0_SUM0_TT8_8_WG16_8_1_WGM8
    SolutionIndex: 48
    SolutionNameMin: Cijk_Ailk_Bljk_SB_MT128x256x8_SN_SU0_SUM0_TT8_16_WG16_16_1_WGM8
    SolutionIndex: 49
    SolutionNameMin: Cijk_Ailk_Bljk_SB_MT128x64x16_SN_SU0_SUM0_TT8_8_WG16_8_1_WGM8
    SolutionIndex: 50
    SolutionNameMin: Cijk_Ailk_Bljk_SB_MT128x256x16_SN_SU0_SUM0_TT8_16_WG16_16_1_WGM8
    SolutionIndex: 51
    SolutionNameMin: Cijk_Ailk_Bljk_SB_MT128x256x16_SN_SU32_SUM3_TT8_16_WG16_16_1_WGM8
    SolutionIndex: 52
    SolutionNameMin: Cijk_Ailk_Bljk_SB_MT32x32x8_SN_SU0_SUM0_TT4_4_WG8_8_1_WGM1
    SolutionIndex: 53
    SolutionNameMin: Cijk_Ailk_Bljk_SB_MT32x64x8_SN_SU0_SUM0_TT4_8_WG8_8_1_WGM1
    SolutionIndex: 54
    SolutionNameMin: Cijk_Ailk_Bljk_SB_MT64x64x8_SN_SU0_SUM0_TT8_8_WG8_8_1_WGM1
    SolutionIndex: 55
    SolutionNameMin: Cijk_Ailk_Bljk_SB_MT64x64x8_SN_SU0_SUM0_TT4_8_WG16_8_1_WGM1
    SolutionIndex: 56
    SolutionNameMin: Cijk_Ailk_Bljk_SB_MT128x64x8_SN_SU0_SUM0_TT8_8_WG16_8_1_WGM1
    SolutionIndex: 57
    SolutionNameMin: Cijk_Ailk_Bljk_SB_MT128x128x8_SN_SU0_SUM0_TT8_8_WG16_16_1_WGM1
    SolutionIndex: 58
    SolutionNameMin: Cijk_Ailk_Bljk_SB_MT64x64x16_SN_SU0_SUM0_TT8_8_WG8_8_1_WGM1
    SolutionIndex: 59
    SolutionNameMin: Cijk_Ailk_Bljk_SB_MT64x64x16_SN_SU0_SUM0_TT4_8_WG16_8_1_WGM1
    SolutionIndex: 60
    SolutionNameMin: Cijk_Ailk_Bljk_SB_MT128x128x16_SN_SU0_SUM0_TT8_8_WG16_16_1_WGM1
    SolutionIndex: 61
    SolutionNameMin: Cijk_Ailk_Bljk_SB_MT64x64x8_SN_SU32_SUM3_TT8_8_WG8_8_1_WGM1
    SolutionIndex: 62
    SolutionNameMin: Cijk_Ailk_Bljk_SB_MT64x64x8_SN_SU32_SUM3_TT4_8_WG16_8_1_WGM1
    SolutionIndex: 63
    SolutionNameMin: Cijk_Ailk_Bljk_SB_MT128x64x8_SN_SU32_SUM3_TT8_8_WG16_8_1_WGM1
    SolutionIndex: 64
    SolutionNameMin: Cijk_Ailk_Bljk_SB_MT128x128x8_SN_SU32_SUM3_TT8_8_WG16_16_1_WGM1
    SolutionIndex: 65
    SolutionNameMin: Cijk_Ailk_Bljk_SB_MT64x64x16_SN_SU32_SUM3_TT8_8_WG8_8_1_WGM1
    SolutionIndex: 66
    SolutionNameMin: Cijk_Ailk_Bljk_SB_MT64x64x16_SN_SU32_SUM3_TT4_8_WG16_8_1_WGM1
    SolutionIndex: 67
    SolutionNameMin: Cijk_Ailk_Bljk_SB_MT128x64x16_SN_SU32_SUM3_TT8_8_WG16_8_1_WGM1
    SolutionIndex: 68
    SolutionNameMin: Cijk_Ailk_Bljk_SB_MT64x128x16_SN_SU32_SUM3_TT4_8_WG16_16_1_WGM1
    SolutionIndex: 69
    SolutionNameMin: Cijk_Ailk_Bljk_SB_MT64x64x32_SN_SU32_SUM3_TT8_8_WG8_8_1_WGM1
    SolutionIndex: 70
    SolutionNameMin: Cijk_Ailk_Bljk_SB_MT64x32x32_SN_SU32_SUM3_TT4_4_WG16_8_1_WGM1
    SolutionIndex: 71
    SolutionNameMin: Cijk_Ailk_Bljk_SB_MT64x64x32_SN_SU32_SUM3_TT4_8_WG16_8_1_WGM1
    SolutionIndex: 72
    SolutionNameMin: Cijk_Ailk_Bljk_SB_MT32x64x8_SN_SU0_SUM0_TT4_8_WG8_8_1_WGM4
    SolutionIndex: 73
    SolutionNameMin: Cijk_Ailk_Bljk_SB_MT64x64x8_SN_SU0_SUM0_TT8_8_WG8_8_1_WGM4
    SolutionIndex: 74
    SolutionNameMin: Cijk_Ailk_Bljk_SB_MT64x64x8_SN_SU0_SUM0_TT4_8_WG16_8_1_WGM4
    SolutionIndex: 75
    SolutionNameMin: Cijk_Ailk_Bljk_SB_MT128x64x8_SN_SU0_SUM0_TT8_8_WG16_8_1_WGM4
    SolutionIndex: 76
    SolutionNameMin: Cijk_Ailk_Bljk_SB_MT128x128x8_SN_SU0_SUM0_TT8_8_WG16_16_1_WGM4
    SolutionIndex: 77
    SolutionNameMin: Cijk_Ailk_Bljk_SB_MT64x64x16_SN_SU0_SUM0_TT8_8_WG8_8_1_WGM4
    SolutionIndex: 78
    SolutionNameMin: Cijk_Ailk_Bljk_SB_MT64x64x16_SN_SU0_SUM0_TT4_8_WG16_8_1_WGM4
    SolutionIndex: 79
    SolutionNameMin: Cijk_Ailk_Bljk_SB_MT128x64x16_SN_SU0_SUM0_TT8_8_WG16_8_1_WGM4
    SolutionIndex: 80
    SolutionNameMin: Cijk_Ailk_Bljk_SB_MT128x128x16_SN_SU0_SUM0_TT8_8_WG16_16_1_WGM4
    SolutionIndex: 81
    SolutionNameMin: Cijk_Ailk_Bljk_SB_MT64x64x8_SN_SU32_SUM3_TT8_8_WG8_8_1_WGM4
    SolutionIndex: 82
    SolutionNameMin: Cijk_Ailk_Bljk_SB_MT64x64x8_SN_SU32_SUM3_TT4_8_WG16_8_1_WGM4
    SolutionIndex: 83
    SolutionNameMin: Cijk_Ailk_Bljk_SB_MT128x64x8_SN_SU32_SUM3_TT8_8_WG16_8_1_WGM4
    SolutionIndex: 84
    SolutionNameMin: Cijk_Ailk_Bljk_SB_MT128x128x8_SN_SU32_SUM3_TT8_8_WG16_16_1_WGM4
    SolutionIndex: 85
    SolutionNameMin: Cijk_Ailk_Bljk_SB_MT64x64x16_SN_SU32_SUM3_TT8_8_WG8_8_1_WGM4
    SolutionIndex: 86
    SolutionNameMin: Cijk_Ailk_Bljk_SB_MT64x32x16_SN_SU32_SUM3_TT4_4_WG16_8_1_WGM4
    SolutionIndex: 87
    SolutionNameMin: Cijk_Ailk_Bljk_SB_MT64x64x16_SN_SU32_SUM3_TT4_8_WG16_8_1_WGM4
    SolutionIndex: 90
    SolutionNameMin: Cijk_Ailk_Bljk_SB_MT128x128x16_SN_SU32_SUM3_TT8_8_WG16_16_1_WGM4
    SolutionIndex: 91
    SolutionNameMin: Cijk_Ailk_Bljk_SB_MT64x64x32_SN_SU32_SUM3_TT8_8_WG8_8_1_WGM4
    SolutionIndex: 92
    SolutionNameMin: Cijk_Ailk_Bljk_SB_MT64x32x32_SN_SU32_SUM3_TT4_4_WG16_8_1_WGM4
    SolutionIndex: 93
    SolutionNameMin: Cijk_Ailk_Bljk_SB_MT64x64x32_SN_SU32_SUM3_TT4_8_WG16_8_1_WGM4
    SolutionIndex: 94
    SolutionNameMin: Cijk_Ailk_Bljk_SB_MT32x32x8_SN_SU0_SUM0_TT4_4_WG8_8_1_WGM8
    SolutionIndex: 95
    SolutionNameMin: Cijk_Ailk_Bljk_SB_MT32x64x8_SN_SU0_SUM0_TT4_8_WG8_8_1_WGM8
    SolutionIndex: 96
    SolutionNameMin: Cijk_Ailk_Bljk_SB_MT64x64x8_SN_SU0_SUM0_TT8_8_WG8_8_1_WGM8
    SolutionIndex: 97
    SolutionNameMin: Cijk_Ailk_Bljk_SB_MT64x64x8_SN_SU0_SUM0_TT4_8_WG16_8_1_WGM8
    SolutionIndex: 98
    SolutionNameMin: Cijk_Ailk_Bljk_SB_MT128x64x8_SN_SU0_SUM0_TT8_8_WG16_8_1_WGM8
    SolutionIndex: 99
    SolutionNameMin: Cijk_Ailk_Bljk_SB_MT128x128x8_SN_SU0_SUM0_TT8_8_WG16_16_1_WGM8
    SolutionIndex: 100
    SolutionNameMin: Cijk_Ailk_Bljk_SB_MT64x64x16_SN_SU0_SUM0_TT8_8_WG8_8_1_WGM8
    SolutionIndex: 101
    SolutionNameMin: Cijk_Ailk_Bljk_SB_MT64x64x16_SN_SU0_SUM0_TT4_4_WG16_16_1_WGM8
    SolutionIndex: 102
    SolutionNameMin: Cijk_Ailk_Bljk_SB_MT128x128x16_SN_SU0_SUM0_TT8_8_WG16_16_1_WGM8
    SolutionIndex: 103
    SolutionNameMin: Cijk_Ailk_Bljk_SB_MT32x64x8_SN_SU32_SUM3_TT4_8_WG8_8_1_WGM8
    SolutionIndex: 104
    SolutionNameMin: Cijk_Ailk_Bljk_SB_MT64x64x8_SN_SU32_SUM3_TT8_8_WG8_8_1_WGM8
    SolutionIndex: 105
    SolutionNameMin: Cijk_Ailk_Bljk_SB_MT64x64x8_SN_SU32_SUM3_TT4_8_WG16_8_1_WGM8
    SolutionIndex: 106
    SolutionNameMin: Cijk_Ailk_Bljk_SB_MT128x64x8_SN_SU32_SUM3_TT8_8_WG16_8_1_WGM8
    SolutionIndex: 107
    SolutionNameMin: Cijk_Ailk_Bljk_SB_MT128x128x8_SN_SU32_SUM3_TT8_8_WG16_16_1_WGM8
    SolutionIndex: 108
    SolutionNameMin: Cijk_Ailk_Bljk_SB_MT64x64x16_SN_SU32_SUM3_TT8_8_WG8_8_1_WGM8
    SolutionIndex: 109
    SolutionNameMin: Cijk_Ailk_Bljk_SB_MT64x32x16_SN_SU32_SUM3_TT4_4_WG16_8_1_WGM8
    SolutionIndex: 110
    SolutionNameMin: Cijk_Ailk_Bljk_SB_MT64x64x16_SN_SU32_SUM3_TT4_8_WG16_8_1_WGM8
    SolutionIndex: 111
    SolutionNameMin: Cijk_Ailk_Bljk_SB_MT128x64x16_SN_SU32_SUM3_TT8_8_WG16_8_1_WGM8
    SolutionIndex: 112
    SolutionNameMin: Cijk_Ailk_Bljk_SB_MT64x64x16_SN_SU32_SUM3_TT4_4_WG16_16_1_WGM8
    SolutionIndex: 113
    SolutionNameMin: Cijk_Ailk_Bljk_SB_MT64x64x32_SN_SU32_SUM3_TT4_8_WG16_8_1_WGM8
- - - [1024, 4096, 1, 1024, 1024, 1024, 1024, 1024]
    - [6, 17894.0]
  - - [4096, 4096, 1, 1024, 4096, 4096, 4096, 1024]
    - [7, 20129.0]
  - - [1024, 2048, 1, 1024, 1024, 1024, 1024, 1024]
    - [28, 17109.0]
  - - [4096, 2048, 1, 1024, 4096, 4096, 4096, 1024]
    - [7, 19141.0]
  - - [768, 4096, 1, 2, 768, 768, 768, 2]
    - [29, 894.0]
  - - [768, 4096, 1, 768, 768, 768, 768, 768]
    - [35, 18045.0]
  - - [3072, 4096, 1, 768, 3072, 3072, 3072, 768]
    - [7, 19786.0]
  - - [768, 2048, 1, 2, 768, 768, 768, 2]
    - [6, 753.0]
  - - [768, 2048, 1, 768, 768, 768, 768, 768]
    - [16, 16363.0]
  - - [3072, 2048, 1, 768, 3072, 3072, 3072, 768]
    - [1, 19360.0]
  - - [3072, 1024, 1, 768, 3072, 3072, 3072, 768]
    - [29, 18143.0]
  - - [3072, 512, 1, 768, 3072, 3072, 3072, 768]
    - [31, 16377.0]
  - - [1024, 3072, 1, 1024, 1024, 1024, 1024, 1024]
    - [35, 18097.0]
  - - [3072, 2048, 1, 1024, 3072, 3072, 3072, 1024]
    - [23, 19398.0]
  - - [3072, 3072, 1, 1024, 3072, 3072, 3072, 1024]
    - [23, 20213.0]
  - - [3072, 512, 1, 1024, 3072, 3072, 3072, 1024]
    - [16, 16452.0]
  - - [3072, 4096, 1, 1024, 3072, 3072, 3072, 1024]
    - [23, 19746.0]
  - - [1024, 2048, 1, 2, 1024, 1024, 1024, 2]
    - [6, 900.0]
  - - [1024, 3072, 1, 2, 1024, 1024, 1024, 2]
    - [6, 999.0]
  - - [1024, 4096, 1, 2, 1024, 1024, 1024, 2]
    - [6, 1036.0]
  - - [128, 128, 512, 64, 128, 128, 128, 64]
    - [12, 15516.0]
  - - [512, 512, 64, 64, 512, 512, 512, 64]
    - [6, 18380.0]
  - - [2944, 4288, 1, 1280, 2944, 2944, 2944, 1280]
    - [1, 19908.0]
  - - [2368, 5888, 1, 256, 2368, 2368, 2368, 256]
    - [1, 18917.0]
  - - [5888, 1856, 1, 256, 5888, 5888, 5888, 256]
    - [29, 18628.0]
  - - [512, 24000, 1, 1536, 512, 512, 512, 1536]
    - [23, 19979.0]
  - - [5888, 1408, 1, 256, 5888, 5888, 5888, 256]
    - [1, 18426.0]
  - - [5888, 1856, 1, 3328, 5888, 5888, 5888, 3328]
    - [1, 19078.0]
  - - [1856, 4288, 1, 256, 1856, 1856, 1856, 256]
    - [22, 18059.0]
  - - [1024, 5056, 1, 128, 1024, 1024, 1024, 128]
    - [6, 17672.0]
  - - [5056, 5056, 1, 3328, 5056, 5056, 5056, 3328]
    - [30, 20051.0]
  - - [1408, 5888, 1, 1280, 1408, 1408, 1408, 1280]
    - [1, 19097.0]
  - - [6144, 6000, 1, 2560, 6144, 6144, 6144, 2560]
    - [1, 20649.0]
  - - [2368, 6784, 1, 128, 2368, 2368, 2368, 128]
    - [30, 18359.0]
  - - [1024, 3584, 1, 3328, 1024, 1024, 1024, 3328]
    - [29, 18179.0]
  - - [512, 48000, 1, 2048, 512, 512, 512, 2048]
    - [39, 20285.0]
  - - [5888, 1408, 1, 1280, 5888, 5888, 5888, 1280]
    - [1, 19158.0]
  - - [1408, 4288, 1, 256, 1408, 1408, 1408, 256]
    - [29, 18282.0]
  - - [1024, 2368, 1, 256, 1024, 1024, 1024, 256]
    - [29, 16336.0]
  - - [1408, 1856, 1, 1280, 1408, 1408, 1408, 1280]
    - [29, 18219.0]
  - - [5056, 5056, 1, 1280, 5056, 5056, 5056, 1280]
    - [1, 19978.0]
  - - [448, 5056, 1, 256, 448, 448, 448, 256]
    - [10, 13892.0]
  - - [1856, 1408, 1, 128, 1856, 1856, 1856, 128]
    - [14, 15400.0]
  - - [6784, 256, 1, 3328, 6784, 6784, 6784, 3328]
    - [31, 18441.0]
  - - [1408, 3584, 1, 256, 1408, 1408, 1408, 256]
    - [30, 18252.0]
  - - [4288, 448, 1, 256, 4288, 4288, 4288, 256]
    - [6, 15957.0]
  - - [1024, 1856, 1, 128, 1024, 1024, 1024, 128]
    - [0, 15204.0]
  - - [4288, 2944, 1, 1280, 4288, 4288, 4288, 1280]
    - [36, 19928.0]
  - - [704, 5056, 1, 1280, 704, 704, 704, 1280]
    - [23, 16929.0]
  - - [2368, 704, 1, 3328, 2368, 2368, 2368, 3328]
    - [0, 17409.0]
  - - [256, 5888, 1, 256, 256, 256, 256, 256]
    - [35, 14706.0]
  - - [1856, 4288, 1, 3328, 1856, 1856, 1856, 3328]
    - [29, 18537.0]
  - - [5888, 1024, 1, 256, 5888, 5888, 5888, 256]
    - [14, 18240.0]
  - - [1408, 2944, 1, 256, 1408, 1408, 1408, 256]
    - [29, 17436.0]
  - - [6784, 5056, 1, 3328, 6784, 6784, 6784, 3328]
    - [1, 20503.0]
  - - [5056, 5056, 1, 256, 5056, 5056, 5056, 256]
    - [15, 19377.0]
  - - [704, 5056, 1, 128, 704, 704, 704, 128]
    - [29, 15167.0]
  - - [2368, 2944, 1, 1280, 2368, 2368, 2368, 1280]
    - [1, 18482.0]
  - - [6784, 6784, 1, 1280, 6784, 6784, 6784, 1280]
    - [15, 20591.0]
  - - [1408, 4288, 1, 1280, 1408, 1408, 1408, 1280]
    - [36, 18640.0]
  - - [3584, 4288, 1, 1280, 3584, 3584, 3584, 1280]
    - [1, 19905.0]
  - - [512, 6000, 1, 2560, 512, 512, 512, 2560]
    - [35, 17826.0]
  - - [2368, 704, 1, 1280, 2368, 2368, 2368, 1280]
    - [14, 17117.0]
  - - [5056, 4288, 1, 3328, 5056, 5056, 5056, 3328]
    - [1, 20050.0]
  - - [3584, 2368, 1, 3328, 3584, 3584, 3584, 3328]
    - [36, 19595.0]
  - - [5888, 6784, 1, 1280, 5888, 5888, 5888, 1280]
    - [30, 20653.0]
  - - [6784, 448, 1, 1280, 6784, 6784, 6784, 1280]
    - [14, 17635.0]
  - - [2944, 5888, 1, 256, 2944, 2944, 2944, 256]
    - [15, 19796.0]
  - - [4288, 2944, 1, 256, 4288, 4288, 4288, 256]
    - [1, 19172.0]
  - - [5888, 704, 1, 1280, 5888, 5888, 5888, 1280]
    - [14, 17872.0]
  - - [448, 5888, 1, 128, 448, 448, 448, 128]
    - [29, 14033.0]
  - - [5056, 2368, 1, 1280, 5056, 5056, 5056, 1280]
    - [1, 18945.0]
  - - [448, 3584, 1, 1280, 448, 448, 448, 1280]
    - [22, 14360.0]
  - - [6784, 5888, 1, 256, 6784, 6784, 6784, 256]
    - [1, 20251.0]
  - - [1024, 1408, 1, 256, 1024, 1024, 1024, 256]
    - [29, 15653.0]
  - - [2368, 2368, 1, 3328, 2368, 2368, 2368, 3328]
    - [0, 18224.0]
  - - [1856, 6784, 1, 128, 1856, 1856, 1856, 128]
    - [14, 17915.0]
  - - [5056, 704, 1, 3328, 5056, 5056, 5056, 3328]
    - [0, 17660.0]
  - - [1408, 1856, 1, 256, 1408, 1408, 1408, 256]
    - [29, 17531.0]
  - - [2368, 5056, 1, 256, 2368, 2368, 2368, 256]
    - [14, 18391.0]
  - - [3584, 2368, 1, 1280, 3584, 3584, 3584, 1280]
    - [23, 19469.0]
  - - [704, 5888, 1, 256, 704, 704, 704, 256]
    - [23, 16315.0]
  - - [6784, 2944, 1, 128, 6784, 6784, 6784, 128]
    - [7, 19512.0]
  - - [2944, 6784, 1, 3328, 2944, 2944, 2944, 3328]
    - [1, 20613.0]
  - - [3584, 704, 1, 3328, 3584, 3584, 3584, 3328]
    - [29, 17775.0]
  - - [448, 4288, 1, 256, 448, 448, 448, 256]
    - [35, 14099.0]
  - - [704, 2368, 1, 1280, 704, 704, 704, 1280]
    - [22, 14953.0]
  - - [1856, 2368, 1, 1280, 1856, 1856, 1856, 1280]
    - [36, 18439.0]
  - - [1856, 4288, 1, 1280, 1856, 1856, 1856, 1280]
    - [29, 18470.0]
  - - [256, 193600, 1, 64, 256, 256, 256, 64]
    - [0, 15090.0]
  - - [704, 2944, 1, 128, 704, 704, 704, 128]
    - [6, 13890.0]
  - - [1408, 1024, 1, 1280, 1408, 1408, 1408, 1280]
    - [29, 17533.0]
  - - [704, 6784, 1, 256, 704, 704, 704, 256]
    - [7, 16666.0]
  - - [6784, 704, 1, 256, 6784, 6784, 6784, 256]
    - [14, 17755.0]
  - - [5056, 1408, 1, 128, 5056, 5056, 5056, 128]
    - [6, 17762.0]
  - - [2048, 7000, 1, 2048, 2048, 2048, 2048, 2048]
    - [23, 19995.0]
  - - [5056, 704, 1, 256, 5056, 5056, 5056, 256]
    - [6, 16831.0]
  - - [3584, 4288, 1, 3328, 3584, 3584, 3584, 3328]
    - [30, 19959.0]
  - - [5888, 1856, 1, 1280, 5888, 5888, 5888, 1280]
    - [30, 18970.0]
  - - [2368, 3584, 1, 1280, 2368, 2368, 2368, 1280]
    - [1, 19488.0]
  - - [2944, 3584, 1, 3328, 2944, 2944, 2944, 3328]
    - [1, 20397.0]
  - - [6784, 2944, 1, 256, 6784, 6784, 6784, 256]
    - [7, 20006.0]
  - - [1024, 1500, 1, 2560, 1024, 1024, 1024, 2560]
    - [16, 16224.0]
  - - [1856, 2368, 1, 256, 1856, 1856, 1856, 256]
    - [15, 17310.0]
  - - [3584, 6784, 1, 3328, 3584, 3584, 3584, 3328]
    - [30, 20395.0]
  - - [1024, 5888, 1, 3328, 1024, 1024, 1024, 3328]
    - [7, 18854.0]
  - - [6144, 24000, 1, 2560, 6144, 6144, 6144, 2560]
    - [1, 20838.0]
  - - [5056, 4288, 1, 1280, 5056, 5056, 5056, 1280]
    - [1, 19956.0]
  - - [2368, 2368, 1, 1280, 2368, 2368, 2368, 1280]
    - [14, 18092.0]
  - - [2944, 5888, 1, 128, 2944, 2944, 2944, 128]
    - [36, 19244.0]
  - - [704, 5888, 1, 1280, 704, 704, 704, 1280]
    - [36, 17488.0]
  - - [2368, 3584, 1, 128, 2368, 2368, 2368, 128]
    - [14, 17809.0]
  - - [1856, 5056, 1, 128, 1856, 1856, 1856, 128]
    - [0, 17659.0]
  - - [2944, 6784, 1, 1280, 2944, 2944, 2944, 1280]
    - [36, 20532.0]
  - - [1024, 5056, 1, 1280, 1024, 1024, 1024, 1280]
    - [30, 19270.0]
  - - [4288, 1024, 1, 256, 4288, 4288, 4288, 256]
    - [2, 17347.0]
  - - [2944, 2368, 1, 128, 2944, 2944, 2944, 128]
    - [29, 18218.0]
  - - [5888, 448, 1, 1280, 5888, 5888, 5888, 1280]
    - [0, 16918.0]
  - - [704, 5888, 1, 3328, 704, 704, 704, 3328]
    - [5, 17679.0]
  - - [3584, 2944, 1, 256, 3584, 3584, 3584, 256]
    - [36, 19579.0]
  - - [1856, 2368, 1, 3328, 1856, 1856, 1856, 3328]
    - [36, 18694.0]
  - - [512, 6000, 1, 2816, 512, 512, 512, 2816]
    - [22, 17845.0]
  - - [512, 24000, 1, 2048, 512, 512, 512, 2048]
    - [27, 19955.0]
  - - [1408, 5056, 1, 3328, 1408, 1408, 1408, 3328]
    - [23, 18930.0]
  - - [1856, 1856, 1, 3328, 1856, 1856, 1856, 3328]
    - [29, 17120.0]
  - - [2368, 2368, 1, 256, 2368, 2368, 2368, 256]
    - [14, 17744.0]
  - - [4288, 4288, 1, 1280, 4288, 4288, 4288, 1280]
    - [23, 19532.0]
  - - [5888, 1024, 1, 1280, 5888, 5888, 5888, 1280]
    - [1, 18788.0]
  - - [1024, 12544, 1, 256, 1024, 1024, 1024, 256]
    - [7, 19492.0]
  - - [5888, 448, 1, 128, 5888, 5888, 5888, 128]
    - [29, 15719.0]
  - - [512, 48000, 1, 2560, 512, 512, 512, 2560]
    - [36, 20365.0]
  - - [704, 6784, 1, 3328, 704, 704, 704, 3328]
    - [23, 18110.0]
  - - [5888, 5888, 1, 1280, 5888, 5888, 5888, 1280]
    - [1, 20664.0]
  - - [5056, 1024, 1, 1280, 5056, 5056, 5056, 1280]
    - [1, 19360.0]
  - - [448, 5888, 1, 3328, 448, 448, 448, 3328]
    - [22, 15407.0]
  - - [1024, 2944, 1, 1280, 1024, 1024, 1024, 1280]
    - [29, 17521.0]
  - - [5056, 5888, 1, 1280, 5056, 5056, 5056, 1280]
    - [1, 20159.0]
  - - [4288, 5888, 1, 128, 4288, 4288, 4288, 128]
    - [1, 18985.0]
  - - [1408, 3584, 1, 128, 1408, 1408, 1408, 128]
    - [35, 17354.0]
  - - [448, 3584, 1, 128, 448, 448, 448, 128]
    - [14, 12441.0]
  - - [5888, 2944, 1, 1280, 5888, 5888, 5888, 1280]
    - [1, 20170.0]
  - - [2368, 5888, 1, 128, 2368, 2368, 2368, 128]
    - [7, 18274.0]
  - - [3584, 5888, 1, 256, 3584, 3584, 3584, 256]
    - [7, 19971.0]
  - - [2368, 1024, 1, 128, 2368, 2368, 2368, 128]
    - [14, 14879.0]
  - - [2368, 704, 1, 128, 2368, 2368, 2368, 128]
    - [14, 14321.0]
  - - [3584, 2368, 1, 128, 3584, 3584, 3584, 128]
    - [29, 18462.0]
  - - [5056, 704, 1, 128, 5056, 5056, 5056, 128]
    - [0, 16592.0]
  - - [5056, 1408, 1, 3328, 5056, 5056, 5056, 3328]
    - [1, 18976.0]
  - - [6784, 1024, 1, 3328, 6784, 6784, 6784, 3328]
    - [1, 19963.0]
  - - [6784, 2944, 1, 3328, 6784, 6784, 6784, 3328]
    - [1, 20627.0]
  - - [1856, 1856, 1, 256, 1856, 1856, 1856, 256]
    - [29, 16205.0]
  - - [6784, 2368, 1, 1280, 6784, 6784, 6784, 1280]
    - [1, 20012.0]
  - - [4288, 3584, 1, 256, 4288, 4288, 4288, 256]
    - [15, 19363.0]
  - - [4288, 5888, 1, 1280, 4288, 4288, 4288, 1280]
    - [1, 20133.0]
  - - [1024, 6000, 1, 1536, 1024, 1024, 1024, 1536]
    - [23, 18994.0]
  - - [4288, 1856, 1, 1280, 4288, 4288, 4288, 1280]
    - [0, 18520.0]
  - - [1856, 2944, 1, 3328, 1856, 1856, 1856, 3328]
    - [36, 18768.0]
  - - [256, 6784, 1, 3328, 256, 256, 256, 3328]
    - [8, 18329.0]
  - - [512, 3000, 1, 1536, 512, 512, 512, 1536]
    - [24, 16098.0]
  - - [256, 5056, 1, 128, 256, 256, 256, 128]
    - [29, 13602.0]
  - - [5056, 1024, 1, 256, 5056, 5056, 5056, 256]
    - [7, 18542.0]
  - - [5056, 1856, 1, 3328, 5056, 5056, 5056, 3328]
    - [36, 19192.0]
  - - [4288, 1408, 1, 128, 4288, 4288, 4288, 128]
    - [14, 17335.0]
  - - [1856, 5888, 1, 3328, 1856, 1856, 1856, 3328]
    - [36, 19053.0]
  - - [4288, 5056, 1, 256, 4288, 4288, 4288, 256]
    - [15, 19402.0]
  - - [4096, 7000, 1, 4096, 4096, 4096, 4096, 4096]
    - [1, 20509.0]
  - - [5056, 256, 1, 3328, 5056, 5056, 5056, 3328]
    - [29, 15901.0]
  - - [1024, 3000, 1, 2560, 1024, 1024, 1024, 2560]
    - [22, 17852.0]
  - - [1024, 5888, 1, 1280, 1024, 1024, 1024, 1280]
    - [15, 18691.0]
  - - [6784, 2368, 1, 128, 6784, 6784, 6784, 128]
    - [29, 18830.0]
  - - [1856, 1024, 1, 1280, 1856, 1856, 1856, 1280]
    - [0, 17007.0]
  - - [6784, 4288, 1, 1280, 6784, 6784, 6784, 1280]
    - [1, 20105.0]
  - - [1856, 1856, 1, 1280, 1856, 1856, 1856, 1280]
    - [22, 16963.0]
  - - [3072, 24000, 1, 1024, 3072, 3072, 3072, 1024]
    - [4, 20360.0]
  - - [1408, 5056, 1, 1280, 1408, 1408, 1408, 1280]
    - [23, 18784.0]
  - - [5888, 1856, 1, 128, 5888, 5888, 5888, 128]
    - [35, 18425.0]
  - - [448, 6784, 1, 128, 448, 448, 448, 128]
    - [6, 14592.0]
  - - [5056, 3584, 1, 128, 5056, 5056, 5056, 128]
    - [1, 18726.0]
  - - [5888, 5888, 1, 3328, 5888, 5888, 5888, 3328]
    - [1, 20733.0]
  - - [6784, 1024, 1, 256, 6784, 6784, 6784, 256]
    - [30, 18947.0]
  - - [2944, 2368, 1, 256, 2944, 2944, 2944, 256]
    - [29, 18567.0]
  - - [5056, 5888, 1, 3328, 5056, 5056, 5056, 3328]
    - [30, 20237.0]
  - - [1856, 1024, 1, 256, 1856, 1856, 1856, 256]
    - [29, 15446.0]
  - - [512, 48000, 1, 1536, 512, 512, 512, 1536]
    - [23, 20302.0]
  - - [3584, 448, 1, 1280, 3584, 3584, 3584, 1280]
    - [29, 16582.0]
  - - [448, 5888, 1, 256, 448, 448, 448, 256]
    - [22, 14610.0]
  - - [1408, 6784, 1, 3328, 1408, 1408, 1408, 3328]
    - [23, 19523.0]
  - - [4288, 704, 1, 128, 4288, 4288, 4288, 128]
    - [29, 15530.0]
  - - [5056, 2944, 1, 256, 5056, 5056, 5056, 256]
    - [15, 19434.0]
  - - [6784, 5888, 1, 128, 6784, 6784, 6784, 128]
    - [1, 19683.0]
  - - [2944, 704, 1, 128, 2944, 2944, 2944, 128]
    - [29, 14738.0]
  - - [1408, 3584, 1, 3328, 1408, 1408, 1408, 3328]
    - [23, 19212.0]
  - - [2368, 6784, 1, 256, 2368, 2368, 2368, 256]
    - [30, 19121.0]
  - - [5056, 1408, 1, 1280, 5056, 5056, 5056, 1280]
    - [1, 18835.0]
  - - [5056, 4288, 1, 128, 5056, 5056, 5056, 128]
    - [30, 18857.0]
  - - [4288, 2368, 1, 3328, 4288, 4288, 4288, 3328]
    - [1, 19632.0]
  - - [1408, 1856, 1, 128, 1408, 1408, 1408, 128]
    - [6, 16175.0]
  - - [1408, 5888, 1, 3328, 1408, 1408, 1408, 3328]
    - [23, 19242.0]
  - - [6784, 6784, 1, 256, 6784, 6784, 6784, 256]
    - [1, 20172.0]
  - - [5888, 5056, 1, 128, 5888, 5888, 5888, 128]
    - [35, 19037.0]
  - - [4288, 2368, 1, 128, 4288, 4288, 4288, 128]
    - [35, 17972.0]
  - - [2368, 2944, 1, 256, 2368, 2368, 2368, 256]
    - [29, 17730.0]
  - - [3584, 1856, 1, 1280, 3584, 3584, 3584, 1280]
    - [1, 18944.0]
  - - [6784, 6784, 1, 128, 6784, 6784, 6784, 128]
    - [1, 19678.0]
  - - [5888, 5056, 1, 256, 5888, 5888, 5888, 256]
    - [7, 19623.0]
  - - [8448, 48000, 1, 2816, 8448, 8448, 8448, 2816]
    - [1, 20919.0]
  - - [512, 6000, 1, 2048, 512, 512, 512, 2048]
    - [35, 17775.0]
  - - [3584, 448, 1, 256, 3584, 3584, 3584, 256]
    - [35, 15558.0]
  - - [448, 4288, 1, 128, 448, 448, 448, 128]
    - [29, 13234.0]
  - - [256, 6784, 1, 256, 256, 256, 256, 256]
    - [35, 16714.0]
  - - [1408, 4288, 1, 128, 1408, 1408, 1408, 128]
    - [29, 17914.0]
  - - [2944, 704, 1, 3328, 2944, 2944, 2944, 3328]
    - [21, 17340.0]
  - - [3584, 3584, 1, 256, 3584, 3584, 3584, 256]
    - [36, 19627.0]
  - - [3584, 5056, 1, 256, 3584, 3584, 3584, 256]
    - [30, 19330.0]
  - - [2944, 2368, 1, 1280, 2944, 2944, 2944, 1280]
    - [0, 18861.0]
  - - [704, 6784, 1, 128, 704, 704, 704, 128]
    - [29, 16096.0]
  - - [6784, 3584, 1, 256, 6784, 6784, 6784, 256]
    - [15, 19988.0]
  - - [1856, 1408, 1, 256, 1856, 1856, 1856, 256]
    - [2, 15808.0]
  - - [5056, 2368, 1, 128, 5056, 5056, 5056, 128]
    - [29, 18218.0]
  - - [2944, 2944, 1, 3328, 2944, 2944, 2944, 3328]
    - [36, 20032.0]
  - - [5056, 6784, 1, 256, 5056, 5056, 5056, 256]
    - [1, 19834.0]
  - - [1856, 3584, 1, 128, 1856, 1856, 1856, 128]
    - [6, 17159.0]
  - - [3584, 6784, 1, 128, 3584, 3584, 3584, 128]
    - [7, 19420.0]
  - - [2368, 6784, 1, 1280, 2368, 2368, 2368, 1280]
    - [36, 20003.0]
  - - [5056, 1856, 1, 256, 5056, 5056, 5056, 256]
    - [15, 18408.0]
  - - [1024, 3000, 1, 2816, 1024, 1024, 1024, 2816]
    - [29, 17890.0]
  - - [1024, 1856, 1, 256, 1024, 1024, 1024, 256]
    - [29, 15931.0]
  - - [1408, 6784, 1, 1280, 1408, 1408, 1408, 1280]
    - [7, 19491.0]
  - - [3584, 3584, 1, 1280, 3584, 3584, 3584, 1280]
    - [1, 20271.0]
  - - [7680, 24000, 1, 2560, 7680, 7680, 7680, 2560]
    - [1, 20821.0]
  - - [4608, 48000, 1, 1536, 4608, 4608, 4608, 1536]
    - [23, 20826.0]
  - - [5888, 5888, 1, 128, 5888, 5888, 5888, 128]
    - [36, 19509.0]
  - - [5056, 2368, 1, 3328, 5056, 5056, 5056, 3328]
    - [23, 19018.0]
  - - [2944, 4288, 1, 256, 2944, 2944, 2944, 256]
    - [30, 19082.0]
  - - [1408, 3584, 1, 1280, 1408, 1408, 1408, 1280]
    - [23, 19058.0]
  - - [1024, 1500, 1, 2816, 1024, 1024, 1024, 2816]
    - [7, 16223.0]
  - - [1024, 6000, 1, 2048, 1024, 1024, 1024, 2048]
    - [7, 19133.0]
  - - [512, 24000, 1, 2560, 512, 512, 512, 2560]
    - [7, 20031.0]
  - - [6144, 3000, 1, 2560, 6144, 6144, 6144, 2560]
    - [1, 20104.0]
  - - [2368, 6784, 1, 3328, 2368, 2368, 2368, 3328]
    - [1, 20057.0]
  - - [1856, 1408, 1, 1280, 1856, 1856, 1856, 1280]
    - [30, 16872.0]
  - - [6784, 704, 1, 128, 6784, 6784, 6784, 128]
    - [14, 17417.0]
  - - [5056, 2944, 1, 128, 5056, 5056, 5056, 128]
    - [1, 18694.0]
  - - [1408, 5888, 1, 256, 1408, 1408, 1408, 256]
    - [15, 18578.0]
  - - [704, 2944, 1, 1280, 704, 704, 704, 1280]
    - [17, 16708.0]
  - - [3584, 704, 1, 1280, 3584, 3584, 3584, 1280]
    - [29, 17635.0]
  - - [5888, 2368, 1, 256, 5888, 5888, 5888, 256]
    - [36, 18893.0]
  - - [2944, 6784, 1, 128, 2944, 2944, 2944, 128]
    - [36, 19527.0]
  - - [3584, 448, 1, 3328, 3584, 3584, 3584, 3328]
    - [29, 16786.0]
  - - [704, 2368, 1, 3328, 704, 704, 704, 3328]
    - [6, 15086.0]
  - - [4608, 6000, 1, 1536, 4608, 4608, 4608, 1536]
    - [1, 20269.0]
  - - [256, 5888, 1, 128, 256, 256, 256, 128]
    - [29, 12984.0]
  - - [2944, 2944, 1, 1280, 2944, 2944, 2944, 1280]
    - [1, 19934.0]
  - - [5056, 448, 1, 3328, 5056, 5056, 5056, 3328]
    - [14, 17968.0]
  - - [6784, 704, 1, 3328, 6784, 6784, 6784, 3328]
    - [29, 18218.0]
  - - [5888, 4288, 1, 128, 5888, 5888, 5888, 128]
    - [0, 19019.0]
  - - [1408, 2944, 1, 3328, 1408, 1408, 1408, 3328]
    - [29, 17937.0]
  - - [3584, 704, 1, 128, 3584, 3584, 3584, 128]
    - [29, 16084.0]
  - - [448, 5056, 1, 128, 448, 448, 448, 128]
    - [14, 13251.0]
  - - [5056, 3584, 1, 256, 5056, 5056, 5056, 256]
    - [1, 19335.0]
  - - [4288, 4288, 1, 256, 4288, 4288, 4288, 256]
    - [7, 19052.0]
  - - [1408, 5056, 1, 128, 1408, 1408, 1408, 128]
    - [29, 17951.0]
  - - [2944, 3584, 1, 128, 2944, 2944, 2944, 128]
    - [1, 18963.0]
  - - [3584, 2368, 1, 256, 3584, 3584, 3584, 256]
    - [29, 18756.0]
  - - [5888, 5056, 1, 1280, 5888, 5888, 5888, 1280]
    - [1, 20162.0]
  - - [8448, 24000, 1, 2816, 8448, 8448, 8448, 2816]
    - [1, 20857.0]
  - - [3584, 3584, 1, 3328, 3584, 3584, 3584, 3328]
    - [1, 20369.0]
  - - [3072, 1500, 1, 128, 3072, 3072, 3072, 128]
    - [35, 17176.0]
  - - [2048, 3136, 1, 512, 2048, 2048, 2048, 512]
    - [29, 18767.0]
  - - [3025, 256, 64, 64, 3025, 3025, 3025, 64]
    - [0, 12124.0]
  - - [5888, 6784, 1, 256, 5888, 5888, 5888, 256]
    - [1, 19999.0]
  - - [4288, 2944, 1, 3328, 4288, 4288, 4288, 3328]
    - [1, 20042.0]
  - - [256, 5056, 1, 1280, 256, 256, 256, 1280]
    - [35, 15773.0]
  - - [2944, 5888, 1, 3328, 2944, 2944, 2944, 3328]
    - [15, 20252.0]
  - - [6784, 5888, 1, 1280, 6784, 6784, 6784, 1280]
    - [15, 20709.0]
  - - [5888, 4288, 1, 1280, 5888, 5888, 5888, 1280]
    - [1, 20092.0]
  - - [1024, 24000, 1, 2048, 1024, 1024, 1024, 2048]
    - [23, 20208.0]
  - - [5888, 3584, 1, 128, 5888, 5888, 5888, 128]
    - [30, 19203.0]
  - - [6784, 6784, 1, 3328, 6784, 6784, 6784, 3328]
    - [1, 20652.0]
  - - [704, 3584, 1, 128, 704, 704, 704, 128]
    - [14, 14066.0]
  - - [5888, 448, 1, 3328, 5888, 5888, 5888, 3328]
    - [29, 16937.0]
  - - [2368, 4288, 1, 1280, 2368, 2368, 2368, 1280]
    - [36, 19459.0]
  - - [4288, 2944, 1, 128, 4288, 4288, 4288, 128]
    - [1, 18458.0]
  - - [5056, 2944, 1, 3328, 5056, 5056, 5056, 3328]
    - [1, 20054.0]
  - - [2944, 3584, 1, 256, 2944, 2944, 2944, 256]
    - [15, 19477.0]
  - - [1408, 1408, 1, 3328, 1408, 1408, 1408, 3328]
    - [29, 17926.0]
  - - [3584, 3584, 1, 128, 3584, 3584, 3584, 128]
    - [1, 18946.0]
  - - [3584, 704, 1, 256, 3584, 3584, 3584, 256]
    - [14, 16989.0]
  - - [3584, 1408, 1, 3328, 3584, 3584, 3584, 3328]
    - [1, 19206.0]
  - - [704, 3584, 1, 1280, 704, 704, 704, 1280]
    - [23, 16333.0]
  - - [1024, 1408, 1, 128, 1024, 1024, 1024, 128]
    - [0, 14955.0]
  - - [1856, 6784, 1, 256, 1856, 1856, 1856, 256]
    - [1, 18514.0]
  - - [4288, 448, 1, 3328, 4288, 4288, 4288, 3328]
    - [0, 17382.0]
  - - [6784, 4288, 1, 128, 6784, 6784, 6784, 128]
    - [30, 19101.0]
  - - [6784, 704, 1, 1280, 6784, 6784, 6784, 1280]
    - [29, 18141.0]
  - - [3584, 6784, 1, 256, 3584, 3584, 3584, 256]
    - [36, 19843.0]
  - - [5888, 1024, 1, 3328, 5888, 5888, 5888, 3328]
    - [1, 18888.0]
  - - [704, 6784, 1, 1280, 704, 704, 704, 1280]
    - [36, 17982.0]
  - - [1856, 5056, 1, 3328, 1856, 1856, 1856, 3328]
    - [23, 19185.0]
  - - [1024, 3584, 1, 128, 1024, 1024, 1024, 128]
    - [35, 16635.0]
  - - [2368, 2944, 1, 128, 2368, 2368, 2368, 128]
    - [6, 17340.0]
  - - [5888, 2944, 1, 3328, 5888, 5888, 5888, 3328]
    - [1, 20269.0]
  - - [1408, 2368, 1, 128, 1408, 1408, 1408, 128]
    - [29, 16503.0]
  - - [5888, 2368, 1, 128, 5888, 5888, 5888, 128]
    - [29, 18668.0]
  - - [3584, 6784, 1, 1280, 3584, 3584, 3584, 1280]
    - [1, 20343.0]
  - - [4288, 1856, 1, 256, 4288, 4288, 4288, 256]
    - [6, 18120.0]
  - - [1856, 5888, 1, 256, 1856, 1856, 1856, 256]
    - [1, 18444.0]
  - - [4288, 4288, 1, 3328, 4288, 4288, 4288, 3328]
    - [1, 19615.0]
  - - [4288, 1408, 1, 1280, 4288, 4288, 4288, 1280]
    - [7, 18659.0]
  - - [3584, 5056, 1, 128, 3584, 3584, 3584, 128]
    - [0, 18821.0]
  - - [4288, 2368, 1, 256, 4288, 4288, 4288, 256]
    - [30, 18766.0]
  - - [2944, 5056, 1, 1280, 2944, 2944, 2944, 1280]
    - [1, 19954.0]
  - - [448, 6784, 1, 256, 448, 448, 448, 256]
    - [16, 15364.0]
  - - [1856, 2368, 1, 128, 1856, 1856, 1856, 128]
    - [0, 16783.0]
  - - [6784, 2368, 1, 3328, 6784, 6784, 6784, 3328]
    - [1, 20098.0]
  - - [1408, 6784, 1, 128, 1408, 1408, 1408, 128]
    - [29, 18237.0]
  - - [4288, 1856, 1, 3328, 4288, 4288, 4288, 3328]
    - [14, 18547.0]
  - - [3584, 448, 1, 128, 3584, 3584, 3584, 128]
    - [29, 14680.0]
  - - [3584, 1024, 1, 1280, 3584, 3584, 3584, 1280]
    - [0, 18094.0]
  - - [1856, 5056, 1, 256, 1856, 1856, 1856, 256]
    - [15, 18302.0]
  - - [6784, 4288, 1, 3328, 6784, 6784, 6784, 3328]
    - [1, 20187.0]
  - - [1024, 4288, 1, 256, 1024, 1024, 1024, 256]
    - [29, 18165.0]
  - - [5888, 3584, 1, 3328, 5888, 5888, 5888, 3328]
    - [1, 20545.0]
  - - [5056, 3584, 1, 3328, 5056, 5056, 5056, 3328]
    - [1, 19862.0]
  - - [2368, 1408, 1, 1280, 2368, 2368, 2368, 1280]
    - [30, 18165.0]
  - - [5056, 2944, 1, 1280, 5056, 5056, 5056, 1280]
    - [1, 19920.0]
  - - [8448, 6000, 1, 2816, 8448, 8448, 8448, 2816]
    - [1, 20642.0]
  - - [3584, 2944, 1, 1280, 3584, 3584, 3584, 1280]
    - [1, 20243.0]
  - - [1024, 6784, 1, 256, 1024, 1024, 1024, 256]
    - [11, 18755.0]
  - - [6784, 448, 1, 256, 6784, 6784, 6784, 256]
    - [14, 17092.0]
  - - [5124, 9124, 1, 2048, 5124, 5124, 5124, 2048]
    - [23, 20014.0]
  - - [2944, 5056, 1, 3328, 2944, 2944, 2944, 3328]
    - [30, 20007.0]
  - - [2944, 1408, 1, 128, 2944, 2944, 2944, 128]
    - [29, 16759.0]
  - - [5056, 6784, 1, 3328, 5056, 5056, 5056, 3328]
    - [1, 20504.0]
  - - [704, 2368, 1, 128, 704, 704, 704, 128]
    - [14, 12686.0]
  - - [3072, 1500, 1, 1024, 3072, 3072, 3072, 1024]
    - [23, 19080.0]
  - - [3584, 4288, 1, 256, 3584, 3584, 3584, 256]
    - [30, 19193.0]
  - - [1856, 6784, 1, 3328, 1856, 1856, 1856, 3328]
    - [1, 19181.0]
  - - [5888, 4288, 1, 256, 5888, 5888, 5888, 256]
    - [30, 19545.0]
  - - [5056, 1408, 1, 256, 5056, 5056, 5056, 256]
    - [7, 18072.0]
  - - [3584, 1024, 1, 256, 3584, 3584, 3584, 256]
    - [29, 17594.0]
  - - [512, 6000, 1, 1536, 512, 512, 512, 1536]
    - [35, 17685.0]
  - - [5888, 5888, 1, 256, 5888, 5888, 5888, 256]
    - [1, 20103.0]
  - - [4288, 1024, 1, 1280, 4288, 4288, 4288, 1280]
    - [1, 18368.0]
  - - [448, 6784, 1, 3328, 448, 448, 448, 3328]
    - [21, 17047.0]
  - - [2944, 1408, 1, 1280, 2944, 2944, 2944, 1280]
    - [14, 17844.0]
  - - [3072, 6000, 1, 1024, 3072, 3072, 3072, 1024]
    - [7, 20045.0]
  - - [2944, 1856, 1, 3328, 2944, 2944, 2944, 3328]
    - [36, 18750.0]
  - - [3584, 5888, 1, 1280, 3584, 3584, 3584, 1280]
    - [36, 20480.0]
  - - [6784, 1856, 1, 1280, 6784, 6784, 6784, 1280]
    - [35, 19128.0]
  - - [2944, 5056, 1, 256, 2944, 2944, 2944, 256]
    - [15, 19280.0]
  - - [5888, 256, 1, 3328, 5888, 5888, 5888, 3328]
    - [1, 16101.0]
  - - [2944, 4288, 1, 128, 2944, 2944, 2944, 128]
    - [29, 18763.0]
  - - [3584, 1408, 1, 256, 3584, 3584, 3584, 256]
    - [1, 18210.0]
  - - [704, 3584, 1, 3328, 704, 704, 704, 3328]
    - [23, 16736.0]
  - - [5056, 448, 1, 1280, 5056, 5056, 5056, 1280]
    - [29, 17731.0]
  - - [3584, 1856, 1, 3328, 3584, 3584, 3584, 3328]
    - [36, 19133.0]
  - - [4288, 6784, 1, 1280, 4288, 4288, 4288, 1280]
    - [1, 20091.0]
  - - [1024, 3000, 1, 2048, 1024, 1024, 1024, 2048]
    - [22, 17778.0]
  - - [2944, 1024, 1, 256, 2944, 2944, 2944, 256]
    - [14, 16969.0]
  - - [2368, 4288, 1, 3328, 2368, 2368, 2368, 3328]
    - [1, 19617.0]
  - - [1024, 1408, 1, 1280, 1024, 1024, 1024, 1280]
    - [35, 17303.0]
  - - [6784, 5056, 1, 256, 6784, 6784, 6784, 256]
    - [1, 19890.0]
  - - [1856, 1856, 1, 128, 1856, 1856, 1856, 128]
    - [6, 15658.0]
  - - [4288, 5888, 1, 256, 4288, 4288, 4288, 256]
    - [7, 19718.0]
  - - [2944, 6784, 1, 256, 2944, 2944, 2944, 256]
    - [1, 20068.0]
  - - [2944, 2944, 1, 128, 2944, 2944, 2944, 128]
    - [7, 18514.0]
  - - [1856, 3584, 1, 1280, 1856, 1856, 1856, 1280]
    - [36, 18939.0]
  - - [3584, 1408, 1, 1280, 3584, 3584, 3584, 1280]
    - [1, 19046.0]
  - - [4288, 448, 1, 128, 4288, 4288, 4288, 128]
    - [6, 14706.0]
  - - [5056, 256, 1, 1280, 5056, 5056, 5056, 1280]
    - [29, 15686.0]
  - - [1856, 1408, 1, 3328, 1856, 1856, 1856, 3328]
    - [15, 17333.0]
  - - [1024, 4288, 1, 3328, 1024, 1024, 1024, 3328]
    - [29, 18903.0]
  - - [5056, 448, 1, 256, 5056, 5056, 5056, 256]
    - [0, 16672.0]
  - - [2944, 2368, 1, 3328, 2944, 2944, 2944, 3328]
    - [29, 18940.0]
  - - [704, 4288, 1, 3328, 704, 704, 704, 3328]
    - [21, 17015.0]
  - - [1024, 1856, 1, 1280, 1024, 1024, 1024, 1280]
    - [29, 17052.0]
  - - [6784, 1856, 1, 256, 6784, 6784, 6784, 256]
    - [29, 18929.0]
  - - [512, 48000, 1, 2816, 512, 512, 512, 2816]
    - [23, 20431.0]
  - - [512, 3000, 1, 2816, 512, 512, 512, 2816]
    - [37, 16228.0]
  - - [1024, 5888, 1, 256, 1024, 1024, 1024, 256]
    - [29, 18189.0]
  - - [6784, 1408, 1, 256, 6784, 6784, 6784, 256]
    - [7, 18976.0]
  - - [1408, 2368, 1, 256, 1408, 1408, 1408, 256]
    - [29, 17292.0]
  - - [1408, 1408, 1, 256, 1408, 1408, 1408, 256]
    - [29, 16805.0]
  - - [2368, 2368, 1, 128, 2368, 2368, 2368, 128]
    - [29, 17041.0]
  - - [6784, 1408, 1, 128, 6784, 6784, 6784, 128]
    - [14, 18397.0]
  - - [1408, 5056, 1, 256, 1408, 1408, 1408, 256]
    - [29, 18257.0]
  - - [512, 50176, 1, 128, 512, 512, 512, 128]
    - [1, 19414.0]
  - - [4288, 3584, 1, 128, 4288, 4288, 4288, 128]
    - [14, 18540.0]
  - - [3584, 5056, 1, 1280, 3584, 3584, 3584, 1280]
    - [7, 19812.0]
  - - [1856, 1024, 1, 128, 1856, 1856, 1856, 128]
    - [29, 14293.0]
  - - [1024, 24000, 1, 1536, 1024, 1024, 1024, 1536]
    - [7, 20252.0]
  - - [704, 4288, 1, 256, 704, 704, 704, 256]
    - [29, 15237.0]
  - - [5888, 2368, 1, 1280, 5888, 5888, 5888, 1280]
    - [1, 19494.0]
  - - [6784, 1856, 1, 3328, 6784, 6784, 6784, 3328]
    - [29, 19196.0]
  - - [2368, 5888, 1, 1280, 2368, 2368, 2368, 1280]
    - [15, 19440.0]
  - - [5888, 256, 1, 1280, 5888, 5888, 5888, 1280]
    - [1, 15924.0]
  - - [2368, 1856, 1, 3328, 2368, 2368, 2368, 3328]
    - [1, 18695.0]
  - - [2944, 704, 1, 256, 2944, 2944, 2944, 256]
    - [14, 15791.0]
  - - [2368, 1024, 1, 3328, 2368, 2368, 2368, 3328]
    - [0, 17077.0]
  - - [704, 3584, 1, 256, 704, 704, 704, 256]
    - [36, 15277.0]
  - - [704, 2944, 1, 3328, 704, 704, 704, 3328]
    - [5, 17188.0]
  - - [6784, 1024, 1, 128, 6784, 6784, 6784, 128]
    - [23, 18236.0]
  - - [2944, 1024, 1, 3328, 2944, 2944, 2944, 3328]
    - [14, 17619.0]
  - - [2944, 5056, 1, 128, 2944, 2944, 2944, 128]
    - [0, 18764.0]
  - - [1408, 6784, 1, 256, 1408, 1408, 1408, 256]
    - [15, 18976.0]
  - - [6784, 1408, 1, 3328, 6784, 6784, 6784, 3328]
    - [1, 19555.0]
  - - [4288, 6784, 1, 128, 4288, 4288, 4288, 128]
    - [7, 19046.0]
  - - [1408, 2944, 1, 128, 1408, 1408, 1408, 128]
    - [35, 16790.0]
  - - [6784, 2944, 1, 1280, 6784, 6784, 6784, 1280]
    - [1, 20548.0]
  - - [4288, 1856, 1, 128, 4288, 4288, 4288, 128]
    - [14, 17576.0]
  - - [1856, 2944, 1, 128, 1856, 1856, 1856, 128]
    - [0, 16869.0]
  - - [6784, 448, 1, 128, 6784, 6784, 6784, 128]
    - [29, 16526.0]
  - - [448, 5056, 1, 1280, 448, 448, 448, 1280]
    - [35, 15709.0]
  - - [4288, 5056, 1, 1280, 4288, 4288, 4288, 1280]
    - [1, 19972.0]
  - - [2368, 1856, 1, 128, 2368, 2368, 2368, 128]
    - [14, 16526.0]
  - - [4288, 704, 1, 256, 4288, 4288, 4288, 256]
    - [6, 16713.0]
  - - [5888, 704, 1, 256, 5888, 5888, 5888, 256]
    - [29, 17430.0]
  - - [3584, 1024, 1, 128, 3584, 3584, 3584, 128]
    - [0, 17020.0]
  - - [256, 5888, 1, 3328, 256, 256, 256, 3328]
    - [23, 16044.0]
  - - [1408, 4288, 1, 3328, 1408, 1408, 1408, 3328]
    - [23, 18918.0]
  - - [6784, 4288, 1, 256, 6784, 6784, 6784, 256]
    - [7, 19608.0]
  - - [5888, 256, 1, 256, 5888, 5888, 5888, 256]
    - [35, 14583.0]
  - - [6784, 1024, 1, 1280, 6784, 6784, 6784, 1280]
    - [36, 19850.0]
  - - [5888, 1024, 1, 128, 5888, 5888, 5888, 128]
    - [29, 17914.0]
  - - [6784, 3584, 1, 1280, 6784, 6784, 6784, 1280]
    - [1, 20340.0]
  - - [1024, 6784, 1, 1280, 1024, 1024, 1024, 1280]
    - [23, 19675.0]
  - - [1408, 2944, 1, 1280, 1408, 1408, 1408, 1280]
    - [0, 17861.0]
  - - [1408, 2368, 1, 3328, 1408, 1408, 1408, 3328]
    - [36, 18661.0]
  - - [2944, 1856, 1, 128, 2944, 2944, 2944, 128]
    - [29, 17824.0]
  - - [256, 6784, 1, 128, 256, 256, 256, 128]
    - [0, 15480.0]
  - - [5056, 6784, 1, 128, 5056, 5056, 5056, 128]
    - [15, 19160.0]
  - - [4288, 5056, 1, 128, 4288, 4288, 4288, 128]
    - [23, 18622.0]
  - - [1856, 5888, 1, 128, 1856, 1856, 1856, 128]
    - [0, 17760.0]
  - - [3584, 1856, 1, 256, 3584, 3584, 3584, 256]
    - [29, 18441.0]
  - - [4288, 3584, 1, 1280, 4288, 4288, 4288, 1280]
    - [15, 19874.0]
  - - [704, 5888, 1, 128, 704, 704, 704, 128]
    - [14, 15596.0]
  - - [6784, 3584, 1, 128, 6784, 6784, 6784, 128]
    - [36, 19468.0]
  - - [5124, 1500, 1, 2048, 5124, 5124, 5124, 2048]
    - [23, 18895.0]
  - - [4288, 5056, 1, 3328, 4288, 4288, 4288, 3328]
    - [1, 20052.0]
  - - [1408, 1408, 1, 128, 1408, 1408, 1408, 128]
    - [29, 15268.0]
  - - [5056, 2368, 1, 256, 5056, 5056, 5056, 256]
    - [14, 18466.0]
  - - [4288, 704, 1, 3328, 4288, 4288, 4288, 3328]
    - [29, 17609.0]
  - - [448, 3584, 1, 256, 448, 448, 448, 256]
    - [22, 13415.0]
  - - [2368, 1024, 1, 1280, 2368, 2368, 2368, 1280]
    - [14, 16900.0]
  - - [2944, 1408, 1, 3328, 2944, 2944, 2944, 3328]
    - [29, 17929.0]
  - - [6144, 1500, 1, 2560, 6144, 6144, 6144, 2560]
    - [23, 19934.0]
  - - [1024, 1408, 1, 3328, 1024, 1024, 1024, 3328]
    - [29, 17718.0]
  - - [2944, 5888, 1, 1280, 2944, 2944, 2944, 1280]
    - [30, 20181.0]
  - - [5888, 3584, 1, 256, 5888, 5888, 5888, 256]
    - [36, 19927.0]
  - - [2368, 5056, 1, 128, 2368, 2368, 2368, 128]
    - [14, 18110.0]
  - - [1408, 1856, 1, 3328, 1408, 1408, 1408, 3328]
    - [29, 18359.0]
  - - [5888, 5056, 1, 3328, 5888, 5888, 5888, 3328]
    - [1, 20256.0]
  - - [7680, 6000, 1, 2560, 7680, 7680, 7680, 2560]
    - [23, 20609.0]
  - - [6784, 1408, 1, 1280, 6784, 6784, 6784, 1280]
    - [1, 19472.0]
  - - [512, 3000, 1, 2560, 512, 512, 512, 2560]
    - [36, 16228.0]
  - - [704, 2944, 1, 256, 704, 704, 704, 256]
    - [8, 15344.0]
  - - [6784, 5888, 1, 3328, 6784, 6784, 6784, 3328]
    - [1, 20781.0]
  - - [2368, 4288, 1, 128, 2368, 2368, 2368, 128]
    - [29, 17819.0]
  - - [1024, 6784, 1, 128, 1024, 1024, 1024, 128]
    - [7, 18132.0]
  - - [1024, 1500, 1, 1536, 1024, 1024, 1024, 1536]
    - [7, 15982.0]
  - - [1408, 1408, 1, 1280, 1408, 1408, 1408, 1280]
    - [29, 17683.0]
  - - [3072, 3000, 1, 1024, 3072, 3072, 3072, 1024]
    - [23, 19666.0]
  - - [448, 4288, 1, 3328, 448, 448, 448, 3328]
    - [34, 16006.0]
  - - [2368, 1408, 1, 256, 2368, 2368, 2368, 256]
    - [14, 17098.0]
  - - [704, 2368, 1, 256, 704, 704, 704, 256]
    - [22, 14039.0]
  - - [1024, 24000, 1, 2560, 1024, 1024, 1024, 2560]
    - [23, 20377.0]
  - - [5888, 2368, 1, 3328, 5888, 5888, 5888, 3328]
    - [30, 19542.0]
  - - [5124, 9124, 1, 1760, 5124, 5124, 5124, 1760]
    - [15, 20144.0]
  - - [4288, 448, 1, 1280, 4288, 4288, 4288, 1280]
    - [14, 17059.0]
  - - [5888, 704, 1, 3328, 5888, 5888, 5888, 3328]
    - [29, 17942.0]
  - - [5056, 256, 1, 128, 5056, 5056, 5056, 128]
    - [6, 12532.0]
  - - [1024, 6784, 1, 3328, 1024, 1024, 1024, 3328]
    - [36, 19828.0]
  - - [1408, 5888, 1, 128, 1408, 1408, 1408, 128]
    - [35, 17998.0]
  - - [512, 3136, 1, 2048, 512, 512, 512, 2048]
    - [24, 16855.0]
  - - [1408, 1024, 1, 256, 1408, 1408, 1408, 256]
    - [14, 16332.0]
  - - [8448, 1500, 1, 2816, 8448, 8448, 8448, 2816]
    - [1, 20051.0]
  - - [2560, 7000, 1, 2560, 2560, 2560, 2560, 2560]
    - [23, 20207.0]
  - - [5056, 6784, 1, 1280, 5056, 5056, 5056, 1280]
    - [1, 20395.0]
  - - [704, 5056, 1, 3328, 704, 704, 704, 3328]
    - [23, 17192.0]
  - - [3584, 5056, 1, 3328, 3584, 3584, 3584, 3328]
    - [36, 19846.0]
  - - [2368, 2944, 1, 3328, 2368, 2368, 2368, 3328]
    - [1, 18514.0]
  - - [2368, 3584, 1, 256, 2368, 2368, 2368, 256]
    - [1, 18694.0]
  - - [4608, 3000, 1, 1536, 4608, 4608, 4608, 1536]
    - [36, 20045.0]
  - - [5056, 3584, 1, 1280, 5056, 5056, 5056, 1280]
    - [1, 19817.0]
  - - [5124, 9124, 1, 4096, 5124, 5124, 5124, 4096]
    - [7, 20053.0]
  - - [7680, 48000, 1, 2560, 7680, 7680, 7680, 2560]
    - [1, 20897.0]
  - - [1856, 2944, 1, 1280, 1856, 1856, 1856, 1280]
    - [36, 18471.0]
  - - [4608, 1500, 1, 1536, 4608, 4608, 4608, 1536]
    - [36, 19651.0]
  - - [1024, 48000, 1, 2816, 1024, 1024, 1024, 2816]
    - [15, 20633.0]
  - - [5124, 9124, 1, 2560, 5124, 5124, 5124, 2560]
    - [1, 20082.0]
  - - [2944, 1408, 1, 256, 2944, 2944, 2944, 256]
    - [14, 17328.0]
  - - [4288, 1408, 1, 3328, 4288, 4288, 4288, 3328]
    - [1, 18943.0]
  - - [5888, 2944, 1, 128, 5888, 5888, 5888, 128]
    - [36, 19026.0]
  - - [2944, 1024, 1, 128, 2944, 2944, 2944, 128]
    - [14, 16365.0]
  - - [5124, 700, 1, 2048, 5124, 5124, 5124, 2048]
    - [29, 17638.0]
  - - [6784, 5056, 1, 128, 6784, 6784, 6784, 128]
    - [1, 19199.0]
  - - [256, 12544, 1, 1024, 256, 256, 256, 1024]
    - [22, 18373.0]
  - - [5888, 1408, 1, 3328, 5888, 5888, 5888, 3328]
    - [1, 19257.0]
  - - [2368, 1856, 1, 256, 2368, 2368, 2368, 256]
    - [14, 17188.0]
  - - [256, 5056, 1, 256, 256, 256, 256, 256]
    - [35, 14688.0]
  - - [5056, 5056, 1, 128, 5056, 5056, 5056, 128]
    - [23, 18859.0]
  - - [448, 3584, 1, 3328, 448, 448, 448, 3328]
    - [22, 14498.0]
  - - [5888, 256, 1, 128, 5888, 5888, 5888, 128]
    - [6, 13841.0]
  - - [3584, 1856, 1, 128, 3584, 3584, 3584, 128]
    - [29, 18062.0]
  - - [4288, 4288, 1, 128, 4288, 4288, 4288, 128]
    - [0, 18523.0]
  - - [1856, 1024, 1, 3328, 1856, 1856, 1856, 3328]
    - [14, 17147.0]
  - - [1856, 4288, 1, 128, 1856, 1856, 1856, 128]
    - [6, 17396.0]
  - - [1024, 6000, 1, 2560, 1024, 1024, 1024, 2560]
    - [7, 19167.0]
  - - [1024, 5056, 1, 256, 1024, 1024, 1024, 256]
    - [29, 18156.0]
  - - [5056, 5888, 1, 128, 5056, 5056, 5056, 128]
    - [15, 19170.0]
  - - [2368, 1408, 1, 3328, 2368, 2368, 2368, 3328]
    - [36, 18599.0]
  - - [1024, 48000, 1, 1536, 1024, 1024, 1024, 1536]
    - [23, 20530.0]
  - - [5888, 448, 1, 256, 5888, 5888, 5888, 256]
    - [14, 16071.0]
  - - [5888, 6784, 1, 128, 5888, 5888, 5888, 128]
    - [1, 19364.0]
  - - [6784, 5056, 1, 1280, 6784, 6784, 6784, 1280]
    - [15, 20386.0]
  - - [5056, 704, 1, 1280, 5056, 5056, 5056, 1280]
    - [6, 17474.0]
  - - [1024, 48000, 1, 2560, 1024, 1024, 1024, 2560]
    - [23, 20613.0]
  - - [1024, 2368, 1, 128, 1024, 1024, 1024, 128]
    - [29, 15185.0]
  - - [3072, 48000, 1, 1024, 3072, 3072, 3072, 1024]
    - [27, 20522.0]
  - - [1024, 5888, 1, 128, 1024, 1024, 1024, 128]
    - [29, 17644.0]
  - - [3584, 5888, 1, 128, 3584, 3584, 3584, 128]
    - [7, 19447.0]
  - - [5056, 5888, 1, 256, 5056, 5056, 5056, 256]
    - [36, 19697.0]
  - - [2368, 1024, 1, 256, 2368, 2368, 2368, 256]
    - [0, 15779.0]
  - - [2944, 1856, 1, 256, 2944, 2944, 2944, 256]
    - [29, 18256.0]
  - - [1856, 6784, 1, 1280, 1856, 1856, 1856, 1280]
    - [15, 19098.0]
  - - [8448, 3000, 1, 2816, 8448, 8448, 8448, 2816]
    - [1, 20258.0]
  - - [6784, 448, 1, 3328, 6784, 6784, 6784, 3328]
    - [0, 17716.0]
  - - [5056, 1856, 1, 1280, 5056, 5056, 5056, 1280]
    - [23, 19017.0]
  - - [1408, 1024, 1, 3328, 1408, 1408, 1408, 3328]
    - [14, 17773.0]
  - - [7680, 1500, 1, 2560, 7680, 7680, 7680, 2560]
    - [36, 19993.0]
  - - [5888, 3584, 1, 1280, 5888, 5888, 5888, 1280]
    - [23, 20477.0]
  - - [1856, 3584, 1, 3328, 1856, 1856, 1856, 3328]
    - [36, 19118.0]
  - - [1024, 2944, 1, 256, 1024, 1024, 1024, 256]
    - [29, 16843.0]
  - - [448, 6784, 1, 1280, 448, 448, 448, 1280]
    - [21, 16672.0]
  - - [704, 5056, 1, 256, 704, 704, 704, 256]
    - [6, 15770.0]
  - - [3584, 1024, 1, 3328, 3584, 3584, 3584, 3328]
    - [14, 18180.0]
  - - [2944, 1856, 1, 1280, 2944, 2944, 2944, 1280]
    - [14, 18607.0]
  - - [5056, 256, 1, 256, 5056, 5056, 5056, 256]
    - [0, 14233.0]
  - - [2944, 4288, 1, 3328, 2944, 2944, 2944, 3328]
    - [30, 19998.0]
  - - [2368, 3584, 1, 3328, 2368, 2368, 2368, 3328]
    - [36, 19638.0]
  - - [2944, 704, 1, 1280, 2944, 2944, 2944, 1280]
    - [34, 16876.0]
  - - [2944, 3584, 1, 1280, 2944, 2944, 2944, 1280]
    - [1, 20296.0]
  - - [1856, 5888, 1, 1280, 1856, 1856, 1856, 1280]
    - [1, 18991.0]
  - - [4608, 24000, 1, 1536, 4608, 4608, 4608, 1536]
    - [1, 20751.0]
  - - [4288, 1408, 1, 256, 4288, 4288, 4288, 256]
    - [6, 18094.0]
  - - [5888, 1408, 1, 128, 5888, 5888, 5888, 128]
    - [14, 18084.0]
  - - [4288, 2368, 1, 1280, 4288, 4288, 4288, 1280]
    - [23, 19514.0]
  - - [6784, 2368, 1, 256, 6784, 6784, 6784, 256]
    - [1, 19360.0]
  - - [1024, 24000, 1, 2816, 1024, 1024, 1024, 2816]
    - [30, 20450.0]
  - - [1856, 2944, 1, 256, 1856, 1856, 1856, 256]
    - [1, 17329.0]
  - - [5056, 1024, 1, 128, 5056, 5056, 5056, 128]
    - [6, 17691.0]
  - - [7680, 3000, 1, 2560, 7680, 7680, 7680, 2560]
    - [1, 20196.0]
  - - [4224, 1500, 1, 176, 4224, 4224, 4224, 176]
    - [29, 17951.0]
  - - [5124, 700, 1, 2560, 5124, 5124, 5124, 2560]
    - [14, 17704.0]
  - - [6784, 256, 1, 128, 6784, 6784, 6784, 128]
    - [29, 15677.0]
  - - [5888, 704, 1, 128, 5888, 5888, 5888, 128]
    - [14, 17049.0]
  - - [1024, 4288, 1, 1280, 1024, 1024, 1024, 1280]
    - [29, 18773.0]
  - - [2368, 5056, 1, 3328, 2368, 2368, 2368, 3328]
    - [36, 18999.0]
  - - [4288, 1024, 1, 3328, 4288, 4288, 4288, 3328]
    - [1, 18682.0]
  - - [6144, 48000, 1, 2560, 6144, 6144, 6144, 2560]
    - [1, 20882.0]
  - - [1024, 5056, 1, 3328, 1024, 1024, 1024, 3328]
    - [23, 19587.0]
  - - [1024, 1856, 1, 3328, 1024, 1024, 1024, 3328]
    - [29, 17207.0]
  - - [5124, 1500, 1, 2560, 5124, 5124, 5124, 2560]
    - [36, 18916.0]
  - - [4288, 6784, 1, 256, 4288, 4288, 4288, 256]
    - [7, 19600.0]
  - - [3584, 2944, 1, 3328, 3584, 3584, 3584, 3328]
    - [23, 20368.0]
  - - [5888, 2944, 1, 256, 5888, 5888, 5888, 256]
    - [30, 19573.0]
  - - [448, 4288, 1, 1280, 448, 448, 448, 1280]
    - [34, 15541.0]
  - - [1024, 4288, 1, 128, 1024, 1024, 1024, 128]
    - [0, 17696.0]
  - - [5056, 4288, 1, 256, 5056, 5056, 5056, 256]
    - [23, 19466.0]
  - - [1024, 3584, 1, 256, 1024, 1024, 1024, 256]
    - [29, 17470.0]
  - - [448, 5888, 1, 1280, 448, 448, 448, 1280]
    - [22, 15259.0]
  - - [512, 3000, 1, 2048, 512, 512, 512, 2048]
    - [8, 16137.0]
  - - [5056, 448, 1, 128, 5056, 5056, 5056, 128]
    - [6, 15488.0]
  - - [4288, 704, 1, 1280, 4288, 4288, 4288, 1280]
    - [22, 17398.0]
  - - [3584, 2944, 1, 128, 3584, 3584, 3584, 128]
    - [1, 18779.0]
  - - [6784, 256, 1, 1280, 6784, 6784, 6784, 1280]
    - [31, 18230.0]
  - - [2368, 5888, 1, 3328, 2368, 2368, 2368, 3328]
    - [1, 19515.0]
  - - [2368, 1856, 1, 1280, 2368, 2368, 2368, 1280]
    - [23, 18358.0]
  - - [448, 5056, 1, 3328, 448, 448, 448, 3328]
    - [35, 15868.0]
  - - [3584, 4288, 1, 128, 3584, 3584, 3584, 128]
    - [29, 18699.0]
  - - [1024, 6000, 1, 2816, 1024, 1024, 1024, 2816]
    - [23, 19174.0]
  - - [5888, 4288, 1, 3328, 5888, 5888, 5888, 3328]
    - [15, 20173.0]
  - - [2368, 704, 1, 256, 2368, 2368, 2368, 256]
    - [14, 15429.0]
  - - [3584, 1408, 1, 128, 3584, 3584, 3584, 128]
    - [0, 17410.0]
  - - [1856, 5056, 1, 1280, 1856, 1856, 1856, 1280]
    - [36, 19065.0]
  - - [2944, 1024, 1, 1280, 2944, 2944, 2944, 1280]
    - [29, 17487.0]
  - - [3584, 5888, 1, 3328, 3584, 3584, 3584, 3328]
    - [1, 20572.0]
  - - [2368, 4288, 1, 256, 2368, 2368, 2368, 256]
    - [15, 18499.0]
  - - [1024, 2368, 1, 3328, 1024, 1024, 1024, 3328]
    - [29, 17086.0]
  - - [1024, 2944, 1, 128, 1024, 1024, 1024, 128]
    - [14, 16295.0]
  - - [1024, 3584, 1, 1280, 1024, 1024, 1024, 1280]
    - [29, 18079.0]
  - - [4288, 5888, 1, 3328, 4288, 4288, 4288, 3328]
    - [1, 20202.0]
  - - [1024, 2944, 1, 3328, 1024, 1024, 1024, 3328]
    - [29, 17603.0]
  - - [256, 6784, 1, 1280, 256, 256, 256, 1280]
    - [8, 17956.0]
  - - [1856, 3584, 1, 256, 1856, 1856, 1856, 256]
    - [30, 18112.0]
  - - [6784, 1856, 1, 128, 6784, 6784, 6784, 128]
    - [29, 18753.0]
  - - [1024, 1500, 1, 2048, 1024, 1024, 1024, 2048]
    - [7, 16110.0]
  - - [512, 24000, 1, 2816, 512, 512, 512, 2816]
    - [23, 20193.0]
  - - [256, 5888, 1, 1280, 256, 256, 256, 1280]
    - [37, 15719.0]
  - - [4288, 6784, 1, 3328, 4288, 4288, 4288, 3328]
    - [1, 20166.0]
  - - [2368, 1408, 1, 128, 2368, 2368, 2368, 128]
    - [14, 16129.0]
  - - [1408, 1024, 1, 128, 1408, 1408, 1408, 128]
    - [0, 15078.0]
  - - [6784, 3584, 1, 3328, 6784, 6784, 6784, 3328]
    - [36, 20392.0]
  - - [1760, 7000, 1, 1760, 1760, 1760, 1760, 1760]
    - [15, 19569.0]
  - - [2368, 5056, 1, 1280, 2368, 2368, 2368, 1280]
    - [36, 18936.0]
  - - [1408, 2368, 1, 1280, 1408, 1408, 1408, 1280]
    - [36, 18330.0]
  - - [704, 4288, 1, 128, 704, 704, 704, 128]
    - [6, 14647.0]
  - - [2944, 2944, 1, 256, 2944, 2944, 2944, 256]
    - [15, 19334.0]
  - - [6784, 256, 1, 256, 6784, 6784, 6784, 256]
    - [14, 16969.0]
  - - [256, 5056, 1, 3328, 256, 256, 256, 3328]
    - [22, 15973.0]
  - - [5056, 1856, 1, 128, 5056, 5056, 5056, 128]
    - [14, 18051.0]
  - - [1024, 3000, 1, 1536, 1024, 1024, 1024, 1536]
    - [35, 17767.0]
  - - [5056, 1024, 1, 3328, 5056, 5056, 5056, 3328]
    - [1, 19671.0]
  - - [4288, 3584, 1, 3328, 4288, 4288, 4288, 3328]
    - [15, 19946.0]
  - - [1024, 2368, 1, 1280, 1024, 1024, 1024, 1280]
    - [29, 16935.0]
  - - [5888, 6784, 1, 3328, 5888, 5888, 5888, 3328]
    - [1, 20768.0]
  - - [704, 4288, 1, 1280, 704, 704, 704, 1280]
    - [7, 16511.0]
  - - [128, 50176, 1, 512, 128, 128, 128, 512]
    - [7, 19174.0]
  - - [1024, 48000, 1, 2048, 1024, 1024, 1024, 2048]
    - [27, 20411.0]
  - - [4288, 1024, 1, 128, 4288, 4288, 4288, 128]
    - [22, 16453.0]
  - - [784, 128, 128, 512, 784, 784, 784, 512]
    - [39, 15672.0]
  - - [784, 512, 256, 128, 784, 784, 784, 128]
    - [0, 15820.0]
  - - [3136, 256, 256, 64, 3136, 3136, 3136, 64]
    - [10, 9356.0]
  - - [784, 512, 128, 128, 784, 784, 784, 128]
    - [14, 14929.0]
  - - [784, 128, 256, 512, 784, 784, 784, 512]
    - [39, 15868.0]
  - - [3136, 256, 128, 64, 3136, 3136, 3136, 64]
    - [0, 10386.0]
  - - [4096, 512, 1, 1024, 4096, 4096, 4096, 1024]
    - [7, 16825.0]
  - - [2048, 768, 1, 512, 2048, 2048, 2048, 512]
    - [16, 15947.0]
  - - [4096, 512, 1, 2048, 4096, 4096, 4096, 2048]
    - [34, 17432.0]
  - - [4096, 1024, 1, 2048, 4096, 4096, 4096, 2048]
    - [29, 18029.0]
  - - [2048, 1024, 1, 2048, 2048, 2048, 2048, 2048]
    - [40, 17417.0]
  - - [2048, 1024, 1, 4096, 2048, 2048, 2048, 4096]
    - [28, 17588.0]
  - - [4096, 1024, 1, 1024, 4096, 4096, 4096, 1024]
    - [29, 17897.0]
  - - [2048, 1024, 1, 512, 2048, 2048, 2048, 512]
    - [21, 16565.0]
  - - [4096, 1024, 1, 4096, 4096, 4096, 4096, 4096]
    - [22, 18086.0]
  - - [2048, 1024, 1, 1024, 2048, 2048, 2048, 1024]
    - [28, 17014.0]
  - - [4096, 384, 1, 2048, 4096, 4096, 4096, 2048]
    - [7, 16570.0]
  - - [1225, 192, 64, 384, 1225, 1225, 1225, 384]
    - [0, 17453.0]
  - - [289, 128, 64, 1024, 289, 289, 289, 1024]
    - [22, 13482.0]
  - - [4096, 384, 1, 1536, 4096, 4096, 4096, 1536]
    - [1, 16595.0]
  - - [289, 192, 64, 1024, 289, 289, 289, 1024]
    - [38, 13607.0]
  - - [4096, 384, 1, 1280, 4096, 4096, 4096, 1280]
    - [36, 16516.0]
  - - [4096, 448, 1, 1280, 4096, 4096, 4096, 1280]
    - [14, 16483.0]
  - - [289, 256, 64, 1024, 289, 289, 289, 1024]
    - [11, 14095.0]
  - - [4096, 448, 1, 2048, 4096, 4096, 4096, 2048]
    - [22, 16502.0]
  - - [289, 384, 64, 1024, 289, 289, 289, 1024]
    - [11, 14355.0]
  - - [1024, 3594, 1, 4096, 1024, 1024, 1024, 4096]
    - [6, 18169.0]
  - - [4096, 3103, 1, 1024, 4096, 4096, 4096, 1024]
    - [7, 19141.0]
  - - [4096, 3136, 1, 1024, 4096, 4096, 4096, 1024]
    - [7, 19377.0]
  - - [1024, 3141, 1, 4096, 1024, 1024, 1024, 4096]
    - [40, 18123.0]
  - - [4096, 3559, 1, 1024, 4096, 4096, 4096, 1024]
    - [7, 20080.0]
  - - [4096, 3368, 1, 1024, 4096, 4096, 4096, 1024]
    - [7, 19814.0]
  - - [1024, 3335, 1, 4096, 1024, 1024, 1024, 4096]
    - [7, 19058.0]
  - - [1024, 3510, 1, 4096, 1024, 1024, 1024, 4096]
    - [6, 17773.0]
  - - [4096, 3209, 1, 1024, 4096, 4096, 4096, 1024]
    - [7, 18960.0]
  - - [4096, 3322, 1, 1024, 4096, 4096, 4096, 1024]
    - [7, 19588.0]
  - - [1024, 3400, 1, 4096, 1024, 1024, 1024, 4096]
    - [7, 19431.0]
  - - [1024, 3995, 1, 4096, 1024, 1024, 1024, 4096]
    - [6, 18795.0]
  - - [1024, 3503, 1, 4096, 1024, 1024, 1024, 4096]
    - [6, 17731.0]
  - - [4096, 3594, 1, 1024, 4096, 4096, 4096, 1024]
    - [7, 19570.0]
  - - [4096, 3473, 1, 1024, 4096, 4096, 4096, 1024]
    - [7, 19585.0]
  - - [4096, 3522, 1, 1024, 4096, 4096, 4096, 1024]
    - [7, 19950.0]
  - - [1024, 3103, 1, 4096, 1024, 1024, 1024, 4096]
    - [6, 18458.0]
  - - [1024, 3214, 1, 4096, 1024, 1024, 1024, 4096]
    - [28, 18531.0]
  - - [4096, 3449, 1, 1024, 4096, 4096, 4096, 1024]
    - [7, 20286.0]
  - - [1024, 3136, 1, 4096, 1024, 1024, 1024, 4096]
    - [6, 18664.0]
  - - [1024, 3955, 1, 33708, 1024, 1024, 1024, 33708]
    - [30, 19480.0]
  - - [1024, 3780, 1, 4096, 1024, 1024, 1024, 4096]
    - [7, 18696.0]
  - - [1024, 3906, 1, 33708, 1024, 1024, 1024, 33708]
    - [7, 19266.0]
  - - [1024, 3386, 1, 4096, 1024, 1024, 1024, 4096]
    - [23, 19302.0]
  - - [4096, 3396, 1, 1024, 4096, 4096, 4096, 1024]
    - [7, 19906.0]
  - - [1024, 3183, 1, 4096, 1024, 1024, 1024, 4096]
    - [40, 18325.0]
  - - [1024, 3098, 1, 4096, 1024, 1024, 1024, 4096]
    - [22, 18432.0]
  - - [1024, 3548, 1, 4096, 1024, 1024, 1024, 4096]
    - [6, 17934.0]
  - - [1024, 3224, 1, 4096, 1024, 1024, 1024, 4096]
    - [28, 18593.0]
  - - [4096, 3469, 1, 1024, 4096, 4096, 4096, 1024]
    - [7, 19607.0]
  - - [1024, 3582, 1, 4096, 1024, 1024, 1024, 4096]
    - [22, 18146.0]
  - - [1024, 2977, 1, 4096, 1024, 1024, 1024, 4096]
    - [22, 17735.0]
  - - [1024, 3939, 1, 1024, 1024, 1024, 1024, 1024]
    - [23, 18973.0]
  - - [4096, 3176, 1, 1024, 4096, 4096, 4096, 1024]
    - [7, 19569.0]
  - - [1024, 3559, 1, 4096, 1024, 1024, 1024, 4096]
    - [22, 18010.0]
  - - [1024, 3478, 1, 4096, 1024, 1024, 1024, 4096]
    - [6, 17604.0]
  - - [4096, 3343, 1, 1024, 4096, 4096, 4096, 1024]
    - [7, 19656.0]
  - - [4096, 3440, 1, 1024, 4096, 4096, 4096, 1024]
    - [7, 20189.0]
  - - [1024, 3996, 1, 33708, 1024, 1024, 1024, 33708]
    - [0, 18828.0]
  - - [1024, 4012, 1, 4096, 1024, 1024, 1024, 4096]
    - [6, 18869.0]
  - - [1024, 3322, 1, 4096, 1024, 1024, 1024, 4096]
    - [13, 19063.0]
  - - [1024, 3990, 1, 33708, 1024, 1024, 1024, 33708]
    - [0, 18800.0]
  - - [1024, 3314, 1, 4096, 1024, 1024, 1024, 4096]
    - [40, 18984.0]
  - - [4096, 3513, 1, 1024, 4096, 4096, 4096, 1024]
    - [7, 19814.0]
  - - [1024, 3562, 1, 4096, 1024, 1024, 1024, 4096]
    - [22, 18034.0]
  - - [1024, 3443, 1, 4096, 1024, 1024, 1024, 4096]
    - [7, 19658.0]
  - - [1024, 3554, 1, 4096, 1024, 1024, 1024, 4096]
    - [22, 18020.0]
  - - [1024, 3063, 1, 4096, 1024, 1024, 1024, 4096]
    - [22, 18229.0]
  - - [4096, 3460, 1, 1024, 4096, 4096, 4096, 1024]
    - [7, 19546.0]
  - - [1024, 3209, 1, 4096, 1024, 1024, 1024, 4096]
    - [40, 18480.0]
  - - [1024, 3147, 1, 4096, 1024, 1024, 1024, 4096]
    - [28, 18178.0]
  - - [4096, 3387, 1, 1024, 4096, 4096, 4096, 1024]
    - [7, 19928.0]
  - - [4096, 3436, 1, 1024, 4096, 4096, 4096, 1024]
    - [7, 20207.0]
  - - [1024, 3341, 1, 4096, 1024, 1024, 1024, 4096]
    - [7, 19082.0]
  - - [1024, 3516, 1, 4096, 1024, 1024, 1024, 4096]
    - [6, 17809.0]
  - - [4096, 3277, 1, 1024, 4096, 4096, 4096, 1024]
    - [7, 19335.0]
  - - [1024, 3454, 1, 4096, 1024, 1024, 1024, 4096]
    - [23, 19703.0]
  - - [1024, 3969, 1, 4096, 1024, 1024, 1024, 4096]
    - [22, 18687.0]
  - - [1024, 3999, 1, 4096, 1024, 1024, 1024, 4096]
    - [22, 18810.0]
  - - [1024, 4032, 1, 4096, 1024, 1024, 1024, 4096]
    - [22, 18987.0]
  - - [4096, 3541, 1, 1024, 4096, 4096, 4096, 1024]
    - [7, 19974.0]
  - - [4096, 3334, 1, 1024, 4096, 4096, 4096, 1024]
    - [7, 19597.0]
  - - [1024, 3365, 1, 4096, 1024, 1024, 1024, 4096]
    - [23, 19222.0]
  - - [1024, 3527, 1, 4096, 1024, 1024, 1024, 4096]
    - [22, 17824.0]
  - - [1024, 3190, 1, 4096, 1024, 1024, 1024, 4096]
    - [28, 18402.0]
  - - [4096, 3906, 1, 1024, 4096, 4096, 4096, 1024]
    - [7, 19762.0]
  - - [1024, 3593, 1, 4096, 1024, 1024, 1024, 4096]
    - [6, 18147.0]
  - - [1024, 3336, 1, 4096, 1024, 1024, 1024, 4096]
    - [23, 19054.0]
  - - [4096, 3504, 1, 1024, 4096, 4096, 4096, 1024]
    - [7, 19798.0]
  - - [4096, 3977, 1, 1024, 4096, 4096, 4096, 1024]
    - [7, 19531.0]
  - - [1024, 3906, 1, 4096, 1024, 1024, 1024, 4096]
    - [23, 19317.0]
  - - [4096, 3415, 1, 1024, 4096, 4096, 4096, 1024]
    - [7, 20065.0]
  - - [1024, 3295, 1, 4096, 1024, 1024, 1024, 4096]
    - [40, 18942.0]
  - - [4096, 3321, 1, 1024, 4096, 4096, 4096, 1024]
    - [7, 19660.0]
  - - [1024, 3072, 1, 4096, 1024, 1024, 1024, 4096]
    - [22, 18313.0]
  - - [1024, 3408, 1, 4096, 1024, 1024, 1024, 4096]
    - [23, 19459.0]
  - - [1024, 3522, 1, 4096, 1024, 1024, 1024, 4096]
    - [22, 17826.0]
  - - [4096, 3751, 1, 1024, 4096, 4096, 4096, 1024]
    - [7, 19721.0]
  - - [4096, 3378, 1, 1024, 4096, 4096, 4096, 1024]
    - [7, 19863.0]
  - - [1024, 3925, 1, 33708, 1024, 1024, 1024, 33708]
    - [7, 19361.0]
  - - [1024, 3990, 1, 1024, 1024, 1024, 1024, 1024]
    - [35, 18539.0]
  - - [1024, 3290, 1, 4096, 1024, 1024, 1024, 4096]
    - [28, 18885.0]
  - - [4096, 3500, 1, 1024, 4096, 4096, 4096, 1024]
    - [7, 19764.0]
  - - [4096, 3565, 1, 1024, 4096, 4096, 4096, 1024]
    - [7, 20149.0]
  - - [1024, 3484, 1, 4096, 1024, 1024, 1024, 4096]
    - [22, 17665.0]
  - - [4096, 3395, 1, 1024, 4096, 4096, 4096, 1024]
    - [7, 19954.0]
  - - [1024, 3681, 1, 1024, 1024, 1024, 1024, 1024]
    - [22, 18347.0]
  - - [1024, 3584, 1, 1024, 1024, 1024, 1024, 1024]
    - [22, 17949.0]
  - - [4096, 3093, 1, 1024, 4096, 4096, 4096, 1024]
    - [7, 19051.0]
  - - [1024, 4050, 1, 1024, 1024, 1024, 1024, 1024]
    - [22, 17704.0]
  - - [1024, 3301, 1, 4096, 1024, 1024, 1024, 4096]
    - [40, 18987.0]
  - - [1024, 3581, 1, 4096, 1024, 1024, 1024, 4096]
    - [6, 18128.0]
  - - [4096, 3374, 1, 1024, 4096, 4096, 4096, 1024]
    - [7, 19849.0]
  - - [1024, 3449, 1, 4096, 1024, 1024, 1024, 4096]
    - [7, 19664.0]
  - - [4096, 3215, 1, 1024, 4096, 4096, 4096, 1024]
    - [7, 18958.0]
  - - [4096, 3312, 1, 1024, 4096, 4096, 4096, 1024]
    - [7, 19619.0]
  - - [4096, 3479, 1, 1024, 4096, 4096, 4096, 1024]
    - [7, 19682.0]
  - - [4096, 3544, 1, 1024, 4096, 4096, 4096, 1024]
    - [7, 20053.0]
  - - [1024, 3263, 1, 4096, 1024, 1024, 1024, 4096]
    - [40, 18750.0]
  - - [4096, 3455, 1, 1024, 4096, 4096, 4096, 1024]
    - [7, 20306.0]
  - - [1024, 3379, 1, 4096, 1024, 1024, 1024, 4096]
    - [23, 19290.0]
  - - [1024, 3490, 1, 4096, 1024, 1024, 1024, 4096]
    - [6, 17690.0]
  - - [1024, 3368, 1, 4096, 1024, 1024, 1024, 4096]
    - [23, 19268.0]
  - - [4096, 3186, 1, 1024, 4096, 4096, 4096, 1024]
    - [7, 19658.0]
  - - [1024, 3428, 1, 4096, 1024, 1024, 1024, 4096]
    - [23, 19607.0]
  - - [4096, 3561, 1, 1024, 4096, 4096, 4096, 1024]
    - [7, 20129.0]
  - - [4096, 3418, 1, 1024, 4096, 4096, 4096, 1024]
    - [7, 20089.0]
  - - [1024, 3064, 1, 4096, 1024, 1024, 1024, 4096]
    - [22, 18245.0]
  - - [4096, 3259, 1, 1024, 4096, 4096, 4096, 1024]
    - [7, 19298.0]
  - - [4096, 3308, 1, 1024, 4096, 4096, 4096, 1024]
    - [7, 19509.0]
  - - [1024, 3533, 1, 4096, 1024, 1024, 1024, 4096]
    - [22, 17889.0]
  - - [1024, 3344, 1, 4096, 1024, 1024, 1024, 4096]
    - [23, 19184.0]
  - - [1024, 4030, 1, 1024, 1024, 1024, 1024, 1024]
    - [22, 18700.0]
  - - [4096, 3459, 1, 1024, 4096, 4096, 4096, 1024]
    - [7, 19555.0]
  - - [1024, 3572, 1, 4096, 1024, 1024, 1024, 4096]
    - [6, 18071.0]
  - - [1024, 3925, 1, 1024, 1024, 1024, 1024, 1024]
    - [7, 18926.0]
  - - [4096, 3435, 1, 1024, 4096, 4096, 4096, 1024]
    - [7, 20198.0]
  - - [1024, 3956, 1, 4096, 1024, 1024, 1024, 4096]
    - [23, 19555.0]
  - - [1024, 3463, 1, 4096, 1024, 1024, 1024, 4096]
    - [22, 17544.0]
  - - [4096, 3182, 1, 1024, 4096, 4096, 4096, 1024]
    - [7, 19580.0]
  - - [4096, 3976, 1, 1024, 4096, 4096, 4096, 1024]
    - [7, 19535.0]
  - - [1024, 3417, 1, 4096, 1024, 1024, 1024, 4096]
    - [7, 19510.0]
  - - [1024, 3528, 1, 4096, 1024, 1024, 1024, 4096]
    - [22, 17858.0]
  - - [4096, 3446, 1, 1024, 4096, 4096, 4096, 1024]
    - [7, 20278.0]
  - - [1024, 3543, 1, 4096, 1024, 1024, 1024, 4096]
    - [6, 17929.0]
  - - [4096, 3287, 1, 1024, 4096, 4096, 4096, 1024]
    - [7, 19395.0]
  - - [1024, 3499, 1, 4096, 1024, 1024, 1024, 4096]
    - [22, 17716.0]
  - - [1024, 3231, 1, 4096, 1024, 1024, 1024, 4096]
    - [13, 18625.0]
  - - [4096, 3519, 1, 1024, 4096, 4096, 4096, 1024]
    - [7, 19888.0]
  - - [4096, 3552, 1, 1024, 4096, 4096, 4096, 1024]
    - [7, 20028.0]
  - - [1024, 3458, 1, 4096, 1024, 1024, 1024, 4096]
    - [22, 17522.0]
  - - [1024, 3374, 1, 4096, 1024, 1024, 1024, 4096]
    - [23, 19305.0]
  - - [1024, 3396, 1, 4096, 1024, 1024, 1024, 4096]
    - [23, 19423.0]
  - - [1024, 2967, 1, 4096, 1024, 1024, 1024, 4096]
    - [22, 17705.0]
  - - [4096, 3482, 1, 1024, 4096, 4096, 4096, 1024]
    - [7, 19664.0]
  - - [1024, 3226, 1, 4096, 1024, 1024, 1024, 4096]
    - [13, 18523.0]
  - - [4096, 3377, 1, 1024, 4096, 4096, 4096, 1024]
    - [7, 19823.0]
  - - [4096, 3426, 1, 1024, 4096, 4096, 4096, 1024]
    - [7, 20122.0]
  - - [4096, 2935, 1, 1024, 4096, 4096, 4096, 1024]
    - [7, 19700.0]
  - - [1024, 3439, 1, 4096, 1024, 1024, 1024, 4096]
    - [7, 19621.0]
  - - [4096, 3267, 1, 1024, 4096, 4096, 4096, 1024]
    - [7, 19273.0]
  - - [4096, 3499, 1, 1024, 4096, 4096, 4096, 1024]
    - [7, 19733.0]
  - - [4096, 3356, 1, 1024, 4096, 4096, 4096, 1024]
    - [7, 19698.0]
  - - [4096, 3939, 1, 1024, 4096, 4096, 4096, 1024]
    - [7, 19952.0]
  - - [1024, 3526, 1, 4096, 1024, 1024, 1024, 4096]
    - [22, 17856.0]
  - - [1024, 3859, 1, 33708, 1024, 1024, 1024, 33708]
    - [1, 19038.0]
  - - [1024, 3385, 1, 4096, 1024, 1024, 1024, 4096]
    - [7, 19321.0]
  - - [1024, 3496, 1, 4096, 1024, 1024, 1024, 4096]
    - [22, 17717.0]
  - - [4096, 3141, 1, 1024, 4096, 4096, 4096, 1024]
    - [7, 19359.0]
  - - [4096, 3510, 1, 1024, 4096, 4096, 4096, 1024]
    - [7, 19869.0]
  - - [1024, 3434, 1, 4096, 1024, 1024, 1024, 4096]
    - [7, 19603.0]
  - - [4096, 3969, 1, 1024, 4096, 4096, 4096, 1024]
    - [7, 19481.0]
  - - [1024, 3121, 1, 4096, 1024, 1024, 1024, 4096]
    - [22, 18553.0]
  - - [1024, 3232, 1, 4096, 1024, 1024, 1024, 4096]
    - [40, 18619.0]
  - - [1024, 4030, 1, 33708, 1024, 1024, 1024, 33708]
    - [0, 18977.0]
  - - [1024, 3780, 1, 33708, 1024, 1024, 1024, 33708]
    - [1, 18660.0]
  - - [1024, 3969, 1, 1024, 1024, 1024, 1024, 1024]
    - [35, 18402.0]
  - - [4096, 3527, 1, 1024, 4096, 4096, 4096, 1024]
    - [7, 19921.0]
  - - [4096, 3336, 1, 1024, 4096, 4096, 4096, 1024]
    - [7, 19580.0]
  - - [4096, 3290, 1, 1024, 4096, 4096, 4096, 1024]
    - [7, 19411.0]
  - - [1024, 3469, 1, 4096, 1024, 1024, 1024, 4096]
    - [6, 17597.0]
  - - [4096, 3490, 1, 1024, 4096, 4096, 4096, 1024]
    - [7, 19760.0]
  - - [4096, 3064, 1, 1024, 4096, 4096, 4096, 1024]
    - [7, 19691.0]
  - - [4096, 3582, 1, 1024, 4096, 4096, 4096, 1024]
    - [7, 20257.0]
  - - [1024, 3956, 1, 1024, 1024, 1024, 1024, 1024]
    - [23, 18962.0]
  - - [4096, 3417, 1, 1024, 4096, 4096, 4096, 1024]
    - [7, 20105.0]
  - - [1024, 2736, 1, 4096, 1024, 1024, 1024, 4096]
    - [23, 18570.0]
  - - [1024, 3205, 1, 4096, 1024, 1024, 1024, 4096]
    - [28, 18468.0]
  - - [1024, 3143, 1, 4096, 1024, 1024, 1024, 4096]
    - [28, 18155.0]
  - - [1024, 4020, 1, 4096, 1024, 1024, 1024, 4096]
    - [6, 18903.0]
  - - [1024, 3318, 1, 4096, 1024, 1024, 1024, 4096]
    - [28, 19069.0]
  - - [4096, 3364, 1, 1024, 4096, 4096, 4096, 1024]
    - [7, 19790.0]
  - - [1024, 3353, 1, 4096, 1024, 1024, 1024, 4096]
    - [7, 19185.0]
  - - [1024, 3464, 1, 4096, 1024, 1024, 1024, 4096]
    - [6, 17540.0]
  - - [4096, 3205, 1, 1024, 4096, 4096, 4096, 1024]
    - [7, 18931.0]
  - - [4096, 3318, 1, 1024, 4096, 4096, 4096, 1024]
    - [7, 19584.0]
  - - [1024, 3402, 1, 4096, 1024, 1024, 1024, 4096]
    - [23, 19460.0]
  - - [4096, 3181, 1, 1024, 4096, 4096, 4096, 1024]
    - [7, 19601.0]
  - - [4096, 3550, 1, 1024, 4096, 4096, 4096, 1024]
    - [7, 20094.0]
  - - [4096, 3445, 1, 1024, 4096, 4096, 4096, 1024]
    - [7, 20258.0]
  - - [1024, 3138, 1, 4096, 1024, 1024, 1024, 4096]
    - [40, 18098.0]
  - - [4096, 3079, 1, 1024, 4096, 4096, 4096, 1024]
    - [7, 18976.0]
  - - [4096, 3144, 1, 1024, 4096, 4096, 4096, 1024]
    - [7, 19404.0]
  - - [4096, 3860, 1, 1024, 4096, 4096, 4096, 1024]
    - [7, 19559.0]
  - - [1024, 3515, 1, 4096, 1024, 1024, 1024, 4096]
    - [6, 17824.0]
  - - [4096, 3408, 1, 1024, 4096, 4096, 4096, 1024]
    - [7, 20034.0]
  - - [1024, 3181, 1, 4096, 1024, 1024, 1024, 4096]
    - [28, 18320.0]
  - - [4096, 3298, 1, 1024, 4096, 4096, 4096, 1024]
    - [7, 19475.0]
  - - [4096, 3585, 1, 1024, 4096, 4096, 4096, 1024]
    - [7, 19536.0]
  - - [1024, 3550, 1, 4096, 1024, 1024, 1024, 4096]
    - [22, 17978.0]
  - - [1024, 4020, 1, 1024, 1024, 1024, 1024, 1024]
    - [35, 18660.0]
  - - [4096, 3481, 1, 1024, 4096, 4096, 4096, 1024]
    - [7, 19684.0]
  - - [4096, 3530, 1, 1024, 4096, 4096, 4096, 1024]
    - [7, 19881.0]
  - - [4096, 3425, 1, 1024, 4096, 4096, 4096, 1024]
    - [7, 20119.0]
  - - [4096, 4026, 1, 1024, 4096, 4096, 4096, 1024]
    - [7, 19745.0]
  - - [1024, 3860, 1, 1024, 1024, 1024, 1024, 1024]
    - [23, 18611.0]
  - - [4096, 3975, 1, 1024, 4096, 4096, 4096, 1024]
    - [7, 19522.0]
  - - [1024, 3286, 1, 4096, 1024, 1024, 1024, 4096]
    - [40, 18904.0]
  - - [1024, 3176, 1, 4096, 1024, 1024, 1024, 4096]
    - [28, 18343.0]
  - - [1024, 3894, 1, 4096, 1024, 1024, 1024, 4096]
    - [23, 19306.0]
  - - [4096, 3355, 1, 1024, 4096, 4096, 4096, 1024]
    - [7, 19745.0]
  - - [4096, 3404, 1, 1024, 4096, 4096, 4096, 1024]
    - [7, 20046.0]
  - - [1024, 3501, 1, 4096, 1024, 1024, 1024, 4096]
    - [22, 17751.0]
  - - [4096, 3245, 1, 1024, 4096, 4096, 4096, 1024]
    - [7, 19164.0]
  - - [1024, 3431, 1, 4096, 1024, 1024, 1024, 4096]
    - [23, 19604.0]
  - - [1024, 4000, 1, 1024, 1024, 1024, 1024, 1024]
    - [35, 18592.0]
  - - [4096, 3509, 1, 1024, 4096, 4096, 4096, 1024]
    - [7, 19832.0]
  - - [4096, 3558, 1, 1024, 4096, 4096, 4096, 1024]
    - [7, 20142.0]
  - - [1024, 3535, 1, 4096, 1024, 1024, 1024, 4096]
    - [22, 17896.0]
  - - [1024, 3414, 1, 4096, 1024, 1024, 1024, 4096]
    - [23, 19542.0]
  - - [1024, 3445, 1, 4096, 1024, 1024, 1024, 4096]
    - [7, 19670.0]
  - - [1024, 3436, 1, 4096, 1024, 1024, 1024, 4096]
    - [7, 19622.0]
  - - [4096, 3472, 1, 1024, 4096, 4096, 4096, 1024]
    - [7, 19634.0]
  - - [1024, 3211, 1, 4096, 1024, 1024, 1024, 4096]
    - [40, 18503.0]
  - - [4096, 3383, 1, 1024, 4096, 4096, 4096, 1024]
    - [7, 19886.0]
  - - [4096, 3448, 1, 1024, 4096, 4096, 4096, 1024]
    - [7, 20288.0]
  - - [1024, 3343, 1, 4096, 1024, 1024, 1024, 4096]
    - [23, 19111.0]
  - - [1024, 3518, 1, 4096, 1024, 1024, 1024, 4096]
    - [6, 17832.0]
  - - [4096, 3289, 1, 1024, 4096, 4096, 4096, 1024]
    - [7, 19419.0]
  - - [1024, 3440, 1, 4096, 1024, 1024, 1024, 4096]
    - [7, 19635.0]
  - - [1024, 4032, 1, 33708, 1024, 1024, 1024, 33708]
    - [14, 18947.0]
  - - [4096, 3489, 1, 1024, 4096, 4096, 4096, 1024]
    - [7, 19697.0]
  - - [4096, 3346, 1, 1024, 4096, 4096, 4096, 1024]
    - [7, 19619.0]
  - - [1024, 3534, 1, 4096, 1024, 1024, 1024, 4096]
    - [6, 17894.0]
  - - [1024, 3079, 1, 4096, 1024, 1024, 1024, 4096]
    - [22, 18332.0]
  - - [1024, 3955, 1, 4096, 1024, 1024, 1024, 4096]
    - [23, 19570.0]
  - - [4096, 3236, 1, 1024, 4096, 4096, 4096, 1024]
    - [7, 19180.0]
  - - [1024, 3545, 1, 4096, 1024, 1024, 1024, 4096]
    - [22, 17962.0]
  - - [1024, 3144, 1, 4096, 1024, 1024, 1024, 4096]
    - [28, 18169.0]
  - - [4096, 3780, 1, 1024, 4096, 4096, 4096, 1024]
    - [7, 19862.0]
  - - [4096, 3163, 1, 1024, 4096, 4096, 4096, 1024]
    - [7, 19496.0]
  - - [4096, 3468, 1, 1024, 4096, 4096, 4096, 1024]
    - [7, 19613.0]
  - - [1024, 3539, 1, 4096, 1024, 1024, 1024, 4096]
    - [22, 17915.0]
  - - [1024, 3541, 1, 4096, 1024, 1024, 1024, 4096]
    - [22, 17925.0]
  - - [4096, 3363, 1, 1024, 4096, 4096, 4096, 1024]
    - [7, 19772.0]
  - - [1024, 3475, 1, 4096, 1024, 1024, 1024, 4096]
    - [35, 17623.0]
  - - [4096, 3110, 1, 1024, 4096, 4096, 4096, 1024]
    - [7, 19210.0]
  - - [1024, 3509, 1, 4096, 1024, 1024, 1024, 4096]
    - [22, 17789.0]
  - - [1024, 3413, 1, 4096, 1024, 1024, 1024, 4096]
    - [23, 19522.0]
  - - [1024, 3975, 1, 1024, 1024, 1024, 1024, 1024]
    - [22, 18461.0]
  - - [4096, 3549, 1, 1024, 4096, 4096, 4096, 1024]
    - [7, 20060.0]
  - - [4096, 3342, 1, 1024, 4096, 4096, 4096, 1024]
    - [7, 19621.0]
  - - [1024, 2985, 1, 4096, 1024, 1024, 1024, 4096]
    - [35, 17792.0]
  - - [1024, 3876, 1, 33708, 1024, 1024, 1024, 33708]
    - [7, 19132.0]
  - - [4096, 3280, 1, 1024, 4096, 4096, 4096, 1024]
    - [7, 19354.0]
  - - [4096, 3191, 1, 1024, 4096, 4096, 4096, 1024]
    - [7, 19633.0]
  - - [4096, 3512, 1, 1024, 4096, 4096, 4096, 1024]
    - [7, 19871.0]
  - - [1024, 3560, 1, 4096, 1024, 1024, 1024, 4096]
    - [22, 18021.0]
  - - [4096, 2499, 1, 1024, 4096, 4096, 4096, 1024]
    - [7, 19514.0]
  - - [1024, 3248, 1, 4096, 1024, 1024, 1024, 4096]
    - [13, 18701.0]
  - - [4096, 3423, 1, 1024, 4096, 4096, 4096, 1024]
    - [7, 20116.0]
  - - [4096, 3297, 1, 1024, 4096, 4096, 4096, 1024]
    - [7, 19436.0]
  - - [4096, 3154, 1, 1024, 4096, 4096, 4096, 1024]
    - [7, 19473.0]
  - - [1024, 3303, 1, 4096, 1024, 1024, 1024, 4096]
    - [40, 18962.0]
  - - [1024, 3222, 1, 4096, 1024, 1024, 1024, 4096]
    - [28, 18556.0]
  - - [1024, 3978, 1, 1024, 1024, 1024, 1024, 1024]
    - [35, 18498.0]
  - - [4096, 3529, 1, 1024, 4096, 4096, 4096, 1024]
    - [7, 19936.0]
  - - [4096, 3386, 1, 1024, 4096, 4096, 4096, 1024]
    - [7, 19919.0]
  - - [1024, 3451, 1, 4096, 1024, 1024, 1024, 4096]
    - [23, 19687.0]
  - - [4096, 3562, 1, 1024, 4096, 4096, 4096, 1024]
    - [7, 20120.0]
  - - [4096, 3276, 1, 1024, 4096, 4096, 4096, 1024]
    - [7, 19359.0]
  - - [1024, 3894, 1, 33708, 1024, 1024, 1024, 33708]
    - [7, 19199.0]
  - - [4096, 3540, 1, 1024, 4096, 4096, 4096, 1024]
    - [7, 19965.0]
  - - [1024, 3416, 1, 4096, 1024, 1024, 1024, 4096]
    - [23, 19505.0]
  - - [1024, 4005, 1, 33708, 1024, 1024, 1024, 33708]
    - [14, 18858.0]
  - - [1024, 3942, 1, 4096, 1024, 1024, 1024, 4096]
    - [7, 19443.0]
  - - [4096, 3403, 1, 1024, 4096, 4096, 4096, 1024]
    - [7, 19972.0]
  - - [4096, 3381, 1, 1024, 4096, 4096, 4096, 1024]
    - [7, 19862.0]
  - - [1024, 3492, 1, 4096, 1024, 1024, 1024, 4096]
    - [22, 17697.0]
  - - [4096, 3101, 1, 1024, 4096, 4096, 4096, 1024]
    - [7, 19136.0]
  - - [1024, 3430, 1, 4096, 1024, 1024, 1024, 4096]
    - [23, 19589.0]
  - - [1024, 3977, 1, 4096, 1024, 1024, 1024, 4096]
    - [22, 18725.0]
  - - [1024, 3640, 1, 4096, 1024, 1024, 1024, 4096]
    - [22, 18409.0]
  - - [4096, 3557, 1, 1024, 4096, 4096, 4096, 1024]
    - [7, 20100.0]
  - - [4096, 3414, 1, 1024, 4096, 4096, 4096, 1024]
    - [7, 20035.0]
  - - [1024, 3391, 1, 4096, 1024, 1024, 1024, 4096]
    - [23, 19402.0]
  - - [1024, 3356, 1, 4096, 1024, 1024, 1024, 4096]
    - [7, 19193.0]
  - - [4096, 3320, 1, 1024, 4096, 4096, 4096, 1024]
    - [1, 19585.0]
  - - [4096, 2765, 1, 1024, 4096, 4096, 4096, 1024]
    - [7, 19485.0]
  - - [1024, 3411, 1, 4096, 1024, 1024, 1024, 4096]
    - [23, 19494.0]
  - - [1024, 3978, 1, 4096, 1024, 1024, 1024, 4096]
    - [22, 18732.0]
  - - [4096, 3487, 1, 1024, 4096, 4096, 4096, 1024]
    - [7, 19676.0]
  - - [4096, 3520, 1, 1024, 4096, 4096, 4096, 1024]
    - [7, 19903.0]
  - - [4096, 3942, 1, 1024, 4096, 4096, 4096, 1024]
    - [7, 19929.0]
  - - [4096, 3431, 1, 1024, 4096, 4096, 4096, 1024]
    - [7, 20179.0]
  - - [1024, 3271, 1, 4096, 1024, 1024, 1024, 4096]
    - [40, 18812.0]
  - - [4096, 4020, 1, 1024, 4096, 4096, 4096, 1024]
    - [7, 19737.0]
  - - [1024, 3481, 1, 4096, 1024, 1024, 1024, 4096]
    - [6, 17622.0]
  - - [1024, 3419, 1, 4096, 1024, 1024, 1024, 4096]
    - [23, 19551.0]
  - - [1024, 4059, 1, 4096, 1024, 1024, 1024, 4096]
    - [22, 17919.0]
  - - [4096, 3345, 1, 1024, 4096, 4096, 4096, 1024]
    - [7, 19659.0]
  - - [4096, 3394, 1, 1024, 4096, 4096, 4096, 1024]
    - [7, 19954.0]
  - - [1024, 3298, 1, 4096, 1024, 1024, 1024, 4096]
    - [40, 18944.0]
  - - [4096, 3235, 1, 1024, 4096, 4096, 4096, 1024]
    - [7, 19114.0]
  - - [1024, 3681, 1, 33708, 1024, 1024, 1024, 33708]
    - [14, 18623.0]
  - - [1024, 3362, 1, 4096, 1024, 1024, 1024, 4096]
    - [7, 19174.0]
  - - [4096, 3467, 1, 1024, 4096, 4096, 4096, 1024]
    - [7, 19583.0]
  - - [1024, 3349, 1, 4096, 1024, 1024, 1024, 4096]
    - [23, 19119.0]
  - - [1024, 3460, 1, 4096, 1024, 1024, 1024, 4096]
    - [6, 17545.0]
  - - [4096, 3214, 1, 1024, 4096, 4096, 4096, 1024]
    - [7, 18908.0]
  - - [1024, 3398, 1, 4096, 1024, 1024, 1024, 4096]
    - [23, 19407.0]
  - - [4096, 3478, 1, 1024, 4096, 4096, 4096, 1024]
    - [7, 19567.0]
  - - [1024, 4050, 1, 33708, 1024, 1024, 1024, 33708]
    - [14, 17924.0]
  - - [1024, 3244, 1, 4096, 1024, 1024, 1024, 4096]
    - [40, 18606.0]
  - - [4096, 3341, 1, 1024, 4096, 4096, 4096, 1024]
    - [7, 19656.0]
  - - [4096, 3454, 1, 1024, 4096, 4096, 4096, 1024]
    - [7, 20254.0]
  - - [1024, 3166, 1, 4096, 1024, 1024, 1024, 4096]
    - [40, 18249.0]
  - - [1024, 3425, 1, 4096, 1024, 1024, 1024, 4096]
    - [23, 19626.0]
  - - [4096, 3295, 1, 1024, 4096, 4096, 4096, 1024]
    - [7, 19443.0]
  - - [4096, 3072, 1, 1024, 4096, 4096, 4096, 1024]
    - [7, 19714.0]
  - - [4096, 3822, 1, 1024, 4096, 4096, 4096, 1024]
    - [7, 20113.0]
  - - [1024, 3681, 1, 4096, 1024, 1024, 1024, 4096]
    - [6, 18563.0]
  - - [1024, 4050, 1, 4096, 1024, 1024, 1024, 4096]
    - [22, 17869.0]
  - - [4096, 3495, 1, 1024, 4096, 4096, 4096, 1024]
    - [7, 19739.0]
  - - [4096, 3560, 1, 1024, 4096, 4096, 4096, 1024]
    - [7, 20096.0]
  - - [1024, 3524, 1, 4096, 1024, 1024, 1024, 4096]
    - [22, 17835.0]
  - - [1024, 3942, 1, 33708, 1024, 1024, 1024, 33708]
    - [7, 19419.0]
  - - [1024, 3304, 1, 4096, 1024, 1024, 1024, 4096]
    - [40, 18882.0]
  - - [1024, 3387, 1, 4096, 1024, 1024, 1024, 4096]
    - [23, 19329.0]
  - - [1024, 3498, 1, 4096, 1024, 1024, 1024, 4096]
    - [22, 17684.0]
  - - [4096, 3458, 1, 1024, 4096, 4096, 4096, 1024]
    - [7, 19539.0]
  - - [4096, 2967, 1, 1024, 4096, 4096, 4096, 1024]
    - [7, 19073.0]
  - - [4096, 3385, 1, 1024, 4096, 4096, 4096, 1024]
    - [7, 19857.0]
  - - [4096, 3434, 1, 1024, 4096, 4096, 4096, 1024]
    - [7, 20183.0]
  - - [1024, 3519, 1, 4096, 1024, 1024, 1024, 4096]
    - [22, 17812.0]
  - - [1024, 3511, 1, 4096, 1024, 1024, 1024, 4096]
    - [6, 17797.0]
  - - [1024, 3288, 1, 4096, 1024, 1024, 1024, 4096]
    - [28, 18933.0]
  - - [1024, 2918, 1, 4096, 1024, 1024, 1024, 4096]
    - [6, 17416.0]
  - - [4096, 3573, 1, 1024, 4096, 4096, 4096, 1024]
    - [7, 20154.0]
  - - [1024, 3822, 1, 33708, 1024, 1024, 1024, 33708]
    - [1, 18894.0]
  - - [4096, 3539, 1, 1024, 4096, 4096, 4096, 1024]
    - [7, 19969.0]
  - - [4096, 3332, 1, 1024, 4096, 4096, 4096, 1024]
    - [7, 19558.0]
  - - [4096, 3286, 1, 1024, 4096, 4096, 4096, 1024]
    - [7, 19356.0]
  - - [1024, 4026, 1, 4096, 1024, 1024, 1024, 4096]
    - [6, 18924.0]
  - - [1024, 3277, 1, 4096, 1024, 1024, 1024, 4096]
    - [28, 18856.0]
  - - [1024, 3471, 1, 4096, 1024, 1024, 1024, 4096]
    - [6, 17602.0]
  - - [4096, 3518, 1, 1024, 4096, 4096, 4096, 1024]
    - [7, 19854.0]
  - - [1024, 3393, 1, 4096, 1024, 1024, 1024, 4096]
    - [23, 19358.0]
  - - [4096, 3413, 1, 1024, 4096, 4096, 4096, 1024]
    - [7, 20031.0]
  - - [4096, 3303, 1, 1024, 4096, 4096, 4096, 1024]
    - [7, 19468.0]
  - - [1024, 3207, 1, 4096, 1024, 1024, 1024, 4096]
    - [40, 18470.0]
  - - [1024, 3894, 1, 1024, 1024, 1024, 1024, 1024]
    - [23, 18759.0]
  - - [1024, 3977, 1, 1024, 1024, 1024, 1024, 1024]
    - [35, 18506.0]
  - - [4096, 3535, 1, 1024, 4096, 4096, 4096, 1024]
    - [7, 19969.0]
  - - [4096, 3376, 1, 1024, 4096, 4096, 4096, 1024]
    - [7, 19855.0]
  - - [1024, 3355, 1, 4096, 1024, 1024, 1024, 4096]
    - [23, 19180.0]
  - - [1024, 3466, 1, 4096, 1024, 1024, 1024, 4096]
    - [22, 17565.0]
  - - [4096, 3266, 1, 1024, 4096, 4096, 4096, 1024]
    - [7, 19227.0]
  - - [1024, 3404, 1, 4096, 1024, 1024, 1024, 4096]
    - [7, 19436.0]
  - - [1024, 3999, 1, 1024, 1024, 1024, 1024, 1024]
    - [35, 18595.0]
  - - [4096, 3498, 1, 1024, 4096, 4096, 4096, 1024]
    - [7, 19776.0]
  - - [1024, 4032, 1, 1024, 1024, 1024, 1024, 1024]
    - [35, 18754.0]
  - - [1024, 3410, 1, 4096, 1024, 1024, 1024, 4096]
    - [23, 19477.0]
  - - [4096, 3393, 1, 1024, 4096, 4096, 4096, 1024]
    - [7, 19941.0]
  - - [1024, 3140, 1, 4096, 1024, 1024, 1024, 4096]
    - [40, 18099.0]
  - - [1024, 3910, 1, 33708, 1024, 1024, 1024, 33708]
    - [7, 19299.0]
  - - [1024, 3334, 1, 4096, 1024, 1024, 1024, 4096]
    - [7, 19013.0]
  - - [4096, 3140, 1, 1024, 4096, 4096, 4096, 1024]
    - [7, 19333.0]
  - - [1024, 4005, 1, 4096, 1024, 1024, 1024, 4096]
    - [6, 18835.0]
  - - [1024, 3579, 1, 4096, 1024, 1024, 1024, 4096]
    - [22, 18102.0]
  - - [4096, 3372, 1, 1024, 4096, 4096, 4096, 1024]
    - [7, 19788.0]
  - - [1024, 3245, 1, 4096, 1024, 1024, 1024, 4096]
    - [40, 18710.0]
  - - [4096, 3956, 1, 1024, 4096, 4096, 4096, 1024]
    - [7, 19976.0]
  - - [4096, 3213, 1, 1024, 4096, 4096, 4096, 1024]
    - [7, 18960.0]
  - - [1024, 3361, 1, 4096, 1024, 1024, 1024, 4096]
    - [23, 19219.0]
  - - [1024, 3536, 1, 4096, 1024, 1024, 1024, 4096]
    - [22, 17910.0]
  - - [4096, 3477, 1, 1024, 4096, 4096, 4096, 1024]
    - [7, 19634.0]
  - - [4096, 3526, 1, 1024, 4096, 4096, 4096, 1024]
    - [7, 19935.0]
  - - [1024, 4005, 1, 1024, 1024, 1024, 1024, 1024]
    - [35, 18615.0]
  - - [1024, 3530, 1, 4096, 1024, 1024, 1024, 4096]
    - [6, 17874.0]
  - - [1024, 3944, 1, 4096, 1024, 1024, 1024, 4096]
    - [7, 19509.0]
  - - [4096, 3453, 1, 1024, 4096, 4096, 4096, 1024]
    - [7, 20229.0]
  - - [4096, 3184, 1, 1024, 4096, 4096, 4096, 1024]
    - [7, 19606.0]
  - - [4096, 3579, 1, 1024, 4096, 4096, 4096, 1024]
    - [7, 20207.0]
  - - [4096, 3351, 1, 1024, 4096, 4096, 4096, 1024]
    - [7, 19691.0]
  - - [4096, 3416, 1, 1024, 4096, 4096, 4096, 1024]
    - [7, 20102.0]
  - - [1024, 3822, 1, 4096, 1024, 1024, 1024, 4096]
    - [23, 18927.0]
  - - [1024, 3796, 1, 4096, 1024, 1024, 1024, 4096]
    - [7, 18760.0]
  - - [4096, 3257, 1, 1024, 4096, 4096, 4096, 1024]
    - [7, 19203.0]
  - - [4096, 3306, 1, 1024, 4096, 4096, 4096, 1024]
    - [7, 19480.0]
  - - [1024, 3505, 1, 4096, 1024, 1024, 1024, 4096]
    - [22, 17757.0]
  - - [1024, 3315, 1, 4096, 1024, 1024, 1024, 4096]
    - [13, 19061.0]
  - - [1024, 3486, 1, 4096, 1024, 1024, 1024, 4096]
    - [6, 17626.0]
  - - [4096, 3457, 1, 1024, 4096, 4096, 4096, 1024]
    - [7, 19597.0]
  - - [4096, 3870, 1, 1024, 4096, 4096, 4096, 1024]
    - [7, 19593.0]
  - - [1024, 3447, 1, 4096, 1024, 1024, 1024, 4096]
    - [7, 19660.0]
  - - [1024, 3558, 1, 4096, 1024, 1024, 1024, 4096]
    - [22, 18011.0]
  - - [4096, 3433, 1, 1024, 4096, 4096, 4096, 1024]
    - [7, 20140.0]
  - - [4096, 3180, 1, 1024, 4096, 4096, 4096, 1024]
    - [7, 19555.0]
  - - [1024, 3213, 1, 4096, 1024, 1024, 1024, 4096]
    - [40, 18470.0]
  - - [1024, 3900, 1, 4096, 1024, 1024, 1024, 4096]
    - [7, 19296.0]
  - - [4096, 3444, 1, 1024, 4096, 4096, 4096, 1024]
    - [7, 20202.0]
  - - [1024, 3504, 1, 4096, 1024, 1024, 1024, 4096]
    - [22, 17748.0]
  - - [4096, 4059, 1, 1024, 4096, 4096, 4096, 1024]
    - [7, 19841.0]
  - - [1024, 3442, 1, 4096, 1024, 1024, 1024, 4096]
    - [7, 19593.0]
  - - [4096, 3517, 1, 1024, 4096, 4096, 4096, 1024]
    - [7, 19794.0]
  - - [1024, 3566, 1, 4096, 1024, 1024, 1024, 4096]
    - [6, 18024.0]
  - - [4096, 3248, 1, 1024, 4096, 4096, 4096, 1024]
    - [7, 19197.0]
  - - [1024, 3547, 1, 4096, 1024, 1024, 1024, 4096]
    - [22, 17931.0]
  - - [1024, 3340, 1, 4096, 1024, 1024, 1024, 4096]
    - [23, 19115.0]
  - - [4096, 3480, 1, 1024, 4096, 4096, 4096, 1024]
    - [7, 19681.0]
  - - [4096, 3424, 1, 1024, 4096, 4096, 4096, 1024]
    - [7, 20140.0]
  - - [1024, 3906, 1, 1024, 1024, 1024, 1024, 1024]
    - [23, 18815.0]
  - - [4096, 3265, 1, 1024, 4096, 4096, 4096, 1024]
    - [7, 19293.0]
  - - [1024, 3384, 1, 4096, 1024, 1024, 1024, 4096]
    - [7, 19351.0]
  - - [1024, 3494, 1, 4096, 1024, 1024, 1024, 4096]
    - [22, 17691.0]
  - - [1024, 3236, 1, 4096, 1024, 1024, 1024, 4096]
    - [13, 18653.0]
  - - [4096, 3497, 1, 1024, 4096, 4096, 4096, 1024]
    - [7, 19765.0]
  - - [4096, 3354, 1, 1024, 4096, 4096, 4096, 1024]
    - [7, 19702.0]
  - - [4096, 3055, 1, 1024, 4096, 4096, 4096, 1024]
    - [7, 19587.0]
  - - [4096, 3244, 1, 1024, 4096, 4096, 4096, 1024]
    - [7, 19135.0]
  - - [4096, 3139, 1, 1024, 4096, 4096, 4096, 1024]
    - [7, 19377.0]
  - - [4096, 3508, 1, 1024, 4096, 4096, 4096, 1024]
    - [7, 19835.0]
  - - [4096, 4050, 1, 1024, 4096, 4096, 4096, 1024]
    - [7, 19875.0]
  - - [1024, 3472, 1, 4096, 1024, 1024, 1024, 4096]
    - [22, 17599.0]
  - - [1024, 3861, 1, 1024, 1024, 1024, 1024, 1024]
    - [23, 18580.0]
  - - [1024, 3910, 1, 1024, 1024, 1024, 1024, 1024]
    - [23, 18819.0]
  - - [4096, 3371, 1, 1024, 4096, 4096, 4096, 1024]
    - [7, 19858.0]
  - - [1024, 3751, 1, 4096, 1024, 1024, 1024, 4096]
    - [7, 18577.0]
  - - [4096, 3325, 1, 1024, 4096, 4096, 4096, 1024]
    - [7, 19591.0]
  - - [1024, 3321, 1, 4096, 1024, 1024, 1024, 4096]
    - [40, 19036.0]
  - - [1024, 3944, 1, 1024, 1024, 1024, 1024, 1024]
    - [7, 18948.0]
  - - [4096, 3525, 1, 1024, 4096, 4096, 4096, 1024]
    - [7, 19902.0]
  - - [4096, 3382, 1, 1024, 4096, 4096, 4096, 1024]
    - [7, 19848.0]
  - - [1024, 3453, 1, 4096, 1024, 1024, 1024, 4096]
    - [7, 19692.0]
  - - [4096, 3564, 1, 1024, 4096, 4096, 4096, 1024]
    - [7, 20096.0]
  - - [4096, 3288, 1, 1024, 4096, 4096, 4096, 1024]
    - [7, 19427.0]
  - - [1024, 3925, 1, 4096, 1024, 1024, 1024, 4096]
    - [23, 19348.0]
  - - [1024, 3057, 1, 4096, 1024, 1024, 1024, 4096]
    - [22, 18199.0]
  - - [4096, 3488, 1, 1024, 4096, 4096, 4096, 1024]
    - [7, 19673.0]
  - - [4096, 3046, 1, 1024, 4096, 4096, 4096, 1024]
    - [7, 19561.0]
  - - [1024, 3189, 1, 4096, 1024, 1024, 1024, 4096]
    - [40, 18368.0]
  - - [4096, 3399, 1, 1024, 4096, 4096, 4096, 1024]
    - [7, 19942.0]
  - - [1024, 3383, 1, 4096, 1024, 1024, 1024, 4096]
    - [23, 19338.0]
  - - [1024, 3415, 1, 4096, 1024, 1024, 1024, 4096]
    - [7, 19497.0]
  - - [1024, 3388, 1, 4096, 1024, 1024, 1024, 4096]
    - [23, 19393.0]
  - - [1024, 3376, 1, 4096, 1024, 1024, 1024, 4096]
    - [23, 19346.0]
  - - [1024, 3473, 1, 4096, 1024, 1024, 1024, 4096]
    - [6, 17604.0]
  - - [4096, 3162, 1, 1024, 4096, 4096, 4096, 1024]
    - [7, 19506.0]
  - - [1024, 3448, 1, 4096, 1024, 1024, 1024, 4096]
    - [23, 19664.0]
  - - [4096, 3362, 1, 1024, 4096, 4096, 4096, 1024]
    - [7, 19770.0]
  - - [1024, 3262, 1, 4096, 1024, 1024, 1024, 4096]
    - [40, 18806.0]
  - - [1024, 3184, 1, 4096, 1024, 1024, 1024, 4096]
    - [13, 18362.0]
  - - [1024, 3378, 1, 4096, 1024, 1024, 1024, 4096]
    - [23, 19352.0]
  - - [4096, 3548, 1, 1024, 4096, 4096, 4096, 1024]
    - [7, 20066.0]
  - - [4096, 2977, 1, 1024, 4096, 4096, 4096, 1024]
    - [7, 19141.0]
  - - [4096, 3443, 1, 1024, 4096, 4096, 4096, 1024]
    - [7, 20185.0]
  - - [1024, 3289, 1, 4096, 1024, 1024, 1024, 4096]
    - [28, 18875.0]
  - - [1024, 3483, 1, 4096, 1024, 1024, 1024, 4096]
    - [22, 17645.0]
  - - [4096, 3190, 1, 1024, 4096, 4096, 4096, 1024]
    - [7, 19673.0]
  - - [1024, 3421, 1, 4096, 1024, 1024, 1024, 4096]
    - [23, 19549.0]
  - - [1024, 3514, 1, 4096, 1024, 1024, 1024, 4096]
    - [22, 17797.0]
  - - [1024, 3532, 1, 4096, 1024, 1024, 1024, 4096]
    - [22, 17877.0]
  - - [1024, 3565, 1, 4096, 1024, 1024, 1024, 4096]
    - [22, 18055.0]
  - - [4096, 3422, 1, 1024, 4096, 4096, 4096, 1024]
    - [7, 20110.0]
  - - [4096, 3263, 1, 1024, 4096, 4096, 4096, 1024]
    - [7, 19276.0]
  - - [4096, 3296, 1, 1024, 4096, 4096, 4096, 1024]
    - [7, 19400.0]
  - - [4096, 3640, 1, 1024, 4096, 4096, 4096, 1024]
    - [7, 19843.0]
  - - [4096, 3463, 1, 1024, 4096, 4096, 4096, 1024]
    - [7, 19596.0]
  - - [4096, 3528, 1, 1024, 4096, 4096, 4096, 1024]
    - [7, 19943.0]
  - - [1024, 3351, 1, 4096, 1024, 1024, 1024, 4096]
    - [7, 19123.0]
  - - [1024, 3462, 1, 4096, 1024, 1024, 1024, 4096]
    - [22, 17552.0]
  - - [4096, 3226, 1, 1024, 4096, 4096, 4096, 1024]
    - [7, 19090.0]
  - - [4096, 3439, 1, 1024, 4096, 4096, 4096, 1024]
    - [7, 20175.0]
  - - [4096, 3121, 1, 1024, 4096, 4096, 4096, 1024]
    - [7, 19270.0]
  - - [1024, 4059, 1, 33708, 1024, 1024, 1024, 33708]
    - [14, 17982.0]
  - - [1024, 3311, 1, 4096, 1024, 1024, 1024, 4096]
    - [40, 18933.0]
  - - [1024, 3230, 1, 4096, 1024, 1024, 1024, 4096]
    - [28, 18603.0]
  - - [4096, 3353, 1, 1024, 4096, 4096, 4096, 1024]
    - [7, 19724.0]
  - - [4096, 3402, 1, 1024, 4096, 4096, 4096, 1024]
    - [7, 20019.0]
  - - [1024, 3427, 1, 4096, 1024, 1024, 1024, 4096]
    - [36, 19581.0]
  - - [1024, 3346, 1, 4096, 1024, 1024, 1024, 4096]
    - [23, 19182.0]
  - - [1024, 3126, 1, 4096, 1024, 1024, 1024, 4096]
    - [22, 18586.0]
  - - [1024, 3796, 1, 1024, 1024, 1024, 1024, 1024]
    - [23, 18289.0]
  - - [1024, 3990, 1, 4096, 1024, 1024, 1024, 4096]
    - [22, 18762.0]
  - - [1024, 3257, 1, 4096, 1024, 1024, 1024, 4096]
    - [13, 18768.0]
  - - [4096, 3996, 1, 1024, 4096, 4096, 4096, 1024]
    - [7, 19609.0]
  - - [1024, 3306, 1, 4096, 1024, 1024, 1024, 4096]
    - [40, 19025.0]
  - - [1024, 3389, 1, 4096, 1024, 1024, 1024, 4096]
    - [23, 19418.0]
  - - [1024, 3500, 1, 4096, 1024, 1024, 1024, 4096]
    - [6, 17735.0]
  - - [1024, 3999, 1, 33708, 1024, 1024, 1024, 33708]
    - [14, 18825.0]
  - - [4096, 3486, 1, 1024, 4096, 4096, 4096, 1024]
    - [7, 19700.0]
  - - [1024, 3438, 1, 4096, 1024, 1024, 1024, 4096]
    - [7, 19577.0]
  - - [4096, 3616, 1, 1024, 4096, 4096, 4096, 1024]
    - [7, 19652.0]
  - - [1024, 3955, 1, 1024, 1024, 1024, 1024, 1024]
    - [7, 18887.0]
  - - [4096, 3430, 1, 1024, 4096, 4096, 4096, 1024]
    - [7, 20156.0]
  - - [4096, 3271, 1, 1024, 4096, 4096, 4096, 1024]
    - [7, 19265.0]
  - - [1024, 3364, 1, 4096, 1024, 1024, 1024, 4096]
    - [23, 19229.0]
  - - [1024, 3497, 1, 4096, 1024, 1024, 1024, 4096]
    - [22, 17715.0]
  - - [4096, 3503, 1, 1024, 4096, 4096, 4096, 1024]
    - [7, 19810.0]
  - - [4096, 3344, 1, 1024, 4096, 4096, 4096, 1024]
    - [7, 19612.0]
  - - [1024, 3457, 1, 4096, 1024, 1024, 1024, 4096]
    - [22, 17495.0]
  - - [4096, 3466, 1, 1024, 4096, 4096, 4096, 1024]
    - [7, 19560.0]
  - - [1024, 3976, 1, 33708, 1024, 1024, 1024, 33708]
    - [22, 18696.0]
  - - [1024, 3395, 1, 4096, 1024, 1024, 1024, 4096]
    - [23, 19379.0]
  - - [4096, 3361, 1, 1024, 4096, 4096, 4096, 1024]
    - [7, 19703.0]
  - - [1024, 3751, 1, 33708, 1024, 1024, 1024, 33708]
    - [7, 18512.0]
  - - [1024, 3822, 1, 1024, 1024, 1024, 1024, 1024]
    - [36, 18189.0]
  - - [4096, 3315, 1, 1024, 4096, 4096, 4096, 1024]
    - [7, 19616.0]
  - - [1024, 3163, 1, 4096, 1024, 1024, 1024, 4096]
    - [40, 18150.0]
  - - [4096, 3547, 1, 1024, 4096, 4096, 4096, 1024]
    - [7, 19972.0]
  - - [4096, 3340, 1, 1024, 4096, 4096, 4096, 1024]
    - [7, 19619.0]
  - - [1024, 3296, 1, 4096, 1024, 1024, 1024, 4096]
    - [40, 18890.0]
  - - [1024, 3468, 1, 4096, 1024, 1024, 1024, 4096]
    - [6, 17535.0]
  - - [4096, 3294, 1, 1024, 4096, 4096, 4096, 1024]
    - [7, 19402.0]
  - - [1024, 3406, 1, 4096, 1024, 1024, 1024, 4096]
    - [23, 19422.0]
  - - [1024, 3860, 1, 33708, 1024, 1024, 1024, 33708]
    - [1, 19042.0]
  - - [1024, 3584, 1, 4096, 1024, 1024, 1024, 4096]
    - [22, 18139.0]
  - - [4096, 3189, 1, 1024, 4096, 4096, 4096, 1024]
    - [7, 19573.0]
  - - [4096, 3494, 1, 1024, 4096, 4096, 4096, 1024]
    - [7, 19736.0]
  - - [1024, 3093, 1, 4096, 1024, 1024, 1024, 4096]
    - [22, 18359.0]
  - - [4096, 3421, 1, 1024, 4096, 4096, 4096, 1024]
    - [7, 20043.0]
  - - [1024, 3479, 1, 4096, 1024, 1024, 1024, 4096]
    - [6, 17583.0]
  - - [1024, 3433, 1, 4096, 1024, 1024, 1024, 4096]
    - [7, 19615.0]
  - - [4096, 3311, 1, 1024, 4096, 4096, 4096, 1024]
    - [7, 19446.0]
  - - [1024, 3381, 1, 4096, 1024, 1024, 1024, 4096]
    - [7, 19290.0]
  - - [1024, 3996, 1, 4096, 1024, 1024, 1024, 4096]
    - [35, 18793.0]
  - - [4096, 3384, 1, 1024, 4096, 4096, 4096, 1024]
    - [7, 19881.0]
  - - [1024, 3247, 1, 4096, 1024, 1024, 1024, 4096]
    - [40, 18675.0]
  - - [1024, 3169, 1, 4096, 1024, 1024, 1024, 4096]
    - [28, 18264.0]
  - - [1024, 3088, 1, 4096, 1024, 1024, 1024, 4096]
    - [22, 18383.0]
  - - [1024, 3363, 1, 4096, 1024, 1024, 1024, 4096]
    - [23, 19222.0]
  - - [1024, 3538, 1, 4096, 1024, 1024, 1024, 4096]
    - [6, 17921.0]
  - - [1024, 3996, 1, 1024, 1024, 1024, 1024, 1024]
    - [22, 18598.0]
  - - [4096, 3169, 1, 1024, 4096, 4096, 4096, 1024]
    - [7, 19555.0]
  - - [4096, 3538, 1, 1024, 4096, 4096, 4096, 1024]
    - [7, 20002.0]
  - - [4096, 3401, 1, 1024, 4096, 4096, 4096, 1024]
    - [7, 19959.0]
  - - [4096, 3581, 1, 1024, 4096, 4096, 4096, 1024]
    - [7, 20208.0]
  - - [1024, 3180, 1, 4096, 1024, 1024, 1024, 4096]
    - [40, 18284.0]
  - - [1024, 3870, 1, 1024, 1024, 1024, 1024, 1024]
    - [23, 18591.0]
  - - [4096, 3555, 1, 1024, 4096, 4096, 4096, 1024]
    - [7, 20041.0]
  - - [4096, 3412, 1, 1024, 4096, 4096, 4096, 1024]
    - [7, 20035.0]
  - - [4096, 3302, 1, 1024, 4096, 4096, 4096, 1024]
    - [7, 19481.0]
  - - [1024, 3561, 1, 4096, 1024, 1024, 1024, 4096]
    - [6, 18026.0]
  - - [1024, 3302, 1, 4096, 1024, 1024, 1024, 4096]
    - [28, 19019.0]
  - - [1024, 3976, 1, 4096, 1024, 1024, 1024, 4096]
    - [6, 18702.0]
  - - [4096, 3485, 1, 1024, 4096, 4096, 4096, 1024]
    - [7, 19693.0]
  - - [4096, 3534, 1, 1024, 4096, 4096, 4096, 1024]
    - [7, 19945.0]
  - - [1024, 3110, 1, 4096, 1024, 1024, 1024, 4096]
    - [22, 18506.0]
  - - [1024, 3401, 1, 4096, 1024, 1024, 1024, 4096]
    - [23, 19472.0]
  - - [4096, 3216, 1, 1024, 4096, 4096, 4096, 1024]
    - [7, 18956.0]
  - - [1024, 4020, 1, 33708, 1024, 1024, 1024, 33708]
    - [14, 18923.0]
  - - [1024, 3215, 1, 4096, 1024, 1024, 1024, 4096]
    - [40, 18447.0]
  - - [4096, 3566, 1, 1024, 4096, 4096, 4096, 1024]
    - [7, 20101.0]
  - - [1024, 3137, 1, 4096, 1024, 1024, 1024, 4096]
    - [40, 18098.0]
  - - [4096, 3359, 1, 1024, 4096, 4096, 4096, 1024]
    - [7, 19719.0]
  - - [4096, 3392, 1, 1024, 4096, 4096, 4096, 1024]
    - [7, 19956.0]
  - - [1024, 3506, 1, 4096, 1024, 1024, 1024, 4096]
    - [35, 17765.0]
  - - [4096, 3233, 1, 1024, 4096, 4096, 4096, 1024]
    - [7, 19074.0]
  - - [1024, 3444, 1, 4096, 1024, 1024, 1024, 4096]
    - [36, 19657.0]
  - - [1024, 3975, 1, 4096, 1024, 1024, 1024, 4096]
    - [6, 18708.0]
  - - [1024, 3870, 1, 33708, 1024, 1024, 1024, 33708]
    - [1, 19060.0]
  - - [4096, 3465, 1, 1024, 4096, 4096, 4096, 1024]
    - [7, 19586.0]
  - - [1024, 3523, 1, 4096, 1024, 1024, 1024, 4096]
    - [22, 17855.0]
  - - [4096, 3990, 1, 1024, 4096, 4096, 4096, 1024]
    - [7, 19569.0]
  - - [1024, 3549, 1, 4096, 1024, 1024, 1024, 4096]
    - [22, 17965.0]
  - - [1024, 3342, 1, 4096, 1024, 1024, 1024, 4096]
    - [23, 19115.0]
  - - [4096, 3476, 1, 1024, 4096, 4096, 4096, 1024]
    - [7, 19665.0]
  - - [1024, 3418, 1, 4096, 1024, 1024, 1024, 4096]
    - [23, 19525.0]
  - - [1024, 3859, 1, 1024, 1024, 1024, 1024, 1024]
    - [7, 18599.0]
  - - [4096, 3339, 1, 1024, 4096, 4096, 4096, 1024]
    - [7, 19622.0]
  - - [4096, 3452, 1, 1024, 4096, 4096, 4096, 1024]
    - [7, 20295.0]
  - - [4096, 3293, 1, 1024, 4096, 4096, 4096, 1024]
    - [7, 19446.0]
  - - [1024, 3369, 1, 4096, 1024, 1024, 1024, 4096]
    - [7, 19274.0]
  - - [1024, 3544, 1, 4096, 1024, 1024, 1024, 4096]
    - [22, 17922.0]
  - - [4096, 3493, 1, 1024, 4096, 4096, 4096, 1024]
    - [7, 19750.0]
  - - [4096, 3350, 1, 1024, 4096, 4096, 4096, 1024]
    - [7, 19712.0]
  - - [4096, 3256, 1, 1024, 4096, 4096, 4096, 1024]
    - [7, 19229.0]
  - - [1024, 3870, 1, 4096, 1024, 1024, 1024, 4096]
    - [23, 19133.0]
  - - [4096, 4012, 1, 1024, 4096, 4096, 4096, 1024]
    - [7, 19667.0]
  - - [1024, 3280, 1, 4096, 1024, 1024, 1024, 4096]
    - [40, 18795.0]
  - - [4096, 3456, 1, 1024, 4096, 4096, 4096, 1024]
    - [7, 20337.0]
  - - [1024, 3555, 1, 4096, 1024, 1024, 1024, 4096]
    - [6, 17991.0]
  - - [4096, 3014, 1, 1024, 4096, 4096, 4096, 1024]
    - [7, 19319.0]
  - - [1024, 3474, 1, 4096, 1024, 1024, 1024, 4096]
    - [22, 17615.0]
  - - [4096, 3367, 1, 1024, 4096, 4096, 4096, 1024]
    - [7, 19773.0]
  - - [4096, 3432, 1, 1024, 4096, 4096, 4096, 1024]
    - [7, 20191.0]
  - - [4096, 3273, 1, 1024, 4096, 4096, 4096, 1024]
    - [7, 19324.0]
  - - [4096, 3130, 1, 1024, 4096, 4096, 4096, 1024]
    - [7, 19317.0]
  - - [1024, 2984, 1, 4096, 1024, 1024, 1024, 4096]
    - [35, 17799.0]
  - - [1024, 3995, 1, 1024, 1024, 1024, 1024, 1024]
    - [22, 18559.0]
  - - [1024, 3517, 1, 4096, 1024, 1024, 1024, 4096]
    - [35, 17836.0]
  - - [1024, 3455, 1, 4096, 1024, 1024, 1024, 4096]
    - [7, 19718.0]
  - - [1024, 3939, 1, 4096, 1024, 1024, 1024, 4096]
    - [23, 19497.0]
  - - [4096, 3147, 1, 1024, 4096, 4096, 4096, 1024]
    - [7, 19414.0]
  - - [4096, 3516, 1, 1024, 4096, 4096, 4096, 1024]
    - [7, 19879.0]
  - - [1024, 3876, 1, 4096, 1024, 1024, 1024, 4096]
    - [7, 19149.0]
  - - [1024, 3191, 1, 4096, 1024, 1024, 1024, 4096]
    - [28, 18405.0]
  - - [4096, 3411, 1, 1024, 4096, 4096, 4096, 1024]
    - [7, 20071.0]
  - - [1024, 3337, 1, 4096, 1024, 1024, 1024, 4096]
    - [7, 19049.0]
  - - [1024, 3512, 1, 4096, 1024, 1024, 1024, 4096]
    - [6, 17773.0]
  - - [4096, 3301, 1, 1024, 4096, 4096, 4096, 1024]
    - [7, 19464.0]
  - - [1024, 3450, 1, 4096, 1024, 1024, 1024, 4096]
    - [23, 19670.0]
  - - [4096, 3533, 1, 1024, 4096, 4096, 4096, 1024]
    - [7, 19961.0]
  - - [4096, 3390, 1, 1024, 4096, 4096, 4096, 1024]
    - [7, 19909.0]
  - - [4096, 3231, 1, 1024, 4096, 4096, 4096, 1024]
    - [7, 19111.0]
  - - [1024, 2499, 1, 4096, 1024, 1024, 1024, 4096]
    - [22, 17933.0]
  - - [1024, 3186, 1, 4096, 1024, 1024, 1024, 4096]
    - [28, 18362.0]
  - - [1024, 3380, 1, 4096, 1024, 1024, 1024, 4096]
    - [23, 19333.0]
  - - [4096, 3496, 1, 1024, 4096, 4096, 4096, 1024]
    - [7, 19792.0]
  - - [1024, 3956, 1, 33708, 1024, 1024, 1024, 33708]
    - [7, 19506.0]
  - - [1024, 3976, 1, 1024, 1024, 1024, 1024, 1024]
    - [35, 18451.0]
  - - [4096, 2736, 1, 1024, 4096, 4096, 4096, 1024]
    - [7, 19273.0]
  - - [1024, 3291, 1, 4096, 1024, 1024, 1024, 4096]
    - [40, 18890.0]
  - - [1024, 3944, 1, 33708, 1024, 1024, 1024, 33708]
    - [7, 19422.0]
  - - [1024, 3485, 1, 4096, 1024, 1024, 1024, 4096]
    - [35, 17657.0]
  - - [4096, 3138, 1, 1024, 4096, 4096, 4096, 1024]
    - [7, 19342.0]
  - - [1024, 3423, 1, 4096, 1024, 1024, 1024, 4096]
    - [23, 19552.0]
  - - [1024, 3491, 1, 4096, 1024, 1024, 1024, 4096]
    - [22, 17693.0]
  - - [1024, 3860, 1, 4096, 1024, 1024, 1024, 4096]
    - [7, 19114.0]
  - - [4096, 3211, 1, 1024, 4096, 4096, 4096, 1024]
    - [7, 18936.0]
  - - [1024, 3221, 1, 4096, 1024, 1024, 1024, 4096]
    - [40, 18558.0]
  - - [1024, 2917, 1, 4096, 1024, 1024, 1024, 4096]
    - [6, 17410.0]
  - - [4096, 3475, 1, 1024, 4096, 4096, 4096, 1024]
    - [7, 19679.0]
  - - [4096, 3524, 1, 1024, 4096, 4096, 4096, 1024]
    - [7, 19928.0]
  - - [4096, 2985, 1, 1024, 4096, 4096, 4096, 1024]
    - [7, 19182.0]
  - - [1024, 3480, 1, 4096, 1024, 1024, 1024, 4096]
    - [22, 17659.0]
  - - [4096, 3222, 1, 1024, 4096, 4096, 4096, 1024]
    - [7, 19057.0]
  - - [4096, 3451, 1, 1024, 4096, 4096, 4096, 1024]
    - [7, 20274.0]
  - - [1024, 3969, 1, 33708, 1024, 1024, 1024, 33708]
    - [14, 18712.0]
  - - [1024, 3640, 1, 1024, 1024, 1024, 1024, 1024]
    - [35, 18070.0]
  - - [1024, 3297, 1, 4096, 1024, 1024, 1024, 4096]
    - [28, 18927.0]
  - - [4096, 3944, 1, 1024, 4096, 4096, 4096, 1024]
    - [7, 19970.0]
  - - [1024, 3216, 1, 4096, 1024, 1024, 1024, 4096]
    - [40, 18511.0]
  - - [4096, 3349, 1, 1024, 4096, 4096, 4096, 1024]
    - [7, 19666.0]
  - - [4096, 3398, 1, 1024, 4096, 4096, 4096, 1024]
    - [7, 19963.0]
  - - [1024, 3154, 1, 4096, 1024, 1024, 1024, 4096]
    - [40, 18176.0]
  - - [1024, 3978, 1, 33708, 1024, 1024, 1024, 33708]
    - [14, 18744.0]
  - - [1024, 3348, 1, 4096, 1024, 1024, 1024, 4096]
    - [23, 19115.0]
  - - [4096, 3304, 1, 1024, 4096, 4096, 4096, 1024]
    - [7, 19508.0]
  - - [4096, 4030, 1, 1024, 4096, 4096, 4096, 1024]
    - [7, 19795.0]
  - - [1024, 4026, 1, 1024, 1024, 1024, 1024, 1024]
    - [35, 18686.0]
  - - [4096, 3471, 1, 1024, 4096, 4096, 4096, 1024]
    - [7, 19662.0]
  - - [1024, 3259, 1, 4096, 1024, 1024, 1024, 4096]
    - [40, 18749.0]
  - - [1024, 3308, 1, 4096, 1024, 1024, 1024, 4096]
    - [40, 19036.0]
  - - [4096, 3391, 1, 1024, 4096, 4096, 4096, 1024]
    - [7, 19934.0]
  - - [1024, 3312, 1, 4096, 1024, 1024, 1024, 4096]
    - [40, 19027.0]
  - - [1024, 3502, 1, 4096, 1024, 1024, 1024, 4096]
    - [22, 17754.0]
  - - [1024, 3968, 1, 33708, 1024, 1024, 1024, 33708]
    - [7, 19544.0]
  - - [1024, 3424, 1, 4096, 1024, 1024, 1024, 4096]
    - [23, 19505.0]
  - - [4096, 4032, 1, 1024, 4096, 4096, 4096, 1024]
    - [7, 19724.0]
  - - [1024, 3900, 1, 1024, 1024, 1024, 1024, 1024]
    - [36, 18682.0]
  - - [4096, 3442, 1, 1024, 4096, 4096, 4096, 1024]
    - [7, 20242.0]
  - - [1024, 3366, 1, 4096, 1024, 1024, 1024, 4096]
    - [23, 19225.0]
  - - [4096, 3999, 1, 1024, 4096, 4096, 4096, 1024]
    - [7, 19614.0]
  - - [1024, 3477, 1, 4096, 1024, 1024, 1024, 4096]
    - [22, 17631.0]
  - - [1024, 2505, 1, 4096, 1024, 1024, 1024, 4096]
    - [22, 17943.0]
  - - [4096, 3515, 1, 1024, 4096, 4096, 4096, 1024]
    - [7, 19867.0]
  - - [1024, 3564, 1, 4096, 1024, 1024, 1024, 4096]
    - [22, 18028.0]
  - - [4096, 3057, 1, 1024, 4096, 4096, 4096, 1024]
    - [7, 19607.0]
  - - [1024, 3339, 1, 4096, 1024, 1024, 1024, 4096]
    - [23, 19096.0]
  - - [4096, 3262, 1, 1024, 4096, 4096, 4096, 1024]
    - [7, 19246.0]
  - - [1024, 4030, 1, 4096, 1024, 1024, 1024, 4096]
    - [22, 18953.0]
  - - [1024, 3265, 1, 4096, 1024, 1024, 1024, 4096]
    - [28, 18799.0]
  - - [1024, 3459, 1, 4096, 1024, 1024, 1024, 4096]
    - [22, 17540.0]
  - - [4096, 3462, 1, 1024, 4096, 4096, 4096, 1024]
    - [7, 19560.0]
  - - [1024, 3513, 1, 4096, 1024, 1024, 1024, 4096]
    - [22, 17799.0]
  - - [1024, 3397, 1, 4096, 1024, 1024, 1024, 4096]
    - [23, 19446.0]
  - - [4096, 3572, 1, 1024, 4096, 4096, 4096, 1024]
    - [7, 20175.0]
  - - [4096, 3389, 1, 1024, 4096, 4096, 4096, 1024]
    - [7, 19914.0]
  - - [4096, 3438, 1, 1024, 4096, 4096, 4096, 1024]
    - [7, 20216.0]
  - - [1024, 3640, 1, 33708, 1024, 1024, 1024, 33708]
    - [14, 18434.0]
  - - [1024, 3995, 1, 33708, 1024, 1024, 1024, 33708]
    - [14, 18831.0]
  - - [1024, 3165, 1, 4096, 1024, 1024, 1024, 4096]
    - [40, 18185.0]
  - - [4096, 3543, 1, 1024, 4096, 4096, 4096, 1024]
    - [7, 20015.0]
  - - [4096, 3352, 1, 1024, 4096, 4096, 4096, 1024]
    - [7, 19687.0]
  - - [1024, 3359, 1, 4096, 1024, 1024, 1024, 4096]
    - [23, 19191.0]
  - - [1024, 3470, 1, 4096, 1024, 1024, 1024, 4096]
    - [6, 17574.0]
  - - [1024, 3392, 1, 4096, 1024, 1024, 1024, 4096]
    - [23, 19423.0]
  - - [4096, 3137, 1, 1024, 4096, 4096, 4096, 1024]
    - [7, 19368.0]
  - - [4096, 3506, 1, 1024, 4096, 4096, 4096, 1024]
    - [7, 19820.0]
  - - [1024, 3095, 1, 4096, 1024, 1024, 1024, 4096]
    - [22, 18417.0]
  - - [1024, 3859, 1, 4096, 1024, 1024, 1024, 4096]
    - [23, 19058.0]
  - - [4096, 3369, 1, 1024, 4096, 4096, 4096, 1024]
    - [7, 19806.0]
  - - [1024, 3435, 1, 4096, 1024, 1024, 1024, 4096]
    - [23, 19620.0]
  - - [1024, 3354, 1, 4096, 1024, 1024, 1024, 4096]
    - [23, 19210.0]
  - - [1024, 3055, 1, 4096, 1024, 1024, 1024, 4096]
    - [22, 18210.0]
  - - [4096, 3523, 1, 1024, 4096, 4096, 4096, 1024]
    - [7, 19911.0]
  - - [4096, 3380, 1, 1024, 4096, 4096, 4096, 1024]
    - [7, 19906.0]
  - - [1024, 3233, 1, 4096, 1024, 1024, 1024, 4096]
    - [40, 18615.0]
  - - [4096, 3221, 1, 1024, 4096, 4096, 4096, 1024]
    - [7, 19081.0]
  - - [4096, 3270, 1, 1024, 4096, 4096, 4096, 1024]
    - [7, 19321.0]
  - - [4096, 3593, 1, 1024, 4096, 4096, 4096, 1024]
    - [7, 19584.0]
  - - [1024, 3358, 1, 4096, 1024, 1024, 1024, 4096]
    - [23, 19194.0]
  - - [1024, 3540, 1, 4096, 1024, 1024, 1024, 4096]
    - [22, 17942.0]
  - - [4096, 3502, 1, 1024, 4096, 4096, 4096, 1024]
    - [7, 19809.0]
  - - [4096, 2505, 1, 1024, 4096, 4096, 4096, 1024]
    - [7, 19547.0]
  - - [4096, 3397, 1, 1024, 4096, 4096, 4096, 1024]
    - [7, 19996.0]
  - - [1024, 3300, 1, 4096, 1024, 1024, 1024, 4096]
    - [40, 18947.0]
  - - [4096, 3095, 1, 1024, 4096, 4096, 4096, 1024]
    - [7, 19122.0]
  - - [1024, 3182, 1, 4096, 1024, 1024, 1024, 4096]
    - [40, 18343.0]
  - - [1024, 3299, 1, 4096, 1024, 1024, 1024, 4096]
    - [13, 18996.0]
  - - [1024, 3276, 1, 4096, 1024, 1024, 1024, 4096]
    - [13, 18881.0]
  - - [1024, 3360, 1, 4096, 1024, 1024, 1024, 4096]
    - [23, 19236.0]
  - - [4096, 3360, 1, 1024, 4096, 4096, 4096, 1024]
    - [7, 19765.0]
  - - [4096, 2918, 1, 1024, 4096, 4096, 4096, 1024]
    - [7, 19653.0]
  - - [1024, 3939, 1, 33708, 1024, 1024, 1024, 33708]
    - [7, 19415.0]
  - - [4096, 3314, 1, 1024, 4096, 4096, 4096, 1024]
    - [7, 19514.0]
  - - [1024, 3319, 1, 4096, 1024, 1024, 1024, 4096]
    - [40, 19054.0]
  - - [1024, 3942, 1, 1024, 1024, 1024, 1024, 1024]
    - [7, 18928.0]
  - - [1024, 3465, 1, 4096, 1024, 1024, 1024, 4096]
    - [22, 17574.0]
  - - [4096, 3546, 1, 1024, 4096, 4096, 4096, 1024]
    - [7, 20032.0]
  - - [1024, 3403, 1, 4096, 1024, 1024, 1024, 4096]
    - [23, 19433.0]
  - - [1024, 3948, 1, 1024, 1024, 1024, 1024, 1024]
    - [23, 19011.0]
  - - [4096, 3441, 1, 1024, 4096, 4096, 4096, 1024]
    - [7, 20181.0]
  - - [1024, 3139, 1, 4096, 1024, 1024, 1024, 4096]
    - [40, 18057.0]
  - - [1024, 3563, 1, 4096, 1024, 1024, 1024, 4096]
    - [22, 18059.0]
  - - [1024, 3508, 1, 4096, 1024, 1024, 1024, 4096]
    - [22, 17770.0]
  - - [1024, 3975, 1, 33708, 1024, 1024, 1024, 33708]
    - [14, 18747.0]
  - - [1024, 3446, 1, 4096, 1024, 1024, 1024, 4096]
    - [7, 19636.0]
  - - [1024, 3529, 1, 4096, 1024, 1024, 1024, 4096]
    - [22, 17865.0]
  - - [4096, 3461, 1, 1024, 4096, 4096, 4096, 1024]
    - [7, 19558.0]
  - - [1024, 3574, 1, 4096, 1024, 1024, 1024, 4096]
    - [6, 18057.0]
  - - [1024, 3101, 1, 4096, 1024, 1024, 1024, 4096]
    - [6, 18439.0]
  - - [1024, 3927, 1, 1024, 1024, 1024, 1024, 1024]
    - [23, 18937.0]
  - - [4096, 3224, 1, 1024, 4096, 4096, 4096, 1024]
    - [7, 19035.0]
  - - [4096, 3437, 1, 1024, 4096, 4096, 4096, 1024]
    - [7, 20215.0]
  - - [4096, 3900, 1, 1024, 4096, 4096, 4096, 1024]
    - [7, 19786.0]
  - - [1024, 3495, 1, 4096, 1024, 1024, 1024, 4096]
    - [6, 17703.0]
  - - [1024, 3977, 1, 33708, 1024, 1024, 1024, 33708]
    - [14, 18716.0]
  - - [1024, 3328, 1, 4096, 1024, 1024, 1024, 4096]
    - [13, 19184.0]
  - - [4096, 3168, 1, 1024, 4096, 4096, 4096, 1024]
    - [7, 19514.0]
  - - [1024, 4026, 1, 33708, 1024, 1024, 1024, 33708]
    - [14, 18951.0]
  - - [1024, 3292, 1, 4096, 1024, 1024, 1024, 4096]
    - [40, 18885.0]
  - - [1024, 3294, 1, 4096, 1024, 1024, 1024, 4096]
    - [13, 18957.0]
  - - [4096, 3335, 1, 1024, 4096, 4096, 4096, 1024]
    - [7, 19611.0]
  - - [4096, 3400, 1, 1024, 4096, 4096, 4096, 1024]
    - [7, 20012.0]
  - - [1024, 3287, 1, 4096, 1024, 1024, 1024, 4096]
    - [40, 18868.0]
  - - [1024, 3910, 1, 4096, 1024, 1024, 1024, 4096]
    - [23, 19360.0]
  - - [1024, 3780, 1, 1024, 1024, 1024, 1024, 1024]
    - [23, 18252.0]
  - - [4096, 3098, 1, 1024, 4096, 4096, 4096, 1024]
    - [7, 19126.0]
  - - [1024, 3584, 1, 33708, 1024, 1024, 1024, 33708]
    - [29, 18169.0]
  - - [1024, 3371, 1, 4096, 1024, 1024, 1024, 4096]
    - [7, 19225.0]
  - - [1024, 3546, 1, 4096, 1024, 1024, 1024, 4096]
    - [22, 17972.0]
  - - [1024, 4012, 1, 1024, 1024, 1024, 1024, 1024]
    - [22, 18613.0]
  - - [4096, 3505, 1, 1024, 4096, 4096, 4096, 1024]
    - [7, 19820.0]
  - - [4096, 3554, 1, 1024, 4096, 4096, 4096, 1024]
    - [7, 20112.0]
  - - [4096, 3063, 1, 1024, 4096, 4096, 4096, 1024]
    - [7, 19642.0]
  - - [1024, 3900, 1, 33708, 1024, 1024, 1024, 33708]
    - [1, 19236.0]
  - - [1024, 3345, 1, 4096, 1024, 1024, 1024, 4096]
    - [23, 19061.0]
  - - [1024, 3357, 1, 4096, 1024, 1024, 1024, 4096]
    - [23, 19228.0]
  - - [1024, 3282, 1, 4096, 1024, 1024, 1024, 4096]
    - [28, 18901.0]
  - - [4096, 3484, 1, 1024, 4096, 4096, 4096, 1024]
    - [7, 19685.0]
  - - [1024, 3557, 1, 4096, 1024, 1024, 1024, 4096]
    - [6, 17989.0]
  - - [1024, 3476, 1, 4096, 1024, 1024, 1024, 4096]
    - [22, 17608.0]
  - - [1024, 3751, 1, 1024, 1024, 1024, 1024, 1024]
    - [23, 18067.0]
  - - [4096, 3379, 1, 1024, 4096, 4096, 4096, 1024]
    - [7, 19840.0]
  - - [4096, 3428, 1, 1024, 4096, 4096, 4096, 1024]
    - [7, 20164.0]
  - - [4096, 3126, 1, 1024, 4096, 4096, 4096, 1024]
    - [7, 19287.0]
  - - [1024, 3325, 1, 4096, 1024, 1024, 1024, 4096]
    - [40, 19115.0]
  - - [4096, 3501, 1, 1024, 4096, 4096, 4096, 1024]
    - [7, 19811.0]
  - - [4096, 3358, 1, 1024, 4096, 4096, 4096, 1024]
    - [7, 19748.0]
  - - [1024, 3441, 1, 4096, 1024, 1024, 1024, 4096]
    - [7, 19668.0]
  - - [1024, 3552, 1, 4096, 1024, 1024, 1024, 4096]
    - [22, 18002.0]
  - - [4096, 3232, 1, 1024, 4096, 4096, 4096, 1024]
    - [7, 19110.0]
  - - [1024, 3412, 1, 4096, 1024, 1024, 1024, 4096]
    - [7, 19517.0]
  - - [1024, 3372, 1, 4096, 1024, 1024, 1024, 4096]
    - [23, 19319.0]
  - - [1024, 3585, 1, 4096, 1024, 1024, 1024, 4096]
    - [22, 18148.0]
  - - [4096, 3143, 1, 1024, 4096, 4096, 4096, 1024]
    - [7, 19411.0]
  - - [4096, 3464, 1, 1024, 4096, 4096, 4096, 1024]
    - [7, 19594.0]
  - - [1024, 3145, 1, 4096, 1024, 1024, 1024, 4096]
    - [28, 18143.0]
  - - [4096, 3375, 1, 1024, 4096, 4096, 4096, 1024]
    - [7, 19879.0]
  - - [4096, 2917, 1, 1024, 4096, 4096, 4096, 1024]
    - [7, 19641.0]
  - - [4096, 3978, 1, 1024, 4096, 4096, 4096, 1024]
    - [7, 19533.0]
  - - [1024, 2765, 1, 4096, 1024, 1024, 1024, 4096]
    - [23, 18764.0]
  - - [1024, 3452, 1, 4096, 1024, 1024, 1024, 4096]
    - [23, 19722.0]
  - - [4096, 3584, 1, 1024, 4096, 4096, 4096, 1024]
    - [7, 20336.0]
  - - [4096, 3545, 1, 1024, 4096, 4096, 4096, 1024]
    - [7, 20051.0]
  - - [1024, 3352, 1, 4096, 1024, 1024, 1024, 4096]
    - [23, 19129.0]
  - - [4096, 3292, 1, 1024, 4096, 4096, 4096, 1024]
    - [7, 19429.0]
  - - [1024, 3525, 1, 4096, 1024, 1024, 1024, 4096]
    - [22, 17845.0]
  - - [1024, 3266, 1, 4096, 1024, 1024, 1024, 4096]
    - [13, 18820.0]
  - - [1024, 3382, 1, 4096, 1024, 1024, 1024, 4096]
    - [23, 19341.0]
  - - [4096, 3492, 1, 1024, 4096, 4096, 4096, 1024]
    - [7, 19746.0]
  - - [4096, 3419, 1, 1024, 4096, 4096, 4096, 1024]
    - [7, 20040.0]
  - - [1024, 3796, 1, 33708, 1024, 1024, 1024, 33708]
    - [1, 18779.0]
  - - [1024, 3293, 1, 4096, 1024, 1024, 1024, 4096]
    - [40, 18829.0]
  - - [4096, 3796, 1, 1024, 4096, 4096, 4096, 1024]
    - [7, 19913.0]
  - - [1024, 3487, 1, 4096, 1024, 1024, 1024, 4096]
    - [22, 17655.0]
  - - [4096, 3166, 1, 1024, 4096, 4096, 4096, 1024]
    - [7, 19491.0]
  - - [1024, 3409, 1, 4096, 1024, 1024, 1024, 4096]
    - [23, 19448.0]
  - - [1024, 3520, 1, 4096, 1024, 1024, 1024, 4096]
    - [35, 17860.0]
  - - [1024, 3573, 1, 4096, 1024, 1024, 1024, 4096]
    - [22, 18082.0]
  - - [4096, 3366, 1, 1024, 4096, 4096, 4096, 1024]
    - [7, 19815.0]
  - - [4096, 3720, 1, 1024, 4096, 4096, 4096, 1024]
    - [7, 19577.0]
  - - [4096, 3207, 1, 1024, 4096, 4096, 4096, 1024]
    - [7, 18968.0]
  - - [4096, 3272, 1, 1024, 4096, 4096, 4096, 1024]
    - [7, 19342.0]
  - - [1024, 3390, 1, 4096, 1024, 1024, 1024, 4096]
    - [23, 19395.0]
  - - [4096, 3183, 1, 1024, 4096, 4096, 4096, 1024]
    - [7, 19617.0]
  - - [4096, 3536, 1, 1024, 4096, 4096, 4096, 1024]
    - [7, 20002.0]
  - - [4096, 3563, 1, 1024, 4096, 4096, 4096, 1024]
    - [7, 20111.0]
  - - [1024, 3482, 1, 4096, 1024, 1024, 1024, 4096]
    - [6, 17648.0]
  - - [4096, 3447, 1, 1024, 4096, 4096, 4096, 1024]
    - [7, 20224.0]
  - - [4096, 3955, 1, 1024, 4096, 4096, 4096, 1024]
    - [7, 20031.0]
  - - [4096, 4005, 1, 1024, 4096, 4096, 4096, 1024]
    - [7, 19606.0]
  - - [1024, 3493, 1, 4096, 1024, 1024, 1024, 4096]
    - [6, 17699.0]
  - - [4096, 3410, 1, 1024, 4096, 4096, 4096, 1024]
    - [7, 20041.0]
  - - [1024, 3422, 1, 4096, 1024, 1024, 1024, 4096]
    - [7, 19514.0]
  - - [1024, 3350, 1, 4096, 1024, 1024, 1024, 4096]
    - [7, 19143.0]
  - - [4096, 3300, 1, 1024, 4096, 4096, 4096, 1024]
    - [7, 19461.0]
  - - [4096, 3910, 1, 1024, 4096, 4096, 4096, 1024]
    - [7, 19792.0]
  - - [1024, 3489, 1, 4096, 1024, 1024, 1024, 4096]
    - [22, 17679.0]
  - - [4096, 3483, 1, 1024, 4096, 4096, 4096, 1024]
    - [7, 19666.0]
  - - [4096, 3532, 1, 1024, 4096, 4096, 4096, 1024]
    - [7, 19971.0]
  - - [4096, 3230, 1, 1024, 4096, 4096, 4096, 1024]
    - [7, 19060.0]
  - - [4096, 3427, 1, 1024, 4096, 4096, 4096, 1024]
    - [7, 20164.0]
  - - [1024, 3377, 1, 4096, 1024, 1024, 1024, 4096]
    - [23, 19311.0]
  - - [1024, 3488, 1, 4096, 1024, 1024, 1024, 4096]
    - [22, 17677.0]
  - - [1024, 3616, 1, 4096, 1024, 1024, 1024, 4096]
    - [22, 18269.0]
  - - [1024, 3426, 1, 4096, 1024, 1024, 1024, 4096]
    - [23, 19571.0]
  - - [4096, 3357, 1, 1024, 4096, 4096, 4096, 1024]
    - [7, 19723.0]
  - - [4096, 3406, 1, 1024, 4096, 4096, 4096, 1024]
    - [7, 20004.0]
  - - [1024, 3046, 1, 4096, 1024, 1024, 1024, 4096]
    - [6, 18131.0]
  - - [1024, 3272, 1, 4096, 1024, 1024, 1024, 4096]
    - [40, 18798.0]
  - - [1024, 3256, 1, 4096, 1024, 1024, 1024, 4096]
    - [28, 18754.0]
  - - [4096, 3247, 1, 1024, 4096, 4096, 4096, 1024]
    - [7, 19183.0]
  - - [4096, 3088, 1, 1024, 4096, 4096, 4096, 1024]
    - [7, 19055.0]
  - - [1024, 3531, 1, 4096, 1024, 1024, 1024, 4096]
    - [35, 17863.0]
  - - [4096, 3511, 1, 1024, 4096, 4096, 4096, 1024]
    - [7, 19859.0]
  - - [1024, 3720, 1, 33708, 1024, 1024, 1024, 33708]
    - [1, 18371.0]
  - - [1024, 3267, 1, 4096, 1024, 1024, 1024, 4096]
    - [40, 18731.0]
  - - [1024, 3270, 1, 4096, 1024, 1024, 1024, 4096]
    - [13, 18820.0]
  - - [1024, 3461, 1, 4096, 1024, 1024, 1024, 4096]
    - [22, 17569.0]
  - - [4096, 3474, 1, 1024, 4096, 4096, 4096, 1024]
    - [7, 19639.0]
  - - [4096, 2984, 1, 1024, 4096, 4096, 4096, 1024]
    - [7, 19182.0]
  - - [1024, 3399, 1, 4096, 1024, 1024, 1024, 4096]
    - [23, 19426.0]
  - - [4096, 3574, 1, 1024, 4096, 4096, 4096, 1024]
    - [7, 20157.0]
  - - [1024, 3876, 1, 1024, 1024, 1024, 1024, 1024]
    - [7, 18657.0]
  - - [4096, 3337, 1, 1024, 4096, 4096, 4096, 1024]
    - [7, 19646.0]
  - - [4096, 3450, 1, 1024, 4096, 4096, 4096, 1024]
    - [7, 20294.0]
  - - [1024, 3720, 1, 1024, 1024, 1024, 1024, 1024]
    - [23, 17986.0]
  - - [1024, 4059, 1, 1024, 1024, 1024, 1024, 1024]
    - [22, 17746.0]
  - - [4096, 3291, 1, 1024, 4096, 4096, 4096, 1024]
    - [7, 19414.0]
  - - [4096, 3995, 1, 1024, 4096, 4096, 4096, 1024]
    - [7, 19602.0]
  - - [4096, 3491, 1, 1024, 4096, 4096, 4096, 1024]
    - [7, 19756.0]
  - - [4096, 3348, 1, 1024, 4096, 4096, 4096, 1024]
    - [7, 19717.0]
  - - [4096, 3925, 1, 1024, 4096, 4096, 4096, 1024]
    - [7, 19880.0]
  - - [4096, 3894, 1, 1024, 4096, 4096, 4096, 1024]
    - [7, 19732.0]
  - - [1024, 3456, 1, 4096, 1024, 1024, 1024, 4096]
    - [23, 19762.0]
  - - [1024, 3394, 1, 4096, 1024, 1024, 1024, 4096]
    - [23, 19408.0]
  - - [4096, 3165, 1, 1024, 4096, 4096, 4096, 1024]
    - [7, 19500.0]
  - - [4096, 3470, 1, 1024, 4096, 4096, 4096, 1024]
    - [7, 19651.0]
  - - [1024, 3014, 1, 4096, 1024, 1024, 1024, 4096]
    - [6, 17944.0]
  - - [1024, 3375, 1, 4096, 1024, 1024, 1024, 4096]
    - [23, 19333.0]
  - - [4096, 3859, 1, 1024, 4096, 4096, 4096, 1024]
    - [7, 19539.0]
  - - [4096, 3365, 1, 1024, 4096, 4096, 4096, 1024]
    - [7, 19819.0]
  - - [1024, 3162, 1, 4096, 1024, 1024, 1024, 4096]
    - [28, 18223.0]
  - - [1024, 3840, 1, 33708, 1024, 1024, 1024, 33708]
    - [1, 18979.0]
  - - [1024, 3437, 1, 4096, 1024, 1024, 1024, 4096]
    - [7, 19592.0]
  - - [4096, 3319, 1, 1024, 4096, 4096, 4096, 1024]
    - [7, 19563.0]
  - - [1024, 3320, 1, 4096, 1024, 1024, 1024, 4096]
    - [40, 19050.0]
  - - [4096, 3328, 1, 1024, 4096, 4096, 4096, 1024]
    - [7, 19701.0]
  - - [1024, 3235, 1, 4096, 1024, 1024, 1024, 4096]
    - [40, 18617.0]
  - - [4096, 3282, 1, 1024, 4096, 4096, 4096, 1024]
    - [7, 19362.0]
  - - [1024, 3367, 1, 4096, 1024, 1024, 1024, 4096]
    - [23, 19201.0]
  - - [1024, 3542, 1, 4096, 1024, 1024, 1024, 4096]
    - [22, 17954.0]
  - - [4096, 3145, 1, 1024, 4096, 4096, 4096, 1024]
    - [7, 19412.0]
  - - [4096, 3514, 1, 1024, 4096, 4096, 4096, 1024]
    - [7, 19888.0]
  - - [1024, 3432, 1, 4096, 1024, 1024, 1024, 4096]
    - [23, 19620.0]
  - - [4096, 3409, 1, 1024, 4096, 4096, 4096, 1024]
    - [7, 20053.0]
  - - [1024, 4012, 1, 33708, 1024, 1024, 1024, 33708]
    - [14, 18899.0]
  - - [4096, 3876, 1, 1024, 4096, 4096, 4096, 1024]
    - [7, 19631.0]
  - - [4096, 3299, 1, 1024, 4096, 4096, 4096, 1024]
    - [7, 19456.0]
  - - [1024, 3168, 1, 4096, 1024, 1024, 1024, 4096]
    - [40, 18245.0]
  - - [4096, 3681, 1, 1024, 4096, 4096, 4096, 1024]
    - [7, 20015.0]
  - - [4096, 3531, 1, 1024, 4096, 4096, 4096, 1024]
    - [7, 19919.0]
  - - [4096, 3388, 1, 1024, 4096, 4096, 4096, 1024]
    - [7, 19906.0]
  - - [1024, 3720, 1, 4096, 1024, 1024, 1024, 4096]
    - [7, 18408.0]
  - - [1024, 3332, 1, 4096, 1024, 1024, 1024, 4096]
    - [23, 19071.0]
  - - [1024, 3273, 1, 4096, 1024, 1024, 1024, 4096]
    - [13, 18849.0]
  - - [1024, 2935, 1, 4096, 1024, 1024, 1024, 4096]
    - [6, 17526.0]
  - - [1024, 3467, 1, 4096, 1024, 1024, 1024, 4096]
    - [6, 17572.0]
  - - [4096, 3542, 1, 1024, 4096, 4096, 4096, 1024]
    - [7, 20006.0]
  - - [1024, 3130, 1, 4096, 1024, 1024, 1024, 4096]
    - [22, 18622.0]
  - - [1024, 3405, 1, 4096, 1024, 1024, 1024, 4096]
    - [23, 19483.0]
  - - [1024, 3960, 1, 1024, 1024, 1024, 1024, 1024]
    - [7, 18990.0]
  - - [4096, 3405, 1, 1024, 4096, 4096, 4096, 1024]
    - [7, 20043.0]
  - - [1024, 10080, 1, 1024, 1024, 1024, 1024, 1024]
    - [7, 19663.0]
  - - [36548, 1216, 1, 1024, 36548, 36548, 36548, 1024]
    - [36, 19346.0]
  - - [1024, 2592, 1, 1024, 1024, 1024, 1024, 1024]
    - [36, 17004.0]
  - - [1024, 1568, 1, 1024, 1024, 1024, 1024, 1024]
    - [24, 16548.0]
  - - [1024, 4445, 1, 1024, 1024, 1024, 1024, 1024]
    - [23, 18864.0]
  - - [1024, 6272, 1, 1024, 1024, 1024, 1024, 1024]
    - [23, 19736.0]
  - - [36548, 3584, 1, 1024, 36548, 36548, 36548, 1024]
    - [36, 20609.0]
  - - [1024, 1827, 1, 1024, 1024, 1024, 1024, 1024]
    - [35, 16492.0]
  - - [1024, 3220, 1, 1024, 1024, 1024, 1024, 1024]
    - [23, 17969.0]
  - - [1024, 1856, 1, 1024, 1024, 1024, 1024, 1024]
    - [22, 16853.0]
  - - [1024, 1760, 1, 1024, 1024, 1024, 1024, 1024]
    - [35, 15912.0]
  - - [36548, 4235, 1, 1024, 36548, 36548, 36548, 1024]
    - [36, 20054.0]
  - - [1024, 1984, 1, 1024, 1024, 1024, 1024, 1024]
    - [22, 17925.0]
  - - [1024, 14720, 1, 1024, 1024, 1024, 1024, 1024]
    - [23, 20051.0]
  - - [1024, 1152, 1, 1024, 1024, 1024, 1024, 1024]
    - [24, 17512.0]
  - - [36548, 14976, 1, 1024, 36548, 36548, 36548, 1024]
    - [36, 20678.0]
  - - [36548, 1152, 1, 1024, 36548, 36548, 36548, 1024]
    - [4, 20216.0]
  - - [1024, 3392, 1, 1024, 1024, 1024, 1024, 1024]
    - [7, 18410.0]
  - - [1024, 1408, 1, 1024, 1024, 1024, 1024, 1024]
    - [22, 17292.0]
  - - [1024, 2080, 1, 1024, 1024, 1024, 1024, 1024]
    - [9, 16960.0]
  - - [1024, 1824, 1, 1024, 1024, 1024, 1024, 1024]
    - [22, 16482.0]
  - - [36548, 2432, 1, 1024, 36548, 36548, 36548, 1024]
    - [36, 20484.0]
  - - [36548, 1827, 1, 1024, 36548, 36548, 36548, 1024]
    - [36, 19479.0]
  - - [1024, 10176, 1, 1024, 1024, 1024, 1024, 1024]
    - [23, 19757.0]
  - - [1024, 1952, 1, 1024, 1024, 1024, 1024, 1024]
    - [35, 17533.0]
  - - [1024, 17024, 1, 1024, 1024, 1024, 1024, 1024]
    - [7, 20033.0]
  - - [1024, 1472, 1, 1024, 1024, 1024, 1024, 1024]
    - [24, 15500.0]
  - - [36548, 4459, 1, 1024, 36548, 36548, 36548, 1024]
    - [36, 20490.0]
  - - [1024, 3712, 1, 1024, 1024, 1024, 1024, 1024]
    - [35, 18517.0]
  - - [36548, 12928, 1, 1024, 36548, 36548, 36548, 1024]
    - [36, 20667.0]
  - - [1024, 1632, 1, 1024, 1024, 1024, 1024, 1024]
    - [24, 16907.0]
  - - [1024, 1696, 1, 1024, 1024, 1024, 1024, 1024]
    - [22, 17531.0]
  - - [36548, 1764, 1, 1024, 36548, 36548, 36548, 1024]
    - [36, 20092.0]
  - - [1024, 2944, 1, 1024, 1024, 1024, 1024, 1024]
    - [35, 17372.0]
  - - [36548, 14080, 1, 1024, 36548, 36548, 36548, 1024]
    - [36, 20670.0]
  - - [1024, 1280, 1, 1024, 1024, 1024, 1024, 1024]
    - [6, 15702.0]
  - - [1024, 13440, 1, 1024, 1024, 1024, 1024, 1024]
    - [23, 19772.0]
  - - [36548, 9120, 1, 1024, 36548, 36548, 36548, 1024]
    - [36, 20458.0]
  - - [1024, 3008, 1, 1024, 1024, 1024, 1024, 1024]
    - [6, 17708.0]
  - - [1024, 2560, 1, 1024, 1024, 1024, 1024, 1024]
    - [35, 18064.0]
  - - [1024, 2208, 1, 1024, 1024, 1024, 1024, 1024]
    - [7, 17909.0]
  - - [1024, 1920, 1, 1024, 1024, 1024, 1024, 1024]
    - [22, 17422.0]
  - - [36548, 2496, 1, 1024, 36548, 36548, 36548, 1024]
    - [36, 20040.0]
  - - [1024, 2016, 1, 1024, 1024, 1024, 1024, 1024]
    - [23, 16269.0]
  - - [1024, 1184, 1, 1024, 1024, 1024, 1024, 1024]
    - [6, 14463.0]
  - - [1024, 1664, 1, 1024, 1024, 1024, 1024, 1024]
    - [8, 17596.0]
  - - [1024, 11424, 1, 1024, 1024, 1024, 1024, 1024]
    - [23, 20071.0]
  - - [1024, 1216, 1, 1024, 1024, 1024, 1024, 1024]
    - [6, 15065.0]
  - - [36548, 3185, 1, 1024, 36548, 36548, 36548, 1024]
    - [36, 20475.0]
  - - [36548, 9216, 1, 1024, 36548, 36548, 36548, 1024]
    - [36, 20669.0]
  - - [1024, 3200, 1, 1024, 1024, 1024, 1024, 1024]
    - [7, 17886.0]
  - - [1024, 2656, 1, 1024, 1024, 1024, 1024, 1024]
    - [36, 17365.0]
  - - [1024, 2368, 1, 1024, 1024, 1024, 1024, 1024]
    - [22, 16873.0]
  - - [1024, 4459, 1, 1024, 1024, 1024, 1024, 1024]
    - [7, 18946.0]
  - - [1024, 3808, 1, 1024, 1024, 1024, 1024, 1024]
    - [23, 18377.0]
  - - [1024, 2336, 1, 1024, 1024, 1024, 1024, 1024]
    - [35, 16484.0]
  - - [1024, 2304, 1, 1024, 1024, 1024, 1024, 1024]
    - [28, 18945.0]
  - - [1024, 1560, 1, 1024, 1024, 1024, 1024, 1024]
    - [24, 16480.0]
  - - [1024, 2496, 1, 1024, 1024, 1024, 1024, 1024]
    - [35, 17639.0]
  - - [1024, 1504, 1, 1024, 1024, 1024, 1024, 1024]
    - [24, 15799.0]
  - - [1024, 3232, 1, 1024, 1024, 1024, 1024, 1024]
    - [23, 18040.0]
  - - [36548, 1015, 1, 1024, 36548, 36548, 36548, 1024]
    - [36, 20147.0]
  - - [1024, 2000, 1, 1024, 1024, 1024, 1024, 1024]
    - [23, 16167.0]
  - - [36548, 243, 1, 1024, 36548, 36548, 36548, 1024]
    - [11, 18577.0]
  - - [1024, 13184, 1, 1024, 1024, 1024, 1024, 1024]
    - [23, 20194.0]
  - - [1024, 2688, 1, 1024, 1024, 1024, 1024, 1024]
    - [7, 17810.0]
  - - [36548, 950, 1, 1024, 36548, 36548, 36548, 1024]
    - [29, 19014.0]
  - - [1024, 1764, 1, 1024, 1024, 1024, 1024, 1024]
    - [35, 15883.0]
  - - [1024, 1376, 1, 1024, 1024, 1024, 1024, 1024]
    - [6, 16769.0]
  - - [36548, 774, 1, 1024, 36548, 36548, 36548, 1024]
    - [29, 17865.0]
  - - [1024, 4256, 1, 1024, 1024, 1024, 1024, 1024]
    - [35, 18418.0]
  - - [36548, 3712, 1, 1024, 36548, 36548, 36548, 1024]
    - [36, 20576.0]
  - - [1024, 3360, 1, 1024, 1024, 1024, 1024, 1024]
    - [7, 18240.0]
  - - [1024, 2784, 1, 1024, 1024, 1024, 1024, 1024]
    - [23, 18250.0]
  - - [1024, 4992, 1, 1024, 1024, 1024, 1024, 1024]
    - [23, 19084.0]
  - - [36548, 1102, 1, 1024, 36548, 36548, 36548, 1024]
    - [36, 19437.0]
  - - [1024, 1536, 1, 1024, 1024, 1024, 1024, 1024]
    - [8, 16203.0]
  - - [1024, 2720, 1, 1024, 1024, 1024, 1024, 1024]
    - [36, 17799.0]
  - - [1024, 2752, 1, 1024, 1024, 1024, 1024, 1024]
    - [23, 18090.0]
  - - [1024, 2816, 1, 1024, 1024, 1024, 1024, 1024]
    - [23, 18592.0]
  - - [1024, 2624, 1, 1024, 1024, 1024, 1024, 1024]
    - [23, 17303.0]
  - - [1024, 2144, 1, 1024, 1024, 1024, 1024, 1024]
    - [25, 17411.0]
  - - [36548, 1131, 1, 1024, 36548, 36548, 36548, 1024]
    - [19, 19890.0]
  - - [1024, 3296, 1, 1024, 1024, 1024, 1024, 1024]
    - [23, 17957.0]
  - - [36548, 4992, 1, 1024, 36548, 36548, 36548, 1024]
    - [36, 20635.0]
  - - [1024, 1344, 1, 1024, 1024, 1024, 1024, 1024]
    - [22, 16372.0]
  - - [36548, 2401, 1, 1024, 36548, 36548, 36548, 1024]
    - [36, 20206.0]
  - - [1024, 15744, 1, 1024, 1024, 1024, 1024, 1024]
    - [36, 19885.0]
  - - [1024, 15232, 1, 1024, 1024, 1024, 1024, 1024]
    - [23, 20038.0]
  - - [1024, 1888, 1, 1024, 1024, 1024, 1024, 1024]
    - [35, 16990.0]
  - - [1024, 1792, 1, 1024, 1024, 1024, 1024, 1024]
    - [22, 16334.0]
  - - [36548, 1073, 1, 1024, 36548, 36548, 36548, 1024]
    - [36, 18981.0]
  - - [36548, 15488, 1, 1024, 36548, 36548, 36548, 1024]
    - [36, 20665.0]
  - - [1024, 2464, 1, 1024, 1024, 1024, 1024, 1024]
    - [35, 17366.0]
  - - [1024, 2272, 1, 1024, 1024, 1024, 1024, 1024]
    - [23, 18348.0]
  - - [1024, 2432, 1, 1024, 1024, 1024, 1024, 1024]
    - [35, 17224.0]
  - - [1024, 3936, 1, 1024, 1024, 1024, 1024, 1024]
    - [7, 18970.0]
  - - [36548, 13824, 1, 1024, 36548, 36548, 36548, 1024]
    - [36, 20679.0]
  - - [1024, 2401, 1, 1024, 1024, 1024, 1024, 1024]
    - [35, 16931.0]
  - - [1024, 2176, 1, 1024, 1024, 1024, 1024, 1024]
    - [23, 17868.0]
  - - [1024, 2240, 1, 1024, 1024, 1024, 1024, 1024]
    - [7, 18129.0]
  - - [1024, 1728, 1, 1024, 1024, 1024, 1024, 1024]
    - [22, 17990.0]
  - - [1024, 2528, 1, 1024, 1024, 1024, 1024, 1024]
    - [35, 17822.0]
  - - [1024, 2400, 1, 1024, 1024, 1024, 1024, 1024]
    - [35, 16995.0]
  - - [1024, 1440, 1, 1024, 1024, 1024, 1024, 1024]
    - [24, 15274.0]
  - - [1024, 2912, 1, 1024, 1024, 1024, 1024, 1024]
    - [22, 17133.0]
  - - [1024, 2880, 1, 1024, 1024, 1024, 1024, 1024]
    - [22, 18500.0]
  - - [1024, 4064, 1, 1024, 1024, 1024, 1024, 1024]
    - [35, 17763.0]
  - - [1024, 4655, 1, 1024, 1024, 1024, 1024, 1024]
    - [22, 17929.0]
  - - [36548, 6272, 1, 1024, 36548, 36548, 36548, 1024]
    - [36, 20650.0]
  - - [768, 2048, 1, 3072, 768, 768, 768, 3072]
    - [8, 16637.0]
  - - [768, 4096, 1, 3072, 768, 768, 768, 3072]
    - [22, 18282.0]
  - - [6272, 256, 1, 528, 6272, 6272, 6272, 528]
    - [16, 16545.0]
  - - [3136, 2048, 1, 1024, 3136, 3136, 3136, 1024]
    - [23, 18266.0]
  - - [50176, 128, 1, 256, 50176, 50176, 50176, 256]
    - [36, 19100.0]
  - - [12544, 1024, 1, 256, 12544, 12544, 12544, 256]
    - [30, 19702.0]
  - - [12544, 256, 1, 1024, 12544, 12544, 12544, 1024]
    - [0, 18538.0]
  - - [3136, 512, 1, 1024, 3136, 3136, 3136, 1024]
    - [8, 16594.0]
  - - [3136, 2048, 1, 512, 3136, 3136, 3136, 512]
    - [23, 18052.0]
  - - [289, 384, 32, 1024, 289, 289, 289, 1024]
    - [23, 14617.0]
  - - [4096, 512, 1, 4096, 4096, 4096, 4096, 4096]
    - [21, 17563.0]
  - - [50176, 512, 1, 256, 50176, 50176, 50176, 256]
    - [1, 19939.0]
  - - [12544, 1024, 1, 512, 12544, 12544, 12544, 512]
    - [1, 19995.0]
  - - [12544, 256, 1, 512, 12544, 12544, 12544, 512]
    - [14, 18334.0]
  - - [784, 128, 32, 256, 784, 784, 784, 256]
    - [22, 15034.0]
  - - [4096, 512, 1, 9216, 4096, 4096, 4096, 9216]
    - [21, 17707.0]
  - - [3136, 512, 1, 2048, 3136, 3136, 3136, 2048]
    - [16, 16798.0]
  - - [1225, 192, 32, 384, 1225, 1225, 1225, 384]
    - [29, 17898.0]
  - - [8192, 320, 1, 1280, 8192, 8192, 8192, 1280]
    - [14, 18234.0]
  - - [8192, 320, 1, 2048, 8192, 8192, 8192, 2048]
    - [0, 18276.0]
  - - [8192, 384, 1, 1280, 8192, 8192, 8192, 1280]
    - [0, 18197.0]
  - - [8192, 384, 1, 2048, 8192, 8192, 8192, 2048]
    - [0, 18254.0]
  - - [8192, 448, 1, 2048, 8192, 8192, 8192, 2048]
    - [14, 18134.0]
  - - [8192, 448, 1, 1280, 8192, 8192, 8192, 1280]
    - [14, 18075.0]
  - - [256, 6400, 1, 4096, 256, 256, 256, 4096]
    - [23, 17244.0]
  - - [512, 3433, 1, 2048, 512, 512, 512, 2048]
    - [37, 18323.0]
  - - [512, 3439, 1, 2048, 512, 512, 512, 2048]
    - [24, 18363.0]
  - - [512, 3461, 1, 2048, 512, 512, 512, 2048]
    - [35, 15935.0]
  - - [512, 3479, 1, 2048, 512, 512, 512, 2048]
    - [22, 16015.0]
  - - [512, 3494, 1, 2048, 512, 512, 512, 2048]
    - [6, 16060.0]
  - - [512, 3520, 1, 2048, 512, 512, 512, 2048]
    - [6, 16227.0]
  - - [512, 3530, 1, 2048, 512, 512, 512, 2048]
    - [22, 16239.0]
  - - [512, 3541, 1, 2048, 512, 512, 512, 2048]
    - [35, 16257.0]
  - - [512, 3564, 1, 2048, 512, 512, 512, 2048]
    - [22, 16364.0]
  - - [512, 3776, 1, 2048, 512, 512, 512, 2048]
    - [35, 17346.0]
  - - [512, 3859, 1, 512, 512, 512, 512, 512]
    - [6, 16866.0]
  - - [512, 3925, 1, 2048, 512, 512, 512, 2048]
    - [35, 17944.0]
  - - [512, 3944, 1, 2048, 512, 512, 512, 2048]
    - [6, 18048.0]
  - - [512, 3955, 1, 2048, 512, 512, 512, 2048]
    - [22, 18075.0]
  - - [512, 3969, 1, 2048, 512, 512, 512, 2048]
    - [13, 16750.0]
  - - [512, 3976, 1, 2048, 512, 512, 512, 2048]
    - [13, 16783.0]
  - - [2048, 1232, 1, 512, 2048, 2048, 2048, 512]
    - [29, 17138.0]
  - - [2048, 3165, 1, 512, 2048, 2048, 2048, 512]
    - [29, 18151.0]
  - - [512, 2387, 1, 512, 512, 512, 512, 512]
    - [35, 14254.0]
  - - [512, 2418, 1, 512, 512, 512, 512, 512]
    - [35, 14347.0]
  - - [512, 2418, 1, 2048, 512, 512, 512, 2048]
    - [35, 15121.0]
  - - [512, 2496, 1, 512, 512, 512, 512, 512]
    - [35, 15160.0]
  - - [512, 2496, 1, 2048, 512, 512, 512, 2048]
    - [6, 15661.0]
  - - [512, 2790, 1, 2048, 512, 512, 512, 2048]
    - [6, 17352.0]
  - - [512, 2864, 1, 2048, 512, 512, 512, 2048]
    - [8, 15455.0]
  - - [512, 3092, 1, 2048, 512, 512, 512, 2048]
    - [8, 16642.0]
  - - [512, 3113, 1, 2048, 512, 512, 512, 2048]
    - [37, 16758.0]
  - - [512, 3137, 1, 2048, 512, 512, 512, 2048]
    - [37, 16844.0]
  - - [512, 3165, 1, 2048, 512, 512, 512, 2048]
    - [24, 16993.0]
  - - [512, 3166, 1, 2048, 512, 512, 512, 2048]
    - [24, 17035.0]
  - - [512, 3194, 1, 2048, 512, 512, 512, 2048]
    - [8, 17143.0]
  - - [512, 3219, 1, 2048, 512, 512, 512, 2048]
    - [8, 17306.0]
  - - [512, 3222, 1, 2048, 512, 512, 512, 2048]
    - [24, 17287.0]
  - - [512, 3234, 1, 2048, 512, 512, 512, 2048]
    - [36, 17339.0]
  - - [512, 3237, 1, 2048, 512, 512, 512, 2048]
    - [8, 17390.0]
  - - [512, 3242, 1, 2048, 512, 512, 512, 2048]
    - [37, 17412.0]
  - - [512, 3246, 1, 2048, 512, 512, 512, 2048]
    - [24, 17417.0]
  - - [512, 3249, 1, 2048, 512, 512, 512, 2048]
    - [24, 17446.0]
  - - [512, 3251, 1, 2048, 512, 512, 512, 2048]
    - [24, 17457.0]
  - - [512, 3257, 1, 2048, 512, 512, 512, 2048]
    - [23, 17462.0]
  - - [512, 3262, 1, 2048, 512, 512, 512, 2048]
    - [8, 17512.0]
  - - [512, 3268, 1, 2048, 512, 512, 512, 2048]
    - [8, 17537.0]
  - - [512, 3282, 1, 2048, 512, 512, 512, 2048]
    - [24, 17605.0]
  - - [512, 3286, 1, 2048, 512, 512, 512, 2048]
    - [8, 17616.0]
  - - [512, 3287, 1, 2048, 512, 512, 512, 2048]
    - [8, 17625.0]
  - - [512, 3293, 1, 2048, 512, 512, 512, 2048]
    - [8, 17653.0]
  - - [512, 3297, 1, 2048, 512, 512, 512, 2048]
    - [24, 17658.0]
  - - [512, 3307, 1, 2048, 512, 512, 512, 2048]
    - [37, 17719.0]
  - - [512, 3314, 1, 2048, 512, 512, 512, 2048]
    - [37, 17728.0]
  - - [512, 3315, 1, 2048, 512, 512, 512, 2048]
    - [8, 17760.0]
  - - [512, 3319, 1, 2048, 512, 512, 512, 2048]
    - [8, 17724.0]
  - - [512, 3322, 1, 2048, 512, 512, 512, 2048]
    - [37, 17756.0]
  - - [512, 3323, 1, 2048, 512, 512, 512, 2048]
    - [36, 17750.0]
  - - [512, 3324, 1, 2048, 512, 512, 512, 2048]
    - [23, 17776.0]
  - - [512, 3325, 1, 2048, 512, 512, 512, 2048]
    - [24, 17799.0]
  - - [512, 3327, 1, 2048, 512, 512, 512, 2048]
    - [8, 17788.0]
  - - [512, 3329, 1, 2048, 512, 512, 512, 2048]
    - [37, 17852.0]
  - - [512, 3332, 1, 2048, 512, 512, 512, 2048]
    - [24, 17864.0]
  - - [512, 3336, 1, 2048, 512, 512, 512, 2048]
    - [8, 17860.0]
  - - [512, 3339, 1, 2048, 512, 512, 512, 2048]
    - [37, 17891.0]
  - - [512, 3342, 1, 2048, 512, 512, 512, 2048]
    - [8, 17919.0]
  - - [512, 3344, 1, 2048, 512, 512, 512, 2048]
    - [8, 17912.0]
  - - [512, 3358, 1, 2048, 512, 512, 512, 2048]
    - [8, 17970.0]
  - - [512, 3360, 1, 2048, 512, 512, 512, 2048]
    - [37, 17998.0]
  - - [512, 3364, 1, 2048, 512, 512, 512, 2048]
    - [8, 17997.0]
  - - [512, 3365, 1, 2048, 512, 512, 512, 2048]
    - [37, 18021.0]
  - - [512, 3369, 1, 2048, 512, 512, 512, 2048]
    - [24, 18031.0]
  - - [512, 3370, 1, 2048, 512, 512, 512, 2048]
    - [8, 18048.0]
  - - [512, 3371, 1, 2048, 512, 512, 512, 2048]
    - [37, 18033.0]
  - - [512, 3374, 1, 2048, 512, 512, 512, 2048]
    - [8, 18078.0]
  - - [512, 3376, 1, 2048, 512, 512, 512, 2048]
    - [37, 18076.0]
  - - [512, 3377, 1, 2048, 512, 512, 512, 2048]
    - [8, 18074.0]
  - - [512, 3378, 1, 2048, 512, 512, 512, 2048]
    - [37, 18088.0]
  - - [512, 3381, 1, 2048, 512, 512, 512, 2048]
    - [37, 18105.0]
  - - [512, 3382, 1, 2048, 512, 512, 512, 2048]
    - [8, 18138.0]
  - - [512, 3383, 1, 2048, 512, 512, 512, 2048]
    - [24, 18121.0]
  - - [512, 3384, 1, 2048, 512, 512, 512, 2048]
    - [37, 18106.0]
  - - [512, 3385, 1, 2048, 512, 512, 512, 2048]
    - [8, 18111.0]
  - - [512, 3386, 1, 2048, 512, 512, 512, 2048]
    - [8, 18128.0]
  - - [512, 3388, 1, 2048, 512, 512, 512, 2048]
    - [24, 18142.0]
  - - [512, 3390, 1, 2048, 512, 512, 512, 2048]
    - [8, 18129.0]
  - - [512, 3391, 1, 2048, 512, 512, 512, 2048]
    - [8, 18112.0]
  - - [512, 3396, 1, 2048, 512, 512, 512, 2048]
    - [37, 18207.0]
  - - [512, 3399, 1, 2048, 512, 512, 512, 2048]
    - [24, 18182.0]
  - - [512, 3402, 1, 2048, 512, 512, 512, 2048]
    - [24, 18230.0]
  - - [512, 3410, 1, 2048, 512, 512, 512, 2048]
    - [24, 18215.0]
  - - [512, 3412, 1, 2048, 512, 512, 512, 2048]
    - [37, 18211.0]
  - - [512, 3414, 1, 2048, 512, 512, 512, 2048]
    - [37, 18261.0]
  - - [512, 3415, 1, 2048, 512, 512, 512, 2048]
    - [37, 18288.0]
  - - [512, 3418, 1, 2048, 512, 512, 512, 2048]
    - [24, 18260.0]
  - - [512, 3420, 1, 2048, 512, 512, 512, 2048]
    - [24, 18287.0]
  - - [512, 3422, 1, 2048, 512, 512, 512, 2048]
    - [24, 18311.0]
  - - [512, 3425, 1, 2048, 512, 512, 512, 2048]
    - [24, 18308.0]
  - - [512, 3426, 1, 2048, 512, 512, 512, 2048]
    - [37, 18312.0]
  - - [512, 3427, 1, 2048, 512, 512, 512, 2048]
    - [37, 18306.0]
  - - [512, 3428, 1, 2048, 512, 512, 512, 2048]
    - [8, 18296.0]
  - - [512, 3430, 1, 2048, 512, 512, 512, 2048]
    - [8, 18287.0]
  - - [512, 3431, 1, 2048, 512, 512, 512, 2048]
    - [24, 18354.0]
  - - [512, 3432, 1, 2048, 512, 512, 512, 2048]
    - [8, 18387.0]
  - - [512, 3438, 1, 2048, 512, 512, 512, 2048]
    - [24, 18370.0]
  - - [512, 3440, 1, 2048, 512, 512, 512, 2048]
    - [24, 18353.0]
  - - [512, 3443, 1, 2048, 512, 512, 512, 2048]
    - [37, 18427.0]
  - - [512, 3445, 1, 2048, 512, 512, 512, 2048]
    - [24, 18382.0]
  - - [512, 3447, 1, 2048, 512, 512, 512, 2048]
    - [8, 18351.0]
  - - [512, 3448, 1, 2048, 512, 512, 512, 2048]
    - [37, 18329.0]
  - - [512, 3450, 1, 2048, 512, 512, 512, 2048]
    - [24, 18393.0]
  - - [512, 3451, 1, 2048, 512, 512, 512, 2048]
    - [8, 18423.0]
  - - [512, 3452, 1, 2048, 512, 512, 512, 2048]
    - [8, 18333.0]
  - - [512, 3453, 1, 2048, 512, 512, 512, 2048]
    - [37, 18464.0]
  - - [512, 3455, 1, 2048, 512, 512, 512, 2048]
    - [24, 18439.0]
  - - [512, 3456, 1, 2048, 512, 512, 512, 2048]
    - [37, 18465.0]
  - - [512, 3457, 1, 2048, 512, 512, 512, 2048]
    - [22, 15935.0]
  - - [512, 3458, 1, 2048, 512, 512, 512, 2048]
    - [22, 15938.0]
  - - [512, 3459, 1, 2048, 512, 512, 512, 2048]
    - [35, 15926.0]
  - - [512, 3460, 1, 2048, 512, 512, 512, 2048]
    - [35, 15943.0]
  - - [512, 3462, 1, 2048, 512, 512, 512, 2048]
    - [6, 15941.0]
  - - [512, 3466, 1, 2048, 512, 512, 512, 2048]
    - [22, 16005.0]
  - - [512, 3467, 1, 2048, 512, 512, 512, 2048]
    - [6, 15980.0]
  - - [512, 3468, 1, 2048, 512, 512, 512, 2048]
    - [35, 16007.0]
  - - [512, 3470, 1, 2048, 512, 512, 512, 2048]
    - [35, 15963.0]
  - - [512, 3471, 1, 2048, 512, 512, 512, 2048]
    - [22, 16120.0]
  - - [512, 3472, 1, 2048, 512, 512, 512, 2048]
    - [22, 15997.0]
  - - [512, 3475, 1, 2048, 512, 512, 512, 2048]
    - [6, 15980.0]
  - - [512, 3476, 1, 2048, 512, 512, 512, 2048]
    - [22, 16013.0]
  - - [512, 3477, 1, 2048, 512, 512, 512, 2048]
    - [6, 16107.0]
  - - [512, 3478, 1, 2048, 512, 512, 512, 2048]
    - [35, 15993.0]
  - - [512, 3480, 1, 2048, 512, 512, 512, 2048]
    - [22, 16031.0]
  - - [512, 3481, 1, 2048, 512, 512, 512, 2048]
    - [35, 16023.0]
  - - [512, 3483, 1, 2048, 512, 512, 512, 2048]
    - [35, 16039.0]
  - - [512, 3484, 1, 2048, 512, 512, 512, 2048]
    - [6, 16034.0]
  - - [512, 3487, 1, 2048, 512, 512, 512, 2048]
    - [22, 16059.0]
  - - [512, 3489, 1, 2048, 512, 512, 512, 2048]
    - [22, 16050.0]
  - - [512, 3490, 1, 2048, 512, 512, 512, 2048]
    - [6, 16070.0]
  - - [512, 3491, 1, 2048, 512, 512, 512, 2048]
    - [22, 16059.0]
  - - [512, 3493, 1, 2048, 512, 512, 512, 2048]
    - [22, 16035.0]
  - - [512, 3495, 1, 2048, 512, 512, 512, 2048]
    - [22, 16045.0]
  - - [512, 3497, 1, 2048, 512, 512, 512, 2048]
    - [22, 16088.0]
  - - [512, 3498, 1, 2048, 512, 512, 512, 2048]
    - [6, 16093.0]
  - - [512, 3499, 1, 2048, 512, 512, 512, 2048]
    - [22, 16109.0]
  - - [512, 3501, 1, 2048, 512, 512, 512, 2048]
    - [35, 16149.0]
  - - [512, 3503, 1, 2048, 512, 512, 512, 2048]
    - [35, 16149.0]
  - - [512, 3505, 1, 2048, 512, 512, 512, 2048]
    - [6, 16103.0]
  - - [512, 3507, 1, 2048, 512, 512, 512, 2048]
    - [35, 16150.0]
  - - [512, 3508, 1, 2048, 512, 512, 512, 2048]
    - [35, 16121.0]
  - - [512, 3509, 1, 2048, 512, 512, 512, 2048]
    - [22, 16182.0]
  - - [512, 3510, 1, 2048, 512, 512, 512, 2048]
    - [35, 16169.0]
  - - [512, 3511, 1, 2048, 512, 512, 512, 2048]
    - [6, 16150.0]
  - - [512, 3513, 1, 2048, 512, 512, 512, 2048]
    - [6, 16135.0]
  - - [512, 3514, 1, 2048, 512, 512, 512, 2048]
    - [35, 16097.0]
  - - [512, 3515, 1, 2048, 512, 512, 512, 2048]
    - [6, 16168.0]
  - - [512, 3517, 1, 2048, 512, 512, 512, 2048]
    - [6, 16162.0]
  - - [512, 3518, 1, 2048, 512, 512, 512, 2048]
    - [6, 16164.0]
  - - [512, 3519, 1, 2048, 512, 512, 512, 2048]
    - [6, 16136.0]
  - - [512, 3523, 1, 2048, 512, 512, 512, 2048]
    - [6, 16228.0]
  - - [512, 3528, 1, 2048, 512, 512, 512, 2048]
    - [6, 16222.0]
  - - [512, 3529, 1, 2048, 512, 512, 512, 2048]
    - [22, 16206.0]
  - - [512, 3531, 1, 2048, 512, 512, 512, 2048]
    - [22, 16205.0]
  - - [512, 3532, 1, 2048, 512, 512, 512, 2048]
    - [22, 16229.0]
  - - [512, 3533, 1, 2048, 512, 512, 512, 2048]
    - [22, 16254.0]
  - - [512, 3534, 1, 2048, 512, 512, 512, 2048]
    - [22, 16223.0]
  - - [512, 3538, 1, 2048, 512, 512, 512, 2048]
    - [22, 16260.0]
  - - [512, 3539, 1, 2048, 512, 512, 512, 2048]
    - [6, 16255.0]
  - - [512, 3540, 1, 2048, 512, 512, 512, 2048]
    - [22, 16252.0]
  - - [512, 3547, 1, 2048, 512, 512, 512, 2048]
    - [22, 16301.0]
  - - [512, 3548, 1, 2048, 512, 512, 512, 2048]
    - [22, 16300.0]
  - - [512, 3552, 1, 2048, 512, 512, 512, 2048]
    - [22, 16318.0]
  - - [512, 3575, 1, 2048, 512, 512, 512, 2048]
    - [6, 16404.0]
  - - [512, 3598, 1, 2048, 512, 512, 512, 2048]
    - [22, 16534.0]
  - - [512, 3599, 1, 2048, 512, 512, 512, 2048]
    - [22, 16517.0]
  - - [512, 3608, 1, 2048, 512, 512, 512, 2048]
    - [22, 16577.0]
  - - [512, 3776, 1, 512, 512, 512, 512, 512]
    - [35, 16863.0]
  - - [512, 3780, 1, 512, 512, 512, 512, 512]
    - [6, 16587.0]
  - - [512, 3780, 1, 2048, 512, 512, 512, 2048]
    - [6, 17333.0]
  - - [512, 3780, 1, 33708, 512, 512, 512, 33708]
    - [0, 17480.0]
  - - [512, 3796, 1, 512, 512, 512, 512, 512]
    - [22, 15988.0]
  - - [512, 3796, 1, 2048, 512, 512, 512, 2048]
    - [22, 17417.0]
  - - [512, 3796, 1, 33708, 512, 512, 512, 33708]
    - [0, 17531.0]
  - - [512, 3822, 1, 512, 512, 512, 512, 512]
    - [35, 16186.0]
  - - [512, 3822, 1, 2048, 512, 512, 512, 2048]
    - [6, 17449.0]
  - - [512, 3822, 1, 33708, 512, 512, 512, 33708]
    - [14, 17646.0]
  - - [512, 3835, 1, 512, 512, 512, 512, 512]
    - [35, 16283.0]
  - - [512, 3835, 1, 2048, 512, 512, 512, 2048]
    - [22, 17522.0]
  - - [512, 3840, 1, 512, 512, 512, 512, 512]
    - [22, 17131.0]
  - - [512, 3840, 1, 2048, 512, 512, 512, 2048]
    - [22, 17597.0]
  - - [512, 3840, 1, 33708, 512, 512, 512, 33708]
    - [29, 17723.0]
  - - [512, 3859, 1, 2048, 512, 512, 512, 2048]
    - [22, 17610.0]
  - - [512, 3859, 1, 33708, 512, 512, 512, 33708]
    - [22, 17792.0]
  - - [512, 3864, 1, 512, 512, 512, 512, 512]
    - [35, 16369.0]
  - - [512, 3864, 1, 2048, 512, 512, 512, 2048]
    - [35, 17693.0]
  - - [512, 3870, 1, 512, 512, 512, 512, 512]
    - [35, 16953.0]
  - - [512, 3870, 1, 2048, 512, 512, 512, 2048]
    - [35, 17703.0]
  - - [512, 3870, 1, 33708, 512, 512, 512, 33708]
    - [14, 17814.0]
  - - [512, 3876, 1, 512, 512, 512, 512, 512]
    - [6, 16372.0]
  - - [512, 3876, 1, 2048, 512, 512, 512, 2048]
    - [6, 17723.0]
  - - [512, 3876, 1, 33708, 512, 512, 512, 33708]
    - [29, 17836.0]
  - - [512, 3906, 1, 512, 512, 512, 512, 512]
    - [35, 16563.0]
  - - [512, 3906, 1, 2048, 512, 512, 512, 2048]
    - [22, 17887.0]
  - - [512, 3906, 1, 33708, 512, 512, 512, 33708]
    - [0, 18023.0]
  - - [512, 3910, 1, 512, 512, 512, 512, 512]
    - [35, 16650.0]
  - - [512, 3910, 1, 2048, 512, 512, 512, 2048]
    - [35, 17899.0]
  - - [512, 3910, 1, 33708, 512, 512, 512, 33708]
    - [0, 18001.0]
  - - [512, 3925, 1, 512, 512, 512, 512, 512]
    - [35, 16595.0]
  - - [512, 3925, 1, 33708, 512, 512, 512, 33708]
    - [29, 18044.0]
  - - [512, 3927, 1, 512, 512, 512, 512, 512]
    - [22, 16647.0]
  - - [512, 3942, 1, 512, 512, 512, 512, 512]
    - [35, 17304.0]
  - - [512, 3942, 1, 2048, 512, 512, 512, 2048]
    - [6, 18038.0]
  - - [512, 3942, 1, 33708, 512, 512, 512, 33708]
    - [29, 18138.0]
  - - [512, 3944, 1, 512, 512, 512, 512, 512]
    - [35, 16708.0]
  - - [512, 3944, 1, 33708, 512, 512, 512, 33708]
    - [14, 18136.0]
  - - [512, 3955, 1, 512, 512, 512, 512, 512]
    - [22, 16755.0]
  - - [512, 3955, 1, 33708, 512, 512, 512, 33708]
    - [14, 18201.0]
  - - [512, 3968, 1, 512, 512, 512, 512, 512]
    - [35, 17547.0]
  - - [512, 3968, 1, 2048, 512, 512, 512, 2048]
    - [35, 18184.0]
  - - [512, 3968, 1, 33708, 512, 512, 512, 33708]
    - [0, 18262.0]
  - - [512, 3969, 1, 512, 512, 512, 512, 512]
    - [22, 15580.0]
  - - [512, 3969, 1, 33708, 512, 512, 512, 33708]
    - [34, 17246.0]
  - - [512, 3976, 1, 512, 512, 512, 512, 512]
    - [22, 15519.0]
  - - [512, 3976, 1, 33708, 512, 512, 512, 33708]
    - [5, 17274.0]
  - - [512, 3977, 1, 512, 512, 512, 512, 512]
    - [6, 15441.0]
  - - [512, 3977, 1, 2048, 512, 512, 512, 2048]
    - [40, 16765.0]
  - - [512, 3977, 1, 33708, 512, 512, 512, 33708]
    - [21, 17293.0]
  - - [512, 3978, 1, 512, 512, 512, 512, 512]
    - [22, 15486.0]
  - - [512, 3978, 1, 2048, 512, 512, 512, 2048]
    - [13, 16782.0]
  - - [512, 3978, 1, 33708, 512, 512, 512, 33708]
    - [21, 17294.0]
  - - [512, 3990, 1, 512, 512, 512, 512, 512]
    - [22, 15621.0]
  - - [512, 3990, 1, 2048, 512, 512, 512, 2048]
    - [40, 16771.0]
  - - [512, 3990, 1, 33708, 512, 512, 512, 33708]
    - [34, 17350.0]
  - - [512, 3995, 1, 512, 512, 512, 512, 512]
    - [35, 15720.0]
  - - [512, 3995, 1, 2048, 512, 512, 512, 2048]
    - [40, 16807.0]
  - - [512, 3995, 1, 33708, 512, 512, 512, 33708]
    - [21, 17373.0]
  - - [512, 3996, 1, 512, 512, 512, 512, 512]
    - [37, 15630.0]
  - - [512, 3996, 1, 2048, 512, 512, 512, 2048]
    - [40, 16821.0]
  - - [512, 3996, 1, 33708, 512, 512, 512, 33708]
    - [21, 17383.0]
  - - [512, 3999, 1, 512, 512, 512, 512, 512]
    - [22, 15693.0]
  - - [512, 3999, 1, 2048, 512, 512, 512, 2048]
    - [40, 16846.0]
  - - [512, 3999, 1, 33708, 512, 512, 512, 33708]
    - [21, 17386.0]
  - - [512, 4005, 1, 512, 512, 512, 512, 512]
    - [22, 15740.0]
  - - [512, 4005, 1, 2048, 512, 512, 512, 2048]
    - [40, 16826.0]
  - - [512, 4005, 1, 33708, 512, 512, 512, 33708]
    - [21, 17417.0]
  - - [512, 4012, 1, 512, 512, 512, 512, 512]
    - [35, 15735.0]
  - - [512, 4012, 1, 2048, 512, 512, 512, 2048]
    - [13, 16896.0]
  - - [512, 4012, 1, 33708, 512, 512, 512, 33708]
    - [21, 17438.0]
  - - [512, 4020, 1, 512, 512, 512, 512, 512]
    - [37, 15743.0]
  - - [512, 4020, 1, 2048, 512, 512, 512, 2048]
    - [13, 16944.0]
  - - [512, 4020, 1, 33708, 512, 512, 512, 33708]
    - [21, 17483.0]
  - - [512, 4026, 1, 512, 512, 512, 512, 512]
    - [35, 15762.0]
  - - [512, 4026, 1, 2048, 512, 512, 512, 2048]
    - [28, 16932.0]
  - - [512, 4026, 1, 33708, 512, 512, 512, 33708]
    - [34, 17502.0]
  - - [512, 4030, 1, 512, 512, 512, 512, 512]
    - [37, 15796.0]
  - - [512, 4030, 1, 2048, 512, 512, 512, 2048]
    - [13, 16967.0]
  - - [512, 4030, 1, 33708, 512, 512, 512, 33708]
    - [21, 17518.0]
  - - [512, 4032, 1, 512, 512, 512, 512, 512]
    - [35, 15952.0]
  - - [512, 4032, 1, 2048, 512, 512, 512, 2048]
    - [13, 16990.0]
  - - [512, 4032, 1, 33708, 512, 512, 512, 33708]
    - [21, 17533.0]
  - - [512, 4050, 1, 512, 512, 512, 512, 512]
    - [6, 15822.0]
  - - [512, 4059, 1, 512, 512, 512, 512, 512]
    - [36, 15967.0]
  - - [2048, 644, 1, 512, 2048, 2048, 2048, 512]
    - [29, 15354.0]
  - - [2048, 668, 1, 512, 2048, 2048, 2048, 512]
    - [29, 15912.0]
  - - [2048, 714, 1, 512, 2048, 2048, 2048, 512]
    - [29, 14600.0]
  - - [2048, 720, 1, 512, 2048, 2048, 2048, 512]
    - [29, 14734.0]
  - - [2048, 722, 1, 512, 2048, 2048, 2048, 512]
    - [29, 14758.0]
  - - [2048, 781, 1, 512, 2048, 2048, 2048, 512]
    - [29, 15852.0]
  - - [2048, 848, 1, 512, 2048, 2048, 2048, 512]
    - [35, 15010.0]
  - - [2048, 872, 1, 512, 2048, 2048, 2048, 512]
    - [35, 15404.0]
  - - [2048, 936, 1, 512, 2048, 2048, 2048, 512]
    - [6, 16468.0]
  - - [2048, 980, 1, 512, 2048, 2048, 2048, 512]
    - [29, 15551.0]
  - - [2048, 1139, 1, 512, 2048, 2048, 2048, 512]
    - [29, 17564.0]
  - - [2048, 1184, 1, 512, 2048, 2048, 2048, 512]
    - [29, 16518.0]
  - - [2048, 1186, 1, 512, 2048, 2048, 2048, 512]
    - [29, 16498.0]
  - - [2048, 1279, 1, 512, 2048, 2048, 2048, 512]
    - [22, 17508.0]
  - - [2048, 1290, 1, 512, 2048, 2048, 2048, 512]
    - [23, 16444.0]
  - - [2048, 1327, 1, 512, 2048, 2048, 2048, 512]
    - [35, 16817.0]
  - - [2048, 1331, 1, 512, 2048, 2048, 2048, 512]
    - [23, 16958.0]
  - - [2048, 1341, 1, 512, 2048, 2048, 2048, 512]
    - [23, 17106.0]
  - - [2048, 1350, 1, 512, 2048, 2048, 2048, 512]
    - [23, 17175.0]
  - - [2048, 1359, 1, 512, 2048, 2048, 2048, 512]
    - [29, 17231.0]
  - - [2048, 1391, 1, 512, 2048, 2048, 2048, 512]
    - [23, 17620.0]
  - - [2048, 1424, 1, 512, 2048, 2048, 2048, 512]
    - [29, 16547.0]
  - - [2048, 1458, 1, 512, 2048, 2048, 2048, 512]
    - [29, 16938.0]
  - - [2048, 1462, 1, 512, 2048, 2048, 2048, 512]
    - [29, 17003.0]
  - - [2048, 1467, 1, 512, 2048, 2048, 2048, 512]
    - [29, 17065.0]
  - - [2048, 1472, 1, 512, 2048, 2048, 2048, 512]
    - [29, 17265.0]
  - - [2048, 1520, 1, 512, 2048, 2048, 2048, 512]
    - [29, 17666.0]
  - - [2048, 1596, 1, 512, 2048, 2048, 2048, 512]
    - [7, 17189.0]
  - - [2048, 1599, 1, 512, 2048, 2048, 2048, 512]
    - [7, 17275.0]
  - - [2048, 1615, 1, 512, 2048, 2048, 2048, 512]
    - [7, 17422.0]
  - - [2048, 1680, 1, 512, 2048, 2048, 2048, 512]
    - [29, 17888.0]
  - - [2048, 1709, 1, 512, 2048, 2048, 2048, 512]
    - [29, 18141.0]
  - - [2048, 1902, 1, 512, 2048, 2048, 2048, 512]
    - [23, 17836.0]
  - - [2048, 1917, 1, 512, 2048, 2048, 2048, 512]
    - [23, 17919.0]
  - - [2048, 2076, 1, 512, 2048, 2048, 2048, 512]
    - [29, 17822.0]
  - - [2048, 2195, 1, 512, 2048, 2048, 2048, 512]
    - [23, 18149.0]
  - - [2048, 2205, 1, 512, 2048, 2048, 2048, 512]
    - [7, 18249.0]
  - - [2048, 2418, 1, 512, 2048, 2048, 2048, 512]
    - [29, 18453.0]
  - - [2048, 2496, 1, 512, 2048, 2048, 2048, 512]
    - [23, 18504.0]
  - - [2048, 2790, 1, 512, 2048, 2048, 2048, 512]
    - [7, 18710.0]
  - - [2048, 2864, 1, 512, 2048, 2048, 2048, 512]
    - [29, 18685.0]
  - - [2048, 3092, 1, 512, 2048, 2048, 2048, 512]
    - [22, 18320.0]
  - - [2048, 3113, 1, 512, 2048, 2048, 2048, 512]
    - [29, 18521.0]
  - - [2048, 3137, 1, 512, 2048, 2048, 2048, 512]
    - [29, 17965.0]
  - - [2048, 3166, 1, 512, 2048, 2048, 2048, 512]
    - [29, 18078.0]
  - - [2048, 3194, 1, 512, 2048, 2048, 2048, 512]
    - [7, 18238.0]
  - - [2048, 3219, 1, 512, 2048, 2048, 2048, 512]
    - [29, 18384.0]
  - - [2048, 3222, 1, 512, 2048, 2048, 2048, 512]
    - [22, 18353.0]
  - - [2048, 3234, 1, 512, 2048, 2048, 2048, 512]
    - [29, 18490.0]
  - - [2048, 3237, 1, 512, 2048, 2048, 2048, 512]
    - [22, 18405.0]
  - - [2048, 3242, 1, 512, 2048, 2048, 2048, 512]
    - [29, 18526.0]
  - - [2048, 3246, 1, 512, 2048, 2048, 2048, 512]
    - [29, 18524.0]
  - - [2048, 3249, 1, 512, 2048, 2048, 2048, 512]
    - [29, 18529.0]
  - - [2048, 3251, 1, 512, 2048, 2048, 2048, 512]
    - [29, 18561.0]
  - - [2048, 3257, 1, 512, 2048, 2048, 2048, 512]
    - [29, 18579.0]
  - - [2048, 3262, 1, 512, 2048, 2048, 2048, 512]
    - [29, 18595.0]
  - - [2048, 3268, 1, 512, 2048, 2048, 2048, 512]
    - [23, 18511.0]
  - - [2048, 3282, 1, 512, 2048, 2048, 2048, 512]
    - [23, 18564.0]
  - - [2048, 3286, 1, 512, 2048, 2048, 2048, 512]
    - [7, 18611.0]
  - - [2048, 3287, 1, 512, 2048, 2048, 2048, 512]
    - [23, 18633.0]
  - - [2048, 3293, 1, 512, 2048, 2048, 2048, 512]
    - [7, 18655.0]
  - - [2048, 3297, 1, 512, 2048, 2048, 2048, 512]
    - [7, 18736.0]
  - - [2048, 3307, 1, 512, 2048, 2048, 2048, 512]
    - [7, 18746.0]
  - - [2048, 3314, 1, 512, 2048, 2048, 2048, 512]
    - [7, 18699.0]
  - - [2048, 3315, 1, 512, 2048, 2048, 2048, 512]
    - [7, 18775.0]
  - - [2048, 3319, 1, 512, 2048, 2048, 2048, 512]
    - [7, 18731.0]
  - - [2048, 3322, 1, 512, 2048, 2048, 2048, 512]
    - [23, 18746.0]
  - - [2048, 3323, 1, 512, 2048, 2048, 2048, 512]
    - [23, 18816.0]
  - - [2048, 3324, 1, 512, 2048, 2048, 2048, 512]
    - [7, 18812.0]
  - - [2048, 3325, 1, 512, 2048, 2048, 2048, 512]
    - [7, 18785.0]
  - - [2048, 3327, 1, 512, 2048, 2048, 2048, 512]
    - [23, 18798.0]
  - - [2048, 3329, 1, 512, 2048, 2048, 2048, 512]
    - [7, 18769.0]
  - - [2048, 3332, 1, 512, 2048, 2048, 2048, 512]
    - [7, 18802.0]
  - - [2048, 3336, 1, 512, 2048, 2048, 2048, 512]
    - [23, 18817.0]
  - - [2048, 3339, 1, 512, 2048, 2048, 2048, 512]
    - [23, 18929.0]
  - - [2048, 3342, 1, 512, 2048, 2048, 2048, 512]
    - [23, 18875.0]
  - - [2048, 3344, 1, 512, 2048, 2048, 2048, 512]
    - [7, 18884.0]
  - - [2048, 3358, 1, 512, 2048, 2048, 2048, 512]
    - [7, 18953.0]
  - - [2048, 3360, 1, 512, 2048, 2048, 2048, 512]
    - [23, 19028.0]
  - - [2048, 3364, 1, 512, 2048, 2048, 2048, 512]
    - [23, 19024.0]
  - - [2048, 3365, 1, 512, 2048, 2048, 2048, 512]
    - [23, 19036.0]
  - - [2048, 3369, 1, 512, 2048, 2048, 2048, 512]
    - [7, 18956.0]
  - - [2048, 3370, 1, 512, 2048, 2048, 2048, 512]
    - [7, 18998.0]
  - - [2048, 3371, 1, 512, 2048, 2048, 2048, 512]
    - [7, 19018.0]
  - - [2048, 3374, 1, 512, 2048, 2048, 2048, 512]
    - [23, 19083.0]
  - - [2048, 3376, 1, 512, 2048, 2048, 2048, 512]
    - [23, 19010.0]
  - - [2048, 3377, 1, 512, 2048, 2048, 2048, 512]
    - [7, 19011.0]
  - - [2048, 3378, 1, 512, 2048, 2048, 2048, 512]
    - [7, 19058.0]
  - - [2048, 3381, 1, 512, 2048, 2048, 2048, 512]
    - [7, 19091.0]
  - - [2048, 3382, 1, 512, 2048, 2048, 2048, 512]
    - [23, 19115.0]
  - - [2048, 3383, 1, 512, 2048, 2048, 2048, 512]
    - [7, 19107.0]
  - - [2048, 3384, 1, 512, 2048, 2048, 2048, 512]
    - [7, 19102.0]
  - - [2048, 3385, 1, 512, 2048, 2048, 2048, 512]
    - [23, 19103.0]
  - - [2048, 3386, 1, 512, 2048, 2048, 2048, 512]
    - [23, 19136.0]
  - - [2048, 3388, 1, 512, 2048, 2048, 2048, 512]
    - [7, 19164.0]
  - - [2048, 3390, 1, 512, 2048, 2048, 2048, 512]
    - [7, 19074.0]
  - - [2048, 3391, 1, 512, 2048, 2048, 2048, 512]
    - [23, 19172.0]
  - - [2048, 3396, 1, 512, 2048, 2048, 2048, 512]
    - [23, 19166.0]
  - - [2048, 3399, 1, 512, 2048, 2048, 2048, 512]
    - [23, 19187.0]
  - - [2048, 3402, 1, 512, 2048, 2048, 2048, 512]
    - [23, 19255.0]
  - - [2048, 3410, 1, 512, 2048, 2048, 2048, 512]
    - [23, 19238.0]
  - - [2048, 3412, 1, 512, 2048, 2048, 2048, 512]
    - [23, 19252.0]
  - - [2048, 3414, 1, 512, 2048, 2048, 2048, 512]
    - [23, 19220.0]
  - - [2048, 3415, 1, 512, 2048, 2048, 2048, 512]
    - [23, 19300.0]
  - - [2048, 3418, 1, 512, 2048, 2048, 2048, 512]
    - [23, 19250.0]
  - - [2048, 3420, 1, 512, 2048, 2048, 2048, 512]
    - [7, 19291.0]
  - - [2048, 3422, 1, 512, 2048, 2048, 2048, 512]
    - [7, 19269.0]
  - - [2048, 3425, 1, 512, 2048, 2048, 2048, 512]
    - [7, 19236.0]
  - - [2048, 3426, 1, 512, 2048, 2048, 2048, 512]
    - [23, 19389.0]
  - - [2048, 3427, 1, 512, 2048, 2048, 2048, 512]
    - [23, 19320.0]
  - - [2048, 3428, 1, 512, 2048, 2048, 2048, 512]
    - [7, 19286.0]
  - - [2048, 3430, 1, 512, 2048, 2048, 2048, 512]
    - [23, 19343.0]
  - - [2048, 3431, 1, 512, 2048, 2048, 2048, 512]
    - [23, 19378.0]
  - - [2048, 3432, 1, 512, 2048, 2048, 2048, 512]
    - [7, 19335.0]
  - - [2048, 3433, 1, 512, 2048, 2048, 2048, 512]
    - [23, 19435.0]
  - - [2048, 3438, 1, 512, 2048, 2048, 2048, 512]
    - [7, 19388.0]
  - - [2048, 3439, 1, 512, 2048, 2048, 2048, 512]
    - [7, 19367.0]
  - - [2048, 3440, 1, 512, 2048, 2048, 2048, 512]
    - [23, 19358.0]
  - - [2048, 3443, 1, 512, 2048, 2048, 2048, 512]
    - [23, 19443.0]
  - - [2048, 3445, 1, 512, 2048, 2048, 2048, 512]
    - [23, 19413.0]
  - - [2048, 3447, 1, 512, 2048, 2048, 2048, 512]
    - [23, 19418.0]
  - - [2048, 3448, 1, 512, 2048, 2048, 2048, 512]
    - [23, 19449.0]
  - - [2048, 3450, 1, 512, 2048, 2048, 2048, 512]
    - [7, 19424.0]
  - - [2048, 3451, 1, 512, 2048, 2048, 2048, 512]
    - [23, 19476.0]
  - - [2048, 3452, 1, 512, 2048, 2048, 2048, 512]
    - [7, 19413.0]
  - - [2048, 3453, 1, 512, 2048, 2048, 2048, 512]
    - [23, 19418.0]
  - - [2048, 3455, 1, 512, 2048, 2048, 2048, 512]
    - [23, 19486.0]
  - - [2048, 3456, 1, 512, 2048, 2048, 2048, 512]
    - [7, 19669.0]
  - - [2048, 3457, 1, 512, 2048, 2048, 2048, 512]
    - [29, 18254.0]
  - - [2048, 3458, 1, 512, 2048, 2048, 2048, 512]
    - [23, 18322.0]
  - - [2048, 3459, 1, 512, 2048, 2048, 2048, 512]
    - [29, 18212.0]
  - - [2048, 3460, 1, 512, 2048, 2048, 2048, 512]
    - [23, 18307.0]
  - - [2048, 3461, 1, 512, 2048, 2048, 2048, 512]
    - [29, 18255.0]
  - - [2048, 3462, 1, 512, 2048, 2048, 2048, 512]
    - [23, 18305.0]
  - - [2048, 3466, 1, 512, 2048, 2048, 2048, 512]
    - [23, 18324.0]
  - - [2048, 3467, 1, 512, 2048, 2048, 2048, 512]
    - [29, 18290.0]
  - - [2048, 3468, 1, 512, 2048, 2048, 2048, 512]
    - [23, 18303.0]
  - - [2048, 3470, 1, 512, 2048, 2048, 2048, 512]
    - [23, 18314.0]
  - - [2048, 3471, 1, 512, 2048, 2048, 2048, 512]
    - [23, 18330.0]
  - - [2048, 3472, 1, 512, 2048, 2048, 2048, 512]
    - [29, 18320.0]
  - - [2048, 3475, 1, 512, 2048, 2048, 2048, 512]
    - [23, 18371.0]
  - - [2048, 3476, 1, 512, 2048, 2048, 2048, 512]
    - [29, 18332.0]
  - - [2048, 3477, 1, 512, 2048, 2048, 2048, 512]
    - [23, 18365.0]
  - - [2048, 3478, 1, 512, 2048, 2048, 2048, 512]
    - [23, 18395.0]
  - - [2048, 3479, 1, 512, 2048, 2048, 2048, 512]
    - [23, 18396.0]
  - - [2048, 3480, 1, 512, 2048, 2048, 2048, 512]
    - [23, 18422.0]
  - - [2048, 3481, 1, 512, 2048, 2048, 2048, 512]
    - [23, 18412.0]
  - - [2048, 3483, 1, 512, 2048, 2048, 2048, 512]
    - [29, 18397.0]
  - - [2048, 3484, 1, 512, 2048, 2048, 2048, 512]
    - [23, 18395.0]
  - - [2048, 3487, 1, 512, 2048, 2048, 2048, 512]
    - [29, 18370.0]
  - - [2048, 3489, 1, 512, 2048, 2048, 2048, 512]
    - [29, 18395.0]
  - - [2048, 3490, 1, 512, 2048, 2048, 2048, 512]
    - [23, 18438.0]
  - - [2048, 3491, 1, 512, 2048, 2048, 2048, 512]
    - [23, 18393.0]
  - - [2048, 3493, 1, 512, 2048, 2048, 2048, 512]
    - [23, 18461.0]
  - - [2048, 3494, 1, 512, 2048, 2048, 2048, 512]
    - [29, 18444.0]
  - - [2048, 3495, 1, 512, 2048, 2048, 2048, 512]
    - [23, 18457.0]
  - - [2048, 3497, 1, 512, 2048, 2048, 2048, 512]
    - [23, 18462.0]
  - - [2048, 3498, 1, 512, 2048, 2048, 2048, 512]
    - [29, 18461.0]
  - - [2048, 3501, 1, 512, 2048, 2048, 2048, 512]
    - [29, 18475.0]
  - - [2048, 3503, 1, 512, 2048, 2048, 2048, 512]
    - [23, 18506.0]
  - - [2048, 3505, 1, 512, 2048, 2048, 2048, 512]
    - [23, 18448.0]
  - - [2048, 3507, 1, 512, 2048, 2048, 2048, 512]
    - [23, 18516.0]
  - - [2048, 3508, 1, 512, 2048, 2048, 2048, 512]
    - [23, 18505.0]
  - - [2048, 3509, 1, 512, 2048, 2048, 2048, 512]
    - [23, 18510.0]
  - - [2048, 3510, 1, 512, 2048, 2048, 2048, 512]
    - [23, 18530.0]
  - - [2048, 3511, 1, 512, 2048, 2048, 2048, 512]
    - [23, 18528.0]
  - - [2048, 3513, 1, 512, 2048, 2048, 2048, 512]
    - [23, 18505.0]
  - - [2048, 3514, 1, 512, 2048, 2048, 2048, 512]
    - [29, 18514.0]
  - - [2048, 3515, 1, 512, 2048, 2048, 2048, 512]
    - [23, 18581.0]
  - - [2048, 3517, 1, 512, 2048, 2048, 2048, 512]
    - [23, 18590.0]
  - - [2048, 3518, 1, 512, 2048, 2048, 2048, 512]
    - [23, 18541.0]
  - - [2048, 3519, 1, 512, 2048, 2048, 2048, 512]
    - [23, 18606.0]
  - - [2048, 3520, 1, 512, 2048, 2048, 2048, 512]
    - [29, 18579.0]
  - - [2048, 3523, 1, 512, 2048, 2048, 2048, 512]
    - [23, 18612.0]
  - - [2048, 3528, 1, 512, 2048, 2048, 2048, 512]
    - [23, 18629.0]
  - - [2048, 3529, 1, 512, 2048, 2048, 2048, 512]
    - [23, 18621.0]
  - - [2048, 3530, 1, 512, 2048, 2048, 2048, 512]
    - [23, 18660.0]
  - - [2048, 3531, 1, 512, 2048, 2048, 2048, 512]
    - [29, 18594.0]
  - - [2048, 3532, 1, 512, 2048, 2048, 2048, 512]
    - [29, 18645.0]
  - - [2048, 3533, 1, 512, 2048, 2048, 2048, 512]
    - [23, 18687.0]
  - - [2048, 3534, 1, 512, 2048, 2048, 2048, 512]
    - [23, 18644.0]
  - - [2048, 3538, 1, 512, 2048, 2048, 2048, 512]
    - [23, 18697.0]
  - - [2048, 3539, 1, 512, 2048, 2048, 2048, 512]
    - [23, 18651.0]
  - - [2048, 3540, 1, 512, 2048, 2048, 2048, 512]
    - [7, 18644.0]
  - - [2048, 3541, 1, 512, 2048, 2048, 2048, 512]
    - [29, 18686.0]
  - - [2048, 3547, 1, 512, 2048, 2048, 2048, 512]
    - [29, 18739.0]
  - - [2048, 3548, 1, 512, 2048, 2048, 2048, 512]
    - [23, 18731.0]
  - - [2048, 3552, 1, 512, 2048, 2048, 2048, 512]
    - [29, 18728.0]
  - - [2048, 3564, 1, 512, 2048, 2048, 2048, 512]
    - [29, 18763.0]
  - - [2048, 3575, 1, 512, 2048, 2048, 2048, 512]
    - [29, 18805.0]
  - - [2048, 3598, 1, 512, 2048, 2048, 2048, 512]
    - [23, 18836.0]
  - - [2048, 3599, 1, 512, 2048, 2048, 2048, 512]
    - [23, 18858.0]
  - - [2048, 3608, 1, 512, 2048, 2048, 2048, 512]
    - [7, 18888.0]
  - - [2048, 3776, 1, 512, 2048, 2048, 2048, 512]
    - [29, 18556.0]
  - - [2048, 3780, 1, 512, 2048, 2048, 2048, 512]
    - [7, 18565.0]
  - - [2048, 3796, 1, 512, 2048, 2048, 2048, 512]
    - [23, 18584.0]
  - - [2048, 3822, 1, 512, 2048, 2048, 2048, 512]
    - [23, 18764.0]
  - - [2048, 3835, 1, 512, 2048, 2048, 2048, 512]
    - [7, 18751.0]
  - - [2048, 3840, 1, 512, 2048, 2048, 2048, 512]
    - [7, 18986.0]
  - - [2048, 3859, 1, 512, 2048, 2048, 2048, 512]
    - [23, 18822.0]
  - - [2048, 3864, 1, 512, 2048, 2048, 2048, 512]
    - [23, 18919.0]
  - - [2048, 3870, 1, 512, 2048, 2048, 2048, 512]
    - [7, 18885.0]
  - - [2048, 3876, 1, 512, 2048, 2048, 2048, 512]
    - [23, 18946.0]
  - - [2048, 3906, 1, 512, 2048, 2048, 2048, 512]
    - [7, 19073.0]
  - - [2048, 3910, 1, 512, 2048, 2048, 2048, 512]
    - [23, 19121.0]
  - - [2048, 3925, 1, 512, 2048, 2048, 2048, 512]
    - [7, 19112.0]
  - - [2048, 3942, 1, 512, 2048, 2048, 2048, 512]
    - [23, 19208.0]
  - - [2048, 3944, 1, 512, 2048, 2048, 2048, 512]
    - [23, 19264.0]
  - - [2048, 3955, 1, 512, 2048, 2048, 2048, 512]
    - [23, 19307.0]
  - - [2048, 3968, 1, 512, 2048, 2048, 2048, 512]
    - [23, 19470.0]
  - - [2048, 3969, 1, 512, 2048, 2048, 2048, 512]
    - [29, 18669.0]
  - - [2048, 3976, 1, 512, 2048, 2048, 2048, 512]
    - [29, 18723.0]
  - - [2048, 3977, 1, 512, 2048, 2048, 2048, 512]
    - [29, 18734.0]
  - - [2048, 3978, 1, 512, 2048, 2048, 2048, 512]
    - [29, 18722.0]
  - - [2048, 3990, 1, 512, 2048, 2048, 2048, 512]
    - [22, 18718.0]
  - - [2048, 3995, 1, 512, 2048, 2048, 2048, 512]
    - [29, 18817.0]
  - - [2048, 3996, 1, 512, 2048, 2048, 2048, 512]
    - [29, 18825.0]
  - - [2048, 3999, 1, 512, 2048, 2048, 2048, 512]
    - [29, 18811.0]
  - - [2048, 4005, 1, 512, 2048, 2048, 2048, 512]
    - [29, 18849.0]
  - - [2048, 4012, 1, 512, 2048, 2048, 2048, 512]
    - [29, 18892.0]
  - - [2048, 4020, 1, 512, 2048, 2048, 2048, 512]
    - [29, 18906.0]
  - - [2048, 4026, 1, 512, 2048, 2048, 2048, 512]
    - [29, 18932.0]
  - - [2048, 4030, 1, 512, 2048, 2048, 2048, 512]
    - [29, 18916.0]
  - - [2048, 4032, 1, 512, 2048, 2048, 2048, 512]
    - [29, 19034.0]
  - - [1024, 4096, 1, 3072, 1024, 1024, 1024, 3072]
    - [22, 18090.0]
  - - [1024, 3840, 1, 1024, 1024, 1024, 1024, 1024]
    - [23, 18600.0]
  - - [1024, 3840, 1, 4096, 1024, 1024, 1024, 4096]
    - [7, 19019.0]
  - - [1024, 3968, 1, 1024, 1024, 1024, 1024, 1024]
    - [23, 19158.0]
  - - [1024, 3968, 1, 4096, 1024, 1024, 1024, 4096]
    - [7, 19659.0]
  - - [1024, 3968, 1, 42720, 1024, 1024, 1024, 42720]
    - [30, 19493.0]
  - - [1024, 7200, 1, 1024, 1024, 1024, 1024, 1024]
    - [23, 19097.0]
  - - [1024, 7200, 1, 4096, 1024, 1024, 1024, 4096]
    - [23, 19381.0]
  - - [1024, 7200, 1, 42720, 1024, 1024, 1024, 42720]
    - [15, 19562.0]
  - - [1024, 8160, 1, 1024, 1024, 1024, 1024, 1024]
    - [36, 18954.0]
  - - [1024, 8160, 1, 4096, 1024, 1024, 1024, 4096]
    - [23, 19279.0]
  - - [1024, 9520, 1, 1024, 1024, 1024, 1024, 1024]
    - [23, 19544.0]
  - - [1024, 9520, 1, 4096, 1024, 1024, 1024, 4096]
    - [11, 19639.0]
  - - [1024, 9520, 1, 42720, 1024, 1024, 1024, 42720]
    - [30, 19931.0]
  - - [1024, 10200, 1, 1024, 1024, 1024, 1024, 1024]
    - [23, 19782.0]
  - - [1024, 10200, 1, 4096, 1024, 1024, 1024, 4096]
    - [13, 19920.0]
  - - [4096, 3840, 1, 1024, 4096, 4096, 4096, 1024]
    - [7, 20161.0]
  - - [4096, 3968, 1, 1024, 4096, 4096, 4096, 1024]
    - [7, 20162.0]
  - - [4096, 7200, 1, 1024, 4096, 4096, 4096, 1024]
    - [1, 20010.0]
  - - [4096, 8160, 1, 1024, 4096, 4096, 4096, 1024]
    - [4, 20207.0]
  - - [4096, 9520, 1, 1024, 4096, 4096, 4096, 1024]
    - [4, 20145.0]
  - - [4096, 10200, 1, 1024, 4096, 4096, 4096, 1024]
    - [1, 20171.0]
  - - [1024, 2048, 1, 4096, 1024, 1024, 1024, 4096]
    - [28, 17542.0]
  - - [1024, 2048, 1, 30528, 1024, 1024, 1024, 30528]
    - [21, 17820.0]
  - - [1024, 4096, 1, 30528, 1024, 1024, 1024, 30528]
    - [14, 18172.0]
  - - [1024, 10240, 1, 256, 1024, 1024, 1024, 256]
    - [7, 19092.0]
  - - [1024, 10496, 1, 256, 1024, 1024, 1024, 256]
    - [7, 19007.0]
  - - [1024, 11008, 1, 256, 1024, 1024, 1024, 256]
    - [7, 18997.0]
  - - [1024, 11264, 1, 256, 1024, 1024, 1024, 256]
    - [7, 19319.0]
  - - [1024, 11520, 1, 256, 1024, 1024, 1024, 256]
    - [4, 19551.0]
  - - [1024, 12288, 1, 256, 1024, 1024, 1024, 256]
    - [7, 19277.0]
  - - [1024, 13312, 1, 256, 1024, 1024, 1024, 256]
    - [7, 19248.0]
  - - [1024, 13568, 1, 256, 1024, 1024, 1024, 256]
    - [7, 19436.0]
  - - [1024, 14336, 1, 256, 1024, 1024, 1024, 256]
    - [4, 19701.0]
  - - [1024, 14592, 1, 256, 1024, 1024, 1024, 256]
    - [7, 19441.0]
  - - [1024, 14848, 1, 256, 1024, 1024, 1024, 256]
    - [7, 19642.0]
  - - [1024, 15104, 1, 256, 1024, 1024, 1024, 256]
    - [7, 19445.0]
  - - [1024, 1600, 1, 1024, 1024, 1024, 1024, 1024]
    - [8, 16838.0]
  - - [1024, 1600, 1, 1, 1024, 1024, 1024, 1]
    - [6, 392.0]
  - - [1024, 16128, 1, 256, 1024, 1024, 1024, 256]
    - [7, 19729.0]
  - - [1024, 17152, 1, 256, 1024, 1024, 1024, 256]
    - [7, 19748.0]
  - - [1024, 1792, 1, 256, 1024, 1024, 1024, 256]
    - [29, 15669.0]
  - - [1024, 18944, 1, 256, 1024, 1024, 1024, 256]
    - [4, 19855.0]
  - - [1024, 19712, 1, 256, 1024, 1024, 1024, 256]
    - [7, 19670.0]
  - - [1024, 19968, 1, 256, 1024, 1024, 1024, 256]
    - [4, 19795.0]
  - - [1024, 20480, 1, 256, 1024, 1024, 1024, 256]
    - [4, 19757.0]
  - - [1024, 2048, 1, 256, 1024, 1024, 1024, 256]
    - [29, 15903.0]
  - - [1024, 20992, 1, 256, 1024, 1024, 1024, 256]
    - [7, 19776.0]
  - - [1024, 21504, 1, 256, 1024, 1024, 1024, 256]
    - [7, 19732.0]
  - - [1024, 22016, 1, 256, 1024, 1024, 1024, 256]
    - [7, 19760.0]
  - - [1024, 23552, 1, 256, 1024, 1024, 1024, 256]
    - [11, 19946.0]
  - - [1024, 2560, 1, 256, 1024, 1024, 1024, 256]
    - [29, 17467.0]
  - - [1024, 28672, 1, 256, 1024, 1024, 1024, 256]
    - [4, 19671.0]
  - - [1024, 3072, 1, 256, 1024, 1024, 1024, 256]
    - [29, 17476.0]
  - - [1024, 3328, 1, 256, 1024, 1024, 1024, 256]
    - [29, 17617.0]
  - - [1024, 33536, 1, 256, 1024, 1024, 1024, 256]
    - [19, 19464.0]
  - - [1024, 3840, 1, 256, 1024, 1024, 1024, 256]
    - [29, 17410.0]
  - - [1024, 40448, 1, 256, 1024, 1024, 1024, 256]
    - [19, 19541.0]
  - - [1024, 4096, 1, 256, 1024, 1024, 1024, 256]
    - [29, 17482.0]
  - - [1024, 4608, 1, 256, 1024, 1024, 1024, 256]
    - [4, 18527.0]
  - - [1024, 4864, 1, 256, 1024, 1024, 1024, 256]
    - [29, 18405.0]
  - - [1024, 5120, 1, 256, 1024, 1024, 1024, 256]
    - [4, 18502.0]
  - - [1024, 5632, 1, 256, 1024, 1024, 1024, 256]
    - [7, 18580.0]
  - - [1024, 6144, 1, 256, 1024, 1024, 1024, 256]
    - [7, 18547.0]
  - - [1024, 6400, 1, 256, 1024, 1024, 1024, 256]
    - [29, 18169.0]
  - - [1024, 7168, 1, 256, 1024, 1024, 1024, 256]
    - [29, 18690.0]
  - - [1024, 7424, 1, 256, 1024, 1024, 1024, 256]
    - [4, 19084.0]
  - - [1024, 7680, 1, 256, 1024, 1024, 1024, 256]
    - [29, 18624.0]
  - - [1024, 7936, 1, 256, 1024, 1024, 1024, 256]
    - [11, 19013.0]
  - - [1024, 8192, 1, 256, 1024, 1024, 1024, 256]
    - [7, 18619.0]
  - - [1024, 8448, 1, 256, 1024, 1024, 1024, 256]
    - [4, 19000.0]
  - - [1024, 8704, 1, 256, 1024, 1024, 1024, 256]
    - [7, 18635.0]
  - - [1024, 8960, 1, 256, 1024, 1024, 1024, 256]
    - [7, 18985.0]
  - - [1024, 9728, 1, 256, 1024, 1024, 1024, 256]
    - [7, 19375.0]
  - - [1024, 9984, 1, 256, 1024, 1024, 1024, 256]
    - [4, 18900.0]
  - - [2048, 1024, 1, 1, 2048, 2048, 2048, 1]
    - [6, 408.0]
  - - [2048, 1024, 1, 256, 2048, 2048, 2048, 256]
    - [14, 16016.0]
  - - [256, 8976, 1, 10240, 256, 256, 256, 10240]
    - [27, 18046.0]
  - - [256, 8976, 1, 10496, 256, 256, 256, 10496]
    - [13, 19236.0]
  - - [256, 8976, 1, 11008, 256, 256, 256, 11008]
    - [13, 19254.0]
  - - [256, 8976, 1, 11520, 256, 256, 256, 11520]
    - [13, 19261.0]
  - - [256, 8976, 1, 12288, 256, 256, 256, 12288]
    - [27, 18038.0]
  - - [256, 8976, 1, 14336, 256, 256, 256, 14336]
    - [27, 18044.0]
  - - [256, 8976, 1, 14848, 256, 256, 256, 14848]
    - [13, 19305.0]
  - - [256, 8976, 1, 15104, 256, 256, 256, 15104]
    - [28, 19311.0]
  - - [256, 8976, 1, 1536, 256, 256, 256, 1536]
    - [25, 18259.0]
  - - [256, 8976, 1, 15872, 256, 256, 256, 15872]
    - [13, 19322.0]
  - - [256, 8976, 1, 17152, 256, 256, 256, 17152]
    - [13, 19325.0]
  - - [256, 8976, 1, 19712, 256, 256, 256, 19712]
    - [40, 19350.0]
  - - [256, 8976, 1, 19968, 256, 256, 256, 19968]
    - [13, 19334.0]
  - - [256, 8976, 1, 20480, 256, 256, 256, 20480]
    - [12, 17652.0]
  - - [256, 8976, 1, 2048, 256, 256, 256, 2048]
    - [9, 18484.0]
  - - [256, 8976, 1, 20992, 256, 256, 256, 20992]
    - [13, 19351.0]
  - - [256, 8976, 1, 22016, 256, 256, 256, 22016]
    - [13, 19355.0]
  - - [256, 8976, 1, 2304, 256, 256, 256, 2304]
    - [9, 18531.0]
  - - [256, 8976, 1, 2560, 256, 256, 256, 2560]
    - [40, 18892.0]
  - - [256, 8976, 1, 26112, 256, 256, 256, 26112]
    - [13, 19366.0]
  - - [256, 8976, 1, 2816, 256, 256, 256, 2816]
    - [34, 18683.0]
  - - [256, 8976, 1, 3072, 256, 256, 256, 3072]
    - [40, 18993.0]
  - - [256, 8976, 1, 33536, 256, 256, 256, 33536]
    - [13, 19347.0]
  - - [256, 8976, 1, 4352, 256, 256, 256, 4352]
    - [13, 18910.0]
  - - [256, 8976, 1, 44505, 256, 256, 256, 44505]
    - [21, 19427.0]
  - - [256, 8976, 1, 4864, 256, 256, 256, 4864]
    - [13, 18987.0]
  - - [256, 8976, 1, 5376, 256, 256, 256, 5376]
    - [13, 19044.0]
  - - [256, 8976, 1, 5632, 256, 256, 256, 5632]
    - [40, 19060.0]
  - - [256, 8976, 1, 5888, 256, 256, 256, 5888]
    - [28, 19081.0]
  - - [256, 8976, 1, 6144, 256, 256, 256, 6144]
    - [11, 18215.0]
  - - [256, 8976, 1, 6656, 256, 256, 256, 6656]
    - [13, 19121.0]
  - - [256, 8976, 1, 7168, 256, 256, 256, 7168]
    - [27, 18132.0]
  - - [256, 8976, 1, 7424, 256, 256, 256, 7424]
    - [40, 19160.0]
  - - [256, 8976, 1, 8192, 256, 256, 256, 8192]
    - [39, 17408.0]
  - - [256, 8976, 1, 8448, 256, 256, 256, 8448]
    - [28, 19171.0]
  - - [256, 8976, 1, 8960, 256, 256, 256, 8960]
    - [40, 19200.0]
  - - [256, 8976, 1, 9472, 256, 256, 256, 9472]
    - [13, 19217.0]
  - - [256, 8976, 1, 9728, 256, 256, 256, 9728]
    - [40, 19231.0]
  - - [256, 8976, 1, 9984, 256, 256, 256, 9984]
    - [28, 19235.0]
  - - [3200, 1024, 1, 2048, 3200, 3200, 3200, 2048]
    - [23, 18260.0]
  - - [4096, 1024, 1, 1, 4096, 4096, 4096, 1]
    - [6, 484.0]
  - - [1024, 4096, 1, 4096, 1024, 1024, 1024, 4096]
    - [22, 18107.0]
  - - [1024, 3072, 1, 3072, 1024, 1024, 1024, 3072]
    - [35, 18292.0]
  - - [1024, 2048, 1, 3072, 1024, 1024, 1024, 3072]
    - [28, 17559.0]
  - - [30528, 4096, 1, 1024, 30528, 30528, 30528, 1024]
    - [36, 20675.0]
  - - [30528, 2048, 1, 1024, 30528, 30528, 30528, 1024]
    - [36, 20521.0]
  - - [512, 32768, 1, 256, 512, 512, 512, 256]
    - [36, 19528.0]
  - - [256, 32768, 1, 128, 256, 256, 256, 128]
    - [29, 18181.0]
  - - [1024, 32768, 1, 512, 1024, 1024, 1024, 512]
    - [11, 19908.0]
  - - [1024, 32768, 1, 1024, 1024, 1024, 1024, 1024]
    - [27, 20218.0]
  - - [479, 32768, 1, 1024, 479, 479, 479, 1024]
    - [39, 18349.0]
  - - [289, 128, 64, 768, 289, 289, 289, 768]
    - [35, 13421.0]
  - - [289, 160, 64, 768, 289, 289, 289, 768]
    - [22, 11766.0]
  - - [289, 192, 64, 768, 289, 289, 289, 768]
    - [35, 14092.0]
  - - [3136, 256, 64, 64, 3136, 3136, 3136, 64]
    - [0, 13797.0]
  - - [784, 512, 64, 128, 784, 784, 784, 128]
    - [29, 16371.0]
  - - [784, 128, 64, 512, 784, 784, 784, 512]
    - [39, 16102.0]
  - - [196, 1024, 64, 256, 196, 196, 196, 256]
    - [7, 14293.0]
  - - [196, 256, 64, 1024, 196, 196, 196, 1024]
    - [7, 13183.0]
  - - [3136, 256, 32, 64, 3136, 3136, 3136, 64]
    - [29, 18140.0]
  - - [784, 512, 32, 128, 784, 784, 784, 128]
    - [2, 16164.0]
  - - [784, 128, 32, 512, 784, 784, 784, 512]
    - [35, 15470.0]
  - - [196, 1024, 32, 256, 196, 196, 196, 256]
    - [35, 14041.0]
  - - [256, 6912, 1, 4, 256, 256, 256, 4]
    - [6, 1539.0]
  - - [512, 4096, 1, 256, 512, 512, 512, 256]
    - [36, 15818.0]
  - - [1024, 4096, 1, 512, 1024, 1024, 1024, 512]
    - [22, 17751.0]
  - - [480, 4096, 1, 1024, 480, 480, 480, 1024]
    - [23, 15763.0]
  - - [512, 6912, 1, 256, 512, 512, 512, 256]
    - [11, 18148.0]
  - - [1024, 6912, 1, 512, 1024, 1024, 1024, 512]
    - [23, 19652.0]
  - - [1024, 6912, 1, 1024, 1024, 1024, 1024, 1024]
    - [23, 19909.0]
  - - [480, 6912, 1, 1024, 480, 480, 480, 1024]
    - [23, 18133.0]
  - - [256, 55296, 1, 128, 256, 256, 256, 128]
    - [30, 19021.0]
  - - [512, 55296, 1, 256, 512, 512, 512, 256]
    - [1, 19536.0]
  - - [1920, 2048, 1, 2048, 1920, 1920, 1920, 2048]
    - [7, 18759.0]
  - - [2880, 3072, 1, 3072, 2880, 2880, 2880, 3072]
    - [36, 19231.0]
  - - [3840, 4096, 1, 4096, 3840, 3840, 3840, 4096]
    - [7, 20328.0]
  - - [7680, 8192, 1, 8192, 7680, 7680, 7680, 8192]
    - [4, 20550.0]
  - - [2048, 2048, 1, 2048, 2048, 2048, 2048, 2048]
    - [22, 18020.0]
  - - [3072, 3072, 1, 3072, 3072, 3072, 3072, 3072]
    - [7, 20423.0]
  - - [4096, 4096, 1, 4096, 4096, 4096, 4096, 4096]
    - [7, 20251.0]
  - - [8192, 8192, 1, 8192, 8192, 8192, 8192, 8192]
    - [4, 20566.0]
  - - [1152, 1152, 1, 1152, 1152, 1152, 1152, 1152]
    - [29, 16059.0]
  - - [1536, 1536, 1, 1536, 1536, 1536, 1536, 1536]
    - [21, 19375.0]
  - - [1920, 1920, 1, 1920, 1920, 1920, 1920, 1920]
    - [14, 18210.0]
  - - [2304, 2304, 1, 2304, 2304, 2304, 2304, 2304]
    - [16, 19240.0]
  - - [2688, 2688, 1, 2688, 2688, 2688, 2688, 2688]
    - [30, 19268.0]
  - - [3456, 3456, 1, 3456, 3456, 3456, 3456, 3456]
    - [1, 19895.0]
  - - [3840, 3840, 1, 3840, 3840, 3840, 3840, 3840]
    - [23, 19853.0]
  - - [4224, 4224, 1, 4224, 4224, 4224, 4224, 4224]
    - [30, 20299.0]
  - - [4608, 4608, 1, 4608, 4608, 4608, 4608, 4608]
    - [1, 20690.0]
  - - [4992, 4992, 1, 4992, 4992, 4992, 4992, 4992]
    - [15, 20495.0]
  - - [5376, 5376, 1, 5376, 5376, 5376, 5376, 5376]
    - [15, 20416.0]
  - - [5760, 5760, 1, 5760, 5760, 5760, 5760, 5760]
    - [15, 20591.0]
  - - [6144, 6144, 1, 6144, 6144, 6144, 6144, 6144]
    - [23, 20527.0]
  - - [6528, 6528, 1, 6528, 6528, 6528, 6528, 6528]
    - [15, 20673.0]
  - - [6912, 6912, 1, 6912, 6912, 6912, 6912, 6912]
    - [15, 20615.0]
  - - [7296, 7296, 1, 7296, 7296, 7296, 7296, 7296]
    - [30, 20723.0]
  - - [7680, 7680, 1, 7680, 7680, 7680, 7680, 7680]
    - [21, 20633.0]
  - - [1152, 1152, 1, 384, 1152, 1152, 1152, 384]
    - [29, 15221.0]
  - - [1536, 1536, 1, 384, 1536, 1536, 1536, 384]
    - [1, 18288.0]
  - - [1920, 1920, 1, 384, 1920, 1920, 1920, 384]
    - [29, 17887.0]
  - - [2304, 2304, 1, 384, 2304, 2304, 2304, 384]
    - [16, 18808.0]
  - - [2688, 2688, 1, 384, 2688, 2688, 2688, 384]
    - [1, 18856.0]
  - - [3072, 3072, 1, 384, 3072, 3072, 3072, 384]
    - [1, 19991.0]
  - - [3456, 3456, 1, 384, 3456, 3456, 3456, 384]
    - [30, 19590.0]
  - - [3840, 3840, 1, 384, 3840, 3840, 3840, 384]
    - [1, 19587.0]
  - - [4224, 4224, 1, 384, 4224, 4224, 4224, 384]
    - [15, 19957.0]
  - - [4608, 4608, 1, 384, 4608, 4608, 4608, 384]
    - [30, 20329.0]
  - - [4992, 4992, 1, 384, 4992, 4992, 4992, 384]
    - [15, 20142.0]
  - - [5376, 5376, 1, 384, 5376, 5376, 5376, 384]
    - [1, 20098.0]
  - - [5760, 5760, 1, 384, 5760, 5760, 5760, 384]
    - [15, 20209.0]
  - - [6144, 6144, 1, 384, 6144, 6144, 6144, 384]
    - [1, 20060.0]
  - - [6528, 6528, 1, 384, 6528, 6528, 6528, 384]
    - [1, 20248.0]
  - - [6912, 6912, 1, 384, 6912, 6912, 6912, 384]
    - [1, 20186.0]
  - - [7296, 7296, 1, 384, 7296, 7296, 7296, 384]
    - [1, 20286.0]
  - - [7680, 7680, 1, 384, 7680, 7680, 7680, 384]
    - [1, 20368.0]
  - - [8064, 8064, 1, 384, 8064, 8064, 8064, 384]
    - [1, 20415.0]
  - - [8448, 8448, 1, 384, 8448, 8448, 8448, 384]
    - [1, 20454.0]
  - - [8832, 8832, 1, 384, 8832, 8832, 8832, 384]
    - [15, 20490.0]
  - - [9216, 9216, 1, 384, 9216, 9216, 9216, 384]
    - [27, 20180.0]
  - - [9600, 9600, 1, 384, 9600, 9600, 9600, 384]
    - [1, 20518.0]
  - - [9984, 9984, 1, 384, 9984, 9984, 9984, 384]
    - [1, 20523.0]
  - - [10368, 10368, 1, 384, 10368, 10368, 10368, 384]
    - [1, 20564.0]
  - - [10752, 10752, 1, 384, 10752, 10752, 10752, 384]
    - [1, 20549.0]
  - - [11136, 11136, 1, 384, 11136, 11136, 11136, 384]
    - [1, 20626.0]
  - - [11520, 11520, 1, 384, 11520, 11520, 11520, 384]
    - [7, 20600.0]
  - - [11904, 11904, 1, 384, 11904, 11904, 11904, 384]
    - [1, 20634.0]
  - - [12288, 12288, 1, 384, 12288, 12288, 12288, 384]
    - [1, 20493.0]
  - - [12672, 12672, 1, 384, 12672, 12672, 12672, 384]
    - [1, 20631.0]
  - - [13056, 13056, 1, 384, 13056, 13056, 13056, 384]
    - [1, 20626.0]
  - - [13440, 13440, 1, 384, 13440, 13440, 13440, 384]
    - [15, 20657.0]
  - - [13824, 13824, 1, 384, 13824, 13824, 13824, 384]
    - [23, 20536.0]
  - - [14208, 14208, 1, 384, 14208, 14208, 14208, 384]
    - [7, 20694.0]
  - - [14592, 14592, 1, 384, 14592, 14592, 14592, 384]
    - [1, 20645.0]
  - - [14976, 14976, 1, 384, 14976, 14976, 14976, 384]
    - [1, 20678.0]
  - - [15360, 15360, 1, 384, 15360, 15360, 15360, 384]
    - [1, 20608.0]
  - - [15744, 15744, 1, 384, 15744, 15744, 15744, 384]
    - [1, 20720.0]
  - - [16128, 16128, 1, 384, 16128, 16128, 16128, 384]
    - [1, 20673.0]
  - - [16512, 16512, 1, 384, 16512, 16512, 16512, 384]
    - [15, 20721.0]
  - - [16896, 16896, 1, 384, 16896, 16896, 16896, 384]
    - [1, 20696.0]
  - - [17280, 17280, 1, 384, 17280, 17280, 17280, 384]
    - [1, 20727.0]
  - - [17664, 17664, 1, 384, 17664, 17664, 17664, 384]
    - [1, 20714.0]
  - - [18048, 18048, 1, 384, 18048, 18048, 18048, 384]
    - [15, 20746.0]
  - - [18432, 18432, 1, 384, 18432, 18432, 18432, 384]
    - [7, 20571.0]
  - - [18816, 18816, 1, 384, 18816, 18816, 18816, 384]
    - [15, 20749.0]
  - - [19200, 19200, 1, 384, 19200, 19200, 19200, 384]
    - [1, 20716.0]
  - - [19584, 19584, 1, 384, 19584, 19584, 19584, 384]
    - [1, 20734.0]
  - - [19968, 19968, 1, 384, 19968, 19968, 19968, 384]
    - [1, 20710.0]
  - - [20352, 20352, 1, 384, 20352, 20352, 20352, 384]
    - [15, 20760.0]
  - - [20736, 20736, 1, 384, 20736, 20736, 20736, 384]
    - [1, 20730.0]
  - - [21120, 21120, 1, 384, 21120, 21120, 21120, 384]
    - [15, 20771.0]
  - - [21504, 21504, 1, 384, 21504, 21504, 21504, 384]
    - [7, 20687.0]
  - - [21888, 21888, 1, 384, 21888, 21888, 21888, 384]
    - [1, 20737.0]
  - - [22272, 22272, 1, 384, 22272, 22272, 22272, 384]
    - [15, 20743.0]
  - - [22656, 22656, 1, 384, 22656, 22656, 22656, 384]
    - [15, 20779.0]
  - - [23040, 23040, 1, 384, 23040, 23040, 23040, 384]
    - [23, 20673.0]
  - - [8192, 1024, 1, 1024, 8192, 8192, 8192, 1024]
    - [7, 19167.0]
  - - [8192, 4096, 1, 1024, 8192, 8192, 8192, 1024]
    - [1, 20368.0]
  - - [16384, 16384, 1, 16384, 16384, 16384, 16384, 16384]
    - [21, 19166.0]
  - - [1444, 256, 120, 128, 1444, 1444, 1444, 128]
    - [0, 15820.0]
  - - [1444, 256, 139, 128, 1444, 1444, 1444, 128]
    - [3, 13333.0]
  - - [1444, 256, 160, 128, 1444, 1444, 1444, 128]
    - [3, 13344.0]
  - - [1444, 256, 18, 128, 1444, 1444, 1444, 128]
    - [6, 16596.0]
  - - [1444, 256, 19, 128, 1444, 1444, 1444, 128]
    - [35, 16829.0]
  - - [1444, 256, 120, 256, 1444, 1444, 1444, 256]
    - [4, 17858.0]
  - - [1444, 256, 139, 256, 1444, 1444, 1444, 256]
    - [4, 17920.0]
  - - [1444, 256, 160, 256, 1444, 1444, 1444, 256]
    - [4, 17836.0]
  - - [1444, 256, 18, 256, 1444, 1444, 1444, 256]
    - [31, 17590.0]
  - - [1444, 256, 19, 256, 1444, 1444, 1444, 256]
    - [7, 17562.0]
  - - [361, 256, 120, 512, 361, 361, 361, 512]
    - [40, 16216.0]
  - - [361, 256, 139, 512, 361, 361, 361, 512]
    - [12, 15850.0]
  - - [361, 256, 160, 512, 361, 361, 361, 512]
    - [11, 15865.0]
  - - [361, 256, 18, 512, 361, 361, 361, 512]
    - [35, 15991.0]
  - - [361, 256, 19, 512, 361, 361, 361, 512]
    - [35, 15099.0]
  - - [173280, 128, 1, 64, 173280, 173280, 173280, 64]
    - [35, 17928.0]
  - - [200716, 128, 1, 64, 200716, 200716, 200716, 64]
    - [0, 14623.0]
  - - [231040, 128, 1, 64, 231040, 231040, 231040, 64]
    - [7, 10202.0]
  - - [25992, 128, 1, 64, 25992, 25992, 25992, 64]
    - [6, 12569.0]
  - - [27436, 128, 1, 64, 27436, 27436, 27436, 64]
    - [16, 14261.0]
  - - [8192, 7680, 1, 8192, 8192, 8192, 8192, 8192]
    - [4, 20550.0]
  - - [4096, 3840, 1, 4096, 4096, 4096, 4096, 4096]
    - [7, 20260.0]
  - - [2048, 1920, 1, 2048, 2048, 2048, 2048, 2048]
    - [7, 18838.0]
  - - [1024, 1280, 1, 2, 1024, 1024, 1024, 2]
    - [6, 690.0]
  - - [1024, 1280, 1, 4096, 1024, 1024, 1024, 4096]
    - [6, 16128.0]
  - - [4096, 1280, 1, 1024, 4096, 4096, 4096, 1024]
    - [7, 19558.0]
  - - [1024, 4992, 1, 2, 1024, 1024, 1024, 2]
    - [0, 1083.0]
  - - [1024, 4992, 1, 4096, 1024, 1024, 1024, 4096]
    - [23, 19400.0]
  - - [4096, 4992, 1, 1024, 4096, 4096, 4096, 1024]
    - [7, 20341.0]
  - - [1024, 5120, 1, 2, 1024, 1024, 1024, 2]
    - [6, 1034.0]
  - - [1024, 5120, 1, 1024, 1024, 1024, 1024, 1024]
    - [7, 19412.0]
  - - [1024, 5120, 1, 4096, 1024, 1024, 1024, 4096]
    - [7, 19626.0]
  - - [4096, 5120, 1, 1024, 4096, 4096, 4096, 1024]
    - [7, 20240.0]
  - - [1024, 5248, 1, 2, 1024, 1024, 1024, 2]
    - [6, 1031.0]
  - - [1024, 5248, 1, 1024, 1024, 1024, 1024, 1024]
    - [35, 18218.0]
  - - [1024, 5248, 1, 4096, 1024, 1024, 1024, 4096]
    - [7, 18404.0]
  - - [4096, 5248, 1, 1024, 4096, 4096, 4096, 1024]
    - [7, 20227.0]
  - - [1024, 2560, 1, 2, 1024, 1024, 1024, 2]
    - [6, 868.0]
  - - [1024, 2560, 1, 4096, 1024, 1024, 1024, 4096]
    - [22, 18377.0]
  - - [4096, 2560, 1, 1024, 4096, 4096, 4096, 1024]
    - [7, 20003.0]
  - - [1024, 1152, 1, 2, 1024, 1024, 1024, 2]
    - [35, 678.0]
  - - [1024, 1152, 1, 4096, 1024, 1024, 1024, 4096]
    - [24, 18214.0]
  - - [4096, 1152, 1, 1024, 4096, 4096, 4096, 1024]
    - [7, 19658.0]
  - - [1024, 8192, 1, 1024, 1024, 1024, 1024, 1024]
    - [23, 19204.0]
  - - [1024, 8192, 1, 4096, 1024, 1024, 1024, 4096]
    - [23, 19343.0]
  - - [1024, 8192, 1, 33712, 1024, 1024, 1024, 33712]
    - [1, 19442.0]
  - - [1024, 9600, 1, 1024, 1024, 1024, 1024, 1024]
    - [23, 19795.0]
  - - [1024, 9600, 1, 4096, 1024, 1024, 1024, 4096]
    - [11, 19787.0]
  - - [1024, 9600, 1, 33712, 1024, 1024, 1024, 33712]
    - [30, 20102.0]
  - - [4096, 8192, 1, 1024, 4096, 4096, 4096, 1024]
    - [1, 20370.0]
  - - [4096, 9600, 1, 1024, 4096, 4096, 4096, 1024]
    - [4, 20299.0]
  - - [1024, 10064, 1, 1024, 1024, 1024, 1024, 1024]
    - [23, 19567.0]
  - - [1024, 10064, 1, 4096, 1024, 1024, 1024, 4096]
    - [23, 19748.0]
  - - [1024, 10080, 1, 4096, 1024, 1024, 1024, 4096]
    - [13, 19722.0]
  - - [1024, 10080, 1, 42720, 1024, 1024, 1024, 42720]
    - [21, 19995.0]
  - - [1024, 6528, 1, 1024, 1024, 1024, 1024, 1024]
    - [7, 18842.0]
  - - [1024, 6528, 1, 4096, 1024, 1024, 1024, 4096]
    - [23, 19113.0]
  - - [1024, 6528, 1, 42720, 1024, 1024, 1024, 42720]
    - [21, 19357.0]
  - - [1024, 7104, 1, 1024, 1024, 1024, 1024, 1024]
    - [23, 18965.0]
  - - [1024, 7104, 1, 4096, 1024, 1024, 1024, 4096]
    - [23, 19300.0]
  - - [1024, 7104, 1, 42720, 1024, 1024, 1024, 42720]
    - [15, 19319.0]
  - - [1024, 8064, 1, 1024, 1024, 1024, 1024, 1024]
    - [7, 19982.0]
  - - [1024, 8064, 1, 4096, 1024, 1024, 1024, 4096]
    - [11, 20060.0]
  - - [1024, 9216, 1, 1024, 1024, 1024, 1024, 1024]
    - [23, 20110.0]
  - - [1024, 9216, 1, 4096, 1024, 1024, 1024, 4096]
    - [28, 20218.0]
  - - [4096, 10064, 1, 1024, 4096, 4096, 4096, 1024]
    - [1, 20208.0]
  - - [4096, 10080, 1, 1024, 4096, 4096, 4096, 1024]
    - [4, 20150.0]
  - - [4096, 6528, 1, 1024, 4096, 4096, 4096, 1024]
    - [4, 20097.0]
  - - [4096, 7104, 1, 1024, 4096, 4096, 4096, 1024]
    - [4, 20048.0]
  - - [4096, 8064, 1, 1024, 4096, 4096, 4096, 1024]
    - [1, 20355.0]
  - - [4096, 9216, 1, 1024, 4096, 4096, 4096, 1024]
    - [4, 20289.0]
  - - [480, 32768, 1, 1024, 480, 480, 480, 1024]
    - [27, 18445.0]
  - - [2048, 960, 1, 2048, 2048, 2048, 2048, 2048]
    - [22, 17574.0]
  - - [2048, 1024, 1, 30592, 2048, 2048, 2048, 30592]
    - [34, 17825.0]
  - - [2048, 1024, 1, 6144, 2048, 2048, 2048, 6144]
    - [28, 17626.0]
  - - [2048, 1024, 1, 8192, 2048, 2048, 2048, 8192]
    - [13, 17708.0]
  - - [8192, 1024, 1, 2048, 8192, 8192, 8192, 2048]
    - [7, 19333.0]
  - - [1024, 8192, 1, 30592, 1024, 1024, 1024, 30592]
    - [7, 19195.0]
  - - [1024, 8192, 1, 3072, 1024, 1024, 1024, 3072]
    - [23, 19394.0]
  - - [512, 512, 256, 64, 512, 512, 512, 64]
    - [0, 12670.0]
  - - [1024, 2048, 1, 30592, 1024, 1024, 1024, 30592]
    - [21, 17816.0]
  - - [1024, 4096, 1, 30592, 1024, 1024, 1024, 30592]
    - [5, 18128.0]
  - - [512, 512, 128, 64, 512, 512, 512, 64]
    - [0, 17369.0]
  - - [2560, 2048, 1, 1920, 2560, 2560, 2560, 1920]
    - [30, 19858.0]
  - - [2560, 2048, 1, 2560, 2560, 2560, 2560, 2560]
    - [23, 19866.0]
  - - [2560, 2048, 1, 7680, 2560, 2560, 2560, 7680]
    - [36, 19646.0]
  - - [640, 2048, 1, 2560, 640, 640, 640, 2560]
    - [35, 16003.0]
  - - [512, 512, 40, 64, 512, 512, 512, 64]
    - [0, 17982.0]
  - - [1536, 4096, 1, 1536, 1536, 1536, 1536, 1536]
    - [36, 19553.0]
  - - [1536, 4096, 1, 4608, 1536, 1536, 1536, 4608]
    - [23, 19681.0]
  - - [1536, 4096, 1, 50304, 1536, 1536, 1536, 50304]
    - [4, 19437.0]
  - - [1536, 4096, 1, 6144, 1536, 1536, 1536, 6144]
    - [23, 19635.0]
  - - [6144, 4096, 1, 1536, 6144, 6144, 6144, 1536]
    - [1, 20487.0]
  - - [1024, 1024, 64, 96, 1024, 1024, 1024, 96]
    - [0, 15461.0]
  - - [1536, 8192, 1, 1536, 1536, 1536, 1536, 1536]
    - [36, 19871.0]
  - - [1536, 8192, 1, 4608, 1536, 1536, 1536, 4608]
    - [36, 19939.0]
  - - [1536, 8192, 1, 50304, 1536, 1536, 1536, 50304]
    - [34, 19975.0]
  - - [1536, 8192, 1, 6144, 1536, 1536, 1536, 6144]
    - [40, 19902.0]
  - - [6144, 8192, 1, 1536, 6144, 6144, 6144, 1536]
    - [1, 20652.0]
  - - [1024, 1024, 128, 96, 1024, 1024, 1024, 96]
    - [0, 15198.0]
  - - [1024, 16384, 1, 1024, 1024, 1024, 1024, 1024]
    - [7, 20084.0]
  - - [1024, 16384, 1, 3072, 1024, 1024, 1024, 3072]
    - [23, 20101.0]
  - - [1024, 16384, 1, 4096, 1024, 1024, 1024, 4096]
    - [23, 20092.0]
  - - [1024, 16384, 1, 50304, 1024, 1024, 1024, 50304]
    - [4, 20068.0]
  - - [4096, 16384, 1, 1024, 4096, 4096, 4096, 1024]
    - [1, 20602.0]
  - - [1024, 1024, 256, 64, 1024, 1024, 1024, 64]
    - [10, 11016.0]
  - - [1024, 2048, 1, 50304, 1024, 1024, 1024, 50304]
    - [34, 17818.0]
  - - [1024, 1024, 32, 64, 1024, 1024, 1024, 64]
    - [0, 17977.0]
  - - [1024, 4096, 1, 50304, 1024, 1024, 1024, 50304]
    - [21, 18133.0]
  - - [1024, 1024, 64, 64, 1024, 1024, 1024, 64]
    - [0, 14980.0]
  - - [1024, 8192, 1, 50304, 1024, 1024, 1024, 50304]
    - [33, 19151.0]
  - - [1024, 1024, 128, 64, 1024, 1024, 1024, 64]
    - [0, 12336.0]
  - - [128, 128, 1024, 64, 128, 128, 128, 64]
    - [20, 16229.0]
  - - [1024, 8192, 1, 30528, 1024, 1024, 1024, 30528]
    - [15, 19385.0]
  - - [1024, 3456, 1, 1024, 1024, 1024, 1024, 1024]
    - [7, 19125.0]
  - - [1024, 3456, 1, 512, 1024, 1024, 1024, 512]
    - [7, 18827.0]
  - - [256, 6912, 1, 128, 256, 256, 256, 128]
    - [0, 15685.0]
  - - [480, 3456, 1, 1024, 480, 480, 480, 1024]
    - [24, 16822.0]
  - - [512, 3456, 1, 256, 512, 512, 512, 256]
    - [35, 16902.0]
  - - [1024, 1280, 1, 30528, 1024, 1024, 1024, 30528]
    - [14, 16316.0]
  - - [1024, 1600, 1, 30528, 1024, 1024, 1024, 30528]
    - [2, 17538.0]
  - - [1024, 10240, 1, 1024, 1024, 1024, 1024, 1024]
    - [23, 19932.0]
  - - [1024, 10240, 1, 4096, 1024, 1024, 1024, 4096]
    - [27, 19922.0]
  - - [4096, 10240, 1, 1024, 4096, 4096, 4096, 1024]
    - [1, 20308.0]
  - - [128, 128, 1280, 64, 128, 128, 128, 64]
    - [23, 7233.0]
  - - [1024, 1640, 1, 30528, 1024, 1024, 1024, 30528]
    - [37, 17952.0]
  - - [1024, 10496, 1, 1024, 1024, 1024, 1024, 1024]
    - [7, 19508.0]
  - - [1024, 10496, 1, 4096, 1024, 1024, 1024, 4096]
    - [23, 19598.0]
  - - [4096, 10496, 1, 1024, 4096, 4096, 4096, 1024]
    - [1, 20441.0]
  - - [128, 128, 1312, 64, 128, 128, 128, 64]
    - [36, 6844.0]
  - - [1024, 6144, 1, 4096, 1024, 1024, 1024, 4096]
    - [23, 19552.0]
  - - [4096, 6144, 1, 1024, 4096, 4096, 4096, 1024]
    - [7, 20277.0]
  - - [1024, 6144, 1, 1024, 1024, 1024, 1024, 1024]
    - [7, 19289.0]
  - - [512, 512, 192, 64, 512, 512, 512, 64]
    - [0, 13616.0]
  - - [256, 6912, 1, 1, 256, 256, 256, 1]
    - [6, 375.0]
  - - [3136, 128, 64, 64, 3136, 3136, 3136, 64]
    - [36, 11021.0]
  - - [3136, 256, 64, 128, 3136, 3136, 3136, 128]
    - [18, 14802.0]
  - - [784, 512, 64, 256, 784, 784, 784, 256]
    - [4, 16778.0]
  - - [3136, 128, 64, 256, 3136, 3136, 3136, 256]
    - [32, 16560.0]
  - - [3136, 256, 64, 256, 3136, 3136, 3136, 256]
    - [19, 19247.0]
  - - [196, 1024, 64, 512, 196, 196, 196, 512]
    - [27, 14455.0]
  - - [784, 256, 64, 512, 784, 784, 784, 512]
    - [4, 16670.0]
  - - [784, 512, 64, 512, 784, 784, 784, 512]
    - [4, 17215.0]
  - - [196, 512, 64, 1024, 196, 196, 196, 1024]
    - [27, 13620.0]
  - - [196, 1024, 64, 1024, 196, 196, 196, 1024]
    - [27, 14323.0]
  - - [3136, 128, 32, 64, 3136, 3136, 3136, 64]
    - [14, 17307.0]
  - - [3136, 256, 32, 128, 3136, 3136, 3136, 128]
    - [0, 18549.0]
  - - [784, 512, 32, 256, 784, 784, 784, 256]
    - [36, 16860.0]
  - - [3136, 128, 32, 256, 3136, 3136, 3136, 256]
    - [4, 17879.0]
  - - [3136, 256, 32, 256, 3136, 3136, 3136, 256]
    - [19, 18779.0]
  - - [196, 1024, 32, 512, 196, 196, 196, 512]
    - [36, 14291.0]
  - - [784, 256, 32, 512, 784, 784, 784, 512]
    - [23, 16460.0]
  - - [784, 512, 32, 512, 784, 784, 784, 512]
    - [36, 17447.0]
  - - [196, 512, 32, 1024, 196, 196, 196, 1024]
    - [35, 13615.0]
  - - [196, 1024, 32, 1024, 196, 196, 196, 1024]
    - [27, 14138.0]
  - - [1024, 10224, 1, 1024, 1024, 1024, 1024, 1024]
    - [7, 19825.0]
  - - [1024, 10192, 1, 1024, 1024, 1024, 1024, 1024]
    - [23, 19873.0]
  - - [1024, 10208, 1, 1024, 1024, 1024, 1024, 1024]
    - [23, 19897.0]
  - - [1024, 10224, 1, 4096, 1024, 1024, 1024, 4096]
    - [13, 19932.0]
  - - [1024, 10224, 1, 3072, 1024, 1024, 1024, 3072]
    - [28, 19874.0]
  - - [4096, 10224, 1, 1024, 4096, 4096, 4096, 1024]
    - [1, 20211.0]
  - - [1024, 10240, 1, 3072, 1024, 1024, 1024, 3072]
    - [11, 19931.0]
  - - [1024, 10192, 1, 3072, 1024, 1024, 1024, 3072]
    - [28, 19857.0]
  - - [4096, 10192, 1, 1024, 4096, 4096, 4096, 1024]
    - [1, 20246.0]
  - - [1024, 10192, 1, 4096, 1024, 1024, 1024, 4096]
    - [13, 19899.0]
  - - [1024, 10200, 1, 3072, 1024, 1024, 1024, 3072]
    - [28, 19862.0]
  - - [1024, 10184, 1, 1024, 1024, 1024, 1024, 1024]
    - [23, 19736.0]
  - - [4096, 10208, 1, 1024, 4096, 4096, 4096, 1024]
    - [1, 20219.0]
  - - [1024, 10208, 1, 3072, 1024, 1024, 1024, 3072]
    - [28, 19845.0]
  - - [1024, 10208, 1, 4096, 1024, 1024, 1024, 4096]
    - [13, 19913.0]
  - - [1024, 10224, 1, 2048, 1024, 1024, 1024, 2048]
    - [7, 20014.0]
  - - [1024, 10240, 1, 2048, 1024, 1024, 1024, 2048]
    - [7, 20025.0]
  - - [1024, 10120, 1, 1024, 1024, 1024, 1024, 1024]
    - [7, 19607.0]
  - - [1024, 10192, 1, 2048, 1024, 1024, 1024, 2048]
    - [7, 19967.0]
  - - [1024, 10152, 1, 1024, 1024, 1024, 1024, 1024]
    - [7, 19680.0]
  - - [1024, 10080, 1, 3072, 1024, 1024, 1024, 3072]
    - [23, 19797.0]
  - - [100352, 512, 1, 256, 100352, 100352, 100352, 256]
    - [27, 19862.0]
  - - [12544, 2048, 1, 1024, 12544, 12544, 12544, 1024]
    - [36, 20355.0]
  - - [200704, 512, 1, 256, 200704, 200704, 200704, 256]
    - [27, 20102.0]
  - - [25088, 1024, 1, 512, 25088, 25088, 25088, 512]
    - [1, 20228.0]
  - - [50176, 1024, 1, 512, 50176, 50176, 50176, 512]
    - [7, 20215.0]
  - - [6272, 2048, 1, 1024, 6272, 6272, 6272, 1024]
    - [7, 20148.0]
  - - [196, 1024, 128, 256, 196, 196, 196, 256]
    - [10, 13615.0]
  - - [196, 1024, 256, 256, 196, 196, 196, 256]
    - [10, 13736.0]
  - - [196, 256, 128, 1024, 196, 196, 196, 1024]
    - [38, 12752.0]
  - - [196, 256, 256, 1024, 196, 196, 196, 1024]
    - [26, 13274.0]
  - - [196, 512, 128, 1024, 196, 196, 196, 1024]
    - [39, 14008.0]
  - - [196, 512, 256, 1024, 196, 196, 196, 1024]
    - [39, 14249.0]
  - - [3136, 128, 128, 256, 3136, 3136, 3136, 256]
    - [32, 16249.0]
  - - [3136, 128, 256, 256, 3136, 3136, 3136, 256]
    - [32, 16034.0]
  - - [784, 256, 128, 512, 784, 784, 784, 512]
    - [11, 17065.0]
  - - [784, 256, 256, 512, 784, 784, 784, 512]
    - [11, 17443.0]
  - - [128, 128, 2048, 64, 128, 128, 128, 64]
    - [0, 6907.0]
  - - [1024, 2560, 1, 30528, 1024, 1024, 1024, 30528]
    - [14, 18287.0]
  - - [128, 128, 1536, 64, 128, 128, 128, 64]
    - [0, 8019.0]
  - - [1024, 12288, 1, 4096, 1024, 1024, 1024, 4096]
    - [23, 19853.0]
  - - [1024, 12288, 1, 1024, 1024, 1024, 1024, 1024]
    - [23, 19703.0]
  - - [4096, 12288, 1, 1024, 4096, 4096, 4096, 1024]
    - [1, 20497.0]
  - - [1024, 1920, 1, 30528, 1024, 1024, 1024, 30528]
    - [14, 17769.0]
  - - [128, 128, 192, 64, 128, 128, 128, 64]
    - [14, 12599.0]
  - - [384, 384, 144, 64, 384, 384, 384, 64]
    - [0, 18570.0]
  - - [768, 4608, 1, 2, 768, 768, 768, 2]
    - [29, 900.0]
  - - [3072, 4608, 1, 768, 3072, 3072, 3072, 768]
    - [1, 20298.0]
  - - [768, 4608, 1, 3072, 768, 768, 768, 3072]
    - [40, 19831.0]
  - - [768, 4608, 1, 768, 768, 768, 768, 768]
    - [36, 19284.0]
  - - [512, 512, 48, 64, 512, 512, 512, 64]
    - [29, 18187.0]
  - - [128, 128, 256, 64, 128, 128, 128, 64]
    - [0, 14340.0]
  - - [384, 384, 192, 64, 384, 384, 384, 64]
    - [0, 17919.0]
  - - [1024, 4608, 1, 2, 1024, 1024, 1024, 2]
    - [6, 989.0]
  - - [4096, 4608, 1, 1024, 4096, 4096, 4096, 1024]
    - [7, 20435.0]
  - - [1024, 4608, 1, 4096, 1024, 1024, 1024, 4096]
    - [13, 20046.0]
  - - [1024, 4608, 1, 1024, 1024, 1024, 1024, 1024]
    - [7, 19508.0]
  - - [3072, 256, 2, 1024, 3072, 3072, 3072, 1024]
    - [31, 16295.0]
  - - [2852, 256, 2, 1024, 2852, 2852, 2852, 1024]
    - [24, 15040.0]
  - - [3220, 256, 2, 1024, 3220, 3220, 3220, 1024]
    - [8, 16858.0]
  - - [850, 2048, 2, 512, 850, 850, 850, 512]
    - [35, 16766.0]
  - - [768, 2048, 2, 512, 768, 768, 768, 512]
    - [35, 17876.0]
  - - [2904, 256, 2, 1024, 2904, 2904, 2904, 1024]
    - [8, 15413.0]
  - - [805, 2048, 2, 512, 805, 805, 805, 512]
    - [35, 15846.0]
  - - [864, 2048, 2, 512, 864, 864, 864, 512]
    - [22, 17046.0]
  - - [2992, 256, 2, 1024, 2992, 2992, 2992, 1024]
    - [7, 15861.0]
  - - [3400, 256, 2, 1024, 3400, 3400, 3400, 1024]
    - [8, 17905.0]
  - - [4032, 256, 2, 1024, 4032, 4032, 4032, 1024]
    - [5, 16464.0]
  - - [15200, 128, 2, 512, 15200, 15200, 15200, 512]
    - [7, 17846.0]
  - - [12288, 128, 2, 512, 12288, 12288, 12288, 512]
    - [29, 17943.0]
  - - [888, 2048, 2, 512, 888, 888, 888, 512]
    - [22, 17483.0]
  - - [13600, 128, 2, 512, 13600, 13600, 13600, 512]
    - [23, 18320.0]
  - - [12880, 128, 2, 512, 12880, 12880, 12880, 512]
    - [1, 17401.0]
  - - [3456, 256, 2, 1024, 3456, 3456, 3456, 1024]
    - [16, 18410.0]
  - - [2944, 256, 2, 1024, 2944, 2944, 2944, 1024]
    - [23, 15689.0]
  - - [2688, 256, 2, 1024, 2688, 2688, 2688, 1024]
    - [22, 16514.0]
  - - [13824, 128, 2, 512, 13824, 13824, 13824, 512]
    - [1, 19166.0]
  - - [3036, 256, 2, 1024, 3036, 3036, 3036, 1024]
    - [8, 16085.0]
  - - [3168, 256, 2, 1024, 3168, 3168, 3168, 1024]
    - [8, 16686.0]
  - - [3360, 256, 2, 1024, 3360, 3360, 3360, 1024]
    - [8, 17762.0]
  - - [3552, 256, 2, 1024, 3552, 3552, 3552, 1024]
    - [6, 16054.0]
  - - [11616, 128, 2, 512, 11616, 11616, 11616, 512]
    - [14, 16816.0]
  - - [4200, 256, 2, 1024, 4200, 4200, 4200, 1024]
    - [7, 17235.0]
  - - [840, 2048, 2, 512, 840, 840, 840, 512]
    - [35, 16578.0]
  - - [14208, 128, 2, 512, 14208, 14208, 14208, 512]
    - [29, 17749.0]
  - - [11968, 128, 2, 512, 11968, 11968, 11968, 512]
    - [29, 17197.0]
  - - [3264, 256, 2, 1024, 3264, 3264, 3264, 1024]
    - [8, 17123.0]
  - - [713, 2048, 2, 512, 713, 713, 713, 512]
    - [22, 16439.0]
  - - [13600, 256, 2, 512, 13600, 13600, 13600, 512]
    - [36, 19332.0]
  - - [12880, 256, 2, 512, 12880, 12880, 12880, 512]
    - [29, 18368.0]
  - - [12288, 256, 2, 512, 12288, 12288, 12288, 512]
    - [1, 19259.0]
  - - [2816, 256, 2, 1024, 2816, 2816, 2816, 1024]
    - [6, 17207.0]
  - - [850, 2048, 1, 512, 850, 850, 850, 512]
    - [6, 14965.0]
  - - [660, 2048, 2, 512, 660, 660, 660, 512]
    - [22, 15234.0]
  - - [672, 2048, 2, 512, 672, 672, 672, 512]
    - [22, 15565.0]
  - - [13440, 128, 2, 512, 13440, 13440, 13440, 512]
    - [1, 18720.0]
  - - [726, 2048, 2, 512, 726, 726, 726, 512]
    - [35, 16764.0]
  - - [3500, 256, 2, 1024, 3500, 3500, 3500, 1024]
    - [6, 15762.0]
  - - [13824, 256, 2, 512, 13824, 13824, 13824, 512]
    - [1, 19944.0]
  - - [15200, 256, 2, 512, 15200, 15200, 15200, 512]
    - [1, 18732.0]
  - - [3700, 256, 2, 1024, 3700, 3700, 3700, 1024]
    - [35, 16540.0]
  - - [748, 2048, 2, 512, 748, 748, 748, 512]
    - [22, 17227.0]
  - - [3600, 256, 2, 1024, 3600, 3600, 3600, 1024]
    - [22, 16154.0]
  - - [4032, 1024, 2, 256, 4032, 4032, 4032, 256]
    - [7, 18363.0]
  - - [16128, 128, 2, 512, 16128, 16128, 16128, 512]
    - [31, 18767.0]
  - - [15200, 128, 1, 512, 15200, 15200, 15200, 512]
    - [0, 16770.0]
  - - [13600, 128, 1, 512, 13600, 13600, 13600, 512]
    - [2, 17266.0]
  - - [2904, 1024, 2, 256, 2904, 2904, 2904, 256]
    - [0, 17921.0]
  - - [2992, 1024, 2, 256, 2992, 2992, 2992, 256]
    - [1, 18338.0]
  - - [1536, 2048, 1, 1024, 1536, 1536, 1536, 1024]
    - [22, 18058.0]
  - - [24576, 128, 1, 256, 24576, 24576, 24576, 256]
    - [0, 17568.0]
  - - [24576, 512, 1, 256, 24576, 24576, 24576, 256]
    - [1, 19273.0]
  - - [25760, 128, 1, 256, 25760, 25760, 25760, 256]
    - [16, 16525.0]
  - - [25760, 512, 1, 256, 25760, 25760, 25760, 256]
    - [30, 19254.0]
  - - [6144, 256, 1, 512, 6144, 6144, 6144, 512]
    - [29, 16010.0]
  - - [6440, 256, 1, 512, 6440, 6440, 6440, 512]
    - [37, 16519.0]
  - - [3036, 1024, 2, 256, 3036, 3036, 3036, 256]
    - [7, 18183.0]
  - - [13600, 512, 1, 128, 13600, 13600, 13600, 128]
    - [7, 18072.0]
  - - [9408, 512, 2, 128, 9408, 9408, 9408, 128]
    - [0, 18355.0]
  - - [56000, 256, 2, 64, 56000, 56000, 56000, 64]
    - [0, 18040.0]
  - - [2852, 1024, 2, 256, 2852, 2852, 2852, 256]
    - [29, 17334.0]
  - - [2816, 1024, 2, 256, 2816, 2816, 2816, 256]
    - [30, 18788.0]
  - - [60800, 256, 1, 64, 60800, 60800, 60800, 64]
    - [29, 18454.0]
  - - [2944, 1024, 2, 256, 2944, 2944, 2944, 256]
    - [14, 18271.0]
  - - [11776, 512, 2, 128, 11776, 11776, 11776, 128]
    - [29, 18754.0]
  - - [11616, 512, 2, 128, 11616, 11616, 11616, 128]
    - [29, 18221.0]
  - - [4200, 1024, 2, 256, 4200, 4200, 4200, 256]
    - [1, 18756.0]
  - - [54400, 256, 1, 64, 54400, 54400, 54400, 64]
    - [14, 18234.0]
  - - [15200, 512, 1, 128, 15200, 15200, 15200, 128]
    - [29, 17687.0]
  - - [2688, 1024, 2, 256, 2688, 2688, 2688, 256]
    - [29, 18345.0]
  - - [12672, 512, 2, 128, 12672, 12672, 12672, 128]
    - [30, 19215.0]
  - - [11968, 512, 2, 128, 11968, 11968, 11968, 128]
    - [22, 18542.0]
  - - [46464, 256, 2, 64, 46464, 46464, 46464, 64]
    - [29, 18686.0]
  - - [2400, 256, 2, 1024, 2400, 2400, 2400, 1024]
    - [35, 14641.0]
  - - [2520, 256, 2, 1024, 2520, 2520, 2520, 1024]
    - [35, 15406.0]
  - - [2400, 1024, 2, 256, 2400, 2400, 2400, 256]
    - [14, 18074.0]
  - - [10752, 128, 2, 512, 10752, 10752, 10752, 512]
    - [36, 17629.0]
  - - [45632, 256, 2, 64, 45632, 45632, 45632, 64]
    - [35, 18191.0]
  - - [2520, 1024, 2, 256, 2520, 2520, 2520, 256]
    - [1, 18401.0]
  - - [53760, 256, 2, 64, 53760, 53760, 53760, 64]
    - [0, 18266.0]
  - - [2352, 256, 2, 1024, 2352, 2352, 2352, 1024]
    - [35, 14352.0]
  - - [47872, 256, 2, 64, 47872, 47872, 47872, 64]
    - [35, 18472.0]
  - - [47104, 256, 2, 64, 47104, 47104, 47104, 64]
    - [35, 18472.0]
  - - [50688, 256, 2, 64, 50688, 50688, 50688, 64]
    - [35, 18541.0]
  - - [45056, 256, 2, 64, 45056, 45056, 45056, 64]
    - [35, 18441.0]
  - - [13440, 512, 2, 128, 13440, 13440, 13440, 128]
    - [36, 18926.0]
  - - [2352, 1024, 2, 256, 2352, 2352, 2352, 256]
    - [6, 17526.0]
  - - [11264, 512, 2, 128, 11264, 11264, 11264, 128]
    - [1, 18741.0]
  - - [10560, 128, 2, 512, 10560, 10560, 10560, 512]
    - [14, 16700.0]
  - - [16128, 512, 2, 128, 16128, 16128, 16128, 128]
    - [1, 19200.0]
  - - [37632, 256, 2, 64, 37632, 37632, 37632, 64]
    - [29, 18399.0]
  - - [51520, 256, 2, 64, 51520, 51520, 51520, 64]
    - [35, 18204.0]
  - - [14000, 512, 2, 128, 14000, 14000, 14000, 128]
    - [1, 18461.0]
  - - [10560, 512, 2, 128, 10560, 10560, 10560, 128]
    - [6, 18470.0]
  - - [64512, 256, 2, 64, 64512, 64512, 64512, 64]
    - [0, 17273.0]
  - - [54400, 256, 2, 64, 54400, 54400, 54400, 64]
    - [14, 18491.0]
  - - [3264, 1024, 2, 256, 3264, 3264, 3264, 256]
    - [1, 18109.0]
  - - [10752, 512, 2, 128, 10752, 10752, 10752, 128]
    - [7, 18686.0]
  - - [3168, 1024, 2, 256, 3168, 3168, 3168, 256]
    - [1, 17906.0]
  - - [950, 2048, 1, 512, 950, 950, 950, 512]
    - [7, 15079.0]
  - - [55296, 256, 2, 256, 55296, 55296, 55296, 256]
    - [39, 19461.0]
  - - [51520, 256, 2, 256, 51520, 51520, 51520, 256]
    - [33, 19313.0]
  - - [11408, 128, 2, 512, 11408, 11408, 11408, 512]
    - [16, 17925.0]
  - - [60800, 256, 2, 256, 60800, 60800, 60800, 256]
    - [33, 19690.0]
  - - [54400, 256, 2, 256, 54400, 54400, 54400, 256]
    - [33, 19412.0]
  - - [3700, 1024, 2, 256, 3700, 3700, 3700, 256]
    - [7, 18563.0]
  - - [60800, 256, 2, 64, 60800, 60800, 60800, 64]
    - [1, 16121.0]
  - - [3800, 1024, 1, 256, 3800, 3800, 3800, 256]
    - [6, 17104.0]
  - - [3400, 1024, 1, 256, 3400, 3400, 3400, 256]
    - [2, 17719.0]
  - - [3072, 1024, 2, 256, 3072, 3072, 3072, 256]
    - [1, 18772.0]
  - - [3600, 1024, 2, 256, 3600, 3600, 3600, 256]
    - [1, 18541.0]
  - - [12288, 512, 2, 128, 12288, 12288, 12288, 128]
    - [7, 18680.0]
  - - [49152, 256, 2, 256, 49152, 49152, 49152, 256]
    - [39, 19033.0]
  - - [12880, 512, 2, 128, 12880, 12880, 12880, 128]
    - [6, 18318.0]
  - - [11408, 512, 2, 128, 11408, 11408, 11408, 128]
    - [30, 18626.0]
  - - [42240, 256, 2, 64, 42240, 42240, 42240, 64]
    - [22, 18465.0]
  - - [1008, 2048, 2, 512, 1008, 1008, 1008, 512]
    - [22, 17404.0]
  - - [3360, 1024, 2, 256, 3360, 3360, 3360, 256]
    - [1, 18630.0]
  - - [14208, 512, 2, 128, 14208, 14208, 14208, 128]
    - [36, 19151.0]
  - - [56832, 256, 2, 64, 56832, 56832, 56832, 64]
    - [0, 17944.0]
  - - [43008, 256, 2, 64, 43008, 43008, 43008, 64]
    - [14, 18170.0]
  - - [13600, 512, 2, 128, 13600, 13600, 13600, 128]
    - [0, 18538.0]
  - - [3500, 1024, 2, 256, 3500, 3500, 3500, 256]
    - [14, 18179.0]
  - - [2640, 1024, 2, 256, 2640, 2640, 2640, 256]
    - [0, 17897.0]
  - - [13824, 512, 2, 128, 13824, 13824, 13824, 128]
    - [1, 19105.0]
  - - [3800, 256, 2, 1024, 3800, 3800, 3800, 1024]
    - [22, 16976.0]
  - - [55296, 256, 2, 64, 55296, 55296, 55296, 64]
    - [0, 17781.0]
  - - [2640, 256, 2, 1024, 2640, 2640, 2640, 1024]
    - [35, 16046.0]
  - - [15200, 512, 2, 128, 15200, 15200, 15200, 128]
    - [1, 18960.0]
  - - [3552, 1024, 2, 256, 3552, 3552, 3552, 256]
    - [1, 18545.0]
  - - [3220, 1024, 2, 256, 3220, 3220, 3220, 256]
    - [7, 17960.0]
  - - [3456, 1024, 2, 256, 3456, 3456, 3456, 256]
    - [1, 19446.0]
  - - [49152, 256, 2, 64, 49152, 49152, 49152, 64]
    - [35, 18352.0]
  - - [3400, 1024, 2, 256, 3400, 3400, 3400, 256]
    - [36, 18392.0]
  - - [950, 2048, 2, 512, 950, 950, 950, 512]
    - [22, 16403.0]
  - - [3800, 1024, 2, 256, 3800, 3800, 3800, 256]
    - [6, 18198.0]
  - - [1610, 2048, 1, 1024, 1610, 1610, 1610, 1024]
    - [7, 17870.0]
  - - [6912, 256, 1, 512, 6912, 6912, 6912, 512]
    - [0, 17799.0]
  - - [6800, 256, 1, 512, 6800, 6800, 6800, 512]
    - [31, 17469.0]
  - - [27648, 128, 1, 256, 27648, 27648, 27648, 256]
    - [7, 18429.0]
  - - [27200, 128, 1, 256, 27200, 27200, 27200, 256]
    - [2, 17449.0]
  - - [30400, 128, 1, 256, 30400, 30400, 30400, 256]
    - [8, 17022.0]
  - - [7600, 256, 1, 512, 7600, 7600, 7600, 512]
    - [0, 16907.0]
  - - [6144, 1024, 1, 512, 6144, 6144, 6144, 512]
    - [1, 19243.0]
  - - [6912, 1024, 1, 512, 6912, 6912, 6912, 512]
    - [1, 19922.0]
  - - [6440, 1024, 1, 512, 6440, 6440, 6440, 512]
    - [7, 18412.0]
  - - [27648, 512, 1, 256, 27648, 27648, 27648, 256]
    - [1, 19855.0]
  - - [1728, 2048, 1, 1024, 1728, 1728, 1728, 1024]
    - [35, 17248.0]
  - - [27200, 512, 1, 256, 27200, 27200, 27200, 256]
    - [23, 19391.0]
  - - [6800, 1024, 1, 512, 6800, 6800, 6800, 512]
    - [36, 19263.0]
  - - [1700, 2048, 1, 1024, 1700, 1700, 1700, 1024]
    - [22, 16996.0]
  - - [7600, 1024, 1, 512, 7600, 7600, 7600, 512]
    - [1, 18709.0]
  - - [30400, 512, 1, 256, 30400, 30400, 30400, 256]
    - [30, 19392.0]
  - - [1900, 2048, 1, 1024, 1900, 1900, 1900, 1024]
    - [7, 18320.0]
  - - [12544, 1024, 1, 1024, 12544, 12544, 12544, 1024]
    - [7, 20212.0]
  - - [1024, 1024, 160, 96, 1024, 1024, 1024, 96]
    - [0, 15577.0]
  - - [1920, 16384, 1, 25216, 1920, 1920, 1920, 25216]
    - [15, 20419.0]
  - - [3840, 16384, 1, 1920, 3840, 3840, 3840, 1920]
    - [1, 20820.0]
  - - [1920, 16384, 1, 3840, 1920, 1920, 1920, 3840]
    - [23, 20481.0]
  - - [960, 16384, 1, 1920, 960, 960, 960, 1920]
    - [1, 18944.0]
  - - [1920, 16384, 1, 2880, 1920, 1920, 1920, 2880]
    - [15, 20579.0]
  - - [1024, 1024, 40, 96, 1024, 1024, 1024, 96]
    - [0, 18943.0]
  - - [1920, 4096, 1, 25216, 1920, 1920, 1920, 25216]
    - [21, 19521.0]
  - - [3840, 4096, 1, 1920, 3840, 3840, 3840, 1920]
    - [15, 20370.0]
  - - [1920, 4096, 1, 3840, 1920, 1920, 1920, 3840]
    - [34, 19406.0]
  - - [960, 4096, 1, 1920, 960, 960, 960, 1920]
    - [0, 16905.0]
  - - [1920, 4096, 1, 2880, 1920, 1920, 1920, 2880]
    - [15, 19488.0]
  - - [1024, 1024, 80, 96, 1024, 1024, 1024, 96]
    - [0, 17042.0]
  - - [1920, 8192, 1, 25216, 1920, 1920, 1920, 25216]
    - [30, 20302.0]
  - - [3840, 8192, 1, 1920, 3840, 3840, 3840, 1920]
    - [1, 20567.0]
  - - [1920, 8192, 1, 3840, 1920, 1920, 1920, 3840]
    - [23, 20240.0]
  - - [960, 8192, 1, 1920, 960, 960, 960, 1920]
    - [1, 18158.0]
  - - [1920, 8192, 1, 2880, 1920, 1920, 1920, 2880]
    - [30, 20424.0]
  - - [1024, 1024, 96, 96, 1024, 1024, 1024, 96]
    - [0, 16137.0]
  - - [2304, 16384, 1, 12672, 2304, 2304, 2304, 12672]
    - [30, 20788.0]
  - - [2304, 16384, 1, 2304, 2304, 2304, 2304, 2304]
    - [1, 20752.0]
  - - [576, 16384, 1, 2304, 576, 576, 576, 2304]
    - [36, 18039.0]
  - - [2304, 16384, 1, 1728, 2304, 2304, 2304, 1728]
    - [15, 20802.0]
  - - [1024, 1024, 24, 96, 1024, 1024, 1024, 96]
    - [7, 18960.0]
  - - [2304, 4096, 1, 12672, 2304, 2304, 2304, 12672]
    - [21, 20538.0]
  - - [2304, 4096, 1, 2304, 2304, 2304, 2304, 2304]
    - [1, 20427.0]
  - - [576, 4096, 1, 2304, 576, 576, 576, 2304]
    - [35, 16478.0]
  - - [2304, 4096, 1, 1728, 2304, 2304, 2304, 1728]
    - [30, 20490.0]
  - - [1024, 1024, 48, 96, 1024, 1024, 1024, 96]
    - [0, 19033.0]
  - - [2304, 8192, 1, 12672, 2304, 2304, 2304, 12672]
    - [15, 20660.0]
  - - [2304, 8192, 1, 2304, 2304, 2304, 2304, 2304]
    - [1, 20627.0]
  - - [576, 8192, 1, 2304, 576, 576, 576, 2304]
    - [7, 17833.0]
  - - [2304, 8192, 1, 1728, 2304, 2304, 2304, 1728]
    - [30, 20693.0]
  - - [1024, 1024, 16, 96, 1024, 1024, 1024, 96]
    - [35, 18715.0]
  - - [3072, 4096, 1, 6400, 3072, 3072, 3072, 6400]
    - [1, 19978.0]
  - - [1536, 4096, 1, 3072, 1536, 1536, 1536, 3072]
    - [36, 19626.0]
  - - [3072, 4096, 1, 1536, 3072, 3072, 3072, 1536]
    - [7, 19833.0]
  - - [384, 4096, 1, 3072, 384, 384, 384, 3072]
    - [37, 16667.0]
  - - [3072, 4096, 1, 1152, 3072, 3072, 3072, 1152]
    - [1, 19907.0]
  - - [1024, 1024, 32, 96, 1024, 1024, 1024, 96]
    - [0, 19018.0]
  - - [3072, 8192, 1, 6400, 3072, 3072, 3072, 6400]
    - [15, 20639.0]
  - - [1536, 8192, 1, 3072, 1536, 1536, 1536, 3072]
    - [23, 19861.0]
  - - [3072, 8192, 1, 1536, 3072, 3072, 3072, 1536]
    - [1, 20435.0]
  - - [384, 8192, 1, 3072, 384, 384, 384, 3072]
    - [22, 18263.0]
  - - [3072, 8192, 1, 1152, 3072, 3072, 3072, 1152]
    - [1, 20538.0]
  - - [2048, 4096, 1, 2048, 2048, 2048, 2048, 2048]
    - [7, 19307.0]
  - - [2048, 4096, 1, 4096, 2048, 2048, 2048, 4096]
    - [7, 19387.0]
  - - [4096, 4096, 1, 2048, 4096, 4096, 4096, 2048]
    - [7, 20271.0]
  - - [1024, 2283, 1, 29000, 1024, 1024, 1024, 29000]
    - [21, 19758.0]
  - - [1024, 2296, 1, 29000, 1024, 1024, 1024, 29000]
    - [21, 19859.0]
  - - [1024, 2306, 1, 29000, 1024, 1024, 1024, 29000]
    - [29, 16661.0]
  - - [1024, 2309, 1, 29000, 1024, 1024, 1024, 29000]
    - [29, 16675.0]
  - - [1024, 2318, 1, 29000, 1024, 1024, 1024, 29000]
    - [0, 16652.0]
  - - [1024, 2320, 1, 29000, 1024, 1024, 1024, 29000]
    - [29, 16778.0]
  - - [1024, 2324, 1, 29000, 1024, 1024, 1024, 29000]
    - [0, 16697.0]
  - - [1024, 2325, 1, 29000, 1024, 1024, 1024, 29000]
    - [29, 16811.0]
  - - [1024, 2329, 1, 29000, 1024, 1024, 1024, 29000]
    - [29, 16811.0]
  - - [1024, 2338, 1, 29000, 1024, 1024, 1024, 29000]
    - [14, 16851.0]
  - - [1024, 2345, 1, 29000, 1024, 1024, 1024, 29000]
    - [29, 16872.0]
  - - [1024, 2350, 1, 29000, 1024, 1024, 1024, 29000]
    - [29, 16942.0]
  - - [1024, 2362, 1, 29000, 1024, 1024, 1024, 29000]
    - [29, 17034.0]
  - - [1024, 2366, 1, 29000, 1024, 1024, 1024, 29000]
    - [29, 17058.0]
  - - [1024, 2368, 1, 29000, 1024, 1024, 1024, 29000]
    - [29, 17078.0]
  - - [1024, 2374, 1, 29000, 1024, 1024, 1024, 29000]
    - [14, 17043.0]
  - - [1024, 2390, 1, 29000, 1024, 1024, 1024, 29000]
    - [0, 17194.0]
  - - [512, 512, 320, 64, 512, 512, 512, 64]
    - [0, 11745.0]
  - - [512, 512, 80, 64, 512, 512, 512, 64]
    - [29, 18261.0]
  - - [2560, 1024, 1, 2560, 2560, 2560, 2560, 2560]
    - [29, 18376.0]
  - - [2560, 1024, 1, 4096, 2560, 2560, 2560, 4096]
    - [35, 18366.0]
  - - [4096, 1024, 1, 2560, 4096, 4096, 4096, 2560]
    - [29, 18069.0]
  - - [1024, 1024, 512, 64, 1024, 1024, 1024, 64]
    - [10, 11048.0]
  - - [1024, 32768, 1, 3072, 1024, 1024, 1024, 3072]
    - [23, 20474.0]
  - - [1024, 32768, 1, 4096, 1024, 1024, 1024, 4096]
    - [23, 20480.0]
  - - [1024, 32768, 1, 50304, 1024, 1024, 1024, 50304]
    - [5, 20019.0]
  - - [4096, 32768, 1, 1024, 4096, 4096, 4096, 1024]
    - [1, 20636.0]
  - - [1024, 1024, 24, 128, 1024, 1024, 1024, 128]
    - [7, 19319.0]
  - - [128, 1024, 24, 1024, 128, 128, 128, 1024]
    - [10, 17305.0]
  - - [768, 320, 1, 30522, 768, 768, 768, 30522]
    - [45, 14933.0]
  - - [768, 640, 1, 30522, 768, 768, 768, 30522]
    - [44, 17346.0]
  - - [768, 1280, 1, 30522, 768, 768, 768, 30522]
    - [42, 18790.0]
  - - [1024, 780, 1, 30522, 1024, 1024, 1024, 30522]
    - [41, 16895.0]
  - - [1024, 308, 1, 30522, 1024, 1024, 1024, 30522]
    - [41, 15189.0]
  - - [1024, 800, 1, 30522, 1024, 1024, 1024, 30522]
    - [41, 17301.0]
  - - [1024, 820, 1, 30522, 1024, 1024, 1024, 30522]
    - [41, 17714.0]
  - - [1024, 385, 1, 30522, 1024, 1024, 1024, 30522]
    - [41, 14103.0]
  - - [1024, 462, 1, 30522, 1024, 1024, 1024, 30522]
    - [43, 15459.0]
  - - [1024, 640, 1, 30528, 1024, 1024, 1024, 30528]
    - [41, 17997.0]
  - - [2048, 199, 1, 29000, 2048, 2048, 2048, 29000]
    - [50, 13362.0]
  - - [2048, 221, 1, 29000, 2048, 2048, 2048, 29000]
    - [48, 14728.0]
  - - [2048, 224, 1, 29000, 2048, 2048, 2048, 29000]
    - [46, 14916.0]
  - - [2048, 229, 1, 29000, 2048, 2048, 2048, 29000]
    - [51, 15324.0]
  - - [2048, 234, 1, 29000, 2048, 2048, 2048, 29000]
    - [51, 15627.0]
  - - [2048, 242, 1, 29000, 2048, 2048, 2048, 29000]
    - [51, 16153.0]
  - - [2048, 246, 1, 29000, 2048, 2048, 2048, 29000]
    - [43, 16322.0]
  - - [2048, 247, 1, 29000, 2048, 2048, 2048, 29000]
    - [43, 16495.0]
  - - [2048, 256, 1, 29000, 2048, 2048, 2048, 29000]
    - [50, 17074.0]
  - - [2048, 262, 1, 29000, 2048, 2048, 2048, 29000]
    - [47, 14545.0]
  - - [2048, 264, 1, 29000, 2048, 2048, 2048, 29000]
    - [47, 14663.0]
  - - [2048, 265, 1, 29000, 2048, 2048, 2048, 29000]
    - [47, 14717.0]
  - - [2048, 274, 1, 29000, 2048, 2048, 2048, 29000]
    - [47, 15173.0]
  - - [2048, 277, 1, 29000, 2048, 2048, 2048, 29000]
    - [49, 15283.0]
  - - [2048, 279, 1, 29000, 2048, 2048, 2048, 29000]
    - [47, 15493.0]
  - - [2048, 288, 1, 29000, 2048, 2048, 2048, 29000]
    - [47, 15913.0]
  - - [2048, 296, 1, 29000, 2048, 2048, 2048, 29000]
    - [47, 16362.0]
  - - [2048, 315, 1, 29000, 2048, 2048, 2048, 29000]
    - [47, 17415.0]
  - - [2048, 335, 1, 29000, 2048, 2048, 2048, 29000]
    - [47, 15590.0]
  - - [1024, 561, 1, 29000, 1024, 1024, 1024, 29000]
    - [41, 17854.0]
  - - [1024, 574, 1, 29000, 1024, 1024, 1024, 29000]
    - [41, 18251.0]
  - - [1024, 600, 1, 29000, 1024, 1024, 1024, 29000]
    - [41, 16932.0]
  - - [1024, 608, 1, 29000, 1024, 1024, 1024, 29000]
    - [41, 17133.0]
  - - [1024, 615, 1, 29000, 1024, 1024, 1024, 29000]
    - [41, 17301.0]
  - - [1024, 622, 1, 29000, 1024, 1024, 1024, 29000]
    - [41, 17508.0]
  - - [1024, 625, 1, 29000, 1024, 1024, 1024, 29000]
    - [41, 17567.0]
  - - [1024, 626, 1, 29000, 1024, 1024, 1024, 29000]
    - [41, 17611.0]
  - - [1024, 628, 1, 29000, 1024, 1024, 1024, 29000]
    - [41, 17679.0]
  - - [1024, 636, 1, 29000, 1024, 1024, 1024, 29000]
    - [41, 17878.0]
  - - [1024, 651, 1, 29000, 1024, 1024, 1024, 29000]
    - [41, 16769.0]
  - - [1024, 658, 1, 29000, 1024, 1024, 1024, 29000]
    - [41, 16997.0]
  - - [1024, 669, 1, 29000, 1024, 1024, 1024, 29000]
    - [41, 17232.0]
  - - [1024, 670, 1, 29000, 1024, 1024, 1024, 29000]
    - [41, 17263.0]
  - - [1024, 672, 1, 29000, 1024, 1024, 1024, 29000]
    - [41, 17323.0]
  - - [1024, 684, 1, 29000, 1024, 1024, 1024, 29000]
    - [41, 17590.0]
  - - [1024, 716, 1, 29000, 1024, 1024, 1024, 29000]
    - [41, 16893.0]
  - - [1024, 730, 1, 29000, 1024, 1024, 1024, 29000]
    - [41, 17220.0]
  - - [1600, 512, 1, 1024, 1600, 1600, 1600, 1024]
    - [83, 14665.0]
  - - [1024, 512, 1, 1, 1024, 1024, 1024, 1]
    - [94, 213.0]
  - - [1024, 512, 1, 64, 1024, 1024, 1024, 64]
    - [53, 6765.0]
  - - [2048, 512, 1, 1, 2048, 2048, 2048, 1]
    - [94, 343.0]
  - - [768, 640, 1, 768, 768, 768, 768, 768]
    - [98, 12693.0]
  - - [768, 1024, 1, 2, 768, 768, 768, 2]
    - [94, 610.0]
  - - [768, 1024, 1, 768, 768, 768, 768, 768]
    - [98, 14796.0]
  - - [768, 1280, 1, 768, 768, 768, 768, 768]
    - [64, 14677.0]
  - - [768, 512, 1, 2, 768, 768, 768, 2]
    - [94, 371.0]
  - - [768, 512, 1, 768, 768, 768, 768, 768]
    - [97, 10471.0]
  - - [1024, 512, 1, 1024, 1024, 1024, 1024, 1024]
    - [106, 13571.0]
  - - [1024, 512, 1, 2, 1024, 1024, 1024, 2]
    - [94, 460.0]
  - - [64, 64, 768, 64, 64, 64, 64, 64]
    - [78, 9977.0]
  - - [64, 64, 96, 64, 64, 64, 64, 64]
    - [55, 5853.0]
  - - [704, 1024, 1, 128, 704, 704, 704, 128]
    - [74, 10185.0]
  - - [1024, 1024, 1, 3328, 1024, 1024, 1024, 3328]
    - [57, 16301.0]
  - - [1856, 448, 1, 3328, 1856, 1856, 1856, 3328]
    - [56, 16253.0]
  - - [128, 6784, 1, 3328, 128, 128, 128, 3328]
    - [107, 13500.0]
  - - [2368, 448, 1, 128, 2368, 2368, 2368, 128]
    - [54, 12435.0]
  - - [256, 4288, 1, 3328, 256, 256, 256, 3328]
    - [64, 16974.0]
  - - [704, 1856, 1, 3328, 704, 704, 704, 3328]
    - [98, 16065.0]
  - - [448, 1024, 1, 1280, 448, 448, 448, 1280]
    - [75, 12043.0]
  - - [256, 1408, 1, 3328, 256, 256, 256, 3328]
    - [82, 10102.0]
  - - [704, 1856, 1, 1280, 704, 704, 704, 1280]
    - [83, 15772.0]
  - - [128, 5056, 1, 128, 128, 128, 128, 128]
    - [98, 9350.0]
  - - [2368, 128, 1, 256, 2368, 2368, 2368, 256]
    - [55, 7334.0]
  - - [64, 5056, 1, 256, 64, 64, 64, 256]
    - [62, 7642.0]
  - - [256, 2944, 1, 256, 256, 256, 256, 256]
    - [63, 12643.0]
  - - [256, 1856, 1, 1280, 256, 256, 256, 1280]
    - [106, 12628.0]
  - - [4288, 256, 1, 256, 4288, 4288, 4288, 256]
    - [56, 14426.0]
  - - [2944, 128, 1, 128, 2944, 2944, 2944, 128]
    - [55, 7584.0]
  - - [5888, 64, 1, 3328, 5888, 5888, 5888, 3328]
    - [55, 10503.0]
  - - [2944, 256, 1, 3328, 2944, 2944, 2944, 3328]
    - [98, 14887.0]
  - - [1408, 448, 1, 1280, 1408, 1408, 1408, 1280]
    - [75, 12278.0]
  - - [1408, 704, 1, 3328, 1408, 1408, 1408, 3328]
    - [57, 15515.0]
  - - [1408, 256, 1, 1280, 1408, 1408, 1408, 1280]
    - [55, 9922.0]
  - - [3072, 128, 1, 1024, 3072, 3072, 3072, 1024]
    - [55, 10613.0]
  - - [6784, 64, 1, 256, 6784, 6784, 6784, 256]
    - [75, 9632.0]
  - - [2944, 256, 1, 256, 2944, 2944, 2944, 256]
    - [75, 12727.0]
  - - [704, 1408, 1, 3328, 704, 704, 704, 3328]
    - [64, 15355.0]
  - - [2944, 256, 1, 128, 2944, 2944, 2944, 128]
    - [98, 10913.0]
  - - [2368, 128, 1, 3328, 2368, 2368, 2368, 3328]
    - [105, 8581.0]
  - - [64, 193600, 1, 64, 64, 64, 64, 64]
    - [65, 13663.0]
  - - [448, 1408, 1, 256, 448, 448, 448, 256]
    - [63, 10246.0]
  - - [64, 5056, 1, 3328, 64, 64, 64, 3328]
    - [62, 9080.0]
  - - [512, 1500, 1, 2816, 512, 512, 512, 2816]
    - [98, 15031.0]
  - - [1024, 448, 1, 128, 1024, 1024, 1024, 128]
    - [54, 8133.0]
  - - [256, 3584, 1, 3328, 256, 256, 256, 3328]
    - [76, 14233.0]
  - - [256, 1408, 1, 256, 256, 256, 256, 256]
    - [105, 8419.0]
  - - [5056, 64, 1, 1280, 5056, 5056, 5056, 1280]
    - [55, 8900.0]
  - - [1024, 704, 1, 256, 1024, 1024, 1024, 256]
    - [63, 12077.0]
  - - [128, 4288, 1, 128, 128, 128, 128, 128]
    - [63, 9494.0]
  - - [3584, 256, 1, 128, 3584, 3584, 3584, 128]
    - [63, 11249.0]
  - - [448, 1024, 1, 256, 448, 448, 448, 256]
    - [61, 9754.0]
  - - [5888, 64, 1, 256, 5888, 5888, 5888, 256]
    - [74, 8818.0]
  - - [1856, 256, 1, 1280, 1856, 1856, 1856, 1280]
    - [75, 12311.0]
  - - [64, 5888, 1, 3328, 64, 64, 64, 3328]
    - [105, 10347.0]
  - - [448, 1856, 1, 128, 448, 448, 448, 128]
    - [54, 11543.0]
  - - [1024, 704, 1, 1280, 1024, 1024, 1024, 1280]
    - [56, 13897.0]
  - - [128, 5888, 1, 256, 128, 128, 128, 256]
    - [63, 12610.0]
  - - [704, 704, 1, 3328, 704, 704, 704, 3328]
    - [56, 13533.0]
  - - [704, 1408, 1, 1280, 704, 704, 704, 1280]
    - [64, 14973.0]
  - - [3584, 256, 1, 3328, 3584, 3584, 3584, 3328]
    - [99, 14469.0]
  - - [704, 1856, 1, 128, 704, 704, 704, 128]
    - [54, 13026.0]
  - - [128, 3584, 1, 3328, 128, 128, 128, 3328]
    - [83, 12531.0]
  - - [2944, 448, 1, 128, 2944, 2944, 2944, 128]
    - [75, 13883.0]
  - - [64, 193600, 1, 256, 64, 64, 64, 256]
    - [93, 9368.0]
  - - [128, 2944, 1, 1280, 128, 128, 128, 1280]
    - [82, 10099.0]
  - - [448, 2944, 1, 1280, 448, 448, 448, 1280]
    - [64, 13723.0]
  - - [3584, 128, 1, 256, 3584, 3584, 3584, 256]
    - [56, 10021.0]
  - - [448, 1408, 1, 3328, 448, 448, 448, 3328]
    - [56, 12420.0]
  - - [704, 1024, 1, 256, 704, 704, 704, 256]
    - [104, 11770.0]
  - - [256, 3584, 1, 256, 256, 256, 256, 256]
    - [63, 12480.0]
  - - [256, 2944, 1, 3328, 256, 256, 256, 3328]
    - [56, 14848.0]
  - - [448, 2368, 1, 128, 448, 448, 448, 128]
    - [54, 12504.0]
  - - [1408, 704, 1, 256, 1408, 1408, 1408, 256]
    - [98, 13512.0]
  - - [448, 2944, 1, 3328, 448, 448, 448, 3328]
    - [64, 13958.0]
  - - [64, 5888, 1, 256, 64, 64, 64, 256]
    - [66, 8302.0]
  - - [512, 1500, 1, 2048, 512, 512, 512, 2048]
    - [106, 14810.0]
  - - [6784, 128, 1, 3328, 6784, 6784, 6784, 3328]
    - [76, 13752.0]
  - - [704, 704, 1, 256, 704, 704, 704, 256]
    - [81, 10417.0]
  - - [448, 704, 1, 1280, 448, 448, 448, 1280]
    - [97, 8689.0]
  - - [1024, 448, 1, 3328, 1024, 1024, 1024, 3328]
    - [56, 12659.0]
  - - [2944, 128, 1, 256, 2944, 2944, 2944, 256]
    - [55, 9050.0]
  - - [1024, 1024, 1, 1280, 1024, 1024, 1024, 1280]
    - [76, 15967.0]
  - - [448, 1024, 1, 128, 448, 448, 448, 128]
    - [54, 8044.0]
  - - [448, 2368, 1, 3328, 448, 448, 448, 3328]
    - [58, 14354.0]
  - - [5056, 64, 1, 128, 5056, 5056, 5056, 128]
    - [55, 6680.0]
  - - [1024, 700, 1, 512, 1024, 1024, 1024, 512]
    - [98, 12577.0]
  - - [128, 6784, 1, 1280, 128, 128, 128, 1280]
    - [64, 13232.0]
  - - [1856, 256, 1, 256, 1856, 1856, 1856, 256]
    - [54, 10170.0]
  - - [128, 5888, 1, 1280, 128, 128, 128, 1280]
    - [83, 14424.0]
  - - [256, 4288, 1, 1280, 256, 256, 256, 1280]
    - [64, 16554.0]
  - - [256, 1856, 1, 128, 256, 256, 256, 128]
    - [98, 8470.0]
  - - [7680, 64, 1, 2560, 7680, 7680, 7680, 2560]
    - [98, 13510.0]
  - - [448, 1408, 1, 128, 448, 448, 448, 128]
    - [54, 9011.0]
  - - [6784, 128, 1, 256, 6784, 6784, 6784, 256]
    - [75, 12201.0]
  - - [704, 448, 1, 256, 704, 704, 704, 256]
    - [55, 7602.0]
  - - [704, 448, 1, 128, 704, 704, 704, 128]
    - [55, 6618.0]
  - - [704, 1408, 1, 128, 704, 704, 704, 128]
    - [54, 11792.0]
  - - [4288, 128, 1, 1280, 4288, 4288, 4288, 1280]
    - [107, 14222.0]
  - - [128, 2944, 1, 128, 128, 128, 128, 128]
    - [55, 7584.0]
  - - [128, 4288, 1, 256, 128, 128, 128, 256]
    - [63, 11651.0]
  - - [704, 448, 1, 3328, 704, 704, 704, 3328]
    - [74, 8886.0]
  - - [448, 2368, 1, 1280, 448, 448, 448, 1280]
    - [58, 14165.0]
  - - [64, 6784, 1, 3328, 64, 64, 64, 3328]
    - [65, 10578.0]
  - - [2944, 256, 1, 1280, 2944, 2944, 2944, 1280]
    - [75, 14550.0]
  - - [256, 2368, 1, 128, 256, 256, 256, 128]
    - [63, 8939.0]
  - - [1856, 704, 1, 256, 1856, 1856, 1856, 256]
    - [56, 14581.0]
  - - [1856, 448, 1, 1280, 1856, 1856, 1856, 1280]
    - [56, 15726.0]
  - - [128, 5888, 1, 128, 128, 128, 128, 128]
    - [98, 10648.0]
  - - [1024, 1024, 1, 256, 1024, 1024, 1024, 256]
    - [76, 14401.0]
  - - [704, 1856, 1, 256, 704, 704, 704, 256]
    - [83, 14368.0]
  - - [256, 2368, 1, 1280, 256, 256, 256, 1280]
    - [56, 11739.0]
  - - [2944, 448, 1, 256, 2944, 2944, 2944, 256]
    - [75, 14993.0]
  - - [1856, 448, 1, 128, 1856, 1856, 1856, 128]
    - [54, 11696.0]
  - - [2368, 128, 1, 1280, 2368, 2368, 2368, 1280]
    - [55, 8423.0]
  - - [64, 6784, 1, 256, 64, 64, 64, 256]
    - [61, 8590.0]
  - - [64, 5056, 1, 1280, 64, 64, 64, 1280]
    - [62, 8742.0]
  - - [3025, 64, 64, 64, 3025, 3025, 3025, 64]
    - [75, 16085.0]
  - - [2368, 256, 1, 1280, 2368, 2368, 2368, 1280]
    - [75, 11537.0]
  - - [2368, 448, 1, 1280, 2368, 2368, 2368, 1280]
    - [75, 15558.0]
  - - [128, 3584, 1, 256, 128, 128, 128, 256]
    - [63, 9902.0]
  - - [704, 448, 1, 1280, 704, 704, 704, 1280]
    - [55, 8723.0]
  - - [4288, 256, 1, 1280, 4288, 4288, 4288, 1280]
    - [99, 16613.0]
  - - [4288, 128, 1, 3328, 4288, 4288, 4288, 3328]
    - [56, 14999.0]
  - - [7680, 128, 1, 2560, 7680, 7680, 7680, 2560]
    - [76, 15379.0]
  - - [1408, 256, 1, 128, 1408, 1408, 1408, 128]
    - [55, 7442.0]
  - - [256, 1408, 1, 1280, 256, 256, 256, 1280]
    - [82, 9808.0]
  - - [6784, 64, 1, 3328, 6784, 6784, 6784, 3328]
    - [75, 12049.0]
  - - [128, 2944, 1, 3328, 128, 128, 128, 3328]
    - [105, 10581.0]
  - - [2944, 448, 1, 3328, 2944, 2944, 2944, 3328]
    - [75, 16288.0]
  - - [5888, 128, 1, 256, 5888, 5888, 5888, 256]
    - [56, 12561.0]
  - - [5056, 64, 1, 256, 5056, 5056, 5056, 256]
    - [55, 7785.0]
  - - [512, 1500, 1, 1536, 512, 512, 512, 1536]
    - [83, 14625.0]
  - - [128, 3584, 1, 1280, 128, 128, 128, 1280]
    - [63, 12117.0]
  - - [1024, 704, 1, 128, 1024, 1024, 1024, 128]
    - [56, 10438.0]
  - - [128, 5056, 1, 3328, 128, 128, 128, 3328]
    - [83, 12776.0]
  - - [1024, 1024, 1, 128, 1024, 1024, 1024, 128]
    - [56, 12614.0]
  - - [4288, 128, 1, 256, 4288, 4288, 4288, 256]
    - [54, 11593.0]
  - - [1408, 448, 1, 128, 1408, 1408, 1408, 128]
    - [75, 9323.0]
  - - [3584, 256, 1, 256, 3584, 3584, 3584, 256]
    - [75, 12601.0]
  - - [128, 2944, 1, 256, 128, 128, 128, 256]
    - [105, 8802.0]
  - - [128, 6784, 1, 128, 128, 128, 128, 128]
    - [63, 10667.0]
  - - [448, 1856, 1, 256, 448, 448, 448, 256]
    - [81, 13091.0]
  - - [3584, 128, 1, 3328, 3584, 3584, 3584, 3328]
    - [57, 12691.0]
  - - [5888, 128, 1, 3328, 5888, 5888, 5888, 3328]
    - [56, 14834.0]
  - - [1408, 704, 1, 1280, 1408, 1408, 1408, 1280]
    - [99, 15140.0]
  - - [448, 2944, 1, 256, 448, 448, 448, 256]
    - [104, 13747.0]
  - - [448, 2368, 1, 256, 448, 448, 448, 256]
    - [104, 13445.0]
  - - [64, 6784, 1, 1280, 64, 64, 64, 1280]
    - [104, 10368.0]
  - - [128, 2368, 1, 3328, 128, 128, 128, 3328]
    - [105, 8573.0]
  - - [5056, 64, 1, 3328, 5056, 5056, 5056, 3328]
    - [97, 9094.0]
  - - [64, 5888, 1, 128, 64, 64, 64, 128]
    - [62, 7537.0]
  - - [5056, 128, 1, 3328, 5056, 5056, 5056, 3328]
    - [56, 12680.0]
  - - [448, 704, 1, 256, 448, 448, 448, 256]
    - [97, 7532.0]
  - - [2944, 128, 1, 3328, 2944, 2944, 2944, 3328]
    - [76, 10565.0]
  - - [128, 5056, 1, 1280, 128, 128, 128, 1280]
    - [63, 12472.0]
  - - [704, 704, 1, 128, 704, 704, 704, 128]
    - [61, 8595.0]
  - - [2368, 128, 1, 128, 2368, 2368, 2368, 128]
    - [55, 6402.0]
  - - [5056, 128, 1, 128, 5056, 5056, 5056, 128]
    - [55, 9265.0]
  - - [448, 1024, 1, 3328, 448, 448, 448, 3328]
    - [83, 12516.0]
  - - [2368, 256, 1, 256, 2368, 2368, 2368, 256]
    - [54, 10237.0]
  - - [256, 2368, 1, 3328, 256, 256, 256, 3328]
    - [56, 11993.0]
  - - [256, 3584, 1, 128, 256, 256, 256, 128]
    - [98, 11402.0]
  - - [4288, 256, 1, 128, 4288, 4288, 4288, 128]
    - [54, 12844.0]
  - - [448, 1856, 1, 3328, 448, 448, 448, 3328]
    - [85, 14391.0]
  - - [2368, 256, 1, 128, 2368, 2368, 2368, 128]
    - [74, 8738.0]
  - - [256, 1856, 1, 256, 256, 256, 256, 256]
    - [63, 10239.0]
  - - [256, 2944, 1, 128, 256, 256, 256, 128]
    - [98, 10839.0]
  - - [1408, 256, 1, 3328, 1408, 1408, 1408, 3328]
    - [74, 10138.0]
  - - [2368, 448, 1, 256, 2368, 2368, 2368, 256]
    - [75, 13647.0]
  - - [4288, 256, 1, 3328, 4288, 4288, 4288, 3328]
    - [76, 17203.0]
  - - [1856, 704, 1, 128, 1856, 1856, 1856, 128]
    - [96, 13211.0]
  - - [4288, 128, 1, 128, 4288, 4288, 4288, 128]
    - [54, 9418.0]
  - - [6784, 64, 1, 1280, 6784, 6784, 6784, 1280]
    - [75, 11720.0]
  - - [3584, 128, 1, 128, 3584, 3584, 3584, 128]
    - [54, 8111.0]
  - - [256, 2368, 1, 256, 256, 256, 256, 256]
    - [63, 10318.0]
  - - [2944, 448, 1, 1280, 2944, 2944, 2944, 1280]
    - [98, 16118.0]
  - - [448, 1408, 1, 1280, 448, 448, 448, 1280]
    - [56, 12098.0]
  - - [448, 1856, 1, 1280, 448, 448, 448, 1280]
    - [61, 14363.0]
  - - [1856, 256, 1, 128, 1856, 1856, 1856, 128]
    - [54, 8308.0]
  - - [128, 2368, 1, 256, 128, 128, 128, 256]
    - [82, 7225.0]
  - - [5888, 64, 1, 1280, 5888, 5888, 5888, 1280]
    - [55, 10289.0]
  - - [1024, 448, 1, 1280, 1024, 1024, 1024, 1280]
    - [56, 12274.0]
  - - [128, 5056, 1, 256, 128, 128, 128, 256]
    - [63, 10928.0]
  - - [1856, 704, 1, 1280, 1856, 1856, 1856, 1280]
    - [98, 15826.0]
  - - [448, 2944, 1, 128, 448, 448, 448, 128]
    - [54, 13107.0]
  - - [1408, 256, 1, 256, 1408, 1408, 1408, 256]
    - [55, 8592.0]
  - - [2368, 448, 1, 3328, 2368, 2368, 2368, 3328]
    - [98, 15928.0]
  - - [128, 5888, 1, 3328, 128, 128, 128, 3328]
    - [63, 14740.0]
  - - [64, 5056, 1, 128, 64, 64, 64, 128]
    - [105, 6554.0]
  - - [64, 6784, 1, 128, 64, 64, 64, 128]
    - [62, 7410.0]
  - - [448, 704, 1, 128, 448, 448, 448, 128]
    - [55, 6596.0]
  - - [1408, 448, 1, 256, 1408, 1408, 1408, 256]
    - [56, 10794.0]
  - - [1408, 704, 1, 128, 1408, 1408, 1408, 128]
    - [75, 12223.0]
  - - [2368, 256, 1, 3328, 2368, 2368, 2368, 3328]
    - [98, 11943.0]
  - - [5888, 128, 1, 1280, 5888, 5888, 5888, 1280]
    - [56, 14507.0]
  - - [256, 3584, 1, 1280, 256, 256, 256, 1280]
    - [64, 13954.0]
  - - [256, 1408, 1, 128, 256, 256, 256, 128]
    - [55, 7187.0]
  - - [256, 4288, 1, 128, 256, 256, 256, 128]
    - [98, 13132.0]
  - - [5888, 128, 1, 128, 5888, 5888, 5888, 128]
    - [56, 10695.0]
  - - [1408, 448, 1, 3328, 1408, 1408, 1408, 3328]
    - [98, 12528.0]
  - - [704, 1024, 1, 1280, 704, 704, 704, 1280]
    - [56, 13822.0]
  - - [1856, 256, 1, 3328, 1856, 1856, 1856, 3328]
    - [56, 13019.0]
  - - [64, 5888, 1, 1280, 64, 64, 64, 1280]
    - [110, 9705.0]
  - - [6784, 64, 1, 128, 6784, 6784, 6784, 128]
    - [75, 7740.0]
  - - [704, 704, 1, 1280, 704, 704, 704, 1280]
    - [56, 12957.0]
  - - [128, 2368, 1, 1280, 128, 128, 128, 1280]
    - [105, 8372.0]
  - - [3584, 256, 1, 1280, 3584, 3584, 3584, 1280]
    - [76, 14153.0]
  - - [128, 4288, 1, 3328, 128, 128, 128, 3328]
    - [106, 15029.0]
  - - [3584, 128, 1, 1280, 3584, 3584, 3584, 1280]
    - [56, 12269.0]
  - - [5056, 128, 1, 1280, 5056, 5056, 5056, 1280]
    - [56, 12506.0]
  - - [256, 4288, 1, 256, 256, 256, 256, 256]
    - [63, 14759.0]
  - - [1024, 448, 1, 256, 1024, 1024, 1024, 256]
    - [56, 10055.0]
  - - [2944, 128, 1, 1280, 2944, 2944, 2944, 1280]
    - [55, 10324.0]
  - - [128, 2368, 1, 128, 128, 128, 128, 128]
    - [55, 6319.0]
  - - [256, 2944, 1, 1280, 256, 256, 256, 1280]
    - [63, 14485.0]
  - - [2560, 128, 1, 2560, 2560, 2560, 2560, 2560]
    - [105, 9156.0]
  - - [704, 1024, 1, 3328, 704, 704, 704, 3328]
    - [56, 14188.0]
  - - [128, 6784, 1, 256, 128, 128, 128, 256]
    - [63, 11913.0]
  - - [256, 1856, 1, 3328, 256, 256, 256, 3328]
    - [56, 13138.0]
  - - [6784, 128, 1, 128, 6784, 6784, 6784, 128]
    - [98, 10983.0]
  - - [128, 3584, 1, 128, 128, 128, 128, 128]
    - [75, 8066.0]
  - - [704, 1408, 1, 256, 704, 704, 704, 256]
    - [64, 13107.0]
  - - [4096, 128, 1, 4096, 4096, 4096, 4096, 4096]
    - [60, 14389.0]
  - - [5888, 64, 1, 128, 5888, 5888, 5888, 128]
    - [62, 7353.0]
  - - [5056, 128, 1, 256, 5056, 5056, 5056, 256]
    - [54, 10744.0]
  - - [6784, 128, 1, 1280, 6784, 6784, 6784, 1280]
    - [76, 13479.0]
  - - [1856, 448, 1, 256, 1856, 1856, 1856, 256]
    - [75, 13221.0]
  - - [1024, 704, 1, 3328, 1024, 1024, 1024, 3328]
    - [56, 14231.0]
  - - [128, 4288, 1, 1280, 128, 128, 128, 1280]
    - [63, 14408.0]
  - - [448, 704, 1, 3328, 448, 448, 448, 3328]
    - [97, 8868.0]
  - - [1856, 704, 1, 3328, 1856, 1856, 1856, 3328]
    - [75, 16096.0]
  - - [512, 1500, 1, 2560, 512, 512, 512, 2560]
    - [63, 14852.0]
  - - [3136, 64, 128, 64, 3136, 3136, 3136, 64]
    - [52, 9068.0]
  - - [3136, 64, 128, 256, 3136, 3136, 3136, 256]
    - [66, 10170.0]
  - - [3136, 64, 256, 64, 3136, 3136, 3136, 64]
    - [52, 6203.0]
  - - [3136, 64, 256, 256, 3136, 3136, 3136, 256]
    - [87, 10198.0]
  - - [1024, 512, 1, 2048, 1024, 1024, 1024, 2048]
    - [83, 13769.0]
  - - [4096, 256, 1, 2048, 4096, 4096, 4096, 2048]
    - [64, 16249.0]
  - - [2048, 256, 1, 4096, 2048, 2048, 2048, 4096]
    - [80, 14395.0]
  - - [512, 768, 1, 2048, 512, 512, 512, 2048]
    - [105, 10839.0]
  - - [2048, 256, 1, 1024, 2048, 2048, 2048, 1024]
    - [75, 13626.0]
  - - [2048, 200, 1, 512, 2048, 2048, 2048, 512]
    - [98, 9781.0]
  - - [4096, 200, 1, 1024, 4096, 4096, 4096, 1024]
    - [99, 12154.0]
  - - [2048, 200, 1, 4096, 2048, 2048, 2048, 4096]
    - [75, 11269.0]
  - - [2048, 512, 1, 1024, 2048, 2048, 2048, 1024]
    - [107, 15795.0]
  - - [1024, 1024, 1, 512, 1024, 1024, 1024, 512]
    - [76, 15140.0]
  - - [2048, 512, 1, 4096, 2048, 2048, 2048, 4096]
    - [57, 16260.0]
  - - [1024, 1024, 1, 4096, 1024, 1024, 1024, 4096]
    - [64, 16190.0]
  - - [4096, 200, 1, 2048, 4096, 4096, 4096, 2048]
    - [76, 12563.0]
  - - [2048, 200, 1, 1024, 2048, 2048, 2048, 1024]
    - [98, 10624.0]
  - - [1024, 768, 1, 512, 1024, 1024, 1024, 512]
    - [98, 14188.0]
  - - [2048, 200, 1, 2048, 2048, 2048, 2048, 2048]
    - [98, 11084.0]
  - - [2048, 256, 1, 2048, 2048, 2048, 2048, 2048]
    - [98, 14128.0]
  - - [512, 768, 1, 512, 512, 512, 512, 512]
    - [105, 9996.0]
  - - [4096, 256, 1, 4096, 4096, 4096, 4096, 4096]
    - [107, 16356.0]
  - - [1024, 512, 1, 512, 1024, 1024, 1024, 512]
    - [63, 12770.0]
  - - [1024, 1024, 1, 2048, 1024, 1024, 1024, 2048]
    - [64, 16067.0]
  - - [4096, 256, 1, 1024, 4096, 4096, 4096, 1024]
    - [64, 15855.0]
  - - [512, 768, 1, 1024, 512, 512, 512, 1024]
    - [82, 10574.0]
  - - [1024, 512, 1, 4096, 1024, 1024, 1024, 4096]
    - [80, 14428.0]
  - - [4096, 200, 1, 4096, 4096, 4096, 4096, 4096]
    - [76, 12831.0]
  - - [2048, 256, 1, 512, 2048, 2048, 2048, 512]
    - [56, 12943.0]
  - - [1024, 1024, 1, 1024, 1024, 1024, 1024, 1024]
    - [64, 15657.0]
  - - [4096, 192, 1, 2048, 4096, 4096, 4096, 2048]
    - [83, 15295.0]
  - - [5329, 64, 64, 160, 5329, 5329, 5329, 160]
    - [52, 8538.0]
  - - [1225, 64, 64, 384, 1225, 1225, 1225, 384]
    - [79, 16148.0]
  - - [4096, 320, 1, 1280, 4096, 4096, 4096, 1280]
    - [75, 15753.0]
  - - [4096, 192, 1, 1280, 4096, 4096, 4096, 1280]
    - [98, 15078.0]
  - - [1225, 96, 64, 384, 1225, 1225, 1225, 384]
    - [60, 12895.0]
  - - [4096, 320, 1, 2048, 4096, 4096, 4096, 2048]
    - [75, 15942.0]
  - - [4096, 256, 1, 1536, 4096, 4096, 4096, 1536]
    - [76, 16125.0]
  - - [64, 147, 432, 148, 64, 64, 64, 148]
    - [77, 10360.0]
  - - [64, 123, 528, 123, 64, 64, 64, 123]
    - [100, 11311.0]
  - - [64, 111, 576, 112, 64, 64, 64, 112]
    - [77, 11406.0]
  - - [64, 77, 816, 77, 64, 64, 64, 77]
    - [54, 8346.0]
  - - [64, 92, 688, 92, 64, 64, 64, 92]
    - [77, 9179.0]
  - - [64, 159, 400, 159, 64, 64, 64, 159]
    - [77, 11386.0]
  - - [64, 85, 752, 84, 64, 64, 64, 84]
    - [54, 8893.0]
  - - [64, 122, 528, 123, 64, 64, 64, 123]
    - [77, 11354.0]
  - - [64, 93, 688, 92, 64, 64, 64, 92]
    - [61, 9504.0]
  - - [64, 102, 624, 99, 64, 64, 64, 99]
    - [58, 9798.0]
  - - [64, 133, 480, 133, 64, 64, 64, 133]
    - [77, 9823.0]
  - - [64, 232, 272, 232, 64, 64, 64, 232]
    - [58, 12604.0]
  - - [64, 162, 400, 159, 64, 64, 64, 159]
    - [58, 11646.0]
  - - [64, 78, 816, 78, 64, 64, 64, 78]
    - [73, 8653.0]
  - - [64, 99, 624, 99, 64, 64, 64, 99]
    - [100, 9703.0]
  - - [64, 101, 624, 102, 64, 64, 64, 102]
    - [77, 9899.0]
  - - [64, 111, 576, 111, 64, 64, 64, 111]
    - [58, 10647.0]
  - - [64, 134, 480, 134, 64, 64, 64, 134]
    - [73, 11540.0]
  - - [64, 135, 480, 132, 64, 64, 64, 132]
    - [100, 9818.0]
  - - [64, 134, 480, 132, 64, 64, 64, 132]
    - [58, 9798.0]
  - - [64, 134, 480, 135, 64, 64, 64, 135]
    - [100, 9808.0]
  - - [64, 162, 400, 162, 64, 64, 64, 162]
    - [100, 11592.0]
  - - [64, 102, 624, 102, 64, 64, 64, 102]
    - [77, 9902.0]
  - - [64, 135, 480, 133, 64, 64, 64, 133]
    - [100, 9776.0]
  - - [64, 148, 432, 143, 64, 64, 64, 143]
    - [100, 10780.0]
  - - [64, 100, 624, 100, 64, 64, 64, 100]
    - [81, 9984.0]
  - - [64, 65, 992, 65, 64, 64, 64, 65]
    - [96, 7748.0]
  - - [64, 122, 528, 122, 64, 64, 64, 122]
    - [77, 11227.0]
  - - [64, 228, 272, 228, 64, 64, 64, 228]
    - [100, 12410.0]
  - - [64, 112, 576, 111, 64, 64, 64, 111]
    - [58, 10834.0]
  - - [64, 143, 432, 143, 64, 64, 64, 143]
    - [77, 10466.0]
  - - [64, 135, 480, 135, 64, 64, 64, 135]
    - [58, 9819.0]
  - - [64, 232, 272, 228, 64, 64, 64, 228]
    - [100, 12579.0]
  - - [64, 193, 320, 193, 64, 64, 64, 193]
    - [58, 10684.0]
  - - [64, 71, 896, 71, 64, 64, 64, 71]
    - [54, 8043.0]
  - - [64, 84, 752, 84, 64, 64, 64, 84]
    - [73, 8848.0]
  - - [64, 132, 480, 132, 64, 64, 64, 132]
    - [54, 10671.0]
  - - [64, 85, 752, 85, 64, 64, 64, 85]
    - [58, 8303.0]
  - - [64, 102, 624, 100, 64, 64, 64, 100]
    - [58, 10118.0]
  - - [64, 78, 816, 77, 64, 64, 64, 77]
    - [96, 8298.0]
  - - [64, 112, 576, 112, 64, 64, 64, 112]
    - [77, 11373.0]
  - - [64, 148, 432, 148, 64, 64, 64, 148]
    - [77, 10810.0]
  - - [64, 159, 400, 160, 64, 64, 64, 160]
    - [58, 11794.0]
  - - [64, 102, 624, 101, 64, 64, 64, 101]
    - [77, 9928.0]
  - - [64, 101, 624, 101, 64, 64, 64, 101]
    - [58, 9774.0]
  - - [64, 160, 400, 160, 64, 64, 64, 160]
    - [96, 13682.0]
  - - [64, 93, 688, 93, 64, 64, 64, 93]
    - [58, 9124.0]
  - - [64, 147, 432, 147, 64, 64, 64, 147]
    - [58, 10478.0]
  - - [64, 100, 624, 102, 64, 64, 64, 102]
    - [77, 9892.0]
  - - [64, 177, 352, 177, 64, 64, 64, 177]
    - [77, 12270.0]
  - - [500, 1024, 1, 512, 500, 500, 500, 512]
    - [106, 11926.0]
  - - [512, 1024, 1, 512, 512, 512, 512, 512]
    - [106, 12906.0]
  - - [200, 2048, 1, 512, 200, 200, 200, 512]
    - [83, 9602.0]
  - - [512, 2000, 1, 1024, 512, 512, 512, 1024]
    - [64, 15285.0]
  - - [512, 2048, 1, 512, 512, 512, 512, 512]
    - [84, 15064.0]
  - - [200, 2000, 1, 100, 200, 200, 200, 100]
    - [95, 6135.0]
  - - [200, 2000, 1, 1024, 200, 200, 200, 1024]
    - [83, 10235.0]
  - - [500, 1024, 1, 2048, 500, 500, 500, 2048]
    - [83, 13547.0]
  - - [512, 2048, 1, 100, 512, 512, 512, 100]
    - [98, 11625.0]
  - - [512, 2048, 1, 2000, 512, 512, 512, 2000]
    - [76, 16438.0]
  - - [200, 2000, 1, 10, 200, 200, 200, 10]
    - [94, 1538.0]
  - - [500, 2048, 1, 1024, 500, 500, 500, 1024]
    - [84, 15005.0]
  - - [500, 2000, 1, 10, 500, 500, 500, 10]
    - [101, 2475.0]
  - - [500, 2048, 1, 100, 500, 500, 500, 100]
    - [98, 10385.0]
  - - [512, 1024, 1, 500, 512, 512, 512, 500]
    - [98, 12838.0]
  - - [200, 2000, 1, 2000, 200, 200, 200, 2000]
    - [76, 10893.0]
  - - [500, 2048, 1, 2000, 500, 500, 500, 2000]
    - [99, 15832.0]
  - - [512, 2048, 1, 1024, 512, 512, 512, 1024]
    - [64, 15712.0]
  - - [512, 1024, 1, 100, 512, 512, 512, 100]
    - [98, 8066.0]
  - - [256, 2000, 1, 10, 256, 256, 256, 10]
    - [94, 2000.0]
  - - [512, 2000, 1, 100, 512, 512, 512, 100]
    - [98, 10870.0]
  - - [512, 2000, 1, 2048, 512, 512, 512, 2048]
    - [64, 15678.0]
  - - [500, 1024, 1, 500, 500, 500, 500, 500]
    - [56, 12179.0]
  - - [256, 2000, 1, 100, 256, 256, 256, 100]
    - [97, 7442.0]
  - - [512, 1024, 1, 2048, 512, 512, 512, 2048]
    - [83, 14154.0]
  - - [500, 2048, 1, 2048, 500, 500, 500, 2048]
    - [107, 15482.0]
  - - [200, 2048, 1, 10, 200, 200, 200, 10]
    - [94, 1600.0]
  - - [500, 2000, 1, 512, 500, 500, 500, 512]
    - [106, 13913.0]
  - - [500, 1024, 1, 1024, 500, 500, 500, 1024]
    - [106, 12984.0]
  - - [200, 2000, 1, 500, 200, 200, 200, 500]
    - [56, 9533.0]
  - - [256, 2048, 1, 100, 256, 256, 256, 100]
    - [98, 8017.0]
  - - [500, 2000, 1, 1024, 500, 500, 500, 1024]
    - [84, 14654.0]
  - - [256, 2048, 1, 1024, 256, 256, 256, 1024]
    - [106, 13633.0]
  - - [200, 2048, 1, 1024, 200, 200, 200, 1024]
    - [83, 10444.0]
  - - [512, 2048, 1, 500, 512, 512, 512, 500]
    - [76, 15447.0]
  - - [512, 2000, 1, 10, 512, 512, 512, 10]
    - [94, 2860.0]
  - - [500, 1024, 1, 2000, 500, 500, 500, 2000]
    - [76, 13921.0]
  - - [512, 2000, 1, 512, 512, 512, 512, 512]
    - [64, 14507.0]
  - - [500, 2000, 1, 2000, 500, 500, 500, 2000]
    - [76, 15497.0]
  - - [500, 1024, 1, 10, 500, 500, 500, 10]
    - [94, 1803.0]
  - - [256, 2048, 1, 10, 256, 256, 256, 10]
    - [94, 2081.0]
  - - [256, 2048, 1, 500, 256, 256, 256, 500]
    - [98, 12850.0]
  - - [256, 2048, 1, 2048, 256, 256, 256, 2048]
    - [106, 14150.0]
  - - [256, 2000, 1, 512, 256, 256, 256, 512]
    - [64, 11745.0]
  - - [512, 1024, 1, 2000, 512, 512, 512, 2000]
    - [99, 14523.0]
  - - [256, 2000, 1, 2000, 256, 256, 256, 2000]
    - [57, 13978.0]
  - - [256, 2048, 1, 2000, 256, 256, 256, 2000]
    - [76, 14515.0]
  - - [200, 2048, 1, 100, 200, 200, 200, 100]
    - [55, 6302.0]
  - - [200, 2000, 1, 2048, 200, 200, 200, 2048]
    - [63, 10650.0]
  - - [500, 2048, 1, 512, 500, 500, 500, 512]
    - [83, 14294.0]
  - - [500, 2000, 1, 500, 500, 500, 500, 500]
    - [99, 14180.0]
  - - [200, 2048, 1, 2048, 200, 200, 200, 2048]
    - [83, 10937.0]
  - - [200, 2048, 1, 500, 200, 200, 200, 500]
    - [98, 9761.0]
  - - [512, 2000, 1, 500, 512, 512, 512, 500]
    - [99, 14637.0]
  - - [200, 2048, 1, 2000, 200, 200, 200, 2000]
    - [76, 11143.0]
  - - [500, 1024, 1, 100, 500, 500, 500, 100]
    - [53, 7356.0]
  - - [512, 1024, 1, 10, 512, 512, 512, 10]
    - [94, 2016.0]
  - - [512, 1024, 1, 1024, 512, 512, 512, 1024]
    - [106, 13696.0]
  - - [500, 2048, 1, 10, 500, 500, 500, 10]
    - [112, 2522.0]
  - - [200, 2000, 1, 512, 200, 200, 200, 512]
    - [106, 9369.0]
  - - [256, 2000, 1, 500, 256, 256, 256, 500]
    - [98, 12075.0]
  - - [256, 2048, 1, 512, 256, 256, 256, 512]
    - [63, 12807.0]
  - - [256, 2000, 1, 2048, 256, 256, 256, 2048]
    - [83, 13628.0]
  - - [500, 2048, 1, 500, 500, 500, 500, 500]
    - [76, 14570.0]
  - - [256, 2000, 1, 1024, 256, 256, 256, 1024]
    - [106, 12952.0]
  - - [500, 2000, 1, 2048, 500, 500, 500, 2048]
    - [84, 15125.0]
  - - [512, 2000, 1, 2000, 512, 512, 512, 2000]
    - [64, 15869.0]
  - - [512, 2048, 1, 2048, 512, 512, 512, 2048]
    - [64, 16045.0]
  - - [512, 2048, 1, 10, 512, 512, 512, 10]
    - [94, 2962.0]
  - - [500, 2000, 1, 100, 500, 500, 500, 100]
    - [96, 9921.0]
  - - [1024, 1131, 1, 1024, 1024, 1024, 1024, 1024]
    - [107, 16822.0]
  - - [1024, 1102, 1, 1024, 1024, 1024, 1024, 1024]
    - [84, 16665.0]
  - - [1024, 774, 1, 1024, 1024, 1024, 1024, 1024]
    - [63, 14756.0]
  - - [4096, 128, 1, 2048, 4096, 4096, 4096, 2048]
    - [56, 14095.0]
  - - [4096, 128, 1, 3072, 4096, 4096, 4096, 3072]
    - [56, 14258.0]
  - - [1024, 1120, 1, 1024, 1024, 1024, 1024, 1024]
    - [84, 16878.0]
  - - [1024, 1015, 1, 1024, 1024, 1024, 1024, 1024]
    - [84, 15309.0]
  - - [1024, 992, 1, 1024, 1024, 1024, 1024, 1024]
    - [107, 14997.0]
  - - [1024, 950, 1, 1024, 1024, 1024, 1024, 1024]
    - [107, 14496.0]
  - - [1024, 1088, 1, 1024, 1024, 1024, 1024, 1024]
    - [84, 16505.0]
  - - [64, 128, 96, 128, 64, 64, 64, 128]
    - [108, 9514.0]
  - - [768, 1024, 1, 3072, 768, 768, 768, 3072]
    - [83, 15314.0]
  - - [768, 512, 1, 3072, 768, 768, 768, 3072]
    - [97, 10956.0]
  - - [64, 256, 192, 256, 64, 64, 64, 256]
    - [65, 13197.0]
  - - [64, 128, 384, 128, 64, 64, 64, 128]
    - [108, 11671.0]
  - - [64, 256, 96, 256, 64, 64, 64, 256]
    - [65, 11685.0]
  - - [6272, 112, 1, 512, 6272, 6272, 6272, 512]
    - [98, 12497.0]
  - - [2048, 320, 1, 1280, 2048, 2048, 2048, 1280]
    - [98, 12668.0]
  - - [5329, 64, 1, 448, 5329, 5329, 5329, 448]
    - [103, 8470.0]
  - - [784, 64, 32, 192, 784, 784, 784, 192]
    - [54, 14090.0]
  - - [6272, 64, 1, 480, 6272, 6272, 6272, 480]
    - [55, 10370.0]
  - - [6272, 64, 1, 512, 6272, 6272, 6272, 512]
    - [55, 10411.0]
  - - [6272, 160, 1, 528, 6272, 6272, 6272, 528]
    - [75, 12075.0]
  - - [289, 160, 32, 768, 289, 289, 289, 768]
    - [83, 11446.0]
  - - [5329, 64, 32, 160, 5329, 5329, 5329, 160]
    - [83, 12315.0]
  - - [5329, 96, 1, 576, 5329, 5329, 5329, 576]
    - [98, 8984.0]
  - - [1225, 64, 32, 288, 1225, 1225, 1225, 288]
    - [56, 16618.0]
  - - [289, 192, 32, 768, 289, 289, 289, 768]
    - [83, 13691.0]
  - - [2048, 448, 1, 1280, 2048, 2048, 2048, 1280]
    - [76, 13984.0]
  - - [3136, 64, 32, 64, 3136, 3136, 3136, 64]
    - [54, 15761.0]
  - - [6272, 128, 1, 528, 6272, 6272, 6272, 528]
    - [75, 14739.0]
  - - [6272, 96, 1, 480, 6272, 6272, 6272, 480]
    - [98, 10768.0]
  - - [2048, 448, 1, 2048, 2048, 2048, 2048, 2048]
    - [76, 14052.0]
  - - [784, 96, 32, 192, 784, 784, 784, 192]
    - [75, 11351.0]
  - - [1001, 512, 1, 4096, 1001, 1001, 1001, 4096]
    - [102, 13986.0]
  - - [2048, 192, 1, 1280, 2048, 2048, 2048, 1280]
    - [55, 10732.0]
  - - [1225, 64, 32, 256, 1225, 1225, 1225, 256]
    - [79, 15365.0]
  - - [2048, 256, 1, 1536, 2048, 2048, 2048, 1536]
    - [56, 14040.0]
  - - [6272, 128, 1, 512, 6272, 6272, 6272, 512]
    - [75, 14597.0]
  - - [1568, 384, 1, 832, 1568, 1568, 1568, 832]
    - [75, 11288.0]
  - - [1568, 256, 1, 832, 1568, 1568, 1568, 832]
    - [55, 10697.0]
  - - [1568, 192, 1, 832, 1568, 1568, 1568, 832]
    - [72, 8239.0]
  - - [289, 192, 32, 1024, 289, 289, 289, 1024]
    - [63, 13677.0]
  - - [1225, 64, 32, 384, 1225, 1225, 1225, 384]
    - [56, 16824.0]
  - - [2048, 320, 1, 2048, 2048, 2048, 2048, 2048]
    - [63, 12770.0]
  - - [2048, 384, 1, 1536, 2048, 2048, 2048, 1536]
    - [75, 15126.0]
  - - [5041, 96, 1, 576, 5041, 5041, 5041, 576]
    - [98, 8917.0]
  - - [6272, 192, 1, 480, 6272, 6272, 6272, 480]
    - [98, 14451.0]
  - - [5041, 192, 1, 720, 5041, 5041, 5041, 720]
    - [98, 13971.0]
  - - [289, 128, 32, 768, 289, 289, 289, 768]
    - [107, 12138.0]
  - - [12544, 64, 1, 147, 12544, 12544, 12544, 147]
    - [98, 11570.0]
  - - [6272, 160, 1, 512, 6272, 6272, 6272, 512]
    - [98, 12050.0]
  - - [1225, 64, 32, 192, 1225, 1225, 1225, 192]
    - [106, 15929.0]
  - - [784, 64, 32, 256, 784, 784, 784, 256]
    - [106, 13116.0]
  - - [6272, 144, 1, 512, 6272, 6272, 6272, 512]
    - [56, 10749.0]
  - - [8192, 192, 1, 1280, 8192, 8192, 8192, 1280]
    - [98, 16294.0]
  - - [8192, 192, 1, 2048, 8192, 8192, 8192, 2048]
    - [56, 16358.0]
  - - [65, 6400, 1, 1024, 65, 65, 65, 1024]
    - [63, 7712.0]
  - - [512, 1290, 1, 2048, 512, 512, 512, 2048]
    - [106, 12792.0]
  - - [512, 2205, 1, 2048, 512, 512, 512, 2048]
    - [64, 17203.0]
  - - [64, 512, 16, 512, 64, 64, 64, 512]
    - [108, 11120.0]
  - - [512, 600, 1, 2048, 512, 512, 512, 2048]
    - [105, 8490.0]
  - - [512, 644, 1, 512, 512, 512, 512, 512]
    - [82, 8341.0]
  - - [512, 644, 1, 2048, 512, 512, 512, 2048]
    - [82, 9093.0]
  - - [512, 668, 1, 2048, 512, 512, 512, 2048]
    - [82, 9450.0]
  - - [512, 714, 1, 512, 512, 512, 512, 512]
    - [105, 9175.0]
  - - [512, 714, 1, 2048, 512, 512, 512, 2048]
    - [105, 10079.0]
  - - [512, 720, 1, 512, 512, 512, 512, 512]
    - [82, 9261.0]
  - - [512, 720, 1, 2048, 512, 512, 512, 2048]
    - [105, 10156.0]
  - - [512, 722, 1, 2048, 512, 512, 512, 2048]
    - [105, 10187.0]
  - - [512, 781, 1, 512, 512, 512, 512, 512]
    - [105, 9997.0]
  - - [512, 781, 1, 2048, 512, 512, 512, 2048]
    - [82, 11031.0]
  - - [512, 848, 1, 2048, 512, 512, 512, 2048]
    - [83, 11654.0]
  - - [512, 872, 1, 2048, 512, 512, 512, 2048]
    - [83, 11999.0]
  - - [512, 936, 1, 512, 512, 512, 512, 512]
    - [106, 11360.0]
  - - [512, 936, 1, 2048, 512, 512, 512, 2048]
    - [83, 12836.0]
  - - [512, 980, 1, 512, 512, 512, 512, 512]
    - [64, 11541.0]
  - - [512, 980, 1, 2048, 512, 512, 512, 2048]
    - [106, 13422.0]
  - - [512, 1139, 1, 2048, 512, 512, 512, 2048]
    - [83, 15467.0]
  - - [512, 1184, 1, 2048, 512, 512, 512, 2048]
    - [83, 11706.0]
  - - [512, 1186, 1, 2048, 512, 512, 512, 2048]
    - [83, 11779.0]
  - - [512, 1232, 1, 512, 512, 512, 512, 512]
    - [106, 11245.0]
  - - [512, 1232, 1, 2048, 512, 512, 512, 2048]
    - [83, 12296.0]
  - - [512, 1279, 1, 2048, 512, 512, 512, 2048]
    - [83, 12717.0]
  - - [512, 1290, 1, 512, 512, 512, 512, 512]
    - [106, 11693.0]
  - - [512, 1327, 1, 2048, 512, 512, 512, 2048]
    - [83, 13152.0]
  - - [512, 1331, 1, 2048, 512, 512, 512, 2048]
    - [106, 13117.0]
  - - [512, 1341, 1, 2048, 512, 512, 512, 2048]
    - [83, 13293.0]
  - - [512, 1350, 1, 512, 512, 512, 512, 512]
    - [106, 12297.0]
  - - [512, 1350, 1, 2048, 512, 512, 512, 2048]
    - [83, 13441.0]
  - - [512, 1359, 1, 2048, 512, 512, 512, 2048]
    - [106, 13438.0]
  - - [512, 1391, 1, 2048, 512, 512, 512, 2048]
    - [83, 13783.0]
  - - [512, 1424, 1, 512, 512, 512, 512, 512]
    - [106, 12881.0]
  - - [512, 1424, 1, 2048, 512, 512, 512, 2048]
    - [63, 14102.0]
  - - [512, 1458, 1, 512, 512, 512, 512, 512]
    - [106, 13189.0]
  - - [512, 1458, 1, 2048, 512, 512, 512, 2048]
    - [106, 14404.0]
  - - [512, 1462, 1, 512, 512, 512, 512, 512]
    - [106, 13161.0]
  - - [512, 1462, 1, 2048, 512, 512, 512, 2048]
    - [106, 14419.0]
  - - [512, 1467, 1, 2048, 512, 512, 512, 2048]
    - [83, 14436.0]
  - - [512, 1472, 1, 2048, 512, 512, 512, 2048]
    - [106, 14592.0]
  - - [512, 1520, 1, 512, 512, 512, 512, 512]
    - [106, 13683.0]
  - - [512, 1520, 1, 2048, 512, 512, 512, 2048]
    - [83, 14982.0]
  - - [512, 1596, 1, 512, 512, 512, 512, 512]
    - [63, 14144.0]
  - - [512, 1596, 1, 2048, 512, 512, 512, 2048]
    - [83, 15667.0]
  - - [512, 1599, 1, 512, 512, 512, 512, 512]
    - [63, 14057.0]
  - - [512, 1599, 1, 2048, 512, 512, 512, 2048]
    - [63, 15687.0]
  - - [512, 1615, 1, 512, 512, 512, 512, 512]
    - [63, 14351.0]
  - - [512, 1615, 1, 2048, 512, 512, 512, 2048]
    - [106, 15898.0]
  - - [512, 1680, 1, 512, 512, 512, 512, 512]
    - [84, 12343.0]
  - - [512, 1680, 1, 2048, 512, 512, 512, 2048]
    - [107, 13263.0]
  - - [512, 1709, 1, 2048, 512, 512, 512, 2048]
    - [64, 13498.0]
  - - [512, 1890, 1, 512, 512, 512, 512, 512]
    - [84, 13724.0]
  - - [512, 1902, 1, 2048, 512, 512, 512, 2048]
    - [84, 14926.0]
  - - [512, 1917, 1, 512, 512, 512, 512, 512]
    - [84, 13798.0]
  - - [512, 1917, 1, 2048, 512, 512, 512, 2048]
    - [107, 14965.0]
  - - [512, 2076, 1, 2048, 512, 512, 512, 2048]
    - [107, 16240.0]
  - - [512, 2195, 1, 2048, 512, 512, 512, 2048]
    - [84, 17115.0]
  - - [512, 2205, 1, 512, 512, 512, 512, 512]
    - [107, 15906.0]
  - - [2048, 198, 1, 512, 2048, 2048, 2048, 512]
    - [75, 9684.0]
  - - [2048, 207, 1, 512, 2048, 2048, 2048, 512]
    - [75, 10124.0]
  - - [2048, 208, 1, 512, 2048, 2048, 2048, 512]
    - [75, 10144.0]
  - - [2048, 245, 1, 512, 2048, 2048, 2048, 512]
    - [83, 11489.0]
  - - [2048, 246, 1, 512, 2048, 2048, 2048, 512]
    - [75, 11588.0]
  - - [2048, 264, 1, 512, 2048, 2048, 2048, 512]
    - [56, 9652.0]
  - - [2048, 401, 1, 512, 2048, 2048, 2048, 512]
    - [76, 12202.0]
  - - [2048, 439, 1, 512, 2048, 2048, 2048, 512]
    - [99, 12981.0]
  - - [2048, 443, 1, 512, 2048, 2048, 2048, 512]
    - [99, 13056.0]
  - - [2048, 446, 1, 512, 2048, 2048, 2048, 512]
    - [76, 13100.0]
  - - [2048, 465, 1, 512, 2048, 2048, 2048, 512]
    - [98, 13650.0]
  - - [2048, 468, 1, 512, 2048, 2048, 2048, 512]
    - [98, 13662.0]
  - - [2048, 493, 1, 512, 2048, 2048, 2048, 512]
    - [75, 14124.0]
  - - [2048, 495, 1, 512, 2048, 2048, 2048, 512]
    - [98, 14346.0]
  - - [2048, 511, 1, 512, 2048, 2048, 2048, 512]
    - [98, 14720.0]
  - - [2048, 512, 1, 512, 2048, 2048, 2048, 512]
    - [76, 15366.0]
  - - [2048, 540, 1, 512, 2048, 2048, 2048, 512]
    - [63, 15328.0]
  - - [2048, 550, 1, 512, 2048, 2048, 2048, 512]
    - [63, 15545.0]
  - - [2048, 560, 1, 512, 2048, 2048, 2048, 512]
    - [63, 15785.0]
  - - [2048, 600, 1, 512, 2048, 2048, 2048, 512]
    - [98, 14266.0]
  - - [64, 64, 496, 64, 64, 64, 64, 64]
    - [78, 8930.0]
  - - [64, 65, 496, 64, 64, 64, 64, 64]
    - [54, 7208.0]
  - - [64, 65, 496, 65, 64, 64, 64, 65]
    - [96, 6978.0]
  - - [64, 70, 216, 70, 64, 64, 64, 70]
    - [54, 6733.0]
  - - [64, 71, 216, 71, 64, 64, 64, 71]
    - [54, 6805.0]
  - - [64, 78, 248, 77, 64, 64, 64, 77]
    - [96, 7530.0]
  - - [64, 80, 152, 80, 64, 64, 64, 80]
    - [73, 6540.0]
  - - [64, 93, 344, 93, 64, 64, 64, 93]
    - [55, 8082.0]
  - - [64, 102, 312, 102, 64, 64, 64, 102]
    - [55, 8744.0]
  - - [64, 122, 264, 122, 64, 64, 64, 122]
    - [78, 9717.0]
  - - [64, 122, 264, 123, 64, 64, 64, 123]
    - [59, 9752.0]
  - - [64, 123, 264, 123, 64, 64, 64, 123]
    - [78, 9877.0]
  - - [64, 512, 96, 512, 64, 64, 64, 512]
    - [108, 13916.0]
  - - [64, 512, 128, 512, 64, 64, 64, 512]
    - [69, 10857.0]
  - - [64, 128, 512, 128, 64, 64, 64, 128]
    - [108, 11312.0]
  - - [64, 512, 64, 512, 64, 64, 64, 512]
    - [65, 12477.0]
  - - [2048, 512, 1, 2048, 2048, 2048, 2048, 2048]
    - [64, 16076.0]
  - - [512, 1600, 1, 32, 512, 512, 512, 32]
    - [94, 6012.0]
  - - [512, 1600, 1, 512, 512, 512, 512, 512]
    - [63, 14842.0]
  - - [560, 1600, 1, 1024, 560, 560, 560, 1024]
    - [64, 13328.0]
  - - [1024, 512, 1, 3072, 1024, 1024, 1024, 3072]
    - [80, 14268.0]
  - - [64, 192, 64, 1280, 64, 64, 64, 1280]
    - [65, 13487.0]
  - - [64, 320, 64, 1280, 64, 64, 64, 1280]
    - [65, 12681.0]
  - - [64, 384, 64, 1280, 64, 64, 64, 1280]
    - [108, 10962.0]
  - - [64, 448, 64, 1280, 64, 64, 64, 1280]
    - [91, 10297.0]
  - - [64, 192, 64, 2048, 64, 64, 64, 2048]
    - [108, 12825.0]
  - - [64, 320, 64, 2048, 64, 64, 64, 2048]
    - [109, 8755.0]
  - - [64, 384, 64, 2048, 64, 64, 64, 2048]
    - [71, 8647.0]
  - - [64, 448, 64, 2048, 64, 64, 64, 2048]
    - [92, 8459.0]
  - - [1225, 64, 64, 192, 1225, 1225, 1225, 192]
    - [75, 17045.0]
  - - [1225, 64, 64, 256, 1225, 1225, 1225, 256]
    - [63, 17081.0]
  - - [1225, 64, 64, 288, 1225, 1225, 1225, 288]
    - [98, 17537.0]
  - - [5329, 80, 64, 64, 5329, 5329, 5329, 64]
    - [52, 7702.0]
  - - [3136, 64, 64, 64, 3136, 3136, 3136, 64]
    - [75, 16621.0]
  - - [3136, 64, 64, 256, 3136, 3136, 3136, 256]
    - [66, 10156.0]
  - - [64, 192, 32, 1280, 64, 64, 64, 1280]
    - [82, 10038.0]
  - - [64, 320, 32, 1280, 64, 64, 64, 1280]
    - [65, 11401.0]
  - - [64, 384, 32, 1280, 64, 64, 64, 1280]
    - [65, 13472.0]
  - - [64, 448, 32, 1280, 64, 64, 64, 1280]
    - [108, 12457.0]
  - - [64, 192, 32, 2048, 64, 64, 64, 2048]
    - [62, 10264.0]
  - - [64, 320, 32, 2048, 64, 64, 64, 2048]
    - [85, 11584.0]
  - - [64, 384, 32, 2048, 64, 64, 64, 2048]
    - [65, 13415.0]
  - - [64, 448, 32, 2048, 64, 64, 64, 2048]
    - [65, 12346.0]
  - - [5329, 80, 32, 64, 5329, 5329, 5329, 64]
    - [98, 10782.0]
  - - [3136, 64, 32, 256, 3136, 3136, 3136, 256]
    - [75, 17717.0]
  - - [196, 256, 32, 1024, 196, 196, 196, 1024]
    - [106, 12458.0]
  - - [256, 4096, 1, 4, 256, 256, 256, 4]
    - [94, 1371.0]
  - - [960, 1024, 1, 1024, 960, 960, 960, 1024]
    - [84, 14513.0]
  - - [768, 768, 1, 768, 768, 768, 768, 768]
    - [98, 15029.0]
  - - [768, 768, 1, 384, 768, 768, 768, 384]
    - [98, 13895.0]
  - - [100, 128, 120, 512, 100, 100, 100, 512]
    - [106, 12888.0]
  - - [100, 128, 139, 512, 100, 100, 100, 512]
    - [106, 13134.0]
  - - [100, 128, 160, 512, 100, 100, 100, 512]
    - [67, 13163.0]
  - - [22500, 64, 1, 147, 22500, 22500, 22500, 147]
    - [83, 13745.0]
  - - [1024, 960, 1, 1024, 1024, 1024, 1024, 1024]
    - [84, 14559.0]
  - - [1024, 616, 1, 1024, 1024, 1024, 1024, 1024]
    - [63, 11783.0]
  - - [64, 128, 128, 128, 64, 64, 64, 128]
    - [108, 10437.0]
  - - [64, 128, 160, 128, 64, 64, 64, 128]
    - [68, 9811.0]
  - - [1024, 1024, 1, 2, 1024, 1024, 1024, 2]
    - [61, 681.0]
  - - [64, 128, 624, 128, 64, 64, 64, 128]
    - [65, 13039.0]
  - - [1024, 780, 1, 1024, 1024, 1024, 1024, 1024]
    - [63, 14844.0]
  - - [64, 128, 640, 128, 64, 64, 64, 128]
    - [108, 12817.0]
  - - [1024, 800, 1, 1024, 1024, 1024, 1024, 1024]
    - [106, 15169.0]
  - - [64, 128, 656, 128, 64, 64, 64, 128]
    - [65, 12930.0]
  - - [1024, 820, 1, 1024, 1024, 1024, 1024, 1024]
    - [83, 15526.0]
  - - [64, 512, 80, 512, 64, 64, 64, 512]
    - [85, 13533.0]
  - - [1024, 385, 1, 1024, 1024, 1024, 1024, 1024]
    - [98, 10143.0]
  - - [1024, 462, 1, 1024, 1024, 1024, 1024, 1024]
    - [98, 12154.0]
  - - [64, 128, 144, 128, 64, 64, 64, 128]
    - [108, 11152.0]
  - - [1024, 960, 1, 64, 1024, 1024, 1024, 64]
    - [54, 9769.0]
  - - [64, 512, 256, 512, 64, 64, 64, 512]
    - [71, 9821.0]
  - - [64, 512, 40, 512, 64, 64, 64, 512]
    - [85, 11578.0]
  - - [96, 1024, 64, 1024, 96, 96, 96, 1024]
    - [111, 10564.0]
  - - [96, 1024, 128, 1024, 96, 96, 96, 1024]
    - [90, 10809.0]
  - - [64, 1024, 256, 1024, 64, 64, 64, 1024]
    - [113, 9762.0]
  - - [64, 1024, 32, 1024, 64, 64, 64, 1024]
    - [108, 11546.0]
  - - [64, 1024, 64, 1024, 64, 64, 64, 1024]
    - [113, 9783.0]
  - - [64, 1024, 128, 1024, 64, 64, 64, 1024]
    - [113, 9727.0]
  - - [64, 128, 1024, 128, 64, 64, 64, 128]
    - [108, 12990.0]
  - - [1024, 864, 1, 1024, 1024, 1024, 1024, 1024]
    - [84, 12928.0]
  - - [1024, 864, 1, 512, 1024, 1024, 1024, 512]
    - [63, 12479.0]
  - - [256, 3456, 1, 128, 256, 256, 256, 128]
    - [106, 10973.0]
  - - [256, 4096, 1, 128, 256, 256, 256, 128]
    - [98, 12544.0]
  - - [480, 864, 1, 1024, 480, 480, 480, 1024]
    - [83, 10638.0]
  - - [512, 864, 1, 256, 512, 512, 512, 256]
    - [104, 8579.0]
  - - [64, 128, 1280, 128, 64, 64, 64, 128]
    - [109, 7236.0]
  - - [64, 128, 1312, 128, 64, 64, 64, 128]
    - [86, 7035.0]
  - - [64, 512, 192, 512, 64, 64, 64, 512]
    - [113, 9678.0]
  - - [256, 4096, 1, 1, 256, 256, 256, 1]
    - [94, 324.0]
  - - [64, 128, 2048, 128, 64, 64, 64, 128]
    - [70, 6095.0]
  - - [64, 128, 1536, 128, 64, 64, 64, 128]
    - [70, 6122.0]
