library/src/blas3/Tensile/Logic/asm_full/navi21/navi21_Cijk_Alik_Bljk_I8II_BH_GB.yaml
---
- {MinimumRequiredVersion: 4.27.0}
- navi21
- gfx1030
    SolutionIndex: 0
    SolutionNameMin: Cijk_Alik_Bljk_I8II_BH_GB_MT32x32x8_SN_EPS1_GRVW4_LRVW4_SU0_SUM0_SUS128_TT4_4_VW4_WG8_8_1_WGM1
    SolutionIndex: 1
    SolutionNameMin: Cijk_Alik_Bljk_I8II_BH_GB_MT64x32x8_SN_EPS1_GRVW4_LRVW4_SU0_SUM0_SUS128_TT8_4_VW4_WG8_8_1_WGM1
    SolutionIndex: 2
    SolutionNameMin: Cijk_Alik_Bljk_I8II_BH_GB_MT128x128x8_SN_EPS1_GRVW8_LRVW8_SU0_SUM0_SUS128_TT16_8_VW8_WG8_16_1_WGM1
    SolutionIndex: 3
    SolutionNameMin: Cijk_Alik_Bljk_I8II_BH_GB_MT64x64x8_SN_EPS1_GRVW8_LRVW8_SU0_SUM0_SUS128_TT8_8_VW8_WG8_8_1_WGM1
    SolutionIndex: 4
    SolutionNameMin: Cijk_Alik_Bljk_I8II_BH_GB_MT32x32x8_SN_EPS1_GRVW4_LRVW4_SU0_SUM0_SUS256_TT4_4_VW4_WG8_8_1_WGM1
    SolutionIndex: 5
    SolutionNameMin: Cijk_Alik_Bljk_I8II_BH_GB_MT64x64x8_SN_EPS1_GRVW4_LRVW4_SU0_SUM0_SUS256_TT8_8_VW4_WG8_8_1_WGM1
    SolutionIndex: 6
    SolutionNameMin: Cijk_Alik_Bljk_I8II_BH_GB_MT32x32x8_SN_EPS1_GRVW4_LRVW4_SU32_SUM0_SUS128_TT4_4_VW4_WG8_8_1_WGM1
    SolutionIndex: 7
    SolutionNameMin: Cijk_Alik_Bljk_I8II_BH_GB_MT64x64x8_SN_EPS1_GRVW4_LRVW4_SU32_SUM3_SUS128_TT8_4_VW4_WG8_16_1_WGM1
    SolutionIndex: 8
    SolutionNameMin: Cijk_Alik_Bljk_I8II_BH_GB_MT64x64x8_SN_EPS1_GRVW4_LRVW4_SU32_SUM0_SUS256_TT8_4_VW4_WG8_16_1_WGM1
    SolutionIndex: 9
    SolutionNameMin: Cijk_Alik_Bljk_I8II_BH_GB_MT128x128x8_SN_EPS1_GRVW4_LRVW4_SU32_SUM0_SUS256_TT16_8_VW4_WG8_16_1_WGM1
    SolutionIndex: 10
    SolutionNameMin: Cijk_Alik_Bljk_I8II_BH_GB_MT32x32x16_SN_EPS1_GRVW4_LRVW4_SU32_SUM0_SUS256_TT4_4_VW4_WG8_8_1_WGM1
    SolutionIndex: 11
    SolutionNameMin: Cijk_Alik_Bljk_I8II_BH_GB_MT64x64x16_SN_EPS1_GRVW8_LRVW8_SU32_SUM0_SUS256_TT8_8_VW8_WG8_8_1_WGM1
    SolutionIndex: 12
    SolutionNameMin: Cijk_Alik_Bljk_I8II_BH_GB_MT64x64x8_SN_EPS1_GRVW4_LRVW4_SU32_SUM3_SUS256_TT8_8_VW4_WG8_8_1_WGM1
    SolutionIndex: 13
    SolutionNameMin: Cijk_Alik_Bljk_I8II_BH_GB_MT32x32x16_SN_EPS1_GRVW4_LRVW4_SU32_SUM3_SUS256_TT4_4_VW4_WG8_8_1_WGM1
    SolutionIndex: 14
    SolutionNameMin: Cijk_Alik_Bljk_I8II_BH_GB_MT128x128x16_SN_EPS1_GRVW8_LRVW8_SU32_SUM3_SUS256_TT16_8_VW8_WG8_16_1_WGM1
    SolutionIndex: 15
    SolutionNameMin: Cijk_Alik_Bljk_I8II_BH_GB_MT32x32x16_SN_EPS1_GRVW4_LRVW4_SU0_SUM0_SUS128_TT4_4_VW4_WG8_8_1_WGM4
    SolutionIndex: 16
    SolutionNameMin: Cijk_Alik_Bljk_I8II_BH_GB_MT64x64x8_SN_EPS1_GRVW4_LRVW4_SU32_SUM0_SUS128_TT8_4_VW4_WG8_16_1_WGM4
    SolutionIndex: 17
    SolutionNameMin: Cijk_Alik_Bljk_I8II_BH_GB_MT256x128x16_SN_EPS1_GRVW8_LRVW8_SU32_SUM0_SUS256_TT16_8_VW8_WG16_16_1_WGM4
    SolutionIndex: 18
    SolutionNameMin: Cijk_Alik_Bljk_I8II_BH_GB_MT128x256x16_SN_EPS1_GRVW8_LRVW8_SU32_SUM3_SUS256_TT8_16_VW8_WG16_16_1_WGM4
    SolutionIndex: 19
    SolutionNameMin: Cijk_Alik_Bljk_I8II_BH_GB_MT32x32x8_SN_EPS1_GRVW4_LRVW4_SU0_SUM0_SUS256_TT4_4_VW4_WG8_8_1_WGM8
    SolutionIndex: 20
    SolutionNameMin: Cijk_Alik_Bljk_I8II_BH_GB_MT32x32x8_SN_EPS1_GRVW4_LRVW4_SU32_SUM0_SUS128_TT4_4_VW4_WG8_8_1_WGM8
    SolutionIndex: 21
    SolutionNameMin: Cijk_Alik_Bljk_I8II_BH_GB_MT64x64x8_SN_EPS1_GRVW4_LRVW4_SU32_SUM3_SUS128_TT8_4_VW4_WG8_16_1_WGM8
    SolutionIndex: 22
    SolutionNameMin: Cijk_Alik_Bljk_I8II_BH_GB_MT32x32x8_SN_EPS1_GRVW4_LRVW4_SU32_SUM3_SUS128_TT4_4_VW4_WG8_8_1_WGM8
    SolutionIndex: 23
    SolutionNameMin: Cijk_Alik_Bljk_I8II_BH_GB_MT32x32x16_SN_EPS1_GRVW4_LRVW4_SU32_SUM3_SUS128_TT4_4_VW4_WG8_8_1_WGM8
    SolutionIndex: 24
    SolutionNameMin: Cijk_Alik_Bljk_I8II_BH_GB_MT32x32x8_SN_EPS0_GRVW4_LRVW4_SU0_SUM0_SUS128_TT4_4_VW4_WG8_8_1_WGM1
    SolutionIndex: 25
    SolutionNameMin: Cijk_Alik_Bljk_I8II_BH_GB_MT64x64x8_SN_EPS0_GRVW4_LRVW4_SU0_SUM0_SUS128_TT8_8_VW4_WG8_8_1_WGM1
    SolutionIndex: 26
    SolutionNameMin: Cijk_Alik_Bljk_I8II_BH_GB_MT32x32x16_SN_EPS0_GRVW4_LRVW4_SU0_SUM0_SUS128_TT4_4_VW4_WG8_8_1_WGM1
    SolutionIndex: 27
    SolutionNameMin: Cijk_Alik_Bljk_I8II_BH_GB_MT32x32x32_SN_EPS0_GRVW4_LRVW4_SU0_SUM0_SUS128_TT4_4_VW4_WG8_8_1_WGM1
    SolutionIndex: 28
    SolutionNameMin: Cijk_Alik_Bljk_I8II_BH_GB_MT64x64x8_SN_EPS0_GRVW8_LRVW8_SU0_SUM0_SUS128_TT8_8_VW8_WG8_8_1_WGM1
    SolutionIndex: 29
    SolutionNameMin: Cijk_Alik_Bljk_I8II_BH_GB_MT64x64x8_SN_EPS0_GRVW4_LRVW4_SU0_SUM0_SUS256_TT8_4_VW4_WG8_16_1_WGM1
    SolutionIndex: 30
    SolutionNameMin: Cijk_Alik_Bljk_I8II_BH_GB_MT32x32x8_SN_EPS0_GRVW4_LRVW4_SU0_SUM0_SUS256_TT4_4_VW4_WG8_8_1_WGM1
    SolutionIndex: 31
    SolutionNameMin: Cijk_Alik_Bljk_I8II_BH_GB_MT64x32x8_SN_EPS0_GRVW4_LRVW4_SU0_SUM0_SUS256_TT8_4_VW4_WG8_8_1_WGM1
    SolutionIndex: 32
    SolutionNameMin: Cijk_Alik_Bljk_I8II_BH_GB_MT64x64x8_SN_EPS0_GRVW4_LRVW4_SU0_SUM0_SUS256_TT8_8_VW4_WG8_8_1_WGM1
    SolutionIndex: 33
    SolutionNameMin: Cijk_Alik_Bljk_I8II_BH_GB_MT32x32x16_SN_EPS0_GRVW4_LRVW4_SU0_SUM0_SUS256_TT4_4_VW4_WG8_8_1_WGM1
    SolutionIndex: 34
    SolutionNameMin: Cijk_Alik_Bljk_I8II_BH_GB_MT32x32x32_SN_EPS0_GRVW4_LRVW4_SU0_SUM0_SUS256_TT4_4_VW4_WG8_8_1_WGM1
    SolutionIndex: 35
    SolutionNameMin: Cijk_Alik_Bljk_I8II_BH_GB_MT64x64x8_SN_EPS0_GRVW8_LRVW8_SU0_SUM0_SUS256_TT8_8_VW8_WG8_8_1_WGM1
    SolutionIndex: 36
    SolutionNameMin: Cijk_Alik_Bljk_I8II_BH_GB_MT32x32x32_SN_EPS0_GRVW4_LRVW4_SU32_SUM3_SUS128_TT4_4_VW4_WG8_8_1_WGM1
    SolutionIndex: 37
    SolutionNameMin: Cijk_Alik_Bljk_I8II_BH_GB_MT32x32x16_SN_EPS0_GRVW4_LRVW4_SU32_SUM0_SUS256_TT4_4_VW4_WG8_8_1_WGM1
    SolutionIndex: 38
    SolutionNameMin: Cijk_Alik_Bljk_I8II_BH_GB_MT64x64x16_SN_EPS0_GRVW8_LRVW8_SU32_SUM0_SUS256_TT8_8_VW8_WG8_8_1_WGM1
    SolutionIndex: 39
    SolutionNameMin: Cijk_Alik_Bljk_I8II_BH_GB_MT64x64x16_SN_EPS0_GRVW8_LRVW8_SU32_SUM3_SUS256_TT8_8_VW8_WG8_8_1_WGM1
    SolutionIndex: 40
    SolutionNameMin: Cijk_Alik_Bljk_I8II_BH_GB_MT32x32x8_SN_EPS0_GRVW4_LRVW4_SU0_SUM0_SUS128_TT4_4_VW4_WG8_8_1_WGM4
    SolutionIndex: 41
    SolutionNameMin: Cijk_Alik_Bljk_I8II_BH_GB_MT32x32x16_SN_EPS0_GRVW4_LRVW4_SU0_SUM0_SUS128_TT4_4_VW4_WG8_8_1_WGM4
    SolutionIndex: 42
    SolutionNameMin: Cijk_Alik_Bljk_I8II_BH_GB_MT32x32x32_SN_EPS0_GRVW4_LRVW4_SU0_SUM0_SUS128_TT4_4_VW4_WG8_8_1_WGM4
    SolutionIndex: 43
    SolutionNameMin: Cijk_Alik_Bljk_I8II_BH_GB_MT64x64x8_SN_EPS0_GRVW4_LRVW4_SU0_SUM0_SUS256_TT8_4_VW4_WG8_16_1_WGM4
    SolutionIndex: 44
    SolutionNameMin: Cijk_Alik_Bljk_I8II_BH_GB_MT32x32x8_SN_EPS0_GRVW4_LRVW4_SU0_SUM0_SUS256_TT4_4_VW4_WG8_8_1_WGM4
    SolutionIndex: 45
    SolutionNameMin: Cijk_Alik_Bljk_I8II_BH_GB_MT32x32x16_SN_EPS0_GRVW4_LRVW4_SU0_SUM0_SUS256_TT4_4_VW4_WG8_8_1_WGM4
    SolutionIndex: 46
    SolutionNameMin: Cijk_Alik_Bljk_I8II_BH_GB_MT32x32x32_SN_EPS0_GRVW4_LRVW4_SU0_SUM0_SUS256_TT4_4_VW4_WG8_8_1_WGM4
    SolutionIndex: 47
    SolutionNameMin: Cijk_Alik_Bljk_I8II_BH_GB_MT32x32x16_SN_EPS0_GRVW4_LRVW4_SU32_SUM3_SUS128_TT4_4_VW4_WG8_8_1_WGM4
    SolutionIndex: 48
    SolutionNameMin: Cijk_Alik_Bljk_I8II_BH_GB_MT32x32x32_SN_EPS0_GRVW4_LRVW4_SU32_SUM3_SUS128_TT4_4_VW4_WG8_8_1_WGM4
    SolutionIndex: 49
    SolutionNameMin: Cijk_Alik_Bljk_I8II_BH_GB_MT32x32x32_SN_EPS0_GRVW4_LRVW4_SU32_SUM3_SUS256_TT4_4_VW4_WG8_8_1_WGM4
    SolutionIndex: 50
    SolutionNameMin: Cijk_Alik_Bljk_I8II_BH_GB_MT32x32x8_SN_EPS0_GRVW4_LRVW4_SU0_SUM0_SUS128_TT4_4_VW4_WG8_8_1_WGM8
    SolutionIndex: 51
    SolutionNameMin: Cijk_Alik_Bljk_I8II_BH_GB_MT32x32x16_SN_EPS0_GRVW4_LRVW4_SU0_SUM0_SUS128_TT4_4_VW4_WG8_8_1_WGM8
    SolutionIndex: 52
    SolutionNameMin: Cijk_Alik_Bljk_I8II_BH_GB_MT32x32x32_SN_EPS0_GRVW4_LRVW4_SU0_SUM0_SUS128_TT4_4_VW4_WG8_8_1_WGM8
    SolutionIndex: 53
    SolutionNameMin: Cijk_Alik_Bljk_I8II_BH_GB_MT64x64x8_SN_EPS0_GRVW4_LRVW4_SU0_SUM0_SUS256_TT8_4_VW4_WG8_16_1_WGM8
    SolutionIndex: 54
    SolutionNameMin: Cijk_Alik_Bljk_I8II_BH_GB_MT32x32x16_SN_EPS0_GRVW4_LRVW4_SU0_SUM0_SUS256_TT4_4_VW4_WG8_8_1_WGM8
    SolutionIndex: 55
    SolutionNameMin: Cijk_Alik_Bljk_I8II_BH_GB_MT32x32x32_SN_EPS0_GRVW4_LRVW4_SU0_SUM0_SUS256_TT4_4_VW4_WG8_8_1_WGM8
    SolutionIndex: 56
    SolutionNameMin: Cijk_Alik_Bljk_I8II_BH_GB_MT32x32x16_SN_EPS0_GRVW4_LRVW4_SU32_SUM0_SUS128_TT4_4_VW4_WG8_8_1_WGM8
    SolutionIndex: 57
    SolutionNameMin: Cijk_Alik_Bljk_I8II_BH_GB_MT32x32x8_SN_EPS0_GRVW4_LRVW4_SU32_SUM3_SUS128_TT4_4_VW4_WG8_8_1_WGM8
    SolutionIndex: 58
    SolutionNameMin: Cijk_Alik_Bljk_I8II_BH_GB_MT32x32x16_SN_EPS0_GRVW4_LRVW4_SU32_SUM3_SUS128_TT4_4_VW4_WG8_8_1_WGM8
    SolutionIndex: 59
    SolutionNameMin: Cijk_Alik_Bljk_I8II_BH_GB_MT32x32x32_SN_EPS0_GRVW4_LRVW4_SU32_SUM3_SUS128_TT4_4_VW4_WG8_8_1_WGM8
    SolutionIndex: 60
    SolutionNameMin: Cijk_Alik_Bljk_I8II_BH_GB_MT64x64x16_SN_EPS0_GRVW8_LRVW8_SU32_SUM0_SUS256_TT8_8_VW8_WG8_8_1_WGM8
- - - [768, 1024, 1, 1024, 768, 768, 1024, 1024]
    - [18, 18842.0]
  - - [1536, 2048, 1, 2048, 1536, 1536, 2048, 2048]
    - [17, 24496.0]
  - - [32, 32, 1, 32, 32, 32, 32, 32]
    - [24, 20.0]
  - - [32, 32, 1, 64, 32, 32, 64, 64]
    - [30, 35.0]
  - - [32, 32, 1, 128, 32, 32, 128, 128]
    - [26, 56.0]
  - - [32, 32, 1, 256, 32, 32, 256, 256]
    - [33, 79.0]
  - - [32, 32, 1, 512, 32, 32, 512, 512]
    - [27, 95.0]
  - - [32, 32, 1, 1024, 32, 32, 1024, 1024]
    - [52, 114.0]
  - - [32, 64, 1, 32, 32, 32, 32, 32]
    - [30, 41.0]
  - - [32, 64, 1, 64, 32, 32, 64, 64]
    - [24, 70.0]
  - - [32, 64, 1, 128, 32, 32, 128, 128]
    - [33, 112.0]
  - - [32, 64, 1, 256, 32, 32, 256, 256]
    - [26, 158.0]
  - - [32, 64, 1, 512, 32, 32, 512, 512]
    - [27, 193.0]
  - - [32, 64, 1, 1024, 32, 32, 1024, 1024]
    - [49, 233.0]
  - - [32, 128, 1, 32, 32, 32, 32, 32]
    - [24, 81.0]
  - - [32, 128, 1, 64, 32, 32, 64, 64]
    - [40, 139.0]
  - - [32, 128, 1, 128, 32, 32, 128, 128]
    - [26, 224.0]
  - - [32, 128, 1, 256, 32, 32, 256, 256]
    - [26, 316.0]
  - - [32, 128, 1, 512, 32, 32, 512, 512]
    - [55, 387.0]
  - - [32, 128, 1, 1024, 32, 32, 1024, 1024]
    - [59, 469.0]
  - - [32, 256, 1, 32, 32, 32, 32, 32]
    - [24, 164.0]
  - - [32, 256, 1, 64, 32, 32, 64, 64]
    - [30, 282.0]
  - - [32, 256, 1, 128, 32, 32, 128, 128]
    - [26, 448.0]
  - - [32, 256, 1, 256, 32, 32, 256, 256]
    - [26, 632.0]
  - - [32, 256, 1, 512, 32, 32, 512, 512]
    - [36, 777.0]
  - - [32, 256, 1, 1024, 32, 32, 1024, 1024]
    - [55, 930.0]
  - - [32, 512, 1, 32, 32, 32, 32, 32]
    - [30, 332.0]
  - - [32, 512, 1, 64, 32, 32, 64, 64]
    - [24, 558.0]
  - - [32, 512, 1, 128, 32, 32, 128, 128]
    - [33, 896.0]
  - - [32, 512, 1, 256, 32, 32, 256, 256]
    - [33, 1271.0]
  - - [32, 512, 1, 512, 32, 32, 512, 512]
    - [36, 1548.0]
  - - [32, 512, 1, 1024, 32, 32, 1024, 1024]
    - [42, 1856.0]
  - - [32, 1024, 1, 32, 32, 32, 32, 32]
    - [40, 655.0]
  - - [32, 1024, 1, 64, 32, 32, 64, 64]
    - [40, 1116.0]
  - - [32, 1024, 1, 128, 32, 32, 128, 128]
    - [26, 1777.0]
  - - [32, 1024, 1, 256, 32, 32, 256, 256]
    - [26, 2467.0]
  - - [32, 1024, 1, 512, 32, 32, 512, 512]
    - [54, 2778.0]
  - - [32, 1024, 1, 1024, 32, 32, 1024, 1024]
    - [58, 3073.0]
  - - [64, 32, 1, 32, 64, 64, 32, 32]
    - [24, 40.0]
  - - [64, 32, 1, 64, 64, 64, 64, 64]
    - [40, 70.0]
  - - [64, 32, 1, 128, 64, 64, 128, 128]
    - [26, 110.0]
  - - [64, 32, 1, 256, 64, 64, 256, 256]
    - [41, 156.0]
  - - [64, 32, 1, 512, 64, 64, 512, 512]
    - [52, 191.0]
  - - [64, 32, 1, 1024, 64, 64, 1024, 1024]
    - [55, 228.0]
  - - [64, 64, 1, 32, 64, 64, 32, 32]
    - [30, 82.0]
  - - [64, 64, 1, 64, 64, 64, 64, 64]
    - [30, 138.0]
  - - [64, 64, 1, 128, 64, 64, 128, 128]
    - [26, 224.0]
  - - [64, 64, 1, 256, 64, 64, 256, 256]
    - [26, 308.0]
  - - [64, 64, 1, 512, 64, 64, 512, 512]
    - [36, 384.0]
  - - [64, 64, 1, 1024, 64, 64, 1024, 1024]
    - [59, 467.0]
  - - [64, 128, 1, 32, 64, 64, 32, 32]
    - [30, 162.0]
  - - [64, 128, 1, 64, 64, 64, 64, 64]
    - [44, 279.0]
  - - [64, 128, 1, 128, 64, 64, 128, 128]
    - [33, 444.0]
  - - [64, 128, 1, 256, 64, 64, 256, 256]
    - [26, 632.0]
  - - [64, 128, 1, 512, 64, 64, 512, 512]
    - [48, 774.0]
  - - [64, 128, 1, 1024, 64, 64, 1024, 1024]
    - [55, 926.0]
  - - [64, 256, 1, 32, 64, 64, 32, 32]
    - [30, 328.0]
  - - [64, 256, 1, 64, 64, 64, 64, 64]
    - [24, 552.0]
  - - [64, 256, 1, 128, 64, 64, 128, 128]
    - [26, 881.0]
  - - [64, 256, 1, 256, 64, 64, 256, 256]
    - [26, 1256.0]
  - - [64, 256, 1, 512, 64, 64, 512, 512]
    - [36, 1548.0]
  - - [64, 256, 1, 1024, 64, 64, 1024, 1024]
    - [55, 1856.0]
  - - [64, 512, 1, 32, 64, 64, 32, 32]
    - [40, 647.0]
  - - [64, 512, 1, 64, 64, 64, 64, 64]
    - [40, 1104.0]
  - - [64, 512, 1, 128, 64, 64, 128, 128]
    - [26, 1777.0]
  - - [64, 512, 1, 256, 64, 64, 256, 256]
    - [26, 2467.0]
  - - [64, 512, 1, 512, 64, 64, 512, 512]
    - [33, 2863.0]
  - - [64, 512, 1, 1024, 64, 64, 1024, 1024]
    - [26, 3160.0]
  - - [64, 1024, 1, 32, 64, 64, 32, 32]
    - [44, 1248.0]
  - - [64, 1024, 1, 64, 64, 64, 64, 64]
    - [40, 2118.0]
  - - [64, 1024, 1, 128, 64, 64, 128, 128]
    - [33, 3410.0]
  - - [64, 1024, 1, 256, 64, 64, 256, 256]
    - [26, 4486.0]
  - - [64, 1024, 1, 512, 64, 64, 512, 512]
    - [33, 5309.0]
  - - [64, 1024, 1, 1024, 64, 64, 1024, 1024]
    - [47, 5736.0]
  - - [128, 32, 1, 32, 128, 128, 32, 32]
    - [30, 82.0]
  - - [128, 32, 1, 64, 128, 128, 64, 64]
    - [30, 139.0]
  - - [128, 32, 1, 128, 128, 128, 128, 128]
    - [26, 218.0]
  - - [128, 32, 1, 256, 128, 128, 256, 256]
    - [26, 314.0]
  - - [128, 32, 1, 512, 128, 128, 512, 512]
    - [27, 381.0]
  - - [128, 32, 1, 1024, 128, 128, 1024, 1024]
    - [46, 459.0]
  - - [128, 64, 1, 32, 128, 128, 32, 32]
    - [30, 164.0]
  - - [128, 64, 1, 64, 128, 128, 64, 64]
    - [24, 279.0]
  - - [128, 64, 1, 128, 128, 128, 128, 128]
    - [26, 441.0]
  - - [128, 64, 1, 256, 128, 128, 256, 256]
    - [26, 632.0]
  - - [128, 64, 1, 512, 128, 128, 512, 512]
    - [34, 771.0]
  - - [128, 64, 1, 1024, 128, 128, 1024, 1024]
    - [27, 922.0]
  - - [128, 128, 1, 32, 128, 128, 32, 32]
    - [24, 328.0]
  - - [128, 128, 1, 64, 128, 128, 64, 64]
    - [24, 552.0]
  - - [128, 128, 1, 128, 128, 128, 128, 128]
    - [26, 889.0]
  - - [128, 128, 1, 256, 128, 128, 256, 256]
    - [26, 1263.0]
  - - [128, 128, 1, 512, 128, 128, 512, 512]
    - [27, 1542.0]
  - - [128, 128, 1, 1024, 128, 128, 1024, 1024]
    - [42, 1848.0]
  - - [128, 256, 1, 32, 128, 128, 32, 32]
    - [30, 647.0]
  - - [128, 256, 1, 64, 128, 128, 64, 64]
    - [30, 1104.0]
  - - [128, 256, 1, 128, 128, 128, 128, 128]
    - [26, 1762.0]
  - - [128, 256, 1, 256, 128, 128, 256, 256]
    - [26, 2439.0]
  - - [128, 256, 1, 512, 128, 128, 512, 512]
    - [51, 2824.0]
  - - [128, 256, 1, 1024, 128, 128, 1024, 1024]
    - [15, 3184.0]
  - - [128, 512, 1, 32, 128, 128, 32, 32]
    - [30, 1234.0]
  - - [128, 512, 1, 64, 128, 128, 64, 64]
    - [24, 2118.0]
  - - [128, 512, 1, 128, 128, 128, 128, 128]
    - [26, 3355.0]
  - - [128, 512, 1, 256, 128, 128, 256, 256]
    - [33, 4486.0]
  - - [128, 512, 1, 512, 128, 128, 512, 512]
    - [45, 5465.0]
  - - [128, 512, 1, 1024, 128, 128, 1024, 1024]
    - [13, 5907.0]
  - - [128, 1024, 1, 32, 128, 128, 32, 32]
    - [30, 2305.0]
  - - [128, 1024, 1, 64, 128, 128, 64, 64]
    - [30, 3995.0]
  - - [128, 1024, 1, 128, 128, 128, 128, 128]
    - [30, 5992.0]
  - - [128, 1024, 1, 256, 128, 128, 256, 256]
    - [6, 7523.0]
  - - [128, 1024, 1, 512, 128, 128, 512, 512]
    - [20, 7609.0]
  - - [128, 1024, 1, 1024, 128, 128, 1024, 1024]
    - [58, 7326.0]
  - - [256, 32, 1, 32, 256, 256, 32, 32]
    - [24, 162.0]
  - - [256, 32, 1, 64, 256, 256, 64, 64]
    - [24, 276.0]
  - - [256, 32, 1, 128, 256, 256, 128, 128]
    - [26, 444.0]
  - - [256, 32, 1, 256, 256, 256, 256, 256]
    - [26, 632.0]
  - - [256, 32, 1, 512, 256, 256, 512, 512]
    - [27, 763.0]
  - - [256, 32, 1, 1024, 256, 256, 1024, 1024]
    - [42, 914.0]
  - - [256, 64, 1, 32, 256, 256, 32, 32]
    - [24, 324.0]
  - - [256, 64, 1, 64, 256, 256, 64, 64]
    - [24, 552.0]
  - - [256, 64, 1, 128, 256, 256, 128, 128]
    - [26, 889.0]
  - - [256, 64, 1, 256, 256, 256, 256, 256]
    - [33, 1256.0]
  - - [256, 64, 1, 512, 256, 256, 512, 512]
    - [34, 1542.0]
  - - [256, 64, 1, 1024, 256, 256, 1024, 1024]
    - [49, 1840.0]
  - - [256, 128, 1, 32, 256, 256, 32, 32]
    - [30, 639.0]
  - - [256, 128, 1, 64, 256, 256, 64, 64]
    - [30, 1092.0]
  - - [256, 128, 1, 128, 256, 256, 128, 128]
    - [26, 1748.0]
  - - [256, 128, 1, 256, 256, 256, 256, 256]
    - [26, 2439.0]
  - - [256, 128, 1, 512, 256, 256, 512, 512]
    - [56, 2815.0]
  - - [256, 128, 1, 1024, 256, 256, 1024, 1024]
    - [54, 3178.0]
  - - [256, 256, 1, 32, 256, 256, 32, 32]
    - [30, 1234.0]
  - - [256, 256, 1, 64, 256, 256, 64, 64]
    - [30, 2097.0]
  - - [256, 256, 1, 128, 256, 256, 128, 128]
    - [26, 3355.0]
  - - [256, 256, 1, 256, 256, 256, 256, 256]
    - [33, 4438.0]
  - - [256, 256, 1, 512, 256, 256, 512, 512]
    - [26, 5447.0]
  - - [256, 256, 1, 1024, 256, 256, 1024, 1024]
    - [10, 6024.0]
  - - [256, 512, 1, 32, 256, 256, 32, 32]
    - [50, 2280.0]
  - - [256, 512, 1, 64, 256, 256, 64, 64]
    - [30, 3920.0]
  - - [256, 512, 1, 128, 256, 256, 128, 128]
    - [4, 5866.0]
  - - [256, 512, 1, 256, 256, 256, 256, 256]
    - [6, 7424.0]
  - - [256, 512, 1, 512, 256, 256, 512, 512]
    - [20, 7592.0]
  - - [256, 512, 1, 1024, 256, 256, 1024, 1024]
    - [57, 7432.0]
  - - [256, 1024, 1, 32, 256, 256, 32, 32]
    - [50, 3884.0]
  - - [256, 1024, 1, 64, 256, 256, 64, 64]
    - [31, 6035.0]
  - - [256, 1024, 1, 128, 256, 256, 128, 128]
    - [43, 8224.0]
  - - [256, 1024, 1, 256, 256, 256, 256, 256]
    - [7, 10324.0]
  - - [256, 1024, 1, 512, 256, 256, 512, 512]
    - [16, 11878.0]
  - - [256, 1024, 1, 1024, 256, 256, 1024, 1024]
    - [38, 12314.0]
  - - [512, 32, 1, 32, 512, 512, 32, 32]
    - [24, 324.0]
  - - [512, 32, 1, 64, 512, 512, 64, 64]
    - [30, 558.0]
  - - [512, 32, 1, 128, 512, 512, 128, 128]
    - [26, 889.0]
  - - [512, 32, 1, 256, 512, 512, 256, 256]
    - [26, 1263.0]
  - - [512, 32, 1, 512, 512, 512, 512, 512]
    - [34, 1531.0]
  - - [512, 32, 1, 1024, 512, 512, 1024, 1024]
    - [34, 1800.0]
  - - [512, 64, 1, 32, 512, 512, 32, 32]
    - [24, 639.0]
  - - [512, 64, 1, 64, 512, 512, 64, 64]
    - [24, 1092.0]
  - - [512, 64, 1, 128, 512, 512, 128, 128]
    - [33, 1777.0]
  - - [512, 64, 1, 256, 512, 512, 256, 256]
    - [26, 2453.0]
  - - [512, 64, 1, 512, 512, 512, 512, 512]
    - [34, 3039.0]
  - - [512, 64, 1, 1024, 512, 512, 1024, 1024]
    - [34, 3631.0]
  - - [512, 128, 1, 32, 512, 512, 32, 32]
    - [30, 1234.0]
  - - [512, 128, 1, 64, 512, 512, 64, 64]
    - [30, 2118.0]
  - - [512, 128, 1, 128, 512, 512, 128, 128]
    - [26, 3329.0]
  - - [512, 128, 1, 256, 512, 512, 256, 256]
    - [26, 4486.0]
  - - [512, 128, 1, 512, 512, 512, 512, 512]
    - [33, 5377.0]
  - - [512, 128, 1, 1024, 512, 512, 1024, 1024]
    - [37, 6046.0]
  - - [512, 256, 1, 32, 512, 512, 32, 32]
    - [50, 2305.0]
  - - [512, 256, 1, 64, 512, 512, 64, 64]
    - [30, 3920.0]
  - - [512, 256, 1, 128, 512, 512, 128, 128]
    - [24, 5907.0]
  - - [512, 256, 1, 256, 512, 512, 256, 256]
    - [4, 7457.0]
  - - [512, 256, 1, 512, 512, 512, 512, 512]
    - [22, 7592.0]
  - - [512, 256, 1, 1024, 512, 512, 1024, 1024]
    - [57, 7498.0]
  - - [512, 512, 1, 32, 512, 512, 32, 32]
    - [0, 3884.0]
  - - [512, 512, 1, 64, 512, 512, 64, 64]
    - [1, 6035.0]
  - - [512, 512, 1, 128, 512, 512, 128, 128]
    - [53, 8265.0]
  - - [512, 512, 1, 256, 512, 512, 256, 256]
    - [29, 10324.0]
  - - [512, 512, 1, 512, 512, 512, 512, 512]
    - [21, 11732.0]
  - - [512, 512, 1, 1024, 512, 512, 1024, 1024]
    - [39, 12382.0]
  - - [512, 1024, 1, 32, 512, 512, 32, 32]
    - [50, 6168.0]
  - - [512, 1024, 1, 64, 512, 512, 64, 64]
    - [12, 8972.0]
  - - [512, 1024, 1, 128, 512, 512, 128, 128]
    - [35, 12474.0]
  - - [512, 1024, 1, 256, 512, 512, 256, 256]
    - [3, 15322.0]
  - - [512, 1024, 1, 512, 512, 512, 512, 512]
    - [11, 14188.0]
  - - [512, 1024, 1, 1024, 512, 512, 1024, 1024]
    - [39, 14880.0]
  - - [1024, 32, 1, 32, 1024, 1024, 32, 32]
    - [40, 647.0]
  - - [1024, 32, 1, 64, 1024, 1024, 64, 64]
    - [40, 1104.0]
  - - [1024, 32, 1, 128, 1024, 1024, 128, 128]
    - [33, 1777.0]
  - - [1024, 32, 1, 256, 1024, 1024, 256, 256]
    - [26, 2424.0]
  - - [1024, 32, 1, 512, 1024, 1024, 512, 512]
    - [26, 2715.0]
  - - [1024, 32, 1, 1024, 1024, 1024, 1024, 1024]
    - [10, 3001.0]
  - - [1024, 64, 1, 32, 1024, 1024, 32, 32]
    - [30, 1248.0]
  - - [1024, 64, 1, 64, 1024, 1024, 64, 64]
    - [33, 2118.0]
  - - [1024, 64, 1, 128, 1024, 1024, 128, 128]
    - [26, 3355.0]
  - - [1024, 64, 1, 256, 1024, 1024, 256, 256]
    - [33, 4415.0]
  - - [1024, 64, 1, 512, 1024, 1024, 512, 512]
    - [26, 5292.0]
  - - [1024, 64, 1, 1024, 1024, 1024, 1024, 1024]
    - [37, 5866.0]
  - - [1024, 128, 1, 32, 1024, 1024, 32, 32]
    - [24, 2280.0]
  - - [1024, 128, 1, 64, 1024, 1024, 64, 64]
    - [24, 3920.0]
  - - [1024, 128, 1, 128, 1024, 1024, 128, 128]
    - [40, 5825.0]
  - - [1024, 128, 1, 256, 1024, 1024, 256, 256]
    - [4, 7263.0]
  - - [1024, 128, 1, 512, 1024, 1024, 512, 512]
    - [8, 7049.0]
  - - [1024, 128, 1, 1024, 1024, 1024, 1024, 1024]
    - [23, 7310.0]
  - - [1024, 256, 1, 32, 1024, 1024, 32, 32]
    - [0, 3813.0]
  - - [1024, 256, 1, 64, 1024, 1024, 64, 64]
    - [31, 6079.0]
  - - [1024, 256, 1, 128, 1024, 1024, 128, 128]
    - [53, 8184.0]
  - - [1024, 256, 1, 256, 1024, 1024, 256, 256]
    - [29, 10356.0]
  - - [1024, 256, 1, 512, 1024, 1024, 512, 512]
    - [39, 11651.0]
  - - [1024, 256, 1, 1024, 1024, 1024, 1024, 1024]
    - [39, 12439.0]
  - - [1024, 512, 1, 32, 1024, 1024, 32, 32]
    - [19, 6079.0]
  - - [1024, 512, 1, 64, 1024, 1024, 64, 64]
    - [25, 8877.0]
  - - [1024, 512, 1, 128, 1024, 1024, 128, 128]
    - [28, 12246.0]
  - - [1024, 512, 1, 256, 1024, 1024, 256, 256]
    - [35, 15607.0]
  - - [1024, 512, 1, 512, 1024, 1024, 512, 512]
    - [60, 14278.0]
  - - [1024, 512, 1, 1024, 1024, 1024, 1024, 1024]
    - [39, 15790.0]
  - - [1024, 1024, 1, 32, 1024, 1024, 32, 32]
    - [32, 8693.0]
  - - [1024, 1024, 1, 64, 1024, 1024, 64, 64]
    - [5, 11941.0]
  - - [1024, 1024, 1, 128, 1024, 1024, 128, 128]
    - [3, 14913.0]
  - - [1024, 1024, 1, 256, 1024, 1024, 256, 256]
    - [2, 18187.0]
  - - [1024, 1024, 1, 512, 1024, 1024, 512, 512]
    - [9, 16550.0]
  - - [1024, 1024, 1, 1024, 1024, 1024, 1024, 1024]
    - [14, 17493.0]
- null
- null
- DeviceEfficiency
...
