library/src/blas3/Tensile/Logic/asm_full/row/aldebaran_Cijk_Ailk_Bjlk_HBH.yaml
- {MinimumRequiredVersion: 4.31.0}
- aldebaran
- {Architecture: gfx90a, CUCount: 104}
- [Device 0050, Device 0051, Device 0052, Device 0054, Device 0062, Device 7400, Device
    SolutionIndex: 0
    SolutionNameMin: Cijk_Ailk_Bjlk_HBH_MT064x064x04_PGR0_PLR1_TT04_04
    SolutionIndex: 1
    SolutionNameMin: Cijk_Ailk_Bjlk_HBH_MT064x064x04_PGR1_PLR1_TT04_04
    SolutionIndex: 2
    SolutionNameMin: Cijk_Ailk_Bjlk_HBH_MT064x064x08_PGR0_PLR1_TT04_04
    SolutionIndex: 3
    SolutionNameMin: Cijk_Ailk_Bjlk_HBH_MT064x064x16_PGR1_PLR1_TT04_04
    SolutionIndex: 4
    SolutionNameMin: Cijk_Ailk_Bjlk_HBH_MT32x32x16_MI16x16x16x1_SE_AF0EM8_GRVW2_SU0_SUS256_SRVW4_TT1_16_WG32_8_1_WGM1
    SolutionIndex: 5
    SolutionNameMin: Cijk_Ailk_Bjlk_HBH_MT16x64x32_MI16x16x16x1_SE_AF0EM8_GRVW8_SU0_SUS256_SRVW0_TT1_16_WG16_16_1_WGM2
    SolutionIndex: 6
    SolutionNameMin: Cijk_Ailk_Bjlk_HBH_MT32x32x16_MI16x16x16x1_SE_AF0EM1_GRVW2_SU0_SUS256_SRVW4_TT1_16_WG32_8_1_WGM1
    SolutionIndex: 7
    SolutionNameMin: Cijk_Ailk_Bjlk_HBH_MT32x32x16_MI16x16x16x1_SE_AF0EM1_GRVW2_SU32_SUS256_SRVW4_TT1_16_WG32_8_1_WGM1
    SolutionIndex: 8
    SolutionNameMin: Cijk_Ailk_Bjlk_HBH_MT32x32x64_MI16x16x16x1_SE_1LDSB0_AF0EM8_AF1EM1_EPS0_GRVW8_GSU1_GSUAMB_NLCA1_NLCB1_PGR2_SU0_SUS0_SRVW4_TT1_16_VAW2_WSGRA1_WSGRB1_WG32_8_1_WGM1
    SolutionIndex: 9
    SolutionNameMin: Cijk_Ailk_Bjlk_HBH_MT64x64x64_MI32x32x8x1_SE_1LDSB0_AF0EM8_AF1EM1_EPS0_GRVW8_GSU1_GSUAMB_NLCA1_NLCB1_PGR2_SU0_SUS0_SRVW4_TT1_32_VAW2_WSGRA1_WSGRB1_WG64_4_1_WGM15
    SolutionIndex: 10
    SolutionNameMin: Cijk_Ailk_Bjlk_HBH_MT64x16x32_MI16x16x16x1_SE_1LDSB0_AF0EM1_AF1EM1_EPS0_GRVW8_GSU1_GSUAMB_NLCA1_NLCB1_PGR2_SU0_SUS0_SRVW0_TT1_16_VAW2_WSGRA1_WSGRB1_WG64_4_1_WGM1
    SolutionIndex: 11
    SolutionNameMin: Cijk_Ailk_Bjlk_HBH_MT64x64x32_MI32x32x8x1_SE_1LDSB0_AF0EM8_AF1EM1_EPS0_GRVW8_GSU1_GSUAMB_NLCA1_NLCB1_PGR2_SU0_SUS0_SRVW4_TT1_32_VAW2_WSGRA1_WSGRB1_WG64_4_1_WGM15
    SolutionIndex: 12
    SolutionNameMin: Cijk_Ailk_Bjlk_HBH_MT32x32x64_MI16x16x16x1_SE_1LDSB0_AF0EM8_AF1EM1_EPS0_GRVW8_GSU1_GSUAMB_NLCA1_NLCB1_PGR2_SU0_SUS0_SRVW4_TT1_16_VAW2_WSGRA1_WSGRB1_WG32_8_1_WGM15
    SolutionIndex: 13
    SolutionNameMin: Cijk_Ailk_Bjlk_HBH_MT64x64x64_MI32x32x8x1_SE_1LDSB0_AF0EM8_AF1EM1_EPS1_GRVW8_GSU7_GSUAMB_NLCA1_NLCB1_PGR1_SU0_SUS0_SRVW0_TT1_32_VAW1_WSGRA1_WSGRB1_WG64_4_1_WGM1
    SolutionIndex: 14
    SolutionNameMin: Cijk_Ailk_Bjlk_HBH_MT32x32x64_MI16x16x16x1_SE_1LDSB0_AF0EM8_AF1EM1_EPS0_GRVW4_GSU1_GSUAMB_NLCA1_NLCB1_PGR2_SU0_SUS0_SRVW4_TT1_16_VAW2_WSGRA1_WSGRB1_WG32_8_1_WGM2
    SolutionIndex: 15
    SolutionNameMin: Cijk_Ailk_Bjlk_HBH_MT32x64x64_MI16x16x16x1_SE_1LDSB0_AF0EM8_AF1EM1_EPS0_GRVW8_GSU1_GSUAMB_NLCA1_NLCB1_PGR2_SU0_SUS0_SRVW4_TT1_32_VAW2_WSGRA1_WSGRB1_WG32_8_1_WGM1
    SolutionIndex: 16
    SolutionNameMin: Cijk_Ailk_Bjlk_HBH_MT32x32x64_MI16x16x16x1_SE_1LDSB0_AF0EM1_AF1EM1_EPS0_GRVW8_GSU1_GSUAMB_NLCA1_NLCB1_PGR2_SU0_SUS0_SRVW4_TT1_16_VAW2_WSGRA1_WSGRB1_WG32_8_1_WGM1
    SolutionIndex: 17
    SolutionNameMin: Cijk_Ailk_Bjlk_HBH_MT64x64x64_MI32x32x8x1_SE_1LDSB0_AF0EM8_AF1EM1_EPS0_GRVW8_GSU1_GSUAMB_NLCA1_NLCB1_PGR2_SU0_SUS0_SRVW4_TT1_32_VAW2_WSGRA1_WSGRB1_WG64_4_1_WGM2
    SolutionIndex: 18
    SolutionNameMin: Cijk_Ailk_Bjlk_HBH_MT64x16x64_MI16x16x16x1_SE_1LDSB0_AF0EM8_AF1EM1_EPS0_GRVW2_GSU7_GSUAMB_NLCA1_NLCB1_PGR2_SU0_SUS0_SRVW0_TT1_16_VAW1_WSGRA1_WSGRB1_WG64_4_1_WGM1
    SolutionIndex: 19
    SolutionNameMin: Cijk_Ailk_Bjlk_HBH_MT32x32x64_MI16x16x16x1_SE_1LDSB0_AF0EM8_AF1EM1_EPS0_GRVW4_GSU1_GSUAMB_NLCA1_NLCB1_PGR2_SU32_SUS128_SRVW4_TT1_16_VAW2_WSGRA1_WSGRB1_WG32_8_1_WGM1
    SolutionIndex: 20
    SolutionNameMin: Cijk_Ailk_Bjlk_HBH_MT64x64x32_MI32x32x8x1_SE_1LDSB0_AF0EM8_AF1EM1_EPS0_GRVW8_GSU1_GSUAMB_NLCA1_NLCB1_PGR2_SU0_SUS0_SRVW4_TT1_32_VAW2_WSGRA1_WSGRB1_WG64_4_1_WGM1
    SolutionIndex: 21
    SolutionNameMin: Cijk_Ailk_Bjlk_HBH_MT64x64x32_MI32x32x8x1_SE_1LDSB0_AF0EM8_AF1EM1_EPS0_GRVW8_GSU1_GSUAMB_NLCA1_NLCB1_PGR2_SU32_SUS128_SRVW4_TT1_32_VAW2_WSGRA1_WSGRB1_WG64_4_1_WGM15
    SolutionIndex: 22
    SolutionNameMin: Cijk_Ailk_Bjlk_HBH_MT32x32x32_MI16x16x16x1_SE_1LDSB0_AF0EM1_AF1EM1_EPS0_GRVW4_GSU1_GSUAMB_NLCA1_NLCB1_PGR2_SU0_SUS0_SRVW4_TT1_16_VAW2_WSGRA1_WSGRB1_WG32_8_1_WGM1
    SolutionIndex: 23
    SolutionNameMin: Cijk_Ailk_Bjlk_HBH_MT64x64x32_MI32x32x8x1_SE_1LDSB0_AF0EM8_AF1EM1_EPS0_GRVW4_GSU1_GSUAMB_NLCA1_NLCB1_PGR2_SU0_SUS0_SRVW4_TT1_32_VAW2_WSGRA1_WSGRB1_WG64_4_1_WGM1
    SolutionIndex: 24
    SolutionNameMin: Cijk_Ailk_Bjlk_HBH_MT32x32x32_MI16x16x16x1_SE_1LDSB0_AF0EM8_AF1EM1_EPS0_GRVW4_GSU1_GSUAMB_NLCA1_NLCB1_PGR2_SU0_SUS0_SRVW4_TT1_16_VAW2_WSGRA1_WSGRB1_WG32_8_1_WGM1
    SolutionIndex: 25
    SolutionNameMin: Cijk_Ailk_Bjlk_HBH_MT16x16x32_MI16x16x16x1_SE_1LDSB0_AF0EM1_AF1EM1_EPS0_GRVW4_GSU1_GSUAMB_NLCA1_NLCB1_PGR2_SU32_SUS128_SRVW0_TT1_16_VAW2_WSGRA1_WSGRB1_WG16_4_1_WGM1
    SolutionIndex: 26
    SolutionNameMin: Cijk_Ailk_Bjlk_HBH_MT64x16x64_MI16x16x16x1_SE_1LDSB0_AF0EM8_AF1EM1_EPS0_GRVW2_GSU7_GSUAMB_NLCA1_NLCB1_PGR2_SU32_SUS128_SRVW0_TT1_16_VAW1_WSGRA1_WSGRB1_WG64_4_1_WGM1
    SolutionIndex: 27
    SolutionNameMin: Cijk_Ailk_Bjlk_HBH_MT64x16x64_MI16x16x16x1_SE_1LDSB0_AF0EM8_AF1EM1_EPS0_GRVW2_GSU7_GSUAMB_NLCA1_NLCB1_PGR2_SU32_SUS256_SRVW4_TT1_16_VAW1_WSGRA1_WSGRB1_WG64_4_1_WGM1
    SolutionIndex: 28
    SolutionNameMin: Cijk_Ailk_Bjlk_HBH_MT128x128x32_MI32x32x8x1_SE_1LDSB0_AF0EM8_AF1EM1_EPS0_GRVW8_GSU1_GSUAMB_NLCA1_NLCB1_PGR2_SU0_SUS0_SRVW4_TT2_64_VAW2_WSGRA1_WSGRB1_WG64_4_1_WGM1
    SolutionIndex: 29
    SolutionNameMin: Cijk_Ailk_Bjlk_HBH_MT128x192x16_MI32x32x8x1_SE_1LDSB0_AF0EM8_AF1EM1_EPS0_GRVW4_GSU1_GSUAMB_NLCA1_NLCB3_PGR2_SU0_SUS0_SRVW4_TT2_96_VAW2_WSGRA1_WSGRB1_WG64_4_1_WGM15
    SolutionIndex: 30
    SolutionNameMin: Cijk_Ailk_Bjlk_HBH_MT128x128x16_MI32x32x8x1_SE_1LDSB0_AF0EM8_AF1EM1_EPS0_GRVW8_GSU1_GSUAMB_NLCA1_NLCB1_PGR2_SU0_SUS0_SRVW4_TT2_64_VAW2_WSGRA1_WSGRB1_WG64_4_1_WGM2
    SolutionIndex: 31
    SolutionNameMin: Cijk_Ailk_Bjlk_HBH_MT128x256x16_MI32x32x8x1_SE_1LDSB0_AF0EM8_AF1EM1_EPS0_GRVW8_GSU1_GSUAMB_NLCA1_NLCB1_PGR2_SU0_SUS0_SRVW4_TT2_128_VAW2_WSGRA1_WSGRB1_WG64_4_1_WGM1
    SolutionIndex: 32
    SolutionNameMin: Cijk_Ailk_Bjlk_HBH_MT128x64x16_MI32x32x8x1_SE_1LDSB0_AF0EM8_AF1EM1_EPS0_GRVW8_GSU1_GSUAMB_NLCA1_NLCB1_PGR2_SU32_SUS128_SRVW4_TT2_32_VAW2_WSGRA1_WSGRB1_WG64_4_1_WGM1
    SolutionIndex: 33
    SolutionNameMin: Cijk_Ailk_Bjlk_HBH_MT128x128x16_MI32x32x8x1_SE_1LDSB0_AF0EM8_AF1EM1_EPS0_GRVW8_GSU1_GSUAMB_NLCA1_NLCB1_PGR2_SU32_SUS256_SRVW4_TT2_64_VAW2_WSGRA1_WSGRB1_WG64_4_1_WGM2
    SolutionIndex: 34
    SolutionNameMin: Cijk_Ailk_Bjlk_HBH_MT64x64x32_MI32x32x8x1_SE_1LDSB0_AF0EM8_AF1EM1_EPS0_GRVW8_GSU1_GSUAMB_NLCA1_NLCB1_PGR2_SU32_SUS128_SRVW4_TT1_32_VAW2_WSGRA1_WSGRB1_WG64_4_1_WGM1
    SolutionIndex: 35
    SolutionNameMin: Cijk_Ailk_Bjlk_HBH_MT128x128x32_MI32x32x8x1_SE_1LDSB0_AF0EM1_AF1EM1_EPS0_GRVW8_GSU1_GSUAMB_NLCA1_NLCB1_PGR2_SU0_SUS0_SRVW4_TT2_64_VAW2_WSGRA1_WSGRB1_WG64_4_1_WGM15
    SolutionIndex: 36
    SolutionNameMin: Cijk_Ailk_Bjlk_HBH_MT64x128x16_MI32x32x8x1_SE_1LDSB0_AF0EM1_AF1EM1_EPS0_GRVW4_GSU1_GSUAMB_NLCA1_NLCB1_PGR2_SU0_SUS0_SRVW4_TT1_64_VAW2_WSGRA1_WSGRB1_WG64_4_1_WGM15
    SolutionIndex: 37
    SolutionNameMin: Cijk_Ailk_Bjlk_HBH_MT64x128x16_MI32x32x8x1_SE_1LDSB0_AF0EM1_AF1EM1_EPS0_GRVW8_GSU1_GSUAMB_NLCA1_NLCB1_PGR2_SU0_SUS0_SRVW4_TT1_64_VAW2_WSGRA1_WSGRB1_WG64_4_1_WGM1
    SolutionIndex: 38
    SolutionNameMin: Cijk_Ailk_Bjlk_HBH_MT128x128x32_MI32x32x8x1_SE_1LDSB0_AF0EM8_AF1EM1_EPS1_GRVW8_GSU1_GSUAMB_NLCA1_NLCB1_PGR1_SU0_SUS0_SRVW4_TT2_64_VAW2_WSGRA1_WSGRB1_WG64_4_1_WGM1
    SolutionIndex: 39
    SolutionNameMin: Cijk_Ailk_Bjlk_HBH_MT128x64x16_MI32x32x8x1_SE_1LDSB0_AF0EM8_AF1EM1_EPS0_GRVW4_GSU1_GSUAMB_NLCA1_NLCB1_PGR2_SU0_SUS0_SRVW4_TT2_32_VAW2_WSGRA1_WSGRB1_WG64_4_1_WGM15
    SolutionIndex: 40
    SolutionNameMin: Cijk_Ailk_Bjlk_HBH_MT128x64x16_MI32x32x8x1_SE_1LDSB0_AF0EM8_AF1EM1_EPS0_GRVW4_GSU1_GSUAMB_NLCA1_NLCB1_PGR2_SU0_SUS0_SRVW4_TT2_32_VAW2_WSGRA1_WSGRB1_WG64_4_1_WGM2
    SolutionIndex: 41
    SolutionNameMin: Cijk_Ailk_Bjlk_HBH_MT128x128x16_MI32x32x8x1_SE_1LDSB0_AF0EM8_AF1EM1_EPS0_GRVW4_GSU1_GSUAMB_NLCA1_NLCB1_PGR2_SU0_SUS0_SRVW4_TT2_64_VAW2_WSGRA1_WSGRB1_WG64_4_1_WGM1
    SolutionIndex: 42
    SolutionNameMin: Cijk_Ailk_Bjlk_HBH_MT128x128x16_MI32x32x8x1_SE_1LDSB0_AF0EM8_AF1EM1_EPS0_GRVW8_GSU1_GSUAMB_NLCA1_NLCB1_PGR2_SU0_SUS0_SRVW4_TT2_64_VAW2_WSGRA1_WSGRB1_WG64_4_1_WGM1
    SolutionIndex: 43
    SolutionNameMin: Cijk_Ailk_Bjlk_HBH_MT64x64x32_MI32x32x8x1_SE_1LDSB0_AF0EM8_AF1EM1_EPS0_GRVW8_GSU1_GSUAMB_NLCA1_NLCB1_PGR2_SU32_SUS128_SRVW4_TT1_32_VAW2_WSGRA1_WSGRB1_WG64_4_1_WGM2
    SolutionIndex: 44
    SolutionNameMin: Cijk_Ailk_Bjlk_HBH_MT16x16x16_MI16x16x16x1_SE_1LDSB0_AF0EM1_AF1EM1_EPS1_GRVW2_GSU1_GSUAMB_NLCA1_NLCB1_PGR1_SU0_SUS0_SRVW0_TT1_16_VAW2_WSGRA1_WSGRB1_WG16_4_1_WGM1
    SolutionIndex: 45
    SolutionNameMin: Cijk_Ailk_Bjlk_HBH_MT16x16x16_MI16x16x16x1_SE_1LDSB0_AF0EM1_AF1EM1_EPS1_GRVW2_GSU1_GSUAMB_NLCA1_NLCB1_PGR1_SU32_SUS128_SRVW0_TT1_16_VAW2_WSGRA1_WSGRB1_WG16_4_1_WGM15
    SolutionIndex: 46
    SolutionNameMin: Cijk_Ailk_Bjlk_HBH_MT16x16x16_MI16x16x16x1_SE_1LDSB0_AF0EM8_AF1EM1_EPS1_GRVW2_GSU1_GSUAMB_NLCA1_NLCB1_PGR1_SU0_SUS0_SRVW0_TT1_16_VAW2_WSGRA1_WSGRB1_WG16_4_1_WGM1
    SolutionIndex: 47
    SolutionNameMin: Cijk_Ailk_Bjlk_HBH_MT16x16x16_MI16x16x16x1_SE_1LDSB0_AF0EM1_AF1EM1_EPS1_GRVW4_GSU1_GSUAMB_NLCA1_NLCB1_PGR1_SU0_SUS0_SRVW0_TT1_16_VAW2_WSGRA1_WSGRB1_WG16_4_1_WGM1
    SolutionIndex: 48
    SolutionNameMin: Cijk_Ailk_Bjlk_HBH_MT16x16x16_MI16x16x16x1_SE_1LDSB0_AF0EM1_AF1EM1_EPS1_GRVW2_GSU1_GSUAMB_NLCA1_NLCB1_PGR1_SU0_SUS0_SRVW4_TT1_16_VAW2_WSGRA1_WSGRB1_WG16_4_1_WGM1
    SolutionIndex: 49
    SolutionNameMin: Cijk_Ailk_Bjlk_HBH_MT16x16x16_MI16x16x16x1_SE_1LDSB0_AF0EM8_AF1EM1_EPS0_GRVW2_GSU1_GSUAMB_NLCA1_NLCB1_PGR2_SU0_SUS0_SRVW0_TT1_16_VAW2_WSGRA1_WSGRB1_WG16_4_1_WGM1
    SolutionIndex: 50
    SolutionNameMin: Cijk_Ailk_Bjlk_HBH_MT16x16x32_MI16x16x16x1_SE_1LDSB0_AF0EM1_AF1EM1_EPS0_GRVW8_GSU1_GSUAMB_NLCA1_NLCB1_PGR2_SU0_SUS0_SRVW0_TT1_16_VAW2_WSGRA1_WSGRB1_WG16_4_1_WGM1
    SolutionIndex: 51
    SolutionNameMin: Cijk_Ailk_Bjlk_HBH_MT32x32x16_MI16x16x16x1_SE_1LDSB0_AF0EM8_AF1EM1_EPS1_GRVW2_GSU1_GSUAMB_NLCA1_NLCB1_PGR1_SU0_SUS0_SRVW4_TT1_16_VAW2_WSGRA1_WSGRB1_WG32_8_1_WGM1
    SolutionIndex: 52
    SolutionNameMin: Cijk_Ailk_Bjlk_HBH_MT64x128x16_MI32x32x8x1_SE_1LDSB0_AF0EM8_AF1EM1_EPS0_GRVW2_GSU1_GSUAMB_NLCA1_NLCB1_PGR2_SU32_SUS128_SRVW4_TT1_64_VAW2_WSGRA1_WSGRB1_WG64_4_1_WGM1
    SolutionIndex: 53
    SolutionNameMin: Cijk_Ailk_Bjlk_HBH_MT64x128x16_MI32x32x8x1_SE_1LDSB0_AF0EM8_AF1EM1_EPS0_GRVW8_GSU1_GSUAMB_NLCA1_NLCB1_PGR2_SU32_SUS256_SRVW4_TT1_64_VAW2_WSGRA1_WSGRB1_WG64_4_1_WGM1
    SolutionIndex: 54
    SolutionNameMin: Cijk_Ailk_Bjlk_HBH_MT128x64x16_MI32x32x8x1_SE_1LDSB0_AF0EM8_AF1EM1_EPS0_GRVW2_GSU1_GSUAMB_NLCA1_NLCB1_PGR2_SU32_SUS256_SRVW4_TT2_32_VAW2_WSGRA1_WSGRB1_WG64_4_1_WGM15
    SolutionIndex: 55
    SolutionNameMin: Cijk_Ailk_Bjlk_HBH_MT16x64x32_MI16x16x16x1_SE_1LDSB0_AF0EM8_AF1EM1_EPS1_GRVW2_GSU1_GSUAMB_NLCA1_NLCB1_PGR1_SU0_SUS0_SRVW0_TT1_16_VAW2_WSGRA1_WSGRB1_WG16_16_1_WGM1
    SolutionIndex: 56
    SolutionNameMin: Cijk_Ailk_Bjlk_HBH_MT32x32x32_MI16x16x16x1_SE_1LDSB0_AF0EM1_AF1EM1_EPS0_GRVW2_GSU1_GSUAMB_NLCA1_NLCB1_PGR2_SU0_SUS0_SRVW4_TT1_16_VAW2_WSGRA1_WSGRB1_WG32_8_1_WGM1
    SolutionIndex: 57
    SolutionNameMin: Cijk_Ailk_Bjlk_HBH_MT64x32x16_MI16x16x16x1_SE_1LDSB0_AF0EM1_AF1EM1_EPS0_GRVW2_GSU1_GSUAMB_NLCA1_NLCB1_PGR2_SU0_SUS0_SRVW4_TT2_16_VAW2_WSGRA1_WSGRB1_WG32_8_1_WGM1
    SolutionIndex: 58
    SolutionNameMin: Cijk_Ailk_Bjlk_HBH_MT64x32x16_MI16x16x16x1_SE_1LDSB0_AF0EM8_AF1EM1_EPS0_GRVW4_GSU1_GSUAMB_NLCA1_NLCB1_PGR2_SU0_SUS0_SRVW4_TT2_16_VAW2_WSGRA1_WSGRB1_WG32_8_1_WGM1
    SolutionIndex: 59
    SolutionNameMin: Cijk_Ailk_Bjlk_HBH_MT128x96x32_MI32x32x8x1_SE_1LDSB0_AF0EM8_AF1EM1_EPS0_GRVW4_GSU1_GSUAMB_NLCA1_NLCB3_PGR2_SU0_SUS0_SRVW4_TT1_96_VAW2_WSGRA1_WSGRB1_WG128_2_1_WGM2
    SolutionIndex: 60
    SolutionNameMin: Cijk_Ailk_Bjlk_HBH_MT128x96x64_MI32x32x8x1_SE_1LDSB0_AF0EM8_AF1EM1_EPS0_GRVW4_GSU1_GSUAMB_NLCA1_NLCB3_PGR2_SU0_SUS0_SRVW4_TT1_96_VAW2_WSGRA1_WSGRB1_WG128_2_1_WGM2
    SolutionIndex: 61
    SolutionNameMin: Cijk_Ailk_Bjlk_HBH_MT256x160x32_MI32x32x8x1_SE_1LDSB0_AF0EM8_AF1EM1_EPS1_GRVW4_GSU1_GSUAMB_NLCA1_NLCB5_PGR1_SU0_SUS0_SRVW4_TT2_160_VAW2_WSGRA1_WSGRB1_WG128_2_1_WGM15
    SolutionIndex: 62
    SolutionNameMin: Cijk_Ailk_Bjlk_HBH_MT128x256x16_MI32x32x8x1_SE_1LDSB1_AF0EM8_AF1EM1_EPS0_GRVW8_GSU1_GSUAMB_NLCA1_NLCB1_PGR2_SU0_SUS0_SRVW4_TT2_128_VAW2_WSGRA1_WSGRB1_WG64_4_1_WGM1
    SolutionIndex: 63
    SolutionNameMin: Cijk_Ailk_Bjlk_HBH_MT128x128x32_MI32x32x8x1_SE_1LDSB0_AF0EM8_AF1EM1_EPS0_GRVW4_GSU1_GSUAMB_NLCA1_NLCB1_PGR2_SU0_SUS0_SRVW4_TT2_64_VAW2_WSGRA1_WSGRB1_WG64_4_1_WGM1
    SolutionIndex: 64
    SolutionNameMin: Cijk_Ailk_Bjlk_HBH_MT160x256x32_MI32x32x8x1_SE_1LDSB0_AF0EM8_AF1EM1_EPS1_GRVW4_GSU1_GSUAMB_NLCA5_NLCB1_PGR1_SU32_SUS128_SRVW0_TT5_64_VAW2_WSGRA1_WSGRB1_WG32_8_1_WGM1
    SolutionIndex: 65
    SolutionNameMin: Cijk_Ailk_Bjlk_HBH_MT16x64x64_MI16x16x16x1_SE_1LDSB0_AF0EM1_AF1EM1_EPS0_GRVW8_GSU15_GSUAMB_NLCA1_NLCB1_PGR2_SU32_SUS256_SRVW0_TT1_16_VAW1_WSGRA1_WSGRB1_WG16_16_1_WGM1
    SolutionIndex: 66
    SolutionNameMin: Cijk_Ailk_Bjlk_HBH_MT32x64x16_MI16x16x16x1_SE_1LDSB0_AF0EM1_AF1EM1_EPS1_GRVW2_GSU1_GSUAMB_NLCA1_NLCB1_PGR1_SU32_SUS128_SRVW4_TT1_32_VAW2_WSGRA1_WSGRB1_WG32_8_1_WGM2
    SolutionIndex: 67
    SolutionNameMin: Cijk_Ailk_Bjlk_HBH_MT32x32x16_MI16x16x16x1_SE_1LDSB0_AF0EM1_AF1EM1_EPS0_GRVW4_GSU1_GSUAMB_NLCA1_NLCB1_PGR2_SU0_SUS0_SRVW4_TT1_16_VAW2_WSGRA1_WSGRB1_WG32_8_1_WGM1
    SolutionIndex: 68
    SolutionNameMin: Cijk_Ailk_Bjlk_HBH_MT64x64x32_MI32x32x8x1_SE_1LDSB0_AF0EM8_AF1EM1_EPS0_GRVW8_GSU15_GSUAMB_NLCA1_NLCB1_PGR2_SU0_SUS0_SRVW4_TT1_32_VAW1_WSGRA1_WSGRB1_WG64_4_1_WGM15
    SolutionIndex: 69
    SolutionNameMin: Cijk_Ailk_Bjlk_HBH_MT64x128x32_MI32x32x8x1_SE_1LDSB0_AF0EM8_AF1EM1_EPS0_GRVW4_GSU7_GSUAMB_NLCA1_NLCB1_PGR2_SU32_SUS256_SRVW4_TT1_64_VAW1_WSGRA1_WSGRB1_WG64_4_1_WGM2
    SolutionIndex: 70
    SolutionNameMin: Cijk_Ailk_Bjlk_HBH_MT128x256x16_MI32x32x8x1_SE_1LDSB0_AF0EM8_AF1EM1_EPS0_GRVW4_GSU5_GSUAMB_NLCA1_NLCB1_PGR2_SU0_SUS0_SRVW4_TT2_128_VAW1_WSGRA1_WSGRB1_WG64_4_1_WGM15
    SolutionIndex: 71
    SolutionNameMin: Cijk_Ailk_Bjlk_HBH_MT128x128x32_MI32x32x8x1_SE_1LDSB0_AF0EM8_AF1EM1_EPS0_GRVW4_GSU2_GSUAMB_NLCA1_NLCB1_PGR2_SU0_SUS0_SRVW4_TT2_64_VAW1_WSGRA1_WSGRB1_WG64_4_1_WGM15
    SolutionIndex: 72
    SolutionNameMin: Cijk_Ailk_Bjlk_HBH_MT128x160x32_MI32x32x8x1_SE_1LDSB0_AF0EM8_AF1EM1_EPS0_GRVW4_GSU2_GSUAMB_NLCA1_NLCB5_PGR2_SU0_SUS0_SRVW4_TT1_160_VAW1_WSGRA1_WSGRB1_WG128_2_1_WGM2
    SolutionIndex: 73
    SolutionNameMin: Cijk_Ailk_Bjlk_HBH_MT128x256x16_MI32x32x8x1_SE_1LDSB0_AF0EM8_AF1EM1_EPS0_GRVW4_GSU3_GSUAMB_NLCA1_NLCB1_PGR2_SU0_SUS0_SRVW4_TT2_128_VAW1_WSGRA1_WSGRB1_WG64_4_1_WGM2
    SolutionIndex: 74
    SolutionNameMin: Cijk_Ailk_Bjlk_HBH_MT128x160x32_MI32x32x8x1_SE_1LDSB0_AF0EM8_AF1EM1_EPS0_GRVW4_GSU1_GSUAMB_NLCA1_NLCB5_PGR2_SU0_SUS0_SRVW4_TT1_160_VAW2_WSGRA1_WSGRB1_WG128_2_1_WGM2
    SolutionIndex: 75
    SolutionNameMin: Cijk_Ailk_Bjlk_HBH_MT128x160x32_MI32x32x8x1_SE_1LDSB0_AF0EM8_AF1EM1_EPS0_GRVW4_GSU1_GSUAMB_NLCA1_NLCB5_PGR2_SU0_SUS0_SRVW4_TT1_160_VAW2_WSGRA1_WSGRB1_WG128_2_1_WGM15
    SolutionIndex: 76
    SolutionNameMin: Cijk_Ailk_Bjlk_HBH_MT128x192x32_MI32x32x8x1_SE_1LDSB0_AF0EM8_AF1EM1_EPS0_GRVW4_GSU1_GSUAMB_NLCA1_NLCB3_PGR2_SU0_SUS0_SRVW4_TT2_96_VAW2_WSGRA1_WSGRB1_WG64_4_1_WGM2
    SolutionIndex: 77
    SolutionNameMin: Cijk_Ailk_Bjlk_HBH_MT128x256x16_MI32x32x8x1_SE_1LDSB1_AF0EM8_AF1EM1_EPS0_GRVW8_GSU1_GSUAMB_NLCA1_NLCB1_PGR2_SU0_SUS0_SRVW4_TT2_128_VAW2_WSGRA1_WSGRB1_WG64_4_1_WGM2
    SolutionIndex: 78
    SolutionNameMin: Cijk_Ailk_Bjlk_HBH_MT128x256x16_MI32x32x8x1_SE_1LDSB0_AF0EM1_AF1EM1_EPS0_GRVW8_GSU1_GSUAMB_NLCA1_NLCB1_PGR2_SU0_SUS0_SRVW4_TT2_128_VAW2_WSGRA1_WSGRB1_WG64_4_1_WGM1
    SolutionIndex: 79
    SolutionNameMin: Cijk_Ailk_Bjlk_HBH_MT128x288x32_MI32x32x8x1_SE_1LDSB0_AF0EM8_AF1EM1_EPS0_GRVW4_GSU1_GSUAMB_NLCA1_NLCB9_PGR2_SU0_SUS0_SRVW4_TT1_288_VAW2_WSGRA1_WSGRB1_WG128_2_1_WGM15
    SolutionIndex: 80
    SolutionNameMin: Cijk_Ailk_Bjlk_HBH_MT128x288x32_MI32x32x8x1_SE_1LDSB0_AF0EM8_AF1EM1_EPS0_GRVW2_GSU1_GSUAMB_NLCA1_NLCB9_PGR2_SU0_SUS0_SRVW4_TT1_288_VAW2_WSGRA1_WSGRB1_WG128_2_1_WGM15
    SolutionIndex: 81
    SolutionNameMin: Cijk_Ailk_Bjlk_HBH_MT128x288x32_MI32x32x8x1_SE_1LDSB0_AF0EM8_AF1EM1_EPS1_GRVW4_GSU1_GSUAMB_NLCA1_NLCB9_PGR1_SU0_SUS0_SRVW4_TT1_288_VAW2_WSGRA1_WSGRB1_WG128_2_1_WGM1
    SolutionIndex: 82
    SolutionNameMin: Cijk_Ailk_Bjlk_HBH_MT256x160x32_MI32x32x8x1_SE_1LDSB0_AF0EM8_AF1EM1_EPS0_GRVW2_GSU1_GSUAMB_NLCA2_NLCB5_PGR2_SU0_SUS0_SRVW4_TT2_160_VAW2_WSGRA1_WSGRB1_WG128_2_1_WGM15
    SolutionIndex: 83
    SolutionNameMin: Cijk_Ailk_Bjlk_HBH_MT256x160x32_MI32x32x8x1_SE_1LDSB0_AF0EM8_AF1EM1_EPS1_GRVW4_GSU1_GSUAMB_NLCA1_NLCB5_PGR1_SU0_SUS0_SRVW4_TT2_160_VAW2_WSGRA1_WSGRB1_WG128_2_1_WGM2
    SolutionIndex: 84
    SolutionNameMin: Cijk_Ailk_Bjlk_HBH_MT128x128x32_MI32x32x8x1_SE_1LDSB0_AF0EM1_AF1EM1_EPS0_GRVW4_GSU1_GSUAMB_NLCA1_NLCB1_PGR2_SU0_SUS0_SRVW4_TT2_64_VAW2_WSGRA1_WSGRB1_WG64_4_1_WGM2
    SolutionIndex: 85
    SolutionNameMin: Cijk_Ailk_Bjlk_HBH_MT128x256x16_MI32x32x8x1_SE_1LDSB1_AF0EM1_AF1EM1_EPS0_GRVW8_GSU1_GSUAMB_NLCA1_NLCB1_PGR2_SU0_SUS0_SRVW4_TT2_128_VAW2_WSGRA1_WSGRB1_WG64_4_1_WGM1
    SolutionIndex: 86
    SolutionNameMin: Cijk_Ailk_Bjlk_HBH_MT128x256x16_MI32x32x8x1_SE_1LDSB0_AF0EM8_AF1EM1_EPS0_GRVW4_GSU1_GSUAMB_NLCA1_NLCB1_PGR2_SU0_SUS0_SRVW4_TT2_128_VAW2_WSGRA1_WSGRB1_WG64_4_1_WGM15
    SolutionIndex: 87
    SolutionNameMin: Cijk_Ailk_Bjlk_HBH_MT128x256x16_MI32x32x8x1_SE_1LDSB0_AF0EM1_AF1EM1_EPS0_GRVW8_GSU1_GSUAMB_NLCA1_NLCB1_PGR2_SU0_SUS0_SRVW4_TT2_128_VAW2_WSGRA1_WSGRB1_WG64_4_1_WGM15
    SolutionIndex: 88
    SolutionNameMin: Cijk_Ailk_Bjlk_HBH_MT128x128x32_MI32x32x8x1_SE_1LDSB0_AF0EM1_AF1EM1_EPS0_GRVW4_GSU1_GSUAMB_NLCA1_NLCB1_PGR2_SU0_SUS0_SRVW4_TT2_64_VAW2_WSGRA1_WSGRB1_WG64_4_1_WGM1
    SolutionIndex: 89
    SolutionNameMin: Cijk_Ailk_Bjlk_HBH_MT64x32x16_MI16x16x16x1_SE_1LDSB0_AF0EM8_AF1EM1_EPS1_GRVW8_GSU1_GSUAMB_NLCA1_NLCB1_PGR1_SU32_SUS128_SRVW4_TT2_16_VAW2_WSGRA1_WSGRB1_WG32_8_1_WGM2
    SolutionIndex: 90
    SolutionNameMin: Cijk_Ailk_Bjlk_HBH_MT128x128x32_MI32x32x8x1_SE_1LDSB0_AF0EM1_AF1EM1_EPS0_GRVW8_GSU1_GSUAMB_NLCA1_NLCB1_PGR2_SU0_SUS0_SRVW4_TT2_64_VAW2_WSGRA1_WSGRB1_WG64_4_1_WGM2
    SolutionIndex: 91
    SolutionNameMin: Cijk_Ailk_Bjlk_HBH_MT128x288x16_MI32x32x8x1_SE_1LDSB0_AF0EM8_AF1EM1_EPS0_GRVW2_GSU1_GSUAMB_NLCA1_NLCB9_PGR2_SU0_SUS0_SRVW4_TT1_288_VAW2_WSGRA1_WSGRB1_WG128_2_1_WGM15
    SolutionIndex: 92
    SolutionNameMin: Cijk_Ailk_Bjlk_HBH_MT64x64x32_MI32x32x8x1_SE_1LDSB0_AF0EM1_AF1EM1_EPS0_GRVW8_GSU1_GSUAMB_NLCA1_NLCB1_PGR2_SU0_SUS0_SRVW4_TT1_32_VAW2_WSGRA1_WSGRB1_WG64_4_1_WGM1
    SolutionIndex: 93
    SolutionNameMin: Cijk_Ailk_Bjlk_HBH_MT128x128x32_MI32x32x8x1_SE_1LDSB0_AF0EM8_AF1EM1_EPS0_GRVW8_GSU3_GSUAMB_NLCA1_NLCB1_PGR2_SU0_SUS0_SRVW4_TT2_64_VAW1_WSGRA1_WSGRB1_WG64_4_1_WGM1
    SolutionIndex: 94
    SolutionNameMin: Cijk_Ailk_Bjlk_HBH_MT128x64x64_MI32x32x8x1_SE_1LDSB0_AF0EM8_AF1EM1_EPS1_GRVW8_GSU5_GSUAMB_NLCA1_NLCB1_PGR1_SU0_SUS0_SRVW0_TT2_32_VAW1_WSGRA1_WSGRB1_WG64_4_1_WGM2
    SolutionIndex: 95
    SolutionNameMin: Cijk_Ailk_Bjlk_HBH_MT32x32x32_MI16x16x16x1_SE_1LDSB0_AF0EM8_AF1EM1_EPS1_GRVW2_GSU1_GSUAMB_NLCA1_NLCB1_PGR1_SU0_SUS0_SRVW4_TT1_16_VAW2_WSGRA1_WSGRB1_WG32_8_1_WGM1
    SolutionIndex: 96
    SolutionNameMin: Cijk_Ailk_Bjlk_HBH_MT128x64x16_MI32x32x8x1_SE_1LDSB0_AF0EM8_AF1EM1_EPS0_GRVW4_GSU1_GSUAMB_NLCA1_NLCB1_PGR2_SU0_SUS0_SRVW4_TT2_32_VAW2_WSGRA1_WSGRB1_WG64_4_1_WGM1
    SolutionIndex: 97
    SolutionNameMin: Cijk_Ailk_Bjlk_HBH_MT64x64x64_MI32x32x8x1_SE_1LDSB0_AF0EM8_AF1EM1_EPS1_GRVW8_GSU3_GSUAMB_NLCA1_NLCB1_PGR1_SU0_SUS0_SRVW0_TT1_32_VAW1_WSGRA1_WSGRB1_WG64_4_1_WGM1
    SolutionIndex: 98
    SolutionNameMin: Cijk_Ailk_Bjlk_HBH_MT64x64x64_MI32x32x8x1_SE_1LDSB0_AF0EM8_AF1EM1_EPS1_GRVW8_GSU3_GSUAMB_NLCA1_NLCB1_PGR1_SU0_SUS0_SRVW0_TT1_32_VAW1_WSGRA1_WSGRB1_WG64_4_1_WGM2
    SolutionIndex: 99
    SolutionNameMin: Cijk_Ailk_Bjlk_HBH_MT64x128x64_MI32x32x8x1_SE_1LDSB0_AF0EM8_AF1EM1_EPS1_GRVW8_GSU3_GSUAMB_NLCA1_NLCB1_PGR1_SU32_SUS128_SRVW0_TT1_64_VAW1_WSGRA1_WSGRB1_WG64_4_1_WGM2
    SolutionIndex: 100
    SolutionNameMin: Cijk_Ailk_Bjlk_HBH_MT128x64x64_MI32x32x8x1_SE_1LDSB0_AF0EM8_AF1EM1_EPS1_GRVW8_GSU3_GSUAMB_NLCA1_NLCB1_PGR1_SU0_SUS0_SRVW0_TT2_32_VAW1_WSGRA1_WSGRB1_WG64_4_1_WGM1
    SolutionIndex: 101
    SolutionNameMin: Cijk_Ailk_Bjlk_HBH_MT128x128x64_MI32x32x8x1_SE_1LDSB0_AF0EM8_AF1EM1_EPS0_GRVW8_GSU15_GSUAMB_NLCA1_NLCB1_PGR2_SU0_SUS0_SRVW4_TT2_64_VAW1_WSGRA1_WSGRB1_WG64_4_1_WGM2
    SolutionIndex: 102
    SolutionNameMin: Cijk_Ailk_Bjlk_HBH_MT128x128x32_MI32x32x8x1_SE_1LDSB0_AF0EM8_AF1EM1_EPS0_GRVW4_GSU3_GSUAMB_NLCA1_NLCB1_PGR2_SU0_SUS0_SRVW4_TT2_64_VAW1_WSGRA1_WSGRB1_WG64_4_1_WGM15
    SolutionIndex: 103
    SolutionNameMin: Cijk_Ailk_Bjlk_HBH_MT64x64x16_MI32x32x8x1_SE_1LDSB0_AF0EM8_AF1EM1_EPS0_GRVW2_GSU1_GSUAMB_NLCA1_NLCB1_PGR2_SU32_SUS256_SRVW4_TT1_32_VAW2_WSGRA1_WSGRB1_WG64_4_1_WGM1
    SolutionIndex: 104
    SolutionNameMin: Cijk_Ailk_Bjlk_HBH_MT128x256x32_MI32x32x8x1_SE_1LDSB0_AF0EM8_AF1EM1_EPS1_GRVW8_GSU3_GSUAMB_NLCA1_NLCB1_PGR1_SU0_SUS0_SRVW4_TT2_128_VAW1_WSGRA1_WSGRB1_WG64_4_1_WGM15
    SolutionIndex: 105
    SolutionNameMin: Cijk_Ailk_Bjlk_HBH_MT128x64x32_MI32x32x8x1_SE_1LDSB0_AF0EM8_AF1EM1_EPS0_GRVW8_GSU1_GSUAMB_NLCA1_NLCB1_PGR2_SU0_SUS0_SRVW4_TT2_32_VAW2_WSGRA1_WSGRB1_WG64_4_1_WGM2
    SolutionIndex: 106
    SolutionNameMin: Cijk_Ailk_Bjlk_HBH_MT64x128x32_MI32x32x8x1_SE_1LDSB0_AF0EM1_AF1EM1_EPS0_GRVW4_GSU1_GSUAMB_NLCA1_NLCB1_PGR2_SU0_SUS0_SRVW4_TT1_64_VAW2_WSGRA1_WSGRB1_WG64_4_1_WGM2
    SolutionIndex: 107
    SolutionNameMin: Cijk_Ailk_Bjlk_HBH_MT64x128x16_MI32x32x8x1_SE_1LDSB0_AF0EM8_AF1EM1_EPS0_GRVW8_GSU1_GSUAMB_NLCA1_NLCB1_PGR2_SU32_SUS128_SRVW4_TT1_64_VAW2_WSGRA1_WSGRB1_WG64_4_1_WGM2
    SolutionIndex: 108
    SolutionNameMin: Cijk_Ailk_Bjlk_HBH_MT16x16x16_MI16x16x16x1_SE_1LDSB0_AF0EM1_AF1EM1_EPS0_GRVW2_GSU1_GSUAMB_NLCA1_NLCB1_PGR2_SU32_SUS256_SRVW4_TT1_16_VAW2_WSGRA1_WSGRB1_WG16_4_1_WGM1
    SolutionIndex: 109
    SolutionNameMin: Cijk_Ailk_Bjlk_HBH_MT32x64x16_MI16x16x16x1_SE_1LDSB1_AF0EM1_AF1EM1_EPS0_GRVW8_GSU1_GSUAMB_NLCA1_NLCB1_PGR2_SU0_SUS0_SRVW4_TT1_32_VAW2_WSGRA1_WSGRB1_WG32_8_1_WGM2
    SolutionIndex: 110
    SolutionNameMin: Cijk_Ailk_Bjlk_HBH_MT32x64x16_MI16x16x16x1_SE_1LDSB1_AF0EM1_AF1EM1_EPS1_GRVW2_GSU1_GSUAMB_NLCA1_NLCB1_PGR1_SU0_SUS0_SRVW4_TT1_32_VAW2_WSGRA1_WSGRB1_WG32_8_1_WGM15
    SolutionIndex: 111
    SolutionNameMin: Cijk_Ailk_Bjlk_HBH_MT32x64x16_MI16x16x16x1_SE_1LDSB0_AF0EM1_AF1EM1_EPS1_GRVW2_GSU1_GSUAMB_NLCA1_NLCB1_PGR1_SU0_SUS0_SRVW4_TT1_32_VAW2_WSGRA1_WSGRB1_WG32_8_1_WGM1
    SolutionIndex: 112
    SolutionNameMin: Cijk_Ailk_Bjlk_HBH_MT32x64x16_MI16x16x16x1_SE_1LDSB0_AF0EM8_AF1EM1_EPS1_GRVW2_GSU1_GSUAMB_NLCA1_NLCB1_PGR1_SU0_SUS0_SRVW4_TT1_32_VAW2_WSGRA1_WSGRB1_WG32_8_1_WGM15
    SolutionIndex: 113
    SolutionNameMin: Cijk_Ailk_Bjlk_HBH_MT32x64x16_MI16x16x16x1_SE_1LDSB0_AF0EM1_AF1EM1_EPS1_GRVW2_GSU1_GSUAMB_NLCA1_NLCB1_PGR1_SU32_SUS256_SRVW4_TT1_32_VAW2_WSGRA1_WSGRB1_WG32_8_1_WGM2
    SolutionIndex: 114
    SolutionNameMin: Cijk_Ailk_Bjlk_HBH_MT32x64x16_MI16x16x16x1_SE_1LDSB0_AF0EM1_AF1EM1_EPS0_GRVW2_GSU1_GSUAMB_NLCA1_NLCB1_PGR2_SU32_SUS256_SRVW4_TT1_32_VAW2_WSGRA1_WSGRB1_WG32_8_1_WGM15
    SolutionIndex: 115
    SolutionNameMin: Cijk_Ailk_Bjlk_HBH_MT32x64x16_MI16x16x16x1_SE_1LDSB0_AF0EM8_AF1EM1_EPS0_GRVW8_GSU1_GSUAMB_NLCA1_NLCB1_PGR2_SU32_SUS256_SRVW4_TT1_32_VAW2_WSGRA1_WSGRB1_WG32_8_1_WGM2
    SolutionIndex: 116
    SolutionNameMin: Cijk_Ailk_Bjlk_HBH_MT64x32x16_MI16x16x16x1_SE_1LDSB1_AF0EM8_AF1EM1_EPS1_GRVW2_GSU1_GSUAMB_NLCA1_NLCB1_PGR1_SU0_SUS0_SRVW4_TT2_16_VAW2_WSGRA1_WSGRB1_WG32_8_1_WGM1
    SolutionIndex: 117
    SolutionNameMin: Cijk_Ailk_Bjlk_HBH_MT64x32x16_MI16x16x16x1_SE_1LDSB0_AF0EM8_AF1EM1_EPS0_GRVW8_GSU1_GSUAMB_NLCA1_NLCB1_PGR2_SU32_SUS128_SRVW4_TT2_16_VAW2_WSGRA1_WSGRB1_WG32_8_1_WGM2
    SolutionIndex: 118
    SolutionNameMin: Cijk_Ailk_Bjlk_HBH_MT64x32x16_MI16x16x16x1_SE_1LDSB0_AF0EM8_AF1EM1_EPS0_GRVW2_GSU1_GSUAMB_NLCA1_NLCB1_PGR2_SU32_SUS128_SRVW4_TT2_16_VAW2_WSGRA1_WSGRB1_WG32_8_1_WGM1
    SolutionIndex: 119
    SolutionNameMin: Cijk_Ailk_Bjlk_HBH_MT64x64x16_MI32x32x8x1_SE_1LDSB0_AF0EM8_AF1EM1_EPS1_GRVW2_GSU1_GSUAMB_NLCA1_NLCB1_PGR1_SU32_SUS256_SRVW4_TT1_32_VAW2_WSGRA1_WSGRB1_WG64_4_1_WGM1
    SolutionIndex: 120
    SolutionNameMin: Cijk_Ailk_Bjlk_HBH_MT64x64x16_MI32x32x8x1_SE_1LDSB0_AF0EM8_AF1EM1_EPS0_GRVW8_GSU1_GSUAMB_NLCA1_NLCB1_PGR2_SU32_SUS256_SRVW4_TT1_32_VAW2_WSGRA1_WSGRB1_WG64_4_1_WGM1
    SolutionIndex: 121
    SolutionNameMin: Cijk_Ailk_Bjlk_HBH_MT64x64x16_MI32x32x8x1_SE_1LDSB0_AF0EM8_AF1EM1_EPS0_GRVW2_GSU1_GSUAMB_NLCA1_NLCB1_PGR2_SU0_SUS0_SRVW4_TT1_32_VAW2_WSGRA1_WSGRB1_WG64_4_1_WGM2
    SolutionIndex: 122
    SolutionNameMin: Cijk_Ailk_Bjlk_HBH_MT128x96x32_MI32x32x8x1_SE_1LDSB0_AF0EM8_AF1EM1_EPS0_GRVW4_GSU1_GSUAMB_NLCA1_NLCB3_PGR2_SU0_SUS0_SRVW4_TT1_96_VAW2_WSGRA1_WSGRB1_WG128_2_1_WGM15
    SolutionIndex: 123
    SolutionNameMin: Cijk_Ailk_Bjlk_HBH_MT32x64x16_MI16x16x16x1_SE_1LDSB0_AF0EM1_AF1EM1_EPS0_GRVW8_GSU1_GSUAMB_NLCA1_NLCB1_PGR2_SU32_SUS256_SRVW4_TT1_32_VAW2_WSGRA1_WSGRB1_WG32_8_1_WGM2
    SolutionIndex: 124
    SolutionNameMin: Cijk_Ailk_Bjlk_HBH_MT64x192x32_MI32x32x8x1_SE_1LDSB0_AF0EM8_AF1EM1_EPS0_GRVW4_GSU1_GSUAMB_NLCA1_NLCB3_PGR2_SU0_SUS0_SRVW4_TT1_96_VAW2_WSGRA1_WSGRB1_WG64_4_1_WGM1
    SolutionIndex: 125
    SolutionNameMin: Cijk_Ailk_Bjlk_HBH_MT64x128x16_MI32x32x8x1_SE_1LDSB0_AF0EM8_AF1EM1_EPS0_GRVW2_GSU1_GSUAMB_NLCA1_NLCB1_PGR2_SU0_SUS0_SRVW4_TT1_64_VAW2_WSGRA1_WSGRB1_WG64_4_1_WGM2
    SolutionIndex: 126
    SolutionNameMin: Cijk_Ailk_Bjlk_HBH_MT64x128x16_MI32x32x8x1_SE_1LDSB0_AF0EM8_AF1EM1_EPS0_GRVW4_GSU1_GSUAMB_NLCA1_NLCB1_PGR2_SU32_SUS128_SRVW4_TT1_64_VAW2_WSGRA1_WSGRB1_WG64_4_1_WGM1
    SolutionIndex: 127
    SolutionNameMin: Cijk_Ailk_Bjlk_HBH_MT64x128x16_MI32x32x8x1_SE_1LDSB0_AF0EM8_AF1EM1_EPS0_GRVW4_GSU1_GSUAMB_NLCA1_NLCB1_PGR2_SU0_SUS0_SRVW4_TT1_64_VAW2_WSGRA1_WSGRB1_WG64_4_1_WGM2
    SolutionIndex: 128
    SolutionNameMin: Cijk_Ailk_Bjlk_HBH_MT64x64x16_MI32x32x8x1_SE_1LDSB0_AF0EM1_AF1EM1_EPS0_GRVW2_GSU1_GSUAMB_NLCA1_NLCB1_PGR2_SU32_SUS128_SRVW4_TT1_32_VAW2_WSGRA1_WSGRB1_WG64_4_1_WGM15
    SolutionIndex: 129
    SolutionNameMin: Cijk_Ailk_Bjlk_HBH_MT64x64x16_MI32x32x8x1_SE_1LDSB0_AF0EM1_AF1EM1_EPS1_GRVW2_GSU1_GSUAMB_NLCA1_NLCB1_PGR1_SU0_SUS0_SRVW4_TT1_32_VAW2_WSGRA1_WSGRB1_WG64_4_1_WGM2
    SolutionIndex: 130
    SolutionNameMin: Cijk_Ailk_Bjlk_HBH_MT64x64x16_MI32x32x8x1_SE_1LDSB0_AF0EM1_AF1EM1_EPS0_GRVW2_GSU1_GSUAMB_NLCA1_NLCB1_PGR2_SU32_SUS128_SRVW4_TT1_32_VAW2_WSGRA1_WSGRB1_WG64_4_1_WGM2
    SolutionIndex: 131
    SolutionNameMin: Cijk_Ailk_Bjlk_HBH_MT64x64x16_MI32x32x8x1_SE_1LDSB0_AF0EM1_AF1EM1_EPS1_GRVW8_GSU1_GSUAMB_NLCA1_NLCB1_PGR1_SU0_SUS0_SRVW4_TT1_32_VAW2_WSGRA1_WSGRB1_WG64_4_1_WGM1
    SolutionIndex: 132
    SolutionNameMin: Cijk_Ailk_Bjlk_HBH_MT128x96x16_MI32x32x8x1_SE_1LDSB0_AF0EM1_AF1EM1_EPS1_GRVW2_GSU1_GSUAMB_NLCA1_NLCB3_PGR1_SU32_SUS256_SRVW4_TT1_96_VAW2_WSGRA1_WSGRB1_WG128_2_1_WGM15
    SolutionIndex: 133
    SolutionNameMin: Cijk_Ailk_Bjlk_HBH_MT128x96x16_MI32x32x8x1_SE_1LDSB0_AF0EM1_AF1EM1_EPS1_GRVW2_GSU1_GSUAMB_NLCA1_NLCB3_PGR1_SU0_SUS0_SRVW4_TT1_96_VAW2_WSGRA1_WSGRB1_WG128_2_1_WGM15
    SolutionIndex: 134
    SolutionNameMin: Cijk_Ailk_Bjlk_HBH_MT64x128x16_MI32x32x8x1_SE_1LDSB0_AF0EM1_AF1EM1_EPS0_GRVW8_GSU1_GSUAMB_NLCA1_NLCB1_PGR2_SU32_SUS128_SRVW4_TT1_64_VAW2_WSGRA1_WSGRB1_WG64_4_1_WGM2
    SolutionIndex: 135
    SolutionNameMin: Cijk_Ailk_Bjlk_HBH_MT64x128x16_MI32x32x8x1_SE_1LDSB0_AF0EM8_AF1EM1_EPS0_GRVW4_GSU1_GSUAMB_NLCA1_NLCB1_PGR2_SU0_SUS0_SRVW4_TT1_64_VAW2_WSGRA1_WSGRB1_WG64_4_1_WGM1
    SolutionIndex: 136
    SolutionNameMin: Cijk_Ailk_Bjlk_HBH_MT64x64x16_MI32x32x8x1_SE_1LDSB0_AF0EM1_AF1EM1_EPS0_GRVW4_GSU1_GSUAMB_NLCA1_NLCB1_PGR2_SU0_SUS0_SRVW4_TT1_32_VAW2_WSGRA1_WSGRB1_WG64_4_1_WGM1
    SolutionIndex: 137
    SolutionNameMin: Cijk_Ailk_Bjlk_HBH_MT64x64x16_MI32x32x8x1_SE_1LDSB0_AF0EM8_AF1EM1_EPS0_GRVW2_GSU1_GSUAMB_NLCA1_NLCB1_PGR2_SU0_SUS0_SRVW4_TT1_32_VAW2_WSGRA1_WSGRB1_WG64_4_1_WGM1
    SolutionIndex: 138
    SolutionNameMin: Cijk_Ailk_Bjlk_HBH_MT96x128x32_MI32x32x8x1_SE_1LDSB0_AF0EM1_AF1EM1_EPS0_GRVW4_GSU1_GSUAMB_NLCA3_NLCB1_PGR2_SU0_SUS0_SRVW0_TT3_32_VAW2_WSGRA1_WSGRB1_WG32_8_1_WGM1
    SolutionIndex: 139
    SolutionNameMin: Cijk_Ailk_Bjlk_HBH_MT64x128x32_MI32x32x8x1_SE_1LDSB0_AF0EM1_AF1EM1_EPS0_GRVW8_GSU1_GSUAMB_NLCA1_NLCB1_PGR2_SU32_SUS256_SRVW4_TT1_64_VAW2_WSGRA1_WSGRB1_WG64_4_1_WGM15
    SolutionIndex: 140
    SolutionNameMin: Cijk_Ailk_Bjlk_HBH_MT128x64x16_MI32x32x8x1_SE_1LDSB0_AF0EM8_AF1EM1_EPS0_GRVW8_GSU1_GSUAMB_NLCA1_NLCB1_PGR2_SU32_SUS256_SRVW4_TT2_32_VAW2_WSGRA1_WSGRB1_WG64_4_1_WGM1
    SolutionIndex: 141
    SolutionNameMin: Cijk_Ailk_Bjlk_HBH_MT128x128x16_MI32x32x8x1_SE_1LDSB0_AF0EM8_AF1EM1_EPS0_GRVW4_GSU1_GSUAMB_NLCA1_NLCB1_PGR2_SU0_SUS0_SRVW4_TT2_64_VAW2_WSGRA1_WSGRB1_WG64_4_1_WGM15
    SolutionIndex: 142
    SolutionNameMin: Cijk_Ailk_Bjlk_HBH_MT128x128x16_MI32x32x8x1_SE_1LDSB0_AF0EM8_AF1EM1_EPS0_GRVW8_GSU1_GSUAMB_NLCA1_NLCB1_PGR2_SU0_SUS0_SRVW4_TT2_64_VAW2_WSGRA1_WSGRB1_WG64_4_1_WGM15
    SolutionIndex: 143
    SolutionNameMin: Cijk_Ailk_Bjlk_HBH_MT128x128x16_MI32x32x8x1_SE_1LDSB0_AF0EM1_AF1EM1_EPS0_GRVW8_GSU1_GSUAMB_NLCA1_NLCB1_PGR2_SU0_SUS0_SRVW4_TT2_64_VAW2_WSGRA1_WSGRB1_WG64_4_1_WGM2
    SolutionIndex: 144
    SolutionNameMin: Cijk_Ailk_Bjlk_HBH_MT64x128x16_MI32x32x8x1_SE_1LDSB0_AF0EM1_AF1EM1_EPS0_GRVW8_GSU1_GSUAMB_NLCA1_NLCB1_PGR2_SU32_SUS128_SRVW4_TT1_64_VAW2_WSGRA1_WSGRB1_WG64_4_1_WGM1
    SolutionIndex: 145
    SolutionNameMin: Cijk_Ailk_Bjlk_HBH_MT128x256x16_MI32x32x8x1_SE_1LDSB1_AF0EM1_AF1EM1_EPS0_GRVW8_GSU1_GSUAMB_NLCA1_NLCB1_PGR2_SU0_SUS0_SRVW4_TT2_128_VAW2_WSGRA1_WSGRB1_WG64_4_1_WGM2
    SolutionIndex: 146
    SolutionNameMin: Cijk_Ailk_Bjlk_HBH_MT64x32x16_MI16x16x16x1_SE_1LDSB0_AF0EM8_AF1EM1_EPS0_GRVW2_GSU1_GSUAMB_NLCA1_NLCB1_PGR2_SU32_SUS256_SRVW4_TT2_16_VAW2_WSGRA1_WSGRB1_WG32_8_1_WGM2
    SolutionIndex: 147
    SolutionNameMin: Cijk_Ailk_Bjlk_HBH_MT128x96x16_MI32x32x8x1_SE_1LDSB0_AF0EM8_AF1EM1_EPS0_GRVW2_GSU1_GSUAMB_NLCA1_NLCB3_PGR2_SU0_SUS0_SRVW4_TT1_96_VAW2_WSGRA1_WSGRB1_WG128_2_1_WGM15
    SolutionIndex: 148
    SolutionNameMin: Cijk_Ailk_Bjlk_HBH_MT64x128x16_MI32x32x8x1_SE_1LDSB0_AF0EM8_AF1EM1_EPS1_GRVW2_GSU1_GSUAMB_NLCA1_NLCB1_PGR1_SU32_SUS128_SRVW4_TT1_64_VAW2_WSGRA1_WSGRB1_WG64_4_1_WGM15
    SolutionIndex: 149
    SolutionNameMin: Cijk_Ailk_Bjlk_HBH_MT64x16x32_MI16x16x16x1_SE_1LDSB0_AF0EM8_AF1EM1_EPS0_GRVW8_GSU15_GSUAMB_NLCA1_NLCB1_PGR2_SU32_SUS128_SRVW0_TT1_16_VAW1_WSGRA1_WSGRB1_WG64_4_1_WGM2
    SolutionIndex: 150
    SolutionNameMin: Cijk_Ailk_Bjlk_HBH_MT64x64x16_MI32x32x8x1_SE_1LDSB0_AF0EM8_AF1EM1_EPS0_GRVW8_GSU1_GSUAMB_NLCA1_NLCB1_PGR2_SU0_SUS0_SRVW4_TT1_32_VAW2_WSGRA1_WSGRB1_WG64_4_1_WGM1
    SolutionIndex: 151
    SolutionNameMin: Cijk_Ailk_Bjlk_HBH_MT64x128x16_MI32x32x8x1_SE_1LDSB0_AF0EM8_AF1EM1_EPS0_GRVW2_GSU1_GSUAMB_NLCA1_NLCB1_PGR2_SU32_SUS256_SRVW4_TT1_64_VAW2_WSGRA1_WSGRB1_WG64_4_1_WGM2
    SolutionIndex: 152
    SolutionNameMin: Cijk_Ailk_Bjlk_HBH_MT16x16x32_MI16x16x16x1_SE_1LDSB0_AF0EM8_AF1EM1_EPS0_GRVW2_GSU5_GSUAMB_NLCA1_NLCB1_PGR2_SU0_SUS0_SRVW0_TT1_16_VAW1_WSGRA1_WSGRB1_WG16_4_1_WGM1
    SolutionIndex: 153
    SolutionNameMin: Cijk_Ailk_Bjlk_HBH_MT64x32x16_MI16x16x16x1_SE_1LDSB0_AF0EM8_AF1EM1_EPS1_GRVW2_GSU1_GSUAMB_NLCA1_NLCB1_PGR1_SU0_SUS0_SRVW4_TT2_16_VAW2_WSGRA1_WSGRB1_WG32_8_1_WGM15
    SolutionIndex: 154
    SolutionNameMin: Cijk_Ailk_Bjlk_HBH_MT64x64x32_MI32x32x8x1_SE_1LDSB0_AF0EM1_AF1EM1_EPS0_GRVW4_GSU1_GSUAMB_NLCA1_NLCB1_PGR2_SU0_SUS0_SRVW4_TT1_32_VAW2_WSGRA1_WSGRB1_WG64_4_1_WGM1
    SolutionIndex: 155
    SolutionNameMin: Cijk_Ailk_Bjlk_HBH_MT128x128x16_MI32x32x8x1_SE_1LDSB0_AF0EM8_AF1EM1_EPS0_GRVW8_GSU1_GSUAMB_NLCA1_NLCB1_PGR2_SU32_SUS128_SRVW4_TT2_64_VAW2_WSGRA1_WSGRB1_WG64_4_1_WGM1
    SolutionIndex: 156
    SolutionNameMin: Cijk_Ailk_Bjlk_HBH_MT128x64x64_MI32x32x8x1_SE_1LDSB0_AF0EM1_AF1EM1_EPS0_GRVW8_GSU1_GSUAMB_NLCA1_NLCB1_PGR2_SU32_SUS256_SRVW4_TT2_32_VAW2_WSGRA1_WSGRB1_WG64_4_1_WGM15
    SolutionIndex: 157
    SolutionNameMin: Cijk_Ailk_Bjlk_HBH_MT128x64x16_MI32x32x8x1_SE_1LDSB0_AF0EM8_AF1EM1_EPS0_GRVW2_GSU1_GSUAMB_NLCA1_NLCB1_PGR2_SU0_SUS0_SRVW4_TT2_32_VAW2_WSGRA1_WSGRB1_WG64_4_1_WGM1
    SolutionIndex: 158
    SolutionNameMin: Cijk_Ailk_Bjlk_HBH_MT128x64x16_MI32x32x8x1_SE_1LDSB0_AF0EM1_AF1EM1_EPS0_GRVW8_GSU1_GSUAMB_NLCA1_NLCB1_PGR2_SU0_SUS0_SRVW4_TT2_32_VAW2_WSGRA1_WSGRB1_WG64_4_1_WGM2
    SolutionIndex: 159
    SolutionNameMin: Cijk_Ailk_Bjlk_HBH_MT256x128x32_MI32x32x8x1_SE_1LDSB0_AF0EM8_AF1EM1_EPS1_GRVW8_GSU1_GSUAMB_NLCA1_NLCB1_PGR1_SU0_SUS0_SRVW4_TT4_64_VAW2_WSGRA1_WSGRB1_WG64_4_1_WGM15
    SolutionIndex: 160
    SolutionNameMin: Cijk_Ailk_Bjlk_HBH_MT128x256x16_MI32x32x8x1_SE_1LDSB0_AF0EM8_AF1EM1_EPS0_GRVW4_GSU1_GSUAMB_NLCA1_NLCB1_PGR2_SU0_SUS0_SRVW4_TT2_128_VAW2_WSGRA1_WSGRB1_WG64_4_1_WGM1
    SolutionIndex: 161
    SolutionNameMin: Cijk_Ailk_Bjlk_HBH_MT128x256x16_MI32x32x8x1_SE_1LDSB0_AF0EM8_AF1EM1_EPS0_GRVW8_GSU1_GSUAMB_NLCA1_NLCB1_PGR2_SU0_SUS0_SRVW4_TT2_128_VAW2_WSGRA1_WSGRB1_WG64_4_1_WGM2
    SolutionIndex: 162
    SolutionNameMin: Cijk_Ailk_Bjlk_HBH_MT128x192x32_MI32x32x8x1_SE_1LDSB0_AF0EM8_AF1EM1_EPS0_GRVW4_GSU1_GSUAMB_NLCA1_NLCB3_PGR2_SU0_SUS0_SRVW4_TT2_96_VAW2_WSGRA1_WSGRB1_WG64_4_1_WGM15
    SolutionIndex: 163
    SolutionNameMin: Cijk_Ailk_Bjlk_HBH_MT128x96x16_MI32x32x8x1_SE_1LDSB0_AF0EM1_AF1EM1_EPS0_GRVW2_GSU1_GSUAMB_NLCA1_NLCB3_PGR2_SU0_SUS0_SRVW4_TT1_96_VAW2_WSGRA1_WSGRB1_WG128_2_1_WGM1
    SolutionIndex: 164
    SolutionNameMin: Cijk_Ailk_Bjlk_HBH_MT64x128x32_MI32x32x8x1_SE_1LDSB0_AF0EM8_AF1EM1_EPS0_GRVW4_GSU1_GSUAMB_NLCA1_NLCB1_PGR2_SU32_SUS256_SRVW4_TT1_64_VAW2_WSGRA1_WSGRB1_WG64_4_1_WGM15
    SolutionIndex: 165
    SolutionNameMin: Cijk_Ailk_Bjlk_HBH_MT64x128x16_MI32x32x8x1_SE_1LDSB0_AF0EM8_AF1EM1_EPS0_GRVW2_GSU1_GSUAMB_NLCA1_NLCB1_PGR2_SU0_SUS0_SRVW4_TT1_64_VAW2_WSGRA1_WSGRB1_WG64_4_1_WGM1
    SolutionIndex: 166
    SolutionNameMin: Cijk_Ailk_Bjlk_HBH_MT96x128x32_MI32x32x8x1_SE_1LDSB0_AF0EM8_AF1EM1_EPS0_GRVW4_GSU1_GSUAMB_NLCA3_NLCB1_PGR2_SU0_SUS0_SRVW0_TT3_32_VAW2_WSGRA1_WSGRB1_WG32_8_1_WGM1
    SolutionIndex: 167
    SolutionNameMin: Cijk_Ailk_Bjlk_HBH_MT128x64x16_MI32x32x8x1_SE_1LDSB0_AF0EM8_AF1EM1_EPS0_GRVW8_GSU1_GSUAMB_NLCA1_NLCB1_PGR2_SU0_SUS0_SRVW4_TT2_32_VAW2_WSGRA1_WSGRB1_WG64_4_1_WGM15
    SolutionIndex: 168
    SolutionNameMin: Cijk_Ailk_Bjlk_HBH_MT128x64x64_MI32x32x8x1_SE_1LDSB0_AF0EM8_AF1EM1_EPS0_GRVW8_GSU1_GSUAMB_NLCA1_NLCB1_PGR2_SU0_SUS0_SRVW4_TT2_32_VAW2_WSGRA1_WSGRB1_WG64_4_1_WGM2
    SolutionIndex: 169
    SolutionNameMin: Cijk_Ailk_Bjlk_HBH_MT64x64x64_MI32x32x8x1_SE_1LDSB0_AF0EM8_AF1EM1_EPS0_GRVW8_GSU15_GSUAMB_NLCA1_NLCB1_PGR2_SU32_SUS128_SRVW4_TT1_32_VAW1_WSGRA1_WSGRB1_WG64_4_1_WGM1
    SolutionIndex: 170
    SolutionNameMin: Cijk_Ailk_Bjlk_HBH_MT64x64x32_MI32x32x8x1_SE_1LDSB0_AF0EM8_AF1EM1_EPS0_GRVW4_GSU15_GSUAMB_NLCA1_NLCB1_PGR2_SU32_SUS256_SRVW4_TT1_32_VAW1_WSGRA1_WSGRB1_WG64_4_1_WGM1
    SolutionIndex: 171
    SolutionNameMin: Cijk_Ailk_Bjlk_HBH_MT64x64x64_MI32x32x8x1_SE_1LDSB0_AF0EM8_AF1EM1_EPS1_GRVW8_GSU5_GSUAMB_NLCA1_NLCB1_PGR1_SU0_SUS0_SRVW0_TT1_32_VAW1_WSGRA1_WSGRB1_WG64_4_1_WGM2
    SolutionIndex: 172
    SolutionNameMin: Cijk_Ailk_Bjlk_HBH_MT64x64x64_MI32x32x8x1_SE_1LDSB0_AF0EM8_AF1EM1_EPS1_GRVW8_GSU5_GSUAMB_NLCA1_NLCB1_PGR1_SU0_SUS0_SRVW0_TT1_32_VAW1_WSGRA1_WSGRB1_WG64_4_1_WGM1
    SolutionIndex: 173
    SolutionNameMin: Cijk_Ailk_Bjlk_HBH_MT128x256x16_MI32x32x8x1_SE_1LDSB0_AF0EM8_AF1EM1_EPS0_GRVW8_GSU15_GSUAMB_NLCA1_NLCB1_PGR2_SU0_SUS0_SRVW4_TT2_128_VAW1_WSGRA1_WSGRB1_WG64_4_1_WGM2
    SolutionIndex: 174
    SolutionNameMin: Cijk_Ailk_Bjlk_HBH_MT128x128x32_MI32x32x8x1_SE_1LDSB0_AF0EM8_AF1EM1_EPS0_GRVW8_GSU1_GSUAMB_NLCA1_NLCB1_PGR2_SU0_SUS0_SRVW4_TT2_64_VAW2_WSGRA1_WSGRB1_WG64_4_1_WGM15
    SolutionIndex: 175
    SolutionNameMin: Cijk_Ailk_Bjlk_HBH_MT64x128x32_MI32x32x8x1_SE_1LDSB0_AF0EM8_AF1EM1_EPS0_GRVW2_GSU1_GSUAMB_NLCA1_NLCB1_PGR2_SU0_SUS0_SRVW4_TT1_64_VAW2_WSGRA1_WSGRB1_WG64_4_1_WGM2
    SolutionIndex: 176
    SolutionNameMin: Cijk_Ailk_Bjlk_HBH_MT128x64x32_MI32x32x8x1_SE_1LDSB0_AF0EM8_AF1EM1_EPS0_GRVW2_GSU1_GSUAMB_NLCA1_NLCB1_PGR2_SU0_SUS0_SRVW4_TT2_32_VAW2_WSGRA1_WSGRB1_WG64_4_1_WGM1
    SolutionIndex: 177
    SolutionNameMin: Cijk_Ailk_Bjlk_HBH_MT32x32x64_MI16x16x16x1_SE_1LDSB0_AF0EM1_AF1EM1_EPS0_GRVW8_GSU7_GSUAMB_NLCA1_NLCB1_PGR2_SU32_SUS256_SRVW4_TT1_16_VAW1_WSGRA1_WSGRB1_WG32_8_1_WGM1
    SolutionIndex: 178
    SolutionNameMin: Cijk_Ailk_Bjlk_HBH_MT128x256x32_MI32x32x8x1_SE_1LDSB0_AF0EM8_AF1EM1_EPS1_GRVW8_GSU1_GSUAMB_NLCA1_NLCB1_PGR1_SU0_SUS0_SRVW4_TT2_128_VAW2_WSGRA1_WSGRB1_WG64_4_1_WGM2
    SolutionIndex: 179
    SolutionNameMin: Cijk_Ailk_Bjlk_HBH_MT64x32x16_MI16x16x16x1_SE_1LDSB1_AF0EM8_AF1EM1_EPS0_GRVW2_GSU1_GSUAMB_NLCA1_NLCB1_PGR2_SU0_SUS0_SRVW4_TT2_16_VAW2_WSGRA1_WSGRB1_WG32_8_1_WGM15
    SolutionIndex: 180
    SolutionNameMin: Cijk_Ailk_Bjlk_HBH_MT128x256x16_MI32x32x8x1_SE_1LDSB0_AF0EM8_AF1EM1_EPS0_GRVW8_GSU1_GSUAMB_NLCA1_NLCB1_PGR2_SU0_SUS0_SRVW4_TT2_128_VAW2_WSGRA1_WSGRB1_WG64_4_1_WGM15
    SolutionIndex: 181
    SolutionNameMin: Cijk_Ailk_Bjlk_HBH_MT128x256x16_MI32x32x8x1_SE_1LDSB0_AF0EM8_AF1EM1_EPS0_GRVW8_GSU1_GSUAMB_NLCA1_NLCB1_PGR2_SU32_SUS256_SRVW4_TT2_128_VAW2_WSGRA1_WSGRB1_WG64_4_1_WGM2
    SolutionIndex: 182
    SolutionNameMin: Cijk_Ailk_Bjlk_HBH_MT64x64x16_MI32x32x8x1_SE_1LDSB0_AF0EM8_AF1EM1_EPS0_GRVW4_GSU1_GSUAMB_NLCA1_NLCB1_PGR2_SU0_SUS0_SRVW4_TT1_32_VAW2_WSGRA1_WSGRB1_WG64_4_1_WGM1
    SolutionIndex: 183
    SolutionNameMin: Cijk_Ailk_Bjlk_HBH_MT128x128x16_MI32x32x8x1_SE_1LDSB0_AF0EM1_AF1EM1_EPS0_GRVW8_GSU1_GSUAMB_NLCA1_NLCB1_PGR2_SU0_SUS0_SRVW4_TT2_64_VAW2_WSGRA1_WSGRB1_WG64_4_1_WGM15
    SolutionIndex: 184
    SolutionNameMin: Cijk_Ailk_Bjlk_HBH_MT128x256x16_MI32x32x8x1_SE_1LDSB1_AF0EM8_AF1EM1_EPS0_GRVW8_GSU1_GSUAMB_NLCA1_NLCB1_PGR2_SU0_SUS0_SRVW4_TT2_128_VAW2_WSGRA1_WSGRB1_WG64_4_1_WGM15
    SolutionIndex: 185
    SolutionNameMin: Cijk_Ailk_Bjlk_HBH_MT128x64x16_MI32x32x8x1_SE_1LDSB0_AF0EM8_AF1EM1_EPS0_GRVW2_GSU1_GSUAMB_NLCA1_NLCB1_PGR2_SU32_SUS256_SRVW4_TT2_32_VAW2_WSGRA1_WSGRB1_WG64_4_1_WGM2
    SolutionIndex: 186
    SolutionNameMin: Cijk_Ailk_Bjlk_HBH_MT128x128x16_MI32x32x8x1_SE_1LDSB0_AF0EM8_AF1EM1_EPS0_GRVW2_GSU1_GSUAMB_NLCA1_NLCB1_PGR2_SU0_SUS0_SRVW4_TT2_64_VAW2_WSGRA1_WSGRB1_WG64_4_1_WGM1
    SolutionIndex: 187
    SolutionNameMin: Cijk_Ailk_Bjlk_HBH_MT128x128x16_MI32x32x8x1_SE_1LDSB0_AF0EM8_AF1EM1_EPS0_GRVW2_GSU1_GSUAMB_NLCA1_NLCB1_PGR2_SU32_SUS256_SRVW4_TT2_64_VAW2_WSGRA1_WSGRB1_WG64_4_1_WGM1
    SolutionIndex: 188
    SolutionNameMin: Cijk_Ailk_Bjlk_HBH_MT128x128x16_MI32x32x8x1_SE_1LDSB0_AF0EM1_AF1EM1_EPS0_GRVW8_GSU1_GSUAMB_NLCA1_NLCB1_PGR2_SU0_SUS0_SRVW4_TT2_64_VAW2_WSGRA1_WSGRB1_WG64_4_1_WGM1
    SolutionIndex: 189
    SolutionNameMin: Cijk_Ailk_Bjlk_HBH_MT128x64x32_MI32x32x8x1_SE_1LDSB0_AF0EM8_AF1EM1_EPS1_GRVW8_GSU1_GSUAMB_NLCA1_NLCB1_PGR1_SU0_SUS0_SRVW4_TT2_32_VAW2_WSGRA1_WSGRB1_WG64_4_1_WGM15
    SolutionIndex: 190
    SolutionNameMin: Cijk_Ailk_Bjlk_HBH_MT128x128x32_MI32x32x8x1_SE_1LDSB0_AF0EM8_AF1EM1_EPS0_GRVW8_GSU3_GSUAMB_NLCA1_NLCB1_PGR2_SU0_SUS0_SRVW4_TT2_64_VAW1_WSGRA1_WSGRB1_WG64_4_1_WGM15
    SolutionIndex: 191
    SolutionNameMin: Cijk_Ailk_Bjlk_HBH_MT128x64x16_MI32x32x8x1_SE_1LDSB0_AF0EM8_AF1EM1_EPS1_GRVW8_GSU1_GSUAMB_NLCA1_NLCB1_PGR1_SU0_SUS0_SRVW4_TT2_32_VAW2_WSGRA1_WSGRB1_WG64_4_1_WGM1
    SolutionIndex: 192
    SolutionNameMin: Cijk_Ailk_Bjlk_HBH_MT64x128x64_MI32x32x8x1_SE_1LDSB0_AF0EM8_AF1EM1_EPS0_GRVW8_GSU1_GSUAMB_NLCA1_NLCB1_PGR2_SU0_SUS0_SRVW4_TT1_64_VAW2_WSGRA1_WSGRB1_WG64_4_1_WGM15
    SolutionIndex: 193
    SolutionNameMin: Cijk_Ailk_Bjlk_HBH_MT128x128x32_MI32x32x8x1_SE_1LDSB0_AF0EM8_AF1EM1_EPS0_GRVW4_GSU1_GSUAMB_NLCA1_NLCB1_PGR2_SU0_SUS0_SRVW4_TT2_64_VAW2_WSGRA1_WSGRB1_WG64_4_1_WGM2
    SolutionIndex: 194
    SolutionNameMin: Cijk_Ailk_Bjlk_HBH_MT128x128x32_MI32x32x8x1_SE_1LDSB0_AF0EM8_AF1EM1_EPS0_GRVW8_GSU1_GSUAMB_NLCA1_NLCB1_PGR2_SU32_SUS256_SRVW4_TT2_64_VAW2_WSGRA1_WSGRB1_WG64_4_1_WGM15
    SolutionIndex: 195
    SolutionNameMin: Cijk_Ailk_Bjlk_HBH_MT128x64x16_MI32x32x8x1_SE_1LDSB0_AF0EM8_AF1EM1_EPS0_GRVW8_GSU1_GSUAMB_NLCA1_NLCB1_PGR2_SU0_SUS0_SRVW4_TT2_32_VAW2_WSGRA1_WSGRB1_WG64_4_1_WGM2
    SolutionIndex: 196
    SolutionNameMin: Cijk_Ailk_Bjlk_HBH_MT64x192x16_MI32x32x8x1_SE_1LDSB0_AF0EM8_AF1EM1_EPS0_GRVW4_GSU1_GSUAMB_NLCA1_NLCB3_PGR2_SU0_SUS0_SRVW4_TT1_96_VAW2_WSGRA1_WSGRB1_WG64_4_1_WGM15
    SolutionIndex: 197
    SolutionNameMin: Cijk_Ailk_Bjlk_HBH_MT128x128x32_MI32x32x8x1_SE_1LDSB0_AF0EM8_AF1EM1_EPS0_GRVW8_GSU1_GSUAMB_NLCA1_NLCB1_PGR2_SU0_SUS0_SRVW4_TT2_64_VAW2_WSGRA1_WSGRB1_WG64_4_1_WGM2
    SolutionIndex: 198
    SolutionNameMin: Cijk_Ailk_Bjlk_HBH_MT128x128x16_MI32x32x8x1_SE_1LDSB0_AF0EM8_AF1EM1_EPS0_GRVW8_GSU1_GSUAMB_NLCA1_NLCB1_PGR2_SU32_SUS256_SRVW4_TT2_64_VAW2_WSGRA1_WSGRB1_WG64_4_1_WGM1
    SolutionIndex: 199
    SolutionNameMin: Cijk_Ailk_Bjlk_HBH_MT32x32x16_MI16x16x16x1_SE_1LDSB0_AF0EM8_AF1EM1_EPS0_GRVW4_GSU1_GSUAMB_NLCA1_NLCB1_PGR2_SU0_SUS0_SRVW4_TT1_16_VAW2_WSGRA1_WSGRB1_WG32_8_1_WGM1
    SolutionIndex: 200
    SolutionNameMin: Cijk_Ailk_Bjlk_HBH_MT32x32x16_MI16x16x16x1_SE_1LDSB0_AF0EM8_AF1EM1_EPS1_GRVW4_GSU1_GSUAMB_NLCA1_NLCB1_PGR1_SU0_SUS0_SRVW4_TT1_16_VAW2_WSGRA1_WSGRB1_WG32_8_1_WGM15
    SolutionIndex: 201
    SolutionNameMin: Cijk_Ailk_Bjlk_HBH_MT128x256x16_MI32x32x8x1_SE_1LDSB0_AF0EM8_AF1EM1_EPS0_GRVW4_GSU1_GSUAMB_NLCA1_NLCB1_PGR2_SU0_SUS0_SRVW4_TT2_128_VAW2_WSGRA1_WSGRB1_WG64_4_1_WGM2
    SolutionIndex: 202
    SolutionNameMin: Cijk_Ailk_Bjlk_HBH_MT64x32x16_MI16x16x16x1_SE_1LDSB1_AF0EM8_AF1EM1_EPS1_GRVW2_GSU1_GSUAMB_NLCA1_NLCB1_PGR1_SU32_SUS256_SRVW4_TT2_16_VAW2_WSGRA1_WSGRB1_WG32_8_1_WGM2
    SolutionIndex: 203
    SolutionNameMin: Cijk_Ailk_Bjlk_HBH_MT64x64x32_MI32x32x8x1_SE_1LDSB0_AF0EM8_AF1EM1_EPS0_GRVW8_GSU1_GSUAMB_NLCA1_NLCB1_PGR2_SU0_SUS0_SRVW4_TT1_32_VAW2_WSGRA1_WSGRB1_WG64_4_1_WGM2
    SolutionIndex: 204
    SolutionNameMin: Cijk_Ailk_Bjlk_HBH_MT64x128x16_MI32x32x8x1_SE_1LDSB0_AF0EM8_AF1EM1_EPS0_GRVW8_GSU1_GSUAMB_NLCA1_NLCB1_PGR2_SU32_SUS256_SRVW4_TT1_64_VAW2_WSGRA1_WSGRB1_WG64_4_1_WGM2
    SolutionIndex: 205
    SolutionNameMin: Cijk_Ailk_Bjlk_HBH_MT128x128x16_MI32x32x8x1_SE_1LDSB0_AF0EM1_AF1EM1_EPS0_GRVW8_GSU1_GSUAMB_NLCA1_NLCB1_PGR2_SU32_SUS128_SRVW4_TT2_64_VAW2_WSGRA1_WSGRB1_WG64_4_1_WGM1
    SolutionIndex: 206
    SolutionNameMin: Cijk_Ailk_Bjlk_HBH_MT64x32x16_MI16x16x16x1_SE_1LDSB0_AF0EM8_AF1EM1_EPS1_GRVW2_GSU1_GSUAMB_NLCA1_NLCB1_PGR1_SU32_SUS128_SRVW4_TT2_16_VAW2_WSGRA1_WSGRB1_WG32_8_1_WGM1
    SolutionIndex: 207
    SolutionNameMin: Cijk_Ailk_Bjlk_HBH_MT128x64x32_MI32x32x8x1_SE_1LDSB0_AF0EM1_AF1EM1_EPS0_GRVW4_GSU1_GSUAMB_NLCA1_NLCB1_PGR2_SU0_SUS0_SRVW4_TT2_32_VAW2_WSGRA1_WSGRB1_WG64_4_1_WGM15
    SolutionIndex: 208
    SolutionNameMin: Cijk_Ailk_Bjlk_HBH_MT128x128x32_MI32x32x8x1_SE_1LDSB0_AF0EM8_AF1EM1_EPS0_GRVW8_GSU1_GSUAMB_NLCA1_NLCB1_PGR2_SU32_SUS128_SRVW4_TT2_64_VAW2_WSGRA1_WSGRB1_WG64_4_1_WGM1
    SolutionIndex: 209
    SolutionNameMin: Cijk_Ailk_Bjlk_HBH_MT64x128x32_MI32x32x8x1_SE_1LDSB0_AF0EM8_AF1EM1_EPS1_GRVW8_GSU1_GSUAMB_NLCA1_NLCB1_PGR1_SU0_SUS0_SRVW4_TT1_64_VAW2_WSGRA1_WSGRB1_WG64_4_1_WGM15
    SolutionIndex: 210
    SolutionNameMin: Cijk_Ailk_Bjlk_HBH_MT96x128x32_MI32x32x8x1_SE_1LDSB0_AF0EM8_AF1EM1_EPS0_GRVW4_GSU1_GSUAMB_NLCA3_NLCB1_PGR2_SU32_SUS256_SRVW0_TT3_32_VAW2_WSGRA1_WSGRB1_WG32_8_1_WGM2
    SolutionIndex: 211
    SolutionNameMin: Cijk_Ailk_Bjlk_HBH_MT128x128x32_MI32x32x8x1_SE_1LDSB0_AF0EM1_AF1EM1_EPS0_GRVW8_GSU1_GSUAMB_NLCA1_NLCB1_PGR2_SU0_SUS0_SRVW4_TT2_64_VAW2_WSGRA1_WSGRB1_WG64_4_1_WGM1
    SolutionIndex: 212
    SolutionNameMin: Cijk_Ailk_Bjlk_HBH_MT64x192x16_MI32x32x8x1_SE_1LDSB0_AF0EM1_AF1EM1_EPS1_GRVW2_GSU1_GSUAMB_NLCA1_NLCB3_PGR1_SU0_SUS0_SRVW4_TT1_96_VAW2_WSGRA1_WSGRB1_WG64_4_1_WGM2
    SolutionIndex: 213
    SolutionNameMin: Cijk_Ailk_Bjlk_HBH_MT32x32x16_MI16x16x16x1_SE_1LDSB0_AF0EM1_AF1EM1_EPS1_GRVW8_GSU1_GSUAMB_NLCA1_NLCB1_PGR1_SU0_SUS0_SRVW4_TT1_16_VAW2_WSGRA1_WSGRB1_WG32_8_1_WGM1
    SolutionIndex: 214
    SolutionNameMin: Cijk_Ailk_Bjlk_HBH_MT64x192x32_MI32x32x8x1_SE_1LDSB0_AF0EM1_AF1EM1_EPS0_GRVW4_GSU1_GSUAMB_NLCA1_NLCB3_PGR2_SU0_SUS0_SRVW4_TT1_96_VAW2_WSGRA1_WSGRB1_WG64_4_1_WGM2
    SolutionIndex: 215
    SolutionNameMin: Cijk_Ailk_Bjlk_HBH_MT64x128x32_MI32x32x8x1_SE_1LDSB0_AF0EM1_AF1EM1_EPS0_GRVW4_GSU1_GSUAMB_NLCA1_NLCB1_PGR2_SU0_SUS0_SRVW4_TT1_64_VAW2_WSGRA1_WSGRB1_WG64_4_1_WGM15
    SolutionIndex: 216
    SolutionNameMin: Cijk_Ailk_Bjlk_HBH_MT128x64x32_MI32x32x8x1_SE_1LDSB0_AF0EM1_AF1EM1_EPS0_GRVW8_GSU1_GSUAMB_NLCA1_NLCB1_PGR2_SU32_SUS256_SRVW4_TT2_32_VAW2_WSGRA1_WSGRB1_WG64_4_1_WGM1
    SolutionIndex: 217
    SolutionNameMin: Cijk_Ailk_Bjlk_HBH_MT128x128x16_MI32x32x8x1_SE_1LDSB0_AF0EM1_AF1EM1_EPS0_GRVW4_GSU1_GSUAMB_NLCA1_NLCB1_PGR2_SU0_SUS0_SRVW4_TT2_64_VAW2_WSGRA1_WSGRB1_WG64_4_1_WGM15
    SolutionIndex: 218
    SolutionNameMin: Cijk_Ailk_Bjlk_HBH_MT128x128x16_MI32x32x8x1_SE_1LDSB0_AF0EM1_AF1EM1_EPS0_GRVW2_GSU1_GSUAMB_NLCA1_NLCB1_PGR2_SU0_SUS0_SRVW4_TT2_64_VAW2_WSGRA1_WSGRB1_WG64_4_1_WGM1
    SolutionIndex: 219
    SolutionNameMin: Cijk_Ailk_Bjlk_HBH_MT16x64x32_MI16x16x16x1_SE_1LDSB0_AF0EM1_AF1EM1_EPS1_GRVW8_GSU1_GSUAMB_NLCA1_NLCB1_PGR1_SU0_SUS0_SRVW0_TT1_16_VAW2_WSGRA1_WSGRB1_WG16_16_1_WGM1
    SolutionIndex: 220
    SolutionNameMin: Cijk_Ailk_Bjlk_HBH_MT128x128x32_MI32x32x8x1_SN_1LDSB0_EPS0_GRVW4_GSU1_NLCA1_NLCB1_PGR2_SU0_SUS0_SRVW4_TT2_64_VAW2_WG64_4_1_WGM1
    SolutionIndex: 221
    SolutionNameMin: Cijk_Ailk_Bjlk_HBH_MT128x128x32_MI32x32x8x1_SN_1LDSB0_EPS0_GRVW4_GSU1_NLCA1_NLCB1_PGR2_SU0_SUS0_SRVW4_TT2_64_VAW2_WG64_4_1_WGM15
    SolutionIndex: 222
    SolutionNameMin: Cijk_Ailk_Bjlk_HBH_MT128x256x16_MI32x32x8x1_SN_1LDSB1_EPS0_GRVW8_NLCA1_NLCB1_PGR2_SU0_SUS0_SRVW4_TT2_128_WG64_4_1_WGM2
- - - [64, 448, 1, 3328]
    - [8, 3.171]
  - - [1, 64, 1, 256]
    - [1, 0.0]
  - - [3584, 64, 1, 1280]
    - [9, 11.899]
  - - [64, 128, 1, 256]
    - [10, 0.183]
  - - [64, 5888, 1, 1280]
    - [11, 20.278]
  - - [64, 4288, 1, 1280]
    - [9, 14.497]
  - - [3584, 64, 1, 3328]
    - [9, 18.068]
  - - [64, 1024, 1, 3328]
    - [8, 7.164]
  - - [1, 64, 1, 1280]
    - [3, 0.001]
  - - [704, 64, 1, 3328]
    - [12, 4.841]
  - - [64, 448, 1, 1280]
    - [12, 2.067]
  - - [64, 704, 1, 3328]
    - [12, 4.954]
  - - [64, 64, 1, 1280]
    - [8, 0.295]
  - - [64, 5056, 1, 256]
    - [8, 6.1]
  - - [64, 4288, 1, 3328]
    - [9, 21.709]
  - - [1856, 64, 1, 3328]
    - [13, 9.81]
  - - [1, 64, 1, 1]
    - [0, 0.0]
  - - [448, 64, 1, 1280]
    - [12, 2.027]
  - - [5888, 64, 1, 1280]
    - [9, 19.689]
  - - [2944, 64, 1, 256]
    - [14, 3.882]
  - - [64, 1856, 1, 256]
    - [10, 2.501]
  - - [64, 1024, 1, 1280]
    - [12, 4.773]
  - - [64, 256, 1, 1280]
    - [8, 1.176]
  - - [704, 64, 1, 1280]
    - [12, 3.185]
  - - [64, 128, 1, 1280]
    - [12, 0.588]
  - - [2368, 64, 1, 256]
    - [8, 3.191]
  - - [2368, 64, 1, 3328]
    - [15, 12.039]
  - - [64, 1408, 1, 3328]
    - [8, 9.599]
  - - [1856, 64, 1, 1280]
    - [16, 6.907]
  - - [64, 3584, 1, 1280]
    - [17, 12.206]
  - - [448, 64, 1, 3328]
    - [12, 3.08]
  - - [5888, 64, 1, 3328]
    - [9, 29.497]
  - - [128, 64, 1, 256]
    - [8, 0.176]
  - - [64, 128, 1, 3328]
    - [18, 0.934]
  - - [64, 256, 1, 3328]
    - [12, 1.818]
  - - [4288, 64, 1, 3328]
    - [9, 21.893]
  - - [64, 2944, 1, 256]
    - [10, 3.938]
  - - [6784, 64, 1, 256]
    - [11, 7.826]
  - - [1024, 64, 1, 1280]
    - [8, 4.633]
  - - [64, 2368, 1, 1280]
    - [16, 8.604]
  - - [64, 3584, 1, 3328]
    - [9, 17.88]
  - - [64, 6784, 1, 3328]
    - [9, 33.496]
  - - [3584, 64, 1, 256]
    - [14, 4.531]
  - - [64, 1856, 1, 3328]
    - [13, 9.897]
  - - [448, 64, 1, 256]
    - [19, 0.627]
  - - [64, 5056, 1, 3328]
    - [17, 25.33]
  - - [256, 64, 1, 256]
    - [10, 0.363]
  - - [4288, 64, 1, 1280]
    - [20, 14.712]
  - - [1, 1, 1, 1]
    - [2, 0.0]
  - - [5056, 64, 1, 1280]
    - [11, 17.543]
  - - [1024, 64, 1, 3328]
    - [8, 6.902]
  - - [1408, 64, 1, 256]
    - [10, 1.984]
  - - [64, 1408, 1, 256]
    - [19, 1.925]
  - - [64, 2368, 1, 3328]
    - [17, 12.014]
  - - [64, 448, 1, 256]
    - [10, 0.622]
  - - [64, 6784, 1, 1280]
    - [11, 23.104]
  - - [64, 1856, 1, 1280]
    - [16, 6.798]
  - - [64, 6784, 1, 256]
    - [21, 7.976]
  - - [64, 5056, 1, 1280]
    - [11, 17.543]
  - - [64, 4288, 1, 256]
    - [22, 5.459]
  - - [128, 64, 1, 1280]
    - [8, 0.588]
  - - [5888, 64, 1, 256]
    - [23, 6.879]
  - - [64, 5888, 1, 3328]
    - [17, 29.253]
  - - [64, 1024, 1, 256]
    - [12, 1.443]
  - - [5056, 64, 1, 3328]
    - [9, 25.597]
  - - [256, 64, 1, 1280]
    - [8, 1.164]
  - - [64, 256, 1, 256]
    - [24, 0.358]
  - - [704, 64, 1, 256]
    - [10, 1.015]
  - - [64, 1408, 1, 1280]
    - [8, 6.278]
  - - [1, 1, 1, 256]
    - [1, 0.0]
  - - [64, 704, 1, 256]
    - [10, 0.985]
  - - [64, 2944, 1, 3328]
    - [9, 14.968]
  - - [64, 64, 1, 256]
    - [25, 0.092]
  - - [1856, 64, 1, 256]
    - [10, 2.576]
  - - [128, 64, 1, 3328]
    - [26, 0.92]
  - - [2944, 64, 1, 1280]
    - [16, 10.451]
  - - [4288, 64, 1, 256]
    - [22, 5.497]
  - - [1, 1, 1, 1280]
    - [3, 0.0]
  - - [64, 2944, 1, 1280]
    - [16, 10.532]
  - - [1408, 64, 1, 1280]
    - [8, 6.465]
  - - [6784, 64, 1, 3328]
    - [9, 33.635]
  - - [1024, 64, 1, 256]
    - [10, 1.465]
  - - [64, 2368, 1, 256]
    - [24, 3.145]
  - - [64, 3584, 1, 256]
    - [8, 4.759]
  - - [2944, 64, 1, 3328]
    - [15, 15.031]
  - - [2368, 64, 1, 1280]
    - [16, 8.471]
  - - [256, 64, 1, 3328]
    - [8, 1.802]
  - - [64, 64, 1, 3328]
    - [27, 0.457]
  - - [1, 1, 1, 3328]
    - [3, 0.0]
  - - [64, 5888, 1, 256]
    - [23, 7.012]
  - - [64, 704, 1, 1280]
    - [8, 3.249]
  - - [6784, 64, 1, 1280]
    - [11, 22.852]
  - - [5056, 64, 1, 256]
    - [14, 6.14]
  - - [1408, 64, 1, 3328]
    - [12, 9.681]
  - - [4096, 7133, 1, 4096]
    - [28, 88.148]
  - - [512, 16, 1, 512]
    - [10, 0.307]
  - - [2048, 7133, 1, 2048]
    - [28, 77.864]
  - - [2560, 7133, 1, 2560]
    - [29, 83.506]
  - - [1024, 1024, 1, 1024]
    - [21, 31.586]
  - - [3072, 7435, 1, 1024]
    - [30, 76.645]
  - - [1024, 32, 1, 512]
    - [19, 1.26]
  - - [1760, 7133, 1, 1760]
    - [29, 75.757]
  - - [7680, 5481, 1, 2560]
    - [31, 88.821]
  - - [1024, 16, 1, 512]
    - [10, 0.622]
  - - [512, 32, 1, 512]
    - [8, 0.618]
  - - [3136, 256, 64, 64]
    - [32, 19.633]
  - - [784, 512, 64, 128]
    - [33, 33.741]
  - - [784, 128, 64, 512]
    - [28, 43.534]
  - - [3136, 64, 128, 64]
    - [34, 15.86]
  - - [196, 256, 128, 1024]
    - [35, 46.137]
  - - [196, 256, 64, 1024]
    - [36, 40.534]
  - - [196, 1024, 128, 256]
    - [37, 36.233]
  - - [784, 128, 256, 512]
    - [38, 50.681]
  - - [3136, 64, 64, 256]
    - [39, 31.938]
  - - [3136, 64, 256, 256]
    - [40, 32.917]
  - - [3136, 256, 256, 64]
    - [32, 20.735]
  - - [3136, 64, 128, 256]
    - [39, 32.699]
  - - [784, 128, 128, 512]
    - [41, 48.62]
  - - [784, 512, 128, 128]
    - [42, 36.18]
  - - [784, 512, 256, 128]
    - [42, 37.422]
  - - [196, 1024, 64, 256]
    - [37, 33.049]
  - - [3136, 64, 64, 64]
    - [43, 14.563]
  - - [196, 1024, 256, 256]
    - [37, 37.911]
  - - [196, 256, 256, 1024]
    - [37, 50.048]
  - - [3136, 256, 128, 64]
    - [32, 20.373]
  - - [3136, 64, 256, 64]
    - [11, 16.517]
  - - [14, 64, 1, 14]
    - [10, 0.001]
  - - [15, 64, 1, 14]
    - [10, 0.001]
  - - [15, 64, 1, 15]
    - [6, 0.001]
  - - [15, 64, 1, 15]
    - [10, 0.001]
  - - [17, 64, 1, 15]
    - [44, 0.002]
  - - [17, 64, 1, 17]
    - [7, 0.002]
  - - [17, 64, 1, 17]
    - [44, 0.002]
  - - [21, 64, 1, 17]
    - [45, 0.003]
  - - [21, 64, 1, 21]
    - [45, 0.003]
  - - [24, 64, 1, 24]
    - [46, 0.004]
  - - [30, 64, 1, 30]
    - [25, 0.006]
  - - [30, 64, 1, 31]
    - [45, 0.007]
  - - [31, 64, 1, 31]
    - [47, 0.007]
  - - [32, 64, 1, 32]
    - [48, 0.008]
  - - [32, 64, 1, 35]
    - [49, 0.008]
  - - [34, 64, 1, 24]
    - [50, 0.005]
  - - [34, 64, 1, 34]
    - [47, 0.008]
  - - [35, 64, 1, 35]
    - [47, 0.008]
  - - [64, 14, 1, 14]
    - [49, 0.001]
  - - [64, 15, 1, 14]
    - [51, 0.001]
  - - [64, 15, 1, 15]
    - [5, 0.002]
  - - [64, 15, 1, 15]
    - [51, 0.001]
  - - [64, 17, 1, 15]
    - [49, 0.002]
  - - [64, 17, 1, 17]
    - [4, 0.002]
  - - [64, 17, 1, 17]
    - [46, 0.002]
  - - [64, 21, 1, 17]
    - [46, 0.002]
  - - [64, 21, 1, 21]
    - [46, 0.003]
  - - [64, 24, 1, 24]
    - [46, 0.004]
  - - [64, 30, 1, 30]
    - [46, 0.006]
  - - [64, 30, 1, 31]
    - [46, 0.006]
  - - [64, 31, 1, 31]
    - [46, 0.006]
  - - [64, 32, 1, 32]
    - [46, 0.007]
  - - [64, 32, 1, 35]
    - [49, 0.007]
  - - [64, 34, 1, 24]
    - [46, 0.005]
  - - [64, 34, 1, 34]
    - [24, 0.007]
  - - [64, 35, 1, 35]
    - [46, 0.008]
  - - [64, 128, 512, 128]
    - [52, 16.709]
  - - [64, 512, 1, 512]
    - [12, 1.252]
  - - [64, 512, 64, 512]
    - [53, 31.341]
  - - [128, 64, 512, 128]
    - [54, 16.572]
  - - [512, 64, 1, 512]
    - [19, 1.244]
  - - [512, 64, 64, 512]
    - [32, 30.704]
  - - [1024, 2, 1, 4]
    - [46, 0.001]
  - - [1024, 2, 1, 32]
    - [55, 0.008]
  - - [1024, 2, 1, 2048]
    - [56, 0.151]
  - - [1024, 1024, 1, 4]
    - [57, 0.34]
  - - [1024, 1024, 1, 32]
    - [58, 2.931]
  - - [1024, 1024, 1, 2048]
    - [59, 40.595]
  - - [1024, 1024, 1, 4096]
    - [60, 50.405]
  - - [1024, 4096, 1, 2048]
    - [28, 64.305]
  - - [1024, 4096, 1, 4096]
    - [61, 75.168]
  - - [1024, 30528, 1, 2048]
    - [62, 86.633]
  - - [1024, 30528, 1, 4096]
    - [31, 91.49]
  - - [4096, 1024, 1, 2048]
    - [63, 64.134]
  - - [4096, 1024, 1, 4096]
    - [64, 72.848]
  - - [3, 64, 512, 3]
    - [44, 0.025]
  - - [5, 64, 512, 5]
    - [47, 0.067]
  - - [5, 64, 960, 5]
    - [44, 0.104]
  - - [9, 64, 512, 9]
    - [44, 0.215]
  - - [13, 512, 1, 32768]
    - [65, 3.432]
  - - [27, 128, 32768, 27]
    - [66, 4.111]
  - - [33, 32, 200, 33]
    - [67, 0.599]
  - - [33, 32, 1600, 33]
    - [47, 2.02]
  - - [67, 2048, 1, 512]
    - [16, 4.629]
  - - [74, 2048, 1, 512]
    - [16, 4.967]
  - - [74, 2048, 1, 960]
    - [16, 7.253]
  - - [100, 2048, 1, 512]
    - [22, 6.153]
  - - [256, 128, 1, 32768]
    - [68, 16.37]
  - - [256, 1280, 1, 8976]
    - [69, 32.777]
  - - [256, 2560, 1, 8976]
    - [70, 51.576]
  - - [256, 2816, 1, 8976]
    - [70, 55.355]
  - - [256, 3328, 1, 8976]
    - [71, 60.293]
  - - [256, 3584, 1, 8976]
    - [72, 52.93]
  - - [256, 3840, 1, 8976]
    - [72, 56.485]
  - - [256, 4096, 1, 8976]
    - [73, 58.651]
  - - [256, 4352, 1, 8976]
    - [73, 61.567]
  - - [256, 4864, 1, 8976]
    - [60, 66.171]
  - - [256, 5120, 1, 8976]
    - [60, 69.001]
  - - [256, 5632, 1, 8976]
    - [63, 68.841]
  - - [256, 5888, 1, 8976]
    - [63, 71.971]
  - - [256, 6144, 1, 8976]
    - [63, 75.064]
  - - [256, 7168, 1, 8976]
    - [74, 64.953]
  - - [256, 8192, 1, 8976]
    - [75, 73.922]
  - - [256, 8960, 1, 8976]
    - [76, 74.134]
  - - [256, 9728, 1, 8976]
    - [76, 80.206]
  - - [256, 9984, 1, 8976]
    - [76, 83.893]
  - - [256, 10240, 1, 8976]
    - [76, 84.24]
  - - [256, 10496, 1, 8976]
    - [76, 86.017]
  - - [256, 11008, 1, 8976]
    - [77, 72.46]
  - - [256, 11264, 1, 8976]
    - [62, 74.183]
  - - [256, 11520, 1, 8976]
    - [77, 75.676]
  - - [256, 11776, 1, 8976]
    - [77, 77.338]
  - - [256, 12544, 1, 8976]
    - [77, 82.236]
  - - [256, 12800, 1, 8976]
    - [77, 83.66]
  - - [256, 13312, 1, 8976]
    - [62, 86.765]
  - - [256, 13568, 1, 8976]
    - [78, 88.151]
  - - [256, 14336, 1, 8976]
    - [79, 77.661]
  - - [256, 14848, 1, 8976]
    - [80, 80.0]
  - - [256, 15104, 1, 8976]
    - [81, 82.096]
  - - [256, 15872, 1, 8976]
    - [61, 80.302]
  - - [256, 16128, 1, 8976]
    - [61, 81.201]
  - - [256, 17152, 1, 8976]
    - [82, 86.206]
  - - [256, 17408, 1, 8976]
    - [83, 87.086]
  - - [256, 18688, 1, 8976]
    - [63, 82.253]
  - - [256, 19968, 1, 8976]
    - [63, 87.901]
  - - [256, 20480, 1, 8976]
    - [84, 89.865]
  - - [256, 20992, 1, 8976]
    - [28, 91.925]
  - - [256, 21248, 1, 8976]
    - [85, 71.729]
  - - [256, 22016, 1, 8976]
    - [86, 74.311]
  - - [256, 26112, 1, 8976]
    - [87, 88.091]
  - - [256, 32512, 1, 8976]
    - [88, 86.827]
  - - [256, 32768, 1, 1]
    - [89, 0.231]
  - - [256, 33536, 1, 8976]
    - [90, 89.598]
  - - [256, 44505, 1, 8976]
    - [91, 84.483]
  - - [257, 4096, 1, 1024]
    - [92, 29.693]
  - - [480, 1024, 1, 32768]
    - [93, 52.904]
  - - [512, 32, 1, 200]
    - [10, 0.264]
  - - [512, 32, 1, 1600]
    - [12, 1.307]
  - - [512, 256, 1, 32768]
    - [94, 34.989]
  - - [512, 512, 1, 200]
    - [95, 4.018]
  - - [512, 512, 1, 1600]
    - [11, 16.019]
  - - [512, 2048, 1, 256]
    - [20, 15.589]
  - - [560, 1024, 1, 200]
    - [58, 7.737]
  - - [560, 1024, 1, 1600]
    - [9, 26.711]
  - - [768, 2048, 1, 256]
    - [96, 21.603]
  - - [1024, 64, 1, 512]
    - [8, 2.52]
  - - [1024, 64, 1, 960]
    - [19, 3.96]
  - - [1024, 256, 1, 1024]
    - [9, 12.601]
  - - [1024, 256, 1, 1280]
    - [9, 14.159]
  - - [1024, 256, 1, 2304]
    - [17, 18.391]
  - - [1024, 256, 1, 2816]
    - [9, 19.208]
  - - [1024, 256, 1, 3072]
    - [9, 20.073]
  - - [1024, 256, 1, 3328]
    - [9, 20.737]
  - - [1024, 256, 1, 3584]
    - [9, 21.255]
  - - [1024, 256, 1, 4096]
    - [9, 21.719]
  - - [1024, 256, 1, 4352]
    - [9, 22.393]
  - - [1024, 256, 1, 4608]
    - [9, 22.495]
  - - [1024, 256, 1, 5120]
    - [97, 23.228]
  - - [1024, 256, 1, 5376]
    - [98, 23.912]
  - - [1024, 256, 1, 5632]
    - [97, 24.248]
  - - [1024, 256, 1, 6144]
    - [99, 25.308]
  - - [1024, 256, 1, 6400]
    - [100, 26.072]
  - - [1024, 256, 1, 7680]
    - [99, 28.496]
  - - [1024, 256, 1, 7936]
    - [100, 28.794]
  - - [1024, 256, 1, 8192]
    - [100, 30.056]
  - - [1024, 256, 1, 8448]
    - [100, 30.098]
  - - [1024, 256, 1, 9728]
    - [100, 32.21]
  - - [1024, 256, 1, 9984]
    - [100, 32.984]
  - - [1024, 256, 1, 10496]
    - [100, 33.549]
  - - [1024, 256, 1, 11520]
    - [100, 34.264]
  - - [1024, 256, 1, 12032]
    - [100, 35.43]
  - - [1024, 256, 1, 13568]
    - [100, 37.07]
  - - [1024, 256, 1, 14336]
    - [100, 37.536]
  - - [1024, 256, 1, 14848]
    - [100, 37.87]
  - - [1024, 256, 1, 15104]
    - [100, 37.965]
  - - [1024, 256, 1, 15872]
    - [100, 38.205]
  - - [1024, 256, 1, 16128]
    - [99, 38.695]
  - - [1024, 256, 1, 17152]
    - [100, 39.392]
  - - [1024, 256, 1, 17408]
    - [100, 39.917]
  - - [1024, 256, 1, 18944]
    - [100, 40.544]
  - - [1024, 256, 1, 19712]
    - [100, 41.231]
  - - [1024, 256, 1, 19968]
    - [100, 41.097]
  - - [1024, 256, 1, 21248]
    - [100, 41.67]
  - - [1024, 256, 1, 21504]
    - [100, 41.949]
  - - [1024, 256, 1, 22016]
    - [100, 42.25]
  - - [1024, 256, 1, 28672]
    - [101, 45.067]
  - - [1024, 256, 1, 33536]
    - [101, 47.436]
  - - [1024, 512, 1, 32768]
    - [102, 57.249]
  - - [1024, 1024, 1, 200]
    - [103, 11.814]
  - - [1024, 1024, 1, 512]
    - [21, 24.389]
  - - [1024, 1024, 1, 960]
    - [21, 30.569]
  - - [1024, 1024, 1, 1600]
    - [59, 37.356]
  - - [1024, 1024, 1, 32768]
    - [104, 68.25]
  - - [1600, 1024, 1, 512]
    - [105, 34.243]
  - - [1600, 1024, 1, 960]
    - [106, 44.413]
  - - [2048, 256, 1, 1024]
    - [9, 20.366]
  - - [2048, 960, 1, 1]
    - [58, 0.126]
  - - [2048, 2048, 1, 512]
    - [96, 44.15]
  - - [2048, 2048, 1, 960]
    - [107, 54.855]
  - - [2048, 2048, 1, 1024]
    - [37, 55.556]
  - - [3200, 2048, 1, 1024]
    - [31, 67.507]
  - - [4096, 4096, 1, 1024]
    - [62, 74.331]
  - - [14, 64, 10880, 14]
    - [48, 1.684]
  - - [15, 64, 10880, 14]
    - [48, 1.742]
  - - [15, 64, 7680, 15]
    - [48, 1.762]
  - - [15, 64, 10880, 15]
    - [108, 1.86]
  - - [17, 64, 7680, 15]
    - [66, 1.555]
  - - [17, 64, 6144, 17]
    - [109, 1.629]
  - - [17, 64, 7680, 17]
    - [110, 1.688]
  - - [21, 64, 6144, 17]
    - [111, 1.997]
  - - [21, 64, 6144, 21]
    - [111, 2.467]
  - - [24, 64, 4736, 24]
    - [112, 4.106]
  - - [30, 64, 2048, 30]
    - [113, 3.098]
  - - [30, 64, 2048, 31]
    - [111, 3.239]
  - - [31, 64, 2048, 31]
    - [114, 2.844]
  - - [32, 64, 4608, 32]
    - [115, 7.595]
  - - [32, 64, 4608, 35]
    - [115, 6.598]
  - - [34, 64, 4736, 24]
    - [111, 2.751]
  - - [34, 64, 4736, 34]
    - [109, 3.728]
  - - [35, 64, 4608, 35]
    - [109, 3.822]
  - - [64, 14, 10880, 14]
    - [49, 2.034]
  - - [64, 15, 10880, 14]
    - [46, 2.145]
  - - [64, 15, 7680, 15]
    - [49, 2.167]
  - - [64, 15, 10880, 15]
    - [46, 2.292]
  - - [64, 17, 7680, 15]
    - [116, 2.319]
  - - [64, 17, 6144, 17]
    - [58, 2.345]
  - - [64, 17, 7680, 17]
    - [58, 2.44]
  - - [64, 21, 6144, 17]
    - [58, 2.839]
  - - [64, 21, 6144, 21]
    - [116, 3.428]
  - - [64, 24, 4736, 24]
    - [58, 4.203]
  - - [64, 30, 2048, 30]
    - [58, 4.764]
  - - [64, 30, 2048, 31]
    - [116, 4.819]
  - - [64, 31, 2048, 31]
    - [58, 4.962]
  - - [64, 32, 4608, 32]
    - [117, 7.912]
  - - [64, 32, 4608, 35]
    - [118, 6.879]
  - - [64, 34, 4736, 24]
    - [119, 4.675]
  - - [64, 34, 4736, 34]
    - [120, 6.027]
  - - [64, 35, 4608, 35]
    - [121, 6.148]
  - - [1024, 1024, 1, 3840]
    - [60, 49.633]
  - - [1024, 1024, 1, 3968]
    - [60, 49.922]
  - - [1024, 1024, 1, 6528]
    - [60, 55.323]
  - - [1024, 1024, 1, 7104]
    - [60, 56.213]
  - - [1024, 1024, 1, 7200]
    - [122, 55.341]
  - - [1024, 1024, 1, 8064]
    - [60, 57.321]
  - - [1024, 1024, 1, 8160]
    - [93, 56.773]
  - - [1024, 1024, 1, 9216]
    - [73, 59.789]
  - - [1024, 1024, 1, 9520]
    - [73, 60.143]
  - - [1024, 1024, 1, 10064]
    - [73, 61.507]
  - - [1024, 1024, 1, 10080]
    - [104, 61.257]
  - - [1024, 1024, 1, 10200]
    - [73, 61.511]
  - - [1024, 4096, 1, 3840]
    - [61, 74.89]
  - - [1024, 4096, 1, 3968]
    - [61, 74.764]
  - - [1024, 4096, 1, 6528]
    - [82, 80.776]
  - - [1024, 4096, 1, 7104]
    - [61, 81.52]
  - - [1024, 4096, 1, 7200]
    - [82, 81.788]
  - - [1024, 4096, 1, 8064]
    - [82, 82.769]
  - - [1024, 4096, 1, 8160]
    - [61, 82.323]
  - - [1024, 4096, 1, 9216]
    - [82, 83.51]
  - - [1024, 4096, 1, 9520]
    - [61, 82.168]
  - - [1024, 4096, 1, 10064]
    - [82, 83.245]
  - - [1024, 4096, 1, 10080]
    - [82, 84.847]
  - - [1024, 4096, 1, 10200]
    - [82, 83.637]
  - - [1024, 42720, 1, 3968]
    - [28, 91.037]
  - - [1024, 42720, 1, 6528]
    - [28, 92.695]
  - - [1024, 42720, 1, 7104]
    - [28, 92.931]
  - - [1024, 42720, 1, 7200]
    - [28, 92.86]
  - - [1024, 42720, 1, 9520]
    - [28, 93.151]
  - - [1024, 42720, 1, 10080]
    - [28, 93.556]
  - - [4096, 1024, 1, 3840]
    - [64, 71.105]
  - - [4096, 1024, 1, 3968]
    - [64, 71.842]
  - - [4096, 1024, 1, 6528]
    - [64, 76.947]
  - - [4096, 1024, 1, 7104]
    - [64, 78.729]
  - - [4096, 1024, 1, 7200]
    - [64, 78.668]
  - - [4096, 1024, 1, 8064]
    - [64, 80.208]
  - - [4096, 1024, 1, 8160]
    - [64, 80.184]
  - - [4096, 1024, 1, 9216]
    - [64, 81.236]
  - - [4096, 1024, 1, 9520]
    - [64, 80.119]
  - - [4096, 1024, 1, 10064]
    - [64, 80.144]
  - - [4096, 1024, 1, 10080]
    - [64, 81.816]
  - - [4096, 1024, 1, 10200]
    - [64, 80.001]
  - - [27, 64, 1920, 27]
    - [109, 2.78]
  - - [27, 64, 1920, 33]
    - [123, 3.316]
  - - [33, 64, 1920, 33]
    - [109, 2.991]
  - - [64, 27, 1920, 27]
    - [58, 3.809]
  - - [64, 27, 1920, 33]
    - [58, 4.486]
  - - [64, 33, 1920, 33]
    - [121, 4.46]
  - - [1024, 1024, 1, 3240]
    - [124, 44.716]
  - - [1024, 1024, 1, 3960]
    - [59, 47.884]
  - - [1024, 4096, 1, 3240]
    - [61, 69.657]
  - - [1024, 4096, 1, 3960]
    - [61, 72.307]
  - - [1024, 42720, 1, 3960]
    - [28, 90.024]
  - - [4096, 1024, 1, 3240]
    - [64, 67.389]
  - - [4096, 1024, 1, 3960]
    - [64, 70.509]
  - - [64, 1280, 64, 192]
    - [53, 27.262]
  - - [64, 1280, 64, 320]
    - [125, 36.35]
  - - [64, 1280, 64, 384]
    - [107, 39.517]
  - - [64, 1280, 64, 448]
    - [125, 42.408]
  - - [64, 2048, 64, 192]
    - [125, 30.143]
  - - [64, 2048, 64, 320]
    - [126, 38.429]
  - - [64, 2048, 64, 384]
    - [37, 41.477]
  - - [64, 2048, 64, 448]
    - [127, 43.967]
  - - [1225, 192, 64, 32]
    - [128, 8.349]
  - - [1225, 192, 64, 48]
    - [129, 11.849]
  - - [1225, 192, 64, 64]
    - [130, 15.012]
  - - [1225, 256, 64, 48]
    - [131, 12.376]
  - - [1225, 256, 64, 64]
    - [130, 15.578]
  - - [1225, 288, 64, 48]
    - [132, 10.951]
  - - [1225, 288, 64, 64]
    - [133, 14.011]
  - - [5329, 64, 64, 80]
    - [130, 15.31]
  - - [289, 768, 64, 128]
    - [37, 21.14]
  - - [289, 768, 64, 160]
    - [37, 24.598]
  - - [289, 768, 64, 192]
    - [134, 27.583]
  - - [64, 1280, 32, 192]
    - [37, 23.826]
  - - [64, 1280, 32, 320]
    - [53, 31.504]
  - - [64, 1280, 32, 384]
    - [53, 34.472]
  - - [64, 1280, 32, 448]
    - [53, 36.856]
  - - [64, 2048, 32, 192]
    - [126, 24.926]
  - - [64, 2048, 32, 320]
    - [37, 33.017]
  - - [64, 2048, 32, 384]
    - [37, 34.173]
  - - [64, 2048, 32, 448]
    - [135, 38.007]
  - - [1225, 192, 32, 32]
    - [128, 7.16]
  - - [1225, 192, 32, 48]
    - [136, 10.15]
  - - [1225, 192, 32, 64]
    - [130, 13.109]
  - - [1225, 256, 32, 48]
    - [136, 11.121]
  - - [1225, 256, 32, 64]
    - [130, 13.915]
  - - [1225, 288, 32, 48]
    - [57, 10.472]
  - - [1225, 288, 32, 64]
    - [132, 12.68]
  - - [5329, 64, 32, 80]
    - [130, 14.318]
  - - [289, 768, 32, 128]
    - [37, 18.161]
  - - [289, 768, 32, 160]
    - [37, 21.268]
  - - [289, 768, 32, 192]
    - [37, 24.387]
  - - [49, 512, 64, 2048]
    - [37, 33.108]
  - - [49, 2048, 64, 512]
    - [37, 28.433]
  - - [3136, 64, 32, 256]
    - [96, 28.764]
  - - [3136, 64, 32, 64]
    - [103, 12.758]
  - - [3136, 256, 32, 64]
    - [137, 18.561]
  - - [784, 128, 32, 512]
    - [127, 40.27]
  - - [784, 512, 32, 128]
    - [53, 29.497]
  - - [196, 256, 32, 1024]
    - [138, 32.961]
  - - [196, 1024, 32, 256]
    - [36, 29.734]
  - - [49, 512, 32, 2048]
    - [139, 24.246]
  - - [49, 2048, 32, 512]
    - [37, 24.864]
  - - [3136, 64, 64, 128]
    - [140, 22.841]
  - - [3136, 128, 64, 256]
    - [141, 41.187]
  - - [784, 256, 64, 512]
    - [30, 56.347]
  - - [3136, 256, 64, 128]
    - [42, 33.212]
  - - [3136, 256, 64, 256]
    - [42, 50.595]
  - - [196, 512, 64, 1024]
    - [84, 47.406]
  - - [784, 512, 64, 256]
    - [42, 50.543]
  - - [784, 512, 64, 512]
    - [142, 64.628]
  - - [196, 1024, 64, 512]
    - [37, 44.825]
  - - [196, 1024, 64, 1024]
    - [143, 53.097]
  - - [49, 1024, 64, 2048]
    - [139, 39.773]
  - - [49, 2048, 64, 1024]
    - [37, 36.809]
  - - [3136, 64, 32, 128]
    - [96, 19.875]
  - - [3136, 128, 32, 256]
    - [30, 39.163]
  - - [784, 256, 32, 512]
    - [135, 49.332]
  - - [3136, 256, 32, 128]
    - [42, 31.477]
  - - [3136, 256, 32, 256]
    - [142, 48.146]
  - - [196, 512, 32, 1024]
    - [37, 42.004]
  - - [784, 512, 32, 256]
    - [142, 44.105]
  - - [784, 512, 32, 512]
    - [30, 57.35]
  - - [196, 1024, 32, 512]
    - [37, 40.139]
  - - [196, 1024, 32, 1024]
    - [84, 48.303]
  - - [49, 1024, 32, 2048]
    - [37, 34.146]
  - - [49, 2048, 32, 1024]
    - [144, 32.786]
  - - [7680, 8192, 1, 8192]
    - [35, 95.68]
  - - [3840, 4096, 1, 4096]
    - [28, 89.599]
  - - [1920, 2048, 1, 2048]
    - [122, 69.739]
  - - [960, 1024, 1, 1024]
    - [21, 30.57]
  - - [480, 512, 1, 512]
    - [16, 7.501]
  - - [8192, 7680, 1, 8192]
    - [35, 95.639]
  - - [4096, 3840, 1, 4096]
    - [63, 89.854]
  - - [2048, 1920, 1, 2048]
    - [59, 70.827]
  - - [1024, 960, 1, 1024]
    - [122, 29.612]
  - - [512, 480, 1, 512]
    - [16, 7.541]
  - - [8192, 8192, 1, 8192]
    - [145, 95.786]
  - - [4096, 4096, 1, 4096]
    - [62, 87.563]
  - - [2048, 2048, 1, 2048]
    - [61, 64.996]
  - - [512, 512, 1, 512]
    - [20, 8.495]
  - - [64, 512, 16, 512]
    - [21, 15.275]
  - - [1024, 2, 1, 1]
    - [49, 0.0]
  - - [1024, 2, 1, 512]
    - [10, 0.073]
  - - [1024, 1024, 1, 1]
    - [146, 0.083]
  - - [1024, 1024, 1, 77]
    - [58, 5.65]
  - - [1024, 4096, 1, 512]
    - [96, 43.99]
  - - [1024, 30522, 1, 77]
    - [147, 19.001]
  - - [4096, 1024, 1, 512]
    - [96, 44.475]
  - - [64, 128, 160, 128]
    - [120, 11.456]
  - - [1024, 2, 1, 10]
    - [46, 0.002]
  - - [1024, 2, 1, 1280]
    - [10, 0.128]
  - - [1024, 1024, 1, 10]
    - [58, 0.856]
  - - [1024, 1024, 1, 1280]
    - [11, 34.212]
  - - [1024, 4096, 1, 1280]
    - [28, 58.725]
  - - [1024, 30522, 1, 200]
    - [147, 41.089]
  - - [4096, 1024, 1, 1280]
    - [90, 58.442]
  - - [64, 128, 624, 128]
    - [148, 18.113]
  - - [1024, 2, 1, 39]
    - [55, 0.008]
  - - [1024, 2, 1, 4992]
    - [149, 0.295]
  - - [1024, 1024, 1, 39]
    - [58, 3.2]
  - - [1024, 1024, 1, 780]
    - [21, 26.479]
  - - [1024, 1024, 1, 4992]
    - [60, 53.274]
  - - [1024, 4096, 1, 4992]
    - [61, 77.675]
  - - [1024, 30522, 1, 780]
    - [42, 73.184]
  - - [4096, 1024, 1, 4992]
    - [64, 75.247]
  - - [1024, 1024, 1, 308]
    - [150, 16.029]
  - - [1024, 30522, 1, 308]
    - [30, 53.321]
  - - [64, 128, 640, 128]
    - [151, 18.263]
  - - [1024, 2, 1, 40]
    - [46, 0.008]
  - - [1024, 2, 1, 5120]
    - [149, 0.296]
  - - [1024, 1024, 1, 40]
    - [58, 3.259]
  - - [1024, 1024, 1, 800]
    - [23, 28.382]
  - - [1024, 1024, 1, 5120]
    - [60, 53.152]
  - - [1024, 4096, 1, 5120]
    - [61, 77.972]
  - - [1024, 30522, 1, 800]
    - [42, 75.524]
  - - [4096, 1024, 1, 5120]
    - [64, 75.49]
  - - [64, 128, 656, 128]
    - [125, 18.365]
  - - [1024, 2, 1, 41]
    - [46, 0.009]
  - - [1024, 2, 1, 5248]
    - [149, 0.302]
  - - [1024, 1024, 1, 41]
    - [58, 3.364]
  - - [1024, 1024, 1, 820]
    - [21, 26.541]
  - - [1024, 1024, 1, 5248]
    - [60, 53.081]
  - - [1024, 4096, 1, 5248]
    - [61, 78.356]
  - - [1024, 30522, 1, 820]
    - [30, 74.592]
  - - [4096, 1024, 1, 5248]
    - [64, 75.562]
  - - [64, 512, 80, 512]
    - [52, 33.455]
  - - [1024, 2, 1, 5]
    - [46, 0.001]
  - - [1024, 2, 1, 2560]
    - [152, 0.176]
  - - [1024, 1024, 1, 5]
    - [153, 0.434]
  - - [1024, 1024, 1, 385]
    - [154, 19.191]
  - - [1024, 1024, 1, 2560]
    - [59, 43.704]
  - - [1024, 4096, 1, 2560]
    - [61, 68.54]
  - - [1024, 30522, 1, 385]
    - [155, 59.591]
  - - [4096, 1024, 1, 2560]
    - [63, 66.106]
  - - [64, 512, 96, 512]
    - [52, 34.896]
  - - [1024, 2, 1, 6]
    - [49, 0.001]
  - - [1024, 2, 1, 3072]
    - [152, 0.201]
  - - [1024, 1024, 1, 6]
    - [89, 0.506]
  - - [1024, 1024, 1, 462]
    - [23, 20.442]
  - - [1024, 1024, 1, 3072]
    - [122, 46.468]
  - - [1024, 4096, 1, 3072]
    - [61, 71.056]
  - - [1024, 30522, 1, 462]
    - [155, 63.08]
  - - [4096, 1024, 1, 3072]
    - [64, 68.476]
  - - [64, 128, 128, 128]
    - [103, 9.819]
  - - [1024, 2, 1, 8]
    - [46, 0.002]
  - - [1024, 2, 1, 1024]
    - [10, 0.114]
  - - [1024, 1024, 1, 8]
    - [58, 0.695]
  - - [1024, 1024, 1, 160]
    - [120, 10.619]
  - - [1024, 4096, 1, 1024]
    - [28, 55.684]
  - - [1024, 30522, 1, 160]
    - [33, 38.017]
  - - [4096, 1024, 1, 1024]
    - [28, 55.748]
  - - [64, 128, 144, 128]
    - [103, 10.699]
  - - [1024, 2, 1, 9]
    - [46, 0.002]
  - - [1024, 2, 1, 1152]
    - [10, 0.121]
  - - [1024, 1024, 1, 9]
    - [58, 0.782]
  - - [1024, 1024, 1, 180]
    - [103, 11.018]
  - - [1024, 1024, 1, 1152]
    - [21, 32.716]
  - - [1024, 4096, 1, 1152]
    - [28, 57.243]
  - - [1024, 30522, 1, 180]
    - [155, 38.275]
  - - [4096, 1024, 1, 1152]
    - [28, 57.545]
  - - [479, 1024, 1, 32768]
    - [156, 36.91]
  - - [4, 64, 32768, 4]
    - [44, 0.199]
  - - [4, 64, 38400, 4]
    - [44, 0.2]
  - - [64, 4, 32768, 4]
    - [46, 0.207]
  - - [64, 4, 38400, 4]
    - [46, 0.209]
  - - [1024, 1024, 1, 8192]
    - [104, 57.538]
  - - [1024, 1024, 1, 9600]
    - [104, 60.616]
  - - [1024, 4096, 1, 8192]
    - [82, 83.358]
  - - [1024, 4096, 1, 9600]
    - [82, 84.243]
  - - [1024, 33712, 1, 8192]
    - [29, 93.449]
  - - [1024, 33712, 1, 9600]
    - [29, 93.917]
  - - [4096, 1024, 1, 8192]
    - [64, 79.604]
  - - [4096, 1024, 1, 9600]
    - [64, 79.421]
  - - [64, 128, 1, 128]
    - [49, 0.104]
  - - [128, 64, 1, 128]
    - [50, 0.103]
  - - [5, 64, 1, 5]
    - [56, 0.0]
  - - [2048, 512, 1, 1]
    - [58, 0.084]
  - - [33, 32, 1, 33]
    - [10, 0.003]
  - - [1024, 1600, 1, 1]
    - [58, 0.112]
  - - [64, 1024, 32, 1024]
    - [37, 41.572]
  - - [2560, 1920, 1, 2048]
    - [28, 75.058]
  - - [1024, 3072, 1, 4096]
    - [63, 76.808]
  - - [2560, 2560, 1, 2048]
    - [28, 76.877]
  - - [2048, 2, 1, 2]
    - [46, 0.001]
  - - [1024, 64, 128, 1024]
    - [157, 51.314]
  - - [2048, 2048, 1, 2]
    - [146, 0.369]
  - - [1024, 64, 32, 1024]
    - [158, 40.459]
  - - [1024, 96, 64, 1024]
    - [122, 59.495]
  - - [1024, 30592, 1, 2048]
    - [31, 86.658]
  - - [1024, 3072, 1, 16384]
    - [159, 83.852]
  - - [6144, 1536, 1, 4096]
    - [122, 83.414]
  - - [1024, 1024, 1, 16]
    - [58, 1.477]
  - - [1536, 4608, 1, 8192]
    - [160, 93.043]
  - - [640, 2560, 1, 2048]
    - [28, 59.254]
  - - [1024, 4096, 1, 16384]
    - [82, 86.924]
  - - [64, 512, 40, 512]
    - [37, 26.436]
  - - [1024, 1024, 1, 16384]
    - [60, 62.681]
  - - [1536, 6144, 1, 4096]
    - [59, 83.622]
  - - [1024, 30592, 1, 4096]
    - [161, 91.705]
  - - [2560, 2560, 1, 4]
    - [153, 0.849]
  - - [1536, 1536, 1, 4096]
    - [162, 71.771]
  - - [2560, 7680, 1, 2048]
    - [28, 87.073]
  - - [64, 1024, 256, 1024]
    - [127, 56.006]
  - - [96, 1024, 64, 1024]
    - [138, 54.086]
  - - [1536, 50304, 1, 4096]
    - [28, 93.774]
  - - [2048, 8192, 1, 1024]
    - [42, 75.139]
  - - [1024, 30592, 1, 8192]
    - [161, 94.034]
  - - [512, 64, 256, 512]
    - [157, 39.599]
  - - [1024, 96, 128, 1024]
    - [163, 63.254]
  - - [64, 512, 128, 512]
    - [164, 36.493]
  - - [4096, 1024, 1, 16384]
    - [64, 83.529]
  - - [8192, 2048, 1, 1024]
    - [62, 74.589]
  - - [64, 1024, 64, 1024]
    - [106, 48.389]
  - - [1024, 50304, 1, 4096]
    - [90, 92.715]
  - - [1536, 4608, 1, 4096]
    - [31, 89.024]
  - - [512, 64, 128, 512]
    - [32, 36.438]
  - - [6144, 1536, 1, 8192]
    - [122, 86.298]
  - - [1024, 3072, 1, 8192]
    - [63, 80.739]
  - - [1536, 1536, 1, 8192]
    - [76, 78.526]
  - - [1536, 50304, 1, 8192]
    - [28, 95.815]
  - - [2560, 2, 1, 4]
    - [55, 0.002]
  - - [2048, 6144, 1, 1024]
    - [28, 77.34]
  - - [64, 1024, 128, 1024]
    - [165, 53.088]
  - - [1024, 64, 64, 1024]
    - [158, 49.126]
  - - [1024, 2, 1, 16]
    - [46, 0.004]
  - - [96, 1024, 128, 1024]
    - [166, 57.629]
  - - [2048, 30592, 1, 1024]
    - [42, 83.447]
  - - [64, 512, 256, 512]
    - [106, 40.904]
  - - [1536, 6144, 1, 8192]
    - [59, 86.495]
  - - [1024, 50304, 1, 2048]
    - [42, 88.871]
  - - [1024, 50304, 1, 8192]
    - [28, 94.691]
  - - [1024, 3072, 1, 2048]
    - [28, 69.927]
  - - [1024, 64, 256, 1024]
    - [157, 54.006]
  - - [1024, 50304, 1, 16384]
    - [90, 95.735]
  - - [512, 64, 40, 512]
    - [167, 25.982]
  - - [1024, 2, 1, 64]
    - [46, 0.014]
  - - [1024, 30528, 1, 8192]
    - [31, 93.709]
  - - [1024, 1024, 1, 64]
    - [58, 5.214]
  - - [64, 128, 1024, 128]
    - [52, 20.196]
  - - [128, 64, 1024, 128]
    - [157, 19.202]
  - - [1024, 1024, 1, 3456]
    - [122, 48.147]
  - - [1024, 1024, 1, 6912]
    - [60, 55.776]
  - - [1024, 1024, 1, 864]
    - [20, 29.845]
  - - [1024, 512, 1, 3456]
    - [168, 31.025]
  - - [1024, 512, 1, 4096]
    - [93, 33.604]
  - - [1024, 512, 1, 6912]
    - [93, 43.854]
  - - [1024, 512, 1, 864]
    - [21, 18.972]
  - - [256, 128, 1, 3456]
    - [12, 3.635]
  - - [256, 128, 1, 4096]
    - [68, 3.838]
  - - [256, 128, 1, 55296]
    - [169, 20.517]
  - - [256, 128, 1, 6912]
    - [170, 5.88]
  - - [256, 128, 1, 864]
    - [24, 1.706]
  - - [256, 3456, 1, 1]
    - [58, 0.078]
  - - [256, 4096, 1, 1]
    - [58, 0.091]
  - - [256, 6912, 1, 1]
    - [58, 0.122]
  - - [256, 864, 1, 1]
    - [51, 0.022]
  - - [480, 1024, 1, 3456]
    - [168, 28.48]
  - - [480, 1024, 1, 4096]
    - [93, 30.987]
  - - [480, 1024, 1, 6912]
    - [93, 40.633]
  - - [480, 1024, 1, 864]
    - [21, 17.787]
  - - [512, 256, 1, 3456]
    - [171, 10.744]
  - - [512, 256, 1, 4096]
    - [172, 12.319]
  - - [512, 256, 1, 55296]
    - [173, 40.89]
  - - [512, 256, 1, 6912]
    - [171, 17.448]
  - - [512, 256, 1, 864]
    - [10, 5.962]
  - - [30528, 1024, 1, 640]
    - [142, 70.242]
  - - [30528, 1024, 1, 1280]
    - [142, 81.714]
  - - [4096, 1024, 1, 10240]
    - [64, 82.03]
  - - [1024, 4096, 1, 10240]
    - [82, 84.983]
  - - [30528, 1024, 1, 1600]
    - [174, 83.645]
  - - [1024, 2, 1, 80]
    - [49, 0.016]
  - - [1024, 1024, 1, 10240]
    - [104, 61.911]
  - - [1024, 1024, 1, 80]
    - [117, 6.259]
  - - [64, 128, 1280, 128]
    - [125, 21.664]
  - - [128, 64, 1280, 128]
    - [54, 19.767]
  - - [1024, 4096, 1, 10496]
    - [82, 85.236]
  - - [30528, 1024, 1, 1640]
    - [142, 83.253]
  - - [4096, 1024, 1, 10496]
    - [64, 80.257]
  - - [1024, 1024, 1, 10496]
    - [104, 62.092]
  - - [1024, 1024, 1, 82]
    - [58, 5.871]
  - - [1024, 2, 1, 82]
    - [55, 0.016]
  - - [128, 64, 1312, 128]
    - [157, 20.0]
  - - [64, 128, 1312, 128]
    - [125, 21.831]
  - - [30528, 1024, 1, 160]
    - [147, 35.11]
  - - [1024, 4096, 1, 6144]
    - [61, 79.828]
  - - [30528, 1024, 1, 240]
    - [147, 46.367]
  - - [4096, 1024, 1, 6144]
    - [64, 76.808]
  - - [1024, 1024, 1, 12]
    - [58, 1.02]
  - - [1024, 2, 1, 12]
    - [46, 0.003]
  - - [1024, 1024, 1, 6144]
    - [60, 55.535]
  - - [64, 512, 192, 512]
    - [175, 40.823]
  - - [512, 64, 192, 512]
    - [176, 38.857]
  - - [13, 512, 1, 3456]
    - [177, 0.73]
  - - [13, 512, 1, 4096]
    - [177, 0.873]
  - - [13, 512, 1, 55296]
    - [65, 4.397]
  - - [13, 512, 1, 6912]
    - [177, 1.286]
  - - [13, 512, 1, 864]
    - [10, 0.327]
  - - [1024, 1024, 1, 10224]
    - [73, 61.437]
  - - [1024, 1024, 1, 10192]
    - [73, 61.874]
  - - [1024, 1024, 1, 10208]
    - [104, 61.56]
  - - [1024, 4096, 1, 10224]
    - [82, 83.17]
  - - [4096, 1024, 1, 10224]
    - [64, 81.063]
  - - [1024, 3072, 1, 10224]
    - [77, 81.538]
  - - [1024, 3072, 1, 10240]
    - [63, 81.555]
  - - [4096, 1024, 1, 10192]
    - [64, 80.512]
  - - [1024, 3072, 1, 10192]
    - [77, 81.558]
  - - [1024, 4096, 1, 10192]
    - [82, 83.558]
  - - [1024, 3072, 1, 10200]
    - [77, 80.873]
  - - [1024, 1024, 1, 10184]
    - [73, 61.352]
  - - [4096, 1024, 1, 10208]
    - [64, 80.585]
  - - [1024, 3072, 1, 10208]
    - [159, 81.667]
  - - [1024, 4096, 1, 10208]
    - [82, 84.185]
  - - [1024, 2048, 1, 10224]
    - [75, 74.766]
  - - [1024, 2048, 1, 10240]
    - [75, 76.59]
  - - [1024, 1024, 1, 10120]
    - [73, 61.342]
  - - [1024, 2048, 1, 10192]
    - [74, 75.23]
  - - [64, 24, 6816, 24]
    - [153, 4.515]
  - - [1024, 1024, 1, 10152]
    - [73, 61.504]
  - - [1024, 3072, 1, 10080]
    - [178, 81.508]
  - - [64, 26, 6272, 26]
    - [179, 5.07]
  - - [100352, 256, 1, 512]
    - [33, 61.695]
  - - [12544, 1024, 1, 2048]
    - [180, 78.099]
  - - [12544, 147, 1, 64]
    - [39, 7.306]
  - - [200704, 256, 1, 512]
    - [181, 60.822]
  - - [25088, 512, 1, 1024]
    - [35, 69.672]
  - - [3136, 576, 1, 64]
    - [182, 8.09]
  - - [50176, 512, 1, 1024]
    - [183, 76.447]
  - - [6272, 1024, 1, 2048]
    - [145, 75.531]
  - - [784, 1152, 1, 128]
    - [120, 8.403]
  - - [3136, 256, 128, 128]
    - [42, 34.225]
  - - [3136, 256, 256, 128]
    - [42, 34.75]
  - - [784, 512, 128, 256]
    - [30, 55.11]
  - - [784, 512, 256, 256]
    - [42, 57.584]
  - - [64, 128, 2048, 128]
    - [125, 22.912]
  - - [128, 64, 2048, 128]
    - [54, 20.626]
  - - [30528, 1024, 1, 2560]
    - [184, 87.571]
  - - [1024, 1024, 1, 128]
    - [58, 8.791]
  - - [1024, 2, 1, 128]
    - [49, 0.026]
  - - [128, 64, 1536, 128]
    - [185, 20.229]
  - - [64, 128, 1536, 128]
    - [125, 21.995]
  - - [1024, 4096, 1, 12288]
    - [82, 85.217]
  - - [30528, 1024, 1, 1920]
    - [174, 85.522]
  - - [1024, 1024, 1, 96]
    - [58, 7.224]
  - - [1024, 1024, 1, 12288]
    - [60, 61.072]
  - - [4096, 1024, 1, 12288]
    - [64, 82.074]
  - - [1024, 2, 1, 96]
    - [49, 0.02]
  - - [25600, 128, 25, 128]
    - [186, 29.005]
  - - [12544, 128, 36, 128]
    - [187, 30.072]
  - - [9216, 128, 49, 128]
    - [187, 30.851]
  - - [6400, 128, 64, 128]
    - [41, 30.748]
  - - [6400, 256, 25, 256]
    - [188, 51.009]
  - - [4096, 256, 36, 256]
    - [30, 52.269]
  - - [2304, 256, 49, 256]
    - [188, 50.216]
  - - [2304, 256, 64, 256]
    - [188, 51.502]
  - - [2304, 512, 25, 512]
    - [42, 68.735]
  - - [1024, 512, 36, 512]
    - [42, 65.273]
  - - [1024, 512, 49, 512]
    - [42, 67.637]
  - - [1024, 512, 64, 512]
    - [42, 69.801]
  - - [92416, 64, 25, 64]
    - [147, 15.488]
  - - [50176, 64, 36, 64]
    - [147, 15.814]
  - - [36864, 64, 49, 64]
    - [147, 16.152]
  - - [25600, 64, 64, 64]
    - [147, 16.253]
  - - [64, 128, 192, 128]
    - [21, 12.395]
  - - [128, 64, 192, 128]
    - [189, 11.938]
  - - [768, 2, 1, 2048]
    - [56, 0.113]
  - - [3072, 768, 1, 2048]
    - [76, 62.215]
  - - [768, 3072, 1, 2048]
    - [122, 62.429]
  - - [768, 768, 1, 2048]
    - [168, 29.977]
  - - [64, 384, 144, 384]
    - [53, 36.804]
  - - [384, 64, 144, 384]
    - [189, 32.855]
  - - [768, 2, 1, 4608]
    - [18, 0.232]
  - - [3072, 768, 1, 4608]
    - [76, 73.609]
  - - [768, 3072, 1, 4608]
    - [162, 73.433]
  - - [768, 768, 1, 4608]
    - [190, 40.398]
  - - [64, 512, 48, 512]
    - [175, 29.845]
  - - [512, 64, 48, 512]
    - [157, 29.845]
  - - [64, 128, 256, 128]
    - [120, 13.747]
  - - [128, 64, 256, 128]
    - [191, 13.623]
  - - [64, 384, 192, 384]
    - [127, 35.503]
  - - [384, 64, 192, 384]
    - [39, 34.367]
  - - [1024, 2, 1, 4608]
    - [149, 0.269]
  - - [4096, 1024, 1, 4608]
    - [64, 73.515]
  - - [1024, 4096, 1, 4608]
    - [61, 76.646]
  - - [1024, 1024, 1, 4608]
    - [122, 51.405]
  - - [196, 2304, 1, 256]
    - [22, 7.156]
  - - [49, 4608, 1, 512]
    - [22, 6.512]
  - - [196, 1024, 128, 512]
    - [37, 47.045]
  - - [196, 1024, 256, 512]
    - [37, 48.828]
  - - [49, 2048, 128, 512]
    - [37, 31.146]
  - - [49, 2048, 256, 512]
    - [37, 32.606]
  - - [49, 512, 128, 2048]
    - [106, 37.593]
  - - [49, 512, 256, 2048]
    - [37, 41.302]
  - - [4880, 256, 49, 256]
    - [42, 53.308]
  - - [3128, 256, 64, 256]
    - [42, 52.64]
  - - [4680, 256, 49, 256]
    - [30, 53.145]
  - - [5280, 256, 36, 256]
    - [42, 51.166]
  - - [2640, 256, 64, 256]
    - [42, 52.286]
  - - [5304, 256, 49, 256]
    - [28, 52.26]
  - - [2760, 256, 64, 256]
    - [42, 52.464]
  - - [6440, 256, 36, 256]
    - [30, 51.826]
  - - [5704, 256, 36, 256]
    - [142, 51.853]
  - - [2128, 256, 64, 256]
    - [42, 51.915]
  - - [1160, 256, 49, 256]
    - [142, 44.505]
  - - [4056, 256, 49, 256]
    - [42, 51.817]
  - - [6144, 256, 36, 256]
    - [142, 52.58]
  - - [6336, 256, 36, 256]
    - [142, 50.229]
  - - [13600, 512, 2, 128]
    - [42, 29.149]
  - - [15200, 512, 2, 128]
    - [42, 29.38]
  - - [15200, 128, 2, 512]
    - [30, 41.035]
  - - [13600, 128, 2, 512]
    - [28, 46.924]
  - - [5632, 256, 36, 256]
    - [188, 52.271]
  - - [12288, 128, 2, 512]
    - [28, 45.365]
  - - [12880, 128, 2, 512]
    - [28, 45.071]
  - - [768, 512, 2, 2048]
    - [192, 39.363]
  - - [11408, 128, 2, 512]
    - [193, 41.089]
  - - [13824, 512, 2, 128]
    - [42, 29.039]
  - - [13824, 128, 2, 512]
    - [28, 48.956]
  - - [10560, 128, 2, 512]
    - [37, 39.579]
  - - [10752, 128, 2, 512]
    - [28, 39.497]
  - - [13600, 512, 2, 256]
    - [30, 44.58]
  - - [15200, 512, 2, 256]
    - [30, 44.448]
  - - [768, 2048, 2, 512]
    - [28, 44.694]
  - - [12880, 512, 2, 128]
    - [41, 29.307]
  - - [11616, 128, 2, 512]
    - [194, 41.037]
  - - [14208, 512, 2, 128]
    - [41, 28.781]
  - - [11408, 512, 2, 128]
    - [42, 29.298]
  - - [6912, 256, 36, 256]
    - [188, 52.449]
  - - [672, 512, 2, 2048]
    - [11, 34.82]
  - - [13824, 512, 2, 256]
    - [31, 46.396]
  - - [11616, 512, 2, 128]
    - [42, 28.447]
  - - [12288, 512, 2, 128]
    - [41, 28.758]
  - - [14208, 128, 2, 512]
    - [195, 38.783]
  - - [11968, 128, 2, 512]
    - [28, 43.424]
  - - [864, 2048, 2, 512]
    - [196, 41.832]
  - - [1008, 512, 2, 2048]
    - [166, 42.153]
  - - [10560, 512, 2, 128]
    - [137, 27.552]
  - - [672, 2048, 2, 512]
    - [28, 39.994]
  - - [9408, 128, 2, 512]
    - [39, 37.147]
  - - [10752, 512, 2, 128]
    - [42, 26.288]
  - - [11968, 512, 2, 128]
    - [42, 28.878]
  - - [1240, 256, 49, 256]
    - [142, 46.684]
  - - [4032, 256, 2, 1024]
    - [59, 45.713]
  - - [888, 2048, 2, 512]
    - [147, 44.358]
  - - [12880, 512, 2, 256]
    - [30, 43.376]
  - - [12288, 512, 2, 256]
    - [41, 44.972]
  - - [13440, 128, 2, 512]
    - [28, 47.143]
  - - [864, 2048, 2, 256]
    - [147, 29.933]
  - - [12672, 128, 2, 512]
    - [28, 45.866]
  - - [11264, 128, 2, 512]
    - [28, 41.689]
  - - [11776, 128, 2, 512]
    - [28, 43.151]
  - - [16128, 128, 2, 512]
    - [30, 43.382]
  - - [4032, 1024, 2, 256]
    - [42, 41.348]
  - - [14000, 128, 2, 512]
    - [197, 50.548]
  - - [13440, 512, 2, 128]
    - [31, 28.072]
  - - [864, 512, 2, 2048]
    - [166, 36.26]
  - - [768, 2048, 2, 256]
    - [197, 30.446]
  - - [3264, 1024, 2, 256]
    - [42, 40.0]
  - - [888, 512, 2, 2048]
    - [166, 37.135]
  - - [4200, 256, 2, 1024]
    - [122, 47.71]
  - - [2352, 1024, 2, 256]
    - [30, 37.347]
  - - [56, 512, 64, 512]
    - [126, 28.003]
  - - [2400, 1024, 2, 256]
    - [198, 36.632]
  - - [15200, 256, 2, 12]
    - [137, 2.956]
  - - [840, 512, 2, 2048]
    - [166, 34.517]
  - - [12880, 256, 2, 12]
    - [103, 2.914]
  - - [2520, 1024, 2, 256]
    - [30, 38.865]
  - - [13600, 256, 2, 12]
    - [137, 2.81]
  - - [15200, 256, 2, 3]
    - [120, 0.756]
  - - [12880, 256, 2, 3]
    - [137, 0.75]
  - - [4200, 1024, 2, 256]
    - [155, 43.601]
  - - [12288, 256, 2, 12]
    - [146, 2.532]
  - - [768, 256, 2, 12]
    - [51, 0.462]
  - - [13824, 256, 2, 12]
    - [160, 2.518]
  - - [864, 256, 2, 3]
    - [51, 0.131]
  - - [176, 256, 2, 3]
    - [46, 0.029]
  - - [864, 256, 2, 12]
    - [199, 0.507]
  - - [13600, 256, 2, 3]
    - [103, 0.731]
  - - [768, 256, 2, 3]
    - [51, 0.117]
  - - [7600, 512, 1, 256]
    - [126, 31.437]
  - - [6144, 512, 1, 256]
    - [90, 30.861]
  - - [12544, 1024, 1, 1024]
    - [147, 70.233]
  - - [1024, 81, 1, 1024]
    - [19, 4.882]
  - - [176, 256, 2, 12]
    - [49, 0.109]
  - - [216, 256, 2, 3]
    - [46, 0.034]
  - - [192, 256, 2, 12]
    - [200, 0.121]
  - - [3800, 256, 2, 3]
    - [121, 0.414]
  - - [13824, 256, 2, 3]
    - [201, 0.666]
  - - [12288, 256, 2, 3]
    - [202, 0.641]
  - - [192, 256, 2, 3]
    - [46, 0.031]
  - - [216, 256, 2, 12]
    - [51, 0.133]
  - - [2688, 256, 2, 1024]
    - [28, 38.168]
  - - [3072, 256, 2, 12]
    - [58, 1.337]
  - - [3800, 256, 2, 12]
    - [103, 1.575]
  - - [3072, 256, 2, 3]
    - [58, 0.332]
  - - [2520, 256, 2, 1024]
    - [203, 39.07]
  - - [16128, 512, 2, 128]
    - [41, 28.152]
  - - [2400, 256, 2, 1024]
    - [11, 37.504]
  - - [2352, 256, 2, 1024]
    - [11, 36.95]
  - - [2944, 256, 2, 1024]
    - [28, 41.802]
  - - [2992, 1024, 2, 256]
    - [204, 39.449]
  - - [2816, 256, 2, 1024]
    - [28, 39.89]
  - - [2904, 1024, 2, 256]
    - [53, 38.034]
  - - [3456, 256, 2, 3]
    - [146, 0.36]
  - - [3400, 256, 2, 3]
    - [121, 0.387]
  - - [2816, 1024, 2, 256]
    - [41, 33.604]
  - - [3456, 256, 2, 12]
    - [146, 1.433]
  - - [2944, 1024, 2, 256]
    - [205, 34.99]
  - - [3168, 256, 2, 1024]
    - [105, 44.449]
  - - [2992, 256, 2, 1024]
    - [105, 43.424]
  - - [51520, 256, 2, 12]
    - [116, 3.29]
  - - [3072, 256, 2, 1024]
    - [28, 43.411]
  - - [2640, 1024, 2, 256]
    - [53, 36.435]
  - - [2688, 1024, 2, 256]
    - [37, 32.603]
  - - [2904, 256, 2, 1024]
    - [105, 42.251]
  - - [3264, 256, 2, 1024]
    - [105, 46.57]
  - - [54400, 256, 2, 12]
    - [206, 2.917]
  - - [55296, 256, 2, 3]
    - [147, 0.761]
  - - [60800, 256, 2, 12]
    - [147, 2.989]
  - - [51520, 256, 2, 3]
    - [119, 0.862]
  - - [55296, 256, 2, 12]
    - [116, 2.931]
  - - [3600, 1024, 2, 256]
    - [107, 39.673]
  - - [60800, 256, 2, 3]
    - [58, 0.764]
  - - [952, 256, 64, 256]
    - [30, 44.586]
  - - [49152, 256, 2, 12]
    - [118, 2.992]
  - - [3360, 256, 2, 1024]
    - [105, 47.368]
  - - [736, 256, 64, 256]
    - [41, 43.584]
  - - [600, 256, 64, 256]
    - [142, 42.005]
  - - [1440, 256, 49, 256]
    - [142, 45.862]
  - - [3168, 1024, 2, 256]
    - [41, 38.583]
  - - [1368, 256, 49, 256]
    - [30, 47.408]
  - - [49152, 256, 2, 3]
    - [116, 0.757]
  - - [3600, 256, 2, 1024]
    - [59, 41.291]
  - - [3360, 1024, 2, 256]
    - [155, 41.262]
  - - [54400, 256, 2, 3]
    - [206, 0.75]
  - - [3072, 1024, 2, 256]
    - [30, 36.659]
  - - [2640, 256, 2, 1024]
    - [105, 38.599]
  - - [616, 256, 64, 256]
    - [30, 42.372]
  - - [3008, 256, 64, 256]
    - [142, 49.91]
  - - [896, 256, 64, 256]
    - [142, 44.336]
  - - [768, 256, 64, 256]
    - [30, 45.252]
  - - [3552, 256, 2, 1024]
    - [122, 40.271]
  - - [3552, 1024, 2, 256]
    - [53, 38.854]
  - - [800, 256, 64, 256]
    - [53, 41.181]
  - - [1120, 256, 49, 256]
    - [41, 43.618]
  - - [2408, 256, 64, 256]
    - [42, 51.489]
  - - [3456, 256, 2, 1024]
    - [207, 47.585]
  - - [672, 256, 64, 256]
    - [42, 41.295]
  - - [3456, 1024, 2, 256]
    - [42, 41.075]
  - - [1064, 256, 49, 256]
    - [142, 43.596]
  - - [3400, 256, 2, 1024]
    - [105, 49.589]
  - - [704, 256, 64, 256]
    - [41, 40.719]
  - - [3400, 1024, 2, 256]
    - [42, 40.987]
  - - [3264, 256, 64, 256]
    - [42, 50.013]
  - - [3800, 1024, 2, 256]
    - [147, 40.59]
  - - [3800, 256, 2, 1024]
    - [59, 43.84]
  - - [6440, 512, 1, 256]
    - [155, 31.49]
  - - [6912, 512, 1, 256]
    - [197, 33.911]
  - - [6800, 512, 1, 256]
    - [155, 32.924]
  - - [6800, 512, 1, 1024]
    - [28, 63.255]
  - - [6440, 512, 1, 1024]
    - [208, 61.455]
  - - [6912, 512, 1, 1024]
    - [28, 66.173]
  - - [1728, 1024, 1, 512]
    - [209, 36.324]
  - - [1536, 1024, 1, 512]
    - [189, 32.288]
  - - [7600, 512, 1, 1024]
    - [210, 54.747]
  - - [6144, 512, 1, 1024]
    - [197, 58.915]
  - - [1728, 1024, 1, 2048]
    - [106, 58.662]
  - - [1536, 1024, 1, 2048]
    - [28, 57.333]
  - - [1024, 320, 1, 1024]
    - [20, 15.686]
  - - [173280, 64, 1, 128]
    - [157, 19.315]
  - - [25992, 64, 1, 128]
    - [120, 13.254]
  - - [4524, 256, 49, 256]
    - [183, 49.049]
  - - [2666, 256, 64, 256]
    - [211, 46.539]
  - - [950, 2048, 2, 512]
    - [212, 38.37]
  - - [3220, 1024, 2, 256]
    - [144, 36.092]
  - - [782, 128, 64, 128]
    - [37, 19.953]
  - - [850, 2048, 2, 512]
    - [163, 38.548]
  - - [713, 512, 2, 2048]
    - [92, 34.311]
  - - [805, 2048, 2, 512]
    - [134, 39.543]
  - - [713, 2048, 2, 512]
    - [37, 37.107]
  - - [660, 512, 2, 2048]
    - [92, 32.42]
  - - [726, 512, 2, 2048]
    - [92, 34.654]
  - - [660, 2048, 2, 512]
    - [36, 34.123]
  - - [726, 2048, 2, 512]
    - [37, 36.889]
  - - [748, 512, 2, 2048]
    - [92, 35.995]
  - - [805, 2048, 2, 256]
    - [37, 28.22]
  - - [1251, 256, 49, 256]
    - [37, 38.163]
  - - [805, 512, 2, 2048]
    - [92, 37.664]
  - - [850, 512, 2, 2048]
    - [92, 31.185]
  - - [850, 256, 2, 3]
    - [67, 0.117]
  - - [805, 256, 2, 12]
    - [67, 0.442]
  - - [228, 256, 2, 12]
    - [10, 0.129]
  - - [228, 256, 2, 3]
    - [10, 0.033]
  - - [805, 256, 2, 3]
    - [67, 0.114]
  - - [850, 256, 2, 12]
    - [67, 0.471]
  - - [187, 256, 2, 12]
    - [10, 0.105]
  - - [247, 256, 2, 12]
    - [44, 0.144]
  - - [950, 256, 2, 12]
    - [67, 0.491]
  - - [950, 256, 2, 3]
    - [213, 0.129]
  - - [1900, 1024, 1, 2048]
    - [214, 46.763]
  - - [1610, 1024, 1, 2048]
    - [106, 52.542]
  - - [1900, 1024, 1, 512]
    - [37, 29.534]
  - - [3220, 256, 2, 12]
    - [57, 1.351]
  - - [187, 256, 2, 3]
    - [47, 0.027]
  - - [221, 256, 2, 3]
    - [10, 0.032]
  - - [221, 256, 2, 12]
    - [44, 0.13]
  - - [247, 256, 2, 3]
    - [44, 0.037]
  - - [3220, 256, 2, 3]
    - [57, 0.344]
  - - [3036, 1024, 2, 256]
    - [144, 36.824]
  - - [3036, 256, 2, 1024]
    - [215, 39.852]
  - - [850, 2048, 2, 256]
    - [144, 27.971]
  - - [2852, 1024, 2, 256]
    - [144, 33.693]
  - - [950, 2048, 2, 256]
    - [158, 27.109]
  - - [3700, 1024, 2, 256]
    - [144, 36.548]
  - - [2852, 256, 2, 1024]
    - [216, 37.604]
  - - [3700, 256, 2, 1024]
    - [37, 37.233]
  - - [1269, 256, 49, 256]
    - [37, 35.426]
  - - [1467, 256, 49, 256]
    - [183, 39.199]
  - - [3500, 256, 2, 1024]
    - [106, 43.071]
  - - [1449, 256, 49, 256]
    - [143, 39.211]
  - - [1278, 256, 49, 256]
    - [90, 36.931]
  - - [1413, 256, 49, 256]
    - [183, 37.37]
  - - [1341, 256, 49, 256]
    - [183, 37.465]
  - - [1287, 256, 49, 256]
    - [183, 38.011]
  - - [1332, 256, 49, 256]
    - [188, 40.193]
  - - [1359, 256, 49, 256]
    - [37, 38.056]
  - - [1395, 256, 49, 256]
    - [183, 37.248]
  - - [1323, 256, 49, 256]
    - [217, 37.719]
  - - [1404, 256, 49, 256]
    - [218, 38.164]
  - - [1386, 256, 49, 256]
    - [37, 39.547]
  - - [1350, 256, 49, 256]
    - [37, 40.635]
  - - [3500, 1024, 2, 256]
    - [144, 35.16]
  - - [3220, 256, 2, 1024]
    - [139, 43.032]
  - - [690, 256, 64, 256]
    - [90, 35.136]
  - - [660, 256, 64, 256]
    - [37, 37.804]
  - - [782, 256, 64, 256]
    - [37, 38.981]
  - - [884, 256, 64, 256]
    - [36, 37.365]
  - - [1610, 1024, 1, 512]
    - [92, 29.172]
  - - [1700, 1024, 1, 512]
    - [106, 29.709]
  - - [1700, 1024, 1, 2048]
    - [106, 54.798]
  - - [100, 512, 120, 128]
    - [129, 14.694]
  - - [100, 512, 18, 128]
    - [123, 6.712]
  - - [100, 512, 19, 128]
    - [123, 7.158]
  - - [1444, 128, 120, 256]
    - [37, 36.43]
  - - [1444, 128, 18, 256]
    - [37, 28.14]
  - - [1444, 128, 19, 256]
    - [37, 29.19]
  - - [1444, 256, 120, 256]
    - [183, 47.264]
  - - [1444, 256, 18, 256]
    - [37, 34.393]
  - - [1444, 256, 19, 256]
    - [37, 36.369]
  - - [25, 256, 120, 128]
    - [111, 5.325]
  - - [25, 256, 18, 128]
    - [10, 1.259]
  - - [25, 256, 19, 128]
    - [10, 1.319]
  - - [361, 512, 120, 256]
    - [36, 36.871]
  - - [361, 512, 18, 256]
    - [36, 27.03]
  - - [361, 512, 19, 256]
    - [37, 24.525]
  - - [9, 256, 120, 128]
    - [219, 2.088]
  - - [9, 256, 18, 128]
    - [50, 0.475]
  - - [9, 256, 19, 128]
    - [50, 0.493]
  - - [100, 2304, 1, 512]
    - [22, 6.816]
  - - [1444, 576, 1, 128]
    - [57, 7.314]
  - - [25, 1152, 1, 256]
    - [10, 0.602]
  - - [27436, 64, 1, 128]
    - [154, 11.51]
  - - [361, 2304, 1, 512]
    - [154, 19.346]
  - - [9, 1152, 1, 256]
    - [10, 0.215]
  - - [3840, 4224, 1, 4096]
    - [220, 91.01]
  - - [3840, 4224, 1, 4224]
    - [220, 91.201]
  - - [3840, 4224, 1, 4320]
    - [220, 91.395]
  - - [7680, 8448, 1, 8192]
    - [221, 96.064]
  - - [7680, 8448, 1, 8448]
    - [221, 96.086]
  - - [7680, 8448, 1, 8640]
    - [221, 96.079]
  - - [64, 32, 16, 32]
    - [200, 0.118]
  - - [64, 48, 16, 48]
    - [49, 0.246]
  - - [64, 64, 16, 64]
    - [5, 0.442]
  - - [64, 80, 16, 80]
    - [49, 0.637]
  - - [64, 96, 16, 96]
    - [5, 0.886]
  - - [64, 112, 16, 112]
    - [49, 1.113]
  - - [64, 128, 16, 128]
    - [12, 1.512]
  - - [64, 144, 16, 144]
    - [49, 1.721]
  - - [64, 160, 16, 160]
    - [24, 2.272]
  - - [64, 176, 16, 176]
    - [24, 2.448]
  - - [64, 192, 16, 192]
    - [12, 3.271]
  - - [64, 208, 16, 208]
    - [199, 3.284]
  - - [64, 224, 16, 224]
    - [56, 4.077]
  - - [64, 240, 16, 240]
    - [58, 4.179]
  - - [64, 256, 16, 256]
    - [12, 4.974]
  - - [64, 272, 16, 272]
    - [58, 5.111]
  - - [64, 288, 16, 288]
    - [24, 5.765]
  - - [64, 304, 16, 304]
    - [58, 6.127]
  - - [64, 320, 16, 320]
    - [15, 7.248]
  - - [64, 336, 16, 336]
    - [58, 7.196]
  - - [64, 352, 16, 352]
    - [20, 8.168]
  - - [64, 368, 16, 368]
    - [150, 8.012]
  - - [64, 384, 16, 384]
    - [34, 9.777]
  - - [64, 400, 16, 400]
    - [58, 8.918]
  - - [64, 416, 16, 416]
    - [11, 10.676]
  - - [64, 448, 16, 448]
    - [20, 12.187]
  - - [64, 464, 16, 464]
    - [150, 10.991]
  - - [64, 480, 16, 480]
    - [43, 13.094]
  - - [64, 496, 16, 496]
    - [150, 12.234]
  - - [1024, 3072, 1, 4896]
    - [193, 78.73]
  - - [1024, 3072, 1, 5552]
    - [193, 78.238]
  - - [1024, 3072, 1, 5888]
    - [193, 80.076]
  - - [1024, 3072, 1, 6128]
    - [193, 78.861]
  - - [1024, 1024, 1, 6128]
    - [73, 52.346]
  - - [1024, 3072, 1, 6688]
    - [193, 80.377]
  - - [1024, 3072, 1, 5664]
    - [193, 79.595]
  - - [1024, 3072, 1, 6048]
    - [193, 80.041]
  - - [1024, 3072, 1, 5984]
    - [193, 80.0]
  - - [1024, 1024, 1, 7872]
    - [73, 57.477]
  - - [1024, 3072, 1, 5920]
    - [193, 79.959]
  - - [1024, 1024, 1, 7344]
    - [73, 55.759]
  - - [1024, 1024, 1, 7760]
    - [73, 57.476]
  - - [1024, 3072, 1, 5136]
    - [193, 77.59]
  - - [1024, 3072, 1, 6336]
    - [193, 80.084]
  - - [1024, 1024, 1, 7184]
    - [73, 54.785]
  - - [1024, 3072, 1, 5936]
    - [193, 78.705]
  - - [1024, 1024, 1, 5936]
    - [73, 51.945]
  - - [1024, 3072, 1, 6608]
    - [193, 79.335]
  - - [1024, 3072, 1, 5616]
    - [88, 78.361]
  - - [1024, 3072, 1, 5904]
    - [84, 78.575]
  - - [1024, 3072, 1, 6624]
    - [193, 80.288]
  - - [1024, 1024, 1, 6624]
    - [73, 53.931]
  - - [1024, 3072, 1, 6416]
    - [84, 79.12]
  - - [1024, 3072, 1, 5344]
    - [193, 79.048]
  - - [1024, 3072, 1, 7024]
    - [193, 79.814]
  - - [1024, 1024, 1, 7024]
    - [73, 54.342]
  - - [1024, 3072, 1, 5776]
    - [193, 78.432]
  - - [1024, 1024, 1, 7536]
    - [73, 56.598]
  - - [1024, 3072, 1, 7040]
    - [84, 80.694]
  - - [1024, 3072, 1, 6512]
    - [84, 79.179]
  - - [1024, 1024, 1, 6512]
    - [73, 53.573]
  - - [1024, 3072, 1, 6544]
    - [193, 79.183]
  - - [1024, 3072, 1, 5472]
    - [84, 79.125]
  - - [1024, 1024, 1, 7232]
    - [60, 57.034]
  - - [1024, 3072, 1, 6368]
    - [193, 80.003]
  - - [1024, 3072, 1, 6736]
    - [193, 79.524]
  - - [1024, 3072, 1, 7152]
    - [193, 79.709]
  - - [1024, 1024, 1, 7152]
    - [73, 55.368]
  - - [1024, 3072, 1, 5296]
    - [193, 77.721]
  - - [1024, 3072, 1, 5312]
    - [193, 79.136]
  - - [1024, 3072, 1, 5872]
    - [63, 78.622]
  - - [1024, 3072, 1, 6080]
    - [193, 79.897]
  - - [1024, 3072, 1, 6000]
    - [193, 78.817]
  - - [1024, 3072, 1, 6960]
    - [193, 79.571]
  - - [1024, 1024, 1, 6960]
    - [73, 53.917]
  - - [1024, 3072, 1, 6848]
    - [193, 80.525]
  - - [4096, 1024, 1, 6848]
    - [64, 78.089]
  - - [1024, 3072, 1, 5056]
    - [88, 78.8]
  - - [1024, 1024, 1, 8016]
    - [73, 56.808]
  - - [1024, 3072, 1, 6976]
    - [193, 80.639]
  - - [1024, 4096, 1, 6976]
    - [82, 81.738]
  - - [1024, 3072, 1, 5744]
    - [88, 78.388]
  - - [1024, 3072, 1, 5728]
    - [193, 79.642]
  - - [1024, 3072, 1, 5632]
    - [193, 79.714]
  - - [1024, 3072, 1, 6176]
    - [193, 79.943]
  - - [1024, 3072, 1, 5504]
    - [84, 79.458]
  - - [1024, 3072, 1, 5488]
    - [193, 78.239]
  - - [1024, 3072, 1, 5456]
    - [193, 78.128]
  - - [1024, 3072, 1, 6640]
    - [193, 79.209]
  - - [1024, 1024, 1, 6640]
    - [73, 53.987]
  - - [1024, 3072, 1, 6432]
    - [193, 80.38]
  - - [1024, 3072, 1, 6288]
    - [84, 79.308]
  - - [1024, 1024, 1, 6288]
    - [73, 52.947]
  - - [1024, 3072, 1, 4704]
    - [193, 78.454]
  - - [1024, 3072, 1, 6256]
    - [193, 78.904]
  - - [1024, 1024, 1, 7264]
    - [104, 55.833]
  - - [1024, 3072, 1, 6672]
    - [193, 79.43]
  - - [1024, 3072, 1, 6304]
    - [193, 80.022]
  - - [1024, 1024, 1, 6304]
    - [59, 53.889]
  - - [1024, 3072, 1, 5520]
    - [193, 78.192]
  - - [1024, 3072, 1, 6208]
    - [193, 79.978]
  - - [1024, 3072, 1, 4976]
    - [193, 77.587]
  - - [1024, 3072, 1, 5360]
    - [193, 78.272]
  - - [1024, 3072, 1, 5392]
    - [193, 78.032]
  - - [1024, 3072, 1, 5376]
    - [84, 79.19]
  - - [1024, 3072, 1, 5328]
    - [193, 77.804]
  - - [1024, 3072, 1, 6448]
    - [193, 79.184]
  - - [1024, 1024, 1, 6448]
    - [73, 53.569]
  - - [1024, 3072, 1, 5424]
    - [63, 78.08]
  - - [1024, 3072, 1, 6464]
    - [193, 80.214]
  - - [1024, 1024, 1, 7376]
    - [73, 56.037]
  - - [1024, 3072, 1, 5104]
    - [84, 77.636]
  - - [1024, 3072, 1, 6224]
    - [63, 78.865]
  - - [1024, 3072, 1, 6320]
    - [193, 78.981]
  - - [1024, 1024, 1, 6320]
    - [73, 52.952]
  - - [1024, 4096, 1, 6320]
    - [82, 78.987]
  - - [1024, 3072, 1, 6560]
    - [84, 80.309]
  - - [1024, 1024, 1, 6560]
    - [73, 54.006]
  - - [1024, 3072, 1, 5856]
    - [88, 79.763]
  - - [1024, 3072, 1, 6496]
    - [193, 80.442]
  - - [1024, 3072, 1, 5696]
    - [193, 79.322]
  - - [1024, 3072, 1, 6144]
    - [84, 79.85]
  - - [1024, 1024, 1, 7504]
    - [73, 55.337]
  - - [4096, 1024, 1, 7504]
    - [64, 77.475]
  - - [1024, 3072, 1, 6096]
    - [84, 78.592]
  - - [1024, 1024, 1, 6096]
    - [73, 52.338]
  - - [1024, 3072, 1, 4880]
    - [193, 77.35]
  - - [1024, 1024, 1, 7168]
    - [60, 56.529]
  - - [1024, 1024, 1, 7776]
    - [73, 56.811]
  - - [1024, 3072, 1, 6384]
    - [193, 79.194]
  - - [1024, 1024, 1, 6384]
    - [73, 53.262]
  - - [1024, 3072, 1, 5712]
    - [193, 78.405]
  - - [1024, 3072, 1, 4624]
    - [193, 76.867]
  - - [1024, 1024, 1, 7488]
    - [60, 57.035]
  - - [1024, 3072, 1, 7472]
    - [84, 79.933]
  - - [1024, 1024, 1, 7472]
    - [73, 56.082]
  - - [1024, 3072, 1, 6576]
    - [193, 79.192]
  - - [1024, 3072, 1, 6928]
    - [84, 79.591]
  - - [1024, 3072, 1, 6864]
    - [193, 79.604]
  - - [1024, 1024, 1, 6864]
    - [73, 54.132]
  - - [1024, 3072, 1, 5792]
    - [193, 79.688]
  - - [1024, 3072, 1, 6704]
    - [193, 79.358]
  - - [1024, 1024, 1, 6704]
    - [73, 54.172]
  - - [1024, 3072, 1, 6800]
    - [193, 79.512]
  - - [1024, 3072, 1, 6016]
    - [84, 79.976]
  - - [1024, 3072, 1, 6880]
    - [84, 80.474]
  - - [1024, 1024, 1, 6880]
    - [73, 54.623]
  - - [1024, 1024, 1, 27]
    - [58, 2.278]
  - - [16384, 16384, 1, 16384]
    - [222, 99.058]
  - - [16896, 16384, 1, 16384]
    - [222, 99.487]
- null
