library/src/blas3/Tensile/Logic/asm_full/row/aldebaran_Cijk_Ailk_Bjlk_BBS_BH.yaml
- {MinimumRequiredVersion: 4.32.1}
- aldebaran
- {Architecture: gfx90a, CUCount: 104}
- [Device 0050, Device 0051, Device 0052, Device 0054, Device 0062, Device 7400, Device
    SolutionIndex: 0
    SolutionIndex: 1
    SolutionIndex: 2
    SolutionIndex: 3
    SolutionIndex: 4
    SolutionNameMin: Cijk_Ailk_Bjlk_BBS_BH_MT128x128x16_MI32x32x4x1_SE_AF0EM4_GRVW8_NLCA1_NLCB1_SU0_SUS0_SRVW4_TT2_64_WG64_4_1_WGM1
    SolutionIndex: 5
    SolutionNameMin: Cijk_Ailk_Bjlk_BBS_BH_MT128x128x16_MI32x32x4x1_SE_AF0EM1_GRVW8_NLCA1_NLCB1_SU0_SUS0_SRVW4_TT2_64_WG64_4_1_WGM2
    SolutionIndex: 6
    SolutionNameMin: Cijk_Ailk_Bjlk_BBS_BH_MT128x128x16_MI32x32x4x1_SE_AF0EM1_GRVW8_NLCA1_NLCB1_SU0_SUS0_SRVW4_TT2_64_WG64_4_1_WGM15
    SolutionIndex: 7
    SolutionNameMin: Cijk_Ailk_Bjlk_BBS_BH_MT128x128x16_MI32x32x4x1_SE_AF0EM4_GRVW8_NLCA1_NLCB1_SU0_SUS0_SRVW4_TT2_64_WG64_4_1_WGM15
    SolutionIndex: 8
    SolutionNameMin: Cijk_Ailk_Bjlk_BBS_BH_MT16x64x32_MI16x16x16x1_SE_1LDSB0_AF0EM1_EPS1_GRVW8_GSU1_NLCA1_NLCB1_PGR1_SU0_SUS0_SRVW0_TT1_16_VAW2_WG16_16_1_WGM1
    SolutionIndex: 9
    SolutionNameMin: Cijk_Ailk_Bjlk_BBS_BH_MT16x16x16_MI16x16x16x1_SE_1LDSB0_AF0EM8_EPS0_GRVW2_GSU1_NLCA1_NLCB1_PGR2_SU0_SUS0_SRVW0_TT1_16_VAW2_WG16_4_1_WGM1
    SolutionIndex: 10
    SolutionNameMin: Cijk_Ailk_Bjlk_BBS_BH_MT16x16x16_MI16x16x16x1_SE_1LDSB0_AF0EM8_EPS1_GRVW2_GSU1_NLCA1_NLCB1_PGR1_SU0_SUS0_SRVW0_TT1_16_VAW2_WG16_4_1_WGM1
    SolutionIndex: 11
    SolutionNameMin: Cijk_Ailk_Bjlk_BBS_BH_MT16x16x32_MI16x16x16x1_SE_1LDSB0_AF0EM1_EPS0_GRVW8_GSU1_NLCA1_NLCB1_PGR2_SU0_SUS0_SRVW0_TT1_16_VAW2_WG16_4_1_WGM1
    SolutionIndex: 12
    SolutionNameMin: Cijk_Ailk_Bjlk_BBS_BH_MT16x16x16_MI16x16x16x1_SE_1LDSB0_AF0EM1_EPS1_GRVW2_GSU1_NLCA1_NLCB1_PGR1_SU0_SUS0_SRVW4_TT1_16_VAW2_WG16_4_1_WGM1
    SolutionIndex: 13
    SolutionNameMin: Cijk_Ailk_Bjlk_BBS_BH_MT64x16x32_MI16x16x16x1_SE_1LDSB0_AF0EM1_EPS0_GRVW8_GSU1_NLCA1_NLCB1_PGR2_SU0_SUS0_SRVW0_TT1_16_VAW2_WG64_4_1_WGM1
    SolutionIndex: 14
    SolutionNameMin: Cijk_Ailk_Bjlk_BBS_BH_MT16x16x16_MI16x16x16x1_SE_1LDSB0_AF0EM1_EPS1_GRVW4_GSU1_NLCA1_NLCB1_PGR1_SU0_SUS0_SRVW0_TT1_16_VAW2_WG16_4_1_WGM1
    SolutionIndex: 15
    SolutionNameMin: Cijk_Ailk_Bjlk_BBS_BH_MT16x16x16_MI16x16x16x1_SE_1LDSB0_AF0EM1_EPS1_GRVW2_GSU1_NLCA1_NLCB1_PGR1_SU0_SUS0_SRVW0_TT1_16_VAW2_WG16_4_1_WGM1
    SolutionIndex: 16
    SolutionNameMin: Cijk_Ailk_Bjlk_BBS_BH_MT16x64x32_MI16x16x16x1_SE_1LDSB0_AF0EM8_EPS1_GRVW8_GSU1_NLCA1_NLCB1_PGR1_SU0_SUS0_SRVW0_TT1_16_VAW2_WG16_16_1_WGM2
    SolutionIndex: 17
    SolutionNameMin: Cijk_Ailk_Bjlk_BBS_BH_MT16x16x16_MI16x16x16x1_SE_1LDSB0_AF0EM1_EPS0_GRVW2_GSU1_NLCA1_NLCB1_PGR2_SU32_SUS256_SRVW4_TT1_16_VAW2_WG16_4_1_WGM1
    SolutionIndex: 18
    SolutionNameMin: Cijk_Ailk_Bjlk_BBS_BH_MT32x32x16_MI16x16x16x1_SE_1LDSB0_AF0EM8_EPS1_GRVW2_GSU1_NLCA1_NLCB1_PGR1_SU0_SUS0_SRVW4_TT1_16_VAW2_WG32_8_1_WGM1
    SolutionIndex: 19
    SolutionNameMin: Cijk_Ailk_Bjlk_BBS_BH_MT64x128x16_MI32x32x8x1_SE_1LDSB0_AF0EM8_EPS0_GRVW4_GSU1_NLCA1_NLCB1_PGR2_SU0_SUS0_SRVW4_TT1_64_VAW2_WG64_4_1_WGM2
    SolutionIndex: 20
    SolutionNameMin: Cijk_Ailk_Bjlk_BBS_BH_MT32x32x64_MI16x16x16x1_SE_1LDSB0_AF0EM8_EPS0_GRVW8_GSU1_NLCA1_NLCB1_PGR2_SU0_SUS0_SRVW4_TT1_16_VAW2_WG32_8_1_WGM1
    SolutionIndex: 21
    SolutionNameMin: Cijk_Ailk_Bjlk_BBS_BH_MT64x128x16_MI32x32x8x1_SE_1LDSB0_AF0EM8_EPS0_GRVW4_GSU1_NLCA1_NLCB1_PGR2_SU0_SUS0_SRVW4_TT1_64_VAW2_WG64_4_1_WGM1
    SolutionIndex: 22
    SolutionNameMin: Cijk_Ailk_Bjlk_BBS_BH_MT128x64x16_MI32x32x8x1_SE_1LDSB0_AF0EM8_EPS0_GRVW4_GSU1_NLCA1_NLCB1_PGR2_SU0_SUS0_SRVW4_TT2_32_VAW2_WG64_4_1_WGM1
    SolutionIndex: 23
    SolutionNameMin: Cijk_Ailk_Bjlk_BBS_BH_MT128x64x16_MI32x32x8x1_SE_1LDSB0_AF0EM8_EPS0_GRVW8_GSU1_NLCA1_NLCB1_PGR2_SU0_SUS0_SRVW4_TT2_32_VAW2_WG64_4_1_WGM2
    SolutionIndex: 24
    SolutionNameMin: Cijk_Ailk_Bjlk_BBS_BH_MT16x64x32_MI16x16x16x1_SE_1LDSB0_AF0EM8_EPS1_GRVW2_GSU1_NLCA1_NLCB1_PGR1_SU0_SUS0_SRVW0_TT1_16_VAW2_WG16_16_1_WGM1
    SolutionIndex: 25
    SolutionNameMin: Cijk_Ailk_Bjlk_BBS_BH_MT64x32x16_MI16x16x16x1_SE_1LDSB0_AF0EM1_EPS0_GRVW2_GSU1_NLCA1_NLCB1_PGR2_SU0_SUS0_SRVW4_TT2_16_VAW2_WG32_8_1_WGM1
    SolutionIndex: 26
    SolutionNameMin: Cijk_Ailk_Bjlk_BBS_BH_MT128x96x32_MI32x32x8x1_SE_1LDSB0_AF0EM8_EPS0_GRVW4_GSU1_NLCA1_NLCB3_PGR2_SU0_SUS0_SRVW4_TT1_96_VAW2_WG128_2_1_WGM2
    SolutionIndex: 27
    SolutionNameMin: Cijk_Ailk_Bjlk_BBS_BH_MT128x128x32_MI32x32x8x1_SE_1LDSB0_AF0EM8_EPS0_GRVW8_GSU1_NLCA1_NLCB1_PGR2_SU0_SUS0_SRVW4_TT2_64_VAW2_WG64_4_1_WGM15
    SolutionIndex: 28
    SolutionNameMin: Cijk_Ailk_Bjlk_BBS_BH_MT256x160x32_MI32x32x8x1_SE_1LDSB0_AF0EM8_EPS0_GRVW2_GSU1_NLCA2_NLCB5_PGR2_SU0_SUS0_SRVW4_TT2_160_VAW2_WG128_2_1_WGM15
    SolutionIndex: 29
    SolutionNameMin: Cijk_Ailk_Bjlk_BBS_BH_MT128x256x16_MI32x32x8x1_SE_1LDSB0_AF0EM8_EPS0_GRVW8_GSU1_NLCA1_NLCB1_PGR2_SU0_SUS0_SRVW4_TT2_128_VAW2_WG64_4_1_WGM15
    SolutionIndex: 30
    SolutionNameMin: Cijk_Ailk_Bjlk_BBS_BH_MT128x256x16_MI32x32x8x1_SE_1LDSB1_AF0EM8_EPS0_GRVW8_GSU1_NLCA1_NLCB1_PGR2_SU0_SUS0_SRVW4_TT2_128_VAW2_WG64_4_1_WGM1
    SolutionIndex: 31
    SolutionNameMin: Cijk_Ailk_Bjlk_BBS_BH_MT128x128x32_MI32x32x8x1_SE_1LDSB0_AF0EM8_EPS0_GRVW8_GSU1_NLCA1_NLCB1_PGR2_SU0_SUS0_SRVW4_TT2_64_VAW2_WG64_4_1_WGM2
    SolutionIndex: 32
    SolutionNameMin: Cijk_Ailk_Bjlk_BBS_BH_MT160x256x32_MI32x32x8x1_SE_1LDSB0_AF0EM8_EPS1_GRVW4_GSU1_NLCA5_NLCB1_PGR1_SU32_SUS128_SRVW0_TT5_64_VAW2_WG32_8_1_WGM1
    SolutionIndex: 33
    SolutionNameMin: Cijk_Ailk_Bjlk_BBS_BH_MT16x64x64_MI16x16x16x1_SE_1LDSB0_AF0EM1_EPS0_GRVW8_GSU15_NLCA1_NLCB1_PGR2_SU32_SUS256_SRVW0_TT1_16_VAW1_WG16_16_1_WGM1
    SolutionIndex: 34
    SolutionNameMin: Cijk_Ailk_Bjlk_BBS_BH_MT32x64x16_MI16x16x16x1_SE_1LDSB0_AF0EM1_EPS1_GRVW2_GSU1_NLCA1_NLCB1_PGR1_SU0_SUS0_SRVW4_TT1_32_VAW2_WG32_8_1_WGM1
    SolutionIndex: 35
    SolutionNameMin: Cijk_Ailk_Bjlk_BBS_BH_MT32x32x64_MI16x16x16x1_SE_1LDSB0_AF0EM1_EPS0_GRVW8_GSU1_NLCA1_NLCB1_PGR2_SU0_SUS0_SRVW4_TT1_16_VAW2_WG32_8_1_WGM1
    SolutionIndex: 36
    SolutionNameMin: Cijk_Ailk_Bjlk_BBS_BH_MT32x32x32_MI16x16x16x1_SE_1LDSB0_AF0EM1_EPS0_GRVW4_GSU1_NLCA1_NLCB1_PGR2_SU0_SUS0_SRVW4_TT1_16_VAW2_WG32_8_1_WGM1
    SolutionIndex: 37
    SolutionNameMin: Cijk_Ailk_Bjlk_BBS_BH_MT64x64x32_MI32x32x8x1_SE_1LDSB0_AF0EM8_EPS0_GRVW8_GSU15_NLCA1_NLCB1_PGR2_SU0_SUS0_SRVW4_TT1_32_VAW1_WG64_4_1_WGM15
    SolutionIndex: 38
    SolutionNameMin: Cijk_Ailk_Bjlk_BBS_BH_MT64x128x32_MI32x32x8x1_SE_1LDSB0_AF0EM8_EPS0_GRVW4_GSU7_NLCA1_NLCB1_PGR2_SU32_SUS256_SRVW4_TT1_64_VAW1_WG64_4_1_WGM2
    SolutionIndex: 39
    SolutionNameMin: Cijk_Ailk_Bjlk_BBS_BH_MT128x256x16_MI32x32x8x1_SE_1LDSB0_AF0EM8_EPS0_GRVW4_GSU5_NLCA1_NLCB1_PGR2_SU0_SUS0_SRVW4_TT2_128_VAW1_WG64_4_1_WGM15
    SolutionIndex: 40
    SolutionNameMin: Cijk_Ailk_Bjlk_BBS_BH_MT128x128x32_MI32x32x8x1_SE_1LDSB0_AF0EM8_EPS0_GRVW4_GSU2_NLCA1_NLCB1_PGR2_SU0_SUS0_SRVW4_TT2_64_VAW1_WG64_4_1_WGM15
    SolutionIndex: 41
    SolutionNameMin: Cijk_Ailk_Bjlk_BBS_BH_MT128x256x32_MI32x32x8x1_SE_1LDSB0_AF0EM8_EPS1_GRVW8_GSU3_NLCA1_NLCB1_PGR1_SU0_SUS0_SRVW4_TT2_128_VAW1_WG64_4_1_WGM15
    SolutionIndex: 42
    SolutionNameMin: Cijk_Ailk_Bjlk_BBS_BH_MT128x256x16_MI32x32x8x1_SE_1LDSB0_AF0EM8_EPS0_GRVW4_GSU3_NLCA1_NLCB1_PGR2_SU0_SUS0_SRVW4_TT2_128_VAW1_WG64_4_1_WGM2
    SolutionIndex: 43
    SolutionNameMin: Cijk_Ailk_Bjlk_BBS_BH_MT128x96x64_MI32x32x8x1_SE_1LDSB0_AF0EM8_EPS0_GRVW4_GSU1_NLCA1_NLCB3_PGR2_SU0_SUS0_SRVW4_TT1_96_VAW2_WG128_2_1_WGM2
    SolutionIndex: 44
    SolutionNameMin: Cijk_Ailk_Bjlk_BBS_BH_MT128x128x32_MI32x32x8x1_SE_1LDSB0_AF0EM8_EPS0_GRVW4_GSU1_NLCA1_NLCB1_PGR2_SU0_SUS0_SRVW4_TT2_64_VAW2_WG64_4_1_WGM2
    SolutionIndex: 45
    SolutionNameMin: Cijk_Ailk_Bjlk_BBS_BH_MT128x128x32_MI32x32x8x1_SE_1LDSB0_AF0EM1_EPS0_GRVW4_GSU1_NLCA1_NLCB1_PGR2_SU0_SUS0_SRVW4_TT2_64_VAW2_WG64_4_1_WGM1
    SolutionIndex: 46
    SolutionNameMin: Cijk_Ailk_Bjlk_BBS_BH_MT128x160x32_MI32x32x8x1_SE_1LDSB0_AF0EM8_EPS0_GRVW4_GSU1_NLCA1_NLCB5_PGR2_SU0_SUS0_SRVW4_TT1_160_VAW2_WG128_2_1_WGM15
    SolutionIndex: 47
    SolutionNameMin: Cijk_Ailk_Bjlk_BBS_BH_MT128x192x32_MI32x32x8x1_SE_1LDSB0_AF0EM8_EPS0_GRVW4_GSU1_NLCA1_NLCB3_PGR2_SU0_SUS0_SRVW4_TT2_96_VAW2_WG64_4_1_WGM15
    SolutionIndex: 48
    SolutionNameMin: Cijk_Ailk_Bjlk_BBS_BH_MT128x192x32_MI32x32x8x1_SE_1LDSB0_AF0EM8_EPS0_GRVW4_GSU1_NLCA1_NLCB3_PGR2_SU0_SUS0_SRVW4_TT2_96_VAW2_WG64_4_1_WGM2
    SolutionIndex: 49
    SolutionNameMin: Cijk_Ailk_Bjlk_BBS_BH_MT128x128x32_MI32x32x8x1_SE_1LDSB0_AF0EM8_EPS0_GRVW8_GSU1_NLCA1_NLCB1_PGR2_SU0_SUS0_SRVW4_TT2_64_VAW2_WG64_4_1_WGM1
    SolutionIndex: 50
    SolutionNameMin: Cijk_Ailk_Bjlk_BBS_BH_MT128x128x32_MI32x32x8x1_SE_1LDSB0_AF0EM8_EPS0_GRVW4_GSU1_NLCA1_NLCB1_PGR2_SU0_SUS0_SRVW4_TT2_64_VAW2_WG64_4_1_WGM1
    SolutionIndex: 51
    SolutionNameMin: Cijk_Ailk_Bjlk_BBS_BH_MT128x288x32_MI32x32x8x1_SE_1LDSB0_AF0EM8_EPS0_GRVW4_GSU1_NLCA1_NLCB9_PGR2_SU0_SUS0_SRVW4_TT1_288_VAW2_WG128_2_1_WGM15
    SolutionIndex: 52
    SolutionNameMin: Cijk_Ailk_Bjlk_BBS_BH_MT256x160x32_MI32x32x8x1_SE_1LDSB0_AF0EM8_EPS1_GRVW4_GSU1_NLCA1_NLCB5_PGR1_SU0_SUS0_SRVW4_TT2_160_VAW2_WG128_2_1_WGM15
    SolutionIndex: 53
    SolutionNameMin: Cijk_Ailk_Bjlk_BBS_BH_MT256x160x32_MI32x32x8x1_SE_1LDSB0_AF0EM8_EPS1_GRVW4_GSU1_NLCA1_NLCB5_PGR1_SU0_SUS0_SRVW4_TT2_160_VAW2_WG128_2_1_WGM2
    SolutionIndex: 54
    SolutionNameMin: Cijk_Ailk_Bjlk_BBS_BH_MT128x256x16_MI32x32x8x1_SE_1LDSB0_AF0EM8_EPS0_GRVW8_GSU1_NLCA1_NLCB1_PGR2_SU0_SUS0_SRVW4_TT2_128_VAW2_WG64_4_1_WGM1
    SolutionIndex: 55
    SolutionNameMin: Cijk_Ailk_Bjlk_BBS_BH_MT128x256x16_MI32x32x8x1_SE_1LDSB1_AF0EM8_EPS0_GRVW8_GSU1_NLCA1_NLCB1_PGR2_SU0_SUS0_SRVW4_TT2_128_VAW2_WG64_4_1_WGM2
    SolutionIndex: 56
    SolutionNameMin: Cijk_Ailk_Bjlk_BBS_BH_MT64x32x16_MI16x16x16x1_SE_1LDSB0_AF0EM8_EPS1_GRVW2_GSU1_NLCA1_NLCB1_PGR1_SU0_SUS0_SRVW4_TT2_16_VAW2_WG32_8_1_WGM15
    SolutionIndex: 57
    SolutionNameMin: Cijk_Ailk_Bjlk_BBS_BH_MT64x64x32_MI32x32x8x1_SE_1LDSB0_AF0EM1_EPS0_GRVW8_GSU1_NLCA1_NLCB1_PGR2_SU0_SUS0_SRVW4_TT1_32_VAW2_WG64_4_1_WGM1
    SolutionIndex: 58
    SolutionNameMin: Cijk_Ailk_Bjlk_BBS_BH_MT128x128x32_MI32x32x8x1_SE_1LDSB0_AF0EM8_EPS0_GRVW4_GSU3_NLCA1_NLCB1_PGR2_SU0_SUS0_SRVW4_TT2_64_VAW1_WG64_4_1_WGM15
    SolutionIndex: 59
    SolutionNameMin: Cijk_Ailk_Bjlk_BBS_BH_MT32x32x32_MI16x16x16x1_SE_1LDSB0_AF0EM8_EPS0_GRVW4_GSU1_NLCA1_NLCB1_PGR2_SU0_SUS0_SRVW4_TT1_16_VAW2_WG32_8_1_WGM1
    SolutionIndex: 60
    SolutionNameMin: Cijk_Ailk_Bjlk_BBS_BH_MT32x32x64_MI16x16x16x1_SE_1LDSB0_AF0EM8_EPS0_GRVW8_GSU1_NLCA1_NLCB1_PGR2_SU0_SUS0_SRVW4_TT1_16_VAW2_WG32_8_1_WGM15
    SolutionIndex: 61
    SolutionNameMin: Cijk_Ailk_Bjlk_BBS_BH_MT64x64x32_MI32x32x8x1_SE_1LDSB0_AF0EM8_EPS0_GRVW8_GSU1_NLCA1_NLCB1_PGR2_SU0_SUS0_SRVW4_TT1_32_VAW2_WG64_4_1_WGM1
    SolutionIndex: 62
    SolutionNameMin: Cijk_Ailk_Bjlk_BBS_BH_MT64x64x32_MI32x32x8x1_SE_1LDSB0_AF0EM8_EPS0_GRVW4_GSU1_NLCA1_NLCB1_PGR2_SU0_SUS0_SRVW4_TT1_32_VAW2_WG64_4_1_WGM1
    SolutionIndex: 63
    SolutionNameMin: Cijk_Ailk_Bjlk_BBS_BH_MT64x64x16_MI32x32x8x1_SE_1LDSB0_AF0EM8_EPS0_GRVW4_GSU1_NLCA1_NLCB1_PGR2_SU0_SUS0_SRVW4_TT1_32_VAW2_WG64_4_1_WGM1
    SolutionIndex: 64
    SolutionNameMin: Cijk_Ailk_Bjlk_BBS_BH_MT64x64x64_MI32x32x8x1_SE_1LDSB0_AF0EM8_EPS0_GRVW8_GSU1_NLCA1_NLCB1_PGR2_SU0_SUS0_SRVW4_TT1_32_VAW2_WG64_4_1_WGM15
    SolutionIndex: 65
    SolutionNameMin: Cijk_Ailk_Bjlk_BBS_BH_MT128x64x32_MI32x32x8x1_SE_1LDSB0_AF0EM8_EPS0_GRVW8_GSU1_NLCA1_NLCB1_PGR2_SU0_SUS0_SRVW4_TT2_32_VAW2_WG64_4_1_WGM2
    SolutionIndex: 66
    SolutionNameMin: Cijk_Ailk_Bjlk_BBS_BH_MT64x64x32_MI32x32x8x1_SE_1LDSB0_AF0EM8_EPS0_GRVW8_GSU1_NLCA1_NLCB1_PGR2_SU0_SUS0_SRVW4_TT1_32_VAW2_WG64_4_1_WGM15
    SolutionIndex: 67
    SolutionNameMin: Cijk_Ailk_Bjlk_BBS_BH_MT64x64x64_MI32x32x8x1_SE_1LDSB0_AF0EM8_EPS0_GRVW8_GSU1_NLCA1_NLCB1_PGR2_SU0_SUS0_SRVW4_TT1_32_VAW2_WG64_4_1_WGM2
    SolutionIndex: 68
    SolutionNameMin: Cijk_Ailk_Bjlk_BBS_BH_MT128x64x64_MI32x32x8x1_SE_1LDSB0_AF0EM8_EPS1_GRVW8_GSU3_NLCA1_NLCB1_PGR1_SU0_SUS0_SRVW0_TT2_32_VAW1_WG64_4_1_WGM1
    SolutionIndex: 69
    SolutionNameMin: Cijk_Ailk_Bjlk_BBS_BH_MT64x64x64_MI32x32x8x1_SE_1LDSB0_AF0EM8_EPS1_GRVW8_GSU3_NLCA1_NLCB1_PGR1_SU0_SUS0_SRVW0_TT1_32_VAW1_WG64_4_1_WGM2
    SolutionIndex: 70
    SolutionNameMin: Cijk_Ailk_Bjlk_BBS_BH_MT64x128x64_MI32x32x8x1_SE_1LDSB0_AF0EM8_EPS1_GRVW8_GSU3_NLCA1_NLCB1_PGR1_SU32_SUS128_SRVW0_TT1_64_VAW1_WG64_4_1_WGM2
    SolutionIndex: 71
    SolutionNameMin: Cijk_Ailk_Bjlk_BBS_BH_MT128x128x64_MI32x32x8x1_SE_1LDSB0_AF0EM8_EPS0_GRVW8_GSU15_NLCA1_NLCB1_PGR2_SU0_SUS0_SRVW4_TT2_64_VAW1_WG64_4_1_WGM2
    SolutionIndex: 72
    SolutionNameMin: Cijk_Ailk_Bjlk_BBS_BH_MT64x128x32_MI32x32x8x1_SE_1LDSB0_AF0EM1_EPS0_GRVW8_GSU1_NLCA1_NLCB1_PGR2_SU32_SUS256_SRVW4_TT1_64_VAW2_WG64_4_1_WGM15
    SolutionIndex: 73
    SolutionNameMin: Cijk_Ailk_Bjlk_BBS_BH_MT128x128x16_MI32x32x8x1_SE_1LDSB0_AF0EM8_EPS0_GRVW8_GSU1_NLCA1_NLCB1_PGR2_SU0_SUS0_SRVW4_TT2_64_VAW2_WG64_4_1_WGM2
    SolutionIndex: 74
    SolutionNameMin: Cijk_Ailk_Bjlk_BBS_BH_MT32x64x16_MI16x16x16x1_SE_1LDSB1_AF0EM1_EPS1_GRVW2_GSU1_NLCA1_NLCB1_PGR1_SU0_SUS0_SRVW4_TT1_32_VAW2_WG32_8_1_WGM15
    SolutionIndex: 75
    SolutionNameMin: Cijk_Ailk_Bjlk_BBS_BH_MT32x64x16_MI16x16x16x1_SE_1LDSB0_AF0EM8_EPS1_GRVW2_GSU1_NLCA1_NLCB1_PGR1_SU0_SUS0_SRVW4_TT1_32_VAW2_WG32_8_1_WGM15
    SolutionIndex: 76
    SolutionNameMin: Cijk_Ailk_Bjlk_BBS_BH_MT32x64x16_MI16x16x16x1_SE_1LDSB0_AF0EM1_EPS1_GRVW2_GSU1_NLCA1_NLCB1_PGR1_SU32_SUS128_SRVW4_TT1_32_VAW2_WG32_8_1_WGM2
    SolutionIndex: 77
    SolutionNameMin: Cijk_Ailk_Bjlk_BBS_BH_MT32x64x16_MI16x16x16x1_SE_1LDSB0_AF0EM8_EPS0_GRVW8_GSU1_NLCA1_NLCB1_PGR2_SU32_SUS256_SRVW4_TT1_32_VAW2_WG32_8_1_WGM2
    SolutionIndex: 78
    SolutionNameMin: Cijk_Ailk_Bjlk_BBS_BH_MT32x64x16_MI16x16x16x1_SE_1LDSB0_AF0EM1_EPS0_GRVW2_GSU1_NLCA1_NLCB1_PGR2_SU32_SUS256_SRVW4_TT1_32_VAW2_WG32_8_1_WGM15
    SolutionIndex: 79
    SolutionNameMin: Cijk_Ailk_Bjlk_BBS_BH_MT32x64x16_MI16x16x16x1_SE_1LDSB1_AF0EM1_EPS0_GRVW8_GSU1_NLCA1_NLCB1_PGR2_SU0_SUS0_SRVW4_TT1_32_VAW2_WG32_8_1_WGM2
    SolutionIndex: 80
    SolutionNameMin: Cijk_Ailk_Bjlk_BBS_BH_MT64x32x16_MI16x16x16x1_SE_1LDSB1_AF0EM8_EPS1_GRVW2_GSU1_NLCA1_NLCB1_PGR1_SU0_SUS0_SRVW4_TT2_16_VAW2_WG32_8_1_WGM1
    SolutionIndex: 81
    SolutionNameMin: Cijk_Ailk_Bjlk_BBS_BH_MT64x32x16_MI16x16x16x1_SE_1LDSB0_AF0EM8_EPS0_GRVW4_GSU1_NLCA1_NLCB1_PGR2_SU0_SUS0_SRVW4_TT2_16_VAW2_WG32_8_1_WGM1
    SolutionIndex: 82
    SolutionNameMin: Cijk_Ailk_Bjlk_BBS_BH_MT64x32x16_MI16x16x16x1_SE_1LDSB1_AF0EM8_EPS0_GRVW2_GSU1_NLCA1_NLCB1_PGR2_SU0_SUS0_SRVW4_TT2_16_VAW2_WG32_8_1_WGM15
    SolutionIndex: 83
    SolutionNameMin: Cijk_Ailk_Bjlk_BBS_BH_MT64x64x16_MI32x32x8x1_SE_1LDSB0_AF0EM8_EPS1_GRVW2_GSU1_NLCA1_NLCB1_PGR1_SU32_SUS256_SRVW4_TT1_32_VAW2_WG64_4_1_WGM1
    SolutionIndex: 84
    SolutionNameMin: Cijk_Ailk_Bjlk_BBS_BH_MT64x64x16_MI32x32x8x1_SE_1LDSB0_AF0EM8_EPS0_GRVW8_GSU1_NLCA1_NLCB1_PGR2_SU32_SUS256_SRVW4_TT1_32_VAW2_WG64_4_1_WGM1
    SolutionIndex: 85
    SolutionNameMin: Cijk_Ailk_Bjlk_BBS_BH_MT64x64x16_MI32x32x8x1_SE_1LDSB0_AF0EM8_EPS0_GRVW2_GSU1_NLCA1_NLCB1_PGR2_SU0_SUS0_SRVW4_TT1_32_VAW2_WG64_4_1_WGM1
    SolutionIndex: 86
    SolutionNameMin: Cijk_Ailk_Bjlk_BBS_BH_MT64x128x16_MI32x32x8x1_SE_1LDSB0_AF0EM8_EPS0_GRVW2_GSU1_NLCA1_NLCB1_PGR2_SU0_SUS0_SRVW4_TT1_64_VAW2_WG64_4_1_WGM2
    SolutionIndex: 87
    SolutionNameMin: Cijk_Ailk_Bjlk_BBS_BH_MT64x128x16_MI32x32x8x1_SE_1LDSB0_AF0EM8_EPS0_GRVW8_GSU1_NLCA1_NLCB1_PGR2_SU32_SUS256_SRVW4_TT1_64_VAW2_WG64_4_1_WGM1
    SolutionIndex: 88
    SolutionNameMin: Cijk_Ailk_Bjlk_BBS_BH_MT64x128x16_MI32x32x8x1_SE_1LDSB0_AF0EM8_EPS0_GRVW2_GSU1_NLCA1_NLCB1_PGR2_SU0_SUS0_SRVW4_TT1_64_VAW2_WG64_4_1_WGM1
    SolutionIndex: 89
    SolutionNameMin: Cijk_Ailk_Bjlk_BBS_BH_MT64x64x16_MI32x32x8x1_SE_1LDSB0_AF0EM1_EPS0_GRVW2_GSU1_NLCA1_NLCB1_PGR2_SU32_SUS128_SRVW4_TT1_32_VAW2_WG64_4_1_WGM2
    SolutionIndex: 90
    SolutionNameMin: Cijk_Ailk_Bjlk_BBS_BH_MT64x64x16_MI32x32x8x1_SE_1LDSB0_AF0EM1_EPS0_GRVW2_GSU1_NLCA1_NLCB1_PGR2_SU32_SUS128_SRVW4_TT1_32_VAW2_WG64_4_1_WGM15
    SolutionIndex: 91
    SolutionNameMin: Cijk_Ailk_Bjlk_BBS_BH_MT64x128x16_MI32x32x8x1_SE_1LDSB0_AF0EM1_EPS0_GRVW8_GSU1_NLCA1_NLCB1_PGR2_SU32_SUS128_SRVW4_TT1_64_VAW2_WG64_4_1_WGM2
    SolutionIndex: 92
    SolutionNameMin: Cijk_Ailk_Bjlk_BBS_BH_MT128x96x16_MI32x32x8x1_SE_1LDSB0_AF0EM1_EPS1_GRVW2_GSU1_NLCA1_NLCB3_PGR1_SU0_SUS0_SRVW4_TT1_96_VAW2_WG128_2_1_WGM15
    SolutionIndex: 93
    SolutionNameMin: Cijk_Ailk_Bjlk_BBS_BH_MT128x96x16_MI32x32x8x1_SE_1LDSB0_AF0EM1_EPS1_GRVW2_GSU1_NLCA1_NLCB3_PGR1_SU32_SUS256_SRVW4_TT1_96_VAW2_WG128_2_1_WGM15
    SolutionIndex: 94
    SolutionNameMin: Cijk_Ailk_Bjlk_BBS_BH_MT64x128x16_MI32x32x8x1_SE_1LDSB0_AF0EM1_EPS0_GRVW8_GSU1_NLCA1_NLCB1_PGR2_SU0_SUS0_SRVW4_TT1_64_VAW2_WG64_4_1_WGM1
    SolutionIndex: 95
    SolutionNameMin: Cijk_Ailk_Bjlk_BBS_BH_MT64x128x16_MI32x32x8x1_SE_1LDSB0_AF0EM1_EPS0_GRVW8_GSU1_NLCA1_NLCB1_PGR2_SU32_SUS128_SRVW4_TT1_64_VAW2_WG64_4_1_WGM1
    SolutionIndex: 96
    SolutionNameMin: Cijk_Ailk_Bjlk_BBS_BH_MT64x128x16_MI32x32x8x1_SE_1LDSB0_AF0EM8_EPS0_GRVW4_GSU1_NLCA1_NLCB1_PGR2_SU32_SUS128_SRVW4_TT1_64_VAW2_WG64_4_1_WGM1
    SolutionIndex: 97
    SolutionNameMin: Cijk_Ailk_Bjlk_BBS_BH_MT64x128x16_MI32x32x8x1_SE_1LDSB0_AF0EM8_EPS0_GRVW2_GSU1_NLCA1_NLCB1_PGR2_SU32_SUS128_SRVW4_TT1_64_VAW2_WG64_4_1_WGM1
    SolutionIndex: 98
    SolutionNameMin: Cijk_Ailk_Bjlk_BBS_BH_MT64x64x16_MI32x32x8x1_SE_1LDSB0_AF0EM1_EPS1_GRVW2_GSU1_NLCA1_NLCB1_PGR1_SU0_SUS0_SRVW4_TT1_32_VAW2_WG64_4_1_WGM2
    SolutionIndex: 99
    SolutionNameMin: Cijk_Ailk_Bjlk_BBS_BH_MT64x64x16_MI32x32x8x1_SE_1LDSB0_AF0EM1_EPS0_GRVW4_GSU1_NLCA1_NLCB1_PGR2_SU0_SUS0_SRVW4_TT1_32_VAW2_WG64_4_1_WGM1
    SolutionIndex: 100
    SolutionNameMin: Cijk_Ailk_Bjlk_BBS_BH_MT128x64x16_MI32x32x8x1_SE_1LDSB0_AF0EM8_EPS0_GRVW8_GSU1_NLCA1_NLCB1_PGR2_SU0_SUS0_SRVW4_TT2_32_VAW2_WG64_4_1_WGM15
    SolutionIndex: 101
    SolutionNameMin: Cijk_Ailk_Bjlk_BBS_BH_MT128x128x16_MI32x32x8x1_SE_1LDSB0_AF0EM1_EPS0_GRVW8_GSU1_NLCA1_NLCB1_PGR2_SU0_SUS0_SRVW4_TT2_64_VAW2_WG64_4_1_WGM15
    SolutionIndex: 102
    SolutionNameMin: Cijk_Ailk_Bjlk_BBS_BH_MT64x128x16_MI32x32x8x1_SE_1LDSB0_AF0EM1_EPS0_GRVW4_GSU1_NLCA1_NLCB1_PGR2_SU0_SUS0_SRVW4_TT1_64_VAW2_WG64_4_1_WGM15
    SolutionIndex: 103
    SolutionNameMin: Cijk_Ailk_Bjlk_BBS_BH_MT96x128x32_MI32x32x8x1_SE_1LDSB0_AF0EM1_EPS0_GRVW4_GSU1_NLCA3_NLCB1_PGR2_SU0_SUS0_SRVW0_TT3_32_VAW2_WG32_8_1_WGM1
    SolutionIndex: 104
    SolutionNameMin: Cijk_Ailk_Bjlk_BBS_BH_MT128x128x16_MI32x32x8x1_SE_1LDSB0_AF0EM8_EPS0_GRVW8_GSU1_NLCA1_NLCB1_PGR2_SU0_SUS0_SRVW4_TT2_64_VAW2_WG64_4_1_WGM1
    SolutionIndex: 105
    SolutionNameMin: Cijk_Ailk_Bjlk_BBS_BH_MT128x128x16_MI32x32x8x1_SE_1LDSB0_AF0EM8_EPS0_GRVW8_GSU1_NLCA1_NLCB1_PGR2_SU0_SUS0_SRVW4_TT2_64_VAW2_WG64_4_1_WGM15
    SolutionIndex: 106
    SolutionNameMin: Cijk_Ailk_Bjlk_BBS_BH_MT128x128x16_MI32x32x8x1_SE_1LDSB0_AF0EM1_EPS0_GRVW8_GSU1_NLCA1_NLCB1_PGR2_SU0_SUS0_SRVW4_TT2_64_VAW2_WG64_4_1_WGM2
    SolutionIndex: 107
    SolutionNameMin: Cijk_Ailk_Bjlk_BBS_BH_MT16x16x32_MI16x16x16x1_SE_1LDSB0_AF0EM8_EPS0_GRVW2_GSU5_NLCA1_NLCB1_PGR2_SU0_SUS0_SRVW0_TT1_16_VAW1_WG16_4_1_WGM1
    SolutionIndex: 108
    SolutionNameMin: Cijk_Ailk_Bjlk_BBS_BH_MT64x64x32_MI32x32x8x1_SE_1LDSB0_AF0EM8_EPS0_GRVW8_GSU1_NLCA1_NLCB1_PGR2_SU32_SUS128_SRVW4_TT1_32_VAW2_WG64_4_1_WGM2
    SolutionIndex: 109
    SolutionNameMin: Cijk_Ailk_Bjlk_BBS_BH_MT64x16x32_MI16x16x16x1_SE_1LDSB0_AF0EM8_EPS0_GRVW8_GSU15_NLCA1_NLCB1_PGR2_SU32_SUS128_SRVW0_TT1_16_VAW1_WG64_4_1_WGM2
    SolutionIndex: 110
    SolutionNameMin: Cijk_Ailk_Bjlk_BBS_BH_MT128x256x16_MI32x32x8x1_SE_1LDSB0_AF0EM8_EPS0_GRVW8_GSU1_NLCA1_NLCB1_PGR2_SU0_SUS0_SRVW4_TT2_128_VAW2_WG64_4_1_WGM2
    SolutionIndex: 111
    SolutionNameMin: Cijk_Ailk_Bjlk_BBS_BH_MT128x128x32_MI32x32x8x1_SE_1LDSB0_AF0EM1_EPS0_GRVW8_GSU1_NLCA1_NLCB1_PGR2_SU0_SUS0_SRVW4_TT2_64_VAW2_WG64_4_1_WGM15
    SolutionIndex: 112
    SolutionNameMin: Cijk_Ailk_Bjlk_BBS_BH_MT32x64x64_MI16x16x16x1_SE_1LDSB0_AF0EM8_EPS0_GRVW8_GSU1_NLCA1_NLCB1_PGR2_SU0_SUS0_SRVW4_TT1_32_VAW2_WG32_8_1_WGM1
    SolutionIndex: 113
    SolutionNameMin: Cijk_Ailk_Bjlk_BBS_BH_MT128x128x32_MI32x32x8x1_SE_1LDSB0_AF0EM1_EPS0_GRVW8_GSU1_NLCA1_NLCB1_PGR2_SU0_SUS0_SRVW4_TT2_64_VAW2_WG64_4_1_WGM2
    SolutionIndex: 114
    SolutionNameMin: Cijk_Ailk_Bjlk_BBS_BH_MT128x96x32_MI32x32x8x1_SE_1LDSB0_AF0EM8_EPS0_GRVW4_GSU1_NLCA1_NLCB3_PGR2_SU0_SUS0_SRVW4_TT1_96_VAW2_WG128_2_1_WGM15
    SolutionIndex: 115
    SolutionNameMin: Cijk_Ailk_Bjlk_BBS_BH_MT64x64x32_MI32x32x8x1_SE_1LDSB0_AF0EM8_EPS0_GRVW8_GSU1_NLCA1_NLCB1_PGR2_SU32_SUS128_SRVW4_TT1_32_VAW2_WG64_4_1_WGM1
    SolutionIndex: 116
    SolutionNameMin: Cijk_Ailk_Bjlk_BBS_BH_MT128x96x16_MI32x32x8x1_SE_1LDSB0_AF0EM8_EPS0_GRVW2_GSU1_NLCA1_NLCB3_PGR2_SU0_SUS0_SRVW4_TT1_96_VAW2_WG128_2_1_WGM15
    SolutionIndex: 117
    SolutionNameMin: Cijk_Ailk_Bjlk_BBS_BH_MT128x64x64_MI32x32x8x1_SE_1LDSB0_AF0EM1_EPS0_GRVW8_GSU1_NLCA1_NLCB1_PGR2_SU32_SUS256_SRVW4_TT2_32_VAW2_WG64_4_1_WGM15
    SolutionIndex: 118
    SolutionNameMin: Cijk_Ailk_Bjlk_BBS_BH_MT128x64x16_MI32x32x8x1_SE_1LDSB0_AF0EM8_EPS0_GRVW4_GSU1_NLCA1_NLCB1_PGR2_SU0_SUS0_SRVW4_TT2_32_VAW2_WG64_4_1_WGM15
    SolutionIndex: 119
    SolutionNameMin: Cijk_Ailk_Bjlk_BBS_BH_MT128x96x16_MI32x32x8x1_SE_1LDSB0_AF0EM1_EPS0_GRVW2_GSU1_NLCA1_NLCB3_PGR2_SU0_SUS0_SRVW4_TT1_96_VAW2_WG128_2_1_WGM1
    SolutionIndex: 120
    SolutionNameMin: Cijk_Ailk_Bjlk_BBS_BH_MT256x128x32_MI32x32x8x1_SE_1LDSB0_AF0EM8_EPS1_GRVW8_GSU1_NLCA1_NLCB1_PGR1_SU0_SUS0_SRVW4_TT4_64_VAW2_WG64_4_1_WGM15
    SolutionIndex: 121
    SolutionNameMin: Cijk_Ailk_Bjlk_BBS_BH_MT96x128x32_MI32x32x8x1_SE_1LDSB0_AF0EM8_EPS0_GRVW4_GSU1_NLCA3_NLCB1_PGR2_SU0_SUS0_SRVW0_TT3_32_VAW2_WG32_8_1_WGM1
    SolutionIndex: 122
    SolutionNameMin: Cijk_Ailk_Bjlk_BBS_BH_MT128x256x16_MI32x32x8x1_SE_1LDSB1_AF0EM1_EPS0_GRVW8_GSU1_NLCA1_NLCB1_PGR2_SU0_SUS0_SRVW4_TT2_128_VAW2_WG64_4_1_WGM1
    SolutionIndex: 123
    SolutionNameMin: Cijk_Ailk_Bjlk_BBS_BH_MT64x128x32_MI32x32x8x1_SE_1LDSB0_AF0EM8_EPS0_GRVW4_GSU1_NLCA1_NLCB1_PGR2_SU32_SUS256_SRVW4_TT1_64_VAW2_WG64_4_1_WGM15
    SolutionIndex: 124
    SolutionNameMin: Cijk_Ailk_Bjlk_BBS_BH_MT128x256x16_MI32x32x8x1_SE_1LDSB0_AF0EM1_EPS0_GRVW8_GSU1_NLCA1_NLCB1_PGR2_SU0_SUS0_SRVW4_TT2_128_VAW2_WG64_4_1_WGM1
    SolutionIndex: 125
    SolutionNameMin: Cijk_Ailk_Bjlk_BBS_BH_MT128x256x16_MI32x32x8x1_SE_1LDSB0_AF0EM1_EPS0_GRVW8_GSU1_NLCA1_NLCB1_PGR2_SU0_SUS0_SRVW4_TT2_128_VAW2_WG64_4_1_WGM15
    SolutionIndex: 126
    SolutionNameMin: Cijk_Ailk_Bjlk_BBS_BH_MT128x64x16_MI32x32x8x1_SE_1LDSB0_AF0EM8_EPS0_GRVW8_GSU1_NLCA1_NLCB1_PGR2_SU32_SUS128_SRVW4_TT2_32_VAW2_WG64_4_1_WGM1
    SolutionIndex: 127
    SolutionNameMin: Cijk_Ailk_Bjlk_BBS_BH_MT96x128x32_MI32x32x8x1_SE_1LDSB0_AF0EM8_EPS0_GRVW4_GSU1_NLCA3_NLCB1_PGR2_SU32_SUS256_SRVW0_TT3_32_VAW2_WG32_8_1_WGM2
    SolutionIndex: 128
    SolutionNameMin: Cijk_Ailk_Bjlk_BBS_BH_MT128x64x16_MI32x32x8x1_SE_1LDSB0_AF0EM8_EPS0_GRVW4_GSU1_NLCA1_NLCB1_PGR2_SU0_SUS0_SRVW4_TT2_32_VAW2_WG64_4_1_WGM2
    SolutionIndex: 129
    SolutionNameMin: Cijk_Ailk_Bjlk_BBS_BH_MT64x128x64_MI32x32x8x1_SE_1LDSB0_AF0EM8_EPS0_GRVW8_GSU1_NLCA1_NLCB1_PGR2_SU0_SUS0_SRVW4_TT1_64_VAW2_WG64_4_1_WGM15
    SolutionIndex: 130
    SolutionNameMin: Cijk_Ailk_Bjlk_BBS_BH_MT128x128x32_MI32x32x8x1_SE_1LDSB0_AF0EM8_EPS0_GRVW8_GSU3_NLCA1_NLCB1_PGR2_SU0_SUS0_SRVW4_TT2_64_VAW1_WG64_4_1_WGM1
    SolutionIndex: 131
    SolutionNameMin: Cijk_Ailk_Bjlk_BBS_BH_MT128x128x32_MI32x32x8x1_SE_1LDSB0_AF0EM8_EPS0_GRVW8_GSU3_NLCA1_NLCB1_PGR2_SU0_SUS0_SRVW4_TT2_64_VAW1_WG64_4_1_WGM15
    SolutionIndex: 132
    SolutionNameMin: Cijk_Ailk_Bjlk_BBS_BH_MT64x64x64_MI32x32x8x1_SE_1LDSB0_AF0EM8_EPS1_GRVW8_GSU5_NLCA1_NLCB1_PGR1_SU0_SUS0_SRVW0_TT1_32_VAW1_WG64_4_1_WGM2
    SolutionIndex: 133
    SolutionNameMin: Cijk_Ailk_Bjlk_BBS_BH_MT64x64x64_MI32x32x8x1_SE_1LDSB0_AF0EM8_EPS1_GRVW8_GSU5_NLCA1_NLCB1_PGR1_SU0_SUS0_SRVW0_TT1_32_VAW1_WG64_4_1_WGM1
    SolutionIndex: 134
    SolutionNameMin: Cijk_Ailk_Bjlk_BBS_BH_MT128x256x16_MI32x32x8x1_SE_1LDSB0_AF0EM8_EPS0_GRVW8_GSU15_NLCA1_NLCB1_PGR2_SU0_SUS0_SRVW4_TT2_128_VAW1_WG64_4_1_WGM2
    SolutionIndex: 135
    SolutionNameMin: Cijk_Ailk_Bjlk_BBS_BH_MT64x64x16_MI32x32x8x1_SE_1LDSB0_AF0EM8_EPS0_GRVW8_GSU1_NLCA1_NLCB1_PGR2_SU0_SUS0_SRVW4_TT1_32_VAW2_WG64_4_1_WGM1
    SolutionIndex: 136
    SolutionNameMin: Cijk_Ailk_Bjlk_BBS_BH_MT64x128x16_MI32x32x8x1_SE_1LDSB0_AF0EM8_EPS1_GRVW2_GSU1_NLCA1_NLCB1_PGR1_SU32_SUS128_SRVW4_TT1_64_VAW2_WG64_4_1_WGM15
    SolutionIndex: 137
    SolutionNameMin: Cijk_Ailk_Bjlk_BBS_BH_MT128x64x16_MI32x32x8x1_SE_1LDSB0_AF0EM8_EPS0_GRVW8_GSU1_NLCA1_NLCB1_PGR2_SU32_SUS256_SRVW4_TT2_32_VAW2_WG64_4_1_WGM1
    SolutionIndex: 138
    SolutionNameMin: Cijk_Ailk_Bjlk_BBS_BH_MT128x64x16_MI32x32x8x1_SE_1LDSB0_AF0EM8_EPS0_GRVW2_GSU1_NLCA1_NLCB1_PGR2_SU0_SUS0_SRVW4_TT2_32_VAW2_WG64_4_1_WGM1
    SolutionIndex: 139
    SolutionNameMin: Cijk_Ailk_Bjlk_BBS_BH_MT32x32x64_MI16x16x16x1_SE_1LDSB0_AF0EM1_EPS0_GRVW8_GSU7_NLCA1_NLCB1_PGR2_SU32_SUS256_SRVW4_TT1_16_VAW1_WG32_8_1_WGM1
    SolutionIndex: 140
    SolutionNameMin: Cijk_Ailk_Bjlk_BBS_BH_MT16x16x32_MI16x16x16x1_SE_1LDSB0_AF0EM1_EPS0_GRVW4_GSU1_NLCA1_NLCB1_PGR2_SU32_SUS128_SRVW0_TT1_16_VAW2_WG16_4_1_WGM1
    SolutionIndex: 141
    SolutionNameMin: Cijk_Ailk_Bjlk_BBS_BH_MT128x160x32_MI32x32x8x1_SE_1LDSB0_AF0EM8_EPS0_GRVW4_GSU1_NLCA1_NLCB5_PGR2_SU0_SUS0_SRVW4_TT1_160_VAW2_WG128_2_1_WGM2
    SolutionIndex: 142
    SolutionNameMin: Cijk_Ailk_Bjlk_BBS_BH_MT64x32x16_MI16x16x16x1_SE_1LDSB0_AF0EM8_EPS1_GRVW2_GSU1_NLCA1_NLCB1_PGR1_SU32_SUS128_SRVW4_TT2_16_VAW2_WG32_8_1_WGM1
    SolutionIndex: 143
    SolutionNameMin: Cijk_Ailk_Bjlk_BBS_BH_MT64x64x16_MI32x32x8x1_SE_1LDSB0_AF0EM8_EPS0_GRVW2_GSU1_NLCA1_NLCB1_PGR2_SU0_SUS0_SRVW4_TT1_32_VAW2_WG64_4_1_WGM2
    SolutionIndex: 144
    SolutionNameMin: Cijk_Ailk_Bjlk_BBS_BH_MT128x128x16_MI32x32x8x1_SE_1LDSB0_AF0EM8_EPS0_GRVW8_GSU1_NLCA1_NLCB1_PGR2_SU32_SUS256_SRVW4_TT2_64_VAW2_WG64_4_1_WGM1
    SolutionIndex: 145
    SolutionNameMin: Cijk_Ailk_Bjlk_BBS_BH_MT128x128x16_MI32x32x8x1_SE_1LDSB0_AF0EM1_EPS0_GRVW8_GSU1_NLCA1_NLCB1_PGR2_SU0_SUS0_SRVW4_TT2_64_VAW2_WG64_4_1_WGM1
    SolutionIndex: 146
    SolutionNameMin: Cijk_Ailk_Bjlk_BBS_BH_MT32x32x32_MI16x16x16x1_SE_1LDSB0_AF0EM1_EPS0_GRVW2_GSU1_NLCA1_NLCB1_PGR2_SU0_SUS0_SRVW4_TT1_16_VAW2_WG32_8_1_WGM1
    SolutionIndex: 147
    SolutionNameMin: Cijk_Ailk_Bjlk_BBS_BH_MT128x64x64_MI32x32x8x1_SE_1LDSB0_AF0EM8_EPS0_GRVW8_GSU1_NLCA1_NLCB1_PGR2_SU0_SUS0_SRVW4_TT2_32_VAW2_WG64_4_1_WGM2
    SolutionIndex: 148
    SolutionNameMin: Cijk_Ailk_Bjlk_BBS_BH_MT64x128x32_MI32x32x8x1_SE_1LDSB0_AF0EM1_EPS0_GRVW4_GSU1_NLCA1_NLCB1_PGR2_SU0_SUS0_SRVW4_TT1_64_VAW2_WG64_4_1_WGM15
    SolutionIndex: 149
    SolutionNameMin: Cijk_Ailk_Bjlk_BBS_BH_MT64x64x64_MI32x32x8x1_SE_1LDSB0_AF0EM8_EPS1_GRVW8_GSU7_NLCA1_NLCB1_PGR1_SU0_SUS0_SRVW0_TT1_32_VAW1_WG64_4_1_WGM1
    SolutionIndex: 150
    SolutionNameMin: Cijk_Ailk_Bjlk_BBS_BH_MT32x32x64_MI16x16x16x1_SE_1LDSB0_AF0EM8_EPS0_GRVW4_GSU1_NLCA1_NLCB1_PGR2_SU0_SUS0_SRVW4_TT1_16_VAW2_WG32_8_1_WGM2
    SolutionIndex: 151
    SolutionNameMin: Cijk_Ailk_Bjlk_BBS_BH_MT128x192x16_MI32x32x8x1_SE_1LDSB0_AF0EM8_EPS0_GRVW4_GSU1_NLCA1_NLCB3_PGR2_SU0_SUS0_SRVW4_TT2_96_VAW2_WG64_4_1_WGM15
    SolutionIndex: 152
    SolutionNameMin: Cijk_Ailk_Bjlk_BBS_BH_MT128x128x16_MI32x32x8x1_SE_1LDSB0_AF0EM8_EPS0_GRVW4_GSU1_NLCA1_NLCB1_PGR2_SU0_SUS0_SRVW4_TT2_64_VAW2_WG64_4_1_WGM1
    SolutionIndex: 153
    SolutionNameMin: Cijk_Ailk_Bjlk_BBS_BH_MT64x192x16_MI32x32x8x1_SE_1LDSB0_AF0EM8_EPS0_GRVW4_GSU1_NLCA1_NLCB3_PGR2_SU0_SUS0_SRVW4_TT1_96_VAW2_WG64_4_1_WGM15
    SolutionIndex: 154
    SolutionNameMin: Cijk_Ailk_Bjlk_BBS_BH_MT128x128x32_MI32x32x8x1_SE_1LDSB0_AF0EM8_EPS1_GRVW8_GSU1_NLCA1_NLCB1_PGR1_SU0_SUS0_SRVW4_TT2_64_VAW2_WG64_4_1_WGM1
    SolutionIndex: 155
    SolutionNameMin: Cijk_Ailk_Bjlk_BBS_BH_MT32x32x16_MI16x16x16x1_SE_1LDSB0_AF0EM8_EPS1_GRVW4_GSU1_NLCA1_NLCB1_PGR1_SU0_SUS0_SRVW4_TT1_16_VAW2_WG32_8_1_WGM15
    SolutionIndex: 156
    SolutionNameMin: Cijk_Ailk_Bjlk_BBS_BH_MT32x32x16_MI16x16x16x1_SE_1LDSB0_AF0EM8_EPS0_GRVW4_GSU1_NLCA1_NLCB1_PGR2_SU0_SUS0_SRVW4_TT1_16_VAW2_WG32_8_1_WGM1
    SolutionIndex: 157
    SolutionNameMin: Cijk_Ailk_Bjlk_BBS_BH_MT32x32x64_MI16x16x16x1_SE_1LDSB0_AF0EM8_EPS0_GRVW4_GSU1_NLCA1_NLCB1_PGR2_SU32_SUS128_SRVW4_TT1_16_VAW2_WG32_8_1_WGM1
    SolutionIndex: 158
    SolutionNameMin: Cijk_Ailk_Bjlk_BBS_BH_MT64x32x16_MI16x16x16x1_SE_1LDSB0_AF0EM8_EPS0_GRVW8_GSU1_NLCA1_NLCB1_PGR2_SU32_SUS128_SRVW4_TT2_16_VAW2_WG32_8_1_WGM2
    SolutionIndex: 159
    SolutionNameMin: Cijk_Ailk_Bjlk_BBS_BH_MT64x128x16_MI32x32x8x1_SE_1LDSB0_AF0EM8_EPS0_GRVW8_GSU1_NLCA1_NLCB1_PGR2_SU32_SUS128_SRVW4_TT1_64_VAW2_WG64_4_1_WGM2
    SolutionIndex: 160
    SolutionNameMin: Cijk_Ailk_Bjlk_BBS_BH_MT64x32x16_MI16x16x16x1_SE_1LDSB0_AF0EM8_EPS0_GRVW2_GSU1_NLCA1_NLCB1_PGR2_SU32_SUS128_SRVW4_TT2_16_VAW2_WG32_8_1_WGM1
    SolutionIndex: 161
    SolutionNameMin: Cijk_Ailk_Bjlk_BBS_BH_MT128x128x32_MI32x32x8x1_SE_1LDSB0_AF0EM1_EPS0_GRVW8_GSU1_NLCA1_NLCB1_PGR2_SU0_SUS0_SRVW4_TT2_64_VAW2_WG64_4_1_WGM1
    SolutionIndex: 162
    SolutionNameMin: Cijk_Ailk_Bjlk_BBS_BH_MT64x64x32_MI32x32x8x1_SE_1LDSB0_AF0EM1_EPS0_GRVW4_GSU1_NLCA1_NLCB1_PGR2_SU0_SUS0_SRVW4_TT1_32_VAW2_WG64_4_1_WGM1
    SolutionIndex: 163
    SolutionNameMin: Cijk_Ailk_Bjlk_BBS_BH_MT32x32x16_MI16x16x16x1_SE_1LDSB0_AF0EM1_EPS0_GRVW4_GSU1_NLCA1_NLCB1_PGR2_SU0_SUS0_SRVW4_TT1_16_VAW2_WG32_8_1_WGM1
    SolutionIndex: 164
    SolutionNameMin: Cijk_Ailk_Bjlk_BBS_BH_MT32x32x16_MI16x16x16x1_SE_1LDSB0_AF0EM1_EPS1_GRVW2_GSU1_NLCA1_NLCB1_PGR1_SU0_SUS0_SRVW4_TT1_16_VAW2_WG32_8_1_WGM1
    SolutionIndex: 165
    SolutionNameMin: Cijk_Ailk_Bjlk_BBS_BH_MT64x128x32_MI32x32x8x1_SE_1LDSB0_AF0EM1_EPS0_GRVW4_GSU1_NLCA1_NLCB1_PGR2_SU0_SUS0_SRVW4_TT1_64_VAW2_WG64_4_1_WGM2
    SolutionIndex: 166
    SolutionNameMin: Cijk_Ailk_Bjlk_BBS_BH_MT128x128x16_MI32x32x8x1_SE_1LDSB0_AF0EM1_EPS0_GRVW8_GSU1_NLCA1_NLCB1_PGR2_SU32_SUS128_SRVW4_TT2_64_VAW2_WG64_4_1_WGM1
    SolutionIndex: 167
    SolutionNameMin: Cijk_Ailk_Bjlk_BBS_BH_MT16x16x16_MI16x16x16x1_SE_1LDSB0_AF0EM1_EPS1_GRVW2_GSU1_NLCA1_NLCB1_PGR1_SU32_SUS128_SRVW0_TT1_16_VAW2_WG16_4_1_WGM15
    SolutionIndex: 168
    SolutionNameMin: Cijk_Ailk_Bjlk_BBS_BH_MT128x128x32_MI32x32x8x1_SE_1LDSB0_EPS1_GRVW8_NLCA1_NLCB1_PGR1_SU16_SUS128_SRVW4_TT2_64_WG64_4_1_WGM15
    SolutionIndex: 169
    SolutionNameMin: Cijk_Ailk_Bjlk_BBS_BH_MT128x256x32_MI32x32x8x1_SE_1LDSB1_EPS1_GRVW8_NLCA1_NLCB1_PGR1_SU16_SUS128_SRVW4_TT2_128_WG64_4_1_WGM1
    SolutionIndex: 170
    SolutionNameMin: Cijk_Ailk_Bjlk_BBS_BH_MT128x256x32_MI32x32x8x1_SE_1LDSB1_EPS1_GRVW8_NLCA1_NLCB1_PGR1_SU0_SUS0_SRVW4_TT2_128_WG64_4_1_WGM2
    SolutionIndex: 171
    SolutionNameMin: Cijk_Ailk_Bjlk_BBS_BH_MT128x256x32_MI32x32x8x1_SE_1LDSB1_EPS1_GRVW8_NLCA1_NLCB1_PGR1_SU0_SUS0_SRVW4_TT2_128_WG64_4_1_WGM1
    SolutionIndex: 172
    SolutionNameMin: Cijk_Ailk_Bjlk_BBS_BH_MT128x256x32_MI32x32x8x1_SE_1LDSB1_EPS1_GRVW8_NLCA1_NLCB1_PGR1_SU0_SUS0_SRVW4_TT2_128_WG64_4_1_WGM2
    SolutionIndex: 173
    SolutionNameMin: Cijk_Ailk_Bjlk_BBS_BH_MT128x256x32_MI32x32x8x1_SE_1LDSB1_EPS1_GRVW8_NLCA1_NLCB1_PGR1_SU0_SUS0_SRVW4_TT2_128_WG64_4_1_WGM15
    SolutionIndex: 174
    SolutionNameMin: Cijk_Ailk_Bjlk_BBS_BH_MT256x192x32_MI32x32x8x1_SE_1LDSB1_EPS1_GRVW8_NLCA1_NLCB3_PGR1_SU0_SUS0_SRVW4_TT4_96_WG64_4_1_WGM2
    SolutionIndex: 175
    SolutionNameMin: Cijk_Ailk_Bjlk_BBS_BH_MT256x192x32_MI32x32x8x1_SE_1LDSB0_EPS1_GRVW8_NLCA1_NLCB3_PGR1_SU0_SUS0_SRVW4_TT4_96_WG64_4_1_WGM2
    SolutionIndex: 176
    SolutionNameMin: Cijk_Ailk_Bjlk_BBS_BH_MT256x192x32_MI32x32x8x1_SE_1LDSB1_AF0EM8_AF1EM1_EPS1_GRVW8_GSU1_GSUAMB_IU1_LRVW4_NLCA1_NLCB3_PGR1_PLR1_SU0_SUM0_SUS0_SCIUI1_SRVW4_TT4_96_VAW1_WSGRA1_WSGRB1_WG64_4_1_WGM15
- - - [34, 64, 1, 34]
    - [8, 0.007]
  - - [32, 64, 1, 35]
    - [9, 0.007]
  - - [64, 21, 1, 17]
    - [10, 0.001]
  - - [64, 32, 1, 35]
    - [10, 0.003]
  - - [21, 64, 1, 21]
    - [11, 0.003]
  - - [64, 30, 1, 31]
    - [12, 0.006]
  - - [15, 64, 1, 15]
    - [0, 0.001]
  - - [64, 24, 1, 24]
    - [13, 0.004]
  - - [17, 64, 1, 15]
    - [14, 0.002]
  - - [64, 35, 1, 35]
    - [11, 0.004]
  - - [32, 64, 1, 32]
    - [11, 0.003]
  - - [64, 34, 1, 24]
    - [10, 0.006]
  - - [64, 15, 1, 15]
    - [2, 0.001]
  - - [30, 64, 1, 30]
    - [14, 0.006]
  - - [30, 64, 1, 31]
    - [13, 0.006]
  - - [34, 64, 1, 24]
    - [14, 0.003]
  - - [64, 30, 1, 30]
    - [15, 0.007]
  - - [14, 64, 1, 14]
    - [8, 0.002]
  - - [64, 17, 1, 17]
    - [1, 0.001]
  - - [64, 17, 1, 15]
    - [9, 0.002]
  - - [64, 32, 1, 32]
    - [11, 0.008]
  - - [64, 31, 1, 31]
    - [16, 0.006]
  - - [17, 64, 1, 17]
    - [3, 0.002]
  - - [64, 21, 1, 21]
    - [16, 0.003]
  - - [35, 64, 1, 35]
    - [17, 0.008]
  - - [31, 64, 1, 31]
    - [14, 0.003]
  - - [21, 64, 1, 17]
    - [13, 0.002]
  - - [64, 15, 1, 15]
    - [10, 0.002]
  - - [64, 17, 1, 17]
    - [9, 0.001]
  - - [17, 64, 1, 17]
    - [11, 0.002]
  - - [64, 34, 1, 34]
    - [167, 0.004]
  - - [15, 64, 1, 14]
    - [8, 0.002]
  - - [24, 64, 1, 24]
    - [10, 0.002]
  - - [64, 14, 1, 14]
    - [18, 0.001]
  - - [15, 64, 1, 15]
    - [79, 0.001]
  - - [64, 15, 1, 14]
    - [10, 0.001]
  - - [64, 128, 512, 128]
    - [19, 16.044]
  - - [64, 512, 1, 512]
    - [60, 0.696]
  - - [64, 512, 64, 512]
    - [21, 29.011]
  - - [128, 64, 512, 128]
    - [22, 15.391]
  - - [512, 64, 1, 512]
    - [20, 1.227]
  - - [512, 64, 64, 512]
    - [23, 28.199]
  - - [1024, 2, 1, 4]
    - [18, 0.0]
  - - [1024, 2, 1, 32]
    - [13, 0.003]
  - - [1024, 2, 1, 2048]
    - [107, 0.145]
  - - [1024, 1024, 1, 4]
    - [25, 0.342]
  - - [1024, 1024, 1, 32]
    - [118, 1.382]
  - - [1024, 1024, 1, 2048]
    - [26, 35.373]
  - - [1024, 1024, 1, 4096]
    - [26, 43.166]
  - - [1024, 4096, 1, 2048]
    - [27, 56.169]
  - - [1024, 4096, 1, 4096]
    - [28, 63.483]
  - - [1024, 30528, 1, 2048]
    - [29, 73.851]
  - - [1024, 30528, 1, 4096]
    - [30, 77.929]
  - - [4096, 1024, 1, 2048]
    - [31, 56.464]
  - - [4096, 1024, 1, 4096]
    - [32, 63.65]
  - - [3, 64, 512, 3]
    - [15, 0.024]
  - - [5, 64, 512, 5]
    - [14, 0.062]
  - - [5, 64, 960, 5]
    - [15, 0.098]
  - - [9, 64, 512, 9]
    - [15, 0.202]
  - - [13, 512, 1, 32768]
    - [33, 3.389]
  - - [27, 128, 32768, 27]
    - [34, 3.725]
  - - [33, 32, 200, 33]
    - [14, 0.582]
  - - [33, 32, 1600, 33]
    - [14, 1.848]
  - - [67, 2048, 1, 512]
    - [35, 4.397]
  - - [74, 2048, 1, 512]
    - [35, 2.809]
  - - [74, 2048, 1, 960]
    - [35, 4.367]
  - - [100, 2048, 1, 512]
    - [35, 3.632]
  - - [256, 128, 1, 32768]
    - [37, 15.63]
  - - [256, 1280, 1, 8976]
    - [38, 30.626]
  - - [256, 2560, 1, 8976]
    - [39, 46.121]
  - - [256, 2816, 1, 8976]
    - [40, 50.958]
  - - [256, 3328, 1, 8976]
    - [40, 52.955]
  - - [256, 3584, 1, 8976]
    - [41, 46.416]
  - - [256, 3840, 1, 8976]
    - [42, 49.386]
  - - [256, 4096, 1, 8976]
    - [42, 51.879]
  - - [256, 4352, 1, 8976]
    - [42, 54.246]
  - - [256, 4864, 1, 8976]
    - [43, 56.266]
  - - [256, 5120, 1, 8976]
    - [39, 63.51]
  - - [256, 5632, 1, 8976]
    - [44, 59.271]
  - - [256, 5888, 1, 8976]
    - [44, 61.739]
  - - [256, 6144, 1, 8976]
    - [45, 63.778]
  - - [256, 7168, 1, 8976]
    - [46, 55.912]
  - - [256, 8192, 1, 8976]
    - [46, 63.101]
  - - [256, 8960, 1, 8976]
    - [47, 63.431]
  - - [256, 9728, 1, 8976]
    - [48, 67.884]
  - - [256, 9984, 1, 8976]
    - [47, 70.506]
  - - [256, 10240, 1, 8976]
    - [44, 69.194]
  - - [256, 10496, 1, 8976]
    - [44, 70.967]
  - - [256, 11008, 1, 8976]
    - [27, 62.511]
  - - [256, 11264, 1, 8976]
    - [31, 63.894]
  - - [256, 11520, 1, 8976]
    - [49, 65.132]
  - - [256, 11776, 1, 8976]
    - [49, 66.391]
  - - [256, 12544, 1, 8976]
    - [49, 70.11]
  - - [256, 12800, 1, 8976]
    - [50, 71.234]
  - - [256, 13312, 1, 8976]
    - [120, 89.029]
  - - [256, 13568, 1, 8976]
    - [51, 76.802]
  - - [256, 14336, 1, 8976]
    - [51, 80.103]
  - - [256, 14848, 1, 8976]
    - [51, 67.855]
  - - [256, 15104, 1, 8976]
    - [53, 78.241]
  - - [256, 15872, 1, 8976]
    - [28, 68.077]
  - - [256, 16128, 1, 8976]
    - [28, 68.787]
  - - [256, 17152, 1, 8976]
    - [161, 78.162]
  - - [256, 17408, 1, 8976]
    - [44, 80.031]
  - - [256, 18688, 1, 8976]
    - [50, 70.537]
  - - [256, 19968, 1, 8976]
    - [176, 90.45]
  - - [256, 20480, 1, 8976]
    - [44, 76.234]
  - - [256, 20992, 1, 8976]
    - [50, 77.938]
  - - [256, 21248, 1, 8976]
    - [54, 63.258]
  - - [256, 22016, 1, 8976]
    - [54, 65.522]
  - - [256, 26112, 1, 8976]
    - [55, 75.414]
  - - [256, 32512, 1, 8976]
    - [27, 74.178]
  - - [256, 32768, 1, 1]
    - [56, 0.218]
  - - [256, 33536, 1, 8976]
    - [27, 76.219]
  - - [256, 44505, 1, 8976]
    - [49, 72.219]
  - - [257, 4096, 1, 1024]
    - [57, 26.459]
  - - [480, 1024, 1, 32768]
    - [58, 47.728]
  - - [512, 32, 1, 200]
    - [59, 0.251]
  - - [512, 32, 1, 1600]
    - [60, 1.284]
  - - [512, 256, 1, 32768]
    - [134, 38.973]
  - - [512, 512, 1, 200]
    - [36, 3.669]
  - - [512, 512, 1, 1600]
    - [61, 14.63]
  - - [512, 2048, 1, 256]
    - [62, 15.047]
  - - [560, 1024, 1, 200]
    - [63, 6.695]
  - - [560, 1024, 1, 1600]
    - [64, 24.152]
  - - [768, 2048, 1, 256]
    - [65, 19.639]
  - - [1024, 64, 1, 512]
    - [20, 2.378]
  - - [1024, 64, 1, 960]
    - [20, 3.79]
  - - [1024, 256, 1, 1024]
    - [66, 11.677]
  - - [1024, 256, 1, 1280]
    - [64, 12.991]
  - - [1024, 256, 1, 2304]
    - [64, 16.719]
  - - [1024, 256, 1, 2816]
    - [64, 17.696]
  - - [1024, 256, 1, 3072]
    - [69, 19.229]
  - - [1024, 256, 1, 3328]
    - [68, 21.654]
  - - [1024, 256, 1, 3584]
    - [70, 21.573]
  - - [1024, 256, 1, 4096]
    - [64, 20.264]
  - - [1024, 256, 1, 4352]
    - [68, 24.92]
  - - [1024, 256, 1, 4608]
    - [68, 26.254]
  - - [1024, 256, 1, 5120]
    - [68, 21.633]
  - - [1024, 256, 1, 5376]
    - [68, 26.28]
  - - [1024, 256, 1, 5632]
    - [68, 22.693]
  - - [1024, 256, 1, 6144]
    - [68, 24.066]
  - - [1024, 256, 1, 6400]
    - [68, 24.327]
  - - [1024, 256, 1, 7680]
    - [68, 26.812]
  - - [1024, 256, 1, 7936]
    - [68, 35.5]
  - - [1024, 256, 1, 8192]
    - [68, 27.557]
  - - [1024, 256, 1, 8448]
    - [68, 36.836]
  - - [1024, 256, 1, 9728]
    - [68, 30.085]
  - - [1024, 256, 1, 9984]
    - [68, 30.12]
  - - [1024, 256, 1, 10496]
    - [68, 30.876]
  - - [1024, 256, 1, 11520]
    - [68, 31.888]
  - - [1024, 256, 1, 12032]
    - [68, 32.394]
  - - [1024, 256, 1, 13568]
    - [68, 34.309]
  - - [1024, 256, 1, 14336]
    - [68, 34.706]
  - - [1024, 256, 1, 14848]
    - [68, 34.998]
  - - [1024, 256, 1, 15104]
    - [68, 35.517]
  - - [1024, 256, 1, 15872]
    - [68, 36.227]
  - - [1024, 256, 1, 16128]
    - [68, 36.168]
  - - [1024, 256, 1, 17152]
    - [68, 36.497]
  - - [1024, 256, 1, 17408]
    - [68, 36.83]
  - - [1024, 256, 1, 18944]
    - [68, 37.5]
  - - [1024, 256, 1, 19712]
    - [68, 37.804]
  - - [1024, 256, 1, 19968]
    - [68, 38.073]
  - - [1024, 256, 1, 21248]
    - [68, 38.103]
  - - [1024, 256, 1, 21504]
    - [68, 38.609]
  - - [1024, 256, 1, 22016]
    - [68, 38.959]
  - - [1024, 256, 1, 28672]
    - [71, 41.552]
  - - [1024, 256, 1, 33536]
    - [71, 35.59]
  - - [1024, 512, 1, 32768]
    - [58, 51.287]
  - - [1024, 1024, 1, 200]
    - [62, 11.305]
  - - [1024, 1024, 1, 512]
    - [66, 21.995]
  - - [1024, 1024, 1, 960]
    - [61, 28.353]
  - - [1024, 1024, 1, 1600]
    - [26, 32.095]
  - - [1024, 1024, 1, 32768]
    - [41, 60.781]
  - - [1600, 1024, 1, 512]
    - [31, 24.18]
  - - [1600, 1024, 1, 960]
    - [50, 40.183]
  - - [2048, 256, 1, 1024]
    - [64, 19.512]
  - - [2048, 960, 1, 1]
    - [116, 0.073]
  - - [2048, 2048, 1, 512]
    - [73, 39.277]
  - - [2048, 2048, 1, 960]
    - [73, 48.416]
  - - [2048, 2048, 1, 1024]
    - [31, 49.027]
  - - [3200, 2048, 1, 1024]
    - [54, 58.657]
  - - [4096, 4096, 1, 1024]
    - [54, 64.606]
  - - [14, 64, 10880, 14]
    - [12, 1.484]
  - - [15, 64, 10880, 14]
    - [12, 1.554]
  - - [15, 64, 7680, 15]
    - [12, 1.583]
  - - [15, 64, 10880, 15]
    - [12, 1.653]
  - - [17, 64, 7680, 15]
    - [34, 1.376]
  - - [17, 64, 6144, 17]
    - [34, 1.447]
  - - [17, 64, 7680, 17]
    - [34, 1.499]
  - - [21, 64, 6144, 17]
    - [34, 1.779]
  - - [21, 64, 6144, 21]
    - [74, 2.159]
  - - [24, 64, 4736, 24]
    - [75, 3.544]
  - - [30, 64, 2048, 30]
    - [74, 2.896]
  - - [30, 64, 2048, 31]
    - [34, 2.999]
  - - [31, 64, 2048, 31]
    - [76, 2.708]
  - - [32, 64, 4608, 32]
    - [77, 7.044]
  - - [32, 64, 4608, 35]
    - [78, 6.071]
  - - [34, 64, 4736, 24]
    - [79, 2.301]
  - - [34, 64, 4736, 34]
    - [34, 3.141]
  - - [35, 64, 4608, 35]
    - [74, 3.243]
  - - [64, 14, 10880, 14]
    - [9, 1.855]
  - - [64, 15, 10880, 14]
    - [10, 1.947]
  - - [64, 15, 7680, 15]
    - [10, 1.968]
  - - [64, 15, 10880, 15]
    - [10, 2.084]
  - - [64, 17, 7680, 15]
    - [80, 1.978]
  - - [64, 17, 6144, 17]
    - [81, 2.029]
  - - [64, 17, 7680, 17]
    - [56, 2.098]
  - - [64, 21, 6144, 17]
    - [82, 2.479]
  - - [64, 21, 6144, 21]
    - [80, 3.02]
  - - [64, 24, 4736, 24]
    - [80, 3.704]
  - - [64, 30, 2048, 30]
    - [80, 4.372]
  - - [64, 30, 2048, 31]
    - [80, 4.518]
  - - [64, 31, 2048, 31]
    - [80, 4.52]
  - - [64, 32, 4608, 32]
    - [82, 7.578]
  - - [64, 32, 4608, 35]
    - [82, 6.438]
  - - [64, 34, 4736, 24]
    - [83, 3.87]
  - - [64, 34, 4736, 34]
    - [84, 5.048]
  - - [64, 35, 4608, 35]
    - [85, 5.218]
  - - [1024, 1024, 1, 3840]
    - [43, 46.286]
  - - [1024, 1024, 1, 3968]
    - [26, 43.567]
  - - [1024, 1024, 1, 6528]
    - [42, 48.904]
  - - [1024, 1024, 1, 7104]
    - [42, 49.31]
  - - [1024, 1024, 1, 7200]
    - [41, 50.421]
  - - [1024, 1024, 1, 8064]
    - [41, 51.246]
  - - [1024, 1024, 1, 8160]
    - [42, 51.579]
  - - [1024, 1024, 1, 9216]
    - [42, 53.74]
  - - [1024, 1024, 1, 9520]
    - [42, 53.89]
  - - [1024, 1024, 1, 10064]
    - [42, 66.525]
  - - [1024, 1024, 1, 10080]
    - [41, 67.229]
  - - [1024, 1024, 1, 10200]
    - [41, 64.47]
  - - [1024, 4096, 1, 3840]
    - [53, 62.508]
  - - [1024, 4096, 1, 3968]
    - [52, 63.284]
  - - [1024, 4096, 1, 6528]
    - [53, 68.4]
  - - [1024, 4096, 1, 7104]
    - [53, 68.777]
  - - [1024, 4096, 1, 7200]
    - [28, 69.168]
  - - [1024, 4096, 1, 8064]
    - [28, 70.101]
  - - [1024, 4096, 1, 8160]
    - [28, 70.225]
  - - [1024, 4096, 1, 9216]
    - [52, 87.529]
  - - [1024, 4096, 1, 9520]
    - [53, 70.128]
  - - [1024, 4096, 1, 10064]
    - [28, 70.792]
  - - [1024, 4096, 1, 10080]
    - [52, 71.619]
  - - [1024, 4096, 1, 10200]
    - [28, 70.967]
  - - [1024, 42720, 1, 3968]
    - [49, 76.964]
  - - [1024, 42720, 1, 6528]
    - [49, 78.492]
  - - [1024, 42720, 1, 7104]
    - [49, 78.695]
  - - [1024, 42720, 1, 7200]
    - [49, 78.716]
  - - [1024, 42720, 1, 9520]
    - [49, 78.891]
  - - [1024, 42720, 1, 10080]
    - [49, 79.278]
  - - [4096, 1024, 1, 3840]
    - [32, 63.293]
  - - [4096, 1024, 1, 3968]
    - [32, 63.113]
  - - [4096, 1024, 1, 6528]
    - [32, 68.552]
  - - [4096, 1024, 1, 7104]
    - [32, 68.721]
  - - [4096, 1024, 1, 7200]
    - [32, 68.541]
  - - [4096, 1024, 1, 8064]
    - [32, 69.869]
  - - [4096, 1024, 1, 8160]
    - [32, 69.704]
  - - [4096, 1024, 1, 9216]
    - [32, 69.748]
  - - [4096, 1024, 1, 9520]
    - [32, 69.532]
  - - [4096, 1024, 1, 10064]
    - [32, 69.6]
  - - [4096, 1024, 1, 10080]
    - [32, 70.862]
  - - [4096, 1024, 1, 10200]
    - [32, 69.735]
  - - [27, 64, 1920, 27]
    - [74, 2.608]
  - - [27, 64, 1920, 33]
    - [34, 3.046]
  - - [33, 64, 1920, 33]
    - [79, 2.599]
  - - [64, 27, 1920, 27]
    - [56, 3.433]
  - - [64, 27, 1920, 33]
    - [81, 4.018]
  - - [64, 33, 1920, 33]
    - [63, 3.926]
  - - [1024, 1024, 1, 3240]
    - [26, 39.502]
  - - [1024, 1024, 1, 3960]
    - [26, 41.291]
  - - [1024, 4096, 1, 3240]
    - [28, 58.729]
  - - [1024, 4096, 1, 3960]
    - [52, 61.455]
  - - [1024, 42720, 1, 3960]
    - [49, 76.299]
  - - [4096, 1024, 1, 3240]
    - [32, 58.978]
  - - [4096, 1024, 1, 3960]
    - [32, 61.923]
  - - [64, 1280, 64, 192]
    - [86, 26.132]
  - - [64, 1280, 64, 320]
    - [21, 34.875]
  - - [64, 1280, 64, 384]
    - [19, 37.679]
  - - [64, 1280, 64, 448]
    - [21, 40.34]
  - - [64, 2048, 64, 192]
    - [87, 28.667]
  - - [64, 2048, 64, 320]
    - [88, 36.526]
  - - [64, 2048, 64, 384]
    - [21, 39.277]
  - - [64, 2048, 64, 448]
    - [86, 41.228]
  - - [1225, 192, 64, 32]
    - [89, 7.82]
  - - [1225, 192, 64, 48]
    - [89, 11.06]
  - - [1225, 192, 64, 64]
    - [90, 13.705]
  - - [1225, 256, 64, 48]
    - [90, 11.51]
  - - [1225, 256, 64, 64]
    - [91, 14.692]
  - - [1225, 288, 64, 48]
    - [92, 10.508]
  - - [1225, 288, 64, 64]
    - [93, 13.466]
  - - [5329, 64, 64, 80]
    - [89, 15.263]
  - - [289, 768, 64, 128]
    - [94, 19.074]
  - - [289, 768, 64, 160]
    - [94, 22.462]
  - - [289, 768, 64, 192]
    - [95, 24.982]
  - - [64, 1280, 32, 192]
    - [96, 21.979]
  - - [64, 1280, 32, 320]
    - [88, 28.64]
  - - [64, 1280, 32, 384]
    - [95, 31.158]
  - - [64, 1280, 32, 448]
    - [21, 33.668]
  - - [64, 2048, 32, 192]
    - [86, 22.796]
  - - [64, 2048, 32, 320]
    - [95, 29.944]
  - - [64, 2048, 32, 384]
    - [87, 31.287]
  - - [64, 2048, 32, 448]
    - [97, 35.225]
  - - [1225, 192, 32, 32]
    - [98, 6.618]
  - - [1225, 192, 32, 48]
    - [99, 9.51]
  - - [1225, 192, 32, 64]
    - [90, 12.251]
  - - [1225, 256, 32, 48]
    - [89, 10.377]
  - - [1225, 256, 32, 64]
    - [99, 13.061]
  - - [1225, 288, 32, 48]
    - [25, 8.608]
  - - [1225, 288, 32, 64]
    - [92, 11.596]
  - - [5329, 64, 32, 80]
    - [90, 13.993]
  - - [289, 768, 32, 128]
    - [94, 16.93]
  - - [289, 768, 32, 160]
    - [91, 19.637]
  - - [289, 768, 32, 192]
    - [94, 22.267]
  - - [3136, 64, 64, 256]
    - [100, 29.902]
  - - [3136, 64, 64, 64]
    - [85, 14.271]
  - - [3136, 256, 64, 64]
    - [87, 18.854]
  - - [784, 128, 64, 512]
    - [19, 40.937]
  - - [784, 512, 64, 128]
    - [73, 30.194]
  - - [196, 256, 64, 1024]
    - [101, 34.432]
  - - [196, 1024, 64, 256]
    - [102, 28.764]
  - - [49, 512, 64, 2048]
    - [94, 29.71]
  - - [49, 2048, 64, 512]
    - [94, 26.294]
  - - [3136, 64, 32, 256]
    - [22, 27.043]
  - - [3136, 64, 32, 64]
    - [63, 12.219]
  - - [3136, 256, 32, 64]
    - [87, 17.795]
  - - [784, 128, 32, 512]
    - [19, 37.048]
  - - [784, 512, 32, 128]
    - [21, 26.501]
  - - [196, 256, 32, 1024]
    - [103, 29.497]
  - - [196, 1024, 32, 256]
    - [95, 25.087]
  - - [49, 512, 32, 2048]
    - [72, 22.238]
  - - [49, 2048, 32, 512]
    - [94, 23.448]
  - - [3136, 64, 64, 128]
    - [66, 21.99]
  - - [3136, 128, 64, 256]
    - [104, 39.987]
  - - [784, 256, 64, 512]
    - [105, 49.431]
  - - [3136, 256, 64, 128]
    - [104, 31.584]
  - - [3136, 256, 64, 256]
    - [105, 47.82]
  - - [196, 512, 64, 1024]
    - [94, 41.096]
  - - [784, 512, 64, 256]
    - [73, 44.449]
  - - [784, 512, 64, 512]
    - [104, 54.886]
  - - [196, 1024, 64, 512]
    - [94, 42.879]
  - - [196, 1024, 64, 1024]
    - [101, 46.354]
  - - [49, 1024, 64, 2048]
    - [94, 36.772]
  - - [49, 2048, 64, 1024]
    - [94, 34.304]
  - - [3136, 64, 32, 128]
    - [22, 19.097]
  - - [3136, 128, 32, 256]
    - [105, 36.573]
  - - [784, 256, 32, 512]
    - [21, 43.844]
  - - [3136, 256, 32, 128]
    - [104, 29.287]
  - - [3136, 256, 32, 256]
    - [73, 44.663]
  - - [196, 512, 32, 1024]
    - [106, 34.951]
  - - [784, 512, 32, 256]
    - [144, 41.688]
  - - [784, 512, 32, 512]
    - [104, 49.663]
  - - [196, 1024, 32, 512]
    - [106, 35.223]
  - - [196, 1024, 32, 1024]
    - [106, 42.756]
  - - [49, 1024, 32, 2048]
    - [94, 30.543]
  - - [49, 2048, 32, 1024]
    - [94, 31.238]
  - - [64, 128, 624, 128]
    - [96, 17.184]
  - - [1024, 1024, 1, 1024]
    - [66, 28.532]
  - - [1024, 1024, 1, 1280]
    - [61, 30.611]
  - - [1024, 1024, 1, 39]
    - [81, 3.011]
  - - [1024, 4096, 1, 2560]
    - [31, 57.993]
  - - [1024, 4096, 1, 1024]
    - [31, 48.977]
  - - [33, 32, 1, 33]
    - [8, 0.004]
  - - [1024, 2, 1, 4992]
    - [107, 0.282]
  - - [64, 128, 144, 128]
    - [63, 10.126]
  - - [512, 512, 1, 512]
    - [108, 7.835]
  - - [1024, 2, 1, 39]
    - [9, 0.008]
  - - [1024, 1024, 1, 8192]
    - [42, 51.506]
  - - [1024, 960, 1, 1024]
    - [57, 27.263]
  - - [1024, 1024, 1, 308]
    - [22, 15.036]
  - - [1024, 2, 1, 5]
    - [155, 0.001]
  - - [1024, 1024, 1, 4992]
    - [43, 44.985]
  - - [4096, 3840, 1, 4096]
    - [31, 76.252]
  - - [4096, 1024, 1, 3072]
    - [32, 60.211]
  - - [64, 512, 96, 512]
    - [97, 32.356]
  - - [1024, 1024, 1, 5248]
    - [43, 45.891]
  - - [4096, 1024, 1, 4992]
    - [32, 65.747]
  - - [1024, 1024, 1, 180]
    - [99, 10.527]
  - - [5, 64, 1, 5]
    - [8, 0.0]
  - - [4096, 1024, 1, 2560]
    - [31, 58.021]
  - - [1024, 33712, 1, 9600]
    - [50, 93.525]
  - - [64, 128, 640, 128]
    - [96, 17.262]
  - - [1024, 1024, 1, 5]
    - [80, 0.431]
  - - [4, 64, 32768, 4]
    - [15, 0.172]
  - - [1024, 2, 1, 40]
    - [9, 0.008]
  - - [1024, 30522, 1, 160]
    - [105, 33.879]
  - - [1024, 1024, 1, 800]
    - [62, 26.85]
  - - [1024, 1024, 1, 41]
    - [81, 3.105]
  - - [1024, 2, 1, 5248]
    - [109, 0.303]
  - - [4096, 4096, 1, 4096]
    - [110, 75.322]
  - - [1024, 30522, 1, 385]
    - [105, 51.217]
  - - [1024, 4096, 1, 9600]
    - [52, 71.408]
  - - [2048, 512, 1, 1]
    - [82, 0.082]
  - - [1024, 4096, 1, 1152]
    - [50, 55.701]
  - - [1024, 2, 1, 512]
    - [13, 0.072]
  - - [64, 4, 38400, 4]
    - [10, 0.19]
  - - [1024, 30522, 1, 180]
    - [105, 34.448]
  - - [4096, 1024, 1, 512]
    - [73, 39.213]
  - - [4096, 1024, 1, 1024]
    - [49, 49.176]
  - - [4, 64, 38400, 4]
    - [15, 0.173]
  - - [1024, 2, 1, 9]
    - [18, 0.001]
  - - [8192, 8192, 1, 8192]
    - [55, 81.541]
  - - [4096, 1024, 1, 1280]
    - [49, 51.876]
  - - [1024, 1024, 1, 3072]
    - [26, 40.102]
  - - [64, 128, 656, 128]
    - [88, 17.534]
  - - [1024, 4096, 1, 4992]
    - [53, 65.546]
  - - [1024, 1024, 1, 9]
    - [80, 0.738]
  - - [1024, 4096, 1, 512]
    - [73, 39.47]
  - - [64, 512, 16, 512]
    - [61, 13.207]
  - - [1024, 2, 1, 6]
    - [10, 0.001]
  - - [2048, 1920, 1, 2048]
    - [52, 65.103]
  - - [1024, 30522, 1, 780]
    - [105, 62.551]
  - - [64, 128, 128, 128]
    - [61, 8.948]
  - - [1024, 30522, 1, 800]
    - [105, 64.79]
  - - [960, 1024, 1, 1024]
    - [62, 27.797]
  - - [1024, 1024, 1, 6]
    - [82, 0.499]
  - - [8192, 7680, 1, 8192]
    - [27, 80.804]
  - - [1024, 2, 1, 1152]
    - [13, 0.119]
  - - [1024, 1024, 1, 2560]
    - [26, 38.283]
  - - [1024, 1024, 1, 77]
    - [25, 5.198]
  - - [1024, 1024, 1, 160]
    - [62, 10.273]
  - - [1024, 4096, 1, 8192]
    - [28, 70.487]
  - - [1024, 2, 1, 41]
    - [18, 0.004]
  - - [128, 64, 1, 128]
    - [9, 0.098]
  - - [480, 512, 1, 512]
    - [112, 6.949]
  - - [1024, 1024, 1, 462]
    - [62, 19.563]
  - - [1024, 1024, 1, 780]
    - [62, 24.442]
  - - [1024, 4096, 1, 5248]
    - [52, 65.956]
  - - [1024, 4096, 1, 1280]
    - [27, 51.698]
  - - [4096, 1024, 1, 9600]
    - [32, 69.739]
  - - [64, 512, 80, 512]
    - [86, 31.97]
  - - [4096, 1024, 1, 1152]
    - [113, 50.22]
  - - [1024, 1600, 1, 1]
    - [81, 0.105]
  - - [1024, 1024, 1, 820]
    - [62, 24.776]
  - - [1024, 2, 1, 2560]
    - [107, 0.173]
  - - [4096, 1024, 1, 5248]
    - [32, 66.611]
  - - [1024, 33712, 1, 8192]
    - [30, 79.495]
  - - [1024, 1024, 1, 385]
    - [66, 18.34]
  - - [1024, 1024, 1, 1]
    - [56, 0.082]
  - - [1024, 2, 1, 10]
    - [9, 0.002]
  - - [64, 4, 32768, 4]
    - [9, 0.189]
  - - [1024, 1024, 1, 10]
    - [82, 0.838]
  - - [1024, 2, 1, 5120]
    - [109, 0.295]
  - - [1920, 2048, 1, 2048]
    - [53, 61.22]
  - - [2048, 2048, 1, 2048]
    - [50, 56.169]
  - - [3840, 4096, 1, 4096]
    - [49, 76.092]
  - - [1024, 4096, 1, 5120]
    - [28, 65.89]
  - - [64, 128, 160, 128]
    - [115, 10.863]
  - - [1024, 30522, 1, 308]
    - [105, 46.829]
  - - [1024, 30522, 1, 820]
    - [105, 63.925]
  - - [1024, 30522, 1, 200]
    - [105, 36.623]
  - - [1024, 30522, 1, 462]
    - [105, 54.41]
  - - [1024, 2, 1, 1024]
    - [13, 0.113]
  - - [1024, 30522, 1, 77]
    - [116, 17.664]
  - - [1024, 1024, 1, 40]
    - [25, 3.029]
  - - [1024, 2, 1, 1]
    - [9, 0.0]
  - - [1024, 2, 1, 8]
    - [24, 0.002]
  - - [1024, 1024, 1, 8]
    - [25, 0.652]
  - - [1024, 1024, 1, 9600]
    - [41, 53.572]
  - - [4096, 1024, 1, 5120]
    - [32, 65.818]
  - - [1024, 4096, 1, 3072]
    - [28, 73.075]
  - - [1024, 1024, 1, 1152]
    - [62, 29.977]
  - - [512, 480, 1, 512]
    - [108, 6.915]
  - - [64, 128, 1, 128]
    - [8, 0.104]
  - - [1024, 1024, 1, 5120]
    - [43, 45.309]
  - - [1024, 2, 1, 3072]
    - [107, 0.197]
  - - [7680, 8192, 1, 8192]
    - [27, 80.829]
  - - [4096, 1024, 1, 8192]
    - [32, 78.649]
  - - [1024, 2, 1, 1280]
    - [13, 0.126]
  - - [479, 1024, 1, 32768]
    - [117, 32.96]
  - - [64, 1024, 32, 1024]
    - [21, 37.337]
  - - [2560, 1920, 1, 2048]
    - [31, 64.77]
  - - [1024, 3072, 1, 4096]
    - [31, 66.136]
  - - [2560, 2560, 1, 2048]
    - [54, 66.733]
  - - [2048, 2, 1, 2]
    - [9, 0.001]
  - - [1024, 64, 128, 1024]
    - [118, 47.792]
  - - [2048, 2048, 1, 2]
    - [56, 0.351]
  - - [1024, 64, 32, 1024]
    - [118, 36.995]
  - - [1024, 96, 64, 1024]
    - [119, 52.674]
  - - [1024, 30592, 1, 2048]
    - [30, 74.143]
  - - [1024, 3072, 1, 16384]
    - [120, 71.618]
  - - [6144, 1536, 1, 4096]
    - [30, 83.798]
  - - [1024, 1024, 1, 16]
    - [25, 1.421]
  - - [1536, 4608, 1, 8192]
    - [48, 83.895]
  - - [640, 2560, 1, 2048]
    - [50, 51.087]
  - - [1024, 4096, 1, 16384]
    - [28, 74.274]
  - - [64, 512, 40, 512]
    - [72, 24.469]
  - - [1024, 1024, 1, 16384]
    - [41, 76.209]
  - - [1536, 6144, 1, 4096]
    - [45, 83.804]
  - - [1024, 30592, 1, 4096]
    - [55, 78.075]
  - - [2560, 2560, 1, 4]
    - [82, 0.809]
  - - [1536, 1536, 1, 4096]
    - [47, 60.554]
  - - [2560, 7680, 1, 2048]
    - [31, 74.235]
  - - [64, 1024, 256, 1024]
    - [86, 52.856]
  - - [96, 1024, 64, 1024]
    - [121, 48.878]
  - - [1536, 50304, 1, 4096]
    - [110, 79.654]
  - - [2048, 8192, 1, 1024]
    - [122, 64.822]
  - - [1024, 30592, 1, 8192]
    - [55, 80.173]
  - - [512, 64, 256, 512]
    - [118, 37.366]
  - - [1024, 96, 128, 1024]
    - [119, 56.996]
  - - [64, 512, 128, 512]
    - [123, 33.604]
  - - [4096, 1024, 1, 16384]
    - [32, 73.207]
  - - [8192, 2048, 1, 1024]
    - [124, 64.909]
  - - [64, 1024, 64, 1024]
    - [87, 44.972]
  - - [1024, 50304, 1, 4096]
    - [49, 78.376]
  - - [1536, 4608, 1, 4096]
    - [151, 81.162]
  - - [512, 64, 128, 512]
    - [126, 33.886]
  - - [6144, 1536, 1, 8192]
    - [114, 72.937]
  - - [1024, 3072, 1, 8192]
    - [31, 69.277]
  - - [1536, 1536, 1, 8192]
    - [48, 66.55]
  - - [1536, 50304, 1, 8192]
    - [55, 81.186]
  - - [2560, 2, 1, 4]
    - [9, 0.002]
  - - [2048, 6144, 1, 1024]
    - [31, 66.408]
  - - [64, 1024, 128, 1024]
    - [21, 49.963]
  - - [1024, 64, 64, 1024]
    - [100, 46.105]
  - - [1024, 2, 1, 16]
    - [10, 0.004]
  - - [96, 1024, 128, 1024]
    - [127, 51.387]
  - - [2048, 30592, 1, 1024]
    - [73, 70.678]
  - - [64, 512, 256, 512]
    - [88, 39.631]
  - - [1536, 6144, 1, 8192]
    - [45, 87.158]
  - - [1024, 50304, 1, 2048]
    - [31, 75.131]
  - - [1024, 50304, 1, 8192]
    - [49, 80.129]
  - - [1024, 3072, 1, 2048]
    - [49, 60.588]
  - - [1024, 64, 256, 1024]
    - [100, 50.99]
  - - [1024, 50304, 1, 16384]
    - [50, 95.823]
  - - [512, 64, 40, 512]
    - [65, 24.548]
  - - [1024, 2, 1, 64]
    - [9, 0.014]
  - - [1024, 30528, 1, 8192]
    - [30, 79.988]
  - - [1024, 1024, 1, 64]
    - [81, 4.942]
  - - [64, 128, 1024, 128]
    - [96, 19.735]
  - - [128, 64, 1024, 128]
    - [128, 18.083]
  - - [1024, 1024, 1, 3456]
    - [26, 41.919]
  - - [1024, 1024, 1, 6912]
    - [42, 48.955]
  - - [1024, 1024, 1, 864]
    - [62, 27.512]
  - - [1024, 512, 1, 3456]
    - [131, 32.656]
  - - [1024, 512, 1, 4096]
    - [130, 31.422]
  - - [1024, 512, 1, 6912]
    - [131, 39.989]
  - - [1024, 512, 1, 864]
    - [62, 17.782]
  - - [256, 128, 1, 3456]
    - [139, 3.094]
  - - [256, 128, 1, 4096]
    - [37, 4.199]
  - - [256, 128, 1, 55296]
    - [37, 19.223]
  - - [256, 128, 1, 6912]
    - [37, 6.018]
  - - [256, 128, 1, 864]
    - [36, 1.636]
  - - [256, 3456, 1, 1]
    - [25, 0.073]
  - - [256, 4096, 1, 1]
    - [25, 0.085]
  - - [256, 6912, 1, 1]
    - [25, 0.117]
  - - [256, 864, 1, 1]
    - [18, 0.021]
  - - [480, 1024, 1, 3456]
    - [58, 26.11]
  - - [480, 1024, 1, 4096]
    - [130, 28.969]
  - - [480, 1024, 1, 6912]
    - [130, 37.234]
  - - [480, 1024, 1, 864]
    - [61, 16.788]
  - - [512, 256, 1, 3456]
    - [132, 10.437]
  - - [512, 256, 1, 4096]
    - [133, 11.814]
  - - [512, 256, 1, 55296]
    - [134, 31.262]
  - - [512, 256, 1, 6912]
    - [37, 17.04]
  - - [512, 256, 1, 864]
    - [59, 5.646]
  - - [30528, 1024, 1, 640]
    - [105, 61.153]
  - - [30528, 1024, 1, 1280]
    - [27, 69.797]
  - - [4096, 1024, 1, 10240]
    - [32, 71.498]
  - - [1024, 4096, 1, 10240]
    - [53, 88.67]
  - - [30528, 1024, 1, 1600]
    - [27, 71.722]
  - - [1024, 2, 1, 80]
    - [9, 0.017]
  - - [1024, 1024, 1, 10240]
    - [42, 68.576]
  - - [1024, 1024, 1, 80]
    - [135, 5.87]
  - - [64, 128, 1280, 128]
    - [136, 20.829]
  - - [128, 64, 1280, 128]
    - [137, 19.437]
  - - [1024, 4096, 1, 10496]
    - [28, 72.334]
  - - [30528, 1024, 1, 1640]
    - [55, 71.143]
  - - [4096, 1024, 1, 10496]
    - [32, 70.544]
  - - [1024, 1024, 1, 10496]
    - [58, 68.008]
  - - [1024, 1024, 1, 82]
    - [25, 5.504]
  - - [1024, 2, 1, 82]
    - [9, 0.015]
  - - [128, 64, 1312, 128]
    - [118, 19.278]
  - - [64, 128, 1312, 128]
    - [21, 21.06]
  - - [30528, 1024, 1, 160]
    - [116, 33.148]
  - - [1024, 4096, 1, 6144]
    - [52, 67.868]
  - - [30528, 1024, 1, 240]
    - [105, 42.18]
  - - [4096, 1024, 1, 6144]
    - [32, 67.458]
  - - [1024, 1024, 1, 12]
    - [80, 0.998]
  - - [1024, 2, 1, 12]
    - [9, 0.003]
  - - [1024, 1024, 1, 6144]
    - [43, 47.784]
  - - [64, 512, 192, 512]
    - [97, 38.445]
  - - [512, 64, 192, 512]
    - [138, 36.585]
  - - [13, 512, 1, 3456]
    - [139, 0.704]
  - - [13, 512, 1, 4096]
    - [139, 0.826]
  - - [13, 512, 1, 55296]
    - [33, 4.379]
  - - [13, 512, 1, 6912]
    - [33, 1.231]
  - - [13, 512, 1, 864]
    - [140, 0.345]
  - - [1024, 1024, 1, 10224]
    - [41, 66.963]
  - - [1024, 1024, 1, 10192]
    - [42, 65.445]
  - - [1024, 1024, 1, 10208]
    - [42, 53.432]
  - - [1024, 4096, 1, 10224]
    - [28, 71.176]
  - - [4096, 1024, 1, 10224]
    - [32, 69.828]
  - - [1024, 3072, 1, 10224]
    - [55, 69.43]
  - - [1024, 3072, 1, 10240]
    - [31, 70.022]
  - - [4096, 1024, 1, 10192]
    - [32, 69.339]
  - - [1024, 3072, 1, 10192]
    - [55, 69.412]
  - - [1024, 4096, 1, 10192]
    - [28, 70.901]
  - - [1024, 3072, 1, 10200]
    - [49, 69.24]
  - - [1024, 1024, 1, 10184]
    - [41, 66.932]
  - - [4096, 1024, 1, 10208]
    - [32, 70.226]
  - - [1024, 3072, 1, 10208]
    - [31, 69.87]
  - - [1024, 4096, 1, 10208]
    - [28, 72.019]
  - - [1024, 2048, 1, 10224]
    - [46, 63.638]
  - - [1024, 2048, 1, 10240]
    - [141, 64.348]
  - - [1024, 1024, 1, 10120]
    - [41, 67.72]
  - - [1024, 2048, 1, 10192]
    - [46, 63.59]
  - - [64, 24, 6816, 24]
    - [80, 3.987]
  - - [1024, 1024, 1, 10152]
    - [41, 65.803]
  - - [1024, 3072, 1, 10080]
    - [31, 69.83]
  - - [64, 26, 6272, 26]
    - [142, 4.489]
  - - [100352, 256, 1, 512]
    - [105, 54.423]
  - - [12544, 1024, 1, 2048]
    - [55, 67.947]
  - - [12544, 147, 1, 64]
    - [118, 6.715]
  - - [200704, 256, 1, 512]
    - [30, 54.016]
  - - [25088, 512, 1, 1024]
    - [30, 60.71]
  - - [3136, 576, 1, 64]
    - [143, 7.846]
  - - [50176, 512, 1, 1024]
    - [105, 65.312]
  - - [6272, 1024, 1, 2048]
    - [122, 65.485]
  - - [784, 1152, 1, 128]
    - [135, 7.662]
  - - [3136, 256, 128, 128]
    - [144, 32.888]
  - - [3136, 256, 256, 128]
    - [144, 33.577]
  - - [3136, 256, 128, 64]
    - [87, 19.412]
  - - [3136, 256, 256, 64]
    - [87, 19.582]
  - - [3136, 64, 128, 256]
    - [22, 31.212]
  - - [3136, 64, 256, 256]
    - [22, 32.028]
  - - [3136, 64, 128, 64]
    - [22, 15.373]
  - - [3136, 64, 256, 64]
    - [100, 17.819]
  - - [784, 128, 128, 512]
    - [73, 45.795]
  - - [784, 128, 256, 512]
    - [73, 49.103]
  - - [784, 512, 128, 128]
    - [73, 33.108]
  - - [784, 512, 256, 128]
    - [104, 34.673]
  - - [784, 512, 128, 256]
    - [104, 47.712]
  - - [784, 512, 256, 256]
    - [54, 49.713]
  - - [64, 128, 2048, 128]
    - [96, 22.136]
  - - [128, 64, 2048, 128]
    - [138, 20.129]
  - - [30528, 1024, 1, 2560]
    - [29, 75.205]
  - - [1024, 1024, 1, 128]
    - [115, 8.355]
  - - [1024, 2, 1, 128]
    - [9, 0.024]
  - - [128, 64, 1536, 128]
    - [23, 19.789]
  - - [64, 128, 1536, 128]
    - [21, 21.125]
  - - [1024, 4096, 1, 12288]
    - [28, 72.903]
  - - [30528, 1024, 1, 1920]
    - [29, 73.153]
  - - [1024, 1024, 1, 96]
    - [63, 6.711]
  - - [1024, 1024, 1, 12288]
    - [58, 69.194]
  - - [4096, 1024, 1, 12288]
    - [32, 72.143]
  - - [1024, 2, 1, 96]
    - [9, 0.019]
  - - [25600, 128, 25, 128]
    - [104, 28.412]
  - - [12544, 128, 36, 128]
    - [105, 29.3]
  - - [9216, 128, 49, 128]
    - [104, 29.803]
  - - [6400, 128, 64, 128]
    - [104, 29.65]
  - - [6400, 256, 25, 256]
    - [145, 46.42]
  - - [4096, 256, 36, 256]
    - [73, 46.509]
  - - [2304, 256, 49, 256]
    - [104, 44.649]
  - - [2304, 256, 64, 256]
    - [104, 46.568]
  - - [2304, 512, 25, 512]
    - [104, 58.784]
  - - [1024, 512, 36, 512]
    - [73, 56.648]
  - - [1024, 512, 49, 512]
    - [105, 58.299]
  - - [1024, 512, 64, 512]
    - [73, 60.074]
  - - [92416, 64, 25, 64]
    - [116, 14.672]
  - - [50176, 64, 36, 64]
    - [116, 14.899]
  - - [36864, 64, 49, 64]
    - [116, 15.151]
  - - [25600, 64, 64, 64]
    - [116, 15.204]
  - - [64, 128, 192, 128]
    - [61, 11.814]
  - - [128, 64, 192, 128]
    - [89, 7.213]
  - - [768, 2, 1, 2048]
    - [107, 0.093]
  - - [3072, 768, 1, 2048]
    - [26, 54.167]
  - - [768, 3072, 1, 2048]
    - [26, 54.114]
  - - [768, 768, 1, 2048]
    - [147, 26.685]
  - - [64, 384, 144, 384]
    - [21, 34.483]
  - - [384, 64, 144, 384]
    - [65, 29.787]
  - - [768, 2, 1, 4608]
    - [109, 0.216]
  - - [3072, 768, 1, 4608]
    - [48, 61.737]
  - - [768, 3072, 1, 4608]
    - [48, 61.582]
  - - [768, 768, 1, 4608]
    - [39, 36.947]
  - - [64, 512, 48, 512]
    - [21, 28.09]
  - - [512, 64, 48, 512]
    - [65, 27.578]
  - - [64, 128, 256, 128]
    - [63, 13.502]
  - - [128, 64, 256, 128]
    - [22, 12.98]
  - - [64, 384, 192, 384]
    - [19, 34.024]
  - - [384, 64, 192, 384]
    - [118, 31.798]
  - - [1024, 2, 1, 4608]
    - [109, 0.269]
  - - [4096, 1024, 1, 4608]
    - [32, 65.196]
  - - [1024, 4096, 1, 4608]
    - [53, 64.634]
  - - [1024, 1024, 1, 4608]
    - [114, 44.695]
  - - [196, 2304, 1, 256]
    - [25, 6.448]
  - - [49, 4608, 1, 512]
    - [35, 6.115]
  - - [196, 1024, 128, 256]
    - [102, 31.544]
  - - [196, 1024, 256, 256]
    - [102, 32.699]
  - - [196, 1024, 128, 512]
    - [106, 41.222]
  - - [196, 1024, 256, 512]
    - [101, 42.849]
  - - [196, 256, 128, 1024]
    - [111, 46.712]
  - - [196, 256, 256, 1024]
    - [94, 44.583]
  - - [49, 2048, 128, 512]
    - [94, 28.477]
  - - [49, 2048, 256, 512]
    - [94, 29.526]
  - - [49, 512, 128, 2048]
    - [148, 34.836]
  - - [49, 512, 256, 2048]
    - [102, 37.785]
  - - [3840, 4224, 1, 4096]
    - [172, 88.616]
  - - [3840, 4224, 1, 4224]
    - [173, 88.617]
  - - [3840, 4224, 1, 4320]
    - [172, 88.942]
  - - [7680, 8448, 1, 8192]
    - [174, 94.869]
  - - [7680, 8448, 1, 8448]
    - [174, 94.966]
  - - [7680, 8448, 1, 8640]
    - [175, 94.971]
  - - [3840, 4224, 1, 3712]
    - [4, 99.158]
  - - [3840, 4224, 1, 3840]
    - [5, 99.108]
  - - [3840, 4224, 1, 3968]
    - [4, 99.164]
  - - [7680, 8448, 1, 7424]
    - [6, 99.813]
  - - [7680, 8448, 1, 7680]
    - [7, 99.823]
  - - [7680, 8448, 1, 7936]
    - [7, 99.828]
  - - [1024, 1024, 1, 10032]
    - [42, 53.652]
  - - [1024, 1024, 1, 11304]
    - [42, 68.51]
  - - [1024, 1024, 1, 13200]
    - [41, 69.824]
  - - [1024, 1024, 1, 1640]
    - [62, 31.71]
  - - [1024, 1024, 1, 1960]
    - [121, 33.317]
  - - [1024, 1024, 1, 2320]
    - [114, 35.274]
  - - [1024, 1024, 1, 256]
    - [62, 14.972]
  - - [1024, 1024, 1, 2832]
    - [26, 37.55]
  - - [1024, 1024, 1, 288]
    - [62, 15.825]
  - - [1024, 1024, 1, 304]
    - [22, 16.177]
  - - [1024, 1024, 1, 312]
    - [22, 15.045]
  - - [1024, 1024, 1, 3304]
    - [121, 39.789]
  - - [1024, 1024, 1, 3400]
    - [26, 39.888]
  - - [1024, 1024, 1, 352]
    - [62, 18.08]
  - - [1024, 1024, 1, 3520]
    - [26, 42.175]
  - - [1024, 1024, 1, 3696]
    - [121, 40.769]
  - - [1024, 1024, 1, 384]
    - [62, 18.902]
  - - [1024, 1024, 1, 3872]
    - [26, 42.711]
  - - [1024, 1024, 1, 392]
    - [62, 17.676]
  - - [1024, 1024, 1, 432]
    - [22, 18.763]
  - - [1024, 1024, 1, 448]
    - [61, 20.837]
  - - [1024, 1024, 1, 456]
    - [62, 19.378]
  - - [1024, 1024, 1, 480]
    - [62, 21.727]
  - - [1024, 1024, 1, 4896]
    - [26, 45.224]
  - - [1024, 1024, 1, 4968]
    - [42, 52.773]
  - - [1024, 1024, 1, 5280]
    - [42, 56.031]
  - - [1024, 1024, 1, 648]
    - [61, 23.059]
  - - [1024, 1024, 1, 7040]
    - [42, 48.866]
  - - [1024, 1024, 1, 7144]
    - [42, 49.327]
  - - [1024, 1024, 1, 720]
    - [135, 24.096]
  - - [1024, 1024, 1, 760]
    - [62, 24.398]
  - - [1024, 2048, 1, 1280]
    - [46, 48.084]
  - - [1024, 2048, 1, 144]
    - [22, 15.465]
  - - [1024, 2048, 1, 1960]
    - [46, 53.529]
  - - [1024, 2048, 1, 3400]
    - [46, 52.199]
  - - [1024, 2048, 1, 4176]
    - [141, 55.184]
  - - [1024, 2048, 1, 504]
    - [100, 29.331]
  - - [1024, 2048, 1, 7448]
    - [141, 61.146]
  - - [1024, 2048, 1, 8192]
    - [141, 63.275]
  - - [1024, 2048, 1, 9152]
    - [141, 63.638]
  - - [1024, 3072, 1, 1280]
    - [49, 54.988]
  - - [1024, 3072, 1, 144]
    - [73, 18.227]
  - - [1024, 3072, 1, 1960]
    - [44, 57.985]
  - - [1024, 3072, 1, 2320]
    - [50, 59.67]
  - - [1024, 3072, 1, 4480]
    - [113, 66.658]
  - - [1024, 3072, 1, 4896]
    - [49, 67.075]
  - - [1024, 3072, 1, 6880]
    - [49, 68.629]
  - - [1024, 3072, 1, 9016]
    - [50, 68.867]
  - - [1024, 33712, 1, 160]
    - [116, 34.668]
  - - [1024, 33712, 1, 3408]
    - [30, 76.885]
  - - [1024, 4096, 1, 10032]
    - [28, 70.979]
  - - [1024, 4096, 1, 1960]
    - [53, 63.238]
  - - [1024, 4096, 1, 2320]
    - [53, 65.0]
  - - [1024, 4096, 1, 2832]
    - [52, 68.728]
  - - [1024, 4096, 1, 3304]
    - [53, 58.985]
  - - [1024, 4096, 1, 3584]
    - [53, 62.061]
  - - [1024, 4096, 1, 3872]
    - [53, 62.363]
  - - [1024, 4096, 1, 4896]
    - [52, 65.653]
  - - [1024, 4096, 1, 4968]
    - [52, 64.284]
  - - [1024, 4096, 1, 5280]
    - [53, 66.148]
  - - [1024, 4096, 1, 6880]
    - [28, 68.939]
  - - [1024, 4096, 1, 7040]
    - [53, 69.049]
  - - [1024, 4096, 1, 7144]
    - [53, 67.94]
  - - [1024, 4096, 1, 864]
    - [73, 46.715]
  - - [4096, 1024, 1, 10032]
    - [32, 70.284]
  - - [4096, 1024, 1, 1960]
    - [31, 54.579]
  - - [4096, 1024, 1, 2320]
    - [104, 55.736]
  - - [4096, 1024, 1, 2832]
    - [44, 57.461]
  - - [4096, 1024, 1, 3304]
    - [32, 59.388]
  - - [4096, 1024, 1, 3584]
    - [32, 61.632]
  - - [4096, 1024, 1, 3872]
    - [32, 62.598]
  - - [4096, 1024, 1, 4896]
    - [32, 65.766]
  - - [4096, 1024, 1, 4968]
    - [32, 64.62]
  - - [4096, 1024, 1, 5280]
    - [32, 65.643]
  - - [4096, 1024, 1, 6880]
    - [32, 68.895]
  - - [4096, 1024, 1, 7040]
    - [32, 68.978]
  - - [4096, 1024, 1, 7144]
    - [32, 67.749]
  - - [4096, 1024, 1, 864]
    - [73, 46.983]
  - - [64, 448, 1, 3328]
    - [139, 3.247]
  - - [3584, 64, 1, 1280]
    - [64, 11.367]
  - - [64, 5888, 1, 1280]
    - [64, 17.876]
  - - [64, 4288, 1, 1280]
    - [64, 13.507]
  - - [3584, 64, 1, 3328]
    - [67, 16.765]
  - - [64, 1024, 1, 3328]
    - [149, 6.518]
  - - [704, 64, 1, 3328]
    - [149, 4.514]
  - - [64, 448, 1, 1280]
    - [20, 2.037]
  - - [64, 704, 1, 3328]
    - [60, 4.719]
  - - [64, 64, 1, 1280]
    - [20, 0.29]
  - - [64, 5056, 1, 256]
    - [20, 5.945]
  - - [64, 4288, 1, 3328]
    - [64, 20.019]
  - - [1856, 64, 1, 3328]
    - [149, 9.183]
  - - [448, 64, 1, 1280]
    - [20, 1.978]
  - - [5888, 64, 1, 1280]
    - [64, 18.297]
  - - [2944, 64, 1, 256]
    - [60, 3.91]
  - - [64, 1856, 1, 256]
    - [60, 2.501]
  - - [64, 1024, 1, 1280]
    - [20, 4.61]
  - - [64, 256, 1, 1280]
    - [20, 1.147]
  - - [704, 64, 1, 1280]
    - [20, 3.079]
  - - [2368, 64, 1, 256]
    - [59, 3.078]
  - - [2368, 64, 1, 3328]
    - [132, 13.45]
  - - [64, 1408, 1, 3328]
    - [60, 9.156]
  - - [1856, 64, 1, 1280]
    - [112, 6.464]
  - - [64, 3584, 1, 1280]
    - [61, 11.29]
  - - [448, 64, 1, 3328]
    - [139, 3.241]
  - - [5888, 64, 1, 3328]
    - [64, 26.71]
  - - [64, 256, 1, 3328]
    - [139, 1.92]
  - - [4288, 64, 1, 3328]
    - [64, 19.942]
  - - [64, 2944, 1, 256]
    - [20, 3.854]
  - - [6784, 64, 1, 256]
    - [112, 7.683]
  - - [64, 2368, 1, 1280]
    - [112, 8.035]
  - - [64, 3584, 1, 3328]
    - [38, 19.751]
  - - [64, 6784, 1, 3328]
    - [38, 24.062]
  - - [3584, 64, 1, 256]
    - [60, 4.411]
  - - [64, 1856, 1, 3328]
    - [149, 9.337]
  - - [448, 64, 1, 256]
    - [140, 0.599]
  - - [64, 5056, 1, 3328]
    - [64, 23.243]
  - - [256, 64, 1, 256]
    - [13, 0.353]
  - - [4288, 64, 1, 1280]
    - [61, 13.6]
  - - [5056, 64, 1, 1280]
    - [108, 15.765]
  - - [1408, 64, 1, 256]
    - [20, 1.883]
  - - [64, 1408, 1, 256]
    - [20, 1.911]
  - - [64, 2368, 1, 3328]
    - [38, 13.252]
  - - [64, 448, 1, 256]
    - [59, 0.604]
  - - [64, 6784, 1, 1280]
    - [64, 20.665]
  - - [64, 1856, 1, 1280]
    - [112, 6.489]
  - - [64, 6784, 1, 256]
    - [112, 7.544]
  - - [64, 5056, 1, 1280]
    - [64, 16.036]
  - - [64, 4288, 1, 256]
    - [20, 5.042]
  - - [5888, 64, 1, 256]
    - [112, 6.709]
  - - [64, 5888, 1, 3328]
    - [64, 26.559]
  - - [64, 1024, 1, 256]
    - [20, 1.37]
  - - [5056, 64, 1, 3328]
    - [64, 23.468]
  - - [256, 64, 1, 1280]
    - [20, 1.136]
  - - [64, 256, 1, 256]
    - [59, 0.347]
  - - [704, 64, 1, 256]
    - [59, 0.949]
  - - [64, 1408, 1, 1280]
    - [20, 6.13]
  - - [64, 704, 1, 256]
    - [59, 0.935]
  - - [64, 2944, 1, 3328]
    - [112, 14.073]
  - - [64, 64, 1, 256]
    - [59, 0.089]
  - - [1856, 64, 1, 256]
    - [60, 2.501]
  - - [2944, 64, 1, 1280]
    - [112, 10.064]
  - - [4288, 64, 1, 256]
    - [150, 5.074]
  - - [64, 2944, 1, 1280]
    - [35, 9.881]
  - - [1408, 64, 1, 1280]
    - [60, 6.016]
  - - [6784, 64, 1, 3328]
    - [68, 22.124]
  - - [64, 2368, 1, 256]
    - [20, 3.1]
  - - [64, 3584, 1, 256]
    - [59, 4.594]
  - - [2944, 64, 1, 3328]
    - [112, 14.045]
  - - [2368, 64, 1, 1280]
    - [112, 8.186]
  - - [256, 64, 1, 3328]
    - [139, 1.977]
  - - [64, 64, 1, 3328]
    - [139, 0.474]
  - - [64, 5888, 1, 256]
    - [112, 6.751]
  - - [64, 704, 1, 1280]
    - [60, 3.233]
  - - [6784, 64, 1, 1280]
    - [64, 20.871]
  - - [5056, 64, 1, 256]
    - [112, 5.833]
  - - [1408, 64, 1, 3328]
    - [20, 9.181]
  - - [4096, 7133, 1, 4096]
    - [49, 74.889]
  - - [512, 16, 1, 512]
    - [13, 0.301]
  - - [2048, 7133, 1, 2048]
    - [31, 66.999]
  - - [2560, 7133, 1, 2560]
    - [31, 85.56]
  - - [3072, 7435, 1, 1024]
    - [105, 65.549]
  - - [1024, 32, 1, 512]
    - [20, 1.252]
  - - [1760, 7133, 1, 1760]
    - [31, 76.998]
  - - [7680, 5481, 1, 2560]
    - [55, 75.957]
  - - [1024, 16, 1, 512]
    - [13, 0.591]
  - - [4880, 256, 49, 256]
    - [73, 50.073]
  - - [3128, 256, 64, 256]
    - [104, 49.141]
  - - [4680, 256, 49, 256]
    - [105, 49.889]
  - - [5280, 256, 36, 256]
    - [104, 48.48]
  - - [2640, 256, 64, 256]
    - [73, 49.077]
  - - [5304, 256, 49, 256]
    - [73, 49.831]
  - - [2760, 256, 64, 256]
    - [73, 48.431]
  - - [6440, 256, 36, 256]
    - [73, 48.77]
  - - [5704, 256, 36, 256]
    - [105, 48.752]
  - - [2128, 256, 64, 256]
    - [105, 47.84]
  - - [1160, 256, 49, 256]
    - [104, 40.085]
  - - [4056, 256, 49, 256]
    - [104, 48.72]
  - - [6144, 256, 36, 256]
    - [104, 47.781]
  - - [6336, 256, 36, 256]
    - [104, 47.724]
  - - [13600, 512, 2, 128]
    - [104, 26.85]
  - - [15200, 512, 2, 128]
    - [104, 26.882]
  - - [15200, 128, 2, 512]
    - [21, 36.677]
  - - [13600, 128, 2, 512]
    - [44, 41.155]
  - - [5632, 256, 36, 256]
    - [145, 47.571]
  - - [12288, 128, 2, 512]
    - [49, 39.448]
  - - [12880, 128, 2, 512]
    - [27, 39.461]
  - - [768, 512, 2, 2048]
    - [129, 34.953]
  - - [11408, 128, 2, 512]
    - [49, 37.604]
  - - [13824, 512, 2, 128]
    - [73, 26.206]
  - - [13824, 128, 2, 512]
    - [49, 43.343]
  - - [10560, 128, 2, 512]
    - [21, 35.932]
  - - [10752, 128, 2, 512]
    - [49, 35.442]
  - - [13600, 512, 2, 256]
    - [73, 39.848]
  - - [15200, 512, 2, 256]
    - [73, 40.444]
  - - [768, 2048, 2, 512]
    - [31, 39.534]
  - - [12880, 512, 2, 128]
    - [152, 25.984]
  - - [11616, 128, 2, 512]
    - [49, 36.575]
  - - [14208, 512, 2, 128]
    - [104, 25.381]
  - - [11408, 512, 2, 128]
    - [21, 25.219]
  - - [6912, 256, 36, 256]
    - [30, 48.046]
  - - [672, 512, 2, 2048]
    - [147, 29.845]
  - - [13824, 512, 2, 256]
    - [106, 40.94]
  - - [11616, 512, 2, 128]
    - [104, 25.795]
  - - [12288, 512, 2, 128]
    - [73, 26.414]
  - - [14208, 128, 2, 512]
    - [104, 35.382]
  - - [11968, 128, 2, 512]
    - [49, 38.008]
  - - [864, 2048, 2, 512]
    - [116, 36.454]
  - - [1008, 512, 2, 2048]
    - [114, 36.459]
  - - [10560, 512, 2, 128]
    - [87, 25.193]
  - - [672, 2048, 2, 512]
    - [49, 35.051]
  - - [9408, 128, 2, 512]
    - [22, 34.052]
  - - [10752, 512, 2, 128]
    - [104, 24.241]
  - - [11968, 512, 2, 128]
    - [96, 25.838]
  - - [1240, 256, 49, 256]
    - [73, 42.404]
  - - [4032, 256, 2, 1024]
    - [114, 39.431]
  - - [888, 2048, 2, 512]
    - [153, 38.01]
  - - [12880, 512, 2, 256]
    - [104, 40.86]
  - - [12288, 512, 2, 256]
    - [73, 40.505]
  - - [13440, 128, 2, 512]
    - [49, 42.408]
  - - [864, 2048, 2, 256]
    - [96, 26.443]
  - - [12672, 128, 2, 512]
    - [113, 40.33]
  - - [11264, 128, 2, 512]
    - [49, 36.801]
  - - [11776, 128, 2, 512]
    - [31, 38.136]
  - - [16128, 128, 2, 512]
    - [73, 38.853]
  - - [4032, 1024, 2, 256]
    - [152, 36.079]
  - - [14000, 128, 2, 512]
    - [50, 44.847]
  - - [13440, 512, 2, 128]
    - [145, 25.459]
  - - [864, 512, 2, 2048]
    - [121, 32.048]
  - - [768, 2048, 2, 256]
    - [154, 27.084]
  - - [3264, 1024, 2, 256]
    - [95, 35.248]
  - - [888, 512, 2, 2048]
    - [121, 31.838]
  - - [4200, 256, 2, 1024]
    - [26, 41.28]
  - - [2352, 1024, 2, 256]
    - [73, 32.085]
  - - [56, 512, 64, 512]
    - [21, 26.397]
  - - [2400, 1024, 2, 256]
    - [73, 31.858]
  - - [15200, 256, 2, 12]
    - [85, 2.776]
  - - [840, 512, 2, 2048]
    - [121, 30.394]
  - - [12880, 256, 2, 12]
    - [85, 2.702]
  - - [2520, 1024, 2, 256]
    - [104, 35.025]
  - - [13600, 256, 2, 12]
    - [85, 2.63]
  - - [15200, 256, 2, 3]
    - [85, 0.739]
  - - [12880, 256, 2, 3]
    - [135, 0.703]
  - - [4200, 1024, 2, 256]
    - [104, 38.051]
  - - [12288, 256, 2, 12]
    - [80, 2.363]
  - - [768, 256, 2, 12]
    - [155, 0.439]
  - - [13824, 256, 2, 12]
    - [25, 2.398]
  - - [864, 256, 2, 3]
    - [155, 0.127]
  - - [176, 256, 2, 3]
    - [9, 0.028]
  - - [864, 256, 2, 12]
    - [156, 0.494]
  - - [13600, 256, 2, 3]
    - [135, 0.696]
  - - [768, 256, 2, 3]
    - [155, 0.114]
  - - [7600, 512, 1, 256]
    - [137, 27.849]
  - - [6144, 512, 1, 256]
    - [111, 27.494]
  - - [1024, 81, 1, 1024]
    - [157, 4.668]
  - - [176, 256, 2, 12]
    - [9, 0.109]
  - - [216, 256, 2, 3]
    - [9, 0.034]
  - - [192, 256, 2, 12]
    - [155, 0.124]
  - - [3800, 256, 2, 3]
    - [85, 0.387]
  - - [13824, 256, 2, 3]
    - [116, 0.615]
  - - [12288, 256, 2, 3]
    - [82, 0.596]
  - - [192, 256, 2, 3]
    - [9, 0.03]
  - - [216, 256, 2, 12]
    - [156, 0.13]
  - - [2688, 256, 2, 1024]
    - [65, 34.293]
  - - [3072, 256, 2, 12]
    - [81, 1.266]
  - - [3800, 256, 2, 12]
    - [143, 1.486]
  - - [3072, 256, 2, 3]
    - [81, 0.318]
  - - [2520, 256, 2, 1024]
    - [50, 29.104]
  - - [16128, 512, 2, 128]
    - [104, 26.317]
  - - [2400, 256, 2, 1024]
    - [127, 32.342]
  - - [2352, 256, 2, 1024]
    - [121, 31.024]
  - - [2944, 256, 2, 1024]
    - [65, 36.922]
  - - [2992, 1024, 2, 256]
    - [104, 31.727]
  - - [2816, 256, 2, 1024]
    - [65, 35.391]
  - - [2904, 1024, 2, 256]
    - [104, 31.917]
  - - [3456, 256, 2, 3]
    - [158, 0.344]
  - - [3400, 256, 2, 3]
    - [135, 0.357]
  - - [2816, 1024, 2, 256]
    - [161, 30.046]
  - - [3456, 256, 2, 12]
    - [82, 1.344]
  - - [2944, 1024, 2, 256]
    - [49, 31.136]
  - - [3168, 256, 2, 1024]
    - [65, 38.744]
  - - [2992, 256, 2, 1024]
    - [65, 37.524]
  - - [51520, 256, 2, 12]
    - [85, 3.184]
  - - [3072, 256, 2, 1024]
    - [161, 39.508]
  - - [2640, 1024, 2, 256]
    - [96, 32.087]
  - - [2688, 1024, 2, 256]
    - [161, 28.726]
  - - [2904, 256, 2, 1024]
    - [123, 36.189]
  - - [3264, 256, 2, 1024]
    - [50, 42.043]
  - - [54400, 256, 2, 12]
    - [80, 2.899]
  - - [55296, 256, 2, 3]
    - [104, 0.744]
  - - [60800, 256, 2, 12]
    - [142, 2.919]
  - - [51520, 256, 2, 3]
    - [83, 0.843]
  - - [55296, 256, 2, 12]
    - [160, 2.863]
  - - [3600, 1024, 2, 256]
    - [31, 34.734]
  - - [60800, 256, 2, 3]
    - [80, 0.751]
  - - [952, 256, 64, 256]
    - [105, 40.384]
  - - [49152, 256, 2, 12]
    - [80, 2.938]
  - - [3360, 256, 2, 1024]
    - [103, 34.11]
  - - [736, 256, 64, 256]
    - [104, 39.748]
  - - [600, 256, 64, 256]
    - [105, 37.754]
  - - [1440, 256, 49, 256]
    - [104, 42.083]
  - - [3168, 1024, 2, 256]
    - [96, 33.416]
  - - [1368, 256, 49, 256]
    - [73, 42.964]
  - - [49152, 256, 2, 3]
    - [80, 0.743]
  - - [3600, 256, 2, 1024]
    - [121, 36.982]
  - - [3360, 1024, 2, 256]
    - [96, 35.632]
  - - [54400, 256, 2, 3]
    - [80, 0.735]
  - - [3072, 1024, 2, 256]
    - [166, 31.987]
  - - [2640, 256, 2, 1024]
    - [65, 33.321]
  - - [616, 256, 64, 256]
    - [105, 38.251]
  - - [3008, 256, 64, 256]
    - [73, 47.651]
  - - [896, 256, 64, 256]
    - [105, 40.096]
  - - [768, 256, 64, 256]
    - [73, 40.55]
  - - [3552, 256, 2, 1024]
    - [121, 35.866]
  - - [3552, 1024, 2, 256]
    - [87, 34.172]
  - - [800, 256, 64, 256]
    - [87, 37.918]
  - - [1120, 256, 49, 256]
    - [105, 39.533]
  - - [2408, 256, 64, 256]
    - [104, 47.932]
  - - [3456, 256, 2, 1024]
    - [26, 32.877]
  - - [672, 256, 64, 256]
    - [104, 37.36]
  - - [3456, 1024, 2, 256]
    - [116, 31.913]
  - - [1064, 256, 49, 256]
    - [73, 38.611]
  - - [3400, 256, 2, 1024]
    - [26, 34.1]
  - - [704, 256, 64, 256]
    - [104, 37.804]
  - - [3400, 1024, 2, 256]
    - [159, 34.567]
  - - [3264, 256, 64, 256]
    - [104, 47.783]
  - - [3800, 1024, 2, 256]
    - [104, 36.087]
  - - [3800, 256, 2, 1024]
    - [121, 38.045]
  - - [6440, 512, 1, 256]
    - [88, 27.726]
  - - [6912, 512, 1, 256]
    - [161, 30.469]
  - - [6800, 512, 1, 256]
    - [19, 29.192]
  - - [6800, 512, 1, 1024]
    - [121, 45.03]
  - - [6440, 512, 1, 1024]
    - [44, 53.882]
  - - [6912, 512, 1, 1024]
    - [31, 57.344]
  - - [1728, 1024, 1, 512]
    - [62, 24.093]
  - - [1536, 1024, 1, 512]
    - [72, 29.08]
  - - [7600, 512, 1, 1024]
    - [49, 50.018]
  - - [6144, 512, 1, 1024]
    - [49, 52.069]
  - - [1728, 1024, 1, 2048]
    - [46, 45.192]
  - - [1536, 1024, 1, 2048]
    - [50, 48.78]
  - - [1024, 320, 1, 1024]
    - [61, 14.54]
  - - [173280, 64, 1, 128]
    - [22, 18.236]
  - - [25992, 64, 1, 128]
    - [61, 12.626]
  - - [4524, 256, 49, 256]
    - [106, 46.913]
  - - [2666, 256, 64, 256]
    - [101, 43.866]
  - - [950, 2048, 2, 512]
    - [95, 34.64]
  - - [3220, 1024, 2, 256]
    - [95, 33.021]
  - - [782, 128, 64, 128]
    - [99, 18.701]
  - - [850, 2048, 2, 512]
    - [95, 34.39]
  - - [713, 512, 2, 2048]
    - [57, 30.299]
  - - [805, 2048, 2, 512]
    - [95, 34.52]
  - - [713, 2048, 2, 512]
    - [95, 32.15]
  - - [660, 512, 2, 2048]
    - [57, 29.423]
  - - [726, 512, 2, 2048]
    - [162, 30.852]
  - - [660, 2048, 2, 512]
    - [94, 30.163]
  - - [726, 2048, 2, 512]
    - [95, 33.179]
  - - [748, 512, 2, 2048]
    - [57, 31.673]
  - - [805, 2048, 2, 256]
    - [95, 24.138]
  - - [1251, 256, 49, 256]
    - [91, 34.289]
  - - [805, 512, 2, 2048]
    - [165, 32.826]
  - - [850, 512, 2, 2048]
    - [57, 28.367]
  - - [850, 256, 2, 3]
    - [15, 0.111]
  - - [805, 256, 2, 12]
    - [15, 0.398]
  - - [228, 256, 2, 12]
    - [14, 0.126]
  - - [228, 256, 2, 3]
    - [14, 0.032]
  - - [805, 256, 2, 3]
    - [14, 0.106]
  - - [850, 256, 2, 12]
    - [163, 0.417]
  - - [187, 256, 2, 12]
    - [14, 0.1]
  - - [247, 256, 2, 12]
    - [13, 0.134]
  - - [950, 256, 2, 12]
    - [164, 0.466]
  - - [950, 256, 2, 3]
    - [163, 0.121]
  - - [1900, 1024, 1, 2048]
    - [103, 41.645]
  - - [1610, 1024, 1, 2048]
    - [161, 49.165]
  - - [1900, 1024, 1, 512]
    - [95, 26.47]
  - - [3220, 256, 2, 12]
    - [25, 1.303]
  - - [187, 256, 2, 3]
    - [8, 0.027]
  - - [221, 256, 2, 3]
    - [13, 0.031]
  - - [221, 256, 2, 12]
    - [13, 0.12]
  - - [247, 256, 2, 3]
    - [14, 0.035]
  - - [3220, 256, 2, 3]
    - [25, 0.332]
  - - [3036, 1024, 2, 256]
    - [94, 30.761]
  - - [3036, 256, 2, 1024]
    - [165, 35.512]
  - - [850, 2048, 2, 256]
    - [95, 24.433]
  - - [2852, 1024, 2, 256]
    - [91, 30.464]
  - - [950, 2048, 2, 256]
    - [89, 24.188]
  - - [3700, 1024, 2, 256]
    - [95, 32.718]
  - - [2852, 256, 2, 1024]
    - [148, 33.492]
  - - [3700, 256, 2, 1024]
    - [103, 33.573]
  - - [1269, 256, 49, 256]
    - [101, 32.936]
  - - [1467, 256, 49, 256]
    - [101, 35.935]
  - - [3500, 256, 2, 1024]
    - [103, 32.079]
  - - [1449, 256, 49, 256]
    - [101, 35.663]
  - - [1278, 256, 49, 256]
    - [91, 33.775]
  - - [1413, 256, 49, 256]
    - [145, 33.789]
  - - [1341, 256, 49, 256]
    - [94, 34.264]
  - - [1287, 256, 49, 256]
    - [101, 33.475]
  - - [1332, 256, 49, 256]
    - [101, 36.648]
  - - [1359, 256, 49, 256]
    - [94, 34.216]
  - - [1395, 256, 49, 256]
    - [145, 33.919]
  - - [1323, 256, 49, 256]
    - [106, 34.387]
  - - [1404, 256, 49, 256]
    - [91, 38.548]
  - - [1386, 256, 49, 256]
    - [106, 36.469]
  - - [1350, 256, 49, 256]
    - [94, 36.946]
  - - [3500, 1024, 2, 256]
    - [95, 31.709]
  - - [3220, 256, 2, 1024]
    - [45, 36.102]
  - - [690, 256, 64, 256]
    - [102, 31.873]
  - - [660, 256, 64, 256]
    - [94, 33.393]
  - - [782, 256, 64, 256]
    - [95, 34.994]
  - - [884, 256, 64, 256]
    - [91, 33.88]
  - - [1610, 1024, 1, 512]
    - [57, 27.018]
  - - [1700, 1024, 1, 512]
    - [57, 26.288]
  - - [1700, 1024, 1, 2048]
    - [103, 39.853]
  - - [100, 512, 120, 128]
    - [7, 15.827]
  - - [100, 512, 18, 128]
    - [90, 4.066]
  - - [100, 512, 19, 128]
    - [162, 4.304]
  - - [1444, 128, 120, 256]
    - [94, 35.285]
  - - [1444, 128, 18, 256]
    - [94, 25.186]
  - - [1444, 128, 19, 256]
    - [94, 25.643]
  - - [1444, 256, 120, 256]
    - [106, 44.164]
  - - [1444, 256, 18, 256]
    - [94, 30.756]
  - - [1444, 256, 19, 256]
    - [94, 32.104]
  - - [25, 256, 120, 128]
    - [74, 5.128]
  - - [25, 256, 18, 128]
    - [11, 0.709]
  - - [25, 256, 19, 128]
    - [146, 0.75]
  - - [361, 512, 120, 256]
    - [102, 33.336]
  - - [361, 512, 18, 256]
    - [91, 23.811]
  - - [361, 512, 19, 256]
    - [89, 21.83]
  - - [9, 256, 120, 128]
    - [8, 1.423]
  - - [9, 256, 18, 128]
    - [140, 0.271]
  - - [9, 256, 19, 128]
    - [11, 0.28]
  - - [100, 2304, 1, 512]
    - [35, 5.987]
  - - [1444, 576, 1, 128]
    - [25, 6.484]
  - - [25, 1152, 1, 256]
    - [13, 0.569]
  - - [27436, 64, 1, 128]
    - [99, 11.254]
  - - [361, 2304, 1, 512]
    - [57, 17.836]
  - - [9, 1152, 1, 256]
    - [13, 0.208]
  - - [3840, 4223, 1, 3712]
    - [168, 89.228]
  - - [3840, 4225, 1, 3712]
    - [169, 84.24]
  - - [3840, 4223, 1, 3840]
    - [30, 86.76]
  - - [3840, 4225, 1, 3840]
    - [170, 84.44]
  - - [3840, 4223, 1, 3968]
    - [168, 89.639]
  - - [3840, 4225, 1, 3968]
    - [170, 84.658]
  - - [7680, 8447, 1, 7424]
    - [151, 93.572]
  - - [7680, 8449, 1, 7424]
    - [171, 93.336]
  - - [7680, 8447, 1, 7680]
    - [171, 98.413]
  - - [7680, 8449, 1, 7680]
    - [171, 93.338]
  - - [7680, 8447, 1, 7936]
    - [171, 98.414]
  - - [7680, 8449, 1, 7936]
    - [171, 93.378]
  - - [3840, 4224, 1, 3711]
    - [168, 89.143]
  - - [3840, 4224, 1, 3713]
    - [168, 90.451]
  - - [3840, 4224, 1, 3839]
    - [168, 89.092]
  - - [3840, 4224, 1, 3841]
    - [168, 90.634]
  - - [3840, 4224, 1, 3967]
    - [168, 89.516]
  - - [3840, 4224, 1, 3969]
    - [168, 90.738]
  - - [7680, 8448, 1, 7423]
    - [171, 98.274]
  - - [7680, 8448, 1, 7425]
    - [171, 98.522]
  - - [7680, 8448, 1, 7679]
    - [171, 98.312]
  - - [7680, 8448, 1, 7681]
    - [171, 98.551]
  - - [7680, 8448, 1, 7935]
    - [171, 98.35]
  - - [7680, 8448, 1, 7937]
    - [171, 98.578]
  - - [64, 32, 16, 32]
    - [59, 0.099]
  - - [64, 48, 16, 48]
    - [10, 0.261]
  - - [64, 80, 16, 80]
    - [15, 0.329]
  - - [64, 96, 16, 96]
    - [13, 0.901]
  - - [64, 160, 16, 160]
    - [59, 2.344]
  - - [64, 192, 16, 192]
    - [13, 3.198]
  - - [64, 240, 16, 240]
    - [156, 4.206]
  - - [64, 304, 16, 304]
    - [158, 3.621]
  - - [64, 320, 16, 320]
    - [112, 4.33]
  - - [64, 384, 16, 384]
    - [61, 8.592]
  - - [64, 416, 16, 416]
    - [62, 10.453]
  - - [64, 432, 16, 432]
    - [115, 9.876]
  - - [64, 448, 16, 448]
    - [66, 11.997]
  - - [64, 464, 16, 464]
    - [62, 11.342]
  - - [64, 480, 16, 480]
    - [62, 13.159]
  - - [64, 496, 16, 496]
    - [62, 12.503]
  - - [1024, 1024, 1, 5552]
    - [42, 50.299]
  - - [1024, 1024, 1, 6128]
    - [42, 52.422]
  - - [1024, 3072, 1, 7344]
    - [50, 79.791]
  - - [1024, 1024, 1, 7760]
    - [42, 56.764]
  - - [1024, 1024, 1, 5936]
    - [42, 51.945]
  - - [1024, 4096, 1, 5936]
    - [52, 75.567]
  - - [1024, 1024, 1, 5616]
    - [42, 51.272]
  - - [1024, 1024, 1, 5904]
    - [42, 51.935]
  - - [1024, 1024, 1, 5776]
    - [42, 51.812]
  - - [4096, 1024, 1, 7232]
    - [32, 78.131]
  - - [1024, 1024, 1, 5312]
    - [43, 52.078]
  - - [1024, 1024, 1, 5872]
    - [42, 51.769]
  - - [1024, 1024, 1, 6000]
    - [42, 52.196]
  - - [1024, 4096, 1, 8016]
    - [52, 79.279]
  - - [1024, 1024, 1, 5744]
    - [42, 51.603]
  - - [1024, 1024, 1, 5728]
    - [42, 51.735]
  - - [1024, 1024, 1, 5632]
    - [43, 52.514]
  - - [1024, 1024, 1, 5504]
    - [43, 52.185]
  - - [1024, 1024, 1, 5488]
    - [42, 49.987]
  - - [1024, 1024, 1, 5456]
    - [42, 55.898]
  - - [1024, 1024, 1, 6288]
    - [42, 52.647]
  - - [1024, 1024, 1, 6256]
    - [42, 53.018]
  - - [1024, 4096, 1, 7264]
    - [28, 79.22]
  - - [1024, 1024, 1, 6304]
    - [42, 53.272]
  - - [1024, 1024, 1, 5520]
    - [42, 50.201]
  - - [1024, 1024, 1, 5360]
    - [42, 49.664]
  - - [1024, 1024, 1, 5392]
    - [42, 49.688]
  - - [1024, 1024, 1, 5376]
    - [43, 52.229]
  - - [1024, 1024, 1, 5328]
    - [43, 49.836]
  - - [1024, 1024, 1, 6224]
    - [42, 52.52]
  - - [1024, 1024, 1, 6320]
    - [42, 52.691]
  - - [1024, 1024, 1, 5696]
    - [43, 52.407]
  - - [1024, 1024, 1, 6096]
    - [42, 52.376]
  - - [1024, 1024, 1, 5712]
    - [42, 51.355]
  - - [1024, 4096, 1, 6016]
    - [52, 76.813]
  - - [1024, 1024, 1, 11248]
    - [42, 63.007]
  - - [1024, 1024, 1, 14080]
    - [42, 63.706]
  - - [1024, 1024, 1, 14400]
    - [42, 63.834]
  - - [1024, 1024, 1, 15168]
    - [42, 64.527]
  - - [1024, 1024, 1, 2088]
    - [61, 34.403]
  - - [4096, 1024, 1, 14192]
    - [32, 76.4]
  - - [4096, 1024, 1, 28672]
    - [32, 79.7]
  - - [1024, 1024, 1, 11984]
    - [42, 61.582]
  - - [1024, 1024, 1, 12064]
    - [42, 61.671]
  - - [1024, 1024, 1, 12112]
    - [42, 61.489]
  - - [1024, 1024, 1, 12192]
    - [42, 61.343]
  - - [1024, 1024, 1, 12272]
    - [42, 61.667]
  - - [1024, 1024, 1, 12304]
    - [42, 60.793]
  - - [1024, 1024, 1, 12368]
    - [42, 62.176]
  - - [1024, 1024, 1, 13024]
    - [42, 62.495]
  - - [1024, 1024, 1, 13056]
    - [42, 62.598]
  - - [1024, 1024, 1, 13072]
    - [42, 62.37]
  - - [1024, 1024, 1, 13088]
    - [42, 62.776]
  - - [1024, 1024, 1, 13168]
    - [42, 62.601]
  - - [1024, 1024, 1, 13184]
    - [42, 62.93]
  - - [1024, 1024, 1, 13216]
    - [42, 62.728]
  - - [1024, 1024, 1, 13232]
    - [42, 62.779]
  - - [1024, 1024, 1, 13248]
    - [42, 62.628]
  - - [1024, 1024, 1, 13280]
    - [42, 62.755]
  - - [1024, 1024, 1, 13296]
    - [42, 62.931]
  - - [1024, 1024, 1, 13312]
    - [41, 62.705]
  - - [1024, 1024, 1, 13328]
    - [42, 62.705]
  - - [1024, 1024, 1, 13344]
    - [42, 62.756]
  - - [1024, 1024, 1, 13360]
    - [42, 62.781]
  - - [1024, 1024, 1, 13376]
    - [42, 62.932]
  - - [1024, 1024, 1, 13392]
    - [42, 62.957]
  - - [1024, 1024, 1, 13408]
    - [42, 62.907]
  - - [1024, 1024, 1, 13424]
    - [42, 62.907]
  - - [1024, 1024, 1, 13440]
    - [42, 62.982]
  - - [1024, 1024, 1, 13456]
    - [42, 63.032]
  - - [1024, 1024, 1, 13472]
    - [42, 63.157]
  - - [1024, 1024, 1, 13504]
    - [42, 63.131]
  - - [1024, 1024, 1, 13520]
    - [42, 62.957]
  - - [1024, 1024, 1, 13536]
    - [42, 62.685]
  - - [1024, 1024, 1, 13552]
    - [42, 63.106]
  - - [1024, 1024, 1, 13568]
    - [42, 63.131]
  - - [1024, 1024, 1, 13584]
    - [42, 63.031]
  - - [1024, 1024, 1, 13600]
    - [41, 62.982]
  - - [1024, 1024, 1, 13632]
    - [42, 63.279]
  - - [1024, 1024, 1, 13648]
    - [42, 62.859]
  - - [1024, 1024, 1, 13664]
    - [42, 63.155]
  - - [1024, 1024, 1, 13680]
    - [42, 63.007]
  - - [1024, 1024, 1, 13696]
    - [41, 63.501]
  - - [1024, 1024, 1, 13712]
    - [42, 61.476]
  - - [1024, 1024, 1, 13728]
    - [42, 63.302]
  - - [1024, 1024, 1, 13744]
    - [42, 63.302]
  - - [1024, 1024, 1, 13760]
    - [42, 63.598]
  - - [1024, 1024, 1, 13776]
    - [42, 63.104]
  - - [1024, 1024, 1, 13792]
    - [42, 63.153]
  - - [1024, 1024, 1, 13808]
    - [42, 63.275]
  - - [1024, 1024, 1, 13824]
    - [42, 63.423]
  - - [1024, 1024, 1, 13840]
    - [42, 63.373]
  - - [1024, 1024, 1, 13856]
    - [42, 63.08]
  - - [1024, 1024, 1, 13872]
    - [42, 63.128]
  - - [1024, 1024, 1, 13888]
    - [42, 63.667]
  - - [1024, 1024, 1, 13904]
    - [42, 63.322]
  - - [1024, 1024, 1, 13920]
    - [42, 63.42]
  - - [1024, 1024, 1, 13936]
    - [42, 63.542]
  - - [1024, 1024, 1, 13952]
    - [42, 63.738]
  - - [1024, 1024, 1, 13968]
    - [42, 63.54]
  - - [1024, 1024, 1, 13984]
    - [42, 63.711]
  - - [1024, 1024, 1, 14016]
    - [42, 63.685]
  - - [1024, 1024, 1, 14032]
    - [42, 63.562]
  - - [1024, 1024, 1, 14048]
    - [41, 63.367]
  - - [1024, 1024, 1, 14064]
    - [42, 63.683]
  - - [1024, 1024, 1, 14096]
    - [42, 63.657]
  - - [1024, 1024, 1, 14112]
    - [42, 63.535]
  - - [1024, 1024, 1, 14128]
    - [42, 63.438]
  - - [1024, 1024, 1, 14144]
    - [42, 63.728]
  - - [1024, 1024, 1, 14160]
    - [42, 63.581]
  - - [1024, 1024, 1, 14192]
    - [42, 63.993]
  - - [1024, 1024, 1, 14224]
    - [42, 63.579]
  - - [1024, 1024, 1, 14240]
    - [42, 63.626]
  - - [1024, 1024, 1, 14256]
    - [42, 63.867]
  - - [1024, 1024, 1, 14272]
    - [41, 63.842]
  - - [1024, 1024, 1, 14288]
    - [42, 63.696]
  - - [1024, 1024, 1, 14304]
    - [42, 63.623]
  - - [1024, 1024, 1, 14320]
    - [42, 63.551]
  - - [1024, 1024, 1, 14336]
    - [42, 63.838]
  - - [1024, 1024, 1, 14352]
    - [42, 63.789]
  - - [1024, 1024, 1, 14368]
    - [42, 63.884]
  - - [1024, 1024, 1, 14384]
    - [42, 63.787]
  - - [1024, 1024, 1, 14416]
    - [42, 63.857]
  - - [1024, 1024, 1, 14432]
    - [42, 63.761]
  - - [1024, 1024, 1, 14448]
    - [42, 63.736]
  - - [1024, 1024, 1, 14464]
    - [41, 63.878]
  - - [1024, 1024, 1, 14480]
    - [42, 63.901]
  - - [1024, 1024, 1, 14496]
    - [41, 63.474]
  - - [1024, 1024, 1, 14512]
    - [42, 63.804]
  - - [1024, 1024, 1, 14528]
    - [42, 64.089]
  - - [1024, 1024, 1, 14544]
    - [42, 63.778]
  - - [1024, 1024, 1, 14560]
    - [42, 63.801]
  - - [1024, 1024, 1, 14576]
    - [42, 63.682]
  - - [1024, 1024, 1, 14592]
    - [42, 64.037]
  - - [1024, 1024, 1, 14608]
    - [42, 64.107]
  - - [1024, 1024, 1, 14624]
    - [42, 63.963]
  - - [1024, 1024, 1, 14640]
    - [42, 63.82]
  - - [1024, 1024, 1, 14656]
    - [41, 63.961]
  - - [1024, 1024, 1, 14672]
    - [42, 64.126]
  - - [1024, 1024, 1, 14688]
    - [42, 63.935]
  - - [1024, 1024, 1, 14704]
    - [42, 64.029]
  - - [1024, 1024, 1, 14720]
    - [42, 64.027]
  - - [1024, 1024, 1, 14752]
    - [41, 64.214]
  - - [1024, 1024, 1, 14768]
    - [42, 64.142]
  - - [1024, 1024, 1, 14784]
    - [42, 64.14]
  - - [1024, 1024, 1, 14800]
    - [42, 63.326]
  - - [1024, 1024, 1, 14816]
    - [42, 64.232]
  - - [1024, 1024, 1, 14832]
    - [42, 63.903]
  - - [1024, 1024, 1, 14848]
    - [42, 64.159]
  - - [1024, 1024, 1, 14864]
    - [42, 64.299]
  - - [1024, 1024, 1, 14880]
    - [42, 64.063]
  - - [1024, 1024, 1, 14896]
    - [42, 64.062]
  - - [1024, 1024, 1, 14912]
    - [42, 64.154]
  - - [1024, 1024, 1, 14928]
    - [42, 63.943]
  - - [1024, 1024, 1, 14944]
    - [42, 64.409]
  - - [1024, 1024, 1, 14960]
    - [42, 64.011]
  - - [1024, 1024, 1, 14976]
    - [42, 64.01]
  - - [1024, 1024, 1, 14992]
    - [42, 64.194]
  - - [1024, 1024, 1, 15008]
    - [42, 64.403]
  - - [1024, 1024, 1, 15024]
    - [42, 64.262]
  - - [1024, 1024, 1, 15056]
    - [42, 64.212]
  - - [1024, 1024, 1, 15072]
    - [42, 64.28]
  - - [1024, 1024, 1, 15088]
    - [42, 64.326]
  - - [1024, 1024, 1, 15104]
    - [42, 64.51]
  - - [1024, 1024, 1, 15136]
    - [41, 64.553]
  - - [1024, 1024, 1, 15152]
    - [42, 64.482]
  - - [1024, 1024, 1, 15184]
    - [42, 64.317]
  - - [1024, 1024, 1, 15200]
    - [41, 64.316]
  - - [1024, 1024, 1, 15216]
    - [42, 64.36]
  - - [1024, 1024, 1, 15248]
    - [42, 64.403]
  - - [1024, 1024, 1, 15264]
    - [42, 64.379]
  - - [1024, 1024, 1, 15280]
    - [42, 64.354]
  - - [1024, 1024, 1, 15296]
    - [41, 64.422]
  - - [1024, 1024, 1, 15312]
    - [42, 64.581]
  - - [1024, 1024, 1, 15328]
    - [42, 64.488]
  - - [1024, 1024, 1, 15344]
    - [42, 64.303]
  - - [1024, 1024, 1, 15360]
    - [41, 64.324]
  - - [1024, 1024, 1, 15376]
    - [42, 64.391]
  - - [1024, 1024, 1, 15392]
    - [42, 64.504]
  - - [1024, 1024, 1, 15408]
    - [42, 64.617]
  - - [1024, 1024, 1, 15424]
    - [42, 64.684]
  - - [1024, 1024, 1, 15440]
    - [42, 64.751]
  - - [1024, 1024, 1, 15456]
    - [41, 64.452]
  - - [1024, 1024, 1, 15472]
    - [42, 64.337]
  - - [1024, 1024, 1, 15488]
    - [42, 64.609]
  - - [1024, 1024, 1, 15504]
    - [42, 64.357]
  - - [1024, 1024, 1, 15520]
    - [42, 65.018]
  - - [1024, 1024, 1, 15536]
    - [42, 64.49]
  - - [1024, 1024, 1, 15552]
    - [42, 64.967]
  - - [1024, 1024, 1, 15568]
    - [42, 64.555]
  - - [1024, 1024, 1, 15584]
    - [41, 64.576]
  - - [1024, 1024, 1, 15600]
    - [42, 64.778]
  - - [1024, 1024, 1, 15616]
    - [41, 64.868]
  - - [1024, 1024, 1, 15632]
    - [42, 64.957]
  - - [1024, 1024, 1, 15648]
    - [41, 64.727]
  - - [1024, 1024, 1, 15664]
    - [42, 64.884]
  - - [1024, 1024, 1, 15680]
    - [41, 64.814]
  - - [1024, 1024, 1, 15696]
    - [42, 64.632]
  - - [1024, 1024, 1, 15712]
    - [41, 64.901]
  - - [1024, 1024, 1, 15728]
    - [42, 65.036]
  - - [1024, 1024, 1, 15744]
    - [42, 64.875]
  - - [1024, 1024, 1, 15760]
    - [42, 64.335]
  - - [1024, 1024, 1, 15776]
    - [41, 64.826]
  - - [1024, 1024, 1, 15808]
    - [42, 64.89]
  - - [1024, 1024, 1, 15840]
    - [41, 64.594]
  - - [1024, 1024, 1, 15856]
    - [42, 63.563]
  - - [1024, 1024, 1, 15872]
    - [42, 65.288]
  - - [1024, 1024, 1, 15888]
    - [42, 64.947]
  - - [1024, 1024, 1, 15904]
    - [41, 65.035]
  - - [1024, 1024, 1, 15920]
    - [42, 64.409]
  - - [1024, 1024, 1, 15936]
    - [42, 64.896]
  - - [1024, 1024, 1, 15968]
    - [42, 65.027]
  - - [1024, 1024, 1, 15984]
    - [42, 64.58]
  - - [1024, 1024, 1, 16000]
    - [41, 64.911]
  - - [1024, 1024, 1, 16016]
    - [42, 64.62]
  - - [1024, 1024, 1, 16032]
    - [42, 65.108]
  - - [1024, 1024, 1, 16048]
    - [42, 65.016]
  - - [1024, 1024, 1, 16064]
    - [42, 65.081]
  - - [1024, 1024, 1, 16080]
    - [42, 64.439]
  - - [1024, 1024, 1, 16112]
    - [42, 65.298]
  - - [1024, 1024, 1, 16144]
    - [42, 65.048]
  - - [1024, 1024, 1, 16160]
    - [41, 64.869]
  - - [1024, 1024, 1, 16176]
    - [42, 64.452]
  - - [1024, 1024, 1, 16208]
    - [42, 65.173]
  - - [1024, 1024, 1, 16224]
    - [42, 64.928]
  - - [1024, 1024, 1, 16240]
    - [42, 65.036]
  - - [1024, 1024, 1, 16256]
    - [42, 65.144]
  - - [1024, 1024, 1, 16272]
    - [42, 64.834]
  - - [1024, 1024, 1, 16288]
    - [41, 65.294]
  - - [1024, 1024, 1, 16304]
    - [41, 63.927]
  - - [1024, 1024, 1, 16320]
    - [42, 64.938]
  - - [1024, 1024, 1, 16336]
    - [42, 64.958]
  - - [1024, 1024, 1, 16352]
    - [41, 65.329]
  - - [1024, 1024, 1, 16368]
    - [42, 65.151]
  - - [1024, 1024, 1, 16400]
    - [42, 64.41]
  - - [1024, 1024, 1, 16432]
    - [42, 64.859]
  - - [1024, 1024, 1, 16464]
    - [42, 64.877]
  - - [1024, 1024, 1, 16480]
    - [41, 65.597]
  - - [1024, 1024, 1, 16496]
    - [42, 65.286]
  - - [1024, 1024, 1, 16544]
    - [41, 65.192]
  - - [1024, 1024, 1, 16576]
    - [41, 65.384]
  - - [1024, 1024, 1, 16608]
    - [42, 65.554]
  - - [1024, 1024, 1, 16656]
    - [42, 65.026]
  - - [1024, 1024, 1, 16704]
    - [41, 65.192]
  - - [1024, 1024, 1, 16736]
    - [41, 65.317]
  - - [1024, 1024, 1, 16768]
    - [41, 65.464]
  - - [1024, 1024, 1, 16880]
    - [42, 65.792]
  - - [1024, 1024, 1, 16928]
    - [42, 65.525]
  - - [1024, 1024, 1, 17024]
    - [41, 65.703]
  - - [1024, 1024, 1, 1906]
    - [61, 33.064]
  - - [1024, 1024, 1, 2009]
    - [114, 33.381]
  - - [1024, 30528, 1, 2088]
    - [110, 78.433]
  - - [1024, 30528, 1, 2215]
    - [54, 78.903]
  - - [1024, 30528, 1, 2250]
    - [30, 78.631]
  - - [1024, 3072, 1, 11984]
    - [30, 74.331]
  - - [1024, 3072, 1, 12064]
    - [50, 74.644]
  - - [1024, 3072, 1, 12112]
    - [122, 74.319]
  - - [1024, 3072, 1, 12192]
    - [50, 74.719]
  - - [1024, 3072, 1, 12304]
    - [30, 74.402]
  - - [1024, 3072, 1, 12368]
    - [124, 74.332]
  - - [1024, 3072, 1, 12416]
    - [50, 74.798]
  - - [1024, 3072, 1, 13024]
    - [49, 74.921]
  - - [1024, 3072, 1, 13056]
    - [50, 74.91]
  - - [1024, 3072, 1, 13072]
    - [125, 74.568]
  - - [1024, 3072, 1, 13088]
    - [50, 74.973]
  - - [1024, 3072, 1, 13168]
    - [30, 74.802]
  - - [1024, 3072, 1, 13184]
    - [27, 74.929]
  - - [1024, 3072, 1, 13232]
    - [122, 74.854]
  - - [1024, 3072, 1, 13248]
    - [45, 74.956]
  - - [1024, 3072, 1, 13280]
    - [27, 74.934]
  - - [1024, 3072, 1, 13296]
    - [125, 74.573]
  - - [1024, 3072, 1, 13312]
    - [50, 74.936]
  - - [1024, 3072, 1, 13328]
    - [30, 74.835]
  - - [1024, 3072, 1, 13344]
    - [49, 74.937]
  - - [1024, 3072, 1, 13360]
    - [44, 74.507]
  - - [1024, 3072, 1, 13376]
    - [50, 74.974]
  - - [1024, 3072, 1, 13392]
    - [30, 74.957]
  - - [1024, 3072, 1, 13408]
    - [30, 74.976]
  - - [1024, 3072, 1, 13424]
    - [125, 74.665]
  - - [1024, 3072, 1, 13440]
    - [49, 75.107]
  - - [1024, 3072, 1, 13456]
    - [122, 75.031]
  - - [1024, 3072, 1, 13472]
    - [44, 75.061]
  - - [1024, 3072, 1, 13488]
    - [125, 74.716]
  - - [1024, 3072, 1, 13504]
    - [50, 75.004]
  - - [1024, 3072, 1, 13520]
    - [122, 74.881]
  - - [1024, 3072, 1, 13536]
    - [49, 74.982]
  - - [1024, 3072, 1, 13552]
    - [125, 74.616]
  - - [1024, 3072, 1, 13568]
    - [44, 75.144]
  - - [1024, 3072, 1, 13584]
    - [122, 75.013]
  - - [1024, 3072, 1, 13600]
    - [27, 74.938]
  - - [1024, 3072, 1, 13616]
    - [30, 74.933]
  - - [1024, 3072, 1, 13632]
    - [50, 74.974]
  - - [1024, 3072, 1, 13648]
    - [125, 74.923]
  - - [1024, 3072, 1, 13664]
    - [50, 75.08]
  - - [1024, 3072, 1, 13680]
    - [122, 75.168]
  - - [1024, 3072, 1, 13696]
    - [30, 75.047]
  - - [1024, 3072, 1, 13712]
    - [30, 74.995]
  - - [1024, 3072, 1, 13728]
    - [44, 75.083]
  - - [1024, 3072, 1, 13744]
    - [30, 74.985]
  - - [1024, 3072, 1, 13760]
    - [50, 75.096]
  - - [1024, 3072, 1, 13776]
    - [30, 74.689]
  - - [1024, 3072, 1, 13792]
    - [161, 75.016]
  - - [1024, 3072, 1, 13808]
    - [125, 74.851]
  - - [1024, 3072, 1, 13824]
    - [50, 75.064]
  - - [1024, 3072, 1, 13840]
    - [125, 74.875]
  - - [1024, 3072, 1, 13856]
    - [44, 75.18]
  - - [1024, 3072, 1, 13872]
    - [30, 75.117]
  - - [1024, 3072, 1, 13888]
    - [120, 75.181]
  - - [1024, 3072, 1, 13904]
    - [30, 75.244]
  - - [1024, 3072, 1, 13920]
    - [44, 75.113]
  - - [1024, 3072, 1, 13936]
    - [30, 75.062]
  - - [1024, 3072, 1, 13968]
    - [122, 74.814]
  - - [1024, 3072, 1, 13984]
    - [122, 75.115]
  - - [1024, 3072, 1, 14000]
    - [124, 74.827]
  - - [1024, 3072, 1, 14016]
    - [50, 75.071]
  - - [1024, 3072, 1, 14032]
    - [30, 75.009]
  - - [1024, 3072, 1, 14048]
    - [30, 75.368]
  - - [1024, 3072, 1, 14064]
    - [124, 74.797]
  - - [1024, 3072, 1, 14080]
    - [44, 75.119]
  - - [1024, 3072, 1, 14096]
    - [30, 75.035]
  - - [1024, 3072, 1, 14112]
    - [31, 75.075]
  - - [1024, 3072, 1, 14128]
    - [124, 74.868]
  - - [1024, 3072, 1, 14144]
    - [125, 75.2]
  - - [1024, 3072, 1, 14160]
    - [30, 74.925]
  - - [1024, 3072, 1, 14176]
    - [120, 75.122]
  - - [1024, 3072, 1, 14192]
    - [30, 75.173]
  - - [1024, 3072, 1, 14208]
    - [122, 75.213]
  - - [1024, 3072, 1, 15088]
    - [125, 75.368]
  - - [1024, 3072, 1, 16192]
    - [120, 75.588]
  - - [1024, 3072, 1, 28672]
    - [120, 77.499]
  - - [1024, 4096, 1, 14320]
    - [52, 77.353]
  - - [1024, 4096, 1, 14528]
    - [28, 78.406]
  - - [1024, 4096, 1, 15008]
    - [28, 77.781]
  - - [1024, 4096, 1, 15040]
    - [28, 78.066]
  - - [1024, 4096, 1, 28672]
    - [28, 80.639]
  - - [4096, 1024, 1, 13360]
    - [32, 76.349]
  - - [4096, 1024, 1, 13536]
    - [32, 76.806]
  - - [4096, 1024, 1, 13632]
    - [32, 76.325]
  - - [4096, 1024, 1, 13680]
    - [32, 75.458]
  - - [4096, 1024, 1, 13760]
    - [32, 76.282]
  - - [4096, 1024, 1, 13856]
    - [32, 76.26]
  - - [4096, 1024, 1, 13968]
    - [32, 76.644]
  - - [4096, 1024, 1, 14432]
    - [32, 76.456]
  - - [4096, 1024, 1, 14592]
    - [32, 76.855]
  - - [4096, 1024, 1, 14656]
    - [32, 76.35]
  - - [4096, 1024, 1, 15424]
    - [32, 77.128]
  - - [64, 112, 16, 112]
    - [9, 0.991]
  - - [64, 128, 16, 128]
    - [24, 1.322]
  - - [64, 288, 16, 288]
    - [36, 5.499]
  - - [64, 336, 16, 336]
    - [82, 6.292]
  - - [64, 352, 16, 352]
    - [62, 7.007]
  - - [64, 400, 16, 400]
    - [62, 7.956]
  - - [2400, 256, 1, 1024]
    - [115, 22.013]
  - - [2400, 256, 1, 512]
    - [61, 14.525]
  - - [256, 12840, 1, 1024]
    - [27, 54.019]
  - - [256, 12840, 1, 512]
    - [159, 39.175]
  - - [256, 2400, 1, 1024]
    - [61, 20.726]
  - - [256, 2400, 1, 512]
    - [61, 14.008]
  - - [256, 256, 1, 1024]
    - [20, 3.653]
  - - [256, 256, 1, 512]
    - [157, 2.173]
  - - [256, 3200, 1, 1024]
    - [67, 28.99]
  - - [256, 3200, 1, 512]
    - [115, 20.023]
  - - [256, 9630, 1, 1024]
    - [114, 45.433]
  - - [256, 9630, 1, 512]
    - [23, 34.516]
  - - [4800, 256, 1, 1024]
    - [61, 34.242]
  - - [4800, 256, 1, 512]
    - [115, 25.046]
  - - [642, 10, 1, 163840]
    - [139, 3.597]
  - - [642, 10, 1, 81920]
    - [139, 3.277]
  - - [642, 30, 1, 163840]
    - [139, 10.793]
  - - [642, 30, 1, 81920]
    - [139, 9.788]
  - - [15, 160, 1024, 642]
    - [78, 8.658]
  - - [15, 160, 512, 642]
    - [90, 7.879]
  - - [20, 160, 1024, 642]
    - [90, 11.791]
  - - [20, 160, 512, 642]
    - [90, 10.902]
- null
