library/src/blas3/Tensile/Logic/asm_full/aldebaran_104cu/aldebaran_Cijk_Ailk_Bjlk_DB.yaml
- {MinimumRequiredVersion: 4.32.1}
- aldebaran
- {Architecture: gfx90a, CUCount: 104}
- [Device 0050, Device 0051, Device 0052, Device 0054, Device 0062, Device 7400, Device
    SolutionIndex: 12
    SolutionNameMin: Cijk_Ailk_Bjlk_DB_MT128x128x8_MI16x16x4x1_SN_EPS0_GRVW2_IU1_PGR2_PLR3_SU32_SUS256_TT2_128_WG64_4_1_WGM5
    SolutionIndex: 13
    SolutionNameMin: Cijk_Ailk_Bjlk_DB_MT128x128x8_MI16x16x4x1_SN_EPS0_GRVW1_IU1_PGR2_PLR1_SU0_SUS256_TT2_128_WG64_4_1_WGM11
    SolutionIndex: 14
    SolutionNameMin: Cijk_Ailk_Bjlk_DB_MT128x128x8_MI16x16x4x1_SN_EPS0_GRVW2_IU1_PGR2_PLR1_SU0_SUS256_TT4_64_WG32_8_1_WGM5
    SolutionIndex: 15
    SolutionNameMin: Cijk_Ailk_Bjlk_DB_MT128x128x8_MI16x16x4x1_SN_EPS0_GRVW2_IU1_PGR2_PLR3_SU0_SUS256_TT2_128_WG64_4_1_WGM5
    SolutionIndex: 16
    SolutionNameMin: Cijk_Ailk_Bjlk_DB_MT128x128x8_MI16x16x4x1_SN_EPS0_GRVW2_IU1_PGR2_PLR3_SU0_SUS128_TT4_64_WG32_8_1_WGM11
    SolutionIndex: 17
    SolutionNameMin: Cijk_Ailk_Bjlk_DB_MT128x128x8_MI16x16x4x1_SN_EPS0_GRVW2_IU1_PGR2_PLR1_SU0_SUS256_TT2_128_WG64_4_1_WGM5
    SolutionIndex: 18
    SolutionNameMin: Cijk_Ailk_Bjlk_DB_MT128x128x8_MI16x16x4x1_SN_EPS0_GRVW2_IU1_PGR2_PLR3_SU32_SUS256_TT2_128_WG64_4_1_WGM11
    SolutionIndex: 19
    SolutionNameMin: Cijk_Ailk_Bjlk_DB_MT128x128x8_MI16x16x4x1_SN_EPS0_GRVW2_IU1_PGR2_PLR3_SU0_SUS256_TT4_64_WG32_8_1_WGM5
    SolutionIndex: 20
    SolutionNameMin: Cijk_Ailk_Bjlk_DB_MT128x128x8_MI16x16x4x1_SN_EPS0_GRVW1_IU1_PGR2_PLR1_SU0_SUS256_TT4_64_WG32_8_1_WGM5
    SolutionIndex: 21
    SolutionNameMin: Cijk_Ailk_Bjlk_DB_MT128x128x8_MI16x16x4x1_SN_EPS0_GRVW2_IU1_PGR2_PLR3_SU32_SUS128_TT2_128_WG64_4_1_WGM5
    SolutionIndex: 22
    SolutionNameMin: Cijk_Ailk_Bjlk_DB_MT128x128x8_MI16x16x4x1_SN_EPS0_GRVW1_IU1_PGR2_PLR3_SU0_SUS128_TT4_64_WG32_8_1_WGM11
    SolutionIndex: 23
    SolutionNameMin: Cijk_Ailk_Bjlk_DB_MT128x128x8_MI16x16x4x1_SN_EPS0_GRVW1_IU1_PGR2_PLR3_SU0_SUS256_TT2_128_WG64_4_1_WGM5
    SolutionIndex: 24
    SolutionNameMin: Cijk_Ailk_Bjlk_DB_MT128x128x8_MI16x16x4x1_SN_EPS0_GRVW1_IU1_PGR2_PLR1_SU0_SUS256_TT2_128_WG64_4_1_WGM5
    SolutionIndex: 25
    SolutionNameMin: Cijk_Ailk_Bjlk_DB_MT128x128x8_MI16x16x4x1_SN_EPS0_GRVW2_IU1_PGR2_PLR3_SU0_SUS128_TT2_128_WG64_4_1_WGM11
    SolutionIndex: 26
    SolutionNameMin: Cijk_Ailk_Bjlk_DB_MT128x128x8_MI16x16x4x1_SN_EPS0_GRVW2_IU1_PGR2_PLR1_SU32_SUS256_TT2_128_WG64_4_1_WGM5
    SolutionIndex: 27
    SolutionNameMin: Cijk_Ailk_Bjlk_DB_MT128x128x8_MI16x16x4x1_SN_EPS0_GRVW1_IU1_PGR2_PLR1_SU0_SUS128_TT4_64_WG32_8_1_WGM11
    SolutionIndex: 28
    SolutionNameMin: Cijk_Ailk_Bjlk_DB_MT128x128x8_MI16x16x4x1_SN_EPS0_GRVW1_IU1_PGR2_PLR3_SU0_SUS256_TT2_128_WG64_4_1_WGM11
    SolutionIndex: 29
    SolutionNameMin: Cijk_Ailk_Bjlk_DB_MT128x128x8_MI16x16x4x1_SN_EPS0_GRVW2_IU1_PGR2_PLR1_SU32_SUS256_TT2_128_WG64_4_1_WGM11
    SolutionIndex: 30
    SolutionNameMin: Cijk_Ailk_Bjlk_DB_MT128x128x8_MI16x16x4x1_SN_EPS0_GRVW2_IU1_PGR2_PLR3_SU32_SUS256_TT4_64_WG32_8_1_WGM11
    SolutionIndex: 31
    SolutionNameMin: Cijk_Ailk_Bjlk_DB_MT128x128x8_MI16x16x4x1_SN_EPS0_GRVW2_IU1_PGR2_PLR1_SU32_SUS256_TT4_64_WG32_8_1_WGM11
    SolutionIndex: 32
    SolutionNameMin: Cijk_Ailk_Bjlk_DB_MT128x128x8_MI16x16x4x1_SN_EPS0_GRVW2_IU1_PGR2_PLR1_SU0_SUS256_TT2_128_WG64_4_1_WGM11
    SolutionIndex: 33
    SolutionNameMin: Cijk_Ailk_Bjlk_DB_MT128x128x16_MI16x16x4x1_SN_EPS0_GRVW2_IU1_PGR2_PLR1_SU0_SUS256_TT4_64_WG32_8_1_WGM5
    SolutionIndex: 34
    SolutionNameMin: Cijk_Ailk_Bjlk_DB_MT128x128x16_MI16x16x4x1_SN_EPS0_GRVW2_IU2_PGR2_PLR1_SU0_SUS128_TT2_128_WG64_4_1_WGM5
    SolutionIndex: 35
    SolutionNameMin: Cijk_Ailk_Bjlk_DB_MT128x128x8_MI16x16x4x1_SN_EPS0_GRVW2_IU1_PGR2_PLR3_SU32_SUS128_TT4_64_WG32_8_1_WGM11
    SolutionIndex: 36
    SolutionNameMin: Cijk_Ailk_Bjlk_DB_MT128x128x8_MI16x16x4x1_SN_EPS0_GRVW2_IU1_PGR2_PLR3_SU32_SUS256_TT4_64_WG32_8_1_WGM5
    SolutionIndex: 37
    SolutionNameMin: Cijk_Ailk_Bjlk_DB_MT128x128x16_MI16x16x4x1_SN_EPS0_GRVW2_IU2_PGR2_PLR3_SU0_SUS128_TT2_128_WG64_4_1_WGM5
    SolutionIndex: 38
    SolutionNameMin: Cijk_Ailk_Bjlk_DB_MT128x128x8_MI16x16x4x1_SN_EPS0_GRVW2_IU1_PGR2_PLR1_SU32_SUS128_TT2_128_WG64_4_1_WGM5
    SolutionIndex: 39
    SolutionNameMin: Cijk_Ailk_Bjlk_DB_MT128x128x8_MI16x16x4x1_SN_EPS0_GRVW2_IU1_PGR2_PLR1_SU0_SUS128_TT4_64_WG32_8_1_WGM11
    SolutionIndex: 40
    SolutionNameMin: Cijk_Ailk_Bjlk_DB_MT128x128x8_MI16x16x4x1_SN_EPS0_GRVW1_IU1_PGR2_PLR3_SU0_SUS128_TT4_64_WG32_8_1_WGM5
    SolutionIndex: 41
    SolutionNameMin: Cijk_Ailk_Bjlk_DB_MT128x128x8_MI16x16x4x1_SN_EPS0_GRVW2_IU1_PGR2_PLR1_SU32_SUS128_TT2_128_WG64_4_1_WGM11
    SolutionIndex: 42
    SolutionNameMin: Cijk_Ailk_Bjlk_DB_MT128x128x8_MI16x16x4x1_SN_EPS0_GRVW2_IU1_PGR2_PLR1_SU32_SUS256_TT4_64_WG32_8_1_WGM5
    SolutionIndex: 43
    SolutionNameMin: Cijk_Ailk_Bjlk_DB_MT128x128x8_MI16x16x4x1_SN_EPS0_GRVW2_IU1_PGR2_PLR1_SU32_SUS128_TT4_64_WG32_8_1_WGM11
    SolutionIndex: 44
    SolutionNameMin: Cijk_Ailk_Bjlk_DB_MT128x128x16_MI16x16x4x1_SN_EPS0_GRVW2_IU2_PGR2_PLR3_SU32_SUS256_TT2_128_WG64_4_1_WGM5
    SolutionIndex: 45
    SolutionNameMin: Cijk_Ailk_Bjlk_DB_MT128x128x8_MI16x16x4x1_SN_EPS0_GRVW1_IU1_PGR2_PLR1_SU0_SUS256_TT8_32_WG16_16_1_WGM5
    SolutionIndex: 46
    SolutionNameMin: Cijk_Ailk_Bjlk_DB_MT128x128x8_MI16x16x4x1_SN_EPS0_GRVW2_IU1_PGR2_PLR3_SU32_SUS128_TT4_64_WG32_8_1_WGM5
    SolutionIndex: 47
    SolutionNameMin: Cijk_Ailk_Bjlk_DB_MT128x128x8_MI16x16x4x1_SN_EPS0_GRVW1_IU1_PGR2_PLR3_SU0_SUS256_TT8_32_WG16_16_1_WGM5
    SolutionIndex: 48
    SolutionNameMin: Cijk_Ailk_Bjlk_DB_MT128x128x8_MI16x16x4x1_SN_EPS0_GRVW2_IU1_PGR2_PLR1_SU32_SUS128_TT4_64_WG32_8_1_WGM5
    SolutionIndex: 49
    SolutionNameMin: Cijk_Ailk_Bjlk_DB_MT128x128x8_MI16x16x4x1_SN_EPS0_GRVW2_IU1_PGR2_PLR3_SU32_SUS128_TT2_128_WG64_4_1_WGM11
    SolutionIndex: 50
    SolutionNameMin: Cijk_Ailk_Bjlk_DB_MT128x128x8_MI16x16x4x1_SN_EPS0_GRVW1_IU1_PGR2_PLR1_SU32_SUS128_TT2_128_WG64_4_1_WGM11
    SolutionIndex: 51
    SolutionNameMin: Cijk_Ailk_Bjlk_DB_MT128x128x16_MI16x16x4x1_SN_EPS0_GRVW2_IU2_PGR2_PLR1_SU32_SUS128_TT2_128_WG64_4_1_WGM5
    SolutionIndex: 52
    SolutionNameMin: Cijk_Ailk_Bjlk_DB_MT128x128x8_MI16x16x4x1_SN_EPS0_GRVW1_IU1_PGR2_PLR3_SU32_SUS128_TT2_128_WG64_4_1_WGM11
    SolutionIndex: 55
    SolutionNameMin: Cijk_Ailk_Bjlk_DB_MT128x128x8_MI16x16x4x1_SN_EPS0_GRVW1_IU1_PGR2_PLR1_SU32_SUS256_TT2_128_WG64_4_1_WGM11
    SolutionIndex: 56
    SolutionNameMin: Cijk_Ailk_Bjlk_DB_MT128x128x16_MI16x16x4x1_SN_EPS0_GRVW2_IU2_PGR2_PLR1_SU32_SUS256_TT2_128_WG64_4_1_WGM5
    SolutionIndex: 57
    SolutionNameMin: Cijk_Ailk_Bjlk_DB_MT128x128x8_MI16x16x4x1_SN_EPS0_GRVW1_IU1_PGR2_PLR3_SU32_SUS128_TT4_64_WG32_8_1_WGM11
    SolutionIndex: 59
    SolutionNameMin: Cijk_Ailk_Bjlk_DB_MT128x128x8_MI16x16x4x1_SN_EPS0_GRVW1_IU1_PGR2_PLR1_SU32_SUS128_TT4_64_WG32_8_1_WGM11
    SolutionIndex: 60
    SolutionNameMin: Cijk_Ailk_Bjlk_DB_MT128x128x8_MI16x16x4x1_SN_EPS0_GRVW2_IU1_PGR2_PLR1_SU32_SUS256_TT8_32_WG16_16_1_WGM5
    SolutionIndex: 61
    SolutionNameMin: Cijk_Ailk_Bjlk_DB_MT128x128x8_MI16x16x4x1_SN_EPS0_GRVW2_IU1_PGR2_PLR3_SU32_SUS256_TT8_32_WG16_16_1_WGM5
    SolutionIndex: 62
    SolutionNameMin: Cijk_Ailk_Bjlk_DB_MT64x64x16_MI16x16x4x1_SN_AF0EM2_EPS0_GRVW2_IU2_PGR2_PLR3_SU0_SUS128_TT2_32_WG32_8_1_WGM5
    SolutionIndex: 63
    SolutionNameMin: Cijk_Ailk_Bjlk_DB_MT64x64x16_MI16x16x4x1_SN_AF0EM2_EPS0_GRVW2_IU2_PGR2_PLR1_SU0_SUS256_TT2_32_WG32_8_1_WGM5
    SolutionIndex: 64
    SolutionNameMin: Cijk_Ailk_Bjlk_DB_MT64x64x16_MI16x16x4x1_SN_AF0EM2_EPS0_GRVW2_IU2_PGR2_PLR1_SU0_SUS256_TT2_32_WG32_8_1_WGM11
    SolutionIndex: 65
    SolutionNameMin: Cijk_Ailk_Bjlk_DB_MT64x128x16_MI16x16x4x1_SN_AF0EM1_EPS0_GRVW2_IU2_PGR2_PLR1_SU0_SUS128_TT2_64_WG32_8_1_WGM11
    SolutionIndex: 66
    SolutionNameMin: Cijk_Ailk_Bjlk_DB_MT64x128x16_MI16x16x4x1_SN_AF0EM1_EPS0_GRVW2_IU2_PGR2_PLR1_SU0_SUS128_TT2_64_WG32_8_1_WGM5
    SolutionIndex: 67
    SolutionNameMin: Cijk_Ailk_Bjlk_DB_MT64x32x8_MI16x16x4x1_SN_AF0EM2_EPS0_GRVW2_IU2_PGR2_PLR1_SU0_SUS256_TT2_16_WG32_8_1_WGM5
    SolutionIndex: 68
    SolutionNameMin: Cijk_Ailk_Bjlk_DB_MT64x64x16_MI16x16x4x1_SN_AF0EM2_EPS0_GRVW2_IU2_PGR2_PLR3_SU0_SUS128_TT2_32_WG32_8_1_WGM11
    SolutionIndex: 69
    SolutionNameMin: Cijk_Ailk_Bjlk_DB_MT64x32x8_MI16x16x4x1_SN_AF0EM2_EPS0_GRVW2_IU2_PGR2_PLR1_SU0_SUS128_TT2_16_WG32_8_1_WGM11
    SolutionIndex: 70
    SolutionNameMin: Cijk_Ailk_Bjlk_DB_MT64x32x8_MI16x16x4x1_SN_AF0EM2_EPS0_GRVW1_IU2_PGR2_PLR1_SU0_SUS256_TT2_16_WG32_8_1_WGM5
    SolutionIndex: 71
    SolutionNameMin: Cijk_Ailk_Bjlk_DB_MT64x128x16_MI16x16x4x1_SN_AF0EM2_EPS0_GRVW2_IU2_PGR2_PLR3_SU0_SUS128_TT2_64_WG32_8_1_WGM5
    SolutionIndex: 72
    SolutionNameMin: Cijk_Ailk_Bjlk_DB_MT64x32x8_MI16x16x4x1_SN_AF0EM1_EPS0_GRVW1_IU2_PGR2_PLR1_SU0_SUS256_TT2_16_WG32_8_1_WGM11
    SolutionIndex: 73
    SolutionNameMin: Cijk_Ailk_Bjlk_DB_MT64x32x8_MI16x16x4x1_SN_AF0EM2_EPS0_GRVW2_IU2_PGR2_PLR1_SU32_SUS128_TT2_16_WG32_8_1_WGM5
    SolutionIndex: 74
    SolutionNameMin: Cijk_Ailk_Bjlk_DB_MT64x64x16_MI16x16x4x1_SN_AF0EM2_EPS1_GRVW2_IU2_PGR1_PLR3_SU0_SUS128_TT2_32_WG32_8_1_WGM5
    SolutionIndex: 75
    SolutionNameMin: Cijk_Ailk_Bjlk_DB_MT64x64x8_MI16x16x4x1_SN_AF0EM1_EPS1_GRVW2_IU2_PGR1_PLR1_SU0_SUS128_TT2_32_WG32_8_1_WGM5
    SolutionIndex: 76
    SolutionNameMin: Cijk_Ailk_Bjlk_DB_MT64x64x16_MI16x16x4x1_SN_AF0EM1_EPS0_GRVW2_IU2_PGR2_PLR1_SU0_SUS256_TT2_32_WG32_8_1_WGM5
    SolutionIndex: 77
    SolutionNameMin: Cijk_Ailk_Bjlk_DB_MT64x32x8_MI16x16x4x1_SN_AF0EM1_EPS0_GRVW1_IU2_PGR2_PLR1_SU32_SUS256_TT2_16_WG32_8_1_WGM5
    SolutionIndex: 78
    SolutionNameMin: Cijk_Ailk_Bjlk_DB_MT64x64x8_MI16x16x4x1_SN_AF0EM1_EPS0_GRVW1_IU2_PGR2_PLR1_SU0_SUS256_TT2_32_WG32_8_1_WGM11
    SolutionIndex: 79
    SolutionNameMin: Cijk_Ailk_Bjlk_DB_MT64x32x8_MI16x16x4x1_SN_AF0EM1_EPS0_GRVW1_IU2_PGR2_PLR1_SU32_SUS128_TT2_16_WG32_8_1_WGM11
    SolutionIndex: 80
    SolutionNameMin: Cijk_Ailk_Bjlk_DB_MT64x64x8_MI16x16x4x1_SN_AF0EM1_EPS0_GRVW1_IU2_PGR2_PLR1_SU0_SUS256_TT2_32_WG32_8_1_WGM5
    SolutionIndex: 81
    SolutionNameMin: Cijk_Ailk_Bjlk_DB_MT64x32x8_MI16x16x4x1_SN_AF0EM1_EPS0_GRVW2_IU2_PGR2_PLR1_SU32_SUS128_TT2_16_WG32_8_1_WGM5
    SolutionIndex: 82
    SolutionNameMin: Cijk_Ailk_Bjlk_DB_MT64x32x8_MI16x16x4x1_SN_AF0EM1_EPS0_GRVW2_IU2_PGR2_PLR1_SU32_SUS128_TT2_16_WG32_8_1_WGM11
    SolutionIndex: 83
    SolutionNameMin: Cijk_Ailk_Bjlk_DB_MT64x64x16_MI16x16x4x1_SN_AF0EM1_EPS1_GRVW2_IU2_PGR1_PLR3_SU0_SUS128_TT2_32_WG32_8_1_WGM5
    SolutionIndex: 84
    SolutionNameMin: Cijk_Ailk_Bjlk_DB_MT128x64x16_MI16x16x4x1_SN_AF0EM1_EPS0_GRVW2_IU2_PGR2_PLR3_SU32_SUS128_TT4_32_WG32_8_1_WGM5
    SolutionIndex: 85
    SolutionNameMin: Cijk_Ailk_Bjlk_DB_MT64x64x16_MI16x16x4x1_SN_AF0EM1_EPS0_GRVW1_IU2_PGR2_PLR1_SU0_SUS256_TT2_32_WG32_8_1_WGM5
    SolutionIndex: 86
    SolutionNameMin: Cijk_Ailk_Bjlk_DB_MT64x64x16_MI16x16x4x1_SN_AF0EM1_EPS0_GRVW2_IU2_PGR2_PLR3_SU0_SUS128_TT2_32_WG32_8_1_WGM5
    SolutionIndex: 88
    SolutionNameMin: Cijk_Ailk_Bjlk_DB_MT64x64x16_MI16x16x4x1_SN_AF0EM1_EPS1_GRVW2_IU2_PGR1_PLR1_SU0_SUS256_TT2_32_WG32_8_1_WGM11
    SolutionIndex: 89
    SolutionNameMin: Cijk_Ailk_Bjlk_DB_MT64x64x16_MI16x16x4x1_SN_AF0EM1_EPS1_GRVW2_IU2_PGR1_PLR1_SU0_SUS256_TT2_32_WG32_8_1_WGM5
    SolutionIndex: 90
    SolutionNameMin: Cijk_Ailk_Bjlk_DB_MT64x64x16_MI16x16x4x1_SN_AF0EM1_EPS0_GRVW2_IU2_PGR2_PLR1_SU0_SUS128_TT2_32_WG32_8_1_WGM11
    SolutionIndex: 91
    SolutionNameMin: Cijk_Ailk_Bjlk_DB_MT64x64x16_MI16x16x4x1_SN_AF0EM1_EPS1_GRVW2_IU2_PGR1_PLR3_SU0_SUS128_TT2_32_WG32_8_1_WGM11
    SolutionIndex: 92
    SolutionNameMin: Cijk_Ailk_Bjlk_DB_MT64x32x8_MI16x16x4x1_SN_AF0EM1_EPS0_GRVW1_IU2_PGR2_PLR1_SU32_SUS128_TT2_16_WG32_8_1_WGM5
    SolutionIndex: 93
    SolutionNameMin: Cijk_Ailk_Bjlk_DB_MT64x128x16_MI16x16x4x1_SN_AF0EM1_EPS0_GRVW2_IU2_PGR2_PLR3_SU0_SUS128_TT2_64_WG32_8_1_WGM5
    SolutionIndex: 94
    SolutionNameMin: Cijk_Ailk_Bjlk_DB_MT64x32x8_MI16x16x4x1_SN_AF0EM1_EPS0_GRVW2_IU2_PGR2_PLR1_SU0_SUS128_TT2_16_WG32_8_1_WGM5
    SolutionIndex: 95
    SolutionNameMin: Cijk_Ailk_Bjlk_DB_MT64x64x16_MI16x16x4x1_SN_AF0EM1_EPS0_GRVW2_IU2_PGR2_PLR3_SU0_SUS256_TT2_32_WG32_8_1_WGM11
    SolutionIndex: 96
    SolutionNameMin: Cijk_Ailk_Bjlk_DB_MT64x64x8_MI16x16x4x1_SN_AF0EM1_EPS0_GRVW2_IU2_PGR2_PLR1_SU0_SUS128_TT2_32_WG32_8_1_WGM5
    SolutionIndex: 97
    SolutionNameMin: Cijk_Ailk_Bjlk_DB_MT64x32x8_MI16x16x4x1_SN_AF0EM1_EPS0_GRVW1_IU2_PGR2_PLR1_SU0_SUS256_TT2_16_WG32_8_1_WGM5
    SolutionIndex: 98
    SolutionNameMin: Cijk_Ailk_Bjlk_DB_MT64x64x8_MI16x16x4x1_SN_AF0EM1_EPS0_GRVW2_IU2_PGR2_PLR1_SU0_SUS128_TT2_32_WG32_8_1_WGM11
    SolutionIndex: 99
    SolutionNameMin: Cijk_Ailk_Bjlk_DB_MT64x64x16_MI16x16x4x1_SN_AF0EM1_EPS0_GRVW1_IU2_PGR2_PLR3_SU0_SUS128_TT2_32_WG32_8_1_WGM5
    SolutionIndex: 100
    SolutionNameMin: Cijk_Ailk_Bjlk_DB_MT64x32x8_MI16x16x4x1_SN_AF0EM1_EPS0_GRVW2_IU2_PGR2_PLR1_SU0_SUS128_TT2_16_WG32_8_1_WGM11
    SolutionIndex: 101
    SolutionNameMin: Cijk_Ailk_Bjlk_DB_MT64x64x16_MI16x16x4x1_SN_AF0EM1_EPS1_GRVW2_IU2_PGR1_PLR1_SU32_SUS128_TT2_32_WG32_8_1_WGM11
    SolutionIndex: 102
    SolutionNameMin: Cijk_Ailk_Bjlk_DB_MT64x32x8_MI16x16x4x1_SN_AF0EM2_EPS0_GRVW2_IU2_PGR2_PLR1_SU32_SUS256_TT2_16_WG32_8_1_WGM11
    SolutionIndex: 103
    SolutionNameMin: Cijk_Ailk_Bjlk_DB_MT64x64x16_MI16x16x4x1_SN_AF0EM2_EPS0_GRVW1_IU2_PGR2_PLR1_SU0_SUS256_TT2_32_WG32_8_1_WGM5
    SolutionIndex: 104
    SolutionNameMin: Cijk_Ailk_Bjlk_DB_MT64x64x16_MI16x16x4x1_SN_AF0EM2_EPS1_GRVW2_IU2_PGR1_PLR1_SU0_SUS128_TT2_32_WG32_8_1_WGM5
    SolutionIndex: 105
    SolutionNameMin: Cijk_Ailk_Bjlk_DB_MT64x32x8_MI16x16x4x1_SN_AF0EM2_EPS0_GRVW1_IU2_PGR2_PLR1_SU0_SUS256_TT2_16_WG32_8_1_WGM11
    SolutionIndex: 106
    SolutionNameMin: Cijk_Ailk_Bjlk_DB_MT64x32x8_MI16x16x4x1_SN_AF0EM2_EPS0_GRVW1_IU2_PGR2_PLR1_SU32_SUS128_TT2_16_WG32_8_1_WGM5
    SolutionIndex: 107
    SolutionNameMin: Cijk_Ailk_Bjlk_DB_MT64x32x8_MI16x16x4x1_SN_AF0EM2_EPS0_GRVW2_IU2_PGR2_PLR1_SU32_SUS256_TT2_16_WG32_8_1_WGM5
    SolutionIndex: 108
    SolutionNameMin: Cijk_Ailk_Bjlk_DB_MT64x32x8_MI16x16x4x1_SN_AF0EM1_EPS0_GRVW1_IU2_PGR2_PLR1_SU32_SUS256_TT2_16_WG32_8_1_WGM11
    SolutionIndex: 110
    SolutionNameMin: Cijk_Ailk_Bjlk_DB_MT64x128x16_MI16x16x4x1_SN_AF0EM2_EPS0_GRVW2_IU2_PGR2_PLR3_SU0_SUS128_TT2_64_WG32_8_1_WGM11
    SolutionIndex: 118
    SolutionNameMin: Cijk_Ailk_Bjlk_DB_MT128x64x16_MI16x16x4x1_SN_AF0EM1_EPS0_GRVW2_IU2_PGR2_PLR1_SU0_SUS128_TT4_32_WG32_8_1_WGM5
    SolutionIndex: 124
    SolutionNameMin: Cijk_Ailk_Bjlk_DB_MT64x64x16_MI16x16x4x1_SN_AF0EM1_EPS0_GRVW2_IU2_PGR2_PLR3_SU32_SUS128_TT2_32_WG32_8_1_WGM11
    SolutionIndex: 126
    SolutionNameMin: Cijk_Ailk_Bjlk_DB_MT16x16x8_MI16x16x4x1_SN_TT1_16_WG16_4_1
    SolutionIndex: 127
    SolutionNameMin: Cijk_Ailk_Bjlk_DB_MT128x128x8_MI16x16x4x1_SN_EPS0_GRVW1_IU1_PGR2_PLR3_SU0_SUS256_TT2_128_WG64_4_1_WGM5
    SolutionIndex: 128
    SolutionNameMin: Cijk_Ailk_Bjlk_DB_MT128x128x8_MI16x16x4x1_SN_EPS0_GRVW1_IU1_PGR2_PLR3_SU0_SUS256_TT2_128_WG64_4_1_WGM11
    SolutionIndex: 129
    SolutionNameMin: Cijk_Ailk_Bjlk_DB_MT128x128x8_MI16x16x4x1_SN_EPS0_GRVW2_IU1_PGR2_PLR1_SU32_SUS128_TT2_128_WG64_4_1_WGM11
    SolutionIndex: 130
    SolutionNameMin: Cijk_Ailk_Bjlk_DB_MT128x128x16_MI16x16x4x1_SN_EPS0_GRVW2_IU2_PGR2_PLR1_SU0_SUS256_TT2_128_WG64_4_1_WGM5
    SolutionIndex: 131
    SolutionNameMin: Cijk_Ailk_Bjlk_DB_MT128x128x8_MI16x16x4x1_SN_EPS0_GRVW1_IU1_PGR2_PLR1_SU0_SUS256_TT2_128_WG64_4_1_WGM5
    SolutionIndex: 132
    SolutionNameMin: Cijk_Ailk_Bjlk_DB_MT128x128x8_MI16x16x4x1_SN_EPS0_GRVW1_IU1_PGR2_PLR1_SU0_SUS256_TT2_128_WG64_4_1_WGM11
    SolutionIndex: 133
    SolutionNameMin: Cijk_Ailk_Bjlk_DB_MT128x128x8_MI16x16x4x1_SN_EPS0_GRVW2_IU1_PGR2_PLR3_SU32_SUS128_TT2_128_WG64_4_1_WGM5
    SolutionIndex: 134
    SolutionNameMin: Cijk_Ailk_Bjlk_DB_MT128x128x8_MI16x16x4x1_SN_EPS0_GRVW2_IU1_PGR2_PLR1_SU32_SUS128_TT2_128_WG64_4_1_WGM5
    SolutionIndex: 135
    SolutionNameMin: Cijk_Ailk_Bjlk_DB_MT128x128x16_MI16x16x4x1_SN_EPS0_GRVW2_IU1_PGR2_PLR1_SU32_SUS128_TT2_128_WG64_4_1_WGM5
    SolutionIndex: 139
    SolutionNameMin: Cijk_Ailk_Bjlk_DB_MT128x128x16_MI16x16x4x1_SN_PLR5_SU0_SUS0_SSO4_WGM4
    SolutionIndex: 192
    SolutionNameMin: Cijk_Ailk_Bjlk_DB_MT64x64x16_MI16x16x4x1_SN_AMAS3_GRVW2_NEPBS2_NLCA1_NLCB1_PLR5_SU0_SUS0_SVW2_TT2_32_VW2_WG32_8_1_WGM5
    SolutionIndex: 193
    SolutionNameMin: Cijk_Ailk_Bjlk_DB_MT64x64x16_MI16x16x4x1_SN_AMAS3_GRVW2_NEPBS2_NLCA1_NLCB1_PLR5_SU0_SUS0_SVW2_TT2_32_VW2_WG32_8_1_WGM5
    SolutionIndex: 195
    SolutionNameMin: Cijk_Ailk_Bjlk_DB_MT64x64x16_MI16x16x4x1_SN_AMAS3_GRVW2_NEPBS2_NLCA1_NLCB1_PLR5_SU0_SUS0_SVW2_TT2_32_VW2_WG32_8_1_WGM4
    SolutionIndex: 199
    SolutionNameMin: Cijk_Ailk_Bjlk_DB_MT128x64x8_MI16x16x4x1_SN_AMAS3_GRVW2_NEPBS1_NLCA1_NLCB1_PLR3_SU0_SUS0_SVW2_TT2_64_VW2_WG64_4_1_WGM4
    SolutionIndex: 200
    SolutionNameMin: Cijk_Ailk_Bjlk_DB_MT64x96x16_MI16x16x4x1_SN_AMAS3_GRVW2_NEPBS2_NLCA1_NLCB3_PLR5_SU0_SUS0_SVW2_TT2_48_VW2_WG32_8_1_WGM8
    SolutionIndex: 202
    SolutionNameMin: Cijk_Ailk_Bjlk_DB_MT128x64x8_MI16x16x4x1_SN_AMAS3_GRVW2_NEPBS2_NLCA1_NLCB1_PLR3_SU0_SUS0_SVW2_TT2_64_VW2_WG64_4_1_WGM5
    SolutionIndex: 203
    SolutionNameMin: Cijk_Ailk_Bjlk_DB_MT128x128x8_MI16x16x4x1_SN_AMAS3_GRVW2_NEPBS2_NLCA1_NLCB1_PLR3_SU0_SUS0_SVW2_TT2_128_VW2_WG64_4_1_WGM5
    SolutionIndex: 204
    SolutionNameMin: Cijk_Ailk_Bjlk_DB_MT128x64x8_MI16x16x4x1_SN_AMAS3_GRVW2_NEPBS2_NLCA1_NLCB1_PLR3_SU32_SUS256_SVW2_TT2_64_VW2_WG64_4_1_WGM8
    SolutionIndex: 206
    SolutionNameMin: Cijk_Ailk_Bjlk_DB_MT128x64x8_MI16x16x4x1_SN_AMAS3_GRVW2_NEPBS2_NLCA1_NLCB1_PLR3_SU0_SUS0_SVW2_TT2_64_VW2_WG64_4_1_WGM4
    SolutionIndex: 207
    SolutionNameMin: Cijk_Ailk_Bjlk_DB_MT64x96x16_MI16x16x4x1_SN_AMAS3_GRVW2_NEPBS2_NLCA1_NLCB3_PLR5_SU0_SUS0_SVW2_TT2_48_VW2_WG32_8_1_WGM4
    SolutionIndex: 208
    SolutionNameMin: Cijk_Ailk_Bjlk_DB_MT128x64x8_MI16x16x4x1_SN_AMAS3_GRVW2_NEPBS2_NLCA1_NLCB1_PLR3_SU0_SUS0_SVW2_TT2_64_VW2_WG64_4_1_WGM8
    SolutionIndex: 213
    SolutionNameMin: Cijk_Ailk_Bjlk_DB_MT128x64x16_MI16x16x4x1_SN_AMAS3_GRVW2_NEPBS2_NLCA1_NLCB1_PLR5_SU32_SUS256_SVW2_TT2_64_VW2_WG64_4_1_WGM8
    SolutionIndex: 214
    SolutionNameMin: Cijk_Ailk_Bjlk_DB_MT128x64x16_MI16x16x4x1_SN_AMAS3_GRVW2_NEPBS2_NLCA1_NLCB1_PLR5_SU32_SUS128_SVW2_TT2_64_VW2_WG64_4_1_WGM8
    SolutionIndex: 218
    SolutionNameMin: Cijk_Ailk_Bjlk_DB_MT128x96x16_MI16x16x4x1_SN_AMAS3_GRVW2_NEPBS2_NLCA1_NLCB3_PLR5_SU32_SUS256_SVW2_TT2_96_VW2_WG64_4_1_WGM4
    SolutionIndex: 220
    SolutionNameMin: Cijk_Ailk_Bjlk_DB_MT128x96x16_MI16x16x4x1_SN_AMAS3_GRVW2_NEPBS2_NLCA1_NLCB3_PLR5_SU0_SUS0_SVW2_TT2_96_VW2_WG64_4_1_WGM5
    SolutionIndex: 221
    SolutionNameMin: Cijk_Ailk_Bjlk_DB_MT128x96x16_MI16x16x4x1_SN_AMAS3_GRVW2_NEPBS2_NLCA1_NLCB3_PLR5_SU32_SUS128_SVW2_TT2_96_VW2_WG64_4_1_WGM5
    SolutionIndex: 222
    SolutionNameMin: Cijk_Ailk_Bjlk_DB_MT128x128x8_MI16x16x4x1_SN_AMAS3_GRVW2_NEPBS1_NLCA1_NLCB2_PLR3_SU0_SUS0_SVW2_TT2_128_VW2_WG64_4_1_WGM5
    SolutionIndex: 223
    SolutionNameMin: Cijk_Ailk_Bjlk_DB_MT128x96x8_MI16x16x4x1_SN_AMAS3_GRVW1_NEPBS2_NLCA1_NLCB3_PLR3_SU32_SUS256_SVW2_TT2_96_VW2_WG64_4_1_WGM5
    SolutionIndex: 225
    SolutionNameMin: Cijk_Ailk_Bjlk_DB_MT128x128x8_MI16x16x4x1_SN_AMAS3_GRVW2_NEPBS2_NLCA2_NLCB1_PLR3_SU0_SUS0_SVW2_TT2_128_VW2_WG64_4_1_WGM8
    SolutionIndex: 226
    SolutionNameMin: Cijk_Ailk_Bjlk_DB_MT128x64x8_MI16x16x4x1_SN_AMAS3_GRVW2_NEPBS2_NLCA1_NLCB1_PLR3_SU32_SUS256_SVW2_TT2_64_VW2_WG64_4_1_WGM8
    SolutionIndex: 227
    SolutionNameMin: Cijk_Ailk_Bjlk_DB_MT128x64x8_MI16x16x4x1_SN_AMAS3_GRVW2_NEPBS2_NLCA1_NLCB1_PLR3_SU32_SUS128_SVW2_TT2_64_VW2_WG64_4_1_WGM8
    SolutionIndex: 229
    SolutionNameMin: Cijk_Ailk_Bjlk_DB_MT128x64x8_MI16x16x4x1_SN_AMAS3_GRVW2_NEPBS2_NLCA1_NLCB1_PLR3_SU0_SUS0_SVW2_TT2_64_VW2_WG64_4_1_WGM8
    SolutionIndex: 230
    SolutionNameMin: Cijk_Ailk_Bjlk_DB_MT128x96x8_MI16x16x4x1_SN_AMAS3_GRVW1_NEPBS2_NLCA1_NLCB3_PLR3_SU32_SUS128_SVW2_TT2_96_VW2_WG64_4_1_WGM4
    SolutionIndex: 231
    SolutionNameMin: Cijk_Ailk_Bjlk_DB_MT128x96x8_MI16x16x4x1_SN_AMAS3_GRVW1_NEPBS2_NLCA1_NLCB3_PLR3_SU32_SUS256_SVW2_TT2_96_VW2_WG64_4_1_WGM4
    SolutionIndex: 232
    SolutionNameMin: Cijk_Ailk_Bjlk_DB_MT128x128x8_MI16x16x4x1_SN_AMAS3_GRVW2_NEPBS2_NLCA2_NLCB1_PLR3_SU32_SUS128_SVW2_TT2_128_VW2_WG64_4_1_WGM5
    SolutionIndex: 233
    SolutionNameMin: Cijk_Ailk_Bjlk_DB_MT128x64x8_MI16x16x4x1_SN_AMAS3_GRVW2_NEPBS1_NLCA1_NLCB1_PLR3_SU0_SUS0_SVW2_TT2_64_VW2_WG64_4_1_WGM8
    SolutionIndex: 234
    SolutionNameMin: Cijk_Ailk_Bjlk_DB_MT128x128x8_MI16x16x4x1_SN_AMAS3_GRVW2_NEPBS2_NLCA1_NLCB2_PLR3_SU0_SUS0_SVW2_TT2_128_VW2_WG64_4_1_WGM5
    SolutionIndex: 235
    SolutionNameMin: Cijk_Ailk_Bjlk_DB_MT128x128x8_MI16x16x4x1_SN_AMAS3_GRVW2_NEPBS2_NLCA1_NLCB1_PLR3_SU32_SUS128_SVW2_TT2_128_VW2_WG64_4_1_WGM8
    SolutionIndex: 236
    SolutionNameMin: Cijk_Ailk_Bjlk_DB_MT128x96x8_MI16x16x4x1_SN_AMAS3_GRVW1_NEPBS2_NLCA1_NLCB3_PLR3_SU32_SUS256_SVW2_TT2_96_VW2_WG64_4_1_WGM8
    SolutionIndex: 237
    SolutionNameMin: Cijk_Ailk_Bjlk_DB_MT128x96x8_MI16x16x4x1_SN_AMAS3_GRVW1_NEPBS2_NLCA1_NLCB3_PLR3_SU32_SUS128_SVW2_TT2_96_VW2_WG64_4_1_WGM5
    SolutionIndex: 238
    SolutionNameMin: Cijk_Ailk_Bjlk_DB_MT128x96x8_MI16x16x4x1_SN_AMAS3_GRVW1_NEPBS1_NLCA1_NLCB3_PLR3_SU32_SUS128_SVW2_TT2_96_VW2_WG64_4_1_WGM4
    SolutionIndex: 239
    SolutionNameMin: Cijk_Ailk_Bjlk_DB_MT128x96x8_MI16x16x4x1_SN_AMAS3_GRVW1_NEPBS1_NLCA1_NLCB3_PLR3_SU0_SUS0_SVW2_TT2_96_VW2_WG64_4_1_WGM5
    SolutionIndex: 240
    SolutionNameMin: Cijk_Ailk_Bjlk_DB_MT128x128x16_MI16x16x4x1_SN_AMAS3_GRVW2_NEPBS2_NLCA1_NLCB2_PLR5_SU32_SUS256_SVW2_TT2_128_VW2_WG64_4_1_WGM4
    SolutionIndex: 241
    SolutionNameMin: Cijk_Ailk_Bjlk_DB_MT128x128x16_MI16x16x4x1_SN_AMAS3_GRVW2_NEPBS2_NLCA4_NLCB1_PLR5_SU32_SUS256_SVW2_TT2_128_VW2_WG64_4_1_WGM4
    SolutionIndex: 242
    SolutionNameMin: Cijk_Ailk_Bjlk_DB_MT128x128x16_MI16x16x4x1_SN_AMAS3_GRVW2_NEPBS2_NLCA1_NLCB1_PLR5_SU32_SUS256_SVW2_TT2_128_VW2_WG64_4_1_WGM5
    SolutionIndex: 243
    SolutionNameMin: Cijk_Ailk_Bjlk_DB_MT128x128x16_MI16x16x4x1_SN_AMAS3_GRVW2_NEPBS2_NLCA4_NLCB1_PLR5_SU32_SUS128_SVW2_TT2_128_VW2_WG64_4_1_WGM8
    SolutionIndex: 244
    SolutionNameMin: Cijk_Ailk_Bjlk_DB_MT128x128x16_MI16x16x4x1_SN_AMAS3_GRVW2_NEPBS2_NLCA1_NLCB2_PLR5_SU0_SUS0_SVW2_TT2_128_VW2_WG64_4_1_WGM4
    SolutionIndex: 245
    SolutionNameMin: Cijk_Ailk_Bjlk_DB_MT128x128x16_MI16x16x4x1_SN_AMAS3_GRVW2_NEPBS2_NLCA2_NLCB1_PLR5_SU32_SUS128_SVW2_TT2_128_VW2_WG64_4_1_WGM4
    SolutionIndex: 246
    SolutionNameMin: Cijk_Ailk_Bjlk_DB_MT128x96x8_MI16x16x4x1_SN_AMAS3_GRVW1_NEPBS1_NLCA1_NLCB3_PLR3_SU0_SUS0_SVW2_TT2_96_VW2_WG64_4_1_WGM4
    SolutionIndex: 248
    SolutionNameMin: Cijk_Ailk_Bjlk_DB_MT128x128x16_MI16x16x4x1_SN_AMAS3_GRVW2_NEPBS2_NLCA4_NLCB1_PLR5_SU32_SUS256_SVW2_TT2_128_VW2_WG64_4_1_WGM5
    SolutionIndex: 249
    SolutionNameMin: Cijk_Ailk_Bjlk_DB_MT128x128x16_MI16x16x4x1_SN_AMAS3_GRVW2_NEPBS2_NLCA2_NLCB2_PLR5_SU32_SUS128_SVW2_TT2_128_VW2_WG64_4_1_WGM5
    SolutionIndex: 250
    SolutionNameMin: Cijk_Ailk_Bjlk_DB_MT128x128x16_MI16x16x4x1_SN_AMAS3_GRVW2_NEPBS2_NLCA4_NLCB2_PLR5_SU32_SUS256_SVW2_TT2_128_VW2_WG64_4_1_WGM8
    SolutionIndex: 251
    SolutionNameMin: Cijk_Ailk_Bjlk_DB_MT128x128x16_MI16x16x4x1_SN_AMAS3_GRVW2_NEPBS2_NLCA1_NLCB1_PLR5_SU32_SUS128_SVW2_TT2_128_VW2_WG64_4_1_WGM5
    SolutionIndex: 256
    SolutionNameMin: Cijk_Ailk_Bjlk_DB_MT128x128x16_MI16x16x4x1_SN_AMAS3_GRVW2_NEPBS2_NLCA2_NLCB1_PLR5_SU32_SUS256_SVW2_TT2_128_VW2_WG64_4_1_WGM8
    SolutionIndex: 258
    SolutionNameMin: Cijk_Ailk_Bjlk_DB_MT128x128x16_MI16x16x4x1_SN_AMAS3_GRVW2_NEPBS2_NLCA4_NLCB1_PLR5_SU32_SUS128_SVW2_TT2_128_VW2_WG64_4_1_WGM4
    SolutionIndex: 261
    SolutionNameMin: Cijk_Ailk_Bjlk_DB_MT128x128x16_MI16x16x4x1_SN_AMAS3_GRVW2_NEPBS2_NLCA1_NLCB2_PLR5_SU32_SUS128_SVW2_TT2_128_VW2_WG64_4_1_WGM8
    SolutionIndex: 272
    SolutionNameMin: Cijk_Ailk_Bjlk_DB_MT128x128x16_MI16x16x4x1_SN_AMAS3_GRVW2_NEPBS2_NLCA1_NLCB4_PLR5_SU32_SUS128_SVW2_TT2_128_VW2_WG64_4_1_WGM8
    SolutionIndex: 273
    SolutionNameMin: Cijk_Ailk_Bjlk_DB_MT128x128x16_MI16x16x4x1_SN_AMAS3_GRVW2_NEPBS2_NLCA2_NLCB4_PLR5_SU32_SUS128_SVW2_TT2_128_VW2_WG64_4_1_WGM8
    SolutionIndex: 276
    SolutionNameMin: Cijk_Ailk_Bjlk_DB_MT128x128x16_MI16x16x4x1_SN_AMAS3_GRVW2_NEPBS2_NLCA1_NLCB4_PLR5_SU32_SUS256_SVW2_TT2_128_VW2_WG64_4_1_WGM8
    SolutionIndex: 279
    SolutionNameMin: Cijk_Ailk_Bjlk_DB_MT64x64x16_MI16x16x4x1_SN_AMAS3_GRVW2_NEPBS2_NLCA1_NLCB1_PLR5_SU32_SUS256_SVW2_TT2_32_VW2_WG32_8_1_WGM4
    SolutionIndex: 280
    SolutionNameMin: Cijk_Ailk_Bjlk_DB_MT64x96x16_MI16x16x4x1_SN_AMAS3_GRVW2_NEPBS2_NLCA1_NLCB3_PLR5_SU0_SUS0_SVW2_TT2_48_VW2_WG32_8_1_WGM5
    SolutionIndex: 281
    SolutionNameMin: Cijk_Ailk_Bjlk_DB_MT64x96x16_MI16x16x4x1_SN_AMAS3_GRVW2_NEPBS2_NLCA1_NLCB3_PLR5_SU32_SUS256_SVW2_TT2_48_VW2_WG32_8_1_WGM8
    SolutionIndex: 282
    SolutionNameMin: Cijk_Ailk_Bjlk_DB_MT128x64x16_MI16x16x4x1_SN_AMAS3_GRVW2_NEPBS2_NLCA1_NLCB1_PLR5_SU0_SUS0_SVW2_TT2_64_VW2_WG64_4_1_WGM5
    SolutionIndex: 283
    SolutionNameMin: Cijk_Ailk_Bjlk_DB_MT128x64x16_MI16x16x4x1_SN_AMAS3_GRVW2_NEPBS2_NLCA1_NLCB1_PLR5_SU32_SUS256_SVW2_TT2_64_VW2_WG64_4_1_WGM4
    SolutionIndex: 284
    SolutionNameMin: Cijk_Ailk_Bjlk_DB_MT128x128x8_MI16x16x4x1_SN_AMAS3_GRVW2_NEPBS2_NLCA1_NLCB1_PLR3_SU0_SUS0_SVW2_TT2_128_VW2_WG64_4_1_WGM4
    SolutionIndex: 285
    SolutionNameMin: Cijk_Ailk_Bjlk_DB_MT128x96x16_MI16x16x4x1_SN_AMAS3_GRVW2_NEPBS2_NLCA1_NLCB3_PLR5_SU32_SUS256_SVW2_TT2_96_VW2_WG64_4_1_WGM5
    SolutionIndex: 286
    SolutionNameMin: Cijk_Ailk_Bjlk_DB_MT128x128x16_MI16x16x4x1_SN_AMAS3_GRVW2_NEPBS2_NLCA2_NLCB2_PLR5_SU32_SUS128_SVW2_TT2_128_VW2_WG64_4_1_WGM4
    SolutionIndex: 293
    SolutionNameMin: Cijk_Ailk_Bjlk_DB_MT128x128x8_MI16x16x4x1_SN_AMAS3_GRVW2_NEPBS2_NLCA1_NLCB2_PLR3_SU32_SUS256_SVW2_TT2_128_VW2_WG64_4_1_WGM4
    SolutionIndex: 296
    SolutionNameMin: Cijk_Ailk_Bjlk_DB_MT128x128x16_MI16x16x4x1_SN_AMAS3_GRVW2_NEPBS2_NLCA2_NLCB1_PLR5_SU32_SUS256_SVW2_TT2_128_VW2_WG64_4_1_WGM4
    SolutionIndex: 306
    SolutionNameMin: Cijk_Ailk_Bjlk_DB_MT128x64x8_MI16x16x4x1_SN_AMAS3_GRVW2_NEPBS1_NLCA1_NLCB1_PLR3_SU32_SUS256_SVW2_TT2_64_VW2_WG64_4_1_WGM8
    SolutionIndex: 320
    SolutionNameMin: Cijk_Ailk_Bjlk_DB_MT64x96x16_MI16x16x4x1_SN_AMAS3_GRVW2_NEPBS2_NLCA1_NLCB3_PLR5_SU32_SUS128_SVW2_TT2_48_VW2_WG32_8_1_WGM5
    SolutionIndex: 323
    SolutionNameMin: Cijk_Ailk_Bjlk_DB_MT128x96x16_MI16x16x4x1_SN_AMAS3_GRVW2_NEPBS2_NLCA1_NLCB3_PLR5_SU0_SUS0_SVW2_TT2_96_VW2_WG64_4_1_WGM4
    SolutionIndex: 324
    SolutionNameMin: Cijk_Ailk_Bjlk_DB_MT128x96x16_MI16x16x4x1_SN_AMAS3_GRVW2_NEPBS2_NLCA1_NLCB3_PLR5_SU32_SUS128_SVW2_TT2_96_VW2_WG64_4_1_WGM4
    SolutionIndex: 325
    SolutionNameMin: Cijk_Ailk_Bjlk_DB_MT128x96x8_MI16x16x4x1_SN_AMAS3_GRVW1_NEPBS1_NLCA1_NLCB3_PLR3_SU0_SUS0_SVW2_TT2_96_VW2_WG64_4_1_WGM8
    SolutionIndex: 326
    SolutionNameMin: Cijk_Ailk_Bjlk_DB_MT128x128x8_MI16x16x4x1_SN_AMAS3_GRVW2_NEPBS2_NLCA2_NLCB2_PLR3_SU32_SUS256_SVW2_TT2_128_VW2_WG64_4_1_WGM8
    SolutionIndex: 327
    SolutionNameMin: Cijk_Ailk_Bjlk_DB_MT128x128x16_MI16x16x4x1_SN_AMAS3_GRVW2_NEPBS2_NLCA1_NLCB2_PLR5_SU32_SUS256_SVW2_TT2_128_VW2_WG64_4_1_WGM8
    SolutionIndex: 328
    SolutionNameMin: Cijk_Ailk_Bjlk_DB_MT128x64x8_MI16x16x4x1_SN_AMAS3_GRVW2_NEPBS2_NLCA1_NLCB1_PLR3_SU0_SUS0_SVW2_TT2_64_VW2_WG64_4_1_WGM5
    SolutionIndex: 329
    SolutionNameMin: Cijk_Ailk_Bjlk_DB_MT128x96x8_MI16x16x4x1_SN_AMAS3_GRVW1_NEPBS1_NLCA1_NLCB3_PLR3_SU32_SUS128_SVW2_TT2_96_VW2_WG64_4_1_WGM8
    SolutionIndex: 351
    SolutionNameMin: Cijk_Ailk_Bjlk_DB_MT64x64x16_MI16x16x4x1_SN_AMAS3_GRVW1_NEPBS2_NLCA1_NLCB1_PLR5_SU0_SUS0_SVW2_TT2_32_VW2_WG32_8_1_WGM8
    SolutionIndex: 352
    SolutionNameMin: Cijk_Ailk_Bjlk_DB_MT128x64x16_MI16x16x4x1_SN_AMAS3_GRVW2_NEPBS2_NLCA1_NLCB1_PLR5_SU0_SUS0_SVW2_TT2_64_VW2_WG64_4_1_WGM4
    SolutionIndex: 353
    SolutionNameMin: Cijk_Ailk_Bjlk_DB_MT128x96x8_MI16x16x4x1_SN_AMAS3_GRVW1_NEPBS2_NLCA1_NLCB3_PLR3_SU0_SUS0_SVW2_TT2_96_VW2_WG64_4_1_WGM5
    SolutionIndex: 354
    SolutionNameMin: Cijk_Ailk_Bjlk_DB_MT128x64x8_MI16x16x4x1_SN_AMAS3_GRVW2_NEPBS2_NLCA1_NLCB1_PLR3_SU0_SUS0_SVW2_TT2_64_VW2_WG64_4_1_WGM4
    SolutionIndex: 355
    SolutionNameMin: Cijk_Ailk_Bjlk_DB_MT128x96x8_MI16x16x4x1_SN_AMAS3_GRVW1_NEPBS2_NLCA1_NLCB3_PLR3_SU0_SUS0_SVW2_TT2_96_VW2_WG64_4_1_WGM8
    SolutionIndex: 356
    SolutionNameMin: Cijk_Ailk_Bjlk_DB_MT128x96x8_MI16x16x4x1_SN_AMAS3_GRVW1_NEPBS2_NLCA1_NLCB3_PLR3_SU0_SUS0_SVW2_TT2_96_VW2_WG64_4_1_WGM4
    SolutionIndex: 357
    SolutionNameMin: Cijk_Ailk_Bjlk_DB_MT128x96x8_MI16x16x4x1_SN_AMAS3_GRVW1_NEPBS2_NLCA1_NLCB3_PLR3_SU32_SUS128_SVW2_TT2_96_VW2_WG64_4_1_WGM8
    SolutionIndex: 358
    SolutionNameMin: Cijk_Ailk_Bjlk_DB_MT128x128x16_MI16x16x4x1_SN_AMAS3_GRVW2_NEPBS2_NLCA2_NLCB1_PLR5_SU0_SUS0_SVW2_TT2_128_VW2_WG64_4_1_WGM5
    SolutionIndex: 359
    SolutionNameMin: Cijk_Ailk_Bjlk_DB_MT128x128x16_MI16x16x4x1_SN_AMAS3_GRVW2_NEPBS2_NLCA1_NLCB1_PLR5_SU32_SUS256_SVW2_TT2_128_VW2_WG64_4_1_WGM8
    SolutionIndex: 360
    SolutionNameMin: Cijk_Ailk_Bjlk_DB_MT128x128x16_MI16x16x4x1_SN_AMAS3_GRVW2_NEPBS2_NLCA2_NLCB1_PLR5_SU32_SUS128_SVW2_TT2_128_VW2_WG64_4_1_WGM8
    SolutionIndex: 361
    SolutionNameMin: Cijk_Ailk_Bjlk_DB_MT128x128x16_MI16x16x4x1_SN_AMAS3_GRVW2_NEPBS2_NLCA2_NLCB1_PLR5_SU32_SUS128_SVW2_TT2_128_VW2_WG64_4_1_WGM5
    SolutionIndex: 362
    SolutionNameMin: Cijk_Ailk_Bjlk_DB_MT128x128x16_MI16x16x4x1_SN_AMAS3_GRVW2_NEPBS2_NLCA1_NLCB2_PLR5_SU32_SUS256_SVW2_TT2_128_VW2_WG64_4_1_WGM5
    SolutionIndex: 364
    SolutionNameMin: Cijk_Ailk_Bjlk_DB_MT128x128x16_MI16x16x4x1_SN_AMAS3_GRVW2_NEPBS2_NLCA4_NLCB1_PLR5_SU32_SUS256_SVW2_TT2_128_VW2_WG64_4_1_WGM8
    SolutionIndex: 393
    SolutionNameMin: Cijk_Ailk_Bjlk_DB_MT128x128x16_MI16x16x4x1_SN_1LDSB1_DTVA1_NEPBS0_WGM11
    SolutionIndex: 394
    SolutionNameMin: Cijk_Ailk_Bjlk_DB_MT128x128x16_MI16x16x4x1_SN_1LDSB1_DTVA1_NEPBS1_WGM11
- - - [38144, 38144, 1, 256]
    - [12, 74.893]
  - - [29568, 128, 1, 384]
    - [233, 55.411]
  - - [30848, 128, 1, 256]
    - [354, 47.977]
  - - [25728, 128, 1, 384]
    - [28, 57.278]
  - - [32256, 32256, 1, 256]
    - [14, 75.584]
  - - [7680, 7680, 1, 256]
    - [20, 73.456]
  - - [41984, 41984, 1, 256]
    - [15, 75.197]
  - - [40448, 40448, 1, 256]
    - [14, 74.937]
  - - [25728, 128, 1, 256]
    - [16, 49.099]
  - - [64, 64, 1, 64]
    - [126, 0.117]
  - - [15104, 15104, 1, 256]
    - [17, 75.487]
  - - [17280, 17280, 1, 384]
    - [17, 90.896]
  - - [34688, 128, 1, 384]
    - [229, 56.958]
  - - [27392, 27392, 1, 256]
    - [18, 74.926]
  - - [6528, 128, 1, 256]
    - [62, 37.791]
  - - [35328, 35328, 1, 256]
    - [19, 75.386]
  - - [18432, 18432, 1, 384]
    - [17, 89.766]
  - - [31232, 31232, 1, 256]
    - [35, 75.543]
  - - [7808, 128, 1, 256]
    - [63, 35.357]
  - - [38400, 38400, 1, 384]
    - [15, 90.583]
  - - [16128, 16128, 1, 256]
    - [15, 75.578]
  - - [9472, 9472, 1, 256]
    - [17, 74.227]
  - - [21888, 21888, 1, 384]
    - [18, 89.215]
  - - [38656, 38656, 1, 256]
    - [19, 74.685]
  - - [20224, 20224, 1, 256]
    - [15, 75.749]
  - - [8960, 8960, 1, 256]
    - [20, 73.31]
  - - [29952, 29952, 1, 384]
    - [17, 90.917]
  - - [36864, 36864, 1, 384]
    - [21, 87.926]
  - - [33408, 33408, 1, 384]
    - [17, 90.847]
  - - [20608, 128, 1, 384]
    - [229, 50.176]
  - - [23424, 23424, 1, 384]
    - [17, 91.11]
  - - [4864, 4864, 1, 256]
    - [236, 77.05]
  - - [21504, 21504, 1, 384]
    - [29, 89.214]
  - - [25600, 25600, 1, 256]
    - [17, 75.967]
  - - [40960, 40960, 1, 256]
    - [38, 66.623]
  - - [19200, 19200, 1, 384]
    - [17, 90.96]
  - - [64, 1, 1, 64]
    - [126, 0.002]
  - - [25088, 25088, 1, 256]
    - [30, 75.905]
  - - [41728, 41728, 1, 256]
    - [18, 73.787]
  - - [35840, 35840, 1, 256]
    - [15, 75.487]
  - - [34560, 34560, 1, 256]
    - [17, 75.1]
  - - [26368, 26368, 1, 256]
    - [15, 75.32]
  - - [5888, 5888, 1, 256]
    - [235, 81.82]
  - - [28032, 28032, 1, 384]
    - [17, 91.053]
  - - [42496, 42496, 1, 256]
    - [18, 75.137]
  - - [27008, 128, 1, 256]
    - [279, 44.517]
  - - [38400, 38400, 1, 256]
    - [15, 75.384]
  - - [11008, 11008, 1, 256]
    - [47, 73.892]
  - - [32000, 32000, 1, 256]
    - [17, 75.005]
  - - [37248, 37248, 1, 384]
    - [15, 90.692]
  - - [10496, 10496, 1, 256]
    - [15, 74.439]
  - - [16640, 16640, 1, 256]
    - [15, 75.73]
  - - [24960, 24960, 1, 384]
    - [15, 91.209]
  - - [18688, 18688, 1, 256]
    - [17, 75.593]
  - - [22272, 22272, 1, 384]
    - [25, 91.067]
  - - [15488, 128, 1, 256]
    - [192, 38.387]
  - - [28416, 28416, 1, 384]
    - [15, 90.867]
  - - [3840, 3840, 1, 256]
    - [237, 72.23]
  - - [19968, 19968, 1, 384]
    - [15, 90.738]
  - - [43776, 43776, 1, 256]
    - [18, 74.28]
  - - [35072, 35072, 1, 256]
    - [15, 75.071]
  - - [20736, 20736, 1, 256]
    - [17, 75.611]
  - - [7168, 7168, 1, 256]
    - [15, 72.544]
  - - [18432, 18432, 1, 256]
    - [17, 76.049]
  - - [38016, 38016, 1, 384]
    - [15, 91.017]
  - - [35328, 35328, 1, 384]
    - [15, 90.526]
  - - [38784, 38784, 1, 384]
    - [15, 90.979]
  - - [26112, 26112, 1, 384]
    - [17, 91.076]
  - - [27264, 27264, 1, 384]
    - [17, 90.776]
  - - [44928, 44928, 1, 384]
    - [17, 90.696]
  - - [41088, 128, 1, 384]
    - [233, 57.835]
  - - [42368, 128, 1, 256]
    - [354, 49.964]
  - - [10752, 10752, 1, 256]
    - [17, 75.284]
  - - [9088, 128, 1, 384]
    - [63, 46.368]
  - - [17152, 17152, 1, 256]
    - [14, 75.562]
  - - [44928, 128, 1, 384]
    - [328, 61.547]
  - - [7808, 128, 1, 384]
    - [64, 40.491]
  - - [29184, 29184, 1, 256]
    - [15, 75.558]
  - - [11776, 11776, 1, 256]
    - [15, 75.132]
  - - [1, 64, 1, 64]
    - [126, 0.002]
  - - [27136, 27136, 1, 256]
    - [30, 75.911]
  - - [33408, 128, 1, 256]
    - [202, 47.749]
  - - [33792, 33792, 1, 384]
    - [29, 89.232]
  - - [43520, 43520, 1, 256]
    - [26, 75.193]
  - - [14592, 14592, 1, 384]
    - [15, 90.309]
  - - [41472, 41472, 1, 256]
    - [15, 74.99]
  - - [14080, 14080, 1, 256]
    - [20, 74.446]
  - - [34688, 128, 1, 256]
    - [202, 48.232]
  - - [16896, 16896, 1, 256]
    - [15, 76.106]
  - - [15744, 15744, 1, 384]
    - [15, 90.68]
  - - [28416, 28416, 1, 256]
    - [15, 74.869]
  - - [23808, 23808, 1, 256]
    - [17, 75.555]
  - - [27648, 27648, 1, 256]
    - [15, 75.552]
  - - [1152, 3072, 1, 384]
    - [356, 60.318]
  - - [21888, 128, 1, 256]
    - [293, 43.419]
  - - [34816, 34816, 1, 256]
    - [17, 75.387]
  - - [43776, 43776, 1, 384]
    - [29, 89.916]
  - - [36096, 36096, 1, 256]
    - [29, 74.203]
  - - [24320, 24320, 1, 256]
    - [14, 75.666]
  - - [12544, 12544, 1, 256]
    - [17, 74.955]
  - - [29184, 29184, 1, 384]
    - [17, 90.781]
  - - [29568, 29568, 1, 384]
    - [14, 90.297]
  - - [12928, 128, 1, 384]
    - [65, 54.014]
  - - [36480, 36480, 1, 384]
    - [15, 90.923]
  - - [30720, 30720, 1, 256]
    - [17, 75.552]
  - - [25728, 25728, 1, 384]
    - [25, 90.933]
  - - [34048, 34048, 1, 256]
    - [30, 74.525]
  - - [12928, 128, 1, 256]
    - [66, 45.988]
  - - [9728, 9728, 1, 256]
    - [17, 74.669]
  - - [128, 128, 1, 256]
    - [67, 1.074]
  - - [33024, 33024, 1, 256]
    - [31, 75.213]
  - - [15488, 128, 1, 384]
    - [279, 45.315]
  - - [39808, 128, 1, 384]
    - [208, 57.079]
  - - [18176, 18176, 1, 256]
    - [17, 75.705]
  - - [21504, 21504, 1, 256]
    - [17, 76.075]
  - - [16384, 16384, 1, 256]
    - [38, 62.756]
  - - [27008, 128, 1, 384]
    - [354, 53.322]
  - - [27904, 27904, 1, 256]
    - [26, 75.163]
  - - [24448, 128, 1, 384]
    - [34, 55.216]
  - - [35968, 128, 1, 384]
    - [354, 58.167]
  - - [37632, 37632, 1, 256]
    - [17, 74.955]
  - - [14848, 14848, 1, 256]
    - [18, 75.624]
  - - [23552, 23552, 1, 256]
    - [17, 76.111]
  - - [4608, 4608, 1, 50000]
    - [393, 95.048]
  - - [13056, 13056, 1, 256]
    - [17, 75.313]
  - - [38528, 128, 1, 256]
    - [226, 50.711]
  - - [19584, 19584, 1, 384]
    - [15, 91.095]
  - - [16768, 128, 1, 384]
    - [202, 48.112]
  - - [22784, 22784, 1, 256]
    - [14, 75.492]
  - - [44160, 44160, 1, 384]
    - [17, 90.838]
  - - [28160, 28160, 1, 256]
    - [35, 75.558]
  - - [14592, 14592, 1, 256]
    - [45, 74.291]
  - - [20992, 20992, 1, 256]
    - [15, 76.172]
  - - [41216, 41216, 1, 256]
    - [15, 74.854]
  - - [21760, 21760, 1, 256]
    - [17, 75.734]
  - - [25344, 25344, 1, 256]
    - [29, 74.966]
  - - [4608, 4608, 1, 256]
    - [355, 76.563]
  - - [2560, 2048, 1, 256]
    - [328, 55.465]
  - - [30464, 30464, 1, 256]
    - [36, 74.371]
  - - [19200, 19200, 1, 256]
    - [15, 75.675]
  - - [22272, 22272, 1, 256]
    - [19, 75.594]
  - - [29952, 29952, 1, 256]
    - [14, 75.275]
  - - [20480, 20480, 1, 256]
    - [17, 75.812]
  - - [17408, 17408, 1, 256]
    - [15, 75.599]
  - - [32768, 32768, 1, 256]
    - [37, 57.634]
  - - [18816, 18816, 1, 384]
    - [25, 90.869]
  - - [34944, 34944, 1, 384]
    - [15, 90.977]
  - - [18048, 18048, 1, 384]
    - [25, 90.958]
  - - [34560, 34560, 1, 384]
    - [15, 90.826]
  - - [9088, 128, 1, 256]
    - [68, 40.41]
  - - [24576, 24576, 1, 256]
    - [38, 70.192]
  - - [32128, 128, 1, 384]
    - [229, 58.934]
  - - [8448, 8448, 1, 256]
    - [20, 73.715]
  - - [42752, 42752, 1, 256]
    - [17, 74.735]
  - - [5376, 5376, 1, 256]
    - [326, 78.129]
  - - [18048, 128, 1, 256]
    - [206, 41.753]
  - - [3584, 3584, 1, 256]
    - [234, 71.46]
  - - [37120, 37120, 1, 256]
    - [17, 74.921]
  - - [39936, 39936, 1, 384]
    - [41, 89.019]
  - - [20736, 20736, 1, 384]
    - [32, 91.075]
  - - [35584, 35584, 1, 256]
    - [15, 74.893]
  - - [26112, 26112, 1, 256]
    - [35, 76.0]
  - - [16896, 16896, 1, 384]
    - [15, 90.639]
  - - [40704, 40704, 1, 384]
    - [15, 90.834]
  - - [33280, 33280, 1, 256]
    - [14, 75.635]
  - - [5632, 5632, 1, 256]
    - [232, 78.755]
  - - [19456, 19456, 1, 256]
    - [17, 75.886]
  - - [22016, 22016, 1, 256]
    - [19, 76.148]
  - - [14208, 128, 1, 256]
    - [195, 35.232]
  - - [13568, 13568, 1, 256]
    - [15, 75.309]
  - - [30848, 128, 1, 384]
    - [354, 57.075]
  - - [1408, 128, 1, 384]
    - [69, 13.439]
  - - [5760, 5760, 1, 5760]
    - [394, 94.835]
  - - [39936, 39936, 1, 256]
    - [15, 75.103]
  - - [1920, 3072, 1, 384]
    - [356, 67.712]
  - - [9984, 9984, 1, 256]
    - [24, 74.421]
  - - [2816, 2048, 1, 256]
    - [227, 58.185]
  - - [23168, 128, 1, 256]
    - [235, 45.849]
  - - [19968, 19968, 1, 256]
    - [18, 76.018]
  - - [44800, 44800, 1, 256]
    - [15, 74.449]
  - - [14976, 14976, 1, 384]
    - [32, 90.548]
  - - [35712, 35712, 1, 384]
    - [15, 90.953]
  - - [43008, 43008, 1, 384]
    - [38, 89.03]
  - - [41088, 41088, 1, 384]
    - [29, 90.052]
  - - [16128, 16128, 1, 384]
    - [15, 90.362]
  - - [5120, 5120, 1, 256]
    - [326, 76.115]
  - - [25856, 25856, 1, 256]
    - [17, 75.426]
  - - [12288, 12288, 1, 256]
    - [17, 75.012]
  - - [6400, 6400, 1, 256]
    - [23, 72.272]
  - - [2688, 128, 1, 256]
    - [70, 20.246]
  - - [11648, 128, 1, 256]
    - [71, 42.668]
  - - [43264, 43264, 1, 256]
    - [15, 74.81]
  - - [19712, 19712, 1, 256]
    - [21, 75.0]
  - - [34176, 34176, 1, 384]
    - [17, 90.755]
  - - [31104, 31104, 1, 384]
    - [17, 90.907]
  - - [36608, 36608, 1, 256]
    - [26, 74.827]
  - - [39808, 128, 1, 256]
    - [306, 47.894]
  - - [13824, 13824, 1, 384]
    - [17, 90.095]
  - - [42624, 42624, 1, 384]
    - [18, 87.986]
  - - [21120, 21120, 1, 384]
    - [15, 91.055]
  - - [23296, 23296, 1, 256]
    - [15, 75.634]
  - - [42240, 42240, 1, 256]
    - [17, 74.739]
  - - [33408, 128, 1, 384]
    - [233, 55.777]
  - - [43648, 128, 1, 256]
    - [227, 52.21]
  - - [19328, 128, 1, 384]
    - [354, 53.468]
  - - [33792, 33792, 1, 256]
    - [15, 75.516]
  - - [31488, 31488, 1, 256]
    - [15, 74.936]
  - - [768, 3072, 1, 384]
    - [285, 53.344]
  - - [6144, 6144, 1, 256]
    - [235, 81.999]
  - - [20352, 20352, 1, 384]
    - [17, 91.117]
  - - [23168, 128, 1, 384]
    - [354, 53.714]
  - - [33536, 33536, 1, 256]
    - [36, 75.178]
  - - [32640, 32640, 1, 384]
    - [17, 90.087]
  - - [1536, 3072, 1, 384]
    - [203, 65.103]
  - - [19328, 128, 1, 256]
    - [208, 43.495]
  - - [2688, 3072, 1, 384]
    - [248, 75.149]
  - - [24192, 24192, 1, 384]
    - [17, 91.241]
  - - [6912, 6912, 1, 256]
    - [23, 72.526]
  - - [15360, 15360, 1, 256]
    - [15, 76.063]
  - - [18944, 18944, 1, 256]
    - [14, 76.049]
  - - [37376, 37376, 1, 256]
    - [29, 75.399]
  - - [31488, 31488, 1, 384]
    - [17, 90.749]
  - - [26880, 26880, 1, 256]
    - [15, 75.31]
  - - [44928, 128, 1, 128]
    - [229, 35.219]
  - - [24448, 128, 1, 256]
    - [20, 46.959]
  - - [31872, 31872, 1, 384]
    - [17, 90.846]
  - - [1408, 128, 1, 256]
    - [72, 11.358]
  - - [38528, 128, 1, 384]
    - [326, 60.3]
  - - [15616, 15616, 1, 256]
    - [15, 75.505]
  - - [39552, 39552, 1, 384]
    - [15, 90.918]
  - - [4352, 4352, 1, 256]
    - [293, 73.426]
  - - [28288, 128, 1, 384]
    - [328, 54.349]
  - - [10368, 128, 1, 256]
    - [63, 43.982]
  - - [32128, 128, 1, 256]
    - [202, 49.566]
  - - [4608, 4608, 1, 4608]
    - [139, 97.048]
  - - [8704, 8704, 1, 256]
    - [17, 74.167]
  - - [17664, 17664, 1, 256]
    - [19, 74.999]
  - - [24576, 24576, 1, 384]
    - [21, 83.07]
  - - [37248, 128, 1, 384]
    - [202, 57.238]
  - - [34304, 34304, 1, 256]
    - [31, 75.525]
  - - [42368, 128, 1, 384]
    - [354, 59.322]
  - - [17664, 17664, 1, 384]
    - [17, 90.703]
  - - [12800, 12800, 1, 256]
    - [17, 75.345]
  - - [26624, 26624, 1, 256]
    - [15, 75.83]
  - - [36864, 36864, 1, 256]
    - [17, 74.612]
  - - [40704, 40704, 1, 256]
    - [17, 74.86]
  - - [12032, 12032, 1, 256]
    - [17, 74.709]
  - - [33024, 33024, 1, 384]
    - [15, 90.647]
  - - [28800, 28800, 1, 384]
    - [32, 91.023]
  - - [22656, 22656, 1, 384]
    - [15, 91.179]
  - - [41472, 41472, 1, 384]
    - [17, 90.471]
  - - [39680, 39680, 1, 256]
    - [17, 74.613]
  - - [44032, 44032, 1, 256]
    - [15, 75.129]
  - - [43392, 43392, 1, 384]
    - [15, 90.699]
  - - [42240, 42240, 1, 384]
    - [17, 90.742]
  - - [38912, 38912, 1, 256]
    - [17, 75.302]
  - - [23040, 23040, 1, 384]
    - [17, 91.024]
  - - [13312, 13312, 1, 256]
    - [15, 75.812]
  - - [128, 128, 1, 384]
    - [69, 1.211]
  - - [39168, 39168, 1, 256]
    - [29, 74.682]
  - - [25344, 25344, 1, 384]
    - [17, 91.121]
  - - [5248, 128, 1, 256]
    - [63, 31.75]
  - - [30208, 30208, 1, 256]
    - [30, 75.621]
  - - [40192, 40192, 1, 256]
    - [17, 74.915]
  - - [15872, 15872, 1, 256]
    - [15, 76.103]
  - - [44544, 44544, 1, 256]
    - [12, 74.966]
  - - [11520, 11520, 1, 256]
    - [17, 74.674]
  - - [15360, 15360, 1, 384]
    - [14, 89.355]
  - - [23040, 23040, 1, 256]
    - [17, 76.194]
  - - [26496, 26496, 1, 384]
    - [17, 91.077]
  - - [11264, 11264, 1, 256]
    - [15, 75.369]
  - - [18048, 128, 1, 384]
    - [229, 50.273]
  - - [30976, 30976, 1, 256]
    - [18, 74.406]
  - - [11648, 128, 1, 384]
    - [65, 50.278]
  - - [2304, 3072, 1, 384]
    - [246, 70.811]
  - - [28928, 28928, 1, 256]
    - [19, 74.911]
  - - [43008, 43008, 1, 256]
    - [15, 74.922]
  - - [29440, 29440, 1, 256]
    - [19, 75.408]
  - - [36352, 36352, 1, 256]
    - [29, 75.406]
  - - [32256, 32256, 1, 384]
    - [15, 90.64]
  - - [23808, 23808, 1, 384]
    - [32, 91.162]
  - - [37248, 128, 1, 256]
    - [328, 50.072]
  - - [1, 1, 1, 64]
    - [126, 0.0]
  - - [37888, 37888, 1, 256]
    - [17, 75.212]
  - - [35968, 128, 1, 256]
    - [354, 49.608]
  - - [13824, 13824, 1, 256]
    - [19, 75.675]
  - - [39168, 39168, 1, 384]
    - [15, 90.701]
  - - [37632, 37632, 1, 384]
    - [15, 90.859]
  - - [29568, 128, 1, 256]
    - [328, 46.493]
  - - [14336, 14336, 1, 256]
    - [17, 75.668]
  - - [28288, 128, 1, 256]
    - [354, 45.207]
  - - [16512, 16512, 1, 384]
    - [38, 89.482]
  - - [30720, 30720, 1, 384]
    - [21, 89.477]
  - - [21248, 21248, 1, 256]
    - [15, 75.578]
  - - [29696, 29696, 1, 256]
    - [15, 75.577]
  - - [384, 3072, 1, 384]
    - [63, 48.474]
  - - [28672, 28672, 1, 256]
    - [17, 75.173]
  - - [32512, 32512, 1, 256]
    - [14, 75.093]
  - - [9216, 9216, 1, 256]
    - [17, 74.101]
  - - [6656, 6656, 1, 256]
    - [23, 72.68]
  - - [30336, 30336, 1, 384]
    - [15, 90.946]
  - - [20608, 128, 1, 256]
    - [354, 41.481]
  - - [7936, 7936, 1, 256]
    - [24, 73.5]
  - - [41856, 41856, 1, 384]
    - [17, 90.931]
  - - [44288, 44288, 1, 256]
    - [15, 74.601]
  - - [7744, 7744, 1, 7744]
    - [15, 97.287]
  - - [7424, 7424, 1, 256]
    - [24, 73.14]
  - - [39424, 39424, 1, 256]
    - [15, 75.347]
  - - [43648, 128, 1, 384]
    - [328, 59.523]
  - - [14208, 14208, 1, 384]
    - [15, 89.943]
  - - [36096, 36096, 1, 384]
    - [18, 89.977]
  - - [44544, 44544, 1, 384]
    - [15, 90.389]
  - - [22528, 22528, 1, 256]
    - [17, 75.715]
  - - [4096, 4096, 1, 256]
    - [234, 72.087]
  - - [31744, 31744, 1, 256]
    - [15, 75.52]
  - - [3968, 128, 1, 384]
    - [62, 28.344]
  - - [17920, 17920, 1, 256]
    - [17, 76.073]
  - - [5248, 128, 1, 384]
    - [62, 36.66]
  - - [26880, 26880, 1, 384]
    - [15, 91.155]
  - - [8192, 8192, 1, 256]
    - [15, 72.824]
  - - [3968, 128, 1, 256]
    - [64, 24.407]
  - - [41088, 128, 1, 256]
    - [328, 48.356]
  - - [21888, 128, 1, 384]
    - [227, 51.495]
  - - [16768, 128, 1, 256]
    - [229, 38.914]
  - - [24064, 24064, 1, 256]
    - [14, 76.017]
  - - [44928, 128, 1, 256]
    - [229, 51.805]
  - - [27648, 27648, 1, 384]
    - [41, 89.139]
  - - [24832, 24832, 1, 256]
    - [14, 75.662]
  - - [10240, 10240, 1, 256]
    - [17, 75.096]
  - - [40320, 40320, 1, 384]
    - [17, 90.989]
  - - [18432, 2688, 1, 384]
    - [17, 85.949]
  - - [43008, 2304, 1, 384]
    - [17, 89.185]
  - - [3840, 3072, 1, 384]
    - [236, 75.263]
  - - [33408, 1920, 1, 384]
    - [17, 87.863]
  - - [33792, 2688, 1, 384]
    - [15, 87.542]
  - - [8064, 2688, 1, 384]
    - [15, 79.14]
  - - [33408, 2304, 1, 384]
    - [17, 88.628]
  - - [31872, 1536, 1, 384]
    - [15, 85.612]
  - - [41088, 1920, 1, 384]
    - [41, 86.524]
  - - [41088, 2304, 1, 384]
    - [49, 87.329]
  - - [5376, 1536, 1, 384]
    - [222, 72.717]
  - - [16128, 1536, 1, 384]
    - [17, 83.019]
  - - [36480, 2688, 1, 384]
    - [25, 88.977]
  - - [15360, 768, 1, 384]
    - [329, 75.522]
  - - [42624, 768, 1, 384]
    - [32, 82.371]
  - - [4992, 1536, 1, 384]
    - [251, 70.916]
  - - [29952, 1536, 1, 384]
    - [15, 86.156]
  - - [10752, 2688, 1, 384]
    - [25, 82.264]
  - - [42240, 2688, 1, 384]
    - [32, 89.835]
  - - [36096, 1536, 1, 384]
    - [14, 85.555]
  - - [26496, 1536, 1, 384]
    - [15, 85.909]
  - - [42624, 2688, 1, 384]
    - [17, 87.217]
  - - [17664, 2688, 1, 384]
    - [25, 86.621]
  - - [37248, 1536, 1, 384]
    - [15, 87.151]
  - - [16896, 2304, 1, 384]
    - [15, 86.299]
  - - [22272, 1920, 1, 384]
    - [15, 87.094]
  - - [26880, 2688, 1, 384]
    - [25, 87.772]
  - - [384, 768, 1, 384]
    - [64, 21.71]
  - - [16896, 1920, 1, 384]
    - [15, 86.53]
  - - [32640, 2304, 1, 384]
    - [15, 85.785]
  - - [5760, 2304, 1, 384]
    - [242, 80.111]
  - - [11904, 2304, 1, 384]
    - [17, 82.809]
  - - [24576, 2304, 1, 384]
    - [15, 85.039]
  - - [33024, 1536, 1, 384]
    - [15, 84.384]
  - - [36096, 2304, 1, 384]
    - [14, 86.916]
  - - [20352, 2688, 1, 384]
    - [32, 87.058]
  - - [14592, 2304, 1, 384]
    - [15, 85.738]
  - - [16128, 1920, 1, 384]
    - [17, 82.946]
  - - [16512, 1920, 1, 384]
    - [29, 79.688]
  - - [35712, 1920, 1, 384]
    - [15, 87.275]
  - - [9216, 2688, 1, 384]
    - [17, 83.651]
  - - [23808, 2688, 1, 384]
    - [32, 88.104]
  - - [18048, 768, 1, 384]
    - [32, 78.673]
  - - [14592, 2688, 1, 384]
    - [15, 86.006]
  - - [14208, 1920, 1, 384]
    - [17, 82.418]
  - - [14976, 2688, 1, 384]
    - [25, 85.749]
  - - [17280, 2304, 1, 384]
    - [17, 84.863]
  - - [11520, 2304, 1, 384]
    - [15, 84.796]
  - - [18432, 768, 1, 384]
    - [225, 78.339]
  - - [4608, 768, 1, 384]
    - [230, 59.757]
  - - [34944, 1920, 1, 384]
    - [15, 87.524]
  - - [13824, 2688, 1, 384]
    - [32, 86.081]
  - - [39936, 2304, 1, 384]
    - [15, 88.199]
  - - [7680, 2688, 1, 384]
    - [17, 81.415]
  - - [19968, 2304, 1, 384]
    - [17, 86.824]
  - - [27648, 2688, 1, 384]
    - [15, 86.702]
  - - [4224, 768, 1, 384]
    - [23, 59.788]
  - - [24192, 1920, 1, 384]
    - [17, 87.591]
  - - [32640, 1920, 1, 384]
    - [15, 84.928]
  - - [34176, 2688, 1, 384]
    - [39, 88.958]
  - - [35328, 1536, 1, 384]
    - [17, 85.698]
  - - [8832, 2688, 1, 384]
    - [239, 82.429]
  - - [18048, 1920, 1, 384]
    - [17, 84.439]
  - - [31488, 768, 1, 384]
    - [235, 83.234]
  - - [21504, 2304, 1, 384]
    - [15, 86.898]
  - - [11136, 2688, 1, 384]
    - [32, 84.703]
  - - [768, 1152, 1, 384]
    - [207, 31.557]
  - - [29184, 2688, 1, 384]
    - [32, 88.494]
  - - [4608, 2688, 1, 384]
    - [238, 77.533]
  - - [21504, 2688, 1, 384]
    - [17, 85.527]
  - - [34176, 768, 1, 384]
    - [32, 83.561]
  - - [23808, 1536, 1, 384]
    - [17, 84.573]
  - - [43392, 1536, 1, 384]
    - [15, 87.946]
  - - [13824, 768, 1, 384]
    - [256, 74.018]
  - - [38016, 1536, 1, 384]
    - [17, 86.692]
  - - [20736, 2688, 1, 384]
    - [25, 88.463]
  - - [15744, 1536, 1, 384]
    - [15, 82.237]
  - - [16512, 1536, 1, 384]
    - [329, 82.43]
  - - [3072, 2304, 1, 384]
    - [230, 68.389]
  - - [5760, 2688, 1, 384]
    - [325, 81.364]
  - - [38400, 2304, 1, 384]
    - [15, 88.2]
  - - [15360, 2688, 1, 384]
    - [17, 86.326]
  - - [29952, 2688, 1, 384]
    - [25, 88.86]
  - - [43008, 2688, 1, 384]
    - [17, 87.686]
  - - [13440, 1920, 1, 384]
    - [17, 82.655]
  - - [6528, 2688, 1, 384]
    - [15, 81.588]
  - - [2304, 1536, 1, 384]
    - [357, 59.413]
  - - [40320, 1536, 1, 384]
    - [17, 86.967]
  - - [13440, 1536, 1, 384]
    - [17, 81.341]
  - - [40320, 2688, 1, 384]
    - [32, 88.955]
  - - [30336, 2304, 1, 384]
    - [25, 88.619]
  - - [24192, 2688, 1, 384]
    - [32, 87.204]
  - - [35328, 768, 1, 384]
    - [32, 81.961]
  - - [23040, 768, 1, 384]
    - [25, 81.55]
  - - [29952, 2304, 1, 384]
    - [17, 87.87]
  - - [33024, 1920, 1, 384]
    - [15, 86.647]
  - - [14976, 768, 1, 384]
    - [241, 78.431]
  - - [42624, 1920, 1, 384]
    - [15, 87.484]
  - - [32640, 2688, 1, 384]
    - [18, 85.433]
  - - [11520, 1536, 1, 384]
    - [17, 82.185]
  - - [6912, 768, 1, 384]
    - [233, 64.089]
  - - [39552, 1920, 1, 384]
    - [17, 87.96]
  - - [32256, 1920, 1, 384]
    - [17, 87.539]
  - - [10752, 1536, 1, 384]
    - [15, 77.35]
  - - [24576, 2688, 1, 384]
    - [15, 84.613]
  - - [12672, 2688, 1, 384]
    - [32, 86.586]
  - - [10752, 1920, 1, 384]
    - [17, 81.453]
  - - [40704, 1536, 1, 384]
    - [15, 87.483]
  - - [32256, 768, 1, 384]
    - [235, 84.246]
  - - [18816, 2688, 1, 384]
    - [32, 85.896]
  - - [11520, 2688, 1, 384]
    - [25, 83.45]
  - - [35712, 2688, 1, 384]
    - [32, 88.852]
  - - [29952, 1920, 1, 384]
    - [15, 88.372]
  - - [26880, 1920, 1, 384]
    - [15, 87.563]
  - - [33408, 2688, 1, 384]
    - [25, 89.067]
  - - [35328, 2688, 1, 384]
    - [32, 88.976]
  - - [21120, 2688, 1, 384]
    - [39, 86.9]
  - - [19584, 1920, 1, 384]
    - [17, 86.96]
  - - [17664, 1536, 1, 384]
    - [17, 81.463]
  - - [36864, 768, 1, 384]
    - [32, 83.653]
  - - [14592, 1536, 1, 384]
    - [15, 81.728]
  - - [11136, 2304, 1, 384]
    - [15, 82.333]
  - - [9600, 2688, 1, 384]
    - [17, 82.609]
  - - [9216, 2304, 1, 384]
    - [17, 83.156]
  - - [21120, 768, 1, 384]
    - [235, 80.959]
  - - [4992, 2688, 1, 384]
    - [325, 82.226]
  - - [41472, 768, 1, 384]
    - [32, 85.184]
  - - [37632, 1536, 1, 384]
    - [17, 86.027]
  - - [38784, 2304, 1, 384]
    - [15, 88.806]
  - - [8448, 2688, 1, 384]
    - [32, 82.716]
  - - [36864, 2304, 1, 384]
    - [15, 87.729]
  - - [40704, 1920, 1, 384]
    - [17, 88.34]
  - - [39552, 2688, 1, 384]
    - [32, 89.664]
  - - [26112, 768, 1, 384]
    - [360, 82.316]
  - - [29184, 1536, 1, 384]
    - [15, 86.987]
  - - [32640, 1536, 1, 384]
    - [17, 83.298]
  - - [5376, 2688, 1, 384]
    - [325, 81.429]
  - - [13056, 768, 1, 384]
    - [327, 77.612]
  - - [13824, 2304, 1, 384]
    - [17, 85.541]
  - - [16896, 768, 1, 384]
    - [360, 78.28]
  - - [30336, 1920, 1, 384]
    - [17, 87.334]
  - - [27264, 2304, 1, 384]
    - [17, 88.195]
  - - [7680, 1536, 1, 384]
    - [325, 76.446]
  - - [30720, 2688, 1, 384]
    - [17, 87.806]
  - - [36096, 2688, 1, 384]
    - [18, 87.086]
  - - [5760, 1920, 1, 384]
    - [246, 77.098]
  - - [42240, 1536, 1, 384]
    - [17, 87.779]
  - - [8448, 1920, 1, 384]
    - [241, 79.937]
  - - [32256, 1536, 1, 384]
    - [15, 86.303]
  - - [44160, 2304, 1, 384]
    - [25, 89.108]
  - - [30336, 2688, 1, 384]
    - [32, 88.332]
  - - [6144, 2688, 1, 384]
    - [329, 81.03]
  - - [39168, 1536, 1, 384]
    - [15, 86.962]
  - - [11904, 1920, 1, 384]
    - [25, 83.359]
  - - [8064, 1536, 1, 384]
    - [230, 77.917]
  - - [21120, 1920, 1, 384]
    - [17, 86.0]
  - - [22656, 2304, 1, 384]
    - [32, 88.383]
  - - [19968, 2688, 1, 384]
    - [32, 87.953]
  - - [10752, 768, 1, 384]
    - [327, 74.532]
  - - [18432, 2304, 1, 384]
    - [17, 86.351]
  - - [14976, 1920, 1, 384]
    - [25, 86.02]
  - - [33024, 2688, 1, 384]
    - [25, 87.96]
  - - [1536, 768, 1, 384]
    - [280, 46.928]
  - - [33024, 2304, 1, 384]
    - [32, 87.324]
  - - [14208, 2688, 1, 384]
    - [32, 84.865]
  - - [38016, 2304, 1, 384]
    - [32, 88.859]
  - - [16896, 2688, 1, 384]
    - [25, 85.692]
  - - [31104, 768, 1, 384]
    - [32, 81.555]
  - - [41472, 2304, 1, 384]
    - [15, 88.447]
  - - [23424, 2688, 1, 384]
    - [17, 87.378]
  - - [26496, 2688, 1, 384]
    - [25, 88.317]
  - - [16512, 2304, 1, 384]
    - [18, 80.998]
  - - [11520, 1920, 1, 384]
    - [15, 81.321]
  - - [39552, 768, 1, 384]
    - [32, 85.633]
  - - [6144, 2304, 1, 384]
    - [296, 78.902]
  - - [14208, 2304, 1, 384]
    - [17, 83.895]
  - - [19584, 2304, 1, 384]
    - [17, 85.331]
  - - [36480, 768, 1, 384]
    - [25, 83.786]
  - - [15744, 2688, 1, 384]
    - [32, 86.233]
  - - [34560, 1536, 1, 384]
    - [17, 86.554]
  - - [8448, 2304, 1, 384]
    - [15, 82.987]
  - - [26112, 2688, 1, 384]
    - [32, 88.934]
  - - [39936, 768, 1, 384]
    - [25, 82.561]
  - - [19200, 1920, 1, 384]
    - [17, 85.398]
  - - [38400, 768, 1, 384]
    - [32, 83.34]
  - - [8448, 1536, 1, 384]
    - [235, 78.822]
  - - [13824, 1536, 1, 384]
    - [15, 82.987]
  - - [9600, 768, 1, 384]
    - [231, 72.123]
  - - [10368, 768, 1, 384]
    - [244, 73.245]
  - - [20736, 1536, 1, 384]
    - [15, 85.105]
  - - [28800, 768, 1, 384]
    - [25, 80.331]
  - - [10368, 1536, 1, 384]
    - [17, 81.171]
  - - [21888, 1536, 1, 384]
    - [17, 82.833]
  - - [38784, 2688, 1, 384]
    - [25, 89.453]
  - - [27648, 2304, 1, 384]
    - [17, 87.437]
  - - [11136, 1920, 1, 384]
    - [17, 83.769]
  - - [37248, 768, 1, 384]
    - [32, 85.091]
  - - [23040, 2688, 1, 384]
    - [25, 87.36]
  - - [37632, 1920, 1, 384]
    - [15, 87.723]
  - - [7680, 768, 1, 384]
    - [355, 67.445]
  - - [38016, 1920, 1, 384]
    - [15, 88.34]
  - - [35712, 2304, 1, 384]
    - [32, 88.776]
  - - [37248, 2688, 1, 384]
    - [32, 88.92]
  - - [29568, 1920, 1, 384]
    - [19, 86.846]
  - - [38400, 2688, 1, 384]
    - [32, 88.725]
  - - [25728, 768, 1, 384]
    - [360, 83.385]
  - - [8832, 1920, 1, 384]
    - [329, 79.39]
  - - [43776, 1920, 1, 384]
    - [19, 86.47]
  - - [15744, 768, 1, 384]
    - [329, 77.155]
  - - [27264, 1920, 1, 384]
    - [17, 85.812]
  - - [33792, 2304, 1, 384]
    - [17, 87.915]
  - - [8832, 2304, 1, 384]
    - [17, 80.583]
  - - [39168, 2688, 1, 384]
    - [25, 89.136]
  - - [35328, 1920, 1, 384]
    - [17, 88.337]
  - - [35328, 2304, 1, 384]
    - [17, 88.11]
  - - [29184, 768, 1, 384]
    - [32, 81.9]
  - - [18048, 2688, 1, 384]
    - [25, 87.839]
  - - [32256, 2688, 1, 384]
    - [25, 88.127]
  - - [18816, 1536, 1, 384]
    - [17, 81.82]
  - - [13056, 1536, 1, 384]
    - [284, 84.688]
  - - [34944, 1536, 1, 384]
    - [17, 87.087]
  - - [38400, 1920, 1, 384]
    - [15, 88.679]
  - - [15360, 2304, 1, 384]
    - [15, 85.764]
  - - [27264, 2688, 1, 384]
    - [17, 87.083]
  - - [11136, 1536, 1, 384]
    - [17, 79.702]
  - - [30720, 2304, 1, 384]
    - [15, 87.779]
  - - [24960, 2688, 1, 384]
    - [25, 87.696]
  - - [13824, 1920, 1, 384]
    - [15, 84.703]
  - - [17280, 2688, 1, 384]
    - [32, 87.383]
  - - [31872, 768, 1, 384]
    - [25, 83.012]
  - - [11904, 2688, 1, 384]
    - [25, 85.826]
  - - [7296, 768, 1, 384]
    - [227, 67.115]
  - - [19200, 1536, 1, 384]
    - [17, 83.176]
  - - [12288, 768, 1, 384]
    - [250, 73.736]
  - - [33792, 768, 1, 384]
    - [32, 82.575]
  - - [21888, 2688, 1, 384]
    - [42, 83.957]
  - - [2688, 1920, 1, 384]
    - [227, 63.361]
  - - [19968, 768, 1, 384]
    - [32, 78.744]
  - - [12288, 2688, 1, 384]
    - [17, 83.987]
  - - [12288, 2304, 1, 384]
    - [15, 84.682]
  - - [28416, 768, 1, 384]
    - [32, 80.118]
  - - [34560, 768, 1, 384]
    - [32, 84.329]
  - - [39936, 2688, 1, 384]
    - [17, 88.07]
  - - [8064, 1920, 1, 384]
    - [15, 79.126]
  - - [26880, 1536, 1, 384]
    - [15, 86.713]
  - - [28032, 2688, 1, 384]
    - [25, 89.022]
  - - [41472, 2688, 1, 384]
    - [25, 89.01]
  - - [29568, 2688, 1, 384]
    - [32, 87.448]
  - - [31104, 2688, 1, 384]
    - [32, 88.587]
  - - [5376, 1920, 1, 384]
    - [329, 74.146]
  - - [41856, 2688, 1, 384]
    - [25, 89.376]
  - - [9984, 768, 1, 384]
    - [245, 70.459]
  - - [3456, 2688, 1, 384]
    - [296, 73.378]
  - - [43392, 2688, 1, 384]
    - [32, 89.587]
  - - [36480, 1920, 1, 384]
    - [32, 88.451]
  - - [29568, 1536, 1, 384]
    - [14, 84.24]
  - - [36864, 2688, 1, 384]
    - [15, 87.725]
  - - [12672, 768, 1, 384]
    - [243, 76.605]
  - - [24064, 3072, 1, 256]
    - [20, 72.89]
  - - [256, 512, 1, 256]
    - [192, 4.477]
  - - [40960, 27648, 1, 256]
    - [12, 67.36]
  - - [31744, 3072, 1, 256]
    - [17, 73.477]
  - - [13056, 1792, 1, 256]
    - [235, 76.914]
  - - [35328, 22785, 1, 256]
    - [48, 73.723]
  - - [28160, 15872, 1, 256]
    - [43, 75.611]
  - - [39168, 1792, 1, 256]
    - [40, 71.707]
  - - [23808, 11265, 1, 256]
    - [21, 71.85]
  - - [16640, 4353, 1, 256]
    - [48, 69.432]
  - - [38912, 26624, 1, 256]
    - [15, 75.182]
  - - [6912, 3585, 1, 256]
    - [326, 73.199]
  - - [32768, 1792, 1, 256]
    - [12, 58.928]
  - - [30976, 18688, 1, 256]
    - [18, 74.426]
  - - [512, 2048, 1, 256]
    - [63, 37.096]
  - - [15872, 3584, 1, 256]
    - [20, 72.985]
  - - [6400, 1792, 1, 256]
    - [361, 68.693]
  - - [39680, 27393, 1, 256]
    - [38, 72.507]
  - - [36864, 24577, 1, 256]
    - [21, 71.805]
  - - [26112, 1536, 1, 256]
    - [24, 70.393]
  - - [26368, 1536, 1, 256]
    - [24, 69.857]
  - - [16896, 4353, 1, 256]
    - [19, 71.01]
  - - [14336, 1793, 1, 256]
    - [356, 72.379]
  - - [3840, 3072, 1, 256]
    - [324, 68.641]
  - - [2560, 3072, 1, 256]
    - [358, 62.945]
  - - [6656, 1536, 1, 256]
    - [236, 65.188]
  - - [27136, 1792, 1, 256]
    - [23, 71.697]
  - - [43776, 3072, 1, 256]
    - [18, 71.088]
  - - [23296, 1792, 1, 256]
    - [23, 70.456]
  - - [11264, 7937, 1, 256]
    - [21, 72.469]
  - - [768, 3072, 1, 256]
    - [328, 44.03]
  - - [6912, 3841, 1, 256]
    - [235, 74.373]
  - - [40960, 769, 1, 256]
    - [286, 61.731]
  - - [40448, 9216, 1, 256]
    - [30, 74.661]
  - - [7680, 4353, 1, 256]
    - [235, 77.187]
  - - [23296, 3072, 1, 256]
    - [15, 72.423]
  - - [7936, 4609, 1, 256]
    - [235, 78.12]
  - - [20736, 8448, 1, 256]
    - [17, 74.596]
  - - [768, 1024, 1, 256]
    - [62, 36.135]
  - - [38656, 3072, 1, 256]
    - [19, 72.725]
  - - [28160, 1792, 1, 256]
    - [20, 71.494]
  - - [13824, 3072, 1, 256]
    - [17, 71.6]
  - - [42752, 1792, 1, 256]
    - [17, 72.151]
  - - [35584, 23041, 1, 256]
    - [18, 73.114]
  - - [13056, 3072, 1, 256]
    - [17, 71.139]
  - - [37888, 768, 1, 256]
    - [235, 76.452]
  - - [19456, 3072, 1, 256]
    - [17, 72.97]
  - - [15872, 9216, 1, 256]
    - [15, 74.823]
  - - [30976, 1792, 1, 256]
    - [20, 71.133]
  - - [26368, 14081, 1, 256]
    - [38, 72.876]
  - - [35328, 23041, 1, 256]
    - [31, 73.686]
  - - [27648, 15105, 1, 256]
    - [15, 74.161]
  - - [25856, 13568, 1, 256]
    - [15, 75.047]
  - - [23296, 9216, 1, 256]
    - [17, 74.259]
  - - [2048, 1024, 1, 256]
    - [218, 40.635]
  - - [12032, 1792, 1, 256]
    - [235, 75.969]
  - - [11520, 1536, 1, 256]
    - [293, 74.16]
  - - [16128, 768, 1, 256]
    - [357, 70.184]
  - - [15360, 3072, 1, 256]
    - [17, 72.025]
  - - [38912, 26369, 1, 256]
    - [38, 73.922]
  - - [25344, 13056, 1, 256]
    - [29, 74.792]
  - - [39168, 26880, 1, 256]
    - [26, 74.625]
  - - [39424, 768, 1, 256]
    - [235, 76.69]
  - - [10496, 1792, 1, 256]
    - [326, 72.171]
  - - [28672, 3072, 1, 256]
    - [15, 73.07]
  - - [27392, 768, 1, 256]
    - [357, 72.829]
  - - [39680, 768, 1, 256]
    - [326, 76.711]
  - - [11520, 8193, 1, 256]
    - [38, 70.412]
  - - [17408, 4865, 1, 256]
    - [15, 71.47]
  - - [14080, 1537, 1, 256]
    - [360, 70.203]
  - - [29184, 768, 1, 256]
    - [236, 73.282]
  - - [19200, 6913, 1, 256]
    - [20, 71.548]
  - - [33536, 9216, 1, 256]
    - [29, 74.284]
  - - [5632, 3072, 1, 256]
    - [355, 72.256]
  - - [32768, 20480, 1, 256]
    - [44, 58.823]
  - - [29440, 9216, 1, 256]
    - [14, 74.429]
  - - [40960, 1792, 1, 256]
    - [26, 66.694]
  - - [10240, 3072, 1, 256]
    - [235, 79.686]
  - - [20992, 1792, 1, 256]
    - [235, 80.331]
  - - [42240, 9216, 1, 256]
    - [18, 74.271]
  - - [19200, 6912, 1, 256]
    - [17, 74.327]
  - - [27392, 1792, 1, 256]
    - [55, 68.339]
  - - [42496, 1536, 1, 256]
    - [15, 71.485]
  - - [29440, 16897, 1, 256]
    - [18, 73.235]
  - - [20480, 8192, 1, 256]
    - [15, 74.921]
  - - [11264, 8193, 1, 256]
    - [17, 70.854]
  - - [26880, 14337, 1, 256]
    - [38, 72.433]
  - - [28928, 16641, 1, 256]
    - [48, 73.123]
  - - [15360, 2817, 1, 256]
    - [17, 67.942]
  - - [44288, 1536, 1, 256]
    - [17, 70.471]
  - - [7936, 1536, 1, 256]
    - [356, 69.493]
  - - [18176, 5633, 1, 256]
    - [15, 71.129]
  - - [8448, 3072, 1, 256]
    - [232, 76.896]
  - - [17920, 5632, 1, 256]
    - [14, 74.331]
  - - [1792, 2048, 1, 256]
    - [223, 53.003]
  - - [39936, 3072, 1, 256]
    - [15, 73.824]
  - - [20480, 3072, 1, 256]
    - [17, 72.732]
  - - [24832, 1792, 1, 256]
    - [40, 71.196]
  - - [37376, 25088, 1, 256]
    - [15, 75.229]
  - - [7168, 4097, 1, 256]
    - [235, 74.238]
  - - [21504, 768, 1, 256]
    - [250, 72.919]
  - - [13312, 3072, 1, 256]
    - [17, 71.791]
  - - [40960, 1025, 1, 256]
    - [17, 57.587]
  - - [12032, 1536, 1, 256]
    - [355, 72.741]
  - - [9216, 768, 1, 256]
    - [218, 61.41]
  - - [44288, 27648, 1, 256]
    - [18, 74.594]
  - - [32512, 1792, 1, 256]
    - [23, 71.363]
  - - [23808, 11520, 1, 256]
    - [15, 75.256]
  - - [25600, 13057, 1, 256]
    - [38, 73.924]
  - - [40448, 1792, 1, 256]
    - [17, 72.271]
  - - [25088, 12800, 1, 256]
    - [14, 75.683]
  - - [22784, 10496, 1, 256]
    - [40, 74.874]
  - - [38400, 26113, 1, 256]
    - [18, 73.709]
  - - [9728, 3072, 1, 256]
    - [225, 78.308]
  - - [20736, 1792, 1, 256]
    - [326, 80.243]
  - - [7680, 3072, 1, 256]
    - [235, 75.747]
  - - [5376, 2305, 1, 256]
    - [284, 67.241]
  - - [12800, 3072, 1, 256]
    - [20, 71.387]
  - - [43520, 3584, 1, 256]
    - [15, 74.091]
  - - [12288, 3072, 1, 256]
    - [293, 81.218]
  - - [12800, 1536, 1, 256]
    - [355, 72.92]
  - - [21504, 8961, 1, 256]
    - [15, 73.17]
  - - [39680, 9216, 1, 256]
    - [17, 74.129]
  - - [3584, 513, 1, 256]
    - [354, 36.18]
  - - [1280, 3072, 1, 256]
    - [229, 53.116]
  - - [13056, 9216, 1, 256]
    - [15, 74.371]
  - - [22016, 768, 1, 256]
    - [355, 71.825]
  - - [33024, 1536, 1, 256]
    - [23, 69.126]
  - - [26880, 9216, 1, 256]
    - [17, 74.278]
  - - [44032, 27648, 1, 256]
    - [17, 74.877]
  - - [7680, 768, 1, 256]
    - [231, 58.9]
  - - [32000, 19712, 1, 256]
    - [15, 75.0]
  - - [26880, 14593, 1, 256]
    - [38, 72.979]
  - - [24064, 9216, 1, 256]
    - [31, 74.935]
  - - [39424, 26881, 1, 256]
    - [38, 73.642]
  - - [27392, 3072, 1, 256]
    - [31, 70.269]
  - - [10752, 1792, 1, 256]
    - [353, 72.748]
  - - [8960, 5633, 1, 256]
    - [17, 70.165]
  - - [34560, 3072, 1, 256]
    - [15, 72.869]
  - - [23808, 9216, 1, 256]
    - [15, 74.572]
  - - [29696, 17153, 1, 256]
    - [17, 74.326]
  - - [11776, 1536, 1, 256]
    - [225, 72.556]
  - - [13568, 1536, 1, 256]
    - [236, 74.691]
  - - [30208, 9216, 1, 256]
    - [30, 75.008]
  - - [36608, 1536, 1, 256]
    - [23, 70.529]
  - - [12800, 513, 1, 256]
    - [355, 57.273]
  - - [7680, 1792, 1, 256]
    - [361, 67.962]
  - - [42496, 2305, 1, 256]
    - [15, 68.926]
  - - [37376, 1536, 1, 256]
    - [17, 70.914]
  - - [20224, 1792, 1, 256]
    - [232, 80.999]
  - - [43520, 1536, 1, 256]
    - [15, 71.431]
  - - [26368, 768, 1, 256]
    - [235, 72.307]
  - - [18176, 3072, 1, 256]
    - [17, 72.178]
  - - [24320, 12033, 1, 256]
    - [48, 73.218]
  - - [17408, 9216, 1, 256]
    - [17, 74.837]
  - - [36352, 1792, 1, 256]
    - [17, 72.37]
  - - [20992, 8705, 1, 256]
    - [21, 72.643]
  - - [19712, 7424, 1, 256]
    - [40, 73.379]
  - - [38144, 768, 1, 256]
    - [225, 76.575]
  - - [10752, 1536, 1, 256]
    - [296, 73.516]
  - - [4096, 3072, 1, 256]
    - [234, 70.481]
  - - [29696, 17409, 1, 256]
    - [38, 72.74]
  - - [10240, 6913, 1, 256]
    - [21, 71.858]
  - - [18944, 1536, 1, 256]
    - [235, 77.007]
  - - [38656, 26113, 1, 256]
    - [29, 72.926]
  - - [37376, 25089, 1, 256]
    - [29, 73.77]
  - - [38400, 1536, 1, 256]
    - [15, 70.995]
  - - [8448, 1792, 1, 256]
    - [235, 70.931]
  - - [13056, 769, 1, 256]
    - [285, 61.87]
  - - [24320, 11777, 1, 256]
    - [48, 73.035]
  - - [17664, 9216, 1, 256]
    - [14, 73.709]
  - - [8192, 4865, 1, 256]
    - [15, 69.019]
  - - [17920, 1792, 1, 256]
    - [232, 79.017]
  - - [32000, 19713, 1, 256]
    - [38, 73.259]
  - - [8960, 768, 1, 256]
    - [227, 60.567]
  - - [31232, 3072, 1, 256]
    - [40, 73.089]
  - - [12544, 257, 1, 256]
    - [355, 46.559]
  - - [43776, 3585, 1, 256]
    - [18, 68.553]
  - - [11008, 1792, 1, 256]
    - [223, 74.719]
  - - [29696, 17408, 1, 256]
    - [17, 75.352]
  - - [34560, 22272, 1, 256]
    - [15, 74.996]
  - - [256, 2048, 1, 256]
    - [68, 25.406]
  - - [32768, 20481, 1, 256]
    - [44, 55.844]
  - - [14336, 3072, 1, 256]
    - [23, 71.953]
  - - [19456, 7168, 1, 256]
    - [17, 74.12]
  - - [13312, 9216, 1, 256]
    - [15, 74.894]
  - - [22272, 768, 1, 256]
    - [357, 72.955]
  - - [24064, 1792, 1, 256]
    - [20, 71.538]
  - - [16896, 1792, 1, 256]
    - [203, 78.07]
  - - [27904, 15616, 1, 256]
    - [17, 75.078]
  - - [37888, 3072, 1, 256]
    - [15, 73.795]
  - - [13056, 513, 1, 256]
    - [355, 55.537]
  - - [36608, 24065, 1, 256]
    - [18, 72.88]
  - - [40704, 3072, 1, 256]
    - [17, 73.142]
  - - [28928, 16640, 1, 256]
    - [14, 75.132]
  - - [24576, 12288, 1, 256]
    - [38, 69.898]
  - - [17152, 3072, 1, 256]
    - [24, 71.874]
  - - [17152, 4864, 1, 256]
    - [24, 73.546]
  - - [42496, 9216, 1, 256]
    - [18, 74.809]
  - - [32256, 768, 1, 256]
    - [235, 76.157]
  - - [4352, 1792, 1, 256]
    - [227, 62.693]
  - - [5632, 768, 1, 256]
    - [320, 53.845]
  - - [40704, 513, 1, 256]
    - [236, 64.697]
  - - [19712, 768, 1, 256]
    - [236, 68.275]
  - - [33536, 20993, 1, 256]
    - [48, 73.277]
  - - [2816, 3072, 1, 256]
    - [218, 66.468]
  - - [3584, 3072, 1, 256]
    - [236, 69.304]
  - - [4608, 1537, 1, 256]
    - [223, 59.201]
  - - [44032, 9216, 1, 256]
    - [15, 74.553]
  - - [33792, 21249, 1, 256]
    - [21, 74.025]
  - - [32512, 20225, 1, 256]
    - [48, 73.399]
  - - [38656, 9216, 1, 256]
    - [29, 74.324]
  - - [17664, 5377, 1, 256]
    - [19, 70.624]
  - - [19456, 7169, 1, 256]
    - [21, 71.093]
  - - [8448, 5121, 1, 256]
    - [17, 68.835]
  - - [29440, 17152, 1, 256]
    - [19, 75.486]
  - - [40448, 513, 1, 256]
    - [357, 63.05]
  - - [41472, 1792, 1, 256]
    - [17, 72.408]
  - - [17920, 3072, 1, 256]
    - [20, 72.264]
  - - [35072, 9216, 1, 256]
    - [15, 74.214]
  - - [34816, 22273, 1, 256]
    - [38, 74.005]
  - - [35072, 22785, 1, 256]
    - [21, 73.107]
  - - [39168, 9216, 1, 256]
    - [18, 74.256]
  - - [42752, 2817, 1, 256]
    - [38, 69.038]
  - - [11776, 3072, 1, 256]
    - [235, 80.578]
  - - [24832, 12289, 1, 256]
    - [31, 72.414]
  - - [24576, 12033, 1, 256]
    - [21, 68.22]
  - - [6400, 1536, 1, 256]
    - [261, 65.726]
  - - [32512, 3072, 1, 256]
    - [20, 72.723]
  - - [30976, 3072, 1, 256]
    - [20, 71.129]
  - - [22016, 9473, 1, 256]
    - [14, 73.241]
  - - [19968, 1792, 1, 256]
    - [235, 81.293]
  - - [29440, 3072, 1, 256]
    - [19, 73.013]
  - - [43776, 3840, 1, 256]
    - [18, 72.616]
  - - [41472, 768, 1, 256]
    - [326, 77.686]
  - - [8192, 1792, 1, 256]
    - [356, 70.045]
  - - [35840, 3072, 1, 256]
    - [17, 73.788]
  - - [8704, 3072, 1, 256]
    - [232, 79.047]
  - - [9728, 1792, 1, 256]
    - [284, 73.341]
  - - [22272, 9729, 1, 256]
    - [46, 72.315]
  - - [32768, 3072, 1, 256]
    - [12, 59.221]
  - - [3072, 2048, 1, 256]
    - [225, 60.493]
  - - [36864, 24576, 1, 256]
    - [15, 74.304]
  - - [9984, 1536, 1, 256]
    - [236, 71.525]
  - - [12032, 8961, 1, 256]
    - [14, 71.392]
  - - [38400, 25857, 1, 256]
    - [18, 73.786]
  - - [20224, 7937, 1, 256]
    - [38, 72.001]
  - - [34304, 21761, 1, 256]
    - [31, 73.859]
  - - [30720, 18432, 1, 256]
    - [17, 75.598]
  - - [31744, 9216, 1, 256]
    - [17, 74.725]
  - - [27136, 14848, 1, 256]
    - [14, 75.662]
  - - [34048, 9216, 1, 256]
    - [31, 73.879]
  - - [3584, 257, 1, 256]
    - [68, 33.197]
  - - [18688, 6145, 1, 256]
    - [21, 70.227]
  - - [36096, 768, 1, 256]
    - [355, 74.999]
  - - [36608, 9216, 1, 256]
    - [18, 74.237]
  - - [35584, 9216, 1, 256]
    - [18, 74.453]
  - - [29952, 17664, 1, 256]
    - [14, 75.301]
  - - [34816, 1792, 1, 256]
    - [17, 72.664]
  - - [24064, 11776, 1, 256]
    - [14, 75.569]
  - - [40448, 3072, 1, 256]
    - [19, 73.246]
  - - [18688, 6401, 1, 256]
    - [38, 70.993]
  - - [20480, 1536, 1, 256]
    - [293, 76.715]
  - - [18432, 3072, 1, 256]
    - [15, 72.829]
  - - [20224, 768, 1, 256]
    - [250, 69.669]
  - - [25344, 768, 1, 256]
    - [236, 73.303]
  - - [36608, 24320, 1, 256]
    - [26, 74.884]
  - - [34816, 9216, 1, 256]
    - [15, 74.783]
  - - [41216, 27648, 1, 256]
    - [18, 74.634]
  - - [30464, 9216, 1, 256]
    - [29, 73.654]
  - - [7424, 3072, 1, 256]
    - [326, 76.609]
  - - [20480, 1792, 1, 256]
    - [284, 78.405]
  - - [41984, 1793, 1, 256]
    - [17, 67.812]
  - - [18688, 1792, 1, 256]
    - [235, 79.793]
  - - [13824, 1792, 1, 256]
    - [235, 74.84]
  - - [38144, 3072, 1, 256]
    - [15, 73.144]
  - - [33280, 3072, 1, 256]
    - [19, 73.418]
  - - [35584, 23296, 1, 256]
    - [36, 74.79]
  - - [43520, 768, 1, 256]
    - [225, 77.031]
  - - [40704, 1536, 1, 256]
    - [17, 71.038]
  - - [29696, 3072, 1, 256]
    - [15, 73.642]
  - - [32256, 19969, 1, 256]
    - [48, 73.669]
  - - [40960, 9216, 1, 256]
    - [26, 67.099]
  - - [37632, 9216, 1, 256]
    - [17, 73.983]
  - - [42240, 2305, 1, 256]
    - [21, 68.068]
  - - [17920, 5377, 1, 256]
    - [14, 71.454]
  - - [27904, 9216, 1, 256]
    - [29, 74.405]
  - - [34304, 22016, 1, 256]
    - [30, 75.492]
  - - [11776, 8705, 1, 256]
    - [19, 72.055]
  - - [22272, 1536, 1, 256]
    - [235, 79.112]
  - - [25856, 9216, 1, 256]
    - [15, 74.358]
  - - [19712, 3072, 1, 256]
    - [19, 70.534]
  - - [41472, 9216, 1, 256]
    - [30, 74.605]
  - - [42496, 27648, 1, 256]
    - [18, 75.01]
  - - [44288, 4352, 1, 256]
    - [26, 73.828]
  - - [42496, 2561, 1, 256]
    - [15, 68.824]
  - - [9984, 6657, 1, 256]
    - [17, 71.101]
  - - [43008, 3073, 1, 256]
    - [38, 69.489]
  - - [36352, 24065, 1, 256]
    - [29, 73.734]
  - - [24832, 3072, 1, 256]
    - [20, 72.622]
  - - [29184, 16641, 1, 256]
    - [21, 73.633]
  - - [1024, 2048, 1, 256]
    - [323, 41.031]
  - - [42240, 27648, 1, 256]
    - [18, 74.587]
  - - [9984, 1792, 1, 256]
    - [223, 72.573]
  - - [44288, 3072, 1, 256]
    - [38, 72.705]
  - - [11008, 768, 1, 256]
    - [357, 65.925]
  - - [28672, 16129, 1, 256]
    - [38, 73.603]
  - - [17920, 9216, 1, 256]
    - [49, 74.862]
  - - [25088, 12801, 1, 256]
    - [31, 73.417]
  - - [19712, 9216, 1, 256]
    - [29, 74.04]
  - - [31744, 19457, 1, 256]
    - [15, 72.863]
  - - [36864, 1792, 1, 256]
    - [17, 72.242]
  - - [42496, 1792, 1, 256]
    - [15, 72.873]
  - - [39936, 9216, 1, 256]
    - [15, 74.655]
  - - [8960, 1792, 1, 256]
    - [284, 70.593]
  - - [17664, 5121, 1, 256]
    - [19, 69.096]
  - - [38144, 25601, 1, 256]
    - [18, 72.464]
  - - [27136, 14849, 1, 256]
    - [31, 73.926]
  - - [31744, 19456, 1, 256]
    - [17, 75.314]
  - - [33024, 3072, 1, 256]
    - [14, 72.339]
  - - [37888, 9216, 1, 256]
    - [17, 74.723]
  - - [6912, 1792, 1, 256]
    - [203, 69.316]
  - - [42240, 2049, 1, 256]
    - [25, 66.103]
  - - [34048, 3072, 1, 256]
    - [20, 72.477]
  - - [37120, 9216, 1, 256]
    - [29, 74.336]
  - - [14080, 9216, 1, 256]
    - [19, 73.043]
  - - [38400, 1792, 1, 256]
    - [15, 72.333]
  - - [43776, 9216, 1, 256]
    - [29, 74.086]
  - - [14336, 2049, 1, 256]
    - [232, 73.365]
  - - [37120, 24577, 1, 256]
    - [29, 72.438]
  - - [30976, 18433, 1, 256]
    - [18, 72.375]
  - - [37632, 3072, 1, 256]
    - [15, 72.923]
  - - [34560, 1792, 1, 256]
    - [23, 71.797]
  - - [5120, 3072, 1, 256]
    - [355, 72.411]
  - - [21760, 9217, 1, 256]
    - [21, 71.598]
  - - [24064, 11521, 1, 256]
    - [19, 73.393]
  - - [7936, 3072, 1, 256]
    - [326, 76.704]
  - - [21760, 9472, 1, 256]
    - [17, 75.121]
  - - [9216, 6145, 1, 256]
    - [17, 69.56]
  - - [8192, 1536, 1, 256]
    - [230, 68.127]
  - - [39936, 27648, 1, 256]
    - [15, 74.967]
  - - [21248, 9216, 1, 256]
    - [17, 74.493]
  - - [5376, 2049, 1, 256]
    - [248, 65.356]
  - - [35072, 22529, 1, 256]
    - [38, 72.351]
  - - [13312, 769, 1, 256]
    - [353, 59.611]
  - - [35840, 9216, 1, 256]
    - [15, 74.674]
  - - [39424, 27136, 1, 256]
    - [26, 75.313]
  - - [26368, 9216, 1, 256]
    - [17, 74.3]
  - - [34048, 21505, 1, 256]
    - [18, 72.296]
  - - [26112, 1792, 1, 256]
    - [40, 71.895]
  - - [23296, 768, 1, 256]
    - [250, 70.36]
  - - [43264, 27648, 1, 256]
    - [17, 74.283]
  - - [18432, 9216, 1, 256]
    - [15, 75.027]
  - - [38912, 3072, 1, 256]
    - [17, 73.845]
  - - [30464, 17921, 1, 256]
    - [29, 72.452]
  - - [37376, 9216, 1, 256]
    - [29, 74.853]
  - - [256, 3072, 1, 256]
    - [62, 36.28]
  - - [9472, 3072, 1, 256]
    - [326, 79.736]
  - - [35840, 23552, 1, 256]
    - [17, 75.421]
  - - [8960, 3072, 1, 256]
    - [232, 79.565]
  - - [34816, 3072, 1, 256]
    - [15, 73.722]
  - - [11008, 3072, 1, 256]
    - [231, 78.107]
  - - [36864, 1536, 1, 256]
    - [17, 70.739]
  - - [23552, 9216, 1, 256]
    - [15, 74.931]
  - - [31232, 18945, 1, 256]
    - [29, 73.789]
  - - [27136, 9216, 1, 256]
    - [31, 74.972]
  - - [19968, 7681, 1, 256]
    - [29, 72.249]
  - - [31488, 18945, 1, 256]
    - [21, 73.064]
  - - [33280, 1792, 1, 256]
    - [20, 72.275]
  - - [14592, 3072, 1, 256]
    - [40, 70.802]
  - - [30976, 18689, 1, 256]
    - [29, 72.645]
  - - [4096, 769, 1, 256]
    - [237, 45.847]
  - - [31488, 3072, 1, 256]
    - [15, 72.752]
  - - [33024, 1792, 1, 256]
    - [40, 70.613]
  - - [11520, 8449, 1, 256]
    - [19, 71.344]
  - - [44544, 4353, 1, 256]
    - [21, 71.136]
  - - [18176, 5889, 1, 256]
    - [15, 70.944]
  - - [5632, 2305, 1, 256]
    - [353, 67.498]
  - - [39936, 27393, 1, 256]
    - [38, 73.828]
  - - [10240, 7169, 1, 256]
    - [15, 70.424]
  - - [39168, 26625, 1, 256]
    - [18, 72.658]
  - - [10752, 7681, 1, 256]
    - [17, 71.73]
  - - [13824, 1536, 1, 256]
    - [235, 74.789]
  - - [14336, 9216, 1, 256]
    - [15, 74.678]
  - - [37632, 25345, 1, 256]
    - [38, 73.074]
  - - [35840, 23553, 1, 256]
    - [21, 73.019]
  - - [23552, 3072, 1, 256]
    - [15, 73.223]
  - - [19712, 7169, 1, 256]
    - [38, 69.862]
  - - [5888, 2561, 1, 256]
    - [235, 69.781]
  - - [27136, 768, 1, 256]
    - [235, 75.15]
  - - [22272, 1792, 1, 256]
    - [23, 70.322]
  - - [15616, 1536, 1, 256]
    - [284, 77.084]
  - - [3840, 769, 1, 256]
    - [354, 46.572]
  - - [42240, 2304, 1, 256]
    - [15, 72.628]
  - - [24576, 3072, 1, 256]
    - [12, 68.65]
  - - [27136, 1536, 1, 256]
    - [20, 70.093]
  - - [25344, 12801, 1, 256]
    - [18, 72.186]
  - - [32512, 20224, 1, 256]
    - [14, 75.143]
  - - [17664, 3072, 1, 256]
    - [20, 71.451]
  - - [28160, 15873, 1, 256]
    - [21, 73.603]
  - - [40960, 3072, 1, 256]
    - [26, 66.819]
  - - [14592, 9216, 1, 256]
    - [47, 72.836]
  - - [22784, 10497, 1, 256]
    - [29, 72.571]
  - - [22272, 3072, 1, 256]
    - [20, 72.388]
  - - [39680, 27137, 1, 256]
    - [21, 72.405]
  - - [20992, 8704, 1, 256]
    - [15, 75.323]
  - - [24320, 1536, 1, 256]
    - [293, 79.984]
  - - [7936, 4865, 1, 256]
    - [326, 78.247]
  - - [17664, 5376, 1, 256]
    - [20, 73.382]
  - - [37888, 25345, 1, 256]
    - [38, 73.968]
  - - [23296, 10753, 1, 256]
    - [21, 72.528]
  - - [28416, 15873, 1, 256]
    - [46, 73.027]
  - - [27648, 15361, 1, 256]
    - [21, 72.759]
  - - [39424, 1536, 1, 256]
    - [20, 70.892]
  - - [15104, 2817, 1, 256]
    - [17, 68.216]
  - - [19456, 9216, 1, 256]
    - [15, 74.881]
  - - [24064, 11777, 1, 256]
    - [31, 73.397]
  - - [40448, 1536, 1, 256]
    - [19, 71.11]
  - - [512, 3072, 1, 256]
    - [71, 44.68]
  - - [38912, 9216, 1, 256]
    - [17, 74.717]
  - - [19456, 6913, 1, 256]
    - [17, 72.86]
  - - [29440, 1792, 1, 256]
    - [23, 71.532]
  - - [41984, 9216, 1, 256]
    - [17, 74.61]
  - - [14080, 1793, 1, 256]
    - [220, 73.035]
  - - [20992, 8449, 1, 256]
    - [21, 72.683]
  - - [17920, 768, 1, 256]
    - [326, 69.974]
  - - [10496, 7169, 1, 256]
    - [38, 69.631]
  - - [40704, 27648, 1, 256]
    - [17, 74.406]
  - - [13568, 1025, 1, 256]
    - [236, 66.483]
  - - [38144, 9216, 1, 256]
    - [29, 74.19]
  - - [27392, 15104, 1, 256]
    - [31, 74.726]
  - - [2304, 3072, 1, 256]
    - [324, 63.009]
  - - [9472, 6401, 1, 256]
    - [15, 70.416]
  - - [39424, 1792, 1, 256]
    - [40, 72.285]
  - - [41728, 768, 1, 256]
    - [235, 76.883]
  - - [11264, 3072, 1, 256]
    - [235, 81.81]
  - - [25344, 3072, 1, 256]
    - [20, 72.1]
  - - [24576, 1792, 1, 256]
    - [15, 67.901]
  - - [27392, 14849, 1, 256]
    - [29, 72.861]
  - - [14848, 2561, 1, 256]
    - [235, 77.918]
  - - [28160, 3072, 1, 256]
    - [17, 73.026]
  - - [23552, 11009, 1, 256]
    - [38, 73.699]
  - - [11776, 8449, 1, 256]
    - [38, 72.092]
  - - [16640, 1792, 1, 256]
    - [235, 77.962]
  - - [24576, 12289, 1, 256]
    - [21, 67.331]
  - - [38656, 26369, 1, 256]
    - [18, 72.925]
  - - [13824, 9216, 1, 256]
    - [41, 74.326]
  - - [28928, 1792, 1, 256]
    - [17, 71.293]
  - - [27904, 15361, 1, 256]
    - [29, 72.692]
  - - [3840, 1792, 1, 256]
    - [237, 61.778]
  - - [14848, 3072, 1, 256]
    - [15, 71.769]
  - - [27904, 1536, 1, 256]
    - [40, 70.041]
  - - [34816, 1536, 1, 256]
    - [17, 71.375]
  - - [14592, 2305, 1, 256]
    - [235, 74.166]
  - - [22528, 9985, 1, 256]
    - [17, 73.686]
  - - [26368, 13825, 1, 256]
    - [48, 72.918]
  - - [4096, 1792, 1, 256]
    - [231, 62.735]
  - - [30720, 18177, 1, 256]
    - [38, 74.079]
  - - [37120, 24833, 1, 256]
    - [29, 73.124]
  - - [24320, 3072, 1, 256]
    - [15, 72.794]
  - - [2560, 1536, 1, 256]
    - [328, 53.614]
  - - [44032, 4097, 1, 256]
    - [38, 70.115]
  - - [44544, 27648, 1, 256]
    - [18, 74.734]
  - - [34048, 21761, 1, 256]
    - [18, 72.608]
  - - [24064, 1536, 1, 256]
    - [235, 79.874]
  - - [24832, 12545, 1, 256]
    - [48, 73.308]
  - - [44032, 3841, 1, 256]
    - [15, 70.954]
  - - [40448, 257, 1, 256]
    - [231, 57.118]
  - - [26624, 14337, 1, 256]
    - [21, 72.796]
  - - [8192, 5121, 1, 256]
    - [15, 68.016]
  - - [42240, 1536, 1, 256]
    - [17, 70.765]
  - - [5888, 2817, 1, 256]
    - [220, 69.798]
  - - [6144, 1792, 1, 256]
    - [326, 69.228]
  - - [16384, 1792, 1, 256]
    - [238, 67.804]
  - - [35584, 23297, 1, 256]
    - [21, 73.151]
  - - [36352, 24064, 1, 256]
    - [18, 75.214]
  - - [23040, 1536, 1, 256]
    - [235, 79.111]
  - - [8704, 1536, 1, 256]
    - [203, 72.256]
  - - [18432, 6145, 1, 256]
    - [15, 70.988]
  - - [12032, 3072, 1, 256]
    - [235, 80.295]
  - - [39168, 3072, 1, 256]
    - [19, 72.818]
  - - [28160, 1536, 1, 256]
    - [38, 70.098]
  - - [41728, 27648, 1, 256]
    - [29, 73.797]
  - - [28416, 1792, 1, 256]
    - [20, 70.953]
  - - [24320, 12032, 1, 256]
    - [14, 75.433]
  - - [28928, 16385, 1, 256]
    - [38, 72.397]
  - - [34816, 22528, 1, 256]
    - [15, 75.054]
  - - [26368, 1792, 1, 256]
    - [23, 71.252]
  - - [25856, 13569, 1, 256]
    - [18, 72.951]
  - - [25600, 13312, 1, 256]
    - [17, 75.771]
  - - [31232, 18689, 1, 256]
    - [18, 73.883]
  - - [20736, 9216, 1, 256]
    - [15, 74.492]
  - - [34304, 9216, 1, 256]
    - [30, 75.021]
  - - [43264, 3073, 1, 256]
    - [38, 69.053]
  - - [8704, 5633, 1, 256]
    - [15, 70.581]
  - - [4864, 1793, 1, 256]
    - [236, 61.197]
  - - [41984, 3072, 1, 256]
    - [17, 73.928]
  - - [20992, 3072, 1, 256]
    - [15, 72.977]
  - - [9728, 6401, 1, 256]
    - [17, 70.891]
  - - [16640, 4097, 1, 256]
    - [38, 67.999]
  - - [38400, 9216, 1, 256]
    - [18, 74.802]
  - - [38656, 1536, 1, 256]
    - [20, 70.607]
  - - [1536, 3072, 1, 256]
    - [230, 56.669]
  - - [12544, 1792, 1, 256]
    - [234, 77.768]
  - - [37632, 1792, 1, 256]
    - [40, 71.968]
  - - [17152, 4609, 1, 256]
    - [17, 70.191]
  - - [18944, 6656, 1, 256]
    - [19, 74.667]
  - - [34560, 22017, 1, 256]
    - [21, 73.029]
  - - [23296, 11008, 1, 256]
    - [17, 74.913]
  - - [14848, 768, 1, 256]
    - [225, 70.288]
  - - [38656, 1792, 1, 256]
    - [20, 71.937]
  - - [8448, 5377, 1, 256]
    - [20, 70.346]
  - - [29952, 17665, 1, 256]
    - [48, 73.321]
  - - [33792, 21504, 1, 256]
    - [17, 75.406]
  - - [24576, 1536, 1, 256]
    - [296, 71.81]
  - - [37376, 1792, 1, 256]
    - [15, 72.422]
  - - [42752, 768, 1, 256]
    - [326, 76.466]
  - - [4096, 1025, 1, 256]
    - [324, 49.512]
  - - [35840, 768, 1, 256]
    - [235, 77.817]
  - - [19200, 3072, 1, 256]
    - [24, 71.676]
  - - [33536, 1792, 1, 256]
    - [23, 71.782]
  - - [36864, 9216, 1, 256]
    - [12, 74.017]
  - - [38656, 26368, 1, 256]
    - [18, 74.56]
  - - [44288, 9216, 1, 256]
    - [29, 74.399]
  - - [44288, 4097, 1, 256]
    - [38, 69.82]
  - - [26112, 3072, 1, 256]
    - [17, 73.247]
  - - [512, 768, 1, 256]
    - [62, 22.789]
  - - [36096, 3072, 1, 256]
    - [14, 71.493]
  - - [4864, 1537, 1, 256]
    - [236, 58.35]
  - - [31232, 18944, 1, 256]
    - [19, 75.689]
  - - [20224, 7681, 1, 256]
    - [18, 71.553]
  - - [26112, 9216, 1, 256]
    - [29, 74.995]
  - - [21504, 3072, 1, 256]
    - [15, 73.129]
  - - [12544, 3072, 1, 256]
    - [232, 81.177]
  - - [32256, 19713, 1, 256]
    - [46, 73.799]
  - - [40704, 1792, 1, 256]
    - [20, 72.126]
  - - [18176, 5888, 1, 256]
    - [23, 73.909]
  - - [33792, 9216, 1, 256]
    - [17, 74.743]
  - - [26624, 14336, 1, 256]
    - [15, 75.385]
  - - [38912, 1792, 1, 256]
    - [17, 72.82]
  - - [7936, 1792, 1, 256]
    - [237, 69.826]
  - - [28672, 16385, 1, 256]
    - [38, 72.361]
  - - [18944, 3072, 1, 256]
    - [40, 72.445]
  - - [33280, 20993, 1, 256]
    - [31, 73.865]
  - - [37120, 24832, 1, 256]
    - [17, 74.866]
  - - [43520, 1792, 1, 256]
    - [17, 72.876]
  - - [16896, 4609, 1, 256]
    - [19, 70.699]
  - - [41472, 1536, 1, 256]
    - [15, 71.132]
  - - [39936, 768, 1, 256]
    - [235, 77.411]
  - - [23296, 11009, 1, 256]
    - [38, 72.525]
  - - [26624, 9216, 1, 256]
    - [15, 74.827]
  - - [29184, 9216, 1, 256]
    - [49, 74.75]
  - - [36352, 9216, 1, 256]
    - [18, 74.823]
  - - [37632, 25344, 1, 256]
    - [17, 74.856]
  - - [37888, 25600, 1, 256]
    - [17, 75.356]
  - - [16640, 9216, 1, 256]
    - [29, 74.324]
  - - [44544, 9216, 1, 256]
    - [18, 74.614]
  - - [14080, 1792, 1, 256]
    - [234, 75.35]
  - - [33536, 21249, 1, 256]
    - [46, 73.389]
  - - [34048, 21760, 1, 256]
    - [42, 74.55]
  - - [9984, 768, 1, 256]
    - [326, 62.485]
  - - [40192, 1536, 1, 256]
    - [15, 71.09]
  - - [41728, 3072, 1, 256]
    - [19, 71.64]
  - - [35328, 9216, 1, 256]
    - [31, 74.937]
  - - [32512, 768, 1, 256]
    - [326, 75.18]
  - - [14592, 2049, 1, 256]
    - [235, 72.37]
  - - [14848, 9216, 1, 256]
    - [29, 74.684]
  - - [23808, 3072, 1, 256]
    - [15, 72.789]
  - - [13568, 9216, 1, 256]
    - [17, 74.107]
  - - [42496, 2560, 1, 256]
    - [15, 73.708]
  - - [42752, 3072, 1, 256]
    - [15, 73.224]
  - - [39680, 27392, 1, 256]
    - [15, 74.582]
  - - [14592, 1792, 1, 256]
    - [235, 76.849]
  - - [25600, 13313, 1, 256]
    - [21, 72.762]
  - - [26624, 1792, 1, 256]
    - [17, 72.142]
  - - [20480, 8193, 1, 256]
    - [38, 71.705]
  - - [36096, 23808, 1, 256]
    - [29, 74.247]
  - - [15104, 2561, 1, 256]
    - [235, 77.852]
  - - [43520, 3072, 1, 256]
    - [17, 73.788]
  - - [1280, 2048, 1, 256]
    - [235, 43.453]
  - - [43008, 1792, 1, 256]
    - [15, 72.967]
  - - [18688, 3072, 1, 256]
    - [15, 72.245]
  - - [35328, 23040, 1, 256]
    - [19, 75.432]
  - - [18944, 6401, 1, 256]
    - [48, 71.873]
  - - [16128, 3585, 1, 256]
    - [15, 69.134]
  - - [29952, 1536, 1, 256]
    - [15, 70.233]
  - - [17408, 5121, 1, 256]
    - [38, 70.042]
  - - [36608, 1792, 1, 256]
    - [23, 71.769]
  - - [13056, 768, 1, 256]
    - [230, 67.527]
  - - [26112, 13824, 1, 256]
    - [43, 75.824]
  - - [43520, 3585, 1, 256]
    - [38, 70.545]
  - - [40704, 9216, 1, 256]
    - [15, 74.131]
  - - [27904, 15617, 1, 256]
    - [30, 73.165]
  - - [21248, 3072, 1, 256]
    - [24, 72.225]
  - - [38912, 1536, 1, 256]
    - [17, 71.532]
  - - [28672, 1792, 1, 256]
    - [17, 71.832]
  - - [18432, 1792, 1, 256]
    - [234, 79.551]
  - - [29952, 9216, 1, 256]
    - [14, 74.232]
  - - [4352, 1025, 1, 256]
    - [231, 52.61]
  - - [34304, 22017, 1, 256]
    - [31, 73.821]
  - - [28160, 15617, 1, 256]
    - [38, 73.595]
  - - [19968, 9216, 1, 256]
    - [18, 74.953]
  - - [7424, 4353, 1, 256]
    - [235, 75.935]
  - - [19200, 1792, 1, 256]
    - [326, 78.957]
  - - [27648, 15360, 1, 256]
    - [17, 75.75]
  - - [23040, 10497, 1, 256]
    - [46, 73.426]
  - - [21248, 8961, 1, 256]
    - [46, 72.223]
  - - [32256, 1792, 1, 256]
    - [20, 72.227]
  - - [26112, 13569, 1, 256]
    - [31, 73.707]
  - - [12288, 8961, 1, 256]
    - [15, 72.875]
  - - [6656, 3585, 1, 256]
    - [326, 73.481]
  - - [19968, 7425, 1, 256]
    - [38, 72.526]
  - - [9472, 768, 1, 256]
    - [236, 63.494]
  - - [33792, 3072, 1, 256]
    - [17, 73.595]
  - - [15616, 3072, 1, 256]
    - [15, 71.795]
  - - [8704, 5377, 1, 256]
    - [17, 70.194]
  - - [11520, 3072, 1, 256]
    - [235, 80.145]
  - - [25856, 1536, 1, 256]
    - [24, 69.702]
  - - [28416, 768, 1, 256]
    - [225, 74.515]
  - - [32256, 3072, 1, 256]
    - [15, 73.426]
  - - [20736, 1536, 1, 256]
    - [326, 78.453]
  - - [22784, 10241, 1, 256]
    - [29, 71.799]
  - - [36608, 24321, 1, 256]
    - [29, 72.971]
  - - [36096, 9216, 1, 256]
    - [18, 73.759]
  - - [10752, 768, 1, 256]
    - [231, 64.296]
  - - [38400, 26112, 1, 256]
    - [17, 75.376]
  - - [9216, 5889, 1, 256]
    - [23, 70.705]
  - - [41472, 27648, 1, 256]
    - [31, 74.643]
  - - [38144, 25856, 1, 256]
    - [15, 74.767]
  - - [15360, 3073, 1, 256]
    - [17, 67.924]
  - - [29184, 16896, 1, 256]
    - [15, 75.487]
  - - [16128, 1792, 1, 256]
    - [235, 78.104]
  - - [32768, 20225, 1, 256]
    - [37, 57.927]
  - - [23040, 10752, 1, 256]
    - [14, 75.65]
  - - [15872, 3585, 1, 256]
    - [15, 69.965]
  - - [11008, 7681, 1, 256]
    - [45, 70.59]
  - - [15360, 9216, 1, 256]
    - [15, 74.876]
  - - [28416, 16128, 1, 256]
    - [19, 74.891]
  - - [30208, 1792, 1, 256]
    - [17, 71.803]
  - - [41728, 1792, 1, 256]
    - [42, 71.002]
  - - [32256, 19968, 1, 256]
    - [19, 75.446]
  - - [18944, 1792, 1, 256]
    - [232, 79.895]
  - - [41728, 1793, 1, 256]
    - [15, 66.538]
  - - [31488, 19201, 1, 256]
    - [21, 73.037]
  - - [40192, 257, 1, 256]
    - [357, 57.031]
  - - [42752, 27648, 1, 256]
    - [17, 74.278]
  - - [40704, 768, 1, 256]
    - [272, 75.441]
  - - [25088, 12545, 1, 256]
    - [14, 73.619]
  - - [24576, 9216, 1, 256]
    - [26, 70.049]
  - - [33024, 20737, 1, 256]
    - [48, 73.586]
  - - [29696, 9216, 1, 256]
    - [17, 74.863]
  - - [31232, 1536, 1, 256]
    - [15, 70.863]
  - - [30208, 17920, 1, 256]
    - [14, 75.773]
  - - [44544, 4609, 1, 256]
    - [38, 71.087]
  - - [22016, 9728, 1, 256]
    - [15, 75.247]
  - - [30208, 17921, 1, 256]
    - [30, 73.75]
  - - [19200, 6657, 1, 256]
    - [46, 71.173]
  - - [22016, 9729, 1, 256]
    - [14, 73.212]
  - - [18176, 768, 1, 256]
    - [355, 69.753]
  - - [29184, 1792, 1, 256]
    - [40, 71.58]
  - - [12288, 1792, 1, 256]
    - [234, 75.353]
  - - [22528, 1536, 1, 256]
    - [245, 78.821]
  - - [14848, 2305, 1, 256]
    - [326, 74.401]
  - - [41216, 1025, 1, 256]
    - [22, 63.189]
  - - [8192, 3072, 1, 256]
    - [286, 74.552]
  - - [5888, 1792, 1, 256]
    - [355, 67.252]
  - - [21760, 3072, 1, 256]
    - [24, 72.375]
  - - [22272, 9985, 1, 256]
    - [48, 72.608]
  - - [29184, 1536, 1, 256]
    - [20, 70.393]
  - - [22016, 3072, 1, 256]
    - [14, 72.804]
  - - [30720, 9216, 1, 256]
    - [17, 74.894]
  - - [39680, 1792, 1, 256]
    - [17, 72.047]
  - - [9728, 1536, 1, 256]
    - [232, 70.944]
  - - [34560, 9216, 1, 256]
    - [15, 74.255]
  - - [12032, 8705, 1, 256]
    - [15, 71.355]
  - - [10752, 7425, 1, 256]
    - [19, 71.821]
  - - [18688, 1536, 1, 256]
    - [236, 78.363]
  - - [16128, 3840, 1, 256]
    - [23, 72.828]
  - - [38656, 768, 1, 256]
    - [326, 77.663]
  - - [21248, 1792, 1, 256]
    - [235, 82.048]
  - - [36352, 3072, 1, 256]
    - [17, 73.493]
  - - [19968, 7680, 1, 256]
    - [17, 75.125]
  - - [3840, 513, 1, 256]
    - [285, 38.608]
  - - [38400, 3072, 1, 256]
    - [15, 73.324]
  - - [5376, 768, 1, 256]
    - [206, 52.964]
  - - [20224, 9216, 1, 256]
    - [15, 74.585]
  - - [17408, 5120, 1, 256]
    - [17, 74.321]
  - - [28928, 9216, 1, 256]
    - [15, 74.117]
  - - [35072, 1792, 1, 256]
    - [17, 71.863]
  - - [31488, 19200, 1, 256]
    - [17, 75.016]
  - - [11008, 7937, 1, 256]
    - [47, 70.797]
  - - [21248, 8705, 1, 256]
    - [48, 72.196]
  - - [13568, 3072, 1, 256]
    - [23, 71.084]
  - - [34560, 22273, 1, 256]
    - [21, 73.128]
  - - [34048, 768, 1, 256]
    - [235, 76.64]
  - - [40448, 27648, 1, 256]
    - [30, 74.661]
  - - [28416, 16129, 1, 256]
    - [38, 73.072]
  - - [34816, 22529, 1, 256]
    - [21, 72.704]
  - - [22528, 3072, 1, 256]
    - [17, 73.326]
  - - [27136, 14593, 1, 256]
    - [46, 73.833]
  - - [35584, 3072, 1, 256]
    - [17, 72.72]
  - - [43008, 3072, 1, 256]
    - [17, 73.831]
  - - [30464, 1792, 1, 256]
    - [20, 70.013]
  - - [16384, 4097, 1, 256]
    - [17, 59.138]
  - - [20992, 9216, 1, 256]
    - [29, 75.069]
  - - [31488, 1792, 1, 256]
    - [23, 71.727]
  - - [31488, 9216, 1, 256]
    - [17, 74.117]
  - - [22272, 9984, 1, 256]
    - [20, 75.013]
  - - [41728, 1537, 1, 256]
    - [17, 65.171]
  - - [26880, 1792, 1, 256]
    - [17, 71.327]
  - - [30464, 768, 1, 256]
    - [326, 74.466]
  - - [2816, 1792, 1, 256]
    - [361, 56.081]
  - - [41472, 1537, 1, 256]
    - [15, 66.289]
  - - [43008, 27648, 1, 256]
    - [15, 74.892]
  - - [39424, 27137, 1, 256]
    - [29, 73.628]
  - - [24320, 1792, 1, 256]
    - [20, 70.912]
  - - [32000, 3072, 1, 256]
    - [15, 72.768]
  - - [12800, 1792, 1, 256]
    - [232, 77.813]
  - - [15872, 3072, 1, 256]
    - [15, 72.001]
  - - [15872, 1792, 1, 256]
    - [232, 78.676]
  - - [10496, 7425, 1, 256]
    - [38, 71.106]
  - - [16896, 4608, 1, 256]
    - [15, 73.401]
  - - [9984, 6913, 1, 256]
    - [15, 71.091]
  - - [21248, 8960, 1, 256]
    - [17, 74.939]
  - - [14336, 1792, 1, 256]
    - [225, 76.971]
  - - [24832, 12544, 1, 256]
    - [20, 75.359]
  - - [30464, 18176, 1, 256]
    - [18, 74.481]
  - - [31744, 19201, 1, 256]
    - [17, 74.065]
  - - [1792, 768, 1, 256]
    - [352, 33.854]
  - - [1536, 2048, 1, 256]
    - [235, 49.863]
  - - [40192, 3072, 1, 256]
    - [15, 73.329]
  - - [42240, 3072, 1, 256]
    - [17, 73.139]
  - - [32256, 9216, 1, 256]
    - [30, 74.881]
  - - [41984, 2049, 1, 256]
    - [49, 66.57]
  - - [6656, 1792, 1, 256]
    - [218, 67.16]
  - - [13824, 1537, 1, 256]
    - [221, 69.76]
  - - [20736, 3072, 1, 256]
    - [17, 72.45]
  - - [36096, 23809, 1, 256]
    - [29, 72.71]
  - - [41728, 9216, 1, 256]
    - [18, 73.108]
  - - [25600, 768, 1, 256]
    - [223, 72.574]
  - - [37632, 768, 1, 256]
    - [235, 76.689]
  - - [25600, 9216, 1, 256]
    - [17, 75.002]
  - - [19968, 3072, 1, 256]
    - [17, 72.482]
  - - [15616, 9216, 1, 256]
    - [17, 74.411]
  - - [29184, 16897, 1, 256]
    - [21, 73.625]
  - - [7168, 3841, 1, 256]
    - [232, 74.558]
  - - [40704, 769, 1, 256]
    - [234, 68.336]
  - - [6144, 3073, 1, 256]
    - [235, 69.805]
  - - [34304, 1792, 1, 256]
    - [40, 72.252]
  - - [18688, 6400, 1, 256]
    - [15, 74.512]
  - - [20992, 1536, 1, 256]
    - [235, 78.591]
  - - [21760, 768, 1, 256]
    - [293, 71.08]
  - - [43264, 3072, 1, 256]
    - [15, 73.263]
  - - [21760, 9216, 1, 256]
    - [15, 74.502]
  - - [11264, 768, 1, 256]
    - [236, 65.325]
  - - [42496, 3072, 1, 256]
    - [15, 73.716]
  - - [30208, 17665, 1, 256]
    - [48, 73.922]
  - - [27392, 15105, 1, 256]
    - [18, 72.88]
  - - [29952, 17409, 1, 256]
    - [48, 72.467]
  - - [44032, 3072, 1, 256]
    - [15, 73.868]
  - - [41216, 9216, 1, 256]
    - [29, 74.596]
  - - [8448, 1536, 1, 256]
    - [234, 69.988]
  - - [36352, 768, 1, 256]
    - [273, 76.575]
  - - [23552, 768, 1, 256]
    - [355, 73.196]
  - - [7168, 3072, 1, 256]
    - [355, 75.672]
  - - [44288, 4353, 1, 256]
    - [38, 70.362]
  - - [36608, 768, 1, 256]
    - [235, 77.672]
  - - [15616, 3073, 1, 256]
    - [17, 68.049]
  - - [37376, 24833, 1, 256]
    - [18, 73.814]
  - - [38144, 25857, 1, 256]
    - [18, 72.949]
  - - [26880, 14592, 1, 256]
    - [17, 75.253]
  - - [6144, 2817, 1, 256]
    - [240, 70.34]
  - - [23808, 768, 1, 256]
    - [236, 71.514]
  - - [39168, 26881, 1, 256]
    - [29, 72.928]
  - - [5120, 1793, 1, 256]
    - [244, 62.708]
  - - [32512, 19969, 1, 256]
    - [31, 73.225]
  - - [43008, 2817, 1, 256]
    - [15, 69.9]
  - - [26112, 13825, 1, 256]
    - [31, 73.821]
  - - [33536, 3072, 1, 256]
    - [19, 72.881]
  - - [9728, 6657, 1, 256]
    - [17, 71.388]
  - - [2048, 3072, 1, 256]
    - [353, 61.286]
  - - [24832, 9216, 1, 256]
    - [17, 74.486]
  - - [5632, 2561, 1, 256]
    - [357, 69.063]
  - - [33280, 20992, 1, 256]
    - [19, 75.582]
  - - [20224, 7936, 1, 256]
    - [17, 74.62]
  - - [28672, 16384, 1, 256]
    - [17, 74.944]
  - - [28416, 9216, 1, 256]
    - [21, 73.936]
  - - [7936, 768, 1, 256]
    - [231, 60.517]
  - - [23552, 11265, 1, 256]
    - [15, 72.46]
  - - [25088, 3072, 1, 256]
    - [17, 72.818]
  - - [32000, 19457, 1, 256]
    - [21, 72.725]
  - - [44800, 3072, 1, 256]
    - [15, 72.719]
  - - [37120, 1792, 1, 256]
    - [17, 71.806]
  - - [30464, 18177, 1, 256]
    - [18, 72.706]
  - - [44544, 4608, 1, 256]
    - [18, 73.899]
  - - [7168, 768, 1, 256]
    - [229, 57.211]
  - - [18944, 9216, 1, 256]
    - [30, 74.773]
  - - [33280, 20737, 1, 256]
    - [46, 73.951]
  - - [25856, 3072, 1, 256]
    - [24, 72.641]
  - - [27648, 9216, 1, 256]
    - [15, 74.837]
  - - [5120, 2049, 1, 256]
    - [225, 63.148]
  - - [28160, 9216, 1, 256]
    - [35, 74.804]
  - - [37632, 25089, 1, 256]
    - [21, 73.058]
  - - [22016, 1792, 1, 256]
    - [17, 71.088]
  - - [16384, 9216, 1, 256]
    - [12, 63.2]
  - - [21504, 9217, 1, 256]
    - [21, 72.143]
  - - [20480, 7937, 1, 256]
    - [21, 72.788]
  - - [33536, 21248, 1, 256]
    - [19, 75.086]
  - - [12800, 768, 1, 256]
    - [357, 66.364]
  - - [28672, 9216, 1, 256]
    - [15, 74.277]
  - - [32000, 9216, 1, 256]
    - [17, 74.163]
  - - [44544, 3072, 1, 256]
    - [15, 73.355]
  - - [5376, 3072, 1, 256]
    - [236, 72.786]
  - - [35840, 23297, 1, 256]
    - [21, 74.027]
  - - [23808, 11521, 1, 256]
    - [21, 72.524]
  - - [13312, 1025, 1, 256]
    - [357, 65.505]
  - - [18176, 9216, 1, 256]
    - [15, 74.483]
  - - [17920, 5633, 1, 256]
    - [40, 71.536]
  - - [27648, 3072, 1, 256]
    - [15, 73.527]
  - - [1024, 3072, 1, 256]
    - [284, 49.484]
  - - [22016, 9216, 1, 256]
    - [29, 75.131]
  - - [21760, 9473, 1, 256]
    - [21, 72.475]
  - - [6144, 1536, 1, 256]
    - [241, 65.214]
  - - [16896, 1536, 1, 256]
    - [293, 77.847]
  - - [19968, 768, 1, 256]
    - [235, 68.668]
  - - [23552, 11264, 1, 256]
    - [15, 75.562]
  - - [27904, 3072, 1, 256]
    - [40, 72.351]
  - - [19712, 7425, 1, 256]
    - [48, 71.126]
  - - [26624, 14081, 1, 256]
    - [15, 73.889]
  - - [3328, 257, 1, 256]
    - [64, 31.019]
  - - [24320, 9216, 1, 256]
    - [14, 74.48]
  - - [14080, 3072, 1, 256]
    - [40, 70.439]
  - - [17408, 3072, 1, 256]
    - [15, 72.646]
  - - [21504, 9216, 1, 256]
    - [17, 74.988]
  - - [14848, 2560, 1, 256]
    - [232, 82.39]
  - - [34304, 3072, 1, 256]
    - [14, 73.279]
  - - [15104, 9216, 1, 256]
    - [15, 74.312]
  - - [17152, 4865, 1, 256]
    - [15, 70.61]
  - - [38912, 26625, 1, 256]
    - [38, 72.727]
  - - [41216, 1792, 1, 256]
    - [15, 71.942]
  - - [39424, 3072, 1, 256]
    - [17, 73.417]
  - - [30720, 18433, 1, 256]
    - [21, 72.945]
  - - [18944, 6657, 1, 256]
    - [14, 72.217]
  - - [5632, 1792, 1, 256]
    - [227, 65.8]
  - - [18176, 1792, 1, 256]
    - [326, 79.438]
  - - [31232, 9216, 1, 256]
    - [18, 74.854]
  - - [42752, 2561, 1, 256]
    - [21, 68.13]
  - - [18688, 9216, 1, 256]
    - [15, 74.553]
  - - [43776, 1792, 1, 256]
    - [29, 69.792]
  - - [10240, 1792, 1, 256]
    - [235, 72.141]
  - - [33792, 21505, 1, 256]
    - [21, 72.863]
  - - [25856, 13313, 1, 256]
    - [18, 72.38]
  - - [29952, 3072, 1, 256]
    - [19, 72.875]
  - - [5888, 768, 1, 256]
    - [355, 54.378]
  - - [20480, 9216, 1, 256]
    - [15, 74.621]
  - - [17152, 1792, 1, 256]
    - [235, 78.232]
  - - [23040, 10753, 1, 256]
    - [48, 73.355]
  - - [8960, 5889, 1, 256]
    - [20, 70.343]
  - - [16640, 4352, 1, 256]
    - [23, 72.785]
  - - [30464, 3072, 1, 256]
    - [20, 71.363]
  - - [16128, 9216, 1, 256]
    - [15, 74.406]
  - - [25344, 13057, 1, 256]
    - [29, 72.612]
  - - [39424, 9216, 1, 256]
    - [29, 74.936]
  - - [25600, 3072, 1, 256]
    - [17, 73.346]
  - - [28416, 3072, 1, 256]
    - [14, 72.357]
  - - [12800, 257, 1, 256]
    - [357, 47.209]
  - - [43264, 1792, 1, 256]
    - [15, 72.181]
  - - [20736, 8193, 1, 256]
    - [38, 71.591]
  - - [30976, 9216, 1, 256]
    - [29, 73.289]
  - - [40192, 27648, 1, 256]
    - [15, 74.477]
  - - [31232, 1792, 1, 256]
    - [24, 71.89]
  - - [36352, 23809, 1, 256]
    - [18, 73.868]
  - - [9984, 3072, 1, 256]
    - [235, 78.695]
  - - [11776, 1792, 1, 256]
    - [234, 74.637]
  - - [37120, 1536, 1, 256]
    - [24, 70.444]
  - - [14592, 2304, 1, 256]
    - [235, 78.538]
  - - [7424, 768, 1, 256]
    - [206, 58.909]
  - - [10240, 1536, 1, 256]
    - [326, 72.415]
  - - [27392, 9216, 1, 256]
    - [29, 74.083]
  - - [15104, 3072, 1, 256]
    - [23, 71.582]
  - - [19200, 9216, 1, 256]
    - [18, 74.336]
  - - [36096, 23553, 1, 256]
    - [18, 72.256]
  - - [16128, 3841, 1, 256]
    - [17, 69.422]
  - - [18432, 5889, 1, 256]
    - [15, 72.062]
  - - [43776, 3841, 1, 256]
    - [18, 69.142]
  - - [22528, 10241, 1, 256]
    - [38, 72.313]
  - - [20224, 3072, 1, 256]
    - [17, 72.17]
  - - [39680, 3072, 1, 256]
    - [15, 72.868]
  - - [20736, 8449, 1, 256]
    - [21, 72.238]
  - - [30720, 1792, 1, 256]
    - [23, 72.468]
  - - [36864, 24321, 1, 256]
    - [21, 73.196]
  - - [22784, 1536, 1, 256]
    - [225, 78.864]
  - - [7424, 4097, 1, 256]
    - [235, 75.786]
  - - [7680, 4609, 1, 256]
    - [235, 79.782]
  - - [12032, 768, 1, 256]
    - [353, 64.656]
  - - [1792, 3072, 1, 256]
    - [328, 57.972]
  - - [6400, 3073, 1, 256]
    - [327, 70.804]
  - - [29440, 17153, 1, 256]
    - [48, 73.313]
  - - [8704, 1792, 1, 256]
    - [220, 71.254]
  - - [30720, 3072, 1, 256]
    - [17, 73.577]
  - - [16384, 3841, 1, 256]
    - [26, 58.468]
  - - [40192, 9216, 1, 256]
    - [17, 74.318]
  - - [23040, 1792, 1, 256]
    - [24, 71.001]
  - - [37888, 25601, 1, 256]
    - [38, 72.878]
  - - [26368, 14080, 1, 256]
    - [15, 75.251]
  - - [30208, 3072, 1, 256]
    - [17, 72.997]
  - - [33024, 20736, 1, 256]
    - [31, 75.079]
  - - [35072, 22784, 1, 256]
    - [15, 74.903]
  - - [9472, 6145, 1, 256]
    - [17, 69.301]
  - - [22784, 1792, 1, 256]
    - [23, 70.849]
  - - [768, 2048, 1, 256]
    - [66, 44.352]
  - - [1024, 1280, 1, 256]
    - [282, 33.09]
  - - [41984, 27648, 1, 256]
    - [15, 74.925]
  - - [33024, 20481, 1, 256]
    - [30, 72.827]
  - - [33280, 1536, 1, 256]
    - [24, 71.098]
  - - [9216, 3072, 1, 256]
    - [293, 78.086]
  - - [22528, 1792, 1, 256]
    - [23, 71.567]
  - - [25088, 768, 1, 256]
    - [225, 72.307]
  - - [13825, 128, 1, 128]
    - [75, 26.713]
  - - [20609, 128, 1, 256]
    - [127, 33.58]
  - - [6017, 128, 1, 256]
    - [76, 30.524]
  - - [2305, 128, 1, 128]
    - [77, 10.976]
  - - [15745, 128, 1, 256]
    - [76, 30.656]
  - - [8833, 128, 1, 128]
    - [78, 23.452]
  - - [641, 128, 1, 128]
    - [79, 3.197]
  - - [9217, 128, 1, 128]
    - [80, 23.704]
  - - [15361, 128, 1, 256]
    - [76, 31.012]
  - - [22913, 128, 1, 256]
    - [128, 36.177]
  - - [2177, 128, 1, 128]
    - [72, 10.367]
  - - [19073, 128, 1, 256]
    - [86, 33.209]
  - - [28289, 128, 1, 128]
    - [76, 23.868]
  - - [13057, 128, 1, 256]
    - [65, 37.574]
  - - [1793, 128, 1, 128]
    - [81, 8.538]
  - - [16769, 128, 1, 128]
    - [98, 20.301]
  - - [23681, 128, 1, 256]
    - [129, 36.993]
  - - [14593, 128, 1, 256]
    - [86, 30.384]
  - - [24449, 128, 1, 128]
    - [95, 23.36]
  - - [4609, 128, 1, 256]
    - [82, 24.923]
  - - [10625, 128, 1, 128]
    - [83, 23.134]
  - - [12545, 128, 1, 256]
    - [84, 36.242]
  - - [5633, 128, 1, 128]
    - [85, 18.479]
  - - [641, 128, 1, 256]
    - [82, 4.731]
  - - [18305, 128, 1, 256]
    - [86, 31.233]
  - - [23297, 128, 1, 256]
    - [134, 36.822]
  - - [21377, 128, 1, 256]
    - [129, 34.302]
  - - [9601, 128, 1, 128]
    - [86, 24.866]
  - - [13697, 128, 1, 256]
    - [95, 29.534]
  - - [23681, 128, 1, 128]
    - [76, 23.301]
  - - [24833, 128, 1, 256]
    - [130, 38.387]
  - - [25985, 128, 1, 128]
    - [132, 25.37]
  - - [9601, 128, 1, 256]
    - [88, 35.612]
  - - [17153, 128, 1, 128]
    - [86, 20.308]
  - - [9985, 128, 1, 128]
    - [89, 25.327]
  - - [23297, 128, 1, 128]
    - [90, 22.878]
  - - [19073, 128, 1, 128]
    - [96, 21.586]
  - - [2689, 128, 1, 256]
    - [72, 18.463]
  - - [4993, 128, 1, 128]
    - [72, 19.814]
  - - [6913, 128, 1, 256]
    - [90, 33.681]
  - - [6785, 128, 1, 128]
    - [81, 22.258]
  - - [27905, 128, 1, 128]
    - [90, 23.693]
  - - [7169, 128, 1, 256]
    - [91, 27.705]
  - - [11905, 128, 1, 256]
    - [86, 35.504]
  - - [1409, 128, 1, 128]
    - [92, 7.027]
  - - [12673, 128, 1, 128]
    - [88, 26.276]
  - - [27521, 128, 1, 256]
    - [101, 34.565]
  - - [1409, 128, 1, 256]
    - [81, 10.4]
  - - [25217, 128, 1, 128]
    - [132, 24.917]
  - - [7297, 128, 1, 128]
    - [86, 20.023]
  - - [14081, 128, 1, 128]
    - [98, 18.804]
  - - [22913, 128, 1, 128]
    - [88, 23.227]
  - - [10753, 128, 1, 256]
    - [93, 32.662]
  - - [7937, 128, 1, 128]
    - [85, 21.46]
  - - [11393, 128, 1, 128]
    - [88, 24.445]
  - - [26369, 128, 1, 128]
    - [91, 22.481]
  - - [12161, 128, 1, 256]
    - [86, 36.415]
  - - [8449, 128, 1, 128]
    - [78, 22.514]
  - - [22145, 128, 1, 256]
    - [131, 35.265]
  - - [20225, 128, 1, 256]
    - [131, 33.174]
  - - [10241, 128, 1, 256]
    - [80, 35.572]
  - - [6913, 128, 1, 128]
    - [81, 21.806]
  - - [4993, 128, 1, 256]
    - [94, 26.999]
  - - [6401, 128, 1, 256]
    - [95, 32.584]
  - - [13057, 128, 1, 128]
    - [96, 26.404]
  - - [2945, 128, 1, 128]
    - [97, 13.846]
  - - [3713, 128, 1, 256]
    - [72, 20.452]
  - - [10753, 128, 1, 128]
    - [90, 23.073]
  - - [14849, 128, 1, 256]
    - [90, 30.049]
  - - [3841, 128, 1, 128]
    - [72, 15.578]
  - - [28289, 128, 1, 256]
    - [88, 35.842]
  - - [12929, 128, 1, 128]
    - [91, 26.806]
  - - [14081, 128, 1, 256]
    - [80, 29.167]
  - - [14977, 128, 1, 256]
    - [95, 30.558]
  - - [12545, 128, 1, 128]
    - [96, 25.865]
  - - [16129, 128, 1, 256]
    - [76, 32.403]
  - - [11777, 128, 1, 256]
    - [93, 34.359]
  - - [11777, 128, 1, 128]
    - [98, 24.695]
  - - [17537, 128, 1, 256]
    - [76, 31.778]
  - - [5377, 128, 1, 128]
    - [99, 17.639]
  - - [8065, 128, 1, 256]
    - [88, 31.167]
  - - [6145, 128, 1, 128]
    - [95, 19.981]
  - - [20993, 128, 1, 128]
    - [76, 22.28]
  - - [15617, 128, 1, 128]
    - [96, 20.563]
  - - [5633, 128, 1, 256]
    - [76, 28.675]
  - - [4865, 128, 1, 128]
    - [82, 19.203]
  - - [385, 128, 1, 256]
    - [77, 2.856]
  - - [3841, 128, 1, 256]
    - [94, 21.236]
  - - [8833, 128, 1, 256]
    - [91, 33.694]
  - - [4225, 128, 1, 128]
    - [77, 17.135]
  - - [11009, 128, 1, 256]
    - [91, 33.235]
  - - [385, 128, 1, 128]
    - [77, 1.973]
  - - [9473, 128, 1, 256]
    - [91, 35.137]
  - - [5761, 128, 1, 128]
    - [81, 19.155]
  - - [11905, 128, 1, 128]
    - [96, 25.324]
  - - [4097, 128, 1, 256]
    - [100, 22.568]
  - - [25217, 128, 1, 256]
    - [129, 38.617]
  - - [9089, 128, 1, 256]
    - [86, 25.783]
  - - [10369, 128, 1, 256]
    - [90, 26.562]
  - - [14209, 128, 1, 256]
    - [95, 30.171]
  - - [6401, 128, 1, 128]
    - [100, 20.814]
  - - [27137, 128, 1, 256]
    - [89, 34.409]
  - - [16385, 128, 1, 256]
    - [96, 29.276]
  - - [24833, 128, 1, 128]
    - [95, 23.667]
  - - [18689, 128, 1, 128]
    - [78, 21.271]
  - - [7553, 128, 1, 256]
    - [76, 29.265]
  - - [8321, 128, 1, 128]
    - [90, 22.334]
  - - [15361, 128, 1, 128]
    - [96, 19.971]
  - - [1153, 128, 1, 128]
    - [81, 5.75]
  - - [1025, 128, 1, 128]
    - [77, 5.182]
  - - [19841, 128, 1, 256]
    - [124, 32.423]
  - - [15233, 128, 1, 128]
    - [98, 19.827]
  - - [21761, 128, 1, 256]
    - [128, 34.842]
  - - [17153, 128, 1, 256]
    - [91, 31.474]
  - - [15617, 128, 1, 256]
    - [96, 31.685]
  - - [4865, 128, 1, 256]
    - [81, 26.404]
  - - [14209, 128, 1, 128]
    - [96, 18.967]
  - - [19457, 128, 1, 256]
    - [98, 33.461]
  - - [9857, 128, 1, 256]
    - [89, 36.107]
  - - [11521, 128, 1, 128]
    - [95, 24.366]
  - - [8449, 128, 1, 256]
    - [89, 32.146]
  - - [4097, 128, 1, 128]
    - [72, 16.708]
  - - [28673, 128, 1, 256]
    - [118, 34.668]
  - - [12161, 128, 1, 128]
    - [90, 25.868]
  - - [1921, 128, 1, 256]
    - [77, 13.314]
  - - [9985, 128, 1, 256]
    - [89, 36.306]
  - - [7937, 128, 1, 256]
    - [90, 30.434]
  - - [9857, 128, 1, 128]
    - [80, 25.528]
  - - [13825, 128, 1, 256]
    - [95, 29.032]
  - - [9089, 128, 1, 128]
    - [80, 24.22]
  - - [6785, 128, 1, 256]
    - [90, 33.387]
  - - [5249, 128, 1, 256]
    - [90, 27.094]
  - - [7681, 128, 1, 256]
    - [88, 29.376]
  - - [3329, 128, 1, 128]
    - [77, 15.075]
  - - [14465, 128, 1, 128]
    - [96, 19.567]
  - - [11137, 128, 1, 256]
    - [90, 34.039]
  - - [1153, 128, 1, 256]
    - [81, 8.596]
  - - [16001, 128, 1, 128]
    - [86, 20.392]
  - - [26753, 128, 1, 128]
    - [91, 22.997]
  - - [13697, 128, 1, 128]
    - [96, 27.251]
  - - [3073, 128, 1, 128]
    - [97, 14.356]
  - - [22529, 128, 1, 256]
    - [128, 35.8]
  - - [18689, 128, 1, 256]
    - [89, 32.31]
  - - [257, 128, 1, 128]
    - [92, 1.282]
  - - [15233, 128, 1, 256]
    - [86, 31.855]
  - - [27521, 128, 1, 128]
    - [90, 23.676]
  - - [16385, 128, 1, 128]
    - [98, 18.806]
  - - [4481, 128, 1, 256]
    - [94, 24.683]
  - - [6017, 128, 1, 128]
    - [85, 19.916]
  - - [7297, 128, 1, 256]
    - [76, 28.273]
  - - [7553, 128, 1, 128]
    - [83, 20.572]
  - - [21761, 128, 1, 128]
    - [95, 22.662]
  - - [11393, 128, 1, 256]
    - [86, 34.324]
  - - [11521, 128, 1, 256]
    - [86, 34.428]
  - - [12929, 128, 1, 256]
    - [89, 37.424]
  - - [20225, 128, 1, 128]
    - [95, 21.928]
  - - [13313, 128, 1, 128]
    - [75, 25.928]
  - - [2561, 128, 1, 128]
    - [72, 12.04]
  - - [1537, 128, 1, 128]
    - [82, 7.718]
  - - [24449, 128, 1, 256]
    - [135, 37.636]
  - - [12289, 128, 1, 256]
    - [93, 35.432]
  - - [4225, 128, 1, 256]
    - [72, 23.101]
  - - [26369, 128, 1, 256]
    - [133, 40.172]
  - - [17921, 128, 1, 256]
    - [91, 33.102]
  - - [2945, 128, 1, 256]
    - [72, 20.127]
  - - [24065, 128, 1, 128]
    - [76, 22.965]
  - - [6529, 128, 1, 128]
    - [82, 21.514]
  - - [6145, 128, 1, 256]
    - [90, 30.96]
  - - [25985, 128, 1, 256]
    - [131, 39.546]
  - - [8705, 128, 1, 256]
    - [89, 32.533]
  - - [384, 128, 1, 256]
    - [67, 3.132]
  - - [25601, 128, 1, 256]
    - [134, 38.882]
  - - [28673, 128, 1, 128]
    - [90, 23.306]
  - - [20609, 128, 1, 128]
    - [95, 21.892]
  - - [19457, 128, 1, 128]
    - [90, 21.919]
  - - [16769, 128, 1, 256]
    - [83, 31.99]
  - - [12673, 128, 1, 256]
    - [65, 36.9]
  - - [8321, 128, 1, 256]
    - [86, 31.823]
  - - [5249, 128, 1, 128]
    - [81, 17.854]
  - - [16129, 128, 1, 128]
    - [98, 21.19]
  - - [13441, 128, 1, 256]
    - [86, 28.398]
  - - [5377, 128, 1, 256]
    - [86, 27.466]
  - - [21377, 128, 1, 128]
    - [89, 22.544]
  - - [14465, 128, 1, 256]
    - [96, 30.09]
  - - [11137, 128, 1, 128]
    - [75, 24.107]
  - - [7681, 128, 1, 128]
    - [80, 20.692]
  - - [7169, 128, 1, 128]
    - [76, 19.671]
  - - [22145, 128, 1, 128]
    - [90, 22.962]
  - - [11009, 128, 1, 128]
    - [96, 23.76]
  - - [20993, 128, 1, 256]
    - [131, 34.018]
  - - [13313, 128, 1, 256]
    - [98, 27.763]
  - - [25601, 128, 1, 128]
    - [132, 24.669]
  - - [4609, 128, 1, 128]
    - [81, 18.29]
  - - [5761, 128, 1, 256]
    - [95, 29.529]
  - - [17921, 128, 1, 128]
    - [89, 21.452]
  - - [2689, 128, 1, 128]
    - [92, 12.405]
  - - [8705, 128, 1, 128]
    - [80, 22.785]
  - - [10241, 128, 1, 128]
    - [98, 25.624]
  - - [14977, 128, 1, 128]
    - [96, 19.498]
  - - [18305, 128, 1, 128]
    - [91, 21.751]
  - - [3457, 128, 1, 128]
    - [77, 15.372]
  - - [24065, 128, 1, 256]
    - [128, 37.356]
  - - [12289, 128, 1, 128]
    - [96, 25.127]
  - - [14593, 128, 1, 128]
    - [78, 19.393]
  - - [2177, 128, 1, 256]
    - [97, 15.018]
  - - [4481, 128, 1, 128]
    - [82, 18.173]
  - - [8065, 128, 1, 128]
    - [76, 21.886]
  - - [3457, 128, 1, 256]
    - [77, 22.482]
  - - [6529, 128, 1, 256]
    - [86, 32.895]
  - - [26753, 128, 1, 256]
    - [95, 33.575]
  - - [17537, 128, 1, 128]
    - [131, 19.148]
  - - [22529, 128, 1, 128]
    - [88, 23.032]
  - - [10625, 128, 1, 256]
    - [86, 32.474]
  - - [14849, 128, 1, 128]
    - [96, 19.83]
  - - [9217, 128, 1, 256]
    - [98, 33.105]
  - - [19841, 128, 1, 128]
    - [86, 22.305]
  - - [15745, 128, 1, 128]
    - [98, 20.718]
  - - [13441, 128, 1, 128]
    - [91, 27.181]
  - - [3713, 128, 1, 128]
    - [72, 15.058]
  - - [27137, 128, 1, 128]
    - [86, 23.448]
  - - [16001, 128, 1, 256]
    - [124, 32.047]
  - - [10369, 128, 1, 128]
    - [80, 26.301]
  - - [1921, 128, 1, 128]
    - [72, 8.975]
  - - [9473, 128, 1, 128]
    - [89, 24.62]
  - - [27905, 128, 1, 256]
    - [83, 35.115]
  - - [30976, 1024, 1, 128]
    - [284, 48.852]
  - - [42240, 26369, 1, 128]
    - [12, 45.705]
  - - [33024, 17025, 1, 128]
    - [17, 46.355]
  - - [39168, 512, 1, 128]
    - [293, 46.992]
  - - [30848, 1024, 1, 128]
    - [235, 50.413]
  - - [41728, 8192, 1, 128]
    - [42, 45.865]
  - - [39552, 23553, 1, 128]
    - [12, 45.133]
  - - [35072, 512, 1, 128]
    - [233, 46.21]
  - - [29952, 14081, 1, 128]
    - [15, 45.934]
  - - [33280, 2048, 1, 128]
    - [225, 55.226]
  - - [40320, 128, 1, 128]
    - [328, 33.609]
  - - [35456, 1024, 1, 128]
    - [326, 51.842]
  - - [36096, 1024, 1, 128]
    - [357, 50.518]
  - - [36992, 20993, 1, 128]
    - [12, 45.407]
  - - [36096, 20097, 1, 128]
    - [42, 44.703]
  - - [31488, 15489, 1, 128]
    - [12, 45.828]
  - - [39552, 23681, 1, 128]
    - [12, 45.361]
  - - [36864, 128, 1, 128]
    - [226, 34.089]
  - - [40320, 4096, 1, 128]
    - [17, 45.636]
  - - [35200, 2048, 1, 128]
    - [235, 54.691]
  - - [29824, 2048, 1, 128]
    - [357, 53.934]
  - - [34688, 2048, 1, 128]
    - [235, 54.998]
  - - [42752, 26753, 1, 128]
    - [12, 45.655]
  - - [34304, 4096, 1, 128]
    - [40, 46.126]
  - - [36480, 20481, 1, 128]
    - [36, 45.313]
  - - [33408, 128, 1, 128]
    - [192, 32.437]
  - - [38784, 4096, 1, 128]
    - [23, 45.248]
  - - [43264, 27393, 1, 128]
    - [26, 45.698]
  - - [34560, 128, 1, 128]
    - [229, 33.493]
  - - [30336, 4096, 1, 128]
    - [40, 45.255]
  - - [29056, 2048, 1, 128]
    - [225, 54.914]
  - - [34816, 512, 1, 128]
    - [204, 45.604]
  - - [38272, 2048, 1, 128]
    - [60, 36.638]
  - - [39808, 23937, 1, 128]
    - [42, 43.271]
  - - [30848, 512, 1, 128]
    - [227, 45.104]
  - - [40448, 512, 1, 128]
    - [229, 46.837]
  - - [40448, 24577, 1, 128]
    - [42, 45.618]
  - - [44544, 28545, 1, 128]
    - [36, 45.737]
  - - [30208, 14209, 1, 128]
    - [19, 46.282]
  - - [34688, 18689, 1, 128]
    - [17, 45.523]
  - - [31360, 512, 1, 128]
    - [355, 45.031]
  - - [38912, 512, 1, 128]
    - [234, 48.489]
  - - [39680, 1024, 1, 128]
    - [225, 51.163]
  - - [34048, 1024, 1, 128]
    - [225, 51.866]
  - - [39552, 4096, 1, 128]
    - [26, 45.488]
  - - [40320, 24321, 1, 128]
    - [12, 45.408]
  - - [40832, 24833, 1, 128]
    - [26, 45.035]
  - - [36736, 1024, 1, 128]
    - [235, 50.994]
  - - [44672, 1024, 1, 128]
    - [235, 52.375]
  - - [32000, 128, 1, 128]
    - [354, 33.032]
  - - [40704, 4096, 1, 128]
    - [17, 45.772]
  - - [38144, 1024, 1, 128]
    - [357, 51.742]
  - - [30720, 14849, 1, 128]
    - [26, 46.757]
  - - [38144, 8192, 1, 128]
    - [15, 46.834]
  - - [30208, 1024, 1, 128]
    - [326, 50.167]
  - - [43136, 1024, 1, 128]
    - [235, 52.803]
  - - [38528, 1024, 1, 128]
    - [284, 51.773]
  - - [43264, 2048, 1, 128]
    - [25, 44.133]
  - - [38400, 22529, 1, 128]
    - [42, 45.897]
  - - [37120, 128, 1, 128]
    - [229, 33.946]
  - - [32256, 128, 1, 128]
    - [229, 32.926]
  - - [29952, 13953, 1, 128]
    - [15, 45.983]
  - - [34560, 8192, 1, 128]
    - [17, 46.641]
  - - [37504, 21505, 1, 128]
    - [19, 44.546]
  - - [33536, 128, 1, 128]
    - [282, 32.372]
  - - [41856, 2048, 1, 128]
    - [13, 44.478]
  - - [32896, 4096, 1, 128]
    - [49, 43.557]
  - - [41856, 8192, 1, 128]
    - [15, 46.566]
  - - [29440, 4096, 1, 128]
    - [26, 45.779]
  - - [33664, 8192, 1, 128]
    - [14, 46.232]
  - - [36992, 512, 1, 128]
    - [208, 44.115]
  - - [33280, 512, 1, 128]
    - [234, 46.696]
  - - [41728, 128, 1, 128]
    - [354, 34.039]
  - - [31744, 128, 1, 128]
    - [229, 32.566]
  - - [31360, 1024, 1, 128]
    - [225, 50.532]
  - - [29952, 8192, 1, 128]
    - [19, 46.599]
  - - [38016, 2048, 1, 128]
    - [357, 53.421]
  - - [34176, 8192, 1, 128]
    - [14, 46.412]
  - - [30464, 512, 1, 128]
    - [284, 45.767]
  - - [41984, 2048, 1, 128]
    - [41, 44.722]
  - - [40448, 4096, 1, 128]
    - [19, 46.116]
  - - [33920, 4096, 1, 128]
    - [17, 45.581]
  - - [41088, 8192, 1, 128]
    - [41, 45.778]
  - - [39808, 8192, 1, 128]
    - [12, 44.228]
  - - [40832, 4096, 1, 128]
    - [15, 45.606]
  - - [30592, 2048, 1, 128]
    - [235, 54.008]
  - - [36352, 1024, 1, 128]
    - [235, 51.621]
  - - [30336, 2048, 1, 128]
    - [355, 54.023]
  - - [30976, 512, 1, 128]
    - [204, 46.745]
  - - [42368, 1024, 1, 128]
    - [235, 51.662]
  - - [29056, 1024, 1, 128]
    - [235, 50.559]
  - - [38784, 22913, 1, 128]
    - [12, 45.544]
  - - [28928, 512, 1, 128]
    - [258, 44.185]
  - - [40576, 512, 1, 128]
    - [233, 46.772]
  - - [34816, 4096, 1, 128]
    - [17, 46.696]
  - - [41600, 2048, 1, 128]
    - [12, 43.878]
  - - [29696, 8192, 1, 128]
    - [15, 47.304]
  - - [41856, 4096, 1, 128]
    - [17, 45.762]
  - - [35584, 2048, 1, 128]
    - [225, 54.461]
  - - [30848, 14849, 1, 128]
    - [15, 45.765]
  - - [33280, 17281, 1, 128]
    - [14, 46.514]
  - - [43776, 2048, 1, 128]
    - [13, 43.542]
  - - [42112, 8192, 1, 128]
    - [15, 46.462]
  - - [37376, 128, 1, 128]
    - [206, 33.859]
  - - [41600, 4096, 1, 128]
    - [26, 45.603]
  - - [36224, 20353, 1, 128]
    - [26, 45.672]
  - - [29952, 1024, 1, 128]
    - [326, 49.858]
  - - [34176, 1024, 1, 128]
    - [225, 52.176]
  - - [31744, 512, 1, 128]
    - [248, 45.25]
  - - [42624, 8192, 1, 128]
    - [17, 41.712]
  - - [41216, 128, 1, 128]
    - [229, 33.084]
  - - [42624, 26753, 1, 128]
    - [51, 40.481]
  - - [32512, 2048, 1, 128]
    - [225, 54.428]
  - - [40064, 4096, 1, 128]
    - [12, 45.152]
  - - [32640, 4096, 1, 128]
    - [17, 45.254]
  - - [42112, 26241, 1, 128]
    - [12, 45.551]
  - - [32256, 512, 1, 128]
    - [234, 45.322]
  - - [40960, 1024, 1, 128]
    - [246, 46.099]
  - - [35968, 128, 1, 128]
    - [354, 33.384]
  - - [32384, 8192, 1, 128]
    - [17, 46.529]
  - - [42880, 512, 1, 128]
    - [227, 46.649]
  - - [33024, 8192, 1, 128]
    - [17, 47.007]
  - - [43904, 1024, 1, 128]
    - [357, 51.544]
  - - [33664, 17665, 1, 128]
    - [26, 45.702]
  - - [41856, 512, 1, 128]
    - [227, 47.189]
  - - [40704, 128, 1, 128]
    - [229, 34.407]
  - - [33408, 17537, 1, 128]
    - [26, 45.966]
  - - [37120, 512, 1, 128]
    - [226, 45.963]
  - - [41216, 25345, 1, 128]
    - [42, 45.806]
  - - [39680, 8192, 1, 128]
    - [15, 46.567]
  - - [40192, 24193, 1, 128]
    - [26, 45.525]
  - - [33024, 17153, 1, 128]
    - [12, 46.343]
  - - [38272, 1024, 1, 128]
    - [357, 51.257]
  - - [35328, 1024, 1, 128]
    - [225, 52.833]
  - - [31104, 8192, 1, 128]
    - [17, 46.434]
  - - [40320, 8192, 1, 128]
    - [15, 46.483]
  - - [29312, 2048, 1, 128]
    - [235, 53.627]
  - - [36608, 20737, 1, 128]
    - [12, 45.83]
  - - [42240, 4096, 1, 128]
    - [15, 45.827]
  - - [43520, 2048, 1, 128]
    - [22, 44.598]
  - - [29056, 512, 1, 128]
    - [229, 45.878]
  - - [35328, 19329, 1, 128]
    - [36, 46.24]
  - - [30464, 128, 1, 128]
    - [229, 31.677]
  - - [29696, 13697, 1, 128]
    - [17, 46.562]
  - - [43904, 28033, 1, 128]
    - [17, 45.375]
  - - [35584, 19713, 1, 128]
    - [12, 45.7]
  - - [41088, 4096, 1, 128]
    - [25, 45.105]
  - - [42368, 2048, 1, 128]
    - [25, 44.078]
  - - [36736, 128, 1, 128]
    - [328, 34.257]
  - - [30336, 8192, 1, 128]
    - [24, 46.227]
  - - [43008, 128, 1, 128]
    - [227, 35.397]
  - - [37120, 1024, 1, 128]
    - [225, 52.332]
  - - [31104, 2048, 1, 128]
    - [235, 54.393]
  - - [33152, 4096, 1, 128]
    - [23, 45.818]
  - - [43392, 27521, 1, 128]
    - [26, 45.358]
  - - [37248, 21249, 1, 128]
    - [26, 45.316]
  - - [33920, 17921, 1, 128]
    - [26, 45.594]
  - - [39680, 4096, 1, 128]
    - [15, 45.776]
  - - [43264, 512, 1, 128]
    - [204, 47.301]
  - - [35712, 8192, 1, 128]
    - [15, 46.366]
  - - [31616, 2048, 1, 128]
    - [236, 54.007]
  - - [35328, 512, 1, 128]
    - [293, 46.404]
  - - [43136, 27265, 1, 128]
    - [12, 45.393]
  - - [30208, 128, 1, 128]
    - [328, 31.226]
  - - [40320, 24449, 1, 128]
    - [26, 45.352]
  - - [44288, 2048, 1, 128]
    - [25, 44.467]
  - - [35072, 1024, 1, 128]
    - [225, 51.811]
  - - [30464, 14465, 1, 128]
    - [49, 43.511]
  - - [44160, 8192, 1, 128]
    - [15, 46.21]
  - - [33792, 17793, 1, 128]
    - [17, 46.448]
  - - [37632, 1024, 1, 128]
    - [326, 51.64]
  - - [35968, 2048, 1, 128]
    - [236, 53.524]
  - - [38400, 8192, 1, 128]
    - [19, 46.925]
  - - [32512, 4096, 1, 128]
    - [17, 45.842]
  - - [32512, 16641, 1, 128]
    - [19, 46.246]
  - - [39424, 128, 1, 128]
    - [229, 34.455]
  - - [30976, 8192, 1, 128]
    - [50, 45.168]
  - - [35968, 20097, 1, 128]
    - [15, 45.717]
  - - [38656, 512, 1, 128]
    - [293, 47.742]
  - - [34944, 18945, 1, 128]
    - [17, 45.624]
  - - [33664, 17793, 1, 128]
    - [12, 45.754]
  - - [38656, 22657, 1, 128]
    - [36, 45.798]
  - - [34944, 1024, 1, 128]
    - [326, 51.457]
  - - [31872, 16001, 1, 128]
    - [26, 45.704]
  - - [43392, 8192, 1, 128]
    - [15, 46.144]
  - - [38016, 512, 1, 128]
    - [227, 46.458]
  - - [29440, 8192, 1, 128]
    - [12, 46.686]
  - - [35200, 1024, 1, 128]
    - [284, 51.397]
  - - [34304, 18433, 1, 128]
    - [36, 46.162]
  - - [44672, 28801, 1, 128]
    - [26, 45.545]
  - - [29184, 4096, 1, 128]
    - [20, 45.73]
  - - [33408, 8192, 1, 128]
    - [17, 46.532]
  - - [39040, 128, 1, 128]
    - [227, 34.399]
  - - [39680, 23681, 1, 128]
    - [26, 45.518]
  - - [38144, 4096, 1, 128]
    - [15, 45.883]
  - - [42368, 26497, 1, 128]
    - [19, 45.346]
  - - [42368, 4096, 1, 128]
    - [40, 45.365]
  - - [31872, 128, 1, 128]
    - [354, 32.462]
  - - [41984, 512, 1, 128]
    - [204, 48.114]
  - - [39296, 2048, 1, 128]
    - [26, 43.934]
  - - [33920, 2048, 1, 128]
    - [235, 54.496]
  - - [36736, 20865, 1, 128]
    - [12, 45.681]
  - - [34432, 8192, 1, 128]
    - [19, 44.91]
  - - [30848, 14977, 1, 128]
    - [15, 45.811]
  - - [31744, 15873, 1, 128]
    - [17, 46.488]
  - - [42880, 27009, 1, 128]
    - [42, 44.895]
  - - [42240, 26241, 1, 128]
    - [26, 45.662]
  - - [38400, 4096, 1, 128]
    - [15, 45.966]
  - - [42624, 26625, 1, 128]
    - [17, 40.471]
  - - [35072, 4096, 1, 128]
    - [15, 45.875]
  - - [40576, 4096, 1, 128]
    - [15, 45.622]
  - - [39296, 8192, 1, 128]
    - [17, 46.525]
  - - [42624, 512, 1, 128]
    - [226, 46.903]
  - - [32768, 8192, 1, 128]
    - [15, 35.565]
  - - [36864, 1024, 1, 128]
    - [284, 50.307]
  - - [43392, 128, 1, 128]
    - [229, 35.086]
  - - [41344, 2048, 1, 128]
    - [28, 44.187]
  - - [35584, 4096, 1, 128]
    - [17, 45.526]
  - - [40064, 2048, 1, 128]
    - [12, 42.994]
  - - [40576, 24705, 1, 128]
    - [26, 45.497]
  - - [39808, 1024, 1, 128]
    - [236, 50.871]
  - - [36992, 1024, 1, 128]
    - [225, 50.145]
  - - [42496, 1024, 1, 128]
    - [225, 52.509]
  - - [43904, 128, 1, 128]
    - [226, 35.185]
  - - [31232, 512, 1, 128]
    - [328, 45.428]
  - - [42112, 128, 1, 128]
    - [229, 34.193]
  - - [37376, 2048, 1, 128]
    - [235, 55.376]
  - - [38016, 128, 1, 128]
    - [202, 34.191]
  - - [42368, 8192, 1, 128]
    - [19, 46.148]
  - - [43392, 512, 1, 128]
    - [226, 47.198]
  - - [41984, 1024, 1, 128]
    - [235, 53.4]
  - - [42240, 2048, 1, 128]
    - [32, 44.379]
  - - [29952, 128, 1, 128]
    - [229, 31.675]
  - - [36608, 8192, 1, 128]
    - [26, 46.612]
  - - [32512, 16513, 1, 128]
    - [42, 46.298]
  - - [29568, 512, 1, 128]
    - [227, 43.659]
  - - [34304, 1024, 1, 128]
    - [225, 51.27]
  - - [41984, 4096, 1, 128]
    - [15, 46.4]
  - - [30464, 4096, 1, 128]
    - [50, 43.433]
  - - [41216, 2048, 1, 128]
    - [25, 44.506]
  - - [36480, 20609, 1, 128]
    - [26, 45.594]
  - - [44800, 4096, 1, 128]
    - [17, 45.493]
  - - [36864, 512, 1, 128]
    - [232, 45.815]
  - - [39680, 2048, 1, 128]
    - [17, 43.919]
  - - [43648, 4096, 1, 128]
    - [15, 45.327]
  - - [33664, 128, 1, 128]
    - [279, 32.371]
  - - [41600, 512, 1, 128]
    - [229, 46.739]
  - - [43776, 1024, 1, 128]
    - [357, 50.385]
  - - [37632, 512, 1, 128]
    - [226, 48.001]
  - - [44160, 128, 1, 128]
    - [202, 35.066]
  - - [37248, 8192, 1, 128]
    - [15, 46.313]
  - - [34816, 18817, 1, 128]
    - [17, 46.801]
  - - [38528, 22529, 1, 128]
    - [26, 45.314]
  - - [40192, 24321, 1, 128]
    - [26, 45.492]
  - - [40832, 128, 1, 128]
    - [354, 33.814]
  - - [29312, 8192, 1, 128]
    - [17, 46.211]
  - - [43776, 27777, 1, 128]
    - [41, 43.983]
  - - [37632, 21633, 1, 128]
    - [26, 45.804]
  - - [33792, 4096, 1, 128]
    - [15, 46.375]
  - - [35968, 1024, 1, 128]
    - [234, 50.383]
  - - [37888, 512, 1, 128]
    - [229, 46.223]
  - - [35968, 512, 1, 128]
    - [306, 46.624]
  - - [30592, 1024, 1, 128]
    - [355, 50.081]
  - - [38400, 512, 1, 128]
    - [229, 46.444]
  - - [43264, 1024, 1, 128]
    - [235, 51.947]
  - - [38528, 4096, 1, 128]
    - [24, 45.377]
  - - [28928, 1024, 1, 128]
    - [284, 50.714]
  - - [33152, 1024, 1, 128]
    - [357, 50.419]
  - - [41344, 1024, 1, 128]
    - [235, 51.667]
  - - [30848, 8192, 1, 128]
    - [15, 46.564]
  - - [41344, 4096, 1, 128]
    - [17, 45.428]
  - - [38912, 2048, 1, 128]
    - [17, 44.728]
  - - [38272, 128, 1, 128]
    - [226, 34.528]
  - - [31488, 4096, 1, 128]
    - [15, 45.665]
  - - [44416, 4096, 1, 128]
    - [15, 45.725]
  - - [39552, 2048, 1, 128]
    - [28, 44.397]
  - - [37760, 1024, 1, 128]
    - [357, 51.044]
  - - [34304, 18305, 1, 128]
    - [36, 46.325]
  - - [44544, 28673, 1, 128]
    - [42, 45.502]
  - - [44416, 8192, 1, 128]
    - [15, 46.505]
  - - [38144, 512, 1, 128]
    - [358, 46.43]
  - - [30208, 14337, 1, 128]
    - [14, 46.144]
  - - [38144, 2048, 1, 128]
    - [357, 54.208]
  - - [40448, 128, 1, 128]
    - [229, 34.189]
  - - [42240, 8192, 1, 128]
    - [15, 46.544]
  - - [39424, 2048, 1, 128]
    - [25, 44.584]
  - - [41088, 512, 1, 128]
    - [355, 44.367]
  - - [36224, 2048, 1, 128]
    - [235, 54.185]
  - - [31744, 4096, 1, 128]
    - [17, 46.397]
  - - [44160, 512, 1, 128]
    - [226, 47.418]
  - - [32000, 1024, 1, 128]
    - [225, 50.509]
  - - [42752, 1024, 1, 128]
    - [326, 51.965]
  - - [42496, 2048, 1, 128]
    - [27, 44.786]
  - - [32640, 2048, 1, 128]
    - [355, 55.131]
  - - [42752, 26881, 1, 128]
    - [26, 45.625]
  - - [32256, 8192, 1, 128]
    - [19, 47.12]
  - - [44800, 512, 1, 128]
    - [229, 48.893]
  - - [34816, 128, 1, 128]
    - [227, 33.121]
  - - [38272, 8192, 1, 128]
    - [41, 42.399]
  - - [44800, 28929, 1, 128]
    - [12, 45.322]
  - - [37120, 8192, 1, 128]
    - [12, 46.547]
  - - [43776, 512, 1, 128]
    - [355, 44.901]
  - - [43008, 1024, 1, 128]
    - [284, 51.898]
  - - [34432, 18561, 1, 128]
    - [49, 44.536]
  - - [36736, 4096, 1, 128]
    - [17, 45.56]
  - - [36224, 512, 1, 128]
    - [293, 46.146]
  - - [32768, 512, 1, 128]
    - [199, 35.536]
  - - [30592, 128, 1, 128]
    - [206, 31.095]
  - - [43008, 27137, 1, 128]
    - [12, 46.575]
  - - [34048, 18177, 1, 128]
    - [42, 45.732]
  - - [43136, 2048, 1, 128]
    - [15, 43.944]
  - - [29184, 13313, 1, 128]
    - [12, 45.766]
  - - [40064, 24193, 1, 128]
    - [42, 44.519]
  - - [40960, 128, 1, 128]
    - [229, 33.561]
  - - [29184, 2048, 1, 128]
    - [326, 54.443]
  - - [37248, 128, 1, 128]
    - [206, 33.721]
  - - [35328, 128, 1, 128]
    - [206, 33.003]
  - - [43264, 128, 1, 128]
    - [233, 34.539]
  - - [29952, 4096, 1, 128]
    - [20, 45.58]
  - - [36736, 20737, 1, 128]
    - [26, 45.629]
  - - [34176, 4096, 1, 128]
    - [20, 45.382]
  - - [32768, 1024, 1, 128]
    - [238, 39.695]
  - - [44160, 4096, 1, 128]
    - [15, 45.544]
  - - [31104, 1024, 1, 128]
    - [326, 50.804]
  - - [33792, 512, 1, 128]
    - [326, 46.076]
  - - [41216, 25217, 1, 128]
    - [42, 45.833]
  - - [31872, 1024, 1, 128]
    - [357, 49.272]
  - - [38528, 8192, 1, 128]
    - [14, 46.201]
  - - [44672, 4096, 1, 128]
    - [17, 45.698]
  - - [32512, 1024, 1, 128]
    - [225, 49.323]
  - - [39168, 8192, 1, 128]
    - [42, 46.6]
  - - [31360, 15361, 1, 128]
    - [26, 45.526]
  - - [38016, 22145, 1, 128]
    - [26, 45.578]
  - - [35712, 128, 1, 128]
    - [229, 33.752]
  - - [30208, 4096, 1, 128]
    - [40, 45.872]
  - - [33920, 128, 1, 128]
    - [328, 32.649]
  - - [30336, 128, 1, 128]
    - [229, 32.543]
  - - [42368, 128, 1, 128]
    - [229, 34.986]
  - - [38912, 4096, 1, 128]
    - [15, 46.69]
  - - [34176, 512, 1, 128]
    - [233, 46.719]
  - - [42752, 8192, 1, 128]
    - [17, 46.612]
  - - [31488, 1024, 1, 128]
    - [235, 50.354]
  - - [36608, 1024, 1, 128]
    - [235, 52.984]
  - - [41856, 128, 1, 128]
    - [328, 34.436]
  - - [29312, 13441, 1, 128]
    - [15, 45.652]
  - - [43520, 128, 1, 128]
    - [229, 33.71]
  - - [31616, 8192, 1, 128]
    - [15, 45.923]
  - - [40448, 2048, 1, 128]
    - [22, 44.652]
  - - [35328, 2048, 1, 128]
    - [225, 54.708]
  - - [36864, 20865, 1, 128]
    - [26, 46.566]
  - - [32000, 2048, 1, 128]
    - [225, 54.942]
  - - [34176, 18177, 1, 128]
    - [42, 45.62]
  - - [37504, 128, 1, 128]
    - [202, 34.044]
  - - [33792, 1024, 1, 128]
    - [357, 50.926]
  - - [31872, 8192, 1, 128]
    - [15, 46.308]
  - - [40704, 512, 1, 128]
    - [226, 47.244]
  - - [37632, 128, 1, 128]
    - [227, 34.168]
  - - [32640, 1024, 1, 128]
    - [357, 50.334]
  - - [44544, 8192, 1, 128]
    - [12, 46.449]
  - - [39424, 8192, 1, 128]
    - [15, 46.96]
  - - [39296, 512, 1, 128]
    - [229, 48.638]
  - - [35840, 128, 1, 128]
    - [328, 33.648]
  - - [39168, 1024, 1, 128]
    - [326, 51.597]
  - - [35712, 19841, 1, 128]
    - [26, 45.634]
  - - [29568, 13569, 1, 128]
    - [12, 45.271]
  - - [34944, 4096, 1, 128]
    - [17, 45.826]
  - - [32768, 2048, 1, 128]
    - [199, 40.929]
  - - [39296, 128, 1, 128]
    - [354, 35.124]
  - - [29568, 4096, 1, 128]
    - [41, 44.664]
  - - [39040, 1024, 1, 128]
    - [235, 52.286]
  - - [37376, 1024, 1, 128]
    - [225, 51.383]
  - - [33536, 2048, 1, 128]
    - [225, 54.565]
  - - [31488, 8192, 1, 128]
    - [17, 46.506]
  - - [37888, 1024, 1, 128]
    - [225, 51.478]
  - - [41472, 4096, 1, 128]
    - [19, 45.992]
  - - [30592, 512, 1, 128]
    - [229, 46.731]
  - - [34560, 18561, 1, 128]
    - [17, 45.867]
  - - [29184, 512, 1, 128]
    - [208, 45.537]
  - - [32256, 16257, 1, 128]
    - [14, 46.612]
  - - [43392, 27393, 1, 128]
    - [26, 45.405]
  - - [29312, 4096, 1, 128]
    - [24, 45.362]
  - - [43648, 2048, 1, 128]
    - [17, 43.517]
  - - [44288, 1024, 1, 128]
    - [225, 51.698]
  - - [35456, 128, 1, 128]
    - [328, 33.171]
  - - [44160, 28289, 1, 128]
    - [15, 45.17]
  - - [40320, 1024, 1, 128]
    - [235, 51.96]
  - - [37888, 22017, 1, 128]
    - [26, 46.388]
  - - [29696, 512, 1, 128]
    - [204, 45.349]
  - - [35840, 2048, 1, 128]
    - [236, 53.965]
  - - [37504, 2048, 1, 128]
    - [326, 54.299]
  - - [41728, 4096, 1, 128]
    - [40, 45.048]
  - - [42752, 4096, 1, 128]
    - [15, 45.734]
  - - [29824, 4096, 1, 128]
    - [41, 44.859]
  - - [44800, 1024, 1, 128]
    - [326, 52.988]
  - - [30592, 4096, 1, 128]
    - [15, 45.582]
  - - [43904, 4096, 1, 128]
    - [17, 45.454]
  - - [39552, 8192, 1, 128]
    - [26, 46.1]
  - - [37632, 2048, 1, 128]
    - [357, 54.308]
  - - [29312, 128, 1, 128]
    - [354, 31.45]
  - - [30080, 512, 1, 128]
    - [355, 44.767]
  - - [33664, 2048, 1, 128]
    - [284, 53.431]
  - - [43520, 27521, 1, 128]
    - [42, 46.018]
  - - [36224, 128, 1, 128]
    - [227, 33.158]
  - - [28928, 12929, 1, 128]
    - [15, 45.873]
  - - [29440, 1024, 1, 128]
    - [235, 50.823]
  - - [35840, 19969, 1, 128]
    - [26, 46.357]
  - - [42880, 4096, 1, 128]
    - [20, 44.933]
  - - [42496, 8192, 1, 128]
    - [15, 46.936]
  - - [39936, 24065, 1, 128]
    - [26, 46.243]
  - - [33408, 1024, 1, 128]
    - [225, 50.716]
  - - [32256, 2048, 1, 128]
    - [225, 54.782]
  - - [35712, 19713, 1, 128]
    - [26, 45.682]
  - - [40192, 4096, 1, 128]
    - [15, 45.816]
  - - [32000, 16129, 1, 128]
    - [17, 46.012]
  - - [44032, 512, 1, 128]
    - [226, 49.143]
  - - [35584, 128, 1, 128]
    - [206, 32.849]
  - - [35584, 8192, 1, 128]
    - [17, 46.454]
  - - [37888, 21889, 1, 128]
    - [26, 46.38]
  - - [37504, 1024, 1, 128]
    - [326, 50.955]
  - - [33664, 512, 1, 128]
    - [227, 45.604]
  - - [32384, 1024, 1, 128]
    - [235, 50.688]
  - - [38400, 1024, 1, 128]
    - [326, 50.075]
  - - [35200, 128, 1, 128]
    - [206, 33.008]
  - - [43648, 1024, 1, 128]
    - [236, 51.469]
  - - [36608, 128, 1, 128]
    - [354, 33.255]
  - - [32768, 128, 1, 128]
    - [306, 30.876]
  - - [28928, 4096, 1, 128]
    - [17, 45.55]
  - - [35200, 19329, 1, 128]
    - [12, 45.615]
  - - [41216, 8192, 1, 128]
    - [15, 46.646]
  - - [36864, 8192, 1, 128]
    - [17, 47.323]
  - - [40064, 128, 1, 128]
    - [328, 34.016]
  - - [42624, 1024, 1, 128]
    - [357, 51.414]
  - - [34688, 128, 1, 128]
    - [229, 32.606]
  - - [43648, 27777, 1, 128]
    - [12, 44.988]
  - - [37888, 8192, 1, 128]
    - [15, 47.162]
  - - [41472, 25601, 1, 128]
    - [42, 45.782]
  - - [38272, 512, 1, 128]
    - [357, 44.89]
  - - [35456, 4096, 1, 128]
    - [24, 45.661]
  - - [42496, 26625, 1, 128]
    - [36, 45.874]
  - - [43136, 4096, 1, 128]
    - [15, 45.517]
  - - [44800, 8192, 1, 128]
    - [17, 46.255]
  - - [36480, 8192, 1, 128]
    - [17, 46.305]
  - - [37504, 4096, 1, 128]
    - [28, 44.983]
  - - [39040, 8192, 1, 128]
    - [17, 46.156]
  - - [31104, 512, 1, 128]
    - [227, 46.963]
  - - [34176, 2048, 1, 128]
    - [235, 55.235]
  - - [31616, 512, 1, 128]
    - [229, 46.888]
  - - [35456, 2048, 1, 128]
    - [235, 54.055]
  - - [43136, 8192, 1, 128]
    - [15, 46.264]
  - - [33024, 128, 1, 128]
    - [193, 30.579]
  - - [38656, 4096, 1, 128]
    - [19, 45.653]
  - - [33408, 17409, 1, 128]
    - [26, 45.715]
  - - [39424, 1024, 1, 128]
    - [326, 51.917]
  - - [29312, 13313, 1, 128]
    - [17, 45.515]
  - - [35840, 4096, 1, 128]
    - [17, 46.364]
  - - [42496, 512, 1, 128]
    - [229, 47.109]
  - - [37632, 8192, 1, 128]
    - [15, 46.625]
  - - [41088, 2048, 1, 128]
    - [25, 43.811]
  - - [38528, 512, 1, 128]
    - [227, 48.218]
  - - [35072, 2048, 1, 128]
    - [225, 55.181]
  - - [31104, 4096, 1, 128]
    - [26, 45.51]
  - - [33280, 4096, 1, 128]
    - [40, 46.23]
  - - [43904, 8192, 1, 128]
    - [15, 46.33]
  - - [34816, 8192, 1, 128]
    - [17, 47.493]
  - - [38016, 1024, 1, 128]
    - [236, 51.149]
  - - [33152, 128, 1, 128]
    - [195, 31.932]
  - - [42496, 128, 1, 128]
    - [30, 31.099]
  - - [40832, 24961, 1, 128]
    - [26, 45.111]
  - - [41728, 1024, 1, 128]
    - [293, 51.183]
  - - [41472, 25473, 1, 128]
    - [36, 46.035]
  - - [34560, 2048, 1, 128]
    - [225, 55.101]
  - - [31616, 15617, 1, 128]
    - [12, 45.318]
  - - [33664, 4096, 1, 128]
    - [26, 45.445]
  - - [35328, 8192, 1, 128]
    - [19, 47.021]
  - - [39808, 4096, 1, 128]
    - [15, 43.349]
  - - [37248, 512, 1, 128]
    - [229, 48.329]
  - - [31360, 4096, 1, 128]
    - [17, 45.616]
  - - [41344, 8192, 1, 128]
    - [15, 46.237]
  - - [32000, 512, 1, 128]
    - [284, 47.285]
  - - [35968, 19969, 1, 128]
    - [17, 45.615]
  - - [30080, 14081, 1, 128]
    - [14, 43.41]
  - - [35840, 8192, 1, 128]
    - [15, 47.132]
  - - [44672, 2048, 1, 128]
    - [28, 44.597]
  - - [31872, 2048, 1, 128]
    - [225, 53.564]
  - - [42496, 4096, 1, 128]
    - [12, 46.1]
  - - [43776, 128, 1, 128]
    - [229, 35.317]
  - - [40704, 2048, 1, 128]
    - [32, 44.366]
  - - [34432, 128, 1, 128]
    - [354, 32.611]
  - - [44544, 2048, 1, 128]
    - [22, 44.537]
  - - [32384, 16385, 1, 128]
    - [15, 45.9]
  - - [43776, 27905, 1, 128]
    - [41, 44.016]
  - - [44032, 4096, 1, 128]
    - [15, 46.373]
  - - [36480, 512, 1, 128]
    - [226, 46.132]
  - - [44160, 1024, 1, 128]
    - [235, 51.94]
  - - [41216, 4096, 1, 128]
    - [15, 45.814]
  - - [44032, 2048, 1, 128]
    - [25, 44.796]
  - - [33152, 2048, 1, 128]
    - [326, 53.929]
  - - [41984, 25985, 1, 128]
    - [26, 46.352]
  - - [39552, 512, 1, 128]
    - [204, 47.973]
  - - [41344, 25473, 1, 128]
    - [17, 45.432]
  - - [40960, 4096, 1, 128]
    - [12, 41.231]
  - - [32640, 128, 1, 128]
    - [233, 32.983]
  - - [35968, 4096, 1, 128]
    - [24, 45.611]
  - - [33536, 4096, 1, 128]
    - [17, 45.86]
  - - [30976, 15105, 1, 128]
    - [50, 44.642]
  - - [35072, 8192, 1, 128]
    - [17, 46.675]
  - - [39424, 23425, 1, 128]
    - [42, 45.929]
  - - [43520, 1024, 1, 128]
    - [235, 50.785]
  - - [44288, 28417, 1, 128]
    - [36, 45.373]
  - - [30848, 128, 1, 128]
    - [208, 31.704]
  - - [35712, 512, 1, 128]
    - [227, 47.422]
  - - [44160, 2048, 1, 128]
    - [32, 44.248]
  - - [34048, 8192, 1, 128]
    - [42, 46.442]
  - - [40448, 24449, 1, 128]
    - [36, 46.019]
  - - [39168, 23297, 1, 128]
    - [36, 45.842]
  - - [32128, 1024, 1, 128]
    - [326, 51.192]
  - - [36864, 20993, 1, 128]
    - [26, 46.547]
  - - [40064, 1024, 1, 128]
    - [355, 51.489]
  - - [38784, 8192, 1, 128]
    - [15, 46.238]
  - - [37248, 2048, 1, 128]
    - [357, 54.279]
  - - [34560, 4096, 1, 128]
    - [17, 45.799]
  - - [39040, 23041, 1, 128]
    - [12, 45.415]
  - - [36480, 1024, 1, 128]
    - [235, 50.917]
  - - [39040, 2048, 1, 128]
    - [32, 44.221]
  - - [39808, 23809, 1, 128]
    - [42, 43.154]
  - - [36992, 4096, 1, 128]
    - [15, 45.424]
  - - [32768, 16897, 1, 128]
    - [15, 34.596]
  - - [30976, 2048, 1, 128]
    - [357, 52.335]
  - - [32640, 16769, 1, 128]
    - [17, 45.395]
  - - [29824, 13953, 1, 128]
    - [42, 45.133]
  - - [29184, 128, 1, 128]
    - [354, 31.788]
  - - [30720, 8192, 1, 128]
    - [17, 47.523]
  - - [30848, 2048, 1, 128]
    - [235, 54.183]
  - - [38016, 4096, 1, 128]
    - [12, 45.516]
  - - [35456, 8192, 1, 128]
    - [17, 46.552]
  - - [36992, 21121, 1, 128]
    - [12, 45.411]
  - - [36736, 2048, 1, 128]
    - [326, 53.318]
  - - [37888, 128, 1, 128]
    - [328, 34.935]
  - - [39808, 2048, 1, 128]
    - [17, 42.312]
  - - [41856, 25985, 1, 128]
    - [12, 45.662]
  - - [34688, 4096, 1, 128]
    - [24, 45.486]
  - - [38784, 1024, 1, 128]
    - [235, 51.806]
  - - [40960, 25089, 1, 128]
    - [12, 40.357]
  - - [32000, 4096, 1, 128]
    - [15, 45.811]
  - - [41600, 25601, 1, 128]
    - [12, 45.352]
  - - [37504, 512, 1, 128]
    - [204, 46.568]
  - - [32128, 16129, 1, 128]
    - [17, 45.863]
  - - [37248, 21377, 1, 128]
    - [26, 45.342]
  - - [35840, 512, 1, 128]
    - [229, 47.524]
  - - [36096, 128, 1, 128]
    - [229, 34.081]
  - - [32512, 8192, 1, 128]
    - [15, 46.813]
  - - [36736, 8192, 1, 128]
    - [17, 46.469]
  - - [42880, 1024, 1, 128]
    - [235, 52.649]
  - - [44288, 8192, 1, 128]
    - [17, 46.275]
  - - [36224, 1024, 1, 128]
    - [326, 52.019]
  - - [41344, 25345, 1, 128]
    - [17, 45.426]
  - - [32384, 512, 1, 128]
    - [284, 46.797]
  - - [38272, 4096, 1, 128]
    - [41, 41.461]
  - - [37120, 2048, 1, 128]
    - [235, 55.19]
  - - [33152, 8192, 1, 128]
    - [17, 46.687]
  - - [36096, 4096, 1, 128]
    - [50, 44.072]
  - - [34560, 18689, 1, 128]
    - [26, 45.867]
  - - [36864, 4096, 1, 128]
    - [15, 46.428]
  - - [34944, 512, 1, 128]
    - [226, 47.785]
  - - [37760, 128, 1, 128]
    - [354, 33.71]
  - - [31616, 128, 1, 128]
    - [229, 32.07]
  - - [36224, 4096, 1, 128]
    - [15, 45.663]
  - - [40576, 24577, 1, 128]
    - [12, 45.04]
  - - [34688, 1024, 1, 128]
    - [225, 50.833]
  - - [40192, 1024, 1, 128]
    - [355, 51.005]
  - - [44672, 512, 1, 128]
    - [227, 48.022]
  - - [33664, 1024, 1, 128]
    - [236, 49.961]
  - - [39424, 512, 1, 128]
    - [227, 45.693]
  - - [44416, 1024, 1, 128]
    - [235, 51.53]
  - - [33408, 2048, 1, 128]
    - [326, 54.61]
  - - [43648, 8192, 1, 128]
    - [15, 46.058]
  - - [43520, 27649, 1, 128]
    - [42, 45.797]
  - - [40448, 1024, 1, 128]
    - [326, 52.952]
  - - [33152, 17153, 1, 128]
    - [15, 46.124]
  - - [33024, 512, 1, 128]
    - [214, 43.004]
  - - [39680, 128, 1, 128]
    - [227, 34.309]
  - - [29696, 4096, 1, 128]
    - [15, 46.382]
  - - [42112, 2048, 1, 128]
    - [17, 44.11]
  - - [38016, 8192, 1, 128]
    - [15, 46.349]
  - - [30464, 8192, 1, 128]
    - [52, 44.92]
  - - [43648, 128, 1, 128]
    - [328, 35.168]
  - - [32896, 16897, 1, 128]
    - [49, 44.774]
  - - [43008, 8192, 1, 128]
    - [17, 47.387]
  - - [34304, 512, 1, 128]
    - [226, 45.089]
  - - [38528, 128, 1, 128]
    - [226, 34.46]
  - - [41216, 1024, 1, 128]
    - [235, 51.568]
  - - [38272, 22401, 1, 128]
    - [49, 40.701]
  - - [34048, 4096, 1, 128]
    - [24, 45.503]
  - - [30720, 512, 1, 128]
    - [233, 45.722]
  - - [41728, 512, 1, 128]
    - [226, 46.785]
  - - [43136, 512, 1, 128]
    - [226, 47.353]
  - - [41088, 1024, 1, 128]
    - [355, 50.562]
  - - [33536, 1024, 1, 128]
    - [225, 51.065]
  - - [41088, 25089, 1, 128]
    - [49, 44.401]
  - - [36352, 20353, 1, 128]
    - [12, 46.128]
  - - [29184, 1024, 1, 128]
    - [225, 49.854]
  - - [44800, 128, 1, 128]
    - [354, 35.459]
  - - [41600, 8192, 1, 128]
    - [12, 46.389]
  - - [44416, 28545, 1, 128]
    - [12, 45.558]
  - - [34048, 512, 1, 128]
    - [229, 47.795]
  - - [32128, 16257, 1, 128]
    - [15, 45.982]
  - - [44288, 4096, 1, 128]
    - [17, 45.46]
  - - [34432, 18433, 1, 128]
    - [49, 44.145]
  - - [41856, 25857, 1, 128]
    - [12, 45.643]
  - - [32128, 2048, 1, 128]
    - [235, 54.634]
  - - [34688, 512, 1, 128]
    - [208, 47.274]
  - - [39936, 4096, 1, 128]
    - [15, 46.381]
  - - [38656, 1024, 1, 128]
    - [225, 52.188]
  - - [37760, 512, 1, 128]
    - [232, 47.028]
  - - [30336, 512, 1, 128]
    - [234, 46.195]
  - - [38016, 22017, 1, 128]
    - [26, 45.593]
  - - [44544, 4096, 1, 128]
    - [36, 45.793]
  - - [38912, 8192, 1, 128]
    - [17, 47.448]
  - - [39936, 128, 1, 128]
    - [206, 33.783]
  - - [36480, 2048, 1, 128]
    - [225, 54.787]
  - - [35200, 4096, 1, 128]
    - [15, 45.526]
  - - [30976, 14977, 1, 128]
    - [49, 44.608]
  - - [31104, 15105, 1, 128]
    - [17, 45.786]
  - - [40832, 1024, 1, 128]
    - [236, 51.355]
  - - [32384, 16513, 1, 128]
    - [15, 46.085]
  - - [43392, 4096, 1, 128]
    - [26, 45.466]
  - - [32768, 4096, 1, 128]
    - [15, 35.663]
  - - [38272, 22273, 1, 128]
    - [52, 40.665]
  - - [32128, 512, 1, 128]
    - [233, 46.865]
  - - [32896, 2048, 1, 128]
    - [355, 54.648]
  - - [37376, 21505, 1, 128]
    - [15, 45.849]
  - - [41856, 1024, 1, 128]
    - [235, 52.524]
  - - [33536, 8192, 1, 128]
    - [42, 46.748]
  - - [29568, 1024, 1, 128]
    - [236, 48.857]
  - - [44032, 28033, 1, 128]
    - [26, 46.336]
  - - [33280, 8192, 1, 128]
    - [19, 47.149]
  - - [39296, 4096, 1, 128]
    - [15, 45.716]
  - - [30592, 14593, 1, 128]
    - [17, 45.761]
  - - [37504, 8192, 1, 128]
    - [41, 45.639]
  - - [30336, 14465, 1, 128]
    - [17, 45.698]
  - - [29952, 2048, 1, 128]
    - [235, 53.848]
  - - [40832, 512, 1, 128]
    - [227, 45.236]
  - - [44672, 28673, 1, 128]
    - [12, 45.372]
  - - [30080, 4096, 1, 128]
    - [52, 43.362]
  - - [37888, 2048, 1, 128]
    - [235, 54.602]
  - - [37632, 21761, 1, 128]
    - [12, 45.775]
  - - [29824, 8192, 1, 128]
    - [49, 45.814]
  - - [35328, 19457, 1, 128]
    - [42, 46.076]
  - - [37376, 4096, 1, 128]
    - [24, 45.946]
  - - [33792, 17921, 1, 128]
    - [15, 46.337]
  - - [34304, 8192, 1, 128]
    - [14, 47.014]
  - - [42752, 512, 1, 128]
    - [227, 46.81]
  - - [36992, 2048, 1, 128]
    - [225, 52.65]
  - - [39168, 4096, 1, 128]
    - [42, 45.615]
  - - [31360, 15489, 1, 128]
    - [15, 45.835]
  - - [43520, 8192, 1, 128]
    - [15, 46.897]
  - - [30080, 2048, 1, 128]
    - [236, 53.678]
  - - [30720, 4096, 1, 128]
    - [15, 46.713]
  - - [34176, 128, 1, 128]
    - [229, 32.962]
  - - [32768, 16769, 1, 128]
    - [15, 34.684]
  - - [35072, 128, 1, 128]
    - [354, 33.129]
  - - [35712, 4096, 1, 128]
    - [26, 45.542]
  - - [36480, 4096, 1, 128]
    - [15, 45.435]
  - - [39424, 4096, 1, 128]
    - [17, 45.949]
  - - [38400, 128, 1, 128]
    - [354, 34.664]
  - - [34432, 2048, 1, 128]
    - [236, 53.791]
  - - [41344, 512, 1, 128]
    - [208, 46.949]
  - - [35200, 512, 1, 128]
    - [229, 47.51]
  - - [39936, 8192, 1, 128]
    - [17, 47.064]
  - - [31488, 128, 1, 128]
    - [354, 32.696]
  - - [43008, 512, 1, 128]
    - [227, 48.494]
  - - [33024, 4096, 1, 128]
    - [15, 46.064]
  - - [36608, 512, 1, 128]
    - [204, 47.207]
  - - [37376, 8192, 1, 128]
    - [15, 46.86]
  - - [29824, 13825, 1, 128]
    - [36, 45.018]
  - - [36352, 2048, 1, 128]
    - [235, 54.587]
  - - [30336, 1024, 1, 128]
    - [235, 49.573]
  - - [44416, 28417, 1, 128]
    - [26, 45.544]
  - - [38144, 22273, 1, 128]
    - [26, 45.787]
  - - [28928, 2048, 1, 128]
    - [225, 54.875]
  - - [29568, 13697, 1, 128]
    - [26, 45.321]
  - - [43136, 27137, 1, 128]
    - [12, 45.344]
  - - [42112, 4096, 1, 128]
    - [15, 45.686]
  - - [40960, 512, 1, 128]
    - [199, 41.578]
  - - [35584, 1024, 1, 128]
    - [326, 49.929]
  - - [31232, 15361, 1, 128]
    - [15, 45.928]
  - - [40960, 8192, 1, 128]
    - [15, 41.571]
  - - [31232, 1024, 1, 128]
    - [235, 50.601]
  - - [29312, 512, 1, 128]
    - [208, 46.76]
  - - [44416, 512, 1, 128]
    - [226, 48.15]
  - - [42240, 512, 1, 128]
    - [232, 46.665]
  - - [31232, 8192, 1, 128]
    - [17, 46.787]
  - - [35072, 19201, 1, 128]
    - [15, 45.897]
  - - [29568, 128, 1, 128]
    - [354, 31.18]
  - - [33792, 2048, 1, 128]
    - [355, 53.719]
  - - [35712, 2048, 1, 128]
    - [236, 53.813]
  - - [40576, 128, 1, 128]
    - [233, 33.304]
  - - [40704, 1024, 1, 128]
    - [235, 51.575]
  - - [29824, 1024, 1, 128]
    - [284, 49.431]
  - - [33536, 17665, 1, 128]
    - [42, 46.186]
  - - [43008, 27009, 1, 128]
    - [12, 46.557]
  - - [34304, 2048, 1, 128]
    - [225, 54.898]
  - - [37120, 21249, 1, 128]
    - [17, 45.742]
  - - [41600, 1024, 1, 128]
    - [357, 51.695]
  - - [33024, 1024, 1, 128]
    - [236, 49.418]
  - - [42368, 512, 1, 128]
    - [226, 48.364]
  - - [30592, 14721, 1, 128]
    - [26, 45.745]
  - - [29696, 2048, 1, 128]
    - [236, 53.442]
  - - [31232, 128, 1, 128]
    - [229, 32.484]
  - - [38784, 22785, 1, 128]
    - [12, 45.55]
  - - [32896, 1024, 1, 128]
    - [355, 49.586]
  - - [32128, 128, 1, 128]
    - [229, 32.637]
  - - [35968, 8192, 1, 128]
    - [15, 46.444]
  - - [38400, 2048, 1, 128]
    - [39, 44.604]
  - - [36864, 2048, 1, 128]
    - [240, 52.657]
  - - [31616, 4096, 1, 128]
    - [42, 45.071]
  - - [34688, 18817, 1, 128]
    - [12, 45.573]
  - - [42624, 4096, 1, 128]
    - [17, 41.862]
  - - [29312, 1024, 1, 128]
    - [235, 50.337]
  - - [37760, 2048, 1, 128]
    - [236, 53.333]
  - - [39808, 512, 1, 128]
    - [226, 46.602]
  - - [41472, 128, 1, 128]
    - [226, 34.821]
  - - [32128, 4096, 1, 128]
    - [15, 45.8]
  - - [43520, 4096, 1, 128]
    - [17, 46.119]
  - - [41472, 512, 1, 128]
    - [226, 49.526]
  - - [38912, 22913, 1, 128]
    - [26, 46.708]
  - - [30464, 1024, 1, 128]
    - [357, 49.336]
  - - [33280, 128, 1, 128]
    - [193, 31.854]
  - - [31872, 15873, 1, 128]
    - [26, 45.676]
  - - [36352, 4096, 1, 128]
    - [15, 45.942]
  - - [30720, 2048, 1, 128]
    - [225, 54.014]
  - - [33792, 128, 1, 128]
    - [328, 32.602]
  - - [36096, 8192, 1, 128]
    - [40, 45.087]
  - - [38784, 128, 1, 128]
    - [229, 35.165]
  - - [30208, 2048, 1, 128]
    - [235, 54.579]
  - - [34432, 4096, 1, 128]
    - [36, 44.362]
  - - [42880, 128, 1, 128]
    - [354, 34.937]
  - - [31616, 15745, 1, 128]
    - [12, 45.341]
  - - [40960, 2048, 1, 128]
    - [12, 39.906]
  - - [41344, 128, 1, 128]
    - [354, 33.539]
  - - [41728, 25857, 1, 128]
    - [42, 45.145]
  - - [32896, 512, 1, 128]
    - [236, 43.691]
  - - [41728, 2048, 1, 128]
    - [40, 43.251]
  - - [42368, 26369, 1, 128]
    - [14, 45.288]
  - - [30720, 14721, 1, 128]
    - [17, 46.809]
  - - [37376, 512, 1, 128]
    - [208, 47.547]
  - - [35456, 19457, 1, 128]
    - [17, 45.548]
  - - [29184, 13185, 1, 128]
    - [12, 45.997]
  - - [34944, 128, 1, 128]
    - [354, 33.436]
  - - [36608, 20609, 1, 128]
    - [17, 45.82]
  - - [35584, 19585, 1, 128]
    - [26, 45.685]
  - - [42880, 8192, 1, 128]
    - [14, 45.728]
  - - [39936, 1024, 1, 128]
    - [225, 53.418]
  - - [34944, 19073, 1, 128]
    - [17, 45.75]
  - - [32512, 128, 1, 128]
    - [328, 32.168]
  - - [40064, 512, 1, 128]
    - [227, 47.544]
  - - [30464, 2048, 1, 128]
    - [355, 53.32]
  - - [30592, 8192, 1, 128]
    - [17, 46.473]
  - - [39040, 512, 1, 128]
    - [226, 46.48]
  - - [41088, 128, 1, 128]
    - [328, 33.187]
  - - [29824, 128, 1, 128]
    - [229, 30.86]
  - - [32384, 128, 1, 128]
    - [227, 32.804]
  - - [41728, 25729, 1, 128]
    - [36, 45.1]
  - - [30976, 4096, 1, 128]
    - [19, 44.37]
  - - [42624, 128, 1, 128]
    - [233, 33.868]
  - - [42112, 512, 1, 128]
    - [226, 47.191]
  - - [38784, 2048, 1, 128]
    - [13, 44.143]
  - - [35200, 8192, 1, 128]
    - [17, 46.357]
  - - [30976, 128, 1, 128]
    - [202, 31.922]
  - - [32640, 16641, 1, 128]
    - [17, 45.367]
  - - [41984, 8192, 1, 128]
    - [17, 47.088]
  - - [30080, 128, 1, 128]
    - [229, 31.135]
  - - [35584, 512, 1, 128]
    - [226, 45.213]
  - - [44800, 2048, 1, 128]
    - [26, 44.034]
  - - [34048, 128, 1, 128]
    - [354, 32.757]
  - - [35712, 1024, 1, 128]
    - [236, 49.769]
  - - [43136, 128, 1, 128]
    - [226, 35.517]
  - - [33280, 1024, 1, 128]
    - [225, 50.937]
  - - [34816, 18945, 1, 128]
    - [12, 46.764]
  - - [40704, 8192, 1, 128]
    - [15, 46.688]
  - - [34304, 128, 1, 128]
    - [229, 33.16]
  - - [39936, 512, 1, 128]
    - [226, 48.841]
  - - [36096, 2048, 1, 128]
    - [236, 53.406]
  - - [40832, 8192, 1, 128]
    - [17, 46.421]
  - - [37760, 4096, 1, 128]
    - [15, 45.537]
  - - [36736, 512, 1, 128]
    - [204, 46.971]
  - - [31744, 8192, 1, 128]
    - [17, 47.209]
  - - [33920, 1024, 1, 128]
    - [357, 51.027]
  - - [39808, 128, 1, 128]
    - [229, 34.327]
  - - [36608, 2048, 1, 128]
    - [235, 55.186]
  - - [30464, 14593, 1, 128]
    - [52, 42.867]
  - - [35200, 19201, 1, 128]
    - [26, 45.538]
  - - [41472, 1024, 1, 128]
    - [225, 53.315]
  - - [30720, 128, 1, 128]
    - [202, 32.217]
  - - [41600, 128, 1, 128]
    - [227, 33.981]
  - - [38144, 22145, 1, 128]
    - [12, 45.754]
  - - [37120, 4096, 1, 128]
    - [26, 45.686]
  - - [40704, 24705, 1, 128]
    - [12, 45.747]
  - - [41088, 25217, 1, 128]
    - [26, 44.43]
  - - [43776, 8192, 1, 128]
    - [41, 45.549]
  - - [38912, 1024, 1, 128]
    - [225, 51.605]
  - - [43008, 2048, 1, 128]
    - [15, 44.887]
  - - [42496, 26497, 1, 128]
    - [42, 46.082]
  - - [33536, 512, 1, 128]
    - [236, 46.345]
  - - [43520, 512, 1, 128]
    - [284, 46.079]
  - - [39040, 23169, 1, 128]
    - [12, 45.446]
  - - [29568, 2048, 1, 128]
    - [236, 53.798]
  - - [44672, 8192, 1, 128]
    - [17, 46.483]
  - - [29824, 512, 1, 128]
    - [355, 45.799]
  - - [34944, 2048, 1, 128]
    - [225, 55.213]
  - - [33408, 4096, 1, 128]
    - [15, 45.857]
  - - [41600, 25729, 1, 128]
    - [26, 45.529]
  - - [40832, 2048, 1, 128]
    - [17, 44.139]
  - - [38912, 128, 1, 128]
    - [354, 35.187]
  - - [34048, 2048, 1, 128]
    - [235, 53.968]
  - - [43904, 2048, 1, 128]
    - [32, 44.341]
  - - [39296, 23297, 1, 128]
    - [12, 45.524]
  - - [31232, 4096, 1, 128]
    - [15, 45.845]
  - - [35840, 1024, 1, 128]
    - [236, 51.076]
  - - [28928, 128, 1, 128]
    - [192, 30.875]
  - - [42752, 2048, 1, 128]
    - [26, 44.089]
  - - [44032, 1024, 1, 128]
    - [326, 53.051]
  - - [29440, 13569, 1, 128]
    - [15, 45.99]
  - - [35456, 19585, 1, 128]
    - [17, 45.703]
  - - [35840, 19841, 1, 128]
    - [15, 46.395]
  - - [31360, 128, 1, 128]
    - [192, 32.087]
  - - [40192, 2048, 1, 128]
    - [13, 44.606]
  - - [33920, 8192, 1, 128]
    - [17, 46.43]
  - - [43648, 512, 1, 128]
    - [227, 46.693]
  - - [30080, 14209, 1, 128]
    - [33, 43.283]
  - - [39680, 23809, 1, 128]
    - [12, 45.422]
  - - [32512, 512, 1, 128]
    - [357, 45.837]
  - - [34816, 2048, 1, 128]
    - [326, 54.9]
  - - [43392, 1024, 1, 128]
    - [225, 51.67]
  - - [39040, 4096, 1, 128]
    - [17, 45.454]
  - - [43264, 4096, 1, 128]
    - [17, 45.807]
  - - [44416, 2048, 1, 128]
    - [25, 44.36]
  - - [31488, 512, 1, 128]
    - [225, 46.661]
  - - [31616, 1024, 1, 128]
    - [236, 50.43]
  - - [44032, 8192, 1, 128]
    - [17, 47.089]
  - - [39424, 23553, 1, 128]
    - [26, 45.76]
  - - [31360, 8192, 1, 128]
    - [17, 46.446]
  - - [42752, 128, 1, 128]
    - [354, 34.6]
  - - [40192, 512, 1, 128]
    - [227, 48.033]
  - - [36096, 20225, 1, 128]
    - [14, 44.722]
  - - [41984, 26113, 1, 128]
    - [12, 46.343]
  - - [39936, 2048, 1, 128]
    - [25, 44.806]
  - - [42880, 2048, 1, 128]
    - [22, 43.617]
  - - [29440, 128, 1, 128]
    - [226, 30.651]
  - - [40192, 128, 1, 128]
    - [227, 33.491]
  - - [36608, 4096, 1, 128]
    - [15, 45.643]
  - - [37760, 21761, 1, 128]
    - [12, 45.57]
  - - [44160, 28161, 1, 128]
    - [17, 45.034]
  - - [44288, 512, 1, 128]
    - [226, 48.322]
  - - [29056, 13185, 1, 128]
    - [17, 45.782]
  - - [43904, 512, 1, 128]
    - [226, 48.982]
  - - [29696, 128, 1, 128]
    - [354, 30.959]
  - - [36224, 8192, 1, 128]
    - [17, 46.49]
  - - [33024, 2048, 1, 128]
    - [326, 54.032]
  - - [44032, 28161, 1, 128]
    - [26, 46.258]
  - - [44032, 128, 1, 128]
    - [354, 35.101]
  - - [38784, 512, 1, 128]
    - [227, 47.097]
  - - [29056, 8192, 1, 128]
    - [15, 46.411]
  - - [33920, 18049, 1, 128]
    - [26, 45.703]
  - - [34816, 1024, 1, 128]
    - [225, 51.641]
  - - [29056, 128, 1, 128]
    - [229, 30.941]
  - - [39552, 1024, 1, 128]
    - [235, 52.403]
  - - [36992, 8192, 1, 128]
    - [15, 46.344]
  - - [44544, 1024, 1, 128]
    - [326, 51.778]
  - - [43904, 27905, 1, 128]
    - [15, 45.391]
  - - [29440, 512, 1, 128]
    - [226, 46.958]
  - - [29568, 8192, 1, 128]
    - [17, 46.022]
  - - [41472, 2048, 1, 128]
    - [27, 44.493]
  - - [29184, 8192, 1, 128]
    - [24, 46.616]
  - - [33408, 512, 1, 128]
    - [236, 46.109]
  - - [38656, 22785, 1, 128]
    - [42, 45.782]
  - - [31744, 15745, 1, 128]
    - [15, 46.536]
  - - [38656, 2048, 1, 128]
    - [28, 44.176]
  - - [30080, 8192, 1, 128]
    - [49, 44.644]
  - - [44672, 128, 1, 128]
    - [328, 36.159]
  - - [40704, 24833, 1, 128]
    - [36, 45.754]
  - - [33792, 8192, 1, 128]
    - [17, 47.181]
  - - [33920, 512, 1, 128]
    - [229, 47.638]
  - - [40576, 1024, 1, 128]
    - [225, 52.164]
  - - [36224, 20225, 1, 128]
    - [26, 45.701]
  - - [34432, 1024, 1, 128]
    - [355, 49.862]
  - - [31488, 15617, 1, 128]
    - [17, 45.941]
  - - [40576, 2048, 1, 128]
    - [32, 44.334]
  - - [30208, 512, 1, 128]
    - [204, 44.712]
  - - [36480, 128, 1, 128]
    - [227, 33.734]
  - - [37504, 21633, 1, 128]
    - [19, 44.759]
  - - [32896, 17025, 1, 128]
    - [49, 44.944]
  - - [39168, 2048, 1, 128]
    - [13, 44.037]
  - - [29440, 2048, 1, 128]
    - [326, 54.05]
  - - [29440, 13441, 1, 128]
    - [17, 45.952]
  - - [32640, 8192, 1, 128]
    - [15, 46.225]
  - - [35072, 19073, 1, 128]
    - [26, 45.943]
  - - [33152, 512, 1, 128]
    - [233, 45.951]
  - - [40576, 8192, 1, 128]
    - [17, 46.372]
  - - [34944, 8192, 1, 128]
    - [17, 46.479]
  - - [38656, 128, 1, 128]
    - [227, 34.859]
  - - [33536, 17537, 1, 128]
    - [36, 46.122]
  - - [29952, 512, 1, 128]
    - [225, 45.523]
  - - [31488, 2048, 1, 128]
    - [225, 54.879]
  - - [31872, 4096, 1, 128]
    - [26, 45.435]
  - - [31232, 15233, 1, 128]
    - [36, 46.235]
  - - [38912, 23041, 1, 128]
    - [12, 46.582]
  - - [31232, 2048, 1, 128]
    - [225, 55.375]
  - - [40448, 8192, 1, 128]
    - [14, 46.84]
  - - [36352, 128, 1, 128]
    - [227, 34.037]
  - - [43776, 4096, 1, 128]
    - [41, 44.709]
  - - [32000, 8192, 1, 128]
    - [17, 46.687]
  - - [37760, 8192, 1, 128]
    - [15, 46.459]
  - - [30080, 1024, 1, 128]
    - [357, 49.187]
  - - [44544, 128, 1, 128]
    - [202, 34.9]
  - - [29696, 1024, 1, 128]
    - [236, 49.526]
  - - [32640, 512, 1, 128]
    - [226, 45.514]
  - - [44416, 128, 1, 128]
    - [354, 34.998]
  - - [41216, 512, 1, 128]
    - [357, 46.274]
  - - [31872, 512, 1, 128]
    - [233, 45.527]
  - - [34432, 512, 1, 128]
    - [293, 45.968]
  - - [34560, 1024, 1, 128]
    - [235, 52.567]
  - - [42240, 128, 1, 128]
    - [202, 34.747]
  - - [44288, 28289, 1, 128]
    - [12, 45.366]
  - - [30336, 14337, 1, 128]
    - [14, 45.421]
  - - [32384, 2048, 1, 128]
    - [235, 53.886]
  - - [38400, 22401, 1, 128]
    - [42, 46.128]
  - - [39296, 1024, 1, 128]
    - [357, 51.438]
  - - [28928, 8192, 1, 128]
    - [17, 46.561]
  - - [40320, 2048, 1, 128]
    - [28, 44.54]
  - - [31104, 15233, 1, 128]
    - [15, 45.866]
  - - [39680, 512, 1, 128]
    - [235, 46.943]
  - - [34048, 18049, 1, 128]
    - [42, 45.789]
  - - [30720, 1024, 1, 128]
    - [355, 50.708]
  - - [42880, 26881, 1, 128]
    - [42, 44.892]
  - - [32896, 8192, 1, 128]
    - [49, 45.437]
  - - [43264, 8192, 1, 128]
    - [15, 46.531]
  - - [37632, 4096, 1, 128]
    - [12, 45.643]
  - - [32256, 4096, 1, 128]
    - [20, 46.088]
  - - [37248, 4096, 1, 128]
    - [17, 45.415]
  - - [33280, 17409, 1, 128]
    - [42, 46.304]
  - - [36096, 512, 1, 128]
    - [355, 45.537]
  - - [37120, 21121, 1, 128]
    - [17, 45.711]
  - - [32896, 128, 1, 128]
    - [354, 31.145]
  - - [36352, 20481, 1, 128]
    - [26, 45.734]
  - - [43392, 2048, 1, 128]
    - [15, 43.776]
  - - [36352, 512, 1, 128]
    - [227, 46.401]
  - - [29056, 13057, 1, 128]
    - [12, 45.668]
  - - [29056, 4096, 1, 128]
    - [23, 45.545]
  - - [37888, 4096, 1, 128]
    - [15, 46.418]
  - - [40320, 512, 1, 128]
    - [226, 46.72]
  - - [39168, 128, 1, 128]
    - [229, 34.765]
  - - [41472, 8192, 1, 128]
    - [19, 46.812]
  - - [34560, 512, 1, 128]
    - [229, 48.139]
  - - [34176, 18305, 1, 128]
    - [19, 45.623]
  - - [34688, 8192, 1, 128]
    - [17, 46.367]
  - - [29696, 13825, 1, 128]
    - [15, 46.514]
  - - [33152, 17281, 1, 128]
    - [15, 46.072]
  - - [30208, 8192, 1, 128]
    - [19, 46.932]
  - - [43648, 27649, 1, 128]
    - [26, 44.631]
  - - [31360, 2048, 1, 128]
    - [225, 54.384]
  - - [41984, 128, 1, 128]
    - [328, 34.455]
  - - [38528, 2048, 1, 128]
    - [13, 43.961]
  - - [32256, 16385, 1, 128]
    - [19, 46.375]
  - - [42240, 1024, 1, 128]
    - [225, 51.81]
  - - [32000, 16001, 1, 128]
    - [12, 46.01]
  - - [37248, 1024, 1, 128]
    - [225, 51.288]
  - - [32256, 1024, 1, 128]
    - [235, 51.245]
  - - [39296, 23425, 1, 128]
    - [12, 45.506]
  - - [43008, 4096, 1, 128]
    - [15, 46.736]
  - - [31104, 128, 1, 128]
    - [354, 31.857]
  - - [38656, 8192, 1, 128]
    - [42, 46.561]
  - - [44288, 128, 1, 128]
    - [354, 35.255]
  - - [38528, 22657, 1, 128]
    - [12, 45.514]
  - - [39552, 128, 1, 128]
    - [229, 34.022]
  - - [37376, 21377, 1, 128]
    - [26, 46.05]
  - - [28928, 13057, 1, 128]
    - [17, 45.96]
  - - [43264, 27265, 1, 128]
    - [12, 45.734]
  - - [35328, 4096, 1, 128]
    - [42, 46.012]
  - - [30848, 4096, 1, 128]
    - [24, 45.587]
  - - [44800, 28801, 1, 128]
    - [26, 45.329]
  - - [35456, 512, 1, 128]
    - [227, 48.424]
  - - [40960, 24961, 1, 128]
    - [12, 40.336]
  - - [39936, 23937, 1, 128]
    - [12, 46.264]
  - - [31744, 1024, 1, 128]
    - [236, 49.42]
  - - [32128, 8192, 1, 128]
    - [12, 46.465]
  - - [42112, 26113, 1, 128]
    - [12, 45.455]
  - - [31744, 2048, 1, 128]
    - [355, 53.911]
  - - [42112, 1024, 1, 128]
    - [235, 52.106]
  - - [40064, 8192, 1, 128]
    - [12, 45.948]
  - - [38144, 128, 1, 128]
    - [208, 34.22]
  - - [42624, 2048, 1, 128]
    - [17, 40.989]
  - - [36992, 128, 1, 128]
    - [208, 33.291]
  - - [40192, 8192, 1, 128]
    - [17, 46.619]
  - - [40064, 24065, 1, 128]
    - [36, 44.533]
  - - [37760, 21889, 1, 128]
    - [12, 45.545]
  - - [36352, 8192, 1, 128]
    - [15, 46.787]
  - - [44544, 512, 1, 128]
    - [234, 47.185]
  - - [32384, 4096, 1, 128]
    - [17, 45.721]
  - - [39168, 23169, 1, 128]
    - [36, 45.761]
  - - [1408, 897, 1, 128]
    - [62, 29.971]
  - - [16512, 512, 1, 128]
    - [236, 39.434]
  - - [20480, 12673, 1, 128]
    - [17, 47.23]
  - - [20992, 512, 1, 128]
    - [229, 44.717]
  - - [9344, 512, 1, 128]
    - [354, 36.788]
  - - [18048, 2048, 1, 128]
    - [355, 52.973]
  - - [20352, 12673, 1, 128]
    - [17, 45.916]
  - - [640, 128, 1, 128]
    - [77, 3.662]
  - - [28160, 512, 1, 128]
    - [204, 45.015]
  - - [20608, 4096, 1, 128]
    - [17, 44.987]
  - - [19328, 1024, 1, 128]
    - [293, 48.029]
  - - [26496, 4096, 1, 128]
    - [40, 44.965]
  - - [10624, 512, 1, 128]
    - [229, 38.164]
  - - [20352, 1024, 1, 128]
    - [232, 48.547]
  - - [10240, 6529, 1, 128]
    - [357, 54.745]
  - - [22144, 14465, 1, 128]
    - [17, 45.898]
  - - [13184, 2048, 1, 128]
    - [236, 50.562]
  - - [14720, 6913, 1, 128]
    - [15, 44.874]
  - - [21248, 512, 1, 128]
    - [226, 41.725]
  - - [10496, 128, 1, 128]
    - [68, 31.751]
  - - [13056, 5377, 1, 128]
    - [225, 54.304]
  - - [10880, 128, 1, 128]
    - [68, 29.524]
  - - [18688, 512, 1, 128]
    - [229, 43.679]
  - - [22656, 4096, 1, 128]
    - [23, 45.081]
  - - [15232, 1024, 1, 128]
    - [357, 47.74]
  - - [20224, 4096, 1, 128]
    - [24, 45.205]
  - - [6016, 2305, 1, 128]
    - [356, 45.883]
  - - [13184, 4096, 1, 128]
    - [355, 54.674]
  - - [256, 129, 1, 128]
    - [102, 1.465]
  - - [11264, 7553, 1, 128]
    - [15, 45.632]
  - - [18176, 128, 1, 128]
    - [229, 27.695]
  - - [15872, 8193, 1, 128]
    - [15, 45.629]
  - - [26112, 4096, 1, 128]
    - [20, 45.885]
  - - [22784, 2048, 1, 128]
    - [355, 53.805]
  - - [10880, 7297, 1, 128]
    - [15, 44.655]
  - - [14720, 2048, 1, 128]
    - [357, 50.308]
  - - [9216, 5633, 1, 128]
    - [357, 53.171]
  - - [23040, 15233, 1, 128]
    - [15, 46.577]
  - - [8832, 5121, 1, 128]
    - [355, 53.012]
  - - [18816, 1024, 1, 128]
    - [236, 48.449]
  - - [128, 129, 1, 128]
    - [69, 0.738]
  - - [15488, 512, 1, 128]
    - [226, 42.143]
  - - [18176, 1024, 1, 128]
    - [357, 48.229]
  - - [16128, 8449, 1, 128]
    - [17, 45.56]
  - - [16000, 2048, 1, 128]
    - [357, 52.236]
  - - [24960, 9089, 1, 128]
    - [15, 45.317]
  - - [14336, 1024, 1, 128]
    - [284, 46.097]
  - - [25472, 8192, 1, 128]
    - [15, 46.584]
  - - [23040, 128, 1, 128]
    - [13, 31.621]
  - - [9472, 512, 1, 128]
    - [354, 36.413]
  - - [19072, 128, 1, 128]
    - [226, 27.559]
  - - [10624, 6913, 1, 128]
    - [225, 53.711]
  - - [7808, 1024, 1, 128]
    - [236, 41.537]
  - - [27008, 11137, 1, 128]
    - [36, 45.459]
  - - [21504, 4096, 1, 128]
    - [17, 46.162]
  - - [7936, 1024, 1, 128]
    - [357, 41.041]
  - - [12928, 5121, 1, 128]
    - [357, 54.18]
  - - [26240, 8192, 1, 128]
    - [17, 42.362]
  - - [18304, 2048, 1, 128]
    - [235, 53.549]
  - - [24576, 1024, 1, 128]
    - [238, 44.83]
  - - [10624, 128, 1, 128]
    - [63, 28.619]
  - - [24576, 128, 1, 128]
    - [23, 33.175]
  - - [25600, 9601, 1, 128]
    - [26, 46.181]
  - - [5248, 128, 1, 128]
    - [72, 22.135]
  - - [24448, 4096, 1, 128]
    - [24, 45.432]
  - - [19328, 128, 1, 128]
    - [226, 27.624]
  - - [24064, 512, 1, 128]
    - [229, 45.491]
  - - [11136, 512, 1, 128]
    - [354, 38.518]
  - - [14592, 1024, 1, 128]
    - [236, 45.672]
  - - [12544, 4737, 1, 128]
    - [225, 53.311]
  - - [17280, 128, 1, 128]
    - [202, 26.918]
  - - [25344, 8192, 1, 128]
    - [42, 46.021]
  - - [4608, 512, 1, 128]
    - [328, 28.144]
  - - [4608, 128, 1, 128]
    - [70, 20.246]
  - - [21760, 512, 1, 128]
    - [234, 43.191]
  - - [7936, 128, 1, 128]
    - [62, 26.151]
  - - [11008, 7425, 1, 128]
    - [47, 44.734]
  - - [13824, 2048, 1, 128]
    - [236, 50.009]
  - - [18048, 512, 1, 128]
    - [306, 42.155]
  - - [19584, 11905, 1, 128]
    - [15, 45.771]
  - - [22656, 512, 1, 128]
    - [226, 44.496]
  - - [4608, 3073, 1, 128]
    - [227, 45.21]
  - - [5504, 128, 1, 128]
    - [62, 22.823]
  - - [4864, 1024, 1, 128]
    - [227, 36.173]
  - - [17664, 1024, 1, 128]
    - [355, 46.24]
  - - [18176, 2048, 1, 128]
    - [357, 52.941]
  - - [2048, 1537, 1, 128]
    - [354, 30.331]
  - - [22528, 128, 1, 128]
    - [284, 29.227]
  - - [21760, 13953, 1, 128]
    - [12, 46.306]
  - - [7040, 128, 1, 128]
    - [64, 27.349]
  - - [3328, 1665, 1, 128]
    - [230, 38.65]
  - - [768, 512, 1, 128]
    - [69, 16.196]
  - - [21504, 13697, 1, 128]
    - [12, 46.635]
  - - [18560, 10881, 1, 128]
    - [17, 45.473]
  - - [2560, 128, 1, 128]
    - [70, 13.997]
  - - [15616, 1024, 1, 128]
    - [284, 46.849]
  - - [19456, 4096, 1, 128]
    - [17, 45.916]
  - - [25600, 2048, 1, 128]
    - [225, 54.114]
  - - [2304, 128, 1, 128]
    - [97, 12.504]
  - - [1664, 1025, 1, 128]
    - [280, 22.494]
  - - [23168, 15361, 1, 128]
    - [15, 45.518]
  - - [9856, 128, 1, 128]
    - [62, 30.957]
  - - [13312, 2048, 1, 128]
    - [235, 50.798]
  - - [19200, 512, 1, 128]
    - [208, 41.737]
  - - [19200, 2048, 1, 128]
    - [225, 51.895]
  - - [23168, 2048, 1, 128]
    - [236, 53.617]
  - - [18688, 128, 1, 128]
    - [226, 27.388]
  - - [13568, 1024, 1, 128]
    - [326, 45.357]
  - - [17792, 9985, 1, 128]
    - [36, 45.306]
  - - [20608, 1024, 1, 128]
    - [250, 46.71]
  - - [11648, 8065, 1, 128]
    - [15, 44.991]
  - - [1280, 128, 1, 128]
    - [67, 7.324]
  - - [16256, 4096, 1, 128]
    - [357, 57.409]
  - - [17024, 1024, 1, 128]
    - [284, 47.259]
  - - [19456, 128, 1, 128]
    - [328, 28.839]
  - - [20736, 512, 1, 128]
    - [226, 44.957]
  - - [14464, 6785, 1, 128]
    - [15, 44.794]
  - - [20736, 13057, 1, 128]
    - [15, 46.071]
  - - [8704, 2048, 1, 128]
    - [236, 48.855]
  - - [640, 512, 1, 128]
    - [67, 13.792]
  - - [768, 129, 1, 128]
    - [102, 4.395]
  - - [27776, 1024, 1, 128]
    - [326, 49.211]
  - - [19200, 11521, 1, 128]
    - [17, 45.806]
  - - [6400, 2048, 1, 128]
    - [230, 47.4]
  - - [14976, 7297, 1, 128]
    - [17, 44.964]
  - - [7040, 2048, 1, 128]
    - [236, 47.265]
  - - [25984, 128, 1, 128]
    - [23, 34.207]
  - - [13696, 128, 1, 128]
    - [195, 22.203]
  - - [2688, 1153, 1, 128]
    - [206, 31.129]
  - - [15232, 2048, 1, 128]
    - [235, 51.36]
  - - [11776, 128, 1, 128]
    - [68, 29.869]
  - - [3328, 512, 1, 128]
    - [62, 32.644]
  - - [11648, 7937, 1, 128]
    - [15, 44.948]
  - - [19456, 2048, 1, 128]
    - [235, 53.82]
  - - [11008, 128, 1, 128]
    - [63, 29.228]
  - - [9984, 6401, 1, 128]
    - [357, 53.535]
  - - [25856, 9857, 1, 128]
    - [15, 45.618]
  - - [4224, 512, 1, 128]
    - [354, 26.826]
  - - [13568, 5761, 1, 128]
    - [15, 44.662]
  - - [5632, 2049, 1, 128]
    - [223, 44.156]
  - - [8832, 2048, 1, 128]
    - [284, 48.641]
  - - [5632, 3969, 1, 128]
    - [223, 49.058]
  - - [25856, 2048, 1, 128]
    - [357, 53.949]
  - - [25472, 2048, 1, 128]
    - [355, 53.722]
  - - [20736, 12929, 1, 128]
    - [17, 46.039]
  - - [14592, 128, 1, 128]
    - [229, 23.452]
  - - [1792, 512, 1, 128]
    - [63, 24.27]
  - - [14208, 2048, 1, 128]
    - [235, 50.766]
  - - [15360, 7681, 1, 128]
    - [15, 45.649]
  - - [5760, 2048, 1, 128]
    - [223, 45.723]
  - - [6400, 512, 1, 128]
    - [354, 32.672]
  - - [5248, 3713, 1, 128]
    - [236, 49.769]
  - - [16768, 1024, 1, 128]
    - [236, 45.64]
  - - [10752, 512, 1, 128]
    - [227, 38.122]
  - - [26624, 2048, 1, 128]
    - [235, 54.67]
  - - [384, 128, 1, 128]
    - [70, 2.232]
  - - [27392, 8192, 1, 128]
    - [49, 45.808]
  - - [24448, 512, 1, 128]
    - [326, 43.739]
  - - [11136, 7553, 1, 128]
    - [17, 44.898]
  - - [17024, 9345, 1, 128]
    - [17, 45.64]
  - - [16000, 8193, 1, 128]
    - [17, 45.091]
  - - [5888, 2048, 1, 128]
    - [356, 45.596]
  - - [18304, 10497, 1, 128]
    - [15, 45.496]
  - - [3968, 128, 1, 128]
    - [67, 17.751]
  - - [14336, 6529, 1, 128]
    - [17, 45.676]
  - - [19840, 128, 1, 128]
    - [233, 28.609]
  - - [25600, 8192, 1, 128]
    - [17, 47.314]
  - - [18688, 11009, 1, 128]
    - [15, 45.921]
  - - [7680, 1024, 1, 128]
    - [230, 40.948]
  - - [7168, 128, 1, 128]
    - [64, 24.049]
  - - [1664, 512, 1, 128]
    - [62, 26.701]
  - - [12544, 1024, 1, 128]
    - [284, 44.839]
  - - [6528, 2048, 1, 128]
    - [357, 48.57]
  - - [19072, 4096, 1, 128]
    - [357, 55.239]
  - - [2048, 512, 1, 128]
    - [103, 27.115]
  - - [13568, 5889, 1, 128]
    - [17, 44.448]
  - - [23680, 16001, 1, 128]
    - [42, 45.198]
  - - [26112, 10113, 1, 128]
    - [36, 46.101]
  - - [15872, 128, 1, 128]
    - [354, 24.978]
  - - [16384, 512, 1, 128]
    - [354, 35.323]
  - - [9856, 6273, 1, 128]
    - [355, 53.917]
  - - [26368, 1024, 1, 128]
    - [326, 49.113]
  - - [16256, 2048, 1, 128]
    - [236, 52.607]
  - - [3968, 2305, 1, 128]
    - [237, 43.744]
  - - [28672, 8192, 1, 128]
    - [15, 47.54]
  - - [10368, 1024, 1, 128]
    - [230, 43.855]
  - - [11008, 1024, 1, 128]
    - [231, 43.831]
  - - [11776, 4097, 1, 128]
    - [357, 52.955]
  - - [26496, 2048, 1, 128]
    - [236, 53.866]
  - - [17792, 4096, 1, 128]
    - [225, 54.3]
  - - [2304, 512, 1, 128]
    - [63, 29.196]
  - - [9216, 2048, 1, 128]
    - [357, 47.915]
  - - [12416, 512, 1, 128]
    - [227, 38.03]
  - - [18048, 128, 1, 128]
    - [354, 26.691]
  - - [21888, 14209, 1, 128]
    - [50, 41.982]
  - - [9344, 5761, 1, 128]
    - [235, 53.299]
  - - [19712, 2048, 1, 128]
    - [236, 52.819]
  - - [12288, 1024, 1, 128]
    - [232, 43.752]
  - - [3584, 1921, 1, 128]
    - [230, 40.907]
  - - [22784, 128, 1, 128]
    - [244, 29.434]
  - - [26880, 128, 1, 128]
    - [279, 29.521]
  - - [17408, 1024, 1, 128]
    - [232, 48.138]
  - - [15488, 4096, 1, 128]
    - [235, 55.362]
  - - [13312, 5633, 1, 128]
    - [235, 54.253]
  - - [22016, 14337, 1, 128]
    - [19, 46.472]
  - - [19328, 2048, 1, 128]
    - [235, 53.431]
  - - [25600, 128, 1, 128]
    - [13, 33.998]
  - - [22784, 15105, 1, 128]
    - [42, 46.187]
  - - [5376, 3713, 1, 128]
    - [357, 48.796]
  - - [14208, 512, 1, 128]
    - [226, 40.195]
  - - [12928, 4096, 1, 128]
    - [236, 54.968]
  - - [768, 257, 1, 128]
    - [105, 3.819]
  - - [27776, 11777, 1, 128]
    - [15, 45.416]
  - - [12032, 1024, 1, 128]
    - [237, 43.329]
  - - [14208, 4096, 1, 128]
    - [235, 55.301]
  - - [19840, 12161, 1, 128]
    - [15, 45.78]
  - - [17536, 512, 1, 128]
    - [204, 42.669]
  - - [19840, 4096, 1, 128]
    - [23, 45.206]
  - - [26624, 512, 1, 128]
    - [328, 44.708]
  - - [27136, 11137, 1, 128]
    - [19, 46.29]
  - - [11008, 512, 1, 128]
    - [281, 37.608]
  - - [1024, 513, 1, 128]
    - [67, 18.031]
  - - [15744, 512, 1, 128]
    - [226, 41.164]
  - - [22016, 128, 1, 128]
    - [195, 28.887]
  - - [9344, 1024, 1, 128]
    - [357, 43.949]
  - - [28544, 1024, 1, 128]
    - [225, 49.116]
  - - [13440, 5633, 1, 128]
    - [236, 53.569]
  - - [21632, 13825, 1, 128]
    - [26, 45.844]
  - - [24064, 4096, 1, 128]
    - [19, 45.78]
  - - [24192, 512, 1, 128]
    - [354, 43.49]
  - - [22912, 15233, 1, 128]
    - [17, 46.056]
  - - [20864, 13185, 1, 128]
    - [17, 45.554]
  - - [8064, 4353, 1, 128]
    - [223, 51.705]
  - - [8704, 5121, 1, 128]
    - [355, 53.387]
  - - [19840, 1024, 1, 128]
    - [357, 48.157]
  - - [15616, 128, 1, 128]
    - [226, 24.845]
  - - [21632, 512, 1, 128]
    - [204, 44.051]
  - - [13440, 512, 1, 128]
    - [226, 39.255]
  - - [23936, 128, 1, 128]
    - [328, 30.586]
  - - [8960, 5377, 1, 128]
    - [357, 53.068]
  - - [27008, 512, 1, 128]
    - [229, 46.138]
  - - [13440, 5761, 1, 128]
    - [355, 54.22]
  - - [3072, 512, 1, 128]
    - [104, 30.642]
  - - [4096, 1024, 1, 128]
    - [354, 34.487]
  - - [7296, 3585, 1, 128]
    - [356, 49.692]
  - - [12416, 4737, 1, 128]
    - [225, 53.227]
  - - [6912, 512, 1, 128]
    - [354, 31.786]
  - - [11136, 2048, 1, 128]
    - [326, 49.837]
  - - [18176, 10369, 1, 128]
    - [15, 45.848]
  - - [14976, 4096, 1, 128]
    - [357, 55.01]
  - - [19712, 4096, 1, 128]
    - [28, 43.38]
  - - [8064, 1024, 1, 128]
    - [230, 42.69]
  - - [9600, 128, 1, 128]
    - [62, 30.281]
  - - [26240, 1024, 1, 128]
    - [236, 48.83]
  - - [5248, 3585, 1, 128]
    - [236, 49.02]
  - - [16768, 2048, 1, 128]
    - [236, 52.223]
  - - [13184, 128, 1, 128]
    - [352, 23.851]
  - - [19328, 11521, 1, 128]
    - [15, 45.479]
  - - [4864, 512, 1, 128]
    - [354, 29.015]
  - - [3584, 2049, 1, 128]
    - [236, 41.721]
  - - [18560, 128, 1, 128]
    - [229, 27.51]
  - - [27392, 11393, 1, 128]
    - [15, 44.508]
  - - [27520, 512, 1, 128]
    - [236, 44.51]
  - - [18176, 4096, 1, 128]
    - [225, 55.776]
  - - [7808, 4225, 1, 128]
    - [357, 50.554]
  - - [15232, 128, 1, 128]
    - [202, 24.374]
  - - [25728, 1024, 1, 128]
    - [355, 48.1]
  - - [23936, 512, 1, 128]
    - [226, 44.79]
  - - [23424, 2048, 1, 128]
    - [355, 54.142]
  - - [28032, 12161, 1, 128]
    - [15, 45.603]
  - - [27136, 512, 1, 128]
    - [226, 43.429]
  - - [14336, 6657, 1, 128]
    - [12, 45.789]
  - - [15616, 4096, 1, 128]
    - [326, 55.401]
  - - [3328, 1793, 1, 128]
    - [355, 39.844]
  - - [28416, 512, 1, 128]
    - [326, 44.651]
  - - [16384, 8705, 1, 128]
    - [17, 37.424]
  - - [3200, 1537, 1, 128]
    - [328, 36.062]
  - - [26368, 128, 1, 128]
    - [28, 35.08]
  - - [16000, 512, 1, 128]
    - [204, 41.241]
  - - [25216, 9345, 1, 128]
    - [17, 45.479]
  - - [28288, 4096, 1, 128]
    - [12, 45.457]
  - - [24832, 512, 1, 128]
    - [245, 42.656]
  - - [18048, 10369, 1, 128]
    - [14, 44.334]
  - - [20480, 4096, 1, 128]
    - [23, 46.324]
  - - [17792, 10113, 1, 128]
    - [14, 45.432]
  - - [13312, 5505, 1, 128]
    - [235, 54.01]
  - - [17024, 2048, 1, 128]
    - [357, 51.601]
  - - [20608, 12929, 1, 128]
    - [17, 45.702]
  - - [16896, 4096, 1, 128]
    - [236, 55.017]
  - - [27776, 2048, 1, 128]
    - [236, 53.865]
  - - [6912, 3201, 1, 128]
    - [353, 49.42]
  - - [15744, 2048, 1, 128]
    - [357, 51.29]
  - - [24448, 128, 1, 128]
    - [234, 30.666]
  - - [2688, 128, 1, 128]
    - [70, 14.172]
  - - [7808, 2048, 1, 128]
    - [225, 47.973]
  - - [1408, 512, 1, 128]
    - [62, 23.224]
  - - [12032, 512, 1, 128]
    - [234, 38.7]
  - - [26752, 512, 1, 128]
    - [204, 45.517]
  - - [16128, 8321, 1, 128]
    - [17, 45.623]
  - - [25856, 128, 1, 128]
    - [40, 34.214]
  - - [24064, 8192, 1, 128]
    - [20, 47.018]
  - - [28160, 4096, 1, 128]
    - [20, 45.418]
  - - [13312, 128, 1, 128]
    - [68, 31.595]
  - - [10112, 6401, 1, 128]
    - [357, 53.899]
  - - [16384, 4096, 1, 128]
    - [246, 47.528]
  - - [16512, 2048, 1, 128]
    - [357, 51.98]
  - - [27520, 11521, 1, 128]
    - [17, 45.627]
  - - [8192, 4481, 1, 128]
    - [230, 51.551]
  - - [16768, 512, 1, 128]
    - [227, 42.626]
  - - [6144, 128, 1, 128]
    - [62, 25.055]
  - - [13568, 512, 1, 128]
    - [226, 39.924]
  - - [9344, 5633, 1, 128]
    - [235, 53.059]
  - - [13440, 4096, 1, 128]
    - [357, 54.12]
  - - [2176, 1665, 1, 128]
    - [237, 33.293]
  - - [28288, 128, 1, 128]
    - [192, 30.564]
  - - [11776, 4096, 1, 128]
    - [355, 53.897]
  - - [17280, 512, 1, 128]
    - [229, 43.256]
  - - [5504, 3841, 1, 128]
    - [223, 49.825]
  - - [14848, 7041, 1, 128]
    - [15, 45.163]
  - - [3584, 128, 1, 128]
    - [67, 16.958]
  - - [26880, 8192, 1, 128]
    - [15, 46.482]
  - - [2944, 1409, 1, 128]
    - [320, 33.188]
  - - [26368, 10369, 1, 128]
    - [15, 45.792]
  - - [21888, 512, 1, 128]
    - [208, 40.618]
  - - [15872, 2048, 1, 128]
    - [355, 51.353]
  - - [20224, 512, 1, 128]
    - [236, 42.372]
  - - [24320, 8449, 1, 128]
    - [15, 45.716]
  - - [5632, 1024, 1, 128]
    - [227, 37.929]
  - - [17152, 9473, 1, 128]
    - [17, 45.713]
  - - [4096, 128, 1, 128]
    - [67, 18.547]
  - - [8832, 128, 1, 128]
    - [68, 28.344]
  - - [2048, 1409, 1, 128]
    - [192, 29.1]
  - - [28160, 12289, 1, 128]
    - [19, 45.864]
  - - [9088, 5505, 1, 128]
    - [225, 53.461]
  - - [19200, 1024, 1, 128]
    - [235, 45.813]
  - - [18048, 4096, 1, 128]
    - [357, 54.757]
  - - [12928, 512, 1, 128]
    - [233, 39.441]
  - - [20864, 4096, 1, 128]
    - [23, 45.018]
  - - [27008, 2048, 1, 128]
    - [326, 53.958]
  - - [16640, 128, 1, 128]
    - [229, 24.227]
  - - [24960, 8192, 1, 128]
    - [17, 46.265]
  - - [24320, 1024, 1, 128]
    - [284, 47.796]
  - - [23552, 15873, 1, 128]
    - [15, 46.69]
  - - [26240, 4096, 1, 128]
    - [17, 42.717]
  - - [24320, 128, 1, 128]
    - [20, 32.949]
  - - [26240, 128, 1, 128]
    - [13, 34.73]
  - - [3200, 1665, 1, 128]
    - [231, 37.437]
  - - [11776, 2048, 1, 128]
    - [236, 48.835]
  - - [6144, 512, 1, 128]
    - [328, 32.383]
  - - [24960, 128, 1, 128]
    - [13, 33.334]
  - - [23424, 128, 1, 128]
    - [358, 30.377]
  - - [11776, 8065, 1, 128]
    - [40, 45.272]
  - - [19072, 11265, 1, 128]
    - [15, 45.403]
  - - [8192, 4609, 1, 128]
    - [356, 51.195]
  - - [21888, 4096, 1, 128]
    - [49, 40.382]
  - - [14976, 2048, 1, 128]
    - [225, 50.585]
  - - [23680, 4096, 1, 128]
    - [36, 44.576]
  - - [14080, 1024, 1, 128]
    - [230, 44.971]
  - - [19968, 4096, 1, 128]
    - [23, 45.484]
  - - [8704, 128, 1, 128]
    - [64, 28.178]
  - - [23424, 15745, 1, 128]
    - [17, 43.83]
  - - [8320, 2048, 1, 128]
    - [231, 47.239]
  - - [6144, 2433, 1, 128]
    - [356, 46.0]
  - - [19200, 11393, 1, 128]
    - [15, 45.778]
  - - [28416, 128, 1, 128]
    - [354, 30.745]
  - - [14080, 2048, 1, 128]
    - [355, 52.099]
  - - [12544, 4096, 1, 128]
    - [235, 54.715]
  - - [17024, 128, 1, 128]
    - [226, 26.848]
  - - [23936, 16257, 1, 128]
    - [17, 46.159]
  - - [12288, 128, 1, 128]
    - [62, 30.85]
  - - [28800, 1024, 1, 128]
    - [235, 47.944]
  - - [13824, 6017, 1, 128]
    - [15, 45.055]
  - - [23040, 2048, 1, 128]
    - [357, 52.5]
  - - [9984, 6273, 1, 128]
    - [355, 52.8]
  - - [23680, 512, 1, 128]
    - [204, 44.844]
  - - [7936, 4353, 1, 128]
    - [357, 50.061]
  - - [24192, 2048, 1, 128]
    - [235, 53.594]
  - - [8448, 512, 1, 128]
    - [192, 34.153]
  - - [5760, 2177, 1, 128]
    - [353, 45.458]
  - - [22656, 14977, 1, 128]
    - [12, 45.731]
  - - [17024, 4096, 1, 128]
    - [235, 55.287]
  - - [24960, 8961, 1, 128]
    - [15, 45.169]
  - - [5888, 1024, 1, 128]
    - [230, 40.29]
  - - [9344, 2048, 1, 128]
    - [223, 48.467]
  - - [11520, 1024, 1, 128]
    - [355, 44.428]
  - - [17024, 9217, 1, 128]
    - [17, 45.351]
  - - [10368, 6657, 1, 128]
    - [236, 54.298]
  - - [21632, 2048, 1, 128]
    - [235, 53.754]
  - - [26880, 2048, 1, 128]
    - [225, 54.234]
  - - [20736, 4096, 1, 128]
    - [17, 45.481]
  - - [26624, 8192, 1, 128]
    - [15, 47.587]
  - - [26752, 2048, 1, 128]
    - [236, 53.795]
  - - [24192, 8321, 1, 128]
    - [15, 45.195]
  - - [4736, 1024, 1, 128]
    - [237, 36.939]
  - - [27648, 8192, 1, 128]
    - [17, 47.306]
  - - [27392, 11521, 1, 128]
    - [49, 44.51]
  - - [27776, 4096, 1, 128]
    - [24, 45.284]
  - - [28672, 12801, 1, 128]
    - [15, 46.648]
  - - [13056, 512, 1, 128]
    - [327, 39.481]
  - - [25088, 2048, 1, 128]
    - [225, 54.494]
  - - [17408, 9601, 1, 128]
    - [15, 46.144]
  - - [5120, 3585, 1, 128]
    - [353, 49.524]
  - - [13824, 512, 1, 128]
    - [227, 39.765]
  - - [8576, 1024, 1, 128]
    - [236, 42.205]
  - - [16768, 4096, 1, 128]
    - [355, 56.018]
  - - [25728, 9729, 1, 128]
    - [17, 45.32]
  - - [27392, 512, 1, 128]
    - [357, 43.933]
  - - [13824, 128, 1, 128]
    - [68, 32.393]
  - - [27264, 1024, 1, 128]
    - [24, 41.537]
  - - [22272, 14465, 1, 128]
    - [19, 46.223]
  - - [19840, 2048, 1, 128]
    - [236, 52.551]
  - - [18176, 10497, 1, 128]
    - [15, 45.819]
  - - [4992, 3329, 1, 128]
    - [227, 46.928]
  - - [14976, 7169, 1, 128]
    - [17, 44.407]
  - - [10112, 512, 1, 128]
    - [229, 37.671]
  - - [24704, 128, 1, 128]
    - [17, 33.286]
  - - [16896, 128, 1, 128]
    - [204, 25.928]
  - - [10880, 7169, 1, 128]
    - [355, 56.759]
  - - [9600, 512, 1, 128]
    - [227, 36.913]
  - - [22528, 1024, 1, 128]
    - [232, 48.758]
  - - [27008, 128, 1, 128]
    - [192, 30.056]
  - - [4480, 2945, 1, 128]
    - [356, 47.872]
  - - [15872, 8065, 1, 128]
    - [15, 45.84]
  - - [28672, 128, 1, 128]
    - [279, 30.697]
  - - [9344, 128, 1, 128]
    - [64, 29.6]
  - - [15360, 2048, 1, 128]
    - [235, 51.481]
  - - [11392, 512, 1, 128]
    - [226, 38.856]
  - - [9216, 128, 1, 128]
    - [64, 28.702]
  - - [8192, 2048, 1, 128]
    - [230, 45.162]
  - - [14464, 1024, 1, 128]
    - [226, 45.934]
  - - [4096, 2433, 1, 128]
    - [40, 39.249]
  - - [6528, 2945, 1, 128]
    - [355, 50.392]
  - - [12672, 512, 1, 128]
    - [234, 39.978]
  - - [26624, 128, 1, 128]
    - [251, 31.426]
  - - [19712, 1024, 1, 128]
    - [357, 46.679]
  - - [4480, 2817, 1, 128]
    - [231, 46.027]
  - - [13440, 2048, 1, 128]
    - [236, 50.073]
  - - [256, 257, 1, 128]
    - [67, 2.987]
  - - [16000, 128, 1, 128]
    - [229, 25.173]
  - - [7552, 3969, 1, 128]
    - [225, 49.954]
  - - [12416, 2048, 1, 128]
    - [225, 48.645]
  - - [18432, 512, 1, 128]
    - [284, 42.921]
  - - [14464, 512, 1, 128]
    - [227, 40.968]
  - - [1280, 769, 1, 128]
    - [62, 25.116]
  - - [14976, 512, 1, 128]
    - [236, 40.323]
  - - [28032, 4096, 1, 128]
    - [24, 45.397]
  - - [27904, 128, 1, 128]
    - [226, 30.141]
  - - [20224, 12545, 1, 128]
    - [17, 45.854]
  - - [15872, 4096, 1, 128]
    - [236, 54.551]
  - - [3456, 1793, 1, 128]
    - [237, 39.924]
  - - [14336, 128, 1, 128]
    - [192, 23.187]
  - - [21248, 2048, 1, 128]
    - [355, 53.28]
  - - [23040, 1024, 1, 128]
    - [326, 48.834]
  - - [15232, 7425, 1, 128]
    - [12, 44.631]
  - - [14592, 512, 1, 128]
    - [355, 40.608]
  - - [22912, 15105, 1, 128]
    - [17, 45.856]
  - - [22528, 2048, 1, 128]
    - [225, 54.224]
  - - [3072, 1024, 1, 128]
    - [249, 31.621]
  - - [17536, 4096, 1, 128]
    - [225, 55.835]
  - - [384, 257, 1, 128]
    - [73, 4.378]
  - - [14464, 6657, 1, 128]
    - [17, 44.75]
  - - [20096, 1024, 1, 128]
    - [235, 47.777]
  - - [26880, 4096, 1, 128]
    - [15, 45.686]
  - - [18816, 2048, 1, 128]
    - [236, 53.333]
  - - [17152, 512, 1, 128]
    - [355, 42.23]
  - - [18432, 4096, 1, 128]
    - [235, 56.697]
  - - [10368, 2048, 1, 128]
    - [236, 48.08]
  - - [1408, 769, 1, 128]
    - [68, 27.266]
  - - [7168, 2048, 1, 128]
    - [226, 47.029]
  - - [17664, 128, 1, 128]
    - [40, 26.138]
  - - [1152, 513, 1, 128]
    - [69, 19.814]
  - - [7296, 3713, 1, 128]
    - [237, 50.165]
  - - [24064, 2048, 1, 128]
    - [225, 53.783]
  - - [8576, 2048, 1, 128]
    - [355, 47.297]
  - - [23168, 15489, 1, 128]
    - [17, 45.702]
  - - [14848, 7169, 1, 128]
    - [17, 44.814]
  - - [2432, 512, 1, 128]
    - [103, 30.686]
  - - [19712, 12033, 1, 128]
    - [36, 44.208]
  - - [25856, 4096, 1, 128]
    - [15, 45.649]
  - - [17152, 9345, 1, 128]
    - [19, 45.62]
  - - [3712, 128, 1, 128]
    - [72, 16.913]
  - - [22272, 128, 1, 128]
    - [195, 29.31]
  - - [25600, 9729, 1, 128]
    - [17, 46.199]
  - - [6016, 2433, 1, 128]
    - [231, 47.366]
  - - [12928, 128, 1, 128]
    - [68, 32.348]
  - - [25088, 8192, 1, 128]
    - [42, 46.92]
  - - [7040, 1024, 1, 128]
    - [230, 39.855]
  - - [4736, 3201, 1, 128]
    - [357, 46.411]
  - - [16000, 1024, 1, 128]
    - [225, 46.75]
  - - [1920, 512, 1, 128]
    - [62, 25.535]
  - - [8192, 1024, 1, 128]
    - [231, 41.701]
  - - [8448, 4865, 1, 128]
    - [357, 52.116]
  - - [11136, 7425, 1, 128]
    - [15, 45.079]
  - - [23296, 4096, 1, 128]
    - [17, 45.463]
  - - [27904, 2048, 1, 128]
    - [326, 53.557]
  - - [23552, 4096, 1, 128]
    - [15, 46.138]
  - - [24960, 2048, 1, 128]
    - [225, 54.204]
  - - [2816, 128, 1, 128]
    - [77, 14.953]
  - - [7424, 3841, 1, 128]
    - [230, 50.11]
  - - [20480, 128, 1, 128]
    - [284, 27.718]
  - - [18816, 11137, 1, 128]
    - [15, 45.576]
  - - [26496, 128, 1, 128]
    - [326, 31.037]
  - - [16896, 9217, 1, 128]
    - [15, 45.874]
  - - [23296, 512, 1, 128]
    - [227, 44.724]
  - - [8064, 2048, 1, 128]
    - [293, 46.918]
  - - [19968, 128, 1, 128]
    - [328, 27.276]
  - - [8320, 4737, 1, 128]
    - [355, 52.283]
  - - [27648, 1024, 1, 128]
    - [326, 49.409]
  - - [3712, 512, 1, 128]
    - [354, 24.324]
  - - [256, 128, 1, 128]
    - [67, 1.5]
  - - [3072, 1537, 1, 128]
    - [236, 37.101]
  - - [5504, 1024, 1, 128]
    - [357, 38.741]
  - - [20992, 2048, 1, 128]
    - [357, 52.578]
  - - [20480, 1024, 1, 128]
    - [356, 45.739]
  - - [20864, 128, 1, 128]
    - [328, 28.413]
  - - [28544, 12545, 1, 128]
    - [15, 45.641]
  - - [1152, 512, 1, 128]
    - [67, 20.49]
  - - [24320, 8321, 1, 128]
    - [17, 45.636]
  - - [2688, 512, 1, 128]
    - [74, 29.178]
  - - [27904, 8192, 1, 128]
    - [36, 46.305]
  - - [3840, 2177, 1, 128]
    - [231, 43.787]
  - - [25344, 128, 1, 128]
    - [354, 31.292]
  - - [13184, 512, 1, 128]
    - [226, 39.676]
  - - [7680, 512, 1, 128]
    - [227, 33.382]
  - - [11904, 2048, 1, 128]
    - [236, 49.484]
  - - [12544, 512, 1, 128]
    - [227, 39.249]
  - - [8448, 4737, 1, 128]
    - [355, 51.681]
  - - [28544, 128, 1, 128]
    - [279, 30.479]
  - - [21760, 14081, 1, 128]
    - [17, 46.293]
  - - [12800, 128, 1, 128]
    - [63, 31.388]
  - - [17664, 4096, 1, 128]
    - [236, 55.788]
  - - [2432, 1793, 1, 128]
    - [229, 35.712]
  - - [16384, 8577, 1, 128]
    - [17, 37.574]
  - - [28544, 512, 1, 128]
    - [204, 44.82]
  - - [28032, 12033, 1, 128]
    - [15, 45.692]
  - - [4864, 3329, 1, 128]
    - [237, 48.742]
  - - [12928, 5249, 1, 128]
    - [355, 54.523]
  - - [4736, 512, 1, 128]
    - [227, 28.645]
  - - [27264, 2048, 1, 128]
    - [357, 53.774]
  - - [19840, 12033, 1, 128]
    - [17, 45.797]
  - - [19584, 4096, 1, 128]
    - [17, 45.273]
  - - [21376, 4096, 1, 128]
    - [15, 45.323]
  - - [20352, 4096, 1, 128]
    - [23, 45.354]
  - - [6400, 2689, 1, 128]
    - [236, 46.205]
  - - [24704, 8192, 1, 128]
    - [41, 45.87]
  - - [22528, 14849, 1, 128]
    - [17, 46.927]
  - - [18304, 512, 1, 128]
    - [226, 43.445]
  - - [6656, 1024, 1, 128]
    - [356, 40.141]
  - - [13568, 4096, 1, 128]
    - [225, 54.883]
  - - [6016, 512, 1, 128]
    - [328, 31.89]
  - - [17664, 2048, 1, 128]
    - [225, 52.614]
  - - [17408, 512, 1, 128]
    - [226, 43.151]
  - - [24960, 4096, 1, 128]
    - [15, 45.456]
  - - [20608, 12801, 1, 128]
    - [15, 45.592]
  - - [27648, 11649, 1, 128]
    - [15, 46.394]
  - - [5760, 128, 1, 128]
    - [63, 23.233]
  - - [17792, 512, 1, 128]
    - [354, 41.765]
  - - [17664, 512, 1, 128]
    - [226, 42.386]
  - - [19968, 12161, 1, 128]
    - [15, 46.15]
  - - [19840, 512, 1, 128]
    - [226, 43.613]
  - - [12032, 4353, 1, 128]
    - [236, 53.274]
  - - [25984, 512, 1, 128]
    - [357, 45.476]
  - - [27648, 4096, 1, 128]
    - [15, 46.345]
  - - [10752, 7041, 1, 128]
    - [225, 54.715]
  - - [28544, 2048, 1, 128]
    - [355, 52.391]
  - - [7680, 2048, 1, 128]
    - [357, 48.937]
  - - [13184, 5377, 1, 128]
    - [236, 53.603]
  - - [6784, 3201, 1, 128]
    - [353, 49.204]
  - - [16384, 2048, 1, 128]
    - [246, 44.152]
  - - [22656, 1024, 1, 128]
    - [293, 48.83]
  - - [12800, 512, 1, 128]
    - [227, 39.962]
  - - [23936, 1024, 1, 128]
    - [235, 49.414]
  - - [15360, 1024, 1, 128]
    - [355, 47.941]
  - - [15488, 2048, 1, 128]
    - [236, 51.296]
  - - [11392, 1024, 1, 128]
    - [326, 44.323]
  - - [15744, 1024, 1, 128]
    - [250, 46.034]
  - - [9856, 2048, 1, 128]
    - [357, 48.566]
  - - [5888, 2305, 1, 128]
    - [357, 45.387]
  - - [10496, 512, 1, 128]
    - [208, 37.101]
  - - [1664, 1153, 1, 128]
    - [328, 23.994]
  - - [3456, 1024, 1, 128]
    - [237, 33.032]
  - - [20992, 13313, 1, 128]
    - [17, 46.058]
  - - [11904, 4096, 1, 128]
    - [355, 53.88]
  - - [13056, 1024, 1, 128]
    - [234, 46.291]
  - - [12800, 2048, 1, 128]
    - [225, 50.352]
  - - [12160, 512, 1, 128]
    - [227, 38.703]
  - - [5760, 2049, 1, 128]
    - [223, 45.291]
  - - [11392, 128, 1, 128]
    - [68, 30.138]
  - - [5632, 128, 1, 128]
    - [63, 22.716]
  - - [11520, 2048, 1, 128]
    - [284, 49.716]
  - - [11648, 2048, 1, 128]
    - [225, 50.277]
  - - [28544, 8192, 1, 128]
    - [15, 46.393]
  - - [22912, 1024, 1, 128]
    - [355, 47.99]
  - - [10752, 7169, 1, 128]
    - [235, 54.618]
  - - [8320, 128, 1, 128]
    - [63, 26.935]
  - - [23808, 1024, 1, 128]
    - [326, 48.631]
  - - [25984, 8192, 1, 128]
    - [14, 46.384]
  - - [22656, 2048, 1, 128]
    - [235, 53.898]
  - - [7296, 1024, 1, 128]
    - [230, 39.746]
  - - [28032, 512, 1, 128]
    - [227, 47.082]
  - - [22400, 2048, 1, 128]
    - [225, 52.737]
  - - [22144, 512, 1, 128]
    - [229, 45.065]
  - - [13312, 4096, 1, 128]
    - [225, 55.602]
  - - [10240, 2048, 1, 128]
    - [236, 49.823]
  - - [12672, 128, 1, 128]
    - [68, 32.477]
  - - [10752, 2048, 1, 128]
    - [293, 48.851]
  - - [1152, 128, 1, 128]
    - [69, 6.643]
  - - [13696, 5889, 1, 128]
    - [24, 42.592]
  - - [9216, 1024, 1, 128]
    - [234, 43.271]
  - - [17152, 128, 1, 128]
    - [328, 26.61]
  - - [24320, 2048, 1, 128]
    - [234, 52.72]
  - - [16512, 8705, 1, 128]
    - [17, 44.284]
  - - [3072, 1409, 1, 128]
    - [356, 34.33]
  - - [1024, 128, 1, 128]
    - [70, 5.905]
  - - [22400, 14593, 1, 128]
    - [12, 45.652]
  - - [4096, 512, 1, 128]
    - [324, 25.77]
  - - [4992, 128, 1, 128]
    - [67, 21.548]
  - - [9472, 5889, 1, 128]
    - [236, 53.662]
  - - [9472, 5761, 1, 128]
    - [236, 53.673]
  - - [27136, 1024, 1, 128]
    - [326, 50.181]
  - - [6528, 1024, 1, 128]
    - [357, 40.894]
  - - [25472, 1024, 1, 128]
    - [236, 49.036]
  - - [5120, 512, 1, 128]
    - [328, 28.709]
  - - [5504, 512, 1, 128]
    - [229, 29.114]
  - - [21120, 13441, 1, 128]
    - [36, 44.906]
  - - [4352, 128, 1, 128]
    - [67, 19.236]
  - - [8832, 5249, 1, 128]
    - [355, 53.42]
  - - [1536, 1025, 1, 128]
    - [213, 21.25]
  - - [11520, 512, 1, 128]
    - [229, 38.624]
  - - [5632, 2048, 1, 128]
    - [320, 43.663]
  - - [7424, 128, 1, 128]
    - [64, 24.684]
  - - [18432, 128, 1, 128]
    - [227, 27.214]
  - - [12672, 2048, 1, 128]
    - [236, 50.265]
  - - [14208, 128, 1, 128]
    - [354, 23.737]
  - - [15360, 7553, 1, 128]
    - [17, 45.889]
  - - [26496, 1024, 1, 128]
    - [284, 49.645]
  - - [27136, 128, 1, 128]
    - [279, 30.147]
  - - [12032, 2048, 1, 128]
    - [357, 49.481]
  - - [11648, 1024, 1, 128]
    - [357, 45.223]
  - - [11776, 512, 1, 128]
    - [227, 37.753]
  - - [1024, 512, 1, 128]
    - [351, 9.915]
  - - [11264, 7681, 1, 128]
    - [17, 45.447]
  - - [19456, 11777, 1, 128]
    - [15, 46.512]
  - - [14080, 4096, 1, 128]
    - [357, 54.196]
  - - [7040, 3329, 1, 128]
    - [223, 50.672]
  - - [27392, 4096, 1, 128]
    - [50, 44.661]
  - - [14720, 7041, 1, 128]
    - [17, 44.828]
  - - [19584, 1024, 1, 128]
    - [236, 48.593]
  - - [21376, 13569, 1, 128]
    - [17, 45.75]
  - - [20480, 12801, 1, 128]
    - [17, 47.065]
  - - [21248, 128, 1, 128]
    - [358, 28.485]
  - - [9728, 1024, 1, 128]
    - [235, 43.513]
  - - [18688, 10881, 1, 128]
    - [17, 45.714]
  - - [21120, 13313, 1, 128]
    - [19, 44.673]
  - - [20096, 2048, 1, 128]
    - [355, 53.016]
  - - [16640, 4096, 1, 128]
    - [236, 55.612]
  - - [28160, 12161, 1, 128]
    - [36, 45.981]
  - - [640, 129, 1, 128]
    - [67, 3.662]
  - - [28672, 512, 1, 128]
    - [354, 44.181]
  - - [12416, 4096, 1, 128]
    - [225, 53.69]
  - - [25344, 9473, 1, 128]
    - [20, 44.899]
  - - [18304, 1024, 1, 128]
    - [225, 46.511]
  - - [25600, 4096, 1, 128]
    - [15, 46.394]
  - - [22272, 512, 1, 128]
    - [204, 44.963]
  - - [21504, 13825, 1, 128]
    - [26, 46.611]
  - - [4736, 128, 1, 128]
    - [279, 10.888]
  - - [26496, 10625, 1, 128]
    - [42, 45.111]
  - - [7040, 512, 1, 128]
    - [281, 32.309]
  - - [14336, 4096, 1, 128]
    - [225, 55.544]
  - - [9216, 512, 1, 128]
    - [229, 36.451]
  - - [1280, 641, 1, 128]
    - [62, 24.901]
  - - [16768, 8961, 1, 128]
    - [17, 45.569]
  - - [18944, 11137, 1, 128]
    - [36, 46.171]
  - - [21504, 2048, 1, 128]
    - [235, 54.423]
  - - [21888, 1024, 1, 128]
    - [355, 48.193]
  - - [11264, 512, 1, 128]
    - [204, 38.548]
  - - [27776, 8192, 1, 128]
    - [15, 46.27]
  - - [10368, 6785, 1, 128]
    - [236, 54.417]
  - - [18432, 10753, 1, 128]
    - [15, 46.711]
  - - [19968, 2048, 1, 128]
    - [326, 53.078]
  - - [16640, 512, 1, 128]
    - [200, 39.76]
  - - [24576, 8577, 1, 128]
    - [26, 42.526]
  - - [28672, 2048, 1, 128]
    - [293, 51.778]
  - - [11136, 128, 1, 128]
    - [62, 29.674]
  - - [12288, 4609, 1, 128]
    - [223, 52.392]
  - - [14848, 1024, 1, 128]
    - [355, 44.415]
  - - [14848, 128, 1, 128]
    - [354, 23.494]
  - - [7424, 1024, 1, 128]
    - [226, 40.154]
  - - [2560, 1024, 1, 128]
    - [227, 28.336]
  - - [6400, 128, 1, 128]
    - [62, 25.674]
  - - [15488, 7809, 1, 128]
    - [17, 45.064]
  - - [17920, 2048, 1, 128]
    - [284, 51.598]
  - - [5760, 512, 1, 128]
    - [284, 31.007]
  - - [16640, 1024, 1, 128]
    - [357, 46.005]
  - - [28160, 2048, 1, 128]
    - [326, 54.242]
  - - [5504, 3969, 1, 128]
    - [355, 49.587]
  - - [11776, 1024, 1, 128]
    - [327, 42.472]
  - - [18816, 128, 1, 128]
    - [328, 27.693]
  - - [27904, 12033, 1, 128]
    - [36, 45.586]
  - - [11520, 7937, 1, 128]
    - [17, 44.746]
  - - [18944, 11265, 1, 128]
    - [42, 46.055]
  - - [5376, 1024, 1, 128]
    - [231, 38.415]
  - - [12032, 4225, 1, 128]
    - [357, 53.132]
  - - [5376, 128, 1, 128]
    - [62, 22.045]
  - - [9856, 1024, 1, 128]
    - [236, 43.608]
  - - [26752, 10881, 1, 128]
    - [17, 45.393]
  - - [20352, 128, 1, 128]
    - [245, 27.369]
  - - [14464, 128, 1, 128]
    - [192, 23.428]
  - - [1024, 385, 1, 128]
    - [73, 15.36]
  - - [3840, 128, 1, 128]
    - [69, 17.389]
  - - [24192, 128, 1, 128]
    - [13, 32.783]
  - - [28544, 12673, 1, 128]
    - [17, 45.789]
  - - [1664, 128, 1, 128]
    - [69, 9.305]
  - - [26752, 8192, 1, 128]
    - [12, 46.339]
  - - [16896, 1024, 1, 128]
    - [234, 46.454]
  - - [9728, 128, 1, 128]
    - [63, 30.297]
  - - [11264, 2048, 1, 128]
    - [236, 48.948]
  - - [11392, 2048, 1, 128]
    - [225, 50.785]
  - - [20224, 2048, 1, 128]
    - [225, 53.57]
  - - [26880, 1024, 1, 128]
    - [235, 50.239]
  - - [15104, 512, 1, 128]
    - [229, 41.305]
  - - [26368, 2048, 1, 128]
    - [357, 53.796]
  - - [6784, 3073, 1, 128]
    - [236, 47.411]
  - - [23168, 128, 1, 128]
    - [243, 30.032]
  - - [8448, 1024, 1, 128]
    - [229, 40.097]
  - - [16896, 9089, 1, 128]
    - [14, 46.11]
  - - [17536, 128, 1, 128]
    - [226, 26.848]
  - - [22912, 512, 1, 128]
    - [235, 43.864]
  - - [28032, 128, 1, 128]
    - [226, 29.876]
  - - [19584, 512, 1, 128]
    - [226, 44.485]
  - - [27136, 11265, 1, 128]
    - [14, 46.115]
  - - [4992, 512, 1, 128]
    - [192, 28.539]
  - - [8448, 128, 1, 128]
    - [68, 27.47]
  - - [27648, 128, 1, 128]
    - [354, 30.544]
  - - [16640, 2048, 1, 128]
    - [236, 51.631]
  - - [26752, 10753, 1, 128]
    - [26, 45.477]
  - - [2944, 1281, 1, 128]
    - [354, 33.347]
  - - [5376, 3841, 1, 128]
    - [353, 48.686]
  - - [10496, 6913, 1, 128]
    - [355, 53.876]
  - - [17024, 512, 1, 128]
    - [226, 42.615]
  - - [11008, 7297, 1, 128]
    - [61, 44.623]
  - - [14080, 128, 1, 128]
    - [208, 23.005]
  - - [5888, 512, 1, 128]
    - [227, 31.076]
  - - [19200, 128, 1, 128]
    - [227, 27.619]
  - - [14208, 6529, 1, 128]
    - [17, 44.534]
  - - [22912, 4096, 1, 128]
    - [23, 45.339]
  - - [14336, 2048, 1, 128]
    - [236, 51.453]
  - - [17792, 128, 1, 128]
    - [202, 27.004]
  - - [22656, 14849, 1, 128]
    - [12, 45.629]
  - - [19712, 512, 1, 128]
    - [235, 41.691]
  - - [5248, 1024, 1, 128]
    - [231, 37.721]
  - - [3712, 2049, 1, 128]
    - [227, 41.231]
  - - [24448, 8449, 1, 128]
    - [17, 45.255]
  - - [8192, 512, 1, 128]
    - [328, 33.366]
  - - [25472, 4096, 1, 128]
    - [15, 45.651]
  - - [25088, 512, 1, 128]
    - [326, 45.309]
  - - [23168, 1024, 1, 128]
    - [236, 49.417]
  - - [24320, 8192, 1, 128]
    - [20, 46.734]
  - - [24192, 8192, 1, 128]
    - [15, 46.474]
  - - [2176, 512, 1, 128]
    - [63, 28.055]
  - - [4992, 3457, 1, 128]
    - [223, 48.707]
  - - [896, 257, 1, 128]
    - [105, 9.692]
  - - [28288, 1024, 1, 128]
    - [235, 49.598]
  - - [20864, 1024, 1, 128]
    - [225, 48.463]
  - - [18432, 2048, 1, 128]
    - [225, 53.385]
  - - [17280, 9601, 1, 128]
    - [17, 45.382]
  - - [18944, 4096, 1, 128]
    - [236, 55.19]
  - - [13440, 128, 1, 128]
    - [64, 32.958]
  - - [7424, 2048, 1, 128]
    - [226, 47.289]
  - - [768, 128, 1, 128]
    - [70, 4.429]
  - - [16128, 512, 1, 128]
    - [200, 40.311]
  - - [28288, 12289, 1, 128]
    - [17, 45.397]
  - - [23552, 128, 1, 128]
    - [32, 31.909]
  - - [24832, 8192, 1, 128]
    - [40, 46.933]
  - - [10240, 1024, 1, 128]
    - [227, 42.863]
  - - [8960, 2048, 1, 128]
    - [326, 47.301]
  - - [17664, 9985, 1, 128]
    - [17, 45.395]
  - - [25088, 4096, 1, 128]
    - [40, 45.937]
  - - [7552, 2048, 1, 128]
    - [236, 48.022]
  - - [15104, 7297, 1, 128]
    - [15, 45.225]
  - - [7168, 1024, 1, 128]
    - [356, 41.527]
  - - [26112, 8192, 1, 128]
    - [20, 47.055]
  - - [24192, 1024, 1, 128]
    - [355, 48.481]
  - - [22912, 2048, 1, 128]
    - [357, 53.137]
  - - [10368, 512, 1, 128]
    - [229, 38.034]
  - - [22528, 4096, 1, 128]
    - [17, 46.425]
  - - [6528, 128, 1, 128]
    - [63, 26.046]
  - - [26752, 4096, 1, 128]
    - [26, 45.179]
  - - [2816, 512, 1, 128]
    - [62, 30.344]
  - - [22016, 14209, 1, 128]
    - [14, 46.54]
  - - [8832, 1024, 1, 128]
    - [355, 42.667]
  - - [16384, 128, 1, 128]
    - [229, 24.871]
  - - [5120, 1024, 1, 128]
    - [328, 36.945]
  - - [24832, 8833, 1, 128]
    - [36, 45.868]
  - - [11520, 128, 1, 128]
    - [63, 30.26]
  - - [24960, 512, 1, 128]
    - [225, 45.76]
  - - [27520, 2048, 1, 128]
    - [355, 53.844]
  - - [22272, 14593, 1, 128]
    - [36, 45.954]
  - - [2048, 128, 1, 128]
    - [70, 11.281]
  - - [2176, 1537, 1, 128]
    - [355, 31.989]
  - - [10496, 1024, 1, 128]
    - [227, 42.845]
  - - [12160, 4353, 1, 128]
    - [357, 53.159]
  - - [6144, 1024, 1, 128]
    - [225, 38.808]
  - - [26752, 1024, 1, 128]
    - [225, 48.969]
  - - [17280, 4096, 1, 128]
    - [235, 55.614]
  - - [16896, 512, 1, 128]
    - [227, 41.476]
  - - [4480, 128, 1, 128]
    - [70, 19.801]
  - - [18944, 128, 1, 128]
    - [229, 27.456]
  - - [9600, 2048, 1, 128]
    - [242, 47.391]
  - - [19456, 1024, 1, 128]
    - [15, 41.595]
  - - [9984, 2048, 1, 128]
    - [15, 42.255]
  - - [25216, 9217, 1, 128]
    - [12, 45.153]
  - - [19968, 1024, 1, 128]
    - [326, 48.69]
  - - [13952, 2048, 1, 128]
    - [357, 49.255]
  - - [10496, 2048, 1, 128]
    - [353, 48.899]
  - - [12672, 1024, 1, 128]
    - [293, 45.114]
  - - [19072, 11393, 1, 128]
    - [26, 45.652]
  - - [11008, 2048, 1, 128]
    - [231, 48.437]
  - - [27520, 11649, 1, 128]
    - [17, 45.664]
  - - [10880, 512, 1, 128]
    - [226, 39.149]
  - - [14592, 6785, 1, 128]
    - [40, 44.037]
  - - [7424, 512, 1, 128]
    - [354, 33.623]
  - - [13056, 5249, 1, 128]
    - [236, 53.815]
  - - [23296, 15489, 1, 128]
    - [15, 46.155]
  - - [28416, 8192, 1, 128]
    - [17, 46.394]
  - - [11392, 7681, 1, 128]
    - [17, 44.48]
  - - [18048, 1024, 1, 128]
    - [357, 47.706]
  - - [15616, 7809, 1, 128]
    - [17, 45.364]
  - - [128, 128, 1, 128]
    - [67, 0.75]
  - - [24704, 512, 1, 128]
    - [236, 41.874]
  - - [7680, 4097, 1, 128]
    - [357, 49.7]
  - - [16640, 8961, 1, 128]
    - [15, 45.941]
  - - [18944, 1024, 1, 128]
    - [357, 48.784]
  - - [12928, 2048, 1, 128]
    - [235, 50.04]
  - - [22272, 2048, 1, 128]
    - [357, 53.445]
  - - [27904, 11905, 1, 128]
    - [19, 45.645]
  - - [26240, 2048, 1, 128]
    - [226, 52.67]
  - - [9728, 6017, 1, 128]
    - [235, 53.768]
  - - [20736, 1024, 1, 128]
    - [236, 46.478]
  - - [3456, 1921, 1, 128]
    - [223, 40.106]
  - - [8064, 512, 1, 128]
    - [236, 33.329]
  - - [4224, 1024, 1, 128]
    - [328, 34.247]
  - - [25984, 10113, 1, 128]
    - [19, 45.563]
  - - [13696, 6017, 1, 128]
    - [47, 42.514]
  - - [27520, 8192, 1, 128]
    - [15, 46.441]
  - - [18944, 512, 1, 128]
    - [229, 44.207]
  - - [6272, 128, 1, 128]
    - [64, 25.437]
  - - [27264, 4096, 1, 128]
    - [24, 45.21]
  - - [1792, 1153, 1, 128]
    - [220, 25.496]
  - - [17536, 9729, 1, 128]
    - [15, 45.307]
  - - [13184, 5505, 1, 128]
    - [353, 53.155]
  - - [2944, 128, 1, 128]
    - [69, 15.411]
  - - [25344, 512, 1, 128]
    - [229, 45.588]
  - - [23040, 15361, 1, 128]
    - [15, 46.101]
  - - [8704, 512, 1, 128]
    - [354, 35.53]
  - - [20864, 13057, 1, 128]
    - [12, 45.465]
  - - [19328, 4096, 1, 128]
    - [15, 45.15]
  - - [28288, 8192, 1, 128]
    - [26, 46.469]
  - - [10112, 1024, 1, 128]
    - [236, 43.778]
  - - [17536, 2048, 1, 128]
    - [236, 52.868]
  - - [7552, 128, 1, 128]
    - [62, 24.997]
  - - [15616, 7937, 1, 128]
    - [17, 45.393]
  - - [23040, 512, 1, 128]
    - [236, 42.981]
  - - [25984, 2048, 1, 128]
    - [357, 53.693]
  - - [14720, 128, 1, 128]
    - [328, 23.464]
  - - [23424, 1024, 1, 128]
    - [357, 47.18]
  - - [1920, 1281, 1, 128]
    - [192, 26.965]
  - - [27136, 2048, 1, 128]
    - [235, 53.897]
  - - [28800, 8192, 1, 128]
    - [17, 46.396]
  - - [15488, 128, 1, 128]
    - [195, 24.417]
  - - [28800, 12929, 1, 128]
    - [15, 45.572]
  - - [21888, 14081, 1, 128]
    - [50, 41.962]
  - - [25600, 1024, 1, 128]
    - [225, 49.147]
  - - [21632, 1024, 1, 128]
    - [227, 47.781]
  - - [24448, 1024, 1, 128]
    - [293, 49.673]
  - - [4352, 2689, 1, 128]
    - [356, 46.742]
  - - [20480, 512, 1, 128]
    - [236, 41.797]
  - - [7296, 128, 1, 128]
    - [68, 24.703]
  - - [4992, 1024, 1, 128]
    - [227, 37.418]
  - - [27264, 11393, 1, 128]
    - [17, 45.662]
  - - [26752, 128, 1, 128]
    - [195, 29.375]
  - - [24960, 1024, 1, 128]
    - [356, 48.573]
  - - [21504, 512, 1, 128]
    - [236, 43.872]
  - - [6272, 2561, 1, 128]
    - [230, 46.917]
  - - [25088, 9089, 1, 128]
    - [14, 45.869]
  - - [20864, 512, 1, 128]
    - [208, 42.939]
  - - [4224, 2561, 1, 128]
    - [230, 44.953]
  - - [15744, 8065, 1, 128]
    - [15, 45.33]
  - - [21632, 128, 1, 128]
    - [284, 28.123]
  - - [15104, 4096, 1, 128]
    - [225, 55.822]
  - - [20352, 512, 1, 128]
    - [226, 43.151]
  - - [25472, 9601, 1, 128]
    - [17, 45.504]
  - - [27904, 512, 1, 128]
    - [227, 45.575]
  - - [19968, 512, 1, 128]
    - [227, 43.505]
  - - [5760, 1024, 1, 128]
    - [230, 38.883]
  - - [28416, 12545, 1, 128]
    - [15, 45.589]
  - - [16512, 8833, 1, 128]
    - [17, 44.373]
  - - [6016, 128, 1, 128]
    - [63, 24.399]
  - - [13056, 4096, 1, 128]
    - [357, 55.215]
  - - [19968, 12289, 1, 128]
    - [17, 45.801]
  - - [7424, 3713, 1, 128]
    - [236, 48.671]
  - - [28800, 128, 1, 128]
    - [193, 30.38]
  - - [512, 512, 1, 128]
    - [69, 10.955]
  - - [24832, 2048, 1, 128]
    - [357, 53.162]
  - - [20736, 128, 1, 128]
    - [284, 28.276]
  - - [26368, 512, 1, 128]
    - [204, 45.956]
  - - [26496, 8192, 1, 128]
    - [20, 45.86]
  - - [13824, 4096, 1, 128]
    - [357, 54.35]
  - - [27264, 128, 1, 128]
    - [354, 30.027]
  - - [21760, 1024, 1, 128]
    - [355, 47.729]
  - - [2432, 1921, 1, 128]
    - [354, 36.475]
  - - [27136, 8192, 1, 128]
    - [14, 47.092]
  - - [6784, 2048, 1, 128]
    - [236, 45.319]
  - - [11264, 128, 1, 128]
    - [104, 28.769]
  - - [7552, 512, 1, 128]
    - [227, 33.662]
  - - [19328, 11649, 1, 128]
    - [17, 45.711]
  - - [17152, 2048, 1, 128]
    - [357, 53.212]
  - - [23808, 16129, 1, 128]
    - [17, 46.207]
  - - [20224, 12417, 1, 128]
    - [12, 45.968]
  - - [27904, 1024, 1, 128]
    - [293, 48.848]
  - - [3456, 512, 1, 128]
    - [195, 23.086]
  - - [13312, 512, 1, 128]
    - [227, 40.039]
  - - [26368, 4096, 1, 128]
    - [15, 45.563]
  - - [23296, 15617, 1, 128]
    - [17, 46.156]
  - - [26112, 10241, 1, 128]
    - [14, 45.807]
  - - [26240, 512, 1, 128]
    - [229, 44.828]
  - - [4352, 1024, 1, 128]
    - [226, 35.452]
  - - [10624, 2048, 1, 128]
    - [227, 50.014]
  - - [23808, 16001, 1, 128]
    - [15, 46.117]
  - - [17536, 9857, 1, 128]
    - [15, 45.598]
  - - [23936, 4096, 1, 128]
    - [17, 45.442]
  - - [1408, 128, 1, 128]
    - [67, 7.933]
  - - [14848, 512, 1, 128]
    - [226, 41.071]
  - - [8704, 4993, 1, 128]
    - [225, 53.749]
  - - [15104, 2048, 1, 128]
    - [357, 51.309]
  - - [2560, 512, 1, 128]
    - [63, 30.724]
  - - [27264, 8192, 1, 128]
    - [17, 46.344]
  - - [23808, 4096, 1, 128]
    - [26, 45.544]
  - - [14080, 6273, 1, 128]
    - [24, 43.219]
  - - [10112, 6529, 1, 128]
    - [235, 53.992]
  - - [27648, 512, 1, 128]
    - [357, 45.529]
  - - [20992, 128, 1, 128]
    - [195, 27.974]
  - - [15104, 128, 1, 128]
    - [354, 23.632]
  - - [7808, 128, 1, 128]
    - [62, 25.729]
  - - [3584, 1024, 1, 128]
    - [231, 34.519]
  - - [15232, 512, 1, 128]
    - [357, 40.624]
  - - [21376, 13697, 1, 128]
    - [17, 45.838]
  - - [11392, 7809, 1, 128]
    - [38, 44.52]
  - - [11904, 1024, 1, 128]
    - [357, 45.301]
  - - [28800, 2048, 1, 128]
    - [235, 52.811]
  - - [8960, 512, 1, 128]
    - [200, 34.586]
  - - [19456, 11649, 1, 128]
    - [17, 46.451]
  - - [11904, 128, 1, 128]
    - [68, 31.381]
  - - [18560, 512, 1, 128]
    - [226, 43.635]
  - - [6656, 128, 1, 128]
    - [64, 26.414]
  - - [17792, 2048, 1, 128]
    - [236, 52.506]
  - - [21632, 4096, 1, 128]
    - [15, 45.217]
  - - [25728, 4096, 1, 128]
    - [24, 45.444]
  - - [18048, 10241, 1, 128]
    - [19, 44.043]
  - - [1792, 1281, 1, 128]
    - [230, 27.052]
  - - [512, 385, 1, 128]
    - [69, 8.547]
  - - [26112, 512, 1, 128]
    - [227, 45.537]
  - - [16128, 1024, 1, 128]
    - [357, 47.485]
  - - [4480, 1024, 1, 128]
    - [356, 35.885]
  - - [14720, 4096, 1, 128]
    - [236, 54.349]
  - - [23552, 2048, 1, 128]
    - [225, 54.612]
  - - [22528, 512, 1, 128]
    - [225, 44.519]
  - - [22912, 128, 1, 128]
    - [284, 29.984]
  - - [25344, 1024, 1, 128]
    - [358, 47.791]
  - - [24064, 16257, 1, 128]
    - [36, 46.571]
  - - [9088, 5377, 1, 128]
    - [357, 53.106]
  - - [27776, 128, 1, 128]
    - [328, 30.529]
  - - [15616, 512, 1, 128]
    - [229, 41.809]
  - - [13568, 128, 1, 128]
    - [64, 32.943]
  - - [15488, 7681, 1, 128]
    - [15, 44.725]
  - - [20096, 512, 1, 128]
    - [229, 43.407]
  - - [24832, 4096, 1, 128]
    - [17, 45.784]
  - - [28800, 4096, 1, 128]
    - [23, 45.168]
  - - [11904, 4225, 1, 128]
    - [236, 51.9]
  - - [3968, 1024, 1, 128]
    - [227, 33.737]
  - - [6400, 2817, 1, 128]
    - [237, 46.794]
  - - [24576, 4096, 1, 128]
    - [17, 42.846]
  - - [9088, 128, 1, 128]
    - [68, 29.292]
  - - [17152, 4096, 1, 128]
    - [357, 55.441]
  - - [22528, 14721, 1, 128]
    - [15, 46.947]
  - - [27392, 2048, 1, 128]
    - [357, 54.187]
  - - [8832, 512, 1, 128]
    - [354, 35.938]
  - - [8960, 5249, 1, 128]
    - [355, 53.972]
  - - [3200, 1024, 1, 128]
    - [234, 32.081]
  - - [4736, 3073, 1, 128]
    - [355, 47.595]
  - - [28032, 2048, 1, 128]
    - [235, 54.453]
  - - [14592, 2048, 1, 128]
    - [236, 50.398]
  - - [13440, 1024, 1, 128]
    - [357, 45.492]
  - - [14464, 2048, 1, 128]
    - [326, 51.099]
  - - [6912, 2048, 1, 128]
    - [356, 46.963]
  - - [19584, 2048, 1, 128]
    - [225, 52.995]
  - - [17920, 128, 1, 128]
    - [208, 27.449]
  - - [19584, 11777, 1, 128]
    - [15, 45.594]
  - - [23936, 16129, 1, 128]
    - [17, 46.1]
  - - [10496, 6785, 1, 128]
    - [236, 54.676]
  - - [27648, 2048, 1, 128]
    - [235, 54.641]
  - - [23808, 128, 1, 128]
    - [13, 32.621]
  - - [20864, 2048, 1, 128]
    - [355, 52.346]
  - - [9088, 512, 1, 128]
    - [328, 35.775]
  - - [3584, 512, 1, 128]
    - [354, 24.309]
  - - [8576, 4993, 1, 128]
    - [235, 52.708]
  - - [3328, 1024, 1, 128]
    - [230, 32.873]
  - - [20608, 2048, 1, 128]
    - [225, 52.689]
  - - [23552, 15745, 1, 128]
    - [15, 46.73]
  - - [23424, 15617, 1, 128]
    - [33, 43.609]
  - - [21120, 512, 1, 128]
    - [208, 42.934]
  - - [6656, 512, 1, 128]
    - [200, 31.387]
  - - [12544, 128, 1, 128]
    - [68, 31.709]
  - - [24448, 8577, 1, 128]
    - [15, 45.437]
  - - [9984, 512, 1, 128]
    - [328, 35.863]
  - - [18304, 4096, 1, 128]
    - [225, 56.337]
  - - [17920, 512, 1, 128]
    - [229, 42.602]
  - - [12160, 4096, 1, 128]
    - [236, 54.042]
  - - [3968, 2433, 1, 128]
    - [237, 44.633]
  - - [27008, 4096, 1, 128]
    - [42, 45.118]
  - - [22272, 1024, 1, 128]
    - [225, 49.5]
  - - [14336, 512, 1, 128]
    - [226, 40.961]
  - - [18560, 10753, 1, 128]
    - [15, 45.476]
  - - [6272, 2048, 1, 128]
    - [357, 47.381]
  - - [12800, 1024, 1, 128]
    - [357, 46.273]
  - - [9600, 5889, 1, 128]
    - [326, 53.627]
  - - [13056, 128, 1, 128]
    - [64, 32.667]
  - - [7296, 2048, 1, 128]
    - [226, 45.13]
  - - [21376, 512, 1, 128]
    - [236, 44.412]
  - - [11904, 512, 1, 128]
    - [227, 37.938]
  - - [6400, 1024, 1, 128]
    - [326, 39.795]
  - - [27008, 1024, 1, 128]
    - [225, 50.493]
  - - [22400, 14721, 1, 128]
    - [12, 45.543]
  - - [6272, 1024, 1, 128]
    - [355, 38.681]
  - - [17408, 128, 1, 128]
    - [328, 26.506]
  - - [26624, 10625, 1, 128]
    - [17, 46.721]
  - - [22400, 1024, 1, 128]
    - [225, 48.647]
  - - [18304, 10625, 1, 128]
    - [15, 45.509]
  - - [15872, 1024, 1, 128]
    - [236, 46.737]
  - - [21120, 128, 1, 128]
    - [328, 27.855]
  - - [22784, 4096, 1, 128]
    - [20, 45.163]
  - - [25728, 9857, 1, 128]
    - [17, 45.466]
  - - [16256, 1024, 1, 128]
    - [236, 46.468]
  - - [18560, 4096, 1, 128]
    - [357, 55.401]
  - - [7936, 4225, 1, 128]
    - [237, 50.567]
  - - [7680, 3969, 1, 128]
    - [234, 51.002]
  - - [9472, 2048, 1, 128]
    - [357, 50.417]
  - - [28160, 128, 1, 128]
    - [202, 30.452]
  - - [18816, 512, 1, 128]
    - [229, 43.924]
  - - [9856, 512, 1, 128]
    - [226, 37.565]
  - - [17664, 9857, 1, 128]
    - [26, 45.257]
  - - [27392, 128, 1, 128]
    - [95, 29.082]
  - - [24448, 2048, 1, 128]
    - [355, 53.885]
  - - [7808, 512, 1, 128]
    - [226, 34.279]
  - - [13952, 512, 1, 128]
    - [226, 40.502]
  - - [24576, 512, 1, 128]
    - [15, 39.435]
  - - [27520, 128, 1, 128]
    - [229, 30.163]
  - - [26496, 512, 1, 128]
    - [227, 45.707]
  - - [8576, 512, 1, 128]
    - [357, 34.358]
  - - [11648, 512, 1, 128]
    - [229, 38.332]
  - - [17408, 2048, 1, 128]
    - [235, 53.089]
  - - [17920, 10241, 1, 128]
    - [14, 45.751]
  - - [16384, 1024, 1, 128]
    - [238, 40.303]
  - - [6016, 2048, 1, 128]
    - [281, 44.904]
  - - [9728, 512, 1, 128]
    - [229, 37.319]
  - - [19712, 128, 1, 128]
    - [208, 27.867]
  - - [26112, 1024, 1, 128]
    - [357, 49.07]
  - - [16768, 128, 1, 128]
    - [354, 26.095]
  - - [8960, 1024, 1, 128]
    - [232, 42.348]
  - - [6784, 128, 1, 128]
    - [62, 26.778]
  - - [12800, 4993, 1, 128]
    - [225, 53.518]
  - - [6144, 2561, 1, 128]
    - [356, 46.693]
  - - [26880, 10881, 1, 128]
    - [26, 45.591]
  - - [12928, 1024, 1, 128]
    - [236, 45.611]
  - - [7040, 3457, 1, 128]
    - [236, 49.225]
  - - [15744, 4096, 1, 128]
    - [236, 55.578]
  - - [20096, 4096, 1, 128]
    - [23, 44.898]
  - - [21760, 128, 1, 128]
    - [354, 28.794]
  - - [7936, 2048, 1, 128]
    - [237, 46.346]
  - - [24448, 8192, 1, 128]
    - [17, 46.582]
  - - [21120, 2048, 1, 128]
    - [357, 52.781]
  - - [12160, 1024, 1, 128]
    - [357, 45.569]
  - - [7168, 3457, 1, 128]
    - [236, 48.544]
  - - [15232, 7553, 1, 128]
    - [26, 44.833]
  - - [26624, 1024, 1, 128]
    - [235, 49.844]
  - - [25344, 2048, 1, 128]
    - [357, 53.205]
  - - [12544, 4865, 1, 128]
    - [355, 52.992]
  - - [21120, 4096, 1, 128]
    - [40, 44.469]
  - - [20224, 128, 1, 128]
    - [234, 27.244]
  - - [14592, 4096, 1, 128]
    - [236, 54.595]
  - - [16256, 8577, 1, 128]
    - [17, 45.045]
  - - [24192, 4096, 1, 128]
    - [17, 45.486]
  - - [21248, 1024, 1, 128]
    - [326, 48.848]
  - - [25216, 1024, 1, 128]
    - [357, 48.29]
  - - [5888, 2177, 1, 128]
    - [230, 45.71]
  - - [21504, 1024, 1, 128]
    - [225, 48.179]
  - - [17536, 1024, 1, 128]
    - [357, 48.694]
  - - [9728, 2048, 1, 128]
    - [326, 49.6]
  - - [13952, 6273, 1, 128]
    - [17, 44.621]
  - - [28800, 512, 1, 128]
    - [227, 44.263]
  - - [2304, 1793, 1, 128]
    - [354, 34.085]
  - - [12416, 128, 1, 128]
    - [64, 31.601]
  - - [20224, 1024, 1, 128]
    - [355, 48.17]
  - - [22144, 128, 1, 128]
    - [327, 28.741]
  - - [22784, 1024, 1, 128]
    - [235, 49.832]
  - - [27136, 4096, 1, 128]
    - [24, 46.044]
  - - [27264, 512, 1, 128]
    - [226, 44.503]
  - - [26240, 10241, 1, 128]
    - [15, 41.87]
  - - [27904, 4096, 1, 128]
    - [42, 45.283]
  - - [21504, 128, 1, 128]
    - [234, 29.247]
  - - [3712, 2177, 1, 128]
    - [230, 42.492]
  - - [18432, 1024, 1, 128]
    - [234, 48.132]
  - - [28672, 4096, 1, 128]
    - [17, 46.523]
  - - [25344, 4096, 1, 128]
    - [40, 45.027]
  - - [26880, 512, 1, 128]
    - [229, 46.558]
  - - [21888, 2048, 1, 128]
    - [355, 52.801]
  - - [1792, 128, 1, 128]
    - [67, 10.02]
  - - [6016, 1024, 1, 128]
    - [357, 38.356]
  - - [15104, 7425, 1, 128]
    - [17, 45.481]
  - - [22016, 2048, 1, 128]
    - [235, 53.377]
  - - [13952, 4096, 1, 128]
    - [357, 54.675]
  - - [20992, 4096, 1, 128]
    - [24, 45.563]
  - - [8064, 4481, 1, 128]
    - [231, 52.133]
  - - [12672, 4096, 1, 128]
    - [223, 53.125]
  - - [20096, 12289, 1, 128]
    - [15, 45.138]
  - - [14848, 2048, 1, 128]
    - [355, 50.311]
  - - [23168, 512, 1, 128]
    - [213, 42.669]
  - - [7680, 128, 1, 128]
    - [62, 25.42]
  - - [13312, 1024, 1, 128]
    - [284, 45.292]
  - - [10624, 1024, 1, 128]
    - [355, 44.997]
  - - [3840, 512, 1, 128]
    - [192, 25.259]
  - - [22144, 14337, 1, 128]
    - [15, 45.549]
  - - [3200, 128, 1, 128]
    - [105, 16.517]
  - - [25472, 9473, 1, 128]
    - [15, 45.643]
  - - [16768, 9089, 1, 128]
    - [15, 45.453]
  - - [12288, 2048, 1, 128]
    - [328, 48.378]
  - - [20608, 512, 1, 128]
    - [236, 41.57]
  - - [2816, 1024, 1, 128]
    - [226, 30.563]
  - - [7552, 1024, 1, 128]
    - [355, 40.716]
  - - [5120, 3457, 1, 128]
    - [237, 47.908]
  - - [25216, 2048, 1, 128]
    - [236, 53.796]
  - - [12672, 4865, 1, 128]
    - [236, 52.332]
  - - [10880, 2048, 1, 128]
    - [236, 50.236]
  - - [18176, 512, 1, 128]
    - [284, 42.69]
  - - [8320, 4609, 1, 128]
    - [355, 52.236]
  - - [16000, 4096, 1, 128]
    - [355, 55.979]
  - - [22144, 2048, 1, 128]
    - [13, 43.669]
  - - [22784, 512, 1, 128]
    - [208, 45.034]
  - - [4096, 2561, 1, 128]
    - [230, 45.275]
  - - [24576, 2048, 1, 128]
    - [246, 48.56]
  - - [26624, 4096, 1, 128]
    - [15, 46.684]
  - - [18560, 2048, 1, 128]
    - [326, 53.16]
  - - [19584, 128, 1, 128]
    - [226, 28.129]
  - - [23936, 2048, 1, 128]
    - [235, 53.21]
  - - [23552, 512, 1, 128]
    - [227, 45.422]
  - - [12032, 4096, 1, 128]
    - [235, 54.747]
  - - [3840, 2305, 1, 128]
    - [226, 41.743]
  - - [25088, 128, 1, 128]
    - [226, 31.662]
  - - [16640, 8833, 1, 128]
    - [17, 46.213]
  - - [896, 128, 1, 128]
    - [67, 5.167]
  - - [17280, 2048, 1, 128]
    - [357, 52.894]
  - - [16896, 2048, 1, 128]
    - [236, 51.206]
  - - [22656, 128, 1, 128]
    - [229, 29.812]
  - - [25728, 8192, 1, 128]
    - [17, 46.455]
  - - [16128, 128, 1, 128]
    - [192, 24.278]
  - - [3840, 1024, 1, 128]
    - [226, 34.074]
  - - [2944, 512, 1, 128]
    - [62, 31.266]
  - - [24064, 1024, 1, 128]
    - [326, 49.251]
  - - [896, 385, 1, 128]
    - [106, 13.814]
  - - [8064, 128, 1, 128]
    - [68, 26.572]
  - - [12416, 1024, 1, 128]
    - [284, 44.511]
  - - [20608, 128, 1, 128]
    - [234, 27.909]
  - - [2944, 1024, 1, 128]
    - [354, 30.916]
  - - [6656, 2048, 1, 128]
    - [230, 45.691]
  - - [24064, 128, 1, 128]
    - [364, 30.327]
  - - [15744, 7937, 1, 128]
    - [15, 45.436]
  - - [2688, 1024, 1, 128]
    - [328, 28.994]
  - - [24192, 8193, 1, 128]
    - [17, 44.945]
  - - [24320, 4096, 1, 128]
    - [15, 45.703]
  - - [24576, 8705, 1, 128]
    - [12, 42.522]
  - - [13824, 1024, 1, 128]
    - [234, 45.228]
  - - [27776, 512, 1, 128]
    - [208, 44.826]
  - - [10240, 128, 1, 128]
    - [63, 30.977]
  - - [26240, 10369, 1, 128]
    - [15, 41.875]
  - - [16512, 4096, 1, 128]
    - [236, 56.358]
  - - [9856, 6145, 1, 128]
    - [357, 54.241]
  - - [27392, 1024, 1, 128]
    - [357, 47.931]
  - - [14976, 1024, 1, 128]
    - [356, 45.815]
  - - [1280, 512, 1, 128]
    - [67, 22.362]
  - - [6528, 2817, 1, 128]
    - [223, 49.356]
  - - [12288, 512, 1, 128]
    - [306, 38.025]
  - - [5248, 512, 1, 128]
    - [227, 28.916]
  - - [28544, 4096, 1, 128]
    - [23, 45.444]
  - - [21248, 13569, 1, 128]
    - [19, 45.898]
  - - [26112, 2048, 1, 128]
    - [357, 52.907]
  - - [14208, 6401, 1, 128]
    - [17, 44.543]
  - - [13952, 128, 1, 128]
    - [68, 33.545]
  - - [2304, 1665, 1, 128]
    - [229, 32.587]
  - - [6912, 1024, 1, 128]
    - [355, 40.889]
  - - [28672, 1024, 1, 128]
    - [293, 48.238]
  - - [14592, 6913, 1, 128]
    - [20, 43.881]
  - - [24704, 1024, 1, 128]
    - [326, 47.638]
  - - [22400, 512, 1, 128]
    - [306, 44.307]
  - - [23424, 4096, 1, 128]
    - [24, 43.442]
  - - [24832, 128, 1, 128]
    - [28, 33.52]
  - - [23680, 2048, 1, 128]
    - [357, 53.387]
  - - [25984, 9985, 1, 128]
    - [19, 45.49]
  - - [15360, 512, 1, 128]
    - [229, 41.341]
  - - [21376, 2048, 1, 128]
    - [225, 53.446]
  - - [16128, 2048, 1, 128]
    - [357, 51.304]
  - - [15872, 512, 1, 128]
    - [227, 40.882]
  - - [3072, 128, 1, 128]
    - [70, 16.313]
  - - [27520, 4096, 1, 128]
    - [17, 45.446]
  - - [25216, 4096, 1, 128]
    - [24, 45.281]
  - - [28672, 12673, 1, 128]
    - [15, 46.81]
  - - [28288, 512, 1, 128]
    - [208, 45.464]
  - - [22400, 4096, 1, 128]
    - [26, 45.103]
  - - [25344, 9345, 1, 128]
    - [14, 45.119]
  - - [9984, 128, 1, 128]
    - [68, 30.964]
  - - [28416, 1024, 1, 128]
    - [357, 49.699]
  - - [27008, 8192, 1, 128]
    - [36, 46.31]
  - - [13184, 1024, 1, 128]
    - [226, 44.786]
  - - [10240, 512, 1, 128]
    - [227, 37.482]
  - - [3456, 128, 1, 128]
    - [67, 17.354]
  - - [16000, 8321, 1, 128]
    - [17, 45.088]
  - - [27520, 1024, 1, 128]
    - [357, 48.903]
  - - [25088, 1024, 1, 128]
    - [355, 49.867]
  - - [6784, 512, 1, 128]
    - [354, 31.994]
  - - [18432, 10625, 1, 128]
    - [15, 46.727]
  - - [16128, 4096, 1, 128]
    - [355, 55.283]
  - - [26880, 11009, 1, 128]
    - [17, 45.732]
  - - [28800, 12801, 1, 128]
    - [17, 45.526]
  - - [12288, 4096, 1, 128]
    - [284, 54.183]
  - - [20096, 12417, 1, 128]
    - [17, 45.622]
  - - [1920, 128, 1, 128]
    - [70, 10.498]
  - - [13056, 2048, 1, 128]
    - [357, 51.34]
  - - [384, 385, 1, 128]
    - [107, 6.362]
  - - [9088, 1024, 1, 128]
    - [227, 42.512]
  - - [6784, 1024, 1, 128]
    - [357, 40.415]
  - - [21760, 4096, 1, 128]
    - [23, 45.548]
  - - [27008, 11009, 1, 128]
    - [36, 45.472]
  - - [14208, 1024, 1, 128]
    - [231, 45.848]
  - - [25600, 512, 1, 128]
    - [248, 44.801]
  - - [23680, 1024, 1, 128]
    - [357, 48.327]
  - - [28160, 8192, 1, 128]
    - [19, 46.763]
  - - [22016, 4096, 1, 128]
    - [19, 45.788]
  - - [18688, 4096, 1, 128]
    - [225, 55.26]
  - - [10752, 1024, 1, 128]
    - [236, 43.744]
  - - [2432, 128, 1, 128]
    - [108, 13.103]
  - - [7296, 512, 1, 128]
    - [328, 33.34]
  - - [19200, 4096, 1, 128]
    - [17, 45.06]
  - - [4608, 2945, 1, 128]
    - [231, 47.64]
  - - [18816, 11009, 1, 128]
    - [17, 45.335]
  - - [9600, 1024, 1, 128]
    - [235, 43.317]
  - - [7168, 512, 1, 128]
    - [229, 32.653]
  - - [11904, 4097, 1, 128]
    - [355, 52.74]
  - - [17920, 1024, 1, 128]
    - [236, 47.25]
  - - [11520, 7809, 1, 128]
    - [24, 44.699]
  - - [22784, 14977, 1, 128]
    - [14, 46.074]
  - - [13696, 1024, 1, 128]
    - [356, 45.641]
  - - [15104, 1024, 1, 128]
    - [355, 46.537]
  - - [25216, 512, 1, 128]
    - [229, 45.41]
  - - [5376, 512, 1, 128]
    - [281, 29.375]
  - - [17408, 4096, 1, 128]
    - [225, 56.231]
  - - [25728, 512, 1, 128]
    - [229, 45.225]
  - - [896, 512, 1, 128]
    - [72, 16.743]
  - - [6912, 3329, 1, 128]
    - [236, 48.663]
  - - [22016, 512, 1, 128]
    - [204, 42.321]
  - - [22144, 4096, 1, 128]
    - [23, 45.107]
  - - [10368, 128, 1, 128]
    - [62, 31.493]
  - - [23296, 2048, 1, 128]
    - [236, 53.89]
  - - [17920, 10113, 1, 128]
    - [42, 46.032]
  - - [14848, 4096, 1, 128]
    - [355, 54.645]
  - - [26112, 128, 1, 128]
    - [13, 34.81]
  - - [28032, 8192, 1, 128]
    - [15, 46.536]
  - - [20096, 128, 1, 128]
    - [248, 27.145]
  - - [15360, 4096, 1, 128]
    - [235, 56.263]
  - - [3328, 128, 1, 128]
    - [72, 17.059]
  - - [25472, 512, 1, 128]
    - [306, 44.43]
  - - [18304, 128, 1, 128]
    - [354, 27.086]
  - - [20352, 12545, 1, 128]
    - [17, 45.911]
  - - [26624, 10753, 1, 128]
    - [15, 46.719]
  - - [20480, 2048, 1, 128]
    - [237, 51.568]
  - - [26496, 10497, 1, 128]
    - [14, 45.036]
  - - [22400, 128, 1, 128]
    - [361, 29.198]
  - - [9216, 5505, 1, 128]
    - [236, 53.504]
  - - [24064, 8193, 1, 128]
    - [19, 45.758]
  - - [4224, 128, 1, 128]
    - [72, 18.782]
  - - [6656, 3073, 1, 128]
    - [223, 48.384]
  - - [10880, 1024, 1, 128]
    - [226, 45.131]
  - - [23808, 512, 1, 128]
    - [226, 45.296]
  - - [15488, 1024, 1, 128]
    - [355, 46.626]
  - - [24704, 8705, 1, 128]
    - [15, 44.615]
  - - [12416, 4609, 1, 128]
    - [355, 52.201]
  - - [3712, 1024, 1, 128]
    - [229, 33.035]
  - - [25856, 8192, 1, 128]
    - [26, 46.514]
  - - [8320, 1024, 1, 128]
    - [356, 40.83]
  - - [16256, 512, 1, 128]
    - [236, 41.358]
  - - [18944, 2048, 1, 128]
    - [236, 53.042]
  - - [23168, 4096, 1, 128]
    - [17, 45.243]
  - - [15616, 2048, 1, 128]
    - [357, 51.848]
  - - [24320, 512, 1, 128]
    - [234, 44.588]
  - - [2688, 1025, 1, 128]
    - [293, 29.009]
  - - [12800, 5121, 1, 128]
    - [355, 53.797]
  - - [5120, 128, 1, 128]
    - [195, 11.845]
  - - [4352, 512, 1, 128]
    - [192, 26.87]
  - - [24576, 8192, 1, 128]
    - [26, 43.71]
  - - [8320, 512, 1, 128]
    - [200, 33.816]
  - - [12160, 4481, 1, 128]
    - [236, 53.398]
  - - [2560, 1025, 1, 128]
    - [227, 28.015]
  - - [19072, 1024, 1, 128]
    - [355, 46.547]
  - - [2816, 1153, 1, 128]
    - [231, 31.034]
  - - [6912, 128, 1, 128]
    - [68, 27.43]
  - - [9088, 2048, 1, 128]
    - [237, 47.731]
  - - [26368, 8192, 1, 128]
    - [15, 46.613]
  - - [17408, 9729, 1, 128]
    - [15, 46.24]
  - - [18816, 4096, 1, 128]
    - [355, 55.01]
  - - [4480, 512, 1, 128]
    - [328, 27.78]
  - - [11648, 128, 1, 128]
    - [62, 30.816]
  - - [1536, 897, 1, 128]
    - [64, 27.683]
  - - [11136, 1024, 1, 128]
    - [357, 44.282]
  - - [8704, 1024, 1, 128]
    - [225, 41.854]
  - - [19072, 2048, 1, 128]
    - [357, 52.84]
  - - [25856, 1024, 1, 128]
    - [357, 48.448]
  - - [7552, 3841, 1, 128]
    - [326, 50.515]
  - - [23296, 128, 1, 128]
    - [256, 29.729]
  - - [23424, 512, 1, 128]
    - [233, 44.63]
  - - [26368, 10497, 1, 128]
    - [17, 45.865]
  - - [18560, 1024, 1, 128]
    - [225, 47.589]
  - - [8192, 128, 1, 128]
    - [63, 26.405]
  - - [27776, 11905, 1, 128]
    - [15, 45.554]
  - - [18688, 1024, 1, 128]
    - [355, 46.431]
  - - [21248, 4096, 1, 128]
    - [24, 45.353]
  - - [16256, 8449, 1, 128]
    - [17, 44.905]
  - - [1920, 1409, 1, 128]
    - [280, 28.228]
  - - [24704, 4096, 1, 128]
    - [41, 44.774]
  - - [13824, 6145, 1, 128]
    - [17, 44.647]
  - - [6528, 512, 1, 128]
    - [354, 33.838]
  - - [21376, 128, 1, 128]
    - [326, 28.422]
  - - [11264, 1024, 1, 128]
    - [357, 44.622]
  - - [4352, 2817, 1, 128]
    - [356, 47.509]
  - - [22272, 4096, 1, 128]
    - [12, 45.315]
  - - [27264, 11265, 1, 128]
    - [15, 45.335]
  - - [28160, 1024, 1, 128]
    - [284, 49.274]
  - - [16256, 128, 1, 128]
    - [354, 26.309]
  - - [18688, 2048, 1, 128]
    - [355, 52.991]
  - - [9600, 6017, 1, 128]
    - [357, 53.267]
  - - [23552, 1024, 1, 128]
    - [235, 49.065]
  - - [8576, 128, 1, 128]
    - [68, 27.764]
  - - [20992, 13185, 1, 128]
    - [17, 46.298]
  - - [20992, 1024, 1, 128]
    - [232, 48.326]
  - - [14720, 512, 1, 128]
    - [226, 41.511]
  - - [28032, 1024, 1, 128]
    - [235, 49.774]
  - - [20352, 2048, 1, 128]
    - [236, 52.962]
  - - [15360, 128, 1, 128]
    - [354, 24.801]
  - - [8448, 2048, 1, 128]
    - [284, 47.344]
  - - [6272, 2689, 1, 128]
    - [220, 47.108]
  - - [7808, 4097, 1, 128]
    - [357, 50.181]
  - - [25472, 128, 1, 128]
    - [13, 33.95]
  - - [12288, 4481, 1, 128]
    - [353, 52.441]
  - - [28416, 4096, 1, 128]
    - [23, 45.681]
  - - [2176, 128, 1, 128]
    - [70, 11.724]
  - - [21760, 2048, 1, 128]
    - [236, 53.745]
  - - [21376, 1024, 1, 128]
    - [231, 47.866]
  - - [13696, 2048, 1, 128]
    - [357, 50.463]
  - - [28288, 12417, 1, 128]
    - [15, 45.754]
  - - [5632, 512, 1, 128]
    - [354, 30.008]
  - - [22016, 1024, 1, 128]
    - [293, 47.25]
  - - [25216, 128, 1, 128]
    - [229, 31.42]
  - - [25216, 8192, 1, 128]
    - [12, 46.249]
  - - [12032, 128, 1, 128]
    - [64, 30.73]
  - - [6144, 2048, 1, 128]
    - [227, 46.555]
  - - [23680, 128, 1, 128]
    - [17, 32.26]
  - - [15744, 128, 1, 128]
    - [206, 24.377]
  - - [3968, 512, 1, 128]
    - [279, 25.162]
  - - [16512, 1024, 1, 128]
    - [236, 48.192]
  - - [1536, 128, 1, 128]
    - [69, 8.857]
  - - [25984, 4096, 1, 128]
    - [19, 45.164]
  - - [19456, 512, 1, 128]
    - [284, 42.791]
  - - [9984, 1024, 1, 128]
    - [227, 43.044]
  - - [14080, 6401, 1, 128]
    - [40, 43.172]
  - - [20736, 2048, 1, 128]
    - [225, 53.415]
  - - [4224, 2689, 1, 128]
    - [237, 44.317]
  - - [13696, 512, 1, 128]
    - [236, 38.896]
  - - [17280, 1024, 1, 128]
    - [225, 47.822]
  - - [10752, 128, 1, 128]
    - [68, 29.285]
  - - [1536, 512, 1, 128]
    - [62, 24.918]
  - - [25728, 2048, 1, 128]
    - [236, 53.712]
  - - [9472, 128, 1, 128]
    - [64, 29.878]
  - - [7168, 3585, 1, 128]
    - [236, 49.222]
  - - [14720, 1024, 1, 128]
    - [234, 45.869]
  - - [25728, 128, 1, 128]
    - [25, 34.113]
  - - [14976, 128, 1, 128]
    - [226, 24.222]
  - - [24832, 1024, 1, 128]
    - [236, 48.957]
  - - [14080, 512, 1, 128]
    - [226, 39.541]
  - - [17152, 1024, 1, 128]
    - [226, 46.193]
  - - [19072, 512, 1, 128]
    - [233, 42.426]
  - - [21120, 1024, 1, 128]
    - [284, 47.241]
  - - [4864, 128, 1, 128]
    - [67, 20.996]
  - - [7936, 512, 1, 128]
    - [226, 32.781]
  - - [21248, 13441, 1, 128]
    - [17, 45.979]
  - - [12160, 2048, 1, 128]
    - [326, 49.17]
  - - [19712, 11905, 1, 128]
    - [42, 44.366]
  - - [23296, 1024, 1, 128]
    - [236, 47.694]
  - - [24832, 8961, 1, 128]
    - [19, 45.757]
  - - [13568, 2048, 1, 128]
    - [357, 50.568]
  - - [13696, 4096, 1, 128]
    - [236, 55.096]
  - - [5888, 128, 1, 128]
    - [62, 24.145]
  - - [10112, 2048, 1, 128]
    - [235, 48.96]
  - - [21632, 13953, 1, 128]
    - [12, 45.908]
  - - [19328, 512, 1, 128]
    - [226, 43.911]
  - - [6272, 512, 1, 128]
    - [328, 32.383]
  - - [4864, 3201, 1, 128]
    - [231, 49.001]
  - - [15232, 4096, 1, 128]
    - [225, 54.861]
  - - [23040, 4096, 1, 128]
    - [24, 45.59]
  - - [2816, 1281, 1, 128]
    - [353, 33.382]
  - - [8960, 128, 1, 128]
    - [64, 28.755]
  - - [9472, 1024, 1, 128]
    - [225, 43.108]
  - - [27648, 11777, 1, 128]
    - [15, 46.371]
  - - [28416, 2048, 1, 128]
    - [225, 54.572]
  - - [13952, 6145, 1, 128]
    - [23, 44.191]
  - - [13952, 1024, 1, 128]
    - [231, 45.357]
  - - [12544, 2048, 1, 128]
    - [236, 50.529]
  - - [10624, 7041, 1, 128]
    - [357, 53.985]
  - - [24704, 2048, 1, 128]
    - [236, 53.136]
  - - [17280, 9473, 1, 128]
    - [26, 45.407]
  - - [25088, 9217, 1, 128]
    - [14, 45.765]
  - - [10240, 6657, 1, 128]
    - [236, 54.669]
  - - [12800, 4096, 1, 128]
    - [236, 53.771]
  - - [17792, 1024, 1, 128]
    - [355, 46.176]
  - - [12160, 128, 1, 128]
    - [64, 31.828]
  - - [16512, 128, 1, 128]
    - [354, 25.658]
  - - [25856, 512, 1, 128]
    - [225, 45.543]
  - - [8576, 4865, 1, 128]
    - [357, 53.16]
  - - [25984, 1024, 1, 128]
    - [225, 48.89]
  - - [512, 128, 1, 128]
    - [106, 2.93]
  - - [10112, 128, 1, 128]
    - [64, 31.099]
  - - [28288, 2048, 1, 128]
    - [235, 54.449]
  - - [1152, 641, 1, 128]
    - [63, 23.269]
  - - [17920, 4096, 1, 128]
    - [357, 54.473]
  - - [2560, 1921, 1, 128]
    - [328, 37.225]
  - - [24704, 8833, 1, 128]
    - [17, 44.724]
  - - [3200, 512, 1, 128]
    - [62, 32.245]
  - - [6656, 2945, 1, 128]
    - [225, 47.751]
  - - [12672, 4993, 1, 128]
    - [355, 52.9]
  - - [4608, 1024, 1, 128]
    - [230, 37.546]
  - - [25856, 9985, 1, 128]
    - [12, 45.586]
  - - [23808, 2048, 1, 128]
    - [357, 53.552]
  - - [9728, 6145, 1, 128]
    - [235, 54.041]
  - - [28416, 12417, 1, 128]
    - [17, 45.628]
  - - [14464, 4096, 1, 128]
    - [225, 54.336]
  - - [21888, 128, 1, 128]
    - [306, 28.4]
  - - [23680, 15873, 1, 128]
    - [36, 45.366]
  - - [22144, 1024, 1, 128]
    - [326, 49.046]
  - - [17664, 512, 1, 256]
    - [226, 64.19]
  - - [25600, 1024, 1, 256]
    - [276, 75.317]
  - - [28928, 512, 1, 256]
    - [225, 72.493]
  - - [15104, 512, 1, 256]
    - [358, 61.706]
  - - [38912, 1024, 1, 256]
    - [13, 70.324]
  - - [34304, 8192, 1, 256]
    - [30, 74.829]
  - - [23552, 1024, 1, 256]
    - [225, 74.314]
  - - [39424, 23552, 1, 256]
    - [29, 75.106]
  - - [9472, 1024, 1, 256]
    - [360, 66.576]
  - - [28928, 13056, 1, 256]
    - [19, 74.869]
  - - [42496, 1024, 1, 256]
    - [22, 70.355]
  - - [18432, 1024, 1, 256]
    - [235, 74.874]
  - - [40192, 24320, 1, 256]
    - [17, 74.909]
  - - [33280, 17152, 1, 256]
    - [14, 75.787]
  - - [27904, 512, 1, 256]
    - [326, 70.61]
  - - [39680, 8192, 1, 256]
    - [15, 74.356]
  - - [28160, 8192, 1, 256]
    - [17, 74.637]
  - - [25088, 8192, 1, 256]
    - [14, 74.701]
  - - [23040, 15360, 1, 256]
    - [15, 75.671]
  - - [19712, 11776, 1, 256]
    - [29, 74.182]
  - - [43520, 27648, 1, 256]
    - [29, 74.947]
  - - [44544, 4096, 1, 256]
    - [29, 73.451]
  - - [20224, 4096, 1, 256]
    - [17, 72.535]
  - - [31744, 4096, 1, 256]
    - [18, 73.158]
  - - [33024, 16896, 1, 256]
    - [30, 75.252]
  - - [32768, 8192, 1, 256]
    - [56, 58.919]
  - - [42752, 4096, 1, 256]
    - [17, 72.964]
  - - [19968, 512, 1, 256]
    - [204, 63.814]
  - - [10496, 512, 1, 256]
    - [227, 57.527]
  - - [36864, 4096, 1, 256]
    - [38, 72.634]
  - - [12288, 1024, 1, 256]
    - [232, 66.771]
  - - [22784, 14848, 1, 256]
    - [18, 75.154]
  - - [17152, 9472, 1, 256]
    - [20, 74.859]
  - - [31488, 1024, 1, 256]
    - [235, 78.031]
  - - [25344, 1024, 1, 256]
    - [245, 75.675]
  - - [33536, 512, 1, 256]
    - [245, 70.579]
  - - [28672, 8192, 1, 256]
    - [17, 74.718]
  - - [15104, 7168, 1, 256]
    - [17, 73.585]
  - - [38144, 22272, 1, 256]
    - [26, 74.833]
  - - [25344, 4096, 1, 256]
    - [31, 72.024]
  - - [6400, 2560, 1, 256]
    - [296, 72.622]
  - - [21248, 13568, 1, 256]
    - [15, 75.179]
  - - [2304, 1536, 1, 256]
    - [355, 51.168]
  - - [20992, 512, 1, 256]
    - [226, 65.944]
  - - [3072, 1024, 1, 256]
    - [293, 50.612]
  - - [36864, 20736, 1, 256]
    - [15, 75.147]
  - - [39936, 24064, 1, 256]
    - [15, 75.501]
  - - [2816, 512, 1, 256]
    - [282, 35.059]
  - - [37888, 512, 1, 256]
    - [203, 71.591]
  - - [39680, 1024, 1, 256]
    - [15, 69.234]
  - - [35584, 19712, 1, 256]
    - [12, 74.82]
  - - [25600, 9728, 1, 256]
    - [15, 75.44]
  - - [2816, 1024, 1, 256]
    - [226, 46.506]
  - - [13056, 1024, 1, 256]
    - [361, 71.566]
  - - [39680, 4096, 1, 256]
    - [15, 72.728]
  - - [4864, 3072, 1, 256]
    - [230, 72.427]
  - - [27648, 11776, 1, 256]
    - [17, 75.73]
  - - [13056, 4096, 1, 256]
    - [15, 72.06]
  - - [4096, 2304, 1, 256]
    - [244, 65.813]
  - - [34048, 1024, 1, 256]
    - [235, 81.141]
  - - [6400, 512, 1, 256]
    - [28, 51.306]
  - - [15872, 4096, 1, 256]
    - [15, 72.281]
  - - [29440, 1024, 1, 256]
    - [235, 80.3]
  - - [7424, 512, 1, 256]
    - [227, 50.348]
  - - [19200, 4096, 1, 256]
    - [15, 72.099]
  - - [37376, 21504, 1, 256]
    - [29, 75.215]
  - - [37888, 1024, 1, 256]
    - [235, 81.195]
  - - [40704, 24832, 1, 256]
    - [17, 74.84]
  - - [26112, 1024, 1, 256]
    - [225, 76.34]
  - - [25088, 8960, 1, 256]
    - [40, 75.437]
  - - [27136, 512, 1, 256]
    - [225, 69.218]
  - - [4608, 512, 1, 256]
    - [206, 44.165]
  - - [31232, 8192, 1, 256]
    - [29, 74.803]
  - - [33024, 512, 1, 256]
    - [227, 69.154]
  - - [27648, 512, 1, 256]
    - [240, 68.877]
  - - [28928, 4096, 1, 256]
    - [17, 72.464]
  - - [44544, 2048, 1, 256]
    - [29, 72.039]
  - - [43776, 27648, 1, 256]
    - [29, 74.437]
  - - [19456, 4096, 1, 256]
    - [15, 72.834]
  - - [33536, 17664, 1, 256]
    - [14, 75.192]
  - - [35328, 4096, 1, 256]
    - [31, 73.657]
  - - [13312, 5376, 1, 256]
    - [23, 74.004]
  - - [32768, 1024, 1, 256]
    - [238, 60.483]
  - - [39168, 4096, 1, 256]
    - [29, 73.18]
  - - [15616, 7936, 1, 256]
    - [15, 74.429]
  - - [41472, 25600, 1, 256]
    - [26, 74.75]
  - - [14592, 4096, 1, 256]
    - [20, 70.479]
  - - [37632, 21760, 1, 256]
    - [15, 74.813]
  - - [37376, 21248, 1, 256]
    - [15, 75.33]
  - - [14336, 6656, 1, 256]
    - [17, 74.692]
  - - [36608, 20480, 1, 256]
    - [29, 74.602]
  - - [32256, 16384, 1, 256]
    - [31, 75.223]
  - - [44544, 28416, 1, 256]
    - [26, 75.158]
  - - [26112, 512, 1, 256]
    - [293, 71.374]
  - - [41216, 25344, 1, 256]
    - [17, 74.919]
  - - [16640, 512, 1, 256]
    - [227, 61.406]
  - - [30464, 14336, 1, 256]
    - [29, 73.987]
  - - [13312, 4096, 1, 256]
    - [17, 72.101]
  - - [22528, 1024, 1, 256]
    - [235, 76.98]
  - - [5632, 1024, 1, 256]
    - [227, 58.191]
  - - [27392, 1024, 1, 256]
    - [235, 74.117]
  - - [27648, 8192, 1, 256]
    - [15, 75.078]
  - - [26368, 1024, 1, 256]
    - [326, 77.839]
  - - [43776, 4096, 1, 256]
    - [18, 73.189]
  - - [23552, 15872, 1, 256]
    - [15, 76.241]
  - - [26624, 10496, 1, 256]
    - [17, 75.778]
  - - [27392, 8192, 1, 256]
    - [18, 74.062]
  - - [17408, 9728, 1, 256]
    - [15, 75.456]
  - - [16896, 9216, 1, 256]
    - [17, 74.885]
  - - [26880, 11008, 1, 256]
    - [17, 74.818]
  - - [31488, 512, 1, 256]
    - [250, 69.717]
  - - [14336, 6400, 1, 256]
    - [24, 74.846]
  - - [17152, 512, 1, 256]
    - [226, 63.984]
  - - [7168, 512, 1, 256]
    - [226, 50.22]
  - - [41984, 26112, 1, 256]
    - [12, 75.545]
  - - [11776, 512, 1, 256]
    - [227, 58.434]
  - - [16128, 8448, 1, 256]
    - [23, 74.56]
  - - [11520, 1024, 1, 256]
    - [357, 66.093]
  - - [27904, 1024, 1, 256]
    - [235, 76.772]
  - - [37888, 8192, 1, 256]
    - [17, 74.991]
  - - [20480, 12544, 1, 256]
    - [12, 75.828]
  - - [23552, 15616, 1, 256]
    - [17, 76.268]
  - - [21504, 13824, 1, 256]
    - [17, 76.158]
  - - [27136, 11008, 1, 256]
    - [14, 75.587]
  - - [32000, 512, 1, 256]
    - [245, 69.662]
  - - [26624, 1024, 1, 256]
    - [235, 76.934]
  - - [34816, 8192, 1, 256]
    - [15, 75.041]
  - - [23040, 512, 1, 256]
    - [227, 67.275]
  - - [36608, 1024, 1, 256]
    - [235, 81.349]
  - - [43264, 8192, 1, 256]
    - [17, 74.358]
  - - [30208, 14336, 1, 256]
    - [30, 75.063]
  - - [43520, 512, 1, 256]
    - [225, 72.271]
  - - [32256, 4096, 1, 256]
    - [31, 73.355]
  - - [33792, 17664, 1, 256]
    - [17, 75.868]
  - - [10752, 6912, 1, 256]
    - [17, 74.308]
  - - [29696, 8192, 1, 256]
    - [17, 74.986]
  - - [41472, 512, 1, 256]
    - [235, 75.122]
  - - [44544, 8192, 1, 256]
    - [17, 74.517]
  - - [41472, 8192, 1, 256]
    - [31, 74.446]
  - - [38656, 4096, 1, 256]
    - [29, 73.31]
  - - [44800, 512, 1, 256]
    - [293, 74.267]
  - - [37376, 4096, 1, 256]
    - [29, 73.81]
  - - [19200, 1024, 1, 256]
    - [225, 74.01]
  - - [39680, 23552, 1, 256]
    - [15, 74.227]
  - - [30976, 8192, 1, 256]
    - [29, 73.668]
  - - [25856, 1024, 1, 256]
    - [232, 76.076]
  - - [22016, 14336, 1, 256]
    - [15, 75.309]
  - - [17152, 9216, 1, 256]
    - [15, 74.262]
  - - [18432, 10752, 1, 256]
    - [15, 75.858]
  - - [5376, 1024, 1, 256]
    - [357, 55.394]
  - - [21760, 13824, 1, 256]
    - [17, 75.487]
  - - [15360, 512, 1, 256]
    - [358, 61.52]
  - - [2560, 512, 1, 256]
    - [283, 33.004]
  - - [36096, 8192, 1, 256]
    - [18, 73.872]
  - - [42752, 26624, 1, 256]
    - [17, 74.446]
  - - [35584, 19456, 1, 256]
    - [29, 74.674]
  - - [6144, 2304, 1, 256]
    - [223, 69.505]
  - - [42240, 1024, 1, 256]
    - [32, 69.828]
  - - [26880, 4096, 1, 256]
    - [15, 72.673]
  - - [28160, 12032, 1, 256]
    - [17, 75.503]
  - - [18688, 10752, 1, 256]
    - [17, 75.22]
  - - [43520, 8192, 1, 256]
    - [17, 74.662]
  - - [8192, 4352, 1, 256]
    - [240, 77.625]
  - - [6912, 3072, 1, 256]
    - [232, 78.097]
  - - [31744, 15616, 1, 256]
    - [15, 75.832]
  - - [36352, 20224, 1, 256]
    - [29, 75.358]
  - - [41216, 25088, 1, 256]
    - [12, 74.747]
  - - [37632, 1024, 1, 256]
    - [326, 79.689]
  - - [18944, 512, 1, 256]
    - [326, 66.947]
  - - [15616, 1024, 1, 256]
    - [242, 70.905]
  - - [44288, 512, 1, 256]
    - [244, 74.282]
  - - [24832, 8704, 1, 256]
    - [19, 74.982]
  - - [21504, 13568, 1, 256]
    - [15, 76.086]
  - - [18176, 10496, 1, 256]
    - [17, 75.104]
  - - [21248, 1024, 1, 256]
    - [249, 75.451]
  - - [16384, 1024, 1, 256]
    - [238, 63.94]
  - - [25600, 8192, 1, 256]
    - [15, 75.08]
  - - [28672, 12544, 1, 256]
    - [12, 75.492]
  - - [16128, 1024, 1, 256]
    - [284, 71.533]
  - - [22272, 14592, 1, 256]
    - [14, 75.412]
  - - [1280, 512, 1, 256]
    - [63, 30.85]
  - - [36864, 20992, 1, 256]
    - [15, 75.008]
  - - [3584, 1792, 1, 256]
    - [229, 61.511]
  - - [35072, 19200, 1, 256]
    - [15, 74.991]
  - - [32000, 4096, 1, 256]
    - [38, 72.71]
  - - [28416, 1024, 1, 256]
    - [235, 77.456]
  - - [20480, 12800, 1, 256]
    - [15, 75.76]
  - - [21760, 4096, 1, 256]
    - [59, 72.584]
  - - [44288, 8192, 1, 256]
    - [29, 74.353]
  - - [33280, 4096, 1, 256]
    - [18, 73.587]
  - - [32512, 1024, 1, 256]
    - [326, 77.366]
  - - [38400, 22528, 1, 256]
    - [18, 75.187]
  - - [40448, 1024, 1, 256]
    - [13, 70.029]
  - - [5120, 512, 1, 256]
    - [225, 43.639]
  - - [29952, 8192, 1, 256]
    - [19, 74.456]
  - - [40448, 24576, 1, 256]
    - [31, 74.509]
  - - [29696, 4096, 1, 256]
    - [15, 73.234]
  - - [21504, 1024, 1, 256]
    - [235, 73.97]
  - - [19968, 1024, 1, 256]
    - [235, 73.04]
  - - [16896, 512, 1, 256]
    - [204, 63.87]
  - - [33536, 17408, 1, 256]
    - [18, 74.787]
  - - [19712, 512, 1, 256]
    - [284, 62.611]
  - - [16384, 8704, 1, 256]
    - [26, 63.818]
  - - [29952, 13824, 1, 256]
    - [19, 75.112]
  - - [14592, 6656, 1, 256]
    - [40, 72.415]
  - - [36864, 1024, 1, 256]
    - [242, 78.36]
  - - [31744, 15872, 1, 256]
    - [17, 75.897]
  - - [24832, 8960, 1, 256]
    - [20, 75.119]
  - - [23808, 1024, 1, 256]
    - [225, 74.659]
  - - [19200, 11264, 1, 256]
    - [18, 74.727]
  - - [23296, 15360, 1, 256]
    - [17, 75.187]
  - - [34304, 18432, 1, 256]
    - [30, 75.048]
  - - [22016, 1024, 1, 256]
    - [326, 74.404]
  - - [40704, 4096, 1, 256]
    - [18, 73.066]
  - - [25600, 4096, 1, 256]
    - [18, 73.152]
  - - [3328, 1024, 1, 256]
    - [236, 50.927]
  - - [30464, 8192, 1, 256]
    - [29, 73.421]
  - - [39424, 8192, 1, 256]
    - [15, 74.587]
  - - [23808, 15872, 1, 256]
    - [15, 75.524]
  - - [8960, 1024, 1, 256]
    - [204, 64.081]
  - - [44032, 4096, 1, 256]
    - [15, 73.194]
  - - [35584, 8192, 1, 256]
    - [30, 74.268]
  - - [29184, 8192, 1, 256]
    - [19, 74.597]
  - - [13824, 1024, 1, 256]
    - [232, 70.822]
  - - [36608, 8192, 1, 256]
    - [15, 74.225]
  - - [30976, 512, 1, 256]
    - [359, 70.181]
  - - [33024, 4096, 1, 256]
    - [30, 73.199]
  - - [11776, 7936, 1, 256]
    - [17, 74.374]
  - - [23808, 16128, 1, 256]
    - [17, 75.37]
  - - [22272, 14336, 1, 256]
    - [29, 74.944]
  - - [27392, 11520, 1, 256]
    - [30, 74.289]
  - - [30464, 4096, 1, 256]
    - [29, 71.791]
  - - [20992, 13312, 1, 256]
    - [18, 75.507]
  - - [44800, 1024, 1, 256]
    - [17, 69.404]
  - - [32512, 4096, 1, 256]
    - [57, 72.937]
  - - [23296, 15616, 1, 256]
    - [17, 75.408]
  - - [9216, 1024, 1, 256]
    - [225, 67.319]
  - - [20224, 12544, 1, 256]
    - [15, 75.301]
  - - [32256, 1024, 1, 256]
    - [225, 77.752]
  - - [38400, 512, 1, 256]
    - [360, 69.875]
  - - [29952, 1024, 1, 256]
    - [235, 77.929]
  - - [36352, 512, 1, 256]
    - [234, 71.381]
  - - [41728, 25600, 1, 256]
    - [29, 73.877]
  - - [32000, 1024, 1, 256]
    - [225, 78.645]
  - - [38144, 22016, 1, 256]
    - [12, 74.81]
  - - [27136, 11264, 1, 256]
    - [14, 75.389]
  - - [34048, 18176, 1, 256]
    - [43, 74.655]
  - - [22016, 14080, 1, 256]
    - [40, 76.113]
  - - [19712, 12032, 1, 256]
    - [29, 74.357]
  - - [23552, 4096, 1, 256]
    - [29, 72.963]
  - - [15872, 1024, 1, 256]
    - [261, 71.921]
  - - [37120, 512, 1, 256]
    - [242, 70.893]
  - - [9984, 1024, 1, 256]
    - [204, 64.724]
  - - [32512, 8192, 1, 256]
    - [14, 74.44]
  - - [15360, 4096, 1, 256]
    - [17, 72.39]
  - - [13056, 512, 1, 256]
    - [362, 61.842]
  - - [44032, 8192, 1, 256]
    - [15, 74.818]
  - - [24576, 8192, 1, 256]
    - [38, 70.1]
  - - [36352, 8192, 1, 256]
    - [18, 74.844]
  - - [26368, 8192, 1, 256]
    - [15, 74.449]
  - - [20480, 1024, 1, 256]
    - [293, 74.04]
  - - [35072, 8192, 1, 256]
    - [15, 74.34]
  - - [32000, 15872, 1, 256]
    - [17, 75.055]
  - - [40704, 24576, 1, 256]
    - [18, 74.2]
  - - [15104, 7424, 1, 256]
    - [17, 74.433]
  - - [25856, 4096, 1, 256]
    - [18, 72.553]
  - - [14848, 512, 1, 256]
    - [229, 62.463]
  - - [39424, 4096, 1, 256]
    - [43, 73.507]
  - - [24832, 512, 1, 256]
    - [229, 67.623]
  - - [44288, 28416, 1, 256]
    - [12, 74.674]
  - - [12544, 4608, 1, 256]
    - [24, 72.008]
  - - [12800, 4864, 1, 256]
    - [40, 73.386]
  - - [29440, 512, 1, 256]
    - [284, 70.338]
  - - [40192, 24064, 1, 256]
    - [15, 74.898]
  - - [18176, 4096, 1, 256]
    - [17, 72.486]
  - - [40960, 8192, 1, 256]
    - [38, 67.262]
  - - [42240, 512, 1, 256]
    - [225, 75.361]
  - - [9728, 512, 1, 256]
    - [225, 57.808]
  - - [14848, 7168, 1, 256]
    - [15, 73.661]
  - - [44800, 28672, 1, 256]
    - [38, 74.049]
  - - [15616, 7680, 1, 256]
    - [17, 74.594]
  - - [33280, 17408, 1, 256]
    - [30, 75.374]
  - - [42752, 1024, 1, 256]
    - [25, 69.863]
  - - [35328, 8192, 1, 256]
    - [14, 74.689]
  - - [36352, 1024, 1, 256]
    - [235, 81.063]
  - - [35840, 1024, 1, 256]
    - [235, 80.244]
  - - [41472, 4096, 1, 256]
    - [18, 73.656]
  - - [3584, 1024, 1, 256]
    - [231, 52.432]
  - - [22528, 14592, 1, 256]
    - [15, 76.245]
  - - [44032, 512, 1, 256]
    - [296, 74.061]
  - - [30720, 1024, 1, 256]
    - [235, 78.893]
  - - [39680, 512, 1, 256]
    - [225, 71.628]
  - - [22272, 1024, 1, 256]
    - [276, 74.062]
  - - [42240, 26368, 1, 256]
    - [17, 74.63]
  - - [10240, 6400, 1, 256]
    - [23, 74.368]
  - - [30976, 14848, 1, 256]
    - [18, 74.145]
  - - [41728, 25856, 1, 256]
    - [29, 74.256]
  - - [28928, 12800, 1, 256]
    - [14, 74.82]
  - - [21760, 14080, 1, 256]
    - [15, 75.486]
  - - [5888, 1024, 1, 256]
    - [357, 60.454]
  - - [24576, 8704, 1, 256]
    - [26, 70.872]
  - - [38912, 4096, 1, 256]
    - [15, 73.118]
  - - [15360, 1024, 1, 256]
    - [236, 70.958]
  - - [18688, 512, 1, 256]
    - [234, 65.318]
  - - [27392, 512, 1, 256]
    - [273, 66.116]
  - - [22784, 512, 1, 256]
    - [284, 69.533]
  - - [40448, 4096, 1, 256]
    - [41, 73.641]
  - - [19200, 512, 1, 256]
    - [251, 66.393]
  - - [26368, 10496, 1, 256]
    - [17, 74.947]
  - - [25088, 9216, 1, 256]
    - [30, 74.874]
  - - [33536, 1024, 1, 256]
    - [235, 79.345]
  - - [25600, 9472, 1, 256]
    - [17, 75.887]
  - - [13824, 4096, 1, 256]
    - [17, 71.984]
  - - [5632, 3840, 1, 256]
    - [235, 75.584]
  - - [9216, 5376, 1, 256]
    - [24, 72.915]
  - - [8960, 5120, 1, 256]
    - [20, 71.62]
  - - [19456, 512, 1, 256]
    - [360, 67.758]
  - - [24576, 4096, 1, 256]
    - [21, 68.369]
  - - [27392, 11264, 1, 256]
    - [29, 74.537]
  - - [35072, 4096, 1, 256]
    - [29, 72.993]
  - - [44288, 4096, 1, 256]
    - [29, 73.28]
  - - [40448, 8192, 1, 256]
    - [19, 74.465]
  - - [33280, 512, 1, 256]
    - [203, 70.6]
  - - [22272, 4096, 1, 256]
    - [29, 72.461]
  - - [35584, 512, 1, 256]
    - [225, 69.945]
  - - [10752, 512, 1, 256]
    - [229, 57.924]
  - - [19968, 4096, 1, 256]
    - [41, 72.937]
  - - [34304, 1024, 1, 256]
    - [235, 79.467]
  - - [41216, 8192, 1, 256]
    - [29, 74.477]
  - - [35840, 19712, 1, 256]
    - [17, 75.823]
  - - [43520, 27392, 1, 256]
    - [26, 75.44]
  - - [30720, 14848, 1, 256]
    - [17, 75.633]
  - - [38400, 22272, 1, 256]
    - [26, 75.441]
  - - [1536, 1024, 1, 256]
    - [283, 36.389]
  - - [40192, 1024, 1, 256]
    - [41, 69.757]
  - - [44800, 256, 1, 256]
    - [227, 64.53]
  - - [1536, 512, 1, 256]
    - [62, 35.992]
  - - [34560, 18432, 1, 256]
    - [15, 74.758]
  - - [1792, 1024, 1, 256]
    - [281, 39.728]
  - - [5376, 3584, 1, 256]
    - [284, 73.951]
  - - [30208, 1024, 1, 256]
    - [235, 76.992]
  - - [31232, 512, 1, 256]
    - [248, 70.96]
  - - [23040, 4096, 1, 256]
    - [57, 73.309]
  - - [35840, 4096, 1, 256]
    - [17, 73.139]
  - - [38144, 512, 1, 256]
    - [235, 71.773]
  - - [31744, 512, 1, 256]
    - [240, 70.665]
  - - [14592, 6912, 1, 256]
    - [45, 73.121]
  - - [19456, 11520, 1, 256]
    - [17, 76.138]
  - - [7168, 1024, 1, 256]
    - [235, 61.009]
  - - [18944, 11264, 1, 256]
    - [30, 75.342]
  - - [19712, 1024, 1, 256]
    - [357, 71.985]
  - - [26112, 9984, 1, 256]
    - [15, 75.563]
  - - [38656, 22784, 1, 256]
    - [14, 74.655]
  - - [24320, 8192, 1, 256]
    - [14, 74.704]
  - - [4864, 1024, 1, 256]
    - [244, 56.013]
  - - [20480, 4096, 1, 256]
    - [15, 72.506]
  - - [10240, 1024, 1, 256]
    - [235, 65.3]
  - - [31232, 15360, 1, 256]
    - [14, 75.415]
  - - [24320, 4096, 1, 256]
    - [14, 72.813]
  - - [33792, 1024, 1, 256]
    - [235, 79.06]
  - - [12032, 1024, 1, 256]
    - [235, 68.736]
  - - [39168, 512, 1, 256]
    - [234, 72.75]
  - - [16896, 4096, 1, 256]
    - [17, 72.514]
  - - [36096, 1024, 1, 256]
    - [235, 77.927]
  - - [28416, 12544, 1, 256]
    - [19, 74.959]
  - - [30720, 4096, 1, 256]
    - [15, 73.127]
  - - [19712, 4096, 1, 256]
    - [29, 71.466]
  - - [37120, 21248, 1, 256]
    - [15, 74.681]
  - - [16384, 4096, 1, 256]
    - [17, 61.887]
  - - [18688, 11008, 1, 256]
    - [17, 75.091]
  - - [38400, 8192, 1, 256]
    - [15, 74.678]
  - - [11264, 7424, 1, 256]
    - [17, 74.924]
  - - [23296, 512, 1, 256]
    - [229, 66.977]
  - - [25344, 512, 1, 256]
    - [284, 70.579]
  - - [44544, 256, 1, 256]
    - [360, 65.676]
  - - [43264, 4096, 1, 256]
    - [38, 72.828]
  - - [32512, 16640, 1, 256]
    - [19, 75.357]
  - - [39936, 8192, 1, 256]
    - [17, 74.974]
  - - [43264, 512, 1, 256]
    - [234, 73.773]
  - - [16640, 8704, 1, 256]
    - [15, 74.811]
  - - [26624, 8192, 1, 256]
    - [15, 75.099]
  - - [35328, 19456, 1, 256]
    - [30, 75.247]
  - - [42752, 26880, 1, 256]
    - [15, 74.838]
  - - [25344, 9216, 1, 256]
    - [31, 73.445]
  - - [34048, 8192, 1, 256]
    - [31, 73.799]
  - - [18688, 4096, 1, 256]
    - [17, 72.394]
  - - [37632, 8192, 1, 256]
    - [38, 74.221]
  - - [19968, 12032, 1, 256]
    - [17, 75.67]
  - - [8448, 4608, 1, 256]
    - [235, 81.788]
  - - [2048, 1536, 1, 256]
    - [229, 48.655]
  - - [31488, 15616, 1, 256]
    - [15, 74.939]
  - - [35328, 512, 1, 256]
    - [245, 71.218]
  - - [37376, 8192, 1, 256]
    - [29, 74.732]
  - - [33792, 8192, 1, 256]
    - [15, 74.959]
  - - [36608, 4096, 1, 256]
    - [29, 72.898]
  - - [28416, 8192, 1, 256]
    - [14, 74.104]
  - - [5632, 512, 1, 256]
    - [226, 46.222]
  - - [13568, 4096, 1, 256]
    - [17, 71.849]
  - - [17664, 9728, 1, 256]
    - [20, 74.224]
  - - [13568, 1024, 1, 256]
    - [225, 69.657]
  - - [8448, 512, 1, 256]
    - [227, 52.262]
  - - [22528, 4096, 1, 256]
    - [17, 72.967]
  - - [33536, 8192, 1, 256]
    - [14, 74.444]
  - - [23296, 1024, 1, 256]
    - [235, 74.139]
  - - [43520, 4096, 1, 256]
    - [29, 73.78]
  - - [39936, 23808, 1, 256]
    - [15, 75.482]
  - - [12544, 4096, 1, 256]
    - [23, 71.348]
  - - [22016, 4096, 1, 256]
    - [49, 73.077]
  - - [14592, 512, 1, 256]
    - [234, 60.746]
  - - [39936, 4096, 1, 256]
    - [17, 73.242]
  - - [18176, 1024, 1, 256]
    - [225, 72.46]
  - - [44800, 2048, 1, 256]
    - [31, 70.237]
  - - [14848, 4096, 1, 256]
    - [17, 72.5]
  - - [20224, 12288, 1, 256]
    - [29, 74.421]
  - - [16896, 8960, 1, 256]
    - [15, 75.55]
  - - [43264, 27392, 1, 256]
    - [15, 74.802]
  - - [24064, 16128, 1, 256]
    - [14, 75.907]
  - - [1024, 512, 1, 256]
    - [63, 24.986]
  - - [24576, 8448, 1, 256]
    - [12, 70.765]
  - - [25344, 9472, 1, 256]
    - [18, 74.117]
  - - [3328, 1536, 1, 256]
    - [229, 55.032]
  - - [31488, 4096, 1, 256]
    - [17, 72.728]
  - - [43008, 8192, 1, 256]
    - [15, 74.904]
  - - [28672, 12800, 1, 256]
    - [15, 75.357]
  - - [20736, 13056, 1, 256]
    - [17, 75.359]
  - - [17664, 9984, 1, 256]
    - [20, 74.504]
  - - [17920, 1024, 1, 256]
    - [235, 71.163]
  - - [11008, 1024, 1, 256]
    - [236, 66.317]
  - - [44800, 4096, 1, 256]
    - [21, 72.511]
  - - [29952, 14080, 1, 256]
    - [14, 75.218]
  - - [39168, 23296, 1, 256]
    - [29, 74.594]
  - - [9472, 512, 1, 256]
    - [227, 56.468]
  - - [27904, 8192, 1, 256]
    - [18, 74.273]
  - - [5120, 1024, 1, 256]
    - [227, 55.472]
  - - [15872, 7936, 1, 256]
    - [15, 75.157]
  - - [13568, 5632, 1, 256]
    - [23, 73.703]
  - - [17920, 9984, 1, 256]
    - [15, 75.469]
  - - [16640, 8960, 1, 256]
    - [19, 74.67]
  - - [41984, 4096, 1, 256]
    - [17, 73.1]
  - - [6912, 512, 1, 256]
    - [229, 48.297]
  - - [28416, 4096, 1, 256]
    - [21, 72.453]
  - - [27648, 11520, 1, 256]
    - [17, 75.978]
  - - [7680, 3840, 1, 256]
    - [357, 79.051]
  - - [34048, 4096, 1, 256]
    - [30, 72.436]
  - - [11264, 512, 1, 256]
    - [213, 57.829]
  - - [26368, 4096, 1, 256]
    - [15, 72.565]
  - - [21248, 13312, 1, 256]
    - [17, 75.106]
  - - [15104, 1024, 1, 256]
    - [225, 71.008]
  - - [35072, 18944, 1, 256]
    - [17, 74.936]
  - - [6144, 1024, 1, 256]
    - [234, 60.175]
  - - [44800, 8192, 1, 256]
    - [15, 74.033]
  - - [25088, 512, 1, 256]
    - [284, 70.787]
  - - [27904, 12032, 1, 256]
    - [31, 74.855]
  - - [27648, 1024, 1, 256]
    - [225, 77.008]
  - - [28928, 8192, 1, 256]
    - [14, 74.128]
  - - [29440, 13312, 1, 256]
    - [19, 75.126]
  - - [43264, 27136, 1, 256]
    - [26, 74.753]
  - - [23552, 512, 1, 256]
    - [227, 67.252]
  - - [26880, 10752, 1, 256]
    - [17, 75.05]
  - - [44032, 28160, 1, 256]
    - [15, 75.553]
  - - [36096, 512, 1, 256]
    - [248, 69.982]
  - - [4352, 2560, 1, 256]
    - [223, 69.01]
  - - [38912, 8192, 1, 256]
    - [15, 74.954]
  - - [12032, 4096, 1, 256]
    - [15, 71.167]
  - - [37632, 512, 1, 256]
    - [362, 70.677]
  - - [30208, 512, 1, 256]
    - [225, 69.714]
  - - [2304, 512, 1, 256]
    - [63, 41.352]
  - - [24320, 8448, 1, 256]
    - [20, 74.743]
  - - [39424, 512, 1, 256]
    - [243, 71.008]
  - - [37632, 21504, 1, 256]
    - [26, 74.577]
  - - [17152, 1024, 1, 256]
    - [242, 72.043]
  - - [22784, 15104, 1, 256]
    - [19, 75.335]
  - - [27904, 11776, 1, 256]
    - [30, 74.855]
  - - [43008, 26880, 1, 256]
    - [26, 75.604]
  - - [41728, 4096, 1, 256]
    - [29, 72.671]
  - - [25344, 8192, 1, 256]
    - [29, 73.596]
  - - [44800, 28928, 1, 256]
    - [15, 74.343]
  - - [38912, 22784, 1, 256]
    - [26, 75.639]
  - - [44032, 1024, 1, 256]
    - [32, 70.885]
  - - [30976, 4096, 1, 256]
    - [18, 71.622]
  - - [15872, 8192, 1, 256]
    - [15, 75.001]
  - - [40960, 4096, 1, 256]
    - [21, 66.076]
  - - [35584, 1024, 1, 256]
    - [235, 81.001]
  - - [18944, 4096, 1, 256]
    - [50, 72.836]
  - - [36096, 20224, 1, 256]
    - [18, 74.266]
  - - [11008, 7168, 1, 256]
    - [47, 71.456]
  - - [7936, 1024, 1, 256]
    - [230, 62.6]
  - - [44288, 1024, 1, 256]
    - [27, 69.726]
  - - [38656, 8192, 1, 256]
    - [29, 74.287]
  - - [38144, 1024, 1, 256]
    - [235, 80.817]
  - - [41984, 1024, 1, 256]
    - [25, 70.499]
  - - [20736, 512, 1, 256]
    - [225, 65.991]
  - - [32768, 16640, 1, 256]
    - [56, 59.277]
  - - [40960, 1024, 1, 256]
    - [15, 64.607]
  - - [25856, 9984, 1, 256]
    - [15, 74.885]
  - - [29696, 13824, 1, 256]
    - [17, 75.882]
  - - [37120, 4096, 1, 256]
    - [29, 73.15]
  - - [37120, 20992, 1, 256]
    - [15, 74.854]
  - - [35072, 512, 1, 256]
    - [249, 70.433]
  - - [38656, 1024, 1, 256]
    - [25, 69.426]
  - - [37376, 512, 1, 256]
    - [242, 72.652]
  - - [32000, 16128, 1, 256]
    - [17, 74.91]
  - - [41984, 25856, 1, 256]
    - [26, 75.626]
  - - [23040, 15104, 1, 256]
    - [19, 76.021]
  - - [31232, 15104, 1, 256]
    - [19, 75.761]
  - - [25088, 4096, 1, 256]
    - [41, 73.174]
  - - [15360, 7424, 1, 256]
    - [15, 75.274]
  - - [16384, 8448, 1, 256]
    - [12, 63.356]
  - - [26624, 4096, 1, 256]
    - [17, 73.175]
  - - [14080, 6400, 1, 256]
    - [47, 73.029]
  - - [16128, 4096, 1, 256]
    - [17, 72.085]
  - - [43776, 27904, 1, 256]
    - [29, 74.364]
  - - [15872, 512, 1, 256]
    - [227, 61.811]
  - - [43776, 8192, 1, 256]
    - [29, 74.087]
  - - [10496, 6656, 1, 256]
    - [24, 73.241]
  - - [13312, 512, 1, 256]
    - [204, 60.02]
  - - [29184, 512, 1, 256]
    - [256, 69.77]
  - - [15360, 7680, 1, 256]
    - [15, 75.288]
  - - [40192, 8192, 1, 256]
    - [15, 74.473]
  - - [34560, 8192, 1, 256]
    - [17, 74.307]
  - - [25856, 8192, 1, 256]
    - [15, 74.455]
  - - [32512, 16384, 1, 256]
    - [30, 75.174]
  - - [12288, 4352, 1, 256]
    - [15, 73.324]
  - - [29440, 13568, 1, 256]
    - [19, 75.133]
  - - [28160, 1024, 1, 256]
    - [326, 76.933]
  - - [32768, 4096, 1, 256]
    - [44, 58.306]
  - - [24832, 4096, 1, 256]
    - [29, 72.684]
  - - [39680, 23808, 1, 256]
    - [15, 74.405]
  - - [22784, 4096, 1, 256]
    - [41, 72.548]
  - - [7936, 4096, 1, 256]
    - [235, 79.37]
  - - [8704, 4864, 1, 256]
    - [23, 72.098]
  - - [29696, 512, 1, 256]
    - [234, 69.432]
  - - [39424, 23296, 1, 256]
    - [12, 75.413]
  - - [17408, 9472, 1, 256]
    - [15, 75.849]
  - - [33792, 4096, 1, 256]
    - [38, 72.911]
  - - [17920, 512, 1, 256]
    - [227, 64.532]
  - - [25856, 512, 1, 256]
    - [284, 71.005]
  - - [44288, 28160, 1, 256]
    - [12, 74.632]
  - - [40192, 4096, 1, 256]
    - [49, 73.012]
  - - [21248, 512, 1, 256]
    - [241, 65.875]
  - - [3072, 512, 1, 256]
    - [110, 44.68]
  - - [29184, 13312, 1, 256]
    - [15, 75.113]
  - - [44544, 1024, 1, 256]
    - [13, 70.345]
  - - [37888, 21760, 1, 256]
    - [17, 75.792]
  - - [33792, 17920, 1, 256]
    - [17, 75.738]
  - - [6912, 1024, 1, 256]
    - [231, 60.989]
  - - [41216, 512, 1, 256]
    - [234, 73.667]
  - - [42240, 26112, 1, 256]
    - [17, 74.753]
  - - [30720, 8192, 1, 256]
    - [15, 75.059]
  - - [11776, 1024, 1, 256]
    - [235, 68.264]
  - - [43008, 4096, 1, 256]
    - [26, 73.053]
  - - [34560, 18688, 1, 256]
    - [17, 74.923]
  - - [41984, 512, 1, 256]
    - [326, 75.617]
  - - [41728, 512, 1, 256]
    - [296, 75.142]
  - - [2560, 1792, 1, 256]
    - [328, 56.281]
  - - [36864, 8192, 1, 256]
    - [17, 74.544]
  - - [40704, 8192, 1, 256]
    - [17, 74.341]
  - - [30720, 14592, 1, 256]
    - [15, 75.998]
  - - [32256, 512, 1, 256]
    - [261, 69.713]
  - - [40192, 512, 1, 256]
    - [362, 72.759]
  - - [8960, 512, 1, 256]
    - [354, 53.98]
  - - [16640, 4096, 1, 256]
    - [35, 71.565]
  - - [30976, 15104, 1, 256]
    - [29, 74.383]
  - - [27136, 8192, 1, 256]
    - [19, 74.986]
  - - [30208, 8192, 1, 256]
    - [14, 74.616]
  - - [21504, 512, 1, 256]
    - [225, 67.646]
  - - [9728, 5888, 1, 256]
    - [23, 73.206]
  - - [38912, 23040, 1, 256]
    - [26, 75.609]
  - - [7424, 1024, 1, 256]
    - [284, 62.46]
  - - [38656, 22528, 1, 256]
    - [18, 74.572]
  - - [26880, 512, 1, 256]
    - [226, 69.26]
  - - [29184, 13056, 1, 256]
    - [14, 75.458]
  - - [44032, 27904, 1, 256]
    - [15, 75.577]
  - - [38144, 8192, 1, 256]
    - [29, 74.149]
  - - [29952, 512, 1, 256]
    - [232, 70.253]
  - - [18432, 4096, 1, 256]
    - [17, 72.431]
  - - [28160, 12288, 1, 256]
    - [18, 74.924]
  - - [29696, 1024, 1, 256]
    - [326, 77.395]
  - - [39936, 1024, 1, 256]
    - [25, 70.178]
  - - [25600, 512, 1, 256]
    - [364, 69.092]
  - - [40448, 24320, 1, 256]
    - [14, 75.043]
  - - [40448, 512, 1, 256]
    - [225, 73.834]
  - - [7424, 3584, 1, 256]
    - [326, 78.96]
  - - [5376, 512, 1, 256]
    - [235, 44.241]
  - - [27136, 4096, 1, 256]
    - [31, 73.399]
  - - [35840, 19968, 1, 256]
    - [17, 75.549]
  - - [18944, 11008, 1, 256]
    - [40, 75.428]
  - - [34816, 18688, 1, 256]
    - [17, 75.739]
  - - [38400, 1024, 1, 256]
    - [25, 70.053]
  - - [36352, 20480, 1, 256]
    - [18, 75.176]
  - - [36608, 20736, 1, 256]
    - [12, 74.849]
  - - [28672, 1024, 1, 256]
    - [232, 76.847]
  - - [42496, 26624, 1, 256]
    - [29, 75.087]
  - - [31488, 15360, 1, 256]
    - [17, 74.816]
  - - [20992, 4096, 1, 256]
    - [18, 73.044]
  - - [12544, 512, 1, 256]
    - [225, 60.652]
  - - [24064, 8192, 1, 256]
    - [14, 74.93]
  - - [26880, 8192, 1, 256]
    - [17, 74.524]
  - - [4352, 512, 1, 256]
    - [221, 42.087]
  - - [7680, 1024, 1, 256]
    - [286, 62.457]
  - - [16128, 8192, 1, 256]
    - [15, 74.553]
  - - [39168, 8192, 1, 256]
    - [18, 74.205]
  - - [29440, 4096, 1, 256]
    - [14, 72.927]
  - - [33536, 4096, 1, 256]
    - [29, 73.191]
  - - [33024, 17152, 1, 256]
    - [14, 75.207]
  - - [34816, 18944, 1, 256]
    - [15, 75.801]
  - - [22016, 512, 1, 256]
    - [226, 67.391]
  - - [14848, 6912, 1, 256]
    - [15, 74.685]
  - - [20736, 12800, 1, 256]
    - [15, 75.324]
  - - [32256, 16128, 1, 256]
    - [19, 75.679]
  - - [7680, 512, 1, 256]
    - [229, 52.405]
  - - [19968, 12288, 1, 256]
    - [29, 75.413]
  - - [29184, 4096, 1, 256]
    - [49, 73.343]
  - - [15616, 4096, 1, 256]
    - [17, 72.242]
  - - [44544, 28672, 1, 256]
    - [12, 74.533]
  - - [26112, 4096, 1, 256]
    - [43, 73.758]
  - - [26624, 10752, 1, 256]
    - [17, 75.829]
  - - [15104, 4096, 1, 256]
    - [17, 71.987]
  - - [23296, 4096, 1, 256]
    - [17, 72.489]
  - - [37888, 22016, 1, 256]
    - [17, 75.62]
  - - [11520, 7680, 1, 256]
    - [40, 73.86]
  - - [41728, 1024, 1, 256]
    - [17, 69.281]
  - - [2304, 1792, 1, 256]
    - [354, 54.815]
