library/src/blas3/Tensile/Logic/asm_full/aldebaran_104cu/aldebaran_Cijk_Ailk_Bjlk_4xi8II_BH.yaml
- {MinimumRequiredVersion: 4.32.1}
- aldebaran
- {Architecture: gfx90a, CUCount: 104}
- [Device 0050, Device 0051, Device 0052, Device 0054, Device 0062, Device 7400, Device
    SolutionIndex: 0
    SolutionNameMin: Cijk_Ailk_Bjlk_4xi8II_BH_MT16x16x16_SN_AMAS3_BL1_EPS1_GRVW2_GSU1_ISA90a_KLA_LRVW2_MAC_NLCA1_SNLL1_TT2_2_USFGRO1_VW2_WG8_8_4_WGM1
    SolutionIndex: 1
    SolutionNameMin: Cijk_Ailk_Bjlk_4xi8II_BH_MT16x16x32_SN_AMAS3_BL1_EPS1_GRVW2_GSU4_ISA90a_KLA_LRVW2_MAC_NLCA1_SNLL0_TT2_2_USFGRO0_VW2_WG8_8_4_WGM1
    SolutionIndex: 2
    SolutionNameMin: Cijk_Ailk_Bjlk_4xi8II_BH_MT64x64x16_SN_AMAS3_BL1_EPS1_GRVW4_GSU1_ISA90a_KLA_LRVW4_MAC_NLCA1_SNLL1_TT4_4_USFGRO0_VW4_WG16_16_1_WGM1
    SolutionIndex: 3
    SolutionNameMin: Cijk_Ailk_Bjlk_4xi8II_BH_MT64x64x16_SN_AMAS3_BL1_EPS1_GRVW4_GSU1_ISA90a_KLA_LRVW4_MAC_NLCA1_SNLL1_TT4_4_USFGRO0_VW4_WG16_16_1_WGM8
    SolutionIndex: 4
    SolutionNameMin: Cijk_Ailk_Bjlk_4xi8II_BH_MT32x32x32_SN_AMAS3_BL1_EPS1_GRVW4_GSU2_ISA90a_KLA_LRVW4_MAC_NLCA1_SNLL0_TT4_4_USFGRO0_VW4_WG8_8_4_WGM8
    SolutionIndex: 5
    SolutionNameMin: Cijk_Ailk_Bjlk_4xi8II_BH_MT128x64x16_SN_AMAS3_BL1_EPS1_GRVW4_GSU1_ISA90a_KLA_LRVW4_MAC_NLCA1_SNLL1_TT8_4_USFGRO0_VW4_WG16_16_1_WGM1
    SolutionIndex: 6
    SolutionNameMin: Cijk_Ailk_Bjlk_4xi8II_BH_MT16x16x32_SN_AMAS3_BL1_EPS1_GRVW2_GSU4_ISA90a_KLA_LRVW2_MAC_NLCA1_SNLL0_TT2_2_USFGRO0_VW2_WG8_8_4_WGM8
    SolutionIndex: 7
    SolutionNameMin: Cijk_Ailk_Bjlk_4xi8II_BH_MT128x128x16_SN_AMAS3_BL1_EPS1_GRVW4_GSU1_ISA90a_KLA_LRVW4_MAC_NLCA1_SNLL1_TT8_8_USFGRO0_VW4_WG16_16_1_WGM1
    SolutionIndex: 8
    SolutionNameMin: Cijk_Ailk_Bjlk_4xi8II_BH_MT128x128x16_SN_AMAS3_BL1_EPS1_GRVW4_GSU1_ISA90a_KLA_LRVW4_MAC_NLCA1_SNLL1_TT8_8_USFGRO0_VW4_WG16_16_1_WGM8
    SolutionIndex: 9
    SolutionNameMin: Cijk_Ailk_Bjlk_4xi8II_BH_MT16x16x32_SN_AMAS3_BL1_EPS1_GRVW2_GSU2_ISA90a_KLA_LRVW2_MAC_NLCA1_SNLL0_TT2_2_USFGRO0_VW2_WG8_8_4_WGM1
    SolutionIndex: 10
    SolutionNameMin: Cijk_Ailk_Bjlk_4xi8II_BH_MT32x32x32_SN_AMAS3_BL1_EPS1_GRVW4_GSU2_ISA90a_KLA_LRVW4_MAC_NLCA1_SNLL0_TT4_4_USFGRO0_VW4_WG8_8_4_WGM1
    SolutionIndex: 11
    SolutionNameMin: Cijk_Ailk_Bjlk_4xi8II_BH_MT32x16x32_SN_AMAS3_BL1_EPS1_GRVW2_GSU2_ISA90a_KLA_LRVW2_MAC_NLCA1_SNLL0_TT4_2_USFGRO0_VW2_WG8_8_4_WGM1
    SolutionIndex: 12
    SolutionNameMin: Cijk_Ailk_Bjlk_4xi8II_BH_MT32x16x32_SN_AMAS3_BL1_EPS1_GRVW2_GSU4_ISA90a_KLA_LRVW2_MAC_NLCA1_SNLL0_TT4_2_USFGRO0_VW2_WG8_8_4_WGM1
    SolutionIndex: 13
    SolutionNameMin: Cijk_Ailk_Bjlk_4xi8II_BH_MT32x8x32_SN_AMAS3_BL1_EPS1_GRVW2_GSU2_ISA90a_KLA_LRVW2_MAC_NLCA1_SNLL0_TT2_2_USFGRO0_VW2_WG16_4_4_WGM1
    SolutionIndex: 14
    SolutionNameMin: Cijk_Ailk_Bjlk_4xi8II_BH_MT16x16x16_SN_AMAS3_BL1_EPS1_GRVW2_GSU16_ISA90a_KLA_LRVW2_MAC_NLCA1_SNLL0_TT2_2_USFGRO1_VW2_WG8_8_4_WGM1
    SolutionIndex: 15
    SolutionNameMin: Cijk_Ailk_Bjlk_4xi8II_BH_MT8x8x8_SN_AMAS3_BL1_EPS1_GRVW2_GSU8_ISA90a_KLA_LRVW2_MAC_NLCA1_SNLL0_TT2_2_USFGRO1_VW2_WG4_4_4_WGM1
    SolutionIndex: 16
    SolutionNameMin: Cijk_Ailk_Bjlk_4xi8II_BH_MT16x16x8_SN_AMAS3_BL1_EPS1_GRVW2_GSU1_ISA90a_KLA_LRVW2_MAC_NLCA1_SNLL1_TT2_2_USFGRO1_VW2_WG8_8_2_WGM1
    SolutionIndex: 17
    SolutionNameMin: Cijk_Ailk_Bjlk_4xi8II_BH_MT32x16x8_SN_AMAS2_BL0_EPS0_GRVW2_GSU1_ISA000_KLS_LRVW2_FMA_NLCA1_SNLL0_TT2_2_USFGRO0_VW2_WG16_8_1_WGM1
    SolutionIndex: 18
    SolutionNameMin: Cijk_Ailk_Bjlk_4xi8II_BH_MT16x16x8_SN_AMAS3_BL1_EPS1_GRVW2_GSU8_ISA90a_KLA_LRVW2_MAC_NLCA1_SNLL0_TT2_2_USFGRO1_VW2_WG8_8_2_WGM1
    SolutionIndex: 19
    SolutionNameMin: Cijk_Ailk_Bjlk_4xi8II_BH_MT32x16x16_SN_AMAS2_BL0_EPS0_GRVW2_GSU1_ISA000_KLS_LRVW2_FMA_NLCA1_SNLL0_TT2_2_USFGRO0_VW2_WG16_8_1_WGM1
    SolutionIndex: 20
    SolutionNameMin: Cijk_Ailk_Bjlk_4xi8II_BH_MT32x32x32_SN_AMAS3_BL1_EPS1_GRVW4_GSU4_ISA90a_KLA_LRVW4_MAC_NLCA1_SNLL0_TT4_4_USFGRO0_VW4_WG8_8_4_WGM8
    SolutionIndex: 21
    SolutionNameMin: Cijk_Ailk_Bjlk_4xi8II_BH_MT16x16x16_SN_AMAS3_BL1_EPS1_GRVW2_GSU8_ISA90a_KLA_LRVW2_MAC_NLCA1_SNLL0_TT2_2_USFGRO1_VW2_WG8_8_4_WGM1
    SolutionIndex: 22
    SolutionNameMin: Cijk_Ailk_Bjlk_4xi8II_BH_MT16x16x32_SN_AMAS3_BL1_EPS1_GRVW2_GSU8_ISA90a_KLA_LRVW2_MAC_NLCA1_SNLL0_TT2_2_USFGRO0_VW2_WG8_8_4_WGM1
    SolutionIndex: 23
    SolutionNameMin: Cijk_Ailk_Bjlk_4xi8II_BH_MT32x8x32_SN_AMAS3_BL1_EPS1_GRVW2_GSU4_ISA90a_KLA_LRVW2_MAC_NLCA1_SNLL0_TT2_2_USFGRO0_VW2_WG16_4_4_WGM8
    SolutionIndex: 24
    SolutionNameMin: Cijk_Ailk_Bjlk_4xi8II_BH_MT32x16x16_SN_AMAS3_BL1_EPS1_GRVW2_GSU2_ISA90a_KLA_LRVW2_MAC_NLCA1_SNLL0_TT4_2_USFGRO0_VW2_WG8_8_4_WGM1
    SolutionIndex: 25
    SolutionNameMin: Cijk_Ailk_Bjlk_4xi8II_BH_MT8x8x8_SN_AMAS3_BL1_EPS1_GRVW2_GSU16_ISA90a_KLA_LRVW2_MAC_NLCA1_SNLL0_TT2_2_USFGRO1_VW2_WG4_4_4_WGM1
    SolutionIndex: 26
    SolutionNameMin: Cijk_Ailk_Bjlk_4xi8II_BH_MT32x32x32_SN_AMAS3_BL1_EPS1_GRVW4_GSU4_ISA90a_KLA_LRVW4_MAC_NLCA1_SNLL0_TT4_4_USFGRO0_VW4_WG8_8_4_WGM1
    SolutionIndex: 27
    SolutionNameMin: Cijk_Ailk_Bjlk_4xi8II_BH_MT16x16x16_SN_AMAS3_BL1_EPS1_GRVW2_GSU2_ISA90a_KLA_LRVW2_MAC_NLCA1_SNLL0_TT2_2_USFGRO1_VW2_WG8_8_4_WGM1
    SolutionIndex: 28
    SolutionNameMin: Cijk_Ailk_Bjlk_4xi8II_BH_MT32x16x16_SN_AMAS3_BL1_EPS1_GRVW2_GSU4_ISA90a_KLA_LRVW2_MAC_NLCA1_SNLL0_TT4_2_USFGRO0_VW2_WG8_8_4_WGM1
    SolutionIndex: 29
    SolutionNameMin: Cijk_Ailk_Bjlk_4xi8II_BH_MT32x16x32_SN_AMAS3_BL1_EPS1_GRVW2_GSU2_ISA90a_KLA_LRVW2_MAC_NLCA1_SNLL0_TT4_2_USFGRO0_VW2_WG8_8_4_WGM8
    SolutionIndex: 30
    SolutionNameMin: Cijk_Ailk_Bjlk_4xi8II_BH_MT16x16x16_SN_AMAS2_BL0_EPS0_GRVW2_GSU1_ISA000_KLS_LRVW2_FMA_NLCA1_SNLL0_TT2_2_USFGRO0_VW2_WG8_8_1_WGM1
    SolutionIndex: 31
    SolutionNameMin: Cijk_Ailk_Bjlk_4xi8II_BH_MT16x16x4_SN_AMAS3_BL1_EPS1_GRVW2_GSU8_ISA90a_KLA_LRVW2_MAC_NLCA1_SNLL0_TT2_2_USFGRO1_VW2_WG8_8_1_WGM1
    SolutionIndex: 32
    SolutionNameMin: Cijk_Ailk_Bjlk_4xi8II_BH_MT128x64x16_SN_AMAS3_BL1_EPS1_GRVW4_GSU1_ISA90a_KLA_LRVW4_MAC_NLCA1_SNLL1_TT8_4_USFGRO0_VW4_WG16_16_1_WGM8
    SolutionIndex: 33
    SolutionNameMin: Cijk_Ailk_Bjlk_4xi8II_BH_MT64x32x32_SN_AMAS3_BL1_EPS1_GRVW4_GSU2_ISA90a_KLA_LRVW4_MAC_NLCA1_SNLL0_TT8_4_USFGRO0_VW4_WG8_8_4_WGM1
    SolutionIndex: 34
    SolutionNameMin: Cijk_Ailk_Bjlk_4xi8II_BH_MT32x32x16_SN_AMAS3_BL1_EPS1_GRVW4_GSU2_ISA90a_KLA_LRVW4_MAC_NLCA1_SNLL0_TT4_4_USFGRO0_VW4_WG8_8_2_WGM1
    SolutionIndex: 35
    SolutionNameMin: Cijk_Ailk_Bjlk_4xi8II_BH_MT16x16x16_SN_AMAS3_BL1_EPS1_GRVW2_GSU4_ISA90a_KLA_LRVW2_MAC_NLCA1_SNLL0_TT2_2_USFGRO1_VW2_WG8_8_4_WGM1
    SolutionIndex: 36
    SolutionNameMin: Cijk_Ailk_Bjlk_4xi8II_BH_MT8x8x8_SN_AMAS3_BL1_EPS1_GRVW2_GSU1_ISA90a_KLA_LRVW2_MAC_NLCA1_SNLL1_TT2_2_USFGRO1_VW2_WG4_4_4_WGM1
    SolutionIndex: 37
    SolutionNameMin: Cijk_Ailk_Bjlk_4xi8II_BH_MT64x16x16_SN_AMAS3_BL1_EPS1_GRVW4_GSU2_ISA90a_KLA_LRVW4_MAC_NLCA1_SNLL0_TT4_4_USFGRO0_VW4_WG16_4_4_WGM1
- - - [1024, 128, 1, 128]
    - [19, 5.156]
  - - [4, 704, 1, 1280]
    - [6, 1.073]
  - - [4, 1856, 1, 3328]
    - [15, 4.778]
  - - [1856, 448, 1, 3328]
    - [3, 74.983]
  - - [2944, 4288, 1, 1280]
    - [3, 69.773]
  - - [2368, 64, 1, 3328]
    - [4, 50.062]
  - - [2368, 5888, 1, 256]
    - [2, 62.533]
  - - [128, 64, 1, 256]
    - [6, 0.72]
  - - [5888, 1024, 1, 1280]
    - [5, 66.623]
  - - [128, 6784, 1, 3328]
    - [3, 60.361]
  - - [64, 4, 1, 256]
    - [25, 0.021]
  - - [5888, 1856, 1, 3328]
    - [3, 71.779]
  - - [5056, 704, 1, 256]
    - [3, 60.322]
  - - [5888, 2944, 1, 3328]
    - [7, 74.927]
  - - [1856, 4288, 1, 256]
    - [2, 63.994]
  - - [1024, 5056, 1, 128]
    - [3, 62.405]
  - - [5056, 5056, 1, 3328]
    - [8, 74.032]
  - - [1408, 5888, 1, 1280]
    - [7, 67.053]
  - - [2368, 448, 1, 128]
    - [3, 31.615]
  - - [1024, 3584, 1, 3328]
    - [3, 64.473]
  - - [4, 2944, 1, 1280]
    - [4, 3.197]
  - - [1408, 64, 1, 128]
    - [0, 3.593]
  - - [256, 4288, 1, 3328]
    - [4, 58.289]
  - - [5888, 1408, 1, 1280]
    - [3, 70.188]
  - - [704, 1856, 1, 3328]
    - [3, 66.033]
  - - [4, 1408, 1, 128]
    - [29, 0.256]
  - - [1024, 2368, 1, 256]
    - [3, 49.609]
  - - [1408, 1856, 1, 1280]
    - [3, 65.448]
  - - [1408, 64, 1, 1280]
    - [10, 21.493]
  - - [448, 1024, 1, 1280]
    - [4, 48.894]
  - - [256, 1408, 1, 3328]
    - [4, 60.857]
  - - [5056, 5056, 1, 1280]
    - [3, 71.969]
  - - [448, 5056, 1, 256]
    - [2, 57.065]
  - - [704, 1856, 1, 1280]
    - [10, 62.363]
  - - [128, 5056, 1, 128]
    - [2, 21.412]
  - - [2368, 128, 1, 256]
    - [16, 16.016]
  - - [1856, 1408, 1, 128]
    - [2, 43.782]
  - - [64, 5056, 1, 256]
    - [0, 17.735]
  - - [6784, 256, 1, 3328]
    - [4, 73.398]
  - - [6784, 4288, 1, 3328]
    - [8, 74.575]
  - - [4288, 448, 1, 256]
    - [2, 56.931]
  - - [64, 704, 1, 128]
    - [36, 1.998]
  - - [1856, 2368, 1, 3328]
    - [2, 70.445]
  - - [4288, 2944, 1, 1280]
    - [3, 70.888]
  - - [704, 5056, 1, 1280]
    - [3, 68.256]
  - - [2368, 704, 1, 3328]
    - [2, 64.359]
  - - [256, 5888, 1, 256]
    - [32, 51.823]
  - - [1856, 4288, 1, 3328]
    - [2, 71.316]
  - - [256, 2944, 1, 256]
    - [2, 35.591]
  - - [5888, 1024, 1, 256]
    - [3, 60.872]
  - - [448, 64, 1, 1280]
    - [6, 9.754]
  - - [448, 5056, 1, 3328]
    - [4, 61.308]
  - - [3584, 4, 1, 1280]
    - [13, 4.3]
  - - [2944, 64, 1, 256]
    - [24, 11.748]
  - - [128, 4, 1, 1280]
    - [14, 0.169]
  - - [1408, 2944, 1, 256]
    - [3, 58.336]
  - - [256, 1856, 1, 1280]
    - [10, 41.682]
  - - [6784, 5056, 1, 3328]
    - [8, 74.899]
  - - [5056, 5056, 1, 256]
    - [2, 69.846]
  - - [1408, 6784, 1, 128]
    - [3, 60.147]
  - - [64, 1024, 1, 1280]
    - [10, 18.239]
  - - [2944, 4, 1, 256]
    - [23, 1.02]
  - - [704, 5056, 1, 128]
    - [2, 50.391]
  - - [4, 2368, 1, 1280]
    - [15, 2.705]
  - - [2368, 2944, 1, 1280]
    - [2, 68.373]
  - - [128, 3584, 1, 1280]
    - [10, 42.987]
  - - [6784, 6784, 1, 1280]
    - [7, 75.852]
  - - [1024, 256, 1, 3328]
    - [4, 45.438]
  - - [1408, 4288, 1, 1280]
    - [5, 69.332]
  - - [3584, 4288, 1, 1280]
    - [8, 72.303]
  - - [2368, 704, 1, 1280]
    - [2, 60.757]
  - - [5056, 4288, 1, 3328]
    - [3, 73.012]
  - - [3584, 2368, 1, 3328]
    - [3, 70.468]
  - - [64, 704, 1, 1280]
    - [11, 14.143]
  - - [4288, 256, 1, 256]
    - [2, 46.911]
  - - [2944, 128, 1, 128]
    - [16, 12.264]
  - - [6784, 448, 1, 1280]
    - [2, 66.54]
  - - [1408, 2944, 1, 128]
    - [2, 50.043]
  - - [4288, 2944, 1, 256]
    - [2, 61.394]
  - - [5888, 704, 1, 1280]
    - [2, 64.111]
  - - [1856, 64, 1, 1280]
    - [10, 27.377]
  - - [448, 5888, 1, 128]
    - [2, 49.185]
  - - [5888, 64, 1, 3328]
    - [3, 34.703]
  - - [2944, 256, 1, 3328]
    - [4, 56.226]
  - - [1024, 64, 1, 128]
    - [0, 3.121]
  - - [5056, 2368, 1, 1280]
    - [8, 70.912]
  - - [448, 3584, 1, 1280]
    - [3, 58.974]
  - - [6784, 5888, 1, 256]
    - [2, 70.294]
  - - [704, 1024, 1, 128]
    - [32, 20.342]
  - - [704, 128, 1, 1280]
    - [10, 23.72]
  - - [5888, 2944, 1, 128]
    - [3, 56.004]
  - - [4, 3584, 1, 128]
    - [0, 0.612]
  - - [1408, 448, 1, 1280]
    - [4, 44.486]
  - - [1024, 1408, 1, 256]
    - [3, 49.387]
  - - [2368, 2368, 1, 3328]
    - [2, 68.844]
  - - [1856, 6784, 1, 128]
    - [3, 61.279]
  - - [5056, 704, 1, 3328]
    - [3, 70.578]
  - - [1408, 1856, 1, 256]
    - [3, 62.122]
  - - [1408, 704, 1, 3328]
    - [4, 57.995]
  - - [2368, 5056, 1, 256]
    - [3, 65.995]
  - - [5888, 1856, 1, 256]
    - [2, 65.485]
  - - [4288, 64, 1, 3328]
    - [20, 55.405]
  - - [2368, 4, 1, 1280]
    - [12, 3.21]
  - - [704, 5888, 1, 256]
    - [3, 58.955]
  - - [4288, 64, 1, 256]
    - [16, 15.225]
  - - [6784, 64, 1, 256]
    - [16, 20.095]
  - - [2944, 256, 1, 256]
    - [2, 39.081]
  - - [2944, 6784, 1, 3328]
    - [2, 73.119]
  - - [704, 1408, 1, 3328]
    - [4, 57.995]
  - - [3584, 704, 1, 3328]
    - [2, 66.429]
  - - [2944, 256, 1, 128]
    - [2, 23.563]
  - - [6784, 4, 1, 1280]
    - [37, 6.179]
  - - [1024, 64, 1, 1280]
    - [12, 17.64]
  - - [448, 4288, 1, 256]
    - [2, 56.909]
  - - [64, 3584, 1, 3328]
    - [26, 53.271]
  - - [704, 2368, 1, 1280]
    - [2, 77.95]
  - - [448, 2944, 1, 128]
    - [2, 33.527]
  - - [1856, 2368, 1, 1280]
    - [2, 67.998]
  - - [2368, 128, 1, 3328]
    - [20, 54.683]
  - - [2944, 128, 1, 256]
    - [16, 17.622]
  - - [448, 1408, 1, 256]
    - [3, 29.182]
  - - [1856, 4288, 1, 1280]
    - [2, 70.819]
  - - [64, 5056, 1, 3328]
    - [4, 48.425]
  - - [4, 704, 1, 256]
    - [22, 0.225]
  - - [1024, 448, 1, 128]
    - [3, 14.145]
  - - [704, 4, 1, 1280]
    - [22, 1.037]
  - - [704, 256, 1, 128]
    - [16, 6.676]
  - - [704, 2944, 1, 128]
    - [2, 42.889]
  - - [1408, 1024, 1, 1280]
    - [5, 54.041]
  - - [704, 6784, 1, 256]
    - [2, 71.156]
  - - [6784, 704, 1, 256]
    - [3, 72.716]
  - - [5056, 1408, 1, 128]
    - [3, 58.8]
  - - [256, 3584, 1, 3328]
    - [4, 56.674]
  - - [4, 5888, 1, 3328]
    - [20, 6.23]
  - - [128, 1408, 1, 128]
    - [0, 6.141]
  - - [3584, 4288, 1, 3328]
    - [2, 89.124]
  - - [5888, 1856, 1, 1280]
    - [2, 70.859]
  - - [5056, 1024, 1, 3328]
    - [8, 69.819]
  - - [5056, 64, 1, 1280]
    - [10, 41.798]
  - - [1024, 704, 1, 256]
    - [2, 36.799]
  - - [1024, 4288, 1, 128]
    - [2, 61.91]
  - - [4288, 64, 1, 1280]
    - [4, 34.538]
  - - [2368, 3584, 1, 1280]
    - [3, 71.504]
  - - [2368, 6784, 1, 1280]
    - [2, 71.647]
  - - [1024, 256, 1, 256]
    - [16, 13.948]
  - - [1856, 4, 1, 1280]
    - [12, 2.412]
  - - [448, 448, 1, 256]
    - [16, 12.184]
  - - [2944, 3584, 1, 3328]
    - [2, 86.724]
  - - [128, 4288, 1, 128]
    - [2, 18.811]
  - - [64, 448, 1, 256]
    - [0, 2.462]
  - - [128, 1024, 1, 3328]
    - [20, 45.186]
  - - [4, 1408, 1, 3328]
    - [22, 3.948]
  - - [6784, 2944, 1, 256]
    - [3, 68.753]
  - - [64, 1856, 1, 1280]
    - [10, 22.723]
  - - [64, 1024, 1, 128]
    - [0, 3.018]
  - - [4288, 2368, 1, 3328]
    - [3, 71.949]
  - - [1856, 2368, 1, 256]
    - [2, 61.739]
  - - [3584, 256, 1, 128]
    - [3, 25.178]
  - - [3584, 6784, 1, 3328]
    - [8, 75.048]
  - - [256, 1024, 1, 256]
    - [16, 14.85]
  - - [4, 6784, 1, 3328]
    - [10, 5.876]
  - - [1024, 5888, 1, 3328]
    - [2, 84.958]
  - - [1024, 128, 1, 1280]
    - [10, 29.88]
  - - [4288, 128, 1, 1280]
    - [10, 43.213]
  - - [5056, 4288, 1, 1280]
    - [5, 69.081]
  - - [5888, 64, 1, 256]
    - [3, 19.218]
  - - [1856, 256, 1, 1280]
    - [4, 40.69]
  - - [64, 5888, 1, 3328]
    - [20, 59.705]
  - - [2944, 5888, 1, 128]
    - [2, 63.071]
  - - [704, 5888, 1, 1280]
    - [3, 65.523]
  - - [2368, 3584, 1, 128]
    - [3, 61.25]
  - - [6784, 5888, 1, 3328]
    - [7, 75.642]
  - - [704, 1024, 1, 1280]
    - [3, 59.367]
  - - [448, 256, 1, 3328]
    - [20, 41.299]
  - - [448, 1856, 1, 128]
    - [2, 27.055]
  - - [128, 1024, 1, 128]
    - [0, 5.499]
  - - [2944, 4, 1, 128]
    - [0, 0.535]
  - - [1024, 704, 1, 1280]
    - [3, 59.433]
  - - [128, 5888, 1, 256]
    - [2, 36.813]
  - - [1024, 5056, 1, 1280]
    - [5, 67.2]
  - - [4288, 1024, 1, 256]
    - [3, 62.347]
  - - [2944, 2368, 1, 128]
    - [2, 58.797]
  - - [704, 704, 1, 3328]
    - [4, 54.18]
  - - [704, 1408, 1, 1280]
    - [2, 48.969]
  - - [5888, 448, 1, 1280]
    - [3, 66.362]
  - - [3584, 256, 1, 3328]
    - [20, 69.472]
  - - [704, 5888, 1, 3328]
    - [2, 65.233]
  - - [704, 1856, 1, 128]
    - [3, 33.485]
  - - [128, 3584, 1, 3328]
    - [10, 51.062]
  - - [6784, 2368, 1, 1280]
    - [2, 87.034]
  - - [4, 4288, 1, 128]
    - [16, 0.748]
  - - [128, 704, 1, 1280]
    - [10, 22.937]
  - - [3584, 2944, 1, 256]
    - [7, 65.379]
  - - [1856, 128, 1, 3328]
    - [20, 55.09]
  - - [4, 64, 1, 1280]
    - [14, 0.099]
  - - [4, 5056, 1, 3328]
    - [26, 6.336]
  - - [128, 2944, 1, 1280]
    - [10, 45.427]
  - - [2368, 1024, 1, 3328]
    - [3, 64.448]
  - - [128, 256, 1, 3328]
    - [12, 20.139]
  - - [1408, 5056, 1, 3328]
    - [3, 88.721]
  - - [1856, 1856, 1, 3328]
    - [5, 67.453]
  - - [3584, 128, 1, 256]
    - [2, 24.777]
  - - [448, 1408, 1, 3328]
    - [10, 65.869]
  - - [2368, 2368, 1, 256]
    - [2, 59.95]
  - - [4288, 4288, 1, 1280]
    - [3, 73.063]
  - - [64, 448, 1, 1280]
    - [12, 9.7]
  - - [1408, 4288, 1, 256]
    - [2, 61.346]
  - - [448, 4, 1, 256]
    - [1, 0.158]
  - - [5888, 448, 1, 128]
    - [2, 43.342]
  - - [448, 4, 1, 1280]
    - [22, 0.777]
  - - [704, 6784, 1, 3328]
    - [3, 70.124]
  - - [5888, 5888, 1, 1280]
    - [8, 75.2]
  - - [5056, 1024, 1, 1280]
    - [3, 68.35]
  - - [448, 5888, 1, 3328]
    - [2, 66.924]
  - - [128, 4, 1, 128]
    - [0, 0.021]
  - - [1024, 2944, 1, 1280]
    - [3, 66.257]
  - - [5056, 5888, 1, 1280]
    - [8, 75.107]
  - - [4288, 5888, 1, 128]
    - [2, 61.579]
  - - [256, 3584, 1, 256]
    - [2, 36.47]
  - - [1408, 3584, 1, 128]
    - [3, 53.891]
  - - [256, 2944, 1, 3328]
    - [10, 56.408]
  - - [448, 3584, 1, 128]
    - [3, 32.373]
  - - [5888, 2944, 1, 1280]
    - [7, 73.62]
  - - [4, 6784, 1, 1280]
    - [15, 5.036]
  - - [2368, 5888, 1, 128]
    - [3, 58.637]
  - - [64, 2944, 1, 128]
    - [0, 7.686]
  - - [3584, 5888, 1, 256]
    - [3, 65.44]
  - - [2368, 704, 1, 128]
    - [2, 44.435]
  - - [3584, 2944, 1, 1280]
    - [2, 85.538]
  - - [3584, 2368, 1, 128]
    - [2, 60.011]
  - - [5056, 704, 1, 128]
    - [2, 46.852]
  - - [448, 2368, 1, 128]
    - [2, 30.241]
  - - [5056, 1408, 1, 3328]
    - [3, 88.48]
  - - [1408, 704, 1, 256]
    - [2, 41.168]
  - - [6784, 1024, 1, 3328]
    - [2, 86.344]
  - - [6784, 2944, 1, 3328]
    - [5, 72.83]
  - - [2944, 5056, 1, 3328]
    - [5, 73.398]
  - - [1856, 1856, 1, 256]
    - [3, 57.823]
  - - [1024, 5888, 1, 128]
    - [3, 54.933]
  - - [2048, 7133, 1, 2048]
    - [2, 72.13]
  - - [256, 4, 1, 128]
    - [0, 0.043]
  - - [4288, 5888, 1, 1280]
    - [3, 72.613]
  - - [4288, 4288, 1, 256]
    - [2, 67.032]
  - - [448, 2944, 1, 3328]
    - [2, 66.506]
  - - [4288, 1856, 1, 1280]
    - [5, 69.042]
  - - [1856, 2944, 1, 3328]
    - [2, 68.654]
  - - [256, 6784, 1, 3328]
    - [5, 66.356]
  - - [64, 5888, 1, 256]
    - [3, 17.273]
  - - [256, 5056, 1, 128]
    - [5, 33.519]
  - - [5056, 1024, 1, 256]
    - [2, 73.213]
  - - [704, 64, 1, 3328]
    - [20, 26.176]
  - - [5056, 1856, 1, 3328]
    - [3, 72.856]
  - - [4, 2944, 1, 3328]
    - [15, 5.852]
  - - [4, 5056, 1, 256]
    - [0, 1.563]
  - - [1856, 1408, 1, 256]
    - [2, 54.088]
  - - [3584, 4, 1, 128]
    - [0, 0.644]
  - - [448, 448, 1, 3328]
    - [10, 54.648]
  - - [6784, 128, 1, 3328]
    - [3, 61.01]
  - - [4288, 1408, 1, 128]
    - [3, 57.149]
  - - [4288, 5056, 1, 256]
    - [3, 68.621]
  - - [1408, 128, 1, 1280]
    - [10, 35.46]
  - - [5056, 256, 1, 3328]
    - [3, 65.514]
  - - [704, 704, 1, 256]
    - [2, 27.023]
  - - [1024, 5888, 1, 1280]
    - [5, 68.761]
  - - [6784, 2368, 1, 128]
    - [2, 63.122]
  - - [4, 5056, 1, 1280]
    - [15, 4.702]
  - - [64, 128, 1, 256]
    - [1, 0.742]
  - - [128, 1856, 1, 1280]
    - [10, 38.046]
  - - [5056, 3584, 1, 256]
    - [3, 68.211]
  - - [1856, 1024, 1, 1280]
    - [2, 57.005]
  - - [6784, 4288, 1, 1280]
    - [5, 73.543]
  - - [1856, 1856, 1, 1280]
    - [3, 66.752]
  - - [6784, 2944, 1, 128]
    - [3, 59.145]
  - - [1408, 5056, 1, 1280]
    - [8, 69.681]
  - - [4, 2368, 1, 3328]
    - [26, 5.326]
  - - [5888, 1856, 1, 128]
    - [2, 59.635]
  - - [448, 704, 1, 1280]
    - [4, 45.122]
  - - [2368, 1024, 1, 128]
    - [2, 44.334]
  - - [1024, 448, 1, 3328]
    - [4, 50.444]
  - - [1856, 704, 1, 1280]
    - [3, 60.995]
  - - [5056, 3584, 1, 128]
    - [2, 63.186]
  - - [5888, 5888, 1, 3328]
    - [7, 75.627]
  - - [6784, 1024, 1, 256]
    - [3, 62.332]
  - - [2944, 2368, 1, 256]
    - [3, 61.904]
  - - [256, 448, 1, 256]
    - [0, 8.933]
  - - [5056, 5888, 1, 3328]
    - [8, 75.735]
  - - [1856, 1024, 1, 256]
    - [2, 55.311]
  - - [448, 1408, 1, 1280]
    - [2, 52.45]
  - - [3584, 448, 1, 1280]
    - [32, 71.384]
  - - [1024, 1024, 1, 1280]
    - [3, 64.354]
  - - [448, 5888, 1, 256]
    - [2, 61.395]
  - - [704, 64, 1, 128]
    - [36, 1.972]
  - - [1408, 6784, 1, 3328]
    - [5, 70.44]
  - - [448, 1024, 1, 128]
    - [2, 15.772]
  - - [4288, 704, 1, 128]
    - [3, 43.608]
  - - [128, 1856, 1, 128]
    - [16, 8.689]
  - - [448, 2368, 1, 3328]
    - [10, 58.886]
  - - [5056, 64, 1, 128]
    - [16, 10.807]
  - - [5056, 2944, 1, 256]
    - [3, 64.13]
  - - [6784, 5888, 1, 128]
    - [3, 67.445]
  - - [704, 1024, 1, 256]
    - [3, 37.662]
  - - [1024, 4, 1, 256]
    - [12, 0.38]
  - - [2368, 1856, 1, 256]
    - [3, 61.503]
  - - [128, 6784, 1, 1280]
    - [3, 55.04]
  - - [1408, 3584, 1, 3328]
    - [3, 67.304]
  - - [2368, 6784, 1, 256]
    - [2, 60.787]
  - - [5056, 1408, 1, 1280]
    - [7, 69.335]
  - - [256, 256, 1, 128]
    - [0, 2.837]
  - - [5056, 4288, 1, 128]
    - [2, 57.671]
  - - [1408, 1856, 1, 128]
    - [3, 49.561]
  - - [1408, 5888, 1, 3328]
    - [3, 71.336]
  - - [1856, 256, 1, 256]
    - [2, 24.302]
  - - [6784, 6784, 1, 256]
    - [8, 72.502]
  - - [64, 256, 1, 128]
    - [0, 0.745]
  - - [4288, 2368, 1, 128]
    - [2, 62.32]
  - - [1856, 4288, 1, 128]
    - [3, 60.262]
  - - [256, 4288, 1, 1280]
    - [3, 67.524]
  - - [2368, 2944, 1, 256]
    - [3, 61.974]
  - - [4, 1856, 1, 256]
    - [35, 0.643]
  - - [3584, 1856, 1, 1280]
    - [2, 68.076]
  - - [6784, 6784, 1, 128]
    - [3, 68.098]
  - - [256, 1856, 1, 128]
    - [3, 16.15]
  - - [704, 64, 1, 1280]
    - [12, 13.892]
  - - [5888, 5056, 1, 256]
    - [2, 69.815]
  - - [3584, 448, 1, 256]
    - [3, 56.884]
  - - [448, 4288, 1, 128]
    - [3, 43.661]
  - - [2944, 4288, 1, 3328]
    - [3, 71.21]
  - - [256, 6784, 1, 256]
    - [2, 52.47]
  - - [1408, 4288, 1, 128]
    - [2, 56.983]
  - - [2944, 704, 1, 3328]
    - [3, 64.327]
  - - [128, 448, 1, 256]
    - [29, 4.658]
  - - [512, 32, 1, 512]
    - [23, 2.836]
  - - [3584, 3584, 1, 256]
    - [2, 65.696]
  - - [448, 1408, 1, 128]
    - [3, 21.915]
  - - [128, 256, 1, 1280]
    - [12, 10.966]
  - - [3584, 5056, 1, 256]
    - [3, 83.303]
  - - [6784, 128, 1, 256]
    - [3, 37.392]
  - - [4288, 4, 1, 256]
    - [13, 1.392]
  - - [64, 1408, 1, 3328]
    - [4, 37.883]
  - - [704, 448, 1, 256]
    - [16, 14.523]
  - - [2944, 2368, 1, 1280]
    - [8, 69.333]
  - - [448, 64, 1, 3328]
    - [12, 18.888]
  - - [1408, 3584, 1, 256]
    - [3, 61.494]
  - - [3584, 4, 1, 3328]
    - [13, 6.908]
  - - [6784, 3584, 1, 256]
    - [2, 69.631]
  - - [256, 128, 1, 128]
    - [0, 1.551]
  - - [704, 1408, 1, 128]
    - [3, 27.877]
  - - [4, 2368, 1, 256]
    - [35, 0.796]
  - - [2944, 448, 1, 128]
    - [3, 33.898]
  - - [128, 1408, 1, 256]
    - [16, 11.637]
  - - [4, 2944, 1, 256]
    - [0, 0.936]
  - - [64, 128, 1, 3328]
    - [22, 7.421]
  - - [5056, 2368, 1, 128]
    - [2, 60.051]
  - - [2944, 2944, 1, 3328]
    - [2, 87.895]
  - - [5056, 6784, 1, 256]
    - [3, 67.969]
  - - [1856, 3584, 1, 128]
    - [2, 58.83]
  - - [128, 2944, 1, 128]
    - [16, 12.257]
  - - [1024, 704, 1, 3328]
    - [10, 56.255]
  - - [6784, 448, 1, 256]
    - [3, 55.304]
  - - [3584, 6784, 1, 128]
    - [2, 80.89]
  - - [128, 4288, 1, 256]
    - [2, 29.964]
  - - [704, 448, 1, 3328]
    - [20, 58.816]
  - - [1024, 1024, 1, 3328]
    - [4, 58.308]
  - - [128, 128, 1, 3328]
    - [22, 12.977]
  - - [5056, 1856, 1, 256]
    - [3, 65.149]
  - - [256, 128, 1, 256]
    - [0, 2.864]
  - - [1024, 1856, 1, 256]
    - [3, 55.08]
  - - [4288, 64, 1, 128]
    - [17, 9.182]
  - - [256, 448, 1, 3328]
    - [26, 40.72]
  - - [1408, 6784, 1, 1280]
    - [5, 68.593]
  - - [3584, 3584, 1, 1280]
    - [2, 71.113]
  - - [64, 2368, 1, 1280]
    - [10, 27.808]
  - - [448, 2368, 1, 1280]
    - [2, 49.842]
  - - [5888, 5888, 1, 128]
    - [2, 66.774]
  - - [64, 6784, 1, 3328]
    - [4, 52.242]
  - - [2944, 256, 1, 1280]
    - [2, 61.891]
  - - [5056, 5888, 1, 128]
    - [2, 60.95]
  - - [256, 2368, 1, 128]
    - [3, 21.243]
  - - [5056, 2368, 1, 3328]
    - [3, 88.242]
  - - [2944, 4288, 1, 256]
    - [2, 62.553]
  - - [1408, 3584, 1, 1280]
    - [7, 65.029]
  - - [2368, 64, 1, 256]
    - [0, 10.247]
  - - [64, 448, 1, 3328]
    - [26, 17.884]
  - - [256, 256, 1, 3328]
    - [26, 28.962]
  - - [5888, 4, 1, 128]
    - [0, 0.953]
  - - [1856, 704, 1, 256]
    - [3, 45.484]
  - - [4, 4288, 1, 1280]
    - [4, 4.193]
  - - [1408, 448, 1, 3328]
    - [4, 63.395]
  - - [1024, 4, 1, 3328]
    - [23, 3.044]
  - - [2368, 256, 1, 256]
    - [3, 32.539]
  - - [2368, 6784, 1, 3328]
    - [3, 73.319]
  - - [1856, 1408, 1, 1280]
    - [3, 65.439]
  - - [1856, 448, 1, 1280]
    - [3, 67.429]
  - - [6784, 704, 1, 128]
    - [2, 63.196]
  - - [4, 4, 1, 256]
    - [31, 0.001]
  - - [128, 5888, 1, 128]
    - [3, 22.209]
  - - [1408, 5888, 1, 256]
    - [3, 62.789]
  - - [704, 2944, 1, 1280]
    - [2, 60.775]
  - - [1856, 2368, 1, 128]
    - [2, 51.704]
  - - [4096, 7133, 1, 4096]
    - [8, 74.69]
  - - [256, 64, 1, 256]
    - [9, 1.334]
  - - [1024, 1024, 1, 256]
    - [3, 41.893]
  - - [704, 1856, 1, 256]
    - [3, 46.312]
  - - [128, 4288, 1, 3328]
    - [10, 66.042]
  - - [3584, 704, 1, 1280]
    - [3, 63.781]
  - - [256, 128, 1, 1280]
    - [1, 10.283]
  - - [2368, 4, 1, 256]
    - [23, 0.687]
  - - [256, 2368, 1, 1280]
    - [10, 44.188]
  - - [2944, 6784, 1, 128]
    - [2, 78.984]
  - - [3584, 448, 1, 3328]
    - [3, 61.539]
  - - [1408, 4, 1, 256]
    - [23, 0.525]
  - - [704, 2368, 1, 3328]
    - [2, 64.147]
  - - [2944, 448, 1, 256]
    - [3, 46.871]
  - - [1856, 448, 1, 128]
    - [2, 27.538]
  - - [2368, 128, 1, 1280]
    - [4, 44.578]
  - - [256, 5888, 1, 128]
    - [3, 40.57]
  - - [64, 6784, 1, 256]
    - [3, 23.87]
  - - [64, 5056, 1, 1280]
    - [10, 43.445]
  - - [4, 6784, 1, 128]
    - [0, 1.201]
  - - [2944, 2944, 1, 1280]
    - [3, 86.69]
  - - [5888, 2368, 1, 256]
    - [3, 67.949]
  - - [4, 3584, 1, 1280]
    - [9, 3.785]
  - - [1408, 128, 1, 128]
    - [19, 7.184]
  - - [6784, 704, 1, 3328]
    - [3, 68.038]
  - - [128, 64, 1, 1280]
    - [22, 3.275]
  - - [2368, 256, 1, 1280]
    - [4, 54.59]
  - - [4, 448, 1, 3328]
    - [14, 1.574]
  - - [5888, 4288, 1, 128]
    - [2, 65.214]
  - - [4, 5888, 1, 256]
    - [9, 1.708]
  - - [1408, 2944, 1, 3328]
    - [5, 67.362]
  - - [3584, 704, 1, 128]
    - [3, 48.11]
  - - [64, 1024, 1, 256]
    - [0, 5.393]
  - - [5056, 5056, 1, 128]
    - [3, 65.804]
  - - [2368, 448, 1, 1280]
    - [3, 50.795]
  - - [128, 3584, 1, 256]
    - [2, 24.947]
  - - [704, 448, 1, 1280]
    - [4, 44.927]
  - - [448, 5056, 1, 128]
    - [2, 46.39]
  - - [256, 4, 1, 1280]
    - [22, 0.426]
  - - [128, 5056, 1, 256]
    - [3, 34.053]
  - - [1408, 5056, 1, 128]
    - [2, 59.558]
  - - [2944, 3584, 1, 128]
    - [3, 58.229]
  - - [3584, 2368, 1, 256]
    - [2, 64.38]
  - - [5888, 5056, 1, 1280]
    - [8, 75.075]
  - - [2368, 5056, 1, 128]
    - [3, 60.504]
  - - [64, 704, 1, 256]
    - [0, 3.906]
  - - [4288, 256, 1, 1280]
    - [2, 66.481]
  - - [3584, 3584, 1, 3328]
    - [3, 72.455]
  - - [1024, 256, 1, 128]
    - [0, 9.295]
  - - [4, 704, 1, 128]
    - [0, 0.129]
  - - [5888, 6784, 1, 256]
    - [7, 71.242]
  - - [4288, 2944, 1, 3328]
    - [3, 70.164]
  - - [2944, 64, 1, 128]
    - [0, 7.233]
  - - [1856, 64, 1, 256]
    - [0, 8.498]
  - - [4288, 128, 1, 3328]
    - [4, 65.443]
  - - [4288, 704, 1, 1280]
    - [3, 66.107]
  - - [256, 5056, 1, 1280]
    - [3, 61.291]
  - - [1408, 256, 1, 128]
    - [0, 11.738]
  - - [2944, 5888, 1, 3328]
    - [8, 75.023]
  - - [6784, 5888, 1, 1280]
    - [8, 74.615]
  - - [704, 128, 1, 256]
    - [11, 6.755]
  - - [5888, 4288, 1, 1280]
    - [5, 72.858]
  - - [448, 256, 1, 1280]
    - [10, 26.527]
  - - [5888, 3584, 1, 128]
    - [3, 65.243]
  - - [1856, 1856, 1, 128]
    - [2, 50.155]
  - - [5056, 4, 1, 1280]
    - [13, 5.662]
  - - [256, 1408, 1, 1280]
    - [4, 40.698]
  - - [512, 16, 1, 512]
    - [1, 1.277]
  - - [704, 3584, 1, 128]
    - [3, 47.824]
  - - [5888, 448, 1, 3328]
    - [3, 69.229]
  - - [2368, 4288, 1, 1280]
    - [3, 71.456]
  - - [4288, 2944, 1, 128]
    - [3, 59.151]
  - - [1024, 6784, 1, 3328]
    - [8, 72.406]
  - - [128, 2368, 1, 256]
    - [0, 16.522]
  - - [6784, 64, 1, 3328]
    - [20, 61.98]
  - - [5056, 2944, 1, 3328]
    - [5, 72.551]
  - - [448, 128, 1, 256]
    - [0, 4.617]
  - - [2944, 3584, 1, 256]
    - [7, 66.305]
  - - [1408, 1408, 1, 3328]
    - [3, 61.643]
  - - [1856, 128, 1, 1280]
    - [10, 38.012]
  - - [3584, 3584, 1, 128]
    - [3, 61.408]
  - - [64, 3584, 1, 256]
    - [0, 13.11]
  - - [1408, 4, 1, 3328]
    - [23, 4.385]
  - - [128, 2944, 1, 3328]
    - [10, 60.019]
  - - [3584, 704, 1, 256]
    - [2, 51.315]
  - - [2944, 448, 1, 3328]
    - [33, 68.648]
  - - [3584, 1408, 1, 3328]
    - [8, 68.158]
  - - [704, 3584, 1, 1280]
    - [3, 63.975]
  - - [2944, 6784, 1, 1280]
    - [8, 72.132]
  - - [1856, 6784, 1, 256]
    - [2, 66.888]
  - - [4288, 448, 1, 3328]
    - [3, 76.167]
  - - [6784, 4288, 1, 128]
    - [3, 66.053]
  - - [6784, 704, 1, 1280]
    - [3, 67.014]
  - - [256, 4288, 1, 256]
    - [2, 45.12]
  - - [3584, 64, 1, 128]
    - [19, 7.956]
  - - [5888, 1024, 1, 3328]
    - [3, 68.875]
  - - [448, 64, 1, 128]
    - [0, 1.344]
  - - [704, 6784, 1, 1280]
    - [2, 67.068]
  - - [5888, 128, 1, 256]
    - [2, 39.164]
  - - [2368, 448, 1, 3328]
    - [4, 58.984]
  - - [1856, 5056, 1, 3328]
    - [2, 72.807]
  - - [4, 6784, 1, 256]
    - [0, 1.946]
  - - [1024, 3584, 1, 128]
    - [2, 45.864]
  - - [1024, 1408, 1, 128]
    - [3, 38.19]
  - - [2368, 2944, 1, 128]
    - [3, 58.492]
  - - [5056, 64, 1, 256]
    - [0, 17.252]
  - - [4, 448, 1, 1280]
    - [6, 0.726]
  - - [5056, 2944, 1, 128]
    - [2, 61.96]
  - - [5888, 5056, 1, 3328]
    - [8, 76.084]
  - - [1024, 704, 1, 128]
    - [2, 23.814]
  - - [1408, 2368, 1, 128]
    - [2, 56.557]
  - - [5888, 2368, 1, 128]
    - [2, 60.045]
  - - [128, 5056, 1, 3328]
    - [10, 54.244]
  - - [3584, 6784, 1, 1280]
    - [8, 74.872]
  - - [3072, 7435, 1, 1024]
    - [7, 73.273]
  - - [1856, 5888, 1, 256]
    - [3, 62.414]
  - - [256, 256, 1, 256]
    - [0, 5.432]
  - - [256, 64, 1, 128]
    - [0, 0.723]
  - - [4288, 4288, 1, 3328]
    - [3, 73.218]
  - - [4288, 1408, 1, 1280]
    - [3, 66.491]
  - - [3584, 5056, 1, 128]
    - [2, 79.358]
  - - [4, 1024, 1, 3328]
    - [1, 3.044]
  - - [4288, 2368, 1, 256]
    - [3, 65.02]
  - - [2944, 5056, 1, 1280]
    - [5, 70.853]
  - - [448, 6784, 1, 256]
    - [2, 63.8]
  - - [64, 1024, 1, 3328]
    - [26, 32.039]
  - - [6784, 2368, 1, 3328]
    - [5, 74.544]
  - - [256, 1024, 1, 1280]
    - [10, 33.933]
  - - [704, 4, 1, 128]
    - [0, 0.109]
  - - [256, 4, 1, 256]
    - [18, 0.071]
  - - [4288, 128, 1, 256]
    - [2, 29.457]
  - - [4288, 1856, 1, 3328]
    - [5, 72.491]
  - - [3584, 448, 1, 128]
    - [32, 39.904]
  - - [256, 4, 1, 3328]
    - [22, 0.98]
  - - [4, 1408, 1, 1280]
    - [6, 2.001]
  - - [3584, 64, 1, 1280]
    - [10, 37.184]
  - - [1408, 448, 1, 128]
    - [3, 19.955]
  - - [3584, 1024, 1, 1280]
    - [2, 63.288]
  - - [1856, 5056, 1, 256]
    - [3, 65.311]
  - - [4, 3584, 1, 256]
    - [0, 1.133]
  - - [1024, 4288, 1, 256]
    - [3, 61.496]
  - - [5888, 3584, 1, 3328]
    - [7, 76.104]
  - - [4, 256, 1, 256]
    - [18, 0.088]
  - - [5056, 3584, 1, 3328]
    - [5, 71.969]
  - - [128, 5888, 1, 1280]
    - [2, 61.273]
  - - [704, 448, 1, 128]
    - [0, 10.969]
  - - [2368, 1408, 1, 1280]
    - [3, 64.834]
  - - [5056, 2944, 1, 1280]
    - [32, 69.78]
  - - [4, 4, 1, 128]
    - [0, 0.001]
  - - [3584, 256, 1, 256]
    - [2, 38.224]
  - - [128, 1856, 1, 3328]
    - [26, 53.752]
  - - [1024, 6784, 1, 256]
    - [2, 62.17]
  - - [4, 128, 1, 256]
    - [35, 0.05]
  - - [64, 64, 1, 1280]
    - [22, 1.739]
  - - [6784, 4, 1, 128]
    - [0, 1.213]
  - - [2944, 1408, 1, 128]
    - [3, 47.717]
  - - [448, 128, 1, 3328]
    - [20, 25.56]
  - - [64, 2944, 1, 3328]
    - [10, 51.107]
  - - [64, 4288, 1, 3328]
    - [20, 54.952]
  - - [5056, 6784, 1, 3328]
    - [7, 74.707]
  - - [128, 2944, 1, 256]
    - [2, 19.086]
  - - [128, 6784, 1, 128]
    - [3, 25.705]
  - - [3584, 4288, 1, 256]
    - [3, 66.676]
  - - [448, 1856, 1, 256]
    - [3, 42.928]
  - - [1856, 6784, 1, 3328]
    - [3, 73.469]
  - - [3584, 128, 1, 3328]
    - [20, 50.158]
  - - [64, 1856, 1, 256]
    - [0, 9.067]
  - - [1024, 448, 1, 1280]
    - [10, 42.409]
  - - [5888, 4288, 1, 256]
    - [3, 69.454]
  - - [4, 448, 1, 128]
    - [0, 0.077]
  - - [5056, 1408, 1, 256]
    - [2, 63.184]
  - - [64, 256, 1, 1280]
    - [6, 5.498]
  - - [3584, 1024, 1, 256]
    - [2, 66.914]
  - - [256, 704, 1, 256]
    - [16, 11.34]
  - - [5888, 5888, 1, 256]
    - [2, 69.647]
  - - [4288, 1024, 1, 1280]
    - [3, 67.566]
  - - [5888, 128, 1, 3328]
    - [4, 55.64]
  - - [448, 6784, 1, 3328]
    - [2, 67.531]
  - - [2944, 1408, 1, 1280]
    - [2, 64.821]
  - - [1024, 32, 1, 512]
    - [13, 5.084]
  - - [2944, 1856, 1, 3328]
    - [2, 82.274]
  - - [2368, 64, 1, 128]
    - [16, 6.064]
  - - [2944, 2944, 1, 128]
    - [2, 60.844]
  - - [4, 128, 1, 3328]
    - [14, 0.456]
  - - [3584, 5888, 1, 1280]
    - [8, 74.392]
  - - [64, 4, 1, 128]
    - [15, 0.011]
  - - [6784, 1856, 1, 1280]
    - [2, 69.676]
  - - [2944, 5056, 1, 256]
    - [3, 61.192]
  - - [2944, 5888, 1, 1280]
    - [8, 73.667]
  - - [5888, 256, 1, 3328]
    - [4, 60.215]
  - - [1856, 5888, 1, 3328]
    - [3, 71.079]
  - - [3584, 1408, 1, 256]
    - [3, 61.417]
  - - [704, 3584, 1, 3328]
    - [3, 65.144]
  - - [5056, 448, 1, 1280]
    - [3, 58.358]
  - - [3584, 1856, 1, 3328]
    - [3, 71.13]
  - - [64, 1408, 1, 128]
    - [0, 4.152]
  - - [1408, 704, 1, 1280]
    - [3, 48.542]
  - - [2944, 1024, 1, 256]
    - [3, 63.298]
  - - [1024, 2368, 1, 128]
    - [2, 44.028]
  - - [2368, 4288, 1, 3328]
    - [3, 72.32]
  - - [4, 1408, 1, 256]
    - [1, 0.461]
  - - [1024, 1408, 1, 1280]
    - [3, 67.466]
  - - [64, 64, 1, 256]
    - [21, 0.339]
  - - [704, 256, 1, 3328]
    - [26, 42.482]
  - - [6784, 5056, 1, 256]
    - [2, 70.094]
  - - [4, 4288, 1, 3328]
    - [15, 6.183]
  - - [448, 6784, 1, 128]
    - [3, 44.455]
  - - [4, 704, 1, 3328]
    - [22, 2.134]
  - - [448, 2944, 1, 256]
    - [2, 45.301]
  - - [2944, 6784, 1, 256]
    - [2, 84.578]
  - - [2368, 2368, 1, 1280]
    - [2, 66.006]
  - - [4, 4, 1, 1280]
    - [14, 0.006]
  - - [1856, 3584, 1, 1280]
    - [3, 70.579]
  - - [64, 2944, 1, 256]
    - [0, 12.294]
  - - [3584, 1408, 1, 1280]
    - [7, 65.833]
  - - [448, 256, 1, 128]
    - [0, 5.153]
  - - [4288, 448, 1, 128]
    - [2, 42.778]
  - - [5056, 256, 1, 1280]
    - [2, 60.363]
  - - [1856, 1408, 1, 3328]
    - [3, 68.515]
  - - [128, 128, 1, 128]
    - [13, 0.777]
  - - [1024, 4288, 1, 3328]
    - [5, 69.301]
  - - [448, 2368, 1, 256]
    - [2, 43.72]
  - - [1024, 4, 1, 128]
    - [23, 0.197]
  - - [5056, 448, 1, 256]
    - [32, 49.052]
  - - [2944, 2368, 1, 3328]
    - [2, 86.758]
  - - [704, 128, 1, 3328]
    - [26, 39.373]
  - - [64, 64, 1, 3328]
    - [14, 3.077]
  - - [1024, 1856, 1, 1280]
    - [3, 56.982]
  - - [6784, 1856, 1, 256]
    - [3, 66.069]
  - - [128, 2368, 1, 3328]
    - [4, 59.893]
  - - [1024, 5888, 1, 256]
    - [3, 59.986]
  - - [5056, 128, 1, 1280]
    - [4, 53.7]
  - - [5056, 64, 1, 3328]
    - [20, 49.319]
  - - [128, 704, 1, 128]
    - [0, 4.064]
  - - [1408, 2368, 1, 256]
    - [32, 64.393]
  - - [1408, 1408, 1, 256]
    - [2, 48.762]
  - - [4, 64, 1, 128]
    - [0, 0.011]
  - - [64, 128, 1, 1280]
    - [22, 3.496]
  - - [2368, 2368, 1, 128]
    - [3, 56.436]
  - - [64, 5888, 1, 128]
    - [17, 12.358]
  - - [5888, 4, 1, 3328]
    - [13, 9.077]
  - - [6784, 1408, 1, 128]
    - [2, 60.36]
  - - [4288, 5888, 1, 256]
    - [3, 66.824]
  - - [1408, 5056, 1, 256]
    - [2, 63.264]
  - - [5056, 128, 1, 3328]
    - [4, 55.431]
  - - [128, 128, 1, 1280]
    - [6, 6.039]
  - - [448, 704, 1, 256]
    - [16, 16.721]
  - - [4288, 3584, 1, 128]
    - [3, 62.046]
  - - [2944, 128, 1, 3328]
    - [4, 59.475]
  - - [128, 5056, 1, 1280]
    - [10, 53.81]
  - - [3584, 5056, 1, 1280]
    - [32, 69.838]
  - - [256, 448, 1, 1280]
    - [10, 23.601]
  - - [704, 704, 1, 128]
    - [2, 17.21]
  - - [5056, 4, 1, 128]
    - [30, 0.909]
  - - [704, 256, 1, 1280]
    - [10, 28.719]
  - - [64, 2368, 1, 3328]
    - [26, 46.741]
  - - [1856, 1024, 1, 128]
    - [3, 43.803]
  - - [1856, 64, 1, 128]
    - [16, 4.907]
  - - [64, 6784, 1, 1280]
    - [4, 39.656]
  - - [704, 4288, 1, 256]
    - [2, 63.054]
  - - [5888, 2368, 1, 1280]
    - [7, 71.628]
  - - [128, 256, 1, 256]
    - [13, 2.869]
  - - [256, 64, 1, 1280]
    - [1, 6.064]
  - - [2368, 5888, 1, 1280]
    - [7, 72.111]
  - - [5888, 256, 1, 1280]
    - [5, 56.457]
  - - [4, 5888, 1, 1280]
    - [15, 5.111]
  - - [704, 128, 1, 128]
    - [0, 4.181]
  - - [1024, 4, 1, 1280]
    - [23, 1.526]
  - - [2368, 1856, 1, 3328]
    - [2, 70.642]
  - - [2368, 128, 1, 128]
    - [16, 10.175]
  - - [2944, 704, 1, 256]
    - [2, 60.78]
  - - [5056, 128, 1, 128]
    - [2, 20.456]
  - - [256, 704, 1, 3328]
    - [20, 49.759]
  - - [704, 3584, 1, 256]
    - [2, 58.958]
  - - [1024, 1024, 1, 1024]
    - [3, 62.849]
  - - [704, 2944, 1, 3328]
    - [2, 64.1]
  - - [6784, 1024, 1, 128]
    - [2, 58.285]
  - - [256, 448, 1, 128]
    - [0, 4.764]
  - - [448, 1024, 1, 3328]
    - [4, 51.414]
  - - [2944, 1024, 1, 3328]
    - [2, 68.433]
  - - [2944, 5056, 1, 128]
    - [3, 62.03]
  - - [1408, 6784, 1, 256]
    - [3, 64.304]
  - - [6784, 1408, 1, 3328]
    - [5, 72.133]
  - - [4288, 6784, 1, 128]
    - [3, 66.469]
  - - [704, 64, 1, 256]
    - [0, 3.741]
  - - [5888, 4, 1, 1280]
    - [13, 6.11]
  - - [256, 2368, 1, 3328]
    - [10, 67.422]
  - - [6784, 2944, 1, 1280]
    - [2, 71.115]
  - - [4288, 1856, 1, 128]
    - [2, 60.291]
  - - [1856, 2944, 1, 128]
    - [3, 55.527]
  - - [6784, 448, 1, 128]
    - [2, 46.102]
  - - [64, 3584, 1, 128]
    - [16, 8.548]
  - - [448, 5056, 1, 1280]
    - [3, 58.373]
  - - [2368, 1856, 1, 128]
    - [2, 51.863]
  - - [128, 448, 1, 1280]
    - [28, 16.148]
  - - [4288, 704, 1, 256]
    - [3, 55.355]
  - - [256, 3584, 1, 128]
    - [2, 27.643]
  - - [5888, 704, 1, 256]
    - [3, 57.918]
  - - [3584, 1024, 1, 128]
    - [2, 53.576]
  - - [256, 5888, 1, 3328]
    - [10, 60.137]
  - - [1408, 4288, 1, 3328]
    - [3, 85.067]
  - - [6784, 4288, 1, 256]
    - [3, 69.07]
  - - [4288, 256, 1, 128]
    - [2, 31.325]
  - - [5888, 256, 1, 256]
    - [3, 52.853]
  - - [6784, 1024, 1, 1280]
    - [7, 67.503]
  - - [5888, 1024, 1, 128]
    - [2, 55.709]
  - - [1024, 128, 1, 256]
    - [0, 9.059]
  - - [128, 64, 1, 3328]
    - [22, 7.366]
  - - [448, 64, 1, 256]
    - [0, 2.387]
  - - [2368, 256, 1, 128]
    - [3, 20.315]
  - - [6784, 3584, 1, 1280]
    - [8, 73.494]
  - - [1024, 6784, 1, 1280]
    - [2, 67.283]
  - - [2944, 64, 1, 1280]
    - [10, 35.098]
  - - [1408, 2944, 1, 1280]
    - [3, 65.231]
  - - [256, 1856, 1, 256]
    - [2, 24.631]
  - - [1408, 2368, 1, 3328]
    - [2, 64.83]
  - - [2944, 4, 1, 3328]
    - [23, 7.415]
  - - [128, 1408, 1, 3328]
    - [4, 49.816]
  - - [2944, 1856, 1, 128]
    - [2, 62.994]
  - - [256, 2944, 1, 128]
    - [2, 22.128]
  - - [256, 6784, 1, 128]
    - [3, 40.555]
  - - [2368, 4, 1, 128]
    - [0, 0.41]
  - - [1408, 256, 1, 3328]
    - [37, 42.221]
  - - [1856, 4, 1, 128]
    - [13, 0.337]
  - - [1024, 16, 1, 512]
    - [13, 2.853]
  - - [5056, 6784, 1, 128]
    - [2, 60.403]
  - - [4288, 5056, 1, 128]
    - [2, 56.482]
  - - [1856, 5888, 1, 128]
    - [3, 58.592]
  - - [2944, 5888, 1, 256]
    - [2, 65.815]
  - - [3584, 1856, 1, 256]
    - [2, 62.611]
  - - [4288, 3584, 1, 1280]
    - [7, 70.851]
  - - [2368, 448, 1, 256]
    - [2, 43.322]
  - - [4288, 256, 1, 3328]
    - [4, 58.707]
  - - [1856, 704, 1, 128]
    - [2, 34.765]
  - - [1408, 64, 1, 256]
    - [0, 6.702]
  - - [64, 1856, 1, 128]
    - [0, 4.42]
  - - [4, 256, 1, 128]
    - [0, 0.04]
  - - [704, 4288, 1, 3328]
    - [3, 68.009]
  - - [704, 5888, 1, 128]
    - [3, 48.123]
  - - [6784, 3584, 1, 128]
    - [2, 62.619]
  - - [1024, 64, 1, 256]
    - [0, 5.416]
  - - [64, 2368, 1, 256]
    - [0, 10.732]
  - - [4288, 5056, 1, 3328]
    - [3, 73.054]
  - - [4, 1856, 1, 1280]
    - [1, 2.426]
  - - [4288, 128, 1, 128]
    - [2, 17.746]
  - - [1408, 1408, 1, 128]
    - [3, 43.97]
  - - [1024, 128, 1, 3328]
    - [4, 43.601]
  - - [1856, 128, 1, 128]
    - [16, 7.694]
  - - [5056, 2368, 1, 256]
    - [3, 61.306]
  - - [4288, 704, 1, 3328]
    - [3, 66.554]
  - - [448, 3584, 1, 256]
    - [3, 43.881]
  - - [64, 128, 1, 128]
    - [0, 0.382]
  - - [2368, 64, 1, 1280]
    - [4, 32.898]
  - - [2368, 1024, 1, 1280]
    - [3, 78.963]
  - - [2944, 1408, 1, 3328]
    - [3, 65.865]
  - - [1408, 448, 1, 256]
    - [2, 31.923]
  - - [1024, 1408, 1, 3328]
    - [4, 59.961]
  - - [2560, 7133, 1, 2560]
    - [3, 72.634]
  - - [1408, 4, 1, 1280]
    - [23, 2.075]
  - - [5888, 3584, 1, 256]
    - [8, 63.493]
  - - [128, 1024, 1, 1280]
    - [10, 29.44]
  - - [1408, 1856, 1, 3328]
    - [5, 65.069]
  - - [4, 4, 1, 3328]
    - [22, 0.014]
  - - [6784, 1408, 1, 1280]
    - [5, 70.194]
  - - [4, 1024, 1, 1280]
    - [6, 1.492]
  - - [704, 2944, 1, 256]
    - [3, 47.524]
  - - [704, 4288, 1, 128]
    - [3, 46.39]
  - - [2368, 4288, 1, 128]
    - [3, 62.169]
  - - [64, 4288, 1, 1280]
    - [10, 36.831]
  - - [6784, 64, 1, 1280]
    - [4, 41.46]
  - - [3584, 128, 1, 128]
    - [2, 15.624]
  - - [1024, 6784, 1, 128]
    - [2, 58.649]
  - - [4, 1856, 1, 128]
    - [0, 0.345]
  - - [1408, 64, 1, 3328]
    - [26, 39.376]
  - - [6784, 4, 1, 256]
    - [0, 1.911]
  - - [1408, 1408, 1, 1280]
    - [2, 74.886]
  - - [256, 2368, 1, 256]
    - [0, 23.653]
  - - [448, 4288, 1, 3328]
    - [4, 60.656]
  - - [2368, 1408, 1, 256]
    - [3, 68.736]
  - - [5888, 5056, 1, 128]
    - [3, 62.078]
  - - [704, 2368, 1, 256]
    - [3, 56.166]
  - - [2944, 448, 1, 1280]
    - [4, 51.155]
  - - [5888, 2368, 1, 3328]
    - [8, 73.751]
  - - [64, 2944, 1, 1280]
    - [4, 35.965]
  - - [448, 1856, 1, 1280]
    - [2, 68.307]
  - - [4288, 448, 1, 1280]
    - [3, 58.029]
  - - [5888, 704, 1, 3328]
    - [2, 67.209]
  - - [5056, 256, 1, 128]
    - [3, 35.385]
  - - [1856, 256, 1, 128]
    - [2, 16.105]
  - - [5056, 128, 1, 256]
    - [2, 34.228]
  - - [704, 4, 1, 256]
    - [0, 0.212]
  - - [1408, 5888, 1, 128]
    - [2, 59.979]
  - - [4288, 4, 1, 128]
    - [0, 0.772]
  - - [1408, 1024, 1, 256]
    - [2, 49.57]
  - - [1024, 1856, 1, 128]
    - [2, 44.217]
  - - [256, 704, 1, 128]
    - [16, 7.169]
  - - [256, 1024, 1, 128]
    - [30, 8.909]
  - - [448, 1024, 1, 256]
    - [3, 25.02]
  - - [128, 4, 1, 3328]
    - [22, 0.438]
  - - [5056, 6784, 1, 1280]
    - [8, 74.016]
  - - [704, 5056, 1, 3328]
    - [3, 70.705]
  - - [64, 1408, 1, 1280]
    - [4, 24.085]
  - - [3584, 5056, 1, 3328]
    - [3, 72.233]
  - - [1856, 4, 1, 3328]
    - [23, 5.506]
  - - [4, 2944, 1, 128]
    - [0, 0.532]
  - - [2368, 2944, 1, 3328]
    - [7, 70.18]
  - - [448, 448, 1, 1280]
    - [10, 37.658]
  - - [2368, 3584, 1, 256]
    - [2, 64.488]
  - - [1024, 256, 1, 1280]
    - [4, 32.746]
  - - [5056, 3584, 1, 1280]
    - [2, 72.131]
  - - [448, 4, 1, 3328]
    - [22, 1.684]
  - - [1856, 2944, 1, 1280]
    - [2, 64.682]
  - - [3584, 2368, 1, 1280]
    - [3, 67.671]
  - - [128, 1024, 1, 256]
    - [0, 9.403]
  - - [2944, 1408, 1, 256]
    - [2, 57.854]
  - - [4288, 1408, 1, 3328]
    - [2, 67.139]
  - - [3584, 64, 1, 3328]
    - [20, 55.747]
  - - [1408, 128, 1, 256]
    - [0, 11.999]
  - - [2944, 1024, 1, 128]
    - [2, 53.498]
  - - [4288, 5056, 1, 1280]
    - [3, 72.432]
  - - [5888, 6784, 1, 1280]
    - [8, 74.796]
  - - [6784, 5056, 1, 128]
    - [3, 63.359]
  - - [256, 1024, 1, 3328]
    - [10, 57.232]
  - - [3584, 4, 1, 256]
    - [23, 1.153]
  - - [1856, 64, 1, 3328]
    - [26, 42.302]
  - - [64, 6784, 1, 128]
    - [2, 14.773]
  - - [5888, 1408, 1, 3328]
    - [3, 70.896]
  - - [5888, 64, 1, 1280]
    - [4, 45.218]
  - - [256, 5056, 1, 256]
    - [2, 45.57]
  - - [128, 3584, 1, 128]
    - [2, 15.912]
  - - [448, 3584, 1, 3328]
    - [2, 62.305]
  - - [704, 2368, 1, 128]
    - [3, 43.361]
  - - [5888, 256, 1, 128]
    - [2, 38.781]
  - - [4, 5056, 1, 128]
    - [0, 0.869]
  - - [448, 256, 1, 256]
    - [0, 8.657]
  - - [704, 4, 1, 3328]
    - [22, 2.46]
  - - [1408, 256, 1, 256]
    - [3, 18.366]
  - - [3584, 1856, 1, 128]
    - [2, 58.87]
  - - [4288, 4288, 1, 128]
    - [3, 63.971]
  - - [1856, 1024, 1, 3328]
    - [4, 61.476]
  - - [128, 5888, 1, 3328]
    - [4, 55.361]
  - - [1024, 5056, 1, 256]
    - [3, 62.584]
  - - [2368, 1408, 1, 3328]
    - [2, 65.557]
  - - [5888, 448, 1, 256]
    - [3, 61.627]
  - - [5888, 6784, 1, 128]
    - [2, 62.747]
  - - [2368, 4, 1, 3328]
    - [23, 6.762]
  - - [6784, 5056, 1, 1280]
    - [5, 73.029]
  - - [5056, 704, 1, 1280]
    - [2, 68.018]
  - - [1408, 256, 1, 1280]
    - [10, 47.294]
  - - [4288, 6784, 1, 1280]
    - [2, 72.954]
  - - [128, 704, 1, 256]
    - [0, 5.241]
  - - [1024, 1024, 1, 128]
    - [3, 30.023]
  - - [448, 128, 1, 1280]
    - [10, 15.79]
  - - [6784, 4, 1, 3328]
    - [37, 8.656]
  - - [4288, 4, 1, 1280]
    - [13, 4.943]
  - - [1024, 64, 1, 3328]
    - [26, 34.077]
  - - [1856, 4, 1, 256]
    - [1, 0.653]
  - - [64, 3584, 1, 1280]
    - [34, 36.109]
  - - [6784, 1408, 1, 256]
    - [2, 64.121]
  - - [3584, 5888, 1, 128]
    - [3, 57.189]
  - - [5056, 5888, 1, 256]
    - [2, 66.672]
  - - [2368, 1024, 1, 256]
    - [3, 51.389]
  - - [2944, 1856, 1, 256]
    - [3, 59.253]
  - - [1856, 6784, 1, 1280]
    - [2, 71.227]
  - - [64, 5056, 1, 128]
    - [16, 11.26]
  - - [5888, 64, 1, 128]
    - [19, 12.138]
  - - [448, 704, 1, 128]
    - [0, 10.573]
  - - [4, 1024, 1, 128]
    - [0, 0.2]
  - - [4288, 3584, 1, 256]
    - [3, 63.544]
  - - [1408, 704, 1, 128]
    - [3, 28.604]
  - - [64, 256, 1, 3328]
    - [1, 12.225]
  - - [5056, 1856, 1, 1280]
    - [3, 69.124]
  - - [1408, 1024, 1, 3328]
    - [4, 60.217]
  - - [2368, 256, 1, 3328]
    - [4, 66.996]
  - - [5888, 3584, 1, 1280]
    - [7, 75.169]
  - - [1856, 3584, 1, 3328]
    - [3, 70.782]
  - - [5888, 128, 1, 1280]
    - [3, 62.179]
  - - [1024, 2944, 1, 256]
    - [3, 62.637]
  - - [448, 6784, 1, 1280]
    - [2, 66.465]
  - - [256, 3584, 1, 1280]
    - [10, 46.808]
  - - [448, 128, 1, 128]
    - [16, 2.468]
  - - [704, 5056, 1, 256]
    - [3, 57.302]
  - - [3584, 1024, 1, 3328]
    - [2, 84.579]
  - - [2944, 1856, 1, 1280]
    - [5, 79.2]
  - - [128, 256, 1, 128]
    - [0, 1.582]
  - - [5056, 256, 1, 256]
    - [2, 44.646]
  - - [2368, 3584, 1, 3328]
    - [2, 71.67]
  - - [2944, 704, 1, 1280]
    - [3, 60.783]
  - - [128, 4, 1, 256]
    - [35, 0.042]
  - - [2944, 3584, 1, 1280]
    - [3, 85.406]
  - - [1856, 5888, 1, 1280]
    - [2, 70.788]
  - - [256, 256, 1, 1280]
    - [29, 17.965]
  - - [5056, 448, 1, 3328]
    - [3, 76.881]
  - - [4288, 1408, 1, 256]
    - [3, 60.839]
  - - [3584, 64, 1, 256]
    - [16, 13.179]
  - - [64, 1856, 1, 3328]
    - [26, 40.566]
  - - [256, 1408, 1, 128]
    - [0, 11.972]
  - - [5888, 1408, 1, 128]
    - [2, 60.236]
  - - [4288, 2368, 1, 1280]
    - [3, 85.788]
  - - [4, 4288, 1, 256]
    - [0, 1.394]
  - - [256, 4288, 1, 128]
    - [2, 29.275]
  - - [256, 128, 1, 3328]
    - [26, 20.388]
  - - [6784, 2368, 1, 256]
    - [2, 67.755]
  - - [5888, 128, 1, 128]
    - [2, 24.784]
  - - [4288, 1856, 1, 256]
    - [3, 62.595]
  - - [1856, 256, 1, 3328]
    - [20, 63.203]
  - - [1856, 2944, 1, 256]
    - [2, 59.037]
  - - [5056, 1024, 1, 128]
    - [2, 54.764]
  - - [64, 5888, 1, 1280]
    - [4, 36.612]
  - - [1760, 7133, 1, 1760]
    - [2, 68.878]
  - - [6784, 256, 1, 128]
    - [2, 37.996]
  - - [5888, 704, 1, 128]
    - [3, 48.171]
  - - [6784, 64, 1, 128]
    - [2, 15.055]
  - - [1024, 4288, 1, 1280]
    - [2, 67.16]
  - - [2368, 5056, 1, 3328]
    - [2, 72.69]
  - - [448, 4, 1, 128]
    - [1, 0.087]
  - - [4, 256, 1, 3328]
    - [22, 0.942]
  - - [4288, 1024, 1, 3328]
    - [2, 70.395]
  - - [1024, 5056, 1, 3328]
    - [2, 83.632]
  - - [1024, 1856, 1, 3328]
    - [4, 60.856]
  - - [704, 704, 1, 1280]
    - [10, 42.103]
  - - [128, 2368, 1, 1280]
    - [10, 43.149]
  - - [1408, 128, 1, 3328]
    - [20, 51.531]
  - - [3584, 256, 1, 1280]
    - [4, 47.897]
  - - [4, 128, 1, 128]
    - [0, 0.023]
  - - [704, 6784, 1, 128]
    - [2, 54.496]
  - - [3584, 128, 1, 1280]
    - [4, 42.337]
  - - [4, 256, 1, 1280]
    - [22, 0.406]
  - - [128, 704, 1, 3328]
    - [10, 30.016]
  - - [4288, 6784, 1, 256]
    - [8, 68.237]
  - - [3584, 2944, 1, 3328]
    - [3, 86.601]
  - - [128, 1856, 1, 256]
    - [16, 13.731]
  - - [64, 4288, 1, 256]
    - [30, 15.234]
  - - [4, 3584, 1, 3328]
    - [22, 5.211]
  - - [64, 4, 1, 3328]
    - [14, 0.222]
  - - [4, 64, 1, 3328]
    - [14, 0.184]
  - - [5888, 2944, 1, 256]
    - [8, 64.383]
  - - [2368, 6784, 1, 128]
    - [2, 54.994]
  - - [448, 4288, 1, 1280]
    - [3, 72.846]
  - - [448, 1856, 1, 3328]
    - [3, 75.054]
  - - [4, 1024, 1, 256]
    - [9, 0.381]
  - - [5056, 4288, 1, 256]
    - [3, 65.446]
  - - [1024, 448, 1, 256]
    - [3, 22.852]
  - - [1024, 3584, 1, 256]
    - [2, 55.911]
  - - [2944, 128, 1, 1280]
    - [4, 39.823]
  - - [1856, 5056, 1, 128]
    - [2, 61.422]
  - - [64, 256, 1, 256]
    - [13, 1.467]
  - - [1408, 4, 1, 128]
    - [0, 0.277]
  - - [128, 2368, 1, 128]
    - [16, 10.92]
  - - [256, 704, 1, 1280]
    - [10, 34.516]
  - - [64, 2368, 1, 128]
    - [16, 6.274]
  - - [6784, 6784, 1, 3328]
    - [8, 77.306]
  - - [448, 5888, 1, 1280]
    - [3, 65.792]
  - - [5056, 448, 1, 128]
    - [2, 47.371]
  - - [3584, 2944, 1, 128]
    - [3, 59.17]
  - - [6784, 256, 1, 1280]
    - [3, 65.762]
  - - [256, 2944, 1, 1280]
    - [3, 51.199]
  - - [64, 4288, 1, 128]
    - [0, 9.718]
  - - [2368, 5888, 1, 3328]
    - [2, 87.985]
  - - [4, 64, 1, 256]
    - [25, 0.023]
  - - [704, 1024, 1, 3328]
    - [4, 56.925]
  - - [2368, 1856, 1, 1280]
    - [2, 68.638]
  - - [128, 448, 1, 128]
    - [0, 2.609]
  - - [128, 6784, 1, 256]
    - [2, 37.595]
  - - [3584, 4288, 1, 128]
    - [2, 57.722]
  - - [64, 448, 1, 128]
    - [0, 1.371]
  - - [5888, 4288, 1, 3328]
    - [5, 73.511]
  - - [2368, 704, 1, 256]
    - [32, 39.119]
  - - [256, 1856, 1, 3328]
    - [33, 46.16]
  - - [1856, 128, 1, 256]
    - [16, 13.648]
  - - [6784, 128, 1, 128]
    - [3, 25.446]
  - - [3584, 1408, 1, 128]
    - [2, 63.016]
  - - [1856, 5056, 1, 1280]
    - [3, 71.721]
  - - [2944, 1024, 1, 1280]
    - [3, 66.153]
  - - [5056, 4, 1, 256]
    - [13, 1.642]
  - - [3584, 5888, 1, 3328]
    - [8, 75.094]
  - - [2368, 4288, 1, 256]
    - [2, 64.527]
  - - [1024, 2368, 1, 3328]
    - [2, 63.286]
  - - [64, 704, 1, 3328]
    - [20, 22.433]
  - - [704, 1408, 1, 256]
    - [3, 37.413]
  - - [6784, 1856, 1, 3328]
    - [5, 74.135]
  - - [1024, 2944, 1, 128]
    - [2, 47.44]
  - - [1024, 3584, 1, 1280]
    - [3, 64.225]
  - - [4288, 5888, 1, 3328]
    - [8, 73.131]
  - - [4288, 4, 1, 3328]
    - [13, 7.99]
  - - [256, 1408, 1, 256]
    - [2, 18.347]
  - - [448, 2944, 1, 1280]
    - [3, 59.959]
  - - [4, 5888, 1, 128]
    - [0, 1.038]
  - - [1024, 2944, 1, 3328]
    - [3, 68.427]
  - - [3584, 6784, 1, 256]
    - [3, 84.856]
  - - [256, 6784, 1, 1280]
    - [3, 62.858]
  - - [1856, 3584, 1, 256]
    - [2, 62.691]
  - - [128, 448, 1, 3328]
    - [20, 27.811]
  - - [6784, 1856, 1, 128]
    - [2, 61.15]
  - - [4, 448, 1, 256]
    - [1, 0.166]
  - - [2944, 704, 1, 128]
    - [2, 43.729]
  - - [256, 5888, 1, 1280]
    - [32, 68.848]
  - - [4, 128, 1, 1280]
    - [14, 0.16]
  - - [4288, 6784, 1, 3328]
    - [8, 74.298]
  - - [6784, 128, 1, 1280]
    - [3, 55.603]
  - - [64, 1408, 1, 256]
    - [0, 7.509]
  - - [7680, 5481, 1, 2560]
    - [8, 75.911]
  - - [2368, 1408, 1, 128]
    - [3, 57.779]
  - - [1856, 448, 1, 256]
    - [2, 42.278]
  - - [1408, 1024, 1, 128]
    - [3, 36.751]
  - - [128, 64, 1, 128]
    - [0, 0.377]
  - - [6784, 3584, 1, 3328]
    - [7, 75.458]
  - - [2944, 64, 1, 3328]
    - [10, 51.288]
  - - [64, 64, 1, 128]
    - [0, 0.205]
  - - [2368, 5056, 1, 1280]
    - [2, 70.004]
  - - [64, 4, 1, 1280]
    - [14, 0.107]
  - - [1408, 2368, 1, 1280]
    - [5, 64.947]
  - - [128, 1408, 1, 1280]
    - [10, 34.482]
  - - [256, 64, 1, 3328]
    - [22, 12.72]
  - - [2944, 4288, 1, 128]
    - [2, 59.079]
  - - [2944, 2944, 1, 256]
    - [8, 63.871]
  - - [2944, 4, 1, 1280]
    - [13, 3.545]
  - - [5888, 4, 1, 256]
    - [0, 1.807]
  - - [6784, 256, 1, 256]
    - [2, 49.824]
  - - [256, 5056, 1, 3328]
    - [2, 64.479]
  - - [128, 4288, 1, 1280]
    - [10, 51.738]
  - - [5056, 1856, 1, 128]
    - [2, 61.813]
  - - [5888, 1408, 1, 256]
    - [2, 63.274]
  - - [128, 128, 1, 256]
    - [27, 1.311]
  - - [5056, 4, 1, 3328]
    - [13, 8.37]
  - - [4288, 3584, 1, 3328]
    - [2, 89.153]
  - - [448, 704, 1, 3328]
    - [20, 58.87]
  - - [448, 448, 1, 128]
    - [16, 7.916]
  - - [1024, 2368, 1, 1280]
    - [3, 61.26]
  - - [1856, 704, 1, 3328]
    - [2, 65.607]
  - - [4, 2368, 1, 128]
    - [0, 0.378]
  - - [5888, 6784, 1, 3328]
    - [8, 75.734]
  - - [704, 4288, 1, 1280]
    - [3, 65.814]
  - - [704, 256, 1, 256]
    - [19, 11.229]
  - - [6784, 448, 1, 3328]
    - [3, 67.704]
  - - [4288, 1024, 1, 128]
    - [3, 54.005]
- null
