library/src/blas3/Tensile/Logic/asm_full/aldebaran_104cu/aldebaran_Cijk_Alik_Bljk_BSS_BH.yaml
- {MinimumRequiredVersion: 4.32.1}
- aldebaran
- {Architecture: gfx90a, CUCount: 104}
- [Device 0050, Device 0051, Device 0052, Device 0054, Device 0062, Device 7400, Device
    SolutionIndex: 0
    SolutionNameMin: Cijk_Alik_Bljk_BSS_BH_MT128x96x64_MI32x32x8x1_SE_1LDSB1_AF0EM8_GRVW8_GSU1_LBSPP128_PLR9_SU0_SUS0_SRVW4_TT1_96_VAW2_WG128_2_1_WGM15
    SolutionIndex: 1
    SolutionNameMin: Cijk_Alik_Bljk_BSS_BH_MT128x96x64_MI32x32x8x1_SE_1LDSB1_AF0EM8_GRVW8_GSU1_LBSPP128_PLR9_SU32_SUS256_SRVW4_TT1_96_VAW2_WG128_2_1_WGM15
    SolutionIndex: 2
    SolutionNameMin: Cijk_Alik_Bljk_BSS_BH_MT128x96x64_MI32x32x8x1_SE_1LDSB1_AF0EM8_GRVW8_GSU1_LBSPP128_PLR9_SU0_SUS0_SRVW4_TT1_96_VAW2_WG128_2_1_WGM1
    SolutionIndex: 3
    SolutionNameMin: Cijk_Alik_Bljk_BSS_BH_MT96x96x64_MI16x16x16x1_SE_1LDSB1_AF0EM8_GRVW8_GSU1_LBSPP128_PLR5_SU32_SUS256_SRVW0_TT3_48_VAW2_WG32_8_1_WGM2
    SolutionIndex: 4
    SolutionNameMin: Cijk_Alik_Bljk_BSS_BH_MT64x32x64_MI16x16x16x1_SE_1LDSB1_AF0EM8_GRVW8_GSU1_LBSPP128_PLR5_SU0_SUS0_SRVW4_TT2_16_VAW2_WG32_8_1_WGM1
    SolutionIndex: 5
    SolutionNameMin: Cijk_Alik_Bljk_BSS_BH_MT128x96x64_MI32x32x8x1_SE_1LDSB1_AF0EM1_GRVW8_GSU1_LBSPP128_PLR9_SU0_SUS0_SRVW4_TT1_96_VAW2_WG128_2_1_WGM15
    SolutionIndex: 6
    SolutionNameMin: Cijk_Alik_Bljk_BSS_BH_MT128x96x64_MI32x32x8x1_SE_1LDSB1_AF0EM8_GRVW8_GSU1_LBSPP128_PLR9_SU32_SUS128_SRVW4_TT1_96_VAW2_WG128_2_1_WGM15
    SolutionIndex: 7
    SolutionNameMin: Cijk_Alik_Bljk_BSS_BH_MT32x64x64_MI16x16x16x1_SE_1LDSB0_AF0EM8_GRVW8_GSU1_LBSPP128_PLR5_SU32_SUS128_SRVW4_TT1_32_VAW2_WG32_8_1_WGM1
    SolutionIndex: 8
    SolutionNameMin: Cijk_Alik_Bljk_BSS_BH_MT64x128x64_MI32x32x8x1_SE_1LDSB1_AF0EM8_GRVW8_GSU1_LBSPP128_PLR9_SU32_SUS128_SRVW4_TT1_64_VAW2_WG64_4_1_WGM2
    SolutionIndex: 9
    SolutionNameMin: Cijk_Alik_Bljk_BSS_BH_MT64x64x64_MI32x32x8x1_SE_1LDSB1_AF0EM8_GRVW8_GSU1_LBSPP128_PLR9_SU0_SUS0_SRVW4_TT1_32_VAW2_WG64_4_1_WGM1
    SolutionIndex: 10
    SolutionNameMin: Cijk_Alik_Bljk_BSS_BH_MT64x32x64_MI16x16x16x1_SE_1LDSB1_AF0EM1_GRVW8_GSU1_LBSPP128_PLR5_SU0_SUS0_SRVW4_TT2_16_VAW2_WG32_8_1_WGM1
    SolutionIndex: 11
    SolutionNameMin: Cijk_Alik_Bljk_BSS_BH_MT16x16x128_MI16x16x16x1_SE_1LDSB1_AF0EM1_GRVW8_GSU1_LBSPP256_PLR9_SU32_SUS256_SRVW0_TT1_16_VAW2_WG16_4_1_WGM1
    SolutionIndex: 12
    SolutionNameMin: Cijk_Alik_Bljk_BSS_BH_MT16x16x128_MI16x16x16x1_SE_1LDSB1_AF0EM1_GRVW8_GSU1_LBSPP256_PLR9_SU0_SUS0_SRVW0_TT1_16_VAW2_WG16_4_1_WGM2
    SolutionIndex: 13
    SolutionNameMin: Cijk_Alik_Bljk_BSS_BH_MT64x64x64_MI32x32x8x1_SE_1LDSB1_AF0EM1_GRVW8_GSU1_LBSPP128_PLR9_SU0_SUS0_SRVW4_TT1_32_VAW2_WG64_4_1_WGM1
    SolutionIndex: 14
    SolutionNameMin: Cijk_Alik_Bljk_BSS_BH_MT64x64x64_MI32x32x8x1_SE_1LDSB1_AF0EM8_GRVW8_GSU1_LBSPP128_PLR9_SU0_SUS0_SRVW4_TT1_32_VAW2_WG64_4_1_WGM15
    SolutionIndex: 15
    SolutionNameMin: Cijk_Alik_Bljk_BSS_BH_MT64x32x32_MI16x16x16x1_SE_1LDSB1_AF0EM8_GRVW8_GSU1_LBSPP128_PLR2_SU0_SUS0_SRVW4_TT2_16_VAW2_WG32_8_1_WGM1
    SolutionIndex: 16
    SolutionNameMin: Cijk_Alik_Bljk_BSS_BH_MT16x16x128_MI16x16x16x1_SE_1LDSB1_AF0EM1_GRVW8_GSU1_LBSPP256_PLR9_SU0_SUS0_SRVW0_TT1_16_VAW2_WG16_4_1_WGM1
    SolutionIndex: 17
    SolutionNameMin: Cijk_Alik_Bljk_BSS_BH_MT64x64x64_MI32x32x8x1_SE_1LDSB1_AF0EM8_GRVW8_GSU1_LBSPP128_PLR9_SU32_SUS256_SRVW4_TT1_32_VAW2_WG64_4_1_WGM1
    SolutionIndex: 18
    SolutionNameMin: Cijk_Alik_Bljk_BSS_BH_MT96x128x64_MI32x32x8x1_SE_1LDSB1_AF0EM8_GRVW8_GSU1_LBSPP128_PLR9_SU32_SUS256_SRVW0_TT3_32_VAW2_WG32_8_1_WGM2
    SolutionIndex: 19
    SolutionNameMin: Cijk_Alik_Bljk_BSS_BH_MT64x128x64_MI32x32x8x1_SE_1LDSB1_AF0EM8_GRVW8_GSU1_LBSPP128_PLR9_SU32_SUS256_SRVW4_TT1_64_VAW2_WG64_4_1_WGM2
    SolutionIndex: 20
    SolutionNameMin: Cijk_Alik_Bljk_BSS_BH_MT16x16x128_MI16x16x16x1_SE_1LDSB0_AF0EM1_GRVW8_GSU1_LBSPP256_PLR9_SU0_SUS0_SRVW0_TT1_16_VAW2_WG16_4_1_WGM1
    SolutionIndex: 21
    SolutionNameMin: Cijk_Alik_Bljk_BSS_BH_MT128x96x64_MI32x32x8x1_SE_1LDSB1_AF0EM1_GRVW8_GSU1_LBSPP128_PLR9_SU32_SUS128_SRVW4_TT1_96_VAW2_WG128_2_1_WGM15
    SolutionIndex: 22
    SolutionNameMin: Cijk_Alik_Bljk_BSS_BH_MT16x16x128_MI16x16x16x1_SE_1LDSB0_AF0EM8_GRVW8_GSU1_LBSPP256_PLR9_SU0_SUS0_SRVW0_TT1_16_VAW2_WG16_4_1_WGM15
    SolutionIndex: 23
    SolutionNameMin: Cijk_Alik_Bljk_BSS_BH_MT64x64x64_MI32x32x8x1_SE_1LDSB1_AF0EM8_GRVW8_GSU1_LBSPP128_PLR9_SU32_SUS128_SRVW4_TT1_32_VAW2_WG64_4_1_WGM2
    SolutionIndex: 24
    SolutionNameMin: Cijk_Alik_Bljk_BSS_BH_MT128x160x64_MI32x32x8x1_SE_1LDSB1_AF0EM8_GRVW4_GSU1_LBSPP128_PLR9_SU32_SUS128_SRVW4_TT1_160_VAW2_WG128_2_1_WGM15
    SolutionIndex: 25
    SolutionNameMin: Cijk_Alik_Bljk_BSS_BH_MT128x96x64_MI32x32x8x1_SE_1LDSB1_AF0EM8_GRVW8_GSU1_LBSPP128_PLR9_SU0_SUS0_SRVW4_TT1_96_VAW2_WG128_2_1_WGM2
    SolutionIndex: 26
    SolutionNameMin: Cijk_Alik_Bljk_BSS_BH_MT128x96x64_MI32x32x8x1_SE_1LDSB1_AF0EM8_GRVW8_GSU1_LBSPP128_PLR9_SU32_SUS128_SRVW4_TT1_96_VAW2_WG128_2_1_WGM1
    SolutionIndex: 27
    SolutionNameMin: Cijk_Alik_Bljk_BSS_BH_MT128x128x64_MI32x32x8x1_SE_1LDSB1_AF0EM8_GRVW8_GSU1_LBSPP128_PLR9_SU0_SUS0_SRVW4_TT2_64_VAW2_WG64_4_1_WGM15
    SolutionIndex: 28
    SolutionNameMin: Cijk_Alik_Bljk_BSS_BH_MT16x16x128_MI16x16x16x1_SE_1LDSB0_AF0EM8_GRVW8_GSU1_LBSPP256_PLR9_SU32_SUS256_SRVW0_TT1_16_VAW2_WG16_4_1_WGM15
    SolutionIndex: 29
    SolutionNameMin: Cijk_Alik_Bljk_BSS_BH_MT16x16x128_MI16x16x16x1_SE_1LDSB1_AF0EM1_GRVW8_GSU1_LBSPP256_PLR9_SU0_SUS0_SRVW0_TT1_16_VAW2_WG16_4_1_WGM15
    SolutionIndex: 30
    SolutionNameMin: Cijk_Alik_Bljk_BSS_BH_MT128x96x64_MI32x32x8x1_SE_1LDSB0_AF0EM8_GRVW8_GSU1_LBSPP128_PLR9_SU0_SUS0_SRVW4_TT1_96_VAW2_WG128_2_1_WGM15
    SolutionIndex: 31
    SolutionNameMin: Cijk_Alik_Bljk_BSS_BH_MT16x16x128_MI16x16x16x1_SE_1LDSB0_AF0EM1_GRVW8_GSU1_LBSPP256_PLR9_SU0_SUS0_SRVW0_TT1_16_VAW2_WG16_4_1_WGM15
    SolutionIndex: 32
    SolutionNameMin: Cijk_Alik_Bljk_BSS_BH_MT128x96x64_MI32x32x8x1_SE_1LDSB1_AF0EM8_GRVW8_GSU1_LBSPP128_PLR9_SU32_SUS256_SRVW4_TT1_96_VAW2_WG128_2_1_WGM1
    SolutionIndex: 33
    SolutionNameMin: Cijk_Alik_Bljk_BSS_BH_MT64x64x64_MI32x32x8x1_SE_1LDSB1_AF0EM8_GRVW8_GSU1_LBSPP128_PLR9_SU0_SUS0_SRVW4_TT1_32_VAW2_WG64_4_1_WGM2
    SolutionIndex: 34
    SolutionNameMin: Cijk_Alik_Bljk_BSS_BH_MT128x144x32_MI16x16x16x1_SE_1LDSB1_AF0EM8_GRVW2_GSU1_LBSPP128_PLR2_SU0_SUS0_SRVW4_TT2_144_VAW2_WG64_4_1_WGM1
    SolutionIndex: 35
    SolutionNameMin: Cijk_Alik_Bljk_BSS_BH_MT16x16x128_MI16x16x16x1_SE_1LDSB1_AF0EM8_GRVW8_GSU1_LBSPP256_PLR9_SU0_SUS0_SRVW0_TT1_16_VAW2_WG16_4_1_WGM2
    SolutionIndex: 36
    SolutionNameMin: Cijk_Alik_Bljk_BSS_BH_MT128x160x64_MI32x32x8x1_SE_1LDSB1_AF0EM8_GRVW4_GSU1_LBSPP128_PLR9_SU0_SUS0_SRVW4_TT1_160_VAW2_WG128_2_1_WGM15
    SolutionIndex: 37
    SolutionNameMin: Cijk_Alik_Bljk_BSS_BH_MT128x96x64_MI32x32x8x1_SE_1LDSB1_AF0EM8_GRVW8_GSU1_LBSPP128_PLR9_SU32_SUS128_SRVW4_TT1_96_VAW2_WG128_2_1_WGM2
    SolutionIndex: 38
    SolutionNameMin: Cijk_Alik_Bljk_BSS_BH_MT64x128x64_MI32x32x8x1_SE_1LDSB1_AF0EM8_GRVW8_GSU1_LBSPP128_PLR9_SU0_SUS0_SRVW4_TT1_64_VAW2_WG64_4_1_WGM1
    SolutionIndex: 39
    SolutionNameMin: Cijk_Alik_Bljk_BSS_BH_MT64x128x64_MI32x32x8x1_SE_1LDSB1_AF0EM8_GRVW8_GSU1_LBSPP128_PLR9_SU32_SUS256_SRVW4_TT1_64_VAW2_WG64_4_1_WGM1
    SolutionIndex: 40
    SolutionNameMin: Cijk_Alik_Bljk_BSS_BH_MT128x160x64_MI32x32x8x1_SE_1LDSB1_AF0EM8_GRVW4_GSU1_LBSPP128_PLR9_SU32_SUS128_SRVW4_TT1_160_VAW2_WG128_2_1_WGM2
    SolutionIndex: 41
    SolutionNameMin: Cijk_Alik_Bljk_BSS_BH_MT128x96x64_MI32x32x8x1_SE_1LDSB1_AF0EM1_GRVW8_GSU1_LBSPP128_PLR9_SU0_SUS0_SRVW4_TT1_96_VAW2_WG128_2_1_WGM2
    SolutionIndex: 42
    SolutionNameMin: Cijk_Alik_Bljk_BSS_BH_MT32x32x32_MI16x16x16x1_SE_1LDSB1_AF0EM8_GRVW8_GSU1_LBSPP128_PLR2_SU0_SUS0_SRVW4_TT1_16_VAW2_WG32_8_1_WGM1
    SolutionIndex: 43
    SolutionNameMin: Cijk_Alik_Bljk_BSS_BH_MT32x32x32_MI16x16x16x1_SE_1LDSB1_AF0EM1_GRVW2_GSU1_LBSPP128_PLR2_SU0_SUS0_SRVW4_TT1_16_VAW2_WG32_8_1_WGM1
    SolutionIndex: 44
    SolutionNameMin: Cijk_Alik_Bljk_BSS_BH_MT32x64x32_MI16x16x16x1_SE_1LDSB1_AF0EM8_GRVW2_GSU1_LBSPP128_PLR2_SU0_SUS0_SRVW4_TT1_32_VAW2_WG32_8_1_WGM15
    SolutionIndex: 45
    SolutionNameMin: Cijk_Alik_Bljk_BSS_BH_MT16x16x32_MI16x16x16x1_SE_1LDSB1_AF0EM1_GRVW2_GSU1_LBSPP128_PLR2_SU0_SUS0_SRVW0_TT1_16_VAW2_WG16_4_1_WGM2
    SolutionIndex: 46
    SolutionNameMin: Cijk_Alik_Bljk_BSS_BH_MT16x16x64_MI16x16x16x1_SE_1LDSB0_AF0EM1_GRVW8_GSU1_LBSPP128_PLR5_SU0_SUS0_SRVW0_TT1_16_VAW2_WG16_4_1_WGM1
    SolutionIndex: 47
    SolutionNameMin: Cijk_Alik_Bljk_BSS_BH_MT16x16x32_MI16x16x16x1_SE_1LDSB0_AF0EM1_GRVW8_GSU1_LBSPP128_PLR2_SU0_SUS0_SRVW0_TT1_16_VAW2_WG16_4_1_WGM1
    SolutionIndex: 48
    SolutionNameMin: Cijk_Alik_Bljk_BSS_BH_MT16x16x128_MI16x16x16x1_SE_1LDSB0_AF0EM1_GRVW8_GSU1_LBSPP256_PLR9_SU0_SUS0_SRVW0_TT1_16_VAW2_WG16_4_1_WGM2
    SolutionIndex: 49
    SolutionNameMin: Cijk_Alik_Bljk_BSS_BH_MT64x128x64_MI32x32x8x1_SE_1LDSB1_AF0EM8_GRVW8_GSU1_LBSPP128_PLR9_SU0_SUS0_SRVW4_TT1_64_VAW2_WG64_4_1_WGM15
    SolutionIndex: 50
    SolutionNameMin: Cijk_Alik_Bljk_BSS_BH_MT16x16x128_MI16x16x16x1_SE_1LDSB1_AF0EM8_GRVW8_GSU1_LBSPP256_PLR9_SU32_SUS256_SRVW0_TT1_16_VAW2_WG16_4_1_WGM1
    SolutionIndex: 51
    SolutionNameMin: Cijk_Alik_Bljk_BSS_BH_MT64x64x64_MI32x32x8x1_SE_1LDSB1_AF0EM8_GRVW4_GSU1_LBSPP128_PLR9_SU0_SUS0_SRVW4_TT1_32_VAW2_WG64_4_1_WGM1
    SolutionIndex: 52
    SolutionNameMin: Cijk_Alik_Bljk_BSS_BH_MT128x160x32_MI32x32x8x1_SE_1LDSB1_AF0EM8_GRVW4_GSU1_LBSPP128_PLR5_SU0_SUS0_SRVW4_TT1_160_VAW2_WG128_2_1_WGM2
    SolutionIndex: 53
    SolutionNameMin: Cijk_Alik_Bljk_BSS_BH_MT64x64x32_MI32x32x8x1_SE_1LDSB1_AF0EM1_GRVW8_GSU1_LBSPP128_PLR5_SU0_SUS0_SRVW4_TT1_32_VAW2_WG64_4_1_WGM1
    SolutionIndex: 54
    SolutionNameMin: Cijk_Alik_Bljk_BSS_BH_MT64x128x64_MI32x32x8x1_SE_1LDSB1_AF0EM8_GRVW8_GSU1_LBSPP128_PLR9_SU0_SUS0_SRVW4_TT1_64_VAW2_WG64_4_1_WGM2
    SolutionIndex: 55
    SolutionNameMin: Cijk_Alik_Bljk_BSS_BH_MT64x128x32_MI32x32x8x1_SE_1LDSB1_AF0EM8_GRVW8_GSU1_LBSPP128_PLR5_SU0_SUS0_SRVW4_TT1_64_VAW2_WG64_4_1_WGM1
    SolutionIndex: 56
    SolutionNameMin: Cijk_Alik_Bljk_BSS_BH_MT64x64x64_MI32x32x8x1_SE_1LDSB1_AF0EM8_GRVW8_GSU1_LBSPP128_PLR9_SU32_SUS128_SRVW4_TT1_32_VAW2_WG64_4_1_WGM1
    SolutionIndex: 57
    SolutionNameMin: Cijk_Alik_Bljk_BSS_BH_MT128x160x32_MI32x32x8x1_SE_1LDSB1_AF0EM8_GRVW4_GSU1_LBSPP128_PLR5_SU32_SUS128_SRVW4_TT1_160_VAW2_WG128_2_1_WGM15
    SolutionIndex: 58
    SolutionNameMin: Cijk_Alik_Bljk_BSS_BH_MT160x128x64_MI32x32x8x1_SE_1LDSB1_AF0EM8_GRVW4_GSU1_LBSPP128_PLR9_SU0_SUS0_SRVW0_TT5_32_VAW2_WG32_8_1_WGM1
    SolutionIndex: 59
    SolutionNameMin: Cijk_Alik_Bljk_BSS_BH_MT96x128x64_MI32x32x8x1_SE_1LDSB1_AF0EM8_GRVW8_GSU1_LBSPP128_PLR9_SU0_SUS0_SRVW0_TT3_32_VAW2_WG32_8_1_WGM1
    SolutionIndex: 60
    SolutionNameMin: Cijk_Alik_Bljk_BSS_BH_MT128x128x64_MI32x32x8x1_SE_1LDSB1_AF0EM8_GRVW8_GSU1_LBSPP128_PLR9_SU32_SUS128_SRVW4_TT2_64_VAW2_WG64_4_1_WGM2
    SolutionIndex: 61
    SolutionNameMin: Cijk_Alik_Bljk_BSS_BH_MT64x32x32_MI16x16x16x1_SE_1LDSB1_AF0EM8_GRVW4_GSU1_LBSPP128_PLR2_SU0_SUS0_SRVW4_TT2_16_VAW2_WG32_8_1_WGM1
    SolutionIndex: 62
    SolutionNameMin: Cijk_Alik_Bljk_BSS_BH_MT16x16x128_MI16x16x16x1_SE_1LDSB0_AF0EM1_GRVW8_GSU1_LBSPP256_PLR9_SU32_SUS256_SRVW0_TT1_16_VAW2_WG16_4_1_WGM1
    SolutionIndex: 63
    SolutionNameMin: Cijk_Alik_Bljk_BSS_BH_MT32x32x32_MI16x16x16x1_SE_1LDSB1_AF0EM8_GRVW4_GSU1_LBSPP128_PLR2_SU0_SUS0_SRVW4_TT1_16_VAW2_WG32_8_1_WGM1
    SolutionIndex: 64
    SolutionNameMin: Cijk_Alik_Bljk_BSS_BH_MT32x64x64_MI16x16x16x1_SE_1LDSB1_AF0EM8_GRVW8_GSU1_LBSPP128_PLR5_SU32_SUS256_SRVW4_TT1_32_VAW2_WG32_8_1_WGM2
    SolutionIndex: 65
    SolutionNameMin: Cijk_Alik_Bljk_BSS_BH_MT16x16x64_MI16x16x16x1_SE_1LDSB0_AF0EM1_GRVW8_GSU1_LBSPP128_PLR5_SU0_SUS0_SRVW0_TT1_16_VAW2_WG16_4_1_WGM15
    SolutionIndex: 66
    SolutionNameMin: Cijk_Alik_Bljk_BSS_BH_MT32x32x64_MI16x16x16x1_SE_1LDSB0_AF0EM8_GRVW8_GSU1_LBSPP128_PLR5_SU32_SUS128_SRVW4_TT1_16_VAW2_WG32_8_1_WGM1
    SolutionIndex: 67
    SolutionNameMin: Cijk_Alik_Bljk_BSS_BH_MT128x128x64_MI32x32x8x1_SE_1LDSB1_AF0EM8_GRVW4_GSU3_LBSPP128_PLR9_SU32_SUS256_SRVW0_TT2_64_VAW1_WG64_4_1_WGM15
    SolutionIndex: 68
    SolutionNameMin: Cijk_Alik_Bljk_BSS_BH_MT128x128x64_MI32x32x8x1_SE_1LDSB1_AF0EM8_GRVW8_GSU1_LBSPP128_PLR9_SU32_SUS128_SRVW4_TT2_64_VAW2_WG64_4_1_WGM15
    SolutionIndex: 69
    SolutionNameMin: Cijk_Alik_Bljk_BSS_BH_MT128x128x64_MI32x32x8x1_SE_1LDSB1_AF0EM8_GRVW8_GSU1_LBSPP128_PLR9_SU0_SUS0_SRVW4_TT2_64_VAW2_WG64_4_1_WGM2
    SolutionIndex: 70
    SolutionNameMin: Cijk_Alik_Bljk_BSS_BH_MT128x128x64_MI32x32x8x1_SE_1LDSB1_AF0EM8_GRVW8_GSU1_LBSPP128_PLR9_SU32_SUS256_SRVW4_TT2_64_VAW2_WG64_4_1_WGM2
    SolutionIndex: 71
    SolutionNameMin: Cijk_Alik_Bljk_BSS_BH_MT128x256x64_MI32x32x8x1_SE_1LDSB1_AF0EM8_GRVW4_GSU1_LBSPP128_PLR9_SU32_SUS128_SRVW4_TT2_128_VAW2_WG64_4_1_WGM1
    SolutionIndex: 72
    SolutionNameMin: Cijk_Alik_Bljk_BSS_BH_MT64x64x64_MI32x32x8x1_SE_1LDSB1_AF0EM8_GRVW8_GSU3_LBSPP128_PLR9_SU0_SUS0_SRVW0_TT1_32_VAW1_WG64_4_1_WGM1
    SolutionIndex: 73
    SolutionNameMin: Cijk_Alik_Bljk_BSS_BH_MT64x64x64_MI32x32x8x1_SE_1LDSB1_AF0EM8_GRVW8_GSU2_LBSPP128_PLR9_SU32_SUS128_SRVW0_TT1_32_VAW1_WG64_4_1_WGM15
    SolutionIndex: 74
    SolutionNameMin: Cijk_Alik_Bljk_BSS_BH_MT64x64x64_MI32x32x8x1_SE_1LDSB1_AF0EM8_GRVW8_GSU1_LBSPP128_PLR9_SU32_SUS256_SRVW4_TT1_32_VAW2_WG64_4_1_WGM2
    SolutionIndex: 75
    SolutionNameMin: Cijk_Alik_Bljk_BSS_BH_MT128x128x64_MI32x32x8x1_SE_1LDSB1_AF0EM8_GRVW8_GSU1_LBSPP128_PLR9_SU32_SUS256_SRVW4_TT2_64_VAW2_WG64_4_1_WGM1
    SolutionIndex: 76
    SolutionNameMin: Cijk_Alik_Bljk_BSS_BH_MT256x160x64_MI32x32x8x1_SE_1LDSB1_AF0EM8_GRVW2_GSU1_LBSPP128_PLR9_SU0_SUS0_SRVW4_TT2_160_VAW2_WG128_2_1_WGM1
    SolutionIndex: 77
    SolutionNameMin: Cijk_Alik_Bljk_BSS_BH_MT160x256x64_MI32x32x8x1_SE_1LDSB1_AF0EM8_GRVW2_GSU1_LBSPP128_PLR9_SU0_SUS0_SRVW0_TT5_64_VAW2_WG32_8_1_WGM15
    SolutionIndex: 78
    SolutionNameMin: Cijk_Alik_Bljk_BSS_BH_MT128x96x64_MI32x32x8x1_SE_1LDSB1_AF0EM1_GRVW8_GSU1_LBSPP128_PLR9_SU32_SUS256_SRVW4_TT1_96_VAW2_WG128_2_1_WGM15
    SolutionIndex: 79
    SolutionNameMin: Cijk_Alik_Bljk_BSS_BH_MT128x160x32_MI32x32x8x1_SE_1LDSB1_AF0EM1_GRVW4_GSU1_LBSPP128_PLR5_SU32_SUS128_SRVW4_TT1_160_VAW2_WG128_2_1_WGM15
    SolutionIndex: 80
    SolutionNameMin: Cijk_Alik_Bljk_BSS_BH_MT16x16x32_MI16x16x16x1_SE_1LDSB1_AF0EM1_GRVW8_GSU1_LBSPP128_PLR2_SU0_SUS0_SRVW0_TT1_16_VAW2_WG16_4_1_WGM1
    SolutionIndex: 81
    SolutionNameMin: Cijk_Alik_Bljk_BSS_BH_MT32x32x32_MI16x16x16x1_SE_1LDSB1_AF0EM1_GRVW2_GSU1_LBSPP128_PLR2_SU0_SUS0_SRVW4_TT1_16_VAW2_WG32_8_1_WGM2
    SolutionIndex: 82
    SolutionNameMin: Cijk_Alik_Bljk_BSS_BH_MT32x32x64_MI16x16x16x1_SE_1LDSB0_AF0EM1_GRVW8_GSU15_LBSPP128_PLR5_SU0_SUS0_SRVW0_TT1_16_VAW1_WG32_8_1_WGM2
    SolutionIndex: 83
    SolutionNameMin: Cijk_Alik_Bljk_BSS_BH_MT32x32x64_MI16x16x16x1_SE_1LDSB0_AF0EM8_GRVW8_GSU1_LBSPP128_PLR5_SU0_SUS0_SRVW4_TT1_16_VAW2_WG32_8_1_WGM1
    SolutionIndex: 84
    SolutionNameMin: Cijk_Alik_Bljk_BSS_BH_MT32x32x64_MI16x16x16x1_SE_1LDSB0_AF0EM8_GRVW8_GSU1_LBSPP128_PLR5_SU0_SUS0_SRVW4_TT1_16_VAW2_WG32_8_1_WGM15
    SolutionIndex: 85
    SolutionNameMin: Cijk_Alik_Bljk_BSS_BH_MT32x64x64_MI16x16x16x1_SE_1LDSB1_AF0EM1_GRVW8_GSU1_LBSPP128_PLR5_SU0_SUS0_SRVW4_TT1_32_VAW2_WG32_8_1_WGM1
    SolutionIndex: 86
    SolutionNameMin: Cijk_Alik_Bljk_BSS_BH_MT16x16x128_MI16x16x16x1_SE_1LDSB1_AF0EM8_GRVW8_GSU1_LBSPP256_PLR9_SU0_SUS0_SRVW0_TT1_16_VAW2_WG16_4_1_WGM15
    SolutionIndex: 87
    SolutionNameMin: Cijk_Alik_Bljk_BSS_BH_MT64x64x64_MI32x32x8x1_SE_1LDSB1_AF0EM8_GRVW8_GSU1_LBSPP128_PLR9_SU32_SUS128_SRVW4_TT1_32_VAW2_WG64_4_1_WGM15
    SolutionIndex: 88
    SolutionNameMin: Cijk_Alik_Bljk_BSS_BH_MT32x64x64_MI16x16x16x1_SE_1LDSB1_AF0EM8_GRVW8_GSU1_LBSPP128_PLR5_SU0_SUS0_SRVW4_TT1_32_VAW2_WG32_8_1_WGM1
    SolutionIndex: 89
    SolutionNameMin: Cijk_Alik_Bljk_BSS_BH_MT64x32x64_MI16x16x16x1_SE_1LDSB1_AF0EM8_GRVW8_GSU1_LBSPP128_PLR5_SU32_SUS128_SRVW4_TT2_16_VAW2_WG32_8_1_WGM2
    SolutionIndex: 90
    SolutionNameMin: Cijk_Alik_Bljk_BSS_BH_MT128x96x64_MI32x32x8x1_SE_1LDSB0_AF0EM8_GRVW8_GSU1_LBSPP128_PLR9_SU0_SUS0_SRVW4_TT1_96_VAW2_WG128_2_1_WGM2
    SolutionIndex: 91
    SolutionNameMin: Cijk_Alik_Bljk_BSS_BH_MT64x64x64_MI32x32x8x1_SE_1LDSB0_AF0EM8_GRVW8_GSU1_LBSPP128_PLR9_SU32_SUS256_SRVW4_TT1_32_VAW2_WG64_4_1_WGM15
    SolutionIndex: 92
    SolutionNameMin: Cijk_Alik_Bljk_BSS_BH_MT128x256x64_MI32x32x8x1_SE_1LDSB1_AF0EM8_GRVW4_GSU1_LBSPP128_PLR9_SU32_SUS128_SRVW4_TT2_128_VAW2_WG64_4_1_WGM2
    SolutionIndex: 93
    SolutionNameMin: Cijk_Alik_Bljk_BSS_BH_MT128x128x64_MI32x32x8x1_SE_1LDSB1_AF0EM8_GRVW8_GSU1_LBSPP128_PLR9_SU32_SUS128_SRVW4_TT2_64_VAW2_WG64_4_1_WGM1
    SolutionIndex: 94
    SolutionNameMin: Cijk_Alik_Bljk_BSS_BH_MT128x256x32_MI32x32x8x1_SE_1LDSB1_AF0EM8_GRVW8_GSU1_LBSPP128_PLR5_SU0_SUS0_SRVW4_TT2_128_VAW2_WG64_4_1_WGM1
    SolutionIndex: 95
    SolutionNameMin: Cijk_Alik_Bljk_BSS_BH_MT128x96x64_MI32x32x8x1_SE_1LDSB1_AF0EM8_GRVW8_GSU1_LBSPP128_PLR9_SU32_SUS256_SRVW4_TT1_96_VAW2_WG128_2_1_WGM2
    SolutionIndex: 96
    SolutionNameMin: Cijk_Alik_Bljk_BSS_BH_MT16x16x128_MI16x16x16x1_SE_1LDSB0_AF0EM8_GRVW8_GSU1_LBSPP256_PLR9_SU0_SUS0_SRVW0_TT1_16_VAW2_WG16_4_1_WGM2
    SolutionIndex: 97
    SolutionNameMin: Cijk_Alik_Bljk_BSS_BH_MT32x32x32_MI16x16x16x1_SE_1LDSB0_AF0EM1_GRVW4_GSU1_LBSPP128_PLR2_SU0_SUS0_SRVW4_TT1_16_VAW2_WG32_8_1_WGM1
    SolutionIndex: 98
    SolutionNameMin: Cijk_Alik_Bljk_BSS_BH_MT32x32x32_MI16x16x16x1_SE_1LDSB1_AF0EM1_GRVW8_GSU1_LBSPP128_PLR2_SU0_SUS0_SRVW4_TT1_16_VAW2_WG32_8_1_WGM1
    SolutionIndex: 99
    SolutionNameMin: Cijk_Alik_Bljk_BSS_BH_MT32x32x32_MI16x16x16x1_SE_1LDSB0_AF0EM8_GRVW8_GSU1_LBSPP128_PLR2_SU0_SUS0_SRVW4_TT1_16_VAW2_WG32_8_1_WGM1
    SolutionIndex: 100
    SolutionNameMin: Cijk_Alik_Bljk_BSS_BH_MT32x64x32_MI16x16x16x1_SE_1LDSB0_AF0EM8_GRVW4_GSU1_LBSPP128_PLR2_SU0_SUS0_SRVW4_TT1_32_VAW2_WG32_8_1_WGM15
    SolutionIndex: 101
    SolutionNameMin: Cijk_Alik_Bljk_BSS_BH_MT32x32x32_MI16x16x16x1_SE_1LDSB1_AF0EM1_GRVW8_GSU1_LBSPP128_PLR2_SU0_SUS0_SRVW4_TT1_16_VAW2_WG32_8_1_WGM2
- - - [7680, 8192, 1, 8192]
    - [0, 78.081]
  - - [3840, 4096, 1, 4096]
    - [1, 72.781]
  - - [1920, 2048, 1, 2048]
    - [19, 59.384]
  - - [960, 1024, 1, 1024]
    - [13, 26.954]
  - - [480, 512, 1, 512]
    - [14, 4.834]
  - - [8192, 7680, 1, 8192]
    - [5, 75.799]
  - - [4096, 3840, 1, 4096]
    - [1, 72.861]
  - - [2048, 1920, 1, 2048]
    - [54, 59.34]
  - - [1024, 960, 1, 1024]
    - [56, 26.796]
  - - [512, 480, 1, 512]
    - [14, 4.742]
  - - [8192, 8192, 1, 8192]
    - [0, 74.888]
  - - [4096, 4096, 1, 4096]
    - [6, 71.841]
  - - [2048, 2048, 1, 2048]
    - [8, 57.435]
  - - [1024, 1024, 1, 1024]
    - [13, 28.364]
  - - [512, 512, 1, 512]
    - [13, 5.17]
  - - [512, 512, 16, 64]
    - [10, 9.334]
  - - [512, 512, 128, 64]
    - [4, 12.376]
  - - [1024, 1, 1, 1024]
    - [16, 0.043]
  - - [1024, 77, 1, 1024]
    - [11, 3.081]
  - - [1024, 512, 1, 1024]
    - [14, 16.047]
  - - [1024, 512, 1, 4096]
    - [14, 33.557]
  - - [4096, 512, 1, 1024]
    - [32, 38.351]
  - - [128, 128, 128, 64]
    - [10, 6.874]
  - - [128, 128, 160, 64]
    - [15, 7.715]
  - - [1024, 10, 1, 1024]
    - [35, 0.419]
  - - [1024, 200, 1, 1024]
    - [17, 10.99]
  - - [1024, 1280, 1, 1024]
    - [19, 30.96]
  - - [1024, 1280, 1, 4096]
    - [27, 53.077]
  - - [4096, 1280, 1, 1024]
    - [19, 51.39]
  - - [128, 128, 624, 64]
    - [10, 10.746]
  - - [1024, 39, 1, 1024]
    - [31, 1.664]
  - - [1024, 780, 1, 1024]
    - [9, 31.996]
  - - [1024, 4992, 1, 1024]
    - [33, 51.472]
  - - [1024, 4992, 1, 4096]
    - [5, 68.656]
  - - [4096, 4992, 1, 1024]
    - [21, 57.063]
  - - [512, 512, 64, 64]
    - [10, 11.779]
  - - [1024, 4, 1, 1024]
    - [96, 0.17]
  - - [1024, 308, 1, 1024]
    - [17, 10.305]
  - - [1024, 2048, 1, 1024]
    - [24, 39.033]
  - - [1024, 2048, 1, 4096]
    - [24, 61.059]
  - - [4096, 2048, 1, 1024]
    - [6, 51.698]
  - - [128, 128, 640, 64]
    - [10, 10.863]
  - - [1024, 40, 1, 1024]
    - [50, 1.769]
  - - [1024, 800, 1, 1024]
    - [14, 32.037]
  - - [1024, 5120, 1, 1024]
    - [9, 52.857]
  - - [1024, 5120, 1, 4096]
    - [0, 70.765]
  - - [4096, 5120, 1, 1024]
    - [6, 57.716]
  - - [128, 128, 656, 64]
    - [4, 10.779]
  - - [1024, 41, 1, 1024]
    - [96, 1.788]
  - - [1024, 820, 1, 1024]
    - [14, 23.801]
  - - [1024, 5248, 1, 1024]
    - [9, 52.584]
  - - [1024, 5248, 1, 4096]
    - [0, 71.799]
  - - [4096, 5248, 1, 1024]
    - [6, 58.352]
  - - [512, 512, 80, 64]
    - [4, 12.049]
  - - [1024, 5, 1, 1024]
    - [96, 0.215]
  - - [1024, 385, 1, 1024]
    - [74, 12.476]
  - - [1024, 2560, 1, 1024]
    - [74, 42.0]
  - - [1024, 2560, 1, 4096]
    - [87, 57.864]
  - - [4096, 2560, 1, 1024]
    - [6, 55.315]
  - - [512, 512, 96, 64]
    - [10, 12.162]
  - - [1024, 6, 1, 1024]
    - [62, 0.265]
  - - [1024, 462, 1, 1024]
    - [17, 19.775]
  - - [1024, 3072, 1, 1024]
    - [23, 46.708]
  - - [1024, 3072, 1, 4096]
    - [27, 60.893]
  - - [4096, 3072, 1, 1024]
    - [21, 54.492]
  - - [1024, 8, 1, 1024]
    - [86, 0.35]
  - - [1024, 160, 1, 1024]
    - [4, 5.835]
  - - [1024, 1024, 1, 4096]
    - [30, 47.674]
  - - [4096, 1024, 1, 1024]
    - [19, 48.78]
  - - [128, 128, 144, 64]
    - [4, 7.397]
  - - [1024, 9, 1, 1024]
    - [35, 0.389]
  - - [1024, 180, 1, 1024]
    - [74, 6.408]
  - - [1024, 1152, 1, 1024]
    - [14, 36.486]
  - - [1024, 1152, 1, 4096]
    - [18, 53.94]
  - - [4096, 1152, 1, 1024]
    - [32, 48.133]
  - - [128, 32768, 1, 256]
    - [33, 23.22]
  - - [256, 32768, 1, 512]
    - [33, 39.309]
  - - [512, 32768, 1, 13]
    - [15, 2.282]
  - - [512, 32768, 1, 1024]
    - [25, 57.265]
  - - [1024, 32768, 1, 479]
    - [34, 37.757]
  - - [1024, 32768, 1, 1024]
    - [6, 62.61]
  - - [32768, 1, 1, 256]
    - [50, 0.309]
  - - [64, 128, 512, 128]
    - [4, 11.93]
  - - [128, 128, 512, 64]
    - [4, 10.322]
  - - [1024, 32, 1, 1024]
    - [11, 1.357]
  - - [1024, 4096, 1, 1024]
    - [19, 49.681]
  - - [1024, 4096, 1, 4096]
    - [76, 72.682]
  - - [4096, 4096, 1, 1024]
    - [6, 56.596]
  - - [30528, 4096, 1, 1024]
    - [1, 62.324]
  - - [64, 512, 64, 512]
    - [14, 23.582]
  - - [30528, 2048, 1, 1024]
    - [6, 60.094]
  - - [1024, 8192, 1, 1024]
    - [6, 53.38]
  - - [1024, 8192, 1, 4096]
    - [37, 66.894]
  - - [1024, 9600, 1, 1024]
    - [8, 55.269]
  - - [1024, 9600, 1, 4096]
    - [38, 69.217]
  - - [4096, 8192, 1, 1024]
    - [6, 58.3]
  - - [4096, 9600, 1, 1024]
    - [6, 59.817]
  - - [33712, 8192, 1, 1024]
    - [6, 65.075]
  - - [33712, 9600, 1, 1024]
    - [21, 66.022]
  - - [1024, 10064, 1, 1024]
    - [37, 56.215]
  - - [1024, 10064, 1, 4096]
    - [25, 71.269]
  - - [1024, 10080, 1, 1024]
    - [6, 56.625]
  - - [1024, 10080, 1, 4096]
    - [37, 71.468]
  - - [1024, 10200, 1, 1024]
    - [38, 59.952]
  - - [1024, 10200, 1, 4096]
    - [37, 72.362]
  - - [1024, 3840, 1, 1024]
    - [38, 49.322]
  - - [1024, 3840, 1, 4096]
    - [76, 68.508]
  - - [1024, 3968, 1, 1024]
    - [39, 48.377]
  - - [1024, 3968, 1, 4096]
    - [40, 61.137]
  - - [1024, 6528, 1, 1024]
    - [54, 57.375]
  - - [1024, 6528, 1, 4096]
    - [37, 71.773]
  - - [1024, 7104, 1, 1024]
    - [6, 53.198]
  - - [1024, 7104, 1, 4096]
    - [25, 67.087]
  - - [1024, 7200, 1, 1024]
    - [21, 53.665]
  - - [1024, 7200, 1, 4096]
    - [37, 67.952]
  - - [1024, 8064, 1, 1024]
    - [21, 52.488]
  - - [1024, 8064, 1, 4096]
    - [21, 65.611]
  - - [1024, 8160, 1, 1024]
    - [6, 53.055]
  - - [1024, 8160, 1, 4096]
    - [41, 66.209]
  - - [1024, 9216, 1, 1024]
    - [2, 57.303]
  - - [1024, 9216, 1, 4096]
    - [37, 73.466]
  - - [1024, 9520, 1, 1024]
    - [6, 55.212]
  - - [1024, 9520, 1, 4096]
    - [25, 81.608]
  - - [4096, 10064, 1, 1024]
    - [1, 59.626]
  - - [4096, 10080, 1, 1024]
    - [21, 60.219]
  - - [4096, 10200, 1, 1024]
    - [6, 58.881]
  - - [4096, 3840, 1, 1024]
    - [6, 56.512]
  - - [4096, 3968, 1, 1024]
    - [6, 62.518]
  - - [4096, 6528, 1, 1024]
    - [21, 59.051]
  - - [4096, 7104, 1, 1024]
    - [21, 59.061]
  - - [4096, 7200, 1, 1024]
    - [6, 59.12]
  - - [4096, 8064, 1, 1024]
    - [21, 59.439]
  - - [4096, 8160, 1, 1024]
    - [21, 59.571]
  - - [4096, 9216, 1, 1024]
    - [6, 59.814]
  - - [4096, 9520, 1, 1024]
    - [6, 59.03]
  - - [42720, 10080, 1, 1024]
    - [6, 66.351]
  - - [42720, 3968, 1, 1024]
    - [6, 64.774]
  - - [42720, 6528, 1, 1024]
    - [21, 65.408]
  - - [42720, 7104, 1, 1024]
    - [21, 65.251]
  - - [42720, 7200, 1, 1024]
    - [6, 77.368]
  - - [42720, 9520, 1, 1024]
    - [21, 65.313]
  - - [24, 24, 4736, 64]
    - [42, 5.07]
  - - [32, 32, 4608, 64]
    - [43, 5.91]
  - - [32, 35, 4608, 64]
    - [44, 6.472]
  - - [64, 512, 1, 512]
    - [31, 1.524]
  - - [512, 512, 1, 64]
    - [10, 0.712]
  - - [128, 128, 1, 64]
    - [46, 0.128]
  - - [64, 128, 1, 128]
    - [47, 0.127]
  - - [2048, 512, 1, 2048]
    - [2, 42.823]
  - - [1024, 512, 1, 1600]
    - [9, 22.252]
  - - [2048, 512, 1, 74]
    - [61, 2.609]
  - - [512, 1, 1, 2048]
    - [35, 0.039]
  - - [64, 512, 1, 1024]
    - [50, 1.364]
  - - [1024, 1600, 1, 560]
    - [60, 21.057]
  - - [1600, 1, 1, 1024]
    - [50, 0.065]
  - - [512, 1600, 1, 512]
    - [19, 13.492]
  - - [1024, 1600, 1, 1024]
    - [69, 36.686]
  - - [32, 1600, 1, 512]
    - [48, 1.123]
  - - [64, 960, 1, 1024]
    - [50, 2.491]
  - - [200, 1, 1, 1024]
    - [50, 0.009]
  - - [256, 684, 1, 1024]
    - [33, 5.95]
  - - [256, 1280, 1, 1024]
    - [14, 10.812]
  - - [256, 1536, 1, 1024]
    - [17, 12.651]
  - - [256, 2304, 1, 1024]
    - [9, 17.591]
  - - [256, 2560, 1, 1024]
    - [9, 19.233]
  - - [256, 2816, 1, 1024]
    - [9, 20.443]
  - - [256, 3328, 1, 1024]
    - [38, 23.321]
  - - [256, 3584, 1, 1024]
    - [33, 29.817]
  - - [256, 4608, 1, 1024]
    - [2, 30.695]
  - - [256, 4864, 1, 1024]
    - [37, 31.777]
  - - [256, 5376, 1, 1024]
    - [38, 30.862]
  - - [256, 5888, 1, 1024]
    - [38, 39.078]
  - - [256, 6144, 1, 1024]
    - [38, 40.595]
  - - [256, 6400, 1, 1024]
    - [38, 41.819]
  - - [256, 6656, 1, 1024]
    - [69, 37.9]
  - - [256, 7168, 1, 1024]
    - [14, 38.422]
  - - [256, 7424, 1, 1024]
    - [14, 39.084]
  - - [256, 7936, 1, 1024]
    - [13, 40.273]
  - - [256, 8192, 1, 1024]
    - [36, 39.909]
  - - [256, 8448, 1, 1024]
    - [41, 38.576]
  - - [256, 8960, 1, 1024]
    - [2, 44.401]
  - - [256, 9984, 1, 1024]
    - [2, 47.637]
  - - [256, 10496, 1, 1024]
    - [33, 41.003]
  - - [256, 11264, 1, 1024]
    - [33, 42.706]
  - - [256, 11520, 1, 1024]
    - [14, 43.508]
  - - [256, 11776, 1, 1024]
    - [9, 43.97]
  - - [256, 12544, 1, 1024]
    - [38, 44.885]
  - - [256, 13312, 1, 1024]
    - [37, 45.733]
  - - [256, 14336, 1, 1024]
    - [2, 49.006]
  - - [256, 14592, 1, 1024]
    - [2, 49.197]
  - - [256, 14848, 1, 1024]
    - [2, 49.495]
  - - [256, 15104, 1, 1024]
    - [9, 45.421]
  - - [256, 16128, 1, 1024]
    - [38, 46.745]
  - - [256, 18176, 1, 1024]
    - [2, 48.275]
  - - [256, 18944, 1, 1024]
    - [2, 50.089]
  - - [256, 19200, 1, 1024]
    - [2, 50.138]
  - - [256, 20480, 1, 1024]
    - [2, 53.012]
  - - [256, 20992, 1, 1024]
    - [2, 52.81]
  - - [256, 21248, 1, 1024]
    - [14, 47.184]
  - - [256, 21504, 1, 1024]
    - [2, 47.22]
  - - [256, 22016, 1, 1024]
    - [14, 47.532]
  - - [256, 22344, 1, 1024]
    - [9, 48.134]
  - - [256, 23296, 1, 1024]
    - [26, 49.18]
  - - [256, 23552, 1, 1024]
    - [2, 50.224]
  - - [256, 31488, 1, 1024]
    - [25, 53.974]
  - - [256, 33536, 1, 1024]
    - [2, 51.668]
  - - [256, 44505, 1, 1024]
    - [26, 52.873]
  - - [960, 1, 1, 2048]
    - [31, 0.07]
  - - [1024, 200, 1, 560]
    - [4, 3.967]
  - - [1024, 960, 1, 1600]
    - [9, 35.082]
  - - [1024, 32768, 1, 480]
    - [52, 47.79]
  - - [1280, 8976, 1, 256]
    - [9, 31.057]
  - - [1792, 8976, 1, 256]
    - [9, 32.284]
  - - [2048, 114, 1, 512]
    - [74, 4.518]
  - - [2048, 114, 1, 768]
    - [7, 6.266]
  - - [2048, 215, 1, 512]
    - [17, 8.244]
  - - [2048, 215, 1, 768]
    - [9, 11.239]
  - - [2048, 256, 1, 512]
    - [74, 9.869]
  - - [2048, 256, 1, 768]
    - [17, 13.049]
  - - [2048, 512, 1, 67]
    - [53, 2.428]
  - - [2048, 512, 1, 100]
    - [55, 3.461]
  - - [2048, 684, 1, 512]
    - [33, 19.474]
  - - [2048, 684, 1, 768]
    - [38, 27.958]
  - - [2048, 960, 1, 74]
    - [44, 3.866]
  - - [2048, 960, 1, 2048]
    - [24, 51.086]
  - - [2048, 1536, 1, 512]
    - [56, 35.721]
  - - [2048, 1536, 1, 768]
    - [33, 43.136]
  - - [2048, 8976, 1, 256]
    - [9, 32.153]
  - - [2304, 8976, 1, 256]
    - [9, 33.23]
  - - [2560, 8976, 1, 256]
    - [9, 33.254]
  - - [2816, 8976, 1, 256]
    - [9, 33.58]
  - - [3072, 8976, 1, 256]
    - [9, 33.685]
  - - [3328, 8976, 1, 256]
    - [9, 33.695]
  - - [3840, 8976, 1, 256]
    - [9, 34.034]
  - - [4096, 8976, 1, 256]
    - [23, 33.346]
  - - [4352, 8976, 1, 256]
    - [9, 34.028]
  - - [4608, 8976, 1, 256]
    - [9, 33.576]
  - - [4864, 8976, 1, 256]
    - [9, 33.348]
  - - [5120, 8976, 1, 256]
    - [9, 33.188]
  - - [5376, 8976, 1, 256]
    - [9, 32.996]
  - - [5632, 8976, 1, 256]
    - [9, 32.854]
  - - [5888, 8976, 1, 256]
    - [9, 32.62]
  - - [6144, 8976, 1, 256]
    - [9, 32.199]
  - - [6400, 8976, 1, 256]
    - [34, 31.686]
  - - [7168, 8976, 1, 256]
    - [34, 31.022]
  - - [7936, 8976, 1, 256]
    - [34, 30.596]
  - - [8192, 8976, 1, 256]
    - [2, 32.463]
  - - [8448, 8976, 1, 256]
    - [6, 32.906]
  - - [8960, 8976, 1, 256]
    - [57, 30.39]
  - - [9472, 8976, 1, 256]
    - [57, 30.125]
  - - [9728, 8976, 1, 256]
    - [57, 29.953]
  - - [9984, 8976, 1, 256]
    - [57, 30.174]
  - - [10240, 8976, 1, 256]
    - [6, 30.531]
  - - [10496, 8976, 1, 256]
    - [57, 30.105]
  - - [11264, 8976, 1, 256]
    - [57, 30.231]
  - - [11776, 8976, 1, 256]
    - [6, 29.866]
  - - [12544, 8976, 1, 256]
    - [57, 29.323]
  - - [13312, 8976, 1, 256]
    - [57, 30.626]
  - - [13568, 8976, 1, 256]
    - [6, 30.299]
  - - [13824, 8976, 1, 256]
    - [57, 30.311]
  - - [15104, 8976, 1, 256]
    - [57, 30.556]
  - - [15360, 8976, 1, 256]
    - [57, 29.594]
  - - [15872, 8976, 1, 256]
    - [57, 30.066]
  - - [16128, 8976, 1, 256]
    - [57, 30.997]
  - - [17152, 8976, 1, 256]
    - [57, 30.544]
  - - [18176, 8976, 1, 256]
    - [57, 30.773]
  - - [18688, 8976, 1, 256]
    - [57, 30.787]
  - - [18944, 8976, 1, 256]
    - [57, 30.272]
  - - [19712, 8976, 1, 256]
    - [57, 31.002]
  - - [19968, 8976, 1, 256]
    - [57, 30.466]
  - - [20480, 8976, 1, 256]
    - [52, 26.951]
  - - [20992, 8976, 1, 256]
    - [57, 30.54]
  - - [21248, 8976, 1, 256]
    - [57, 30.741]
  - - [23552, 8976, 1, 256]
    - [57, 30.873]
  - - [28672, 8976, 1, 256]
    - [52, 26.796]
  - - [31488, 8976, 1, 256]
    - [57, 30.628]
  - - [33536, 8976, 1, 256]
    - [6, 30.944]
  - - [2048, 1024, 1, 2048]
    - [58, 50.99]
  - - [2048, 1024, 1, 8192]
    - [58, 64.996]
  - - [2048, 2, 1, 2048]
    - [20, 0.294]
  - - [30592, 1024, 1, 2048]
    - [6, 69.415]
  - - [6144, 1024, 1, 2048]
    - [6, 62.573]
  - - [8192, 1024, 1, 2048]
    - [19, 58.654]
  - - [1024, 16, 1, 1024]
    - [62, 0.708]
  - - [30592, 8192, 1, 1024]
    - [21, 63.653]
  - - [3072, 8192, 1, 1024]
    - [6, 59.691]
  - - [512, 512, 256, 64]
    - [4, 12.727]
  - - [64, 512, 256, 512]
    - [54, 28.248]
  - - [30592, 2048, 1, 1024]
    - [1, 60.295]
  - - [3072, 2048, 1, 1024]
    - [39, 53.175]
  - - [30592, 4096, 1, 1024]
    - [1, 62.851]
  - - [3072, 4096, 1, 1024]
    - [6, 55.599]
  - - [64, 512, 128, 512]
    - [38, 24.969]
  - - [1920, 2048, 1, 2560]
    - [8, 61.068]
  - - [2560, 2048, 1, 2560]
    - [6, 65.236]
  - - [2560, 2048, 1, 640]
    - [9, 42.389]
  - - [2560, 4, 1, 2560]
    - [20, 0.869]
  - - [7680, 2048, 1, 2560]
    - [6, 69.175]
  - - [512, 512, 40, 64]
    - [4, 10.039]
  - - [64, 512, 40, 512]
    - [17, 22.774]
  - - [1536, 4096, 1, 1536]
    - [38, 60.438]
  - - [1536, 4096, 1, 6144]
    - [59, 76.361]
  - - [4608, 4096, 1, 1536]
    - [6, 62.971]
  - - [50304, 4096, 1, 1536]
    - [6, 69.557]
  - - [6144, 4096, 1, 1536]
    - [6, 66.226]
  - - [1024, 1024, 64, 96]
    - [34, 16.403]
  - - [96, 1024, 64, 1024]
    - [59, 41.596]
  - - [1536, 8192, 1, 1536]
    - [6, 61.756]
  - - [1536, 8192, 1, 6144]
    - [60, 72.632]
  - - [4608, 8192, 1, 1536]
    - [6, 65.713]
  - - [50304, 8192, 1, 1536]
    - [6, 70.214]
  - - [6144, 8192, 1, 1536]
    - [6, 67.931]
  - - [1024, 1024, 128, 96]
    - [34, 16.68]
  - - [96, 1024, 128, 1024]
    - [18, 42.274]
  - - [1024, 16384, 1, 1024]
    - [6, 59.102]
  - - [1024, 16384, 1, 4096]
    - [37, 72.48]
  - - [3072, 16384, 1, 1024]
    - [1, 62.284]
  - - [4096, 16384, 1, 1024]
    - [6, 61.001]
  - - [50304, 16384, 1, 1024]
    - [6, 63.823]
  - - [1024, 1024, 256, 64]
    - [4, 12.697]
  - - [64, 1024, 256, 1024]
    - [49, 34.838]
  - - [50304, 2048, 1, 1024]
    - [1, 61.121]
  - - [1024, 1024, 32, 64]
    - [10, 12.17]
  - - [64, 1024, 32, 1024]
    - [33, 30.434]
  - - [50304, 4096, 1, 1024]
    - [6, 62.706]
  - - [1024, 1024, 64, 64]
    - [4, 12.455]
  - - [64, 1024, 64, 1024]
    - [8, 31.689]
  - - [50304, 8192, 1, 1024]
    - [6, 63.431]
  - - [1024, 1024, 128, 64]
    - [10, 12.661]
  - - [64, 1024, 128, 1024]
    - [54, 35.308]
  - - [1024, 64, 1, 1024]
    - [16, 2.825]
  - - [30528, 8192, 1, 1024]
    - [1, 63.54]
  - - [128, 128, 1024, 64]
    - [10, 11.295]
  - - [64, 128, 1024, 128]
    - [33, 12.681]
  - - [1024, 3456, 1, 1024]
    - [41, 49.014]
  - - [1024, 3456, 1, 480]
    - [34, 31.634]
  - - [1024, 4096, 1, 480]
    - [52, 34.843]
  - - [1024, 6912, 1, 1024]
    - [19, 53.864]
  - - [1024, 6912, 1, 480]
    - [34, 37.563]
  - - [1024, 864, 1, 1024]
    - [3, 31.31]
  - - [1024, 864, 1, 480]
    - [55, 17.787]
  - - [128, 3456, 1, 256]
    - [23, 4.399]
  - - [128, 4096, 1, 256]
    - [9, 5.263]
  - - [128, 55296, 1, 256]
    - [9, 25.11]
  - - [128, 6912, 1, 256]
    - [13, 7.978]
  - - [128, 864, 1, 256]
    - [56, 1.266]
  - - [256, 3456, 1, 512]
    - [13, 14.432]
  - - [256, 4096, 1, 512]
    - [9, 16.746]
  - - [256, 55296, 1, 512]
    - [2, 42.07]
  - - [256, 6912, 1, 512]
    - [13, 23.393]
  - - [256, 864, 1, 512]
    - [17, 4.421]
  - - [3456, 1, 1, 256]
    - [4, 0.04]
  - - [4096, 1, 1, 256]
    - [35, 0.049]
  - - [512, 3456, 1, 1024]
    - [33, 35.254]
  - - [512, 3456, 1, 13]
    - [61, 0.744]
  - - [512, 4096, 1, 1024]
    - [14, 42.747]
  - - [512, 4096, 1, 13]
    - [61, 0.85]
  - - [512, 55296, 1, 13]
    - [61, 2.4]
  - - [512, 6912, 1, 1024]
    - [2, 48.813]
  - - [512, 6912, 1, 13]
    - [15, 1.635]
  - - [512, 864, 1, 1024]
    - [9, 14.076]
  - - [512, 864, 1, 13]
    - [97, 0.234]
  - - [6912, 1, 1, 256]
    - [50, 0.08]
  - - [864, 1, 1, 256]
    - [20, 0.011]
  - - [30528, 640, 1, 1024]
    - [6, 54.289]
  - - [30528, 1280, 1, 1024]
    - [6, 59.38]
  - - [30528, 1600, 1, 1024]
    - [6, 58.743]
  - - [1024, 10240, 1, 1024]
    - [37, 57.009]
  - - [1024, 80, 1, 1024]
    - [35, 3.328]
  - - [4096, 10240, 1, 1024]
    - [6, 59.63]
  - - [1024, 10240, 1, 4096]
    - [37, 72.331]
  - - [64, 128, 1280, 128]
    - [13, 12.891]
  - - [128, 128, 1280, 64]
    - [4, 11.588]
  - - [1024, 10496, 1, 4096]
    - [37, 73.885]
  - - [30528, 1640, 1, 1024]
    - [1, 58.022]
  - - [1024, 82, 1, 1024]
    - [29, 3.455]
  - - [4096, 10496, 1, 1024]
    - [6, 60.164]
  - - [1024, 10496, 1, 1024]
    - [37, 57.835]
  - - [64, 128, 1312, 128]
    - [10, 12.895]
  - - [128, 128, 1312, 64]
    - [4, 11.567]
  - - [30528, 160, 1, 1024]
    - [1, 40.251]
  - - [1024, 12, 1, 1024]
    - [28, 0.506]
  - - [30528, 240, 1, 1024]
    - [8, 47.541]
  - - [1024, 6144, 1, 1024]
    - [26, 57.064]
  - - [4096, 6144, 1, 1024]
    - [6, 58.465]
  - - [1024, 6144, 1, 4096]
    - [26, 79.347]
  - - [64, 512, 192, 512]
    - [49, 27.043]
  - - [512, 512, 192, 64]
    - [4, 12.659]
  - - [1024, 10224, 1, 1024]
    - [37, 56.947]
  - - [1024, 10192, 1, 1024]
    - [37, 56.903]
  - - [1024, 10208, 1, 1024]
    - [2, 56.777]
  - - [1024, 10224, 1, 4096]
    - [37, 72.337]
  - - [4096, 10224, 1, 1024]
    - [6, 67.402]
  - - [3072, 10224, 1, 1024]
    - [1, 60.302]
  - - [3072, 10240, 1, 1024]
    - [6, 60.426]
  - - [1024, 10192, 1, 4096]
    - [37, 72.403]
  - - [4096, 10192, 1, 1024]
    - [6, 59.755]
  - - [3072, 10192, 1, 1024]
    - [1, 60.123]
  - - [3072, 10200, 1, 1024]
    - [6, 60.472]
  - - [1024, 10184, 1, 1024]
    - [6, 57.02]
  - - [3072, 10208, 1, 1024]
    - [1, 59.849]
  - - [1024, 10208, 1, 4096]
    - [25, 72.528]
  - - [4096, 10208, 1, 1024]
    - [1, 59.057]
  - - [2048, 10224, 1, 1024]
    - [6, 60.483]
  - - [2048, 10240, 1, 1024]
    - [6, 60.852]
  - - [1024, 10120, 1, 1024]
    - [6, 56.208]
  - - [2048, 10192, 1, 1024]
    - [6, 60.536]
  - - [24, 24, 6816, 64]
    - [42, 5.562]
  - - [1024, 10152, 1, 1024]
    - [37, 56.36]
  - - [3072, 10080, 1, 1024]
    - [21, 61.121]
  - - [1024, 2048, 1, 49]
    - [55, 2.925]
  - - [1024, 256, 1, 196]
    - [101, 2.017]
  - - [1024, 512, 1, 196]
    - [61, 3.637]
  - - [1152, 128, 1, 784]
    - [4, 3.873]
  - - [128, 512, 1, 784]
    - [84, 1.838]
  - - [2048, 512, 1, 49]
    - [53, 1.847]
  - - [2304, 256, 1, 196]
    - [53, 4.1]
  - - [256, 1024, 1, 196]
    - [43, 1.966]
  - - [256, 128, 1, 3136]
    - [16, 2.777]
  - - [256, 512, 1, 784]
    - [4, 3.454]
  - - [256, 64, 1, 3136]
    - [50, 1.419]
  - - [4608, 512, 1, 49]
    - [55, 4.668]
  - - [512, 1024, 1, 196]
    - [61, 3.643]
  - - [512, 128, 1, 784]
    - [66, 2.938]
  - - [512, 2048, 1, 49]
    - [53, 1.808]
  - - [512, 256, 1, 784]
    - [89, 3.485]
  - - [576, 64, 1, 3136]
    - [35, 3.163]
  - - [64, 256, 1, 3136]
    - [72, 1.436]
  - - [64, 64, 1, 3136]
    - [72, 0.374]
  - - [128, 128, 49, 12800]
    - [13, 41.993]
  - - [128, 128, 25, 25088]
    - [67, 40.197]
  - - [128, 128, 49, 25600]
    - [51, 41.084]
  - - [128, 128, 25, 50176]
    - [67, 35.179]
  - - [256, 256, 25, 12544]
    - [27, 66.404]
  - - [256, 256, 49, 3200]
    - [68, 56.669]
  - - [256, 256, 25, 6272]
    - [27, 63.058]
  - - [256, 256, 49, 6400]
    - [69, 62.564]
  - - [512, 512, 49, 1152]
    - [2, 52.675]
  - - [512, 512, 25, 2048]
    - [49, 57.694]
  - - [512, 512, 49, 2304]
    - [25, 60.901]
  - - [512, 512, 25, 4096]
    - [27, 64.389]
  - - [64, 128, 2048, 128]
    - [17, 13.236]
  - - [128, 128, 2048, 64]
    - [4, 11.966]
  - - [30528, 2560, 1, 1024]
    - [1, 61.692]
  - - [1024, 128, 1, 1024]
    - [65, 4.79]
  - - [64, 128, 1536, 128]
    - [56, 13.092]
  - - [128, 128, 1536, 64]
    - [4, 11.768]
  - - [1024, 12288, 1, 1024]
    - [6, 57.041]
  - - [1024, 12288, 1, 4096]
    - [38, 70.41]
  - - [30528, 1920, 1, 1024]
    - [1, 60.905]
  - - [1024, 96, 1, 1024]
    - [35, 4.033]
  - - [4096, 12288, 1, 1024]
    - [21, 60.186]
  - - [128, 128, 36, 12544]
    - [9, 36.039]
  - - [128, 128, 49, 9216]
    - [13, 41.889]
  - - [128, 128, 64, 6400]
    - [69, 37.635]
  - - [128, 128, 81, 12544]
    - [70, 43.047]
  - - [128, 128, 121, 9216]
    - [54, 35.043]
  - - [128, 128, 169, 6400]
    - [70, 41.439]
  - - [256, 256, 36, 4096]
    - [9, 53.671]
  - - [256, 256, 49, 2304]
    - [71, 53.094]
  - - [256, 256, 64, 2304]
    - [49, 52.47]
  - - [256, 256, 81, 4096]
    - [38, 61.821]
  - - [256, 256, 121, 2304]
    - [38, 55.334]
  - - [256, 256, 169, 2304]
    - [38, 54.648]
  - - [512, 512, 81, 1024]
    - [49, 53.745]
  - - [512, 512, 121, 1024]
    - [0, 54.198]
  - - [512, 512, 169, 1024]
    - [6, 55.16]
  - - [512, 512, 36, 1024]
    - [25, 51.698]
  - - [512, 512, 49, 1024]
    - [2, 52.125]
  - - [512, 512, 64, 1024]
    - [2, 53.351]
  - - [64, 64, 36, 50176]
    - [73, 20.053]
  - - [64, 64, 49, 36864]
    - [73, 18.102]
  - - [64, 64, 64, 25600]
    - [72, 22.794]
  - - [128, 128, 192, 64]
    - [4, 8.101]
  - - [64, 128, 192, 128]
    - [38, 9.735]
  - - [768, 2048, 1, 768]
    - [38, 36.39]
  - - [3072, 2048, 1, 768]
    - [19, 48.175]
  - - [768, 2048, 1, 3072]
    - [68, 56.471]
  - - [768, 16, 1, 768]
    - [50, 0.409]
  - - [384, 384, 144, 64]
    - [4, 12.18]
  - - [64, 384, 144, 384]
    - [13, 18.997]
  - - [768, 4608, 1, 768]
    - [74, 41.342]
  - - [3072, 4608, 1, 768]
    - [6, 51.486]
  - - [768, 4608, 1, 3072]
    - [41, 67.042]
  - - [768, 12, 1, 768]
    - [16, 0.313]
  - - [512, 512, 48, 64]
    - [10, 11.327]
  - - [64, 512, 48, 512]
    - [49, 24.39]
  - - [768, 4, 1, 768]
    - [22, 0.107]
  - - [128, 128, 256, 64]
    - [4, 8.948]
  - - [64, 128, 256, 128]
    - [74, 10.763]
  - - [384, 384, 192, 64]
    - [10, 12.298]
  - - [64, 384, 192, 384]
    - [38, 22.022]
  - - [1024, 4608, 1, 1024]
    - [2, 50.499]
  - - [4096, 4608, 1, 1024]
    - [21, 57.897]
  - - [1024, 4608, 1, 4096]
    - [6, 73.344]
  - - [2880, 3072, 1, 3072]
    - [21, 70.329]
  - - [3072, 3072, 1, 3072]
    - [21, 70.394]
  - - [3072, 512, 1, 3072]
    - [75, 56.006]
  - - [4096, 512, 1, 4096]
    - [58, 59.373]
  - - [512, 1024, 1, 1024]
    - [13, 21.836]
  - - [512, 2048, 1, 2048]
    - [2, 42.005]
  - - [512, 3072, 1, 3072]
    - [68, 56.122]
  - - [512, 4096, 1, 4096]
    - [24, 59.228]
  - - [512, 8192, 1, 8192]
    - [76, 67.254]
  - - [64, 1024, 1, 1024]
    - [50, 4.816]
  - - [8192, 512, 1, 8192]
    - [77, 66.23]
  - - [2, 1, 1, 1024]
    - [29, 0.0]
  - - [2, 8, 1, 1024]
    - [29, 0.001]
  - - [30522, 77, 1, 1024]
    - [78, 23.394]
  - - [30522, 616, 1, 1024]
    - [21, 53.718]
  - - [2, 10, 1, 1024]
    - [16, 0.001]
  - - [30522, 160, 1, 1024]
    - [79, 34.907]
  - - [30522, 200, 1, 1024]
    - [21, 38.781]
  - - [2, 39, 1, 1024]
    - [16, 0.003]
  - - [30522, 780, 1, 1024]
    - [21, 55.286]
  - - [2, 4, 1, 1024]
    - [16, 0.001]
  - - [30522, 308, 1, 1024]
    - [21, 45.762]
  - - [2, 40, 1, 1024]
    - [11, 0.006]
  - - [30522, 800, 1, 1024]
    - [21, 55.684]
  - - [2, 41, 1, 1024]
    - [48, 0.007]
  - - [30522, 820, 1, 1024]
    - [78, 57.178]
  - - [2, 5, 1, 1024]
    - [29, 0.001]
  - - [30522, 385, 1, 1024]
    - [21, 49.316]
  - - [2, 6, 1, 1024]
    - [48, 0.001]
  - - [30522, 462, 1, 1024]
    - [21, 52.751]
  - - [2, 9, 1, 1024]
    - [29, 0.001]
  - - [30522, 180, 1, 1024]
    - [41, 33.661]
  - - [2, 32, 1, 1024]
    - [31, 0.005]
  - - [4, 4, 32768, 64]
    - [80, 0.655]
  - - [4, 4, 38400, 64]
    - [45, 0.657]
  - - [14, 14, 10880, 64]
    - [47, 3.075]
  - - [15, 14, 10880, 64]
    - [47, 3.174]
  - - [15, 15, 7680, 64]
    - [47, 3.024]
  - - [15, 15, 10880, 64]
    - [47, 3.324]
  - - [17, 15, 7680, 64]
    - [43, 2.418]
  - - [17, 17, 6144, 64]
    - [43, 2.618]
  - - [17, 17, 7680, 64]
    - [43, 2.722]
  - - [21, 17, 6144, 64]
    - [43, 3.195]
  - - [21, 21, 6144, 64]
    - [81, 3.686]
  - - [30, 30, 2048, 64]
    - [81, 3.641]
  - - [30, 31, 2048, 64]
    - [81, 3.763]
  - - [31, 31, 2048, 64]
    - [81, 3.715]
  - - [34, 24, 4736, 64]
    - [10, 3.822]
  - - [34, 34, 4736, 64]
    - [80, 3.735]
  - - [35, 35, 4608, 64]
    - [80, 3.586]
  - - [2, 2048, 1, 1024]
    - [31, 0.167]
  - - [2, 1024, 1, 1024]
    - [16, 0.085]
  - - [5, 5, 1, 64]
    - [65, 0.0]
  - - [33, 33, 1, 32]
    - [45, 0.005]
  - - [3, 3, 512, 64]
    - [80, 0.013]
  - - [5, 5, 512, 64]
    - [46, 0.08]
  - - [5, 5, 960, 64]
    - [80, 0.142]
  - - [9, 9, 512, 64]
    - [46, 0.253]
  - - [27, 27, 32768, 128]
    - [12, 6.488]
  - - [33, 33, 1600, 32]
    - [80, 2.115]
  - - [684, 8976, 1, 256]
    - [13, 25.082]
  - - [44505, 8976, 1, 256]
    - [21, 33.222]
  - - [2, 2, 1, 2048]
    - [31, 0.0]
  - - [2, 16, 1, 1024]
    - [12, 0.002]
  - - [2, 4, 1, 2560]
    - [31, 0.001]
  - - [2, 64, 1, 1024]
    - [12, 0.011]
  - - [2, 80, 1, 1024]
    - [31, 0.014]
  - - [2, 82, 1, 1024]
    - [31, 0.007]
  - - [2, 12, 1, 1024]
    - [62, 0.002]
  - - [1, 4096, 1, 256]
    - [16, 0.046]
  - - [1, 6912, 1, 256]
    - [16, 0.077]
  - - [26, 26, 6272, 64]
    - [81, 4.349]
  - - [147, 64, 1, 12544]
    - [82, 2.983]
  - - [2, 128, 1, 1024]
    - [16, 0.012]
  - - [2, 96, 1, 1024]
    - [16, 0.008]
  - - [2, 2048, 1, 768]
    - [31, 0.127]
  - - [2, 4608, 1, 768]
    - [16, 0.286]
  - - [2, 4608, 1, 1024]
    - [29, 0.363]
  - - [512, 8, 1, 500000]
    - [82, 2.261]
  - - [512, 16, 1, 500000]
    - [82, 2.771]
  - - [1760, 16, 1, 1760]
    - [12, 1.459]
  - - [3072, 16, 1, 1024]
    - [28, 1.969]
  - - [2048, 16, 1, 2048]
    - [96, 2.395]
  - - [2560, 16, 1, 2560]
    - [31, 3.394]
  - - [4608, 16, 1, 1536]
    - [50, 4.053]
  - - [6144, 16, 1, 2560]
    - [35, 7.645]
  - - [4096, 16, 1, 4096]
    - [11, 7.238]
  - - [7680, 16, 1, 2560]
    - [35, 8.767]
  - - [8448, 16, 1, 2816]
    - [50, 12.114]
  - - [128, 64, 1, 256]
    - [96, 0.1]
  - - [128, 256, 1, 256]
    - [66, 0.391]
  - - [64, 448, 1, 256]
    - [83, 0.332]
  - - [128, 448, 1, 256]
    - [20, 0.652]
  - - [64, 704, 1, 256]
    - [84, 0.519]
  - - [128, 704, 1, 256]
    - [88, 1.012]
  - - [128, 1024, 1, 256]
    - [87, 1.448]
  - - [64, 1408, 1, 256]
    - [12, 1.037]
  - - [128, 1408, 1, 256]
    - [91, 2.019]
  - - [64, 1856, 1, 256]
    - [87, 1.343]
  - - [128, 1856, 1, 256]
    - [16, 2.397]
  - - [64, 2368, 1, 256]
    - [12, 1.652]
  - - [128, 2368, 1, 256]
    - [86, 3.043]
  - - [64, 2944, 1, 256]
    - [87, 2.077]
  - - [128, 2944, 1, 256]
    - [4, 3.775]
  - - [64, 3584, 1, 256]
    - [50, 2.52]
  - - [128, 3584, 1, 256]
    - [9, 4.534]
  - - [64, 4288, 1, 256]
    - [50, 2.846]
  - - [128, 4288, 1, 256]
    - [14, 5.529]
  - - [64, 5056, 1, 256]
    - [13, 3.296]
  - - [128, 5056, 1, 256]
    - [17, 6.433]
  - - [64, 5888, 1, 256]
    - [88, 3.731]
  - - [128, 5888, 1, 256]
    - [9, 7.031]
  - - [64, 6784, 1, 256]
    - [88, 4.283]
  - - [128, 6784, 1, 256]
    - [9, 7.968]
  - - [128, 64, 1, 1280]
    - [96, 0.443]
  - - [128, 256, 1, 1280]
    - [16, 1.711]
  - - [64, 448, 1, 1280]
    - [20, 1.488]
  - - [128, 448, 1, 1280]
    - [11, 2.793]
  - - [64, 704, 1, 1280]
    - [28, 2.331]
  - - [128, 704, 1, 1280]
    - [86, 4.466]
  - - [128, 1024, 1, 1280]
    - [86, 5.82]
  - - [64, 1408, 1, 1280]
    - [50, 4.479]
  - - [128, 1408, 1, 1280]
    - [11, 7.126]
  - - [64, 1856, 1, 1280]
    - [29, 5.588]
  - - [128, 1856, 1, 1280]
    - [10, 9.616]
  - - [64, 2368, 1, 1280]
    - [86, 6.525]
  - - [128, 2368, 1, 1280]
    - [4, 11.675]
  - - [64, 2944, 1, 1280]
    - [16, 7.701]
  - - [128, 2944, 1, 1280]
    - [91, 13.587]
  - - [64, 3584, 1, 1280]
    - [88, 9.045]
  - - [128, 3584, 1, 1280]
    - [56, 16.235]
  - - [64, 4288, 1, 1280]
    - [4, 10.629]
  - - [128, 4288, 1, 1280]
    - [74, 18.836]
  - - [64, 5056, 1, 1280]
    - [10, 12.059]
  - - [128, 5056, 1, 1280]
    - [23, 22.147]
  - - [64, 5888, 1, 1280]
    - [51, 13.164]
  - - [128, 5888, 1, 1280]
    - [33, 25.501]
  - - [64, 6784, 1, 1280]
    - [74, 15.277]
  - - [128, 6784, 1, 1280]
    - [13, 38.413]
  - - [128, 64, 1, 3328]
    - [35, 0.884]
  - - [128, 256, 1, 3328]
    - [96, 3.446]
  - - [64, 448, 1, 3328]
    - [31, 3.081]
  - - [128, 448, 1, 3328]
    - [16, 5.874]
  - - [64, 704, 1, 3328]
    - [29, 4.698]
  - - [128, 704, 1, 3328]
    - [86, 8.806]
  - - [128, 1024, 1, 3328]
    - [12, 11.379]
  - - [64, 1408, 1, 3328]
    - [50, 8.676]
  - - [128, 1408, 1, 3328]
    - [72, 14.481]
  - - [64, 1856, 1, 3328]
    - [11, 10.65]
  - - [128, 1856, 1, 3328]
    - [72, 17.819]
  - - [64, 2368, 1, 3328]
    - [35, 12.656]
  - - [128, 2368, 1, 3328]
    - [4, 20.149]
  - - [64, 2944, 1, 3328]
    - [72, 13.939]
  - - [128, 2944, 1, 3328]
    - [72, 24.007]
  - - [64, 3584, 1, 3328]
    - [72, 16.517]
  - - [128, 3584, 1, 3328]
    - [73, 26.008]
  - - [64, 4288, 1, 3328]
    - [4, 19.342]
  - - [128, 4288, 1, 3328]
    - [67, 31.101]
  - - [64, 5056, 1, 3328]
    - [85, 22.979]
  - - [128, 5056, 1, 3328]
    - [13, 37.797]
  - - [64, 5888, 1, 3328]
    - [10, 26.117]
  - - [128, 5888, 1, 3328]
    - [9, 43.812]
  - - [64, 6784, 1, 3328]
    - [10, 29.227]
  - - [128, 6784, 1, 3328]
    - [9, 49.108]
  - - [448, 64, 1, 256]
    - [84, 0.335]
  - - [704, 64, 1, 256]
    - [83, 0.509]
  - - [1408, 64, 1, 256]
    - [56, 1.016]
  - - [1856, 64, 1, 256]
    - [33, 1.339]
  - - [2368, 64, 1, 256]
    - [11, 1.725]
  - - [2944, 64, 1, 256]
    - [12, 2.107]
  - - [3584, 64, 1, 256]
    - [29, 2.529]
  - - [4288, 64, 1, 256]
    - [4, 2.876]
  - - [5056, 64, 1, 256]
    - [4, 3.405]
  - - [5888, 64, 1, 256]
    - [81, 3.77]
  - - [6784, 64, 1, 256]
    - [13, 4.281]
  - - [448, 128, 1, 256]
    - [83, 1.49]
  - - [704, 128, 1, 256]
    - [88, 1.046]
  - - [1408, 128, 1, 256]
    - [87, 2.049]
  - - [1856, 128, 1, 256]
    - [4, 2.617]
  - - [2368, 128, 1, 256]
    - [10, 3.182]
  - - [2944, 128, 1, 256]
    - [10, 3.781]
  - - [3584, 128, 1, 256]
    - [10, 4.582]
  - - [4288, 128, 1, 256]
    - [17, 5.474]
  - - [5056, 128, 1, 256]
    - [14, 6.502]
  - - [5888, 128, 1, 256]
    - [17, 6.926]
  - - [6784, 128, 1, 256]
    - [14, 7.887]
  - - [448, 64, 1, 1280]
    - [96, 1.474]
  - - [704, 64, 1, 1280]
    - [48, 2.313]
  - - [1408, 64, 1, 1280]
    - [35, 4.4]
  - - [1856, 64, 1, 1280]
    - [35, 5.714]
  - - [2368, 64, 1, 1280]
    - [86, 6.653]
  - - [2944, 64, 1, 1280]
    - [12, 7.768]
  - - [3584, 64, 1, 1280]
    - [10, 9.145]
  - - [4288, 64, 1, 1280]
    - [10, 10.47]
  - - [5056, 64, 1, 1280]
    - [10, 17.412]
  - - [5888, 64, 1, 1280]
    - [10, 13.692]
  - - [6784, 64, 1, 1280]
    - [10, 22.523]
  - - [448, 128, 1, 1280]
    - [12, 2.92]
  - - [704, 128, 1, 1280]
    - [16, 4.473]
  - - [1408, 128, 1, 1280]
    - [89, 7.45]
  - - [1856, 128, 1, 1280]
    - [56, 9.468]
  - - [2368, 128, 1, 1280]
    - [13, 11.569]
  - - [2944, 128, 1, 1280]
    - [13, 13.828]
  - - [3584, 128, 1, 1280]
    - [9, 21.341]
  - - [4288, 128, 1, 1280]
    - [13, 24.659]
  - - [5056, 128, 1, 1280]
    - [17, 22.456]
  - - [5888, 128, 1, 1280]
    - [13, 25.644]
  - - [6784, 128, 1, 1280]
    - [9, 37.27]
  - - [448, 64, 1, 3328]
    - [96, 3.151]
  - - [704, 64, 1, 3328]
    - [50, 4.782]
  - - [1408, 64, 1, 3328]
    - [11, 8.474]
  - - [1856, 64, 1, 3328]
    - [50, 10.591]
  - - [2368, 64, 1, 3328]
    - [12, 12.691]
  - - [2944, 64, 1, 3328]
    - [72, 14.085]
  - - [3584, 64, 1, 3328]
    - [72, 16.57]
  - - [4288, 64, 1, 3328]
    - [72, 18.637]
  - - [5056, 64, 1, 3328]
    - [4, 22.935]
  - - [5888, 64, 1, 3328]
    - [10, 26.069]
  - - [6784, 64, 1, 3328]
    - [4, 28.864]
  - - [448, 128, 1, 3328]
    - [50, 5.933]
  - - [704, 128, 1, 3328]
    - [50, 8.744]
  - - [1408, 128, 1, 3328]
    - [72, 13.785]
  - - [1856, 128, 1, 3328]
    - [72, 17.086]
  - - [2368, 128, 1, 3328]
    - [4, 21.982]
  - - [2944, 128, 1, 3328]
    - [4, 26.913]
  - - [3584, 128, 1, 3328]
    - [56, 27.521]
  - - [4288, 128, 1, 3328]
    - [13, 32.614]
  - - [5056, 128, 1, 3328]
    - [9, 37.974]
  - - [5888, 128, 1, 3328]
    - [9, 42.816]
  - - [6784, 128, 1, 3328]
    - [74, 36.578]
  - - [256, 256, 1, 256]
    - [89, 0.776]
  - - [448, 256, 1, 256]
    - [13, 1.319]
  - - [256, 448, 1, 256]
    - [89, 1.317]
  - - [448, 448, 1, 256]
    - [33, 2.316]
  - - [256, 256, 1, 1280]
    - [11, 3.34]
  - - [448, 256, 1, 1280]
    - [50, 5.454]
  - - [256, 448, 1, 1280]
    - [35, 5.52]
  - - [448, 448, 1, 1280]
    - [17, 8.293]
  - - [256, 256, 1, 3328]
    - [35, 6.804]
  - - [448, 256, 1, 3328]
    - [29, 12.611]
  - - [256, 448, 1, 3328]
    - [50, 12.079]
  - - [448, 448, 1, 3328]
    - [72, 15.699]
  - - [1760, 32, 1, 1760]
    - [12, 2.998]
  - - [3072, 32, 1, 1024]
    - [35, 3.986]
  - - [2048, 32, 1, 2048]
    - [29, 4.785]
  - - [1760, 64, 1, 1760]
    - [89, 5.434]
  - - [3072, 64, 1, 1024]
    - [4, 6.89]
  - - [2560, 32, 1, 2560]
    - [35, 6.56]
  - - [4608, 32, 1, 1536]
    - [29, 7.544]
  - - [2048, 64, 1, 2048]
    - [29, 7.538]
  - - [1760, 128, 1, 1760]
    - [43, 10.322]
  - - [3072, 128, 1, 1024]
    - [17, 12.784]
  - - [2560, 64, 1, 2560]
    - [35, 11.325]
  - - [6144, 32, 1, 2560]
    - [35, 15.974]
  - - [2048, 128, 1, 2048]
    - [56, 17.431]
  - - [4096, 32, 1, 4096]
    - [50, 12.681]
  - - [7680, 32, 1, 2560]
    - [10, 13.143]
  - - [8448, 32, 1, 2816]
    - [89, 16.399]
  - - [2560, 128, 1, 2560]
    - [17, 22.61]
  - - [4096, 64, 1, 4096]
    - [72, 19.244]
  - - [7680, 64, 1, 2560]
    - [17, 25.823]
  - - [4096, 128, 1, 4096]
    - [39, 32.131]
  - - [7680, 128, 1, 2560]
    - [33, 39.054]
  - - [704, 256, 1, 256]
    - [14, 2.0]
  - - [1408, 256, 1, 256]
    - [10, 3.685]
  - - [1856, 256, 1, 256]
    - [56, 4.687]
  - - [2368, 256, 1, 256]
    - [56, 6.059]
  - - [2944, 256, 1, 256]
    - [56, 7.023]
  - - [3584, 256, 1, 256]
    - [17, 8.426]
  - - [4288, 256, 1, 256]
    - [13, 15.831]
  - - [5056, 256, 1, 256]
    - [56, 18.035]
  - - [5888, 256, 1, 256]
    - [38, 11.776]
  - - [6784, 256, 1, 256]
    - [33, 12.825]
  - - [704, 448, 1, 256]
    - [10, 3.21]
  - - [1024, 448, 1, 256]
    - [14, 4.657]
  - - [1408, 448, 1, 256]
    - [74, 6.259]
  - - [1856, 448, 1, 256]
    - [74, 7.645]
  - - [2368, 448, 1, 256]
    - [17, 9.499]
  - - [2944, 448, 1, 256]
    - [56, 10.786]
  - - [3584, 448, 1, 256]
    - [56, 12.404]
  - - [4288, 448, 1, 256]
    - [9, 13.71]
  - - [5056, 448, 1, 256]
    - [2, 21.633]
  - - [5888, 448, 1, 256]
    - [56, 22.443]
  - - [6784, 448, 1, 256]
    - [17, 18.377]
  - - [256, 704, 1, 256]
    - [74, 2.057]
  - - [448, 704, 1, 256]
    - [64, 3.251]
  - - [704, 704, 1, 256]
    - [14, 4.948]
  - - [1024, 704, 1, 256]
    - [56, 12.834]
  - - [1408, 704, 1, 256]
    - [56, 8.944]
  - - [1856, 704, 1, 256]
    - [33, 18.384]
  - - [2368, 704, 1, 256]
    - [33, 18.93]
  - - [2944, 704, 1, 256]
    - [74, 14.363]
  - - [3584, 704, 1, 256]
    - [33, 22.461]
  - - [4288, 704, 1, 256]
    - [13, 22.912]
  - - [5056, 704, 1, 256]
    - [13, 24.56]
  - - [5888, 704, 1, 256]
    - [9, 24.399]
  - - [6784, 704, 1, 256]
    - [13, 21.936]
  - - [448, 1024, 1, 256]
    - [13, 4.778]
  - - [704, 1024, 1, 256]
    - [17, 6.655]
  - - [1408, 1024, 1, 256]
    - [87, 11.877]
  - - [1856, 1024, 1, 256]
    - [9, 14.08]
  - - [2368, 1024, 1, 256]
    - [17, 16.968]
  - - [2944, 1024, 1, 256]
    - [13, 23.5]
  - - [3584, 1024, 1, 256]
    - [56, 24.848]
  - - [4288, 1024, 1, 256]
    - [9, 25.74]
  - - [5056, 1024, 1, 256]
    - [13, 23.494]
  - - [5888, 1024, 1, 256]
    - [13, 27.003]
  - - [6784, 1024, 1, 256]
    - [26, 25.908]
  - - [256, 1408, 1, 256]
    - [4, 3.661]
  - - [448, 1408, 1, 256]
    - [13, 11.3]
  - - [704, 1408, 1, 256]
    - [56, 8.879]
  - - [1024, 1408, 1, 256]
    - [39, 11.522]
  - - [1408, 1408, 1, 256]
    - [17, 14.33]
  - - [1856, 1408, 1, 256]
    - [9, 23.191]
  - - [2368, 1408, 1, 256]
    - [33, 24.346]
  - - [2944, 1408, 1, 256]
    - [33, 25.878]
  - - [3584, 1408, 1, 256]
    - [13, 26.705]
  - - [4288, 1408, 1, 256]
    - [13, 27.466]
  - - [5056, 1408, 1, 256]
    - [9, 28.165]
  - - [5888, 1408, 1, 256]
    - [9, 28.432]
  - - [6784, 1408, 1, 256]
    - [26, 27.03]
  - - [256, 1856, 1, 256]
    - [17, 4.74]
  - - [448, 1856, 1, 256]
    - [9, 7.748]
  - - [704, 1856, 1, 256]
    - [17, 10.754]
  - - [1024, 1856, 1, 256]
    - [14, 19.789]
  - - [1408, 1856, 1, 256]
    - [56, 17.756]
  - - [1856, 1856, 1, 256]
    - [13, 24.776]
  - - [2368, 1856, 1, 256]
    - [13, 26.687]
  - - [2944, 1856, 1, 256]
    - [9, 27.795]
  - - [3584, 1856, 1, 256]
    - [33, 28.678]
  - - [4288, 1856, 1, 256]
    - [9, 29.428]
  - - [5056, 1856, 1, 256]
    - [9, 29.292]
  - - [5888, 1856, 1, 256]
    - [9, 29.512]
  - - [6784, 1856, 1, 256]
    - [2, 28.505]
  - - [256, 2368, 1, 256]
    - [17, 5.972]
  - - [448, 2368, 1, 256]
    - [87, 9.53]
  - - [704, 2368, 1, 256]
    - [56, 12.978]
  - - [1024, 2368, 1, 256]
    - [33, 16.869]
  - - [1408, 2368, 1, 256]
    - [13, 24.469]
  - - [1856, 2368, 1, 256]
    - [9, 26.631]
  - - [2368, 2368, 1, 256]
    - [33, 27.981]
  - - [2944, 2368, 1, 256]
    - [9, 29.526]
  - - [3584, 2368, 1, 256]
    - [13, 29.888]
  - - [4288, 2368, 1, 256]
    - [9, 30.255]
  - - [5056, 2368, 1, 256]
    - [13, 30.159]
  - - [5888, 2368, 1, 256]
    - [9, 30.236]
  - - [6784, 2368, 1, 256]
    - [9, 28.977]
  - - [256, 2944, 1, 256]
    - [87, 7.012]
  - - [448, 2944, 1, 256]
    - [54, 10.848]
  - - [704, 2944, 1, 256]
    - [56, 14.799]
  - - [1024, 2944, 1, 256]
    - [56, 19.504]
  - - [1408, 2944, 1, 256]
    - [9, 25.492]
  - - [1856, 2944, 1, 256]
    - [13, 27.992]
  - - [2368, 2944, 1, 256]
    - [9, 29.353]
  - - [2944, 2944, 1, 256]
    - [9, 30.411]
  - - [3584, 2944, 1, 256]
    - [9, 30.647]
  - - [4288, 2944, 1, 256]
    - [9, 31.04]
  - - [5056, 2944, 1, 256]
    - [13, 30.34]
  - - [5888, 2944, 1, 256]
    - [9, 30.71]
  - - [6784, 2944, 1, 256]
    - [13, 29.693]
  - - [448, 3584, 1, 256]
    - [49, 20.312]
  - - [704, 3584, 1, 256]
    - [74, 17.009]
  - - [1024, 3584, 1, 256]
    - [74, 21.174]
  - - [1408, 3584, 1, 256]
    - [56, 27.256]
  - - [1856, 3584, 1, 256]
    - [33, 29.025]
  - - [2368, 3584, 1, 256]
    - [13, 30.035]
  - - [2944, 3584, 1, 256]
    - [56, 30.927]
  - - [3584, 3584, 1, 256]
    - [9, 31.343]
  - - [4288, 3584, 1, 256]
    - [9, 31.526]
  - - [5056, 3584, 1, 256]
    - [9, 31.147]
  - - [5888, 3584, 1, 256]
    - [9, 31.133]
  - - [6784, 3584, 1, 256]
    - [17, 29.677]
  - - [256, 4288, 1, 256]
    - [14, 9.69]
  - - [448, 4288, 1, 256]
    - [14, 20.296]
  - - [704, 4288, 1, 256]
    - [14, 23.532]
  - - [1024, 4288, 1, 256]
    - [9, 26.662]
  - - [1408, 4288, 1, 256]
    - [33, 28.361]
  - - [1856, 4288, 1, 256]
    - [9, 29.927]
  - - [2368, 4288, 1, 256]
    - [9, 31.057]
  - - [2944, 4288, 1, 256]
    - [9, 31.579]
  - - [3584, 4288, 1, 256]
    - [56, 32.05]
  - - [4288, 4288, 1, 256]
    - [9, 31.909]
  - - [5056, 4288, 1, 256]
    - [13, 31.422]
  - - [5888, 4288, 1, 256]
    - [9, 31.62]
  - - [6784, 4288, 1, 256]
    - [26, 30.322]
  - - [256, 5056, 1, 256]
    - [13, 10.881]
  - - [448, 5056, 1, 256]
    - [13, 22.45]
  - - [704, 5056, 1, 256]
    - [13, 25.101]
  - - [1024, 5056, 1, 256]
    - [56, 27.299]
  - - [1408, 5056, 1, 256]
    - [9, 29.458]
  - - [1856, 5056, 1, 256]
    - [9, 30.756]
  - - [2368, 5056, 1, 256]
    - [23, 31.45]
  - - [2944, 5056, 1, 256]
    - [13, 32.231]
  - - [3584, 5056, 1, 256]
    - [9, 32.543]
  - - [4288, 5056, 1, 256]
    - [9, 32.416]
  - - [5056, 5056, 1, 256]
    - [13, 31.863]
  - - [5888, 5056, 1, 256]
    - [9, 31.969]
  - - [6784, 5056, 1, 256]
    - [26, 30.346]
  - - [448, 5888, 1, 256]
    - [13, 18.013]
  - - [704, 5888, 1, 256]
    - [13, 25.491]
  - - [1024, 5888, 1, 256]
    - [33, 28.094]
  - - [1408, 5888, 1, 256]
    - [13, 30.115]
  - - [1856, 5888, 1, 256]
    - [13, 30.992]
  - - [2368, 5888, 1, 256]
    - [9, 31.942]
  - - [2944, 5888, 1, 256]
    - [9, 32.549]
  - - [3584, 5888, 1, 256]
    - [9, 32.9]
  - - [4288, 5888, 1, 256]
    - [9, 32.906]
  - - [5056, 5888, 1, 256]
    - [9, 31.967]
  - - [5888, 5888, 1, 256]
    - [9, 32.141]
  - - [6784, 5888, 1, 256]
    - [34, 30.953]
  - - [256, 6784, 1, 256]
    - [14, 13.224]
  - - [448, 6784, 1, 256]
    - [14, 23.95]
  - - [704, 6784, 1, 256]
    - [9, 26.957]
  - - [1024, 6784, 1, 256]
    - [13, 28.996]
  - - [1408, 6784, 1, 256]
    - [33, 30.475]
  - - [1856, 6784, 1, 256]
    - [9, 31.717]
  - - [2368, 6784, 1, 256]
    - [9, 32.333]
  - - [2944, 6784, 1, 256]
    - [9, 33.068]
  - - [3584, 6784, 1, 256]
    - [9, 33.11]
  - - [4288, 6784, 1, 256]
    - [9, 32.903]
  - - [5056, 6784, 1, 256]
    - [13, 32.099]
  - - [5888, 6784, 1, 256]
    - [9, 32.262]
  - - [6784, 6784, 1, 256]
    - [34, 30.706]
  - - [704, 256, 1, 1280]
    - [74, 7.381]
  - - [1408, 256, 1, 1280]
    - [17, 13.849]
  - - [1856, 256, 1, 1280]
    - [14, 16.876]
  - - [2368, 256, 1, 1280]
    - [13, 21.361]
  - - [2944, 256, 1, 1280]
    - [8, 25.683]
  - - [3584, 256, 1, 1280]
    - [87, 27.881]
  - - [4288, 256, 1, 1280]
    - [90, 39.088]
  - - [5056, 256, 1, 1280]
    - [8, 34.214]
  - - [5888, 256, 1, 1280]
    - [70, 42.373]
  - - [6784, 256, 1, 1280]
    - [14, 37.391]
  - - [704, 448, 1, 1280]
    - [74, 12.57]
  - - [1024, 448, 1, 1280]
    - [19, 16.318]
  - - [1408, 448, 1, 1280]
    - [39, 28.338]
  - - [1856, 448, 1, 1280]
    - [13, 28.579]
  - - [2368, 448, 1, 1280]
    - [37, 32.245]
  - - [2944, 448, 1, 1280]
    - [39, 34.56]
  - - [3584, 448, 1, 1280]
    - [87, 40.623]
  - - [4288, 448, 1, 1280]
    - [40, 42.038]
  - - [5056, 448, 1, 1280]
    - [1, 46.798]
  - - [5888, 448, 1, 1280]
    - [87, 46.733]
  - - [6784, 448, 1, 1280]
    - [87, 47.383]
  - - [256, 704, 1, 1280]
    - [50, 7.261]
  - - [448, 704, 1, 1280]
    - [91, 12.202]
  - - [704, 704, 1, 1280]
    - [13, 23.589]
  - - [1024, 704, 1, 1280]
    - [19, 32.186]
  - - [1408, 704, 1, 1280]
    - [2, 34.529]
  - - [1856, 704, 1, 1280]
    - [38, 34.765]
  - - [2368, 704, 1, 1280]
    - [14, 41.522]
  - - [2944, 704, 1, 1280]
    - [87, 44.149]
  - - [3584, 704, 1, 1280]
    - [14, 45.426]
  - - [4288, 704, 1, 1280]
    - [87, 47.578]
  - - [5056, 704, 1, 1280]
    - [87, 50.132]
  - - [5888, 704, 1, 1280]
    - [87, 48.719]
  - - [6784, 704, 1, 1280]
    - [87, 52.827]
  - - [448, 1024, 1, 1280]
    - [13, 22.275]
  - - [704, 1024, 1, 1280]
    - [9, 31.127]
  - - [1408, 1024, 1, 1280]
    - [38, 41.501]
  - - [1856, 1024, 1, 1280]
    - [9, 42.427]
  - - [2368, 1024, 1, 1280]
    - [8, 46.301]
  - - [2944, 1024, 1, 1280]
    - [19, 46.747]
  - - [3584, 1024, 1, 1280]
    - [6, 52.195]
  - - [4288, 1024, 1, 1280]
    - [6, 52.271]
  - - [5056, 1024, 1, 1280]
    - [6, 56.435]
  - - [5888, 1024, 1, 1280]
    - [6, 53.839]
  - - [6784, 1024, 1, 1280]
    - [6, 59.237]
  - - [256, 1408, 1, 1280]
    - [74, 13.661]
  - - [448, 1408, 1, 1280]
    - [9, 27.566]
  - - [704, 1408, 1, 1280]
    - [2, 35.383]
  - - [1024, 1408, 1, 1280]
    - [38, 41.091]
  - - [1408, 1408, 1, 1280]
    - [9, 44.188]
  - - [1856, 1408, 1, 1280]
    - [33, 44.658]
  - - [2368, 1408, 1, 1280]
    - [39, 49.723]
  - - [2944, 1408, 1, 1280]
    - [39, 50.149]
  - - [3584, 1408, 1, 1280]
    - [6, 54.553]
  - - [4288, 1408, 1, 1280]
    - [6, 58.876]
  - - [5056, 1408, 1, 1280]
    - [6, 54.958]
  - - [5888, 1408, 1, 1280]
    - [6, 54.968]
  - - [6784, 1408, 1, 1280]
    - [6, 55.078]
  - - [256, 1856, 1, 1280]
    - [13, 22.916]
  - - [448, 1856, 1, 1280]
    - [9, 28.664]
  - - [704, 1856, 1, 1280]
    - [38, 34.922]
  - - [1024, 1856, 1, 1280]
    - [13, 42.959]
  - - [1408, 1856, 1, 1280]
    - [33, 44.605]
  - - [1856, 1856, 1, 1280]
    - [39, 53.13]
  - - [2368, 1856, 1, 1280]
    - [87, 50.949]
  - - [2944, 1856, 1, 1280]
    - [87, 52.497]
  - - [3584, 1856, 1, 1280]
    - [6, 57.068]
  - - [4288, 1856, 1, 1280]
    - [87, 53.732]
  - - [5056, 1856, 1, 1280]
    - [87, 54.989]
  - - [5888, 1856, 1, 1280]
    - [6, 56.587]
  - - [6784, 1856, 1, 1280]
    - [6, 58.592]
  - - [256, 2368, 1, 1280]
    - [13, 27.15]
  - - [448, 2368, 1, 1280]
    - [30, 31.887]
  - - [704, 2368, 1, 1280]
    - [74, 39.227]
  - - [1024, 2368, 1, 1280]
    - [32, 49.813]
  - - [1408, 2368, 1, 1280]
    - [9, 51.562]
  - - [1856, 2368, 1, 1280]
    - [33, 51.571]
  - - [2368, 2368, 1, 1280]
    - [87, 51.937]
  - - [2944, 2368, 1, 1280]
    - [6, 59.054]
  - - [3584, 2368, 1, 1280]
    - [6, 56.246]
  - - [4288, 2368, 1, 1280]
    - [6, 58.363]
  - - [5056, 2368, 1, 1280]
    - [6, 57.784]
  - - [5888, 2368, 1, 1280]
    - [6, 58.827]
  - - [6784, 2368, 1, 1280]
    - [6, 58.769]
  - - [256, 2944, 1, 1280]
    - [14, 26.294]
  - - [448, 2944, 1, 1280]
    - [68, 34.058]
  - - [704, 2944, 1, 1280]
    - [9, 45.355]
  - - [1024, 2944, 1, 1280]
    - [9, 49.235]
  - - [1408, 2944, 1, 1280]
    - [19, 52.208]
  - - [1856, 2944, 1, 1280]
    - [13, 50.936]
  - - [2368, 2944, 1, 1280]
    - [39, 54.461]
  - - [2944, 2944, 1, 1280]
    - [6, 55.135]
  - - [3584, 2944, 1, 1280]
    - [6, 58.569]
  - - [4288, 2944, 1, 1280]
    - [6, 57.556]
  - - [5056, 2944, 1, 1280]
    - [6, 58.157]
  - - [5888, 2944, 1, 1280]
    - [6, 60.675]
  - - [6784, 2944, 1, 1280]
    - [6, 60.61]
  - - [448, 3584, 1, 1280]
    - [49, 45.049]
  - - [704, 3584, 1, 1280]
    - [8, 47.316]
  - - [1024, 3584, 1, 1280]
    - [26, 53.514]
  - - [1408, 3584, 1, 1280]
    - [8, 56.247]
  - - [1856, 3584, 1, 1280]
    - [8, 53.862]
  - - [2368, 3584, 1, 1280]
    - [6, 56.401]
  - - [2944, 3584, 1, 1280]
    - [6, 59.554]
  - - [3584, 3584, 1, 1280]
    - [6, 59.601]
  - - [4288, 3584, 1, 1280]
    - [6, 59.818]
  - - [5056, 3584, 1, 1280]
    - [6, 61.545]
  - - [5888, 3584, 1, 1280]
    - [6, 62.221]
  - - [6784, 3584, 1, 1280]
    - [6, 61.321]
  - - [256, 4288, 1, 1280]
    - [33, 37.161]
  - - [448, 4288, 1, 1280]
    - [14, 42.687]
  - - [704, 4288, 1, 1280]
    - [56, 48.86]
  - - [1024, 4288, 1, 1280]
    - [33, 53.856]
  - - [1408, 4288, 1, 1280]
    - [37, 59.534]
  - - [1856, 4288, 1, 1280]
    - [39, 56.846]
  - - [2368, 4288, 1, 1280]
    - [6, 58.737]
  - - [2944, 4288, 1, 1280]
    - [6, 58.897]
  - - [3584, 4288, 1, 1280]
    - [6, 60.29]
  - - [4288, 4288, 1, 1280]
    - [6, 61.766]
  - - [5056, 4288, 1, 1280]
    - [6, 61.801]
  - - [5888, 4288, 1, 1280]
    - [6, 63.454]
  - - [6784, 4288, 1, 1280]
    - [6, 63.475]
  - - [256, 5056, 1, 1280]
    - [38, 33.876]
  - - [448, 5056, 1, 1280]
    - [13, 43.448]
  - - [704, 5056, 1, 1280]
    - [9, 51.152]
  - - [1024, 5056, 1, 1280]
    - [33, 55.756]
  - - [1408, 5056, 1, 1280]
    - [39, 57.643]
  - - [1856, 5056, 1, 1280]
    - [2, 62.661]
  - - [2368, 5056, 1, 1280]
    - [6, 57.707]
  - - [2944, 5056, 1, 1280]
    - [6, 59.037]
  - - [3584, 5056, 1, 1280]
    - [6, 61.185]
  - - [4288, 5056, 1, 1280]
    - [6, 61.631]
  - - [5056, 5056, 1, 1280]
    - [6, 62.115]
  - - [5888, 5056, 1, 1280]
    - [6, 62.986]
  - - [6784, 5056, 1, 1280]
    - [6, 63.044]
  - - [448, 5888, 1, 1280]
    - [13, 45.16]
  - - [704, 5888, 1, 1280]
    - [8, 50.832]
  - - [1024, 5888, 1, 1280]
    - [2, 54.789]
  - - [1408, 5888, 1, 1280]
    - [19, 54.792]
  - - [1856, 5888, 1, 1280]
    - [2, 57.204]
  - - [2368, 5888, 1, 1280]
    - [2, 59.366]
  - - [2944, 5888, 1, 1280]
    - [6, 61.435]
  - - [3584, 5888, 1, 1280]
    - [6, 62.081]
  - - [4288, 5888, 1, 1280]
    - [6, 61.266]
  - - [5056, 5888, 1, 1280]
    - [6, 62.619]
  - - [5888, 5888, 1, 1280]
    - [6, 63.762]
  - - [6784, 5888, 1, 1280]
    - [6, 63.574]
  - - [256, 6784, 1, 1280]
    - [13, 37.684]
  - - [448, 6784, 1, 1280]
    - [54, 48.06]
  - - [704, 6784, 1, 1280]
    - [33, 54.49]
  - - [1024, 6784, 1, 1280]
    - [8, 55.471]
  - - [1408, 6784, 1, 1280]
    - [39, 57.829]
  - - [1856, 6784, 1, 1280]
    - [39, 59.185]
  - - [2368, 6784, 1, 1280]
    - [6, 60.567]
  - - [2944, 6784, 1, 1280]
    - [6, 62.613]
  - - [3584, 6784, 1, 1280]
    - [6, 62.68]
  - - [4288, 6784, 1, 1280]
    - [6, 63.246]
  - - [5056, 6784, 1, 1280]
    - [6, 64.015]
  - - [5888, 6784, 1, 1280]
    - [6, 64.833]
  - - [6784, 6784, 1, 1280]
    - [6, 64.512]
  - - [704, 256, 1, 3328]
    - [72, 14.596]
  - - [1408, 256, 1, 3328]
    - [74, 23.681]
  - - [1856, 256, 1, 3328]
    - [13, 29.544]
  - - [2368, 256, 1, 3328]
    - [33, 35.795]
  - - [2944, 256, 1, 3328]
    - [33, 42.816]
  - - [3584, 256, 1, 3328]
    - [2, 42.056]
  - - [4288, 256, 1, 3328]
    - [2, 52.299]
  - - [5056, 256, 1, 3328]
    - [68, 47.84]
  - - [5888, 256, 1, 3328]
    - [27, 54.448]
  - - [6784, 256, 1, 3328]
    - [58, 50.966]
  - - [704, 448, 1, 3328]
    - [72, 20.864]
  - - [1024, 448, 1, 3328]
    - [33, 28.958]
  - - [1408, 448, 1, 3328]
    - [9, 35.854]
  - - [1856, 448, 1, 3328]
    - [9, 47.526]
  - - [2368, 448, 1, 3328]
    - [2, 51.259]
  - - [2944, 448, 1, 3328]
    - [70, 50.548]
  - - [3584, 448, 1, 3328]
    - [87, 49.55]
  - - [4288, 448, 1, 3328]
    - [36, 54.942]
  - - [5056, 448, 1, 3328]
    - [0, 58.012]
  - - [5888, 448, 1, 3328]
    - [87, 57.536]
  - - [6784, 448, 1, 3328]
    - [87, 59.716]
  - - [256, 704, 1, 3328]
    - [72, 14.882]
  - - [448, 704, 1, 3328]
    - [72, 21.51]
  - - [704, 704, 1, 3328]
    - [13, 30.972]
  - - [1024, 704, 1, 3328]
    - [33, 39.871]
  - - [1408, 704, 1, 3328]
    - [6, 46.284]
  - - [1856, 704, 1, 3328]
    - [70, 50.777]
  - - [2368, 704, 1, 3328]
    - [87, 51.319]
  - - [2944, 704, 1, 3328]
    - [87, 54.649]
  - - [3584, 704, 1, 3328]
    - [87, 56.179]
  - - [4288, 704, 1, 3328]
    - [27, 57.456]
  - - [5056, 704, 1, 3328]
    - [87, 63.499]
  - - [5888, 704, 1, 3328]
    - [87, 58.058]
  - - [6784, 704, 1, 3328]
    - [87, 66.639]
  - - [448, 1024, 1, 3328]
    - [33, 28.62]
  - - [704, 1024, 1, 3328]
    - [13, 42.169]
  - - [1408, 1024, 1, 3328]
    - [70, 53.314]
  - - [1856, 1024, 1, 3328]
    - [58, 56.582]
  - - [2368, 1024, 1, 3328]
    - [59, 60.929]
  - - [2944, 1024, 1, 3328]
    - [93, 57.059]
  - - [3584, 1024, 1, 3328]
    - [6, 63.766]
  - - [4288, 1024, 1, 3328]
    - [0, 66.562]
  - - [5056, 1024, 1, 3328]
    - [0, 67.639]
  - - [5888, 1024, 1, 3328]
    - [6, 64.078]
  - - [6784, 1024, 1, 3328]
    - [6, 73.371]
  - - [256, 1408, 1, 3328]
    - [10, 25.743]
  - - [448, 1408, 1, 3328]
    - [14, 37.423]
  - - [704, 1408, 1, 3328]
    - [2, 47.833]
  - - [1024, 1408, 1, 3328]
    - [60, 53.684]
  - - [1408, 1408, 1, 3328]
    - [24, 55.889]
  - - [1856, 1408, 1, 3328]
    - [71, 55.24]
  - - [2368, 1408, 1, 3328]
    - [6, 66.781]
  - - [2944, 1408, 1, 3328]
    - [40, 60.125]
  - - [3584, 1408, 1, 3328]
    - [60, 71.674]
  - - [4288, 1408, 1, 3328]
    - [6, 74.698]
  - - [5056, 1408, 1, 3328]
    - [6, 75.427]
  - - [5888, 1408, 1, 3328]
    - [6, 64.424]
  - - [6784, 1408, 1, 3328]
    - [6, 64.8]
  - - [256, 1856, 1, 3328]
    - [14, 30.093]
  - - [448, 1856, 1, 3328]
    - [13, 48.261]
  - - [704, 1856, 1, 3328]
    - [68, 50.29]
  - - [1024, 1856, 1, 3328]
    - [24, 54.9]
  - - [1408, 1856, 1, 3328]
    - [8, 55.566]
  - - [1856, 1856, 1, 3328]
    - [26, 68.883]
  - - [2368, 1856, 1, 3328]
    - [6, 60.055]
  - - [2944, 1856, 1, 3328]
    - [49, 59.281]
  - - [3584, 1856, 1, 3328]
    - [6, 70.456]
  - - [4288, 1856, 1, 3328]
    - [87, 62.69]
  - - [5056, 1856, 1, 3328]
    - [49, 65.242]
  - - [5888, 1856, 1, 3328]
    - [6, 65.823]
  - - [6784, 1856, 1, 3328]
    - [6, 67.987]
  - - [256, 2368, 1, 3328]
    - [9, 36.31]
  - - [448, 2368, 1, 3328]
    - [2, 50.16]
  - - [704, 2368, 1, 3328]
    - [13, 54.626]
  - - [1024, 2368, 1, 3328]
    - [37, 61.308]
  - - [1408, 2368, 1, 3328]
    - [37, 65.466]
  - - [1856, 2368, 1, 3328]
    - [2, 60.099]
  - - [2368, 2368, 1, 3328]
    - [6, 61.405]
  - - [2944, 2368, 1, 3328]
    - [6, 72.796]
  - - [3584, 2368, 1, 3328]
    - [6, 65.993]
  - - [4288, 2368, 1, 3328]
    - [6, 68.661]
  - - [5056, 2368, 1, 3328]
    - [6, 66.614]
  - - [5888, 2368, 1, 3328]
    - [6, 69.005]
  - - [6784, 2368, 1, 3328]
    - [6, 67.938]
  - - [256, 2944, 1, 3328]
    - [13, 43.812]
  - - [448, 2944, 1, 3328]
    - [68, 51.658]
  - - [704, 2944, 1, 3328]
    - [33, 55.35]
  - - [1024, 2944, 1, 3328]
    - [92, 57.233]
  - - [1408, 2944, 1, 3328]
    - [54, 66.205]
  - - [1856, 2944, 1, 3328]
    - [2, 59.161]
  - - [2368, 2944, 1, 3328]
    - [2, 72.889]
  - - [2944, 2944, 1, 3328]
    - [6, 66.011]
  - - [3584, 2944, 1, 3328]
    - [6, 69.627]
  - - [4288, 2944, 1, 3328]
    - [1, 67.378]
  - - [5056, 2944, 1, 3328]
    - [1, 67.08]
  - - [5888, 2944, 1, 3328]
    - [1, 70.87]
  - - [6784, 2944, 1, 3328]
    - [6, 70.887]
  - - [448, 3584, 1, 3328]
    - [38, 55.538]
  - - [704, 3584, 1, 3328]
    - [38, 58.834]
  - - [1024, 3584, 1, 3328]
    - [26, 71.869]
  - - [1408, 3584, 1, 3328]
    - [60, 73.29]
  - - [1856, 3584, 1, 3328]
    - [38, 71.467]
  - - [2368, 3584, 1, 3328]
    - [6, 66.309]
  - - [2944, 3584, 1, 3328]
    - [6, 70.571]
  - - [3584, 3584, 1, 3328]
    - [6, 69.77]
  - - [4288, 3584, 1, 3328]
    - [6, 69.931]
  - - [5056, 3584, 1, 3328]
    - [6, 70.789]
  - - [5888, 3584, 1, 3328]
    - [6, 71.735]
  - - [6784, 3584, 1, 3328]
    - [1, 70.764]
  - - [256, 4288, 1, 3328]
    - [59, 50.133]
  - - [448, 4288, 1, 3328]
    - [58, 56.386]
  - - [704, 4288, 1, 3328]
    - [69, 57.808]
  - - [1024, 4288, 1, 3328]
    - [38, 64.412]
  - - [1408, 4288, 1, 3328]
    - [26, 64.587]
  - - [1856, 4288, 1, 3328]
    - [49, 65.497]
  - - [2368, 4288, 1, 3328]
    - [6, 69.084]
  - - [2944, 4288, 1, 3328]
    - [6, 68.44]
  - - [3584, 4288, 1, 3328]
    - [1, 69.719]
  - - [4288, 4288, 1, 3328]
    - [1, 71.221]
  - - [5056, 4288, 1, 3328]
    - [1, 70.834]
  - - [5888, 4288, 1, 3328]
    - [1, 72.859]
  - - [6784, 4288, 1, 3328]
    - [1, 72.521]
  - - [256, 5056, 1, 3328]
    - [70, 49.045]
  - - [448, 5056, 1, 3328]
    - [59, 59.845]
  - - [704, 5056, 1, 3328]
    - [38, 64.287]
  - - [1024, 5056, 1, 3328]
    - [37, 67.545]
  - - [1408, 5056, 1, 3328]
    - [37, 75.116]
  - - [1856, 5056, 1, 3328]
    - [2, 64.762]
  - - [2368, 5056, 1, 3328]
    - [6, 66.221]
  - - [2944, 5056, 1, 3328]
    - [6, 67.682]
  - - [3584, 5056, 1, 3328]
    - [6, 70.716]
  - - [4288, 5056, 1, 3328]
    - [6, 69.933]
  - - [5056, 5056, 1, 3328]
    - [1, 70.8]
  - - [5888, 5056, 1, 3328]
    - [1, 71.87]
  - - [6784, 5056, 1, 3328]
    - [1, 72.651]
  - - [448, 5888, 1, 3328]
    - [9, 56.854]
  - - [704, 5888, 1, 3328]
    - [8, 60.759]
  - - [1024, 5888, 1, 3328]
    - [2, 64.869]
  - - [1408, 5888, 1, 3328]
    - [37, 64.732]
  - - [1856, 5888, 1, 3328]
    - [2, 66.898]
  - - [2368, 5888, 1, 3328]
    - [25, 69.005]
  - - [2944, 5888, 1, 3328]
    - [6, 71.625]
  - - [3584, 5888, 1, 3328]
    - [1, 71.457]
  - - [4288, 5888, 1, 3328]
    - [1, 69.901]
  - - [5056, 5888, 1, 3328]
    - [1, 71.601]
  - - [5888, 5888, 1, 3328]
    - [1, 73.102]
  - - [6784, 5888, 1, 3328]
    - [1, 73.038]
  - - [256, 6784, 1, 3328]
    - [24, 53.782]
  - - [448, 6784, 1, 3328]
    - [56, 57.641]
  - - [704, 6784, 1, 3328]
    - [38, 68.621]
  - - [1024, 6784, 1, 3328]
    - [37, 73.428]
  - - [1408, 6784, 1, 3328]
    - [26, 77.095]
  - - [1856, 6784, 1, 3328]
    - [2, 69.458]
  - - [2368, 6784, 1, 3328]
    - [6, 68.76]
  - - [2944, 6784, 1, 3328]
    - [6, 72.033]
  - - [3584, 6784, 1, 3328]
    - [1, 71.558]
  - - [4288, 6784, 1, 3328]
    - [1, 72.291]
  - - [5056, 6784, 1, 3328]
    - [1, 72.973]
  - - [5888, 6784, 1, 3328]
    - [1, 73.779]
  - - [6784, 6784, 1, 3328]
    - [1, 73.225]
  - - [1760, 800, 1, 1760]
    - [69, 38.885]
  - - [1760, 1600, 1, 1760]
    - [94, 50.656]
  - - [1760, 3200, 1, 1760]
    - [52, 56.833]
  - - [1760, 6400, 1, 1760]
    - [52, 69.685]
  - - [2048, 800, 1, 2048]
    - [87, 43.635]
  - - [2048, 1600, 1, 2048]
    - [8, 56.551]
  - - [2048, 3200, 1, 2048]
    - [2, 65.433]
  - - [2048, 6400, 1, 2048]
    - [6, 67.598]
  - - [2560, 800, 1, 2560]
    - [40, 55.153]
  - - [2560, 1600, 1, 2560]
    - [76, 63.91]
  - - [2560, 3200, 1, 2560]
    - [6, 61.788]
  - - [2560, 6400, 1, 2560]
    - [6, 67.143]
  - - [2048, 400, 1, 512]
    - [9, 20.636]
  - - [2048, 800, 1, 512]
    - [14, 27.158]
  - - [2048, 1600, 1, 512]
    - [8, 35.53]
  - - [2048, 3200, 1, 512]
    - [26, 42.005]
  - - [4096, 400, 1, 1024]
    - [14, 35.331]
  - - [4096, 800, 1, 1024]
    - [6, 44.58]
  - - [4096, 1600, 1, 1024]
    - [95, 53.852]
  - - [4096, 3200, 1, 1024]
    - [6, 56.152]
  - - [8192, 400, 1, 2048]
    - [14, 51.736]
  - - [8192, 800, 1, 2048]
    - [6, 60.386]
  - - [8192, 1600, 1, 2048]
    - [25, 62.473]
  - - [8192, 3200, 1, 2048]
    - [25, 63.771]
  - - [16384, 400, 1, 4096]
    - [0, 58.261]
  - - [16384, 800, 1, 4096]
    - [49, 65.848]
  - - [16384, 1600, 1, 4096]
    - [76, 68.162]
  - - [16384, 3200, 1, 4096]
    - [76, 68.643]
  - - [8448, 48000, 1, 2816]
    - [21, 73.137]
  - - [8448, 24000, 1, 2816]
    - [21, 83.44]
  - - [8448, 12000, 1, 2816]
    - [78, 74.343]
  - - [8448, 5984, 1, 2816]
    - [1, 72.344]
  - - [6144, 48000, 1, 2048]
    - [78, 74.55]
  - - [6144, 24000, 1, 2048]
    - [1, 73.638]
  - - [6144, 12000, 1, 2048]
    - [78, 72.747]
  - - [6144, 5984, 1, 2048]
    - [6, 69.815]
  - - [4608, 48000, 1, 1536]
    - [6, 70.373]
  - - [4608, 24000, 1, 1536]
    - [21, 69.392]
  - - [4608, 12000, 1, 1536]
    - [6, 67.857]
  - - [4608, 5984, 1, 1536]
    - [6, 64.58]
  - - [7680, 48000, 1, 2560]
    - [6, 83.885]
  - - [7680, 24000, 1, 2560]
    - [6, 83.544]
  - - [7680, 12000, 1, 2560]
    - [1, 73.775]
  - - [7680, 5984, 1, 2560]
    - [1, 71.429]
  - - [1024, 700, 1, 512]
    - [17, 12.368]
  - - [512, 24000, 1, 1536]
    - [2, 69.527]
  - - [1760, 7000, 1, 1760]
    - [52, 63.635]
  - - [512, 24000, 1, 2048]
    - [38, 63.629]
  - - [2048, 7000, 1, 2048]
    - [6, 67.909]
  - - [512, 24000, 1, 2560]
    - [2, 75.919]
  - - [512, 24000, 1, 2816]
    - [41, 77.617]
  - - [512, 48000, 1, 1536]
    - [21, 62.479]
  - - [1024, 24000, 1, 1536]
    - [78, 64.371]
  - - [2560, 7000, 1, 2560]
    - [6, 67.713]
  - - [512, 48000, 1, 2048]
    - [6, 67.467]
  - - [1024, 24000, 1, 2048]
    - [21, 67.952]
  - - [512, 48000, 1, 2560]
    - [26, 67.993]
  - - [1024, 24000, 1, 2560]
    - [37, 69.093]
  - - [512, 48000, 1, 2816]
    - [21, 68.794]
  - - [1024, 24000, 1, 2816]
    - [37, 70.08]
  - - [1024, 48000, 1, 1536]
    - [78, 67.241]
  - - [3072, 24000, 1, 1024]
    - [6, 63.882]
  - - [5124, 9124, 1, 1760]
    - [79, 66.857]
  - - [5124, 9124, 1, 2048]
    - [21, 70.575]
  - - [1024, 48000, 1, 2048]
    - [78, 70.914]
  - - [4096, 7000, 1, 4096]
    - [1, 73.997]
  - - [5124, 9124, 1, 2560]
    - [78, 71.164]
  - - [1024, 48000, 1, 2560]
    - [78, 71.361]
  - - [1024, 48000, 1, 2816]
    - [37, 72.172]
  - - [3072, 48000, 1, 1024]
    - [21, 64.914]
  - - [5124, 9124, 1, 4096]
    - [78, 74.645]
  - - [6144, 24000, 1, 2560]
    - [78, 74.547]
  - - [6144, 48000, 1, 2560]
    - [78, 74.895]
  - - [32, 32, 1, 32]
    - [47, 0.002]
  - - [32, 64, 1, 256]
    - [29, 0.065]
  - - [32, 128, 1, 256]
    - [22, 0.054]
  - - [32, 256, 1, 256]
    - [62, 0.272]
  - - [32, 448, 1, 256]
    - [16, 0.431]
  - - [32, 704, 1, 256]
    - [84, 0.278]
  - - [32, 1024, 1, 256]
    - [83, 0.851]
  - - [32, 1408, 1, 256]
    - [83, 1.192]
  - - [32, 1856, 1, 256]
    - [83, 1.49]
  - - [32, 2368, 1, 256]
    - [12, 1.837]
  - - [32, 2944, 1, 256]
    - [12, 2.227]
  - - [32, 3584, 1, 256]
    - [16, 2.689]
  - - [32, 4288, 1, 256]
    - [16, 3.218]
  - - [32, 5056, 1, 256]
    - [16, 3.733]
  - - [32, 5888, 1, 256]
    - [50, 4.086]
  - - [32, 6784, 1, 256]
    - [29, 4.409]
  - - [32, 64, 1, 1280]
    - [20, 0.115]
  - - [32, 128, 1, 1280]
    - [50, 0.438]
  - - [32, 256, 1, 1280]
    - [96, 0.862]
  - - [32, 448, 1, 1280]
    - [12, 1.456]
  - - [32, 704, 1, 1280]
    - [11, 2.123]
  - - [32, 1024, 1, 1280]
    - [31, 2.954]
  - - [32, 1408, 1, 1280]
    - [11, 4.036]
  - - [32, 1856, 1, 1280]
    - [29, 5.068]
  - - [32, 2368, 1, 1280]
    - [16, 6.139]
  - - [32, 2944, 1, 1280]
    - [29, 7.113]
  - - [32, 3584, 1, 1280]
    - [29, 8.614]
  - - [32, 4288, 1, 1280]
    - [50, 9.7]
  - - [32, 5056, 1, 1280]
    - [29, 10.463]
  - - [32, 5888, 1, 1280]
    - [29, 11.712]
  - - [32, 6784, 1, 1280]
    - [85, 11.51]
  - - [32, 64, 1, 3328]
    - [20, 0.33]
  - - [32, 128, 1, 3328]
    - [96, 0.689]
  - - [32, 256, 1, 3328]
    - [35, 1.409]
  - - [32, 448, 1, 3328]
    - [12, 2.389]
  - - [32, 704, 1, 3328]
    - [16, 3.49]
  - - [32, 1024, 1, 3328]
    - [35, 4.934]
  - - [32, 1408, 1, 3328]
    - [29, 6.758]
  - - [32, 1856, 1, 3328]
    - [16, 5.933]
  - - [32, 2368, 1, 3328]
    - [50, 9.664]
  - - [32, 2944, 1, 3328]
    - [50, 10.869]
  - - [32, 3584, 1, 3328]
    - [12, 12.76]
  - - [32, 4288, 1, 3328]
    - [35, 13.192]
  - - [32, 5056, 1, 3328]
    - [50, 13.787]
  - - [32, 5888, 1, 3328]
    - [50, 16.82]
  - - [32, 6784, 1, 3328]
    - [7, 13.251]
  - - [64, 32, 1, 256]
    - [86, 0.055]
  - - [128, 32, 1, 256]
    - [16, 0.133]
  - - [256, 32, 1, 256]
    - [20, 0.265]
  - - [448, 32, 1, 256]
    - [12, 0.44]
  - - [704, 32, 1, 256]
    - [22, 0.619]
  - - [1408, 32, 1, 256]
    - [83, 0.545]
  - - [1856, 32, 1, 256]
    - [83, 1.53]
  - - [2368, 32, 1, 256]
    - [35, 1.884]
  - - [2944, 32, 1, 256]
    - [35, 2.283]
  - - [3584, 32, 1, 256]
    - [16, 2.803]
  - - [4288, 32, 1, 256]
    - [35, 3.271]
  - - [5056, 32, 1, 256]
    - [11, 3.794]
  - - [5888, 32, 1, 256]
    - [50, 2.037]
  - - [6784, 32, 1, 256]
    - [35, 2.354]
  - - [64, 32, 1, 1280]
    - [22, 0.197]
  - - [128, 32, 1, 1280]
    - [48, 0.434]
  - - [256, 32, 1, 1280]
    - [35, 0.882]
  - - [448, 32, 1, 1280]
    - [22, 1.426]
  - - [704, 32, 1, 1280]
    - [62, 1.157]
  - - [1408, 32, 1, 1280]
    - [12, 4.061]
  - - [1856, 32, 1, 1280]
    - [35, 5.16]
  - - [2368, 32, 1, 1280]
    - [29, 6.428]
  - - [2944, 32, 1, 1280]
    - [35, 4.508]
  - - [3584, 32, 1, 1280]
    - [12, 8.228]
  - - [4288, 32, 1, 1280]
    - [29, 6.18]
  - - [5056, 32, 1, 1280]
    - [35, 10.558]
  - - [5888, 32, 1, 1280]
    - [86, 7.584]
  - - [6784, 32, 1, 1280]
    - [10, 11.595]
  - - [64, 32, 1, 3328]
    - [20, 0.324]
  - - [128, 32, 1, 3328]
    - [11, 0.668]
  - - [256, 32, 1, 3328]
    - [28, 1.384]
  - - [448, 32, 1, 3328]
    - [20, 2.358]
  - - [704, 32, 1, 3328]
    - [11, 3.61]
  - - [1408, 32, 1, 3328]
    - [48, 6.651]
  - - [1856, 32, 1, 3328]
    - [12, 7.706]
  - - [2368, 32, 1, 3328]
    - [11, 9.697]
  - - [2944, 32, 1, 3328]
    - [29, 8.85]
  - - [3584, 32, 1, 3328]
    - [50, 12.012]
  - - [4288, 32, 1, 3328]
    - [12, 12.927]
  - - [5056, 32, 1, 3328]
    - [29, 13.366]
  - - [5888, 32, 1, 3328]
    - [29, 15.095]
  - - [6784, 32, 1, 3328]
    - [4, 15.018]
  - - [128, 64, 1, 32]
    - [80, 0.032]
  - - [448, 64, 1, 32]
    - [42, 0.108]
  - - [704, 64, 1, 32]
    - [97, 0.169]
  - - [1408, 64, 1, 32]
    - [15, 0.143]
  - - [1856, 64, 1, 32]
    - [61, 0.397]
  - - [2368, 64, 1, 32]
    - [15, 0.525]
  - - [2944, 64, 1, 32]
    - [80, 0.618]
  - - [3584, 64, 1, 32]
    - [45, 0.732]
  - - [4288, 64, 1, 32]
    - [80, 0.876]
  - - [5056, 64, 1, 32]
    - [15, 1.032]
  - - [5888, 64, 1, 32]
    - [15, 1.202]
  - - [6784, 64, 1, 32]
    - [15, 1.294]
  - - [448, 128, 1, 32]
    - [42, 0.215]
  - - [704, 128, 1, 32]
    - [15, 0.315]
  - - [1408, 128, 1, 32]
    - [15, 0.602]
  - - [1856, 128, 1, 32]
    - [45, 0.758]
  - - [2368, 128, 1, 32]
    - [45, 0.959]
  - - [2944, 128, 1, 32]
    - [15, 1.181]
  - - [3584, 128, 1, 32]
    - [15, 1.414]
  - - [4288, 128, 1, 32]
    - [15, 1.663]
  - - [5056, 128, 1, 32]
    - [61, 1.852]
  - - [5888, 128, 1, 32]
    - [15, 2.174]
  - - [6784, 128, 1, 32]
    - [61, 2.319]
  - - [128, 256, 1, 32]
    - [97, 0.122]
  - - [256, 256, 1, 32]
    - [61, 0.106]
  - - [448, 256, 1, 32]
    - [61, 0.398]
  - - [704, 256, 1, 32]
    - [15, 0.607]
  - - [1408, 256, 1, 32]
    - [15, 1.15]
  - - [1856, 256, 1, 32]
    - [15, 1.428]
  - - [2368, 256, 1, 32]
    - [15, 1.777]
  - - [2944, 256, 1, 32]
    - [15, 2.123]
  - - [3584, 256, 1, 32]
    - [15, 2.487]
  - - [4288, 256, 1, 32]
    - [15, 2.656]
  - - [5056, 256, 1, 32]
    - [15, 2.972]
  - - [5888, 256, 1, 32]
    - [15, 3.314]
  - - [6784, 256, 1, 32]
    - [15, 3.727]
  - - [64, 448, 1, 32]
    - [63, 0.107]
  - - [128, 448, 1, 32]
    - [53, 0.088]
  - - [256, 448, 1, 32]
    - [15, 0.413]
  - - [448, 448, 1, 32]
    - [15, 0.652]
  - - [704, 448, 1, 32]
    - [15, 1.006]
  - - [1024, 448, 1, 32]
    - [15, 1.402]
  - - [1408, 448, 1, 32]
    - [15, 1.864]
  - - [1856, 448, 1, 32]
    - [15, 2.324]
  - - [2368, 448, 1, 32]
    - [15, 2.567]
  - - [2944, 448, 1, 32]
    - [15, 3.048]
  - - [3584, 448, 1, 32]
    - [15, 3.466]
  - - [4288, 448, 1, 32]
    - [15, 3.645]
  - - [5056, 448, 1, 32]
    - [15, 4.043]
  - - [5888, 448, 1, 32]
    - [15, 4.403]
  - - [6784, 448, 1, 32]
    - [15, 4.723]
  - - [64, 704, 1, 32]
    - [99, 0.169]
  - - [128, 704, 1, 32]
    - [15, 0.309]
  - - [256, 704, 1, 32]
    - [53, 0.258]
  - - [448, 704, 1, 32]
    - [45, 0.997]
  - - [704, 704, 1, 32]
    - [15, 1.489]
  - - [1024, 704, 1, 32]
    - [15, 2.096]
  - - [1408, 704, 1, 32]
    - [15, 2.59]
  - - [1856, 704, 1, 32]
    - [15, 3.02]
  - - [2368, 704, 1, 32]
    - [15, 3.536]
  - - [2944, 704, 1, 32]
    - [15, 3.852]
  - - [3584, 704, 1, 32]
    - [61, 4.251]
  - - [4288, 704, 1, 32]
    - [15, 4.651]
  - - [5056, 704, 1, 32]
    - [15, 4.861]
  - - [5888, 704, 1, 32]
    - [15, 5.244]
  - - [6784, 704, 1, 32]
    - [61, 5.25]
  - - [128, 1024, 1, 32]
    - [15, 0.468]
  - - [448, 1024, 1, 32]
    - [15, 1.426]
  - - [704, 1024, 1, 32]
    - [15, 2.063]
  - - [1408, 1024, 1, 32]
    - [15, 3.229]
  - - [1856, 1024, 1, 32]
    - [15, 3.704]
  - - [2368, 1024, 1, 32]
    - [15, 4.183]
  - - [2944, 1024, 1, 32]
    - [15, 4.726]
  - - [3584, 1024, 1, 32]
    - [15, 4.937]
  - - [4288, 1024, 1, 32]
    - [15, 5.123]
  - - [5056, 1024, 1, 32]
    - [61, 5.474]
  - - [5888, 1024, 1, 32]
    - [15, 5.676]
  - - [6784, 1024, 1, 32]
    - [15, 5.838]
  - - [64, 1408, 1, 32]
    - [61, 0.328]
  - - [128, 1408, 1, 32]
    - [53, 0.277]
  - - [256, 1408, 1, 32]
    - [15, 1.111]
  - - [448, 1408, 1, 32]
    - [53, 0.826]
  - - [704, 1408, 1, 32]
    - [15, 2.499]
  - - [1024, 1408, 1, 32]
    - [15, 3.189]
  - - [1408, 1408, 1, 32]
    - [15, 3.782]
  - - [1856, 1408, 1, 32]
    - [15, 4.403]
  - - [2368, 1408, 1, 32]
    - [15, 4.733]
  - - [2944, 1408, 1, 32]
    - [15, 5.171]
  - - [3584, 1408, 1, 32]
    - [15, 5.496]
  - - [4288, 1408, 1, 32]
    - [61, 4.456]
  - - [5056, 1408, 1, 32]
    - [15, 5.927]
  - - [5888, 1408, 1, 32]
    - [15, 6.05]
  - - [6784, 1408, 1, 32]
    - [15, 6.216]
  - - [64, 1856, 1, 32]
    - [15, 0.437]
  - - [128, 1856, 1, 32]
    - [45, 0.745]
  - - [256, 1856, 1, 32]
    - [15, 1.381]
  - - [448, 1856, 1, 32]
    - [15, 2.324]
  - - [704, 1856, 1, 32]
    - [15, 3.001]
  - - [1024, 1856, 1, 32]
    - [15, 3.724]
  - - [1408, 1856, 1, 32]
    - [15, 4.362]
  - - [1856, 1856, 1, 32]
    - [61, 4.814]
  - - [2368, 1856, 1, 32]
    - [61, 5.095]
  - - [2944, 1856, 1, 32]
    - [15, 5.442]
  - - [3584, 1856, 1, 32]
    - [15, 5.765]
  - - [4288, 1856, 1, 32]
    - [15, 6.105]
  - - [5056, 1856, 1, 32]
    - [15, 6.185]
  - - [5888, 1856, 1, 32]
    - [15, 6.334]
  - - [6784, 1856, 1, 32]
    - [15, 6.43]
  - - [64, 2368, 1, 32]
    - [61, 0.52]
  - - [128, 2368, 1, 32]
    - [45, 0.95]
  - - [256, 2368, 1, 32]
    - [15, 1.821]
  - - [448, 2368, 1, 32]
    - [15, 2.732]
  - - [704, 2368, 1, 32]
    - [15, 3.665]
  - - [1024, 2368, 1, 32]
    - [15, 4.104]
  - - [1408, 2368, 1, 32]
    - [15, 4.847]
  - - [1856, 2368, 1, 32]
    - [61, 5.111]
  - - [2368, 2368, 1, 32]
    - [15, 5.479]
  - - [2944, 2368, 1, 32]
    - [15, 5.859]
  - - [3584, 2368, 1, 32]
    - [15, 6.12]
  - - [4288, 2368, 1, 32]
    - [15, 6.258]
  - - [5056, 2368, 1, 32]
    - [15, 6.452]
  - - [5888, 2368, 1, 32]
    - [61, 6.478]
  - - [6784, 2368, 1, 32]
    - [15, 6.567]
  - - [64, 2944, 1, 32]
    - [15, 0.607]
  - - [128, 2944, 1, 32]
    - [15, 1.151]
  - - [256, 2944, 1, 32]
    - [15, 2.123]
  - - [448, 2944, 1, 32]
    - [45, 1.551]
  - - [704, 2944, 1, 32]
    - [15, 3.912]
  - - [1024, 2944, 1, 32]
    - [15, 4.665]
  - - [1408, 2944, 1, 32]
    - [15, 5.189]
  - - [1856, 2944, 1, 32]
    - [15, 5.565]
  - - [2368, 2944, 1, 32]
    - [15, 5.984]
  - - [2944, 2944, 1, 32]
    - [15, 6.188]
  - - [3584, 2944, 1, 32]
    - [15, 6.34]
  - - [4288, 2944, 1, 32]
    - [15, 6.383]
  - - [5056, 2944, 1, 32]
    - [61, 6.56]
  - - [5888, 2944, 1, 32]
    - [15, 6.691]
  - - [6784, 2944, 1, 32]
    - [15, 6.748]
  - - [64, 3584, 1, 32]
    - [53, 0.707]
  - - [128, 3584, 1, 32]
    - [15, 1.302]
  - - [448, 3584, 1, 32]
    - [61, 3.289]
  - - [704, 3584, 1, 32]
    - [15, 4.352]
  - - [1024, 3584, 1, 32]
    - [15, 4.847]
  - - [1408, 3584, 1, 32]
    - [15, 5.48]
  - - [1856, 3584, 1, 32]
    - [61, 5.696]
  - - [2368, 3584, 1, 32]
    - [15, 6.194]
  - - [2944, 3584, 1, 32]
    - [15, 6.246]
  - - [3584, 3584, 1, 32]
    - [15, 6.523]
  - - [4288, 3584, 1, 32]
    - [15, 6.612]
  - - [5056, 3584, 1, 32]
    - [61, 6.777]
  - - [5888, 3584, 1, 32]
    - [15, 6.781]
  - - [6784, 3584, 1, 32]
    - [15, 6.87]
  - - [64, 4288, 1, 32]
    - [15, 0.853]
  - - [128, 4288, 1, 32]
    - [15, 1.622]
  - - [256, 4288, 1, 32]
    - [15, 2.638]
  - - [448, 4288, 1, 32]
    - [15, 3.785]
  - - [704, 4288, 1, 32]
    - [15, 4.691]
  - - [1024, 4288, 1, 32]
    - [15, 5.294]
  - - [1408, 4288, 1, 32]
    - [15, 5.669]
  - - [1856, 4288, 1, 32]
    - [15, 5.119]
  - - [2368, 4288, 1, 32]
    - [15, 6.269]
  - - [2944, 4288, 1, 32]
    - [15, 6.456]
  - - [3584, 4288, 1, 32]
    - [15, 6.604]
  - - [4288, 4288, 1, 32]
    - [15, 6.744]
  - - [5056, 4288, 1, 32]
    - [15, 6.844]
  - - [5888, 4288, 1, 32]
    - [15, 6.875]
  - - [6784, 4288, 1, 32]
    - [15, 6.982]
  - - [64, 5056, 1, 32]
    - [45, 0.98]
  - - [128, 5056, 1, 32]
    - [61, 1.809]
  - - [256, 5056, 1, 32]
    - [53, 2.953]
  - - [448, 5056, 1, 32]
    - [15, 4.063]
  - - [704, 5056, 1, 32]
    - [15, 4.993]
  - - [1024, 5056, 1, 32]
    - [15, 5.348]
  - - [1408, 5056, 1, 32]
    - [15, 5.914]
  - - [1856, 5056, 1, 32]
    - [15, 6.3]
  - - [2368, 5056, 1, 32]
    - [15, 6.414]
  - - [2944, 5056, 1, 32]
    - [15, 6.529]
  - - [3584, 5056, 1, 32]
    - [15, 6.784]
  - - [4288, 5056, 1, 32]
    - [15, 6.838]
  - - [5056, 5056, 1, 32]
    - [15, 6.924]
  - - [5888, 5056, 1, 32]
    - [15, 6.96]
  - - [6784, 5056, 1, 32]
    - [61, 6.986]
  - - [64, 5888, 1, 32]
    - [45, 1.142]
  - - [128, 5888, 1, 32]
    - [15, 2.123]
  - - [448, 5888, 1, 32]
    - [15, 4.486]
  - - [704, 5888, 1, 32]
    - [15, 5.318]
  - - [1024, 5888, 1, 32]
    - [15, 5.631]
  - - [1408, 5888, 1, 32]
    - [15, 6.125]
  - - [1856, 5888, 1, 32]
    - [15, 6.355]
  - - [2368, 5888, 1, 32]
    - [15, 6.545]
  - - [2944, 5888, 1, 32]
    - [15, 6.691]
  - - [3584, 5888, 1, 32]
    - [15, 6.793]
  - - [4288, 5888, 1, 32]
    - [61, 6.885]
  - - [5056, 5888, 1, 32]
    - [61, 7.001]
  - - [5888, 5888, 1, 32]
    - [15, 6.991]
  - - [6784, 5888, 1, 32]
    - [15, 7.059]
  - - [64, 6784, 1, 32]
    - [15, 1.223]
  - - [128, 6784, 1, 32]
    - [15, 2.319]
  - - [256, 6784, 1, 32]
    - [15, 3.598]
  - - [448, 6784, 1, 32]
    - [15, 4.723]
  - - [704, 6784, 1, 32]
    - [15, 5.449]
  - - [1024, 6784, 1, 32]
    - [15, 5.921]
  - - [1408, 6784, 1, 32]
    - [15, 6.284]
  - - [1856, 6784, 1, 32]
    - [15, 6.466]
  - - [2368, 6784, 1, 32]
    - [61, 6.634]
  - - [2944, 6784, 1, 32]
    - [15, 6.787]
  - - [3584, 6784, 1, 32]
    - [15, 6.891]
  - - [4288, 6784, 1, 32]
    - [15, 7.011]
  - - [5056, 6784, 1, 32]
    - [15, 7.066]
  - - [5888, 6784, 1, 32]
    - [15, 7.084]
  - - [6784, 6784, 1, 32]
    - [15, 7.1]
  - - [32, 32, 1, 256]
    - [46, 0.028]
  - - [32, 32, 1, 1280]
    - [16, 0.1]
  - - [32, 32, 1, 3328]
    - [12, 0.165]
  - - [32, 64, 1, 32]
    - [45, 0.009]
  - - [32, 128, 1, 32]
    - [45, 0.019]
  - - [32, 256, 1, 32]
    - [45, 0.037]
  - - [32, 448, 1, 32]
    - [97, 0.023]
  - - [32, 704, 1, 32]
    - [98, 0.086]
  - - [32, 1024, 1, 32]
    - [98, 0.124]
  - - [32, 1408, 1, 32]
    - [97, 0.173]
  - - [32, 1856, 1, 32]
    - [99, 0.221]
  - - [32, 2368, 1, 32]
    - [44, 0.117]
  - - [32, 2944, 1, 32]
    - [100, 0.32]
  - - [32, 3584, 1, 32]
    - [100, 0.372]
  - - [32, 4288, 1, 32]
    - [100, 0.45]
  - - [32, 5056, 1, 32]
    - [47, 0.512]
  - - [32, 5888, 1, 32]
    - [80, 0.586]
  - - [32, 6784, 1, 32]
    - [80, 0.675]
  - - [64, 32, 1, 32]
    - [80, 0.008]
  - - [128, 32, 1, 32]
    - [45, 0.018]
  - - [256, 32, 1, 32]
    - [97, 0.014]
  - - [448, 32, 1, 32]
    - [63, 0.024]
  - - [704, 32, 1, 32]
    - [42, 0.084]
  - - [1408, 32, 1, 32]
    - [42, 0.173]
  - - [1856, 32, 1, 32]
    - [99, 0.221]
  - - [2368, 32, 1, 32]
    - [15, 0.273]
  - - [2944, 32, 1, 32]
    - [15, 0.34]
  - - [3584, 32, 1, 32]
    - [15, 0.413]
  - - [4288, 32, 1, 32]
    - [15, 0.476]
  - - [5056, 32, 1, 32]
    - [15, 0.521]
  - - [5888, 32, 1, 32]
    - [80, 0.586]
  - - [6784, 32, 1, 32]
    - [47, 0.658]
  - - [1, 1, 1, 1]
    - [80, 0.0]
  - - [1, 64, 1, 256]
    - [48, 0.002]
  - - [1, 128, 1, 256]
    - [31, 0.004]
  - - [1, 256, 1, 256]
    - [29, 0.008]
  - - [1, 448, 1, 256]
    - [12, 0.014]
  - - [1, 704, 1, 256]
    - [62, 0.021]
  - - [1, 1024, 1, 256]
    - [16, 0.03]
  - - [1, 1408, 1, 256]
    - [62, 0.037]
  - - [1, 1856, 1, 256]
    - [29, 0.045]
  - - [1, 2368, 1, 256]
    - [31, 0.056]
  - - [1, 2944, 1, 256]
    - [20, 0.068]
  - - [1, 3584, 1, 256]
    - [11, 0.081]
  - - [1, 4288, 1, 256]
    - [12, 0.099]
  - - [1, 5056, 1, 256]
    - [11, 0.117]
  - - [1, 5888, 1, 256]
    - [16, 0.135]
  - - [1, 6784, 1, 256]
    - [11, 0.153]
  - - [1, 64, 1, 1280]
    - [48, 0.006]
  - - [1, 128, 1, 1280]
    - [31, 0.007]
  - - [1, 256, 1, 1280]
    - [20, 0.028]
  - - [1, 448, 1, 1280]
    - [16, 0.048]
  - - [1, 704, 1, 1280]
    - [11, 0.074]
  - - [1, 1024, 1, 1280]
    - [62, 0.102]
  - - [1, 1408, 1, 1280]
    - [11, 0.131]
  - - [1, 1856, 1, 1280]
    - [12, 0.165]
  - - [1, 2368, 1, 1280]
    - [29, 0.211]
  - - [1, 2944, 1, 1280]
    - [12, 0.251]
  - - [1, 3584, 1, 1280]
    - [11, 0.297]
  - - [1, 4288, 1, 1280]
    - [29, 0.357]
  - - [1, 5056, 1, 1280]
    - [29, 0.412]
  - - [1, 5888, 1, 1280]
    - [16, 0.438]
  - - [1, 6784, 1, 1280]
    - [29, 0.489]
  - - [1, 64, 1, 3328]
    - [31, 0.01]
  - - [1, 128, 1, 3328]
    - [48, 0.022]
  - - [1, 256, 1, 3328]
    - [20, 0.045]
  - - [1, 448, 1, 3328]
    - [29, 0.077]
  - - [1, 704, 1, 3328]
    - [16, 0.122]
  - - [1, 1024, 1, 3328]
    - [12, 0.172]
  - - [1, 1408, 1, 3328]
    - [48, 0.225]
  - - [1, 1856, 1, 3328]
    - [62, 0.283]
  - - [1, 2368, 1, 3328]
    - [29, 0.343]
  - - [1, 2944, 1, 3328]
    - [12, 0.42]
  - - [1, 3584, 1, 3328]
    - [12, 0.487]
  - - [1, 4288, 1, 3328]
    - [12, 0.551]
  - - [1, 5056, 1, 3328]
    - [16, 0.634]
  - - [1, 5888, 1, 3328]
    - [29, 0.661]
  - - [1, 6784, 1, 3328]
    - [16, 0.723]
  - - [64, 1, 1, 256]
    - [50, 0.001]
  - - [128, 1, 1, 256]
    - [62, 0.004]
  - - [256, 1, 1, 256]
    - [22, 0.007]
  - - [448, 1, 1, 256]
    - [96, 0.013]
  - - [704, 1, 1, 256]
    - [35, 0.021]
  - - [1408, 1, 1, 256]
    - [66, 0.017]
  - - [1856, 1, 1, 256]
    - [83, 0.045]
  - - [2368, 1, 1, 256]
    - [83, 0.057]
  - - [2944, 1, 1, 256]
    - [22, 0.071]
  - - [3584, 1, 1, 256]
    - [86, 0.084]
  - - [4288, 1, 1, 256]
    - [50, 0.101]
  - - [5056, 1, 1, 256]
    - [50, 0.059]
  - - [5888, 1, 1, 256]
    - [35, 0.138]
  - - [6784, 1, 1, 256]
    - [35, 0.158]
  - - [64, 1, 1, 1280]
    - [48, 0.006]
  - - [128, 1, 1, 1280]
    - [35, 0.013]
  - - [256, 1, 1, 1280]
    - [35, 0.025]
  - - [448, 1, 1, 1280]
    - [35, 0.046]
  - - [704, 1, 1, 1280]
    - [35, 0.073]
  - - [1408, 1, 1, 1280]
    - [22, 0.13]
  - - [1856, 1, 1, 1280]
    - [20, 0.095]
  - - [2368, 1, 1, 1280]
    - [22, 0.207]
  - - [2944, 1, 1, 1280]
    - [31, 0.251]
  - - [3584, 1, 1, 1280]
    - [11, 0.299]
  - - [4288, 1, 1, 1280]
    - [86, 0.351]
  - - [5056, 1, 1, 1280]
    - [29, 0.412]
  - - [5888, 1, 1, 1280]
    - [50, 0.449]
  - - [6784, 1, 1, 1280]
    - [35, 0.494]
  - - [64, 1, 1, 3328]
    - [35, 0.01]
  - - [128, 1, 1, 3328]
    - [22, 0.021]
  - - [256, 1, 1, 3328]
    - [48, 0.043]
  - - [448, 1, 1, 3328]
    - [48, 0.072]
  - - [704, 1, 1, 3328]
    - [50, 0.075]
  - - [1408, 1, 1, 3328]
    - [20, 0.143]
  - - [1856, 1, 1, 3328]
    - [35, 0.277]
  - - [2368, 1, 1, 3328]
    - [96, 0.347]
  - - [2944, 1, 1, 3328]
    - [11, 0.428]
  - - [3584, 1, 1, 3328]
    - [50, 0.478]
  - - [4288, 1, 1, 3328]
    - [29, 0.554]
  - - [5056, 1, 1, 3328]
    - [11, 0.632]
  - - [5888, 1, 1, 3328]
    - [12, 0.642]
  - - [6784, 1, 1, 3328]
    - [12, 0.707]
  - - [128, 64, 1, 1]
    - [47, 0.001]
  - - [448, 64, 1, 1]
    - [63, 0.003]
  - - [704, 64, 1, 1]
    - [15, 0.002]
  - - [1408, 64, 1, 1]
    - [63, 0.009]
  - - [1856, 64, 1, 1]
    - [15, 0.011]
  - - [2368, 64, 1, 1]
    - [15, 0.014]
  - - [2944, 64, 1, 1]
    - [15, 0.017]
  - - [3584, 64, 1, 1]
    - [15, 0.02]
  - - [4288, 64, 1, 1]
    - [53, 0.024]
  - - [5056, 64, 1, 1]
    - [15, 0.028]
  - - [5888, 64, 1, 1]
    - [61, 0.016]
  - - [6784, 64, 1, 1]
    - [15, 0.036]
  - - [448, 128, 1, 1]
    - [63, 0.006]
  - - [704, 128, 1, 1]
    - [61, 0.004]
  - - [1408, 128, 1, 1]
    - [15, 0.017]
  - - [1856, 128, 1, 1]
    - [15, 0.021]
  - - [2368, 128, 1, 1]
    - [53, 0.013]
  - - [2944, 128, 1, 1]
    - [15, 0.033]
  - - [3584, 128, 1, 1]
    - [15, 0.039]
  - - [4288, 128, 1, 1]
    - [15, 0.044]
  - - [5056, 128, 1, 1]
    - [61, 0.026]
  - - [5888, 128, 1, 1]
    - [15, 0.057]
  - - [6784, 128, 1, 1]
    - [15, 0.064]
  - - [128, 256, 1, 1]
    - [63, 0.003]
  - - [256, 256, 1, 1]
    - [61, 0.003]
  - - [448, 256, 1, 1]
    - [15, 0.011]
  - - [704, 256, 1, 1]
    - [15, 0.017]
  - - [1408, 256, 1, 1]
    - [15, 0.031]
  - - [1856, 256, 1, 1]
    - [15, 0.039]
  - - [2368, 256, 1, 1]
    - [53, 0.024]
  - - [2944, 256, 1, 1]
    - [53, 0.058]
  - - [3584, 256, 1, 1]
    - [15, 0.065]
  - - [4288, 256, 1, 1]
    - [15, 0.072]
  - - [5056, 256, 1, 1]
    - [15, 0.081]
  - - [5888, 256, 1, 1]
    - [15, 0.089]
  - - [6784, 256, 1, 1]
    - [15, 0.093]
  - - [64, 448, 1, 1]
    - [42, 0.001]
  - - [128, 448, 1, 1]
    - [97, 0.003]
  - - [256, 448, 1, 1]
    - [15, 0.011]
  - - [448, 448, 1, 1]
    - [53, 0.009]
  - - [704, 448, 1, 1]
    - [15, 0.027]
  - - [1024, 448, 1, 1]
    - [15, 0.038]
  - - [1408, 448, 1, 1]
    - [53, 0.024]
  - - [1856, 448, 1, 1]
    - [53, 0.031]
  - - [2368, 448, 1, 1]
    - [15, 0.068]
  - - [2944, 448, 1, 1]
    - [15, 0.079]
  - - [3584, 448, 1, 1]
    - [15, 0.091]
  - - [4288, 448, 1, 1]
    - [15, 0.099]
  - - [5056, 448, 1, 1]
    - [61, 0.105]
  - - [5888, 448, 1, 1]
    - [15, 0.111]
  - - [6784, 448, 1, 1]
    - [15, 0.121]
  - - [64, 704, 1, 1]
    - [63, 0.004]
  - - [128, 704, 1, 1]
    - [61, 0.004]
  - - [256, 704, 1, 1]
    - [15, 0.017]
  - - [448, 704, 1, 1]
    - [15, 0.013]
  - - [704, 704, 1, 1]
    - [15, 0.04]
  - - [1024, 704, 1, 1]
    - [15, 0.054]
  - - [1408, 704, 1, 1]
    - [53, 0.036]
  - - [1856, 704, 1, 1]
    - [15, 0.082]
  - - [2368, 704, 1, 1]
    - [61, 0.088]
  - - [2944, 704, 1, 1]
    - [15, 0.102]
  - - [3584, 704, 1, 1]
    - [15, 0.113]
  - - [4288, 704, 1, 1]
    - [61, 0.121]
  - - [5056, 704, 1, 1]
    - [15, 0.129]
  - - [5888, 704, 1, 1]
    - [61, 0.138]
  - - [6784, 704, 1, 1]
    - [15, 0.113]
  - - [128, 1024, 1, 1]
    - [63, 0.006]
  - - [448, 1024, 1, 1]
    - [61, 0.019]
  - - [704, 1024, 1, 1]
    - [15, 0.027]
  - - [1408, 1024, 1, 1]
    - [53, 0.048]
  - - [1856, 1024, 1, 1]
    - [15, 0.099]
  - - [2368, 1024, 1, 1]
    - [15, 0.112]
  - - [2944, 1024, 1, 1]
    - [15, 0.12]
  - - [3584, 1024, 1, 1]
    - [15, 0.133]
  - - [4288, 1024, 1, 1]
    - [15, 0.137]
  - - [5056, 1024, 1, 1]
    - [15, 0.145]
  - - [5888, 1024, 1, 1]
    - [15, 0.149]
  - - [6784, 1024, 1, 1]
    - [61, 0.155]
  - - [64, 1408, 1, 1]
    - [15, 0.004]
  - - [128, 1408, 1, 1]
    - [15, 0.017]
  - - [256, 1408, 1, 1]
    - [15, 0.032]
  - - [448, 1408, 1, 1]
    - [53, 0.024]
  - - [704, 1408, 1, 1]
    - [15, 0.036]
  - - [1024, 1408, 1, 1]
    - [15, 0.086]
  - - [1408, 1408, 1, 1]
    - [15, 0.1]
  - - [1856, 1408, 1, 1]
    - [15, 0.112]
  - - [2368, 1408, 1, 1]
    - [61, 0.125]
  - - [2944, 1408, 1, 1]
    - [15, 0.138]
  - - [3584, 1408, 1, 1]
    - [15, 0.145]
  - - [4288, 1408, 1, 1]
    - [15, 0.153]
  - - [5056, 1408, 1, 1]
    - [15, 0.16]
  - - [5888, 1408, 1, 1]
    - [15, 0.161]
  - - [6784, 1408, 1, 1]
    - [15, 0.166]
  - - [64, 1856, 1, 1]
    - [15, 0.011]
  - - [128, 1856, 1, 1]
    - [99, 0.021]
  - - [256, 1856, 1, 1]
    - [15, 0.039]
  - - [448, 1856, 1, 1]
    - [15, 0.062]
  - - [704, 1856, 1, 1]
    - [15, 0.082]
  - - [1024, 1856, 1, 1]
    - [15, 0.1]
  - - [1408, 1856, 1, 1]
    - [61, 0.076]
  - - [1856, 1856, 1, 1]
    - [15, 0.126]
  - - [2368, 1856, 1, 1]
    - [15, 0.14]
  - - [2944, 1856, 1, 1]
    - [15, 0.147]
  - - [3584, 1856, 1, 1]
    - [15, 0.158]
  - - [4288, 1856, 1, 1]
    - [15, 0.162]
  - - [5056, 1856, 1, 1]
    - [15, 0.168]
  - - [5888, 1856, 1, 1]
    - [15, 0.174]
  - - [6784, 1856, 1, 1]
    - [15, 0.173]
  - - [64, 2368, 1, 1]
    - [61, 0.014]
  - - [128, 2368, 1, 1]
    - [15, 0.028]
  - - [256, 2368, 1, 1]
    - [53, 0.024]
  - - [448, 2368, 1, 1]
    - [53, 0.038]
  - - [704, 2368, 1, 1]
    - [61, 0.091]
  - - [1024, 2368, 1, 1]
    - [15, 0.111]
  - - [1408, 2368, 1, 1]
    - [15, 0.125]
  - - [1856, 2368, 1, 1]
    - [15, 0.139]
  - - [2368, 2368, 1, 1]
    - [61, 0.151]
  - - [2944, 2368, 1, 1]
    - [15, 0.16]
  - - [3584, 2368, 1, 1]
    - [15, 0.166]
  - - [4288, 2368, 1, 1]
    - [15, 0.17]
  - - [5056, 2368, 1, 1]
    - [61, 0.173]
  - - [5888, 2368, 1, 1]
    - [15, 0.176]
  - - [6784, 2368, 1, 1]
    - [15, 0.18]
  - - [64, 2944, 1, 1]
    - [15, 0.017]
  - - [128, 2944, 1, 1]
    - [15, 0.033]
  - - [256, 2944, 1, 1]
    - [15, 0.058]
  - - [448, 2944, 1, 1]
    - [15, 0.081]
  - - [704, 2944, 1, 1]
    - [15, 0.104]
  - - [1024, 2944, 1, 1]
    - [61, 0.119]
  - - [1408, 2944, 1, 1]
    - [61, 0.136]
  - - [1856, 2944, 1, 1]
    - [15, 0.148]
  - - [2368, 2944, 1, 1]
    - [15, 0.157]
  - - [2944, 2944, 1, 1]
    - [61, 0.166]
  - - [3584, 2944, 1, 1]
    - [61, 0.17]
  - - [4288, 2944, 1, 1]
    - [15, 0.174]
  - - [5056, 2944, 1, 1]
    - [15, 0.178]
  - - [5888, 2944, 1, 1]
    - [61, 0.18]
  - - [6784, 2944, 1, 1]
    - [15, 0.183]
  - - [64, 3584, 1, 1]
    - [15, 0.021]
  - - [128, 3584, 1, 1]
    - [15, 0.039]
  - - [448, 3584, 1, 1]
    - [15, 0.085]
  - - [704, 3584, 1, 1]
    - [15, 0.112]
  - - [1024, 3584, 1, 1]
    - [15, 0.132]
  - - [1408, 3584, 1, 1]
    - [15, 0.146]
  - - [1856, 3584, 1, 1]
    - [15, 0.157]
  - - [2368, 3584, 1, 1]
    - [15, 0.164]
  - - [2944, 3584, 1, 1]
    - [15, 0.17]
  - - [3584, 3584, 1, 1]
    - [15, 0.175]
  - - [4288, 3584, 1, 1]
    - [15, 0.178]
  - - [5056, 3584, 1, 1]
    - [15, 0.183]
  - - [5888, 3584, 1, 1]
    - [61, 0.183]
  - - [6784, 3584, 1, 1]
    - [61, 0.184]
  - - [64, 4288, 1, 1]
    - [15, 0.025]
  - - [128, 4288, 1, 1]
    - [15, 0.045]
  - - [256, 4288, 1, 1]
    - [53, 0.039]
  - - [448, 4288, 1, 1]
    - [15, 0.1]
  - - [704, 4288, 1, 1]
    - [15, 0.121]
  - - [1024, 4288, 1, 1]
    - [15, 0.14]
  - - [1408, 4288, 1, 1]
    - [61, 0.153]
  - - [1856, 4288, 1, 1]
    - [15, 0.165]
  - - [2368, 4288, 1, 1]
    - [15, 0.167]
  - - [2944, 4288, 1, 1]
    - [61, 0.173]
  - - [3584, 4288, 1, 1]
    - [61, 0.178]
  - - [4288, 4288, 1, 1]
    - [15, 0.182]
  - - [5056, 4288, 1, 1]
    - [61, 0.184]
  - - [5888, 4288, 1, 1]
    - [15, 0.187]
  - - [6784, 4288, 1, 1]
    - [15, 0.188]
  - - [64, 5056, 1, 1]
    - [15, 0.028]
  - - [128, 5056, 1, 1]
    - [53, 0.052]
  - - [256, 5056, 1, 1]
    - [53, 0.08]
  - - [448, 5056, 1, 1]
    - [15, 0.069]
  - - [704, 5056, 1, 1]
    - [15, 0.13]
  - - [1024, 5056, 1, 1]
    - [15, 0.142]
  - - [1408, 5056, 1, 1]
    - [15, 0.161]
  - - [1856, 5056, 1, 1]
    - [61, 0.166]
  - - [2368, 5056, 1, 1]
    - [15, 0.175]
  - - [2944, 5056, 1, 1]
    - [15, 0.179]
  - - [3584, 5056, 1, 1]
    - [15, 0.182]
  - - [4288, 5056, 1, 1]
    - [61, 0.184]
  - - [5056, 5056, 1, 1]
    - [15, 0.187]
  - - [5888, 5056, 1, 1]
    - [61, 0.189]
  - - [6784, 5056, 1, 1]
    - [61, 0.19]
  - - [64, 5888, 1, 1]
    - [15, 0.032]
  - - [128, 5888, 1, 1]
    - [53, 0.058]
  - - [448, 5888, 1, 1]
    - [15, 0.115]
  - - [704, 5888, 1, 1]
    - [15, 0.137]
  - - [1024, 5888, 1, 1]
    - [15, 0.152]
  - - [1408, 5888, 1, 1]
    - [15, 0.165]
  - - [1856, 5888, 1, 1]
    - [15, 0.17]
  - - [2368, 5888, 1, 1]
    - [15, 0.176]
  - - [2944, 5888, 1, 1]
    - [61, 0.18]
  - - [3584, 5888, 1, 1]
    - [15, 0.185]
  - - [4288, 5888, 1, 1]
    - [15, 0.186]
  - - [5056, 5888, 1, 1]
    - [15, 0.19]
  - - [5888, 5888, 1, 1]
    - [15, 0.191]
  - - [6784, 5888, 1, 1]
    - [61, 0.19]
  - - [64, 6784, 1, 1]
    - [15, 0.036]
  - - [128, 6784, 1, 1]
    - [53, 0.033]
  - - [256, 6784, 1, 1]
    - [15, 0.094]
  - - [448, 6784, 1, 1]
    - [15, 0.125]
  - - [704, 6784, 1, 1]
    - [15, 0.144]
  - - [1024, 6784, 1, 1]
    - [61, 0.156]
  - - [1408, 6784, 1, 1]
    - [15, 0.167]
  - - [1856, 6784, 1, 1]
    - [61, 0.174]
  - - [2368, 6784, 1, 1]
    - [15, 0.181]
  - - [2944, 6784, 1, 1]
    - [15, 0.184]
  - - [3584, 6784, 1, 1]
    - [61, 0.187]
  - - [4288, 6784, 1, 1]
    - [15, 0.189]
  - - [5056, 6784, 1, 1]
    - [15, 0.19]
  - - [5888, 6784, 1, 1]
    - [15, 0.193]
  - - [6784, 6784, 1, 1]
    - [15, 0.192]
  - - [1, 1, 1, 256]
    - [65, 0.0]
  - - [1, 1, 1, 1280]
    - [29, 0.0]
  - - [1, 1, 1, 3328]
    - [48, 0.0]
  - - [1, 64, 1, 1]
    - [80, 0.0]
  - - [1, 128, 1, 1]
    - [45, 0.0]
  - - [1, 256, 1, 1]
    - [47, 0.0]
  - - [1, 448, 1, 1]
    - [45, 0.0]
  - - [1, 704, 1, 1]
    - [80, 0.0]
  - - [1, 1024, 1, 1]
    - [80, 0.0]
  - - [1, 1408, 1, 1]
    - [97, 0.0]
  - - [1, 1856, 1, 1]
    - [97, 0.0]
  - - [1, 2368, 1, 1]
    - [98, 0.0]
  - - [1, 2944, 1, 1]
    - [80, 0.0]
  - - [1, 3584, 1, 1]
    - [80, 0.0]
  - - [1, 4288, 1, 1]
    - [47, 0.0]
  - - [1, 5056, 1, 1]
    - [45, 0.0]
  - - [1, 5888, 1, 1]
    - [80, 0.001]
  - - [1, 6784, 1, 1]
    - [45, 0.001]
  - - [64, 1, 1, 1]
    - [101, 0.0]
  - - [128, 1, 1, 1]
    - [47, 0.0]
  - - [256, 1, 1, 1]
    - [80, 0.0]
  - - [448, 1, 1, 1]
    - [80, 0.0]
  - - [704, 1, 1, 1]
    - [80, 0.0]
  - - [1408, 1, 1, 1]
    - [63, 0.0]
  - - [1856, 1, 1, 1]
    - [42, 0.0]
  - - [2368, 1, 1, 1]
    - [63, 0.0]
  - - [2944, 1, 1, 1]
    - [63, 0.0]
  - - [3584, 1, 1, 1]
    - [15, 0.0]
  - - [4288, 1, 1, 1]
    - [15, 0.0]
  - - [5056, 1, 1, 1]
    - [61, 0.0]
  - - [5888, 1, 1, 1]
    - [15, 0.001]
  - - [6784, 1, 1, 1]
    - [63, 0.001]
- null
