library/src/blas3/Tensile/Logic/asm_full/aldebaran_104cu/aldebaran_Cijk_Ailk_Bjlk_I8II_BH.yaml
- {MinimumRequiredVersion: 4.32.1}
- aldebaran
- {Architecture: gfx90a, CUCount: 104}
- [Device 7400, Device 7408, Device 740c]
    SolutionIndex: 0
    SolutionNameMin: Cijk_Ailk_Bjlk_I8II_BH_MT64x64x64_MI32x32x8x1_SE_AF0EM1_EPS1_GRVW4_NLCA1_NLCB1_OPLV0_PK0_PAP0_PGR1_SU32_SUS256_SRVW0_TT1_32_WG64_4_1_WGM8
    SolutionIndex: 1
    SolutionNameMin: Cijk_Ailk_Bjlk_I8II_BH_MT64x64x16_MI32x32x8x1_SE_AF0EM4_EPS1_GRVW4_NLCA1_NLCB1_OPLV0_PK0_PAP0_PGR1_SU32_SUS256_SRVW0_TT1_32_WG64_4_1_WGM8
    SolutionIndex: 2
    SolutionNameMin: Cijk_Ailk_Bjlk_I8II_BH_MT32x32x32_MI16x16x16x1_SE_AF0EM8_EPS0_GRVW8_NLCA1_NLCB1_OPLV0_PK0_PAP0_PGR2_SU0_SUS0_SRVW0_TT1_16_WG32_8_1_WGM1
    SolutionIndex: 3
    SolutionNameMin: Cijk_Ailk_Bjlk_I8II_BH_MT64x64x64_MI32x32x8x1_SE_AF0EM8_EPS0_GRVW16_NLCA1_NLCB1_OPLV0_PK0_PAP0_PGR2_SU0_SUS0_SRVW4_TT1_32_WG64_4_1_WGM1
    SolutionIndex: 4
    SolutionNameMin: Cijk_Ailk_Bjlk_I8II_BH_MT128x96x32_MI32x32x8x1_SE_AF0EM8_EPS0_GRVW4_NLCA1_NLCB3_OPLV0_PK0_PAP0_PGR2_SU0_SUS0_SRVW4_TT1_96_WG128_2_1_WGM1
    SolutionIndex: 5
    SolutionNameMin: Cijk_Ailk_Bjlk_I8II_BH_MT128x128x32_MI32x32x8x1_SE_AF0EM8_EPS0_GRVW16_NLCA1_NLCB1_OPLV0_PK0_PAP0_PGR2_SU0_SUS0_SRVW4_TT1_128_WG128_2_1_WGM2
    SolutionIndex: 6
    SolutionNameMin: Cijk_Ailk_Bjlk_I8II_BH_MT128x128x32_MI32x32x8x1_SE_AF0EM8_EPS0_GRVW16_NLCA1_NLCB1_OPLV0_PK0_PAP0_PGR2_SU0_SUS0_SRVW4_TT1_128_WG128_2_1_WGM15
    SolutionIndex: 7
    SolutionNameMin: Cijk_Ailk_Bjlk_I8II_BH_MT32x32x32_MI16x16x16x1_SE_AF0EM8_EPS0_GRVW16_NLCA1_NLCB1_OPLV0_PK0_PAP0_PGR2_SU0_SUS0_SRVW0_TT1_16_WG32_8_1_WGM1
    SolutionIndex: 8
    SolutionNameMin: Cijk_Ailk_Bjlk_I8II_BH_MT64x64x128_MI32x32x8x1_SE_AF0EM8_EPS0_GRVW8_NLCA1_NLCB1_OPLV0_PK0_PAP0_PGR2_SU0_SUS0_SRVW4_TT1_32_WG64_4_1_WGM2
    SolutionIndex: 9
    SolutionNameMin: Cijk_Ailk_Bjlk_I8II_BH_MT32x64x64_MI16x16x16x1_SE_AF0EM8_EPS0_GRVW16_NLCA1_NLCB1_OPLV0_PK0_PAP0_PGR2_SU0_SUS0_SRVW0_TT1_32_WG32_8_1_WGM2
    SolutionIndex: 10
    SolutionNameMin: Cijk_Ailk_Bjlk_I8II_BH_MT64x128x32_MI32x32x8x1_SE_AF0EM8_EPS0_GRVW16_NLCA1_NLCB1_OPLV0_PK0_PAP0_PGR2_SU0_SUS0_SRVW4_TT1_64_WG64_4_1_WGM1
    SolutionIndex: 11
    SolutionNameMin: Cijk_Ailk_Bjlk_I8II_BH_MT64x64x128_MI32x32x8x1_SE_AF0EM8_EPS0_GRVW8_NLCA1_NLCB1_OPLV0_PK0_PAP0_PGR2_SU0_SUS0_SRVW4_TT1_32_WG64_4_1_WGM15
    SolutionIndex: 12
    SolutionNameMin: Cijk_Ailk_Bjlk_I8II_BH_MT32x32x32_MI16x16x16x1_SE_AF0EM8_EPS0_GRVW4_NLCA1_NLCB1_OPLV0_PK0_PAP0_PGR2_SU0_SUS0_SRVW0_TT1_16_WG32_8_1_WGM1
    SolutionIndex: 13
    SolutionNameMin: Cijk_Ailk_Bjlk_I8II_BH_MT64x64x32_MI32x32x8x1_SE_AF0EM8_EPS0_GRVW16_NLCA1_NLCB1_OPLV0_PK0_PAP0_PGR2_SU0_SUS0_SRVW4_TT1_32_WG64_4_1_WGM1
    SolutionIndex: 14
    SolutionNameMin: Cijk_Ailk_Bjlk_I8II_BH_MT128x64x32_MI32x32x8x1_SE_AF0EM8_EPS0_GRVW8_NLCA1_NLCB1_OPLV0_PK0_PAP0_PGR2_SU32_SUS128_SRVW4_TT1_64_WG128_2_1_WGM1
    SolutionIndex: 15
    SolutionNameMin: Cijk_Ailk_Bjlk_I8II_BH_MT64x192x32_MI32x32x8x1_SN_AF0EM8_EPS0_GRVW8_NLCA1_NLCB3_OPLV0_PK0_PAP0_PGR2_SU0_SUS0_SRVW4_TT1_96_WG64_4_1_WGM2
    SolutionIndex: 16
    SolutionNameMin: Cijk_Ailk_Bjlk_I8II_BH_MT32x32x64_MI16x16x16x1_SE_AF0EM8_EPS0_GRVW16_NLCA1_NLCB1_OPLV0_PK0_PAP0_PGR2_SU0_SUS0_SRVW0_TT1_16_WG32_8_1_WGM1
    SolutionIndex: 17
    SolutionNameMin: Cijk_Ailk_Bjlk_I8II_BH_MT64x192x32_MI32x32x8x1_SE_AF0EM8_EPS0_GRVW8_NLCA1_NLCB3_OPLV0_PK0_PAP0_PGR2_SU0_SUS0_SRVW4_TT1_96_WG64_4_1_WGM2
    SolutionIndex: 18
    SolutionNameMin: Cijk_Ailk_Bjlk_I8II_BH_MT128x128x32_MI32x32x8x1_SE_AF0EM8_EPS0_GRVW16_NLCA1_NLCB1_OPLV0_PK0_PAP0_PGR2_SU0_SUS0_SRVW4_TT1_128_WG128_2_1_WGM1
    SolutionIndex: 19
    SolutionNameMin: Cijk_Ailk_Bjlk_I8II_BH_MT64x128x32_MI32x32x8x1_SE_AF0EM8_EPS0_GRVW16_NLCA1_NLCB1_OPLV0_PK0_PAP0_PGR2_SU0_SUS0_SRVW4_TT1_64_WG64_4_1_WGM2
    SolutionIndex: 20
    SolutionNameMin: Cijk_Ailk_Bjlk_I8II_BH_MT64x64x64_MI32x32x8x1_SE_AF0EM8_EPS0_GRVW8_NLCA1_NLCB1_OPLV0_PK0_PAP0_PGR2_SU0_SUS0_SRVW4_TT1_32_WG64_4_1_WGM15
    SolutionIndex: 21
    SolutionNameMin: Cijk_Ailk_Bjlk_I8II_BH_MT32x32x64_MI16x16x16x1_SE_AF0EM8_EPS0_GRVW4_NLCA1_NLCB1_OPLV0_PK0_PAP0_PGR2_SU0_SUS0_SRVW0_TT1_16_WG32_8_1_WGM1
    SolutionIndex: 22
    SolutionNameMin: Cijk_Ailk_Bjlk_I8II_BH_MT64x128x32_MI32x32x8x1_SE_AF0EM8_EPS0_GRVW16_NLCA1_NLCB1_OPLV0_PKn1_PAP0_PGR2_SU0_SUS0_SRVW4_TT1_64_WG64_4_1_WGM1
    SolutionIndex: 23
    SolutionNameMin: Cijk_Ailk_Bjlk_I8II_BH_MT64x128x32_MI32x32x8x1_SE_AF0EM8_EPS0_GRVW16_NLCA1_NLCB1_OPLV0_PK0_PAP0_PGR2_SU32_SUS256_SRVW4_TT1_64_WG64_4_1_WGM1
    SolutionIndex: 24
    SolutionNameMin: Cijk_Ailk_Bjlk_I8II_BH_MT64x128x32_MI32x32x8x1_SE_AF0EM8_EPS0_GRVW16_NLCA1_NLCB1_OPLV0_PK0_PAP0_PGR2_SU32_SUS128_SRVW4_TT1_64_WG64_4_1_WGM1
    SolutionIndex: 25
    SolutionNameMin: Cijk_Ailk_Bjlk_I8II_BH_MT64x192x32_MI32x32x8x1_SE_AF0EM8_EPS0_GRVW8_NLCA1_NLCB3_OPLV0_PK0_PAP0_PGR2_SU32_SUS256_SRVW4_TT1_96_WG64_4_1_WGM15
    SolutionIndex: 26
    SolutionNameMin: Cijk_Ailk_Bjlk_I8II_BH_MT64x64x32_MI32x32x8x1_SE_AF0EM8_EPS0_GRVW16_NLCA1_NLCB1_OPLV0_PK0_PAP0_PGR2_SU0_SUS0_SRVW4_TT1_32_WG64_4_1_WGM15
    SolutionIndex: 27
    SolutionNameMin: Cijk_Ailk_Bjlk_I8II_BH_MT128x64x32_MI32x32x8x1_SE_AF0EM8_EPS0_GRVW8_NLCA1_NLCB1_OPLV0_PK0_PAP0_PGR2_SU32_SUS256_SRVW4_TT1_64_WG128_2_1_WGM1
    SolutionIndex: 28
    SolutionNameMin: Cijk_Ailk_Bjlk_I8II_BH_MT64x64x64_MI32x32x8x1_SE_GRVW16_LBSPP128_LPA0_NTC0_NTD3_NEPBS0_SU0_SUS0_TT1_32_VW8_WG64_4_1_WGM2
    SolutionIndex: 29
    SolutionNameMin: Cijk_Ailk_Bjlk_I8II_BH_MT64x128x32_MI32x32x8x1_SE_GRVW16_LBSPP0_LPA0_NTC0_NTD3_NEPBS1_SU32_SUS128_TT1_64_VW8_WG64_4_1_WGM1
    SolutionIndex: 30
    SolutionNameMin: Cijk_Ailk_Bjlk_I8II_BH_MT64x64x64_MI32x32x8x1_SE_GRVW8_LBSPP128_LPA0_NTC0_NTD3_NEPBS4_SU0_SUS0_TT1_32_VW4_WG64_4_1_WGM2
    SolutionIndex: 31
    SolutionNameMin: Cijk_Ailk_Bjlk_I8II_BH_MT64x128x32_MI32x32x8x1_SE_GRVW16_LBSPP128_LPA0_NTC0_NTD3_NEPBS1_SU0_SUS0_TT1_64_VW4_WG64_4_1_WGM2
    SolutionIndex: 32
    SolutionNameMin: Cijk_Ailk_Bjlk_I8II_BH_MT128x128x32_MI32x32x8x1_SE_GRVW16_LBSPP64_LPA0_LPB0_NTC0_NTD3_NEPBS1_SU0_SUS0_TT1_128_VW4
    SolutionIndex: 33
    SolutionNameMin: Cijk_Ailk_Bjlk_I8II_BH_MT128x128x32_MI32x32x8x1_SE_GRVW16_LBSPP128_LPA0_LPB0_NTC0_NTD3_NEPBS1_SU32_SUS128_TT1_128_VW8
    SolutionIndex: 34
    SolutionNameMin: Cijk_Ailk_Bjlk_I8II_BH_MT128x128x32_MI32x32x8x1_SE_GRVW16_LBSPP64_LPA0_LPB0_NTC0_NTD3_NEPBS1_SU32_SUS128_TT1_128_VW4
    SolutionIndex: 35
    SolutionNameMin: Cijk_Ailk_Bjlk_I8II_BH_MT128x256x32_MI32x32x8x1_SE_GRVW16_LBSPP64_LPA0_LPB0_NTC0_NTD0_NEPBS1_SU0_SUS0_TT1_256_VW4
    SolutionIndex: 36
    SolutionNameMin: Cijk_Ailk_Bjlk_I8II_BH_MT128x256x32_MI32x32x8x1_SE_GRVW16_LBSPP128_LPA0_LPB0_NTC0_NTD0_NEPBS1_SU32_SUS128_TT1_256_VW4
    SolutionIndex: 37
    SolutionNameMin: Cijk_Ailk_Bjlk_I8II_BH_MT128x128x32_MI32x32x8x1_SE_GRVW16_LBSPP128_LPA0_LPB0_NTC0_NTD3_NEPBS1_SU32_SUS256_TT1_128_VW8
    SolutionIndex: 38
    SolutionNameMin: Cijk_Ailk_Bjlk_I8II_BH_MT128x128x32_MI32x32x8x1_SE_GRVW16_LBSPP64_LPA0_LPB0_NTC0_NTD0_NEPBS4_SU0_SUS0_TT1_128_VW4
    SolutionIndex: 39
    SolutionNameMin: Cijk_Ailk_Bjlk_I8II_BH_MT128x256x32_MI32x32x8x1_SE_GRVW16_LBSPP0_LPA8_LPB16_NTC0_NTD0_NEPBS1_SU32_SUS256_TT1_256_VW4
    SolutionIndex: 40
    SolutionNameMin: Cijk_Ailk_Bjlk_I8II_BH_MT128x256x32_MI32x32x8x1_SE_GRVW8_LBSPP128_LPA0_LPB8_NTC0_NTD0_NEPBS4_SU32_SUS128_TT1_256_VW8
    SolutionIndex: 41
    SolutionNameMin: Cijk_Ailk_Bjlk_I8II_BH_MT128x256x32_MI32x32x8x1_SE_GRVW16_LBSPP128_LPA16_LPB16_NTC0_NTD0_NEPBS1_SU32_SUS256_TT1_256_VW4
    SolutionIndex: 42
    SolutionNameMin: Cijk_Ailk_Bjlk_I8II_BH_MT128x256x32_MI32x32x8x1_SE_GRVW16_LBSPP0_LPA0_LPB0_NTC0_NTD0_NEPBS1_SU0_SUS0_TT1_256_VW4
    SolutionIndex: 43
    SolutionNameMin: Cijk_Ailk_Bjlk_I8II_BH_MT128x128x32_MI32x32x8x1_SE_GRVW8_LBSPP0_LPA0_LPB0_NTC0_NTD0_NEPBS4_SU0_SUS0_TT1_128_VW4
    SolutionIndex: 44
    SolutionNameMin: Cijk_Ailk_Bjlk_I8II_BH_MT128x128x32_MI32x32x8x1_SE_GRVW16_LBSPP64_LPA0_LPB0_NTC0_NTD0_NEPBS1_SU0_SUS0_TT1_128_VW8
    SolutionIndex: 45
    SolutionNameMin: Cijk_Ailk_Bjlk_I8II_BH_MT128x256x32_MI32x32x8x1_SE_GRVW16_LBSPP128_LPA16_LPB16_NTC0_NTD0_NEPBS1_SU32_SUS256_TT1_256_VW8
    SolutionIndex: 46
    SolutionNameMin: Cijk_Ailk_Bjlk_I8II_BH_MT128x256x32_MI32x32x8x1_SE_GRVW8_LBSPP64_LPA16_LPB0_NTC0_NTD0_NEPBS4_SU32_SUS128_TT1_256_VW8
    SolutionIndex: 47
    SolutionNameMin: Cijk_Ailk_Bjlk_I8II_BH_MT128x256x32_MI32x32x8x1_SE_GRVW16_LBSPP64_LPA8_LPB16_NTC0_NTD0_NEPBS1_SU32_SUS128_TT1_256_VW4
    SolutionIndex: 48
    SolutionNameMin: Cijk_Ailk_Bjlk_I8II_BH_MT128x128x32_MI32x32x8x1_SE_1LDSB0_LBSPP128_LPA0_LPB0_NTC0_NTD0_NEPBS1_SU0_SUS0_TT1_128_VW4_WGM1
    SolutionIndex: 49
    SolutionNameMin: Cijk_Ailk_Bjlk_I8II_BH_MT128x128x32_MI32x32x8x1_SE_1LDSB0_LBSPP0_LPA0_LPB0_NTC0_NTD0_NEPBS1_SU0_SUS0_TT1_128_VW4_WGM1
    SolutionIndex: 50
    SolutionNameMin: Cijk_Ailk_Bjlk_I8II_BH_MT128x128x32_MI32x32x8x1_SE_1LDSB0_LBSPP64_LPA0_LPB0_NTC0_NTD0_NEPBS1_SU32_SUS128_TT1_128_VW4_WGM15
    SolutionIndex: 51
    SolutionNameMin: Cijk_Ailk_Bjlk_I8II_BH_MT128x256x32_MI32x32x8x1_SE_1LDSB0_LBSPP0_LPA16_LPB0_NTC0_NTD0_NEPBS1_SU0_SUS0_TT1_256_VW4_WGM1
    SolutionIndex: 52
    SolutionNameMin: Cijk_Ailk_Bjlk_I8II_BH_MT128x128x32_MI32x32x8x1_SE_1LDSB0_LBSPP64_LPA0_LPB0_NTC0_NTD0_NEPBS1_SU32_SUS128_TT1_128_VW8_WGM15
    SolutionIndex: 53
    SolutionNameMin: Cijk_Ailk_Bjlk_I8II_BH_MT128x128x32_MI32x32x8x1_SE_1LDSB0_LBSPP0_LPA0_LPB0_NTC0_NTD0_NEPBS1_SU32_SUS128_TT1_128_VW8_WGM15
    SolutionIndex: 54
    SolutionNameMin: Cijk_Ailk_Bjlk_I8II_BH_MT128x128x32_MI32x32x8x1_SE_1LDSB0_LBSPP64_LPA0_LPB0_NTC0_NTD3_NEPBS1_SU32_SUS128_TT1_128_VW8_WGM15
    SolutionIndex: 55
    SolutionNameMin: Cijk_Ailk_Bjlk_I8II_BH_MT128x256x32_MI32x32x8x1_SE_1LDSB0_LBSPP64_LPA0_LPB16_NTC0_NTD3_NEPBS1_SU0_SUS0_TT1_256_VW4_WGM1
    SolutionIndex: 56
    SolutionNameMin: Cijk_Ailk_Bjlk_I8II_BH_MT128x128x32_MI32x32x8x1_SE_1LDSB0_LBSPP0_LPA0_LPB0_NTC0_NTD3_NEPBS1_SU0_SUS0_TT1_128_VW4_WGM8
    SolutionIndex: 57
    SolutionNameMin: Cijk_Ailk_Bjlk_I8II_BH_MT128x128x32_MI32x32x8x1_SE_1LDSB0_LBSPP0_LPA0_LPB0_NTC0_NTD0_NEPBS1_SU32_SUS128_TT1_128_VW4_WGM15
    SolutionIndex: 58
    SolutionNameMin: Cijk_Ailk_Bjlk_I8II_BH_MT128x128x32_MI32x32x8x1_SE_1LDSB0_LBSPP128_LPA0_LPB0_NTC0_NTD0_NEPBS1_SU0_SUS0_TT1_128_VW8_WGM8
    SolutionIndex: 59
    SolutionNameMin: Cijk_Ailk_Bjlk_I8II_BH_MT128x256x32_MI32x32x8x1_SE_1LDSB0_LBSPP64_LPA16_LPB0_NTC0_NTD0_NEPBS1_SU0_SUS0_TT1_256_VW8_WGM1
    SolutionIndex: 60
    SolutionNameMin: Cijk_Ailk_Bjlk_I8II_BH_MT128x128x32_MI32x32x8x1_SE_1LDSB0_LBSPP0_LPA0_LPB0_NTC3_NTD3_NEPBS1_SU0_SUS0_TT1_128_VW4_WGM8
    SolutionIndex: 61
    SolutionNameMin: Cijk_Ailk_Bjlk_I8II_BH_MT128x128x32_MI32x32x8x1_SE_1LDSB0_LBSPP0_LPA0_LPB0_NTC0_NTD3_NEPBS1_SU0_SUS0_TT1_128_VW8_WGM8
    SolutionIndex: 62
    SolutionNameMin: Cijk_Ailk_Bjlk_I8II_BH_MT128x128x32_MI32x32x8x1_SE_1LDSB0_LBSPP0_LPA0_LPB0_NTC0_NTD3_NEPBS1_SU32_SUS128_TT1_128_VW8_WGM15
    SolutionIndex: 63
    SolutionNameMin: Cijk_Ailk_Bjlk_I8II_BH_MT128x256x32_MI32x32x8x1_SE_1LDSB0_LBSPP0_LPA16_LPB0_NTC3_NTD3_NEPBS1_SU0_SUS0_TT1_256_VW4_WGM1
    SolutionIndex: 64
    SolutionNameMin: Cijk_Ailk_Bjlk_I8II_BH_MT128x128x32_MI32x32x8x1_SE_1LDSB0_LBSPP0_LPA0_LPB0_NTC3_NTD3_NEPBS1_SU32_SUS128_TT1_128_VW8_WGM15
    SolutionIndex: 65
    SolutionNameMin: Cijk_Ailk_Bjlk_I8II_BH_MT128x256x32_MI32x32x8x1_SE_1LDSB0_LBSPP0_LPA16_LPB0_NTC0_NTD3_NEPBS1_SU0_SUS0_TT1_256_VW8_WGM1
    SolutionIndex: 66
    SolutionNameMin: Cijk_Ailk_Bjlk_I8II_BH_MT128x256x32_MI32x32x8x1_SE_1LDSB0_LBSPP64_LPA0_LPB0_NTC0_NTD3_NEPBS1_SU0_SUS0_TT1_256_VW8_WGM8
    SolutionIndex: 67
    SolutionNameMin: Cijk_Ailk_Bjlk_I8II_BH_MT128x256x32_MI32x32x8x1_SE_1LDSB0_LBSPP128_LPA16_LPB0_NTC0_NTD3_NEPBS1_SU0_SUS0_TT1_256_VW8_WGM1
    SolutionIndex: 68
    SolutionNameMin: Cijk_Ailk_Bjlk_I8II_BH_MT128x256x32_MI32x32x8x1_SE_1LDSB0_LBSPP0_LPA0_LPB0_NTC3_NTD3_NEPBS1_SU0_SUS0_TT1_256_VW8_WGM8
    SolutionIndex: 69
    SolutionNameMin: Cijk_Ailk_Bjlk_I8II_BH_MT128x256x32_MI32x32x8x1_SE_1LDSB0_LBSPP128_LPA8_LPB0_NTC0_NTD3_NEPBS1_SU0_SUS0_TT1_256_VW8_WGM1
- - - [35, 35, 1, 512]
    - [0, 0.016]
  - - [4, 64, 1, 128]
    - [1, 0.002]
  - - [480, 512, 1, 512]
    - [9, 4.693]
  - - [960, 1024, 1, 1024]
    - [3, 30.003]
  - - [1920, 2048, 1, 2048]
    - [19, 64.162]
  - - [3840, 4096, 1, 4096]
    - [5, 74.698]
  - - [7680, 8192, 1, 8192]
    - [6, 79.507]
  - - [1024, 128, 1, 128]
    - [7, 1.588]
  - - [1856, 448, 1, 3328]
    - [8, 43.911]
  - - [2944, 4288, 1, 1280]
    - [5, 61.132]
  - - [2368, 64, 1, 3328]
    - [9, 11.963]
  - - [2368, 5888, 1, 256]
    - [10, 33.652]
  - - [128, 64, 1, 256]
    - [7, 0.186]
  - - [5888, 1024, 1, 1280]
    - [10, 57.468]
  - - [128, 6784, 1, 3328]
    - [11, 45.41]
  - - [64, 4, 1, 256]
    - [12, 0.005]
  - - [5888, 1856, 1, 3328]
    - [15, 82.314]
  - - [5056, 704, 1, 256]
    - [13, 23.655]
  - - [5888, 2944, 1, 3328]
    - [6, 73.291]
  - - [1856, 4288, 1, 256]
    - [10, 30.687]
  - - [1024, 5056, 1, 128]
    - [14, 16.126]
  - - [5056, 5056, 1, 3328]
    - [5, 72.839]
  - - [1408, 5888, 1, 1280]
    - [5, 60.812]
  - - [2368, 448, 1, 128]
    - [13, 7.806]
  - - [1024, 3584, 1, 3328]
    - [15, 62.435]
  - - [1408, 64, 1, 128]
    - [16, 1.111]
  - - [256, 4288, 1, 3328]
    - [17, 42.874]
  - - [5888, 1408, 1, 1280]
    - [5, 67.998]
  - - [704, 1856, 1, 3328]
    - [10, 48.487]
  - - [1024, 2368, 1, 256]
    - [19, 22.634]
  - - [1408, 1856, 1, 1280]
    - [19, 50.585]
  - - [1408, 64, 1, 1280]
    - [16, 6.248]
  - - [448, 1024, 1, 1280]
    - [20, 16.479]
  - - [256, 1408, 1, 3328]
    - [20, 26.192]
  - - [5056, 5056, 1, 1280]
    - [5, 67.051]
  - - [448, 5056, 1, 256]
    - [19, 20.74]
  - - [704, 1856, 1, 1280]
    - [3, 40.523]
  - - [128, 5056, 1, 128]
    - [20, 3.38]
  - - [2368, 128, 1, 256]
    - [9, 3.26]
  - - [1856, 1408, 1, 128]
    - [13, 9.438]
  - - [64, 5056, 1, 256]
    - [9, 3.326]
  - - [6784, 256, 1, 3328]
    - [19, 56.921]
  - - [6784, 4288, 1, 3328]
    - [6, 73.385]
  - - [4288, 448, 1, 256]
    - [27, 14.568]
  - - [64, 704, 1, 128]
    - [7, 0.596]
  - - [1856, 2368, 1, 3328]
    - [18, 59.513]
  - - [4288, 2944, 1, 1280]
    - [22, 61.566]
  - - [704, 5056, 1, 1280]
    - [15, 54.281]
  - - [2368, 704, 1, 3328]
    - [8, 56.043]
  - - [256, 5888, 1, 256]
    - [23, 17.601]
  - - [1856, 4288, 1, 3328]
    - [18, 80.234]
  - - [256, 2944, 1, 256]
    - [13, 11.814]
  - - [5888, 1024, 1, 256]
    - [24, 28.602]
  - - [448, 64, 1, 1280]
    - [16, 2.047]
  - - [448, 5056, 1, 3328]
    - [25, 56.059]
  - - [3584, 4, 1, 1280]
    - [21, 0.827]
  - - [2944, 64, 1, 256]
    - [2, 4.117]
  - - [128, 4, 1, 1280]
    - [21, 0.036]
  - - [1408, 2944, 1, 256]
    - [19, 26.334]
  - - [256, 1856, 1, 1280]
    - [3, 20.212]
  - - [6784, 5056, 1, 3328]
    - [6, 73.819]
  - - [5056, 5056, 1, 256]
    - [24, 36.124]
  - - [1408, 6784, 1, 128]
    - [24, 17.797]
  - - [64, 1024, 1, 1280]
    - [16, 4.726]
  - - [2944, 4, 1, 256]
    - [7, 0.261]
  - - [704, 5056, 1, 128]
    - [13, 14.063]
  - - [2368, 2944, 1, 1280]
    - [10, 63.883]
  - - [128, 3584, 1, 1280]
    - [20, 20.048]
  - - [6784, 6784, 1, 1280]
    - [5, 70.606]
  - - [1024, 256, 1, 3328]
    - [20, 19.897]
  - - [1408, 4288, 1, 1280]
    - [24, 57.168]
  - - [3584, 4288, 1, 1280]
    - [18, 65.338]
  - - [2368, 704, 1, 1280]
    - [20, 39.742]
  - - [5056, 4288, 1, 3328]
    - [18, 71.338]
  - - [3584, 2368, 1, 3328]
    - [4, 80.109]
  - - [64, 704, 1, 1280]
    - [16, 3.201]
  - - [4288, 256, 1, 256]
    - [26, 14.658]
  - - [2944, 128, 1, 128]
    - [7, 3.967]
  - - [6784, 448, 1, 1280]
    - [27, 50.106]
  - - [1408, 2944, 1, 128]
    - [3, 14.439]
  - - [4288, 2944, 1, 256]
    - [24, 33.838]
  - - [5888, 704, 1, 1280]
    - [14, 52.761]
  - - [1856, 64, 1, 1280]
    - [16, 6.992]
  - - [448, 5888, 1, 128]
    - [26, 9.57]
  - - [5888, 64, 1, 3328]
    - [20, 27.759]
  - - [2944, 256, 1, 3328]
    - [20, 40.254]
  - - [1024, 64, 1, 128]
    - [2, 0.836]
  - - [5056, 2368, 1, 1280]
    - [5, 63.782]
  - - [448, 3584, 1, 1280]
    - [19, 43.607]
  - - [6784, 5888, 1, 256]
    - [18, 37.551]
  - - [704, 1024, 1, 128]
    - [8, 3.698]
  - - [704, 128, 1, 1280]
    - [16, 6.218]
  - - [5888, 2944, 1, 128]
    - [24, 19.652]
  - - [1408, 448, 1, 1280]
    - [3, 26.14]
  - - [1024, 1408, 1, 256]
    - [24, 17.255]
  - - [2368, 2368, 1, 3328]
    - [19, 62.094]
  - - [1856, 6784, 1, 128]
    - [22, 18.836]
  - - [5056, 704, 1, 3328]
    - [14, 62.248]
  - - [1408, 1856, 1, 256]
    - [19, 23.12]
  - - [1408, 704, 1, 3328]
    - [20, 39.329]
  - - [2368, 5056, 1, 256]
    - [10, 32.303]
  - - [5888, 1856, 1, 256]
    - [27, 31.838]
  - - [4288, 64, 1, 3328]
    - [20, 20.83]
  - - [2368, 4, 1, 1280]
    - [21, 0.638]
  - - [704, 5888, 1, 256]
    - [19, 26.161]
  - - [4288, 64, 1, 256]
    - [7, 5.695]
  - - [6784, 64, 1, 256]
    - [16, 7.876]
  - - [3840, 4224, 1, 4096]
    - [18, 76.606]
  - - [3840, 4224, 1, 4224]
    - [5, 76.746]
  - - [3840, 4224, 1, 4320]
    - [18, 76.78]
  - - [7680, 8448, 1, 8192]
    - [6, 79.717]
  - - [7680, 8448, 1, 8448]
    - [6, 79.737]
  - - [7680, 8448, 1, 8640]
    - [6, 79.75]
  - - [1024, 1024, 1, 1024]
    - [28, 29.943]
  - - [2048, 2048, 1, 1024]
    - [29, 51.096]
  - - [1024, 1024, 1, 2048]
    - [30, 37.863]
  - - [2048, 2048, 1, 2048]
    - [31, 61.29]
  - - [4096, 4096, 1, 1024]
    - [32, 62.276]
  - - [8192, 8192, 1, 1024]
    - [33, 63.737]
  - - [12288, 12288, 1, 1024]
    - [34, 75.989]
  - - [16384, 16384, 1, 1024]
    - [35, 43.118]
  - - [20480, 20480, 1, 1024]
    - [33, 76.75]
  - - [24576, 24576, 1, 1024]
    - [36, 63.009]
  - - [28672, 28672, 1, 1024]
    - [37, 77.065]
  - - [32768, 32768, 1, 1024]
    - [38, 25.327]
  - - [36864, 36864, 1, 1024]
    - [37, 76.929]
  - - [40960, 40960, 1, 1024]
    - [39, 61.793]
  - - [45056, 45056, 1, 1024]
    - [37, 76.308]
  - - [49152, 49152, 1, 1024]
    - [40, 42.441]
  - - [53248, 53248, 1, 1024]
    - [37, 75.813]
  - - [57344, 57344, 1, 1024]
    - [41, 61.62]
  - - [61440, 61440, 1, 1024]
    - [42, 75.278]
  - - [65536, 65536, 1, 1024]
    - [43, 22.968]
  - - [69632, 69632, 1, 1024]
    - [44, 74.238]
  - - [73728, 73728, 1, 1024]
    - [45, 61.673]
  - - [77824, 77824, 1, 1024]
    - [35, 75.007]
  - - [81920, 81920, 1, 1024]
    - [46, 42.158]
  - - [86016, 86016, 1, 1024]
    - [42, 74.838]
  - - [90112, 90112, 1, 1024]
    - [47, 60.855]
  - - [4096, 4096, 1, 2048]
    - [48, 73.246]
  - - [8192, 8192, 1, 2048]
    - [49, 78.981]
  - - [12288, 12288, 1, 2048]
    - [50, 80.537]
  - - [16384, 16384, 1, 2048]
    - [51, 79.515]
  - - [20480, 20480, 1, 2048]
    - [52, 79.635]
  - - [24576, 24576, 1, 2048]
    - [53, 78.926]
  - - [28672, 28672, 1, 2048]
    - [54, 79.821]
  - - [32768, 32768, 1, 2048]
    - [55, 78.006]
  - - [36864, 36864, 1, 2048]
    - [56, 81.504]
  - - [40960, 40960, 1, 2048]
    - [57, 80.484]
  - - [45056, 45056, 1, 2048]
    - [58, 81.365]
  - - [49152, 49152, 1, 2048]
    - [59, 79.7]
  - - [53248, 53248, 1, 2048]
    - [60, 81.079]
  - - [57344, 57344, 1, 2048]
    - [61, 80.077]
  - - [61440, 61440, 1, 2048]
    - [62, 80.555]
  - - [65536, 65536, 1, 2048]
    - [63, 77.867]
  - - [69632, 69632, 1, 2048]
    - [64, 79.996]
  - - [73728, 73728, 1, 2048]
    - [65, 79.748]
  - - [77824, 77824, 1, 2048]
    - [66, 79.798]
  - - [81920, 81920, 1, 2048]
    - [67, 79.268]
  - - [86016, 86016, 1, 2048]
    - [68, 79.701]
  - - [90112, 90112, 1, 2048]
    - [69, 79.458]
- null
