library/src/blas3/Tensile/Logic/asm_full/aldebaran_104cu/aldebaran_Cijk_Alik_Bljk_SB.yaml
- {MinimumRequiredVersion: 4.32.1}
- aldebaran
- {Architecture: gfx90a, CUCount: 104}
- [Device 0050, Device 0051, Device 0052, Device 0054, Device 0062, Device 7400, Device
    SolutionIndex: 0
    SolutionNameMin: Cijk_Alik_Bljk_SB_MT32x32x32_MI16x16x4x1_SN_1LDSB1_AMAS0_DTL0_EPS0_GRVW2_GSU1_IU1_LBSPP128_LPA2_LPB2_LRVW2_NEPBS4_NLCA1_NLCB1_ONLL1_PGR2_PLR9_SIA3_SS1_SU0_SUS256_SRVW0_SVW1_SNLL0_TT1_16_TLDS1_USFGROn1_VW1_WSGRA1_WSGRB1_WG32_8_1_WGM10
    SolutionIndex: 1
    SolutionNameMin: Cijk_Alik_Bljk_SB_MT64x64x16_MI32x32x2x1_SN_1LDSB1_AMAS0_DTL0_EPS0_GRVW4_GSU1_IU1_LBSPP128_LPA4_LPB4_LRVW2_NEPBS8_NLCA1_NLCB1_ONLL1_PGR2_PLR9_SIA3_SS1_SU0_SUS256_SRVW0_SVW1_SNLL0_TT1_32_TLDS1_USFGROn1_VW1_WSGRA1_WSGRB1_WG64_4_1_WGM5
    SolutionIndex: 2
    SolutionNameMin: Cijk_Alik_Bljk_SB_MT128x64x16_MI32x32x2x1_SN_1LDSB1_AMAS3_DTL0_EPS0_GRVW2_GSU1_IU1_LBSPP128_LPA2_LPB2_LRVW2_NEPBS2_NLCA1_NLCB1_ONLL1_PGR2_PLR9_SIA3_SS1_SU0_SUS256_SRVW0_SVW2_SNLL0_TT2_32_TLDS1_USFGROn1_VW2_WSGRA1_WSGRB1_WG64_4_1_WGM10
    SolutionIndex: 3
    SolutionNameMin: Cijk_Alik_Bljk_SB_MT96x96x16_MI16x16x4x1_SN_1LDSB1_AMAS0_DTL0_EPS0_GRVW2_GSU1_IU1_LBSPP128_LPA2_LPB2_LRVW2_NEPBS2_NLCA1_NLCB1_ONLL1_PGR2_PLR5_SIA3_SS1_SU0_SUS256_SRVW0_SVW1_SNLL0_TT3_48_TLDS1_USFGROn1_VW1_WSGRA1_WSGRB1_WG32_8_1_WGM5
    SolutionIndex: 4
    SolutionNameMin: Cijk_Alik_Bljk_SB_MT64x128x32_MI32x32x2x1_SE_1LDSB1_AMAS0_DTL0_EPS0_GRVW2_GSU1_IU1_LBSPP128_LPA2_LPB2_LRVW2_NEPBS0_NLCA1_NLCB1_ONLL1_PGR2_PLR17_SIA3_SS0_SU0_SUS256_SRVW2_SVW4_SNLL0_TT1_64_TLDS1_USFGROn1_VW1_WSGRA1_WSGRB1_WG64_4_1_WGM2
    SolutionIndex: 5
    SolutionNameMin: Cijk_Alik_Bljk_SB_MT96x96x32_MI16x16x4x1_SN_1LDSB1_AMAS0_DTL0_EPS0_GRVW2_GSU1_IU1_LBSPP128_LPA2_LPB2_LRVW2_NEPBS4_NLCA1_NLCB1_ONLL1_PGR2_PLR9_SIA3_SS1_SU32_SUS256_SRVW0_SVW1_SNLL0_TT3_48_TLDS1_USFGROn1_VW1_WSGRA1_WSGRB1_WG32_8_1_WGM5
    SolutionIndex: 6
    SolutionNameMin: Cijk_Alik_Bljk_SB_MT64x64x32_MI32x32x2x1_SE_1LDSB1_AMAS0_DTL0_EPS1_GRVW2_GSU1_IU1_LBSPP128_LPA2_LPB2_LRVW2_NEPBS0_NLCA1_NLCB1_ONLL1_PGR1_PLR17_SIA3_SS0_SU0_SUS256_SRVW2_SVW4_SNLL0_TT1_32_TLDS1_USFGROn1_VW1_WSGRA1_WSGRB1_WG64_4_1_WGM1
    SolutionIndex: 7
    SolutionNameMin: Cijk_Alik_Bljk_SB_MT64x64x32_MI32x32x2x1_SE_1LDSB1_AMAS0_DTL0_EPS0_GRVW4_GSU1_IU1_LBSPP128_LPA4_LPB4_LRVW2_NEPBS0_NLCA1_NLCB1_ONLL1_PGR2_PLR17_SIA3_SS0_SU0_SUS256_SRVW2_SVW4_SNLL0_TT1_32_TLDS1_USFGROn1_VW1_WSGRA1_WSGRB1_WG64_4_1_WGM15
    SolutionIndex: 8
    SolutionNameMin: Cijk_Alik_Bljk_SB_MT64x64x32_MI32x32x2x1_SE_1LDSB1_AMAS0_DTL0_EPS1_GRVW2_GSU1_IU1_LBSPP128_LPA2_LPB2_LRVW2_NEPBS0_NLCA1_NLCB1_ONLL1_PGR1_PLR17_SIA3_SS0_SU0_SUS256_SRVW2_SVW4_SNLL0_TT1_32_TLDS1_USFGROn1_VW1_WSGRA1_WSGRB1_WG64_4_1_WGM15
    SolutionIndex: 9
    SolutionNameMin: Cijk_Alik_Bljk_SB_MT64x64x32_MI32x32x2x1_SE_1LDSB1_AMAS0_DTL0_EPS1_GRVW4_GSU1_IU1_LBSPP128_LPA4_LPB4_LRVW2_NEPBS0_NLCA1_NLCB1_ONLL1_PGR1_PLR17_SIA3_SS0_SU0_SUS256_SRVW2_SVW4_SNLL0_TT1_32_TLDS1_USFGROn1_VW1_WSGRA1_WSGRB1_WG64_4_1_WGM1
    SolutionIndex: 10
    SolutionNameMin: Cijk_Alik_Bljk_SB_MT64x32x32_MI16x16x4x1_SE_1LDSB1_AMAS0_DTL0_EPS0_GRVW4_GSU1_IU1_LBSPP128_LPA4_LPB4_LRVW2_NEPBS0_NLCA1_NLCB1_ONLL1_PGR2_PLR9_SIA3_SS0_SU0_SUS256_SRVW2_SVW4_SNLL0_TT2_16_TLDS1_USFGROn1_VW1_WSGRA1_WSGRB1_WG32_8_1_WGM15
    SolutionIndex: 11
    SolutionNameMin: Cijk_Alik_Bljk_SB_MT64x64x32_MI32x32x2x1_SE_1LDSB1_AMAS0_DTL0_EPS1_GRVW4_GSU1_IU1_LBSPP128_LPA4_LPB4_LRVW2_NEPBS0_NLCA1_NLCB1_ONLL1_PGR1_PLR17_SIA3_SS0_SU32_SUS256_SRVW2_SVW4_SNLL0_TT1_32_TLDS1_USFGROn1_VW1_WSGRA1_WSGRB1_WG64_4_1_WGM15
    SolutionIndex: 12
    SolutionNameMin: Cijk_Alik_Bljk_SB_MT128x96x16_MI32x32x2x1_SE_1LDSB1_AMAS0_DTL0_EPS0_GRVW2_GSU1_IU1_LBSPP128_LPA2_LPB2_LRVW2_NEPBS0_NLCA1_NLCB1_ONLL1_PGR2_PLR9_SIA3_SS0_SU0_SUS256_SRVW2_SVW4_SNLL0_TT1_96_TLDS1_USFGROn1_VW1_WSGRA1_WSGRB1_WG128_2_1_WGM15
    SolutionIndex: 13
    SolutionNameMin: Cijk_Alik_Bljk_SB_MT64x64x32_MI32x32x2x1_SE_1LDSB1_AMAS0_DTL0_EPS1_GRVW4_GSU1_IU1_LBSPP128_LPA4_LPB4_LRVW2_NEPBS0_NLCA1_NLCB1_ONLL1_PGR1_PLR17_SIA3_SS0_SU0_SUS256_SRVW2_SVW4_SNLL0_TT1_32_TLDS1_USFGROn1_VW1_WSGRA1_WSGRB1_WG64_4_1_WGM15
    SolutionIndex: 14
    SolutionNameMin: Cijk_Alik_Bljk_SB_MT128x32x64_MI32x32x2x1_SE_1LDSB1_AMAS0_DTL0_EPS1_GRVW4_GSU1_IU1_LBSPP256_LPA4_LPB4_LRVW4_NEPBS0_NLCA1_NLCB1_ONLL1_PGR1_PLR33_SIA3_SS0_SU32_SUS256_SRVW0_SVW4_SNLL0_TT1_32_TLDS1_USFGROn1_VW1_WSGRA1_WSGRB1_WG128_2_1_WGM2
    SolutionIndex: 15
    SolutionNameMin: Cijk_Alik_Bljk_SB_MT96x96x16_MI16x16x4x1_SN_1LDSB1_AMAS0_DTL0_EPS0_GRVW2_GSU1_IU1_LBSPP128_LPA2_LPB2_LRVW2_NEPBS4_NLCA1_NLCB1_ONLL1_PGR2_PLR5_SIA3_SS1_SU32_SUS128_SRVW0_SVW1_SNLL0_TT3_48_TLDS1_USFGROn1_VW1_WSGRA1_WSGRB1_WG32_8_1_WGM5
    SolutionIndex: 16
    SolutionNameMin: Cijk_Alik_Bljk_SB_MT32x32x32_MI16x16x4x1_SE_1LDSB1_AMAS0_DTL0_EPS1_GRVW2_GSU1_IU1_LBSPP128_LPA2_LPB2_LRVW2_NEPBS0_NLCA1_NLCB1_ONLL1_PGR1_PLR9_SIA3_SS0_SU0_SUS256_SRVW2_SVW4_SNLL0_TT1_16_TLDS1_USFGROn1_VW1_WSGRA1_WSGRB1_WG32_8_1_WGM1
    SolutionIndex: 17
    SolutionNameMin: Cijk_Alik_Bljk_SB_MT16x16x32_MI16x16x4x1_SN_1LDSB0_AMAS0_DTL0_EPS0_GRVW4_GSU1_IU1_LBSPP128_LPA4_LPB4_LRVW2_NEPBS8_NLCA1_NLCB1_ONLL1_PGR2_PLR9_SIA3_SS1_SU32_SUS256_SRVW0_SVW1_SNLL0_TT1_16_TLDS1_USFGROn1_VW1_WSGRA1_WSGRB1_WG16_4_1_WGM10
    SolutionIndex: 18
    SolutionNameMin: Cijk_Alik_Bljk_SB_MT16x16x32_MI16x16x4x1_SN_1LDSB0_AMAS0_DTL0_EPS0_GRVW4_GSU1_IU1_LBSPP128_LPA4_LPB4_LRVW2_NEPBS4_NLCA1_NLCB1_ONLL1_PGR2_PLR9_SIA3_SS1_SU32_SUS128_SRVW0_SVW1_SNLL0_TT1_16_TLDS1_USFGROn1_VW1_WSGRA1_WSGRB1_WG16_4_1_WGM5
    SolutionIndex: 19
    SolutionNameMin: Cijk_Alik_Bljk_SB_MT16x16x32_MI16x16x4x1_SN_1LDSB0_AMAS0_DTL0_EPS0_GRVW4_GSU1_IU1_LBSPP128_LPA4_LPB4_LRVW2_NEPBS2_NLCA1_NLCB1_ONLL1_PGR2_PLR9_SIA3_SS1_SU0_SUS256_SRVW0_SVW1_SNLL0_TT1_16_TLDS1_USFGROn1_VW1_WSGRA1_WSGRB1_WG16_4_1_WGM8
    SolutionIndex: 20
    SolutionNameMin: Cijk_Alik_Bljk_SB_MT16x16x32_MI16x16x4x1_SE_1LDSB0_AMAS3_DTL0_EPS0_GRVW4_GSU1_IU1_LBSPP128_LPA4_LPB4_LRVW2_NEPBS0_NLCA1_NLCB1_ONLL1_PGR2_PLR9_SIA3_SS0_SU32_SUS128_SRVW0_SVW4_SNLL0_TT1_16_TLDS1_USFGROn1_VW2_WSGRA1_WSGRB1_WG16_4_1_WGM1
    SolutionIndex: 21
    SolutionNameMin: Cijk_Alik_Bljk_SB_MT16x16x32_MI16x16x4x1_SE_1LDSB0_AMAS3_DTL0_EPS0_GRVW4_GSU1_IU1_LBSPP128_LPA4_LPB4_LRVW2_NEPBS0_NLCA1_NLCB1_ONLL1_PGR2_PLR9_SIA3_SS0_SU0_SUS256_SRVW0_SVW4_SNLL0_TT1_16_TLDS1_USFGROn1_VW2_WSGRA1_WSGRB1_WG16_4_1_WGM1
    SolutionIndex: 22
    SolutionNameMin: Cijk_Alik_Bljk_SB_MT64x32x32_MI16x16x4x1_SN_1LDSB1_AMAS3_DTL0_EPS0_GRVW2_GSU1_IU1_LBSPP128_LPA2_LPB2_LRVW2_NEPBS4_NLCA1_NLCB1_ONLL1_PGR2_PLR9_SIA3_SS1_SU32_SUS256_SRVW0_SVW2_SNLL0_TT2_16_TLDS1_USFGROn1_VW2_WSGRA1_WSGRB1_WG32_8_1_WGM8
    SolutionIndex: 23
    SolutionNameMin: Cijk_Alik_Bljk_SB_MT64x128x32_MI32x32x2x1_SE_1LDSB1_AMAS0_DTL0_EPS1_GRVW4_GSU1_IU1_LBSPP128_LPA4_LPB4_LRVW2_NEPBS0_NLCA1_NLCB1_ONLL1_PGR1_PLR17_SIA3_SS0_SU0_SUS256_SRVW2_SVW4_SNLL0_TT1_64_TLDS1_USFGROn1_VW1_WSGRA1_WSGRB1_WG64_4_1_WGM15
    SolutionIndex: 24
    SolutionNameMin: Cijk_Alik_Bljk_SB_MT16x16x32_MI16x16x4x1_SE_1LDSB0_AMAS3_DTL0_EPS0_GRVW4_GSU1_IU1_LBSPP128_LPA4_LPB4_LRVW2_NEPBS0_NLCA1_NLCB1_ONLL1_PGR2_PLR9_SIA3_SS0_SU32_SUS256_SRVW0_SVW4_SNLL0_TT1_16_TLDS1_USFGROn1_VW2_WSGRA1_WSGRB1_WG16_4_1_WGM1
    SolutionIndex: 25
    SolutionNameMin: Cijk_Alik_Bljk_SB_MT16x16x32_MI16x16x4x1_SE_1LDSB0_AMAS3_DTL0_EPS0_GRVW2_GSU1_IU1_LBSPP128_LPA2_LPB2_LRVW2_NEPBS0_NLCA1_NLCB1_ONLL1_PGR2_PLR9_SIA3_SS0_SU0_SUS256_SRVW0_SVW4_SNLL0_TT1_16_TLDS1_USFGROn1_VW2_WSGRA1_WSGRB1_WG16_4_1_WGM2
    SolutionIndex: 26
    SolutionNameMin: Cijk_Alik_Bljk_SB_MT32x64x32_MI16x16x4x1_SE_1LDSB0_AMAS0_DTL0_EPS0_GRVW4_GSU1_IU1_LBSPP128_LPA4_LPB4_LRVW2_NEPBS0_NLCA1_NLCB1_ONLL1_PGR2_PLR9_SIA3_SS0_SU32_SUS128_SRVW2_SVW4_SNLL0_TT1_32_TLDS1_USFGROn1_VW1_WSGRA1_WSGRB1_WG32_8_1_WGM15
    SolutionIndex: 27
    SolutionNameMin: Cijk_Alik_Bljk_SB_MT128x64x32_MI32x32x2x1_SE_1LDSB0_AMAS0_DTL0_EPS0_GRVW1_GSU1_IU1_LBSPP128_LPA2_LPB2_LRVW2_NEPBS0_NLCA1_NLCB1_ONLL1_PGR2_PLR17_SIA3_SS0_SU0_SUS256_SRVW2_SVW4_SNLL0_TT2_32_TLDS1_USFGROn1_VW1_WSGRA1_WSGRB1_WG64_4_1_WGM2
    SolutionIndex: 28
    SolutionNameMin: Cijk_Alik_Bljk_SB_MT64x144x32_MI16x16x4x1_SE_1LDSB1_AMAS0_DTL0_EPS0_GRVW1_GSU1_IU1_LBSPP128_LPA2_LPB2_LRVW2_NEPBS0_NLCA1_NLCB1_ONLL1_PGR2_PLR9_SIA3_SS0_SU0_SUS256_SRVW2_SVW4_SNLL0_TT1_144_TLDS1_USFGROn1_VW1_WSGRA1_WSGRB1_WG64_4_1_WGM15
    SolutionIndex: 29
    SolutionNameMin: Cijk_Alik_Bljk_SB_MT128x96x16_MI32x32x2x1_SE_1LDSB0_AMAS0_DTL0_EPS0_GRVW2_GSU1_IU1_LBSPP128_LPA2_LPB2_LRVW2_NEPBS0_NLCA1_NLCB1_ONLL1_PGR2_PLR9_SIA3_SS0_SU0_SUS256_SRVW2_SVW4_SNLL0_TT1_96_TLDS1_USFGROn1_VW1_WSGRA1_WSGRB1_WG128_2_1_WGM15
    SolutionIndex: 30
    SolutionNameMin: Cijk_Alik_Bljk_SB_MT64x64x32_MI32x32x2x1_SE_1LDSB1_AMAS0_DTL0_EPS1_GRVW4_GSU1_IU1_LBSPP128_LPA4_LPB4_LRVW2_NEPBS0_NLCA1_NLCB1_ONLL1_PGR1_PLR17_SIA3_SS0_SU32_SUS128_SRVW2_SVW4_SNLL0_TT1_32_TLDS1_USFGROn1_VW1_WSGRA1_WSGRB1_WG64_4_1_WGM2
    SolutionIndex: 31
    SolutionNameMin: Cijk_Alik_Bljk_SB_MT64x64x32_MI32x32x2x1_SE_1LDSB1_AMAS0_DTL0_EPS0_GRVW4_GSU1_IU1_LBSPP128_LPA4_LPB4_LRVW2_NEPBS0_NLCA1_NLCB1_ONLL1_PGR2_PLR17_SIA3_SS0_SU0_SUS256_SRVW2_SVW4_SNLL0_TT1_32_TLDS1_USFGROn1_VW1_WSGRA1_WSGRB1_WG64_4_1_WGM1
    SolutionIndex: 32
    SolutionNameMin: Cijk_Alik_Bljk_SB_MT32x64x32_MI16x16x4x1_SE_1LDSB1_AMAS0_DTL0_EPS0_GRVW2_GSU1_IU1_LBSPP128_LPA2_LPB2_LRVW2_NEPBS0_NLCA1_NLCB1_ONLL1_PGR2_PLR9_SIA3_SS0_SU0_SUS256_SRVW2_SVW4_SNLL0_TT1_32_TLDS1_USFGROn1_VW1_WSGRA1_WSGRB1_WG32_8_1_WGM1
    SolutionIndex: 33
    SolutionNameMin: Cijk_Alik_Bljk_SB_MT64x192x16_MI32x32x2x1_SN_1LDSB1_AMAS0_DTL0_EPS0_GRVW2_GSU1_IU1_LBSPP128_LPA2_LPB2_LRVW2_NEPBS4_NLCA1_NLCB1_ONLL1_PGR2_PLR9_SIA3_SS1_SU32_SUS256_SRVW0_SVW1_SNLL0_TT1_96_TLDS1_USFGROn1_VW1_WSGRA1_WSGRB1_WG64_4_1_WGM10
    SolutionIndex: 34
    SolutionNameMin: Cijk_Alik_Bljk_SB_MT32x32x32_MI16x16x4x1_SE_1LDSB0_AMAS0_DTL0_EPS0_GRVW4_GSU1_IU1_LBSPP128_LPA4_LPB4_LRVW2_NEPBS0_NLCA1_NLCB1_ONLL1_PGR2_PLR9_SIA3_SS0_SU0_SUS256_SRVW2_SVW4_SNLL0_TT1_16_TLDS1_USFGROn1_VW1_WSGRA1_WSGRB1_WG32_8_1_WGM2
    SolutionIndex: 35
    SolutionNameMin: Cijk_Alik_Bljk_SB_MT64x32x32_MI16x16x4x1_SE_1LDSB0_AMAS0_DTL0_EPS0_GRVW1_GSU1_IU1_LBSPP128_LPA2_LPB2_LRVW2_NEPBS0_NLCA1_NLCB1_ONLL1_PGR2_PLR9_SIA3_SS0_SU32_SUS256_SRVW2_SVW4_SNLL0_TT2_16_TLDS1_USFGROn1_VW1_WSGRA1_WSGRB1_WG32_8_1_WGM1
    SolutionIndex: 36
    SolutionNameMin: Cijk_Alik_Bljk_SB_MT64x64x32_MI32x32x2x1_SE_1LDSB0_AMAS0_DTL0_EPS0_GRVW2_GSU1_IU1_LBSPP128_LPA2_LPB2_LRVW2_NEPBS0_NLCA1_NLCB1_ONLL1_PGR2_PLR17_SIA3_SS0_SU0_SUS256_SRVW2_SVW4_SNLL0_TT1_32_TLDS1_USFGROn1_VW1_WSGRA1_WSGRB1_WG64_4_1_WGM2
    SolutionIndex: 37
    SolutionNameMin: Cijk_Alik_Bljk_SB_MT64x32x32_MI16x16x4x1_SE_1LDSB1_AMAS0_DTL0_EPS0_GRVW2_GSU1_IU1_LBSPP128_LPA2_LPB2_LRVW2_NEPBS0_NLCA1_NLCB1_ONLL1_PGR2_PLR9_SIA3_SS0_SU0_SUS256_SRVW2_SVW4_SNLL0_TT2_16_TLDS1_USFGROn1_VW1_WSGRA1_WSGRB1_WG32_8_1_WGM15
    SolutionIndex: 38
    SolutionNameMin: Cijk_Alik_Bljk_SB_MT128x128x16_MI32x32x2x1_SE_1LDSB0_AMAS0_DTL0_EPS0_GRVW2_GSU1_IU1_LBSPP128_LPA2_LPB2_LRVW2_NEPBS0_NLCA1_NLCB1_ONLL1_PGR2_PLR9_SIA3_SS0_SU0_SUS256_SRVW2_SVW4_SNLL0_TT2_64_TLDS1_USFGROn1_VW1_WSGRA1_WSGRB1_WG64_4_1_WGM15
    SolutionIndex: 39
    SolutionNameMin: Cijk_Alik_Bljk_SB_MT128x64x16_MI32x32x2x1_SE_1LDSB0_AMAS0_DTL0_EPS0_GRVW2_GSU1_IU1_LBSPP128_LPA2_LPB2_LRVW2_NEPBS0_NLCA1_NLCB1_ONLL1_PGR2_PLR9_SIA3_SS0_SU0_SUS256_SRVW2_SVW4_SNLL0_TT2_32_TLDS1_USFGROn1_VW1_WSGRA1_WSGRB1_WG64_4_1_WGM2
    SolutionIndex: 40
    SolutionNameMin: Cijk_Alik_Bljk_SB_MT32x32x32_MI16x16x4x1_SE_1LDSB0_AMAS0_DTL0_EPS0_GRVW2_GSU1_IU1_LBSPP128_LPA2_LPB2_LRVW2_NEPBS0_NLCA1_NLCB1_ONLL1_PGR2_PLR9_SIA3_SS0_SU32_SUS128_SRVW2_SVW4_SNLL0_TT1_16_TLDS1_USFGROn1_VW1_WSGRA1_WSGRB1_WG32_8_1_WGM1
    SolutionIndex: 41
    SolutionNameMin: Cijk_Alik_Bljk_SB_MT32x32x32_MI16x16x4x1_SE_1LDSB0_AMAS0_DTL0_EPS0_GRVW1_GSU1_IU1_LBSPP128_LPA2_LPB2_LRVW2_NEPBS0_NLCA1_NLCB1_ONLL1_PGR2_PLR9_SIA3_SS0_SU32_SUS128_SRVW2_SVW4_SNLL0_TT1_16_TLDS1_USFGROn1_VW1_WSGRA1_WSGRB1_WG32_8_1_WGM2
    SolutionIndex: 42
    SolutionNameMin: Cijk_Alik_Bljk_SB_MT64x144x32_MI16x16x4x1_SE_1LDSB1_AMAS0_DTL0_EPS0_GRVW2_GSU1_IU1_LBSPP128_LPA2_LPB2_LRVW2_NEPBS0_NLCA1_NLCB1_ONLL1_PGR2_PLR9_SIA3_SS0_SU32_SUS256_SRVW2_SVW4_SNLL0_TT1_144_TLDS1_USFGROn1_VW1_WSGRA1_WSGRB1_WG64_4_1_WGM15
    SolutionIndex: 43
    SolutionNameMin: Cijk_Alik_Bljk_SB_MT32x32x32_MI16x16x4x1_SE_1LDSB1_AMAS0_DTL0_EPS1_GRVW2_GSU1_IU1_LBSPP128_LPA2_LPB2_LRVW2_NEPBS0_NLCA1_NLCB1_ONLL1_PGR1_PLR9_SIA3_SS0_SU32_SUS128_SRVW2_SVW4_SNLL0_TT1_16_TLDS1_USFGROn1_VW1_WSGRA1_WSGRB1_WG32_8_1_WGM1
    SolutionIndex: 44
    SolutionNameMin: Cijk_Alik_Bljk_SB_MT64x32x32_MI16x16x4x1_SE_1LDSB0_AMAS0_DTL0_EPS0_GRVW1_GSU1_IU1_LBSPP128_LPA2_LPB2_LRVW2_NEPBS0_NLCA1_NLCB1_ONLL1_PGR2_PLR9_SIA3_SS0_SU0_SUS256_SRVW2_SVW4_SNLL0_TT2_16_TLDS1_USFGROn1_VW1_WSGRA1_WSGRB1_WG32_8_1_WGM2
    SolutionIndex: 45
    SolutionNameMin: Cijk_Alik_Bljk_SB_MT32x32x32_MI16x16x4x1_SE_1LDSB0_AMAS0_DTL0_EPS0_GRVW2_GSU1_IU1_LBSPP128_LPA2_LPB2_LRVW2_NEPBS0_NLCA1_NLCB1_ONLL1_PGR2_PLR9_SIA3_SS0_SU0_SUS256_SRVW2_SVW4_SNLL0_TT1_16_TLDS1_USFGROn1_VW1_WSGRA1_WSGRB1_WG32_8_1_WGM1
    SolutionIndex: 46
    SolutionNameMin: Cijk_Alik_Bljk_SB_MT64x64x32_MI32x32x2x1_SE_1LDSB0_AMAS0_DTL0_EPS0_GRVW2_GSU1_IU1_LBSPP128_LPA2_LPB2_LRVW2_NEPBS0_NLCA1_NLCB1_ONLL1_PGR2_PLR17_SIA3_SS0_SU32_SUS256_SRVW2_SVW4_SNLL0_TT1_32_TLDS1_USFGROn1_VW1_WSGRA1_WSGRB1_WG64_4_1_WGM1
    SolutionIndex: 47
    SolutionNameMin: Cijk_Alik_Bljk_SB_MT32x32x32_MI16x16x4x1_SE_1LDSB1_AMAS0_DTL0_EPS0_GRVW4_GSU1_IU1_LBSPP128_LPA4_LPB4_LRVW2_NEPBS0_NLCA1_NLCB1_ONLL1_PGR2_PLR9_SIA3_SS0_SU32_SUS128_SRVW2_SVW4_SNLL0_TT1_16_TLDS1_USFGROn1_VW1_WSGRA1_WSGRB1_WG32_8_1_WGM1
    SolutionIndex: 48
    SolutionNameMin: Cijk_Alik_Bljk_SB_MT16x64x32_MI16x16x4x1_SE_1LDSB0_AMAS3_DTL0_EPS0_GRVW4_GSU1_IU1_LBSPP128_LPA4_LPB4_LRVW2_NEPBS0_NLCA1_NLCB1_ONLL1_PGR2_PLR9_SIA3_SS0_SU0_SUS256_SRVW0_SVW4_SNLL0_TT1_16_TLDS1_USFGROn1_VW2_WSGRA1_WSGRB1_WG16_16_1_WGM2
    SolutionIndex: 49
    SolutionNameMin: Cijk_Alik_Bljk_SB_MT144x64x32_MI16x16x4x1_SE_1LDSB1_AMAS0_DTL0_EPS0_GRVW1_GSU1_IU1_LBSPP128_LPA2_LPB2_LRVW2_NEPBS0_NLCA1_NLCB1_ONLL1_PGR2_PLR9_SIA3_SS0_SU32_SUS256_SRVW0_SVW4_SNLL0_TT9_16_TLDS1_USFGROn1_VW1_WSGRA1_WSGRB1_WG16_16_1_WGM15
    SolutionIndex: 50
    SolutionNameMin: Cijk_Alik_Bljk_SB_MT64x32x32_MI16x16x4x1_SE_1LDSB0_AMAS0_DTL0_EPS0_GRVW2_GSU1_IU1_LBSPP128_LPA2_LPB2_LRVW2_NEPBS0_NLCA1_NLCB1_ONLL1_PGR2_PLR9_SIA3_SS0_SU32_SUS256_SRVW2_SVW4_SNLL0_TT2_16_TLDS1_USFGROn1_VW1_WSGRA1_WSGRB1_WG32_8_1_WGM15
    SolutionIndex: 51
    SolutionNameMin: Cijk_Alik_Bljk_SB_MT64x144x32_MI16x16x4x1_SE_1LDSB0_AMAS0_DTL0_EPS0_GRVW2_GSU1_IU1_LBSPP128_LPA2_LPB2_LRVW2_NEPBS0_NLCA1_NLCB1_ONLL1_PGR2_PLR9_SIA3_SS0_SU32_SUS256_SRVW2_SVW4_SNLL0_TT1_144_TLDS1_USFGROn1_VW1_WSGRA1_WSGRB1_WG64_4_1_WGM15
    SolutionIndex: 52
    SolutionNameMin: Cijk_Alik_Bljk_SB_MT128x64x32_MI32x32x2x1_SE_1LDSB0_AMAS0_DTL0_EPS0_GRVW1_GSU1_IU1_LBSPP128_LPA2_LPB2_LRVW2_NEPBS0_NLCA1_NLCB1_ONLL1_PGR2_PLR17_SIA3_SS0_SU0_SUS256_SRVW2_SVW4_SNLL0_TT2_32_TLDS1_USFGROn1_VW1_WSGRA1_WSGRB1_WG64_4_1_WGM1
    SolutionIndex: 53
    SolutionNameMin: Cijk_Alik_Bljk_SB_MT32x32x32_MI16x16x4x1_SE_1LDSB0_AMAS0_DTL0_EPS0_GRVW1_GSU1_IU1_LBSPP128_LPA2_LPB2_LRVW2_NEPBS0_NLCA1_NLCB1_ONLL1_PGR2_PLR9_SIA3_SS0_SU0_SUS256_SRVW2_SVW4_SNLL0_TT1_16_TLDS1_USFGROn1_VW1_WSGRA1_WSGRB1_WG32_8_1_WGM1
    SolutionIndex: 54
    SolutionNameMin: Cijk_Alik_Bljk_SB_MT32x64x32_MI16x16x4x1_SE_1LDSB1_AMAS0_DTL0_EPS1_GRVW4_GSU1_IU1_LBSPP128_LPA4_LPB4_LRVW2_NEPBS0_NLCA1_NLCB1_ONLL1_PGR1_PLR9_SIA3_SS0_SU0_SUS256_SRVW2_SVW4_SNLL0_TT1_32_TLDS1_USFGROn1_VW1_WSGRA1_WSGRB1_WG32_8_1_WGM15
    SolutionIndex: 56
    SolutionNameMin: Cijk_Alik_Bljk_SB_MT32x32x32_MI16x16x4x1_SN_1LDSB1_AMAS0_DTL0_EPS0_GRVW2_GSU1_IU1_LBSPP128_LPA2_LPB2_LRVW2_NEPBS2_NLCA1_NLCB1_ONLL1_PGR2_PLR9_SIA3_SS1_SU0_SUS256_SRVW0_SVW1_SNLL0_TT1_16_TLDS1_USFGROn1_VW1_WSGRA1_WSGRB1_WG32_8_1_WGM8
    SolutionIndex: 57
    SolutionNameMin: Cijk_Alik_Bljk_SB_MT64x128x16_MI32x32x2x1_SE_1LDSB1_AMAS0_DTL0_EPS0_GRVW4_GSU1_IU1_LBSPP128_LPA4_LPB4_LRVW2_NEPBS0_NLCA1_NLCB1_ONLL1_PGR2_PLR9_SIA3_SS0_SU0_SUS256_SRVW2_SVW4_SNLL0_TT1_64_TLDS1_USFGROn1_VW1_WSGRA1_WSGRB1_WG64_4_1_WGM1
    SolutionIndex: 58
    SolutionNameMin: Cijk_Alik_Bljk_SB_MT32x32x32_MI16x16x4x1_SE_1LDSB0_AMAS0_DTL0_EPS0_GRVW2_GSU1_IU1_LBSPP128_LPA2_LPB2_LRVW2_NEPBS0_NLCA1_NLCB1_ONLL1_PGR2_PLR9_SIA3_SS0_SU0_SUS256_SRVW2_SVW4_SNLL0_TT1_16_TLDS1_USFGROn1_VW1_WSGRA1_WSGRB1_WG32_8_1_WGM15
    SolutionIndex: 59
    SolutionNameMin: Cijk_Alik_Bljk_SB_MT16x64x32_MI16x16x4x1_SN_1LDSB1_AMAS0_DTL0_EPS0_GRVW2_GSU1_IU1_LBSPP128_LPA2_LPB2_LRVW2_NEPBS2_NLCA1_NLCB1_ONLL1_PGR2_PLR9_SIA3_SS1_SU32_SUS256_SRVW0_SVW1_SNLL0_TT1_16_TLDS1_USFGROn1_VW1_WSGRA1_WSGRB1_WG16_16_1_WGM5
    SolutionIndex: 60
    SolutionNameMin: Cijk_Alik_Bljk_SB_MT64x32x32_MI16x16x4x1_SE_1LDSB0_AMAS0_DTL0_EPS0_GRVW4_GSU1_IU1_LBSPP128_LPA4_LPB4_LRVW2_NEPBS0_NLCA1_NLCB1_ONLL1_PGR2_PLR9_SIA3_SS0_SU32_SUS128_SRVW2_SVW4_SNLL0_TT2_16_TLDS1_USFGROn1_VW1_WSGRA1_WSGRB1_WG32_8_1_WGM15
    SolutionIndex: 61
    SolutionNameMin: Cijk_Alik_Bljk_SB_MT64x64x32_MI32x32x2x1_SE_1LDSB1_AMAS0_DTL0_EPS0_GRVW4_GSU1_IU1_LBSPP128_LPA4_LPB4_LRVW2_NEPBS0_NLCA1_NLCB1_ONLL1_PGR2_PLR17_SIA3_SS0_SU0_SUS256_SRVW2_SVW4_SNLL0_TT1_32_TLDS1_USFGROn1_VW1_WSGRA1_WSGRB1_WG64_4_1_WGM2
    SolutionIndex: 62
    SolutionNameMin: Cijk_Alik_Bljk_SB_MT16x16x32_MI16x16x4x1_SE_1LDSB1_AMAS3_DTL0_EPS1_GRVW4_GSU1_IU1_LBSPP128_LPA4_LPB4_LRVW2_NEPBS0_NLCA1_NLCB1_ONLL1_PGR1_PLR9_SIA3_SS0_SU0_SUS256_SRVW0_SVW4_SNLL0_TT1_16_TLDS1_USFGROn1_VW2_WSGRA1_WSGRB1_WG16_4_1_WGM1
    SolutionIndex: 63
    SolutionNameMin: Cijk_Alik_Bljk_SB_MT128x64x16_MI32x32x2x1_SE_1LDSB1_AMAS0_DTL0_EPS0_GRVW2_GSU1_IU1_LBSPP128_LPA2_LPB2_LRVW2_NEPBS0_NLCA1_NLCB1_ONLL1_PGR2_PLR9_SIA3_SS0_SU0_SUS256_SRVW2_SVW4_SNLL0_TT2_32_TLDS1_USFGROn1_VW1_WSGRA1_WSGRB1_WG64_4_1_WGM1
    SolutionIndex: 64
    SolutionNameMin: Cijk_Alik_Bljk_SB_MT32x32x32_MI16x16x4x1_SN_1LDSB1_AMAS0_DTL0_EPS0_GRVW2_GSU1_IU1_LBSPP128_LPA2_LPB2_LRVW2_NEPBS1_NLCA1_NLCB1_ONLL1_PGR2_PLR9_SIA3_SS1_SU0_SUS256_SRVW0_SVW1_SNLL0_TT1_16_TLDS1_USFGROn1_VW1_WSGRA1_WSGRB1_WG32_8_1_WGM5
    SolutionIndex: 65
    SolutionNameMin: Cijk_Alik_Bljk_SB_MT144x64x32_MI16x16x4x1_SE_1LDSB0_AMAS0_DTL0_EPS0_GRVW2_GSU1_IU1_LBSPP128_LPA2_LPB2_LRVW2_NEPBS0_NLCA1_NLCB1_ONLL1_PGR2_PLR9_SIA3_SS0_SU32_SUS256_SRVW0_SVW4_SNLL0_TT9_16_TLDS1_USFGROn1_VW1_WSGRA1_WSGRB1_WG16_16_1_WGM15
    SolutionIndex: 66
    SolutionNameMin: Cijk_Alik_Bljk_SB_MT64x64x32_MI32x32x2x1_SE_1LDSB1_AMAS0_DTL0_EPS1_GRVW4_GSU1_IU1_LBSPP128_LPA4_LPB4_LRVW2_NEPBS0_NLCA1_NLCB1_ONLL1_PGR1_PLR17_SIA3_SS0_SU0_SUS256_SRVW2_SVW4_SNLL0_TT1_32_TLDS1_USFGROn1_VW1_WSGRA1_WSGRB1_WG64_4_1_WGM2
    SolutionIndex: 67
    SolutionNameMin: Cijk_Alik_Bljk_SB_MT64x64x32_MI32x32x2x1_SE_1LDSB0_AMAS0_DTL0_EPS0_GRVW2_GSU1_IU1_LBSPP128_LPA2_LPB2_LRVW2_NEPBS0_NLCA1_NLCB1_ONLL1_PGR2_PLR17_SIA3_SS0_SU0_SUS256_SRVW2_SVW4_SNLL0_TT1_32_TLDS1_USFGROn1_VW1_WSGRA1_WSGRB1_WG64_4_1_WGM1
    SolutionIndex: 68
    SolutionNameMin: Cijk_Alik_Bljk_SB_MT16x16x32_MI16x16x4x1_SE_1LDSB0_AMAS3_DTL0_EPS0_GRVW2_GSU1_IU1_LBSPP128_LPA2_LPB2_LRVW2_NEPBS0_NLCA1_NLCB1_ONLL1_PGR2_PLR9_SIA3_SS0_SU0_SUS256_SRVW0_SVW4_SNLL0_TT1_16_TLDS1_USFGROn1_VW2_WSGRA1_WSGRB1_WG16_4_1_WGM15
    SolutionIndex: 69
    SolutionNameMin: Cijk_Alik_Bljk_SB_MT128x160x16_MI32x32x2x1_SE_1LDSB1_AMAS0_DTL0_EPS1_GRVW1_GSU1_IU1_LBSPP128_LPA2_LPB2_LRVW2_NEPBS0_NLCA1_NLCB1_ONLL1_PGR1_PLR9_SIA3_SS0_SU0_SUS256_SRVW2_SVW4_SNLL0_TT1_160_TLDS1_USFGROn1_VW1_WSGRA1_WSGRB1_WG128_2_1_WGM1
    SolutionIndex: 70
    SolutionNameMin: Cijk_Alik_Bljk_SB_MT16x64x32_MI16x16x4x1_SN_1LDSB1_AMAS0_DTL0_EPS0_GRVW4_GSU1_IU1_LBSPP128_LPA4_LPB4_LRVW2_NEPBS4_NLCA1_NLCB1_ONLL1_PGR2_PLR9_SIA3_SS1_SU0_SUS256_SRVW0_SVW1_SNLL0_TT1_16_TLDS1_USFGROn1_VW1_WSGRA1_WSGRB1_WG16_16_1_WGM8
    SolutionIndex: 71
    SolutionNameMin: Cijk_Alik_Bljk_SB_MT64x64x32_MI32x32x2x1_SE_1LDSB1_AMAS0_DTL0_EPS1_GRVW4_GSU1_IU1_LBSPP128_LPA4_LPB4_LRVW2_NEPBS0_NLCA1_NLCB1_ONLL1_PGR1_PLR17_SIA3_SS0_SU32_SUS256_SRVW2_SVW4_SNLL0_TT1_32_TLDS1_USFGROn1_VW1_WSGRA1_WSGRB1_WG64_4_1_WGM1
    SolutionIndex: 72
    SolutionNameMin: Cijk_Alik_Bljk_SB_MT64x128x16_MI32x32x2x1_SE_1LDSB0_AMAS0_DTL0_EPS0_GRVW4_GSU1_IU1_LBSPP128_LPA4_LPB4_LRVW2_NEPBS0_NLCA1_NLCB1_ONLL1_PGR2_PLR9_SIA3_SS0_SU0_SUS256_SRVW2_SVW4_SNLL0_TT1_64_TLDS1_USFGROn1_VW1_WSGRA1_WSGRB1_WG64_4_1_WGM1
    SolutionIndex: 73
    SolutionNameMin: Cijk_Alik_Bljk_SB_MT64x144x32_MI16x16x4x1_SE_1LDSB1_AMAS0_DTL0_EPS0_GRVW1_GSU1_IU1_LBSPP128_LPA2_LPB2_LRVW2_NEPBS0_NLCA1_NLCB1_ONLL1_PGR2_PLR9_SIA3_SS0_SU32_SUS128_SRVW2_SVW4_SNLL0_TT1_144_TLDS1_USFGROn1_VW1_WSGRA1_WSGRB1_WG64_4_1_WGM15
    SolutionIndex: 74
    SolutionNameMin: Cijk_Alik_Bljk_SB_MT64x128x16_MI32x32x2x1_SE_1LDSB1_AMAS0_DTL0_EPS0_GRVW2_GSU1_IU1_LBSPP128_LPA2_LPB2_LRVW2_NEPBS0_NLCA1_NLCB1_ONLL1_PGR2_PLR9_SIA3_SS0_SU32_SUS128_SRVW2_SVW4_SNLL0_TT1_64_TLDS1_USFGROn1_VW1_WSGRA1_WSGRB1_WG64_4_1_WGM1
    SolutionIndex: 75
    SolutionNameMin: Cijk_Alik_Bljk_SB_MT32x32x32_MI16x16x4x1_SE_1LDSB0_AMAS0_DTL0_EPS0_GRVW4_GSU1_IU1_LBSPP128_LPA4_LPB4_LRVW2_NEPBS0_NLCA1_NLCB1_ONLL1_PGR2_PLR9_SIA3_SS0_SU32_SUS128_SRVW2_SVW4_SNLL0_TT1_16_TLDS1_USFGROn1_VW1_WSGRA1_WSGRB1_WG32_8_1_WGM1
    SolutionIndex: 76
    SolutionNameMin: Cijk_Alik_Bljk_SB_MT64x64x32_MI32x32x2x1_SE_1LDSB1_AMAS0_DTL0_EPS0_GRVW4_GSU1_IU1_LBSPP128_LPA4_LPB4_LRVW2_NEPBS0_NLCA1_NLCB1_ONLL1_PGR2_PLR17_SIA3_SS0_SU32_SUS256_SRVW2_SVW4_SNLL0_TT1_32_TLDS1_USFGROn1_VW1_WSGRA1_WSGRB1_WG64_4_1_WGM1
    SolutionIndex: 77
    SolutionNameMin: Cijk_Alik_Bljk_SB_MT64x128x16_MI32x32x2x1_SE_1LDSB0_AMAS0_DTL0_EPS0_GRVW1_GSU1_IU1_LBSPP128_LPA2_LPB2_LRVW2_NEPBS0_NLCA1_NLCB1_ONLL1_PGR2_PLR9_SIA3_SS0_SU0_SUS256_SRVW2_SVW4_SNLL0_TT1_64_TLDS1_USFGROn1_VW1_WSGRA1_WSGRB1_WG64_4_1_WGM2
    SolutionIndex: 78
    SolutionNameMin: Cijk_Alik_Bljk_SB_MT16x16x32_MI16x16x4x1_SN_1LDSB0_AMAS0_DTL0_EPS0_GRVW4_GSU1_IU1_LBSPP128_LPA4_LPB4_LRVW2_NEPBS8_NLCA1_NLCB1_ONLL1_PGR2_PLR9_SIA3_SS1_SU0_SUS256_SRVW0_SVW1_SNLL0_TT1_16_TLDS1_USFGROn1_VW1_WSGRA1_WSGRB1_WG16_4_1_WGM8
    SolutionIndex: 79
    SolutionNameMin: Cijk_Alik_Bljk_SB_MT144x64x16_MI16x16x4x1_SE_1LDSB0_AMAS0_DTL0_EPS0_GRVW1_GSU1_IU1_LBSPP128_LPA2_LPB2_LRVW2_NEPBS0_NLCA1_NLCB1_ONLL1_PGR2_PLR5_SIA3_SS0_SU0_SUS256_SRVW0_SVW4_SNLL0_TT9_16_TLDS1_USFGROn1_VW1_WSGRA1_WSGRB1_WG16_16_1_WGM1
    SolutionIndex: 80
    SolutionNameMin: Cijk_Alik_Bljk_SB_MT64x64x32_MI32x32x2x1_SE_1LDSB0_AMAS0_DTL0_EPS0_GRVW2_GSU1_IU1_LBSPP128_LPA2_LPB2_LRVW2_NEPBS0_NLCA1_NLCB1_ONLL1_PGR2_PLR17_SIA3_SS0_SU0_SUS256_SRVW2_SVW4_SNLL0_TT1_32_TLDS1_USFGROn1_VW1_WSGRA1_WSGRB1_WG64_4_1_WGM15
    SolutionIndex: 81
    SolutionNameMin: Cijk_Alik_Bljk_SB_MT16x16x32_MI16x16x4x1_SN_1LDSB0_AMAS0_DTL0_EPS0_GRVW4_GSU1_IU1_LBSPP128_LPA4_LPB4_LRVW2_NEPBS2_NLCA1_NLCB1_ONLL1_PGR2_PLR9_SIA3_SS1_SU0_SUS256_SRVW0_SVW1_SNLL0_TT1_16_TLDS1_USFGROn1_VW1_WSGRA1_WSGRB1_WG16_4_1_WGM10
    SolutionIndex: 82
    SolutionNameMin: Cijk_Alik_Bljk_SB_MT64x16x32_MI16x16x4x1_SN_1LDSB1_AMAS0_DTL0_EPS0_GRVW4_GSU1_IU1_LBSPP128_LPA4_LPB4_LRVW2_NEPBS2_NLCA1_NLCB1_ONLL1_PGR2_PLR9_SIA3_SS1_SU32_SUS256_SRVW0_SVW1_SNLL0_TT1_16_TLDS1_USFGROn1_VW1_WSGRA1_WSGRB1_WG64_4_1_WGM8
    SolutionIndex: 83
    SolutionNameMin: Cijk_Alik_Bljk_SB_MT64x32x32_MI16x16x4x1_SE_1LDSB1_AMAS0_DTL0_EPS0_GRVW2_GSU1_IU1_LBSPP128_LPA2_LPB2_LRVW2_NEPBS0_NLCA1_NLCB1_ONLL1_PGR2_PLR9_SIA3_SS0_SU32_SUS256_SRVW2_SVW4_SNLL0_TT2_16_TLDS1_USFGROn1_VW1_WSGRA1_WSGRB1_WG32_8_1_WGM2
    SolutionIndex: 84
    SolutionNameMin: Cijk_Alik_Bljk_SB_MT16x16x32_MI16x16x4x1_SE_1LDSB0_AMAS3_DTL0_EPS0_GRVW1_GSU1_IU1_LBSPP128_LPA2_LPB2_LRVW2_NEPBS0_NLCA1_NLCB1_ONLL1_PGR2_PLR9_SIA3_SS0_SU0_SUS256_SRVW0_SVW4_SNLL0_TT1_16_TLDS1_USFGROn1_VW2_WSGRA1_WSGRB1_WG16_4_1_WGM1
    SolutionIndex: 85
    SolutionNameMin: Cijk_Alik_Bljk_SB_MT32x64x32_MI16x16x4x1_SE_1LDSB1_AMAS0_DTL0_EPS0_GRVW4_GSU1_IU1_LBSPP128_LPA4_LPB4_LRVW2_NEPBS0_NLCA1_NLCB1_ONLL1_PGR2_PLR9_SIA3_SS0_SU0_SUS256_SRVW2_SVW4_SNLL0_TT1_32_TLDS1_USFGROn1_VW1_WSGRA1_WSGRB1_WG32_8_1_WGM2
    SolutionIndex: 86
    SolutionNameMin: Cijk_Alik_Bljk_SB_MT128x160x16_MI32x32x2x1_SE_1LDSB1_AMAS0_DTL0_EPS1_GRVW1_GSU1_IU1_LBSPP128_LPA2_LPB2_LRVW2_NEPBS0_NLCA1_NLCB1_ONLL1_PGR1_PLR9_SIA3_SS0_SU0_SUS256_SRVW2_SVW4_SNLL0_TT1_160_TLDS1_USFGROn1_VW1_WSGRA1_WSGRB1_WG128_2_1_WGM2
    SolutionIndex: 87
    SolutionNameMin: Cijk_Alik_Bljk_SB_MT64x32x32_MI16x16x4x1_SE_1LDSB0_AMAS0_DTL0_EPS0_GRVW2_GSU1_IU1_LBSPP128_LPA2_LPB2_LRVW2_NEPBS0_NLCA1_NLCB1_ONLL1_PGR2_PLR9_SIA3_SS0_SU32_SUS128_SRVW2_SVW4_SNLL0_TT2_16_TLDS1_USFGROn1_VW1_WSGRA1_WSGRB1_WG32_8_1_WGM15
    SolutionIndex: 88
    SolutionNameMin: Cijk_Alik_Bljk_SB_MT32x64x32_MI16x16x4x1_SE_1LDSB0_AMAS0_DTL0_EPS0_GRVW1_GSU1_IU1_LBSPP128_LPA2_LPB2_LRVW2_NEPBS0_NLCA1_NLCB1_ONLL1_PGR2_PLR9_SIA3_SS0_SU0_SUS256_SRVW2_SVW4_SNLL0_TT1_32_TLDS1_USFGROn1_VW1_WSGRA1_WSGRB1_WG32_8_1_WGM1
    SolutionIndex: 89
    SolutionNameMin: Cijk_Alik_Bljk_SB_MT32x32x32_MI16x16x4x1_SE_1LDSB0_AMAS0_DTL0_EPS0_GRVW2_GSU1_IU1_LBSPP128_LPA2_LPB2_LRVW2_NEPBS0_NLCA1_NLCB1_ONLL1_PGR2_PLR9_SIA3_SS0_SU32_SUS256_SRVW2_SVW4_SNLL0_TT1_16_TLDS1_USFGROn1_VW1_WSGRA1_WSGRB1_WG32_8_1_WGM1
    SolutionIndex: 90
    SolutionNameMin: Cijk_Alik_Bljk_SB_MT64x128x16_MI32x32x2x1_SE_1LDSB0_AMAS0_DTL0_EPS0_GRVW2_GSU1_IU1_LBSPP128_LPA2_LPB2_LRVW2_NEPBS0_NLCA1_NLCB1_ONLL1_PGR2_PLR9_SIA3_SS0_SU0_SUS256_SRVW2_SVW4_SNLL0_TT1_64_TLDS1_USFGROn1_VW1_WSGRA1_WSGRB1_WG64_4_1_WGM15
    SolutionIndex: 91
    SolutionNameMin: Cijk_Alik_Bljk_SB_MT64x128x16_MI32x32x2x1_SE_1LDSB0_AMAS0_DTL0_EPS0_GRVW1_GSU1_IU1_LBSPP128_LPA2_LPB2_LRVW2_NEPBS0_NLCA1_NLCB1_ONLL1_PGR2_PLR9_SIA3_SS0_SU0_SUS256_SRVW2_SVW4_SNLL0_TT1_64_TLDS1_USFGROn1_VW1_WSGRA1_WSGRB1_WG64_4_1_WGM15
    SolutionIndex: 92
    SolutionNameMin: Cijk_Alik_Bljk_SB_MT64x64x32_MI32x32x2x1_SE_1LDSB1_AMAS0_DTL0_EPS1_GRVW2_GSU1_IU1_LBSPP128_LPA2_LPB2_LRVW2_NEPBS0_NLCA1_NLCB1_ONLL1_PGR1_PLR17_SIA3_SS0_SU32_SUS256_SRVW2_SVW4_SNLL0_TT1_32_TLDS1_USFGROn1_VW1_WSGRA1_WSGRB1_WG64_4_1_WGM2
    SolutionIndex: 93
    SolutionNameMin: Cijk_Alik_Bljk_SB_MT64x64x32_MI32x32x2x1_SE_1LDSB0_AMAS0_DTL0_EPS0_GRVW1_GSU1_IU1_LBSPP128_LPA2_LPB2_LRVW2_NEPBS0_NLCA1_NLCB1_ONLL1_PGR2_PLR17_SIA3_SS0_SU0_SUS256_SRVW2_SVW4_SNLL0_TT1_32_TLDS1_USFGROn1_VW1_WSGRA1_WSGRB1_WG64_4_1_WGM2
    SolutionIndex: 94
    SolutionNameMin: Cijk_Alik_Bljk_SB_MT64x64x32_MI32x32x2x1_SE_1LDSB1_AMAS0_DTL0_EPS0_GRVW4_GSU1_IU1_LBSPP128_LPA4_LPB4_LRVW2_NEPBS0_NLCA1_NLCB1_ONLL1_PGR2_PLR17_SIA3_SS0_SU32_SUS128_SRVW2_SVW4_SNLL0_TT1_32_TLDS1_USFGROn1_VW1_WSGRA1_WSGRB1_WG64_4_1_WGM1
    SolutionIndex: 95
    SolutionNameMin: Cijk_Alik_Bljk_SB_MT16x16x32_MI16x16x4x1_SE_1LDSB1_AMAS3_DTL0_EPS1_GRVW4_GSU1_IU1_LBSPP128_LPA4_LPB4_LRVW2_NEPBS0_NLCA1_NLCB1_ONLL1_PGR1_PLR9_SIA3_SS0_SU0_SUS256_SRVW2_SVW4_SNLL0_TT1_16_TLDS1_USFGROn1_VW2_WSGRA1_WSGRB1_WG16_4_1_WGM1
    SolutionIndex: 96
    SolutionNameMin: Cijk_Alik_Bljk_SB_MT64x128x32_MI32x32x2x1_SE_1LDSB0_AMAS0_DTL0_EPS0_GRVW1_GSU1_IU1_LBSPP128_LPA2_LPB2_LRVW2_NEPBS0_NLCA1_NLCB1_ONLL1_PGR2_PLR17_SIA3_SS0_SU0_SUS256_SRVW2_SVW4_SNLL0_TT1_64_TLDS1_USFGROn1_VW1_WSGRA1_WSGRB1_WG64_4_1_WGM15
    SolutionIndex: 97
    SolutionNameMin: Cijk_Alik_Bljk_SB_MT64x128x16_MI32x32x2x1_SE_1LDSB1_AMAS0_DTL0_EPS0_GRVW2_GSU1_IU1_LBSPP128_LPA2_LPB2_LRVW2_NEPBS0_NLCA1_NLCB1_ONLL1_PGR2_PLR9_SIA3_SS0_SU32_SUS256_SRVW2_SVW4_SNLL0_TT1_64_TLDS1_USFGROn1_VW1_WSGRA1_WSGRB1_WG64_4_1_WGM2
    SolutionIndex: 98
    SolutionNameMin: Cijk_Alik_Bljk_SB_MT32x64x32_MI16x16x4x1_SE_1LDSB0_AMAS0_DTL0_EPS0_GRVW1_GSU1_IU1_LBSPP128_LPA2_LPB2_LRVW2_NEPBS0_NLCA1_NLCB1_ONLL1_PGR2_PLR9_SIA3_SS0_SU0_SUS256_SRVW2_SVW4_SNLL0_TT1_32_TLDS1_USFGROn1_VW1_WSGRA1_WSGRB1_WG32_8_1_WGM15
    SolutionIndex: 99
    SolutionNameMin: Cijk_Alik_Bljk_SB_MT64x64x32_MI32x32x2x1_SE_1LDSB1_AMAS0_DTL0_EPS1_GRVW2_GSU1_IU1_LBSPP128_LPA2_LPB2_LRVW2_NEPBS0_NLCA1_NLCB1_ONLL1_PGR1_PLR17_SIA3_SS0_SU32_SUS256_SRVW2_SVW4_SNLL0_TT1_32_TLDS1_USFGROn1_VW1_WSGRA1_WSGRB1_WG64_4_1_WGM1
    SolutionIndex: 100
    SolutionNameMin: Cijk_Alik_Bljk_SB_MT64x32x32_MI16x16x4x1_SE_1LDSB0_AMAS0_DTL0_EPS0_GRVW1_GSU1_IU1_LBSPP128_LPA2_LPB2_LRVW2_NEPBS0_NLCA1_NLCB1_ONLL1_PGR2_PLR9_SIA3_SS0_SU0_SUS256_SRVW2_SVW4_SNLL0_TT2_16_TLDS1_USFGROn1_VW1_WSGRA1_WSGRB1_WG32_8_1_WGM15
    SolutionIndex: 101
    SolutionNameMin: Cijk_Alik_Bljk_SB_MT64x128x32_MI32x32x2x1_SE_1LDSB1_AMAS0_DTL0_EPS0_GRVW1_GSU1_IU1_LBSPP128_LPA2_LPB2_LRVW2_NEPBS0_NLCA1_NLCB1_ONLL1_PGR2_PLR17_SIA3_SS0_SU0_SUS256_SRVW2_SVW4_SNLL0_TT1_64_TLDS1_USFGROn1_VW1_WSGRA1_WSGRB1_WG64_4_1_WGM15
    SolutionIndex: 102
    SolutionNameMin: Cijk_Alik_Bljk_SB_MT64x64x32_MI32x32x2x1_SE_1LDSB1_AMAS0_DTL0_EPS0_GRVW4_GSU1_IU1_LBSPP128_LPA4_LPB4_LRVW2_NEPBS0_NLCA1_NLCB1_ONLL1_PGR2_PLR17_SIA3_SS0_SU32_SUS256_SRVW2_SVW4_SNLL0_TT1_32_TLDS1_USFGROn1_VW1_WSGRA1_WSGRB1_WG64_4_1_WGM15
    SolutionIndex: 103
    SolutionNameMin: Cijk_Alik_Bljk_SB_MT128x96x16_MI32x32x2x1_SE_1LDSB0_AMAS0_DTL0_EPS0_GRVW1_GSU1_IU1_LBSPP128_LPA2_LPB2_LRVW2_NEPBS0_NLCA1_NLCB1_ONLL1_PGR2_PLR9_SIA3_SS0_SU0_SUS256_SRVW2_SVW4_SNLL0_TT1_96_TLDS1_USFGROn1_VW1_WSGRA1_WSGRB1_WG128_2_1_WGM2
    SolutionIndex: 104
    SolutionNameMin: Cijk_Alik_Bljk_SB_MT32x32x32_MI16x16x4x1_SE_1LDSB0_AMAS0_DTL0_EPS0_GRVW1_GSU1_IU1_LBSPP128_LPA2_LPB2_LRVW2_NEPBS0_NLCA1_NLCB1_ONLL1_PGR2_PLR9_SIA3_SS0_SU0_SUS256_SRVW2_SVW4_SNLL0_TT1_16_TLDS1_USFGROn1_VW1_WSGRA1_WSGRB1_WG32_8_1_WGM15
    SolutionIndex: 105
    SolutionNameMin: Cijk_Alik_Bljk_SB_MT64x128x16_MI32x32x2x1_SE_1LDSB0_AMAS0_DTL0_EPS0_GRVW4_GSU1_IU1_LBSPP128_LPA4_LPB4_LRVW2_NEPBS0_NLCA1_NLCB1_ONLL1_PGR2_PLR9_SIA3_SS0_SU0_SUS256_SRVW2_SVW4_SNLL0_TT1_64_TLDS1_USFGROn1_VW1_WSGRA1_WSGRB1_WG64_4_1_WGM15
    SolutionIndex: 106
    SolutionNameMin: Cijk_Alik_Bljk_SB_MT32x32x32_MI16x16x4x1_SE_1LDSB1_AMAS0_DTL0_EPS1_GRVW4_GSU1_IU1_LBSPP128_LPA4_LPB4_LRVW2_NEPBS0_NLCA1_NLCB1_ONLL1_PGR1_PLR9_SIA3_SS0_SU0_SUS256_SRVW2_SVW4_SNLL0_TT1_16_TLDS1_USFGROn1_VW1_WSGRA1_WSGRB1_WG32_8_1_WGM1
    SolutionIndex: 107
    SolutionNameMin: Cijk_Alik_Bljk_SB_MT32x32x32_MI16x16x4x1_SE_1LDSB1_AMAS0_DTL0_EPS1_GRVW1_GSU1_IU1_LBSPP128_LPA2_LPB2_LRVW2_NEPBS0_NLCA1_NLCB1_ONLL1_PGR1_PLR9_SIA3_SS0_SU0_SUS256_SRVW2_SVW4_SNLL0_TT1_16_TLDS1_USFGROn1_VW1_WSGRA1_WSGRB1_WG32_8_1_WGM15
    SolutionIndex: 108
    SolutionNameMin: Cijk_Alik_Bljk_SB_MT128x144x16_MI16x16x4x1_SE_1LDSB1_AMAS0_DTL0_EPS0_GRVW1_GSU1_IU1_LBSPP128_LPA2_LPB2_LRVW2_NEPBS0_NLCA1_NLCB1_ONLL1_PGR2_PLR5_SIA3_SS0_SU0_SUS256_SRVW2_SVW4_SNLL0_TT2_144_TLDS1_USFGROn1_VW1_WSGRA1_WSGRB1_WG64_4_1_WGM1
    SolutionIndex: 109
    SolutionNameMin: Cijk_Alik_Bljk_SB_MT64x128x32_MI32x32x2x1_SE_1LDSB1_AMAS0_DTL0_EPS1_GRVW2_GSU1_IU1_LBSPP128_LPA2_LPB2_LRVW2_NEPBS0_NLCA1_NLCB1_ONLL1_PGR1_PLR17_SIA3_SS0_SU0_SUS256_SRVW2_SVW4_SNLL0_TT1_64_TLDS1_USFGROn1_VW1_WSGRA1_WSGRB1_WG64_4_1_WGM15
    SolutionIndex: 110
    SolutionNameMin: Cijk_Alik_Bljk_SB_MT64x64x32_MI32x32x2x1_SE_1LDSB1_AMAS0_DTL0_EPS1_GRVW1_GSU1_IU1_LBSPP128_LPA2_LPB2_LRVW2_NEPBS0_NLCA1_NLCB1_ONLL1_PGR1_PLR17_SIA3_SS0_SU0_SUS256_SRVW2_SVW4_SNLL0_TT1_32_TLDS1_USFGROn1_VW1_WSGRA1_WSGRB1_WG64_4_1_WGM15
    SolutionIndex: 111
    SolutionNameMin: Cijk_Alik_Bljk_SB_MT128x96x16_MI32x32x2x1_SE_1LDSB1_AMAS0_DTL0_EPS0_GRVW1_GSU1_IU1_LBSPP128_LPA2_LPB2_LRVW2_NEPBS0_NLCA1_NLCB1_ONLL1_PGR2_PLR9_SIA3_SS0_SU0_SUS256_SRVW2_SVW4_SNLL0_TT1_96_TLDS1_USFGROn1_VW1_WSGRA1_WSGRB1_WG128_2_1_WGM15
    SolutionIndex: 112
    SolutionNameMin: Cijk_Alik_Bljk_SB_MT32x64x16_MI16x16x4x1_SE_1LDSB1_AMAS0_DTL0_EPS1_GRVW1_GSU1_IU1_LBSPP128_LPA2_LPB2_LRVW2_NEPBS0_NLCA1_NLCB1_ONLL1_PGR1_PLR5_SIA3_SS0_SU0_SUS256_SRVW2_SVW4_SNLL0_TT1_32_TLDS1_USFGROn1_VW1_WSGRA1_WSGRB1_WG32_8_1_WGM15
    SolutionIndex: 113
    SolutionNameMin: Cijk_Alik_Bljk_SB_MT16x16x16_MI16x16x4x1_SN_1LDSB0_AMAS0_DTL0_EPS0_GRVW2_GSU1_IU1_LBSPP128_LPA2_LPB2_LRVW2_NEPBS4_NLCA1_NLCB1_ONLL1_PGR2_PLR5_SIA3_SS1_SU0_SUS256_SRVW0_SVW1_SNLL0_TT1_16_TLDS1_USFGROn1_VW1_WSGRA1_WSGRB1_WG16_4_1_WGM10
    SolutionIndex: 114
    SolutionNameMin: Cijk_Alik_Bljk_SB_MT64x32x32_MI16x16x4x1_SE_1LDSB0_AMAS0_DTL0_EPS0_GRVW1_GSU1_IU1_LBSPP128_LPA2_LPB2_LRVW2_NEPBS0_NLCA1_NLCB1_ONLL1_PGR2_PLR9_SIA3_SS0_SU0_SUS256_SRVW2_SVW4_SNLL0_TT2_16_TLDS1_USFGROn1_VW1_WSGRA1_WSGRB1_WG32_8_1_WGM1
    SolutionIndex: 115
    SolutionNameMin: Cijk_Alik_Bljk_SB_MT64x64x32_MI32x32x2x1_SE_1LDSB0_AMAS0_DTL0_EPS0_GRVW1_GSU1_IU1_LBSPP128_LPA2_LPB2_LRVW2_NEPBS0_NLCA1_NLCB1_ONLL1_PGR2_PLR17_SIA3_SS0_SU0_SUS256_SRVW2_SVW4_SNLL0_TT1_32_TLDS1_USFGROn1_VW1_WSGRA1_WSGRB1_WG64_4_1_WGM1
    SolutionIndex: 116
    SolutionNameMin: Cijk_Alik_Bljk_SB_MT16x16x16_MI16x16x4x1_SN_1LDSB0_AMAS0_DTL0_EPS0_GRVW4_GSU1_IU1_LBSPP128_LPA4_LPB4_LRVW2_NEPBS4_NLCA1_NLCB1_ONLL1_PGR2_PLR5_SIA3_SS1_SU0_SUS256_SRVW0_SVW1_SNLL0_TT1_16_TLDS1_USFGROn1_VW1_WSGRA1_WSGRB1_WG16_4_1_WGM5
    SolutionIndex: 117
    SolutionNameMin: Cijk_Alik_Bljk_SB_MT64x64x32_MI32x32x2x1_SE_1LDSB1_AMAS0_DTL0_EPS1_GRVW1_GSU1_IU1_LBSPP128_LPA2_LPB2_LRVW2_NEPBS0_NLCA1_NLCB1_ONLL1_PGR1_PLR17_SIA3_SS0_SU0_SUS256_SRVW2_SVW4_SNLL0_TT1_32_TLDS1_USFGROn1_VW1_WSGRA1_WSGRB1_WG64_4_1_WGM2
    SolutionIndex: 118
    SolutionNameMin: Cijk_Alik_Bljk_SB_MT64x64x16_MI32x32x2x1_SE_1LDSB0_AMAS0_DTL0_EPS0_GRVW2_GSU1_IU1_LBSPP128_LPA2_LPB2_LRVW2_NEPBS0_NLCA1_NLCB1_ONLL1_PGR2_PLR9_SIA3_SS0_SU0_SUS256_SRVW2_SVW4_SNLL0_TT1_32_TLDS1_USFGROn1_VW1_WSGRA1_WSGRB1_WG64_4_1_WGM1
    SolutionIndex: 119
    SolutionNameMin: Cijk_Alik_Bljk_SB_MT96x96x32_MI16x16x4x1_SE_1LDSB1_AMAS0_DTL0_EPS0_GRVW1_GSU1_IU1_LBSPP128_LPA2_LPB2_LRVW2_NEPBS0_NLCA1_NLCB1_ONLL1_PGR2_PLR9_SIA3_SS0_SU0_SUS256_SRVW0_SVW4_SNLL0_TT3_48_TLDS1_USFGROn1_VW1_WSGRA1_WSGRB1_WG32_8_1_WGM2
    SolutionIndex: 120
    SolutionNameMin: Cijk_Alik_Bljk_SB_MT32x64x32_MI16x16x4x1_SE_1LDSB0_AMAS0_DTL0_EPS0_GRVW1_GSU1_IU1_LBSPP128_LPA2_LPB2_LRVW2_NEPBS0_NLCA1_NLCB1_ONLL1_PGR2_PLR9_SIA3_SS0_SU0_SUS256_SRVW2_SVW4_SNLL0_TT1_32_TLDS1_USFGROn1_VW1_WSGRA1_WSGRB1_WG32_8_1_WGM2
    SolutionIndex: 121
    SolutionNameMin: Cijk_Alik_Bljk_SB_MT128x64x16_MI32x32x2x1_SE_1LDSB0_AMAS0_DTL0_EPS0_GRVW1_GSU1_IU1_LBSPP128_LPA2_LPB2_LRVW2_NEPBS0_NLCA1_NLCB1_ONLL1_PGR2_PLR9_SIA3_SS0_SU0_SUS256_SRVW2_SVW4_SNLL0_TT2_32_TLDS1_USFGROn1_VW1_WSGRA1_WSGRB1_WG64_4_1_WGM15
    SolutionIndex: 122
    SolutionNameMin: Cijk_Alik_Bljk_SB_MT64x64x32_MI32x32x2x1_SE_1LDSB0_AMAS0_DTL0_EPS0_GRVW2_GSU1_IU1_LBSPP128_LPA2_LPB2_LRVW2_NEPBS0_NLCA1_NLCB1_ONLL1_PGR2_PLR17_SIA3_SS0_SU32_SUS128_SRVW2_SVW4_SNLL0_TT1_32_TLDS1_USFGROn1_VW1_WSGRA1_WSGRB1_WG64_4_1_WGM1
    SolutionIndex: 123
    SolutionNameMin: Cijk_Alik_Bljk_SB_MT128x64x16_MI32x32x2x1_SE_1LDSB0_AMAS0_DTL0_EPS0_GRVW1_GSU1_IU1_LBSPP128_LPA2_LPB2_LRVW2_NEPBS0_NLCA1_NLCB1_ONLL1_PGR2_PLR9_SIA3_SS0_SU0_SUS256_SRVW2_SVW4_SNLL0_TT2_32_TLDS1_USFGROn1_VW1_WSGRA1_WSGRB1_WG64_4_1_WGM1
    SolutionIndex: 124
    SolutionNameMin: Cijk_Alik_Bljk_SB_MT64x64x32_MI32x32x2x1_SE_1LDSB0_AMAS0_DTL0_EPS0_GRVW1_GSU1_IU1_LBSPP128_LPA2_LPB2_LRVW2_NEPBS0_NLCA1_NLCB1_ONLL1_PGR2_PLR17_SIA3_SS0_SU32_SUS128_SRVW2_SVW4_SNLL0_TT1_32_TLDS1_USFGROn1_VW1_WSGRA1_WSGRB1_WG64_4_1_WGM2
    SolutionIndex: 125
    SolutionNameMin: Cijk_Alik_Bljk_SB_MT16x16x32_MI16x16x4x1_SE_1LDSB1_AMAS3_DTL0_EPS1_GRVW2_GSU1_IU1_LBSPP128_LPA2_LPB2_LRVW2_NEPBS0_NLCA1_NLCB1_ONLL1_PGR1_PLR9_SIA3_SS0_SU0_SUS256_SRVW0_SVW4_SNLL0_TT1_16_TLDS1_USFGROn1_VW2_WSGRA1_WSGRB1_WG16_4_1_WGM1
    SolutionIndex: 126
    SolutionNameMin: Cijk_Alik_Bljk_SB_MT64x128x16_MI32x32x2x1_SE_1LDSB0_AMAS0_DTL0_EPS0_GRVW1_GSU1_IU1_LBSPP128_LPA2_LPB2_LRVW2_NEPBS0_NLCA1_NLCB1_ONLL1_PGR2_PLR9_SIA3_SS0_SU32_SUS128_SRVW2_SVW4_SNLL0_TT1_64_TLDS1_USFGROn1_VW1_WSGRA1_WSGRB1_WG64_4_1_WGM15
    SolutionIndex: 127
    SolutionNameMin: Cijk_Alik_Bljk_SB_MT64x144x16_MI16x16x4x1_SE_1LDSB0_AMAS0_DTL0_EPS0_GRVW1_GSU1_IU1_LBSPP128_LPA2_LPB2_LRVW2_NEPBS0_NLCA1_NLCB1_ONLL1_PGR2_PLR5_SIA3_SS0_SU0_SUS256_SRVW2_SVW4_SNLL0_TT1_144_TLDS1_USFGROn1_VW1_WSGRA1_WSGRB1_WG64_4_1_WGM1
    SolutionIndex: 128
    SolutionNameMin: Cijk_Alik_Bljk_SB_MT64x144x32_MI16x16x4x1_SE_1LDSB1_AMAS0_DTL0_EPS1_GRVW1_GSU1_IU1_LBSPP128_LPA2_LPB2_LRVW2_NEPBS0_NLCA1_NLCB1_ONLL1_PGR1_PLR9_SIA3_SS0_SU0_SUS256_SRVW2_SVW4_SNLL0_TT1_144_TLDS1_USFGROn1_VW1_WSGRA1_WSGRB1_WG64_4_1_WGM2
    SolutionIndex: 129
    SolutionNameMin: Cijk_Alik_Bljk_SB_MT128x64x16_MI32x32x2x1_SE_1LDSB0_AMAS0_DTL0_EPS0_GRVW2_GSU1_IU1_LBSPP128_LPA2_LPB2_LRVW2_NEPBS0_NLCA1_NLCB1_ONLL1_PGR2_PLR9_SIA3_SS0_SU0_SUS256_SRVW2_SVW4_SNLL0_TT2_32_TLDS1_USFGROn1_VW1_WSGRA1_WSGRB1_WG64_4_1_WGM15
    SolutionIndex: 130
    SolutionNameMin: Cijk_Alik_Bljk_SB_MT64x144x32_MI16x16x4x1_SE_1LDSB1_AMAS0_DTL0_EPS0_GRVW1_GSU1_IU1_LBSPP128_LPA2_LPB2_LRVW2_NEPBS0_NLCA1_NLCB1_ONLL1_PGR2_PLR9_SIA3_SS0_SU32_SUS256_SRVW2_SVW4_SNLL0_TT1_144_TLDS1_USFGROn1_VW1_WSGRA1_WSGRB1_WG64_4_1_WGM2
    SolutionIndex: 131
    SolutionNameMin: Cijk_Alik_Bljk_SB_MT128x128x16_MI32x32x2x1_SE_1LDSB0_AMAS0_DTL0_EPS0_GRVW1_GSU1_IU1_LBSPP128_LPA2_LPB2_LRVW2_NEPBS0_NLCA1_NLCB1_ONLL1_PGR2_PLR9_SIA3_SS0_SU0_SUS256_SRVW2_SVW4_SNLL0_TT2_64_TLDS1_USFGROn1_VW1_WSGRA1_WSGRB1_WG64_4_1_WGM15
    SolutionIndex: 132
    SolutionNameMin: Cijk_Alik_Bljk_SB_MT64x128x32_MI32x32x2x1_SE_1LDSB1_AMAS0_DTL0_EPS0_GRVW1_GSU1_IU1_LBSPP128_LPA2_LPB2_LRVW2_NEPBS0_NLCA1_NLCB1_ONLL1_PGR2_PLR17_SIA3_SS0_SU0_SUS256_SRVW2_SVW4_SNLL0_TT1_64_TLDS1_USFGROn1_VW1_WSGRA1_WSGRB1_WG64_4_1_WGM1
    SolutionIndex: 133
    SolutionNameMin: Cijk_Alik_Bljk_SB_MT64x64x32_MI32x32x2x1_SE_1LDSB1_AMAS0_DTL0_EPS1_GRVW1_GSU1_IU1_LBSPP128_LPA2_LPB2_LRVW2_NEPBS0_NLCA1_NLCB1_ONLL1_PGR1_PLR17_SIA3_SS0_SU32_SUS256_SRVW2_SVW4_SNLL0_TT1_32_TLDS1_USFGROn1_VW1_WSGRA1_WSGRB1_WG64_4_1_WGM2
    SolutionIndex: 134
    SolutionNameMin: Cijk_Alik_Bljk_SB_MT32x64x32_MI16x16x4x1_SE_1LDSB0_AMAS0_DTL0_EPS0_GRVW1_GSU1_IU1_LBSPP128_LPA2_LPB2_LRVW2_NEPBS0_NLCA1_NLCB1_ONLL1_PGR2_PLR9_SIA3_SS0_SU32_SUS128_SRVW2_SVW4_SNLL0_TT1_32_TLDS1_USFGROn1_VW1_WSGRA1_WSGRB1_WG32_8_1_WGM1
    SolutionIndex: 135
    SolutionNameMin: Cijk_Alik_Bljk_SB_MT32x64x32_MI16x16x4x1_SE_1LDSB1_AMAS0_DTL0_EPS1_GRVW1_GSU1_IU1_LBSPP128_LPA2_LPB2_LRVW2_NEPBS0_NLCA1_NLCB1_ONLL1_PGR1_PLR9_SIA3_SS0_SU32_SUS256_SRVW2_SVW4_SNLL0_TT1_32_TLDS1_USFGROn1_VW1_WSGRA1_WSGRB1_WG32_8_1_WGM15
    SolutionIndex: 136
    SolutionNameMin: Cijk_Alik_Bljk_SB_MT64x128x32_MI32x32x2x1_SE_1LDSB1_AMAS0_DTL0_EPS0_GRVW1_GSU1_IU1_LBSPP128_LPA2_LPB2_LRVW2_NEPBS0_NLCA1_NLCB1_ONLL1_PGR2_PLR17_SIA3_SS0_SU32_SUS128_SRVW2_SVW4_SNLL0_TT1_64_TLDS1_USFGROn1_VW1_WSGRA1_WSGRB1_WG64_4_1_WGM1
    SolutionIndex: 137
    SolutionNameMin: Cijk_Alik_Bljk_SB_MT128x144x16_MI16x16x4x1_SE_1LDSB1_AMAS0_DTL0_EPS1_GRVW1_GSU1_IU1_LBSPP128_LPA2_LPB2_LRVW2_NEPBS0_NLCA1_NLCB1_ONLL1_PGR1_PLR5_SIA3_SS0_SU32_SUS128_SRVW2_SVW4_SNLL0_TT2_144_TLDS1_USFGROn1_VW1_WSGRA1_WSGRB1_WG64_4_1_WGM15
    SolutionIndex: 138
    SolutionNameMin: Cijk_Alik_Bljk_SB_MT128x160x16_MI32x32x2x1_SE_1LDSB1_AMAS0_DTL0_EPS1_GRVW1_GSU1_IU1_LBSPP128_LPA2_LPB2_LRVW2_NEPBS0_NLCA1_NLCB1_ONLL1_PGR1_PLR9_SIA3_SS0_SU32_SUS128_SRVW2_SVW4_SNLL0_TT1_160_TLDS1_USFGROn1_VW1_WSGRA1_WSGRB1_WG128_2_1_WGM1
    SolutionIndex: 139
    SolutionNameMin: Cijk_Alik_Bljk_SB_MT64x144x16_MI16x16x4x1_SE_1LDSB0_AMAS0_DTL0_EPS0_GRVW1_GSU1_IU1_LBSPP128_LPA2_LPB2_LRVW2_NEPBS0_NLCA1_NLCB1_ONLL1_PGR2_PLR5_SIA3_SS0_SU0_SUS256_SRVW2_SVW4_SNLL0_TT1_144_TLDS1_USFGROn1_VW1_WSGRA1_WSGRB1_WG64_4_1_WGM15
    SolutionIndex: 140
    SolutionNameMin: Cijk_Alik_Bljk_SB_MT128x128x16_MI32x32x2x1_SE_1LDSB1_AMAS0_DTL0_EPS1_GRVW1_GSU1_IU1_LBSPP128_LPA2_LPB2_LRVW2_NEPBS0_NLCA1_NLCB1_ONLL1_PGR1_PLR9_SIA3_SS0_SU32_SUS256_SRVW2_SVW4_SNLL0_TT2_64_TLDS1_USFGROn1_VW1_WSGRA1_WSGRB1_WG64_4_1_WGM2
    SolutionIndex: 141
    SolutionNameMin: Cijk_Alik_Bljk_SB_MT64x32x32_MI16x16x4x1_SE_1LDSB1_AMAS0_DTL0_EPS1_GRVW2_GSU1_IU1_LBSPP128_LPA2_LPB2_LRVW2_NEPBS0_NLCA1_NLCB1_ONLL1_PGR1_PLR9_SIA3_SS0_SU32_SUS256_SRVW2_SVW4_SNLL0_TT2_16_TLDS1_USFGROn1_VW1_WSGRA1_WSGRB1_WG32_8_1_WGM15
    SolutionIndex: 142
    SolutionNameMin: Cijk_Alik_Bljk_SB_MT128x144x16_MI16x16x4x1_SE_1LDSB1_AMAS0_DTL0_EPS0_GRVW1_GSU1_IU1_LBSPP128_LPA2_LPB2_LRVW2_NEPBS0_NLCA1_NLCB1_ONLL1_PGR2_PLR5_SIA3_SS0_SU0_SUS256_SRVW2_SVW4_SNLL0_TT2_144_TLDS1_USFGROn1_VW1_WSGRA1_WSGRB1_WG64_4_1_WGM15
    SolutionIndex: 143
    SolutionNameMin: Cijk_Alik_Bljk_SB_MT128x160x16_MI32x32x2x1_SE_1LDSB1_AMAS0_DTL0_EPS1_GRVW1_GSU1_IU1_LBSPP128_LPA2_LPB2_LRVW2_NEPBS0_NLCA1_NLCB1_ONLL1_PGR1_PLR9_SIA3_SS0_SU0_SUS256_SRVW2_SVW4_SNLL0_TT1_160_TLDS1_USFGROn1_VW1_WSGRA1_WSGRB1_WG128_2_1_WGM15
    SolutionIndex: 144
    SolutionNameMin: Cijk_Alik_Bljk_SB_MT128x96x16_MI32x32x2x1_SE_1LDSB1_AMAS0_DTL0_EPS0_GRVW1_GSU1_IU1_LBSPP128_LPA2_LPB2_LRVW2_NEPBS0_NLCA1_NLCB1_ONLL1_PGR2_PLR9_SIA3_SS0_SU32_SUS128_SRVW2_SVW4_SNLL0_TT1_96_TLDS1_USFGROn1_VW1_WSGRA1_WSGRB1_WG128_2_1_WGM15
    SolutionIndex: 145
    SolutionNameMin: Cijk_Alik_Bljk_SB_MT96x128x16_MI32x32x2x1_SE_1LDSB0_AMAS0_DTL0_EPS0_GRVW1_GSU1_IU1_LBSPP128_LPA2_LPB2_LRVW2_NEPBS0_NLCA1_NLCB1_ONLL1_PGR2_PLR9_SIA3_SS0_SU0_SUS256_SRVW0_SVW4_SNLL0_TT3_32_TLDS1_USFGROn1_VW1_WSGRA1_WSGRB1_WG32_8_1_WGM15
    SolutionIndex: 146
    SolutionNameMin: Cijk_Alik_Bljk_SB_MT128x128x16_MI32x32x2x1_SE_1LDSB1_AMAS0_DTL0_EPS0_GRVW2_GSU1_IU1_LBSPP128_LPA2_LPB2_LRVW2_NEPBS0_NLCA1_NLCB1_ONLL1_PGR2_PLR9_SIA3_SS0_SU32_SUS256_SRVW2_SVW4_SNLL0_TT2_64_TLDS1_USFGROn1_VW1_WSGRA1_WSGRB1_WG64_4_1_WGM15
    SolutionIndex: 147
    SolutionNameMin: Cijk_Alik_Bljk_SB_MT64x32x16_MI16x16x4x1_SE_1LDSB1_AMAS0_DTL0_EPS1_GRVW1_GSU1_IU1_LBSPP128_LPA2_LPB2_LRVW2_NEPBS0_NLCA1_NLCB1_ONLL1_PGR1_PLR5_SIA3_SS0_SU0_SUS256_SRVW2_SVW4_SNLL0_TT2_16_TLDS1_USFGROn1_VW1_WSGRA1_WSGRB1_WG32_8_1_WGM1
    SolutionIndex: 148
    SolutionNameMin: Cijk_Alik_Bljk_SB_MT64x128x16_MI32x32x2x1_SE_1LDSB1_AMAS0_DTL0_EPS0_GRVW2_GSU1_IU1_LBSPP128_LPA2_LPB2_LRVW2_NEPBS0_NLCA1_NLCB1_ONLL1_PGR2_PLR9_SIA3_SS0_SU0_SUS256_SRVW2_SVW4_SNLL0_TT1_64_TLDS1_USFGROn1_VW1_WSGRA1_WSGRB1_WG64_4_1_WGM15
    SolutionIndex: 149
    SolutionNameMin: Cijk_Alik_Bljk_SB_MT64x64x32_MI32x32x2x1_SE_1LDSB1_AMAS0_DTL0_EPS1_GRVW1_GSU1_IU1_LBSPP128_LPA2_LPB2_LRVW2_NEPBS0_NLCA1_NLCB1_ONLL1_PGR1_PLR17_SIA3_SS0_SU32_SUS128_SRVW2_SVW4_SNLL0_TT1_32_TLDS1_USFGROn1_VW1_WSGRA1_WSGRB1_WG64_4_1_WGM15
    SolutionIndex: 150
    SolutionNameMin: Cijk_Alik_Bljk_SB_MT64x128x32_MI32x32x2x1_SE_1LDSB1_AMAS0_DTL0_EPS1_GRVW1_GSU1_IU1_LBSPP128_LPA2_LPB2_LRVW2_NEPBS0_NLCA1_NLCB1_ONLL1_PGR1_PLR17_SIA3_SS0_SU0_SUS256_SRVW2_SVW4_SNLL0_TT1_64_TLDS1_USFGROn1_VW1_WSGRA1_WSGRB1_WG64_4_1_WGM2
    SolutionIndex: 151
    SolutionNameMin: Cijk_Alik_Bljk_SB_MT64x64x32_MI32x32x2x1_SE_1LDSB0_AMAS0_DTL0_EPS0_GRVW1_GSU1_IU1_LBSPP128_LPA2_LPB2_LRVW2_NEPBS0_NLCA1_NLCB1_ONLL1_PGR2_PLR17_SIA3_SS0_SU32_SUS128_SRVW2_SVW4_SNLL0_TT1_32_TLDS1_USFGROn1_VW1_WSGRA1_WSGRB1_WG64_4_1_WGM15
    SolutionIndex: 152
    SolutionNameMin: Cijk_Alik_Bljk_SB_MT32x32x16_MI16x16x4x1_SE_1LDSB0_AMAS0_DTL0_EPS0_GRVW2_GSU1_IU1_LBSPP128_LPA2_LPB2_LRVW2_NEPBS0_NLCA1_NLCB1_ONLL1_PGR2_PLR5_SIA3_SS0_SU0_SUS256_SRVW2_SVW4_SNLL0_TT1_16_TLDS1_USFGROn1_VW1_WSGRA1_WSGRB1_WG32_8_1_WGM15
    SolutionIndex: 153
    SolutionNameMin: Cijk_Alik_Bljk_SB_MT32x64x16_MI16x16x4x1_SE_1LDSB1_AMAS0_DTL0_EPS1_GRVW4_GSU1_IU1_LBSPP128_LPA4_LPB4_LRVW2_NEPBS0_NLCA1_NLCB1_ONLL1_PGR1_PLR5_SIA3_SS0_SU0_SUS256_SRVW2_SVW4_SNLL0_TT1_32_TLDS1_USFGROn1_VW1_WSGRA1_WSGRB1_WG32_8_1_WGM15
    SolutionIndex: 154
    SolutionNameMin: Cijk_Alik_Bljk_SB_MT32x64x16_MI16x16x4x1_SN_1LDSB0_AMAS3_DTL0_EPS0_GRVW4_GSU1_IU1_LBSPP128_LPA4_LPB4_LRVW2_NEPBS1_NLCA1_NLCB1_ONLL1_PGR2_PLR5_SIA3_SS1_SU0_SUS256_SRVW0_SVW2_SNLL0_TT2_16_TLDS1_USFGROn1_VW2_WSGRA1_WSGRB1_WG16_16_1_WGM8
    SolutionIndex: 155
    SolutionNameMin: Cijk_Alik_Bljk_SB_MT64x128x16_MI32x32x2x1_SE_1LDSB0_AMAS0_DTL0_EPS1_GRVW4_GSU1_IU1_LBSPP128_LPA4_LPB4_LRVW2_NEPBS0_NLCA1_NLCB1_ONLL1_PGR1_PLR9_SIA3_SS0_SU0_SUS256_SRVW2_SVW4_SNLL0_TT1_64_TLDS1_USFGROn1_VW1_WSGRA1_WSGRB1_WG64_4_1_WGM1
    SolutionIndex: 156
    SolutionNameMin: Cijk_Alik_Bljk_SB_MT64x128x32_MI32x32x2x1_SE_1LDSB1_AMAS0_DTL0_EPS1_GRVW4_GSU1_IU1_LBSPP128_LPA4_LPB4_LRVW2_NEPBS0_NLCA1_NLCB1_ONLL1_PGR1_PLR17_SIA3_SS0_SU32_SUS128_SRVW2_SVW4_SNLL0_TT1_64_TLDS1_USFGROn1_VW1_WSGRA1_WSGRB1_WG64_4_1_WGM15
    SolutionIndex: 157
    SolutionNameMin: Cijk_Alik_Bljk_SB_MT96x128x16_MI32x32x2x1_SE_1LDSB0_AMAS0_DTL0_EPS0_GRVW2_GSU1_IU1_LBSPP128_LPA2_LPB2_LRVW2_NEPBS0_NLCA1_NLCB1_ONLL1_PGR2_PLR9_SIA3_SS0_SU32_SUS128_SRVW0_SVW4_SNLL0_TT3_32_TLDS1_USFGROn1_VW1_WSGRA1_WSGRB1_WG32_8_1_WGM15
    SolutionIndex: 158
    SolutionNameMin: Cijk_Alik_Bljk_SB_MT32x32x16_MI16x16x4x1_SE_1LDSB0_AMAS0_DTL0_EPS0_GRVW1_GSU1_IU1_LBSPP128_LPA2_LPB2_LRVW2_NEPBS0_NLCA1_NLCB1_ONLL1_PGR2_PLR5_SIA3_SS0_SU0_SUS256_SRVW2_SVW4_SNLL0_TT1_16_TLDS1_USFGROn1_VW1_WSGRA1_WSGRB1_WG32_8_1_WGM1
    SolutionIndex: 159
    SolutionNameMin: Cijk_Alik_Bljk_SB_MT64x128x32_MI32x32x2x1_SE_1LDSB1_AMAS0_DTL0_EPS1_GRVW4_GSU1_IU1_LBSPP128_LPA4_LPB4_LRVW2_NEPBS0_NLCA1_NLCB1_ONLL1_PGR1_PLR17_SIA3_SS0_SU0_SUS256_SRVW2_SVW4_SNLL0_TT1_64_TLDS1_USFGROn1_VW1_WSGRA1_WSGRB1_WG64_4_1_WGM1
    SolutionIndex: 162
    SolutionNameMin: Cijk_Alik_Bljk_SB_MT64x64x32_MI32x32x2x1_SE_1LDSB0_AMAS0_DTL0_EPS0_GRVW1_GSU1_IU1_LBSPP128_LPA2_LPB2_LRVW2_NEPBS0_NLCA1_NLCB1_ONLL1_PGR2_PLR17_SIA3_SS0_SU32_SUS256_SRVW2_SVW4_SNLL0_TT1_32_TLDS1_USFGROn1_VW1_WSGRA1_WSGRB1_WG64_4_1_WGM15
    SolutionIndex: 163
    SolutionNameMin: Cijk_Alik_Bljk_SB_MT128x64x32_MI32x32x2x1_SE_1LDSB1_AMAS0_DTL0_EPS1_GRVW2_GSU1_IU1_LBSPP128_LPA2_LPB2_LRVW2_NEPBS0_NLCA1_NLCB1_ONLL1_PGR1_PLR17_SIA3_SS0_SU0_SUS256_SRVW2_SVW4_SNLL0_TT2_32_TLDS1_USFGROn1_VW1_WSGRA1_WSGRB1_WG64_4_1_WGM1
    SolutionIndex: 164
    SolutionNameMin: Cijk_Alik_Bljk_SB_MT16x64x32_MI16x16x4x1_SE_1LDSB0_AMAS3_EPS0_GRVW4_GSU5_IU1_LBSPP128_LPA4_LPB4_LRVW2_PGR2_PLR9_SU0_SUS0_SVW4_TT1_16_TLDS1_VW2_WSGRA1_WSGRB1_WG16_16_1_WGM2
    SolutionIndex: 165
    SolutionNameMin: Cijk_Alik_Bljk_SB_MT16x16x32_MI16x16x4x1_SE_1LDSB0_AMAS3_EPS0_GRVW4_GSU5_IU1_LBSPP128_LPA4_LPB4_LRVW2_PGR2_PLR9_SU0_SUS0_SVW4_TT1_16_TLDS1_VW2_WSGRA1_WSGRB1_WG16_4_1_WGM1
    SolutionIndex: 166
    SolutionNameMin: Cijk_Alik_Bljk_SB_MT32x32x32_MI16x16x4x1_SE_1LDSB0_AMAS0_EPS0_GRVW4_GSU5_IU1_LBSPP128_LPA4_LPB4_LRVW2_PGR2_PLR9_SU0_SUS0_SVW4_TT1_16_TLDS1_VW1_WSGRA1_WSGRB1_WG32_8_1_WGM15
    SolutionIndex: 167
    SolutionNameMin: Cijk_Alik_Bljk_SB_MT16x16x32_MI16x16x4x1_SE_1LDSB0_AMAS3_EPS0_GRVW2_GSU5_IU1_LBSPP128_LPA2_LPB2_LRVW2_PGR2_PLR9_SU0_SUS0_SVW4_TT1_16_TLDS1_VW2_WSGRA1_WSGRB1_WG16_4_1_WGM2
    SolutionIndex: 168
    SolutionNameMin: Cijk_Alik_Bljk_SB_MT16x16x32_MI16x16x4x1_SE_1LDSB0_AMAS3_EPS1_GRVW4_GSU5_IU1_LBSPP128_LPA4_LPB4_LRVW2_PGR1_PLR9_SU32_SUS128_SVW4_TT1_16_TLDS1_VW2_WSGRA1_WSGRB1_WG16_4_1_WGM1
    SolutionIndex: 169
    SolutionNameMin: Cijk_Alik_Bljk_SB_MT16x16x32_MI16x16x4x1_SE_1LDSB0_AMAS3_EPS0_GRVW2_GSU5_IU1_LBSPP128_LPA2_LPB2_LRVW2_PGR2_PLR9_SU32_SUS256_SVW4_TT1_16_TLDS1_VW2_WSGRA1_WSGRB1_WG16_4_1_WGM1
    SolutionIndex: 170
    SolutionNameMin: Cijk_Alik_Bljk_SB_MT16x16x32_MI16x16x4x1_SE_1LDSB0_AMAS3_EPS0_GRVW4_GSU5_IU1_LBSPP128_LPA4_LPB4_LRVW2_PGR2_PLR9_SU32_SUS128_SVW4_TT1_16_TLDS1_VW2_WSGRA1_WSGRB1_WG16_4_1_WGM1
    SolutionIndex: 171
    SolutionNameMin: Cijk_Alik_Bljk_SB_MT16x16x32_MI16x16x4x1_SE_1LDSB1_AMAS3_EPS1_GRVW4_GSU5_IU1_LBSPP128_LPA4_LPB4_LRVW2_PGR1_PLR9_SU0_SUS0_SVW4_TT1_16_TLDS1_VW2_WSGRA1_WSGRB1_WG16_4_1_WGM15
    SolutionIndex: 172
    SolutionNameMin: Cijk_Alik_Bljk_SB_MT16x16x32_MI16x16x4x1_SE_1LDSB0_AMAS3_EPS0_GRVW2_GSU3_IU1_LBSPP128_LPA2_LPB2_LRVW2_PGR2_PLR9_SU0_SUS0_SVW4_TT1_16_TLDS1_VW2_WSGRA1_WSGRB1_WG16_4_1_WGM15
    SolutionIndex: 173
    SolutionNameMin: Cijk_Alik_Bljk_SB_MT16x16x32_MI16x16x4x1_SE_1LDSB0_AMAS3_EPS0_GRVW2_GSU5_IU1_LBSPP128_LPA2_LPB2_LRVW2_PGR2_PLR9_SU32_SUS128_SVW4_TT1_16_TLDS1_VW2_WSGRA1_WSGRB1_WG16_4_1_WGM1
    SolutionIndex: 175
    SolutionNameMin: Cijk_Alik_Bljk_SB_MT16x16x32_MI16x16x4x1_SE_1LDSB0_AMAS3_EPS0_GRVW4_GSU5_IU1_LBSPP128_LPA4_LPB4_LRVW2_PGR2_PLR9_SU0_SUS0_SVW4_TT1_16_TLDS1_VW2_WSGRA1_WSGRB1_WG16_4_1_WGM15
    SolutionIndex: 176
    SolutionNameMin: Cijk_Alik_Bljk_SB_MT32x32x32_MI16x16x4x1_SE_1LDSB0_AMAS0_EPS0_GRVW2_GSU5_IU1_LBSPP128_LPA2_LPB2_LRVW2_PGR2_PLR9_SU0_SUS0_SVW4_TT1_16_TLDS1_VW1_WSGRA1_WSGRB1_WG32_8_1_WGM2
    SolutionIndex: 177
    SolutionNameMin: Cijk_Alik_Bljk_SB_MT16x16x32_MI16x16x4x1_SE_1LDSB0_AMAS3_EPS0_GRVW4_GSU5_IU1_LBSPP128_LPA4_LPB4_LRVW2_PGR2_PLR9_SU32_SUS256_SVW4_TT1_16_TLDS1_VW2_WSGRA1_WSGRB1_WG16_4_1_WGM1
    SolutionIndex: 178
    SolutionNameMin: Cijk_Alik_Bljk_SB_MT32x32x32_MI16x16x4x1_SE_1LDSB0_AMAS0_EPS0_GRVW4_GSU5_IU1_LBSPP128_LPA4_LPB4_LRVW2_PGR2_PLR9_SU32_SUS128_SVW4_TT1_16_TLDS1_VW1_WSGRA1_WSGRB1_WG32_8_1_WGM1
    SolutionIndex: 179
    SolutionNameMin: Cijk_Alik_Bljk_SB_MT16x16x32_MI16x16x4x1_SE_1LDSB0_AMAS3_EPS0_GRVW2_GSU3_IU1_LBSPP128_LPA2_LPB2_LRVW2_PGR2_PLR9_SU0_SUS0_SVW4_TT1_16_TLDS1_VW2_WSGRA1_WSGRB1_WG16_4_1_WGM1
    SolutionIndex: 180
    SolutionNameMin: Cijk_Alik_Bljk_SB_MT32x32x32_MI16x16x4x1_SE_1LDSB0_AMAS0_EPS0_GRVW2_GSU5_IU1_LBSPP128_LPA2_LPB2_LRVW2_PGR2_PLR9_SU0_SUS0_SVW4_TT1_16_TLDS1_VW1_WSGRA1_WSGRB1_WG32_8_1_WGM1
    SolutionIndex: 181
    SolutionNameMin: Cijk_Alik_Bljk_SB_MT32x64x32_MI16x16x4x1_SE_1LDSB1_AMAS0_EPS0_GRVW2_GSU3_IU1_LBSPP128_LPA2_LPB2_LRVW2_PGR2_PLR9_SU32_SUS128_SVW4_TT1_32_TLDS1_VW1_WSGRA1_WSGRB1_WG32_8_1_WGM15
    SolutionIndex: 182
    SolutionNameMin: Cijk_Alik_Bljk_SB_MT64x32x32_MI16x16x4x1_SE_1LDSB0_AMAS0_EPS0_GRVW2_GSU5_IU1_LBSPP128_LPA2_LPB2_LRVW2_PGR2_PLR9_SU0_SUS0_SVW4_TT2_16_TLDS1_VW1_WSGRA1_WSGRB1_WG32_8_1_WGM15
    SolutionIndex: 183
    SolutionNameMin: Cijk_Alik_Bljk_SB_MT32x64x32_MI16x16x4x1_SE_1LDSB1_AMAS0_EPS0_GRVW2_GSU3_IU1_LBSPP128_LPA2_LPB2_LRVW2_PGR2_PLR9_SU32_SUS256_SVW4_TT1_32_TLDS1_VW1_WSGRA1_WSGRB1_WG32_8_1_WGM15
    SolutionIndex: 184
    SolutionNameMin: Cijk_Alik_Bljk_SB_MT128x128x32_MI32x32x2x1_SE_1LDSB1_AMAS0_EPS1_GRVW1_GSU3_IU1_LBSPP128_LPA2_LPB2_LRVW2_PGR1_PLR17_SU0_SUS0_SVW4_TT2_64_TLDS1_VW1_WSGRA1_WSGRB1_WG64_4_1_WGM1
    SolutionIndex: 185
    SolutionNameMin: Cijk_Alik_Bljk_SB_MT64x32x32_MI16x16x4x1_SE_1LDSB1_AMAS0_EPS0_GRVW4_GSU3_IU1_LBSPP128_LPA4_LPB4_LRVW2_PGR2_PLR9_SU32_SUS128_SVW4_TT2_16_TLDS1_VW1_WSGRA1_WSGRB1_WG32_8_1_WGM15
    SolutionIndex: 186
    SolutionNameMin: Cijk_Alik_Bljk_SB_MT32x64x32_MI16x16x4x1_SE_1LDSB0_AMAS0_EPS0_GRVW2_GSU3_IU1_LBSPP128_LPA2_LPB2_LRVW2_PGR2_PLR9_SU32_SUS256_SVW4_TT1_32_TLDS1_VW1_WSGRA1_WSGRB1_WG32_8_1_WGM15
    SolutionIndex: 187
    SolutionNameMin: Cijk_Alik_Bljk_SB_MT16x64x32_MI16x16x4x1_SE_1LDSB0_AMAS3_EPS0_GRVW4_GSU5_IU1_LBSPP128_LPA4_LPB4_LRVW2_PGR2_PLR9_SU0_SUS0_SVW4_TT1_16_TLDS1_VW2_WSGRA1_WSGRB1_WG16_16_1_WGM1
    SolutionIndex: 188
    SolutionNameMin: Cijk_Alik_Bljk_SB_MT16x16x32_MI16x16x4x1_SE_1LDSB0_AMAS3_EPS0_GRVW4_GSU5_IU1_LBSPP128_LPA4_LPB4_LRVW2_PGR2_PLR9_SU0_SUS0_SVW4_TT1_16_TLDS1_VW2_WSGRA1_WSGRB1_WG16_4_1_WGM2
    SolutionIndex: 189
    SolutionNameMin: Cijk_Alik_Bljk_SB_MT64x32x32_MI16x16x4x1_SE_1LDSB0_AMAS0_EPS0_GRVW4_GSU3_IU1_LBSPP128_LPA4_LPB4_LRVW2_PGR2_PLR9_SU0_SUS0_SVW4_TT2_16_TLDS1_VW1_WSGRA1_WSGRB1_WG32_8_1_WGM2
    SolutionIndex: 190
    SolutionNameMin: Cijk_Alik_Bljk_SB_MT32x32x32_MI16x16x4x1_SE_1LDSB0_AMAS0_EPS0_GRVW1_GSU5_IU1_LBSPP128_LPA2_LPB2_LRVW2_PGR2_PLR9_SU0_SUS0_SVW4_TT1_16_TLDS1_VW1_WSGRA1_WSGRB1_WG32_8_1_WGM1
    SolutionIndex: 191
    SolutionNameMin: Cijk_Alik_Bljk_SB_MT64x32x32_MI16x16x4x1_SE_1LDSB0_AMAS0_EPS0_GRVW2_GSU3_IU1_LBSPP128_LPA2_LPB2_LRVW2_PGR2_PLR9_SU0_SUS0_SVW4_TT2_16_TLDS1_VW1_WSGRA1_WSGRB1_WG32_8_1_WGM2
    SolutionIndex: 192
    SolutionNameMin: Cijk_Alik_Bljk_SB_MT64x32x32_MI16x16x4x1_SE_1LDSB0_AMAS0_EPS0_GRVW1_GSU5_IU1_LBSPP128_LPA2_LPB2_LRVW2_PGR2_PLR9_SU0_SUS0_SVW4_TT2_16_TLDS1_VW1_WSGRA1_WSGRB1_WG32_8_1_WGM1
    SolutionIndex: 193
    SolutionNameMin: Cijk_Alik_Bljk_SB_MT32x32x32_MI16x16x4x1_SE_1LDSB0_AMAS0_EPS0_GRVW2_GSU2_IU1_LBSPP128_LPA2_LPB2_LRVW2_PGR2_PLR9_SU0_SUS0_SVW4_TT1_16_TLDS1_VW1_WSGRA1_WSGRB1_WG32_8_1_WGM1
    SolutionIndex: 194
    SolutionNameMin: Cijk_Alik_Bljk_SB_MT64x64x32_MI32x32x2x1_SE_1LDSB0_AMAS0_EPS0_GRVW2_GSU2_IU1_LBSPP128_LPA2_LPB2_LRVW2_PGR2_PLR17_SU0_SUS0_SVW4_TT1_32_TLDS1_VW1_WSGRA1_WSGRB1_WG64_4_1_WGM1
    SolutionIndex: 195
    SolutionNameMin: Cijk_Alik_Bljk_SB_MT64x64x32_MI32x32x2x1_SE_1LDSB0_AMAS0_EPS0_GRVW1_GSU2_IU1_LBSPP128_LPA2_LPB2_LRVW2_PGR2_PLR17_SU0_SUS0_SVW4_TT1_32_TLDS1_VW1_WSGRA1_WSGRB1_WG64_4_1_WGM2
    SolutionIndex: 196
    SolutionNameMin: Cijk_Alik_Bljk_SB_MT32x32x32_MI16x16x4x1_SE_1LDSB0_AMAS0_EPS0_GRVW1_GSU3_IU1_LBSPP128_LPA2_LPB2_LRVW2_PGR2_PLR9_SU0_SUS0_SVW4_TT1_16_TLDS1_VW1_WSGRA1_WSGRB1_WG32_8_1_WGM1
    SolutionIndex: 197
    SolutionNameMin: Cijk_Alik_Bljk_SB_MT64x32x32_MI16x16x4x1_SE_1LDSB0_AMAS0_EPS0_GRVW1_GSU3_IU1_LBSPP128_LPA2_LPB2_LRVW2_PGR2_PLR9_SU32_SUS128_SVW4_TT2_16_TLDS1_VW1_WSGRA1_WSGRB1_WG32_8_1_WGM2
    SolutionIndex: 198
    SolutionNameMin: Cijk_Alik_Bljk_SB_MT64x32x32_MI16x16x4x1_SE_1LDSB0_AMAS0_EPS0_GRVW1_GSU5_IU1_LBSPP128_LPA2_LPB2_LRVW2_PGR2_PLR9_SU32_SUS128_SVW4_TT2_16_TLDS1_VW1_WSGRA1_WSGRB1_WG32_8_1_WGM1
    SolutionIndex: 199
    SolutionNameMin: Cijk_Alik_Bljk_SB_MT64x64x32_MI32x32x2x1_SE_1LDSB0_AMAS0_EPS0_GRVW2_GSU3_IU1_LBSPP128_LPA2_LPB2_LRVW2_PGR2_PLR17_SU0_SUS0_SVW4_TT1_32_TLDS1_VW1_WSGRA1_WSGRB1_WG64_4_1_WGM1
    SolutionIndex: 200
    SolutionNameMin: Cijk_Alik_Bljk_SB_MT64x32x32_MI16x16x4x1_SE_1LDSB1_AMAS0_EPS0_GRVW4_GSU5_IU1_LBSPP128_LPA4_LPB4_LRVW2_PGR2_PLR9_SU32_SUS256_SVW4_TT2_16_TLDS1_VW1_WSGRA1_WSGRB1_WG32_8_1_WGM1
    SolutionIndex: 201
    SolutionNameMin: Cijk_Alik_Bljk_SB_MT64x64x32_MI32x32x2x1_SE_1LDSB0_AMAS0_EPS0_GRVW1_GSU2_IU1_LBSPP128_LPA2_LPB2_LRVW2_PGR2_PLR17_SU0_SUS0_SVW4_TT1_32_TLDS1_VW1_WSGRA1_WSGRB1_WG64_4_1_WGM15
    SolutionIndex: 204
    SolutionNameMin: Cijk_Alik_Bljk_SB_MT64x64x32_MI32x32x2x1_SE_1LDSB0_AMAS0_EPS0_GRVW1_GSU5_IU1_LBSPP128_LPA2_LPB2_LRVW2_PGR2_PLR17_SU32_SUS128_SVW4_TT1_32_TLDS1_VW1_WSGRA1_WSGRB1_WG64_4_1_WGM15
    SolutionIndex: 205
    SolutionNameMin: Cijk_Alik_Bljk_SB_MT32x64x32_MI16x16x4x1_SE_1LDSB0_AMAS0_EPS0_GRVW4_GSU3_IU1_LBSPP128_LPA4_LPB4_LRVW2_PGR2_PLR9_SU32_SUS256_SVW4_TT1_32_TLDS1_VW1_WSGRA1_WSGRB1_WG32_8_1_WGM15
    SolutionIndex: 209
    SolutionNameMin: Cijk_Alik_Bljk_SB_MT16x16x32_MI16x16x4x1_SE_1LDSB1_AMAS3_EPS1_GRVW4_GSU1_IU1_LBSPP128_LPA4_LPB4_LRVW2_NEPBS0_PGR1_PLR9_SS0_SU0_SUS0_SRVW0_SVW4_TT1_16_TLDS1_VW2_WSGRA1_WSGRB1_WG16_4_1_WGM15
    SolutionIndex: 211
    SolutionNameMin: Cijk_Alik_Bljk_SB_MT16x16x32_MI16x16x4x1_SE_1LDSB1_AMAS3_EPS1_GRVW4_GSU1_IU1_LBSPP128_LPA4_LPB4_LRVW2_NEPBS0_PGR1_PLR9_SS0_SU0_SUS0_SRVW0_SVW4_TT1_16_TLDS1_VW2_WSGRA1_WSGRB1_WG16_4_1_WGM1
    SolutionIndex: 220
    SolutionNameMin: Cijk_Alik_Bljk_SB_MT64x64x32_MI16x16x4x1_SN_GRVW4_LPA8_LPB8_LRVW4_MIAV1_PLR9_SU4_SUS128_TT2_32_WG32_8_1_WGM10
    SolutionIndex: 221
    SolutionNameMin: Cijk_Alik_Bljk_SB_MT64x48x32_MI16x16x4x1_SN_1LDSB0_EPS0_GRVW2_IU1_LBSPP128_LPA2_LPB2_PLR9_SIA3_SS0_SU0_SUS0_SVW4_TT1_48_TLDS1_VW2_WG64_4_1_WGM1
- - - [1024, 512, 1, 1600]
    - [0, 59.441]
  - - [2048, 512, 1, 100]
    - [1, 13.359]
  - - [1024, 4096, 1, 1024]
    - [2, 81.705]
  - - [4096, 4096, 1, 1024]
    - [3, 88.778]
  - - [1024, 4096, 1, 4096]
    - [4, 86.381]
  - - [30528, 4096, 1, 1024]
    - [15, 93.325]
  - - [1024, 2048, 1, 1024]
    - [6, 76.445]
  - - [4096, 2048, 1, 1024]
    - [7, 85.024]
  - - [1024, 2048, 1, 4096]
    - [8, 81.895]
  - - [30528, 2048, 1, 1024]
    - [2, 90.256]
  - - [30522, 320, 1, 768]
    - [2, 83.675]
  - - [3072, 4096, 1, 768]
    - [2, 87.839]
  - - [768, 4096, 1, 3072]
    - [8, 88.644]
  - - [768, 4096, 1, 768]
    - [9, 80.709]
  - - [30522, 160, 1, 768]
    - [10, 71.29]
  - - [30522, 640, 1, 768]
    - [11, 86.712]
  - - [768, 640, 1, 768]
    - [0, 49.742]
  - - [30522, 1280, 1, 768]
    - [11, 88.199]
  - - [768, 1280, 1, 768]
    - [32, 65.179]
  - - [1024, 3072, 1, 1024]
    - [6, 83.671]
  - - [1024, 512, 1, 1024]
    - [37, 47.626]
  - - [1024, 2048, 1, 3072]
    - [6, 81.327]
  - - [1024, 3072, 1, 3072]
    - [6, 88.535]
  - - [1024, 512, 1, 3072]
    - [0, 62.844]
  - - [3072, 2048, 1, 1024]
    - [2, 87.848]
  - - [3072, 3072, 1, 1024]
    - [12, 87.469]
  - - [3072, 512, 1, 1024]
    - [2, 66.926]
  - - [30522, 120, 1, 1024]
    - [10, 70.865]
  - - [30522, 20, 1, 1024]
    - [14, 26.677]
  - - [30522, 80, 1, 1024]
    - [10, 59.644]
  - - [30522, 160, 1, 1024]
    - [10, 80.979]
  - - [1024, 200, 1, 560]
    - [64, 14.692]
  - - [768, 320, 1, 768]
    - [56, 22.583]
  - - [768, 32, 1, 768]
    - [34, 2.8]
  - - [768, 64, 1, 768]
    - [34, 5.697]
  - - [1024, 80, 1, 1024]
    - [89, 11.648]
  - - [1024, 120, 1, 1024]
    - [0, 26.375]
  - - [1024, 20, 1, 1024]
    - [20, 2.868]
  - - [768, 16, 1, 768]
    - [21, 1.421]
  - - [1024, 4, 1, 1024]
    - [188, 0.626]
  - - [1024, 6, 1, 1024]
    - [188, 0.909]
  - - [128, 128, 512, 64]
    - [22, 30.821]
  - - [64, 128, 512, 128]
    - [23, 34.713]
  - - [64, 512, 64, 512]
    - [11, 56.071]
  - - [512, 512, 64, 64]
    - [2, 40.766]
  - - [256, 256, 192, 64]
    - [2, 36.076]
  - - [256, 256, 96, 64]
    - [1, 33.981]
  - - [128, 128, 384, 64]
    - [22, 30.966]
  - - [128, 128, 96, 64]
    - [10, 25.63]
  - - [512, 512, 16, 64]
    - [2, 34.368]
  - - [512, 512, 96, 64]
    - [2, 41.382]
  - - [512, 512, 128, 64]
    - [2, 42.151]
  - - [1024, 128, 1, 128]
    - [158, 3.03]
  - - [4, 704, 1, 1280]
    - [188, 0.532]
  - - [4, 1856, 1, 3328]
    - [179, 2.592]
  - - [1856, 448, 1, 3328]
    - [37, 75.45]
  - - [2944, 4288, 1, 1280]
    - [3, 88.321]
  - - [2368, 64, 1, 3328]
    - [26, 41.028]
  - - [1760, 32, 1, 1760]
    - [89, 10.951]
  - - [2368, 5888, 1, 256]
    - [9, 76.782]
  - - [5888, 1856, 1, 256]
    - [13, 72.086]
  - - [128, 64, 1, 256]
    - [18, 1.05]
  - - [512, 24000, 1, 1536]
    - [2, 89.405]
  - - [128, 6784, 1, 3328]
    - [28, 74.315]
  - - [5888, 1408, 1, 256]
    - [13, 69.308]
  - - [5888, 1856, 1, 3328]
    - [12, 91.434]
  - - [5056, 704, 1, 256]
    - [9, 64.265]
  - - [2048, 400, 1, 512]
    - [10, 56.09]
  - - [5888, 2944, 1, 3328]
    - [29, 92.24]
  - - [1856, 4288, 1, 256]
    - [30, 73.336]
  - - [1024, 5056, 1, 128]
    - [2, 55.306]
  - - [5056, 5056, 1, 3328]
    - [3, 92.425]
  - - [1408, 5888, 1, 1280]
    - [10, 85.565]
  - - [2368, 448, 1, 128]
    - [22, 17.911]
  - - [2368, 6784, 1, 128]
    - [31, 61.046]
  - - [1024, 3584, 1, 3328]
    - [111, 88.71]
  - - [512, 48000, 1, 2048]
    - [6, 91.64]
  - - [128, 448, 1, 1280]
    - [17, 9.766]
  - - [256, 4288, 1, 3328]
    - [32, 81.868]
  - - [5888, 1408, 1, 1280]
    - [10, 85.413]
  - - [704, 1856, 1, 3328]
    - [32, 73.049]
  - - [4, 1408, 1, 128]
    - [70, 0.143]
  - - [1024, 2368, 1, 256]
    - [22, 47.744]
  - - [64, 4, 1, 256]
    - [24, 0.033]
  - - [1408, 1856, 1, 1280]
    - [10, 75.803]
  - - [1408, 64, 1, 1280]
    - [81, 14.568]
  - - [448, 1024, 1, 1280]
    - [56, 43.258]
  - - [6144, 24000, 1, 2048]
    - [5, 95.339]
  - - [4096, 32, 1, 4096]
    - [50, 29.118]
  - - [256, 1408, 1, 3328]
    - [36, 64.128]
  - - [5056, 5056, 1, 1280]
    - [2, 91.613]
  - - [448, 5056, 1, 256]
    - [10, 61.343]
  - - [704, 1856, 1, 1280]
    - [37, 77.068]
  - - [128, 5056, 1, 128]
    - [31, 11.771]
  - - [2368, 128, 1, 256]
    - [0, 11.816]
  - - [1760, 6400, 1, 1760]
    - [2, 90.281]
  - - [1856, 1408, 1, 128]
    - [22, 33.954]
  - - [64, 5056, 1, 256]
    - [10, 28.939]
  - - [6784, 256, 1, 3328]
    - [65, 79.55]
  - - [6784, 4288, 1, 3328]
    - [86, 93.411]
  - - [4288, 448, 1, 256]
    - [10, 57.715]
  - - [64, 704, 1, 128]
    - [70, 1.094]
  - - [1856, 2368, 1, 3328]
    - [8, 87.901]
  - - [4288, 2944, 1, 1280]
    - [3, 88.16]
  - - [704, 5056, 1, 1280]
    - [6, 84.427]
  - - [2368, 704, 1, 3328]
    - [8, 82.303]
  - - [256, 5888, 1, 256]
    - [10, 54.858]
  - - [1856, 4288, 1, 3328]
    - [2, 89.509]
  - - [256, 2944, 1, 256]
    - [1, 23.253]
  - - [5888, 1024, 1, 256]
    - [2, 68.33]
  - - [448, 64, 1, 1280]
    - [21, 4.93]
  - - [3072, 64, 1, 1024]
    - [83, 24.275]
  - - [3584, 4, 1, 1280]
    - [68, 2.208]
  - - [16384, 3200, 1, 4096]
    - [4, 93.057]
  - - [2944, 64, 1, 256]
    - [56, 7.882]
  - - [128, 4, 1, 1280]
    - [190, 0.101]
  - - [1408, 2944, 1, 256]
    - [22, 68.026]
  - - [256, 1856, 1, 1280]
    - [0, 54.166]
  - - [6784, 5056, 1, 3328]
    - [5, 92.517]
  - - [5056, 5056, 1, 256]
    - [2, 77.748]
  - - [1408, 6784, 1, 128]
    - [2, 61.154]
  - - [64, 1024, 1, 1280]
    - [78, 10.755]
  - - [2944, 4, 1, 256]
    - [19, 0.519]
  - - [704, 5056, 1, 128]
    - [10, 51.331]
  - - [4, 2368, 1, 1280]
    - [19, 1.522]
  - - [2368, 2944, 1, 1280]
    - [2, 86.483]
  - - [128, 3584, 1, 1280]
    - [0, 51.787]
  - - [6784, 6784, 1, 1280]
    - [3, 91.97]
  - - [1408, 4288, 1, 1280]
    - [37, 84.375]
  - - [3584, 4288, 1, 1280]
    - [3, 88.237]
  - - [2368, 704, 1, 1280]
    - [10, 75.305]
  - - [5056, 4288, 1, 3328]
    - [3, 92.223]
  - - [3584, 2368, 1, 3328]
    - [7, 89.431]
  - - [64, 704, 1, 1280]
    - [81, 7.462]
  - - [4288, 256, 1, 256]
    - [10, 50.861]
  - - [2944, 128, 1, 128]
    - [47, 7.599]
  - - [6144, 32, 1, 2560]
    - [44, 41.927]
  - - [6784, 448, 1, 1280]
    - [37, 78.609]
  - - [1408, 2944, 1, 128]
    - [10, 52.9]
  - - [4288, 2944, 1, 256]
    - [9, 73.445]
  - - [5888, 704, 1, 1280]
    - [10, 81.72]
  - - [5056, 4, 1, 3328]
    - [25, 5.141]
  - - [1856, 64, 1, 1280]
    - [0, 17.613]
  - - [1760, 16, 1, 1760]
    - [172, 5.558]
  - - [448, 5888, 1, 128]
    - [10, 48.152]
  - - [5888, 64, 1, 3328]
    - [14, 60.913]
  - - [2944, 256, 1, 3328]
    - [27, 72.227]
  - - [1024, 64, 1, 128]
    - [70, 1.566]
  - - [5056, 2368, 1, 1280]
    - [11, 87.125]
  - - [448, 3584, 1, 1280]
    - [4, 75.24]
  - - [6784, 5888, 1, 256]
    - [2, 80.443]
  - - [704, 1024, 1, 128]
    - [10, 13.286]
  - - [704, 128, 1, 1280]
    - [24, 14.619]
  - - [4, 3584, 1, 128]
    - [24, 0.33]
  - - [1408, 448, 1, 1280]
    - [10, 67.258]
  - - [1024, 1408, 1, 256]
    - [10, 54.182]
  - - [2368, 2368, 1, 3328]
    - [2, 88.829]
  - - [1856, 6784, 1, 128]
    - [31, 60.882]
  - - [5056, 704, 1, 3328]
    - [8, 88.312]
  - - [1408, 1856, 1, 256]
    - [22, 49.345]
  - - [1408, 704, 1, 3328]
    - [37, 74.949]
  - - [2368, 5056, 1, 256]
    - [9, 75.977]
  - - [1408, 256, 1, 1280]
    - [50, 41.207]
  - - [3072, 128, 1, 1024]
    - [80, 39.422]
  - - [3584, 2368, 1, 1280]
    - [13, 86.756]
  - - [4288, 64, 1, 3328]
    - [46, 49.352]
  - - [2368, 4, 1, 1280]
    - [179, 1.568]
  - - [704, 5888, 1, 256]
    - [10, 67.072]
  - - [6784, 2944, 1, 128]
    - [2, 60.036]
  - - [2560, 1600, 1, 2560]
    - [2, 88.657]
  - - [4288, 6784, 1, 3328]
    - [2, 92.456]
  - - [2944, 256, 1, 256]
    - [37, 23.42]
  - - [2944, 6784, 1, 3328]
    - [12, 92.609]
  - - [704, 1408, 1, 3328]
    - [32, 74.403]
  - - [6144, 5984, 1, 2048]
    - [5, 92.627]
  - - [3584, 704, 1, 3328]
    - [52, 82.266]
  - - [2944, 256, 1, 128]
    - [1, 13.499]
  - - [6784, 4, 1, 1280]
    - [84, 3.67]
  - - [1024, 64, 1, 1280]
    - [21, 10.947]
  - - [2048, 1600, 1, 512]
    - [54, 74.345]
  - - [448, 4288, 1, 256]
    - [10, 42.861]
  - - [64, 3584, 1, 3328]
    - [16, 38.71]
  - - [1856, 4288, 1, 128]
    - [31, 57.892]
  - - [704, 2368, 1, 1280]
    - [6, 75.84]
  - - [1856, 2368, 1, 1280]
    - [8, 84.116]
  - - [2368, 128, 1, 3328]
    - [0, 54.969]
  - - [2944, 128, 1, 256]
    - [56, 13.908]
  - - [448, 1408, 1, 256]
    - [1, 20.771]
  - - [1856, 4288, 1, 1280]
    - [13, 86.701]
  - - [64, 5056, 1, 3328]
    - [122, 51.846]
  - - [4, 704, 1, 256]
    - [81, 0.132]
  - - [1024, 448, 1, 128]
    - [83, 8.95]
  - - [704, 4, 1, 1280]
    - [188, 0.54]
  - - [704, 256, 1, 128]
    - [152, 4.145]
  - - [704, 2944, 1, 128]
    - [22, 28.742]
  - - [1408, 1024, 1, 1280]
    - [37, 70.395]
  - - [704, 6784, 1, 256]
    - [10, 68.875]
  - - [6784, 704, 1, 256]
    - [54, 64.444]
  - - [5056, 1408, 1, 128]
    - [31, 55.568]
  - - [2048, 7000, 1, 2048]
    - [2, 92.065]
  - - [256, 3584, 1, 3328]
    - [51, 74.382]
  - - [4, 5888, 1, 3328]
    - [17, 5.409]
  - - [128, 1408, 1, 128]
    - [47, 4.189]
  - - [3584, 4288, 1, 3328]
    - [3, 90.315]
  - - [5888, 1856, 1, 1280]
    - [141, 86.869]
  - - [256, 1408, 1, 256]
    - [0, 13.166]
  - - [5056, 64, 1, 1280]
    - [60, 37.119]
  - - [1024, 704, 1, 256]
    - [22, 23.041]
  - - [448, 128, 1, 128]
    - [45, 1.384]
  - - [2368, 3584, 1, 1280]
    - [8, 86.926]
  - - [2368, 6784, 1, 1280]
    - [57, 88.779]
  - - [1856, 4, 1, 1280]
    - [179, 1.237]
  - - [448, 448, 1, 256]
    - [16, 8.359]
  - - [2944, 3584, 1, 3328]
    - [12, 91.267]
  - - [7680, 32, 1, 2560]
    - [14, 41.032]
  - - [128, 4288, 1, 128]
    - [83, 10.604]
  - - [256, 256, 1, 3328]
    - [34, 22.911]
  - - [128, 1024, 1, 3328]
    - [87, 30.595]
  - - [4, 1408, 1, 3328]
    - [188, 2.122]
  - - [6784, 2944, 1, 256]
    - [2, 75.879]
  - - [64, 1856, 1, 1280]
    - [0, 17.576]
  - - [6784, 64, 1, 128]
    - [1, 8.385]
  - - [4288, 2368, 1, 3328]
    - [8, 90.001]
  - - [1856, 2368, 1, 256]
    - [22, 60.199]
  - - [3584, 256, 1, 128]
    - [1, 16.192]
  - - [3584, 6784, 1, 3328]
    - [2, 93.946]
  - - [256, 1024, 1, 256]
    - [59, 10.229]
  - - [4, 6784, 1, 3328]
    - [78, 4.883]
  - - [1024, 5888, 1, 3328]
    - [12, 89.4]
  - - [1024, 128, 1, 1280]
    - [0, 19.15]
  - - [3072, 32, 1, 1024]
    - [78, 13.018]
  - - [6144, 24000, 1, 2560]
    - [5, 95.458]
  - - [5056, 4288, 1, 1280]
    - [3, 90.69]
  - - [5888, 64, 1, 256]
    - [0, 13.982]
  - - [6784, 1856, 1, 3328]
    - [2, 93.232]
  - - [1408, 5056, 1, 1280]
    - [2, 89.233]
  - - [1856, 256, 1, 1280]
    - [0, 52.708]
  - - [64, 5888, 1, 3328]
    - [60, 61.633]
  - - [2368, 2368, 1, 1280]
    - [10, 84.809]
  - - [2944, 5888, 1, 128]
    - [31, 61.8]
  - - [704, 5888, 1, 1280]
    - [32, 82.367]
  - - [2368, 3584, 1, 128]
    - [9, 57.937]
  - - [1856, 5056, 1, 128]
    - [61, 58.838]
  - - [704, 1024, 1, 1280]
    - [1, 61.515]
  - - [448, 256, 1, 3328]
    - [60, 27.281]
  - - [448, 1856, 1, 128]
    - [47, 14.608]
  - - [8192, 3200, 1, 2048]
    - [4, 90.027]
  - - [128, 1024, 1, 128]
    - [70, 3.015]
  - - [2944, 4, 1, 128]
    - [82, 0.273]
  - - [1024, 704, 1, 1280]
    - [63, 61.607]
  - - [128, 5888, 1, 256]
    - [22, 23.431]
  - - [1024, 5056, 1, 1280]
    - [37, 83.333]
  - - [4288, 1024, 1, 256]
    - [9, 66.743]
  - - [2944, 2368, 1, 128]
    - [2, 58.366]
  - - [704, 704, 1, 3328]
    - [64, 59.041]
  - - [704, 1408, 1, 1280]
    - [32, 69.476]
  - - [5888, 448, 1, 1280]
    - [37, 77.501]
  - - [3584, 256, 1, 3328]
    - [65, 74.382]
  - - [704, 5888, 1, 3328]
    - [4, 85.362]
  - - [704, 1856, 1, 128]
    - [10, 20.557]
  - - [448, 448, 1, 3328]
    - [37, 47.28]
  - - [4, 4288, 1, 128]
    - [70, 0.407]
  - - [128, 704, 1, 1280]
    - [78, 14.668]
  - - [3584, 2944, 1, 256]
    - [66, 73.553]
  - - [3584, 4, 1, 128]
    - [209, 0.328]
  - - [1856, 128, 1, 3328]
    - [16, 45.102]
  - - [4, 64, 1, 1280]
    - [188, 0.049]
  - - [2944, 448, 1, 128]
    - [83, 20.538]
  - - [128, 2944, 1, 1280]
    - [67, 56.756]
  - - [64, 64, 1, 3328]
    - [165, 1.846]
  - - [448, 2944, 1, 1280]
    - [32, 77.634]
  - - [512, 24000, 1, 2048]
    - [4, 89.803]
  - - [128, 256, 1, 3328]
    - [179, 11.296]
  - - [1408, 5056, 1, 3328]
    - [2, 91.947]
  - - [1856, 1856, 1, 3328]
    - [3, 84.631]
  - - [3584, 128, 1, 256]
    - [37, 16.177]
  - - [2560, 800, 1, 2560]
    - [138, 81.503]
  - - [448, 1408, 1, 3328]
    - [37, 72.777]
  - - [2368, 2368, 1, 256]
    - [9, 69.637]
  - - [4288, 4288, 1, 1280]
    - [2, 88.951]
  - - [64, 448, 1, 1280]
    - [34, 4.852]
  - - [5888, 1024, 1, 1280]
    - [2, 85.497]
  - - [1408, 4288, 1, 256]
    - [30, 71.148]
  - - [448, 4, 1, 256]
    - [21, 0.083]
  - - [5888, 448, 1, 128]
    - [94, 33.249]
  - - [512, 48000, 1, 2560]
    - [6, 93.324]
  - - [35, 8457, 1, 1760]
    - [70, 34.73]
  - - [704, 6784, 1, 3328]
    - [4, 88.02]
  - - [2560, 6400, 1, 2560]
    - [3, 90.126]
  - - [5056, 1024, 1, 1280]
    - [2, 85.427]
  - - [448, 5888, 1, 3328]
    - [32, 83.619]
  - - [128, 4, 1, 128]
    - [78, 0.012]
  - - [1024, 2944, 1, 1280]
    - [32, 76.988]
  - - [5056, 5888, 1, 1280]
    - [3, 91.353]
  - - [4288, 5888, 1, 128]
    - [31, 62.749]
  - - [256, 3584, 1, 256]
    - [10, 26.626]
  - - [1408, 3584, 1, 128]
    - [2, 55.658]
  - - [256, 2944, 1, 3328]
    - [27, 72.043]
  - - [448, 3584, 1, 128]
    - [10, 23.291]
  - - [5888, 2944, 1, 1280]
    - [3, 88.021]
  - - [4, 6784, 1, 1280]
    - [17, 5.183]
  - - [2368, 5888, 1, 128]
    - [9, 61.396]
  - - [8448, 16, 1, 2816]
    - [14, 22.541]
  - - [64, 2944, 1, 128]
    - [21, 4.223]
  - - [2368, 4, 1, 256]
    - [82, 0.409]
  - - [3584, 5888, 1, 256]
    - [71, 76.512]
  - - [2368, 1024, 1, 128]
    - [10, 46.47]
  - - [2368, 704, 1, 128]
    - [1, 42.178]
  - - [3584, 2944, 1, 1280]
    - [2, 88.402]
  - - [3584, 2368, 1, 128]
    - [31, 57.8]
  - - [5056, 704, 1, 128]
    - [1, 50.08]
  - - [448, 2368, 1, 128]
    - [10, 34.574]
  - - [5056, 1408, 1, 3328]
    - [2, 91.372]
  - - [1408, 704, 1, 256]
    - [10, 47.451]
  - - [6784, 1024, 1, 3328]
    - [49, 90.183]
  - - [6784, 2944, 1, 3328]
    - [12, 92.626]
  - - [2944, 5056, 1, 3328]
    - [12, 93.668]
  - - [1856, 1856, 1, 256]
    - [10, 66.126]
  - - [1024, 5888, 1, 128]
    - [2, 56.737]
  - - [6784, 2368, 1, 1280]
    - [2, 90.522]
  - - [256, 4, 1, 128]
    - [24, 0.074]
  - - [4288, 5888, 1, 1280]
    - [11, 89.316]
  - - [4288, 4288, 1, 256]
    - [2, 74.364]
  - - [8448, 32, 1, 2816]
    - [14, 45.561]
  - - [448, 2944, 1, 3328]
    - [32, 82.663]
  - - [5888, 4, 1, 128]
    - [24, 1.617]
  - - [4288, 1856, 1, 1280]
    - [2, 88.541]
  - - [1856, 2944, 1, 3328]
    - [10, 85.472]
  - - [256, 6784, 1, 3328]
    - [108, 78.715]
  - - [64, 5888, 1, 256]
    - [10, 31.276]
  - - [256, 5056, 1, 128]
    - [1, 20.831]
  - - [5056, 1024, 1, 256]
    - [9, 66.294]
  - - [704, 64, 1, 3328]
    - [193, 14.002]
  - - [5056, 1856, 1, 3328]
    - [8, 91.112]
  - - [4, 2944, 1, 3328]
    - [165, 3.368]
  - - [4, 5056, 1, 256]
    - [17, 2.181]
  - - [1856, 1408, 1, 256]
    - [22, 49.857]
  - - [8448, 12000, 1, 2816]
    - [3, 95.497]
  - - [6784, 128, 1, 3328]
    - [65, 74.798]
  - - [4288, 1408, 1, 128]
    - [9, 55.019]
  - - [1856, 5888, 1, 3328]
    - [28, 92.001]
  - - [4288, 5056, 1, 256]
    - [2, 75.775]
  - - [1408, 128, 1, 1280]
    - [50, 25.643]
  - - [4096, 800, 1, 1024]
    - [37, 76.779]
  - - [5056, 256, 1, 3328]
    - [37, 80.516]
  - - [704, 704, 1, 256]
    - [22, 17.666]
  - - [1024, 5888, 1, 1280]
    - [37, 84.153]
  - - [6784, 2368, 1, 128]
    - [2, 60.057]
  - - [4, 5056, 1, 1280]
    - [70, 4.487]
  - - [256, 64, 1, 1280]
    - [24, 4.922]
  - - [128, 1856, 1, 1280]
    - [0, 41.153]
  - - [1856, 1024, 1, 1280]
    - [37, 69.567]
  - - [6784, 4288, 1, 1280]
    - [2, 92.307]
  - - [2560, 64, 1, 2560]
    - [87, 34.783]
  - - [1856, 1856, 1, 1280]
    - [37, 79.658]
  - - [4096, 400, 1, 1024]
    - [10, 71.803]
  - - [3072, 24000, 1, 1024]
    - [15, 93.408]
  - - [128, 4288, 1, 3328]
    - [32, 64.513]
  - - [4, 2368, 1, 3328]
    - [179, 3.056]
  - - [5888, 1856, 1, 128]
    - [31, 57.887]
  - - [448, 704, 1, 1280]
    - [0, 53.51]
  - - [128, 5056, 1, 1280]
    - [10, 68.374]
  - - [1024, 448, 1, 3328]
    - [0, 55.984]
  - - [1856, 704, 1, 1280]
    - [37, 64.793]
  - - [5056, 3584, 1, 128]
    - [31, 60.143]
  - - [5888, 5888, 1, 3328]
    - [3, 93.261]
  - - [6784, 1024, 1, 256]
    - [2, 70.179]
  - - [2944, 2368, 1, 256]
    - [9, 71.747]
  - - [256, 448, 1, 256]
    - [45, 12.972]
  - - [5056, 5888, 1, 3328]
    - [3, 93.361]
  - - [1856, 1024, 1, 256]
    - [22, 43.799]
  - - [512, 48000, 1, 1536]
    - [6, 90.528]
  - - [3584, 448, 1, 1280]
    - [2, 74.156]
  - - [8448, 5984, 1, 2816]
    - [5, 93.534]
  - - [448, 5888, 1, 256]
    - [13, 63.269]
  - - [704, 64, 1, 128]
    - [0, 3.209]
  - - [1408, 6784, 1, 3328]
    - [4, 90.293]
  - - [448, 1024, 1, 128]
    - [0, 23.627]
  - - [4288, 704, 1, 128]
    - [31, 47.839]
  - - [128, 1856, 1, 128]
    - [43, 13.842]
  - - [448, 2368, 1, 3328]
    - [32, 79.317]
  - - [5056, 64, 1, 128]
    - [50, 6.772]
  - - [5056, 2944, 1, 256]
    - [2, 73.702]
  - - [6784, 5888, 1, 128]
    - [2, 62.461]
  - - [1024, 700, 1, 512]
    - [1, 51.047]
  - - [704, 1024, 1, 256]
    - [10, 42.434]
  - - [1024, 4, 1, 256]
    - [82, 0.186]
  - - [2944, 704, 1, 128]
    - [10, 43.793]
  - - [128, 6784, 1, 1280]
    - [139, 56.099]
  - - [1408, 3584, 1, 3328]
    - [38, 91.956]
  - - [2368, 6784, 1, 256]
    - [66, 76.364]
  - - [5056, 1408, 1, 1280]
    - [2, 88.464]
  - - [256, 256, 1, 128]
    - [48, 4.725]
  - - [5056, 4288, 1, 128]
    - [31, 60.416]
  - - [1408, 1856, 1, 128]
    - [10, 33.918]
  - - [1408, 5888, 1, 3328]
    - [8, 88.529]
  - - [1856, 256, 1, 256]
    - [10, 34.915]
  - - [6784, 6784, 1, 256]
    - [2, 81.334]
  - - [64, 256, 1, 128]
    - [37, 0.407]
  - - [4288, 2368, 1, 128]
    - [31, 58.927]
  - - [256, 4288, 1, 1280]
    - [32, 75.744]
  - - [2368, 2944, 1, 256]
    - [30, 71.492]
  - - [4, 1856, 1, 256]
    - [78, 0.33]
  - - [3584, 1856, 1, 1280]
    - [2, 88.084]
  - - [6784, 6784, 1, 128]
    - [2, 62.51]
  - - [256, 1856, 1, 128]
    - [1, 9.347]
  - - [704, 64, 1, 1280]
    - [21, 13.127]
  - - [5888, 5056, 1, 256]
    - [2, 79.162]
  - - [8448, 48000, 1, 2816]
    - [15, 96.72]
  - - [3584, 448, 1, 256]
    - [10, 54.482]
  - - [448, 4288, 1, 128]
    - [10, 44.326]
  - - [7680, 64, 1, 2560]
    - [10, 53.903]
  - - [256, 6784, 1, 256]
    - [10, 57.41]
  - - [1408, 4288, 1, 128]
    - [2, 58.045]
  - - [2944, 704, 1, 3328]
    - [8, 80.572]
  - - [128, 448, 1, 256]
    - [0, 7.114]
  - - [5056, 256, 1, 1280]
    - [22, 63.823]
  - - [2560, 32, 1, 2560]
    - [53, 26.108]
  - - [3584, 3584, 1, 256]
    - [9, 74.769]
  - - [448, 1408, 1, 128]
    - [1, 12.309]
  - - [128, 256, 1, 1280]
    - [21, 9.794]
  - - [3584, 5056, 1, 256]
    - [9, 76.41]
  - - [6784, 128, 1, 256]
    - [10, 46.814]
  - - [4288, 4, 1, 256]
    - [18, 1.849]
  - - [704, 448, 1, 256]
    - [10, 29.582]
  - - [2944, 2368, 1, 1280]
    - [2, 87.12]
  - - [448, 64, 1, 3328]
    - [172, 10.123]
  - - [1408, 3584, 1, 256]
    - [22, 69.226]
  - - [3584, 4, 1, 3328]
    - [25, 4.344]
  - - [6784, 3584, 1, 256]
    - [2, 77.126]
  - - [256, 128, 1, 128]
    - [70, 0.842]
  - - [704, 1408, 1, 128]
    - [10, 35.514]
  - - [4, 2368, 1, 256]
    - [70, 0.42]
  - - [4288, 128, 1, 1280]
    - [37, 48.266]
  - - [128, 1408, 1, 256]
    - [56, 7.806]
  - - [4, 2944, 1, 256]
    - [70, 0.521]
  - - [64, 128, 1, 3328]
    - [165, 3.614]
  - - [5056, 2368, 1, 128]
    - [31, 59.333]
  - - [2944, 2944, 1, 3328]
    - [2, 89.94]
  - - [5056, 6784, 1, 256]
    - [33, 78.938]
  - - [1856, 3584, 1, 128]
    - [10, 57.015]
  - - [128, 2944, 1, 128]
    - [10, 21.104]
  - - [35, 8457, 1, 2560]
    - [10, 33.512]
  - - [1024, 704, 1, 3328]
    - [27, 69.086]
  - - [6784, 448, 1, 256]
    - [10, 60.875]
  - - [3584, 6784, 1, 128]
    - [31, 63.092]
  - - [128, 4288, 1, 256]
    - [10, 39.088]
  - - [704, 448, 1, 3328]
    - [0, 59.128]
  - - [128, 128, 1, 3328]
    - [170, 6.251]
  - - [5056, 1856, 1, 256]
    - [9, 70.852]
  - - [4608, 5984, 1, 1536]
    - [2, 91.375]
  - - [256, 128, 1, 256]
    - [48, 1.478]
  - - [1760, 3200, 1, 1760]
    - [32, 88.475]
  - - [1024, 1856, 1, 256]
    - [10, 58.315]
  - - [4096, 1600, 1, 1024]
    - [11, 83.499]
  - - [4288, 64, 1, 128]
    - [0, 15.222]
  - - [256, 448, 1, 3328]
    - [50, 28.023]
  - - [1408, 6784, 1, 1280]
    - [2, 87.752]
  - - [3584, 3584, 1, 1280]
    - [2, 87.809]
  - - [7680, 24000, 1, 2560]
    - [5, 95.635]
  - - [64, 2368, 1, 1280]
    - [56, 21.573]
  - - [448, 2368, 1, 1280]
    - [32, 73.73]
  - - [4608, 48000, 1, 1536]
    - [15, 95.597]
  - - [5888, 5888, 1, 128]
    - [31, 61.953]
  - - [64, 6784, 1, 3328]
    - [60, 68.835]
  - - [2944, 256, 1, 1280]
    - [74, 65.18]
  - - [2048, 16, 1, 2048]
    - [17, 10.429]
  - - [256, 2368, 1, 128]
    - [10, 28.202]
  - - [5056, 2368, 1, 3328]
    - [8, 90.685]
  - - [2944, 4288, 1, 256]
    - [9, 76.412]
  - - [1408, 3584, 1, 1280]
    - [28, 86.301]
  - - [2368, 64, 1, 256]
    - [56, 15.896]
  - - [64, 448, 1, 3328]
    - [179, 10.091]
  - - [704, 128, 1, 3328]
    - [75, 31.651]
  - - [8192, 1600, 1, 2048]
    - [2, 89.102]
  - - [1856, 704, 1, 256]
    - [10, 54.42]
  - - [4, 4288, 1, 1280]
    - [18, 4.175]
  - - [1408, 448, 1, 3328]
    - [37, 74.142]
  - - [1024, 4, 1, 3328]
    - [167, 1.629]
  - - [512, 24000, 1, 2560]
    - [2, 90.812]
  - - [2368, 6784, 1, 3328]
    - [4, 92.7]
  - - [1856, 1408, 1, 1280]
    - [37, 76.691]
  - - [1856, 448, 1, 1280]
    - [37, 69.919]
  - - [6784, 704, 1, 128]
    - [76, 50.0]
  - - [4, 4, 1, 256]
    - [21, 0.002]
  - - [128, 5888, 1, 128]
    - [10, 31.276]
  - - [1408, 5888, 1, 256]
    - [30, 73.291]
  - - [704, 2944, 1, 1280]
    - [32, 76.541]
  - - [4288, 64, 1, 1280]
    - [16, 33.955]
  - - [256, 64, 1, 256]
    - [34, 0.75]
  - - [704, 1856, 1, 256]
    - [54, 53.267]
  - - [704, 6784, 1, 128]
    - [10, 53.704]
  - - [3584, 704, 1, 1280]
    - [2, 78.377]
  - - [256, 128, 1, 1280]
    - [17, 9.794]
  - - [5888, 2368, 1, 256]
    - [2, 73.484]
  - - [256, 2368, 1, 1280]
    - [10, 64.638]
  - - [2944, 6784, 1, 128]
    - [9, 62.478]
  - - [3584, 448, 1, 3328]
    - [2, 79.059]
  - - [1408, 4, 1, 256]
    - [47, 0.244]
  - - [704, 2368, 1, 3328]
    - [6, 83.553]
  - - [2944, 448, 1, 256]
    - [10, 35.456]
  - - [1856, 448, 1, 128]
    - [56, 14.49]
  - - [4288, 4, 1, 3328]
    - [21, 4.738]
  - - [2368, 128, 1, 1280]
    - [16, 49.672]
  - - [256, 5888, 1, 128]
    - [10, 40.069]
  - - [64, 6784, 1, 256]
    - [54, 34.309]
  - - [64, 5056, 1, 1280]
    - [50, 36.979]
  - - [4, 6784, 1, 128]
    - [17, 1.701]
  - - [2048, 3200, 1, 512]
    - [31, 80.051]
  - - [2944, 2944, 1, 1280]
    - [3, 86.784]
  - - [5056, 448, 1, 3328]
    - [37, 79.262]
  - - [4, 3584, 1, 1280]
    - [17, 3.759]
  - - [1408, 128, 1, 128]
    - [0, 11.949]
  - - [6784, 704, 1, 3328]
    - [2, 86.199]
  - - [128, 64, 1, 1280]
    - [18, 2.514]
  - - [2368, 256, 1, 1280]
    - [10, 64.638]
  - - [4, 448, 1, 3328]
    - [165, 0.768]
  - - [5888, 4288, 1, 128]
    - [2, 61.219]
  - - [4, 5888, 1, 256]
    - [78, 2.493]
  - - [1408, 2944, 1, 3328]
    - [2, 91.465]
  - - [3584, 704, 1, 128]
    - [22, 32.356]
  - - [4608, 12000, 1, 1536]
    - [5, 93.71]
  - - [64, 1024, 1, 256]
    - [0, 8.043]
  - - [5056, 5056, 1, 128]
    - [31, 61.035]
  - - [2368, 448, 1, 1280]
    - [37, 73.288]
  - - [128, 3584, 1, 256]
    - [10, 33.498]
  - - [704, 448, 1, 1280]
    - [87, 37.92]
  - - [8192, 800, 1, 2048]
    - [141, 85.198]
  - - [448, 5056, 1, 128]
    - [10, 47.0]
  - - [256, 4, 1, 1280]
    - [175, 0.203]
  - - [5056, 3584, 1, 256]
    - [13, 74.424]
  - - [2368, 4, 1, 3328]
    - [172, 3.063]
  - - [1408, 5056, 1, 128]
    - [2, 60.747]
  - - [2944, 3584, 1, 128]
    - [2, 60.744]
  - - [3584, 2368, 1, 256]
    - [9, 72.852]
  - - [128, 3584, 1, 3328]
    - [0, 53.795]
  - - [128, 1024, 1, 1280]
    - [0, 19.213]
  - - [8448, 24000, 1, 2816]
    - [5, 95.963]
  - - [64, 704, 1, 256]
    - [0, 5.65]
  - - [4288, 256, 1, 1280]
    - [10, 74.849]
  - - [3584, 3584, 1, 3328]
    - [28, 91.721]
  - - [4, 704, 1, 128]
    - [21, 0.206]
  - - [5888, 6784, 1, 256]
    - [2, 80.756]
  - - [4288, 2944, 1, 3328]
    - [3, 90.734]
  - - [2944, 64, 1, 128]
    - [0, 12.351]
  - - [1024, 128, 1, 3328]
    - [50, 31.257]
  - - [1024, 16, 1, 500000]
    - [168, 12.952]
  - - [4288, 128, 1, 3328]
    - [10, 61.853]
  - - [7680, 128, 1, 2560]
    - [10, 68.693]
  - - [256, 5056, 1, 1280]
    - [32, 76.188]
  - - [1408, 256, 1, 128]
    - [16, 19.615]
  - - [2944, 5888, 1, 3328]
    - [12, 92.87]
  - - [6784, 5888, 1, 1280]
    - [2, 92.466]
  - - [2048, 800, 1, 512]
    - [10, 65.747]
  - - [704, 128, 1, 256]
    - [0, 10.609]
  - - [5888, 4288, 1, 1280]
    - [3, 89.543]
  - - [1024, 24000, 1, 2048]
    - [3, 92.176]
  - - [448, 256, 1, 1280]
    - [56, 17.349]
  - - [5888, 3584, 1, 128]
    - [31, 60.442]
  - - [1024, 2944, 1, 128]
    - [22, 49.124]
  - - [5056, 4, 1, 1280]
    - [18, 4.305]
  - - [256, 1408, 1, 1280]
    - [80, 54.289]
  - - [3072, 16, 1, 1024]
    - [68, 11.514]
  - - [704, 3584, 1, 128]
    - [10, 46.951]
  - - [5888, 448, 1, 3328]
    - [37, 82.159]
  - - [2368, 4288, 1, 1280]
    - [8, 86.506]
  - - [4288, 2944, 1, 128]
    - [31, 60.282]
  - - [1024, 6784, 1, 3328]
    - [6, 89.625]
  - - [128, 2368, 1, 256]
    - [83, 11.892]
  - - [6784, 64, 1, 3328]
    - [10, 47.903]
  - - [5056, 2944, 1, 3328]
    - [3, 93.123]
  - - [448, 128, 1, 256]
    - [18, 7.27]
  - - [2944, 3584, 1, 256]
    - [9, 74.452]
  - - [1408, 1408, 1, 3328]
    - [8, 81.219]
  - - [1856, 128, 1, 1280]
    - [0, 39.953]
  - - [3584, 3584, 1, 128]
    - [31, 61.186]
  - - [64, 3584, 1, 256]
    - [16, 21.69]
  - - [1408, 4, 1, 3328]
    - [169, 2.122]
  - - [128, 2944, 1, 3328]
    - [36, 66.884]
  - - [3584, 704, 1, 256]
    - [30, 60.393]
  - - [2944, 448, 1, 3328]
    - [37, 82.456]
  - - [3584, 1408, 1, 3328]
    - [38, 91.758]
  - - [704, 3584, 1, 1280]
    - [4, 80.546]
  - - [2944, 6784, 1, 1280]
    - [2, 88.445]
  - - [1856, 6784, 1, 256]
    - [30, 76.575]
  - - [4288, 448, 1, 3328]
    - [8, 77.773]
  - - [6784, 4288, 1, 128]
    - [2, 60.975]
  - - [6784, 704, 1, 1280]
    - [11, 83.057]
  - - [256, 4288, 1, 256]
    - [10, 50.861]
  - - [3584, 6784, 1, 256]
    - [2, 78.364]
  - - [6144, 12000, 1, 2048]
    - [5, 94.683]
  - - [6144, 16, 1, 2560]
    - [78, 17.87]
  - - [3584, 64, 1, 128]
    - [0, 13.641]
  - - [5888, 1024, 1, 3328]
    - [49, 90.7]
  - - [448, 64, 1, 128]
    - [0, 0.694]
  - - [704, 6784, 1, 1280]
    - [6, 83.866]
  - - [4, 1024, 1, 1280]
    - [188, 0.775]
  - - [5888, 128, 1, 256]
    - [10, 43.045]
  - - [4096, 16, 1, 4096]
    - [24, 16.26]
  - - [1856, 5056, 1, 3328]
    - [8, 90.953]
  - - [4, 6784, 1, 256]
    - [18, 2.77]
  - - [1024, 3584, 1, 128]
    - [10, 51.137]
  - - [1024, 1408, 1, 128]
    - [0, 39.047]
  - - [2368, 2944, 1, 128]
    - [31, 56.64]
  - - [5056, 64, 1, 256]
    - [10, 28.498]
  - - [4, 448, 1, 1280]
    - [187, 0.346]
  - - [5056, 2944, 1, 128]
    - [31, 60.044]
  - - [5888, 5056, 1, 3328]
    - [3, 93.382]
  - - [1024, 704, 1, 128]
    - [54, 29.703]
  - - [5888, 2368, 1, 128]
    - [31, 59.798]
  - - [128, 5056, 1, 3328]
    - [83, 75.242]
  - - [3584, 6784, 1, 1280]
    - [2, 91.783]
  - - [448, 4, 1, 1280]
    - [190, 0.347]
  - - [1856, 5888, 1, 256]
    - [66, 75.315]
  - - [256, 256, 1, 256]
    - [70, 3.023]
  - - [256, 64, 1, 128]
    - [24, 1.196]
  - - [4288, 4288, 1, 3328]
    - [8, 92.122]
  - - [4288, 1408, 1, 1280]
    - [37, 85.319]
  - - [3584, 5056, 1, 128]
    - [9, 61.925]
  - - [4, 1024, 1, 3328]
    - [167, 1.669]
  - - [4288, 2368, 1, 256]
    - [9, 72.046]
  - - [2944, 5056, 1, 1280]
    - [2, 89.871]
  - - [448, 6784, 1, 256]
    - [10, 64.812]
  - - [64, 128, 1, 128]
    - [18, 0.598]
  - - [1856, 2368, 1, 128]
    - [10, 52.927]
  - - [6784, 2368, 1, 3328]
    - [2, 93.072]
  - - [256, 1024, 1, 1280]
    - [0, 44.871]
  - - [704, 4, 1, 128]
    - [21, 0.198]
  - - [256, 4, 1, 256]
    - [24, 0.127]
  - - [4288, 128, 1, 256]
    - [10, 38.61]
  - - [4288, 1856, 1, 3328]
    - [2, 91.733]
  - - [3584, 448, 1, 128]
    - [22, 41.349]
  - - [2048, 1600, 1, 2048]
    - [37, 83.132]
  - - [256, 4, 1, 3328]
    - [166, 0.453]
  - - [4, 1408, 1, 1280]
    - [165, 0.991]
  - - [3584, 64, 1, 1280]
    - [43, 38.688]
  - - [1408, 448, 1, 128]
    - [1, 11.939]
  - - [3584, 1024, 1, 1280]
    - [37, 79.298]
  - - [1856, 5056, 1, 256]
    - [9, 75.286]
  - - [4, 3584, 1, 256]
    - [70, 1.638]
  - - [4, 2944, 1, 1280]
    - [20, 3.13]
  - - [1024, 4288, 1, 256]
    - [30, 68.829]
  - - [5888, 3584, 1, 3328]
    - [28, 93.404]
  - - [1856, 4, 1, 256]
    - [0, 0.874]
  - - [4, 256, 1, 256]
    - [21, 0.128]
  - - [5056, 3584, 1, 3328]
    - [4, 92.958]
  - - [704, 448, 1, 128]
    - [10, 6.594]
  - - [2368, 1408, 1, 1280]
    - [37, 82.758]
  - - [5056, 2944, 1, 1280]
    - [2, 90.625]
  - - [4, 4, 1, 128]
    - [21, 0.0]
  - - [3584, 256, 1, 256]
    - [10, 45.236]
  - - [1024, 6784, 1, 256]
    - [2, 72.529]
  - - [4, 128, 1, 256]
    - [21, 0.064]
  - - [64, 64, 1, 1280]
    - [20, 1.231]
  - - [5124, 9124, 1, 2048]
    - [5, 91.56]
  - - [6784, 4, 1, 128]
    - [84, 1.631]
  - - [2944, 1408, 1, 128]
    - [22, 52.437]
  - - [448, 128, 1, 3328]
    - [20, 20.575]
  - - [3584, 1408, 1, 1280]
    - [38, 83.363]
  - - [64, 4288, 1, 3328]
    - [16, 45.074]
  - - [5056, 6784, 1, 3328]
    - [5, 92.477]
  - - [128, 2944, 1, 256]
    - [56, 13.751]
  - - [128, 6784, 1, 128]
    - [10, 33.173]
  - - [3584, 4288, 1, 256]
    - [9, 75.706]
  - - [448, 1856, 1, 256]
    - [1, 25.501]
  - - [1856, 6784, 1, 3328]
    - [4, 93.357]
  - - [3584, 128, 1, 3328]
    - [56, 53.627]
  - - [64, 1856, 1, 256]
    - [21, 13.569]
  - - [64, 448, 1, 256]
    - [70, 1.389]
  - - [5888, 4288, 1, 256]
    - [2, 78.274]
  - - [4, 448, 1, 128]
    - [21, 0.129]
  - - [5056, 1408, 1, 256]
    - [2, 69.898]
  - - [35, 8457, 1, 2048]
    - [85, 31.99]
  - - [64, 256, 1, 1280]
    - [78, 2.699]
  - - [3584, 1024, 1, 256]
    - [30, 63.863]
  - - [256, 704, 1, 256]
    - [26, 7.607]
  - - [5888, 5888, 1, 256]
    - [2, 80.025]
  - - [4288, 1024, 1, 1280]
    - [10, 81.446]
  - - [5888, 128, 1, 3328]
    - [52, 71.814]
  - - [448, 6784, 1, 3328]
    - [32, 83.614]
  - - [2944, 1408, 1, 1280]
    - [2, 84.05]
  - - [64, 128, 1, 1280]
    - [20, 2.461]
  - - [2944, 1856, 1, 3328]
    - [108, 88.999]
  - - [2368, 64, 1, 128]
    - [62, 9.607]
  - - [256, 1024, 1, 128]
    - [87, 5.538]
  - - [3584, 5888, 1, 1280]
    - [12, 89.757]
  - - [64, 4, 1, 128]
    - [24, 0.019]
  - - [6784, 1856, 1, 1280]
    - [2, 90.36]
  - - [2944, 5056, 1, 256]
    - [9, 76.459]
  - - [4288, 4, 1, 128]
    - [18, 1.112]
  - - [5888, 256, 1, 3328]
    - [4, 78.173]
  - - [2944, 4288, 1, 128]
    - [31, 60.836]
  - - [3584, 1408, 1, 256]
    - [9, 67.617]
  - - [704, 3584, 1, 3328]
    - [4, 85.403]
  - - [4096, 3200, 1, 1024]
    - [2, 87.65]
  - - [5056, 448, 1, 1280]
    - [37, 76.143]
  - - [3584, 1856, 1, 3328]
    - [8, 89.516]
  - - [4288, 6784, 1, 1280]
    - [15, 90.207]
  - - [2560, 7000, 1, 2560]
    - [2, 93.035]
  - - [1408, 704, 1, 1280]
    - [37, 68.56]
  - - [2944, 1024, 1, 256]
    - [9, 64.17]
  - - [6784, 64, 1, 256]
    - [44, 33.173]
  - - [2368, 4288, 1, 3328]
    - [8, 89.91]
  - - [4, 1408, 1, 256]
    - [59, 0.249]
  - - [1024, 1408, 1, 1280]
    - [37, 73.536]
  - - [64, 64, 1, 256]
    - [24, 0.525]
  - - [704, 256, 1, 3328]
    - [50, 42.415]
  - - [6784, 5056, 1, 256]
    - [2, 79.826]
  - - [1856, 1856, 1, 128]
    - [10, 49.927]
  - - [3584, 5056, 1, 3328]
    - [49, 91.442]
  - - [448, 6784, 1, 128]
    - [10, 48.835]
  - - [4, 704, 1, 3328]
    - [170, 1.138]
  - - [35, 8457, 1, 4096]
    - [10, 31.619]
  - - [448, 2944, 1, 256]
    - [10, 53.767]
  - - [4, 4288, 1, 3328]
    - [17, 4.863]
  - - [2944, 6784, 1, 256]
    - [30, 77.451]
  - - [2944, 2944, 1, 128]
    - [31, 58.75]
  - - [4, 4, 1, 1280]
    - [177, 0.003]
  - - [1856, 3584, 1, 1280]
    - [8, 85.9]
  - - [64, 2944, 1, 256]
    - [56, 7.539]
  - - [448, 256, 1, 128]
    - [83, 2.557]
  - - [4288, 448, 1, 128]
    - [83, 41.975]
  - - [4608, 24000, 1, 1536]
    - [5, 94.54]
  - - [1856, 1408, 1, 3328]
    - [3, 84.01]
  - - [128, 128, 1, 128]
    - [70, 0.408]
  - - [1024, 4288, 1, 3328]
    - [2, 89.782]
  - - [448, 2368, 1, 256]
    - [10, 51.425]
  - - [1024, 4, 1, 128]
    - [24, 0.285]
  - - [64, 1408, 1, 1280]
    - [34, 24.871]
  - - [64, 6784, 1, 1280]
    - [10, 38.822]
  - - [5056, 448, 1, 256]
    - [10, 59.257]
  - - [2944, 2368, 1, 3328]
    - [2, 89.772]
  - - [704, 4288, 1, 3328]
    - [85, 82.721]
  - - [1408, 128, 1, 256]
    - [56, 19.802]
  - - [1024, 1856, 1, 1280]
    - [37, 70.405]
  - - [2048, 6400, 1, 2048]
    - [2, 89.963]
  - - [512, 48000, 1, 2816]
    - [86, 92.293]
  - - [5124, 9124, 1, 2560]
    - [5, 91.864]
  - - [128, 2368, 1, 3328]
    - [16, 57.471]
  - - [1024, 5888, 1, 256]
    - [30, 71.416]
  - - [64, 2944, 1, 1280]
    - [120, 26.358]
  - - [5056, 64, 1, 3328]
    - [46, 57.163]
  - - [128, 704, 1, 128]
    - [22, 2.133]
  - - [1408, 2368, 1, 256]
    - [10, 66.093]
  - - [1408, 1408, 1, 256]
    - [10, 59.874]
  - - [4, 64, 1, 128]
    - [21, 0.018]
  - - [64, 1024, 1, 128]
    - [0, 4.786]
  - - [1024, 8, 1, 500000]
    - [171, 6.558]
  - - [2368, 2368, 1, 128]
    - [10, 54.732]
  - - [64, 5888, 1, 128]
    - [10, 19.761]
  - - [5888, 4, 1, 3328]
    - [18, 5.304]
  - - [6784, 1408, 1, 128]
    - [2, 56.455]
  - - [4288, 5888, 1, 256]
    - [2, 77.103]
  - - [1408, 5056, 1, 256]
    - [2, 73.527]
  - - [5056, 128, 1, 3328]
    - [10, 74.434]
  - - [128, 128, 1, 1280]
    - [24, 5.001]
  - - [448, 704, 1, 256]
    - [10, 28.428]
  - - [4288, 3584, 1, 128]
    - [31, 60.348]
  - - [2944, 128, 1, 3328]
    - [36, 66.806]
  - - [64, 1408, 1, 3328]
    - [34, 30.998]
  - - [3584, 5056, 1, 1280]
    - [11, 87.795]
  - - [256, 448, 1, 1280]
    - [81, 16.89]
  - - [704, 704, 1, 128]
    - [10, 24.646]
  - - [5056, 4, 1, 128]
    - [17, 1.215]
  - - [704, 256, 1, 1280]
    - [87, 41.255]
  - - [64, 2368, 1, 3328]
    - [60, 34.912]
  - - [1856, 1024, 1, 128]
    - [10, 44.748]
  - - [1856, 64, 1, 128]
    - [0, 7.699]
  - - [4096, 64, 1, 4096]
    - [46, 47.581]
  - - [1024, 24000, 1, 1536]
    - [3, 91.763]
  - - [704, 4288, 1, 256]
    - [10, 64.495]
  - - [5888, 2368, 1, 1280]
    - [2, 88.209]
  - - [128, 256, 1, 256]
    - [56, 4.109]
  - - [64, 128, 1, 256]
    - [18, 1.062]
  - - [2368, 5888, 1, 1280]
    - [2, 88.597]
  - - [5888, 256, 1, 1280]
    - [10, 76.005]
  - - [1760, 128, 1, 1760]
    - [56, 33.692]
  - - [4, 5888, 1, 1280]
    - [18, 4.887]
  - - [704, 128, 1, 128]
    - [0, 6.418]
  - - [1024, 4, 1, 1280]
    - [175, 0.777]
  - - [2368, 1856, 1, 3328]
    - [8, 88.171]
  - - [2368, 128, 1, 128]
    - [16, 16.813]
  - - [2944, 704, 1, 256]
    - [9, 58.178]
  - - [5056, 128, 1, 128]
    - [10, 28.716]
  - - [2368, 1024, 1, 3328]
    - [2, 86.446]
  - - [256, 704, 1, 3328]
    - [87, 42.91]
  - - [704, 3584, 1, 256]
    - [10, 62.067]
  - - [704, 2944, 1, 3328]
    - [8, 80.739]
  - - [6784, 1024, 1, 128]
    - [2, 55.733]
  - - [256, 448, 1, 128]
    - [154, 2.637]
  - - [448, 1024, 1, 3328]
    - [64, 56.629]
  - - [2944, 1024, 1, 3328]
    - [8, 84.496]
  - - [2944, 5056, 1, 128]
    - [9, 62.085]
  - - [2368, 256, 1, 256]
    - [10, 41.88]
  - - [1408, 6784, 1, 256]
    - [9, 74.711]
  - - [6784, 1408, 1, 3328]
    - [4, 89.381]
  - - [4288, 6784, 1, 128]
    - [31, 62.311]
  - - [704, 64, 1, 256]
    - [56, 2.116]
  - - [5888, 4, 1, 1280]
    - [21, 4.717]
  - - [256, 2368, 1, 3328]
    - [32, 71.929]
  - - [6784, 2944, 1, 1280]
    - [2, 88.289]
  - - [4288, 1856, 1, 128]
    - [31, 56.817]
  - - [1856, 2944, 1, 128]
    - [10, 55.492]
  - - [6784, 448, 1, 128]
    - [9, 47.256]
  - - [64, 3584, 1, 128]
    - [0, 13.231]
  - - [448, 5056, 1, 1280]
    - [37, 76.995]
  - - [2368, 1856, 1, 128]
    - [31, 52.49]
  - - [64, 2944, 1, 3328]
    - [88, 49.317]
  - - [4288, 704, 1, 256]
    - [9, 62.303]
  - - [256, 3584, 1, 128]
    - [10, 32.874]
  - - [5888, 704, 1, 256]
    - [54, 64.105]
  - - [3584, 1024, 1, 128]
    - [71, 49.463]
  - - [256, 5888, 1, 3328]
    - [4, 78.202]
  - - [1408, 4288, 1, 3328]
    - [12, 89.475]
  - - [6784, 4288, 1, 256]
    - [2, 79.191]
  - - [4288, 256, 1, 128]
    - [1, 34.793]
  - - [5888, 256, 1, 256]
    - [10, 52.698]
  - - [6784, 1024, 1, 1280]
    - [2, 86.775]
  - - [5888, 1024, 1, 128]
    - [2, 54.429]
  - - [1024, 128, 1, 256]
    - [0, 14.972]
  - - [512, 16, 1, 500000]
    - [172, 9.624]
  - - [128, 64, 1, 3328]
    - [188, 3.493]
  - - [448, 64, 1, 256]
    - [0, 1.334]
  - - [2368, 256, 1, 128]
    - [102, 11.694]
  - - [6784, 3584, 1, 1280]
    - [2, 91.645]
  - - [1024, 6784, 1, 1280]
    - [9, 85.042]
  - - [2944, 64, 1, 1280]
    - [0, 26.211]
  - - [1408, 2944, 1, 1280]
    - [10, 81.916]
  - - [256, 1856, 1, 256]
    - [10, 34.476]
  - - [2048, 800, 1, 2048]
    - [37, 77.851]
  - - [1408, 2368, 1, 3328]
    - [2, 90.349]
  - - [2944, 4, 1, 3328]
    - [165, 3.266]
  - - [128, 1408, 1, 3328]
    - [50, 42.666]
  - - [2944, 1856, 1, 128]
    - [31, 55.2]
  - - [256, 2944, 1, 128]
    - [1, 31.966]
  - - [256, 6784, 1, 128]
    - [1, 43.557]
  - - [2368, 4, 1, 128]
    - [17, 0.607]
  - - [1408, 256, 1, 3328]
    - [46, 63.75]
  - - [1856, 4, 1, 128]
    - [82, 0.18]
  - - [5056, 6784, 1, 128]
    - [31, 61.715]
  - - [4288, 5056, 1, 128]
    - [31, 61.305]
  - - [1856, 5888, 1, 128]
    - [9, 59.98]
  - - [2944, 5888, 1, 256]
    - [9, 77.274]
  - - [3584, 1856, 1, 256]
    - [9, 71.19]
  - - [4288, 3584, 1, 1280]
    - [3, 88.017]
  - - [2368, 448, 1, 256]
    - [10, 49.153]
  - - [4288, 256, 1, 3328]
    - [10, 80.311]
  - - [1856, 704, 1, 128]
    - [9, 39.67]
  - - [1408, 64, 1, 256]
    - [21, 10.397]
  - - [64, 1856, 1, 128]
    - [18, 7.876]
  - - [4, 256, 1, 128]
    - [20, 0.074]
  - - [2560, 16, 1, 2560]
    - [17, 13.127]
  - - [704, 5888, 1, 128]
    - [10, 52.901]
  - - [6784, 3584, 1, 128]
    - [2, 61.461]
  - - [1024, 64, 1, 256]
    - [70, 2.884]
  - - [64, 2368, 1, 256]
    - [82, 6.43]
  - - [4288, 5056, 1, 3328]
    - [3, 92.585]
  - - [4, 1856, 1, 1280]
    - [172, 1.284]
  - - [4288, 128, 1, 128]
    - [1, 10.657]
  - - [1408, 1408, 1, 128]
    - [10, 45.023]
  - - [7680, 16, 1, 2560]
    - [68, 20.696]
  - - [1856, 128, 1, 128]
    - [0, 13.842]
  - - [5056, 2368, 1, 256]
    - [13, 72.092]
  - - [4288, 704, 1, 3328]
    - [37, 82.049]
  - - [448, 3584, 1, 256]
    - [10, 56.134]
  - - [2368, 64, 1, 1280]
    - [50, 21.651]
  - - [2368, 1024, 1, 1280]
    - [10, 80.204]
  - - [2944, 1408, 1, 3328]
    - [2, 91.004]
  - - [1408, 448, 1, 256]
    - [10, 44.106]
  - - [1024, 1408, 1, 3328]
    - [37, 77.728]
  - - [2944, 5888, 1, 1280]
    - [3, 88.504]
  - - [1408, 4, 1, 1280]
    - [165, 1.019]
  - - [5888, 3584, 1, 256]
    - [2, 75.375]
  - - [2368, 5056, 1, 128]
    - [9, 60.108]
  - - [1408, 1856, 1, 3328]
    - [3, 84.147]
  - - [4, 4, 1, 3328]
    - [175, 0.007]
  - - [6784, 1408, 1, 1280]
    - [2, 87.059]
  - - [4096, 7000, 1, 4096]
    - [4, 93.694]
  - - [704, 2944, 1, 256]
    - [10, 58.749]
  - - [4288, 64, 1, 256]
    - [16, 24.735]
  - - [6784, 5888, 1, 3328]
    - [4, 94.603]
  - - [2368, 4288, 1, 128]
    - [31, 59.586]
  - - [64, 4288, 1, 1280]
    - [16, 43.974]
  - - [6784, 64, 1, 1280]
    - [10, 37.748]
  - - [3584, 128, 1, 128]
    - [10, 23.012]
  - - [1024, 6784, 1, 128]
    - [2, 57.824]
  - - [4, 1856, 1, 128]
    - [70, 0.172]
  - - [1408, 64, 1, 3328]
    - [34, 31.213]
  - - [6784, 4, 1, 256]
    - [21, 2.722]
  - - [1408, 1408, 1, 1280]
    - [37, 79.915]
  - - [16384, 400, 1, 4096]
    - [10, 84.163]
  - - [256, 2368, 1, 256]
    - [10, 41.63]
  - - [448, 4288, 1, 3328]
    - [8, 78.882]
  - - [2368, 1408, 1, 256]
    - [10, 64.866]
  - - [5888, 5056, 1, 128]
    - [2, 61.617]
  - - [704, 2368, 1, 256]
    - [10, 56.734]
  - - [1024, 24000, 1, 2560]
    - [3, 92.73]
  - - [2944, 448, 1, 1280]
    - [37, 77.396]
  - - [5888, 2368, 1, 3328]
    - [8, 91.999]
  - - [5124, 9124, 1, 1760]
    - [15, 92.064]
  - - [448, 1408, 1, 1280]
    - [37, 67.633]
  - - [448, 1856, 1, 1280]
    - [37, 70.535]
  - - [4288, 448, 1, 1280]
    - [10, 77.492]
  - - [5888, 704, 1, 3328]
    - [2, 89.029]
  - - [5056, 256, 1, 128]
    - [30, 39.297]
  - - [1856, 256, 1, 128]
    - [54, 23.031]
  - - [64, 1408, 1, 128]
    - [32, 2.002]
  - - [704, 4, 1, 256]
    - [21, 0.128]
  - - [1408, 5888, 1, 128]
    - [2, 58.895]
  - - [7680, 12000, 1, 2560]
    - [5, 95.429]
  - - [1408, 1024, 1, 256]
    - [10, 54.182]
  - - [8192, 400, 1, 2048]
    - [37, 77.827]
  - - [1024, 1856, 1, 128]
    - [10, 44.386]
  - - [256, 704, 1, 128]
    - [0, 11.552]
  - - [2560, 128, 1, 2560]
    - [37, 47.81]
  - - [448, 1024, 1, 256]
    - [10, 33.71]
  - - [128, 4, 1, 3328]
    - [175, 0.25]
  - - [5056, 6784, 1, 1280]
    - [3, 91.667]
  - - [1408, 64, 1, 128]
    - [18, 6.188]
  - - [1024, 448, 1, 1280]
    - [0, 51.285]
  - - [704, 5056, 1, 3328]
    - [32, 86.556]
  - - [128, 5056, 1, 256]
    - [10, 43.159]
  - - [64, 1024, 1, 3328]
    - [25, 23.073]
  - - [1856, 4, 1, 3328]
    - [171, 2.668]
  - - [4, 2944, 1, 128]
    - [48, 0.849]
  - - [2368, 2944, 1, 3328]
    - [2, 90.034]
  - - [448, 448, 1, 1280]
    - [87, 29.376]
  - - [2368, 3584, 1, 256]
    - [9, 74.12]
  - - [5056, 3584, 1, 1280]
    - [2, 90.828]
  - - [5124, 9124, 1, 4096]
    - [49, 92.48]
  - - [7680, 48000, 1, 2560]
    - [5, 95.888]
  - - [448, 4, 1, 3328]
    - [176, 0.764]
  - - [1856, 2944, 1, 1280]
    - [10, 83.164]
  - - [1024, 48000, 1, 2816]
    - [2, 95.167]
  - - [128, 1024, 1, 256]
    - [0, 14.266]
  - - [2944, 1408, 1, 256]
    - [9, 65.781]
  - - [4288, 1408, 1, 3328]
    - [12, 89.244]
  - - [3584, 64, 1, 3328]
    - [43, 45.206]
  - - [5888, 2944, 1, 128]
    - [31, 59.983]
  - - [2944, 1024, 1, 128]
    - [22, 48.441]
  - - [4288, 5056, 1, 1280]
    - [8, 89.557]
  - - [5888, 6784, 1, 1280]
    - [2, 92.655]
  - - [6784, 5056, 1, 128]
    - [2, 62.122]
  - - [256, 1024, 1, 3328]
    - [16, 50.149]
  - - [3584, 4, 1, 256]
    - [17, 1.56]
  - - [1760, 1600, 1, 1760]
    - [37, 85.023]
  - - [1856, 64, 1, 3328]
    - [25, 28.11]
  - - [4, 128, 1, 3328]
    - [177, 0.242]
  - - [5888, 1408, 1, 3328]
    - [2, 92.248]
  - - [448, 2944, 1, 128]
    - [9, 40.043]
  - - [2368, 1856, 1, 256]
    - [9, 68.52]
  - - [256, 5056, 1, 256]
    - [1, 54.499]
  - - [128, 3584, 1, 128]
    - [10, 22.619]
  - - [448, 3584, 1, 3328]
    - [91, 80.058]
  - - [4, 5056, 1, 3328]
    - [18, 5.203]
  - - [704, 2368, 1, 128]
    - [10, 43.123]
  - - [5888, 256, 1, 128]
    - [10, 40.069]
  - - [4, 5056, 1, 128]
    - [70, 1.311]
  - - [448, 256, 1, 256]
    - [0, 13.1]
  - - [704, 4, 1, 3328]
    - [188, 1.178]
  - - [1408, 256, 1, 256]
    - [10, 31.988]
  - - [3584, 1856, 1, 128]
    - [31, 55.692]
  - - [4288, 4288, 1, 128]
    - [31, 61.523]
  - - [1856, 1024, 1, 3328]
    - [6, 76.839]
  - - [128, 5888, 1, 3328]
    - [27, 71.905]
  - - [1024, 5056, 1, 256]
    - [30, 70.024]
  - - [5888, 5888, 1, 1280]
    - [3, 91.33]
  - - [5056, 5888, 1, 128]
    - [31, 62.04]
  - - [2368, 1408, 1, 3328]
    - [37, 86.291]
  - - [1024, 48000, 1, 1536]
    - [3, 92.318]
  - - [5888, 448, 1, 256]
    - [37, 47.866]
  - - [2560, 3200, 1, 2560]
    - [8, 87.075]
  - - [5888, 6784, 1, 128]
    - [31, 62.174]
  - - [6144, 48000, 1, 2048]
    - [15, 95.453]
  - - [6784, 5056, 1, 1280]
    - [2, 92.569]
  - - [5056, 704, 1, 1280]
    - [8, 83.977]
  - - [1024, 48000, 1, 2560]
    - [73, 93.655]
  - - [4608, 32, 1, 1536]
    - [87, 31.602]
  - - [1024, 2368, 1, 128]
    - [22, 46.164]
  - - [128, 704, 1, 256]
    - [114, 3.928]
  - - [2368, 448, 1, 3328]
    - [37, 78.962]
  - - [128, 5888, 1, 1280]
    - [90, 63.56]
  - - [16384, 800, 1, 4096]
    - [10, 88.619]
  - - [448, 128, 1, 1280]
    - [21, 16.376]
  - - [6784, 4, 1, 3328]
    - [18, 5.59]
  - - [5888, 5056, 1, 1280]
    - [3, 91.314]
  - - [1024, 64, 1, 3328]
    - [21, 19.02]
  - - [3072, 48000, 1, 1024]
    - [15, 94.28]
  - - [64, 3584, 1, 1280]
    - [0, 38.242]
  - - [6784, 1408, 1, 256]
    - [2, 70.868]
  - - [3584, 5888, 1, 128]
    - [31, 62.49]
  - - [5056, 5888, 1, 256]
    - [2, 78.101]
  - - [2368, 1024, 1, 256]
    - [10, 61.892]
  - - [2944, 1856, 1, 256]
    - [66, 69.197]
  - - [1856, 6784, 1, 1280]
    - [4, 89.47]
  - - [64, 5056, 1, 128]
    - [56, 17.777]
  - - [64, 6784, 1, 128]
    - [10, 21.59]
  - - [448, 704, 1, 128]
    - [87, 6.557]
  - - [4, 1024, 1, 128]
    - [70, 0.097]
  - - [4288, 3584, 1, 256]
    - [9, 73.356]
  - - [1408, 704, 1, 128]
    - [10, 34.239]
  - - [64, 256, 1, 3328]
    - [178, 6.696]
  - - [6784, 448, 1, 3328]
    - [8, 85.313]
  - - [5056, 1856, 1, 1280]
    - [8, 86.971]
  - - [1408, 1024, 1, 3328]
    - [37, 77.784]
  - - [2368, 256, 1, 3328]
    - [37, 71.142]
  - - [5888, 3584, 1, 1280]
    - [2, 89.481]
  - - [1856, 3584, 1, 3328]
    - [8, 89.879]
  - - [5888, 128, 1, 1280]
    - [74, 56.714]
  - - [1024, 2944, 1, 256]
    - [30, 65.009]
  - - [448, 6784, 1, 1280]
    - [6, 82.001]
  - - [256, 3584, 1, 1280]
    - [32, 63.689]
  - - [704, 5056, 1, 256]
    - [30, 67.209]
  - - [3584, 1024, 1, 3328]
    - [12, 87.702]
  - - [2944, 1856, 1, 1280]
    - [10, 82.815]
  - - [128, 256, 1, 128]
    - [0, 2.393]
  - - [5056, 256, 1, 256]
    - [10, 52.766]
  - - [2944, 4288, 1, 3328]
    - [3, 91.282]
  - - [2368, 3584, 1, 3328]
    - [8, 90.9]
  - - [2944, 704, 1, 1280]
    - [13, 75.909]
  - - [128, 4, 1, 256]
    - [24, 0.062]
  - - [2944, 3584, 1, 1280]
    - [2, 87.804]
  - - [1856, 5888, 1, 1280]
    - [141, 86.742]
  - - [256, 256, 1, 1280]
    - [19, 11.048]
  - - [2048, 3200, 1, 2048]
    - [2, 89.694]
  - - [4288, 1408, 1, 256]
    - [9, 67.955]
  - - [3584, 64, 1, 256]
    - [47, 20.837]
  - - [64, 1856, 1, 3328]
    - [50, 27.6]
  - - [256, 1408, 1, 128]
    - [0, 20.385]
  - - [5888, 1408, 1, 128]
    - [31, 56.461]
  - - [4288, 2368, 1, 1280]
    - [15, 87.478]
  - - [4, 4288, 1, 256]
    - [70, 0.738]
  - - [256, 4288, 1, 128]
    - [1, 35.179]
  - - [2048, 128, 1, 2048]
    - [43, 44.805]
  - - [256, 128, 1, 3328]
    - [179, 11.084]
  - - [512, 8, 1, 500000]
    - [179, 4.858]
  - - [6784, 2368, 1, 256]
    - [2, 75.802]
  - - [5888, 128, 1, 128]
    - [56, 13.599]
  - - [1024, 24000, 1, 2816]
    - [3, 92.748]
  - - [7680, 5984, 1, 2560]
    - [3, 93.785]
  - - [4288, 1856, 1, 256]
    - [9, 71.121]
  - - [1856, 256, 1, 3328]
    - [0, 57.284]
  - - [1856, 2944, 1, 256]
    - [9, 69.426]
  - - [5056, 1024, 1, 128]
    - [31, 52.58]
  - - [64, 5888, 1, 1280]
    - [93, 54.616]
  - - [1760, 800, 1, 1760]
    - [0, 76.282]
  - - [6784, 256, 1, 128]
    - [66, 41.568]
  - - [5888, 704, 1, 128]
    - [94, 50.128]
  - - [1408, 2368, 1, 128]
    - [10, 51.151]
  - - [1024, 4288, 1, 1280]
    - [37, 83.062]
  - - [2368, 5056, 1, 3328]
    - [8, 90.621]
  - - [448, 4, 1, 128]
    - [24, 0.129]
  - - [4, 256, 1, 3328]
    - [187, 0.46]
  - - [4288, 1024, 1, 3328]
    - [3, 86.512]
  - - [6144, 48000, 1, 2560]
    - [5, 95.906]
  - - [1024, 5056, 1, 3328]
    - [3, 86.238]
  - - [1024, 1856, 1, 3328]
    - [142, 85.556]
  - - [704, 704, 1, 1280]
    - [0, 54.98]
  - - [128, 2368, 1, 1280]
    - [0, 50.098]
  - - [1408, 128, 1, 3328]
    - [87, 42.878]
  - - [3584, 256, 1, 1280]
    - [37, 63.158]
  - - [4, 128, 1, 128]
    - [21, 0.036]
  - - [5888, 64, 1, 1280]
    - [36, 56.17]
  - - [3584, 128, 1, 1280]
    - [0, 50.215]
  - - [4, 256, 1, 1280]
    - [175, 0.191]
  - - [128, 704, 1, 3328]
    - [34, 32.026]
  - - [4288, 6784, 1, 256]
    - [2, 77.667]
  - - [3584, 2944, 1, 3328]
    - [12, 91.247]
  - - [128, 1856, 1, 256]
    - [16, 23.227]
  - - [64, 4288, 1, 256]
    - [16, 25.74]
  - - [4, 3584, 1, 3328]
    - [21, 4.498]
  - - [64, 4, 1, 3328]
    - [190, 0.115]
  - - [4, 64, 1, 3328]
    - [169, 0.125]
  - - [5888, 2944, 1, 256]
    - [2, 74.989]
  - - [1856, 64, 1, 256]
    - [0, 13.177]
  - - [5056, 128, 1, 1280]
    - [10, 68.123]
  - - [448, 4288, 1, 1280]
    - [32, 78.48]
  - - [448, 1856, 1, 3328]
    - [32, 76.215]
  - - [1024, 4288, 1, 128]
    - [2, 54.824]
  - - [4, 1024, 1, 256]
    - [59, 0.184]
  - - [5056, 4288, 1, 256]
    - [33, 74.912]
  - - [1024, 448, 1, 256]
    - [10, 33.079]
  - - [1024, 3584, 1, 256]
    - [10, 66.261]
  - - [2944, 128, 1, 1280]
    - [36, 56.756]
  - - [2048, 32, 1, 2048]
    - [41, 20.095]
  - - [64, 256, 1, 256]
    - [45, 0.783]
  - - [1408, 4, 1, 128]
    - [45, 0.135]
  - - [128, 2368, 1, 128]
    - [37, 6.484]
  - - [256, 704, 1, 1280]
    - [120, 24.919]
  - - [64, 2368, 1, 128]
    - [25, 3.433]
  - - [6784, 6784, 1, 3328]
    - [3, 94.063]
  - - [448, 5888, 1, 1280]
    - [32, 77.485]
  - - [5056, 448, 1, 128]
    - [10, 44.142]
  - - [4288, 704, 1, 1280]
    - [37, 78.237]
  - - [3584, 2944, 1, 128]
    - [9, 59.906]
  - - [6784, 256, 1, 1280]
    - [37, 69.32]
  - - [256, 2944, 1, 1280]
    - [90, 63.84]
  - - [64, 4288, 1, 128]
    - [16, 16.153]
  - - [2368, 5888, 1, 3328]
    - [28, 92.308]
  - - [4, 64, 1, 256]
    - [78, 0.029]
  - - [704, 1024, 1, 3328]
    - [96, 68.866]
  - - [2368, 1856, 1, 1280]
    - [8, 83.921]
  - - [448, 5056, 1, 3328]
    - [32, 79.597]
  - - [128, 448, 1, 128]
    - [0, 4.135]
  - - [128, 6784, 1, 256]
    - [10, 47.48]
  - - [3584, 4288, 1, 128]
    - [31, 60.845]
  - - [64, 448, 1, 128]
    - [48, 1.993]
  - - [5888, 4288, 1, 3328]
    - [12, 92.665]
  - - [2368, 704, 1, 256]
    - [10, 56.401]
  - - [256, 1856, 1, 3328]
    - [64, 57.655]
  - - [1856, 128, 1, 256]
    - [43, 22.465]
  - - [6784, 128, 1, 128]
    - [54, 33.617]
  - - [3584, 1408, 1, 128]
    - [9, 53.707]
  - - [1856, 5056, 1, 1280]
    - [8, 87.294]
  - - [2944, 1024, 1, 1280]
    - [37, 77.162]
  - - [5056, 4, 1, 256]
    - [17, 2.16]
  - - [3584, 5888, 1, 3328]
    - [12, 94.23]
  - - [2368, 4288, 1, 256]
    - [9, 74.902]
  - - [1024, 2368, 1, 3328]
    - [2, 86.358]
  - - [64, 704, 1, 3328]
    - [193, 13.559]
  - - [704, 1408, 1, 256]
    - [10, 48.05]
  - - [4096, 128, 1, 4096]
    - [10, 61.8]
  - - [1024, 3584, 1, 1280]
    - [6, 81.147]
  - - [4288, 5888, 1, 3328]
    - [28, 93.929]
  - - [4288, 4, 1, 1280]
    - [18, 4.055]
  - - [4608, 16, 1, 1536]
    - [25, 17.418]
  - - [5888, 64, 1, 128]
    - [10, 20.127]
  - - [4, 5888, 1, 128]
    - [17, 1.544]
  - - [1024, 2944, 1, 3328]
    - [6, 85.117]
  - - [6784, 1856, 1, 256]
    - [2, 75.305]
  - - [2048, 64, 1, 2048]
    - [83, 25.393]
  - - [256, 6784, 1, 1280]
    - [37, 69.476]
  - - [1856, 3584, 1, 256]
    - [9, 72.194]
  - - [128, 448, 1, 3328]
    - [75, 20.284]
  - - [6784, 1856, 1, 128]
    - [2, 59.583]
  - - [4, 448, 1, 256]
    - [24, 0.227]
  - - [5056, 128, 1, 256]
    - [10, 43.408]
  - - [512, 24000, 1, 2816]
    - [2, 90.759]
  - - [256, 5888, 1, 1280]
    - [32, 77.083]
  - - [4, 128, 1, 1280]
    - [187, 0.098]
  - - [16384, 1600, 1, 4096]
    - [5, 90.473]
  - - [6784, 128, 1, 1280]
    - [79, 59.328]
  - - [64, 1408, 1, 256]
    - [0, 10.829]
  - - [2368, 1408, 1, 128]
    - [10, 50.613]
  - - [1856, 448, 1, 256]
    - [1, 25.215]
  - - [1408, 1024, 1, 128]
    - [10, 39.793]
  - - [128, 64, 1, 128]
    - [18, 0.622]
  - - [6784, 3584, 1, 3328]
    - [2, 93.982]
  - - [1760, 7000, 1, 1760]
    - [2, 91.488]
  - - [2944, 64, 1, 3328]
    - [26, 50.104]
  - - [64, 64, 1, 128]
    - [24, 0.311]
  - - [2368, 5056, 1, 1280]
    - [8, 87.147]
  - - [64, 4, 1, 1280]
    - [165, 0.048]
  - - [1408, 2368, 1, 1280]
    - [37, 82.972]
  - - [128, 1408, 1, 1280]
    - [0, 24.975]
  - - [256, 64, 1, 3328]
    - [180, 6.466]
  - - [704, 4288, 1, 128]
    - [10, 50.475]
  - - [128, 1856, 1, 3328]
    - [16, 44.818]
  - - [2944, 2944, 1, 256]
    - [9, 73.254]
  - - [2944, 4, 1, 1280]
    - [78, 3.16]
  - - [5888, 4, 1, 256]
    - [18, 2.448]
  - - [6784, 256, 1, 256]
    - [10, 39.513]
  - - [256, 5056, 1, 3328]
    - [32, 73.005]
  - - [128, 4288, 1, 1280]
    - [32, 48.692]
  - - [5056, 1856, 1, 128]
    - [31, 57.771]
  - - [5056, 1024, 1, 3328]
    - [2, 88.763]
  - - [128, 128, 1, 256]
    - [70, 0.757]
  - - [1760, 64, 1, 1760]
    - [68, 21.053]
  - - [4288, 3584, 1, 3328]
    - [3, 90.244]
  - - [448, 704, 1, 3328]
    - [56, 59.801]
  - - [448, 448, 1, 128]
    - [0, 12.864]
  - - [1024, 2368, 1, 1280]
    - [32, 81.087]
  - - [1856, 704, 1, 3328]
    - [37, 81.653]
  - - [4, 2368, 1, 128]
    - [70, 0.224]
  - - [5888, 6784, 1, 3328]
    - [12, 95.19]
  - - [704, 4288, 1, 1280]
    - [32, 78.177]
  - - [704, 256, 1, 256]
    - [0, 19.253]
  - - [1024, 48000, 1, 2048]
    - [2, 94.528]
  - - [4288, 1024, 1, 128]
    - [22, 41.412]
  - - [256, 64, 1, 3136]
    - [173, 6.21]
  - - [256, 1024, 1, 196]
    - [16, 17.95]
  - - [1024, 1024, 1, 3328]
    - [37, 77.129]
  - - [2048, 200, 1, 3200]
    - [0, 50.357]
  - - [1024, 200, 1, 13312]
    - [181, 51.419]
  - - [1024, 256, 1, 1536]
    - [0, 45.479]
  - - [4096, 256, 1, 12288]
    - [85, 81.368]
  - - [64, 200, 1, 1024]
    - [20, 3.516]
  - - [32, 512, 1, 1024]
    - [19, 4.448]
  - - [2048, 256, 1, 3328]
    - [56, 62.656]
  - - [4096, 512, 1, 32]
    - [1, 19.512]
  - - [2048, 256, 1, 13312]
    - [181, 66.751]
  - - [4096, 200, 1, 11264]
    - [85, 61.937]
  - - [2048, 512, 1, 1024]
    - [22, 63.17]
  - - [2048, 1024, 1, 1664]
    - [61, 78.281]
  - - [1024, 1024, 1, 64]
    - [0, 22.238]
  - - [512, 1024, 1, 1536]
    - [0, 59.496]
  - - [1024, 256, 1, 15360]
    - [181, 64.663]
  - - [1, 512, 1, 1024]
    - [187, 0.085]
  - - [4096, 512, 1, 1408]
    - [8, 78.072]
  - - [1024, 200, 1, 1408]
    - [82, 28.693]
  - - [1024, 512, 1, 512]
    - [0, 47.071]
  - - [4096, 256, 1, 15360]
    - [85, 78.904]
  - - [2048, 512, 1, 640]
    - [54, 63.537]
  - - [4096, 1024, 1, 1280]
    - [2, 82.689]
  - - [1024, 200, 1, 6144]
    - [0, 40.791]
  - - [1024, 1024, 1, 512]
    - [10, 61.098]
  - - [128, 512, 1, 2048]
    - [53, 21.002]
  - - [2048, 1024, 1, 640]
    - [31, 71.752]
  - - [1024, 256, 1, 3328]
    - [16, 49.455]
  - - [4096, 1024, 1, 13312]
    - [4, 88.538]
  - - [2048, 256, 1, 2048]
    - [37, 59.374]
  - - [2048, 1024, 1, 13312]
    - [8, 83.53]
  - - [2048, 512, 1, 16640]
    - [98, 77.099]
  - - [1024, 512, 1, 128]
    - [10, 25.848]
  - - [2048, 1024, 1, 3584]
    - [8, 81.346]
  - - [2048, 512, 1, 256]
    - [10, 48.977]
  - - [512, 256, 1, 3200]
    - [50, 31.228]
  - - [4096, 1024, 1, 1920]
    - [2, 84.243]
  - - [4096, 200, 1, 2560]
    - [37, 59.969]
  - - [1024, 256, 1, 16384]
    - [183, 55.445]
  - - [1024, 1024, 1, 1152]
    - [32, 71.441]
  - - [2048, 200, 1, 32]
    - [0, 6.712]
  - - [512, 1024, 1, 2816]
    - [0, 63.307]
  - - [4096, 256, 1, 14336]
    - [85, 78.627]
  - - [1024, 200, 1, 4608]
    - [56, 39.242]
  - - [1024, 200, 1, 16384]
    - [181, 45.506]
  - - [64, 256, 1, 1024]
    - [21, 4.638]
  - - [1, 200, 1, 1024]
    - [21, 0.057]
  - - [2048, 200, 1, 2080]
    - [0, 53.032]
  - - [512, 256, 1, 1792]
    - [0, 31.883]
  - - [2048, 200, 1, 1024]
    - [56, 44.792]
  - - [4096, 1024, 1, 12288]
    - [4, 88.427]
  - - [4096, 200, 1, 4096]
    - [37, 60.975]
  - - [1024, 512, 1, 11264]
    - [37, 63.685]
  - - [128, 512, 1, 1024]
    - [0, 17.481]
  - - [32, 256, 1, 2048]
    - [165, 2.24]
  - - [1024, 200, 1, 1792]
    - [0, 30.992]
  - - [1024, 1024, 1, 1792]
    - [32, 73.893]
  - - [32, 256, 1, 512]
    - [21, 1.688]
  - - [512, 200, 1, 2816]
    - [82, 28.878]
  - - [512, 200, 1, 3072]
    - [82, 28.582]
  - - [1024, 1024, 1, 8192]
    - [37, 78.221]
  - - [1024, 256, 1, 12288]
    - [181, 55.009]
  - - [4096, 200, 1, 768]
    - [10, 52.898]
  - - [1024, 512, 1, 16384]
    - [184, 62.894]
  - - [4096, 256, 1, 1024]
    - [37, 69.725]
  - - [1024, 512, 1, 256]
    - [10, 38.043]
  - - [4096, 1024, 1, 8320]
    - [4, 88.124]
  - - [4096, 256, 1, 9216]
    - [10, 82.571]
  - - [1024, 512, 1, 1408]
    - [0, 59.09]
  - - [1024, 512, 1, 5632]
    - [83, 63.555]
  - - [4096, 200, 1, 256]
    - [10, 39.877]
  - - [1024, 200, 1, 128]
    - [95, 11.814]
  - - [256, 200, 1, 1024]
    - [40, 7.468]
  - - [1024, 200, 1, 5120]
    - [82, 43.84]
  - - [512, 1024, 1, 3072]
    - [0, 62.681]
  - - [4096, 1024, 1, 15360]
    - [101, 95.283]
  - - [1, 256, 1, 2048]
    - [187, 0.076]
  - - [1024, 1024, 1, 4160]
    - [37, 78.32]
  - - [1024, 256, 1, 256]
    - [16, 24.194]
  - - [2048, 256, 1, 384]
    - [10, 42.597]
  - - [512, 256, 1, 2560]
    - [87, 28.93]
  - - [4096, 512, 1, 3072]
    - [8, 84.975]
  - - [1024, 256, 1, 4160]
    - [0, 50.928]
  - - [4096, 512, 1, 13312]
    - [8, 83.342]
  - - [4096, 1024, 1, 3840]
    - [4, 86.461]
  - - [4096, 200, 1, 640]
    - [10, 50.922]
  - - [32, 200, 1, 2048]
    - [188, 1.735]
  - - [1024, 200, 1, 512]
    - [56, 27.798]
  - - [1024, 1024, 1, 7168]
    - [37, 78.792]
  - - [2048, 1024, 1, 3200]
    - [6, 80.52]
  - - [512, 512, 1, 1536]
    - [0, 46.173]
  - - [4096, 256, 1, 768]
    - [10, 66.469]
  - - [2048, 256, 1, 6656]
    - [37, 64.348]
  - - [1024, 256, 1, 896]
    - [56, 40.248]
  - - [2048, 200, 1, 3072]
    - [0, 50.451]
  - - [128, 200, 1, 1024]
    - [21, 7.16]
  - - [4096, 512, 1, 3840]
    - [8, 81.482]
  - - [1024, 200, 1, 3200]
    - [82, 44.817]
  - - [4096, 512, 1, 5632]
    - [7, 81.551]
  - - [4096, 512, 1, 64]
    - [22, 17.062]
  - - [1024, 512, 1, 2816]
    - [0, 63.247]
  - - [4096, 256, 1, 7680]
    - [37, 79.903]
  - - [4096, 200, 1, 1024]
    - [10, 55.108]
  - - [1024, 512, 1, 12288]
    - [183, 64.362]
  - - [2048, 1024, 1, 512]
    - [99, 69.426]
  - - [128, 256, 1, 2048]
    - [45, 7.45]
  - - [2048, 200, 1, 1792]
    - [0, 48.149]
  - - [1024, 1024, 1, 2816]
    - [37, 76.521]
  - - [2048, 512, 1, 1536]
    - [22, 72.44]
  - - [4096, 256, 1, 3072]
    - [37, 77.713]
  - - [1024, 200, 1, 1536]
    - [56, 29.566]
  - - [1024, 256, 1, 1024]
    - [221, 37.452]
  - - [4096, 512, 1, 8192]
    - [8, 82.594]
  - - [128, 1024, 1, 512]
    - [56, 10.588]
  - - [4096, 512, 1, 2304]
    - [8, 79.968]
  - - [2048, 256, 1, 5632]
    - [37, 65.092]
  - - [1024, 256, 1, 5120]
    - [56, 51.303]
  - - [1024, 512, 1, 6656]
    - [37, 63.083]
  - - [4096, 512, 1, 2816]
    - [8, 80.382]
  - - [4096, 200, 1, 2080]
    - [56, 64.045]
  - - [1024, 200, 1, 2304]
    - [0, 33.108]
  - - [2048, 200, 1, 13312]
    - [182, 53.257]
  - - [64, 1024, 1, 1024]
    - [53, 16.617]
  - - [4096, 256, 1, 3584]
    - [37, 78.12]
  - - [2048, 1024, 1, 7680]
    - [8, 83.21]
  - - [1024, 256, 1, 1664]
    - [16, 46.146]
  - - [1, 512, 1, 2048]
    - [187, 0.157]
  - - [512, 512, 1, 1024]
    - [0, 42.151]
  - - [2048, 256, 1, 8192]
    - [37, 65.639]
  - - [2048, 512, 1, 512]
    - [10, 60.944]
  - - [4096, 512, 1, 1920]
    - [8, 79.206]
  - - [4096, 200, 1, 12288]
    - [37, 62.017]
  - - [2048, 512, 1, 1152]
    - [85, 69.972]
  - - [1024, 256, 1, 2080]
    - [56, 50.561]
  - - [4096, 1024, 1, 32]
    - [22, 14.156]
  - - [4096, 512, 1, 16640]
    - [14, 83.32]
  - - [2048, 200, 1, 9216]
    - [185, 50.766]
  - - [2048, 200, 1, 2560]
    - [56, 50.165]
  - - [2048, 1024, 1, 1024]
    - [220, 78.553]
  - - [2048, 256, 1, 4608]
    - [56, 64.5]
  - - [512, 200, 1, 768]
    - [0, 20.369]
  - - [128, 256, 1, 512]
    - [34, 2.829]
  - - [4096, 512, 1, 1792]
    - [8, 78.92]
  - - [4096, 1024, 1, 8192]
    - [4, 87.642]
  - - [1024, 256, 1, 2816]
    - [0, 49.286]
  - - [1024, 1024, 1, 13312]
    - [87, 78.31]
  - - [2048, 1024, 1, 4160]
    - [8, 81.654]
  - - [2048, 256, 1, 3584]
    - [0, 63.384]
  - - [128, 200, 1, 2048]
    - [179, 5.966]
  - - [4096, 512, 1, 10240]
    - [8, 82.506]
  - - [4096, 512, 1, 512]
    - [66, 68.541]
  - - [2048, 1024, 1, 6656]
    - [8, 82.652]
  - - [1024, 512, 1, 640]
    - [0, 49.907]
  - - [2048, 512, 1, 768]
    - [22, 65.986]
  - - [2048, 200, 1, 1408]
    - [56, 47.428]
  - - [4096, 200, 1, 2048]
    - [37, 59.628]
  - - [1024, 1024, 1, 5632]
    - [37, 79.186]
  - - [2048, 512, 1, 3584]
    - [22, 76.462]
  - - [64, 200, 1, 512]
    - [21, 2.546]
  - - [1024, 200, 1, 64]
    - [95, 6.869]
  - - [512, 512, 1, 2304]
    - [0, 48.867]
  - - [2048, 1024, 1, 14336]
    - [8, 83.662]
  - - [4096, 512, 1, 11264]
    - [14, 82.442]
  - - [4096, 512, 1, 128]
    - [92, 43.516]
  - - [1024, 512, 1, 64]
    - [0, 16.436]
  - - [4096, 512, 1, 768]
    - [8, 72.152]
  - - [4096, 1024, 1, 11264]
    - [4, 88.178]
  - - [1, 256, 1, 1024]
    - [21, 0.074]
  - - [4096, 200, 1, 7680]
    - [37, 62.479]
  - - [1024, 200, 1, 12288]
    - [181, 49.713]
  - - [1024, 1024, 1, 1280]
    - [32, 72.876]
  - - [4096, 1024, 1, 16640]
    - [4, 88.615]
  - - [2048, 1024, 1, 5632]
    - [92, 81.639]
  - - [1024, 200, 1, 15360]
    - [182, 47.99]
  - - [1, 1024, 1, 1024]
    - [177, 0.161]
  - - [2048, 256, 1, 16384]
    - [205, 68.475]
  - - [4096, 512, 1, 12288]
    - [14, 89.536]
  - - [2048, 200, 1, 896]
    - [56, 43.184]
  - - [4096, 1024, 1, 5632]
    - [4, 87.138]
  - - [2048, 256, 1, 32]
    - [1, 2.779]
  - - [2048, 256, 1, 1280]
    - [0, 57.606]
  - - [4096, 256, 1, 4096]
    - [37, 78.047]
  - - [2048, 256, 1, 11264]
    - [181, 64.208]
  - - [4096, 200, 1, 9216]
    - [37, 62.223]
  - - [1024, 512, 1, 4096]
    - [0, 62.158]
  - - [2048, 1024, 1, 10240]
    - [8, 83.236]
  - - [4096, 1024, 1, 640]
    - [10, 77.399]
  - - [128, 1024, 1, 2048]
    - [56, 26.017]
  - - [4096, 200, 1, 3840]
    - [37, 63.063]
  - - [1024, 1024, 1, 1920]
    - [83, 71.244]
  - - [2048, 200, 1, 7168]
    - [185, 54.001]
  - - [2048, 512, 1, 16384]
    - [98, 75.008]
  - - [2048, 1024, 1, 12288]
    - [92, 82.77]
  - - [4096, 1024, 1, 10240]
    - [4, 88.202]
  - - [1024, 1024, 1, 8320]
    - [32, 79.028]
  - - [1024, 256, 1, 9216]
    - [181, 51.821]
  - - [4096, 256, 1, 1152]
    - [10, 70.334]
  - - [512, 200, 1, 2560]
    - [68, 22.895]
  - - [2048, 256, 1, 1920]
    - [0, 60.326]
  - - [2048, 1024, 1, 4608]
    - [8, 81.77]
  - - [512, 256, 1, 1024]
    - [64, 17.408]
  - - [1024, 256, 1, 1920]
    - [0, 47.255]
  - - [4096, 512, 1, 3584]
    - [8, 81.327]
  - - [2048, 512, 1, 4160]
    - [37, 77.7]
  - - [2048, 512, 1, 5632]
    - [85, 77.389]
  - - [4096, 1024, 1, 4608]
    - [4, 86.979]
  - - [4096, 1024, 1, 3328]
    - [2, 85.785]
  - - [4096, 256, 1, 7168]
    - [37, 79.719]
  - - [4096, 200, 1, 128]
    - [0, 28.815]
  - - [2048, 200, 1, 5120]
    - [0, 50.812]
  - - [1024, 1024, 1, 6656]
    - [37, 79.147]
  - - [512, 1024, 1, 3200]
    - [0, 62.902]
  - - [512, 200, 1, 2304]
    - [82, 27.545]
  - - [2048, 1024, 1, 9216]
    - [8, 83.374]
  - - [2048, 256, 1, 1536]
    - [0, 60.286]
  - - [4096, 256, 1, 256]
    - [10, 49.177]
  - - [2048, 512, 1, 1408]
    - [22, 71.621]
  - - [1024, 256, 1, 384]
    - [16, 31.071]
  - - [2048, 1024, 1, 2304]
    - [8, 79.821]
  - - [4096, 512, 1, 6144]
    - [8, 82.588]
  - - [1024, 200, 1, 14336]
    - [182, 47.905]
  - - [1024, 512, 1, 2080]
    - [0, 66.593]
  - - [2048, 512, 1, 2304]
    - [22, 74.778]
  - - [4096, 512, 1, 15360]
    - [8, 83.373]
  - - [1024, 256, 1, 32]
    - [95, 4.555]
  - - [1024, 200, 1, 2816]
    - [56, 35.242]
  - - [4096, 200, 1, 512]
    - [10, 37.748]
  - - [4096, 1024, 1, 7168]
    - [4, 87.77]
  - - [2048, 256, 1, 14336]
    - [181, 66.508]
  - - [1024, 200, 1, 3072]
    - [82, 44.722]
  - - [2048, 200, 1, 1280]
    - [56, 46.88]
  - - [1024, 1024, 1, 2304]
    - [37, 75.978]
  - - [4096, 1024, 1, 9216]
    - [4, 88.119]
  - - [2048, 512, 1, 4608]
    - [85, 76.917]
  - - [4096, 1024, 1, 7680]
    - [4, 87.832]
  - - [4096, 256, 1, 6144]
    - [37, 78.512]
  - - [4096, 256, 1, 896]
    - [10, 68.513]
  - - [512, 256, 1, 1536]
    - [50, 22.057]
  - - [1024, 256, 1, 512]
    - [56, 33.604]
  - - [2048, 256, 1, 640]
    - [0, 50.072]
  - - [256, 256, 1, 2048]
    - [56, 20.644]
  - - [2048, 1024, 1, 8192]
    - [61, 82.234]
  - - [4096, 200, 1, 16640]
    - [85, 61.834]
  - - [256, 512, 1, 512]
    - [56, 10.594]
  - - [2048, 512, 1, 384]
    - [10, 55.835]
  - - [2048, 200, 1, 16384]
    - [182, 53.086]
  - - [4096, 200, 1, 10240]
    - [37, 62.414]
  - - [1024, 512, 1, 9216]
    - [37, 63.19]
  - - [4096, 1024, 1, 64]
    - [22, 36.111]
  - - [4096, 200, 1, 1920]
    - [37, 58.922]
  - - [2048, 1024, 1, 1280]
    - [7, 77.004]
  - - [1024, 200, 1, 3840]
    - [82, 45.496]
  - - [256, 1024, 1, 512]
    - [16, 34.368]
  - - [2048, 1024, 1, 3328]
    - [31, 80.69]
  - - [1024, 256, 1, 16640]
    - [181, 65.937]
  - - [4096, 512, 1, 14336]
    - [8, 83.011]
  - - [1024, 1024, 1, 16640]
    - [100, 77.77]
  - - [1024, 256, 1, 1152]
    - [0, 43.205]
  - - [4096, 512, 1, 8320]
    - [8, 82.554]
  - - [2048, 512, 1, 7680]
    - [37, 78.656]
  - - [4096, 1024, 1, 6656]
    - [4, 87.686]
  - - [1024, 512, 1, 3584]
    - [0, 63.432]
  - - [1024, 1024, 1, 32]
    - [1, 12.815]
  - - [512, 512, 1, 2816]
    - [0, 50.254]
  - - [2048, 512, 1, 1664]
    - [85, 72.539]
  - - [1024, 1024, 1, 14336]
    - [50, 77.743]
  - - [2048, 200, 1, 2048]
    - [0, 48.592]
  - - [1024, 1024, 1, 3584]
    - [37, 77.654]
  - - [512, 200, 1, 1280]
    - [82, 24.819]
  - - [4096, 256, 1, 6656]
    - [37, 78.949]
  - - [4096, 256, 1, 4160]
    - [37, 78.382]
  - - [128, 256, 1, 1024]
    - [34, 4.893]
  - - [512, 200, 1, 3200]
    - [82, 24.968]
  - - [2048, 512, 1, 9216]
    - [37, 79.068]
  - - [2048, 1024, 1, 256]
    - [10, 59.446]
  - - [1024, 256, 1, 2304]
    - [0, 47.586]
  - - [1024, 200, 1, 8192]
    - [181, 44.665]
  - - [2048, 256, 1, 3072]
    - [56, 62.358]
  - - [2048, 256, 1, 8320]
    - [37, 64.096]
  - - [4096, 512, 1, 1024]
    - [7, 75.198]
  - - [1024, 512, 1, 3200]
    - [56, 63.007]
  - - [1024, 512, 1, 896]
    - [0, 54.988]
  - - [2048, 512, 1, 1280]
    - [85, 70.662]
  - - [4096, 200, 1, 64]
    - [0, 19.054]
  - - [1024, 256, 1, 6144]
    - [16, 51.08]
  - - [1024, 200, 1, 2560]
    - [0, 34.287]
  - - [1024, 1024, 1, 5120]
    - [37, 78.733]
  - - [2048, 512, 1, 6656]
    - [37, 78.028]
  - - [4096, 1024, 1, 1536]
    - [2, 83.55]
  - - [1024, 1024, 1, 128]
    - [0, 33.982]
  - - [512, 1024, 1, 1792]
    - [0, 61.01]
  - - [2048, 1024, 1, 32]
    - [1, 18.554]
  - - [4096, 256, 1, 2816]
    - [37, 77.008]
  - - [1024, 1024, 1, 15360]
    - [44, 77.374]
  - - [1024, 256, 1, 5632]
    - [56, 51.658]
  - - [1024, 1024, 1, 4096]
    - [37, 77.859]
  - - [2048, 200, 1, 4160]
    - [56, 51.159]
  - - [512, 256, 1, 768]
    - [47, 13.975]
  - - [4096, 512, 1, 640]
    - [8, 65.125]
  - - [2048, 512, 1, 8192]
    - [98, 76.024]
  - - [1024, 512, 1, 768]
    - [0, 52.904]
  - - [4096, 200, 1, 8320]
    - [37, 62.495]
  - - [2048, 512, 1, 896]
    - [22, 67.102]
  - - [4096, 200, 1, 7168]
    - [10, 61.513]
  - - [2048, 512, 1, 13312]
    - [50, 77.319]
  - - [2048, 200, 1, 3840]
    - [0, 51.216]
  - - [1024, 1024, 1, 768]
    - [22, 66.347]
  - - [4096, 512, 1, 16384]
    - [8, 82.444]
  - - [4096, 256, 1, 2304]
    - [37, 76.458]
  - - [1, 256, 1, 4096]
    - [165, 0.148]
  - - [1024, 1024, 1, 11264]
    - [50, 77.221]
  - - [2048, 200, 1, 16640]
    - [182, 55.195]
  - - [1024, 256, 1, 3072]
    - [16, 49.715]
  - - [4096, 1024, 1, 512]
    - [2, 75.373]
  - - [2048, 256, 1, 2816]
    - [0, 62.769]
  - - [32, 512, 1, 512]
    - [34, 1.424]
  - - [256, 512, 1, 2048]
    - [50, 26.113]
  - - [1024, 512, 1, 384]
    - [10, 42.798]
  - - [2048, 200, 1, 7680]
    - [185, 55.023]
  - - [1024, 512, 1, 4608]
    - [83, 61.862]
  - - [4096, 200, 1, 32]
    - [0, 10.363]
  - - [4096, 200, 1, 3328]
    - [37, 60.914]
  - - [1024, 200, 1, 1152]
    - [82, 37.438]
  - - [1024, 1024, 1, 1408]
    - [32, 72.956]
  - - [2048, 200, 1, 15360]
    - [182, 54.421]
  - - [512, 1024, 1, 2048]
    - [0, 59.74]
  - - [1024, 200, 1, 10240]
    - [82, 46.216]
  - - [4096, 256, 1, 5632]
    - [37, 79.044]
  - - [512, 512, 1, 3072]
    - [0, 50.688]
  - - [2048, 256, 1, 1408]
    - [0, 58.262]
  - - [2048, 256, 1, 6144]
    - [37, 63.282]
  - - [4096, 256, 1, 3328]
    - [37, 77.701]
  - - [1024, 200, 1, 1664]
    - [0, 29.752]
  - - [2048, 1024, 1, 1152]
    - [9, 76.084]
  - - [2048, 512, 1, 6144]
    - [37, 77.901]
  - - [2048, 512, 1, 3200]
    - [37, 75.646]
  - - [4096, 1024, 1, 2080]
    - [2, 90.937]
  - - [4096, 1024, 1, 768]
    - [2, 79.111]
  - - [4096, 1024, 1, 2560]
    - [2, 85.358]
  - - [64, 200, 1, 2048]
    - [175, 3.349]
  - - [2048, 200, 1, 4608]
    - [56, 50.691]
  - - [1024, 1024, 1, 6144]
    - [37, 78.639]
  - - [4096, 256, 1, 1664]
    - [37, 74.252]
  - - [2048, 200, 1, 384]
    - [16, 34.243]
  - - [1, 200, 1, 2048]
    - [180, 0.058]
  - - [4096, 256, 1, 1792]
    - [37, 74.478]
  - - [2048, 1024, 1, 64]
    - [1, 30.549]
  - - [4096, 1024, 1, 16384]
    - [101, 87.677]
  - - [1024, 512, 1, 16640]
    - [184, 71.263]
  - - [2048, 512, 1, 10240]
    - [37, 78.644]
  - - [4096, 512, 1, 6656]
    - [7, 81.888]
  - - [2048, 256, 1, 16640]
    - [181, 68.057]
  - - [2048, 512, 1, 2816]
    - [22, 75.48]
  - - [1024, 200, 1, 32]
    - [0, 3.836]
  - - [1, 512, 1, 4096]
    - [187, 0.28]
  - - [256, 256, 1, 1024]
    - [34, 17.184]
  - - [2048, 1024, 1, 128]
    - [22, 44.805]
  - - [2048, 1024, 1, 2080]
    - [6, 82.654]
  - - [2048, 1024, 1, 16640]
    - [14, 83.28]
  - - [1024, 200, 1, 384]
    - [82, 25.136]
  - - [4096, 256, 1, 384]
    - [10, 56.529]
  - - [4096, 256, 1, 13312]
    - [85, 78.86]
  - - [2048, 256, 1, 128]
    - [1, 10.537]
  - - [512, 256, 1, 2304]
    - [87, 28.041]
  - - [2048, 1024, 1, 3072]
    - [6, 80.919]
  - - [1024, 1024, 1, 640]
    - [10, 64.347]
  - - [256, 512, 1, 1024]
    - [56, 17.157]
  - - [4096, 1024, 1, 1408]
    - [97, 85.029]
  - - [4096, 200, 1, 5632]
    - [37, 61.37]
  - - [4096, 1024, 1, 2048]
    - [2, 84.782]
  - - [2048, 1024, 1, 2560]
    - [61, 79.983]
  - - [4096, 1024, 1, 128]
    - [2, 52.144]
  - - [1024, 200, 1, 3328]
    - [0, 36.845]
  - - [2048, 200, 1, 1152]
    - [0, 46.634]
  - - [1024, 200, 1, 9216]
    - [181, 46.484]
  - - [4096, 256, 1, 512]
    - [10, 61.721]
  - - [4096, 1024, 1, 14336]
    - [4, 88.591]
  - - [1024, 1024, 1, 384]
    - [10, 57.424]
  - - [2048, 200, 1, 512]
    - [56, 38.419]
  - - [2048, 256, 1, 9216]
    - [37, 67.504]
  - - [2048, 256, 1, 1792]
    - [0, 60.143]
  - - [4096, 512, 1, 9216]
    - [8, 82.898]
  - - [4096, 200, 1, 15360]
    - [85, 62.103]
  - - [64, 256, 1, 2048]
    - [175, 4.058]
  - - [4096, 200, 1, 1792]
    - [37, 58.443]
  - - [1, 200, 1, 4096]
    - [180, 0.109]
  - - [2048, 1024, 1, 2048]
    - [6, 80.381]
  - - [1024, 200, 1, 2080]
    - [82, 43.044]
  - - [2048, 200, 1, 1536]
    - [0, 47.255]
  - - [1024, 1024, 1, 3072]
    - [37, 77.589]
  - - [512, 200, 1, 1792]
    - [68, 20.052]
  - - [1024, 256, 1, 11264]
    - [181, 54.16]
  - - [2048, 512, 1, 12288]
    - [37, 78.226]
  - - [1024, 256, 1, 1792]
    - [56, 46.325]
  - - [1024, 200, 1, 7168]
    - [183, 42.143]
  - - [32, 256, 1, 1024]
    - [21, 2.319]
  - - [512, 256, 1, 3072]
    - [50, 30.239]
  - - [1024, 1024, 1, 2080]
    - [32, 77.885]
  - - [2048, 200, 1, 2304]
    - [0, 49.801]
  - - [4096, 512, 1, 1536]
    - [8, 78.682]
  - - [2048, 256, 1, 7168]
    - [37, 63.887]
  - - [2048, 512, 1, 1792]
    - [22, 72.876]
  - - [1024, 200, 1, 2048]
    - [56, 31.772]
  - - [1024, 1024, 1, 4608]
    - [32, 78.216]
  - - [4096, 256, 1, 8192]
    - [37, 78.939]
  - - [512, 1024, 1, 1280]
    - [0, 58.954]
  - - [2048, 1024, 1, 16384]
    - [14, 81.148]
  - - [512, 512, 1, 1280]
    - [0, 44.872]
  - - [1024, 200, 1, 1280]
    - [56, 26.76]
  - - [2048, 256, 1, 3200]
    - [0, 63.218]
  - - [2048, 512, 1, 15360]
    - [98, 77.209]
  - - [1024, 512, 1, 3328]
    - [0, 63.26]
  - - [1024, 512, 1, 4160]
    - [83, 62.328]
  - - [4096, 200, 1, 6656]
    - [37, 62.021]
  - - [4096, 1024, 1, 1024]
    - [2, 81.532]
  - - [2048, 200, 1, 3328]
    - [56, 51.066]
  - - [1024, 1024, 1, 256]
    - [85, 48.197]
  - - [512, 200, 1, 512]
    - [0, 18.317]
  - - [2048, 256, 1, 64]
    - [70, 15.274]
  - - [1024, 256, 1, 2560]
    - [0, 48.858]
  - - [2048, 512, 1, 11264]
    - [37, 76.511]
  - - [32, 200, 1, 1024]
    - [21, 1.79]
  - - [32, 512, 1, 2048]
    - [188, 4.042]
  - - [2048, 256, 1, 2304]
    - [56, 61.721]
  - - [2048, 256, 1, 12288]
    - [181, 65.171]
  - - [4096, 200, 1, 8192]
    - [37, 62.435]
  - - [1024, 512, 1, 7168]
    - [83, 62.473]
  - - [1024, 512, 1, 1792]
    - [0, 60.228]
  - - [4096, 1024, 1, 1664]
    - [2, 87.158]
  - - [4096, 200, 1, 2816]
    - [37, 60.094]
  - - [1024, 1024, 1, 896]
    - [32, 69.297]
  - - [1024, 200, 1, 8320]
    - [181, 44.554]
  - - [1024, 1024, 1, 12288]
    - [37, 78.565]
  - - [1024, 256, 1, 8320]
    - [205, 54.703]
  - - [1024, 200, 1, 1024]
    - [56, 23.026]
  - - [1024, 200, 1, 16640]
    - [182, 48.895]
  - - [4096, 256, 1, 5120]
    - [37, 79.171]
  - - [1024, 256, 1, 3200]
    - [0, 49.94]
  - - [512, 512, 1, 2560]
    - [0, 49.337]
  - - [4096, 256, 1, 2048]
    - [37, 74.964]
  - - [1024, 256, 1, 640]
    - [16, 37.43]
  - - [2048, 256, 1, 5120]
    - [37, 63.951]
  - - [2048, 256, 1, 7680]
    - [37, 64.234]
  - - [4096, 512, 1, 384]
    - [30, 65.156]
  - - [2048, 200, 1, 3584]
    - [56, 51.087]
  - - [1024, 512, 1, 1536]
    - [0, 59.496]
  - - [4096, 512, 1, 3328]
    - [8, 80.773]
  - - [4096, 1024, 1, 256]
    - [66, 66.287]
  - - [2048, 200, 1, 64]
    - [0, 12.703]
  - - [2048, 200, 1, 4096]
    - [0, 49.841]
  - - [1024, 1024, 1, 1536]
    - [32, 73.839]
  - - [2048, 1024, 1, 7168]
    - [8, 82.737]
  - - [1024, 256, 1, 3584]
    - [0, 50.346]
  - - [4096, 256, 1, 32]
    - [1, 13.502]
  - - [4096, 256, 1, 1280]
    - [37, 72.353]
  - - [512, 512, 1, 3200]
    - [0, 50.812]
  - - [2048, 1024, 1, 1536]
    - [31, 77.755]
  - - [2048, 256, 1, 1024]
    - [37, 54.616]
  - - [128, 200, 1, 512]
    - [48, 2.195]
  - - [4096, 512, 1, 7168]
    - [8, 82.697]
  - - [1024, 512, 1, 1152]
    - [0, 57.303]
  - - [64, 1024, 1, 2048]
    - [58, 20.029]
  - - [2048, 512, 1, 3328]
    - [22, 76.343]
  - - [4096, 1024, 1, 896]
    - [10, 80.842]
  - - [1, 1024, 1, 2048]
    - [177, 0.296]
  - - [4096, 200, 1, 3584]
    - [37, 61.059]
  - - [4096, 1024, 1, 4096]
    - [4, 86.807]
  - - [1024, 256, 1, 14336]
    - [181, 62.82]
  - - [2048, 200, 1, 256]
    - [10, 28.467]
  - - [4096, 256, 1, 16384]
    - [26, 73.213]
  - - [4096, 256, 1, 1920]
    - [37, 75.609]
  - - [32, 1024, 1, 512]
    - [48, 2.846]
  - - [1024, 256, 1, 7680]
    - [181, 54.201]
  - - [2048, 256, 1, 1664]
    - [56, 59.39]
  - - [512, 200, 1, 1536]
    - [81, 29.658]
  - - [2048, 1024, 1, 6144]
    - [8, 82.599]
  - - [512, 256, 1, 2816]
    - [87, 29.494]
  - - [4096, 512, 1, 4160]
    - [8, 81.417]
  - - [4096, 512, 1, 2080]
    - [8, 80.998]
  - - [2048, 256, 1, 15360]
    - [181, 68.141]
  - - [4096, 200, 1, 5120]
    - [37, 61.631]
  - - [1024, 512, 1, 8192]
    - [85, 62.458]
  - - [4096, 200, 1, 896]
    - [10, 54.05]
  - - [2048, 512, 1, 8320]
    - [37, 78.117]
  - - [1024, 1024, 1, 10240]
    - [32, 78.351]
  - - [1024, 200, 1, 768]
    - [56, 19.605]
  - - [2048, 200, 1, 640]
    - [0, 39.644]
  - - [512, 200, 1, 2048]
    - [17, 20.767]
  - - [1024, 1024, 1, 9216]
    - [37, 79.821]
  - - [4096, 200, 1, 1408]
    - [0, 57.692]
  - - [1024, 256, 1, 13312]
    - [181, 62.133]
  - - [1024, 256, 1, 128]
    - [0, 14.972]
  - - [2048, 200, 1, 5632]
    - [0, 50.393]
  - - [64, 1024, 1, 512]
    - [34, 12.098]
  - - [1024, 512, 1, 2560]
    - [0, 63.007]
  - - [4096, 200, 1, 1280]
    - [0, 57.21]
  - - [1024, 200, 1, 4096]
    - [56, 37.724]
  - - [1024, 1024, 1, 2560]
    - [37, 75.751]
  - - [2048, 512, 1, 64]
    - [1, 23.086]
  - - [2048, 200, 1, 8192]
    - [185, 49.466]
  - - [2048, 512, 1, 3072]
    - [37, 76.004]
  - - [4096, 1024, 1, 5120]
    - [4, 87.133]
  - - [4096, 256, 1, 640]
    - [37, 63.671]
  - - [1024, 256, 1, 1280]
    - [0, 44.607]
  - - [2048, 1024, 1, 1920]
    - [92, 79.414]
  - - [2048, 256, 1, 4096]
    - [10, 62.278]
  - - [2048, 1024, 1, 15360]
    - [8, 83.579]
  - - [4096, 200, 1, 16384]
    - [54, 62.705]
  - - [1, 1024, 1, 4096]
    - [164, 0.477]
  - - [4096, 1024, 1, 2816]
    - [2, 85.618]
  - - [4096, 200, 1, 1664]
    - [37, 58.395]
  - - [4096, 512, 1, 256]
    - [30, 59.012]
  - - [1024, 200, 1, 896]
    - [56, 20.977]
  - - [2048, 200, 1, 6656]
    - [185, 52.23]
  - - [2048, 1024, 1, 5120]
    - [8, 81.601]
  - - [512, 1024, 1, 768]
    - [0, 53.371]
  - - [2048, 512, 1, 14336]
    - [50, 77.036]
  - - [2048, 200, 1, 8320]
    - [185, 50.271]
  - - [4096, 256, 1, 3840]
    - [37, 78.827]
  - - [2048, 1024, 1, 4096]
    - [92, 81.412]
  - - [1024, 1024, 1, 3200]
    - [83, 77.428]
  - - [1024, 256, 1, 4608]
    - [0, 51.02]
  - - [4096, 512, 1, 4608]
    - [8, 81.939]
  - - [4096, 512, 1, 1664]
    - [102, 78.359]
  - - [4096, 256, 1, 4608]
    - [37, 79.097]
  - - [1024, 512, 1, 32]
    - [22, 2.81]
  - - [1024, 512, 1, 3840]
    - [0, 63.849]
  - - [2048, 512, 1, 1920]
    - [22, 74.065]
  - - [2048, 1024, 1, 896]
    - [31, 74.741]
  - - [4096, 200, 1, 6144]
    - [37, 61.805]
  - - [1024, 512, 1, 13312]
    - [183, 65.871]
  - - [4096, 1024, 1, 4160]
    - [4, 86.772]
  - - [2048, 200, 1, 2816]
    - [0, 50.812]
  - - [1024, 1024, 1, 3840]
    - [37, 78.418]
  - - [128, 1024, 1, 1024]
    - [56, 16.927]
  - - [2048, 1024, 1, 11264]
    - [14, 82.801]
  - - [2048, 1024, 1, 384]
    - [9, 65.746]
  - - [1024, 256, 1, 2048]
    - [16, 47.071]
  - - [2048, 1024, 1, 3840]
    - [8, 82.034]
  - - [4096, 256, 1, 8320]
    - [37, 79.977]
  - - [2048, 256, 1, 3840]
    - [0, 63.537]
  - - [64, 256, 1, 512]
    - [18, 3.375]
  - - [4096, 512, 1, 1280]
    - [7, 76.76]
  - - [512, 256, 1, 1280]
    - [0, 19.161]
  - - [1024, 512, 1, 7680]
    - [37, 63.16]
  - - [4096, 1024, 1, 1152]
    - [2, 82.82]
  - - [256, 200, 1, 512]
    - [56, 4.172]
  - - [256, 1024, 1, 2048]
    - [0, 47.722]
  - - [2048, 200, 1, 10240]
    - [185, 51.858]
  - - [2048, 512, 1, 5120]
    - [37, 77.746]
  - - [2048, 1024, 1, 1408]
    - [92, 77.638]
  - - [512, 1024, 1, 512]
    - [54, 46.529]
  - - [1024, 200, 1, 11264]
    - [181, 48.597]
  - - [2048, 512, 1, 32]
    - [1, 13.624]
  - - [4096, 256, 1, 2560]
    - [37, 76.711]
  - - [4096, 256, 1, 64]
    - [1, 22.57]
  - - [32, 1024, 1, 1024]
    - [0, 8.543]
  - - [2048, 200, 1, 768]
    - [0, 42.701]
  - - [512, 512, 1, 2048]
    - [0, 47.441]
  - - [2048, 512, 1, 2560]
    - [85, 74.999]
  - - [512, 256, 1, 512]
    - [0, 10.406]
  - - [1024, 200, 1, 7680]
    - [181, 43.735]
  - - [4096, 512, 1, 896]
    - [11, 73.572]
  - - [4096, 1024, 1, 3072]
    - [4, 85.911]
  - - [4096, 200, 1, 13312]
    - [37, 62.47]
  - - [2048, 512, 1, 7168]
    - [37, 77.94]
  - - [2048, 1024, 1, 2816]
    - [31, 80.406]
  - - [2048, 512, 1, 128]
    - [22, 35.166]
  - - [1024, 256, 1, 8192]
    - [16, 51.233]
  - - [4096, 1024, 1, 1792]
    - [2, 84.093]
  - - [1024, 200, 1, 6656]
    - [181, 41.694]
  - - [4096, 200, 1, 2304]
    - [37, 59.649]
  - - [4096, 512, 1, 1152]
    - [8, 75.766]
  - - [512, 200, 1, 1024]
    - [82, 22.94]
  - - [1024, 256, 1, 3840]
    - [0, 50.801]
  - - [512, 512, 1, 768]
    - [56, 23.994]
  - - [2048, 512, 1, 4096]
    - [37, 76.687]
  - - [2048, 256, 1, 2560]
    - [0, 62.681]
  - - [2048, 256, 1, 4160]
    - [56, 63.578]
  - - [1024, 256, 1, 64]
    - [1, 2.945]
  - - [4096, 512, 1, 7680]
    - [8, 82.774]
  - - [1024, 512, 1, 1664]
    - [0, 60.301]
  - - [2048, 512, 1, 2080]
    - [37, 76.971]
  - - [2048, 512, 1, 3840]
    - [37, 76.695]
  - - [4096, 1024, 1, 384]
    - [10, 71.865]
  - - [4096, 200, 1, 3072]
    - [37, 60.811]
  - - [1024, 512, 1, 14336]
    - [181, 66.599]
  - - [1024, 200, 1, 1920]
    - [82, 42.092]
  - - [1024, 1024, 1, 1664]
    - [32, 74.112]
  - - [512, 1024, 1, 2304]
    - [0, 63.08]
  - - [2048, 1024, 1, 1792]
    - [92, 78.957]
  - - [32, 200, 1, 512]
    - [81, 1.262]
  - - [4096, 256, 1, 11264]
    - [85, 78.289]
  - - [4096, 256, 1, 1408]
    - [37, 72.716]
  - - [1024, 256, 1, 7168]
    - [181, 52.199]
  - - [2048, 256, 1, 1152]
    - [0, 56.471]
  - - [256, 256, 1, 512]
    - [21, 12.707]
  - - [1024, 512, 1, 1280]
    - [0, 57.497]
  - - [512, 512, 1, 1792]
    - [56, 37.21]
  - - [2048, 200, 1, 12288]
    - [185, 53.133]
  - - [2048, 200, 1, 1664]
    - [56, 47.769]
  - - [4096, 200, 1, 4608]
    - [37, 62.064]
  - - [512, 1024, 1, 2560]
    - [0, 62.681]
  - - [4096, 200, 1, 384]
    - [10, 45.584]
  - - [128, 512, 1, 512]
    - [0, 12.498]
  - - [1024, 200, 1, 256]
    - [0, 19.527]
  - - [256, 1024, 1, 1024]
    - [16, 43.051]
  - - [2048, 200, 1, 128]
    - [56, 20.545]
  - - [2048, 200, 1, 11264]
    - [185, 52.599]
  - - [1024, 512, 1, 1920]
    - [0, 60.893]
  - - [4096, 256, 1, 1536]
    - [37, 69.4]
  - - [4096, 1024, 1, 3584]
    - [4, 86.388]
  - - [2048, 256, 1, 256]
    - [10, 36.22]
  - - [2048, 1024, 1, 768]
    - [66, 73.243]
  - - [4096, 256, 1, 10240]
    - [10, 78.939]
  - - [2048, 256, 1, 10240]
    - [37, 64.041]
  - - [4096, 200, 1, 14336]
    - [85, 61.815]
  - - [1024, 512, 1, 5120]
    - [0, 63.337]
  - - [1024, 512, 1, 8320]
    - [37, 63.393]
  - - [256, 200, 1, 2048]
    - [17, 16.351]
  - - [1024, 200, 1, 640]
    - [16, 17.167]
  - - [1024, 512, 1, 10240]
    - [37, 63.254]
  - - [1024, 200, 1, 4160]
    - [82, 46.203]
  - - [1024, 200, 1, 5632]
    - [0, 40.174]
  - - [1024, 1024, 1, 2048]
    - [37, 72.601]
  - - [1024, 256, 1, 6656]
    - [56, 51.36]
  - - [2048, 1024, 1, 8320]
    - [8, 82.981]
  - - [1024, 256, 1, 10240]
    - [185, 52.574]
  - - [2048, 256, 1, 2080]
    - [0, 64.411]
  - - [4096, 256, 1, 128]
    - [10, 34.367]
  - - [1024, 256, 1, 768]
    - [0, 23.804]
  - - [2048, 256, 1, 896]
    - [0, 54.284]
  - - [64, 512, 1, 2048]
    - [78, 10.465]
  - - [4096, 512, 1, 2048]
    - [8, 79.95]
  - - [512, 256, 1, 2048]
    - [60, 33.697]
  - - [4096, 256, 1, 16640]
    - [85, 78.609]
  - - [4096, 512, 1, 2560]
    - [8, 79.983]
  - - [1024, 512, 1, 15360]
    - [184, 69.96]
  - - [4096, 1024, 1, 2304]
    - [2, 84.795]
  - - [4096, 200, 1, 1152]
    - [0, 56.481]
  - - [2048, 200, 1, 6144]
    - [185, 51.871]
  - - [1024, 1024, 1, 7680]
    - [37, 79.258]
  - - [2048, 200, 1, 1920]
    - [0, 49.708]
  - - [32, 1024, 1, 2048]
    - [53, 9.982]
  - - [1024, 200, 1, 3584]
    - [82, 45.5]
  - - [4096, 256, 1, 2080]
    - [37, 77.824]
  - - [1024, 1024, 1, 16384]
    - [103, 72.698]
  - - [1024, 256, 1, 1408]
    - [0, 44.715]
  - - [1024, 256, 1, 4096]
    - [16, 49.027]
  - - [2048, 200, 1, 14336]
    - [182, 54.05]
  - - [4096, 512, 1, 5120]
    - [8, 81.905]
  - - [1024, 512, 1, 6144]
    - [37, 62.304]
  - - [1024, 512, 1, 2304]
    - [0, 61.932]
  - - [4096, 200, 1, 4160]
    - [37, 61.334]
  - - [4096, 200, 1, 1536]
    - [37, 58.161]
  - - [4096, 1024, 1, 6144]
    - [4, 87.636]
  - - [256, 64, 1, 1225]
    - [34, 2.575]
  - - [2048, 320, 1, 64]
    - [56, 17.665]
  - - [1024, 128, 1, 289]
    - [41, 13.656]
  - - [384, 64, 1, 1225]
    - [34, 3.837]
  - - [2048, 384, 1, 64]
    - [1, 20.074]
  - - [64, 80, 1, 5329]
    - [169, 3.021]
  - - [1024, 384, 1, 289]
    - [1, 30.125]
  - - [2048, 448, 1, 64]
    - [0, 20.514]
  - - [768, 192, 1, 289]
    - [56, 6.896]
  - - [288, 64, 1, 1225]
    - [18, 4.988]
  - - [384, 96, 1, 1225]
    - [17, 9.784]
  - - [1024, 3392, 1, 4096]
    - [3, 86.311]
  - - [1024, 3301, 1, 4096]
    - [105, 85.768]
  - - [1024, 3443, 1, 4096]
    - [3, 87.758]
  - - [132, 134, 480, 64]
    - [106, 23.015]
  - - [162, 162, 400, 64]
    - [1, 26.079]
  - - [4096, 3548, 1, 1024]
    - [3, 87.552]
  - - [4096, 2977, 1, 1024]
    - [2, 86.692]
  - - [132, 135, 480, 64]
    - [106, 23.165]
  - - [1024, 2985, 1, 4096]
    - [8, 86.751]
  - - [33708, 3681, 1, 1024]
    - [15, 91.582]
  - - [4096, 3443, 1, 1024]
    - [2, 87.898]
  - - [1024, 3400, 1, 4096]
    - [3, 86.641]
  - - [4096, 3995, 1, 1024]
    - [3, 87.431]
  - - [4096, 3190, 1, 1024]
    - [2, 86.685]
  - - [4096, 3594, 1, 1024]
    - [3, 88.653]
  - - [159, 162, 400, 64]
    - [1, 25.662]
  - - [1024, 3565, 1, 4096]
    - [111, 89.541]
  - - [4096, 3422, 1, 1024]
    - [2, 87.504]
  - - [1024, 3214, 1, 4096]
    - [2, 89.785]
  - - [33708, 3584, 1, 1024]
    - [97, 92.273]
  - - [33708, 3640, 1, 1024]
    - [15, 92.849]
  - - [4096, 3263, 1, 1024]
    - [2, 87.623]
  - - [4096, 3296, 1, 1024]
    - [3, 87.184]
  - - [1024, 3557, 1, 4096]
    - [111, 89.444]
  - - [4096, 3463, 1, 1024]
    - [2, 88.721]
  - - [4096, 3528, 1, 1024]
    - [3, 86.92]
  - - [4096, 3226, 1, 1024]
    - [2, 87.374]
  - - [4096, 3439, 1, 1024]
    - [2, 87.784]
  - - [1024, 3523, 1, 4096]
    - [3, 84.113]
  - - [1024, 3098, 1, 4096]
    - [2, 86.655]
  - - [4096, 3121, 1, 1024]
    - [3, 87.468]
  - - [33708, 3894, 1, 1024]
    - [15, 92.149]
  - - [1024, 3548, 1, 4096]
    - [3, 84.774]
  - - [1024, 3451, 1, 4096]
    - [4, 90.223]
  - - [4096, 3353, 1, 1024]
    - [3, 88.592]
  - - [4096, 3402, 1, 1024]
    - [73, 87.241]
  - - [4096, 3939, 1, 1024]
    - [3, 86.205]
  - - [133, 133, 480, 64]
    - [107, 22.654]
  - - [1024, 3559, 1, 4096]
    - [3, 85.123]
  - - [1024, 2977, 1, 4096]
    - [8, 86.519]
  - - [1024, 3478, 1, 4096]
    - [3, 88.51]
  - - [134, 134, 480, 64]
    - [106, 23.254]
  - - [1024, 3368, 1, 4096]
    - [3, 85.799]
  - - [4096, 4012, 1, 1024]
    - [3, 87.691]
  - - [4096, 3486, 1, 1024]
    - [2, 88.804]
  - - [1024, 3479, 1, 4096]
    - [3, 88.479]
  - - [1024, 3505, 1, 4096]
    - [3, 89.321]
  - - [4096, 3381, 1, 1024]
    - [2, 86.863]
  - - [4096, 3430, 1, 1024]
    - [2, 88.789]
  - - [1024, 3554, 1, 4096]
    - [29, 89.353]
  - - [4096, 3271, 1, 1024]
    - [3, 86.668]
  - - [1024, 3063, 1, 4096]
    - [8, 88.487]
  - - [1024, 3209, 1, 4096]
    - [2, 89.928]
  - - [4096, 3503, 1, 1024]
    - [2, 89.225]
  - - [4096, 3344, 1, 1024]
    - [3, 88.466]
  - - [1024, 3147, 1, 4096]
    - [2, 88.257]
  - - [1024, 3322, 1, 4096]
    - [4, 86.887]
  - - [1024, 3341, 1, 4096]
    - [3, 84.946]
  - - [1024, 3516, 1, 4096]
    - [2, 89.569]
  - - [102, 101, 624, 64]
    - [66, 20.763]
  - - [1024, 3454, 1, 4096]
    - [4, 90.615]
  - - [4096, 3969, 1, 1024]
    - [3, 86.243]
  - - [4096, 3466, 1, 1024]
    - [2, 88.701]
  - - [1024, 3999, 1, 1024]
    - [10, 79.201]
  - - [1024, 4032, 1, 1024]
    - [10, 80.564]
  - - [1024, 3403, 1, 4096]
    - [3, 86.859]
  - - [4096, 3361, 1, 1024]
    - [11, 86.295]
  - - [1024, 3527, 1, 4096]
    - [3, 84.017]
  - - [1024, 3822, 1, 4096]
    - [2, 86.267]
  - - [4096, 3315, 1, 1024]
    - [3, 87.748]
  - - [232, 232, 272, 64]
    - [22, 29.222]
  - - [1024, 3336, 1, 4096]
    - [3, 84.729]
  - - [228, 232, 272, 64]
    - [10, 28.56]
  - - [4096, 3547, 1, 1024]
    - [3, 87.55]
  - - [4096, 3340, 1, 1024]
    - [3, 88.298]
  - - [1024, 3906, 1, 1024]
    - [37, 81.42]
  - - [1024, 3295, 1, 4096]
    - [10, 86.926]
  - - [4096, 3294, 1, 1024]
    - [3, 87.29]
  - - [33708, 3968, 1, 1024]
    - [2, 91.775]
  - - [1024, 3473, 1, 4096]
    - [3, 88.379]
  - - [1024, 3072, 1, 4096]
    - [8, 89.006]
  - - [4096, 3189, 1, 1024]
    - [2, 86.62]
  - - [4096, 3494, 1, 1024]
    - [2, 89.008]
  - - [1024, 3522, 1, 4096]
    - [3, 84.377]
  - - [33708, 3944, 1, 1024]
    - [2, 91.276]
  - - [135, 135, 480, 64]
    - [106, 23.084]
  - - [4096, 3421, 1, 1024]
    - [2, 87.455]
  - - [4096, 3311, 1, 1024]
    - [3, 87.397]
  - - [1024, 3990, 1, 1024]
    - [10, 79.523]
  - - [1024, 3290, 1, 4096]
    - [10, 86.952]
  - - [4096, 3565, 1, 1024]
    - [3, 87.88]
  - - [1024, 3484, 1, 4096]
    - [3, 88.647]
  - - [4096, 3384, 1, 1024]
    - [2, 87.483]
  - - [1024, 3422, 1, 4096]
    - [3, 86.97]
  - - [4096, 3681, 1, 1024]
    - [2, 88.647]
  - - [1024, 3584, 1, 1024]
    - [10, 79.813]
  - - [4096, 4050, 1, 1024]
    - [3, 88.399]
  - - [1024, 3996, 1, 4096]
    - [4, 84.451]
  - - [4096, 3169, 1, 1024]
    - [2, 86.263]
  - - [4096, 3538, 1, 1024]
    - [3, 87.26]
  - - [1024, 3495, 1, 4096]
    - [3, 88.971]
  - - [4096, 3401, 1, 1024]
    - [2, 87.262]
  - - [1024, 3560, 1, 4096]
    - [111, 89.585]
  - - [133, 135, 480, 64]
    - [106, 22.701]
  - - [1024, 3263, 1, 4096]
    - [2, 89.78]
  - - [1024, 3870, 1, 4096]
    - [148, 87.238]
  - - [4096, 3555, 1, 1024]
    - [3, 87.645]
  - - [4096, 3412, 1, 1024]
    - [2, 88.594]
  - - [101, 101, 624, 64]
    - [13, 20.628]
  - - [1024, 3296, 1, 4096]
    - [10, 87.306]
  - - [1024, 3379, 1, 4096]
    - [3, 86.33]
  - - [4096, 3302, 1, 1024]
    - [3, 87.282]
  - - [1024, 3490, 1, 4096]
    - [3, 89.011]
  - - [1024, 3428, 1, 4096]
    - [3, 87.122]
  - - [1024, 3976, 1, 4096]
    - [4, 84.16]
  - - [4096, 3485, 1, 1024]
    - [2, 88.935]
  - - [4096, 3534, 1, 1024]
    - [3, 86.283]
  - - [1024, 3064, 1, 4096]
    - [8, 88.57]
  - - [4096, 3216, 1, 1024]
    - [2, 87.278]
  - - [1024, 3450, 1, 4096]
    - [3, 87.875]
  - - [1024, 3533, 1, 4096]
    - [3, 84.416]
  - - [1024, 4030, 1, 1024]
    - [10, 80.016]
  - - [1024, 3311, 1, 4096]
    - [4, 86.707]
  - - [1024, 3468, 1, 4096]
    - [3, 88.392]
  - - [4096, 3359, 1, 1024]
    - [3, 88.825]
  - - [4096, 3392, 1, 1024]
    - [7, 87.162]
  - - [1024, 3925, 1, 1024]
    - [10, 81.35]
  - - [4096, 3233, 1, 1024]
    - [2, 87.363]
  - - [4096, 3956, 1, 1024]
    - [3, 86.467]
  - - [1024, 3463, 1, 4096]
    - [3, 88.242]
  - - [1024, 3126, 1, 4096]
    - [10, 82.919]
  - - [1024, 3363, 1, 4096]
    - [3, 85.059]
  - - [4096, 3465, 1, 1024]
    - [2, 88.736]
  - - [33708, 3996, 1, 1024]
    - [15, 92.275]
  - - [1024, 3231, 1, 4096]
    - [10, 85.5]
  - - [33708, 3978, 1, 1024]
    - [15, 91.811]
  - - [4096, 3476, 1, 1024]
    - [2, 88.765]
  - - [85, 85, 752, 64]
    - [0, 21.917]
  - - [4096, 3339, 1, 1024]
    - [3, 88.296]
  - - [4096, 3452, 1, 1024]
    - [2, 87.926]
  - - [1024, 3396, 1, 4096]
    - [3, 86.45]
  - - [4096, 3293, 1, 1024]
    - [3, 87.055]
  - - [1024, 3432, 1, 4096]
    - [3, 87.154]
  - - [4096, 3493, 1, 1024]
    - [2, 89.007]
  - - [4096, 3350, 1, 1024]
    - [3, 88.538]
  - - [1024, 3079, 1, 4096]
    - [2, 86.155]
  - - [1024, 3101, 1, 4096]
    - [10, 82.049]
  - - [33708, 3939, 1, 1024]
    - [2, 91.124]
  - - [4096, 3256, 1, 1024]
    - [2, 87.672]
  - - [1024, 3439, 1, 4096]
    - [3, 87.259]
  - - [1024, 3510, 1, 4096]
    - [8, 89.694]
  - - [4096, 3900, 1, 1024]
    - [2, 87.791]
  - - [1024, 3470, 1, 4096]
    - [3, 88.24]
  - - [4096, 3456, 1, 1024]
    - [2, 89.628]
  - - [4096, 3014, 1, 1024]
    - [2, 88.04]
  - - [4096, 3367, 1, 1024]
    - [11, 85.65]
  - - [4096, 3432, 1, 1024]
    - [2, 88.553]
  - - [33708, 4026, 1, 1024]
    - [15, 92.563]
  - - [4096, 3273, 1, 1024]
    - [3, 86.515]
  - - [4096, 3130, 1, 1024]
    - [3, 88.834]
  - - [1024, 3496, 1, 4096]
    - [3, 89.081]
  - - [1024, 3995, 1, 4096]
    - [4, 84.524]
  - - [1024, 3939, 1, 4096]
    - [4, 83.107]
  - - [1024, 3121, 1, 4096]
    - [37, 82.636]
  - - [1024, 3232, 1, 4096]
    - [10, 85.622]
  - - [4096, 3147, 1, 1024]
    - [3, 88.903]
  - - [4096, 3516, 1, 1024]
    - [2, 89.34]
  - - [1024, 3969, 1, 1024]
    - [10, 79.305]
  - - [1024, 3364, 1, 4096]
    - [3, 85.494]
  - - [4096, 3411, 1, 1024]
    - [2, 87.223]
  - - [147, 147, 432, 64]
    - [0, 25.116]
  - - [4096, 3301, 1, 1024]
    - [3, 87.414]
  - - [112, 111, 576, 64]
    - [0, 24.413]
  - - [1024, 3513, 1, 4096]
    - [3, 89.272]
  - - [1024, 3469, 1, 4096]
    - [3, 88.472]
  - - [1024, 3095, 1, 4096]
    - [2, 86.824]
  - - [4096, 3533, 1, 1024]
    - [3, 86.955]
  - - [4096, 3390, 1, 1024]
    - [11, 86.172]
  - - [4096, 3582, 1, 1024]
    - [3, 88.727]
  - - [1024, 3956, 1, 1024]
    - [10, 79.045]
  - - [4096, 3585, 1, 1024]
    - [3, 88.627]
  - - [4096, 3231, 1, 1024]
    - [2, 86.999]
  - - [1024, 3205, 1, 4096]
    - [2, 89.411]
  - - [4096, 3496, 1, 1024]
    - [2, 88.963]
  - - [1024, 3143, 1, 4096]
    - [2, 88.269]
  - - [1024, 3318, 1, 4096]
    - [4, 87.047]
  - - [1024, 3353, 1, 4096]
    - [3, 85.474]
  - - [1024, 3464, 1, 4096]
    - [3, 88.241]
  - - [4096, 2736, 1, 1024]
    - [2, 85.425]
  - - [1024, 3402, 1, 4096]
    - [3, 86.694]
  - - [4096, 3138, 1, 1024]
    - [3, 89.075]
  - - [1024, 3860, 1, 4096]
    - [2, 87.305]
  - - [148, 148, 432, 64]
    - [0, 25.894]
  - - [1024, 3539, 1, 4096]
    - [3, 84.474]
  - - [4096, 3211, 1, 1024]
    - [2, 87.08]
  - - [1024, 3332, 1, 4096]
    - [3, 84.992]
  - - [1024, 3466, 1, 4096]
    - [3, 88.418]
  - - [4096, 3475, 1, 1024]
    - [2, 88.812]
  - - [4096, 3524, 1, 1024]
    - [3, 86.926]
  - - [4096, 2985, 1, 1024]
    - [2, 86.911]
  - - [4096, 3222, 1, 1024]
    - [2, 87.416]
  - - [4096, 3451, 1, 1024]
    - [2, 87.948]
  - - [1024, 3181, 1, 4096]
    - [10, 84.449]
  - - [1024, 3640, 1, 4096]
    - [29, 91.006]
  - - [1024, 3375, 1, 4096]
    - [3, 85.729]
  - - [1024, 3550, 1, 4096]
    - [3, 84.736]
  - - [1024, 4020, 1, 1024]
    - [10, 80.155]
  - - [4096, 3349, 1, 1024]
    - [3, 88.388]
  - - [4096, 3398, 1, 1024]
    - [2, 87.197]
  - - [33708, 3976, 1, 1024]
    - [15, 91.855]
  - - [1024, 2917, 1, 4096]
    - [8, 84.984]
  - - [33708, 3910, 1, 1024]
    - [15, 92.455]
  - - [4096, 3860, 1, 1024]
    - [2, 87.422]
  - - [4096, 3304, 1, 1024]
    - [3, 87.359]
  - - [1024, 3286, 1, 4096]
    - [10, 86.931]
  - - [1024, 3460, 1, 4096]
    - [3, 88.156]
  - - [1024, 4026, 1, 4096]
    - [4, 85.038]
  - - [4096, 3471, 1, 1024]
    - [2, 88.793]
  - - [193, 193, 320, 64]
    - [10, 25.466]
  - - [1024, 3894, 1, 1024]
    - [6, 82.002]
  - - [65, 65, 992, 64]
    - [15, 16.674]
  - - [1024, 3506, 1, 4096]
    - [3, 88.935]
  - - [1024, 4000, 1, 1024]
    - [10, 79.992]
  - - [1024, 3900, 1, 4096]
    - [74, 88.021]
  - - [1024, 3445, 1, 4096]
    - [3, 87.498]
  - - [4096, 3442, 1, 1024]
    - [2, 88.854]
  - - [1024, 3358, 1, 4096]
    - [3, 85.521]
  - - [1024, 3211, 1, 4096]
    - [2, 89.903]
  - - [4096, 3515, 1, 1024]
    - [2, 89.087]
  - - [1024, 3564, 1, 4096]
    - [111, 89.628]
  - - [4096, 3057, 1, 1024]
    - [2, 88.694]
  - - [1024, 3343, 1, 4096]
    - [3, 85.223]
  - - [4096, 3262, 1, 1024]
    - [2, 87.584]
  - - [1024, 3518, 1, 4096]
    - [8, 89.668]
  - - [77, 77, 816, 64]
    - [0, 17.966]
  - - [33708, 3876, 1, 1024]
    - [142, 92.295]
  - - [4096, 3462, 1, 1024]
    - [2, 88.695]
  - - [1024, 3265, 1, 4096]
    - [10, 86.594]
  - - [4096, 3389, 1, 1024]
    - [2, 87.326]
  - - [4096, 3438, 1, 1024]
    - [2, 87.759]
  - - [1024, 3955, 1, 1024]
    - [10, 79.26]
  - - [1024, 3545, 1, 4096]
    - [3, 84.542]
  - - [1024, 3144, 1, 4096]
    - [10, 83.49]
  - - [1024, 3417, 1, 4096]
    - [3, 87.017]
  - - [4096, 3543, 1, 1024]
    - [3, 87.337]
  - - [4096, 3352, 1, 1024]
    - [3, 88.479]
  - - [33708, 3975, 1, 1024]
    - [15, 91.771]
  - - [148, 147, 432, 64]
    - [0, 25.287]
  - - [4096, 3137, 1, 1024]
    - [3, 88.767]
  - - [4096, 3506, 1, 1024]
    - [37, 86.593]
  - - [1024, 3975, 1, 1024]
    - [10, 79.224]
  - - [1024, 3859, 1, 4096]
    - [2, 87.459]
  - - [4096, 3369, 1, 1024]
    - [2, 87.267]
  - - [1024, 3434, 1, 4096]
    - [3, 87.26]
  - - [1024, 3292, 1, 4096]
    - [10, 86.932]
  - - [4096, 3523, 1, 1024]
    - [3, 86.912]
  - - [4096, 3380, 1, 1024]
    - [11, 85.93]
  - - [1024, 3408, 1, 4096]
    - [3, 86.585]
  - - [4096, 3221, 1, 1024]
    - [2, 87.389]
  - - [4096, 3270, 1, 1024]
    - [3, 86.666]
  - - [143, 143, 432, 64]
    - [0, 24.336]
  - - [111, 111, 576, 64]
    - [47, 21.799]
  - - [1024, 3303, 1, 4096]
    - [3, 84.115]
  - - [4096, 3502, 1, 1024]
    - [2, 89.056]
  - - [1024, 3222, 1, 4096]
    - [10, 85.334]
  - - [4096, 2505, 1, 1024]
    - [2, 85.515]
  - - [4096, 3397, 1, 1024]
    - [2, 87.243]
  - - [4096, 3562, 1, 1024]
    - [3, 87.909]
  - - [4096, 3095, 1, 1024]
    - [3, 87.867]
  - - [1024, 3226, 1, 4096]
    - [10, 85.524]
  - - [177, 177, 352, 64]
    - [10, 26.774]
  - - [4096, 3360, 1, 1024]
    - [3, 88.678]
  - - [1024, 3942, 1, 1024]
    - [10, 79.1]
  - - [1024, 3298, 1, 4096]
    - [4, 86.51]
  - - [1024, 3381, 1, 4096]
    - [3, 86.271]
  - - [4096, 3314, 1, 1024]
    - [3, 87.819]
  - - [1024, 3492, 1, 4096]
    - [3, 88.691]
  - - [1024, 3430, 1, 4096]
    - [3, 87.487]
  - - [4096, 3977, 1, 1024]
    - [3, 87.097]
  - - [4096, 3546, 1, 1024]
    - [3, 87.594]
  - - [4096, 3640, 1, 1024]
    - [3, 89.6]
  - - [4096, 3441, 1, 1024]
    - [2, 87.682]
  - - [33708, 4059, 1, 1024]
    - [15, 91.673]
  - - [1024, 3978, 1, 1024]
    - [10, 79.183]
  - - [1024, 3376, 1, 4096]
    - [3, 86.145]
  - - [1024, 3482, 1, 4096]
    - [3, 88.765]
  - - [1024, 3563, 1, 4096]
    - [12, 89.502]
  - - [4096, 4020, 1, 1024]
    - [3, 87.724]
  - - [1024, 3271, 1, 4096]
    - [10, 86.741]
  - - [1024, 3291, 1, 4096]
    - [37, 86.603]
  - - [1024, 3431, 1, 4096]
    - [3, 87.484]
  - - [1024, 3481, 1, 4096]
    - [3, 88.468]
  - - [84, 85, 752, 64]
    - [0, 21.997]
  - - [4096, 3461, 1, 1024]
    - [2, 88.67]
  - - [1024, 3574, 1, 4096]
    - [12, 90.008]
  - - [1024, 4059, 1, 1024]
    - [10, 80.66]
  - - [84, 84, 752, 64]
    - [0, 22.244]
  - - [1024, 3421, 1, 4096]
    - [3, 87.165]
  - - [4096, 3224, 1, 1024]
    - [2, 86.588]
  - - [4096, 3437, 1, 1024]
    - [2, 88.66]
  - - [4096, 3168, 1, 1024]
    - [3, 88.447]
  - - [33708, 3990, 1, 1024]
    - [15, 92.015]
  - - [1024, 3349, 1, 4096]
    - [3, 85.22]
  - - [4096, 3335, 1, 1024]
    - [3, 88.178]
  - - [4096, 3400, 1, 1024]
    - [2, 87.225]
  - - [160, 159, 400, 64]
    - [0, 28.746]
  - - [1024, 3398, 1, 4096]
    - [3, 86.346]
  - - [1024, 3780, 1, 4096]
    - [2, 86.122]
  - - [4096, 3098, 1, 1024]
    - [3, 87.847]
  - - [1024, 4012, 1, 4096]
    - [4, 84.903]
  - - [4096, 3505, 1, 1024]
    - [2, 88.905]
  - - [4096, 3554, 1, 1024]
    - [3, 87.586]
  - - [4096, 3063, 1, 1024]
    - [2, 88.936]
  - - [1024, 3503, 1, 4096]
    - [3, 89.061]
  - - [1024, 3166, 1, 4096]
    - [10, 83.98]
  - - [1024, 3425, 1, 4096]
    - [3, 87.227]
  - - [1024, 3344, 1, 4096]
    - [3, 85.196]
  - - [4096, 3484, 1, 1024]
    - [2, 88.873]
  - - [1024, 3681, 1, 1024]
    - [3, 81.512]
  - - [1024, 4050, 1, 1024]
    - [10, 80.549]
  - - [4096, 3379, 1, 1024]
    - [2, 87.136]
  - - [4096, 3428, 1, 1024]
    - [2, 88.557]
  - - [1024, 3304, 1, 4096]
    - [4, 86.728]
  - - [1024, 3387, 1, 4096]
    - [3, 86.129]
  - - [4096, 3126, 1, 1024]
    - [3, 88.774]
  - - [1024, 3498, 1, 4096]
    - [3, 88.886]
  - - [1024, 3436, 1, 4096]
    - [3, 87.53]
  - - [4096, 3501, 1, 1024]
    - [2, 88.995]
  - - [4096, 3358, 1, 1024]
    - [3, 88.6]
  - - [4096, 3232, 1, 1024]
    - [2, 87.187]
  - - [1024, 3585, 1, 4096]
    - [12, 89.933]
  - - [4096, 3143, 1, 1024]
    - [3, 88.976]
  - - [4096, 3464, 1, 1024]
    - [2, 88.77]
  - - [1024, 3366, 1, 4096]
    - [3, 85.564]
  - - [4096, 3375, 1, 1024]
    - [2, 87.117]
  - - [4096, 2917, 1, 1024]
    - [11, 85.352]
  - - [4096, 4026, 1, 1024]
    - [3, 86.882]
  - - [1024, 3277, 1, 4096]
    - [10, 86.815]
  - - [1024, 3103, 1, 4096]
    - [2, 86.877]
  - - [33708, 3995, 1, 1024]
    - [15, 92.28]
  - - [1024, 3297, 1, 4096]
    - [4, 86.388]
  - - [4096, 3545, 1, 1024]
    - [3, 87.387]
  - - [1024, 3399, 1, 4096]
    - [3, 86.464]
  - - [33708, 3796, 1, 1024]
    - [15, 92.02]
  - - [4096, 3292, 1, 1024]
    - [3, 86.908]
  - - [71, 71, 896, 64]
    - [106, 18.069]
  - - [33708, 3859, 1, 1024]
    - [142, 91.971]
  - - [4096, 3566, 1, 1024]
    - [3, 88.065]
  - - [4096, 3894, 1, 1024]
    - [11, 86.712]
  - - [4096, 3492, 1, 1024]
    - [2, 88.173]
  - - [1024, 3977, 1, 1024]
    - [10, 79.432]
  - - [1024, 3272, 1, 4096]
    - [38, 90.011]
  - - [135, 134, 480, 64]
    - [107, 22.955]
  - - [1024, 3355, 1, 4096]
    - [3, 85.414]
  - - [4096, 3419, 1, 1024]
    - [8, 86.396]
  - - [1024, 3404, 1, 4096]
    - [3, 86.783]
  - - [4096, 3999, 1, 1024]
    - [3, 87.478]
  - - [4096, 3166, 1, 1024]
    - [3, 89.587]
  - - [33708, 3840, 1, 1024]
    - [15, 93.0]
  - - [4096, 4032, 1, 1024]
    - [3, 88.108]
  - - [1024, 3573, 1, 4096]
    - [111, 89.72]
  - - [4096, 3366, 1, 1024]
    - [2, 87.04]
  - - [1024, 3541, 1, 4096]
    - [3, 84.404]
  - - [4096, 3207, 1, 1024]
    - [2, 87.134]
  - - [4096, 3272, 1, 1024]
    - [3, 85.769]
  - - [1024, 3334, 1, 4096]
    - [15, 84.505]
  - - [228, 228, 272, 64]
    - [22, 28.439]
  - - [4096, 3183, 1, 1024]
    - [2, 86.544]
  - - [4096, 3536, 1, 1024]
    - [2, 87.213]
  - - [1024, 4005, 1, 1024]
    - [2, 80.636]
  - - [1024, 3245, 1, 4096]
    - [10, 86.027]
  - - [4096, 3447, 1, 1024]
    - [2, 89.031]
  - - [1024, 3183, 1, 4096]
    - [10, 84.526]
  - - [1024, 3361, 1, 4096]
    - [3, 85.736]
  - - [33708, 3870, 1, 1024]
    - [142, 92.202]
  - - [1024, 3321, 1, 4096]
    - [4, 86.885]
  - - [1024, 3486, 1, 4096]
    - [3, 88.87]
  - - [4096, 4005, 1, 1024]
    - [3, 87.589]
  - - [4096, 3410, 1, 1024]
    - [2, 87.351]
  - - [1024, 3944, 1, 1024]
    - [10, 79.208]
  - - [4096, 3300, 1, 1024]
    - [3, 87.253]
  - - [4096, 3579, 1, 1024]
    - [3, 88.352]
  - - [4096, 3483, 1, 1024]
    - [2, 88.98]
  - - [4096, 3532, 1, 1024]
    - [3, 87.112]
  - - [1024, 3140, 1, 4096]
    - [2, 87.944]
  - - [1024, 3372, 1, 4096]
    - [3, 85.709]
  - - [1024, 3224, 1, 4096]
    - [2, 89.763]
  - - [4096, 3230, 1, 1024]
    - [2, 86.638]
  - - [4096, 3427, 1, 1024]
    - [2, 87.325]
  - - [1024, 3796, 1, 1024]
    - [37, 79.129]
  - - [143, 148, 432, 64]
    - [0, 24.508]
  - - [1024, 3616, 1, 4096]
    - [103, 90.489]
  - - [1024, 3315, 1, 4096]
    - [72, 85.989]
  - - [1024, 3476, 1, 4096]
    - [3, 88.566]
  - - [1024, 3509, 1, 4096]
    - [8, 89.777]
  - - [4096, 3357, 1, 1024]
    - [3, 88.365]
  - - [4096, 3406, 1, 1024]
    - [2, 87.331]
  - - [1024, 3558, 1, 4096]
    - [12, 89.466]
  - - [4096, 3593, 1, 1024]
    - [3, 88.674]
  - - [4096, 3247, 1, 1024]
    - [2, 87.554]
  - - [4096, 3088, 1, 1024]
    - [3, 87.656]
  - - [1024, 3213, 1, 4096]
    - [2, 89.809]
  - - [4096, 3511, 1, 1024]
    - [2, 88.135]
  - - [122, 122, 528, 64]
    - [0, 24.827]
  - - [1024, 3365, 1, 4096]
    - [3, 85.853]
  - - [1024, 3504, 1, 4096]
    - [3, 88.913]
  - - [1024, 3442, 1, 4096]
    - [3, 87.594]
  - - [4096, 3474, 1, 1024]
    - [2, 88.75]
  - - [4096, 2984, 1, 1024]
    - [2, 86.949]
  - - [1024, 3876, 1, 4096]
    - [74, 87.433]
  - - [4096, 3337, 1, 1024]
    - [3, 88.207]
  - - [4096, 3450, 1, 1024]
    - [2, 89.266]
  - - [1024, 3547, 1, 4096]
    - [3, 84.611]
  - - [4096, 3291, 1, 1024]
    - [3, 86.942]
  - - [1024, 3340, 1, 4096]
    - [3, 84.843]
  - - [4096, 3491, 1, 1024]
    - [2, 89.04]
  - - [4096, 3348, 1, 1024]
    - [3, 88.51]
  - - [78, 78, 816, 64]
    - [0, 20.083]
  - - [4096, 3906, 1, 1024]
    - [103, 85.791]
  - - [1024, 3477, 1, 4096]
    - [3, 88.608]
  - - [1024, 3397, 1, 4096]
    - [4, 88.959]
  - - [4096, 3165, 1, 1024]
    - [3, 89.465]
  - - [4096, 3470, 1, 1024]
    - [2, 88.756]
  - - [1024, 3526, 1, 4096]
    - [3, 84.068]
  - - [112, 112, 576, 64]
    - [0, 24.988]
  - - [4096, 3365, 1, 1024]
    - [2, 86.861]
  - - [4096, 3319, 1, 1024]
    - [3, 87.89]
  - - [1024, 3401, 1, 4096]
    - [3, 86.806]
  - - [1024, 3294, 1, 4096]
    - [10, 87.131]
  - - [159, 159, 400, 64]
    - [0, 26.588]
  - - [1024, 3472, 1, 4096]
    - [3, 88.15]
  - - [4096, 3328, 1, 1024]
    - [3, 87.993]
  - - [1024, 3861, 1, 1024]
    - [31, 81.635]
  - - [1024, 3910, 1, 1024]
    - [10, 81.648]
  - - [1024, 3410, 1, 4096]
    - [3, 86.879]
  - - [1024, 3395, 1, 4096]
    - [3, 86.505]
  - - [4096, 3282, 1, 1024]
    - [3, 87.032]
  - - [1024, 3751, 1, 1024]
    - [37, 77.775]
  - - [4096, 3145, 1, 1024]
    - [3, 88.873]
  - - [4096, 3514, 1, 1024]
    - [2, 89.301]
  - - [4096, 3944, 1, 1024]
    - [3, 86.245]
  - - [1024, 3515, 1, 4096]
    - [3, 89.154]
  - - [4096, 3409, 1, 1024]
    - [2, 87.29]
  - - [4096, 3564, 1, 1024]
    - [3, 87.844]
  - - [4096, 3299, 1, 1024]
    - [3, 87.312]
  - - [1024, 3057, 1, 4096]
    - [8, 88.463]
  - - [4096, 3531, 1, 1024]
    - [3, 87.178]
  - - [4096, 3388, 1, 1024]
    - [11, 86.846]
  - - [1024, 3189, 1, 4096]
    - [10, 84.614]
  - - [1024, 3300, 1, 4096]
    - [4, 86.252]
  - - [1024, 3720, 1, 4096]
    - [2, 84.559]
  - - [1024, 3383, 1, 4096]
    - [3, 86.204]
  - - [1024, 3494, 1, 4096]
    - [3, 88.947]
  - - [77, 78, 816, 64]
    - [0, 19.825]
  - - [1024, 3448, 1, 4096]
    - [3, 87.548]
  - - [4096, 3542, 1, 1024]
    - [3, 87.369]
  - - [1024, 3488, 1, 4096]
    - [3, 88.595]
  - - [4096, 3405, 1, 1024]
    - [2, 87.329]
  - - [1024, 3262, 1, 4096]
    - [10, 86.188]
  - - [33708, 4005, 1, 1024]
    - [15, 92.391]
  - - [1024, 3594, 1, 4096]
    - [29, 89.855]
  - - [4096, 3103, 1, 1024]
    - [3, 87.804]
  - - [4096, 3136, 1, 1024]
    - [3, 88.951]
  - - [1024, 3378, 1, 4096]
    - [3, 86.087]
  - - [7, 7, 8192, 64]
    - [211, 2.909]
  - - [4096, 3559, 1, 1024]
    - [3, 87.938]
  - - [4096, 3368, 1, 1024]
    - [2, 87.058]
  - - [4096, 3209, 1, 1024]
    - [2, 87.201]
  - - [4096, 3322, 1, 1024]
    - [3, 87.921]
  - - [1024, 3483, 1, 4096]
    - [3, 88.691]
  - - [4096, 3473, 1, 1024]
    - [2, 88.701]
  - - [4096, 3522, 1, 1024]
    - [3, 86.842]
  - - [1024, 3532, 1, 4096]
    - [3, 84.19]
  - - [4096, 3449, 1, 1024]
    - [2, 87.945]
  - - [1024, 3351, 1, 4096]
    - [3, 85.416]
  - - [1024, 3462, 1, 4096]
    - [3, 87.881]
  - - [4096, 3396, 1, 1024]
    - [2, 87.182]
  - - [132, 132, 480, 64]
    - [106, 23.128]
  - - [111, 112, 576, 64]
    - [22, 21.647]
  - - [1024, 3416, 1, 4096]
    - [3, 86.834]
  - - [4096, 3469, 1, 1024]
    - [2, 88.826]
  - - [1024, 3582, 1, 4096]
    - [29, 89.997]
  - - [1024, 3230, 1, 4096]
    - [2, 89.86]
  - - [1024, 3489, 1, 4096]
    - [3, 88.762]
  - - [1024, 3427, 1, 4096]
    - [3, 87.247]
  - - [1024, 3346, 1, 4096]
    - [3, 85.033]
  - - [33708, 3977, 1, 1024]
    - [15, 91.816]
  - - [4096, 3796, 1, 1024]
    - [3, 88.213]
  - - [4096, 3176, 1, 1024]
    - [2, 86.59]
  - - [4096, 3990, 1, 1024]
    - [3, 87.19]
  - - [1024, 3257, 1, 4096]
    - [2, 89.915]
  - - [4096, 3343, 1, 1024]
    - [3, 88.143]
  - - [4096, 3440, 1, 1024]
    - [2, 87.739]
  - - [33708, 4030, 1, 1024]
    - [15, 92.986]
  - - [1024, 3190, 1, 4096]
    - [10, 84.581]
  - - [1024, 3389, 1, 4096]
    - [3, 86.218]
  - - [1024, 3500, 1, 4096]
    - [8, 89.608]
  - - [1024, 3471, 1, 4096]
    - [3, 88.097]
  - - [1024, 3438, 1, 4096]
    - [3, 87.416]
  - - [4096, 3513, 1, 1024]
    - [2, 89.168]
  - - [1024, 3562, 1, 4096]
    - [111, 89.392]
  - - [4096, 3616, 1, 1024]
    - [2, 88.741]
  - - [4096, 3955, 1, 1024]
    - [3, 86.595]
  - - [1024, 3441, 1, 4096]
    - [3, 87.708]
  - - [1024, 3236, 1, 4096]
    - [2, 89.53]
  - - [1024, 3524, 1, 4096]
    - [3, 83.925]
  - - [4096, 3460, 1, 1024]
    - [2, 88.644]
  - - [92, 93, 688, 64]
    - [56, 23.679]
  - - [1024, 3384, 1, 4096]
    - [3, 86.208]
  - - [4096, 3387, 1, 1024]
    - [37, 86.239]
  - - [4096, 3436, 1, 1024]
    - [2, 87.672]
  - - [4096, 3277, 1, 1024]
    - [3, 86.863]
  - - [1024, 3457, 1, 4096]
    - [3, 88.078]
  - - [1024, 3999, 1, 4096]
    - [4, 84.571]
  - - [1024, 4032, 1, 4096]
    - [4, 85.107]
  - - [4096, 3541, 1, 1024]
    - [3, 87.334]
  - - [4096, 3334, 1, 1024]
    - [3, 87.943]
  - - [1024, 3393, 1, 4096]
    - [3, 86.517]
  - - [1024, 3411, 1, 4096]
    - [3, 86.823]
  - - [1024, 3822, 1, 1024]
    - [37, 78.935]
  - - [1024, 3593, 1, 4096]
    - [12, 90.138]
  - - [33708, 3822, 1, 1024]
    - [15, 92.702]
  - - [4096, 3504, 1, 1024]
    - [2, 89.119]
  - - [1024, 3163, 1, 4096]
    - [10, 83.901]
  - - [1024, 3357, 1, 4096]
    - [3, 85.52]
  - - [1024, 3906, 1, 4096]
    - [2, 88.548]
  - - [4096, 3415, 1, 1024]
    - [2, 87.373]
  - - [1024, 3406, 1, 4096]
    - [3, 86.65]
  - - [4096, 3321, 1, 1024]
    - [3, 87.943]
  - - [4096, 3584, 1, 1024]
    - [3, 88.509]
  - - [1024, 2736, 1, 4096]
    - [28, 89.124]
  - - [1024, 3110, 1, 4096]
    - [10, 82.634]
  - - [33708, 3999, 1, 1024]
    - [15, 92.333]
  - - [1024, 3093, 1, 4096]
    - [10, 81.998]
  - - [4096, 3378, 1, 1024]
    - [2, 87.258]
  - - [1024, 3543, 1, 4096]
    - [3, 84.537]
  - - [33708, 3925, 1, 1024]
    - [15, 92.775]
  - - [1024, 3352, 1, 4096]
    - [3, 85.273]
  - - [4096, 3780, 1, 1024]
    - [3, 87.863]
  - - [1024, 3990, 1, 4096]
    - [4, 84.371]
  - - [4096, 3500, 1, 1024]
    - [2, 89.089]
  - - [4096, 3996, 1, 1024]
    - [3, 87.544]
  - - [1024, 3247, 1, 4096]
    - [10, 85.984]
  - - [4096, 3395, 1, 1024]
    - [2, 86.967]
  - - [1024, 3169, 1, 4096]
    - [2, 88.467]
  - - [1024, 3088, 1, 4096]
    - [10, 81.969]
  - - [1024, 3584, 1, 4096]
    - [111, 89.764]
  - - [4096, 3093, 1, 1024]
    - [3, 87.811]
  - - [1024, 3538, 1, 4096]
    - [3, 84.589]
  - - [1024, 3996, 1, 1024]
    - [10, 79.375]
  - - [1024, 3581, 1, 4096]
    - [12, 90.047]
  - - [4096, 3374, 1, 1024]
    - [11, 85.909]
  - - [33708, 3751, 1, 1024]
    - [5, 91.398]
  - - [4096, 3215, 1, 1024]
    - [2, 87.201]
  - - [4096, 3312, 1, 1024]
    - [3, 86.709]
  - - [4096, 3581, 1, 1024]
    - [3, 88.586]
  - - [4096, 3479, 1, 1024]
    - [2, 88.746]
  - - [4096, 3544, 1, 1024]
    - [3, 87.476]
  - - [1024, 3870, 1, 1024]
    - [31, 81.642]
  - - [1024, 3374, 1, 4096]
    - [3, 86.13]
  - - [1024, 2967, 1, 4096]
    - [8, 86.654]
  - - [4096, 3455, 1, 1024]
    - [2, 88.969]
  - - [4096, 3942, 1, 1024]
    - [3, 86.311]
  - - [1024, 3528, 1, 4096]
    - [3, 84.168]
  - - [4096, 3186, 1, 1024]
    - [2, 87.555]
  - - [1024, 3976, 1, 1024]
    - [37, 79.144]
  - - [1024, 3511, 1, 4096]
    - [8, 89.562]
  - - [4096, 3573, 1, 1024]
    - [3, 88.157]
  - - [4096, 3561, 1, 1024]
    - [3, 87.212]
  - - [4096, 3418, 1, 1024]
    - [2, 87.485]
  - - [33708, 3906, 1, 1024]
    - [15, 92.269]
  - - [4096, 3259, 1, 1024]
    - [2, 87.553]
  - - [4096, 3308, 1, 1024]
    - [3, 87.452]
  - - [1024, 3419, 1, 4096]
    - [3, 87.075]
  - - [1024, 3215, 1, 4096]
    - [10, 85.184]
  - - [1024, 4030, 1, 4096]
    - [4, 85.141]
  - - [4096, 3459, 1, 1024]
    - [2, 88.69]
  - - [1024, 3572, 1, 4096]
    - [12, 89.871]
  - - [1024, 3137, 1, 4096]
    - [10, 83.34]
  - - [1024, 3312, 1, 4096]
    - [4, 86.865]
  - - [1024, 3925, 1, 4096]
    - [2, 88.37]
  - - [1024, 3453, 1, 4096]
    - [3, 87.269]
  - - [4096, 3435, 1, 1024]
    - [2, 87.718]
  - - [1024, 3176, 1, 4096]
    - [10, 84.518]
  - - [1024, 3444, 1, 4096]
    - [3, 87.743]
  - - [4096, 3975, 1, 1024]
    - [3, 86.722]
  - - [4096, 3182, 1, 1024]
    - [2, 86.704]
  - - [1024, 3475, 1, 4096]
    - [3, 88.456]
  - - [33708, 3955, 1, 1024]
    - [2, 91.41]
  - - [4096, 3446, 1, 1024]
    - [2, 87.928]
  - - [1024, 3138, 1, 4096]
    - [2, 87.914]
  - - [1024, 3549, 1, 4096]
    - [3, 84.712]
  - - [4096, 3287, 1, 1024]
    - [3, 87.129]
  - - [1024, 3342, 1, 4096]
    - [3, 85.268]
  - - [102, 102, 624, 64]
    - [31, 20.736]
  - - [4096, 3519, 1, 1024]
    - [2, 89.308]
  - - [4096, 3552, 1, 1024]
    - [3, 87.639]
  - - [4096, 3859, 1, 1024]
    - [2, 87.546]
  - - [33708, 3969, 1, 1024]
    - [15, 91.698]
  - - [1024, 3369, 1, 4096]
    - [3, 85.872]
  - - [4096, 3482, 1, 1024]
    - [2, 88.822]
  - - [1024, 3306, 1, 4096]
    - [3, 84.258]
  - - [1024, 3474, 1, 4096]
    - [3, 88.62]
  - - [99, 99, 624, 64]
    - [9, 20.091]
  - - [4096, 3377, 1, 1024]
    - [2, 87.113]
  - - [4096, 3426, 1, 1024]
    - [8, 86.413]
  - - [4096, 2935, 1, 1024]
    - [11, 85.9]
  - - [4096, 3267, 1, 1024]
    - [3, 85.931]
  - - [1024, 3299, 1, 4096]
    - [3, 83.785]
  - - [1024, 3456, 1, 4096]
    - [3, 88.068]
  - - [1024, 3280, 1, 4096]
    - [10, 86.724]
  - - [1024, 3555, 1, 4096]
    - [12, 89.451]
  - - [4096, 3499, 1, 1024]
    - [2, 88.824]
  - - [4096, 3356, 1, 1024]
    - [3, 88.783]
  - - [100, 102, 624, 64]
    - [106, 20.443]
  - - [1024, 3412, 1, 4096]
    - [3, 86.945]
  - - [1024, 2984, 1, 4096]
    - [8, 86.616]
  - - [4096, 3141, 1, 1024]
    - [3, 88.787]
  - - [4096, 3510, 1, 1024]
    - [2, 89.356]
  - - [1024, 3995, 1, 1024]
    - [10, 79.488]
  - - [1024, 3517, 1, 4096]
    - [3, 89.668]
  - - [1024, 3455, 1, 4096]
    - [3, 87.79]
  - - [1024, 3939, 1, 1024]
    - [10, 78.872]
  - - [1024, 3447, 1, 4096]
    - [3, 87.667]
  - - [1024, 3969, 1, 4096]
    - [4, 84.04]
  - - [4096, 3527, 1, 1024]
    - [3, 86.773]
  - - [4096, 3336, 1, 1024]
    - [3, 88.008]
  - - [1024, 3191, 1, 4096]
    - [37, 84.572]
  - - [1024, 3302, 1, 4096]
    - [4, 86.567]
  - - [1024, 3337, 1, 4096]
    - [3, 85.007]
  - - [4096, 3290, 1, 1024]
    - [3, 86.927]
  - - [1024, 3512, 1, 4096]
    - [3, 89.236]
  - - [1024, 3433, 1, 4096]
    - [3, 87.53]
  - - [4096, 3876, 1, 1024]
    - [2, 87.742]
  - - [4096, 3490, 1, 1024]
    - [2, 88.93]
  - - [4096, 3064, 1, 1024]
    - [2, 88.815]
  - - [1024, 3508, 1, 4096]
    - [6, 89.209]
  - - [1024, 3956, 1, 4096]
    - [4, 83.624]
  - - [4096, 3417, 1, 1024]
    - [2, 87.614]
  - - [1024, 3248, 1, 4096]
    - [10, 86.095]
  - - [1024, 2499, 1, 4096]
    - [3, 83.769]
  - - [1024, 3186, 1, 4096]
    - [10, 84.416]
  - - [1024, 3180, 1, 4096]
    - [10, 84.375]
  - - [4096, 3364, 1, 1024]
    - [2, 86.905]
  - - [4096, 3976, 1, 1024]
    - [3, 87.035]
  - - [4096, 3205, 1, 1024]
    - [2, 86.93]
  - - [4096, 3318, 1, 1024]
    - [3, 87.852]
  - - [1024, 3377, 1, 4096]
    - [3, 85.754]
  - - [1024, 3485, 1, 4096]
    - [3, 88.288]
  - - [4096, 3181, 1, 1024]
    - [2, 86.752]
  - - [4096, 3550, 1, 1024]
    - [3, 87.773]
  - - [1024, 3534, 1, 4096]
    - [3, 84.493]
  - - [1024, 3860, 1, 1024]
    - [8, 81.759]
  - - [160, 160, 400, 64]
    - [106, 28.956]
  - - [4096, 3445, 1, 1024]
    - [2, 87.89]
  - - [1024, 3391, 1, 4096]
    - [3, 86.548]
  - - [1024, 3221, 1, 4096]
    - [10, 85.271]
  - - [4096, 3079, 1, 1024]
    - [3, 87.269]
  - - [4096, 3144, 1, 1024]
    - [3, 88.924]
  - - [1024, 3270, 1, 4096]
    - [10, 86.569]
  - - [1024, 3561, 1, 4096]
    - [111, 89.498]
  - - [1024, 3480, 1, 4096]
    - [3, 88.662]
  - - [4096, 3408, 1, 1024]
    - [2, 88.536]
  - - [1024, 3418, 1, 4096]
    - [3, 86.828]
  - - [4096, 3298, 1, 1024]
    - [3, 87.127]
  - - [1024, 3640, 1, 1024]
    - [8, 79.402]
  - - [1024, 3449, 1, 4096]
    - [3, 87.681]
  - - [1024, 4020, 1, 4096]
    - [74, 90.805]
  - - [4096, 3481, 1, 1024]
    - [2, 88.749]
  - - [4096, 3530, 1, 1024]
    - [3, 87.017]
  - - [1024, 3216, 1, 4096]
    - [2, 89.591]
  - - [1024, 3491, 1, 4096]
    - [3, 88.928]
  - - [1024, 3154, 1, 4096]
    - [2, 88.126]
  - - [4096, 3425, 1, 1024]
    - [2, 88.442]
  - - [1024, 3348, 1, 4096]
    - [3, 85.257]
  - - [1024, 3415, 1, 4096]
    - [3, 86.817]
  - - [1024, 4026, 1, 1024]
    - [10, 79.971]
  - - [1024, 3367, 1, 4096]
    - [3, 85.85]
  - - [1024, 3259, 1, 4096]
    - [10, 86.314]
  - - [1024, 3894, 1, 4096]
    - [74, 87.819]
  - - [4096, 3355, 1, 1024]
    - [3, 87.87]
  - - [4096, 3404, 1, 1024]
    - [2, 88.404]
  - - [1024, 3308, 1, 4096]
    - [4, 86.821]
  - - [4096, 3245, 1, 1024]
    - [2, 87.425]
  - - [1024, 3502, 1, 4096]
    - [3, 89.108]
  - - [33708, 4032, 1, 1024]
    - [15, 93.088]
  - - [1024, 3424, 1, 4096]
    - [3, 87.065]
  - - [4096, 3509, 1, 1024]
    - [2, 89.198]
  - - [4096, 3558, 1, 1024]
    - [3, 87.89]
  - - [1024, 3900, 1, 1024]
    - [6, 81.909]
  - - [1024, 2505, 1, 4096]
    - [3, 83.96]
  - - [4096, 3472, 1, 1024]
    - [2, 88.699]
  - - [1024, 3386, 1, 4096]
    - [3, 86.082]
  - - [4096, 3383, 1, 1024]
    - [2, 86.951]
  - - [4096, 3448, 1, 1024]
    - [11, 86.904]
  - - [4096, 4030, 1, 1024]
    - [3, 87.963]
  - - [4096, 3289, 1, 1024]
    - [3, 86.841]
  - - [1024, 3459, 1, 4096]
    - [3, 88.081]
  - - [1024, 2918, 1, 4096]
    - [8, 84.908]
  - - [4096, 3489, 1, 1024]
    - [2, 88.833]
  - - [4096, 3346, 1, 1024]
    - [3, 88.395]
  - - [4096, 3572, 1, 1024]
    - [3, 87.892]
  - - [1024, 3955, 1, 4096]
    - [2, 83.055]
  - - [4096, 3236, 1, 1024]
    - [2, 87.444]
  - - [4096, 3163, 1, 1024]
    - [3, 89.369]
  - - [4096, 3468, 1, 1024]
    - [2, 88.716]
  - - [1024, 3165, 1, 4096]
    - [10, 83.906]
  - - [1024, 3276, 1, 4096]
    - [10, 86.764]
  - - [1024, 3359, 1, 4096]
    - [3, 85.69]
  - - [4096, 3363, 1, 1024]
    - [11, 85.377]
  - - [1024, 3385, 1, 4096]
    - [3, 86.117]
  - - [1024, 3207, 1, 4096]
    - [2, 89.377]
  - - [1024, 3458, 1, 4096]
    - [3, 87.934]
  - - [4096, 3110, 1, 1024]
    - [3, 88.108]
  - - [4096, 3925, 1, 1024]
    - [2, 87.04]
  - - [1024, 3975, 1, 4096]
    - [4, 83.989]
  - - [4096, 3549, 1, 1024]
    - [3, 87.519]
  - - [4096, 3342, 1, 1024]
    - [3, 88.351]
  - - [1024, 3859, 1, 1024]
    - [61, 81.665]
  - - [1024, 3497, 1, 4096]
    - [3, 88.905]
  - - [4096, 3280, 1, 1024]
    - [3, 86.87]
  - - [1024, 3435, 1, 4096]
    - [3, 87.534]
  - - [1024, 3354, 1, 4096]
    - [3, 85.374]
  - - [4096, 3191, 1, 1024]
    - [2, 86.849]
  - - [4096, 3512, 1, 1024]
    - [2, 89.298]
  - - [1024, 3055, 1, 4096]
    - [8, 88.5]
  - - [4096, 2499, 1, 1024]
    - [2, 85.388]
  - - [1024, 3233, 1, 4096]
    - [10, 85.829]
  - - [4096, 3423, 1, 1024]
    - [2, 87.353]
  - - [1024, 3319, 1, 4096]
    - [4, 86.904]
  - - [4096, 3297, 1, 1024]
    - [3, 87.21]
  - - [4096, 3154, 1, 1024]
    - [3, 89.194]
  - - [1024, 3540, 1, 4096]
    - [3, 84.519]
  - - [1024, 3289, 1, 4096]
    - [10, 86.938]
  - - [4096, 3529, 1, 1024]
    - [3, 87.015]
  - - [4096, 3386, 1, 1024]
    - [2, 87.607]
  - - [4096, 3276, 1, 1024]
    - [3, 86.873]
  - - [1024, 3244, 1, 4096]
    - [10, 85.953]
  - - [1024, 3182, 1, 4096]
    - [10, 84.428]
  - - [4096, 3540, 1, 1024]
    - [3, 87.161]
  - - [1024, 3360, 1, 4096]
    - [3, 85.551]
  - - [1024, 3942, 1, 4096]
    - [4, 83.282]
  - - [4096, 3403, 1, 1024]
    - [2, 88.32]
  - - [4096, 3101, 1, 1024]
    - [3, 88.038]
  - - [4096, 2918, 1, 1024]
    - [7, 85.488]
  - - [1024, 3465, 1, 4096]
    - [3, 88.144]
  - - [33708, 3780, 1, 1024]
    - [15, 91.676]
  - - [4096, 3557, 1, 1024]
    - [3, 87.946]
  - - [4096, 3414, 1, 1024]
    - [8, 86.126]
  - - [1024, 3948, 1, 1024]
    - [10, 79.221]
  - - [4096, 3320, 1, 1024]
    - [3, 87.929]
  - - [4096, 2765, 1, 1024]
    - [2, 87.064]
  - - [1024, 3978, 1, 4096]
    - [4, 84.099]
  - - [4096, 3487, 1, 1024]
    - [2, 88.794]
  - - [4096, 3520, 1, 1024]
    - [2, 90.023]
  - - [1024, 3139, 1, 4096]
    - [10, 83.299]
  - - [1024, 3314, 1, 4096]
    - [4, 86.713]
  - - [4096, 3431, 1, 1024]
    - [8, 86.695]
  - - [123, 122, 528, 64]
    - [0, 24.813]
  - - [1024, 3446, 1, 4096]
    - [3, 87.624]
  - - [1024, 4059, 1, 4096]
    - [2, 91.408]
  - - [99, 102, 624, 64]
    - [13, 20.397]
  - - [4096, 3345, 1, 1024]
    - [3, 87.938]
  - - [4096, 3394, 1, 1024]
    - [2, 87.272]
  - - [1024, 3927, 1, 1024]
    - [2, 79.618]
  - - [4096, 3235, 1, 1024]
    - [2, 87.417]
  - - [1024, 3328, 1, 4096]
    - [3, 84.817]
  - - [33708, 3956, 1, 1024]
    - [15, 91.229]
  - - [4096, 3467, 1, 1024]
    - [2, 88.835]
  - - [1024, 3287, 1, 4096]
    - [10, 86.982]
  - - [4096, 3214, 1, 1024]
    - [2, 87.249]
  - - [4096, 3910, 1, 1024]
    - [2, 86.839]
  - - [1024, 3780, 1, 1024]
    - [37, 78.859]
  - - [1024, 3371, 1, 4096]
    - [3, 86.125]
  - - [4096, 3478, 1, 1024]
    - [2, 88.661]
  - - [1024, 3546, 1, 4096]
    - [3, 84.619]
  - - [1024, 4012, 1, 1024]
    - [10, 79.692]
  - - [4096, 3341, 1, 1024]
    - [3, 88.287]
  - - [4096, 3454, 1, 1024]
    - [2, 89.162]
  - - [4096, 3295, 1, 1024]
    - [3, 87.035]
  - - [4096, 3072, 1, 1024]
    - [2, 89.514]
  - - [1024, 3282, 1, 4096]
    - [10, 86.801]
  - - [33708, 3720, 1, 1024]
    - [15, 92.45]
  - - [1024, 3681, 1, 4096]
    - [2, 83.499]
  - - [1024, 4050, 1, 4096]
    - [4, 85.631]
  - - [4096, 3495, 1, 1024]
    - [2, 88.854]
  - - [4096, 3560, 1, 1024]
    - [3, 87.859]
  - - [4096, 3751, 1, 1024]
    - [3, 87.189]
  - - [1024, 3414, 1, 4096]
    - [3, 86.749]
  - - [33708, 3860, 1, 1024]
    - [142, 92.004]
  - - [1024, 3325, 1, 4096]
    - [4, 87.062]
  - - [4096, 3458, 1, 1024]
    - [2, 88.713]
  - - [4096, 2967, 1, 1024]
    - [2, 86.654]
  - - [1024, 3519, 1, 4096]
    - [3, 89.681]
  - - [4096, 3385, 1, 1024]
    - [2, 87.246]
  - - [4096, 3434, 1, 1024]
    - [2, 87.681]
  - - [1024, 3552, 1, 4096]
    - [3, 84.602]
  - - [4096, 3822, 1, 1024]
    - [3, 88.686]
  - - [1024, 3544, 1, 4096]
    - [3, 84.604]
  - - [4096, 3539, 1, 1024]
    - [3, 87.137]
  - - [4096, 3332, 1, 1024]
    - [3, 88.148]
  - - [1024, 3145, 1, 4096]
    - [2, 88.212]
  - - [1024, 3535, 1, 4096]
    - [3, 84.41]
  - - [1024, 3320, 1, 4096]
    - [4, 87.003]
  - - [33708, 4012, 1, 1024]
    - [15, 92.703]
  - - [4096, 3286, 1, 1024]
    - [3, 86.992]
  - - [1024, 3514, 1, 4096]
    - [3, 89.207]
  - - [93, 93, 688, 64]
    - [0, 23.511]
  - - [1024, 2765, 1, 4096]
    - [6, 86.563]
  - - [1024, 3452, 1, 4096]
    - [3, 87.975]
  - - [4096, 3518, 1, 1024]
    - [2, 89.343]
  - - [1024, 3529, 1, 4096]
    - [3, 84.309]
  - - [4096, 3413, 1, 1024]
    - [2, 87.239]
  - - [33708, 4050, 1, 1024]
    - [15, 91.451]
  - - [1024, 3525, 1, 4096]
    - [3, 84.193]
  - - [4096, 3303, 1, 1024]
    - [3, 87.589]
  - - [1024, 3382, 1, 4096]
    - [3, 86.115]
  - - [1024, 3390, 1, 4096]
    - [3, 86.006]
  - - [1024, 3977, 1, 4096]
    - [4, 84.21]
  - - [1024, 3184, 1, 4096]
    - [10, 84.434]
  - - [4096, 3535, 1, 1024]
    - [3, 87.277]
  - - [4096, 3376, 1, 1024]
    - [22, 85.615]
  - - [4096, 3978, 1, 1024]
    - [3, 87.089]
  - - [1024, 3136, 1, 4096]
    - [10, 83.184]
  - - [1024, 3293, 1, 4096]
    - [10, 87.019]
  - - [4096, 3266, 1, 1024]
    - [3, 86.511]
  - - [1024, 3487, 1, 4096]
    - [3, 88.764]
  - - [1024, 3409, 1, 4096]
    - [3, 86.605]
  - - [4096, 3498, 1, 1024]
    - [2, 89.086]
  - - [1024, 3520, 1, 4096]
    - [3, 89.705]
  - - [1024, 3530, 1, 4096]
    - [3, 84.387]
  - - [4096, 3393, 1, 1024]
    - [2, 87.413]
  - - [4096, 3140, 1, 1024]
    - [3, 88.998]
  - - [1024, 3536, 1, 4096]
    - [3, 84.466]
  - - [1024, 3288, 1, 4096]
    - [10, 86.984]
  - - [1024, 4005, 1, 4096]
    - [4, 84.707]
  - - [1024, 3579, 1, 4096]
    - [111, 90.003]
  - - [4096, 3372, 1, 1024]
    - [2, 87.266]
  - - [1024, 3440, 1, 4096]
    - [3, 87.563]
  - - [4096, 3213, 1, 1024]
    - [2, 86.526]
  - - [123, 123, 528, 64]
    - [0, 24.774]
  - - [100, 100, 624, 64]
    - [47, 20.359]
  - - [4096, 3477, 1, 1024]
    - [2, 88.899]
  - - [4096, 3526, 1, 1024]
    - [3, 85.899]
  - - [1024, 3493, 1, 4096]
    - [3, 88.834]
  - - [1024, 3944, 1, 4096]
    - [4, 83.185]
  - - [4096, 3453, 1, 1024]
    - [2, 88.106]
  - - [1024, 3350, 1, 4096]
    - [3, 85.458]
  - - [4096, 3184, 1, 1024]
    - [2, 86.934]
  - - [1024, 3423, 1, 4096]
    - [3, 87.314]
  - - [4096, 3351, 1, 1024]
    - [3, 88.502]
  - - [4096, 3416, 1, 1024]
    - [2, 88.618]
  - - [1024, 3796, 1, 4096]
    - [2, 86.14]
  - - [4096, 3257, 1, 1024]
    - [2, 87.549]
  - - [4096, 3306, 1, 1024]
    - [3, 87.399]
  - - [33708, 4020, 1, 1024]
    - [15, 92.733]
  - - [1024, 3426, 1, 4096]
    - [3, 87.225]
  - - [4096, 3457, 1, 1024]
    - [2, 88.591]
  - - [1024, 2935, 1, 4096]
    - [8, 85.063]
  - - [1024, 3046, 1, 4096]
    - [8, 88.374]
  - - [4096, 3433, 1, 1024]
    - [2, 88.784]
  - - [1024, 3256, 1, 4096]
    - [10, 86.234]
  - - [1024, 3531, 1, 4096]
    - [3, 84.325]
  - - [4096, 3180, 1, 1024]
    - [2, 86.7]
  - - [1024, 3388, 1, 4096]
    - [3, 86.168]
  - - [4096, 3444, 1, 1024]
    - [11, 86.663]
  - - [1024, 3501, 1, 4096]
    - [3, 88.248]
  - - [1024, 3266, 1, 4096]
    - [10, 86.511]
  - - [1024, 3267, 1, 4096]
    - [10, 86.659]
  - - [1024, 3461, 1, 4096]
    - [3, 87.82]
  - - [4096, 3870, 1, 1024]
    - [2, 87.669]
  - - [4096, 3517, 1, 1024]
    - [2, 89.21]
  - - [1024, 3566, 1, 4096]
    - [12, 89.747]
  - - [4096, 3574, 1, 1024]
    - [3, 88.355]
  - - [1024, 3876, 1, 1024]
    - [31, 81.805]
  - - [4096, 3720, 1, 1024]
    - [3, 86.436]
  - - [4096, 3248, 1, 1024]
    - [2, 87.369]
  - - [4096, 4059, 1, 1024]
    - [3, 88.606]
  - - [1024, 3380, 1, 4096]
    - [3, 86.125]
  - - [4096, 3480, 1, 1024]
    - [2, 88.843]
  - - [1024, 3335, 1, 4096]
    - [3, 84.823]
  - - [1024, 3345, 1, 4096]
    - [3, 85.232]
  - - [4096, 3391, 1, 1024]
    - [2, 87.626]
  - - [4096, 3424, 1, 1024]
    - [2, 87.378]
  - - [1024, 3394, 1, 4096]
    - [3, 86.598]
  - - [4096, 3265, 1, 1024]
    - [3, 86.376]
  - - [1024, 3014, 1, 4096]
    - [8, 88.082]
  - - [4096, 3497, 1, 1024]
    - [2, 89.037]
  - - [4096, 3354, 1, 1024]
    - [3, 88.458]
  - - [4096, 3055, 1, 1024]
    - [2, 88.813]
  - - [1024, 3499, 1, 4096]
    - [3, 89.01]
  - - [1024, 3162, 1, 4096]
    - [10, 83.686]
  - - [4096, 3244, 1, 1024]
    - [2, 86.547]
  - - [1024, 3437, 1, 4096]
    - [3, 87.289]
  - - [1024, 3356, 1, 4096]
    - [3, 85.554]
  - - [4096, 3139, 1, 1024]
    - [3, 89.023]
  - - [4096, 3508, 1, 1024]
    - [2, 89.089]
  - - [1024, 3235, 1, 4096]
    - [10, 85.967]
  - - [1024, 3910, 1, 4096]
    - [2, 88.947]
  - - [4096, 3371, 1, 1024]
    - [11, 86.364]
  - - [1024, 3751, 1, 4096]
    - [4, 85.08]
  - - [4096, 3325, 1, 1024]
    - [3, 88.111]
  - - [1024, 3413, 1, 4096]
    - [3, 86.667]
  - - [1024, 3542, 1, 4096]
    - [3, 84.609]
  - - [101, 102, 624, 64]
    - [66, 20.88]
  - - [33708, 3900, 1, 1024]
    - [15, 92.176]
  - - [4096, 3525, 1, 1024]
    - [3, 87.064]
  - - [4096, 3382, 1, 1024]
    - [2, 87.287]
  - - [102, 100, 624, 64]
    - [47, 20.58]
  - - [1024, 3339, 1, 4096]
    - [3, 85.106]
  - - [4096, 3288, 1, 1024]
    - [3, 86.093]
  - - [92, 92, 688, 64]
    - [56, 23.722]
  - - [1024, 3141, 1, 4096]
    - [10, 83.411]
  - - [1024, 3168, 1, 4096]
    - [37, 83.611]
  - - [4096, 3488, 1, 1024]
    - [2, 88.951]
  - - [4096, 3046, 1, 1024]
    - [2, 88.415]
  - - [1024, 3362, 1, 4096]
    - [3, 85.467]
  - - [33708, 3942, 1, 1024]
    - [2, 91.283]
  - - [4096, 3399, 1, 1024]
    - [2, 87.318]
  - - [1024, 3720, 1, 1024]
    - [3, 82.492]
  - - [4096, 3563, 1, 1024]
    - [3, 87.659]
  - - [1024, 3273, 1, 4096]
    - [10, 86.733]
  - - [4096, 3162, 1, 1024]
    - [3, 87.927]
  - - [1024, 3467, 1, 4096]
    - [3, 88.076]
  - - [1024, 3130, 1, 4096]
    - [37, 83.06]
  - - [1024, 3405, 1, 4096]
    - [3, 86.691]
  - - [4096, 3362, 1, 1024]
    - [2, 86.771]
  - - [1024, 3960, 1, 1024]
    - [10, 79.226]
  - - [2048, 128, 1, 4096]
    - [16, 48.633]
  - - [1024, 3712, 1, 36548]
    - [132, 87.077]
  - - [1024, 128, 1, 1024]
    - [56, 27.619]
  - - [3072, 128, 1, 4096]
    - [67, 71.091]
  - - [1024, 3712, 1, 1024]
    - [37, 77.595]
  - - [2, 16, 1, 768]
    - [21, 0.007]
  - - [2, 8, 1, 768]
    - [175, 0.002]
  - - [2, 64, 1, 768]
    - [24, 0.031]
  - - [1728, 320, 1, 64]
    - [56, 16.275]
  - - [1152, 128, 1, 784]
    - [56, 15.382]
  - - [576, 96, 1, 5329]
    - [189, 20.913]
  - - [864, 96, 1, 1225]
    - [56, 20.261]
  - - [256, 128, 1, 784]
    - [25, 7.017]
  - - [1440, 320, 1, 196]
    - [112, 24.819]
  - - [192, 48, 1, 1225]
    - [17, 2.57]
  - - [2592, 384, 1, 289]
    - [133, 28.656]
  - - [192, 80, 36, 10368]
    - [5, 53.531]
  - - [896, 192, 1, 289]
    - [152, 7.762]
  - - [768, 128, 1, 289]
    - [53, 11.038]
  - - [64, 256, 1, 3136]
    - [178, 6.414]
  - - [1280, 384, 1, 64]
    - [0, 14.615]
  - - [512, 144, 1, 196]
    - [21, 6.144]
  - - [1344, 192, 1, 289]
    - [100, 10.725]
  - - [288, 64, 1, 21609]
    - [190, 21.043]
  - - [400, 32, 1, 784]
    - [21, 2.758]
  - - [288, 32, 1, 21609]
    - [175, 11.492]
  - - [1280, 448, 1, 64]
    - [0, 16.706]
  - - [3456, 256, 1, 169]
    - [149, 17.773]
  - - [2304, 256, 1, 196]
    - [1, 28.162]
  - - [384, 192, 1, 1225]
    - [34, 18.417]
  - - [832, 48, 1, 49]
    - [53, 0.36]
  - - [832, 192, 1, 49]
    - [113, 3.919]
  - - [1280, 192, 1, 64]
    - [0, 8.438]
  - - [192, 32, 1, 784]
    - [17, 1.324]
  - - [288, 48, 1, 1225]
    - [18, 3.894]
  - - [512, 112, 1, 196]
    - [21, 4.87]
  - - [224, 192, 36, 2592]
    - [32, 82.924]
  - - [528, 32, 1, 196]
    - [24, 1.478]
  - - [192, 128, 36, 1568]
    - [37, 58.742]
  - - [4032, 384, 1, 64]
    - [1, 25.962]
  - - [576, 64, 1, 3136]
    - [172, 12.161]
  - - [2048, 32, 1, 1001]
    - [34, 14.782]
  - - [480, 64, 1, 196]
    - [89, 1.061]
  - - [512, 256, 1, 196]
    - [56, 9.981]
  - - [864, 96, 1, 289]
    - [53, 9.233]
  - - [896, 128, 1, 289]
    - [0, 12.447]
  - - [192, 64, 1, 784]
    - [81, 2.647]
  - - [1200, 64, 1, 1225]
    - [53, 18.434]
  - - [1296, 288, 1, 196]
    - [114, 22.428]
  - - [576, 96, 1, 5041]
    - [191, 20.229]
  - - [1024, 256, 1, 289]
    - [44, 11.071]
  - - [1024, 2048, 1, 49]
    - [2, 20.767]
  - - [192, 64, 36, 6272]
    - [107, 47.013]
  - - [192, 32, 1, 1225]
    - [24, 1.671]
  - - [1024, 256, 1, 196]
    - [16, 17.812]
  - - [1120, 192, 1, 289]
    - [120, 9.429]
  - - [400, 48, 1, 196]
    - [0, 0.654]
  - - [1728, 224, 1, 1225]
    - [35, 34.917]
  - - [800, 96, 1, 784]
    - [53, 15.685]
  - - [1152, 384, 1, 64]
    - [16, 13.574]
  - - [4608, 512, 1, 49]
    - [2, 22.652]
  - - [1792, 256, 1, 289]
    - [1, 26.674]
  - - [864, 128, 1, 784]
    - [56, 11.892]
  - - [1728, 384, 1, 169]
    - [1, 28.879]
  - - [480, 16, 1, 196]
    - [21, 0.665]
  - - [1568, 256, 1, 289]
    - [1, 15.468]
  - - [1152, 448, 1, 64]
    - [16, 15.345]
  - - [512, 64, 1, 196]
    - [89, 1.146]
  - - [1344, 224, 1, 289]
    - [100, 12.016]
  - - [9216, 512, 1, 4096]
    - [49, 86.754]
  - - [27, 32, 1, 22201]
    - [169, 1.253]
  - - [1152, 192, 1, 784]
    - [114, 36.69]
  - - [1536, 256, 1, 64]
    - [0, 12.601]
  - - [800, 128, 1, 196]
    - [56, 8.076]
  - - [800, 64, 1, 196]
    - [53, 4.348]
  - - [864, 208, 1, 196]
    - [0, 13.453]
  - - [1440, 320, 1, 49]
    - [107, 9.599]
  - - [512, 128, 1, 784]
    - [53, 13.385]
  - - [720, 192, 1, 5041]
    - [26, 34.954]
  - - [256, 64, 1, 784]
    - [25, 3.551]
  - - [256, 48, 1, 1225]
    - [17, 3.375]
  - - [576, 192, 1, 3136]
    - [68, 26.271]
  - - [160, 64, 1, 5329]
    - [170, 6.079]
  - - [3456, 384, 1, 289]
    - [149, 34.222]
  - - [32, 32, 36, 43808]
    - [192, 22.915]
  - - [1344, 512, 1, 64]
    - [1, 6.875]
  - - [192, 16, 1, 784]
    - [24, 0.654]
  - - [3456, 384, 1, 169]
    - [2, 24.117]
  - - [1152, 256, 1, 196]
    - [10, 19.735]
  - - [1728, 192, 1, 1225]
    - [115, 46.844]
  - - [2048, 512, 1, 49]
    - [1, 7.338]
  - - [576, 96, 1, 1225]
    - [18, 14.468]
  - - [512, 2048, 1, 49]
    - [117, 7.507]
  - - [1728, 192, 1, 64]
    - [0, 10.752]
  - - [832, 256, 1, 49]
    - [116, 1.797]
  - - [512, 128, 1, 196]
    - [158, 2.232]
  - - [1200, 128, 1, 49]
    - [116, 3.769]
  - - [528, 256, 1, 196]
    - [0, 10.204]
  - - [256, 512, 1, 784]
    - [0, 13.649]
  - - [480, 192, 1, 196]
    - [53, 7.608]
  - - [96, 64, 36, 2592]
    - [16, 36.343]
  - - [96, 96, 36, 2592]
    - [16, 42.4]
  - - [1024, 192, 1, 289]
    - [44, 8.364]
  - - [1536, 384, 1, 64]
    - [1, 6.108]
  - - [192, 96, 1, 784]
    - [68, 3.971]
  - - [2048, 192, 1, 64]
    - [0, 12.195]
  - - [192, 64, 1, 1225]
    - [18, 3.325]
  - - [512, 32, 1, 196]
    - [21, 1.462]
  - - [128, 96, 36, 1568]
    - [37, 64.586]
  - - [528, 128, 1, 196]
    - [21, 5.685]
  - - [128, 512, 1, 784]
    - [0, 13.462]
  - - [128, 128, 36, 3136]
    - [10, 64.37]
  - - [528, 160, 1, 196]
    - [68, 6.784]
  - - [448, 64, 1, 5329]
    - [196, 13.854]
  - - [1280, 320, 1, 64]
    - [0, 13.274]
  - - [1792, 320, 1, 289]
    - [133, 18.982]
  - - [2880, 320, 1, 64]
    - [0, 20.29]
  - - [147, 64, 1, 12544]
    - [188, 9.514]
  - - [4096, 512, 1, 1001]
    - [117, 68.804]
  - - [1536, 32, 1, 1001]
    - [17, 11.794]
  - - [512, 160, 1, 196]
    - [21, 6.762]
  - - [768, 160, 1, 289]
    - [56, 13.336]
  - - [1728, 384, 1, 49]
    - [1, 12.11]
  - - [64, 32, 36, 43808]
    - [192, 32.922]
  - - [64, 64, 1, 3136]
    - [169, 1.733]
  - - [256, 32, 1, 784]
    - [17, 1.765]
  - - [480, 96, 1, 196]
    - [0, 1.635]
  - - [1024, 32, 1, 1001]
    - [104, 4.451]
  - - [832, 160, 1, 49]
    - [116, 3.303]
  - - [512, 1024, 1, 196]
    - [1, 25.872]
  - - [2048, 64, 1, 1001]
    - [0, 24.843]
  - - [2048, 128, 1, 1001]
    - [118, 34.08]
  - - [1536, 64, 1, 1001]
    - [53, 22.742]
  - - [32, 32, 64, 40000]
    - [197, 24.645]
  - - [224, 192, 36, 5184]
    - [98, 79.185]
  - - [32, 32, 49, 115200]
    - [190, 22.856]
  - - [384, 448, 49, 512]
    - [7, 80.841]
  - - [192, 80, 36, 20736]
    - [5, 55.414]
  - - [384, 448, 64, 256]
    - [9, 69.109]
  - - [96, 64, 64, 18432]
    - [88, 51.796]
  - - [224, 192, 64, 4608]
    - [8, 78.152]
  - - [96, 96, 49, 3136]
    - [88, 48.459]
  - - [224, 192, 64, 2304]
    - [85, 77.056]
  - - [64, 32, 49, 57600]
    - [194, 31.048]
  - - [384, 448, 36, 256]
    - [2, 68.113]
  - - [96, 64, 36, 10368]
    - [14, 43.81]
  - - [96, 64, 36, 20736]
    - [14, 46.388]
  - - [192, 80, 49, 14400]
    - [5, 69.359]
  - - [96, 64, 49, 6272]
    - [14, 55.114]
  - - [64, 32, 49, 115200]
    - [195, 31.251]
  - - [384, 448, 49, 256]
    - [66, 68.343]
  - - [96, 96, 64, 2304]
    - [119, 49.549]
  - - [96, 96, 49, 6272]
    - [39, 45.522]
  - - [224, 192, 49, 6272]
    - [29, 77.152]
  - - [96, 96, 36, 10368]
    - [107, 43.416]
  - - [96, 64, 36, 5184]
    - [14, 39.019]
  - - [384, 448, 64, 512]
    - [61, 81.713]
  - - [224, 192, 49, 3136]
    - [85, 77.845]
  - - [384, 448, 36, 512]
    - [2, 79.433]
  - - [32, 32, 36, 175232]
    - [190, 23.873]
  - - [224, 192, 36, 10368]
    - [88, 80.794]
  - - [64, 32, 64, 40000]
    - [197, 32.809]
  - - [96, 64, 64, 4608]
    - [54, 52.11]
  - - [32, 32, 49, 57600]
    - [193, 22.464]
  - - [192, 80, 36, 41472]
    - [5, 56.375]
  - - [32, 32, 36, 87616]
    - [198, 24.373]
  - - [192, 80, 49, 28800]
    - [119, 70.414]
  - - [96, 64, 49, 28800]
    - [14, 60.17]
  - - [96, 64, 36, 41472]
    - [14, 47.872]
  - - [192, 80, 64, 9216]
    - [44, 57.766]
  - - [96, 96, 36, 5184]
    - [47, 42.009]
  - - [32, 32, 64, 80000]
    - [197, 23.997]
  - - [96, 64, 64, 2304]
    - [54, 49.132]
  - - [96, 64, 49, 3136]
    - [14, 50.174]
  - - [64, 32, 36, 87616]
    - [192, 31.809]
  - - [64, 32, 64, 80000]
    - [197, 32.962]
  - - [96, 96, 64, 4608]
    - [14, 53.769]
  - - [64, 32, 36, 175232]
    - [190, 26.689]
  - - [64, 64, 11, 233600]
    - [204, 19.424]
  - - [320, 256, 9, 19584]
    - [96, 81.251]
  - - [256, 224, 9, 9792]
    - [85, 62.023]
  - - [128, 128, 11, 3264]
    - [44, 47.766]
  - - [256, 256, 9, 4896]
    - [37, 73.237]
  - - [320, 256, 9, 4896]
    - [77, 74.966]
  - - [224, 192, 9, 19584]
    - [88, 71.75]
  - - [192, 192, 11, 3264]
    - [122, 71.606]
  - - [64, 64, 11, 116800]
    - [197, 35.306]
  - - [64, 64, 9, 172864]
    - [190, 28.173]
  - - [192, 128, 11, 6528]
    - [16, 52.6]
  - - [64, 64, 11, 58400]
    - [191, 39.322]
  - - [192, 160, 9, 19584]
    - [191, 58.587]
  - - [128, 128, 9, 9792]
    - [194, 43.378]
  - - [128, 128, 11, 6528]
    - [44, 52.083]
  - - [192, 192, 11, 6528]
    - [122, 75.408]
  - - [160, 160, 9, 4896]
    - [0, 47.071]
  - - [192, 192, 9, 4896]
    - [162, 58.04]
  - - [256, 256, 11, 13056]
    - [52, 74.025]
  - - [224, 192, 11, 6528]
    - [37, 57.441]
  - - [192, 192, 9, 19584]
    - [115, 67.394]
  - - [256, 224, 11, 13056]
    - [44, 74.797]
  - - [224, 192, 11, 13056]
    - [186, 58.676]
  - - [256, 256, 11, 3264]
    - [123, 69.037]
  - - [192, 160, 11, 13056]
    - [115, 66.362]
  - - [320, 256, 11, 6528]
    - [37, 70.913]
  - - [192, 192, 9, 9792]
    - [162, 63.715]
  - - [192, 160, 11, 6528]
    - [124, 61.249]
  - - [224, 224, 9, 9792]
    - [87, 55.278]
  - - [64, 64, 9, 86432]
    - [192, 42.121]
  - - [224, 192, 11, 3264]
    - [37, 55.361]
  - - [128, 128, 9, 19584]
    - [182, 51.871]
  - - [224, 224, 11, 6528]
    - [32, 66.849]
  - - [160, 160, 11, 13056]
    - [16, 57.177]
  - - [160, 160, 9, 19584]
    - [186, 53.985]
  - - [192, 128, 9, 19584]
    - [199, 56.113]
  - - [192, 160, 9, 9792]
    - [16, 54.443]
  - - [224, 224, 9, 19584]
    - [197, 58.399]
  - - [192, 192, 11, 13056]
    - [67, 77.515]
  - - [192, 128, 9, 4896]
    - [64, 43.505]
  - - [320, 256, 9, 9792]
    - [96, 75.035]
  - - [320, 256, 11, 13056]
    - [50, 70.898]
  - - [64, 64, 9, 345728]
    - [200, 18.388]
  - - [128, 128, 9, 4896]
    - [87, 43.613]
  - - [256, 256, 9, 9792]
    - [37, 70.729]
  - - [224, 224, 9, 4896]
    - [64, 62.391]
  - - [320, 256, 11, 3264]
    - [10, 66.435]
  - - [256, 256, 11, 6528]
    - [52, 72.186]
  - - [224, 192, 9, 4896]
    - [32, 66.322]
  - - [256, 224, 9, 19584]
    - [191, 66.758]
  - - [192, 128, 11, 3264]
    - [16, 50.592]
  - - [224, 224, 11, 13056]
    - [100, 66.1]
  - - [224, 224, 11, 3264]
    - [32, 64.847]
  - - [160, 160, 11, 3264]
    - [16, 51.843]
  - - [256, 224, 11, 6528]
    - [10, 73.845]
  - - [128, 128, 11, 13056]
    - [120, 54.858]
  - - [192, 160, 9, 4896]
    - [0, 57.388]
  - - [256, 224, 11, 3264]
    - [10, 71.649]
  - - [160, 160, 9, 9792]
    - [191, 47.071]
  - - [192, 160, 11, 3264]
    - [124, 53.314]
  - - [256, 256, 9, 19584]
    - [44, 75.226]
  - - [192, 128, 11, 13056]
    - [199, 60.347]
  - - [224, 192, 9, 9792]
    - [88, 68.661]
  - - [160, 160, 11, 6528]
    - [16, 52.622]
  - - [256, 224, 9, 4896]
    - [64, 68.392]
  - - [192, 128, 9, 9792]
    - [205, 48.608]
  - - [1024, 6400, 1, 65]
    - [2, 33.271]
  - - [4096, 6400, 1, 256]
    - [9, 78.007]
  - - [4096, 64, 1, 1024]
    - [43, 39.795]
  - - [104, 104, 16, 64]
    - [70, 5.672]
  - - [135, 135, 32, 64]
    - [0, 13.788]
  - - [512, 3194, 1, 2048]
    - [4, 76.928]
  - - [512, 3222, 1, 2048]
    - [38, 80.195]
  - - [512, 3234, 1, 2048]
    - [38, 79.913]
  - - [512, 3242, 1, 2048]
    - [38, 80.046]
  - - [512, 3257, 1, 2048]
    - [38, 79.885]
  - - [512, 3332, 1, 2048]
    - [32, 72.638]
  - - [512, 3336, 1, 2048]
    - [37, 73.1]
  - - [512, 3378, 1, 2048]
    - [37, 73.402]
  - - [512, 3396, 1, 2048]
    - [32, 74.08]
  - - [512, 3399, 1, 2048]
    - [32, 74.361]
  - - [512, 3451, 1, 2048]
    - [37, 75.453]
  - - [512, 3456, 1, 2048]
    - [32, 75.909]
  - - [512, 3458, 1, 2048]
    - [37, 75.57]
  - - [512, 3467, 1, 2048]
    - [32, 75.871]
  - - [512, 3468, 1, 2048]
    - [32, 75.646]
  - - [512, 3470, 1, 2048]
    - [37, 75.872]
  - - [512, 3477, 1, 2048]
    - [37, 75.307]
  - - [512, 3478, 1, 2048]
    - [37, 75.982]
  - - [512, 3495, 1, 2048]
    - [37, 76.187]
  - - [512, 3507, 1, 2048]
    - [32, 76.486]
  - - [512, 3515, 1, 2048]
    - [37, 76.623]
  - - [512, 3517, 1, 2048]
    - [32, 76.225]
  - - [2048, 2864, 1, 512]
    - [3, 80.32]
  - - [2048, 3287, 1, 512]
    - [3, 81.324]
  - - [2048, 3412, 1, 512]
    - [2, 79.623]
  - - [2048, 3456, 1, 512]
    - [2, 82.15]
  - - [2048, 3466, 1, 512]
    - [2, 81.445]
  - - [2048, 3476, 1, 512]
    - [2, 81.156]
  - - [2048, 3999, 1, 512]
    - [102, 79.501]
  - - [33708, 189, 1, 512]
    - [15, 71.822]
  - - [33708, 2496, 1, 512]
    - [2, 89.664]
  - - [33708, 3864, 1, 512]
    - [13, 87.959]
  - - [33708, 3969, 1, 512]
    - [2, 88.613]
  - - [33708, 3995, 1, 512]
    - [2, 88.28]
  - - [7, 7, 736, 64]
    - [95, 1.107]
  - - [26, 27, 56, 64]
    - [21, 1.4]
  - - [64, 65, 496, 64]
    - [22, 19.074]
  - - [65, 65, 472, 64]
    - [0, 15.018]
  - - [65, 65, 496, 64]
    - [0, 15.225]
  - - [70, 70, 216, 64]
    - [0, 14.819]
  - - [70, 71, 216, 64]
    - [56, 14.958]
  - - [71, 71, 216, 64]
    - [0, 15.703]
  - - [71, 71, 448, 64]
    - [0, 16.831]
  - - [77, 77, 248, 64]
    - [0, 10.193]
  - - [77, 77, 408, 64]
    - [106, 13.977]
  - - [77, 78, 248, 64]
    - [56, 17.323]
  - - [77, 78, 408, 64]
    - [15, 19.153]
  - - [78, 78, 248, 64]
    - [0, 18.133]
  - - [78, 78, 408, 64]
    - [15, 19.561]
  - - [80, 84, 152, 64]
    - [0, 17.748]
  - - [84, 84, 152, 64]
    - [56, 17.778]
  - - [85, 85, 376, 64]
    - [15, 20.352]
  - - [91, 91, 40, 64]
    - [0, 10.273]
  - - [91, 93, 40, 64]
    - [56, 10.17]
  - - [93, 93, 40, 64]
    - [56, 10.615]
  - - [93, 93, 344, 64]
    - [0, 22.289]
  - - [102, 102, 56, 64]
    - [16, 13.027]
  - - [102, 102, 312, 64]
    - [1, 19.836]
  - - [103, 103, 16, 64]
    - [0, 5.693]
  - - [103, 104, 16, 64]
    - [95, 5.748]
  - - [112, 112, 16, 64]
    - [95, 6.81]
  - - [112, 112, 288, 64]
    - [1, 23.627]
  - - [112, 123, 16, 64]
    - [59, 7.392]
  - - [119, 119, 32, 64]
    - [56, 12.567]
  - - [119, 135, 32, 64]
    - [0, 13.358]
  - - [122, 122, 264, 64]
    - [1, 24.268]
  - - [123, 122, 264, 64]
    - [1, 23.854]
  - - [123, 123, 16, 64]
    - [0, 8.025]
  - - [123, 123, 264, 64]
    - [1, 24.355]
  - - [134, 134, 240, 64]
    - [106, 22.517]
  - - [135, 134, 240, 64]
    - [47, 21.969]
  - - [135, 135, 240, 64]
    - [47, 22.289]
  - - [256, 1, 1, 4]
    - [125, 0.001]
  - - [2, 1, 1, 1024]
    - [187, 0.0]
  - - [1024, 1, 1, 1024]
    - [177, 0.163]
  - - [512, 2790, 1, 2048]
    - [37, 75.685]
  - - [512, 2864, 1, 2048]
    - [37, 77.381]
  - - [512, 3092, 1, 2048]
    - [4, 75.667]
  - - [512, 3113, 1, 2048]
    - [109, 76.3]
  - - [512, 3137, 1, 2048]
    - [91, 76.61]
  - - [512, 3165, 1, 2048]
    - [4, 76.975]
  - - [512, 3166, 1, 2048]
    - [91, 76.527]
  - - [512, 3219, 1, 2048]
    - [38, 80.15]
  - - [512, 3237, 1, 2048]
    - [38, 79.977]
  - - [512, 3246, 1, 2048]
    - [38, 79.925]
  - - [512, 3249, 1, 2048]
    - [38, 79.669]
  - - [512, 3251, 1, 2048]
    - [131, 79.952]
  - - [512, 3262, 1, 2048]
    - [131, 80.025]
  - - [512, 3268, 1, 2048]
    - [2, 79.114]
  - - [512, 3282, 1, 2048]
    - [109, 80.136]
  - - [512, 3286, 1, 2048]
    - [109, 79.819]
  - - [512, 3287, 1, 2048]
    - [4, 79.936]
  - - [512, 3293, 1, 2048]
    - [126, 79.507]
  - - [512, 3297, 1, 2048]
    - [4, 80.367]
  - - [512, 3307, 1, 2048]
    - [74, 80.039]
  - - [512, 3314, 1, 2048]
    - [109, 80.058]
  - - [512, 3315, 1, 2048]
    - [38, 77.979]
  - - [512, 3319, 1, 2048]
    - [8, 79.695]
  - - [512, 3322, 1, 2048]
    - [109, 79.704]
  - - [512, 3323, 1, 2048]
    - [38, 78.112]
  - - [512, 3324, 1, 2048]
    - [4, 79.654]
  - - [512, 3325, 1, 2048]
    - [4, 80.043]
  - - [512, 3327, 1, 2048]
    - [131, 77.929]
  - - [512, 3329, 1, 2048]
    - [37, 73.305]
  - - [512, 3339, 1, 2048]
    - [37, 73.305]
  - - [512, 3342, 1, 2048]
    - [32, 73.164]
  - - [512, 3344, 1, 2048]
    - [37, 73.51]
  - - [512, 3358, 1, 2048]
    - [37, 73.431]
  - - [512, 3360, 1, 2048]
    - [32, 73.687]
  - - [512, 3364, 1, 2048]
    - [10, 73.046]
  - - [512, 3365, 1, 2048]
    - [32, 73.373]
  - - [512, 3369, 1, 2048]
    - [32, 73.179]
  - - [512, 3371, 1, 2048]
    - [37, 73.657]
  - - [512, 3374, 1, 2048]
    - [32, 73.707]
  - - [512, 3376, 1, 2048]
    - [83, 73.263]
  - - [512, 3377, 1, 2048]
    - [32, 73.391]
  - - [512, 3381, 1, 2048]
    - [32, 73.736]
  - - [512, 3382, 1, 2048]
    - [37, 73.343]
  - - [512, 3383, 1, 2048]
    - [32, 73.353]
  - - [512, 3384, 1, 2048]
    - [32, 73.121]
  - - [512, 3385, 1, 2048]
    - [32, 73.478]
  - - [512, 3386, 1, 2048]
    - [32, 73.408]
  - - [512, 3388, 1, 2048]
    - [37, 73.088]
  - - [512, 3390, 1, 2048]
    - [37, 73.32]
  - - [512, 3391, 1, 2048]
    - [32, 73.341]
  - - [512, 3402, 1, 2048]
    - [32, 73.783]
  - - [512, 3410, 1, 2048]
    - [32, 74.618]
  - - [512, 3412, 1, 2048]
    - [37, 73.954]
  - - [512, 3414, 1, 2048]
    - [37, 74.43]
  - - [512, 3415, 1, 2048]
    - [32, 73.904]
  - - [512, 3418, 1, 2048]
    - [37, 74.122]
  - - [512, 3420, 1, 2048]
    - [32, 74.29]
  - - [512, 3422, 1, 2048]
    - [32, 74.915]
  - - [512, 3425, 1, 2048]
    - [37, 74.525]
  - - [512, 3426, 1, 2048]
    - [37, 75.046]
  - - [512, 3427, 1, 2048]
    - [37, 75.012]
  - - [512, 3428, 1, 2048]
    - [37, 74.946]
  - - [512, 3430, 1, 2048]
    - [37, 74.938]
  - - [512, 3431, 1, 2048]
    - [37, 74.956]
  - - [512, 3432, 1, 2048]
    - [32, 74.953]
  - - [512, 3438, 1, 2048]
    - [37, 75.208]
  - - [512, 3439, 1, 2048]
    - [32, 75.114]
  - - [512, 3440, 1, 2048]
    - [32, 75.021]
  - - [512, 3443, 1, 2048]
    - [37, 75.098]
  - - [512, 3445, 1, 2048]
    - [32, 75.191]
  - - [512, 3447, 1, 2048]
    - [37, 75.384]
  - - [512, 3448, 1, 2048]
    - [37, 74.817]
  - - [512, 3450, 1, 2048]
    - [32, 75.227]
  - - [512, 3452, 1, 2048]
    - [37, 74.685]
  - - [512, 3453, 1, 2048]
    - [32, 74.747]
  - - [512, 3455, 1, 2048]
    - [32, 75.137]
  - - [512, 3457, 1, 2048]
    - [37, 74.982]
  - - [512, 3459, 1, 2048]
    - [32, 75.607]
  - - [512, 3460, 1, 2048]
    - [32, 75.286]
  - - [512, 3461, 1, 2048]
    - [32, 75.792]
  - - [512, 3462, 1, 2048]
    - [32, 76.077]
  - - [512, 3466, 1, 2048]
    - [32, 75.88]
  - - [512, 3471, 1, 2048]
    - [32, 75.629]
  - - [512, 3472, 1, 2048]
    - [37, 75.874]
  - - [512, 3475, 1, 2048]
    - [37, 75.603]
  - - [512, 3476, 1, 2048]
    - [32, 76.302]
  - - [512, 3479, 1, 2048]
    - [32, 75.982]
  - - [512, 3480, 1, 2048]
    - [32, 76.31]
  - - [512, 3481, 1, 2048]
    - [32, 75.747]
  - - [512, 3483, 1, 2048]
    - [32, 75.462]
  - - [512, 3484, 1, 2048]
    - [37, 75.67]
  - - [512, 3487, 1, 2048]
    - [37, 75.985]
  - - [512, 3489, 1, 2048]
    - [37, 76.407]
  - - [512, 3490, 1, 2048]
    - [32, 75.634]
  - - [512, 3491, 1, 2048]
    - [37, 76.457]
  - - [512, 3493, 1, 2048]
    - [32, 75.831]
  - - [512, 3494, 1, 2048]
    - [32, 76.255]
  - - [512, 3497, 1, 2048]
    - [37, 76.607]
  - - [512, 3498, 1, 2048]
    - [37, 76.415]
  - - [512, 3499, 1, 2048]
    - [37, 76.423]
  - - [512, 3501, 1, 2048]
    - [37, 75.926]
  - - [512, 3503, 1, 2048]
    - [37, 76.713]
  - - [512, 3508, 1, 2048]
    - [32, 76.35]
  - - [512, 3509, 1, 2048]
    - [32, 76.226]
  - - [512, 3511, 1, 2048]
    - [37, 76.639]
  - - [512, 3514, 1, 2048]
    - [32, 76.266]
  - - [512, 3518, 1, 2048]
    - [37, 76.326]
  - - [512, 3519, 1, 2048]
    - [37, 75.585]
  - - [512, 3520, 1, 2048]
    - [32, 76.502]
  - - [512, 3523, 1, 2048]
    - [127, 76.79]
  - - [512, 3528, 1, 2048]
    - [127, 77.363]
  - - [512, 3529, 1, 2048]
    - [42, 77.134]
  - - [512, 3530, 1, 2048]
    - [28, 76.978]
  - - [512, 3532, 1, 2048]
    - [127, 77.307]
  - - [512, 3533, 1, 2048]
    - [42, 76.831]
  - - [512, 3534, 1, 2048]
    - [127, 77.136]
  - - [512, 3538, 1, 2048]
    - [28, 77.474]
  - - [512, 3539, 1, 2048]
    - [28, 77.103]
  - - [512, 3541, 1, 2048]
    - [127, 77.111]
  - - [512, 3547, 1, 2048]
    - [127, 77.135]
  - - [512, 3548, 1, 2048]
    - [128, 76.804]
  - - [512, 3552, 1, 2048]
    - [127, 77.138]
  - - [512, 3564, 1, 2048]
    - [28, 77.291]
  - - [512, 3575, 1, 2048]
    - [28, 77.637]
  - - [512, 3598, 1, 2048]
    - [28, 77.144]
  - - [512, 3599, 1, 2048]
    - [128, 76.99]
  - - [512, 3608, 1, 2048]
    - [142, 80.689]
  - - [512, 3780, 1, 512]
    - [10, 69.128]
  - - [512, 3780, 1, 2048]
    - [8, 76.289]
  - - [512, 3796, 1, 512]
    - [54, 69.744]
  - - [512, 3796, 1, 2048]
    - [99, 76.527]
  - - [512, 3822, 1, 512]
    - [10, 69.252]
  - - [512, 3822, 1, 2048]
    - [99, 77.055]
  - - [512, 3840, 1, 512]
    - [10, 70.553]
  - - [512, 3840, 1, 2048]
    - [6, 78.734]
  - - [512, 3859, 1, 512]
    - [10, 69.709]
  - - [512, 3859, 1, 2048]
    - [6, 78.237]
  - - [512, 3870, 1, 512]
    - [54, 69.694]
  - - [512, 3870, 1, 2048]
    - [6, 78.19]
  - - [512, 3876, 1, 512]
    - [54, 69.909]
  - - [512, 3876, 1, 2048]
    - [8, 78.008]
  - - [512, 3906, 1, 512]
    - [10, 70.992]
  - - [512, 3906, 1, 2048]
    - [10, 81.962]
  - - [512, 3910, 1, 512]
    - [10, 70.2]
  - - [512, 3910, 1, 2048]
    - [10, 82.046]
  - - [512, 3925, 1, 512]
    - [10, 70.257]
  - - [512, 3925, 1, 2048]
    - [37, 82.434]
  - - [512, 3927, 1, 512]
    - [10, 69.764]
  - - [512, 3942, 1, 512]
    - [54, 67.591]
  - - [512, 3942, 1, 2048]
    - [8, 76.754]
  - - [512, 3944, 1, 512]
    - [10, 67.235]
  - - [512, 3944, 1, 2048]
    - [8, 77.174]
  - - [512, 3955, 1, 512]
    - [10, 67.52]
  - - [512, 3955, 1, 2048]
    - [92, 76.785]
  - - [512, 3968, 1, 512]
    - [10, 68.135]
  - - [512, 3968, 1, 2048]
    - [8, 77.934]
  - - [512, 3969, 1, 512]
    - [54, 67.37]
  - - [512, 3969, 1, 2048]
    - [6, 78.312]
  - - [512, 3976, 1, 512]
    - [10, 68.174]
  - - [512, 3976, 1, 2048]
    - [8, 78.091]
  - - [512, 3977, 1, 512]
    - [10, 67.408]
  - - [512, 3977, 1, 2048]
    - [92, 77.884]
  - - [512, 3978, 1, 512]
    - [10, 68.208]
  - - [512, 3978, 1, 2048]
    - [8, 78.195]
  - - [512, 3990, 1, 512]
    - [10, 67.823]
  - - [512, 3990, 1, 2048]
    - [92, 77.945]
  - - [512, 3995, 1, 512]
    - [10, 67.713]
  - - [512, 3995, 1, 2048]
    - [6, 77.85]
  - - [512, 3996, 1, 512]
    - [54, 67.44]
  - - [512, 3996, 1, 2048]
    - [8, 78.062]
  - - [512, 3999, 1, 512]
    - [54, 67.107]
  - - [512, 3999, 1, 2048]
    - [6, 78.315]
  - - [512, 4005, 1, 512]
    - [10, 68.079]
  - - [512, 4005, 1, 2048]
    - [8, 78.433]
  - - [512, 4012, 1, 512]
    - [10, 67.517]
  - - [512, 4012, 1, 2048]
    - [8, 78.148]
  - - [512, 4020, 1, 512]
    - [10, 67.942]
  - - [512, 4020, 1, 2048]
    - [6, 78.111]
  - - [512, 4026, 1, 512]
    - [10, 67.752]
  - - [512, 4026, 1, 2048]
    - [6, 78.357]
  - - [512, 4030, 1, 512]
    - [10, 67.245]
  - - [512, 4030, 1, 2048]
    - [8, 77.985]
  - - [512, 4032, 1, 512]
    - [10, 69.335]
  - - [512, 4032, 1, 2048]
    - [6, 79.555]
  - - [512, 4050, 1, 512]
    - [54, 68.646]
  - - [512, 4059, 1, 512]
    - [54, 68.601]
  - - [2048, 2790, 1, 512]
    - [3, 79.423]
  - - [2048, 3092, 1, 512]
    - [54, 78.094]
  - - [2048, 3113, 1, 512]
    - [54, 77.834]
  - - [2048, 3137, 1, 512]
    - [92, 77.816]
  - - [2048, 3165, 1, 512]
    - [61, 78.429]
  - - [2048, 3166, 1, 512]
    - [31, 78.207]
  - - [2048, 3194, 1, 512]
    - [2, 76.543]
  - - [2048, 3219, 1, 512]
    - [31, 79.725]
  - - [2048, 3222, 1, 512]
    - [8, 76.034]
  - - [2048, 3234, 1, 512]
    - [6, 76.025]
  - - [2048, 3237, 1, 512]
    - [3, 79.877]
  - - [2048, 3242, 1, 512]
    - [8, 75.873]
  - - [2048, 3246, 1, 512]
    - [31, 79.891]
  - - [2048, 3249, 1, 512]
    - [3, 79.923]
  - - [2048, 3251, 1, 512]
    - [61, 80.181]
  - - [2048, 3257, 1, 512]
    - [31, 80.037]
  - - [2048, 3262, 1, 512]
    - [6, 76.316]
  - - [2048, 3268, 1, 512]
    - [3, 81.108]
  - - [2048, 3282, 1, 512]
    - [3, 81.2]
  - - [2048, 3286, 1, 512]
    - [3, 81.171]
  - - [2048, 3293, 1, 512]
    - [3, 81.729]
  - - [2048, 3297, 1, 512]
    - [3, 81.401]
  - - [2048, 3307, 1, 512]
    - [3, 81.733]
  - - [2048, 3314, 1, 512]
    - [3, 81.735]
  - - [2048, 3315, 1, 512]
    - [3, 81.717]
  - - [2048, 3319, 1, 512]
    - [3, 82.116]
  - - [2048, 3322, 1, 512]
    - [3, 82.276]
  - - [2048, 3323, 1, 512]
    - [3, 82.085]
  - - [2048, 3324, 1, 512]
    - [3, 82.11]
  - - [2048, 3325, 1, 512]
    - [3, 82.092]
  - - [2048, 3327, 1, 512]
    - [3, 81.97]
  - - [2048, 3329, 1, 512]
    - [3, 81.891]
  - - [2048, 3332, 1, 512]
    - [3, 81.753]
  - - [2048, 3336, 1, 512]
    - [3, 81.596]
  - - [2048, 3339, 1, 512]
    - [3, 82.052]
  - - [2048, 3342, 1, 512]
    - [3, 82.211]
  - - [2048, 3344, 1, 512]
    - [3, 82.047]
  - - [2048, 3358, 1, 512]
    - [3, 82.39]
  - - [2048, 3360, 1, 512]
    - [3, 82.783]
  - - [2048, 3364, 1, 512]
    - [8, 76.027]
  - - [2048, 3365, 1, 512]
    - [61, 78.487]
  - - [2048, 3369, 1, 512]
    - [61, 78.387]
  - - [2048, 3371, 1, 512]
    - [54, 78.705]
  - - [2048, 3374, 1, 512]
    - [11, 78.697]
  - - [2048, 3376, 1, 512]
    - [54, 78.782]
  - - [2048, 3377, 1, 512]
    - [2, 78.884]
  - - [2048, 3378, 1, 512]
    - [11, 78.519]
  - - [2048, 3381, 1, 512]
    - [11, 78.666]
  - - [2048, 3382, 1, 512]
    - [61, 78.65]
  - - [2048, 3383, 1, 512]
    - [11, 78.713]
  - - [2048, 3384, 1, 512]
    - [11, 78.465]
  - - [2048, 3385, 1, 512]
    - [31, 78.643]
  - - [2048, 3386, 1, 512]
    - [61, 78.705]
  - - [2048, 3388, 1, 512]
    - [2, 78.597]
  - - [2048, 3390, 1, 512]
    - [61, 78.72]
  - - [2048, 3391, 1, 512]
    - [31, 78.55]
  - - [2048, 3396, 1, 512]
    - [2, 79.642]
  - - [2048, 3399, 1, 512]
    - [2, 79.991]
  - - [2048, 3402, 1, 512]
    - [2, 80.061]
  - - [2048, 3410, 1, 512]
    - [2, 80.09]
  - - [2048, 3414, 1, 512]
    - [31, 79.473]
  - - [2048, 3415, 1, 512]
    - [8, 76.753]
  - - [2048, 3418, 1, 512]
    - [61, 79.644]
  - - [2048, 3420, 1, 512]
    - [31, 79.888]
  - - [2048, 3422, 1, 512]
    - [31, 79.541]
  - - [2048, 3425, 1, 512]
    - [2, 79.887]
  - - [2048, 3426, 1, 512]
    - [61, 79.596]
  - - [2048, 3427, 1, 512]
    - [31, 79.815]
  - - [2048, 3428, 1, 512]
    - [2, 79.956]
  - - [2048, 3430, 1, 512]
    - [2, 79.964]
  - - [2048, 3431, 1, 512]
    - [31, 79.868]
  - - [2048, 3432, 1, 512]
    - [61, 79.656]
  - - [2048, 3438, 1, 512]
    - [2, 79.835]
  - - [2048, 3439, 1, 512]
    - [2, 79.937]
  - - [2048, 3440, 1, 512]
    - [2, 79.764]
  - - [2048, 3443, 1, 512]
    - [11, 79.872]
  - - [2048, 3445, 1, 512]
    - [31, 79.84]
  - - [2048, 3447, 1, 512]
    - [2, 80.083]
  - - [2048, 3448, 1, 512]
    - [2, 79.91]
  - - [2048, 3450, 1, 512]
    - [61, 80.035]
  - - [2048, 3451, 1, 512]
    - [2, 80.137]
  - - [2048, 3452, 1, 512]
    - [2, 80.003]
  - - [2048, 3453, 1, 512]
    - [2, 79.947]
  - - [2048, 3455, 1, 512]
    - [31, 80.151]
  - - [2048, 3457, 1, 512]
    - [2, 81.477]
  - - [2048, 3458, 1, 512]
    - [2, 81.217]
  - - [2048, 3459, 1, 512]
    - [2, 81.443]
  - - [2048, 3460, 1, 512]
    - [2, 81.426]
  - - [2048, 3461, 1, 512]
    - [2, 81.247]
  - - [2048, 3462, 1, 512]
    - [2, 81.109]
  - - [2048, 3467, 1, 512]
    - [2, 81.267]
  - - [2048, 3468, 1, 512]
    - [2, 81.452]
  - - [2048, 3470, 1, 512]
    - [2, 81.418]
  - - [2048, 3471, 1, 512]
    - [2, 81.119]
  - - [2048, 3472, 1, 512]
    - [2, 81.587]
  - - [2048, 3475, 1, 512]
    - [31, 80.853]
  - - [2048, 3477, 1, 512]
    - [2, 81.501]
  - - [2048, 3478, 1, 512]
    - [2, 81.404]
  - - [2048, 3479, 1, 512]
    - [2, 81.549]
  - - [2048, 3480, 1, 512]
    - [2, 81.089]
  - - [2048, 3481, 1, 512]
    - [2, 81.353]
  - - [2048, 3483, 1, 512]
    - [31, 80.999]
  - - [2048, 3484, 1, 512]
    - [2, 81.182]
  - - [2048, 3487, 1, 512]
    - [2, 80.853]
  - - [2048, 3489, 1, 512]
    - [2, 80.979]
  - - [2048, 3490, 1, 512]
    - [2, 81.082]
  - - [2048, 3491, 1, 512]
    - [2, 80.986]
  - - [2048, 3493, 1, 512]
    - [2, 81.272]
  - - [2048, 3494, 1, 512]
    - [2, 80.857]
  - - [2048, 3495, 1, 512]
    - [2, 81.398]
  - - [2048, 3497, 1, 512]
    - [2, 81.046]
  - - [2048, 3498, 1, 512]
    - [2, 81.148]
  - - [2048, 3499, 1, 512]
    - [2, 81.052]
  - - [2048, 3501, 1, 512]
    - [31, 80.9]
  - - [2048, 3503, 1, 512]
    - [2, 81.105]
  - - [2048, 3507, 1, 512]
    - [31, 81.397]
  - - [2048, 3508, 1, 512]
    - [31, 81.26]
  - - [2048, 3509, 1, 512]
    - [31, 81.085]
  - - [2048, 3511, 1, 512]
    - [2, 81.171]
  - - [2048, 3514, 1, 512]
    - [2, 81.28]
  - - [2048, 3515, 1, 512]
    - [2, 81.343]
  - - [2048, 3517, 1, 512]
    - [61, 81.072]
  - - [2048, 3518, 1, 512]
    - [2, 81.333]
  - - [2048, 3519, 1, 512]
    - [31, 81.118]
  - - [2048, 3520, 1, 512]
    - [2, 83.211]
  - - [2048, 3523, 1, 512]
    - [102, 78.714]
  - - [2048, 3528, 1, 512]
    - [54, 78.64]
  - - [2048, 3529, 1, 512]
    - [54, 78.736]
  - - [2048, 3530, 1, 512]
    - [54, 78.647]
  - - [2048, 3532, 1, 512]
    - [10, 78.544]
  - - [2048, 3533, 1, 512]
    - [102, 78.308]
  - - [2048, 3534, 1, 512]
    - [10, 78.441]
  - - [2048, 3538, 1, 512]
    - [54, 78.567]
  - - [2048, 3539, 1, 512]
    - [54, 78.848]
  - - [2048, 3541, 1, 512]
    - [54, 78.744]
  - - [2048, 3547, 1, 512]
    - [54, 78.915]
  - - [2048, 3548, 1, 512]
    - [11, 78.825]
  - - [2048, 3552, 1, 512]
    - [10, 79.175]
  - - [2048, 3564, 1, 512]
    - [54, 79.032]
  - - [2048, 3575, 1, 512]
    - [31, 78.869]
  - - [2048, 3598, 1, 512]
    - [102, 79.266]
  - - [2048, 3599, 1, 512]
    - [31, 79.51]
  - - [2048, 3608, 1, 512]
    - [31, 79.338]
  - - [2048, 3780, 1, 512]
    - [3, 82.278]
  - - [2048, 3796, 1, 512]
    - [3, 82.664]
  - - [2048, 3822, 1, 512]
    - [3, 82.773]
  - - [2048, 3840, 1, 512]
    - [3, 83.622]
  - - [2048, 3859, 1, 512]
    - [2, 80.904]
  - - [2048, 3870, 1, 512]
    - [31, 80.812]
  - - [2048, 3876, 1, 512]
    - [31, 80.546]
  - - [2048, 3906, 1, 512]
    - [54, 78.846]
  - - [2048, 3910, 1, 512]
    - [11, 79.3]
  - - [2048, 3925, 1, 512]
    - [61, 79.331]
  - - [2048, 3942, 1, 512]
    - [102, 79.167]
  - - [2048, 3944, 1, 512]
    - [11, 79.309]
  - - [2048, 3955, 1, 512]
    - [11, 79.768]
  - - [2048, 3968, 1, 512]
    - [31, 80.098]
  - - [2048, 3969, 1, 512]
    - [54, 79.54]
  - - [2048, 3976, 1, 512]
    - [11, 79.177]
  - - [2048, 3977, 1, 512]
    - [54, 79.364]
  - - [2048, 3978, 1, 512]
    - [61, 79.251]
  - - [2048, 3990, 1, 512]
    - [54, 79.289]
  - - [2048, 3995, 1, 512]
    - [11, 79.188]
  - - [2048, 3996, 1, 512]
    - [54, 79.308]
  - - [2048, 4005, 1, 512]
    - [102, 79.487]
  - - [2048, 4012, 1, 512]
    - [31, 79.459]
  - - [2048, 4020, 1, 512]
    - [11, 79.584]
  - - [2048, 4026, 1, 512]
    - [102, 79.636]
  - - [2048, 4030, 1, 512]
    - [11, 79.648]
  - - [2048, 4032, 1, 512]
    - [11, 80.632]
  - - [33708, 184, 1, 512]
    - [3, 70.47]
  - - [33708, 208, 1, 512]
    - [10, 70.553]
  - - [33708, 246, 1, 512]
    - [2, 73.76]
  - - [33708, 264, 1, 512]
    - [3, 74.585]
  - - [33708, 465, 1, 512]
    - [3, 83.046]
  - - [33708, 468, 1, 512]
    - [3, 83.524]
  - - [33708, 493, 1, 512]
    - [11, 77.793]
  - - [33708, 540, 1, 512]
    - [2, 78.168]
  - - [33708, 550, 1, 512]
    - [2, 79.233]
  - - [33708, 560, 1, 512]
    - [2, 80.435]
  - - [33708, 644, 1, 512]
    - [3, 80.052]
  - - [33708, 714, 1, 512]
    - [142, 81.419]
  - - [33708, 720, 1, 512]
    - [142, 82.758]
  - - [33708, 781, 1, 512]
    - [11, 80.254]
  - - [33708, 936, 1, 512]
    - [3, 85.026]
  - - [33708, 980, 1, 512]
    - [13, 81.828]
  - - [33708, 1232, 1, 512]
    - [12, 84.337]
  - - [33708, 1290, 1, 512]
    - [13, 83.925]
  - - [33708, 1350, 1, 512]
    - [3, 83.017]
  - - [33708, 1424, 1, 512]
    - [3, 86.541]
  - - [33708, 1458, 1, 512]
    - [11, 84.112]
  - - [33708, 1462, 1, 512]
    - [11, 84.387]
  - - [33708, 1520, 1, 512]
    - [11, 86.354]
  - - [33708, 1596, 1, 512]
    - [2, 86.4]
  - - [33708, 1599, 1, 512]
    - [11, 85.984]
  - - [33708, 1615, 1, 512]
    - [11, 85.405]
  - - [33708, 1680, 1, 512]
    - [13, 85.624]
  - - [33708, 1917, 1, 512]
    - [11, 87.218]
  - - [33708, 2205, 1, 512]
    - [11, 86.743]
  - - [33708, 2418, 1, 512]
    - [11, 87.194]
  - - [33708, 3776, 1, 512]
    - [13, 89.157]
  - - [33708, 3780, 1, 512]
    - [13, 87.8]
  - - [33708, 3796, 1, 512]
    - [13, 88.065]
  - - [33708, 3822, 1, 512]
    - [13, 88.555]
  - - [33708, 3835, 1, 512]
    - [15, 89.396]
  - - [33708, 3840, 1, 512]
    - [13, 89.106]
  - - [33708, 3859, 1, 512]
    - [11, 87.86]
  - - [33708, 3870, 1, 512]
    - [11, 87.899]
  - - [33708, 3876, 1, 512]
    - [15, 87.755]
  - - [33708, 3906, 1, 512]
    - [2, 88.656]
  - - [33708, 3910, 1, 512]
    - [15, 88.584]
  - - [33708, 3925, 1, 512]
    - [11, 88.005]
  - - [33708, 3942, 1, 512]
    - [13, 88.133]
  - - [33708, 3944, 1, 512]
    - [13, 88.29]
  - - [33708, 3955, 1, 512]
    - [13, 88.285]
  - - [33708, 3968, 1, 512]
    - [13, 88.892]
  - - [33708, 3976, 1, 512]
    - [2, 88.236]
  - - [33708, 3977, 1, 512]
    - [15, 88.56]
  - - [33708, 3978, 1, 512]
    - [11, 87.967]
  - - [33708, 3990, 1, 512]
    - [2, 88.88]
  - - [33708, 3996, 1, 512]
    - [11, 88.214]
  - - [33708, 3999, 1, 512]
    - [13, 88.204]
  - - [33708, 4005, 1, 512]
    - [13, 88.33]
  - - [33708, 4012, 1, 512]
    - [11, 88.37]
  - - [33708, 4020, 1, 512]
    - [13, 88.661]
  - - [33708, 4026, 1, 512]
    - [11, 88.631]
  - - [33708, 4030, 1, 512]
    - [2, 89.615]
  - - [33708, 4032, 1, 512]
    - [11, 89.057]
  - - [2, 6, 1, 1024]
    - [178, 0.002]
  - - [2, 8, 1, 1024]
    - [180, 0.003]
  - - [3072, 512, 1, 3072]
    - [4, 80.692]
  - - [511, 8192, 1, 8192]
    - [4, 87.655]
  - - [512, 512, 1, 512]
    - [16, 33.791]
  - - [511, 2048, 1, 2048]
    - [32, 74.876]
  - - [4096, 4096, 1, 4096]
    - [3, 92.917]
  - - [1024, 512, 1, 1025]
    - [129, 43.48]
  - - [8192, 8193, 1, 8192]
    - [130, 94.414]
  - - [3072, 3072, 1, 3071]
    - [111, 92.349]
  - - [8192, 8192, 1, 8193]
    - [108, 96.343]
  - - [7681, 8192, 1, 8192]
    - [28, 94.213]
  - - [512, 1023, 1, 1024]
    - [0, 55.439]
  - - [7680, 8192, 1, 8193]
    - [111, 94.612]
  - - [513, 4096, 1, 4096]
    - [32, 80.975]
  - - [3073, 512, 1, 3072]
    - [91, 77.905]
  - - [7680, 8192, 1, 8192]
    - [5, 94.956]
  - - [4096, 4096, 1, 4097]
    - [12, 91.122]
  - - [1025, 1024, 1, 1024]
    - [32, 69.394]
  - - [8192, 8191, 1, 8192]
    - [4, 94.517]
  - - [8192, 512, 1, 8193]
    - [4, 87.165]
  - - [2880, 3071, 1, 3072]
    - [3, 91.535]
  - - [2048, 513, 1, 2048]
    - [37, 74.476]
  - - [1024, 1024, 1, 1025]
    - [33, 55.867]
  - - [960, 1024, 1, 1023]
    - [33, 48.7]
  - - [1024, 1024, 1, 1024]
    - [37, 63.669]
  - - [960, 1025, 1, 1024]
    - [37, 58.743]
  - - [2880, 3072, 1, 3072]
    - [3, 91.798]
  - - [4096, 511, 1, 4096]
    - [8, 81.117]
  - - [512, 3072, 1, 3072]
    - [38, 81.303]
  - - [2049, 512, 1, 2048]
    - [37, 73.409]
  - - [512, 8191, 1, 8192]
    - [4, 87.92]
  - - [513, 1024, 1, 1024]
    - [32, 43.831]
  - - [512, 2048, 1, 2048]
    - [37, 75.727]
  - - [4096, 4095, 1, 4096]
    - [3, 92.998]
  - - [8192, 511, 1, 8192]
    - [2, 86.949]
  - - [513, 512, 1, 512]
    - [16, 34.239]
  - - [1024, 511, 1, 1024]
    - [56, 53.424]
  - - [1024, 512, 1, 1023]
    - [123, 43.163]
  - - [960, 1024, 1, 1025]
    - [6, 49.272]
  - - [8192, 512, 1, 8192]
    - [4, 87.459]
  - - [959, 1024, 1, 1024]
    - [83, 57.166]
  - - [511, 3072, 1, 3072]
    - [37, 83.62]
  - - [7680, 8193, 1, 8192]
    - [5, 94.945]
  - - [2048, 2048, 1, 2048]
    - [4, 84.634]
  - - [2048, 512, 1, 2049]
    - [33, 63.203]
  - - [511, 1024, 1, 1024]
    - [0, 53.661]
  - - [3072, 512, 1, 3073]
    - [38, 78.185]
  - - [512, 2049, 1, 2048]
    - [32, 75.764]
  - - [513, 8192, 1, 8192]
    - [65, 83.811]
  - - [7679, 8192, 1, 8192]
    - [111, 94.894]
  - - [1024, 513, 1, 1024]
    - [37, 44.445]
  - - [3840, 4096, 1, 4097]
    - [108, 91.516]
  - - [2048, 512, 1, 2047]
    - [33, 62.731]
  - - [512, 3072, 1, 3071]
    - [38, 78.19]
  - - [7680, 8192, 1, 8191]
    - [111, 94.597]
  - - [3072, 511, 1, 3072]
    - [85, 81.61]
  - - [8193, 8192, 1, 8192]
    - [28, 94.234]
  - - [512, 4096, 1, 4095]
    - [69, 80.428]
  - - [512, 3071, 1, 3072]
    - [32, 83.95]
  - - [3073, 3072, 1, 3072]
    - [2, 88.883]
  - - [512, 3073, 1, 3072]
    - [2, 78.523]
  - - [4096, 4096, 1, 4095]
    - [111, 91.056]
  - - [1920, 2048, 1, 2047]
    - [132, 81.047]
  - - [1920, 2049, 1, 2048]
    - [2, 84.267]
  - - [512, 8192, 1, 8191]
    - [4, 87.439]
  - - [3840, 4096, 1, 4096]
    - [3, 92.676]
  - - [8191, 512, 1, 8192]
    - [4, 87.202]
  - - [1025, 512, 1, 1024]
    - [37, 43.11]
  - - [2881, 3072, 1, 3072]
    - [2, 90.346]
  - - [512, 4096, 1, 4096]
    - [8, 82.225]
  - - [1024, 1024, 1, 1023]
    - [117, 55.185]
  - - [513, 2048, 1, 2048]
    - [32, 75.579]
  - - [3841, 4096, 1, 4096]
    - [4, 90.93]
  - - [2880, 3072, 1, 3073]
    - [3, 88.483]
  - - [512, 512, 1, 513]
    - [115, 26.698]
  - - [4095, 512, 1, 4096]
    - [8, 81.052]
  - - [1919, 2048, 1, 2048]
    - [3, 87.85]
  - - [1024, 1025, 1, 1024]
    - [37, 69.793]
  - - [1920, 2048, 1, 2048]
    - [4, 83.648]
  - - [8192, 8192, 1, 8192]
    - [4, 94.602]
  - - [512, 2048, 1, 2049]
    - [33, 63.119]
  - - [511, 4096, 1, 4096]
    - [8, 81.51]
  - - [8192, 513, 1, 8192]
    - [28, 78.94]
  - - [513, 3072, 1, 3072]
    - [32, 77.971]
  - - [7680, 8191, 1, 8192]
    - [4, 94.897]
  - - [512, 4097, 1, 4096]
    - [143, 85.26]
  - - [512, 512, 1, 511]
    - [114, 15.511]
  - - [2047, 2048, 1, 2048]
    - [4, 87.859]
  - - [1024, 1023, 1, 1024]
    - [37, 68.571]
  - - [2049, 2048, 1, 2048]
    - [10, 81.117]
  - - [3840, 4095, 1, 4096]
    - [3, 92.734]
  - - [960, 1023, 1, 1024]
    - [37, 57.566]
  - - [2880, 3072, 1, 3071]
    - [119, 89.599]
  - - [3072, 3072, 1, 3073]
    - [119, 91.5]
  - - [2880, 3073, 1, 3072]
    - [3, 91.451]
  - - [2048, 511, 1, 2048]
    - [22, 72.733]
  - - [4096, 513, 1, 4096]
    - [10, 79.858]
  - - [4097, 512, 1, 4096]
    - [8, 81.863]
  - - [8192, 512, 1, 8191]
    - [4, 87.129]
  - - [1921, 2048, 1, 2048]
    - [6, 82.713]
  - - [512, 3072, 1, 3073]
    - [38, 77.905]
  - - [2048, 2049, 1, 2048]
    - [141, 81.502]
  - - [3072, 512, 1, 3071]
    - [131, 77.966]
  - - [3071, 3072, 1, 3072]
    - [12, 93.026]
  - - [3840, 4097, 1, 4096]
    - [3, 92.714]
  - - [1023, 512, 1, 1024]
    - [10, 53.476]
  - - [2048, 2047, 1, 2048]
    - [4, 87.559]
  - - [2047, 512, 1, 2048]
    - [37, 73.393]
  - - [2879, 3072, 1, 3072]
    - [3, 90.968]
  - - [3072, 513, 1, 3072]
    - [14, 75.127]
  - - [512, 1024, 1, 1024]
    - [0, 55.114]
  - - [512, 4095, 1, 4096]
    - [8, 81.736]
  - - [512, 1024, 1, 1025]
    - [91, 43.402]
  - - [3071, 512, 1, 3072]
    - [97, 79.127]
  - - [512, 513, 1, 512]
    - [16, 33.858]
  - - [512, 511, 1, 512]
    - [0, 33.17]
  - - [4096, 512, 1, 4096]
    - [8, 81.705]
  - - [4097, 4096, 1, 4096]
    - [3, 92.737]
  - - [2048, 2048, 1, 2047]
    - [101, 81.338]
  - - [3839, 4096, 1, 4096]
    - [3, 92.284]
  - - [512, 4096, 1, 4097]
    - [69, 80.301]
  - - [3072, 3073, 1, 3072]
    - [2, 89.242]
  - - [512, 2047, 1, 2048]
    - [32, 74.986]
  - - [2048, 2048, 1, 2049]
    - [132, 81.555]
  - - [8191, 8192, 1, 8192]
    - [4, 94.352]
  - - [3072, 3071, 1, 3072]
    - [12, 92.677]
  - - [4096, 512, 1, 4097]
    - [133, 79.036]
  - - [3840, 4096, 1, 4095]
    - [108, 91.59]
  - - [1920, 2047, 1, 2048]
    - [37, 83.306]
  - - [512, 1025, 1, 1024]
    - [32, 54.669]
  - - [8192, 8192, 1, 8191]
    - [42, 94.207]
  - - [512, 2048, 1, 2047]
    - [33, 63.514]
  - - [3072, 3072, 1, 3072]
    - [12, 93.282]
  - - [512, 8193, 1, 8192]
    - [6, 85.055]
  - - [511, 512, 1, 512]
    - [16, 34.497]
  - - [4096, 512, 1, 4095]
    - [133, 76.321]
  - - [960, 1024, 1, 1024]
    - [37, 59.021]
  - - [8193, 512, 1, 8192]
    - [8, 84.248]
  - - [961, 1024, 1, 1024]
    - [32, 65.625]
  - - [512, 1024, 1, 1023]
    - [91, 43.009]
  - - [4095, 4096, 1, 4096]
    - [3, 92.936]
  - - [4096, 4097, 1, 4096]
    - [3, 93.057]
  - - [512, 8192, 1, 8192]
    - [4, 88.171]
  - - [512, 8192, 1, 8193]
    - [4, 87.445]
  - - [1023, 1024, 1, 1024]
    - [32, 68.863]
  - - [1920, 2048, 1, 2049]
    - [132, 81.328]
  - - [479, 512, 1, 512]
    - [16, 32.153]
  - - [479, 1024, 1, 1024]
    - [16, 51.327]
  - - [479, 2048, 1, 2048]
    - [37, 68.592]
  - - [479, 3072, 1, 3072]
    - [37, 79.608]
  - - [479, 4096, 1, 4096]
    - [92, 81.381]
  - - [479, 8192, 1, 8192]
    - [3, 92.095]
  - - [480, 511, 1, 512]
    - [0, 31.796]
  - - [480, 512, 1, 511]
    - [114, 14.678]
  - - [480, 512, 1, 513]
    - [54, 24.811]
  - - [480, 513, 1, 512]
    - [16, 32.843]
  - - [480, 1023, 1, 1024]
    - [64, 51.618]
  - - [480, 1024, 1, 1023]
    - [134, 39.205]
  - - [480, 1024, 1, 1025]
    - [120, 39.555]
  - - [480, 1025, 1, 1024]
    - [0, 51.719]
  - - [480, 2047, 1, 2048]
    - [83, 68.055]
  - - [480, 2048, 1, 2047]
    - [145, 61.041]
  - - [480, 2048, 1, 2049]
    - [157, 60.58]
  - - [480, 2049, 1, 2048]
    - [32, 69.376]
  - - [480, 3071, 1, 3072]
    - [32, 79.315]
  - - [480, 3072, 1, 3071]
    - [4, 71.206]
  - - [480, 3072, 1, 3073]
    - [4, 71.252]
  - - [480, 3073, 1, 3072]
    - [32, 80.429]
  - - [480, 4095, 1, 4096]
    - [8, 81.118]
  - - [480, 4096, 1, 4095]
    - [86, 81.357]
  - - [480, 4096, 1, 4097]
    - [138, 81.491]
  - - [480, 4097, 1, 4096]
    - [32, 80.865]
  - - [480, 8191, 1, 8192]
    - [2, 88.013]
  - - [480, 8192, 1, 8191]
    - [4, 87.497]
  - - [480, 8192, 1, 8193]
    - [119, 91.618]
  - - [480, 8193, 1, 8192]
    - [119, 92.007]
  - - [481, 512, 1, 512]
    - [16, 32.472]
  - - [481, 1024, 1, 1024]
    - [0, 51.894]
  - - [481, 2048, 1, 2048]
    - [37, 71.309]
  - - [481, 3072, 1, 3072]
    - [2, 75.45]
  - - [481, 4096, 1, 4096]
    - [143, 81.137]
  - - [481, 8192, 1, 8192]
    - [4, 82.612]
  - - [511, 480, 1, 512]
    - [16, 31.975]
  - - [512, 479, 1, 512]
    - [16, 31.971]
  - - [512, 480, 1, 511]
    - [10, 24.932]
  - - [512, 480, 1, 513]
    - [114, 24.703]
  - - [512, 481, 1, 512]
    - [16, 32.286]
  - - [513, 480, 1, 512]
    - [16, 32.467]
  - - [1023, 480, 1, 1024]
    - [0, 50.808]
  - - [1024, 479, 1, 1024]
    - [0, 50.752]
  - - [1024, 480, 1, 1023]
    - [100, 39.205]
  - - [1024, 480, 1, 1025]
    - [135, 38.548]
  - - [1024, 481, 1, 1024]
    - [0, 51.659]
  - - [1025, 480, 1, 1024]
    - [43, 51.137]
  - - [2047, 480, 1, 2048]
    - [37, 68.881]
  - - [2048, 479, 1, 2048]
    - [37, 67.94]
  - - [2048, 480, 1, 2047]
    - [29, 60.237]
  - - [2048, 480, 1, 2049]
    - [29, 60.525]
  - - [2048, 481, 1, 2048]
    - [37, 69.617]
  - - [2049, 480, 1, 2048]
    - [37, 68.637]
  - - [3071, 480, 1, 3072]
    - [37, 78.977]
  - - [3072, 479, 1, 3072]
    - [91, 74.841]
  - - [3072, 480, 1, 3071]
    - [4, 70.835]
  - - [3072, 480, 1, 3073]
    - [4, 70.881]
  - - [3072, 481, 1, 3072]
    - [90, 75.267]
  - - [3073, 480, 1, 3072]
    - [91, 74.846]
  - - [480, 512, 1, 512]
    - [16, 32.59]
  - - [480, 1024, 1, 1024]
    - [16, 52.143]
  - - [480, 2048, 1, 2048]
    - [32, 68.831]
  - - [480, 3072, 1, 3072]
    - [2, 74.959]
  - - [480, 4096, 1, 4096]
    - [8, 81.365]
  - - [480, 8192, 1, 8192]
    - [2, 88.539]
  - - [512, 480, 1, 512]
    - [0, 31.503]
  - - [1024, 480, 1, 1024]
    - [0, 51.669]
  - - [2048, 480, 1, 2048]
    - [37, 68.701]
  - - [3072, 480, 1, 3072]
    - [37, 82.884]
  - - [4096, 480, 1, 4096]
    - [8, 81.858]
  - - [8192, 480, 1, 8192]
    - [2, 88.493]
  - - [1024, 3840, 1, 1024]
    - [37, 79.037]
  - - [1024, 3840, 1, 4096]
    - [72, 86.945]
  - - [1024, 3968, 1, 1024]
    - [10, 79.453]
  - - [1024, 3968, 1, 4096]
    - [4, 84.511]
  - - [1024, 7200, 1, 1024]
    - [10, 83.741]
  - - [1024, 7200, 1, 4096]
    - [8, 88.975]
  - - [1024, 8160, 1, 1024]
    - [8, 85.047]
  - - [1024, 8160, 1, 4096]
    - [8, 90.417]
  - - [1024, 9520, 1, 1024]
    - [3, 88.02]
  - - [1024, 9520, 1, 4096]
    - [4, 92.618]
  - - [1024, 10200, 1, 1024]
    - [2, 86.723]
  - - [1024, 10200, 1, 4096]
    - [69, 93.337]
  - - [4096, 3840, 1, 1024]
    - [3, 88.919]
  - - [4096, 3968, 1, 1024]
    - [11, 86.86]
  - - [4096, 7200, 1, 1024]
    - [3, 90.076]
  - - [4096, 8160, 1, 1024]
    - [3, 90.897]
  - - [4096, 9520, 1, 1024]
    - [2, 91.544]
  - - [4096, 10200, 1, 1024]
    - [3, 91.185]
  - - [42720, 3968, 1, 1024]
    - [2, 92.963]
  - - [42720, 7200, 1, 1024]
    - [15, 94.579]
  - - [42720, 9520, 1, 1024]
    - [15, 93.929]
  - - [15, 14, 1, 64]
    - [62, 0.008]
  - - [17, 15, 1, 64]
    - [62, 0.01]
  - - [30, 31, 1, 64]
    - [21, 0.038]
  - - [1024, 32, 1, 1024]
    - [18, 8.641]
  - - [2, 32, 1, 1024]
    - [187, 0.01]
  - - [2, 4, 1, 1024]
    - [166, 0.001]
  - - [512, 512, 1, 64]
    - [16, 8.592]
  - - [64, 512, 1, 512]
    - [18, 6.575]
  - - [1024, 512, 1, 2048]
    - [221, 56.2]
  - - [1024, 960, 1, 1024]
    - [83, 58.744]
  - - [1024, 960, 1, 1600]
    - [37, 66.261]
  - - [64, 960, 1, 1024]
    - [53, 15.928]
  - - [2048, 960, 1, 2048]
    - [8, 77.596]
  - - [2048, 960, 1, 74]
    - [1, 26.227]
  - - [1024, 1024, 1, 960]
    - [10, 69.259]
  - - [1600, 1024, 1, 960]
    - [4, 73.302]
  - - [2048, 2048, 1, 960]
    - [10, 81.776]
  - - [4096, 1024, 1, 257]
    - [136, 53.737]
  - - [10240, 8976, 1, 256]
    - [33, 84.036]
  - - [1024, 1600, 1, 1024]
    - [2, 75.233]
  - - [1024, 1600, 1, 560]
    - [2, 70.082]
  - - [10496, 8976, 1, 256]
    - [33, 83.581]
  - - [11264, 8976, 1, 256]
    - [33, 83.238]
  - - [11776, 8976, 1, 256]
    - [33, 83.694]
  - - [12544, 8976, 1, 256]
    - [33, 82.7]
  - - [1280, 8976, 1, 256]
    - [2, 75.7]
  - - [13312, 8976, 1, 256]
    - [33, 83.641]
  - - [13568, 8976, 1, 256]
    - [33, 84.095]
  - - [13824, 8976, 1, 256]
    - [33, 83.954]
  - - [15104, 8976, 1, 256]
    - [33, 84.058]
  - - [15360, 8976, 1, 256]
    - [33, 84.22]
  - - [15872, 8976, 1, 256]
    - [33, 84.158]
  - - [1600, 1, 1, 1024]
    - [175, 0.236]
  - - [16128, 8976, 1, 256]
    - [33, 84.321]
  - - [17152, 8976, 1, 256]
    - [33, 84.194]
  - - [1792, 8976, 1, 256]
    - [2, 77.001]
  - - [18176, 8976, 1, 256]
    - [33, 84.514]
  - - [18688, 8976, 1, 256]
    - [33, 84.773]
  - - [18944, 8976, 1, 256]
    - [33, 84.365]
  - - [19712, 8976, 1, 256]
    - [33, 84.417]
  - - [19968, 8976, 1, 256]
    - [33, 84.387]
  - - [200, 1, 1, 1024]
    - [165, 0.032]
  - - [20480, 8976, 1, 256]
    - [2, 81.135]
  - - [2048, 114, 1, 512]
    - [0, 28.962]
  - - [2048, 114, 1, 768]
    - [0, 35.287]
  - - [2048, 1536, 1, 512]
    - [92, 76.566]
  - - [2048, 1536, 1, 768]
    - [6, 80.47]
  - - [2048, 215, 1, 512]
    - [0, 40.967]
  - - [2048, 215, 1, 768]
    - [0, 45.492]
  - - [2048, 256, 1, 512]
    - [10, 46.173]
  - - [2048, 256, 1, 768]
    - [0, 51.995]
  - - [2048, 512, 1, 2048]
    - [10, 73.373]
  - - [2048, 512, 1, 67]
    - [1, 19.306]
  - - [2048, 512, 1, 74]
    - [1, 22.56]
  - - [2048, 684, 1, 512]
    - [10, 62.762]
  - - [2048, 684, 1, 768]
    - [10, 66.326]
  - - [2048, 8976, 1, 256]
    - [2, 77.234]
  - - [20992, 8976, 1, 256]
    - [33, 84.679]
  - - [21248, 8976, 1, 256]
    - [33, 84.348]
  - - [2304, 8976, 1, 256]
    - [3, 77.065]
  - - [23552, 8976, 1, 256]
    - [33, 84.746]
  - - [2560, 8976, 1, 256]
    - [2, 77.227]
  - - [256, 10496, 1, 1024]
    - [10, 74.618]
  - - [256, 11264, 1, 1024]
    - [10, 80.212]
  - - [256, 11520, 1, 1024]
    - [32, 73.399]
  - - [256, 11776, 1, 1024]
    - [6, 80.416]
  - - [256, 12544, 1, 1024]
    - [10, 78.202]
  - - [256, 1280, 1, 1024]
    - [87, 34.447]
  - - [256, 13312, 1, 1024]
    - [6, 80.197]
  - - [256, 14336, 1, 1024]
    - [10, 79.364]
  - - [256, 14592, 1, 1024]
    - [85, 80.442]
  - - [256, 14848, 1, 1024]
    - [10, 81.739]
  - - [256, 15104, 1, 1024]
    - [6, 81.144]
  - - [256, 1536, 1, 1024]
    - [37, 56.18]
  - - [256, 16128, 1, 1024]
    - [10, 80.428]
  - - [256, 18176, 1, 1024]
    - [10, 81.677]
  - - [256, 18944, 1, 1024]
    - [6, 84.009]
  - - [256, 19200, 1, 1024]
    - [6, 85.241]
  - - [256, 20480, 1, 1024]
    - [6, 81.307]
  - - [256, 20992, 1, 1024]
    - [6, 85.604]
  - - [256, 21248, 1, 1024]
    - [10, 81.474]
  - - [256, 21504, 1, 1024]
    - [85, 82.082]
  - - [256, 22016, 1, 1024]
    - [6, 83.097]
  - - [256, 22344, 1, 1024]
    - [8, 83.508]
  - - [256, 2304, 1, 1024]
    - [10, 61.443]
  - - [256, 23296, 1, 1024]
    - [10, 82.548]
  - - [256, 23552, 1, 1024]
    - [32, 82.588]
  - - [256, 2560, 1, 1024]
    - [32, 67.358]
  - - [256, 2816, 1, 1024]
    - [91, 59.62]
  - - [256, 31488, 1, 1024]
    - [6, 86.672]
  - - [256, 3328, 1, 1024]
    - [96, 59.742]
  - - [256, 33536, 1, 1024]
    - [2, 84.385]
  - - [256, 3584, 1, 1024]
    - [37, 61.542]
  - - [256, 44505, 1, 1024]
    - [6, 85.478]
  - - [256, 4608, 1, 1024]
    - [6, 68.648]
  - - [256, 4864, 1, 1024]
    - [6, 72.008]
  - - [256, 5376, 1, 1024]
    - [10, 68.661]
  - - [256, 5888, 1, 1024]
    - [10, 74.555]
  - - [256, 6144, 1, 1024]
    - [85, 76.809]
  - - [256, 6400, 1, 1024]
    - [4, 74.638]
  - - [256, 6656, 1, 1024]
    - [131, 70.776]
  - - [256, 684, 1, 1024]
    - [56, 21.631]
  - - [256, 7168, 1, 1024]
    - [10, 72.626]
  - - [256, 7424, 1, 1024]
    - [10, 75.026]
  - - [256, 7936, 1, 1024]
    - [6, 74.232]
  - - [256, 8192, 1, 1024]
    - [6, 76.566]
  - - [256, 8448, 1, 1024]
    - [37, 69.81]
  - - [256, 8960, 1, 1024]
    - [10, 74.86]
  - - [256, 9984, 1, 1024]
    - [10, 71.526]
  - - [2816, 8976, 1, 256]
    - [2, 77.839]
  - - [28672, 8976, 1, 256]
    - [2, 81.049]
  - - [3072, 8976, 1, 256]
    - [2, 78.295]
  - - [31488, 8976, 1, 256]
    - [33, 84.442]
  - - [32, 1600, 1, 512]
    - [21, 9.528]
  - - [3328, 8976, 1, 256]
    - [2, 78.229]
  - - [33536, 8976, 1, 256]
    - [33, 84.339]
  - - [3840, 8976, 1, 256]
    - [2, 79.357]
  - - [4096, 8976, 1, 256]
    - [2, 79.254]
  - - [4352, 8976, 1, 256]
    - [2, 79.605]
  - - [44505, 8976, 1, 256]
    - [11, 82.777]
  - - [4608, 8976, 1, 256]
    - [2, 80.108]
  - - [4864, 8976, 1, 256]
    - [2, 80.583]
  - - [5120, 8976, 1, 256]
    - [33, 80.531]
  - - [512, 1, 1, 2048]
    - [165, 0.153]
  - - [512, 1600, 1, 512]
    - [1, 58.34]
  - - [5376, 8976, 1, 256]
    - [2, 80.868]
  - - [5632, 8976, 1, 256]
    - [33, 81.155]
  - - [5888, 8976, 1, 256]
    - [2, 81.107]
  - - [6144, 8976, 1, 256]
    - [33, 82.634]
  - - [6400, 8976, 1, 256]
    - [33, 81.401]
  - - [64, 512, 1, 1024]
    - [25, 9.001]
  - - [684, 8976, 1, 256]
    - [66, 68.371]
  - - [7168, 8976, 1, 256]
    - [33, 82.095]
  - - [7936, 8976, 1, 256]
    - [33, 82.11]
  - - [8192, 8976, 1, 256]
    - [108, 72.643]
  - - [8448, 8976, 1, 256]
    - [33, 82.761]
  - - [8960, 8976, 1, 256]
    - [33, 83.414]
  - - [9472, 8976, 1, 256]
    - [33, 82.888]
  - - [9728, 8976, 1, 256]
    - [33, 83.3]
  - - [9984, 8976, 1, 256]
    - [33, 83.076]
  - - [33, 33, 1600, 32]
    - [1, 8.266]
  - - [512, 32768, 1, 13]
    - [2, 10.385]
  - - [256, 32768, 1, 512]
    - [7, 80.784]
  - - [128, 32768, 1, 512]
    - [54, 72.657]
  - - [1024, 32768, 1, 479]
    - [137, 81.486]
  - - [1024, 32768, 1, 1024]
    - [108, 90.814]
  - - [512, 32768, 1, 1024]
    - [2, 87.632]
  - - [1023, 2048, 1, 4096]
    - [8, 81.196]
  - - [1025, 2048, 1, 4096]
    - [37, 78.381]
  - - [1024, 2047, 1, 4096]
    - [8, 81.321]
  - - [1024, 2049, 1, 4096]
    - [86, 84.965]
  - - [1024, 2048, 1, 4095]
    - [138, 80.145]
  - - [1024, 2048, 1, 4097]
    - [69, 79.986]
  - - [767, 1280, 1, 768]
    - [37, 61.781]
  - - [769, 1280, 1, 768]
    - [32, 53.066]
  - - [768, 1279, 1, 768]
    - [0, 62.38]
  - - [768, 1281, 1, 768]
    - [37, 62.708]
  - - [768, 1280, 1, 767]
    - [92, 45.321]
  - - [768, 1280, 1, 769]
    - [8, 45.016]
  - - [1023, 3072, 1, 1024]
    - [6, 82.402]
  - - [1025, 3072, 1, 1024]
    - [37, 76.803]
  - - [1024, 3071, 1, 1024]
    - [6, 82.315]
  - - [1024, 3073, 1, 1024]
    - [10, 77.407]
  - - [1024, 3072, 1, 1023]
    - [110, 74.373]
  - - [1024, 3072, 1, 1025]
    - [110, 73.949]
  - - [3071, 512, 1, 1024]
    - [10, 74.959]
  - - [3073, 512, 1, 1024]
    - [2, 71.254]
  - - [3072, 511, 1, 1024]
    - [22, 75.461]
  - - [3072, 513, 1, 1024]
    - [10, 64.944]
  - - [3072, 512, 1, 1023]
    - [140, 68.603]
  - - [3072, 512, 1, 1025]
    - [140, 68.478]
  - - [128, 32768, 1, 256]
    - [7, 60.261]
  - - [1024, 4096, 1, 480]
    - [2, 74.63]
  - - [512, 4096, 1, 1024]
    - [6, 76.869]
  - - [256, 4096, 1, 512]
    - [10, 61.565]
  - - [512, 55296, 1, 13]
    - [2, 12.214]
  - - [256, 55296, 1, 512]
    - [7, 83.494]
  - - [128, 55296, 1, 256]
    - [7, 59.303]
  - - [1024, 6912, 1, 480]
    - [2, 79.072]
  - - [1024, 6912, 1, 1024]
    - [2, 87.875]
  - - [512, 6912, 1, 1024]
    - [32, 78.602]
  - - [256, 6912, 1, 512]
    - [54, 55.877]
  - - [383, 384, 1, 384]
    - [56, 9.545]
  - - [385, 384, 1, 384]
    - [45, 19.988]
  - - [384, 383, 1, 384]
    - [0, 20.362]
  - - [384, 385, 1, 384]
    - [47, 8.89]
  - - [384, 384, 1, 383]
    - [0, 8.369]
  - - [384, 384, 1, 385]
    - [56, 9.003]
  - - [767, 768, 1, 768]
    - [32, 55.402]
  - - [769, 768, 1, 768]
    - [32, 42.521]
  - - [768, 767, 1, 768]
    - [10, 55.102]
  - - [768, 769, 1, 768]
    - [10, 57.097]
  - - [768, 768, 1, 767]
    - [63, 45.106]
  - - [768, 768, 1, 769]
    - [63, 45.024]
  - - [1151, 1152, 1, 1152]
    - [37, 75.814]
  - - [1153, 1152, 1, 1152]
    - [37, 67.539]
  - - [1152, 1151, 1, 1152]
    - [32, 75.233]
  - - [1152, 1153, 1, 1152]
    - [32, 67.672]
  - - [1152, 1152, 1, 1151]
    - [131, 56.082]
  - - [1152, 1152, 1, 1153]
    - [132, 57.206]
  - - [1535, 1536, 1, 1536]
    - [10, 79.189]
  - - [1537, 1536, 1, 1536]
    - [37, 79.523]
  - - [1536, 1535, 1, 1536]
    - [37, 79.112]
  - - [1536, 1537, 1, 1536]
    - [37, 79.64]
  - - [1536, 1536, 1, 1535]
    - [103, 75.77]
  - - [1536, 1536, 1, 1537]
    - [103, 76.258]
  - - [1919, 1920, 1, 1920]
    - [10, 82.614]
  - - [1921, 1920, 1, 1920]
    - [37, 83.305]
  - - [1920, 1919, 1, 1920]
    - [3, 85.927]
  - - [1920, 1921, 1, 1920]
    - [10, 82.141]
  - - [1920, 1920, 1, 1919]
    - [103, 81.225]
  - - [1920, 1920, 1, 1921]
    - [103, 81.455]
  - - [2303, 2304, 1, 2304]
    - [4, 89.136]
  - - [2305, 2304, 1, 2304]
    - [54, 84.2]
  - - [2304, 2303, 1, 2304]
    - [2, 88.977]
  - - [2304, 2305, 1, 2304]
    - [10, 85.585]
  - - [2304, 2304, 1, 2303]
    - [108, 86.076]
  - - [2304, 2304, 1, 2305]
    - [108, 86.02]
  - - [2687, 2688, 1, 2688]
    - [141, 85.518]
  - - [2689, 2688, 1, 2688]
    - [3, 88.938]
  - - [2688, 2687, 1, 2688]
    - [141, 85.736]
  - - [2688, 2689, 1, 2688]
    - [8, 86.011]
  - - [2688, 2688, 1, 2687]
    - [111, 82.44]
  - - [2688, 2688, 1, 2689]
    - [12, 82.362]
  - - [3455, 3456, 1, 3456]
    - [3, 92.477]
  - - [3457, 3456, 1, 3456]
    - [28, 92.375]
  - - [3456, 3455, 1, 3456]
    - [3, 92.902]
  - - [3456, 3457, 1, 3456]
    - [49, 91.108]
  - - [3456, 3456, 1, 3455]
    - [15, 91.502]
  - - [3456, 3456, 1, 3457]
    - [3, 91.739]
  - - [3839, 3840, 1, 3840]
    - [12, 93.544]
  - - [3841, 3840, 1, 3840]
    - [3, 92.293]
  - - [3840, 3839, 1, 3840]
    - [12, 93.114]
  - - [3840, 3841, 1, 3840]
    - [108, 93.379]
  - - [3840, 3840, 1, 3839]
    - [12, 92.978]
  - - [3840, 3840, 1, 3841]
    - [111, 93.009]
  - - [4223, 4224, 1, 4224]
    - [3, 93.021]
  - - [4225, 4224, 1, 4224]
    - [3, 93.182]
  - - [4224, 4223, 1, 4224]
    - [3, 93.24]
  - - [4224, 4225, 1, 4224]
    - [3, 93.402]
  - - [4224, 4224, 1, 4223]
    - [108, 92.526]
  - - [4224, 4224, 1, 4225]
    - [108, 92.48]
  - - [4607, 4608, 1, 4608]
    - [3, 94.991]
  - - [4609, 4608, 1, 4608]
    - [4, 92.379]
  - - [4608, 4607, 1, 4608]
    - [3, 95.172]
  - - [4608, 4609, 1, 4608]
    - [2, 92.725]
  - - [4608, 4608, 1, 4607]
    - [111, 95.551]
  - - [4608, 4608, 1, 4609]
    - [111, 95.525]
  - - [4991, 4992, 1, 4992]
    - [5, 93.665]
  - - [4993, 4992, 1, 4992]
    - [49, 92.471]
  - - [4992, 4991, 1, 4992]
    - [5, 93.864]
  - - [4992, 4993, 1, 4992]
    - [73, 93.672]
  - - [4992, 4992, 1, 4991]
    - [111, 95.541]
  - - [4992, 4992, 1, 4993]
    - [73, 93.157]
  - - [5375, 5376, 1, 5376]
    - [5, 94.021]
  - - [5377, 5376, 1, 5376]
    - [8, 92.733]
  - - [5376, 5375, 1, 5376]
    - [3, 94.067]
  - - [5376, 5377, 1, 5376]
    - [86, 93.106]
  - - [5376, 5376, 1, 5375]
    - [12, 96.537]
  - - [5376, 5376, 1, 5377]
    - [143, 93.505]
  - - [5759, 5760, 1, 5760]
    - [3, 94.771]
  - - [5761, 5760, 1, 5760]
    - [5, 92.437]
  - - [5760, 5759, 1, 5760]
    - [3, 95.129]
  - - [5760, 5761, 1, 5760]
    - [12, 93.666]
  - - [5760, 5760, 1, 5759]
    - [73, 94.366]
  - - [5760, 5760, 1, 5761]
    - [73, 94.436]
  - - [6143, 6144, 1, 6144]
    - [12, 95.274]
  - - [6145, 6144, 1, 6144]
    - [3, 94.072]
  - - [6144, 6143, 1, 6144]
    - [12, 95.262]
  - - [6144, 6145, 1, 6144]
    - [73, 94.084]
  - - [6144, 6144, 1, 6143]
    - [111, 94.853]
  - - [6144, 6144, 1, 6145]
    - [111, 94.781]
  - - [6527, 6528, 1, 6528]
    - [111, 94.213]
  - - [6529, 6528, 1, 6528]
    - [3, 93.764]
  - - [6528, 6527, 1, 6528]
    - [12, 94.174]
  - - [6528, 6529, 1, 6528]
    - [12, 94.267]
  - - [6528, 6528, 1, 6527]
    - [111, 93.8]
  - - [6528, 6528, 1, 6529]
    - [144, 93.73]
  - - [6911, 6912, 1, 6912]
    - [5, 94.454]
  - - [6913, 6912, 1, 6912]
    - [5, 94.327]
  - - [6912, 6911, 1, 6912]
    - [5, 94.671]
  - - [6912, 6913, 1, 6912]
    - [5, 94.329]
  - - [6912, 6912, 1, 6911]
    - [142, 94.107]
  - - [6912, 6912, 1, 6913]
    - [142, 94.06]
  - - [7295, 7296, 1, 7296]
    - [5, 95.194]
  - - [7297, 7296, 1, 7296]
    - [49, 94.33]
  - - [7296, 7295, 1, 7296]
    - [5, 95.501]
  - - [7296, 7297, 1, 7296]
    - [73, 95.174]
  - - [7296, 7296, 1, 7295]
    - [5, 94.69]
  - - [7296, 7296, 1, 7297]
    - [73, 94.696]
  - - [7679, 7680, 1, 7680]
    - [5, 94.865]
  - - [7681, 7680, 1, 7680]
    - [5, 94.767]
  - - [7680, 7679, 1, 7680]
    - [5, 95.158]
  - - [7680, 7681, 1, 7680]
    - [5, 94.905]
  - - [7680, 7680, 1, 7679]
    - [12, 94.661]
  - - [7680, 7680, 1, 7681]
    - [5, 94.844]
  - - [384, 384, 1, 384]
    - [22, 19.629]
  - - [768, 768, 1, 768]
    - [85, 59.344]
  - - [1152, 1152, 1, 1152]
    - [37, 63.988]
  - - [1536, 1536, 1, 1536]
    - [10, 82.649]
  - - [1920, 1920, 1, 1920]
    - [12, 86.043]
  - - [2304, 2304, 1, 2304]
    - [108, 86.377]
  - - [2688, 2688, 1, 2688]
    - [141, 89.258]
  - - [3456, 3456, 1, 3456]
    - [3, 92.816]
  - - [3840, 3840, 1, 3840]
    - [12, 97.482]
  - - [4224, 4224, 1, 4224]
    - [2, 96.679]
  - - [4608, 4608, 1, 4608]
    - [3, 98.717]
  - - [4992, 4992, 1, 4992]
    - [3, 97.461]
  - - [5376, 5376, 1, 5376]
    - [3, 97.71]
  - - [5760, 5760, 1, 5760]
    - [3, 98.499]
  - - [6144, 6144, 1, 6144]
    - [12, 99.236]
  - - [6528, 6528, 1, 6528]
    - [111, 98.099]
  - - [6912, 6912, 1, 6912]
    - [15, 98.053]
  - - [7296, 7296, 1, 7296]
    - [15, 98.718]
  - - [7680, 7680, 1, 7680]
    - [12, 98.747]
  - - [128, 128, 49, 1152]
    - [52, 64.82]
  - - [128, 128, 36, 12000]
    - [87, 69.721]
  - - [128, 128, 49, 1216]
    - [27, 66.158]
  - - [128, 128, 36, 1800]
    - [114, 54.619]
  - - [128, 128, 36, 1900]
    - [39, 54.481]
  - - [128, 128, 64, 5880]
    - [8, 65.657]
  - - [128, 128, 49, 7680]
    - [27, 80.446]
  - - [128, 128, 64, 882]
    - [117, 52.759]
  - - [128, 128, 64, 931]
    - [110, 53.718]
  - - [128, 64, 121, 1152]
    - [14, 51.564]
  - - [128, 64, 81, 12000]
    - [52, 64.949]
  - - [128, 64, 121, 1216]
    - [14, 52.281]
  - - [128, 64, 81, 1800]
    - [27, 56.78]
  - - [128, 64, 81, 1900]
    - [27, 56.76]
  - - [128, 64, 49, 20280]
    - [14, 70.796]
  - - [128, 64, 49, 3042]
    - [115, 61.97]
  - - [128, 64, 49, 3211]
    - [115, 63.275]
  - - [128, 64, 25, 43320]
    - [201, 64.084]
  - - [128, 64, 169, 5880]
    - [52, 60.132]
  - - [128, 64, 25, 6498]
    - [100, 53.31]
  - - [128, 64, 25, 6859]
    - [100, 52.492]
  - - [128, 64, 121, 7680]
    - [14, 64.102]
  - - [128, 64, 169, 882]
    - [27, 48.357]
  - - [128, 64, 169, 931]
    - [52, 49.689]
  - - [256, 128, 25, 1080]
    - [2, 67.694]
  - - [256, 128, 49, 1152]
    - [105, 71.308]
  - - [256, 128, 121, 120]
    - [2, 34.589]
  - - [256, 128, 169, 120]
    - [2, 37.242]
  - - [256, 128, 36, 120]
    - [1, 31.738]
  - - [256, 128, 49, 120]
    - [2, 20.205]
  - - [256, 128, 64, 120]
    - [1, 26.039]
  - - [256, 128, 36, 12000]
    - [99, 81.827]
  - - [256, 128, 49, 1216]
    - [146, 71.711]
  - - [256, 128, 25, 162]
    - [1, 32.329]
  - - [256, 128, 25, 171]
    - [117, 31.565]
  - - [256, 128, 121, 18]
    - [1, 12.323]
  - - [256, 128, 169, 18]
    - [1, 12.619]
  - - [256, 128, 36, 18]
    - [112, 7.717]
  - - [256, 128, 49, 18]
    - [147, 8.741]
  - - [256, 128, 64, 18]
    - [1, 10.31]
  - - [256, 128, 36, 1800]
    - [8, 68.893]
  - - [256, 128, 121, 19]
    - [1, 12.168]
  - - [256, 128, 169, 19]
    - [1, 12.92]
  - - [256, 128, 36, 19]
    - [112, 7.891]
  - - [256, 128, 49, 19]
    - [112, 9.166]
  - - [256, 128, 64, 19]
    - [1, 5.317]
  - - [256, 128, 36, 1900]
    - [6, 68.573]
  - - [256, 128, 49, 480]
    - [105, 62.808]
  - - [256, 128, 81, 480]
    - [13, 68.843]
  - - [256, 128, 64, 5880]
    - [6, 81.628]
  - - [256, 128, 49, 72]
    - [1, 27.277]
  - - [256, 128, 81, 72]
    - [2, 31.432]
  - - [256, 128, 49, 76]
    - [1, 26.439]
  - - [256, 128, 81, 76]
    - [2, 32.123]
  - - [256, 128, 49, 7680]
    - [38, 83.492]
  - - [256, 128, 64, 882]
    - [117, 66.315]
  - - [256, 128, 64, 931]
    - [110, 67.788]
  - - [256, 256, 49, 1152]
    - [10, 76.546]
  - - [256, 256, 36, 12000]
    - [123, 89.375]
  - - [256, 256, 49, 1216]
    - [10, 77.116]
  - - [256, 256, 36, 1800]
    - [2, 76.37]
  - - [256, 256, 36, 1900]
    - [109, 75.295]
  - - [256, 256, 64, 5880]
    - [121, 86.46]
  - - [256, 256, 49, 7680]
    - [4, 83.536]
  - - [256, 256, 64, 882]
    - [101, 72.993]
  - - [256, 256, 64, 931]
    - [109, 74.034]
  - - [340, 256, 49, 1152]
    - [85, 78.075]
  - - [340, 256, 36, 120]
    - [2, 37.573]
  - - [340, 256, 49, 120]
    - [133, 37.443]
  - - [340, 256, 64, 120]
    - [110, 40.167]
  - - [340, 256, 36, 12000]
    - [37, 80.326]
  - - [340, 256, 49, 1216]
    - [85, 78.325]
  - - [340, 256, 36, 18]
    - [1, 10.547]
  - - [340, 256, 49, 18]
    - [1, 10.914]
  - - [340, 256, 64, 18]
    - [1, 11.269]
  - - [340, 256, 36, 1800]
    - [145, 70.238]
  - - [340, 256, 36, 19]
    - [1, 10.732]
  - - [340, 256, 49, 19]
    - [1, 11.63]
  - - [340, 256, 64, 19]
    - [1, 11.72]
  - - [340, 256, 36, 1900]
    - [6, 70.515]
  - - [340, 256, 64, 5880]
    - [148, 82.697]
  - - [340, 256, 49, 7680]
    - [120, 79.899]
  - - [340, 256, 64, 882]
    - [101, 71.128]
  - - [340, 256, 64, 931]
    - [109, 71.65]
  - - [510, 256, 49, 120]
    - [110, 42.191]
  - - [510, 256, 64, 120]
    - [149, 43.787]
  - - [510, 256, 49, 18]
    - [1, 11.356]
  - - [510, 256, 64, 18]
    - [1, 11.567]
  - - [510, 256, 49, 19]
    - [1, 11.655]
  - - [510, 256, 64, 19]
    - [1, 12.045]
  - - [510, 256, 36, 480]
    - [85, 76.273]
  - - [510, 256, 36, 72]
    - [1, 29.787]
  - - [510, 256, 36, 76]
    - [1, 29.756]
  - - [510, 512, 36, 1080]
    - [8, 81.701]
  - - [510, 512, 36, 162]
    - [101, 49.912]
  - - [510, 512, 36, 171]
    - [101, 50.801]
  - - [510, 512, 49, 1920]
    - [8, 88.689]
  - - [510, 512, 64, 1920]
    - [4, 89.277]
  - - [510, 512, 49, 288]
    - [66, 75.76]
  - - [510, 512, 64, 288]
    - [66, 77.107]
  - - [510, 512, 36, 3000]
    - [8, 89.281]
  - - [510, 512, 49, 304]
    - [2, 77.085]
  - - [510, 512, 64, 304]
    - [2, 79.498]
  - - [510, 512, 36, 450]
    - [101, 68.599]
  - - [510, 512, 36, 475]
    - [117, 69.509]
  - - [510, 512, 49, 480]
    - [66, 82.521]
  - - [510, 512, 64, 480]
    - [2, 83.739]
  - - [510, 512, 49, 72]
    - [110, 33.24]
  - - [510, 512, 64, 72]
    - [117, 34.125]
  - - [510, 512, 49, 76]
    - [110, 33.998]
  - - [510, 512, 64, 76]
    - [33, 34.859]
  - - [512, 256, 81, 1080]
    - [2, 85.808]
  - - [512, 256, 25, 12000]
    - [90, 93.782]
  - - [512, 256, 81, 162]
    - [2, 51.941]
  - - [512, 256, 81, 171]
    - [2, 54.984]
  - - [512, 256, 25, 1800]
    - [91, 80.184]
  - - [512, 256, 25, 1900]
    - [109, 79.282]
  - - [512, 256, 121, 1920]
    - [4, 88.713]
  - - [512, 256, 169, 1920]
    - [2, 89.673]
  - - [512, 256, 49, 1920]
    - [10, 85.155]
  - - [512, 256, 121, 288]
    - [2, 79.323]
  - - [512, 256, 169, 288]
    - [2, 80.039]
  - - [512, 256, 49, 288]
    - [10, 71.064]
  - - [512, 256, 25, 3000]
    - [2, 83.683]
  - - [512, 256, 81, 3000]
    - [2, 90.715]
  - - [512, 256, 121, 304]
    - [2, 84.743]
  - - [512, 256, 169, 304]
    - [2, 86.534]
  - - [512, 256, 49, 304]
    - [2, 73.386]
  - - [512, 256, 25, 450]
    - [132, 62.338]
  - - [512, 256, 81, 450]
    - [150, 70.454]
  - - [512, 256, 25, 475]
    - [2, 62.854]
  - - [512, 256, 81, 475]
    - [132, 71.088]
  - - [512, 256, 121, 480]
    - [2, 83.717]
  - - [512, 256, 169, 480]
    - [2, 85.857]
  - - [512, 256, 49, 5880]
    - [6, 87.009]
  - - [512, 256, 121, 72]
    - [2, 41.839]
  - - [512, 256, 169, 72]
    - [2, 42.707]
  - - [512, 256, 121, 76]
    - [2, 40.968]
  - - [512, 256, 169, 76]
    - [2, 43.753]
  - - [512, 256, 49, 882]
    - [117, 75.417]
  - - [512, 256, 49, 931]
    - [110, 75.971]
  - - [64, 64, 64, 20280]
    - [151, 48.915]
  - - [64, 64, 49, 27000]
    - [134, 51.016]
  - - [64, 64, 64, 3042]
    - [151, 39.079]
  - - [64, 64, 64, 3211]
    - [93, 43.804]
  - - [64, 64, 49, 4050]
    - [44, 37.963]
  - - [64, 64, 49, 4275]
    - [100, 44.91]
  - - [64, 64, 36, 43320]
    - [195, 50.647]
  - - [64, 64, 36, 6498]
    - [114, 39.075]
  - - [64, 64, 36, 6859]
    - [44, 40.989]
  - - [1152, 128, 1, 1444]
    - [10, 22.203]
  - - [1152, 256, 1, 1]
    - [147, 0.162]
  - - [1152, 256, 1, 1444]
    - [118, 43.322]
  - - [1152, 256, 1, 25]
    - [0, 3.733]
  - - [1152, 256, 1, 9]
    - [152, 1.477]
  - - [128, 256, 1, 1444]
    - [25, 9.312]
  - - [147, 64, 1, 22500]
    - [190, 11.925]
  - - [2304, 256, 1, 1444]
    - [39, 52.293]
  - - [2304, 340, 1, 1]
    - [153, 0.336]
  - - [2304, 340, 1, 1444]
    - [15, 55.847]
  - - [2304, 340, 1, 9]
    - [1, 1.114]
  - - [2304, 510, 1, 25]
    - [1, 9.88]
  - - [2304, 512, 1, 100]
    - [1, 29.535]
  - - [2304, 512, 1, 361]
    - [133, 47.979]
  - - [256, 128, 1, 25]
    - [116, 0.513]
  - - [256, 128, 1, 9]
    - [113, 0.201]
  - - [256, 256, 1, 1444]
    - [53, 17.479]
  - - [4608, 510, 1, 100]
    - [1, 33.622]
  - - [4608, 510, 1, 361]
    - [2, 47.363]
  - - [512, 128, 1, 100]
    - [21, 3.282]
  - - [512, 256, 1, 361]
    - [53, 16.403]
  - - [576, 128, 1, 1444]
    - [75, 12.835]
  - - [576, 64, 1, 5625]
    - [192, 17.022]
  - - [64, 128, 1, 1444]
    - [68, 2.308]
  - - [8192, 7680, 1, 8192]
    - [4, 94.864]
  - - [4096, 3840, 1, 4096]
    - [3, 94.425]
  - - [2048, 1920, 1, 2048]
    - [4, 83.993]
  - - [1024, 77, 1, 1024]
    - [56, 19.458]
  - - [30522, 77, 1, 1024]
    - [10, 54.649]
  - - [30522, 616, 1, 1024]
    - [2, 85.483]
  - - [2, 10, 1, 1024]
    - [178, 0.003]
  - - [128, 128, 128, 64]
    - [1, 28.265]
  - - [128, 128, 160, 64]
    - [2, 30.123]
  - - [1024, 10, 1, 1024]
    - [18, 2.78]
  - - [1024, 1280, 1, 1024]
    - [37, 61.311]
  - - [1024, 1280, 1, 4096]
    - [37, 82.492]
  - - [4096, 1280, 1, 1024]
    - [2, 85.193]
  - - [30522, 200, 1, 1024]
    - [10, 73.803]
  - - [2, 39, 1, 1024]
    - [187, 0.012]
  - - [128, 128, 624, 64]
    - [22, 31.775]
  - - [1024, 39, 1, 1024]
    - [18, 10.715]
  - - [1024, 780, 1, 1024]
    - [10, 65.007]
  - - [1024, 4992, 1, 1024]
    - [2, 83.121]
  - - [1024, 4992, 1, 4096]
    - [8, 86.439]
  - - [4096, 4992, 1, 1024]
    - [2, 89.542]
  - - [30522, 780, 1, 1024]
    - [143, 84.181]
  - - [1024, 308, 1, 1024]
    - [0, 49.338]
  - - [30522, 308, 1, 1024]
    - [2, 83.172]
  - - [2, 40, 1, 1024]
    - [187, 0.012]
  - - [128, 128, 640, 64]
    - [22, 30.58]
  - - [1024, 40, 1, 1024]
    - [18, 11.119]
  - - [1024, 800, 1, 1024]
    - [37, 67.268]
  - - [1024, 5120, 1, 1024]
    - [2, 85.736]
  - - [1024, 5120, 1, 4096]
    - [8, 88.801]
  - - [4096, 5120, 1, 1024]
    - [3, 88.647]
  - - [30522, 800, 1, 1024]
    - [10, 85.618]
  - - [2, 41, 1, 1024]
    - [175, 0.013]
  - - [128, 128, 656, 64]
    - [22, 31.893]
  - - [1024, 41, 1, 1024]
    - [18, 11.199]
  - - [1024, 820, 1, 1024]
    - [163, 56.565]
  - - [1024, 5248, 1, 1024]
    - [2, 87.23]
  - - [1024, 5248, 1, 4096]
    - [8, 91.152]
  - - [4096, 5248, 1, 1024]
    - [2, 89.748]
  - - [30522, 820, 1, 1024]
    - [11, 86.835]
  - - [2, 5, 1, 1024]
    - [180, 0.002]
  - - [512, 512, 80, 64]
    - [2, 41.148]
  - - [1024, 5, 1, 1024]
    - [20, 1.398]
  - - [1024, 385, 1, 1024]
    - [14, 40.654]
  - - [1024, 2560, 1, 1024]
    - [37, 74.019]
  - - [1024, 2560, 1, 4096]
    - [3, 85.893]
  - - [4096, 2560, 1, 1024]
    - [2, 87.251]
  - - [30522, 385, 1, 1024]
    - [10, 78.466]
  - - [1024, 462, 1, 1024]
    - [0, 50.189]
  - - [30522, 462, 1, 1024]
    - [3, 84.347]
  - - [1024, 8, 1, 1024]
    - [20, 2.277]
  - - [1024, 160, 1, 1024]
    - [60, 34.842]
  - - [2, 9, 1, 1024]
    - [187, 0.003]
  - - [128, 128, 144, 64]
    - [2, 27.662]
  - - [1024, 9, 1, 1024]
    - [20, 2.547]
  - - [1024, 180, 1, 1024]
    - [56, 38.315]
  - - [1024, 1152, 1, 1024]
    - [6, 68.734]
  - - [1024, 1152, 1, 4096]
    - [29, 78.982]
  - - [4096, 1152, 1, 1024]
    - [10, 82.859]
  - - [30522, 180, 1, 1024]
    - [3, 77.867]
  - - [32768, 1, 1, 256]
    - [82, 1.416]
  - - [1024, 8192, 1, 1024]
    - [6, 85.532]
  - - [1024, 8192, 1, 4096]
    - [38, 93.505]
  - - [1024, 9600, 1, 1024]
    - [3, 89.144]
  - - [1024, 9600, 1, 4096]
    - [4, 93.406]
  - - [4096, 8192, 1, 1024]
    - [3, 90.358]
  - - [4096, 9600, 1, 1024]
    - [2, 92.372]
  - - [33712, 8192, 1, 1024]
    - [15, 93.618]
  - - [33712, 9600, 1, 1024]
    - [15, 94.454]
  - - [1024, 10064, 1, 1024]
    - [8, 86.816]
  - - [1024, 10064, 1, 4096]
    - [8, 92.278]
  - - [1024, 10080, 1, 1024]
    - [6, 86.717]
  - - [1024, 10080, 1, 4096]
    - [8, 92.411]
  - - [1024, 6528, 1, 1024]
    - [2, 86.557]
  - - [1024, 6528, 1, 4096]
    - [4, 94.098]
  - - [1024, 7104, 1, 1024]
    - [102, 82.992]
  - - [1024, 7104, 1, 4096]
    - [8, 87.972]
  - - [1024, 8064, 1, 1024]
    - [11, 84.456]
  - - [1024, 8064, 1, 4096]
    - [4, 93.469]
  - - [1024, 9216, 1, 1024]
    - [108, 88.672]
  - - [1024, 9216, 1, 4096]
    - [108, 95.66]
  - - [4096, 10064, 1, 1024]
    - [15, 91.022]
  - - [4096, 10080, 1, 1024]
    - [108, 91.753]
  - - [4096, 6528, 1, 1024]
    - [3, 90.664]
  - - [4096, 7104, 1, 1024]
    - [3, 91.641]
  - - [4096, 8064, 1, 1024]
    - [3, 91.575]
  - - [4096, 9216, 1, 1024]
    - [3, 91.119]
  - - [42720, 10080, 1, 1024]
    - [15, 94.705]
  - - [42720, 6528, 1, 1024]
    - [15, 94.56]
  - - [42720, 7104, 1, 1024]
    - [15, 94.533]
  - - [15, 14, 10880, 64]
    - [95, 8.942]
  - - [17, 15, 7680, 64]
    - [47, 8.282]
  - - [21, 17, 6144, 64]
    - [47, 10.058]
  - - [30, 31, 2048, 64]
    - [56, 13.978]
  - - [32, 35, 4608, 64]
    - [70, 15.021]
  - - [2, 2048, 1, 1024]
    - [179, 0.593]
  - - [128, 128, 1, 64]
    - [62, 0.695]
  - - [2, 1024, 1, 1024]
    - [24, 0.566]
  - - [33, 33, 1, 32]
    - [62, 0.027]
  - - [27, 27, 32768, 128]
    - [85, 16.219]
  - - [960, 1, 1, 2048]
    - [188, 0.274]
  - - [1024, 32768, 1, 480]
    - [2, 92.171]
  - - [2, 2, 1, 2048]
    - [190, 0.001]
  - - [2048, 2, 1, 2048]
    - [171, 1.033]
  - - [30592, 1024, 1, 2048]
    - [2, 92.361]
  - - [6144, 1024, 1, 2048]
    - [109, 90.674]
  - - [8192, 1024, 1, 2048]
    - [61, 86.535]
  - - [1024, 16, 1, 1024]
    - [18, 4.474]
  - - [2, 16, 1, 1024]
    - [165, 0.005]
  - - [30592, 8192, 1, 1024]
    - [2, 93.811]
  - - [3072, 8192, 1, 1024]
    - [2, 90.894]
  - - [512, 512, 256, 64]
    - [2, 42.587]
  - - [64, 512, 256, 512]
    - [155, 59.084]
  - - [30592, 2048, 1, 1024]
    - [2, 90.412]
  - - [30592, 4096, 1, 1024]
    - [2, 93.327]
  - - [3072, 4096, 1, 1024]
    - [2, 89.763]
  - - [64, 512, 128, 512]
    - [156, 58.265]
  - - [1920, 2048, 1, 2560]
    - [4, 85.203]
  - - [2, 4, 1, 2560]
    - [187, 0.003]
  - - [2560, 2048, 1, 2560]
    - [4, 88.847]
  - - [2560, 2048, 1, 640]
    - [2, 80.995]
  - - [2560, 4, 1, 2560]
    - [172, 2.808]
  - - [7680, 2048, 1, 2560]
    - [2, 93.136]
  - - [512, 512, 40, 64]
    - [2, 38.774]
  - - [64, 512, 40, 512]
    - [102, 57.171]
  - - [1536, 4096, 1, 1536]
    - [2, 89.869]
  - - [1536, 4096, 1, 6144]
    - [4, 94.112]
  - - [4608, 4096, 1, 1536]
    - [2, 91.808]
  - - [50304, 4096, 1, 1536]
    - [15, 94.842]
  - - [6144, 4096, 1, 1536]
    - [2, 92.122]
  - - [1024, 1024, 64, 96]
    - [2, 64.952]
  - - [96, 1024, 64, 1024]
    - [157, 77.217]
  - - [1536, 8192, 1, 1536]
    - [2, 91.445]
  - - [1536, 8192, 1, 6144]
    - [4, 94.562]
  - - [4608, 8192, 1, 1536]
    - [2, 92.454]
  - - [50304, 8192, 1, 1536]
    - [15, 95.145]
  - - [6144, 8192, 1, 1536]
    - [2, 92.57]
  - - [1024, 1024, 128, 96]
    - [2, 65.799]
  - - [96, 1024, 128, 1024]
    - [15, 78.8]
  - - [1024, 16384, 1, 1024]
    - [2, 88.86]
  - - [1024, 16384, 1, 4096]
    - [4, 92.695]
  - - [3072, 16384, 1, 1024]
    - [3, 92.42]
  - - [4096, 16384, 1, 1024]
    - [3, 92.14]
  - - [50304, 16384, 1, 1024]
    - [15, 94.548]
  - - [1024, 1024, 256, 64]
    - [2, 46.847]
  - - [64, 1024, 256, 1024]
    - [4, 72.773]
  - - [50304, 2048, 1, 1024]
    - [2, 91.959]
  - - [1024, 1024, 32, 64]
    - [2, 44.743]
  - - [64, 1024, 32, 1024]
    - [11, 66.151]
  - - [50304, 4096, 1, 1024]
    - [15, 93.617]
  - - [1024, 1024, 64, 64]
    - [2, 46.063]
  - - [64, 1024, 64, 1024]
    - [4, 69.426]
  - - [50304, 8192, 1, 1024]
    - [2, 94.418]
  - - [1024, 1024, 128, 64]
    - [2, 46.635]
  - - [64, 1024, 128, 1024]
    - [4, 69.776]
  - - [1024, 64, 1, 1024]
    - [75, 16.896]
  - - [30528, 8192, 1, 1024]
    - [33, 93.861]
  - - [2, 64, 1, 1024]
    - [175, 0.02]
  - - [128, 128, 1024, 64]
    - [22, 31.586]
  - - [64, 128, 1024, 128]
    - [23, 35.244]
  - - [1024, 3456, 1, 1024]
    - [37, 78.975]
  - - [1024, 3456, 1, 480]
    - [2, 79.085]
  - - [1024, 864, 1, 1024]
    - [37, 71.755]
  - - [1024, 864, 1, 480]
    - [22, 60.758]
  - - [128, 3456, 1, 256]
    - [10, 36.453]
  - - [128, 4096, 1, 256]
    - [10, 36.437]
  - - [128, 6912, 1, 256]
    - [54, 47.475]
  - - [128, 864, 1, 256]
    - [34, 12.633]
  - - [256, 3456, 1, 512]
    - [54, 61.304]
  - - [256, 864, 1, 512]
    - [0, 35.196]
  - - [3456, 1, 1, 256]
    - [82, 0.153]
  - - [4096, 1, 1, 256]
    - [18, 0.45]
  - - [512, 3456, 1, 1024]
    - [32, 69.279]
  - - [512, 3456, 1, 13]
    - [1, 6.36]
  - - [512, 4096, 1, 13]
    - [1, 7.185]
  - - [512, 6912, 1, 13]
    - [1, 8.675]
  - - [512, 864, 1, 1024]
    - [50, 61.305]
  - - [512, 864, 1, 13]
    - [158, 2.7]
  - - [6912, 1, 1, 256]
    - [18, 0.7]
  - - [864, 1, 1, 256]
    - [20, 0.11]
  - - [30528, 640, 1, 1024]
    - [2, 89.386]
  - - [30528, 1280, 1, 1024]
    - [2, 89.997]
  - - [30528, 1600, 1, 1024]
    - [2, 92.051]
  - - [1024, 10240, 1, 1024]
    - [2, 87.33]
  - - [2, 80, 1, 1024]
    - [170, 0.025]
  - - [4096, 10240, 1, 1024]
    - [3, 91.552]
  - - [1024, 10240, 1, 4096]
    - [4, 91.513]
  - - [64, 128, 1280, 128]
    - [156, 35.919]
  - - [128, 128, 1280, 64]
    - [22, 31.357]
  - - [1024, 10496, 1, 4096]
    - [4, 93.703]
  - - [30528, 1640, 1, 1024]
    - [2, 89.055]
  - - [1024, 82, 1, 1024]
    - [0, 21.409]
  - - [4096, 10496, 1, 1024]
    - [3, 91.71]
  - - [1024, 10496, 1, 1024]
    - [2, 89.031]
  - - [2, 82, 1, 1024]
    - [178, 0.026]
  - - [64, 128, 1312, 128]
    - [159, 35.489]
  - - [128, 128, 1312, 64]
    - [22, 31.876]
  - - [30528, 160, 1, 1024]
    - [10, 80.995]
  - - [1024, 12, 1, 1024]
    - [18, 3.297]
  - - [30528, 240, 1, 1024]
    - [2, 79.781]
