library/src/blas3/Tensile/Logic/asm_full/aldebaran_104cu/aldebaran_Cijk_Alik_Bljk_BBS_BH.yaml
- {MinimumRequiredVersion: 4.32.1}
- aldebaran
- {Architecture: gfx90a, CUCount: 104}
- [Device 0050, Device 0051, Device 0052, Device 0054, Device 0062, Device 7400, Device
    SolutionIndex: 0
    SolutionIndex: 1
    SolutionIndex: 2
    SolutionIndex: 3
    SolutionNameMin: Cijk_Alik_Bljk_BBS_BH_MT32x32x64_MI16x16x8x1_SE_1LDSB0_AF0EM8_GRVW8_LBSPP128_LPA8_LPB8_PLR9_SU0_SUS256_SRVW0_TT1_16_WG32_8_1_WGM2
    SolutionIndex: 4
    SolutionNameMin: Cijk_Alik_Bljk_BBS_BH_MT128x64x64_MI32x32x8x1_SE_1LDSB1_AF0EM8_EPS0_GRVW8_GSU1_GSUAMB_LBSPP128_LPA8_LPB8_LRVW8_PGR2_PLR9_SU0_SUS0_SRVW4_TT2_32_VAW2_WSGRA1_WSGRB1_WG64_4_1_WGM15
    SolutionIndex: 5
    SolutionNameMin: Cijk_Alik_Bljk_BBS_BH_MT128x96x64_MI32x32x8x1_SE_1LDSB1_AF0EM8_EPS0_GRVW8_GSU1_GSUAMB_LBSPP128_LPA8_LPB8_LRVW8_PGR2_PLR9_SU32_SUS128_SRVW4_TT1_96_VAW2_WSGRA1_WSGRB1_WG128_2_1_WGM15
    SolutionIndex: 6
    SolutionNameMin: Cijk_Alik_Bljk_BBS_BH_MT256x128x64_MI32x32x8x1_SE_1LDSB1_AF0EM8_EPS0_GRVW2_GSU1_GSUAMB_LBSPP128_LPA8_LPB8_LRVW8_PGR2_PLR9_SU0_SUS0_SRVW4_TT4_64_VAW2_WSGRA1_WSGRB1_WG64_4_1_WGM1
    SolutionIndex: 7
    SolutionNameMin: Cijk_Alik_Bljk_BBS_BH_MT64x64x64_MI32x32x8x1_SE_1LDSB1_AF0EM1_EPS1_GRVW8_GSU1_GSUAMB_LBSPP128_LPA8_LPB8_LRVW8_PGR1_PLR9_SU32_SUS128_SRVW4_TT1_32_VAW2_WSGRA1_WSGRB1_WG64_4_1_WGM1
    SolutionIndex: 8
    SolutionNameMin: Cijk_Alik_Bljk_BBS_BH_MT128x256x32_MI32x32x8x1_SE_1LDSB1_AF0EM8_EPS0_GRVW8_GSU1_GSUAMB_LBSPP128_LPA8_LPB8_LRVW8_PGR2_PLR5_SU32_SUS128_SRVW4_TT2_128_VAW2_WSGRA1_WSGRB1_WG64_4_1_WGM15
    SolutionIndex: 9
    SolutionNameMin: Cijk_Alik_Bljk_BBS_BH_MT128x96x64_MI32x32x8x1_SE_1LDSB1_AF0EM8_EPS0_GRVW8_GSU1_GSUAMB_LBSPP128_LPA8_LPB8_LRVW8_PGR2_PLR9_SU0_SUS0_SRVW4_TT1_96_VAW2_WSGRA1_WSGRB1_WG128_2_1_WGM1
    SolutionIndex: 10
    SolutionNameMin: Cijk_Alik_Bljk_BBS_BH_MT128x96x64_MI32x32x8x1_SE_1LDSB1_AF0EM8_EPS0_GRVW8_GSU1_GSUAMB_LBSPP128_LPA8_LPB8_LRVW8_PGR2_PLR9_SU32_SUS128_SRVW4_TT1_96_VAW2_WSGRA1_WSGRB1_WG128_2_1_WGM2
    SolutionIndex: 11
    SolutionNameMin: Cijk_Alik_Bljk_BBS_BH_MT32x64x64_MI16x16x16x1_SE_1LDSB1_AF0EM1_EPS1_GRVW8_GSU1_GSUAMB_LBSPP128_LPA16_LPB16_LRVW8_PGR1_PLR5_SU32_SUS128_SRVW4_TT1_32_VAW2_WSGRA1_WSGRB1_WG32_8_1_WGM1
    SolutionIndex: 12
    SolutionNameMin: Cijk_Alik_Bljk_BBS_BH_MT64x32x64_MI16x16x16x1_SE_1LDSB1_AF0EM8_EPS1_GRVW8_GSU1_GSUAMB_LBSPP128_LPA16_LPB16_LRVW8_PGR1_PLR5_SU0_SUS0_SRVW4_TT2_16_VAW2_WSGRA1_WSGRB1_WG32_8_1_WGM1
    SolutionIndex: 13
    SolutionNameMin: Cijk_Alik_Bljk_BBS_BH_MT64x32x64_MI16x16x16x1_SE_1LDSB1_AF0EM1_EPS1_GRVW8_GSU1_GSUAMB_LBSPP128_LPA16_LPB16_LRVW8_PGR1_PLR5_SU0_SUS0_SRVW4_TT2_16_VAW2_WSGRA1_WSGRB1_WG32_8_1_WGM1
    SolutionIndex: 14
    SolutionNameMin: Cijk_Alik_Bljk_BBS_BH_MT128x64x64_MI32x32x8x1_SE_1LDSB1_AF0EM8_EPS0_GRVW8_GSU1_GSUAMB_LBSPP128_LPA8_LPB8_LRVW8_PGR2_PLR9_SU32_SUS128_SRVW4_TT2_32_VAW2_WSGRA1_WSGRB1_WG64_4_1_WGM15
    SolutionIndex: 15
    SolutionNameMin: Cijk_Alik_Bljk_BBS_BH_MT128x96x64_MI32x32x8x1_SE_1LDSB1_AF0EM1_EPS0_GRVW8_GSU1_GSUAMB_LBSPP128_LPA8_LPB8_LRVW8_PGR2_PLR9_SU0_SUS0_SRVW4_TT1_96_VAW2_WSGRA1_WSGRB1_WG128_2_1_WGM15
    SolutionIndex: 16
    SolutionNameMin: Cijk_Alik_Bljk_BBS_BH_MT64x64x64_MI32x32x8x1_SE_1LDSB1_AF0EM8_EPS1_GRVW8_GSU1_GSUAMB_LBSPP128_LPA8_LPB8_LRVW8_PGR1_PLR9_SU0_SUS0_SRVW4_TT1_32_VAW2_WSGRA1_WSGRB1_WG64_4_1_WGM1
    SolutionIndex: 17
    SolutionNameMin: Cijk_Alik_Bljk_BBS_BH_MT128x64x32_MI32x32x8x1_SE_1LDSB0_AF0EM8_EPS0_GRVW4_GSU1_GSUAMB_LBSPP128_LPA8_LPB8_LRVW8_PGR2_PLR5_SU0_SUS0_SRVW4_TT2_32_VAW2_WSGRA1_WSGRB1_WG64_4_1_WGM15
    SolutionIndex: 18
    SolutionNameMin: Cijk_Alik_Bljk_BBS_BH_MT64x64x32_MI32x32x8x1_SE_1LDSB1_AF0EM8_EPS0_GRVW2_GSU1_GSUAMB_LBSPP128_LPA8_LPB8_LRVW8_PGR2_PLR5_SU0_SUS0_SRVW4_TT1_32_VAW2_WSGRA1_WSGRB1_WG64_4_1_WGM1
    SolutionIndex: 19
    SolutionNameMin: Cijk_Alik_Bljk_BBS_BH_MT128x64x64_MI32x32x8x1_SE_1LDSB1_AF0EM1_EPS1_GRVW8_GSU1_GSUAMB_LBSPP128_LPA8_LPB8_LRVW8_PGR1_PLR9_SU0_SUS0_SRVW4_TT2_32_VAW2_WSGRA1_WSGRB1_WG64_4_1_WGM15
    SolutionIndex: 20
    SolutionNameMin: Cijk_Alik_Bljk_BBS_BH_MT128x96x64_MI32x32x8x1_SE_1LDSB1_AF0EM8_EPS0_GRVW8_GSU1_GSUAMB_LBSPP128_LPA8_LPB8_LRVW8_PGR2_PLR9_SU0_SUS0_SRVW4_TT1_96_VAW2_WSGRA1_WSGRB1_WG128_2_1_WGM2
    SolutionIndex: 21
    SolutionNameMin: Cijk_Alik_Bljk_BBS_BH_MT64x32x64_MI16x16x16x1_SE_1LDSB0_AF0EM8_EPS0_GRVW8_GSU1_GSUAMB_LBSPP128_LPA16_LPB16_LRVW8_PGR2_PLR5_SU0_SUS0_SRVW4_TT2_16_VAW2_WSGRA1_WSGRB1_WG32_8_1_WGM15
    SolutionIndex: 22
    SolutionNameMin: Cijk_Alik_Bljk_BBS_BH_MT128x160x64_MI32x32x8x1_SE_1LDSB1_AF0EM8_EPS0_GRVW8_GSU1_GSUAMB_LBSPP128_LPA8_LPB8_LRVW8_PGR2_PLR9_SU32_SUS128_SRVW4_TT1_160_VAW2_WSGRA1_WSGRB1_WG128_2_1_WGM15
    SolutionIndex: 23
    SolutionNameMin: Cijk_Alik_Bljk_BBS_BH_MT256x160x64_MI32x32x8x1_SE_1LDSB1_AF0EM8_EPS0_GRVW2_GSU1_GSUAMB_LBSPP128_LPA8_LPB8_LRVW8_PGR2_PLR9_SU32_SUS256_SRVW4_TT2_160_VAW2_WSGRA1_WSGRB1_WG128_2_1_WGM2
    SolutionIndex: 24
    SolutionNameMin: Cijk_Alik_Bljk_BBS_BH_MT256x256x32_MI32x32x8x1_SE_1LDSB1_AF0EM1_EPS1_GRVW2_GSU1_GSUAMB_LBSPP128_LPA8_LPB8_LRVW8_PGR1_PLR5_SU0_SUS0_SRVW4_TT4_128_VAW2_WSGRA1_WSGRB1_WG64_4_1_WGM2
    SolutionIndex: 25
    SolutionNameMin: Cijk_Alik_Bljk_BBS_BH_MT128x96x64_MI32x32x8x1_SE_1LDSB0_AF0EM8_EPS0_GRVW8_GSU1_GSUAMB_LBSPP128_LPA8_LPB8_LRVW8_PGR2_PLR9_SU0_SUS0_SRVW4_TT1_96_VAW2_WSGRA1_WSGRB1_WG128_2_1_WGM2
    SolutionIndex: 26
    SolutionNameMin: Cijk_Alik_Bljk_BBS_BH_MT32x32x32_MI16x16x16x1_SE_1LDSB0_AF0EM1_EPS0_GRVW2_GSU1_GSUAMB_LBSPP128_LPA16_LPB16_LRVW8_PGR2_PLR2_SU0_SUS0_SRVW4_TT1_16_VAW2_WSGRA1_WSGRB1_WG32_8_1_WGM1
    SolutionIndex: 27
    SolutionNameMin: Cijk_Alik_Bljk_BBS_BH_MT128x96x64_MI32x32x8x1_SE_1LDSB0_AF0EM8_EPS0_GRVW2_GSU1_GSUAMB_LBSPP128_LPA8_LPB8_LRVW8_PGR2_PLR9_SU32_SUS128_SRVW4_TT1_96_VAW2_WSGRA1_WSGRB1_WG128_2_1_WGM15
    SolutionIndex: 28
    SolutionNameMin: Cijk_Alik_Bljk_BBS_BH_MT128x64x64_MI32x32x8x1_SE_1LDSB1_AF0EM8_EPS0_GRVW8_GSU1_GSUAMB_LBSPP128_LPA8_LPB8_LRVW8_PGR2_PLR9_SU0_SUS0_SRVW4_TT2_32_VAW2_WSGRA1_WSGRB1_WG64_4_1_WGM2
    SolutionIndex: 29
    SolutionNameMin: Cijk_Alik_Bljk_BBS_BH_MT128x256x32_MI32x32x8x1_SE_1LDSB1_AF0EM8_EPS0_GRVW8_GSU1_GSUAMB_LBSPP128_LPA8_LPB8_LRVW8_PGR2_PLR5_SU0_SUS0_SRVW4_TT2_128_VAW2_WSGRA1_WSGRB1_WG64_4_1_WGM15
    SolutionIndex: 30
    SolutionNameMin: Cijk_Alik_Bljk_BBS_BH_MT64x64x64_MI32x32x8x1_SE_1LDSB1_AF0EM8_EPS1_GRVW8_GSU1_GSUAMB_LBSPP128_LPA8_LPB8_LRVW8_PGR1_PLR9_SU32_SUS128_SRVW4_TT1_32_VAW2_WSGRA1_WSGRB1_WG64_4_1_WGM15
    SolutionIndex: 31
    SolutionNameMin: Cijk_Alik_Bljk_BBS_BH_MT64x128x64_MI32x32x8x1_SE_1LDSB1_AF0EM8_EPS0_GRVW8_GSU1_GSUAMB_LBSPP128_LPA8_LPB8_LRVW8_PGR2_PLR9_SU32_SUS256_SRVW4_TT1_64_VAW2_WSGRA1_WSGRB1_WG64_4_1_WGM15
    SolutionIndex: 32
    SolutionNameMin: Cijk_Alik_Bljk_BBS_BH_MT96x128x64_MI32x32x8x1_SE_1LDSB1_AF0EM8_EPS0_GRVW8_GSU1_GSUAMB_LBSPP128_LPA8_LPB8_LRVW8_PGR2_PLR9_SU0_SUS0_SRVW0_TT3_32_VAW2_WSGRA1_WSGRB1_WG32_8_1_WGM2
    SolutionIndex: 33
    SolutionNameMin: Cijk_Alik_Bljk_BBS_BH_MT32x32x32_MI16x16x16x1_SE_1LDSB1_AF0EM1_EPS0_GRVW4_GSU1_GSUAMB_LBSPP128_LPA16_LPB16_LRVW8_PGR2_PLR2_SU0_SUS0_SRVW4_TT1_16_VAW2_WSGRA1_WSGRB1_WG32_8_1_WGM1
    SolutionIndex: 34
    SolutionNameMin: Cijk_Alik_Bljk_BBS_BH_MT32x64x32_MI16x16x16x1_SE_1LDSB1_AF0EM8_EPS0_GRVW2_GSU1_GSUAMB_LBSPP128_LPA16_LPB16_LRVW8_PGR2_PLR2_SU0_SUS0_SRVW4_TT1_32_VAW2_WSGRA1_WSGRB1_WG32_8_1_WGM15
    SolutionIndex: 35
    SolutionNameMin: Cijk_Alik_Bljk_BBS_BH_MT32x32x32_MI16x16x16x1_SE_1LDSB1_AF0EM8_EPS0_GRVW2_GSU1_GSUAMB_LBSPP128_LPA16_LPB16_LRVW8_PGR2_PLR2_SU0_SUS0_SRVW4_TT1_16_VAW2_WSGRA1_WSGRB1_WG32_8_1_WGM1
    SolutionIndex: 36
    SolutionNameMin: Cijk_Alik_Bljk_BBS_BH_MT64x32x64_MI16x16x16x1_SE_1LDSB1_AF0EM8_EPS1_GRVW8_GSU1_GSUAMB_LBSPP128_LPA16_LPB16_LRVW8_PGR1_PLR5_SU32_SUS128_SRVW4_TT2_16_VAW2_WSGRA1_WSGRB1_WG32_8_1_WGM15
    SolutionIndex: 37
    SolutionNameMin: Cijk_Alik_Bljk_BBS_BH_MT32x64x64_MI16x16x16x1_SE_1LDSB1_AF0EM8_EPS1_GRVW8_GSU1_GSUAMB_LBSPP128_LPA16_LPB16_LRVW8_PGR1_PLR5_SU0_SUS0_SRVW4_TT1_32_VAW2_WSGRA1_WSGRB1_WG32_8_1_WGM15
    SolutionIndex: 38
    SolutionNameMin: Cijk_Alik_Bljk_BBS_BH_MT128x96x64_MI32x32x8x1_SE_1LDSB1_AF0EM8_EPS0_GRVW8_GSU1_GSUAMB_LBSPP128_LPA8_LPB8_LRVW8_PGR2_PLR9_SU0_SUS0_SRVW4_TT1_96_VAW2_WSGRA1_WSGRB1_WG128_2_1_WGM15
    SolutionIndex: 39
    SolutionNameMin: Cijk_Alik_Bljk_BBS_BH_MT16x16x32_MI16x16x16x1_SE_1LDSB1_AF0EM1_EPS0_GRVW8_GSU1_GSUAMB_LBSPP128_LPA16_LPB16_LRVW8_PGR2_PLR2_SU0_SUS0_SRVW0_TT1_16_VAW2_WSGRA1_WSGRB1_WG16_4_1_WGM1
    SolutionIndex: 40
    SolutionNameMin: Cijk_Alik_Bljk_BBS_BH_MT16x64x32_MI16x16x16x1_SE_1LDSB1_AF0EM8_EPS0_GRVW8_GSU1_GSUAMB_LBSPP128_LPA16_LPB16_LRVW8_PGR2_PLR2_SU0_SUS0_SRVW0_TT1_16_VAW2_WSGRA1_WSGRB1_WG16_16_1_WGM1
    SolutionIndex: 41
    SolutionNameMin: Cijk_Alik_Bljk_BBS_BH_MT16x16x64_MI16x16x16x1_SE_1LDSB0_AF0EM1_EPS0_GRVW8_GSU1_GSUAMB_LBSPP128_LPA16_LPB16_LRVW8_PGR2_PLR5_SU0_SUS0_SRVW0_TT1_16_VAW2_WSGRA1_WSGRB1_WG16_4_1_WGM1
    SolutionIndex: 42
    SolutionNameMin: Cijk_Alik_Bljk_BBS_BH_MT16x16x32_MI16x16x16x1_SE_1LDSB0_AF0EM1_EPS0_GRVW8_GSU1_GSUAMB_LBSPP128_LPA16_LPB16_LRVW8_PGR2_PLR2_SU0_SUS0_SRVW0_TT1_16_VAW2_WSGRA1_WSGRB1_WG16_4_1_WGM15
    SolutionIndex: 43
    SolutionNameMin: Cijk_Alik_Bljk_BBS_BH_MT16x16x128_MI16x16x16x1_SE_1LDSB0_AF0EM1_EPS0_GRVW8_GSU1_GSUAMB_LBSPP256_LPA16_LPB16_LRVW8_PGR2_PLR9_SU0_SUS0_SRVW0_TT1_16_VAW2_WSGRA1_WSGRB1_WG16_4_1_WGM15
    SolutionIndex: 44
    SolutionNameMin: Cijk_Alik_Bljk_BBS_BH_MT64x16x128_MI16x16x16x1_SE_1LDSB0_AF0EM1_EPS0_GRVW8_GSU1_GSUAMB_LBSPP256_LPA16_LPB16_LRVW8_PGR2_PLR9_SU0_SUS0_SRVW0_TT1_16_VAW2_WSGRA1_WSGRB1_WG64_4_1_WGM2
    SolutionIndex: 45
    SolutionNameMin: Cijk_Alik_Bljk_BBS_BH_MT16x16x128_MI16x16x16x1_SE_1LDSB0_AF0EM1_EPS0_GRVW8_GSU1_GSUAMB_LBSPP256_LPA16_LPB16_LRVW8_PGR2_PLR9_SU0_SUS0_SRVW0_TT1_16_VAW2_WSGRA1_WSGRB1_WG16_4_1_WGM1
    SolutionIndex: 46
    SolutionNameMin: Cijk_Alik_Bljk_BBS_BH_MT64x16x128_MI16x16x16x1_SE_1LDSB0_AF0EM1_EPS0_GRVW8_GSU1_GSUAMB_LBSPP256_LPA16_LPB16_LRVW8_PGR2_PLR9_SU0_SUS0_SRVW0_TT1_16_VAW2_WSGRA1_WSGRB1_WG64_4_1_WGM1
    SolutionIndex: 47
    SolutionNameMin: Cijk_Alik_Bljk_BBS_BH_MT64x64x64_MI32x32x8x1_SE_1LDSB1_AF0EM8_EPS1_GRVW8_GSU1_GSUAMB_LBSPP128_LPA8_LPB8_LRVW8_PGR1_PLR9_SU32_SUS256_SRVW4_TT1_32_VAW2_WSGRA1_WSGRB1_WG64_4_1_WGM15
    SolutionIndex: 48
    SolutionNameMin: Cijk_Alik_Bljk_BBS_BH_MT128x64x32_MI32x32x8x1_SE_1LDSB1_AF0EM8_EPS0_GRVW8_GSU1_GSUAMB_LBSPP128_LPA8_LPB8_LRVW8_PGR2_PLR5_SU0_SUS0_SRVW4_TT2_32_VAW2_WSGRA1_WSGRB1_WG64_4_1_WGM15
    SolutionIndex: 49
    SolutionNameMin: Cijk_Alik_Bljk_BBS_BH_MT16x16x128_MI16x16x16x1_SE_1LDSB0_AF0EM8_EPS0_GRVW8_GSU1_GSUAMB_LBSPP256_LPA16_LPB16_LRVW8_PGR2_PLR9_SU32_SUS256_SRVW0_TT1_16_VAW2_WSGRA1_WSGRB1_WG16_4_1_WGM1
    SolutionIndex: 50
    SolutionNameMin: Cijk_Alik_Bljk_BBS_BH_MT128x160x64_MI32x32x8x1_SE_1LDSB1_AF0EM8_EPS0_GRVW4_GSU1_GSUAMB_LBSPP128_LPA8_LPB8_LRVW8_PGR2_PLR9_SU0_SUS0_SRVW4_TT1_160_VAW2_WSGRA1_WSGRB1_WG128_2_1_WGM2
    SolutionIndex: 51
    SolutionNameMin: Cijk_Alik_Bljk_BBS_BH_MT128x64x64_MI32x32x8x1_SE_1LDSB1_AF0EM8_EPS0_GRVW8_GSU1_GSUAMB_LBSPP128_LPA8_LPB8_LRVW8_PGR2_PLR9_SU0_SUS0_SRVW4_TT2_32_VAW2_WSGRA1_WSGRB1_WG64_4_1_WGM1
    SolutionIndex: 52
    SolutionNameMin: Cijk_Alik_Bljk_BBS_BH_MT16x16x128_MI16x16x16x1_SE_1LDSB1_AF0EM1_EPS1_GRVW8_GSU1_GSUAMB_LBSPP256_LPA16_LPB16_LRVW8_PGR1_PLR9_SU0_SUS0_SRVW0_TT1_16_VAW2_WSGRA1_WSGRB1_WG16_4_1_WGM1
    SolutionIndex: 53
    SolutionNameMin: Cijk_Alik_Bljk_BBS_BH_MT16x64x128_MI16x16x16x1_SE_1LDSB0_AF0EM8_EPS0_GRVW8_GSU1_GSUAMB_LBSPP256_LPA16_LPB16_LRVW8_PGR2_PLR9_SU0_SUS0_SRVW4_TT1_16_VAW2_WSGRA1_WSGRB1_WG16_16_1_WGM1
    SolutionIndex: 54
    SolutionNameMin: Cijk_Alik_Bljk_BBS_BH_MT16x16x32_MI16x16x16x1_SE_1LDSB1_AF0EM1_EPS1_GRVW8_GSU1_GSUAMB_LBSPP128_LPA16_LPB16_LRVW8_PGR1_PLR2_SU0_SUS0_SRVW0_TT1_16_VAW2_WSGRA1_WSGRB1_WG16_4_1_WGM1
    SolutionIndex: 55
    SolutionNameMin: Cijk_Alik_Bljk_BBS_BH_MT64x16x128_MI16x16x16x1_SE_1LDSB0_AF0EM8_EPS0_GRVW8_GSU1_GSUAMB_LBSPP256_LPA16_LPB16_LRVW8_PGR2_PLR9_SU0_SUS0_SRVW0_TT1_16_VAW2_WSGRA1_WSGRB1_WG64_4_1_WGM2
    SolutionIndex: 56
    SolutionNameMin: Cijk_Alik_Bljk_BBS_BH_MT64x128x64_MI32x32x8x1_SE_1LDSB0_AF0EM8_EPS0_GRVW8_GSU1_GSUAMB_LBSPP128_LPA8_LPB8_LRVW8_PGR2_PLR9_SU32_SUS128_SRVW4_TT1_64_VAW2_WSGRA1_WSGRB1_WG64_4_1_WGM1
    SolutionIndex: 57
    SolutionNameMin: Cijk_Alik_Bljk_BBS_BH_MT64x64x64_MI32x32x8x1_SE_1LDSB1_AF0EM8_EPS1_GRVW8_GSU1_GSUAMB_LBSPP128_LPA8_LPB8_LRVW8_PGR1_PLR9_SU0_SUS0_SRVW4_TT1_32_VAW2_WSGRA1_WSGRB1_WG64_4_1_WGM2
    SolutionIndex: 58
    SolutionNameMin: Cijk_Alik_Bljk_BBS_BH_MT64x64x64_MI32x32x8x1_SE_1LDSB1_AF0EM8_EPS1_GRVW8_GSU1_GSUAMB_LBSPP128_LPA8_LPB8_LRVW8_PGR1_PLR9_SU0_SUS0_SRVW4_TT1_32_VAW2_WSGRA1_WSGRB1_WG64_4_1_WGM15
    SolutionIndex: 59
    SolutionNameMin: Cijk_Alik_Bljk_BBS_BH_MT128x96x32_MI32x32x8x1_SE_1LDSB1_AF0EM8_EPS1_GRVW4_GSU1_GSUAMB_LBSPP128_LPA8_LPB8_LRVW8_PGR1_PLR5_SU32_SUS128_SRVW4_TT1_96_VAW2_WSGRA1_WSGRB1_WG128_2_1_WGM1
    SolutionIndex: 60
    SolutionNameMin: Cijk_Alik_Bljk_BBS_BH_MT96x96x64_MI16x16x16x1_SE_1LDSB0_AF0EM8_EPS1_GRVW8_GSU1_GSUAMB_LBSPP128_LPA16_LPB16_LRVW8_PGR1_PLR5_SU32_SUS256_SRVW0_TT3_48_VAW2_WSGRA1_WSGRB1_WG32_8_1_WGM1
    SolutionIndex: 61
    SolutionNameMin: Cijk_Alik_Bljk_BBS_BH_MT128x64x64_MI32x32x8x1_SE_1LDSB1_AF0EM8_EPS1_GRVW8_GSU1_GSUAMB_LBSPP128_LPA8_LPB8_LRVW8_PGR1_PLR9_SU32_SUS128_SRVW4_TT2_32_VAW2_WSGRA1_WSGRB1_WG64_4_1_WGM1
    SolutionIndex: 62
    SolutionNameMin: Cijk_Alik_Bljk_BBS_BH_MT128x256x32_MI32x32x8x1_SE_1LDSB1_AF0EM8_EPS0_GRVW8_GSU1_GSUAMB_LBSPP128_LPA8_LPB8_LRVW8_PGR2_PLR5_SU0_SUS0_SRVW4_TT2_128_VAW2_WSGRA1_WSGRB1_WG64_4_1_WGM2
    SolutionIndex: 63
    SolutionNameMin: Cijk_Alik_Bljk_BBS_BH_MT128x96x64_MI32x32x8x1_SE_1LDSB1_AF0EM8_EPS1_GRVW8_GSU1_GSUAMB_LBSPP128_LPA8_LPB8_LRVW8_PGR1_PLR9_SU32_SUS128_SRVW4_TT1_96_VAW2_WSGRA1_WSGRB1_WG128_2_1_WGM2
    SolutionIndex: 64
    SolutionNameMin: Cijk_Alik_Bljk_BBS_BH_MT64x64x32_MI32x32x8x1_SE_1LDSB1_AF0EM1_EPS0_GRVW2_GSU1_GSUAMB_LBSPP128_LPA8_LPB8_LRVW8_PGR2_PLR5_SU32_SUS256_SRVW4_TT1_32_VAW2_WSGRA1_WSGRB1_WG64_4_1_WGM15
    SolutionIndex: 65
    SolutionNameMin: Cijk_Alik_Bljk_BBS_BH_MT128x64x32_MI32x32x8x1_SE_1LDSB1_AF0EM8_EPS1_GRVW2_GSU1_GSUAMB_LBSPP128_LPA8_LPB8_LRVW8_PGR1_PLR5_SU0_SUS0_SRVW4_TT2_32_VAW2_WSGRA1_WSGRB1_WG64_4_1_WGM15
    SolutionIndex: 66
    SolutionNameMin: Cijk_Alik_Bljk_BBS_BH_MT128x96x64_MI32x32x8x1_SE_1LDSB1_AF0EM8_EPS1_GRVW8_GSU1_GSUAMB_LBSPP128_LPA8_LPB8_LRVW8_PGR1_PLR9_SU32_SUS128_SRVW4_TT1_96_VAW2_WSGRA1_WSGRB1_WG128_2_1_WGM1
    SolutionIndex: 67
    SolutionNameMin: Cijk_Alik_Bljk_BBS_BH_MT128x96x64_MI32x32x8x1_SE_1LDSB1_AF0EM8_EPS1_GRVW8_GSU1_GSUAMB_LBSPP128_LPA8_LPB8_LRVW8_PGR1_PLR9_SU32_SUS256_SRVW4_TT1_96_VAW2_WSGRA1_WSGRB1_WG128_2_1_WGM1
    SolutionIndex: 68
    SolutionNameMin: Cijk_Alik_Bljk_BBS_BH_MT128x96x64_MI32x32x8x1_SE_1LDSB1_AF0EM8_EPS0_GRVW8_GSU1_GSUAMB_LBSPP128_LPA8_LPB8_LRVW8_PGR2_PLR9_SU32_SUS128_SRVW4_TT1_96_VAW2_WSGRA1_WSGRB1_WG128_2_1_WGM1
    SolutionIndex: 69
    SolutionNameMin: Cijk_Alik_Bljk_BBS_BH_MT16x16x32_MI16x16x16x1_SE_1LDSB1_AF0EM1_EPS0_GRVW2_GSU1_GSUAMB_LBSPP128_LPA16_LPB16_LRVW8_PGR2_PLR2_SU0_SUS0_SRVW0_TT1_16_VAW2_WSGRA1_WSGRB1_WG16_4_1_WGM2
    SolutionIndex: 70
    SolutionNameMin: Cijk_Alik_Bljk_BBS_BH_MT64x128x64_MI32x32x8x1_SE_1LDSB1_AF0EM8_EPS0_GRVW8_GSU1_GSUAMB_LBSPP128_LPA8_LPB8_LRVW8_PGR2_PLR9_SU32_SUS128_SRVW4_TT1_64_VAW2_WSGRA1_WSGRB1_WG64_4_1_WGM1
    SolutionIndex: 71
    SolutionNameMin: Cijk_Alik_Bljk_BBS_BH_MT128x96x64_MI32x32x8x1_SE_1LDSB1_AF0EM8_EPS0_GRVW8_GSU1_GSUAMB_LBSPP128_LPA8_LPB8_LRVW8_PGR2_PLR9_SU32_SUS256_SRVW4_TT1_96_VAW2_WSGRA1_WSGRB1_WG128_2_1_WGM15
    SolutionIndex: 72
    SolutionNameMin: Cijk_Alik_Bljk_BBS_BH_MT32x64x32_MI16x16x16x1_SE_1LDSB1_AF0EM1_EPS1_GRVW4_GSU1_GSUAMB_LBSPP128_LPA16_LPB16_LRVW8_PGR1_PLR2_SU0_SUS0_SRVW4_TT1_32_VAW2_WSGRA1_WSGRB1_WG32_8_1_WGM1
    SolutionIndex: 73
    SolutionNameMin: Cijk_Alik_Bljk_BBS_BH_MT64x128x64_MI32x32x8x1_SE_1LDSB1_AF0EM8_EPS0_GRVW8_GSU1_GSUAMB_LBSPP128_LPA8_LPB8_LRVW8_PGR2_PLR9_SU0_SUS0_SRVW4_TT1_64_VAW2_WSGRA1_WSGRB1_WG64_4_1_WGM1
    SolutionIndex: 74
    SolutionNameMin: Cijk_Alik_Bljk_BBS_BH_MT16x64x128_MI16x16x16x1_SE_1LDSB0_AF0EM8_EPS0_GRVW8_GSU1_GSUAMB_LBSPP256_LPA16_LPB16_LRVW8_PGR2_PLR9_SU0_SUS0_SRVW0_TT1_16_VAW2_WSGRA1_WSGRB1_WG16_16_1_WGM2
    SolutionIndex: 75
    SolutionNameMin: Cijk_Alik_Bljk_BBS_BH_MT128x256x32_MI32x32x8x1_SE_1LDSB1_AF0EM8_EPS0_GRVW2_GSU1_GSUAMB_LBSPP128_LPA8_LPB8_LRVW8_PGR2_PLR5_SU0_SUS0_SRVW4_TT2_128_VAW2_WSGRA1_WSGRB1_WG64_4_1_WGM1
    SolutionIndex: 76
    SolutionNameMin: Cijk_Alik_Bljk_BBS_BH_MT16x16x128_MI16x16x16x1_SE_1LDSB0_AF0EM1_EPS0_GRVW8_GSU1_GSUAMB_LBSPP256_LPA16_LPB16_LRVW8_PGR2_PLR9_SU0_SUS0_SRVW0_TT1_16_VAW2_WSGRA1_WSGRB1_WG16_4_1_WGM2
    SolutionIndex: 77
    SolutionNameMin: Cijk_Alik_Bljk_BBS_BH_MT128x64x32_MI32x32x8x1_SE_1LDSB1_AF0EM8_EPS1_GRVW8_GSU1_GSUAMB_LBSPP128_LPA8_LPB8_LRVW8_PGR1_PLR5_SU32_SUS128_SRVW4_TT2_32_VAW2_WSGRA1_WSGRB1_WG64_4_1_WGM1
    SolutionIndex: 78
    SolutionNameMin: Cijk_Alik_Bljk_BBS_BH_MT16x16x128_MI16x16x16x1_SE_1LDSB0_AF0EM1_EPS1_GRVW8_GSU1_GSUAMB_LBSPP256_LPA16_LPB16_LRVW8_PGR1_PLR9_SU32_SUS256_SRVW0_TT1_16_VAW2_WSGRA1_WSGRB1_WG16_4_1_WGM1
    SolutionIndex: 79
    SolutionNameMin: Cijk_Alik_Bljk_BBS_BH_MT128x64x64_MI32x32x8x1_SE_1LDSB0_AF0EM8_EPS0_GRVW8_GSU1_GSUAMB_LBSPP128_LPA8_LPB8_LRVW8_PGR2_PLR9_SU0_SUS0_SRVW4_TT2_32_VAW2_WSGRA1_WSGRB1_WG64_4_1_WGM15
    SolutionIndex: 80
    SolutionNameMin: Cijk_Alik_Bljk_BBS_BH_MT128x64x32_MI32x32x8x1_SE_1LDSB1_AF0EM8_EPS1_GRVW8_GSU1_GSUAMB_LBSPP128_LPA8_LPB8_LRVW8_PGR1_PLR5_SU0_SUS0_SRVW4_TT2_32_VAW2_WSGRA1_WSGRB1_WG64_4_1_WGM2
    SolutionIndex: 81
    SolutionNameMin: Cijk_Alik_Bljk_BBS_BH_MT64x16x32_MI16x16x16x1_SE_1LDSB1_AF0EM1_EPS1_GRVW8_GSU1_GSUAMB_LBSPP128_LPA16_LPB16_LRVW8_PGR1_PLR2_SU0_SUS0_SRVW0_TT1_16_VAW2_WSGRA1_WSGRB1_WG64_4_1_WGM1
    SolutionIndex: 82
    SolutionNameMin: Cijk_Alik_Bljk_BBS_BH_MT128x128x32_MI32x32x8x1_SE_1LDSB1_AF0EM8_EPS0_GRVW8_GSU1_GSUAMB_LBSPP128_LPA8_LPB8_LRVW8_PGR2_PLR5_SU32_SUS128_SRVW4_TT2_64_VAW2_WSGRA1_WSGRB1_WG64_4_1_WGM1
    SolutionIndex: 83
    SolutionNameMin: Cijk_Alik_Bljk_BBS_BH_MT128x128x32_MI32x32x8x1_SE_1LDSB1_AF0EM8_EPS0_GRVW8_GSU1_GSUAMB_LBSPP128_LPA8_LPB8_LRVW8_PGR2_PLR5_SU32_SUS256_SRVW4_TT2_64_VAW2_WSGRA1_WSGRB1_WG64_4_1_WGM1
    SolutionIndex: 84
    SolutionNameMin: Cijk_Alik_Bljk_BBS_BH_MT128x128x32_MI32x32x8x1_SE_1LDSB1_AF0EM8_EPS0_GRVW4_GSU1_GSUAMB_LBSPP128_LPA8_LPB8_LRVW8_PGR2_PLR5_SU0_SUS0_SRVW4_TT2_64_VAW2_WSGRA1_WSGRB1_WG64_4_1_WGM15
    SolutionIndex: 85
    SolutionNameMin: Cijk_Alik_Bljk_BBS_BH_MT16x64x128_MI16x16x16x1_SE_1LDSB0_AF0EM1_EPS0_GRVW8_GSU1_GSUAMB_LBSPP256_LPA16_LPB16_LRVW8_PGR2_PLR9_SU0_SUS0_SRVW0_TT1_16_VAW2_WSGRA1_WSGRB1_WG16_16_1_WGM1
    SolutionIndex: 86
    SolutionNameMin: Cijk_Alik_Bljk_BBS_BH_MT16x16x128_MI16x16x16x1_SE_1LDSB0_AF0EM8_EPS0_GRVW8_GSU1_GSUAMB_LBSPP256_LPA16_LPB16_LRVW8_PGR2_PLR9_SU0_SUS0_SRVW0_TT1_16_VAW2_WSGRA1_WSGRB1_WG16_4_1_WGM2
    SolutionIndex: 87
    SolutionNameMin: Cijk_Alik_Bljk_BBS_BH_MT64x16x128_MI16x16x16x1_SE_1LDSB0_AF0EM1_EPS0_GRVW8_GSU1_GSUAMB_LBSPP256_LPA16_LPB16_LRVW8_PGR2_PLR9_SU32_SUS256_SRVW0_TT1_16_VAW2_WSGRA1_WSGRB1_WG64_4_1_WGM1
    SolutionIndex: 88
    SolutionNameMin: Cijk_Alik_Bljk_BBS_BH_MT64x128x64_MI32x32x8x1_SE_1LDSB0_AF0EM8_EPS0_GRVW8_GSU1_GSUAMB_LBSPP128_LPA8_LPB8_LRVW8_PGR2_PLR9_SU32_SUS256_SRVW4_TT1_64_VAW2_WSGRA1_WSGRB1_WG64_4_1_WGM1
    SolutionIndex: 89
    SolutionNameMin: Cijk_Alik_Bljk_BBS_BH_MT16x64x128_MI16x16x16x1_SE_1LDSB0_AF0EM8_EPS0_GRVW8_GSU1_GSUAMB_LBSPP256_LPA16_LPB16_LRVW8_PGR2_PLR9_SU0_SUS0_SRVW0_TT1_16_VAW2_WSGRA1_WSGRB1_WG16_16_1_WGM1
    SolutionIndex: 90
    SolutionNameMin: Cijk_Alik_Bljk_BBS_BH_MT128x128x64_MI32x32x8x1_SE_1LDSB1_AF0EM8_EPS0_GRVW8_GSU1_GSUAMB_LBSPP128_LPA8_LPB8_LRVW8_PGR2_PLR9_SU0_SUS0_SRVW4_TT2_64_VAW2_WSGRA1_WSGRB1_WG64_4_1_WGM2
    SolutionIndex: 91
    SolutionNameMin: Cijk_Alik_Bljk_BBS_BH_MT128x128x32_MI32x32x8x1_SE_1LDSB1_AF0EM8_EPS0_GRVW8_GSU1_GSUAMB_LBSPP128_LPA8_LPB8_LRVW8_PGR2_PLR5_SU0_SUS0_SRVW4_TT2_64_VAW2_WSGRA1_WSGRB1_WG64_4_1_WGM1
    SolutionIndex: 92
    SolutionNameMin: Cijk_Alik_Bljk_BBS_BH_MT64x128x64_MI32x32x8x1_SE_1LDSB1_AF0EM8_EPS1_GRVW8_GSU1_GSUAMB_LBSPP128_LPA8_LPB8_LRVW8_PGR1_PLR9_SU32_SUS128_SRVW4_TT1_64_VAW2_WSGRA1_WSGRB1_WG64_4_1_WGM2
    SolutionIndex: 93
    SolutionNameMin: Cijk_Alik_Bljk_BBS_BH_MT160x128x64_MI32x32x8x1_SE_1LDSB1_AF0EM8_EPS1_GRVW8_GSU1_GSUAMB_LBSPP128_LPA8_LPB8_LRVW8_PGR1_PLR9_SU32_SUS128_SRVW0_TT5_32_VAW2_WSGRA1_WSGRB1_WG32_8_1_WGM2
    SolutionIndex: 94
    SolutionNameMin: Cijk_Alik_Bljk_BBS_BH_MT128x128x64_MI32x32x8x1_SE_1LDSB1_AF0EM8_EPS0_GRVW8_GSU1_GSUAMB_LBSPP128_LPA8_LPB8_LRVW8_PGR2_PLR9_SU0_SUS0_SRVW4_TT2_64_VAW2_WSGRA1_WSGRB1_WG64_4_1_WGM1
    SolutionIndex: 95
    SolutionNameMin: Cijk_Alik_Bljk_BBS_BH_MT128x128x32_MI32x32x8x1_SE_1LDSB1_AF0EM8_EPS0_GRVW8_GSU1_GSUAMB_LBSPP128_LPA8_LPB8_LRVW8_PGR2_PLR5_SU0_SUS0_SRVW4_TT2_64_VAW2_WSGRA1_WSGRB1_WG64_4_1_WGM2
    SolutionIndex: 96
    SolutionNameMin: Cijk_Alik_Bljk_BBS_BH_MT64x128x64_MI32x32x8x1_SE_1LDSB1_AF0EM8_EPS1_GRVW8_GSU1_GSUAMB_LBSPP128_LPA8_LPB8_LRVW8_PGR1_PLR9_SU32_SUS256_SRVW4_TT1_64_VAW2_WSGRA1_WSGRB1_WG64_4_1_WGM15
    SolutionIndex: 97
    SolutionNameMin: Cijk_Alik_Bljk_BBS_BH_MT128x128x32_MI32x32x8x1_SE_1LDSB1_AF0EM8_EPS0_GRVW8_GSU1_GSUAMB_LBSPP128_LPA8_LPB8_LRVW8_PGR2_PLR5_SU32_SUS256_SRVW4_TT2_64_VAW2_WSGRA1_WSGRB1_WG64_4_1_WGM2
    SolutionIndex: 98
    SolutionNameMin: Cijk_Alik_Bljk_BBS_BH_MT128x64x64_MI32x32x8x1_SE_1LDSB1_AF0EM8_EPS0_GRVW8_GSU1_GSUAMB_LBSPP128_LPA8_LPB8_LRVW8_PGR2_PLR9_SU32_SUS128_SRVW4_TT2_32_VAW2_WSGRA1_WSGRB1_WG64_4_1_WGM2
    SolutionIndex: 99
    SolutionNameMin: Cijk_Alik_Bljk_BBS_BH_MT64x128x64_MI32x32x8x1_SE_1LDSB1_AF0EM8_EPS1_GRVW8_GSU1_GSUAMB_LBSPP128_LPA8_LPB8_LRVW8_PGR1_PLR9_SU0_SUS0_SRVW4_TT1_64_VAW2_WSGRA1_WSGRB1_WG64_4_1_WGM1
    SolutionIndex: 100
    SolutionNameMin: Cijk_Alik_Bljk_BBS_BH_MT128x128x32_MI32x32x8x1_SE_1LDSB1_AF0EM8_EPS1_GRVW4_GSU1_GSUAMB_LBSPP128_LPA8_LPB8_LRVW8_PGR1_PLR5_SU0_SUS0_SRVW4_TT2_64_VAW2_WSGRA1_WSGRB1_WG64_4_1_WGM2
    SolutionIndex: 101
    SolutionNameMin: Cijk_Alik_Bljk_BBS_BH_MT16x16x128_MI16x16x16x1_SE_1LDSB1_AF0EM8_EPS1_GRVW8_GSU1_GSUAMB_LBSPP256_LPA16_LPB16_LRVW8_PGR1_PLR9_SU0_SUS0_SRVW0_TT1_16_VAW2_WSGRA1_WSGRB1_WG16_4_1_WGM2
    SolutionIndex: 102
    SolutionNameMin: Cijk_Alik_Bljk_BBS_BH_MT128x128x32_MI32x32x8x1_SE_1LDSB1_AF0EM8_EPS0_GRVW8_GSU1_GSUAMB_LBSPP128_LPA8_LPB8_LRVW8_PGR2_PLR5_SU0_SUS0_SRVW4_TT2_64_VAW2_WSGRA1_WSGRB1_WG64_4_1_WGM15
    SolutionIndex: 103
    SolutionNameMin: Cijk_Alik_Bljk_BBS_BH_MT128x256x32_MI32x32x8x1_SE_1LDSB1_AF0EM8_EPS1_GRVW8_GSU1_GSUAMB_LBSPP128_LPA8_LPB8_LRVW8_PGR1_PLR5_SU0_SUS0_SRVW4_TT2_128_VAW2_WSGRA1_WSGRB1_WG64_4_1_WGM1
    SolutionIndex: 104
    SolutionNameMin: Cijk_Alik_Bljk_BBS_BH_MT64x64x32_MI32x32x8x1_SE_1LDSB1_AF0EM8_EPS0_GRVW8_GSU1_GSUAMB_LBSPP128_LPA8_LPB8_LRVW8_PGR2_PLR5_SU0_SUS0_SRVW4_TT1_32_VAW2_WSGRA1_WSGRB1_WG64_4_1_WGM1
    SolutionIndex: 105
    SolutionNameMin: Cijk_Alik_Bljk_BBS_BH_MT32x64x64_MI16x16x16x1_SE_1LDSB1_AF0EM8_EPS1_GRVW8_GSU1_GSUAMB_LBSPP128_LPA16_LPB16_LRVW8_PGR1_PLR5_SU0_SUS0_SRVW4_TT1_32_VAW2_WSGRA1_WSGRB1_WG32_8_1_WGM2
    SolutionIndex: 106
    SolutionNameMin: Cijk_Alik_Bljk_BBS_BH_MT64x16x128_MI16x16x16x1_SE_1LDSB1_AF0EM8_EPS1_GRVW8_GSU1_GSUAMB_LBSPP256_LPA16_LPB16_LRVW8_PGR1_PLR9_SU0_SUS0_SRVW0_TT1_16_VAW2_WSGRA1_WSGRB1_WG64_4_1_WGM1
    SolutionIndex: 107
    SolutionNameMin: Cijk_Alik_Bljk_BBS_BH_MT64x32x32_MI16x16x16x1_SE_1LDSB1_AF0EM8_EPS1_GRVW8_GSU1_GSUAMB_LBSPP128_LPA16_LPB16_LRVW8_PGR1_PLR2_SU0_SUS0_SRVW4_TT2_16_VAW2_WSGRA1_WSGRB1_WG32_8_1_WGM15
    SolutionIndex: 108
    SolutionNameMin: Cijk_Alik_Bljk_BBS_BH_MT64x64x32_MI32x32x8x1_SE_1LDSB1_AF0EM8_EPS1_GRVW4_GSU1_GSUAMB_LBSPP128_LPA8_LPB8_LRVW8_PGR1_PLR5_SU0_SUS0_SRVW4_TT1_32_VAW2_WSGRA1_WSGRB1_WG64_4_1_WGM1
    SolutionIndex: 109
    SolutionNameMin: Cijk_Alik_Bljk_BBS_BH_MT128x96x32_MI32x32x8x1_SE_1LDSB1_AF0EM8_EPS1_GRVW4_GSU1_GSUAMB_LBSPP128_LPA8_LPB8_LRVW8_PGR1_PLR5_SU32_SUS256_SRVW4_TT1_96_VAW2_WSGRA1_WSGRB1_WG128_2_1_WGM2
    SolutionIndex: 110
    SolutionNameMin: Cijk_Alik_Bljk_BBS_BH_MT64x128x32_MI32x32x8x1_SE_1LDSB1_AF0EM1_EPS1_GRVW8_GSU1_GSUAMB_LBSPP128_LPA8_LPB8_LRVW8_PGR1_PLR5_SU0_SUS0_SRVW4_TT1_64_VAW2_WSGRA1_WSGRB1_WG64_4_1_WGM2
    SolutionIndex: 111
    SolutionNameMin: Cijk_Alik_Bljk_BBS_BH_MT64x64x64_MI32x32x8x1_SE_1LDSB1_AF0EM8_EPS1_GRVW8_GSU1_GSUAMB_LBSPP128_LPA8_LPB8_LRVW8_PGR1_PLR9_SU32_SUS128_SRVW4_TT1_32_VAW2_WSGRA1_WSGRB1_WG64_4_1_WGM1
    SolutionIndex: 112
    SolutionNameMin: Cijk_Alik_Bljk_BBS_BH_MT16x16x128_MI16x16x16x1_SE_1LDSB1_AF0EM1_EPS1_GRVW8_GSU1_GSUAMB_LBSPP256_LPA16_LPB16_LRVW8_PGR1_PLR9_SU0_SUS0_SRVW4_TT1_16_VAW2_WSGRA1_WSGRB1_WG16_4_1_WGM1
    SolutionIndex: 113
    SolutionNameMin: Cijk_Alik_Bljk_BBS_BH_MT64x64x32_MI32x32x8x1_SE_1LDSB0_AF0EM8_EPS0_GRVW2_GSU1_GSUAMB_LBSPP128_LPA8_LPB8_LRVW8_PGR2_PLR5_SU0_SUS0_SRVW4_TT1_32_VAW2_WSGRA1_WSGRB1_WG64_4_1_WGM15
    SolutionIndex: 114
    SolutionNameMin: Cijk_Alik_Bljk_BBS_BH_MT32x32x64_MI16x16x16x1_SE_1LDSB0_AF0EM8_EPS0_GRVW4_GSU1_GSUAMB_LBSPP128_LPA16_LPB16_LRVW8_PGR2_PLR5_SU0_SUS0_SRVW4_TT1_16_VAW2_WSGRA1_WSGRB1_WG32_8_1_WGM1
    SolutionIndex: 115
    SolutionNameMin: Cijk_Alik_Bljk_BBS_BH_MT64x32x32_MI16x16x16x1_SE_1LDSB1_AF0EM8_EPS1_GRVW2_GSU1_GSUAMB_LBSPP128_LPA16_LPB16_LRVW8_PGR1_PLR2_SU0_SUS0_SRVW4_TT2_16_VAW2_WSGRA1_WSGRB1_WG32_8_1_WGM2
    SolutionIndex: 116
    SolutionNameMin: Cijk_Alik_Bljk_BBS_BH_MT128x64x32_MI32x32x8x1_SE_1LDSB1_AF0EM8_EPS1_GRVW2_GSU1_GSUAMB_LBSPP128_LPA8_LPB8_LRVW8_PGR1_PLR5_SU32_SUS128_SRVW4_TT2_32_VAW2_WSGRA1_WSGRB1_WG64_4_1_WGM2
    SolutionIndex: 117
    SolutionNameMin: Cijk_Alik_Bljk_BBS_BH_MT32x32x64_MI16x16x16x1_SE_1LDSB0_AF0EM8_EPS0_GRVW2_GSU1_GSUAMB_LBSPP128_LPA16_LPB16_LRVW8_PGR2_PLR5_SU32_SUS128_SRVW4_TT1_16_VAW2_WSGRA1_WSGRB1_WG32_8_1_WGM1
    SolutionIndex: 118
    SolutionNameMin: Cijk_Alik_Bljk_BBS_BH_MT64x128x64_MI32x32x8x1_SE_1LDSB1_AF0EM8_EPS0_GRVW8_GSU1_GSUAMB_LBSPP128_LPA8_LPB8_LRVW8_PGR2_PLR9_SU0_SUS0_SRVW4_TT1_64_VAW2_WSGRA1_WSGRB1_WG64_4_1_WGM15
    SolutionIndex: 119
    SolutionNameMin: Cijk_Alik_Bljk_BBS_BH_MT64x64x64_MI32x32x8x1_SE_1LDSB0_AF0EM8_EPS0_GRVW8_GSU1_GSUAMB_LBSPP128_LPA8_LPB8_LRVW8_PGR2_PLR9_SU0_SUS0_SRVW4_TT1_32_VAW2_WSGRA1_WSGRB1_WG64_4_1_WGM1
    SolutionIndex: 120
    SolutionNameMin: Cijk_Alik_Bljk_BBS_BH_MT64x64x64_MI32x32x8x1_SE_1LDSB0_AF0EM8_EPS0_GRVW8_GSU1_GSUAMB_LBSPP128_LPA8_LPB8_LRVW8_PGR2_PLR9_SU0_SUS0_SRVW4_TT1_32_VAW2_WSGRA1_WSGRB1_WG64_4_1_WGM2
    SolutionIndex: 121
    SolutionNameMin: Cijk_Alik_Bljk_BBS_BH_MT128x128x64_MI32x32x8x1_SE_1LDSB1_AF0EM8_EPS0_GRVW8_GSU1_GSUAMB_LBSPP128_LPA8_LPB8_LRVW8_PGR2_PLR9_SU0_SUS0_SRVW4_TT2_64_VAW2_WSGRA1_WSGRB1_WG64_4_1_WGM15
    SolutionIndex: 122
    SolutionNameMin: Cijk_Alik_Bljk_BBS_BH_MT128x64x64_MI32x32x8x1_SE_1LDSB0_AF0EM8_EPS0_GRVW8_GSU1_GSUAMB_LBSPP128_LPA8_LPB8_LRVW8_PGR2_PLR9_SU0_SUS0_SRVW4_TT2_32_VAW2_WSGRA1_WSGRB1_WG64_4_1_WGM1
    SolutionIndex: 123
    SolutionNameMin: Cijk_Alik_Bljk_BBS_BH_MT128x128x64_MI32x32x8x1_SE_1LDSB1_AF0EM8_EPS0_GRVW8_GSU1_GSUAMB_LBSPP128_LPA8_LPB8_LRVW8_PGR2_PLR9_SU32_SUS128_SRVW4_TT2_64_VAW2_WSGRA1_WSGRB1_WG64_4_1_WGM15
    SolutionIndex: 124
    SolutionNameMin: Cijk_Alik_Bljk_BBS_BH_MT128x128x64_MI32x32x8x1_SE_1LDSB1_AF0EM1_EPS0_GRVW8_GSU1_GSUAMB_LBSPP128_LPA8_LPB8_LRVW8_PGR2_PLR9_SU0_SUS0_SRVW4_TT2_64_VAW2_WSGRA1_WSGRB1_WG64_4_1_WGM15
    SolutionIndex: 125
    SolutionNameMin: Cijk_Alik_Bljk_BBS_BH_MT64x128x64_MI32x32x8x1_SE_1LDSB1_AF0EM8_EPS1_GRVW8_GSU1_GSUAMB_LBSPP128_LPA8_LPB8_LRVW8_PGR1_PLR9_SU0_SUS0_SRVW4_TT1_64_VAW2_WSGRA1_WSGRB1_WG64_4_1_WGM2
    SolutionIndex: 126
    SolutionNameMin: Cijk_Alik_Bljk_BBS_BH_MT64x32x64_MI16x16x16x1_SE_1LDSB0_AF0EM1_EPS0_GRVW8_GSU15_GSUAMB_LBSPP128_LPA16_LPB16_LRVW8_PGR2_PLR5_SU32_SUS128_SRVW4_TT2_16_VAW1_WSGRA1_WSGRB1_WG32_8_1_WGM15
    SolutionIndex: 127
    SolutionNameMin: Cijk_Alik_Bljk_BBS_BH_MT16x16x128_MI16x16x16x1_SE_1LDSB0_AF0EM1_EPS0_GRVW8_GSU1_GSUAMB_LBSPP256_LPA16_LPB16_LRVW8_PGR2_PLR9_SU32_SUS256_SRVW0_TT1_16_VAW2_WSGRA1_WSGRB1_WG16_4_1_WGM2
    SolutionIndex: 128
    SolutionNameMin: Cijk_Alik_Bljk_BBS_BH_MT32x32x32_MI16x16x16x1_SE_1LDSB1_AF0EM1_EPS0_GRVW8_GSU1_GSUAMB_LBSPP128_LPA16_LPB16_LRVW8_PGR2_PLR2_SU0_SUS0_SRVW4_TT1_16_VAW2_WSGRA1_WSGRB1_WG32_8_1_WGM1
    SolutionIndex: 129
    SolutionNameMin: Cijk_Alik_Bljk_BBS_BH_MT16x16x32_MI16x16x16x1_SE_1LDSB1_AF0EM1_EPS0_GRVW2_GSU1_GSUAMB_LBSPP128_LPA16_LPB16_LRVW8_PGR2_PLR2_SU32_SUS256_SRVW0_TT1_16_VAW2_WSGRA1_WSGRB1_WG16_4_1_WGM2
    SolutionIndex: 130
    SolutionNameMin: Cijk_Alik_Bljk_BBS_BH_MT64x64x64_MI32x32x8x1_SE_1LDSB0_AF0EM8_EPS0_GRVW8_GSU1_GSUAMB_LBSPP128_LPA8_LPB8_LRVW8_PGR2_PLR9_SU32_SUS128_SRVW4_TT1_32_VAW2_WSGRA1_WSGRB1_WG64_4_1_WGM15
    SolutionIndex: 131
    SolutionNameMin: Cijk_Alik_Bljk_BBS_BH_MT16x16x32_MI16x16x16x1_SE_1LDSB0_AF0EM8_EPS1_GRVW4_GSU1_GSUAMB_LBSPP128_LPA16_LPB16_LRVW8_PGR1_PLR2_SU0_SUS0_SRVW0_TT1_16_VAW2_WSGRA1_WSGRB1_WG16_4_1_WGM1
    SolutionIndex: 132
    SolutionNameMin: Cijk_Alik_Bljk_BBS_BH_MT16x16x32_MI16x16x16x1_SE_1LDSB1_AF0EM1_EPS0_GRVW2_GSU1_GSUAMB_LBSPP128_LPA16_LPB16_LRVW8_PGR2_PLR2_SU0_SUS0_SRVW0_TT1_16_VAW2_WSGRA1_WSGRB1_WG16_4_1_WGM15
    SolutionIndex: 133
    SolutionNameMin: Cijk_Alik_Bljk_BBS_BH_MT64x64x32_MI32x32x8x1_SE_1LDSB1_AF0EM8_EPS1_GRVW8_GSU1_GSUAMB_LBSPP128_LPA8_LPB8_LRVW8_PGR1_PLR5_SU0_SUS0_SRVW4_TT1_32_VAW2_WSGRA1_WSGRB1_WG64_4_1_WGM1
    SolutionIndex: 134
    SolutionNameMin: Cijk_Alik_Bljk_BBS_BH_MT64x32x32_MI16x16x16x1_SE_1LDSB0_AF0EM8_EPS1_GRVW4_GSU1_GSUAMB_LBSPP128_LPA16_LPB16_LRVW8_PGR1_PLR2_SU0_SUS0_SRVW4_TT2_16_VAW2_WSGRA1_WSGRB1_WG32_8_1_WGM1
    SolutionIndex: 135
    SolutionNameMin: Cijk_Alik_Bljk_BBS_BH_MT16x64x32_MI16x16x16x1_SE_1LDSB0_AF0EM8_EPS0_GRVW4_GSU1_GSUAMB_LBSPP128_LPA16_LPB16_LRVW8_PGR2_PLR2_SU0_SUS0_SRVW0_TT1_16_VAW2_WSGRA1_WSGRB1_WG16_16_1_WGM2
    SolutionIndex: 136
    SolutionNameMin: Cijk_Alik_Bljk_BBS_BH_MT64x64x64_MI32x32x8x1_SE_1LDSB0_AF0EM8_EPS0_GRVW8_GSU1_GSUAMB_LBSPP128_LPA8_LPB8_LRVW8_PGR2_PLR9_SU0_SUS0_SRVW4_TT1_32_VAW2_WSGRA1_WSGRB1_WG64_4_1_WGM15
    SolutionIndex: 137
    SolutionNameMin: Cijk_Alik_Bljk_BBS_BH_MT64x32x32_MI16x16x16x1_SE_1LDSB1_AF0EM8_EPS1_GRVW8_GSU1_GSUAMB_LBSPP128_LPA16_LPB16_LRVW8_PGR1_PLR2_SU32_SUS128_SRVW4_TT2_16_VAW2_WSGRA1_WSGRB1_WG32_8_1_WGM2
    SolutionIndex: 138
    SolutionNameMin: Cijk_Alik_Bljk_BBS_BH_MT128x128x32_MI32x32x8x1_SE_1LDSB1_AF0EM8_EPS1_GRVW8_GSU1_GSUAMB_LBSPP128_LPA8_LPB8_LRVW8_PGR1_PLR5_SU32_SUS256_SRVW4_TT2_64_VAW2_WSGRA1_WSGRB1_WG64_4_1_WGM1
    SolutionIndex: 139
    SolutionNameMin: Cijk_Alik_Bljk_BBS_BH_MT64x128x32_MI32x32x8x1_SE_1LDSB1_AF0EM8_EPS1_GRVW8_GSU1_GSUAMB_LBSPP128_LPA8_LPB8_LRVW8_PGR1_PLR5_SU0_SUS0_SRVW4_TT1_64_VAW2_WSGRA1_WSGRB1_WG64_4_1_WGM2
    SolutionIndex: 140
    SolutionNameMin: Cijk_Alik_Bljk_BBS_BH_MT64x32x32_MI16x16x16x1_SE_1LDSB0_AF0EM8_EPS1_GRVW8_GSU1_GSUAMB_LBSPP128_LPA16_LPB16_LRVW8_PGR1_PLR2_SU0_SUS0_SRVW4_TT2_16_VAW2_WSGRA1_WSGRB1_WG32_8_1_WGM1
    SolutionIndex: 141
    SolutionNameMin: Cijk_Alik_Bljk_BBS_BH_MT16x64x32_MI16x16x16x1_SE_1LDSB0_AF0EM8_EPS0_GRVW4_GSU1_GSUAMB_LBSPP128_LPA16_LPB16_LRVW8_PGR2_PLR2_SU0_SUS0_SRVW0_TT1_16_VAW2_WSGRA1_WSGRB1_WG16_16_1_WGM1
    SolutionIndex: 142
    SolutionNameMin: Cijk_Alik_Bljk_BBS_BH_MT64x64x32_MI32x32x8x1_SE_1LDSB1_AF0EM8_EPS1_GRVW2_GSU1_GSUAMB_LBSPP128_LPA8_LPB8_LRVW8_PGR1_PLR5_SU32_SUS128_SRVW4_TT1_32_VAW2_WSGRA1_WSGRB1_WG64_4_1_WGM1
    SolutionIndex: 143
    SolutionNameMin: Cijk_Alik_Bljk_BBS_BH_MT64x64x32_MI32x32x8x1_SE_1LDSB1_AF0EM8_EPS0_GRVW8_GSU1_GSUAMB_LBSPP128_LPA8_LPB8_LRVW8_PGR2_PLR5_SU32_SUS128_SRVW4_TT1_32_VAW2_WSGRA1_WSGRB1_WG64_4_1_WGM1
    SolutionIndex: 144
    SolutionNameMin: Cijk_Alik_Bljk_BBS_BH_MT128x64x32_MI32x32x8x1_SE_1LDSB1_AF0EM8_EPS1_GRVW8_GSU1_GSUAMB_LBSPP128_LPA8_LPB8_LRVW8_PGR1_PLR5_SU0_SUS0_SRVW4_TT2_32_VAW2_WSGRA1_WSGRB1_WG64_4_1_WGM1
    SolutionIndex: 145
    SolutionNameMin: Cijk_Alik_Bljk_BBS_BH_MT16x16x128_MI16x16x16x1_SE_1LDSB1_AF0EM1_EPS1_GRVW8_GSU1_GSUAMB_LBSPP256_LPA16_LPB16_LRVW8_PGR1_PLR9_SU0_SUS0_SRVW0_TT1_16_VAW2_WSGRA1_WSGRB1_WG16_4_1_WGM2
    SolutionIndex: 146
    SolutionNameMin: Cijk_Alik_Bljk_BBS_BH_MT64x32x64_MI16x16x16x1_SE_1LDSB0_AF0EM8_EPS0_GRVW8_GSU1_GSUAMB_LBSPP128_LPA16_LPB16_LRVW8_PGR2_PLR5_SU32_SUS128_SRVW4_TT2_16_VAW2_WSGRA1_WSGRB1_WG32_8_1_WGM1
    SolutionIndex: 147
    SolutionNameMin: Cijk_Alik_Bljk_BBS_BH_MT64x64x64_MI32x32x8x1_SE_1LDSB1_AF0EM8_EPS1_GRVW8_GSU1_GSUAMB_LBSPP128_LPA8_LPB8_LRVW8_PGR1_PLR9_SU32_SUS256_SRVW4_TT1_32_VAW2_WSGRA1_WSGRB1_WG64_4_1_WGM2
    SolutionIndex: 148
    SolutionNameMin: Cijk_Alik_Bljk_BBS_BH_MT16x16x128_MI16x16x16x1_SE_1LDSB0_AF0EM8_EPS0_GRVW8_GSU1_GSUAMB_LBSPP256_LPA16_LPB16_LRVW8_PGR2_PLR9_SU0_SUS0_SRVW0_TT1_16_VAW2_WSGRA1_WSGRB1_WG16_4_1_WGM15
    SolutionIndex: 149
    SolutionNameMin: Cijk_Alik_Bljk_BBS_BH_MT128x64x32_MI32x32x8x1_SE_1LDSB1_AF0EM8_EPS1_GRVW4_GSU1_GSUAMB_LBSPP128_LPA8_LPB8_LRVW8_PGR1_PLR5_SU32_SUS256_SRVW4_TT2_32_VAW2_WSGRA1_WSGRB1_WG64_4_1_WGM1
    SolutionIndex: 150
    SolutionNameMin: Cijk_Alik_Bljk_BBS_BH_MT16x16x128_MI16x16x16x1_SE_1LDSB1_AF0EM8_EPS1_GRVW8_GSU1_GSUAMB_LBSPP256_LPA16_LPB16_LRVW8_PGR1_PLR9_SU32_SUS256_SRVW0_TT1_16_VAW2_WSGRA1_WSGRB1_WG16_4_1_WGM1
    SolutionIndex: 151
    SolutionNameMin: Cijk_Alik_Bljk_BBS_BH_MT64x128x64_MI32x32x8x1_SE_1LDSB1_AF0EM8_EPS0_GRVW8_GSU1_GSUAMB_LBSPP128_LPA8_LPB8_LRVW8_PGR2_PLR9_SU32_SUS128_SRVW4_TT1_64_VAW2_WSGRA1_WSGRB1_WG64_4_1_WGM2
    SolutionIndex: 152
    SolutionNameMin: Cijk_Alik_Bljk_BBS_BH_MT64x128x64_MI32x32x8x1_SE_1LDSB0_AF0EM8_EPS0_GRVW8_GSU1_GSUAMB_LBSPP128_LPA8_LPB8_LRVW8_PGR2_PLR9_SU32_SUS128_SRVW4_TT1_64_VAW2_WSGRA1_WSGRB1_WG64_4_1_WGM2
    SolutionIndex: 153
    SolutionNameMin: Cijk_Alik_Bljk_BBS_BH_MT64x32x32_MI16x16x16x1_SE_1LDSB1_AF0EM8_EPS1_GRVW4_GSU1_GSUAMB_LBSPP128_LPA16_LPB16_LRVW8_PGR1_PLR2_SU0_SUS0_SRVW4_TT2_16_VAW2_WSGRA1_WSGRB1_WG32_8_1_WGM1
    SolutionIndex: 154
    SolutionNameMin: Cijk_Alik_Bljk_BBS_BH_MT16x64x128_MI16x16x16x1_SE_1LDSB0_AF0EM1_EPS1_GRVW8_GSU1_GSUAMB_LBSPP256_LPA16_LPB16_LRVW8_PGR1_PLR9_SU0_SUS0_SRVW0_TT1_16_VAW2_WSGRA1_WSGRB1_WG16_16_1_WGM1
    SolutionIndex: 155
    SolutionNameMin: Cijk_Alik_Bljk_BBS_BH_MT128x64x32_MI32x32x8x1_SE_1LDSB1_AF0EM8_EPS1_GRVW2_GSU1_GSUAMB_LBSPP128_LPA8_LPB8_LRVW8_PGR1_PLR5_SU0_SUS0_SRVW4_TT2_32_VAW2_WSGRA1_WSGRB1_WG64_4_1_WGM2
    SolutionIndex: 156
    SolutionNameMin: Cijk_Alik_Bljk_BBS_BH_MT64x32x32_MI16x16x16x1_SE_1LDSB1_AF0EM8_EPS1_GRVW8_GSU1_GSUAMB_LBSPP128_LPA16_LPB16_LRVW8_PGR1_PLR2_SU0_SUS0_SRVW4_TT2_16_VAW2_WSGRA1_WSGRB1_WG32_8_1_WGM1
    SolutionIndex: 157
    SolutionNameMin: Cijk_Alik_Bljk_BBS_BH_MT128x96x64_MI32x32x8x1_SE_1LDSB1_AF0EM8_EPS1_GRVW8_GSU1_GSUAMB_LBSPP128_LPA8_LPB8_LRVW8_PGR1_PLR9_SU0_SUS0_SRVW4_TT1_96_VAW2_WSGRA1_WSGRB1_WG128_2_1_WGM2
    SolutionIndex: 158
    SolutionNameMin: Cijk_Alik_Bljk_BBS_BH_MT64x32x32_MI16x16x16x1_SE_1LDSB0_AF0EM8_EPS1_GRVW2_GSU1_GSUAMB_LBSPP128_LPA16_LPB16_LRVW8_PGR1_PLR2_SU0_SUS0_SRVW4_TT2_16_VAW2_WSGRA1_WSGRB1_WG32_8_1_WGM1
    SolutionIndex: 159
    SolutionNameMin: Cijk_Alik_Bljk_BBS_BH_MT128x96x32_MI32x32x8x1_SE_1LDSB1_AF0EM8_EPS1_GRVW4_GSU1_GSUAMB_LBSPP128_LPA8_LPB8_LRVW8_PGR1_PLR5_SU0_SUS0_SRVW4_TT1_96_VAW2_WSGRA1_WSGRB1_WG128_2_1_WGM2
    SolutionIndex: 160
    SolutionNameMin: Cijk_Alik_Bljk_BBS_BH_MT16x64x64_MI16x16x16x1_SE_1LDSB0_AF0EM8_EPS0_GRVW8_GSU1_GSUAMB_LBSPP128_LPA16_LPB16_LRVW8_PGR2_PLR5_SU0_SUS0_SRVW0_TT1_16_VAW2_WSGRA1_WSGRB1_WG16_16_1_WGM2
    SolutionIndex: 161
    SolutionNameMin: Cijk_Alik_Bljk_BBS_BH_MT16x16x128_MI16x16x16x1_SE_1LDSB0_AF0EM8_EPS1_GRVW8_GSU1_GSUAMB_LBSPP256_LPA16_LPB16_LRVW8_PGR1_PLR9_SU0_SUS0_SRVW0_TT1_16_VAW2_WSGRA1_WSGRB1_WG16_4_1_WGM1
    SolutionIndex: 162
    SolutionNameMin: Cijk_Alik_Bljk_BBS_BH_MT128x128x32_MI32x32x8x1_SE_1LDSB1_AF0EM8_EPS1_GRVW4_GSU1_GSUAMB_LBSPP128_LPA8_LPB8_LRVW8_PGR1_PLR5_SU0_SUS0_SRVW4_TT2_64_VAW2_WSGRA1_WSGRB1_WG64_4_1_WGM15
    SolutionIndex: 163
    SolutionNameMin: Cijk_Alik_Bljk_BBS_BH_MT64x32x32_MI16x16x16x1_SE_1LDSB1_AF0EM8_EPS1_GRVW2_GSU1_GSUAMB_LBSPP128_LPA16_LPB16_LRVW8_PGR1_PLR2_SU0_SUS0_SRVW4_TT2_16_VAW2_WSGRA1_WSGRB1_WG32_8_1_WGM1
    SolutionIndex: 164
    SolutionNameMin: Cijk_Alik_Bljk_BBS_BH_MT64x64x64_MI32x32x8x1_SE_1LDSB0_AF0EM8_EPS0_GRVW8_GSU1_GSUAMB_LBSPP128_LPA8_LPB8_LRVW8_PGR2_PLR9_SU32_SUS256_SRVW4_TT1_32_VAW2_WSGRA1_WSGRB1_WG64_4_1_WGM2
    SolutionIndex: 165
    SolutionNameMin: Cijk_Alik_Bljk_BBS_BH_MT16x16x32_MI16x16x16x1_SE_1LDSB0_AF0EM1_EPS0_GRVW4_GSU1_GSUAMB_LBSPP128_LPA16_LPB16_LRVW8_PGR2_PLR2_SU0_SUS0_SRVW0_TT1_16_VAW2_WSGRA1_WSGRB1_WG16_4_1_WGM1
    SolutionIndex: 166
    SolutionNameMin: Cijk_Alik_Bljk_BBS_BH_MT128x64x64_MI32x32x8x1_SE_1LDSB0_AF0EM8_EPS0_GRVW8_GSU1_GSUAMB_LBSPP128_LPA8_LPB8_LRVW8_PGR2_PLR9_SU32_SUS128_SRVW4_TT2_32_VAW2_WSGRA1_WSGRB1_WG64_4_1_WGM2
    SolutionIndex: 167
    SolutionNameMin: Cijk_Alik_Bljk_BBS_BH_MT16x64x32_MI16x16x16x1_SE_1LDSB0_AF0EM1_EPS1_GRVW2_GSU1_GSUAMB_LBSPP128_LPA16_LPB16_LRVW8_PGR1_PLR2_SU0_SUS0_SRVW0_TT1_16_VAW2_WSGRA1_WSGRB1_WG16_16_1_WGM1
    SolutionIndex: 168
    SolutionNameMin: Cijk_Alik_Bljk_BBS_BH_MT16x64x32_MI16x16x16x1_SE_1LDSB0_AF0EM8_EPS0_GRVW8_GSU1_GSUAMB_LBSPP128_LPA16_LPB16_LRVW8_PGR2_PLR2_SU0_SUS0_SRVW0_TT1_16_VAW2_WSGRA1_WSGRB1_WG16_16_1_WGM1
    SolutionIndex: 169
    SolutionNameMin: Cijk_Alik_Bljk_BBS_BH_MT64x128x32_MI32x32x8x1_SE_1LDSB1_AF0EM8_EPS0_GRVW8_GSU1_GSUAMB_LBSPP128_LPA8_LPB8_LRVW8_PGR2_PLR5_SU32_SUS256_SRVW4_TT1_64_VAW2_WSGRA1_WSGRB1_WG64_4_1_WGM1
    SolutionIndex: 170
    SolutionNameMin: Cijk_Alik_Bljk_BBS_BH_MT64x64x32_MI32x32x8x1_SE_1LDSB1_AF0EM1_EPS1_GRVW2_GSU1_GSUAMB_LBSPP128_LPA8_LPB8_LRVW8_PGR1_PLR5_SU0_SUS0_SRVW4_TT1_32_VAW2_WSGRA1_WSGRB1_WG64_4_1_WGM2
    SolutionIndex: 171
    SolutionNameMin: Cijk_Alik_Bljk_BBS_BH_MT128x96x64_MI32x32x8x1_SE_1LDSB1_AF0EM8_EPS1_GRVW8_GSU1_GSUAMB_LBSPP128_LPA8_LPB8_LRVW8_PGR1_PLR9_SU0_SUS0_SRVW4_TT1_96_VAW2_WSGRA1_WSGRB1_WG128_2_1_WGM1
    SolutionIndex: 172
    SolutionNameMin: Cijk_Alik_Bljk_BBS_BH_MT64x64x64_MI32x32x8x1_SE_1LDSB0_AF0EM8_EPS0_GRVW8_GSU1_GSUAMB_LBSPP128_LPA8_LPB8_LRVW8_PGR2_PLR9_SU32_SUS256_SRVW4_TT1_32_VAW2_WSGRA1_WSGRB1_WG64_4_1_WGM15
    SolutionIndex: 173
    SolutionNameMin: Cijk_Alik_Bljk_BBS_BH_MT128x256x32_MI32x32x8x1_SE_1LDSB1_AF0EM1_EPS1_GRVW8_GSU1_GSUAMB_LBSPP128_LPA8_LPB8_LRVW8_PGR1_PLR5_SU0_SUS0_SRVW4_TT2_128_VAW2_WSGRA1_WSGRB1_WG64_4_1_WGM2
    SolutionIndex: 174
    SolutionNameMin: Cijk_Alik_Bljk_BBS_BH_MT64x32x32_MI16x16x16x1_SE_1LDSB1_AF0EM8_EPS0_GRVW2_GSU1_GSUAMB_LBSPP128_LPA16_LPB16_LRVW8_PGR2_PLR2_SU0_SUS0_SRVW4_TT2_16_VAW2_WSGRA1_WSGRB1_WG32_8_1_WGM2
    SolutionIndex: 175
    SolutionNameMin: Cijk_Alik_Bljk_BBS_BH_MT128x96x32_MI32x32x8x1_SE_1LDSB1_AF0EM8_EPS1_GRVW2_GSU1_GSUAMB_LBSPP128_LPA8_LPB8_LRVW8_PGR1_PLR5_SU32_SUS128_SRVW4_TT1_96_VAW2_WSGRA1_WSGRB1_WG128_2_1_WGM1
    SolutionIndex: 176
    SolutionNameMin: Cijk_Alik_Bljk_BBS_BH_MT128x144x64_MI16x16x16x1_SE_1LDSB1_AF0EM8_EPS0_GRVW4_GSU1_GSUAMB_LBSPP128_LPA16_LPB16_LRVW8_PGR2_PLR5_SU32_SUS128_SRVW4_TT2_144_VAW2_WSGRA1_WSGRB1_WG64_4_1_WGM15
    SolutionIndex: 177
    SolutionNameMin: Cijk_Alik_Bljk_BBS_BH_MT64x64x64_MI32x32x8x1_SE_1LDSB1_AF0EM8_EPS1_GRVW4_GSU1_GSUAMB_LBSPP128_LPA8_LPB8_LRVW8_PGR1_PLR9_SU0_SUS0_SRVW4_TT1_32_VAW2_WSGRA1_WSGRB1_WG64_4_1_WGM1
    SolutionIndex: 178
    SolutionNameMin: Cijk_Alik_Bljk_BBS_BH_MT144x64x64_MI16x16x16x1_SE_1LDSB1_AF0EM8_EPS0_GRVW4_GSU1_GSUAMB_LBSPP128_LPA16_LPB16_LRVW8_PGR2_PLR5_SU32_SUS256_SRVW0_TT9_16_VAW2_WSGRA1_WSGRB1_WG16_16_1_WGM1
    SolutionIndex: 179
    SolutionNameMin: Cijk_Alik_Bljk_BBS_BH_MT16x16x128_MI16x16x16x1_SE_1LDSB0_AF0EM1_EPS1_GRVW8_GSU1_GSUAMB_LBSPP256_LPA16_LPB16_LRVW8_PGR1_PLR9_SU0_SUS0_SRVW0_TT1_16_VAW2_WSGRA1_WSGRB1_WG16_4_1_WGM1
    SolutionIndex: 180
    SolutionNameMin: Cijk_Alik_Bljk_BBS_BH_MT64x64x32_MI32x32x8x1_SE_1LDSB1_AF0EM1_EPS1_GRVW4_GSU1_GSUAMB_LBSPP128_LPA8_LPB8_LRVW8_PGR1_PLR5_SU0_SUS0_SRVW4_TT1_32_VAW2_WSGRA1_WSGRB1_WG64_4_1_WGM2
    SolutionIndex: 181
    SolutionNameMin: Cijk_Alik_Bljk_BBS_BH_MT128x128x32_MI32x32x8x1_SE_1LDSB1_AF0EM1_EPS1_GRVW4_GSU1_GSUAMB_LBSPP128_LPA8_LPB8_LRVW8_PGR1_PLR5_SU0_SUS0_SRVW4_TT2_64_VAW2_WSGRA1_WSGRB1_WG64_4_1_WGM15
    SolutionIndex: 182
    SolutionNameMin: Cijk_Alik_Bljk_BBS_BH_MT128x64x32_MI32x32x8x1_SE_1LDSB0_AF0EM8_EPS0_GRVW8_GSU1_GSUAMB_LBSPP128_LPA8_LPB8_LRVW8_PGR2_PLR5_SU0_SUS0_SRVW4_TT2_32_VAW2_WSGRA1_WSGRB1_WG64_4_1_WGM1
    SolutionIndex: 183
    SolutionNameMin: Cijk_Alik_Bljk_BBS_BH_MT128x64x64_MI32x32x8x1_SE_1LDSB0_AF0EM8_EPS0_GRVW8_GSU1_GSUAMB_LBSPP128_LPA8_LPB8_LRVW8_PGR2_PLR9_SU32_SUS256_SRVW4_TT2_32_VAW2_WSGRA1_WSGRB1_WG64_4_1_WGM15
    SolutionIndex: 184
    SolutionNameMin: Cijk_Alik_Bljk_BBS_BH_MT16x64x128_MI16x16x16x1_SE_1LDSB1_AF0EM8_EPS1_GRVW8_GSU1_GSUAMB_LBSPP256_LPA16_LPB16_LRVW8_PGR1_PLR9_SU0_SUS0_SRVW0_TT1_16_VAW2_WSGRA1_WSGRB1_WG16_16_1_WGM2
    SolutionIndex: 185
    SolutionNameMin: Cijk_Alik_Bljk_BBS_BH_MT128x128x32_MI32x32x8x1_SE_1LDSB1_AF0EM8_EPS1_GRVW8_GSU1_GSUAMB_LBSPP128_LPA8_LPB8_LRVW8_PGR1_PLR5_SU0_SUS0_SRVW4_TT2_64_VAW2_WSGRA1_WSGRB1_WG64_4_1_WGM1
    SolutionIndex: 186
    SolutionNameMin: Cijk_Alik_Bljk_BBS_BH_MT128x256x32_MI32x32x8x1_SE_1LDSB1_AF0EM8_EPS0_GRVW8_GSU1_GSUAMB_LBSPP128_LPA8_LPB8_LRVW8_PGR2_PLR5_SU32_SUS256_SRVW4_TT2_128_VAW2_WSGRA1_WSGRB1_WG64_4_1_WGM2
    SolutionIndex: 187
    SolutionNameMin: Cijk_Alik_Bljk_BBS_BH_MT128x64x64_MI32x32x8x1_SE_1LDSB1_AF0EM8_EPS0_GRVW8_GSU1_GSUAMB_LBSPP128_LPA8_LPB8_LRVW8_PGR2_PLR9_SU32_SUS256_SRVW4_TT2_32_VAW2_WSGRA1_WSGRB1_WG64_4_1_WGM15
    SolutionIndex: 188
    SolutionNameMin: Cijk_Alik_Bljk_BBS_BH_MT128x192x32_MI32x32x8x1_SE_1LDSB1_AF0EM1_EPS0_GRVW8_GSU1_GSUAMB_LBSPP128_LPA8_LPB8_LRVW8_PGR2_PLR5_SU32_SUS128_SRVW4_TT2_96_VAW2_WSGRA1_WSGRB1_WG64_4_1_WGM15
    SolutionIndex: 189
    SolutionNameMin: Cijk_Alik_Bljk_BBS_BH_MT32x32x64_MI16x16x16x1_SE_1LDSB0_AF0EM8_EPS0_GRVW4_GSU1_GSUAMB_LBSPP128_LPA16_LPB16_LRVW8_PGR2_PLR5_SU0_SUS0_SRVW4_TT1_16_VAW2_WSGRA1_WSGRB1_WG32_8_1_WGM2
    SolutionIndex: 190
    SolutionNameMin: Cijk_Alik_Bljk_BBS_BH_MT128x64x64_MI32x32x8x1_SE_1LDSB1_AF0EM8_EPS1_GRVW8_GSU1_GSUAMB_LBSPP128_LPA8_LPB8_LRVW8_PGR1_PLR9_SU0_SUS0_SRVW4_TT2_32_VAW2_WSGRA1_WSGRB1_WG64_4_1_WGM15
    SolutionIndex: 191
    SolutionNameMin: Cijk_Alik_Bljk_BBS_BH_MT16x16x128_MI16x16x16x1_SE_1LDSB1_AF0EM8_EPS1_GRVW8_GSU15_GSUAMB_LBSPP256_LPA16_LPB16_LRVW8_PGR1_PLR9_SU32_SUS256_SRVW4_TT1_16_VAW1_WSGRA1_WSGRB1_WG16_4_1_WGM15
    SolutionIndex: 192
    SolutionNameMin: Cijk_Alik_Bljk_BBS_BH_MT32x64x64_MI16x16x16x1_SE_1LDSB0_AF0EM8_EPS0_GRVW8_GSU1_GSUAMB_LBSPP128_LPA16_LPB16_LRVW8_PGR2_PLR5_SU32_SUS256_SRVW4_TT1_32_VAW2_WSGRA1_WSGRB1_WG32_8_1_WGM1
    SolutionIndex: 193
    SolutionNameMin: Cijk_Alik_Bljk_BBS_BH_MT128x160x32_MI32x32x8x1_SE_1LDSB1_AF0EM8_EPS0_GRVW2_GSU1_GSUAMB_LBSPP128_LPA8_LPB8_LRVW8_PGR2_PLR5_SU0_SUS0_SRVW4_TT1_160_VAW2_WSGRA1_WSGRB1_WG128_2_1_WGM15
    SolutionIndex: 194
    SolutionNameMin: Cijk_Alik_Bljk_BBS_BH_MT16x16x128_MI16x16x16x1_SE_1LDSB0_AF0EM8_EPS1_GRVW8_GSU5_GSUAMB_LBSPP256_LPA16_LPB16_LRVW8_PGR1_PLR9_SU32_SUS256_SRVW0_TT1_16_VAW1_WSGRA1_WSGRB1_WG16_4_1_WGM1
    SolutionIndex: 195
    SolutionNameMin: Cijk_Alik_Bljk_BBS_BH_MT32x32x64_MI16x16x16x1_SE_1LDSB0_AF0EM1_EPS1_GRVW8_GSU1_GSUAMB_LBSPP128_LPA16_LPB16_LRVW8_PGR1_PLR5_SU0_SUS0_SRVW4_TT1_16_VAW2_WSGRA1_WSGRB1_WG32_8_1_WGM1
    SolutionIndex: 196
    SolutionNameMin: Cijk_Alik_Bljk_BBS_BH_MT64x4x64_MI4x4x4x16_SE_1LDSB0_AF0EM1_EPS1_GRVW8_GSU1_GSUAMB_LBSPP128_LPA8_LPB8_LRVW8_PGR1_PLR17_SU0_SUS0_SRVW0_TT1_4_VAW2_WSGRA1_WSGRB1_WG64_1_1_WGM15
    SolutionIndex: 197
    SolutionNameMin: Cijk_Alik_Bljk_BBS_BH_MT128x96x64_MI32x32x8x1_SE_1LDSB0_AF0EM8_EPS0_GRVW4_GSU15_GSUAMB_LBSPP128_LPA8_LPB8_LRVW8_PGR2_PLR9_SU0_SUS0_SRVW4_TT1_96_VAW1_WSGRA1_WSGRB1_WG128_2_1_WGM2
    SolutionIndex: 198
    SolutionNameMin: Cijk_Alik_Bljk_BBS_BH_MT128x96x64_MI32x32x8x1_SE_1LDSB0_AF0EM8_EPS0_GRVW4_GSU15_GSUAMB_LBSPP128_LPA8_LPB8_LRVW8_PGR2_PLR9_SU0_SUS0_SRVW4_TT1_96_VAW1_WSGRA1_WSGRB1_WG128_2_1_WGM1
    SolutionIndex: 199
    SolutionNameMin: Cijk_Alik_Bljk_BBS_BH_MT128x96x64_MI32x32x8x1_SE_1LDSB0_AF0EM8_EPS0_GRVW8_GSU15_GSUAMB_LBSPP128_LPA8_LPB8_LRVW8_PGR2_PLR9_SU0_SUS0_SRVW4_TT1_96_VAW1_WSGRA1_WSGRB1_WG128_2_1_WGM2
    SolutionIndex: 200
    SolutionNameMin: Cijk_Alik_Bljk_BBS_BH_MT128x96x64_MI32x32x8x1_SE_1LDSB1_AF0EM8_EPS0_GRVW8_GSU15_GSUAMB_LBSPP128_LPA8_LPB8_LRVW8_PGR2_PLR9_SU32_SUS128_SRVW4_TT1_96_VAW1_WSGRA1_WSGRB1_WG128_2_1_WGM1
    SolutionIndex: 201
    SolutionNameMin: Cijk_Alik_Bljk_BBS_BH_MT32x32x64_MI16x16x16x1_SE_1LDSB0_AF0EM8_EPS0_GRVW8_GSU7_GSUAMB_LBSPP128_LPA16_LPB16_LRVW8_PGR2_PLR5_SU32_SUS256_SRVW4_TT1_16_VAW1_WSGRA1_WSGRB1_WG32_8_1_WGM1
    SolutionIndex: 202
    SolutionNameMin: Cijk_Alik_Bljk_BBS_BH_MT16x16x128_MI16x16x16x1_SE_1LDSB1_AF0EM1_EPS1_GRVW8_GSU7_GSUAMB_LBSPP256_LPA16_LPB16_LRVW8_PGR1_PLR9_SU32_SUS256_SRVW0_TT1_16_VAW1_WSGRA1_WSGRB1_WG16_4_1_WGM2
    SolutionIndex: 203
    SolutionNameMin: Cijk_Alik_Bljk_BBS_BH_MT16x64x64_MI16x16x16x1_SE_1LDSB0_AF0EM8_EPS0_GRVW8_GSU1_GSUAMB_LBSPP128_LPA16_LPB16_LRVW8_PGR2_PLR5_SU0_SUS0_SRVW0_TT1_16_VAW2_WSGRA1_WSGRB1_WG16_16_1_WGM1
    SolutionIndex: 204
    SolutionNameMin: Cijk_Alik_Bljk_BBS_BH_MT64x64x64_MI32x32x8x1_SE_1LDSB0_AF0EM8_EPS0_GRVW8_GSU1_GSUAMB_LBSPP128_LPA8_LPB8_LRVW8_PGR2_PLR9_SU32_SUS128_SRVW4_TT1_32_VAW2_WSGRA1_WSGRB1_WG64_4_1_WGM2
    SolutionIndex: 205
    SolutionNameMin: Cijk_Alik_Bljk_BBS_BH_MT64x32x64_MI16x16x16x1_SE_1LDSB0_AF0EM8_EPS0_GRVW4_GSU1_GSUAMB_LBSPP128_LPA16_LPB16_LRVW8_PGR2_PLR5_SU0_SUS0_SRVW4_TT2_16_VAW2_WSGRA1_WSGRB1_WG32_8_1_WGM15
    SolutionIndex: 206
    SolutionNameMin: Cijk_Alik_Bljk_BBS_BH_MT64x64x32_MI32x32x8x1_SE_1LDSB1_AF0EM1_EPS1_GRVW2_GSU1_GSUAMB_LBSPP128_LPA8_LPB8_LRVW8_PGR1_PLR5_SU32_SUS256_SRVW4_TT1_32_VAW2_WSGRA1_WSGRB1_WG64_4_1_WGM15
    SolutionIndex: 207
    SolutionNameMin: Cijk_Alik_Bljk_BBS_BH_MT128x64x32_MI32x32x8x1_SE_1LDSB0_AF0EM8_EPS0_GRVW2_GSU1_GSUAMB_LBSPP128_LPA8_LPB8_LRVW8_PGR2_PLR5_SU0_SUS0_SRVW4_TT2_32_VAW2_WSGRA1_WSGRB1_WG64_4_1_WGM1
    SolutionIndex: 208
    SolutionNameMin: Cijk_Alik_Bljk_BBS_BH_MT64x64x32_MI32x32x8x1_SE_1LDSB1_AF0EM8_EPS0_GRVW8_GSU1_GSUAMB_LBSPP128_LPA8_LPB8_LRVW8_PGR2_PLR5_SU0_SUS0_SRVW4_TT1_32_VAW2_WSGRA1_WSGRB1_WG64_4_1_WGM15
    SolutionIndex: 209
    SolutionNameMin: Cijk_Alik_Bljk_BBS_BH_MT64x64x32_MI32x32x8x1_SE_1LDSB1_AF0EM8_EPS1_GRVW8_GSU1_GSUAMB_LBSPP128_LPA8_LPB8_LRVW8_PGR1_PLR5_SU32_SUS128_SRVW4_TT1_32_VAW2_WSGRA1_WSGRB1_WG64_4_1_WGM1
    SolutionIndex: 210
    SolutionNameMin: Cijk_Alik_Bljk_BBS_BH_MT128x128x32_MI32x32x8x1_SE_1LDSB1_AF0EM8_EPS1_GRVW8_GSU1_GSUAMB_LBSPP128_LPA8_LPB8_LRVW8_PGR1_PLR5_SU0_SUS0_SRVW4_TT2_64_VAW2_WSGRA1_WSGRB1_WG64_4_1_WGM2
    SolutionIndex: 211
    SolutionNameMin: Cijk_Alik_Bljk_BBS_BH_MT128x128x32_MI32x32x8x1_SE_1LDSB1_AF0EM1_EPS1_GRVW8_GSU1_GSUAMB_LBSPP128_LPA8_LPB8_LRVW8_PGR1_PLR5_SU0_SUS0_SRVW4_TT2_64_VAW2_WSGRA1_WSGRB1_WG64_4_1_WGM15
    SolutionIndex: 212
    SolutionNameMin: Cijk_Alik_Bljk_BBS_BH_MT128x256x32_MI32x32x8x1_SE_1LDSB1_AF0EM8_EPS1_GRVW4_GSU1_GSUAMB_LBSPP128_LPA8_LPB8_LRVW8_PGR1_PLR5_SU0_SUS0_SRVW4_TT2_128_VAW2_WSGRA1_WSGRB1_WG64_4_1_WGM1
    SolutionIndex: 213
    SolutionNameMin: Cijk_Alik_Bljk_BBS_BH_MT128x128x32_MI32x32x8x1_SE_1LDSB1_AF0EM8_EPS0_GRVW2_GSU1_GSUAMB_LBSPP128_LPA8_LPB8_LRVW8_PGR2_PLR5_SU0_SUS0_SRVW4_TT2_64_VAW2_WSGRA1_WSGRB1_WG64_4_1_WGM15
    SolutionIndex: 214
    SolutionNameMin: Cijk_Alik_Bljk_BBS_BH_MT128x128x32_MI32x32x8x1_SE_1LDSB1_AF0EM8_EPS0_GRVW2_GSU1_GSUAMB_LBSPP128_LPA8_LPB8_LRVW8_PGR2_PLR5_SU32_SUS256_SRVW4_TT2_64_VAW2_WSGRA1_WSGRB1_WG64_4_1_WGM1
    SolutionIndex: 215
    SolutionNameMin: Cijk_Alik_Bljk_BBS_BH_MT256x128x32_MI32x32x8x1_SE_1LDSB1_AF0EM8_EPS0_GRVW8_GSU1_GSUAMB_LBSPP128_LPA8_LPB8_LRVW8_PGR2_PLR5_SU0_SUS0_SRVW4_TT4_64_VAW2_WSGRA1_WSGRB1_WG64_4_1_WGM15
    SolutionIndex: 216
    SolutionNameMin: Cijk_Alik_Bljk_BBS_BH_MT128x256x32_MI32x32x8x1_SE_1LDSB1_AF0EM8_EPS0_GRVW4_GSU1_GSUAMB_LBSPP128_LPA8_LPB8_LRVW8_PGR2_PLR5_SU0_SUS0_SRVW4_TT2_128_VAW2_WSGRA1_WSGRB1_WG64_4_1_WGM2
    SolutionIndex: 217
    SolutionNameMin: Cijk_Alik_Bljk_BBS_BH_MT256x128x32_MI32x32x8x1_SE_1LDSB0_AF0EM8_EPS0_GRVW8_GSU1_GSUAMB_LBSPP128_LPA8_LPB8_LRVW8_PGR2_PLR5_SU32_SUS128_SRVW4_TT4_64_VAW2_WSGRA1_WSGRB1_WG64_4_1_WGM15
    SolutionIndex: 218
    SolutionNameMin: Cijk_Alik_Bljk_BBS_BH_MT128x128x32_MI32x32x8x1_SE_1LDSB1_AF0EM8_EPS0_GRVW2_GSU1_GSUAMB_LBSPP128_LPA8_LPB8_LRVW8_PGR2_PLR5_SU0_SUS0_SRVW4_TT2_64_VAW2_WSGRA1_WSGRB1_WG64_4_1_WGM2
    SolutionIndex: 219
    SolutionNameMin: Cijk_Alik_Bljk_BBS_BH_MT128x128x32_MI32x32x8x1_SE_1LDSB1_AF0EM1_EPS1_GRVW2_GSU1_GSUAMB_LBSPP128_LPA8_LPB8_LRVW8_PGR1_PLR5_SU0_SUS0_SRVW4_TT2_64_VAW2_WSGRA1_WSGRB1_WG64_4_1_WGM15
    SolutionIndex: 220
    SolutionNameMin: Cijk_Alik_Bljk_BBS_BH_MT128x128x32_MI32x32x8x1_SE_1LDSB1_AF0EM8_EPS0_GRVW4_GSU1_GSUAMB_LBSPP128_LPA8_LPB8_LRVW8_PGR2_PLR5_SU32_SUS256_SRVW4_TT2_64_VAW2_WSGRA1_WSGRB1_WG64_4_1_WGM1
    SolutionIndex: 221
    SolutionNameMin: Cijk_Alik_Bljk_BBS_BH_MT128x64x32_MI32x32x8x1_SE_1LDSB1_AF0EM8_EPS1_GRVW2_GSU1_GSUAMB_LBSPP128_LPA8_LPB8_LRVW8_PGR1_PLR5_SU32_SUS256_SRVW4_TT2_32_VAW2_WSGRA1_WSGRB1_WG64_4_1_WGM1
    SolutionIndex: 222
    SolutionNameMin: Cijk_Alik_Bljk_BBS_BH_MT128x128x32_MI32x32x8x1_SE_1LDSB1_AF0EM1_EPS0_GRVW8_GSU1_GSUAMB_LBSPP128_LPA8_LPB8_LRVW8_PGR2_PLR5_SU0_SUS0_SRVW4_TT2_64_VAW2_WSGRA1_WSGRB1_WG64_4_1_WGM15
    SolutionIndex: 223
    SolutionNameMin: Cijk_Alik_Bljk_BBS_BH_MT64x128x32_MI32x32x8x1_SE_1LDSB1_AF0EM1_EPS1_GRVW2_GSU1_GSUAMB_LBSPP128_LPA8_LPB8_LRVW8_PGR1_PLR5_SU32_SUS128_SRVW4_TT1_64_VAW2_WSGRA1_WSGRB1_WG64_4_1_WGM15
    SolutionIndex: 224
    SolutionNameMin: Cijk_Alik_Bljk_BBS_BH_MT128x256x32_MI32x32x8x1_SE_1LDSB1_AF0EM1_EPS1_GRVW8_GSU1_GSUAMB_LBSPP128_LPA8_LPB8_LRVW8_PGR1_PLR5_SU0_SUS0_SRVW4_TT2_128_VAW2_WSGRA1_WSGRB1_WG64_4_1_WGM1
    SolutionIndex: 225
    SolutionNameMin: Cijk_Alik_Bljk_BBS_BH_MT64x64x32_MI32x32x8x1_SE_1LDSB1_AF0EM1_EPS0_GRVW4_GSU1_GSUAMB_LBSPP128_LPA8_LPB8_LRVW8_PGR2_PLR5_SU32_SUS128_SRVW4_TT1_32_VAW2_WSGRA1_WSGRB1_WG64_4_1_WGM15
    SolutionIndex: 226
    SolutionNameMin: Cijk_Alik_Bljk_BBS_BH_MT64x64x32_MI32x32x8x1_SE_1LDSB1_AF0EM1_EPS0_GRVW2_GSU1_GSUAMB_LBSPP128_LPA8_LPB8_LRVW8_PGR2_PLR5_SU32_SUS128_SRVW4_TT1_32_VAW2_WSGRA1_WSGRB1_WG64_4_1_WGM15
    SolutionIndex: 227
    SolutionNameMin: Cijk_Alik_Bljk_BBS_BH_MT64x128x32_MI32x32x8x1_SE_1LDSB1_AF0EM1_EPS1_GRVW2_GSU1_GSUAMB_LBSPP128_LPA8_LPB8_LRVW8_PGR1_PLR5_SU32_SUS256_SRVW4_TT1_64_VAW2_WSGRA1_WSGRB1_WG64_4_1_WGM2
    SolutionIndex: 228
    SolutionNameMin: Cijk_Alik_Bljk_BBS_BH_MT64x128x32_MI32x32x8x1_SE_1LDSB1_AF0EM1_EPS0_GRVW8_GSU1_GSUAMB_LBSPP128_LPA8_LPB8_LRVW8_PGR2_PLR5_SU0_SUS0_SRVW4_TT1_64_VAW2_WSGRA1_WSGRB1_WG64_4_1_WGM2
    SolutionIndex: 229
    SolutionNameMin: Cijk_Alik_Bljk_BBS_BH_MT128x256x32_MI32x32x8x1_SE_1LDSB1_AF0EM1_EPS1_GRVW2_GSU1_GSUAMB_LBSPP128_LPA8_LPB8_LRVW8_PGR1_PLR5_SU0_SUS0_SRVW4_TT2_128_VAW2_WSGRA1_WSGRB1_WG64_4_1_WGM15
    SolutionIndex: 230
    SolutionNameMin: Cijk_Alik_Bljk_BBS_BH_MT128x96x64_MI32x32x8x1_SN_AMAS0_LPA8_LPB8_MIAV0_NTC3_NTD0_NEPBS0_PLR9_SU0_SUS0_SPO1_SSO0_SVW1_TT1_96_VW1_WG128_2_1_WGM8
    SolutionIndex: 231
    SolutionNameMin: Cijk_Alik_Bljk_BBS_BH_MT160x256x64_MI32x32x8x1_SN_AMAS0_LPA8_LPB8_MIAV0_NTC0_NTD3_NEPBS0_PLR9_SU0_SUS0_SPO0_SSO0_SVW1_TT5_64_VW1_WG32_8_1_WGM8
    SolutionIndex: 232
    SolutionNameMin: Cijk_Alik_Bljk_BBS_BH_MT128x64x64_MI16x16x16x1_SN_AMAS3_LPA16_LPB16_MIAV1_NTC3_NTD0_NEPBS0_PLR5_SU32_SUS256_SPO1_SSO4_SVW2_TT2_64_VW2_WG64_4_1_WGM8
    SolutionIndex: 233
    SolutionNameMin: Cijk_Alik_Bljk_BBS_BH_MT128x256x64_MI32x32x8x1_SN_AMAS0_GRVW8_LPA8_LPB8_LRVW8_MIAV0_NTC0_NTD0_NEPBS0_PLR9_SU0_SUS0_SVW1_TT2_128_VW1_WG64_4_1_WGM8
    SolutionIndex: 234
    SolutionNameMin: Cijk_Alik_Bljk_BBS_BH_MT256x256x32_MI32x32x8x1_SN_AMAS3_GRVW8_LPA8_LPB8_LRVW8_MIAV0_NTC3_NTD3_NEPBS0_PLR5_SU32_SUS256_SVW2_TT4_128_VW2_WG64_4_1_WGM1
    SolutionIndex: 235
    SolutionNameMin: Cijk_Alik_Bljk_BBS_BH_MT128x128x64_MI16x16x16x1_SN_AMAS0_GRVW8_LPA16_LPB16_LRVW8_MIAV1_NTC3_NTD3_NEPBS8_PLR5_SU0_SUS0_SVW1_TT4_64_VW1_WG32_8_1_WGM15
    SolutionIndex: 236
    SolutionNameMin: Cijk_Alik_Bljk_BBS_BH_MT128x64x64_MI32x32x8x1_SN_AMAS0_GRVW8_LPA8_LPB8_LRVW8_MIAV0_NTC3_NTD3_NEPBS0_PLR9_SU32_SUS256_SVW1_TT1_64_VW1_WG128_2_1_WGM3
    SolutionIndex: 237
    SolutionNameMin: Cijk_Alik_Bljk_BBS_BH_MT128x256x64_MI32x32x8x1_SN_AMAS0_NTC0_NEPBS0_SU0_SUS0_SPO1_SSO0_SVW1_TT2_128_VW1_WGM8
    SolutionIndex: 238
    SolutionNameMin: Cijk_Alik_Bljk_BBS_BH_MT128x128x64_MI32x32x8x1_SN_AMAS0_NTC3_NEPBS16_SU0_SUS0_SPO0_SSO4_SVW1_TT2_64_VW1_WGM8
    SolutionIndex: 239
    SolutionNameMin: Cijk_Alik_Bljk_BBS_BH_MT128x256x64_MI32x32x8x1_SN_AMAS0_NTC0_NEPBS0_SU0_SUS0_SPO0_SSO0_SVW1_TT2_128_VW1_WGM8
    SolutionIndex: 240
    SolutionNameMin: Cijk_Alik_Bljk_BBS_BH_MT128x128x64_MI32x32x8x1_SN_AMAS0_NTC3_NEPBS0_SU32_SUS128_SPO1_SSO4_SVW1_TT2_64_VW1_WGM12
- - - [1024, 512, 1, 1025]
    - [4, 16.364]
  - - [8192, 8193, 1, 8192]
    - [5, 80.06]
  - - [8192, 8192, 1, 8193]
    - [6, 74.403]
  - - [4096, 4096, 1, 4097]
    - [6, 64.925]
  - - [1025, 1024, 1, 1024]
    - [7, 31.867]
  - - [8192, 8191, 1, 8192]
    - [5, 93.807]
  - - [2048, 513, 1, 2048]
    - [71, 41.206]
  - - [1024, 1024, 1, 1025]
    - [10, 25.019]
  - - [3072, 511, 1, 3072]
    - [4, 58.109]
  - - [2049, 512, 1, 2048]
    - [7, 38.181]
  - - [4096, 4095, 1, 4096]
    - [5, 76.066]
  - - [513, 512, 1, 512]
    - [11, 8.512]
  - - [1024, 511, 1, 1024]
    - [12, 23.219]
  - - [1023, 512, 1, 1024]
    - [13, 22.054]
  - - [1024, 513, 1, 1024]
    - [12, 23.4]
  - - [4096, 4097, 1, 4096]
    - [5, 76.095]
  - - [2048, 2047, 1, 2048]
    - [14, 62.854]
  - - [8193, 8192, 1, 8192]
    - [15, 78.647]
  - - [1024, 1023, 1, 1024]
    - [16, 33.758]
  - - [4096, 4096, 1, 4095]
    - [6, 64.514]
  - - [1025, 512, 1, 1024]
    - [13, 22.342]
  - - [1024, 512, 1, 1023]
    - [17, 15.696]
  - - [512, 512, 1, 513]
    - [18, 7.147]
  - - [1024, 1025, 1, 1024]
    - [16, 34.111]
  - - [512, 512, 1, 511]
    - [18, 7.086]
  - - [2047, 2048, 1, 2048]
    - [19, 54.681]
  - - [2049, 2048, 1, 2048]
    - [15, 59.244]
  - - [2048, 511, 1, 2048]
    - [38, 40.4]
  - - [2048, 2049, 1, 2048]
    - [23, 63.959]
  - - [2048, 512, 1, 2047]
    - [27, 33.462]
  - - [2047, 512, 1, 2048]
    - [7, 37.845]
  - - [3072, 513, 1, 3072]
    - [4, 58.212]
  - - [512, 511, 1, 512]
    - [21, 9.864]
  - - [4097, 4096, 1, 4096]
    - [15, 73.489]
  - - [2048, 2048, 1, 2047]
    - [23, 57.358]
  - - [2048, 2048, 1, 2049]
    - [23, 49.808]
  - - [8191, 8192, 1, 8192]
    - [15, 78.953]
  - - [512, 513, 1, 512]
    - [172, 5.195]
  - - [8192, 8192, 1, 8191]
    - [24, 74.384]
  - - [1024, 1024, 1, 1023]
    - [25, 24.514]
  - - [511, 512, 1, 512]
    - [26, 8.114]
  - - [4095, 4096, 1, 4096]
    - [15, 73.578]
  - - [2048, 512, 1, 2049]
    - [27, 34.531]
  - - [1023, 1024, 1, 1024]
    - [7, 29.841]
  - - [512, 512, 1, 512]
    - [21, 10.287]
  - - [1024, 1024, 1, 1024]
    - [57, 32.962]
  - - [2048, 2048, 1, 2048]
    - [28, 63.839]
  - - [4096, 4096, 1, 4096]
    - [5, 76.144]
  - - [8192, 8192, 1, 8192]
    - [29, 80.508]
  - - [479, 1024, 1, 1024]
    - [13, 20.959]
  - - [479, 2048, 1, 2048]
    - [7, 36.627]
  - - [480, 1023, 1, 1024]
    - [12, 21.958]
  - - [480, 1024, 1, 1023]
    - [30, 14.563]
  - - [480, 1024, 1, 1025]
    - [31, 15.137]
  - - [480, 1025, 1, 1024]
    - [12, 21.665]
  - - [480, 2047, 1, 2048]
    - [38, 38.522]
  - - [480, 2048, 1, 2047]
    - [32, 34.195]
  - - [480, 2048, 1, 2049]
    - [32, 34.647]
  - - [480, 2049, 1, 2048]
    - [32, 37.717]
  - - [481, 1024, 1, 1024]
    - [13, 21.203]
  - - [481, 2048, 1, 2048]
    - [7, 36.661]
  - - [511, 480, 1, 512]
    - [33, 7.648]
  - - [512, 479, 1, 512]
    - [21, 9.431]
  - - [512, 480, 1, 511]
    - [34, 6.835]
  - - [512, 480, 1, 513]
    - [35, 6.796]
  - - [512, 481, 1, 512]
    - [21, 9.225]
  - - [513, 480, 1, 512]
    - [128, 4.803]
  - - [1023, 480, 1, 1024]
    - [13, 21.06]
  - - [1024, 479, 1, 1024]
    - [36, 21.599]
  - - [1024, 480, 1, 1023]
    - [17, 14.676]
  - - [1024, 480, 1, 1025]
    - [4, 15.467]
  - - [1024, 481, 1, 1024]
    - [12, 22.197]
  - - [1025, 480, 1, 1024]
    - [11, 14.752]
  - - [2047, 480, 1, 2048]
    - [7, 34.772]
  - - [2048, 479, 1, 2048]
    - [71, 38.713]
  - - [2048, 480, 1, 2047]
    - [5, 33.788]
  - - [2048, 480, 1, 2049]
    - [10, 34.074]
  - - [2048, 481, 1, 2048]
    - [20, 39.947]
  - - [2049, 480, 1, 2048]
    - [7, 35.908]
  - - [480, 1024, 1, 1024]
    - [12, 21.81]
  - - [480, 2048, 1, 2048]
    - [32, 42.717]
  - - [512, 480, 1, 512]
    - [21, 9.515]
  - - [1024, 480, 1, 1024]
    - [37, 21.561]
  - - [2048, 480, 1, 2048]
    - [71, 38.893]
  - - [480, 3072, 1, 3072]
    - [4, 55.96]
  - - [480, 4096, 1, 4096]
    - [22, 58.877]
  - - [480, 8192, 1, 8192]
    - [98, 81.1]
  - - [3072, 480, 1, 3072]
    - [4, 55.534]
  - - [4096, 480, 1, 4096]
    - [22, 59.379]
  - - [8192, 480, 1, 8192]
    - [22, 80.59]
  - - [17, 17, 1, 64]
    - [54, 0.001]
  - - [24, 24, 1, 64]
    - [165, 0.002]
  - - [30, 31, 1, 64]
    - [39, 0.007]
  - - [32, 32, 1, 64]
    - [54, 0.009]
  - - [32, 35, 1, 64]
    - [40, 0.008]
  - - [31, 31, 1, 64]
    - [129, 0.007]
  - - [34, 34, 1, 64]
    - [42, 0.009]
  - - [30, 30, 1, 64]
    - [39, 0.007]
  - - [17, 15, 1, 64]
    - [39, 0.002]
  - - [35, 35, 1, 64]
    - [39, 0.01]
  - - [21, 17, 1, 64]
    - [41, 0.003]
  - - [21, 21, 1, 64]
    - [195, 0.003]
  - - [15, 14, 1, 64]
    - [39, 0.001]
  - - [14, 14, 1, 64]
    - [39, 0.001]
  - - [15, 15, 1, 64]
    - [39, 0.002]
  - - [34, 24, 1, 64]
    - [196, 0.007]
  - - [2, 4, 1, 1024]
    - [43, 0.001]
  - - [2, 32, 1, 1024]
    - [44, 0.005]
  - - [2, 2048, 1, 1024]
    - [85, 0.189]
  - - [64, 128, 512, 128]
    - [70, 12.212]
  - - [64, 512, 1, 512]
    - [46, 1.673]
  - - [64, 512, 64, 512]
    - [147, 26.764]
  - - [128, 128, 512, 64]
    - [116, 10.872]
  - - [512, 512, 1, 64]
    - [33, 1.703]
  - - [512, 512, 64, 64]
    - [97, 15.288]
  - - [1024, 4, 1, 1024]
    - [3, 0.734]
  - - [1024, 4, 1, 1024]
    - [87, 0.187]
  - - [1024, 32, 1, 1024]
    - [46, 2.821]
  - - [1024, 2048, 1, 1024]
    - [28, 42.481]
  - - [1024, 2048, 1, 4096]
    - [50, 61.84]
  - - [1024, 4096, 1, 1024]
    - [51, 55.877]
  - - [1024, 4096, 1, 4096]
    - [4, 69.276]
  - - [4096, 2048, 1, 1024]
    - [5, 59.851]
  - - [4096, 4096, 1, 1024]
    - [5, 66.538]
  - - [30528, 2048, 1, 1024]
    - [5, 69.685]
  - - [30528, 4096, 1, 1024]
    - [5, 72.08]
  - - [3, 3, 512, 64]
    - [165, 0.014]
  - - [5, 5, 512, 64]
    - [69, 0.037]
  - - [5, 5, 960, 64]
    - [132, 0.069]
  - - [9, 9, 512, 64]
    - [41, 0.124]
  - - [27, 27, 32768, 128]
    - [52, 7.049]
  - - [32, 1600, 1, 512]
    - [53, 2.482]
  - - [33, 33, 1600, 32]
    - [39, 1.554]
  - - [64, 512, 1, 1024]
    - [44, 2.864]
  - - [64, 960, 1, 1024]
    - [55, 5.212]
  - - [128, 32768, 1, 256]
    - [51, 27.185]
  - - [256, 684, 1, 1024]
    - [21, 11.223]
  - - [256, 1280, 1, 1024]
    - [21, 19.793]
  - - [256, 1536, 1, 1024]
    - [21, 22.683]
  - - [256, 2304, 1, 1024]
    - [12, 25.297]
  - - [256, 2560, 1, 1024]
    - [31, 27.594]
  - - [256, 2816, 1, 1024]
    - [4, 30.577]
  - - [256, 3328, 1, 1024]
    - [56, 35.23]
  - - [256, 3584, 1, 1024]
    - [57, 31.133]
  - - [256, 4608, 1, 1024]
    - [16, 36.982]
  - - [256, 4864, 1, 1024]
    - [58, 38.826]
  - - [256, 5376, 1, 1024]
    - [4, 40.299]
  - - [256, 5888, 1, 1024]
    - [4, 43.475]
  - - [256, 6144, 1, 1024]
    - [4, 45.028]
  - - [256, 6400, 1, 1024]
    - [4, 46.102]
  - - [256, 6656, 1, 1024]
    - [123, 39.267]
  - - [256, 7168, 1, 1024]
    - [16, 39.204]
  - - [256, 7424, 1, 1024]
    - [16, 40.455]
  - - [256, 7936, 1, 1024]
    - [4, 40.431]
  - - [256, 8192, 1, 1024]
    - [4, 43.128]
  - - [256, 8448, 1, 1024]
    - [4, 43.928]
  - - [256, 8960, 1, 1024]
    - [51, 46.755]
  - - [256, 9984, 1, 1024]
    - [188, 44.498]
  - - [256, 10496, 1, 1024]
    - [4, 52.631]
  - - [256, 11264, 1, 1024]
    - [4, 46.529]
  - - [256, 11520, 1, 1024]
    - [51, 47.989]
  - - [256, 11776, 1, 1024]
    - [51, 48.575]
  - - [256, 12544, 1, 1024]
    - [51, 49.27]
  - - [256, 13312, 1, 1024]
    - [29, 50.803]
  - - [256, 14336, 1, 1024]
    - [9, 52.08]
  - - [256, 14592, 1, 1024]
    - [20, 54.971]
  - - [256, 14848, 1, 1024]
    - [28, 52.385]
  - - [256, 15104, 1, 1024]
    - [28, 51.499]
  - - [256, 16128, 1, 1024]
    - [28, 52.867]
  - - [256, 18176, 1, 1024]
    - [20, 51.568]
  - - [256, 18944, 1, 1024]
    - [9, 53.286]
  - - [256, 19200, 1, 1024]
    - [20, 55.979]
  - - [256, 20480, 1, 1024]
    - [20, 57.009]
  - - [256, 20992, 1, 1024]
    - [28, 56.696]
  - - [256, 21248, 1, 1024]
    - [28, 51.565]
  - - [256, 21504, 1, 1024]
    - [20, 52.272]
  - - [256, 22016, 1, 1024]
    - [51, 52.822]
  - - [256, 22344, 1, 1024]
    - [4, 53.048]
  - - [256, 23296, 1, 1024]
    - [28, 55.532]
  - - [256, 23552, 1, 1024]
    - [28, 56.415]
  - - [256, 31488, 1, 1024]
    - [20, 62.499]
  - - [256, 32768, 1, 512]
    - [4, 46.844]
  - - [256, 33536, 1, 1024]
    - [20, 57.72]
  - - [256, 44505, 1, 1024]
    - [20, 60.24]
  - - [512, 1600, 1, 512]
    - [16, 23.278]
  - - [512, 32768, 1, 13]
    - [59, 2.821]
  - - [512, 32768, 1, 1024]
    - [5, 64.434]
  - - [684, 8976, 1, 256]
    - [7, 29.862]
  - - [1024, 200, 1, 560]
    - [35, 4.295]
  - - [1024, 512, 1, 1024]
    - [36, 20.857]
  - - [1024, 512, 1, 1600]
    - [4, 28.213]
  - - [1024, 960, 1, 1024]
    - [30, 27.312]
  - - [1024, 960, 1, 1600]
    - [57, 35.92]
  - - [1024, 1600, 1, 560]
    - [91, 22.209]
  - - [1024, 1600, 1, 1024]
    - [4, 46.788]
  - - [1024, 32768, 1, 480]
    - [62, 57.334]
  - - [1024, 32768, 1, 1024]
    - [5, 70.104]
  - - [1280, 8976, 1, 256]
    - [63, 37.36]
  - - [1792, 8976, 1, 256]
    - [20, 41.422]
  - - [2048, 114, 1, 512]
    - [21, 9.1]
  - - [2048, 114, 1, 768]
    - [21, 11.61]
  - - [2048, 215, 1, 512]
    - [12, 14.35]
  - - [2048, 215, 1, 768]
    - [12, 17.804]
  - - [2048, 256, 1, 512]
    - [12, 16.436]
  - - [2048, 256, 1, 768]
    - [12, 20.434]
  - - [2048, 512, 1, 67]
    - [170, 2.565]
  - - [2048, 512, 1, 74]
    - [18, 2.846]
  - - [2048, 512, 1, 100]
    - [64, 5.997]
  - - [2048, 512, 1, 2048]
    - [71, 41.675]
  - - [2048, 684, 1, 512]
    - [4, 29.491]
  - - [2048, 684, 1, 768]
    - [14, 28.546]
  - - [2048, 960, 1, 74]
    - [65, 7.005]
  - - [2048, 960, 1, 2048]
    - [20, 51.087]
  - - [2048, 1536, 1, 512]
    - [4, 39.707]
  - - [2048, 1536, 1, 768]
    - [4, 46.849]
  - - [2048, 8976, 1, 256]
    - [66, 41.914]
  - - [2304, 8976, 1, 256]
    - [63, 43.192]
  - - [2560, 8976, 1, 256]
    - [66, 43.574]
  - - [2816, 8976, 1, 256]
    - [66, 43.918]
  - - [3072, 8976, 1, 256]
    - [63, 44.406]
  - - [3328, 8976, 1, 256]
    - [63, 45.015]
  - - [3840, 8976, 1, 256]
    - [66, 45.54]
  - - [4096, 8976, 1, 256]
    - [63, 45.124]
  - - [4352, 8976, 1, 256]
    - [66, 45.912]
  - - [4608, 8976, 1, 256]
    - [66, 45.972]
  - - [4864, 8976, 1, 256]
    - [63, 45.526]
  - - [5120, 8976, 1, 256]
    - [63, 45.881]
  - - [5376, 8976, 1, 256]
    - [67, 45.439]
  - - [5632, 8976, 1, 256]
    - [66, 45.38]
  - - [5888, 8976, 1, 256]
    - [10, 45.462]
  - - [6144, 8976, 1, 256]
    - [66, 45.826]
  - - [6400, 8976, 1, 256]
    - [20, 45.159]
  - - [7168, 8976, 1, 256]
    - [9, 45.118]
  - - [7936, 8976, 1, 256]
    - [9, 44.781]
  - - [8192, 8976, 1, 256]
    - [68, 45.249]
  - - [8448, 8976, 1, 256]
    - [38, 44.698]
  - - [8960, 8976, 1, 256]
    - [38, 44.54]
  - - [9472, 8976, 1, 256]
    - [38, 45.11]
  - - [9728, 8976, 1, 256]
    - [38, 44.853]
  - - [9984, 8976, 1, 256]
    - [8, 45.062]
  - - [10240, 8976, 1, 256]
    - [38, 45.527]
  - - [10496, 8976, 1, 256]
    - [8, 45.198]
  - - [11264, 8976, 1, 256]
    - [8, 45.557]
  - - [11776, 8976, 1, 256]
    - [8, 45.817]
  - - [12544, 8976, 1, 256]
    - [8, 45.675]
  - - [13312, 8976, 1, 256]
    - [8, 46.167]
  - - [13568, 8976, 1, 256]
    - [8, 45.26]
  - - [13824, 8976, 1, 256]
    - [8, 46.191]
  - - [15104, 8976, 1, 256]
    - [8, 46.144]
  - - [15360, 8976, 1, 256]
    - [8, 47.171]
  - - [15872, 8976, 1, 256]
    - [38, 45.723]
  - - [16128, 8976, 1, 256]
    - [8, 46.352]
  - - [17152, 8976, 1, 256]
    - [8, 46.707]
  - - [18176, 8976, 1, 256]
    - [8, 46.42]
  - - [18688, 8976, 1, 256]
    - [8, 46.156]
  - - [18944, 8976, 1, 256]
    - [8, 46.923]
  - - [19712, 8976, 1, 256]
    - [8, 46.643]
  - - [19968, 8976, 1, 256]
    - [8, 46.397]
  - - [20480, 8976, 1, 256]
    - [8, 47.586]
  - - [20992, 8976, 1, 256]
    - [8, 46.927]
  - - [21248, 8976, 1, 256]
    - [8, 46.972]
  - - [23552, 8976, 1, 256]
    - [8, 47.358]
  - - [28672, 8976, 1, 256]
    - [8, 47.806]
  - - [31488, 8976, 1, 256]
    - [8, 47.34]
  - - [33536, 8976, 1, 256]
    - [8, 47.34]
  - - [44505, 8976, 1, 256]
    - [15, 43.068]
  - - [14, 14, 10880, 64]
    - [69, 3.679]
  - - [15, 14, 10880, 64]
    - [129, 3.086]
  - - [15, 15, 7680, 64]
    - [129, 2.829]
  - - [15, 15, 10880, 64]
    - [129, 3.804]
  - - [17, 15, 7680, 64]
    - [69, 2.68]
  - - [17, 17, 7680, 64]
    - [39, 2.528]
  - - [21, 17, 6144, 64]
    - [33, 3.157]
  - - [21, 21, 6144, 64]
    - [128, 3.869]
  - - [24, 24, 4736, 64]
    - [35, 4.225]
  - - [30, 30, 2048, 64]
    - [33, 4.343]
  - - [30, 31, 2048, 64]
    - [33, 4.518]
  - - [31, 31, 2048, 64]
    - [128, 4.327]
  - - [32, 32, 4608, 64]
    - [128, 8.006]
  - - [32, 35, 4608, 64]
    - [34, 7.075]
  - - [34, 24, 4736, 64]
    - [13, 3.844]
  - - [34, 34, 4736, 64]
    - [132, 4.209]
  - - [35, 35, 4608, 64]
    - [54, 4.066]
  - - [1024, 3840, 1, 1024]
    - [28, 55.418]
  - - [1024, 3840, 1, 4096]
    - [98, 75.445]
  - - [1024, 3968, 1, 1024]
    - [14, 53.697]
  - - [1024, 3968, 1, 4096]
    - [4, 67.328]
  - - [1024, 6528, 1, 1024]
    - [9, 64.321]
  - - [1024, 6528, 1, 4096]
    - [6, 83.527]
  - - [1024, 7104, 1, 1024]
    - [20, 60.075]
  - - [1024, 7104, 1, 4096]
    - [20, 71.456]
  - - [1024, 7200, 1, 1024]
    - [20, 60.627]
  - - [1024, 7200, 1, 4096]
    - [20, 72.207]
  - - [1024, 8064, 1, 1024]
    - [5, 59.542]
  - - [1024, 8064, 1, 4096]
    - [20, 69.998]
  - - [1024, 8160, 1, 1024]
    - [20, 59.988]
  - - [1024, 8160, 1, 4096]
    - [20, 70.74]
  - - [1024, 9216, 1, 1024]
    - [20, 66.106]
  - - [1024, 9216, 1, 4096]
    - [20, 78.342]
  - - [1024, 9520, 1, 1024]
    - [4, 61.525]
  - - [1024, 9520, 1, 4096]
    - [5, 86.247]
  - - [1024, 10064, 1, 1024]
    - [9, 63.107]
  - - [1024, 10064, 1, 4096]
    - [20, 75.693]
  - - [1024, 10080, 1, 1024]
    - [20, 64.544]
  - - [1024, 10080, 1, 4096]
    - [20, 75.777]
  - - [1024, 10200, 1, 1024]
    - [20, 63.791]
  - - [1024, 10200, 1, 4096]
    - [20, 76.026]
  - - [4096, 3840, 1, 1024]
    - [5, 66.665]
  - - [4096, 3968, 1, 1024]
    - [5, 64.905]
  - - [4096, 6528, 1, 1024]
    - [5, 69.306]
  - - [4096, 7104, 1, 1024]
    - [5, 69.403]
  - - [4096, 7200, 1, 1024]
    - [5, 69.778]
  - - [4096, 8064, 1, 1024]
    - [5, 69.908]
  - - [4096, 8160, 1, 1024]
    - [71, 69.616]
  - - [4096, 9216, 1, 1024]
    - [5, 70.676]
  - - [4096, 9520, 1, 1024]
    - [5, 69.791]
  - - [4096, 10064, 1, 1024]
    - [5, 70.771]
  - - [4096, 10080, 1, 1024]
    - [5, 70.799]
  - - [4096, 10200, 1, 1024]
    - [71, 69.775]
  - - [42720, 3968, 1, 1024]
    - [5, 71.733]
  - - [42720, 6528, 1, 1024]
    - [5, 73.074]
  - - [42720, 7104, 1, 1024]
    - [5, 73.065]
  - - [42720, 7200, 1, 1024]
    - [5, 73.418]
  - - [42720, 9520, 1, 1024]
    - [5, 72.697]
  - - [42720, 10080, 1, 1024]
    - [5, 73.166]
  - - [27, 27, 1920, 64]
    - [1, 4.213]
  - - [27, 33, 1920, 64]
    - [0, 4.595]
  - - [33, 33, 1920, 64]
    - [2, 3.385]
  - - [27, 27, 1920, 64]
    - [128, 4.103]
  - - [27, 33, 1920, 64]
    - [72, 2.821]
  - - [33, 33, 1920, 64]
    - [54, 3.75]
  - - [1024, 3240, 1, 1024]
    - [28, 51.447]
  - - [1024, 3240, 1, 4096]
    - [29, 78.28]
  - - [1024, 3960, 1, 1024]
    - [14, 52.389]
  - - [1024, 3960, 1, 4096]
    - [14, 66.619]
  - - [4096, 3240, 1, 1024]
    - [5, 66.109]
  - - [4096, 3960, 1, 1024]
    - [5, 64.707]
  - - [42720, 3960, 1, 1024]
    - [5, 70.861]
  - - [1024, 10, 1, 1024]
    - [87, 0.452]
  - - [1024, 32768, 1, 479]
    - [75, 45.441]
  - - [1024, 4992, 1, 4096]
    - [20, 73.718]
  - - [1024, 5, 1, 1024]
    - [55, 0.434]
  - - [2, 5, 1, 1024]
    - [76, 0.001]
  - - [8192, 7680, 1, 8192]
    - [15, 81.134]
  - - [2, 40, 1, 1024]
    - [44, 0.007]
  - - [128, 128, 128, 64]
    - [77, 4.652]
  - - [64, 128, 1, 128]
    - [78, 0.121]
  - - [1024, 2560, 1, 4096]
    - [121, 63.24]
  - - [30522, 462, 1, 1024]
    - [15, 60.276]
  - - [1024, 820, 1, 1024]
    - [79, 33.637]
  - - [4096, 5248, 1, 1024]
    - [5, 68.545]
  - - [4096, 3840, 1, 4096]
    - [5, 77.201]
  - - [1024, 39, 1, 1024]
    - [55, 1.721]
  - - [128, 128, 160, 64]
    - [80, 9.088]
  - - [4096, 1280, 1, 1024]
    - [4, 57.497]
  - - [1024, 2560, 1, 1024]
    - [4, 53.339]
  - - [1024, 800, 1, 1024]
    - [79, 25.295]
  - - [1024, 8, 1, 1024]
    - [46, 0.355]
  - - [30522, 160, 1, 1024]
    - [19, 41.641]
  - - [2, 1024, 1, 1024]
    - [85, 0.086]
  - - [30522, 308, 1, 1024]
    - [19, 53.585]
  - - [17, 17, 6144, 64]
    - [128, 2.587]
  - - [4096, 2560, 1, 1024]
    - [71, 64.348]
  - - [4096, 8192, 1, 1024]
    - [5, 69.338]
  - - [33, 33, 1, 32]
    - [81, 0.004]
  - - [1024, 5120, 1, 1024]
    - [28, 58.668]
  - - [1024, 9, 1, 1024]
    - [55, 0.418]
  - - [1024, 780, 1, 1024]
    - [4, 32.22]
  - - [512, 512, 80, 64]
    - [82, 16.33]
  - - [4096, 3072, 1, 1024]
    - [5, 64.149]
  - - [480, 512, 1, 512]
    - [21, 9.389]
  - - [1024, 3072, 1, 4096]
    - [4, 65.127]
  - - [4096, 1024, 1, 1024]
    - [31, 53.528]
  - - [1024, 1152, 1, 1024]
    - [38, 32.164]
  - - [128, 128, 656, 64]
    - [83, 12.981]
  - - [1024, 1024, 1, 4096]
    - [20, 52.426]
  - - [30522, 820, 1, 1024]
    - [15, 65.239]
  - - [2, 10, 1, 1024]
    - [43, 0.002]
  - - [1024, 180, 1, 1024]
    - [21, 12.083]
  - - [128, 128, 624, 64]
    - [84, 12.865]
  - - [1024, 160, 1, 1024]
    - [21, 11.119]
  - - [4096, 5120, 1, 1024]
    - [71, 67.245]
  - - [4, 4, 38400, 64]
    - [39, 0.625]
  - - [2048, 1920, 1, 2048]
    - [28, 66.931]
  - - [2, 39, 1, 1024]
    - [76, 0.006]
  - - [1024, 462, 1, 1024]
    - [12, 20.992]
  - - [2, 9, 1, 1024]
    - [85, 0.001]
  - - [30522, 180, 1, 1024]
    - [19, 45.21]
  - - [33712, 8192, 1, 1024]
    - [5, 73.918]
  - - [1024, 77, 1, 1024]
    - [44, 5.907]
  - - [5, 5, 1, 64]
    - [39, 0.0]
  - - [1024, 40, 1, 1024]
    - [55, 3.527]
  - - [2, 8, 1, 1024]
    - [43, 0.001]
  - - [512, 512, 96, 64]
    - [83, 16.818]
  - - [1024, 1152, 1, 4096]
    - [20, 60.02]
  - - [30522, 385, 1, 1024]
    - [15, 53.04]
  - - [1024, 200, 1, 1024]
    - [21, 13.126]
  - - [1024, 5120, 1, 4096]
    - [20, 74.445]
  - - [30522, 616, 1, 1024]
    - [15, 61.327]
  - - [1024, 41, 1, 1024]
    - [55, 1.867]
  - - [128, 128, 1, 64]
    - [39, 0.127]
  - - [1024, 5248, 1, 4096]
    - [20, 76.26]
  - - [4, 4, 32768, 64]
    - [54, 0.621]
  - - [128, 128, 640, 64]
    - [84, 13.149]
  - - [7680, 8192, 1, 8192]
    - [5, 81.141]
  - - [1024, 1280, 1, 4096]
    - [28, 55.915]
  - - [1024, 5248, 1, 1024]
    - [4, 59.5]
  - - [512, 512, 128, 64]
    - [84, 17.369]
  - - [512, 512, 16, 64]
    - [84, 7.605]
  - - [1024, 9600, 1, 1024]
    - [5, 62.076]
  - - [2, 6, 1, 1024]
    - [45, 0.001]
  - - [1024, 385, 1, 1024]
    - [21, 21.866]
  - - [1024, 4992, 1, 1024]
    - [9, 60.178]
  - - [33712, 9600, 1, 1024]
    - [5, 74.885]
  - - [1024, 512, 1, 4096]
    - [88, 38.711]
  - - [1024, 9600, 1, 4096]
    - [20, 87.757]
  - - [1024, 6, 1, 1024]
    - [55, 0.267]
  - - [1024, 308, 1, 1024]
    - [21, 18.756]
  - - [3840, 4096, 1, 4096]
    - [5, 77.013]
  - - [2, 41, 1, 1024]
    - [44, 0.007]
  - - [4096, 1152, 1, 1024]
    - [15, 55.606]
  - - [4096, 9600, 1, 1024]
    - [5, 70.225]
  - - [30522, 200, 1, 1024]
    - [15, 42.4]
  - - [4096, 4992, 1, 1024]
    - [5, 67.055]
  - - [1024, 8192, 1, 1024]
    - [14, 59.483]
  - - [30522, 780, 1, 1024]
    - [15, 61.639]
  - - [4096, 512, 1, 1024]
    - [38, 44.071]
  - - [1024, 1280, 1, 1024]
    - [16, 41.092]
  - - [1920, 2048, 1, 2048]
    - [4, 66.257]
  - - [1024, 3072, 1, 1024]
    - [4, 51.625]
  - - [1024, 8192, 1, 4096]
    - [90, 70.719]
  - - [128, 128, 144, 64]
    - [48, 5.231]
  - - [30522, 800, 1, 1024]
    - [15, 64.537]
  - - [30522, 77, 1, 1024]
    - [15, 26.713]
  - - [1024, 1024, 128, 96]
    - [91, 26.868]
  - - [30592, 4096, 1, 1024]
    - [5, 71.175]
  - - [64, 1024, 256, 1024]
    - [92, 38.17]
  - - [1536, 8192, 1, 1536]
    - [28, 68.176]
  - - [2048, 2, 1, 2048]
    - [46, 0.327]
  - - [3072, 8192, 1, 1024]
    - [5, 68.833]
  - - [3072, 2048, 1, 1024]
    - [5, 59.74]
  - - [50304, 8192, 1, 1024]
    - [5, 72.294]
  - - [64, 512, 40, 512]
    - [92, 18.185]
  - - [2048, 1024, 1, 8192]
    - [93, 64.071]
  - - [96, 1024, 64, 1024]
    - [32, 44.367]
  - - [1024, 16, 1, 1024]
    - [44, 1.37]
  - - [50304, 2048, 1, 1024]
    - [5, 69.531]
  - - [1536, 8192, 1, 6144]
    - [94, 78.286]
  - - [50304, 4096, 1, 1536]
    - [5, 74.61]
  - - [8192, 1024, 1, 2048]
    - [38, 66.583]
  - - [2, 4, 1, 2560]
    - [202, 0.001]
  - - [2560, 2048, 1, 640]
    - [38, 52.072]
  - - [1024, 1024, 128, 64]
    - [83, 18.935]
  - - [2048, 1024, 1, 2048]
    - [38, 53.41]
  - - [1536, 4096, 1, 1536]
    - [28, 66.632]
  - - [1024, 1024, 64, 64]
    - [95, 18.364]
  - - [30592, 8192, 1, 1024]
    - [5, 72.235]
  - - [50304, 16384, 1, 1024]
    - [5, 72.425]
  - - [4608, 4096, 1, 1536]
    - [5, 69.378]
  - - [2560, 2048, 1, 2560]
    - [38, 70.366]
  - - [7680, 2048, 1, 2560]
    - [5, 73.585]
  - - [2, 16, 1, 1024]
    - [45, 0.001]
  - - [50304, 4096, 1, 1024]
    - [5, 71.876]
  - - [64, 1024, 128, 1024]
    - [96, 38.012]
  - - [1920, 2048, 1, 2560]
    - [4, 66.964]
  - - [1024, 1024, 64, 96]
    - [97, 26.016]
  - - [64, 1024, 32, 1024]
    - [16, 32.784]
  - - [6144, 4096, 1, 1536]
    - [5, 72.127]
  - - [64, 512, 128, 512]
    - [73, 29.221]
  - - [1536, 4096, 1, 6144]
    - [32, 84.155]
  - - [512, 512, 256, 64]
    - [82, 18.476]
  - - [96, 1024, 128, 1024]
    - [32, 45.351]
  - - [50304, 8192, 1, 1536]
    - [5, 75.363]
  - - [6144, 8192, 1, 1536]
    - [5, 73.852]
  - - [4096, 16384, 1, 1024]
    - [5, 71.701]
  - - [30592, 1024, 1, 2048]
    - [5, 73.825]
  - - [2, 2, 1, 2048]
    - [202, 0.0]
  - - [1024, 16384, 1, 4096]
    - [38, 76.354]
  - - [64, 512, 256, 512]
    - [99, 31.565]
  - - [512, 512, 40, 64]
    - [84, 12.962]
  - - [6144, 1024, 1, 2048]
    - [186, 71.536]
  - - [4608, 8192, 1, 1536]
    - [5, 72.576]
  - - [30592, 2048, 1, 1024]
    - [5, 68.663]
  - - [3072, 16384, 1, 1024]
    - [5, 71.257]
  - - [1024, 1024, 256, 64]
    - [100, 19.107]
  - - [64, 1024, 64, 1024]
    - [70, 35.424]
  - - [1024, 16384, 1, 1024]
    - [5, 66.038]
  - - [1024, 1024, 32, 64]
    - [82, 17.469]
  - - [3072, 4096, 1, 1024]
    - [5, 64.262]
  - - [2560, 4, 1, 2560]
    - [55, 1.53]
  - - [960, 1024, 1, 1024]
    - [16, 33.654]
  - - [1024, 1, 1, 1024]
    - [55, 0.088]
  - - [32768, 1, 1, 256]
    - [101, 0.446]
  - - [512, 1, 1, 2048]
    - [86, 0.074]
  - - [1600, 1, 1, 1024]
    - [55, 0.133]
  - - [200, 1, 1, 1024]
    - [89, 0.017]
  - - [960, 1, 1, 2048]
    - [55, 0.08]
  - - [1024, 64, 1, 1024]
    - [46, 5.559]
  - - [30528, 8192, 1, 1024]
    - [5, 72.835]
  - - [128, 128, 1024, 64]
    - [77, 13.654]
  - - [64, 128, 1024, 128]
    - [58, 16.282]
  - - [1024, 3456, 1, 1024]
    - [38, 53.365]
  - - [1024, 3456, 1, 480]
    - [102, 42.342]
  - - [1024, 4096, 1, 480]
    - [91, 38.84]
  - - [1024, 6912, 1, 1024]
    - [28, 60.442]
  - - [1024, 6912, 1, 480]
    - [83, 45.262]
  - - [1024, 864, 1, 1024]
    - [60, 30.652]
  - - [1024, 864, 1, 480]
    - [104, 19.45]
  - - [128, 3456, 1, 256]
    - [21, 9.815]
  - - [128, 4096, 1, 256]
    - [105, 10.149]
  - - [128, 55296, 1, 256]
    - [4, 30.378]
  - - [128, 6912, 1, 256]
    - [57, 15.85]
  - - [128, 864, 1, 256]
    - [46, 2.798]
  - - [256, 3456, 1, 512]
    - [16, 24.537]
  - - [256, 4096, 1, 512]
    - [16, 25.308]
  - - [256, 55296, 1, 512]
    - [20, 51.389]
  - - [256, 6912, 1, 512]
    - [4, 35.689]
  - - [256, 864, 1, 512]
    - [21, 8.985]
  - - [3456, 1, 1, 256]
    - [106, 0.089]
  - - [4096, 1, 1, 256]
    - [55, 0.106]
  - - [512, 3456, 1, 1024]
    - [4, 49.913]
  - - [512, 3456, 1, 13]
    - [144, 0.815]
  - - [512, 4096, 1, 1024]
    - [28, 44.313]
  - - [512, 4096, 1, 13]
    - [155, 0.939]
  - - [512, 55296, 1, 13]
    - [109, 3.156]
  - - [512, 6912, 1, 1024]
    - [9, 54.559]
  - - [512, 6912, 1, 13]
    - [110, 1.92]
  - - [512, 864, 1, 1024]
    - [21, 24.896]
  - - [512, 864, 1, 13]
    - [33, 0.506]
  - - [6912, 1, 1, 256]
    - [46, 0.166]
  - - [864, 1, 1, 256]
    - [106, 0.024]
  - - [30528, 640, 1, 1024]
    - [38, 64.384]
  - - [30528, 1280, 1, 1024]
    - [5, 67.874]
  - - [30528, 1600, 1, 1024]
    - [5, 68.848]
  - - [1024, 10240, 1, 1024]
    - [20, 63.771]
  - - [1024, 80, 1, 1024]
    - [44, 6.848]
  - - [4096, 10240, 1, 1024]
    - [5, 70.457]
  - - [1024, 10240, 1, 4096]
    - [20, 76.566]
  - - [64, 128, 1280, 128]
    - [111, 16.765]
  - - [128, 128, 1280, 64]
    - [4, 14.132]
  - - [1024, 10496, 1, 4096]
    - [20, 78.011]
  - - [30528, 1640, 1, 1024]
    - [5, 68.567]
  - - [1024, 82, 1, 1024]
    - [46, 6.635]
  - - [4096, 10496, 1, 1024]
    - [5, 70.947]
  - - [1024, 10496, 1, 1024]
    - [10, 65.125]
  - - [64, 128, 1312, 128]
    - [70, 16.299]
  - - [128, 128, 1312, 64]
    - [28, 13.976]
  - - [30528, 160, 1, 1024]
    - [4, 44.795]
  - - [1024, 12, 1, 1024]
    - [46, 0.555]
  - - [30528, 240, 1, 1024]
    - [31, 54.711]
  - - [1024, 6144, 1, 1024]
    - [20, 60.995]
  - - [4096, 6144, 1, 1024]
    - [5, 69.013]
  - - [1024, 6144, 1, 4096]
    - [20, 87.262]
  - - [64, 512, 192, 512]
    - [70, 30.678]
  - - [512, 512, 192, 64]
    - [102, 18.029]
  - - [2, 64, 1, 1024]
    - [43, 0.011]
  - - [2, 80, 1, 1024]
    - [76, 0.013]
  - - [2, 82, 1, 1024]
    - [76, 0.016]
  - - [2, 12, 1, 1024]
    - [46, 0.002]
  - - [2, 1, 1, 1024]
    - [85, 0.0]
  - - [1, 4096, 1, 256]
    - [85, 0.107]
  - - [1, 6912, 1, 256]
    - [52, 0.163]
  - - [1024, 10224, 1, 1024]
    - [10, 63.571]
  - - [1024, 10192, 1, 1024]
    - [10, 63.573]
  - - [1024, 10208, 1, 1024]
    - [10, 63.706]
  - - [1024, 10224, 1, 4096]
    - [20, 76.362]
  - - [4096, 10224, 1, 1024]
    - [5, 70.387]
  - - [3072, 10224, 1, 1024]
    - [5, 69.43]
  - - [3072, 10240, 1, 1024]
    - [5, 68.787]
  - - [1024, 10192, 1, 4096]
    - [20, 76.183]
  - - [4096, 10192, 1, 1024]
    - [5, 69.449]
  - - [3072, 10192, 1, 1024]
    - [5, 69.345]
  - - [3072, 10200, 1, 1024]
    - [5, 69.227]
  - - [1024, 10184, 1, 1024]
    - [20, 63.725]
  - - [3072, 10208, 1, 1024]
    - [5, 69.361]
  - - [1024, 10208, 1, 4096]
    - [20, 76.302]
  - - [4096, 10208, 1, 1024]
    - [5, 70.308]
  - - [2048, 10224, 1, 1024]
    - [5, 67.346]
  - - [2048, 10240, 1, 1024]
    - [5, 67.791]
  - - [1024, 10120, 1, 1024]
    - [10, 63.057]
  - - [2048, 10192, 1, 1024]
    - [5, 67.36]
  - - [24, 24, 6816, 64]
    - [35, 4.875]
  - - [1024, 10152, 1, 1024]
    - [9, 63.424]
  - - [3072, 10080, 1, 1024]
    - [5, 70.145]
  - - [1024, 2048, 1, 49]
    - [65, 5.1]
  - - [1024, 256, 1, 196]
    - [33, 4.048]
  - - [1024, 512, 1, 196]
    - [113, 6.397]
  - - [1152, 128, 1, 784]
    - [21, 6.784]
  - - [128, 512, 1, 784]
    - [114, 3.405]
  - - [2048, 512, 1, 49]
    - [207, 1.896]
  - - [2304, 256, 1, 196]
    - [113, 7.079]
  - - [256, 1024, 1, 196]
    - [35, 4.105]
  - - [256, 128, 1, 3136]
    - [41, 4.47]
  - - [256, 512, 1, 784]
    - [21, 6.03]
  - - [256, 64, 1, 3136]
    - [41, 2.244]
  - - [4608, 512, 1, 49]
    - [116, 5.713]
  - - [512, 1024, 1, 196]
    - [34, 6.432]
  - - [512, 128, 1, 784]
    - [117, 3.346]
  - - [512, 2048, 1, 49]
    - [209, 1.847]
  - - [512, 256, 1, 784]
    - [21, 6.093]
  - - [576, 64, 1, 3136]
    - [41, 4.971]
  - - [64, 256, 1, 3136]
    - [41, 2.235]
  - - [64, 64, 1, 3136]
    - [201, 0.478]
  - - [128, 128, 49, 12800]
    - [118, 44.393]
  - - [128, 128, 25, 25088]
    - [119, 43.888]
  - - [128, 128, 49, 25600]
    - [51, 44.927]
  - - [128, 128, 25, 50176]
    - [120, 44.581]
  - - [256, 256, 25, 12544]
    - [90, 72.315]
  - - [256, 256, 49, 3200]
    - [94, 61.714]
  - - [256, 256, 25, 6272]
    - [121, 67.705]
  - - [256, 256, 49, 6400]
    - [94, 68.224]
  - - [512, 512, 49, 1152]
    - [20, 58.745]
  - - [512, 512, 25, 2048]
    - [28, 62.798]
  - - [512, 512, 49, 2304]
    - [51, 66.62]
  - - [512, 512, 25, 4096]
    - [121, 68.517]
  - - [64, 128, 2048, 128]
    - [7, 17.051]
  - - [128, 128, 2048, 64]
    - [4, 14.816]
  - - [30528, 2560, 1, 1024]
    - [5, 71.039]
  - - [1024, 128, 1, 1024]
    - [21, 8.948]
  - - [64, 128, 1536, 128]
    - [7, 16.88]
  - - [128, 128, 1536, 64]
    - [4, 14.192]
  - - [1024, 12288, 1, 1024]
    - [5, 63.867]
  - - [1024, 12288, 1, 4096]
    - [94, 75.53]
  - - [30528, 1920, 1, 1024]
    - [5, 71.144]
  - - [1024, 96, 1, 1024]
    - [87, 7.931]
  - - [4096, 12288, 1, 1024]
    - [5, 71.135]
  - - [128, 128, 36, 12544]
    - [122, 40.962]
  - - [128, 128, 49, 9216]
    - [122, 44.292]
  - - [128, 128, 64, 6400]
    - [94, 42.122]
  - - [128, 128, 81, 12544]
    - [123, 46.425]
  - - [128, 128, 121, 9216]
    - [119, 40.584]
  - - [128, 128, 169, 6400]
    - [121, 44.947]
  - - [256, 256, 36, 4096]
    - [10, 62.645]
  - - [256, 256, 49, 2304]
    - [124, 62.387]
  - - [256, 256, 64, 2304]
    - [51, 58.852]
  - - [256, 256, 81, 4096]
    - [124, 70.945]
  - - [256, 256, 121, 2304]
    - [94, 68.551]
  - - [256, 256, 169, 2304]
    - [94, 69.702]
  - - [512, 512, 81, 1024]
    - [29, 61.784]
  - - [512, 512, 121, 1024]
    - [29, 62.769]
  - - [512, 512, 169, 1024]
    - [38, 62.899]
  - - [512, 512, 36, 1024]
    - [20, 57.485]
  - - [512, 512, 49, 1024]
    - [9, 58.344]
  - - [512, 512, 64, 1024]
    - [9, 59.814]
  - - [64, 64, 36, 50176]
    - [46, 21.308]
  - - [64, 64, 49, 36864]
    - [46, 27.25]
  - - [64, 64, 64, 25600]
    - [46, 24.041]
  - - [128, 128, 192, 64]
    - [84, 9.221]
  - - [64, 128, 192, 128]
    - [99, 6.519]
  - - [768, 2048, 1, 768]
    - [4, 39.679]
  - - [3072, 2048, 1, 768]
    - [28, 55.379]
  - - [768, 2048, 1, 3072]
    - [28, 60.286]
  - - [768, 16, 1, 768]
    - [46, 0.443]
  - - [384, 384, 144, 64]
    - [59, 16.015]
  - - [64, 384, 144, 384]
    - [70, 25.732]
  - - [768, 4608, 1, 768]
    - [28, 51.378]
  - - [3072, 4608, 1, 768]
    - [5, 61.799]
  - - [768, 4608, 1, 3072]
    - [9, 73.592]
  - - [768, 12, 1, 768]
    - [86, 0.613]
  - - [512, 512, 48, 64]
    - [82, 14.729]
  - - [64, 512, 48, 512]
    - [125, 27.003]
  - - [768, 4, 1, 768]
    - [86, 0.206]
  - - [128, 128, 256, 64]
    - [84, 10.357]
  - - [64, 128, 256, 128]
    - [16, 12.195]
  - - [384, 384, 192, 64]
    - [59, 16.41]
  - - [64, 384, 192, 384]
    - [111, 24.896]
  - - [1024, 4608, 1, 1024]
    - [20, 56.18]
  - - [4096, 4608, 1, 1024]
    - [5, 68.757]
  - - [1024, 4608, 1, 4096]
    - [20, 68.714]
  - - [2880, 3072, 1, 3072]
    - [20, 72.068]
  - - [3072, 3072, 1, 3072]
    - [9, 76.102]
  - - [3072, 512, 1, 3072]
    - [4, 60.153]
  - - [4096, 512, 1, 4096]
    - [4, 58.406]
  - - [512, 1024, 1, 1024]
    - [12, 23.814]
  - - [512, 2048, 1, 2048]
    - [20, 42.447]
  - - [512, 3072, 1, 3072]
    - [98, 60.286]
  - - [512, 4096, 1, 4096]
    - [50, 62.357]
  - - [512, 8192, 1, 8192]
    - [23, 85.456]
  - - [64, 1024, 1, 1024]
    - [89, 5.56]
  - - [8192, 512, 1, 8192]
    - [14, 72.169]
  - - [26, 26, 6272, 64]
    - [33, 5.549]
  - - [147, 64, 1, 12544]
    - [126, 3.613]
  - - [2, 128, 1, 1024]
    - [127, 0.023]
  - - [2, 96, 1, 1024]
    - [46, 0.009]
  - - [2, 2048, 1, 768]
    - [85, 0.133]
  - - [2, 4608, 1, 768]
    - [85, 0.562]
  - - [2, 4608, 1, 1024]
    - [85, 0.695]
  - - [4224, 3840, 1, 4096]
    - [38, 79.402]
  - - [5376, 4096, 1, 4096]
    - [5, 76.6]
  - - [7040, 4096, 1, 384]
    - [38, 52.155]
  - - [7040, 4096, 1, 512]
    - [5, 57.181]
  - - [7040, 4096, 1, 768]
    - [5, 64.858]
  - - [7040, 4096, 1, 1536]
    - [5, 72.196]
  - - [31, 31, 8192, 64]
    - [128, 5.62]
  - - [34, 34, 5248, 64]
    - [54, 4.231]
  - - [15, 15, 8192, 64]
    - [129, 3.563]
  - - [5, 5, 8192, 64]
    - [54, 0.642]
  - - [32, 32, 5248, 64]
    - [35, 8.554]
  - - [17, 17, 8192, 64]
    - [128, 2.749]
  - - [24, 24, 5440, 64]
    - [35, 5.565]
  - - [9, 9, 8192, 64]
    - [39, 1.929]
  - - [26, 26, 5248, 64]
    - [128, 5.296]
  - - [30, 30, 5248, 64]
    - [33, 5.657]
  - - [33, 33, 8192, 64]
    - [54, 4.495]
  - - [35, 35, 8192, 64]
    - [54, 4.232]
  - - [4, 4, 3456, 64]
    - [39, 0.256]
  - - [3, 3, 8192, 64]
    - [54, 0.236]
  - - [14, 14, 5440, 64]
    - [69, 3.1]
  - - [21, 21, 8192, 64]
    - [33, 4.064]
  - - [34, 24, 320, 64]
    - [39, 1.29]
  - - [27, 27, 8192, 64]
    - [128, 5.811]
  - - [1024, 10032, 1, 1024]
    - [5, 63.175]
  - - [1024, 10032, 1, 4096]
    - [20, 75.058]
  - - [1024, 11304, 1, 1024]
    - [5, 63.562]
  - - [1024, 13104, 1, 1024]
    - [10, 66.186]
  - - [1024, 1640, 1, 1024]
    - [118, 45.695]
  - - [1024, 256, 1, 1024]
    - [146, 13.562]
  - - [1024, 288, 1, 1024]
    - [21, 17.012]
  - - [1024, 304, 1, 1024]
    - [21, 18.512]
  - - [1024, 312, 1, 1024]
    - [21, 18.616]
  - - [1024, 3304, 1, 1024]
    - [4, 52.89]
  - - [1024, 3304, 1, 4096]
    - [29, 77.431]
  - - [1024, 3400, 1, 1024]
    - [14, 53.628]
  - - [1024, 352, 1, 1024]
    - [21, 20.897]
  - - [1024, 3520, 1, 1024]
    - [38, 52.988]
  - - [1024, 3584, 1, 4096]
    - [20, 69.44]
  - - [1024, 3696, 1, 1024]
    - [4, 52.56]
  - - [1024, 384, 1, 1024]
    - [130, 22.458]
  - - [1024, 3872, 1, 1024]
    - [73, 53.649]
  - - [1024, 3872, 1, 4096]
    - [98, 76.375]
  - - [1024, 392, 1, 1024]
    - [21, 21.948]
  - - [1024, 432, 1, 1024]
    - [36, 20.252]
  - - [1024, 448, 1, 1024]
    - [12, 21.87]
  - - [1024, 456, 1, 1024]
    - [37, 20.562]
  - - [1024, 4896, 1, 1024]
    - [20, 59.385]
  - - [1024, 4896, 1, 4096]
    - [20, 72.369]
  - - [1024, 4968, 1, 1024]
    - [20, 57.204]
  - - [1024, 4968, 1, 4096]
    - [38, 72.593]
  - - [1024, 504, 1, 1024]
    - [105, 22.639]
  - - [1024, 520, 1, 1024]
    - [12, 23.358]
  - - [1024, 5280, 1, 1024]
    - [20, 63.327]
  - - [1024, 5280, 1, 4096]
    - [20, 77.223]
  - - [1024, 672, 1, 1024]
    - [183, 21.524]
  - - [1024, 6880, 1, 4096]
    - [20, 82.172]
  - - [1024, 7040, 1, 1024]
    - [4, 61.064]
  - - [1024, 7040, 1, 4096]
    - [20, 84.196]
  - - [1024, 7144, 1, 1024]
    - [5, 59.31]
  - - [1024, 7144, 1, 4096]
    - [20, 71.147]
  - - [1024, 728, 1, 1024]
    - [118, 22.777]
  - - [1024, 760, 1, 1024]
    - [79, 23.097]
  - - [2048, 1280, 1, 1024]
    - [28, 53.059]
  - - [2048, 144, 1, 1024]
    - [21, 17.183]
  - - [2048, 1640, 1, 1024]
    - [4, 53.374]
  - - [2048, 2832, 1, 1024]
    - [4, 56.515]
  - - [2048, 3696, 1, 1024]
    - [5, 60.729]
  - - [2048, 4704, 1, 1024]
    - [71, 60.901]
  - - [2048, 480, 1, 1024]
    - [47, 27.465]
  - - [2048, 744, 1, 1024]
    - [4, 42.668]
  - - [2048, 7448, 1, 1024]
    - [5, 65.226]
  - - [2048, 8192, 1, 1024]
    - [5, 66.469]
  - - [2048, 8968, 1, 1024]
    - [5, 67.225]
  - - [3072, 144, 1, 1024]
    - [12, 19.629]
  - - [3072, 4480, 1, 1024]
    - [5, 63.69]
  - - [3072, 4896, 1, 1024]
    - [5, 65.16]
  - - [3072, 6880, 1, 1024]
    - [5, 67.846]
  - - [3072, 8968, 1, 1024]
    - [5, 68.856]
  - - [33712, 160, 1, 1024]
    - [20, 48.655]
  - - [33712, 3408, 1, 1024]
    - [5, 72.981]
  - - [4096, 10032, 1, 1024]
    - [5, 70.43]
  - - [4096, 3304, 1, 1024]
    - [5, 63.186]
  - - [4096, 3584, 1, 1024]
    - [5, 63.646]
  - - [4096, 3872, 1, 1024]
    - [5, 66.852]
  - - [4096, 4896, 1, 1024]
    - [5, 68.349]
  - - [4096, 4968, 1, 1024]
    - [5, 66.411]
  - - [4096, 5280, 1, 1024]
    - [5, 68.982]
  - - [4096, 6880, 1, 1024]
    - [5, 69.366]
  - - [4096, 7040, 1, 1024]
    - [5, 68.863]
  - - [4096, 7144, 1, 1024]
    - [5, 69.335]
  - - [1024, 14336, 1, 1024]
    - [20, 66.054]
  - - [1024, 1536, 1, 1024]
    - [4, 45.365]
  - - [1024, 15360, 1, 1024]
    - [20, 66.812]
  - - [1024, 17920, 1, 1024]
    - [5, 66.889]
  - - [1024, 18944, 1, 1024]
    - [5, 66.528]
  - - [1024, 19968, 1, 1024]
    - [5, 67.15]
  - - [1024, 20992, 1, 1024]
    - [5, 68.056]
  - - [1024, 22016, 1, 1024]
    - [5, 68.034]
  - - [1024, 23040, 1, 1024]
    - [5, 68.476]
  - - [1024, 24064, 1, 1024]
    - [5, 67.575]
  - - [1024, 28160, 1, 1024]
    - [5, 69.02]
  - - [1024, 30208, 1, 1024]
    - [5, 68.894]
  - - [1024, 31232, 1, 1024]
    - [5, 69.749]
  - - [10, 44, 3712, 64]
    - [39, 3.515]
  - - [16, 12, 10240, 64]
    - [131, 3.207]
  - - [16, 14, 10240, 64]
    - [131, 3.651]
  - - [16, 32, 5120, 64]
    - [69, 5.728]
  - - [18, 14, 9088, 64]
    - [39, 2.789]
  - - [20, 16, 11008, 64]
    - [54, 4.097]
  - - [20, 18, 8192, 64]
    - [128, 3.392]
  - - [22, 16, 10048, 64]
    - [54, 4.12]
  - - [22, 18, 10048, 64]
    - [33, 3.82]
  - - [22, 32, 5120, 64]
    - [128, 5.437]
  - - [24, 36, 320, 64]
    - [40, 1.557]
  - - [26, 32, 384, 64]
    - [132, 1.8]
  - - [26, 34, 320, 64]
    - [69, 1.569]
  - - [28, 32, 384, 64]
    - [69, 1.851]
  - - [28, 34, 320, 64]
    - [0, 0.781]
  - - [30, 32, 384, 64]
    - [132, 1.926]
  - - [30, 36, 320, 64]
    - [132, 1.793]
  - - [32, 34, 320, 64]
    - [54, 1.946]
  - - [32, 36, 320, 64]
    - [40, 2.077]
  - - [2368, 1024, 1, 1]
    - [108, 0.137]
  - - [448, 1, 1, 256]
    - [55, 0.012]
  - - [5056, 1408, 1, 3328]
    - [5, 80.4]
  - - [5056, 1856, 1, 3328]
    - [14, 71.529]
  - - [5888, 128, 1, 1]
    - [107, 0.062]
  - - [448, 3584, 1, 3328]
    - [118, 61.621]
  - - [704, 64, 1, 3328]
    - [44, 7.931]
  - - [5056, 4288, 1, 32]
    - [133, 10.664]
  - - [3584, 1024, 1, 256]
    - [61, 23.967]
  - - [32, 5056, 1, 1280]
    - [52, 11.784]
  - - [1856, 256, 1, 1]
    - [134, 0.041]
  - - [256, 1856, 1, 32]
    - [107, 1.416]
  - - [1408, 3584, 1, 3328]
    - [94, 78.973]
  - - [128, 3584, 1, 1280]
    - [105, 23.544]
  - - [1024, 2368, 1, 3328]
    - [9, 65.128]
  - - [4288, 64, 1, 3328]
    - [119, 25.854]
  - - [1, 4288, 1, 1280]
    - [85, 0.379]
  - - [2368, 64, 1, 1]
    - [135, 0.015]
  - - [448, 64, 1, 1]
    - [40, 0.003]
  - - [32, 1408, 1, 32]
    - [40, 0.177]
  - - [448, 3584, 1, 32]
    - [108, 4.106]
  - - [1, 1408, 1, 3328]
    - [45, 0.264]
  - - [1408, 128, 1, 32]
    - [81, 0.619]
  - - [4288, 6784, 1, 3328]
    - [5, 77.351]
  - - [2944, 128, 1, 32]
    - [54, 1.27]
  - - [64, 6784, 1, 1]
    - [206, 0.018]
  - - [448, 128, 1, 256]
    - [87, 1.517]
  - - [64, 5056, 1, 3328]
    - [136, 26.783]
  - - [5888, 4288, 1, 3328]
    - [5, 77.21]
  - - [1, 2368, 1, 1280]
    - [85, 0.125]
  - - [704, 1024, 1, 1]
    - [104, 0.056]
  - - [2368, 1408, 1, 32]
    - [108, 6.164]
  - - [256, 1856, 1, 1280]
    - [105, 23.792]
  - - [1024, 2944, 1, 1]
    - [211, 0.095]
  - - [2944, 3584, 1, 3328]
    - [38, 74.914]
  - - [2368, 2944, 1, 1280]
    - [51, 63.111]
  - - [256, 1408, 1, 1]
    - [81, 0.033]
  - - [1, 1024, 1, 3328]
    - [45, 0.19]
  - - [6784, 5888, 1, 3328]
    - [5, 77.735]
  - - [3584, 1408, 1, 32]
    - [115, 6.664]
  - - [5056, 256, 1, 256]
    - [16, 20.18]
  - - [1856, 2368, 1, 256]
    - [16, 30.767]
  - - [2368, 1024, 1, 3328]
    - [118, 70.006]
  - - [3584, 4288, 1, 32]
    - [137, 8.644]
  - - [3584, 3584, 1, 1]
    - [138, 0.213]
  - - [32, 2944, 1, 3328]
    - [53, 15.358]
  - - [704, 1408, 1, 3328]
    - [32, 48.838]
  - - [1408, 704, 1, 256]
    - [16, 15.207]
  - - [704, 64, 1, 32]
    - [81, 0.18]
  - - [5888, 1, 1, 3328]
    - [46, 0.78]
  - - [2368, 32, 1, 256]
    - [106, 1.917]
  - - [6784, 128, 1, 3328]
    - [32, 38.811]
  - - [2944, 256, 1, 1]
    - [108, 0.059]
  - - [1408, 2368, 1, 1]
    - [139, 0.137]
  - - [32, 448, 1, 3328]
    - [86, 2.729]
  - - [5056, 1, 1, 3328]
    - [46, 0.749]
  - - [2944, 256, 1, 32]
    - [140, 2.322]
  - - [5056, 6784, 1, 1280]
    - [5, 72.116]
  - - [4288, 5056, 1, 1]
    - [108, 0.251]
  - - [5056, 4288, 1, 1]
    - [108, 0.253]
  - - [128, 4288, 1, 3328]
    - [88, 36.947]
  - - [5056, 128, 1, 256]
    - [111, 6.75]
  - - [1408, 4288, 1, 1280]
    - [9, 65.722]
  - - [1856, 704, 1, 1280]
    - [28, 37.999]
  - - [4288, 1024, 1, 3328]
    - [5, 71.937]
  - - [1, 5888, 1, 3328]
    - [85, 0.788]
  - - [32, 4288, 1, 1280]
    - [112, 10.696]
  - - [1024, 5056, 1, 1]
    - [144, 0.134]
  - - [704, 3584, 1, 1280]
    - [73, 55.215]
  - - [1856, 5056, 1, 256]
    - [51, 36.724]
  - - [1408, 1024, 1, 1280]
    - [51, 45.498]
  - - [5056, 5888, 1, 3328]
    - [5, 76.135]
  - - [448, 1, 1, 1]
    - [141, 0.0]
  - - [3584, 3584, 1, 1280]
    - [5, 67.044]
  - - [2368, 3584, 1, 32]
    - [108, 8.717]
  - - [2944, 2368, 1, 1]
    - [77, 0.181]
  - - [704, 4288, 1, 1]
    - [159, 0.096]
  - - [2368, 256, 1, 32]
    - [206, 0.844]
  - - [1024, 6784, 1, 1280]
    - [51, 62.928]
  - - [32, 5056, 1, 32]
    - [135, 0.556]
  - - [5888, 32, 1, 32]
    - [81, 0.635]
  - - [256, 5056, 1, 32]
    - [155, 1.704]
  - - [5056, 64, 1, 32]
    - [135, 1.061]
  - - [2368, 5056, 1, 32]
    - [133, 9.487]
  - - [6784, 1856, 1, 32]
    - [137, 8.391]
  - - [64, 2368, 1, 1280]
    - [21, 11.324]
  - - [128, 704, 1, 32]
    - [134, 0.322]
  - - [64, 6784, 1, 3328]
    - [73, 25.048]
  - - [2944, 256, 1, 1280]
    - [88, 35.635]
  - - [5056, 704, 1, 1]
    - [142, 0.15]
  - - [2944, 4288, 1, 256]
    - [171, 39.974]
  - - [5056, 704, 1, 32]
    - [133, 3.746]
  - - [1856, 4288, 1, 3328]
    - [73, 72.061]
  - - [1, 1856, 1, 256]
    - [85, 0.047]
  - - [6784, 4288, 1, 32]
    - [144, 9.306]
  - - [5888, 64, 1, 256]
    - [21, 8.051]
  - - [5888, 5056, 1, 256]
    - [20, 43.497]
  - - [2944, 448, 1, 256]
    - [16, 19.608]
  - - [3584, 2368, 1, 3328]
    - [38, 81.86]
  - - [4288, 1856, 1, 1]
    - [108, 0.212]
  - - [1856, 2944, 1, 1]
    - [108, 0.188]
  - - [32, 4288, 1, 3328]
    - [52, 15.978]
  - - [1, 3584, 1, 3328]
    - [85, 0.592]
  - - [256, 32, 1, 3328]
    - [45, 1.544]
  - - [1856, 2368, 1, 32]
    - [104, 6.83]
  - - [4288, 1856, 1, 32]
    - [18, 6.717]
  - - [5056, 64, 1, 3328]
    - [130, 29.307]
  - - [6784, 1, 1, 1280]
    - [46, 0.523]
  - - [1408, 64, 1, 1]
    - [134, 0.004]
  - - [1, 1, 1, 3328]
    - [202, 0.0]
  - - [5056, 2368, 1, 256]
    - [51, 38.931]
  - - [1408, 5888, 1, 256]
    - [51, 35.477]
  - - [5056, 6784, 1, 1]
    - [59, 0.268]
  - - [32, 448, 1, 1280]
    - [86, 1.456]
  - - [32, 448, 1, 32]
    - [153, 0.023]
  - - [1856, 64, 1, 256]
    - [21, 1.392]
  - - [1024, 1408, 1, 3328]
    - [51, 56.371]
  - - [256, 5056, 1, 1280]
    - [19, 35.947]
  - - [704, 2368, 1, 1]
    - [108, 0.115]
  - - [128, 1, 1, 1]
    - [141, 0.0]
  - - [3584, 4288, 1, 1280]
    - [5, 68.256]
  - - [1856, 128, 1, 32]
    - [81, 0.8]
  - - [1856, 128, 1, 1280]
    - [21, 15.788]
  - - [128, 2944, 1, 3328]
    - [136, 34.802]
  - - [1, 6784, 1, 3328]
    - [145, 0.821]
  - - [3584, 2368, 1, 1]
    - [59, 0.193]
  - - [4288, 448, 1, 3328]
    - [22, 55.026]
  - - [4288, 32, 1, 3328]
    - [101, 15.928]
  - - [256, 1856, 1, 1]
    - [158, 0.02]
  - - [704, 6784, 1, 1280]
    - [73, 61.527]
  - - [2368, 4288, 1, 32]
    - [108, 9.106]
  - - [704, 5056, 1, 1280]
    - [73, 59.342]
  - - [3584, 6784, 1, 32]
    - [115, 9.179]
  - - [3584, 6784, 1, 1280]
    - [5, 69.447]
  - - [4288, 4288, 1, 3328]
    - [38, 76.297]
  - - [3584, 64, 1, 1280]
    - [146, 15.104]
  - - [64, 1856, 1, 256]
    - [52, 2.903]
  - - [3584, 64, 1, 32]
    - [131, 0.78]
  - - [448, 1, 1, 1280]
    - [86, 0.045]
  - - [256, 4288, 1, 1280]
    - [16, 37.872]
  - - [1408, 3584, 1, 1]
    - [91, 0.184]
  - - [4288, 1856, 1, 3328]
    - [14, 72.942]
  - - [1856, 2944, 1, 1280]
    - [51, 58.283]
  - - [4288, 256, 1, 256]
    - [16, 17.688]
  - - [128, 5888, 1, 32]
    - [107, 2.283]
  - - [128, 5888, 1, 1280]
    - [31, 34.836]
  - - [1408, 128, 1, 3328]
    - [21, 21.118]
  - - [3584, 256, 1, 256]
    - [147, 14.461]
  - - [32, 6784, 1, 3328]
    - [85, 20.35]
  - - [32, 3584, 1, 256]
    - [52, 2.902]
  - - [704, 256, 1, 32]
    - [108, 0.276]
  - - [448, 128, 1, 3328]
    - [44, 10.047]
  - - [64, 2944, 1, 3328]
    - [21, 19.901]
  - - [64, 4288, 1, 3328]
    - [120, 23.333]
  - - [5056, 1024, 1, 3328]
    - [5, 72.381]
  - - [128, 256, 1, 1280]
    - [85, 1.847]
  - - [1856, 256, 1, 256]
    - [12, 9.323]
  - - [3584, 704, 1, 1]
    - [149, 0.132]
  - - [256, 704, 1, 256]
    - [150, 4.126]
  - - [448, 5056, 1, 1]
    - [133, 0.127]
  - - [5888, 5888, 1, 256]
    - [20, 44.52]
  - - [3584, 704, 1, 32]
    - [77, 5.168]
  - - [448, 6784, 1, 3328]
    - [118, 67.346]
  - - [6784, 4288, 1, 1]
    - [59, 0.248]
  - - [3584, 6784, 1, 1]
    - [95, 0.243]
  - - [1408, 2368, 1, 32]
    - [107, 5.835]
  - - [448, 5056, 1, 32]
    - [108, 4.89]
  - - [4288, 4288, 1, 1280]
    - [5, 69.871]
  - - [6784, 1408, 1, 1]
    - [91, 0.2]
  - - [1856, 5888, 1, 3328]
    - [32, 81.059]
  - - [1024, 704, 1, 1]
    - [72, 0.029]
  - - [3584, 1856, 1, 3328]
    - [14, 69.166]
  - - [5056, 5888, 1, 1]
    - [138, 0.262]
  - - [2944, 1024, 1, 256]
    - [95, 25.878]
  - - [448, 1408, 1, 3328]
    - [151, 42.924]
  - - [5056, 32, 1, 3328]
    - [101, 17.04]
  - - [2368, 4288, 1, 3328]
    - [20, 73.104]
  - - [1024, 704, 1, 32]
    - [107, 2.096]
  - - [448, 2944, 1, 256]
    - [16, 20.452]
  - - [2944, 6784, 1, 256]
    - [66, 42.512]
  - - [2368, 2368, 1, 1280]
    - [51, 58.429]
  - - [5888, 128, 1, 3328]
    - [152, 50.734]
  - - [256, 256, 1, 32]
    - [134, 0.1]
  - - [3584, 3584, 1, 32]
    - [115, 8.56]
  - - [2944, 448, 1, 1]
    - [144, 0.05]
  - - [128, 32, 1, 32]
    - [81, 0.016]
  - - [5056, 64, 1, 1280]
    - [119, 20.289]
  - - [2944, 2944, 1, 1280]
    - [5, 62.339]
  - - [1, 2368, 1, 256]
    - [154, 0.062]
  - - [1408, 5056, 1, 1]
    - [155, 0.181]
  - - [2944, 32, 1, 1280]
    - [46, 9.118]
  - - [64, 1408, 1, 3328]
    - [53, 14.884]
  - - [256, 448, 1, 1280]
    - [21, 5.593]
  - - [2368, 6784, 1, 1]
    - [108, 0.244]
  - - [6784, 4288, 1, 1280]
    - [5, 71.127]
  - - [2944, 704, 1, 256]
    - [28, 16.33]
  - - [2368, 6784, 1, 1280]
    - [5, 67.151]
  - - [704, 2944, 1, 3328]
    - [28, 56.931]
  - - [5888, 256, 1, 1]
    - [149, 0.056]
  - - [704, 704, 1, 32]
    - [107, 1.567]
  - - [256, 4288, 1, 256]
    - [16, 16.841]
  - - [5056, 6784, 1, 32]
    - [133, 11.222]
  - - [5056, 128, 1, 1]
    - [107, 0.053]
  - - [448, 5056, 1, 1280]
    - [73, 46.746]
  - - [448, 448, 1, 256]
    - [21, 4.631]
  - - [704, 448, 1, 1280]
    - [130, 13.032]
  - - [448, 64, 1, 256]
    - [89, 0.78]
  - - [1024, 704, 1, 1280]
    - [4, 33.754]
  - - [5888, 1024, 1, 1]
    - [186, 0.148]
  - - [5888, 448, 1, 32]
    - [156, 5.113]
  - - [6784, 2944, 1, 256]
    - [67, 40.567]
  - - [2368, 448, 1, 256]
    - [16, 17.485]
  - - [4288, 256, 1, 3328]
    - [32, 53.109]
  - - [4288, 2944, 1, 256]
    - [157, 39.749]
  - - [448, 5888, 1, 3328]
    - [73, 68.924]
  - - [128, 256, 1, 3328]
    - [87, 3.881]
  - - [128, 6784, 1, 32]
    - [104, 1.143]
  - - [1856, 64, 1, 32]
    - [158, 0.428]
  - - [1408, 4288, 1, 1]
    - [144, 0.143]
  - - [1408, 1856, 1, 3328]
    - [73, 59.551]
  - - [4288, 64, 1, 256]
    - [21, 5.907]
  - - [3584, 1024, 1, 3328]
    - [38, 67.554]
  - - [2944, 5888, 1, 3328]
    - [5, 76.456]
  - - [128, 6784, 1, 3328]
    - [68, 41.437]
  - - [448, 4288, 1, 3328]
    - [93, 55.026]
  - - [704, 2368, 1, 256]
    - [111, 13.959]
  - - [1, 64, 1, 3328]
    - [43, 0.012]
  - - [4288, 128, 1, 1]
    - [143, 0.023]
  - - [256, 2368, 1, 32]
    - [140, 0.845]
  - - [4288, 3584, 1, 3328]
    - [38, 74.651]
  - - [1408, 64, 1, 256]
    - [46, 2.342]
  - - [1408, 1024, 1, 1]
    - [149, 0.054]
  - - [1408, 1024, 1, 256]
    - [61, 19.897]
  - - [5056, 3584, 1, 1]
    - [83, 0.244]
  - - [448, 1024, 1, 256]
    - [105, 9.001]
  - - [6784, 6784, 1, 3328]
    - [5, 77.109]
  - - [6784, 32, 1, 32]
    - [39, 0.309]
  - - [2368, 2944, 1, 3328]
    - [20, 78.318]
  - - [448, 448, 1, 1280]
    - [21, 14.997]
  - - [5056, 3584, 1, 32]
    - [133, 10.321]
  - - [5056, 3584, 1, 1280]
    - [5, 69.464]
  - - [1856, 1856, 1, 256]
    - [118, 28.469]
  - - [32, 5888, 1, 256]
    - [52, 4.418]
  - - [256, 1408, 1, 32]
    - [81, 1.15]
  - - [2944, 1, 1, 3328]
    - [148, 0.516]
  - - [32, 704, 1, 3328]
    - [89, 2.707]
  - - [5888, 4288, 1, 1]
    - [159, 0.24]
  - - [32, 1856, 1, 3328]
    - [53, 10.215]
  - - [5056, 704, 1, 256]
    - [51, 29.586]
  - - [2368, 5056, 1, 256]
    - [157, 38.931]
  - - [1024, 5056, 1, 256]
    - [4, 31.771]
  - - [32, 1024, 1, 3328]
    - [53, 3.833]
  - - [5888, 448, 1, 256]
    - [57, 25.192]
  - - [6784, 5056, 1, 1280]
    - [5, 71.405]
  - - [4288, 6784, 1, 1280]
    - [5, 70.613]
  - - [64, 1, 1, 256]
    - [160, 0.002]
  - - [1856, 64, 1, 1280]
    - [21, 9.063]
  - - [128, 1408, 1, 1]
    - [81, 0.017]
  - - [704, 6784, 1, 3328]
    - [151, 74.759]
  - - [2944, 1856, 1, 1]
    - [144, 0.13]
  - - [5888, 4288, 1, 1280]
    - [5, 70.851]
  - - [5888, 3584, 1, 1280]
    - [5, 69.212]
  - - [32, 2368, 1, 1280]
    - [53, 7.189]
  - - [3584, 1408, 1, 1280]
    - [90, 60.624]
  - - [1024, 2944, 1, 256]
    - [190, 20.853]
  - - [1, 2944, 1, 1280]
    - [85, 0.161]
  - - [32, 1024, 1, 256]
    - [74, 0.413]
  - - [2944, 1856, 1, 1280]
    - [118, 56.487]
  - - [3584, 1, 1, 1280]
    - [46, 0.345]
  - - [1024, 2368, 1, 1]
    - [77, 0.126]
  - - [2944, 3584, 1, 1280]
    - [38, 66.884]
  - - [64, 1, 1, 1]
    - [40, 0.0]
  - - [1856, 4288, 1, 256]
    - [51, 35.922]
  - - [256, 1, 1, 256]
    - [161, 0.007]
  - - [1, 1856, 1, 3328]
    - [85, 0.213]
  - - [448, 3584, 1, 1]
    - [108, 0.109]
  - - [2368, 2944, 1, 32]
    - [133, 8.268]
  - - [128, 4288, 1, 32]
    - [107, 1.609]
  - - [448, 256, 1, 256]
    - [145, 2.711]
  - - [1, 1408, 1, 1]
    - [1, 0.0]
  - - [2944, 32, 1, 32]
    - [134, 0.33]
  - - [448, 1856, 1, 1]
    - [158, 0.064]
  - - [4288, 704, 1, 256]
    - [111, 26.069]
  - - [1856, 1024, 1, 256]
    - [16, 22.103]
  - - [448, 1856, 1, 32]
    - [104, 1.13]
  - - [448, 1856, 1, 3328]
    - [58, 46.516]
  - - [448, 448, 1, 32]
    - [81, 0.664]
  - - [6784, 1, 1, 256]
    - [46, 0.16]
  - - [704, 6784, 1, 32]
    - [133, 7.145]
  - - [1024, 4288, 1, 1]
    - [109, 0.119]
  - - [704, 256, 1, 3328]
    - [192, 16.636]
  - - [704, 1856, 1, 32]
    - [133, 1.732]
  - - [1408, 5888, 1, 1280]
    - [20, 61.123]
  - - [32, 704, 1, 1280]
    - [74, 1.257]
  - - [5056, 1856, 1, 256]
    - [51, 37.076]
  - - [6784, 704, 1, 1280]
    - [4, 61.12]
  - - [704, 1408, 1, 32]
    - [107, 2.728]
  - - [5888, 1024, 1, 256]
    - [51, 32.026]
  - - [64, 2944, 1, 1]
    - [81, 0.018]
  - - [64, 2944, 1, 32]
    - [208, 0.28]
  - - [64, 2944, 1, 1280]
    - [21, 13.793]
  - - [6784, 1856, 1, 3328]
    - [14, 74.476]
  - - [2368, 5888, 1, 1280]
    - [5, 67.429]
  - - [5888, 6784, 1, 32]
    - [91, 9.777]
  - - [1, 6784, 1, 256]
    - [85, 0.157]
  - - [6784, 6784, 1, 32]
    - [91, 9.948]
  - - [256, 1, 1, 1280]
    - [86, 0.014]
  - - [5888, 128, 1, 32]
    - [107, 2.156]
  - - [6784, 256, 1, 256]
    - [70, 22.564]
  - - [2368, 3584, 1, 3328]
    - [14, 70.558]
  - - [128, 4288, 1, 1280]
    - [187, 19.021]
  - - [32, 3584, 1, 1280]
    - [112, 9.344]
  - - [5888, 1024, 1, 1280]
    - [5, 65.466]
  - - [1856, 704, 1, 3328]
    - [118, 53.892]
  - - [5888, 6784, 1, 3328]
    - [5, 77.844]
  - - [6784, 448, 1, 1]
    - [175, 0.093]
  - - [6784, 1856, 1, 1]
    - [109, 0.213]
  - - [128, 32, 1, 1280]
    - [45, 0.41]
  - - [2944, 2368, 1, 1280]
    - [14, 61.754]
  - - [128, 256, 1, 1]
    - [141, 0.003]
  - - [6784, 448, 1, 32]
    - [107, 5.371]
  - - [6784, 448, 1, 3328]
    - [4, 61.598]
  - - [1, 6784, 1, 1]
    - [54, 0.001]
  - - [448, 3584, 1, 1280]
    - [73, 49.477]
  - - [1408, 6784, 1, 1280]
    - [28, 63.951]
  - - [5056, 5888, 1, 1280]
    - [5, 70.751]
  - - [32, 2944, 1, 32]
    - [0, 0.142]
  - - [5888, 704, 1, 1]
    - [162, 0.151]
  - - [3584, 1856, 1, 1]
    - [48, 0.173]
  - - [1, 256, 1, 256]
    - [41, 0.007]
  - - [5056, 2944, 1, 32]
    - [104, 10.031]
  - - [32, 6784, 1, 256]
    - [52, 2.334]
  - - [4288, 6784, 1, 1]
    - [82, 0.266]
  - - [1, 4288, 1, 3328]
    - [85, 0.673]
  - - [1024, 6784, 1, 1]
    - [48, 0.18]
  - - [2368, 5888, 1, 32]
    - [133, 9.895]
  - - [448, 448, 1, 3328]
    - [21, 23.227]
  - - [1, 256, 1, 1]
    - [81, 0.0]
  - - [3584, 4288, 1, 1]
    - [59, 0.219]
  - - [5888, 1024, 1, 3328]
    - [5, 79.121]
  - - [6784, 5888, 1, 256]
    - [67, 43.689]
  - - [704, 128, 1, 1280]
    - [46, 8.78]
  - - [4288, 128, 1, 256]
    - [12, 10.484]
  - - [5056, 1024, 1, 1]
    - [59, 0.182]
  - - [32, 3584, 1, 3328]
    - [52, 14.053]
  - - [4288, 2368, 1, 32]
    - [108, 9.129]
  - - [704, 3584, 1, 1]
    - [159, 0.081]
  - - [704, 1856, 1, 3328]
    - [51, 53.203]
  - - [2944, 128, 1, 1280]
    - [136, 24.369]
  - - [1, 2368, 1, 3328]
    - [85, 0.267]
  - - [6784, 704, 1, 32]
    - [163, 6.522]
  - - [4288, 1, 1, 1280]
    - [46, 0.404]
  - - [704, 5888, 1, 256]
    - [7, 29.232]
  - - [2368, 3584, 1, 1280]
    - [9, 62.958]
  - - [64, 448, 1, 256]
    - [46, 0.795]
  - - [1408, 448, 1, 1280]
    - [183, 22.214]
  - - [3584, 5056, 1, 32]
    - [137, 8.925]
  - - [128, 2368, 1, 1]
    - [81, 0.028]
  - - [6784, 1856, 1, 1280]
    - [14, 65.718]
  - - [5056, 5056, 1, 3328]
    - [5, 75.806]
  - - [128, 704, 1, 1280]
    - [44, 8.55]
  - - [128, 2944, 1, 1280]
    - [164, 24.26]
  - - [2368, 5056, 1, 1]
    - [108, 0.231]
  - - [5888, 1408, 1, 256]
    - [82, 34.062]
  - - [2368, 1024, 1, 32]
    - [108, 5.204]
  - - [256, 256, 1, 3328]
    - [46, 11.272]
  - - [64, 4288, 1, 1]
    - [81, 0.027]
  - - [4288, 1024, 1, 256]
    - [111, 30.889]
  - - [3584, 32, 1, 32]
    - [134, 0.394]
  - - [3584, 64, 1, 1]
    - [81, 0.022]
  - - [704, 32, 1, 1280]
    - [87, 1.254]
  - - [32, 4288, 1, 32]
    - [135, 0.48]
  - - [64, 1408, 1, 1]
    - [156, 0.004]
  - - [4288, 5888, 1, 1280]
    - [5, 69.459]
  - - [1856, 2944, 1, 3328]
    - [51, 65.247]
  - - [5056, 5888, 1, 256]
    - [157, 44.697]
  - - [1408, 128, 1, 1280]
    - [21, 13.825]
  - - [5056, 256, 1, 3328]
    - [118, 52.798]
  - - [1024, 5888, 1, 1280]
    - [9, 66.504]
  - - [32, 32, 1, 32]
    - [39, 0.004]
  - - [5056, 1, 1, 1280]
    - [87, 0.259]
  - - [5888, 5056, 1, 1280]
    - [5, 70.565]
  - - [5888, 2944, 1, 1]
    - [82, 0.229]
  - - [64, 4288, 1, 1280]
    - [136, 17.207]
  - - [1408, 4288, 1, 3328]
    - [5, 79.053]
  - - [704, 2944, 1, 32]
    - [108, 5.015]
  - - [1, 5888, 1, 1280]
    - [85, 0.482]
  - - [2944, 4288, 1, 3328]
    - [5, 72.698]
  - - [256, 2944, 1, 256]
    - [58, 13.846]
  - - [704, 448, 1, 32]
    - [81, 1.172]
  - - [5056, 2944, 1, 256]
    - [51, 40.311]
  - - [704, 1024, 1, 256]
    - [7, 13.244]
  - - [2368, 1856, 1, 256]
    - [16, 30.993]
  - - [64, 3584, 1, 1]
    - [135, 0.023]
  - - [2368, 4288, 1, 1280]
    - [9, 65.99]
  - - [3584, 448, 1, 256]
    - [61, 21.948]
  - - [256, 6784, 1, 256]
    - [4, 22.977]
  - - [1024, 1408, 1, 1]
    - [182, 0.054]
  - - [128, 64, 1, 32]
    - [165, 0.033]
  - - [64, 1, 1, 1280]
    - [148, 0.007]
  - - [2368, 32, 1, 32]
    - [134, 0.119]
  - - [2944, 2944, 1, 1]
    - [59, 0.196]
  - - [6784, 3584, 1, 256]
    - [67, 41.227]
  - - [1408, 1856, 1, 256]
    - [16, 25.724]
  - - [128, 1408, 1, 256]
    - [21, 4.296]
  - - [2944, 2944, 1, 32]
    - [115, 7.792]
  - - [2944, 2944, 1, 3328]
    - [5, 82.974]
  - - [1, 2944, 1, 256]
    - [154, 0.074]
  - - [448, 32, 1, 1280]
    - [87, 1.426]
  - - [3584, 1, 1, 256]
    - [44, 0.095]
  - - [704, 32, 1, 3328]
    - [46, 2.597]
  - - [256, 448, 1, 3328]
    - [21, 13.48]
  - - [2368, 64, 1, 256]
    - [85, 1.668]
  - - [64, 448, 1, 1280]
    - [89, 1.548]
  - - [6784, 1408, 1, 32]
    - [137, 7.972]
  - - [1408, 448, 1, 3328]
    - [166, 42.538]
  - - [2368, 6784, 1, 3328]
    - [32, 82.625]
  - - [256, 2368, 1, 1]
    - [134, 0.049]
  - - [4288, 3584, 1, 32]
    - [133, 10.092]
  - - [5888, 64, 1, 3328]
    - [119, 31.468]
  - - [3584, 704, 1, 1280]
    - [4, 54.635]
  - - [448, 5056, 1, 3328]
    - [32, 65.059]
  - - [4288, 448, 1, 256]
    - [58, 21.987]
  - - [5056, 256, 1, 1280]
    - [73, 36.712]
  - - [704, 448, 1, 3328]
    - [164, 31.619]
  - - [2944, 5888, 1, 32]
    - [77, 8.777]
  - - [3584, 5056, 1, 256]
    - [66, 41.513]
  - - [6784, 1, 1, 3328]
    - [112, 0.624]
  - - [32, 2368, 1, 3328]
    - [53, 12.516]
  - - [4288, 256, 1, 1]
    - [108, 0.08]
  - - [1856, 448, 1, 3328]
    - [16, 45.21]
  - - [3584, 2368, 1, 256]
    - [38, 34.369]
  - - [4288, 4288, 1, 256]
    - [20, 42.528]
  - - [4288, 256, 1, 1280]
    - [32, 39.088]
  - - [448, 5056, 1, 256]
    - [16, 24.56]
  - - [128, 1856, 1, 1]
    - [81, 0.022]
  - - [4288, 704, 1, 1280]
    - [118, 52.897]
  - - [128, 1856, 1, 32]
    - [104, 0.349]
  - - [2368, 704, 1, 1]
    - [65, 0.059]
  - - [3584, 32, 1, 256]
    - [52, 1.325]
  - - [448, 2368, 1, 1280]
    - [16, 38.152]
  - - [3584, 256, 1, 1]
    - [149, 0.036]
  - - [1408, 1856, 1, 1280]
    - [28, 57.361]
  - - [3584, 4288, 1, 3328]
    - [5, 74.661]
  - - [448, 4288, 1, 32]
    - [108, 4.617]
  - - [448, 4288, 1, 1280]
    - [16, 44.755]
  - - [64, 3584, 1, 256]
    - [119, 2.528]
  - - [1, 6784, 1, 1280]
    - [85, 0.52]
  - - [5056, 1024, 1, 256]
    - [66, 32.463]
  - - [2368, 448, 1, 32]
    - [142, 1.404]
  - - [4288, 3584, 1, 1280]
    - [5, 68.34]
  - - [32, 2944, 1, 1280]
    - [53, 8.88]
  - - [1408, 704, 1, 1]
    - [107, 0.071]
  - - [2368, 256, 1, 256]
    - [13, 11.657]
  - - [1, 5056, 1, 1]
    - [167, 0.0]
  - - [4288, 32, 1, 32]
    - [107, 0.462]
  - - [1856, 3584, 1, 32]
    - [108, 8.102]
  - - [5056, 3584, 1, 3328]
    - [38, 75.443]
  - - [4288, 5056, 1, 256]
    - [51, 43.184]
  - - [1856, 5888, 1, 256]
    - [51, 38.159]
  - - [256, 256, 1, 256]
    - [21, 0.784]
  - - [2368, 3584, 1, 1]
    - [108, 0.214]
  - - [4288, 2368, 1, 256]
    - [66, 38.084]
  - - [448, 1, 1, 3328]
    - [86, 0.087]
  - - [1856, 256, 1, 1280]
    - [11, 23.875]
  - - [256, 2944, 1, 1]
    - [107, 0.059]
  - - [1408, 2944, 1, 3328]
    - [51, 68.288]
  - - [32, 1856, 1, 32]
    - [135, 0.23]
  - - [5888, 3584, 1, 1]
    - [59, 0.236]
  - - [256, 1, 1, 1]
    - [40, 0.0]
  - - [6784, 5056, 1, 3328]
    - [5, 77.493]
  - - [6784, 5056, 1, 1]
    - [91, 0.253]
  - - [5888, 3584, 1, 32]
    - [115, 8.993]
  - - [5888, 3584, 1, 3328]
    - [38, 76.198]
  - - [32, 1024, 1, 1280]
    - [76, 3.237]
  - - [1, 256, 1, 3328]
    - [76, 0.048]
  - - [1024, 6784, 1, 256]
    - [14, 34.017]
  - - [6784, 5888, 1, 32]
    - [91, 9.83]
  - - [1408, 1, 1, 1280]
    - [46, 0.077]
  - - [2368, 6784, 1, 32]
    - [133, 10.073]
  - - [6784, 64, 1, 1]
    - [33, 0.039]
  - - [5056, 1408, 1, 1280]
    - [118, 64.976]
  - - [3584, 1408, 1, 3328]
    - [94, 79.547]
  - - [2944, 3584, 1, 1]
    - [91, 0.21]
  - - [2944, 1408, 1, 1280]
    - [118, 57.314]
  - - [1856, 64, 1, 1]
    - [140, 0.005]
  - - [3584, 1024, 1, 1]
    - [100, 0.105]
  - - [256, 32, 1, 256]
    - [106, 0.104]
  - - [2944, 1856, 1, 3328]
    - [14, 64.204]
  - - [128, 1024, 1, 3328]
    - [21, 14.803]
  - - [1408, 128, 1, 1]
    - [81, 0.018]
  - - [2944, 3584, 1, 32]
    - [115, 8.128]
  - - [5888, 256, 1, 32]
    - [107, 3.8]
  - - [6784, 64, 1, 256]
    - [21, 8.882]
  - - [6784, 5056, 1, 256]
    - [66, 43.39]
  - - [1408, 32, 1, 3328]
    - [86, 8.007]
  - - [1856, 3584, 1, 1280]
    - [73, 68.296]
  - - [5056, 32, 1, 256]
    - [101, 1.762]
  - - [1024, 4288, 1, 3328]
    - [51, 71.334]
  - - [448, 2368, 1, 256]
    - [16, 17.385]
  - - [64, 1408, 1, 1280]
    - [46, 8.781]
  - - [3584, 32, 1, 1280]
    - [52, 5.566]
  - - [128, 2368, 1, 3328]
    - [136, 28.699]
  - - [64, 5056, 1, 256]
    - [21, 7.235]
  - - [32, 1408, 1, 256]
    - [53, 1.226]
  - - [2368, 448, 1, 3328]
    - [32, 51.659]
  - - [2368, 1408, 1, 1]
    - [110, 0.157]
  - - [1, 1, 1, 1]
    - [167, 0.0]
  - - [1024, 1856, 1, 32]
    - [156, 4.256]
  - - [32, 1024, 1, 32]
    - [40, 0.133]
  - - [4288, 1, 1, 256]
    - [106, 0.109]
  - - [1856, 128, 1, 3328]
    - [119, 23.627]
  - - [5888, 2368, 1, 1]
    - [59, 0.213]
  - - [2368, 2368, 1, 1]
    - [108, 0.186]
  - - [704, 256, 1, 1280]
    - [21, 13.537]
  - - [704, 4288, 1, 256]
    - [58, 27.124]
  - - [5888, 2368, 1, 32]
    - [115, 8.593]
  - - [5888, 2368, 1, 1280]
    - [5, 66.558]
  - - [128, 256, 1, 256]
    - [53, 0.892]
  - - [2944, 5056, 1, 3328]
    - [5, 86.24]
  - - [6784, 704, 1, 3328]
    - [187, 74.471]
  - - [1856, 1856, 1, 32]
    - [108, 6.118]
  - - [4288, 2944, 1, 32]
    - [104, 9.602]
  - - [256, 5056, 1, 1]
    - [104, 0.05]
  - - [704, 64, 1, 256]
    - [46, 1.203]
  - - [256, 2368, 1, 3328]
    - [14, 40.589]
  - - [704, 1, 1, 1]
    - [135, 0.0]
  - - [128, 448, 1, 1280]
    - [46, 5.703]
  - - [5056, 5056, 1, 256]
    - [51, 43.627]
  - - [5888, 256, 1, 256]
    - [61, 21.104]
  - - [5888, 64, 1, 1]
    - [107, 0.034]
  - - [6784, 6784, 1, 256]
    - [9, 44.41]
  - - [2368, 1, 1, 256]
    - [46, 0.061]
  - - [448, 32, 1, 32]
    - [33, 0.024]
  - - [704, 64, 1, 1]
    - [81, 0.005]
  - - [3584, 704, 1, 3328]
    - [4, 66.812]
  - - [4288, 704, 1, 3328]
    - [118, 62.639]
  - - [4288, 2944, 1, 1280]
    - [5, 65.723]
  - - [448, 3584, 1, 256]
    - [73, 21.742]
  - - [704, 32, 1, 256]
    - [46, 0.596]
  - - [6784, 256, 1, 32]
    - [107, 3.963]
  - - [1856, 128, 1, 1]
    - [81, 0.022]
  - - [1856, 32, 1, 32]
    - [81, 0.228]
  - - [6784, 1408, 1, 1280]
    - [5, 63.743]
  - - [2368, 5056, 1, 1280]
    - [5, 64.401]
  - - [704, 1856, 1, 1280]
    - [4, 36.962]
  - - [1408, 1408, 1, 1280]
    - [111, 45.308]
  - - [448, 1024, 1, 3328]
    - [88, 32.032]
  - - [32, 704, 1, 32]
    - [141, 0.086]
  - - [256, 704, 1, 1]
    - [81, 0.017]
  - - [5888, 1856, 1, 32]
    - [115, 8.174]
  - - [5888, 704, 1, 3328]
    - [4, 67.592]
  - - [5056, 1, 1, 256]
    - [44, 0.127]
  - - [448, 6784, 1, 256]
    - [16, 26.644]
  - - [128, 64, 1, 256]
    - [161, 0.223]
  - - [1856, 128, 1, 256]
    - [21, 5.191]
  - - [2944, 5888, 1, 256]
    - [63, 41.525]
  - - [128, 5056, 1, 32]
    - [158, 1.882]
  - - [128, 5056, 1, 1280]
    - [57, 22.784]
  - - [448, 32, 1, 3328]
    - [45, 2.674]
  - - [1856, 1408, 1, 32]
    - [169, 5.234]
  - - [64, 704, 1, 32]
    - [135, 0.179]
  - - [64, 704, 1, 3328]
    - [55, 7.931]
  - - [64, 2368, 1, 32]
    - [158, 0.525]
  - - [5888, 64, 1, 32]
    - [81, 1.213]
  - - [2368, 256, 1, 1]
    - [180, 0.025]
  - - [5888, 64, 1, 1280]
    - [119, 22.643]
  - - [5056, 1, 1, 1]
    - [81, 0.001]
  - - [5888, 2944, 1, 1280]
    - [5, 68.17]
  - - [32, 2368, 1, 256]
    - [53, 2.062]
  - - [256, 1408, 1, 256]
    - [21, 7.534]
  - - [448, 5888, 1, 1]
    - [228, 0.084]
  - - [3584, 1408, 1, 1]
    - [91, 0.182]
  - - [32, 6784, 1, 1280]
    - [85, 13.436]
  - - [32, 6784, 1, 32]
    - [39, 0.725]
  - - [448, 5888, 1, 32]
    - [34, 3.015]
  - - [5056, 704, 1, 1280]
    - [4, 58.664]
  - - [1856, 6784, 1, 1]
    - [170, 0.231]
  - - [5056, 64, 1, 1]
    - [81, 0.03]
  - - [1, 5888, 1, 1]
    - [167, 0.001]
  - - [2368, 1024, 1, 256]
    - [171, 25.712]
  - - [1856, 6784, 1, 32]
    - [133, 9.597]
  - - [1856, 6784, 1, 1280]
    - [9, 67.251]
  - - [64, 3584, 1, 3328]
    - [120, 17.93]
  - - [5888, 5056, 1, 3328]
    - [5, 75.982]
  - - [1, 2944, 1, 3328]
    - [76, 0.518]
  - - [1408, 6784, 1, 32]
    - [107, 8.046]
  - - [32, 5888, 1, 1280]
    - [52, 12.817]
  - - [448, 256, 1, 1]
    - [140, 0.005]
  - - [3584, 5888, 1, 3328]
    - [5, 76.612]
  - - [4288, 1408, 1, 256]
    - [51, 33.747]
  - - [448, 64, 1, 1280]
    - [44, 1.567]
  - - [128, 448, 1, 32]
    - [81, 0.225]
  - - [6784, 2368, 1, 256]
    - [20, 39.467]
  - - [1408, 448, 1, 32]
    - [107, 1.864]
  - - [1856, 1408, 1, 1280]
    - [51, 57.624]
  - - [448, 256, 1, 3328]
    - [21, 13.917]
  - - [1856, 2368, 1, 1]
    - [108, 0.172]
  - - [1408, 5056, 1, 3328]
    - [28, 73.532]
  - - [128, 704, 1, 3328]
    - [46, 14.819]
  - - [5056, 128, 1, 1280]
    - [152, 30.302]
  - - [5056, 4288, 1, 256]
    - [51, 42.654]
  - - [5056, 5056, 1, 32]
    - [133, 10.855]
  - - [1856, 704, 1, 256]
    - [16, 20.153]
  - - [448, 5888, 1, 1280]
    - [73, 56.608]
  - - [128, 6784, 1, 256]
    - [16, 14.997]
  - - [5056, 448, 1, 256]
    - [157, 24.196]
  - - [4288, 5888, 1, 1]
    - [220, 0.26]
  - - [1856, 5056, 1, 1280]
    - [51, 64.167]
  - - [2368, 4288, 1, 1]
    - [108, 0.222]
  - - [2368, 32, 1, 3328]
    - [46, 12.684]
  - - [3584, 1856, 1, 256]
    - [51, 32.74]
  - - [64, 704, 1, 1]
    - [135, 0.005]
  - - [4288, 5888, 1, 32]
    - [133, 10.811]
  - - [4288, 5888, 1, 3328]
    - [5, 74.429]
  - - [1, 1024, 1, 1]
    - [167, 0.0]
  - - [1024, 2944, 1, 3328]
    - [51, 61.667]
  - - [2944, 2368, 1, 256]
    - [5, 31.474]
  - - [1024, 1856, 1, 256]
    - [58, 21.667]
  - - [2944, 64, 1, 3328]
    - [146, 20.185]
  - - [1024, 5888, 1, 32]
    - [137, 7.127]
  - - [1024, 5888, 1, 3328]
    - [9, 80.346]
  - - [5056, 2368, 1, 32]
    - [108, 9.635]
  - - [1408, 2368, 1, 1280]
    - [51, 57.377]
  - - [256, 1, 1, 3328]
    - [86, 0.049]
  - - [128, 1024, 1, 32]
    - [225, 0.19]
  - - [5056, 6784, 1, 3328]
    - [5, 77.517]
  - - [448, 704, 1, 1]
    - [81, 0.029]
  - - [32, 64, 1, 32]
    - [131, 0.008]
  - - [448, 704, 1, 32]
    - [81, 1.043]
  - - [448, 704, 1, 3328]
    - [130, 31.368]
  - - [1408, 2944, 1, 256]
    - [51, 29.089]
  - - [64, 5888, 1, 1]
    - [81, 0.035]
  - - [2368, 128, 1, 32]
    - [135, 0.993]
  - - [2368, 256, 1, 1280]
    - [12, 29.238]
  - - [2368, 128, 1, 3328]
    - [130, 29.751]
  - - [704, 5056, 1, 32]
    - [108, 6.291]
  - - [32, 2368, 1, 32]
    - [72, 0.113]
  - - [1408, 1, 1, 256]
    - [106, 0.037]
  - - [4288, 256, 1, 32]
    - [108, 3.092]
  - - [448, 1408, 1, 1]
    - [18, 0.026]
  - - [5056, 4288, 1, 1280]
    - [5, 69.556]
  - - [1408, 256, 1, 256]
    - [21, 8.059]
  - - [4288, 448, 1, 1]
    - [108, 0.116]
  - - [256, 4288, 1, 32]
    - [182, 1.421]
  - - [1408, 256, 1, 1280]
    - [164, 23.415]
  - - [256, 256, 1, 1]
    - [81, 0.007]
  - - [1408, 1, 1, 1]
    - [35, 0.0]
  - - [448, 1408, 1, 256]
    - [16, 11.814]
  - - [5888, 5888, 1, 1]
    - [91, 0.255]
  - - [128, 2944, 1, 32]
    - [107, 1.161]
  - - [32, 256, 1, 32]
    - [168, 0.014]
  - - [2944, 704, 1, 1280]
    - [4, 46.775]
  - - [1856, 448, 1, 1]
    - [158, 0.065]
  - - [2368, 2944, 1, 1]
    - [108, 0.202]
  - - [5056, 256, 1, 32]
    - [107, 3.333]
  - - [4288, 1, 1, 3328]
    - [46, 0.676]
  - - [5056, 1024, 1, 1280]
    - [38, 63.49]
  - - [704, 704, 1, 1]
    - [35, 0.041]
  - - [1856, 448, 1, 1280]
    - [119, 29.269]
  - - [3584, 6784, 1, 256]
    - [66, 43.857]
  - - [64, 1856, 1, 1280]
    - [52, 9.161]
  - - [1856, 1408, 1, 256]
    - [16, 26.633]
  - - [4288, 4288, 1, 32]
    - [104, 10.294]
  - - [128, 1, 1, 256]
    - [89, 0.004]
  - - [32, 64, 1, 3328]
    - [194, 0.256]
  - - [5888, 448, 1, 1]
    - [77, 0.135]
  - - [128, 5888, 1, 256]
    - [57, 12.939]
  - - [3584, 256, 1, 3328]
    - [20, 44.582]
  - - [5056, 5056, 1, 1280]
    - [5, 70.233]
  - - [6784, 1408, 1, 3328]
    - [38, 82.474]
  - - [448, 2368, 1, 1]
    - [108, 0.081]
  - - [2368, 1, 1, 1280]
    - [55, 0.237]
  - - [32, 3584, 1, 32]
    - [34, 0.167]
  - - [128, 6784, 1, 1]
    - [140, 0.07]
  - - [1, 3584, 1, 1]
    - [167, 0.0]
  - - [5888, 5888, 1, 3328]
    - [5, 77.343]
  - - [256, 2944, 1, 3328]
    - [56, 50.372]
  - - [1, 128, 1, 3328]
    - [202, 0.016]
  - - [32, 256, 1, 256]
    - [89, 0.101]
  - - [5888, 1408, 1, 32]
    - [115, 7.763]
  - - [704, 256, 1, 1]
    - [168, 0.018]
  - - [1, 448, 1, 1]
    - [81, 0.0]
  - - [256, 6784, 1, 3328]
    - [176, 55.717]
  - - [64, 5888, 1, 256]
    - [21, 8.172]
  - - [1856, 1, 1, 1]
    - [81, 0.0]
  - - [704, 704, 1, 256]
    - [36, 9.791]
  - - [448, 1024, 1, 32]
    - [107, 1.464]
  - - [6784, 2368, 1, 1280]
    - [5, 66.305]
  - - [128, 1856, 1, 1280]
    - [21, 15.935]
  - - [256, 2368, 1, 256]
    - [58, 6.39]
  - - [2944, 1408, 1, 1]
    - [91, 0.156]
  - - [6784, 1024, 1, 256]
    - [71, 31.339]
  - - [5056, 1408, 1, 32]
    - [108, 8.415]
  - - [1408, 6784, 1, 3328]
    - [20, 82.067]
  - - [2944, 1408, 1, 3328]
    - [4, 67.312]
  - - [1856, 32, 1, 256]
    - [21, 0.7]
  - - [704, 2368, 1, 32]
    - [108, 4.355]
  - - [448, 256, 1, 32]
    - [134, 0.398]
  - - [704, 6784, 1, 1]
    - [108, 0.183]
  - - [2368, 6784, 1, 256]
    - [171, 41.149]
  - - [1856, 3584, 1, 3328]
    - [73, 78.205]
  - - [1, 704, 1, 3328]
    - [45, 0.133]
  - - [64, 1, 1, 3328]
    - [202, 0.008]
  - - [448, 704, 1, 1280]
    - [21, 21.057]
  - - [704, 1856, 1, 1]
    - [108, 0.094]
  - - [704, 448, 1, 256]
    - [21, 6.944]
  - - [448, 64, 1, 3328]
    - [46, 3.38]
  - - [704, 6784, 1, 256]
    - [16, 31.378]
  - - [256, 32, 1, 1280]
    - [148, 0.826]
  - - [2368, 448, 1, 1280]
    - [16, 37.59]
  - - [6784, 2944, 1, 32]
    - [115, 8.868]
  - - [64, 4288, 1, 32]
    - [81, 0.899]
  - - [128, 704, 1, 1]
    - [140, 0.004]
  - - [128, 448, 1, 3328]
    - [55, 9.863]
  - - [5888, 2368, 1, 3328]
    - [38, 73.466]
  - - [2368, 704, 1, 1280]
    - [58, 42.133]
  - - [1024, 1408, 1, 1280]
    - [4, 45.698]
  - - [4288, 64, 1, 1280]
    - [146, 11.156]
  - - [128, 5056, 1, 1]
    - [206, 0.027]
  - - [2944, 5056, 1, 32]
    - [174, 8.698]
  - - [448, 448, 1, 1]
    - [135, 0.02]
  - - [256, 2368, 1, 1280]
    - [37, 28.948]
  - - [704, 2368, 1, 3328]
    - [176, 56.7]
  - - [3584, 2944, 1, 256]
    - [51, 37.525]
  - - [64, 6784, 1, 256]
    - [21, 9.009]
  - - [3584, 1024, 1, 1280]
    - [38, 57.094]
  - - [1408, 32, 1, 32]
    - [140, 0.072]
  - - [128, 3584, 1, 256]
    - [36, 9.001]
  - - [704, 1408, 1, 1]
    - [107, 0.073]
  - - [5056, 3584, 1, 256]
    - [66, 42.183]
  - - [2368, 704, 1, 256]
    - [28, 22.364]
  - - [1856, 1856, 1, 1280]
    - [68, 56.251]
  - - [32, 5888, 1, 32]
    - [135, 0.641]
  - - [64, 32, 1, 32]
    - [39, 0.008]
  - - [4288, 704, 1, 1]
    - [109, 0.094]
  - - [1856, 1024, 1, 1]
    - [108, 0.113]
  - - [4288, 2944, 1, 3328]
    - [5, 72.765]
  - - [4288, 128, 1, 3328]
    - [88, 38.181]
  - - [4288, 704, 1, 32]
    - [108, 5.883]
  - - [1856, 1024, 1, 32]
    - [108, 4.792]
  - - [1, 448, 1, 3328]
    - [43, 0.083]
  - - [2944, 6784, 1, 1]
    - [95, 0.236]
  - - [6784, 2368, 1, 32]
    - [115, 8.789]
  - - [5888, 5056, 1, 1]
    - [175, 0.247]
  - - [128, 6784, 1, 1280]
    - [57, 27.066]
  - - [704, 5888, 1, 1]
    - [108, 0.168]
  - - [6784, 6784, 1, 1]
    - [95, 0.263]
  - - [1856, 32, 1, 1280]
    - [46, 5.748]
  - - [5888, 448, 1, 3328]
    - [4, 68.4]
  - - [704, 5888, 1, 32]
    - [133, 6.672]
  - - [704, 5888, 1, 1280]
    - [73, 58.491]
  - - [1024, 6784, 1, 3328]
    - [28, 71.934]
  - - [704, 2944, 1, 1280]
    - [16, 47.823]
  - - [4288, 6784, 1, 256]
    - [171, 45.157]
  - - [3584, 256, 1, 32]
    - [107, 2.506]
  - - [1408, 1408, 1, 32]
    - [107, 4.229]
  - - [1408, 1408, 1, 3328]
    - [22, 61.465]
  - - [4288, 64, 1, 32]
    - [135, 0.899]
  - - [1408, 256, 1, 32]
    - [81, 1.15]
  - - [5888, 128, 1, 256]
    - [177, 13.174]
  - - [64, 704, 1, 1280]
    - [44, 4.512]
  - - [2944, 1856, 1, 256]
    - [51, 31.456]
  - - [128, 5056, 1, 3328]
    - [70, 43.177]
  - - [4288, 2944, 1, 1]
    - [108, 0.234]
  - - [6784, 5056, 1, 32]
    - [144, 9.461]
  - - [3584, 128, 1, 1]
    - [81, 0.039]
  - - [2944, 4288, 1, 1280]
    - [5, 65.841]
  - - [64, 32, 1, 3328]
    - [202, 0.26]
  - - [1024, 4288, 1, 256]
    - [51, 30.444]
  - - [128, 2368, 1, 256]
    - [21, 6.335]
  - - [2368, 64, 1, 32]
    - [107, 0.515]
  - - [1408, 1, 1, 3328]
    - [86, 0.264]
  - - [64, 1408, 1, 32]
    - [140, 0.136]
  - - [2368, 5888, 1, 1]
    - [108, 0.237]
  - - [1408, 1856, 1, 32]
    - [156, 5.012]
  - - [448, 1856, 1, 256]
    - [16, 15.178]
  - - [1856, 6784, 1, 3328]
    - [73, 74.044]
  - - [3584, 128, 1, 256]
    - [105, 8.88]
  - - [1024, 2368, 1, 32]
    - [137, 2.731]
  - - [32, 2944, 1, 256]
    - [89, 2.426]
  - - [128, 5888, 1, 1]
    - [107, 0.061]
  - - [64, 5056, 1, 1]
    - [135, 0.03]
  - - [1856, 256, 1, 32]
    - [107, 1.49]
  - - [2368, 2368, 1, 3328]
    - [14, 66.138]
  - - [64, 448, 1, 1]
    - [135, 0.003]
  - - [3584, 5888, 1, 32]
    - [137, 9.025]
  - - [3584, 5888, 1, 1280]
    - [5, 69.592]
  - - [64, 5056, 1, 32]
    - [81, 1.09]
  - - [2944, 64, 1, 1]
    - [135, 0.019]
  - - [6784, 704, 1, 256]
    - [28, 27.663]
  - - [3584, 1024, 1, 32]
    - [107, 6.126]
  - - [1408, 704, 1, 32]
    - [107, 2.836]
  - - [1408, 704, 1, 1280]
    - [7, 30.916]
  - - [2368, 5888, 1, 256]
    - [157, 40.621]
  - - [2944, 64, 1, 32]
    - [81, 0.653]
  - - [1, 1408, 1, 256]
    - [85, 0.017]
  - - [64, 2944, 1, 256]
    - [150, 4.348]
  - - [5888, 5888, 1, 32]
    - [138, 9.615]
  - - [1856, 1408, 1, 3328]
    - [28, 68.809]
  - - [4288, 1024, 1, 1]
    - [104, 0.168]
  - - [704, 4288, 1, 3328]
    - [28, 62.157]
  - - [2944, 5056, 1, 1280]
    - [5, 65.967]
  - - [6784, 2944, 1, 1280]
    - [5, 68.822]
  - - [6784, 256, 1, 3328]
    - [38, 51.246]
  - - [5056, 128, 1, 3328]
    - [70, 44.361]
  - - [128, 4288, 1, 1]
    - [107, 0.046]
  - - [1408, 5056, 1, 32]
    - [107, 7.461]
  - - [2944, 128, 1, 3328]
    - [119, 29.803]
  - - [5888, 1856, 1, 1280]
    - [5, 63.445]
  - - [5888, 256, 1, 1280]
    - [4, 45.571]
  - - [1856, 5056, 1, 1]
    - [108, 0.223]
  - - [3584, 1856, 1, 1280]
    - [14, 60.068]
  - - [6784, 448, 1, 256]
    - [51, 25.262]
  - - [704, 3584, 1, 256]
    - [57, 25.624]
  - - [1856, 5056, 1, 32]
    - [104, 8.927]
  - - [1856, 5056, 1, 3328]
    - [9, 80.609]
  - - [1024, 2944, 1, 32]
    - [153, 5.302]
  - - [1408, 6784, 1, 256]
    - [4, 36.49]
  - - [1024, 2368, 1, 1280]
    - [28, 53.634]
  - - [1856, 3584, 1, 1]
    - [180, 0.2]
  - - [5888, 128, 1, 1280]
    - [4, 35.519]
  - - [2944, 5888, 1, 1280]
    - [5, 69.056]
  - - [1, 1856, 1, 1]
    - [167, 0.0]
  - - [3584, 3584, 1, 256]
    - [63, 39.204]
  - - [1856, 2368, 1, 3328]
    - [9, 62.994]
  - - [5888, 704, 1, 256]
    - [61, 24.618]
  - - [64, 448, 1, 32]
    - [81, 0.115]
  - - [6784, 4288, 1, 256]
    - [66, 42.742]
  - - [128, 64, 1, 3328]
    - [45, 1.528]
  - - [1, 5056, 1, 1280]
    - [85, 0.434]
  - - [32, 64, 1, 1280]
    - [86, 0.208]
  - - [1408, 2368, 1, 3328]
    - [51, 67.832]
  - - [2944, 128, 1, 256]
    - [21, 8.051]
  - - [6784, 128, 1, 1]
    - [158, 0.066]
  - - [1408, 256, 1, 3328]
    - [119, 34.654]
  - - [448, 32, 1, 256]
    - [78, 0.39]
  - - [1, 5888, 1, 256]
    - [154, 0.142]
  - - [64, 2368, 1, 256]
    - [21, 3.525]
  - - [2944, 256, 1, 256]
    - [16, 13.418]
  - - [1, 128, 1, 256]
    - [45, 0.003]
  - - [32, 256, 1, 1280]
    - [89, 0.467]
  - - [5888, 1, 1, 256]
    - [55, 0.143]
  - - [32, 128, 1, 3328]
    - [86, 0.78]
  - - [6784, 128, 1, 256]
    - [7, 14.819]
  - - [6784, 64, 1, 1280]
    - [30, 15.148]
  - - [4288, 1024, 1, 32]
    - [133, 6.68]
  - - [1408, 64, 1, 3328]
    - [44, 14.884]
  - - [2944, 448, 1, 1280]
    - [14, 36.306]
  - - [6784, 32, 1, 1280]
    - [55, 13.21]
  - - [2944, 64, 1, 1280]
    - [21, 14.006]
  - - [704, 448, 1, 1]
    - [140, 0.013]
  - - [32, 128, 1, 32]
    - [131, 0.016]
  - - [1, 128, 1, 1]
    - [1, 0.0]
  - - [5888, 1, 1, 1]
    - [81, 0.001]
  - - [5888, 1856, 1, 3328]
    - [38, 70.38]
  - - [2368, 3584, 1, 256]
    - [51, 36.318]
  - - [4288, 1408, 1, 3328]
    - [5, 78.999]
  - - [1856, 32, 1, 3328]
    - [87, 6.605]
  - - [2944, 32, 1, 256]
    - [87, 2.303]
  - - [128, 64, 1, 1]
    - [81, 0.001]
  - - [32, 448, 1, 256]
    - [154, 0.179]
  - - [1856, 64, 1, 3328]
    - [21, 13.918]
  - - [256, 5056, 1, 256]
    - [4, 11.062]
  - - [5888, 2944, 1, 3328]
    - [5, 76.214]
  - - [2368, 1408, 1, 3328]
    - [118, 67.248]
  - - [5888, 704, 1, 32]
    - [107, 6.253]
  - - [2944, 704, 1, 1]
    - [116, 0.07]
  - - [6784, 1856, 1, 256]
    - [20, 38.227]
  - - [1, 704, 1, 256]
    - [44, 0.018]
  - - [1856, 1856, 1, 1]
    - [139, 0.155]
  - - [5888, 32, 1, 256]
    - [145, 4.313]
  - - [128, 704, 1, 256]
    - [21, 1.054]
  - - [256, 1408, 1, 3328]
    - [130, 34.565]
  - - [2944, 128, 1, 1]
    - [81, 0.034]
  - - [32, 256, 1, 3328]
    - [86, 1.583]
  - - [2944, 704, 1, 3328]
    - [4, 56.109]
  - - [704, 1024, 1, 32]
    - [107, 2.113]
  - - [2368, 1856, 1, 32]
    - [108, 6.772]
  - - [5056, 4288, 1, 3328]
    - [38, 74.77]
  - - [3584, 448, 1, 3328]
    - [14, 60.811]
  - - [256, 32, 1, 32]
    - [39, 0.034]
  - - [256, 6784, 1, 1]
    - [116, 0.058]
  - - [256, 6784, 1, 32]
    - [107, 4.119]
  - - [2944, 1408, 1, 32]
    - [107, 6.387]
  - - [4288, 3584, 1, 1]
    - [108, 0.239]
  - - [1, 704, 1, 1]
    - [81, 0.0]
  - - [5056, 448, 1, 3328]
    - [38, 65.579]
  - - [3584, 64, 1, 256]
    - [21, 5.089]
  - - [64, 1856, 1, 32]
    - [140, 0.416]
  - - [64, 1856, 1, 3328]
    - [21, 13.497]
  - - [6784, 3584, 1, 32]
    - [82, 9.122]
  - - [4288, 1856, 1, 256]
    - [51, 36.435]
  - - [1856, 2944, 1, 256]
    - [57, 32.697]
  - - [128, 448, 1, 1]
    - [135, 0.006]
  - - [704, 1, 1, 1280]
    - [49, 0.071]
  - - [2944, 5888, 1, 1]
    - [91, 0.228]
  - - [1024, 1856, 1, 3328]
    - [176, 57.376]
  - - [5888, 1024, 1, 32]
    - [174, 7.104]
  - - [3584, 256, 1, 1280]
    - [16, 32.59]
  - - [1408, 5056, 1, 1280]
    - [28, 64.204]
  - - [3584, 128, 1, 1280]
    - [12, 23.295]
  - - [5056, 6784, 1, 256]
    - [171, 45.569]
  - - [256, 1856, 1, 256]
    - [12, 9.387]
  - - [5888, 32, 1, 1280]
    - [101, 12.878]
  - - [32, 1856, 1, 1280]
    - [53, 5.826]
  - - [2944, 5056, 1, 1]
    - [175, 0.215]
  - - [448, 128, 1, 1]
    - [81, 0.006]
  - - [256, 704, 1, 32]
    - [158, 0.613]
  - - [256, 704, 1, 1280]
    - [21, 13.608]
  - - [1, 2368, 1, 1]
    - [167, 0.0]
  - - [5888, 5888, 1, 1280]
    - [5, 71.444]
  - - [256, 2944, 1, 1280]
    - [28, 25.611]
  - - [2944, 256, 1, 3328]
    - [88, 50.734]
  - - [5056, 2944, 1, 1280]
    - [31, 66.375]
  - - [704, 1024, 1, 3328]
    - [51, 45.375]
  - - [2368, 1856, 1, 1280]
    - [20, 55.793]
  - - [448, 2944, 1, 1]
    - [108, 0.096]
  - - [6784, 2944, 1, 1]
    - [91, 0.235]
  - - [2944, 1024, 1, 32]
    - [107, 5.434]
  - - [2944, 1024, 1, 1280]
    - [31, 51.756]
  - - [1408, 64, 1, 32]
    - [137, 0.137]
  - - [5056, 5056, 1, 1]
    - [108, 0.259]
  - - [2368, 4288, 1, 256]
    - [171, 38.283]
  - - [448, 1856, 1, 1280]
    - [16, 37.708]
  - - [2368, 448, 1, 1]
    - [108, 0.08]
  - - [448, 2944, 1, 32]
    - [108, 3.496]
  - - [448, 2944, 1, 1280]
    - [118, 36.945]
  - - [2944, 6784, 1, 1280]
    - [5, 69.621]
  - - [256, 6784, 1, 1280]
    - [51, 52.396]
  - - [128, 2368, 1, 1280]
    - [21, 19.341]
  - - [3584, 2368, 1, 32]
    - [115, 7.806]
  - - [704, 32, 1, 32]
    - [81, 0.088]
  - - [6784, 3584, 1, 3328]
    - [5, 85.845]
  - - [128, 32, 1, 256]
    - [46, 0.11]
  - - [128, 1408, 1, 1280]
    - [21, 13.329]
  - - [64, 32, 1, 1280]
    - [43, 0.205]
  - - [128, 1856, 1, 3328]
    - [136, 19.604]
  - - [2944, 2944, 1, 256]
    - [157, 33.912]
  - - [1408, 1024, 1, 3328]
    - [51, 56.667]
  - - [5056, 2368, 1, 1280]
    - [71, 64.067]
  - - [448, 128, 1, 32]
    - [81, 0.225]
  - - [2368, 64, 1, 3328]
    - [146, 13.826]
  - - [32, 5056, 1, 3328]
    - [52, 17.185]
  - - [448, 2944, 1, 3328]
    - [51, 54.107]
  - - [2944, 1024, 1, 1]
    - [181, 0.134]
  - - [2368, 128, 1, 1280]
    - [164, 19.602]
  - - [3584, 704, 1, 256]
    - [7, 25.008]
  - - [2368, 5888, 1, 3328]
    - [5, 81.88]
  - - [4288, 2368, 1, 1]
    - [108, 0.221]
  - - [1408, 3584, 1, 32]
    - [107, 6.84]
  - - [2944, 4288, 1, 32]
    - [115, 8.555]
  - - [5888, 1408, 1, 1280]
    - [38, 62.236]
  - - [3584, 5056, 1, 1280]
    - [5, 68.769]
  - - [5888, 6784, 1, 1280]
    - [5, 72.041]
  - - [64, 1856, 1, 1]
    - [135, 0.012]
  - - [704, 128, 1, 32]
    - [158, 0.319]
  - - [3584, 2944, 1, 1]
    - [95, 0.212]
  - - [128, 3584, 1, 3328]
    - [88, 31.274]
  - - [256, 4288, 1, 3328]
    - [9, 51.003]
  - - [4288, 64, 1, 1]
    - [81, 0.026]
  - - [1, 1408, 1, 1280]
    - [85, 0.075]
  - - [5056, 32, 1, 1280]
    - [145, 11.844]
  - - [1856, 704, 1, 32]
    - [108, 3.438]
  - - [1024, 1856, 1, 1]
    - [108, 0.104]
  - - [704, 5056, 1, 3328]
    - [73, 71.332]
  - - [5888, 256, 1, 3328]
    - [4, 56.744]
  - - [1856, 1408, 1, 1]
    - [108, 0.138]
  - - [2944, 448, 1, 32]
    - [149, 1.611]
  - - [128, 448, 1, 256]
    - [53, 1.606]
  - - [128, 1024, 1, 1]
    - [81, 0.013]
  - - [32, 32, 1, 256]
    - [86, 0.027]
  - - [4288, 5056, 1, 1280]
    - [5, 69.217]
  - - [1856, 1856, 1, 3328]
    - [9, 71.755]
  - - [1024, 2368, 1, 256]
    - [47, 17.153]
  - - [4288, 2368, 1, 3328]
    - [38, 73.343]
  - - [1, 1024, 1, 1280]
    - [45, 0.105]
  - - [5056, 128, 1, 32]
    - [107, 1.944]
  - - [5888, 3584, 1, 256]
    - [66, 41.575]
  - - [1024, 5056, 1, 32]
    - [107, 6.837]
  - - [5888, 448, 1, 1280]
    - [4, 56.19]
  - - [704, 5888, 1, 3328]
    - [73, 68.168]
  - - [1024, 1408, 1, 256]
    - [61, 20.187]
  - - [3584, 2944, 1, 1280]
    - [5, 66.592]
  - - [1, 5056, 1, 256]
    - [85, 0.125]
  - - [32, 32, 1, 3328]
    - [202, 0.129]
  - - [2368, 1, 1, 3328]
    - [55, 0.267]
  - - [4288, 1856, 1, 1280]
    - [14, 63.34]
  - - [3584, 5888, 1, 1]
    - [95, 0.238]
  - - [5888, 4288, 1, 256]
    - [66, 42.61]
  - - [1024, 2944, 1, 1280]
    - [51, 52.697]
  - - [6784, 1, 1, 1]
    - [131, 0.001]
  - - [1408, 64, 1, 1280]
    - [46, 8.663]
  - - [1, 256, 1, 1280]
    - [87, 0.025]
  - - [2944, 3584, 1, 256]
    - [66, 36.256]
  - - [1, 128, 1, 1280]
    - [76, 0.013]
  - - [5888, 1, 1, 1280]
    - [46, 0.491]
  - - [2368, 32, 1, 1280]
    - [44, 7.434]
  - - [5888, 1856, 1, 1]
    - [77, 0.198]
  - - [6784, 128, 1, 1280]
    - [57, 25.353]
  - - [6784, 2368, 1, 3328]
    - [5, 86.09]
  - - [1, 64, 1, 256]
    - [41, 0.002]
  - - [704, 128, 1, 1]
    - [140, 0.004]
  - - [1408, 4288, 1, 32]
    - [107, 7.208]
  - - [256, 448, 1, 256]
    - [52, 2.757]
  - - [1856, 1024, 1, 1280]
    - [16, 44.712]
  - - [5888, 1856, 1, 256]
    - [157, 35.921]
  - - [5056, 1856, 1, 1]
    - [108, 0.22]
  - - [5888, 2368, 1, 256]
    - [38, 38.01]
  - - [1408, 1024, 1, 32]
    - [107, 3.536]
  - - [32, 704, 1, 256]
    - [154, 0.284]
  - - [2944, 1, 1, 256]
    - [44, 0.035]
  - - [32, 4288, 1, 256]
    - [150, 3.298]
  - - [5056, 1856, 1, 32]
    - [133, 8.998]
  - - [5056, 1856, 1, 1280]
    - [118, 64.596]
  - - [1, 64, 1, 1]
    - [165, 0.0]
  - - [1408, 5888, 1, 3328]
    - [9, 69.016]
  - - [1408, 704, 1, 3328]
    - [20, 46.342]
  - - [5056, 704, 1, 3328]
    - [4, 70.727]
  - - [704, 64, 1, 1280]
    - [46, 2.441]
  - - [1, 704, 1, 1280]
    - [45, 0.04]
  - - [5888, 6784, 1, 1]
    - [91, 0.262]
  - - [5888, 4288, 1, 32]
    - [115, 9.148]
  - - [1408, 3584, 1, 256]
    - [95, 31.099]
  - - [1856, 704, 1, 1]
    - [133, 0.094]
  - - [6784, 256, 1, 1]
    - [182, 0.106]
  - - [2944, 1, 1, 1]
    - [81, 0.0]
  - - [256, 1856, 1, 3328]
    - [183, 32.689]
  - - [4288, 128, 1, 1280]
    - [12, 26.561]
  - - [6784, 256, 1, 1280]
    - [118, 50.905]
  - - [128, 4288, 1, 256]
    - [105, 10.484]
  - - [128, 1408, 1, 32]
    - [104, 0.273]
  - - [6784, 128, 1, 32]
    - [107, 2.505]
  - - [1408, 448, 1, 1]
    - [108, 0.025]
  - - [2368, 704, 1, 3328]
    - [176, 55.446]
  - - [704, 128, 1, 3328]
    - [44, 15.084]
  - - [2944, 1856, 1, 32]
    - [107, 6.912]
  - - [1408, 32, 1, 1280]
    - [44, 2.46]
  - - [704, 1, 1, 256]
    - [184, 0.019]
  - - [2368, 1408, 1, 256]
    - [70, 28.62]
  - - [2368, 1856, 1, 1]
    - [80, 0.116]
  - - [4288, 1408, 1, 1]
    - [108, 0.195]
  - - [3584, 2368, 1, 1280]
    - [5, 63.251]
  - - [64, 5056, 1, 1280]
    - [119, 20.028]
  - - [1408, 2944, 1, 1]
    - [185, 0.153]
  - - [4288, 1408, 1, 32]
    - [108, 7.887]
  - - [5888, 2944, 1, 256]
    - [66, 40.352]
  - - [128, 64, 1, 1280]
    - [86, 0.85]
  - - [1408, 2944, 1, 32]
    - [80, 3.891]
  - - [1, 3584, 1, 1280]
    - [85, 0.19]
  - - [448, 1408, 1, 32]
    - [133, 0.84]
  - - [128, 5056, 1, 256]
    - [16, 6.169]
  - - [1, 1, 1, 1280]
    - [85, 0.0]
  - - [64, 704, 1, 256]
    - [85, 0.562]
  - - [5888, 6784, 1, 256]
    - [66, 44.534]
  - - [6784, 5888, 1, 1]
    - [91, 0.261]
  - - [64, 4288, 1, 256]
    - [21, 5.863]
  - - [1, 448, 1, 1280]
    - [76, 0.045]
  - - [6784, 5888, 1, 1280]
    - [5, 71.425]
  - - [1024, 4288, 1, 32]
    - [107, 6.409]
  - - [1856, 1, 1, 1280]
    - [86, 0.183]
  - - [3584, 5888, 1, 256]
    - [63, 41.976]
  - - [5056, 2368, 1, 1]
    - [108, 0.232]
  - - [256, 1408, 1, 1280]
    - [21, 23.414]
  - - [64, 5888, 1, 3328]
    - [119, 31.329]
  - - [6784, 64, 1, 3328]
    - [98, 25.151]
  - - [5056, 448, 1, 1]
    - [108, 0.128]
  - - [2944, 448, 1, 3328]
    - [118, 53.299]
  - - [2368, 1024, 1, 1280]
    - [51, 51.817]
  - - [1856, 6784, 1, 256]
    - [171, 40.486]
  - - [4288, 32, 1, 1280]
    - [52, 10.253]
  - - [448, 1408, 1, 1280]
    - [152, 29.923]
  - - [5056, 448, 1, 32]
    - [108, 4.89]
  - - [3584, 2944, 1, 32]
    - [137, 8.128]
  - - [2368, 128, 1, 1]
    - [168, 0.028]
  - - [32, 128, 1, 1280]
    - [86, 0.431]
  - - [3584, 1856, 1, 32]
    - [115, 7.245]
  - - [5056, 64, 1, 256]
    - [21, 7.07]
  - - [64, 448, 1, 3328]
    - [46, 3.412]
  - - [4288, 1408, 1, 1280]
    - [5, 65.331]
  - - [6784, 2368, 1, 1]
    - [59, 0.222]
  - - [32, 5056, 1, 256]
    - [52, 3.857]
  - - [704, 128, 1, 256]
    - [46, 2.363]
  - - [704, 5056, 1, 1]
    - [139, 0.156]
  - - [2368, 128, 1, 256]
    - [21, 6.524]
  - - [32, 64, 1, 256]
    - [161, 0.056]
  - - [2368, 1408, 1, 1280]
    - [118, 57.377]
  - - [128, 256, 1, 32]
    - [35, 0.131]
  - - [64, 6784, 1, 32]
    - [81, 1.449]
  - - [6784, 32, 1, 256]
    - [21, 4.604]
  - - [256, 4288, 1, 1]
    - [149, 0.043]
  - - [5888, 1408, 1, 1]
    - [59, 0.19]
  - - [1024, 4288, 1, 1280]
    - [51, 61.359]
  - - [1856, 4288, 1, 1]
    - [18, 0.209]
  - - [128, 2944, 1, 256]
    - [21, 8.297]
  - - [3584, 4288, 1, 256]
    - [66, 40.624]
  - - [2368, 2944, 1, 256]
    - [67, 32.426]
  - - [3584, 128, 1, 32]
    - [81, 1.464]
  - - [3584, 128, 1, 3328]
    - [152, 32.333]
  - - [704, 5056, 1, 256]
    - [31, 28.677]
  - - [1856, 4288, 1, 32]
    - [108, 8.642]
  - - [4288, 1024, 1, 1280]
    - [118, 61.418]
  - - [1, 4288, 1, 256]
    - [154, 0.107]
  - - [64, 2368, 1, 1]
    - [81, 0.016]
  - - [4288, 6784, 1, 32]
    - [133, 10.993]
  - - [704, 704, 1, 3328]
    - [73, 33.483]
  - - [128, 2944, 1, 1]
    - [81, 0.035]
  - - [3584, 1408, 1, 256]
    - [38, 31.988]
  - - [704, 3584, 1, 3328]
    - [73, 67.048]
  - - [5056, 448, 1, 1280]
    - [5, 50.96]
  - - [1408, 2944, 1, 1280]
    - [51, 58.377]
  - - [5888, 704, 1, 1280]
    - [4, 57.095]
  - - [704, 1408, 1, 1280]
    - [16, 35.648]
  - - [4288, 5888, 1, 256]
    - [66, 43.841]
  - - [6784, 64, 1, 32]
    - [81, 1.41]
  - - [3584, 3584, 1, 3328]
    - [5, 74.153]
  - - [2944, 6784, 1, 32]
    - [137, 8.978]
  - - [448, 64, 1, 32]
    - [81, 0.111]
  - - [5056, 256, 1, 1]
    - [77, 0.047]
  - - [64, 6784, 1, 1280]
    - [151, 15.224]
  - - [2944, 2368, 1, 3328]
    - [5, 78.452]
  - - [1, 4288, 1, 1]
    - [167, 0.0]
  - - [1408, 128, 1, 256]
    - [52, 4.192]
  - - [1024, 1856, 1, 1280]
    - [16, 44.566]
  - - [448, 5888, 1, 256]
    - [16, 26.789]
  - - [1024, 5888, 1, 256]
    - [4, 29.364]
  - - [704, 1408, 1, 256]
    - [118, 9.065]
  - - [6784, 2944, 1, 3328]
    - [5, 76.367]
  - - [1408, 2368, 1, 256]
    - [4, 27.398]
  - - [5888, 32, 1, 3328]
    - [44, 18.255]
  - - [1408, 5056, 1, 256]
    - [51, 34.683]
  - - [1024, 1408, 1, 32]
    - [77, 1.749]
  - - [4288, 128, 1, 32]
    - [107, 1.721]
  - - [6784, 704, 1, 1]
    - [162, 0.168]
  - - [448, 704, 1, 256]
    - [21, 6.944]
  - - [704, 3584, 1, 32]
    - [107, 2.839]
  - - [1856, 256, 1, 3328]
    - [152, 33.238]
  - - [448, 1024, 1, 1280]
    - [105, 16.676]
  - - [4288, 4288, 1, 1]
    - [108, 0.246]
  - - [5056, 2944, 1, 1]
    - [83, 0.222]
  - - [64, 2368, 1, 3328]
    - [21, 16.519]
  - - [256, 704, 1, 3328]
    - [21, 20.415]
  - - [1, 2944, 1, 1]
    - [167, 0.0]
  - - [3584, 1, 1, 1]
    - [81, 0.0]
  - - [256, 2944, 1, 32]
    - [107, 2.246]
  - - [6784, 4288, 1, 3328]
    - [5, 77.056]
  - - [5056, 2944, 1, 3328]
    - [5, 72.51]
  - - [704, 1024, 1, 1280]
    - [88, 34.086]
  - - [2368, 1856, 1, 3328]
    - [9, 62.54]
  - - [1856, 4288, 1, 1280]
    - [73, 63.691]
  - - [1, 1024, 1, 256]
    - [154, 0.026]
  - - [3584, 448, 1, 1]
    - [182, 0.103]
  - - [2944, 1024, 1, 3328]
    - [118, 60.902]
  - - [32, 1408, 1, 3328]
    - [53, 7.894]
  - - [128, 1, 1, 3328]
    - [201, 0.017]
  - - [5888, 5056, 1, 32]
    - [144, 9.309]
  - - [704, 2944, 1, 1]
    - [139, 0.068]
  - - [3584, 448, 1, 32]
    - [107, 3.859]
  - - [3584, 448, 1, 1280]
    - [4, 48.954]
  - - [2944, 6784, 1, 3328]
    - [5, 76.861]
  - - [1856, 2368, 1, 1280]
    - [20, 55.842]
  - - [6784, 1024, 1, 1280]
    - [38, 66.765]
  - - [6784, 3584, 1, 1280]
    - [5, 69.091]
  - - [1, 5056, 1, 3328]
    - [85, 0.724]
  - - [128, 2368, 1, 32]
    - [158, 0.413]
  - - [128, 1408, 1, 3328]
    - [21, 19.993]
  - - [2944, 32, 1, 3328]
    - [46, 15.292]
  - - [704, 1856, 1, 256]
    - [16, 20.706]
  - - [1408, 1408, 1, 1]
    - [77, 0.065]
  - - [1408, 4288, 1, 256]
    - [51, 33.106]
  - - [256, 5056, 1, 3328]
    - [28, 51.843]
  - - [2368, 64, 1, 1280]
    - [21, 11.324]
  - - [1856, 448, 1, 32]
    - [134, 2.417]
  - - [1408, 448, 1, 256]
    - [16, 5.992]
  - - [32, 128, 1, 256]
    - [45, 0.109]
  - - [448, 1024, 1, 1]
    - [170, 0.018]
  - - [128, 1024, 1, 1280]
    - [21, 6.164]
  - - [448, 6784, 1, 1]
    - [108, 0.155]
  - - [704, 2944, 1, 256]
    - [57, 24.007]
  - - [1408, 1408, 1, 256]
    - [7, 21.659]
  - - [448, 6784, 1, 32]
    - [223, 3.113]
  - - [1, 64, 1, 1280]
    - [76, 0.006]
  - - [1408, 1856, 1, 1]
    - [77, 0.14]
  - - [4288, 448, 1, 32]
    - [108, 4.587]
  - - [4288, 448, 1, 1280]
    - [47, 44.325]
  - - [2944, 704, 1, 32]
    - [156, 4.396]
  - - [1024, 704, 1, 256]
    - [177, 12.995]
  - - [448, 4288, 1, 1]
    - [108, 0.122]
  - - [3584, 5056, 1, 1]
    - [59, 0.23]
  - - [1408, 3584, 1, 1280]
    - [9, 60.949]
  - - [6784, 448, 1, 1280]
    - [187, 51.287]
  - - [3584, 5056, 1, 3328]
    - [5, 75.409]
  - - [2368, 2368, 1, 32]
    - [104, 7.6]
  - - [64, 5888, 1, 32]
    - [81, 1.171]
  - - [1856, 448, 1, 256]
    - [16, 14.988]
  - - [128, 1024, 1, 256]
    - [52, 3.0]
  - - [3584, 64, 1, 3328]
    - [119, 22.223]
  - - [5888, 2944, 1, 32]
    - [174, 8.765]
  - - [2944, 1, 1, 1280]
    - [46, 0.283]
  - - [1856, 2944, 1, 32]
    - [108, 7.636]
  - - [5056, 1408, 1, 1]
    - [108, 0.203]
  - - [5888, 1408, 1, 3328]
    - [38, 68.604]
  - - [448, 4288, 1, 256]
    - [16, 22.163]
  - - [6784, 1024, 1, 1]
    - [185, 0.155]
  - - [256, 448, 1, 1]
    - [134, 0.005]
  - - [128, 5888, 1, 3328]
    - [56, 49.403]
  - - [6784, 1024, 1, 32]
    - [137, 7.388]
  - - [256, 448, 1, 32]
    - [174, 0.174]
  - - [6784, 3584, 1, 1]
    - [91, 0.243]
  - - [2944, 2368, 1, 32]
    - [115, 7.243]
  - - [3584, 6784, 1, 3328]
    - [5, 85.934]
  - - [448, 128, 1, 1280]
    - [44, 5.664]
  - - [64, 3584, 1, 32]
    - [81, 0.759]
  - - [64, 3584, 1, 1280]
    - [21, 14.572]
  - - [6784, 1408, 1, 256]
    - [20, 35.548]
  - - [5056, 1024, 1, 32]
    - [108, 7.588]
  - - [1024, 5056, 1, 1280]
    - [20, 61.91]
  - - [4288, 3584, 1, 256]
    - [66, 41.464]
  - - [2368, 256, 1, 3328]
    - [88, 41.478]
  - - [448, 6784, 1, 1280]
    - [73, 51.572]
  - - [1856, 5888, 1, 1]
    - [108, 0.226]
  - - [3584, 1, 1, 3328]
    - [46, 0.603]
  - - [4288, 32, 1, 256]
    - [145, 3.244]
  - - [4288, 5056, 1, 32]
    - [104, 10.62]
  - - [4288, 5056, 1, 3328]
    - [38, 74.756]
  - - [1856, 5888, 1, 32]
    - [133, 9.249]
  - - [1856, 5888, 1, 1280]
    - [9, 64.801]
  - - [256, 256, 1, 1280]
    - [46, 6.386]
  - - [704, 2368, 1, 1280]
    - [16, 40.511]
  - - [4288, 2368, 1, 1280]
    - [5, 65.694]
  - - [2944, 5056, 1, 256]
    - [9, 40.123]
  - - [32, 1856, 1, 256]
    - [53, 1.616]
  - - [64, 5888, 1, 1280]
    - [119, 22.643]
  - - [1, 1856, 1, 1280]
    - [85, 0.098]
  - - [2944, 4288, 1, 1]
    - [175, 0.21]
  - - [5056, 5888, 1, 32]
    - [104, 11.053]
  - - [704, 1, 1, 3328]
    - [86, 0.133]
  - - [448, 256, 1, 1280]
    - [192, 5.544]
  - - [1408, 256, 1, 1]
    - [81, 0.032]
  - - [2368, 5056, 1, 3328]
    - [14, 71.999]
  - - [1024, 5056, 1, 3328]
    - [20, 72.327]
  - - [704, 704, 1, 1280]
    - [105, 24.229]
  - - [128, 32, 1, 3328]
    - [201, 0.493]
  - - [1024, 6784, 1, 32]
    - [107, 7.476]
  - - [3584, 2944, 1, 3328]
    - [9, 74.337]
  - - [128, 1856, 1, 256]
    - [21, 5.271]
  - - [32, 32, 1, 1280]
    - [148, 0.103]
  - - [1408, 5888, 1, 1]
    - [59, 0.19]
  - - [1, 3584, 1, 256]
    - [154, 0.091]
  - - [704, 4288, 1, 32]
    - [108, 5.915]
  - - [1408, 5888, 1, 32]
    - [107, 7.804]
  - - [6784, 1024, 1, 3328]
    - [5, 77.506]
  - - [1856, 1, 1, 3328]
    - [86, 0.341]
  - - [5056, 1408, 1, 256]
    - [66, 32.534]
  - - [1, 1, 1, 256]
    - [179, 0.0]
  - - [2944, 1408, 1, 256]
    - [28, 24.413]
  - - [4288, 1, 1, 1]
    - [81, 0.0]
  - - [2368, 2368, 1, 256]
    - [16, 33.074]
  - - [1, 448, 1, 256]
    - [85, 0.012]
  - - [1408, 6784, 1, 1]
    - [95, 0.199]
  - - [3584, 32, 1, 3328]
    - [145, 13.695]
  - - [128, 3584, 1, 1]
    - [33, 0.039]
  - - [1856, 1, 1, 256]
    - [55, 0.05]
  - - [6784, 6784, 1, 1280]
    - [5, 72.457]
  - - [1024, 5888, 1, 1]
    - [65, 0.171]
  - - [6784, 32, 1, 3328]
    - [44, 19.999]
  - - [1408, 32, 1, 256]
    - [44, 1.215]
  - - [128, 3584, 1, 32]
    - [54, 1.402]
  - - [1856, 3584, 1, 256]
    - [70, 34.138]
  - - [2944, 64, 1, 256]
    - [52, 4.313]
  - - [2368, 704, 1, 32]
    - [140, 1.978]
  - - [448, 2368, 1, 32]
    - [108, 2.942]
  - - [448, 2368, 1, 3328]
    - [32, 51.592]
  - - [64, 1408, 1, 256]
    - [21, 1.077]
  - - [5056, 32, 1, 32]
    - [81, 0.621]
  - - [1024, 704, 1, 3328]
    - [183, 47.841]
  - - [32, 5888, 1, 3328]
    - [74, 15.728]
  - - [32, 1408, 1, 1280]
    - [74, 2.416]
  - - [64, 32, 1, 256]
    - [46, 0.056]
  - - [1856, 1024, 1, 3328]
    - [93, 54.648]
  - - [2368, 1, 1, 1]
    - [81, 0.0]
  - - [5056, 2368, 1, 3328]
    - [38, 83.39]
  - - [128, 1, 1, 1280]
    - [89, 0.013]
  - - [704, 4288, 1, 1280]
    - [51, 53.351]
  - - [704, 256, 1, 256]
    - [112, 4.158]
  - - [2560, 7000, 1, 2560]
    - [5, 73.679]
  - - [7680, 12000, 1, 2560]
    - [5, 77.814]
  - - [5124, 9124, 1, 1760]
    - [188, 72.042]
  - - [1760, 32, 1, 1760]
    - [189, 4.898]
  - - [512, 24000, 1, 1536]
    - [28, 66.599]
  - - [3072, 24000, 1, 1024]
    - [5, 72.195]
  - - [2048, 400, 1, 512]
    - [16, 20.546]
  - - [2560, 128, 1, 2560]
    - [130, 30.003]
  - - [3072, 16, 1, 1024]
    - [87, 4.051]
  - - [512, 48000, 1, 2816]
    - [20, 74.571]
  - - [512, 48000, 1, 2048]
    - [20, 73.321]
  - - [1760, 64, 1, 1760]
    - [205, 6.222]
  - - [2048, 1600, 1, 2048]
    - [14, 61.772]
  - - [512, 48000, 1, 1536]
    - [20, 69.63]
  - - [2560, 32, 1, 2560]
    - [44, 12.055]
  - - [8448, 5984, 1, 2816]
    - [5, 76.762]
  - - [4096, 3200, 1, 1024]
    - [5, 65.547]
  - - [1024, 24000, 1, 2560]
    - [20, 74.842]
  - - [1760, 6400, 1, 1760]
    - [83, 64.891]
  - - [5124, 9124, 1, 2048]
    - [15, 73.998]
  - - [1024, 700, 1, 512]
    - [58, 21.313]
  - - [4608, 32, 1, 1536]
    - [21, 11.291]
  - - [3072, 64, 1, 1024]
    - [21, 13.036]
  - - [16384, 3200, 1, 4096]
    - [5, 77.394]
  - - [2560, 16, 1, 2560]
    - [46, 6.386]
  - - [1024, 48000, 1, 2560]
    - [20, 76.909]
  - - [8448, 48000, 1, 2816]
    - [5, 79.133]
  - - [2048, 32, 1, 2048]
    - [46, 8.495]
  - - [2560, 3200, 1, 2560]
    - [14, 66.764]
  - - [16384, 800, 1, 4096]
    - [14, 79.54]
  - - [4608, 24000, 1, 1536]
    - [5, 75.236]
  - - [7680, 48000, 1, 2560]
    - [71, 78.42]
  - - [3072, 48000, 1, 1024]
    - [5, 72.944]
  - - [1760, 16, 1, 1760]
    - [114, 2.482]
  - - [8192, 3200, 1, 2048]
    - [5, 73.603]
  - - [512, 24000, 1, 2816]
    - [9, 83.582]
  - - [4096, 400, 1, 1024]
    - [58, 36.142]
  - - [6144, 48000, 1, 2560]
    - [5, 78.369]
  - - [4608, 48000, 1, 1536]
    - [5, 75.778]
  - - [4096, 128, 1, 4096]
    - [88, 38.404]
  - - [2048, 800, 1, 512]
    - [190, 32.59]
  - - [4608, 5984, 1, 1536]
    - [5, 71.66]
  - - [4096, 1600, 1, 1024]
    - [5, 60.102]
  - - [6144, 5984, 1, 2048]
    - [5, 74.552]
  - - [7680, 24000, 1, 2560]
    - [5, 78.319]
  - - [6144, 48000, 1, 2048]
    - [71, 77.805]
  - - [2048, 3200, 1, 2048]
    - [4, 73.682]
  - - [5124, 9124, 1, 2560]
    - [15, 74.804]
  - - [1024, 24000, 1, 1536]
    - [9, 70.824]
  - - [7680, 16, 1, 2560]
    - [101, 11.933]
  - - [2560, 6400, 1, 2560]
    - [5, 72.356]
  - - [2048, 128, 1, 2048]
    - [130, 21.995]
  - - [512, 16, 1, 500000]
    - [191, 6.589]
  - - [512, 24000, 1, 2560]
    - [9, 82.392]
  - - [1024, 24000, 1, 2816]
    - [9, 75.168]
  - - [7680, 5984, 1, 2560]
    - [5, 76.039]
  - - [2048, 1600, 1, 512]
    - [51, 40.563]
  - - [2048, 7000, 1, 2048]
    - [5, 72.509]
  - - [1760, 800, 1, 1760]
    - [102, 42.887]
  - - [4096, 64, 1, 4096]
    - [130, 25.905]
  - - [7680, 32, 1, 2560]
    - [44, 16.295]
  - - [2560, 64, 1, 2560]
    - [146, 12.034]
  - - [3072, 128, 1, 1024]
    - [136, 22.238]
  - - [7680, 64, 1, 2560]
    - [122, 29.72]
  - - [1760, 128, 1, 1760]
    - [174, 11.112]
  - - [2560, 1600, 1, 2560]
    - [14, 64.486]
  - - [2048, 3200, 1, 512]
    - [28, 46.41]
  - - [2560, 800, 1, 2560]
    - [22, 55.673]
  - - [3072, 32, 1, 1024]
    - [87, 7.821]
  - - [6144, 32, 1, 2560]
    - [55, 17.029]
  - - [4608, 12000, 1, 1536]
    - [5, 74.405]
  - - [4096, 32, 1, 4096]
    - [21, 14.471]
  - - [6144, 24000, 1, 2048]
    - [71, 77.313]
  - - [8192, 800, 1, 2048]
    - [14, 64.293]
  - - [5124, 9124, 1, 4096]
    - [15, 76.921]
  - - [8448, 24000, 1, 2816]
    - [5, 79.053]
  - - [1024, 48000, 1, 1536]
    - [9, 73.334]
  - - [7680, 128, 1, 2560]
    - [32, 42.255]
  - - [8192, 1600, 1, 2048]
    - [5, 71.803]
  - - [4096, 800, 1, 1024]
    - [4, 52.579]
  - - [2048, 800, 1, 2048]
    - [4, 56.34]
  - - [1760, 3200, 1, 1760]
    - [193, 59.183]
  - - [512, 48000, 1, 2560]
    - [9, 74.145]
  - - [8448, 16, 1, 2816]
    - [52, 12.763]
  - - [2048, 64, 1, 2048]
    - [21, 12.601]
  - - [512, 24000, 1, 2048]
    - [9, 81.55]
  - - [16384, 1600, 1, 4096]
    - [5, 76.108]
  - - [4608, 16, 1, 1536]
    - [46, 7.595]
  - - [1024, 24000, 1, 2048]
    - [20, 73.702]
  - - [8192, 400, 1, 2048]
    - [14, 56.732]
  - - [2048, 6400, 1, 2048]
    - [5, 72.318]
  - - [6144, 12000, 1, 2048]
    - [5, 76.852]
  - - [512, 8, 1, 500000]
    - [194, 3.444]
  - - [1760, 7000, 1, 1760]
    - [102, 67.578]
  - - [1024, 48000, 1, 2816]
    - [9, 77.476]
  - - [6144, 16, 1, 2560]
    - [46, 11.387]
  - - [8448, 32, 1, 2816]
    - [55, 18.057]
  - - [4096, 7000, 1, 4096]
    - [38, 77.359]
  - - [4096, 16, 1, 4096]
    - [87, 11.16]
  - - [6144, 24000, 1, 2560]
    - [5, 78.084]
  - - [2048, 16, 1, 2048]
    - [44, 4.396]
  - - [8448, 12000, 1, 2816]
    - [5, 78.698]
  - - [16384, 400, 1, 4096]
    - [4, 73.055]
  - - [1760, 1600, 1, 1760]
    - [102, 52.678]
  - - [1024, 48000, 1, 2048]
    - [20, 75.629]
  - - [27, 27, 1, 64]
    - [41, 0.006]
  - - [27, 33, 1, 64]
    - [132, 0.007]
  - - [256, 80, 1, 784]
    - [160, 1.07]
  - - [256, 256, 1, 60800]
    - [197, 38.403]
  - - [256, 256, 1, 54400]
    - [198, 36.416]
  - - [256, 256, 1, 51520]
    - [197, 36.298]
  - - [256, 256, 1, 55296]
    - [197, 37.151]
  - - [256, 256, 1, 56832]
    - [198, 37.467]
  - - [256, 256, 1, 45632]
    - [198, 40.064]
  - - [256, 256, 1, 49152]
    - [199, 32.174]
  - - [256, 256, 1, 43008]
    - [200, 34.555]
  - - [256, 12, 1, 11408]
    - [201, 1.005]
  - - [256, 12, 1, 3800]
    - [201, 0.391]
  - - [256, 3, 1, 3800]
    - [201, 0.105]
  - - [256, 12, 1, 11616]
    - [201, 1.115]
  - - [256, 12, 1, 12288]
    - [202, 1.134]
  - - [256, 12, 1, 950]
    - [160, 0.18]
  - - [256, 3, 1, 950]
    - [160, 0.047]
  - - [256, 12, 1, 3220]
    - [201, 0.334]
  - - [256, 3, 1, 3220]
    - [201, 0.087]
  - - [256, 12, 1, 3072]
    - [49, 0.56]
  - - [256, 3, 1, 3072]
    - [86, 0.138]
  - - [256, 12, 1, 850]
    - [160, 0.171]
  - - [256, 3, 1, 850]
    - [203, 0.043]
  - - [256, 12, 1, 2852]
    - [201, 0.3]
  - - [256, 3, 1, 2852]
    - [201, 0.077]
  - - [256, 12, 1, 805]
    - [160, 0.157]
  - - [256, 3, 1, 805]
    - [160, 0.042]
  - - [256, 3, 1, 864]
    - [160, 0.043]
  - - [256, 3, 1, 768]
    - [74, 0.052]
  - - [256, 12, 1, 864]
    - [160, 0.169]
  - - [256, 12, 1, 768]
    - [89, 0.206]
  - - [256, 12, 1, 2904]
    - [201, 0.308]
  - - [256, 3, 1, 2904]
    - [201, 0.079]
  - - [256, 3, 1, 713]
    - [160, 0.039]
  - - [256, 12, 1, 888]
    - [160, 0.176]
  - - [256, 3, 1, 888]
    - [160, 0.044]
  - - [256, 12, 1, 713]
    - [160, 0.148]
  - - [256, 3, 1, 660]
    - [160, 0.036]
  - - [256, 3, 1, 672]
    - [160, 0.037]
  - - [256, 12, 1, 660]
    - [160, 0.142]
  - - [256, 3, 1, 726]
    - [160, 0.038]
  - - [256, 12, 1, 672]
    - [40, 0.139]
  - - [256, 3, 1, 247]
    - [40, 0.016]
  - - [256, 12, 1, 726]
    - [114, 0.149]
  - - [256, 3, 1, 216]
    - [160, 0.015]
  - - [256, 3, 1, 3400]
    - [201, 0.09]
  - - [256, 3, 1, 221]
    - [160, 0.015]
  - - [256, 12, 1, 3552]
    - [201, 0.395]
  - - [256, 3, 1, 3456]
    - [86, 0.148]
  - - [256, 3, 1, 204]
    - [160, 0.014]
  - - [256, 12, 1, 3400]
    - [201, 0.377]
  - - [256, 12, 1, 3456]
    - [49, 0.589]
  - - [256, 12, 1, 221]
    - [160, 0.058]
  - - [256, 3, 1, 3552]
    - [201, 0.099]
  - - [256, 3, 1, 228]
    - [135, 0.015]
  - - [256, 3, 1, 234]
    - [135, 0.015]
  - - [256, 12, 1, 234]
    - [160, 0.06]
  - - [1024, 1000, 1, 12544]
    - [9, 59.9]
  - - [320, 1024, 1, 1024]
    - [21, 19.386]
  - - [1024, 1000, 1, 1024]
    - [16, 32.999]
  - - [320, 1000, 1, 1024]
    - [21, 18.836]
  - - [256, 12, 1, 228]
    - [168, 0.058]
  - - [256, 3, 1, 252]
    - [135, 0.016]
  - - [256, 12, 1, 252]
    - [135, 0.063]
  - - [256, 12, 1, 247]
    - [40, 0.063]
  - - [128, 64, 121, 1152]
    - [16, 21.622]
  - - [128, 64, 81, 12000]
    - [122, 32.201]
  - - [128, 64, 121, 1216]
    - [16, 23.993]
  - - [128, 64, 81, 1800]
    - [122, 23.122]
  - - [128, 64, 81, 1900]
    - [177, 21.004]
  - - [128, 64, 49, 20280]
    - [136, 32.477]
  - - [128, 64, 49, 3042]
    - [204, 24.436]
  - - [128, 64, 49, 3211]
    - [164, 24.284]
  - - [128, 64, 25, 43320]
    - [199, 32.428]
  - - [128, 64, 169, 5880]
    - [79, 30.47]
  - - [128, 64, 25, 6498]
    - [21, 21.45]
  - - [128, 64, 25, 6859]
    - [119, 20.059]
  - - [128, 64, 121, 7680]
    - [120, 30.021]
  - - [128, 64, 169, 882]
    - [4, 20.172]
  - - [128, 64, 169, 931]
    - [4, 20.985]
  - - [256, 128, 25, 1080]
    - [79, 21.12]
  - - [256, 128, 49, 1152]
    - [90, 35.399]
  - - [256, 128, 121, 120]
    - [214, 10.641]
  - - [256, 128, 169, 120]
    - [18, 13.563]
  - - [256, 128, 36, 120]
    - [206, 7.895]
  - - [256, 128, 49, 120]
    - [221, 5.799]
  - - [256, 128, 64, 120]
    - [65, 10.348]
  - - [256, 128, 36, 12000]
    - [90, 57.668]
  - - [256, 128, 49, 1216]
    - [190, 37.156]
  - - [256, 128, 25, 162]
    - [113, 4.56]
  - - [256, 128, 25, 171]
    - [225, 4.706]
  - - [256, 128, 121, 18]
    - [211, 1.873]
  - - [256, 128, 169, 18]
    - [211, 2.32]
  - - [256, 128, 36, 18]
    - [80, 0.78]
  - - [256, 128, 49, 18]
    - [208, 0.957]
  - - [256, 128, 64, 18]
    - [77, 1.18]
  - - [256, 128, 36, 1800]
    - [102, 32.141]
  - - [256, 128, 121, 19]
    - [222, 2.018]
  - - [256, 128, 169, 19]
    - [97, 2.475]
  - - [256, 128, 36, 19]
    - [182, 0.792]
  - - [256, 128, 49, 19]
    - [182, 1.015]
  - - [256, 128, 64, 19]
    - [144, 1.258]
  - - [256, 128, 36, 1900]
    - [222, 32.922]
  - - [256, 128, 49, 480]
    - [182, 29.335]
  - - [256, 128, 81, 480]
    - [185, 27.423]
  - - [256, 128, 64, 5880]
    - [215, 49.986]
  - - [256, 128, 49, 72]
    - [207, 3.727]
  - - [256, 128, 81, 72]
    - [100, 5.396]
  - - [256, 128, 49, 76]
    - [149, 3.861]
  - - [256, 128, 81, 76]
    - [181, 5.606]
  - - [256, 128, 49, 7680]
    - [124, 63.818]
  - - [256, 128, 64, 882]
    - [210, 28.469]
  - - [256, 128, 64, 931]
    - [211, 28.906]
  - - [512, 256, 81, 1080]
    - [75, 54.234]
  - - [512, 256, 25, 12000]
    - [212, 73.579]
  - - [512, 256, 81, 162]
    - [213, 20.926]
  - - [512, 256, 81, 171]
    - [214, 21.876]
  - - [512, 256, 25, 1800]
    - [215, 51.039]
  - - [512, 256, 25, 1900]
    - [216, 52.78]
  - - [512, 256, 121, 1920]
    - [94, 70.716]
  - - [512, 256, 169, 1920]
    - [94, 71.321]
  - - [512, 256, 49, 1920]
    - [6, 66.874]
  - - [512, 256, 121, 288]
    - [102, 40.489]
  - - [512, 256, 169, 288]
    - [84, 41.571]
  - - [512, 256, 49, 288]
    - [91, 33.776]
  - - [512, 256, 25, 3000]
    - [217, 59.706]
  - - [512, 256, 81, 3000]
    - [75, 66.961]
  - - [512, 256, 121, 304]
    - [218, 34.776]
  - - [512, 256, 169, 304]
    - [218, 35.519]
  - - [512, 256, 49, 304]
    - [103, 30.939]
  - - [512, 256, 25, 450]
    - [162, 30.427]
  - - [512, 256, 81, 450]
    - [218, 36.864]
  - - [512, 256, 25, 475]
    - [100, 30.711]
  - - [512, 256, 81, 475]
    - [75, 37.014]
  - - [512, 256, 121, 480]
    - [91, 49.779]
  - - [512, 256, 169, 480]
    - [91, 50.976]
  - - [512, 256, 49, 5880]
    - [24, 66.304]
  - - [512, 256, 121, 72]
    - [84, 13.76]
  - - [512, 256, 169, 72]
    - [219, 14.104]
  - - [512, 256, 121, 76]
    - [213, 14.161]
  - - [512, 256, 169, 76]
    - [220, 14.557]
  - - [512, 256, 49, 882]
    - [173, 46.382]
  - - [512, 256, 49, 931]
    - [24, 50.562]
  - - [1152, 256, 1, 1]
    - [156, 0.012]
  - - [1152, 256, 1, 1444]
    - [164, 16.209]
  - - [1152, 256, 1, 25]
    - [140, 0.301]
  - - [1152, 256, 1, 9]
    - [156, 0.109]
  - - [128, 256, 1, 1444]
    - [189, 2.491]
  - - [2304, 340, 1, 1]
    - [107, 0.061]
  - - [2304, 340, 1, 1444]
    - [178, 22.515]
  - - [2304, 340, 1, 9]
    - [107, 0.552]
  - - [2304, 510, 1, 25]
    - [107, 1.947]
  - - [2304, 512, 1, 100]
    - [182, 3.918]
  - - [2304, 512, 1, 361]
    - [221, 14.901]
  - - [256, 256, 1, 1444]
    - [114, 4.936]
  - - [4608, 510, 1, 100]
    - [155, 6.181]
  - - [4608, 510, 1, 361]
    - [162, 17.62]
  - - [576, 128, 1, 1444]
    - [203, 5.579]
  - - [81, 1024, 1, 1024]
    - [85, 6.554]
  - - [81, 1000, 1, 1024]
    - [85, 6.272]
  - - [340, 256, 49, 1152]
    - [222, 43.179]
  - - [340, 256, 36, 120]
    - [223, 11.297]
  - - [340, 256, 49, 120]
    - [64, 10.478]
  - - [340, 256, 64, 120]
    - [64, 13.121]
  - - [340, 256, 36, 12000]
    - [15, 56.493]
  - - [340, 256, 49, 1216]
    - [19, 46.895]
  - - [340, 256, 36, 18]
    - [170, 1.506]
  - - [340, 256, 49, 18]
    - [226, 1.973]
  - - [340, 256, 64, 18]
    - [225, 2.302]
  - - [340, 256, 36, 1800]
    - [19, 38.035]
  - - [340, 256, 36, 19]
    - [225, 1.607]
  - - [340, 256, 49, 19]
    - [225, 2.088]
  - - [340, 256, 64, 19]
    - [225, 2.422]
  - - [340, 256, 36, 1900]
    - [15, 37.5]
  - - [340, 256, 64, 5880]
    - [124, 55.328]
  - - [340, 256, 49, 7680]
    - [124, 60.498]
  - - [340, 256, 64, 882]
    - [173, 36.683]
  - - [340, 256, 64, 931]
    - [224, 36.911]
  - - [510, 256, 49, 120]
    - [64, 12.016]
  - - [510, 256, 64, 120]
    - [226, 13.743]
  - - [510, 256, 49, 18]
    - [180, 2.269]
  - - [510, 256, 64, 18]
    - [206, 2.853]
  - - [510, 256, 49, 19]
    - [225, 2.404]
  - - [510, 256, 64, 19]
    - [180, 2.72]
  - - [510, 256, 36, 480]
    - [222, 34.82]
  - - [510, 256, 36, 72]
    - [170, 7.178]
  - - [510, 256, 36, 76]
    - [206, 8.581]
  - - [510, 512, 36, 1080]
    - [229, 47.754]
  - - [510, 512, 36, 162]
    - [223, 16.232]
  - - [510, 512, 36, 171]
    - [227, 16.738]
  - - [510, 512, 49, 1920]
    - [19, 62.127]
  - - [510, 512, 64, 1920]
    - [19, 62.991]
  - - [510, 512, 49, 288]
    - [228, 31.006]
  - - [510, 512, 64, 288]
    - [110, 31.618]
  - - [510, 512, 36, 3000]
    - [229, 56.136]
  - - [510, 512, 49, 304]
    - [219, 27.389]
  - - [510, 512, 64, 304]
    - [181, 27.217]
  - - [510, 512, 36, 450]
    - [219, 28.051]
  - - [510, 512, 36, 475]
    - [219, 29.927]
  - - [510, 512, 49, 480]
    - [222, 39.181]
  - - [510, 512, 64, 480]
    - [222, 40.527]
  - - [510, 512, 49, 72]
    - [226, 10.492]
  - - [510, 512, 64, 72]
    - [223, 11.269]
  - - [510, 512, 49, 76]
    - [170, 10.832]
  - - [510, 512, 64, 76]
    - [223, 11.72]
  - - [48, 48, 16, 64]
    - [203, 0.113]
  - - [64, 64, 16, 64]
    - [13, 0.196]
  - - [80, 80, 16, 64]
    - [114, 0.301]
  - - [96, 96, 16, 64]
    - [41, 0.439]
  - - [144, 144, 16, 64]
    - [165, 0.892]
  - - [160, 160, 16, 64]
    - [168, 1.073]
  - - [176, 176, 16, 64]
    - [57, 1.299]
  - - [192, 192, 16, 64]
    - [16, 1.538]
  - - [208, 208, 16, 64]
    - [208, 1.716]
  - - [224, 224, 16, 64]
    - [47, 1.987]
  - - [240, 240, 16, 64]
    - [104, 2.343]
  - - [256, 256, 16, 64]
    - [180, 2.553]
  - - [288, 288, 16, 64]
    - [177, 3.143]
  - - [304, 304, 16, 64]
    - [58, 3.585]
  - - [352, 352, 16, 64]
    - [149, 4.392]
  - - [368, 368, 16, 64]
    - [57, 4.831]
  - - [416, 416, 16, 64]
    - [133, 8.913]
  - - [432, 432, 16, 64]
    - [177, 6.0]
  - - [448, 448, 16, 64]
    - [142, 6.424]
  - - [464, 464, 16, 64]
    - [77, 6.731]
  - - [480, 480, 16, 64]
    - [59, 6.932]
  - - [1024, 6688, 1, 1024]
    - [28, 66.395]
  - - [1024, 7872, 1, 1024]
    - [9, 75.669]
  - - [1024, 5136, 1, 4096]
    - [20, 87.649]
  - - [1024, 6544, 1, 4096]
    - [50, 81.357]
  - - [1024, 5632, 1, 1024]
    - [28, 65.23]
  - - [1024, 6176, 1, 4096]
    - [8, 79.113]
  - - [1024, 6640, 1, 1024]
    - [14, 66.029]
  - - [1024, 6288, 1, 4096]
    - [8, 80.127]
  - - [1024, 6256, 1, 4096]
    - [28, 79.636]
  - - [1024, 6672, 1, 1024]
    - [4, 66.181]
  - - [1024, 6304, 1, 4096]
    - [8, 80.151]
  - - [1024, 6208, 1, 4096]
    - [8, 79.271]
  - - [1024, 6224, 1, 4096]
    - [73, 79.155]
  - - [1024, 6320, 1, 4096]
    - [8, 80.141]
  - - [1024, 6560, 1, 4096]
    - [50, 82.819]
  - - [1024, 7776, 1, 1024]
    - [9, 74.93]
  - - [1024, 6928, 1, 4096]
    - [20, 82.362]
  - - [1024, 6704, 1, 1024]
    - [73, 66.288]
  - - [1024, 27, 1, 1024]
    - [46, 2.328]
  - - [1024, 14320, 1, 4096]
    - [20, 83.645]
  - - [1024, 14112, 1, 4096]
    - [20, 83.015]
  - - [1024, 14128, 1, 4096]
    - [20, 82.626]
  - - [1024, 14144, 1, 4096]
    - [20, 82.72]
  - - [1024, 14160, 1, 4096]
    - [20, 82.895]
  - - [1024, 14176, 1, 4096]
    - [20, 82.917]
  - - [1024, 14192, 1, 4096]
    - [20, 82.918]
  - - [1024, 14208, 1, 4096]
    - [20, 83.279]
  - - [1024, 14224, 1, 4096]
    - [20, 83.136]
  - - [1024, 14240, 1, 4096]
    - [20, 83.117]
  - - [1024, 14256, 1, 4096]
    - [20, 83.272]
  - - [1024, 14272, 1, 4096]
    - [20, 83.375]
  - - [1024, 14288, 1, 4096]
    - [20, 83.355]
  - - [1024, 14304, 1, 4096]
    - [20, 83.915]
  - - [1024, 14480, 1, 4096]
    - [20, 84.392]
  - - [1024, 14528, 1, 4096]
    - [20, 78.775]
  - - [1024, 14784, 1, 4096]
    - [20, 80.172]
  - - [1024, 15072, 1, 4096]
    - [20, 81.528]
  - - [1024, 15232, 1, 4096]
    - [20, 81.98]
  - - [1024, 15328, 1, 4096]
    - [20, 82.385]
  - - [1024, 15392, 1, 4096]
    - [20, 82.766]
  - - [1024, 15504, 1, 4096]
    - [20, 83.141]
  - - [1024, 16064, 1, 4096]
    - [20, 80.083]
  - - [1024, 16256, 1, 4096]
    - [20, 80.997]
  - - [1024, 17024, 1, 4096]
    - [20, 84.317]
  - - [1024, 3568, 1, 4096]
    - [38, 72.926]
  - - [1024, 3584, 1, 1024]
    - [68, 54.352]
  - - [1024, 3600, 1, 4096]
    - [38, 73.39]
  - - [1024, 368, 1, 4096]
    - [130, 37.886]
  - - [1024, 3760, 1, 1024]
    - [10, 56.586]
  - - [1024, 3920, 1, 4096]
    - [20, 78.825]
  - - [1024, 4032, 1, 4096]
    - [4, 71.926]
  - - [30528, 468, 1, 1024]
    - [71, 68.966]
  - - [3072, 4304, 1, 1024]
    - [5, 69.78]
  - - [1024, 109, 1, 1024]
    - [21, 6.923]
  - - [1024, 128, 1, 4096]
    - [192, 16.348]
  - - [1024, 14096, 1, 4096]
    - [20, 82.388]
  - - [1024, 16432, 1, 4096]
    - [20, 81.797]
  - - [1024, 2201, 1, 1024]
    - [28, 45.458]
  - - [1024, 2240, 1, 1024]
    - [28, 48.027]
  - - [1024, 2241, 1, 1024]
    - [28, 47.025]
  - - [1024, 2243, 1, 1024]
    - [28, 47.066]
  - - [1024, 2244, 1, 1024]
    - [28, 47.087]
  - - [1024, 2246, 1, 1024]
    - [28, 46.55]
  - - [1024, 2249, 1, 1024]
    - [28, 46.859]
  - - [1024, 2251, 1, 1024]
    - [28, 46.818]
  - - [1024, 2254, 1, 1024]
    - [28, 46.88]
  - - [1024, 2259, 1, 1024]
    - [28, 46.82]
  - - [1024, 2265, 1, 1024]
    - [28, 46.374]
  - - [1024, 2268, 1, 1024]
    - [28, 46.924]
  - - [1024, 2269, 1, 1024]
    - [28, 46.781]
  - - [1024, 2270, 1, 1024]
    - [28, 47.717]
  - - [1024, 2278, 1, 1024]
    - [28, 46.803]
  - - [1024, 2280, 1, 1024]
    - [28, 46.441]
  - - [1024, 2281, 1, 1024]
    - [28, 47.193]
  - - [1024, 2282, 1, 1024]
    - [4, 46.401]
  - - [1024, 2285, 1, 1024]
    - [28, 47.193]
  - - [1024, 2286, 1, 1024]
    - [4, 47.296]
  - - [1024, 2287, 1, 1024]
    - [28, 46.825]
  - - [1024, 2289, 1, 1024]
    - [28, 47.029]
  - - [1024, 2296, 1, 1024]
    - [28, 47.337]
  - - [1024, 2298, 1, 1024]
    - [28, 47.544]
  - - [1024, 2300, 1, 1024]
    - [51, 47.753]
  - - [1024, 2301, 1, 1024]
    - [28, 47.193]
  - - [1024, 2303, 1, 1024]
    - [28, 47.316]
  - - [1024, 3552, 1, 1024]
    - [20, 56.86]
  - - [1024, 3936, 1, 1024]
    - [15, 61.264]
  - - [1024, 3936, 1, 4096]
    - [15, 80.274]
  - - [1024, 4352, 1, 1024]
    - [28, 60.629]
  - - [1024, 47, 1, 1024]
    - [55, 3.47]
  - - [1024, 5952, 1, 4096]
    - [4, 76.078]
  - - [1024, 646, 1, 1024]
    - [51, 25.958]
  - - [1024, 696, 1, 1024]
    - [51, 27.685]
  - - [1024, 705, 1, 1024]
    - [28, 27.762]
  - - [1024, 715, 1, 1024]
    - [51, 28.536]
  - - [1024, 716, 1, 1024]
    - [51, 28.385]
  - - [1024, 718, 1, 1024]
    - [51, 28.464]
  - - [1024, 722, 1, 1024]
    - [51, 28.526]
  - - [1024, 726, 1, 1024]
    - [51, 28.781]
  - - [1024, 727, 1, 1024]
    - [51, 28.918]
  - - [1024, 730, 1, 1024]
    - [51, 28.843]
  - - [1024, 731, 1, 1024]
    - [28, 28.691]
  - - [1024, 732, 1, 1024]
    - [51, 28.54]
  - - [1024, 733, 1, 1024]
    - [28, 28.579]
  - - [1024, 739, 1, 1024]
    - [51, 29.101]
  - - [1024, 740, 1, 1024]
    - [51, 29.14]
  - - [1024, 742, 1, 1024]
    - [51, 29.122]
  - - [1024, 751, 1, 1024]
    - [51, 29.185]
  - - [1024, 756, 1, 1024]
    - [51, 29.475]
  - - [1024, 759, 1, 1024]
    - [51, 29.79]
  - - [1024, 761, 1, 1024]
    - [51, 29.868]
  - - [1024, 762, 1, 1024]
    - [51, 30.007]
  - - [1024, 768, 1, 1024]
    - [51, 31.394]
  - - [1024, 769, 1, 1024]
    - [51, 30.283]
  - - [1024, 792, 1, 1024]
    - [51, 31.188]
  - - [1024, 793, 1, 1024]
    - [51, 31.124]
  - - [1024, 794, 1, 1024]
    - [51, 31.06]
  - - [1024, 800, 1, 4096]
    - [183, 56.593]
  - - [1024, 802, 1, 1024]
    - [51, 31.27]
  - - [1024, 808, 1, 1024]
    - [51, 31.818]
  - - [1024, 816, 1, 4096]
    - [187, 56.79]
  - - [1024, 834, 1, 1024]
    - [60, 29.323]
  - - [1024, 835, 1, 1024]
    - [60, 28.76]
  - - [1024, 836, 1, 1024]
    - [60, 28.878]
  - - [1024, 837, 1, 1024]
    - [60, 28.997]
  - - [1024, 838, 1, 1024]
    - [60, 28.779]
  - - [1024, 839, 1, 1024]
    - [57, 28.482]
  - - [1024, 840, 1, 1024]
    - [60, 28.848]
  - - [1024, 962, 1, 1024]
    - [58, 31.052]
  - - [1024, 966, 1, 1024]
    - [16, 31.011]
  - - [1024, 976, 1, 1024]
    - [147, 31.163]
  - - [30528, 109, 1, 1024]
    - [32, 42.279]
  - - [30528, 17, 1, 1024]
    - [58, 9.58]
  - - [30528, 447, 1, 1024]
    - [38, 66.037]
  - - [30528, 448, 1, 1024]
    - [71, 66.576]
  - - [30528, 461, 1, 1024]
    - [71, 67.906]
  - - [30528, 462, 1, 1024]
    - [5, 68.11]
  - - [30528, 471, 1, 1024]
    - [71, 68.86]
  - - [30528, 473, 1, 1024]
    - [71, 69.182]
  - - [30528, 474, 1, 1024]
    - [71, 68.672]
  - - [30528, 475, 1, 1024]
    - [5, 69.073]
  - - [30528, 477, 1, 1024]
    - [71, 69.68]
  - - [30528, 478, 1, 1024]
    - [71, 69.971]
  - - [30528, 54, 1, 1024]
    - [28, 27.015]
  - - [30528, 548, 1, 1024]
    - [71, 66.12]
  - - [30528, 549, 1, 1024]
    - [71, 66.286]
  - - [30528, 550, 1, 1024]
    - [71, 66.384]
  - - [30528, 553, 1, 1024]
    - [71, 66.45]
  - - [30528, 555, 1, 1024]
    - [71, 67.034]
  - - [30528, 557, 1, 1024]
    - [71, 67.391]
  - - [30528, 558, 1, 1024]
    - [71, 67.097]
  - - [30528, 559, 1, 1024]
    - [71, 67.103]
  - - [30528, 560, 1, 1024]
    - [71, 67.245]
  - - [30528, 561, 1, 1024]
    - [71, 67.274]
  - - [30528, 562, 1, 1024]
    - [71, 67.417]
  - - [30528, 563, 1, 1024]
    - [5, 67.721]
  - - [30528, 565, 1, 1024]
    - [71, 67.592]
  - - [30528, 566, 1, 1024]
    - [71, 67.873]
  - - [30528, 567, 1, 1024]
    - [71, 67.878]
  - - [30528, 568, 1, 1024]
    - [71, 68.113]
  - - [30528, 569, 1, 1024]
    - [5, 68.326]
  - - [30528, 570, 1, 1024]
    - [71, 68.516]
  - - [30528, 571, 1, 1024]
    - [71, 68.38]
  - - [30528, 572, 1, 1024]
    - [5, 67.603]
  - - [30528, 573, 1, 1024]
    - [71, 68.479]
  - - [30528, 749, 1, 1024]
    - [71, 70.028]
  - - [30528, 753, 1, 1024]
    - [71, 70.272]
  - - [30528, 755, 1, 1024]
    - [71, 70.627]
  - - [30528, 756, 1, 1024]
    - [71, 70.402]
  - - [30528, 757, 1, 1024]
    - [71, 70.291]
  - - [30528, 758, 1, 1024]
    - [5, 70.682]
  - - [30528, 759, 1, 1024]
    - [5, 70.514]
  - - [30528, 760, 1, 1024]
    - [5, 70.7]
  - - [30528, 761, 1, 1024]
    - [5, 70.83]
  - - [30528, 762, 1, 1024]
    - [71, 71.074]
  - - [30528, 763, 1, 1024]
    - [5, 71.092]
  - - [30528, 764, 1, 1024]
    - [71, 71.053]
  - - [30528, 765, 1, 1024]
    - [71, 71.448]
  - - [30528, 766, 1, 1024]
    - [5, 71.145]
  - - [30528, 82, 1, 1024]
    - [71, 33.699]
  - - [3072, 3248, 1, 1024]
    - [5, 66.119]
  - - [3072, 368, 1, 1024]
    - [58, 34.873]
  - - [3072, 560, 1, 1024]
    - [51, 45.836]
  - - [4096, 16256, 1, 1024]
    - [5, 76.864]
  - - [4096, 368, 1, 1024]
    - [4, 41.602]
  - - [16, 16, 16, 64]
    - [40, 0.026]
  - - [272, 272, 16, 64]
    - [104, 4.742]
  - - [10, 163840, 1, 642]
    - [2, 5.646]
  - - [10, 81920, 1, 642]
    - [2, 5.343]
  - - [12840, 1024, 1, 256]
    - [5, 47.521]
  - - [12840, 512, 1, 256]
    - [47, 36.393]
  - - [2400, 1024, 1, 256]
    - [16, 26.059]
  - - [2400, 512, 1, 256]
    - [16, 17.72]
  - - [256, 1024, 1, 2400]
    - [119, 19.003]
  - - [256, 1024, 1, 256]
    - [21, 4.638]
  - - [256, 1024, 1, 4800]
    - [136, 32.001]
  - - [256, 512, 1, 2400]
    - [205, 10.805]
  - - [256, 512, 1, 256]
    - [21, 2.52]
  - - [256, 512, 1, 4800]
    - [21, 17.545]
  - - [30, 163840, 1, 642]
    - [11, 14.988]
  - - [30, 81920, 1, 642]
    - [11, 14.209]
  - - [3200, 1024, 1, 256]
    - [91, 31.088]
  - - [3200, 512, 1, 256]
    - [61, 21.676]
  - - [9630, 1024, 1, 256]
    - [15, 41.641]
  - - [9630, 512, 1, 256]
    - [7, 32.691]
  - - [160, 642, 1024, 20]
    - [209, 6.25]
  - - [160, 642, 512, 20]
    - [143, 5.964]
  - - [642, 160, 1024, 15]
    - [206, 3.994]
  - - [642, 160, 512, 15]
    - [226, 3.826]
  - - [642, 160, 1024, 20]
    - [225, 5.209]
  - - [642, 160, 512, 20]
    - [64, 5.002]
  - - [2200, 1024, 1, 2200]
    - [63, 52.877]
  - - [2200, 1024, 1, 22374]
    - [25, 68.6]
  - - [2200, 256, 1, 2200]
    - [51, 29.022]
  - - [2200, 256, 1, 22374]
    - [98, 49.672]
  - - [2200, 512, 1, 2200]
    - [9, 42.624]
  - - [2200, 512, 1, 22374]
    - [32, 70.055]
  - - [4000, 1024, 1, 11190]
    - [93, 72.791]
  - - [4000, 1024, 1, 4000]
    - [93, 64.473]
  - - [4000, 256, 1, 11190]
    - [25, 60.072]
  - - [4000, 256, 1, 4000]
    - [20, 48.524]
  - - [4000, 512, 1, 11190]
    - [93, 71.264]
  - - [4000, 512, 1, 4000]
    - [93, 61.284]
  - - [256, 1024, 1, 7616]
    - [120, 35.76]
  - - [256, 512, 1, 7616]
    - [146, 19.593]
  - - [7616, 1024, 1, 256]
    - [171, 35.534]
  - - [7616, 512, 1, 256]
    - [16, 27.907]
  - - [1024, 1024, 1, 2048]
    - [9, 42.446]
  - - [1024, 512, 1, 2048]
    - [51, 29.65]
  - - [2048, 1024, 1, 1024]
    - [16, 44.971]
  - - [2048, 1024, 1, 7616]
    - [93, 75.259]
  - - [2048, 512, 1, 1024]
    - [57, 32.432]
  - - [2048, 512, 1, 7616]
    - [20, 62.962]
  - - [128, 1024, 1, 1677]
    - [205, 8.227]
  - - [128, 512, 1, 1677]
    - [114, 4.708]
  - - [2048, 1024, 1, 3465]
    - [93, 54.688]
  - - [2048, 1024, 1, 9375]
    - [93, 66.339]
  - - [2048, 512, 1, 3465]
    - [71, 43.593]
  - - [2048, 512, 1, 9375]
    - [27, 55.571]
  - - [3465, 1024, 1, 128]
    - [7, 15.049]
  - - [3465, 512, 1, 128]
    - [11, 9.955]
  - - [9375, 1024, 1, 128]
    - [7, 20.479]
  - - [9375, 512, 1, 128]
    - [7, 16.842]
  - - [12288, 2048, 1, 8192]
    - [237, 92.503]
  - - [16384, 2048, 1, 8192]
    - [238, 87.854]
  - - [64000, 2048, 1, 8192]
    - [239, 91.601]
  - - [8192, 2048, 1, 16384]
    - [233, 87.95]
  - - [8192, 2048, 1, 4096]
    - [230, 77.639]
  - - [12288, 512, 1, 8192]
    - [234, 77.12]
  - - [16384, 512, 1, 8192]
    - [235, 82.83]
  - - [64000, 512, 1, 8192]
    - [240, 88.811]
  - - [8192, 512, 1, 16384]
    - [231, 76.42]
  - - [8192, 512, 1, 4096]
    - [232, 70.873]
  - - [512, 512, 128, 128]
    - [236, 21.01]
- null
