library/src/blas3/Tensile/Logic/asm_full/aldebaran_104cu/aldebaran_Cijk_Alik_Bljk_DB.yaml
- {MinimumRequiredVersion: 4.32.1}
- aldebaran
- {Architecture: gfx90a, CUCount: 104}
- [Device 0050, Device 0051, Device 0052, Device 0054, Device 0062, Device 7400, Device
    SolutionIndex: 0
    SolutionNameMin: Cijk_Alik_Bljk_DB_MT32x16x32_MI16x16x4x1_SN_EPS0_GSU110_IU1_PGR2_TT2_16_TLDS1_WG16_4_1_WGM8
    SolutionIndex: 1
    SolutionNameMin: Cijk_Alik_Bljk_DB_MT64x16x16_MI16x16x4x1_SN_IU1_NEPBS0_PLR5_SU32_SUS128_TLDS0_WGM5
    SolutionIndex: 2
    SolutionNameMin: Cijk_Alik_Bljk_DB_MT64x16x16_MI16x16x4x1_SN_IU1_NEPBS0_PLR5_SU0_SUS0_TLDS0_WGM11
    SolutionIndex: 3
    SolutionNameMin: Cijk_Alik_Bljk_DB_MT64x16x16_MI16x16x4x1_SN_IU2_NEPBS0_PLR3_SU32_SUS128_TLDS0_WGM11
    SolutionIndex: 4
    SolutionNameMin: Cijk_Alik_Bljk_DB_MT64x16x16_MI16x16x4x1_SN_IU1_NEPBS0_PLR5_SU32_SUS128_TLDS0_WGM11
    SolutionIndex: 5
    SolutionNameMin: Cijk_Alik_Bljk_DB_MT128x128x32_MI16x16x4x1_SN_1LDSB1_EPS0_GSU55_IU2_PGR2_TT4_64_TLDS0_WGM1
    SolutionIndex: 6
    SolutionNameMin: Cijk_Alik_Bljk_DB_MT128x256x16_MI16x16x4x1_SN_LBSPP256_LPB0_SS0_SUS128_WGM4
    SolutionIndex: 7
    SolutionNameMin: Cijk_Alik_Bljk_DB_MT128x256x16_MI16x16x4x1_SN_LBSPP128_LPB4_SS0_SUS128_WGM4
    SolutionIndex: 8
    SolutionNameMin: Cijk_Alik_Bljk_DB_MT128x256x16_MI16x16x4x1_SN_LBSPP128_LPB4_SS0_SUS128_WGM6
    SolutionIndex: 9
    SolutionNameMin: Cijk_Alik_Bljk_DB_MT128x256x16_MI16x16x4x1_SN_LBSPP128_LPB0_SS0_SUS256_WGM4
    SolutionIndex: 10
    SolutionNameMin: Cijk_Alik_Bljk_DB_MT128x256x16_MI16x16x4x1_SN_LBSPP256_LPB4_SS1_SUS256_WGM4
    SolutionIndex: 11
    SolutionNameMin: Cijk_Alik_Bljk_DB_MT128x128x16_MI16x16x4x1_SN_MIAV1_SUS256_SSO4_WGM5
    SolutionIndex: 12
    SolutionNameMin: Cijk_Alik_Bljk_DB_MT128x128x16_MI16x16x4x1_SN_MIAV0_SUS256_SSO4_WGM6
    SolutionIndex: 13
    SolutionNameMin: Cijk_Alik_Bljk_DB_MT128x128x16_MI16x16x4x1_SN_MIAV0_SUS256_SSO4_WGM5
    SolutionIndex: 14
    SolutionNameMin: Cijk_Alik_Bljk_DB_MT128x128x16_MI16x16x4x1_SN_MIAV0_SUS128_SSO4_WGM5
    SolutionIndex: 15
    SolutionNameMin: Cijk_Alik_Bljk_DB_MT128x128x16_MI16x16x4x1_SN_MIAV1_SUS128_SSO4_WGM5
    SolutionIndex: 16
    SolutionNameMin: Cijk_Alik_Bljk_DB_MT128x128x16_MI16x16x4x1_SN_MIAV0_SUS128_SSO4_WGM6
    SolutionIndex: 17
    SolutionNameMin: Cijk_Alik_Bljk_DB_MT128x128x16_MI16x16x4x1_SN_MIAV1_SUS128_SSO4_WGM6
    SolutionIndex: 18
    SolutionNameMin: Cijk_Alik_Bljk_DB_MT128x128x16_MI16x16x4x1_SN_MIAV0_SUS256_SSO4_WGM8
    SolutionIndex: 19
    SolutionNameMin: Cijk_Alik_Bljk_DB_MT128x128x16_MI16x16x4x1_SN_MIAV1_SUS256_SSO4_WGM8
    SolutionIndex: 20
    SolutionNameMin: Cijk_Alik_Bljk_DB_MT128x128x16_MI16x16x4x1_SN_MIAV1_SUS256_SSO4_WGM6
    SolutionIndex: 21
    SolutionNameMin: Cijk_Alik_Bljk_DB_MT128x128x16_MI16x16x4x1_SN_MIAV0_SUS128_SSO4_WGM8
    SolutionIndex: 22
    SolutionNameMin: Cijk_Alik_Bljk_DB_MT128x128x16_MI16x16x4x1_SN_MIAV1_SUS128_SSO4_WGM11
    SolutionIndex: 23
    SolutionNameMin: Cijk_Alik_Bljk_DB_MT128x128x16_MI16x16x4x1_SN_MIAV1_SUS256_SSO6_WGM5
    SolutionIndex: 24
    SolutionNameMin: Cijk_Alik_Bljk_DB_MT128x128x16_MI16x16x4x1_SN_MIAV1_SUS128_SSO4_WGM8
- - - [1, 64, 1, 64]
    - [2, 0.002]
  - - [64, 1, 1, 64]
    - [3, 0.002]
  - - [1, 1, 1, 64]
    - [4, 0.0]
  - - [64, 64, 1, 64]
    - [2, 0.045]
  - - [128, 1, 1, 128]
    - [1, 0.006]
  - - [250, 9, 1, 500000]
    - [0, 3.43]
  - - [250, 250, 1, 500000]
    - [5, 23.813]
  - - [250, 250, 1, 8000000]
    - [6, 33.918]
  - - [250, 9, 1, 8000000]
    - [0, 3.528]
  - - [250, 250, 1, 12000000]
    - [7, 33.3]
  - - [250, 250, 1, 16000000]
    - [8, 33.65]
  - - [250, 9, 1, 12000000]
    - [0, 3.489]
  - - [250, 9, 1, 16000000]
    - [0, 4.172]
  - - [250, 250, 1, 4000000]
    - [5, 34.982]
  - - [250, 250, 1, 5000000]
    - [9, 31.895]
  - - [250, 250, 1, 6000000]
    - [9, 33.52]
  - - [250, 250, 1, 7000000]
    - [10, 31.864]
  - - [6454, 6454, 1, 689]
    - [11, 60.556]
  - - [7561, 7561, 1, 411]
    - [12, 49.947]
  - - [7985, 7985, 1, 701]
    - [13, 61.65]
  - - [7985, 7985, 1, 1948]
    - [13, 78.111]
  - - [8709, 8709, 1, 875]
    - [12, 65.904]
  - - [9603, 9603, 1, 1371]
    - [14, 71.34]
  - - [9603, 9603, 1, 701]
    - [13, 62.106]
  - - [10606, 10606, 1, 1239]
    - [13, 73.699]
  - - [11505, 11505, 1, 1278]
    - [13, 74.052]
  - - [12301, 12301, 1, 837]
    - [15, 66.86]
  - - [13179, 13179, 1, 1392]
    - [11, 78.08]
  - - [14487, 14487, 1, 1169]
    - [12, 72.955]
  - - [15420, 15420, 1, 2986]
    - [12, 83.264]
  - - [15420, 15420, 1, 701]
    - [14, 64.647]
  - - [17445, 17445, 1, 1266]
    - [13, 74.918]
  - - [18395, 18395, 1, 1008]
    - [12, 74.338]
  - - [19343, 19343, 1, 501]
    - [16, 57.724]
  - - [19343, 19343, 1, 1266]
    - [13, 74.934]
  - - [20342, 20342, 1, 1636]
    - [12, 79.295]
  - - [21581, 21581, 1, 701]
    - [12, 64.329]
  - - [21581, 21581, 1, 2921]
    - [17, 81.298]
  - - [24261, 24261, 1, 659]
    - [12, 64.233]
  - - [25109, 25109, 1, 1087]
    - [13, 71.905]
  - - [25854, 25854, 1, 701]
    - [18, 64.816]
  - - [25854, 25854, 1, 1820]
    - [12, 80.031]
  - - [27412, 27412, 1, 501]
    - [16, 58.684]
  - - [27412, 27412, 1, 1416]
    - [13, 77.843]
  - - [28005, 28005, 1, 701]
    - [19, 64.673]
  - - [28005, 28005, 1, 2572]
    - [17, 82.82]
  - - [29829, 29829, 1, 1582]
    - [13, 77.105]
  - - [30421, 30421, 1, 1186]
    - [13, 74.391]
  - - [31256, 31256, 1, 415]
    - [18, 53.721]
  - - [31256, 31256, 1, 1186]
    - [13, 74.545]
  - - [32163, 32163, 1, 1796]
    - [12, 79.679]
  - - [33974, 33974, 1, 1225]
    - [13, 74.11]
  - - [35882, 35882, 1, 701]
    - [18, 64.745]
  - - [35882, 35882, 1, 2387]
    - [20, 80.543]
  - - [36653, 36653, 1, 501]
    - [21, 58.061]
  - - [36653, 36653, 1, 2845]
    - [22, 79.593]
  - - [37967, 37967, 1, 1339]
    - [12, 75.035]
  - - [38361, 38361, 1, 701]
    - [16, 64.582]
  - - [38361, 38361, 1, 3690]
    - [23, 84.552]
  - - [39067, 39067, 1, 1224]
    - [12, 75.189]
  - - [39761, 39761, 1, 3821]
    - [12, 83.021]
  - - [40401, 40401, 1, 701]
    - [16, 64.604]
  - - [40401, 40401, 1, 1925]
    - [20, 78.883]
  - - [41535, 41535, 1, 701]
    - [24, 60.78]
  - - [41535, 41535, 1, 2235]
    - [17, 80.053]
  - - [43623, 43623, 1, 701]
    - [20, 64.631]
  - - [43623, 43623, 1, 3812]
    - [13, 86.088]
  - - [45312, 45312, 1, 701]
    - [12, 65.958]
  - - [45312, 45312, 1, 3235]
    - [20, 83.442]
  - - [47463, 47463, 1, 3020]
    - [14, 84.225]
  - - [47463, 47463, 1, 701]
    - [18, 64.472]
  - - [49109, 49109, 1, 3250]
    - [20, 84.662]
  - - [51821, 51821, 1, 701]
    - [18, 64.422]
  - - [51821, 51821, 1, 3954]
    - [16, 85.609]
  - - [60766, 60766, 1, 701]
    - [18, 64.537]
  - - [60766, 60766, 1, 2493]
    - [20, 80.754]
  - - [67143, 67143, 1, 701]
    - [22, 63.425]
  - - [67143, 67143, 1, 3914]
    - [12, 85.241]
- null
