library/src/blas3/Tensile/Logic/asm_full/aldebaran_104cu/aldebaran_Cijk_Ailk_Bljk_SB.yaml
- {MinimumRequiredVersion: 4.32.1}
- aldebaran
- {Architecture: gfx90a, CUCount: 104}
- [Device 0050, Device 0051, Device 0052, Device 0054, Device 0062, Device 7400, Device
    SolutionIndex: 0
    SolutionNameMin: Cijk_Ailk_Bljk_SB_MT64x64x16_MI32x32x2x1_SE_1LDSB0_AF0EM1_AMAS0_DTL0_DVO0_EPS0_FL0_GRVW1_GSU1_IU1_LBSPP128_LPB2_LRVW2_NEPBS0_NLCA1_NLCB1_ONLL1_PGR2_PLR9_SIA3_SS0_SU0_SUS256_SRVW2_SVW4_SNLL0_TT1_32_TLDS1_USFGROn1_VW1_WSGRA1_WSGRB1_WG64_4_1_WGM1
    SolutionIndex: 1
    SolutionNameMin: Cijk_Ailk_Bljk_SB_MT32x32x16_MI16x16x4x1_SE_1LDSB0_AF0EM1_AMAS0_DTL0_DVO0_EPS0_FL0_GRVW1_GSU1_IU1_LBSPP128_LPB2_LRVW2_NEPBS0_NLCA1_NLCB1_ONLL1_PGR2_PLR5_SIA3_SS0_SU0_SUS256_SRVW2_SVW4_SNLL0_TT1_16_TLDS1_USFGROn1_VW1_WSGRA1_WSGRB1_WG32_8_1_WGM15
    SolutionIndex: 2
    SolutionNameMin: Cijk_Ailk_Bljk_SB_MT32x32x16_MI16x16x4x1_SE_1LDSB0_AF0EM1_AMAS0_DTL0_DVO0_EPS0_FL0_GRVW1_GSU1_IU1_LBSPP128_LPB2_LRVW2_NEPBS0_NLCA1_NLCB1_ONLL1_PGR2_PLR5_SIA3_SS0_SU0_SUS256_SRVW2_SVW4_SNLL0_TT1_16_TLDS1_USFGROn1_VW1_WSGRA1_WSGRB1_WG32_8_1_WGM1
    SolutionIndex: 3
    SolutionNameMin: Cijk_Ailk_Bljk_SB_MT64x32x16_MI16x16x4x1_SE_1LDSB0_AF0EM1_AMAS0_DTL0_DVO0_EPS1_FL0_GRVW1_GSU1_IU1_LBSPP128_LPB2_LRVW2_NEPBS0_NLCA1_NLCB1_ONLL1_PGR1_PLR5_SIA3_SS0_SU0_SUS256_SRVW2_SVW4_SNLL0_TT2_16_TLDS1_USFGROn1_VW1_WSGRA1_WSGRB1_WG32_8_1_WGM1
    SolutionIndex: 4
    SolutionNameMin: Cijk_Ailk_Bljk_SB_MT64x64x16_MI32x32x2x1_SN_1LDSB1_AF0EM1_AMAS0_DTL0_DVO0_EPS0_FL0_GRVW4_GSU1_IU1_LBSPP128_LPB4_LRVW2_NEPBS4_NLCA1_NLCB1_ONLL1_PGR2_PLR9_SIA3_SS1_SU0_SUS256_SRVW0_SVW1_SNLL0_TT1_32_TLDS1_USFGROn1_VW1_WSGRA1_WSGRB1_WG64_4_1_WGM5
    SolutionIndex: 5
    SolutionNameMin: Cijk_Ailk_Bljk_SB_MT64x64x16_MI32x32x2x1_SN_1LDSB1_AF0EM1_AMAS0_DTL0_DVO0_EPS0_FL0_GRVW4_GSU1_IU1_LBSPP128_LPB4_LRVW2_NEPBS4_NLCA1_NLCB1_ONLL1_PGR2_PLR9_SIA3_SS1_SU32_SUS256_SRVW0_SVW1_SNLL0_TT1_32_TLDS1_USFGROn1_VW1_WSGRA1_WSGRB1_WG64_4_1_WGM5
    SolutionIndex: 6
    SolutionNameMin: Cijk_Ailk_Bljk_SB_MT128x64x16_MI32x32x2x1_SN_1LDSB1_AF0EM1_AMAS3_DTL0_DVO0_EPS0_FL0_GRVW4_GSU1_IU1_LBSPP128_LPB4_LRVW2_NEPBS1_NLCA1_NLCB1_ONLL1_PGR2_PLR9_SIA3_SS1_SU0_SUS256_SRVW0_SVW2_SNLL0_TT2_32_TLDS1_USFGROn1_VW2_WSGRA1_WSGRB1_WG64_4_1_WGM5
    SolutionIndex: 7
    SolutionNameMin: Cijk_Ailk_Bljk_SB_MT64x32x32_MI16x16x4x1_SN_1LDSB1_AF0EM1_AMAS3_DTL0_DVO0_EPS0_FL0_GRVW4_GSU1_IU1_LBSPP128_LPB4_LRVW2_NEPBS4_NLCA1_NLCB1_ONLL1_PGR2_PLR9_SIA3_SS1_SU32_SUS256_SRVW0_SVW2_SNLL0_TT2_16_TLDS1_USFGROn1_VW2_WSGRA1_WSGRB1_WG32_8_1_WGM5
    SolutionIndex: 8
    SolutionNameMin: Cijk_Ailk_Bljk_SB_MT64x32x16_MI16x16x4x1_SE_1LDSB0_AF0EM1_AMAS0_DTL0_DVO0_EPS1_FL0_GRVW1_GSU1_IU1_LBSPP128_LPB2_LRVW2_NEPBS0_NLCA1_NLCB1_ONLL1_PGR1_PLR5_SIA3_SS0_SU0_SUS256_SRVW2_SVW4_SNLL0_TT2_16_TLDS1_USFGROn1_VW1_WSGRA1_WSGRB1_WG32_8_1_WGM15
    SolutionIndex: 9
    SolutionNameMin: Cijk_Ailk_Bljk_SB_MT64x16x16_MI16x16x4x1_SE_1LDSB0_AF0EM1_AMAS0_DTL0_DVO0_EPS1_FL0_GRVW1_GSU1_IU1_LBSPP128_LPB2_LRVW2_NEPBS0_NLCA1_NLCB1_ONLL1_PGR1_PLR5_SIA3_SS0_SU0_SUS256_SRVW0_SVW4_SNLL0_TT1_16_TLDS1_USFGROn1_VW1_WSGRA1_WSGRB1_WG64_4_1_WGM2
    SolutionIndex: 10
    SolutionNameMin: Cijk_Ailk_Bljk_SB_MT64x32x32_MI16x16x4x1_SE_1LDSB0_AF0EM1_AMAS0_DTL0_DVO0_EPS0_FL0_GRVW2_GSU1_IU1_LBSPP128_LPB2_LRVW2_NEPBS0_NLCA1_NLCB1_ONLL1_PGR2_PLR9_SIA3_SS0_SU0_SUS256_SRVW2_SVW4_SNLL0_TT2_16_TLDS1_USFGROn1_VW1_WSGRA1_WSGRB1_WG32_8_1_WGM2
    SolutionIndex: 11
    SolutionNameMin: Cijk_Ailk_Bljk_SB_MT16x64x16_MI16x16x4x1_SN_1LDSB0_AF0EM1_AMAS0_DTL0_DVO0_EPS0_FL0_GRVW4_GSU1_IU1_LBSPP128_LPB4_LRVW2_NEPBS8_NLCA1_NLCB1_ONLL1_PGR2_PLR5_SIA3_SS1_SU0_SUS256_SRVW0_SVW1_SNLL0_TT1_16_TLDS1_USFGROn1_VW1_WSGRA1_WSGRB1_WG16_16_1_WGM5
    SolutionIndex: 12
    SolutionNameMin: Cijk_Ailk_Bljk_SB_MT16x64x32_MI16x16x4x1_SE_1LDSB0_AF0EM1_AMAS0_DTL0_DVO0_EPS1_FL0_GRVW1_GSU1_IU1_LBSPP128_LPB2_LRVW2_NEPBS0_NLCA1_NLCB1_ONLL1_PGR1_PLR9_SIA3_SS0_SU0_SUS256_SRVW0_SVW4_SNLL0_TT1_16_TLDS1_USFGROn1_VW1_WSGRA1_WSGRB1_WG16_16_1_WGM1
    SolutionIndex: 13
    SolutionNameMin: Cijk_Ailk_Bljk_SB_MT64x16x32_MI16x16x4x1_SE_1LDSB0_AF0EM1_AMAS0_DTL0_DVO0_EPS0_FL0_GRVW1_GSU1_IU1_LBSPP128_LPB2_LRVW2_NEPBS0_NLCA1_NLCB1_ONLL1_PGR2_PLR9_SIA3_SS0_SU0_SUS256_SRVW0_SVW4_SNLL0_TT1_16_TLDS1_USFGROn1_VW1_WSGRA1_WSGRB1_WG64_4_1_WGM1
    SolutionIndex: 14
    SolutionNameMin: Cijk_Ailk_Bljk_SB_MT16x16x32_MI16x16x4x1_SN_1LDSB0_AF0EM1_AMAS0_DTL0_DVO0_EPS0_FL0_GRVW4_GSU1_IU1_LBSPP128_LPB4_LRVW2_NEPBS8_NLCA1_NLCB1_ONLL1_PGR2_PLR9_SIA3_SS1_SU32_SUS128_SRVW0_SVW1_SNLL0_TT1_16_TLDS1_USFGROn1_VW1_WSGRA1_WSGRB1_WG16_4_1_WGM5
    SolutionIndex: 15
    SolutionNameMin: Cijk_Ailk_Bljk_SB_MT32x32x32_MI16x16x4x1_SE_1LDSB0_AF0EM1_AMAS0_DTL0_DVO0_EPS0_FL0_GRVW4_GSU1_IU1_LBSPP128_LPB4_LRVW2_NEPBS0_NLCA1_NLCB1_ONLL1_PGR2_PLR9_SIA3_SS0_SU0_SUS256_SRVW2_SVW4_SNLL0_TT1_16_TLDS1_USFGROn1_VW1_WSGRA1_WSGRB1_WG32_8_1_WGM1
    SolutionIndex: 16
    SolutionNameMin: Cijk_Ailk_Bljk_SB_MT16x16x32_MI16x16x4x1_SE_1LDSB0_AF0EM1_AMAS0_DTL0_DVO0_EPS0_FL0_GRVW4_GSU1_IU1_LBSPP128_LPB4_LRVW2_NEPBS0_NLCA1_NLCB1_ONLL1_PGR2_PLR9_SIA3_SS0_SU0_SUS256_SRVW0_SVW4_SNLL0_TT1_16_TLDS1_USFGROn1_VW1_WSGRA1_WSGRB1_WG16_4_1_WGM1
    SolutionIndex: 17
    SolutionNameMin: Cijk_Ailk_Bljk_SB_MT16x16x32_MI16x16x4x1_SN_1LDSB0_AF0EM1_AMAS0_DTL0_DVO0_EPS0_FL0_GRVW4_GSU1_IU1_LBSPP128_LPB4_LRVW2_NEPBS4_NLCA1_NLCB1_ONLL1_PGR2_PLR9_SIA3_SS1_SU32_SUS256_SRVW0_SVW1_SNLL0_TT1_16_TLDS1_USFGROn1_VW1_WSGRA1_WSGRB1_WG16_4_1_WGM10
    SolutionIndex: 18
    SolutionNameMin: Cijk_Ailk_Bljk_SB_MT64x16x32_MI16x16x4x1_SE_1LDSB0_AF0EM1_AMAS0_DTL0_DVO0_EPS0_FL0_GRVW2_GSU1_IU1_LBSPP128_LPB2_LRVW2_NEPBS0_NLCA1_NLCB1_ONLL1_PGR2_PLR9_SIA3_SS0_SU32_SUS128_SRVW0_SVW4_SNLL0_TT1_16_TLDS1_USFGROn1_VW1_WSGRA1_WSGRB1_WG64_4_1_WGM2
    SolutionIndex: 19
    SolutionNameMin: Cijk_Ailk_Bljk_SB_MT32x32x32_MI16x16x4x1_SE_1LDSB0_AF0EM1_AMAS0_DTL0_DVO0_EPS0_FL0_GRVW4_GSU1_IU1_LBSPP128_LPB4_LRVW2_NEPBS0_NLCA1_NLCB1_ONLL1_PGR2_PLR9_SIA3_SS0_SU32_SUS128_SRVW2_SVW4_SNLL0_TT1_16_TLDS1_USFGROn1_VW1_WSGRA1_WSGRB1_WG32_8_1_WGM1
    SolutionIndex: 20
    SolutionNameMin: Cijk_Ailk_Bljk_SB_MT16x16x32_MI16x16x4x1_SE_1LDSB0_AF0EM1_AMAS0_DTL0_DVO0_EPS0_FL0_GRVW4_GSU1_IU1_LBSPP128_LPB4_LRVW2_NEPBS0_NLCA1_NLCB1_ONLL1_PGR2_PLR9_SIA3_SS0_SU32_SUS128_SRVW0_SVW4_SNLL0_TT1_16_TLDS1_USFGROn1_VW1_WSGRA1_WSGRB1_WG16_4_1_WGM1
    SolutionIndex: 21
    SolutionNameMin: Cijk_Ailk_Bljk_SB_MT64x16x16_MI16x16x4x1_SE_1LDSB0_AF0EM1_AMAS0_DTL0_DVO0_EPS0_FL0_GRVW1_GSU1_IU1_LBSPP128_LPB2_LRVW2_NEPBS0_NLCA1_NLCB1_ONLL1_PGR2_PLR5_SIA3_SS0_SU0_SUS256_SRVW2_SVW4_SNLL0_TT1_16_TLDS1_USFGROn1_VW1_WSGRA1_WSGRB1_WG64_4_1_WGM1
    SolutionIndex: 22
    SolutionNameMin: Cijk_Ailk_Bljk_SB_MT16x16x32_MI16x16x4x1_SE_1LDSB0_AF0EM1_AMAS0_DTL0_DVO0_EPS0_FL0_GRVW4_GSU1_IU1_LBSPP128_LPB4_LRVW2_NEPBS0_NLCA1_NLCB1_ONLL1_PGR2_PLR9_SIA3_SS0_SU0_SUS256_SRVW0_SVW4_SNLL0_TT1_16_TLDS1_USFGROn1_VW1_WSGRA1_WSGRB1_WG16_4_1_WGM2
    SolutionIndex: 23
    SolutionNameMin: Cijk_Ailk_Bljk_SB_MT16x16x32_MI16x16x4x1_SE_1LDSB0_AF0EM1_AMAS0_DTL0_DVO0_EPS0_FL0_GRVW2_GSU1_IU1_LBSPP128_LPB2_LRVW2_NEPBS0_NLCA1_NLCB1_ONLL1_PGR2_PLR9_SIA3_SS0_SU0_SUS256_SRVW0_SVW4_SNLL0_TT1_16_TLDS1_USFGROn1_VW1_WSGRA1_WSGRB1_WG16_4_1_WGM1
    SolutionIndex: 24
    SolutionNameMin: Cijk_Ailk_Bljk_SB_MT64x32x32_MI16x16x4x1_SE_1LDSB0_AF0EM1_AMAS0_DTL0_DVO0_EPS0_FL0_GRVW4_GSU1_IU1_LBSPP128_LPB4_LRVW2_NEPBS0_NLCA1_NLCB1_ONLL1_PGR2_PLR9_SIA3_SS0_SU0_SUS256_SRVW2_SVW4_SNLL0_TT2_16_TLDS1_USFGROn1_VW1_WSGRA1_WSGRB1_WG32_8_1_WGM15
    SolutionIndex: 25
    SolutionNameMin: Cijk_Ailk_Bljk_SB_MT128x64x16_MI32x32x2x1_SE_1LDSB0_AF0EM1_AMAS0_DTL0_DVO0_EPS0_FL0_GRVW2_GSU1_IU1_LBSPP128_LPB2_LRVW2_NEPBS0_NLCA1_NLCB1_ONLL1_PGR2_PLR9_SIA3_SS0_SU0_SUS256_SRVW2_SVW4_SNLL0_TT2_32_TLDS1_USFGROn1_VW1_WSGRA1_WSGRB1_WG64_4_1_WGM15
    SolutionIndex: 26
    SolutionNameMin: Cijk_Ailk_Bljk_SB_MT64x144x16_MI16x16x4x1_SE_1LDSB0_AF0EM1_AMAS0_DTL0_DVO0_EPS0_FL0_GRVW1_GSU1_IU1_LBSPP128_LPB2_LRVW2_NEPBS0_NLCA1_NLCB1_ONLL1_PGR2_PLR5_SIA3_SS0_SU0_SUS256_SRVW2_SVW4_SNLL0_TT1_144_TLDS1_USFGROn1_VW1_WSGRA1_WSGRB1_WG64_4_1_WGM1
    SolutionIndex: 27
    SolutionNameMin: Cijk_Ailk_Bljk_SB_MT16x16x32_MI16x16x4x1_SE_1LDSB0_AF0EM1_AMAS0_DTL0_DVO0_EPS0_FL0_GRVW4_GSU1_IU1_LBSPP128_LPB4_LRVW2_NEPBS0_NLCA1_NLCB1_ONLL1_PGR2_PLR9_SIA3_SS0_SU32_SUS256_SRVW0_SVW4_SNLL0_TT1_16_TLDS1_USFGROn1_VW1_WSGRA1_WSGRB1_WG16_4_1_WGM1
    SolutionIndex: 28
    SolutionNameMin: Cijk_Ailk_Bljk_SB_MT32x32x32_MI16x16x4x1_SE_1LDSB0_AF0EM1_AMAS0_DTL0_DVO0_EPS0_FL0_GRVW1_GSU1_IU1_LBSPP128_LPB2_LRVW2_NEPBS0_NLCA1_NLCB1_ONLL1_PGR2_PLR9_SIA3_SS0_SU32_SUS256_SRVW2_SVW4_SNLL0_TT1_16_TLDS1_USFGROn1_VW1_WSGRA1_WSGRB1_WG32_8_1_WGM1
    SolutionIndex: 29
    SolutionNameMin: Cijk_Ailk_Bljk_SB_MT64x32x32_MI16x16x4x1_SN_1LDSB1_AF0EM1_AMAS3_DTL0_DVO0_EPS0_FL0_GRVW4_GSU1_IU1_LBSPP128_LPB4_LRVW2_NEPBS1_NLCA1_NLCB1_ONLL1_PGR2_PLR9_SIA3_SS1_SU32_SUS256_SRVW0_SVW2_SNLL0_TT2_16_TLDS1_USFGROn1_VW2_WSGRA1_WSGRB1_WG32_8_1_WGM10
    SolutionIndex: 30
    SolutionNameMin: Cijk_Ailk_Bljk_SB_MT64x32x32_MI16x16x4x1_SE_1LDSB0_AF0EM1_AMAS0_DTL0_DVO0_EPS0_FL0_GRVW2_GSU1_IU1_LBSPP128_LPB2_LRVW2_NEPBS0_NLCA1_NLCB1_ONLL1_PGR2_PLR9_SIA3_SS0_SU0_SUS256_SRVW2_SVW4_SNLL0_TT2_16_TLDS1_USFGROn1_VW1_WSGRA1_WSGRB1_WG32_8_1_WGM15
    SolutionIndex: 31
    SolutionNameMin: Cijk_Ailk_Bljk_SB_MT64x32x32_MI16x16x4x1_SE_1LDSB0_AF0EM1_AMAS0_DTL0_DVO0_EPS0_FL0_GRVW4_GSU1_IU1_LBSPP128_LPB4_LRVW2_NEPBS0_NLCA1_NLCB1_ONLL1_PGR2_PLR9_SIA3_SS0_SU32_SUS128_SRVW2_SVW4_SNLL0_TT2_16_TLDS1_USFGROn1_VW1_WSGRA1_WSGRB1_WG32_8_1_WGM15
    SolutionIndex: 32
    SolutionNameMin: Cijk_Ailk_Bljk_SB_MT64x64x32_MI32x32x2x1_SE_1LDSB0_AF0EM1_AMAS0_DTL0_DVO0_EPS0_FL0_GRVW2_GSU1_IU1_LBSPP128_LPB2_LRVW2_NEPBS0_NLCA1_NLCB1_ONLL1_PGR2_PLR17_SIA3_SS0_SU0_SUS256_SRVW2_SVW4_SNLL0_TT1_32_TLDS1_USFGROn1_VW1_WSGRA1_WSGRB1_WG64_4_1_WGM2
    SolutionIndex: 33
    SolutionNameMin: Cijk_Ailk_Bljk_SB_MT64x32x16_MI16x16x4x1_SE_1LDSB0_AF0EM1_AMAS0_DTL0_DVO0_EPS0_FL0_GRVW2_GSU1_IU1_LBSPP128_LPB2_LRVW2_NEPBS0_NLCA1_NLCB1_ONLL1_PGR2_PLR5_SIA3_SS0_SU0_SUS256_SRVW2_SVW4_SNLL0_TT2_16_TLDS1_USFGROn1_VW1_WSGRA1_WSGRB1_WG32_8_1_WGM2
    SolutionIndex: 34
    SolutionNameMin: Cijk_Ailk_Bljk_SB_MT64x32x32_MI16x16x4x1_SE_1LDSB0_AF0EM1_AMAS0_DTL0_DVO0_EPS0_FL0_GRVW4_GSU1_IU1_LBSPP128_LPB4_LRVW2_NEPBS0_NLCA1_NLCB1_ONLL1_PGR2_PLR9_SIA3_SS0_SU32_SUS256_SRVW2_SVW4_SNLL0_TT2_16_TLDS1_USFGROn1_VW1_WSGRA1_WSGRB1_WG32_8_1_WGM2
    SolutionIndex: 35
    SolutionNameMin: Cijk_Ailk_Bljk_SB_MT64x128x16_MI32x32x2x1_SE_1LDSB0_AF0EM1_AMAS0_DTL0_DVO0_EPS0_FL0_GRVW1_GSU1_IU1_LBSPP128_LPB2_LRVW2_NEPBS0_NLCA1_NLCB1_ONLL1_PGR2_PLR9_SIA3_SS0_SU0_SUS256_SRVW2_SVW4_SNLL0_TT1_64_TLDS1_USFGROn1_VW1_WSGRA1_WSGRB1_WG64_4_1_WGM2
    SolutionIndex: 36
    SolutionNameMin: Cijk_Ailk_Bljk_SB_MT64x32x32_MI16x16x4x1_SN_1LDSB1_AF0EM1_AMAS3_DTL0_DVO0_EPS0_FL0_GRVW4_GSU1_IU1_LBSPP128_LPB4_LRVW2_NEPBS2_NLCA1_NLCB1_ONLL1_PGR2_PLR9_SIA3_SS1_SU32_SUS256_SRVW0_SVW2_SNLL0_TT2_16_TLDS1_USFGROn1_VW2_WSGRA1_WSGRB1_WG32_8_1_WGM5
    SolutionIndex: 37
    SolutionNameMin: Cijk_Ailk_Bljk_SB_MT32x64x32_MI16x16x4x1_SE_1LDSB0_AF0EM1_AMAS0_DTL0_DVO0_EPS0_FL0_GRVW2_GSU1_IU1_LBSPP128_LPB2_LRVW2_NEPBS0_NLCA1_NLCB1_ONLL1_PGR2_PLR9_SIA3_SS0_SU0_SUS256_SRVW2_SVW4_SNLL0_TT1_32_TLDS1_USFGROn1_VW1_WSGRA1_WSGRB1_WG32_8_1_WGM15
    SolutionIndex: 38
    SolutionNameMin: Cijk_Ailk_Bljk_SB_MT64x16x16_MI16x16x4x1_SE_1LDSB0_AF0EM1_AMAS0_DTL0_DVO0_EPS0_FL0_GRVW1_GSU1_IU1_LBSPP128_LPB2_LRVW2_NEPBS0_NLCA1_NLCB1_ONLL1_PGR2_PLR5_SIA3_SS0_SU0_SUS256_SRVW2_SVW4_SNLL0_TT1_16_TLDS1_USFGROn1_VW1_WSGRA1_WSGRB1_WG64_4_1_WGM2
    SolutionIndex: 39
    SolutionNameMin: Cijk_Ailk_Bljk_SB_MT64x16x32_MI16x16x4x1_SE_1LDSB0_AF0EM1_AMAS0_DTL0_DVO0_EPS0_FL0_GRVW1_GSU1_IU1_LBSPP128_LPB2_LRVW2_NEPBS0_NLCA1_NLCB1_ONLL1_PGR2_PLR9_SIA3_SS0_SU0_SUS256_SRVW0_SVW4_SNLL0_TT1_16_TLDS1_USFGROn1_VW1_WSGRA1_WSGRB1_WG64_4_1_WGM2
    SolutionIndex: 40
    SolutionNameMin: Cijk_Ailk_Bljk_SB_MT64x64x32_MI32x32x2x1_SE_1LDSB0_AF0EM1_AMAS0_DTL0_DVO0_EPS0_FL0_GRVW1_GSU1_IU1_LBSPP128_LPB2_LRVW2_NEPBS0_NLCA1_NLCB1_ONLL1_PGR2_PLR17_SIA3_SS0_SU0_SUS256_SRVW2_SVW4_SNLL0_TT1_32_TLDS1_USFGROn1_VW1_WSGRA1_WSGRB1_WG64_4_1_WGM1
    SolutionIndex: 41
    SolutionNameMin: Cijk_Ailk_Bljk_SB_MT128x64x16_MI32x32x2x1_SE_1LDSB0_AF0EM1_AMAS0_DTL0_DVO0_EPS0_FL0_GRVW1_GSU1_IU1_LBSPP128_LPB2_LRVW2_NEPBS0_NLCA2_NLCB1_ONLL1_PGR2_PLR9_SIA3_SS0_SU0_SUS256_SRVW2_SVW4_SNLL0_TT2_32_TLDS1_USFGROn1_VW1_WSGRA1_WSGRB1_WG64_4_1_WGM1
    SolutionIndex: 42
    SolutionNameMin: Cijk_Ailk_Bljk_SB_MT144x64x16_MI16x16x4x1_SE_1LDSB0_AF0EM1_AMAS0_DTL0_DVO0_EPS0_FL0_GRVW1_GSU1_IU1_LBSPP128_LPB2_LRVW2_NEPBS0_NLCA9_NLCB1_ONLL1_PGR2_PLR5_SIA3_SS0_SU0_SUS256_SRVW0_SVW4_SNLL0_TT9_16_TLDS1_USFGROn1_VW1_WSGRA1_WSGRB1_WG16_16_1_WGM1
    SolutionIndex: 43
    SolutionNameMin: Cijk_Ailk_Bljk_SB_MT64x32x16_MI16x16x4x1_SE_1LDSB0_AF0EM1_AMAS0_DTL0_DVO0_EPS1_FL0_GRVW1_GSU1_IU1_LBSPP128_LPB2_LRVW2_NEPBS0_NLCA1_NLCB1_ONLL1_PGR1_PLR5_SIA3_SS0_SU0_SUS256_SRVW2_SVW4_SNLL0_TT2_16_TLDS1_USFGROn1_VW1_WSGRA1_WSGRB1_WG32_8_1_WGM2
    SolutionIndex: 44
    SolutionNameMin: Cijk_Ailk_Bljk_SB_MT64x32x16_MI16x16x4x1_SE_1LDSB0_AF0EM1_AMAS0_DTL0_DVO0_EPS0_FL0_GRVW2_GSU1_IU1_LBSPP128_LPB2_LRVW2_NEPBS0_NLCA1_NLCB1_ONLL1_PGR2_PLR5_SIA3_SS0_SU32_SUS128_SRVW2_SVW4_SNLL0_TT2_16_TLDS1_USFGROn1_VW1_WSGRA1_WSGRB1_WG32_8_1_WGM2
    SolutionIndex: 45
    SolutionNameMin: Cijk_Ailk_Bljk_SB_MT32x32x32_MI16x16x4x1_SE_1LDSB0_AF0EM1_AMAS0_DTL0_DVO0_EPS0_FL0_GRVW4_GSU1_IU1_LBSPP128_LPB4_LRVW2_NEPBS0_NLCA1_NLCB1_ONLL1_PGR2_PLR9_SIA3_SS0_SU32_SUS256_SRVW2_SVW4_SNLL0_TT1_16_TLDS1_USFGROn1_VW1_WSGRA1_WSGRB1_WG32_8_1_WGM2
    SolutionIndex: 46
    SolutionNameMin: Cijk_Ailk_Bljk_SB_MT16x64x32_MI16x16x4x1_SE_1LDSB0_AF0EM1_AMAS0_DTL0_DVO0_EPS0_FL0_GRVW1_GSU1_IU1_LBSPP128_LPB2_LRVW2_NEPBS0_NLCA1_NLCB1_ONLL1_PGR2_PLR9_SIA3_SS0_SU0_SUS256_SRVW0_SVW4_SNLL0_TT1_16_TLDS1_USFGROn1_VW1_WSGRA1_WSGRB1_WG16_16_1_WGM15
    SolutionIndex: 47
    SolutionNameMin: Cijk_Ailk_Bljk_SB_MT16x16x32_MI16x16x4x1_SN_1LDSB0_AF0EM1_AMAS0_DTL0_DVO0_EPS0_FL0_GRVW4_GSU1_IU1_LBSPP128_LPB4_LRVW2_NEPBS1_NLCA1_NLCB1_ONLL1_PGR2_PLR9_SIA3_SS1_SU0_SUS256_SRVW0_SVW1_SNLL0_TT1_16_TLDS1_USFGROn1_VW1_WSGRA1_WSGRB1_WG16_4_1_WGM10
    SolutionIndex: 48
    SolutionNameMin: Cijk_Ailk_Bljk_SB_MT64x64x16_MI32x32x2x1_SE_1LDSB0_AF0EM1_AMAS0_DTL0_DVO0_EPS0_FL0_GRVW4_GSU1_IU1_LBSPP128_LPB4_LRVW2_NEPBS0_NLCA1_NLCB1_ONLL1_PGR2_PLR9_SIA3_SS0_SU0_SUS256_SRVW2_SVW4_SNLL0_TT1_32_TLDS1_USFGROn1_VW1_WSGRA1_WSGRB1_WG64_4_1_WGM1
    SolutionIndex: 49
    SolutionNameMin: Cijk_Ailk_Bljk_SB_MT64x128x16_MI16x16x4x1_SE_1LDSB0_AF0EM1_AMAS3_DTL0_DVO0_EPS1_FL1_GRVW4_GSU1_IU1_LBSPP0_LPB0_LRVW1_NEPBS0_NLCA1_NLCB1_ONLL0_PGR1_PLR1_SIA3_SS0_SU32_SUS256_SRVW4_SVW4_SNLL0_TT4_32_TLDS1_USFGROn1_VW4_WSGRA0_WSGRB0_WG16_16_1_WGM1
    SolutionIndex: 50
    SolutionNameMin: Cijk_Ailk_Bljk_SB_MT64x16x32_MI16x16x4x1_SE_1LDSB0_AF0EM1_AMAS0_DTL0_DVO0_EPS0_FL0_GRVW2_GSU1_IU1_LBSPP128_LPB2_LRVW2_NEPBS0_NLCA1_NLCB1_ONLL1_PGR2_PLR9_SIA3_SS0_SU32_SUS128_SRVW2_SVW4_SNLL0_TT1_16_TLDS1_USFGROn1_VW1_WSGRA1_WSGRB1_WG64_4_1_WGM1
    SolutionIndex: 51
    SolutionNameMin: Cijk_Ailk_Bljk_SB_MT64x128x16_MI32x32x2x1_SE_1LDSB0_AF0EM1_AMAS0_DTL0_DVO0_EPS0_FL0_GRVW1_GSU1_IU1_LBSPP128_LPB2_LRVW2_NEPBS0_NLCA1_NLCB1_ONLL1_PGR2_PLR9_SIA3_SS0_SU0_SUS256_SRVW2_SVW4_SNLL0_TT1_64_TLDS1_USFGROn1_VW1_WSGRA1_WSGRB1_WG64_4_1_WGM1
    SolutionIndex: 52
    SolutionNameMin: Cijk_Ailk_Bljk_SB_MT16x64x32_MI16x16x4x1_SE_1LDSB0_AF0EM1_AMAS0_DTL0_DVO0_EPS0_FL0_GRVW4_GSU1_IU1_LBSPP128_LPB4_LRVW2_NEPBS0_NLCA1_NLCB1_ONLL1_PGR2_PLR9_SIA3_SS0_SU0_SUS256_SRVW0_SVW4_SNLL0_TT1_16_TLDS1_USFGROn1_VW1_WSGRA1_WSGRB1_WG16_16_1_WGM2
    SolutionIndex: 53
    SolutionNameMin: Cijk_Ailk_Bljk_SB_MT16x16x32_MI16x16x4x1_SE_1LDSB0_AF0EM1_AMAS0_DTL0_DVO0_EPS0_FL0_GRVW4_GSU1_IU1_LBSPP128_LPB4_LRVW2_NEPBS0_NLCA1_NLCB1_ONLL1_PGR2_PLR9_SIA3_SS0_SU32_SUS128_SRVW0_SVW4_SNLL0_TT1_16_TLDS1_USFGROn1_VW1_WSGRA1_WSGRB1_WG16_4_1_WGM2
    SolutionIndex: 54
    SolutionNameMin: Cijk_Ailk_Bljk_SB_MT144x64x16_MI16x16x4x1_SE_1LDSB0_AF0EM1_AMAS0_DTL0_DVO0_EPS0_FL0_GRVW1_GSU1_IU1_LBSPP128_LPB2_LRVW2_NEPBS0_NLCA9_NLCB1_ONLL1_PGR2_PLR5_SIA3_SS0_SU0_SUS256_SRVW0_SVW4_SNLL0_TT9_16_TLDS1_USFGROn1_VW1_WSGRA1_WSGRB1_WG16_16_1_WGM2
    SolutionIndex: 55
    SolutionNameMin: Cijk_Ailk_Bljk_SB_MT16x64x32_MI16x16x4x1_SE_1LDSB0_AF0EM1_AMAS0_DTL0_DVO0_EPS0_FL0_GRVW1_GSU1_IU1_LBSPP128_LPB2_LRVW2_NEPBS0_NLCA1_NLCB1_ONLL1_PGR2_PLR9_SIA3_SS0_SU0_SUS256_SRVW2_SVW4_SNLL0_TT1_16_TLDS1_USFGROn1_VW1_WSGRA1_WSGRB1_WG16_16_1_WGM1
    SolutionIndex: 56
    SolutionNameMin: Cijk_Ailk_Bljk_SB_MT96x96x16_MI16x16x4x1_SN_1LDSB1_AF0EM1_AMAS0_DTL0_DVO0_EPS0_FL0_GRVW2_GSU1_IU1_LBSPP128_LPB2_LRVW2_NEPBS2_NLCA3_NLCB1_ONLL1_PGR2_PLR5_SIA3_SS1_SU32_SUS256_SRVW0_SVW1_SNLL0_TT3_48_TLDS1_USFGROn1_VW1_WSGRA1_WSGRB1_WG32_8_1_WGM5
    SolutionIndex: 57
    SolutionNameMin: Cijk_Ailk_Bljk_SB_MT16x16x32_MI16x16x4x1_SN_1LDSB0_AF0EM1_AMAS0_DTL0_DVO0_EPS0_FL0_GRVW4_GSU1_IU1_LBSPP128_LPB4_LRVW2_NEPBS1_NLCA1_NLCB1_ONLL1_PGR2_PLR9_SIA3_SS1_SU0_SUS256_SRVW0_SVW1_SNLL0_TT1_16_TLDS1_USFGROn1_VW1_WSGRA1_WSGRB1_WG16_4_1_WGM5
    SolutionIndex: 58
    SolutionNameMin: Cijk_Ailk_Bljk_SB_MT16x64x32_MI16x16x4x1_SE_1LDSB0_AF0EM1_AMAS0_DTL0_DVO0_EPS0_FL0_GRVW4_GSU1_IU1_LBSPP128_LPB4_LRVW2_NEPBS0_NLCA1_NLCB1_ONLL1_PGR2_PLR9_SIA3_SS0_SU0_SUS256_SRVW0_SVW4_SNLL0_TT1_16_TLDS1_USFGROn1_VW1_WSGRA1_WSGRB1_WG16_16_1_WGM15
    SolutionIndex: 59
    SolutionNameMin: Cijk_Ailk_Bljk_SB_MT64x128x16_MI32x32x2x1_SE_1LDSB0_AF0EM1_AMAS0_DTL0_DVO0_EPS0_FL0_GRVW1_GSU1_IU1_LBSPP128_LPB2_LRVW2_NEPBS0_NLCA1_NLCB1_ONLL1_PGR2_PLR9_SIA3_SS0_SU32_SUS128_SRVW2_SVW4_SNLL0_TT1_64_TLDS1_USFGROn1_VW1_WSGRA1_WSGRB1_WG64_4_1_WGM2
    SolutionIndex: 60
    SolutionNameMin: Cijk_Ailk_Bljk_SB_MT16x64x32_MI16x16x4x1_SE_1LDSB0_AF0EM1_AMAS0_DTL0_DVO0_EPS0_FL0_GRVW1_GSU1_IU1_LBSPP128_LPB2_LRVW2_NEPBS0_NLCA1_NLCB1_ONLL1_PGR2_PLR9_SIA3_SS0_SU0_SUS256_SRVW0_SVW4_SNLL0_TT1_16_TLDS1_USFGROn1_VW1_WSGRA1_WSGRB1_WG16_16_1_WGM1
    SolutionIndex: 61
    SolutionNameMin: Cijk_Ailk_Bljk_SB_MT32x32x32_MI16x16x4x1_SE_1LDSB0_AF0EM1_AMAS0_DTL0_DVO0_EPS0_FL0_GRVW4_GSU1_IU1_LBSPP128_LPB4_LRVW2_NEPBS0_NLCA1_NLCB1_ONLL1_PGR2_PLR9_SIA3_SS0_SU0_SUS256_SRVW2_SVW4_SNLL0_TT1_16_TLDS1_USFGROn1_VW1_WSGRA1_WSGRB1_WG32_8_1_WGM15
    SolutionIndex: 62
    SolutionNameMin: Cijk_Ailk_Bljk_SB_MT32x32x32_MI16x16x4x1_SE_1LDSB0_AF0EM1_AMAS0_DTL0_DVO0_EPS0_FL0_GRVW1_GSU1_IU1_LBSPP128_LPB2_LRVW2_NEPBS0_NLCA1_NLCB1_ONLL1_PGR2_PLR9_SIA3_SS0_SU0_SUS256_SRVW2_SVW4_SNLL0_TT1_16_TLDS1_USFGROn1_VW1_WSGRA1_WSGRB1_WG32_8_1_WGM1
    SolutionIndex: 63
    SolutionNameMin: Cijk_Ailk_Bljk_SB_MT64x64x32_MI32x32x2x1_SE_1LDSB0_AF0EM1_AMAS0_DTL0_DVO0_EPS0_FL0_GRVW2_GSU1_IU1_LBSPP128_LPB2_LRVW2_NEPBS0_NLCA1_NLCB1_ONLL1_PGR2_PLR17_SIA3_SS0_SU0_SUS256_SRVW2_SVW4_SNLL0_TT1_32_TLDS1_USFGROn1_VW1_WSGRA1_WSGRB1_WG64_4_1_WGM15
    SolutionIndex: 64
    SolutionNameMin: Cijk_Ailk_Bljk_SB_MT64x64x32_MI32x32x2x1_SE_1LDSB0_AF0EM1_AMAS0_DTL0_DVO0_EPS0_FL0_GRVW2_GSU1_IU1_LBSPP128_LPB2_LRVW2_NEPBS0_NLCA1_NLCB1_ONLL1_PGR2_PLR17_SIA3_SS0_SU32_SUS256_SRVW2_SVW4_SNLL0_TT1_32_TLDS1_USFGROn1_VW1_WSGRA1_WSGRB1_WG64_4_1_WGM1
    SolutionIndex: 65
    SolutionNameMin: Cijk_Ailk_Bljk_SB_MT64x144x16_MI16x16x4x1_SE_1LDSB0_AF0EM1_AMAS0_DTL0_DVO0_EPS0_FL0_GRVW1_GSU1_IU1_LBSPP128_LPB2_LRVW2_NEPBS0_NLCA1_NLCB1_ONLL1_PGR2_PLR5_SIA3_SS0_SU0_SUS256_SRVW2_SVW4_SNLL0_TT1_144_TLDS1_USFGROn1_VW1_WSGRA1_WSGRB1_WG64_4_1_WGM15
    SolutionIndex: 66
    SolutionNameMin: Cijk_Ailk_Bljk_SB_MT144x64x16_MI16x16x4x1_SE_1LDSB0_AF0EM1_AMAS0_DTL0_DVO0_EPS0_FL0_GRVW1_GSU1_IU1_LBSPP128_LPB2_LRVW2_NEPBS0_NLCA9_NLCB1_ONLL1_PGR2_PLR5_SIA3_SS0_SU32_SUS128_SRVW0_SVW4_SNLL0_TT9_16_TLDS1_USFGROn1_VW1_WSGRA1_WSGRB1_WG16_16_1_WGM15
    SolutionIndex: 67
    SolutionNameMin: Cijk_Ailk_Bljk_SB_MT16x64x16_MI16x16x4x1_SN_1LDSB0_AF0EM1_AMAS0_DTL0_DVO0_EPS0_FL0_GRVW4_GSU1_IU1_LBSPP128_LPB4_LRVW2_NEPBS2_NLCA1_NLCB1_ONLL1_PGR2_PLR5_SIA3_SS1_SU0_SUS256_SRVW0_SVW1_SNLL0_TT1_16_TLDS1_USFGROn1_VW1_WSGRA1_WSGRB1_WG16_16_1_WGM10
    SolutionIndex: 68
    SolutionNameMin: Cijk_Ailk_Bljk_SB_MT32x32x32_MI16x16x4x1_SE_1LDSB0_AF0EM1_AMAS0_DTL0_DVO0_EPS0_FL0_GRVW2_GSU1_IU1_LBSPP128_LPB2_LRVW2_NEPBS0_NLCA1_NLCB1_ONLL1_PGR2_PLR9_SIA3_SS0_SU32_SUS128_SRVW2_SVW4_SNLL0_TT1_16_TLDS1_USFGROn1_VW1_WSGRA1_WSGRB1_WG32_8_1_WGM1
    SolutionIndex: 69
    SolutionNameMin: Cijk_Ailk_Bljk_SB_MT32x64x32_MI16x16x4x1_SE_1LDSB0_AF0EM1_AMAS0_DTL0_DVO0_EPS0_FL0_GRVW1_GSU1_IU1_LBSPP128_LPB2_LRVW2_NEPBS0_NLCA1_NLCB1_ONLL1_PGR2_PLR9_SIA3_SS0_SU0_SUS256_SRVW2_SVW4_SNLL0_TT1_32_TLDS1_USFGROn1_VW1_WSGRA1_WSGRB1_WG32_8_1_WGM15
    SolutionIndex: 70
    SolutionNameMin: Cijk_Ailk_Bljk_SB_MT16x64x32_MI16x16x4x1_SE_1LDSB0_AF0EM1_AMAS0_DTL0_DVO0_EPS0_FL0_GRVW4_GSU1_IU1_LBSPP128_LPB4_LRVW2_NEPBS0_NLCA1_NLCB1_ONLL1_PGR2_PLR9_SIA3_SS0_SU32_SUS128_SRVW2_SVW4_SNLL0_TT1_16_TLDS1_USFGROn1_VW1_WSGRA1_WSGRB1_WG16_16_1_WGM1
    SolutionIndex: 71
    SolutionNameMin: Cijk_Ailk_Bljk_SB_MT64x32x16_MI16x16x4x1_SE_1LDSB0_AF0EM1_AMAS0_DTL0_DVO0_EPS0_FL0_GRVW4_GSU1_IU1_LBSPP128_LPB4_LRVW2_NEPBS0_NLCA1_NLCB1_ONLL1_PGR2_PLR5_SIA3_SS0_SU0_SUS256_SRVW2_SVW4_SNLL0_TT2_16_TLDS1_USFGROn1_VW1_WSGRA1_WSGRB1_WG32_8_1_WGM2
    SolutionIndex: 72
    SolutionNameMin: Cijk_Ailk_Bljk_SB_MT64x32x16_MI16x16x4x1_SE_1LDSB0_AF0EM1_AMAS0_DTL0_DVO0_EPS0_FL0_GRVW1_GSU1_IU1_LBSPP128_LPB2_LRVW2_NEPBS0_NLCA1_NLCB1_ONLL1_PGR2_PLR5_SIA3_SS0_SU0_SUS256_SRVW2_SVW4_SNLL0_TT2_16_TLDS1_USFGROn1_VW1_WSGRA1_WSGRB1_WG32_8_1_WGM15
    SolutionIndex: 73
    SolutionNameMin: Cijk_Ailk_Bljk_SB_MT64x32x16_MI16x16x4x1_SE_1LDSB0_AF0EM1_AMAS0_DTL0_DVO0_EPS0_FL0_GRVW1_GSU1_IU1_LBSPP128_LPB2_LRVW2_NEPBS0_NLCA1_NLCB1_ONLL1_PGR2_PLR5_SIA3_SS0_SU0_SUS256_SRVW2_SVW4_SNLL0_TT2_16_TLDS1_USFGROn1_VW1_WSGRA1_WSGRB1_WG32_8_1_WGM2
    SolutionIndex: 74
    SolutionNameMin: Cijk_Ailk_Bljk_SB_MT144x128x16_MI16x16x4x1_SE_1LDSB1_AF0EM1_AMAS0_DTL0_DVO0_EPS1_FL0_GRVW1_GSU1_IU1_LBSPP128_LPB2_LRVW2_NEPBS0_NLCA9_NLCB1_ONLL1_PGR1_PLR5_SIA3_SS0_SU0_SUS256_SRVW0_SVW4_SNLL0_TT9_32_TLDS1_USFGROn1_VW1_WSGRA1_WSGRB1_WG16_16_1_WGM1
    SolutionIndex: 75
    SolutionNameMin: Cijk_Ailk_Bljk_SB_MT96x96x32_MI16x16x4x1_SN_1LDSB1_AF0EM1_AMAS0_DTL0_DVO0_EPS0_FL0_GRVW2_GSU1_IU1_LBSPP128_LPB2_LRVW2_NEPBS8_NLCA3_NLCB1_ONLL1_PGR2_PLR9_SIA3_SS1_SU32_SUS256_SRVW0_SVW1_SNLL0_TT3_48_TLDS1_USFGROn1_VW1_WSGRA1_WSGRB1_WG32_8_1_WGM5
    SolutionIndex: 76
    SolutionNameMin: Cijk_Ailk_Bljk_SB_MT128x64x16_MI32x32x2x1_SE_1LDSB0_AF0EM1_AMAS0_DTL0_DVO0_EPS0_FL0_GRVW4_GSU1_IU1_LBSPP128_LPB4_LRVW2_NEPBS0_NLCA1_NLCB1_ONLL1_PGR2_PLR9_SIA3_SS0_SU0_SUS256_SRVW2_SVW4_SNLL0_TT2_32_TLDS1_USFGROn1_VW1_WSGRA1_WSGRB1_WG64_4_1_WGM2
    SolutionIndex: 77
    SolutionNameMin: Cijk_Ailk_Bljk_SB_MT96x96x16_MI16x16x4x1_SE_1LDSB1_AF0EM1_AMAS0_DTL0_DVO0_EPS0_FL0_GRVW2_GSU1_IU1_LBSPP128_LPB2_LRVW2_NEPBS0_NLCA3_NLCB1_ONLL1_PGR2_PLR5_SIA3_SS0_SU0_SUS256_SRVW0_SVW4_SNLL0_TT3_48_TLDS1_USFGROn1_VW1_WSGRA1_WSGRB1_WG32_8_1_WGM2
    SolutionIndex: 78
    SolutionNameMin: Cijk_Ailk_Bljk_SB_MT64x128x16_MI32x32x2x1_SE_1LDSB0_AF0EM1_AMAS0_DTL0_DVO0_EPS0_FL0_GRVW2_GSU1_IU1_LBSPP128_LPB2_LRVW2_NEPBS0_NLCA1_NLCB1_ONLL1_PGR2_PLR9_SIA3_SS0_SU0_SUS256_SRVW2_SVW4_SNLL0_TT1_64_TLDS1_USFGROn1_VW1_WSGRA1_WSGRB1_WG64_4_1_WGM1
    SolutionIndex: 79
    SolutionNameMin: Cijk_Ailk_Bljk_SB_MT32x32x32_MI16x16x4x1_SE_1LDSB0_AF0EM1_AMAS0_DTL0_DVO0_EPS0_FL0_GRVW1_GSU1_IU1_LBSPP128_LPB2_LRVW2_NEPBS0_NLCA1_NLCB1_ONLL1_PGR2_PLR9_SIA3_SS0_SU0_SUS256_SRVW2_SVW4_SNLL0_TT1_16_TLDS1_USFGROn1_VW1_WSGRA1_WSGRB1_WG32_8_1_WGM2
    SolutionIndex: 80
    SolutionNameMin: Cijk_Ailk_Bljk_SB_MT128x64x16_MI32x32x2x1_SE_1LDSB0_AF0EM1_AMAS0_DTL0_DVO0_EPS0_FL0_GRVW4_GSU1_IU1_LBSPP128_LPB4_LRVW2_NEPBS0_NLCA1_NLCB1_ONLL1_PGR2_PLR9_SIA3_SS0_SU0_SUS256_SRVW2_SVW4_SNLL0_TT2_32_TLDS1_USFGROn1_VW1_WSGRA1_WSGRB1_WG64_4_1_WGM15
    SolutionIndex: 81
    SolutionNameMin: Cijk_Ailk_Bljk_SB_MT64x128x32_MI32x32x2x1_SE_1LDSB0_AF0EM1_AMAS0_DTL0_DVO0_EPS0_FL0_GRVW1_GSU1_IU1_LBSPP128_LPB2_LRVW2_NEPBS0_NLCA1_NLCB1_ONLL1_PGR2_PLR17_SIA3_SS0_SU0_SUS256_SRVW2_SVW4_SNLL0_TT1_64_TLDS1_USFGROn1_VW1_WSGRA1_WSGRB1_WG64_4_1_WGM15
    SolutionIndex: 82
    SolutionNameMin: Cijk_Ailk_Bljk_SB_MT64x32x16_MI16x16x4x1_SE_1LDSB0_AF0EM1_AMAS0_DTL0_DVO0_EPS0_FL0_GRVW4_GSU1_IU1_LBSPP128_LPB4_LRVW2_NEPBS0_NLCA1_NLCB1_ONLL1_PGR2_PLR5_SIA3_SS0_SU0_SUS256_SRVW2_SVW4_SNLL0_TT2_16_TLDS1_USFGROn1_VW1_WSGRA1_WSGRB1_WG32_8_1_WGM15
    SolutionIndex: 83
    SolutionNameMin: Cijk_Ailk_Bljk_SB_MT64x64x16_MI32x32x2x1_SE_1LDSB0_AF0EM1_AMAS0_DTL0_DVO0_EPS0_FL0_GRVW1_GSU1_IU1_LBSPP128_LPB2_LRVW2_NEPBS0_NLCA1_NLCB1_ONLL1_PGR2_PLR9_SIA3_SS0_SU0_SUS256_SRVW2_SVW4_SNLL0_TT1_32_TLDS1_USFGROn1_VW1_WSGRA1_WSGRB1_WG64_4_1_WGM2
    SolutionIndex: 84
    SolutionNameMin: Cijk_Ailk_Bljk_SB_MT64x16x16_MI16x16x4x1_SN_1LDSB0_AF0EM1_AMAS0_DTL0_DVO0_EPS0_FL0_GRVW2_GSU1_IU1_LBSPP128_LPB2_LRVW2_NEPBS8_NLCA1_NLCB1_ONLL1_PGR2_PLR5_SIA3_SS1_SU0_SUS256_SRVW0_SVW1_SNLL0_TT1_16_TLDS1_USFGROn1_VW1_WSGRA1_WSGRB1_WG64_4_1_WGM10
    SolutionIndex: 85
    SolutionNameMin: Cijk_Ailk_Bljk_SB_MT128x96x16_MI32x32x2x1_SE_1LDSB0_AF0EM1_AMAS0_DTL0_DVO0_EPS0_FL0_GRVW2_GSU1_IU1_LBSPP128_LPB2_LRVW2_NEPBS0_NLCA1_NLCB1_ONLL1_PGR2_PLR9_SIA3_SS0_SU0_SUS256_SRVW2_SVW4_SNLL0_TT1_96_TLDS1_USFGROn1_VW1_WSGRA1_WSGRB1_WG128_2_1_WGM15
    SolutionIndex: 86
    SolutionNameMin: Cijk_Ailk_Bljk_SB_MT64x32x16_MI16x16x4x1_SE_1LDSB0_AF0EM1_AMAS0_DTL0_DVO0_EPS0_FL0_GRVW1_GSU1_IU1_LBSPP128_LPB2_LRVW2_NEPBS0_NLCA1_NLCB1_ONLL1_PGR2_PLR5_SIA3_SS0_SU0_SUS256_SRVW2_SVW4_SNLL0_TT2_16_TLDS1_USFGROn1_VW1_WSGRA1_WSGRB1_WG32_8_1_WGM1
    SolutionIndex: 87
    SolutionNameMin: Cijk_Ailk_Bljk_SB_MT64x32x16_MI16x16x4x1_SE_1LDSB0_AF0EM1_AMAS0_DTL0_DVO0_EPS0_FL0_GRVW1_GSU1_IU1_LBSPP128_LPB2_LRVW2_NEPBS0_NLCA1_NLCB1_ONLL1_PGR2_PLR5_SIA3_SS0_SU32_SUS256_SRVW2_SVW4_SNLL0_TT2_16_TLDS1_USFGROn1_VW1_WSGRA1_WSGRB1_WG32_8_1_WGM1
    SolutionIndex: 88
    SolutionNameMin: Cijk_Ailk_Bljk_SB_MT64x32x16_MI16x16x4x1_SE_1LDSB0_AF0EM1_AMAS0_DTL0_DVO0_EPS0_FL0_GRVW1_GSU1_IU1_LBSPP128_LPB2_LRVW2_NEPBS0_NLCA1_NLCB1_ONLL1_PGR2_PLR5_SIA3_SS0_SU32_SUS128_SRVW2_SVW4_SNLL0_TT2_16_TLDS1_USFGROn1_VW1_WSGRA1_WSGRB1_WG32_8_1_WGM1
    SolutionIndex: 89
    SolutionNameMin: Cijk_Ailk_Bljk_SB_MT128x96x16_MI32x32x2x1_SE_1LDSB0_AF0EM1_AMAS0_DTL0_DVO0_EPS1_FL0_GRVW2_GSU1_IU1_LBSPP128_LPB2_LRVW2_NEPBS0_NLCA1_NLCB1_ONLL1_PGR1_PLR9_SIA3_SS0_SU32_SUS128_SRVW2_SVW4_SNLL0_TT1_96_TLDS1_USFGROn1_VW1_WSGRA1_WSGRB1_WG128_2_1_WGM15
    SolutionIndex: 90
    SolutionNameMin: Cijk_Ailk_Bljk_SB_MT64x32x16_MI16x16x4x1_SE_1LDSB0_AF0EM1_AMAS0_DTL0_DVO0_EPS0_FL0_GRVW4_GSU1_IU1_LBSPP128_LPB4_LRVW2_NEPBS0_NLCA1_NLCB1_ONLL1_PGR2_PLR5_SIA3_SS0_SU0_SUS256_SRVW2_SVW4_SNLL0_TT2_16_TLDS1_USFGROn1_VW1_WSGRA1_WSGRB1_WG32_8_1_WGM1
    SolutionIndex: 91
    SolutionNameMin: Cijk_Ailk_Bljk_SB_MT128x96x16_MI32x32x2x1_SE_1LDSB0_AF0EM1_AMAS0_DTL0_DVO0_EPS1_FL0_GRVW2_GSU1_IU1_LBSPP128_LPB2_LRVW2_NEPBS0_NLCA1_NLCB1_ONLL1_PGR1_PLR9_SIA3_SS0_SU0_SUS256_SRVW2_SVW4_SNLL0_TT1_96_TLDS1_USFGROn1_VW1_WSGRA1_WSGRB1_WG128_2_1_WGM15
    SolutionIndex: 92
    SolutionNameMin: Cijk_Ailk_Bljk_SB_MT16x64x32_MI16x16x4x1_SE_1LDSB0_AF0EM1_AMAS0_DTL0_DVO0_EPS0_FL0_GRVW4_GSU1_IU1_LBSPP128_LPB4_LRVW2_NEPBS0_NLCA1_NLCB1_ONLL1_PGR2_PLR9_SIA3_SS0_SU32_SUS256_SRVW0_SVW4_SNLL0_TT1_16_TLDS1_USFGROn1_VW1_WSGRA1_WSGRB1_WG16_16_1_WGM2
    SolutionIndex: 93
    SolutionNameMin: Cijk_Ailk_Bljk_SB_MT16x64x16_MI16x16x4x1_SN_1LDSB0_AF0EM1_AMAS0_DTL0_DVO0_EPS0_FL0_GRVW2_GSU1_IU1_LBSPP128_LPB2_LRVW2_NEPBS4_NLCA1_NLCB1_ONLL1_PGR2_PLR5_SIA3_SS1_SU0_SUS256_SRVW0_SVW1_SNLL0_TT1_16_TLDS1_USFGROn1_VW1_WSGRA1_WSGRB1_WG16_16_1_WGM10
    SolutionIndex: 94
    SolutionNameMin: Cijk_Ailk_Bljk_SB_MT64x16x16_MI16x16x4x1_SE_1LDSB0_AF0EM1_AMAS0_DTL0_DVO0_EPS0_FL0_GRVW1_GSU1_IU1_LBSPP128_LPB2_LRVW2_NEPBS0_NLCA1_NLCB1_ONLL1_PGR2_PLR5_SIA3_SS0_SU32_SUS256_SRVW0_SVW4_SNLL0_TT1_16_TLDS1_USFGROn1_VW1_WSGRA1_WSGRB1_WG64_4_1_WGM1
    SolutionIndex: 95
    SolutionNameMin: Cijk_Ailk_Bljk_SB_MT64x16x16_MI16x16x4x1_SE_1LDSB0_AF0EM1_AMAS0_DTL0_DVO0_EPS0_FL0_GRVW2_GSU1_IU1_LBSPP128_LPB2_LRVW2_NEPBS0_NLCA1_NLCB1_ONLL1_PGR2_PLR5_SIA3_SS0_SU0_SUS256_SRVW2_SVW4_SNLL0_TT1_16_TLDS1_USFGROn1_VW1_WSGRA1_WSGRB1_WG64_4_1_WGM15
    SolutionIndex: 96
    SolutionNameMin: Cijk_Ailk_Bljk_SB_MT64x4x16_MI4x4x1x16_SE_1LDSB0_AF0EM1_AMAS0_DTL0_DVO0_EPS1_FL0_GRVW1_GSU1_IU1_LBSPP128_LPB2_LRVW2_NEPBS0_NLCA1_NLCB1_ONLL1_PGR1_PLR17_SIA3_SS0_SU0_SUS256_SRVW0_SVW4_SNLL0_TT1_4_TLDS1_USFGROn1_VW1_WSGRA1_WSGRB1_WG64_1_1_WGM2
    SolutionIndex: 97
    SolutionNameMin: Cijk_Ailk_Bljk_SB_MT16x64x32_MI16x16x4x1_SE_1LDSB0_AF0EM1_AMAS0_DTL0_DVO0_EPS0_FL0_GRVW4_GSU1_IU1_LBSPP128_LPB4_LRVW2_NEPBS0_NLCA1_NLCB1_ONLL1_PGR2_PLR9_SIA3_SS0_SU32_SUS256_SRVW0_SVW4_SNLL0_TT1_16_TLDS1_USFGROn1_VW1_WSGRA1_WSGRB1_WG16_16_1_WGM15
    SolutionIndex: 98
    SolutionNameMin: Cijk_Ailk_Bljk_SB_MT16x64x16_MI16x16x4x1_SE_1LDSB0_AF0EM1_AMAS0_DTL0_DVO0_EPS1_FL0_GRVW1_GSU1_IU1_LBSPP128_LPB2_LRVW2_NEPBS0_NLCA1_NLCB1_ONLL1_PGR1_PLR5_SIA3_SS0_SU0_SUS256_SRVW0_SVW4_SNLL0_TT1_16_TLDS1_USFGROn1_VW1_WSGRA1_WSGRB1_WG16_16_1_WGM1
    SolutionIndex: 99
    SolutionNameMin: Cijk_Ailk_Bljk_SB_MT16x64x32_MI16x16x4x1_SE_1LDSB0_AF0EM1_AMAS0_DTL0_DVO0_EPS0_FL0_GRVW4_GSU1_IU1_LBSPP128_LPB4_LRVW2_NEPBS0_NLCA1_NLCB1_ONLL1_PGR2_PLR9_SIA3_SS0_SU0_SUS256_SRVW0_SVW4_SNLL0_TT1_16_TLDS1_USFGROn1_VW1_WSGRA1_WSGRB1_WG16_16_1_WGM1
    SolutionIndex: 100
    SolutionNameMin: Cijk_Ailk_Bljk_SB_MT32x64x16_MI16x16x4x1_SE_1LDSB0_AF0EM1_AMAS0_DTL0_DVO0_EPS0_FL0_GRVW1_GSU1_IU1_LBSPP128_LPB2_LRVW2_NEPBS0_NLCA1_NLCB1_ONLL1_PGR2_PLR5_SIA3_SS0_SU0_SUS256_SRVW2_SVW4_SNLL0_TT1_32_TLDS1_USFGROn1_VW1_WSGRA1_WSGRB1_WG32_8_1_WGM2
    SolutionIndex: 101
    SolutionNameMin: Cijk_Ailk_Bljk_SB_MT64x32x32_MI16x16x4x1_SE_1LDSB0_AF0EM1_AMAS0_DTL0_DVO0_EPS0_FL0_GRVW2_GSU1_IU1_LBSPP128_LPB2_LRVW2_NEPBS0_NLCA1_NLCB1_ONLL1_PGR2_PLR9_SIA3_SS0_SU32_SUS256_SRVW2_SVW4_SNLL0_TT2_16_TLDS1_USFGROn1_VW1_WSGRA1_WSGRB1_WG32_8_1_WGM1
    SolutionIndex: 102
    SolutionNameMin: Cijk_Ailk_Bljk_SB_MT64x64x16_MI16x16x4x1_SE_1LDSB0_AF0EM1_AMAS3_DTL0_DVO0_EPS1_FL0_GRVW1_GSU1_IU1_LBSPP0_LPB0_LRVW1_NEPBS0_NLCA1_NLCB1_ONLL1_PGR1_PLR1_SIA3_SS0_SU32_SUS256_SRVW0_SVW4_SNLL0_TT4_16_TLDS1_USFGROn1_VW4_WSGRA1_WSGRB1_WG16_16_1_WGM8
    SolutionIndex: 103
    SolutionNameMin: Cijk_Ailk_Bljk_SB_MT64x32x32_MI16x16x4x1_SE_1LDSB0_AF0EM1_AMAS0_DTL0_DVO0_EPS1_FL0_GRVW4_GSU1_IU1_LBSPP128_LPB4_LRVW2_NEPBS0_NLCA1_NLCB1_ONLL1_PGR1_PLR9_SIA3_SS0_SU0_SUS256_SRVW2_SVW4_SNLL0_TT2_16_TLDS1_USFGROn1_VW1_WSGRA1_WSGRB1_WG32_8_1_WGM15
    SolutionIndex: 104
    SolutionNameMin: Cijk_Ailk_Bljk_SB_MT128x96x16_MI32x32x2x1_SE_1LDSB0_AF0EM1_AMAS0_DTL0_DVO0_EPS0_FL0_GRVW2_GSU1_IU1_LBSPP128_LPB2_LRVW2_NEPBS0_NLCA1_NLCB1_ONLL1_PGR2_PLR9_SIA3_SS0_SU0_SUS256_SRVW2_SVW4_SNLL0_TT1_96_TLDS1_USFGROn1_VW1_WSGRA1_WSGRB1_WG128_2_1_WGM1
    SolutionIndex: 105
    SolutionNameMin: Cijk_Ailk_Bljk_SB_MT128x64x16_MI32x32x2x1_SE_1LDSB0_AF0EM1_AMAS0_DTL0_DVO0_EPS0_FL0_GRVW2_GSU1_IU1_LBSPP128_LPB2_LRVW2_NEPBS0_NLCA1_NLCB1_ONLL1_PGR2_PLR9_SIA3_SS0_SU32_SUS256_SRVW2_SVW4_SNLL0_TT2_32_TLDS1_USFGROn1_VW1_WSGRA1_WSGRB1_WG64_4_1_WGM15
    SolutionIndex: 106
    SolutionNameMin: Cijk_Ailk_Bljk_SB_MT64x144x32_MI16x16x4x1_SE_1LDSB0_AF0EM1_AMAS0_DTL0_DVO0_EPS0_FL0_GRVW1_GSU1_IU1_LBSPP128_LPB2_LRVW2_NEPBS0_NLCA1_NLCB1_ONLL1_PGR2_PLR9_SIA3_SS0_SU0_SUS256_SRVW2_SVW4_SNLL0_TT1_144_TLDS1_USFGROn1_VW1_WSGRA1_WSGRB1_WG64_4_1_WGM1
    SolutionIndex: 107
    SolutionNameMin: Cijk_Ailk_Bljk_SB_MT64x64x16_MI32x32x2x1_SE_1LDSB0_AF0EM1_AMAS0_DTL0_DVO0_EPS0_FL0_GRVW1_GSU1_IU1_LBSPP128_LPB2_LRVW2_NEPBS0_NLCA1_NLCB1_ONLL1_PGR2_PLR9_SIA3_SS0_SU32_SUS256_SRVW2_SVW4_SNLL0_TT1_32_TLDS1_USFGROn1_VW1_WSGRA1_WSGRB1_WG64_4_1_WGM1
    SolutionIndex: 108
    SolutionNameMin: Cijk_Ailk_Bljk_SB_MT128x96x16_MI32x32x2x1_SE_1LDSB0_AF0EM1_AMAS0_DTL0_DVO0_EPS0_FL0_GRVW2_GSU1_IU1_LBSPP128_LPB2_LRVW2_NEPBS0_NLCA1_NLCB1_ONLL1_PGR2_PLR9_SIA3_SS0_SU0_SUS256_SRVW2_SVW4_SNLL0_TT1_96_TLDS1_USFGROn1_VW1_WSGRA1_WSGRB1_WG128_2_1_WGM2
    SolutionIndex: 109
    SolutionNameMin: Cijk_Ailk_Bljk_SB_MT128x160x16_MI32x32x2x1_SE_1LDSB0_AF0EM1_AMAS0_DTL0_DVO0_EPS0_FL0_GRVW2_GSU1_IU1_LBSPP128_LPB2_LRVW2_NEPBS0_NLCA1_NLCB1_ONLL1_PGR2_PLR9_SIA3_SS0_SU0_SUS256_SRVW2_SVW4_SNLL0_TT1_160_TLDS1_USFGROn1_VW1_WSGRA1_WSGRB1_WG128_2_1_WGM2
    SolutionIndex: 110
    SolutionNameMin: Cijk_Ailk_Bljk_SB_MT64x64x16_MI16x16x4x1_SE_1LDSB0_AF0EM1_AMAS0_DTL0_DVO0_EPS1_FL0_GRVW4_GSU1_IU1_LBSPP0_LPB0_LRVW1_NEPBS0_NLCA1_NLCB1_ONLL1_PGR1_PLR1_SIA3_SS0_SU32_SUS256_SRVW0_SVW4_SNLL0_TT2_32_TLDS0_USFGROn1_VW1_WSGRA1_WSGRB1_WG32_8_1_WGM8
    SolutionIndex: 111
    SolutionNameMin: Cijk_Ailk_Bljk_SB_MT128x64x32_MI32x32x2x1_SE_1LDSB0_AF0EM1_AMAS0_DTL0_DVO0_EPS0_FL0_GRVW1_GSU1_IU1_LBSPP128_LPB2_LRVW2_NEPBS0_NLCA2_NLCB1_ONLL1_PGR2_PLR17_SIA3_SS0_SU0_SUS256_SRVW2_SVW4_SNLL0_TT2_32_TLDS1_USFGROn1_VW1_WSGRA1_WSGRB1_WG64_4_1_WGM15
    SolutionIndex: 112
    SolutionNameMin: Cijk_Ailk_Bljk_SB_MT64x32x16_MI16x16x4x1_SE_1LDSB0_AF0EM1_AMAS3_DTL0_DVO0_EPS1_FL0_GRVW1_GSU1_IU1_LBSPP0_LPB0_LRVW1_NEPBS0_NLCA1_NLCB1_ONLL1_PGR1_PLR1_SIA3_SS0_SU32_SUS256_SRVW0_SVW4_SNLL0_TT2_16_TLDS0_USFGROn1_VW4_WSGRA1_WSGRB1_WG32_8_1_WGM8
    SolutionIndex: 113
    SolutionNameMin: Cijk_Ailk_Bljk_SB_MT128x80x16_MI16x16x4x1_SE_1LDSB0_AF0EM1_AMAS3_DTL0_DVO1_EPS1_FL1_GRVW4_GSU1_IU1_LBSPP0_LPB0_LRVW1_NEPBS0_NLCA1_NLCB1_ONLL1_PGR1_PLR1_SIA3_SS0_SU32_SUS256_SRVW0_SVW4_SNLL0_TT2_80_TLDS0_USFGROn1_VW4_WSGRA0_WSGRB0_WG64_4_1_WGM8
    SolutionIndex: 114
    SolutionNameMin: Cijk_Ailk_Bljk_SB_MT64x128x16_MI32x32x2x1_SE_1LDSB0_AF0EM1_AMAS0_DTL0_DVO0_EPS1_FL0_GRVW4_GSU1_IU1_LBSPP128_LPB4_LRVW2_NEPBS0_NLCA1_NLCB1_ONLL1_PGR1_PLR9_SIA3_SS0_SU32_SUS128_SRVW2_SVW4_SNLL0_TT1_64_TLDS1_USFGROn1_VW1_WSGRA1_WSGRB1_WG64_4_1_WGM15
    SolutionIndex: 115
    SolutionNameMin: Cijk_Ailk_Bljk_SB_MT64x64x16_MI16x16x4x1_SE_1LDSB0_AF0EM1_AMAS3_DTL0_DVO1_EPS1_FL1_GRVW4_GSU1_IU1_LBSPP0_LPB0_LRVW1_NEPBS0_NLCA1_NLCB1_ONLL1_PGR1_PLR1_SIA1_SS0_SU32_SUS256_SRVW4_SVW4_SNLL0_TT4_16_TLDS1_USFGROn1_VW4_WSGRA0_WSGRB0_WG16_16_1_WGM8
    SolutionIndex: 116
    SolutionNameMin: Cijk_Ailk_Bljk_SB_MT128x144x16_MI16x16x4x1_SE_1LDSB1_AF0EM1_AMAS0_DTL0_DVO0_EPS0_FL0_GRVW1_GSU1_IU1_LBSPP128_LPB2_LRVW2_NEPBS0_NLCA2_NLCB1_ONLL1_PGR2_PLR5_SIA3_SS0_SU0_SUS256_SRVW2_SVW4_SNLL0_TT2_144_TLDS1_USFGROn1_VW1_WSGRA1_WSGRB1_WG64_4_1_WGM2
    SolutionIndex: 117
    SolutionNameMin: Cijk_Ailk_Bljk_SB_MT128x144x16_MI16x16x4x1_SE_1LDSB1_AF0EM1_AMAS0_DTL0_DVO0_EPS0_FL0_GRVW1_GSU1_IU1_LBSPP128_LPB2_LRVW2_NEPBS0_NLCA2_NLCB1_ONLL1_PGR2_PLR5_SIA3_SS0_SU0_SUS256_SRVW2_SVW4_SNLL0_TT2_144_TLDS1_USFGROn1_VW1_WSGRA1_WSGRB1_WG64_4_1_WGM1
    SolutionIndex: 118
    SolutionNameMin: Cijk_Ailk_Bljk_SB_MT32x64x16_MI16x16x4x1_SE_1LDSB0_AF0EM1_AMAS0_DTL0_DVO0_EPS0_FL0_GRVW1_GSU1_IU1_LBSPP128_LPB2_LRVW2_NEPBS0_NLCA1_NLCB1_ONLL1_PGR2_PLR5_SIA3_SS0_SU0_SUS256_SRVW2_SVW4_SNLL0_TT1_32_TLDS1_USFGROn1_VW1_WSGRA1_WSGRB1_WG32_8_1_WGM1
    SolutionIndex: 119
    SolutionNameMin: Cijk_Ailk_Bljk_SB_MT32x64x16_MI16x16x4x1_SE_1LDSB0_AF0EM1_AMAS0_DTL0_DVO0_EPS1_FL0_GRVW4_GSU1_IU1_LBSPP128_LPB4_LRVW2_NEPBS0_NLCA1_NLCB1_ONLL1_PGR1_PLR5_SIA3_SS0_SU0_SUS256_SRVW2_SVW4_SNLL0_TT1_32_TLDS1_USFGROn1_VW1_WSGRA1_WSGRB1_WG32_8_1_WGM15
    SolutionIndex: 120
    SolutionNameMin: Cijk_Ailk_Bljk_SB_MT64x64x16_MI16x16x4x1_SE_1LDSB0_AF0EM1_AMAS3_DTL0_DVO0_EPS1_FL1_GRVW4_GSU1_IU1_LBSPP0_LPB0_LRVW1_NEPBS0_NLCA1_NLCB1_ONLL0_PGR1_PLR1_SIA3_SS0_SU32_SUS256_SRVW4_SVW4_SNLL0_TT4_16_TLDS1_USFGROn1_VW4_WSGRA0_WSGRB0_WG16_16_1_WGM8
    SolutionIndex: 121
    SolutionNameMin: Cijk_Ailk_Bljk_SB_MT64x128x16_MI32x32x2x1_SE_1LDSB0_AF0EM1_AMAS0_DTL0_DVO0_EPS0_FL0_GRVW1_GSU1_IU1_LBSPP128_LPB2_LRVW2_NEPBS0_NLCA1_NLCB1_ONLL1_PGR2_PLR9_SIA3_SS0_SU32_SUS256_SRVW2_SVW4_SNLL0_TT1_64_TLDS1_USFGROn1_VW1_WSGRA1_WSGRB1_WG64_4_1_WGM15
    SolutionIndex: 122
    SolutionNameMin: Cijk_Ailk_Bljk_SB_MT64x4x16_MI4x4x1x16_SE_1LDSB0_AF0EM1_AMAS0_DTL0_DVO0_EPS1_FL0_GRVW1_GSU1_IU1_LBSPP128_LPB2_LRVW2_NEPBS0_NLCA1_NLCB1_ONLL1_PGR1_PLR17_SIA3_SS0_SU0_SUS256_SRVW0_SVW4_SNLL0_TT1_4_TLDS1_USFGROn1_VW1_WSGRA1_WSGRB1_WG64_1_1_WGM1
    SolutionIndex: 123
    SolutionNameMin: Cijk_Ailk_Bljk_SB_MT64x64x16_MI32x32x2x1_SE_1LDSB0_AF0EM1_AMAS0_DTL0_DVO0_EPS0_FL0_GRVW1_GSU1_IU1_LBSPP128_LPB2_LRVW2_NEPBS0_NLCA1_NLCB1_ONLL1_PGR2_PLR9_SIA3_SS0_SU0_SUS256_SRVW2_SVW4_SNLL0_TT1_32_TLDS1_USFGROn1_VW1_WSGRA1_WSGRB1_WG64_4_1_WGM15
    SolutionIndex: 124
    SolutionNameMin: Cijk_Ailk_Bljk_SB_MT160x128x16_MI32x32x2x1_SE_1LDSB0_AF0EM1_AMAS0_DTL0_DVO0_EPS1_FL0_GRVW1_GSU1_IU1_LBSPP128_LPB2_LRVW2_NEPBS0_NLCA5_NLCB1_ONLL1_PGR1_PLR9_SIA3_SS0_SU32_SUS256_SRVW0_SVW4_SNLL0_TT5_32_TLDS1_USFGROn1_VW1_WSGRA1_WSGRB1_WG32_8_1_WGM15
    SolutionIndex: 125
    SolutionNameMin: Cijk_Ailk_Bljk_SB_MT64x128x16_MI16x16x4x1_SE_1LDSB0_AF0EM1_AMAS3_DTL0_DVO0_EPS1_FL1_GRVW4_GSU1_IU1_LBSPP0_LPB0_LRVW1_NEPBS0_NLCA1_NLCB1_ONLL2_PGR1_PLR1_SIA3_SS0_SU32_SUS256_SRVW4_SVW4_SNLL0_TT4_32_TLDS1_USFGROn1_VW4_WSGRA0_WSGRB0_WG16_16_1_WGM1
    SolutionIndex: 126
    SolutionNameMin: Cijk_Ailk_Bljk_SB_MT128x64x32_MI32x32x2x1_SE_1LDSB0_AF0EM1_AMAS0_DTL0_DVO0_EPS0_FL0_GRVW2_GSU1_IU1_LBSPP128_LPB2_LRVW2_NEPBS0_NLCA1_NLCB1_ONLL1_PGR2_PLR17_SIA3_SS0_SU0_SUS256_SRVW2_SVW4_SNLL0_TT2_32_TLDS1_USFGROn1_VW1_WSGRA1_WSGRB1_WG64_4_1_WGM15
    SolutionIndex: 127
    SolutionNameMin: Cijk_Ailk_Bljk_SB_MT96x128x16_MI32x32x2x1_SE_1LDSB0_AF0EM1_AMAS0_DTL0_DVO0_EPS0_FL0_GRVW1_GSU1_IU1_LBSPP128_LPB2_LRVW2_NEPBS0_NLCA3_NLCB1_ONLL1_PGR2_PLR9_SIA3_SS0_SU0_SUS256_SRVW0_SVW4_SNLL0_TT3_32_TLDS1_USFGROn1_VW1_WSGRA1_WSGRB1_WG32_8_1_WGM1
    SolutionIndex: 128
    SolutionNameMin: Cijk_Ailk_Bljk_SB_MT64x128x32_MI32x32x2x1_SE_1LDSB0_AF0EM1_AMAS0_DTL0_DVO0_EPS0_FL0_GRVW2_GSU1_IU1_LBSPP128_LPB2_LRVW2_NEPBS0_NLCA1_NLCB1_ONLL1_PGR2_PLR17_SIA3_SS0_SU0_SUS256_SRVW2_SVW4_SNLL0_TT1_64_TLDS1_USFGROn1_VW1_WSGRA1_WSGRB1_WG64_4_1_WGM15
    SolutionIndex: 129
    SolutionNameMin: Cijk_Ailk_Bljk_SB_MT128x160x16_MI32x32x2x1_SE_1LDSB0_AF0EM1_AMAS0_DTL0_DVO0_EPS1_FL0_GRVW1_GSU1_IU1_LBSPP128_LPB2_LRVW2_NEPBS0_NLCA2_NLCB1_ONLL1_PGR1_PLR9_SIA3_SS0_SU0_SUS256_SRVW2_SVW4_SNLL0_TT1_160_TLDS1_USFGROn1_VW1_WSGRA1_WSGRB1_WG128_2_1_WGM1
    SolutionIndex: 130
    SolutionNameMin: Cijk_Ailk_Bljk_SB_MT128x64x32_MI32x32x2x1_SE_1LDSB0_AF0EM1_AMAS0_DTL0_DVO0_EPS0_FL0_GRVW1_GSU1_IU1_LBSPP128_LPB2_LRVW2_NEPBS0_NLCA2_NLCB1_ONLL1_PGR2_PLR17_SIA3_SS0_SU0_SUS256_SRVW2_SVW4_SNLL0_TT2_32_TLDS1_USFGROn1_VW1_WSGRA1_WSGRB1_WG64_4_1_WGM1
    SolutionIndex: 131
    SolutionNameMin: Cijk_Ailk_Bljk_SB_MT96x128x16_MI32x32x2x1_SE_1LDSB0_AF0EM1_AMAS0_DTL0_DVO0_EPS0_FL0_GRVW2_GSU1_IU1_LBSPP128_LPB2_LRVW2_NEPBS0_NLCA3_NLCB1_ONLL1_PGR2_PLR9_SIA3_SS0_SU0_SUS256_SRVW0_SVW4_SNLL0_TT3_32_TLDS1_USFGROn1_VW1_WSGRA1_WSGRB1_WG32_8_1_WGM1
    SolutionIndex: 132
    SolutionNameMin: Cijk_Ailk_Bljk_SB_MT64x128x16_MI16x16x1x4_SE_1LDSB0_AF0EM1_AMAS3_DTL0_DVO1_EPS1_FL1_GRVW4_GSU1_IU2_LBSPP0_LPB0_LRVW1_NEPBS0_NLCA1_NLCB1_ONLL0_PGR1_PLR1_SIA3_SS0_SU32_SUS256_SRVW4_SVW4_SNLL0_TT2_16_TLDS0_USFGROn1_VW4_WSGRA0_WSGRB0_WG32_8_1_WGM1
    SolutionIndex: 133
    SolutionNameMin: Cijk_Ailk_Bljk_SB_MT128x16x16_MI16x16x4x1_SE_1LDSB0_AF0EM1_AMAS0_DTL0_DVO0_EPS1_FL0_GRVW1_GSU1_IU1_LBSPP0_LPB0_LRVW1_NEPBS0_NLCA2_NLCB1_ONLL1_PGR1_PLR1_SIA3_SS0_SU32_SUS256_SRVW0_SVW4_SNLL0_TT2_16_TLDS1_USFGROn1_VW1_WSGRA1_WSGRB1_WG64_4_1_WGM8
    SolutionIndex: 134
    SolutionNameMin: Cijk_Ailk_Bljk_SB_MT32x64x32_MI16x16x4x1_SE_1LDSB0_AF0EM1_AMAS0_DTL0_DVO0_EPS0_FL0_GRVW4_GSU1_IU1_LBSPP128_LPB4_LRVW2_NEPBS0_NLCA1_NLCB1_ONLL1_PGR2_PLR9_SIA3_SS0_SU32_SUS256_SRVW2_SVW4_SNLL0_TT1_32_TLDS1_USFGROn1_VW1_WSGRA1_WSGRB1_WG32_8_1_WGM1
    SolutionIndex: 135
    SolutionNameMin: Cijk_Ailk_Bljk_SB_MT64x4x16_MI4x4x1x16_SE_1LDSB0_AF0EM1_AMAS0_DTL0_DVO0_EPS1_FL0_GRVW4_GSU1_IU1_LBSPP128_LPB4_LRVW2_NEPBS0_NLCA1_NLCB1_ONLL1_PGR1_PLR17_SIA3_SS0_SU0_SUS256_SRVW2_SVW4_SNLL0_TT1_4_TLDS1_USFGROn1_VW1_WSGRA1_WSGRB1_WG64_1_1_WGM1
    SolutionIndex: 136
    SolutionNameMin: Cijk_Ailk_Bljk_SB_MT64x16x16_MI16x16x4x1_SN_1LDSB0_AF0EM1_AMAS0_DTL0_DVO0_EPS0_FL0_GRVW2_GSU1_IU1_LBSPP128_LPB2_LRVW2_NEPBS2_NLCA1_NLCB1_ONLL1_PGR2_PLR5_SIA3_SS1_SU0_SUS256_SRVW0_SVW1_SNLL0_TT1_16_TLDS1_USFGROn1_VW1_WSGRA1_WSGRB1_WG64_4_1_WGM10
    SolutionIndex: 137
    SolutionNameMin: Cijk_Ailk_Bljk_SB_MT64x4x16_MI4x4x1x16_SE_1LDSB0_AF0EM1_AMAS0_DTL0_DVO0_EPS0_FL0_GRVW2_GSU1_IU1_LBSPP128_LPB2_LRVW2_NEPBS0_NLCA1_NLCB1_ONLL1_PGR2_PLR17_SIA3_SS0_SU0_SUS256_SRVW0_SVW4_SNLL0_TT1_4_TLDS1_USFGROn1_VW1_WSGRA1_WSGRB1_WG64_1_1_WGM1
    SolutionIndex: 138
    SolutionNameMin: Cijk_Ailk_Bljk_SB_MT16x16x32_MI16x16x4x1_SE_1LDSB0_EPS0_GRVW4_GSU5_LPB4_NLCA1_PGR2_PLR9_SU0_SUS0_TT1_16_WG16_4_1_WGM1
    SolutionIndex: 139
    SolutionNameMin: Cijk_Ailk_Bljk_SB_MT64x16x32_MI16x16x4x1_SE_1LDSB0_EPS0_GRVW4_GSU5_LPB4_NLCA1_PGR2_PLR9_SU0_SUS0_TT1_16_WG64_4_1_WGM1
    SolutionIndex: 140
    SolutionNameMin: Cijk_Ailk_Bljk_SB_MT32x32x32_MI16x16x4x1_SE_1LDSB0_EPS0_GRVW4_GSU5_LPB4_NLCA1_PGR2_PLR9_SU0_SUS0_TT1_16_WG32_8_1_WGM2
    SolutionIndex: 141
    SolutionNameMin: Cijk_Ailk_Bljk_SB_MT16x16x32_MI16x16x4x1_SE_1LDSB0_EPS0_GRVW1_GSU5_LPB2_NLCA1_PGR2_PLR9_SU32_SUS256_TT1_16_WG16_4_1_WGM1
    SolutionIndex: 142
    SolutionNameMin: Cijk_Ailk_Bljk_SB_MT16x16x32_MI16x16x4x1_SE_1LDSB0_EPS0_GRVW1_GSU5_LPB2_NLCA1_PGR2_PLR9_SU32_SUS256_TT1_16_WG16_4_1_WGM15
    SolutionIndex: 143
    SolutionNameMin: Cijk_Ailk_Bljk_SB_MT64x64x32_MI32x32x2x1_SE_1LDSB0_EPS0_GRVW2_GSU3_LPB2_NLCA1_PGR2_PLR17_SU32_SUS128_TT1_32_WG64_4_1_WGM1
    SolutionIndex: 144
    SolutionNameMin: Cijk_Ailk_Bljk_SB_MT128x64x32_MI32x32x2x1_SE_1LDSB0_EPS0_GRVW2_GSU5_LPB2_NLCA1_PGR2_PLR17_SU32_SUS256_TT2_32_WG64_4_1_WGM1
    SolutionIndex: 145
    SolutionNameMin: Cijk_Ailk_Bljk_SB_MT32x32x32_MI16x16x4x1_SE_1LDSB0_EPS0_GRVW2_GSU3_LPB2_NLCA1_PGR2_PLR9_SU0_SUS0_TT1_16_WG32_8_1_WGM1
    SolutionIndex: 147
    SolutionNameMin: Cijk_Ailk_Bljk_SB_MT32x32x32_MI16x16x4x1_SE_1LDSB0_EPS0_GRVW4_GSU3_LPB4_NLCA1_PGR2_PLR9_SU32_SUS256_TT1_16_WG32_8_1_WGM15
    SolutionIndex: 148
    SolutionNameMin: Cijk_Ailk_Bljk_SB_MT128x144x16_MI16x16x4x1_SE_1LDSB1_AMAS0_DVO0_EPS1_FL0_GRVW1_GSU1_IU1_LBSPP128_LPB2_LRVW2_NEPBS0_NLCA2_ONLL1_PGR1_PLR5_SIA3_SS0_SU0_SUS0_SRVW2_SVW4_TT2_144_TLDS1_VW1_WSGRA1_WSGRB1_WG64_4_1_WGM1
    SolutionIndex: 149
    SolutionNameMin: Cijk_Ailk_Bljk_SB_MT16x16x32_MI16x16x4x1_SE_1LDSB0_AMAS0_DVO0_EPS0_FL0_GRVW4_GSU1_IU1_LBSPP128_LPB4_LRVW2_NEPBS0_NLCA1_ONLL1_PGR2_PLR9_SIA3_SS0_SU0_SUS0_SRVW0_SVW4_TT1_16_TLDS1_VW1_WSGRA1_WSGRB1_WG16_4_1_WGM2
    SolutionIndex: 150
    SolutionNameMin: Cijk_Ailk_Bljk_SB_MT64x16x32_MI16x16x4x1_SE_1LDSB0_AMAS0_DVO0_EPS0_FL0_GRVW4_GSU5_IU1_LBSPP128_LPB4_LRVW2_NEPBS0_NLCA1_ONLL1_PGR2_PLR9_SIA3_SS0_SU0_SUS0_SRVW0_SVW4_TT1_16_TLDS1_VW1_WSGRA1_WSGRB1_WG64_4_1_WGM1
    SolutionIndex: 151
    SolutionNameMin: Cijk_Ailk_Bljk_SB_MT64x16x16_MI16x16x4x1_SE_1LDSB0_AMAS0_DVO0_EPS0_FL0_GRVW1_GSU1_IU1_LBSPP128_LPB2_LRVW2_NEPBS0_NLCA1_ONLL1_PGR2_PLR5_SIA3_SS0_SU0_SUS0_SRVW2_SVW4_TT1_16_TLDS1_VW1_WSGRA1_WSGRB1_WG64_4_1_WGM2
    SolutionIndex: 152
    SolutionNameMin: Cijk_Ailk_Bljk_SB_MT64x16x16_MI16x16x4x1_SE_1LDSB0_AMAS0_DVO0_EPS1_FL0_GRVW1_GSU1_IU1_LBSPP128_LPB2_LRVW2_NEPBS0_NLCA1_ONLL1_PGR1_PLR5_SIA3_SS0_SU0_SUS0_SRVW0_SVW4_TT1_16_TLDS1_VW1_WSGRA1_WSGRB1_WG64_4_1_WGM2
    SolutionIndex: 153
    SolutionNameMin: Cijk_Ailk_Bljk_SB_MT64x64x32_MI32x32x2x1_SE_1LDSB0_AMAS0_DVO0_EPS0_FL0_GRVW2_GSU3_IU1_LBSPP128_LPB2_LRVW2_NEPBS0_NLCA1_ONLL1_PGR2_PLR17_SIA3_SS0_SU32_SUS128_SRVW0_SVW4_TT1_32_TLDS1_VW1_WSGRA1_WSGRB1_WG64_4_1_WGM1
    SolutionIndex: 154
    SolutionNameMin: Cijk_Ailk_Bljk_SB_MT64x32x32_MI16x16x4x1_SE_1LDSB0_AMAS0_DVO0_EPS0_FL0_GRVW4_GSU1_IU1_LBSPP128_LPB4_LRVW2_NEPBS0_NLCA1_ONLL1_PGR2_PLR9_SIA3_SS0_SU32_SUS256_SRVW2_SVW4_TT2_16_TLDS1_VW1_WSGRA1_WSGRB1_WG32_8_1_WGM2
    SolutionIndex: 155
    SolutionNameMin: Cijk_Ailk_Bljk_SB_MT64x32x32_MI16x16x4x1_SE_1LDSB0_AMAS0_DVO0_EPS0_FL0_GRVW4_GSU1_IU1_LBSPP128_LPB4_LRVW2_NEPBS0_NLCA1_ONLL1_PGR2_PLR9_SIA3_SS0_SU0_SUS0_SRVW2_SVW4_TT2_16_TLDS1_VW1_WSGRA1_WSGRB1_WG32_8_1_WGM15
    SolutionIndex: 156
    SolutionNameMin: Cijk_Ailk_Bljk_SB_MT16x16x32_MI16x16x4x1_SN_1LDSB0_AMAS0_DVO0_EPS0_FL0_GRVW4_GSU1_IU1_LBSPP128_LPB4_LRVW2_NEPBS4_NLCA1_ONLL1_PGR2_PLR9_SIA3_SS1_SU32_SUS256_SRVW0_SVW1_TT1_16_TLDS1_VW1_WSGRA1_WSGRB1_WG16_4_1_WGM10
- - - [1600, 512, 1, 1024]
    - [0, 68.986]
  - - [1024, 512, 1, 1]
    - [8, 0.137]
  - - [1024, 512, 1, 64]
    - [73, 5.489]
  - - [2048, 512, 1, 1]
    - [3, 0.4]
  - - [1024, 4096, 1, 1024]
    - [6, 83.11]
  - - [4096, 4096, 1, 1024]
    - [4, 93.687]
  - - [1024, 2048, 1, 1024]
    - [4, 80.582]
  - - [4096, 2048, 1, 1024]
    - [5, 91.603]
  - - [768, 4096, 1, 2]
    - [6, 1.35]
  - - [768, 4096, 1, 768]
    - [4, 87.31]
  - - [3072, 4096, 1, 768]
    - [4, 94.021]
  - - [768, 2048, 1, 2]
    - [4, 1.027]
  - - [768, 2048, 1, 768]
    - [7, 77.436]
  - - [3072, 2048, 1, 768]
    - [4, 91.454]
  - - [768, 640, 1, 768]
    - [7, 48.745]
  - - [768, 1024, 1, 2]
    - [8, 0.762]
  - - [768, 1024, 1, 768]
    - [4, 65.118]
  - - [3072, 1024, 1, 768]
    - [4, 86.478]
  - - [768, 1280, 1, 768]
    - [7, 65.305]
  - - [768, 512, 1, 2]
    - [11, 0.136]
  - - [768, 512, 1, 768]
    - [10, 55.549]
  - - [3072, 512, 1, 768]
    - [7, 77.991]
  - - [1024, 3072, 1, 1024]
    - [4, 88.517]
  - - [1024, 512, 1, 1024]
    - [101, 47.07]
  - - [3072, 2048, 1, 1024]
    - [4, 92.287]
  - - [3072, 3072, 1, 1024]
    - [4, 93.899]
  - - [3072, 512, 1, 1024]
    - [7, 80.292]
  - - [3072, 4096, 1, 1024]
    - [6, 94.434]
  - - [1024, 2048, 1, 2]
    - [3, 1.105]
  - - [1024, 3072, 1, 2]
    - [4, 1.277]
  - - [1024, 512, 1, 2]
    - [3, 0.556]
  - - [1024, 4096, 1, 2]
    - [3, 1.385]
  - - [64, 512, 1, 1]
    - [11, 0.022]
  - - [512, 200, 1, 32]
    - [11, 2.172]
  - - [1024, 200, 1, 1]
    - [11, 0.126]
  - - [512, 200, 1, 1]
    - [112, 0.019]
  - - [1024, 32, 1, 2]
    - [13, 0.046]
  - - [1024, 32, 1, 1024]
    - [14, 8.448]
  - - [768, 320, 1, 768]
    - [1, 35.739]
  - - [768, 160, 1, 768]
    - [30, 12.552]
  - - [768, 32, 1, 768]
    - [16, 5.633]
  - - [768, 32, 1, 2]
    - [1, 0.034]
  - - [768, 64, 1, 768]
    - [61, 5.479]
  - - [768, 64, 1, 2]
    - [9, 0.071]
  - - [1024, 120, 1, 1024]
    - [101, 14.561]
  - - [1024, 20, 1, 1024]
    - [17, 5.28]
  - - [1024, 80, 1, 1024]
    - [18, 19.69]
  - - [1024, 160, 1, 1024]
    - [30, 20.281]
  - - [32, 200, 1, 1]
    - [12, 0.004]
  - - [1024, 4, 1, 1024]
    - [20, 1.062]
  - - [1024, 4, 1, 2]
    - [122, 0.002]
  - - [768, 16, 1, 768]
    - [22, 1.44]
  - - [768, 16, 1, 2]
    - [9, 0.018]
  - - [768, 8, 1, 768]
    - [20, 1.39]
  - - [1024, 6, 1, 1024]
    - [139, 0.911]
  - - [1024, 6, 1, 2]
    - [122, 0.002]
  - - [1024, 8, 1, 1024]
    - [17, 2.1]
  - - [128, 128, 512, 64]
    - [7, 37.337]
  - - [512, 512, 64, 64]
    - [6, 43.594]
  - - [64, 64, 768, 64]
    - [7, 25.702]
  - - [64, 64, 96, 64]
    - [94, 4.223]
  - - [704, 1024, 1, 128]
    - [5, 30.578]
  - - [1024, 1024, 1, 3328]
    - [10, 79.911]
  - - [4, 704, 1, 1280]
    - [138, 0.498]
  - - [4, 1856, 1, 3328]
    - [142, 2.276]
  - - [1856, 448, 1, 3328]
    - [0, 79.38]
  - - [2944, 4288, 1, 1280]
    - [5, 92.248]
  - - [2368, 64, 1, 3328]
    - [101, 36.291]
  - - [1760, 32, 1, 1760]
    - [53, 10.969]
  - - [2368, 5888, 1, 256]
    - [4, 85.882]
  - - [5888, 1856, 1, 256]
    - [5, 82.946]
  - - [64, 3584, 1, 1280]
    - [101, 27.595]
  - - [512, 24000, 1, 1536]
    - [4, 93.022]
  - - [128, 6784, 1, 3328]
    - [106, 72.004]
  - - [5888, 1408, 1, 256]
    - [5, 80.239]
  - - [5888, 1856, 1, 3328]
    - [4, 92.349]
  - - [512, 4, 1, 512]
    - [27, 0.369]
  - - [35, 1500, 1, 2560]
    - [28, 16.024]
  - - [1856, 4288, 1, 256]
    - [5, 82.718]
  - - [1024, 5056, 1, 128]
    - [6, 63.14]
  - - [5056, 5056, 1, 3328]
    - [4, 96.186]
  - - [1408, 5888, 1, 1280]
    - [4, 91.649]
  - - [2368, 448, 1, 128]
    - [4, 18.471]
  - - [6144, 6000, 1, 2560]
    - [4, 95.401]
  - - [2368, 6784, 1, 128]
    - [6, 72.171]
  - - [1024, 3584, 1, 3328]
    - [29, 87.3]
  - - [512, 48000, 1, 2048]
    - [4, 95.654]
  - - [1408, 64, 1, 128]
    - [7, 2.077]
  - - [256, 4288, 1, 3328]
    - [30, 83.403]
  - - [5888, 1408, 1, 1280]
    - [4, 91.456]
  - - [704, 1856, 1, 3328]
    - [10, 74.95]
  - - [1408, 4288, 1, 256]
    - [4, 79.605]
  - - [1024, 2368, 1, 256]
    - [7, 66.135]
  - - [64, 4, 1, 256]
    - [16, 0.027]
  - - [1408, 1856, 1, 1280]
    - [4, 86.436]
  - - [1408, 64, 1, 1280]
    - [15, 24.177]
  - - [448, 1024, 1, 1280]
    - [30, 50.406]
  - - [4096, 32, 1, 4096]
    - [31, 37.052]
  - - [256, 1408, 1, 3328]
    - [32, 65.687]
  - - [5056, 5056, 1, 1280]
    - [4, 95.766]
  - - [448, 5056, 1, 256]
    - [7, 64.683]
  - - [704, 1856, 1, 1280]
    - [7, 66.571]
  - - [128, 5056, 1, 128]
    - [4, 12.415]
  - - [2368, 128, 1, 256]
    - [34, 26.097]
  - - [1856, 1408, 1, 128]
    - [7, 53.837]
  - - [64, 5056, 1, 256]
    - [34, 28.497]
  - - [6784, 256, 1, 3328]
    - [66, 79.617]
  - - [1408, 3584, 1, 256]
    - [5, 76.906]
  - - [4288, 448, 1, 256]
    - [7, 62.962]
  - - [64, 704, 1, 128]
    - [11, 3.058]
  - - [1024, 1856, 1, 128]
    - [7, 47.46]
  - - [4288, 2944, 1, 1280]
    - [4, 91.991]
  - - [704, 5056, 1, 1280]
    - [4, 89.976]
  - - [2368, 704, 1, 3328]
    - [4, 83.176]
  - - [256, 5888, 1, 256]
    - [4, 55.382]
  - - [1856, 4288, 1, 3328]
    - [4, 93.581]
  - - [256, 2944, 1, 256]
    - [4, 45.524]
  - - [5888, 1024, 1, 256]
    - [6, 78.687]
  - - [448, 64, 1, 1280]
    - [27, 8.068]
  - - [3072, 64, 1, 1024]
    - [101, 23.867]
  - - [3584, 4, 1, 1280]
    - [27, 3.611]
  - - [2560, 16, 1, 2560]
    - [16, 13.163]
  - - [2944, 64, 1, 256]
    - [95, 7.63]
  - - [128, 4, 1, 1280]
    - [139, 0.097]
  - - [1408, 2944, 1, 256]
    - [4, 74.028]
  - - [256, 1856, 1, 1280]
    - [30, 51.909]
  - - [6784, 5056, 1, 3328]
    - [4, 95.658]
  - - [5056, 5056, 1, 256]
    - [6, 89.532]
  - - [128, 256, 1, 256]
    - [15, 1.475]
  - - [64, 1024, 1, 1280]
    - [19, 17.262]
  - - [2944, 4, 1, 256]
    - [39, 0.494]
  - - [704, 5056, 1, 128]
    - [36, 56.876]
  - - [4, 2368, 1, 1280]
    - [20, 2.577]
  - - [2368, 2944, 1, 1280]
    - [4, 89.551]
  - - [448, 448, 1, 3328]
    - [10, 48.373]
  - - [6784, 6784, 1, 1280]
    - [4, 95.748]
  - - [1024, 256, 1, 3328]
    - [32, 48.241]
  - - [1408, 4288, 1, 1280]
    - [4, 89.622]
  - - [3584, 4288, 1, 1280]
    - [4, 93.17]
  - - [512, 6000, 1, 2560]
    - [4, 89.839]
  - - [2368, 704, 1, 1280]
    - [4, 79.018]
  - - [5056, 4288, 1, 3328]
    - [4, 94.812]
  - - [3584, 2368, 1, 3328]
    - [4, 94.483]
  - - [5888, 6784, 1, 1280]
    - [4, 95.995]
  - - [64, 704, 1, 1280]
    - [16, 11.977]
  - - [4288, 256, 1, 256]
    - [7, 54.824]
  - - [2944, 128, 1, 128]
    - [38, 20.128]
  - - [6144, 32, 1, 2560]
    - [24, 52.264]
  - - [6784, 448, 1, 1280]
    - [4, 87.136]
  - - [2944, 5888, 1, 256]
    - [6, 87.983]
  - - [64, 64, 1, 1280]
    - [17, 1.158]
  - - [4288, 2944, 1, 256]
    - [4, 83.894]
  - - [5888, 704, 1, 1280]
    - [7, 86.197]
  - - [5056, 4, 1, 3328]
    - [39, 6.228]
  - - [1856, 64, 1, 1280]
    - [10, 17.478]
  - - [1760, 16, 1, 1760]
    - [17, 8.46]
  - - [448, 5888, 1, 128]
    - [7, 51.756]
  - - [5888, 64, 1, 3328]
    - [40, 68.34]
  - - [2944, 256, 1, 3328]
    - [41, 74.957]
  - - [1024, 64, 1, 128]
    - [11, 4.248]
  - - [5056, 2368, 1, 1280]
    - [4, 93.595]
  - - [448, 3584, 1, 1280]
    - [4, 77.507]
  - - [6784, 5888, 1, 256]
    - [6, 93.004]
  - - [64, 1024, 1, 3328]
    - [19, 22.648]
  - - [704, 128, 1, 1280]
    - [15, 24.636]
  - - [4, 3584, 1, 128]
    - [52, 0.32]
  - - [1408, 448, 1, 1280]
    - [36, 68.14]
  - - [1024, 1408, 1, 256]
    - [36, 56.386]
  - - [2368, 2368, 1, 3328]
    - [29, 91.215]
  - - [1856, 6784, 1, 128]
    - [6, 69.57]
  - - [5056, 704, 1, 3328]
    - [4, 91.505]
  - - [1408, 1856, 1, 256]
    - [4, 70.113]
  - - [1408, 704, 1, 3328]
    - [30, 75.887]
  - - [2368, 5056, 1, 256]
    - [4, 85.158]
  - - [1408, 256, 1, 1280]
    - [10, 56.81]
  - - [3072, 128, 1, 1024]
    - [30, 57.063]
  - - [3584, 2368, 1, 1280]
    - [4, 93.41]
  - - [4288, 64, 1, 3328]
    - [32, 50.133]
  - - [2368, 4, 1, 1280]
    - [16, 2.53]
  - - [704, 5888, 1, 256]
    - [4, 74.258]
  - - [6784, 2944, 1, 128]
    - [6, 76.499]
  - - [6784, 64, 1, 256]
    - [34, 37.103]
  - - [2944, 256, 1, 256]
    - [36, 24.002]
  - - [2944, 6784, 1, 3328]
    - [4, 94.963]
  - - [128, 1, 1, 1408]
    - [138, 0.026]
  - - [704, 1408, 1, 3328]
    - [7, 74.931]
  - - [3584, 704, 1, 3328]
    - [41, 85.557]
  - - [2944, 256, 1, 128]
    - [5, 31.278]
  - - [6784, 4, 1, 1280]
    - [38, 3.395]
  - - [1024, 64, 1, 1280]
    - [19, 18.175]
  - - [8448, 4, 1, 2816]
    - [38, 5.609]
  - - [448, 4288, 1, 256]
    - [36, 60.555]
  - - [64, 3584, 1, 3328]
    - [40, 42.107]
  - - [704, 2368, 1, 1280]
    - [4, 80.405]
  - - [1856, 2368, 1, 1280]
    - [4, 89.903]
  - - [2368, 128, 1, 3328]
    - [32, 55.506]
  - - [64, 193600, 1, 64]
    - [7, 35.139]
  - - [1760, 128, 1, 1760]
    - [84, 31.073]
  - - [448, 1408, 1, 256]
    - [7, 43.062]
  - - [1856, 4288, 1, 1280]
    - [4, 92.446]
  - - [64, 5056, 1, 3328]
    - [40, 58.754]
  - - [512, 1500, 1, 2816]
    - [4, 72.734]
  - - [1024, 448, 1, 128]
    - [4, 9.328]
  - - [704, 4, 1, 1280]
    - [138, 0.502]
  - - [704, 256, 1, 128]
    - [11, 3.96]
  - - [256, 193600, 1, 64]
    - [7, 45.265]
  - - [704, 2944, 1, 128]
    - [7, 49.199]
  - - [1408, 1024, 1, 1280]
    - [36, 75.815]
  - - [704, 6784, 1, 256]
    - [4, 77.17]
  - - [6784, 704, 1, 256]
    - [4, 63.824]
  - - [5056, 1408, 1, 128]
    - [7, 64.771]
  - - [2048, 7000, 1, 2048]
    - [6, 95.197]
  - - [256, 3584, 1, 3328]
    - [26, 75.691]
  - - [5056, 704, 1, 256]
    - [7, 72.81]
  - - [128, 1408, 1, 128]
    - [36, 3.993]
  - - [3584, 4288, 1, 3328]
    - [4, 93.742]
  - - [5888, 1856, 1, 1280]
    - [4, 92.202]
  - - [256, 1408, 1, 256]
    - [30, 30.355]
  - - [5056, 64, 1, 1280]
    - [10, 49.908]
  - - [1024, 704, 1, 256]
    - [7, 23.79]
  - - [64, 256, 1, 128]
    - [13, 1.086]
  - - [2368, 3584, 1, 1280]
    - [4, 93.233]
  - - [1024, 256, 1, 256]
    - [38, 23.814]
  - - [1856, 4, 1, 1280]
    - [15, 2.03]
  - - [448, 448, 1, 256]
    - [10, 8.389]
  - - [2944, 3584, 1, 3328]
    - [6, 93.527]
  - - [7680, 32, 1, 2560]
    - [24, 41.331]
  - - [128, 4288, 1, 128]
    - [44, 25.74]
  - - [256, 256, 1, 3328]
    - [45, 23.073]
  - - [128, 1024, 1, 3328]
    - [34, 36.951]
  - - [4, 1408, 1, 3328]
    - [138, 2.117]
  - - [6784, 2944, 1, 256]
    - [6, 88.69]
  - - [64, 1856, 1, 1280]
    - [24, 26.766]
  - - [64, 1024, 1, 128]
    - [90, 1.551]
  - - [1024, 1500, 1, 2560]
    - [7, 83.235]
  - - [1856, 2368, 1, 256]
    - [5, 76.942]
  - - [3584, 256, 1, 128]
    - [7, 33.926]
  - - [3584, 6784, 1, 3328]
    - [6, 96.77]
  - - [256, 1024, 1, 256]
    - [38, 23.627]
  - - [4, 6784, 1, 3328]
    - [22, 4.842]
  - - [1024, 5888, 1, 3328]
    - [4, 90.095]
  - - [1024, 128, 1, 1280]
    - [31, 29.767]
  - - [3072, 32, 1, 1024]
    - [28, 22.796]
  - - [6144, 24000, 1, 2560]
    - [6, 97.098]
  - - [448, 1024, 1, 256]
    - [7, 32.873]
  - - [5056, 4288, 1, 1280]
    - [4, 94.293]
  - - [5888, 64, 1, 256]
    - [7, 33.441]
  - - [1856, 256, 1, 1280]
    - [10, 52.406]
  - - [64, 5888, 1, 3328]
    - [40, 67.604]
  - - [2368, 2368, 1, 1280]
    - [29, 89.354]
  - - [2944, 5888, 1, 128]
    - [4, 66.045]
  - - [704, 5888, 1, 1280]
    - [4, 86.257]
  - - [2368, 3584, 1, 128]
    - [7, 65.89]
  - - [1856, 5056, 1, 128]
    - [7, 67.579]
  - - [4608, 1, 1, 1536]
    - [13, 0.758]
  - - [448, 256, 1, 3328]
    - [10, 32.578]
  - - [2944, 6784, 1, 1280]
    - [5, 93.963]
  - - [448, 1856, 1, 128]
    - [48, 34.757]
  - - [128, 1024, 1, 128]
    - [13, 8.69]
  - - [7680, 4, 1, 2560]
    - [38, 4.855]
  - - [1024, 704, 1, 1280]
    - [4, 64.572]
  - - [128, 5888, 1, 256]
    - [4, 43.694]
  - - [1024, 5056, 1, 1280]
    - [4, 88.911]
  - - [4288, 1024, 1, 256]
    - [5, 75.608]
  - - [2944, 2368, 1, 128]
    - [6, 67.248]
  - - [704, 704, 1, 3328]
    - [30, 59.277]
  - - [704, 1408, 1, 1280]
    - [36, 70.33]
  - - [5888, 448, 1, 1280]
    - [4, 86.603]
  - - [3584, 256, 1, 3328]
    - [42, 74.787]
  - - [704, 5888, 1, 3328]
    - [29, 88.472]
  - - [704, 1856, 1, 128]
    - [7, 21.781]
  - - [128, 3584, 1, 3328]
    - [30, 56.35]
  - - [4, 4288, 1, 128]
    - [12, 1.064]
  - - [128, 704, 1, 1280]
    - [15, 24.753]
  - - [3584, 2944, 1, 256]
    - [5, 77.66]
  - - [1856, 128, 1, 3328]
    - [32, 43.665]
  - - [1856, 2368, 1, 3328]
    - [29, 89.317]
  - - [512, 6000, 1, 2816]
    - [4, 89.911]
  - - [2944, 448, 1, 128]
    - [7, 40.904]
  - - [64, 193600, 1, 256]
    - [49, 54.727]
  - - [128, 2944, 1, 1280]
    - [10, 58.121]
  - - [448, 2944, 1, 1280]
    - [7, 66.775]
  - - [512, 24000, 1, 2048]
    - [4, 93.282]
  - - [128, 256, 1, 3328]
    - [145, 10.802]
  - - [1408, 5056, 1, 3328]
    - [6, 93.846]
  - - [1856, 1856, 1, 3328]
    - [4, 89.107]
  - - [3584, 128, 1, 256]
    - [7, 33.286]
  - - [448, 1408, 1, 3328]
    - [30, 76.541]
  - - [2368, 2368, 1, 256]
    - [4, 78.51]
  - - [4288, 4288, 1, 1280]
    - [4, 95.176]
  - - [64, 448, 1, 1280]
    - [15, 7.914]
  - - [5888, 1024, 1, 1280]
    - [7, 89.294]
  - - [704, 1024, 1, 256]
    - [7, 43.774]
  - - [1024, 12544, 1, 256]
    - [6, 85.266]
  - - [448, 4, 1, 256]
    - [13, 0.195]
  - - [5888, 448, 1, 128]
    - [7, 53.39]
  - - [512, 48000, 1, 2560]
    - [4, 95.729]
  - - [8448, 16, 1, 2816]
    - [38, 21.94]
  - - [704, 6784, 1, 3328]
    - [4, 90.843]
  - - [5888, 5888, 1, 1280]
    - [4, 96.058]
  - - [5056, 1024, 1, 1280]
    - [36, 89.444]
  - - [448, 5888, 1, 3328]
    - [7, 85.15]
  - - [3072, 2, 1, 1024]
    - [15, 1.484]
  - - [1024, 2944, 1, 1280]
    - [4, 86.388]
  - - [5056, 5888, 1, 1280]
    - [4, 94.939]
  - - [4288, 5888, 1, 128]
    - [6, 76.896]
  - - [256, 3584, 1, 256]
    - [7, 44.105]
  - - [256, 4, 1, 1280]
    - [140, 0.181]
  - - [1408, 3584, 1, 128]
    - [7, 62.067]
  - - [256, 2944, 1, 3328]
    - [25, 74.857]
  - - [448, 3584, 1, 128]
    - [7, 25.773]
  - - [5888, 2944, 1, 1280]
    - [4, 94.19]
  - - [4, 6784, 1, 1280]
    - [20, 5.082]
  - - [2368, 5888, 1, 128]
    - [6, 71.176]
  - - [35, 8457, 1, 1760]
    - [29, 28.935]
  - - [64, 2944, 1, 128]
    - [13, 11.814]
  - - [2368, 4, 1, 256]
    - [13, 1.041]
  - - [3584, 5888, 1, 256]
    - [6, 90.003]
  - - [2368, 1024, 1, 128]
    - [7, 52.585]
  - - [2368, 704, 1, 128]
    - [7, 44.728]
  - - [512, 32, 1, 512]
    - [27, 3.124]
  - - [3584, 2368, 1, 128]
    - [6, 68.759]
  - - [5056, 704, 1, 128]
    - [7, 58.331]
  - - [448, 2368, 1, 128]
    - [36, 38.248]
  - - [4, 5056, 1, 256]
    - [53, 2.065]
  - - [5056, 1408, 1, 3328]
    - [4, 93.763]
  - - [1408, 704, 1, 256]
    - [7, 51.281]
  - - [6784, 1024, 1, 3328]
    - [4, 92.264]
  - - [6784, 2944, 1, 3328]
    - [4, 94.981]
  - - [7680, 1, 1, 2560]
    - [38, 1.25]
  - - [1856, 1856, 1, 256]
    - [4, 73.189]
  - - [64, 64, 1, 3328]
    - [138, 1.873]
  - - [512, 1, 1, 512]
    - [16, 0.095]
  - - [6784, 2368, 1, 1280]
    - [6, 94.626]
  - - [4608, 2, 1, 1536]
    - [47, 2.532]
  - - [4288, 3584, 1, 256]
    - [4, 84.874]
  - - [4288, 5888, 1, 1280]
    - [4, 94.418]
  - - [4608, 4, 1, 1536]
    - [16, 4.984]
  - - [1024, 6000, 1, 1536]
    - [4, 91.305]
  - - [8448, 32, 1, 2816]
    - [24, 45.501]
  - - [448, 2944, 1, 3328]
    - [30, 75.617]
  - - [4288, 1856, 1, 1280]
    - [4, 92.464]
  - - [1856, 2944, 1, 3328]
    - [29, 89.212]
  - - [256, 6784, 1, 3328]
    - [10, 79.377]
  - - [512, 3000, 1, 1536]
    - [7, 81.226]
  - - [64, 5888, 1, 256]
    - [34, 32.935]
  - - [256, 5056, 1, 128]
    - [4, 40.577]
  - - [5056, 1024, 1, 256]
    - [7, 75.704]
  - - [704, 64, 1, 3328]
    - [23, 15.863]
  - - [5056, 1856, 1, 3328]
    - [4, 94.66]
  - - [4, 2944, 1, 3328]
    - [138, 3.313]
  - - [512, 1500, 1, 2048]
    - [4, 70.671]
  - - [1024, 1, 1, 500000]
    - [139, 1.723]
  - - [256, 4, 1, 256]
    - [22, 0.115]
  - - [6784, 128, 1, 3328]
    - [42, 73.154]
  - - [4288, 1408, 1, 128]
    - [7, 64.139]
  - - [1856, 5888, 1, 3328]
    - [4, 92.131]
  - - [4288, 5056, 1, 256]
    - [6, 87.333]
  - - [1408, 128, 1, 1280]
    - [24, 39.985]
  - - [4096, 7000, 1, 4096]
    - [6, 96.308]
  - - [5056, 256, 1, 3328]
    - [36, 74.104]
  - - [704, 704, 1, 256]
    - [7, 34.654]
  - - [1024, 3000, 1, 2560]
    - [4, 89.612]
  - - [1024, 5888, 1, 1280]
    - [4, 89.501]
  - - [6784, 2368, 1, 128]
    - [6, 75.647]
  - - [4, 5056, 1, 1280]
    - [55, 4.419]
  - - [256, 64, 1, 1280]
    - [61, 2.734]
  - - [128, 1856, 1, 1280]
    - [1, 38.279]
  - - [1856, 1024, 1, 1280]
    - [4, 72.611]
  - - [6784, 4288, 1, 1280]
    - [4, 95.625]
  - - [1856, 1856, 1, 1280]
    - [4, 87.268]
  - - [35, 1500, 1, 2048]
    - [15, 15.783]
  - - [3072, 24000, 1, 1024]
    - [6, 96.705]
  - - [1408, 5056, 1, 1280]
    - [4, 92.655]
  - - [4, 2368, 1, 3328]
    - [138, 2.806]
  - - [5888, 1856, 1, 128]
    - [6, 70.91]
  - - [448, 704, 1, 1280]
    - [10, 49.844]
  - - [448, 6784, 1, 128]
    - [5, 53.288]
  - - [1024, 448, 1, 3328]
    - [10, 55.938]
  - - [2944, 128, 1, 256]
    - [31, 33.186]
  - - [5056, 3584, 1, 128]
    - [6, 73.872]
  - - [5888, 5888, 1, 3328]
    - [4, 96.456]
  - - [6784, 1024, 1, 256]
    - [6, 80.547]
  - - [2944, 2368, 1, 256]
    - [6, 80.914]
  - - [256, 448, 1, 256]
    - [30, 4.839]
  - - [5056, 5888, 1, 3328]
    - [4, 95.409]
  - - [1856, 1024, 1, 256]
    - [36, 62.291]
  - - [512, 48000, 1, 1536]
    - [4, 95.331]
  - - [3584, 448, 1, 1280]
    - [4, 77.119]
  - - [1024, 1024, 1, 1280]
    - [7, 74.035]
  - - [448, 5888, 1, 256]
    - [4, 68.852]
  - - [2048, 128, 1, 2048]
    - [10, 44.805]
  - - [1408, 6784, 1, 3328]
    - [6, 92.247]
  - - [448, 1024, 1, 128]
    - [7, 23.011]
  - - [4288, 704, 1, 128]
    - [7, 55.106]
  - - [128, 1856, 1, 128]
    - [11, 13.843]
  - - [448, 2368, 1, 3328]
    - [30, 80.52]
  - - [5056, 64, 1, 128]
    - [2, 18.481]
  - - [5056, 2944, 1, 256]
    - [6, 85.82]
  - - [6784, 5888, 1, 128]
    - [6, 80.763]
  - - [1024, 700, 1, 512]
    - [4, 51.524]
  - - [3072, 1, 1, 128]
    - [13, 0.07]
  - - [1024, 4, 1, 256]
    - [13, 0.463]
  - - [2944, 704, 1, 128]
    - [7, 50.234]
  - - [128, 6784, 1, 1280]
    - [65, 58.142]
  - - [1408, 3584, 1, 3328]
    - [26, 92.875]
  - - [2368, 6784, 1, 256]
    - [5, 86.565]
  - - [5056, 1408, 1, 1280]
    - [4, 92.509]
  - - [5056, 4288, 1, 128]
    - [6, 75.565]
  - - [4, 704, 1, 256]
    - [17, 0.128]
  - - [4288, 2368, 1, 3328]
    - [4, 93.757]
  - - [1408, 1856, 1, 128]
    - [7, 52.161]
  - - [1408, 5888, 1, 3328]
    - [4, 92.39]
  - - [1856, 256, 1, 256]
    - [7, 33.838]
  - - [6784, 6784, 1, 256]
    - [6, 92.906]
  - - [5888, 5056, 1, 128]
    - [6, 79.173]
  - - [4288, 2368, 1, 128]
    - [7, 68.267]
  - - [128, 5888, 1, 1280]
    - [35, 66.374]
  - - [256, 4288, 1, 1280]
    - [30, 75.744]
  - - [2368, 2944, 1, 256]
    - [4, 80.67]
  - - [4, 1856, 1, 256]
    - [60, 0.327]
  - - [3584, 1856, 1, 1280]
    - [4, 92.239]
  - - [6784, 6784, 1, 128]
    - [6, 81.286]
  - - [256, 1856, 1, 128]
    - [7, 23.425]
  - - [704, 64, 1, 1280]
    - [17, 12.435]
  - - [5888, 5056, 1, 256]
    - [6, 90.764]
  - - [8448, 48000, 1, 2816]
    - [6, 97.499]
  - - [512, 6000, 1, 2048]
    - [4, 89.583]
  - - [3584, 448, 1, 256]
    - [4, 58.252]
  - - [448, 4288, 1, 128]
    - [7, 47.97]
  - - [7680, 64, 1, 2560]
    - [7, 57.164]
  - - [256, 6784, 1, 256]
    - [4, 61.84]
  - - [1408, 4288, 1, 128]
    - [7, 52.022]
  - - [2944, 704, 1, 3328]
    - [4, 83.516]
  - - [128, 448, 1, 256]
    - [62, 2.593]
  - - [2048, 32, 1, 2048]
    - [19, 20.23]
  - - [3584, 3584, 1, 256]
    - [4, 85.315]
  - - [448, 1408, 1, 128]
    - [7, 28.65]
  - - [128, 256, 1, 1280]
    - [15, 5.41]
  - - [3584, 5056, 1, 256]
    - [6, 87.618]
  - - [6784, 128, 1, 256]
    - [5, 49.109]
  - - [4288, 4, 1, 256]
    - [13, 1.799]
  - - [64, 1408, 1, 3328]
    - [15, 31.212]
  - - [704, 448, 1, 256]
    - [36, 12.472]
  - - [2944, 2368, 1, 1280]
    - [4, 90.88]
  - - [448, 64, 1, 3328]
    - [147, 9.577]
  - - [704, 6784, 1, 128]
    - [7, 61.086]
  - - [3584, 4, 1, 3328]
    - [47, 4.634]
  - - [6784, 3584, 1, 256]
    - [6, 92.181]
  - - [704, 448, 1, 128]
    - [44, 6.619]
  - - [256, 128, 1, 128]
    - [13, 2.198]
  - - [704, 1408, 1, 128]
    - [7, 35.737]
  - - [4, 448, 1, 128]
    - [58, 0.117]
  - - [4288, 128, 1, 1280]
    - [7, 59.625]
  - - [128, 1408, 1, 256]
    - [69, 7.369]
  - - [4, 2944, 1, 256]
    - [99, 0.529]
  - - [64, 128, 1, 3328]
    - [138, 3.551]
  - - [1856, 1408, 1, 256]
    - [4, 68.676]
  - - [5056, 2368, 1, 128]
    - [6, 69.064]
  - - [2944, 2944, 1, 3328]
    - [6, 91.885]
  - - [5056, 6784, 1, 256]
    - [6, 90.802]
  - - [1856, 3584, 1, 128]
    - [7, 64.38]
  - - [5888, 4, 1, 1280]
    - [13, 5.757]
  - - [128, 2944, 1, 128]
    - [1, 20.507]
  - - [35, 8457, 1, 2560]
    - [7, 34.047]
  - - [3584, 6784, 1, 128]
    - [6, 79.78]
  - - [128, 4288, 1, 256]
    - [7, 37.691]
  - - [704, 448, 1, 3328]
    - [10, 57.546]
  - - [2368, 6784, 1, 1280]
    - [4, 94.356]
  - - [128, 128, 1, 3328]
    - [140, 6.205]
  - - [5056, 1856, 1, 256]
    - [5, 83.023]
  - - [256, 128, 1, 256]
    - [52, 1.507]
  - - [1024, 3000, 1, 2816]
    - [4, 89.663]
  - - [1024, 1856, 1, 256]
    - [7, 61.591]
  - - [64, 1, 1, 1216]
    - [140, 0.011]
  - - [4288, 64, 1, 128]
    - [2, 15.221]
  - - [256, 448, 1, 3328]
    - [30, 32.639]
  - - [1408, 6784, 1, 1280]
    - [4, 91.346]
  - - [3584, 3584, 1, 1280]
    - [4, 93.367]
  - - [7680, 24000, 1, 2560]
    - [6, 97.181]
  - - [64, 2368, 1, 1280]
    - [24, 33.885]
  - - [448, 2368, 1, 1280]
    - [7, 74.537]
  - - [4608, 48000, 1, 1536]
    - [6, 97.127]
  - - [5888, 5888, 1, 128]
    - [6, 79.866]
  - - [64, 6784, 1, 3328]
    - [29, 49.055]
  - - [2944, 256, 1, 1280]
    - [4, 66.374]
  - - [2048, 16, 1, 2048]
    - [53, 9.883]
  - - [256, 2368, 1, 128]
    - [7, 27.535]
  - - [5056, 2368, 1, 3328]
    - [4, 94.334]
  - - [2944, 4288, 1, 256]
    - [4, 85.22]
  - - [1408, 3584, 1, 1280]
    - [36, 84.324]
  - - [2368, 64, 1, 256]
    - [84, 6.198]
  - - [1024, 128, 1, 128]
    - [13, 8.401]
  - - [704, 128, 1, 3328]
    - [15, 31.285]
  - - [5888, 4, 1, 128]
    - [13, 1.461]
  - - [1856, 704, 1, 256]
    - [7, 56.885]
  - - [1024, 1500, 1, 2816]
    - [10, 83.876]
  - - [8448, 1, 1, 2816]
    - [38, 1.38]
  - - [1024, 4, 1, 3328]
    - [139, 1.721]
  - - [1024, 6000, 1, 2048]
    - [4, 91.595]
  - - [512, 24000, 1, 2560]
    - [4, 93.396]
  - - [6144, 3000, 1, 2560]
    - [6, 93.76]
  - - [2368, 6784, 1, 3328]
    - [4, 94.954]
  - - [1856, 1408, 1, 1280]
    - [4, 85.992]
  - - [1856, 448, 1, 1280]
    - [4, 72.454]
  - - [6784, 704, 1, 128]
    - [7, 61.086]
  - - [4, 4, 1, 256]
    - [52, 0.002]
  - - [128, 5888, 1, 128]
    - [7, 13.764]
  - - [5056, 2944, 1, 128]
    - [6, 73.075]
  - - [1408, 5888, 1, 256]
    - [5, 82.452]
  - - [704, 2944, 1, 1280]
    - [4, 81.0]
  - - [4288, 64, 1, 1280]
    - [10, 33.47]
  - - [256, 64, 1, 256]
    - [16, 1.89]
  - - [1024, 1024, 1, 256]
    - [36, 51.478]
  - - [704, 1856, 1, 256]
    - [4, 58.428]
  - - [2560, 64, 1, 2560]
    - [24, 44.061]
  - - [3584, 704, 1, 1280]
    - [6, 79.959]
  - - [256, 128, 1, 1280]
    - [15, 5.337]
  - - [5888, 2368, 1, 256]
    - [6, 86.856]
  - - [256, 2368, 1, 1280]
    - [30, 65.241]
  - - [2944, 6784, 1, 128]
    - [6, 77.634]
  - - [3584, 448, 1, 3328]
    - [41, 81.549]
  - - [1408, 4, 1, 256]
    - [13, 0.613]
  - - [704, 2368, 1, 3328]
    - [4, 85.012]
  - - [2944, 448, 1, 256]
    - [7, 57.204]
  - - [1856, 448, 1, 128]
    - [5, 33.308]
  - - [4608, 6000, 1, 1536]
    - [6, 95.301]
  - - [2368, 128, 1, 1280]
    - [30, 47.641]
  - - [256, 5888, 1, 128]
    - [7, 42.005]
  - - [64, 6784, 1, 256]
    - [34, 36.037]
  - - [64, 5056, 1, 1280]
    - [40, 49.25]
  - - [4, 6784, 1, 128]
    - [16, 1.614]
  - - [3025, 64, 64, 64]
    - [7, 32.756]
  - - [2944, 2944, 1, 1280]
    - [4, 90.655]
  - - [5056, 448, 1, 3328]
    - [29, 81.801]
  - - [4, 3584, 1, 1280]
    - [16, 3.596]
  - - [1408, 128, 1, 128]
    - [13, 11.3]
  - - [6784, 704, 1, 3328]
    - [4, 90.487]
  - - [128, 64, 1, 1280]
    - [20, 2.387]
  - - [2368, 256, 1, 1280]
    - [7, 66.104]
  - - [4, 448, 1, 3328]
    - [138, 0.795]
  - - [5888, 4288, 1, 128]
    - [6, 77.799]
  - - [4, 5888, 1, 256]
    - [60, 2.342]
  - - [1408, 2944, 1, 3328]
    - [29, 88.384]
  - - [3584, 704, 1, 128]
    - [7, 52.544]
  - - [64, 1024, 1, 256]
    - [52, 2.907]
  - - [2368, 448, 1, 1280]
    - [36, 75.271]
  - - [128, 3584, 1, 256]
    - [7, 32.272]
  - - [704, 448, 1, 1280]
    - [30, 49.845]
  - - [448, 5056, 1, 128]
    - [5, 48.573]
  - - [6144, 4, 1, 2560]
    - [39, 7.178]
  - - [5056, 3584, 1, 256]
    - [6, 86.209]
  - - [4288, 4288, 1, 256]
    - [6, 87.44]
  - - [1408, 5056, 1, 128]
    - [6, 67.099]
  - - [2944, 3584, 1, 128]
    - [6, 73.067]
  - - [3584, 2368, 1, 256]
    - [5, 82.837]
  - - [5888, 5056, 1, 1280]
    - [5, 94.918]
  - - [128, 1024, 1, 1280]
    - [24, 29.193]
  - - [8448, 24000, 1, 2816]
    - [56, 97.307]
  - - [64, 704, 1, 256]
    - [13, 4.95]
  - - [4288, 256, 1, 1280]
    - [7, 77.887]
  - - [3584, 3584, 1, 3328]
    - [4, 94.261]
  - - [704, 64, 1, 128]
    - [13, 2.92]
  - - [3072, 1500, 1, 128]
    - [4, 59.07]
  - - [2048, 3136, 1, 512]
    - [5, 85.463]
  - - [3025, 256, 64, 64]
    - [7, 38.129]
  - - [5888, 6784, 1, 256]
    - [6, 93.041]
  - - [4288, 2944, 1, 3328]
    - [4, 92.656]
  - - [2944, 64, 1, 128]
    - [13, 11.687]
  - - [1024, 128, 1, 3328]
    - [30, 37.588]
  - - [1024, 16, 1, 500000]
    - [139, 26.487]
  - - [4288, 128, 1, 3328]
    - [30, 67.089]
  - - [7680, 128, 1, 2560]
    - [7, 71.99]
  - - [256, 5056, 1, 1280]
    - [36, 66.362]
  - - [1408, 256, 1, 128]
    - [10, 7.496]
  - - [2944, 5888, 1, 3328]
    - [4, 95.182]
  - - [6784, 5888, 1, 1280]
    - [4, 96.155]
  - - [3072, 1, 1, 1024]
    - [23, 0.762]
  - - [704, 128, 1, 256]
    - [62, 9.996]
  - - [5888, 4288, 1, 1280]
    - [4, 94.516]
  - - [1024, 24000, 1, 2048]
    - [4, 95.485]
  - - [448, 256, 1, 1280]
    - [30, 16.924]
  - - [5888, 3584, 1, 128]
    - [6, 77.044]
  - - [64, 4288, 1, 3328]
    - [63, 50.133]
  - - [448, 4, 1, 1280]
    - [138, 0.325]
  - - [6784, 6784, 1, 3328]
    - [4, 96.094]
  - - [5056, 4, 1, 1280]
    - [18, 4.964]
  - - [4, 5888, 1, 3328]
    - [27, 5.409]
  - - [256, 1408, 1, 1280]
    - [10, 56.501]
  - - [3072, 16, 1, 1024]
    - [13, 6.562]
  - - [704, 3584, 1, 128]
    - [7, 51.43]
  - - [1024, 2, 1, 512]
    - [45, 0.163]
  - - [5888, 448, 1, 3328]
    - [4, 89.894]
  - - [2368, 4288, 1, 1280]
    - [4, 93.047]
  - - [4288, 2944, 1, 128]
    - [7, 69.618]
  - - [256, 64, 1, 3328]
    - [139, 6.19]
  - - [2944, 64, 1, 3328]
    - [10, 52.919]
  - - [6784, 64, 1, 3328]
    - [7, 50.323]
  - - [5056, 2944, 1, 3328]
    - [4, 95.08]
  - - [448, 128, 1, 256]
    - [13, 6.301]
  - - [2944, 3584, 1, 256]
    - [6, 85.665]
  - - [1408, 1408, 1, 3328]
    - [4, 83.646]
  - - [1856, 128, 1, 1280]
    - [10, 37.961]
  - - [3584, 3584, 1, 128]
    - [6, 73.654]
  - - [64, 3584, 1, 256]
    - [10, 9.369]
  - - [1408, 4, 1, 3328]
    - [139, 2.34]
  - - [128, 2944, 1, 3328]
    - [32, 69.008]
  - - [3584, 704, 1, 256]
    - [7, 66.307]
  - - [2944, 448, 1, 3328]
    - [10, 75.343]
  - - [1024, 2, 1, 500000]
    - [139, 3.446]
  - - [3584, 1408, 1, 3328]
    - [66, 91.95]
  - - [704, 3584, 1, 1280]
    - [4, 83.695]
  - - [1024, 1408, 1, 128]
    - [7, 42.432]
  - - [1856, 6784, 1, 256]
    - [4, 85.802]
  - - [4288, 448, 1, 3328]
    - [4, 80.191]
  - - [6784, 4288, 1, 128]
    - [6, 79.115]
  - - [6784, 704, 1, 1280]
    - [4, 89.245]
  - - [6144, 1, 1, 2560]
    - [39, 1.785]
  - - [3584, 6784, 1, 256]
    - [6, 92.516]
  - - [6144, 16, 1, 2560]
    - [39, 28.283]
  - - [3584, 64, 1, 128]
    - [2, 13.101]
  - - [5888, 1024, 1, 3328]
    - [4, 90.525]
  - - [448, 64, 1, 128]
    - [93, 0.685]
  - - [704, 6784, 1, 1280]
    - [4, 89.476]
  - - [4, 448, 1, 256]
    - [22, 0.199]
  - - [5888, 128, 1, 256]
    - [7, 44.136]
  - - [4096, 16, 1, 4096]
    - [39, 20.435]
  - - [1856, 5056, 1, 3328]
    - [4, 93.99]
  - - [4, 6784, 1, 256]
    - [16, 2.699]
  - - [1024, 3584, 1, 128]
    - [7, 56.304]
  - - [64, 704, 1, 3328]
    - [19, 15.715]
  - - [2368, 2944, 1, 128]
    - [7, 65.389]
  - - [5056, 64, 1, 256]
    - [34, 28.717]
  - - [512, 1500, 1, 1536]
    - [4, 69.403]
  - - [512, 1, 1, 500000]
    - [140, 0.942]
  - - [5888, 2944, 1, 3328]
    - [4, 95.036]
  - - [128, 3584, 1, 1280]
    - [7, 50.406]
  - - [1024, 704, 1, 128]
    - [4, 30.133]
  - - [1408, 2368, 1, 128]
    - [7, 56.236]
  - - [5888, 2368, 1, 128]
    - [6, 74.678]
  - - [128, 5056, 1, 3328]
    - [10, 78.276]
  - - [3584, 6784, 1, 1280]
    - [6, 96.262]
  - - [4288, 1856, 1, 256]
    - [4, 81.907]
  - - [1856, 5888, 1, 256]
    - [4, 84.786]
  - - [256, 256, 1, 256]
    - [99, 2.918]
  - - [4288, 4288, 1, 3328]
    - [4, 95.902]
  - - [1024, 1024, 1, 128]
    - [7, 37.805]
  - - [4288, 1408, 1, 1280]
    - [4, 89.576]
  - - [3584, 5056, 1, 128]
    - [6, 75.8]
  - - [4, 1024, 1, 3328]
    - [138, 1.583]
  - - [4, 704, 1, 128]
    - [11, 0.067]
  - - [4288, 2368, 1, 256]
    - [4, 83.023]
  - - [2944, 5056, 1, 1280]
    - [5, 93.076]
  - - [448, 6784, 1, 256]
    - [4, 70.979]
  - - [64, 128, 1, 128]
    - [22, 0.543]
  - - [1856, 2368, 1, 128]
    - [7, 60.364]
  - - [6784, 2368, 1, 3328]
    - [6, 95.477]
  - - [1408, 6784, 1, 128]
    - [6, 70.822]
  - - [256, 1024, 1, 1280]
    - [10, 41.543]
  - - [704, 4, 1, 128]
    - [13, 0.183]
  - - [1408, 4, 1, 128]
    - [13, 0.382]
  - - [4288, 128, 1, 256]
    - [7, 38.376]
  - - [4288, 1856, 1, 3328]
    - [4, 93.529]
  - - [3584, 448, 1, 128]
    - [7, 44.529]
  - - [64, 4288, 1, 128]
    - [21, 15.831]
  - - [64, 448, 1, 3328]
    - [145, 9.969]
  - - [448, 4, 1, 3328]
    - [139, 0.735]
  - - [256, 4, 1, 3328]
    - [138, 0.475]
  - - [4, 1408, 1, 1280]
    - [138, 0.947]
  - - [3584, 64, 1, 1280]
    - [30, 36.151]
  - - [1408, 448, 1, 128]
    - [7, 30.578]
  - - [3584, 1024, 1, 1280]
    - [29, 84.953]
  - - [1856, 5056, 1, 256]
    - [4, 84.316]
  - - [4, 3584, 1, 256]
    - [16, 1.546]
  - - [6784, 4288, 1, 3328]
    - [4, 96.057]
  - - [4, 2944, 1, 1280]
    - [27, 3.174]
  - - [1024, 4288, 1, 256]
    - [5, 75.948]
  - - [5888, 3584, 1, 3328]
    - [4, 95.251]
  - - [1856, 4, 1, 256]
    - [13, 0.816]
  - - [4, 256, 1, 256]
    - [16, 0.117]
  - - [5056, 3584, 1, 3328]
    - [4, 94.71]
  - - [1408, 128, 1, 3328]
    - [10, 50.904]
  - - [4, 64, 1, 1280]
    - [147, 0.046]
  - - [2368, 1408, 1, 1280]
    - [29, 86.479]
  - - [5056, 2944, 1, 1280]
    - [4, 92.804]
  - - [8448, 6000, 1, 2816]
    - [4, 96.461]
  - - [4, 4, 1, 128]
    - [67, 0.001]
  - - [3584, 256, 1, 256]
    - [36, 46.631]
  - - [3584, 2944, 1, 1280]
    - [4, 92.654]
  - - [1024, 6784, 1, 256]
    - [6, 80.791]
  - - [4, 128, 1, 256]
    - [16, 0.056]
  - - [6784, 448, 1, 256]
    - [5, 69.571]
  - - [5124, 9124, 1, 2048]
    - [6, 93.119]
  - - [2944, 5056, 1, 3328]
    - [6, 93.654]
  - - [6784, 4, 1, 128]
    - [13, 1.701]
  - - [2944, 1408, 1, 128]
    - [7, 59.927]
  - - [448, 128, 1, 3328]
    - [19, 20.094]
  - - [64, 2944, 1, 3328]
    - [34, 52.428]
  - - [5056, 6784, 1, 3328]
    - [4, 95.69]
  - - [704, 2368, 1, 128]
    - [36, 25.187]
  - - [3072, 1500, 1, 1024]
    - [4, 85.849]
  - - [128, 2944, 1, 256]
    - [30, 31.966]
  - - [128, 6784, 1, 128]
    - [4, 35.276]
  - - [3584, 4288, 1, 256]
    - [6, 86.069]
  - - [448, 1856, 1, 256]
    - [4, 47.49]
  - - [1856, 6784, 1, 3328]
    - [35, 94.705]
  - - [3584, 128, 1, 3328]
    - [10, 56.166]
  - - [64, 1856, 1, 256]
    - [13, 12.807]
  - - [64, 448, 1, 256]
    - [13, 3.15]
  - - [5888, 4288, 1, 256]
    - [6, 90.124]
  - - [128, 1500, 1, 1280]
    - [37, 26.656]
  - - [5056, 1408, 1, 256]
    - [5, 80.677]
  - - [35, 8457, 1, 4096]
    - [36, 31.711]
  - - [64, 256, 1, 1280]
    - [27, 4.522]
  - - [2944, 4, 1, 128]
    - [13, 0.738]
  - - [3584, 1024, 1, 256]
    - [7, 71.886]
  - - [512, 6000, 1, 1536]
    - [4, 88.53]
  - - [256, 704, 1, 256]
    - [1, 7.338]
  - - [5888, 5888, 1, 256]
    - [6, 92.65]
  - - [4288, 1024, 1, 1280]
    - [4, 89.249]
  - - [5888, 128, 1, 3328]
    - [41, 74.758]
  - - [448, 6784, 1, 3328]
    - [4, 89.623]
  - - [2944, 1408, 1, 1280]
    - [29, 86.073]
  - - [3072, 6000, 1, 1024]
    - [5, 93.379]
  - - [1024, 32, 1, 512]
    - [45, 2.648]
  - - [2944, 1856, 1, 3328]
    - [29, 88.989]
  - - [2368, 64, 1, 128]
    - [13, 9.3]
  - - [256, 1024, 1, 128]
    - [38, 14.972]
  - - [3584, 5888, 1, 1280]
    - [4, 95.414]
  - - [64, 4, 1, 128]
    - [11, 0.016]
  - - [6784, 1856, 1, 1280]
    - [4, 94.794]
  - - [2944, 5056, 1, 256]
    - [6, 87.705]
  - - [5888, 256, 1, 3328]
    - [7, 83.022]
  - - [2944, 4288, 1, 128]
    - [6, 73.779]
  - - [3584, 1408, 1, 256]
    - [4, 76.805]
  - - [704, 3584, 1, 3328]
    - [51, 87.073]
  - - [5056, 448, 1, 1280]
    - [7, 79.477]
  - - [3584, 1856, 1, 3328]
    - [4, 93.457]
  - - [64, 1408, 1, 128]
    - [13, 5.975]
  - - [4288, 6784, 1, 1280]
    - [4, 95.457]
  - - [1024, 3000, 1, 2048]
    - [4, 89.133]
  - - [1408, 704, 1, 1280]
    - [7, 70.504]
  - - [2944, 1024, 1, 256]
    - [4, 70.834]
  - - [256, 64, 1, 128]
    - [13, 1.112]
  - - [2368, 4288, 1, 3328]
    - [4, 93.745]
  - - [4, 1408, 1, 256]
    - [99, 0.253]
  - - [1024, 1408, 1, 1280]
    - [36, 75.746]
  - - [64, 64, 1, 256]
    - [13, 0.468]
  - - [704, 256, 1, 3328]
    - [24, 51.193]
  - - [6784, 5056, 1, 256]
    - [6, 91.686]
  - - [1856, 1856, 1, 128]
    - [7, 57.764]
  - - [4288, 5888, 1, 256]
    - [6, 88.805]
  - - [4, 704, 1, 3328]
    - [138, 1.151]
  - - [35, 8457, 1, 2048]
    - [7, 33.397]
  - - [448, 2944, 1, 256]
    - [4, 58.077]
  - - [4, 4288, 1, 3328]
    - [22, 4.985]
  - - [2944, 6784, 1, 256]
    - [6, 88.827]
  - - [2944, 2944, 1, 128]
    - [6, 69.151]
  - - [4, 4, 1, 1280]
    - [140, 0.003]
  - - [1856, 3584, 1, 1280]
    - [4, 91.973]
  - - [64, 2944, 1, 256]
    - [93, 7.527]
  - - [3584, 1408, 1, 1280]
    - [36, 87.179]
  - - [448, 256, 1, 128]
    - [11, 7.191]
  - - [4288, 448, 1, 128]
    - [7, 48.391]
  - - [5056, 256, 1, 1280]
    - [7, 65.935]
  - - [1856, 1408, 1, 3328]
    - [29, 84.139]
  - - [128, 128, 1, 128]
    - [94, 0.396]
  - - [1024, 4288, 1, 3328]
    - [4, 91.541]
  - - [448, 2368, 1, 256]
    - [7, 52.529]
  - - [1024, 4, 1, 128]
    - [13, 0.096]
  - - [64, 1408, 1, 1280]
    - [15, 23.736]
  - - [64, 6784, 1, 1280]
    - [7, 40.374]
  - - [5056, 448, 1, 256]
    - [7, 64.049]
  - - [2944, 2368, 1, 3328]
    - [4, 92.007]
  - - [704, 4288, 1, 3328]
    - [29, 85.259]
  - - [1408, 128, 1, 256]
    - [34, 7.395]
  - - [1024, 1856, 1, 1280]
    - [7, 71.201]
  - - [6784, 1856, 1, 256]
    - [6, 88.305]
  - - [512, 48000, 1, 2816]
    - [4, 95.711]
  - - [512, 3000, 1, 2816]
    - [36, 84.057]
  - - [128, 2368, 1, 3328]
    - [32, 55.438]
  - - [1024, 5888, 1, 256]
    - [4, 69.535]
  - - [64, 2944, 1, 1280]
    - [69, 25.325]
  - - [6784, 1408, 1, 256]
    - [6, 83.865]
  - - [5056, 64, 1, 3328]
    - [32, 58.825]
  - - [128, 704, 1, 128]
    - [72, 2.074]
  - - [1408, 2368, 1, 256]
    - [7, 72.304]
  - - [1408, 1408, 1, 256]
    - [7, 64.976]
  - - [4, 64, 1, 128]
    - [16, 0.016]
  - - [64, 128, 1, 1280]
    - [27, 2.363]
  - - [1024, 8, 1, 500000]
    - [139, 13.516]
  - - [4, 2368, 1, 128]
    - [52, 0.588]
  - - [2368, 2368, 1, 128]
    - [7, 62.686]
  - - [64, 5888, 1, 128]
    - [21, 19.942]
  - - [5888, 4, 1, 3328]
    - [13, 7.051]
  - - [6784, 1408, 1, 128]
    - [6, 70.731]
  - - [1408, 5056, 1, 256]
    - [6, 82.625]
  - - [512, 50176, 1, 128]
    - [6, 75.072]
  - - [5056, 128, 1, 3328]
    - [78, 61.282]
  - - [128, 128, 1, 1280]
    - [14, 4.726]
  - - [512, 2, 1, 512]
    - [57, 0.186]
  - - [448, 704, 1, 256]
    - [69, 27.565]
  - - [4288, 3584, 1, 128]
    - [6, 72.132]
  - - [2944, 128, 1, 3328]
    - [40, 68.84]
  - - [128, 5056, 1, 1280]
    - [7, 69.133]
  - - [3584, 5056, 1, 1280]
    - [4, 93.941]
  - - [256, 448, 1, 1280]
    - [37, 17.027]
  - - [704, 704, 1, 128]
    - [7, 23.243]
  - - [5056, 4, 1, 128]
    - [13, 1.282]
  - - [704, 256, 1, 1280]
    - [10, 40.14]
  - - [64, 2368, 1, 3328]
    - [24, 42.092]
  - - [1856, 1024, 1, 128]
    - [7, 48.726]
  - - [1856, 64, 1, 128]
    - [13, 7.448]
  - - [4096, 64, 1, 4096]
    - [40, 48.927]
  - - [1024, 24000, 1, 1536]
    - [4, 95.342]
  - - [704, 4288, 1, 256]
    - [4, 70.501]
  - - [5888, 2368, 1, 1280]
    - [4, 95.046]
  - - [6784, 1856, 1, 3328]
    - [6, 95.859]
  - - [64, 128, 1, 256]
    - [16, 0.936]
  - - [2368, 5888, 1, 1280]
    - [4, 95.069]
  - - [5888, 256, 1, 1280]
    - [7, 79.478]
  - - [4, 5888, 1, 1280]
    - [14, 3.24]
  - - [704, 128, 1, 128]
    - [13, 5.84]
  - - [1024, 4, 1, 1280]
    - [138, 0.751]
  - - [2368, 1856, 1, 3328]
    - [4, 91.627]
  - - [2368, 128, 1, 128]
    - [21, 16.495]
  - - [2944, 704, 1, 256]
    - [4, 63.257]
  - - [5056, 128, 1, 128]
    - [7, 29.394]
  - - [2368, 1024, 1, 3328]
    - [29, 87.234]
  - - [35, 700, 1, 2048]
    - [15, 7.588]
  - - [256, 704, 1, 3328]
    - [31, 50.241]
  - - [704, 3584, 1, 256]
    - [4, 67.383]
  - - [704, 2944, 1, 3328]
    - [4, 84.103]
  - - [6784, 1024, 1, 128]
    - [6, 67.122]
  - - [256, 448, 1, 128]
    - [71, 2.614]
  - - [448, 1024, 1, 3328]
    - [30, 55.938]
  - - [2944, 1024, 1, 3328]
    - [4, 88.291]
  - - [2944, 5056, 1, 128]
    - [6, 76.255]
  - - [2368, 256, 1, 256]
    - [7, 41.88]
  - - [1408, 6784, 1, 256]
    - [6, 83.993]
  - - [6784, 1408, 1, 3328]
    - [4, 92.193]
  - - [4288, 6784, 1, 128]
    - [6, 78.303]
  - - [1408, 2944, 1, 128]
    - [7, 58.605]
  - - [704, 64, 1, 256]
    - [13, 4.998]
  - - [3072, 4, 1, 1024]
    - [16, 2.893]
  - - [256, 2368, 1, 3328]
    - [10, 73.918]
  - - [6784, 2944, 1, 1280]
    - [4, 94.224]
  - - [4288, 1856, 1, 128]
    - [7, 66.055]
  - - [1856, 2944, 1, 128]
    - [7, 62.913]
  - - [6784, 448, 1, 128]
    - [7, 55.833]
  - - [64, 3584, 1, 128]
    - [11, 13.366]
  - - [448, 5056, 1, 1280]
    - [7, 79.332]
  - - [4288, 5056, 1, 1280]
    - [4, 94.179]
  - - [2368, 1856, 1, 128]
    - [7, 60.651]
  - - [128, 448, 1, 1280]
    - [15, 15.677]
  - - [4288, 704, 1, 256]
    - [5, 68.965]
  - - [256, 3584, 1, 128]
    - [7, 34.819]
  - - [5888, 704, 1, 256]
    - [7, 72.789]
  - - [3584, 1024, 1, 128]
    - [7, 58.806]
  - - [256, 5888, 1, 3328]
    - [30, 83.205]
  - - [1408, 4288, 1, 3328]
    - [4, 90.691]
  - - [6784, 4288, 1, 256]
    - [6, 91.446]
  - - [4288, 256, 1, 128]
    - [7, 40.333]
  - - [448, 1856, 1, 3328]
    - [0, 79.128]
  - - [5888, 256, 1, 256]
    - [7, 59.351]
  - - [1024, 4, 1, 500000]
    - [139, 6.849]
  - - [6784, 1024, 1, 1280]
    - [4, 90.071]
  - - [5888, 1024, 1, 128]
    - [6, 64.527]
  - - [1024, 128, 1, 256]
    - [70, 14.001]
  - - [512, 16, 1, 500000]
    - [139, 14.853]
  - - [128, 64, 1, 3328]
    - [138, 3.403]
  - - [448, 64, 1, 256]
    - [13, 3.181]
  - - [2368, 256, 1, 128]
    - [5, 11.208]
  - - [6784, 3584, 1, 1280]
    - [6, 96.064]
  - - [1024, 6784, 1, 1280]
    - [4, 90.253]
  - - [2944, 64, 1, 1280]
    - [10, 42.291]
  - - [1408, 2944, 1, 1280]
    - [29, 86.073]
  - - [256, 1856, 1, 256]
    - [7, 32.435]
  - - [1408, 2368, 1, 3328]
    - [29, 89.359]
  - - [2944, 4, 1, 3328]
    - [139, 3.209]
  - - [128, 1408, 1, 3328]
    - [24, 49.687]
  - - [2944, 1856, 1, 128]
    - [7, 63.547]
  - - [256, 2944, 1, 128]
    - [4, 30.19]
  - - [256, 6784, 1, 128]
    - [5, 45.126]
  - - [2368, 4, 1, 128]
    - [13, 0.581]
  - - [1408, 256, 1, 3328]
    - [40, 65.448]
  - - [1856, 4, 1, 128]
    - [13, 0.471]
  - - [1024, 16, 1, 512]
    - [13, 1.308]
  - - [5056, 6784, 1, 128]
    - [6, 79.207]
  - - [4288, 5056, 1, 128]
    - [6, 75.565]
  - - [1856, 5888, 1, 128]
    - [7, 68.298]
  - - [7680, 2, 1, 2560]
    - [38, 2.47]
  - - [3584, 1856, 1, 256]
    - [5, 80.443]
  - - [4288, 3584, 1, 1280]
    - [4, 93.052]
  - - [2368, 448, 1, 256]
    - [7, 52.755]
  - - [4288, 256, 1, 3328]
    - [7, 82.691]
  - - [1856, 704, 1, 128]
    - [4, 40.092]
  - - [1408, 64, 1, 256]
    - [13, 9.997]
  - - [64, 1856, 1, 128]
    - [13, 7.876]
  - - [4, 256, 1, 128]
    - [58, 0.067]
  - - [512, 16, 1, 512]
    - [27, 1.549]
  - - [704, 5888, 1, 128]
    - [7, 57.896]
  - - [6784, 3584, 1, 128]
    - [6, 79.373]
  - - [1024, 64, 1, 256]
    - [92, 2.857]
  - - [64, 2368, 1, 256]
    - [30, 6.178]
  - - [5124, 1500, 1, 2048]
    - [6, 88.984]
  - - [4288, 5056, 1, 3328]
    - [4, 94.721]
  - - [4, 1856, 1, 1280]
    - [23, 2.02]
  - - [4288, 128, 1, 128]
    - [7, 10.715]
  - - [512, 2, 1, 500000]
    - [140, 1.883]
  - - [1408, 1408, 1, 128]
    - [7, 48.871]
  - - [7680, 16, 1, 2560]
    - [38, 19.477]
  - - [1856, 128, 1, 128]
    - [38, 13.436]
  - - [5056, 2368, 1, 256]
    - [4, 83.764]
  - - [4288, 704, 1, 3328]
    - [36, 84.564]
  - - [448, 3584, 1, 256]
    - [7, 57.887]
  - - [2368, 64, 1, 1280]
    - [34, 21.299]
  - - [2368, 1024, 1, 1280]
    - [36, 84.009]
  - - [2944, 1408, 1, 3328]
    - [29, 88.283]
  - - [6144, 1500, 1, 2560]
    - [4, 92.77]
  - - [4224, 1, 1, 128]
    - [13, 0.254]
  - - [1024, 1408, 1, 3328]
    - [10, 80.089]
  - - [2944, 5888, 1, 1280]
    - [4, 94.457]
  - - [8448, 2, 1, 2816]
    - [21, 2.779]
  - - [1408, 4, 1, 1280]
    - [142, 0.96]
  - - [5888, 3584, 1, 256]
    - [6, 89.87]
  - - [2368, 5056, 1, 128]
    - [7, 69.202]
  - - [1408, 1856, 1, 3328]
    - [30, 84.612]
  - - [4, 4, 1, 3328]
    - [138, 0.008]
  - - [5888, 5056, 1, 3328]
    - [4, 95.352]
  - - [7680, 6000, 1, 2560]
    - [4, 96.151]
  - - [6784, 1408, 1, 1280]
    - [4, 91.104]
  - - [4, 1024, 1, 1280]
    - [138, 0.695]
  - - [512, 3000, 1, 2560]
    - [7, 83.352]
  - - [704, 2944, 1, 256]
    - [4, 64.45]
  - - [4288, 64, 1, 256]
    - [1, 24.736]
  - - [6784, 5888, 1, 3328]
    - [4, 96.41]
  - - [2368, 4288, 1, 128]
    - [7, 68.108]
  - - [64, 4288, 1, 1280]
    - [40, 42.328]
  - - [6784, 64, 1, 1280]
    - [10, 66.257]
  - - [3584, 128, 1, 128]
    - [30, 8.994]
  - - [1024, 6784, 1, 128]
    - [6, 66.017]
  - - [1024, 1500, 1, 1536]
    - [7, 80.855]
  - - [1408, 64, 1, 3328]
    - [15, 31.357]
  - - [6784, 4, 1, 256]
    - [13, 2.846]
  - - [1408, 1408, 1, 1280]
    - [7, 82.868]
  - - [256, 2368, 1, 256]
    - [7, 39.072]
  - - [3072, 3000, 1, 1024]
    - [4, 91.639]
  - - [448, 4288, 1, 3328]
    - [4, 80.622]
  - - [2368, 1408, 1, 256]
    - [7, 71.631]
  - - [704, 2368, 1, 256]
    - [7, 60.103]
  - - [1024, 24000, 1, 2560]
    - [4, 96.043]
  - - [2944, 448, 1, 1280]
    - [7, 67.187]
  - - [5888, 2368, 1, 3328]
    - [4, 95.564]
  - - [1024, 256, 1, 128]
    - [21, 14.682]
  - - [5124, 9124, 1, 1760]
    - [4, 94.41]
  - - [448, 1408, 1, 1280]
    - [30, 68.395]
  - - [448, 1856, 1, 1280]
    - [4, 72.783]
  - - [4288, 448, 1, 1280]
    - [7, 80.416]
  - - [5888, 704, 1, 3328]
    - [29, 88.021]
  - - [4, 1856, 1, 128]
    - [67, 0.167]
  - - [5056, 256, 1, 128]
    - [7, 41.023]
  - - [1856, 256, 1, 128]
    - [73, 22.465]
  - - [128, 2368, 1, 256]
    - [34, 26.693]
  - - [704, 4, 1, 256]
    - [13, 0.306]
  - - [1024, 6784, 1, 3328]
    - [4, 91.594]
  - - [1408, 5888, 1, 128]
    - [6, 67.167]
  - - [4288, 4, 1, 128]
    - [13, 1.075]
  - - [512, 3136, 1, 2048]
    - [4, 79.205]
  - - [1408, 1024, 1, 256]
    - [7, 57.757]
  - - [128, 64, 1, 256]
    - [13, 0.395]
  - - [8448, 1500, 1, 2816]
    - [4, 93.145]
  - - [256, 704, 1, 128]
    - [13, 11.424]
  - - [2560, 7000, 1, 2560]
    - [4, 95.665]
  - - [5888, 64, 1, 1280]
    - [30, 58.277]
  - - [128, 4, 1, 3328]
    - [138, 0.25]
  - - [5056, 6784, 1, 1280]
    - [5, 95.28]
  - - [1024, 448, 1, 1280]
    - [10, 50.119]
  - - [704, 5056, 1, 3328]
    - [10, 89.123]
  - - [128, 5056, 1, 256]
    - [7, 43.408]
  - - [3584, 5056, 1, 3328]
    - [4, 94.507]
  - - [1856, 4, 1, 3328]
    - [139, 2.524]
  - - [4, 2944, 1, 128]
    - [60, 0.269]
  - - [2368, 2944, 1, 3328]
    - [29, 91.83]
  - - [448, 448, 1, 1280]
    - [30, 28.527]
  - - [128, 4, 1, 128]
    - [16, 0.034]
  - - [2368, 3584, 1, 256]
    - [5, 83.33]
  - - [4608, 3000, 1, 1536]
    - [4, 94.473]
  - - [1024, 256, 1, 1280]
    - [10, 41.888]
  - - [5056, 3584, 1, 1280]
    - [4, 93.874]
  - - [5124, 9124, 1, 4096]
    - [66, 93.749]
  - - [7680, 48000, 1, 2560]
    - [6, 97.22]
  - - [1856, 704, 1, 1280]
    - [7, 66.95]
  - - [1856, 2944, 1, 1280]
    - [29, 87.214]
  - - [4608, 1500, 1, 1536]
    - [4, 90.497]
  - - [1024, 48000, 1, 2816]
    - [6, 96.301]
  - - [5124, 9124, 1, 2560]
    - [6, 93.1]
  - - [128, 1024, 1, 256]
    - [36, 5.517]
  - - [2944, 1408, 1, 256]
    - [7, 74.028]
  - - [4288, 1408, 1, 3328]
    - [4, 90.759]
  - - [3584, 64, 1, 3328]
    - [32, 42.107]
  - - [5888, 2944, 1, 128]
    - [6, 75.238]
  - - [2944, 1024, 1, 128]
    - [7, 55.382]
  - - [128, 1, 1, 1024]
    - [140, 0.02]
  - - [5124, 700, 1, 2048]
    - [4, 82.875]
  - - [4, 4288, 1, 1280]
    - [46, 4.038]
  - - [6784, 5056, 1, 128]
    - [6, 79.975]
  - - [256, 1024, 1, 3328]
    - [32, 48.359]
  - - [3584, 4, 1, 256]
    - [13, 1.517]
  - - [1856, 64, 1, 3328]
    - [10, 33.805]
  - - [4, 128, 1, 3328]
    - [138, 0.242]
  - - [256, 12544, 1, 1024]
    - [7, 82.192]
  - - [5888, 1408, 1, 3328]
    - [4, 92.397]
  - - [448, 2944, 1, 128]
    - [7, 20.535]
  - - [2368, 1856, 1, 256]
    - [4, 76.709]
  - - [256, 5056, 1, 256]
    - [4, 56.995]
  - - [5056, 5056, 1, 128]
    - [6, 77.043]
  - - [448, 3584, 1, 3328]
    - [51, 82.105]
  - - [4, 5056, 1, 3328]
    - [60, 5.248]
  - - [256, 256, 1, 128]
    - [15, 4.346]
  - - [5888, 256, 1, 128]
    - [36, 44.136]
  - - [4, 5056, 1, 128]
    - [53, 1.241]
  - - [448, 256, 1, 256]
    - [62, 12.366]
  - - [704, 4, 1, 3328]
    - [139, 1.2]
  - - [1408, 256, 1, 256]
    - [7, 31.033]
  - - [3584, 1856, 1, 128]
    - [6, 65.704]
  - - [4288, 4288, 1, 128]
    - [6, 74.327]
  - - [1856, 1024, 1, 3328]
    - [74, 83.349]
  - - [1856, 4288, 1, 128]
    - [5, 65.96]
  - - [1024, 6000, 1, 2560]
    - [4, 91.972]
  - - [1024, 5056, 1, 256]
    - [5, 76.873]
  - - [5056, 5888, 1, 128]
    - [6, 77.915]
  - - [2368, 1408, 1, 3328]
    - [29, 89.295]
  - - [1024, 48000, 1, 1536]
    - [6, 96.169]
  - - [5888, 448, 1, 256]
    - [4, 68.234]
  - - [5888, 6784, 1, 128]
    - [6, 80.481]
  - - [2368, 4, 1, 3328]
    - [139, 2.982]
  - - [6784, 5056, 1, 1280]
    - [4, 95.284]
  - - [5056, 704, 1, 1280]
    - [4, 89.078]
  - - [1024, 48000, 1, 2560]
    - [6, 96.243]
  - - [4608, 32, 1, 1536]
    - [34, 34.367]
  - - [1024, 2368, 1, 128]
    - [7, 51.425]
  - - [128, 704, 1, 256]
    - [70, 10.094]
  - - [2368, 448, 1, 3328]
    - [10, 80.561]
  - - [128, 5888, 1, 3328]
    - [35, 74.857]
  - - [448, 128, 1, 1280]
    - [19, 15.752]
  - - [6784, 4, 1, 3328]
    - [38, 4.702]
  - - [4288, 4, 1, 1280]
    - [18, 4.21]
  - - [1024, 64, 1, 3328]
    - [45, 22.753]
  - - [3072, 48000, 1, 1024]
    - [6, 96.965]
  - - [256, 4, 1, 128]
    - [22, 0.066]
  - - [1024, 5888, 1, 128]
    - [6, 63.467]
  - - [3584, 5888, 1, 128]
    - [6, 78.232]
  - - [5056, 5888, 1, 256]
    - [6, 89.909]
  - - [2368, 1024, 1, 256]
    - [7, 67.41]
  - - [2944, 1856, 1, 256]
    - [4, 77.538]
  - - [1856, 6784, 1, 1280]
    - [4, 94.658]
  - - [64, 5056, 1, 128]
    - [2, 17.609]
  - - [64, 6784, 1, 128]
    - [7, 22.768]
  - - [448, 704, 1, 128]
    - [37, 6.588]
  - - [4, 1024, 1, 128]
    - [67, 0.098]
  - - [1408, 448, 1, 256]
    - [7, 43.316]
  - - [1408, 704, 1, 128]
    - [36, 36.89]
  - - [64, 256, 1, 3328]
    - [139, 6.57]
  - - [8448, 3000, 1, 2816]
    - [4, 95.355]
  - - [6784, 448, 1, 3328]
    - [4, 89.325]
  - - [5056, 1856, 1, 1280]
    - [4, 93.619]
  - - [1408, 1024, 1, 3328]
    - [10, 79.676]
  - - [2368, 256, 1, 3328]
    - [10, 73.978]
  - - [7680, 1500, 1, 2560]
    - [29, 91.137]
  - - [5888, 3584, 1, 1280]
    - [4, 95.302]
  - - [1856, 3584, 1, 3328]
    - [4, 93.23]
  - - [5888, 128, 1, 1280]
    - [76, 66.071]
  - - [1024, 2944, 1, 256]
    - [5, 70.263]
  - - [448, 6784, 1, 1280]
    - [4, 86.876]
  - - [256, 3584, 1, 1280]
    - [30, 64.153]
  - - [448, 128, 1, 128]
    - [13, 3.759]
  - - [704, 5056, 1, 256]
    - [4, 74.258]
  - - [3584, 1024, 1, 3328]
    - [29, 86.9]
  - - [2944, 1856, 1, 1280]
    - [29, 87.287]
  - - [128, 256, 1, 128]
    - [12, 2.25]
  - - [5056, 256, 1, 256]
    - [7, 56.563]
  - - [2944, 4288, 1, 3328]
    - [4, 92.765]
  - - [2368, 3584, 1, 3328]
    - [4, 94.126]
  - - [2944, 704, 1, 1280]
    - [4, 80.509]
  - - [128, 4, 1, 256]
    - [20, 0.056]
  - - [2944, 3584, 1, 1280]
    - [4, 92.626]
  - - [1856, 5888, 1, 1280]
    - [4, 92.242]
  - - [256, 256, 1, 1280]
    - [15, 18.351]
  - - [4608, 24000, 1, 1536]
    - [6, 97.005]
  - - [4288, 1408, 1, 256]
    - [5, 78.175]
  - - [3584, 64, 1, 256]
    - [34, 21.002]
  - - [64, 1856, 1, 3328]
    - [24, 32.869]
  - - [256, 1408, 1, 128]
    - [36, 7.398]
  - - [5888, 1408, 1, 128]
    - [6, 68.026]
  - - [4288, 2368, 1, 1280]
    - [4, 92.855]
  - - [4, 4288, 1, 256]
    - [46, 1.783]
  - - [256, 4288, 1, 128]
    - [36, 39.088]
  - - [256, 128, 1, 3328]
    - [145, 11.493]
  - - [512, 8, 1, 500000]
    - [140, 7.571]
  - - [6784, 2368, 1, 256]
    - [6, 89.361]
  - - [5888, 128, 1, 128]
    - [36, 31.054]
  - - [1408, 448, 1, 3328]
    - [10, 76.541]
  - - [1024, 24000, 1, 2816]
    - [4, 95.544]
  - - [704, 1024, 1, 1280]
    - [4, 63.585]
  - - [1856, 256, 1, 3328]
    - [10, 57.983]
  - - [1856, 2944, 1, 256]
    - [5, 77.347]
  - - [5056, 1024, 1, 128]
    - [7, 63.007]
  - - [64, 5888, 1, 1280]
    - [32, 57.506]
  - - [7680, 3000, 1, 2560]
    - [6, 94.909]
  - - [4224, 1500, 1, 176]
    - [4, 73.258]
  - - [5124, 700, 1, 2560]
    - [4, 84.493]
  - - [6784, 256, 1, 128]
    - [7, 46.596]
  - - [5888, 704, 1, 128]
    - [7, 60.229]
  - - [6784, 64, 1, 128]
    - [1, 21.779]
  - - [4, 448, 1, 1280]
    - [145, 0.313]
  - - [1024, 4288, 1, 1280]
    - [4, 89.628]
  - - [2368, 5056, 1, 3328]
    - [4, 94.438]
  - - [448, 4, 1, 128]
    - [20, 0.043]
  - - [4, 256, 1, 3328]
    - [140, 0.421]
  - - [4288, 1024, 1, 3328]
    - [29, 89.825]
  - - [6144, 48000, 1, 2560]
    - [6, 97.188]
  - - [1024, 5056, 1, 3328]
    - [29, 91.074]
  - - [1024, 1856, 1, 3328]
    - [75, 86.56]
  - - [704, 704, 1, 1280]
    - [30, 54.249]
  - - [128, 2368, 1, 1280]
    - [10, 47.512]
  - - [3584, 4, 1, 128]
    - [13, 0.889]
  - - [3584, 256, 1, 1280]
    - [7, 65.422]
  - - [4, 128, 1, 128]
    - [13, 0.033]
  - - [128, 4288, 1, 3328]
    - [10, 67.035]
  - - [5124, 1500, 1, 2560]
    - [6, 89.442]
  - - [3584, 128, 1, 1280]
    - [7, 50.119]
  - - [4, 256, 1, 1280]
    - [145, 0.184]
  - - [128, 704, 1, 3328]
    - [45, 31.357]
  - - [4288, 6784, 1, 256]
    - [6, 90.241]
  - - [3584, 2944, 1, 3328]
    - [6, 93.505]
  - - [128, 1856, 1, 256]
    - [38, 21.926]
  - - [64, 4288, 1, 256]
    - [21, 23.985]
  - - [4, 3584, 1, 3328]
    - [14, 4.517]
  - - [64, 4, 1, 3328]
    - [138, 0.127]
  - - [4, 64, 1, 3328]
    - [138, 0.109]
  - - [35, 700, 1, 2560]
    - [45, 7.83]
  - - [5888, 2944, 1, 256]
    - [6, 87.674]
  - - [4, 2368, 1, 256]
    - [60, 0.423]
  - - [1856, 64, 1, 256]
    - [15, 12.689]
  - - [5056, 128, 1, 1280]
    - [7, 69.91]
  - - [448, 4288, 1, 1280]
    - [7, 80.827]
  - - [256, 4288, 1, 256]
    - [7, 51.273]
  - - [1024, 4288, 1, 128]
    - [6, 59.879]
  - - [4, 1024, 1, 256]
    - [60, 0.178]
  - - [5056, 4288, 1, 256]
    - [6, 87.455]
  - - [1024, 448, 1, 256]
    - [36, 32.67]
  - - [1024, 3584, 1, 256]
    - [4, 71.521]
  - - [2944, 128, 1, 1280]
    - [30, 58.909]
  - - [2560, 32, 1, 2560]
    - [15, 26.4]
  - - [64, 256, 1, 256]
    - [16, 1.89]
  - - [1024, 4, 1, 512]
    - [27, 0.733]
  - - [128, 2368, 1, 128]
    - [101, 6.525]
  - - [256, 704, 1, 1280]
    - [30, 25.165]
  - - [64, 2368, 1, 128]
    - [79, 9.714]
  - - [176, 1500, 1, 1408]
    - [37, 40.958]
  - - [448, 5888, 1, 1280]
    - [4, 87.049]
  - - [512, 3000, 1, 2048]
    - [7, 82.807]
  - - [5056, 448, 1, 128]
    - [7, 50.841]
  - - [4288, 704, 1, 1280]
    - [4, 85.402]
  - - [3584, 2944, 1, 128]
    - [6, 71.859]
  - - [6784, 256, 1, 1280]
    - [29, 71.501]
  - - [256, 2944, 1, 1280]
    - [80, 66.374]
  - - [2560, 128, 1, 2560]
    - [40, 58.071]
  - - [2368, 5888, 1, 3328]
    - [26, 93.79]
  - - [4, 64, 1, 256]
    - [16, 0.027]
  - - [704, 1024, 1, 3328]
    - [81, 70.437]
  - - [2368, 1856, 1, 1280]
    - [4, 90.03]
  - - [448, 5056, 1, 3328]
    - [7, 81.998]
  - - [128, 448, 1, 128]
    - [58, 1.349]
  - - [128, 6784, 1, 256]
    - [7, 48.397]
  - - [512, 4, 1, 500000]
    - [140, 3.787]
  - - [3584, 4288, 1, 128]
    - [6, 74.685]
  - - [64, 448, 1, 128]
    - [13, 1.901]
  - - [1024, 6000, 1, 2816]
    - [4, 92.023]
  - - [5888, 4288, 1, 3328]
    - [4, 94.935]
  - - [2368, 704, 1, 256]
    - [5, 59.915]
  - - [256, 1856, 1, 3328]
    - [10, 58.363]
  - - [1856, 128, 1, 256]
    - [90, 9.345]
  - - [6784, 128, 1, 128]
    - [5, 35.276]
  - - [3584, 1408, 1, 128]
    - [6, 62.735]
  - - [1856, 5056, 1, 1280]
    - [4, 93.749]
  - - [2944, 1024, 1, 1280]
    - [4, 85.665]
  - - [5056, 4, 1, 256]
    - [13, 2.141]
  - - [3584, 5888, 1, 3328]
    - [4, 96.092]
  - - [2368, 4288, 1, 256]
    - [4, 83.855]
  - - [1024, 2368, 1, 3328]
    - [29, 87.254]
  - - [128, 3584, 1, 128]
    - [82, 22.427]
  - - [704, 1408, 1, 256]
    - [7, 50.378]
  - - [4096, 128, 1, 4096]
    - [30, 63.254]
  - - [1024, 2944, 1, 128]
    - [7, 54.514]
  - - [1024, 3584, 1, 1280]
    - [29, 84.109]
  - - [4288, 5888, 1, 3328]
    - [4, 95.767]
  - - [4288, 4, 1, 3328]
    - [18, 5.393]
  - - [4608, 16, 1, 1536]
    - [18, 19.554]
  - - [5888, 64, 1, 128]
    - [1, 20.316]
  - - [4, 5888, 1, 128]
    - [58, 1.415]
  - - [1024, 2944, 1, 3328]
    - [29, 84.877]
  - - [2048, 64, 1, 2048]
    - [34, 33.511]
  - - [6144, 2, 1, 2560]
    - [39, 3.544]
  - - [256, 6784, 1, 1280]
    - [7, 71.857]
  - - [1856, 3584, 1, 256]
    - [5, 81.037]
  - - [128, 448, 1, 3328]
    - [15, 20.189]
  - - [6784, 1856, 1, 128]
    - [6, 74.57]
  - - [1024, 1500, 1, 2048]
    - [7, 82.374]
  - - [5056, 128, 1, 256]
    - [7, 44.443]
  - - [512, 24000, 1, 2816]
    - [6, 93.575]
  - - [256, 5888, 1, 1280]
    - [10, 77.22]
  - - [4, 128, 1, 1280]
    - [138, 0.09]
  - - [4288, 6784, 1, 3328]
    - [4, 95.957]
  - - [6784, 128, 1, 1280]
    - [66, 58.074]
  - - [64, 1408, 1, 256]
    - [13, 9.901]
  - - [2368, 1408, 1, 128]
    - [7, 57.412]
  - - [1856, 448, 1, 256]
    - [5, 47.964]
  - - [1408, 1024, 1, 128]
    - [7, 42.434]
  - - [128, 64, 1, 128]
    - [16, 0.556]
  - - [6784, 3584, 1, 3328]
    - [6, 96.696]
  - - [1760, 7000, 1, 1760]
    - [4, 93.358]
  - - [1024, 704, 1, 3328]
    - [41, 72.128]
  - - [64, 64, 1, 128]
    - [16, 0.272]
  - - [2368, 5056, 1, 1280]
    - [4, 93.607]
  - - [64, 4, 1, 1280]
    - [139, 0.046]
  - - [1408, 2368, 1, 1280]
    - [29, 86.324]
  - - [128, 1408, 1, 1280]
    - [31, 40.14]
  - - [1024, 1, 1, 512]
    - [57, 0.12]
  - - [4, 1408, 1, 128]
    - [11, 0.131]
  - - [704, 4288, 1, 128]
    - [4, 53.912]
  - - [128, 1856, 1, 3328]
    - [40, 43.665]
  - - [2944, 2944, 1, 256]
    - [6, 82.57]
  - - [2944, 4, 1, 1280]
    - [15, 3.13]
  - - [5888, 4, 1, 256]
    - [13, 2.47]
  - - [6784, 256, 1, 256]
    - [7, 61.273]
  - - [256, 5056, 1, 3328]
    - [10, 74.652]
  - - [128, 4288, 1, 1280]
    - [36, 58.74]
  - - [5056, 1856, 1, 128]
    - [7, 67.748]
  - - [1024, 3000, 1, 1536]
    - [4, 88.236]
  - - [5056, 1024, 1, 3328]
    - [29, 91.374]
  - - [128, 128, 1, 256]
    - [92, 0.759]
  - - [1760, 64, 1, 1760]
    - [10, 20.319]
  - - [4288, 3584, 1, 3328]
    - [4, 93.65]
  - - [448, 704, 1, 3328]
    - [30, 57.546]
  - - [448, 448, 1, 128]
    - [7, 4.374]
  - - [1024, 2368, 1, 1280]
    - [29, 83.358]
  - - [1856, 704, 1, 3328]
    - [30, 74.896]
  - - [512, 1500, 1, 2560]
    - [4, 72.27]
  - - [5888, 6784, 1, 3328]
    - [4, 96.396]
  - - [704, 4288, 1, 1280]
    - [4, 86.807]
  - - [128, 50176, 1, 512]
    - [4, 82.466]
  - - [704, 256, 1, 256]
    - [84, 7.166]
  - - [1024, 48000, 1, 2048]
    - [6, 96.296]
  - - [4288, 1024, 1, 128]
    - [7, 60.451]
  - - [3136, 64, 128, 64]
    - [7, 41.371]
  - - [784, 128, 128, 512]
    - [4, 78.909]
  - - [784, 512, 256, 128]
    - [4, 64.299]
  - - [3136, 256, 256, 64]
    - [6, 49.439]
  - - [3136, 64, 128, 256]
    - [7, 67.01]
  - - [3136, 64, 256, 64]
    - [7, 41.91]
  - - [784, 512, 128, 128]
    - [5, 63.438]
  - - [784, 128, 256, 512]
    - [6, 81.66]
  - - [3136, 64, 256, 256]
    - [7, 67.552]
  - - [3136, 256, 128, 64]
    - [6, 49.152]
  - - [1024, 256, 1, 1024]
    - [30, 31.098]
  - - [1024, 512, 1, 2048]
    - [10, 56.595]
  - - [512, 200, 1, 512]
    - [50, 7.969]
  - - [4096, 256, 1, 2048]
    - [36, 77.114]
  - - [4096, 512, 1, 1024]
    - [4, 80.515]
  - - [1024, 200, 1, 1024]
    - [94, 22.529]
  - - [2048, 256, 1, 4096]
    - [10, 64.648]
  - - [2048, 768, 1, 512]
    - [7, 71.866]
  - - [512, 256, 1, 1024]
    - [24, 27.746]
  - - [512, 768, 1, 2048]
    - [40, 67.457]
  - - [2048, 256, 1, 1024]
    - [7, 54.615]
  - - [1024, 256, 1, 2048]
    - [10, 44.888]
  - - [2048, 200, 1, 512]
    - [7, 24.122]
  - - [4096, 200, 1, 1024]
    - [7, 56.089]
  - - [2048, 200, 1, 4096]
    - [10, 49.554]
  - - [2048, 512, 1, 1024]
    - [7, 65.302]
  - - [1024, 1024, 1, 512]
    - [7, 62.843]
  - - [1024, 200, 1, 4096]
    - [30, 35.673]
  - - [2048, 512, 1, 4096]
    - [10, 80.181]
  - - [4096, 512, 1, 2048]
    - [4, 83.864]
  - - [4096, 1024, 1, 2048]
    - [6, 89.141]
  - - [2048, 1024, 1, 2048]
    - [4, 82.858]
  - - [1024, 200, 1, 512]
    - [37, 14.364]
  - - [1024, 1024, 1, 4096]
    - [10, 80.683]
  - - [2048, 1024, 1, 4096]
    - [4, 85.006]
  - - [4096, 200, 1, 2048]
    - [36, 60.487]
  - - [2048, 200, 1, 1024]
    - [30, 34.367]
  - - [1024, 768, 1, 512]
    - [4, 57.424]
  - - [2048, 200, 1, 2048]
    - [30, 42.841]
  - - [2048, 256, 1, 2048]
    - [36, 59.962]
  - - [512, 768, 1, 512]
    - [34, 46.529]
  - - [512, 200, 1, 1024]
    - [50, 13.352]
  - - [4096, 1024, 1, 1024]
    - [7, 85.721]
  - - [4096, 256, 1, 4096]
    - [7, 79.588]
  - - [1024, 512, 1, 512]
    - [36, 46.529]
  - - [512, 256, 1, 512]
    - [30, 9.781]
  - - [1024, 256, 1, 4096]
    - [32, 49.427]
  - - [1024, 200, 1, 2048]
    - [10, 29.708]
  - - [2048, 1024, 1, 512]
    - [5, 73.206]
  - - [1024, 1024, 1, 2048]
    - [10, 73.205]
  - - [4096, 256, 1, 1024]
    - [7, 72.224]
  - - [512, 768, 1, 1024]
    - [30, 58.347]
  - - [1024, 512, 1, 4096]
    - [10, 64.996]
  - - [1024, 256, 1, 512]
    - [34, 31.341]
  - - [4096, 200, 1, 4096]
    - [29, 62.383]
  - - [2048, 256, 1, 512]
    - [36, 46.35]
  - - [512, 200, 1, 2048]
    - [39, 28.381]
  - - [1024, 1024, 1, 1024]
    - [36, 64.091]
  - - [4096, 1024, 1, 4096]
    - [78, 93.115]
  - - [2048, 1024, 1, 1024]
    - [5, 75.021]
  - - [4096, 384, 1, 2048]
    - [7, 84.547]
  - - [4096, 192, 1, 2048]
    - [41, 74.141]
  - - [1225, 192, 64, 384]
    - [6, 80.276]
  - - [5329, 64, 64, 160]
    - [6, 48.161]
  - - [1225, 64, 64, 384]
    - [6, 59.555]
  - - [289, 128, 64, 1024]
    - [4, 70.944]
  - - [4096, 320, 1, 1280]
    - [36, 65.912]
  - - [4096, 384, 1, 1536]
    - [7, 83.239]
  - - [4096, 192, 1, 1280]
    - [41, 69.155]
  - - [289, 192, 64, 1024]
    - [4, 71.815]
  - - [1225, 96, 64, 384]
    - [85, 66.317]
  - - [4096, 320, 1, 2048]
    - [7, 70.972]
  - - [4096, 256, 1, 1536]
    - [7, 75.451]
  - - [4096, 384, 1, 1280]
    - [7, 82.257]
  - - [4096, 448, 1, 1280]
    - [36, 73.644]
  - - [289, 256, 64, 1024]
    - [4, 76.482]
  - - [4096, 448, 1, 2048]
    - [36, 79.147]
  - - [289, 384, 64, 1024]
    - [4, 79.208]
  - - [1024, 3594, 1, 4096]
    - [29, 87.375]
  - - [4096, 3103, 1, 1024]
    - [5, 92.396]
  - - [4096, 3136, 1, 1024]
    - [4, 93.203]
  - - [1024, 3141, 1, 4096]
    - [29, 86.51]
  - - [64, 147, 432, 148]
    - [86, 34.27]
  - - [4096, 3559, 1, 1024]
    - [5, 92.892]
  - - [4096, 3368, 1, 1024]
    - [5, 93.511]
  - - [1024, 3335, 1, 4096]
    - [29, 86.397]
  - - [1024, 3510, 1, 4096]
    - [4, 92.857]
  - - [4096, 3209, 1, 1024]
    - [6, 92.155]
  - - [4096, 3322, 1, 1024]
    - [5, 92.628]
  - - [1024, 3400, 1, 4096]
    - [29, 88.038]
  - - [1024, 3995, 1, 4096]
    - [29, 87.512]
  - - [1024, 3503, 1, 4096]
    - [4, 93.01]
  - - [4096, 3594, 1, 1024]
    - [5, 91.654]
  - - [4096, 3473, 1, 1024]
    - [6, 93.528]
  - - [4096, 3522, 1, 1024]
    - [4, 92.079]
  - - [1024, 3103, 1, 4096]
    - [29, 85.513]
  - - [1024, 3214, 1, 4096]
    - [29, 88.34]
  - - [4096, 3449, 1, 1024]
    - [4, 93.133]
  - - [1024, 3136, 1, 4096]
    - [29, 86.46]
  - - [1024, 3955, 1, 33708]
    - [41, 87.128]
  - - [1024, 3780, 1, 4096]
    - [29, 88.291]
  - - [1024, 3906, 1, 33708]
    - [35, 93.083]
  - - [1024, 3386, 1, 4096]
    - [29, 87.718]
  - - [4096, 3396, 1, 1024]
    - [4, 91.715]
  - - [1024, 3183, 1, 4096]
    - [29, 87.628]
  - - [1024, 3098, 1, 4096]
    - [29, 85.288]
  - - [1024, 3548, 1, 4096]
    - [29, 86.49]
  - - [1024, 3224, 1, 4096]
    - [29, 88.551]
  - - [4096, 3469, 1, 1024]
    - [5, 93.473]
  - - [1024, 3582, 1, 4096]
    - [29, 87.398]
  - - [1024, 2977, 1, 4096]
    - [4, 90.222]
  - - [1024, 3939, 1, 1024]
    - [7, 83.172]
  - - [64, 123, 528, 123]
    - [72, 29.387]
  - - [64, 12, 5040, 12]
    - [84, 4.388]
  - - [4096, 3176, 1, 1024]
    - [5, 91.668]
  - - [1024, 3559, 1, 4096]
    - [29, 86.815]
  - - [1024, 3478, 1, 4096]
    - [4, 92.489]
  - - [4096, 3343, 1, 1024]
    - [5, 93.063]
  - - [4096, 3440, 1, 1024]
    - [5, 92.917]
  - - [1024, 3996, 1, 33708]
    - [35, 88.014]
  - - [1024, 4012, 1, 4096]
    - [29, 87.721]
  - - [1024, 3322, 1, 4096]
    - [29, 86.449]
  - - [1024, 3990, 1, 33708]
    - [35, 87.916]
  - - [1024, 3314, 1, 4096]
    - [4, 88.614]
  - - [4096, 3513, 1, 1024]
    - [4, 94.43]
  - - [1024, 3562, 1, 4096]
    - [29, 86.776]
  - - [1024, 3443, 1, 4096]
    - [10, 88.942]
  - - [1024, 3554, 1, 4096]
    - [29, 86.681]
  - - [1024, 3063, 1, 4096]
    - [4, 92.576]
  - - [64, 111, 576, 112]
    - [5, 31.58]
  - - [4096, 3460, 1, 1024]
    - [6, 93.324]
  - - [1024, 3209, 1, 4096]
    - [29, 88.203]
  - - [1024, 3147, 1, 4096]
    - [29, 86.624]
  - - [4096, 3387, 1, 1024]
    - [4, 94.094]
  - - [4096, 3436, 1, 1024]
    - [4, 92.822]
  - - [1024, 3341, 1, 4096]
    - [29, 86.786]
  - - [1024, 3516, 1, 4096]
    - [4, 93.146]
  - - [4096, 3277, 1, 1024]
    - [5, 91.522]
  - - [1024, 3454, 1, 4096]
    - [29, 89.291]
  - - [1024, 3969, 1, 4096]
    - [29, 86.922]
  - - [1024, 3999, 1, 4096]
    - [29, 87.528]
  - - [1024, 4032, 1, 4096]
    - [29, 88.291]
  - - [4096, 3541, 1, 1024]
    - [5, 92.525]
  - - [4096, 3334, 1, 1024]
    - [5, 92.689]
  - - [1024, 3365, 1, 4096]
    - [10, 87.2]
  - - [1024, 3527, 1, 4096]
    - [29, 86.045]
  - - [1024, 3190, 1, 4096]
    - [29, 87.744]
  - - [4096, 3906, 1, 1024]
    - [4, 91.727]
  - - [1024, 3593, 1, 4096]
    - [29, 87.508]
  - - [1024, 3336, 1, 4096]
    - [29, 86.44]
  - - [4096, 3504, 1, 1024]
    - [4, 94.322]
  - - [4096, 3977, 1, 1024]
    - [4, 93.163]
  - - [1024, 3906, 1, 4096]
    - [78, 89.31]
  - - [4096, 3415, 1, 1024]
    - [5, 92.387]
  - - [1024, 3295, 1, 4096]
    - [29, 90.356]
  - - [4096, 3321, 1, 1024]
    - [5, 92.546]
  - - [1024, 3072, 1, 4096]
    - [4, 92.774]
  - - [1024, 3408, 1, 4096]
    - [10, 88.178]
  - - [1024, 3522, 1, 4096]
    - [29, 85.99]
  - - [4096, 3751, 1, 1024]
    - [5, 92.876]
  - - [4096, 3378, 1, 1024]
    - [5, 93.802]
  - - [64, 77, 816, 77]
    - [87, 24.059]
  - - [1024, 3925, 1, 33708]
    - [41, 93.451]
  - - [1024, 3990, 1, 1024]
    - [4, 83.171]
  - - [1024, 3290, 1, 4096]
    - [29, 90.245]
  - - [4096, 3500, 1, 1024]
    - [5, 94.214]
  - - [4096, 3565, 1, 1024]
    - [5, 93.074]
  - - [1024, 3484, 1, 4096]
    - [4, 92.558]
  - - [4096, 3395, 1, 1024]
    - [4, 91.741]
  - - [64, 92, 688, 92]
    - [87, 25.999]
  - - [1024, 3681, 1, 1024]
    - [4, 84.687]
  - - [64, 159, 400, 159]
    - [86, 34.722]
  - - [1024, 3584, 1, 1024]
    - [7, 83.677]
  - - [4096, 3093, 1, 1024]
    - [4, 91.91]
  - - [1024, 4050, 1, 1024]
    - [4, 84.31]
  - - [1024, 3301, 1, 4096]
    - [4, 88.167]
  - - [1024, 3581, 1, 4096]
    - [29, 87.216]
  - - [4096, 3374, 1, 1024]
    - [4, 93.664]
  - - [1024, 3449, 1, 4096]
    - [29, 89.041]
  - - [4096, 3215, 1, 1024]
    - [4, 92.174]
  - - [4096, 3312, 1, 1024]
    - [4, 92.322]
  - - [4096, 3479, 1, 1024]
    - [4, 93.689]
  - - [4096, 3544, 1, 1024]
    - [4, 92.488]
  - - [1024, 3263, 1, 4096]
    - [29, 89.44]
  - - [4096, 3455, 1, 1024]
    - [5, 93.162]
  - - [1024, 3379, 1, 4096]
    - [29, 87.716]
  - - [1024, 3490, 1, 4096]
    - [4, 92.887]
  - - [1024, 3368, 1, 4096]
    - [29, 87.294]
  - - [4096, 3186, 1, 1024]
    - [5, 91.998]
  - - [1024, 3428, 1, 4096]
    - [10, 88.646]
  - - [64, 85, 752, 84]
    - [86, 25.682]
  - - [4096, 3561, 1, 1024]
    - [4, 92.944]
  - - [4096, 3418, 1, 1024]
    - [4, 92.441]
  - - [1024, 3064, 1, 4096]
    - [4, 92.547]
  - - [4096, 3259, 1, 1024]
    - [5, 93.294]
  - - [4096, 3308, 1, 1024]
    - [5, 92.17]
  - - [1024, 3533, 1, 4096]
    - [29, 86.091]
  - - [1024, 3344, 1, 4096]
    - [10, 86.531]
  - - [1024, 4030, 1, 1024]
    - [4, 84.079]
  - - [4096, 3459, 1, 1024]
    - [6, 93.23]
  - - [1024, 3572, 1, 4096]
    - [29, 87.086]
  - - [1024, 3925, 1, 1024]
    - [7, 85.042]
  - - [4096, 3435, 1, 1024]
    - [4, 92.795]
  - - [1024, 3956, 1, 4096]
    - [29, 86.818]
  - - [1024, 3463, 1, 4096]
    - [4, 92.052]
  - - [4096, 3182, 1, 1024]
    - [5, 91.714]
  - - [4096, 3976, 1, 1024]
    - [4, 93.082]
  - - [1024, 3417, 1, 4096]
    - [10, 88.341]
  - - [1024, 3528, 1, 4096]
    - [29, 86.036]
  - - [4096, 3446, 1, 1024]
    - [5, 93.105]
  - - [64, 122, 528, 123]
    - [4, 29.563]
  - - [1024, 3543, 1, 4096]
    - [29, 86.302]
  - - [4096, 3287, 1, 1024]
    - [5, 91.464]
  - - [1024, 3499, 1, 4096]
    - [4, 92.787]
  - - [1024, 3231, 1, 4096]
    - [29, 88.64]
  - - [64, 17, 3632, 17]
    - [4, 4.988]
  - - [4096, 3519, 1, 1024]
    - [5, 94.524]
  - - [4096, 3552, 1, 1024]
    - [5, 92.645]
  - - [1024, 3458, 1, 4096]
    - [4, 92.009]
  - - [64, 93, 688, 92]
    - [73, 26.241]
  - - [1024, 3374, 1, 4096]
    - [29, 87.352]
  - - [1024, 3396, 1, 4096]
    - [29, 87.763]
  - - [1024, 2967, 1, 4096]
    - [4, 89.977]
  - - [64, 19, 3264, 19]
    - [4, 6.058]
  - - [4096, 3482, 1, 1024]
    - [4, 93.743]
  - - [64, 32, 1984, 32]
    - [7, 16.368]
  - - [64, 102, 624, 99]
    - [72, 27.62]
  - - [1024, 3226, 1, 4096]
    - [29, 88.438]
  - - [4096, 3377, 1, 1024]
    - [4, 93.719]
  - - [4096, 3426, 1, 1024]
    - [4, 92.512]
  - - [4096, 2935, 1, 1024]
    - [5, 92.849]
  - - [64, 133, 480, 133]
    - [86, 31.722]
  - - [1024, 3439, 1, 4096]
    - [10, 88.951]
  - - [4096, 3267, 1, 1024]
    - [4, 91.122]
  - - [4096, 3499, 1, 1024]
    - [4, 94.214]
  - - [4096, 3356, 1, 1024]
    - [5, 93.274]
  - - [64, 232, 272, 232]
    - [71, 42.183]
  - - [64, 162, 400, 159]
    - [86, 34.001]
  - - [4096, 3939, 1, 1024]
    - [5, 92.434]
  - - [1024, 3526, 1, 4096]
    - [29, 85.976]
  - - [1024, 3859, 1, 33708]
    - [51, 91.965]
  - - [1024, 3385, 1, 4096]
    - [29, 87.588]
  - - [1024, 3496, 1, 4096]
    - [4, 92.929]
  - - [4096, 3141, 1, 1024]
    - [5, 90.713]
  - - [4096, 3510, 1, 1024]
    - [4, 94.416]
  - - [1024, 3434, 1, 4096]
    - [10, 89.058]
  - - [4096, 3969, 1, 1024]
    - [5, 92.907]
  - - [1024, 3121, 1, 4096]
    - [29, 85.996]
  - - [1024, 3232, 1, 4096]
    - [29, 88.964]
  - - [1024, 4030, 1, 33708]
    - [35, 88.776]
  - - [1024, 3780, 1, 33708]
    - [35, 90.071]
  - - [1024, 3969, 1, 1024]
    - [7, 83.173]
  - - [4096, 3527, 1, 1024]
    - [4, 92.274]
  - - [4096, 3336, 1, 1024]
    - [4, 92.677]
  - - [4096, 3290, 1, 1024]
    - [5, 91.641]
  - - [64, 9, 6544, 9]
    - [84, 2.604]
  - - [1024, 3469, 1, 4096]
    - [4, 92.146]
  - - [4096, 3490, 1, 1024]
    - [5, 94.066]
  - - [4096, 3064, 1, 1024]
    - [4, 93.989]
  - - [4096, 3582, 1, 1024]
    - [5, 93.518]
  - - [1024, 3956, 1, 1024]
    - [36, 82.827]
  - - [4096, 3417, 1, 1024]
    - [4, 92.322]
  - - [1024, 2736, 1, 4096]
    - [26, 87.182]
  - - [64, 78, 816, 78]
    - [86, 24.561]
  - - [1024, 3205, 1, 4096]
    - [29, 88.092]
  - - [1024, 3143, 1, 4096]
    - [29, 86.514]
  - - [1024, 4020, 1, 4096]
    - [29, 87.917]
  - - [1024, 3318, 1, 4096]
    - [4, 88.521]
  - - [4096, 3364, 1, 1024]
    - [5, 93.441]
  - - [1024, 3353, 1, 4096]
    - [29, 86.623]
  - - [1024, 3464, 1, 4096]
    - [4, 92.013]
  - - [4096, 3205, 1, 1024]
    - [6, 91.985]
  - - [4096, 3318, 1, 1024]
    - [5, 92.435]
  - - [1024, 3402, 1, 4096]
    - [10, 87.9]
  - - [4096, 3181, 1, 1024]
    - [4, 91.784]
  - - [4096, 3550, 1, 1024]
    - [4, 92.593]
  - - [4096, 3445, 1, 1024]
    - [4, 93.172]
  - - [1024, 3138, 1, 4096]
    - [29, 86.414]
  - - [64, 99, 624, 99]
    - [88, 26.848]
  - - [4096, 3079, 1, 1024]
    - [4, 91.408]
  - - [4096, 3144, 1, 1024]
    - [4, 90.758]
  - - [4096, 3860, 1, 1024]
    - [4, 92.792]
  - - [1024, 3515, 1, 4096]
    - [4, 93.198]
  - - [4096, 3408, 1, 1024]
    - [5, 92.131]
  - - [64, 101, 624, 102]
    - [88, 27.387]
  - - [1024, 3181, 1, 4096]
    - [29, 87.509]
  - - [4096, 3298, 1, 1024]
    - [5, 91.973]
  - - [4096, 3585, 1, 1024]
    - [5, 91.462]
  - - [1024, 3550, 1, 4096]
    - [29, 86.461]
  - - [1024, 4020, 1, 1024]
    - [4, 83.833]
  - - [4096, 3481, 1, 1024]
    - [4, 93.769]
  - - [4096, 3530, 1, 1024]
    - [4, 92.262]
  - - [4096, 3425, 1, 1024]
    - [5, 92.671]
  - - [4096, 4026, 1, 1024]
    - [5, 93.939]
  - - [1024, 3860, 1, 1024]
    - [4, 87.737]
  - - [4096, 3975, 1, 1024]
    - [5, 92.898]
  - - [1024, 3286, 1, 4096]
    - [29, 90.018]
  - - [1024, 3176, 1, 4096]
    - [29, 87.27]
  - - [1024, 3894, 1, 4096]
    - [4, 92.352]
  - - [4096, 3355, 1, 1024]
    - [4, 93.246]
  - - [4096, 3404, 1, 1024]
    - [5, 91.813]
  - - [1024, 3501, 1, 4096]
    - [4, 92.827]
  - - [4096, 3245, 1, 1024]
    - [5, 92.879]
  - - [1024, 3431, 1, 4096]
    - [10, 88.733]
  - - [1024, 4000, 1, 1024]
    - [7, 83.972]
  - - [4096, 3509, 1, 1024]
    - [4, 94.403]
  - - [4096, 3558, 1, 1024]
    - [5, 92.866]
  - - [1024, 3535, 1, 4096]
    - [29, 86.307]
  - - [1024, 3414, 1, 4096]
    - [29, 88.354]
  - - [1024, 3445, 1, 4096]
    - [29, 88.916]
  - - [1024, 3436, 1, 4096]
    - [29, 88.828]
  - - [4096, 3472, 1, 1024]
    - [5, 93.434]
  - - [1024, 3211, 1, 4096]
    - [29, 88.065]
  - - [64, 7, 8192, 7]
    - [84, 1.68]
  - - [4096, 3383, 1, 1024]
    - [4, 93.969]
  - - [4096, 3448, 1, 1024]
    - [5, 93.146]
  - - [1024, 3343, 1, 4096]
    - [29, 86.556]
  - - [1024, 3518, 1, 4096]
    - [4, 93.304]
  - - [4096, 3289, 1, 1024]
    - [5, 91.708]
  - - [1024, 3440, 1, 4096]
    - [4, 91.543]
  - - [1024, 4032, 1, 33708]
    - [51, 88.861]
  - - [4096, 3489, 1, 1024]
    - [4, 93.932]
  - - [4096, 3346, 1, 1024]
    - [5, 93.051]
  - - [1024, 3534, 1, 4096]
    - [29, 86.238]
  - - [1024, 3079, 1, 4096]
    - [29, 84.839]
  - - [1024, 3955, 1, 4096]
    - [29, 86.606]
  - - [4096, 3236, 1, 1024]
    - [4, 92.565]
  - - [1024, 3545, 1, 4096]
    - [29, 86.395]
  - - [1024, 3144, 1, 4096]
    - [29, 86.516]
  - - [4096, 3780, 1, 1024]
    - [4, 93.252]
  - - [4096, 3163, 1, 1024]
    - [5, 91.32]
  - - [4096, 3468, 1, 1024]
    - [4, 93.433]
  - - [1024, 3539, 1, 4096]
    - [29, 86.282]
  - - [1024, 3541, 1, 4096]
    - [29, 86.076]
  - - [4096, 3363, 1, 1024]
    - [4, 93.413]
  - - [1024, 3475, 1, 4096]
    - [4, 92.566]
  - - [4096, 3110, 1, 1024]
    - [4, 92.459]
  - - [1024, 3509, 1, 4096]
    - [4, 93.0]
  - - [1024, 3413, 1, 4096]
    - [29, 88.277]
  - - [1024, 3975, 1, 1024]
    - [4, 83.151]
  - - [4096, 3549, 1, 1024]
    - [4, 92.555]
  - - [4096, 3342, 1, 1024]
    - [4, 92.953]
  - - [1024, 2985, 1, 4096]
    - [4, 90.479]
  - - [1024, 3876, 1, 33708]
    - [35, 92.418]
  - - [4096, 3280, 1, 1024]
    - [5, 91.444]
  - - [4096, 3191, 1, 1024]
    - [4, 91.974]
  - - [4096, 3512, 1, 1024]
    - [5, 94.43]
  - - [1024, 3560, 1, 4096]
    - [29, 86.66]
  - - [4096, 2499, 1, 1024]
    - [4, 89.666]
  - - [1024, 3248, 1, 4096]
    - [29, 89.236]
  - - [4096, 3423, 1, 1024]
    - [5, 92.577]
  - - [64, 111, 576, 111]
    - [88, 29.2]
  - - [4096, 3297, 1, 1024]
    - [4, 91.809]
  - - [4096, 3154, 1, 1024]
    - [5, 91.074]
  - - [1024, 3303, 1, 4096]
    - [4, 88.358]
  - - [1024, 3222, 1, 4096]
    - [29, 88.444]
  - - [1024, 3978, 1, 1024]
    - [29, 83.178]
  - - [4096, 3529, 1, 1024]
    - [4, 92.147]
  - - [4096, 3386, 1, 1024]
    - [5, 94.052]
  - - [64, 134, 480, 134]
    - [73, 32.538]
  - - [1024, 3451, 1, 4096]
    - [29, 88.975]
  - - [4096, 3562, 1, 1024]
    - [5, 92.958]
  - - [4096, 3276, 1, 1024]
    - [5, 91.4]
  - - [64, 135, 480, 132]
    - [86, 32.59]
  - - [1024, 3894, 1, 33708]
    - [51, 92.802]
  - - [64, 134, 480, 132]
    - [87, 32.349]
  - - [4096, 3540, 1, 1024]
    - [5, 92.345]
  - - [1024, 3416, 1, 4096]
    - [51, 91.174]
  - - [1024, 4005, 1, 33708]
    - [41, 88.257]
  - - [1024, 3942, 1, 4096]
    - [29, 86.411]
  - - [4096, 3403, 1, 1024]
    - [5, 91.983]
  - - [4096, 3381, 1, 1024]
    - [4, 94.079]
  - - [1024, 3492, 1, 4096]
    - [4, 92.627]
  - - [4096, 3101, 1, 1024]
    - [4, 92.191]
  - - [1024, 3430, 1, 4096]
    - [10, 88.818]
  - - [1024, 3977, 1, 4096]
    - [29, 87.087]
  - - [1024, 3640, 1, 4096]
    - [29, 88.71]
  - - [4096, 3557, 1, 1024]
    - [5, 92.763]
  - - [4096, 3414, 1, 1024]
    - [5, 92.36]
  - - [1024, 3391, 1, 4096]
    - [29, 87.713]
  - - [64, 134, 480, 135]
    - [73, 32.567]
  - - [64, 16, 3840, 16]
    - [9, 8.242]
  - - [1024, 3356, 1, 4096]
    - [29, 87.003]
  - - [4096, 3320, 1, 1024]
    - [5, 92.737]
  - - [4096, 2765, 1, 1024]
    - [5, 91.467]
  - - [64, 162, 400, 162]
    - [87, 33.943]
  - - [1024, 3411, 1, 4096]
    - [10, 87.778]
  - - [1024, 3978, 1, 4096]
    - [29, 87.15]
  - - [4096, 3487, 1, 1024]
    - [4, 93.985]
  - - [4096, 3520, 1, 1024]
    - [6, 94.929]
  - - [4096, 3942, 1, 1024]
    - [5, 92.584]
  - - [4096, 3431, 1, 1024]
    - [4, 92.568]
  - - [1024, 3271, 1, 4096]
    - [29, 89.594]
  - - [4096, 4020, 1, 1024]
    - [4, 93.984]
  - - [1024, 3481, 1, 4096]
    - [4, 92.258]
  - - [1024, 3419, 1, 4096]
    - [29, 88.488]
  - - [1024, 4059, 1, 4096]
    - [29, 88.79]
  - - [4096, 3345, 1, 1024]
    - [4, 93.077]
  - - [4096, 3394, 1, 1024]
    - [4, 91.805]
  - - [1024, 3298, 1, 4096]
    - [4, 88.074]
  - - [4096, 3235, 1, 1024]
    - [4, 92.593]
  - - [1024, 3681, 1, 33708]
    - [75, 90.345]
  - - [1024, 3362, 1, 4096]
    - [10, 87.078]
  - - [4096, 3467, 1, 1024]
    - [6, 93.419]
  - - [1024, 3349, 1, 4096]
    - [10, 86.844]
  - - [1024, 3460, 1, 4096]
    - [4, 91.868]
  - - [4096, 3214, 1, 1024]
    - [4, 92.103]
  - - [1024, 3398, 1, 4096]
    - [29, 87.798]
  - - [4096, 3478, 1, 1024]
    - [5, 93.662]
  - - [1024, 4050, 1, 33708]
    - [35, 89.199]
  - - [1024, 3244, 1, 4096]
    - [29, 88.932]
  - - [4096, 3341, 1, 1024]
    - [4, 92.857]
  - - [4096, 3454, 1, 1024]
    - [4, 93.322]
  - - [1024, 3166, 1, 4096]
    - [29, 86.97]
  - - [1024, 3425, 1, 4096]
    - [29, 88.184]
  - - [4096, 3295, 1, 1024]
    - [4, 91.794]
  - - [4096, 3072, 1, 1024]
    - [6, 94.372]
  - - [4096, 3822, 1, 1024]
    - [5, 94.215]
  - - [1024, 3681, 1, 4096]
    - [29, 89.513]
  - - [1024, 4050, 1, 4096]
    - [29, 88.573]
  - - [4096, 3495, 1, 1024]
    - [4, 93.999]
  - - [4096, 3560, 1, 1024]
    - [5, 92.841]
  - - [1024, 3524, 1, 4096]
    - [29, 85.961]
  - - [1024, 3942, 1, 33708]
    - [41, 86.861]
  - - [1024, 3304, 1, 4096]
    - [4, 88.284]
  - - [1024, 3387, 1, 4096]
    - [10, 87.608]
  - - [1024, 3498, 1, 4096]
    - [4, 92.878]
  - - [4096, 3458, 1, 1024]
    - [6, 93.256]
  - - [4096, 2967, 1, 1024]
    - [4, 91.265]
  - - [64, 8, 7280, 8]
    - [84, 2.14]
  - - [4096, 3385, 1, 1024]
    - [4, 93.859]
  - - [4096, 3434, 1, 1024]
    - [4, 92.755]
  - - [1024, 3519, 1, 4096]
    - [4, 93.291]
  - - [1024, 3511, 1, 4096]
    - [4, 93.105]
  - - [1024, 3288, 1, 4096]
    - [29, 90.177]
  - - [1024, 2918, 1, 4096]
    - [4, 88.194]
  - - [4096, 3573, 1, 1024]
    - [5, 93.258]
  - - [1024, 3822, 1, 33708]
    - [51, 91.028]
  - - [64, 102, 624, 102]
    - [86, 27.781]
  - - [4096, 3539, 1, 1024]
    - [5, 92.256]
  - - [4096, 3332, 1, 1024]
    - [4, 92.525]
  - - [4096, 3286, 1, 1024]
    - [5, 91.49]
  - - [1024, 4026, 1, 4096]
    - [29, 88.129]
  - - [1024, 3277, 1, 4096]
    - [29, 89.771]
  - - [1024, 3471, 1, 4096]
    - [4, 92.329]
  - - [4096, 3518, 1, 1024]
    - [4, 94.524]
  - - [1024, 3393, 1, 4096]
    - [10, 87.697]
  - - [4096, 3413, 1, 1024]
    - [5, 92.109]
  - - [4096, 3303, 1, 1024]
    - [4, 92.031]
  - - [1024, 3207, 1, 4096]
    - [29, 87.994]
  - - [1024, 3894, 1, 1024]
    - [4, 88.595]
  - - [1024, 3977, 1, 1024]
    - [7, 83.193]
  - - [64, 135, 480, 133]
    - [86, 32.074]
  - - [4096, 3535, 1, 1024]
    - [4, 92.304]
  - - [4096, 3376, 1, 1024]
    - [4, 93.637]
  - - [1024, 3355, 1, 4096]
    - [29, 86.791]
  - - [64, 27, 2336, 27]
    - [4, 10.148]
  - - [1024, 3466, 1, 4096]
    - [4, 91.976]
  - - [4096, 3266, 1, 1024]
    - [5, 91.094]
  - - [1024, 3404, 1, 4096]
    - [29, 87.966]
  - - [1024, 3999, 1, 1024]
    - [7, 83.469]
  - - [64, 148, 432, 143]
    - [73, 34.07]
  - - [4096, 3498, 1, 1024]
    - [5, 94.174]
  - - [1024, 4032, 1, 1024]
    - [7, 84.195]
  - - [1024, 3410, 1, 4096]
    - [10, 88.033]
  - - [4096, 3393, 1, 1024]
    - [4, 91.647]
  - - [1024, 3140, 1, 4096]
    - [29, 86.431]
  - - [1024, 3910, 1, 33708]
    - [41, 93.146]
  - - [1024, 3334, 1, 4096]
    - [29, 86.323]
  - - [4096, 3140, 1, 1024]
    - [56, 90.518]
  - - [1024, 4005, 1, 4096]
    - [29, 87.589]
  - - [1024, 3579, 1, 4096]
    - [29, 86.988]
  - - [4096, 3372, 1, 1024]
    - [5, 93.595]
  - - [1024, 3245, 1, 4096]
    - [29, 89.062]
  - - [64, 38, 1680, 38]
    - [5, 15.344]
  - - [4096, 3956, 1, 1024]
    - [5, 92.66]
  - - [4096, 3213, 1, 1024]
    - [4, 92.131]
  - - [1024, 3361, 1, 4096]
    - [10, 87.029]
  - - [1024, 3536, 1, 4096]
    - [29, 86.276]
  - - [4096, 3477, 1, 1024]
    - [4, 93.729]
  - - [4096, 3526, 1, 1024]
    - [4, 92.171]
  - - [1024, 4005, 1, 1024]
    - [29, 83.631]
  - - [1024, 3530, 1, 4096]
    - [29, 86.018]
  - - [1024, 3944, 1, 4096]
    - [29, 86.505]
  - - [4096, 3453, 1, 1024]
    - [4, 93.201]
  - - [4096, 3184, 1, 1024]
    - [5, 91.969]
  - - [4096, 3579, 1, 1024]
    - [5, 93.183]
  - - [4096, 3351, 1, 1024]
    - [4, 93.093]
  - - [4096, 3416, 1, 1024]
    - [4, 92.229]
  - - [64, 100, 624, 100]
    - [73, 27.646]
  - - [1024, 3822, 1, 4096]
    - [29, 88.816]
  - - [1024, 3796, 1, 4096]
    - [29, 88.564]
  - - [4096, 3257, 1, 1024]
    - [4, 93.053]
  - - [4096, 3306, 1, 1024]
    - [5, 92.169]
  - - [1024, 3505, 1, 4096]
    - [4, 92.998]
  - - [1024, 3315, 1, 4096]
    - [4, 88.478]
  - - [1024, 3486, 1, 4096]
    - [4, 92.377]
  - - [4096, 3457, 1, 1024]
    - [4, 93.136]
  - - [4096, 3870, 1, 1024]
    - [5, 92.89]
  - - [1024, 3447, 1, 4096]
    - [29, 89.107]
  - - [1024, 3558, 1, 4096]
    - [29, 86.869]
  - - [4096, 3433, 1, 1024]
    - [5, 92.794]
  - - [4096, 3180, 1, 1024]
    - [5, 91.601]
  - - [1024, 3213, 1, 4096]
    - [29, 88.159]
  - - [1024, 3900, 1, 4096]
    - [4, 92.483]
  - - [4096, 3444, 1, 1024]
    - [4, 93.131]
  - - [1024, 3504, 1, 4096]
    - [4, 93.299]
  - - [4096, 4059, 1, 1024]
    - [5, 92.919]
  - - [1024, 3442, 1, 4096]
    - [10, 89.243]
  - - [4096, 3517, 1, 1024]
    - [4, 94.551]
  - - [1024, 3566, 1, 4096]
    - [29, 86.94]
  - - [4096, 3248, 1, 1024]
    - [5, 92.894]
  - - [1024, 3547, 1, 4096]
    - [29, 86.366]
  - - [64, 59, 1088, 59]
    - [5, 21.335]
  - - [1024, 3340, 1, 4096]
    - [29, 86.564]
  - - [4096, 3480, 1, 1024]
    - [4, 93.783]
  - - [4096, 3424, 1, 1024]
    - [5, 92.591]
  - - [1024, 3906, 1, 1024]
    - [36, 84.63]
  - - [4096, 3265, 1, 1024]
    - [4, 91.026]
  - - [1024, 3384, 1, 4096]
    - [29, 87.74]
  - - [1024, 3494, 1, 4096]
    - [4, 92.732]
  - - [1024, 3236, 1, 4096]
    - [29, 88.88]
  - - [4096, 3497, 1, 1024]
    - [4, 94.16]
  - - [4096, 3354, 1, 1024]
    - [4, 93.3]
  - - [4096, 3055, 1, 1024]
    - [5, 93.683]
  - - [64, 11, 5456, 11]
    - [84, 3.778]
  - - [4096, 3244, 1, 1024]
    - [5, 93.019]
  - - [4096, 3139, 1, 1024]
    - [4, 90.738]
  - - [4096, 3508, 1, 1024]
    - [4, 94.322]
  - - [4096, 4050, 1, 1024]
    - [5, 92.668]
  - - [1024, 3472, 1, 4096]
    - [4, 92.499]
  - - [1024, 3861, 1, 1024]
    - [4, 87.549]
  - - [1024, 3910, 1, 1024]
    - [29, 84.951]
  - - [4096, 3371, 1, 1024]
    - [4, 93.608]
  - - [64, 65, 992, 65]
    - [7, 21.06]
  - - [1024, 3751, 1, 4096]
    - [29, 87.529]
  - - [4096, 3325, 1, 1024]
    - [5, 92.712]
  - - [1024, 3321, 1, 4096]
    - [4, 88.526]
  - - [1024, 3944, 1, 1024]
    - [7, 82.76]
  - - [4096, 3525, 1, 1024]
    - [4, 92.158]
  - - [4096, 3382, 1, 1024]
    - [4, 93.803]
  - - [64, 122, 528, 122]
    - [5, 29.864]
  - - [1024, 3453, 1, 4096]
    - [36, 88.893]
  - - [4096, 3564, 1, 1024]
    - [5, 92.997]
  - - [4096, 3288, 1, 1024]
    - [5, 91.653]
  - - [1024, 3925, 1, 4096]
    - [4, 89.923]
  - - [1024, 3057, 1, 4096]
    - [4, 92.159]
  - - [4096, 3488, 1, 1024]
    - [5, 93.945]
  - - [4096, 3046, 1, 1024]
    - [4, 93.589]
  - - [1024, 3189, 1, 4096]
    - [29, 87.78]
  - - [4096, 3399, 1, 1024]
    - [5, 92.059]
  - - [1024, 3383, 1, 4096]
    - [10, 87.256]
  - - [1024, 3415, 1, 4096]
    - [29, 88.479]
  - - [1024, 3388, 1, 4096]
    - [29, 87.876]
  - - [1024, 3376, 1, 4096]
    - [10, 87.517]
  - - [1024, 3473, 1, 4096]
    - [4, 92.292]
  - - [4096, 3162, 1, 1024]
    - [5, 91.389]
  - - [1024, 3448, 1, 4096]
    - [29, 89.157]
  - - [4096, 3362, 1, 1024]
    - [5, 93.605]
  - - [64, 228, 272, 228]
    - [90, 41.53]
  - - [1024, 3262, 1, 4096]
    - [29, 89.399]
  - - [1024, 3184, 1, 4096]
    - [29, 87.605]
  - - [1024, 3378, 1, 4096]
    - [29, 87.581]
  - - [4096, 3548, 1, 1024]
    - [4, 92.477]
  - - [4096, 2977, 1, 1024]
    - [5, 91.677]
  - - [64, 21, 2976, 21]
    - [5, 6.933]
  - - [64, 112, 576, 111]
    - [73, 29.379]
  - - [4096, 3443, 1, 1024]
    - [5, 92.998]
  - - [1024, 3289, 1, 4096]
    - [29, 90.205]
  - - [1024, 3483, 1, 4096]
    - [4, 92.57]
  - - [4096, 3190, 1, 1024]
    - [5, 92.114]
  - - [1024, 3421, 1, 4096]
    - [10, 88.455]
  - - [1024, 3514, 1, 4096]
    - [4, 93.08]
  - - [1024, 3532, 1, 4096]
    - [29, 86.2]
  - - [1024, 3565, 1, 4096]
    - [29, 86.961]
  - - [4096, 3422, 1, 1024]
    - [5, 92.418]
  - - [4096, 3263, 1, 1024]
    - [5, 93.38]
  - - [4096, 3296, 1, 1024]
    - [4, 91.944]
  - - [4096, 3640, 1, 1024]
    - [5, 92.878]
  - - [4096, 3463, 1, 1024]
    - [6, 93.498]
  - - [4096, 3528, 1, 1024]
    - [4, 92.21]
  - - [1024, 3351, 1, 4096]
    - [29, 87.095]
  - - [1024, 3462, 1, 4096]
    - [4, 91.883]
  - - [4096, 3226, 1, 1024]
    - [5, 92.489]
  - - [4096, 3439, 1, 1024]
    - [4, 92.89]
  - - [4096, 3121, 1, 1024]
    - [4, 92.903]
  - - [1024, 4059, 1, 33708]
    - [35, 89.43]
  - - [1024, 3311, 1, 4096]
    - [29, 85.91]
  - - [1024, 3230, 1, 4096]
    - [29, 88.741]
  - - [4096, 3353, 1, 1024]
    - [5, 93.3]
  - - [4096, 3402, 1, 1024]
    - [5, 91.969]
  - - [1024, 3427, 1, 4096]
    - [29, 88.696]
  - - [1024, 3346, 1, 4096]
    - [29, 86.863]
  - - [1024, 3126, 1, 4096]
    - [29, 86.197]
  - - [1024, 3796, 1, 1024]
    - [4, 86.951]
  - - [1024, 3990, 1, 4096]
    - [29, 87.301]
  - - [1024, 3257, 1, 4096]
    - [29, 89.418]
  - - [4096, 3996, 1, 1024]
    - [4, 93.562]
  - - [64, 143, 432, 143]
    - [86, 30.804]
  - - [1024, 3306, 1, 4096]
    - [4, 88.251]
  - - [1024, 3389, 1, 4096]
    - [29, 87.861]
  - - [1024, 3500, 1, 4096]
    - [4, 92.957]
  - - [1024, 3999, 1, 33708]
    - [35, 95.279]
  - - [4096, 3486, 1, 1024]
    - [4, 93.851]
  - - [1024, 3438, 1, 4096]
    - [10, 88.792]
  - - [4096, 3616, 1, 1024]
    - [5, 92.253]
  - - [1024, 3955, 1, 1024]
    - [7, 83.286]
  - - [4096, 3430, 1, 1024]
    - [5, 92.726]
  - - [4096, 3271, 1, 1024]
    - [5, 91.341]
  - - [1024, 3364, 1, 4096]
    - [29, 87.296]
  - - [64, 54, 1184, 54]
    - [4, 20.489]
  - - [1024, 3497, 1, 4096]
    - [4, 92.617]
  - - [4096, 3503, 1, 1024]
    - [5, 94.362]
  - - [4096, 3344, 1, 1024]
    - [5, 92.954]
  - - [1024, 3457, 1, 4096]
    - [4, 91.557]
  - - [4096, 3466, 1, 1024]
    - [6, 93.499]
  - - [1024, 3976, 1, 33708]
    - [35, 87.655]
  - - [1024, 3395, 1, 4096]
    - [10, 87.829]
  - - [4096, 3361, 1, 1024]
    - [5, 93.344]
  - - [1024, 3751, 1, 33708]
    - [35, 89.45]
  - - [1024, 3822, 1, 1024]
    - [4, 86.706]
  - - [4096, 3315, 1, 1024]
    - [5, 92.597]
  - - [1024, 3163, 1, 4096]
    - [29, 87.001]
  - - [4096, 3547, 1, 1024]
    - [5, 92.515]
  - - [4096, 3340, 1, 1024]
    - [4, 92.897]
  - - [1024, 3296, 1, 4096]
    - [29, 90.436]
  - - [1024, 3468, 1, 4096]
    - [4, 92.327]
  - - [4096, 3294, 1, 1024]
    - [5, 91.966]
  - - [1024, 3406, 1, 4096]
    - [29, 88.163]
  - - [1024, 3860, 1, 33708]
    - [51, 91.996]
  - - [1024, 3584, 1, 4096]
    - [29, 87.492]
  - - [4096, 3189, 1, 1024]
    - [5, 92.0]
  - - [4096, 3494, 1, 1024]
    - [4, 94.039]
  - - [64, 135, 480, 135]
    - [86, 32.514]
  - - [1024, 3093, 1, 4096]
    - [29, 85.237]
  - - [4096, 3421, 1, 1024]
    - [5, 92.509]
  - - [1024, 3479, 1, 4096]
    - [4, 92.477]
  - - [1024, 3433, 1, 4096]
    - [29, 88.644]
  - - [4096, 3311, 1, 1024]
    - [5, 92.431]
  - - [1024, 3381, 1, 4096]
    - [29, 87.602]
  - - [1024, 3996, 1, 4096]
    - [29, 87.635]
  - - [4096, 3384, 1, 1024]
    - [4, 94.149]
  - - [1024, 3247, 1, 4096]
    - [29, 89.04]
  - - [1024, 3169, 1, 4096]
    - [29, 87.434]
  - - [1024, 3088, 1, 4096]
    - [29, 85.273]
  - - [1024, 3363, 1, 4096]
    - [10, 87.202]
  - - [1024, 3538, 1, 4096]
    - [29, 86.414]
  - - [1024, 3996, 1, 1024]
    - [4, 83.554]
  - - [4096, 3169, 1, 1024]
    - [4, 91.591]
  - - [4096, 3538, 1, 1024]
    - [5, 92.536]
  - - [4096, 3401, 1, 1024]
    - [5, 92.034]
  - - [4096, 3581, 1, 1024]
    - [5, 93.505]
  - - [1024, 3180, 1, 4096]
    - [51, 88.963]
  - - [1024, 3870, 1, 1024]
    - [4, 81.42]
  - - [4096, 3555, 1, 1024]
    - [5, 92.878]
  - - [4096, 3412, 1, 1024]
    - [5, 92.095]
  - - [4096, 3302, 1, 1024]
    - [5, 92.166]
  - - [1024, 3561, 1, 4096]
    - [29, 86.841]
  - - [1024, 3302, 1, 4096]
    - [4, 88.181]
  - - [1024, 3976, 1, 4096]
    - [4, 90.904]
  - - [4096, 3485, 1, 1024]
    - [5, 93.784]
  - - [4096, 3534, 1, 1024]
    - [5, 92.482]
  - - [1024, 3110, 1, 4096]
    - [29, 85.581]
  - - [1024, 3401, 1, 4096]
    - [29, 88.255]
  - - [4096, 3216, 1, 1024]
    - [4, 92.23]
  - - [1024, 4020, 1, 33708]
    - [41, 88.53]
  - - [1024, 3215, 1, 4096]
    - [29, 88.162]
  - - [4096, 3566, 1, 1024]
    - [5, 93.113]
  - - [1024, 3137, 1, 4096]
    - [29, 86.311]
  - - [4096, 3359, 1, 1024]
    - [4, 93.426]
  - - [4096, 3392, 1, 1024]
    - [4, 94.108]
  - - [1024, 3506, 1, 4096]
    - [4, 93.025]
  - - [4096, 3233, 1, 1024]
    - [5, 92.634]
  - - [1024, 3444, 1, 4096]
    - [10, 89.149]
  - - [1024, 3975, 1, 4096]
    - [29, 87.033]
  - - [1024, 3870, 1, 33708]
    - [51, 92.234]
  - - [4096, 3465, 1, 1024]
    - [4, 93.499]
  - - [1024, 3523, 1, 4096]
    - [29, 86.114]
  - - [64, 10, 5952, 10]
    - [84, 3.173]
  - - [4096, 3990, 1, 1024]
    - [5, 93.295]
  - - [1024, 3549, 1, 4096]
    - [29, 86.559]
  - - [1024, 3342, 1, 4096]
    - [29, 86.911]
  - - [4096, 3476, 1, 1024]
    - [4, 93.662]
  - - [64, 232, 272, 228]
    - [71, 41.874]
  - - [1024, 3418, 1, 4096]
    - [29, 88.585]
  - - [1024, 3859, 1, 1024]
    - [4, 88.266]
  - - [4096, 3339, 1, 1024]
    - [4, 92.897]
  - - [4096, 3452, 1, 1024]
    - [4, 93.028]
  - - [4096, 3293, 1, 1024]
    - [4, 91.874]
  - - [1024, 3369, 1, 4096]
    - [29, 87.539]
  - - [64, 193, 320, 193]
    - [90, 36.074]
  - - [1024, 3544, 1, 4096]
    - [29, 86.348]
  - - [4096, 3493, 1, 1024]
    - [5, 94.133]
  - - [4096, 3350, 1, 1024]
    - [4, 93.272]
  - - [64, 71, 896, 71]
    - [73, 22.895]
  - - [4096, 3256, 1, 1024]
    - [5, 93.42]
  - - [1024, 3870, 1, 4096]
    - [29, 89.962]
  - - [4096, 4012, 1, 1024]
    - [4, 93.728]
  - - [1024, 3280, 1, 4096]
    - [29, 90.023]
  - - [4096, 3456, 1, 1024]
    - [6, 93.309]
  - - [1024, 3555, 1, 4096]
    - [29, 86.639]
  - - [4096, 3014, 1, 1024]
    - [5, 92.666]
  - - [1024, 3474, 1, 4096]
    - [4, 92.578]
  - - [4096, 3367, 1, 1024]
    - [5, 93.621]
  - - [4096, 3432, 1, 1024]
    - [4, 92.887]
  - - [64, 84, 752, 84]
    - [87, 25.635]
  - - [4096, 3273, 1, 1024]
    - [5, 91.437]
  - - [4096, 3130, 1, 1024]
    - [4, 93.097]
  - - [1024, 2984, 1, 4096]
    - [4, 90.376]
  - - [1024, 3995, 1, 1024]
    - [7, 83.607]
  - - [1024, 3517, 1, 4096]
    - [4, 93.277]
  - - [1024, 3455, 1, 4096]
    - [10, 89.383]
  - - [1024, 3939, 1, 4096]
    - [29, 86.465]
  - - [64, 49, 1296, 49]
    - [5, 19.259]
  - - [64, 14, 4368, 14]
    - [84, 5.612]
  - - [64, 25, 2512, 25]
    - [4, 8.985]
  - - [4096, 3147, 1, 1024]
    - [5, 90.872]
  - - [4096, 3516, 1, 1024]
    - [4, 94.564]
  - - [1024, 3876, 1, 4096]
    - [4, 88.599]
  - - [1024, 3191, 1, 4096]
    - [29, 87.733]
  - - [4096, 3411, 1, 1024]
    - [5, 92.278]
  - - [1024, 3337, 1, 4096]
    - [10, 86.372]
  - - [1024, 3512, 1, 4096]
    - [4, 93.276]
  - - [4096, 3301, 1, 1024]
    - [4, 92.193]
  - - [1024, 3450, 1, 4096]
    - [29, 89.404]
  - - [4096, 3533, 1, 1024]
    - [5, 92.418]
  - - [4096, 3390, 1, 1024]
    - [5, 94.094]
  - - [4096, 3231, 1, 1024]
    - [4, 92.339]
  - - [1024, 2499, 1, 4096]
    - [7, 83.496]
  - - [1024, 3186, 1, 4096]
    - [29, 87.621]
  - - [1024, 3380, 1, 4096]
    - [29, 87.469]
  - - [4096, 3496, 1, 1024]
    - [4, 94.187]
  - - [1024, 3956, 1, 33708]
    - [41, 87.166]
  - - [1024, 3976, 1, 1024]
    - [4, 83.32]
  - - [4096, 2736, 1, 1024]
    - [5, 91.001]
  - - [1024, 3291, 1, 4096]
    - [29, 90.246]
  - - [1024, 3944, 1, 33708]
    - [35, 86.951]
  - - [1024, 3485, 1, 4096]
    - [4, 92.78]
  - - [4096, 3138, 1, 1024]
    - [5, 90.668]
  - - [1024, 3423, 1, 4096]
    - [10, 88.518]
  - - [1024, 3491, 1, 4096]
    - [4, 92.77]
  - - [1024, 3860, 1, 4096]
    - [29, 89.602]
  - - [4096, 3211, 1, 1024]
    - [4, 92.073]
  - - [1024, 3221, 1, 4096]
    - [29, 88.416]
  - - [1024, 2917, 1, 4096]
    - [4, 88.546]
  - - [4096, 3475, 1, 1024]
    - [5, 93.621]
  - - [4096, 3524, 1, 1024]
    - [4, 92.182]
  - - [4096, 2985, 1, 1024]
    - [4, 91.908]
  - - [1024, 3480, 1, 4096]
    - [4, 92.66]
  - - [4096, 3222, 1, 1024]
    - [5, 92.319]
  - - [4096, 3451, 1, 1024]
    - [4, 93.108]
  - - [1024, 3969, 1, 33708]
    - [35, 87.496]
  - - [1024, 3640, 1, 1024]
    - [7, 83.866]
  - - [1024, 3297, 1, 4096]
    - [10, 85.193]
  - - [4096, 3944, 1, 1024]
    - [5, 92.551]
  - - [1024, 3216, 1, 4096]
    - [29, 88.318]
  - - [4096, 3349, 1, 1024]
    - [5, 93.12]
  - - [4096, 3398, 1, 1024]
    - [5, 91.888]
  - - [1024, 3154, 1, 4096]
    - [29, 86.653]
  - - [1024, 3978, 1, 33708]
    - [51, 87.627]
  - - [1024, 3348, 1, 4096]
    - [29, 86.528]
  - - [4096, 3304, 1, 1024]
    - [4, 92.086]
  - - [4096, 4030, 1, 1024]
    - [4, 94.148]
  - - [1024, 4026, 1, 1024]
    - [4, 83.995]
  - - [4096, 3471, 1, 1024]
    - [4, 93.594]
  - - [1024, 3259, 1, 4096]
    - [29, 89.369]
  - - [64, 132, 480, 132]
    - [86, 31.993]
  - - [1024, 3308, 1, 4096]
    - [29, 85.795]
  - - [4096, 3391, 1, 1024]
    - [4, 94.205]
  - - [1024, 3312, 1, 4096]
    - [29, 85.886]
  - - [1024, 3502, 1, 4096]
    - [4, 93.127]
  - - [1024, 3968, 1, 33708]
    - [41, 87.492]
  - - [1024, 3424, 1, 4096]
    - [10, 88.79]
  - - [64, 13, 4672, 13]
    - [84, 4.972]
  - - [4096, 4032, 1, 1024]
    - [4, 94.253]
  - - [1024, 3900, 1, 1024]
    - [4, 88.604]
  - - [4096, 3442, 1, 1024]
    - [4, 92.905]
  - - [1024, 3366, 1, 4096]
    - [10, 87.139]
  - - [4096, 3999, 1, 1024]
    - [5, 93.621]
  - - [1024, 3477, 1, 4096]
    - [4, 92.619]
  - - [1024, 2505, 1, 4096]
    - [7, 83.961]
  - - [4096, 3515, 1, 1024]
    - [5, 94.578]
  - - [1024, 3564, 1, 4096]
    - [29, 86.948]
  - - [4096, 3057, 1, 1024]
    - [4, 93.774]
  - - [1024, 3339, 1, 4096]
    - [10, 86.319]
  - - [4096, 3262, 1, 1024]
    - [4, 93.281]
  - - [1024, 4030, 1, 4096]
    - [29, 88.217]
  - - [1024, 3265, 1, 4096]
    - [29, 89.546]
  - - [1024, 3459, 1, 4096]
    - [4, 91.778]
  - - [4096, 3462, 1, 1024]
    - [6, 93.285]
  - - [64, 85, 752, 85]
    - [87, 24.914]
  - - [1024, 3513, 1, 4096]
    - [4, 93.119]
  - - [1024, 3397, 1, 4096]
    - [10, 88.058]
  - - [4096, 3572, 1, 1024]
    - [5, 93.154]
  - - [4096, 3389, 1, 1024]
    - [4, 94.191]
  - - [4096, 3438, 1, 1024]
    - [5, 92.916]
  - - [64, 102, 624, 100]
    - [86, 28.113]
  - - [1024, 3640, 1, 33708]
    - [89, 96.232]
  - - [1024, 3995, 1, 33708]
    - [51, 88.036]
  - - [1024, 3165, 1, 4096]
    - [29, 87.094]
  - - [4096, 3543, 1, 1024]
    - [4, 92.411]
  - - [4096, 3352, 1, 1024]
    - [4, 93.121]
  - - [1024, 3359, 1, 4096]
    - [29, 87.017]
  - - [1024, 3470, 1, 4096]
    - [4, 92.29]
  - - [64, 15, 4096, 15]
    - [84, 6.344]
  - - [1024, 3392, 1, 4096]
    - [29, 87.722]
  - - [64, 78, 816, 77]
    - [72, 23.999]
  - - [4096, 3137, 1, 1024]
    - [4, 90.652]
  - - [4096, 3506, 1, 1024]
    - [5, 94.282]
  - - [1024, 3095, 1, 4096]
    - [29, 85.02]
  - - [1024, 3859, 1, 4096]
    - [10, 89.796]
  - - [4096, 3369, 1, 1024]
    - [5, 93.539]
  - - [64, 45, 1424, 45]
    - [4, 18.002]
  - - [1024, 3435, 1, 4096]
    - [10, 88.657]
  - - [1024, 3354, 1, 4096]
    - [29, 86.683]
  - - [1024, 3055, 1, 4096]
    - [4, 92.275]
  - - [4096, 3523, 1, 1024]
    - [4, 92.067]
  - - [4096, 3380, 1, 1024]
    - [4, 93.982]
  - - [1024, 3233, 1, 4096]
    - [29, 88.733]
  - - [4096, 3221, 1, 1024]
    - [5, 92.318]
  - - [4096, 3270, 1, 1024]
    - [5, 91.3]
  - - [4096, 3593, 1, 1024]
    - [5, 91.654]
  - - [1024, 3358, 1, 4096]
    - [29, 87.052]
  - - [1024, 3540, 1, 4096]
    - [29, 86.273]
  - - [4096, 3502, 1, 1024]
    - [5, 94.255]
  - - [4096, 2505, 1, 1024]
    - [5, 89.882]
  - - [4096, 3397, 1, 1024]
    - [4, 91.795]
  - - [1024, 3300, 1, 4096]
    - [4, 88.029]
  - - [4096, 3095, 1, 1024]
    - [4, 91.926]
  - - [1024, 3182, 1, 4096]
    - [29, 87.448]
  - - [1024, 3299, 1, 4096]
    - [4, 88.051]
  - - [1024, 3276, 1, 4096]
    - [29, 89.835]
  - - [1024, 3360, 1, 4096]
    - [29, 87.041]
  - - [4096, 3360, 1, 1024]
    - [5, 93.207]
  - - [4096, 2918, 1, 1024]
    - [5, 92.467]
  - - [1024, 3939, 1, 33708]
    - [41, 86.78]
  - - [4096, 3314, 1, 1024]
    - [5, 92.487]
  - - [1024, 3319, 1, 4096]
    - [29, 86.262]
  - - [64, 35, 1808, 35]
    - [4, 14.164]
  - - [1024, 3942, 1, 1024]
    - [29, 83.049]
  - - [1024, 3465, 1, 4096]
    - [4, 92.247]
  - - [4096, 3546, 1, 1024]
    - [5, 92.54]
  - - [1024, 3403, 1, 4096]
    - [29, 88.045]
  - - [1024, 3948, 1, 1024]
    - [7, 82.954]
  - - [4096, 3441, 1, 1024]
    - [5, 93.116]
  - - [1024, 3139, 1, 4096]
    - [78, 88.259]
  - - [1024, 3563, 1, 4096]
    - [29, 86.744]
  - - [1024, 3508, 1, 4096]
    - [4, 93.025]
  - - [1024, 3975, 1, 33708]
    - [51, 87.53]
  - - [1024, 3446, 1, 4096]
    - [10, 88.921]
  - - [1024, 3529, 1, 4096]
    - [29, 86.06]
  - - [64, 112, 576, 112]
    - [5, 31.575]
  - - [4096, 3461, 1, 1024]
    - [6, 93.444]
  - - [1024, 3574, 1, 4096]
    - [29, 87.225]
  - - [1024, 3101, 1, 4096]
    - [29, 85.271]
  - - [1024, 3927, 1, 1024]
    - [36, 84.968]
  - - [4096, 3224, 1, 1024]
    - [5, 92.334]
  - - [4096, 3437, 1, 1024]
    - [5, 92.743]
  - - [4096, 3900, 1, 1024]
    - [5, 93.563]
  - - [1024, 3495, 1, 4096]
    - [4, 92.876]
  - - [1024, 3977, 1, 33708]
    - [35, 87.62]
  - - [1024, 3328, 1, 4096]
    - [10, 86.438]
  - - [4096, 3168, 1, 1024]
    - [4, 91.381]
  - - [1024, 4026, 1, 33708]
    - [35, 88.697]
  - - [1024, 3292, 1, 4096]
    - [29, 90.012]
  - - [1024, 3294, 1, 4096]
    - [29, 90.302]
  - - [4096, 3335, 1, 1024]
    - [4, 92.826]
  - - [4096, 3400, 1, 1024]
    - [4, 92.113]
  - - [1024, 3287, 1, 4096]
    - [29, 90.163]
  - - [1024, 3910, 1, 4096]
    - [4, 89.323]
  - - [1024, 3780, 1, 1024]
    - [4, 86.796]
  - - [4096, 3098, 1, 1024]
    - [4, 92.219]
  - - [1024, 3584, 1, 33708]
    - [91, 94.85]
  - - [64, 29, 2176, 29]
    - [4, 11.327]
  - - [1024, 3371, 1, 4096]
    - [29, 87.364]
  - - [1024, 3546, 1, 4096]
    - [29, 86.475]
  - - [1024, 4012, 1, 1024]
    - [29, 83.814]
  - - [4096, 3505, 1, 1024]
    - [4, 94.403]
  - - [4096, 3554, 1, 1024]
    - [5, 92.685]
  - - [4096, 3063, 1, 1024]
    - [4, 93.928]
  - - [1024, 3900, 1, 33708]
    - [35, 92.928]
  - - [1024, 3345, 1, 4096]
    - [29, 86.727]
  - - [1024, 3357, 1, 4096]
    - [10, 86.857]
  - - [1024, 3282, 1, 4096]
    - [29, 89.999]
  - - [4096, 3484, 1, 1024]
    - [5, 93.57]
  - - [1024, 3557, 1, 4096]
    - [29, 86.754]
  - - [1024, 3476, 1, 4096]
    - [4, 92.151]
  - - [1024, 3751, 1, 1024]
    - [4, 85.921]
  - - [4096, 3379, 1, 1024]
    - [5, 93.982]
  - - [4096, 3428, 1, 1024]
    - [4, 92.527]
  - - [4096, 3126, 1, 1024]
    - [4, 92.876]
  - - [64, 41, 1552, 41]
    - [4, 16.287]
  - - [1024, 3325, 1, 4096]
    - [4, 88.533]
  - - [4096, 3501, 1, 1024]
    - [4, 94.376]
  - - [4096, 3358, 1, 1024]
    - [4, 93.274]
  - - [1024, 3441, 1, 4096]
    - [10, 89.061]
  - - [1024, 3552, 1, 4096]
    - [29, 86.722]
  - - [4096, 3232, 1, 1024]
    - [5, 92.633]
  - - [64, 18, 3440, 18]
    - [4, 4.342]
  - - [1024, 3412, 1, 4096]
    - [29, 88.259]
  - - [1024, 3372, 1, 4096]
    - [29, 87.203]
  - - [1024, 3585, 1, 4096]
    - [29, 87.314]
  - - [4096, 3143, 1, 1024]
    - [56, 90.798]
  - - [4096, 3464, 1, 1024]
    - [4, 93.378]
  - - [1024, 3145, 1, 4096]
    - [29, 86.632]
  - - [4096, 3375, 1, 1024]
    - [4, 93.705]
  - - [4096, 2917, 1, 1024]
    - [5, 92.435]
  - - [4096, 3978, 1, 1024]
    - [4, 93.095]
  - - [1024, 2765, 1, 4096]
    - [4, 88.262]
  - - [64, 148, 432, 148]
    - [73, 34.287]
  - - [1024, 3452, 1, 4096]
    - [10, 89.265]
  - - [4096, 3584, 1, 1024]
    - [5, 93.635]
  - - [4096, 3545, 1, 1024]
    - [5, 92.642]
  - - [1024, 3352, 1, 4096]
    - [4, 89.592]
  - - [64, 159, 400, 160]
    - [7, 39.716]
  - - [4096, 3292, 1, 1024]
    - [5, 91.846]
  - - [1024, 3525, 1, 4096]
    - [29, 86.118]
  - - [1024, 3266, 1, 4096]
    - [29, 89.6]
  - - [1024, 3382, 1, 4096]
    - [29, 87.714]
  - - [4096, 3492, 1, 1024]
    - [5, 94.066]
  - - [4096, 3419, 1, 1024]
    - [4, 92.349]
  - - [1024, 3796, 1, 33708]
    - [51, 90.439]
  - - [1024, 3293, 1, 4096]
    - [29, 90.105]
  - - [4096, 3796, 1, 1024]
    - [5, 93.647]
  - - [1024, 3487, 1, 4096]
    - [4, 92.677]
  - - [4096, 3166, 1, 1024]
    - [56, 91.449]
  - - [64, 102, 624, 101]
    - [86, 27.965]
  - - [1024, 3409, 1, 4096]
    - [29, 88.097]
  - - [1024, 3520, 1, 4096]
    - [4, 93.514]
  - - [1024, 3573, 1, 4096]
    - [29, 87.111]
  - - [4096, 3366, 1, 1024]
    - [5, 91.3]
  - - [4096, 3720, 1, 1024]
    - [5, 92.626]
  - - [4096, 3207, 1, 1024]
    - [6, 92.042]
  - - [4096, 3272, 1, 1024]
    - [5, 91.221]
  - - [1024, 3390, 1, 4096]
    - [29, 87.589]
  - - [4096, 3183, 1, 1024]
    - [5, 91.898]
  - - [4096, 3536, 1, 1024]
    - [5, 92.292]
  - - [4096, 3563, 1, 1024]
    - [5, 93.061]
  - - [1024, 3482, 1, 4096]
    - [4, 92.401]
  - - [4096, 3447, 1, 1024]
    - [4, 93.119]
  - - [4096, 3955, 1, 1024]
    - [5, 92.798]
  - - [4096, 4005, 1, 1024]
    - [4, 93.599]
  - - [1024, 3493, 1, 4096]
    - [4, 92.654]
  - - [4096, 3410, 1, 1024]
    - [4, 92.08]
  - - [1024, 3422, 1, 4096]
    - [29, 88.418]
  - - [1024, 3350, 1, 4096]
    - [29, 86.764]
  - - [4096, 3300, 1, 1024]
    - [4, 92.029]
  - - [4096, 3910, 1, 1024]
    - [5, 91.822]
  - - [1024, 3489, 1, 4096]
    - [4, 92.6]
  - - [4096, 3483, 1, 1024]
    - [4, 93.89]
  - - [4096, 3532, 1, 1024]
    - [4, 92.277]
  - - [64, 101, 624, 101]
    - [86, 27.525]
  - - [4096, 3230, 1, 1024]
    - [5, 92.576]
  - - [4096, 3427, 1, 1024]
    - [4, 92.552]
  - - [1024, 3377, 1, 4096]
    - [29, 87.581]
  - - [1024, 3488, 1, 4096]
    - [4, 92.755]
  - - [1024, 3616, 1, 4096]
    - [29, 88.034]
  - - [1024, 3426, 1, 4096]
    - [29, 88.605]
  - - [4096, 3357, 1, 1024]
    - [4, 93.302]
  - - [4096, 3406, 1, 1024]
    - [4, 92.012]
  - - [1024, 3046, 1, 4096]
    - [4, 92.151]
  - - [1024, 3272, 1, 4096]
    - [29, 89.777]
  - - [1024, 3256, 1, 4096]
    - [29, 89.312]
  - - [4096, 3247, 1, 1024]
    - [5, 93.105]
  - - [4096, 3088, 1, 1024]
    - [5, 91.805]
  - - [1024, 3531, 1, 4096]
    - [29, 86.054]
  - - [64, 160, 400, 160]
    - [7, 40.907]
  - - [4096, 3511, 1, 1024]
    - [5, 94.309]
  - - [1024, 3720, 1, 33708]
    - [75, 91.334]
  - - [1024, 3267, 1, 4096]
    - [29, 89.575]
  - - [1024, 3270, 1, 4096]
    - [29, 89.45]
  - - [1024, 3461, 1, 4096]
    - [4, 91.921]
  - - [4096, 3474, 1, 1024]
    - [4, 93.621]
  - - [4096, 2984, 1, 1024]
    - [4, 91.803]
  - - [1024, 3399, 1, 4096]
    - [10, 88.124]
  - - [4096, 3574, 1, 1024]
    - [5, 93.232]
  - - [1024, 3876, 1, 1024]
    - [4, 88.27]
  - - [4096, 3337, 1, 1024]
    - [5, 92.732]
  - - [4096, 3450, 1, 1024]
    - [5, 93.2]
  - - [1024, 3720, 1, 1024]
    - [4, 85.293]
  - - [1024, 4059, 1, 1024]
    - [4, 84.609]
  - - [4096, 3291, 1, 1024]
    - [4, 91.751]
  - - [64, 93, 688, 93]
    - [87, 26.004]
  - - [4096, 3995, 1, 1024]
    - [5, 93.527]
  - - [64, 147, 432, 147]
    - [86, 33.825]
  - - [4096, 3491, 1, 1024]
    - [5, 93.945]
  - - [4096, 3348, 1, 1024]
    - [4, 92.983]
  - - [4096, 3925, 1, 1024]
    - [5, 92.185]
  - - [4096, 3894, 1, 1024]
    - [5, 93.395]
  - - [1024, 3456, 1, 4096]
    - [29, 89.251]
  - - [1024, 3394, 1, 4096]
    - [29, 87.801]
  - - [64, 100, 624, 102]
    - [86, 27.237]
  - - [4096, 3165, 1, 1024]
    - [5, 91.336]
  - - [4096, 3470, 1, 1024]
    - [5, 93.46]
  - - [1024, 3014, 1, 4096]
    - [4, 90.993]
  - - [1024, 3375, 1, 4096]
    - [29, 87.527]
  - - [4096, 3859, 1, 1024]
    - [5, 92.72]
  - - [4096, 3365, 1, 1024]
    - [4, 93.496]
  - - [1024, 3162, 1, 4096]
    - [29, 86.974]
  - - [1024, 3840, 1, 33708]
    - [51, 91.578]
  - - [1024, 3437, 1, 4096]
    - [10, 88.57]
  - - [4096, 3319, 1, 1024]
    - [4, 92.395]
  - - [1024, 3320, 1, 4096]
    - [4, 88.549]
  - - [64, 23, 2720, 23]
    - [4, 8.09]
  - - [4096, 3328, 1, 1024]
    - [5, 92.727]
  - - [1024, 3235, 1, 4096]
    - [29, 88.917]
  - - [4096, 3282, 1, 1024]
    - [5, 91.662]
  - - [1024, 3367, 1, 4096]
    - [10, 87.346]
  - - [1024, 3542, 1, 4096]
    - [29, 86.166]
  - - [64, 177, 352, 177]
    - [90, 36.268]
  - - [4096, 3145, 1, 1024]
    - [5, 90.842]
  - - [4096, 3514, 1, 1024]
    - [4, 94.537]
  - - [1024, 3432, 1, 4096]
    - [10, 88.583]
  - - [4096, 3409, 1, 1024]
    - [4, 92.027]
  - - [1024, 4012, 1, 33708]
    - [35, 88.362]
  - - [4096, 3876, 1, 1024]
    - [5, 93.034]
  - - [4096, 3299, 1, 1024]
    - [5, 92.041]
  - - [1024, 3168, 1, 4096]
    - [29, 87.05]
  - - [4096, 3681, 1, 1024]
    - [5, 93.407]
  - - [4096, 3531, 1, 1024]
    - [4, 92.34]
  - - [4096, 3388, 1, 1024]
    - [4, 93.956]
  - - [1024, 3720, 1, 4096]
    - [56, 89.12]
  - - [1024, 3332, 1, 4096]
    - [29, 86.645]
  - - [1024, 3273, 1, 4096]
    - [29, 89.831]
  - - [1024, 2935, 1, 4096]
    - [4, 88.892]
  - - [1024, 3467, 1, 4096]
    - [4, 92.197]
  - - [4096, 3542, 1, 1024]
    - [5, 92.589]
  - - [1024, 3130, 1, 4096]
    - [29, 86.069]
  - - [1024, 3405, 1, 4096]
    - [10, 88.261]
  - - [1024, 3960, 1, 1024]
    - [7, 83.317]
  - - [4096, 3405, 1, 1024]
    - [4, 92.037]
  - - [512, 512, 1, 1024]
    - [10, 39.925]
  - - [8, 500, 1, 512]
    - [16, 0.763]
  - - [512, 512, 1, 2000]
    - [1, 43.353]
  - - [32, 512, 1, 512]
    - [15, 3.0]
  - - [100, 1024, 1, 2048]
    - [37, 19.463]
  - - [8, 512, 1, 500]
    - [16, 0.664]
  - - [8, 500, 1, 1024]
    - [16, 1.067]
  - - [100, 2000, 1, 1024]
    - [37, 28.842]
  - - [64, 1024, 1, 100]
    - [13, 3.21]
  - - [64, 1024, 1, 500]
    - [13, 10.255]
  - - [64, 1024, 1, 1024]
    - [15, 16.173]
  - - [128, 2000, 1, 100]
    - [21, 11.537]
  - - [2, 500, 1, 2048]
    - [141, 0.279]
  - - [16, 512, 1, 10]
    - [12, 0.058]
  - - [64, 2000, 1, 1024]
    - [24, 15.987]
  - - [100, 1024, 1, 1024]
    - [30, 12.4]
  - - [8, 512, 1, 10]
    - [9, 0.028]
  - - [16, 500, 1, 2048]
    - [138, 2.126]
  - - [10, 100, 1, 500]
    - [13, 0.153]
  - - [16, 100, 1, 10]
    - [13, 0.01]
  - - [500, 1024, 1, 512]
    - [7, 43.594]
  - - [128, 1024, 1, 512]
    - [19, 22.238]
  - - [512, 500, 1, 2000]
    - [1, 42.415]
  - - [2, 100, 1, 2000]
    - [141, 0.054]
  - - [500, 512, 1, 100]
    - [11, 10.884]
  - - [100, 1024, 1, 500]
    - [93, 7.199]
  - - [256, 100, 1, 2048]
    - [145, 5.791]
  - - [2, 512, 1, 512]
    - [18, 0.18]
  - - [128, 2000, 1, 512]
    - [21, 30.927]
  - - [2, 100, 1, 10]
    - [9, 0.001]
  - - [16, 2000, 1, 2048]
    - [16, 10.149]
  - - [200, 100, 1, 100]
    - [11, 0.91]
  - - [256, 1024, 1, 100]
    - [21, 11.933]
  - - [200, 500, 1, 1024]
    - [92, 22.187]
  - - [500, 100, 1, 100]
    - [11, 2.231]
  - - [4, 100, 1, 10]
    - [13, 0.003]
  - - [32, 100, 1, 512]
    - [16, 0.256]
  - - [100, 2000, 1, 512]
    - [24, 23.189]
  - - [16, 1024, 1, 512]
    - [52, 1.359]
  - - [200, 512, 1, 100]
    - [11, 4.569]
  - - [4, 1024, 1, 1024]
    - [16, 1.08]
  - - [512, 1024, 1, 512]
    - [7, 46.35]
  - - [4, 512, 1, 10]
    - [9, 0.014]
  - - [2, 2048, 1, 2000]
    - [141, 0.9]
  - - [64, 2048, 1, 10]
    - [69, 0.236]
  - - [128, 100, 1, 10]
    - [11, 0.082]
  - - [4, 512, 1, 2048]
    - [141, 0.541]
  - - [64, 2048, 1, 500]
    - [93, 8.891]
  - - [512, 512, 1, 512]
    - [34, 31.669]
  - - [500, 500, 1, 2000]
    - [30, 40.094]
  - - [10, 1024, 1, 2000]
    - [142, 2.496]
  - - [256, 100, 1, 100]
    - [67, 0.454]
  - - [32, 2000, 1, 2048]
    - [15, 18.459]
  - - [64, 1024, 1, 2048]
    - [45, 20.298]
  - - [200, 2048, 1, 512]
    - [36, 35.265]
  - - [256, 500, 1, 10]
    - [112, 0.235]
  - - [16, 1024, 1, 100]
    - [11, 0.786]
  - - [32, 1024, 1, 1024]
    - [15, 4.504]
  - - [512, 500, 1, 512]
    - [95, 29.985]
  - - [128, 1024, 1, 2000]
    - [10, 31.253]
  - - [8, 100, 1, 500]
    - [16, 0.124]
  - - [100, 2000, 1, 2048]
    - [30, 33.319]
  - - [10, 512, 1, 512]
    - [27, 0.916]
  - - [8, 500, 1, 10]
    - [98, 0.008]
  - - [10, 2000, 1, 1024]
    - [15, 4.733]
  - - [16, 1024, 1, 10]
    - [11, 0.114]
  - - [16, 512, 1, 2048]
    - [138, 2.105]
  - - [256, 512, 1, 10]
    - [83, 0.245]
  - - [2, 2000, 1, 100]
    - [12, 0.186]
  - - [128, 512, 1, 2048]
    - [15, 21.223]
  - - [128, 512, 1, 100]
    - [13, 3.142]
  - - [512, 2000, 1, 1024]
    - [7, 70.111]
  - - [64, 500, 1, 2048]
    - [23, 10.046]
  - - [64, 2000, 1, 2048]
    - [30, 25.047]
  - - [64, 2048, 1, 512]
    - [7, 9.688]
  - - [10, 2000, 1, 512]
    - [52, 1.601]
  - - [32, 2000, 1, 500]
    - [28, 4.772]
  - - [64, 2000, 1, 10]
    - [9, 0.861]
  - - [500, 100, 1, 10]
    - [12, 0.297]
  - - [128, 1024, 1, 500]
    - [30, 9.264]
  - - [64, 100, 1, 2048]
    - [138, 1.702]
  - - [64, 100, 1, 10]
    - [96, 0.041]
  - - [16, 512, 1, 500]
    - [22, 1.318]
  - - [32, 2000, 1, 1024]
    - [15, 14.841]
  - - [200, 512, 1, 1024]
    - [92, 22.829]
  - - [128, 2048, 1, 10]
    - [9, 1.688]
  - - [200, 100, 1, 2000]
    - [14, 6.029]
  - - [2, 100, 1, 512]
    - [23, 0.016]
  - - [64, 2048, 1, 100]
    - [13, 6.089]
  - - [32, 512, 1, 100]
    - [93, 0.301]
  - - [16, 512, 1, 1024]
    - [27, 2.198]
  - - [4, 1024, 1, 512]
    - [16, 0.756]
  - - [64, 2000, 1, 100]
    - [13, 5.947]
  - - [512, 2048, 1, 512]
    - [36, 62.68]
  - - [2, 500, 1, 500]
    - [13, 0.153]
  - - [32, 100, 1, 100]
    - [22, 0.15]
  - - [100, 500, 1, 2000]
    - [68, 10.679]
  - - [200, 2000, 1, 100]
    - [2, 14.655]
  - - [10, 512, 1, 10]
    - [13, 0.035]
  - - [100, 500, 1, 2048]
    - [15, 14.791]
  - - [4, 2048, 1, 500]
    - [60, 0.624]
  - - [200, 500, 1, 100]
    - [11, 4.552]
  - - [500, 500, 1, 500]
    - [30, 15.21]
  - - [2, 100, 1, 1024]
    - [145, 0.03]
  - - [128, 2048, 1, 512]
    - [10, 18.254]
  - - [200, 2000, 1, 1024]
    - [36, 41.204]
  - - [32, 512, 1, 1024]
    - [15, 4.224]
  - - [100, 2048, 1, 500]
    - [69, 13.101]
  - - [256, 100, 1, 1024]
    - [45, 3.612]
  - - [16, 2000, 1, 500]
    - [99, 2.392]
  - - [128, 100, 1, 100]
    - [13, 0.583]
  - - [500, 500, 1, 2048]
    - [10, 41.203]
  - - [32, 512, 1, 10]
    - [2, 0.109]
  - - [128, 100, 1, 1024]
    - [15, 3.263]
  - - [16, 500, 1, 2000]
    - [141, 2.075]
  - - [4, 2048, 1, 100]
    - [93, 0.385]
  - - [64, 500, 1, 500]
    - [13, 5.078]
  - - [500, 1024, 1, 2048]
    - [7, 57.488]
  - - [512, 2048, 1, 100]
    - [5, 27.159]
  - - [128, 512, 1, 1024]
    - [61, 9.231]
  - - [128, 512, 1, 2000]
    - [45, 19.116]
  - - [128, 2000, 1, 2000]
    - [1, 42.729]
  - - [2, 512, 1, 10]
    - [93, 0.002]
  - - [10, 512, 1, 500]
    - [13, 0.796]
  - - [4, 1024, 1, 2000]
    - [141, 1.078]
  - - [256, 100, 1, 2000]
    - [27, 5.593]
  - - [512, 2048, 1, 2000]
    - [30, 73.378]
  - - [100, 100, 1, 10]
    - [11, 0.061]
  - - [256, 500, 1, 1024]
    - [30, 16.002]
  - - [128, 512, 1, 10]
    - [43, 0.128]
  - - [256, 100, 1, 500]
    - [13, 1.932]
  - - [64, 100, 1, 512]
    - [53, 1.102]
  - - [64, 512, 1, 500]
    - [79, 5.274]
  - - [64, 2048, 1, 2000]
    - [24, 30.926]
  - - [100, 2048, 1, 1024]
    - [10, 29.442]
  - - [200, 2000, 1, 10]
    - [11, 2.121]
  - - [128, 1024, 1, 100]
    - [93, 6.09]
  - - [16, 2000, 1, 100]
    - [93, 1.487]
  - - [8, 100, 1, 512]
    - [53, 0.137]
  - - [500, 2048, 1, 1024]
    - [36, 65.45]
  - - [500, 2000, 1, 10]
    - [4, 3.363]
  - - [32, 100, 1, 500]
    - [16, 0.494]
  - - [256, 1024, 1, 2048]
    - [32, 44.971]
  - - [32, 500, 1, 2048]
    - [138, 3.818]
  - - [4, 2000, 1, 10]
    - [11, 0.015]
  - - [128, 500, 1, 2000]
    - [45, 18.313]
  - - [8, 1024, 1, 10]
    - [93, 0.016]
  - - [2, 500, 1, 100]
    - [11, 0.018]
  - - [10, 500, 1, 512]
    - [27, 0.894]
  - - [10, 2000, 1, 10]
    - [12, 0.039]
  - - [500, 512, 1, 512]
    - [24, 28.814]
  - - [32, 500, 1, 500]
    - [20, 2.42]
  - - [256, 500, 1, 2000]
    - [30, 24.238]
  - - [100, 500, 1, 100]
    - [11, 2.253]
  - - [500, 2048, 1, 100]
    - [4, 26.073]
  - - [10, 1024, 1, 512]
    - [27, 1.777]
  - - [2, 2048, 1, 512]
    - [52, 0.331]
  - - [256, 512, 1, 100]
    - [13, 6.153]
  - - [10, 2048, 1, 100]
    - [93, 0.961]
  - - [8, 2048, 1, 100]
    - [12, 0.288]
  - - [512, 100, 1, 512]
    - [15, 8.816]
  - - [4, 500, 1, 500]
    - [57, 0.324]
  - - [64, 100, 1, 1024]
    - [27, 1.623]
  - - [2, 2048, 1, 1024]
    - [23, 1.027]
  - - [2, 500, 1, 2000]
    - [142, 0.262]
  - - [512, 1024, 1, 500]
    - [33, 43.755]
  - - [128, 2000, 1, 500]
    - [21, 30.044]
  - - [32, 512, 1, 2048]
    - [19, 5.161]
  - - [10, 100, 1, 2000]
    - [140, 0.271]
  - - [4, 100, 1, 512]
    - [16, 0.07]
  - - [2, 512, 1, 2048]
    - [141, 0.273]
  - - [200, 512, 1, 2048]
    - [70, 28.902]
  - - [200, 2000, 1, 2000]
    - [33, 44.021]
  - - [100, 100, 1, 2000]
    - [139, 2.534]
  - - [500, 2048, 1, 2000]
    - [7, 66.687]
  - - [64, 2048, 1, 2048]
    - [24, 33.053]
  - - [16, 2000, 1, 1024]
    - [19, 4.304]
  - - [512, 2048, 1, 1024]
    - [7, 71.371]
  - - [10, 500, 1, 500]
    - [20, 0.386]
  - - [200, 1024, 1, 2048]
    - [10, 30.384]
  - - [10, 2000, 1, 2000]
    - [23, 6.009]
  - - [8, 2000, 1, 500]
    - [52, 1.19]
  - - [2, 100, 1, 2048]
    - [142, 0.067]
  - - [32, 100, 1, 2048]
    - [139, 0.849]
  - - [512, 512, 1, 10]
    - [9, 1.575]
  - - [512, 500, 1, 10]
    - [9, 1.58]
  - - [16, 100, 1, 1024]
    - [16, 0.422]
  - - [2, 500, 1, 10]
    - [12, 0.007]
  - - [200, 512, 1, 10]
    - [12, 0.632]
  - - [512, 1024, 1, 100]
    - [73, 19.054]
  - - [16, 2000, 1, 2000]
    - [16, 9.364]
  - - [500, 500, 1, 1024]
    - [30, 35.173]
  - - [500, 100, 1, 2048]
    - [19, 10.955]
  - - [256, 1024, 1, 512]
    - [24, 17.525]
  - - [256, 500, 1, 512]
    - [34, 9.454]
  - - [16, 1024, 1, 2000]
    - [141, 3.772]
  - - [200, 500, 1, 2048]
    - [58, 20.483]
  - - [256, 2000, 1, 10]
    - [1, 2.536]
  - - [10, 2048, 1, 2048]
    - [15, 6.238]
  - - [512, 2000, 1, 100]
    - [5, 26.073]
  - - [10, 1024, 1, 1024]
    - [19, 1.4]
  - - [512, 2000, 1, 2048]
    - [7, 74.771]
  - - [500, 1024, 1, 500]
    - [87, 38.975]
  - - [500, 100, 1, 512]
    - [70, 8.068]
  - - [256, 2000, 1, 100]
    - [1, 17.887]
  - - [512, 1024, 1, 2048]
    - [30, 61.098]
  - - [32, 512, 1, 500]
    - [16, 2.582]
  - - [100, 2000, 1, 10]
    - [11, 1.202]
  - - [100, 500, 1, 512]
    - [70, 4.041]
  - - [8, 2000, 1, 512]
    - [15, 2.755]
  - - [100, 2048, 1, 2048]
    - [10, 33.514]
  - - [128, 1024, 1, 2048]
    - [31, 33.326]
  - - [8, 500, 1, 2000]
    - [138, 1.052]
  - - [100, 2000, 1, 500]
    - [21, 22.647]
  - - [100, 2048, 1, 100]
    - [11, 8.546]
  - - [4, 100, 1, 1024]
    - [145, 0.06]
  - - [500, 2048, 1, 2048]
    - [7, 71.221]
  - - [2, 2000, 1, 2048]
    - [141, 0.902]
  - - [200, 2048, 1, 10]
    - [11, 2.146]
  - - [2, 500, 1, 1024]
    - [23, 0.254]
  - - [100, 500, 1, 1024]
    - [15, 11.894]
  - - [16, 2048, 1, 500]
    - [99, 2.55]
  - - [100, 1024, 1, 10]
    - [12, 0.577]
  - - [8, 2048, 1, 1024]
    - [27, 4.0]
  - - [2, 2000, 1, 500]
    - [46, 0.296]
  - - [32, 100, 1, 1024]
    - [16, 0.839]
  - - [500, 2000, 1, 512]
    - [36, 55.467]
  - - [64, 100, 1, 2000]
    - [138, 1.646]
  - - [100, 1024, 1, 2000]
    - [37, 19.431]
  - - [64, 500, 1, 10]
    - [9, 0.203]
  - - [32, 2048, 1, 100]
    - [2, 3.142]
  - - [64, 500, 1, 512]
    - [19, 2.57]
  - - [10, 100, 1, 1024]
    - [145, 0.148]
  - - [16, 512, 1, 100]
    - [11, 0.393]
  - - [4, 100, 1, 2000]
    - [138, 0.109]
  - - [2, 512, 1, 1024]
    - [23, 0.255]
  - - [64, 512, 1, 1024]
    - [45, 4.624]
  - - [10, 2048, 1, 500]
    - [52, 1.554]
  - - [4, 2000, 1, 2048]
    - [14, 2.546]
  - - [512, 100, 1, 2048]
    - [19, 16.128]
  - - [32, 100, 1, 2000]
    - [139, 0.806]
  - - [256, 512, 1, 500]
    - [30, 8.998]
  - - [100, 2000, 1, 100]
    - [11, 8.666]
  - - [8, 2000, 1, 1024]
    - [16, 3.928]
  - - [4, 512, 1, 500]
    - [16, 0.334]
  - - [128, 1024, 1, 10]
    - [102, 0.247]
  - - [4, 500, 1, 1024]
    - [16, 0.54]
  - - [32, 2048, 1, 512]
    - [15, 11.201]
  - - [32, 100, 1, 10]
    - [93, 0.019]
  - - [100, 2048, 1, 10]
    - [11, 1.168]
  - - [512, 500, 1, 100]
    - [9, 10.782]
  - - [128, 2000, 1, 1024]
    - [10, 27.885]
  - - [200, 1024, 1, 500]
    - [1, 24.036]
  - - [32, 2048, 1, 1024]
    - [15, 15.917]
  - - [10, 1024, 1, 2048]
    - [138, 2.656]
  - - [8, 500, 1, 100]
    - [13, 0.188]
  - - [32, 2048, 1, 500]
    - [46, 10.046]
  - - [200, 100, 1, 1024]
    - [16, 4.989]
  - - [16, 100, 1, 100]
    - [13, 0.076]
  - - [8, 1024, 1, 2000]
    - [138, 1.976]
  - - [4, 512, 1, 100]
    - [13, 0.096]
  - - [16, 500, 1, 100]
    - [67, 0.146]
  - - [8, 1024, 1, 2048]
    - [141, 2.023]
  - - [16, 1024, 1, 2048]
    - [142, 3.943]
  - - [10, 2048, 1, 1024]
    - [16, 4.897]
  - - [64, 512, 1, 100]
    - [13, 1.605]
  - - [2, 100, 1, 500]
    - [145, 0.015]
  - - [2, 500, 1, 512]
    - [18, 0.176]
  - - [256, 512, 1, 2000]
    - [30, 31.336]
  - - [128, 500, 1, 1024]
    - [15, 15.627]
  - - [10, 100, 1, 10]
    - [9, 0.006]
  - - [8, 2048, 1, 2048]
    - [23, 5.161]
  - - [16, 2048, 1, 2048]
    - [16, 10.081]
  - - [64, 1024, 1, 10]
    - [112, 0.126]
  - - [500, 100, 1, 500]
    - [62, 7.461]
  - - [256, 1024, 1, 2000]
    - [95, 37.18]
  - - [200, 512, 1, 500]
    - [52, 7.459]
  - - [8, 2000, 1, 10]
    - [60, 0.032]
  - - [64, 2000, 1, 512]
    - [10, 9.216]
  - - [2, 512, 1, 100]
    - [12, 0.048]
  - - [4, 2000, 1, 2000]
    - [138, 1.696]
  - - [200, 1024, 1, 100]
    - [11, 8.707]
  - - [16, 100, 1, 500]
    - [27, 0.244]
  - - [128, 100, 1, 500]
    - [17, 2.017]
  - - [500, 1024, 1, 1024]
    - [7, 51.928]
  - - [200, 1024, 1, 1024]
    - [101, 22.513]
  - - [8, 2048, 1, 512]
    - [62, 2.821]
  - - [200, 2000, 1, 500]
    - [71, 32.305]
  - - [512, 100, 1, 1024]
    - [15, 12.982]
  - - [16, 100, 1, 2000]
    - [142, 0.484]
  - - [500, 512, 1, 2000]
    - [10, 40.984]
  - - [8, 2000, 1, 2048]
    - [16, 5.006]
  - - [256, 2048, 1, 100]
    - [100, 19.368]
  - - [32, 2048, 1, 2000]
    - [15, 18.693]
  - - [200, 500, 1, 512]
    - [30, 7.683]
  - - [10, 512, 1, 100]
    - [13, 0.24]
  - - [16, 2000, 1, 10]
    - [12, 0.203]
  - - [8, 512, 1, 100]
    - [13, 0.186]
  - - [256, 512, 1, 512]
    - [19, 21.45]
  - - [500, 2000, 1, 1024]
    - [7, 64.362]
  - - [512, 512, 1, 500]
    - [1, 31.253]
  - - [256, 2048, 1, 1024]
    - [10, 54.739]
  - - [8, 2048, 1, 2000]
    - [27, 4.795]
  - - [100, 1024, 1, 512]
    - [19, 16.183]
  - - [128, 100, 1, 2000]
    - [141, 3.138]
  - - [4, 2048, 1, 2048]
    - [16, 2.572]
  - - [2, 1024, 1, 2000]
    - [141, 0.518]
  - - [100, 512, 1, 512]
    - [92, 8.32]
  - - [128, 1024, 1, 1024]
    - [30, 17.031]
  - - [200, 2048, 1, 1024]
    - [7, 41.912]
  - - [32, 1024, 1, 2000]
    - [15, 9.715]
  - - [128, 500, 1, 100]
    - [11, 3.004]
  - - [200, 512, 1, 2000]
    - [70, 26.22]
  - - [10, 2048, 1, 2000]
    - [23, 5.86]
  - - [256, 1024, 1, 500]
    - [1, 30.606]
  - - [100, 100, 1, 100]
    - [11, 0.46]
  - - [8, 512, 1, 1024]
    - [16, 1.086]
  - - [200, 1024, 1, 512]
    - [103, 14.085]
  - - [256, 500, 1, 500]
    - [30, 9.242]
  - - [200, 100, 1, 500]
    - [52, 1.527]
  - - [2, 1024, 1, 2048]
    - [141, 0.561]
  - - [256, 500, 1, 2048]
    - [30, 25.323]
  - - [512, 2048, 1, 500]
    - [5, 54.316]
  - - [512, 100, 1, 2000]
    - [15, 14.935]
  - - [512, 500, 1, 1024]
    - [101, 27.661]
  - - [16, 512, 1, 2000]
    - [138, 2.125]
  - - [64, 500, 1, 1024]
    - [19, 4.482]
  - - [512, 2000, 1, 10]
    - [86, 1.582]
  - - [256, 512, 1, 1024]
    - [134, 15.949]
  - - [10, 512, 1, 1024]
    - [27, 1.305]
  - - [512, 100, 1, 100]
    - [13, 2.354]
  - - [8, 2000, 1, 100]
    - [93, 0.721]
  - - [128, 2048, 1, 1024]
    - [10, 39.15]
  - - [2, 2000, 1, 2000]
    - [142, 0.883]
  - - [16, 2048, 1, 1024]
    - [16, 8.044]
  - - [500, 512, 1, 500]
    - [38, 26.83]
  - - [8, 100, 1, 1024]
    - [138, 0.117]
  - - [10, 100, 1, 100]
    - [13, 0.047]
  - - [200, 500, 1, 500]
    - [30, 7.105]
  - - [10, 500, 1, 2000]
    - [138, 1.31]
  - - [500, 100, 1, 2000]
    - [15, 13.909]
  - - [100, 512, 1, 2000]
    - [61, 10.954]
  - - [500, 1024, 1, 2000]
    - [33, 55.069]
  - - [32, 2000, 1, 2000]
    - [16, 18.255]
  - - [64, 1024, 1, 512]
    - [13, 11.456]
  - - [64, 2000, 1, 2000]
    - [30, 23.655]
  - - [32, 500, 1, 100]
    - [11, 0.721]
  - - [128, 2000, 1, 2048]
    - [101, 42.649]
  - - [10, 100, 1, 2048]
    - [139, 0.275]
  - - [32, 2048, 1, 2048]
    - [15, 20.23]
  - - [64, 100, 1, 100]
    - [13, 0.297]
  - - [2, 1024, 1, 100]
    - [99, 0.037]
  - - [256, 1024, 1, 10]
    - [11, 1.618]
  - - [256, 1024, 1, 1024]
    - [30, 39.277]
  - - [64, 500, 1, 2000]
    - [22, 9.614]
  - - [512, 2000, 1, 512]
    - [7, 60.896]
  - - [8, 512, 1, 512]
    - [27, 0.756]
  - - [8, 512, 1, 2048]
    - [141, 1.083]
  - - [100, 100, 1, 1024]
    - [17, 2.455]
  - - [2, 2048, 1, 10]
    - [11, 0.026]
  - - [4, 2048, 1, 512]
    - [14, 1.432]
  - - [4, 2048, 1, 10]
    - [11, 0.053]
  - - [8, 100, 1, 2000]
    - [145, 0.21]
  - - [2, 1024, 1, 1024]
    - [23, 0.525]
  - - [16, 2048, 1, 100]
    - [93, 1.588]
  - - [16, 512, 1, 512]
    - [22, 1.524]
  - - [32, 500, 1, 512]
    - [16, 2.93]
  - - [500, 2000, 1, 2000]
    - [36, 64.984]
  - - [500, 1024, 1, 10]
    - [2, 2.307]
  - - [32, 500, 1, 1024]
    - [16, 4.013]
  - - [32, 500, 1, 10]
    - [67, 0.031]
  - - [500, 500, 1, 10]
    - [11, 1.463]
  - - [4, 2000, 1, 500]
    - [16, 1.279]
  - - [10, 2000, 1, 500]
    - [16, 3.025]
  - - [32, 2000, 1, 512]
    - [19, 5.218]
  - - [256, 500, 1, 100]
    - [13, 5.6]
  - - [256, 2048, 1, 10]
    - [3, 2.625]
  - - [4, 1024, 1, 500]
    - [16, 0.664]
  - - [256, 512, 1, 2048]
    - [24, 33.981]
  - - [2, 2000, 1, 1024]
    - [52, 0.544]
  - - [256, 100, 1, 512]
    - [45, 2.133]
  - - [8, 1024, 1, 500]
    - [16, 1.282]
  - - [256, 2048, 1, 500]
    - [33, 43.917]
  - - [256, 2048, 1, 2048]
    - [10, 61.02]
  - - [2, 2000, 1, 512]
    - [58, 0.326]
  - - [256, 2000, 1, 512]
    - [7, 43.755]
  - - [4, 1024, 1, 100]
    - [11, 0.19]
  - - [512, 1024, 1, 2000]
    - [30, 58.557]
  - - [100, 500, 1, 500]
    - [19, 3.698]
  - - [4, 2048, 1, 1024]
    - [16, 2.066]
  - - [2, 1024, 1, 500]
    - [60, 0.152]
  - - [64, 100, 1, 500]
    - [27, 0.995]
  - - [256, 2000, 1, 2000]
    - [30, 56.415]
  - - [2, 512, 1, 500]
    - [23, 0.162]
  - - [8, 2048, 1, 500]
    - [16, 2.511]
  - - [10, 1024, 1, 500]
    - [22, 0.78]
  - - [4, 2048, 1, 2000]
    - [16, 2.429]
  - - [200, 1024, 1, 2000]
    - [1, 34.96]
  - - [128, 500, 1, 512]
    - [13, 11.02]
  - - [10, 500, 1, 2048]
    - [138, 1.365]
  - - [256, 2048, 1, 2000]
    - [30, 58.556]
  - - [8, 2000, 1, 2000]
    - [22, 4.728]
  - - [100, 2048, 1, 512]
    - [34, 23.51]
  - - [512, 500, 1, 2048]
    - [101, 42.804]
  - - [200, 2048, 1, 100]
    - [1, 14.65]
  - - [128, 512, 1, 512]
    - [15, 12.195]
  - - [200, 2000, 1, 2048]
    - [7, 45.747]
  - - [4, 2000, 1, 1024]
    - [20, 2.017]
  - - [64, 512, 1, 10]
    - [12, 0.217]
  - - [32, 500, 1, 2000]
    - [141, 3.631]
  - - [128, 2048, 1, 2000]
    - [1, 43.918]
  - - [100, 100, 1, 2048]
    - [138, 2.541]
  - - [500, 2048, 1, 512]
    - [7, 56.797]
  - - [200, 100, 1, 512]
    - [16, 3.393]
  - - [32, 2000, 1, 100]
    - [93, 2.884]
  - - [500, 512, 1, 2048]
    - [10, 42.042]
  - - [500, 2000, 1, 500]
    - [5, 52.281]
  - - [200, 100, 1, 2048]
    - [145, 4.394]
  - - [2, 2048, 1, 100]
    - [11, 0.071]
  - - [8, 100, 1, 10]
    - [9, 0.005]
  - - [200, 2048, 1, 2048]
    - [30, 46.499]
  - - [200, 2048, 1, 500]
    - [82, 32.963]
  - - [100, 100, 1, 500]
    - [17, 1.565]
  - - [8, 2048, 1, 10]
    - [67, 0.033]
  - - [100, 500, 1, 10]
    - [11, 0.309]
  - - [200, 500, 1, 2000]
    - [70, 25.975]
  - - [512, 2000, 1, 500]
    - [5, 53.288]
  - - [10, 500, 1, 1024]
    - [16, 1.275]
  - - [256, 100, 1, 10]
    - [11, 0.16]
  - - [500, 512, 1, 1024]
    - [10, 36.576]
  - - [200, 2048, 1, 2000]
    - [33, 45.022]
  - - [100, 1024, 1, 100]
    - [67, 4.48]
  - - [500, 1024, 1, 100]
    - [73, 16.966]
  - - [10, 512, 1, 2048]
    - [145, 1.333]
  - - [2, 1024, 1, 512]
    - [79, 0.165]
  - - [4, 500, 1, 2048]
    - [142, 0.525]
  - - [100, 512, 1, 100]
    - [12, 2.307]
  - - [16, 500, 1, 512]
    - [16, 1.477]
  - - [10, 1024, 1, 100]
    - [19, 0.181]
  - - [8, 1024, 1, 100]
    - [67, 0.146]
  - - [64, 2000, 1, 500]
    - [93, 8.895]
  - - [64, 1024, 1, 2000]
    - [15, 18.993]
  - - [10, 100, 1, 512]
    - [22, 0.08]
  - - [4, 500, 1, 2000]
    - [141, 0.534]
  - - [512, 1024, 1, 10]
    - [3, 2.541]
  - - [128, 2048, 1, 2048]
    - [10, 44.64]
  - - [4, 100, 1, 100]
    - [94, 0.019]
  - - [32, 1024, 1, 512]
    - [15, 5.954]
  - - [8, 512, 1, 2000]
    - [138, 1.044]
  - - [100, 100, 1, 512]
    - [20, 1.66]
  - - [2, 2048, 1, 2048]
    - [23, 1.281]
  - - [2, 512, 1, 2000]
    - [142, 0.279]
  - - [16, 500, 1, 10]
    - [98, 0.016]
  - - [10, 500, 1, 100]
    - [13, 0.237]
  - - [4, 100, 1, 500]
    - [16, 0.065]
  - - [512, 1024, 1, 1024]
    - [30, 54.987]
  - - [64, 500, 1, 100]
    - [13, 1.472]
  - - [128, 2000, 1, 10]
    - [9, 1.498]
  - - [10, 2000, 1, 2048]
    - [15, 6.133]
  - - [2, 100, 1, 100]
    - [94, 0.009]
  - - [10, 512, 1, 2000]
    - [138, 1.315]
  - - [8, 500, 1, 500]
    - [16, 0.639]
  - - [4, 500, 1, 512]
    - [16, 0.381]
  - - [10, 500, 1, 10]
    - [98, 0.01]
  - - [64, 512, 1, 2000]
    - [16, 9.878]
  - - [500, 512, 1, 10]
    - [11, 1.46]
  - - [200, 512, 1, 512]
    - [99, 7.757]
  - - [512, 500, 1, 500]
    - [1, 30.202]
  - - [32, 512, 1, 2000]
    - [138, 3.762]
  - - [128, 500, 1, 2048]
    - [45, 19.495]
  - - [500, 2048, 1, 10]
    - [72, 1.519]
  - - [512, 512, 1, 100]
    - [38, 11.814]
  - - [200, 2000, 1, 512]
    - [36, 34.311]
  - - [500, 500, 1, 512]
    - [34, 27.733]
  - - [128, 2048, 1, 500]
    - [21, 30.765]
  - - [4, 512, 1, 512]
    - [16, 0.394]
  - - [16, 2048, 1, 2000]
    - [14, 9.558]
  - - [16, 500, 1, 1024]
    - [16, 2.146]
  - - [256, 2000, 1, 500]
    - [33, 40.199]
  - - [10, 1024, 1, 10]
    - [93, 0.021]
  - - [16, 500, 1, 500]
    - [23, 1.261]
  - - [10, 2048, 1, 512]
    - [92, 1.664]
  - - [200, 500, 1, 10]
    - [72, 0.188]
  - - [256, 2048, 1, 512]
    - [7, 45.823]
  - - [256, 2000, 1, 2048]
    - [10, 55.07]
  - - [500, 2048, 1, 500]
    - [4, 52.921]
  - - [500, 100, 1, 1024]
    - [70, 11.833]
  - - [16, 100, 1, 512]
    - [16, 0.286]
  - - [64, 512, 1, 2048]
    - [19, 7.319]
  - - [32, 1024, 1, 10]
    - [11, 0.068]
  - - [16, 2048, 1, 512]
    - [22, 5.728]
  - - [8, 1024, 1, 512]
    - [16, 1.488]
  - - [4, 1024, 1, 2048]
    - [141, 1.082]
  - - [100, 2048, 1, 2000]
    - [84, 32.787]
  - - [256, 2000, 1, 1024]
    - [7, 52.274]
  - - [200, 1024, 1, 10]
    - [9, 1.199]
  - - [128, 500, 1, 500]
    - [13, 9.877]
  - - [100, 512, 1, 1024]
    - [97, 7.092]
  - - [16, 1024, 1, 500]
    - [16, 2.637]
  - - [128, 100, 1, 2048]
    - [17, 4.219]
  - - [100, 512, 1, 500]
    - [58, 3.923]
  - - [8, 1024, 1, 1024]
    - [16, 2.136]
  - - [2, 2000, 1, 10]
    - [12, 0.026]
  - - [4, 500, 1, 10]
    - [67, 0.004]
  - - [500, 2000, 1, 2048]
    - [24, 69.395]
  - - [4, 2000, 1, 100]
    - [93, 0.38]
  - - [512, 2000, 1, 2000]
    - [10, 70.942]
  - - [128, 500, 1, 10]
    - [9, 0.406]
  - - [32, 1024, 1, 100]
    - [93, 1.571]
  - - [8, 500, 1, 2048]
    - [138, 1.055]
  - - [16, 1024, 1, 1024]
    - [27, 4.224]
  - - [200, 100, 1, 10]
    - [11, 0.123]
  - - [512, 100, 1, 500]
    - [50, 3.826]
  - - [512, 2048, 1, 2048]
    - [30, 77.114]
  - - [16, 2000, 1, 512]
    - [27, 5.47]
  - - [64, 2048, 1, 1024]
    - [37, 16.37]
  - - [32, 2048, 1, 10]
    - [12, 0.448]
  - - [10, 2048, 1, 10]
    - [93, 0.125]
  - - [4, 2000, 1, 512]
    - [97, 0.651]
  - - [4, 500, 1, 100]
    - [93, 0.036]
  - - [8, 100, 1, 2048]
    - [138, 0.256]
  - - [512, 2048, 1, 10]
    - [102, 3.78]
  - - [512, 100, 1, 10]
    - [13, 0.334]
  - - [4, 512, 1, 1024]
    - [14, 0.549]
  - - [16, 2048, 1, 10]
    - [11, 0.214]
  - - [500, 2000, 1, 100]
    - [5, 25.318]
  - - [32, 1024, 1, 2048]
    - [15, 10.465]
  - - [100, 2000, 1, 2000]
    - [10, 27.876]
  - - [128, 100, 1, 512]
    - [27, 2.401]
  - - [500, 500, 1, 100]
    - [11, 10.529]
  - - [32, 2000, 1, 10]
    - [12, 0.406]
  - - [128, 2048, 1, 100]
    - [21, 12.055]
  - - [10, 2000, 1, 100]
    - [60, 0.356]
  - - [2, 2048, 1, 500]
    - [60, 0.302]
  - - [32, 1024, 1, 500]
    - [62, 5.128]
  - - [4, 1024, 1, 10]
    - [98, 0.008]
  - - [100, 512, 1, 10]
    - [67, 0.316]
  - - [8, 100, 1, 100]
    - [13, 0.038]
  - - [128, 512, 1, 500]
    - [19, 5.017]
  - - [16, 100, 1, 2048]
    - [140, 0.432]
  - - [2, 1024, 1, 10]
    - [98, 0.004]
  - - [4, 100, 1, 2048]
    - [138, 0.115]
  - - [4, 512, 1, 2000]
    - [138, 0.544]
  - - [4096, 64, 1, 2048]
    - [101, 43.91]
  - - [1024, 10080, 1, 1024]
    - [4, 93.564]
  - - [1024, 1131, 1, 1024]
    - [4, 70.231]
  - - [36548, 1216, 1, 1024]
    - [6, 94.958]
  - - [1024, 29, 1, 1024]
    - [17, 7.656]
  - - [1024, 2592, 1, 1024]
    - [4, 85.895]
  - - [1024, 1568, 1, 1024]
    - [4, 75.225]
  - - [4096, 91, 1, 2048]
    - [30, 60.354]
  - - [1024, 4445, 1, 1024]
    - [4, 84.834]
  - - [1024, 6272, 1, 1024]
    - [4, 88.499]
  - - [36548, 3584, 1, 1024]
    - [6, 96.273]
  - - [1024, 1827, 1, 1024]
    - [5, 69.373]
  - - [1024, 3220, 1, 1024]
    - [29, 83.149]
  - - [1024, 1856, 1, 1024]
    - [4, 70.35]
  - - [1024, 1760, 1, 1024]
    - [7, 80.669]
  - - [1024, 1, 1, 21]
    - [13, 0.004]
  - - [36548, 4235, 1, 1024]
    - [6, 95.179]
  - - [1024, 49, 1, 1024]
    - [19, 12.123]
  - - [1024, 1984, 1, 1024]
    - [4, 78.259]
  - - [1024, 14720, 1, 1024]
    - [6, 93.608]
  - - [1024, 1152, 1, 1024]
    - [4, 71.535]
  - - [36548, 14976, 1, 1024]
    - [6, 96.951]
  - - [36548, 1152, 1, 1024]
    - [6, 95.501]
  - - [4096, 86, 1, 3072]
    - [30, 61.42]
  - - [1024, 3392, 1, 1024]
    - [4, 86.925]
  - - [1024, 1408, 1, 1024]
    - [36, 73.52]
  - - [1024, 2080, 1, 1024]
    - [129, 73.009]
  - - [1024, 1824, 1, 1024]
    - [36, 70.589]
  - - [36548, 2432, 1, 1024]
    - [6, 96.199]
  - - [4096, 29, 1, 2048]
    - [101, 28.111]
  - - [1024, 1102, 1, 1024]
    - [4, 68.701]
  - - [4096, 49, 1, 2048]
    - [101, 32.902]
  - - [36548, 1827, 1, 1024]
    - [6, 94.242]
  - - [4096, 25, 1, 2048]
    - [34, 24.741]
  - - [1024, 10176, 1, 1024]
    - [4, 91.177]
  - - [1024, 774, 1, 1024]
    - [105, 54.609]
  - - [1024, 1952, 1, 1024]
    - [7, 80.843]
  - - [4096, 128, 1, 2048]
    - [7, 59.962]
  - - [1024, 17024, 1, 1024]
    - [4, 94.444]
  - - [1024, 1472, 1, 1024]
    - [36, 76.692]
  - - [36548, 4459, 1, 1024]
    - [6, 96.4]
  - - [4096, 91, 1, 3072]
    - [30, 64.827]
  - - [1024, 3712, 1, 1024]
    - [29, 85.317]
  - - [4096, 64, 1, 3072]
    - [40, 47.69]
  - - [4096, 29, 1, 3072]
    - [10, 31.383]
  - - [4096, 128, 1, 3072]
    - [30, 63.116]
  - - [36548, 12928, 1, 1024]
    - [6, 96.917]
  - - [1024, 1632, 1, 1024]
    - [29, 70.046]
  - - [1024, 1696, 1, 1024]
    - [36, 68.129]
  - - [4096, 24, 1, 2048]
    - [31, 23.384]
  - - [4096, 63, 1, 3072]
    - [30, 44.88]
  - - [4096, 96, 1, 2048]
    - [30, 64.577]
  - - [36548, 1764, 1, 1024]
    - [6, 94.669]
  - - [4096, 32, 1, 2048]
    - [34, 33.604]
  - - [1024, 35, 1, 1024]
    - [15, 9.038]
  - - [1024, 1120, 1, 1024]
    - [4, 69.547]
  - - [4096, 49, 1, 3072]
    - [10, 35.441]
  - - [1024, 24, 1, 1024]
    - [27, 6.266]
  - - [1024, 2944, 1, 1024]
    - [4, 84.571]
  - - [36548, 14080, 1, 1024]
    - [6, 97.104]
  - - [1024, 1280, 1, 1024]
    - [29, 62.584]
  - - [1024, 13440, 1, 1024]
    - [4, 93.591]
  - - [1024, 1015, 1, 1024]
    - [36, 69.919]
  - - [36548, 9120, 1, 1024]
    - [56, 96.849]
  - - [36548, 1, 1, 1024]
    - [84, 1.726]
  - - [1024, 3008, 1, 1024]
    - [4, 86.726]
  - - [1024, 2560, 1, 1024]
    - [4, 85.132]
  - - [1024, 21, 1, 1024]
    - [20, 3.009]
  - - [1024, 2208, 1, 1024]
    - [7, 77.807]
  - - [1024, 96, 1, 1024]
    - [19, 24.26]
  - - [4096, 86, 1, 2048]
    - [30, 57.441]
  - - [4096, 96, 1, 3072]
    - [30, 69.972]
  - - [1024, 1920, 1, 1024]
    - [4, 70.849]
  - - [4096, 27, 1, 2048]
    - [31, 26.651]
  - - [36548, 2496, 1, 1024]
    - [6, 96.124]
  - - [1024, 1, 1, 14]
    - [13, 0.01]
  - - [1024, 91, 1, 1024]
    - [45, 22.397]
  - - [1024, 2016, 1, 1024]
    - [4, 79.654]
  - - [1024, 1184, 1, 1024]
    - [4, 73.619]
  - - [4096, 1, 1, 2048]
    - [39, 1.167]
  - - [1024, 1664, 1, 1024]
    - [7, 68.488]
  - - [1024, 11424, 1, 1024]
    - [4, 91.113]
  - - [4096, 24, 1, 3072]
    - [10, 26.223]
  - - [1024, 1216, 1, 1024]
    - [4, 75.509]
  - - [36548, 3185, 1, 1024]
    - [6, 96.311]
  - - [36548, 9216, 1, 1024]
    - [6, 96.872]
  - - [1024, 3200, 1, 1024]
    - [7, 83.132]
  - - [1024, 2656, 1, 1024]
    - [36, 79.942]
  - - [1024, 2368, 1, 1024]
    - [36, 81.62]
  - - [1024, 4459, 1, 1024]
    - [4, 85.205]
  - - [1024, 3808, 1, 1024]
    - [4, 86.973]
  - - [1024, 2336, 1, 1024]
    - [36, 81.108]
  - - [4096, 27, 1, 3072]
    - [31, 29.387]
  - - [1024, 2304, 1, 1024]
    - [7, 80.233]
  - - [1024, 1560, 1, 1024]
    - [4, 75.531]
  - - [4096, 35, 1, 3072]
    - [21, 25.147]
  - - [1024, 2496, 1, 1024]
    - [4, 82.713]
  - - [1024, 1504, 1, 1024]
    - [7, 78.015]
  - - [4096, 50, 1, 2048]
    - [10, 33.936]
  - - [1024, 3232, 1, 1024]
    - [36, 84.009]
  - - [1024, 14, 1, 1024]
    - [17, 3.675]
  - - [36548, 1015, 1, 1024]
    - [6, 93.373]
  - - [1024, 2000, 1, 1024]
    - [4, 78.89]
  - - [36548, 243, 1, 1024]
    - [4, 84.889]
  - - [36548, 32, 1, 1024]
    - [31, 44.457]
  - - [1024, 25, 1, 1024]
    - [27, 6.491]
  - - [1024, 13184, 1, 1024]
    - [6, 94.654]
  - - [1024, 2688, 1, 1024]
    - [7, 80.445]
  - - [1024, 27, 1, 1024]
    - [53, 6.934]
  - - [36548, 950, 1, 1024]
    - [6, 94.82]
  - - [1024, 1764, 1, 1024]
    - [36, 68.529]
  - - [1024, 992, 1, 1024]
    - [7, 69.038]
  - - [1024, 1376, 1, 1024]
    - [7, 72.57]
  - - [1024, 950, 1, 1024]
    - [30, 57.345]
  - - [36548, 774, 1, 1024]
    - [6, 88.462]
  - - [36548, 25, 1, 1024]
    - [103, 36.444]
  - - [1024, 4256, 1, 1024]
    - [4, 87.901]
  - - [4096, 32, 1, 3072]
    - [30, 35.861]
  - - [1024, 243, 1, 1024]
    - [10, 36.687]
  - - [36548, 3712, 1, 1024]
    - [6, 96.606]
  - - [1024, 50, 1, 1024]
    - [17, 12.502]
  - - [1024, 3360, 1, 1024]
    - [4, 85.779]
  - - [1024, 2784, 1, 1024]
    - [36, 82.585]
  - - [1024, 4992, 1, 1024]
    - [4, 87.564]
  - - [36548, 1102, 1, 1024]
    - [6, 91.536]
  - - [1024, 1536, 1, 1024]
    - [7, 79.588]
  - - [1024, 2720, 1, 1024]
    - [7, 81.402]
  - - [4096, 1, 1, 3072]
    - [57, 1.274]
  - - [1024, 2752, 1, 1024]
    - [7, 81.739]
  - - [1024, 2816, 1, 1024]
    - [36, 83.326]
  - - [1024, 2624, 1, 1024]
    - [4, 87.016]
  - - [1024, 2144, 1, 1024]
    - [4, 83.801]
  - - [36548, 1131, 1, 1024]
    - [6, 93.949]
  - - [4096, 25, 1, 3072]
    - [101, 27.368]
  - - [1024, 64, 1, 1024]
    - [45, 16.526]
  - - [1024, 3296, 1, 1024]
    - [7, 85.018]
  - - [36548, 4992, 1, 1024]
    - [6, 97.134]
  - - [1024, 1344, 1, 1024]
    - [7, 71.441]
  - - [36548, 2401, 1, 1024]
    - [6, 95.234]
  - - [1024, 15744, 1, 1024]
    - [6, 94.703]
  - - [1024, 15232, 1, 1024]
    - [4, 94.078]
  - - [1024, 1888, 1, 1024]
    - [7, 70.677]
  - - [1024, 1792, 1, 1024]
    - [7, 75.744]
  - - [36548, 1073, 1, 1024]
    - [6, 92.926]
  - - [4096, 50, 1, 3072]
    - [30, 36.119]
  - - [36548, 15488, 1, 1024]
    - [6, 96.914]
  - - [1024, 2464, 1, 1024]
    - [4, 81.94]
  - - [1024, 2272, 1, 1024]
    - [7, 79.235]
  - - [1024, 13, 1, 1024]
    - [20, 3.394]
  - - [1024, 2432, 1, 1024]
    - [4, 81.161]
  - - [36548, 24, 1, 1024]
    - [103, 34.955]
  - - [1024, 3936, 1, 1024]
    - [4, 82.128]
  - - [36548, 13824, 1, 1024]
    - [56, 97.016]
  - - [1024, 2401, 1, 1024]
    - [4, 79.958]
  - - [1024, 2176, 1, 1024]
    - [4, 84.841]
  - - [1024, 2240, 1, 1024]
    - [36, 78.408]
  - - [1024, 1728, 1, 1024]
    - [4, 82.649]
  - - [1024, 128, 1, 1024]
    - [10, 16.311]
  - - [1024, 216, 1, 1024]
    - [84, 33.248]
  - - [1024, 63, 1, 1024]
    - [15, 15.345]
  - - [1024, 86, 1, 1024]
    - [45, 21.166]
  - - [1024, 2528, 1, 1024]
    - [4, 83.832]
  - - [1024, 2400, 1, 1024]
    - [36, 82.783]
  - - [1024, 1440, 1, 1024]
    - [7, 75.191]
  - - [1024, 2912, 1, 1024]
    - [4, 84.422]
  - - [4096, 35, 1, 2048]
    - [94, 22.48]
  - - [4096, 63, 1, 2048]
    - [101, 42.005]
  - - [1024, 2880, 1, 1024]
    - [7, 76.086]
  - - [1024, 4064, 1, 1024]
    - [7, 84.378]
  - - [1024, 4655, 1, 1024]
    - [4, 87.884]
  - - [1024, 1088, 1, 1024]
    - [36, 75.831]
  - - [36548, 6272, 1, 1024]
    - [6, 96.878]
  - - [1024, 1, 1, 13]
    - [39, 0.003]
  - - [768, 2048, 1, 3072]
    - [7, 86.547]
  - - [64, 128, 96, 128]
    - [3, 30.042]
  - - [768, 1024, 1, 3072]
    - [105, 77.991]
  - - [768, 512, 1, 3072]
    - [40, 71.161]
  - - [768, 4096, 1, 3072]
    - [4, 92.229]
  - - [768, 320, 1, 30522]
    - [143, 58.556]
  - - [768, 640, 1, 30522]
    - [144, 67.602]
  - - [768, 1280, 1, 30522]
    - [30, 84.225]
  - - [64, 256, 192, 256]
    - [49, 50.266]
  - - [64, 128, 384, 128]
    - [7, 37.725]
  - - [64, 256, 96, 256]
    - [49, 48.911]
  - - [6272, 256, 1, 528]
    - [4, 70.621]
  - - [3136, 2048, 1, 1024]
    - [4, 88.765]
  - - [6272, 112, 1, 512]
    - [4, 51.293]
  - - [2048, 320, 1, 1280]
    - [36, 70.268]
  - - [289, 256, 1, 1568]
    - [92, 20.582]
  - - [50176, 128, 1, 256]
    - [6, 73.948]
  - - [5329, 64, 1, 448]
    - [7, 36.823]
  - - [289, 192, 1, 1344]
    - [15, 14.741]
  - - [12544, 1024, 1, 256]
    - [6, 85.266]
  - - [784, 64, 32, 192]
    - [7, 31.841]
  - - [6272, 64, 1, 480]
    - [34, 45.943]
  - - [196, 128, 1, 800]
    - [92, 2.947]
  - - [64, 512, 1, 1344]
    - [16, 9.146]
  - - [6272, 64, 1, 512]
    - [34, 47.015]
  - - [6272, 160, 1, 528]
    - [82, 56.585]
  - - [289, 160, 32, 768]
    - [24, 58.395]
  - - [12544, 256, 1, 1024]
    - [29, 82.01]
  - - [289, 224, 1, 1568]
    - [19, 11.738]
  - - [5329, 64, 32, 160]
    - [6, 47.378]
  - - [5329, 96, 1, 576]
    - [7, 45.792]
  - - [3025, 64, 1, 363]
    - [21, 9.787]
  - - [784, 32, 32, 192]
    - [7, 17.971]
  - - [3136, 512, 1, 1024]
    - [4, 75.685]
  - - [6272, 16, 1, 480]
    - [13, 15.846]
  - - [1225, 64, 32, 288]
    - [6, 54.27]
  - - [64, 256, 1, 1536]
    - [14, 4.91]
  - - [289, 192, 32, 768]
    - [4, 64.15]
  - - [2048, 448, 1, 1280]
    - [36, 59.129]
  - - [3136, 2048, 1, 512]
    - [4, 86.359]
  - - [289, 256, 1, 2016]
    - [19, 21.824]
  - - [289, 384, 32, 1024]
    - [4, 76.401]
  - - [1568, 32, 1, 832]
    - [15, 11.334]
  - - [3136, 64, 32, 64]
    - [7, 37.727]
  - - [289, 160, 1, 1120]
    - [19, 6.979]
  - - [6272, 128, 1, 528]
    - [4, 58.96]
  - - [21609, 32, 1, 288]
    - [33, 35.899]
  - - [1225, 192, 1, 1728]
    - [10, 39.475]
  - - [4096, 512, 1, 4096]
    - [4, 85.249]
  - - [64, 256, 1, 1152]
    - [17, 4.384]
  - - [6272, 96, 1, 480]
    - [36, 53.162]
  - - [784, 96, 1, 800]
    - [19, 8.513]
  - - [2048, 448, 1, 2048]
    - [36, 64.88]
  - - [784, 96, 32, 192]
    - [7, 50.216]
  - - [289, 224, 1, 1344]
    - [19, 17.122]
  - - [1001, 512, 1, 4096]
    - [36, 60.528]
  - - [2048, 192, 1, 1280]
    - [10, 60.811]
  - - [1225, 64, 32, 256]
    - [6, 49.817]
  - - [2048, 256, 1, 1536]
    - [7, 58.16]
  - - [1225, 64, 1, 1200]
    - [15, 11.129]
  - - [6272, 128, 1, 512]
    - [4, 57.887]
  - - [729, 192, 1, 1600]
    - [30, 23.697]
  - - [289, 192, 1, 896]
    - [97, 12.588]
  - - [1568, 384, 1, 832]
    - [36, 59.1]
  - - [784, 16, 32, 192]
    - [38, 19.512]
  - - [1568, 256, 1, 832]
    - [10, 54.334]
  - - [1568, 48, 1, 832]
    - [45, 15.944]
  - - [1568, 192, 1, 832]
    - [10, 41.963]
  - - [289, 192, 32, 1024]
    - [4, 66.081]
  - - [6272, 32, 1, 528]
    - [36, 13.927]
  - - [49, 128, 1, 1200]
    - [17, 1.563]
  - - [1225, 64, 32, 384]
    - [6, 57.58]
  - - [289, 128, 1, 896]
    - [27, 8.585]
  - - [1568, 160, 1, 832]
    - [1, 36.46]
  - - [1001, 32, 1, 1024]
    - [27, 7.739]
  - - [2048, 320, 1, 2048]
    - [101, 73.764]
  - - [2048, 384, 1, 1536]
    - [105, 71.441]
  - - [50176, 512, 1, 256]
    - [6, 90.472]
  - - [289, 256, 1, 1792]
    - [45, 21.263]
  - - [64, 448, 1, 1152]
    - [19, 7.634]
  - - [5041, 96, 1, 576]
    - [7, 42.296]
  - - [6272, 192, 1, 480]
    - [4, 64.48]
  - - [784, 32, 32, 256]
    - [29, 22.403]
  - - [1001, 32, 1, 2048]
    - [20, 9.988]
  - - [289, 192, 1, 1120]
    - [19, 8.091]
  - - [6272, 32, 1, 512]
    - [7, 14.629]
  - - [289, 384, 1, 3456]
    - [30, 27.204]
  - - [289, 384, 1, 2592]
    - [24, 25.062]
  - - [12544, 1024, 1, 512]
    - [4, 90.804]
  - - [12544, 256, 1, 512]
    - [7, 78.078]
  - - [6272, 24, 1, 512]
    - [7, 10.456]
  - - [5041, 192, 1, 720]
    - [48, 45.71]
  - - [64, 320, 1, 1728]
    - [27, 6.379]
  - - [784, 128, 32, 256]
    - [4, 60.339]
  - - [289, 96, 1, 864]
    - [27, 6.43]
  - - [1225, 32, 32, 192]
    - [3, 31.011]
  - - [1568, 128, 1, 832]
    - [34, 21.655]
  - - [289, 128, 32, 768]
    - [4, 64.826]
  - - [196, 64, 1, 800]
    - [16, 2.724]
  - - [4096, 512, 1, 9216]
    - [4, 86.196]
  - - [12544, 64, 1, 147]
    - [107, 32.429]
  - - [784, 32, 1, 400]
    - [16, 3.325]
  - - [6272, 160, 1, 512]
    - [7, 61.257]
  - - [1225, 48, 32, 288]
    - [4, 43.923]
  - - [64, 320, 1, 2880]
    - [140, 6.995]
  - - [1225, 64, 32, 192]
    - [4, 45.605]
  - - [1001, 32, 1, 1536]
    - [20, 9.239]
  - - [784, 64, 32, 256]
    - [4, 48.492]
  - - [64, 384, 1, 1152]
    - [15, 3.764]
  - - [3136, 512, 1, 2048]
    - [51, 80.539]
  - - [6272, 144, 1, 512]
    - [7, 54.986]
  - - [1225, 192, 32, 384]
    - [6, 77.945]
  - - [64, 192, 1, 1728]
    - [16, 3.797]
  - - [8192, 320, 1, 1280]
    - [4, 86.509]
  - - [8192, 320, 1, 2048]
    - [4, 87.535]
  - - [8192, 384, 1, 1280]
    - [4, 88.777]
  - - [8192, 192, 1, 1280]
    - [29, 81.372]
  - - [8192, 192, 1, 2048]
    - [29, 83.912]
  - - [8192, 384, 1, 2048]
    - [5, 88.761]
  - - [8192, 448, 1, 2048]
    - [29, 85.819]
  - - [1001, 64, 1, 1536]
    - [92, 17.598]
  - - [8192, 448, 1, 1280]
    - [36, 84.681]
  - - [1001, 64, 1, 2048]
    - [19, 18.771]
  - - [1001, 128, 1, 2048]
    - [30, 24.612]
  - - [65, 6400, 1, 1024]
    - [37, 39.582]
  - - [256, 6400, 1, 4096]
    - [35, 84.977]
  - - [1024, 64, 1, 4096]
    - [45, 23.674]
  - - [2048, 174, 1, 512]
    - [10, 39.342]
  - - [2048, 189, 1, 512]
    - [7, 42.328]
  - - [64, 10, 448, 10]
    - [84, 1.185]
  - - [64, 18, 648, 18]
    - [94, 1.703]
  - - [64, 18, 1720, 18]
    - [5, 3.388]
  - - [64, 19, 1632, 19]
    - [9, 5.429]
  - - [64, 21, 1472, 21]
    - [4, 6.179]
  - - [64, 23, 64, 23]
    - [9, 1.191]
  - - [64, 26, 56, 26]
    - [9, 1.255]
  - - [64, 35, 904, 35]
    - [4, 12.008]
  - - [64, 103, 16, 103]
    - [2, 4.848]
  - - [64, 104, 16, 103]
    - [93, 4.847]
  - - [64, 123, 16, 112]
    - [11, 6.622]
  - - [64, 123, 16, 123]
    - [1, 2.466]
  - - [512, 1290, 1, 2048]
    - [30, 75.352]
  - - [512, 2205, 1, 2048]
    - [4, 72.713]
  - - [512, 3433, 1, 2048]
    - [7, 76.805]
  - - [512, 3439, 1, 2048]
    - [7, 76.624]
  - - [512, 3461, 1, 2048]
    - [7, 76.69]
  - - [512, 3479, 1, 2048]
    - [36, 77.127]
  - - [512, 3494, 1, 2048]
    - [10, 77.396]
  - - [512, 3520, 1, 2048]
    - [36, 77.62]
  - - [512, 3530, 1, 2048]
    - [26, 78.058]
  - - [512, 3541, 1, 2048]
    - [26, 78.265]
  - - [512, 3564, 1, 2048]
    - [26, 78.48]
  - - [512, 3776, 1, 2048]
    - [5, 77.647]
  - - [512, 3859, 1, 512]
    - [7, 74.009]
  - - [512, 3925, 1, 2048]
    - [7, 85.552]
  - - [512, 3944, 1, 2048]
    - [4, 80.962]
  - - [512, 3955, 1, 2048]
    - [4, 81.259]
  - - [512, 3969, 1, 2048]
    - [4, 81.652]
  - - [512, 3976, 1, 2048]
    - [4, 81.726]
  - - [2048, 1232, 1, 512]
    - [4, 76.003]
  - - [2048, 3165, 1, 512]
    - [5, 85.124]
  - - [64, 512, 16, 512]
    - [36, 45.65]
  - - [1024, 1, 1, 2]
    - [96, 0.0]
  - - [1024, 1, 1, 1024]
    - [27, 0.191]
  - - [512, 540, 1, 512]
    - [37, 32.219]
  - - [512, 540, 1, 2048]
    - [10, 45.978]
  - - [512, 550, 1, 512]
    - [30, 18.738]
  - - [512, 550, 1, 2048]
    - [10, 47.428]
  - - [512, 560, 1, 512]
    - [30, 18.584]
  - - [512, 560, 1, 2048]
    - [10, 47.94]
  - - [512, 600, 1, 2048]
    - [10, 51.928]
  - - [512, 644, 1, 512]
    - [37, 38.041]
  - - [512, 644, 1, 2048]
    - [10, 56.461]
  - - [512, 668, 1, 2048]
    - [10, 57.29]
  - - [512, 714, 1, 512]
    - [34, 41.758]
  - - [512, 714, 1, 2048]
    - [30, 61.458]
  - - [512, 720, 1, 512]
    - [7, 41.9]
  - - [512, 720, 1, 2048]
    - [10, 62.087]
  - - [512, 722, 1, 2048]
    - [30, 62.033]
  - - [512, 781, 1, 512]
    - [30, 24.734]
  - - [512, 781, 1, 2048]
    - [10, 67.593]
  - - [512, 848, 1, 2048]
    - [10, 72.332]
  - - [512, 872, 1, 2048]
    - [30, 52.359]
  - - [512, 936, 1, 512]
    - [7, 41.885]
  - - [512, 936, 1, 2048]
    - [30, 55.636]
  - - [512, 980, 1, 512]
    - [7, 43.362]
  - - [512, 980, 1, 2048]
    - [30, 58.033]
  - - [512, 1139, 1, 2048]
    - [30, 66.862]
  - - [512, 1184, 1, 2048]
    - [10, 70.377]
  - - [512, 1186, 1, 2048]
    - [10, 69.448]
  - - [512, 1232, 1, 512]
    - [7, 54.923]
  - - [512, 1232, 1, 2048]
    - [10, 71.786]
  - - [512, 1279, 1, 2048]
    - [30, 74.524]
  - - [512, 1290, 1, 512]
    - [7, 56.029]
  - - [512, 1327, 1, 2048]
    - [4, 62.77]
  - - [512, 1331, 1, 2048]
    - [4, 62.646]
  - - [512, 1341, 1, 2048]
    - [4, 62.866]
  - - [512, 1350, 1, 512]
    - [4, 50.954]
  - - [512, 1350, 1, 2048]
    - [4, 63.986]
  - - [512, 1359, 1, 2048]
    - [4, 64.542]
  - - [512, 1391, 1, 2048]
    - [4, 65.732]
  - - [512, 1424, 1, 512]
    - [4, 53.406]
  - - [512, 1424, 1, 2048]
    - [4, 67.698]
  - - [512, 1458, 1, 512]
    - [4, 53.492]
  - - [512, 1458, 1, 2048]
    - [4, 68.351]
  - - [512, 1462, 1, 512]
    - [4, 53.144]
  - - [512, 1462, 1, 2048]
    - [4, 68.607]
  - - [512, 1467, 1, 2048]
    - [4, 67.964]
  - - [512, 1472, 1, 2048]
    - [41, 71.343]
  - - [512, 1520, 1, 512]
    - [4, 55.595]
  - - [512, 1520, 1, 2048]
    - [4, 71.471]
  - - [512, 1596, 1, 512]
    - [4, 57.66]
  - - [512, 1596, 1, 2048]
    - [4, 74.086]
  - - [512, 1599, 1, 512]
    - [4, 57.769]
  - - [512, 1599, 1, 2048]
    - [4, 74.08]
  - - [512, 1615, 1, 512]
    - [41, 40.747]
  - - [512, 1615, 1, 2048]
    - [25, 71.366]
  - - [512, 1680, 1, 512]
    - [29, 41.24]
  - - [512, 1680, 1, 2048]
    - [26, 63.119]
  - - [512, 1709, 1, 2048]
    - [65, 63.323]
  - - [512, 1890, 1, 512]
    - [7, 58.451]
  - - [512, 1902, 1, 2048]
    - [30, 71.333]
  - - [512, 1917, 1, 512]
    - [7, 57.48]
  - - [512, 1917, 1, 2048]
    - [7, 72.297]
  - - [512, 2076, 1, 2048]
    - [7, 77.735]
  - - [512, 2195, 1, 2048]
    - [4, 72.485]
  - - [512, 2205, 1, 512]
    - [7, 60.581]
  - - [512, 2387, 1, 512]
    - [4, 65.428]
  - - [512, 2418, 1, 512]
    - [4, 66.278]
  - - [512, 2418, 1, 2048]
    - [4, 78.802]
  - - [512, 2496, 1, 512]
    - [36, 50.684]
  - - [512, 2496, 1, 2048]
    - [108, 81.739]
  - - [512, 2790, 1, 2048]
    - [7, 77.326]
  - - [512, 2864, 1, 2048]
    - [29, 78.64]
  - - [512, 3092, 1, 2048]
    - [4, 78.177]
  - - [512, 3113, 1, 2048]
    - [4, 78.456]
  - - [512, 3137, 1, 2048]
    - [4, 79.742]
  - - [512, 3165, 1, 2048]
    - [4, 80.281]
  - - [512, 3166, 1, 2048]
    - [4, 80.134]
  - - [512, 3194, 1, 2048]
    - [4, 80.241]
  - - [512, 3219, 1, 2048]
    - [4, 81.607]
  - - [512, 3222, 1, 2048]
    - [4, 81.464]
  - - [512, 3234, 1, 2048]
    - [4, 81.636]
  - - [512, 3237, 1, 2048]
    - [4, 81.581]
  - - [512, 3242, 1, 2048]
    - [4, 82.014]
  - - [512, 3246, 1, 2048]
    - [4, 81.852]
  - - [512, 3249, 1, 2048]
    - [4, 81.84]
  - - [512, 3251, 1, 2048]
    - [4, 81.63]
  - - [512, 3257, 1, 2048]
    - [4, 81.693]
  - - [512, 3262, 1, 2048]
    - [4, 81.689]
  - - [512, 3268, 1, 2048]
    - [10, 73.128]
  - - [512, 3282, 1, 2048]
    - [4, 82.848]
  - - [512, 3286, 1, 2048]
    - [4, 82.684]
  - - [512, 3287, 1, 2048]
    - [4, 82.797]
  - - [512, 3293, 1, 2048]
    - [4, 82.904]
  - - [512, 3297, 1, 2048]
    - [36, 74.187]
  - - [512, 3307, 1, 2048]
    - [36, 73.968]
  - - [512, 3314, 1, 2048]
    - [7, 73.903]
  - - [512, 3315, 1, 2048]
    - [29, 74.184]
  - - [512, 3319, 1, 2048]
    - [7, 74.698]
  - - [512, 3322, 1, 2048]
    - [29, 73.908]
  - - [512, 3323, 1, 2048]
    - [29, 73.889]
  - - [512, 3324, 1, 2048]
    - [36, 74.423]
  - - [512, 3325, 1, 2048]
    - [36, 74.627]
  - - [512, 3327, 1, 2048]
    - [29, 74.609]
  - - [512, 3329, 1, 2048]
    - [29, 74.422]
  - - [512, 3332, 1, 2048]
    - [7, 74.496]
  - - [512, 3336, 1, 2048]
    - [7, 74.828]
  - - [512, 3339, 1, 2048]
    - [7, 74.982]
  - - [512, 3342, 1, 2048]
    - [36, 74.212]
  - - [512, 3344, 1, 2048]
    - [29, 74.391]
  - - [512, 3358, 1, 2048]
    - [36, 74.449]
  - - [512, 3360, 1, 2048]
    - [7, 74.949]
  - - [512, 3364, 1, 2048]
    - [7, 75.386]
  - - [512, 3365, 1, 2048]
    - [29, 75.381]
  - - [512, 3369, 1, 2048]
    - [7, 74.922]
  - - [512, 3370, 1, 2048]
    - [7, 74.688]
  - - [512, 3371, 1, 2048]
    - [7, 75.018]
  - - [512, 3374, 1, 2048]
    - [10, 74.979]
  - - [512, 3376, 1, 2048]
    - [29, 74.983]
  - - [512, 3377, 1, 2048]
    - [36, 74.883]
  - - [512, 3378, 1, 2048]
    - [7, 74.411]
  - - [512, 3381, 1, 2048]
    - [7, 75.053]
  - - [512, 3382, 1, 2048]
    - [36, 74.954]
  - - [512, 3383, 1, 2048]
    - [36, 75.812]
  - - [512, 3384, 1, 2048]
    - [7, 75.451]
  - - [512, 3385, 1, 2048]
    - [7, 75.642]
  - - [512, 3386, 1, 2048]
    - [7, 75.866]
  - - [512, 3388, 1, 2048]
    - [29, 75.384]
  - - [512, 3390, 1, 2048]
    - [29, 75.296]
  - - [512, 3391, 1, 2048]
    - [36, 75.863]
  - - [512, 3396, 1, 2048]
    - [36, 75.64]
  - - [512, 3399, 1, 2048]
    - [7, 75.836]
  - - [512, 3402, 1, 2048]
    - [29, 75.899]
  - - [512, 3410, 1, 2048]
    - [7, 75.882]
  - - [512, 3412, 1, 2048]
    - [7, 75.481]
  - - [512, 3414, 1, 2048]
    - [10, 75.569]
  - - [512, 3415, 1, 2048]
    - [7, 75.162]
  - - [512, 3418, 1, 2048]
    - [7, 75.574]
  - - [512, 3420, 1, 2048]
    - [36, 75.773]
  - - [512, 3422, 1, 2048]
    - [7, 76.467]
  - - [512, 3425, 1, 2048]
    - [7, 76.165]
  - - [512, 3426, 1, 2048]
    - [36, 76.181]
  - - [512, 3427, 1, 2048]
    - [10, 75.878]
  - - [512, 3428, 1, 2048]
    - [29, 76.143]
  - - [512, 3430, 1, 2048]
    - [29, 76.693]
  - - [512, 3431, 1, 2048]
    - [36, 75.765]
  - - [512, 3432, 1, 2048]
    - [7, 76.215]
  - - [512, 3438, 1, 2048]
    - [7, 76.147]
  - - [512, 3440, 1, 2048]
    - [7, 76.745]
  - - [512, 3443, 1, 2048]
    - [36, 76.623]
  - - [512, 3445, 1, 2048]
    - [7, 76.542]
  - - [512, 3447, 1, 2048]
    - [36, 76.202]
  - - [512, 3448, 1, 2048]
    - [10, 76.413]
  - - [512, 3450, 1, 2048]
    - [7, 76.051]
  - - [512, 3451, 1, 2048]
    - [10, 76.583]
  - - [512, 3452, 1, 2048]
    - [10, 76.702]
  - - [512, 3453, 1, 2048]
    - [7, 76.498]
  - - [512, 3455, 1, 2048]
    - [29, 77.053]
  - - [512, 3456, 1, 2048]
    - [10, 77.095]
  - - [512, 3457, 1, 2048]
    - [36, 76.823]
  - - [512, 3458, 1, 2048]
    - [10, 77.259]
  - - [512, 3459, 1, 2048]
    - [7, 77.309]
  - - [512, 3460, 1, 2048]
    - [29, 76.73]
  - - [512, 3462, 1, 2048]
    - [36, 76.928]
  - - [512, 3466, 1, 2048]
    - [7, 76.871]
  - - [512, 3467, 1, 2048]
    - [29, 76.943]
  - - [512, 3468, 1, 2048]
    - [7, 77.164]
  - - [512, 3470, 1, 2048]
    - [36, 76.885]
  - - [512, 3471, 1, 2048]
    - [10, 76.784]
  - - [512, 3472, 1, 2048]
    - [7, 77.283]
  - - [512, 3475, 1, 2048]
    - [36, 77.27]
  - - [512, 3476, 1, 2048]
    - [10, 76.894]
  - - [512, 3477, 1, 2048]
    - [4, 87.165]
  - - [512, 3478, 1, 2048]
    - [36, 77.473]
  - - [512, 3480, 1, 2048]
    - [29, 77.162]
  - - [512, 3481, 1, 2048]
    - [36, 77.159]
  - - [512, 3483, 1, 2048]
    - [7, 77.009]
  - - [512, 3484, 1, 2048]
    - [29, 77.283]
  - - [512, 3487, 1, 2048]
    - [7, 76.81]
  - - [512, 3489, 1, 2048]
    - [36, 76.82]
  - - [512, 3490, 1, 2048]
    - [36, 77.477]
  - - [512, 3491, 1, 2048]
    - [10, 77.531]
  - - [512, 3493, 1, 2048]
    - [7, 77.138]
  - - [512, 3495, 1, 2048]
    - [29, 77.609]
  - - [512, 3497, 1, 2048]
    - [29, 77.009]
  - - [512, 3498, 1, 2048]
    - [7, 77.381]
  - - [512, 3499, 1, 2048]
    - [7, 77.191]
  - - [512, 3501, 1, 2048]
    - [7, 77.21]
  - - [512, 3503, 1, 2048]
    - [36, 77.597]
  - - [512, 3505, 1, 2048]
    - [10, 77.812]
  - - [512, 3507, 1, 2048]
    - [7, 77.193]
  - - [512, 3508, 1, 2048]
    - [36, 77.796]
  - - [512, 3509, 1, 2048]
    - [36, 78.122]
  - - [512, 3510, 1, 2048]
    - [29, 78.11]
  - - [512, 3511, 1, 2048]
    - [10, 77.798]
  - - [512, 3513, 1, 2048]
    - [36, 77.979]
  - - [512, 3514, 1, 2048]
    - [36, 78.131]
  - - [512, 3515, 1, 2048]
    - [29, 77.871]
  - - [512, 3517, 1, 2048]
    - [10, 77.916]
  - - [512, 3518, 1, 2048]
    - [36, 77.551]
  - - [512, 3519, 1, 2048]
    - [7, 77.783]
  - - [512, 3523, 1, 2048]
    - [26, 78.013]
  - - [512, 3528, 1, 2048]
    - [26, 78.124]
  - - [512, 3529, 1, 2048]
    - [26, 78.109]
  - - [512, 3531, 1, 2048]
    - [26, 78.007]
  - - [512, 3532, 1, 2048]
    - [26, 77.993]
  - - [512, 3533, 1, 2048]
    - [26, 78.235]
  - - [512, 3534, 1, 2048]
    - [26, 77.965]
  - - [512, 3538, 1, 2048]
    - [26, 78.053]
  - - [512, 3539, 1, 2048]
    - [7, 77.857]
  - - [512, 3540, 1, 2048]
    - [26, 78.206]
  - - [512, 3547, 1, 2048]
    - [26, 78.288]
  - - [512, 3548, 1, 2048]
    - [7, 78.339]
  - - [512, 3552, 1, 2048]
    - [36, 78.523]
  - - [512, 3575, 1, 2048]
    - [7, 78.576]
  - - [512, 3598, 1, 2048]
    - [7, 78.934]
  - - [512, 3599, 1, 2048]
    - [7, 78.956]
  - - [512, 3608, 1, 2048]
    - [117, 80.594]
  - - [512, 3776, 1, 512]
    - [7, 73.491]
  - - [512, 3780, 1, 512]
    - [7, 72.143]
  - - [512, 3780, 1, 2048]
    - [4, 78.419]
  - - [512, 3780, 1, 33708]
    - [109, 88.374]
  - - [512, 3796, 1, 512]
    - [7, 72.919]
  - - [512, 3796, 1, 2048]
    - [4, 79.114]
  - - [512, 3796, 1, 33708]
    - [109, 88.714]
  - - [512, 3822, 1, 512]
    - [7, 72.36]
  - - [512, 3822, 1, 2048]
    - [4, 79.082]
  - - [512, 3822, 1, 33708]
    - [109, 89.287]
  - - [512, 3835, 1, 512]
    - [36, 73.074]
  - - [512, 3835, 1, 2048]
    - [4, 79.875]
  - - [512, 3840, 1, 512]
    - [7, 73.169]
  - - [512, 3840, 1, 2048]
    - [4, 80.369]
  - - [512, 3840, 1, 33708]
    - [109, 90.024]
  - - [512, 3859, 1, 2048]
    - [4, 79.465]
  - - [512, 3859, 1, 33708]
    - [109, 90.368]
  - - [512, 3864, 1, 512]
    - [7, 72.805]
  - - [512, 3864, 1, 2048]
    - [4, 79.984]
  - - [512, 3870, 1, 512]
    - [7, 73.034]
  - - [512, 3870, 1, 2048]
    - [4, 80.432]
  - - [512, 3870, 1, 33708]
    - [109, 90.807]
  - - [512, 3876, 1, 512]
    - [7, 73.382]
  - - [512, 3876, 1, 2048]
    - [4, 80.019]
  - - [512, 3876, 1, 33708]
    - [109, 90.888]
  - - [512, 3906, 1, 512]
    - [7, 74.188]
  - - [512, 3906, 1, 2048]
    - [7, 84.864]
  - - [512, 3906, 1, 33708]
    - [109, 84.95]
  - - [512, 3910, 1, 512]
    - [7, 74.144]
  - - [512, 3910, 1, 2048]
    - [7, 85.107]
  - - [512, 3910, 1, 33708]
    - [109, 91.543]
  - - [512, 3925, 1, 512]
    - [7, 73.836]
  - - [512, 3925, 1, 33708]
    - [109, 91.957]
  - - [512, 3927, 1, 512]
    - [7, 74.228]
  - - [512, 3942, 1, 512]
    - [4, 71.536]
  - - [512, 3942, 1, 2048]
    - [4, 80.992]
  - - [512, 3942, 1, 33708]
    - [109, 85.675]
  - - [512, 3944, 1, 512]
    - [4, 71.244]
  - - [512, 3944, 1, 33708]
    - [109, 85.721]
  - - [512, 3955, 1, 512]
    - [4, 71.993]
  - - [512, 3955, 1, 33708]
    - [109, 85.936]
  - - [512, 3968, 1, 512]
    - [4, 73.131]
  - - [512, 3968, 1, 2048]
    - [4, 81.632]
  - - [512, 3968, 1, 33708]
    - [109, 86.211]
  - - [512, 3969, 1, 512]
    - [4, 71.805]
  - - [512, 3969, 1, 33708]
    - [109, 86.277]
  - - [512, 3976, 1, 512]
    - [4, 72.824]
  - - [512, 3976, 1, 33708]
    - [109, 86.383]
  - - [512, 3977, 1, 512]
    - [4, 72.505]
  - - [512, 3977, 1, 2048]
    - [4, 81.888]
  - - [512, 3977, 1, 33708]
    - [109, 86.349]
  - - [512, 3978, 1, 512]
    - [4, 72.189]
  - - [512, 3978, 1, 2048]
    - [4, 82.088]
  - - [512, 3978, 1, 33708]
    - [109, 86.395]
  - - [512, 3990, 1, 512]
    - [4, 72.742]
  - - [512, 3990, 1, 2048]
    - [4, 82.3]
  - - [512, 3990, 1, 33708]
    - [109, 86.706]
  - - [512, 3995, 1, 512]
    - [4, 72.499]
  - - [512, 3995, 1, 2048]
    - [4, 82.08]
  - - [512, 3995, 1, 33708]
    - [109, 86.75]
  - - [512, 3996, 1, 512]
    - [4, 72.852]
  - - [512, 3996, 1, 2048]
    - [4, 82.173]
  - - [512, 3996, 1, 33708]
    - [109, 86.672]
  - - [512, 3999, 1, 512]
    - [4, 72.571]
  - - [512, 3999, 1, 2048]
    - [4, 82.091]
  - - [512, 3999, 1, 33708]
    - [109, 86.861]
  - - [512, 4005, 1, 512]
    - [4, 72.903]
  - - [512, 4005, 1, 2048]
    - [4, 82.25]
  - - [512, 4005, 1, 33708]
    - [109, 87.079]
  - - [512, 4012, 1, 512]
    - [4, 72.918]
  - - [512, 4012, 1, 2048]
    - [4, 82.286]
  - - [512, 4012, 1, 33708]
    - [109, 87.168]
  - - [512, 4020, 1, 512]
    - [4, 72.617]
  - - [512, 4020, 1, 2048]
    - [4, 82.201]
  - - [512, 4020, 1, 33708]
    - [109, 87.354]
  - - [512, 4026, 1, 512]
    - [4, 72.503]
  - - [512, 4026, 1, 2048]
    - [4, 82.359]
  - - [512, 4026, 1, 33708]
    - [109, 87.562]
  - - [512, 4030, 1, 512]
    - [4, 72.355]
  - - [512, 4030, 1, 2048]
    - [4, 82.263]
  - - [512, 4030, 1, 33708]
    - [109, 87.647]
  - - [512, 4032, 1, 512]
    - [4, 73.736]
  - - [512, 4032, 1, 2048]
    - [4, 82.805]
  - - [512, 4032, 1, 33708]
    - [109, 87.693]
  - - [512, 4050, 1, 512]
    - [4, 73.609]
  - - [512, 4059, 1, 512]
    - [4, 73.772]
  - - [2048, 160, 1, 512]
    - [101, 38.38]
  - - [2048, 184, 1, 512]
    - [10, 41.014]
  - - [2048, 198, 1, 512]
    - [7, 36.126]
  - - [2048, 207, 1, 512]
    - [7, 37.768]
  - - [2048, 208, 1, 512]
    - [7, 38.245]
  - - [2048, 245, 1, 512]
    - [7, 43.039]
  - - [2048, 246, 1, 512]
    - [7, 42.896]
  - - [2048, 264, 1, 512]
    - [36, 46.55]
  - - [2048, 401, 1, 512]
    - [7, 56.397]
  - - [2048, 439, 1, 512]
    - [7, 54.165]
  - - [2048, 443, 1, 512]
    - [7, 53.816]
  - - [2048, 446, 1, 512]
    - [36, 54.742]
  - - [2048, 465, 1, 512]
    - [7, 56.343]
  - - [2048, 468, 1, 512]
    - [7, 56.998]
  - - [2048, 493, 1, 512]
    - [7, 58.388]
  - - [2048, 495, 1, 512]
    - [7, 59.979]
  - - [2048, 511, 1, 512]
    - [7, 61.444]
  - - [2048, 512, 1, 512]
    - [7, 62.519]
  - - [2048, 540, 1, 512]
    - [7, 64.766]
  - - [2048, 550, 1, 512]
    - [4, 60.867]
  - - [2048, 560, 1, 512]
    - [4, 61.975]
  - - [2048, 600, 1, 512]
    - [29, 46.856]
  - - [2048, 644, 1, 512]
    - [7, 60.987]
  - - [2048, 668, 1, 512]
    - [36, 62.138]
  - - [2048, 714, 1, 512]
    - [7, 67.615]
  - - [2048, 720, 1, 512]
    - [7, 66.976]
  - - [2048, 722, 1, 512]
    - [7, 66.899]
  - - [2048, 781, 1, 512]
    - [7, 54.259]
  - - [2048, 848, 1, 512]
    - [7, 70.179]
  - - [2048, 872, 1, 512]
    - [7, 67.663]
  - - [2048, 936, 1, 512]
    - [7, 71.687]
  - - [2048, 980, 1, 512]
    - [5, 70.919]
  - - [2048, 1139, 1, 512]
    - [7, 73.031]
  - - [2048, 1184, 1, 512]
    - [7, 76.435]
  - - [2048, 1186, 1, 512]
    - [4, 73.261]
  - - [2048, 1279, 1, 512]
    - [4, 77.986]
  - - [2048, 1290, 1, 512]
    - [7, 76.486]
  - - [2048, 1327, 1, 512]
    - [7, 74.123]
  - - [2048, 1331, 1, 512]
    - [7, 74.434]
  - - [2048, 1341, 1, 512]
    - [29, 74.203]
  - - [2048, 1350, 1, 512]
    - [7, 75.407]
  - - [2048, 1359, 1, 512]
    - [7, 75.376]
  - - [2048, 1391, 1, 512]
    - [7, 77.332]
  - - [2048, 1424, 1, 512]
    - [5, 77.169]
  - - [2048, 1458, 1, 512]
    - [4, 78.293]
  - - [2048, 1462, 1, 512]
    - [5, 78.065]
  - - [2048, 1467, 1, 512]
    - [5, 78.509]
  - - [2048, 1472, 1, 512]
    - [4, 79.497]
  - - [2048, 1520, 1, 512]
    - [4, 80.979]
  - - [2048, 1596, 1, 512]
    - [7, 77.672]
  - - [2048, 1599, 1, 512]
    - [7, 78.464]
  - - [2048, 1615, 1, 512]
    - [7, 78.677]
  - - [2048, 1680, 1, 512]
    - [4, 79.868]
  - - [2048, 1709, 1, 512]
    - [5, 81.328]
  - - [2048, 1902, 1, 512]
    - [4, 81.857]
  - - [2048, 1917, 1, 512]
    - [4, 82.204]
  - - [2048, 2076, 1, 512]
    - [36, 82.231]
  - - [2048, 2195, 1, 512]
    - [4, 80.407]
  - - [2048, 2205, 1, 512]
    - [4, 80.586]
  - - [2048, 2418, 1, 512]
    - [4, 81.21]
  - - [2048, 2496, 1, 512]
    - [5, 83.121]
  - - [2048, 2790, 1, 512]
    - [5, 85.891]
  - - [2048, 2864, 1, 512]
    - [5, 83.491]
  - - [2048, 3092, 1, 512]
    - [4, 84.118]
  - - [2048, 3113, 1, 512]
    - [5, 84.398]
  - - [2048, 3137, 1, 512]
    - [5, 85.293]
  - - [2048, 3166, 1, 512]
    - [4, 85.394]
  - - [2048, 3194, 1, 512]
    - [5, 86.297]
  - - [2048, 3219, 1, 512]
    - [5, 86.626]
  - - [2048, 3222, 1, 512]
    - [5, 86.954]
  - - [2048, 3234, 1, 512]
    - [5, 86.881]
  - - [2048, 3237, 1, 512]
    - [4, 86.519]
  - - [2048, 3242, 1, 512]
    - [5, 87.095]
  - - [2048, 3246, 1, 512]
    - [4, 86.907]
  - - [2048, 3249, 1, 512]
    - [5, 87.284]
  - - [2048, 3251, 1, 512]
    - [4, 87.139]
  - - [2048, 3257, 1, 512]
    - [5, 87.399]
  - - [2048, 3262, 1, 512]
    - [5, 87.484]
  - - [2048, 3268, 1, 512]
    - [36, 84.204]
  - - [2048, 3282, 1, 512]
    - [7, 84.75]
  - - [2048, 3286, 1, 512]
    - [7, 84.668]
  - - [2048, 3287, 1, 512]
    - [7, 84.648]
  - - [2048, 3293, 1, 512]
    - [7, 84.802]
  - - [2048, 3297, 1, 512]
    - [4, 84.49]
  - - [2048, 3307, 1, 512]
    - [5, 85.024]
  - - [2048, 3314, 1, 512]
    - [5, 84.972]
  - - [2048, 3315, 1, 512]
    - [4, 84.448]
  - - [2048, 3319, 1, 512]
    - [4, 85.378]
  - - [2048, 3322, 1, 512]
    - [5, 85.178]
  - - [2048, 3323, 1, 512]
    - [5, 85.249]
  - - [2048, 3324, 1, 512]
    - [4, 84.906]
  - - [2048, 3325, 1, 512]
    - [4, 85.162]
  - - [2048, 3327, 1, 512]
    - [4, 85.121]
  - - [2048, 3329, 1, 512]
    - [4, 85.264]
  - - [2048, 3332, 1, 512]
    - [5, 85.11]
  - - [2048, 3336, 1, 512]
    - [4, 85.167]
  - - [2048, 3339, 1, 512]
    - [5, 85.382]
  - - [2048, 3342, 1, 512]
    - [5, 85.366]
  - - [2048, 3344, 1, 512]
    - [5, 85.371]
  - - [2048, 3358, 1, 512]
    - [5, 85.59]
  - - [2048, 3360, 1, 512]
    - [5, 85.826]
  - - [2048, 3364, 1, 512]
    - [4, 85.604]
  - - [2048, 3365, 1, 512]
    - [4, 85.675]
  - - [2048, 3369, 1, 512]
    - [4, 85.823]
  - - [2048, 3370, 1, 512]
    - [4, 85.435]
  - - [2048, 3371, 1, 512]
    - [5, 86.014]
  - - [2048, 3374, 1, 512]
    - [4, 85.766]
  - - [2048, 3376, 1, 512]
    - [5, 86.234]
  - - [2048, 3377, 1, 512]
    - [5, 86.167]
  - - [2048, 3378, 1, 512]
    - [5, 86.192]
  - - [2048, 3381, 1, 512]
    - [5, 86.315]
  - - [2048, 3382, 1, 512]
    - [5, 86.388]
  - - [2048, 3383, 1, 512]
    - [5, 86.273]
  - - [2048, 3384, 1, 512]
    - [5, 86.532]
  - - [2048, 3385, 1, 512]
    - [5, 85.953]
  - - [2048, 3386, 1, 512]
    - [5, 86.35]
  - - [2048, 3388, 1, 512]
    - [5, 86.122]
  - - [2048, 3390, 1, 512]
    - [4, 86.592]
  - - [2048, 3391, 1, 512]
    - [5, 86.152]
  - - [2048, 3396, 1, 512]
    - [4, 86.279]
  - - [2048, 3399, 1, 512]
    - [5, 86.588]
  - - [2048, 3402, 1, 512]
    - [4, 86.338]
  - - [2048, 3410, 1, 512]
    - [5, 86.728]
  - - [2048, 3412, 1, 512]
    - [5, 86.966]
  - - [2048, 3414, 1, 512]
    - [5, 86.69]
  - - [2048, 3415, 1, 512]
    - [5, 87.042]
  - - [2048, 3418, 1, 512]
    - [5, 86.745]
  - - [2048, 3420, 1, 512]
    - [5, 87.17]
  - - [2048, 3422, 1, 512]
    - [5, 87.174]
  - - [2048, 3425, 1, 512]
    - [5, 86.876]
  - - [2048, 3426, 1, 512]
    - [4, 86.948]
  - - [2048, 3427, 1, 512]
    - [4, 87.02]
  - - [2048, 3428, 1, 512]
    - [5, 87.232]
  - - [2048, 3430, 1, 512]
    - [5, 87.283]
  - - [2048, 3431, 1, 512]
    - [5, 87.309]
  - - [2048, 3432, 1, 512]
    - [5, 87.335]
  - - [2048, 3433, 1, 512]
    - [5, 87.36]
  - - [2048, 3438, 1, 512]
    - [5, 86.74]
  - - [2048, 3439, 1, 512]
    - [5, 87.559]
  - - [2048, 3440, 1, 512]
    - [4, 87.209]
  - - [2048, 3443, 1, 512]
    - [5, 87.379]
  - - [2048, 3445, 1, 512]
    - [5, 87.477]
  - - [2048, 3447, 1, 512]
    - [5, 87.858]
  - - [2048, 3448, 1, 512]
    - [4, 87.085]
  - - [2048, 3450, 1, 512]
    - [4, 87.557]
  - - [2048, 3451, 1, 512]
    - [4, 87.394]
  - - [2048, 3452, 1, 512]
    - [5, 87.938]
  - - [2048, 3453, 1, 512]
    - [5, 87.916]
  - - [2048, 3455, 1, 512]
    - [5, 87.684]
  - - [2048, 3456, 1, 512]
    - [6, 87.756]
  - - [2048, 3457, 1, 512]
    - [6, 87.829]
  - - [2048, 3458, 1, 512]
    - [5, 87.807]
  - - [2048, 3459, 1, 512]
    - [5, 87.88]
  - - [2048, 3460, 1, 512]
    - [5, 87.716]
  - - [2048, 3461, 1, 512]
    - [6, 87.46]
  - - [2048, 3462, 1, 512]
    - [6, 87.72]
  - - [2048, 3466, 1, 512]
    - [5, 87.587]
  - - [2048, 3467, 1, 512]
    - [5, 87.705]
  - - [2048, 3468, 1, 512]
    - [5, 87.496]
  - - [2048, 3470, 1, 512]
    - [5, 87.923]
  - - [2048, 3471, 1, 512]
    - [5, 88.089]
  - - [2048, 3472, 1, 512]
    - [5, 87.879]
  - - [2048, 3475, 1, 512]
    - [5, 88.238]
  - - [2048, 3476, 1, 512]
    - [5, 87.839]
  - - [2048, 3477, 1, 512]
    - [5, 88.053]
  - - [2048, 3478, 1, 512]
    - [5, 88.173]
  - - [2048, 3479, 1, 512]
    - [5, 88.104]
  - - [2048, 3480, 1, 512]
    - [5, 88.318]
  - - [2048, 3481, 1, 512]
    - [5, 88.201]
  - - [2048, 3483, 1, 512]
    - [5, 88.205]
  - - [2048, 3484, 1, 512]
    - [5, 88.041]
  - - [2048, 3487, 1, 512]
    - [4, 87.742]
  - - [2048, 3489, 1, 512]
    - [5, 88.074]
  - - [2048, 3490, 1, 512]
    - [5, 88.429]
  - - [2048, 3491, 1, 512]
    - [5, 88.077]
  - - [2048, 3493, 1, 512]
    - [5, 88.553]
  - - [2048, 3494, 1, 512]
    - [5, 88.436]
  - - [2048, 3495, 1, 512]
    - [5, 88.178]
  - - [2048, 3497, 1, 512]
    - [5, 88.323]
  - - [2048, 3498, 1, 512]
    - [5, 88.442]
  - - [2048, 3501, 1, 512]
    - [5, 88.376]
  - - [2048, 3503, 1, 512]
    - [5, 88.616]
  - - [2048, 3505, 1, 512]
    - [5, 88.383]
  - - [2048, 3507, 1, 512]
    - [5, 88.575]
  - - [2048, 3508, 1, 512]
    - [5, 88.223]
  - - [2048, 3509, 1, 512]
    - [5, 88.295]
  - - [2048, 3510, 1, 512]
    - [5, 88.509]
  - - [2048, 3511, 1, 512]
    - [5, 89.009]
  - - [2048, 3513, 1, 512]
    - [4, 88.349]
  - - [2048, 3514, 1, 512]
    - [5, 87.86]
  - - [2048, 3515, 1, 512]
    - [5, 88.493]
  - - [2048, 3517, 1, 512]
    - [5, 88.544]
  - - [2048, 3518, 1, 512]
    - [5, 88.334]
  - - [2048, 3519, 1, 512]
    - [5, 88.641]
  - - [2048, 3520, 1, 512]
    - [6, 88.904]
  - - [2048, 3523, 1, 512]
    - [5, 84.982]
  - - [2048, 3528, 1, 512]
    - [5, 85.19]
  - - [2048, 3529, 1, 512]
    - [5, 85.432]
  - - [2048, 3530, 1, 512]
    - [5, 85.108]
  - - [2048, 3531, 1, 512]
    - [4, 85.219]
  - - [2048, 3532, 1, 512]
    - [4, 84.853]
  - - [2048, 3533, 1, 512]
    - [5, 81.654]
  - - [2048, 3534, 1, 512]
    - [5, 85.554]
  - - [2048, 3538, 1, 512]
    - [4, 85.214]
  - - [2048, 3539, 1, 512]
    - [5, 85.455]
  - - [2048, 3540, 1, 512]
    - [5, 85.045]
  - - [2048, 3541, 1, 512]
    - [4, 85.416]
  - - [2048, 3547, 1, 512]
    - [4, 85.43]
  - - [2048, 3548, 1, 512]
    - [5, 85.324]
  - - [2048, 3552, 1, 512]
    - [5, 85.42]
  - - [2048, 3564, 1, 512]
    - [5, 85.752]
  - - [2048, 3575, 1, 512]
    - [5, 85.886]
  - - [2048, 3598, 1, 512]
    - [5, 86.526]
  - - [2048, 3599, 1, 512]
    - [4, 86.727]
  - - [2048, 3608, 1, 512]
    - [5, 86.546]
  - - [2048, 3776, 1, 512]
    - [5, 86.661]
  - - [2048, 3780, 1, 512]
    - [5, 86.543]
  - - [2048, 3796, 1, 512]
    - [5, 86.616]
  - - [2048, 3822, 1, 512]
    - [5, 87.335]
  - - [2048, 3835, 1, 512]
    - [5, 87.421]
  - - [2048, 3840, 1, 512]
    - [5, 87.831]
  - - [2048, 3859, 1, 512]
    - [5, 87.378]
  - - [2048, 3864, 1, 512]
    - [5, 87.87]
  - - [2048, 3870, 1, 512]
    - [5, 87.964]
  - - [2048, 3876, 1, 512]
    - [5, 88.186]
  - - [2048, 3906, 1, 512]
    - [4, 85.891]
  - - [2048, 3910, 1, 512]
    - [5, 85.304]
  - - [2048, 3925, 1, 512]
    - [5, 85.869]
  - - [2048, 3942, 1, 512]
    - [5, 86.562]
  - - [2048, 3944, 1, 512]
    - [5, 86.165]
  - - [2048, 3955, 1, 512]
    - [5, 86.285]
  - - [2048, 3968, 1, 512]
    - [4, 86.81]
  - - [2048, 3969, 1, 512]
    - [5, 86.352]
  - - [2048, 3976, 1, 512]
    - [4, 86.544]
  - - [2048, 3977, 1, 512]
    - [5, 86.208]
  - - [2048, 3978, 1, 512]
    - [5, 86.747]
  - - [2048, 3990, 1, 512]
    - [5, 86.609]
  - - [2048, 3995, 1, 512]
    - [5, 86.598]
  - - [2048, 3996, 1, 512]
    - [5, 86.66]
  - - [2048, 3999, 1, 512]
    - [5, 86.765]
  - - [2048, 4005, 1, 512]
    - [5, 86.815]
  - - [2048, 4012, 1, 512]
    - [5, 87.327]
  - - [2048, 4020, 1, 512]
    - [5, 87.22]
  - - [2048, 4026, 1, 512]
    - [5, 87.27]
  - - [2048, 4030, 1, 512]
    - [5, 87.317]
  - - [2048, 4032, 1, 512]
    - [5, 87.763]
  - - [512, 160, 1, 2048]
    - [19, 26.162]
  - - [512, 174, 1, 2048]
    - [45, 27.047]
  - - [512, 182, 1, 512]
    - [45, 7.034]
  - - [512, 184, 1, 512]
    - [15, 16.102]
  - - [512, 184, 1, 2048]
    - [45, 28.791]
  - - [512, 189, 1, 512]
    - [15, 16.662]
  - - [512, 189, 1, 2048]
    - [45, 29.379]
  - - [512, 198, 1, 2048]
    - [50, 20.702]
  - - [512, 206, 1, 512]
    - [18, 8.163]
  - - [512, 207, 1, 2048]
    - [18, 22.309]
  - - [512, 208, 1, 512]
    - [50, 8.132]
  - - [512, 208, 1, 2048]
    - [39, 29.876]
  - - [512, 224, 1, 512]
    - [34, 8.412]
  - - [512, 245, 1, 2048]
    - [34, 31.291]
  - - [512, 246, 1, 512]
    - [36, 9.418]
  - - [512, 246, 1, 2048]
    - [34, 31.25]
  - - [512, 264, 1, 512]
    - [30, 9.806]
  - - [512, 264, 1, 2048]
    - [10, 27.064]
  - - [512, 401, 1, 2048]
    - [24, 50.667]
  - - [512, 439, 1, 2048]
    - [30, 39.216]
  - - [512, 443, 1, 2048]
    - [30, 39.498]
  - - [512, 446, 1, 2048]
    - [10, 33.329]
  - - [512, 455, 1, 512]
    - [101, 15.342]
  - - [512, 465, 1, 512]
    - [1, 29.377]
  - - [512, 465, 1, 2048]
    - [30, 40.617]
  - - [512, 468, 1, 512]
    - [1, 29.1]
  - - [512, 468, 1, 2048]
    - [30, 40.954]
  - - [512, 476, 1, 512]
    - [95, 28.987]
  - - [512, 493, 1, 512]
    - [37, 16.892]
  - - [512, 493, 1, 2048]
    - [30, 42.435]
  - - [512, 495, 1, 2048]
    - [101, 42.376]
  - - [512, 511, 1, 2048]
    - [30, 43.431]
  - - [512, 512, 1, 2048]
    - [10, 44.722]
  - - [64, 27, 56, 26]
    - [11, 1.4]
  - - [64, 59, 512, 59]
    - [4, 20.896]
  - - [64, 59, 544, 59]
    - [4, 21.847]
  - - [64, 64, 496, 64]
    - [36, 24.015]
  - - [64, 65, 496, 64]
    - [7, 22.457]
  - - [64, 65, 496, 65]
    - [7, 18.829]
  - - [64, 70, 216, 70]
    - [4, 16.412]
  - - [64, 71, 216, 71]
    - [4, 16.794]
  - - [64, 78, 248, 77]
    - [72, 11.09]
  - - [64, 80, 152, 80]
    - [4, 19.217]
  - - [64, 93, 344, 93]
    - [5, 23.705]
  - - [64, 102, 312, 102]
    - [5, 26.299]
  - - [64, 122, 264, 122]
    - [4, 32.015]
  - - [64, 122, 264, 123]
    - [4, 32.928]
  - - [64, 123, 264, 123]
    - [5, 32.088]
  - - [1024, 4096, 1, 3072]
    - [6, 91.543]
  - - [1024, 20, 1, 30522]
    - [145, 17.4]
  - - [1024, 80, 1, 30522]
    - [143, 37.965]
  - - [1024, 120, 1, 30522]
    - [143, 55.326]
  - - [64, 512, 96, 512]
    - [110, 60.286]
  - - [64, 512, 128, 512]
    - [81, 59.851]
  - - [1024, 3840, 1, 1024]
    - [4, 88.002]
  - - [1024, 3840, 1, 4096]
    - [29, 89.369]
  - - [1024, 3968, 1, 1024]
    - [7, 83.448]
  - - [1024, 3968, 1, 4096]
    - [29, 86.94]
  - - [1024, 3968, 1, 42720]
    - [41, 94.786]
  - - [1024, 7200, 1, 1024]
    - [4, 89.962]
  - - [1024, 7200, 1, 4096]
    - [4, 92.074]
  - - [1024, 7200, 1, 42720]
    - [0, 92.092]
  - - [1024, 8160, 1, 1024]
    - [4, 91.375]
  - - [1024, 8160, 1, 4096]
    - [109, 92.612]
  - - [1024, 9520, 1, 1024]
    - [4, 92.547]
  - - [1024, 9520, 1, 4096]
    - [4, 94.1]
  - - [1024, 9520, 1, 42720]
    - [41, 95.566]
  - - [1024, 10200, 1, 1024]
    - [4, 91.271]
  - - [1024, 10200, 1, 4096]
    - [4, 92.845]
  - - [4096, 3840, 1, 1024]
    - [4, 94.658]
  - - [4096, 3968, 1, 1024]
    - [4, 92.964]
  - - [4096, 7200, 1, 1024]
    - [6, 95.138]
  - - [4096, 8160, 1, 1024]
    - [5, 95.187]
  - - [4096, 9520, 1, 1024]
    - [5, 95.778]
  - - [4096, 10200, 1, 1024]
    - [5, 95.276]
  - - [64, 17, 1, 17]
    - [13, 0.011]
  - - [64, 30, 1, 30]
    - [11, 0.032]
  - - [64, 31, 1, 30]
    - [93, 0.033]
  - - [64, 31, 1, 31]
    - [98, 0.034]
  - - [64, 14, 1, 14]
    - [98, 0.007]
  - - [64, 14, 1, 15]
    - [12, 0.008]
  - - [64, 15, 1, 15]
    - [11, 0.008]
  - - [64, 15, 1, 17]
    - [60, 0.009]
  - - [1024, 2048, 1, 4096]
    - [4, 85.664]
  - - [1024, 2048, 1, 30528]
    - [109, 88.913]
  - - [1024, 4096, 1, 30528]
    - [111, 90.331]
  - - [64, 128, 512, 128]
    - [7, 42.822]
  - - [64, 512, 64, 512]
    - [5, 58.441]
  - - [100, 512, 1, 2048]
    - [19, 15.098]
  - - [1024, 10240, 1, 256]
    - [6, 84.715]
  - - [1024, 10496, 1, 256]
    - [6, 86.712]
  - - [1024, 11008, 1, 256]
    - [6, 85.22]
  - - [1024, 11264, 1, 256]
    - [6, 86.917]
  - - [1024, 11520, 1, 256]
    - [6, 83.494]
  - - [1024, 1, 1, 1600]
    - [142, 0.226]
  - - [1024, 1, 1, 200]
    - [136, 0.035]
  - - [1024, 12288, 1, 256]
    - [6, 88.517]
  - - [1024, 13312, 1, 256]
    - [6, 85.193]
  - - [1024, 13568, 1, 256]
    - [6, 86.596]
  - - [1024, 14336, 1, 256]
    - [6, 86.586]
  - - [1024, 14592, 1, 256]
    - [6, 87.952]
  - - [1024, 14848, 1, 256]
    - [6, 89.495]
  - - [1024, 15104, 1, 256]
    - [6, 86.409]
  - - [1024, 1600, 1, 1024]
    - [4, 77.151]
  - - [1024, 1600, 1, 1]
    - [112, 0.506]
  - - [1024, 16128, 1, 256]
    - [6, 87.925]
  - - [1024, 17152, 1, 256]
    - [6, 88.99]
  - - [1024, 1792, 1, 256]
    - [7, 60.486]
  - - [1024, 18944, 1, 256]
    - [6, 89.556]
  - - [1024, 19712, 1, 256]
    - [6, 89.74]
  - - [1024, 19968, 1, 256]
    - [6, 90.59]
  - - [1024, 20480, 1, 256]
    - [6, 89.444]
  - - [1024, 2048, 1, 256]
    - [4, 64.177]
  - - [1024, 20992, 1, 256]
    - [6, 91.242]
  - - [1024, 21504, 1, 256]
    - [6, 90.375]
  - - [1024, 22016, 1, 256]
    - [6, 89.287]
  - - [1024, 23552, 1, 256]
    - [6, 91.677]
  - - [1024, 2560, 1, 256]
    - [4, 68.269]
  - - [1024, 28672, 1, 256]
    - [6, 92.045]
  - - [1024, 3072, 1, 256]
    - [5, 71.866]
  - - [1024, 3328, 1, 256]
    - [5, 70.968]
  - - [1024, 33536, 1, 256]
    - [6, 91.88]
  - - [1024, 3840, 1, 256]
    - [5, 74.614]
  - - [1024, 40448, 1, 256]
    - [6, 94.268]
  - - [1024, 4096, 1, 256]
    - [5, 73.54]
  - - [1024, 4608, 1, 256]
    - [4, 75.399]
  - - [1024, 4864, 1, 256]
    - [5, 74.919]
  - - [1024, 5120, 1, 256]
    - [5, 77.054]
  - - [1024, 5632, 1, 256]
    - [5, 79.115]
  - - [1024, 6144, 1, 256]
    - [6, 81.647]
  - - [1024, 6400, 1, 256]
    - [5, 78.841]
  - - [1024, 7168, 1, 256]
    - [4, 79.813]
  - - [1024, 7424, 1, 256]
    - [4, 80.909]
  - - [1024, 7680, 1, 256]
    - [6, 82.557]
  - - [1024, 7936, 1, 256]
    - [4, 80.545]
  - - [1024, 8192, 1, 256]
    - [4, 80.851]
  - - [1024, 8448, 1, 256]
    - [6, 82.21]
  - - [1024, 8704, 1, 256]
    - [6, 84.841]
  - - [1024, 8960, 1, 256]
    - [4, 81.613]
  - - [1024, 9728, 1, 256]
    - [4, 81.797]
  - - [1024, 9984, 1, 256]
    - [6, 83.121]
  - - [1, 200, 1, 1]
    - [94, 0.0]
  - - [1, 512, 1, 1]
    - [9, 0.0]
  - - [2048, 1024, 1, 1]
    - [112, 0.549]
  - - [2048, 1024, 1, 256]
    - [5, 63.337]
  - - [2048, 1, 1, 512]
    - [39, 0.358]
  - - [2048, 512, 1, 2048]
    - [36, 76.687]
  - - [256, 1024, 1, 1]
    - [11, 0.16]
  - - [256, 8976, 1, 10240]
    - [30, 84.833]
  - - [256, 8976, 1, 10496]
    - [30, 84.935]
  - - [256, 8976, 1, 11008]
    - [30, 85.083]
  - - [256, 8976, 1, 11520]
    - [30, 85.126]
  - - [256, 8976, 1, 12288]
    - [30, 85.116]
  - - [256, 8976, 1, 14336]
    - [30, 85.33]
  - - [256, 8976, 1, 14848]
    - [30, 85.369]
  - - [256, 8976, 1, 15104]
    - [30, 85.484]
  - - [256, 8976, 1, 1536]
    - [36, 79.89]
  - - [256, 8976, 1, 15872]
    - [30, 85.485]
  - - [256, 8976, 1, 17152]
    - [30, 85.48]
  - - [256, 8976, 1, 19712]
    - [30, 85.538]
  - - [256, 8976, 1, 19968]
    - [30, 85.69]
  - - [256, 8976, 1, 20480]
    - [30, 85.755]
  - - [256, 8976, 1, 2048]
    - [36, 81.133]
  - - [256, 8976, 1, 20992]
    - [30, 85.709]
  - - [256, 8976, 1, 22016]
    - [30, 85.623]
  - - [256, 8976, 1, 2304]
    - [36, 81.347]
  - - [256, 8976, 1, 2560]
    - [7, 81.897]
  - - [256, 8976, 1, 26112]
    - [30, 85.99]
  - - [256, 8976, 1, 2816]
    - [7, 82.26]
  - - [256, 8976, 1, 3072]
    - [7, 82.565]
  - - [256, 8976, 1, 33536]
    - [10, 92.14]
  - - [256, 8976, 1, 4352]
    - [7, 83.366]
  - - [256, 8976, 1, 44505]
    - [25, 82.459]
  - - [256, 8976, 1, 4864]
    - [36, 83.573]
  - - [256, 8976, 1, 5376]
    - [7, 83.666]
  - - [256, 8976, 1, 5632]
    - [7, 83.905]
  - - [256, 8976, 1, 5888]
    - [30, 83.905]
  - - [256, 8976, 1, 6144]
    - [7, 83.893]
  - - [256, 8976, 1, 6656]
    - [30, 84.047]
  - - [256, 8976, 1, 7168]
    - [30, 84.293]
  - - [256, 8976, 1, 7424]
    - [30, 84.224]
  - - [256, 8976, 1, 8192]
    - [30, 84.596]
  - - [256, 8976, 1, 8448]
    - [30, 84.574]
  - - [256, 8976, 1, 8960]
    - [30, 84.798]
  - - [256, 8976, 1, 9472]
    - [30, 84.836]
  - - [256, 8976, 1, 9728]
    - [30, 84.768]
  - - [256, 8976, 1, 9984]
    - [30, 84.815]
  - - [257, 1024, 1, 4096]
    - [10, 48.241]
  - - [3200, 1024, 1, 2048]
    - [29, 86.657]
  - - [4096, 1024, 1, 1]
    - [6, 0.747]
  - - [512, 1600, 1, 32]
    - [3, 11.697]
  - - [512, 1600, 1, 512]
    - [4, 60.583]
  - - [512, 215, 1, 2048]
    - [10, 21.605]
  - - [512, 256, 1, 2048]
    - [34, 34.077]
  - - [560, 1600, 1, 1024]
    - [75, 62.366]
  - - [560, 200, 1, 1024]
    - [30, 13.787]
  - - [67, 512, 1, 2048]
    - [16, 10.313]
  - - [74, 512, 1, 2048]
    - [53, 11.244]
  - - [768, 215, 1, 2048]
    - [10, 31.867]
  - - [768, 256, 1, 2048]
    - [31, 49.99]
  - - [32, 33, 1600, 33]
    - [2, 7.902]
  - - [64, 3, 512, 3]
    - [96, 0.16]
  - - [64, 5, 512, 5]
    - [9, 0.352]
  - - [64, 9, 512, 9]
    - [9, 0.997]
  - - [1024, 4096, 1, 4096]
    - [6, 92.958]
  - - [1024, 3072, 1, 3072]
    - [4, 92.268]
  - - [1024, 2048, 1, 3072]
    - [4, 85.343]
  - - [1024, 512, 1, 3072]
    - [10, 63.951]
  - - [512, 512, 1, 64]
    - [11, 8.895]
  - - [64, 512, 1, 512]
    - [16, 5.772]
  - - [30528, 4096, 1, 1024]
    - [5, 96.581]
  - - [30528, 2048, 1, 1024]
    - [4, 96.075]
  - - [512, 32768, 1, 256]
    - [6, 88.91]
  - - [256, 32768, 1, 128]
    - [6, 61.8]
  - - [1024, 32768, 1, 512]
    - [4, 94.28]
  - - [1024, 32768, 1, 1024]
    - [4, 95.261]
  - - [479, 32768, 1, 1024]
    - [56, 88.842]
  - - [64, 192, 64, 1280]
    - [40, 59.691]
  - - [64, 320, 64, 1280]
    - [40, 68.054]
  - - [64, 384, 64, 1280]
    - [49, 69.259]
  - - [64, 448, 64, 1280]
    - [7, 63.689]
  - - [64, 192, 64, 2048]
    - [32, 64.462]
  - - [64, 320, 64, 2048]
    - [32, 73.495]
  - - [64, 384, 64, 2048]
    - [81, 72.353]
  - - [64, 448, 64, 2048]
    - [36, 69.439]
  - - [1225, 32, 64, 192]
    - [90, 35.587]
  - - [1225, 48, 64, 192]
    - [4, 37.002]
  - - [1225, 64, 64, 192]
    - [6, 43.064]
  - - [1225, 48, 64, 256]
    - [6, 40.842]
  - - [1225, 64, 64, 256]
    - [48, 49.604]
  - - [1225, 48, 64, 288]
    - [4, 43.339]
  - - [1225, 64, 64, 288]
    - [6, 56.238]
  - - [5329, 80, 64, 64]
    - [113, 31.105]
  - - [289, 128, 64, 768]
    - [4, 68.455]
  - - [289, 160, 64, 768]
    - [24, 63.976]
  - - [289, 192, 64, 768]
    - [4, 73.074]
  - - [49, 2048, 64, 512]
    - [114, 47.498]
  - - [49, 512, 64, 2048]
    - [7, 55.816]
  - - [3136, 256, 64, 64]
    - [7, 48.177]
  - - [3136, 64, 64, 64]
    - [7, 39.709]
  - - [3136, 64, 64, 256]
    - [7, 66.514]
  - - [784, 512, 64, 128]
    - [5, 62.161]
  - - [784, 128, 64, 512]
    - [4, 75.996]
  - - [196, 1024, 64, 256]
    - [4, 60.81]
  - - [196, 256, 64, 1024]
    - [4, 63.931]
  - - [64, 192, 32, 1280]
    - [40, 57.279]
  - - [64, 320, 32, 1280]
    - [7, 63.324]
  - - [64, 384, 32, 1280]
    - [81, 57.949]
  - - [64, 448, 32, 1280]
    - [36, 57.842]
  - - [64, 192, 32, 2048]
    - [32, 62.465]
  - - [64, 320, 32, 2048]
    - [7, 68.735]
  - - [64, 384, 32, 2048]
    - [81, 66.444]
  - - [64, 448, 32, 2048]
    - [7, 62.588]
  - - [1225, 48, 32, 192]
    - [4, 37.6]
  - - [1225, 48, 32, 256]
    - [4, 41.665]
  - - [5329, 80, 32, 64]
    - [7, 30.174]
  - - [49, 2048, 32, 512]
    - [7, 46.837]
  - - [49, 512, 32, 2048]
    - [7, 54.403]
  - - [3136, 256, 32, 64]
    - [7, 47.135]
  - - [3136, 64, 32, 256]
    - [7, 64.997]
  - - [784, 512, 32, 128]
    - [4, 60.094]
  - - [784, 128, 32, 512]
    - [29, 62.422]
  - - [196, 1024, 32, 256]
    - [4, 58.994]
  - - [196, 256, 32, 1024]
    - [4, 56.461]
  - - [256, 4096, 1, 4]
    - [115, 1.644]
  - - [256, 6912, 1, 4]
    - [8, 2.112]
  - - [512, 4096, 1, 256]
    - [5, 65.04]
  - - [1024, 4096, 1, 512]
    - [36, 82.225]
  - - [480, 4096, 1, 1024]
    - [4, 71.64]
  - - [512, 6912, 1, 256]
    - [4, 73.965]
  - - [1024, 6912, 1, 512]
    - [4, 88.709]
  - - [1024, 6912, 1, 1024]
    - [4, 91.084]
  - - [480, 6912, 1, 1024]
    - [4, 82.761]
  - - [256, 55296, 1, 128]
    - [6, 67.207]
  - - [512, 55296, 1, 256]
    - [6, 91.39]
  - - [960, 1024, 1, 1024]
    - [36, 58.275]
  - - [1920, 2048, 1, 2048]
    - [4, 89.81]
  - - [2880, 3072, 1, 3072]
    - [4, 93.923]
  - - [3840, 4096, 1, 4096]
    - [4, 95.95]
  - - [7680, 8192, 1, 8192]
    - [6, 96.856]
  - - [2048, 2048, 1, 2048]
    - [6, 89.896]
  - - [3072, 3072, 1, 3072]
    - [4, 94.998]
  - - [4096, 4096, 1, 4096]
    - [6, 94.528]
  - - [8192, 8192, 1, 8192]
    - [6, 96.531]
  - - [384, 384, 1, 384]
    - [84, 8.66]
  - - [768, 768, 1, 768]
    - [36, 57.995]
  - - [1152, 1152, 1, 1152]
    - [7, 66.044]
  - - [1536, 1536, 1, 1536]
    - [29, 82.566]
  - - [1920, 1920, 1, 1920]
    - [29, 86.372]
  - - [2304, 2304, 1, 2304]
    - [4, 89.69]
  - - [2688, 2688, 1, 2688]
    - [29, 89.395]
  - - [3456, 3456, 1, 3456]
    - [4, 94.016]
  - - [3840, 3840, 1, 3840]
    - [4, 95.483]
  - - [4224, 4224, 1, 4224]
    - [4, 95.207]
  - - [4608, 4608, 1, 4608]
    - [108, 96.023]
  - - [4992, 4992, 1, 4992]
    - [6, 95.68]
  - - [5376, 5376, 1, 5376]
    - [6, 96.059]
  - - [5760, 5760, 1, 5760]
    - [6, 96.441]
  - - [6144, 6144, 1, 6144]
    - [6, 96.779]
  - - [6528, 6528, 1, 6528]
    - [6, 95.724]
  - - [6912, 6912, 1, 6912]
    - [117, 95.558]
  - - [7296, 7296, 1, 7296]
    - [56, 96.308]
  - - [7680, 7680, 1, 7680]
    - [6, 96.425]
  - - [768, 768, 1, 384]
    - [7, 47.697]
  - - [1152, 1152, 1, 384]
    - [5, 65.43]
  - - [1536, 1536, 1, 384]
    - [7, 73.17]
  - - [1920, 1920, 1, 384]
    - [36, 78.565]
  - - [2304, 2304, 1, 384]
    - [4, 84.667]
  - - [2688, 2688, 1, 384]
    - [5, 85.002]
  - - [3072, 3072, 1, 384]
    - [4, 89.243]
  - - [3456, 3456, 1, 384]
    - [4, 89.633]
  - - [3840, 3840, 1, 384]
    - [5, 90.908]
  - - [4224, 4224, 1, 384]
    - [6, 92.169]
  - - [4608, 4608, 1, 384]
    - [5, 91.544]
  - - [4992, 4992, 1, 384]
    - [6, 93.002]
  - - [5376, 5376, 1, 384]
    - [5, 92.826]
  - - [5760, 5760, 1, 384]
    - [6, 94.355]
  - - [6144, 6144, 1, 384]
    - [6, 94.881]
  - - [6528, 6528, 1, 384]
    - [5, 94.474]
  - - [6912, 6912, 1, 384]
    - [6, 94.08]
  - - [7296, 7296, 1, 384]
    - [5, 94.481]
  - - [7680, 7680, 1, 384]
    - [6, 95.127]
  - - [8064, 8064, 1, 384]
    - [6, 94.965]
  - - [8448, 8448, 1, 384]
    - [6, 95.217]
  - - [8832, 8832, 1, 384]
    - [6, 95.805]
  - - [9216, 9216, 1, 384]
    - [6, 95.667]
  - - [9600, 9600, 1, 384]
    - [6, 95.673]
  - - [9984, 9984, 1, 384]
    - [6, 96.122]
  - - [10368, 10368, 1, 384]
    - [6, 95.998]
  - - [10752, 10752, 1, 384]
    - [6, 96.081]
  - - [11136, 11136, 1, 384]
    - [6, 96.361]
  - - [11520, 11520, 1, 384]
    - [6, 96.156]
  - - [11904, 11904, 1, 384]
    - [6, 96.22]
  - - [12288, 12288, 1, 384]
    - [6, 96.856]
  - - [12672, 12672, 1, 384]
    - [6, 96.349]
  - - [13056, 13056, 1, 384]
    - [6, 96.47]
  - - [13440, 13440, 1, 384]
    - [6, 96.506]
  - - [13824, 13824, 1, 384]
    - [6, 96.344]
  - - [14208, 14208, 1, 384]
    - [6, 96.438]
  - - [14592, 14592, 1, 384]
    - [6, 96.647]
  - - [14976, 14976, 1, 384]
    - [6, 96.855]
  - - [15360, 15360, 1, 384]
    - [6, 96.718]
  - - [15744, 15744, 1, 384]
    - [6, 96.65]
  - - [16128, 16128, 1, 384]
    - [6, 96.824]
  - - [16512, 16512, 1, 384]
    - [6, 96.836]
  - - [16896, 16896, 1, 384]
    - [6, 96.898]
  - - [17280, 17280, 1, 384]
    - [6, 96.783]
  - - [17664, 17664, 1, 384]
    - [6, 96.713]
  - - [18048, 18048, 1, 384]
    - [6, 96.88]
  - - [18432, 18432, 1, 384]
    - [6, 96.815]
  - - [18816, 18816, 1, 384]
    - [6, 97.031]
  - - [19200, 19200, 1, 384]
    - [6, 96.87]
  - - [19584, 19584, 1, 384]
    - [6, 96.923]
  - - [19968, 19968, 1, 384]
    - [6, 96.921]
  - - [20352, 20352, 1, 384]
    - [6, 96.939]
  - - [20736, 20736, 1, 384]
    - [6, 96.938]
  - - [21120, 21120, 1, 384]
    - [6, 97.111]
  - - [21504, 21504, 1, 384]
    - [6, 96.953]
  - - [21888, 21888, 1, 384]
    - [6, 96.938]
  - - [22272, 22272, 1, 384]
    - [6, 97.038]
  - - [22656, 22656, 1, 384]
    - [6, 96.984]
  - - [23040, 23040, 1, 384]
    - [6, 96.947]
  - - [8192, 1024, 1, 1024]
    - [4, 90.893]
  - - [8192, 4096, 1, 1024]
    - [5, 95.548]
  - - [16384, 16384, 1, 16384]
    - [6, 97.572]
  - - [100, 128, 120, 512]
    - [4, 48.418]
  - - [100, 128, 139, 512]
    - [6, 47.187]
  - - [100, 128, 160, 512]
    - [4, 52.158]
  - - [100, 128, 18, 512]
    - [34, 26.189]
  - - [100, 128, 19, 512]
    - [10, 27.508]
  - - [1444, 256, 120, 128]
    - [6, 58.919]
  - - [1444, 256, 139, 128]
    - [6, 59.221]
  - - [1444, 256, 160, 128]
    - [6, 59.616]
  - - [1444, 256, 18, 128]
    - [5, 50.906]
  - - [1444, 256, 19, 128]
    - [5, 51.547]
  - - [1444, 256, 120, 256]
    - [6, 80.645]
  - - [1444, 256, 139, 256]
    - [6, 80.665]
  - - [1444, 256, 160, 256]
    - [6, 80.935]
  - - [1444, 256, 18, 256]
    - [6, 72.013]
  - - [1444, 256, 19, 256]
    - [6, 69.614]
  - - [25, 128, 120, 256]
    - [2, 20.51]
  - - [25, 128, 139, 256]
    - [118, 20.045]
  - - [25, 128, 160, 256]
    - [119, 21.797]
  - - [25, 128, 18, 256]
    - [27, 2.498]
  - - [25, 128, 19, 256]
    - [55, 2.559]
  - - [361, 256, 120, 512]
    - [6, 79.198]
  - - [361, 256, 139, 512]
    - [6, 80.874]
  - - [361, 256, 160, 512]
    - [6, 82.791]
  - - [361, 256, 18, 512]
    - [7, 50.181]
  - - [361, 256, 19, 512]
    - [4, 53.013]
  - - [9, 128, 120, 256]
    - [93, 4.592]
  - - [9, 128, 139, 256]
    - [60, 8.513]
  - - [9, 128, 160, 256]
    - [53, 5.487]
  - - [9, 128, 18, 256]
    - [13, 2.278]
  - - [9, 128, 19, 256]
    - [60, 0.986]
  - - [1, 256, 1, 1152]
    - [141, 0.038]
  - - [100, 512, 1, 2304]
    - [14, 15.544]
  - - [1444, 128, 1, 576]
    - [34, 14.18]
  - - [173280, 128, 1, 64]
    - [6, 32.589]
  - - [200716, 128, 1, 64]
    - [6, 31.109]
  - - [22500, 64, 1, 147]
    - [5, 36.135]
  - - [231040, 128, 1, 64]
    - [6, 38.473]
  - - [25, 256, 1, 1152]
    - [20, 1.74]
  - - [25992, 128, 1, 64]
    - [7, 21.055]
  - - [27436, 128, 1, 64]
    - [7, 21.343]
  - - [361, 512, 1, 2304]
    - [24, 36.992]
  - - [9, 256, 1, 1152]
    - [145, 0.367]
  - - [480, 512, 1, 512]
    - [1, 29.845]
  - - [8192, 7680, 1, 8192]
    - [6, 96.986]
  - - [4096, 3840, 1, 4096]
    - [4, 95.808]
  - - [2048, 1920, 1, 2048]
    - [4, 89.698]
  - - [1024, 960, 1, 1024]
    - [30, 57.919]
  - - [512, 480, 1, 512]
    - [34, 30.163]
  - - [1024, 77, 1, 1024]
    - [19, 19.05]
  - - [1024, 77, 1, 30522]
    - [143, 36.777]
  - - [1024, 616, 1, 1024]
    - [10, 64.544]
  - - [64, 128, 128, 128]
    - [7, 34.174]
  - - [64, 128, 160, 128]
    - [5, 37.062]
  - - [1024, 10, 1, 2]
    - [96, 0.004]
  - - [1024, 10, 1, 1024]
    - [17, 2.655]
  - - [1024, 200, 1, 30522]
    - [143, 58.402]
  - - [1024, 1024, 1, 2]
    - [4, 0.844]
  - - [1024, 1280, 1, 2]
    - [4, 0.938]
  - - [1024, 1280, 1, 4096]
    - [10, 76.547]
  - - [4096, 1280, 1, 1024]
    - [4, 89.776]
  - - [64, 128, 624, 128]
    - [7, 38.85]
  - - [1024, 39, 1, 2]
    - [84, 0.015]
  - - [1024, 39, 1, 1024]
    - [15, 10.071]
  - - [1024, 780, 1, 1024]
    - [105, 54.232]
  - - [1024, 780, 1, 30522]
    - [41, 85.041]
  - - [1024, 4992, 1, 2]
    - [4, 1.477]
  - - [1024, 4992, 1, 4096]
    - [29, 90.617]
  - - [4096, 4992, 1, 1024]
    - [6, 94.482]
  - - [1024, 308, 1, 1024]
    - [10, 45.913]
  - - [1024, 308, 1, 30522]
    - [144, 72.08]
  - - [64, 128, 640, 128]
    - [120, 39.277]
  - - [1024, 40, 1, 2]
    - [13, 0.055]
  - - [1024, 40, 1, 1024]
    - [15, 10.273]
  - - [1024, 800, 1, 1024]
    - [36, 55.671]
  - - [1024, 800, 1, 30522]
    - [41, 87.188]
  - - [1024, 5120, 1, 2]
    - [4, 1.515]
  - - [1024, 5120, 1, 1024]
    - [4, 88.918]
  - - [1024, 5120, 1, 4096]
    - [4, 91.089]
  - - [4096, 5120, 1, 1024]
    - [5, 94.76]
  - - [64, 128, 656, 128]
    - [120, 39.743]
  - - [1024, 41, 1, 2]
    - [13, 0.056]
  - - [1024, 41, 1, 1024]
    - [15, 10.417]
  - - [1024, 820, 1, 1024]
    - [105, 55.468]
  - - [1024, 820, 1, 30522]
    - [41, 89.402]
  - - [1024, 5248, 1, 2]
    - [4, 1.518]
  - - [1024, 5248, 1, 1024]
    - [4, 91.342]
  - - [1024, 5248, 1, 4096]
    - [4, 93.163]
  - - [4096, 5248, 1, 1024]
    - [6, 95.182]
  - - [64, 512, 80, 512]
    - [121, 60.186]
  - - [1024, 5, 1, 2]
    - [9, 0.002]
  - - [1024, 5, 1, 1024]
    - [23, 1.298]
  - - [1024, 385, 1, 1024]
    - [10, 56.326]
  - - [1024, 385, 1, 30522]
    - [30, 75.79]
  - - [1024, 2560, 1, 2]
    - [112, 1.212]
  - - [1024, 2560, 1, 4096]
    - [10, 85.831]
  - - [4096, 2560, 1, 1024]
    - [4, 91.612]
  - - [1024, 462, 1, 1024]
    - [36, 49.06]
  - - [1024, 462, 1, 30522]
    - [143, 69.886]
  - - [1024, 8, 1, 2]
    - [96, 0.011]
  - - [1024, 160, 1, 30522]
    - [10, 56.145]
  - - [64, 128, 144, 128]
    - [120, 34.367]
  - - [1024, 9, 1, 2]
    - [21, 0.004]
  - - [1024, 9, 1, 1024]
    - [20, 2.35]
  - - [1024, 180, 1, 1024]
    - [10, 22.442]
  - - [1024, 180, 1, 30522]
    - [30, 62.056]
  - - [1024, 1152, 1, 2]
    - [4, 0.886]
  - - [1024, 1152, 1, 4096]
    - [108, 80.262]
  - - [4096, 1152, 1, 1024]
    - [4, 87.521]
  - - [64, 4, 32768, 4]
    - [122, 0.988]
  - - [64, 4, 38400, 4]
    - [122, 0.989]
  - - [1024, 8192, 1, 1024]
    - [4, 92.017]
  - - [1024, 8192, 1, 4096]
    - [4, 93.817]
  - - [1024, 8192, 1, 33712]
    - [0, 93.817]
  - - [1024, 9600, 1, 1024]
    - [4, 93.21]
  - - [1024, 9600, 1, 4096]
    - [6, 95.04]
  - - [1024, 9600, 1, 33712]
    - [35, 96.306]
  - - [4096, 8192, 1, 1024]
    - [5, 95.466]
  - - [4096, 9600, 1, 1024]
    - [6, 95.621]
  - - [1024, 10064, 1, 1024]
    - [4, 93.433]
  - - [1024, 10064, 1, 4096]
    - [4, 95.101]
  - - [1024, 10080, 1, 4096]
    - [4, 95.429]
  - - [1024, 10080, 1, 42720]
    - [106, 96.806]
  - - [1024, 6528, 1, 1024]
    - [4, 91.974]
  - - [1024, 6528, 1, 4096]
    - [4, 94.959]
  - - [1024, 6528, 1, 42720]
    - [41, 97.585]
  - - [1024, 7104, 1, 1024]
    - [4, 88.81]
  - - [1024, 7104, 1, 4096]
    - [29, 90.608]
  - - [1024, 7104, 1, 42720]
    - [0, 90.936]
  - - [1024, 8064, 1, 1024]
    - [4, 90.3]
  - - [1024, 8064, 1, 4096]
    - [4, 92.346]
  - - [1024, 9216, 1, 1024]
    - [4, 93.336]
  - - [1024, 9216, 1, 4096]
    - [116, 95.938]
  - - [4096, 10064, 1, 1024]
    - [6, 95.965]
  - - [4096, 10080, 1, 1024]
    - [6, 95.991]
  - - [4096, 6528, 1, 1024]
    - [6, 95.093]
  - - [4096, 7104, 1, 1024]
    - [5, 95.106]
  - - [4096, 8064, 1, 1024]
    - [6, 95.487]
  - - [4096, 9216, 1, 1024]
    - [6, 96.27]
  - - [64, 14, 10880, 14]
    - [84, 6.2]
  - - [64, 14, 10880, 15]
    - [84, 6.603]
  - - [64, 15, 7680, 15]
    - [84, 6.744]
  - - [64, 15, 10880, 15]
    - [84, 6.998]
  - - [64, 15, 7680, 17]
    - [84, 7.462]
  - - [64, 17, 6144, 17]
    - [4, 5.247]
  - - [64, 17, 7680, 17]
    - [5, 5.196]
  - - [64, 17, 6144, 21]
    - [4, 5.439]
  - - [64, 21, 6144, 21]
    - [4, 7.443]
  - - [64, 24, 4736, 24]
    - [4, 9.033]
  - - [64, 24, 4736, 34]
    - [5, 12.116]
  - - [64, 30, 2048, 30]
    - [4, 11.788]
  - - [64, 31, 2048, 30]
    - [5, 11.865]
  - - [64, 31, 2048, 31]
    - [4, 9.535]
  - - [64, 32, 4608, 32]
    - [7, 18.17]
  - - [64, 34, 4736, 34]
    - [4, 15.257]
  - - [64, 35, 4608, 32]
    - [7, 15.954]
  - - [64, 35, 4608, 35]
    - [4, 15.345]
  - - [128, 128, 1, 64]
    - [11, 0.656]
  - - [64, 5, 1, 5]
    - [98, 0.0]
  - - [32, 33, 1, 33]
    - [16, 0.02]
  - - [64, 5, 960, 5]
    - [9, 0.524]
  - - [74, 960, 1, 2048]
    - [70, 15.282]
  - - [128, 27, 32768, 27]
    - [4, 12.205]
  - - [480, 32768, 1, 1024]
    - [56, 91.049]
  - - [1024, 960, 1, 64]
    - [36, 22.502]
  - - [2048, 960, 1, 2048]
    - [4, 78.896]
  - - [2048, 1024, 1, 30592]
    - [124, 88.221]
  - - [2048, 1024, 1, 6144]
    - [4, 85.143]
  - - [2048, 1024, 1, 8192]
    - [4, 85.749]
  - - [2048, 2, 1, 2]
    - [13, 0.006]
  - - [2048, 2, 1, 2048]
    - [139, 0.966]
  - - [8192, 1024, 1, 2048]
    - [4, 92.006]
  - - [1024, 16, 1, 1024]
    - [20, 4.37]
  - - [1024, 16, 1, 2]
    - [9, 0.023]
  - - [1024, 8192, 1, 30592]
    - [32, 91.016]
  - - [1024, 8192, 1, 3072]
    - [4, 93.431]
  - - [512, 512, 256, 64]
    - [6, 47.301]
  - - [64, 512, 256, 512]
    - [125, 63.007]
  - - [1024, 2048, 1, 30592]
    - [109, 89.006]
  - - [1024, 4096, 1, 30592]
    - [41, 90.349]
  - - [512, 512, 128, 64]
    - [6, 46.394]
  - - [2560, 2048, 1, 1920]
    - [4, 90.948]
  - - [2560, 2048, 1, 2560]
    - [4, 91.328]
  - - [2560, 2048, 1, 7680]
    - [123, 90.098]
  - - [2560, 4, 1, 2]
    - [96, 0.004]
  - - [2560, 4, 1, 2560]
    - [139, 2.676]
  - - [640, 2048, 1, 2560]
    - [30, 73.566]
  - - [512, 512, 40, 64]
    - [4, 42.298]
  - - [64, 512, 40, 512]
    - [4, 59.185]
  - - [1536, 4096, 1, 1536]
    - [4, 93.536]
  - - [1536, 4096, 1, 4608]
    - [35, 95.026]
  - - [1536, 4096, 1, 50304]
    - [127, 97.912]
  - - [1536, 4096, 1, 6144]
    - [131, 94.844]
  - - [6144, 4096, 1, 1536]
    - [6, 96.101]
  - - [1024, 1024, 64, 96]
    - [6, 72.295]
  - - [96, 1024, 64, 1024]
    - [127, 78.575]
  - - [1536, 8192, 1, 1536]
    - [4, 95.036]
  - - [1536, 8192, 1, 4608]
    - [6, 95.968]
  - - [1536, 8192, 1, 50304]
    - [41, 96.959]
  - - [1536, 8192, 1, 6144]
    - [6, 96.132]
  - - [6144, 8192, 1, 1536]
    - [6, 96.663]
  - - [1024, 1024, 128, 96]
    - [6, 73.197]
  - - [96, 1024, 128, 1024]
    - [77, 81.179]
  - - [1024, 16384, 1, 1024]
    - [6, 93.506]
  - - [1024, 16384, 1, 3072]
    - [6, 94.487]
  - - [1024, 16384, 1, 4096]
    - [6, 94.522]
  - - [1024, 16384, 1, 50304]
    - [126, 95.368]
  - - [4096, 16384, 1, 1024]
    - [5, 96.345]
  - - [1024, 1024, 256, 64]
    - [6, 53.65]
  - - [64, 1024, 256, 1024]
    - [128, 73.75]
  - - [1024, 2048, 1, 50304]
    - [129, 89.078]
  - - [1024, 1024, 32, 64]
    - [6, 50.883]
  - - [64, 1024, 32, 1024]
    - [7, 65.926]
  - - [1024, 4096, 1, 50304]
    - [130, 90.533]
  - - [1024, 1024, 64, 64]
    - [6, 52.426]
  - - [64, 1024, 64, 1024]
    - [81, 69.75]
  - - [1024, 8192, 1, 50304]
    - [32, 91.033]
  - - [1024, 1024, 128, 64]
    - [6, 53.241]
  - - [64, 1024, 128, 1024]
    - [128, 70.5]
  - - [128, 128, 1024, 64]
    - [7, 37.424]
  - - [64, 128, 1024, 128]
    - [7, 38.929]
  - - [1024, 64, 1, 2]
    - [9, 0.095]
  - - [1024, 8192, 1, 30528]
    - [32, 91.042]
  - - [1024, 3456, 1, 1024]
    - [4, 88.23]
  - - [1024, 3456, 1, 512]
    - [4, 83.323]
  - - [1024, 864, 1, 1024]
    - [7, 72.391]
  - - [1024, 864, 1, 512]
    - [7, 62.813]
  - - [256, 3456, 1, 128]
    - [4, 35.442]
  - - [256, 4096, 1, 128]
    - [36, 38.043]
  - - [256, 6912, 1, 128]
    - [5, 46.395]
  - - [256, 864, 1, 128]
    - [101, 4.809]
  - - [480, 3456, 1, 1024]
    - [4, 77.483]
  - - [480, 864, 1, 1024]
    - [10, 59.069]
  - - [512, 3456, 1, 256]
    - [4, 62.62]
  - - [512, 864, 1, 256]
    - [34, 36.983]
  - - [1024, 640, 1, 30528]
    - [143, 77.656]
  - - [1024, 1280, 1, 30528]
    - [10, 82.27]
  - - [1024, 1600, 1, 30528]
    - [25, 88.077]
  - - [1024, 10240, 1, 1024]
    - [4, 91.681]
  - - [1024, 10240, 1, 4096]
    - [4, 93.227]
  - - [4096, 10240, 1, 1024]
    - [6, 95.678]
  - - [1024, 80, 1, 2]
    - [9, 0.115]
  - - [128, 128, 1280, 64]
    - [7, 37.78]
  - - [64, 128, 1280, 128]
    - [120, 39.457]
  - - [1024, 1640, 1, 30528]
    - [111, 89.928]
  - - [1024, 10496, 1, 1024]
    - [4, 93.601]
  - - [1024, 10496, 1, 4096]
    - [6, 95.424]
  - - [4096, 10496, 1, 1024]
    - [6, 95.978]
  - - [1024, 82, 1, 1024]
    - [19, 20.078]
  - - [1024, 82, 1, 2]
    - [9, 0.105]
  - - [128, 128, 1312, 64]
    - [7, 37.735]
  - - [64, 128, 1312, 128]
    - [132, 39.339]
  - - [1024, 160, 1, 30528]
    - [10, 57.199]
  - - [1024, 240, 1, 30528]
    - [143, 69.602]
  - - [1024, 6144, 1, 4096]
    - [104, 94.622]
  - - [1024, 12, 1, 1024]
    - [27, 3.168]
  - - [4096, 6144, 1, 1024]
    - [6, 95.694]
  - - [1024, 6144, 1, 1024]
    - [4, 91.733]
  - - [1024, 12, 1, 2]
    - [122, 0.005]
  - - [512, 512, 192, 64]
    - [6, 47.041]
  - - [64, 512, 192, 512]
    - [81, 62.438]
  - - [256, 4096, 1, 1]
    - [4, 0.422]
  - - [256, 6912, 1, 1]
    - [73, 0.251]
  - - [3136, 128, 64, 64]
    - [7, 44.852]
  - - [3136, 256, 64, 128]
    - [6, 76.388]
  - - [784, 512, 64, 256]
    - [6, 79.268]
  - - [3136, 128, 64, 256]
    - [6, 83.067]
  - - [3136, 256, 64, 256]
    - [6, 90.485]
  - - [196, 1024, 64, 512]
    - [6, 69.525]
  - - [784, 256, 64, 512]
    - [4, 84.997]
  - - [784, 512, 64, 512]
    - [4, 88.079]
  - - [196, 512, 64, 1024]
    - [4, 69.378]
  - - [196, 1024, 64, 1024]
    - [4, 71.186]
  - - [49, 2048, 64, 1024]
    - [7, 55.008]
  - - [49, 1024, 64, 2048]
    - [7, 60.229]
  - - [3136, 128, 32, 64]
    - [7, 43.029]
  - - [3136, 256, 32, 128]
    - [6, 73.073]
  - - [784, 512, 32, 256]
    - [4, 74.816]
  - - [3136, 128, 32, 256]
    - [6, 79.588]
  - - [3136, 256, 32, 256]
    - [6, 87.198]
  - - [196, 1024, 32, 512]
    - [4, 63.199]
  - - [784, 256, 32, 512]
    - [4, 79.888]
  - - [784, 512, 32, 512]
    - [4, 85.537]
  - - [196, 512, 32, 1024]
    - [4, 64.798]
  - - [196, 1024, 32, 1024]
    - [4, 69.77]
  - - [49, 2048, 32, 1024]
    - [7, 54.423]
  - - [49, 1024, 32, 2048]
    - [7, 56.757]
  - - [1024, 10224, 1, 1024]
    - [4, 91.625]
  - - [1024, 10192, 1, 1024]
    - [4, 90.941]
  - - [1024, 10208, 1, 1024]
    - [4, 91.395]
  - - [1024, 10224, 1, 4096]
    - [4, 93.054]
  - - [1024, 10224, 1, 3072]
    - [4, 92.893]
  - - [4096, 10224, 1, 1024]
    - [5, 95.43]
  - - [1024, 10240, 1, 3072]
    - [6, 92.943]
  - - [1024, 10192, 1, 3072]
    - [4, 92.591]
  - - [4096, 10192, 1, 1024]
    - [5, 95.136]
  - - [1024, 10192, 1, 4096]
    - [4, 92.745]
  - - [1024, 10200, 1, 3072]
    - [4, 92.794]
  - - [1024, 10184, 1, 1024]
    - [4, 90.99]
  - - [4096, 10208, 1, 1024]
    - [5, 95.36]
  - - [1024, 10208, 1, 3072]
    - [4, 92.611]
  - - [1024, 10208, 1, 4096]
    - [4, 92.864]
  - - [1024, 10224, 1, 2048]
    - [4, 92.467]
  - - [1024, 10240, 1, 2048]
    - [4, 92.558]
  - - [1024, 10120, 1, 1024]
    - [4, 90.521]
  - - [1024, 10192, 1, 2048]
    - [4, 92.318]
  - - [64, 24, 6816, 24]
    - [5, 9.251]
  - - [1024, 10152, 1, 1024]
    - [4, 90.979]
  - - [1024, 10080, 1, 3072]
    - [29, 91.903]
  - - [64, 26, 6272, 26]
    - [5, 10.652]
  - - [100352, 512, 1, 256]
    - [6, 89.813]
  - - [12544, 2048, 1, 1024]
    - [4, 94.48]
  - - [196, 256, 1, 2304]
    - [19, 15.278]
  - - [200704, 512, 1, 256]
    - [6, 73.231]
  - - [25088, 1024, 1, 512]
    - [6, 93.393]
  - - [3136, 64, 1, 576]
    - [10, 15.683]
  - - [49, 512, 1, 4608]
    - [147, 10.632]
  - - [50176, 1024, 1, 512]
    - [6, 94.09]
  - - [6272, 2048, 1, 1024]
    - [4, 93.364]
  - - [784, 128, 1, 1152]
    - [70, 25.048]
  - - [196, 1024, 128, 256]
    - [4, 62.489]
  - - [196, 1024, 256, 256]
    - [4, 63.276]
  - - [196, 256, 128, 1024]
    - [4, 68.608]
  - - [196, 256, 256, 1024]
    - [6, 70.999]
  - - [196, 512, 128, 1024]
    - [6, 71.007]
  - - [196, 512, 256, 1024]
    - [6, 72.082]
  - - [3136, 128, 128, 256]
    - [6, 85.958]
  - - [3136, 128, 256, 256]
    - [6, 87.288]
  - - [49, 2048, 128, 512]
    - [114, 48.965]
  - - [49, 2048, 256, 512]
    - [114, 49.451]
  - - [49, 512, 128, 2048]
    - [81, 62.551]
  - - [49, 512, 256, 2048]
    - [24, 59.473]
  - - [784, 256, 128, 512]
    - [4, 87.857]
  - - [784, 256, 256, 512]
    - [4, 88.751]
  - - [128, 128, 2048, 64]
    - [7, 38.102]
  - - [64, 128, 2048, 128]
    - [7, 39.357]
  - - [1024, 2560, 1, 30528]
    - [77, 89.81]
  - - [1024, 128, 1, 2]
    - [133, 0.166]
  - - [128, 128, 1536, 64]
    - [7, 37.628]
  - - [64, 128, 1536, 128]
    - [132, 39.234]
  - - [1024, 12288, 1, 4096]
    - [6, 95.872]
  - - [1024, 12288, 1, 1024]
    - [6, 94.372]
  - - [4096, 12288, 1, 1024]
    - [6, 96.477]
  - - [1024, 1920, 1, 30528]
    - [109, 90.082]
  - - [1024, 96, 1, 2]
    - [73, 0.037]
  - - [128, 128, 192, 64]
    - [7, 32.993]
  - - [64, 128, 192, 128]
    - [132, 36.292]
  - - [384, 384, 144, 64]
    - [7, 45.5]
  - - [64, 384, 144, 384]
    - [49, 59.057]
  - - [768, 4608, 1, 2]
    - [6, 1.393]
  - - [3072, 4608, 1, 768]
    - [4, 93.039]
  - - [768, 4608, 1, 3072]
    - [30, 88.055]
  - - [768, 4608, 1, 768]
    - [4, 87.054]
  - - [512, 512, 48, 64]
    - [6, 42.747]
  - - [64, 512, 48, 512]
    - [125, 59.789]
  - - [128, 128, 256, 64]
    - [6, 33.604]
  - - [64, 128, 256, 128]
    - [7, 36.438]
  - - [384, 384, 192, 64]
    - [7, 45.978]
  - - [64, 384, 192, 384]
    - [49, 54.474]
  - - [1024, 4608, 1, 2]
    - [4, 1.477]
  - - [4096, 4608, 1, 1024]
    - [6, 95.109]
  - - [1024, 4608, 1, 4096]
    - [29, 91.033]
  - - [1024, 4608, 1, 1024]
    - [4, 87.416]
  - - [3072, 256, 2, 1024]
    - [7, 80.292]
  - - [950, 512, 2, 2048]
    - [36, 67.814]
  - - [2852, 256, 2, 1024]
    - [4, 62.885]
  - - [3220, 256, 2, 1024]
    - [78, 75.552]
  - - [850, 2048, 2, 512]
    - [4, 70.222]
  - - [768, 2048, 2, 512]
    - [4, 83.143]
  - - [2904, 256, 2, 1024]
    - [7, 72.302]
  - - [805, 2048, 2, 512]
    - [4, 73.65]
  - - [864, 2048, 2, 512]
    - [7, 77.253]
  - - [2992, 256, 2, 1024]
    - [7, 77.092]
  - - [3400, 256, 2, 1024]
    - [4, 79.303]
  - - [4032, 256, 2, 1024]
    - [4, 79.521]
  - - [3400, 256, 1, 1024]
    - [54, 51.445]
  - - [15200, 128, 2, 512]
    - [6, 65.533]
  - - [12288, 128, 2, 512]
    - [5, 81.923]
  - - [888, 2048, 2, 512]
    - [4, 75.54]
  - - [13600, 128, 2, 512]
    - [6, 76.363]
  - - [12880, 128, 2, 512]
    - [36, 74.225]
  - - [3456, 256, 2, 1024]
    - [7, 70.12]
  - - [2944, 256, 2, 1024]
    - [7, 77.461]
  - - [2688, 256, 2, 1024]
    - [7, 71.36]
  - - [13824, 128, 2, 512]
    - [5, 81.494]
  - - [3036, 256, 2, 1024]
    - [5, 71.591]
  - - [3800, 256, 1, 1024]
    - [7, 56.766]
  - - [3168, 256, 2, 1024]
    - [5, 75.305]
  - - [3360, 256, 2, 1024]
    - [5, 79.468]
  - - [3552, 256, 2, 1024]
    - [7, 74.336]
  - - [11616, 128, 2, 512]
    - [7, 72.762]
  - - [4200, 256, 2, 1024]
    - [4, 80.288]
  - - [840, 2048, 2, 512]
    - [4, 72.237]
  - - [14208, 128, 2, 512]
    - [36, 78.655]
  - - [11968, 128, 2, 512]
    - [5, 80.151]
  - - [3264, 256, 2, 1024]
    - [4, 78.775]
  - - [713, 2048, 2, 512]
    - [4, 73.087]
  - - [13600, 256, 2, 512]
    - [6, 84.296]
  - - [12880, 256, 2, 512]
    - [4, 85.245]
  - - [12288, 256, 2, 512]
    - [5, 88.788]
  - - [850, 512, 2, 2048]
    - [54, 66.259]
  - - [2816, 256, 2, 1024]
    - [7, 74.508]
  - - [850, 2048, 1, 512]
    - [75, 63.056]
  - - [660, 2048, 2, 512]
    - [4, 69.154]
  - - [672, 2048, 2, 512]
    - [7, 75.519]
  - - [13440, 128, 2, 512]
    - [5, 69.061]
  - - [726, 2048, 2, 512]
    - [4, 73.621]
  - - [805, 512, 2, 2048]
    - [78, 70.261]
  - - [3500, 256, 2, 1024]
    - [4, 81.395]
  - - [13824, 256, 2, 512]
    - [5, 88.421]
  - - [15200, 256, 2, 512]
    - [6, 85.024]
  - - [864, 512, 2, 2048]
    - [42, 70.421]
  - - [3700, 256, 2, 1024]
    - [4, 68.284]
  - - [748, 2048, 2, 512]
    - [4, 76.674]
  - - [950, 256, 2, 2048]
    - [7, 54.547]
  - - [3600, 256, 2, 1024]
    - [42, 77.609]
  - - [888, 512, 2, 2048]
    - [29, 64.658]
  - - [4032, 1024, 2, 256]
    - [5, 80.94]
  - - [16128, 128, 2, 512]
    - [36, 79.989]
  - - [850, 3, 2, 256]
    - [62, 0.223]
  - - [850, 12, 2, 256]
    - [45, 0.874]
  - - [51520, 64, 2, 256]
    - [6, 65.305]
  - - [805, 12, 2, 256]
    - [16, 1.99]
  - - [46464, 64, 2, 256]
    - [6, 65.535]
  - - [805, 3, 2, 256]
    - [20, 0.511]
  - - [768, 3, 2, 256]
    - [13, 0.497]
  - - [768, 12, 2, 256]
    - [39, 0.813]
  - - [49152, 64, 2, 256]
    - [6, 67.457]
  - - [864, 12, 2, 256]
    - [20, 2.175]
  - - [864, 3, 2, 256]
    - [13, 0.544]
  - - [15200, 128, 1, 512]
    - [7, 70.254]
  - - [12288, 12, 2, 256]
    - [84, 17.629]
  - - [12288, 3, 2, 256]
    - [137, 2.592]
  - - [13600, 128, 1, 512]
    - [7, 70.099]
  - - [247, 3, 2, 256]
    - [22, 0.158]
  - - [216, 3, 2, 256]
    - [22, 0.058]
  - - [51520, 12, 2, 256]
    - [84, 21.846]
  - - [950, 3, 2, 256]
    - [13, 0.249]
  - - [2904, 1024, 2, 256]
    - [6, 73.15]
  - - [187, 12, 2, 256]
    - [53, 0.202]
  - - [176, 12, 2, 256]
    - [16, 0.431]
  - - [247, 12, 2, 256]
    - [16, 0.605]
  - - [187, 3, 2, 256]
    - [20, 0.118]
  - - [51520, 3, 2, 256]
    - [137, 4.959]
  - - [228, 12, 2, 256]
    - [16, 0.574]
  - - [221, 12, 2, 256]
    - [22, 0.572]
  - - [176, 3, 2, 256]
    - [16, 0.048]
  - - [950, 12, 2, 256]
    - [20, 2.349]
  - - [2992, 1024, 2, 256]
    - [5, 75.608]
  - - [192, 12, 2, 256]
    - [16, 0.47]
  - - [15200, 12, 2, 256]
    - [84, 15.304]
  - - [228, 3, 2, 256]
    - [53, 0.059]
  - - [1900, 512, 1, 1024]
    - [7, 64.316]
  - - [1700, 512, 1, 1024]
    - [29, 52.278]
  - - [1610, 512, 1, 1024]
    - [59, 57.544]
  - - [1536, 512, 1, 1024]
    - [4, 67.583]
  - - [1728, 512, 1, 1024]
    - [54, 56.99]
  - - [1536, 2048, 1, 1024]
    - [4, 88.842]
  - - [24576, 128, 1, 256]
    - [5, 68.218]
  - - [24576, 512, 1, 256]
    - [6, 87.345]
  - - [25760, 128, 1, 256]
    - [6, 61.356]
  - - [25760, 512, 1, 256]
    - [6, 78.718]
  - - [6144, 256, 1, 512]
    - [7, 73.021]
  - - [6440, 256, 1, 512]
    - [5, 66.388]
  - - [1024, 1024, 1, 320]
    - [7, 55.595]
  - - [15200, 3, 2, 256]
    - [135, 4.74]
  - - [51520, 64, 2, 64]
    - [6, 34.836]
  - - [3456, 3, 2, 256]
    - [53, 0.862]
  - - [3036, 1024, 2, 256]
    - [6, 71.733]
  - - [13600, 12, 2, 256]
    - [84, 18.104]
  - - [12880, 3, 2, 256]
    - [137, 2.507]
  - - [3400, 3, 2, 256]
    - [22, 0.851]
  - - [12880, 12, 2, 256]
    - [136, 17.568]
  - - [13824, 12, 2, 256]
    - [136, 18.856]
  - - [13824, 3, 2, 256]
    - [122, 2.622]
  - - [221, 3, 2, 256]
    - [58, 0.139]
  - - [13600, 3, 2, 256]
    - [137, 2.606]
  - - [13600, 512, 1, 128]
    - [6, 53.699]
  - - [9408, 512, 2, 128]
    - [6, 67.198]
  - - [3456, 12, 2, 256]
    - [20, 3.394]
  - - [56000, 256, 2, 64]
    - [6, 47.94]
  - - [3800, 3, 2, 256]
    - [13, 2.268]
  - - [2852, 1024, 2, 256]
    - [6, 72.303]
  - - [2816, 1024, 2, 256]
    - [4, 78.74]
  - - [60800, 256, 1, 64]
    - [6, 46.91]
  - - [3400, 12, 2, 256]
    - [16, 3.281]
  - - [3800, 12, 2, 256]
    - [57, 3.724]
  - - [192, 3, 2, 256]
    - [13, 0.124]
  - - [216, 12, 2, 256]
    - [17, 0.539]
  - - [2944, 1024, 2, 256]
    - [4, 79.315]
  - - [55296, 64, 2, 64]
    - [6, 37.665]
  - - [55296, 3, 2, 256]
    - [137, 5.138]
  - - [49152, 64, 2, 64]
    - [6, 37.569]
  - - [11776, 512, 2, 128]
    - [6, 70.763]
  - - [54400, 64, 2, 64]
    - [6, 37.261]
  - - [3220, 3, 2, 256]
    - [13, 1.973]
  - - [42240, 64, 2, 256]
    - [6, 68.171]
  - - [3072, 3, 2, 256]
    - [13, 2.006]
  - - [3220, 12, 2, 256]
    - [14, 3.165]
  - - [11616, 512, 2, 128]
    - [6, 57.131]
  - - [4200, 1024, 2, 256]
    - [6, 78.262]
  - - [3072, 12, 2, 256]
    - [17, 2.997]
  - - [672, 512, 2, 2048]
    - [4, 62.945]
  - - [54400, 256, 1, 64]
    - [6, 46.49]
  - - [54400, 64, 2, 256]
    - [6, 66.501]
  - - [15200, 512, 1, 128]
    - [6, 52.877]
  - - [56832, 64, 2, 256]
    - [6, 64.657]
  - - [2688, 1024, 2, 256]
    - [5, 77.832]
  - - [54400, 3, 2, 256]
    - [94, 5.93]
  - - [12672, 512, 2, 128]
    - [6, 71.835]
  - - [11968, 512, 2, 128]
    - [6, 69.376]
  - - [46464, 256, 2, 64]
    - [6, 48.663]
  - - [55296, 64, 2, 256]
    - [6, 68.104]
  - - [60800, 64, 2, 64]
    - [6, 38.767]
  - - [2400, 256, 2, 1024]
    - [4, 73.932]
  - - [660, 512, 2, 2048]
    - [0, 61.821]
  - - [2520, 256, 2, 1024]
    - [29, 60.363]
  - - [768, 512, 2, 2048]
    - [25, 74.906]
  - - [2400, 1024, 2, 256]
    - [5, 72.887]
  - - [10752, 128, 2, 512]
    - [7, 76.704]
  - - [45632, 256, 2, 64]
    - [6, 46.763]
  - - [2520, 1024, 2, 256]
    - [6, 70.882]
  - - [53760, 256, 2, 64]
    - [6, 48.825]
  - - [43008, 64, 2, 256]
    - [6, 63.069]
  - - [2352, 256, 2, 1024]
    - [4, 72.172]
  - - [47872, 256, 2, 64]
    - [6, 48.554]
  - - [47104, 256, 2, 64]
    - [6, 46.158]
  - - [50688, 256, 2, 64]
    - [6, 46.988]
  - - [45056, 256, 2, 64]
    - [6, 47.627]
  - - [13440, 512, 2, 128]
    - [6, 71.845]
  - - [2352, 1024, 2, 256]
    - [4, 73.122]
  - - [11264, 512, 2, 128]
    - [6, 66.271]
  - - [10560, 128, 2, 512]
    - [5, 80.486]
  - - [16128, 512, 2, 128]
    - [6, 72.89]
  - - [864, 256, 2, 2048]
    - [37, 71.504]
  - - [37632, 256, 2, 64]
    - [6, 47.825]
  - - [51520, 256, 2, 64]
    - [6, 46.963]
  - - [14000, 512, 2, 128]
    - [6, 58.609]
  - - [726, 512, 2, 2048]
    - [0, 68.137]
  - - [768, 256, 2, 2048]
    - [30, 66.96]
  - - [60800, 12, 2, 256]
    - [84, 21.283]
  - - [10560, 512, 2, 128]
    - [6, 66.429]
  - - [60800, 3, 2, 256]
    - [137, 5.726]
  - - [64512, 256, 2, 64]
    - [6, 46.449]
  - - [54400, 256, 2, 64]
    - [6, 49.164]
  - - [45632, 64, 2, 256]
    - [6, 63.873]
  - - [3264, 1024, 2, 256]
    - [5, 80.839]
  - - [713, 512, 2, 2048]
    - [0, 66.851]
  - - [805, 256, 2, 2048]
    - [64, 57.181]
  - - [60800, 64, 2, 256]
    - [6, 66.805]
  - - [10752, 512, 2, 128]
    - [6, 69.487]
  - - [3168, 1024, 2, 256]
    - [4, 75.153]
  - - [950, 2048, 1, 512]
    - [56, 69.065]
  - - [55296, 256, 2, 256]
    - [6, 90.831]
  - - [51520, 256, 2, 256]
    - [6, 89.062]
  - - [11408, 128, 2, 512]
    - [7, 71.764]
  - - [60800, 256, 2, 256]
    - [6, 91.268]
  - - [54400, 256, 2, 256]
    - [6, 91.366]
  - - [850, 256, 2, 2048]
    - [36, 44.851]
  - - [3700, 1024, 2, 256]
    - [6, 75.17]
  - - [60800, 256, 2, 64]
    - [6, 49.09]
  - - [3800, 1024, 1, 256]
    - [4, 57.289]
  - - [3400, 1024, 1, 256]
    - [6, 64.995]
  - - [3072, 1024, 2, 256]
    - [6, 81.923]
  - - [3600, 1024, 2, 256]
    - [5, 75.075]
  - - [12288, 512, 2, 128]
    - [6, 71.937]
  - - [49152, 256, 2, 256]
    - [6, 87.662]
  - - [12880, 512, 2, 128]
    - [6, 58.932]
  - - [11408, 512, 2, 128]
    - [6, 58.647]
  - - [42240, 256, 2, 64]
    - [6, 47.077]
  - - [1008, 2048, 2, 512]
    - [4, 79.389]
  - - [3360, 1024, 2, 256]
    - [4, 70.083]
  - - [14208, 512, 2, 128]
    - [6, 72.1]
  - - [56832, 256, 2, 64]
    - [6, 47.766]
  - - [43008, 256, 2, 64]
    - [6, 47.15]
  - - [13600, 512, 2, 128]
    - [6, 57.299]
  - - [3500, 1024, 2, 256]
    - [6, 72.732]
  - - [2640, 1024, 2, 256]
    - [4, 73.212]
  - - [13824, 512, 2, 128]
    - [6, 73.433]
  - - [3800, 256, 2, 1024]
    - [5, 69.025]
  - - [55296, 256, 2, 64]
    - [6, 48.09]
  - - [2640, 256, 2, 1024]
    - [36, 68.697]
  - - [15200, 512, 2, 128]
    - [6, 57.777]
  - - [3552, 1024, 2, 256]
    - [4, 75.473]
  - - [3220, 1024, 2, 256]
    - [6, 74.153]
  - - [3456, 1024, 2, 256]
    - [6, 81.821]
  - - [49152, 256, 2, 64]
    - [6, 46.202]
  - - [3400, 1024, 2, 256]
    - [6, 76.363]
  - - [950, 2048, 2, 512]
    - [4, 77.601]
  - - [3800, 1024, 2, 256]
    - [6, 77.135]
  - - [1610, 2048, 1, 1024]
    - [4, 79.499]
  - - [6912, 256, 1, 512]
    - [5, 74.234]
  - - [6800, 256, 1, 512]
    - [4, 71.345]
  - - [27648, 128, 1, 256]
    - [7, 57.426]
  - - [27200, 128, 1, 256]
    - [5, 69.613]
  - - [30400, 128, 1, 256]
    - [5, 70.808]
  - - [7600, 256, 1, 512]
    - [7, 69.709]
  - - [6144, 1024, 1, 512]
    - [6, 88.194]
  - - [6912, 1024, 1, 512]
    - [5, 82.618]
  - - [6440, 1024, 1, 512]
    - [5, 81.283]
  - - [27648, 512, 1, 256]
    - [6, 87.803]
  - - [1728, 2048, 1, 1024]
    - [4, 88.565]
  - - [27200, 512, 1, 256]
    - [6, 84.785]
  - - [6800, 1024, 1, 512]
    - [6, 84.74]
  - - [1700, 2048, 1, 1024]
    - [4, 82.99]
  - - [7600, 1024, 1, 512]
    - [6, 84.663]
  - - [30400, 512, 1, 256]
    - [6, 85.266]
  - - [1900, 2048, 1, 1024]
    - [4, 84.742]
  - - [1024, 1024, 1, 81]
    - [5, 23.482]
  - - [12544, 1024, 1, 1024]
    - [5, 92.736]
  - - [2, 6, 1, 1024]
    - [142, 0.002]
  - - [512, 128, 1, 256]
    - [15, 7.486]
  - - [256, 1, 1, 128]
    - [16, 0.017]
  - - [367, 128, 1, 512]
    - [13, 7.58]
  - - [16, 27, 128, 27]
    - [11, 0.782]
  - - [64, 128, 1, 16]
    - [67, 0.026]
  - - [256, 128, 1, 64]
    - [11, 1.313]
  - - [256, 128, 1, 1]
    - [12, 0.022]
  - - [16, 27, 1, 27]
    - [12, 0.007]
  - - [47000, 50000, 1, 20000]
    - [148, 87.797]
  - - [600, 8, 1, 2000]
    - [138, 1.28]
  - - [60483, 32, 1, 2000]
    - [24, 50.312]
  - - [2000, 8, 1, 60483]
    - [150, 11.611]
  - - [2000, 100, 1, 60483]
    - [143, 62.121]
  - - [2000, 100, 1, 600]
    - [151, 21.6315]
  - - [600, 100, 1, 2]
    - [152, 0.052]
  - - [2000, 32, 1, 60483]
    - [153, 35.9465]
  - - [1200, 4, 1, 400]
    - [39, 0.303]
  - - [1200, 22, 1, 1200]
    - [27, 4.025]
  - - [1200, 9, 1, 2400]
    - [150, 3.309]
  - - [1200, 9, 1, 1200]
    - [138, 1.73]
  - - [1200, 22, 1, 400]
    - [149, 2.816]
  - - [1200, 6, 1, 1200]
    - [138, 1.163]
  - - [1200, 10, 1, 2400]
    - [150, 3.6155]
  - - [1200, 10, 1, 1200]
    - [141, 1.858]
  - - [1200, 9, 1, 400]
    - [149, 1.1945]
  - - [1200, 6, 1, 400]
    - [39, 0.452]
  - - [3600, 22, 1, 3600]
    - [154, 20.625]
  - - [1200, 6, 1, 2400]
    - [150, 2.244]
  - - [1200, 8, 1, 400]
    - [61, 0.583]
  - - [1200, 8, 1, 2400]
    - [150, 2.958]
  - - [1200, 8, 1, 1200]
    - [141, 1.515]
  - - [1200, 32, 1, 400]
    - [149, 4.247]
  - - [3600, 32, 1, 3600]
    - [155, 29.761]
  - - [1200, 32, 1, 1200]
    - [156, 8.4415]
  - - [1200, 3, 1, 1200]
    - [142, 0.59]
  - - [1200, 3, 1, 400]
    - [13, 0.224]
  - - [1200, 3, 1, 2400]
    - [150, 1.094]
  - - [1200, 4, 1, 1200]
    - [138, 0.784]
  - - [1000, 224, 1, 4000]
    - [30, 38.202]
  - - [224, 7168, 1, 4000]
    - [37, 72.107]
