library/src/blas3/Tensile/Logic/asm_full/aldebaran_104cu/aldebaran_Cijk_Ailk_Bjlk_BSS_BH.yaml
- {MinimumRequiredVersion: 4.32.1}
- aldebaran
- {Architecture: gfx90a, CUCount: 104}
- [Device 0050, Device 0051, Device 0052, Device 0054, Device 0062, Device 7400, Device
    SolutionIndex: 0
    SolutionNameMin: Cijk_Ailk_Bjlk_BSS_BH_MT128x256x32_MI32x32x8x1_SE_1LDSB0_AF0EM8_GRVW8_GSU1_NLCA1_NLCB1_SU0_SUS0_SRVW4_TT2_128_VAW2_WG64_4_1_WGM2
    SolutionIndex: 1
    SolutionNameMin: Cijk_Ailk_Bjlk_BSS_BH_MT128x128x32_MI32x32x8x1_SE_1LDSB0_AF0EM4_GRVW8_GSU1_NLCA1_NLCB1_SU0_SUS0_SRVW0_TT2_64_VAW2_WG64_4_1_WGM15
    SolutionIndex: 2
    SolutionNameMin: Cijk_Ailk_Bjlk_BSS_BH_MT256x160x32_MI32x32x8x1_SE_1LDSB0_AF0EM8_GRVW4_GSU1_NLCA1_NLCB5_SU0_SUS0_SRVW4_TT2_160_VAW2_WG128_2_1_WGM2
    SolutionIndex: 3
    SolutionNameMin: Cijk_Ailk_Bjlk_BSS_BH_MT64x64x32_MI32x32x8x1_SE_1LDSB0_AF0EM8_GRVW8_GSU1_NLCA1_NLCB1_SU0_SUS0_SRVW4_TT1_32_VAW2_WG64_4_1_WGM1
    SolutionIndex: 4
    SolutionNameMin: Cijk_Ailk_Bjlk_BSS_BH_MT32x32x64_MI16x16x16x1_SE_1LDSB0_AF0EM1_GRVW8_GSU1_NLCA1_NLCB1_SU0_SUS0_SRVW0_TT1_16_VAW2_WG32_8_1_WGM2
    SolutionIndex: 5
    SolutionNameMin: Cijk_Ailk_Bjlk_BSS_BH_MT128x128x32_MI32x32x8x1_SE_1LDSB0_AF0EM4_GRVW8_GSU1_NLCA1_NLCB1_SU0_SUS0_SRVW0_TT2_64_VAW2_WG64_4_1_WGM2
    SolutionIndex: 6
    SolutionNameMin: Cijk_Ailk_Bjlk_BSS_BH_MT128x256x32_MI32x32x8x1_SE_1LDSB0_AF0EM4_GRVW8_GSU1_NLCA1_NLCB1_SU0_SUS0_SRVW4_TT2_128_VAW2_WG64_4_1_WGM1
    SolutionIndex: 7
    SolutionNameMin: Cijk_Ailk_Bjlk_BSS_BH_MT64x64x64_MI32x32x8x1_SE_1LDSB0_AF0EM8_GRVW8_GSU1_NLCA1_NLCB1_SU0_SUS0_SRVW4_TT1_32_VAW2_WG64_4_1_WGM1
    SolutionIndex: 8
    SolutionNameMin: Cijk_Ailk_Bjlk_BSS_BH_MT32x32x16_MI16x16x16x1_SE_1LDSB0_AF0EM4_GRVW2_GSU1_NLCA1_NLCB1_SU0_SUS0_SRVW0_TT1_16_VAW2_WG32_8_1_WGM1
    SolutionIndex: 9
    SolutionNameMin: Cijk_Ailk_Bjlk_BSS_BH_MT32x32x32_MI16x16x16x1_SE_1LDSB0_AF0EM8_GRVW2_GSU1_NLCA1_NLCB1_SU0_SUS0_SRVW4_TT1_16_VAW2_WG32_8_1_WGM1
    SolutionIndex: 10
    SolutionNameMin: Cijk_Ailk_Bjlk_BSS_BH_MT64x32x16_MI16x16x16x1_SE_1LDSB0_AF0EM4_GRVW4_GSU1_NLCA1_NLCB1_SU0_SUS0_SRVW4_TT2_16_VAW2_WG32_8_1_WGM1
    SolutionIndex: 11
    SolutionNameMin: Cijk_Ailk_Bjlk_BSS_BH_MT64x32x16_MI16x16x16x1_SE_1LDSB0_AF0EM4_GRVW2_GSU1_NLCA1_NLCB1_SU0_SUS0_SRVW4_TT2_16_VAW2_WG32_8_1_WGM1
    SolutionIndex: 12
    SolutionNameMin: Cijk_Ailk_Bjlk_BSS_BH_MT64x32x16_MI16x16x16x1_SE_1LDSB0_AF0EM8_GRVW2_GSU1_NLCA1_NLCB1_SU0_SUS0_SRVW4_TT2_16_VAW2_WG32_8_1_WGM1
    SolutionIndex: 13
    SolutionNameMin: Cijk_Ailk_Bjlk_BSS_BH_MT64x128x32_MI32x32x8x1_SE_1LDSB0_AF0EM8_GRVW8_GSU1_NLCA1_NLCB1_SU32_SUS128_SRVW4_TT1_64_VAW2_WG64_4_1_WGM2
    SolutionIndex: 14
    SolutionNameMin: Cijk_Ailk_Bjlk_BSS_BH_MT32x32x16_MI16x16x16x1_SE_1LDSB0_AF0EM4_GRVW4_GSU1_NLCA1_NLCB1_SU0_SUS0_SRVW0_TT1_16_VAW2_WG32_8_1_WGM15
    SolutionIndex: 15
    SolutionNameMin: Cijk_Ailk_Bjlk_BSS_BH_MT32x32x128_MI16x16x16x1_SE_1LDSB0_AF0EM4_GRVW2_GSU1_NLCA1_NLCB1_SU0_SUS0_SRVW0_TT1_16_VAW2_WG32_8_1_WGM1
    SolutionIndex: 16
    SolutionNameMin: Cijk_Ailk_Bjlk_BSS_BH_MT128x96x64_MI32x32x8x1_SE_1LDSB0_AF0EM8_GRVW8_GSU1_NLCA1_NLCB3_SU32_SUS128_SRVW4_TT1_96_VAW2_WG128_2_1_WGM15
    SolutionIndex: 17
    SolutionNameMin: Cijk_Ailk_Bjlk_BSS_BH_MT128x96x16_MI32x32x8x1_SE_1LDSB0_AF0EM4_GRVW2_GSU1_NLCA1_NLCB3_SU0_SUS0_SRVW4_TT1_96_VAW2_WG128_2_1_WGM2
    SolutionIndex: 18
    SolutionNameMin: Cijk_Ailk_Bjlk_BSS_BH_MT160x256x32_MI32x32x8x1_SE_1LDSB0_AF0EM8_GRVW4_GSU1_NLCA5_NLCB1_SU0_SUS0_SRVW0_TT5_64_VAW2_WG32_8_1_WGM1
    SolutionIndex: 19
    SolutionNameMin: Cijk_Ailk_Bjlk_BSS_BH_MT64x128x16_MI32x32x8x1_SE_1LDSB0_AF0EM8_GRVW4_GSU1_NLCA1_NLCB1_SU0_SUS0_SRVW4_TT1_64_VAW2_WG64_4_1_WGM15
    SolutionIndex: 20
    SolutionNameMin: Cijk_Ailk_Bjlk_BSS_BH_MT64x16x32_MI16x16x16x1_SE_1LDSB0_AF0EM8_GRVW2_GSU15_NLCA1_NLCB1_SU0_SUS0_SRVW0_TT1_16_VAW1_WG64_4_1_WGM2
    SolutionIndex: 21
    SolutionNameMin: Cijk_Ailk_Bjlk_BSS_BH_MT256x160x32_MI32x32x8x1_SE_1LDSB0_AF0EM8_GRVW4_GSU1_NLCA1_NLCB5_SU0_SUS0_SRVW4_TT2_160_VAW2_WG128_2_1_WGM15
    SolutionIndex: 22
    SolutionNameMin: Cijk_Ailk_Bjlk_BSS_BH_MT64x128x16_MI32x32x8x1_SE_1LDSB0_AF0EM8_GRVW8_GSU1_NLCA1_NLCB1_SU0_SUS0_SRVW4_TT1_64_VAW2_WG64_4_1_WGM1
    SolutionIndex: 23
    SolutionNameMin: Cijk_Ailk_Bjlk_BSS_BH_MT32x32x16_MI16x16x16x1_SE_1LDSB0_AF0EM4_GRVW4_GSU1_NLCA1_NLCB1_SU0_SUS0_SRVW0_TT1_16_VAW2_WG32_8_1_WGM1
    SolutionIndex: 24
    SolutionNameMin: Cijk_Ailk_Bjlk_BSS_BH_MT64x64x32_MI32x32x8x1_SE_1LDSB0_AF0EM4_GRVW4_GSU1_NLCA1_NLCB1_SU0_SUS0_SRVW4_TT1_32_VAW2_WG64_4_1_WGM1
    SolutionIndex: 25
    SolutionNameMin: Cijk_Ailk_Bjlk_BSS_BH_MT128x96x16_MI32x32x8x1_SE_1LDSB0_AF0EM8_GRVW2_GSU1_NLCA1_NLCB3_SU0_SUS0_SRVW4_TT1_96_VAW2_WG128_2_1_WGM2
    SolutionIndex: 26
    SolutionNameMin: Cijk_Ailk_Bjlk_BSS_BH_MT64x128x16_MI32x32x8x1_SE_1LDSB0_AF0EM8_GRVW8_GSU1_NLCA1_NLCB1_SU0_SUS0_SRVW4_TT1_64_VAW2_WG64_4_1_WGM15
    SolutionIndex: 27
    SolutionNameMin: Cijk_Ailk_Bjlk_BSS_BH_MT16x16x16_MI16x16x16x1_SE_1LDSB0_AF0EM8_GRVW2_GSU1_NLCA1_NLCB1_SU0_SUS0_SRVW0_TT1_16_VAW2_WG16_4_1_WGM1
    SolutionIndex: 28
    SolutionNameMin: Cijk_Ailk_Bjlk_BSS_BH_MT64x16x32_MI16x16x16x1_SE_1LDSB0_AF0EM8_GRVW8_GSU15_NLCA1_NLCB1_SU0_SUS0_SRVW0_TT1_16_VAW1_WG64_4_1_WGM15
    SolutionIndex: 29
    SolutionNameMin: Cijk_Ailk_Bjlk_BSS_BH_MT256x160x32_MI32x32x8x1_SE_1LDSB0_AF0EM8_GRVW4_GSU1_NLCA1_NLCB5_SU32_SUS256_SRVW4_TT2_160_VAW2_WG128_2_1_WGM15
    SolutionIndex: 30
    SolutionNameMin: Cijk_Ailk_Bjlk_BSS_BH_MT160x256x32_MI32x32x8x1_SE_1LDSB0_AF0EM8_GRVW4_GSU1_NLCA5_NLCB1_SU0_SUS0_SRVW0_TT5_64_VAW2_WG32_8_1_WGM2
    SolutionIndex: 31
    SolutionNameMin: Cijk_Ailk_Bjlk_BSS_BH_MT64x16x32_MI16x16x16x1_SE_1LDSB0_AF0EM8_GRVW8_GSU7_NLCA1_NLCB1_SU0_SUS0_SRVW0_TT1_16_VAW1_WG64_4_1_WGM1
    SolutionIndex: 32
    SolutionNameMin: Cijk_Ailk_Bjlk_BSS_BH_MT64x128x32_MI32x32x8x1_SE_1LDSB0_AF0EM8_GRVW8_GSU1_NLCA1_NLCB1_SU0_SUS0_SRVW4_TT1_64_VAW2_WG64_4_1_WGM1
    SolutionIndex: 33
    SolutionNameMin: Cijk_Ailk_Bjlk_BSS_BH_MT160x256x32_MI32x32x8x1_SE_1LDSB0_AF0EM8_GRVW4_GSU1_NLCA5_NLCB1_SU32_SUS128_SRVW0_TT5_64_VAW2_WG32_8_1_WGM1
    SolutionIndex: 34
    SolutionNameMin: Cijk_Ailk_Bjlk_BSS_BH_MT16x16x32_MI16x16x16x1_SE_1LDSB0_AF0EM1_GRVW4_GSU15_NLCA1_NLCB1_SU0_SUS0_SRVW0_TT1_16_VAW1_WG16_4_1_WGM1
    SolutionIndex: 35
    SolutionNameMin: Cijk_Ailk_Bjlk_BSS_BH_MT64x64x64_MI32x32x8x1_SE_1LDSB0_AF0EM8_GRVW8_GSU15_NLCA1_NLCB1_SU0_SUS0_SRVW0_TT1_32_VAW1_WG64_4_1_WGM1
    SolutionIndex: 36
    SolutionNameMin: Cijk_Ailk_Bjlk_BSS_BH_MT128x256x32_MI32x32x8x1_SE_1LDSB0_AF0EM1_GRVW8_GSU7_NLCA1_NLCB1_SU32_SUS128_SRVW0_TT2_128_VAW1_WG64_4_1_WGM2
    SolutionIndex: 37
    SolutionNameMin: Cijk_Ailk_Bjlk_BSS_BH_MT256x128x32_MI32x32x8x1_SE_1LDSB0_AF0EM8_GRVW8_GSU15_NLCA1_NLCB1_SU0_SUS0_SRVW0_TT4_64_VAW1_WG64_4_1_WGM1
    SolutionIndex: 38
    SolutionNameMin: Cijk_Ailk_Bjlk_BSS_BH_MT128x128x64_MI32x32x8x1_SE_1LDSB0_AF0EM8_GRVW8_GSU3_NLCA1_NLCB1_SU0_SUS0_SRVW0_TT2_64_VAW1_WG64_4_1_WGM2
    SolutionIndex: 39
    SolutionNameMin: Cijk_Ailk_Bjlk_BSS_BH_MT128x256x32_MI32x32x8x1_SE_1LDSB0_AF0EM8_GRVW8_GSU3_NLCA1_NLCB1_SU0_SUS0_SRVW0_TT2_128_VAW1_WG64_4_1_WGM2
    SolutionIndex: 40
    SolutionNameMin: Cijk_Ailk_Bjlk_BSS_BH_MT64x64x32_MI32x32x8x1_SE_1LDSB0_AF0EM8_GRVW8_GSU1_NLCA1_NLCB1_SU32_SUS128_SRVW4_TT1_32_VAW2_WG64_4_1_WGM1
    SolutionIndex: 41
    SolutionNameMin: Cijk_Ailk_Bjlk_BSS_BH_MT32x64x16_MI16x16x16x1_SE_1LDSB0_AF0EM4_GRVW2_GSU1_NLCA1_NLCB1_SU0_SUS0_SRVW0_TT1_32_VAW2_WG32_8_1_WGM1
    SolutionIndex: 42
    SolutionNameMin: Cijk_Ailk_Bjlk_BSS_BH_MT128x256x32_MI32x32x8x1_SE_1LDSB0_AF0EM8_GRVW8_GSU3_NLCA1_NLCB1_SU0_SUS0_SRVW0_TT2_128_VAW1_WG64_4_1_WGM1
    SolutionIndex: 43
    SolutionNameMin: Cijk_Ailk_Bjlk_BSS_BH_MT256x128x32_MI32x32x8x1_SE_1LDSB0_AF0EM8_GRVW8_GSU3_NLCA1_NLCB1_SU0_SUS0_SRVW0_TT4_64_VAW1_WG64_4_1_WGM15
    SolutionIndex: 44
    SolutionNameMin: Cijk_Ailk_Bjlk_BSS_BH_MT256x128x32_MI32x32x8x1_SE_1LDSB0_AF0EM8_GRVW8_GSU3_NLCA1_NLCB1_SU0_SUS0_SRVW0_TT4_64_VAW1_WG64_4_1_WGM1
    SolutionIndex: 45
    SolutionNameMin: Cijk_Ailk_Bjlk_BSS_BH_MT32x64x16_MI16x16x16x1_SE_1LDSB0_AF0EM1_GRVW2_GSU1_NLCA1_NLCB1_SU0_SUS0_SRVW4_TT1_32_VAW2_WG32_8_1_WGM1
    SolutionIndex: 46
    SolutionNameMin: Cijk_Ailk_Bjlk_BSS_BH_MT16x16x16_MI16x16x16x1_SE_1LDSB0_AF0EM1_GRVW8_GSU1_NLCA1_NLCB1_SU0_SUS0_SRVW4_TT1_16_VAW2_WG16_4_1_WGM1
    SolutionIndex: 47
    SolutionNameMin: Cijk_Ailk_Bjlk_BSS_BH_MT32x64x16_MI16x16x16x1_SE_1LDSB0_AF0EM1_GRVW8_GSU1_NLCA1_NLCB1_SU0_SUS0_SRVW4_TT1_32_VAW2_WG32_8_1_WGM1
    SolutionIndex: 48
    SolutionNameMin: Cijk_Ailk_Bjlk_BSS_BH_MT32x64x16_MI16x16x16x1_SE_1LDSB0_AF0EM4_GRVW2_GSU1_NLCA1_NLCB1_SU0_SUS0_SRVW0_TT1_32_VAW2_WG32_8_1_WGM15
    SolutionIndex: 49
    SolutionNameMin: Cijk_Ailk_Bjlk_BSS_BH_MT32x64x16_MI16x16x16x1_SE_1LDSB0_AF0EM1_GRVW2_GSU1_NLCA1_NLCB1_SU32_SUS128_SRVW4_TT1_32_VAW2_WG32_8_1_WGM15
    SolutionIndex: 50
    SolutionNameMin: Cijk_Ailk_Bjlk_BSS_BH_MT32x64x16_MI16x16x16x1_SE_1LDSB0_AF0EM1_GRVW2_GSU1_NLCA1_NLCB1_SU0_SUS0_SRVW0_TT1_32_VAW2_WG32_8_1_WGM1
    SolutionIndex: 51
    SolutionNameMin: Cijk_Ailk_Bjlk_BSS_BH_MT32x64x16_MI16x16x16x1_SE_1LDSB0_AF0EM4_GRVW2_GSU1_NLCA1_NLCB1_SU0_SUS0_SRVW0_TT1_32_VAW2_WG32_8_1_WGM2
    SolutionIndex: 52
    SolutionNameMin: Cijk_Ailk_Bjlk_BSS_BH_MT64x32x16_MI16x16x16x1_SE_1LDSB0_AF0EM4_GRVW2_GSU1_NLCA1_NLCB1_SU0_SUS0_SRVW0_TT2_16_VAW2_WG32_8_1_WGM1
    SolutionIndex: 53
    SolutionNameMin: Cijk_Ailk_Bjlk_BSS_BH_MT64x32x16_MI16x16x16x1_SE_1LDSB1_AF0EM8_GRVW2_GSU1_NLCA1_NLCB1_SU0_SUS0_SRVW4_TT2_16_VAW2_WG32_8_1_WGM1
    SolutionIndex: 54
    SolutionNameMin: Cijk_Ailk_Bjlk_BSS_BH_MT64x32x16_MI16x16x16x1_SE_1LDSB0_AF0EM8_GRVW4_GSU1_NLCA1_NLCB1_SU0_SUS0_SRVW4_TT2_16_VAW2_WG32_8_1_WGM1
    SolutionIndex: 55
    SolutionNameMin: Cijk_Ailk_Bjlk_BSS_BH_MT32x32x64_MI16x16x16x1_SE_1LDSB0_AF0EM4_GRVW8_GSU1_NLCA1_NLCB1_SU32_SUS128_SRVW0_TT1_16_VAW2_WG32_8_1_WGM1
    SolutionIndex: 56
    SolutionNameMin: Cijk_Ailk_Bjlk_BSS_BH_MT32x32x64_MI16x16x16x1_SE_1LDSB0_AF0EM4_GRVW4_GSU1_NLCA1_NLCB1_SU32_SUS128_SRVW0_TT1_16_VAW2_WG32_8_1_WGM1
    SolutionIndex: 57
    SolutionNameMin: Cijk_Ailk_Bjlk_BSS_BH_MT32x32x32_MI16x16x16x1_SE_1LDSB0_AF0EM4_GRVW4_GSU1_NLCA1_NLCB1_SU0_SUS0_SRVW0_TT1_16_VAW2_WG32_8_1_WGM15
    SolutionIndex: 58
    SolutionNameMin: Cijk_Ailk_Bjlk_BSS_BH_MT32x32x64_MI16x16x16x1_SE_1LDSB0_AF0EM1_GRVW4_GSU1_NLCA1_NLCB1_SU0_SUS0_SRVW0_TT1_16_VAW2_WG32_8_1_WGM2
    SolutionIndex: 59
    SolutionNameMin: Cijk_Ailk_Bjlk_BSS_BH_MT32x32x16_MI16x16x16x1_SE_1LDSB0_AF0EM1_GRVW2_GSU1_NLCA1_NLCB1_SU0_SUS0_SRVW0_TT1_16_VAW2_WG32_8_1_WGM1
    SolutionIndex: 60
    SolutionNameMin: Cijk_Ailk_Bjlk_BSS_BH_MT64x64x16_MI32x32x8x1_SE_1LDSB0_AF0EM1_GRVW4_GSU1_NLCA1_NLCB1_SU0_SUS0_SRVW4_TT1_32_VAW2_WG64_4_1_WGM2
    SolutionIndex: 61
    SolutionNameMin: Cijk_Ailk_Bjlk_BSS_BH_MT64x64x64_MI32x32x8x1_SE_1LDSB0_AF0EM8_GRVW8_GSU1_NLCA1_NLCB1_SU0_SUS0_SRVW4_TT1_32_VAW2_WG64_4_1_WGM2
    SolutionIndex: 62
    SolutionNameMin: Cijk_Ailk_Bjlk_BSS_BH_MT64x32x16_MI16x16x16x1_SE_1LDSB1_AF0EM8_GRVW2_GSU1_NLCA1_NLCB1_SU0_SUS0_SRVW4_TT2_16_VAW2_WG32_8_1_WGM15
    SolutionIndex: 63
    SolutionNameMin: Cijk_Ailk_Bjlk_BSS_BH_MT32x64x16_MI16x16x16x1_SE_1LDSB1_AF0EM1_GRVW2_GSU1_NLCA1_NLCB1_SU32_SUS256_SRVW4_TT1_32_VAW2_WG32_8_1_WGM15
    SolutionIndex: 64
    SolutionNameMin: Cijk_Ailk_Bjlk_BSS_BH_MT128x128x64_MI32x32x8x1_SE_1LDSB0_AF0EM8_GRVW8_GSU5_NLCA1_NLCB1_SU0_SUS0_SRVW0_TT2_64_VAW1_WG64_4_1_WGM1
    SolutionIndex: 65
    SolutionNameMin: Cijk_Ailk_Bjlk_BSS_BH_MT256x128x32_MI32x32x8x1_SE_1LDSB0_AF0EM8_GRVW8_GSU5_NLCA1_NLCB1_SU0_SUS0_SRVW0_TT4_64_VAW1_WG64_4_1_WGM1
    SolutionIndex: 66
    SolutionNameMin: Cijk_Ailk_Bjlk_BSS_BH_MT128x128x64_MI32x32x8x1_SE_1LDSB0_AF0EM8_GRVW8_GSU2_NLCA1_NLCB1_SU0_SUS0_SRVW0_TT2_64_VAW1_WG64_4_1_WGM15
    SolutionIndex: 67
    SolutionNameMin: Cijk_Ailk_Bjlk_BSS_BH_MT128x96x64_MI32x32x8x1_SE_1LDSB0_AF0EM8_GRVW8_GSU1_NLCA1_NLCB3_SU0_SUS0_SRVW4_TT1_96_VAW2_WG128_2_1_WGM2
    SolutionIndex: 68
    SolutionNameMin: Cijk_Ailk_Bjlk_BSS_BH_MT128x128x64_MI32x32x8x1_SE_1LDSB0_AF0EM8_GRVW4_GSU1_NLCA1_NLCB1_SU0_SUS0_SRVW4_TT2_64_VAW2_WG64_4_1_WGM1
    SolutionIndex: 69
    SolutionNameMin: Cijk_Ailk_Bjlk_BSS_BH_MT128x160x32_MI32x32x8x1_SE_1LDSB0_AF0EM8_GRVW4_GSU1_NLCA1_NLCB5_SU32_SUS128_SRVW4_TT1_160_VAW2_WG128_2_1_WGM2
    SolutionIndex: 70
    SolutionNameMin: Cijk_Ailk_Bjlk_BSS_BH_MT128x160x32_MI32x32x8x1_SE_1LDSB0_AF0EM8_GRVW4_GSU1_NLCA1_NLCB5_SU32_SUS128_SRVW4_TT1_160_VAW2_WG128_2_1_WGM15
    SolutionIndex: 71
    SolutionNameMin: Cijk_Ailk_Bjlk_BSS_BH_MT128x96x32_MI32x32x8x1_SE_1LDSB0_AF0EM8_GRVW4_GSU1_NLCA1_NLCB3_SU0_SUS0_SRVW4_TT1_96_VAW2_WG128_2_1_WGM1
    SolutionIndex: 72
    SolutionNameMin: Cijk_Ailk_Bjlk_BSS_BH_MT128x96x32_MI32x32x8x1_SE_1LDSB0_AF0EM4_GRVW4_GSU1_NLCA1_NLCB3_SU0_SUS0_SRVW4_TT1_96_VAW2_WG128_2_1_WGM2
    SolutionIndex: 73
    SolutionNameMin: Cijk_Ailk_Bjlk_BSS_BH_MT128x96x32_MI32x32x8x1_SE_1LDSB0_AF0EM4_GRVW4_GSU1_NLCA1_NLCB3_SU32_SUS128_SRVW4_TT1_96_VAW2_WG128_2_1_WGM2
    SolutionIndex: 74
    SolutionNameMin: Cijk_Ailk_Bjlk_BSS_BH_MT128x256x32_MI32x32x8x1_SE_1LDSB0_AF0EM8_GRVW8_GSU1_NLCA1_NLCB1_SU0_SUS0_SRVW4_TT2_128_VAW2_WG64_4_1_WGM15
    SolutionIndex: 75
    SolutionNameMin: Cijk_Ailk_Bjlk_BSS_BH_MT128x288x32_MI32x32x8x1_SE_1LDSB0_AF0EM4_GRVW4_GSU1_NLCA1_NLCB9_SU0_SUS0_SRVW4_TT1_288_VAW2_WG128_2_1_WGM2
    SolutionIndex: 76
    SolutionNameMin: Cijk_Ailk_Bjlk_BSS_BH_MT128x288x32_MI32x32x8x1_SE_1LDSB0_AF0EM8_GRVW4_GSU1_NLCA1_NLCB9_SU0_SUS0_SRVW4_TT1_288_VAW2_WG128_2_1_WGM2
    SolutionIndex: 77
    SolutionNameMin: Cijk_Ailk_Bjlk_BSS_BH_MT256x256x16_MI32x32x8x1_SE_1LDSB0_AF0EM4_GRVW4_GSU1_NLCA1_NLCB1_SU16_SUS256_SRVW0_TT4_128_VAW2_WG64_4_1_WGM1
    SolutionIndex: 78
    SolutionNameMin: Cijk_Ailk_Bjlk_BSS_BH_MT64x64x32_MI32x32x8x1_SE_1LDSB0_AF0EM1_GRVW8_GSU1_NLCA1_NLCB1_SU0_SUS0_SRVW4_TT1_32_VAW2_WG64_4_1_WGM1
    SolutionIndex: 79
    SolutionNameMin: Cijk_Ailk_Bjlk_BSS_BH_MT32x32x32_MI16x16x16x1_SE_1LDSB0_AF0EM4_GRVW8_GSU1_NLCA1_NLCB1_SU0_SUS0_SRVW0_TT1_16_VAW2_WG32_8_1_WGM1
    SolutionIndex: 80
    SolutionNameMin: Cijk_Ailk_Bjlk_BSS_BH_MT64x64x128_MI32x32x8x1_SE_1LDSB0_AF0EM4_GRVW8_GSU1_NLCA1_NLCB1_SU16_SUS256_SRVW4_TT1_32_VAW2_WG64_4_1_WGM2
    SolutionIndex: 81
    SolutionNameMin: Cijk_Ailk_Bjlk_BSS_BH_MT64x64x128_MI32x32x8x1_SE_1LDSB0_AF0EM4_GRVW8_GSU1_NLCA1_NLCB1_SU16_SUS256_SRVW4_TT1_32_VAW2_WG64_4_1_WGM15
    SolutionIndex: 82
    SolutionNameMin: Cijk_Ailk_Bjlk_BSS_BH_MT64x64x128_MI32x32x8x1_SE_1LDSB0_AF0EM1_GRVW8_GSU1_NLCA1_NLCB1_SU32_SUS256_SRVW4_TT1_32_VAW2_WG64_4_1_WGM1
    SolutionIndex: 83
    SolutionNameMin: Cijk_Ailk_Bjlk_BSS_BH_MT96x128x64_MI32x32x8x1_SE_1LDSB0_AF0EM8_GRVW8_GSU5_NLCA3_NLCB1_SU32_SUS256_SRVW0_TT3_32_VAW1_WG32_8_1_WGM2
    SolutionIndex: 84
    SolutionNameMin: Cijk_Ailk_Bjlk_BSS_BH_MT128x256x32_MI32x32x8x1_SE_1LDSB0_AF0EM8_GRVW8_GSU1_NLCA1_NLCB1_SU0_SUS0_SRVW4_TT2_128_VAW2_WG64_4_1_WGM1
    SolutionIndex: 85
    SolutionNameMin: Cijk_Ailk_Bjlk_BSS_BH_MT128x256x32_MI32x32x8x1_SE_1LDSB0_AF0EM8_GRVW8_GSU1_NLCA1_NLCB1_SU32_SUS256_SRVW4_TT2_128_VAW2_WG64_4_1_WGM1
    SolutionIndex: 86
    SolutionNameMin: Cijk_Ailk_Bjlk_BSS_BH_MT128x64x64_MI32x32x8x1_SE_1LDSB0_AF0EM4_GRVW8_GSU1_NLCA1_NLCB1_SU0_SUS0_SRVW4_TT2_32_VAW2_WG64_4_1_WGM15
    SolutionIndex: 87
    SolutionNameMin: Cijk_Ailk_Bjlk_BSS_BH_MT64x128x32_MI32x32x8x1_SE_1LDSB0_AF0EM8_GRVW8_GSU1_NLCA1_NLCB1_SU0_SUS0_SRVW4_TT1_64_VAW2_WG64_4_1_WGM2
    SolutionIndex: 88
    SolutionNameMin: Cijk_Ailk_Bjlk_BSS_BH_MT128x96x32_MI32x32x8x1_SE_1LDSB0_AF0EM4_GRVW4_GSU1_NLCA1_NLCB3_SU0_SUS0_SRVW4_TT1_96_VAW2_WG128_2_1_WGM15
    SolutionIndex: 89
    SolutionNameMin: Cijk_Ailk_Bjlk_BSS_BH_MT96x128x32_MI32x32x8x1_SE_1LDSB0_AF0EM8_GRVW4_GSU1_NLCA3_NLCB1_SU0_SUS0_SRVW0_TT3_32_VAW2_WG32_8_1_WGM1
    SolutionIndex: 90
    SolutionNameMin: Cijk_Ailk_Bjlk_BSS_BH_MT96x128x16_MI32x32x8x1_SE_1LDSB0_AF0EM8_GRVW2_GSU1_NLCA3_NLCB1_SU0_SUS0_SRVW0_TT3_32_VAW2_WG32_8_1_WGM2
    SolutionIndex: 91
    SolutionNameMin: Cijk_Ailk_Bjlk_BSS_BH_MT256x128x32_MI32x32x8x1_SE_1LDSB0_AF0EM8_GRVW8_GSU3_NLCA1_NLCB1_SU32_SUS256_SRVW0_TT4_64_VAW1_WG64_4_1_WGM1
    SolutionIndex: 92
    SolutionNameMin: Cijk_Ailk_Bjlk_BSS_BH_MT128x64x16_MI32x32x8x1_SE_1LDSB0_AF0EM4_GRVW4_GSU1_NLCA1_NLCB1_SU0_SUS0_SRVW0_TT2_32_VAW2_WG64_4_1_WGM15
    SolutionIndex: 93
    SolutionNameMin: Cijk_Ailk_Bjlk_BSS_BH_MT64x128x32_MI32x32x8x1_SE_1LDSB0_AF0EM8_GRVW8_GSU1_NLCA1_NLCB1_SU32_SUS128_SRVW4_TT1_64_VAW2_WG64_4_1_WGM1
    SolutionIndex: 94
    SolutionNameMin: Cijk_Ailk_Bjlk_BSS_BH_MT64x128x16_MI32x32x8x1_SE_1LDSB0_AF0EM1_GRVW8_GSU1_NLCA1_NLCB1_SU0_SUS0_SRVW4_TT1_64_VAW2_WG64_4_1_WGM1
    SolutionIndex: 95
    SolutionNameMin: Cijk_Ailk_Bjlk_BSS_BH_MT64x128x32_MI32x32x8x1_SE_1LDSB0_AF0EM4_GRVW8_GSU1_NLCA1_NLCB1_SU0_SUS0_SRVW4_TT1_64_VAW2_WG64_4_1_WGM1
    SolutionIndex: 96
    SolutionNameMin: Cijk_Ailk_Bjlk_BSS_BH_MT64x16x32_MI16x16x16x1_SE_1LDSB0_AF0EM8_GRVW4_GSU1_NLCA1_NLCB1_SU0_SUS0_SRVW0_TT1_16_VAW2_WG64_4_1_WGM15
    SolutionIndex: 97
    SolutionNameMin: Cijk_Ailk_Bjlk_BSS_BH_MT128x96x64_MI32x32x8x1_SE_1LDSB0_AF0EM4_GRVW8_GSU1_NLCA1_NLCB3_SU0_SUS0_SRVW4_TT1_96_VAW2_WG128_2_1_WGM2
    SolutionIndex: 98
    SolutionNameMin: Cijk_Ailk_Bjlk_BSS_BH_MT32x32x64_MI16x16x16x1_SE_1LDSB0_AF0EM8_GRVW2_GSU7_NLCA1_NLCB1_SU0_SUS0_SRVW0_TT1_16_VAW1_WG32_8_1_WGM15
    SolutionIndex: 99
    SolutionNameMin: Cijk_Ailk_Bjlk_BSS_BH_MT32x32x64_MI16x16x16x1_SE_1LDSB0_AF0EM8_GRVW4_GSU5_NLCA1_NLCB1_SU0_SUS0_SRVW0_TT1_16_VAW1_WG32_8_1_WGM1
    SolutionIndex: 100
    SolutionNameMin: Cijk_Ailk_Bjlk_BSS_BH_MT32x32x16_MI16x16x16x1_SE_1LDSB0_AF0EM4_GRVW8_GSU1_NLCA1_NLCB1_SU0_SUS0_SRVW0_TT1_16_VAW2_WG32_8_1_WGM2
    SolutionIndex: 101
    SolutionNameMin: Cijk_Ailk_Bjlk_BSS_BH_MT128x128x64_MI32x32x8x1_SE_1LDSB0_AF0EM8_GRVW8_GSU3_NLCA1_NLCB1_SU0_SUS0_SRVW0_TT2_64_VAW1_WG64_4_1_WGM1
    SolutionIndex: 102
    SolutionNameMin: Cijk_Ailk_Bjlk_BSS_BH_MT32x64x128_MI16x16x16x1_SE_1LDSB0_AF0EM1_GRVW8_GSU1_NLCA1_NLCB1_SU32_SUS256_SRVW0_TT1_32_VAW2_WG32_8_1_WGM15
    SolutionIndex: 103
    SolutionNameMin: Cijk_Ailk_Bjlk_BSS_BH_MT64x64x32_MI32x32x8x1_SE_1LDSB0_AF0EM8_GRVW8_GSU7_NLCA1_NLCB1_SU0_SUS0_SRVW0_TT1_32_VAW1_WG64_4_1_WGM1
    SolutionIndex: 104
    SolutionNameMin: Cijk_Ailk_Bjlk_BSS_BH_MT144x256x32_MI16x16x16x1_SE_1LDSB0_AF0EM8_GRVW2_GSU1_NLCA9_NLCB2_SU0_SUS0_SRVW0_TT9_64_VAW2_WG16_16_1_WGM1
    SolutionIndex: 105
    SolutionNameMin: Cijk_Ailk_Bjlk_BSS_BH_MT64x32x16_MI16x16x16x1_SE_1LDSB0_AF0EM1_GRVW2_GSU1_NLCA1_NLCB1_SU0_SUS0_SRVW4_TT2_16_VAW2_WG32_8_1_WGM2
    SolutionIndex: 106
    SolutionNameMin: Cijk_Ailk_Bjlk_BSS_BH_MT128x96x16_MI32x32x8x1_SE_1LDSB0_AF0EM4_GRVW2_GSU1_NLCA1_NLCB3_SU16_SUS256_SRVW4_TT1_96_VAW2_WG128_2_1_WGM15
    SolutionIndex: 107
    SolutionNameMin: Cijk_Ailk_Bjlk_BSS_BH_MT64x128x16_MI32x32x8x1_SE_1LDSB0_AF0EM4_GRVW8_GSU1_NLCA1_NLCB1_SU0_SUS0_SRVW4_TT1_64_VAW2_WG64_4_1_WGM1
    SolutionIndex: 108
    SolutionNameMin: Cijk_Ailk_Bjlk_BSS_BH_MT64x128x32_MI32x32x8x1_SE_1LDSB0_AF0EM1_GRVW8_GSU1_NLCA1_NLCB1_SU0_SUS0_SRVW4_TT1_64_VAW2_WG64_4_1_WGM1
    SolutionIndex: 109
    SolutionNameMin: Cijk_Ailk_Bjlk_BSS_BH_MT64x128x16_MI32x32x8x1_SE_1LDSB0_AF0EM8_GRVW8_GSU1_NLCA1_NLCB1_SU0_SUS0_SRVW4_TT1_64_VAW2_WG64_4_1_WGM2
    SolutionIndex: 110
    SolutionNameMin: Cijk_Ailk_Bjlk_BSS_BH_MT64x128x16_MI32x32x8x1_SE_1LDSB0_AF0EM4_GRVW2_GSU1_NLCA1_NLCB1_SU0_SUS0_SRVW4_TT1_64_VAW2_WG64_4_1_WGM15
    SolutionIndex: 111
    SolutionNameMin: Cijk_Ailk_Bjlk_BSS_BH_MT64x64x32_MI32x32x8x1_SE_1LDSB0_AF0EM8_GRVW8_GSU1_NLCA1_NLCB1_SU0_SUS0_SRVW4_TT1_32_VAW2_WG64_4_1_WGM2
    SolutionIndex: 112
    SolutionNameMin: Cijk_Ailk_Bjlk_BSS_BH_MT64x16x32_MI16x16x16x1_SE_1LDSB0_AF0EM8_GRVW8_GSU1_NLCA1_NLCB1_SU0_SUS0_SRVW0_TT1_16_VAW2_WG64_4_1_WGM2
    SolutionIndex: 113
    SolutionNameMin: Cijk_Ailk_Bjlk_BSS_BH_MT256x144x32_MI16x16x16x1_SE_1LDSB0_AF0EM4_GRVW2_GSU1_NLCA2_NLCB9_SU0_SUS0_SRVW4_TT4_144_VAW2_WG64_4_1_WGM15
    SolutionIndex: 114
    SolutionNameMin: Cijk_Ailk_Bjlk_BSS_BH_MT128x96x16_MI32x32x8x1_SE_1LDSB0_AF0EM8_GRVW2_GSU1_NLCA1_NLCB3_SU0_SUS0_SRVW4_TT1_96_VAW2_WG128_2_1_WGM1
    SolutionIndex: 115
    SolutionNameMin: Cijk_Ailk_Bjlk_BSS_BH_MT64x64x64_MI32x32x8x1_SE_1LDSB0_AF0EM4_GRVW8_GSU1_NLCA1_NLCB1_SU0_SUS0_SRVW4_TT1_32_VAW2_WG64_4_1_WGM1
    SolutionIndex: 116
    SolutionNameMin: Cijk_Ailk_Bjlk_BSS_BH_MT64x16x32_MI16x16x16x1_SE_1LDSB0_AF0EM8_GRVW8_GSU15_NLCA1_NLCB1_SU0_SUS0_SRVW4_TT1_16_VAW1_WG64_4_1_WGM1
    SolutionIndex: 117
    SolutionNameMin: Cijk_Ailk_Bjlk_BSS_BH_MT16x16x64_MI16x16x16x1_SE_1LDSB0_AF0EM1_GRVW4_GSU7_NLCA1_NLCB1_SU0_SUS0_SRVW0_TT1_16_VAW1_WG16_4_1_WGM15
    SolutionIndex: 118
    SolutionNameMin: Cijk_Ailk_Bjlk_BSS_BH_MT32x32x64_MI16x16x16x1_SE_1LDSB0_AF0EM1_GRVW8_GSU1_NLCA1_NLCB1_SU0_SUS0_SRVW4_TT1_16_VAW2_WG32_8_1_WGM2
    SolutionIndex: 119
    SolutionNameMin: Cijk_Ailk_Bjlk_BSS_BH_MT64x256x16_MI32x32x8x1_SE_1LDSB0_AF0EM1_GRVW8_GSU1_NLCA1_NLCB1_SU0_SUS0_SRVW4_TT1_128_VAW2_WG64_4_1_WGM1
    SolutionIndex: 120
    SolutionNameMin: Cijk_Ailk_Bjlk_BSS_BH_MT64x128x16_MI32x32x8x1_SE_1LDSB0_AF0EM1_GRVW2_GSU1_NLCA1_NLCB1_SU0_SUS0_SRVW4_TT1_64_VAW2_WG64_4_1_WGM2
    SolutionIndex: 121
    SolutionNameMin: Cijk_Ailk_Bjlk_BSS_BH_MT32x32x64_MI16x16x16x1_SE_1LDSB0_AF0EM8_GRVW8_GSU1_NLCA1_NLCB1_SU0_SUS0_SRVW4_TT1_16_VAW2_WG32_8_1_WGM1
    SolutionIndex: 122
    SolutionNameMin: Cijk_Ailk_Bjlk_BSS_BH_MT64x64x64_MI32x32x8x1_SE_1LDSB0_AF0EM8_GRVW8_GSU1_NLCA1_NLCB1_SU0_SUS0_SRVW4_TT1_32_VAW2_WG64_4_1_WGM15
    SolutionIndex: 123
    SolutionNameMin: Cijk_Ailk_Bjlk_BSS_BH_MT32x32x128_MI16x16x16x1_SE_1LDSB0_AF0EM1_GRVW8_GSU1_NLCA1_NLCB1_SU0_SUS0_SRVW0_TT1_16_VAW2_WG32_8_1_WGM2
    SolutionIndex: 124
    SolutionNameMin: Cijk_Ailk_Bjlk_BSS_BH_MT64x32x128_MI16x16x16x1_SE_1LDSB0_AF0EM4_GRVW8_GSU1_NLCA1_NLCB1_SU0_SUS0_SRVW4_TT2_16_VAW2_WG32_8_1_WGM1
    SolutionIndex: 125
    SolutionNameMin: Cijk_Ailk_Bjlk_BSS_BH_MT32x64x128_MI16x16x16x1_SE_1LDSB0_AF0EM1_GRVW8_GSU1_NLCA1_NLCB1_SU16_SUS256_SRVW0_TT1_32_VAW2_WG32_8_1_WGM15
    SolutionIndex: 126
    SolutionNameMin: Cijk_Ailk_Bjlk_BSS_BH_MT64x64x128_MI32x32x8x1_SE_1LDSB0_AF0EM4_GRVW8_GSU1_NLCA1_NLCB1_SU32_SUS256_SRVW4_TT1_32_VAW2_WG64_4_1_WGM15
    SolutionIndex: 127
    SolutionNameMin: Cijk_Ailk_Bjlk_BSS_BH_MT64x128x64_MI32x32x8x1_SE_1LDSB0_AF0EM1_GRVW8_GSU1_NLCA1_NLCB1_SU16_SUS256_SRVW4_TT1_64_VAW2_WG64_4_1_WGM15
    SolutionIndex: 128
    SolutionNameMin: Cijk_Ailk_Bjlk_BSS_BH_MT32x32x64_MI16x16x16x1_SE_1LDSB0_AF0EM4_GRVW4_GSU1_NLCA1_NLCB1_SU32_SUS128_SRVW0_TT1_16_VAW2_WG32_8_1_WGM15
    SolutionIndex: 129
    SolutionNameMin: Cijk_Ailk_Bjlk_BSS_BH_MT64x64x64_MI32x32x8x1_SE_1LDSB0_AF0EM4_GRVW8_GSU1_NLCA1_NLCB1_SU16_SUS128_SRVW4_TT1_32_VAW2_WG64_4_1_WGM1
    SolutionIndex: 130
    SolutionNameMin: Cijk_Ailk_Bjlk_BSS_BH_MT32x32x128_MI16x16x16x1_SE_1LDSB0_AF0EM4_GRVW2_GSU1_NLCA1_NLCB1_SU32_SUS256_SRVW0_TT1_16_VAW2_WG32_8_1_WGM1
    SolutionIndex: 131
    SolutionNameMin: Cijk_Ailk_Bjlk_BSS_BH_MT64x32x64_MI16x16x16x1_SE_1LDSB0_AF0EM8_GRVW8_GSU5_NLCA1_NLCB1_SU32_SUS128_SRVW0_TT2_16_VAW1_WG32_8_1_WGM15
    SolutionIndex: 132
    SolutionNameMin: Cijk_Ailk_Bjlk_BSS_BH_MT64x128x64_MI32x32x8x1_SE_1LDSB0_AF0EM4_GRVW8_GSU1_NLCA1_NLCB1_SU32_SUS128_SRVW4_TT1_64_VAW2_WG64_4_1_WGM15
    SolutionIndex: 133
    SolutionNameMin: Cijk_Ailk_Bjlk_BSS_BH_MT64x64x64_MI32x32x8x1_SE_1LDSB0_AF0EM8_GRVW4_GSU7_NLCA1_NLCB1_SU0_SUS0_SRVW0_TT1_32_VAW1_WG64_4_1_WGM1
    SolutionIndex: 134
    SolutionNameMin: Cijk_Ailk_Bjlk_BSS_BH_MT64x256x16_MI32x32x8x1_SE_1LDSB0_AF0EM8_GRVW8_GSU1_NLCA1_NLCB1_SU0_SUS0_SRVW4_TT1_128_VAW2_WG64_4_1_WGM1
    SolutionIndex: 135
    SolutionNameMin: Cijk_Ailk_Bjlk_BSS_BH_MT64x128x32_MI32x32x8x1_SE_1LDSB0_AF0EM8_GRVW8_GSU1_NLCA1_NLCB1_SU32_SUS256_SRVW4_TT1_64_VAW2_WG64_4_1_WGM1
    SolutionIndex: 136
    SolutionNameMin: Cijk_Ailk_Bjlk_BSS_BH_MT64x128x16_MI32x32x8x1_SE_1LDSB0_AF0EM4_GRVW8_GSU1_NLCA1_NLCB1_SU0_SUS0_SRVW4_TT1_64_VAW2_WG64_4_1_WGM2
    SolutionIndex: 137
    SolutionNameMin: Cijk_Ailk_Bjlk_BSS_BH_MT128x96x16_MI32x32x8x1_SE_1LDSB0_AF0EM4_GRVW2_GSU1_NLCA1_NLCB3_SU32_SUS128_SRVW4_TT1_96_VAW2_WG128_2_1_WGM2
    SolutionIndex: 138
    SolutionNameMin: Cijk_Ailk_Bjlk_BSS_BH_MT128x96x64_MI32x32x8x1_SE_1LDSB0_AF0EM4_GRVW8_GSU1_NLCA1_NLCB3_SU0_SUS0_SRVW4_TT1_96_VAW2_WG128_2_1_WGM1
    SolutionIndex: 139
    SolutionNameMin: Cijk_Ailk_Bjlk_BSS_BH_MT64x64x32_MI32x32x8x1_SE_1LDSB0_AF0EM1_GRVW4_GSU1_NLCA1_NLCB1_SU16_SUS128_SRVW4_TT1_32_VAW2_WG64_4_1_WGM15
    SolutionIndex: 140
    SolutionNameMin: Cijk_Ailk_Bjlk_BSS_BH_MT128x96x32_MI32x32x8x1_SE_1LDSB0_AF0EM8_GRVW4_GSU1_NLCA1_NLCB3_SU0_SUS0_SRVW4_TT1_96_VAW2_WG128_2_1_WGM2
    SolutionIndex: 141
    SolutionNameMin: Cijk_Ailk_Bjlk_BSS_BH_MT128x96x32_MI32x32x8x1_SE_1LDSB0_AF0EM8_GRVW4_GSU1_NLCA1_NLCB3_SU0_SUS0_SRVW4_TT1_96_VAW2_WG128_2_1_WGM15
    SolutionIndex: 142
    SolutionNameMin: Cijk_Ailk_Bjlk_BSS_BH_MT128x256x32_MI32x32x8x1_SE_1LDSB0_AF0EM4_GRVW4_GSU1_NLCA1_NLCB1_SU16_SUS128_SRVW4_TT2_128_VAW2_WG64_4_1_WGM1
    SolutionIndex: 143
    SolutionNameMin: Cijk_Ailk_Bjlk_BSS_BH_MT128x256x32_MI32x32x8x1_SE_1LDSB0_AF0EM8_GRVW8_GSU1_NLCA1_NLCB1_SU32_SUS128_SRVW4_TT2_128_VAW2_WG64_4_1_WGM1
    SolutionIndex: 144
    SolutionNameMin: Cijk_Ailk_Bjlk_BSS_BH_MT128x128x64_MI32x32x8x1_SE_1LDSB0_AF0EM8_GRVW4_GSU1_NLCA1_NLCB1_SU32_SUS256_SRVW4_TT2_64_VAW2_WG64_4_1_WGM1
    SolutionIndex: 145
    SolutionNameMin: Cijk_Ailk_Bjlk_BSS_BH_MT256x128x32_MI32x32x8x1_SE_1LDSB0_AF0EM1_GRVW8_GSU1_NLCA1_NLCB1_SU0_SUS0_SRVW0_TT4_64_VAW2_WG64_4_1_WGM15
    SolutionIndex: 146
    SolutionNameMin: Cijk_Ailk_Bjlk_BSS_BH_MT128x160x32_MI32x32x8x1_SE_1LDSB0_AF0EM4_GRVW4_GSU1_NLCA1_NLCB5_SU16_SUS128_SRVW4_TT1_160_VAW2_WG128_2_1_WGM1
    SolutionIndex: 147
    SolutionNameMin: Cijk_Ailk_Bjlk_BSS_BH_MT32x32x32_MI16x16x16x1_SE_1LDSB0_AF0EM4_GRVW8_GSU1_NLCA1_NLCB1_SU0_SUS0_SRVW0_TT1_16_VAW2_WG32_8_1_WGM15
    SolutionIndex: 148
    SolutionNameMin: Cijk_Ailk_Bjlk_BSS_BH_MT64x32x16_MI16x16x16x1_SE_1LDSB1_AF0EM8_GRVW4_GSU1_NLCA1_NLCB1_SU0_SUS0_SRVW4_TT2_16_VAW2_WG32_8_1_WGM2
    SolutionIndex: 149
    SolutionNameMin: Cijk_Ailk_Bjlk_BSS_BH_MT16x16x16_MI16x16x16x1_SE_1LDSB0_AF0EM1_GRVW4_GSU1_NLCA1_NLCB1_SU0_SUS0_SRVW0_TT1_16_VAW2_WG16_4_1_WGM2
    SolutionIndex: 150
    SolutionNameMin: Cijk_Ailk_Bjlk_BSS_BH_MT32x32x16_MI16x16x16x1_SE_1LDSB0_AF0EM8_GRVW8_GSU1_NLCA1_NLCB1_SU0_SUS0_SRVW4_TT1_16_VAW2_WG32_8_1_WGM2
    SolutionIndex: 151
    SolutionNameMin: Cijk_Ailk_Bjlk_BSS_BH_MT64x32x16_MI16x16x16x1_SE_1LDSB0_AF0EM8_GRVW2_GSU1_NLCA1_NLCB1_SU0_SUS0_SRVW4_TT2_16_VAW2_WG32_8_1_WGM2
    SolutionIndex: 152
    SolutionNameMin: Cijk_Ailk_Bjlk_BSS_BH_MT128x96x64_MI32x32x8x1_SN_AMAS0_IU1_LBSPP256_LPA0_LPB0_NLCB3_PLR9_SPO0_SSO2_SVW1_TT1_96_VS0_VW1_WG128_2_1_WGM8
    SolutionIndex: 153
    SolutionNameMin: Cijk_Ailk_Bjlk_BSS_BH_MT128x128x32_MI32x32x8x1_SN_1LDSB1_AMAS3_EPS1_IU2_NEPBS4_NLCB1_PGR1_PLR1_SU0_SUS0_SPO1_SSO2_SVW2_TT2_64_VW2_WG64_4_1_WGM4
    SolutionIndex: 154
    SolutionNameMin: Cijk_Ailk_Bjlk_BSS_BH_MT128x128x32_MI32x32x8x1_SN_1LDSB1_AMAS0_EPS0_IU2_NEPBS4_NLCB1_PGR2_PLR1_SU32_SUS128_SPO0_SSO2_SVW1_TT2_64_VW1_WG64_4_1_WGM8
    SolutionIndex: 155
    SolutionNameMin: Cijk_Ailk_Bjlk_BSS_BH_MT128x128x32_MI32x32x8x1_SN_1LDSB1_AMAS3_EPS0_IU2_NEPBS2_NLCB1_PGR2_PLR1_SU0_SUS0_SPO0_SSO2_SVW2_TT2_64_VW2_WG64_4_1_WGM4
    SolutionIndex: 156
    SolutionNameMin: Cijk_Ailk_Bjlk_BSS_BH_MT128x128x32_MI32x32x8x1_SN_1LDSB1_AMAS0_EPS0_IU2_NEPBS4_NLCB1_PGR2_PLR1_SU32_SUS128_SPO0_SSO4_SVW1_TT2_64_VW1_WG64_4_1_WGM16
    SolutionIndex: 157
    SolutionNameMin: Cijk_Ailk_Bjlk_BSS_BH_MT128x128x32_MI32x32x8x1_SN_1LDSB1_AMAS3_EPS0_IU1_NEPBS2_NLCB1_PGR2_PLR5_SU0_SUS0_SPO1_SSO4_SVW2_TT2_64_VW2_WG64_4_1_WGM4
    SolutionIndex: 158
    SolutionNameMin: Cijk_Ailk_Bjlk_BSS_BH_MT128x128x32_MI32x32x8x1_SN_1LDSB1_AMAS0_EPS1_IU1_NEPBS4_NLCB1_PGR1_PLR5_SU32_SUS128_SPO0_SSO2_SVW1_TT2_64_VW1_WG64_4_1_WGM16
    SolutionIndex: 159
    SolutionNameMin: Cijk_Ailk_Bjlk_BSS_BH_MT128x128x32_MI32x32x8x1_SN_1LDSB1_AMAS0_EPS1_IU1_NEPBS4_NLCB1_PGR1_PLR5_SU0_SUS0_SPO1_SSO2_SVW1_TT2_64_VW1_WG64_4_1_WGM4
    SolutionIndex: 160
    SolutionNameMin: Cijk_Ailk_Bjlk_BSS_BH_MT128x128x32_MI32x32x8x1_SN_1LDSB1_AMAS0_EPS1_IU1_NEPBS4_NLCB1_PGR1_PLR5_SU32_SUS128_SPO1_SSO2_SVW1_TT2_64_VW1_WG64_4_1_WGM16
    SolutionIndex: 161
    SolutionNameMin: Cijk_Ailk_Bjlk_BSS_BH_MT128x128x32_MI32x32x8x1_SN_1LDSB1_AMAS0_EPS0_IU2_NEPBS2_NLCB1_PGR2_PLR1_SU0_SUS0_SPO0_SSO4_SVW1_TT2_64_VW1_WG64_4_1_WGM4
    SolutionIndex: 162
    SolutionNameMin: Cijk_Ailk_Bjlk_BSS_BH_MT128x128x32_MI32x32x8x1_SN_1LDSB1_AMAS3_EPS0_IU1_NEPBS2_NLCB1_PGR2_PLR5_SU32_SUS256_SPO1_SSO4_SVW2_TT2_64_VW2_WG64_4_1_WGM4
    SolutionIndex: 163
    SolutionNameMin: Cijk_Ailk_Bjlk_BSS_BH_MT128x128x32_MI32x32x8x1_SN_1LDSB1_AMAS0_EPS1_IU1_NEPBS4_NLCB1_PGR1_PLR5_SU32_SUS128_SPO1_SSO4_SVW1_TT2_64_VW1_WG64_4_1_WGM16
    SolutionIndex: 164
    SolutionNameMin: Cijk_Ailk_Bjlk_BSS_BH_MT128x128x32_MI32x32x8x1_SN_1LDSB1_AMAS3_EPS0_IU1_NEPBS1_NLCB1_PGR2_PLR5_SU0_SUS0_SPO1_SSO4_SVW2_TT2_64_VW2_WG64_4_1_WGM4
    SolutionIndex: 165
    SolutionNameMin: Cijk_Ailk_Bjlk_BSS_BH_MT128x128x32_MI32x32x8x1_SN_1LDSB1_AMAS0_EPS0_IU1_NEPBS4_NLCB1_PGR2_PLR5_SU32_SUS128_SPO1_SSO2_SVW1_TT2_64_VW1_WG64_4_1_WGM4
    SolutionIndex: 166
    SolutionNameMin: Cijk_Ailk_Bjlk_BSS_BH_MT128x96x64_MI32x32x8x1_SN_AMAS0_IU2_LBSPP0_NLCB3_PLR1_SPO0_SSO0_SVW1_TT1_96_VW1_WSGRA0_WG128_2_1_WGM8
    SolutionIndex: 167
    SolutionNameMin: Cijk_Ailk_Bjlk_BSS_BH_MT128x128x32_MI32x32x8x1_SN_AMAS3_IU1_LBSPP128_NLCB1_PLR1_SPO0_SSO4_SVW2_TT2_64_VW2_WSGRA1_WG64_4_1_WGM15
    SolutionIndex: 168
    SolutionNameMin: Cijk_Ailk_Bjlk_BSS_BH_MT128x128x32_MI32x32x8x1_SN_1LDSB1_AMAS0_EPS0_IU2_NEPBS4_NLCB1_PGR2_PLR1_SU32_SUS128_SPO0_SSO4_SVW1_TT2_64_VW1_WG64_4_1_WGM8
    SolutionIndex: 169
    SolutionNameMin: Cijk_Ailk_Bjlk_BSS_BH_MT128x128x32_MI32x32x8x1_SN_1LDSB1_AMAS3_EPS0_IU2_NEPBS1_NLCB1_PGR2_PLR1_SU0_SUS0_SPO0_SSO0_SVW2_TT2_64_VW2_WG64_4_1_WGM8
    SolutionIndex: 170
    SolutionNameMin: Cijk_Ailk_Bjlk_BSS_BH_MT128x128x32_MI32x32x8x1_SN_1LDSB0_AMAS3_EPS0_IU1_NEPBS1_NLCB1_PGR2_PLR1_SU32_SUS256_SPO1_SSO0_SVW2_TT2_64_VW2_WG64_4_1_WGM8
    SolutionIndex: 171
    SolutionNameMin: Cijk_Ailk_Bjlk_BSS_BH_MT128x128x32_MI32x32x8x1_SN_1LDSB1_AMAS0_EPS1_IU1_NEPBS4_NLCB1_PGR1_PLR5_SU32_SUS128_SPO0_SSO2_SVW1_TT2_64_VW1_WG64_4_1_WGM15
    SolutionIndex: 172
    SolutionNameMin: Cijk_Ailk_Bjlk_BSS_BH_MT128x128x32_MI32x32x8x1_SN_1LDSB1_AMAS0_EPS1_IU1_NEPBS4_NLCB1_PGR1_PLR5_SU32_SUS256_SPO0_SSO2_SVW1_TT2_64_VW1_WG64_4_1_WGM15
    SolutionIndex: 173
    SolutionNameMin: Cijk_Ailk_Bjlk_BSS_BH_MT128x128x32_MI32x32x8x1_SN_1LDSB1_AMAS0_EPS0_IU2_NEPBS1_NLCB1_PGR2_PLR1_SU0_SUS0_SPO0_SSO2_SVW1_TT2_64_VW1_WG64_4_1_WGM8
    SolutionIndex: 174
    SolutionNameMin: Cijk_Ailk_Bjlk_BSS_BH_MT128x128x32_MI32x32x8x1_SN_1LDSB1_AMAS0_EPS1_IU1_NEPBS4_NLCB1_PGR1_PLR5_SU32_SUS256_SPO1_SSO2_SVW1_TT2_64_VW1_WG64_4_1_WGM15
    SolutionIndex: 175
    SolutionNameMin: Cijk_Ailk_Bjlk_BSS_BH_MT128x128x32_MI32x32x8x1_SN_1LDSB0_AMAS3_EPS0_IU1_NEPBS2_NLCB1_PGR2_PLR1_SU0_SUS0_SPO1_SSO4_SVW2_TT2_64_VW2_WG64_4_1_WGM8
    SolutionIndex: 176
    SolutionNameMin: Cijk_Ailk_Bjlk_BSS_BH_MT128x128x32_MI32x32x8x1_SN_1LDSB1_AMAS0_EPS1_IU1_NEPBS4_NLCB1_PGR1_PLR5_SU32_SUS128_SPO1_SSO2_SVW1_TT2_64_VW1_WG64_4_1_WGM8
    SolutionIndex: 177
    SolutionNameMin: Cijk_Ailk_Bjlk_BSS_BH_MT128x128x32_MI32x32x8x1_SN_1LDSB0_AMAS3_EPS0_IU1_NEPBS2_NLCB1_PGR2_PLR1_SU0_SUS0_SPO1_SSO0_SVW2_TT2_64_VW2_WG64_4_1_WGM8
    SolutionIndex: 178
    SolutionNameMin: Cijk_Ailk_Bjlk_BSS_BH_MT128x128x32_MI32x32x8x1_SN_1LDSB0_AMAS0_EPS0_IU1_NEPBS4_NLCB1_PGR2_PLR5_SU0_SUS0_SPO1_SSO4_SVW1_TT2_64_VW1_WG64_4_1_WGM8
    SolutionIndex: 179
    SolutionNameMin: Cijk_Ailk_Bjlk_BSS_BH_MT128x128x32_MI32x32x8x1_SN_1LDSB0_AMAS0_EPS0_IU1_NEPBS2_NLCB1_PGR2_PLR1_SU0_SUS0_SPO0_SSO2_SVW1_TT2_64_VW1_WG64_4_1_WGM8
    SolutionIndex: 180
    SolutionNameMin: Cijk_Ailk_Bjlk_BSS_BH_MT128x128x32_MI32x32x8x1_SN_1LDSB1_AMAS0_EPS1_IU1_NEPBS1_NLCB1_PGR1_PLR5_SU32_SUS128_SPO1_SSO2_SVW1_TT2_64_VW1_WG64_4_1_WGM8
    SolutionIndex: 181
    SolutionNameMin: Cijk_Ailk_Bjlk_BSS_BH_MT128x128x32_MI32x32x8x1_SN_1LDSB0_AMAS0_EPS0_IU1_NEPBS4_NLCB1_PGR2_PLR5_SU0_SUS0_SPO1_SSO2_SVW1_TT2_64_VW1_WG64_4_1_WGM8
    SolutionIndex: 182
    SolutionNameMin: Cijk_Ailk_Bjlk_BSS_BH_MT128x128x32_MI32x32x8x1_SN_1LDSB0_AMAS0_EPS0_IU1_NEPBS4_NLCB1_PGR2_PLR1_SU0_SUS0_SPO1_SSO4_SVW1_TT2_64_VW1_WG64_4_1_WGM8
    SolutionIndex: 183
    SolutionNameMin: Cijk_Ailk_Bjlk_BSS_BH_MT128x128x32_MI32x32x8x1_SN_1LDSB1_AMAS0_EPS1_IU1_NEPBS2_NLCB1_PGR1_PLR5_SU32_SUS128_SPO1_SSO2_SVW1_TT2_64_VW1_WG64_4_1_WGM8
    SolutionIndex: 184
    SolutionNameMin: Cijk_Ailk_Bjlk_BSS_BH_MT128x128x32_MI32x32x8x1_SN_1LDSB0_AMAS0_EPS0_IU1_NEPBS2_NLCB1_PGR2_PLR1_SU0_SUS0_SPO1_SSO4_SVW1_TT2_64_VW1_WG64_4_1_WGM8
    SolutionIndex: 185
    SolutionNameMin: Cijk_Ailk_Bjlk_BSS_BH_MT128x128x32_MI32x32x8x1_SN_AMAS0_EPS0_GRCGA1_GRCGB1_IU2_NTC0_NTD0_PGR2_PLR1_SU0_SUS0_SVW1_SNLL0_VW1_WGM1
    SolutionIndex: 186
    SolutionNameMin: Cijk_Ailk_Bjlk_BSS_BH_MT128x128x32_MI32x32x8x1_SN_AMAS0_EPS0_GRCGA1_GRCGB1_IU2_NTC0_NTD1_PGR2_PLR1_SU0_SUS0_SVW1_SNLL0_VW1_WGM1
    SolutionIndex: 187
    SolutionNameMin: Cijk_Ailk_Bjlk_BSS_BH_MT256x256x32_MI32x32x8x1_SN_AMAS0_EPS1_NTC2_NTD1_PGR1_PLR1_SU32_SUS128_SVW1_SNLL0_VW1_WGM4
    SolutionIndex: 188
    SolutionNameMin: Cijk_Ailk_Bjlk_BSS_BH_MT256x256x32_MI32x32x8x1_SN_AMAS0_EPS1_NTC1_NTD1_PGR1_PLR1_SU32_SUS128_SVW1_SNLL0_VW1_WGM4
    SolutionIndex: 189
    SolutionNameMin: Cijk_Ailk_Bjlk_BSS_BH_MT256x256x32_MI32x32x8x1_SN_AMAS3_EPS1_NTC0_NTD2_PGR1_PLR1_SU0_SUS0_SVW2_SNLL0_VW2_WGM3
    SolutionIndex: 190
    SolutionNameMin: Cijk_Ailk_Bjlk_BSS_BH_MT128x128x32_MI32x32x8x1_SN_AMAS0_GRCGA1_GRCGB1_NTC0_NTD0_SU0_SUS0_SVW1_VW1_WGM3
    SolutionIndex: 191
    SolutionNameMin: Cijk_Ailk_Bjlk_BSS_BH_MT128x128x32_MI32x32x8x1_SN_AMAS0_GRCGA1_GRCGB1_NTC1_NTD0_SU0_SUS0_SVW1_VW1_WGM5
    SolutionIndex: 192
    SolutionNameMin: Cijk_Ailk_Bjlk_BSS_BH_MT128x128x32_MI32x32x8x1_SN_AMAS0_GRCGA1_GRCGB1_NTC3_NTD0_SU64_SUS64_SVW1_VW1_WGM16
    SolutionIndex: 193
    SolutionNameMin: Cijk_Ailk_Bjlk_BSS_BH_MT256x256x32_MI32x32x8x1_SN_FL2_IU1_NTC3_NTD3_PK0_SU32_SUM0_WGM8
    SolutionIndex: 194
    SolutionNameMin: Cijk_Ailk_Bjlk_BSS_BH_MT256x256x32_MI32x32x8x1_SN_FL1_IU1_NTC2_NTD3_PK0_SU32_SUM0_WGM8
    SolutionIndex: 195
    SolutionNameMin: Cijk_Ailk_Bjlk_BSS_BH_MT256x256x32_MI32x32x8x1_SN_FL1_IU1_NTC0_NTD2_PK0_SU32_SUM0_WGM8
    SolutionIndex: 196
    SolutionNameMin: Cijk_Ailk_Bjlk_BSS_BH_MT256x256x32_MI32x32x8x1_SN_FL2_IU1_NTC2_NTD2_PK0_SU32_SUM0_WGM8
    SolutionIndex: 197
    SolutionNameMin: Cijk_Ailk_Bjlk_BSS_BH_MT256x256x32_MI32x32x8x1_SN_FL1_IU1_NTC3_NTD3_PK0_SU32_SUM0_WGM8
- - - [7680, 8192, 1, 8192]
    - [0, 78.071]
  - - [3840, 4096, 1, 4096]
    - [1, 69.36]
  - - [1920, 2048, 1, 2048]
    - [2, 51.318]
  - - [960, 1024, 1, 1024]
    - [3, 24.926]
  - - [480, 512, 1, 512]
    - [4, 6.719]
  - - [8192, 7680, 1, 8192]
    - [2, 79.33]
  - - [4096, 3840, 1, 4096]
    - [84, 80.179]
  - - [2048, 1920, 1, 2048]
    - [2, 53.942]
  - - [1024, 960, 1, 1024]
    - [3, 24.442]
  - - [512, 480, 1, 512]
    - [4, 6.687]
  - - [8192, 8192, 1, 8192]
    - [6, 78.668]
  - - [4096, 4096, 1, 4096]
    - [0, 70.353]
  - - [2048, 2048, 1, 2048]
    - [2, 54.157]
  - - [1024, 1024, 1, 1024]
    - [3, 26.185]
  - - [512, 512, 1, 512]
    - [4, 7.201]
  - - [64, 512, 16, 512]
    - [7, 13.265]
  - - [1024, 2, 1, 1]
    - [8, 0.0]
  - - [1024, 2, 1, 512]
    - [9, 0.062]
  - - [1024, 1024, 1, 1]
    - [10, 0.073]
  - - [1024, 1024, 1, 77]
    - [11, 4.865]
  - - [1024, 1024, 1, 512]
    - [3, 20.23]
  - - [1024, 4096, 1, 512]
    - [2, 33.228]
  - - [1024, 30522, 1, 77]
    - [12, 11.617]
  - - [4096, 1024, 1, 512]
    - [13, 30.821]
  - - [64, 128, 160, 128]
    - [3, 9.644]
  - - [1024, 2, 1, 10]
    - [14, 0.002]
  - - [1024, 2, 1, 1280]
    - [15, 0.116]
  - - [1024, 1024, 1, 10]
    - [11, 0.729]
  - - [1024, 1024, 1, 200]
    - [3, 10.012]
  - - [1024, 1024, 1, 1280]
    - [16, 28.16]
  - - [1024, 4096, 1, 1280]
    - [29, 55.586]
  - - [1024, 30522, 1, 200]
    - [17, 25.333]
  - - [4096, 1024, 1, 1280]
    - [18, 45.547]
  - - [64, 128, 624, 128]
    - [19, 12.821]
  - - [1024, 2, 1, 39]
    - [8, 0.008]
  - - [1024, 2, 1, 4992]
    - [20, 0.283]
  - - [1024, 1024, 1, 39]
    - [11, 2.648]
  - - [1024, 1024, 1, 780]
    - [3, 22.421]
  - - [1024, 1024, 1, 4992]
    - [16, 44.275]
  - - [1024, 4096, 1, 4992]
    - [21, 66.004]
  - - [1024, 30522, 1, 780]
    - [17, 46.458]
  - - [4096, 1024, 1, 4992]
    - [18, 66.152]
  - - [64, 512, 64, 512]
    - [22, 23.175]
  - - [1024, 2, 1, 4]
    - [23, 0.001]
  - - [1024, 2, 1, 2048]
    - [98, 0.156]
  - - [1024, 1024, 1, 4]
    - [11, 0.295]
  - - [1024, 1024, 1, 308]
    - [24, 13.628]
  - - [1024, 1024, 1, 2048]
    - [16, 34.465]
  - - [1024, 4096, 1, 2048]
    - [21, 53.736]
  - - [1024, 30522, 1, 308]
    - [25, 32.414]
  - - [4096, 1024, 1, 2048]
    - [18, 54.248]
  - - [64, 128, 640, 128]
    - [26, 13.104]
  - - [1024, 2, 1, 40]
    - [27, 0.008]
  - - [1024, 2, 1, 5120]
    - [28, 0.291]
  - - [1024, 1024, 1, 40]
    - [11, 2.764]
  - - [1024, 1024, 1, 800]
    - [3, 24.296]
  - - [1024, 1024, 1, 5120]
    - [16, 44.313]
  - - [1024, 4096, 1, 5120]
    - [2, 66.196]
  - - [1024, 30522, 1, 800]
    - [0, 49.903]
  - - [4096, 1024, 1, 5120]
    - [18, 66.469]
  - - [64, 128, 656, 128]
    - [19, 13.135]
  - - [1024, 2, 1, 41]
    - [27, 0.008]
  - - [1024, 2, 1, 5248]
    - [28, 0.298]
  - - [1024, 1024, 1, 41]
    - [11, 2.9]
  - - [1024, 1024, 1, 820]
    - [3, 22.902]
  - - [1024, 1024, 1, 5248]
    - [16, 44.927]
  - - [1024, 4096, 1, 5248]
    - [29, 66.469]
  - - [1024, 30522, 1, 820]
    - [25, 47.719]
  - - [4096, 1024, 1, 5248]
    - [30, 66.345]
  - - [64, 512, 80, 512]
    - [19, 27.051]
  - - [1024, 2, 1, 5]
    - [14, 0.001]
  - - [1024, 2, 1, 2560]
    - [31, 0.165]
  - - [1024, 1024, 1, 5]
    - [11, 0.376]
  - - [1024, 1024, 1, 385]
    - [3, 16.244]
  - - [1024, 1024, 1, 2560]
    - [16, 37.063]
  - - [1024, 4096, 1, 2560]
    - [21, 57.252]
  - - [1024, 30522, 1, 385]
    - [17, 35.676]
  - - [4096, 1024, 1, 2560]
    - [30, 57.47]
  - - [64, 512, 96, 512]
    - [32, 27.205]
  - - [1024, 2, 1, 6]
    - [23, 0.001]
  - - [1024, 2, 1, 3072]
    - [31, 0.181]
  - - [1024, 1024, 1, 6]
    - [11, 0.443]
  - - [1024, 1024, 1, 462]
    - [3, 17.778]
  - - [1024, 1024, 1, 3072]
    - [16, 39.707]
  - - [1024, 4096, 1, 3072]
    - [29, 60.236]
  - - [1024, 30522, 1, 462]
    - [25, 39.267]
  - - [4096, 1024, 1, 3072]
    - [30, 60.462]
  - - [64, 128, 128, 128]
    - [78, 5.155]
  - - [1024, 2, 1, 8]
    - [27, 0.002]
  - - [1024, 2, 1, 1024]
    - [15, 0.105]
  - - [1024, 1024, 1, 8]
    - [11, 0.583]
  - - [1024, 1024, 1, 160]
    - [3, 9.595]
  - - [1024, 4096, 1, 1024]
    - [2, 50.516]
  - - [1024, 30522, 1, 160]
    - [17, 22.581]
  - - [4096, 1024, 1, 1024]
    - [30, 40.835]
  - - [64, 128, 144, 128]
    - [78, 5.55]
  - - [1024, 2, 1, 9]
    - [14, 0.002]
  - - [1024, 2, 1, 1152]
    - [15, 0.111]
  - - [1024, 1024, 1, 9]
    - [11, 0.677]
  - - [1024, 1024, 1, 180]
    - [24, 8.897]
  - - [1024, 1024, 1, 1152]
    - [67, 25.452]
  - - [1024, 4096, 1, 1152]
    - [21, 53.832]
  - - [1024, 30522, 1, 180]
    - [25, 23.175]
  - - [4096, 1024, 1, 1152]
    - [33, 42.696]
  - - [13, 512, 1, 32768]
    - [34, 3.167]
  - - [256, 128, 1, 32768]
    - [35, 14.505]
  - - [256, 32768, 1, 1]
    - [10, 0.182]
  - - [479, 1024, 1, 32768]
    - [36, 29.212]
  - - [512, 256, 1, 32768]
    - [37, 30.453]
  - - [1024, 512, 1, 32768]
    - [38, 50.551]
  - - [1024, 1024, 1, 32768]
    - [39, 62.388]
  - - [64, 128, 512, 128]
    - [22, 12.097]
  - - [128, 64, 512, 128]
    - [3, 11.61]
  - - [1024, 2, 1, 32]
    - [8, 0.007]
  - - [1024, 1024, 1, 32]
    - [11, 2.439]
  - - [1024, 1024, 1, 4096]
    - [16, 42.484]
  - - [1024, 4096, 1, 4096]
    - [2, 64.177]
  - - [1024, 30528, 1, 4096]
    - [21, 73.445]
  - - [4096, 1024, 1, 4096]
    - [18, 64.177]
  - - [512, 64, 64, 512]
    - [40, 21.836]
  - - [1024, 30528, 1, 2048]
    - [0, 65.472]
  - - [4, 64, 32768, 4]
    - [41, 0.171]
  - - [4, 64, 38400, 4]
    - [41, 0.172]
  - - [64, 4, 32768, 4]
    - [27, 0.188]
  - - [64, 4, 38400, 4]
    - [27, 0.19]
  - - [1024, 1024, 1, 8192]
    - [39, 49.809]
  - - [1024, 1024, 1, 9600]
    - [42, 51.598]
  - - [1024, 4096, 1, 8192]
    - [21, 70.551]
  - - [1024, 4096, 1, 9600]
    - [21, 71.497]
  - - [1024, 33712, 1, 8192]
    - [0, 76.662]
  - - [1024, 33712, 1, 9600]
    - [0, 77.275]
  - - [4096, 1024, 1, 8192]
    - [18, 70.054]
  - - [4096, 1024, 1, 9600]
    - [18, 70.927]
  - - [1024, 1024, 1, 10064]
    - [44, 64.387]
  - - [1024, 1024, 1, 10080]
    - [91, 64.988]
  - - [1024, 1024, 1, 10200]
    - [39, 63.502]
  - - [1024, 1024, 1, 3840]
    - [16, 41.429]
  - - [1024, 1024, 1, 3968]
    - [16, 41.967]
  - - [1024, 1024, 1, 6528]
    - [16, 46.514]
  - - [1024, 1024, 1, 7104]
    - [43, 47.309]
  - - [1024, 1024, 1, 7200]
    - [44, 47.626]
  - - [1024, 1024, 1, 8064]
    - [39, 49.335]
  - - [1024, 1024, 1, 8160]
    - [43, 49.411]
  - - [1024, 1024, 1, 9216]
    - [43, 51.308]
  - - [1024, 1024, 1, 9520]
    - [42, 62.773]
  - - [1024, 4096, 1, 10064]
    - [2, 70.876]
  - - [1024, 4096, 1, 10080]
    - [2, 71.748]
  - - [1024, 4096, 1, 10200]
    - [21, 71.124]
  - - [1024, 4096, 1, 3840]
    - [29, 63.095]
  - - [1024, 4096, 1, 3968]
    - [2, 63.562]
  - - [1024, 4096, 1, 6528]
    - [21, 68.72]
  - - [1024, 4096, 1, 7104]
    - [2, 69.346]
  - - [1024, 4096, 1, 7200]
    - [2, 69.635]
  - - [1024, 4096, 1, 8064]
    - [2, 70.516]
  - - [1024, 4096, 1, 8160]
    - [29, 70.469]
  - - [1024, 4096, 1, 9216]
    - [2, 71.712]
  - - [1024, 4096, 1, 9520]
    - [2, 70.679]
  - - [1024, 42720, 1, 10080]
    - [2, 78.262]
  - - [1024, 42720, 1, 3968]
    - [2, 73.06]
  - - [1024, 42720, 1, 6528]
    - [2, 76.415]
  - - [1024, 42720, 1, 7104]
    - [2, 76.833]
  - - [1024, 42720, 1, 7200]
    - [2, 76.861]
  - - [1024, 42720, 1, 9520]
    - [2, 77.295]
  - - [4096, 1024, 1, 10064]
    - [33, 70.792]
  - - [4096, 1024, 1, 10080]
    - [30, 71.233]
  - - [4096, 1024, 1, 10200]
    - [30, 70.397]
  - - [4096, 1024, 1, 3840]
    - [33, 63.161]
  - - [4096, 1024, 1, 3968]
    - [30, 63.627]
  - - [4096, 1024, 1, 6528]
    - [18, 68.582]
  - - [4096, 1024, 1, 7104]
    - [30, 69.26]
  - - [4096, 1024, 1, 7200]
    - [30, 69.196]
  - - [4096, 1024, 1, 8064]
    - [30, 69.792]
  - - [4096, 1024, 1, 8160]
    - [18, 69.692]
  - - [4096, 1024, 1, 9216]
    - [30, 70.642]
  - - [4096, 1024, 1, 9520]
    - [33, 70.281]
  - - [14, 64, 10880, 14]
    - [45, 1.102]
  - - [15, 64, 10880, 14]
    - [46, 1.08]
  - - [15, 64, 7680, 15]
    - [45, 1.11]
  - - [15, 64, 10880, 15]
    - [45, 1.14]
  - - [17, 64, 7680, 15]
    - [47, 1.179]
  - - [17, 64, 6144, 17]
    - [45, 1.27]
  - - [17, 64, 7680, 17]
    - [45, 1.317]
  - - [21, 64, 6144, 17]
    - [45, 1.533]
  - - [21, 64, 6144, 21]
    - [47, 1.845]
  - - [24, 64, 4736, 24]
    - [48, 3.5]
  - - [30, 64, 2048, 30]
    - [47, 2.332]
  - - [30, 64, 2048, 31]
    - [49, 2.461]
  - - [31, 64, 2048, 31]
    - [49, 2.323]
  - - [32, 64, 4608, 32]
    - [50, 5.461]
  - - [32, 64, 4608, 35]
    - [51, 5.354]
  - - [34, 64, 4736, 24]
    - [50, 2.434]
  - - [34, 64, 4736, 34]
    - [50, 3.22]
  - - [35, 64, 4608, 35]
    - [50, 3.336]
  - - [64, 14, 10880, 14]
    - [52, 1.774]
  - - [64, 15, 10880, 14]
    - [52, 1.812]
  - - [64, 15, 7680, 15]
    - [52, 1.857]
  - - [64, 15, 10880, 15]
    - [52, 1.919]
  - - [64, 17, 7680, 15]
    - [52, 2.017]
  - - [64, 17, 6144, 17]
    - [52, 2.055]
  - - [64, 17, 7680, 17]
    - [52, 2.12]
  - - [64, 21, 6144, 17]
    - [52, 2.305]
  - - [64, 21, 6144, 21]
    - [52, 2.803]
  - - [64, 24, 4736, 24]
    - [53, 3.323]
  - - [64, 30, 2048, 30]
    - [54, 3.765]
  - - [64, 30, 2048, 31]
    - [54, 3.836]
  - - [64, 31, 2048, 31]
    - [53, 3.856]
  - - [64, 32, 4608, 32]
    - [11, 5.325]
  - - [64, 32, 4608, 35]
    - [53, 5.112]
  - - [64, 34, 4736, 24]
    - [41, 2.93]
  - - [64, 34, 4736, 34]
    - [41, 3.774]
  - - [64, 35, 4608, 35]
    - [41, 3.779]
  - - [512, 64, 1, 512]
    - [55, 1.074]
  - - [64, 512, 1, 512]
    - [56, 1.068]
  - - [64, 128, 1, 128]
    - [79, 0.05]
  - - [128, 64, 1, 128]
    - [56, 0.105]
  - - [74, 2048, 1, 512]
    - [58, 4.438]
  - - [2048, 2048, 1, 512]
    - [29, 33.867]
  - - [1024, 64, 1, 512]
    - [56, 2.124]
  - - [5, 64, 1, 5]
    - [59, 0.0]
  - - [2048, 512, 1, 1]
    - [10, 0.074]
  - - [1600, 1024, 1, 512]
    - [32, 27.474]
  - - [512, 32, 1, 1600]
    - [131, 0.992]
  - - [33, 32, 1, 33]
    - [60, 0.003]
  - - [560, 1024, 1, 1600]
    - [61, 22.769]
  - - [1024, 1600, 1, 1]
    - [62, 0.094]
  - - [1024, 1024, 1, 1600]
    - [16, 31.347]
  - - [512, 512, 1, 1600]
    - [61, 13.387]
  - - [3, 64, 512, 3]
    - [50, 0.021]
  - - [5, 64, 512, 5]
    - [46, 0.062]
  - - [5, 64, 960, 5]
    - [149, 0.061]
  - - [9, 64, 512, 9]
    - [50, 0.177]
  - - [27, 128, 32768, 27]
    - [63, 2.821]
  - - [33, 32, 200, 33]
    - [149, 0.335]
  - - [33, 32, 1600, 33]
    - [59, 1.848]
  - - [67, 2048, 1, 512]
    - [125, 2.94]
  - - [74, 2048, 1, 960]
    - [4, 6.256]
  - - [100, 2048, 1, 512]
    - [57, 5.419]
  - - [256, 1280, 1, 8976]
    - [64, 30.74]
  - - [256, 2560, 1, 8976]
    - [65, 42.566]
  - - [256, 2816, 1, 8976]
    - [66, 49.181]
  - - [256, 3328, 1, 8976]
    - [66, 47.839]
  - - [256, 3584, 1, 8976]
    - [39, 44.802]
  - - [256, 3840, 1, 8976]
    - [39, 47.43]
  - - [256, 4096, 1, 8976]
    - [39, 50.019]
  - - [256, 4352, 1, 8976]
    - [44, 52.065]
  - - [256, 4864, 1, 8976]
    - [67, 53.29]
  - - [256, 5120, 1, 8976]
    - [68, 57.072]
  - - [256, 5632, 1, 8976]
    - [68, 54.938]
  - - [256, 5888, 1, 8976]
    - [68, 57.07]
  - - [256, 6144, 1, 8976]
    - [68, 58.977]
  - - [256, 7168, 1, 8976]
    - [69, 49.592]
  - - [256, 8192, 1, 8976]
    - [70, 56.874]
  - - [256, 8960, 1, 8976]
    - [71, 53.057]
  - - [256, 9728, 1, 8976]
    - [71, 56.915]
  - - [256, 9984, 1, 8976]
    - [71, 58.019]
  - - [256, 10240, 1, 8976]
    - [6, 66.894]
  - - [256, 10496, 1, 8976]
    - [84, 68.087]
  - - [256, 11008, 1, 8976]
    - [6, 71.744]
  - - [256, 11264, 1, 8976]
    - [0, 62.672]
  - - [256, 11520, 1, 8976]
    - [0, 63.808]
  - - [256, 11776, 1, 8976]
    - [0, 64.976]
  - - [256, 12544, 1, 8976]
    - [0, 68.672]
  - - [256, 12800, 1, 8976]
    - [74, 69.734]
  - - [256, 13312, 1, 8976]
    - [0, 72.024]
  - - [256, 13568, 1, 8976]
    - [76, 76.925]
  - - [256, 14336, 1, 8976]
    - [75, 65.319]
  - - [256, 14848, 1, 8976]
    - [76, 67.843]
  - - [256, 15104, 1, 8976]
    - [21, 79.116]
  - - [256, 15872, 1, 8976]
    - [29, 68.622]
  - - [256, 16128, 1, 8976]
    - [2, 68.957]
  - - [256, 17152, 1, 8976]
    - [68, 69.899]
  - - [256, 17408, 1, 8976]
    - [5, 73.303]
  - - [256, 18688, 1, 8976]
    - [1, 65.522]
  - - [256, 19968, 1, 8976]
    - [84, 67.936]
  - - [256, 20480, 1, 8976]
    - [6, 69.419]
  - - [256, 20992, 1, 8976]
    - [6, 71.124]
  - - [256, 21248, 1, 8976]
    - [77, 61.182]
  - - [256, 22016, 1, 8976]
    - [77, 63.232]
  - - [256, 26112, 1, 8976]
    - [77, 73.051]
  - - [256, 32512, 1, 8976]
    - [21, 71.628]
  - - [256, 33536, 1, 8976]
    - [6, 76.331]
  - - [256, 44505, 1, 8976]
    - [5, 67.003]
  - - [257, 4096, 1, 1024]
    - [108, 19.891]
  - - [480, 1024, 1, 32768]
    - [38, 47.428]
  - - [512, 32, 1, 200]
    - [79, 0.253]
  - - [512, 512, 1, 200]
    - [57, 3.624]
  - - [512, 2048, 1, 256]
    - [3, 14.266]
  - - [560, 1024, 1, 200]
    - [3, 6.493]
  - - [768, 2048, 1, 256]
    - [32, 16.617]
  - - [1024, 64, 1, 960]
    - [55, 3.109]
  - - [1024, 256, 1, 1024]
    - [7, 10.687]
  - - [1024, 256, 1, 1280]
    - [7, 11.851]
  - - [1024, 256, 1, 2304]
    - [80, 15.361]
  - - [1024, 256, 1, 2816]
    - [80, 16.802]
  - - [1024, 256, 1, 3072]
    - [80, 17.448]
  - - [1024, 256, 1, 3328]
    - [80, 18.102]
  - - [1024, 256, 1, 3584]
    - [64, 17.931]
  - - [1024, 256, 1, 4096]
    - [64, 20.328]
  - - [1024, 256, 1, 4352]
    - [64, 20.993]
  - - [1024, 256, 1, 4608]
    - [64, 21.853]
  - - [1024, 256, 1, 5120]
    - [64, 23.002]
  - - [1024, 256, 1, 5376]
    - [64, 23.967]
  - - [1024, 256, 1, 5632]
    - [64, 25.126]
  - - [1024, 256, 1, 6144]
    - [64, 24.74]
  - - [1024, 256, 1, 6400]
    - [64, 26.474]
  - - [1024, 256, 1, 7680]
    - [64, 30.199]
  - - [1024, 256, 1, 7936]
    - [64, 27.755]
  - - [1024, 256, 1, 8192]
    - [64, 31.244]
  - - [1024, 256, 1, 8448]
    - [64, 31.207]
  - - [1024, 256, 1, 9728]
    - [64, 33.397]
  - - [1024, 256, 1, 9984]
    - [64, 33.59]
  - - [1024, 256, 1, 10496]
    - [64, 35.439]
  - - [1024, 256, 1, 11520]
    - [64, 37.214]
  - - [1024, 256, 1, 12032]
    - [64, 36.553]
  - - [1024, 256, 1, 13568]
    - [64, 39.179]
  - - [1024, 256, 1, 14336]
    - [64, 41.154]
  - - [1024, 256, 1, 14848]
    - [64, 40.84]
  - - [1024, 256, 1, 15104]
    - [64, 41.163]
  - - [1024, 256, 1, 15872]
    - [64, 41.408]
  - - [1024, 256, 1, 16128]
    - [64, 42.241]
  - - [1024, 256, 1, 17152]
    - [64, 43.128]
  - - [1024, 256, 1, 17408]
    - [64, 42.989]
  - - [1024, 256, 1, 18944]
    - [64, 44.394]
  - - [1024, 256, 1, 19712]
    - [64, 45.428]
  - - [1024, 256, 1, 19968]
    - [64, 44.716]
  - - [1024, 256, 1, 21248]
    - [64, 44.551]
  - - [1024, 256, 1, 21504]
    - [64, 46.18]
  - - [1024, 256, 1, 22016]
    - [64, 45.388]
  - - [1024, 256, 1, 28672]
    - [64, 50.713]
  - - [1024, 256, 1, 33536]
    - [64, 51.284]
  - - [1024, 1024, 1, 960]
    - [3, 25.544]
  - - [1600, 1024, 1, 960]
    - [68, 36.507]
  - - [2048, 256, 1, 1024]
    - [7, 18.385]
  - - [2048, 960, 1, 1]
    - [11, 0.104]
  - - [2048, 2048, 1, 960]
    - [29, 48.689]
  - - [2048, 2048, 1, 1024]
    - [153, 51.866]
  - - [3200, 2048, 1, 1024]
    - [0, 47.853]
  - - [4096, 4096, 1, 1024]
    - [154, 69.18]
  - - [2048, 2, 1, 2]
    - [96, 0.0]
  - - [2048, 2048, 1, 2]
    - [11, 0.296]
  - - [2048, 30592, 1, 1024]
    - [0, 57.724]
  - - [2048, 6144, 1, 1024]
    - [5, 51.333]
  - - [2048, 8192, 1, 1024]
    - [84, 52.355]
  - - [8192, 2048, 1, 1024]
    - [85, 52.583]
  - - [1024, 1024, 1, 16]
    - [11, 1.26]
  - - [1024, 2, 1, 16]
    - [51, 0.002]
  - - [1024, 30592, 1, 8192]
    - [5, 87.463]
  - - [1024, 3072, 1, 8192]
    - [0, 68.621]
  - - [512, 64, 256, 512]
    - [86, 27.541]
  - - [64, 512, 256, 512]
    - [87, 30.821]
  - - [1024, 30592, 1, 2048]
    - [0, 65.508]
  - - [1024, 3072, 1, 2048]
    - [0, 54.127]
  - - [1024, 30592, 1, 4096]
    - [21, 73.427]
  - - [1024, 3072, 1, 4096]
    - [0, 62.844]
  - - [512, 64, 128, 512]
    - [86, 25.255]
  - - [64, 512, 128, 512]
    - [13, 28.464]
  - - [2560, 1920, 1, 2048]
    - [144, 61.541]
  - - [2560, 2, 1, 4]
    - [23, 0.002]
  - - [2560, 2560, 1, 2048]
    - [0, 59.324]
  - - [2560, 2560, 1, 4]
    - [54, 0.662]
  - - [2560, 7680, 1, 2048]
    - [1, 63.967]
  - - [640, 2560, 1, 2048]
    - [68, 45.712]
  - - [512, 64, 40, 512]
    - [3, 22.37]
  - - [64, 512, 40, 512]
    - [3, 22.303]
  - - [1536, 1536, 1, 4096]
    - [72, 60.978]
  - - [1536, 4608, 1, 4096]
    - [75, 74.739]
  - - [1536, 50304, 1, 4096]
    - [0, 75.042]
  - - [1536, 6144, 1, 4096]
    - [0, 65.717]
  - - [6144, 1536, 1, 4096]
    - [6, 66.006]
  - - [1024, 96, 64, 1024]
    - [88, 43.725]
  - - [96, 1024, 64, 1024]
    - [89, 42.822]
  - - [1536, 1536, 1, 8192]
    - [16, 55.606]
  - - [1536, 4608, 1, 8192]
    - [76, 81.132]
  - - [1536, 50304, 1, 8192]
    - [0, 78.581]
  - - [1536, 6144, 1, 8192]
    - [0, 70.175]
  - - [6144, 1536, 1, 8192]
    - [0, 70.316]
  - - [1024, 96, 128, 1024]
    - [71, 46.203]
  - - [96, 1024, 128, 1024]
    - [90, 46.027]
  - - [1024, 1024, 1, 16384]
    - [91, 53.381]
  - - [1024, 3072, 1, 16384]
    - [0, 71.839]
  - - [1024, 4096, 1, 16384]
    - [21, 74.56]
  - - [1024, 50304, 1, 16384]
    - [84, 78.874]
  - - [4096, 1024, 1, 16384]
    - [30, 72.725]
  - - [1024, 64, 256, 1024]
    - [92, 39.868]
  - - [64, 1024, 256, 1024]
    - [93, 41.688]
  - - [1024, 50304, 1, 2048]
    - [6, 66.92]
  - - [1024, 64, 32, 1024]
    - [3, 28.498]
  - - [64, 1024, 32, 1024]
    - [94, 30.281]
  - - [1024, 50304, 1, 4096]
    - [6, 73.509]
  - - [1024, 64, 64, 1024]
    - [86, 34.441]
  - - [64, 1024, 64, 1024]
    - [95, 37.165]
  - - [1024, 50304, 1, 8192]
    - [6, 77.061]
  - - [1024, 64, 128, 1024]
    - [92, 37.599]
  - - [64, 1024, 128, 1024]
    - [87, 40.476]
  - - [1024, 2, 1, 64]
    - [96, 0.014]
  - - [1024, 30528, 1, 8192]
    - [21, 78.358]
  - - [1024, 1024, 1, 64]
    - [3, 2.858]
  - - [64, 128, 1024, 128]
    - [22, 13.323]
  - - [128, 64, 1024, 128]
    - [62, 12.801]
  - - [1024, 1024, 1, 3456]
    - [97, 40.707]
  - - [1024, 1024, 1, 6912]
    - [42, 57.977]
  - - [1024, 1024, 1, 864]
    - [3, 25.646]
  - - [1024, 512, 1, 3456]
    - [38, 28.029]
  - - [1024, 512, 1, 4096]
    - [38, 34.79]
  - - [1024, 512, 1, 6912]
    - [38, 36.716]
  - - [1024, 512, 1, 864]
    - [3, 15.8]
  - - [256, 128, 1, 3456]
    - [98, 3.031]
  - - [256, 128, 1, 4096]
    - [35, 4.198]
  - - [256, 128, 1, 55296]
    - [35, 17.97]
  - - [256, 128, 1, 6912]
    - [35, 5.488]
  - - [256, 128, 1, 864]
    - [79, 1.324]
  - - [256, 3456, 1, 1]
    - [62, 0.068]
  - - [256, 4096, 1, 1]
    - [52, 0.076]
  - - [256, 6912, 1, 1]
    - [11, 0.103]
  - - [256, 864, 1, 1]
    - [100, 0.021]
  - - [480, 1024, 1, 3456]
    - [38, 32.314]
  - - [480, 1024, 1, 4096]
    - [101, 27.263]
  - - [480, 1024, 1, 6912]
    - [38, 35.116]
  - - [480, 1024, 1, 864]
    - [3, 14.677]
  - - [512, 256, 1, 3456]
    - [103, 11.926]
  - - [512, 256, 1, 4096]
    - [103, 10.706]
  - - [512, 256, 1, 55296]
    - [37, 30.744]
  - - [512, 256, 1, 6912]
    - [103, 14.901]
  - - [512, 256, 1, 864]
    - [58, 5.104]
  - - [30528, 1024, 1, 640]
    - [106, 47.599]
  - - [30528, 1024, 1, 1280]
    - [74, 56.43]
  - - [4096, 1024, 1, 10240]
    - [30, 71.329]
  - - [1024, 4096, 1, 10240]
    - [2, 72.051]
  - - [30528, 1024, 1, 1600]
    - [0, 60.282]
  - - [1024, 2, 1, 80]
    - [27, 0.017]
  - - [1024, 1024, 1, 10240]
    - [44, 65.052]
  - - [1024, 1024, 1, 80]
    - [60, 3.29]
  - - [64, 128, 1280, 128]
    - [19, 13.574]
  - - [128, 64, 1280, 128]
    - [105, 12.991]
  - - [1024, 4096, 1, 10496]
    - [29, 72.071]
  - - [30528, 1024, 1, 1640]
    - [5, 57.634]
  - - [4096, 1024, 1, 10496]
    - [33, 71.572]
  - - [1024, 1024, 1, 10496]
    - [43, 65.525]
  - - [1024, 1024, 1, 82]
    - [11, 4.994]
  - - [1024, 2, 1, 82]
    - [23, 0.015]
  - - [128, 64, 1312, 128]
    - [3, 13.091]
  - - [64, 128, 1312, 128]
    - [19, 13.717]
  - - [30528, 1024, 1, 160]
    - [104, 19.122]
  - - [1024, 4096, 1, 6144]
    - [21, 67.979]
  - - [30528, 1024, 1, 240]
    - [106, 25.315]
  - - [4096, 1024, 1, 6144]
    - [30, 68.042]
  - - [1024, 1024, 1, 12]
    - [54, 0.525]
  - - [1024, 2, 1, 12]
    - [14, 0.003]
  - - [1024, 1024, 1, 6144]
    - [16, 46.056]
  - - [64, 512, 192, 512]
    - [87, 30.704]
  - - [512, 64, 192, 512]
    - [86, 27.725]
  - - [3136, 64, 64, 128]
    - [11, 14.563]
  - - [3136, 64, 64, 256]
    - [61, 20.412]
  - - [3136, 128, 64, 256]
    - [87, 24.609]
  - - [784, 256, 64, 512]
    - [5, 39.539]
  - - [3136, 256, 64, 128]
    - [3, 18.21]
  - - [3136, 256, 64, 256]
    - [104, 28.904]
  - - [784, 512, 64, 256]
    - [5, 31.055]
  - - [784, 512, 64, 512]
    - [5, 44.0]
  - - [3136, 64, 32, 128]
    - [10, 13.288]
  - - [3136, 64, 32, 256]
    - [3, 20.091]
  - - [3136, 128, 32, 256]
    - [32, 23.658]
  - - [784, 256, 32, 512]
    - [5, 34.083]
  - - [3136, 256, 32, 128]
    - [3, 17.65]
  - - [3136, 256, 32, 256]
    - [32, 26.779]
  - - [784, 512, 32, 256]
    - [1, 27.856]
  - - [784, 512, 32, 512]
    - [1, 40.292]
  - - [3136, 256, 32, 64]
    - [10, 11.491]
  - - [3136, 64, 32, 64]
    - [11, 9.063]
  - - [784, 512, 32, 128]
    - [107, 17.984]
  - - [784, 128, 32, 512]
    - [32, 29.877]
  - - [3136, 64, 64, 64]
    - [11, 10.002]
  - - [3136, 256, 64, 64]
    - [10, 11.878]
  - - [784, 128, 64, 512]
    - [32, 32.328]
  - - [784, 512, 64, 128]
    - [22, 19.918]
  - - [64, 1280, 64, 192]
    - [22, 18.411]
  - - [64, 1280, 64, 320]
    - [95, 24.806]
  - - [64, 1280, 64, 384]
    - [108, 27.1]
  - - [64, 1280, 64, 448]
    - [108, 29.502]
  - - [64, 2048, 64, 192]
    - [32, 18.961]
  - - [64, 2048, 64, 320]
    - [108, 25.415]
  - - [64, 2048, 64, 384]
    - [108, 27.831]
  - - [64, 2048, 64, 448]
    - [108, 30.222]
  - - [64, 1280, 32, 192]
    - [32, 13.067]
  - - [64, 1280, 32, 320]
    - [19, 22.774]
  - - [64, 1280, 32, 384]
    - [19, 24.602]
  - - [64, 1280, 32, 448]
    - [107, 26.73]
  - - [64, 2048, 32, 192]
    - [26, 17.023]
  - - [64, 2048, 32, 320]
    - [109, 23.016]
  - - [64, 2048, 32, 384]
    - [22, 24.995]
  - - [64, 2048, 32, 448]
    - [87, 26.832]
  - - [1024, 1024, 1, 10224]
    - [42, 62.021]
  - - [1024, 1024, 1, 10192]
    - [43, 48.259]
  - - [1024, 1024, 1, 10208]
    - [39, 48.549]
  - - [1024, 4096, 1, 10224]
    - [2, 71.018]
  - - [4096, 1024, 1, 10224]
    - [30, 70.686]
  - - [1024, 3072, 1, 10224]
    - [0, 68.641]
  - - [1024, 3072, 1, 10240]
    - [0, 69.833]
  - - [4096, 1024, 1, 10192]
    - [30, 70.817]
  - - [1024, 3072, 1, 10192]
    - [0, 68.751]
  - - [1024, 4096, 1, 10192]
    - [21, 71.194]
  - - [1024, 3072, 1, 10200]
    - [74, 68.583]
  - - [1024, 1024, 1, 10184]
    - [91, 63.498]
  - - [4096, 1024, 1, 10208]
    - [33, 70.97]
  - - [1024, 3072, 1, 10208]
    - [0, 69.776]
  - - [1024, 4096, 1, 10208]
    - [2, 71.912]
  - - [1024, 2048, 1, 10224]
    - [70, 55.971]
  - - [1024, 2048, 1, 10240]
    - [44, 70.419]
  - - [1024, 1024, 1, 10120]
    - [39, 64.311]
  - - [1024, 2048, 1, 10192]
    - [39, 68.323]
  - - [64, 24, 6816, 24]
    - [12, 3.495]
  - - [1024, 1024, 1, 10152]
    - [44, 64.203]
  - - [1024, 3072, 1, 10080]
    - [0, 69.707]
  - - [64, 26, 6272, 26]
    - [11, 3.846]
  - - [100352, 256, 1, 512]
    - [85, 36.34]
  - - [12544, 1024, 1, 2048]
    - [6, 71.228]
  - - [12544, 147, 1, 64]
    - [52, 5.806]
  - - [200704, 256, 1, 512]
    - [84, 34.803]
  - - [25088, 512, 1, 1024]
    - [6, 48.492]
  - - [3136, 576, 1, 64]
    - [11, 4.148]
  - - [50176, 512, 1, 1024]
    - [1, 51.172]
  - - [6272, 1024, 1, 2048]
    - [6, 68.773]
  - - [784, 1152, 1, 128]
    - [3, 7.443]
  - - [3136, 256, 128, 128]
    - [104, 18.634]
  - - [3136, 256, 256, 128]
    - [3, 18.643]
  - - [3136, 256, 128, 64]
    - [11, 12.069]
  - - [3136, 256, 256, 64]
    - [11, 12.171]
  - - [3136, 64, 128, 256]
    - [111, 22.911]
  - - [3136, 64, 256, 256]
    - [7, 20.875]
  - - [3136, 64, 128, 64]
    - [12, 10.513]
  - - [3136, 64, 256, 64]
    - [54, 10.795]
  - - [784, 128, 128, 512]
    - [5, 35.795]
  - - [784, 128, 256, 512]
    - [1, 37.795]
  - - [784, 512, 128, 128]
    - [109, 20.738]
  - - [784, 512, 256, 128]
    - [107, 21.186]
  - - [784, 512, 128, 256]
    - [5, 32.924]
  - - [784, 512, 256, 256]
    - [5, 33.888]
  - - [64, 128, 2048, 128]
    - [110, 14.157]
  - - [128, 64, 2048, 128]
    - [3, 13.479]
  - - [30528, 1024, 1, 2560]
    - [74, 66.856]
  - - [1024, 1024, 1, 128]
    - [3, 8.001]
  - - [1024, 2, 1, 128]
    - [27, 0.023]
  - - [128, 64, 1536, 128]
    - [111, 13.255]
  - - [64, 128, 1536, 128]
    - [19, 13.778]
  - - [1024, 4096, 1, 12288]
    - [21, 72.921]
  - - [30528, 1024, 1, 1920]
    - [0, 63.057]
  - - [1024, 1024, 1, 96]
    - [3, 6.336]
  - - [1024, 1024, 1, 12288]
    - [39, 51.351]
  - - [4096, 1024, 1, 12288]
    - [30, 72.196]
  - - [1024, 2, 1, 96]
    - [112, 0.019]
  - - [25600, 128, 25, 128]
    - [113, 16.786]
  - - [12544, 128, 36, 128]
    - [113, 16.189]
  - - [9216, 128, 49, 128]
    - [12, 16.507]
  - - [6400, 128, 64, 128]
    - [11, 16.415]
  - - [6400, 256, 25, 256]
    - [114, 28.405]
  - - [4096, 256, 36, 256]
    - [0, 29.01]
  - - [2304, 256, 49, 256]
    - [114, 28.029]
  - - [2304, 256, 64, 256]
    - [114, 28.765]
  - - [2304, 512, 25, 512]
    - [114, 40.265]
  - - [1024, 512, 36, 512]
    - [108, 38.926]
  - - [1024, 512, 49, 512]
    - [114, 40.009]
  - - [1024, 512, 64, 512]
    - [114, 41.2]
  - - [92416, 64, 25, 64]
    - [105, 8.241]
  - - [50176, 64, 36, 64]
    - [105, 8.608]
  - - [36864, 64, 49, 64]
    - [105, 8.58]
  - - [25600, 64, 64, 64]
    - [105, 8.889]
  - - [64, 128, 192, 128]
    - [61, 6.706]
  - - [128, 64, 192, 128]
    - [3, 9.146]
  - - [768, 2, 1, 2048]
    - [98, 0.124]
  - - [3072, 768, 1, 2048]
    - [71, 47.795]
  - - [768, 3072, 1, 2048]
    - [71, 47.544]
  - - [768, 768, 1, 2048]
    - [115, 25.678]
  - - [64, 384, 144, 384]
    - [108, 25.603]
  - - [384, 64, 144, 384]
    - [40, 20.701]
  - - [768, 2, 1, 4608]
    - [28, 0.249]
  - - [3072, 768, 1, 4608]
    - [71, 53.746]
  - - [768, 3072, 1, 4608]
    - [71, 53.464]
  - - [768, 768, 1, 4608]
    - [86, 33.823]
  - - [64, 512, 48, 512]
    - [32, 24.79]
  - - [512, 64, 48, 512]
    - [61, 19.985]
  - - [64, 128, 256, 128]
    - [22, 10.287]
  - - [128, 64, 256, 128]
    - [3, 10.393]
  - - [64, 384, 192, 384]
    - [108, 25.018]
  - - [384, 64, 192, 384]
    - [92, 22.458]
  - - [1024, 2, 1, 4608]
    - [116, 0.266]
  - - [4096, 1024, 1, 4608]
    - [30, 65.47]
  - - [1024, 4096, 1, 4608]
    - [21, 64.788]
  - - [1024, 1024, 1, 4608]
    - [67, 43.308]
  - - [13, 512, 1, 3456]
    - [117, 0.65]
  - - [13, 512, 1, 4096]
    - [117, 0.817]
  - - [13, 512, 1, 55296]
    - [34, 3.753]
  - - [13, 512, 1, 6912]
    - [34, 1.22]
  - - [13, 512, 1, 864]
    - [118, 0.27]
  - - [196, 512, 64, 1024]
    - [5, 40.379]
  - - [196, 1024, 64, 512]
    - [1, 34.951]
  - - [196, 1024, 64, 1024]
    - [1, 44.422]
  - - [49, 1024, 64, 2048]
    - [108, 29.485]
  - - [49, 2048, 64, 1024]
    - [119, 29.179]
  - - [196, 512, 32, 1024]
    - [1, 33.02]
  - - [196, 1024, 32, 512]
    - [1, 31.317]
  - - [196, 1024, 32, 1024]
    - [5, 40.757]
  - - [49, 1024, 32, 2048]
    - [94, 24.31]
  - - [49, 2048, 32, 1024]
    - [108, 23.948]
  - - [196, 1024, 32, 256]
    - [88, 21.515]
  - - [196, 256, 32, 1024]
    - [88, 28.408]
  - - [49, 2048, 32, 512]
    - [94, 17.676]
  - - [49, 512, 32, 2048]
    - [108, 18.999]
  - - [196, 256, 64, 1024]
    - [5, 32.104]
  - - [196, 1024, 64, 256]
    - [72, 24.183]
  - - [49, 512, 64, 2048]
    - [94, 23.917]
  - - [49, 2048, 64, 512]
    - [119, 19.366]
  - - [1225, 192, 64, 32]
    - [78, 5.558]
  - - [1225, 192, 64, 48]
    - [105, 7.608]
  - - [1225, 192, 64, 64]
    - [78, 9.761]
  - - [1225, 256, 64, 48]
    - [105, 7.775]
  - - [1225, 256, 64, 64]
    - [78, 10.127]
  - - [1225, 288, 64, 48]
    - [105, 7.908]
  - - [1225, 288, 64, 64]
    - [105, 9.527]
  - - [5329, 64, 64, 80]
    - [105, 10.526]
  - - [289, 768, 64, 128]
    - [108, 14.748]
  - - [289, 768, 64, 160]
    - [120, 17.186]
  - - [289, 768, 64, 192]
    - [94, 19.374]
  - - [1225, 192, 32, 32]
    - [105, 4.863]
  - - [1225, 192, 32, 48]
    - [105, 6.795]
  - - [1225, 192, 32, 64]
    - [78, 8.669]
  - - [1225, 256, 32, 48]
    - [60, 6.97]
  - - [1225, 256, 32, 64]
    - [78, 9.194]
  - - [1225, 288, 32, 48]
    - [105, 7.183]
  - - [1225, 288, 32, 64]
    - [105, 8.985]
  - - [5329, 64, 32, 80]
    - [105, 10.007]
  - - [289, 768, 32, 128]
    - [78, 12.244]
  - - [289, 768, 32, 160]
    - [108, 14.758]
  - - [289, 768, 32, 192]
    - [108, 17.38]
  - - [196, 2304, 1, 256]
    - [115, 4.592]
  - - [49, 4608, 1, 512]
    - [4, 5.894]
  - - [196, 1024, 128, 256]
    - [17, 26.444]
  - - [196, 1024, 256, 256]
    - [17, 27.804]
  - - [196, 1024, 128, 512]
    - [1, 37.862]
  - - [196, 1024, 256, 512]
    - [1, 39.418]
  - - [196, 256, 128, 1024]
    - [1, 39.413]
  - - [196, 256, 256, 1024]
    - [1, 42.781]
  - - [49, 2048, 128, 512]
    - [119, 20.52]
  - - [49, 2048, 256, 512]
    - [119, 21.87]
  - - [49, 512, 128, 2048]
    - [108, 28.731]
  - - [49, 512, 256, 2048]
    - [108, 31.33]
  - - [64, 64, 1, 256]
    - [56, 0.083]
  - - [128, 128, 1, 256]
    - [55, 0.35]
  - - [64, 256, 1, 256]
    - [4, 0.189]
  - - [128, 256, 1, 256]
    - [55, 0.68]
  - - [64, 448, 1, 256]
    - [56, 0.574]
  - - [128, 448, 1, 256]
    - [56, 1.149]
  - - [64, 704, 1, 256]
    - [121, 0.922]
  - - [128, 704, 1, 256]
    - [55, 1.78]
  - - [64, 1024, 1, 256]
    - [4, 0.783]
  - - [128, 1024, 1, 256]
    - [4, 2.487]
  - - [64, 1408, 1, 256]
    - [4, 1.036]
  - - [128, 1408, 1, 256]
    - [79, 3.512]
  - - [64, 1856, 1, 256]
    - [121, 2.269]
  - - [128, 1856, 1, 256]
    - [56, 4.337]
  - - [64, 2368, 1, 256]
    - [121, 2.857]
  - - [128, 2368, 1, 256]
    - [4, 5.43]
  - - [64, 2944, 1, 256]
    - [58, 2.175]
  - - [128, 2944, 1, 256]
    - [57, 6.106]
  - - [64, 3584, 1, 256]
    - [79, 4.324]
  - - [128, 3584, 1, 256]
    - [3, 7.351]
  - - [64, 4288, 1, 256]
    - [4, 4.978]
  - - [128, 4288, 1, 256]
    - [122, 6.018]
  - - [64, 5056, 1, 256]
    - [4, 5.691]
  - - [128, 5056, 1, 256]
    - [122, 9.929]
  - - [64, 5888, 1, 256]
    - [3, 6.246]
  - - [128, 5888, 1, 256]
    - [122, 7.455]
  - - [64, 6784, 1, 256]
    - [7, 4.735]
  - - [128, 6784, 1, 256]
    - [3, 12.844]
  - - [64, 64, 1, 1280]
    - [99, 0.186]
  - - [128, 128, 1, 1280]
    - [131, 0.816]
  - - [64, 256, 1, 1280]
    - [131, 0.796]
  - - [128, 256, 1, 1280]
    - [123, 1.868]
  - - [64, 448, 1, 1280]
    - [123, 1.798]
  - - [128, 448, 1, 1280]
    - [123, 3.23]
  - - [64, 704, 1, 1280]
    - [123, 2.73]
  - - [128, 704, 1, 1280]
    - [123, 4.904]
  - - [64, 1024, 1, 1280]
    - [123, 3.736]
  - - [128, 1024, 1, 1280]
    - [58, 6.386]
  - - [64, 1408, 1, 1280]
    - [123, 4.998]
  - - [128, 1408, 1, 1280]
    - [102, 8.663]
  - - [64, 1856, 1, 1280]
    - [124, 5.887]
  - - [128, 1856, 1, 1280]
    - [7, 10.382]
  - - [64, 2368, 1, 1280]
    - [125, 7.409]
  - - [128, 2368, 1, 1280]
    - [61, 13.048]
  - - [64, 2944, 1, 1280]
    - [124, 9.211]
  - - [128, 2944, 1, 1280]
    - [61, 16.271]
  - - [64, 3584, 1, 1280]
    - [7, 10.241]
  - - [128, 3584, 1, 1280]
    - [61, 17.832]
  - - [64, 4288, 1, 1280]
    - [7, 12.253]
  - - [128, 4288, 1, 1280]
    - [7, 20.995]
  - - [64, 5056, 1, 1280]
    - [82, 11.215]
  - - [128, 5056, 1, 1280]
    - [7, 24.56]
  - - [64, 5888, 1, 1280]
    - [61, 15.89]
  - - [128, 5888, 1, 1280]
    - [7, 28.157]
  - - [64, 6784, 1, 1280]
    - [7, 17.737]
  - - [128, 6784, 1, 1280]
    - [97, 23.077]
  - - [64, 64, 1, 3328]
    - [98, 0.425]
  - - [128, 128, 1, 3328]
    - [98, 1.674]
  - - [64, 256, 1, 3328]
    - [98, 1.97]
  - - [128, 256, 1, 3328]
    - [99, 2.932]
  - - [64, 448, 1, 3328]
    - [98, 3.037]
  - - [128, 448, 1, 3328]
    - [103, 4.876]
  - - [64, 704, 1, 3328]
    - [98, 4.547]
  - - [128, 704, 1, 3328]
    - [133, 8.537]
  - - [64, 1024, 1, 3328]
    - [103, 6.182]
  - - [128, 1024, 1, 3328]
    - [103, 11.165]
  - - [64, 1408, 1, 3328]
    - [133, 8.289]
  - - [128, 1408, 1, 3328]
    - [103, 14.167]
  - - [64, 1856, 1, 3328]
    - [103, 9.034]
  - - [128, 1856, 1, 3328]
    - [126, 15.992]
  - - [64, 2368, 1, 3328]
    - [103, 12.211]
  - - [128, 2368, 1, 3328]
    - [81, 19.799]
  - - [64, 2944, 1, 3328]
    - [125, 13.771]
  - - [128, 2944, 1, 3328]
    - [81, 24.658]
  - - [64, 3584, 1, 3328]
    - [82, 15.468]
  - - [128, 3584, 1, 3328]
    - [38, 25.673]
  - - [64, 4288, 1, 3328]
    - [82, 18.811]
  - - [128, 4288, 1, 3328]
    - [101, 32.393]
  - - [64, 5056, 1, 3328]
    - [126, 21.197]
  - - [128, 5056, 1, 3328]
    - [86, 31.845]
  - - [64, 5888, 1, 3328]
    - [126, 24.111]
  - - [128, 5888, 1, 3328]
    - [127, 35.998]
  - - [64, 6784, 1, 3328]
    - [127, 21.779]
  - - [128, 6784, 1, 3328]
    - [67, 35.82]
  - - [256, 64, 1, 256]
    - [121, 0.192]
  - - [448, 64, 1, 256]
    - [121, 0.337]
  - - [704, 64, 1, 256]
    - [55, 0.89]
  - - [1408, 64, 1, 256]
    - [56, 1.768]
  - - [1856, 64, 1, 256]
    - [128, 1.45]
  - - [2368, 64, 1, 256]
    - [128, 2.857]
  - - [2944, 64, 1, 256]
    - [121, 3.575]
  - - [3584, 64, 1, 256]
    - [128, 4.135]
  - - [4288, 64, 1, 256]
    - [4, 4.978]
  - - [5056, 64, 1, 256]
    - [55, 3.399]
  - - [5888, 64, 1, 256]
    - [57, 6.175]
  - - [6784, 64, 1, 256]
    - [7, 4.528]
  - - [448, 128, 1, 256]
    - [121, 0.689]
  - - [704, 128, 1, 256]
    - [56, 1.78]
  - - [1024, 128, 1, 256]
    - [56, 2.504]
  - - [1408, 128, 1, 256]
    - [56, 3.42]
  - - [1856, 128, 1, 256]
    - [4, 2.792]
  - - [2368, 128, 1, 256]
    - [128, 3.244]
  - - [2944, 128, 1, 256]
    - [57, 6.211]
  - - [3584, 128, 1, 256]
    - [7, 4.913]
  - - [4288, 128, 1, 256]
    - [61, 5.926]
  - - [5056, 128, 1, 256]
    - [3, 9.427]
  - - [5888, 128, 1, 256]
    - [115, 7.968]
  - - [6784, 128, 1, 256]
    - [3, 12.399]
  - - [256, 64, 1, 1280]
    - [131, 0.778]
  - - [448, 64, 1, 1280]
    - [123, 1.674]
  - - [704, 64, 1, 1280]
    - [123, 2.696]
  - - [1408, 64, 1, 1280]
    - [15, 4.795]
  - - [1856, 64, 1, 1280]
    - [124, 5.99]
  - - [2368, 64, 1, 1280]
    - [124, 7.511]
  - - [2944, 64, 1, 1280]
    - [124, 9.337]
  - - [3584, 64, 1, 1280]
    - [122, 8.259]
  - - [4288, 64, 1, 1280]
    - [61, 12.253]
  - - [5056, 64, 1, 1280]
    - [61, 14.098]
  - - [5888, 64, 1, 1280]
    - [61, 13.375]
  - - [6784, 64, 1, 1280]
    - [129, 18.308]
  - - [448, 128, 1, 1280]
    - [123, 3.282]
  - - [704, 128, 1, 1280]
    - [130, 4.813]
  - - [1024, 128, 1, 1280]
    - [56, 6.429]
  - - [1408, 128, 1, 1280]
    - [124, 8.781]
  - - [1856, 128, 1, 1280]
    - [61, 10.542]
  - - [2368, 128, 1, 1280]
    - [61, 13.367]
  - - [2944, 128, 1, 1280]
    - [7, 13.643]
  - - [3584, 128, 1, 1280]
    - [7, 17.642]
  - - [4288, 128, 1, 1280]
    - [115, 20.348]
  - - [5056, 128, 1, 1280]
    - [7, 23.688]
  - - [5888, 128, 1, 1280]
    - [7, 27.516]
  - - [6784, 128, 1, 1280]
    - [7, 30.997]
  - - [256, 64, 1, 3328]
    - [98, 1.959]
  - - [448, 64, 1, 3328]
    - [31, 2.757]
  - - [704, 64, 1, 3328]
    - [98, 4.557]
  - - [1408, 64, 1, 3328]
    - [133, 7.906]
  - - [1856, 64, 1, 3328]
    - [133, 10.846]
  - - [2368, 64, 1, 3328]
    - [103, 12.406]
  - - [2944, 64, 1, 3328]
    - [124, 13.38]
  - - [3584, 64, 1, 3328]
    - [82, 15.195]
  - - [4288, 64, 1, 3328]
    - [80, 18.743]
  - - [5056, 64, 1, 3328]
    - [82, 21.704]
  - - [5888, 64, 1, 3328]
    - [82, 23.628]
  - - [6784, 64, 1, 3328]
    - [86, 21.484]
  - - [448, 128, 1, 3328]
    - [103, 5.864]
  - - [704, 128, 1, 3328]
    - [133, 8.527]
  - - [1024, 128, 1, 3328]
    - [103, 11.375]
  - - [1408, 128, 1, 3328]
    - [103, 14.682]
  - - [1856, 128, 1, 3328]
    - [83, 19.199]
  - - [2368, 128, 1, 3328]
    - [82, 19.513]
  - - [2944, 128, 1, 3328]
    - [82, 24.573]
  - - [3584, 128, 1, 3328]
    - [38, 25.869]
  - - [4288, 128, 1, 3328]
    - [101, 33.318]
  - - [5056, 128, 1, 3328]
    - [132, 31.27]
  - - [5888, 128, 1, 3328]
    - [86, 36.369]
  - - [6784, 128, 1, 3328]
    - [38, 33.05]
  - - [256, 256, 1, 256]
    - [56, 0.726]
  - - [448, 256, 1, 256]
    - [121, 2.176]
  - - [256, 448, 1, 256]
    - [56, 1.44]
  - - [448, 448, 1, 256]
    - [121, 3.711]
  - - [256, 256, 1, 1280]
    - [123, 3.736]
  - - [448, 256, 1, 1280]
    - [124, 5.684]
  - - [256, 448, 1, 1280]
    - [124, 5.723]
  - - [448, 448, 1, 1280]
    - [124, 10.05]
  - - [256, 256, 1, 3328]
    - [133, 5.365]
  - - [448, 256, 1, 3328]
    - [103, 8.959]
  - - [256, 448, 1, 3328]
    - [103, 8.94]
  - - [448, 448, 1, 3328]
    - [124, 14.843]
  - - [512, 16, 1, 512]
    - [55, 0.273]
  - - [1024, 16, 1, 512]
    - [56, 0.543]
  - - [1024, 32, 1, 512]
    - [128, 1.074]
  - - [704, 256, 1, 256]
    - [79, 3.465]
  - - [1408, 256, 1, 256]
    - [3, 5.907]
  - - [1856, 256, 1, 256]
    - [3, 7.175]
  - - [2368, 256, 1, 256]
    - [3, 8.966]
  - - [2944, 256, 1, 256]
    - [111, 11.263]
  - - [3584, 256, 1, 256]
    - [3, 12.483]
  - - [4288, 256, 1, 256]
    - [3, 14.135]
  - - [5056, 256, 1, 256]
    - [111, 15.752]
  - - [5888, 256, 1, 256]
    - [13, 16.916]
  - - [6784, 256, 1, 256]
    - [32, 18.902]
  - - [704, 448, 1, 256]
    - [4, 5.547]
  - - [1024, 448, 1, 256]
    - [3, 7.114]
  - - [1408, 448, 1, 256]
    - [3, 9.282]
  - - [1856, 448, 1, 256]
    - [3, 11.991]
  - - [2368, 448, 1, 256]
    - [3, 13.782]
  - - [2944, 448, 1, 256]
    - [3, 16.188]
  - - [3584, 448, 1, 256]
    - [61, 14.939]
  - - [4288, 448, 1, 256]
    - [71, 17.207]
  - - [5056, 448, 1, 256]
    - [71, 18.773]
  - - [5888, 448, 1, 256]
    - [3, 19.761]
  - - [6784, 448, 1, 256]
    - [40, 17.269]
  - - [256, 704, 1, 256]
    - [56, 3.398]
  - - [448, 704, 1, 256]
    - [4, 5.721]
  - - [704, 704, 1, 256]
    - [3, 7.769]
  - - [1024, 704, 1, 256]
    - [3, 11.119]
  - - [1408, 704, 1, 256]
    - [3, 13.55]
  - - [1856, 704, 1, 256]
    - [24, 16.105]
  - - [2368, 704, 1, 256]
    - [7, 12.592]
  - - [2944, 704, 1, 256]
    - [71, 17.53]
  - - [3584, 704, 1, 256]
    - [3, 19.563]
  - - [4288, 704, 1, 256]
    - [134, 19.61]
  - - [5056, 704, 1, 256]
    - [3, 21.344]
  - - [5888, 704, 1, 256]
    - [111, 20.437]
  - - [6784, 704, 1, 256]
    - [71, 22.545]
  - - [256, 1024, 1, 256]
    - [57, 4.847]
  - - [448, 1024, 1, 256]
    - [3, 6.964]
  - - [704, 1024, 1, 256]
    - [3, 10.663]
  - - [1408, 1024, 1, 256]
    - [135, 15.288]
  - - [1856, 1024, 1, 256]
    - [40, 16.611]
  - - [2368, 1024, 1, 256]
    - [107, 16.617]
  - - [2944, 1024, 1, 256]
    - [134, 19.806]
  - - [3584, 1024, 1, 256]
    - [3, 21.213]
  - - [4288, 1024, 1, 256]
    - [3, 21.873]
  - - [5056, 1024, 1, 256]
    - [40, 21.51]
  - - [5888, 1024, 1, 256]
    - [3, 23.186]
  - - [6784, 1024, 1, 256]
    - [104, 24.253]
  - - [256, 1408, 1, 256]
    - [57, 6.009]
  - - [448, 1408, 1, 256]
    - [3, 9.729]
  - - [704, 1408, 1, 256]
    - [3, 13.236]
  - - [1024, 1408, 1, 256]
    - [87, 15.872]
  - - [1408, 1408, 1, 256]
    - [71, 17.119]
  - - [1856, 1408, 1, 256]
    - [108, 16.177]
  - - [2368, 1408, 1, 256]
    - [3, 20.905]
  - - [2944, 1408, 1, 256]
    - [93, 20.148]
  - - [3584, 1408, 1, 256]
    - [32, 22.24]
  - - [4288, 1408, 1, 256]
    - [3, 23.532]
  - - [5056, 1408, 1, 256]
    - [72, 24.667]
  - - [5888, 1408, 1, 256]
    - [72, 25.63]
  - - [6784, 1408, 1, 256]
    - [114, 25.0]
  - - [256, 1856, 1, 256]
    - [3, 7.571]
  - - [448, 1856, 1, 256]
    - [3, 12.622]
  - - [704, 1856, 1, 256]
    - [3, 16.385]
  - - [1024, 1856, 1, 256]
    - [71, 16.919]
  - - [1408, 1856, 1, 256]
    - [111, 16.301]
  - - [1856, 1856, 1, 256]
    - [3, 21.139]
  - - [2368, 1856, 1, 256]
    - [3, 22.317]
  - - [2944, 1856, 1, 256]
    - [40, 23.142]
  - - [3584, 1856, 1, 256]
    - [3, 24.133]
  - - [4288, 1856, 1, 256]
    - [40, 24.735]
  - - [5056, 1856, 1, 256]
    - [71, 26.688]
  - - [5888, 1856, 1, 256]
    - [71, 25.419]
  - - [6784, 1856, 1, 256]
    - [71, 26.508]
  - - [256, 2368, 1, 256]
    - [3, 9.554]
  - - [448, 2368, 1, 256]
    - [3, 14.57]
  - - [704, 2368, 1, 256]
    - [122, 12.637]
  - - [1024, 2368, 1, 256]
    - [71, 19.756]
  - - [1408, 2368, 1, 256]
    - [3, 20.815]
  - - [1856, 2368, 1, 256]
    - [3, 22.677]
  - - [2368, 2368, 1, 256]
    - [3, 23.338]
  - - [2944, 2368, 1, 256]
    - [3, 24.581]
  - - [3584, 2368, 1, 256]
    - [72, 26.379]
  - - [4288, 2368, 1, 256]
    - [3, 25.69]
  - - [5056, 2368, 1, 256]
    - [72, 27.897]
  - - [5888, 2368, 1, 256]
    - [114, 26.72]
  - - [6784, 2368, 1, 256]
    - [71, 27.08]
  - - [256, 2944, 1, 256]
    - [3, 11.624]
  - - [448, 2944, 1, 256]
    - [3, 16.685]
  - - [704, 2944, 1, 256]
    - [107, 17.582]
  - - [1024, 2944, 1, 256]
    - [111, 20.035]
  - - [1408, 2944, 1, 256]
    - [3, 21.503]
  - - [1856, 2944, 1, 256]
    - [111, 23.557]
  - - [2368, 2944, 1, 256]
    - [3, 24.664]
  - - [2944, 2944, 1, 256]
    - [73, 26.626]
  - - [3584, 2944, 1, 256]
    - [114, 26.625]
  - - [4288, 2944, 1, 256]
    - [3, 26.007]
  - - [5056, 2944, 1, 256]
    - [72, 29.351]
  - - [5888, 2944, 1, 256]
    - [114, 28.262]
  - - [6784, 2944, 1, 256]
    - [114, 28.716]
  - - [448, 3584, 1, 256]
    - [87, 17.28]
  - - [704, 3584, 1, 256]
    - [136, 17.218]
  - - [1024, 3584, 1, 256]
    - [3, 21.341]
  - - [1408, 3584, 1, 256]
    - [3, 22.957]
  - - [1856, 3584, 1, 256]
    - [3, 24.316]
  - - [2368, 3584, 1, 256]
    - [3, 25.419]
  - - [2944, 3584, 1, 256]
    - [25, 26.44]
  - - [3584, 3584, 1, 256]
    - [114, 26.482]
  - - [4288, 3584, 1, 256]
    - [71, 27.127]
  - - [5056, 3584, 1, 256]
    - [114, 27.8]
  - - [5888, 3584, 1, 256]
    - [114, 28.819]
  - - [6784, 3584, 1, 256]
    - [114, 28.8]
  - - [256, 4288, 1, 256]
    - [139, 9.898]
  - - [448, 4288, 1, 256]
    - [71, 17.049]
  - - [704, 4288, 1, 256]
    - [3, 20.108]
  - - [1024, 4288, 1, 256]
    - [3, 22.575]
  - - [1408, 4288, 1, 256]
    - [3, 23.756]
  - - [1856, 4288, 1, 256]
    - [3, 25.169]
  - - [2368, 4288, 1, 256]
    - [3, 26.125]
  - - [2944, 4288, 1, 256]
    - [40, 26.384]
  - - [3584, 4288, 1, 256]
    - [71, 27.094]
  - - [4288, 4288, 1, 256]
    - [114, 28.045]
  - - [5056, 4288, 1, 256]
    - [25, 28.104]
  - - [5888, 4288, 1, 256]
    - [114, 29.245]
  - - [6784, 4288, 1, 256]
    - [114, 29.285]
  - - [256, 5056, 1, 256]
    - [24, 16.231]
  - - [448, 5056, 1, 256]
    - [109, 15.767]
  - - [704, 5056, 1, 256]
    - [3, 21.613]
  - - [1024, 5056, 1, 256]
    - [71, 23.553]
  - - [1408, 5056, 1, 256]
    - [3, 24.828]
  - - [1856, 5056, 1, 256]
    - [3, 25.925]
  - - [2368, 5056, 1, 256]
    - [140, 28.668]
  - - [2944, 5056, 1, 256]
    - [114, 30.141]
  - - [3584, 5056, 1, 256]
    - [114, 27.668]
  - - [4288, 5056, 1, 256]
    - [17, 28.091]
  - - [5056, 5056, 1, 256]
    - [72, 28.611]
  - - [5888, 5056, 1, 256]
    - [25, 29.628]
  - - [6784, 5056, 1, 256]
    - [114, 29.637]
  - - [448, 5888, 1, 256]
    - [93, 16.44]
  - - [704, 5888, 1, 256]
    - [3, 21.659]
  - - [1024, 5888, 1, 256]
    - [3, 23.757]
  - - [1408, 5888, 1, 256]
    - [3, 25.117]
  - - [1856, 5888, 1, 256]
    - [3, 26.049]
  - - [2368, 5888, 1, 256]
    - [25, 27.19]
  - - [2944, 5888, 1, 256]
    - [25, 28.119]
  - - [3584, 5888, 1, 256]
    - [114, 28.751]
  - - [4288, 5888, 1, 256]
    - [25, 29.093]
  - - [5056, 5888, 1, 256]
    - [114, 29.165]
  - - [5888, 5888, 1, 256]
    - [17, 32.703]
  - - [6784, 5888, 1, 256]
    - [114, 29.994]
  - - [256, 6784, 1, 256]
    - [3, 12.851]
  - - [448, 6784, 1, 256]
    - [111, 19.968]
  - - [704, 6784, 1, 256]
    - [3, 22.582]
  - - [1024, 6784, 1, 256]
    - [3, 24.706]
  - - [1408, 6784, 1, 256]
    - [3, 25.772]
  - - [1856, 6784, 1, 256]
    - [114, 26.683]
  - - [2368, 6784, 1, 256]
    - [25, 27.336]
  - - [2944, 6784, 1, 256]
    - [17, 28.363]
  - - [3584, 6784, 1, 256]
    - [114, 29.014]
  - - [4288, 6784, 1, 256]
    - [17, 29.316]
  - - [5056, 6784, 1, 256]
    - [114, 29.575]
  - - [5888, 6784, 1, 256]
    - [25, 30.112]
  - - [6784, 6784, 1, 256]
    - [137, 30.107]
  - - [704, 256, 1, 1280]
    - [124, 8.931]
  - - [1408, 256, 1, 1280]
    - [7, 16.093]
  - - [1856, 256, 1, 1280]
    - [61, 18.272]
  - - [2368, 256, 1, 1280]
    - [61, 23.128]
  - - [2944, 256, 1, 1280]
    - [61, 27.585]
  - - [3584, 256, 1, 1280]
    - [67, 24.778]
  - - [4288, 256, 1, 1280]
    - [138, 30.096]
  - - [5056, 256, 1, 1280]
    - [93, 30.252]
  - - [5888, 256, 1, 1280]
    - [32, 36.109]
  - - [6784, 256, 1, 1280]
    - [72, 32.789]
  - - [704, 448, 1, 1280]
    - [7, 14.125]
  - - [1024, 448, 1, 1280]
    - [61, 17.595]
  - - [1408, 448, 1, 1280]
    - [7, 23.567]
  - - [1856, 448, 1, 1280]
    - [7, 30.204]
  - - [2368, 448, 1, 1280]
    - [16, 29.03]
  - - [2944, 448, 1, 1280]
    - [135, 31.064]
  - - [3584, 448, 1, 1280]
    - [86, 33.173]
  - - [4288, 448, 1, 1280]
    - [70, 35.793]
  - - [5056, 448, 1, 1280]
    - [71, 40.08]
  - - [5888, 448, 1, 1280]
    - [6, 41.433]
  - - [6784, 448, 1, 1280]
    - [16, 40.268]
  - - [256, 704, 1, 1280]
    - [124, 8.87]
  - - [448, 704, 1, 1280]
    - [61, 13.952]
  - - [704, 704, 1, 1280]
    - [61, 18.959]
  - - [1024, 704, 1, 1280]
    - [115, 26.794]
  - - [1408, 704, 1, 1280]
    - [16, 27.125]
  - - [1856, 704, 1, 1280]
    - [32, 30.877]
  - - [2368, 704, 1, 1280]
    - [7, 34.944]
  - - [2944, 704, 1, 1280]
    - [140, 37.502]
  - - [3584, 704, 1, 1280]
    - [1, 36.941]
  - - [4288, 704, 1, 1280]
    - [85, 48.371]
  - - [5056, 704, 1, 1280]
    - [21, 47.942]
  - - [5888, 704, 1, 1280]
    - [1, 42.216]
  - - [6784, 704, 1, 1280]
    - [85, 43.937]
  - - [256, 1024, 1, 1280]
    - [61, 12.195]
  - - [448, 1024, 1, 1280]
    - [115, 17.689]
  - - [704, 1024, 1, 1280]
    - [61, 26.725]
  - - [1408, 1024, 1, 1280]
    - [32, 34.654]
  - - [1856, 1024, 1, 1280]
    - [88, 36.562]
  - - [2368, 1024, 1, 1280]
    - [89, 40.752]
  - - [2944, 1024, 1, 1280]
    - [0, 45.052]
  - - [3584, 1024, 1, 1280]
    - [71, 42.82]
  - - [4288, 1024, 1, 1280]
    - [68, 48.879]
  - - [5056, 1024, 1, 1280]
    - [84, 47.592]
  - - [5888, 1024, 1, 1280]
    - [0, 48.521]
  - - [6784, 1024, 1, 1280]
    - [104, 55.076]
  - - [256, 1408, 1, 1280]
    - [7, 15.848]
  - - [448, 1408, 1, 1280]
    - [115, 23.505]
  - - [704, 1408, 1, 1280]
    - [67, 27.28]
  - - [1024, 1408, 1, 1280]
    - [87, 35.301]
  - - [1408, 1408, 1, 1280]
    - [70, 39.146]
  - - [1856, 1408, 1, 1280]
    - [74, 41.771]
  - - [2368, 1408, 1, 1280]
    - [104, 47.378]
  - - [2944, 1408, 1, 1280]
    - [29, 46.196]
  - - [3584, 1408, 1, 1280]
    - [5, 49.641]
  - - [4288, 1408, 1, 1280]
    - [0, 47.578]
  - - [5056, 1408, 1, 1280]
    - [75, 56.05]
  - - [5888, 1408, 1, 1280]
    - [5, 51.049]
  - - [6784, 1408, 1, 1280]
    - [5, 57.236]
  - - [256, 1856, 1, 1280]
    - [122, 16.287]
  - - [448, 1856, 1, 1280]
    - [7, 30.984]
  - - [704, 1856, 1, 1280]
    - [95, 31.073]
  - - [1024, 1856, 1, 1280]
    - [69, 37.975]
  - - [1408, 1856, 1, 1280]
    - [74, 40.765]
  - - [1856, 1856, 1, 1280]
    - [104, 49.263]
  - - [2368, 1856, 1, 1280]
    - [5, 44.199]
  - - [2944, 1856, 1, 1280]
    - [0, 43.85]
  - - [3584, 1856, 1, 1280]
    - [76, 51.481]
  - - [4288, 1856, 1, 1280]
    - [2, 57.736]
  - - [5056, 1856, 1, 1280]
    - [141, 55.388]
  - - [5888, 1856, 1, 1280]
    - [1, 50.447]
  - - [6784, 1856, 1, 1280]
    - [1, 58.703]
  - - [256, 2368, 1, 1280]
    - [7, 23.189]
  - - [448, 2368, 1, 1280]
    - [138, 28.92]
  - - [704, 2368, 1, 1280]
    - [61, 35.41]
  - - [1024, 2368, 1, 1280]
    - [140, 42.645]
  - - [1408, 2368, 1, 1280]
    - [113, 44.818]
  - - [1856, 2368, 1, 1280]
    - [5, 43.862]
  - - [2368, 2368, 1, 1280]
    - [0, 45.0]
  - - [2944, 2368, 1, 1280]
    - [5, 52.444]
  - - [3584, 2368, 1, 1280]
    - [72, 55.694]
  - - [4288, 2368, 1, 1280]
    - [76, 56.478]
  - - [5056, 2368, 1, 1280]
    - [21, 59.074]
  - - [5888, 2368, 1, 1280]
    - [5, 54.803]
  - - [6784, 2368, 1, 1280]
    - [2, 62.567]
  - - [256, 2944, 1, 1280]
    - [7, 28.157]
  - - [448, 2944, 1, 1280]
    - [108, 31.509]
  - - [704, 2944, 1, 1280]
    - [71, 37.882]
  - - [1024, 2944, 1, 1280]
    - [1, 43.388]
  - - [1408, 2944, 1, 1280]
    - [144, 46.582]
  - - [1856, 2944, 1, 1280]
    - [0, 44.12]
  - - [2368, 2944, 1, 1280]
    - [104, 54.61]
  - - [2944, 2944, 1, 1280]
    - [72, 57.415]
  - - [3584, 2944, 1, 1280]
    - [5, 54.676]
  - - [4288, 2944, 1, 1280]
    - [84, 61.247]
  - - [5056, 2944, 1, 1280]
    - [1, 52.858]
  - - [5888, 2944, 1, 1280]
    - [5, 55.062]
  - - [6784, 2944, 1, 1280]
    - [0, 55.378]
  - - [448, 3584, 1, 1280]
    - [32, 38.592]
  - - [704, 3584, 1, 1280]
    - [22, 39.68]
  - - [1024, 3584, 1, 1280]
    - [76, 52.704]
  - - [1408, 3584, 1, 1280]
    - [144, 55.615]
  - - [1856, 3584, 1, 1280]
    - [76, 52.988]
  - - [2368, 3584, 1, 1280]
    - [5, 52.506]
  - - [2944, 3584, 1, 1280]
    - [76, 56.972]
  - - [3584, 3584, 1, 1280]
    - [0, 53.23]
  - - [4288, 3584, 1, 1280]
    - [85, 60.771]
  - - [5056, 3584, 1, 1280]
    - [1, 53.19]
  - - [5888, 3584, 1, 1280]
    - [84, 57.648]
  - - [6784, 3584, 1, 1280]
    - [6, 57.566]
  - - [256, 4288, 1, 1280]
    - [16, 28.835]
  - - [448, 4288, 1, 1280]
    - [71, 35.746]
  - - [704, 4288, 1, 1280]
    - [5, 43.621]
  - - [1024, 4288, 1, 1280]
    - [68, 48.857]
  - - [1408, 4288, 1, 1280]
    - [73, 46.486]
  - - [1856, 4288, 1, 1280]
    - [1, 49.258]
  - - [2368, 4288, 1, 1280]
    - [75, 55.736]
  - - [2944, 4288, 1, 1280]
    - [84, 59.983]
  - - [3584, 4288, 1, 1280]
    - [84, 60.844]
  - - [4288, 4288, 1, 1280]
    - [71, 53.895]
  - - [5056, 4288, 1, 1280]
    - [84, 61.972]
  - - [5888, 4288, 1, 1280]
    - [6, 63.679]
  - - [6784, 4288, 1, 1280]
    - [5, 55.535]
  - - [256, 5056, 1, 1280]
    - [87, 30.673]
  - - [448, 5056, 1, 1280]
    - [89, 38.036]
  - - [704, 5056, 1, 1280]
    - [2, 47.694]
  - - [1024, 5056, 1, 1280]
    - [1, 50.688]
  - - [1408, 5056, 1, 1280]
    - [75, 54.251]
  - - [1856, 5056, 1, 1280]
    - [0, 50.308]
  - - [2368, 5056, 1, 1280]
    - [1, 53.241]
  - - [2944, 5056, 1, 1280]
    - [5, 53.041]
  - - [3584, 5056, 1, 1280]
    - [71, 53.288]
  - - [4288, 5056, 1, 1280]
    - [0, 62.501]
  - - [5056, 5056, 1, 1280]
    - [0, 63.638]
  - - [5888, 5056, 1, 1280]
    - [0, 66.52]
  - - [6784, 5056, 1, 1280]
    - [0, 57.732]
  - - [448, 5888, 1, 1280]
    - [68, 41.775]
  - - [704, 5888, 1, 1280]
    - [68, 46.308]
  - - [1024, 5888, 1, 1280]
    - [0, 48.092]
  - - [1408, 5888, 1, 1280]
    - [68, 58.066]
  - - [1856, 5888, 1, 1280]
    - [5, 50.903]
  - - [2368, 5888, 1, 1280]
    - [84, 55.544]
  - - [2944, 5888, 1, 1280]
    - [0, 56.969]
  - - [3584, 5888, 1, 1280]
    - [0, 57.922]
  - - [4288, 5888, 1, 1280]
    - [84, 64.062]
  - - [5056, 5888, 1, 1280]
    - [0, 66.366]
  - - [5888, 5888, 1, 1280]
    - [84, 58.605]
  - - [6784, 5888, 1, 1280]
    - [84, 58.186]
  - - [256, 6784, 1, 1280]
    - [70, 34.332]
  - - [448, 6784, 1, 1280]
    - [32, 42.85]
  - - [704, 6784, 1, 1280]
    - [95, 47.37]
  - - [1024, 6784, 1, 1280]
    - [75, 53.83]
  - - [1408, 6784, 1, 1280]
    - [74, 50.384]
  - - [1856, 6784, 1, 1280]
    - [0, 51.673]
  - - [2368, 6784, 1, 1280]
    - [5, 61.211]
  - - [2944, 6784, 1, 1280]
    - [5, 62.271]
  - - [3584, 6784, 1, 1280]
    - [0, 57.246]
  - - [4288, 6784, 1, 1280]
    - [6, 64.907]
  - - [5056, 6784, 1, 1280]
    - [6, 57.604]
  - - [5888, 6784, 1, 1280]
    - [0, 57.999]
  - - [6784, 6784, 1, 1280]
    - [143, 58.219]
  - - [704, 256, 1, 3328]
    - [103, 14.698]
  - - [1408, 256, 1, 3328]
    - [80, 24.351]
  - - [1856, 256, 1, 3328]
    - [101, 26.251]
  - - [2368, 256, 1, 3328]
    - [86, 30.106]
  - - [2944, 256, 1, 3328]
    - [86, 37.939]
  - - [3584, 256, 1, 3328]
    - [16, 35.502]
  - - [4288, 256, 1, 3328]
    - [67, 42.171]
  - - [5056, 256, 1, 3328]
    - [144, 42.091]
  - - [5888, 256, 1, 3328]
    - [144, 49.795]
  - - [6784, 256, 1, 3328]
    - [141, 43.059]
  - - [704, 448, 1, 3328]
    - [82, 21.94]
  - - [1024, 448, 1, 3328]
    - [38, 28.17]
  - - [1408, 448, 1, 3328]
    - [86, 31.662]
  - - [1856, 448, 1, 3328]
    - [61, 39.873]
  - - [2368, 448, 1, 3328]
    - [16, 40.755]
  - - [2944, 448, 1, 3328]
    - [144, 43.304]
  - - [3584, 448, 1, 3328]
    - [86, 42.758]
  - - [4288, 448, 1, 3328]
    - [146, 53.948]
  - - [5056, 448, 1, 3328]
    - [88, 49.121]
  - - [5888, 448, 1, 3328]
    - [0, 50.513]
  - - [6784, 448, 1, 3328]
    - [104, 55.442]
  - - [256, 704, 1, 3328]
    - [103, 14.489]
  - - [448, 704, 1, 3328]
    - [81, 21.859]
  - - [704, 704, 1, 3328]
    - [86, 25.421]
  - - [1024, 704, 1, 3328]
    - [86, 35.426]
  - - [1408, 704, 1, 3328]
    - [16, 38.395]
  - - [1856, 704, 1, 3328]
    - [144, 43.051]
  - - [2368, 704, 1, 3328]
    - [70, 46.661]
  - - [2944, 704, 1, 3328]
    - [71, 46.12]
  - - [3584, 704, 1, 3328]
    - [0, 48.74]
  - - [4288, 704, 1, 3328]
    - [74, 57.456]
  - - [5056, 704, 1, 3328]
    - [21, 64.624]
  - - [5888, 704, 1, 3328]
    - [1, 52.472]
  - - [6784, 704, 1, 3328]
    - [0, 56.848]
  - - [256, 1024, 1, 3328]
    - [81, 18.068]
  - - [448, 1024, 1, 3328]
    - [38, 26.015]
  - - [704, 1024, 1, 3328]
    - [86, 35.287]
  - - [1408, 1024, 1, 3328]
    - [144, 47.714]
  - - [1856, 1024, 1, 3328]
    - [88, 47.544]
  - - [2368, 1024, 1, 3328]
    - [89, 56.074]
  - - [2944, 1024, 1, 3328]
    - [74, 58.384]
  - - [3584, 1024, 1, 3328]
    - [29, 54.911]
  - - [4288, 1024, 1, 3328]
    - [68, 63.173]
  - - [5056, 1024, 1, 3328]
    - [6, 61.797]
  - - [5888, 1024, 1, 3328]
    - [0, 60.886]
  - - [6784, 1024, 1, 3328]
    - [104, 67.457]
  - - [256, 1408, 1, 3328]
    - [82, 23.836]
  - - [448, 1408, 1, 3328]
    - [86, 31.244]
  - - [704, 1408, 1, 3328]
    - [16, 38.715]
  - - [1024, 1408, 1, 3328]
    - [144, 47.714]
  - - [1408, 1408, 1, 3328]
    - [69, 48.743]
  - - [1856, 1408, 1, 3328]
    - [142, 55.763]
  - - [2368, 1408, 1, 3328]
    - [104, 63.648]
  - - [2944, 1408, 1, 3328]
    - [69, 62.42]
  - - [3584, 1408, 1, 3328]
    - [1, 62.24]
  - - [4288, 1408, 1, 3328]
    - [0, 60.015]
  - - [5056, 1408, 1, 3328]
    - [76, 71.626]
  - - [5888, 1408, 1, 3328]
    - [2, 64.464]
  - - [6784, 1408, 1, 3328]
    - [5, 72.583]
  - - [256, 1856, 1, 3328]
    - [101, 25.739]
  - - [448, 1856, 1, 3328]
    - [129, 40.245]
  - - [704, 1856, 1, 3328]
    - [144, 42.825]
  - - [1024, 1856, 1, 3328]
    - [70, 47.412]
  - - [1408, 1856, 1, 3328]
    - [142, 56.689]
  - - [1856, 1856, 1, 3328]
    - [104, 55.22]
  - - [2368, 1856, 1, 3328]
    - [1, 55.355]
  - - [2944, 1856, 1, 3328]
    - [0, 55.119]
  - - [3584, 1856, 1, 3328]
    - [76, 67.611]
  - - [4288, 1856, 1, 3328]
    - [2, 62.337]
  - - [5056, 1856, 1, 3328]
    - [1, 72.032]
  - - [5888, 1856, 1, 3328]
    - [1, 71.421]
  - - [6784, 1856, 1, 3328]
    - [1, 73.963]
  - - [256, 2368, 1, 3328]
    - [86, 30.799]
  - - [448, 2368, 1, 3328]
    - [16, 40.506]
  - - [704, 2368, 1, 3328]
    - [146, 48.263]
  - - [1024, 2368, 1, 3328]
    - [140, 52.313]
  - - [1408, 2368, 1, 3328]
    - [76, 63.063]
  - - [1856, 2368, 1, 3328]
    - [68, 63.525]
  - - [2368, 2368, 1, 3328]
    - [0, 56.534]
  - - [2944, 2368, 1, 3328]
    - [5, 65.332]
  - - [3584, 2368, 1, 3328]
    - [6, 68.666]
  - - [4288, 2368, 1, 3328]
    - [75, 70.641]
  - - [5056, 2368, 1, 3328]
    - [29, 76.156]
  - - [5888, 2368, 1, 3328]
    - [1, 66.947]
  - - [6784, 2368, 1, 3328]
    - [2, 78.488]
  - - [256, 2944, 1, 3328]
    - [86, 36.843]
  - - [448, 2944, 1, 3328]
    - [144, 43.115]
  - - [704, 2944, 1, 3328]
    - [140, 45.929]
  - - [1024, 2944, 1, 3328]
    - [145, 56.858]
  - - [1408, 2944, 1, 3328]
    - [18, 60.382]
  - - [1856, 2944, 1, 3328]
    - [0, 55.148]
  - - [2368, 2944, 1, 3328]
    - [104, 68.433]
  - - [2944, 2944, 1, 3328]
    - [0, 69.814]
  - - [3584, 2944, 1, 3328]
    - [75, 71.907]
  - - [4288, 2944, 1, 3328]
    - [0, 76.882]
  - - [5056, 2944, 1, 3328]
    - [1, 64.723]
  - - [5888, 2944, 1, 3328]
    - [1, 74.657]
  - - [6784, 2944, 1, 3328]
    - [1, 78.52]
  - - [448, 3584, 1, 3328]
    - [32, 46.924]
  - - [704, 3584, 1, 3328]
    - [74, 48.64]
  - - [1024, 3584, 1, 3328]
    - [75, 71.654]
  - - [1408, 3584, 1, 3328]
    - [1, 62.425]
  - - [1856, 3584, 1, 3328]
    - [75, 68.308]
  - - [2368, 3584, 1, 3328]
    - [1, 64.836]
  - - [2944, 3584, 1, 3328]
    - [76, 71.959]
  - - [3584, 3584, 1, 3328]
    - [84, 78.943]
  - - [4288, 3584, 1, 3328]
    - [1, 66.532]
  - - [5056, 3584, 1, 3328]
    - [1, 64.838]
  - - [5888, 3584, 1, 3328]
    - [6, 71.046]
  - - [6784, 3584, 1, 3328]
    - [0, 70.43]
  - - [256, 4288, 1, 3328]
    - [16, 41.659]
  - - [448, 4288, 1, 3328]
    - [16, 48.126]
  - - [704, 4288, 1, 3328]
    - [74, 56.821]
  - - [1024, 4288, 1, 3328]
    - [5, 63.833]
  - - [1408, 4288, 1, 3328]
    - [0, 59.416]
  - - [1856, 4288, 1, 3328]
    - [33, 72.219]
  - - [2368, 4288, 1, 3328]
    - [75, 70.734]
  - - [2944, 4288, 1, 3328]
    - [6, 76.792]
  - - [3584, 4288, 1, 3328]
    - [5, 66.34]
  - - [4288, 4288, 1, 3328]
    - [76, 78.159]
  - - [5056, 4288, 1, 3328]
    - [84, 77.089]
  - - [5888, 4288, 1, 3328]
    - [84, 78.627]
  - - [6784, 4288, 1, 3328]
    - [84, 80.663]
  - - [256, 5056, 1, 3328]
    - [68, 45.898]
  - - [448, 5056, 1, 3328]
    - [89, 50.825]
  - - [704, 5056, 1, 3328]
    - [21, 62.86]
  - - [1024, 5056, 1, 3328]
    - [5, 64.025]
  - - [1408, 5056, 1, 3328]
    - [75, 71.411]
  - - [1856, 5056, 1, 3328]
    - [0, 62.831]
  - - [2368, 5056, 1, 3328]
    - [1, 66.182]
  - - [2944, 5056, 1, 3328]
    - [1, 64.716]
  - - [3584, 5056, 1, 3328]
    - [1, 64.863]
  - - [4288, 5056, 1, 3328]
    - [76, 77.021]
  - - [5056, 5056, 1, 3328]
    - [84, 79.39]
  - - [5888, 5056, 1, 3328]
    - [6, 81.79]
  - - [6784, 5056, 1, 3328]
    - [0, 70.113]
  - - [448, 5888, 1, 3328]
    - [74, 50.617]
  - - [704, 5888, 1, 3328]
    - [5, 53.191]
  - - [1024, 5888, 1, 3328]
    - [74, 60.479]
  - - [1408, 5888, 1, 3328]
    - [5, 63.829]
  - - [1856, 5888, 1, 3328]
    - [5, 73.002]
  - - [2368, 5888, 1, 3328]
    - [5, 73.524]
  - - [2944, 5888, 1, 3328]
    - [0, 69.85]
  - - [3584, 5888, 1, 3328]
    - [6, 71.008]
  - - [4288, 5888, 1, 3328]
    - [84, 78.682]
  - - [5056, 5888, 1, 3328]
    - [0, 81.81]
  - - [5888, 5888, 1, 3328]
    - [0, 70.835]
  - - [6784, 5888, 1, 3328]
    - [6, 69.575]
  - - [256, 6784, 1, 3328]
    - [70, 48.155]
  - - [448, 6784, 1, 3328]
    - [75, 57.499]
  - - [704, 6784, 1, 3328]
    - [95, 57.164]
  - - [1024, 6784, 1, 3328]
    - [76, 70.213]
  - - [1408, 6784, 1, 3328]
    - [0, 63.513]
  - - [1856, 6784, 1, 3328]
    - [84, 76.5]
  - - [2368, 6784, 1, 3328]
    - [0, 65.372]
  - - [2944, 6784, 1, 3328]
    - [5, 78.968]
  - - [3584, 6784, 1, 3328]
    - [0, 70.246]
  - - [4288, 6784, 1, 3328]
    - [1, 67.688]
  - - [5056, 6784, 1, 3328]
    - [84, 69.873]
  - - [5888, 6784, 1, 3328]
    - [2, 71.187]
  - - [6784, 6784, 1, 3328]
    - [1, 69.64]
  - - [1760, 7133, 1, 1760]
    - [18, 69.164]
  - - [2048, 7133, 1, 2048]
    - [5, 57.59]
  - - [2560, 7133, 1, 2560]
    - [5, 61.578]
  - - [3072, 7435, 1, 1024]
    - [5, 51.851]
  - - [4096, 7133, 1, 4096]
    - [6, 83.116]
  - - [7680, 5481, 1, 2560]
    - [0, 67.811]
  - - [32, 32, 1, 32]
    - [23, 0.003]
  - - [32, 64, 1, 256]
    - [56, 0.04]
  - - [32, 128, 1, 256]
    - [121, 0.082]
  - - [32, 256, 1, 256]
    - [128, 0.176]
  - - [32, 448, 1, 256]
    - [121, 0.285]
  - - [32, 704, 1, 256]
    - [56, 0.442]
  - - [32, 1024, 1, 256]
    - [121, 0.383]
  - - [32, 1408, 1, 256]
    - [56, 0.896]
  - - [32, 1856, 1, 256]
    - [56, 1.215]
  - - [32, 2368, 1, 256]
    - [121, 1.518]
  - - [32, 2944, 1, 256]
    - [4, 1.121]
  - - [32, 3584, 1, 256]
    - [121, 2.25]
  - - [32, 4288, 1, 256]
    - [121, 2.604]
  - - [32, 5056, 1, 256]
    - [121, 3.111]
  - - [32, 5888, 1, 256]
    - [121, 3.484]
  - - [32, 6784, 1, 256]
    - [121, 4.014]
  - - [32, 64, 1, 1280]
    - [99, 0.101]
  - - [32, 128, 1, 1280]
    - [99, 0.192]
  - - [32, 256, 1, 1280]
    - [99, 0.391]
  - - [32, 448, 1, 1280]
    - [123, 0.887]
  - - [32, 704, 1, 1280]
    - [123, 1.406]
  - - [32, 1024, 1, 1280]
    - [123, 1.937]
  - - [32, 1408, 1, 1280]
    - [123, 2.589]
  - - [32, 1856, 1, 1280]
    - [123, 3.539]
  - - [32, 2368, 1, 1280]
    - [123, 4.46]
  - - [32, 2944, 1, 1280]
    - [15, 5.069]
  - - [32, 3584, 1, 1280]
    - [56, 5.569]
  - - [32, 4288, 1, 1280]
    - [125, 6.663]
  - - [32, 5056, 1, 1280]
    - [125, 7.726]
  - - [32, 5888, 1, 1280]
    - [102, 8.968]
  - - [32, 6784, 1, 1280]
    - [115, 7.163]
  - - [32, 64, 1, 3328]
    - [117, 0.233]
  - - [32, 128, 1, 3328]
    - [117, 0.454]
  - - [32, 256, 1, 3328]
    - [31, 0.839]
  - - [32, 448, 1, 3328]
    - [123, 1.375]
  - - [32, 704, 1, 3328]
    - [98, 2.514]
  - - [32, 1024, 1, 3328]
    - [98, 2.997]
  - - [32, 1408, 1, 3328]
    - [99, 3.994]
  - - [32, 1856, 1, 3328]
    - [133, 5.824]
  - - [32, 2368, 1, 3328]
    - [123, 6.749]
  - - [32, 2944, 1, 3328]
    - [103, 7.77]
  - - [32, 3584, 1, 3328]
    - [103, 9.229]
  - - [32, 4288, 1, 3328]
    - [102, 10.088]
  - - [32, 5056, 1, 3328]
    - [125, 11.965]
  - - [32, 5888, 1, 3328]
    - [125, 13.534]
  - - [32, 6784, 1, 3328]
    - [83, 11.622]
  - - [64, 32, 1, 256]
    - [128, 0.023]
  - - [128, 32, 1, 256]
    - [79, 0.081]
  - - [256, 32, 1, 256]
    - [56, 0.174]
  - - [448, 32, 1, 256]
    - [56, 0.281]
  - - [704, 32, 1, 256]
    - [55, 0.448]
  - - [1024, 32, 1, 256]
    - [57, 0.666]
  - - [1408, 32, 1, 256]
    - [56, 0.89]
  - - [1856, 32, 1, 256]
    - [55, 1.181]
  - - [2368, 32, 1, 256]
    - [79, 1.518]
  - - [2944, 32, 1, 256]
    - [96, 1.811]
  - - [3584, 32, 1, 256]
    - [56, 2.205]
  - - [4288, 32, 1, 256]
    - [121, 2.587]
  - - [5056, 32, 1, 256]
    - [121, 3.111]
  - - [5888, 32, 1, 256]
    - [121, 2.107]
  - - [6784, 32, 1, 256]
    - [56, 2.521]
  - - [64, 32, 1, 1280]
    - [99, 0.093]
  - - [128, 32, 1, 1280]
    - [99, 0.194]
  - - [256, 32, 1, 1280]
    - [99, 0.394]
  - - [448, 32, 1, 1280]
    - [123, 0.847]
  - - [704, 32, 1, 1280]
    - [123, 1.321]
  - - [1024, 32, 1, 1280]
    - [123, 1.832]
  - - [1408, 32, 1, 1280]
    - [123, 2.518]
  - - [1856, 32, 1, 1280]
    - [123, 3.51]
  - - [2368, 32, 1, 1280]
    - [123, 4.285]
  - - [2944, 32, 1, 1280]
    - [123, 5.069]
  - - [3584, 32, 1, 1280]
    - [124, 5.626]
  - - [4288, 32, 1, 1280]
    - [124, 6.823]
  - - [5056, 32, 1, 1280]
    - [124, 7.803]
  - - [5888, 32, 1, 1280]
    - [124, 8.968]
  - - [6784, 32, 1, 1280]
    - [115, 7.303]
  - - [64, 32, 1, 3328]
    - [117, 0.214]
  - - [128, 32, 1, 3328]
    - [98, 0.444]
  - - [256, 32, 1, 3328]
    - [117, 0.943]
  - - [448, 32, 1, 3328]
    - [31, 1.437]
  - - [704, 32, 1, 3328]
    - [98, 2.229]
  - - [1024, 32, 1, 3328]
    - [99, 3.366]
  - - [1408, 32, 1, 3328]
    - [133, 4.483]
  - - [1856, 32, 1, 3328]
    - [133, 5.701]
  - - [2368, 32, 1, 3328]
    - [131, 7.121]
  - - [2944, 32, 1, 3328]
    - [103, 7.684]
  - - [3584, 32, 1, 3328]
    - [103, 8.52]
  - - [4288, 32, 1, 3328]
    - [124, 10.31]
  - - [5056, 32, 1, 3328]
    - [124, 11.895]
  - - [5888, 32, 1, 3328]
    - [124, 13.691]
  - - [6784, 32, 1, 3328]
    - [86, 10.882]
  - - [64, 64, 1, 32]
    - [147, 0.014]
  - - [256, 64, 1, 32]
    - [79, 0.062]
  - - [448, 64, 1, 32]
    - [79, 0.109]
  - - [704, 64, 1, 32]
    - [79, 0.162]
  - - [1408, 64, 1, 32]
    - [57, 0.319]
  - - [1856, 64, 1, 32]
    - [57, 0.393]
  - - [2368, 64, 1, 32]
    - [112, 0.26]
  - - [2944, 64, 1, 32]
    - [112, 0.323]
  - - [3584, 64, 1, 32]
    - [57, 0.738]
  - - [4288, 64, 1, 32]
    - [57, 0.883]
  - - [5056, 64, 1, 32]
    - [53, 0.518]
  - - [5888, 64, 1, 32]
    - [57, 1.151]
  - - [6784, 64, 1, 32]
    - [57, 1.294]
  - - [128, 128, 1, 32]
    - [8, 0.062]
  - - [448, 128, 1, 32]
    - [79, 0.22]
  - - [704, 128, 1, 32]
    - [57, 0.315]
  - - [1024, 128, 1, 32]
    - [57, 0.438]
  - - [1408, 128, 1, 32]
    - [147, 0.31]
  - - [1856, 128, 1, 32]
    - [57, 0.779]
  - - [2368, 128, 1, 32]
    - [57, 0.942]
  - - [2944, 128, 1, 32]
    - [52, 1.161]
  - - [3584, 128, 1, 32]
    - [57, 1.334]
  - - [4288, 128, 1, 32]
    - [79, 1.534]
  - - [5056, 128, 1, 32]
    - [57, 1.809]
  - - [5888, 128, 1, 32]
    - [11, 1.998]
  - - [6784, 128, 1, 32]
    - [11, 2.269]
  - - [64, 256, 1, 32]
    - [57, 0.027]
  - - [128, 256, 1, 32]
    - [8, 0.124]
  - - [256, 256, 1, 32]
    - [79, 0.251]
  - - [448, 256, 1, 32]
    - [57, 0.383]
  - - [704, 256, 1, 32]
    - [57, 0.602]
  - - [1408, 256, 1, 32]
    - [27, 1.083]
  - - [1856, 256, 1, 32]
    - [57, 1.37]
  - - [2368, 256, 1, 32]
    - [111, 0.935]
  - - [2944, 256, 1, 32]
    - [3, 2.013]
  - - [3584, 256, 1, 32]
    - [11, 2.25]
  - - [4288, 256, 1, 32]
    - [52, 2.505]
  - - [5056, 256, 1, 32]
    - [3, 2.863]
  - - [5888, 256, 1, 32]
    - [11, 3.088]
  - - [6784, 256, 1, 32]
    - [10, 3.313]
  - - [64, 448, 1, 32]
    - [57, 0.108]
  - - [128, 448, 1, 32]
    - [23, 0.205]
  - - [256, 448, 1, 32]
    - [57, 0.394]
  - - [448, 448, 1, 32]
    - [57, 0.67]
  - - [704, 448, 1, 32]
    - [96, 0.972]
  - - [1024, 448, 1, 32]
    - [57, 1.367]
  - - [1408, 448, 1, 32]
    - [11, 1.723]
  - - [1856, 448, 1, 32]
    - [3, 2.157]
  - - [2368, 448, 1, 32]
    - [111, 1.494]
  - - [2944, 448, 1, 32]
    - [3, 2.953]
  - - [3584, 448, 1, 32]
    - [53, 3.198]
  - - [4288, 448, 1, 32]
    - [10, 3.516]
  - - [5056, 448, 1, 32]
    - [10, 3.945]
  - - [5888, 448, 1, 32]
    - [54, 2.816]
  - - [6784, 448, 1, 32]
    - [10, 4.348]
  - - [64, 704, 1, 32]
    - [79, 0.078]
  - - [128, 704, 1, 32]
    - [57, 0.322]
  - - [256, 704, 1, 32]
    - [57, 0.596]
  - - [448, 704, 1, 32]
    - [52, 0.5]
  - - [704, 704, 1, 32]
    - [57, 1.441]
  - - [1024, 704, 1, 32]
    - [40, 1.079]
  - - [1408, 704, 1, 32]
    - [24, 1.414]
  - - [1856, 704, 1, 32]
    - [3, 2.908]
  - - [2368, 704, 1, 32]
    - [10, 3.358]
  - - [2944, 704, 1, 32]
    - [12, 3.645]
  - - [3584, 704, 1, 32]
    - [12, 4.043]
  - - [4288, 704, 1, 32]
    - [54, 4.371]
  - - [5056, 704, 1, 32]
    - [10, 4.633]
  - - [5888, 704, 1, 32]
    - [53, 4.836]
  - - [6784, 704, 1, 32]
    - [11, 5.094]
  - - [64, 1024, 1, 32]
    - [57, 0.246]
  - - [128, 1024, 1, 32]
    - [41, 0.45]
  - - [256, 1024, 1, 32]
    - [57, 0.851]
  - - [448, 1024, 1, 32]
    - [57, 1.367]
  - - [704, 1024, 1, 32]
    - [3, 1.897]
  - - [1408, 1024, 1, 32]
    - [11, 2.953]
  - - [1856, 1024, 1, 32]
    - [54, 3.478]
  - - [2368, 1024, 1, 32]
    - [54, 3.956]
  - - [2944, 1024, 1, 32]
    - [52, 3.003]
  - - [3584, 1024, 1, 32]
    - [53, 4.643]
  - - [4288, 1024, 1, 32]
    - [11, 4.916]
  - - [5056, 1024, 1, 32]
    - [12, 5.058]
  - - [5888, 1024, 1, 32]
    - [12, 5.315]
  - - [6784, 1024, 1, 32]
    - [11, 5.386]
  - - [64, 1408, 1, 32]
    - [57, 0.319]
  - - [128, 1408, 1, 32]
    - [57, 0.619]
  - - [256, 1408, 1, 32]
    - [79, 0.575]
  - - [448, 1408, 1, 32]
    - [3, 1.736]
  - - [704, 1408, 1, 32]
    - [11, 2.367]
  - - [1024, 1408, 1, 32]
    - [11, 3.005]
  - - [1408, 1408, 1, 32]
    - [10, 3.592]
  - - [1856, 1408, 1, 32]
    - [54, 2.756]
  - - [2368, 1408, 1, 32]
    - [53, 4.536]
  - - [2944, 1408, 1, 32]
    - [52, 4.852]
  - - [3584, 1408, 1, 32]
    - [11, 5.11]
  - - [4288, 1408, 1, 32]
    - [12, 5.469]
  - - [5056, 1408, 1, 32]
    - [11, 5.729]
  - - [5888, 1408, 1, 32]
    - [11, 5.93]
  - - [6784, 1408, 1, 32]
    - [10, 5.937]
  - - [64, 1856, 1, 32]
    - [8, 0.204]
  - - [128, 1856, 1, 32]
    - [57, 0.772]
  - - [256, 1856, 1, 32]
    - [57, 1.44]
  - - [448, 1856, 1, 32]
    - [23, 1.175]
  - - [704, 1856, 1, 32]
    - [3, 2.872]
  - - [1024, 1856, 1, 32]
    - [11, 2.242]
  - - [1408, 1856, 1, 32]
    - [53, 4.026]
  - - [1856, 1856, 1, 32]
    - [11, 4.566]
  - - [2368, 1856, 1, 32]
    - [148, 5.062]
  - - [2944, 1856, 1, 32]
    - [11, 5.31]
  - - [3584, 1856, 1, 32]
    - [11, 5.616]
  - - [4288, 1856, 1, 32]
    - [11, 5.892]
  - - [5056, 1856, 1, 32]
    - [10, 6.151]
  - - [5888, 1856, 1, 32]
    - [53, 6.185]
  - - [6784, 1856, 1, 32]
    - [11, 6.322]
  - - [64, 2368, 1, 32]
    - [149, 0.249]
  - - [128, 2368, 1, 32]
    - [50, 0.503]
  - - [256, 2368, 1, 32]
    - [40, 0.918]
  - - [448, 2368, 1, 32]
    - [57, 2.468]
  - - [704, 2368, 1, 32]
    - [11, 3.358]
  - - [1024, 2368, 1, 32]
    - [11, 3.92]
  - - [1408, 2368, 1, 32]
    - [11, 4.519]
  - - [1856, 2368, 1, 32]
    - [10, 5.128]
  - - [2368, 2368, 1, 32]
    - [53, 5.334]
  - - [2944, 2368, 1, 32]
    - [53, 5.752]
  - - [3584, 2368, 1, 32]
    - [10, 5.918]
  - - [4288, 2368, 1, 32]
    - [12, 6.173]
  - - [5056, 2368, 1, 32]
    - [53, 6.442]
  - - [5888, 2368, 1, 32]
    - [11, 6.469]
  - - [6784, 2368, 1, 32]
    - [53, 6.537]
  - - [64, 2944, 1, 32]
    - [57, 0.629]
  - - [128, 2944, 1, 32]
    - [57, 1.151]
  - - [256, 2944, 1, 32]
    - [3, 2.013]
  - - [448, 2944, 1, 32]
    - [3, 2.847]
  - - [704, 2944, 1, 32]
    - [11, 3.645]
  - - [1024, 2944, 1, 32]
    - [11, 4.348]
  - - [1408, 2944, 1, 32]
    - [148, 4.948]
  - - [1856, 2944, 1, 32]
    - [53, 5.353]
  - - [2368, 2944, 1, 32]
    - [10, 5.712]
  - - [2944, 2944, 1, 32]
    - [11, 5.963]
  - - [3584, 2944, 1, 32]
    - [11, 6.155]
  - - [4288, 2944, 1, 32]
    - [53, 6.392]
  - - [5056, 2944, 1, 32]
    - [12, 6.497]
  - - [5888, 2944, 1, 32]
    - [12, 6.663]
  - - [6784, 2944, 1, 32]
    - [11, 6.673]
  - - [64, 3584, 1, 32]
    - [79, 0.719]
  - - [128, 3584, 1, 32]
    - [57, 1.345]
  - - [448, 3584, 1, 32]
    - [10, 3.27]
  - - [704, 3584, 1, 32]
    - [11, 4.043]
  - - [1024, 3584, 1, 32]
    - [148, 4.61]
  - - [1408, 3584, 1, 32]
    - [12, 5.139]
  - - [1856, 3584, 1, 32]
    - [53, 5.006]
  - - [2368, 3584, 1, 32]
    - [11, 6.047]
  - - [2944, 3584, 1, 32]
    - [53, 6.175]
  - - [3584, 3584, 1, 32]
    - [53, 6.459]
  - - [4288, 3584, 1, 32]
    - [53, 6.557]
  - - [5056, 3584, 1, 32]
    - [12, 6.749]
  - - [5888, 3584, 1, 32]
    - [11, 6.805]
  - - [6784, 3584, 1, 32]
    - [53, 6.811]
  - - [64, 4288, 1, 32]
    - [57, 0.876]
  - - [128, 4288, 1, 32]
    - [57, 0.842]
  - - [256, 4288, 1, 32]
    - [3, 2.604]
  - - [448, 4288, 1, 32]
    - [54, 3.552]
  - - [704, 4288, 1, 32]
    - [12, 4.406]
  - - [1024, 4288, 1, 32]
    - [53, 4.901]
  - - [1408, 4288, 1, 32]
    - [11, 5.497]
  - - [1856, 4288, 1, 32]
    - [12, 5.916]
  - - [2368, 4288, 1, 32]
    - [54, 6.205]
  - - [2944, 4288, 1, 32]
    - [11, 6.41]
  - - [3584, 4288, 1, 32]
    - [53, 6.518]
  - - [4288, 4288, 1, 32]
    - [12, 6.792]
  - - [5056, 4288, 1, 32]
    - [53, 6.899]
  - - [5888, 4288, 1, 32]
    - [12, 6.896]
  - - [6784, 4288, 1, 32]
    - [53, 6.877]
  - - [64, 5056, 1, 32]
    - [57, 0.98]
  - - [128, 5056, 1, 32]
    - [12, 1.703]
  - - [256, 5056, 1, 32]
    - [3, 2.811]
  - - [448, 5056, 1, 32]
    - [12, 3.798]
  - - [704, 5056, 1, 32]
    - [11, 4.65]
  - - [1024, 5056, 1, 32]
    - [12, 5.1]
  - - [1408, 5056, 1, 32]
    - [54, 5.716]
  - - [1856, 5056, 1, 32]
    - [12, 6.129]
  - - [2368, 5056, 1, 32]
    - [11, 6.423]
  - - [2944, 5056, 1, 32]
    - [11, 6.513]
  - - [3584, 5056, 1, 32]
    - [11, 6.721]
  - - [4288, 5056, 1, 32]
    - [11, 6.844]
  - - [5056, 5056, 1, 32]
    - [12, 6.998]
  - - [5888, 5056, 1, 32]
    - [53, 6.983]
  - - [6784, 5056, 1, 32]
    - [11, 6.975]
  - - [64, 5888, 1, 32]
    - [57, 1.171]
  - - [128, 5888, 1, 32]
    - [11, 2.059]
  - - [448, 5888, 1, 32]
    - [12, 4.064]
  - - [704, 5888, 1, 32]
    - [12, 3.68]
  - - [1024, 5888, 1, 32]
    - [148, 5.367]
  - - [1408, 5888, 1, 32]
    - [10, 5.942]
  - - [1856, 5888, 1, 32]
    - [11, 6.304]
  - - [2368, 5888, 1, 32]
    - [12, 6.511]
  - - [2944, 5888, 1, 32]
    - [53, 6.648]
  - - [3584, 5888, 1, 32]
    - [12, 6.751]
  - - [4288, 5888, 1, 32]
    - [12, 6.906]
  - - [5056, 5888, 1, 32]
    - [12, 7.043]
  - - [5888, 5888, 1, 32]
    - [53, 7.022]
  - - [6784, 5888, 1, 32]
    - [53, 7.028]
  - - [64, 6784, 1, 32]
    - [57, 1.294]
  - - [128, 6784, 1, 32]
    - [11, 2.236]
  - - [256, 6784, 1, 32]
    - [53, 3.385]
  - - [448, 6784, 1, 32]
    - [54, 4.401]
  - - [704, 6784, 1, 32]
    - [11, 5.109]
  - - [1024, 6784, 1, 32]
    - [54, 5.591]
  - - [1408, 6784, 1, 32]
    - [12, 6.042]
  - - [1856, 6784, 1, 32]
    - [11, 6.412]
  - - [2368, 6784, 1, 32]
    - [53, 6.589]
  - - [2944, 6784, 1, 32]
    - [53, 6.68]
  - - [3584, 6784, 1, 32]
    - [11, 6.827]
  - - [4288, 6784, 1, 32]
    - [12, 6.955]
  - - [5056, 6784, 1, 32]
    - [12, 7.054]
  - - [5888, 6784, 1, 32]
    - [11, 7.042]
  - - [6784, 6784, 1, 32]
    - [12, 7.043]
  - - [32, 32, 1, 256]
    - [121, 0.011]
  - - [32, 32, 1, 1280]
    - [99, 0.05]
  - - [32, 32, 1, 3328]
    - [117, 0.125]
  - - [32, 64, 1, 32]
    - [79, 0.003]
  - - [32, 128, 1, 32]
    - [23, 0.016]
  - - [32, 256, 1, 32]
    - [147, 0.014]
  - - [32, 448, 1, 32]
    - [79, 0.025]
  - - [32, 704, 1, 32]
    - [8, 0.039]
  - - [32, 1024, 1, 32]
    - [79, 0.128]
  - - [32, 1408, 1, 32]
    - [79, 0.077]
  - - [32, 1856, 1, 32]
    - [79, 0.223]
  - - [32, 2368, 1, 32]
    - [57, 0.276]
  - - [32, 2944, 1, 32]
    - [41, 0.33]
  - - [32, 3584, 1, 32]
    - [41, 0.383]
  - - [32, 4288, 1, 32]
    - [41, 0.462]
  - - [32, 5056, 1, 32]
    - [57, 0.263]
  - - [32, 5888, 1, 32]
    - [57, 0.618]
  - - [32, 6784, 1, 32]
    - [57, 0.693]
  - - [64, 32, 1, 32]
    - [79, 0.007]
  - - [128, 32, 1, 32]
    - [27, 0.007]
  - - [256, 32, 1, 32]
    - [79, 0.031]
  - - [448, 32, 1, 32]
    - [79, 0.051]
  - - [704, 32, 1, 32]
    - [79, 0.085]
  - - [1024, 32, 1, 32]
    - [79, 0.122]
  - - [1408, 32, 1, 32]
    - [79, 0.164]
  - - [1856, 32, 1, 32]
    - [79, 0.214]
  - - [2368, 32, 1, 32]
    - [57, 0.271]
  - - [2944, 32, 1, 32]
    - [112, 0.317]
  - - [3584, 32, 1, 32]
    - [52, 0.379]
  - - [4288, 32, 1, 32]
    - [52, 0.446]
  - - [5056, 32, 1, 32]
    - [57, 0.275]
  - - [5888, 32, 1, 32]
    - [57, 0.606]
  - - [6784, 32, 1, 32]
    - [27, 0.675]
  - - [64, 64, 1, 1]
    - [27, 0.0]
  - - [256, 64, 1, 1]
    - [14, 0.001]
  - - [448, 64, 1, 1]
    - [23, 0.003]
  - - [704, 64, 1, 1]
    - [57, 0.005]
  - - [1408, 64, 1, 1]
    - [23, 0.009]
  - - [1856, 64, 1, 1]
    - [112, 0.006]
  - - [2368, 64, 1, 1]
    - [57, 0.015]
  - - [2944, 64, 1, 1]
    - [57, 0.018]
  - - [3584, 64, 1, 1]
    - [23, 0.022]
  - - [4288, 64, 1, 1]
    - [151, 0.014]
  - - [5056, 64, 1, 1]
    - [10, 0.016]
  - - [5888, 64, 1, 1]
    - [11, 0.035]
  - - [6784, 64, 1, 1]
    - [52, 0.038]
  - - [128, 128, 1, 1]
    - [8, 0.002]
  - - [448, 128, 1, 1]
    - [8, 0.006]
  - - [704, 128, 1, 1]
    - [23, 0.009]
  - - [1024, 128, 1, 1]
    - [52, 0.013]
  - - [1408, 128, 1, 1]
    - [57, 0.017]
  - - [1856, 128, 1, 1]
    - [57, 0.022]
  - - [2368, 128, 1, 1]
    - [100, 0.028]
  - - [2944, 128, 1, 1]
    - [62, 0.019]
  - - [3584, 128, 1, 1]
    - [52, 0.039]
  - - [4288, 128, 1, 1]
    - [11, 0.048]
  - - [5056, 128, 1, 1]
    - [11, 0.056]
  - - [5888, 128, 1, 1]
    - [10, 0.034]
  - - [6784, 128, 1, 1]
    - [54, 0.039]
  - - [64, 256, 1, 1]
    - [8, 0.002]
  - - [128, 256, 1, 1]
    - [8, 0.004]
  - - [256, 256, 1, 1]
    - [57, 0.007]
  - - [448, 256, 1, 1]
    - [27, 0.011]
  - - [704, 256, 1, 1]
    - [57, 0.017]
  - - [1408, 256, 1, 1]
    - [8, 0.032]
  - - [1856, 256, 1, 1]
    - [10, 0.04]
  - - [2368, 256, 1, 1]
    - [11, 0.05]
  - - [2944, 256, 1, 1]
    - [12, 0.034]
  - - [3584, 256, 1, 1]
    - [10, 0.069]
  - - [4288, 256, 1, 1]
    - [53, 0.079]
  - - [5056, 256, 1, 1]
    - [11, 0.084]
  - - [5888, 256, 1, 1]
    - [11, 0.095]
  - - [6784, 256, 1, 1]
    - [53, 0.102]
  - - [64, 448, 1, 1]
    - [8, 0.001]
  - - [128, 448, 1, 1]
    - [59, 0.006]
  - - [256, 448, 1, 1]
    - [57, 0.011]
  - - [448, 448, 1, 1]
    - [14, 0.019]
  - - [704, 448, 1, 1]
    - [100, 0.029]
  - - [1024, 448, 1, 1]
    - [11, 0.038]
  - - [1408, 448, 1, 1]
    - [52, 0.051]
  - - [1856, 448, 1, 1]
    - [11, 0.065]
  - - [2368, 448, 1, 1]
    - [11, 0.077]
  - - [2944, 448, 1, 1]
    - [10, 0.084]
  - - [3584, 448, 1, 1]
    - [11, 0.096]
  - - [4288, 448, 1, 1]
    - [12, 0.106]
  - - [5056, 448, 1, 1]
    - [11, 0.118]
  - - [5888, 448, 1, 1]
    - [148, 0.122]
  - - [6784, 448, 1, 1]
    - [10, 0.133]
  - - [64, 704, 1, 1]
    - [23, 0.005]
  - - [128, 704, 1, 1]
    - [23, 0.009]
  - - [256, 704, 1, 1]
    - [23, 0.017]
  - - [448, 704, 1, 1]
    - [48, 0.016]
  - - [704, 704, 1, 1]
    - [148, 0.024]
  - - [1024, 704, 1, 1]
    - [10, 0.056]
  - - [1408, 704, 1, 1]
    - [11, 0.072]
  - - [1856, 704, 1, 1]
    - [11, 0.083]
  - - [2368, 704, 1, 1]
    - [54, 0.098]
  - - [2944, 704, 1, 1]
    - [53, 0.111]
  - - [3584, 704, 1, 1]
    - [52, 0.12]
  - - [4288, 704, 1, 1]
    - [10, 0.096]
  - - [5056, 704, 1, 1]
    - [53, 0.098]
  - - [5888, 704, 1, 1]
    - [10, 0.149]
  - - [6784, 704, 1, 1]
    - [11, 0.156]
  - - [64, 1024, 1, 1]
    - [59, 0.007]
  - - [128, 1024, 1, 1]
    - [59, 0.013]
  - - [256, 1024, 1, 1]
    - [59, 0.025]
  - - [448, 1024, 1, 1]
    - [54, 0.039]
  - - [704, 1024, 1, 1]
    - [10, 0.056]
  - - [1408, 1024, 1, 1]
    - [11, 0.088]
  - - [1856, 1024, 1, 1]
    - [54, 0.106]
  - - [2368, 1024, 1, 1]
    - [11, 0.118]
  - - [2944, 1024, 1, 1]
    - [11, 0.094]
  - - [3584, 1024, 1, 1]
    - [52, 0.141]
  - - [4288, 1024, 1, 1]
    - [53, 0.151]
  - - [5056, 1024, 1, 1]
    - [148, 0.16]
  - - [5888, 1024, 1, 1]
    - [54, 0.165]
  - - [6784, 1024, 1, 1]
    - [10, 0.172]
  - - [64, 1408, 1, 1]
    - [23, 0.009]
  - - [128, 1408, 1, 1]
    - [27, 0.017]
  - - [256, 1408, 1, 1]
    - [52, 0.032]
  - - [448, 1408, 1, 1]
    - [52, 0.051]
  - - [704, 1408, 1, 1]
    - [53, 0.071]
  - - [1024, 1408, 1, 1]
    - [11, 0.088]
  - - [1408, 1408, 1, 1]
    - [53, 0.106]
  - - [1856, 1408, 1, 1]
    - [148, 0.12]
  - - [2368, 1408, 1, 1]
    - [53, 0.133]
  - - [2944, 1408, 1, 1]
    - [11, 0.151]
  - - [3584, 1408, 1, 1]
    - [148, 0.16]
  - - [4288, 1408, 1, 1]
    - [12, 0.165]
  - - [5056, 1408, 1, 1]
    - [11, 0.172]
  - - [5888, 1408, 1, 1]
    - [12, 0.157]
  - - [6784, 1408, 1, 1]
    - [11, 0.185]
  - - [64, 1856, 1, 1]
    - [27, 0.012]
  - - [128, 1856, 1, 1]
    - [8, 0.023]
  - - [256, 1856, 1, 1]
    - [100, 0.023]
  - - [448, 1856, 1, 1]
    - [148, 0.064]
  - - [704, 1856, 1, 1]
    - [11, 0.083]
  - - [1024, 1856, 1, 1]
    - [10, 0.103]
  - - [1408, 1856, 1, 1]
    - [148, 0.121]
  - - [1856, 1856, 1, 1]
    - [52, 0.135]
  - - [2368, 1856, 1, 1]
    - [10, 0.149]
  - - [2944, 1856, 1, 1]
    - [148, 0.157]
  - - [3584, 1856, 1, 1]
    - [11, 0.172]
  - - [4288, 1856, 1, 1]
    - [11, 0.178]
  - - [5056, 1856, 1, 1]
    - [10, 0.185]
  - - [5888, 1856, 1, 1]
    - [54, 0.187]
  - - [6784, 1856, 1, 1]
    - [11, 0.192]
  - - [64, 2368, 1, 1]
    - [57, 0.015]
  - - [128, 2368, 1, 1]
    - [23, 0.028]
  - - [256, 2368, 1, 1]
    - [148, 0.049]
  - - [448, 2368, 1, 1]
    - [53, 0.075]
  - - [704, 2368, 1, 1]
    - [10, 0.097]
  - - [1024, 2368, 1, 1]
    - [11, 0.116]
  - - [1408, 2368, 1, 1]
    - [10, 0.132]
  - - [1856, 2368, 1, 1]
    - [53, 0.15]
  - - [2368, 2368, 1, 1]
    - [148, 0.159]
  - - [2944, 2368, 1, 1]
    - [10, 0.174]
  - - [3584, 2368, 1, 1]
    - [11, 0.183]
  - - [4288, 2368, 1, 1]
    - [10, 0.188]
  - - [5056, 2368, 1, 1]
    - [11, 0.192]
  - - [5888, 2368, 1, 1]
    - [11, 0.197]
  - - [6784, 2368, 1, 1]
    - [10, 0.198]
  - - [64, 2944, 1, 1]
    - [14, 0.01]
  - - [128, 2944, 1, 1]
    - [59, 0.034]
  - - [256, 2944, 1, 1]
    - [10, 0.06]
  - - [448, 2944, 1, 1]
    - [11, 0.053]
  - - [704, 2944, 1, 1]
    - [10, 0.111]
  - - [1024, 2944, 1, 1]
    - [148, 0.128]
  - - [1408, 2944, 1, 1]
    - [10, 0.149]
  - - [1856, 2944, 1, 1]
    - [148, 0.159]
  - - [2368, 2944, 1, 1]
    - [10, 0.172]
  - - [2944, 2944, 1, 1]
    - [54, 0.18]
  - - [3584, 2944, 1, 1]
    - [11, 0.187]
  - - [4288, 2944, 1, 1]
    - [11, 0.193]
  - - [5056, 2944, 1, 1]
    - [54, 0.197]
  - - [5888, 2944, 1, 1]
    - [54, 0.199]
  - - [6784, 2944, 1, 1]
    - [11, 0.201]
  - - [64, 3584, 1, 1]
    - [27, 0.022]
  - - [128, 3584, 1, 1]
    - [150, 0.04]
  - - [448, 3584, 1, 1]
    - [53, 0.097]
  - - [704, 3584, 1, 1]
    - [54, 0.088]
  - - [1024, 3584, 1, 1]
    - [148, 0.139]
  - - [1408, 3584, 1, 1]
    - [148, 0.157]
  - - [1856, 3584, 1, 1]
    - [148, 0.167]
  - - [2368, 3584, 1, 1]
    - [11, 0.179]
  - - [2944, 3584, 1, 1]
    - [10, 0.185]
  - - [3584, 3584, 1, 1]
    - [53, 0.193]
  - - [4288, 3584, 1, 1]
    - [148, 0.197]
  - - [5056, 3584, 1, 1]
    - [10, 0.201]
  - - [5888, 3584, 1, 1]
    - [10, 0.204]
  - - [6784, 3584, 1, 1]
    - [54, 0.206]
  - - [64, 4288, 1, 1]
    - [59, 0.014]
  - - [128, 4288, 1, 1]
    - [11, 0.049]
  - - [256, 4288, 1, 1]
    - [11, 0.08]
  - - [448, 4288, 1, 1]
    - [54, 0.108]
  - - [704, 4288, 1, 1]
    - [10, 0.133]
  - - [1024, 4288, 1, 1]
    - [53, 0.151]
  - - [1408, 4288, 1, 1]
    - [53, 0.165]
  - - [1856, 4288, 1, 1]
    - [11, 0.177]
  - - [2368, 4288, 1, 1]
    - [12, 0.185]
  - - [2944, 4288, 1, 1]
    - [12, 0.191]
  - - [3584, 4288, 1, 1]
    - [12, 0.197]
  - - [4288, 4288, 1, 1]
    - [10, 0.202]
  - - [5056, 4288, 1, 1]
    - [54, 0.206]
  - - [5888, 4288, 1, 1]
    - [11, 0.208]
  - - [6784, 4288, 1, 1]
    - [54, 0.208]
  - - [64, 5056, 1, 1]
    - [100, 0.03]
  - - [128, 5056, 1, 1]
    - [11, 0.055]
  - - [256, 5056, 1, 1]
    - [11, 0.085]
  - - [448, 5056, 1, 1]
    - [11, 0.118]
  - - [704, 5056, 1, 1]
    - [53, 0.138]
  - - [1024, 5056, 1, 1]
    - [11, 0.157]
  - - [1408, 5056, 1, 1]
    - [11, 0.173]
  - - [1856, 5056, 1, 1]
    - [11, 0.182]
  - - [2368, 5056, 1, 1]
    - [11, 0.19]
  - - [2944, 5056, 1, 1]
    - [10, 0.196]
  - - [3584, 5056, 1, 1]
    - [10, 0.203]
  - - [4288, 5056, 1, 1]
    - [11, 0.205]
  - - [5056, 5056, 1, 1]
    - [12, 0.206]
  - - [5888, 5056, 1, 1]
    - [10, 0.21]
  - - [6784, 5056, 1, 1]
    - [11, 0.21]
  - - [64, 5888, 1, 1]
    - [14, 0.034]
  - - [128, 5888, 1, 1]
    - [11, 0.061]
  - - [448, 5888, 1, 1]
    - [151, 0.121]
  - - [704, 5888, 1, 1]
    - [11, 0.15]
  - - [1024, 5888, 1, 1]
    - [148, 0.16]
  - - [1408, 5888, 1, 1]
    - [11, 0.178]
  - - [1856, 5888, 1, 1]
    - [12, 0.186]
  - - [2368, 5888, 1, 1]
    - [10, 0.196]
  - - [2944, 5888, 1, 1]
    - [10, 0.201]
  - - [3584, 5888, 1, 1]
    - [10, 0.205]
  - - [4288, 5888, 1, 1]
    - [10, 0.207]
  - - [5056, 5888, 1, 1]
    - [11, 0.21]
  - - [5888, 5888, 1, 1]
    - [10, 0.212]
  - - [6784, 5888, 1, 1]
    - [54, 0.212]
  - - [64, 6784, 1, 1]
    - [151, 0.021]
  - - [128, 6784, 1, 1]
    - [53, 0.067]
  - - [256, 6784, 1, 1]
    - [11, 0.1]
  - - [448, 6784, 1, 1]
    - [62, 0.133]
  - - [704, 6784, 1, 1]
    - [11, 0.155]
  - - [1024, 6784, 1, 1]
    - [148, 0.169]
  - - [1408, 6784, 1, 1]
    - [53, 0.182]
  - - [1856, 6784, 1, 1]
    - [54, 0.19]
  - - [2368, 6784, 1, 1]
    - [10, 0.2]
  - - [2944, 6784, 1, 1]
    - [11, 0.203]
  - - [3584, 6784, 1, 1]
    - [54, 0.208]
  - - [4288, 6784, 1, 1]
    - [11, 0.209]
  - - [5056, 6784, 1, 1]
    - [12, 0.218]
  - - [5888, 6784, 1, 1]
    - [54, 0.214]
  - - [6784, 6784, 1, 1]
    - [54, 0.213]
  - - [1152, 1152, 1, 1024]
    - [152, 39.26]
  - - [8192, 8192, 1, 1024]
    - [155, 76.47]
  - - [12288, 12288, 1, 1024]
    - [156, 78.678]
  - - [16384, 16384, 1, 1024]
    - [157, 77.231]
  - - [20480, 20480, 1, 1024]
    - [158, 79.707]
  - - [24576, 24576, 1, 1024]
    - [159, 79.294]
  - - [28672, 28672, 1, 1024]
    - [160, 79.885]
  - - [32768, 32768, 1, 1024]
    - [161, 71.805]
  - - [36864, 36864, 1, 1024]
    - [160, 79.756]
  - - [40960, 40960, 1, 1024]
    - [160, 79.106]
  - - [45056, 45056, 1, 1024]
    - [160, 79.488]
  - - [49152, 49152, 1, 1024]
    - [162, 76.406]
  - - [53248, 53248, 1, 1024]
    - [160, 78.916]
  - - [57344, 57344, 1, 1024]
    - [160, 78.209]
  - - [61440, 61440, 1, 1024]
    - [163, 78.271]
  - - [65536, 65536, 1, 1024]
    - [164, 60.66]
  - - [69632, 69632, 1, 1024]
    - [160, 77.434]
  - - [73728, 73728, 1, 1024]
    - [160, 76.497]
  - - [77824, 77824, 1, 1024]
    - [160, 76.013]
  - - [81920, 81920, 1, 1024]
    - [165, 72.715]
  - - [86016, 86016, 1, 1024]
    - [160, 74.154]
  - - [90112, 90112, 1, 1024]
    - [160, 73.356]
  - - [1152, 1152, 1, 2048]
    - [166, 50.366]
  - - [2176, 2176, 1, 2048]
    - [167, 65.306]
  - - [4096, 4096, 1, 2048]
    - [154, 73.879]
  - - [8192, 8192, 1, 2048]
    - [168, 79.726]
  - - [12288, 12288, 1, 2048]
    - [169, 81.442]
  - - [16384, 16384, 1, 2048]
    - [170, 80.134]
  - - [20480, 20480, 1, 2048]
    - [171, 80.474]
  - - [24576, 24576, 1, 2048]
    - [172, 80.197]
  - - [28672, 28672, 1, 2048]
    - [171, 80.434]
  - - [32768, 32768, 1, 2048]
    - [173, 78.251]
  - - [36864, 36864, 1, 2048]
    - [171, 80.25]
  - - [40960, 40960, 1, 2048]
    - [174, 79.891]
  - - [45056, 45056, 1, 2048]
    - [175, 79.877]
  - - [49152, 49152, 1, 2048]
    - [176, 79.497]
  - - [53248, 53248, 1, 2048]
    - [177, 79.472]
  - - [57344, 57344, 1, 2048]
    - [178, 79.213]
  - - [61440, 61440, 1, 2048]
    - [179, 80.278]
  - - [65536, 65536, 1, 2048]
    - [180, 72.983]
  - - [69632, 69632, 1, 2048]
    - [181, 78.679]
  - - [73728, 73728, 1, 2048]
    - [182, 78.274]
  - - [77824, 77824, 1, 2048]
    - [182, 78.028]
  - - [81920, 81920, 1, 2048]
    - [183, 77.424]
  - - [86016, 86016, 1, 2048]
    - [182, 77.042]
  - - [90112, 90112, 1, 2048]
    - [184, 78.42]
  - - [2560, 12800, 1, 2560]
    - [185, 78.443]
  - - [2560, 35840, 1, 2560]
    - [186, 82.25]
  - - [2560, 166400, 1, 2560]
    - [187, 83.317]
  - - [2560, 168960, 1, 2560]
    - [188, 84.123]
  - - [2560, 171520, 1, 2560]
    - [189, 84.07]
  - - [12800, 2560, 1, 2560]
    - [190, 79.034]
  - - [15360, 2560, 1, 2560]
    - [191, 81.379]
  - - [17920, 2560, 1, 2560]
    - [192, 80.796]
  - - [84480, 163840, 1, 2560]
    - [193, 83.715]
  - - [84480, 166400, 1, 2560]
    - [194, 83.732]
  - - [84480, 168960, 1, 2560]
    - [195, 83.73]
  - - [84480, 171520, 1, 2560]
    - [196, 83.722]
  - - [87040, 168960, 1, 2560]
    - [193, 83.755]
  - - [87040, 171520, 1, 2560]
    - [197, 83.725]
- null
