library/src/blas3/Tensile/Logic/asm_full/aldebaran_104cu/aldebaran_Cijk_Alik_Bljk_DB.yaml
- {MinimumRequiredVersion: 4.32.1}
- aldebaran
- {Architecture: gfx90a, CUCount: 104}
- [Device 0050, Device 0051, Device 0052, Device 0054, Device 0062, Device 7400, Device
    SolutionIndex: 0
    SolutionNameMin: Cijk_Alik_Bljk_DB_MT64x16x16_MI16x16x4x1_SN_IU1_NEPBS0_PLR5_SU32_SUS128_TLDS0_WGM5
    SolutionIndex: 1
    SolutionNameMin: Cijk_Alik_Bljk_DB_MT64x16x16_MI16x16x4x1_SN_IU1_NEPBS0_PLR5_SU0_SUS0_TLDS0_WGM11
    SolutionIndex: 2
    SolutionNameMin: Cijk_Alik_Bljk_DB_MT64x16x16_MI16x16x4x1_SN_IU2_NEPBS0_PLR3_SU32_SUS128_TLDS0_WGM11
    SolutionIndex: 3
    SolutionNameMin: Cijk_Alik_Bljk_DB_MT64x16x16_MI16x16x4x1_SN_IU1_NEPBS0_PLR5_SU32_SUS128_TLDS0_WGM11
    SolutionIndex: 4
    SolutionNameMin: Cijk_Alik_Bljk_DB_MT128x128x16_MI16x16x4x1_SN_MIAV1_SUS256_SSO4_WGM5
    SolutionIndex: 5
    SolutionNameMin: Cijk_Alik_Bljk_DB_MT128x128x16_MI16x16x4x1_SN_MIAV0_SUS256_SSO4_WGM6
    SolutionIndex: 6
    SolutionNameMin: Cijk_Alik_Bljk_DB_MT128x128x16_MI16x16x4x1_SN_MIAV0_SUS256_SSO4_WGM5
    SolutionIndex: 7
    SolutionNameMin: Cijk_Alik_Bljk_DB_MT128x128x16_MI16x16x4x1_SN_MIAV0_SUS128_SSO4_WGM5
    SolutionIndex: 8
    SolutionNameMin: Cijk_Alik_Bljk_DB_MT128x128x16_MI16x16x4x1_SN_MIAV1_SUS128_SSO4_WGM5
    SolutionIndex: 9
    SolutionNameMin: Cijk_Alik_Bljk_DB_MT128x128x16_MI16x16x4x1_SN_MIAV0_SUS128_SSO4_WGM6
    SolutionIndex: 10
    SolutionNameMin: Cijk_Alik_Bljk_DB_MT128x128x16_MI16x16x4x1_SN_MIAV1_SUS128_SSO4_WGM6
    SolutionIndex: 11
    SolutionNameMin: Cijk_Alik_Bljk_DB_MT128x128x16_MI16x16x4x1_SN_MIAV0_SUS256_SSO4_WGM8
    SolutionIndex: 12
    SolutionNameMin: Cijk_Alik_Bljk_DB_MT128x128x16_MI16x16x4x1_SN_MIAV1_SUS256_SSO4_WGM8
    SolutionIndex: 13
    SolutionNameMin: Cijk_Alik_Bljk_DB_MT128x128x16_MI16x16x4x1_SN_MIAV1_SUS256_SSO4_WGM6
    SolutionIndex: 14
    SolutionNameMin: Cijk_Alik_Bljk_DB_MT128x128x16_MI16x16x4x1_SN_MIAV0_SUS128_SSO4_WGM8
    SolutionIndex: 15
    SolutionNameMin: Cijk_Alik_Bljk_DB_MT128x128x16_MI16x16x4x1_SN_MIAV1_SUS128_SSO4_WGM11
    SolutionIndex: 16
    SolutionNameMin: Cijk_Alik_Bljk_DB_MT128x128x16_MI16x16x4x1_SN_MIAV1_SUS256_SSO6_WGM5
    SolutionIndex: 17
    SolutionNameMin: Cijk_Alik_Bljk_DB_MT128x128x16_MI16x16x4x1_SN_MIAV1_SUS128_SSO4_WGM8
    SolutionIndex: 18
    SolutionNameMin: Cijk_Alik_Bljk_DB_MT64x16x64_MI16x16x4x1_SN_BL1_EPS1_GSU125_NEPBS2_NLCA4_SU2_SUS512_WGM6
    SolutionIndex: 19
    SolutionNameMin: Cijk_Alik_Bljk_DB_MT64x16x64_MI16x16x4x1_SN_BL0_EPS0_GSU125_NEPBS0_NLCA4_SU0_SUS0_WGM8
    SolutionIndex: 20
    SolutionNameMin: Cijk_Alik_Bljk_DB_MT64x16x64_MI16x16x4x1_SN_BL0_EPS0_GSU125_NEPBS0_NLCA2_SU0_SUS0_WGM6
    SolutionIndex: 21
    SolutionNameMin: Cijk_Alik_Bljk_DB_MT64x16x64_MI16x16x4x1_SN_BL1_EPS1_GSU175_NEPBS0_NLCA4_SU0_SUS0_WGM8
    SolutionIndex: 22
    SolutionNameMin: Cijk_Alik_Bljk_DB_MT256x128x16_MI16x16x4x1_SN_GSU500_SU32_SUS256_TT4_128_WG64_4_1_WGM7
    SolutionIndex: 23
    SolutionNameMin: Cijk_Alik_Bljk_DB_MT256x128x16_MI16x16x4x1_SN_GSU625_SU8_SUS256_TT4_128_WG64_4_1_WGM4
    SolutionIndex: 24
    SolutionNameMin: Cijk_Alik_Bljk_DB_MT256x128x16_MI16x16x4x1_SN_GSU875_SU8_SUS256_TT4_128_WG64_4_1_WGM4
    SolutionIndex: 25
    SolutionNameMin: Cijk_Alik_Bljk_DB_MT256x128x16_MI16x16x4x1_SN_GSU625_SU0_SUS0_TT4_128_WG64_4_1_WGM4
    SolutionIndex: 26
    SolutionNameMin: Cijk_Alik_Bljk_DB_MT128x256x16_MI16x16x4x1_SN_GSU625_SU8_SUS256_TT8_64_WG16_16_1_WGM7
    SolutionIndex: 27
    SolutionNameMin: Cijk_Alik_Bljk_DB_MT256x128x16_MI16x16x4x1_SN_GSU875_SU32_SUS256_TT4_128_WG64_4_1_WGM7
    SolutionIndex: 28
    SolutionNameMin: Cijk_Alik_Bljk_DB_MT256x128x16_MI16x16x4x1_SN_GSU875_SU0_SUS0_TT4_128_WG64_4_1_WGM4
    SolutionIndex: 29
    SolutionNameMin: Cijk_Alik_Bljk_DB_MT256x128x16_MI16x16x4x1_SN_BL1_EPS1_GSU175_SU32_SUS256_TT4_128_WG64_4_1_WGM4
- - - [1, 64, 1, 64]
    - [1, 0.002]
  - - [64, 1, 1, 64]
    - [2, 0.002]
  - - [1, 1, 1, 64]
    - [3, 0.0]
  - - [64, 64, 1, 64]
    - [1, 0.045]
  - - [128, 1, 1, 128]
    - [0, 0.006]
  - - [250, 9, 1, 500000]
    - [21, 7.93]
  - - [250, 250, 1, 500000]
    - [29, 42.133]
  - - [250, 250, 1, 8000000]
    - [26, 43.114]
  - - [250, 9, 1, 8000000]
    - [18, 8.326]
  - - [250, 250, 1, 12000000]
    - [27, 43.913]
  - - [250, 250, 1, 16000000]
    - [28, 43.355]
  - - [250, 9, 1, 12000000]
    - [19, 8.3]
  - - [250, 9, 1, 16000000]
    - [20, 8.219]
  - - [250, 250, 1, 4000000]
    - [22, 43.067]
  - - [250, 250, 1, 5000000]
    - [23, 43.299]
  - - [250, 250, 1, 6000000]
    - [24, 43.418]
  - - [250, 250, 1, 7000000]
    - [25, 42.097]
  - - [6454, 6454, 1, 689]
    - [4, 60.556]
  - - [7561, 7561, 1, 411]
    - [5, 49.947]
  - - [7985, 7985, 1, 701]
    - [6, 61.65]
  - - [7985, 7985, 1, 1948]
    - [6, 78.111]
  - - [8709, 8709, 1, 875]
    - [5, 65.904]
  - - [9603, 9603, 1, 1371]
    - [7, 71.34]
  - - [9603, 9603, 1, 701]
    - [6, 62.106]
  - - [10606, 10606, 1, 1239]
    - [6, 73.699]
  - - [11505, 11505, 1, 1278]
    - [6, 74.052]
  - - [12301, 12301, 1, 837]
    - [8, 66.86]
  - - [13179, 13179, 1, 1392]
    - [4, 78.08]
  - - [14487, 14487, 1, 1169]
    - [5, 72.955]
  - - [15420, 15420, 1, 2986]
    - [5, 83.264]
  - - [15420, 15420, 1, 701]
    - [7, 64.647]
  - - [17445, 17445, 1, 1266]
    - [6, 74.918]
  - - [18395, 18395, 1, 1008]
    - [5, 74.338]
  - - [19343, 19343, 1, 501]
    - [9, 57.724]
  - - [19343, 19343, 1, 1266]
    - [6, 74.934]
  - - [20342, 20342, 1, 1636]
    - [5, 79.295]
  - - [21581, 21581, 1, 701]
    - [5, 64.329]
  - - [21581, 21581, 1, 2921]
    - [10, 81.298]
  - - [24261, 24261, 1, 659]
    - [5, 64.233]
  - - [25109, 25109, 1, 1087]
    - [6, 71.905]
  - - [25854, 25854, 1, 701]
    - [11, 64.816]
  - - [25854, 25854, 1, 1820]
    - [5, 80.031]
  - - [27412, 27412, 1, 501]
    - [9, 58.684]
  - - [27412, 27412, 1, 1416]
    - [6, 77.843]
  - - [28005, 28005, 1, 701]
    - [12, 64.673]
  - - [28005, 28005, 1, 2572]
    - [10, 82.82]
  - - [29829, 29829, 1, 1582]
    - [6, 77.105]
  - - [30421, 30421, 1, 1186]
    - [6, 74.391]
  - - [31256, 31256, 1, 415]
    - [11, 53.721]
  - - [31256, 31256, 1, 1186]
    - [6, 74.545]
  - - [32163, 32163, 1, 1796]
    - [5, 79.679]
  - - [33974, 33974, 1, 1225]
    - [6, 74.11]
  - - [35882, 35882, 1, 701]
    - [11, 64.745]
  - - [35882, 35882, 1, 2387]
    - [13, 80.543]
  - - [36653, 36653, 1, 501]
    - [14, 58.061]
  - - [36653, 36653, 1, 2845]
    - [15, 79.593]
  - - [37967, 37967, 1, 1339]
    - [5, 75.035]
  - - [38361, 38361, 1, 701]
    - [9, 64.582]
  - - [38361, 38361, 1, 3690]
    - [16, 84.552]
  - - [39067, 39067, 1, 1224]
    - [5, 75.189]
  - - [39761, 39761, 1, 3821]
    - [5, 83.021]
  - - [40401, 40401, 1, 701]
    - [9, 64.604]
  - - [40401, 40401, 1, 1925]
    - [13, 78.883]
  - - [41535, 41535, 1, 701]
    - [17, 60.78]
  - - [41535, 41535, 1, 2235]
    - [10, 80.053]
  - - [43623, 43623, 1, 701]
    - [13, 64.631]
  - - [43623, 43623, 1, 3812]
    - [6, 86.088]
  - - [45312, 45312, 1, 701]
    - [5, 65.958]
  - - [45312, 45312, 1, 3235]
    - [13, 83.442]
  - - [47463, 47463, 1, 3020]
    - [7, 84.225]
  - - [47463, 47463, 1, 701]
    - [11, 64.472]
  - - [49109, 49109, 1, 3250]
    - [13, 84.662]
  - - [51821, 51821, 1, 701]
    - [11, 64.422]
  - - [51821, 51821, 1, 3954]
    - [9, 85.609]
  - - [60766, 60766, 1, 701]
    - [11, 64.537]
  - - [60766, 60766, 1, 2493]
    - [13, 80.754]
  - - [67143, 67143, 1, 701]
    - [15, 63.425]
  - - [67143, 67143, 1, 3914]
    - [5, 85.241]
- null
