library/src/blas3/Tensile/Logic/asm_full/aldebaran_104cu/aldebaran_Cijk_Alik_Bljk_4xi8II_BH.yaml
- {MinimumRequiredVersion: 4.32.1}
- aldebaran
- {Architecture: gfx90a, CUCount: 104}
- [Device 0050, Device 0051, Device 0052, Device 0054, Device 0062, Device 7400, Device
    SolutionIndex: 0
    SolutionNameMin: Cijk_Alik_Bljk_4xi8II_BH_MT64x16x16_SN_AMAS3_BL1_EPS1_GRVW4_GSU1_ISA90a_KLA_LRVW4_MAC_PGR1_SNLL1_TT4_4_USFGRO1_VW4_WG16_4_4_WGM1
    SolutionIndex: 1
    SolutionNameMin: Cijk_Alik_Bljk_4xi8II_BH_MT16x16x16_SN_AMAS3_BL1_EPS1_GRVW2_GSU8_ISA90a_KLA_LRVW2_MAC_PGR1_SNLL0_TT2_2_USFGRO1_VW2_WG8_8_4_WGM1
    SolutionIndex: 2
    SolutionNameMin: Cijk_Alik_Bljk_4xi8II_BH_MT16x16x16_SN_AMAS3_BL1_EPS1_GRVW2_GSU16_ISA90a_KLA_LRVW2_MAC_PGR1_SNLL0_TT2_2_USFGRO1_VW2_WG8_8_4_WGM1
    SolutionIndex: 3
    SolutionNameMin: Cijk_Alik_Bljk_4xi8II_BH_MT64x64x16_SN_AMAS3_BL1_EPS1_GRVW4_GSU1_ISA90a_KLA_LRVW4_MAC_PGR1_SNLL1_TT4_4_USFGRO1_VW4_WG16_16_1_WGM1
    SolutionIndex: 4
    SolutionNameMin: Cijk_Alik_Bljk_4xi8II_BH_MT128x64x8_SN_AMAS3_BL1_EPS1_GRVW4_GSU1_ISA90a_KLA_LRVW4_MAC_PGR1_SNLL1_TT8_4_USFGRO1_VW4_WG16_16_1_WGM8
    SolutionIndex: 5
    SolutionNameMin: Cijk_Alik_Bljk_4xi8II_BH_MT64x32x16_SN_AMAS3_BL1_EPS1_GRVW4_GSU4_ISA90a_KLA_LRVW4_MAC_PGR1_SNLL0_TT4_4_USFGRO1_VW4_WG16_8_2_WGM8
    SolutionIndex: 6
    SolutionNameMin: Cijk_Alik_Bljk_4xi8II_BH_MT32x32x32_SN_AMAS3_BL1_EPS1_GRVW4_GSU4_ISA90a_KLA_LRVW4_MAC_PGR1_SNLL0_TT4_4_USFGRO1_VW4_WG8_8_4_WGM1
    SolutionIndex: 7
    SolutionNameMin: Cijk_Alik_Bljk_4xi8II_BH_MT64x128x8_SN_AMAS3_BL1_EPS1_GRVW4_GSU1_ISA90a_KLA_LRVW4_MAC_PGR1_SNLL1_TT4_8_USFGRO1_VW4_WG16_16_1_WGM1
    SolutionIndex: 8
    SolutionNameMin: Cijk_Alik_Bljk_4xi8II_BH_MT128x64x8_SN_AMAS3_BL1_EPS1_GRVW4_GSU1_ISA90a_KLA_LRVW4_MAC_PGR1_SNLL1_TT8_4_USFGRO1_VW4_WG16_16_1_WGM1
    SolutionIndex: 9
    SolutionNameMin: Cijk_Alik_Bljk_4xi8II_BH_MT16x16x16_SN_AMAS3_BL1_EPS1_GRVW2_GSU4_ISA90a_KLA_LRVW2_MAC_PGR1_SNLL0_TT2_2_USFGRO1_VW2_WG8_8_4_WGM1
    SolutionIndex: 10
    SolutionNameMin: Cijk_Alik_Bljk_4xi8II_BH_MT64x64x16_SN_AMAS3_BL1_EPS1_GRVW4_GSU1_ISA90a_KLA_LRVW4_MAC_PGR1_SNLL1_TT4_4_USFGRO1_VW4_WG16_16_1_WGM8
    SolutionIndex: 11
    SolutionNameMin: Cijk_Alik_Bljk_4xi8II_BH_MT32x32x32_SN_AMAS3_BL1_EPS1_GRVW4_GSU4_ISA90a_KLA_LRVW4_MAC_PGR1_SNLL0_TT4_4_USFGRO1_VW4_WG8_8_4_WGM8
    SolutionIndex: 12
    SolutionNameMin: Cijk_Alik_Bljk_4xi8II_BH_MT128x32x16_SN_AMAS3_BL1_EPS1_GRVW4_GSU2_ISA90a_KLA_LRVW4_MAC_PGR1_SNLL0_TT8_4_USFGRO1_VW4_WG16_8_2_WGM8
    SolutionIndex: 13
    SolutionNameMin: Cijk_Alik_Bljk_4xi8II_BH_MT64x128x8_SN_AMAS3_BL1_EPS1_GRVW4_GSU1_ISA90a_KLA_LRVW4_MAC_PGR1_SNLL1_TT4_8_USFGRO1_VW4_WG16_16_1_WGM8
    SolutionIndex: 14
    SolutionNameMin: Cijk_Alik_Bljk_4xi8II_BH_MT32x8x32_SN_AMAS3_BL1_EPS1_GRVW4_GSU1_ISA90a_KLA_LRVW4_MAC_PGR1_SNLL1_TT4_4_USFGRO1_VW4_WG8_2_16_WGM1
    SolutionIndex: 15
    SolutionNameMin: Cijk_Alik_Bljk_4xi8II_BH_MT8x8x8_SN_AMAS3_BL1_EPS1_GRVW2_GSU16_ISA90a_KLA_LRVW2_MAC_PGR1_SNLL0_TT2_2_USFGRO1_VW2_WG4_4_4_WGM1
    SolutionIndex: 16
    SolutionNameMin: Cijk_Alik_Bljk_4xi8II_BH_MT32x32x16_SN_AMAS3_BL1_EPS1_GRVW4_GSU2_ISA90a_KLA_LRVW4_MAC_PGR1_SNLL0_TT4_4_USFGRO1_VW4_WG8_8_2_WGM8
    SolutionIndex: 17
    SolutionNameMin: Cijk_Alik_Bljk_4xi8II_BH_MT32x32x16_SN_AMAS3_BL1_EPS1_GRVW4_GSU4_ISA90a_KLA_LRVW4_MAC_PGR1_SNLL0_TT4_4_USFGRO1_VW4_WG8_8_2_WGM1
    SolutionIndex: 18
    SolutionNameMin: Cijk_Alik_Bljk_4xi8II_BH_MT128x32x16_SN_AMAS3_BL1_EPS1_GRVW4_GSU2_ISA90a_KLA_LRVW4_MAC_PGR1_SNLL0_TT8_4_USFGRO1_VW4_WG16_8_2_WGM1
    SolutionIndex: 19
    SolutionNameMin: Cijk_Alik_Bljk_4xi8II_BH_MT32x32x32_SN_AMAS3_BL1_EPS1_GRVW4_GSU1_ISA90a_KLA_LRVW4_MAC_PGR1_SNLL1_TT4_8_USFGRO1_VW4_WG8_4_8_WGM1
    SolutionIndex: 20
    SolutionNameMin: Cijk_Alik_Bljk_4xi8II_BH_MT128x64x16_SN_AMAS3_BL1_EPS1_GRVW4_GSU1_ISA90a_KLA_LRVW4_MAC_PGR1_SNLL1_TT8_4_USFGRO1_VW4_WG16_16_1_WGM8
    SolutionIndex: 21
    SolutionNameMin: Cijk_Alik_Bljk_4xi8II_BH_MT32x16x16_SN_AMAS3_BL1_EPS1_GRVW2_GSU8_ISA90a_KLA_LRVW2_MAC_PGR1_SNLL0_TT4_2_USFGRO1_VW2_WG8_8_4_WGM1
    SolutionIndex: 22
    SolutionNameMin: Cijk_Alik_Bljk_4xi8II_BH_MT64x8x32_SN_AMAS3_BL1_EPS1_GRVW4_GSU16_ISA90a_KLA_LRVW4_MAC_PGR1_SNLL0_TT4_4_USFGRO1_VW4_WG16_2_8_WGM1
    SolutionIndex: 23
    SolutionNameMin: Cijk_Alik_Bljk_4xi8II_BH_MT16x16x16_SN_AMAS3_BL1_EPS1_GRVW2_GSU8_ISA90a_KLA_LRVW2_MAC_PGR1_SNLL0_TT2_2_USFGRO1_VW2_WG8_8_4_WGM8
    SolutionIndex: 24
    SolutionNameMin: Cijk_Alik_Bljk_4xi8II_BH_MT64x32x16_SN_AMAS3_BL1_EPS1_GRVW4_GSU2_ISA90a_KLA_LRVW4_MAC_PGR1_SNLL0_TT4_4_USFGRO1_VW4_WG16_8_2_WGM8
    SolutionIndex: 25
    SolutionNameMin: Cijk_Alik_Bljk_4xi8II_BH_MT8x8x8_SN_AMAS3_BL1_EPS1_GRVW2_GSU8_ISA90a_KLA_LRVW2_MAC_PGR1_SNLL0_TT2_2_USFGRO1_VW2_WG4_4_4_WGM1
    SolutionIndex: 26
    SolutionNameMin: Cijk_Alik_Bljk_4xi8II_BH_MT32x32x16_SN_AMAS3_BL1_EPS1_GRVW4_GSU2_ISA90a_KLA_LRVW4_MAC_PGR1_SNLL0_TT4_4_USFGRO1_VW4_WG8_8_2_WGM1
    SolutionIndex: 27
    SolutionNameMin: Cijk_Alik_Bljk_4xi8II_BH_MT128x128x16_SN_AMAS3_BL1_EPS1_GRVW4_GSU1_ISA90a_KLA_LRVW4_MAC_PGR1_SNLL1_TT8_8_USFGRO1_VW4_WG16_16_1_WGM8
    SolutionIndex: 28
    SolutionNameMin: Cijk_Alik_Bljk_4xi8II_BH_MT128x32x16_SN_AMAS3_BL1_EPS1_GRVW4_GSU4_ISA90a_KLA_LRVW4_MAC_PGR1_SNLL0_TT8_4_USFGRO1_VW4_WG16_8_2_WGM8
    SolutionIndex: 29
    SolutionNameMin: Cijk_Alik_Bljk_4xi8II_BH_MT128x8x32_SN_AMAS3_BL1_EPS0_GRVW4_GSU16_ISA90a_KLA_LRVW4_MAC_PGR0_SNLL0_TT4_4_USFGRO1_VW4_WG32_2_4_WGM1
    SolutionIndex: 30
    SolutionNameMin: Cijk_Alik_Bljk_4xi8II_BH_MT64x64x8_SN_AMAS3_BL1_EPS1_GRVW4_GSU1_ISA90a_KLA_LRVW4_MAC_PGR1_SNLL1_TT4_4_USFGRO1_VW4_WG16_16_1_WGM8
    SolutionIndex: 31
    SolutionNameMin: Cijk_Alik_Bljk_4xi8II_BH_MT8x8x8_SN_AMAS3_BL1_EPS1_GRVW2_GSU1_ISA90a_KLA_LRVW2_MAC_PGR1_SNLL1_TT2_2_USFGRO1_VW2_WG4_4_4_WGM1
    SolutionIndex: 32
    SolutionNameMin: Cijk_Alik_Bljk_4xi8II_BH_MT32x64x8_SN_AMAS3_BL1_EPS1_GRVW4_GSU1_ISA90a_KLA_LRVW4_MAC_PGR1_SNLL1_TT4_4_USFGRO1_VW4_WG8_16_2_WGM1
    SolutionIndex: 33
    SolutionNameMin: Cijk_Alik_Bljk_4xi8II_BH_MT64x128x16_SN_AMAS3_BL1_EPS1_GRVW4_GSU1_ISA90a_KLA_LRVW4_MAC_PGR1_SNLL1_TT4_8_USFGRO1_VW4_WG16_16_1_WGM1
    SolutionIndex: 34
    SolutionNameMin: Cijk_Alik_Bljk_4xi8II_BH_MT32x32x16_SN_AMAS3_BL1_EPS1_GRVW4_GSU4_ISA90a_KLA_LRVW4_MAC_PGR1_SNLL0_TT4_4_USFGRO1_VW4_WG8_8_2_WGM8
    SolutionIndex: 35
    SolutionNameMin: Cijk_Alik_Bljk_4xi8II_BH_MT64x32x16_SN_AMAS3_BL1_EPS1_GRVW4_GSU2_ISA90a_KLA_LRVW4_MAC_PGR1_SNLL0_TT4_4_USFGRO1_VW4_WG16_8_2_WGM1
    SolutionIndex: 36
    SolutionNameMin: Cijk_Alik_Bljk_4xi8II_BH_MT16x16x16_SN_AMAS3_BL1_EPS1_GRVW2_GSU1_ISA90a_KLA_LRVW2_MAC_PGR1_SNLL1_TT2_2_USFGRO1_VW2_WG8_8_4_WGM1
    SolutionIndex: 37
    SolutionNameMin: Cijk_Alik_Bljk_4xi8II_BH_MT128x128x16_SN_AMAS3_BL1_EPS1_GRVW4_GSU1_ISA90a_KLA_LRVW4_MAC_PGR1_SNLL1_TT8_8_USFGRO1_VW4_WG16_16_1_WGM1
    SolutionIndex: 38
    SolutionNameMin: Cijk_Alik_Bljk_4xi8II_BH_MT32x16x16_SN_AMAS3_BL1_EPS1_GRVW4_GSU1_ISA90a_KLA_LRVW4_MAC_PGR1_SNLL1_TT4_4_USFGRO1_VW4_WG8_4_8_WGM8
    SolutionIndex: 39
    SolutionNameMin: Cijk_Alik_Bljk_4xi8II_BH_MT64x32x16_SN_AMAS3_BL1_EPS1_GRVW4_GSU4_ISA90a_KLA_LRVW4_MAC_PGR1_SNLL0_TT4_4_USFGRO1_VW4_WG16_8_2_WGM1
    SolutionIndex: 40
    SolutionNameMin: Cijk_Alik_Bljk_4xi8II_BH_MT32x32x32_SN_AMAS3_BL1_EPS1_GRVW4_GSU4_ISA90a_KLA_LRVW4_MAC_PGR1_SNLL0_TT4_8_USFGRO1_VW4_WG8_4_8_WGM8
    SolutionIndex: 41
    SolutionNameMin: Cijk_Alik_Bljk_4xi8II_BH_MT36x48x16_SN_AMAS0_BL1_EPS1_GRVW1_GSU8_ISA90a_KLA_LRVW1_MAC_PGR1_SNLL0_TT3_3_USFGRO1_VW1_WG12_16_1_WGM1
    SolutionIndex: 42
    SolutionNameMin: Cijk_Alik_Bljk_4xi8II_BH_MT64x64x8_SN_AMAS3_BL1_EPS1_GRVW4_GSU1_ISA90a_KLA_LRVW4_MAC_PGR1_SNLL1_TT4_4_USFGRO1_VW4_WG16_16_1_WGM1
    SolutionIndex: 43
    SolutionNameMin: Cijk_Alik_Bljk_4xi8II_BH_MT64x128x16_SN_AMAS3_BL1_EPS1_GRVW4_GSU1_ISA90a_KLA_LRVW4_MAC_PGR1_SNLL1_TT4_8_USFGRO1_VW4_WG16_16_1_WGM8
    SolutionIndex: 44
    SolutionNameMin: Cijk_Alik_Bljk_4xi8II_BH_MT64x16x16_SN_AMAS3_BL1_EPS1_GRVW4_GSU2_ISA90a_KLA_LRVW4_MAC_PGR1_SNLL0_TT4_4_USFGRO1_VW4_WG16_4_4_WGM8
    SolutionIndex: 45
    SolutionNameMin: Cijk_Alik_Bljk_4xi8II_BH_MT64x32x8_SN_AMAS3_BL1_EPS1_GRVW4_GSU1_ISA90a_KLA_LRVW4_MAC_PGR1_SNLL1_TT4_4_USFGRO1_VW4_WG16_8_2_WGM1
    SolutionIndex: 46
    SolutionNameMin: Cijk_Alik_Bljk_4xi8II_BH_MT64x32x16_SN_AMAS3_BL1_EPS1_GRVW4_GSU2_ISA90a_KLA_LRVW4_MAC_PGR1_SNLL0_TT8_4_USFGRO1_VW4_WG8_8_2_WGM1
    SolutionIndex: 47
    SolutionNameMin: Cijk_Alik_Bljk_4xi8II_BH_MT128x16x32_SN_AMAS3_BL1_EPS0_GRVW4_GSU32_ISA90a_KLA_LRVW4_MAC_PGR0_SNLL0_TT4_4_USFGRO1_VW4_WG32_4_2_WGM1
    SolutionIndex: 48
    SolutionNameMin: Cijk_Alik_Bljk_4xi8II_BH_MT64x16x16_SN_AMAS3_BL1_EPS1_GRVW4_GSU2_ISA90a_KLA_LRVW4_MAC_PGR1_SNLL0_TT4_4_USFGRO1_VW4_WG16_4_4_WGM1
    SolutionIndex: 49
    SolutionNameMin: Cijk_Alik_Bljk_4xi8II_BH_MT32x8x32_SN_AMAS3_BL1_EPS1_GRVW2_GSU2_ISA90a_KLA_LRVW2_MAC_PGR1_SNLL0_TT2_2_USFGRO1_VW2_WG16_4_4_WGM1
    SolutionIndex: 50
    SolutionNameMin: Cijk_Alik_Bljk_4xi8II_BH_MT16x16x8_SN_AMAS2_BL0_EPS0_GRVW2_GSU1_ISA000_KLS_LRVW2_FMA_PGR1_SNLL0_TT2_2_USFGRO0_VW2_WG8_8_1_WGM1
    SolutionIndex: 51
    SolutionNameMin: Cijk_Alik_Bljk_4xi8II_BH_MT32x16x16_SN_AMAS3_BL1_EPS1_GRVW2_GSU4_ISA90a_KLA_LRVW2_MAC_PGR1_SNLL0_TT4_2_USFGRO1_VW2_WG8_8_4_WGM1
- - - [1024, 128, 1, 128]
    - [0, 6.111]
  - - [4, 704, 1, 1280]
    - [1, 1.098]
  - - [4, 1856, 1, 3328]
    - [2, 3.263]
  - - [1856, 448, 1, 3328]
    - [3, 49.767]
  - - [2944, 4288, 1, 1280]
    - [4, 69.596]
  - - [2368, 64, 1, 3328]
    - [5, 33.449]
  - - [1760, 32, 1, 1760]
    - [34, 16.505]
  - - [2368, 5888, 1, 256]
    - [7, 62.545]
  - - [5888, 1856, 1, 256]
    - [8, 60.164]
  - - [128, 64, 1, 256]
    - [9, 0.758]
  - - [512, 24000, 1, 1536]
    - [8, 73.152]
  - - [128, 6784, 1, 3328]
    - [3, 52.044]
  - - [5888, 1408, 1, 256]
    - [7, 57.79]
  - - [5888, 1856, 1, 3328]
    - [4, 72.09]
  - - [5056, 704, 1, 256]
    - [3, 59.095]
  - - [2048, 400, 1, 512]
    - [3, 31.39]
  - - [5888, 2944, 1, 3328]
    - [4, 73.738]
  - - [1856, 4288, 1, 256]
    - [7, 54.636]
  - - [1024, 5056, 1, 128]
    - [8, 48.006]
  - - [5056, 5056, 1, 3328]
    - [7, 75.11]
  - - [1408, 5888, 1, 1280]
    - [4, 69.434]
  - - [2368, 448, 1, 128]
    - [3, 28.511]
  - - [2368, 6784, 1, 128]
    - [7, 61.428]
  - - [1024, 3584, 1, 3328]
    - [4, 60.762]
  - - [512, 48000, 1, 2048]
    - [4, 74.755]
  - - [128, 448, 1, 1280]
    - [6, 14.047]
  - - [256, 4288, 1, 3328]
    - [12, 51.67]
  - - [5888, 1408, 1, 1280]
    - [13, 67.368]
  - - [704, 1856, 1, 3328]
    - [10, 54.891]
  - - [4, 1408, 1, 128]
    - [14, 0.248]
  - - [1024, 2368, 1, 256]
    - [8, 61.696]
  - - [64, 4, 1, 256]
    - [15, 0.026]
  - - [1408, 1856, 1, 1280]
    - [4, 65.802]
  - - [1408, 64, 1, 1280]
    - [6, 19.603]
  - - [448, 1024, 1, 1280]
    - [16, 37.482]
  - - [6144, 24000, 1, 2048]
    - [4, 78.157]
  - - [4096, 32, 1, 4096]
    - [17, 34.761]
  - - [256, 1408, 1, 3328]
    - [12, 50.264]
  - - [5056, 5056, 1, 1280]
    - [4, 75.273]
  - - [448, 5056, 1, 256]
    - [13, 54.683]
  - - [704, 1856, 1, 1280]
    - [3, 52.941]
  - - [128, 5056, 1, 128]
    - [10, 20.54]
  - - [2368, 128, 1, 256]
    - [19, 15.869]
  - - [1760, 6400, 1, 1760]
    - [4, 71.836]
  - - [1856, 1408, 1, 128]
    - [3, 43.6]
  - - [64, 5056, 1, 256]
    - [32, 16.935]
  - - [6784, 256, 1, 3328]
    - [12, 61.102]
  - - [6784, 4288, 1, 3328]
    - [4, 75.652]
  - - [4288, 448, 1, 256]
    - [3, 43.531]
  - - [64, 704, 1, 128]
    - [14, 1.805]
  - - [1856, 2368, 1, 3328]
    - [4, 78.514]
  - - [4288, 2944, 1, 1280]
    - [7, 69.942]
  - - [704, 5056, 1, 1280]
    - [13, 63.016]
  - - [2368, 704, 1, 3328]
    - [10, 70.856]
  - - [256, 5888, 1, 256]
    - [33, 48.339]
  - - [1856, 4288, 1, 3328]
    - [13, 71.877]
  - - [256, 2944, 1, 256]
    - [10, 35.068]
  - - [5888, 1024, 1, 256]
    - [7, 60.29]
  - - [448, 64, 1, 1280]
    - [51, 7.957]
  - - [3072, 64, 1, 1024]
    - [19, 30.586]
  - - [3584, 4, 1, 1280]
    - [22, 3.81]
  - - [16384, 3200, 1, 4096]
    - [4, 76.291]
  - - [2944, 64, 1, 256]
    - [19, 12.574]
  - - [128, 4, 1, 1280]
    - [2, 0.187]
  - - [1408, 2944, 1, 256]
    - [4, 69.093]
  - - [256, 1856, 1, 1280]
    - [24, 32.874]
  - - [6784, 5056, 1, 3328]
    - [4, 76.367]
  - - [5056, 5056, 1, 256]
    - [7, 67.306]
  - - [1408, 6784, 1, 128]
    - [7, 56.456]
  - - [64, 1024, 1, 1280]
    - [17, 15.344]
  - - [2944, 4, 1, 256]
    - [49, 0.891]
  - - [704, 5056, 1, 128]
    - [10, 50.096]
  - - [4, 2368, 1, 1280]
    - [25, 2.792]
  - - [2368, 2944, 1, 1280]
    - [7, 71.23]
  - - [128, 3584, 1, 1280]
    - [16, 34.455]
  - - [6784, 6784, 1, 1280]
    - [4, 76.119]
  - - [1024, 256, 1, 3328]
    - [26, 37.028]
  - - [1408, 4288, 1, 1280]
    - [7, 66.72]
  - - [3584, 4288, 1, 1280]
    - [4, 72.969]
  - - [2368, 704, 1, 1280]
    - [20, 55.965]
  - - [5056, 4288, 1, 3328]
    - [4, 74.99]
  - - [3584, 2368, 1, 3328]
    - [27, 70.155]
  - - [64, 704, 1, 1280]
    - [14, 11.889]
  - - [4288, 256, 1, 256]
    - [42, 40.53]
  - - [2944, 128, 1, 128]
    - [32, 13.501]
  - - [6144, 32, 1, 2560]
    - [28, 33.811]
  - - [6784, 448, 1, 1280]
    - [4, 60.741]
  - - [1408, 2944, 1, 128]
    - [7, 48.877]
  - - [4288, 2944, 1, 256]
    - [7, 65.089]
  - - [5888, 704, 1, 1280]
    - [4, 62.735]
  - - [5056, 4, 1, 3328]
    - [29, 7.133]
  - - [1856, 64, 1, 1280]
    - [17, 23.025]
  - - [1760, 16, 1, 1760]
    - [21, 9.848]
  - - [448, 5888, 1, 128]
    - [42, 44.436]
  - - [5888, 64, 1, 3328]
    - [18, 42.474]
  - - [2944, 256, 1, 3328]
    - [10, 60.042]
  - - [1024, 64, 1, 128]
    - [14, 2.821]
  - - [5056, 2368, 1, 1280]
    - [4, 71.947]
  - - [448, 3584, 1, 1280]
    - [7, 52.176]
  - - [6784, 5888, 1, 256]
    - [13, 72.386]
  - - [704, 1024, 1, 128]
    - [3, 22.127]
  - - [704, 128, 1, 1280]
    - [34, 19.348]
  - - [4, 3584, 1, 128]
    - [36, 0.664]
  - - [1408, 448, 1, 1280]
    - [32, 50.26]
  - - [1024, 1408, 1, 256]
    - [8, 45.883]
  - - [2368, 2368, 1, 3328]
    - [4, 67.348]
  - - [1856, 6784, 1, 128]
    - [7, 73.324]
  - - [5056, 704, 1, 3328]
    - [8, 68.809]
  - - [1408, 1856, 1, 256]
    - [4, 54.311]
  - - [1408, 704, 1, 3328]
    - [12, 47.764]
  - - [2368, 5056, 1, 256]
    - [8, 64.61]
  - - [1408, 256, 1, 1280]
    - [12, 32.928]
  - - [3072, 128, 1, 1024]
    - [10, 38.791]
  - - [3584, 2368, 1, 1280]
    - [4, 70.758]
  - - [4288, 64, 1, 3328]
    - [24, 43.155]
  - - [2368, 4, 1, 1280]
    - [15, 2.712]
  - - [704, 5888, 1, 256]
    - [13, 65.91]
  - - [6784, 2944, 1, 128]
    - [7, 61.457]
  - - [2560, 1600, 1, 2560]
    - [8, 66.147]
  - - [4288, 6784, 1, 3328]
    - [4, 75.965]
  - - [2944, 256, 1, 256]
    - [42, 34.655]
  - - [2944, 6784, 1, 3328]
    - [4, 74.521]
  - - [704, 1408, 1, 3328]
    - [12, 47.525]
  - - [6144, 5984, 1, 2048]
    - [4, 75.946]
  - - [3584, 704, 1, 3328]
    - [8, 66.659]
  - - [2944, 256, 1, 128]
    - [42, 22.703]
  - - [6784, 4, 1, 1280]
    - [14, 5.322]
  - - [1024, 64, 1, 1280]
    - [6, 15.404]
  - - [2048, 1600, 1, 512]
    - [8, 76.443]
  - - [448, 4288, 1, 256]
    - [10, 42.415]
  - - [64, 3584, 1, 3328]
    - [26, 40.77]
  - - [1856, 4288, 1, 128]
    - [7, 51.893]
  - - [704, 2368, 1, 1280]
    - [10, 67.495]
  - - [1856, 2368, 1, 1280]
    - [10, 57.467]
  - - [2368, 128, 1, 3328]
    - [35, 37.676]
  - - [2944, 128, 1, 256]
    - [45, 20.204]
  - - [448, 1408, 1, 256]
    - [32, 30.581]
  - - [1856, 4288, 1, 1280]
    - [7, 69.71]
  - - [64, 5056, 1, 3328]
    - [26, 39.09]
  - - [4, 704, 1, 256]
    - [1, 0.22]
  - - [1024, 448, 1, 128]
    - [32, 14.315]
  - - [704, 4, 1, 1280]
    - [1, 1.032]
  - - [704, 256, 1, 128]
    - [19, 6.941]
  - - [704, 2944, 1, 128]
    - [3, 38.281]
  - - [1408, 1024, 1, 1280]
    - [20, 48.322]
  - - [704, 6784, 1, 256]
    - [7, 57.668]
  - - [6784, 704, 1, 256]
    - [4, 54.701]
  - - [5056, 1408, 1, 128]
    - [7, 53.514]
  - - [2048, 7000, 1, 2048]
    - [4, 75.463]
  - - [256, 3584, 1, 3328]
    - [18, 54.505]
  - - [4, 5888, 1, 3328]
    - [15, 6.062]
  - - [128, 1408, 1, 128]
    - [19, 7.061]
  - - [3584, 4288, 1, 3328]
    - [4, 72.267]
  - - [5888, 1856, 1, 1280]
    - [7, 69.217]
  - - [256, 1408, 1, 256]
    - [19, 19.007]
  - - [5056, 64, 1, 1280]
    - [35, 32.556]
  - - [1024, 704, 1, 256]
    - [10, 33.725]
  - - [448, 128, 1, 128]
    - [36, 2.592]
  - - [2368, 3584, 1, 1280]
    - [7, 68.447]
  - - [2368, 6784, 1, 1280]
    - [7, 75.022]
  - - [1024, 256, 1, 256]
    - [19, 14.572]
  - - [1856, 4, 1, 1280]
    - [25, 2.237]
  - - [448, 448, 1, 256]
    - [19, 13.401]
  - - [2944, 3584, 1, 3328]
    - [4, 73.342]
  - - [7680, 32, 1, 2560]
    - [34, 34.508]
  - - [128, 4288, 1, 128]
    - [45, 17.232]
  - - [256, 256, 1, 3328]
    - [34, 23.493]
  - - [128, 1024, 1, 3328]
    - [34, 36.212]
  - - [4, 1408, 1, 3328]
    - [15, 3.663]
  - - [6784, 2944, 1, 256]
    - [13, 64.441]
  - - [64, 1856, 1, 1280]
    - [26, 22.662]
  - - [6784, 64, 1, 128]
    - [42, 13.324]
  - - [4288, 2368, 1, 3328]
    - [4, 72.107]
  - - [1856, 2368, 1, 256]
    - [10, 54.06]
  - - [3584, 256, 1, 128]
    - [10, 24.915]
  - - [3584, 6784, 1, 3328]
    - [4, 77.082]
  - - [256, 1024, 1, 256]
    - [19, 14.622]
  - - [4, 6784, 1, 3328]
    - [17, 5.231]
  - - [1024, 5888, 1, 3328]
    - [8, 70.306]
  - - [1024, 128, 1, 1280]
    - [6, 20.621]
  - - [3072, 32, 1, 1024]
    - [6, 18.71]
  - - [6144, 24000, 1, 2560]
    - [4, 78.327]
  - - [5056, 4288, 1, 1280]
    - [4, 72.519]
  - - [5888, 64, 1, 256]
    - [32, 20.581]
  - - [6784, 1856, 1, 3328]
    - [4, 74.031]
  - - [1408, 5056, 1, 1280]
    - [8, 70.706]
  - - [1856, 256, 1, 1280]
    - [16, 34.304]
  - - [64, 5888, 1, 3328]
    - [46, 46.312]
  - - [2368, 2368, 1, 1280]
    - [8, 64.528]
  - - [2944, 5888, 1, 128]
    - [8, 76.581]
  - - [704, 5888, 1, 1280]
    - [7, 61.945]
  - - [2368, 3584, 1, 128]
    - [7, 53.408]
  - - [1856, 5056, 1, 128]
    - [7, 55.337]
  - - [704, 1024, 1, 1280]
    - [3, 52.818]
  - - [448, 256, 1, 3328]
    - [17, 29.806]
  - - [448, 1856, 1, 128]
    - [42, 24.213]
  - - [8192, 3200, 1, 2048]
    - [4, 74.375]
  - - [128, 1024, 1, 128]
    - [38, 5.658]
  - - [2944, 4, 1, 128]
    - [31, 0.522]
  - - [1024, 704, 1, 1280]
    - [3, 44.452]
  - - [128, 5888, 1, 256]
    - [30, 28.674]
  - - [1024, 5056, 1, 1280]
    - [8, 69.117]
  - - [4288, 1024, 1, 256]
    - [7, 56.801]
  - - [2944, 2368, 1, 128]
    - [8, 55.696]
  - - [704, 704, 1, 3328]
    - [39, 41.241]
  - - [704, 1408, 1, 1280]
    - [10, 42.58]
  - - [5888, 448, 1, 1280]
    - [8, 66.099]
  - - [3584, 256, 1, 3328]
    - [28, 55.789]
  - - [704, 5888, 1, 3328]
    - [13, 62.75]
  - - [704, 1856, 1, 128]
    - [3, 30.722]
  - - [448, 448, 1, 3328]
    - [35, 36.361]
  - - [4, 4288, 1, 128]
    - [38, 0.705]
  - - [128, 704, 1, 1280]
    - [6, 19.011]
  - - [3584, 2944, 1, 256]
    - [8, 65.346]
  - - [3584, 4, 1, 128]
    - [14, 0.625]
  - - [1856, 128, 1, 3328]
    - [26, 41.954]
  - - [4, 64, 1, 1280]
    - [22, 0.096]
  - - [2944, 448, 1, 128]
    - [20, 31.138]
  - - [128, 2944, 1, 1280]
    - [18, 37.923]
  - - [64, 64, 1, 3328]
    - [2, 3.808]
  - - [448, 2944, 1, 1280]
    - [10, 47.966]
  - - [512, 24000, 1, 2048]
    - [4, 74.472]
  - - [128, 256, 1, 3328]
    - [21, 14.859]
  - - [1408, 5056, 1, 3328]
    - [37, 71.354]
  - - [1856, 1856, 1, 3328]
    - [4, 65.456]
  - - [3584, 128, 1, 256]
    - [3, 22.246]
  - - [2560, 800, 1, 2560]
    - [8, 53.722]
  - - [448, 1408, 1, 3328]
    - [5, 42.557]
  - - [2368, 2368, 1, 256]
    - [8, 46.951]
  - - [4288, 4288, 1, 1280]
    - [4, 74.159]
  - - [64, 448, 1, 1280]
    - [51, 7.824]
  - - [5888, 1024, 1, 1280]
    - [4, 70.023]
  - - [1408, 4288, 1, 256]
    - [4, 70.157]
  - - [448, 4, 1, 256]
    - [23, 0.162]
  - - [5888, 448, 1, 128]
    - [4, 45.192]
  - - [512, 48000, 1, 2560]
    - [4, 75.844]
  - - [35, 8457, 1, 1760]
    - [41, 28.537]
  - - [704, 6784, 1, 3328]
    - [4, 62.969]
  - - [2560, 6400, 1, 2560]
    - [4, 73.467]
  - - [5056, 1024, 1, 1280]
    - [7, 66.436]
  - - [448, 5888, 1, 3328]
    - [13, 68.604]
  - - [128, 4, 1, 128]
    - [36, 0.023]
  - - [1024, 2944, 1, 1280]
    - [4, 57.461]
  - - [5056, 5888, 1, 1280]
    - [13, 75.328]
  - - [4288, 5888, 1, 128]
    - [7, 60.034]
  - - [256, 3584, 1, 256]
    - [10, 35.14]
  - - [1408, 3584, 1, 128]
    - [7, 47.931]
  - - [256, 2944, 1, 3328]
    - [42, 45.886]
  - - [448, 3584, 1, 128]
    - [33, 37.293]
  - - [5888, 2944, 1, 1280]
    - [7, 72.809]
  - - [4, 6784, 1, 1280]
    - [16, 4.004]
  - - [2368, 5888, 1, 128]
    - [7, 53.345]
  - - [8448, 16, 1, 2816]
    - [44, 26.357]
  - - [64, 2944, 1, 128]
    - [19, 6.96]
  - - [2368, 4, 1, 256]
    - [14, 0.72]
  - - [3584, 5888, 1, 256]
    - [4, 69.619]
  - - [2368, 1024, 1, 128]
    - [7, 46.217]
  - - [2368, 704, 1, 128]
    - [10, 38.138]
  - - [3584, 2944, 1, 1280]
    - [8, 73.441]
  - - [3584, 2368, 1, 128]
    - [8, 55.958]
  - - [5056, 704, 1, 128]
    - [42, 49.506]
  - - [448, 2368, 1, 128]
    - [10, 29.298]
  - - [5056, 1408, 1, 3328]
    - [7, 72.935]
  - - [1408, 704, 1, 256]
    - [3, 36.435]
  - - [6784, 1024, 1, 3328]
    - [27, 71.097]
  - - [6784, 2944, 1, 3328]
    - [4, 75.032]
  - - [2944, 5056, 1, 3328]
    - [4, 74.557]
  - - [1856, 1856, 1, 256]
    - [3, 56.996]
  - - [1024, 5888, 1, 128]
    - [13, 50.287]
  - - [6784, 2368, 1, 1280]
    - [4, 72.818]
  - - [256, 4, 1, 128]
    - [14, 0.046]
  - - [4288, 5888, 1, 1280]
    - [7, 73.947]
  - - [4288, 4288, 1, 256]
    - [8, 64.443]
  - - [8448, 32, 1, 2816]
    - [26, 38.457]
  - - [448, 2944, 1, 3328]
    - [33, 61.122]
  - - [5888, 4, 1, 128]
    - [14, 1.017]
  - - [4288, 1856, 1, 1280]
    - [8, 71.514]
  - - [1856, 2944, 1, 3328]
    - [4, 66.075]
  - - [256, 6784, 1, 3328]
    - [18, 60.326]
  - - [64, 5888, 1, 256]
    - [19, 20.143]
  - - [256, 5056, 1, 128]
    - [10, 32.634]
  - - [5056, 1024, 1, 256]
    - [7, 58.885]
  - - [704, 64, 1, 3328]
    - [11, 19.783]
  - - [5056, 1856, 1, 3328]
    - [4, 71.561]
  - - [4, 2944, 1, 3328]
    - [15, 4.875]
  - - [4, 5056, 1, 256]
    - [19, 1.354]
  - - [1856, 1408, 1, 256]
    - [3, 52.865]
  - - [8448, 12000, 1, 2816]
    - [4, 77.821]
  - - [6784, 128, 1, 3328]
    - [3, 54.515]
  - - [4288, 1408, 1, 128]
    - [7, 54.812]
  - - [1856, 5888, 1, 3328]
    - [8, 71.745]
  - - [4288, 5056, 1, 256]
    - [4, 65.207]
  - - [1408, 128, 1, 1280]
    - [19, 29.238]
  - - [4096, 800, 1, 1024]
    - [8, 61.73]
  - - [5056, 256, 1, 3328]
    - [33, 59.858]
  - - [704, 704, 1, 256]
    - [32, 25.21]
  - - [1024, 5888, 1, 1280]
    - [4, 67.673]
  - - [6784, 2368, 1, 128]
    - [4, 53.292]
  - - [4, 5056, 1, 1280]
    - [25, 4.096]
  - - [256, 64, 1, 1280]
    - [1, 4.935]
  - - [128, 1856, 1, 1280]
    - [16, 28.555]
  - - [1856, 1024, 1, 1280]
    - [10, 50.317]
  - - [6784, 4288, 1, 1280]
    - [13, 74.272]
  - - [2560, 64, 1, 2560]
    - [5, 32.927]
  - - [1856, 1856, 1, 1280]
    - [7, 62.744]
  - - [4096, 400, 1, 1024]
    - [45, 39.374]
  - - [3072, 24000, 1, 1024]
    - [8, 76.834]
  - - [128, 4288, 1, 3328]
    - [24, 43.826]
  - - [4, 2368, 1, 3328]
    - [15, 4.321]
  - - [5888, 1856, 1, 128]
    - [8, 56.068]
  - - [448, 704, 1, 1280]
    - [0, 36.798]
  - - [128, 5056, 1, 1280]
    - [3, 39.921]
  - - [1024, 448, 1, 3328]
    - [5, 40.725]
  - - [1856, 704, 1, 1280]
    - [3, 53.534]
  - - [5056, 3584, 1, 128]
    - [13, 62.417]
  - - [5888, 5888, 1, 3328]
    - [4, 76.989]
  - - [6784, 1024, 1, 256]
    - [7, 56.252]
  - - [2944, 2368, 1, 256]
    - [8, 61.061]
  - - [256, 448, 1, 256]
    - [38, 8.279]
  - - [5056, 5888, 1, 3328]
    - [4, 75.611]
  - - [1856, 1024, 1, 256]
    - [10, 41.842]
  - - [512, 48000, 1, 1536]
    - [8, 74.864]
  - - [3584, 448, 1, 1280]
    - [20, 50.284]
  - - [8448, 5984, 1, 2816]
    - [4, 77.041]
  - - [1024, 1024, 1, 1280]
    - [42, 43.732]
  - - [448, 5888, 1, 256]
    - [7, 53.699]
  - - [704, 64, 1, 128]
    - [36, 2.264]
  - - [1408, 6784, 1, 3328]
    - [8, 88.568]
  - - [448, 1024, 1, 128]
    - [3, 15.106]
  - - [4288, 704, 1, 128]
    - [10, 41.33]
  - - [128, 1856, 1, 128]
    - [19, 8.338]
  - - [448, 2368, 1, 3328]
    - [17, 46.045]
  - - [5056, 64, 1, 128]
    - [0, 11.222]
  - - [5056, 2944, 1, 256]
    - [4, 61.901]
  - - [6784, 5888, 1, 128]
    - [7, 63.641]
  - - [1024, 700, 1, 512]
    - [10, 39.779]
  - - [704, 1024, 1, 256]
    - [3, 33.528]
  - - [1024, 4, 1, 256]
    - [14, 0.335]
  - - [2944, 704, 1, 128]
    - [3, 36.443]
  - - [128, 6784, 1, 1280]
    - [3, 51.755]
  - - [1408, 3584, 1, 3328]
    - [8, 68.512]
  - - [2368, 6784, 1, 256]
    - [7, 59.446]
  - - [5056, 1408, 1, 1280]
    - [7, 72.526]
  - - [256, 256, 1, 128]
    - [38, 2.811]
  - - [5056, 4288, 1, 128]
    - [7, 60.717]
  - - [1408, 1856, 1, 128]
    - [42, 44.824]
  - - [1408, 5888, 1, 3328]
    - [4, 69.507]
  - - [1856, 256, 1, 256]
    - [32, 24.209]
  - - [6784, 6784, 1, 256]
    - [13, 69.975]
  - - [64, 256, 1, 128]
    - [36, 0.724]
  - - [4288, 2368, 1, 128]
    - [4, 52.457]
  - - [1024, 1024, 1, 128]
    - [42, 27.843]
  - - [256, 4288, 1, 1280]
    - [10, 46.266]
  - - [2368, 2944, 1, 256]
    - [7, 60.983]
  - - [4, 1856, 1, 256]
    - [14, 0.556]
  - - [3584, 1856, 1, 1280]
    - [8, 66.569]
  - - [6784, 6784, 1, 128]
    - [13, 64.457]
  - - [256, 1856, 1, 128]
    - [42, 15.085]
  - - [704, 64, 1, 1280]
    - [40, 12.375]
  - - [5888, 5056, 1, 256]
    - [4, 68.863]
  - - [8448, 48000, 1, 2816]
    - [4, 78.41]
  - - [3584, 448, 1, 256]
    - [4, 50.365]
  - - [448, 4288, 1, 128]
    - [3, 34.045]
  - - [7680, 64, 1, 2560]
    - [34, 47.337]
  - - [256, 6784, 1, 256]
    - [4, 45.874]
  - - [1408, 4288, 1, 128]
    - [8, 60.737]
  - - [2944, 704, 1, 3328]
    - [4, 55.557]
  - - [128, 448, 1, 256]
    - [36, 4.423]
  - - [5056, 256, 1, 1280]
    - [33, 56.566]
  - - [2560, 32, 1, 2560]
    - [17, 24.945]
  - - [3584, 3584, 1, 256]
    - [7, 66.42]
  - - [448, 1408, 1, 128]
    - [42, 19.264]
  - - [128, 256, 1, 1280]
    - [6, 8.55]
  - - [3584, 5056, 1, 256]
    - [4, 68.617]
  - - [6784, 128, 1, 256]
    - [10, 33.575]
  - - [4288, 4, 1, 256]
    - [14, 1.364]
  - - [704, 448, 1, 256]
    - [32, 17.995]
  - - [2944, 2368, 1, 1280]
    - [4, 70.858]
  - - [448, 64, 1, 3328]
    - [21, 14.149]
  - - [1408, 3584, 1, 256]
    - [8, 56.622]
  - - [3584, 4, 1, 3328]
    - [22, 5.822]
  - - [6784, 3584, 1, 256]
    - [7, 70.108]
  - - [256, 128, 1, 128]
    - [14, 1.385]
  - - [704, 1408, 1, 128]
    - [10, 26.813]
  - - [4, 2368, 1, 256]
    - [36, 0.686]
  - - [4288, 128, 1, 1280]
    - [32, 43.324]
  - - [128, 1408, 1, 256]
    - [19, 11.905]
  - - [4, 2944, 1, 256]
    - [31, 0.84]
  - - [64, 128, 1, 3328]
    - [1, 6.539]
  - - [5056, 2368, 1, 128]
    - [4, 48.641]
  - - [2944, 2944, 1, 3328]
    - [4, 87.533]
  - - [5056, 6784, 1, 256]
    - [4, 67.703]
  - - [1856, 3584, 1, 128]
    - [7, 54.891]
  - - [128, 2944, 1, 128]
    - [32, 12.245]
  - - [35, 8457, 1, 2560]
    - [41, 29.413]
  - - [1024, 704, 1, 3328]
    - [12, 43.48]
  - - [6784, 448, 1, 256]
    - [4, 52.403]
  - - [3584, 6784, 1, 128]
    - [7, 57.37]
  - - [128, 4288, 1, 256]
    - [10, 23.974]
  - - [704, 448, 1, 3328]
    - [24, 38.409]
  - - [1024, 1024, 1, 3328]
    - [18, 49.739]
  - - [128, 128, 1, 3328]
    - [21, 9.95]
  - - [5056, 1856, 1, 256]
    - [4, 62.011]
  - - [4608, 5984, 1, 1536]
    - [4, 76.004]
  - - [256, 128, 1, 256]
    - [14, 2.81]
  - - [1760, 3200, 1, 1760]
    - [13, 63.791]
  - - [1024, 1856, 1, 256]
    - [4, 49.636]
  - - [4096, 1600, 1, 1024]
    - [8, 64.248]
  - - [4288, 64, 1, 128]
    - [0, 9.463]
  - - [256, 448, 1, 3328]
    - [34, 29.285]
  - - [1408, 6784, 1, 1280]
    - [4, 72.356]
  - - [3584, 3584, 1, 1280]
    - [7, 70.486]
  - - [7680, 24000, 1, 2560]
    - [4, 78.256]
  - - [64, 2368, 1, 1280]
    - [19, 25.141]
  - - [448, 2368, 1, 1280]
    - [10, 40.2]
  - - [4608, 48000, 1, 1536]
    - [4, 78.057]
  - - [5888, 5888, 1, 128]
    - [4, 62.493]
  - - [64, 6784, 1, 3328]
    - [46, 42.613]
  - - [2944, 256, 1, 1280]
    - [3, 54.327]
  - - [2048, 16, 1, 2048]
    - [21, 11.447]
  - - [256, 2368, 1, 128]
    - [3, 18.953]
  - - [5056, 2368, 1, 3328]
    - [4, 72.659]
  - - [2944, 4288, 1, 256]
    - [8, 58.235]
  - - [1408, 3584, 1, 1280]
    - [4, 67.623]
  - - [2368, 64, 1, 256]
    - [0, 10.414]
  - - [64, 448, 1, 3328]
    - [6, 13.475]
  - - [704, 128, 1, 3328]
    - [17, 30.24]
  - - [8192, 1600, 1, 2048]
    - [4, 74.104]
  - - [1856, 704, 1, 256]
    - [3, 40.545]
  - - [4, 4288, 1, 1280]
    - [25, 3.665]
  - - [1408, 448, 1, 3328]
    - [18, 46.136]
  - - [1024, 4, 1, 3328]
    - [15, 2.816]
  - - [512, 24000, 1, 2560]
    - [8, 73.633]
  - - [2368, 6784, 1, 3328]
    - [13, 75.337]
  - - [1856, 1408, 1, 1280]
    - [13, 65.293]
  - - [1856, 448, 1, 1280]
    - [3, 59.848]
  - - [6784, 704, 1, 128]
    - [3, 44.184]
  - - [4, 4, 1, 256]
    - [23, 0.001]
  - - [128, 5888, 1, 128]
    - [3, 23.765]
  - - [1408, 5888, 1, 256]
    - [4, 55.876]
  - - [704, 2944, 1, 1280]
    - [10, 50.618]
  - - [4288, 64, 1, 1280]
    - [0, 32.052]
  - - [256, 64, 1, 256]
    - [14, 1.335]
  - - [1024, 1024, 1, 256]
    - [10, 38.377]
  - - [704, 1856, 1, 256]
    - [10, 39.85]
  - - [704, 6784, 1, 128]
    - [7, 46.468]
  - - [3584, 704, 1, 1280]
    - [4, 59.172]
  - - [256, 128, 1, 1280]
    - [51, 8.789]
  - - [5888, 2368, 1, 256]
    - [7, 58.742]
  - - [256, 2368, 1, 1280]
    - [32, 39.396]
  - - [2944, 6784, 1, 128]
    - [13, 56.935]
  - - [3584, 448, 1, 3328]
    - [20, 56.859]
  - - [1408, 4, 1, 256]
    - [14, 0.486]
  - - [704, 2368, 1, 3328]
    - [10, 70.424]
  - - [2944, 448, 1, 256]
    - [3, 40.94]
  - - [1856, 448, 1, 128]
    - [42, 24.034]
  - - [4288, 4, 1, 3328]
    - [29, 6.42]
  - - [2368, 128, 1, 1280]
    - [0, 36.38]
  - - [256, 5888, 1, 128]
    - [10, 35.673]
  - - [64, 6784, 1, 256]
    - [32, 22.641]
  - - [64, 5056, 1, 1280]
    - [0, 32.989]
  - - [4, 6784, 1, 128]
    - [31, 1.087]
  - - [2048, 3200, 1, 512]
    - [7, 59.948]
  - - [2944, 2944, 1, 1280]
    - [27, 68.783]
  - - [5056, 448, 1, 3328]
    - [7, 58.19]
  - - [4, 3584, 1, 1280]
    - [34, 2.999]
  - - [1408, 128, 1, 128]
    - [19, 6.931]
  - - [6784, 704, 1, 3328]
    - [4, 66.604]
  - - [128, 64, 1, 1280]
    - [1, 2.884]
  - - [2368, 256, 1, 1280]
    - [45, 47.797]
  - - [4, 448, 1, 3328]
    - [1, 1.368]
  - - [5888, 4288, 1, 128]
    - [8, 57.473]
  - - [4, 5888, 1, 256]
    - [36, 1.594]
  - - [1408, 2944, 1, 3328]
    - [7, 65.108]
  - - [3584, 704, 1, 128]
    - [8, 49.36]
  - - [4608, 12000, 1, 1536]
    - [4, 76.578]
  - - [64, 1024, 1, 256]
    - [14, 4.906]
  - - [5056, 5056, 1, 128]
    - [7, 54.932]
  - - [2368, 448, 1, 1280]
    - [3, 40.158]
  - - [128, 3584, 1, 256]
    - [30, 22.899]
  - - [704, 448, 1, 1280]
    - [0, 31.831]
  - - [8192, 800, 1, 2048]
    - [4, 65.008]
  - - [448, 5056, 1, 128]
    - [13, 41.45]
  - - [256, 4, 1, 1280]
    - [2, 0.38]
  - - [5056, 3584, 1, 256]
    - [4, 63.886]
  - - [2368, 4, 1, 3328]
    - [22, 5.338]
  - - [1408, 5056, 1, 128]
    - [8, 55.914]
  - - [2944, 3584, 1, 128]
    - [7, 71.575]
  - - [3584, 2368, 1, 256]
    - [8, 57.226]
  - - [128, 3584, 1, 3328]
    - [34, 40.252]
  - - [128, 1024, 1, 1280]
    - [26, 22.011]
  - - [8448, 24000, 1, 2816]
    - [4, 78.396]
  - - [64, 704, 1, 256]
    - [14, 3.677]
  - - [4288, 256, 1, 1280]
    - [3, 42.932]
  - - [3584, 3584, 1, 3328]
    - [4, 72.853]
  - - [1024, 256, 1, 128]
    - [0, 9.28]
  - - [4, 704, 1, 128]
    - [36, 0.124]
  - - [5888, 6784, 1, 256]
    - [4, 68.894]
  - - [4288, 2944, 1, 3328]
    - [4, 71.391]
  - - [2944, 64, 1, 128]
    - [19, 7.515]
  - - [1024, 128, 1, 3328]
    - [34, 32.885]
  - - [1024, 16, 1, 500000]
    - [47, 18.183]
  - - [4288, 128, 1, 3328]
    - [24, 43.884]
  - - [7680, 128, 1, 2560]
    - [12, 45.428]
  - - [256, 5056, 1, 1280]
    - [20, 56.337]
  - - [1408, 256, 1, 128]
    - [45, 12.498]
  - - [2944, 5888, 1, 3328]
    - [4, 74.218]
  - - [6784, 5888, 1, 1280]
    - [4, 76.162]
  - - [2048, 800, 1, 512]
    - [20, 51.402]
  - - [704, 128, 1, 256]
    - [38, 6.358]
  - - [5888, 4288, 1, 1280]
    - [4, 74.035]
  - - [1024, 24000, 1, 2048]
    - [8, 75.251]
  - - [448, 256, 1, 1280]
    - [17, 18.28]
  - - [5888, 3584, 1, 128]
    - [7, 62.447]
  - - [1024, 2944, 1, 128]
    - [10, 39.642]
  - - [5056, 4, 1, 1280]
    - [14, 4.905]
  - - [256, 1408, 1, 1280]
    - [18, 33.271]
  - - [3072, 16, 1, 1024]
    - [14, 10.533]
  - - [704, 3584, 1, 128]
    - [10, 38.126]
  - - [5888, 448, 1, 3328]
    - [4, 68.664]
  - - [2368, 4288, 1, 1280]
    - [7, 70.796]
  - - [4288, 2944, 1, 128]
    - [7, 52.228]
  - - [1024, 6784, 1, 3328]
    - [4, 72.154]
  - - [128, 2368, 1, 256]
    - [32, 17.036]
  - - [6784, 64, 1, 3328]
    - [17, 47.256]
  - - [5056, 2944, 1, 3328]
    - [4, 74.353]
  - - [448, 128, 1, 256]
    - [14, 4.319]
  - - [2944, 3584, 1, 256]
    - [7, 80.645]
  - - [1408, 1408, 1, 3328]
    - [4, 52.862]
  - - [1856, 128, 1, 1280]
    - [16, 29.403]
  - - [3584, 3584, 1, 128]
    - [7, 59.544]
  - - [64, 3584, 1, 256]
    - [19, 13.043]
  - - [1408, 4, 1, 3328]
    - [22, 3.697]
  - - [128, 2944, 1, 3328]
    - [18, 42.193]
  - - [3584, 704, 1, 256]
    - [8, 63.801]
  - - [2944, 448, 1, 3328]
    - [20, 61.128]
  - - [3584, 1408, 1, 3328]
    - [4, 68.339]
  - - [704, 3584, 1, 1280]
    - [7, 58.891]
  - - [2944, 6784, 1, 1280]
    - [4, 73.43]
  - - [1856, 6784, 1, 256]
    - [7, 79.083]
  - - [4288, 448, 1, 3328]
    - [3, 65.77]
  - - [6784, 4288, 1, 128]
    - [8, 79.506]
  - - [6784, 704, 1, 1280]
    - [4, 62.675]
  - - [256, 4288, 1, 256]
    - [10, 40.315]
  - - [3584, 6784, 1, 256]
    - [7, 68.305]
  - - [6144, 12000, 1, 2048]
    - [4, 77.038]
  - - [6144, 16, 1, 2560]
    - [44, 23.242]
  - - [3584, 64, 1, 128]
    - [0, 8.601]
  - - [5888, 1024, 1, 3328]
    - [4, 71.456]
  - - [448, 64, 1, 128]
    - [38, 1.275]
  - - [704, 6784, 1, 1280]
    - [7, 61.562]
  - - [4, 1024, 1, 1280]
    - [15, 1.273]
  - - [5888, 128, 1, 256]
    - [10, 34.774]
  - - [4096, 16, 1, 4096]
    - [21, 20.313]
  - - [1856, 5056, 1, 3328]
    - [4, 71.614]
  - - [4, 6784, 1, 256]
    - [50, 1.698]
  - - [1024, 3584, 1, 128]
    - [7, 42.899]
  - - [1024, 1408, 1, 128]
    - [10, 34.21]
  - - [2368, 2944, 1, 128]
    - [13, 52.231]
  - - [5056, 64, 1, 256]
    - [45, 17.646]
  - - [4, 448, 1, 1280]
    - [1, 0.593]
  - - [5056, 2944, 1, 128]
    - [7, 51.149]
  - - [5888, 5056, 1, 3328]
    - [4, 75.993]
  - - [1024, 704, 1, 128]
    - [10, 21.523]
  - - [5888, 2368, 1, 128]
    - [8, 49.954]
  - - [128, 5056, 1, 3328]
    - [12, 47.293]
  - - [3584, 6784, 1, 1280]
    - [4, 75.053]
  - - [448, 4, 1, 1280]
    - [22, 0.655]
  - - [1856, 5888, 1, 256]
    - [8, 57.526]
  - - [256, 256, 1, 256]
    - [14, 5.129]
  - - [256, 64, 1, 128]
    - [36, 0.753]
  - - [4288, 4288, 1, 3328]
    - [4, 75.138]
  - - [4288, 1408, 1, 1280]
    - [7, 69.721]
  - - [3584, 5056, 1, 128]
    - [4, 60.667]
  - - [4, 1024, 1, 3328]
    - [15, 2.803]
  - - [4288, 2368, 1, 256]
    - [8, 62.726]
  - - [2944, 5056, 1, 1280]
    - [8, 72.587]
  - - [448, 6784, 1, 256]
    - [10, 48.193]
  - - [64, 128, 1, 128]
    - [36, 0.387]
  - - [1856, 2368, 1, 128]
    - [10, 44.577]
  - - [6784, 2368, 1, 3328]
    - [4, 75.658]
  - - [256, 1024, 1, 1280]
    - [16, 30.186]
  - - [704, 4, 1, 128]
    - [14, 0.126]
  - - [256, 4, 1, 256]
    - [14, 0.085]
  - - [4288, 128, 1, 256]
    - [32, 26.553]
  - - [4288, 1856, 1, 3328]
    - [4, 71.663]
  - - [3584, 448, 1, 128]
    - [20, 36.976]
  - - [2048, 1600, 1, 2048]
    - [7, 65.13]
  - - [256, 4, 1, 3328]
    - [2, 0.882]
  - - [4, 1408, 1, 1280]
    - [25, 1.74]
  - - [3584, 64, 1, 1280]
    - [26, 27.311]
  - - [1408, 448, 1, 128]
    - [10, 19.373]
  - - [3584, 1024, 1, 1280]
    - [4, 56.486]
  - - [1856, 5056, 1, 256]
    - [13, 59.016]
  - - [4, 3584, 1, 256]
    - [19, 1.027]
  - - [4, 2944, 1, 1280]
    - [25, 3.074]
  - - [1024, 4288, 1, 256]
    - [8, 65.121]
  - - [5888, 3584, 1, 3328]
    - [4, 75.781]
  - - [1856, 4, 1, 256]
    - [14, 0.626]
  - - [4, 256, 1, 256]
    - [14, 0.088]
  - - [5056, 3584, 1, 3328]
    - [4, 74.18]
  - - [704, 448, 1, 128]
    - [45, 10.683]
  - - [2368, 1408, 1, 1280]
    - [7, 61.983]
  - - [5056, 2944, 1, 1280]
    - [7, 91.821]
  - - [4, 4, 1, 128]
    - [2, 0.001]
  - - [3584, 256, 1, 256]
    - [30, 34.701]
  - - [1024, 6784, 1, 256]
    - [8, 73.912]
  - - [4, 128, 1, 256]
    - [14, 0.042]
  - - [64, 64, 1, 1280]
    - [2, 1.503]
  - - [5124, 9124, 1, 2048]
    - [4, 74.87]
  - - [6784, 4, 1, 128]
    - [14, 1.155]
  - - [2944, 1408, 1, 128]
    - [13, 44.826]
  - - [448, 128, 1, 3328]
    - [17, 21.291]
  - - [3584, 1408, 1, 1280]
    - [8, 65.235]
  - - [64, 4288, 1, 3328]
    - [24, 41.939]
  - - [5056, 6784, 1, 3328]
    - [4, 75.895]
  - - [128, 2944, 1, 256]
    - [32, 20.761]
  - - [128, 6784, 1, 128]
    - [42, 23.624]
  - - [3584, 4288, 1, 256]
    - [8, 61.137]
  - - [448, 1856, 1, 256]
    - [10, 37.223]
  - - [1856, 6784, 1, 3328]
    - [13, 74.977]
  - - [3584, 128, 1, 3328]
    - [34, 40.89]
  - - [64, 1856, 1, 256]
    - [19, 8.57]
  - - [64, 448, 1, 256]
    - [14, 2.28]
  - - [5888, 4288, 1, 256]
    - [4, 70.194]
  - - [4, 448, 1, 128]
    - [14, 0.079]
  - - [5056, 1408, 1, 256]
    - [7, 56.195]
  - - [35, 8457, 1, 2048]
    - [41, 33.162]
  - - [64, 256, 1, 1280]
    - [21, 4.91]
  - - [3584, 1024, 1, 256]
    - [7, 49.429]
  - - [256, 704, 1, 256]
    - [0, 11.999]
  - - [5888, 5888, 1, 256]
    - [13, 69.543]
  - - [4288, 1024, 1, 1280]
    - [7, 63.574]
  - - [5888, 128, 1, 3328]
    - [10, 44.803]
  - - [448, 6784, 1, 3328]
    - [7, 62.316]
  - - [2944, 1408, 1, 1280]
    - [7, 62.554]
  - - [64, 128, 1, 1280]
    - [23, 2.745]
  - - [2944, 1856, 1, 3328]
    - [8, 64.211]
  - - [2368, 64, 1, 128]
    - [19, 6.097]
  - - [256, 1024, 1, 128]
    - [0, 9.152]
  - - [3584, 5888, 1, 1280]
    - [4, 74.232]
  - - [64, 4, 1, 128]
    - [9, 0.012]
  - - [6784, 1856, 1, 1280]
    - [4, 72.533]
  - - [2944, 5056, 1, 256]
    - [8, 62.372]
  - - [4288, 4, 1, 128]
    - [14, 0.724]
  - - [5888, 256, 1, 3328]
    - [33, 56.206]
  - - [2944, 4288, 1, 128]
    - [8, 58.287]
  - - [3584, 1408, 1, 256]
    - [4, 58.673]
  - - [704, 3584, 1, 3328]
    - [13, 64.461]
  - - [4096, 3200, 1, 1024]
    - [7, 70.789]
  - - [5056, 448, 1, 1280]
    - [4, 53.64]
  - - [3584, 1856, 1, 3328]
    - [4, 69.017]
  - - [4288, 6784, 1, 1280]
    - [4, 74.143]
  - - [2560, 7000, 1, 2560]
    - [4, 75.95]
  - - [1408, 704, 1, 1280]
    - [10, 40.335]
  - - [2944, 1024, 1, 256]
    - [8, 48.858]
  - - [6784, 64, 1, 256]
    - [45, 22.354]
  - - [2368, 4288, 1, 3328]
    - [4, 71.121]
  - - [4, 1408, 1, 256]
    - [14, 0.449]
  - - [1024, 1408, 1, 1280]
    - [7, 47.161]
  - - [64, 64, 1, 256]
    - [1, 0.344]
  - - [704, 256, 1, 3328]
    - [34, 35.616]
  - - [6784, 5056, 1, 256]
    - [4, 71.337]
  - - [1856, 1856, 1, 128]
    - [42, 50.095]
  - - [3584, 5056, 1, 3328]
    - [4, 74.081]
  - - [448, 6784, 1, 128]
    - [7, 50.642]
  - - [4, 704, 1, 3328]
    - [15, 2.066]
  - - [35, 8457, 1, 4096]
    - [41, 33.19]
  - - [448, 2944, 1, 256]
    - [10, 42.808]
  - - [4, 4288, 1, 3328]
    - [15, 5.478]
  - - [2944, 6784, 1, 256]
    - [13, 66.019]
  - - [2944, 2944, 1, 128]
    - [7, 54.778]
  - - [4, 4, 1, 1280]
    - [15, 0.006]
  - - [1856, 3584, 1, 1280]
    - [7, 66.301]
  - - [64, 2944, 1, 256]
    - [19, 11.608]
  - - [448, 256, 1, 128]
    - [38, 4.539]
  - - [4288, 448, 1, 128]
    - [10, 40.029]
  - - [4608, 24000, 1, 1536]
    - [4, 77.739]
  - - [1856, 1408, 1, 3328]
    - [4, 68.38]
  - - [128, 128, 1, 128]
    - [36, 0.705]
  - - [1024, 4288, 1, 3328]
    - [4, 69.284]
  - - [448, 2368, 1, 256]
    - [3, 39.558]
  - - [1024, 4, 1, 128]
    - [14, 0.18]
  - - [64, 1408, 1, 1280]
    - [19, 17.909]
  - - [64, 6784, 1, 1280]
    - [3, 38.777]
  - - [5056, 448, 1, 256]
    - [4, 54.103]
  - - [2944, 2368, 1, 3328]
    - [4, 71.522]
  - - [704, 4288, 1, 3328]
    - [7, 60.439]
  - - [1408, 128, 1, 256]
    - [19, 12.061]
  - - [1024, 1856, 1, 1280]
    - [10, 46.958]
  - - [2048, 6400, 1, 2048]
    - [4, 73.196]
  - - [512, 48000, 1, 2816]
    - [8, 75.306]
  - - [5124, 9124, 1, 2560]
    - [4, 74.864]
  - - [128, 2368, 1, 3328]
    - [39, 36.303]
  - - [1024, 5888, 1, 256]
    - [8, 52.628]
  - - [64, 2944, 1, 1280]
    - [19, 30.367]
  - - [5056, 64, 1, 3328]
    - [17, 45.13]
  - - [128, 704, 1, 128]
    - [38, 3.821]
  - - [1408, 2368, 1, 256]
    - [8, 54.244]
  - - [1408, 1408, 1, 256]
    - [8, 43.858]
  - - [4, 64, 1, 128]
    - [36, 0.012]
  - - [64, 1024, 1, 128]
    - [36, 2.793]
  - - [1024, 8, 1, 500000]
    - [22, 11.314]
  - - [2368, 2368, 1, 128]
    - [10, 50.45]
  - - [64, 5888, 1, 128]
    - [32, 12.607]
  - - [5888, 4, 1, 3328]
    - [14, 7.283]
  - - [6784, 1408, 1, 128]
    - [7, 58.803]
  - - [4288, 5888, 1, 256]
    - [7, 67.735]
  - - [1408, 5056, 1, 256]
    - [8, 55.689]
  - - [5056, 128, 1, 3328]
    - [12, 47.146]
  - - [128, 128, 1, 1280]
    - [21, 4.972]
  - - [448, 704, 1, 256]
    - [32, 17.401]
  - - [4288, 3584, 1, 128]
    - [7, 54.485]
  - - [2944, 128, 1, 3328]
    - [12, 50.839]
  - - [64, 1408, 1, 3328]
    - [17, 29.233]
  - - [3584, 5056, 1, 1280]
    - [4, 72.596]
  - - [256, 448, 1, 1280]
    - [6, 19.835]
  - - [704, 704, 1, 128]
    - [45, 16.411]
  - - [5056, 4, 1, 128]
    - [14, 0.865]
  - - [704, 256, 1, 1280]
    - [19, 27.239]
  - - [64, 2368, 1, 3328]
    - [26, 33.364]
  - - [1856, 1024, 1, 128]
    - [3, 29.961]
  - - [1856, 64, 1, 128]
    - [19, 4.805]
  - - [4096, 64, 1, 4096]
    - [5, 46.85]
  - - [1024, 24000, 1, 1536]
    - [4, 74.555]
  - - [704, 4288, 1, 256]
    - [10, 48.267]
  - - [5888, 2368, 1, 1280]
    - [4, 71.743]
  - - [128, 256, 1, 256]
    - [14, 2.709]
  - - [64, 128, 1, 256]
    - [14, 0.685]
  - - [2368, 5888, 1, 1280]
    - [13, 71.915]
  - - [5888, 256, 1, 1280]
    - [20, 46.977]
  - - [1760, 128, 1, 1760]
    - [19, 33.872]
  - - [4, 5888, 1, 1280]
    - [25, 4.379]
  - - [704, 128, 1, 128]
    - [38, 3.687]
  - - [1024, 4, 1, 1280]
    - [22, 1.433]
  - - [2368, 1856, 1, 3328]
    - [4, 60.236]
  - - [2368, 128, 1, 128]
    - [32, 10.884]
  - - [2944, 704, 1, 256]
    - [10, 53.272]
  - - [5056, 128, 1, 128]
    - [30, 19.638]
  - - [2368, 1024, 1, 3328]
    - [13, 62.707]
  - - [256, 704, 1, 3328]
    - [34, 33.807]
  - - [704, 3584, 1, 256]
    - [13, 59.991]
  - - [1024, 1024, 1, 1024]
    - [10, 42.216]
  - - [704, 2944, 1, 3328]
    - [13, 56.185]
  - - [6784, 1024, 1, 128]
    - [7, 52.238]
  - - [256, 448, 1, 128]
    - [19, 4.599]
  - - [448, 1024, 1, 3328]
    - [34, 40.721]
  - - [2944, 1024, 1, 3328]
    - [27, 61.322]
  - - [2944, 5056, 1, 128]
    - [4, 74.831]
  - - [2368, 256, 1, 256]
    - [32, 29.201]
  - - [1408, 6784, 1, 256]
    - [13, 58.419]
  - - [6784, 1408, 1, 3328]
    - [4, 72.714]
  - - [4288, 6784, 1, 128]
    - [7, 65.873]
  - - [704, 64, 1, 256]
    - [36, 3.492]
  - - [5888, 4, 1, 1280]
    - [14, 5.609]
  - - [256, 2368, 1, 3328]
    - [12, 44.44]
  - - [6784, 2944, 1, 1280]
    - [4, 72.659]
  - - [4288, 1856, 1, 128]
    - [8, 52.546]
  - - [1856, 2944, 1, 128]
    - [13, 46.721]
  - - [6784, 448, 1, 128]
    - [3, 44.9]
  - - [64, 3584, 1, 128]
    - [0, 8.242]
  - - [448, 5056, 1, 1280]
    - [13, 53.308]
  - - [2368, 1856, 1, 128]
    - [3, 54.761]
  - - [64, 2944, 1, 3328]
    - [35, 39.498]
  - - [4288, 704, 1, 256]
    - [8, 49.899]
  - - [256, 3584, 1, 128]
    - [42, 25.652]
  - - [5888, 704, 1, 256]
    - [4, 57.168]
  - - [3584, 1024, 1, 128]
    - [42, 44.119]
  - - [256, 5888, 1, 3328]
    - [33, 52.707]
  - - [1408, 4288, 1, 3328]
    - [8, 71.082]
  - - [6784, 4288, 1, 256]
    - [4, 67.996]
  - - [4288, 256, 1, 128]
    - [10, 30.45]
  - - [5888, 256, 1, 256]
    - [8, 43.17]
  - - [6784, 1024, 1, 1280]
    - [7, 68.828]
  - - [5888, 1024, 1, 128]
    - [7, 51.055]
  - - [1024, 128, 1, 256]
    - [19, 9.425]
  - - [512, 16, 1, 500000]
    - [47, 15.51]
  - - [128, 64, 1, 3328]
    - [1, 5.992]
  - - [448, 64, 1, 256]
    - [14, 2.329]
  - - [2368, 256, 1, 128]
    - [42, 18.674]
  - - [6784, 3584, 1, 1280]
    - [4, 75.635]
  - - [1024, 6784, 1, 1280]
    - [8, 68.961]
  - - [2944, 64, 1, 1280]
    - [19, 30.485]
  - - [1408, 2944, 1, 1280]
    - [8, 62.582]
  - - [256, 1856, 1, 256]
    - [32, 22.916]
  - - [2048, 800, 1, 2048]
    - [18, 56.864]
  - - [1408, 2368, 1, 3328]
    - [4, 66.135]
  - - [2944, 4, 1, 3328]
    - [22, 5.566]
  - - [128, 1408, 1, 3328]
    - [17, 38.726]
  - - [2944, 1856, 1, 128]
    - [4, 47.583]
  - - [256, 2944, 1, 128]
    - [10, 22.015]
  - - [256, 6784, 1, 128]
    - [30, 36.437]
  - - [2368, 4, 1, 128]
    - [14, 0.405]
  - - [1408, 256, 1, 3328]
    - [12, 49.033]
  - - [1856, 4, 1, 128]
    - [14, 0.323]
  - - [5056, 6784, 1, 128]
    - [13, 61.012]
  - - [4288, 5056, 1, 128]
    - [13, 58.389]
  - - [1856, 5888, 1, 128]
    - [13, 50.813]
  - - [2944, 5888, 1, 256]
    - [7, 85.386]
  - - [3584, 1856, 1, 256]
    - [4, 61.029]
  - - [4288, 3584, 1, 1280]
    - [4, 72.564]
  - - [2368, 448, 1, 256]
    - [10, 38.047]
  - - [4288, 256, 1, 3328]
    - [3, 60.998]
  - - [1856, 704, 1, 128]
    - [3, 31.139]
  - - [1408, 64, 1, 256]
    - [38, 6.381]
  - - [64, 1856, 1, 128]
    - [19, 4.784]
  - - [4, 256, 1, 128]
    - [14, 0.046]
  - - [2560, 16, 1, 2560]
    - [21, 14.842]
  - - [704, 5888, 1, 128]
    - [13, 47.574]
  - - [6784, 3584, 1, 128]
    - [7, 64.035]
  - - [1024, 64, 1, 256]
    - [36, 4.971]
  - - [64, 2368, 1, 256]
    - [0, 10.382]
  - - [4288, 5056, 1, 3328]
    - [4, 74.376]
  - - [4, 1856, 1, 1280]
    - [25, 2.17]
  - - [4288, 128, 1, 128]
    - [45, 17.141]
  - - [1408, 1408, 1, 128]
    - [7, 41.221]
  - - [7680, 16, 1, 2560]
    - [48, 24.592]
  - - [1856, 128, 1, 128]
    - [0, 8.307]
  - - [5056, 2368, 1, 256]
    - [8, 60.609]
  - - [4288, 704, 1, 3328]
    - [4, 60.22]
  - - [448, 3584, 1, 256]
    - [7, 50.118]
  - - [2368, 64, 1, 1280]
    - [26, 25.192]
  - - [2368, 1024, 1, 1280]
    - [7, 57.398]
  - - [2944, 1408, 1, 3328]
    - [8, 65.779]
  - - [1408, 448, 1, 256]
    - [32, 29.562]
  - - [1024, 1408, 1, 3328]
    - [20, 53.961]
  - - [2944, 5888, 1, 1280]
    - [8, 73.28]
  - - [1408, 4, 1, 1280]
    - [22, 1.796]
  - - [5888, 3584, 1, 256]
    - [13, 67.313]
  - - [2368, 5056, 1, 128]
    - [13, 56.257]
  - - [1408, 1856, 1, 3328]
    - [8, 68.885]
  - - [4, 4, 1, 3328]
    - [2, 0.014]
  - - [6784, 1408, 1, 1280]
    - [4, 72.37]
  - - [4096, 7000, 1, 4096]
    - [4, 77.024]
  - - [704, 2944, 1, 256]
    - [10, 51.218]
  - - [4288, 64, 1, 256]
    - [0, 15.416]
  - - [6784, 5888, 1, 3328]
    - [4, 76.765]
  - - [2368, 4288, 1, 128]
    - [8, 47.726]
  - - [64, 4288, 1, 1280]
    - [26, 31.436]
  - - [6784, 64, 1, 1280]
    - [16, 37.898]
  - - [3584, 128, 1, 128]
    - [10, 14.939]
  - - [1024, 6784, 1, 128]
    - [4, 63.261]
  - - [4, 1856, 1, 128]
    - [14, 0.306]
  - - [1408, 64, 1, 3328]
    - [17, 30.212]
  - - [6784, 4, 1, 256]
    - [14, 2.112]
  - - [1408, 1408, 1, 1280]
    - [4, 52.584]
  - - [16384, 400, 1, 4096]
    - [4, 61.752]
  - - [256, 2368, 1, 256]
    - [10, 29.071]
  - - [448, 4288, 1, 3328]
    - [3, 51.601]
  - - [2368, 1408, 1, 256]
    - [7, 52.454]
  - - [5888, 5056, 1, 128]
    - [8, 62.574]
  - - [704, 2368, 1, 256]
    - [10, 49.326]
  - - [1024, 24000, 1, 2560]
    - [4, 75.535]
  - - [2944, 448, 1, 1280]
    - [20, 57.113]
  - - [5888, 2368, 1, 3328]
    - [4, 73.913]
  - - [5124, 9124, 1, 1760]
    - [4, 74.802]
  - - [448, 1408, 1, 1280]
    - [32, 47.599]
  - - [448, 1856, 1, 1280]
    - [3, 60.023]
  - - [4288, 448, 1, 1280]
    - [3, 49.318]
  - - [5888, 704, 1, 3328]
    - [4, 67.0]
  - - [5056, 256, 1, 128]
    - [30, 30.045]
  - - [1856, 256, 1, 128]
    - [45, 15.685]
  - - [64, 1408, 1, 128]
    - [38, 3.533]
  - - [704, 4, 1, 256]
    - [14, 0.239]
  - - [1408, 5888, 1, 128]
    - [13, 56.335]
  - - [7680, 12000, 1, 2560]
    - [4, 77.675]
  - - [1408, 1024, 1, 256]
    - [7, 45.954]
  - - [8192, 400, 1, 2048]
    - [4, 52.288]
  - - [1024, 1856, 1, 128]
    - [10, 39.484]
  - - [256, 704, 1, 128]
    - [19, 6.815]
  - - [2560, 128, 1, 2560]
    - [24, 39.89]
  - - [448, 1024, 1, 256]
    - [32, 22.552]
  - - [128, 4, 1, 3328]
    - [2, 0.409]
  - - [5056, 6784, 1, 1280]
    - [13, 74.732]
  - - [1408, 64, 1, 128]
    - [38, 3.776]
  - - [1024, 448, 1, 1280]
    - [16, 34.467]
  - - [704, 5056, 1, 3328]
    - [7, 68.649]
  - - [128, 5056, 1, 256]
    - [42, 29.622]
  - - [64, 1024, 1, 3328]
    - [17, 22.718]
  - - [1856, 4, 1, 3328]
    - [22, 4.22]
  - - [4, 2944, 1, 128]
    - [31, 0.498]
  - - [2368, 2944, 1, 3328]
    - [8, 71.598]
  - - [448, 448, 1, 1280]
    - [19, 32.04]
  - - [2368, 3584, 1, 256]
    - [13, 62.426]
  - - [1024, 256, 1, 1280]
    - [26, 32.311]
  - - [5056, 3584, 1, 1280]
    - [13, 72.582]
  - - [5124, 9124, 1, 4096]
    - [4, 75.291]
  - - [7680, 48000, 1, 2560]
    - [4, 78.431]
  - - [448, 4, 1, 3328]
    - [23, 1.49]
  - - [1856, 2944, 1, 1280]
    - [8, 62.094]
  - - [1024, 48000, 1, 2816]
    - [8, 77.498]
  - - [128, 1024, 1, 256]
    - [19, 9.268]
  - - [2944, 1408, 1, 256]
    - [8, 69.378]
  - - [4288, 1408, 1, 3328]
    - [13, 69.561]
  - - [3584, 64, 1, 3328]
    - [5, 40.113]
  - - [5888, 2944, 1, 128]
    - [7, 53.458]
  - - [2944, 1024, 1, 128]
    - [13, 49.929]
  - - [4288, 5056, 1, 1280]
    - [4, 73.973]
  - - [5888, 6784, 1, 1280]
    - [4, 76.149]
  - - [6784, 5056, 1, 128]
    - [8, 61.517]
  - - [256, 1024, 1, 3328]
    - [16, 44.323]
  - - [3584, 4, 1, 256]
    - [14, 1.12]
  - - [1760, 1600, 1, 1760]
    - [8, 55.038]
  - - [1856, 64, 1, 3328]
    - [34, 30.469]
  - - [4, 128, 1, 3328]
    - [2, 0.469]
  - - [5888, 1408, 1, 3328]
    - [4, 69.819]
  - - [448, 2944, 1, 128]
    - [43, 32.183]
  - - [2368, 1856, 1, 256]
    - [3, 52.098]
  - - [256, 5056, 1, 256]
    - [4, 40.784]
  - - [128, 3584, 1, 128]
    - [42, 14.447]
  - - [448, 3584, 1, 3328]
    - [33, 57.169]
  - - [4, 5056, 1, 3328]
    - [15, 5.543]
  - - [704, 2368, 1, 128]
    - [42, 38.085]
  - - [5888, 256, 1, 128]
    - [13, 36.17]
  - - [4, 5056, 1, 128]
    - [19, 0.814]
  - - [448, 256, 1, 256]
    - [38, 8.364]
  - - [704, 4, 1, 3328]
    - [23, 2.168]
  - - [1408, 256, 1, 256]
    - [3, 20.726]
  - - [3584, 1856, 1, 128]
    - [8, 50.357]
  - - [4288, 4288, 1, 128]
    - [8, 55.022]
  - - [1856, 1024, 1, 3328]
    - [3, 65.202]
  - - [128, 5888, 1, 3328]
    - [3, 48.336]
  - - [1024, 5056, 1, 256]
    - [8, 58.677]
  - - [5888, 5888, 1, 1280]
    - [4, 75.4]
  - - [5056, 5888, 1, 128]
    - [7, 59.633]
  - - [2368, 1408, 1, 3328]
    - [4, 65.061]
  - - [1024, 48000, 1, 1536]
    - [4, 77.179]
  - - [5888, 448, 1, 256]
    - [8, 56.178]
  - - [2560, 3200, 1, 2560]
    - [4, 69.779]
  - - [5888, 6784, 1, 128]
    - [8, 62.748]
  - - [6144, 48000, 1, 2048]
    - [4, 78.322]
  - - [6784, 5056, 1, 1280]
    - [4, 74.875]
  - - [5056, 704, 1, 1280]
    - [8, 65.016]
  - - [1024, 48000, 1, 2560]
    - [8, 95.861]
  - - [4608, 32, 1, 1536]
    - [26, 27.495]
  - - [1024, 2368, 1, 128]
    - [4, 46.554]
  - - [128, 704, 1, 256]
    - [38, 6.908]
  - - [2368, 448, 1, 3328]
    - [18, 49.711]
  - - [128, 5888, 1, 1280]
    - [30, 54.126]
  - - [16384, 800, 1, 4096]
    - [4, 70.101]
  - - [448, 128, 1, 1280]
    - [41, 13.099]
  - - [6784, 4, 1, 3328]
    - [14, 7.688]
  - - [5888, 5056, 1, 1280]
    - [4, 74.806]
  - - [1024, 64, 1, 3328]
    - [34, 24.99]
  - - [3072, 48000, 1, 1024]
    - [4, 77.576]
  - - [64, 3584, 1, 1280]
    - [26, 27.798]
  - - [6784, 1408, 1, 256]
    - [13, 60.105]
  - - [3584, 5888, 1, 128]
    - [7, 59.51]
  - - [5056, 5888, 1, 256]
    - [7, 68.916]
  - - [2368, 1024, 1, 256]
    - [13, 59.014]
  - - [2944, 1856, 1, 256]
    - [8, 49.9]
  - - [1856, 6784, 1, 1280]
    - [7, 73.226]
  - - [64, 5056, 1, 128]
    - [0, 10.423]
  - - [64, 6784, 1, 128]
    - [42, 14.022]
  - - [448, 704, 1, 128]
    - [32, 10.942]
  - - [4, 1024, 1, 128]
    - [14, 0.184]
  - - [4288, 3584, 1, 256]
    - [7, 62.259]
  - - [1408, 704, 1, 128]
    - [42, 28.211]
  - - [64, 256, 1, 3328]
    - [21, 10.34]
  - - [6784, 448, 1, 3328]
    - [4, 61.135]
  - - [5056, 1856, 1, 1280]
    - [4, 68.33]
  - - [1408, 1024, 1, 3328]
    - [20, 51.943]
  - - [2368, 256, 1, 3328]
    - [18, 44.06]
  - - [5888, 3584, 1, 1280]
    - [4, 73.634]
  - - [1856, 3584, 1, 3328]
    - [8, 69.097]
  - - [5888, 128, 1, 1280]
    - [10, 54.805]
  - - [1024, 2944, 1, 256]
    - [4, 50.28]
  - - [448, 6784, 1, 1280]
    - [7, 76.275]
  - - [256, 3584, 1, 1280]
    - [16, 37.958]
  - - [704, 5056, 1, 256]
    - [10, 59.082]
  - - [3584, 1024, 1, 3328]
    - [4, 59.27]
  - - [2944, 1856, 1, 1280]
    - [4, 62.432]
  - - [128, 256, 1, 128]
    - [14, 1.462]
  - - [5056, 256, 1, 256]
    - [13, 41.224]
  - - [2944, 4288, 1, 3328]
    - [4, 71.685]
  - - [2368, 3584, 1, 3328]
    - [4, 70.64]
  - - [2944, 704, 1, 1280]
    - [4, 50.152]
  - - [128, 4, 1, 256]
    - [9, 0.043]
  - - [2944, 3584, 1, 1280]
    - [4, 70.885]
  - - [1856, 5888, 1, 1280]
    - [4, 69.029]
  - - [256, 256, 1, 1280]
    - [6, 14.855]
  - - [2048, 3200, 1, 2048]
    - [13, 67.035]
  - - [4288, 1408, 1, 256]
    - [13, 51.788]
  - - [3584, 64, 1, 256]
    - [45, 12.706]
  - - [64, 1856, 1, 3328]
    - [17, 30.299]
  - - [256, 1408, 1, 128]
    - [45, 12.184]
  - - [5888, 1408, 1, 128]
    - [8, 53.066]
  - - [4288, 2368, 1, 1280]
    - [4, 69.725]
  - - [4, 4288, 1, 256]
    - [36, 1.24]
  - - [256, 4288, 1, 128]
    - [3, 29.847]
  - - [2048, 128, 1, 2048]
    - [26, 39.141]
  - - [256, 128, 1, 3328]
    - [40, 15.363]
  - - [512, 8, 1, 500000]
    - [22, 9.148]
  - - [6784, 2368, 1, 256]
    - [8, 63.075]
  - - [5888, 128, 1, 128]
    - [42, 22.567]
  - - [1024, 24000, 1, 2816]
    - [8, 75.535]
  - - [7680, 5984, 1, 2560]
    - [4, 76.558]
  - - [4288, 1856, 1, 256]
    - [8, 57.744]
  - - [1856, 256, 1, 3328]
    - [34, 41.156]
  - - [1856, 2944, 1, 256]
    - [7, 49.38]
  - - [5056, 1024, 1, 128]
    - [13, 47.914]
  - - [64, 5888, 1, 1280]
    - [10, 36.186]
  - - [1760, 800, 1, 1760]
    - [33, 46.718]
  - - [6784, 256, 1, 128]
    - [8, 37.256]
  - - [5888, 704, 1, 128]
    - [42, 43.648]
  - - [1408, 2368, 1, 128]
    - [8, 52.626]
  - - [1024, 4288, 1, 1280]
    - [8, 65.529]
  - - [2368, 5056, 1, 3328]
    - [4, 72.426]
  - - [448, 4, 1, 128]
    - [14, 0.083]
  - - [4, 256, 1, 3328]
    - [2, 0.94]
  - - [4288, 1024, 1, 3328]
    - [7, 68.683]
  - - [6144, 48000, 1, 2560]
    - [13, 78.142]
  - - [1024, 5056, 1, 3328]
    - [4, 69.932]
  - - [1024, 1856, 1, 3328]
    - [3, 51.002]
  - - [704, 704, 1, 1280]
    - [24, 34.043]
  - - [128, 2368, 1, 1280]
    - [0, 32.847]
  - - [1408, 128, 1, 3328]
    - [34, 39.452]
  - - [3584, 256, 1, 1280]
    - [26, 38.876]
  - - [4, 128, 1, 128]
    - [14, 0.023]
  - - [5888, 64, 1, 1280]
    - [12, 37.872]
  - - [3584, 128, 1, 1280]
    - [16, 34.802]
  - - [4, 256, 1, 1280]
    - [1, 0.364]
  - - [128, 704, 1, 3328]
    - [34, 26.672]
  - - [4288, 6784, 1, 256]
    - [13, 68.252]
  - - [3584, 2944, 1, 3328]
    - [4, 74.61]
  - - [128, 1856, 1, 256]
    - [0, 14.179]
  - - [64, 4288, 1, 256]
    - [32, 15.079]
  - - [4, 3584, 1, 3328]
    - [15, 5.133]
  - - [64, 4, 1, 3328]
    - [2, 0.24]
  - - [4, 64, 1, 3328]
    - [22, 0.229]
  - - [5888, 2944, 1, 256]
    - [4, 63.555]
  - - [1856, 64, 1, 256]
    - [19, 8.642]
  - - [5056, 128, 1, 1280]
    - [3, 47.236]
  - - [448, 4288, 1, 1280]
    - [3, 47.06]
  - - [448, 1856, 1, 3328]
    - [3, 52.464]
  - - [1024, 4288, 1, 128]
    - [10, 54.452]
  - - [4, 1024, 1, 256]
    - [14, 0.326]
  - - [5056, 4288, 1, 256]
    - [7, 64.723]
  - - [1024, 448, 1, 256]
    - [32, 23.329]
  - - [1024, 3584, 1, 256]
    - [4, 48.526]
  - - [2944, 128, 1, 1280]
    - [32, 37.346]
  - - [2048, 32, 1, 2048]
    - [6, 19.488]
  - - [64, 256, 1, 256]
    - [14, 1.376]
  - - [1408, 4, 1, 128]
    - [14, 0.253]
  - - [128, 2368, 1, 128]
    - [0, 10.689]
  - - [256, 704, 1, 1280]
    - [19, 29.409]
  - - [64, 2368, 1, 128]
    - [0, 5.855]
  - - [6784, 6784, 1, 3328]
    - [4, 76.653]
  - - [448, 5888, 1, 1280]
    - [7, 62.853]
  - - [5056, 448, 1, 128]
    - [3, 42.866]
  - - [4288, 704, 1, 1280]
    - [4, 56.721]
  - - [3584, 2944, 1, 128]
    - [7, 50.251]
  - - [6784, 256, 1, 1280]
    - [20, 54.494]
  - - [256, 2944, 1, 1280]
    - [10, 54.298]
  - - [64, 4288, 1, 128]
    - [0, 9.067]
  - - [2368, 5888, 1, 3328]
    - [8, 73.962]
  - - [4, 64, 1, 256]
    - [14, 0.022]
  - - [704, 1024, 1, 3328]
    - [12, 43.481]
  - - [2368, 1856, 1, 1280]
    - [8, 76.111]
  - - [448, 5056, 1, 3328]
    - [7, 57.801]
  - - [128, 448, 1, 128]
    - [36, 2.445]
  - - [128, 6784, 1, 256]
    - [10, 33.212]
  - - [3584, 4288, 1, 128]
    - [8, 47.96]
  - - [64, 448, 1, 128]
    - [14, 1.218]
  - - [5888, 4288, 1, 3328]
    - [4, 75.199]
  - - [2368, 704, 1, 256]
    - [10, 48.135]
  - - [256, 1856, 1, 3328]
    - [17, 40.834]
  - - [1856, 128, 1, 256]
    - [0, 14.067]
  - - [6784, 128, 1, 128]
    - [42, 24.181]
  - - [3584, 1408, 1, 128]
    - [7, 47.343]
  - - [1856, 5056, 1, 1280]
    - [4, 70.451]
  - - [2944, 1024, 1, 1280]
    - [4, 55.664]
  - - [5056, 4, 1, 256]
    - [14, 1.641]
  - - [3584, 5888, 1, 3328]
    - [4, 75.614]
  - - [2368, 4288, 1, 256]
    - [4, 62.848]
  - - [1024, 2368, 1, 3328]
    - [4, 62.927]
  - - [64, 704, 1, 3328]
    - [6, 20.067]
  - - [704, 1408, 1, 256]
    - [10, 37.668]
  - - [4096, 128, 1, 4096]
    - [28, 44.074]
  - - [1024, 3584, 1, 1280]
    - [4, 56.487]
  - - [4288, 5888, 1, 3328]
    - [4, 74.904]
  - - [4288, 4, 1, 1280]
    - [14, 4.155]
  - - [4608, 16, 1, 1536]
    - [21, 15.648]
  - - [5888, 64, 1, 128]
    - [45, 12.459]
  - - [4, 5888, 1, 128]
    - [31, 0.92]
  - - [1024, 2944, 1, 3328]
    - [4, 60.505]
  - - [6784, 1856, 1, 256]
    - [4, 61.892]
  - - [2048, 64, 1, 2048]
    - [6, 28.07]
  - - [256, 6784, 1, 1280]
    - [33, 54.34]
  - - [1856, 3584, 1, 256]
    - [7, 51.694]
  - - [128, 448, 1, 3328]
    - [6, 21.002]
  - - [6784, 1856, 1, 128]
    - [4, 48.709]
  - - [4, 448, 1, 256]
    - [36, 0.145]
  - - [5056, 128, 1, 256]
    - [42, 30.688]
  - - [512, 24000, 1, 2816]
    - [4, 74.108]
  - - [256, 5888, 1, 1280]
    - [33, 48.102]
  - - [4, 128, 1, 1280]
    - [23, 0.191]
  - - [16384, 1600, 1, 4096]
    - [4, 75.136]
  - - [6784, 128, 1, 1280]
    - [3, 52.418]
  - - [64, 1408, 1, 256]
    - [38, 6.538]
  - - [2368, 1408, 1, 128]
    - [7, 48.014]
  - - [1856, 448, 1, 256]
    - [3, 37.348]
  - - [1408, 1024, 1, 128]
    - [20, 34.255]
  - - [128, 64, 1, 128]
    - [36, 0.364]
  - - [6784, 3584, 1, 3328]
    - [4, 77.139]
  - - [1760, 7000, 1, 1760]
    - [4, 72.803]
  - - [2944, 64, 1, 3328]
    - [28, 40.659]
  - - [64, 64, 1, 128]
    - [14, 0.192]
  - - [2368, 5056, 1, 1280]
    - [7, 70.064]
  - - [64, 4, 1, 1280]
    - [2, 0.101]
  - - [1408, 2368, 1, 1280]
    - [37, 62.682]
  - - [128, 1408, 1, 1280]
    - [19, 29.037]
  - - [256, 64, 1, 3328]
    - [21, 10.444]
  - - [704, 4288, 1, 128]
    - [3, 43.367]
  - - [128, 1856, 1, 3328]
    - [26, 41.072]
  - - [2944, 2944, 1, 256]
    - [8, 57.492]
  - - [2944, 4, 1, 1280]
    - [25, 3.098]
  - - [5888, 4, 1, 256]
    - [14, 1.8]
  - - [6784, 256, 1, 256]
    - [10, 45.961]
  - - [256, 5056, 1, 3328]
    - [20, 59.874]
  - - [128, 4288, 1, 1280]
    - [45, 42.626]
  - - [5056, 1856, 1, 128]
    - [8, 54.848]
  - - [5056, 1024, 1, 3328]
    - [13, 70.623]
  - - [128, 128, 1, 256]
    - [14, 1.314]
  - - [1760, 64, 1, 1760]
    - [19, 24.561]
  - - [4288, 3584, 1, 3328]
    - [4, 73.079]
  - - [448, 704, 1, 3328]
    - [35, 38.958]
  - - [448, 448, 1, 128]
    - [0, 7.669]
  - - [1024, 2368, 1, 1280]
    - [4, 57.825]
  - - [1856, 704, 1, 3328]
    - [10, 54.858]
  - - [4, 2368, 1, 128]
    - [36, 0.4]
  - - [5888, 6784, 1, 3328]
    - [4, 76.735]
  - - [704, 4288, 1, 1280]
    - [13, 75.76]
  - - [704, 256, 1, 256]
    - [19, 11.716]
  - - [1024, 48000, 1, 2048]
    - [4, 77.028]
  - - [4288, 1024, 1, 128]
    - [7, 45.187]
  - - [3136, 2048, 1, 128]
    - [7, 49.008]
  - - [3025, 64, 1, 144]
    - [0, 8.256]
  - - [3025, 256, 1, 64]
    - [30, 13.303]
  - - [196, 256, 1, 2304]
    - [11, 16.201]
  - - [784, 128, 1, 512]
    - [19, 12.552]
  - - [49, 512, 1, 4608]
    - [40, 14.009]
  - - [3025, 64, 1, 256]
    - [19, 12.7]
  - - [50176, 63, 1, 784]
    - [8, 52.457]
  - - [784, 512, 1, 128]
    - [32, 13.26]
  - - [3025, 64, 1, 64]
    - [19, 3.832]
  - - [49, 512, 1, 1024]
    - [14, 5.615]
  - - [196, 256, 1, 576]
    - [14, 6.747]
  - - [784, 512, 1, 32]
    - [32, 4.047]
  - - [784, 128, 1, 128]
    - [19, 4.037]
  - - [50176, 63, 1, 196]
    - [4, 40.485]
- null
