library/src/blas3/Tensile/Logic/asm_full/aldebaran_104cu/aldebaran_Cijk_Alik_Bljk_I8II_BH.yaml
- {MinimumRequiredVersion: 4.32.1}
- aldebaran
- {Architecture: gfx90a, CUCount: 104}
- [Device 7400, Device 7408, Device 740c]
    SolutionIndex: 0
    SolutionNameMin: Cijk_Alik_Bljk_I8II_BH_MT64x64x64_MI32x32x8x1_SE_1LDSB0_AF0EM1_EPS1_GRVW4_LPA4_LPB4_LRVW4_OPLV0_PK0_PAP0_PGR1_PLR1_SU32_SUS256_SRVW0_TT1_32_WG64_4_1_WGM8
    SolutionIndex: 1
    SolutionNameMin: Cijk_Alik_Bljk_I8II_BH_MT32x32x128_MI16x16x16x1_SE_1LDSB1_AF0EM8_EPS0_GRVW16_LPA32_LPB32_LRVW16_OPLV0_PK0_PAP0_PGR2_PLR9_SU0_SUS0_SRVW0_TT1_16_WG32_8_1_WGM1
    SolutionIndex: 2
    SolutionNameMin: Cijk_Alik_Bljk_I8II_BH_MT64x32x128_MI16x16x16x1_SE_1LDSB1_AF0EM8_EPS1_GRVW16_LPA32_LPB32_LRVW16_OPLV0_PK0_PAP0_PGR1_PLR9_SU0_SUS0_SRVW0_TT2_16_WG32_8_1_WGM1
    SolutionIndex: 3
    SolutionNameMin: Cijk_Alik_Bljk_I8II_BH_MT64x64x128_MI32x32x8x1_SE_1LDSB1_AF0EM8_EPS1_GRVW16_LPA16_LPB16_LRVW16_OPLV0_PK0_PAP0_PGR1_PLR17_SU32_SUS128_SRVW4_TT1_32_WG64_4_1_WGM1
    SolutionIndex: 4
    SolutionNameMin: Cijk_Alik_Bljk_I8II_BH_MT64x64x128_MI32x32x8x1_SE_1LDSB1_AF0EM8_EPS1_GRVW16_LPA16_LPB16_LRVW16_OPLV0_PK0_PAP0_PGR1_PLR17_SU32_SUS128_SRVW4_TT1_32_WG64_4_1_WGM15
    SolutionIndex: 5
    SolutionNameMin: Cijk_Alik_Bljk_I8II_BH_MT128x128x64_MI32x32x8x1_SE_1LDSB1_AF0EM8_EPS0_GRVW16_LPA16_LPB16_LRVW16_OPLV0_PK0_PAP0_PGR2_PLR9_SU32_SUS128_SRVW4_TT1_128_WG128_2_1_WGM15
    SolutionIndex: 6
    SolutionNameMin: Cijk_Alik_Bljk_I8II_BH_MT32x32x128_MI16x16x16x1_SE_1LDSB1_AF0EM8_EPS1_GRVW16_LPA32_LPB32_LRVW16_OPLV0_PK0_PAP0_PGR1_PLR9_SU0_SUS0_SRVW0_TT1_16_WG32_8_1_WGM1
    SolutionIndex: 7
    SolutionNameMin: Cijk_Alik_Bljk_I8II_BH_MT64x64x128_MI32x32x8x1_SE_1LDSB1_AF0EM8_EPS0_GRVW16_LPA16_LPB16_LRVW16_OPLV0_PK0_PAP0_PGR2_PLR17_SU0_SUS0_SRVW4_TT1_32_WG64_4_1_WGM1
    SolutionIndex: 8
    SolutionNameMin: Cijk_Alik_Bljk_I8II_BH_MT32x32x128_MI16x16x16x1_SE_1LDSB0_AF0EM8_EPS0_GRVW16_LPA32_LPB32_LRVW16_OPLV0_PK0_PAP0_PGR2_PLR9_SU0_SUS0_SRVW0_TT1_16_WG32_8_1_WGM2
    SolutionIndex: 9
    SolutionNameMin: Cijk_Alik_Bljk_I8II_BH_MT64x64x128_MI32x32x8x1_SE_1LDSB1_AF0EM8_EPS0_GRVW16_LPA16_LPB16_LRVW16_OPLV0_PK0_PAP0_PGR2_PLR17_SU32_SUS128_SRVW4_TT1_32_WG64_4_1_WGM2
    SolutionIndex: 10
    SolutionNameMin: Cijk_Alik_Bljk_I8II_BH_MT32x32x128_MI16x16x16x1_SE_1LDSB0_AF0EM8_EPS0_GRVW8_LPA32_LPB32_LRVW16_OPLV0_PK0_PAP0_PGR2_PLR9_SU0_SUS0_SRVW0_TT1_16_WG32_8_1_WGM2
    SolutionIndex: 11
    SolutionNameMin: Cijk_Alik_Bljk_I8II_BH_MT128x96x128_MI32x32x8x1_SE_1LDSB1_AF0EM8_EPS0_GRVW16_LPA16_LPB16_LRVW16_OPLV0_PK0_PAP0_PGR2_PLR17_SU0_SUS0_SRVW4_TT1_96_WG128_2_1_WGM15
    SolutionIndex: 12
    SolutionNameMin: Cijk_Alik_Bljk_I8II_BH_MT32x64x128_MI16x16x16x1_SE_1LDSB1_AF0EM8_EPS0_GRVW16_LPA32_LPB32_LRVW16_OPLV0_PK0_PAP0_PGR2_PLR9_SU0_SUS0_SRVW0_TT1_32_WG32_8_1_WGM15
    SolutionIndex: 13
    SolutionNameMin: Cijk_Alik_Bljk_I8II_BH_MT32x32x128_MI16x16x16x1_SE_1LDSB0_AF0EM8_EPS0_GRVW16_LPA32_LPB32_LRVW16_OPLV0_PK0_PAP0_PGR2_PLR9_SU0_SUS0_SRVW0_TT1_16_WG32_8_1_WGM15
    SolutionIndex: 14
    SolutionNameMin: Cijk_Alik_Bljk_I8II_BH_MT64x64x128_MI32x32x8x1_SE_1LDSB1_AF0EM8_EPS1_GRVW16_LPA16_LPB16_LRVW16_OPLV0_PK0_PAP0_PGR1_PLR17_SU0_SUS0_SRVW4_TT1_32_WG64_4_1_WGM15
    SolutionIndex: 15
    SolutionNameMin: Cijk_Alik_Bljk_I8II_BH_MT32x32x128_MI16x16x16x1_SE_1LDSB0_AF0EM8_EPS0_GRVW16_LPA32_LPB32_LRVW16_OPLV0_PK0_PAP0_PGR2_PLR9_SU0_SUS0_SRVW0_TT1_16_WG32_8_1_WGM1
    SolutionIndex: 16
    SolutionNameMin: Cijk_Alik_Bljk_I8II_BH_MT64x64x128_MI32x32x8x1_SE_1LDSB0_AF0EM8_EPS0_GRVW16_LPA16_LPB16_LRVW16_OPLV0_PK0_PAP0_PGR2_PLR17_SU0_SUS0_SRVW4_TT1_32_WG64_4_1_WGM1
    SolutionIndex: 17
    SolutionNameMin: Cijk_Alik_Bljk_I8II_BH_MT64x128x128_MI32x32x8x1_SE_1LDSB1_AF0EM8_EPS1_GRVW16_LPA16_LPB16_LRVW16_OPLV0_PK0_PAP0_PGR1_PLR17_SU32_SUS256_SRVW4_TT1_64_WG64_4_1_WGM15
    SolutionIndex: 18
    SolutionNameMin: Cijk_Alik_Bljk_I8II_BH_MT128x128x64_MI32x32x8x1_SE_1LDSB1_AF0EM8_EPS1_GRVW4_LPA16_LPB16_LRVW16_OPLV0_PK0_PAP0_PGR1_PLR9_SU0_SUS0_SRVW4_TT1_128_WG128_2_1_WGM2
    SolutionIndex: 19
    SolutionNameMin: Cijk_Alik_Bljk_I8II_BH_MT32x32x128_MI16x16x16x1_SE_1LDSB0_AF0EM8_EPS0_GRVW16_LPA32_LPB32_LRVW16_OPLV0_PK0_PAP0_PGR2_PLR9_SU32_SUS256_SRVW0_TT1_16_WG32_8_1_WGM1
    SolutionIndex: 20
    SolutionNameMin: Cijk_Alik_Bljk_I8II_BH_MT128x128x64_MI32x32x8x1_SE_1LDSB1_AF0EM8_EPS0_GRVW16_LPA16_LPB16_LRVW16_OPLV0_PK0_PAP0_PGR2_PLR9_SU0_SUS0_SRVW4_TT1_128_WG128_2_1_WGM1
    SolutionIndex: 21
    SolutionNameMin: Cijk_Alik_Bljk_I8II_BH_MT32x32x128_MI16x16x16x1_SE_1LDSB0_AF0EM8_EPS0_GRVW16_LPA32_LPB32_LRVW16_OPLV0_PK0_PAP0_PGR2_PLR9_SU32_SUS128_SRVW0_TT1_16_WG32_8_1_WGM1
    SolutionIndex: 22
    SolutionNameMin: Cijk_Alik_Bljk_I8II_BH_MT32x32x128_MI16x16x16x1_SE_1LDSB1_AF0EM8_EPS1_GRVW16_LPA32_LPB32_LRVW16_OPLV0_PK0_PAP0_PGR1_PLR9_SU0_SUS0_SRVW0_TT1_16_WG32_8_1_WGM15
    SolutionIndex: 23
    SolutionNameMin: Cijk_Alik_Bljk_I8II_BH_MT64x32x128_MI16x16x16x1_SE_LBSPP128_NTB0_NEPBS1_ONLL0_SU32_SUM4_SUS128_SPO1_SSO0_TT2_16_VSn1_WGM1
    SolutionIndex: 24
    SolutionNameMin: Cijk_Alik_Bljk_I8II_BH_MT64x64x128_MI16x16x16x1_SE_LBSPP0_NTB0_NEPBS1_ONLL0_SU0_SUM0_SUS0_SPO0_SSO2_TT2_32_VS1_WGM4
    SolutionIndex: 25
    SolutionNameMin: Cijk_Alik_Bljk_I8II_BH_MT64x64x128_MI16x16x16x1_SE_LBSPP0_NTB0_NEPBS1_ONLL0_SU32_SUM0_SUS128_SPO0_SSO2_TT2_32_VSn1_WGM2
    SolutionIndex: 26
    SolutionNameMin: Cijk_Alik_Bljk_I8II_BH_MT64x32x128_MI16x16x16x1_SE_LBSPP0_NTB0_NEPBS0_ONLL2_SU0_SUM0_SUS0_SPO1_SSO0_TT2_16_VS1_WGM1
    SolutionIndex: 27
    SolutionNameMin: Cijk_Alik_Bljk_I8II_BH_MT64x64x128_MI16x16x16x1_SE_LBSPP0_NTB0_NEPBS1_ONLL2_SU32_SUM4_SUS128_SPO1_SSO4_TT2_32_VS1_WGM1
    SolutionIndex: 28
    SolutionNameMin: Cijk_Alik_Bljk_I8II_BH_MT64x64x128_MI16x16x16x1_SE_LBSPP128_NTB0_NEPBS1_ONLL1_SU32_SUM1_SUS128_SPO1_SSO4_TT2_32_VS1_WGM1
    SolutionIndex: 29
    SolutionNameMin: Cijk_Alik_Bljk_I8II_BH_MT128x128x64_MI32x32x8x1_SE_LBSPP128_LPA8_LPB8_LRVW8_NTC0_NTD3_SUM1_SUS128_TT1_128_VW4_WGM1
    SolutionIndex: 30
    SolutionNameMin: Cijk_Alik_Bljk_I8II_BH_MT128x128x64_MI32x32x8x1_SE_LBSPP64_LPA16_LPB8_LRVW8_NTC0_NTD3_SUM1_SUS256_TT1_128_VW8_WGM1
    SolutionIndex: 31
    SolutionNameMin: Cijk_Alik_Bljk_I8II_BH_MT128x128x64_MI32x32x8x1_SE_LBSPP128_LPA16_LPB16_LRVW16_NTC0_NTD3_SUM1_SUS256_TT1_128_VW4_WGM1
    SolutionIndex: 32
    SolutionNameMin: Cijk_Alik_Bljk_I8II_BH_MT128x128x64_MI32x32x8x1_SE_LBSPP128_LPA8_LPB8_LRVW8_NTC0_NTD0_SUM0_SUS128_TT1_128_VW8_WGM8
    SolutionIndex: 33
    SolutionNameMin: Cijk_Alik_Bljk_I8II_BH_MT128x256x64_MI32x32x8x1_SE_LBSPP0_LPA16_LPB16_LRVW16_NTC0_NTD0_SUM0_SUS128_TT1_256_VW4_WGM1
    SolutionIndex: 34
    SolutionNameMin: Cijk_Alik_Bljk_I8II_BH_MT128x256x64_MI32x32x8x1_SE_LBSPP64_LPA8_LPB8_LRVW8_NTC0_NTD0_SUM0_SUS256_TT1_256_VW4_WGM1
    SolutionIndex: 35
    SolutionNameMin: Cijk_Alik_Bljk_I8II_BH_MT128x256x64_MI32x32x8x1_SE_LBSPP64_LPA16_LPB16_LRVW16_NTC0_NTD0_SUM0_SUS256_TT1_256_VW8_WGM1
    SolutionIndex: 36
    SolutionNameMin: Cijk_Alik_Bljk_I8II_BH_MT128x128x64_MI32x32x8x1_SE_LBSPP128_LPA8_LPB8_LRVW8_NTC0_NTD0_SUM0_SUS128_TT1_128_VW4_WGM8
    SolutionIndex: 37
    SolutionNameMin: Cijk_Alik_Bljk_I8II_BH_MT128x256x64_MI32x32x8x1_SE_LBSPP0_LPA16_LPB8_LRVW8_NTC0_NTD0_SUM0_SUS256_TT1_256_VW8_WGM1
    SolutionIndex: 38
    SolutionNameMin: Cijk_Alik_Bljk_I8II_BH_MT128x128x64_MI32x32x8x1_SE_LBSPP128_LPA8_LPB8_LRVW8_NTC0_NTD0_SUM0_SUS256_TT1_128_VW8_WGM8
    SolutionIndex: 39
    SolutionNameMin: Cijk_Alik_Bljk_I8II_BH_MT128x256x64_MI32x32x8x1_SE_LBSPP128_LPA16_LPB16_LRVW16_NTC0_NTD0_SUM0_SUS128_TT1_256_VW8_WGM1
    SolutionIndex: 40
    SolutionNameMin: Cijk_Alik_Bljk_I8II_BH_MT128x128x64_MI32x32x8x1_SE_LBSPP128_LPA8_LPB8_LRVW8_NTC0_NTD3_SUM0_SUS256_TT1_128_VW8_WGM15
    SolutionIndex: 41
    SolutionNameMin: Cijk_Alik_Bljk_I8II_BH_MT128x256x64_MI32x32x8x1_SE_LBSPP64_LPA16_LPB8_LRVW8_NTC0_NTD3_SUM0_SUS256_TT1_256_VW8_WGM1
    SolutionIndex: 42
    SolutionNameMin: Cijk_Alik_Bljk_I8II_BH_MT128x128x64_MI32x32x8x1_SE_LBSPP128_LPA16_LPB16_LRVW16_NTC0_NTD3_SUM0_SUS256_TT1_128_VW4_WGM15
    SolutionIndex: 43
    SolutionNameMin: Cijk_Alik_Bljk_I8II_BH_MT128x256x64_MI32x32x8x1_SE_LBSPP128_LPA16_LPB16_LRVW16_NTC0_NTD0_SUM0_SUS256_TT1_256_VW4_WGM1
    SolutionIndex: 44
    SolutionNameMin: Cijk_Alik_Bljk_I8II_BH_MT128x128x64_MI32x32x8x1_SE_LBSPP0_LPA16_LPB16_LRVW16_NTC0_NTD3_SUM0_SUS256_TT1_128_VW8_WGM15
    SolutionIndex: 45
    SolutionNameMin: Cijk_Alik_Bljk_I8II_BH_MT128x128x64_MI32x32x8x1_SE_LBSPP128_LPA16_LPB16_LRVW16_NTC0_NTD3_NEPBS1_SUM1_SUS256_VW8_WGM1
    SolutionIndex: 46
    SolutionNameMin: Cijk_Alik_Bljk_I8II_BH_MT128x128x64_MI32x32x8x1_SE_LBSPP128_LPA16_LPB16_LRVW16_NTC0_NTD3_NEPBS1_SUM1_SUS128_VW4_WGM8
    SolutionIndex: 47
    SolutionNameMin: Cijk_Alik_Bljk_I8II_BH_MT128x128x64_MI32x32x8x1_SE_LBSPP128_LPA0_LPB16_LRVW16_NTC0_NTD3_NEPBS1_SUM1_SUS256_VW8_WGM1
    SolutionIndex: 48
    SolutionNameMin: Cijk_Alik_Bljk_I8II_BH_MT128x128x64_MI32x32x8x1_SE_LBSPP128_LPA16_LPB16_LRVW16_NTC0_NTD3_NEPBS1_SUM0_SUS256_VW4_WGM15
    SolutionIndex: 49
    SolutionNameMin: Cijk_Alik_Bljk_I8II_BH_MT128x128x64_MI32x32x8x1_SE_LBSPP128_LPA16_LPB16_LRVW16_NTC0_NTD0_NEPBS1_SUM0_SUS128_VW8_WGM8
    SolutionIndex: 50
    SolutionNameMin: Cijk_Alik_Bljk_I8II_BH_MT128x128x64_MI32x32x8x1_SE_LBSPP128_LPA16_LPB16_LRVW16_NTC0_NTD0_NEPBS1_SUM0_SUS256_VW4_WGM15
    SolutionIndex: 51
    SolutionNameMin: Cijk_Alik_Bljk_I8II_BH_MT128x128x64_MI32x32x8x1_SE_LBSPP64_LPA0_LPB16_LRVW16_NTC0_NTD3_NEPBS1_SUM1_SUS256_VW8_WGM1
    SolutionIndex: 52
    SolutionNameMin: Cijk_Alik_Bljk_I8II_BH_MT128x128x64_MI32x32x8x1_SE_LBSPP64_LPA16_LPB16_LRVW16_NTC0_NTD3_NEPBS1_SUM0_SUS256_VW8_WGM15
    SolutionIndex: 53
    SolutionNameMin: Cijk_Alik_Bljk_I8II_BH_MT128x128x64_MI32x32x8x1_SE_LBSPP128_LPA16_LPB16_LRVW16_NTC0_NTD0_NEPBS1_SUM0_SUS256_VW4_WGM8
    SolutionIndex: 54
    SolutionNameMin: Cijk_Alik_Bljk_I8II_BH_MT128x128x64_MI32x32x8x1_SE_LBSPP0_LPA16_LPB16_LRVW16_NTC0_NTD0_NEPBS1_SUM0_SUS256_VW4_WGM15
    SolutionIndex: 55
    SolutionNameMin: Cijk_Alik_Bljk_I8II_BH_MT128x128x64_MI32x32x8x1_SE_LBSPP0_LPA16_LPB16_LRVW16_NTC0_NTD3_NEPBS1_SUM0_SUS128_VW4_WGM1
    SolutionIndex: 56
    SolutionNameMin: Cijk_Alik_Bljk_I8II_BH_MT128x128x64_MI32x32x8x1_SE_LBSPP64_LPA16_LPB16_LRVW16_NTC0_NTD3_NEPBS1_SUM0_SUS256_VW4_WGM15
    SolutionIndex: 57
    SolutionNameMin: Cijk_Alik_Bljk_I8II_BH_MT128x128x64_MI32x32x8x1_SE_LBSPP0_LPA16_LPB16_LRVW16_NTC0_NTD0_NEPBS1_SUM0_SUS256_VW8_WGM8
    SolutionIndex: 58
    SolutionNameMin: Cijk_Alik_Bljk_I8II_BH_MT128x128x64_MI32x32x8x1_SE_LBSPP128_LPA16_LPB16_LRVW8_NTC0_NTD3_NEPBS1_SUM0_SUS128_VW8_WGM8
    SolutionIndex: 59
    SolutionNameMin: Cijk_Alik_Bljk_I8II_BH_MT128x128x64_MI32x32x8x1_SE_LBSPP128_LPA8_LPB16_LRVW8_NTC0_NTD3_NEPBS1_SUM4_SUS128_VW4_WGM1
    SolutionIndex: 60
    SolutionNameMin: Cijk_Alik_Bljk_I8II_BH_MT128x128x64_MI32x32x8x1_SE_LBSPP128_LPA16_LPB16_LRVW16_NTC0_NTD0_NEPBS1_SUM0_SUS256_VW8_WGM15
    SolutionIndex: 61
    SolutionNameMin: Cijk_Alik_Bljk_I8II_BH_MT128x128x64_MI32x32x8x1_SE_LBSPP0_LPA0_LPB16_LRVW16_NTC0_NTD3_NEPBS1_SUM0_SUS256_VW8_WGM1
    SolutionIndex: 62
    SolutionNameMin: Cijk_Alik_Bljk_I8II_BH_MT128x128x64_MI32x32x8x1_SE_LBSPP128_LPA16_LPB16_LRVW16_NTC0_NTD3_NEPBS1_SUM0_SUS256_VW4_WGM8
- - - [35, 35, 1, 512]
    - [0, 0.033]
  - - [4, 64, 1, 128]
    - [0, 0.002]
  - - [480, 512, 1, 512]
    - [1, 10.58]
  - - [960, 1024, 1, 1024]
    - [2, 38.576]
  - - [1920, 2048, 1, 2048]
    - [3, 68.372]
  - - [3840, 4096, 1, 4096]
    - [4, 78.19]
  - - [7680, 8192, 1, 8192]
    - [5, 81.986]
  - - [1024, 128, 1, 128]
    - [12, 0.75]
  - - [1856, 448, 1, 3328]
    - [7, 57.842]
  - - [2944, 4288, 1, 1280]
    - [7, 71.561]
  - - [2368, 64, 1, 3328]
    - [1, 24.388]
  - - [1760, 32, 1, 1760]
    - [8, 5.94]
  - - [2368, 5888, 1, 256]
    - [9, 36.558]
  - - [5888, 1856, 1, 256]
    - [2, 34.905]
  - - [128, 64, 1, 256]
    - [1, 0.102]
  - - [512, 24000, 1, 1536]
    - [9, 73.125]
  - - [128, 6784, 1, 3328]
    - [12, 48.548]
  - - [5888, 1408, 1, 256]
    - [2, 33.725]
  - - [5888, 1856, 1, 3328]
    - [4, 75.669]
  - - [5056, 704, 1, 256]
    - [2, 28.757]
  - - [2048, 400, 1, 512]
    - [2, 25.136]
  - - [5888, 2944, 1, 3328]
    - [11, 77.384]
  - - [1856, 4288, 1, 256]
    - [7, 35.206]
  - - [1024, 5056, 1, 128]
    - [2, 18.854]
  - - [5056, 5056, 1, 3328]
    - [4, 77.761]
  - - [1408, 5888, 1, 1280]
    - [7, 69.227]
  - - [2368, 448, 1, 128]
    - [6, 9.744]
  - - [2368, 6784, 1, 128]
    - [2, 22.757]
  - - [1024, 3584, 1, 3328]
    - [12, 69.71]
  - - [512, 48000, 1, 2048]
    - [7, 76.578]
  - - [128, 448, 1, 1280]
    - [13, 6.265]
  - - [256, 4288, 1, 3328]
    - [12, 61.432]
  - - [5888, 1408, 1, 1280]
    - [14, 66.42]
  - - [704, 1856, 1, 3328]
    - [2, 59.9]
  - - [1024, 2368, 1, 256]
    - [7, 26.194]
  - - [64, 4, 1, 256]
    - [19, 0.003]
  - - [1408, 1856, 1, 1280]
    - [7, 59.914]
  - - [1408, 64, 1, 1280]
    - [15, 9.485]
  - - [448, 1024, 1, 1280]
    - [6, 30.487]
  - - [6144, 24000, 1, 2048]
    - [5, 79.446]
  - - [4096, 32, 1, 4096]
    - [1, 21.916]
  - - [256, 1408, 1, 3328]
    - [16, 42.5]
  - - [5056, 5056, 1, 1280]
    - [17, 71.568]
  - - [448, 5056, 1, 256]
    - [2, 25.031]
  - - [704, 1856, 1, 1280]
    - [12, 40.852]
  - - [128, 5056, 1, 128]
    - [6, 7.125]
  - - [2368, 128, 1, 256]
    - [6, 7.472]
  - - [1760, 6400, 1, 1760]
    - [18, 65.232]
  - - [1856, 1408, 1, 128]
    - [2, 15.382]
  - - [64, 5056, 1, 256]
    - [6, 7.777]
  - - [6784, 256, 1, 3328]
    - [12, 64.093]
  - - [6784, 4288, 1, 3328]
    - [4, 77.775]
  - - [4288, 448, 1, 256]
    - [2, 23.086]
  - - [64, 704, 1, 128]
    - [19, 0.706]
  - - [1856, 2368, 1, 3328]
    - [7, 73.273]
  - - [4288, 2944, 1, 1280]
    - [7, 69.939]
  - - [704, 5056, 1, 1280]
    - [7, 63.45]
  - - [2368, 704, 1, 3328]
    - [7, 65.043]
  - - [256, 5888, 1, 256]
    - [12, 21.003]
  - - [1856, 4288, 1, 3328]
    - [4, 75.603]
  - - [256, 2944, 1, 256]
    - [2, 14.688]
  - - [5888, 1024, 1, 256]
    - [2, 32.444]
  - - [448, 64, 1, 1280]
    - [10, 3.181]
  - - [3072, 64, 1, 1024]
    - [1, 16.437]
  - - [3584, 4, 1, 1280]
    - [1, 1.426]
  - - [16384, 3200, 1, 4096]
    - [20, 78.414]
  - - [2944, 64, 1, 256]
    - [6, 4.852]
  - - [128, 4, 1, 1280]
    - [10, 0.063]
  - - [1408, 2944, 1, 256]
    - [2, 30.191]
  - - [256, 1856, 1, 1280]
    - [6, 31.432]
  - - [6784, 5056, 1, 3328]
    - [4, 77.812]
  - - [5056, 5056, 1, 256]
    - [3, 38.103]
  - - [1408, 6784, 1, 128]
    - [2, 21.423]
  - - [64, 1024, 1, 1280]
    - [21, 7.053]
  - - [2944, 4, 1, 256]
    - [2, 0.142]
  - - [704, 5056, 1, 128]
    - [2, 17.4]
  - - [2368, 2944, 1, 1280]
    - [9, 67.655]
  - - [128, 3584, 1, 1280]
    - [22, 30.487]
  - - [6784, 6784, 1, 1280]
    - [5, 74.057]
  - - [1024, 256, 1, 3328]
    - [1, 36.136]
  - - [1408, 4288, 1, 1280]
    - [7, 67.286]
  - - [3584, 4288, 1, 1280]
    - [9, 71.24]
  - - [2368, 704, 1, 1280]
    - [3, 52.954]
  - - [5056, 4288, 1, 3328]
    - [14, 91.233]
  - - [3584, 2368, 1, 3328]
    - [4, 75.496]
  - - [64, 704, 1, 1280]
    - [1, 4.922]
  - - [4288, 256, 1, 256]
    - [2, 10.579]
  - - [2944, 128, 1, 128]
    - [6, 4.896]
  - - [6144, 32, 1, 2560]
    - [1, 25.315]
  - - [6784, 448, 1, 1280]
    - [4, 58.595]
  - - [1408, 2944, 1, 128]
    - [2, 18.393]
  - - [4288, 2944, 1, 256]
    - [7, 35.626]
  - - [5888, 704, 1, 1280]
    - [12, 61.06]
  - - [5056, 4, 1, 3328]
    - [1, 3.283]
  - - [1856, 64, 1, 1280]
    - [1, 11.574]
  - - [1760, 16, 1, 1760]
    - [10, 3.002]
  - - [448, 5888, 1, 128]
    - [2, 15.785]
  - - [5888, 64, 1, 3328]
    - [7, 42.687]
  - - [2944, 256, 1, 3328]
    - [4, 53.928]
  - - [1024, 64, 1, 128]
    - [13, 1.016]
  - - [5056, 2368, 1, 1280]
    - [4, 68.871]
  - - [448, 3584, 1, 1280]
    - [7, 51.115]
  - - [6784, 5888, 1, 256]
    - [7, 38.224]
  - - [704, 1024, 1, 128]
    - [2, 7.759]
  - - [704, 128, 1, 1280]
    - [21, 9.698]
  - - [1408, 448, 1, 1280]
    - [2, 38.545]
  - - [1024, 1408, 1, 256]
    - [2, 21.003]
  - - [1024, 1024, 1, 1024]
    - [23, 40.459]
  - - [2048, 2048, 1, 1024]
    - [24, 63.17]
  - - [4096, 4096, 1, 1024]
    - [25, 75.933]
  - - [1024, 1024, 1, 2048]
    - [26, 53.057]
  - - [2048, 2048, 1, 2048]
    - [27, 71.369]
  - - [4096, 4096, 1, 2048]
    - [28, 80.246]
  - - [8192, 8192, 1, 1024]
    - [29, 77.097]
  - - [12288, 12288, 1, 1024]
    - [30, 76.54]
  - - [16384, 16384, 1, 1024]
    - [31, 74.201]
  - - [20480, 20480, 1, 1024]
    - [32, 76.989]
  - - [24576, 24576, 1, 1024]
    - [33, 75.087]
  - - [28672, 28672, 1, 1024]
    - [32, 77.263]
  - - [32768, 32768, 1, 1024]
    - [34, 69.439]
  - - [36864, 36864, 1, 1024]
    - [32, 77.161]
  - - [40960, 40960, 1, 1024]
    - [35, 75.153]
  - - [45056, 45056, 1, 1024]
    - [36, 76.625]
  - - [49152, 49152, 1, 1024]
    - [37, 73.632]
  - - [53248, 53248, 1, 1024]
    - [38, 76.296]
  - - [57344, 57344, 1, 1024]
    - [39, 74.535]
  - - [61440, 61440, 1, 1024]
    - [40, 76.437]
  - - [65536, 65536, 1, 1024]
    - [41, 68.079]
  - - [69632, 69632, 1, 1024]
    - [42, 74.771]
  - - [73728, 73728, 1, 1024]
    - [43, 72.653]
  - - [77824, 77824, 1, 1024]
    - [44, 73.94]
  - - [81920, 81920, 1, 1024]
    - [33, 72.376]
  - - [86016, 86016, 1, 1024]
    - [42, 73.821]
  - - [90112, 90112, 1, 1024]
    - [33, 71.734]
  - - [8192, 8192, 1, 2048]
    - [45, 82.963]
  - - [12288, 12288, 1, 2048]
    - [46, 84.562]
  - - [16384, 16384, 1, 2048]
    - [47, 83.154]
  - - [20480, 20480, 1, 2048]
    - [48, 85.572]
  - - [24576, 24576, 1, 2048]
    - [49, 84.576]
  - - [28672, 28672, 1, 2048]
    - [50, 85.809]
  - - [32768, 32768, 1, 2048]
    - [51, 77.602]
  - - [36864, 36864, 1, 2048]
    - [52, 85.808]
  - - [40960, 40960, 1, 2048]
    - [53, 84.923]
  - - [45056, 45056, 1, 2048]
    - [54, 85.823]
  - - [49152, 49152, 1, 2048]
    - [55, 80.693]
  - - [53248, 53248, 1, 2048]
    - [56, 83.959]
  - - [57344, 57344, 1, 2048]
    - [57, 83.148]
  - - [61440, 61440, 1, 2048]
    - [58, 84.101]
  - - [65536, 65536, 1, 2048]
    - [59, 75.749]
  - - [69632, 69632, 1, 2048]
    - [60, 85.899]
  - - [73728, 73728, 1, 2048]
    - [52, 84.467]
  - - [77824, 77824, 1, 2048]
    - [52, 85.824]
  - - [81920, 81920, 1, 2048]
    - [61, 80.376]
  - - [86016, 86016, 1, 2048]
    - [57, 85.696]
  - - [90112, 90112, 1, 2048]
    - [62, 84.493]
- null
