library/src/blas3/Tensile/Logic/asm_full/aldebaran_104cu/aldebaran_Cijk_Ailk_Bjlk_HSS_BH.yaml
- {MinimumRequiredVersion: 4.32.1}
- aldebaran
- {Architecture: gfx90a, CUCount: 104}
- [Device 0050, Device 0051, Device 0052, Device 0054, Device 0062, Device 7400, Device
    SolutionIndex: 0
    SolutionNameMin: Cijk_Ailk_Bjlk_HSS_BH_MT128x128x4_SE_PGR0_PLR0_TT8_8
    SolutionIndex: 1
    SolutionNameMin: Cijk_Ailk_Bjlk_HSS_BH_MT64x128x4_SE_PGR0_PLR0_TT4_8
    SolutionIndex: 2
    SolutionNameMin: Cijk_Ailk_Bjlk_HSS_BH_MT64x64x4_SE_PGR0_PLR0_TT4_4
    SolutionIndex: 3
    SolutionNameMin: Cijk_Ailk_Bjlk_HSS_BH_MT64x64x4_SE_PGR1_PLR0_TT4_4
    SolutionIndex: 4
    SolutionNameMin: Cijk_Ailk_Bjlk_HSS_BH_MT64x64x4_SE_PGR0_PLR1_TT4_4
    SolutionIndex: 5
    SolutionNameMin: Cijk_Ailk_Bjlk_HSS_BH_MT64x64x8_SE_PGR0_PLR0_TT4_4
    SolutionIndex: 6
    SolutionNameMin: Cijk_Ailk_Bjlk_HSS_BH_MT64x64x8_SE_PGR1_PLR0_TT4_4
    SolutionIndex: 7
    SolutionNameMin: Cijk_Ailk_Bjlk_HSS_BH_MT64x64x8_SE_PGR0_PLR1_TT4_4
    SolutionIndex: 8
    SolutionNameMin: Cijk_Ailk_Bjlk_HSS_BH_MT64x64x8_SE_PGR1_PLR1_TT4_4
    SolutionIndex: 9
    SolutionNameMin: Cijk_Ailk_Bjlk_HSS_BH_MT64x64x16_SE_PGR0_PLR0_TT4_4
    SolutionIndex: 10
    SolutionNameMin: Cijk_Ailk_Bjlk_HSS_BH_MT64x64x16_SE_PGR1_PLR0_TT4_4
    SolutionIndex: 11
    SolutionNameMin: Cijk_Ailk_Bjlk_HSS_BH_MT64x64x16_SE_PGR1_PLR1_TT4_4
    SolutionIndex: 12
    SolutionNameMin: Cijk_Ailk_Bjlk_HSS_BH_MT32x32x64_MI16x16x16x1_SE_1LDSB0_AF0EM8_GRVW8_GSU1_NLCA1_NLCB1_SU0_SUS0_SRVW4_TT1_16_VAW2_WG32_8_1_WGM1
    SolutionIndex: 13
    SolutionNameMin: Cijk_Ailk_Bjlk_HSS_BH_MT32x32x128_MI16x16x16x1_SE_1LDSB0_AF0EM4_GRVW2_GSU1_NLCA1_NLCB1_SU0_SUS0_SRVW0_TT1_16_VAW2_WG32_8_1_WGM1
    SolutionIndex: 14
    SolutionNameMin: Cijk_Ailk_Bjlk_HSS_BH_MT32x32x64_MI16x16x16x1_SE_1LDSB0_AF0EM4_GRVW4_GSU1_NLCA1_NLCB1_SU32_SUS128_SRVW0_TT1_16_VAW2_WG32_8_1_WGM1
    SolutionIndex: 15
    SolutionNameMin: Cijk_Ailk_Bjlk_HSS_BH_MT32x32x32_MI16x16x16x1_SE_1LDSB0_AF0EM4_GRVW4_GSU1_NLCA1_NLCB1_SU0_SUS0_SRVW0_TT1_16_VAW2_WG32_8_1_WGM15
    SolutionIndex: 16
    SolutionNameMin: Cijk_Ailk_Bjlk_HSS_BH_MT32x32x32_MI16x16x16x1_SE_1LDSB0_AF0EM4_GRVW8_GSU1_NLCA1_NLCB1_SU0_SUS0_SRVW0_TT1_16_VAW2_WG32_8_1_WGM1
    SolutionIndex: 17
    SolutionNameMin: Cijk_Ailk_Bjlk_HSS_BH_MT32x32x64_MI16x16x16x1_SE_1LDSB0_AF0EM4_GRVW4_GSU1_NLCA1_NLCB1_SU32_SUS128_SRVW0_TT1_16_VAW2_WG32_8_1_WGM15
    SolutionIndex: 18
    SolutionNameMin: Cijk_Ailk_Bjlk_HSS_BH_MT32x32x64_MI16x16x16x1_SE_1LDSB0_AF0EM4_GRVW8_GSU1_NLCA1_NLCB1_SU0_SUS0_SRVW0_TT1_16_VAW2_WG32_8_1_WGM15
    SolutionIndex: 19
    SolutionNameMin: Cijk_Ailk_Bjlk_HSS_BH_MT64x64x64_MI32x32x8x1_SE_1LDSB0_AF0EM8_GRVW8_GSU1_NLCA1_NLCB1_SU0_SUS0_SRVW4_TT1_32_VAW2_WG64_4_1_WGM2
    SolutionIndex: 20
    SolutionNameMin: Cijk_Ailk_Bjlk_HSS_BH_MT32x32x64_MI16x16x16x1_SE_1LDSB0_AF0EM4_GRVW8_GSU1_NLCA1_NLCB1_SU32_SUS128_SRVW0_TT1_16_VAW2_WG32_8_1_WGM1
    SolutionIndex: 21
    SolutionNameMin: Cijk_Ailk_Bjlk_HSS_BH_MT64x64x32_MI32x32x8x1_SE_1LDSB0_AF0EM8_GRVW8_GSU1_NLCA1_NLCB1_SU0_SUS0_SRVW4_TT1_32_VAW2_WG64_4_1_WGM1
    SolutionIndex: 22
    SolutionNameMin: Cijk_Ailk_Bjlk_HSS_BH_MT32x32x128_MI16x16x16x1_SE_1LDSB0_AF0EM1_GRVW8_GSU1_NLCA1_NLCB1_SU0_SUS0_SRVW0_TT1_16_VAW2_WG32_8_1_WGM2
    SolutionIndex: 23
    SolutionNameMin: Cijk_Ailk_Bjlk_HSS_BH_MT32x32x128_MI16x16x16x1_SE_1LDSB0_AF0EM4_GRVW2_GSU1_NLCA1_NLCB1_SU32_SUS256_SRVW0_TT1_16_VAW2_WG32_8_1_WGM1
    SolutionIndex: 24
    SolutionNameMin: Cijk_Ailk_Bjlk_HSS_BH_MT32x64x128_MI16x16x16x1_SE_1LDSB0_AF0EM1_GRVW8_GSU1_NLCA1_NLCB1_SU32_SUS256_SRVW0_TT1_32_VAW2_WG32_8_1_WGM15
    SolutionIndex: 25
    SolutionNameMin: Cijk_Ailk_Bjlk_HSS_BH_MT32x32x128_MI16x16x16x1_SE_1LDSB0_AF0EM4_GRVW2_GSU1_NLCA1_NLCB1_SU16_SUS256_SRVW0_TT1_16_VAW2_WG32_8_1_WGM1
    SolutionIndex: 26
    SolutionNameMin: Cijk_Ailk_Bjlk_HSS_BH_MT32x32x64_MI16x16x16x1_SE_1LDSB0_AF0EM1_GRVW4_GSU1_NLCA1_NLCB1_SU0_SUS0_SRVW0_TT1_16_VAW2_WG32_8_1_WGM2
    SolutionIndex: 27
    SolutionNameMin: Cijk_Ailk_Bjlk_HSS_BH_MT64x64x64_MI32x32x8x1_SE_1LDSB0_AF0EM8_GRVW8_GSU1_NLCA1_NLCB1_SU0_SUS0_SRVW4_TT1_32_VAW2_WG64_4_1_WGM15
    SolutionIndex: 28
    SolutionNameMin: Cijk_Ailk_Bjlk_HSS_BH_MT64x64x64_MI32x32x8x1_SE_1LDSB0_AF0EM4_GRVW8_GSU1_NLCA1_NLCB1_SU0_SUS0_SRVW4_TT1_32_VAW2_WG64_4_1_WGM1
    SolutionIndex: 29
    SolutionNameMin: Cijk_Ailk_Bjlk_HSS_BH_MT64x64x64_MI32x32x8x1_SE_1LDSB0_AF0EM8_GRVW8_GSU1_NLCA1_NLCB1_SU0_SUS0_SRVW4_TT1_32_VAW2_WG64_4_1_WGM1
    SolutionIndex: 30
    SolutionNameMin: Cijk_Ailk_Bjlk_HSS_BH_MT32x32x64_MI16x16x16x1_SE_1LDSB0_AF0EM8_GRVW4_GSU5_NLCA1_NLCB1_SU0_SUS0_SRVW0_TT1_16_VAW1_WG32_8_1_WGM1
    SolutionIndex: 31
    SolutionNameMin: Cijk_Ailk_Bjlk_HSS_BH_MT64x16x32_MI16x16x16x1_SE_1LDSB0_AF0EM8_GRVW8_GSU7_NLCA1_NLCB1_SU0_SUS0_SRVW0_TT1_16_VAW1_WG64_4_1_WGM1
    SolutionIndex: 32
    SolutionNameMin: Cijk_Ailk_Bjlk_HSS_BH_MT64x32x64_MI16x16x16x1_SE_1LDSB0_AF0EM8_GRVW8_GSU5_NLCA1_NLCB1_SU32_SUS128_SRVW0_TT2_16_VAW1_WG32_8_1_WGM15
    SolutionIndex: 33
    SolutionNameMin: Cijk_Ailk_Bjlk_HSS_BH_MT32x32x64_MI16x16x16x1_SE_1LDSB0_AF0EM8_GRVW2_GSU7_NLCA1_NLCB1_SU0_SUS0_SRVW0_TT1_16_VAW1_WG32_8_1_WGM15
    SolutionIndex: 34
    SolutionNameMin: Cijk_Ailk_Bjlk_HSS_BH_MT64x64x64_MI32x32x8x1_SE_1LDSB0_AF0EM8_GRVW4_GSU7_NLCA1_NLCB1_SU0_SUS0_SRVW0_TT1_32_VAW1_WG64_4_1_WGM1
    SolutionIndex: 35
    SolutionNameMin: Cijk_Ailk_Bjlk_HSS_BH_MT64x64x128_MI32x32x8x1_SE_1LDSB0_AF0EM4_GRVW8_GSU1_NLCA1_NLCB1_SU32_SUS256_SRVW4_TT1_32_VAW2_WG64_4_1_WGM15
    SolutionIndex: 36
    SolutionNameMin: Cijk_Ailk_Bjlk_HSS_BH_MT64x64x128_MI32x32x8x1_SE_1LDSB0_AF0EM4_GRVW8_GSU1_NLCA1_NLCB1_SU16_SUS256_SRVW4_TT1_32_VAW2_WG64_4_1_WGM2
    SolutionIndex: 37
    SolutionNameMin: Cijk_Ailk_Bjlk_HSS_BH_MT32x64x128_MI16x16x16x1_SE_1LDSB0_AF0EM1_GRVW8_GSU1_NLCA1_NLCB1_SU16_SUS256_SRVW0_TT1_32_VAW2_WG32_8_1_WGM15
    SolutionIndex: 38
    SolutionNameMin: Cijk_Ailk_Bjlk_HSS_BH_MT64x128x64_MI32x32x8x1_SE_1LDSB0_AF0EM1_GRVW8_GSU1_NLCA1_NLCB1_SU16_SUS256_SRVW4_TT1_64_VAW2_WG64_4_1_WGM15
    SolutionIndex: 39
    SolutionNameMin: Cijk_Ailk_Bjlk_HSS_BH_MT64x64x128_MI32x32x8x1_SE_1LDSB0_AF0EM4_GRVW8_GSU1_NLCA1_NLCB1_SU16_SUS256_SRVW4_TT1_32_VAW2_WG64_4_1_WGM1
    SolutionIndex: 40
    SolutionNameMin: Cijk_Ailk_Bjlk_HSS_BH_MT128x64x64_MI32x32x8x1_SE_1LDSB0_AF0EM4_GRVW8_GSU1_NLCA1_NLCB1_SU0_SUS0_SRVW4_TT2_32_VAW2_WG64_4_1_WGM15
    SolutionIndex: 41
    SolutionNameMin: Cijk_Ailk_Bjlk_HSS_BH_MT64x64x128_MI32x32x8x1_SE_1LDSB0_AF0EM4_GRVW8_GSU1_NLCA1_NLCB1_SU16_SUS256_SRVW4_TT1_32_VAW2_WG64_4_1_WGM15
    SolutionIndex: 42
    SolutionNameMin: Cijk_Ailk_Bjlk_HSS_BH_MT64x128x64_MI32x32x8x1_SE_1LDSB0_AF0EM4_GRVW8_GSU1_NLCA1_NLCB1_SU16_SUS256_SRVW4_TT1_64_VAW2_WG64_4_1_WGM15
    SolutionIndex: 43
    SolutionNameMin: Cijk_Ailk_Bjlk_HSS_BH_MT64x32x128_MI16x16x16x1_SE_1LDSB0_AF0EM4_GRVW8_GSU1_NLCA1_NLCB1_SU0_SUS0_SRVW4_TT2_16_VAW2_WG32_8_1_WGM1
    SolutionIndex: 44
    SolutionNameMin: Cijk_Ailk_Bjlk_HSS_BH_MT64x64x64_MI32x32x8x1_SE_1LDSB0_AF0EM4_GRVW8_GSU1_NLCA1_NLCB1_SU16_SUS256_SRVW4_TT1_32_VAW2_WG64_4_1_WGM2
    SolutionIndex: 45
    SolutionNameMin: Cijk_Ailk_Bjlk_HSS_BH_MT64x64x64_MI32x32x8x1_SE_1LDSB0_AF0EM4_GRVW8_GSU1_NLCA1_NLCB1_SU16_SUS128_SRVW4_TT1_32_VAW2_WG64_4_1_WGM1
    SolutionIndex: 46
    SolutionNameMin: Cijk_Ailk_Bjlk_HSS_BH_MT64x64x32_MI32x32x8x1_SE_1LDSB0_AF0EM8_GRVW8_GSU7_NLCA1_NLCB1_SU0_SUS0_SRVW0_TT1_32_VAW1_WG64_4_1_WGM1
    SolutionIndex: 47
    SolutionNameMin: Cijk_Ailk_Bjlk_HSS_BH_MT64x64x32_MI32x32x8x1_SE_1LDSB0_AF0EM8_GRVW8_GSU1_NLCA1_NLCB1_SU0_SUS0_SRVW4_TT1_32_VAW2_WG64_4_1_WGM15
    SolutionIndex: 48
    SolutionNameMin: Cijk_Ailk_Bjlk_HSS_BH_MT64x64x32_MI32x32x8x1_SE_1LDSB0_AF0EM8_GRVW8_GSU1_NLCA1_NLCB1_SU32_SUS128_SRVW4_TT1_32_VAW2_WG64_4_1_WGM1
    SolutionIndex: 49
    SolutionNameMin: Cijk_Ailk_Bjlk_HSS_BH_MT64x128x32_MI32x32x8x1_SE_1LDSB0_AF0EM8_GRVW8_GSU1_NLCA1_NLCB1_SU0_SUS0_SRVW4_TT1_64_VAW2_WG64_4_1_WGM1
    SolutionIndex: 50
    SolutionNameMin: Cijk_Ailk_Bjlk_HSS_BH_MT64x128x16_MI32x32x8x1_SE_1LDSB0_AF0EM8_GRVW8_GSU1_NLCA1_NLCB1_SU0_SUS0_SRVW4_TT1_64_VAW2_WG64_4_1_WGM2
    SolutionIndex: 51
    SolutionNameMin: Cijk_Ailk_Bjlk_HSS_BH_MT128x96x32_MI32x32x8x1_SE_1LDSB0_AF0EM8_GRVW4_GSU1_NLCA1_NLCB3_SU0_SUS0_SRVW4_TT1_96_VAW2_WG128_2_1_WGM2
    SolutionIndex: 52
    SolutionNameMin: Cijk_Ailk_Bjlk_HSS_BH_MT64x128x32_MI32x32x8x1_SE_1LDSB0_AF0EM4_GRVW8_GSU1_NLCA1_NLCB1_SU0_SUS0_SRVW4_TT1_64_VAW2_WG64_4_1_WGM1
    SolutionIndex: 53
    SolutionNameMin: Cijk_Ailk_Bjlk_HSS_BH_MT128x96x32_MI32x32x8x1_SE_1LDSB0_AF0EM8_GRVW4_GSU1_NLCA1_NLCB3_SU0_SUS0_SRVW4_TT1_96_VAW2_WG128_2_1_WGM1
    SolutionIndex: 54
    SolutionNameMin: Cijk_Ailk_Bjlk_HSS_BH_MT128x96x32_MI32x32x8x1_SE_1LDSB0_AF0EM4_GRVW4_GSU1_NLCA1_NLCB3_SU0_SUS0_SRVW4_TT1_96_VAW2_WG128_2_1_WGM2
    SolutionIndex: 55
    SolutionNameMin: Cijk_Ailk_Bjlk_HSS_BH_MT128x96x16_MI32x32x8x1_SE_1LDSB0_AF0EM4_GRVW2_GSU1_NLCA1_NLCB3_SU0_SUS0_SRVW4_TT1_96_VAW2_WG128_2_1_WGM2
    SolutionIndex: 56
    SolutionNameMin: Cijk_Ailk_Bjlk_HSS_BH_MT64x64x32_MI32x32x8x1_SE_1LDSB0_AF0EM8_GRVW8_GSU1_NLCA1_NLCB1_SU0_SUS0_SRVW4_TT1_32_VAW2_WG64_4_1_WGM2
    SolutionIndex: 57
    SolutionNameMin: Cijk_Ailk_Bjlk_HSS_BH_MT64x128x16_MI32x32x8x1_SE_1LDSB0_AF0EM8_GRVW8_GSU1_NLCA1_NLCB1_SU0_SUS0_SRVW4_TT1_64_VAW2_WG64_4_1_WGM1
    SolutionIndex: 58
    SolutionNameMin: Cijk_Ailk_Bjlk_HSS_BH_MT128x96x32_MI32x32x8x1_SE_1LDSB0_AF0EM8_GRVW4_GSU1_NLCA1_NLCB3_SU0_SUS0_SRVW4_TT1_96_VAW2_WG128_2_1_WGM15
    SolutionIndex: 59
    SolutionNameMin: Cijk_Ailk_Bjlk_HSS_BH_MT64x128x32_MI32x32x8x1_SE_1LDSB0_AF0EM1_GRVW8_GSU1_NLCA1_NLCB1_SU0_SUS0_SRVW4_TT1_64_VAW2_WG64_4_1_WGM1
    SolutionIndex: 60
    SolutionNameMin: Cijk_Ailk_Bjlk_HSS_BH_MT128x96x64_MI32x32x8x1_SE_1LDSB0_AF0EM4_GRVW8_GSU1_NLCA1_NLCB3_SU16_SUS128_SRVW4_TT1_96_VAW2_WG128_2_1_WGM2
    SolutionIndex: 61
    SolutionNameMin: Cijk_Ailk_Bjlk_HSS_BH_MT128x96x64_MI32x32x8x1_SE_1LDSB0_AF0EM8_GRVW8_GSU1_NLCA1_NLCB3_SU32_SUS128_SRVW4_TT1_96_VAW2_WG128_2_1_WGM15
    SolutionIndex: 62
    SolutionNameMin: Cijk_Ailk_Bjlk_HSS_BH_MT64x64x32_MI32x32x8x1_SE_1LDSB0_AF0EM1_GRVW4_GSU1_NLCA1_NLCB1_SU16_SUS128_SRVW4_TT1_32_VAW2_WG64_4_1_WGM15
    SolutionIndex: 63
    SolutionNameMin: Cijk_Ailk_Bjlk_HSS_BH_MT64x128x32_MI32x32x8x1_SE_1LDSB0_AF0EM8_GRVW8_GSU1_NLCA1_NLCB1_SU32_SUS128_SRVW4_TT1_64_VAW2_WG64_4_1_WGM1
    SolutionIndex: 64
    SolutionNameMin: Cijk_Ailk_Bjlk_HSS_BH_MT128x96x64_MI32x32x8x1_SE_1LDSB0_AF0EM4_GRVW4_GSU1_NLCA1_NLCB3_SU0_SUS0_SRVW4_TT1_96_VAW2_WG128_2_1_WGM2
    SolutionIndex: 65
    SolutionNameMin: Cijk_Ailk_Bjlk_HSS_BH_MT64x64x32_MI32x32x8x1_SE_1LDSB0_AF0EM4_GRVW4_GSU1_NLCA1_NLCB1_SU0_SUS0_SRVW4_TT1_32_VAW2_WG64_4_1_WGM1
    SolutionIndex: 66
    SolutionNameMin: Cijk_Ailk_Bjlk_HSS_BH_MT128x160x32_MI32x32x8x1_SE_1LDSB0_AF0EM4_GRVW4_GSU1_NLCA1_NLCB5_SU16_SUS128_SRVW4_TT1_160_VAW2_WG128_2_1_WGM1
    SolutionIndex: 67
    SolutionNameMin: Cijk_Ailk_Bjlk_HSS_BH_MT128x128x32_MI32x32x8x1_SE_1LDSB0_AF0EM4_GRVW8_GSU1_NLCA1_NLCB1_SU0_SUS0_SRVW0_TT2_64_VAW2_WG64_4_1_WGM2
    SolutionIndex: 68
    SolutionNameMin: Cijk_Ailk_Bjlk_HSS_BH_MT144x256x32_MI16x16x16x1_SE_1LDSB0_AF0EM8_GRVW2_GSU1_NLCA9_NLCB2_SU0_SUS0_SRVW0_TT9_64_VAW2_WG16_16_1_WGM1
    SolutionIndex: 69
    SolutionNameMin: Cijk_Ailk_Bjlk_HSS_BH_MT128x96x64_MI32x32x8x1_SE_1LDSB0_AF0EM4_GRVW4_GSU1_NLCA1_NLCB3_SU0_SUS0_SRVW0_TT1_96_VAW2_WG128_2_1_WGM15
    SolutionIndex: 70
    SolutionNameMin: Cijk_Ailk_Bjlk_HSS_BH_MT64x128x32_MI32x32x8x1_SE_1LDSB0_AF0EM4_GRVW8_GSU1_NLCA1_NLCB1_SU0_SUS0_SRVW4_TT1_64_VAW2_WG64_4_1_WGM2
    SolutionIndex: 71
    SolutionNameMin: Cijk_Ailk_Bjlk_HSS_BH_MT128x160x32_MI32x32x8x1_SE_1LDSB0_AF0EM8_GRVW4_GSU1_NLCA1_NLCB5_SU32_SUS128_SRVW4_TT1_160_VAW2_WG128_2_1_WGM2
    SolutionIndex: 72
    SolutionNameMin: Cijk_Ailk_Bjlk_HSS_BH_MT160x256x32_MI32x32x8x1_SE_1LDSB0_AF0EM8_GRVW4_GSU1_NLCA5_NLCB1_SU0_SUS0_SRVW0_TT5_64_VAW2_WG32_8_1_WGM1
    SolutionIndex: 73
    SolutionNameMin: Cijk_Ailk_Bjlk_HSS_BH_MT128x256x32_MI32x32x8x1_SE_1LDSB0_AF0EM8_GRVW8_GSU1_NLCA1_NLCB1_SU0_SUS0_SRVW4_TT2_128_VAW2_WG64_4_1_WGM1
    SolutionIndex: 74
    SolutionNameMin: Cijk_Ailk_Bjlk_HSS_BH_MT128x256x32_MI32x32x8x1_SE_1LDSB0_AF0EM8_GRVW8_GSU1_NLCA1_NLCB1_SU0_SUS0_SRVW4_TT2_128_VAW2_WG64_4_1_WGM2
    SolutionIndex: 75
    SolutionNameMin: Cijk_Ailk_Bjlk_HSS_BH_MT96x128x32_MI32x32x8x1_SE_1LDSB0_AF0EM8_GRVW4_GSU1_NLCA3_NLCB1_SU0_SUS0_SRVW0_TT3_32_VAW2_WG32_8_1_WGM1
    SolutionIndex: 76
    SolutionNameMin: Cijk_Ailk_Bjlk_HSS_BH_MT256x160x32_MI32x32x8x1_SE_1LDSB0_AF0EM8_GRVW4_GSU1_NLCA1_NLCB5_SU32_SUS256_SRVW4_TT2_160_VAW2_WG128_2_1_WGM15
    SolutionIndex: 77
    SolutionNameMin: Cijk_Ailk_Bjlk_HSS_BH_MT128x128x32_MI32x32x8x1_SE_1LDSB0_AF0EM4_GRVW8_GSU1_NLCA1_NLCB1_SU0_SUS0_SRVW0_TT2_64_VAW2_WG64_4_1_WGM15
    SolutionIndex: 78
    SolutionNameMin: Cijk_Ailk_Bjlk_HSS_BH_MT64x64x32_MI32x32x8x1_SE_1LDSB0_AF0EM1_GRVW8_GSU1_NLCA1_NLCB1_SU0_SUS0_SRVW4_TT1_32_VAW2_WG64_4_1_WGM2
    SolutionIndex: 79
    SolutionNameMin: Cijk_Ailk_Bjlk_HSS_BH_MT256x160x32_MI32x32x8x1_SE_1LDSB0_AF0EM8_GRVW4_GSU1_NLCA1_NLCB5_SU0_SUS0_SRVW4_TT2_160_VAW2_WG128_2_1_WGM2
    SolutionIndex: 80
    SolutionNameMin: Cijk_Ailk_Bjlk_HSS_BH_MT128x96x64_MI32x32x8x1_SE_1LDSB0_AF0EM4_GRVW8_GSU1_NLCA1_NLCB3_SU0_SUS0_SRVW4_TT1_96_VAW2_WG128_2_1_WGM2
    SolutionIndex: 81
    SolutionNameMin: Cijk_Ailk_Bjlk_HSS_BH_MT128x256x32_MI32x32x8x1_SE_1LDSB0_AF0EM8_GRVW8_GSU1_NLCA1_NLCB1_SU32_SUS128_SRVW4_TT2_128_VAW2_WG64_4_1_WGM1
    SolutionIndex: 82
    SolutionNameMin: Cijk_Ailk_Bjlk_HSS_BH_MT160x256x32_MI32x32x8x1_SE_1LDSB0_AF0EM8_GRVW4_GSU1_NLCA5_NLCB1_SU32_SUS128_SRVW0_TT5_64_VAW2_WG32_8_1_WGM1
    SolutionIndex: 83
    SolutionNameMin: Cijk_Ailk_Bjlk_HSS_BH_MT128x256x32_MI32x32x8x1_SE_1LDSB0_AF0EM4_GRVW8_GSU1_NLCA1_NLCB1_SU0_SUS0_SRVW4_TT2_128_VAW2_WG64_4_1_WGM1
    SolutionIndex: 84
    SolutionNameMin: Cijk_Ailk_Bjlk_HSS_BH_MT128x96x64_MI32x32x8x1_SE_1LDSB0_AF0EM8_GRVW8_GSU1_NLCA1_NLCB3_SU0_SUS0_SRVW4_TT1_96_VAW2_WG128_2_1_WGM2
    SolutionIndex: 85
    SolutionNameMin: Cijk_Ailk_Bjlk_HSS_BH_MT128x128x64_MI32x32x8x1_SE_1LDSB0_AF0EM8_GRVW4_GSU1_NLCA1_NLCB1_SU32_SUS256_SRVW4_TT2_64_VAW2_WG64_4_1_WGM1
    SolutionIndex: 86
    SolutionNameMin: Cijk_Ailk_Bjlk_HSS_BH_MT128x128x64_MI32x32x8x1_SE_1LDSB0_AF0EM8_GRVW8_GSU1_NLCA1_NLCB1_SU0_SUS0_SRVW4_TT2_64_VAW2_WG64_4_1_WGM2
    SolutionIndex: 87
    SolutionNameMin: Cijk_Ailk_Bjlk_HSS_BH_MT128x256x32_MI32x32x8x1_SE_1LDSB0_AF0EM4_GRVW4_GSU1_NLCA1_NLCB1_SU16_SUS128_SRVW4_TT2_128_VAW2_WG64_4_1_WGM1
    SolutionIndex: 88
    SolutionNameMin: Cijk_Ailk_Bjlk_HSS_BH_MT128x96x64_MI32x32x8x1_SE_1LDSB0_AF0EM4_GRVW8_GSU1_NLCA1_NLCB3_SU0_SUS0_SRVW4_TT1_96_VAW2_WG128_2_1_WGM1
    SolutionIndex: 89
    SolutionNameMin: Cijk_Ailk_Bjlk_HSS_BH_MT128x128x64_MI32x32x8x1_SE_1LDSB0_AF0EM8_GRVW4_GSU1_NLCA1_NLCB1_SU0_SUS0_SRVW4_TT2_64_VAW2_WG64_4_1_WGM1
    SolutionIndex: 90
    SolutionNameMin: Cijk_Ailk_Bjlk_HSS_BH_MT128x256x32_MI32x32x8x1_SE_1LDSB0_AF0EM8_GRVW8_GSU1_NLCA1_NLCB1_SU0_SUS0_SRVW4_TT2_128_VAW2_WG64_4_1_WGM15
    SolutionIndex: 91
    SolutionNameMin: Cijk_Ailk_Bjlk_HSS_BH_MT128x96x64_MI32x32x8x1_SE_1LDSB0_AF0EM4_GRVW8_GSU1_NLCA1_NLCB3_SU32_SUS256_SRVW4_TT1_96_VAW2_WG128_2_1_WGM15
    SolutionIndex: 92
    SolutionNameMin: Cijk_Ailk_Bjlk_HSS_BH_MT128x96x32_MI32x32x8x1_SE_1LDSB0_AF0EM4_GRVW4_GSU1_NLCA1_NLCB3_SU0_SUS0_SRVW4_TT1_96_VAW2_WG128_2_1_WGM15
    SolutionIndex: 93
    SolutionNameMin: Cijk_Ailk_Bjlk_HSS_BH_MT128x160x32_MI32x32x8x1_SE_1LDSB0_AF0EM8_GRVW4_GSU1_NLCA1_NLCB5_SU32_SUS128_SRVW4_TT1_160_VAW2_WG128_2_1_WGM15
    SolutionIndex: 94
    SolutionNameMin: Cijk_Ailk_Bjlk_HSS_BH_MT128x288x32_MI32x32x8x1_SE_1LDSB0_AF0EM4_GRVW4_GSU1_NLCA1_NLCB9_SU0_SUS0_SRVW4_TT1_288_VAW2_WG128_2_1_WGM2
    SolutionIndex: 95
    SolutionNameMin: Cijk_Ailk_Bjlk_HSS_BH_MT256x128x32_MI32x32x8x1_SE_1LDSB0_AF0EM1_GRVW8_GSU1_NLCA1_NLCB1_SU0_SUS0_SRVW0_TT4_64_VAW2_WG64_4_1_WGM15
    SolutionIndex: 96
    SolutionNameMin: Cijk_Ailk_Bjlk_HSS_BH_MT160x256x32_MI32x32x8x1_SE_1LDSB0_AF0EM8_GRVW4_GSU1_NLCA5_NLCB1_SU0_SUS0_SRVW0_TT5_64_VAW2_WG32_8_1_WGM2
    SolutionIndex: 97
    SolutionNameMin: Cijk_Ailk_Bjlk_HSS_BH_MT128x288x32_MI32x32x8x1_SE_1LDSB0_AF0EM8_GRVW4_GSU1_NLCA1_NLCB9_SU32_SUS128_SRVW4_TT1_288_VAW2_WG128_2_1_WGM2
    SolutionIndex: 98
    SolutionNameMin: Cijk_Ailk_Bjlk_HSS_BH_MT128x288x32_MI32x32x8x1_SE_1LDSB0_AF0EM4_GRVW4_GSU1_NLCA1_NLCB9_SU32_SUS128_SRVW4_TT1_288_VAW2_WG128_2_1_WGM15
    SolutionIndex: 99
    SolutionNameMin: Cijk_Ailk_Bjlk_HSS_BH_MT16x16x64_MI16x16x16x1_SE_1LDSB0_AF0EM1_GRVW4_GSU7_NLCA1_NLCB1_SU0_SUS0_SRVW0_TT1_16_VAW1_WG16_4_1_WGM15
    SolutionIndex: 100
    SolutionNameMin: Cijk_Ailk_Bjlk_HSS_BH_MT64x16x32_MI16x16x16x1_SE_1LDSB0_AF0EM8_GRVW8_GSU1_NLCA1_NLCB1_SU0_SUS0_SRVW0_TT1_16_VAW2_WG64_4_1_WGM2
    SolutionIndex: 101
    SolutionNameMin: Cijk_Ailk_Bjlk_HSS_BH_MT32x32x32_MI16x16x16x1_SE_1LDSB0_AF0EM8_GRVW2_GSU1_NLCA1_NLCB1_SU0_SUS0_SRVW4_TT1_16_VAW2_WG32_8_1_WGM1
    SolutionIndex: 102
    SolutionNameMin: Cijk_Ailk_Bjlk_HSS_BH_MT64x16x32_MI16x16x16x1_SE_1LDSB0_AF0EM8_GRVW2_GSU7_NLCA1_NLCB1_SU0_SUS0_SRVW0_TT1_16_VAW1_WG64_4_1_WGM2
    SolutionIndex: 103
    SolutionNameMin: Cijk_Ailk_Bjlk_HSS_BH_MT64x16x64_MI16x16x16x1_SE_1LDSB0_AF0EM8_GRVW2_GSU7_NLCA1_NLCB1_SU0_SUS0_SRVW4_TT1_16_VAW1_WG64_4_1_WGM1
    SolutionIndex: 104
    SolutionNameMin: Cijk_Ailk_Bjlk_HSS_BH_MT32x32x32_MI16x16x16x1_SE_1LDSB0_AF0EM4_GRVW8_GSU1_NLCA1_NLCB1_SU0_SUS0_SRVW0_TT1_16_VAW2_WG32_8_1_WGM15
    SolutionIndex: 105
    SolutionNameMin: Cijk_Ailk_Bjlk_HSS_BH_MT16x16x16_MI16x16x16x1_SE_1LDSB0_AF0EM1_GRVW8_GSU1_NLCA1_NLCB1_SU0_SUS0_SRVW4_TT1_16_VAW2_WG16_4_1_WGM1
    SolutionIndex: 106
    SolutionNameMin: Cijk_Ailk_Bjlk_HSS_BH_MT16x16x16_MI16x16x16x1_SE_1LDSB0_AF0EM8_GRVW2_GSU1_NLCA1_NLCB1_SU0_SUS0_SRVW0_TT1_16_VAW2_WG16_4_1_WGM1
    SolutionIndex: 107
    SolutionNameMin: Cijk_Ailk_Bjlk_HSS_BH_MT64x16x32_MI16x16x16x1_SE_1LDSB0_AF0EM8_GRVW4_GSU1_NLCA1_NLCB1_SU0_SUS0_SRVW0_TT1_16_VAW2_WG64_4_1_WGM15
    SolutionIndex: 108
    SolutionNameMin: Cijk_Ailk_Bjlk_HSS_BH_MT32x64x16_MI16x16x16x1_SE_1LDSB0_AF0EM4_GRVW2_GSU1_NLCA1_NLCB1_SU0_SUS0_SRVW0_TT1_32_VAW2_WG32_8_1_WGM1
    SolutionIndex: 109
    SolutionNameMin: Cijk_Ailk_Bjlk_HSS_BH_MT32x32x16_MI16x16x16x1_SE_1LDSB0_AF0EM4_GRVW4_GSU1_NLCA1_NLCB1_SU0_SUS0_SRVW0_TT1_16_VAW2_WG32_8_1_WGM15
    SolutionIndex: 110
    SolutionNameMin: Cijk_Ailk_Bjlk_HSS_BH_MT64x32x16_MI16x16x16x1_SE_1LDSB0_AF0EM4_GRVW2_GSU1_NLCA1_NLCB1_SU0_SUS0_SRVW0_TT2_16_VAW2_WG32_8_1_WGM1
    SolutionIndex: 111
    SolutionNameMin: Cijk_Ailk_Bjlk_HSS_BH_MT32x32x16_MI16x16x16x1_SE_1LDSB0_AF0EM4_GRVW4_GSU1_NLCA1_NLCB1_SU0_SUS0_SRVW0_TT1_16_VAW2_WG32_8_1_WGM1
    SolutionIndex: 112
    SolutionNameMin: Cijk_Ailk_Bjlk_HSS_BH_MT32x32x16_MI16x16x16x1_SE_1LDSB0_AF0EM4_GRVW8_GSU1_NLCA1_NLCB1_SU0_SUS0_SRVW0_TT1_16_VAW2_WG32_8_1_WGM2
    SolutionIndex: 113
    SolutionNameMin: Cijk_Ailk_Bjlk_HSS_BH_MT64x32x16_MI16x16x16x1_SE_1LDSB0_AF0EM4_GRVW2_GSU1_NLCA1_NLCB1_SU16_SUS128_SRVW0_TT2_16_VAW2_WG32_8_1_WGM1
    SolutionIndex: 114
    SolutionNameMin: Cijk_Ailk_Bjlk_HSS_BH_MT32x64x16_MI16x16x16x1_SE_1LDSB0_AF0EM4_GRVW2_GSU1_NLCA1_NLCB1_SU0_SUS0_SRVW0_TT1_32_VAW2_WG32_8_1_WGM2
    SolutionIndex: 115
    SolutionNameMin: Cijk_Ailk_Bjlk_HSS_BH_MT64x32x16_MI16x16x16x1_SE_1LDSB0_AF0EM8_GRVW2_GSU1_NLCA1_NLCB1_SU0_SUS0_SRVW4_TT2_16_VAW2_WG32_8_1_WGM2
    SolutionIndex: 116
    SolutionNameMin: Cijk_Ailk_Bjlk_HSS_BH_MT64x32x16_MI16x16x16x1_SE_1LDSB0_AF0EM8_GRVW2_GSU1_NLCA1_NLCB1_SU0_SUS0_SRVW4_TT2_16_VAW2_WG32_8_1_WGM1
    SolutionIndex: 117
    SolutionNameMin: Cijk_Ailk_Bjlk_HSS_BH_MT32x64x16_MI16x16x16x1_SE_1LDSB0_AF0EM4_GRVW2_GSU1_NLCA1_NLCB1_SU0_SUS0_SRVW0_TT1_32_VAW2_WG32_8_1_WGM15
    SolutionIndex: 118
    SolutionNameMin: Cijk_Ailk_Bjlk_HSS_BH_MT64x32x16_MI16x16x16x1_SE_1LDSB0_AF0EM4_GRVW2_GSU1_NLCA1_NLCB1_SU32_SUS128_SRVW0_TT2_16_VAW2_WG32_8_1_WGM1
    SolutionIndex: 119
    SolutionNameMin: Cijk_Ailk_Bjlk_HSS_BH_MT64x32x16_MI16x16x16x1_SE_1LDSB1_AF0EM8_GRVW2_GSU1_NLCA1_NLCB1_SU0_SUS0_SRVW4_TT2_16_VAW2_WG32_8_1_WGM15
    SolutionIndex: 120
    SolutionNameMin: Cijk_Ailk_Bjlk_HSS_BH_MT64x32x16_MI16x16x16x1_SE_1LDSB1_AF0EM8_GRVW2_GSU1_NLCA1_NLCB1_SU0_SUS0_SRVW4_TT2_16_VAW2_WG32_8_1_WGM1
    SolutionIndex: 121
    SolutionNameMin: Cijk_Ailk_Bjlk_HSS_BH_MT64x32x16_MI16x16x16x1_SE_1LDSB0_AF0EM4_GRVW2_GSU1_NLCA1_NLCB1_SU16_SUS128_SRVW0_TT2_16_VAW2_WG32_8_1_WGM15
    SolutionIndex: 122
    SolutionNameMin: Cijk_Ailk_Bjlk_HSS_BH_MT64x32x16_MI16x16x16x1_SE_1LDSB0_AF0EM4_GRVW4_GSU1_NLCA1_NLCB1_SU0_SUS0_SRVW4_TT2_16_VAW2_WG32_8_1_WGM1
    SolutionIndex: 123
    SolutionNameMin: Cijk_Ailk_Bjlk_HSS_BH_MT64x32x16_MI16x16x16x1_SE_1LDSB0_AF0EM4_GRVW2_GSU1_NLCA1_NLCB1_SU0_SUS0_SRVW4_TT2_16_VAW2_WG32_8_1_WGM1
    SolutionIndex: 124
    SolutionNameMin: Cijk_Ailk_Bjlk_HSS_BH_MT64x32x16_MI16x16x16x1_SE_1LDSB1_AF0EM8_GRVW2_GSU1_NLCA1_NLCB1_SU0_SUS0_SRVW4_TT2_16_VAW2_WG32_8_1_WGM2
    SolutionIndex: 125
    SolutionNameMin: Cijk_Ailk_Bjlk_HSS_BH_MT64x32x16_MI16x16x16x1_SE_1LDSB0_AF0EM8_GRVW4_GSU1_NLCA1_NLCB1_SU0_SUS0_SRVW4_TT2_16_VAW2_WG32_8_1_WGM1
    SolutionIndex: 126
    SolutionNameMin: Cijk_Ailk_Bjlk_HSS_BH_MT32x32x16_MI16x16x16x1_SE_1LDSB0_AF0EM8_GRVW8_GSU1_NLCA1_NLCB1_SU0_SUS0_SRVW4_TT1_16_VAW2_WG32_8_1_WGM2
    SolutionIndex: 127
    SolutionNameMin: Cijk_Ailk_Bjlk_HSS_BH_MT32x32x16_MI16x16x16x1_SE_1LDSB0_AF0EM4_GRVW2_GSU1_NLCA1_NLCB1_SU0_SUS0_SRVW0_TT1_16_VAW2_WG32_8_1_WGM1
    SolutionIndex: 128
    SolutionNameMin: Cijk_Ailk_Bjlk_HSS_BH_MT16x16x16_MI16x16x16x1_SE_1LDSB0_AF0EM1_GRVW4_GSU1_NLCA1_NLCB1_SU0_SUS0_SRVW0_TT1_16_VAW2_WG16_4_1_WGM2
    SolutionIndex: 129
    SolutionNameMin: Cijk_Ailk_Bjlk_HSS_BH_MT64x32x16_MI16x16x16x1_SE_1LDSB0_AF0EM4_GRVW2_GSU1_NLCA1_NLCB1_SU16_SUS256_SRVW0_TT2_16_VAW2_WG32_8_1_WGM2
    SolutionIndex: 130
    SolutionNameMin: Cijk_Ailk_Bjlk_HSS_BH_MT32x32x16_MI16x16x16x1_SE_1LDSB0_AF0EM4_GRVW8_GSU1_NLCA1_NLCB1_SU0_SUS0_SRVW0_TT1_16_VAW2_WG32_8_1_WGM1
    SolutionIndex: 131
    SolutionNameMin: Cijk_Ailk_Bjlk_HSS_BH_MT64x32x16_MI16x16x16x1_SE_1LDSB0_AF0EM4_GRVW4_GSU1_NLCA1_NLCB1_SU16_SUS128_SRVW4_TT2_16_VAW2_WG32_8_1_WGM1
    SolutionIndex: 132
    SolutionNameMin: Cijk_Ailk_Bjlk_HSS_BH_MT64x32x16_MI16x16x16x1_SE_1LDSB1_AF0EM8_GRVW4_GSU1_NLCA1_NLCB1_SU0_SUS0_SRVW4_TT2_16_VAW2_WG32_8_1_WGM2
    SolutionIndex: 133
    SolutionNameMin: Cijk_Ailk_Bjlk_HSS_BH_MT64x64x16_MI32x32x8x1_SE_1LDSB0_AF0EM4_GRVW2_GSU1_NLCA1_NLCB1_SU0_SUS0_SRVW4_TT1_32_VAW2_WG64_4_1_WGM15
    SolutionIndex: 134
    SolutionNameMin: Cijk_Ailk_Bjlk_HSS_BH_MT64x16x32_MI16x16x16x1_SE_1LDSB0_AF0EM8_GRVW8_GSU15_NLCA1_NLCB1_SU0_SUS0_SRVW0_TT1_16_VAW1_WG64_4_1_WGM15
    SolutionIndex: 135
    SolutionNameMin: Cijk_Ailk_Bjlk_HSS_BH_MT64x128x16_MI32x32x8x1_SE_1LDSB0_AF0EM1_GRVW2_GSU1_NLCA1_NLCB1_SU0_SUS0_SRVW4_TT1_64_VAW2_WG64_4_1_WGM2
    SolutionIndex: 136
    SolutionNameMin: Cijk_Ailk_Bjlk_HSS_BH_MT64x16x32_MI16x16x16x1_SE_1LDSB0_AF0EM8_GRVW8_GSU15_NLCA1_NLCB1_SU0_SUS0_SRVW0_TT1_16_VAW1_WG64_4_1_WGM2
    SolutionIndex: 137
    SolutionNameMin: Cijk_Ailk_Bjlk_HSS_BH_MT256x160x32_MI32x32x8x1_SE_1LDSB0_AF0EM8_GRVW4_GSU1_NLCA1_NLCB5_SU0_SUS0_SRVW4_TT2_160_VAW2_WG128_2_1_WGM15
    SolutionIndex: 138
    SolutionNameMin: Cijk_Ailk_Bjlk_HSS_BH_MT64x16x32_MI16x16x16x1_SE_1LDSB0_AF0EM8_GRVW2_GSU15_NLCA1_NLCB1_SU0_SUS0_SRVW0_TT1_16_VAW1_WG64_4_1_WGM2
    SolutionIndex: 139
    SolutionNameMin: Cijk_Ailk_Bjlk_HSS_BH_MT16x16x32_MI16x16x16x1_SE_1LDSB0_AF0EM1_GRVW4_GSU15_NLCA1_NLCB1_SU0_SUS0_SRVW0_TT1_16_VAW1_WG16_4_1_WGM1
    SolutionIndex: 140
    SolutionNameMin: Cijk_Ailk_Bjlk_HSS_BH_MT64x64x64_MI32x32x8x1_SE_1LDSB0_AF0EM8_GRVW8_GSU15_NLCA1_NLCB1_SU0_SUS0_SRVW0_TT1_32_VAW1_WG64_4_1_WGM1
    SolutionIndex: 141
    SolutionNameMin: Cijk_Ailk_Bjlk_HSS_BH_MT128x256x32_MI32x32x8x1_SE_1LDSB0_AF0EM1_GRVW8_GSU7_NLCA1_NLCB1_SU32_SUS128_SRVW0_TT2_128_VAW1_WG64_4_1_WGM2
    SolutionIndex: 142
    SolutionNameMin: Cijk_Ailk_Bjlk_HSS_BH_MT128x128x32_MI32x32x8x1_SE_1LDSB0_AF0EM8_GRVW8_GSU15_NLCA1_NLCB1_SU0_SUS0_SRVW0_TT2_64_VAW1_WG64_4_1_WGM1
    SolutionIndex: 143
    SolutionNameMin: Cijk_Ailk_Bjlk_HSS_BH_MT128x128x64_MI32x32x8x1_SE_1LDSB0_AF0EM8_GRVW8_GSU3_NLCA1_NLCB1_SU0_SUS0_SRVW0_TT2_64_VAW1_WG64_4_1_WGM1
    SolutionIndex: 144
    SolutionNameMin: Cijk_Ailk_Bjlk_HSS_BH_MT256x128x32_MI32x32x8x1_SE_1LDSB0_AF0EM8_GRVW8_GSU3_NLCA1_NLCB1_SU0_SUS0_SRVW0_TT4_64_VAW1_WG64_4_1_WGM1
    SolutionIndex: 145
    SolutionNameMin: Cijk_Ailk_Bjlk_HSS_BH_MT128x256x32_MI32x32x8x1_SE_1LDSB0_AF0EM8_GRVW8_GSU3_NLCA1_NLCB1_SU0_SUS0_SRVW0_TT2_128_VAW1_WG64_4_1_WGM1
    SolutionIndex: 146
    SolutionNameMin: Cijk_Ailk_Bjlk_HSS_BH_MT128x256x32_MI32x32x8x1_SE_1LDSB0_AF0EM8_GRVW8_GSU3_NLCA1_NLCB1_SU0_SUS0_SRVW0_TT2_128_VAW1_WG64_4_1_WGM15
    SolutionIndex: 147
    SolutionNameMin: Cijk_Ailk_Bjlk_HSS_BH_MT256x128x32_MI32x32x8x1_SE_1LDSB0_AF0EM8_GRVW8_GSU3_NLCA1_NLCB1_SU0_SUS0_SRVW0_TT4_64_VAW1_WG64_4_1_WGM15
    SolutionIndex: 148
    SolutionNameMin: Cijk_Ailk_Bjlk_HSS_BH_MT32x64x16_MI16x16x16x1_SE_1LDSB1_AF0EM1_GRVW2_GSU1_NLCA1_NLCB1_SU32_SUS256_SRVW4_TT1_32_VAW2_WG32_8_1_WGM15
    SolutionIndex: 149
    SolutionNameMin: Cijk_Ailk_Bjlk_HSS_BH_MT32x64x16_MI16x16x16x1_SE_1LDSB0_AF0EM1_GRVW2_GSU1_NLCA1_NLCB1_SU0_SUS0_SRVW4_TT1_32_VAW2_WG32_8_1_WGM1
    SolutionIndex: 150
    SolutionNameMin: Cijk_Ailk_Bjlk_HSS_BH_MT32x64x16_MI16x16x16x1_SE_1LDSB0_AF0EM1_GRVW2_GSU1_NLCA1_NLCB1_SU32_SUS128_SRVW4_TT1_32_VAW2_WG32_8_1_WGM15
    SolutionIndex: 151
    SolutionNameMin: Cijk_Ailk_Bjlk_HSS_BH_MT32x64x16_MI16x16x16x1_SE_1LDSB0_AF0EM1_GRVW8_GSU1_NLCA1_NLCB1_SU0_SUS0_SRVW4_TT1_32_VAW2_WG32_8_1_WGM1
    SolutionIndex: 152
    SolutionNameMin: Cijk_Ailk_Bjlk_HSS_BH_MT32x64x16_MI16x16x16x1_SE_1LDSB0_AF0EM1_GRVW8_GSU1_NLCA1_NLCB1_SU16_SUS128_SRVW4_TT1_32_VAW2_WG32_8_1_WGM2
    SolutionIndex: 153
    SolutionNameMin: Cijk_Ailk_Bjlk_HSS_BH_MT32x64x16_MI16x16x16x1_SE_1LDSB0_AF0EM1_GRVW2_GSU1_NLCA1_NLCB1_SU16_SUS256_SRVW4_TT1_32_VAW2_WG32_8_1_WGM2
    SolutionIndex: 154
    SolutionNameMin: Cijk_Ailk_Bjlk_HSS_BH_MT32x32x64_MI16x16x16x1_SE_1LDSB0_AF0EM1_GRVW8_GSU1_NLCA1_NLCB1_SU0_SUS0_SRVW0_TT1_16_VAW2_WG32_8_1_WGM2
    SolutionIndex: 155
    SolutionNameMin: Cijk_Ailk_Bjlk_HSS_BH_MT32x64x16_MI16x16x16x1_SE_1LDSB0_AF0EM1_GRVW2_GSU1_NLCA1_NLCB1_SU0_SUS0_SRVW0_TT1_32_VAW2_WG32_8_1_WGM1
    SolutionIndex: 156
    SolutionNameMin: Cijk_Ailk_Bjlk_HSS_BH_MT32x32x16_MI16x16x16x1_SE_1LDSB0_AF0EM1_GRVW2_GSU1_NLCA1_NLCB1_SU0_SUS0_SRVW0_TT1_16_VAW2_WG32_8_1_WGM1
    SolutionIndex: 157
    SolutionNameMin: Cijk_Ailk_Bjlk_HSS_BH_MT128x128x64_MI32x32x8x1_SE_1LDSB0_AF0EM8_GRVW8_GSU5_NLCA1_NLCB1_SU0_SUS0_SRVW0_TT2_64_VAW1_WG64_4_1_WGM1
    SolutionIndex: 158
    SolutionNameMin: Cijk_Ailk_Bjlk_HSS_BH_MT256x128x32_MI32x32x8x1_SE_1LDSB0_AF0EM8_GRVW8_GSU5_NLCA1_NLCB1_SU0_SUS0_SRVW0_TT4_64_VAW1_WG64_4_1_WGM1
    SolutionIndex: 159
    SolutionNameMin: Cijk_Ailk_Bjlk_HSS_BH_MT128x128x64_MI32x32x8x1_SE_1LDSB0_AF0EM8_GRVW8_GSU2_NLCA1_NLCB1_SU0_SUS0_SRVW0_TT2_64_VAW1_WG64_4_1_WGM15
    SolutionIndex: 160
    SolutionNameMin: Cijk_Ailk_Bjlk_HSS_BH_MT256x160x32_MI32x32x8x1_SE_1LDSB0_AF0EM8_GRVW4_GSU2_NLCA1_NLCB5_SU0_SUS0_SRVW0_TT2_160_VAW1_WG128_2_1_WGM15
    SolutionIndex: 161
    SolutionNameMin: Cijk_Ailk_Bjlk_HSS_BH_MT256x256x16_MI32x32x8x1_SE_1LDSB0_AF0EM8_GRVW8_GSU3_NLCA1_NLCB1_SU0_SUS0_SRVW0_TT4_128_VAW1_WG64_4_1_WGM1
    SolutionIndex: 162
    SolutionNameMin: Cijk_Ailk_Bjlk_HSS_BH_MT128x96x32_MI32x32x8x1_SE_1LDSB0_AF0EM4_GRVW4_GSU1_NLCA1_NLCB3_SU32_SUS128_SRVW4_TT1_96_VAW2_WG128_2_1_WGM2
    SolutionIndex: 163
    SolutionNameMin: Cijk_Ailk_Bjlk_HSS_BH_MT128x256x32_MI32x32x8x1_SE_1LDSB0_AF0EM4_GRVW4_GSU1_NLCA1_NLCB1_SU0_SUS0_SRVW4_TT2_128_VAW2_WG64_4_1_WGM15
    SolutionIndex: 164
    SolutionNameMin: Cijk_Ailk_Bjlk_HSS_BH_MT128x288x32_MI32x32x8x1_SE_1LDSB0_AF0EM8_GRVW4_GSU1_NLCA1_NLCB9_SU0_SUS0_SRVW4_TT1_288_VAW2_WG128_2_1_WGM2
    SolutionIndex: 165
    SolutionNameMin: Cijk_Ailk_Bjlk_HSS_BH_MT128x288x32_MI32x32x8x1_SE_1LDSB0_AF0EM4_GRVW4_GSU1_NLCA1_NLCB9_SU32_SUS256_SRVW4_TT1_288_VAW2_WG128_2_1_WGM15
    SolutionIndex: 166
    SolutionNameMin: Cijk_Ailk_Bjlk_HSS_BH_MT256x256x16_MI32x32x8x1_SE_1LDSB0_AF0EM4_GRVW4_GSU1_NLCA1_NLCB1_SU16_SUS256_SRVW0_TT4_128_VAW2_WG64_4_1_WGM1
    SolutionIndex: 167
    SolutionNameMin: Cijk_Ailk_Bjlk_HSS_BH_MT64x64x32_MI32x32x8x1_SE_1LDSB0_AF0EM1_GRVW8_GSU1_NLCA1_NLCB1_SU0_SUS0_SRVW4_TT1_32_VAW2_WG64_4_1_WGM1
    SolutionIndex: 168
    SolutionNameMin: Cijk_Ailk_Bjlk_HSS_BH_MT64x64x128_MI32x32x8x1_SE_1LDSB0_AF0EM1_GRVW8_GSU1_NLCA1_NLCB1_SU32_SUS256_SRVW4_TT1_32_VAW2_WG64_4_1_WGM1
    SolutionIndex: 169
    SolutionNameMin: Cijk_Ailk_Bjlk_HSS_BH_MT96x128x64_MI32x32x8x1_SE_1LDSB0_AF0EM8_GRVW8_GSU5_NLCA3_NLCB1_SU32_SUS256_SRVW0_TT3_32_VAW1_WG32_8_1_WGM2
    SolutionIndex: 170
    SolutionNameMin: Cijk_Ailk_Bjlk_HSS_BH_MT64x128x32_MI32x32x8x1_SE_1LDSB0_AF0EM1_GRVW8_GSU1_NLCA1_NLCB1_SU32_SUS256_SRVW4_TT1_64_VAW2_WG64_4_1_WGM15
    SolutionIndex: 171
    SolutionNameMin: Cijk_Ailk_Bjlk_HSS_BH_MT96x128x16_MI32x32x8x1_SE_1LDSB0_AF0EM8_GRVW2_GSU1_NLCA3_NLCB1_SU0_SUS0_SRVW0_TT3_32_VAW2_WG32_8_1_WGM2
    SolutionIndex: 172
    SolutionNameMin: Cijk_Ailk_Bjlk_HSS_BH_MT64x128x16_MI32x32x8x1_SE_1LDSB0_AF0EM8_GRVW8_GSU1_NLCA1_NLCB1_SU0_SUS0_SRVW4_TT1_64_VAW2_WG64_4_1_WGM15
    SolutionIndex: 173
    SolutionNameMin: Cijk_Ailk_Bjlk_HSS_BH_MT128x128x64_MI32x32x8x1_SE_1LDSB0_AF0EM8_GRVW8_GSU3_NLCA1_NLCB1_SU32_SUS256_SRVW0_TT2_64_VAW1_WG64_4_1_WGM15
    SolutionIndex: 174
    SolutionNameMin: Cijk_Ailk_Bjlk_HSS_BH_MT128x128x64_MI32x32x8x1_SE_1LDSB0_AF0EM8_GRVW8_GSU3_NLCA1_NLCB1_SU0_SUS0_SRVW0_TT2_64_VAW1_WG64_4_1_WGM2
    SolutionIndex: 175
    SolutionNameMin: Cijk_Ailk_Bjlk_HSS_BH_MT256x128x32_MI32x32x8x1_SE_1LDSB0_AF0EM8_GRVW8_GSU15_NLCA1_NLCB1_SU0_SUS0_SRVW0_TT4_64_VAW1_WG64_4_1_WGM1
    SolutionIndex: 176
    SolutionNameMin: Cijk_Ailk_Bjlk_HSS_BH_MT128x256x32_MI32x32x8x1_SE_1LDSB0_AF0EM8_GRVW8_GSU3_NLCA1_NLCB1_SU0_SUS0_SRVW0_TT2_128_VAW1_WG64_4_1_WGM2
    SolutionIndex: 177
    SolutionNameMin: Cijk_Ailk_Bjlk_HSS_BH_MT64x128x32_MI32x32x8x1_SE_1LDSB0_AF0EM8_GRVW8_GSU1_NLCA1_NLCB1_SU0_SUS0_SRVW4_TT1_64_VAW2_WG64_4_1_WGM2
    SolutionIndex: 178
    SolutionNameMin: Cijk_Ailk_Bjlk_HSS_BH_MT64x128x32_MI32x32x8x1_SE_1LDSB0_AF0EM8_GRVW8_GSU1_NLCA1_NLCB1_SU32_SUS256_SRVW4_TT1_64_VAW2_WG64_4_1_WGM1
    SolutionIndex: 179
    SolutionNameMin: Cijk_Ailk_Bjlk_HSS_BH_MT64x128x16_MI32x32x8x1_SE_1LDSB0_AF0EM8_GRVW4_GSU1_NLCA1_NLCB1_SU0_SUS0_SRVW4_TT1_64_VAW2_WG64_4_1_WGM2
    SolutionIndex: 180
    SolutionNameMin: Cijk_Ailk_Bjlk_HSS_BH_MT256x128x32_MI32x32x8x1_SE_1LDSB0_AF0EM8_GRVW8_GSU3_NLCA1_NLCB1_SU32_SUS256_SRVW0_TT4_64_VAW1_WG64_4_1_WGM1
    SolutionIndex: 181
    SolutionNameMin: Cijk_Ailk_Bjlk_HSS_BH_MT256x160x32_MI32x32x8x1_SE_1LDSB0_AF0EM8_GRVW4_GSU2_NLCA1_NLCB5_SU0_SUS0_SRVW0_TT2_160_VAW1_WG128_2_1_WGM2
    SolutionIndex: 182
    SolutionNameMin: Cijk_Ailk_Bjlk_HSS_BH_MT256x144x32_MI16x16x16x1_SE_1LDSB0_AF0EM4_GRVW2_GSU1_NLCA2_NLCB9_SU0_SUS0_SRVW4_TT4_144_VAW2_WG64_4_1_WGM15
    SolutionIndex: 183
    SolutionNameMin: Cijk_Ailk_Bjlk_HSS_BH_MT64x32x16_MI16x16x16x1_SE_1LDSB0_AF0EM1_GRVW2_GSU1_NLCA1_NLCB1_SU0_SUS0_SRVW4_TT2_16_VAW2_WG32_8_1_WGM2
    SolutionIndex: 184
    SolutionNameMin: Cijk_Ailk_Bjlk_HSS_BH_MT64x16x32_MI16x16x16x1_SE_1LDSB0_AF0EM8_GRVW8_GSU15_NLCA1_NLCB1_SU0_SUS0_SRVW4_TT1_16_VAW1_WG64_4_1_WGM1
    SolutionIndex: 185
    SolutionNameMin: Cijk_Ailk_Bjlk_HSS_BH_MT64x256x16_MI32x32x8x1_SE_1LDSB0_AF0EM1_GRVW8_GSU1_NLCA1_NLCB1_SU0_SUS0_SRVW4_TT1_128_VAW2_WG64_4_1_WGM15
    SolutionIndex: 186
    SolutionNameMin: Cijk_Ailk_Bjlk_HSS_BH_MT64x128x16_MI32x32x8x1_SE_1LDSB0_AF0EM1_GRVW8_GSU1_NLCA1_NLCB1_SU0_SUS0_SRVW4_TT1_64_VAW2_WG64_4_1_WGM1
    SolutionIndex: 187
    SolutionNameMin: Cijk_Ailk_Bjlk_HSS_BH_MT64x128x32_MI32x32x8x1_SE_1LDSB0_AF0EM4_GRVW8_GSU1_NLCA1_NLCB1_SU0_SUS0_SRVW4_TT1_64_VAW2_WG64_4_1_WGM15
    SolutionIndex: 188
    SolutionNameMin: Cijk_Ailk_Bjlk_HSS_BH_MT64x128x16_MI32x32x8x1_SE_1LDSB0_AF0EM1_GRVW8_GSU1_NLCA1_NLCB1_SU32_SUS256_SRVW4_TT1_64_VAW2_WG64_4_1_WGM15
    SolutionIndex: 189
    SolutionNameMin: Cijk_Ailk_Bjlk_HSS_BH_MT64x64x16_MI32x32x8x1_SE_1LDSB0_AF0EM1_GRVW4_GSU1_NLCA1_NLCB1_SU0_SUS0_SRVW4_TT1_32_VAW2_WG64_4_1_WGM2
    SolutionIndex: 190
    SolutionNameMin: Cijk_Ailk_Bjlk_HSS_BH_MT64x32x16_MI16x16x16x1_SE_1LDSB0_AF0EM1_GRVW4_GSU1_NLCA1_NLCB1_SU0_SUS0_SRVW4_TT2_16_VAW2_WG32_8_1_WGM1
    SolutionIndex: 191
    SolutionNameMin: Cijk_Ailk_Bjlk_HSS_BH_MT64x128x16_MI32x32x8x1_SE_1LDSB0_AF0EM1_GRVW8_GSU1_NLCA1_NLCB1_SU16_SUS256_SRVW4_TT1_64_VAW2_WG64_4_1_WGM2
    SolutionIndex: 192
    SolutionNameMin: Cijk_Ailk_Bjlk_HSS_BH_MT64x64x32_MI32x32x8x1_SE_1LDSB0_AF0EM4_GRVW8_GSU1_NLCA1_NLCB1_SU16_SUS256_SRVW4_TT1_32_VAW2_WG64_4_1_WGM15
    SolutionIndex: 193
    SolutionNameMin: Cijk_Ailk_Bjlk_HSS_BH_MT32x32x64_MI16x16x16x1_SE_1LDSB0_AF0EM1_GRVW8_GSU1_NLCA1_NLCB1_SU0_SUS0_SRVW4_TT1_16_VAW2_WG32_8_1_WGM2
    SolutionIndex: 194
    SolutionNameMin: Cijk_Ailk_Bjlk_HSS_BH_MT64x256x16_MI32x32x8x1_SE_1LDSB0_AF0EM1_GRVW8_GSU1_NLCA1_NLCB1_SU0_SUS0_SRVW4_TT1_128_VAW2_WG64_4_1_WGM1
    SolutionIndex: 195
    SolutionNameMin: Cijk_Ailk_Bjlk_HSS_BH_MT128x64x32_MI32x32x8x1_SN_1LDSB0_GRVW8_NLCA1_NLCB1_PLR1_SS1_SU0_SUS0_SRVW0_SVW2_TT2_32_VW2_WG64_4_1
    SolutionIndex: 196
    SolutionNameMin: Cijk_Ailk_Bjlk_HSS_BH_MT128x128x32_MI32x32x8x1_SN_1LDSB0_GRVW8_NLCA1_NLCB1_PLR1_SS1_SU32_SUS256_SRVW0_SVW2_TT2_64_VW2_WG64_4_1
    SolutionIndex: 197
    SolutionNameMin: Cijk_Ailk_Bjlk_HSS_BH_MT256x128x32_MI32x32x8x1_SN_1LDSB1_GRVW8_NLCA1_NLCB1_PLR1_SS1_SU0_SUS0_SRVW0_SVW2_TT4_64_VW2_WG64_4_1
    SolutionIndex: 198
    SolutionNameMin: Cijk_Ailk_Bjlk_HSS_BH_MT256x128x32_MI32x32x8x1_SN_1LDSB1_GRVW8_NLCA1_NLCB1_PLR1_SS1_SU0_SUS0_SRVW0_SVW4_TT4_64_VW4_WG64_4_1
    SolutionIndex: 199
    SolutionNameMin: Cijk_Ailk_Bjlk_HSS_BH_MT256x128x32_MI32x32x8x1_SN_1LDSB1_GRVW8_NLCA1_NLCB1_PLR1_SS1_SU32_SUS128_SRVW0_SVW4_TT4_64_VW4_WG64_4_1
    SolutionIndex: 200
    SolutionNameMin: Cijk_Ailk_Bjlk_HSS_BH_MT256x128x32_MI32x32x8x1_SN_1LDSB1_GRVW8_NLCA1_NLCB1_PLR1_SS1_SU32_SUS256_SRVW0_SVW4_TT4_64_VW4_WG64_4_1
    SolutionIndex: 201
    SolutionNameMin: Cijk_Ailk_Bjlk_HSS_BH_MT256x128x32_MI32x32x8x1_SN_1LDSB1_GRVW8_NLCA1_NLCB1_PLR1_SS1_SU32_SUS256_SRVW0_SVW2_TT4_64_VW2_WG64_4_1
    SolutionIndex: 202
    SolutionNameMin: Cijk_Ailk_Bjlk_HSS_BH_MT128x128x32_MI32x32x8x1_SN_1LDSB0_AMAS3_EPS0_IU1_PGR2_SVW2_TT2_64_VW2_WGM16
    SolutionIndex: 203
    SolutionNameMin: Cijk_Ailk_Bjlk_HSS_BH_MT128x128x32_MI32x32x8x1_SN_1LDSB0_AMAS3_EPS0_IU1_PGR2_SVW2_TT2_64_VW2_WGM8
    SolutionIndex: 204
    SolutionNameMin: Cijk_Ailk_Bjlk_HSS_BH_MT128x128x32_MI32x32x8x1_SN_1LDSB0_AMAS0_EPS0_IU1_PGR2_SVW1_TT2_64_VW1_WGM16
    SolutionIndex: 205
    SolutionNameMin: Cijk_Ailk_Bjlk_HSS_BH_MT128x128x32_MI32x32x8x1_SN_1LDSB1_AMAS0_EPS0_IU2_PGR2_SVW1_TT2_64_VW1_WGM32
    SolutionIndex: 206
    SolutionNameMin: Cijk_Ailk_Bjlk_HSS_BH_MT256x256x32_MI32x32x8x1_SN_1LDSB1_AMAS0_EPS1_IU1_PGR1_SVW1_TT4_128_VW1_WGM8
    SolutionIndex: 207
    SolutionNameMin: Cijk_Ailk_Bjlk_HSS_BH_MT256x256x32_MI32x32x8x1_SN_1LDSB0_AMAS3_EPS0_IU2_PGR2_SVW2_TT4_128_VW2_WGM8
    SolutionIndex: 208
    SolutionNameMin: Cijk_Ailk_Bjlk_HSS_BH_MT256x256x32_MI32x32x8x1_SN_1LDSB1_AMAS0_EPS0_IU1_PGR2_SVW1_TT4_128_VW1_WGM4
    SolutionIndex: 209
    SolutionNameMin: Cijk_Ailk_Bjlk_HSS_BH_MT256x256x32_MI32x32x8x1_SN_1LDSB1_AMAS3_EPS0_IU2_PGR2_SVW2_TT4_128_VW2_WGM4
    SolutionIndex: 210
    SolutionNameMin: Cijk_Ailk_Bjlk_HSS_BH_MT256x256x32_MI32x32x8x1_SN_1LDSB1_AMAS0_EPS0_IU1_PGR2_SVW1_TT4_128_VW1_WGM8
    SolutionIndex: 211
    SolutionNameMin: Cijk_Ailk_Bjlk_HSS_BH_MT128x128x32_MI32x32x8x1_SN_1LDSB0_AMAS3_EPS0_FL0_PGR2_SU16_SUM1_SVW2_TT2_64_VW2_WG64_4_1
    SolutionIndex: 212
    SolutionNameMin: Cijk_Ailk_Bjlk_HSS_BH_MT128x128x32_MI32x32x8x1_SN_1LDSB0_AMAS3_EPS0_FL1_PGR2_SU16_SUM0_SVW2_TT2_64_VW2_WG64_4_1
    SolutionIndex: 213
    SolutionNameMin: Cijk_Ailk_Bjlk_HSS_BH_MT128x128x32_MI32x32x8x1_SN_1LDSB0_AMAS3_EPS0_FL2_PGR2_SU32_SUM0_SVW2_TT2_64_VW2_WG64_4_1
    SolutionIndex: 214
    SolutionNameMin: Cijk_Ailk_Bjlk_HSS_BH_MT256x256x32_MI32x32x8x1_SN_1LDSB0_AMAS3_EPS1_FL1_PGR1_SU32_SUM0_SVW2_TT4_128_VW2_WG64_4_1
    SolutionIndex: 215
    SolutionNameMin: Cijk_Ailk_Bjlk_HSS_BH_MT256x256x32_MI32x32x8x1_SN_1LDSB1_AMAS3_EPS0_FL1_PGR2_SU32_SUM0_SVW2_TT4_128_VW2_WG64_4_1
    SolutionIndex: 216
    SolutionNameMin: Cijk_Ailk_Bjlk_HSS_BH_MT256x256x32_MI32x32x8x1_SN_1LDSB1_AMAS0_EPS1_FL0_PGR1_SU16_SUM0_SVW1_TT4_128_VW1_WG64_4_1
    SolutionIndex: 217
    SolutionNameMin: Cijk_Ailk_Bjlk_HSS_BH_MT256x256x32_MI32x32x8x1_SN_1LDSB0_AMAS0_EPS1_FL2_PGR1_SU32_SUM0_SVW1_TT4_128_VW1_WG64_4_1
    SolutionIndex: 218
    SolutionNameMin: Cijk_Ailk_Bjlk_HSS_BH_MT256x256x32_MI32x32x8x1_SN_1LDSB1_AMAS3_EPS0_FL1_PGR2_SU16_SUM0_SVW2_TT4_128_VW2_WG64_4_1
    SolutionIndex: 219
    SolutionNameMin: Cijk_Ailk_Bjlk_HSS_BH_MT256x256x32_MI32x32x8x1_SN_1LDSB1_AMAS0_EPS1_FL2_PGR1_SU16_SUM0_SVW1_TT4_128_VW1_WG64_4_1
    SolutionIndex: 220
    SolutionNameMin: Cijk_Ailk_Bjlk_HSS_BH_MT256x256x32_MI32x32x8x1_SN_1LDSB1_AMAS0_EPS0_FL2_PGR2_SU16_SUM0_SVW1_TT4_128_VW1_WG64_4_1
    SolutionIndex: 221
    SolutionNameMin: Cijk_Ailk_Bjlk_HSS_BH_MT256x256x32_MI16x16x16x1_SN_1LDSB1_AMAS0_EPS0_FL1_PGR2_SU16_SUM0_SVW1_TT8_128_VW1_WG32_8_1
    SolutionIndex: 222
    SolutionNameMin: Cijk_Ailk_Bjlk_HSS_BH_MT256x256x32_MI32x32x8x1_SN_1LDSB1_AMAS0_EPS0_FL0_PGR2_SU16_SUM0_SVW1_TT4_128_VW1_WG64_4_1
    SolutionIndex: 223
    SolutionNameMin: Cijk_Ailk_Bjlk_HSS_BH_MT256x256x32_MI32x32x8x1_SN_1LDSB1_AMAS0_EPS0_FL1_PGR2_SU16_SUM0_SVW1_TT4_128_VW1_WG64_4_1
    SolutionIndex: 224
    SolutionNameMin: Cijk_Ailk_Bjlk_HSS_BH_MT256x256x32_MI32x32x8x1_SN_1LDSB1_AMAS0_EPS0_FL2_PGR2_SU32_SUM0_SVW1_TT4_128_VW1_WG64_4_1
    SolutionIndex: 225
    SolutionNameMin: Cijk_Ailk_Bjlk_HSS_BH_MT256x256x32_MI16x16x16x1_SN_1LDSB1_AMAS0_EPS0_FL1_PGR2_SU32_SUM0_SVW1_TT8_128_VW1_WG32_8_1
- - - [64, 64, 1, 256]
    - [12, 0.083]
  - - [128, 64, 1, 256]
    - [13, 0.172]
  - - [64, 128, 1, 256]
    - [14, 0.165]
  - - [128, 128, 1, 256]
    - [17, 0.184]
  - - [64, 256, 1, 256]
    - [16, 0.333]
  - - [128, 256, 1, 256]
    - [12, 0.68]
  - - [64, 448, 1, 256]
    - [12, 0.587]
  - - [128, 448, 1, 256]
    - [14, 1.165]
  - - [64, 704, 1, 256]
    - [14, 0.935]
  - - [128, 704, 1, 256]
    - [12, 1.83]
  - - [64, 1024, 1, 256]
    - [12, 1.341]
  - - [128, 1024, 1, 256]
    - [14, 2.589]
  - - [64, 1408, 1, 256]
    - [43, 0.936]
  - - [128, 1408, 1, 256]
    - [12, 3.585]
  - - [64, 1856, 1, 256]
    - [18, 2.447]
  - - [128, 1856, 1, 256]
    - [15, 4.538]
  - - [64, 2368, 1, 256]
    - [12, 3.078]
  - - [128, 2368, 1, 256]
    - [18, 5.828]
  - - [64, 2944, 1, 256]
    - [14, 3.748]
  - - [128, 2944, 1, 256]
    - [28, 3.596]
  - - [64, 3584, 1, 256]
    - [18, 4.411]
  - - [128, 3584, 1, 256]
    - [19, 7.561]
  - - [64, 4288, 1, 256]
    - [18, 5.385]
  - - [128, 4288, 1, 256]
    - [19, 8.995]
  - - [64, 5056, 1, 256]
    - [20, 5.983]
  - - [128, 5056, 1, 256]
    - [19, 10.37]
  - - [64, 5888, 1, 256]
    - [15, 6.548]
  - - [128, 5888, 1, 256]
    - [21, 11.814]
  - - [64, 6784, 1, 256]
    - [19, 7.197]
  - - [128, 6784, 1, 256]
    - [21, 13.393]
  - - [64, 64, 1, 1280]
    - [32, 0.176]
  - - [128, 64, 1, 1280]
    - [22, 0.532]
  - - [64, 128, 1, 1280]
    - [22, 0.503]
  - - [128, 128, 1, 1280]
    - [22, 0.949]
  - - [64, 256, 1, 1280]
    - [23, 0.964]
  - - [128, 256, 1, 1280]
    - [22, 1.905]
  - - [64, 448, 1, 1280]
    - [22, 1.752]
  - - [128, 448, 1, 1280]
    - [22, 3.269]
  - - [64, 704, 1, 1280]
    - [22, 2.765]
  - - [128, 704, 1, 1280]
    - [22, 5.116]
  - - [64, 1024, 1, 1280]
    - [22, 2.756]
  - - [128, 1024, 1, 1280]
    - [24, 6.751]
  - - [64, 1408, 1, 1280]
    - [25, 5.24]
  - - [128, 1408, 1, 1280]
    - [29, 6.649]
  - - [64, 1856, 1, 1280]
    - [24, 6.118]
  - - [128, 1856, 1, 1280]
    - [19, 10.981]
  - - [64, 2368, 1, 1280]
    - [26, 7.834]
  - - [128, 2368, 1, 1280]
    - [19, 13.921]
  - - [64, 2944, 1, 1280]
    - [24, 6.841]
  - - [128, 2944, 1, 1280]
    - [19, 17.935]
  - - [64, 3584, 1, 1280]
    - [39, 7.708]
  - - [128, 3584, 1, 1280]
    - [19, 19.232]
  - - [64, 4288, 1, 1280]
    - [28, 12.934]
  - - [128, 4288, 1, 1280]
    - [19, 22.297]
  - - [64, 5056, 1, 1280]
    - [19, 15.819]
  - - [128, 5056, 1, 1280]
    - [27, 26.069]
  - - [64, 5888, 1, 1280]
    - [19, 17.143]
  - - [128, 5888, 1, 1280]
    - [19, 30.444]
  - - [64, 6784, 1, 1280]
    - [19, 19.148]
  - - [128, 6784, 1, 1280]
    - [29, 34.785]
  - - [64, 64, 1, 3328]
    - [30, 0.428]
  - - [128, 64, 1, 3328]
    - [31, 0.851]
  - - [64, 128, 1, 3328]
    - [31, 0.844]
  - - [128, 128, 1, 3328]
    - [32, 1.563]
  - - [64, 256, 1, 3328]
    - [33, 1.579]
  - - [128, 256, 1, 3328]
    - [31, 2.925]
  - - [64, 448, 1, 3328]
    - [33, 2.689]
  - - [128, 448, 1, 3328]
    - [34, 5.059]
  - - [64, 704, 1, 3328]
    - [32, 4.058]
  - - [128, 704, 1, 3328]
    - [46, 7.574]
  - - [64, 1024, 1, 3328]
    - [34, 5.825]
  - - [128, 1024, 1, 3328]
    - [46, 10.534]
  - - [64, 1408, 1, 3328]
    - [46, 7.56]
  - - [128, 1408, 1, 3328]
    - [24, 13.707]
  - - [64, 1856, 1, 3328]
    - [34, 9.436]
  - - [128, 1856, 1, 3328]
    - [35, 16.807]
  - - [64, 2368, 1, 3328]
    - [24, 11.888]
  - - [128, 2368, 1, 3328]
    - [36, 21.046]
  - - [64, 2944, 1, 3328]
    - [37, 14.657]
  - - [128, 2944, 1, 3328]
    - [35, 26.069]
  - - [64, 3584, 1, 3328]
    - [36, 16.076]
  - - [128, 3584, 1, 3328]
    - [174, 25.513]
  - - [64, 4288, 1, 3328]
    - [39, 19.788]
  - - [128, 4288, 1, 3328]
    - [143, 30.86]
  - - [64, 5056, 1, 3328]
    - [35, 23.288]
  - - [128, 5056, 1, 3328]
    - [29, 34.177]
  - - [64, 5888, 1, 3328]
    - [35, 25.367]
  - - [128, 5888, 1, 3328]
    - [38, 39.522]
  - - [64, 6784, 1, 3328]
    - [42, 21.089]
  - - [128, 6784, 1, 3328]
    - [84, 34.86]
  - - [256, 64, 1, 256]
    - [17, 0.338]
  - - [448, 64, 1, 256]
    - [14, 0.587]
  - - [704, 64, 1, 256]
    - [18, 0.909]
  - - [1024, 64, 1, 256]
    - [12, 1.313]
  - - [1408, 64, 1, 256]
    - [17, 1.83]
  - - [1856, 64, 1, 256]
    - [18, 2.331]
  - - [2368, 64, 1, 256]
    - [18, 3.035]
  - - [2944, 64, 1, 256]
    - [18, 3.8]
  - - [3584, 64, 1, 256]
    - [26, 4.381]
  - - [4288, 64, 1, 256]
    - [14, 5.173]
  - - [5056, 64, 1, 256]
    - [29, 3.106]
  - - [5888, 64, 1, 256]
    - [15, 6.431]
  - - [6784, 64, 1, 256]
    - [19, 7.239]
  - - [256, 128, 1, 256]
    - [14, 0.69]
  - - [448, 128, 1, 256]
    - [14, 1.157]
  - - [704, 128, 1, 256]
    - [14, 1.818]
  - - [1024, 128, 1, 256]
    - [20, 2.607]
  - - [1408, 128, 1, 256]
    - [15, 3.489]
  - - [1856, 128, 1, 256]
    - [18, 4.538]
  - - [2368, 128, 1, 256]
    - [20, 5.751]
  - - [2944, 128, 1, 256]
    - [15, 6.431]
  - - [3584, 128, 1, 256]
    - [45, 4.607]
  - - [4288, 128, 1, 256]
    - [27, 5.416]
  - - [5056, 128, 1, 256]
    - [19, 10.313]
  - - [5888, 128, 1, 256]
    - [19, 11.879]
  - - [6784, 128, 1, 256]
    - [195, 7.837]
  - - [256, 64, 1, 1280]
    - [22, 0.96]
  - - [448, 64, 1, 1280]
    - [22, 1.73]
  - - [704, 64, 1, 1280]
    - [22, 2.599]
  - - [1024, 64, 1, 1280]
    - [22, 3.78]
  - - [1408, 64, 1, 1280]
    - [22, 5.116]
  - - [1856, 64, 1, 1280]
    - [20, 6.229]
  - - [2368, 64, 1, 1280]
    - [43, 7.806]
  - - [2944, 64, 1, 1280]
    - [43, 9.636]
  - - [3584, 64, 1, 1280]
    - [44, 10.369]
  - - [4288, 64, 1, 1280]
    - [19, 12.726]
  - - [5056, 64, 1, 1280]
    - [39, 10.887]
  - - [5888, 64, 1, 1280]
    - [168, 13.033]
  - - [6784, 64, 1, 1280]
    - [45, 19.941]
  - - [256, 128, 1, 1280]
    - [22, 1.89]
  - - [448, 128, 1, 1280]
    - [22, 3.348]
  - - [704, 128, 1, 1280]
    - [23, 5.057]
  - - [1024, 128, 1, 1280]
    - [14, 6.949]
  - - [1408, 128, 1, 1280]
    - [24, 6.612]
  - - [1856, 128, 1, 1280]
    - [35, 8.178]
  - - [2368, 128, 1, 1280]
    - [29, 11.16]
  - - [2944, 128, 1, 1280]
    - [39, 14.415]
  - - [3584, 128, 1, 1280]
    - [29, 18.531]
  - - [4288, 128, 1, 1280]
    - [19, 21.987]
  - - [5056, 128, 1, 1280]
    - [28, 20.778]
  - - [5888, 128, 1, 1280]
    - [19, 29.696]
  - - [6784, 128, 1, 1280]
    - [28, 33.573]
  - - [256, 64, 1, 3328]
    - [31, 1.587]
  - - [448, 64, 1, 3328]
    - [30, 2.848]
  - - [704, 64, 1, 3328]
    - [32, 4.131]
  - - [1024, 64, 1, 3328]
    - [32, 5.676]
  - - [1408, 64, 1, 3328]
    - [34, 7.708]
  - - [1856, 64, 1, 3328]
    - [34, 9.788]
  - - [2368, 64, 1, 3328]
    - [24, 11.573]
  - - [2944, 64, 1, 3328]
    - [46, 13.452]
  - - [3584, 64, 1, 3328]
    - [46, 13.983]
  - - [4288, 64, 1, 3328]
    - [41, 19.75]
  - - [5056, 64, 1, 3328]
    - [36, 22.763]
  - - [5888, 64, 1, 3328]
    - [36, 24.832]
  - - [6784, 64, 1, 3328]
    - [40, 20.59]
  - - [256, 128, 1, 3328]
    - [32, 3.064]
  - - [448, 128, 1, 3328]
    - [34, 5.217]
  - - [704, 128, 1, 3328]
    - [34, 7.779]
  - - [1024, 128, 1, 3328]
    - [46, 10.317]
  - - [1408, 128, 1, 3328]
    - [37, 13.542]
  - - [1856, 128, 1, 3328]
    - [41, 17.364]
  - - [2368, 128, 1, 3328]
    - [36, 21.898]
  - - [2944, 128, 1, 3328]
    - [39, 27.383]
  - - [3584, 128, 1, 3328]
    - [143, 23.86]
  - - [4288, 128, 1, 3328]
    - [174, 30.322]
  - - [5056, 128, 1, 3328]
    - [40, 30.663]
  - - [5888, 128, 1, 3328]
    - [40, 38.643]
  - - [6784, 128, 1, 3328]
    - [174, 31.905]
  - - [256, 256, 1, 256]
    - [26, 1.36]
  - - [448, 256, 1, 256]
    - [13, 1.232]
  - - [256, 448, 1, 256]
    - [14, 1.219]
  - - [448, 448, 1, 256]
    - [24, 2.079]
  - - [256, 256, 1, 1280]
    - [22, 3.889]
  - - [448, 256, 1, 1280]
    - [14, 6.014]
  - - [256, 448, 1, 1280]
    - [20, 5.993]
  - - [448, 448, 1, 1280]
    - [24, 7.705]
  - - [256, 256, 1, 3328]
    - [34, 5.701]
  - - [448, 256, 1, 3328]
    - [34, 9.483]
  - - [256, 448, 1, 3328]
    - [34, 9.41]
  - - [448, 448, 1, 3328]
    - [43, 15.81]
  - - [512, 16, 1, 512]
    - [18, 0.158]
  - - [512, 32, 1, 512]
    - [22, 0.328]
  - - [1024, 16, 1, 512]
    - [17, 0.546]
  - - [1024, 32, 1, 512]
    - [14, 1.146]
  - - [704, 256, 1, 256]
    - [12, 3.585]
  - - [1024, 256, 1, 256]
    - [18, 4.974]
  - - [1408, 256, 1, 256]
    - [29, 3.655]
  - - [1856, 256, 1, 256]
    - [19, 4.842]
  - - [2368, 256, 1, 256]
    - [29, 5.98]
  - - [2944, 256, 1, 256]
    - [47, 11.814]
  - - [3584, 256, 1, 256]
    - [47, 12.784]
  - - [4288, 256, 1, 256]
    - [47, 15.222]
  - - [5056, 256, 1, 256]
    - [70, 10.225]
  - - [5888, 256, 1, 256]
    - [49, 17.673]
  - - [6784, 256, 1, 256]
    - [195, 13.069]
  - - [704, 448, 1, 256]
    - [18, 5.794]
  - - [1024, 448, 1, 256]
    - [45, 4.376]
  - - [1408, 448, 1, 256]
    - [27, 9.476]
  - - [1856, 448, 1, 256]
    - [47, 12.689]
  - - [2368, 448, 1, 256]
    - [47, 14.926]
  - - [2944, 448, 1, 256]
    - [195, 10.363]
  - - [3584, 448, 1, 256]
    - [195, 11.665]
  - - [4288, 448, 1, 256]
    - [48, 13.282]
  - - [5056, 448, 1, 256]
    - [51, 19.857]
  - - [5888, 448, 1, 256]
    - [196, 17.338]
  - - [6784, 448, 1, 256]
    - [195, 19.284]
  - - [256, 704, 1, 256]
    - [26, 3.585]
  - - [448, 704, 1, 256]
    - [14, 5.869]
  - - [704, 704, 1, 256]
    - [29, 5.063]
  - - [1024, 704, 1, 256]
    - [48, 11.239]
  - - [1408, 704, 1, 256]
    - [21, 13.55]
  - - [1856, 704, 1, 256]
    - [195, 11.175]
  - - [2368, 704, 1, 256]
    - [47, 16.299]
  - - [2944, 704, 1, 256]
    - [195, 14.286]
  - - [3584, 704, 1, 256]
    - [195, 16.161]
  - - [4288, 704, 1, 256]
    - [195, 19.152]
  - - [5056, 704, 1, 256]
    - [195, 21.034]
  - - [5888, 704, 1, 256]
    - [196, 21.974]
  - - [6784, 704, 1, 256]
    - [198, 22.627]
  - - [256, 1024, 1, 256]
    - [15, 5.074]
  - - [448, 1024, 1, 256]
    - [19, 4.619]
  - - [704, 1024, 1, 256]
    - [19, 10.829]
  - - [1024, 1024, 1, 256]
    - [21, 14.067]
  - - [1408, 1024, 1, 256]
    - [195, 11.329]
  - - [1856, 1024, 1, 256]
    - [195, 12.95]
  - - [2368, 1024, 1, 256]
    - [50, 20.877]
  - - [2944, 1024, 1, 256]
    - [196, 19.944]
  - - [3584, 1024, 1, 256]
    - [55, 22.285]
  - - [4288, 1024, 1, 256]
    - [196, 24.356]
  - - [5056, 1024, 1, 256]
    - [196, 25.003]
  - - [5888, 1024, 1, 256]
    - [199, 28.336]
  - - [6784, 1024, 1, 256]
    - [196, 29.792]
  - - [256, 1408, 1, 256]
    - [15, 6.225]
  - - [448, 1408, 1, 256]
    - [19, 10.052]
  - - [704, 1408, 1, 256]
    - [47, 13.679]
  - - [1024, 1408, 1, 256]
    - [195, 12.148]
  - - [1408, 1408, 1, 256]
    - [195, 14.31]
  - - [1856, 1408, 1, 256]
    - [195, 17.454]
  - - [2368, 1408, 1, 256]
    - [195, 20.165]
  - - [2944, 1408, 1, 256]
    - [196, 24.888]
  - - [3584, 1408, 1, 256]
    - [196, 27.069]
  - - [4288, 1408, 1, 256]
    - [201, 27.701]
  - - [5056, 1408, 1, 256]
    - [196, 29.408]
  - - [5888, 1408, 1, 256]
    - [196, 34.674]
  - - [6784, 1408, 1, 256]
    - [198, 34.634]
  - - [256, 1856, 1, 256]
    - [29, 4.769]
  - - [448, 1856, 1, 256]
    - [29, 12.825]
  - - [704, 1856, 1, 256]
    - [195, 10.769]
  - - [1024, 1856, 1, 256]
    - [195, 13.252]
  - - [1408, 1856, 1, 256]
    - [196, 16.88]
  - - [1856, 1856, 1, 256]
    - [195, 20.315]
  - - [2368, 1856, 1, 256]
    - [196, 24.574]
  - - [2944, 1856, 1, 256]
    - [196, 27.432]
  - - [3584, 1856, 1, 256]
    - [195, 28.976]
  - - [4288, 1856, 1, 256]
    - [196, 30.232]
  - - [5056, 1856, 1, 256]
    - [200, 33.416]
  - - [5888, 1856, 1, 256]
    - [196, 36.163]
  - - [6784, 1856, 1, 256]
    - [196, 37.545]
  - - [256, 2368, 1, 256]
    - [19, 9.66]
  - - [448, 2368, 1, 256]
    - [47, 14.64]
  - - [704, 2368, 1, 256]
    - [28, 11.824]
  - - [1024, 2368, 1, 256]
    - [50, 21.129]
  - - [1408, 2368, 1, 256]
    - [195, 21.545]
  - - [1856, 2368, 1, 256]
    - [195, 23.921]
  - - [2368, 2368, 1, 256]
    - [200, 26.672]
  - - [2944, 2368, 1, 256]
    - [195, 28.526]
  - - [3584, 2368, 1, 256]
    - [198, 31.273]
  - - [4288, 2368, 1, 256]
    - [196, 32.084]
  - - [5056, 2368, 1, 256]
    - [198, 36.078]
  - - [5888, 2368, 1, 256]
    - [198, 36.792]
  - - [6784, 2368, 1, 256]
    - [198, 40.04]
  - - [256, 2944, 1, 256]
    - [27, 6.823]
  - - [448, 2944, 1, 256]
    - [70, 10.337]
  - - [704, 2944, 1, 256]
    - [58, 19.098]
  - - [1024, 2944, 1, 256]
    - [195, 19.96]
  - - [1408, 2944, 1, 256]
    - [195, 23.056]
  - - [1856, 2944, 1, 256]
    - [195, 26.064]
  - - [2368, 2944, 1, 256]
    - [196, 30.139]
  - - [2944, 2944, 1, 256]
    - [196, 33.755]
  - - [3584, 2944, 1, 256]
    - [196, 35.687]
  - - [4288, 2944, 1, 256]
    - [200, 36.977]
  - - [5056, 2944, 1, 256]
    - [199, 37.861]
  - - [5888, 2944, 1, 256]
    - [196, 39.224]
  - - [6784, 2944, 1, 256]
    - [198, 42.596]
  - - [256, 3584, 1, 256]
    - [47, 13.365]
  - - [448, 3584, 1, 256]
    - [59, 18.232]
  - - [704, 3584, 1, 256]
    - [196, 16.735]
  - - [1024, 3584, 1, 256]
    - [196, 21.58]
  - - [1408, 3584, 1, 256]
    - [195, 26.627]
  - - [1856, 3584, 1, 256]
    - [195, 27.951]
  - - [2368, 3584, 1, 256]
    - [198, 31.603]
  - - [2944, 3584, 1, 256]
    - [196, 35.989]
  - - [3584, 3584, 1, 256]
    - [197, 38.628]
  - - [4288, 3584, 1, 256]
    - [198, 38.863]
  - - [5056, 3584, 1, 256]
    - [198, 39.778]
  - - [5888, 3584, 1, 256]
    - [199, 42.743]
  - - [6784, 3584, 1, 256]
    - [199, 43.153]
  - - [256, 4288, 1, 256]
    - [195, 9.909]
  - - [448, 4288, 1, 256]
    - [21, 17.816]
  - - [704, 4288, 1, 256]
    - [196, 19.717]
  - - [1024, 4288, 1, 256]
    - [195, 24.644]
  - - [1408, 4288, 1, 256]
    - [195, 28.198]
  - - [1856, 4288, 1, 256]
    - [196, 32.179]
  - - [2368, 4288, 1, 256]
    - [200, 32.319]
  - - [2944, 4288, 1, 256]
    - [199, 37.496]
  - - [3584, 4288, 1, 256]
    - [198, 38.964]
  - - [4288, 4288, 1, 256]
    - [201, 38.669]
  - - [5056, 4288, 1, 256]
    - [198, 38.847]
  - - [5888, 4288, 1, 256]
    - [196, 43.345]
  - - [6784, 4288, 1, 256]
    - [200, 43.302]
  - - [256, 5056, 1, 256]
    - [52, 10.436]
  - - [448, 5056, 1, 256]
    - [195, 15.248]
  - - [704, 5056, 1, 256]
    - [195, 20.636]
  - - [1024, 5056, 1, 256]
    - [196, 26.222]
  - - [1408, 5056, 1, 256]
    - [195, 28.612]
  - - [1856, 5056, 1, 256]
    - [195, 31.306]
  - - [2368, 5056, 1, 256]
    - [200, 36.016]
  - - [2944, 5056, 1, 256]
    - [198, 37.684]
  - - [3584, 5056, 1, 256]
    - [198, 39.467]
  - - [4288, 5056, 1, 256]
    - [197, 40.172]
  - - [5056, 5056, 1, 256]
    - [199, 40.462]
  - - [5888, 5056, 1, 256]
    - [199, 44.626]
  - - [6784, 5056, 1, 256]
    - [198, 45.86]
  - - [256, 5888, 1, 256]
    - [195, 11.763]
  - - [448, 5888, 1, 256]
    - [195, 17.16]
  - - [704, 5888, 1, 256]
    - [196, 22.865]
  - - [1024, 5888, 1, 256]
    - [196, 28.979]
  - - [1408, 5888, 1, 256]
    - [196, 34.853]
  - - [1856, 5888, 1, 256]
    - [200, 34.936]
  - - [2368, 5888, 1, 256]
    - [200, 36.8]
  - - [2944, 5888, 1, 256]
    - [196, 40.331]
  - - [3584, 5888, 1, 256]
    - [199, 41.723]
  - - [4288, 5888, 1, 256]
    - [199, 42.781]
  - - [5056, 5888, 1, 256]
    - [201, 44.933]
  - - [5888, 5888, 1, 256]
    - [200, 46.657]
  - - [6784, 5888, 1, 256]
    - [196, 46.985]
  - - [256, 6784, 1, 256]
    - [196, 12.713]
  - - [448, 6784, 1, 256]
    - [196, 18.338]
  - - [704, 6784, 1, 256]
    - [198, 24.474]
  - - [1024, 6784, 1, 256]
    - [196, 30.399]
  - - [1408, 6784, 1, 256]
    - [196, 35.862]
  - - [1856, 6784, 1, 256]
    - [196, 37.695]
  - - [2368, 6784, 1, 256]
    - [196, 37.284]
  - - [2944, 6784, 1, 256]
    - [197, 41.586]
  - - [3584, 6784, 1, 256]
    - [196, 44.766]
  - - [4288, 6784, 1, 256]
    - [198, 42.929]
  - - [5056, 6784, 1, 256]
    - [198, 45.931]
  - - [5888, 6784, 1, 256]
    - [199, 47.056]
  - - [6784, 6784, 1, 256]
    - [197, 47.509]
  - - [704, 256, 1, 1280]
    - [29, 6.339]
  - - [1024, 256, 1, 1280]
    - [19, 12.729]
  - - [1408, 256, 1, 1280]
    - [19, 17.043]
  - - [1856, 256, 1, 1280]
    - [29, 19.086]
  - - [2368, 256, 1, 1280]
    - [19, 24.352]
  - - [2944, 256, 1, 1280]
    - [19, 30.359]
  - - [3584, 256, 1, 1280]
    - [60, 26.569]
  - - [4288, 256, 1, 1280]
    - [61, 32.176]
  - - [5056, 256, 1, 1280]
    - [187, 29.543]
  - - [5888, 256, 1, 1280]
    - [195, 34.107]
  - - [6784, 256, 1, 1280]
    - [58, 32.395]
  - - [704, 448, 1, 1280]
    - [19, 15.161]
  - - [1024, 448, 1, 1280]
    - [19, 18.956]
  - - [1408, 448, 1, 1280]
    - [28, 25.481]
  - - [1856, 448, 1, 1280]
    - [29, 32.942]
  - - [2368, 448, 1, 1280]
    - [64, 31.544]
  - - [2944, 448, 1, 1280]
    - [195, 31.246]
  - - [3584, 448, 1, 1280]
    - [195, 37.164]
  - - [4288, 448, 1, 1280]
    - [66, 39.747]
  - - [5056, 448, 1, 1280]
    - [53, 44.747]
  - - [5888, 448, 1, 1280]
    - [196, 44.773]
  - - [6784, 448, 1, 1280]
    - [195, 44.217]
  - - [256, 704, 1, 1280]
    - [24, 6.797]
  - - [448, 704, 1, 1280]
    - [19, 15.212]
  - - [704, 704, 1, 1280]
    - [29, 20.134]
  - - [1024, 704, 1, 1280]
    - [29, 29.368]
  - - [1408, 704, 1, 1280]
    - [61, 29.534]
  - - [1856, 704, 1, 1280]
    - [195, 31.1]
  - - [2368, 704, 1, 1280]
    - [19, 38.1]
  - - [2944, 704, 1, 1280]
    - [58, 41.803]
  - - [3584, 704, 1, 1280]
    - [196, 41.6]
  - - [4288, 704, 1, 1280]
    - [196, 48.707]
  - - [5056, 704, 1, 1280]
    - [137, 46.507]
  - - [5888, 704, 1, 1280]
    - [196, 50.885]
  - - [6784, 704, 1, 1280]
    - [200, 48.959]
  - - [256, 1024, 1, 1280]
    - [19, 12.859]
  - - [448, 1024, 1, 1280]
    - [29, 18.795]
  - - [704, 1024, 1, 1280]
    - [19, 28.878]
  - - [1024, 1024, 1, 1280]
    - [69, 30.244]
  - - [1408, 1024, 1, 1280]
    - [195, 33.815]
  - - [1856, 1024, 1, 1280]
    - [53, 35.505]
  - - [2368, 1024, 1, 1280]
    - [75, 40.274]
  - - [2944, 1024, 1, 1280]
    - [196, 51.583]
  - - [3584, 1024, 1, 1280]
    - [68, 48.081]
  - - [4288, 1024, 1, 1280]
    - [196, 54.484]
  - - [5056, 1024, 1, 1280]
    - [196, 53.467]
  - - [5888, 1024, 1, 1280]
    - [197, 61.027]
  - - [6784, 1024, 1, 1280]
    - [196, 57.196]
  - - [256, 1408, 1, 1280]
    - [19, 16.932]
  - - [448, 1408, 1, 1280]
    - [29, 26.065]
  - - [704, 1408, 1, 1280]
    - [61, 29.657]
  - - [1024, 1408, 1, 1280]
    - [195, 34.374]
  - - [1408, 1408, 1, 1280]
    - [93, 38.666]
  - - [1856, 1408, 1, 1280]
    - [196, 44.267]
  - - [2368, 1408, 1, 1280]
    - [68, 48.034]
  - - [2944, 1408, 1, 1280]
    - [196, 50.688]
  - - [3584, 1408, 1, 1280]
    - [196, 59.755]
  - - [4288, 1408, 1, 1280]
    - [198, 60.256]
  - - [5056, 1408, 1, 1280]
    - [196, 58.756]
  - - [5888, 1408, 1, 1280]
    - [196, 63.968]
  - - [6784, 1408, 1, 1280]
    - [200, 67.749]
  - - [256, 1856, 1, 1280]
    - [28, 19.747]
  - - [448, 1856, 1, 1280]
    - [19, 33.495]
  - - [704, 1856, 1, 1280]
    - [196, 32.165]
  - - [1024, 1856, 1, 1280]
    - [54, 38.822]
  - - [1408, 1856, 1, 1280]
    - [197, 42.67]
  - - [1856, 1856, 1, 1280]
    - [68, 47.727]
  - - [2368, 1856, 1, 1280]
    - [196, 51.619]
  - - [2944, 1856, 1, 1280]
    - [196, 55.464]
  - - [3584, 1856, 1, 1280]
    - [196, 56.308]
  - - [4288, 1856, 1, 1280]
    - [196, 63.883]
  - - [5056, 1856, 1, 1280]
    - [197, 66.462]
  - - [5888, 1856, 1, 1280]
    - [196, 65.625]
  - - [6784, 1856, 1, 1280]
    - [197, 69.78]
  - - [256, 2368, 1, 1280]
    - [29, 24.557]
  - - [448, 2368, 1, 1280]
    - [80, 31.675]
  - - [704, 2368, 1, 1280]
    - [29, 33.566]
  - - [1024, 2368, 1, 1280]
    - [51, 47.128]
  - - [1408, 2368, 1, 1280]
    - [195, 48.51]
  - - [1856, 2368, 1, 1280]
    - [196, 52.31]
  - - [2368, 2368, 1, 1280]
    - [198, 57.268]
  - - [2944, 2368, 1, 1280]
    - [196, 55.899]
  - - [3584, 2368, 1, 1280]
    - [197, 60.384]
  - - [4288, 2368, 1, 1280]
    - [196, 62.47]
  - - [5056, 2368, 1, 1280]
    - [196, 66.073]
  - - [5888, 2368, 1, 1280]
    - [196, 67.177]
  - - [6784, 2368, 1, 1280]
    - [196, 71.371]
  - - [256, 2944, 1, 1280]
    - [29, 30.616]
  - - [448, 2944, 1, 1280]
    - [195, 32.357]
  - - [704, 2944, 1, 1280]
    - [54, 42.336]
  - - [1024, 2944, 1, 1280]
    - [196, 51.042]
  - - [1408, 2944, 1, 1280]
    - [196, 53.828]
  - - [1856, 2944, 1, 1280]
    - [198, 54.598]
  - - [2368, 2944, 1, 1280]
    - [196, 57.221]
  - - [2944, 2944, 1, 1280]
    - [196, 63.204]
  - - [3584, 2944, 1, 1280]
    - [196, 66.643]
  - - [4288, 2944, 1, 1280]
    - [198, 70.006]
  - - [5056, 2944, 1, 1280]
    - [196, 69.792]
  - - [5888, 2944, 1, 1280]
    - [196, 70.899]
  - - [6784, 2944, 1, 1280]
    - [196, 73.685]
  - - [256, 3584, 1, 1280]
    - [62, 26.784]
  - - [448, 3584, 1, 1280]
    - [49, 42.801]
  - - [704, 3584, 1, 1280]
    - [196, 41.466]
  - - [1024, 3584, 1, 1280]
    - [94, 51.526]
  - - [1408, 3584, 1, 1280]
    - [196, 55.681]
  - - [1856, 3584, 1, 1280]
    - [196, 56.01]
  - - [2368, 3584, 1, 1280]
    - [196, 60.322]
  - - [2944, 3584, 1, 1280]
    - [196, 67.4]
  - - [3584, 3584, 1, 1280]
    - [197, 71.392]
  - - [4288, 3584, 1, 1280]
    - [198, 67.792]
  - - [5056, 3584, 1, 1280]
    - [196, 71.312]
  - - [5888, 3584, 1, 1280]
    - [196, 74.152]
  - - [6784, 3584, 1, 1280]
    - [196, 73.881]
  - - [256, 4288, 1, 1280]
    - [84, 32.506]
  - - [448, 4288, 1, 1280]
    - [92, 36.435]
  - - [704, 4288, 1, 1280]
    - [196, 49.826]
  - - [1024, 4288, 1, 1280]
    - [196, 53.891]
  - - [1408, 4288, 1, 1280]
    - [197, 60.012]
  - - [1856, 4288, 1, 1280]
    - [196, 59.985]
  - - [2368, 4288, 1, 1280]
    - [196, 60.213]
  - - [2944, 4288, 1, 1280]
    - [196, 68.91]
  - - [3584, 4288, 1, 1280]
    - [201, 68.432]
  - - [4288, 4288, 1, 1280]
    - [198, 70.371]
  - - [5056, 4288, 1, 1280]
    - [197, 71.206]
  - - [5888, 4288, 1, 1280]
    - [198, 73.814]
  - - [6784, 4288, 1, 1280]
    - [197, 75.991]
  - - [256, 5056, 1, 1280]
    - [196, 31.918]
  - - [448, 5056, 1, 1280]
    - [196, 39.459]
  - - [704, 5056, 1, 1280]
    - [68, 48.27]
  - - [1024, 5056, 1, 1280]
    - [198, 52.388]
  - - [1408, 5056, 1, 1280]
    - [196, 57.505]
  - - [1856, 5056, 1, 1280]
    - [196, 64.558]
  - - [2368, 5056, 1, 1280]
    - [201, 66.387]
  - - [2944, 5056, 1, 1280]
    - [196, 70.184]
  - - [3584, 5056, 1, 1280]
    - [196, 71.69]
  - - [4288, 5056, 1, 1280]
    - [198, 72.361]
  - - [5056, 5056, 1, 1280]
    - [198, 73.887]
  - - [5888, 5056, 1, 1280]
    - [197, 77.187]
  - - [6784, 5056, 1, 1280]
    - [196, 75.388]
  - - [256, 5888, 1, 1280]
    - [49, 40.479]
  - - [448, 5888, 1, 1280]
    - [196, 44.037]
  - - [704, 5888, 1, 1280]
    - [196, 51.06]
  - - [1024, 5888, 1, 1280]
    - [197, 62.16]
  - - [1408, 5888, 1, 1280]
    - [196, 67.035]
  - - [1856, 5888, 1, 1280]
    - [196, 65.879]
  - - [2368, 5888, 1, 1280]
    - [196, 66.534]
  - - [2944, 5888, 1, 1280]
    - [196, 71.73]
  - - [3584, 5888, 1, 1280]
    - [196, 73.671]
  - - [4288, 5888, 1, 1280]
    - [198, 74.746]
  - - [5056, 5888, 1, 1280]
    - [197, 77.269]
  - - [5888, 5888, 1, 1280]
    - [197, 78.409]
  - - [6784, 5888, 1, 1280]
    - [196, 79.117]
  - - [256, 6784, 1, 1280]
    - [93, 34.034]
  - - [448, 6784, 1, 1280]
    - [59, 42.457]
  - - [704, 6784, 1, 1280]
    - [199, 49.13]
  - - [1024, 6784, 1, 1280]
    - [196, 58.362]
  - - [1408, 6784, 1, 1280]
    - [196, 66.632]
  - - [1856, 6784, 1, 1280]
    - [196, 67.735]
  - - [2368, 6784, 1, 1280]
    - [196, 69.136]
  - - [2944, 6784, 1, 1280]
    - [196, 74.374]
  - - [3584, 6784, 1, 1280]
    - [196, 74.548]
  - - [4288, 6784, 1, 1280]
    - [197, 75.955]
  - - [5056, 6784, 1, 1280]
    - [198, 74.928]
  - - [5888, 6784, 1, 1280]
    - [198, 80.651]
  - - [6784, 6784, 1, 1280]
    - [197, 80.254]
  - - [704, 256, 1, 3328]
    - [46, 13.052]
  - - [1024, 256, 1, 3328]
    - [41, 19.012]
  - - [1408, 256, 1, 3328]
    - [41, 26.141]
  - - [1856, 256, 1, 3328]
    - [174, 26.026]
  - - [2368, 256, 1, 3328]
    - [42, 28.984]
  - - [2944, 256, 1, 3328]
    - [38, 40.254]
  - - [3584, 256, 1, 3328]
    - [61, 39.049]
  - - [4288, 256, 1, 3328]
    - [60, 47.093]
  - - [5056, 256, 1, 3328]
    - [85, 47.164]
  - - [5888, 256, 1, 3328]
    - [86, 54.871]
  - - [6784, 256, 1, 3328]
    - [92, 42.584]
  - - [704, 448, 1, 3328]
    - [35, 23.417]
  - - [1024, 448, 1, 3328]
    - [143, 26.121]
  - - [1408, 448, 1, 3328]
    - [42, 34.477]
  - - [1856, 448, 1, 3328]
    - [29, 38.238]
  - - [2368, 448, 1, 3328]
    - [80, 45.932]
  - - [2944, 448, 1, 3328]
    - [85, 48.294]
  - - [3584, 448, 1, 3328]
    - [195, 49.919]
  - - [4288, 448, 1, 3328]
    - [66, 54.9]
  - - [5056, 448, 1, 3328]
    - [58, 55.51]
  - - [5888, 448, 1, 3328]
    - [81, 56.777]
  - - [6784, 448, 1, 3328]
    - [79, 53.622]
  - - [256, 704, 1, 3328]
    - [43, 13.679]
  - - [448, 704, 1, 3328]
    - [39, 22.962]
  - - [704, 704, 1, 3328]
    - [40, 27.208]
  - - [1024, 704, 1, 3328]
    - [40, 39.634]
  - - [1408, 704, 1, 3328]
    - [88, 42.72]
  - - [1856, 704, 1, 3328]
    - [89, 48.221]
  - - [2368, 704, 1, 3328]
    - [66, 46.62]
  - - [2944, 704, 1, 3328]
    - [51, 51.912]
  - - [3584, 704, 1, 3328]
    - [90, 54.06]
  - - [4288, 704, 1, 3328]
    - [73, 64.753]
  - - [5056, 704, 1, 3328]
    - [182, 64.719]
  - - [5888, 704, 1, 3328]
    - [77, 58.672]
  - - [6784, 704, 1, 3328]
    - [197, 59.421]
  - - [256, 1024, 1, 3328]
    - [39, 18.939]
  - - [448, 1024, 1, 3328]
    - [143, 26.526]
  - - [704, 1024, 1, 3328]
    - [38, 38.78]
  - - [1024, 1024, 1, 3328]
    - [91, 44.325]
  - - [1408, 1024, 1, 3328]
    - [89, 53.157]
  - - [1856, 1024, 1, 3328]
    - [92, 46.883]
  - - [2368, 1024, 1, 3328]
    - [75, 55.182]
  - - [2944, 1024, 1, 3328]
    - [74, 65.528]
  - - [3584, 1024, 1, 3328]
    - [79, 61.958]
  - - [4288, 1024, 1, 3328]
    - [196, 65.023]
  - - [5056, 1024, 1, 3328]
    - [197, 63.863]
  - - [5888, 1024, 1, 3328]
    - [197, 75.739]
  - - [6784, 1024, 1, 3328]
    - [196, 67.245]
  - - [256, 1408, 1, 3328]
    - [36, 25.792]
  - - [448, 1408, 1, 3328]
    - [40, 34.031]
  - - [704, 1408, 1, 3328]
    - [61, 42.671]
  - - [1024, 1408, 1, 3328]
    - [89, 53.261]
  - - [1408, 1408, 1, 3328]
    - [66, 54.818]
  - - [1856, 1408, 1, 3328]
    - [201, 57.729]
  - - [2368, 1408, 1, 3328]
    - [164, 63.207]
  - - [2944, 1408, 1, 3328]
    - [71, 62.641]
  - - [3584, 1408, 1, 3328]
    - [196, 74.2]
  - - [4288, 1408, 1, 3328]
    - [197, 74.413]
  - - [5056, 1408, 1, 3328]
    - [94, 71.71]
  - - [5888, 1408, 1, 3328]
    - [196, 75.808]
  - - [6784, 1408, 1, 3328]
    - [201, 79.879]
  - - [256, 1856, 1, 3328]
    - [173, 24.174]
  - - [448, 1856, 1, 3328]
    - [19, 44.348]
  - - [704, 1856, 1, 3328]
    - [89, 48.221]
  - - [1024, 1856, 1, 3328]
    - [93, 51.639]
  - - [1408, 1856, 1, 3328]
    - [197, 57.551]
  - - [1856, 1856, 1, 3328]
    - [68, 64.265]
  - - [2368, 1856, 1, 3328]
    - [89, 63.153]
  - - [2944, 1856, 1, 3328]
    - [201, 67.196]
  - - [3584, 1856, 1, 3328]
    - [94, 67.933]
  - - [4288, 1856, 1, 3328]
    - [79, 71.066]
  - - [5056, 1856, 1, 3328]
    - [197, 79.123]
  - - [5888, 1856, 1, 3328]
    - [196, 74.552]
  - - [6784, 1856, 1, 3328]
    - [201, 80.944]
  - - [256, 2368, 1, 3328]
    - [42, 32.658]
  - - [448, 2368, 1, 3328]
    - [80, 45.879]
  - - [704, 2368, 1, 3328]
    - [93, 46.754]
  - - [1024, 2368, 1, 3328]
    - [53, 59.58]
  - - [1408, 2368, 1, 3328]
    - [98, 63.924]
  - - [1856, 2368, 1, 3328]
    - [196, 62.55]
  - - [2368, 2368, 1, 3328]
    - [197, 70.068]
  - - [2944, 2368, 1, 3328]
    - [67, 74.62]
  - - [3584, 2368, 1, 3328]
    - [201, 71.157]
  - - [4288, 2368, 1, 3328]
    - [77, 73.627]
  - - [5056, 2368, 1, 3328]
    - [198, 76.367]
  - - [5888, 2368, 1, 3328]
    - [196, 76.269]
  - - [6784, 2368, 1, 3328]
    - [201, 81.828]
  - - [256, 2944, 1, 3328]
    - [38, 41.014]
  - - [448, 2944, 1, 3328]
    - [89, 48.722]
  - - [704, 2944, 1, 3328]
    - [54, 52.086]
  - - [1024, 2944, 1, 3328]
    - [95, 64.042]
  - - [1408, 2944, 1, 3328]
    - [196, 64.406]
  - - [1856, 2944, 1, 3328]
    - [197, 67.908]
  - - [2368, 2944, 1, 3328]
    - [68, 68.218]
  - - [2944, 2944, 1, 3328]
    - [198, 72.486]
  - - [3584, 2944, 1, 3328]
    - [196, 75.778]
  - - [4288, 2944, 1, 3328]
    - [197, 80.377]
  - - [5056, 2944, 1, 3328]
    - [196, 79.682]
  - - [5888, 2944, 1, 3328]
    - [196, 81.416]
  - - [6784, 2944, 1, 3328]
    - [196, 82.797]
  - - [256, 3584, 1, 3328]
    - [61, 38.96]
  - - [448, 3584, 1, 3328]
    - [59, 53.089]
  - - [704, 3584, 1, 3328]
    - [74, 54.122]
  - - [1024, 3584, 1, 3328]
    - [97, 65.715]
  - - [1408, 3584, 1, 3328]
    - [89, 71.645]
  - - [1856, 3584, 1, 3328]
    - [94, 67.97]
  - - [2368, 3584, 1, 3328]
    - [197, 71.849]
  - - [2944, 3584, 1, 3328]
    - [196, 74.586]
  - - [3584, 3584, 1, 3328]
    - [201, 83.76]
  - - [4288, 3584, 1, 3328]
    - [197, 79.453]
  - - [5056, 3584, 1, 3328]
    - [196, 81.076]
  - - [5888, 3584, 1, 3328]
    - [196, 82.98]
  - - [6784, 3584, 1, 3328]
    - [196, 83.442]
  - - [256, 4288, 1, 3328]
    - [61, 46.04]
  - - [448, 4288, 1, 3328]
    - [58, 47.648]
  - - [704, 4288, 1, 3328]
    - [73, 63.876]
  - - [1024, 4288, 1, 3328]
    - [196, 65.561]
  - - [1408, 4288, 1, 3328]
    - [201, 74.06]
  - - [1856, 4288, 1, 3328]
    - [76, 70.44]
  - - [2368, 4288, 1, 3328]
    - [196, 70.867]
  - - [2944, 4288, 1, 3328]
    - [197, 80.515]
  - - [3584, 4288, 1, 3328]
    - [197, 79.927]
  - - [4288, 4288, 1, 3328]
    - [197, 79.854]
  - - [5056, 4288, 1, 3328]
    - [197, 81.671]
  - - [5888, 4288, 1, 3328]
    - [197, 84.227]
  - - [6784, 4288, 1, 3328]
    - [197, 85.651]
  - - [256, 5056, 1, 3328]
    - [89, 45.48]
  - - [448, 5056, 1, 3328]
    - [75, 51.826]
  - - [704, 5056, 1, 3328]
    - [98, 64.319]
  - - [1024, 5056, 1, 3328]
    - [201, 63.611]
  - - [1408, 5056, 1, 3328]
    - [94, 71.651]
  - - [1856, 5056, 1, 3328]
    - [74, 71.442]
  - - [2368, 5056, 1, 3328]
    - [201, 76.717]
  - - [2944, 5056, 1, 3328]
    - [196, 81.545]
  - - [3584, 5056, 1, 3328]
    - [196, 81.233]
  - - [4288, 5056, 1, 3328]
    - [197, 81.488]
  - - [5056, 5056, 1, 3328]
    - [197, 84.251]
  - - [5888, 5056, 1, 3328]
    - [197, 88.343]
  - - [6784, 5056, 1, 3328]
    - [197, 84.17]
  - - [256, 5888, 1, 3328]
    - [86, 54.659]
  - - [448, 5888, 1, 3328]
    - [87, 56.388]
  - - [704, 5888, 1, 3328]
    - [67, 58.872]
  - - [1024, 5888, 1, 3328]
    - [197, 76.109]
  - - [1408, 5888, 1, 3328]
    - [196, 79.094]
  - - [1856, 5888, 1, 3328]
    - [196, 76.819]
  - - [2368, 5888, 1, 3328]
    - [196, 76.653]
  - - [2944, 5888, 1, 3328]
    - [196, 80.08]
  - - [3584, 5888, 1, 3328]
    - [196, 82.639]
  - - [4288, 5888, 1, 3328]
    - [197, 84.31]
  - - [5056, 5888, 1, 3328]
    - [197, 87.766]
  - - [5888, 5888, 1, 3328]
    - [196, 85.876]
  - - [6784, 5888, 1, 3328]
    - [196, 86.975]
  - - [256, 6784, 1, 3328]
    - [93, 46.834]
  - - [448, 6784, 1, 3328]
    - [165, 58.087]
  - - [704, 6784, 1, 3328]
    - [197, 59.526]
  - - [1024, 6784, 1, 3328]
    - [98, 69.822]
  - - [1408, 6784, 1, 3328]
    - [90, 72.295]
  - - [1856, 6784, 1, 3328]
    - [196, 78.425]
  - - [2368, 6784, 1, 3328]
    - [196, 78.893]
  - - [2944, 6784, 1, 3328]
    - [196, 84.12]
  - - [3584, 6784, 1, 3328]
    - [196, 83.246]
  - - [4288, 6784, 1, 3328]
    - [197, 86.291]
  - - [5056, 6784, 1, 3328]
    - [197, 84.428]
  - - [5888, 6784, 1, 3328]
    - [197, 89.963]
  - - [6784, 6784, 1, 3328]
    - [201, 88.726]
  - - [1024, 1024, 1, 1024]
    - [195, 25.63]
  - - [1760, 7133, 1, 1760]
    - [197, 72.559]
  - - [2048, 7133, 1, 2048]
    - [196, 73.353]
  - - [2560, 7133, 1, 2560]
    - [197, 78.66]
  - - [3072, 7435, 1, 1024]
    - [197, 71.236]
  - - [4096, 7133, 1, 4096]
    - [197, 87.899]
  - - [7680, 5481, 1, 2560]
    - [198, 84.438]
  - - [32, 32, 1, 32]
    - [16, 0.004]
  - - [32, 64, 1, 256]
    - [14, 0.042]
  - - [32, 128, 1, 256]
    - [12, 0.084]
  - - [32, 256, 1, 256]
    - [14, 0.168]
  - - [32, 448, 1, 256]
    - [14, 0.293]
  - - [32, 704, 1, 256]
    - [14, 0.464]
  - - [32, 1024, 1, 256]
    - [14, 0.685]
  - - [32, 1408, 1, 256]
    - [14, 0.935]
  - - [32, 1856, 1, 256]
    - [12, 1.224]
  - - [32, 2368, 1, 256]
    - [14, 1.561]
  - - [32, 2944, 1, 256]
    - [14, 1.914]
  - - [32, 3584, 1, 256]
    - [14, 2.281]
  - - [32, 4288, 1, 256]
    - [14, 2.748]
  - - [32, 5056, 1, 256]
    - [14, 3.218]
  - - [32, 5888, 1, 256]
    - [14, 3.697]
  - - [32, 6784, 1, 256]
    - [14, 4.092]
  - - [32, 64, 1, 1280]
    - [30, 0.098]
  - - [32, 128, 1, 1280]
    - [30, 0.188]
  - - [32, 256, 1, 1280]
    - [22, 0.488]
  - - [32, 448, 1, 1280]
    - [22, 0.911]
  - - [32, 704, 1, 1280]
    - [22, 1.394]
  - - [32, 1024, 1, 1280]
    - [22, 1.945]
  - - [32, 1408, 1, 1280]
    - [22, 2.589]
  - - [32, 1856, 1, 1280]
    - [22, 3.629]
  - - [32, 2368, 1, 1280]
    - [22, 4.67]
  - - [32, 2944, 1, 1280]
    - [22, 5.391]
  - - [32, 3584, 1, 1280]
    - [24, 4.229]
  - - [32, 4288, 1, 1280]
    - [24, 5.085]
  - - [32, 5056, 1, 1280]
    - [24, 6.014]
  - - [32, 5888, 1, 1280]
    - [37, 9.305]
  - - [32, 6784, 1, 1280]
    - [19, 7.034]
  - - [32, 64, 1, 3328]
    - [99, 0.224]
  - - [32, 128, 1, 3328]
    - [33, 0.438]
  - - [32, 256, 1, 3328]
    - [33, 0.849]
  - - [32, 448, 1, 3328]
    - [33, 1.473]
  - - [32, 704, 1, 3328]
    - [33, 2.177]
  - - [32, 1024, 1, 3328]
    - [30, 3.004]
  - - [32, 1408, 1, 3328]
    - [34, 4.152]
  - - [32, 1856, 1, 3328]
    - [13, 5.581]
  - - [32, 2368, 1, 3328]
    - [22, 7.193]
  - - [32, 2944, 1, 3328]
    - [46, 7.427]
  - - [32, 3584, 1, 3328]
    - [24, 8.758]
  - - [32, 4288, 1, 3328]
    - [37, 10.719]
  - - [32, 5056, 1, 3328]
    - [37, 12.665]
  - - [32, 5888, 1, 3328]
    - [24, 14.017]
  - - [32, 6784, 1, 3328]
    - [169, 10.8]
  - - [64, 32, 1, 256]
    - [100, 0.041]
  - - [128, 32, 1, 256]
    - [17, 0.083]
  - - [256, 32, 1, 256]
    - [14, 0.17]
  - - [448, 32, 1, 256]
    - [12, 0.297]
  - - [704, 32, 1, 256]
    - [12, 0.458]
  - - [1024, 32, 1, 256]
    - [17, 0.67]
  - - [1408, 32, 1, 256]
    - [14, 0.495]
  - - [1856, 32, 1, 256]
    - [17, 1.224]
  - - [2368, 32, 1, 256]
    - [12, 0.81]
  - - [2944, 32, 1, 256]
    - [20, 1.887]
  - - [3584, 32, 1, 256]
    - [14, 2.33]
  - - [4288, 32, 1, 256]
    - [13, 1.475]
  - - [5056, 32, 1, 256]
    - [20, 3.175]
  - - [5888, 32, 1, 256]
    - [18, 3.672]
  - - [6784, 32, 1, 256]
    - [14, 4.348]
  - - [64, 32, 1, 1280]
    - [30, 0.095]
  - - [128, 32, 1, 1280]
    - [30, 0.183]
  - - [256, 32, 1, 1280]
    - [22, 0.469]
  - - [448, 32, 1, 1280]
    - [22, 0.858]
  - - [704, 32, 1, 1280]
    - [22, 1.342]
  - - [1024, 32, 1, 1280]
    - [22, 1.883]
  - - [1408, 32, 1, 1280]
    - [22, 2.538]
  - - [1856, 32, 1, 1280]
    - [22, 3.554]
  - - [2368, 32, 1, 1280]
    - [22, 4.354]
  - - [2944, 32, 1, 1280]
    - [13, 5.37]
  - - [3584, 32, 1, 1280]
    - [43, 4.343]
  - - [4288, 32, 1, 1280]
    - [18, 6.943]
  - - [5056, 32, 1, 1280]
    - [14, 8.245]
  - - [5888, 32, 1, 1280]
    - [43, 9.601]
  - - [6784, 32, 1, 1280]
    - [19, 7.094]
  - - [64, 32, 1, 3328]
    - [33, 0.218]
  - - [128, 32, 1, 3328]
    - [33, 0.435]
  - - [256, 32, 1, 3328]
    - [102, 0.839]
  - - [448, 32, 1, 3328]
    - [103, 1.389]
  - - [704, 32, 1, 3328]
    - [33, 2.202]
  - - [1024, 32, 1, 3328]
    - [32, 2.844]
  - - [1408, 32, 1, 3328]
    - [34, 3.893]
  - - [1856, 32, 1, 3328]
    - [34, 5.086]
  - - [2368, 32, 1, 3328]
    - [32, 6.329]
  - - [2944, 32, 1, 3328]
    - [46, 7.277]
  - - [3584, 32, 1, 3328]
    - [43, 8.848]
  - - [4288, 32, 1, 3328]
    - [43, 10.674]
  - - [5056, 32, 1, 3328]
    - [43, 12.56]
  - - [5888, 32, 1, 3328]
    - [43, 14.272]
  - - [6784, 32, 1, 3328]
    - [40, 10.793]
  - - [64, 64, 1, 32]
    - [104, 0.014]
  - - [128, 64, 1, 32]
    - [104, 0.013]
  - - [256, 64, 1, 32]
    - [130, 0.027]
  - - [448, 64, 1, 32]
    - [16, 0.103]
  - - [704, 64, 1, 32]
    - [16, 0.166]
  - - [1024, 64, 1, 32]
    - [117, 0.099]
  - - [1408, 64, 1, 32]
    - [110, 0.138]
  - - [1856, 64, 1, 32]
    - [108, 0.412]
  - - [2368, 64, 1, 32]
    - [15, 0.219]
  - - [2944, 64, 1, 32]
    - [110, 0.635]
  - - [3584, 64, 1, 32]
    - [15, 0.773]
  - - [4288, 64, 1, 32]
    - [101, 0.389]
  - - [5056, 64, 1, 32]
    - [110, 0.456]
  - - [5888, 64, 1, 32]
    - [104, 0.522]
  - - [6784, 64, 1, 32]
    - [100, 0.594]
  - - [64, 128, 1, 32]
    - [107, 0.013]
  - - [128, 128, 1, 32]
    - [109, 0.063]
  - - [256, 128, 1, 32]
    - [100, 0.119]
  - - [448, 128, 1, 32]
    - [16, 0.213]
  - - [704, 128, 1, 32]
    - [114, 0.144]
  - - [1024, 128, 1, 32]
    - [113, 0.446]
  - - [1408, 128, 1, 32]
    - [108, 0.602]
  - - [1856, 128, 1, 32]
    - [16, 0.779]
  - - [2368, 128, 1, 32]
    - [117, 0.436]
  - - [2944, 128, 1, 32]
    - [16, 0.509]
  - - [3584, 128, 1, 32]
    - [106, 1.367]
  - - [4288, 128, 1, 32]
    - [65, 0.761]
  - - [5056, 128, 1, 32]
    - [21, 0.867]
  - - [5888, 128, 1, 32]
    - [133, 0.989]
  - - [6784, 128, 1, 32]
    - [195, 1.137]
  - - [64, 256, 1, 32]
    - [100, 0.06]
  - - [128, 256, 1, 32]
    - [104, 0.054]
  - - [256, 256, 1, 32]
    - [113, 0.099]
  - - [448, 256, 1, 32]
    - [113, 0.394]
  - - [704, 256, 1, 32]
    - [127, 0.26]
  - - [1024, 256, 1, 32]
    - [15, 0.844]
  - - [1408, 256, 1, 32]
    - [118, 0.505]
  - - [1856, 256, 1, 32]
    - [107, 0.639]
  - - [2368, 256, 1, 32]
    - [118, 1.763]
  - - [2944, 256, 1, 32]
    - [48, 0.988]
  - - [3584, 256, 1, 32]
    - [78, 1.186]
  - - [4288, 256, 1, 32]
    - [21, 1.375]
  - - [5056, 256, 1, 32]
    - [195, 1.598]
  - - [5888, 256, 1, 32]
    - [116, 3.235]
  - - [6784, 256, 1, 32]
    - [116, 3.578]
  - - [64, 448, 1, 32]
    - [109, 0.108]
  - - [128, 448, 1, 32]
    - [108, 0.092]
  - - [256, 448, 1, 32]
    - [108, 0.398]
  - - [448, 448, 1, 32]
    - [16, 0.285]
  - - [704, 448, 1, 32]
    - [122, 0.443]
  - - [1024, 448, 1, 32]
    - [100, 0.621]
  - - [1408, 448, 1, 32]
    - [120, 1.866]
  - - [1856, 448, 1, 32]
    - [65, 1.088]
  - - [2368, 448, 1, 32]
    - [16, 1.297]
  - - [2944, 448, 1, 32]
    - [195, 1.682]
  - - [3584, 448, 1, 32]
    - [116, 3.366]
  - - [4288, 448, 1, 32]
    - [195, 2.13]
  - - [5056, 448, 1, 32]
    - [115, 4.043]
  - - [5888, 448, 1, 32]
    - [195, 2.86]
  - - [6784, 448, 1, 32]
    - [195, 3.028]
  - - [64, 704, 1, 32]
    - [101, 0.166]
  - - [128, 704, 1, 32]
    - [118, 0.315]
  - - [256, 704, 1, 32]
    - [123, 0.263]
  - - [448, 704, 1, 32]
    - [114, 0.989]
  - - [704, 704, 1, 32]
    - [15, 1.489]
  - - [1024, 704, 1, 32]
    - [133, 0.955]
  - - [1408, 704, 1, 32]
    - [15, 2.448]
  - - [1856, 704, 1, 32]
    - [195, 1.684]
  - - [2368, 704, 1, 32]
    - [195, 2.018]
  - - [2944, 704, 1, 32]
    - [195, 2.482]
  - - [3584, 704, 1, 32]
    - [195, 2.7]
  - - [4288, 704, 1, 32]
    - [115, 4.573]
  - - [5056, 704, 1, 32]
    - [195, 3.483]
  - - [5888, 704, 1, 32]
    - [195, 3.826]
  - - [6784, 704, 1, 32]
    - [195, 3.982]
  - - [64, 1024, 1, 32]
    - [117, 0.099]
  - - [128, 1024, 1, 32]
    - [113, 0.459]
  - - [256, 1024, 1, 32]
    - [15, 0.829]
  - - [448, 1024, 1, 32]
    - [15, 1.39]
  - - [704, 1024, 1, 32]
    - [116, 1.984]
  - - [1024, 1024, 1, 32]
    - [48, 1.31]
  - - [1408, 1024, 1, 32]
    - [195, 1.81]
  - - [1856, 1024, 1, 32]
    - [119, 3.587]
  - - [2368, 1024, 1, 32]
    - [195, 2.688]
  - - [2944, 1024, 1, 32]
    - [195, 2.989]
  - - [3584, 1024, 1, 32]
    - [195, 3.436]
  - - [4288, 1024, 1, 32]
    - [195, 3.855]
  - - [5056, 1024, 1, 32]
    - [200, 4.246]
  - - [5888, 1024, 1, 32]
    - [115, 5.602]
  - - [6784, 1024, 1, 32]
    - [196, 5.212]
  - - [64, 1408, 1, 32]
    - [113, 0.315]
  - - [128, 1408, 1, 32]
    - [16, 0.267]
  - - [256, 1408, 1, 32]
    - [118, 1.111]
  - - [448, 1408, 1, 32]
    - [56, 0.861]
  - - [704, 1408, 1, 32]
    - [78, 1.283]
  - - [1024, 1408, 1, 32]
    - [195, 1.717]
  - - [1408, 1408, 1, 32]
    - [195, 2.337]
  - - [1856, 1408, 1, 32]
    - [195, 2.808]
  - - [2368, 1408, 1, 32]
    - [195, 3.36]
  - - [2944, 1408, 1, 32]
    - [196, 3.937]
  - - [3584, 1408, 1, 32]
    - [195, 4.441]
  - - [4288, 1408, 1, 32]
    - [200, 4.822]
  - - [5056, 1408, 1, 32]
    - [195, 5.439]
  - - [5888, 1408, 1, 32]
    - [195, 5.769]
  - - [6784, 1408, 1, 32]
    - [195, 6.096]
  - - [64, 1856, 1, 32]
    - [108, 0.412]
  - - [128, 1856, 1, 32]
    - [15, 0.745]
  - - [256, 1856, 1, 32]
    - [15, 1.404]
  - - [448, 1856, 1, 32]
    - [116, 2.221]
  - - [704, 1856, 1, 32]
    - [132, 1.588]
  - - [1024, 1856, 1, 32]
    - [125, 3.606]
  - - [1408, 1856, 1, 32]
    - [116, 4.322]
  - - [1856, 1856, 1, 32]
    - [116, 4.814]
  - - [2368, 1856, 1, 32]
    - [195, 3.892]
  - - [2944, 1856, 1, 32]
    - [198, 4.648]
  - - [3584, 1856, 1, 32]
    - [195, 5.244]
  - - [4288, 1856, 1, 32]
    - [195, 5.528]
  - - [5056, 1856, 1, 32]
    - [196, 5.744]
  - - [5888, 1856, 1, 32]
    - [196, 6.229]
  - - [6784, 1856, 1, 32]
    - [195, 6.502]
  - - [64, 2368, 1, 32]
    - [108, 0.515]
  - - [128, 2368, 1, 32]
    - [119, 0.43]
  - - [256, 2368, 1, 32]
    - [78, 0.828]
  - - [448, 2368, 1, 32]
    - [167, 1.358]
  - - [704, 2368, 1, 32]
    - [115, 3.454]
  - - [1024, 2368, 1, 32]
    - [195, 2.542]
  - - [1408, 2368, 1, 32]
    - [195, 3.27]
  - - [1856, 2368, 1, 32]
    - [195, 3.809]
  - - [2368, 2368, 1, 32]
    - [123, 5.524]
  - - [2944, 2368, 1, 32]
    - [195, 5.196]
  - - [3584, 2368, 1, 32]
    - [196, 5.533]
  - - [4288, 2368, 1, 32]
    - [195, 6.147]
  - - [5056, 2368, 1, 32]
    - [195, 6.498]
  - - [5888, 2368, 1, 32]
    - [195, 6.881]
  - - [6784, 2368, 1, 32]
    - [199, 6.475]
  - - [64, 2944, 1, 32]
    - [15, 0.28]
  - - [128, 2944, 1, 32]
    - [15, 1.181]
  - - [256, 2944, 1, 32]
    - [108, 1.019]
  - - [448, 2944, 1, 32]
    - [118, 2.935]
  - - [704, 2944, 1, 32]
    - [120, 3.852]
  - - [1024, 2944, 1, 32]
    - [195, 3.063]
  - - [1408, 2944, 1, 32]
    - [195, 3.797]
  - - [1856, 2944, 1, 32]
    - [199, 4.493]
  - - [2368, 2944, 1, 32]
    - [195, 5.377]
  - - [2944, 2944, 1, 32]
    - [195, 6.003]
  - - [3584, 2944, 1, 32]
    - [196, 6.301]
  - - [4288, 2944, 1, 32]
    - [195, 6.659]
  - - [5056, 2944, 1, 32]
    - [195, 6.713]
  - - [5888, 2944, 1, 32]
    - [196, 7.159]
  - - [6784, 2944, 1, 32]
    - [196, 7.508]
  - - [64, 3584, 1, 32]
    - [15, 0.701]
  - - [128, 3584, 1, 32]
    - [15, 1.323]
  - - [256, 3584, 1, 32]
    - [47, 1.194]
  - - [448, 3584, 1, 32]
    - [195, 1.918]
  - - [704, 3584, 1, 32]
    - [116, 4.332]
  - - [1024, 3584, 1, 32]
    - [195, 3.578]
  - - [1408, 3584, 1, 32]
    - [195, 4.208]
  - - [1856, 3584, 1, 32]
    - [196, 4.965]
  - - [2368, 3584, 1, 32]
    - [196, 5.678]
  - - [2944, 3584, 1, 32]
    - [196, 6.129]
  - - [3584, 3584, 1, 32]
    - [196, 6.497]
  - - [4288, 3584, 1, 32]
    - [195, 6.851]
  - - [5056, 3584, 1, 32]
    - [198, 7.045]
  - - [5888, 3584, 1, 32]
    - [199, 7.269]
  - - [6784, 3584, 1, 32]
    - [196, 7.671]
  - - [64, 4288, 1, 32]
    - [47, 0.846]
  - - [128, 4288, 1, 32]
    - [116, 1.546]
  - - [256, 4288, 1, 32]
    - [21, 1.375]
  - - [448, 4288, 1, 32]
    - [116, 3.785]
  - - [704, 4288, 1, 32]
    - [195, 3.015]
  - - [1024, 4288, 1, 32]
    - [195, 3.956]
  - - [1408, 4288, 1, 32]
    - [195, 4.902]
  - - [1856, 4288, 1, 32]
    - [196, 5.632]
  - - [2368, 4288, 1, 32]
    - [116, 6.572]
  - - [2944, 4288, 1, 32]
    - [195, 6.563]
  - - [3584, 4288, 1, 32]
    - [196, 6.819]
  - - [4288, 4288, 1, 32]
    - [197, 6.947]
  - - [5056, 4288, 1, 32]
    - [195, 7.048]
  - - [5888, 4288, 1, 32]
    - [195, 7.315]
  - - [6784, 4288, 1, 32]
    - [196, 7.95]
  - - [64, 5056, 1, 32]
    - [110, 0.446]
  - - [128, 5056, 1, 32]
    - [65, 0.859]
  - - [256, 5056, 1, 32]
    - [195, 1.526]
  - - [448, 5056, 1, 32]
    - [195, 2.346]
  - - [704, 5056, 1, 32]
    - [196, 3.4]
  - - [1024, 5056, 1, 32]
    - [196, 4.215]
  - - [1408, 5056, 1, 32]
    - [195, 5.333]
  - - [1856, 5056, 1, 32]
    - [116, 6.557]
  - - [2368, 5056, 1, 32]
    - [195, 6.62]
  - - [2944, 5056, 1, 32]
    - [197, 6.715]
  - - [3584, 5056, 1, 32]
    - [195, 6.905]
  - - [4288, 5056, 1, 32]
    - [200, 7.251]
  - - [5056, 5056, 1, 32]
    - [195, 7.744]
  - - [5888, 5056, 1, 32]
    - [195, 7.899]
  - - [6784, 5056, 1, 32]
    - [195, 8.159]
  - - [64, 5888, 1, 32]
    - [15, 1.161]
  - - [128, 5888, 1, 32]
    - [47, 0.984]
  - - [256, 5888, 1, 32]
    - [195, 1.867]
  - - [448, 5888, 1, 32]
    - [195, 2.803]
  - - [704, 5888, 1, 32]
    - [116, 5.244]
  - - [1024, 5888, 1, 32]
    - [195, 4.94]
  - - [1408, 5888, 1, 32]
    - [196, 5.63]
  - - [1856, 5888, 1, 32]
    - [198, 6.189]
  - - [2368, 5888, 1, 32]
    - [199, 6.499]
  - - [2944, 5888, 1, 32]
    - [195, 7.31]
  - - [3584, 5888, 1, 32]
    - [201, 7.48]
  - - [4288, 5888, 1, 32]
    - [198, 7.571]
  - - [5056, 5888, 1, 32]
    - [199, 7.788]
  - - [5888, 5888, 1, 32]
    - [196, 7.784]
  - - [6784, 5888, 1, 32]
    - [196, 7.952]
  - - [64, 6784, 1, 32]
    - [15, 1.338]
  - - [128, 6784, 1, 32]
    - [192, 1.136]
  - - [256, 6784, 1, 32]
    - [131, 1.987]
  - - [448, 6784, 1, 32]
    - [195, 3.016]
  - - [704, 6784, 1, 32]
    - [195, 4.205]
  - - [1024, 6784, 1, 32]
    - [195, 5.432]
  - - [1408, 6784, 1, 32]
    - [116, 6.366]
  - - [1856, 6784, 1, 32]
    - [195, 6.643]
  - - [2368, 6784, 1, 32]
    - [199, 6.87]
  - - [2944, 6784, 1, 32]
    - [195, 7.381]
  - - [3584, 6784, 1, 32]
    - [196, 7.786]
  - - [4288, 6784, 1, 32]
    - [195, 7.915]
  - - [5056, 6784, 1, 32]
    - [195, 8.111]
  - - [5888, 6784, 1, 32]
    - [196, 8.358]
  - - [6784, 6784, 1, 32]
    - [195, 8.296]
  - - [32, 32, 1, 256]
    - [12, 0.02]
  - - [32, 32, 1, 1280]
    - [30, 0.049]
  - - [32, 32, 1, 3328]
    - [99, 0.111]
  - - [32, 64, 1, 32]
    - [16, 0.007]
  - - [32, 128, 1, 32]
    - [109, 0.015]
  - - [32, 256, 1, 32]
    - [109, 0.031]
  - - [32, 448, 1, 32]
    - [16, 0.022]
  - - [32, 704, 1, 32]
    - [16, 0.084]
  - - [32, 1024, 1, 32]
    - [15, 0.128]
  - - [32, 1408, 1, 32]
    - [104, 0.166]
  - - [32, 1856, 1, 32]
    - [111, 0.214]
  - - [32, 2368, 1, 32]
    - [108, 0.114]
  - - [32, 2944, 1, 32]
    - [108, 0.336]
  - - [32, 3584, 1, 32]
    - [108, 0.405]
  - - [32, 4288, 1, 32]
    - [114, 0.476]
  - - [32, 5056, 1, 32]
    - [108, 0.53]
  - - [32, 5888, 1, 32]
    - [15, 0.606]
  - - [32, 6784, 1, 32]
    - [15, 0.693]
  - - [64, 32, 1, 32]
    - [100, 0.007]
  - - [128, 32, 1, 32]
    - [106, 0.015]
  - - [256, 32, 1, 32]
    - [16, 0.013]
  - - [448, 32, 1, 32]
    - [15, 0.023]
  - - [704, 32, 1, 32]
    - [111, 0.083]
  - - [1024, 32, 1, 32]
    - [100, 0.121]
  - - [1408, 32, 1, 32]
    - [118, 0.07]
  - - [1856, 32, 1, 32]
    - [125, 0.093]
  - - [2368, 32, 1, 32]
    - [123, 0.112]
  - - [2944, 32, 1, 32]
    - [113, 0.323]
  - - [3584, 32, 1, 32]
    - [118, 0.167]
  - - [4288, 32, 1, 32]
    - [113, 0.458]
  - - [5056, 32, 1, 32]
    - [113, 0.516]
  - - [5888, 32, 1, 32]
    - [15, 0.596]
  - - [6784, 32, 1, 32]
    - [15, 0.675]
  - - [1, 1, 1, 1]
    - [2, 0.0]
  - - [1, 64, 1, 256]
    - [6, 0.001]
  - - [1, 128, 1, 256]
    - [3, 0.001]
  - - [1, 256, 1, 256]
    - [6, 0.001]
  - - [1, 448, 1, 256]
    - [5, 0.009]
  - - [1, 704, 1, 256]
    - [6, 0.015]
  - - [1, 1024, 1, 256]
    - [6, 0.021]
  - - [1, 1408, 1, 256]
    - [5, 0.027]
  - - [1, 1856, 1, 256]
    - [6, 0.036]
  - - [1, 2368, 1, 256]
    - [6, 0.048]
  - - [1, 2944, 1, 256]
    - [6, 0.06]
  - - [1, 3584, 1, 256]
    - [6, 0.072]
  - - [1, 4288, 1, 256]
    - [6, 0.084]
  - - [1, 5056, 1, 256]
    - [6, 0.099]
  - - [1, 5888, 1, 256]
    - [8, 0.111]
  - - [1, 6784, 1, 256]
    - [10, 0.032]
  - - [1, 64, 1, 1280]
    - [6, 0.003]
  - - [1, 128, 1, 1280]
    - [6, 0.001]
  - - [1, 256, 1, 1280]
    - [10, 0.002]
  - - [1, 448, 1, 1280]
    - [10, 0.004]
  - - [1, 704, 1, 1280]
    - [10, 0.021]
  - - [1, 1024, 1, 1280]
    - [10, 0.03]
  - - [1, 1408, 1, 1280]
    - [6, 0.039]
  - - [1, 1856, 1, 1280]
    - [10, 0.015]
  - - [1, 2368, 1, 1280]
    - [10, 0.066]
  - - [1, 2944, 1, 1280]
    - [11, 0.084]
  - - [1, 3584, 1, 1280]
    - [11, 0.102]
  - - [1, 4288, 1, 1280]
    - [10, 0.12]
  - - [1, 5056, 1, 1280]
    - [10, 0.141]
  - - [1, 5888, 1, 1280]
    - [10, 0.162]
  - - [1, 6784, 1, 1280]
    - [6, 0.189]
  - - [1, 64, 1, 3328]
    - [10, 0.001]
  - - [1, 128, 1, 3328]
    - [10, 0.001]
  - - [1, 256, 1, 3328]
    - [10, 0.009]
  - - [1, 448, 1, 3328]
    - [10, 0.015]
  - - [1, 704, 1, 3328]
    - [10, 0.007]
  - - [1, 1024, 1, 3328]
    - [10, 0.01]
  - - [1, 1408, 1, 3328]
    - [10, 0.013]
  - - [1, 1856, 1, 3328]
    - [10, 0.057]
  - - [1, 2368, 1, 3328]
    - [10, 0.072]
  - - [1, 2944, 1, 3328]
    - [10, 0.09]
  - - [1, 3584, 1, 3328]
    - [11, 0.111]
  - - [1, 4288, 1, 3328]
    - [11, 0.132]
  - - [1, 5056, 1, 3328]
    - [11, 0.156]
  - - [1, 5888, 1, 3328]
    - [11, 0.18]
  - - [1, 6784, 1, 3328]
    - [11, 0.207]
  - - [64, 1, 1, 256]
    - [8, 0.001]
  - - [128, 1, 1, 256]
    - [3, 0.001]
  - - [256, 1, 1, 256]
    - [3, 0.001]
  - - [448, 1, 1, 256]
    - [3, 0.002]
  - - [704, 1, 1, 256]
    - [6, 0.015]
  - - [1024, 1, 1, 256]
    - [5, 0.021]
  - - [1408, 1, 1, 256]
    - [6, 0.03]
  - - [1856, 1, 1, 256]
    - [6, 0.039]
  - - [2368, 1, 1, 256]
    - [6, 0.048]
  - - [2944, 1, 1, 256]
    - [6, 0.06]
  - - [3584, 1, 1, 256]
    - [8, 0.075]
  - - [4288, 1, 1, 256]
    - [6, 0.087]
  - - [5056, 1, 1, 256]
    - [6, 0.102]
  - - [5888, 1, 1, 256]
    - [6, 0.114]
  - - [6784, 1, 1, 256]
    - [10, 0.165]
  - - [64, 1, 1, 1280]
    - [6, 0.003]
  - - [128, 1, 1, 1280]
    - [10, 0.001]
  - - [256, 1, 1, 1280]
    - [10, 0.002]
  - - [448, 1, 1, 1280]
    - [10, 0.004]
  - - [704, 1, 1, 1280]
    - [10, 0.021]
  - - [1024, 1, 1, 1280]
    - [10, 0.03]
  - - [1408, 1, 1, 1280]
    - [6, 0.039]
  - - [1856, 1, 1, 1280]
    - [11, 0.054]
  - - [2368, 1, 1, 1280]
    - [6, 0.066]
  - - [2944, 1, 1, 1280]
    - [10, 0.084]
  - - [3584, 1, 1, 1280]
    - [10, 0.102]
  - - [4288, 1, 1, 1280]
    - [11, 0.123]
  - - [5056, 1, 1, 1280]
    - [11, 0.144]
  - - [5888, 1, 1, 1280]
    - [10, 0.165]
  - - [6784, 1, 1, 1280]
    - [11, 0.207]
  - - [64, 1, 1, 3328]
    - [10, 0.001]
  - - [128, 1, 1, 3328]
    - [10, 0.001]
  - - [256, 1, 1, 3328]
    - [10, 0.009]
  - - [448, 1, 1, 3328]
    - [10, 0.015]
  - - [704, 1, 1, 3328]
    - [10, 0.007]
  - - [1024, 1, 1, 3328]
    - [10, 0.01]
  - - [1408, 1, 1, 3328]
    - [10, 0.013]
  - - [1856, 1, 1, 3328]
    - [10, 0.057]
  - - [2368, 1, 1, 3328]
    - [10, 0.072]
  - - [2944, 1, 1, 3328]
    - [10, 0.09]
  - - [3584, 1, 1, 3328]
    - [11, 0.111]
  - - [4288, 1, 1, 3328]
    - [11, 0.132]
  - - [5056, 1, 1, 3328]
    - [11, 0.156]
  - - [5888, 1, 1, 3328]
    - [10, 0.18]
  - - [6784, 1, 1, 3328]
    - [11, 0.207]
  - - [64, 64, 1, 1]
    - [112, 0.0]
  - - [128, 64, 1, 1]
    - [15, 0.001]
  - - [256, 64, 1, 1]
    - [109, 0.002]
  - - [448, 64, 1, 1]
    - [15, 0.003]
  - - [704, 64, 1, 1]
    - [112, 0.005]
  - - [1024, 64, 1, 1]
    - [122, 0.003]
  - - [1408, 64, 1, 1]
    - [110, 0.009]
  - - [1856, 64, 1, 1]
    - [114, 0.012]
  - - [2368, 64, 1, 1]
    - [114, 0.016]
  - - [2944, 64, 1, 1]
    - [110, 0.019]
  - - [3584, 64, 1, 1]
    - [110, 0.022]
  - - [4288, 64, 1, 1]
    - [114, 0.026]
  - - [5056, 64, 1, 1]
    - [114, 0.015]
  - - [5888, 64, 1, 1]
    - [129, 0.036]
  - - [6784, 64, 1, 1]
    - [126, 0.04]
  - - [64, 128, 1, 1]
    - [109, 0.001]
  - - [128, 128, 1, 1]
    - [127, 0.001]
  - - [256, 128, 1, 1]
    - [130, 0.003]
  - - [448, 128, 1, 1]
    - [111, 0.006]
  - - [704, 128, 1, 1]
    - [110, 0.004]
  - - [1024, 128, 1, 1]
    - [110, 0.013]
  - - [1408, 128, 1, 1]
    - [110, 0.018]
  - - [1856, 128, 1, 1]
    - [126, 0.023]
  - - [2368, 128, 1, 1]
    - [114, 0.029]
  - - [2944, 128, 1, 1]
    - [118, 0.035]
  - - [3584, 128, 1, 1]
    - [120, 0.02]
  - - [4288, 128, 1, 1]
    - [129, 0.049]
  - - [5056, 128, 1, 1]
    - [116, 0.056]
  - - [5888, 128, 1, 1]
    - [110, 0.032]
  - - [6784, 128, 1, 1]
    - [116, 0.071]
  - - [64, 256, 1, 1]
    - [100, 0.002]
  - - [128, 256, 1, 1]
    - [127, 0.002]
  - - [256, 256, 1, 1]
    - [118, 0.003]
  - - [448, 256, 1, 1]
    - [114, 0.011]
  - - [704, 256, 1, 1]
    - [110, 0.018]
  - - [1024, 256, 1, 1]
    - [114, 0.025]
  - - [1408, 256, 1, 1]
    - [110, 0.016]
  - - [1856, 256, 1, 1]
    - [126, 0.043]
  - - [2368, 256, 1, 1]
    - [114, 0.053]
  - - [2944, 256, 1, 1]
    - [119, 0.064]
  - - [3584, 256, 1, 1]
    - [113, 0.072]
  - - [4288, 256, 1, 1]
    - [115, 0.082]
  - - [5056, 256, 1, 1]
    - [125, 0.087]
  - - [5888, 256, 1, 1]
    - [113, 0.098]
  - - [6784, 256, 1, 1]
    - [132, 0.062]
  - - [64, 448, 1, 1]
    - [100, 0.001]
  - - [128, 448, 1, 1]
    - [114, 0.003]
  - - [256, 448, 1, 1]
    - [108, 0.012]
  - - [448, 448, 1, 1]
    - [110, 0.019]
  - - [704, 448, 1, 1]
    - [114, 0.029]
  - - [1024, 448, 1, 1]
    - [121, 0.019]
  - - [1408, 448, 1, 1]
    - [115, 0.054]
  - - [1856, 448, 1, 1]
    - [114, 0.067]
  - - [2368, 448, 1, 1]
    - [115, 0.08]
  - - [2944, 448, 1, 1]
    - [195, 0.05]
  - - [3584, 448, 1, 1]
    - [115, 0.1]
  - - [4288, 448, 1, 1]
    - [116, 0.113]
  - - [5056, 448, 1, 1]
    - [116, 0.124]
  - - [5888, 448, 1, 1]
    - [116, 0.129]
  - - [6784, 448, 1, 1]
    - [131, 0.139]
  - - [64, 704, 1, 1]
    - [110, 0.005]
  - - [128, 704, 1, 1]
    - [183, 0.004]
  - - [256, 704, 1, 1]
    - [114, 0.018]
  - - [448, 704, 1, 1]
    - [126, 0.03]
  - - [704, 704, 1, 1]
    - [126, 0.044]
  - - [1024, 704, 1, 1]
    - [119, 0.059]
  - - [1408, 704, 1, 1]
    - [119, 0.073]
  - - [1856, 704, 1, 1]
    - [195, 0.049]
  - - [2368, 704, 1, 1]
    - [124, 0.102]
  - - [2944, 704, 1, 1]
    - [115, 0.116]
  - - [3584, 704, 1, 1]
    - [132, 0.124]
  - - [4288, 704, 1, 1]
    - [131, 0.137]
  - - [5056, 704, 1, 1]
    - [195, 0.101]
  - - [5888, 704, 1, 1]
    - [115, 0.156]
  - - [6784, 704, 1, 1]
    - [120, 0.164]
  - - [64, 1024, 1, 1]
    - [115, 0.003]
  - - [128, 1024, 1, 1]
    - [108, 0.014]
  - - [256, 1024, 1, 1]
    - [110, 0.025]
  - - [448, 1024, 1, 1]
    - [126, 0.042]
  - - [704, 1024, 1, 1]
    - [116, 0.059]
  - - [1024, 1024, 1, 1]
    - [21, 0.04]
  - - [1408, 1024, 1, 1]
    - [116, 0.095]
  - - [1856, 1024, 1, 1]
    - [116, 0.112]
  - - [2368, 1024, 1, 1]
    - [116, 0.125]
  - - [2944, 1024, 1, 1]
    - [195, 0.091]
  - - [3584, 1024, 1, 1]
    - [132, 0.147]
  - - [4288, 1024, 1, 1]
    - [116, 0.16]
  - - [5056, 1024, 1, 1]
    - [120, 0.17]
  - - [5888, 1024, 1, 1]
    - [196, 0.15]
  - - [6784, 1024, 1, 1]
    - [196, 0.155]
  - - [64, 1408, 1, 1]
    - [108, 0.004]
  - - [128, 1408, 1, 1]
    - [114, 0.018]
  - - [256, 1408, 1, 1]
    - [114, 0.034]
  - - [448, 1408, 1, 1]
    - [114, 0.053]
  - - [704, 1408, 1, 1]
    - [133, 0.039]
  - - [1024, 1408, 1, 1]
    - [116, 0.093]
  - - [1408, 1408, 1, 1]
    - [116, 0.115]
  - - [1856, 1408, 1, 1]
    - [132, 0.125]
  - - [2368, 1408, 1, 1]
    - [115, 0.141]
  - - [2944, 1408, 1, 1]
    - [120, 0.155]
  - - [3584, 1408, 1, 1]
    - [131, 0.168]
  - - [4288, 1408, 1, 1]
    - [131, 0.172]
  - - [5056, 1408, 1, 1]
    - [195, 0.152]
  - - [5888, 1408, 1, 1]
    - [116, 0.188]
  - - [6784, 1408, 1, 1]
    - [123, 0.192]
  - - [64, 1856, 1, 1]
    - [110, 0.013]
  - - [128, 1856, 1, 1]
    - [111, 0.023]
  - - [256, 1856, 1, 1]
    - [118, 0.02]
  - - [448, 1856, 1, 1]
    - [195, 0.033]
  - - [704, 1856, 1, 1]
    - [115, 0.087]
  - - [1024, 1856, 1, 1]
    - [116, 0.11]
  - - [1408, 1856, 1, 1]
    - [116, 0.125]
  - - [1856, 1856, 1, 1]
    - [116, 0.142]
  - - [2368, 1856, 1, 1]
    - [195, 0.115]
  - - [2944, 1856, 1, 1]
    - [131, 0.167]
  - - [3584, 1856, 1, 1]
    - [196, 0.148]
  - - [4288, 1856, 1, 1]
    - [196, 0.159]
  - - [5056, 1856, 1, 1]
    - [196, 0.169]
  - - [5888, 1856, 1, 1]
    - [116, 0.197]
  - - [6784, 1856, 1, 1]
    - [199, 0.194]
  - - [64, 2368, 1, 1]
    - [110, 0.016]
  - - [128, 2368, 1, 1]
    - [114, 0.03]
  - - [256, 2368, 1, 1]
    - [120, 0.026]
  - - [448, 2368, 1, 1]
    - [111, 0.041]
  - - [704, 2368, 1, 1]
    - [115, 0.104]
  - - [1024, 2368, 1, 1]
    - [115, 0.124]
  - - [1408, 2368, 1, 1]
    - [195, 0.096]
  - - [1856, 2368, 1, 1]
    - [123, 0.157]
  - - [2368, 2368, 1, 1]
    - [123, 0.167]
  - - [2944, 2368, 1, 1]
    - [123, 0.179]
  - - [3584, 2368, 1, 1]
    - [196, 0.167]
  - - [4288, 2368, 1, 1]
    - [196, 0.175]
  - - [5056, 2368, 1, 1]
    - [198, 0.19]
  - - [5888, 2368, 1, 1]
    - [120, 0.206]
  - - [6784, 2368, 1, 1]
    - [200, 0.206]
  - - [64, 2944, 1, 1]
    - [108, 0.018]
  - - [128, 2944, 1, 1]
    - [129, 0.035]
  - - [256, 2944, 1, 1]
    - [115, 0.064]
  - - [448, 2944, 1, 1]
    - [116, 0.092]
  - - [704, 2944, 1, 1]
    - [116, 0.119]
  - - [1024, 2944, 1, 1]
    - [195, 0.09]
  - - [1408, 2944, 1, 1]
    - [115, 0.155]
  - - [1856, 2944, 1, 1]
    - [131, 0.169]
  - - [2368, 2944, 1, 1]
    - [116, 0.181]
  - - [2944, 2944, 1, 1]
    - [196, 0.171]
  - - [3584, 2944, 1, 1]
    - [197, 0.177]
  - - [4288, 2944, 1, 1]
    - [196, 0.195]
  - - [5056, 2944, 1, 1]
    - [196, 0.195]
  - - [5888, 2944, 1, 1]
    - [196, 0.211]
  - - [6784, 2944, 1, 1]
    - [200, 0.221]
  - - [64, 3584, 1, 1]
    - [110, 0.022]
  - - [128, 3584, 1, 1]
    - [126, 0.042]
  - - [256, 3584, 1, 1]
    - [133, 0.036]
  - - [448, 3584, 1, 1]
    - [115, 0.102]
  - - [704, 3584, 1, 1]
    - [115, 0.127]
  - - [1024, 3584, 1, 1]
    - [119, 0.147]
  - - [1408, 3584, 1, 1]
    - [123, 0.163]
  - - [1856, 3584, 1, 1]
    - [196, 0.148]
  - - [2368, 3584, 1, 1]
    - [196, 0.161]
  - - [2944, 3584, 1, 1]
    - [196, 0.187]
  - - [3584, 3584, 1, 1]
    - [196, 0.195]
  - - [4288, 3584, 1, 1]
    - [199, 0.205]
  - - [5056, 3584, 1, 1]
    - [200, 0.21]
  - - [5888, 3584, 1, 1]
    - [196, 0.222]
  - - [6784, 3584, 1, 1]
    - [196, 0.229]
  - - [64, 4288, 1, 1]
    - [118, 0.026]
  - - [128, 4288, 1, 1]
    - [114, 0.049]
  - - [256, 4288, 1, 1]
    - [119, 0.083]
  - - [448, 4288, 1, 1]
    - [115, 0.114]
  - - [704, 4288, 1, 1]
    - [115, 0.141]
  - - [1024, 4288, 1, 1]
    - [195, 0.116]
  - - [1408, 4288, 1, 1]
    - [195, 0.146]
  - - [1856, 4288, 1, 1]
    - [123, 0.184]
  - - [2368, 4288, 1, 1]
    - [122, 0.194]
  - - [2944, 4288, 1, 1]
    - [199, 0.196]
  - - [3584, 4288, 1, 1]
    - [196, 0.204]
  - - [4288, 4288, 1, 1]
    - [200, 0.216]
  - - [5056, 4288, 1, 1]
    - [196, 0.223]
  - - [5888, 4288, 1, 1]
    - [200, 0.227]
  - - [6784, 4288, 1, 1]
    - [196, 0.233]
  - - [64, 5056, 1, 1]
    - [112, 0.032]
  - - [128, 5056, 1, 1]
    - [115, 0.056]
  - - [256, 5056, 1, 1]
    - [116, 0.092]
  - - [448, 5056, 1, 1]
    - [115, 0.122]
  - - [704, 5056, 1, 1]
    - [116, 0.145]
  - - [1024, 5056, 1, 1]
    - [115, 0.168]
  - - [1408, 5056, 1, 1]
    - [116, 0.179]
  - - [1856, 5056, 1, 1]
    - [120, 0.192]
  - - [2368, 5056, 1, 1]
    - [199, 0.185]
  - - [2944, 5056, 1, 1]
    - [196, 0.204]
  - - [3584, 5056, 1, 1]
    - [196, 0.215]
  - - [4288, 5056, 1, 1]
    - [199, 0.222]
  - - [5056, 5056, 1, 1]
    - [196, 0.229]
  - - [5888, 5056, 1, 1]
    - [201, 0.238]
  - - [6784, 5056, 1, 1]
    - [200, 0.243]
  - - [64, 5888, 1, 1]
    - [114, 0.036]
  - - [128, 5888, 1, 1]
    - [133, 0.063]
  - - [256, 5888, 1, 1]
    - [116, 0.1]
  - - [448, 5888, 1, 1]
    - [116, 0.128]
  - - [704, 5888, 1, 1]
    - [131, 0.157]
  - - [1024, 5888, 1, 1]
    - [195, 0.145]
  - - [1408, 5888, 1, 1]
    - [196, 0.172]
  - - [1856, 5888, 1, 1]
    - [196, 0.187]
  - - [2368, 5888, 1, 1]
    - [196, 0.202]
  - - [2944, 5888, 1, 1]
    - [200, 0.213]
  - - [3584, 5888, 1, 1]
    - [196, 0.225]
  - - [4288, 5888, 1, 1]
    - [200, 0.233]
  - - [5056, 5888, 1, 1]
    - [198, 0.238]
  - - [5888, 5888, 1, 1]
    - [197, 0.246]
  - - [6784, 5888, 1, 1]
    - [198, 0.248]
  - - [64, 6784, 1, 1]
    - [129, 0.018]
  - - [128, 6784, 1, 1]
    - [116, 0.07]
  - - [256, 6784, 1, 1]
    - [115, 0.107]
  - - [448, 6784, 1, 1]
    - [115, 0.141]
  - - [704, 6784, 1, 1]
    - [116, 0.164]
  - - [1024, 6784, 1, 1]
    - [196, 0.159]
  - - [1408, 6784, 1, 1]
    - [196, 0.181]
  - - [1856, 6784, 1, 1]
    - [196, 0.19]
  - - [2368, 6784, 1, 1]
    - [200, 0.206]
  - - [2944, 6784, 1, 1]
    - [196, 0.224]
  - - [3584, 6784, 1, 1]
    - [196, 0.234]
  - - [4288, 6784, 1, 1]
    - [199, 0.239]
  - - [5056, 6784, 1, 1]
    - [200, 0.243]
  - - [5888, 6784, 1, 1]
    - [198, 0.249]
  - - [6784, 6784, 1, 1]
    - [197, 0.251]
  - - [1, 1, 1, 256]
    - [5, 0.0]
  - - [1, 1, 1, 1280]
    - [9, 0.0]
  - - [1, 1, 1, 3328]
    - [10, 0.0]
  - - [1, 64, 1, 1]
    - [2, 0.0]
  - - [1, 128, 1, 1]
    - [4, 0.0]
  - - [1, 256, 1, 1]
    - [4, 0.0]
  - - [1, 448, 1, 1]
    - [4, 0.0]
  - - [1, 704, 1, 1]
    - [4, 0.0]
  - - [1, 1024, 1, 1]
    - [4, 0.0]
  - - [1, 1408, 1, 1]
    - [4, 0.001]
  - - [1, 1856, 1, 1]
    - [4, 0.0]
  - - [1, 2368, 1, 1]
    - [2, 0.001]
  - - [1, 2944, 1, 1]
    - [4, 0.001]
  - - [1, 3584, 1, 1]
    - [2, 0.003]
  - - [1, 4288, 1, 1]
    - [4, 0.003]
  - - [1, 5056, 1, 1]
    - [1, 0.003]
  - - [1, 5888, 1, 1]
    - [1, 0.003]
  - - [1, 6784, 1, 1]
    - [7, 0.0]
  - - [64, 1, 1, 1]
    - [7, 0.0]
  - - [128, 1, 1, 1]
    - [4, 0.0]
  - - [256, 1, 1, 1]
    - [2, 0.0]
  - - [448, 1, 1, 1]
    - [7, 0.0]
  - - [704, 1, 1, 1]
    - [2, 0.0]
  - - [1024, 1, 1, 1]
    - [3, 0.001]
  - - [1408, 1, 1, 1]
    - [4, 0.001]
  - - [1856, 1, 1, 1]
    - [4, 0.001]
  - - [2368, 1, 1, 1]
    - [2, 0.001]
  - - [2944, 1, 1, 1]
    - [4, 0.001]
  - - [3584, 1, 1, 1]
    - [2, 0.003]
  - - [4288, 1, 1, 1]
    - [2, 0.003]
  - - [5056, 1, 1, 1]
    - [2, 0.003]
  - - [5888, 1, 1, 1]
    - [2, 0.0]
  - - [6784, 1, 1, 1]
    - [0, 0.003]
  - - [7680, 8192, 1, 8192]
    - [74, 90.736]
  - - [3840, 4096, 1, 4096]
    - [197, 84.215]
  - - [1920, 2048, 1, 2048]
    - [79, 57.534]
  - - [960, 1024, 1, 1024]
    - [56, 26.436]
  - - [480, 512, 1, 512]
    - [18, 7.124]
  - - [8192, 7680, 1, 8192]
    - [197, 94.603]
  - - [4096, 3840, 1, 4096]
    - [197, 83.535]
  - - [2048, 1920, 1, 2048]
    - [76, 59.928]
  - - [1024, 960, 1, 1024]
    - [47, 26.253]
  - - [512, 480, 1, 512]
    - [26, 7.196]
  - - [8192, 8192, 1, 8192]
    - [83, 91.424]
  - - [4096, 4096, 1, 4096]
    - [203, 76.614]
  - - [2048, 2048, 1, 2048]
    - [202, 60.411]
  - - [512, 512, 1, 512]
    - [29, 4.664]
  - - [64, 512, 16, 512]
    - [27, 13.562]
  - - [1024, 2, 1, 1]
    - [127, 0.0]
  - - [1024, 2, 1, 512]
    - [100, 0.065]
  - - [1024, 1024, 1, 77]
    - [189, 2.897]
  - - [1024, 1024, 1, 512]
    - [47, 21.602]
  - - [1024, 4096, 1, 512]
    - [196, 37.486]
  - - [1024, 30522, 1, 77]
    - [196, 14.372]
  - - [4096, 1024, 1, 512]
    - [196, 35.695]
  - - [64, 128, 160, 128]
    - [47, 9.845]
  - - [1024, 2, 1, 10]
    - [130, 0.002]
  - - [1024, 2, 1, 1280]
    - [13, 0.12]
  - - [1024, 1024, 1, 10]
    - [110, 0.772]
  - - [1024, 1024, 1, 200]
    - [47, 10.548]
  - - [1024, 4096, 1, 1280]
    - [137, 55.024]
  - - [1024, 30522, 1, 200]
    - [200, 34.559]
  - - [4096, 1024, 1, 1280]
    - [82, 49.498]
  - - [64, 128, 624, 128]
    - [196, 11.968]
  - - [1024, 2, 1, 39]
    - [109, 0.008]
  - - [1024, 2, 1, 4992]
    - [134, 0.301]
  - - [1024, 1024, 1, 39]
    - [195, 1.515]
  - - [1024, 1024, 1, 780]
    - [65, 23.997]
  - - [1024, 1024, 1, 4992]
    - [61, 49.227]
  - - [1024, 4096, 1, 4992]
    - [76, 74.534]
  - - [1024, 30522, 1, 780]
    - [197, 67.819]
  - - [4096, 1024, 1, 4992]
    - [96, 74.51]
  - - [64, 512, 64, 512]
    - [135, 25.203]
  - - [1024, 2, 1, 4]
    - [127, 0.001]
  - - [1024, 2, 1, 2048]
    - [102, 0.142]
  - - [1024, 1024, 1, 4]
    - [195, 0.16]
  - - [1024, 1024, 1, 308]
    - [65, 14.326]
  - - [1024, 1024, 1, 2048]
    - [202, 35.791]
  - - [1024, 4096, 1, 2048]
    - [79, 59.704]
  - - [1024, 30522, 1, 308]
    - [199, 44.457]
  - - [4096, 1024, 1, 2048]
    - [82, 60.449]
  - - [64, 128, 640, 128]
    - [196, 12.169]
  - - [1024, 2, 1, 40]
    - [100, 0.004]
  - - [1024, 2, 1, 5120]
    - [136, 0.302]
  - - [1024, 1024, 1, 40]
    - [116, 2.935]
  - - [1024, 1024, 1, 800]
    - [195, 21.189]
  - - [1024, 1024, 1, 5120]
    - [61, 49.702]
  - - [1024, 4096, 1, 5120]
    - [137, 75.139]
  - - [1024, 30522, 1, 800]
    - [197, 69.214]
  - - [4096, 1024, 1, 5120]
    - [72, 75.491]
  - - [64, 128, 656, 128]
    - [196, 12.304]
  - - [1024, 2, 1, 41]
    - [130, 0.009]
  - - [1024, 2, 1, 5248]
    - [138, 0.301]
  - - [1024, 1024, 1, 41]
    - [133, 1.562]
  - - [1024, 1024, 1, 820]
    - [195, 19.241]
  - - [1024, 1024, 1, 5248]
    - [61, 50.121]
  - - [1024, 4096, 1, 5248]
    - [137, 75.447]
  - - [1024, 30522, 1, 820]
    - [197, 68.364]
  - - [4096, 1024, 1, 5248]
    - [82, 75.77]
  - - [64, 512, 80, 512]
    - [50, 28.694]
  - - [1024, 2, 1, 5]
    - [111, 0.001]
  - - [1024, 2, 1, 2560]
    - [33, 0.17]
  - - [1024, 1024, 1, 5]
    - [116, 0.389]
  - - [1024, 1024, 1, 385]
    - [47, 17.427]
  - - [1024, 1024, 1, 2560]
    - [61, 41.204]
  - - [1024, 4096, 1, 2560]
    - [79, 64.211]
  - - [1024, 30522, 1, 385]
    - [197, 53.201]
  - - [4096, 1024, 1, 2560]
    - [82, 64.727]
  - - [64, 512, 96, 512]
    - [59, 29.458]
  - - [1024, 2, 1, 6]
    - [127, 0.001]
  - - [1024, 2, 1, 3072]
    - [31, 0.18]
  - - [1024, 1024, 1, 6]
    - [115, 0.479]
  - - [1024, 1024, 1, 462]
    - [195, 13.108]
  - - [1024, 1024, 1, 3072]
    - [61, 43.051]
  - - [1024, 4096, 1, 3072]
    - [137, 66.867]
  - - [1024, 30522, 1, 462]
    - [198, 56.962]
  - - [4096, 1024, 1, 3072]
    - [72, 67.995]
  - - [64, 128, 128, 128]
    - [167, 4.902]
  - - [1024, 2, 1, 8]
    - [130, 0.002]
  - - [1024, 2, 1, 1024]
    - [13, 0.101]
  - - [1024, 1024, 1, 8]
    - [115, 0.622]
  - - [1024, 1024, 1, 160]
    - [47, 9.794]
  - - [1024, 4096, 1, 1024]
    - [196, 51.209]
  - - [1024, 30522, 1, 160]
    - [196, 33.486]
  - - [4096, 1024, 1, 1024]
    - [96, 44.517]
  - - [64, 128, 144, 128]
    - [177, 5.133]
  - - [1024, 2, 1, 9]
    - [111, 0.002]
  - - [1024, 2, 1, 1152]
    - [13, 0.112]
  - - [1024, 1024, 1, 9]
    - [115, 0.695]
  - - [1024, 1024, 1, 180]
    - [133, 9.493]
  - - [1024, 1024, 1, 1152]
    - [21, 29.143]
  - - [1024, 4096, 1, 1152]
    - [196, 52.502]
  - - [1024, 30522, 1, 180]
    - [199, 30.058]
  - - [4096, 1024, 1, 1152]
    - [82, 46.648]
  - - [13, 512, 1, 32768]
    - [139, 3.154]
  - - [256, 128, 1, 32768]
    - [140, 15.352]
  - - [256, 32768, 1, 1]
    - [196, 0.171]
  - - [479, 1024, 1, 32768]
    - [141, 32.394]
  - - [512, 256, 1, 32768]
    - [142, 32.873]
  - - [1024, 512, 1, 32768]
    - [143, 53.543]
  - - [1024, 1024, 1, 32768]
    - [144, 68.046]
  - - [64, 128, 512, 128]
    - [196, 10.994]
  - - [128, 64, 512, 128]
    - [195, 12.399]
  - - [1024, 2, 1, 32]
    - [100, 0.003]
  - - [1024, 1024, 1, 4096]
    - [211, 41.219]
  - - [1024, 4096, 1, 4096]
    - [76, 72.196]
  - - [1024, 30528, 1, 4096]
    - [197, 86.067]
  - - [4096, 1024, 1, 4096]
    - [82, 72.739]
  - - [512, 64, 64, 512]
    - [195, 22.636]
  - - [1024, 30528, 1, 2048]
    - [197, 81.54]
  - - [4, 64, 32768, 4]
    - [108, 0.22]
  - - [4, 64, 38400, 4]
    - [108, 0.222]
  - - [64, 4, 32768, 4]
    - [110, 0.225]
  - - [64, 4, 38400, 4]
    - [110, 0.228]
  - - [1024, 1024, 1, 8192]
    - [144, 55.556]
  - - [1024, 1024, 1, 9600]
    - [144, 58.131]
  - - [1024, 4096, 1, 8192]
    - [137, 80.448]
  - - [1024, 4096, 1, 9600]
    - [137, 81.724]
  - - [1024, 33712, 1, 8192]
    - [74, 88.773]
  - - [1024, 33712, 1, 9600]
    - [73, 89.83]
  - - [4096, 1024, 1, 8192]
    - [72, 79.116]
  - - [4096, 1024, 1, 9600]
    - [82, 80.349]
  - - [1024, 1024, 1, 10064]
    - [145, 57.604]
  - - [1024, 1024, 1, 10080]
    - [146, 58.836]
  - - [1024, 1024, 1, 10200]
    - [144, 56.975]
  - - [1024, 1024, 1, 3840]
    - [61, 46.576]
  - - [1024, 1024, 1, 3968]
    - [61, 46.831]
  - - [1024, 1024, 1, 6528]
    - [61, 51.968]
  - - [1024, 1024, 1, 7104]
    - [61, 53.151]
  - - [1024, 1024, 1, 7200]
    - [144, 52.799]
  - - [1024, 1024, 1, 8064]
    - [144, 54.657]
  - - [1024, 1024, 1, 8160]
    - [147, 55.149]
  - - [1024, 1024, 1, 9216]
    - [144, 57.607]
  - - [1024, 1024, 1, 9520]
    - [144, 56.659]
  - - [1024, 4096, 1, 10064]
    - [137, 81.282]
  - - [1024, 4096, 1, 10080]
    - [137, 82.155]
  - - [1024, 4096, 1, 10200]
    - [137, 81.269]
  - - [1024, 4096, 1, 3840]
    - [76, 71.022]
  - - [1024, 4096, 1, 3968]
    - [137, 71.76]
  - - [1024, 4096, 1, 6528]
    - [76, 78.176]
  - - [1024, 4096, 1, 7104]
    - [137, 79.381]
  - - [1024, 4096, 1, 7200]
    - [76, 79.088]
  - - [1024, 4096, 1, 8064]
    - [137, 80.275]
  - - [1024, 4096, 1, 8160]
    - [137, 80.318]
  - - [1024, 4096, 1, 9216]
    - [137, 81.693]
  - - [1024, 4096, 1, 9520]
    - [137, 80.752]
  - - [1024, 42720, 1, 10080]
    - [79, 91.07]
  - - [1024, 42720, 1, 3968]
    - [201, 87.007]
  - - [1024, 42720, 1, 6528]
    - [79, 88.363]
  - - [1024, 42720, 1, 7104]
    - [79, 88.998]
  - - [1024, 42720, 1, 7200]
    - [79, 89.113]
  - - [1024, 42720, 1, 9520]
    - [79, 89.757]
  - - [4096, 1024, 1, 10064]
    - [72, 79.969]
  - - [4096, 1024, 1, 10080]
    - [96, 81.051]
  - - [4096, 1024, 1, 10200]
    - [82, 80.307]
  - - [4096, 1024, 1, 3840]
    - [82, 71.951]
  - - [4096, 1024, 1, 3968]
    - [82, 72.147]
  - - [4096, 1024, 1, 6528]
    - [82, 78.554]
  - - [4096, 1024, 1, 7104]
    - [96, 78.07]
  - - [4096, 1024, 1, 7200]
    - [82, 78.668]
  - - [4096, 1024, 1, 8064]
    - [96, 79.389]
  - - [4096, 1024, 1, 8160]
    - [82, 79.736]
  - - [4096, 1024, 1, 9216]
    - [82, 80.263]
  - - [4096, 1024, 1, 9520]
    - [82, 79.963]
  - - [14, 64, 10880, 14]
    - [148, 1.241]
  - - [15, 64, 10880, 14]
    - [105, 1.118]
  - - [15, 64, 7680, 15]
    - [149, 1.231]
  - - [15, 64, 10880, 15]
    - [150, 1.258]
  - - [17, 64, 7680, 15]
    - [150, 1.309]
  - - [17, 64, 6144, 17]
    - [128, 1.431]
  - - [17, 64, 7680, 17]
    - [128, 1.47]
  - - [21, 64, 6144, 17]
    - [151, 1.668]
  - - [21, 64, 6144, 21]
    - [152, 2.031]
  - - [24, 64, 4736, 24]
    - [108, 3.732]
  - - [30, 64, 2048, 30]
    - [153, 2.596]
  - - [30, 64, 2048, 31]
    - [148, 2.646]
  - - [31, 64, 2048, 31]
    - [148, 2.566]
  - - [32, 64, 4608, 32]
    - [108, 5.614]
  - - [32, 64, 4608, 35]
    - [114, 5.441]
  - - [34, 64, 4736, 24]
    - [151, 2.762]
  - - [34, 64, 4736, 34]
    - [151, 3.71]
  - - [35, 64, 4608, 35]
    - [151, 3.762]
  - - [64, 14, 10880, 14]
    - [110, 1.959]
  - - [64, 15, 10880, 14]
    - [110, 1.971]
  - - [64, 15, 7680, 15]
    - [113, 1.968]
  - - [64, 15, 10880, 15]
    - [110, 2.048]
  - - [64, 17, 7680, 15]
    - [110, 2.14]
  - - [64, 17, 6144, 17]
    - [110, 2.227]
  - - [64, 17, 7680, 17]
    - [121, 2.257]
  - - [64, 21, 6144, 17]
    - [122, 2.433]
  - - [64, 21, 6144, 21]
    - [122, 2.925]
  - - [64, 24, 4736, 24]
    - [115, 3.445]
  - - [64, 30, 2048, 30]
    - [119, 3.898]
  - - [64, 30, 2048, 31]
    - [119, 3.924]
  - - [64, 31, 2048, 31]
    - [116, 4.009]
  - - [64, 32, 4608, 32]
    - [116, 5.392]
  - - [64, 32, 4608, 35]
    - [115, 5.205]
  - - [64, 34, 4736, 24]
    - [108, 3.039]
  - - [64, 34, 4736, 34]
    - [108, 3.886]
  - - [64, 35, 4608, 35]
    - [116, 3.921]
  - - [512, 64, 1, 512]
    - [17, 1.112]
  - - [64, 512, 1, 512]
    - [14, 1.105]
  - - [64, 128, 1, 128]
    - [16, 0.099]
  - - [128, 64, 1, 128]
    - [13, 0.048]
  - - [74, 2048, 1, 512]
    - [154, 4.577]
  - - [2048, 2048, 1, 512]
    - [196, 37.024]
  - - [1024, 64, 1, 512]
    - [17, 2.211]
  - - [5, 64, 1, 5]
    - [128, 0.0]
  - - [2048, 512, 1, 1]
    - [109, 0.041]
  - - [1600, 1024, 1, 512]
    - [196, 21.821]
  - - [512, 32, 1, 1600]
    - [32, 0.916]
  - - [33, 32, 1, 33]
    - [128, 0.004]
  - - [560, 1024, 1, 1600]
    - [29, 24.969]
  - - [1024, 1600, 1, 1]
    - [119, 0.098]
  - - [1024, 1024, 1, 1600]
    - [80, 33.936]
  - - [512, 512, 1, 1600]
    - [19, 14.451]
  - - [3, 64, 512, 3]
    - [155, 0.022]
  - - [5, 64, 512, 5]
    - [128, 0.065]
  - - [5, 64, 960, 5]
    - [128, 0.102]
  - - [9, 64, 512, 9]
    - [155, 0.19]
  - - [27, 128, 32768, 27]
    - [149, 3.038]
  - - [33, 32, 200, 33]
    - [128, 0.609]
  - - [33, 32, 1600, 33]
    - [156, 2.06]
  - - [67, 2048, 1, 512]
    - [154, 4.21]
  - - [74, 2048, 1, 960]
    - [154, 6.583]
  - - [100, 2048, 1, 512]
    - [15, 5.937]
  - - [256, 1280, 1, 8976]
    - [157, 33.883]
  - - [256, 2560, 1, 8976]
    - [158, 46.805]
  - - [256, 2816, 1, 8976]
    - [159, 48.03]
  - - [256, 3328, 1, 8976]
    - [159, 53.648]
  - - [256, 3584, 1, 8976]
    - [144, 48.886]
  - - [256, 3840, 1, 8976]
    - [144, 52.544]
  - - [256, 4096, 1, 8976]
    - [144, 55.606]
  - - [256, 4352, 1, 8976]
    - [144, 58.804]
  - - [256, 4864, 1, 8976]
    - [80, 59.231]
  - - [256, 5120, 1, 8976]
    - [89, 57.636]
  - - [256, 5632, 1, 8976]
    - [89, 61.678]
  - - [256, 5888, 1, 8976]
    - [89, 63.94]
  - - [256, 6144, 1, 8976]
    - [89, 67.171]
  - - [256, 7168, 1, 8976]
    - [160, 54.757]
  - - [256, 8192, 1, 8976]
    - [160, 72.414]
  - - [256, 8960, 1, 8976]
    - [161, 64.274]
  - - [256, 9728, 1, 8976]
    - [162, 65.06]
  - - [256, 9984, 1, 8976]
    - [73, 64.987]
  - - [256, 10240, 1, 8976]
    - [74, 66.444]
  - - [256, 10496, 1, 8976]
    - [73, 68.052]
  - - [256, 11008, 1, 8976]
    - [74, 69.339]
  - - [256, 11264, 1, 8976]
    - [90, 70.814]
  - - [256, 11520, 1, 8976]
    - [90, 72.336]
  - - [256, 11776, 1, 8976]
    - [163, 73.782]
  - - [256, 12544, 1, 8976]
    - [73, 78.348]
  - - [256, 12800, 1, 8976]
    - [73, 79.985]
  - - [256, 13312, 1, 8976]
    - [163, 82.885]
  - - [256, 13568, 1, 8976]
    - [94, 77.073]
  - - [256, 14336, 1, 8976]
    - [94, 74.229]
  - - [256, 14848, 1, 8976]
    - [164, 76.941]
  - - [256, 15104, 1, 8976]
    - [79, 78.691]
  - - [256, 15872, 1, 8976]
    - [79, 78.628]
  - - [256, 16128, 1, 8976]
    - [137, 78.974]
  - - [256, 17152, 1, 8976]
    - [196, 74.628]
  - - [256, 17408, 1, 8976]
    - [196, 75.349]
  - - [256, 18688, 1, 8976]
    - [67, 74.87]
  - - [256, 19968, 1, 8976]
    - [197, 69.725]
  - - [256, 20480, 1, 8976]
    - [197, 71.499]
  - - [256, 20992, 1, 8976]
    - [197, 73.373]
  - - [256, 21248, 1, 8976]
    - [166, 68.942]
  - - [256, 22016, 1, 8976]
    - [166, 71.415]
  - - [256, 26112, 1, 8976]
    - [166, 83.893]
  - - [256, 32512, 1, 8976]
    - [76, 82.222]
  - - [256, 33536, 1, 8976]
    - [197, 79.254]
  - - [256, 44505, 1, 8976]
    - [67, 76.889]
  - - [257, 4096, 1, 1024]
    - [59, 21.277]
  - - [480, 1024, 1, 32768]
    - [143, 54.476]
  - - [512, 32, 1, 200]
    - [16, 0.249]
  - - [512, 512, 1, 200]
    - [15, 3.861]
  - - [512, 2048, 1, 256]
    - [47, 14.133]
  - - [560, 1024, 1, 200]
    - [48, 4.207]
  - - [768, 2048, 1, 256]
    - [195, 12.582]
  - - [1024, 64, 1, 960]
    - [17, 3.207]
  - - [1024, 256, 1, 1024]
    - [19, 11.37]
  - - [1024, 256, 1, 2304]
    - [35, 16.202]
  - - [1024, 256, 1, 2816]
    - [36, 17.809]
  - - [1024, 256, 1, 3072]
    - [41, 18.366]
  - - [1024, 256, 1, 3584]
    - [39, 17.391]
  - - [1024, 256, 1, 4096]
    - [39, 20.062]
  - - [1024, 256, 1, 4352]
    - [157, 19.626]
  - - [1024, 256, 1, 4608]
    - [168, 21.166]
  - - [1024, 256, 1, 5120]
    - [157, 22.145]
  - - [1024, 256, 1, 5376]
    - [157, 22.581]
  - - [1024, 256, 1, 5632]
    - [157, 23.142]
  - - [1024, 256, 1, 6144]
    - [157, 24.75]
  - - [1024, 256, 1, 6400]
    - [157, 25.1]
  - - [1024, 256, 1, 7680]
    - [157, 27.945]
  - - [1024, 256, 1, 7936]
    - [157, 28.862]
  - - [1024, 256, 1, 8192]
    - [157, 28.878]
  - - [1024, 256, 1, 8448]
    - [157, 29.602]
  - - [1024, 256, 1, 9728]
    - [157, 31.896]
  - - [1024, 256, 1, 9984]
    - [157, 31.954]
  - - [1024, 256, 1, 10496]
    - [157, 34.192]
  - - [1024, 256, 1, 11520]
    - [142, 31.196]
  - - [1024, 256, 1, 12032]
    - [157, 35.658]
  - - [1024, 256, 1, 13568]
    - [157, 37.86]
  - - [1024, 256, 1, 14336]
    - [157, 39.513]
  - - [1024, 256, 1, 14848]
    - [157, 39.314]
  - - [1024, 256, 1, 15104]
    - [157, 39.067]
  - - [1024, 256, 1, 15872]
    - [157, 40.789]
  - - [1024, 256, 1, 16128]
    - [157, 39.636]
  - - [1024, 256, 1, 17152]
    - [157, 41.185]
  - - [1024, 256, 1, 17408]
    - [157, 41.597]
  - - [1024, 256, 1, 18944]
    - [157, 43.026]
  - - [1024, 256, 1, 19712]
    - [157, 44.149]
  - - [1024, 256, 1, 19968]
    - [157, 44.18]
  - - [1024, 256, 1, 21248]
    - [157, 44.532]
  - - [1024, 256, 1, 21504]
    - [157, 45.025]
  - - [1024, 256, 1, 22016]
    - [157, 45.396]
  - - [1024, 256, 1, 28672]
    - [157, 49.241]
  - - [1024, 256, 1, 33536]
    - [157, 50.977]
  - - [1024, 1024, 1, 960]
    - [195, 23.685]
  - - [1600, 1024, 1, 960]
    - [196, 34.967]
  - - [2048, 256, 1, 1024]
    - [19, 20.029]
  - - [2048, 960, 1, 1]
    - [123, 0.111]
  - - [2048, 2048, 1, 960]
    - [196, 48.22]
  - - [2048, 2048, 1, 1024]
    - [196, 44.722]
  - - [3200, 2048, 1, 1024]
    - [196, 60.644]
  - - [4096, 4096, 1, 1024]
    - [197, 64.113]
  - - [2048, 2, 1, 2]
    - [100, 0.0]
  - - [2048, 2048, 1, 2]
    - [122, 0.306]
  - - [2048, 30592, 1, 1024]
    - [197, 80.61]
  - - [2048, 6144, 1, 1024]
    - [197, 67.256]
  - - [2048, 8192, 1, 1024]
    - [198, 72.889]
  - - [8192, 2048, 1, 1024]
    - [197, 71.32]
  - - [1024, 1024, 1, 16]
    - [113, 1.341]
  - - [1024, 2, 1, 16]
    - [110, 0.002]
  - - [1024, 30592, 1, 8192]
    - [196, 90.686]
  - - [1024, 3072, 1, 8192]
    - [73, 78.258]
  - - [512, 64, 256, 512]
    - [195, 34.75]
  - - [64, 512, 256, 512]
    - [170, 32.74]
  - - [1024, 30592, 1, 2048]
    - [74, 74.074]
  - - [1024, 3072, 1, 2048]
    - [73, 59.839]
  - - [1024, 30592, 1, 4096]
    - [196, 87.6]
  - - [1024, 3072, 1, 4096]
    - [90, 70.918]
  - - [512, 64, 128, 512]
    - [195, 30.021]
  - - [64, 512, 128, 512]
    - [49, 29.363]
  - - [2560, 1920, 1, 2048]
    - [67, 61.94]
  - - [2560, 2, 1, 4]
    - [100, 0.001]
  - - [2560, 2560, 1, 2048]
    - [197, 75.093]
  - - [2560, 2560, 1, 4]
    - [116, 0.705]
  - - [2560, 7680, 1, 2048]
    - [197, 82.705]
  - - [640, 2560, 1, 2048]
    - [85, 51.156]
  - - [512, 64, 40, 512]
    - [195, 17.03]
  - - [64, 512, 40, 512]
    - [59, 23.702]
  - - [1536, 1536, 1, 4096]
    - [54, 60.086]
  - - [1536, 4608, 1, 4096]
    - [94, 74.785]
  - - [1536, 50304, 1, 4096]
    - [201, 90.768]
  - - [1536, 6144, 1, 4096]
    - [197, 81.812]
  - - [6144, 1536, 1, 4096]
    - [83, 74.932]
  - - [1024, 96, 64, 1024]
    - [51, 47.627]
  - - [96, 1024, 64, 1024]
    - [196, 49.078]
  - - [1536, 1536, 1, 8192]
    - [60, 65.759]
  - - [1536, 4608, 1, 8192]
    - [94, 81.013]
  - - [1536, 50304, 1, 8192]
    - [83, 91.473]
  - - [1536, 6144, 1, 8192]
    - [73, 80.196]
  - - [6144, 1536, 1, 8192]
    - [73, 80.56]
  - - [1024, 96, 128, 1024]
    - [197, 55.153]
  - - [96, 1024, 128, 1024]
    - [171, 49.92]
  - - [1024, 1024, 1, 16384]
    - [147, 72.667]
  - - [1024, 3072, 1, 16384]
    - [74, 82.459]
  - - [1024, 4096, 1, 16384]
    - [137, 85.475]
  - - [1024, 50304, 1, 16384]
    - [83, 91.972]
  - - [4096, 1024, 1, 16384]
    - [96, 83.746]
  - - [1024, 64, 256, 1024]
    - [195, 49.007]
  - - [64, 1024, 256, 1024]
    - [59, 43.584]
  - - [1024, 50304, 1, 2048]
    - [197, 85.596]
  - - [1024, 64, 32, 1024]
    - [195, 32.636]
  - - [64, 1024, 32, 1024]
    - [172, 33.144]
  - - [1024, 50304, 1, 4096]
    - [201, 89.791]
  - - [1024, 64, 64, 1024]
    - [195, 41.199]
  - - [64, 1024, 64, 1024]
    - [63, 39.534]
  - - [1024, 50304, 1, 8192]
    - [73, 89.465]
  - - [1024, 64, 128, 1024]
    - [195, 45.314]
  - - [64, 1024, 128, 1024]
    - [70, 42.709]
  - - [1024, 2, 1, 64]
    - [100, 0.014]
  - - [1024, 30528, 1, 8192]
    - [137, 90.853]
  - - [1024, 1024, 1, 64]
    - [195, 2.701]
  - - [64, 128, 1024, 128]
    - [196, 14.495]
  - - [128, 64, 1024, 128]
    - [195, 16.507]
  - - [1024, 1024, 1, 3456]
    - [61, 45.265]
  - - [1024, 1024, 1, 6912]
    - [61, 52.716]
  - - [1024, 1024, 1, 864]
    - [195, 22.644]
  - - [1024, 512, 1, 3456]
    - [173, 29.53]
  - - [1024, 512, 1, 4096]
    - [174, 34.902]
  - - [1024, 512, 1, 6912]
    - [173, 39.717]
  - - [1024, 512, 1, 864]
    - [21, 16.678]
  - - [256, 128, 1, 3456]
    - [33, 3.174]
  - - [256, 128, 1, 4096]
    - [140, 3.997]
  - - [256, 128, 1, 55296]
    - [140, 19.61]
  - - [256, 128, 1, 6912]
    - [140, 5.608]
  - - [256, 128, 1, 864]
    - [14, 1.375]
  - - [256, 3456, 1, 1]
    - [122, 0.036]
  - - [256, 4096, 1, 1]
    - [195, 0.042]
  - - [256, 6912, 1, 1]
    - [116, 0.11]
  - - [256, 864, 1, 1]
    - [109, 0.021]
  - - [480, 1024, 1, 3456]
    - [174, 30.505]
  - - [480, 1024, 1, 4096]
    - [174, 28.822]
  - - [480, 1024, 1, 6912]
    - [143, 38.354]
  - - [480, 1024, 1, 864]
    - [21, 15.238]
  - - [512, 256, 1, 3456]
    - [46, 11.067]
  - - [512, 256, 1, 4096]
    - [46, 11.391]
  - - [512, 256, 1, 55296]
    - [175, 39.089]
  - - [512, 256, 1, 6912]
    - [46, 14.945]
  - - [512, 256, 1, 864]
    - [26, 5.316]
  - - [30528, 1024, 1, 640]
    - [198, 65.22]
  - - [30528, 1024, 1, 1280]
    - [198, 75.47]
  - - [4096, 1024, 1, 10240]
    - [96, 81.464]
  - - [1024, 4096, 1, 10240]
    - [76, 82.463]
  - - [30528, 1024, 1, 1600]
    - [197, 77.981]
  - - [1024, 2, 1, 80]
    - [109, 0.008]
  - - [1024, 1024, 1, 10240]
    - [176, 59.243]
  - - [1024, 1024, 1, 80]
    - [189, 3.068]
  - - [64, 128, 1280, 128]
    - [196, 15.539]
  - - [128, 64, 1280, 128]
    - [195, 17.143]
  - - [1024, 4096, 1, 10496]
    - [137, 82.186]
  - - [30528, 1024, 1, 1640]
    - [201, 77.038]
  - - [4096, 1024, 1, 10496]
    - [82, 80.676]
  - - [1024, 1024, 1, 10496]
    - [176, 59.586]
  - - [1024, 1024, 1, 82]
    - [65, 3.133]
  - - [1024, 2, 1, 82]
    - [100, 0.008]
  - - [128, 64, 1312, 128]
    - [195, 16.972]
  - - [64, 128, 1312, 128]
    - [196, 15.219]
  - - [30528, 1024, 1, 160]
    - [198, 31.23]
  - - [1024, 4096, 1, 6144]
    - [137, 77.135]
  - - [30528, 1024, 1, 240]
    - [200, 36.441]
  - - [4096, 1024, 1, 6144]
    - [82, 77.341]
  - - [1024, 1024, 1, 12]
    - [114, 0.927]
  - - [1024, 2, 1, 12]
    - [111, 0.003]
  - - [1024, 1024, 1, 6144]
    - [61, 51.772]
  - - [64, 512, 192, 512]
    - [59, 32.117]
  - - [512, 64, 192, 512]
    - [195, 34.062]
  - - [3136, 64, 64, 128]
    - [195, 18.56]
  - - [3136, 64, 64, 256]
    - [195, 26.965]
  - - [3136, 128, 64, 256]
    - [198, 37.527]
  - - [784, 256, 64, 512]
    - [77, 41.981]
  - - [3136, 256, 64, 128]
    - [196, 28.176]
  - - [3136, 256, 64, 256]
    - [198, 44.447]
  - - [784, 512, 64, 256]
    - [196, 38.693]
  - - [784, 512, 64, 512]
    - [196, 51.409]
  - - [3136, 64, 32, 128]
    - [195, 15.232]
  - - [3136, 64, 32, 256]
    - [195, 22.971]
  - - [3136, 128, 32, 256]
    - [196, 33.477]
  - - [784, 256, 32, 512]
    - [196, 37.227]
  - - [3136, 256, 32, 128]
    - [196, 26.104]
  - - [3136, 256, 32, 256]
    - [198, 41.22]
  - - [784, 512, 32, 256]
    - [196, 34.469]
  - - [784, 512, 32, 512]
    - [196, 45.799]
  - - [3136, 256, 32, 64]
    - [199, 14.155]
  - - [3136, 64, 32, 64]
    - [195, 9.09]
  - - [784, 512, 32, 128]
    - [196, 20.116]
  - - [784, 128, 32, 512]
    - [49, 32.272]
  - - [3136, 64, 64, 64]
    - [195, 11.138]
  - - [3136, 256, 64, 64]
    - [196, 15.781]
  - - [784, 128, 64, 512]
    - [197, 33.678]
  - - [784, 512, 64, 128]
    - [196, 24.176]
  - - [64, 1280, 64, 192]
    - [196, 16.906]
  - - [64, 1280, 64, 320]
    - [178, 23.114]
  - - [64, 1280, 64, 384]
    - [63, 25.748]
  - - [64, 1280, 64, 448]
    - [59, 31.504]
  - - [64, 2048, 64, 192]
    - [196, 19.878]
  - - [64, 2048, 64, 320]
    - [49, 27.027]
  - - [64, 2048, 64, 384]
    - [59, 29.104]
  - - [64, 2048, 64, 448]
    - [59, 31.907]
  - - [64, 1280, 32, 192]
    - [59, 12.375]
  - - [64, 1280, 32, 320]
    - [52, 18.089]
  - - [64, 1280, 32, 384]
    - [177, 20.618]
  - - [64, 1280, 32, 448]
    - [50, 28.701]
  - - [64, 2048, 32, 192]
    - [59, 15.435]
  - - [64, 2048, 32, 320]
    - [179, 23.965]
  - - [64, 2048, 32, 384]
    - [57, 26.529]
  - - [64, 2048, 32, 448]
    - [57, 28.493]
  - - [1024, 1024, 1, 10224]
    - [144, 57.654]
  - - [1024, 1024, 1, 10192]
    - [144, 58.111]
  - - [1024, 1024, 1, 10208]
    - [144, 59.73]
  - - [1024, 4096, 1, 10224]
    - [137, 81.378]
  - - [4096, 1024, 1, 10224]
    - [82, 80.604]
  - - [1024, 3072, 1, 10224]
    - [73, 78.636]
  - - [1024, 3072, 1, 10240]
    - [90, 79.956]
  - - [4096, 1024, 1, 10192]
    - [96, 80.621]
  - - [1024, 3072, 1, 10192]
    - [73, 78.526]
  - - [1024, 4096, 1, 10192]
    - [137, 81.687]
  - - [1024, 3072, 1, 10200]
    - [87, 78.502]
  - - [1024, 1024, 1, 10184]
    - [180, 57.676]
  - - [4096, 1024, 1, 10208]
    - [96, 80.653]
  - - [1024, 3072, 1, 10208]
    - [74, 79.918]
  - - [1024, 4096, 1, 10208]
    - [137, 82.276]
  - - [1024, 2048, 1, 10224]
    - [181, 66.603]
  - - [1024, 2048, 1, 10240]
    - [181, 66.763]
  - - [1024, 1024, 1, 10120]
    - [144, 58.235]
  - - [1024, 2048, 1, 10192]
    - [181, 64.475]
  - - [64, 24, 6816, 24]
    - [116, 3.639]
  - - [1024, 1024, 1, 10152]
    - [176, 57.827]
  - - [1024, 3072, 1, 10080]
    - [73, 79.815]
  - - [64, 26, 6272, 26]
    - [115, 3.976]
  - - [100352, 256, 1, 512]
    - [199, 57.844]
  - - [12544, 1024, 1, 2048]
    - [197, 78.623]
  - - [12544, 147, 1, 64]
    - [195, 3.971]
  - - [200704, 256, 1, 512]
    - [198, 60.416]
  - - [25088, 512, 1, 1024]
    - [197, 68.231]
  - - [3136, 576, 1, 64]
    - [195, 3.958]
  - - [50176, 512, 1, 1024]
    - [197, 72.073]
  - - [6272, 1024, 1, 2048]
    - [196, 70.874]
  - - [784, 1152, 1, 128]
    - [65, 7.617]
  - - [3136, 256, 128, 128]
    - [196, 28.989]
  - - [3136, 256, 256, 128]
    - [196, 29.269]
  - - [3136, 256, 128, 64]
    - [196, 16.289]
  - - [3136, 256, 256, 64]
    - [196, 16.579]
  - - [3136, 64, 128, 256]
    - [195, 29.478]
  - - [3136, 64, 256, 256]
    - [195, 30.781]
  - - [3136, 64, 128, 64]
    - [198, 12.323]
  - - [3136, 64, 256, 64]
    - [195, 13.041]
  - - [784, 128, 128, 512]
    - [197, 39.87]
  - - [784, 128, 256, 512]
    - [77, 42.529]
  - - [784, 512, 128, 128]
    - [196, 26.019]
  - - [784, 512, 256, 128]
    - [196, 27.284]
  - - [784, 512, 128, 256]
    - [196, 41.68]
  - - [784, 512, 256, 256]
    - [196, 43.2]
  - - [64, 128, 2048, 128]
    - [196, 16.821]
  - - [128, 64, 2048, 128]
    - [195, 18.843]
  - - [30528, 1024, 1, 2560]
    - [197, 81.641]
  - - [1024, 1024, 1, 128]
    - [195, 5.105]
  - - [1024, 2, 1, 128]
    - [100, 0.025]
  - - [128, 64, 1536, 128]
    - [195, 17.643]
  - - [64, 128, 1536, 128]
    - [196, 16.005]
  - - [1024, 4096, 1, 12288]
    - [137, 83.43]
  - - [30528, 1024, 1, 1920]
    - [198, 78.777]
  - - [1024, 1024, 1, 96]
    - [195, 3.865]
  - - [1024, 1024, 1, 12288]
    - [144, 59.544]
  - - [4096, 1024, 1, 12288]
    - [96, 81.521]
  - - [1024, 2, 1, 96]
    - [100, 0.02]
  - - [25600, 128, 25, 128]
    - [197, 27.313]
  - - [12544, 128, 36, 128]
    - [197, 27.361]
  - - [9216, 128, 49, 128]
    - [197, 27.317]
  - - [6400, 128, 64, 128]
    - [197, 27.236]
  - - [6400, 256, 25, 256]
    - [201, 46.704]
  - - [4096, 256, 36, 256]
    - [198, 46.012]
  - - [2304, 256, 49, 256]
    - [196, 44.8]
  - - [2304, 256, 64, 256]
    - [198, 46.328]
  - - [2304, 512, 25, 512]
    - [197, 62.329]
  - - [1024, 512, 36, 512]
    - [196, 57.809]
  - - [1024, 512, 49, 512]
    - [196, 61.33]
  - - [1024, 512, 64, 512]
    - [197, 63.988]
  - - [92416, 64, 25, 64]
    - [199, 13.378]
  - - [50176, 64, 36, 64]
    - [198, 13.445]
  - - [36864, 64, 49, 64]
    - [199, 13.701]
  - - [25600, 64, 64, 64]
    - [200, 13.814]
  - - [64, 128, 192, 128]
    - [59, 6.371]
  - - [128, 64, 192, 128]
    - [195, 6.917]
  - - [768, 2, 1, 2048]
    - [33, 0.107]
  - - [3072, 768, 1, 2048]
    - [53, 53.007]
  - - [768, 3072, 1, 2048]
    - [58, 53.319]
  - - [768, 768, 1, 2048]
    - [29, 28.413]
  - - [64, 384, 144, 384]
    - [52, 27.195]
  - - [384, 64, 144, 384]
    - [195, 23.873]
  - - [768, 2, 1, 4608]
    - [184, 0.213]
  - - [3072, 768, 1, 4608]
    - [53, 60.908]
  - - [768, 3072, 1, 4608]
    - [54, 60.757]
  - - [768, 768, 1, 4608]
    - [40, 33.124]
  - - [64, 512, 48, 512]
    - [59, 26.452]
  - - [512, 64, 48, 512]
    - [195, 20.486]
  - - [64, 128, 256, 128]
    - [50, 10.84]
  - - [128, 64, 256, 128]
    - [195, 8.44]
  - - [64, 384, 192, 384]
    - [50, 27.439]
  - - [384, 64, 192, 384]
    - [195, 28.252]
  - - [1024, 2, 1, 4608]
    - [136, 0.287]
  - - [4096, 1024, 1, 4608]
    - [96, 73.69]
  - - [1024, 4096, 1, 4608]
    - [137, 73.515]
  - - [1024, 1024, 1, 4608]
    - [61, 48.389]
  - - [13, 512, 1, 3456]
    - [99, 0.706]
  - - [13, 512, 1, 4096]
    - [139, 0.832]
  - - [13, 512, 1, 55296]
    - [139, 4.057]
  - - [13, 512, 1, 6912]
    - [139, 1.343]
  - - [13, 512, 1, 864]
    - [26, 0.262]
  - - [196, 512, 64, 1024]
    - [67, 45.126]
  - - [196, 1024, 64, 512]
    - [77, 37.998]
  - - [196, 1024, 64, 1024]
    - [77, 49.679]
  - - [49, 1024, 64, 2048]
    - [59, 32.456]
  - - [49, 2048, 64, 1024]
    - [185, 28.379]
  - - [196, 512, 32, 1024]
    - [67, 36.322]
  - - [196, 1024, 32, 512]
    - [67, 33.927]
  - - [196, 1024, 32, 1024]
    - [67, 45.514]
  - - [49, 1024, 32, 2048]
    - [186, 26.788]
  - - [49, 2048, 32, 1024]
    - [59, 26.257]
  - - [196, 1024, 32, 256]
    - [187, 22.535]
  - - [196, 256, 32, 1024]
    - [54, 27.399]
  - - [49, 2048, 32, 512]
    - [188, 18.806]
  - - [49, 512, 32, 2048]
    - [59, 20.837]
  - - [196, 256, 64, 1024]
    - [67, 35.217]
  - - [196, 1024, 64, 256]
    - [55, 26.784]
  - - [49, 512, 64, 2048]
    - [186, 26.257]
  - - [49, 2048, 64, 512]
    - [59, 20.582]
  - - [1225, 192, 64, 32]
    - [167, 5.931]
  - - [1225, 192, 64, 48]
    - [183, 7.934]
  - - [1225, 192, 64, 64]
    - [167, 10.387]
  - - [1225, 256, 64, 48]
    - [189, 8.198]
  - - [1225, 256, 64, 64]
    - [167, 10.849]
  - - [1225, 288, 64, 48]
    - [183, 8.497]
  - - [1225, 288, 64, 64]
    - [183, 10.477]
  - - [5329, 64, 64, 80]
    - [190, 11.053]
  - - [289, 768, 64, 128]
    - [167, 15.578]
  - - [289, 768, 64, 160]
    - [191, 18.109]
  - - [289, 768, 64, 192]
    - [59, 20.678]
  - - [1225, 192, 32, 32]
    - [167, 5.289]
  - - [1225, 192, 32, 48]
    - [183, 7.128]
  - - [1225, 192, 32, 64]
    - [78, 9.183]
  - - [1225, 256, 32, 48]
    - [190, 7.537]
  - - [1225, 256, 32, 64]
    - [167, 9.792]
  - - [1225, 288, 32, 48]
    - [183, 7.719]
  - - [1225, 288, 32, 64]
    - [183, 9.703]
  - - [5329, 64, 32, 80]
    - [190, 10.454]
  - - [289, 768, 32, 128]
    - [167, 13.879]
  - - [289, 768, 32, 160]
    - [170, 15.28]
  - - [289, 768, 32, 192]
    - [59, 18.247]
  - - [196, 2304, 1, 256]
    - [44, 4.376]
  - - [49, 4608, 1, 512]
    - [193, 6.058]
  - - [196, 1024, 128, 256]
    - [55, 27.638]
  - - [196, 1024, 256, 256]
    - [55, 28.417]
  - - [196, 1024, 128, 512]
    - [77, 40.858]
  - - [196, 1024, 256, 512]
    - [67, 42.719]
  - - [196, 256, 128, 1024]
    - [77, 43.922]
  - - [196, 256, 256, 1024]
    - [67, 47.075]
  - - [49, 2048, 128, 512]
    - [185, 22.072]
  - - [49, 2048, 256, 512]
    - [194, 23.275]
  - - [49, 512, 128, 2048]
    - [59, 31.625]
  - - [49, 512, 256, 2048]
    - [59, 34.592]
  - - [3072, 3072, 1, 1024]
    - [197, 58.662]
  - - [5120, 5120, 1, 1024]
    - [197, 65.222]
  - - [6144, 6144, 1, 1024]
    - [197, 68.941]
  - - [7168, 7168, 1, 1024]
    - [197, 70.383]
  - - [8192, 8192, 1, 1024]
    - [197, 72.419]
  - - [9216, 9216, 1, 1024]
    - [198, 72.557]
  - - [10240, 10240, 1, 1024]
    - [199, 72.985]
  - - [11264, 11264, 1, 1024]
    - [197, 73.999]
  - - [12288, 12288, 1, 1024]
    - [197, 74.315]
  - - [13312, 13312, 1, 1024]
    - [197, 74.732]
  - - [14336, 14336, 1, 1024]
    - [197, 74.424]
  - - [15360, 15360, 1, 1024]
    - [197, 74.975]
  - - [16384, 16384, 1, 1024]
    - [197, 75.19]
  - - [17408, 17408, 1, 1024]
    - [197, 75.08]
  - - [18432, 18432, 1, 1024]
    - [197, 74.957]
  - - [19456, 19456, 1, 1024]
    - [197, 75.3]
  - - [20480, 20480, 1, 1024]
    - [200, 75.324]
  - - [21504, 21504, 1, 1024]
    - [197, 75.443]
  - - [22528, 22528, 1, 1024]
    - [197, 75.604]
  - - [23552, 23552, 1, 1024]
    - [197, 75.397]
  - - [24576, 24576, 1, 1024]
    - [197, 75.484]
  - - [25600, 25600, 1, 1024]
    - [197, 75.533]
  - - [26624, 26624, 1, 1024]
    - [197, 75.633]
  - - [27648, 27648, 1, 1024]
    - [197, 75.488]
  - - [28672, 28672, 1, 1024]
    - [197, 75.514]
  - - [29696, 29696, 1, 1024]
    - [197, 75.618]
  - - [30720, 30720, 1, 1024]
    - [197, 75.669]
  - - [31744, 31744, 1, 1024]
    - [197, 75.686]
  - - [32768, 32768, 1, 1024]
    - [197, 75.721]
  - - [33792, 33792, 1, 1024]
    - [197, 75.719]
  - - [34816, 34816, 1, 1024]
    - [197, 75.71]
  - - [35840, 35840, 1, 1024]
    - [197, 75.702]
  - - [36864, 36864, 1, 1024]
    - [197, 75.755]
  - - [37888, 37888, 1, 1024]
    - [197, 75.721]
  - - [38912, 38912, 1, 1024]
    - [197, 75.834]
  - - [39936, 39936, 1, 1024]
    - [197, 75.792]
  - - [40960, 40960, 1, 1024]
    - [200, 75.679]
  - - [41984, 41984, 1, 1024]
    - [197, 75.716]
  - - [43008, 43008, 1, 1024]
    - [197, 75.774]
  - - [44032, 44032, 1, 1024]
    - [197, 75.826]
  - - [45056, 45056, 1, 1024]
    - [197, 75.828]
  - - [46080, 46080, 1, 1024]
    - [197, 75.867]
  - - [47104, 47104, 1, 1024]
    - [197, 75.873]
  - - [48128, 48128, 1, 1024]
    - [197, 75.879]
  - - [49152, 49152, 1, 1024]
    - [197, 75.836]
  - - [50176, 50176, 1, 1024]
    - [197, 75.808]
  - - [51200, 51200, 1, 1024]
    - [197, 75.879]
  - - [52224, 52224, 1, 1024]
    - [197, 75.878]
  - - [53248, 53248, 1, 1024]
    - [197, 75.839]
  - - [54272, 54272, 1, 1024]
    - [197, 75.9]
  - - [55296, 55296, 1, 1024]
    - [197, 75.824]
  - - [56320, 56320, 1, 1024]
    - [197, 75.796]
  - - [57344, 57344, 1, 1024]
    - [197, 75.862]
  - - [58368, 58368, 1, 1024]
    - [197, 75.825]
  - - [59392, 59392, 1, 1024]
    - [197, 75.913]
  - - [60416, 60416, 1, 1024]
    - [197, 75.899]
  - - [61440, 61440, 1, 1024]
    - [197, 75.888]
  - - [62464, 62464, 1, 1024]
    - [197, 75.915]
  - - [63488, 63488, 1, 1024]
    - [197, 75.869]
  - - [64512, 64512, 1, 1024]
    - [197, 75.947]
  - - [65536, 65536, 1, 1024]
    - [197, 75.943]
  - - [66560, 66560, 1, 1024]
    - [197, 75.952]
  - - [67584, 67584, 1, 1024]
    - [197, 75.949]
  - - [68608, 68608, 1, 1024]
    - [197, 75.958]
  - - [69632, 69632, 1, 1024]
    - [197, 75.957]
  - - [70656, 70656, 1, 1024]
    - [197, 75.959]
  - - [71680, 71680, 1, 1024]
    - [197, 75.916]
  - - [72704, 72704, 1, 1024]
    - [197, 75.92]
  - - [73728, 73728, 1, 1024]
    - [197, 75.953]
  - - [74752, 74752, 1, 1024]
    - [197, 75.94]
  - - [75776, 75776, 1, 1024]
    - [197, 75.945]
  - - [76800, 76800, 1, 1024]
    - [197, 75.949]
  - - [77824, 77824, 1, 1024]
    - [197, 75.934]
  - - [78848, 78848, 1, 1024]
    - [197, 75.948]
  - - [79872, 79872, 1, 1024]
    - [197, 75.969]
  - - [80896, 80896, 1, 1024]
    - [200, 75.765]
  - - [81920, 81920, 1, 1024]
    - [197, 75.976]
  - - [82944, 82944, 1, 1024]
    - [197, 75.953]
  - - [83968, 83968, 1, 1024]
    - [197, 75.944]
  - - [84992, 84992, 1, 1024]
    - [197, 75.953]
  - - [86016, 86016, 1, 1024]
    - [197, 75.969]
  - - [87040, 87040, 1, 1024]
    - [197, 75.986]
  - - [88064, 88064, 1, 1024]
    - [197, 75.978]
  - - [89088, 89088, 1, 1024]
    - [201, 75.82]
  - - [90112, 90112, 1, 1024]
    - [197, 75.934]
  - - [4096, 4096, 1, 2048]
    - [203, 74.848]
  - - [8192, 8192, 1, 2048]
    - [204, 79.674]
  - - [12288, 12288, 1, 2048]
    - [205, 82.182]
  - - [16384, 16384, 1, 2048]
    - [202, 80.736]
  - - [20480, 20480, 1, 2048]
    - [205, 82.629]
  - - [24576, 24576, 1, 2048]
    - [205, 82.391]
  - - [28672, 28672, 1, 2048]
    - [206, 83.016]
  - - [32768, 32768, 1, 2048]
    - [207, 80.36]
  - - [36864, 36864, 1, 2048]
    - [206, 83.024]
  - - [40960, 40960, 1, 2048]
    - [208, 82.656]
  - - [45056, 45056, 1, 2048]
    - [208, 82.829]
  - - [49152, 49152, 1, 2048]
    - [209, 81.296]
  - - [53248, 53248, 1, 2048]
    - [210, 82.763]
  - - [57344, 57344, 1, 2048]
    - [210, 82.6]
  - - [61440, 61440, 1, 2048]
    - [210, 82.66]
  - - [65536, 65536, 1, 2048]
    - [202, 78.327]
  - - [69632, 69632, 1, 2048]
    - [210, 82.676]
  - - [73728, 73728, 1, 2048]
    - [208, 82.633]
  - - [77824, 77824, 1, 2048]
    - [210, 82.603]
  - - [81920, 81920, 1, 2048]
    - [208, 80.79]
  - - [86016, 86016, 1, 2048]
    - [210, 82.535]
  - - [90112, 90112, 1, 2048]
    - [208, 82.431]
  - - [2048, 2048, 1, 4096]
    - [212, 62.948]
  - - [8192, 8192, 1, 4096]
    - [213, 81.011]
  - - [12288, 12288, 1, 4096]
    - [214, 84.053]
  - - [16384, 16384, 1, 4096]
    - [215, 82.1]
  - - [20480, 20480, 1, 4096]
    - [216, 83.944]
  - - [24576, 24576, 1, 4096]
    - [217, 84.376]
  - - [28672, 28672, 1, 4096]
    - [217, 84.588]
  - - [32768, 32768, 1, 4096]
    - [218, 83.011]
  - - [36864, 36864, 1, 4096]
    - [219, 84.629]
  - - [40960, 40960, 1, 4096]
    - [220, 84.296]
  - - [45056, 45056, 1, 4096]
    - [220, 84.475]
  - - [49152, 49152, 1, 4096]
    - [221, 83.556]
  - - [53248, 53248, 1, 4096]
    - [222, 84.402]
  - - [57344, 57344, 1, 4096]
    - [223, 84.291]
  - - [61440, 61440, 1, 4096]
    - [224, 84.357]
  - - [65536, 65536, 1, 4096]
    - [225, 82.338]
  - - [69632, 69632, 1, 4096]
    - [223, 84.386]
  - - [73728, 73728, 1, 4096]
    - [220, 84.299]
  - - [77824, 77824, 1, 4096]
    - [222, 84.267]
  - - [81920, 81920, 1, 4096]
    - [225, 83.475]
  - - [86016, 86016, 1, 4096]
    - [220, 84.228]
  - - [90112, 90112, 1, 4096]
    - [223, 84.204]
- null
