library/src/blas3/Tensile/Logic/asm_full/aldebaran_104cu/aldebaran_Cijk_Ailk_Bljk_BBS_BH.yaml
- {MinimumRequiredVersion: 4.32.1}
- aldebaran
- {Architecture: gfx90a, CUCount: 104}
- [Device 0050, Device 0051, Device 0052, Device 0054, Device 0062, Device 7400, Device
    SolutionIndex: 0
    SolutionIndex: 1
    SolutionIndex: 2
    SolutionIndex: 3
    SolutionIndex: 4
    SolutionIndex: 5
    SolutionIndex: 6
    SolutionNameMin: Cijk_Ailk_Bljk_BBS_BH_MT64x16x32_MI16x16x8x1_SE_GRVW2_LPB4_PLR5_SU0_SUS256_SRVW0_WGM1
    SolutionIndex: 7
    SolutionNameMin: Cijk_Ailk_Bljk_BBS_BH_MT64x16x32_MI16x16x16x1_SE_1LDSB0_AF0EM8_EPS1_GRVW2_GSU1_LPB16_NLCA1_PGR1_PLR2_SU0_SUS0_SRVW0_TT1_16_VAW2_WG64_4_1_WGM1
    SolutionIndex: 8
    SolutionNameMin: Cijk_Ailk_Bljk_BBS_BH_MT16x16x64_MI16x16x16x1_SE_1LDSB0_AF0EM8_EPS0_GRVW8_GSU1_LPB16_NLCA1_PGR2_PLR5_SU0_SUS0_SRVW0_TT1_16_VAW2_WG16_4_1_WGM1
    SolutionIndex: 9
    SolutionNameMin: Cijk_Ailk_Bljk_BBS_BH_MT64x16x32_MI16x16x16x1_SE_1LDSB0_AF0EM8_EPS0_GRVW4_GSU1_LPB16_NLCA1_PGR2_PLR2_SU0_SUS0_SRVW0_TT1_16_VAW2_WG64_4_1_WGM1
    SolutionIndex: 10
    SolutionNameMin: Cijk_Ailk_Bljk_BBS_BH_MT64x32x32_MI16x16x16x1_SE_1LDSB1_AF0EM8_EPS1_GRVW2_GSU1_LPB16_NLCA1_PGR1_PLR2_SU0_SUS0_SRVW4_TT2_16_VAW2_WG32_8_1_WGM1
    SolutionIndex: 11
    SolutionNameMin: Cijk_Ailk_Bljk_BBS_BH_MT16x64x64_MI16x16x16x1_SE_1LDSB0_AF0EM8_EPS0_GRVW8_GSU1_LPB16_NLCA1_PGR2_PLR5_SU32_SUS256_SRVW0_TT1_16_VAW2_WG16_16_1_WGM1
    SolutionIndex: 12
    SolutionNameMin: Cijk_Ailk_Bljk_BBS_BH_MT64x32x32_MI16x16x16x1_SE_1LDSB1_AF0EM8_EPS1_GRVW2_GSU1_LPB16_NLCA1_PGR1_PLR2_SU0_SUS0_SRVW4_TT2_16_VAW2_WG32_8_1_WGM15
    SolutionIndex: 13
    SolutionNameMin: Cijk_Ailk_Bljk_BBS_BH_MT64x16x32_MI16x16x16x1_SE_1LDSB0_AF0EM8_EPS0_GRVW8_GSU1_LPB16_NLCA1_PGR2_PLR2_SU0_SUS0_SRVW0_TT1_16_VAW2_WG64_4_1_WGM15
    SolutionIndex: 14
    SolutionNameMin: Cijk_Ailk_Bljk_BBS_BH_MT128x96x32_MI32x32x8x1_SE_1LDSB1_AF0EM8_EPS1_GRVW2_GSU1_LPB8_NLCA1_PGR1_PLR5_SU32_SUS256_SRVW4_TT1_96_VAW2_WG128_2_1_WGM1
    SolutionIndex: 15
    SolutionNameMin: Cijk_Ailk_Bljk_BBS_BH_MT64x16x64_MI16x16x16x1_SE_1LDSB0_AF0EM8_EPS0_GRVW8_GSU1_LPB16_NLCA1_PGR2_PLR5_SU0_SUS0_SRVW0_TT1_16_VAW2_WG64_4_1_WGM1
    SolutionIndex: 16
    SolutionNameMin: Cijk_Ailk_Bljk_BBS_BH_MT128x96x32_MI32x32x8x1_SE_1LDSB0_AF0EM8_EPS0_GRVW4_GSU1_LPB8_NLCA1_PGR2_PLR5_SU32_SUS128_SRVW4_TT1_96_VAW2_WG128_2_1_WGM1
    SolutionIndex: 17
    SolutionNameMin: Cijk_Ailk_Bljk_BBS_BH_MT128x160x32_MI32x32x8x1_SE_1LDSB0_AF0EM8_EPS0_GRVW4_GSU1_LPB8_NLCA1_PGR2_PLR5_SU32_SUS256_SRVW4_TT1_160_VAW2_WG128_2_1_WGM1
    SolutionIndex: 18
    SolutionNameMin: Cijk_Ailk_Bljk_BBS_BH_MT128x64x32_MI32x32x8x1_SE_1LDSB0_AF0EM8_EPS0_GRVW8_GSU1_LPB8_NLCA1_PGR2_PLR5_SU0_SUS0_SRVW4_TT2_32_VAW2_WG64_4_1_WGM15
    SolutionIndex: 19
    SolutionNameMin: Cijk_Ailk_Bljk_BBS_BH_MT128x160x32_MI32x32x8x1_SE_1LDSB0_AF0EM8_EPS0_GRVW4_GSU1_LPB8_NLCA1_PGR2_PLR5_SU32_SUS128_SRVW4_TT1_160_VAW2_WG128_2_1_WGM2
    SolutionIndex: 20
    SolutionNameMin: Cijk_Ailk_Bljk_BBS_BH_MT256x160x32_MI32x32x8x1_SE_1LDSB0_AF0EM8_EPS0_GRVW4_GSU1_LPB8_NLCA1_PGR2_PLR5_SU0_SUS0_SRVW4_TT2_160_VAW2_WG128_2_1_WGM15
    SolutionIndex: 21
    SolutionNameMin: Cijk_Ailk_Bljk_BBS_BH_MT128x160x32_MI32x32x8x1_SE_1LDSB1_AF0EM8_EPS1_GRVW2_GSU1_LPB8_NLCA1_PGR1_PLR5_SU32_SUS128_SRVW4_TT1_160_VAW2_WG128_2_1_WGM1
    SolutionIndex: 22
    SolutionNameMin: Cijk_Ailk_Bljk_BBS_BH_MT128x256x32_MI32x32x8x1_SE_1LDSB1_AF0EM8_EPS0_GRVW8_GSU1_LPB8_NLCA1_PGR2_PLR5_SU0_SUS0_SRVW4_TT2_128_VAW2_WG64_4_1_WGM2
    SolutionIndex: 23
    SolutionNameMin: Cijk_Ailk_Bljk_BBS_BH_MT32x64x32_MI16x16x16x1_SE_1LDSB1_AF0EM8_EPS1_GRVW2_GSU1_LPB16_NLCA1_PGR1_PLR2_SU0_SUS0_SRVW4_TT1_32_VAW2_WG32_8_1_WGM1
    SolutionIndex: 24
    SolutionNameMin: Cijk_Ailk_Bljk_BBS_BH_MT16x64x32_MI16x16x16x1_SE_1LDSB0_AF0EM8_EPS1_GRVW2_GSU1_LPB16_NLCA1_PGR1_PLR2_SU0_SUS0_SRVW0_TT1_16_VAW2_WG16_16_1_WGM1
    SolutionIndex: 25
    SolutionNameMin: Cijk_Ailk_Bljk_BBS_BH_MT32x32x64_MI16x16x16x1_SE_1LDSB0_AF0EM1_EPS0_GRVW4_GSU1_LPB16_NLCA1_PGR2_PLR5_SU0_SUS0_SRVW4_TT1_16_VAW2_WG32_8_1_WGM2
    SolutionIndex: 26
    SolutionNameMin: Cijk_Ailk_Bljk_BBS_BH_MT32x32x64_MI16x16x16x1_SE_1LDSB0_AF0EM1_EPS0_GRVW8_GSU1_LPB16_NLCA1_PGR2_PLR5_SU0_SUS0_SRVW4_TT1_16_VAW2_WG32_8_1_WGM15
    SolutionIndex: 27
    SolutionNameMin: Cijk_Ailk_Bljk_BBS_BH_MT32x32x64_MI16x16x16x1_SE_1LDSB0_AF0EM1_EPS0_GRVW8_GSU1_LPB16_NLCA1_PGR2_PLR5_SU0_SUS0_SRVW4_TT1_16_VAW2_WG32_8_1_WGM1
    SolutionIndex: 28
    SolutionNameMin: Cijk_Ailk_Bljk_BBS_BH_MT64x32x32_MI16x16x16x1_SE_1LDSB1_AF0EM8_EPS1_GRVW2_GSU1_LPB16_NLCA1_PGR1_PLR2_SU0_SUS0_SRVW4_TT2_16_VAW2_WG32_8_1_WGM2
    SolutionIndex: 29
    SolutionNameMin: Cijk_Ailk_Bljk_BBS_BH_MT128x192x32_MI32x32x8x1_SE_1LDSB0_AF0EM8_EPS0_GRVW8_GSU1_LPB8_NLCA1_PGR2_PLR5_SU0_SUS0_SRVW4_TT2_96_VAW2_WG64_4_1_WGM15
    SolutionIndex: 30
    SolutionNameMin: Cijk_Ailk_Bljk_BBS_BH_MT128x192x32_MI32x32x8x1_SE_1LDSB0_AF0EM8_EPS0_GRVW8_GSU1_LPB8_NLCA1_PGR2_PLR5_SU0_SUS0_SRVW4_TT2_96_VAW2_WG64_4_1_WGM2
    SolutionIndex: 31
    SolutionNameMin: Cijk_Ailk_Bljk_BBS_BH_MT128x192x32_MI32x32x8x1_SE_1LDSB0_AF0EM8_EPS0_GRVW8_GSU1_LPB8_NLCA1_PGR2_PLR5_SU32_SUS128_SRVW4_TT2_96_VAW2_WG64_4_1_WGM15
    SolutionIndex: 32
    SolutionNameMin: Cijk_Ailk_Bljk_BBS_BH_MT256x128x32_MI32x32x8x1_SE_1LDSB0_AF0EM8_EPS0_GRVW4_GSU3_LPB8_NLCA1_PGR2_PLR5_SU0_SUS0_SRVW0_TT4_64_VAW1_WG64_4_1_WGM15
    SolutionIndex: 33
    SolutionNameMin: Cijk_Ailk_Bljk_BBS_BH_MT128x128x32_MI32x32x8x1_SE_1LDSB1_AF0EM8_EPS1_GRVW2_GSU1_LPB8_NLCA1_PGR1_PLR5_SU0_SUS0_SRVW4_TT2_64_VAW2_WG64_4_1_WGM1
    SolutionIndex: 34
    SolutionNameMin: Cijk_Ailk_Bljk_BBS_BH_MT64x64x64_MI32x32x8x1_SE_1LDSB0_AF0EM1_EPS0_GRVW8_GSU1_LPB8_NLCA1_PGR2_PLR9_SU0_SUS0_SRVW4_TT1_32_VAW2_WG64_4_1_WGM1
    SolutionIndex: 35
    SolutionNameMin: Cijk_Ailk_Bljk_BBS_BH_MT32x64x64_MI16x16x16x1_SE_1LDSB0_AF0EM8_EPS0_GRVW8_GSU1_LPB16_NLCA1_PGR2_PLR5_SU32_SUS128_SRVW4_TT1_32_VAW2_WG32_8_1_WGM1
    SolutionIndex: 36
    SolutionNameMin: Cijk_Ailk_Bljk_BBS_BH_MT32x64x64_MI16x16x16x1_SE_1LDSB0_AF0EM8_EPS0_GRVW8_GSU1_LPB16_NLCA1_PGR2_PLR5_SU32_SUS256_SRVW4_TT1_32_VAW2_WG32_8_1_WGM1
    SolutionIndex: 37
    SolutionNameMin: Cijk_Ailk_Bljk_BBS_BH_MT64x64x32_MI32x32x8x1_SE_1LDSB0_AF0EM8_EPS0_GRVW8_GSU1_LPB8_NLCA1_PGR2_PLR5_SU0_SUS0_SRVW4_TT1_32_VAW2_WG64_4_1_WGM1
    SolutionIndex: 38
    SolutionNameMin: Cijk_Ailk_Bljk_BBS_BH_MT128x96x32_MI32x32x8x1_SE_1LDSB1_AF0EM8_EPS1_GRVW2_GSU1_LPB8_NLCA1_PGR1_PLR5_SU0_SUS0_SRVW4_TT1_96_VAW2_WG128_2_1_WGM15
    SolutionIndex: 39
    SolutionNameMin: Cijk_Ailk_Bljk_BBS_BH_MT32x64x64_MI16x16x16x1_SE_1LDSB0_AF0EM8_EPS0_GRVW8_GSU1_LPB16_NLCA1_PGR2_PLR5_SU32_SUS256_SRVW4_TT1_32_VAW2_WG32_8_1_WGM15
    SolutionIndex: 40
    SolutionNameMin: Cijk_Ailk_Bljk_BBS_BH_MT96x96x64_MI16x16x16x1_SE_1LDSB0_AF0EM8_EPS0_GRVW8_GSU1_LPB16_NLCA3_PGR2_PLR5_SU0_SUS0_SRVW0_TT3_48_VAW2_WG32_8_1_WGM1
    SolutionIndex: 41
    SolutionNameMin: Cijk_Ailk_Bljk_BBS_BH_MT32x64x32_MI16x16x16x1_SE_1LDSB1_AF0EM8_EPS1_GRVW2_GSU1_LPB16_NLCA1_PGR1_PLR2_SU0_SUS0_SRVW4_TT1_32_VAW2_WG32_8_1_WGM15
    SolutionIndex: 42
    SolutionNameMin: Cijk_Ailk_Bljk_BBS_BH_MT64x128x64_MI32x32x8x1_SE_1LDSB0_AF0EM8_EPS0_GRVW8_GSU1_LPB8_NLCA1_PGR2_PLR9_SU0_SUS0_SRVW4_TT1_64_VAW2_WG64_4_1_WGM1
    SolutionIndex: 43
    SolutionNameMin: Cijk_Ailk_Bljk_BBS_BH_MT64x32x32_MI16x16x16x1_SE_1LDSB1_AF0EM8_EPS1_GRVW2_GSU1_LPB16_NLCA1_PGR1_PLR2_SU32_SUS256_SRVW4_TT2_16_VAW2_WG32_8_1_WGM1
    SolutionIndex: 44
    SolutionNameMin: Cijk_Ailk_Bljk_BBS_BH_MT128x64x32_MI32x32x8x1_SE_1LDSB0_AF0EM8_EPS0_GRVW8_GSU1_LPB8_NLCA1_PGR2_PLR5_SU0_SUS0_SRVW4_TT2_32_VAW2_WG64_4_1_WGM1
    SolutionIndex: 45
    SolutionNameMin: Cijk_Ailk_Bljk_BBS_BH_MT128x128x32_MI32x32x8x1_SE_1LDSB1_AF0EM8_EPS1_GRVW2_GSU1_LPB8_NLCA1_PGR1_PLR5_SU0_SUS0_SRVW4_TT2_64_VAW2_WG64_4_1_WGM2
    SolutionIndex: 46
    SolutionNameMin: Cijk_Ailk_Bljk_BBS_BH_MT128x96x32_MI32x32x8x1_SE_1LDSB1_AF0EM8_EPS1_GRVW2_GSU1_LPB8_NLCA1_PGR1_PLR5_SU32_SUS256_SRVW4_TT1_96_VAW2_WG128_2_1_WGM2
    SolutionIndex: 47
    SolutionNameMin: Cijk_Ailk_Bljk_BBS_BH_MT128x96x32_MI32x32x8x1_SE_1LDSB1_AF0EM8_EPS1_GRVW2_GSU1_LPB8_NLCA1_PGR1_PLR5_SU0_SUS0_SRVW4_TT1_96_VAW2_WG128_2_1_WGM2
    SolutionIndex: 48
    SolutionNameMin: Cijk_Ailk_Bljk_BBS_BH_MT128x96x32_MI32x32x8x1_SE_1LDSB1_AF0EM8_EPS1_GRVW2_GSU1_LPB8_NLCA1_PGR1_PLR5_SU32_SUS128_SRVW4_TT1_96_VAW2_WG128_2_1_WGM15
    SolutionIndex: 49
    SolutionNameMin: Cijk_Ailk_Bljk_BBS_BH_MT128x160x32_MI32x32x8x1_SE_1LDSB1_AF0EM8_EPS1_GRVW2_GSU1_LPB8_NLCA1_PGR1_PLR5_SU32_SUS128_SRVW4_TT1_160_VAW2_WG128_2_1_WGM2
    SolutionIndex: 50
    SolutionNameMin: Cijk_Ailk_Bljk_BBS_BH_MT128x96x32_MI32x32x8x1_SE_1LDSB1_AF0EM8_EPS1_GRVW2_GSU1_LPB8_NLCA1_PGR1_PLR5_SU0_SUS0_SRVW4_TT1_96_VAW2_WG128_2_1_WGM1
    SolutionIndex: 51
    SolutionNameMin: Cijk_Ailk_Bljk_BBS_BH_MT128x96x32_MI32x32x8x1_SE_1LDSB1_AF0EM8_EPS1_GRVW2_GSU1_LPB8_NLCA1_PGR1_PLR5_SU32_SUS256_SRVW4_TT1_96_VAW2_WG128_2_1_WGM15
    SolutionIndex: 52
    SolutionNameMin: Cijk_Ailk_Bljk_BBS_BH_MT128x128x32_MI32x32x8x1_SE_1LDSB1_AF0EM8_EPS1_GRVW2_GSU1_LPB8_NLCA1_PGR1_PLR5_SU32_SUS128_SRVW4_TT2_64_VAW2_WG64_4_1_WGM2
    SolutionIndex: 53
    SolutionNameMin: Cijk_Ailk_Bljk_BBS_BH_MT128x96x32_MI32x32x8x1_SE_1LDSB1_AF0EM8_EPS1_GRVW2_GSU1_LPB8_NLCA1_PGR1_PLR5_SU32_SUS128_SRVW4_TT1_96_VAW2_WG128_2_1_WGM2
    SolutionIndex: 54
    SolutionNameMin: Cijk_Ailk_Bljk_BBS_BH_MT128x96x32_MI32x32x8x1_SE_1LDSB1_AF0EM8_EPS1_GRVW2_GSU1_LPB8_NLCA1_PGR1_PLR5_SU32_SUS128_SRVW4_TT1_96_VAW2_WG128_2_1_WGM1
    SolutionIndex: 55
    SolutionNameMin: Cijk_Ailk_Bljk_BBS_BH_MT128x144x32_MI16x16x16x1_SE_1LDSB1_AF0EM8_EPS1_GRVW2_GSU1_LPB16_NLCA1_PGR1_PLR2_SU32_SUS128_SRVW4_TT2_144_VAW2_WG64_4_1_WGM2
    SolutionIndex: 56
    SolutionNameMin: Cijk_Ailk_Bljk_BBS_BH_MT128x160x32_MI32x32x8x1_SE_1LDSB1_AF0EM8_EPS1_GRVW2_GSU1_LPB8_NLCA1_PGR1_PLR5_SU0_SUS0_SRVW4_TT1_160_VAW2_WG128_2_1_WGM1
    SolutionIndex: 57
    SolutionNameMin: Cijk_Ailk_Bljk_BBS_BH_MT64x128x64_MI32x32x8x1_SE_1LDSB0_AF0EM8_EPS0_GRVW8_GSU1_LPB8_NLCA1_PGR2_PLR9_SU0_SUS0_SRVW4_TT1_64_VAW2_WG64_4_1_WGM2
    SolutionIndex: 58
    SolutionNameMin: Cijk_Ailk_Bljk_BBS_BH_MT128x96x64_MI32x32x8x1_SE_1LDSB0_AF0EM8_EPS0_GRVW8_GSU1_LPB8_NLCA1_PGR2_PLR9_SU0_SUS0_SRVW4_TT1_96_VAW2_WG128_2_1_WGM1
    SolutionIndex: 59
    SolutionNameMin: Cijk_Ailk_Bljk_BBS_BH_MT128x160x32_MI32x32x8x1_SE_1LDSB0_AF0EM8_EPS0_GRVW4_GSU1_LPB8_NLCA1_PGR2_PLR5_SU0_SUS0_SRVW4_TT1_160_VAW2_WG128_2_1_WGM2
    SolutionIndex: 60
    SolutionNameMin: Cijk_Ailk_Bljk_BBS_BH_MT128x128x32_MI32x32x8x1_SE_1LDSB0_AF0EM8_EPS0_GRVW8_GSU1_LPB8_NLCA1_PGR2_PLR5_SU0_SUS0_SRVW4_TT2_64_VAW2_WG64_4_1_WGM1
    SolutionIndex: 61
    SolutionNameMin: Cijk_Ailk_Bljk_BBS_BH_MT128x96x32_MI32x32x8x1_SE_1LDSB0_AF0EM1_EPS0_GRVW4_GSU1_LPB8_NLCA1_PGR2_PLR5_SU0_SUS0_SRVW4_TT1_96_VAW2_WG128_2_1_WGM15
    SolutionIndex: 62
    SolutionNameMin: Cijk_Ailk_Bljk_BBS_BH_MT128x160x32_MI32x32x8x1_SE_1LDSB0_AF0EM8_EPS0_GRVW4_GSU1_LPB8_NLCA1_PGR2_PLR5_SU0_SUS0_SRVW4_TT1_160_VAW2_WG128_2_1_WGM15
    SolutionIndex: 63
    SolutionNameMin: Cijk_Ailk_Bljk_BBS_BH_MT128x192x32_MI32x32x8x1_SE_1LDSB0_AF0EM1_EPS0_GRVW8_GSU1_LPB8_NLCA1_PGR2_PLR5_SU0_SUS0_SRVW4_TT2_96_VAW2_WG64_4_1_WGM1
    SolutionIndex: 64
    SolutionNameMin: Cijk_Ailk_Bljk_BBS_BH_MT256x160x32_MI32x32x8x1_SE_1LDSB0_AF0EM8_EPS0_GRVW4_GSU3_LPB8_NLCA1_PGR2_PLR5_SU0_SUS0_SRVW4_TT2_160_VAW1_WG128_2_1_WGM15
    SolutionIndex: 65
    SolutionNameMin: Cijk_Ailk_Bljk_BBS_BH_MT128x96x32_MI32x32x8x1_SE_1LDSB1_AF0EM1_EPS1_GRVW2_GSU1_LPB8_NLCA1_PGR1_PLR5_SU0_SUS0_SRVW4_TT1_96_VAW2_WG128_2_1_WGM2
    SolutionIndex: 66
    SolutionNameMin: Cijk_Ailk_Bljk_BBS_BH_MT128x128x32_MI32x32x8x1_SE_1LDSB0_AF0EM8_EPS0_GRVW8_GSU1_LPB8_NLCA1_PGR2_PLR5_SU32_SUS128_SRVW4_TT2_64_VAW2_WG64_4_1_WGM15
    SolutionIndex: 67
    SolutionNameMin: Cijk_Ailk_Bljk_BBS_BH_MT256x160x32_MI32x32x8x1_SE_1LDSB0_AF0EM8_EPS0_GRVW4_GSU1_LPB8_NLCA1_PGR2_PLR5_SU0_SUS0_SRVW4_TT2_160_VAW2_WG128_2_1_WGM2
    SolutionIndex: 68
    SolutionNameMin: Cijk_Ailk_Bljk_BBS_BH_MT128x256x32_MI32x32x8x1_SE_1LDSB1_AF0EM8_EPS0_GRVW8_GSU1_LPB8_NLCA1_PGR2_PLR5_SU0_SUS0_SRVW4_TT2_128_VAW2_WG64_4_1_WGM15
    SolutionIndex: 69
    SolutionNameMin: Cijk_Ailk_Bljk_BBS_BH_MT256x160x32_MI32x32x8x1_SE_1LDSB0_AF0EM8_EPS0_GRVW4_GSU5_LPB8_NLCA1_PGR2_PLR5_SU0_SUS0_SRVW4_TT2_160_VAW1_WG128_2_1_WGM1
    SolutionIndex: 70
    SolutionNameMin: Cijk_Ailk_Bljk_BBS_BH_MT128x256x32_MI32x32x8x1_SE_1LDSB1_AF0EM8_EPS0_GRVW8_GSU1_LPB8_NLCA1_PGR2_PLR5_SU0_SUS0_SRVW4_TT2_128_VAW2_WG64_4_1_WGM1
    SolutionIndex: 71
    SolutionNameMin: Cijk_Ailk_Bljk_BBS_BH_MT256x192x32_MI32x32x8x1_SE_1LDSB1_AF0EM8_EPS0_GRVW8_GSU1_LPB8_NLCA1_PGR2_PLR5_SU0_SUS0_SRVW4_TT4_96_VAW2_WG64_4_1_WGM1
    SolutionIndex: 72
    SolutionNameMin: Cijk_Ailk_Bljk_BBS_BH_MT64x64x64_MI32x32x8x1_SE_1LDSB0_AF0EM8_EPS0_GRVW8_GSU1_LPB8_NLCA1_PGR2_PLR9_SU32_SUS256_SRVW4_TT1_32_VAW2_WG64_4_1_WGM1
    SolutionIndex: 73
    SolutionNameMin: Cijk_Ailk_Bljk_BBS_BH_MT64x128x32_MI32x32x8x1_SE_1LDSB0_AF0EM8_EPS1_GRVW8_GSU1_LPB8_NLCA1_PGR1_PLR5_SU0_SUS0_SRVW4_TT1_64_VAW2_WG64_4_1_WGM15
    SolutionIndex: 74
    SolutionNameMin: Cijk_Ailk_Bljk_BBS_BH_MT64x64x32_MI32x32x8x1_SE_1LDSB0_AF0EM8_EPS0_GRVW2_GSU1_LPB8_NLCA1_PGR2_PLR5_SU0_SUS0_SRVW4_TT1_32_VAW2_WG64_4_1_WGM15
    SolutionIndex: 75
    SolutionNameMin: Cijk_Ailk_Bljk_BBS_BH_MT64x128x64_MI32x32x8x1_SE_1LDSB0_AF0EM8_EPS0_GRVW8_GSU1_LPB8_NLCA1_PGR2_PLR9_SU0_SUS0_SRVW4_TT1_64_VAW2_WG64_4_1_WGM15
    SolutionIndex: 76
    SolutionNameMin: Cijk_Ailk_Bljk_BBS_BH_MT64x32x32_MI16x16x16x1_SE_1LDSB0_AF0EM1_EPS0_GRVW2_GSU1_LPB16_NLCA1_PGR2_PLR2_SU0_SUS0_SRVW4_TT2_16_VAW2_WG32_8_1_WGM1
    SolutionIndex: 77
    SolutionNameMin: Cijk_Ailk_Bljk_BBS_BH_MT128x64x32_MI32x32x8x1_SE_1LDSB0_AF0EM1_EPS0_GRVW8_GSU1_LPB8_NLCA1_PGR2_PLR5_SU0_SUS0_SRVW4_TT2_32_VAW2_WG64_4_1_WGM1
    SolutionIndex: 78
    SolutionNameMin: Cijk_Ailk_Bljk_BBS_BH_MT64x128x32_MI32x32x8x1_SE_1LDSB0_AF0EM1_EPS0_GRVW2_GSU1_LPB8_NLCA1_PGR2_PLR5_SU0_SUS0_SRVW4_TT1_64_VAW2_WG64_4_1_WGM15
    SolutionIndex: 79
    SolutionNameMin: Cijk_Ailk_Bljk_BBS_BH_MT128x96x32_MI32x32x8x1_SE_1LDSB1_AF0EM1_EPS1_GRVW2_GSU1_LPB8_NLCA1_PGR1_PLR5_SU0_SUS0_SRVW4_TT1_96_VAW2_WG128_2_1_WGM15
    SolutionIndex: 80
    SolutionNameMin: Cijk_Ailk_Bljk_BBS_BH_MT64x64x64_MI32x32x8x1_SE_1LDSB0_AF0EM8_EPS0_GRVW8_GSU1_LPB8_NLCA1_PGR2_PLR9_SU0_SUS0_SRVW4_TT1_32_VAW2_WG64_4_1_WGM1
    SolutionIndex: 81
    SolutionNameMin: Cijk_Ailk_Bljk_BBS_BH_MT64x192x64_MI32x32x8x1_SE_1LDSB1_AF0EM8_EPS1_GRVW2_GSU1_LPB8_NLCA1_PGR1_PLR9_SU0_SUS0_SRVW4_TT1_96_VAW2_WG64_4_1_WGM2
    SolutionIndex: 82
    SolutionNameMin: Cijk_Ailk_Bljk_BBS_BH_MT64x32x32_MI16x16x16x1_SE_1LDSB1_AF0EM1_EPS1_GRVW2_GSU1_LPB16_NLCA1_PGR1_PLR2_SU0_SUS0_SRVW4_TT2_16_VAW2_WG32_8_1_WGM15
    SolutionIndex: 83
    SolutionNameMin: Cijk_Ailk_Bljk_BBS_BH_MT128x64x32_MI32x32x8x1_SE_1LDSB0_AF0EM8_EPS0_GRVW4_GSU1_LPB8_NLCA1_PGR2_PLR5_SU0_SUS0_SRVW4_TT2_32_VAW2_WG64_4_1_WGM15
    SolutionIndex: 84
    SolutionNameMin: Cijk_Ailk_Bljk_BBS_BH_MT64x64x32_MI32x32x8x1_SE_1LDSB0_AF0EM1_EPS0_GRVW2_GSU1_LPB8_NLCA1_PGR2_PLR5_SU32_SUS256_SRVW4_TT1_32_VAW2_WG64_4_1_WGM15
    SolutionIndex: 85
    SolutionNameMin: Cijk_Ailk_Bljk_BBS_BH_MT64x128x32_MI32x32x8x1_SE_1LDSB0_AF0EM8_EPS0_GRVW4_GSU1_LPB8_NLCA1_PGR2_PLR5_SU0_SUS0_SRVW4_TT1_64_VAW2_WG64_4_1_WGM1
    SolutionIndex: 86
    SolutionNameMin: Cijk_Ailk_Bljk_BBS_BH_MT64x128x32_MI32x32x8x1_SE_1LDSB0_AF0EM1_EPS0_GRVW4_GSU1_LPB8_NLCA1_PGR2_PLR5_SU0_SUS0_SRVW4_TT1_64_VAW2_WG64_4_1_WGM15
    SolutionIndex: 87
    SolutionNameMin: Cijk_Ailk_Bljk_BBS_BH_MT64x128x32_MI32x32x8x1_SE_1LDSB0_AF0EM1_EPS0_GRVW4_GSU1_LPB8_NLCA1_PGR2_PLR5_SU32_SUS128_SRVW4_TT1_64_VAW2_WG64_4_1_WGM1
    SolutionIndex: 88
    SolutionNameMin: Cijk_Ailk_Bljk_BBS_BH_MT32x64x64_MI16x16x16x1_SE_1LDSB0_AF0EM1_EPS0_GRVW4_GSU1_LPB16_NLCA1_PGR2_PLR5_SU0_SUS0_SRVW4_TT1_32_VAW2_WG32_8_1_WGM1
    SolutionIndex: 89
    SolutionNameMin: Cijk_Ailk_Bljk_BBS_BH_MT128x256x32_MI32x32x8x1_SE_1LDSB1_AF0EM8_EPS0_GRVW8_GSU1_LPB8_NLCA1_PGR2_PLR5_SU32_SUS128_SRVW4_TT2_128_VAW2_WG64_4_1_WGM1
    SolutionIndex: 90
    SolutionNameMin: Cijk_Ailk_Bljk_BBS_BH_MT64x128x64_MI32x32x8x1_SE_1LDSB0_AF0EM1_EPS0_GRVW8_GSU1_LPB8_NLCA1_PGR2_PLR9_SU0_SUS0_SRVW4_TT1_64_VAW2_WG64_4_1_WGM2
    SolutionIndex: 91
    SolutionNameMin: Cijk_Ailk_Bljk_BBS_BH_MT128x128x32_MI32x32x8x1_SE_1LDSB1_AF0EM8_EPS1_GRVW2_GSU1_LPB8_NLCA1_PGR1_PLR5_SU32_SUS256_SRVW4_TT2_64_VAW2_WG64_4_1_WGM1
    SolutionIndex: 92
    SolutionNameMin: Cijk_Ailk_Bljk_BBS_BH_MT128x128x32_MI32x32x8x1_SE_1LDSB1_AF0EM8_EPS1_GRVW2_GSU1_LPB8_NLCA1_PGR1_PLR5_SU0_SUS0_SRVW4_TT2_64_VAW2_WG64_4_1_WGM15
    SolutionIndex: 93
    SolutionNameMin: Cijk_Ailk_Bljk_BBS_BH_MT16x64x32_MI16x16x16x1_SE_1LDSB0_AF0EM8_EPS0_GRVW8_GSU1_LPB16_NLCA1_PGR2_PLR2_SU0_SUS0_SRVW0_TT1_16_VAW2_WG16_16_1_WGM1
    SolutionIndex: 94
    SolutionNameMin: Cijk_Ailk_Bljk_BBS_BH_MT16x16x64_MI16x16x16x1_SE_1LDSB0_AF0EM8_EPS0_GRVW8_GSU1_LPB16_NLCA1_PGR2_PLR5_SU32_SUS256_SRVW0_TT1_16_VAW2_WG16_4_1_WGM1
    SolutionIndex: 95
    SolutionNameMin: Cijk_Ailk_Bljk_BBS_BH_MT128x128x32_MI32x32x8x1_SE_1LDSB1_AF0EM1_EPS1_GRVW2_GSU1_LPB8_NLCA1_PGR1_PLR5_SU0_SUS0_SRVW4_TT2_64_VAW2_WG64_4_1_WGM1
    SolutionIndex: 96
    SolutionNameMin: Cijk_Ailk_Bljk_BBS_BH_MT128x128x32_MI32x32x8x1_SE_1LDSB1_AF0EM1_EPS1_GRVW2_GSU1_LPB8_NLCA1_PGR1_PLR5_SU0_SUS0_SRVW4_TT2_64_VAW2_WG64_4_1_WGM2
    SolutionIndex: 97
    SolutionNameMin: Cijk_Ailk_Bljk_BBS_BH_MT64x64x64_MI32x32x8x1_SE_1LDSB0_AF0EM8_EPS0_GRVW8_GSU1_LPB8_NLCA1_PGR2_PLR9_SU0_SUS0_SRVW4_TT1_32_VAW2_WG64_4_1_WGM15
    SolutionIndex: 98
    SolutionNameMin: Cijk_Ailk_Bljk_BBS_BH_MT64x128x32_MI32x32x8x1_SE_1LDSB0_AF0EM8_EPS0_GRVW8_GSU1_LPB8_NLCA1_PGR2_PLR5_SU32_SUS128_SRVW4_TT1_64_VAW2_WG64_4_1_WGM1
    SolutionIndex: 99
    SolutionNameMin: Cijk_Ailk_Bljk_BBS_BH_MT16x16x64_MI16x16x16x1_SE_1LDSB0_AF0EM8_EPS0_GRVW4_GSU1_LPB16_NLCA1_PGR2_PLR5_SU0_SUS0_SRVW0_TT1_16_VAW2_WG16_4_1_WGM1
    SolutionIndex: 100
    SolutionNameMin: Cijk_Ailk_Bljk_BBS_BH_MT128x96x64_MI32x32x8x1_SE_1LDSB0_AF0EM8_EPS0_GRVW8_GSU15_LPB8_NLCA1_PGR2_PLR9_SU0_SUS0_SRVW4_TT1_96_VAW1_WG128_2_1_WGM15
    SolutionIndex: 101
    SolutionNameMin: Cijk_Ailk_Bljk_BBS_BH_MT64x64x32_MI32x32x8x1_SE_1LDSB0_AF0EM8_EPS0_GRVW8_GSU1_LPB8_NLCA1_PGR2_PLR5_SU0_SUS0_SRVW4_TT1_32_VAW2_WG64_4_1_WGM2
    SolutionIndex: 102
    SolutionNameMin: Cijk_Ailk_Bljk_BBS_BH_MT128x64x64_MI32x32x8x1_SE_1LDSB0_AF0EM8_EPS0_GRVW8_GSU1_LPB8_NLCA1_PGR2_PLR9_SU0_SUS0_SRVW4_TT2_32_VAW2_WG64_4_1_WGM15
    SolutionIndex: 103
    SolutionNameMin: Cijk_Ailk_Bljk_BBS_BH_MT128x256x32_MI32x32x8x1_SE_1LDSB1_AF0EM1_EPS0_GRVW8_GSU1_LPB8_NLCA1_PGR2_PLR5_SU0_SUS0_SRVW4_TT2_128_VAW2_WG64_4_1_WGM2
    SolutionIndex: 104
    SolutionNameMin: Cijk_Ailk_Bljk_BBS_BH_MT64x32x32_MI16x16x16x1_SE_1LDSB0_AF0EM8_EPS1_GRVW2_GSU1_LPB16_NLCA1_PGR1_PLR2_SU0_SUS0_SRVW4_TT2_16_VAW2_WG32_8_1_WGM1
    SolutionIndex: 105
    SolutionNameMin: Cijk_Ailk_Bljk_BBS_BH_MT128x96x64_MI32x32x8x1_SE_1LDSB0_AF0EM8_EPS1_GRVW8_GSU5_LPB8_NLCA1_PGR1_PLR9_SU0_SUS0_SRVW0_TT1_96_VAW1_WG128_2_1_WGM2
    SolutionIndex: 106
    SolutionNameMin: Cijk_Ailk_Bljk_BBS_BH_MT128x128x32_MI32x32x8x1_SE_1LDSB0_AF0EM1_EPS0_GRVW8_GSU5_LPB8_NLCA1_PGR2_PLR5_SU0_SUS0_SRVW4_TT2_64_VAW1_WG64_4_1_WGM2
    SolutionIndex: 107
    SolutionNameMin: Cijk_Ailk_Bljk_BBS_BH_MT64x16x32_MI16x16x16x1_SE_1LDSB0_AF0EM8_EPS0_GRVW2_GSU1_LPB16_NLCA1_PGR2_PLR2_SU0_SUS0_SRVW0_TT1_16_VAW2_WG64_4_1_WGM1
    SolutionIndex: 108
    SolutionNameMin: Cijk_Ailk_Bljk_BBS_BH_MT128x128x32_MI32x32x8x1_SE_1LDSB1_AF0EM1_EPS1_GRVW2_GSU1_LPB8_NLCA1_PGR1_PLR5_SU32_SUS256_SRVW4_TT2_64_VAW2_WG64_4_1_WGM2
    SolutionIndex: 109
    SolutionNameMin: Cijk_Ailk_Bljk_BBS_BH_MT256x192x32_MI32x32x8x1_SE_1LDSB1_AF0EM8_EPS1_GRVW8_GSU1_LPB8_NLCA1_PGR1_PLR5_SU0_SUS0_SRVW4_TT4_96_VAW2_WG64_4_1_WGM1
    SolutionIndex: 110
    SolutionNameMin: Cijk_Ailk_Bljk_BBS_BH_MT64x128x64_MI32x32x8x1_SE_1LDSB0_AF0EM8_EPS0_GRVW8_GSU1_LPB8_NLCA1_PGR2_PLR9_SU32_SUS256_SRVW4_TT1_64_VAW2_WG64_4_1_WGM1
    SolutionIndex: 111
    SolutionNameMin: Cijk_Ailk_Bljk_BBS_BH_MT128x96x64_MI32x32x8x1_SE_1LDSB0_AF0EM8_EPS0_GRVW8_GSU1_LPB8_NLCA1_PGR2_PLR9_SU0_SUS0_SRVW4_TT1_96_VAW2_WG128_2_1_WGM15
    SolutionIndex: 112
    SolutionNameMin: Cijk_Ailk_Bljk_BBS_BH_MT160x128x32_MI32x32x8x1_SE_1LDSB0_AF0EM8_EPS0_GRVW4_GSU1_LPB8_NLCA5_PGR2_PLR5_SU0_SUS0_SRVW0_TT5_32_VAW2_WG32_8_1_WGM1
    SolutionIndex: 113
    SolutionNameMin: Cijk_Ailk_Bljk_BBS_BH_MT128x128x32_MI32x32x8x1_SE_1LDSB0_AF0EM8_EPS0_GRVW8_GSU1_LPB8_NLCA1_PGR2_PLR5_SU32_SUS256_SRVW4_TT2_64_VAW2_WG64_4_1_WGM1
    SolutionIndex: 114
    SolutionNameMin: Cijk_Ailk_Bljk_BBS_BH_MT128x160x32_MI32x32x8x1_SE_1LDSB0_AF0EM8_EPS0_GRVW4_GSU1_LPB8_NLCA1_PGR2_PLR5_SU32_SUS256_SRVW4_TT1_160_VAW2_WG128_2_1_WGM2
    SolutionIndex: 115
    SolutionNameMin: Cijk_Ailk_Bljk_BBS_BH_MT96x128x64_MI32x32x8x1_SE_1LDSB0_AF0EM1_EPS0_GRVW8_GSU1_LPB8_NLCA3_PGR2_PLR9_SU0_SUS0_SRVW0_TT3_32_VAW2_WG32_8_1_WGM1
    SolutionIndex: 116
    SolutionNameMin: Cijk_Ailk_Bljk_BBS_BH_MT64x128x64_MI32x32x8x1_SE_1LDSB0_AF0EM8_EPS0_GRVW8_GSU1_LPB8_NLCA1_PGR2_PLR9_SU32_SUS256_SRVW4_TT1_64_VAW2_WG64_4_1_WGM2
    SolutionIndex: 117
    SolutionNameMin: Cijk_Ailk_Bljk_BBS_BH_MT128x128x32_MI32x32x8x1_SE_1LDSB0_AF0EM8_EPS0_GRVW8_GSU1_LPB8_NLCA1_PGR2_PLR5_SU32_SUS128_SRVW4_TT2_64_VAW2_WG64_4_1_WGM2
    SolutionIndex: 118
    SolutionNameMin: Cijk_Ailk_Bljk_BBS_BH_MT128x144x32_MI16x16x16x1_SE_1LDSB1_AF0EM8_EPS1_GRVW2_GSU1_LPB16_NLCA1_PGR1_PLR2_SU32_SUS256_SRVW4_TT2_144_VAW2_WG64_4_1_WGM1
    SolutionIndex: 119
    SolutionNameMin: Cijk_Ailk_Bljk_BBS_BH_MT64x128x64_MI32x32x8x1_SE_1LDSB0_AF0EM8_EPS0_GRVW8_GSU1_LPB8_NLCA1_PGR2_PLR9_SU32_SUS128_SRVW4_TT1_64_VAW2_WG64_4_1_WGM2
    SolutionIndex: 120
    SolutionNameMin: Cijk_Ailk_Bljk_BBS_BH_MT32x32x64_MI16x16x16x1_SE_1LDSB0_AF0EM8_EPS0_GRVW8_GSU1_LPB16_NLCA1_PGR2_PLR5_SU0_SUS0_SRVW4_TT1_16_VAW2_WG32_8_1_WGM1
    SolutionIndex: 121
    SolutionNameMin: Cijk_Ailk_Bljk_BBS_BH_MT64x128x32_MI32x32x8x1_SE_1LDSB0_AF0EM8_EPS1_GRVW8_GSU1_LPB8_NLCA1_PGR1_PLR5_SU0_SUS0_SRVW4_TT1_64_VAW2_WG64_4_1_WGM1
    SolutionIndex: 122
    SolutionNameMin: Cijk_Ailk_Bljk_BBS_BH_MT128x256x32_MI32x32x8x1_SE_1LDSB1_AF0EM8_EPS0_GRVW8_GSU1_LPB8_NLCA1_PGR2_PLR5_SU32_SUS256_SRVW4_TT2_128_VAW2_WG64_4_1_WGM1
    SolutionIndex: 123
    SolutionNameMin: Cijk_Ailk_Bljk_BBS_BH_MT64x128x32_MI32x32x8x1_SE_1LDSB0_AF0EM8_EPS0_GRVW8_GSU1_LPB8_NLCA1_PGR2_PLR5_SU32_SUS256_SRVW4_TT1_64_VAW2_WG64_4_1_WGM2
    SolutionIndex: 124
    SolutionNameMin: Cijk_Ailk_Bljk_BBS_BH_MT160x128x32_MI32x32x8x1_SE_1LDSB0_AF0EM8_EPS0_GRVW4_GSU1_LPB8_NLCA5_PGR2_PLR5_SU32_SUS256_SRVW0_TT5_32_VAW2_WG32_8_1_WGM15
    SolutionIndex: 125
    SolutionNameMin: Cijk_Ailk_Bljk_BBS_BH_MT64x32x64_MI16x16x16x1_SE_1LDSB0_AF0EM8_EPS0_GRVW8_GSU1_LPB16_NLCA1_PGR2_PLR5_SU0_SUS0_SRVW4_TT2_16_VAW2_WG32_8_1_WGM1
    SolutionIndex: 126
    SolutionNameMin: Cijk_Ailk_Bljk_BBS_BH_MT128x128x32_MI32x32x8x1_SE_1LDSB1_AF0EM8_EPS1_GRVW2_GSU1_LPB8_NLCA1_PGR1_PLR5_SU32_SUS128_SRVW4_TT2_64_VAW2_WG64_4_1_WGM15
    SolutionIndex: 127
    SolutionNameMin: Cijk_Ailk_Bljk_BBS_BH_MT128x96x64_MI32x32x8x1_SE_1LDSB0_AF0EM8_EPS1_GRVW8_GSU5_LPB8_NLCA1_PGR1_PLR9_SU0_SUS0_SRVW0_TT1_96_VAW1_WG128_2_1_WGM1
    SolutionIndex: 128
    SolutionNameMin: Cijk_Ailk_Bljk_BBS_BH_MT96x128x64_MI32x32x8x1_SE_1LDSB0_AF0EM8_EPS1_GRVW8_GSU5_LPB8_NLCA3_PGR1_PLR9_SU32_SUS256_SRVW0_TT3_32_VAW1_WG32_8_1_WGM15
    SolutionIndex: 129
    SolutionNameMin: Cijk_Ailk_Bljk_BBS_BH_MT128x256x32_MI32x32x8x1_SE_1LDSB1_AF0EM8_EPS1_GRVW8_GSU1_LPB8_NLCA1_PGR1_PLR5_SU32_SUS128_SRVW4_TT2_128_VAW2_WG64_4_1_WGM2
    SolutionIndex: 130
    SolutionNameMin: Cijk_Ailk_Bljk_BBS_BH_MT128x256x32_MI32x32x8x1_SE_1LDSB1_AF0EM8_EPS1_GRVW8_GSU1_LPB8_NLCA1_PGR1_PLR5_SU32_SUS128_SRVW4_TT2_128_VAW2_WG64_4_1_WGM15
    SolutionIndex: 131
    SolutionNameMin: Cijk_Ailk_Bljk_BBS_BH_MT128x256x32_MI32x32x8x1_SE_1LDSB1_AF0EM8_EPS1_GRVW8_GSU1_LPB8_NLCA1_PGR1_PLR5_SU0_SUS0_SRVW4_TT2_128_VAW2_WG64_4_1_WGM1
    SolutionIndex: 132
    SolutionNameMin: Cijk_Ailk_Bljk_BBS_BH_MT128x64x32_MI32x32x8x1_SE_1LDSB0_AF0EM8_EPS0_GRVW8_GSU1_LPB8_NLCA1_PGR2_PLR5_SU32_SUS256_SRVW4_TT2_32_VAW2_WG64_4_1_WGM2
    SolutionIndex: 133
    SolutionNameMin: Cijk_Ailk_Bljk_BBS_BH_MT128x256x32_MI32x32x8x1_SE_1LDSB1_AF0EM8_EPS0_GRVW8_GSU1_LPB8_NLCA1_PGR2_PLR5_SU32_SUS128_SRVW4_TT2_128_VAW2_WG64_4_1_WGM15
    SolutionIndex: 134
    SolutionNameMin: Cijk_Ailk_Bljk_BBS_BH_MT128x128x32_MI32x32x8x1_SE_1LDSB1_AF0EM1_EPS1_GRVW2_GSU1_LPB8_NLCA1_PGR1_PLR5_SU0_SUS0_SRVW4_TT2_64_VAW2_WG64_4_1_WGM15
    SolutionIndex: 135
    SolutionNameMin: Cijk_Ailk_Bljk_BBS_BH_MT64x4x32_MI4x4x4x16_SE_1LDSB0_AF0EM8_EPS1_GRVW4_GSU1_LPB8_NLCA1_PGR1_PLR9_SU0_SUS0_SRVW0_TT1_4_VAW2_WG64_1_1_WGM1
    SolutionIndex: 136
    SolutionNameMin: Cijk_Ailk_Bljk_BBS_BH_MT64x64x64_MI32x32x8x1_SE_1LDSB0_AF0EM8_EPS0_GRVW8_GSU1_LPB8_NLCA1_PGR2_PLR9_SU0_SUS0_SRVW4_TT1_32_VAW2_WG64_4_1_WGM2
    SolutionIndex: 137
    SolutionNameMin: Cijk_Ailk_Bljk_BBS_BH_MT128x128x32_MI32x32x8x1_SE_1LDSB0_AF0EM8_EPS0_GRVW8_GSU1_LPB8_NLCA1_PGR2_PLR5_SU0_SUS0_SRVW4_TT2_64_VAW2_WG64_4_1_WGM15
    SolutionIndex: 138
    SolutionNameMin: Cijk_Ailk_Bljk_BBS_BH_MT256x128x32_MI32x32x8x1_SE_1LDSB0_AF0EM8_EPS1_GRVW8_GSU1_LPB8_NLCA1_PGR1_PLR5_SU32_SUS128_SRVW4_TT4_64_VAW2_WG64_4_1_WGM1
    SolutionIndex: 139
    SolutionNameMin: Cijk_Ailk_Bljk_BBS_BH_MT256x128x32_MI32x32x8x1_SE_1LDSB0_AF0EM8_EPS0_GRVW8_GSU1_LPB8_NLCA1_PGR2_PLR5_SU0_SUS0_SRVW4_TT4_64_VAW2_WG64_4_1_WGM1
    SolutionIndex: 140
    SolutionNameMin: Cijk_Ailk_Bljk_BBS_BH_MT96x128x32_MI32x32x8x1_SE_1LDSB0_AF0EM8_EPS0_GRVW4_GSU1_LPB8_NLCA3_PGR2_PLR5_SU32_SUS128_SRVW0_TT3_32_VAW2_WG32_8_1_WGM1
    SolutionIndex: 141
    SolutionNameMin: Cijk_Ailk_Bljk_BBS_BH_MT192x256x32_MI32x32x8x1_SE_1LDSB0_AF0EM8_EPS1_GRVW8_GSU1_LPB8_NLCA3_PGR1_PLR5_SU32_SUS256_SRVW0_TT3_128_VAW2_WG64_4_1_WGM1
    SolutionIndex: 142
    SolutionNameMin: Cijk_Ailk_Bljk_BBS_BH_MT32x32x64_MI16x16x16x1_SE_1LDSB0_AF0EM8_EPS0_GRVW8_GSU1_LPB16_NLCA1_PGR2_PLR5_SU32_SUS128_SRVW4_TT1_16_VAW2_WG32_8_1_WGM2
    SolutionIndex: 143
    SolutionNameMin: Cijk_Ailk_Bljk_BBS_BH_MT128x128x32_MI32x32x8x1_SE_1LDSB1_AF0EM8_EPS1_GRVW2_GSU1_LPB8_NLCA1_PGR1_PLR5_SU32_SUS256_SRVW4_TT2_64_VAW2_WG64_4_1_WGM2
    SolutionIndex: 144
    SolutionNameMin: Cijk_Ailk_Bljk_BBS_BH_MT64x128x64_MI32x32x8x1_SE_1LDSB0_AF0EM8_EPS0_GRVW8_GSU1_LPB8_NLCA1_PGR2_PLR9_SU32_SUS128_SRVW4_TT1_64_VAW2_WG64_4_1_WGM1
    SolutionIndex: 145
    SolutionNameMin: Cijk_Ailk_Bljk_BBS_BH_MT32x32x64_MI16x16x16x1_SE_1LDSB0_AF0EM8_EPS0_GRVW8_GSU1_LPB16_NLCA1_PGR2_PLR5_SU32_SUS256_SRVW4_TT1_16_VAW2_WG32_8_1_WGM2
    SolutionIndex: 146
    SolutionNameMin: Cijk_Ailk_Bljk_BBS_BH_MT128x64x32_MI32x32x8x1_SE_1LDSB0_AF0EM8_EPS0_GRVW8_GSU1_LPB8_NLCA1_PGR2_PLR5_SU32_SUS256_SRVW4_TT2_32_VAW2_WG64_4_1_WGM15
    SolutionIndex: 147
    SolutionNameMin: Cijk_Ailk_Bljk_BBS_BH_MT128x96x32_MI32x32x8x1_SE_1LDSB0_AF0EM8_EPS1_GRVW4_GSU1_LPB8_NLCA1_PGR1_PLR5_SU0_SUS0_SRVW4_TT1_96_VAW2_WG128_2_1_WGM1
    SolutionIndex: 148
    SolutionNameMin: Cijk_Ailk_Bljk_BBS_BH_MT16x16x64_MI16x16x16x1_SE_1LDSB0_AF0EM8_EPS0_GRVW8_GSU1_LPB16_NLCA1_PGR2_PLR5_SU32_SUS128_SRVW0_TT1_16_VAW2_WG16_4_1_WGM2
    SolutionIndex: 149
    SolutionNameMin: Cijk_Ailk_Bljk_BBS_BH_MT64x16x32_MI16x16x16x1_SE_1LDSB0_AF0EM8_EPS0_GRVW8_GSU1_LPB16_NLCA1_PGR2_PLR2_SU0_SUS0_SRVW0_TT1_16_VAW2_WG64_4_1_WGM1
    SolutionIndex: 150
    SolutionNameMin: Cijk_Ailk_Bljk_BBS_BH_MT128x256x32_MI32x32x8x1_SE_1LDSB1_AF0EM8_EPS0_GRVW8_GSU1_LPB8_NLCA1_PGR2_PLR5_SU32_SUS128_SRVW4_TT2_128_VAW2_WG64_4_1_WGM2
    SolutionIndex: 151
    SolutionNameMin: Cijk_Ailk_Bljk_BBS_BH_MT128x128x32_MI32x32x8x1_SE_1LDSB0_AF0EM8_EPS0_GRVW8_GSU1_LPB8_NLCA1_PGR2_PLR5_SU32_SUS256_SRVW4_TT2_64_VAW2_WG64_4_1_WGM15
    SolutionIndex: 152
    SolutionNameMin: Cijk_Ailk_Bljk_BBS_BH_MT128x128x32_MI32x32x8x1_SE_1LDSB1_AF0EM8_EPS1_GRVW2_GSU1_LPB8_NLCA1_PGR1_PLR5_SU32_SUS128_SRVW4_TT2_64_VAW2_WG64_4_1_WGM1
    SolutionIndex: 153
    SolutionNameMin: Cijk_Ailk_Bljk_BBS_BH_MT16x64x64_MI16x16x16x1_SE_1LDSB0_AF0EM8_EPS0_GRVW8_GSU1_LPB16_NLCA1_PGR2_PLR5_SU0_SUS0_SRVW0_TT1_16_VAW2_WG16_16_1_WGM1
    SolutionIndex: 154
    SolutionNameMin: Cijk_Ailk_Bljk_BBS_BH_MT128x144x32_MI16x16x16x1_SE_1LDSB1_AF0EM8_EPS1_GRVW2_GSU1_LPB16_NLCA1_PGR1_PLR2_SU32_SUS256_SRVW4_TT2_144_VAW2_WG64_4_1_WGM15
    SolutionIndex: 155
    SolutionNameMin: Cijk_Ailk_Bljk_BBS_BH_MT192x192x32_MI32x32x8x1_SE_1LDSB0_AF0EM8_EPS0_GRVW8_GSU1_LPB8_NLCA3_PGR2_PLR5_SU0_SUS0_SRVW0_TT3_96_VAW2_WG64_4_1_WGM1
    SolutionIndex: 156
    SolutionNameMin: Cijk_Ailk_Bljk_BBS_BH_MT64x128x32_MI32x32x8x1_SE_1LDSB0_AF0EM8_EPS0_GRVW8_GSU1_LPB8_NLCA1_PGR2_PLR5_SU32_SUS256_SRVW4_TT1_64_VAW2_WG64_4_1_WGM15
    SolutionIndex: 157
    SolutionNameMin: Cijk_Ailk_Bljk_BBS_BH_MT192x128x32_MI32x32x8x1_SE_1LDSB0_AF0EM8_EPS0_GRVW4_GSU1_LPB8_NLCA3_PGR2_PLR5_SU32_SUS128_SRVW0_TT3_64_VAW2_WG64_4_1_WGM1
    SolutionIndex: 158
    SolutionNameMin: Cijk_Ailk_Bljk_BBS_BH_MT128x144x32_MI16x16x16x1_SE_1LDSB1_AF0EM8_EPS0_GRVW2_GSU1_LPB16_NLCA1_PGR2_PLR2_SU0_SUS0_SRVW4_TT2_144_VAW2_WG64_4_1_WGM15
    SolutionIndex: 159
    SolutionNameMin: Cijk_Ailk_Bljk_BBS_BH_MT32x64x32_MI16x16x16x1_SE_1LDSB0_AF0EM8_EPS1_GRVW8_GSU1_LPB16_NLCA1_PGR1_PLR2_SU32_SUS256_SRVW4_TT1_32_VAW2_WG32_8_1_WGM15
    SolutionIndex: 160
    SolutionNameMin: Cijk_Ailk_Bljk_BBS_BH_MT256x128x32_MI32x32x8x1_SE_1LDSB0_AF0EM8_EPS0_GRVW8_GSU1_LPB8_NLCA1_PGR2_PLR5_SU0_SUS0_SRVW4_TT4_64_VAW2_WG64_4_1_WGM2
    SolutionIndex: 161
    SolutionNameMin: Cijk_Ailk_Bljk_BBS_BH_MT128x160x32_MI32x32x8x1_SE_1LDSB1_AF0EM8_EPS1_GRVW2_GSU1_LPB8_NLCA1_PGR1_PLR5_SU32_SUS256_SRVW4_TT1_160_VAW2_WG128_2_1_WGM15
    SolutionIndex: 162
    SolutionNameMin: Cijk_Ailk_Bljk_BBS_BH_MT128x128x32_MI32x32x8x1_SE_1LDSB1_AF0EM8_EPS1_GRVW2_GSU1_LPB8_NLCA1_PGR1_PLR5_SU32_SUS256_SRVW4_TT2_64_VAW2_WG64_4_1_WGM15
    SolutionIndex: 163
    SolutionNameMin: Cijk_Ailk_Bljk_BBS_BH_MT256x128x32_MI32x32x8x1_SE_1LDSB1_AF0EM8_EPS0_GRVW8_GSU1_LPB8_NLCA1_PGR2_PLR5_SU0_SUS0_SRVW4_TT4_64_VAW2_WG64_4_1_WGM15
    SolutionIndex: 164
    SolutionNameMin: Cijk_Ailk_Bljk_BBS_BH_MT128x256x32_MI32x32x8x1_SE_1LDSB1_AF0EM1_EPS0_GRVW8_GSU1_LPB8_NLCA1_PGR2_PLR5_SU0_SUS0_SRVW4_TT2_128_VAW2_WG64_4_1_WGM1
    SolutionIndex: 165
    SolutionNameMin: Cijk_Ailk_Bljk_BBS_BH_MT32x32x64_MI16x16x16x1_SE_1LDSB0_AF0EM8_EPS0_GRVW8_GSU1_LPB16_NLCA1_PGR2_PLR5_SU0_SUS0_SRVW4_TT1_16_VAW2_WG32_8_1_WGM2
    SolutionIndex: 166
    SolutionNameMin: Cijk_Ailk_Bljk_BBS_BH_MT128x64x64_MI32x32x8x1_SE_1LDSB0_AF0EM8_EPS1_GRVW8_GSU15_LPB8_NLCA1_PGR1_PLR9_SU0_SUS0_SRVW0_TT2_32_VAW1_WG64_4_1_WGM1
    SolutionIndex: 167
    SolutionNameMin: Cijk_Ailk_Bljk_BBS_BH_MT128x64x64_MI32x32x8x1_SE_1LDSB0_AF0EM8_EPS1_GRVW8_GSU15_LPB8_NLCA1_PGR1_PLR9_SU32_SUS256_SRVW0_TT2_32_VAW1_WG64_4_1_WGM2
    SolutionIndex: 168
    SolutionNameMin: Cijk_Ailk_Bljk_BBS_BH_MT128x64x64_MI32x32x8x1_SE_1LDSB0_AF0EM1_EPS0_GRVW8_GSU1_LPB8_NLCA1_PGR2_PLR9_SU32_SUS256_SRVW4_TT2_32_VAW2_WG64_4_1_WGM15
    SolutionIndex: 169
    SolutionNameMin: Cijk_Ailk_Bljk_BBS_BH_MT64x16x64_MI16x16x16x1_SE_1LDSB0_AF0EM8_EPS0_GRVW2_GSU1_LPB16_NLCA1_PGR2_PLR5_SU0_SUS0_SRVW0_TT1_16_VAW2_WG64_4_1_WGM2
    SolutionIndex: 170
    SolutionNameMin: Cijk_Ailk_Bljk_BBS_BH_MT32x32x32_MI16x16x16x1_SE_1LDSB0_AF0EM1_EPS0_GRVW4_GSU1_LPB16_NLCA1_PGR2_PLR2_SU0_SUS0_SRVW4_TT1_16_VAW2_WG32_8_1_WGM15
    SolutionIndex: 171
    SolutionNameMin: Cijk_Ailk_Bljk_BBS_BH_MT64x16x32_MI16x16x16x1_SE_1LDSB0_AF0EM8_EPS1_GRVW4_GSU1_LPB16_NLCA1_PGR1_PLR2_SU0_SUS0_SRVW0_TT1_16_VAW2_WG64_4_1_WGM1
    SolutionIndex: 172
    SolutionNameMin: Cijk_Ailk_Bljk_BBS_BH_MT64x4x32_MI4x4x4x16_SE_1LDSB0_AF0EM8_EPS1_GRVW4_GSU1_LPB8_NLCA1_PGR1_PLR9_SU0_SUS0_SRVW0_TT1_4_VAW2_WG64_1_1_WGM15
    SolutionIndex: 173
    SolutionNameMin: Cijk_Ailk_Bljk_BBS_BH_MT128x256x32_MI32x32x8x1_SE_1LDSB1_AF0EM8_EPS1_GRVW8_GSU1_LPB8_NLCA1_PGR1_PLR5_SU32_SUS128_SRVW4_TT2_128_VAW2_WG64_4_1_WGM1
    SolutionIndex: 174
    SolutionNameMin: Cijk_Ailk_Bljk_BBS_BH_MT128x64x32_MI32x32x8x1_SE_1LDSB0_AF0EM8_EPS1_GRVW8_GSU1_LPB8_NLCA1_PGR1_PLR5_SU0_SUS0_SRVW4_TT2_32_VAW2_WG64_4_1_WGM2
    SolutionIndex: 175
    SolutionNameMin: Cijk_Ailk_Bljk_BBS_BH_MT64x4x32_MI4x4x4x16_SE_1LDSB0_AF0EM8_EPS0_GRVW8_GSU1_LPB8_NLCA1_PGR2_PLR9_SU0_SUS0_SRVW0_TT1_4_VAW2_WG64_1_1_WGM1
    SolutionIndex: 176
    SolutionNameMin: Cijk_Ailk_Bljk_BBS_BH_MT128x256x32_MI32x32x8x1_SE_1LDSB1_AF0EM8_EPS1_GRVW8_GSU1_LPB8_NLCA1_PGR1_PLR5_SU32_SUS256_SRVW4_TT2_128_VAW2_WG64_4_1_WGM2
    SolutionIndex: 177
    SolutionNameMin: Cijk_Ailk_Bljk_BBS_BH_MT32x32x64_MI16x16x16x1_SE_1LDSB0_AF0EM1_EPS0_GRVW4_GSU1_LPB16_NLCA1_PGR2_PLR5_SU0_SUS0_SRVW4_TT1_16_VAW2_WG32_8_1_WGM1
    SolutionIndex: 178
    SolutionNameMin: Cijk_Ailk_Bljk_BBS_BH_MT32x32x64_MI16x16x16x1_SE_1LDSB0_AF0EM1_EPS0_GRVW8_GSU1_LPB16_NLCA1_PGR2_PLR5_SU0_SUS0_SRVW4_TT1_16_VAW2_WG32_8_1_WGM2
    SolutionIndex: 179
    SolutionNameMin: Cijk_Ailk_Bljk_BBS_BH_MT32x32x32_MI16x16x16x1_SE_1LDSB0_AF0EM1_EPS0_GRVW8_GSU1_LPB16_NLCA1_PGR2_PLR2_SU0_SUS0_SRVW4_TT1_16_VAW2_WG32_8_1_WGM1
    SolutionIndex: 180
    SolutionNameMin: Cijk_Ailk_Bljk_BBS_BH_MT64x128x64_MI32x32x8x1_SE_1LDSB0_AF0EM1_EPS0_GRVW8_GSU1_LPB8_NLCA1_PGR2_PLR9_SU0_SUS0_SRVW4_TT1_64_VAW2_WG64_4_1_WGM15
    SolutionIndex: 181
    SolutionNameMin: Cijk_Ailk_Bljk_BBS_BH_MT32x64x64_MI16x16x16x1_SE_1LDSB0_AF0EM1_EPS0_GRVW8_GSU1_LPB16_NLCA1_PGR2_PLR5_SU32_SUS256_SRVW4_TT1_32_VAW2_WG32_8_1_WGM15
    SolutionIndex: 182
    SolutionNameMin: Cijk_Ailk_Bljk_BBS_BH_MT128x64x32_MI32x32x8x1_SE_1LDSB0_AF0EM1_EPS0_GRVW2_GSU1_LPB8_NLCA1_PGR2_PLR5_SU0_SUS0_SRVW4_TT2_32_VAW2_WG64_4_1_WGM15
    SolutionIndex: 183
    SolutionNameMin: Cijk_Ailk_Bljk_BBS_BH_MT128x64x32_MI32x32x8x1_SE_1LDSB0_AF0EM1_EPS0_GRVW4_GSU1_LPB8_NLCA1_PGR2_PLR5_SU0_SUS0_SRVW4_TT2_32_VAW2_WG64_4_1_WGM1
    SolutionIndex: 184
    SolutionNameMin: Cijk_Ailk_Bljk_BBS_BH_MT128x128x32_MI32x32x8x1_SE_1LDSB1_AF0EM1_EPS1_GRVW2_GSU1_LPB8_NLCA1_PGR1_PLR5_SU32_SUS128_SRVW4_TT2_64_VAW2_WG64_4_1_WGM1
    SolutionIndex: 185
    SolutionNameMin: Cijk_Ailk_Bljk_BBS_BH_MT32x64x32_MI16x16x16x1_SE_1LDSB1_AF0EM1_EPS1_GRVW2_GSU1_LPB16_NLCA1_PGR1_PLR2_SU32_SUS128_SRVW4_TT1_32_VAW2_WG32_8_1_WGM1
    SolutionIndex: 186
    SolutionNameMin: Cijk_Ailk_Bljk_BBS_BH_MT32x64x32_MI16x16x16x1_SE_1LDSB0_AF0EM1_EPS0_GRVW2_GSU1_LPB16_NLCA1_PGR2_PLR2_SU0_SUS0_SRVW4_TT1_32_VAW2_WG32_8_1_WGM1
    SolutionIndex: 187
    SolutionNameMin: Cijk_Ailk_Bljk_BBS_BH_MT128x128x32_MI32x32x8x1_SE_1LDSB1_AF0EM1_EPS1_GRVW2_GSU1_LPB8_NLCA1_PGR1_PLR5_SU32_SUS256_SRVW4_TT2_64_VAW2_WG64_4_1_WGM15
    SolutionIndex: 188
    SolutionNameMin: Cijk_Ailk_Bljk_BBS_BH_MT32x32x32_MI16x16x16x1_SE_1LDSB0_AF0EM8_AF1EM1_EPS0_GRVW8_GSU1_GSUAMB_IU1_LBSPP128_LPB16_LRVW8_NLCA1_PGR2_PLR2_SU0_SUM0_SUS0_SRVW4_TT1_16_TLDS1_VAW2_WSGRA1_WSGRB1_WG32_8_1_WGM1
    SolutionIndex: 189
    SolutionNameMin: Cijk_Ailk_Bljk_BBS_BH_MT64x192x32_MI32x32x8x1_SE_1LDSB1_AF0EM8_AF1EM1_EPS1_GRVW4_GSU1_GSUAMB_IU1_LBSPP128_LPB8_LRVW8_NLCA1_PGR1_PLR5_SU0_SUM0_SUS0_SRVW4_TT1_96_TLDS1_VAW2_WSGRA1_WSGRB1_WG64_4_1_WGM15
    SolutionIndex: 190
    SolutionNameMin: Cijk_Ailk_Bljk_BBS_BH_MT64x80x64_MI16x16x16x1_SN_1LDSB0_GSU1_LPB4_LRVW4_PLR5_SU0_SUS0_TT1_80_WGM8
    SolutionIndex: 191
    SolutionNameMin: Cijk_Ailk_Bljk_BBS_BH_MT16x16x32_SN_GSU4
    SolutionIndex: 192
    SolutionNameMin: Cijk_Ailk_Bljk_BBS_BH_MT16x16x32_SN_GSU8
    SolutionIndex: 193
    SolutionNameMin: Cijk_Ailk_Bljk_BBS_BH_MT16x32x64_MI16x16x16x1_SN_FL0_GSUWGMRR0_LBSPP128_LPA16_LPB8_NTA2_NTB0_NTC1_NTD3_WSGRA0_WGM1
    SolutionIndex: 194
    SolutionNameMin: Cijk_Ailk_Bljk_BBS_BH_MT16x32x64_MI16x16x16x1_SN_FL2_GSUWGMRR0_LBSPP0_LPA16_LPB4_NTA2_NTB0_NTC0_NTD3_WSGRA0_WGM1
    SolutionIndex: 195
    SolutionNameMin: Cijk_Ailk_Bljk_BBS_BH_MT4x32x64_SN_LDL8
    SolutionIndex: 196
    SolutionNameMin: Cijk_Ailk_Bljk_BBS_BH_MT128x64x32_MI32x32x8x1_SE_1LDSB0_AF0EM8_AF1EM1_AMAS3_EPS0_GRVW8_GSU1_GSUAMB_ISA90a_IU1_KLA_LBSPP128_LPB8_LDL1_LRVW8_LDW0_MAC_NLCA1_PGR2_PLR5_SIA3_SU0_SUM0_SUS0_SRVW4_TT2_32_TLDS1_VAW2_VW2_WSGRA1_WSGRB1_WG64_4_1_WGM1
    SolutionIndex: 197
    SolutionNameMin: Cijk_Ailk_Bljk_BBS_BH_MT16x16x32_MI16x16x16x1_SN_1LDSB0_EPS1_GRVW2_GSU1_PGR1_PLR2_SU32_SUS128_SRVW4_TT1_16_WG16_4_1_WGM1
    SolutionIndex: 198
    SolutionNameMin: Cijk_Ailk_Bljk_BBS_BH_MT16x32x32_MI16x16x16x1_SN_1LDSB0_EPS1_GRVW2_GSU1_PGR1_PLR2_SU0_SUS0_SRVW4_TT1_16_WG16_8_1_WGM1
    SolutionIndex: 199
    SolutionNameMin: Cijk_Ailk_Bljk_BBS_BH_MT16x16x32_MI16x16x16x1_SN_1LDSB0_EPS0_GRVW2_GSU1_PGR2_PLR2_SU0_SUS0_SRVW4_TT1_16_WG16_4_1_WGM1
    SolutionIndex: 200
    SolutionNameMin: Cijk_Ailk_Bljk_BBS_BH_MT16x32x64_MI16x16x16x1_SN_1LDSB0_EPS0_GRVW2_GSU1_PGR2_PLR5_SU0_SUS0_SRVW4_TT1_16_WG16_8_1_WGM1
    SolutionIndex: 201
    SolutionNameMin: Cijk_Ailk_Bljk_BBS_BH_MT16x32x64_MI16x16x16x1_SN_1LDSB0_EPS0_GRVW2_GSU1_PGR2_PLR5_SU32_SUS128_SRVW4_TT1_16_WG16_8_1_WGM2
    SolutionIndex: 202
    SolutionNameMin: Cijk_Ailk_Bljk_BBS_BH_MT16x32x64_MI16x16x16x1_SN_1LDSB0_EPS0_GRVW2_GSU11_PGR2_PLR5_SU0_SUS0_SRVW0_TT1_16_WG16_8_1_WGM1
    SolutionIndex: 203
    SolutionNameMin: Cijk_Ailk_Bljk_BBS_BH_MT16x32x32_MI16x16x16x1_SN_1LDSB0_EPS1_GRVW2_GSU1_PGR1_PLR2_SU0_SUS0_SRVW4_TT1_16_WG16_8_1_WGM2
    SolutionIndex: 204
    SolutionNameMin: Cijk_Ailk_Bljk_BBS_BH_MT16x16x32_MI16x16x16x1_SN_1LDSB0_EPS0_GRVW2_GSU1_PGR2_PLR2_SU32_SUS256_SRVW4_TT1_16_WG16_4_1_WGM1
    SolutionIndex: 205
    SolutionNameMin: Cijk_Ailk_Bljk_BBS_BH_MT16x32x64_MI16x16x16x1_SN_1LDSB0_EPS0_GRVW2_GSU1_PGR2_PLR5_SU32_SUS128_SRVW4_TT1_16_WG16_8_1_WGM15
    SolutionIndex: 206
    SolutionNameMin: Cijk_Ailk_Bljk_BBS_BH_MT16x32x64_MI16x16x16x1_SN_1LDSB0_EPS0_GRVW2_GSU1_PGR2_PLR5_SU0_SUS0_SRVW4_TT1_16_WG16_8_1_WGM15
    SolutionIndex: 207
    SolutionNameMin: Cijk_Ailk_Bljk_BBS_BH_MT16x32x64_MI16x16x16x1_SN_1LDSB0_EPS0_GRVW2_GSU11_PGR2_PLR5_SU0_SUS0_SRVW0_TT1_16_WG16_8_1_WGM15
    SolutionIndex: 208
    SolutionNameMin: Cijk_Ailk_Bljk_BBS_BH_MT16x32x64_MI16x16x16x1_SN_1LDSB0_EPS0_GRVW2_GSU11_PGR2_PLR5_SU32_SUS128_SRVW0_TT1_16_WG16_8_1_WGM1
    SolutionIndex: 209
    SolutionNameMin: Cijk_Ailk_Bljk_BBS_BH_MT16x16x32_MI16x16x16x1_SN_1LDSB0_EPS0_GRVW2_GSU1_PGR2_PLR2_SU0_SUS0_SRVW4_TT1_16_WG16_4_1_WGM15
    SolutionIndex: 210
    SolutionNameMin: Cijk_Ailk_Bljk_BBS_BH_MT16x32x32_MI16x16x16x1_SN_1LDSB0_EPS1_GRVW2_GSU1_PGR1_PLR2_SU0_SUS0_SRVW4_TT1_16_WG16_8_1_WGM15
    SolutionIndex: 211
    SolutionNameMin: Cijk_Ailk_Bljk_BBS_BH_MT16x32x64_MI16x16x16x1_SN_1LDSB0_EPS0_GRVW2_GSU1_PGR2_PLR5_SU32_SUS256_SRVW4_TT1_16_WG16_8_1_WGM1
    SolutionIndex: 212
    SolutionNameMin: Cijk_Ailk_Bljk_BBS_BH_MT16x32x64_MI16x16x16x1_SN_1LDSB0_EPS1_GRVW2_GSU10_PGR1_PLR5_SU32_SUS128_SRVW0_TT1_16_WG16_8_1_WGM1
    SolutionIndex: 213
    SolutionNameMin: Cijk_Ailk_Bljk_BBS_BH_MT16x32x32_MI16x16x16x1_SN_1LDSB0_EPS0_GRVW2_GSU1_PGR2_PLR2_SU32_SUS128_SRVW4_TT1_16_WG16_8_1_WGM1
    SolutionIndex: 214
    SolutionNameMin: Cijk_Ailk_Bljk_BBS_BH_MT16x32x64_MI16x16x16x1_SN_1LDSB0_EPS1_GRVW2_GSU1_PGR1_PLR5_SU32_SUS256_SRVW4_TT1_16_WG16_8_1_WGM1
    SolutionIndex: 215
    SolutionNameMin: Cijk_Ailk_Bljk_BBS_BH_MT16x32x32_MI16x16x16x1_SN_1LDSB0_EPS0_GRVW2_GSU1_PGR2_PLR2_SU0_SUS0_SRVW4_TT1_16_WG16_8_1_WGM1
    SolutionIndex: 216
    SolutionNameMin: Cijk_Ailk_Bljk_BBS_BH_MT16x32x64_MI16x16x16x1_SN_1LDSB0_EPS0_GRVW2_GSU1_PGR2_PLR5_SU32_SUS256_SRVW4_TT1_16_WG16_8_1_WGM2
    SolutionIndex: 217
    SolutionNameMin: Cijk_Ailk_Bljk_BBS_BH_MT16x32x32_MI16x16x16x1_SN_1LDSB0_EPS0_GRVW2_GSU1_PGR2_PLR2_SU32_SUS128_SRVW4_TT1_16_WG16_8_1_WGM15
    SolutionIndex: 218
    SolutionNameMin: Cijk_Ailk_Bljk_BBS_BH_MT16x16x64_MI16x16x16x1_SN_1LDSB0_EPS0_GRVW2_GSU1_PGR2_PLR5_SU32_SUS128_SRVW4_TT1_16_WG16_4_1_WGM1
    SolutionIndex: 219
    SolutionNameMin: Cijk_Ailk_Bljk_BBS_BH_MT16x32x64_MI16x16x16x1_SN_1LDSB0_EPS0_GRVW4_GSU1_PGR2_PLR5_SU32_SUS256_SRVW4_TT1_16_WG16_8_1_WGM1
    SolutionIndex: 220
    SolutionNameMin: Cijk_Ailk_Bljk_BBS_BH_MT16x16x64_MI16x16x16x1_SN_1LDSB0_EPS0_GRVW4_GSU1_PGR2_PLR5_SU0_SUS0_SRVW4_TT1_16_WG16_4_1_WGM2
    SolutionIndex: 221
    SolutionNameMin: Cijk_Ailk_Bljk_BBS_BH_MT16x16x64_MI16x16x16x1_SN_1LDSB0_EPS0_GRVW4_GSU1_PGR2_PLR5_SU32_SUS256_SRVW4_TT1_16_WG16_4_1_WGM1
    SolutionIndex: 222
    SolutionNameMin: Cijk_Ailk_Bljk_BBS_BH_MT16x32x64_MI16x16x16x1_SN_1LDSB0_EPS0_GRVW4_GSU1_PGR2_PLR5_SU0_SUS0_SRVW4_TT1_16_WG16_8_1_WGM1
    SolutionIndex: 223
    SolutionNameMin: Cijk_Ailk_Bljk_BBS_BH_MT16x32x64_MI16x16x16x1_SN_1LDSB0_EPS0_GRVW4_GSU11_PGR2_PLR5_SU0_SUS0_SRVW0_TT1_16_WG16_8_1_WGM15
    SolutionIndex: 224
    SolutionNameMin: Cijk_Ailk_Bljk_BBS_BH_MT16x32x64_MI16x16x16x1_SN_1LDSB0_EPS1_GRVW4_GSU1_PGR1_PLR5_SU0_SUS0_SRVW4_TT1_16_WG16_8_1_WGM1
    SolutionIndex: 225
    SolutionNameMin: Cijk_Ailk_Bljk_BBS_BH_MT16x32x32_MI16x16x16x1_SN_1LDSB0_EPS0_GRVW4_GSU1_PGR2_PLR2_SU0_SUS0_SRVW4_TT1_16_WG16_8_1_WGM1
    SolutionIndex: 226
    SolutionNameMin: Cijk_Ailk_Bljk_BBS_BH_MT16x16x64_MI16x16x16x1_SN_1LDSB0_EPS0_GRVW4_GSU1_PGR2_PLR5_SU0_SUS0_SRVW4_TT1_16_WG16_4_1_WGM15
    SolutionIndex: 227
    SolutionNameMin: Cijk_Ailk_Bljk_BBS_BH_MT16x32x32_MI16x16x16x1_SN_1LDSB0_EPS0_GRVW4_GSU1_PGR2_PLR2_SU0_SUS0_SRVW4_TT1_16_WG16_8_1_WGM15
    SolutionIndex: 228
    SolutionNameMin: Cijk_Ailk_Bljk_BBS_BH_MT16x16x64_MI16x16x16x1_SN_1LDSB0_EPS0_GRVW4_GSU1_PGR2_PLR5_SU0_SUS0_SRVW4_TT1_16_WG16_4_1_WGM1
    SolutionIndex: 229
    SolutionNameMin: Cijk_Ailk_Bljk_BBS_BH_MT16x32x64_MI16x16x16x1_SN_1LDSB0_EPS0_GRVW4_GSU10_PGR2_PLR5_SU32_SUS256_SRVW0_TT1_16_WG16_8_1_WGM15
    SolutionIndex: 230
    SolutionNameMin: Cijk_Ailk_Bljk_BBS_BH_MT16x32x32_MI16x16x16x1_SN_1LDSB0_EPS0_GRVW4_GSU1_PGR2_PLR2_SU0_SUS0_SRVW4_TT1_16_WG16_8_1_WGM2
    SolutionIndex: 231
    SolutionNameMin: Cijk_Ailk_Bljk_BBS_BH_MT16x16x64_MI16x16x16x1_SN_1LDSB0_EPS0_GRVW4_GSU1_PGR2_PLR5_SU32_SUS128_SRVW4_TT1_16_WG16_4_1_WGM1
    SolutionIndex: 232
    SolutionNameMin: Cijk_Ailk_Bljk_BBS_BH_MT16x32x32_MI16x16x16x1_SN_1LDSB0_EPS0_GRVW2_GSU1_PGR2_PLR2_SU32_SUS256_SRVW4_TT1_16_WG16_8_1_WGM1
    SolutionIndex: 233
    SolutionNameMin: Cijk_Ailk_Bljk_BBS_BH_MT16x16x64_MI16x16x16x1_SN_1LDSB0_EPS0_GRVW4_GSU1_PGR2_PLR5_SU32_SUS256_SRVW4_TT1_16_WG16_4_1_WGM2
    SolutionIndex: 234
    SolutionNameMin: Cijk_Ailk_Bljk_BBS_BH_MT16x32x64_MI16x16x16x1_SN_1LDSB0_EPS0_GRVW2_GSU11_PGR2_PLR5_SU32_SUS128_SRVW0_TT1_16_WG16_8_1_WGM15
    SolutionIndex: 235
    SolutionNameMin: Cijk_Ailk_Bljk_BBS_BH_MT16x64x64_MI16x16x16x1_SE_1LDSB0_AF0EM8_AF1EM1_EPS0_GRVW8_GSU1_GSUAMB_IU1_LBSPP128_LPB16_LRVW8_LDW0_MAC_NLCA1_PGR2_PLR5_SU0_SUM0_SUS0_SRVW0_TT1_16_TLDS1_VAW2_WSGRA1_WSGRB1_WG16_16_1_WGM15
    SolutionIndex: 236
    SolutionNameMin: Cijk_Ailk_Bljk_BBS_BH_MT16x16x64_MI16x16x16x1_SN_1LDSB0_EPS0_GRVW8_GSU11_PGR2_PLR5_SU0_SUS0_SRVW0_TT1_16_WG16_4_1_WGM1
    SolutionIndex: 237
    SolutionNameMin: Cijk_Ailk_Bljk_BBS_BH_MT16x32x64_MI16x16x16x1_SN_1LDSB0_EPS0_GRVW8_GSU11_PGR2_PLR5_SU32_SUS128_SRVW0_TT1_16_WG16_8_1_WGM15
    SolutionIndex: 238
    SolutionNameMin: Cijk_Ailk_Bljk_BBS_BH_MT16x32x64_MI16x16x16x1_SN_1LDSB0_EPS0_GRVW4_GSU10_PGR2_PLR5_SU32_SUS128_SRVW0_TT1_16_WG16_8_1_WGM15
    SolutionIndex: 239
    SolutionNameMin: Cijk_Ailk_Bljk_BBS_BH_MT16x16x64_MI16x16x16x1_SN_1LDSB0_EPS0_GRVW8_GSU1_PGR2_PLR5_SU0_SUS0_SRVW4_TT1_16_WG16_4_1_WGM2
    SolutionIndex: 240
    SolutionNameMin: Cijk_Ailk_Bljk_BBS_BH_MT16x32x64_MI16x16x16x1_SN_1LDSB0_EPS0_GRVW8_GSU1_PGR2_PLR5_SU32_SUS128_SRVW4_TT1_16_WG16_8_1_WGM1
    SolutionIndex: 241
    SolutionNameMin: Cijk_Ailk_Bljk_BBS_BH_MT16x16x64_MI16x16x16x1_SN_1LDSB0_EPS0_GRVW8_GSU1_PGR2_PLR5_SU0_SUS0_SRVW4_TT1_16_WG16_4_1_WGM1
    SolutionIndex: 242
    SolutionNameMin: Cijk_Ailk_Bljk_BBS_BH_MT16x32x64_MI16x16x16x1_SN_1LDSB0_EPS0_GRVW8_GSU11_PGR2_PLR5_SU0_SUS0_SRVW0_TT1_16_WG16_8_1_WGM1
    SolutionIndex: 243
    SolutionNameMin: Cijk_Ailk_Bljk_BBS_BH_MT16x32x64_MI16x16x16x1_SN_1LDSB0_EPS0_GRVW8_GSU1_PGR2_PLR5_SU0_SUS0_SRVW4_TT1_16_WG16_8_1_WGM1
    SolutionIndex: 244
    SolutionNameMin: Cijk_Ailk_Bljk_BBS_BH_MT16x16x32_MI16x16x16x1_SN_1LDSB0_EPS1_GRVW8_GSU1_PGR1_PLR2_SU0_SUS0_SRVW4_TT1_16_WG16_4_1_WGM15
    SolutionIndex: 245
    SolutionNameMin: Cijk_Ailk_Bljk_BBS_BH_MT16x16x32_MI16x16x16x1_SN_1LDSB0_EPS1_GRVW8_GSU1_PGR1_PLR2_SU0_SUS0_SRVW4_TT1_16_WG16_4_1_WGM1
    SolutionIndex: 246
    SolutionNameMin: Cijk_Ailk_Bljk_BBS_BH_MT16x32x64_MI16x16x16x1_SN_1LDSB0_EPS0_GRVW8_GSU1_PGR2_PLR5_SU32_SUS128_SRVW4_TT1_16_WG16_8_1_WGM2
    SolutionIndex: 247
    SolutionNameMin: Cijk_Ailk_Bljk_BBS_BH_MT16x32x64_MI16x16x16x1_SN_1LDSB0_EPS0_GRVW8_GSU1_PGR2_PLR5_SU0_SUS0_SRVW4_TT1_16_WG16_8_1_WGM15
    SolutionIndex: 248
    SolutionNameMin: Cijk_Ailk_Bljk_BBS_BH_MT16x16x64_MI16x16x16x1_SN_1LDSB0_EPS0_GRVW8_GSU10_PGR2_PLR5_SU32_SUS128_SRVW0_TT1_16_WG16_4_1_WGM1
    SolutionIndex: 249
    SolutionNameMin: Cijk_Ailk_Bljk_BBS_BH_MT16x32x64_MI16x16x16x1_SN_1LDSB0_EPS0_GRVW8_GSU1_PGR2_PLR5_SU32_SUS128_SRVW4_TT1_16_WG16_8_1_WGM15
    SolutionIndex: 250
    SolutionNameMin: Cijk_Ailk_Bljk_BBS_BH_MT16x32x32_MI16x16x16x1_SN_1LDSB0_EPS1_GRVW8_GSU1_PGR1_PLR2_SU0_SUS0_SRVW4_TT1_16_WG16_8_1_WGM1
    SolutionIndex: 251
    SolutionNameMin: Cijk_Ailk_Bljk_BBS_BH_MT16x32x64_MI16x16x16x1_SN_1LDSB0_EPS0_GRVW8_GSU1_PGR2_PLR5_SU32_SUS256_SRVW4_TT1_16_WG16_8_1_WGM1
    SolutionIndex: 252
    SolutionNameMin: Cijk_Ailk_Bljk_BBS_BH_MT16x32x64_MI16x16x16x1_SN_1LDSB0_EPS0_GRVW8_GSU1_PGR2_PLR5_SU0_SUS0_SRVW4_TT1_16_WG16_8_1_WGM2
    SolutionIndex: 253
    SolutionNameMin: Cijk_Ailk_Bljk_BBS_BH_MT16x32x64_MI16x16x16x1_SN_1LDSB0_EPS0_GRVW8_GSU1_PGR2_PLR5_SU32_SUS256_SRVW4_TT1_16_WG16_8_1_WGM15
    SolutionIndex: 254
    SolutionNameMin: Cijk_Ailk_Bljk_BBS_BH_MT16x16x64_MI16x16x16x1_SN_1LDSB0_EPS0_GRVW8_GSU1_PGR2_PLR5_SU32_SUS256_SRVW4_TT1_16_WG16_4_1_WGM1
    SolutionIndex: 255
    SolutionNameMin: Cijk_Ailk_Bljk_BBS_BH_MT16x128x32_MI16x16x16x1_SN_1LDSB1_EPS0_GRVW8_GSU1_PGR2_PLR2_SU0_SUS0_SRVW4_TT1_32_WG16_16_1_WGM1
    SolutionIndex: 256
    SolutionNameMin: Cijk_Ailk_Bljk_BBS_BH_MT16x16x64_MI16x16x16x1_SN_1LDSB0_EPS1_GRVW8_GSU1_PGR1_PLR5_SU32_SUS256_SRVW4_TT1_16_WG16_4_1_WGM15
    SolutionIndex: 257
    SolutionNameMin: Cijk_Ailk_Bljk_BBS_BH_MT64x16x32_MI16x16x16x1_SE_1LDSB0_AF0EM8_AF1EM1_AMAS3_EPS0_GRVW4_GSU1_GSUAMB_ISA90a_IU1_KLA_LBSPP128_LPB16_LDL1_LRVW8_LDW0_MAC_NLCA1_PGR2_PLR2_SIA3_SU0_SUM0_SUS0_SRVW0_TT1_16_TLDS1_VAW2_VW2_WSGRA1_WSGRB1_WG64_4_1_WGM1
    SolutionIndex: 258
    SolutionNameMin: Cijk_Ailk_Bljk_BBS_BH_MT16x16x64_MI16x16x16x1_SE_1LDSB0_AF0EM8_AF1EM1_AMAS3_EPS0_GRVW8_GSU1_GSUAMB_ISA90a_IU1_KLA_LBSPP128_LPB16_LDL1_LRVW8_LDW0_MAC_NLCA1_PGR2_PLR5_SIA3_SU0_SUM0_SUS0_SRVW0_TT1_16_TLDS1_VAW2_VW2_WSGRA1_WSGRB1_WG16_4_1_WGM1
    SolutionIndex: 259
    SolutionNameMin: Cijk_Ailk_Bljk_BBS_BH_MT16x16x64_MI16x16x16x1_SE_1LDSB0_AF0EM8_AF1EM1_AMAS3_EPS0_GRVW8_GSU1_GSUAMB_ISA90a_IU1_KLA_LBSPP128_LPB16_LDL1_LRVW8_LDW0_MAC_NLCA1_PGR2_PLR5_SIA3_SU32_SUM0_SUS128_SRVW0_TT1_16_TLDS1_VAW2_VW2_WSGRA1_WSGRB1_WG16_4_1_WGM2
    SolutionIndex: 260
    SolutionNameMin: Cijk_Ailk_Bljk_BBS_BH_MT16x64x64_MI16x16x16x1_SE_1LDSB0_AF0EM8_AF1EM1_AMAS3_EPS0_GRVW8_GSU1_GSUAMB_ISA90a_IU1_KLA_LBSPP128_LPB16_LDL1_LRVW8_LDW0_MAC_NLCA1_PGR2_PLR5_SIA3_SU0_SUM0_SUS0_SRVW0_TT1_16_TLDS1_VAW2_VW2_WSGRA1_WSGRB1_WG16_16_1_WGM1
    SolutionIndex: 261
    SolutionNameMin: Cijk_Ailk_Bljk_BBS_BH_MT32x32x64_MI16x16x16x1_SE_1LDSB0_AF0EM8_AF1EM1_AMAS3_EPS0_GRVW8_GSU1_GSUAMB_ISA90a_IU1_KLA_LBSPP128_LPB16_LDL1_LRVW8_LDW0_MAC_NLCA1_PGR2_PLR5_SIA3_SU0_SUM0_SUS0_SRVW4_TT1_16_TLDS1_VAW2_VW2_WSGRA1_WSGRB1_WG32_8_1_WGM1
    SolutionIndex: 262
    SolutionNameMin: Cijk_Ailk_Bljk_BBS_BH_MT16x16x64_MI16x16x16x1_SE_1LDSB0_AF0EM8_AF1EM1_AMAS3_EPS0_GRVW8_GSU1_GSUAMB_ISA90a_IU1_KLA_LBSPP128_LPB16_LDL1_LRVW8_LDW0_MAC_NLCA1_PGR2_PLR5_SIA3_SU32_SUM0_SUS256_SRVW0_TT1_16_TLDS1_VAW2_VW2_WSGRA1_WSGRB1_WG16_4_1_WGM1
    SolutionIndex: 263
    SolutionNameMin: Cijk_Ailk_Bljk_BBS_BH_MT16x64x64_MI16x16x16x1_SE_1LDSB0_AF0EM8_AF1EM1_AMAS3_EPS0_GRVW8_GSU1_GSUAMB_ISA90a_IU1_KLA_LBSPP128_LPB16_LDL1_LRVW8_LDW0_MAC_NLCA1_PGR2_PLR5_SIA3_SU32_SUM0_SUS256_SRVW0_TT1_16_TLDS1_VAW2_VW2_WSGRA1_WSGRB1_WG16_16_1_WGM1
    SolutionIndex: 264
    SolutionNameMin: Cijk_Ailk_Bljk_BBS_BH_MT128x64x64_MI32x32x8x1_SE_1LDSB0_AF0EM8_AF1EM1_AMAS3_EPS1_GRVW8_GSU15_GSUAMB_ISA90a_IU1_KLA_LBSPP128_LPB8_LDL1_LRVW8_LDW0_MAC_NLCA1_PGR1_PLR9_SIA3_SU0_SUM0_SUS0_SRVW0_TT2_32_TLDS1_VAW1_VW2_WSGRA1_WSGRB1_WG64_4_1_WGM1
    SolutionIndex: 265
    SolutionNameMin: Cijk_Ailk_Bljk_BBS_BH_MT32x32x32_MI16x16x16x1_SE_1LDSB0_AF0EM1_AF1EM1_AMAS3_EPS0_GRVW4_GSU1_GSUAMB_ISA90a_IU1_KLA_LBSPP128_LPB16_LDL1_LRVW8_LDW0_MAC_NLCA1_PGR2_PLR2_SIA3_SU0_SUM0_SUS0_SRVW4_TT1_16_TLDS1_VAW2_VW2_WSGRA1_WSGRB1_WG32_8_1_WGM15
    SolutionIndex: 266
    SolutionNameMin: Cijk_Ailk_Bljk_BBS_BH_MT16x64x32_MI16x16x16x1_SE_1LDSB0_AF0EM8_AF1EM1_AMAS3_EPS0_GRVW8_GSU1_GSUAMB_ISA90a_IU1_KLA_LBSPP128_LPB16_LDL1_LRVW8_LDW0_MAC_NLCA1_PGR2_PLR2_SIA3_SU0_SUM0_SUS0_SRVW0_TT1_16_TLDS1_VAW2_VW2_WSGRA1_WSGRB1_WG16_16_1_WGM1
    SolutionIndex: 267
    SolutionNameMin: Cijk_Ailk_Bljk_BBS_BH_MT32x32x64_MI16x16x16x1_SE_1LDSB0_AF0EM1_AF1EM1_AMAS3_EPS0_GRVW8_GSU1_GSUAMB_ISA90a_IU1_KLA_LBSPP128_LPB16_LDL1_LRVW8_LDW0_MAC_NLCA1_PGR2_PLR5_SIA3_SU0_SUM0_SUS0_SRVW4_TT1_16_TLDS1_VAW2_VW2_WSGRA1_WSGRB1_WG32_8_1_WGM1
    SolutionIndex: 268
    SolutionNameMin: Cijk_Ailk_Bljk_BBS_BH_MT64x16x64_MI16x16x16x1_SE_1LDSB0_AF0EM8_AF1EM1_AMAS3_EPS0_GRVW8_GSU1_GSUAMB_ISA90a_IU1_KLA_LBSPP128_LPB16_LDL1_LRVW8_LDW0_MAC_NLCA1_PGR2_PLR5_SIA3_SU0_SUM0_SUS0_SRVW0_TT1_16_TLDS1_VAW2_VW2_WSGRA1_WSGRB1_WG64_4_1_WGM1
    SolutionIndex: 269
    SolutionNameMin: Cijk_Ailk_Bljk_BBS_BH_MT32x32x64_MI16x16x16x1_SE_1LDSB0_AF0EM8_AF1EM1_AMAS3_EPS0_GRVW8_GSU1_GSUAMB_ISA90a_IU1_KLA_LBSPP128_LPB16_LDL1_LRVW8_LDW0_MAC_NLCA1_PGR2_PLR5_SIA3_SU32_SUM0_SUS256_SRVW4_TT1_16_TLDS1_VAW2_VW2_WSGRA1_WSGRB1_WG32_8_1_WGM2
    SolutionIndex: 270
    SolutionNameMin: Cijk_Ailk_Bljk_BBS_BH_MT128x96x64_MI32x32x8x1_SE_1LDSB0_AF0EM8_AF1EM1_AMAS3_EPS0_GRVW8_GSU15_GSUAMB_ISA90a_IU1_KLA_LBSPP128_LPB8_LDL1_LRVW8_LDW0_MAC_NLCA1_PGR2_PLR9_SIA3_SU0_SUM0_SUS0_SRVW4_TT1_96_TLDS1_VAW1_VW2_WSGRA1_WSGRB1_WG128_2_1_WGM15
    SolutionIndex: 271
    SolutionNameMin: Cijk_Ailk_Bljk_BBS_BH_MT32x32x64_MI16x16x16x1_SE_1LDSB0_AF0EM1_AF1EM1_AMAS3_EPS0_GRVW8_GSU1_GSUAMB_ISA90a_IU1_KLA_LBSPP128_LPB16_LDL1_LRVW8_LDW0_MAC_NLCA1_PGR2_PLR5_SIA3_SU0_SUM0_SUS0_SRVW4_TT1_16_TLDS1_VAW2_VW2_WSGRA1_WSGRB1_WG32_8_1_WGM2
    SolutionIndex: 272
    SolutionNameMin: Cijk_Ailk_Bljk_BBS_BH_MT32x64x64_MI16x16x16x1_SE_1LDSB0_AF0EM8_AF1EM1_AMAS3_EPS0_GRVW8_GSU1_GSUAMB_ISA90a_IU1_KLA_LBSPP128_LPB16_LDL1_LRVW8_LDW0_MAC_NLCA1_PGR2_PLR5_SIA3_SU32_SUM0_SUS256_SRVW4_TT1_32_TLDS1_VAW2_VW2_WSGRA1_WSGRB1_WG32_8_1_WGM1
    SolutionIndex: 273
    SolutionNameMin: Cijk_Ailk_Bljk_BBS_BH_MT64x32x64_MI16x16x16x1_SE_1LDSB0_AF0EM8_AF1EM1_AMAS3_EPS0_GRVW8_GSU1_GSUAMB_ISA90a_IU1_KLA_LBSPP128_LPB16_LDL1_LRVW8_LDW0_MAC_NLCA1_PGR2_PLR5_SIA3_SU0_SUM0_SUS0_SRVW4_TT2_16_TLDS1_VAW2_VW2_WSGRA1_WSGRB1_WG32_8_1_WGM1
    SolutionIndex: 274
    SolutionNameMin: Cijk_Ailk_Bljk_BBS_BH_MT32x64x64_MI16x16x16x1_SE_1LDSB0_AF0EM8_AF1EM1_AMAS3_EPS0_GRVW8_GSU1_GSUAMB_ISA90a_IU1_KLA_LBSPP128_LPB16_LDL1_LRVW8_LDW0_MAC_NLCA1_PGR2_PLR5_SIA3_SU32_SUM0_SUS256_SRVW4_TT1_32_TLDS1_VAW2_VW2_WSGRA1_WSGRB1_WG32_8_1_WGM15
    SolutionIndex: 275
    SolutionNameMin: Cijk_Ailk_Bljk_BBS_BH_MT96x128x64_MI32x32x8x1_SE_1LDSB0_AF0EM8_AF1EM1_AMAS3_EPS1_GRVW8_GSU5_GSUAMB_ISA90a_IU1_KLA_LBSPP128_LPB8_LDL1_LRVW8_LDW0_MAC_NLCA3_PGR1_PLR9_SIA3_SU32_SUM0_SUS256_SRVW0_TT3_32_TLDS1_VAW1_VW2_WSGRA1_WSGRB1_WG32_8_1_WGM15
    SolutionIndex: 276
    SolutionNameMin: Cijk_Ailk_Bljk_BBS_BH_MT64x16x32_MI16x16x16x1_SE_1LDSB0_AF0EM8_AF1EM1_AMAS3_EPS0_GRVW8_GSU1_GSUAMB_ISA90a_IU1_KLA_LBSPP128_LPB16_LDL1_LRVW8_LDW0_MAC_NLCA1_PGR2_PLR2_SIA3_SU0_SUM0_SUS0_SRVW0_TT1_16_TLDS1_VAW2_VW2_WSGRA1_WSGRB1_WG64_4_1_WGM15
    SolutionIndex: 277
    SolutionNameMin: Cijk_Ailk_Bljk_BBS_BH_MT32x64x64_MI16x16x16x1_SE_1LDSB0_AF0EM1_AF1EM1_AMAS3_EPS0_GRVW8_GSU1_GSUAMB_ISA90a_IU1_KLA_LBSPP128_LPB16_LDL1_LRVW8_LDW0_MAC_NLCA1_PGR2_PLR5_SIA3_SU32_SUM0_SUS256_SRVW4_TT1_32_TLDS1_VAW2_VW2_WSGRA1_WSGRB1_WG32_8_1_WGM15
    SolutionIndex: 278
    SolutionNameMin: Cijk_Ailk_Bljk_BBS_BH_MT64x64x64_MI32x32x8x1_SE_1LDSB0_AF0EM1_AF1EM1_AMAS3_EPS0_GRVW8_GSU1_GSUAMB_ISA90a_IU1_KLA_LBSPP128_LPB8_LDL1_LRVW8_LDW0_MAC_NLCA1_PGR2_PLR9_SIA3_SU0_SUM0_SUS0_SRVW4_TT1_32_TLDS1_VAW2_VW2_WSGRA1_WSGRB1_WG64_4_1_WGM1
    SolutionIndex: 279
    SolutionNameMin: Cijk_Ailk_Bljk_BBS_BH_MT64x64x64_MI32x32x8x1_SE_1LDSB0_AF0EM8_AF1EM1_AMAS3_EPS0_GRVW8_GSU1_GSUAMB_ISA90a_IU1_KLA_LBSPP128_LPB8_LDL1_LRVW8_LDW0_MAC_NLCA1_PGR2_PLR9_SIA3_SU0_SUM0_SUS0_SRVW4_TT1_32_TLDS1_VAW2_VW2_WSGRA1_WSGRB1_WG64_4_1_WGM1
    SolutionIndex: 280
    SolutionNameMin: Cijk_Ailk_Bljk_BBS_BH_MT64x64x32_MI32x32x8x1_SE_1LDSB0_AF0EM8_AF1EM1_AMAS3_EPS0_GRVW2_GSU1_GSUAMB_ISA90a_IU1_KLA_LBSPP128_LPB8_LDL1_LRVW8_LDW0_MAC_NLCA1_PGR2_PLR5_SIA3_SU0_SUM0_SUS0_SRVW4_TT1_32_TLDS1_VAW2_VW2_WSGRA1_WSGRB1_WG64_4_1_WGM15
    SolutionIndex: 281
    SolutionNameMin: Cijk_Ailk_Bljk_BBS_BH_MT64x64x32_MI32x32x8x1_SE_1LDSB0_AF0EM8_AF1EM1_AMAS3_EPS0_GRVW8_GSU1_GSUAMB_ISA90a_IU1_KLA_LBSPP128_LPB8_LDL1_LRVW8_LDW0_MAC_NLCA1_PGR2_PLR5_SIA3_SU0_SUM0_SUS0_SRVW4_TT1_32_TLDS1_VAW2_VW2_WSGRA1_WSGRB1_WG64_4_1_WGM1
    SolutionIndex: 282
    SolutionNameMin: Cijk_Ailk_Bljk_BBS_BH_MT64x80x64_MI16x16x16x1_SN_1LDSB0_AF0EM4_AF1EM4_AMAS3_EPS0_GRVW2_GSU1_GSUAMB_ISA90a_IU1_KLA_LBSPP128_LPB4_LDL1_LRVW4_LDW1_FMA_NLCA1_PGR2_PLR5_SIA3_SU0_SUM0_SUS0_SRVW0_TT1_80_TLDS1_VAW1_VW2_WSGRA0_WSGRB0_WG64_4_1_WGM8
    SolutionIndex: 283
    SolutionNameMin: Cijk_Ailk_Bljk_BBS_BH_MT64x128x64_MI32x32x8x1_SE_1LDSB0_AF0EM8_AF1EM1_AMAS3_EPS0_GRVW8_GSU1_GSUAMB_ISA90a_IU1_KLA_LBSPP128_LPB8_LDL1_LRVW8_LDW0_MAC_NLCA1_PGR2_PLR9_SIA3_SU32_SUM0_SUS256_SRVW4_TT1_64_TLDS1_VAW2_VW2_WSGRA1_WSGRB1_WG64_4_1_WGM2
    SolutionIndex: 284
    SolutionNameMin: Cijk_Ailk_Bljk_BBS_BH_MT64x32x32_MI16x16x16x1_SE_1LDSB0_AF0EM8_AF1EM1_AMAS3_EPS1_GRVW2_GSU1_GSUAMB_ISA90a_IU1_KLA_LBSPP128_LPB16_LDL1_LRVW8_LDW0_MAC_NLCA1_PGR1_PLR2_SIA3_SU0_SUM0_SUS0_SRVW4_TT2_16_TLDS1_VAW2_VW2_WSGRA1_WSGRB1_WG32_8_1_WGM1
    SolutionIndex: 285
    SolutionNameMin: Cijk_Ailk_Bljk_BBS_BH_MT32x32x64_MI16x16x16x1_SE_1LDSB0_AF0EM1_AF1EM1_AMAS3_EPS0_GRVW4_GSU1_GSUAMB_ISA90a_IU1_KLA_LBSPP128_LPB16_LDL1_LRVW8_LDW0_MAC_NLCA1_PGR2_PLR5_SIA3_SU0_SUM0_SUS0_SRVW4_TT1_16_TLDS1_VAW2_VW2_WSGRA1_WSGRB1_WG32_8_1_WGM1
    SolutionIndex: 286
    SolutionNameMin: Cijk_Ailk_Bljk_BBS_BH_MT64x16x32_MI16x16x16x1_SE_1LDSB0_AF0EM8_AF1EM1_AMAS3_EPS1_GRVW4_GSU1_GSUAMB_ISA90a_IU1_KLA_LBSPP128_LPB16_LDL1_LRVW8_LDW0_MAC_NLCA1_PGR1_PLR2_SIA3_SU0_SUM0_SUS0_SRVW0_TT1_16_TLDS1_VAW2_VW2_WSGRA1_WSGRB1_WG64_4_1_WGM1
    SolutionIndex: 287
    SolutionNameMin: Cijk_Ailk_Bljk_BBS_BH_MT64x32x32_MI16x16x16x1_SE_1LDSB0_AF0EM1_AF1EM1_AMAS3_EPS0_GRVW2_GSU1_GSUAMB_ISA90a_IU1_KLA_LBSPP128_LPB16_LDL1_LRVW8_LDW0_MAC_NLCA1_PGR2_PLR2_SIA3_SU0_SUM0_SUS0_SRVW4_TT2_16_TLDS1_VAW2_VW2_WSGRA1_WSGRB1_WG32_8_1_WGM1
    SolutionIndex: 288
    SolutionNameMin: Cijk_Ailk_Bljk_BBS_BH_MT128x128x32_MI32x32x8x1_SE_1LDSB0_AF0EM1_AF1EM1_AMAS3_EPS0_GRVW8_GSU5_GSUAMB_ISA90a_IU1_KLA_LBSPP128_LPB8_LDL1_LRVW8_LDW0_MAC_NLCA1_PGR2_PLR5_SIA3_SU0_SUM0_SUS0_SRVW4_TT2_64_TLDS1_VAW1_VW2_WSGRA1_WSGRB1_WG64_4_1_WGM2
    SolutionIndex: 289
    SolutionNameMin: Cijk_Ailk_Bljk_BBS_BH_MT64x128x64_MI32x32x8x1_SE_1LDSB0_AF0EM8_AF1EM1_AMAS3_EPS0_GRVW8_GSU1_GSUAMB_ISA90a_IU1_KLA_LBSPP128_LPB8_LDL1_LRVW8_LDW0_MAC_NLCA1_PGR2_PLR9_SIA3_SU0_SUM0_SUS0_SRVW4_TT1_64_TLDS1_VAW2_VW2_WSGRA1_WSGRB1_WG64_4_1_WGM1
    SolutionIndex: 290
    SolutionNameMin: Cijk_Ailk_Bljk_BBS_BH_MT32x64x32_MI16x16x16x1_SE_1LDSB0_AF0EM1_AF1EM1_AMAS3_EPS0_GRVW2_GSU1_GSUAMB_ISA90a_IU1_KLA_LBSPP128_LPB16_LDL1_LRVW8_LDW0_MAC_NLCA1_PGR2_PLR2_SIA3_SU0_SUM0_SUS0_SRVW4_TT1_32_TLDS1_VAW2_VW2_WSGRA1_WSGRB1_WG32_8_1_WGM1
    SolutionIndex: 291
    SolutionNameMin: Cijk_Ailk_Bljk_BBS_BH_MT128x64x32_MI32x32x8x1_SE_1LDSB0_AF0EM8_AF1EM1_AMAS3_EPS0_GRVW8_GSU1_GSUAMB_ISA90a_IU1_KLA_LBSPP128_LPB8_LDL1_LRVW8_LDW0_MAC_NLCA1_PGR2_PLR5_SIA3_SU0_SUM0_SUS0_SRVW4_TT2_32_TLDS1_VAW2_VW2_WSGRA1_WSGRB1_WG64_4_1_WGM15
    SolutionIndex: 292
    SolutionNameMin: Cijk_Ailk_Bljk_BBS_BH_MT128x96x64_MI32x32x8x1_SE_1LDSB0_AF0EM8_AF1EM1_AMAS3_EPS0_GRVW8_GSU1_GSUAMB_ISA90a_IU1_KLA_LBSPP128_LPB8_LDL1_LRVW8_LDW0_MAC_NLCA1_PGR2_PLR9_SIA3_SU0_SUM0_SUS0_SRVW4_TT1_96_TLDS1_VAW2_VW2_WSGRA1_WSGRB1_WG128_2_1_WGM1
    SolutionIndex: 293
    SolutionNameMin: Cijk_Ailk_Bljk_BBS_BH_MT128x96x64_MI32x32x8x1_SE_1LDSB0_AF0EM8_AF1EM1_AMAS3_EPS0_GRVW8_GSU1_GSUAMB_ISA90a_IU1_KLA_LBSPP128_LPB8_LDL1_LRVW8_LDW0_MAC_NLCA1_PGR2_PLR9_SIA3_SU0_SUM0_SUS0_SRVW4_TT1_96_TLDS1_VAW2_VW2_WSGRA1_WSGRB1_WG128_2_1_WGM15
    SolutionIndex: 294
    SolutionNameMin: Cijk_Ailk_Bljk_BBS_BH_MT128x128x32_MI32x32x8x1_SE_1LDSB1_AF0EM8_AF1EM1_AMAS3_EPS1_GRVW2_GSU1_GSUAMB_ISA90a_IU1_KLA_LBSPP128_LPB8_LDL1_LRVW8_LDW0_MAC_NLCA1_PGR1_PLR5_SIA3_SU32_SUM0_SUS128_SRVW4_TT2_64_TLDS1_VAW2_VW2_WSGRA1_WSGRB1_WG64_4_1_WGM1
    SolutionIndex: 295
    SolutionNameMin: Cijk_Ailk_Bljk_BBS_BH_MT128x64x32_MI32x32x8x1_SE_1LDSB0_AF0EM8_AF1EM1_AMAS3_EPS0_GRVW8_GSU1_GSUAMB_ISA90a_IU1_KLA_LBSPP128_LPB8_LDL1_LRVW8_LDW0_MAC_NLCA1_PGR2_PLR5_SIA3_SU32_SUM0_SUS256_SRVW4_TT2_32_TLDS1_VAW2_VW2_WSGRA1_WSGRB1_WG64_4_1_WGM15
    SolutionIndex: 296
    SolutionNameMin: Cijk_Ailk_Bljk_BBS_BH_MT128x160x32_MI32x32x8x1_SE_1LDSB0_AF0EM8_AF1EM1_AMAS3_EPS0_GRVW4_GSU1_GSUAMB_ISA90a_IU1_KLA_LBSPP128_LPB8_LDL1_LRVW8_LDW0_MAC_NLCA1_PGR2_PLR5_SIA3_SU0_SUM0_SUS0_SRVW4_TT1_160_TLDS1_VAW2_VW2_WSGRA1_WSGRB1_WG128_2_1_WGM2
    SolutionIndex: 297
    SolutionNameMin: Cijk_Ailk_Bljk_BBS_BH_MT128x160x32_MI32x32x8x1_SE_1LDSB0_AF0EM8_AF1EM1_AMAS3_EPS0_GRVW4_GSU1_GSUAMB_ISA90a_IU1_KLA_LBSPP128_LPB8_LDL1_LRVW8_LDW0_MAC_NLCA1_PGR2_PLR5_SIA3_SU0_SUM0_SUS0_SRVW4_TT1_160_TLDS1_VAW2_VW2_WSGRA1_WSGRB1_WG128_2_1_WGM15
    SolutionIndex: 298
    SolutionNameMin: Cijk_Ailk_Bljk_BBS_BH_MT16x32x32_MI16x16x16x1_SN_MIAV1
    SolutionIndex: 299
    SolutionNameMin: Cijk_Ailk_Bljk_BBS_BH_MT64x16x32_MI16x16x16x1_SN_TT2_16_WG32_4_1
    SolutionIndex: 300
    SolutionNameMin: Cijk_Ailk_Bljk_BBS_BH_MT4x32x64_SN_LPA4_LPB4_LDL4_WG1_8_16
    SolutionIndex: 301
    SolutionNameMin: Cijk_Ailk_Bljk_BBS_BH_MT4x16x64_SN_
    SolutionIndex: 302
    SolutionNameMin: Cijk_Ailk_Bljk_BBS_BH_MT8x8x32_SN_LDL4_LDW1
    SolutionIndex: 303
    SolutionNameMin: Cijk_Ailk_Bljk_BBS_BH_MT4x32x64_SN_GSU16_LPA2_LPB2_LDL1_LDW0
    SolutionIndex: 304
    SolutionNameMin: Cijk_Ailk_Bljk_BBS_BH_MT4x32x64_SN_LDL2_LDW0
- - - [64, 35, 1, 35]
    - [2, 0.005]
  - - [64, 35, 1, 32]
    - [7, 0.009]
  - - [64, 15, 1, 15]
    - [0, 0.001]
  - - [64, 15, 1, 17]
    - [8, 0.002]
  - - [64, 17, 1, 17]
    - [1, 0.001]
  - - [64, 30, 1, 30]
    - [93, 0.007]
  - - [64, 32, 1, 32]
    - [24, 0.009]
  - - [64, 31, 1, 31]
    - [4, 0.004]
  - - [64, 24, 1, 24]
    - [93, 0.004]
  - - [64, 15, 1, 15]
    - [3, 0.001]
  - - [64, 17, 1, 17]
    - [1, 0.001]
  - - [64, 34, 1, 34]
    - [165, 0.008]
  - - [64, 14, 1, 15]
    - [93, 0.001]
  - - [64, 17, 1, 21]
    - [93, 0.001]
  - - [64, 14, 1, 14]
    - [0, 0.001]
  - - [64, 24, 1, 34]
    - [171, 0.005]
  - - [64, 21, 1, 21]
    - [93, 0.001]
  - - [64, 31, 1, 30]
    - [93, 0.003]
  - - [64, 128, 512, 128]
    - [10, 14.333]
  - - [64, 512, 1, 512]
    - [99, 0.758]
  - - [64, 512, 64, 512]
    - [42, 22.102]
  - - [128, 128, 512, 64]
    - [12, 11.837]
  - - [512, 512, 1, 64]
    - [13, 1.644]
  - - [512, 512, 64, 64]
    - [14, 15.489]
  - - [1024, 4, 1, 2]
    - [9, 0.001]
  - - [1024, 4, 1, 1024]
    - [8, 0.295]
  - - [1024, 32, 1, 2]
    - [9, 0.007]
  - - [1024, 32, 1, 1024]
    - [15, 2.319]
  - - [1024, 2048, 1, 2]
    - [10, 0.214]
  - - [1024, 2048, 1, 1024]
    - [62, 44.44]
  - - [1024, 2048, 1, 4096]
    - [17, 63.295]
  - - [1024, 2048, 1, 30528]
    - [17, 75.999]
  - - [1024, 4096, 1, 1024]
    - [18, 49.681]
  - - [1024, 4096, 1, 4096]
    - [67, 80.521]
  - - [1024, 4096, 1, 30528]
    - [20, 77.924]
  - - [4096, 2048, 1, 1024]
    - [108, 63.157]
  - - [4096, 4096, 1, 1024]
    - [22, 64.8]
  - - [32, 33, 1600, 33]
    - [23, 2.115]
  - - [32, 200, 1, 1]
    - [24, 0.001]
  - - [64, 3, 512, 3]
    - [172, 0.027]
  - - [64, 5, 512, 5]
    - [12, 0.06]
  - - [64, 5, 960, 5]
    - [7, 0.085]
  - - [64, 9, 512, 9]
    - [12, 0.11]
  - - [64, 512, 1, 1]
    - [13, 0.003]
  - - [67, 512, 1, 2048]
    - [25, 3.368]
  - - [74, 512, 1, 2048]
    - [26, 3.658]
  - - [74, 960, 1, 2048]
    - [27, 6.61]
  - - [100, 512, 1, 2048]
    - [26, 4.802]
  - - [128, 27, 32768, 27]
    - [28, 4.241]
  - - [256, 1024, 1, 1]
    - [13, 0.024]
  - - [256, 8976, 1, 1536]
    - [16, 49.769]
  - - [256, 8976, 1, 2048]
    - [16, 52.392]
  - - [256, 8976, 1, 2304]
    - [16, 54.176]
  - - [256, 8976, 1, 2560]
    - [16, 55.461]
  - - [256, 8976, 1, 2816]
    - [16, 56.209]
  - - [256, 8976, 1, 3072]
    - [16, 56.485]
  - - [256, 8976, 1, 4352]
    - [29, 59.962]
  - - [256, 8976, 1, 4864]
    - [30, 61.486]
  - - [256, 8976, 1, 5376]
    - [29, 62.356]
  - - [256, 8976, 1, 5632]
    - [30, 62.578]
  - - [256, 8976, 1, 5888]
    - [29, 63.12]
  - - [256, 8976, 1, 6144]
    - [31, 63.447]
  - - [256, 8976, 1, 6656]
    - [29, 64.417]
  - - [256, 8976, 1, 7168]
    - [29, 64.592]
  - - [256, 8976, 1, 7424]
    - [30, 64.888]
  - - [256, 8976, 1, 8192]
    - [30, 65.782]
  - - [256, 8976, 1, 8448]
    - [30, 65.916]
  - - [256, 8976, 1, 8960]
    - [29, 66.219]
  - - [256, 8976, 1, 9472]
    - [30, 66.763]
  - - [256, 8976, 1, 9728]
    - [30, 66.892]
  - - [256, 8976, 1, 9984]
    - [30, 67.206]
  - - [256, 8976, 1, 10240]
    - [30, 67.165]
  - - [256, 8976, 1, 10496]
    - [31, 67.11]
  - - [256, 8976, 1, 11008]
    - [31, 67.5]
  - - [256, 8976, 1, 11520]
    - [29, 67.813]
  - - [256, 8976, 1, 12288]
    - [29, 68.267]
  - - [256, 8976, 1, 14336]
    - [30, 68.845]
  - - [256, 8976, 1, 14848]
    - [29, 68.963]
  - - [256, 8976, 1, 15104]
    - [30, 69.013]
  - - [256, 8976, 1, 15872]
    - [30, 69.13]
  - - [256, 8976, 1, 17152]
    - [30, 69.643]
  - - [256, 8976, 1, 19712]
    - [30, 70.051]
  - - [256, 8976, 1, 19968]
    - [30, 70.199]
  - - [256, 8976, 1, 20480]
    - [29, 70.3]
  - - [256, 8976, 1, 20992]
    - [30, 70.26]
  - - [256, 8976, 1, 22016]
    - [29, 70.428]
  - - [256, 8976, 1, 26112]
    - [29, 70.853]
  - - [256, 8976, 1, 33536]
    - [30, 71.552]
  - - [256, 8976, 1, 44505]
    - [31, 86.603]
  - - [256, 32768, 1, 128]
    - [33, 21.112]
  - - [257, 1024, 1, 4096]
    - [34, 21.05]
  - - [480, 32768, 1, 1024]
    - [22, 61.533]
  - - [512, 200, 1, 1]
    - [13, 0.01]
  - - [512, 200, 1, 32]
    - [13, 0.345]
  - - [512, 215, 1, 2048]
    - [35, 9.338]
  - - [512, 256, 1, 2048]
    - [36, 11.327]
  - - [512, 1600, 1, 32]
    - [10, 2.255]
  - - [512, 1600, 1, 512]
    - [119, 14.942]
  - - [512, 32768, 1, 256]
    - [38, 40.024]
  - - [560, 200, 1, 1024]
    - [39, 6.493]
  - - [560, 1600, 1, 1024]
    - [40, 28.321]
  - - [768, 215, 1, 2048]
    - [36, 13.905]
  - - [768, 256, 1, 2048]
    - [35, 16.318]
  - - [1024, 200, 1, 1]
    - [13, 0.02]
  - - [1024, 512, 1, 1]
    - [104, 0.033]
  - - [1024, 512, 1, 64]
    - [23, 2.908]
  - - [1024, 512, 1, 1024]
    - [37, 19.702]
  - - [1024, 960, 1, 64]
    - [43, 4.663]
  - - [1024, 960, 1, 1024]
    - [61, 23.931]
  - - [1024, 1600, 1, 1]
    - [44, 0.097]
  - - [1024, 1600, 1, 1024]
    - [60, 40.486]
  - - [1024, 1792, 1, 256]
    - [18, 18.313]
  - - [1024, 2048, 1, 256]
    - [19, 15.754]
  - - [1024, 2560, 1, 256]
    - [44, 17.872]
  - - [1024, 3072, 1, 256]
    - [45, 25.343]
  - - [1024, 3328, 1, 256]
    - [150, 23.546]
  - - [1024, 3840, 1, 256]
    - [46, 29.924]
  - - [1024, 4096, 1, 256]
    - [38, 27.124]
  - - [1024, 4608, 1, 256]
    - [47, 30.721]
  - - [1024, 4864, 1, 256]
    - [48, 30.371]
  - - [1024, 5120, 1, 256]
    - [14, 31.635]
  - - [1024, 5632, 1, 256]
    - [38, 31.267]
  - - [1024, 6144, 1, 256]
    - [47, 33.604]
  - - [1024, 6400, 1, 256]
    - [45, 30.92]
  - - [1024, 7168, 1, 256]
    - [48, 33.764]
  - - [1024, 7424, 1, 256]
    - [50, 33.837]
  - - [1024, 7680, 1, 256]
    - [50, 36.526]
  - - [1024, 7936, 1, 256]
    - [38, 34.317]
  - - [1024, 8192, 1, 256]
    - [51, 34.863]
  - - [1024, 8448, 1, 256]
    - [46, 35.952]
  - - [1024, 8704, 1, 256]
    - [52, 35.754]
  - - [1024, 8960, 1, 256]
    - [53, 35.955]
  - - [1024, 9728, 1, 256]
    - [48, 37.025]
  - - [1024, 9984, 1, 256]
    - [54, 37.804]
  - - [1024, 10240, 1, 256]
    - [49, 37.292]
  - - [1024, 10496, 1, 256]
    - [14, 37.804]
  - - [1024, 11008, 1, 256]
    - [48, 37.804]
  - - [1024, 11264, 1, 256]
    - [38, 38.327]
  - - [1024, 11520, 1, 256]
    - [14, 39.288]
  - - [1024, 12288, 1, 256]
    - [53, 39.108]
  - - [1024, 13312, 1, 256]
    - [48, 38.85]
  - - [1024, 13568, 1, 256]
    - [48, 39.48]
  - - [1024, 14336, 1, 256]
    - [38, 40.634]
  - - [1024, 14592, 1, 256]
    - [38, 40.696]
  - - [1024, 14848, 1, 256]
    - [51, 40.085]
  - - [1024, 15104, 1, 256]
    - [38, 40.517]
  - - [1024, 16128, 1, 256]
    - [53, 41.17]
  - - [1024, 17152, 1, 256]
    - [53, 41.252]
  - - [1024, 18944, 1, 256]
    - [54, 41.322]
  - - [1024, 19712, 1, 256]
    - [51, 42.065]
  - - [1024, 19968, 1, 256]
    - [53, 42.276]
  - - [1024, 20480, 1, 256]
    - [49, 42.239]
  - - [1024, 20992, 1, 256]
    - [38, 42.32]
  - - [1024, 21504, 1, 256]
    - [53, 42.653]
  - - [1024, 22016, 1, 256]
    - [46, 42.141]
  - - [1024, 23552, 1, 256]
    - [55, 42.859]
  - - [1024, 28672, 1, 256]
    - [48, 43.786]
  - - [1024, 32768, 1, 512]
    - [38, 57.029]
  - - [1024, 32768, 1, 1024]
    - [56, 67.01]
  - - [1024, 33536, 1, 256]
    - [55, 44.416]
  - - [1024, 40448, 1, 256]
    - [49, 45.114]
  - - [1600, 512, 1, 1024]
    - [57, 31.192]
  - - [2048, 512, 1, 1]
    - [183, 0.044]
  - - [2048, 512, 1, 2048]
    - [111, 39.82]
  - - [2048, 960, 1, 2048]
    - [59, 50.915]
  - - [2048, 1024, 1, 1]
    - [12, 0.104]
  - - [2048, 1024, 1, 256]
    - [77, 15.546]
  - - [3200, 1024, 1, 2048]
    - [60, 57.982]
  - - [4096, 1024, 1, 1]
    - [33, 0.15]
  - - [64, 14, 10880, 14]
    - [28, 1.305]
  - - [64, 14, 10880, 15]
    - [12, 1.436]
  - - [64, 15, 7680, 15]
    - [10, 1.388]
  - - [64, 15, 10880, 15]
    - [28, 1.47]
  - - [64, 15, 7680, 17]
    - [12, 1.542]
  - - [64, 17, 6144, 17]
    - [28, 1.554]
  - - [64, 17, 7680, 17]
    - [28, 1.632]
  - - [64, 17, 6144, 21]
    - [28, 2.051]
  - - [64, 21, 6144, 21]
    - [12, 2.495]
  - - [64, 24, 4736, 24]
    - [12, 3.152]
  - - [64, 24, 4736, 34]
    - [43, 4.098]
  - - [64, 30, 2048, 30]
    - [28, 3.765]
  - - [64, 31, 2048, 30]
    - [12, 3.825]
  - - [64, 31, 2048, 31]
    - [12, 3.196]
  - - [64, 32, 4608, 32]
    - [12, 7.733]
  - - [64, 34, 4736, 34]
    - [41, 3.528]
  - - [64, 35, 4608, 32]
    - [10, 5.271]
  - - [64, 35, 4608, 35]
    - [10, 3.615]
  - - [1024, 3840, 1, 1024]
    - [61, 54.265]
  - - [1024, 3840, 1, 4096]
    - [67, 76.58]
  - - [1024, 3968, 1, 1024]
    - [18, 48.427]
  - - [1024, 3968, 1, 4096]
    - [19, 64.703]
  - - [1024, 3968, 1, 42720]
    - [20, 76.369]
  - - [1024, 6528, 1, 1024]
    - [139, 61.901]
  - - [1024, 6528, 1, 4096]
    - [163, 84.929]
  - - [1024, 6528, 1, 42720]
    - [139, 96.353]
  - - [1024, 7104, 1, 1024]
    - [61, 56.439]
  - - [1024, 7104, 1, 4096]
    - [63, 82.625]
  - - [1024, 7104, 1, 42720]
    - [31, 90.981]
  - - [1024, 7200, 1, 1024]
    - [61, 56.896]
  - - [1024, 7200, 1, 4096]
    - [31, 81.587]
  - - [1024, 7200, 1, 42720]
    - [64, 78.863]
  - - [1024, 8064, 1, 1024]
    - [65, 55.227]
  - - [1024, 8064, 1, 4096]
    - [66, 68.414]
  - - [1024, 8160, 1, 1024]
    - [56, 57.245]
  - - [1024, 8160, 1, 4096]
    - [67, 69.894]
  - - [1024, 9216, 1, 1024]
    - [61, 61.721]
  - - [1024, 9216, 1, 4096]
    - [70, 82.709]
  - - [1024, 9520, 1, 1024]
    - [68, 57.061]
  - - [1024, 9520, 1, 4096]
    - [22, 71.442]
  - - [1024, 9520, 1, 42720]
    - [69, 78.776]
  - - [1024, 10064, 1, 1024]
    - [49, 62.469]
  - - [1024, 10064, 1, 4096]
    - [19, 81.692]
  - - [1024, 10080, 1, 1024]
    - [61, 60.326]
  - - [1024, 10080, 1, 4096]
    - [19, 81.88]
  - - [1024, 10080, 1, 42720]
    - [62, 94.938]
  - - [1024, 10200, 1, 1024]
    - [56, 64.115]
  - - [1024, 10200, 1, 4096]
    - [19, 81.932]
  - - [4096, 3840, 1, 1024]
    - [21, 64.508]
  - - [4096, 3968, 1, 1024]
    - [48, 60.663]
  - - [4096, 6528, 1, 1024]
    - [49, 66.141]
  - - [4096, 7104, 1, 1024]
    - [48, 64.87]
  - - [4096, 7200, 1, 1024]
    - [48, 65.068]
  - - [4096, 8064, 1, 1024]
    - [21, 66.088]
  - - [4096, 8160, 1, 1024]
    - [21, 67.19]
  - - [4096, 9216, 1, 1024]
    - [22, 67.857]
  - - [4096, 9520, 1, 1024]
    - [21, 65.809]
  - - [4096, 10064, 1, 1024]
    - [22, 66.983]
  - - [4096, 10080, 1, 1024]
    - [70, 66.901]
  - - [4096, 10200, 1, 1024]
    - [22, 67.64]
  - - [64, 27, 1920, 27]
    - [10, 2.96]
  - - [64, 33, 1920, 27]
    - [12, 2.377]
  - - [64, 33, 1920, 33]
    - [5, 2.734]
  - - [1024, 3240, 1, 1024]
    - [18, 47.081]
  - - [1024, 3240, 1, 4096]
    - [70, 65.319]
  - - [1024, 3960, 1, 1024]
    - [44, 47.543]
  - - [1024, 3960, 1, 4096]
    - [19, 64.306]
  - - [1024, 3960, 1, 42720]
    - [67, 76.299]
  - - [4096, 3240, 1, 1024]
    - [48, 61.243]
  - - [4096, 3960, 1, 1024]
    - [48, 60.482]
  - - [64, 192, 64, 1280]
    - [80, 22.841]
  - - [64, 320, 64, 1280]
    - [144, 26.932]
  - - [64, 384, 64, 1280]
    - [75, 31.494]
  - - [64, 448, 64, 1280]
    - [136, 28.33]
  - - [64, 192, 64, 2048]
    - [72, 27.103]
  - - [64, 320, 64, 2048]
    - [75, 31.902]
  - - [64, 384, 64, 2048]
    - [75, 33.357]
  - - [64, 448, 64, 2048]
    - [90, 32.367]
  - - [1225, 32, 64, 192]
    - [76, 12.168]
  - - [1225, 48, 64, 192]
    - [76, 11.613]
  - - [1225, 64, 64, 192]
    - [77, 16.495]
  - - [1225, 48, 64, 256]
    - [77, 13.077]
  - - [1225, 64, 64, 256]
    - [77, 19.092]
  - - [1225, 48, 64, 288]
    - [77, 14.315]
  - - [1225, 64, 64, 288]
    - [77, 21.843]
  - - [5329, 80, 64, 64]
    - [76, 8.509]
  - - [289, 128, 64, 768]
    - [77, 26.896]
  - - [289, 160, 64, 768]
    - [77, 24.387]
  - - [289, 192, 64, 768]
    - [79, 31.164]
  - - [64, 192, 32, 1280]
    - [80, 15.617]
  - - [64, 320, 32, 1280]
    - [42, 26.399]
  - - [64, 384, 32, 1280]
    - [57, 24.617]
  - - [64, 448, 32, 1280]
    - [81, 22.028]
  - - [64, 192, 32, 2048]
    - [136, 18.651]
  - - [64, 320, 32, 2048]
    - [75, 29.305]
  - - [64, 384, 32, 2048]
    - [42, 32.174]
  - - [64, 448, 32, 2048]
    - [81, 26.529]
  - - [1225, 32, 32, 192]
    - [82, 10.558]
  - - [1225, 48, 32, 192]
    - [82, 10.025]
  - - [1225, 64, 32, 192]
    - [77, 12.178]
  - - [1225, 48, 32, 256]
    - [76, 10.407]
  - - [1225, 64, 32, 256]
    - [82, 15.629]
  - - [1225, 48, 32, 288]
    - [82, 12.138]
  - - [1225, 64, 32, 288]
    - [77, 17.283]
  - - [5329, 80, 32, 64]
    - [82, 9.219]
  - - [289, 128, 32, 768]
    - [77, 21.391]
  - - [289, 160, 32, 768]
    - [61, 21.664]
  - - [289, 192, 32, 768]
    - [61, 26.627]
  - - [3136, 256, 64, 64]
    - [33, 18.386]
  - - [3136, 64, 64, 64]
    - [12, 13.783]
  - - [3136, 64, 64, 256]
    - [83, 27.042]
  - - [784, 512, 64, 128]
    - [14, 27.71]
  - - [784, 128, 64, 512]
    - [45, 36.358]
  - - [196, 1024, 64, 256]
    - [79, 23.933]
  - - [196, 256, 64, 1024]
    - [77, 31.828]
  - - [49, 2048, 64, 512]
    - [78, 19.55]
  - - [49, 512, 64, 2048]
    - [84, 22.771]
  - - [3136, 256, 32, 64]
    - [52, 16.718]
  - - [3136, 64, 32, 64]
    - [28, 12.219]
  - - [3136, 64, 32, 256]
    - [44, 24.932]
  - - [784, 512, 32, 128]
    - [50, 24.31]
  - - [784, 128, 32, 512]
    - [85, 31.238]
  - - [196, 1024, 32, 256]
    - [86, 21.074]
  - - [196, 256, 32, 1024]
    - [61, 27.898]
  - - [49, 2048, 32, 512]
    - [87, 18.617]
  - - [49, 512, 32, 2048]
    - [88, 18.921]
  - - [3136, 128, 64, 64]
    - [10, 15.942]
  - - [3136, 256, 64, 128]
    - [33, 29.299]
  - - [784, 512, 64, 256]
    - [33, 39.35]
  - - [3136, 128, 64, 256]
    - [45, 35.743]
  - - [3136, 256, 64, 256]
    - [89, 42.942]
  - - [196, 1024, 64, 512]
    - [79, 33.757]
  - - [784, 256, 64, 512]
    - [33, 44.105]
  - - [784, 512, 64, 512]
    - [70, 50.133]
  - - [196, 512, 64, 1024]
    - [65, 37.979]
  - - [196, 1024, 64, 1024]
    - [65, 42.584]
  - - [49, 2048, 64, 1024]
    - [86, 23.941]
  - - [49, 1024, 64, 2048]
    - [90, 26.827]
  - - [3136, 128, 32, 64]
    - [12, 14.337]
  - - [3136, 256, 32, 128]
    - [33, 27.342]
  - - [784, 512, 32, 256]
    - [45, 35.05]
  - - [3136, 128, 32, 256]
    - [91, 32.613]
  - - [3136, 256, 32, 256]
    - [45, 40.379]
  - - [196, 1024, 32, 512]
    - [79, 31.828]
  - - [784, 256, 32, 512]
    - [92, 38.037]
  - - [784, 512, 32, 512]
    - [33, 45.016]
  - - [196, 512, 32, 1024]
    - [65, 32.3]
  - - [196, 1024, 32, 1024]
    - [79, 39.163]
  - - [49, 2048, 32, 1024]
    - [180, 24.437]
  - - [49, 1024, 32, 2048]
    - [84, 23.213]
  - - [64, 128, 624, 128]
    - [10, 14.983]
  - - [1024, 10, 1, 1024]
    - [15, 0.725]
  - - [2048, 2048, 1, 2048]
    - [67, 68.826]
  - - [1024, 10, 1, 2]
    - [171, 0.001]
  - - [1024, 5, 1, 2]
    - [6, 0.001]
  - - [1024, 5, 1, 1024]
    - [94, 0.367]
  - - [64, 512, 16, 512]
    - [84, 9.268]
  - - [1024, 1024, 1, 1024]
    - [77, 27.873]
  - - [1024, 9600, 1, 4096]
    - [70, 71.735]
  - - [1024, 8192, 1, 1024]
    - [95, 55.78]
  - - [1024, 1280, 1, 4096]
    - [137, 54.583]
  - - [512, 512, 1, 512]
    - [39, 8.843]
  - - [1024, 1152, 1, 1024]
    - [58, 34.281]
  - - [1024, 5248, 1, 2]
    - [96, 0.37]
  - - [1024, 820, 1, 1024]
    - [44, 24.418]
  - - [4096, 1152, 1, 1024]
    - [16, 51.846]
  - - [1024, 308, 1, 30522]
    - [100, 48.803]
  - - [1024, 39, 1, 1024]
    - [11, 2.809]
  - - [1024, 616, 1, 1024]
    - [42, 18.636]
  - - [64, 512, 96, 512]
    - [98, 27.084]
  - - [1024, 39, 1, 2]
    - [13, 0.008]
  - - [128, 128, 1, 64]
    - [99, 0.118]
  - - [1024, 160, 1, 30522]
    - [100, 35.103]
  - - [1024, 2560, 1, 1024]
    - [137, 41.233]
  - - [4096, 9600, 1, 1024]
    - [21, 66.391]
  - - [1024, 8, 1, 2]
    - [13, 0.002]
  - - [1024, 800, 1, 1024]
    - [44, 23.584]
  - - [64, 128, 640, 128]
    - [43, 15.213]
  - - [4096, 1024, 1, 1024]
    - [44, 49.63]
  - - [1024, 8, 1, 1024]
    - [8, 0.338]
  - - [1024, 1024, 1, 2]
    - [123, 0.085]
  - - [4096, 5248, 1, 1024]
    - [48, 63.785]
  - - [4096, 4096, 1, 4096]
    - [22, 75.69]
  - - [1024, 77, 1, 30522]
    - [100, 23.334]
  - - [1024, 9, 1, 2]
    - [9, 0.002]
  - - [1024, 1024, 1, 4096]
    - [58, 50.564]
  - - [1024, 9, 1, 1024]
    - [94, 0.375]
  - - [1024, 780, 1, 1024]
    - [102, 23.872]
  - - [64, 4, 38400, 4]
    - [135, 0.133]
  - - [1024, 4096, 1, 2]
    - [38, 0.303]
  - - [4096, 2560, 1, 1024]
    - [49, 64.924]
  - - [64, 128, 144, 128]
    - [85, 9.296]
  - - [1024, 780, 1, 30522]
    - [69, 75.931]
  - - [8192, 7680, 1, 8192]
    - [164, 94.542]
  - - [1024, 3072, 1, 2]
    - [38, 0.272]
  - - [8192, 8192, 1, 8192]
    - [29, 91.122]
  - - [1024, 180, 1, 1024]
    - [36, 10.74]
  - - [1024, 180, 1, 30522]
    - [100, 38.909]
  - - [1024, 512, 1, 2]
    - [43, 0.048]
  - - [1024, 8192, 1, 4096]
    - [60, 69.826]
  - - [1024, 385, 1, 30522]
    - [105, 37.275]
  - - [4096, 512, 1, 1024]
    - [16, 39.534]
  - - [1024, 160, 1, 1024]
    - [35, 9.358]
  - - [1024, 5120, 1, 4096]
    - [60, 70.313]
  - - [2048, 1920, 1, 2048]
    - [67, 65.725]
  - - [1024, 462, 1, 1024]
    - [37, 19.151]
  - - [1024, 462, 1, 30522]
    - [105, 44.088]
  - - [1024, 77, 1, 1024]
    - [15, 5.32]
  - - [960, 1024, 1, 1024]
    - [58, 24.075]
  - - [1024, 40, 1, 2]
    - [13, 0.009]
  - - [64, 5, 1, 5]
    - [93, 0.0]
  - - [1024, 40, 1, 1024]
    - [15, 2.847]
  - - [4096, 5120, 1, 1024]
    - [22, 67.508]
  - - [1024, 200, 1, 30522]
    - [106, 36.547]
  - - [1024, 41, 1, 2]
    - [107, 0.009]
  - - [1024, 200, 1, 1024]
    - [36, 6.998]
  - - [4096, 8192, 1, 1024]
    - [22, 66.606]
  - - [1024, 41, 1, 1024]
    - [15, 2.883]
  - - [1024, 4992, 1, 4096]
    - [109, 84.569]
  - - [4096, 1280, 1, 1024]
    - [49, 51.623]
  - - [1024, 2560, 1, 4096]
    - [60, 62.084]
  - - [1024, 4992, 1, 2]
    - [109, 0.278]
  - - [32, 33, 1, 33]
    - [7, 0.003]
  - - [7680, 8192, 1, 8192]
    - [103, 81.151]
  - - [4096, 3072, 1, 1024]
    - [70, 69.239]
  - - [1024, 9600, 1, 1024]
    - [61, 57.893]
  - - [1024, 385, 1, 1024]
    - [37, 16.661]
  - - [64, 4, 32768, 4]
    - [135, 0.133]
  - - [64, 128, 656, 128]
    - [73, 15.226]
  - - [64, 512, 128, 512]
    - [119, 28.816]
  - - [1024, 4992, 1, 1024]
    - [109, 56.854]
  - - [1024, 1152, 1, 2]
    - [83, 0.096]
  - - [1024, 5248, 1, 4096]
    - [60, 71.654]
  - - [1024, 9600, 1, 33712]
    - [69, 77.727]
  - - [1024, 3072, 1, 4096]
    - [22, 63.894]
  - - [4096, 3840, 1, 4096]
    - [164, 85.506]
  - - [1024, 6, 1, 1024]
    - [94, 0.248]
  - - [1024, 5120, 1, 1024]
    - [16, 55.543]
  - - [1024, 8192, 1, 33712]
    - [137, 95.113]
  - - [1024, 308, 1, 1024]
    - [136, 10.564]
  - - [3840, 4096, 1, 4096]
    - [103, 85.461]
  - - [1024, 2560, 1, 2]
    - [143, 0.179]
  - - [1024, 6, 1, 2]
    - [24, 0.001]
  - - [64, 128, 160, 128]
    - [98, 10.163]
  - - [1024, 512, 1, 4096]
    - [110, 36.274]
  - - [64, 128, 128, 128]
    - [28, 8.309]
  - - [1024, 5248, 1, 1024]
    - [16, 55.704]
  - - [1024, 820, 1, 30522]
    - [102, 61.777]
  - - [1024, 1280, 1, 2]
    - [146, 0.104]
  - - [1024, 1280, 1, 1024]
    - [77, 32.633]
  - - [1920, 2048, 1, 2048]
    - [67, 65.765]
  - - [1024, 3072, 1, 1024]
    - [138, 50.557]
  - - [1024, 800, 1, 30522]
    - [69, 80.632]
  - - [64, 128, 1, 128]
    - [15, 0.108]
  - - [64, 512, 80, 512]
    - [78, 27.149]
  - - [480, 512, 1, 512]
    - [88, 5.115]
  - - [512, 480, 1, 512]
    - [13, 5.122]
  - - [4096, 4992, 1, 1024]
    - [48, 70.579]
  - - [479, 32768, 1, 1024]
    - [103, 50.092]
  - - [1024, 1152, 1, 4096]
    - [58, 63.454]
  - - [1024, 5120, 1, 2]
    - [52, 0.367]
  - - [1024, 1024, 64, 64]
    - [14, 18.441]
  - - [64, 1024, 32, 1024]
    - [42, 29.327]
  - - [1024, 16384, 1, 3072]
    - [70, 74.16]
  - - [1024, 2048, 1, 30592]
    - [62, 75.301]
  - - [640, 2048, 1, 2560]
    - [113, 45.833]
  - - [1024, 1024, 64, 96]
    - [47, 25.951]
  - - [2048, 2, 1, 2048]
    - [15, 0.416]
  - - [2048, 2, 1, 2]
    - [15, 0.0]
  - - [1536, 4096, 1, 4608]
    - [22, 70.017]
  - - [512, 512, 256, 64]
    - [33, 18.647]
  - - [2048, 1024, 1, 8192]
    - [112, 66.151]
  - - [4096, 16384, 1, 1024]
    - [22, 70.487]
  - - [1024, 8192, 1, 50304]
    - [117, 90.808]
  - - [1536, 8192, 1, 50304]
    - [157, 96.282]
  - - [6144, 8192, 1, 1536]
    - [22, 75.282]
  - - [1024, 4096, 1, 30592]
    - [67, 77.898]
  - - [1536, 4096, 1, 6144]
    - [68, 72.139]
  - - [1024, 16384, 1, 4096]
    - [22, 75.638]
  - - [1024, 16384, 1, 50304]
    - [139, 97.328]
  - - [1024, 4096, 1, 3072]
    - [67, 75.592]
  - - [1536, 8192, 1, 1536]
    - [22, 74.215]
  - - [1024, 2048, 1, 3072]
    - [114, 59.301]
  - - [2560, 2048, 1, 7680]
    - [114, 73.412]
  - - [96, 1024, 64, 1024]
    - [115, 42.373]
  - - [2048, 1024, 1, 2048]
    - [112, 49.027]
  - - [2048, 1024, 1, 30592]
    - [112, 71.319]
  - - [64, 1024, 256, 1024]
    - [116, 38.473]
  - - [8192, 1024, 1, 2048]
    - [117, 63.796]
  - - [2560, 2048, 1, 2560]
    - [16, 66.294]
  - - [1536, 8192, 1, 4608]
    - [157, 84.616]
  - - [64, 512, 256, 512]
    - [75, 31.118]
  - - [1024, 2048, 1, 50304]
    - [59, 75.743]
  - - [1024, 1024, 32, 64]
    - [47, 17.596]
  - - [1536, 8192, 1, 6144]
    - [157, 87.684]
  - - [1024, 1024, 256, 64]
    - [118, 19.441]
  - - [512, 512, 40, 64]
    - [92, 14.347]
  - - [1536, 4096, 1, 50304]
    - [115, 92.479]
  - - [1024, 1024, 128, 96]
    - [46, 26.539]
  - - [1024, 8192, 1, 3072]
    - [60, 67.021]
  - - [64, 1024, 64, 1024]
    - [42, 35.014]
  - - [1024, 1024, 128, 64]
    - [118, 19.122]
  - - [64, 1024, 128, 1024]
    - [119, 36.506]
  - - [1024, 4096, 1, 50304]
    - [67, 78.718]
  - - [96, 1024, 128, 1024]
    - [115, 45.337]
  - - [6144, 4096, 1, 1536]
    - [103, 74.015]
  - - [1024, 16, 1, 2]
    - [13, 0.003]
  - - [1024, 16, 1, 1024]
    - [94, 1.146]
  - - [2560, 4, 1, 2]
    - [13, 0.002]
  - - [1024, 16384, 1, 1024]
    - [70, 64.584]
  - - [2560, 2048, 1, 1920]
    - [16, 63.572]
  - - [2048, 1024, 1, 6144]
    - [112, 63.614]
  - - [2560, 4, 1, 2560]
    - [120, 1.123]
  - - [512, 512, 128, 64]
    - [45, 17.444]
  - - [1024, 8192, 1, 30592]
    - [117, 90.773]
  - - [1536, 4096, 1, 1536]
    - [103, 68.908]
  - - [64, 512, 40, 512]
    - [121, 23.122]
  - - [1024, 1, 1, 2]
    - [13, 0.0]
  - - [1024, 1, 1, 1024]
    - [94, 0.061]
  - - [1024, 1, 1, 200]
    - [13, 0.017]
  - - [1024, 1, 1, 1600]
    - [94, 0.096]
  - - [2048, 1, 1, 512]
    - [15, 0.09]
  - - [128, 128, 1024, 64]
    - [33, 13.427]
  - - [64, 128, 1024, 128]
    - [28, 16.066]
  - - [1024, 64, 1, 2]
    - [107, 0.014]
  - - [1024, 8192, 1, 30528]
    - [60, 96.132]
  - - [1024, 64, 1, 1024]
    - [11, 4.5]
  - - [1024, 3456, 1, 1024]
    - [61, 52.38]
  - - [1024, 3456, 1, 512]
    - [61, 37.846]
  - - [1024, 4096, 1, 512]
    - [44, 39.405]
  - - [1024, 6912, 1, 1024]
    - [61, 60.444]
  - - [1024, 6912, 1, 512]
    - [38, 46.625]
  - - [1024, 864, 1, 1024]
    - [40, 28.915]
  - - [1024, 864, 1, 512]
    - [40, 19.781]
  - - [256, 3456, 1, 128]
    - [37, 8.679]
  - - [256, 4096, 1, 128]
    - [196, 5.369]
  - - [256, 55296, 1, 128]
    - [50, 25.079]
  - - [256, 6912, 1, 128]
    - [147, 7.752]
  - - [256, 864, 1, 128]
    - [107, 2.774]
  - - [480, 3456, 1, 1024]
    - [40, 34.478]
  - - [480, 4096, 1, 1024]
    - [124, 38.38]
  - - [480, 6912, 1, 1024]
    - [16, 47.089]
  - - [480, 864, 1, 1024]
    - [42, 12.051]
  - - [512, 3456, 1, 256]
    - [44, 23.304]
  - - [512, 4096, 1, 256]
    - [18, 19.897]
  - - [512, 55296, 1, 256]
    - [47, 43.136]
  - - [512, 6912, 1, 256]
    - [46, 22.667]
  - - [512, 864, 1, 256]
    - [125, 8.506]
  - - [1024, 640, 1, 30528]
    - [106, 79.785]
  - - [1024, 1280, 1, 30528]
    - [106, 83.202]
  - - [1024, 1600, 1, 30528]
    - [117, 74.333]
  - - [1024, 10240, 1, 1024]
    - [56, 65.809]
  - - [1024, 10240, 1, 4096]
    - [62, 82.302]
  - - [4096, 10240, 1, 1024]
    - [22, 69.128]
  - - [1024, 80, 1, 1024]
    - [15, 5.728]
  - - [1024, 80, 1, 2]
    - [13, 0.017]
  - - [128, 128, 1280, 64]
    - [92, 13.911]
  - - [64, 128, 1280, 128]
    - [43, 16.33]
  - - [1024, 1640, 1, 30528]
    - [60, 76.171]
  - - [1024, 10496, 1, 1024]
    - [38, 63.355]
  - - [1024, 10496, 1, 4096]
    - [61, 80.162]
  - - [4096, 10496, 1, 1024]
    - [70, 70.443]
  - - [1024, 82, 1, 1024]
    - [15, 6.017]
  - - [1024, 82, 1, 2]
    - [13, 0.017]
  - - [128, 128, 1312, 64]
    - [126, 13.989]
  - - [64, 128, 1312, 128]
    - [43, 16.315]
  - - [1024, 160, 1, 30528]
    - [127, 37.025]
  - - [1024, 240, 1, 30528]
    - [106, 52.439]
  - - [1024, 6144, 1, 4096]
    - [70, 69.876]
  - - [1024, 12, 1, 1024]
    - [148, 0.509]
  - - [4096, 6144, 1, 1024]
    - [22, 69.425]
  - - [1024, 6144, 1, 1024]
    - [61, 57.243]
  - - [1024, 12, 1, 2]
    - [9, 0.002]
  - - [512, 512, 192, 64]
    - [92, 18.164]
  - - [64, 512, 192, 512]
    - [78, 29.315]
  - - [256, 4096, 1, 1]
    - [73, 0.043]
  - - [256, 6912, 1, 1]
    - [50, 0.067]
  - - [1024, 10224, 1, 1024]
    - [56, 64.466]
  - - [1024, 10192, 1, 1024]
    - [47, 59.284]
  - - [1024, 10208, 1, 1024]
    - [56, 64.219]
  - - [1024, 10224, 1, 4096]
    - [19, 82.749]
  - - [1024, 10224, 1, 3072]
    - [19, 79.24]
  - - [4096, 10224, 1, 1024]
    - [22, 67.695]
  - - [1024, 10240, 1, 3072]
    - [62, 79.967]
  - - [1024, 10192, 1, 3072]
    - [62, 78.903]
  - - [4096, 10192, 1, 1024]
    - [22, 67.379]
  - - [1024, 10192, 1, 4096]
    - [19, 82.502]
  - - [1024, 10200, 1, 3072]
    - [62, 78.744]
  - - [1024, 10184, 1, 1024]
    - [56, 64.362]
  - - [4096, 10208, 1, 1024]
    - [70, 67.693]
  - - [1024, 10208, 1, 3072]
    - [62, 79.158]
  - - [1024, 10208, 1, 4096]
    - [19, 82.514]
  - - [1024, 10224, 1, 2048]
    - [56, 73.477]
  - - [1024, 10240, 1, 2048]
    - [59, 74.579]
  - - [1024, 10120, 1, 1024]
    - [56, 63.914]
  - - [1024, 10192, 1, 2048]
    - [59, 73.064]
  - - [64, 24, 6816, 24]
    - [43, 3.134]
  - - [1024, 10152, 1, 1024]
    - [56, 63.797]
  - - [1024, 10080, 1, 3072]
    - [59, 78.741]
  - - [64, 26, 6272, 26]
    - [28, 3.836]
  - - [100352, 512, 1, 256]
    - [129, 42.292]
  - - [12544, 2048, 1, 1024]
    - [49, 63.876]
  - - [12544, 64, 1, 147]
    - [74, 6.998]
  - - [200704, 512, 1, 256]
    - [130, 40.774]
  - - [25088, 1024, 1, 512]
    - [48, 54.065]
  - - [3136, 64, 1, 576]
    - [36, 8.14]
  - - [50176, 1024, 1, 512]
    - [130, 58.069]
  - - [6272, 2048, 1, 1024]
    - [22, 61.136]
  - - [784, 128, 1, 1152]
    - [142, 4.529]
  - - [3136, 128, 128, 256]
    - [45, 36.6]
  - - [3136, 128, 256, 256]
    - [33, 37.622]
  - - [3136, 256, 128, 64]
    - [33, 18.868]
  - - [3136, 256, 256, 64]
    - [126, 19.208]
  - - [3136, 64, 128, 256]
    - [18, 28.477]
  - - [3136, 64, 256, 256]
    - [44, 29.247]
  - - [3136, 64, 128, 64]
    - [10, 15.437]
  - - [3136, 64, 256, 64]
    - [10, 16.157]
  - - [784, 128, 128, 512]
    - [33, 40.892]
  - - [784, 128, 256, 512]
    - [45, 43.689]
  - - [784, 256, 128, 512]
    - [45, 48.271]
  - - [784, 256, 256, 512]
    - [131, 50.517]
  - - [784, 512, 128, 128]
    - [33, 30.231]
  - - [784, 512, 256, 128]
    - [33, 31.537]
  - - [128, 128, 2048, 64]
    - [33, 14.445]
  - - [64, 128, 2048, 128]
    - [43, 16.86]
  - - [1024, 2560, 1, 30528]
    - [64, 85.456]
  - - [1024, 128, 1, 1024]
    - [36, 4.8]
  - - [1024, 128, 1, 2]
    - [107, 0.014]
  - - [128, 128, 1536, 64]
    - [92, 14.199]
  - - [64, 128, 1536, 128]
    - [43, 16.452]
  - - [1024, 12288, 1, 4096]
    - [63, 87.403]
  - - [1024, 12288, 1, 1024]
    - [96, 61.382]
  - - [4096, 12288, 1, 1024]
    - [70, 70.909]
  - - [1024, 1920, 1, 30528]
    - [17, 72.347]
  - - [1024, 96, 1, 1024]
    - [120, 3.964]
  - - [1024, 96, 1, 2]
    - [149, 0.009]
  - - [128, 128, 192, 64]
    - [12, 9.373]
  - - [64, 128, 192, 128]
    - [85, 11.752]
  - - [768, 2048, 1, 2]
    - [162, 0.118]
  - - [3072, 2048, 1, 768]
    - [22, 52.044]
  - - [768, 2048, 1, 3072]
    - [117, 56.943]
  - - [768, 2048, 1, 768]
    - [18, 31.216]
  - - [384, 384, 144, 64]
    - [38, 16.271]
  - - [64, 384, 144, 384]
    - [121, 24.735]
  - - [768, 4608, 1, 2]
    - [46, 0.214]
  - - [3072, 4608, 1, 768]
    - [48, 62.717]
  - - [768, 4608, 1, 3072]
    - [58, 69.531]
  - - [768, 4608, 1, 768]
    - [44, 46.822]
  - - [512, 512, 48, 64]
    - [50, 14.705]
  - - [64, 512, 48, 512]
    - [121, 26.452]
  - - [128, 128, 256, 64]
    - [28, 10.115]
  - - [64, 128, 256, 128]
    - [43, 11.86]
  - - [384, 384, 192, 64]
    - [14, 16.57]
  - - [64, 384, 192, 384]
    - [121, 23.573]
  - - [1024, 4608, 1, 2]
    - [154, 0.269]
  - - [4096, 4608, 1, 1024]
    - [48, 63.689]
  - - [1024, 4608, 1, 4096]
    - [30, 66.126]
  - - [1024, 4608, 1, 1024]
    - [61, 52.648]
  - - [8192, 1024, 1, 1024]
    - [52, 57.063]
  - - [8192, 4096, 1, 1024]
    - [22, 66.537]
  - - [16384, 16384, 1, 16384]
    - [67, 82.827]
  - - [196, 256, 1, 2304]
    - [25, 4.806]
  - - [49, 512, 1, 4608]
    - [27, 3.392]
  - - [196, 1024, 128, 256]
    - [79, 26.247]
  - - [196, 1024, 256, 256]
    - [79, 27.146]
  - - [196, 256, 128, 1024]
    - [134, 36.681]
  - - [196, 256, 256, 1024]
    - [96, 38.988]
  - - [196, 512, 128, 1024]
    - [103, 44.873]
  - - [196, 512, 256, 1024]
    - [96, 43.433]
  - - [49, 2048, 128, 512]
    - [86, 20.469]
  - - [49, 2048, 256, 512]
    - [78, 21.032]
  - - [49, 512, 128, 2048]
    - [90, 26.341]
  - - [49, 512, 256, 2048]
    - [90, 27.013]
  - - [64, 9, 8192, 9]
    - [12, 0.518]
  - - [64, 14, 5440, 14]
    - [10, 1.122]
  - - [64, 24, 5440, 24]
    - [28, 3.232]
  - - [64, 30, 5248, 30]
    - [10, 4.79]
  - - [64, 5, 8192, 5]
    - [10, 0.172]
  - - [64, 15, 8192, 15]
    - [12, 1.42]
  - - [64, 33, 8192, 33]
    - [10, 3.382]
  - - [64, 26, 5248, 26]
    - [12, 3.702]
  - - [64, 31, 8192, 31]
    - [12, 5.18]
  - - [64, 27, 8192, 27]
    - [28, 3.961]
  - - [64, 35, 8192, 35]
    - [28, 3.861]
  - - [64, 21, 8192, 21]
    - [28, 2.587]
  - - [64, 3, 8192, 3]
    - [135, 0.07]
  - - [64, 24, 320, 34]
    - [104, 1.264]
  - - [64, 34, 5248, 34]
    - [10, 3.545]
  - - [64, 17, 8192, 17]
    - [10, 1.661]
  - - [64, 32, 5248, 32]
    - [10, 7.957]
  - - [64, 4, 3456, 4]
    - [135, 0.101]
  - - [1024, 10032, 1, 1024]
    - [56, 63.36]
  - - [1024, 10032, 1, 4096]
    - [19, 81.136]
  - - [1024, 11304, 1, 1024]
    - [38, 59.458]
  - - [1024, 1280, 1, 2048]
    - [113, 43.767]
  - - [1024, 1280, 1, 3072]
    - [113, 48.728]
  - - [1024, 13104, 1, 1024]
    - [47, 61.828]
  - - [1024, 144, 1, 2048]
    - [36, 12.463]
  - - [1024, 160, 1, 33712]
    - [100, 36.222]
  - - [1024, 1640, 1, 1024]
    - [60, 41.367]
  - - [1024, 1960, 1, 1024]
    - [114, 43.236]
  - - [1024, 1960, 1, 2048]
    - [19, 50.392]
  - - [1024, 1960, 1, 3072]
    - [114, 56.706]
  - - [1024, 1960, 1, 4096]
    - [59, 60.934]
  - - [1024, 2320, 1, 1024]
    - [29, 46.36]
  - - [1024, 2320, 1, 3072]
    - [29, 67.805]
  - - [1024, 2320, 1, 4096]
    - [29, 72.708]
  - - [1024, 256, 1, 1024]
    - [136, 12.001]
  - - [1024, 2832, 1, 1024]
    - [18, 43.226]
  - - [1024, 2832, 1, 4096]
    - [66, 57.759]
  - - [1024, 288, 1, 1024]
    - [80, 15.121]
  - - [1024, 304, 1, 1024]
    - [136, 15.48]
  - - [1024, 312, 1, 1024]
    - [136, 15.819]
  - - [1024, 3304, 1, 1024]
    - [70, 49.074]
  - - [1024, 3304, 1, 4096]
    - [68, 79.508]
  - - [1024, 3400, 1, 1024]
    - [18, 49.285]
  - - [1024, 3400, 1, 2048]
    - [58, 60.988]
  - - [1024, 3408, 1, 33712]
    - [58, 84.824]
  - - [1024, 352, 1, 1024]
    - [80, 18.319]
  - - [1024, 3520, 1, 1024]
    - [16, 49.584]
  - - [1024, 3584, 1, 4096]
    - [16, 64.519]
  - - [1024, 3696, 1, 1024]
    - [18, 47.913]
  - - [1024, 384, 1, 1024]
    - [80, 20.62]
  - - [1024, 3872, 1, 1024]
    - [44, 50.496]
  - - [1024, 3872, 1, 4096]
    - [59, 73.803]
  - - [1024, 392, 1, 1024]
    - [101, 17.026]
  - - [1024, 4176, 1, 2048]
    - [16, 60.51]
  - - [1024, 432, 1, 1024]
    - [101, 19.043]
  - - [1024, 448, 1, 1024]
    - [37, 19.107]
  - - [1024, 4480, 1, 3072]
    - [16, 60.372]
  - - [1024, 456, 1, 1024]
    - [37, 19.24]
  - - [1024, 480, 1, 1024]
    - [37, 19.897]
  - - [1024, 4896, 1, 1024]
    - [61, 55.885]
  - - [1024, 4896, 1, 3072]
    - [61, 67.361]
  - - [1024, 4896, 1, 4096]
    - [58, 79.964]
  - - [1024, 4968, 1, 1024]
    - [16, 53.746]
  - - [1024, 4968, 1, 4096]
    - [71, 79.324]
  - - [1024, 504, 1, 2048]
    - [75, 26.942]
  - - [1024, 5280, 1, 1024]
    - [61, 59.237]
  - - [1024, 5280, 1, 4096]
    - [61, 72.342]
  - - [1024, 6880, 1, 3072]
    - [16, 74.447]
  - - [1024, 6880, 1, 4096]
    - [31, 77.922]
  - - [1024, 704, 1, 1024]
    - [144, 20.977]
  - - [1024, 7040, 1, 1024]
    - [38, 59.407]
  - - [1024, 7040, 1, 4096]
    - [29, 79.795]
  - - [1024, 7144, 1, 1024]
    - [38, 54.733]
  - - [1024, 7144, 1, 4096]
    - [29, 67.276]
  - - [1024, 744, 1, 1024]
    - [57, 21.352]
  - - [1024, 7448, 1, 2048]
    - [16, 64.179]
  - - [1024, 768, 1, 1024]
    - [42, 30.966]
  - - [1024, 8192, 1, 2048]
    - [60, 63.233]
  - - [1024, 864, 1, 4096]
    - [40, 47.475]
  - - [1024, 8968, 1, 2048]
    - [16, 66.32]
  - - [1024, 8968, 1, 3072]
    - [16, 69.64]
  - - [4096, 10032, 1, 1024]
    - [70, 66.788]
  - - [4096, 1960, 1, 1024]
    - [51, 59.573]
  - - [4096, 2320, 1, 1024]
    - [53, 62.762]
  - - [4096, 2832, 1, 1024]
    - [48, 59.294]
  - - [4096, 3304, 1, 1024]
    - [54, 67.543]
  - - [4096, 3584, 1, 1024]
    - [50, 68.274]
  - - [4096, 3872, 1, 1024]
    - [53, 61.794]
  - - [4096, 4896, 1, 1024]
    - [48, 63.947]
  - - [4096, 4968, 1, 1024]
    - [48, 69.94]
  - - [4096, 5280, 1, 1024]
    - [49, 64.29]
  - - [4096, 6880, 1, 1024]
    - [22, 66.924]
  - - [4096, 7040, 1, 1024]
    - [21, 66.535]
  - - [4096, 7144, 1, 1024]
    - [48, 64.722]
  - - [4096, 864, 1, 1024]
    - [16, 49.37]
  - - [64, 10, 384, 30]
    - [107, 0.314]
  - - [64, 12, 10240, 16]
    - [12, 1.327]
  - - [64, 12, 10048, 22]
    - [12, 1.673]
  - - [64, 14, 10240, 16]
    - [10, 1.54]
  - - [64, 14, 9088, 18]
    - [12, 1.574]
  - - [64, 16, 11008, 20]
    - [12, 2.032]
  - - [64, 16, 10048, 22]
    - [12, 2.218]
  - - [64, 18, 8192, 20]
    - [12, 2.215]
  - - [64, 18, 10048, 22]
    - [28, 2.465]
  - - [64, 32, 5120, 16]
    - [28, 3.015]
  - - [64, 32, 5120, 22]
    - [10, 3.932]
  - - [64, 32, 384, 26]
    - [12, 1.486]
  - - [64, 32, 384, 28]
    - [104, 1.56]
  - - [64, 32, 384, 30]
    - [12, 1.726]
  - - [64, 34, 320, 26]
    - [12, 1.152]
  - - [64, 34, 320, 28]
    - [12, 1.248]
  - - [64, 34, 320, 32]
    - [10, 0.978]
  - - [64, 36, 320, 30]
    - [12, 1.416]
  - - [64, 36, 320, 32]
    - [41, 1.912]
  - - [2944, 4288, 1, 1280]
    - [22, 69.228]
  - - [2368, 64, 1, 3328]
    - [35, 15.399]
  - - [2368, 5888, 1, 256]
    - [50, 40.134]
  - - [256, 704, 1, 1280]
    - [36, 11.76]
  - - [128, 6784, 1, 3328]
    - [58, 40.363]
  - - [5888, 1856, 1, 3328]
    - [61, 66.865]
  - - [5888, 2944, 1, 3328]
    - [61, 81.788]
  - - [1856, 4288, 1, 256]
    - [47, 34.312]
  - - [5056, 5056, 1, 3328]
    - [70, 71.997]
  - - [1408, 5888, 1, 1280]
    - [21, 57.149]
  - - [448, 3584, 1, 3328]
    - [75, 55.899]
  - - [256, 4288, 1, 3328]
    - [111, 49.53]
  - - [5888, 1408, 1, 1280]
    - [113, 65.895]
  - - [704, 1856, 1, 3328]
    - [113, 47.937]
  - - [1024, 2368, 1, 256]
    - [16, 22.93]
  - - [5056, 6784, 1, 1280]
    - [70, 77.357]
  - - [1408, 64, 1, 1280]
    - [15, 7.025]
  - - [448, 1024, 1, 1280]
    - [57, 15.651]
  - - [5056, 5056, 1, 1280]
    - [48, 66.078]
  - - [4288, 6784, 1, 256]
    - [47, 44.964]
  - - [6784, 448, 1, 256]
    - [44, 24.282]
  - - [5056, 256, 1, 1280]
    - [42, 34.3]
  - - [5888, 704, 1, 1280]
    - [44, 51.936]
  - - [3584, 1024, 1, 256]
    - [38, 27.71]
  - - [6784, 4288, 1, 3328]
    - [61, 72.87]
  - - [1856, 2368, 1, 3328]
    - [141, 58.791]
  - - [5888, 2944, 1, 1280]
    - [48, 72.796]
  - - [5888, 1024, 1, 256]
    - [51, 30.388]
  - - [448, 64, 1, 1280]
    - [15, 2.349]
  - - [1408, 2944, 1, 256]
    - [44, 26.746]
  - - [256, 1856, 1, 1280]
    - [42, 17.217]
  - - [6784, 5056, 1, 3328]
    - [22, 76.248]
  - - [5056, 5056, 1, 256]
    - [56, 44.176]
  - - [256, 2944, 1, 3328]
    - [110, 47.334]
  - - [64, 1024, 1, 1280]
    - [142, 5.137]
  - - [2368, 2944, 1, 1280]
    - [16, 62.892]
  - - [128, 3584, 1, 1280]
    - [144, 20.674]
  - - [6784, 6784, 1, 1280]
    - [48, 68.685]
  - - [1408, 4288, 1, 1280]
    - [61, 59.958]
  - - [3584, 4288, 1, 1280]
    - [21, 64.803]
  - - [2368, 704, 1, 1280]
    - [40, 37.132]
  - - [5056, 4288, 1, 3328]
    - [70, 83.256]
  - - [3584, 2368, 1, 3328]
    - [61, 78.467]
  - - [5888, 6784, 1, 1280]
    - [21, 69.169]
  - - [64, 704, 1, 1280]
    - [15, 3.61]
  - - [4288, 256, 1, 256]
    - [98, 15.222]
  - - [6784, 448, 1, 1280]
    - [18, 47.383]
  - - [2944, 5888, 1, 256]
    - [47, 41.422]
  - - [256, 128, 1, 256]
    - [15, 0.788]
  - - [4288, 2944, 1, 256]
    - [50, 39.277]
  - - [5888, 64, 1, 3328]
    - [80, 32.707]
  - - [2944, 256, 1, 3328]
    - [144, 47.335]
  - - [5056, 2368, 1, 1280]
    - [126, 61.554]
  - - [448, 3584, 1, 1280]
    - [42, 42.448]
  - - [6784, 5888, 1, 256]
    - [21, 45.918]
  - - [64, 1024, 1, 3328]
    - [145, 8.004]
  - - [704, 128, 1, 1280]
    - [15, 7.101]
  - - [1408, 448, 1, 1280]
    - [42, 21.424]
  - - [1024, 1408, 1, 256]
    - [146, 19.708]
  - - [2368, 2368, 1, 3328]
    - [16, 60.608]
  - - [5056, 704, 1, 3328]
    - [114, 64.391]
  - - [1408, 1856, 1, 256]
    - [146, 17.621]
  - - [1408, 256, 1, 1280]
    - [80, 21.131]
  - - [5888, 1856, 1, 256]
    - [53, 37.257]
  - - [704, 5888, 1, 256]
    - [53, 24.066]
  - - [6784, 64, 1, 256]
    - [74, 4.359]
  - - [3584, 704, 1, 3328]
    - [102, 63.264]
  - - [1408, 1408, 1, 256]
    - [44, 14.62]
  - - [448, 4288, 1, 256]
    - [16, 20.147]
  - - [64, 3584, 1, 3328]
    - [80, 20.526]
  - - [704, 2368, 1, 1280]
    - [101, 37.021]
  - - [1856, 2368, 1, 1280]
    - [16, 51.488]
  - - [2368, 128, 1, 3328]
    - [97, 27.124]
  - - [1408, 1408, 1, 3328]
    - [17, 57.846]
  - - [2944, 128, 1, 256]
    - [35, 7.444]
  - - [448, 1408, 1, 256]
    - [37, 11.515]
  - - [64, 5056, 1, 3328]
    - [80, 27.388]
  - - [1408, 1024, 1, 1280]
    - [44, 41.173]
  - - [704, 6784, 1, 256]
    - [50, 31.165]
  - - [6784, 704, 1, 256]
    - [44, 25.616]
  - - [256, 3584, 1, 3328]
    - [111, 41.598]
  - - [5056, 704, 1, 256]
    - [132, 22.68]
  - - [1408, 3584, 1, 256]
    - [45, 31.1]
  - - [3584, 4288, 1, 3328]
    - [22, 80.425]
  - - [5888, 1856, 1, 1280]
    - [48, 59.381]
  - - [256, 1408, 1, 256]
    - [35, 7.121]
  - - [5056, 64, 1, 1280]
    - [97, 18.741]
  - - [2368, 128, 1, 256]
    - [39, 3.528]
  - - [2368, 3584, 1, 1280]
    - [18, 61.208]
  - - [448, 448, 1, 256]
    - [36, 2.376]
  - - [2944, 3584, 1, 3328]
    - [61, 78.85]
  - - [256, 256, 1, 3328]
    - [15, 8.191]
  - - [128, 1024, 1, 3328]
    - [35, 13.283]
  - - [6784, 2944, 1, 256]
    - [50, 42.45]
  - - [64, 1856, 1, 1280]
    - [36, 7.931]
  - - [448, 256, 1, 256]
    - [148, 2.544]
  - - [1856, 2368, 1, 256]
    - [47, 28.55]
  - - [3584, 6784, 1, 3328]
    - [22, 76.481]
  - - [4288, 128, 1, 1280]
    - [42, 19.11]
  - - [5056, 4288, 1, 1280]
    - [21, 65.835]
  - - [5888, 64, 1, 256]
    - [39, 3.918]
  - - [6784, 1856, 1, 3328]
    - [160, 78.889]
  - - [1408, 5056, 1, 1280]
    - [16, 62.204]
  - - [1856, 256, 1, 1280]
    - [37, 22.319]
  - - [64, 5888, 1, 3328]
    - [136, 29.872]
  - - [6784, 5888, 1, 3328]
    - [22, 74.803]
  - - [448, 256, 1, 3328]
    - [36, 11.685]
  - - [2368, 5056, 1, 1280]
    - [16, 69.028]
  - - [256, 1408, 1, 3328]
    - [80, 32.178]
  - - [6784, 128, 1, 3328]
    - [140, 34.869]
  - - [1024, 5056, 1, 1280]
    - [16, 58.24]
  - - [4288, 1024, 1, 256]
    - [51, 28.018]
  - - [2368, 1408, 1, 256]
    - [98, 25.851]
  - - [704, 704, 1, 3328]
    - [42, 31.338]
  - - [5888, 448, 1, 1280]
    - [163, 45.988]
  - - [3584, 256, 1, 3328]
    - [111, 41.649]
  - - [704, 5888, 1, 3328]
    - [57, 60.998]
  - - [1024, 6784, 1, 1280]
    - [61, 60.161]
  - - [128, 3584, 1, 3328]
    - [116, 29.966]
  - - [128, 704, 1, 1280]
    - [11, 6.949]
  - - [3584, 2944, 1, 1280]
    - [16, 62.158]
  - - [1856, 128, 1, 3328]
    - [80, 21.886]
  - - [128, 2944, 1, 1280]
    - [80, 21.913]
  - - [448, 1856, 1, 1280]
    - [37, 34.358]
  - - [1408, 5056, 1, 3328]
    - [31, 75.935]
  - - [1856, 1856, 1, 3328]
    - [155, 68.168]
  - - [3584, 128, 1, 256]
    - [37, 8.167]
  - - [448, 1408, 1, 3328]
    - [144, 40.223]
  - - [2368, 2368, 1, 256]
    - [53, 28.982]
  - - [4288, 4288, 1, 1280]
    - [38, 64.863]
  - - [64, 448, 1, 1280]
    - [8, 1.435]
  - - [5888, 1024, 1, 1280]
    - [22, 57.544]
  - - [704, 1024, 1, 256]
    - [37, 12.756]
  - - [704, 6784, 1, 3328]
    - [42, 69.598]
  - - [5888, 5888, 1, 3328]
    - [103, 77.476]
  - - [5056, 1024, 1, 1280]
    - [16, 56.649]
  - - [448, 5888, 1, 3328]
    - [60, 59.679]
  - - [1024, 2944, 1, 1280]
    - [44, 47.102]
  - - [5056, 5888, 1, 1280]
    - [70, 68.8]
  - - [448, 6784, 1, 256]
    - [98, 20.616]
  - - [256, 3584, 1, 256]
    - [44, 13.101]
  - - [256, 448, 1, 256]
    - [149, 2.506]
  - - [3584, 5888, 1, 256]
    - [46, 42.297]
  - - [2944, 3584, 1, 256]
    - [48, 38.04]
  - - [1408, 704, 1, 256]
    - [146, 13.878]
  - - [6784, 1024, 1, 3328]
    - [61, 73.651]
  - - [6784, 2944, 1, 3328]
    - [113, 83.28]
  - - [64, 64, 1, 3328]
    - [94, 0.531]
  - - [6784, 2368, 1, 1280]
    - [38, 71.905]
  - - [4288, 3584, 1, 256]
    - [47, 40.928]
  - - [4288, 5888, 1, 1280]
    - [70, 65.996]
  - - [448, 2944, 1, 3328]
    - [117, 47.053]
  - - [4288, 1856, 1, 1280]
    - [44, 56.902]
  - - [1856, 2944, 1, 3328]
    - [16, 59.47]
  - - [256, 6784, 1, 3328]
    - [62, 56.446]
  - - [64, 5888, 1, 256]
    - [125, 7.394]
  - - [5056, 1024, 1, 256]
    - [47, 32.252]
  - - [704, 64, 1, 3328]
    - [15, 5.766]
  - - [5056, 1856, 1, 3328]
    - [163, 78.021]
  - - [448, 448, 1, 3328]
    - [36, 19.908]
  - - [448, 2368, 1, 1280]
    - [58, 31.338]
  - - [1408, 128, 1, 1280]
    - [35, 11.707]
  - - [5056, 256, 1, 3328]
    - [113, 49.696]
  - - [704, 704, 1, 256]
    - [37, 9.163]
  - - [1024, 5888, 1, 1280]
    - [70, 57.355]
  - - [128, 1856, 1, 1280]
    - [97, 13.984]
  - - [5056, 3584, 1, 256]
    - [47, 42.251]
  - - [1856, 1024, 1, 1280]
    - [16, 40.484]
  - - [1856, 1856, 1, 1280]
    - [155, 51.158]
  - - [128, 4288, 1, 3328]
    - [42, 34.646]
  - - [1856, 1024, 1, 3328]
    - [124, 58.089]
  - - [256, 2368, 1, 256]
    - [37, 10.793]
  - - [1856, 704, 1, 1280]
    - [44, 37.686]
  - - [6784, 1024, 1, 256]
    - [14, 31.937]
  - - [5056, 5888, 1, 3328]
    - [70, 74.818]
  - - [1856, 1024, 1, 256]
    - [16, 19.302]
  - - [5056, 1408, 1, 3328]
    - [157, 75.994]
  - - [448, 5888, 1, 256]
    - [85, 18.125]
  - - [1408, 6784, 1, 3328]
    - [22, 68.69]
  - - [2944, 1408, 1, 3328]
    - [19, 63.231]
  - - [2944, 4288, 1, 3328]
    - [70, 81.729]
  - - [256, 2944, 1, 256]
    - [37, 13.095]
  - - [5056, 2944, 1, 256]
    - [50, 40.085]
  - - [2368, 1856, 1, 256]
    - [47, 28.615]
  - - [128, 6784, 1, 1280]
    - [58, 25.823]
  - - [1408, 3584, 1, 3328]
    - [117, 66.647]
  - - [2368, 6784, 1, 256]
    - [54, 40.823]
  - - [4288, 2368, 1, 3328]
    - [61, 68.525]
  - - [704, 3584, 1, 1280]
    - [57, 46.412]
  - - [1408, 5888, 1, 3328]
    - [117, 67.56]
  - - [1856, 5056, 1, 256]
    - [50, 35.566]
  - - [6784, 6784, 1, 256]
    - [47, 46.219]
  - - [1408, 704, 1, 3328]
    - [58, 46.671]
  - - [128, 5888, 1, 1280]
    - [42, 32.252]
  - - [2368, 4288, 1, 1280]
    - [50, 64.137]
  - - [3584, 1856, 1, 1280]
    - [77, 62.138]
  - - [704, 1408, 1, 3328]
    - [58, 47.007]
  - - [704, 64, 1, 1280]
    - [15, 3.63]
  - - [3584, 448, 1, 256]
    - [146, 21.54]
  - - [3584, 3584, 1, 1280]
    - [103, 63.766]
  - - [256, 6784, 1, 256]
    - [44, 22.769]
  - - [1856, 3584, 1, 3328]
    - [42, 73.959]
  - - [128, 448, 1, 256]
    - [15, 1.367]
  - - [3584, 3584, 1, 256]
    - [46, 38.794]
  - - [6784, 4288, 1, 1280]
    - [48, 67.423]
  - - [448, 704, 1, 1280]
    - [80, 18.34]
  - - [3584, 5056, 1, 256]
    - [54, 41.348]
  - - [6784, 128, 1, 256]
    - [37, 14.312]
  - - [64, 1408, 1, 3328]
    - [15, 10.829]
  - - [704, 448, 1, 256]
    - [39, 3.427]
  - - [2944, 2368, 1, 1280]
    - [16, 61.897]
  - - [448, 64, 1, 3328]
    - [94, 3.657]
  - - [6784, 3584, 1, 256]
    - [46, 42.891]
  - - [256, 1856, 1, 3328]
    - [110, 30.298]
  - - [256, 704, 1, 256]
    - [149, 3.879]
  - - [128, 1408, 1, 256]
    - [107, 3.908]
  - - [1856, 1408, 1, 256]
    - [132, 18.216]
  - - [2944, 2944, 1, 3328]
    - [58, 78.837]
  - - [5056, 6784, 1, 256]
    - [56, 46.164]
  - - [1408, 4288, 1, 3328]
    - [16, 64.92]
  - - [6784, 256, 1, 1280]
    - [44, 48.072]
  - - [2368, 704, 1, 3328]
    - [62, 53.73]
  - - [128, 4288, 1, 256]
    - [37, 9.423]
  - - [3584, 6784, 1, 256]
    - [14, 43.422]
  - - [5056, 1856, 1, 256]
    - [46, 36.33]
  - - [704, 4288, 1, 256]
    - [85, 23.855]
  - - [256, 448, 1, 3328]
    - [39, 11.622]
  - - [1408, 6784, 1, 1280]
    - [22, 58.968]
  - - [64, 2368, 1, 1280]
    - [36, 10.213]
  - - [64, 6784, 1, 3328]
    - [75, 26.094]
  - - [2944, 256, 1, 1280]
    - [75, 32.836]
  - - [5056, 2368, 1, 3328]
    - [20, 79.515]
  - - [2944, 4288, 1, 256]
    - [50, 38.57]
  - - [1408, 3584, 1, 1280]
    - [113, 62.378]
  - - [2368, 64, 1, 256]
    - [13, 3.337]
  - - [256, 256, 1, 256]
    - [153, 1.616]
  - - [704, 128, 1, 3328]
    - [15, 11.042]
  - - [1856, 704, 1, 256]
    - [44, 17.13]
  - - [2368, 6784, 1, 3328]
    - [22, 71.427]
  - - [5056, 704, 1, 1280]
    - [44, 53.359]
  - - [1856, 4288, 1, 3328]
    - [117, 76.06]
  - - [1408, 5888, 1, 256]
    - [45, 33.583]
  - - [704, 2944, 1, 1280]
    - [16, 43.38]
  - - [4288, 64, 1, 1280]
    - [80, 16.287]
  - - [704, 1856, 1, 256]
    - [44, 16.976]
  - - [3584, 704, 1, 1280]
    - [44, 49.104]
  - - [5888, 5056, 1, 256]
    - [49, 44.305]
  - - [3584, 448, 1, 3328]
    - [18, 55.08]
  - - [704, 2368, 1, 3328]
    - [112, 53.856]
  - - [2944, 448, 1, 256]
    - [146, 18.029]
  - - [448, 5056, 1, 3328]
    - [75, 60.222]
  - - [2368, 128, 1, 1280]
    - [80, 17.841]
  - - [4288, 448, 1, 256]
    - [16, 19.718]
  - - [64, 6784, 1, 256]
    - [125, 8.461]
  - - [64, 5056, 1, 1280]
    - [80, 17.948]
  - - [5888, 2368, 1, 256]
    - [14, 39.043]
  - - [704, 448, 1, 3328]
    - [80, 28.157]
  - - [6784, 704, 1, 3328]
    - [18, 68.39]
  - - [128, 64, 1, 1280]
    - [8, 0.664]
  - - [2368, 256, 1, 1280]
    - [75, 26.735]
  - - [1408, 2944, 1, 3328]
    - [77, 70.427]
  - - [64, 1024, 1, 256]
    - [11, 1.588]
  - - [2368, 448, 1, 1280]
    - [16, 32.62]
  - - [128, 3584, 1, 256]
    - [37, 8.375]
  - - [1856, 448, 1, 3328]
    - [80, 42.904]
  - - [128, 5056, 1, 256]
    - [37, 11.313]
  - - [4288, 4288, 1, 256]
    - [47, 42.596]
  - - [2368, 704, 1, 256]
    - [44, 21.659]
  - - [3584, 2368, 1, 256]
    - [48, 34.623]
  - - [5888, 5056, 1, 1280]
    - [48, 66.892]
  - - [128, 1024, 1, 1280]
    - [35, 8.711]
  - - [64, 704, 1, 256]
    - [15, 1.074]
  - - [4288, 256, 1, 1280]
    - [58, 31.555]
  - - [3584, 3584, 1, 3328]
    - [70, 71.32]
  - - [128, 1024, 1, 256]
    - [13, 2.8]
  - - [5888, 6784, 1, 256]
    - [21, 45.955]
  - - [4288, 2944, 1, 3328]
    - [70, 69.844]
  - - [1856, 64, 1, 256]
    - [13, 2.635]
  - - [4288, 128, 1, 3328]
    - [42, 34.999]
  - - [256, 5056, 1, 1280]
    - [44, 33.916]
  - - [6784, 5888, 1, 1280]
    - [164, 81.818]
  - - [704, 128, 1, 256]
    - [11, 2.13]
  - - [5888, 4288, 1, 1280]
    - [48, 66.795]
  - - [448, 256, 1, 1280]
    - [36, 7.765]
  - - [448, 2368, 1, 3328]
    - [58, 46.742]
  - - [256, 1408, 1, 1280]
    - [80, 21.131]
  - - [1408, 1856, 1, 1280]
    - [66, 45.306]
  - - [5888, 448, 1, 3328]
    - [137, 59.688]
  - - [704, 5888, 1, 1280]
    - [42, 48.918]
  - - [256, 64, 1, 3328]
    - [15, 2.097]
  - - [128, 2368, 1, 256]
    - [36, 3.532]
  - - [6784, 64, 1, 3328]
    - [102, 24.28]
  - - [5056, 2944, 1, 3328]
    - [117, 80.15]
  - - [448, 128, 1, 256]
    - [15, 1.39]
  - - [1856, 128, 1, 1280]
    - [80, 14.041]
  - - [448, 4288, 1, 1280]
    - [124, 41.042]
  - - [64, 3584, 1, 256]
    - [13, 4.829]
  - - [128, 2944, 1, 3328]
    - [80, 33.482]
  - - [3584, 704, 1, 256]
    - [44, 20.674]
  - - [2944, 448, 1, 3328]
    - [60, 48.012]
  - - [3584, 1408, 1, 3328]
    - [117, 66.741]
  - - [2368, 1024, 1, 1280]
    - [180, 48.351]
  - - [2944, 6784, 1, 1280]
    - [56, 66.257]
  - - [1856, 6784, 1, 256]
    - [50, 39.603]
  - - [4288, 448, 1, 3328]
    - [19, 55.492]
  - - [6784, 704, 1, 1280]
    - [146, 55.393]
  - - [5888, 1024, 1, 3328]
    - [70, 66.025]
  - - [704, 6784, 1, 1280]
    - [57, 54.674]
  - - [5888, 128, 1, 256]
    - [37, 7.379]
  - - [5056, 1024, 1, 3328]
    - [61, 65.858]
  - - [704, 5056, 1, 1280]
    - [44, 49.115]
  - - [64, 704, 1, 3328]
    - [145, 5.746]
  - - [2944, 1856, 1, 256]
    - [154, 29.512]
  - - [5056, 64, 1, 256]
    - [181, 3.652]
  - - [5888, 5056, 1, 3328]
    - [22, 73.629]
  - - [128, 5056, 1, 3328]
    - [42, 40.376]
  - - [3584, 6784, 1, 1280]
    - [22, 68.336]
  - - [1856, 5888, 1, 256]
    - [47, 37.793]
  - - [64, 448, 1, 3328]
    - [142, 3.669]
  - - [4288, 4288, 1, 3328]
    - [61, 71.852]
  - - [4288, 1408, 1, 1280]
    - [21, 55.849]
  - - [64, 1856, 1, 256]
    - [8, 2.677]
  - - [4288, 2368, 1, 256]
    - [50, 37.595]
  - - [2944, 5056, 1, 1280]
    - [48, 62.894]
  - - [256, 4288, 1, 1280]
    - [58, 33.754]
  - - [6784, 2368, 1, 3328]
    - [61, 82.113]
  - - [4288, 128, 1, 256]
    - [37, 10.28]
  - - [4288, 1856, 1, 3328]
    - [113, 77.324]
  - - [1856, 2944, 1, 1280]
    - [16, 52.219]
  - - [3584, 64, 1, 1280]
    - [80, 13.502]
  - - [4288, 6784, 1, 3328]
    - [61, 73.124]
  - - [3584, 1024, 1, 1280]
    - [16, 52.61]
  - - [1024, 4288, 1, 256]
    - [38, 28.206]
  - - [5888, 3584, 1, 3328]
    - [70, 77.634]
  - - [5056, 3584, 1, 3328]
    - [61, 71.618]
  - - [1408, 128, 1, 3328]
    - [36, 17.552]
  - - [2368, 1408, 1, 1280]
    - [57, 52.407]
  - - [5056, 2944, 1, 1280]
    - [162, 69.757]
  - - [3584, 256, 1, 256]
    - [77, 12.542]
  - - [1024, 6784, 1, 256]
    - [38, 31.6]
  - - [2944, 5056, 1, 3328]
    - [61, 83.79]
  - - [3584, 2944, 1, 256]
    - [46, 37.711]
  - - [448, 128, 1, 3328]
    - [165, 5.432]
  - - [64, 2944, 1, 3328]
    - [35, 18.446]
  - - [64, 4288, 1, 3328]
    - [80, 23.386]
  - - [5056, 6784, 1, 3328]
    - [70, 76.983]
  - - [128, 2944, 1, 256]
    - [125, 7.444]
  - - [3584, 4288, 1, 256]
    - [50, 40.077]
  - - [1856, 6784, 1, 3328]
    - [22, 70.128]
  - - [3584, 128, 1, 3328]
    - [42, 30.019]
  - - [128, 256, 1, 1280]
    - [15, 2.596]
  - - [64, 448, 1, 256]
    - [153, 0.701]
  - - [64, 256, 1, 1280]
    - [94, 1.358]
  - - [5056, 1408, 1, 1280]
    - [61, 61.311]
  - - [5888, 5888, 1, 256]
    - [46, 45.184]
  - - [4288, 1024, 1, 1280]
    - [44, 53.708]
  - - [5888, 128, 1, 3328]
    - [110, 47.098]
  - - [448, 6784, 1, 3328]
    - [57, 63.432]
  - - [2944, 1408, 1, 1280]
    - [44, 52.117]
  - - [2944, 1856, 1, 3328]
    - [61, 59.696]
  - - [448, 5056, 1, 256]
    - [74, 15.575]
  - - [64, 64, 1, 256]
    - [8, 0.099]
  - - [3584, 5888, 1, 1280]
    - [22, 70.429]
  - - [6784, 1856, 1, 1280]
    - [49, 62.678]
  - - [5888, 256, 1, 3328]
    - [66, 56.292]
  - - [1856, 5888, 1, 3328]
    - [117, 77.312]
  - - [3584, 1408, 1, 256]
    - [96, 28.686]
  - - [704, 3584, 1, 3328]
    - [42, 59.763]
  - - [5056, 448, 1, 1280]
    - [16, 46.933]
  - - [3584, 1856, 1, 3328]
    - [44, 74.055]
  - - [1408, 704, 1, 1280]
    - [58, 31.015]
  - - [2944, 1024, 1, 256]
    - [143, 24.22]
  - - [448, 1408, 1, 1280]
    - [75, 27.99]
  - - [2368, 4288, 1, 3328]
    - [112, 75.939]
  - - [1024, 1408, 1, 1280]
    - [44, 41.173]
  - - [256, 128, 1, 1280]
    - [15, 2.64]
  - - [704, 1408, 1, 1280]
    - [58, 29.478]
  - - [6784, 5056, 1, 256]
    - [49, 45.214]
  - - [4288, 5888, 1, 256]
    - [50, 43.868]
  - - [448, 2944, 1, 256]
    - [156, 17.611]
  - - [2944, 6784, 1, 256]
    - [50, 42.356]
  - - [2368, 2368, 1, 1280]
    - [16, 53.589]
  - - [1856, 3584, 1, 1280]
    - [16, 59.588]
  - - [64, 2944, 1, 256]
    - [13, 3.996]
  - - [3584, 1408, 1, 1280]
    - [117, 61.922]
  - - [5056, 3584, 1, 1280]
    - [48, 64.428]
  - - [256, 5888, 1, 256]
    - [146, 19.942]
  - - [128, 256, 1, 3328]
    - [15, 4.151]
  - - [1856, 1408, 1, 3328]
    - [133, 57.804]
  - - [1024, 4288, 1, 3328]
    - [31, 68.475]
  - - [448, 2368, 1, 256]
    - [44, 14.232]
  - - [64, 1408, 1, 1280]
    - [15, 6.876]
  - - [64, 6784, 1, 1280]
    - [180, 15.055]
  - - [2944, 2368, 1, 3328]
    - [61, 75.142]
  - - [704, 4288, 1, 3328]
    - [66, 57.31]
  - - [1024, 1856, 1, 1280]
    - [19, 40.665]
  - - [6784, 1856, 1, 256]
    - [53, 38.924]
  - - [128, 2368, 1, 3328]
    - [80, 27.124]
  - - [1024, 5888, 1, 256]
    - [14, 29.353]
  - - [64, 2944, 1, 1280]
    - [39, 12.407]
  - - [5056, 64, 1, 3328]
    - [80, 28.819]
  - - [1408, 2368, 1, 256]
    - [44, 25.991]
  - - [2944, 704, 1, 3328]
    - [16, 53.263]
  - - [256, 64, 1, 256]
    - [153, 0.185]
  - - [2944, 2944, 1, 1280]
    - [16, 67.242]
  - - [6784, 256, 1, 3328]
    - [124, 50.633]
  - - [1408, 5056, 1, 256]
    - [48, 33.224]
  - - [5056, 128, 1, 3328]
    - [110, 40.714]
  - - [448, 704, 1, 256]
    - [39, 3.575]
  - - [1856, 256, 1, 3328]
    - [75, 30.929]
  - - [2944, 128, 1, 3328]
    - [80, 33.965]
  - - [704, 256, 1, 256]
    - [13, 3.879]
  - - [256, 448, 1, 1280]
    - [36, 7.802]
  - - [704, 256, 1, 1280]
    - [36, 11.814]
  - - [64, 2368, 1, 3328]
    - [36, 14.954]
  - - [256, 704, 1, 3328]
    - [39, 17.598]
  - - [1408, 4288, 1, 256]
    - [161, 30.799]
  - - [5888, 2368, 1, 1280]
    - [126, 62.659]
  - - [128, 256, 1, 256]
    - [15, 0.788]
  - - [256, 64, 1, 1280]
    - [15, 1.358]
  - - [2368, 5888, 1, 1280]
    - [70, 66.624]
  - - [5888, 256, 1, 1280]
    - [44, 42.706]
  - - [704, 1024, 1, 1280]
    - [42, 31.314]
  - - [2368, 1856, 1, 3328]
    - [61, 59.128]
  - - [2944, 704, 1, 256]
    - [44, 15.65]
  - - [2368, 6784, 1, 1280]
    - [70, 64.658]
  - - [2368, 1024, 1, 3328]
    - [157, 70.442]
  - - [1856, 4288, 1, 1280]
    - [56, 56.068]
  - - [704, 3584, 1, 256]
    - [101, 17.753]
  - - [704, 2944, 1, 3328]
    - [16, 52.901]
  - - [1856, 5056, 1, 3328]
    - [70, 68.507]
  - - [3584, 5056, 1, 1280]
    - [48, 64.54]
  - - [2944, 1024, 1, 3328]
    - [133, 59.997]
  - - [256, 4288, 1, 256]
    - [44, 15.222]
  - - [2368, 256, 1, 256]
    - [37, 10.997]
  - - [1408, 6784, 1, 256]
    - [38, 35.872]
  - - [6784, 1408, 1, 3328]
    - [163, 78.491]
  - - [1024, 2368, 1, 1280]
    - [29, 51.695]
  - - [704, 64, 1, 256]
    - [15, 1.065]
  - - [256, 2368, 1, 3328]
    - [144, 38.073]
  - - [6784, 2944, 1, 1280]
    - [95, 72.783]
  - - [3584, 448, 1, 1280]
    - [44, 45.313]
  - - [2944, 6784, 1, 3328]
    - [61, 83.63]
  - - [448, 5056, 1, 1280]
    - [75, 43.424]
  - - [4288, 5056, 1, 1280]
    - [56, 65.601]
  - - [128, 448, 1, 1280]
    - [15, 4.519]
  - - [4288, 704, 1, 256]
    - [44, 23.985]
  - - [64, 64, 1, 1280]
    - [8, 0.202]
  - - [5888, 704, 1, 256]
    - [48, 26.927]
  - - [256, 5888, 1, 3328]
    - [113, 55.409]
  - - [6784, 4288, 1, 256]
    - [14, 44.322]
  - - [5888, 256, 1, 256]
    - [146, 20.127]
  - - [6784, 1024, 1, 1280]
    - [51, 61.609]
  - - [704, 448, 1, 1280]
    - [80, 18.565]
  - - [128, 64, 1, 3328]
    - [94, 1.038]
  - - [448, 64, 1, 256]
    - [8, 0.701]
  - - [2944, 704, 1, 1280]
    - [16, 43.13]
  - - [6784, 3584, 1, 1280]
    - [22, 69.987]
  - - [2944, 64, 1, 1280]
    - [36, 12.295]
  - - [1408, 2944, 1, 1280]
    - [44, 52.621]
  - - [256, 1856, 1, 256]
    - [159, 8.459]
  - - [1408, 2368, 1, 3328]
    - [58, 65.842]
  - - [128, 1408, 1, 3328]
    - [35, 17.877]
  - - [2368, 2944, 1, 256]
    - [50, 32.908]
  - - [64, 5056, 1, 256]
    - [36, 3.708]
  - - [1408, 256, 1, 3328]
    - [80, 32.102]
  - - [3584, 1856, 1, 256]
    - [47, 31.504]
  - - [4288, 3584, 1, 1280]
    - [48, 62.944]
  - - [2368, 448, 1, 256]
    - [123, 14.298]
  - - [4288, 256, 1, 3328]
    - [111, 48.594]
  - - [1408, 64, 1, 256]
    - [15, 2.113]
  - - [4288, 2944, 1, 1280]
    - [70, 70.617]
  - - [5056, 448, 1, 3328]
    - [16, 56.507]
  - - [64, 2368, 1, 256]
    - [149, 3.238]
  - - [4288, 5056, 1, 3328]
    - [70, 83.465]
  - - [2944, 256, 1, 256]
    - [37, 13.586]
  - - [256, 5056, 1, 3328]
    - [137, 50.617]
  - - [5056, 2368, 1, 256]
    - [50, 38.157]
  - - [4288, 704, 1, 3328]
    - [70, 57.867]
  - - [448, 3584, 1, 256]
    - [156, 20.955]
  - - [2368, 64, 1, 1280]
    - [36, 10.261]
  - - [1024, 1408, 1, 3328]
    - [66, 54.06]
  - - [2944, 5888, 1, 1280]
    - [16, 72.619]
  - - [5888, 3584, 1, 256]
    - [47, 42.682]
  - - [1408, 1856, 1, 3328]
    - [113, 58.309]
  - - [6784, 1408, 1, 1280]
    - [16, 65.112]
  - - [704, 2944, 1, 256]
    - [16, 21.349]
  - - [4288, 64, 1, 256]
    - [13, 6.089]
  - - [2944, 5888, 1, 3328]
    - [61, 83.306]
  - - [64, 4288, 1, 1280]
    - [80, 16.088]
  - - [6784, 64, 1, 1280]
    - [37, 14.565]
  - - [704, 1856, 1, 1280]
    - [18, 37.387]
  - - [1408, 64, 1, 3328]
    - [15, 11.042]
  - - [1408, 1408, 1, 1280]
    - [62, 41.676]
  - - [448, 1024, 1, 3328]
    - [42, 29.708]
  - - [448, 4288, 1, 3328]
    - [112, 59.429]
  - - [704, 2368, 1, 256]
    - [37, 13.144]
  - - [2944, 448, 1, 1280]
    - [18, 38.193]
  - - [5888, 2368, 1, 3328]
    - [19, 78.847]
  - - [4288, 5056, 1, 256]
    - [56, 43.758]
  - - [4288, 448, 1, 1280]
    - [16, 40.443]
  - - [5888, 704, 1, 3328]
    - [18, 60.032]
  - - [4288, 3584, 1, 3328]
    - [70, 81.04]
  - - [2944, 64, 1, 256]
    - [13, 2.142]
  - - [1024, 6784, 1, 3328]
    - [31, 74.018]
  - - [1408, 1024, 1, 256]
    - [44, 19.615]
  - - [448, 1024, 1, 256]
    - [37, 8.218]
  - - [6784, 6784, 1, 3328]
    - [70, 74.198]
  - - [704, 5056, 1, 3328]
    - [62, 63.758]
  - - [256, 2368, 1, 1280]
    - [75, 21.687]
  - - [3584, 5056, 1, 3328]
    - [61, 71.482]
  - - [2368, 2944, 1, 3328]
    - [157, 74.452]
  - - [448, 448, 1, 1280]
    - [36, 13.277]
  - - [2368, 3584, 1, 256]
    - [50, 35.631]
  - - [128, 5056, 1, 1280]
    - [42, 26.666]
  - - [3584, 2368, 1, 1280]
    - [16, 65.005]
  - - [1856, 1856, 1, 256]
    - [47, 26.708]
  - - [4288, 1408, 1, 3328]
    - [150, 64.476]
  - - [3584, 64, 1, 3328]
    - [80, 20.926]
  - - [1856, 64, 1, 3328]
    - [128, 10.727]
  - - [5888, 1408, 1, 3328]
    - [113, 67.094]
  - - [256, 5056, 1, 256]
    - [77, 17.364]
  - - [1856, 64, 1, 1280]
    - [36, 7.968]
  - - [1408, 256, 1, 256]
    - [36, 7.072]
  - - [2368, 5056, 1, 256]
    - [46, 38.369]
  - - [128, 5888, 1, 3328]
    - [42, 47.255]
  - - [1024, 5056, 1, 256]
    - [46, 31.174]
  - - [2368, 1408, 1, 3328]
    - [90, 69.484]
  - - [5888, 448, 1, 256]
    - [44, 21.492]
  - - [6784, 5056, 1, 1280]
    - [150, 69.027]
  - - [4288, 6784, 1, 1280]
    - [70, 66.737]
  - - [2368, 448, 1, 3328]
    - [58, 47.185]
  - - [448, 128, 1, 1280]
    - [15, 4.569]
  - - [64, 3584, 1, 1280]
    - [80, 13.557]
  - - [6784, 1408, 1, 256]
    - [54, 35.457]
  - - [5888, 4288, 1, 256]
    - [54, 43.71]
  - - [5056, 5888, 1, 256]
    - [161, 45.143]
  - - [2368, 1024, 1, 256]
    - [16, 24.54]
  - - [1856, 6784, 1, 1280]
    - [70, 62.142]
  - - [3584, 128, 1, 1280]
    - [75, 15.909]
  - - [128, 64, 1, 256]
    - [8, 0.199]
  - - [1408, 448, 1, 256]
    - [37, 10.894]
  - - [64, 256, 1, 3328]
    - [120, 2.118]
  - - [6784, 448, 1, 3328]
    - [58, 60.484]
  - - [5056, 1856, 1, 1280]
    - [48, 64.734]
  - - [1408, 1024, 1, 3328]
    - [117, 54.223]
  - - [2368, 256, 1, 3328]
    - [42, 38.722]
  - - [5888, 3584, 1, 1280]
    - [22, 70.283]
  - - [5888, 128, 1, 1280]
    - [42, 32.347]
  - - [1024, 2944, 1, 256]
    - [162, 24.424]
  - - [448, 6784, 1, 1280]
    - [75, 48.542]
  - - [256, 3584, 1, 1280]
    - [58, 28.953]
  - - [704, 5056, 1, 256]
    - [18, 22.361]
  - - [3584, 1024, 1, 3328]
    - [58, 71.469]
  - - [2944, 1856, 1, 1280]
    - [16, 52.358]
  - - [5056, 256, 1, 256]
    - [98, 17.609]
  - - [128, 5888, 1, 256]
    - [37, 13.255]
  - - [2368, 3584, 1, 3328]
    - [117, 67.821]
  - - [3584, 5888, 1, 3328]
    - [22, 77.917]
  - - [2944, 3584, 1, 1280]
    - [16, 65.601]
  - - [1856, 5888, 1, 1280]
    - [16, 59.202]
  - - [256, 256, 1, 1280]
    - [120, 5.193]
  - - [4288, 1408, 1, 256]
    - [38, 31.893]
  - - [3584, 64, 1, 256]
    - [13, 4.759]
  - - [64, 1856, 1, 3328]
    - [36, 11.94]
  - - [1408, 128, 1, 256]
    - [107, 2.145]
  - - [4288, 2368, 1, 1280]
    - [38, 60.509]
  - - [2944, 5056, 1, 256]
    - [46, 39.973]
  - - [256, 128, 1, 3328]
    - [15, 4.193]
  - - [6784, 2368, 1, 256]
    - [50, 40.431]
  - - [1408, 448, 1, 3328]
    - [42, 39.353]
  - - [4288, 1856, 1, 256]
    - [50, 33.806]
  - - [1856, 2944, 1, 256]
    - [50, 28.13]
  - - [64, 5888, 1, 1280]
    - [97, 20.901]
  - - [1856, 1408, 1, 1280]
    - [44, 49.522]
  - - [128, 704, 1, 256]
    - [153, 2.184]
  - - [1024, 4288, 1, 1280]
    - [44, 54.029]
  - - [2368, 5056, 1, 3328]
    - [61, 79.235]
  - - [4288, 1024, 1, 3328]
    - [117, 68.377]
  - - [1024, 5056, 1, 3328]
    - [16, 67.9]
  - - [1024, 1856, 1, 3328]
    - [17, 55.803]
  - - [704, 704, 1, 1280]
    - [144, 17.676]
  - - [128, 2368, 1, 1280]
    - [80, 17.697]
  - - [3584, 256, 1, 1280]
    - [16, 28.333]
  - - [5888, 64, 1, 1280]
    - [80, 21.825]
  - - [128, 704, 1, 3328]
    - [142, 10.76]
  - - [3584, 2944, 1, 3328]
    - [61, 78.205]
  - - [128, 1856, 1, 256]
    - [13, 5.038]
  - - [64, 4288, 1, 256]
    - [39, 3.218]
  - - [5888, 2944, 1, 256]
    - [50, 41.594]
  - - [5056, 128, 1, 1280]
    - [144, 28.281]
  - - [448, 1856, 1, 3328]
    - [80, 43.406]
  - - [5056, 4288, 1, 256]
    - [56, 43.636]
  - - [2944, 128, 1, 1280]
    - [80, 22.272]
  - - [64, 256, 1, 256]
    - [15, 0.397]
  - - [704, 256, 1, 3328]
    - [35, 18.02]
  - - [5056, 1408, 1, 256]
    - [50, 33.278]
  - - [5888, 5888, 1, 1280]
    - [22, 70.546]
  - - [448, 5888, 1, 1280]
    - [60, 44.727]
  - - [4288, 704, 1, 1280]
    - [44, 47.115]
  - - [2944, 1408, 1, 256]
    - [44, 26.988]
  - - [256, 2944, 1, 1280]
    - [75, 32.737]
  - - [2368, 5888, 1, 3328]
    - [70, 75.711]
  - - [704, 1024, 1, 3328]
    - [110, 44.975]
  - - [2368, 1856, 1, 1280]
    - [16, 51.321]
  - - [1856, 448, 1, 1280]
    - [37, 34.757]
  - - [128, 6784, 1, 256]
    - [37, 14.997]
  - - [5888, 4288, 1, 3328]
    - [61, 73.113]
  - - [1856, 128, 1, 256]
    - [36, 2.875]
  - - [5056, 448, 1, 256]
    - [16, 22.606]
  - - [1856, 5056, 1, 1280]
    - [70, 59.986]
  - - [2944, 1024, 1, 1280]
    - [66, 47.358]
  - - [2368, 4288, 1, 256]
    - [50, 37.985]
  - - [1024, 2368, 1, 3328]
    - [29, 71.223]
  - - [4288, 64, 1, 3328]
    - [80, 24.855]
  - - [704, 1408, 1, 256]
    - [98, 13.946]
  - - [4288, 5888, 1, 3328]
    - [22, 85.745]
  - - [448, 2944, 1, 1280]
    - [18, 37.004]
  - - [1024, 2944, 1, 3328]
    - [160, 59.119]
  - - [256, 6784, 1, 1280]
    - [62, 36.63]
  - - [1856, 3584, 1, 256]
    - [46, 32.191]
  - - [128, 448, 1, 3328]
    - [120, 7.215]
  - - [1856, 256, 1, 256]
    - [101, 8.256]
  - - [5056, 128, 1, 256]
    - [37, 11.74]
  - - [256, 5888, 1, 1280]
    - [44, 42.373]
  - - [6784, 128, 1, 1280]
    - [77, 23.285]
  - - [64, 1408, 1, 256]
    - [11, 2.166]
  - - [2944, 2368, 1, 256]
    - [51, 32.379]
  - - [1856, 448, 1, 256]
    - [37, 14.803]
  - - [1024, 1856, 1, 256]
    - [18, 14.613]
  - - [6784, 3584, 1, 3328]
    - [61, 83.637]
  - - [2944, 64, 1, 3328]
    - [35, 17.706]
  - - [1024, 5888, 1, 3328]
    - [70, 65.546]
  - - [1408, 2368, 1, 1280]
    - [44, 51.535]
  - - [128, 1408, 1, 1280]
    - [35, 12.033]
  - - [128, 1856, 1, 3328]
    - [80, 21.726]
  - - [2944, 2944, 1, 256]
    - [53, 33.989]
  - - [6784, 256, 1, 256]
    - [44, 22.977]
  - - [128, 4288, 1, 1280]
    - [144, 18.828]
  - - [5888, 1408, 1, 256]
    - [38, 34.454]
  - - [448, 704, 1, 3328]
    - [80, 28.023]
  - - [448, 1856, 1, 256]
    - [37, 14.623]
  - - [1856, 704, 1, 3328]
    - [113, 47.381]
  - - [5888, 6784, 1, 3328]
    - [70, 74.454]
  - - [704, 4288, 1, 1280]
    - [44, 47.115]
  - - [4096, 7000, 1, 4096]
    - [139, 76.753]
  - - [5124, 9124, 1, 1760]
    - [164, 71.043]
  - - [1760, 32, 1, 1760]
    - [165, 4.558]
  - - [1024, 1500, 1, 1536]
    - [18, 44.008]
  - - [512, 24000, 1, 2048]
    - [61, 77.468]
  - - [3072, 24000, 1, 1024]
    - [22, 69.55]
  - - [1024, 3000, 1, 2560]
    - [66, 55.725]
  - - [512, 3136, 1, 2048]
    - [44, 50.681]
  - - [7680, 4, 1, 2560]
    - [13, 2.21]
  - - [64, 193600, 1, 64]
    - [28, 14.866]
  - - [8448, 1500, 1, 2816]
    - [68, 69.257]
  - - [2560, 7000, 1, 2560]
    - [56, 71.676]
  - - [3072, 16, 1, 1024]
    - [15, 3.278]
  - - [512, 48000, 1, 2048]
    - [22, 72.897]
  - - [1760, 64, 1, 1760]
    - [13, 5.735]
  - - [512, 48000, 1, 1536]
    - [131, 69.618]
  - - [2560, 32, 1, 2560]
    - [15, 8.751]
  - - [4608, 1500, 1, 1536]
    - [16, 63.471]
  - - [2048, 128, 1, 2048]
    - [80, 20.23]
  - - [1024, 24000, 1, 2560]
    - [22, 75.496]
  - - [4608, 3000, 1, 1536]
    - [21, 70.538]
  - - [5124, 9124, 1, 2048]
    - [164, 71.35]
  - - [2048, 16, 1, 2048]
    - [15, 3.204]
  - - [1024, 700, 1, 512]
    - [37, 19.784]
  - - [3072, 1, 1, 128]
    - [13, 0.041]
  - - [5124, 700, 1, 2560]
    - [61, 56.408]
  - - [8448, 16, 1, 2816]
    - [13, 9.242]
  - - [6144, 6000, 1, 2560]
    - [22, 73.459]
  - - [4608, 32, 1, 1536]
    - [125, 9.929]
  - - [3072, 64, 1, 1024]
    - [36, 11.064]
  - - [512, 16, 1, 512]
    - [153, 0.186]
  - - [7680, 2, 1, 2560]
    - [13, 1.102]
  - - [4224, 1, 1, 128]
    - [13, 0.055]
  - - [7680, 1, 1, 2560]
    - [13, 0.558]
  - - [128, 1500, 1, 1280]
    - [36, 12.759]
  - - [1024, 1500, 1, 2816]
    - [60, 53.143]
  - - [6144, 2, 1, 2560]
    - [15, 1.218]
  - - [8448, 48000, 1, 2816]
    - [22, 79.622]
  - - [512, 6000, 1, 2048]
    - [137, 57.109]
  - - [4224, 1500, 1, 176]
    - [14, 20.781]
  - - [1024, 6000, 1, 2816]
    - [16, 64.418]
  - - [1024, 48000, 1, 1536]
    - [22, 72.781]
  - - [1024, 48000, 1, 2560]
    - [22, 76.643]
  - - [4096, 32, 1, 4096]
    - [80, 12.472]
  - - [512, 16, 1, 500000]
    - [166, 7.588]
  - - [2560, 128, 1, 2560]
    - [80, 26.036]
  - - [4608, 24000, 1, 1536]
    - [22, 74.973]
  - - [512, 2, 1, 500000]
    - [167, 0.959]
  - - [7680, 48000, 1, 2560]
    - [103, 79.248]
  - - [3072, 48000, 1, 1024]
    - [22, 70.633]
  - - [1760, 16, 1, 1760]
    - [99, 1.647]
  - - [1024, 1500, 1, 2048]
    - [60, 48.023]
  - - [64, 193600, 1, 256]
    - [98, 24.938]
  - - [1024, 3000, 1, 2048]
    - [66, 52.662]
  - - [6144, 4, 1, 2560]
    - [15, 2.505]
  - - [1024, 6000, 1, 2048]
    - [16, 61.664]
  - - [512, 24000, 1, 2816]
    - [67, 80.416]
  - - [6144, 48000, 1, 2560]
    - [22, 78.711]
  - - [1760, 7000, 1, 1760]
    - [70, 74.991]
  - - [8448, 3000, 1, 2816]
    - [22, 70.601]
  - - [3072, 4, 1, 1024]
    - [8, 0.834]
  - - [4608, 48000, 1, 1536]
    - [22, 75.36]
  - - [2048, 32, 1, 2048]
    - [142, 6.275]
  - - [7680, 1500, 1, 2560]
    - [61, 66.908]
  - - [4096, 128, 1, 4096]
    - [144, 36.111]
  - - [4608, 16, 1, 1536]
    - [15, 6.224]
  - - [512, 3000, 1, 1536]
    - [44, 44.45]
  - - [3072, 2, 1, 1024]
    - [15, 0.41]
  - - [8448, 1, 1, 2816]
    - [13, 0.62]
  - - [1024, 3000, 1, 2816]
    - [66, 57.231]
  - - [128, 1, 1, 1408]
    - [11, 0.011]
  - - [64, 1, 1, 1216]
    - [8, 0.003]
  - - [1024, 2, 1, 512]
    - [11, 0.09]
  - - [6144, 1, 1, 2560]
    - [15, 0.626]
  - - [5124, 9124, 1, 2560]
    - [103, 72.891]
  - - [512, 48000, 1, 2816]
    - [22, 75.284]
  - - [512, 3000, 1, 2816]
    - [60, 53.788]
  - - [1024, 24000, 1, 1536]
    - [22, 70.8]
  - - [7680, 6000, 1, 2560]
    - [139, 73.178]
  - - [1760, 128, 1, 1760]
    - [37, 10.81]
  - - [512, 1500, 1, 2816]
    - [42, 44.626]
  - - [512, 1, 1, 512]
    - [8, 0.011]
  - - [512, 6000, 1, 2560]
    - [66, 55.205]
  - - [512, 8, 1, 500000]
    - [166, 4.89]
  - - [512, 24000, 1, 2560]
    - [61, 78.77]
  - - [6144, 3000, 1, 2560]
    - [68, 79.768]
  - - [1024, 24000, 1, 2816]
    - [22, 76.069]
  - - [2048, 7000, 1, 2048]
    - [56, 76.193]
  - - [7680, 3000, 1, 2560]
    - [61, 79.986]
  - - [5124, 700, 1, 2048]
    - [61, 52.051]
  - - [5124, 9124, 1, 4096]
    - [164, 75.089]
  - - [4096, 64, 1, 4096]
    - [80, 24.39]
  - - [256, 193600, 1, 64]
    - [118, 18.031]
  - - [7680, 32, 1, 2560]
    - [125, 13.817]
  - - [2560, 64, 1, 2560]
    - [39, 14.363]
  - - [3072, 128, 1, 1024]
    - [80, 20.162]
  - - [8448, 6000, 1, 2816]
    - [22, 85.655]
  - - [7680, 64, 1, 2560]
    - [168, 26.85]
  - - [5124, 1500, 1, 2560]
    - [61, 62.009]
  - - [1024, 1500, 1, 2560]
    - [66, 51.574]
  - - [512, 4, 1, 512]
    - [148, 0.045]
  - - [1024, 6000, 1, 2560]
    - [16, 63.401]
  - - [3072, 32, 1, 1024]
    - [15, 6.594]
  - - [6144, 32, 1, 2560]
    - [125, 15.665]
  - - [512, 50176, 1, 128]
    - [50, 28.024]
  - - [4608, 1, 1, 1536]
    - [15, 0.403]
  - - [7680, 24000, 1, 2560]
    - [22, 78.374]
  - - [8448, 4, 1, 2816]
    - [13, 2.442]
  - - [512, 1, 1, 500000]
    - [166, 0.493]
  - - [176, 1500, 1, 1408]
    - [136, 15.34]
  - - [512, 3000, 1, 2560]
    - [137, 51.754]
  - - [8448, 24000, 1, 2816]
    - [22, 78.865]
  - - [4608, 2, 1, 1536]
    - [15, 0.793]
  - - [512, 6000, 1, 1536]
    - [18, 48.505]
  - - [7680, 128, 1, 2560]
    - [115, 37.804]
  - - [3072, 6000, 1, 1024]
    - [48, 62.765]
  - - [3072, 1500, 1, 128]
    - [47, 18.306]
  - - [2048, 3136, 1, 512]
    - [14, 44.961]
  - - [1024, 3000, 1, 1536]
    - [44, 48.639]
  - - [512, 4, 1, 500000]
    - [166, 2.011]
  - - [512, 6000, 1, 2816]
    - [117, 56.864]
  - - [128, 50176, 1, 512]
    - [22, 40.582]
  - - [256, 12544, 1, 1024]
    - [44, 47.376]
  - - [1024, 12544, 1, 256]
    - [38, 39.246]
  - - [512, 48000, 1, 2560]
    - [22, 74.669]
  - - [2560, 16, 1, 2560]
    - [15, 4.441]
  - - [2048, 64, 1, 2048]
    - [39, 10.84]
  - - [512, 2, 1, 512]
    - [11, 0.045]
  - - [512, 1500, 1, 2560]
    - [42, 43.604]
  - - [512, 24000, 1, 1536]
    - [61, 72.782]
  - - [6144, 16, 1, 2560]
    - [169, 9.611]
  - - [1024, 24000, 1, 2048]
    - [70, 73.568]
  - - [4096, 16, 1, 4096]
    - [169, 7.431]
  - - [512, 32, 1, 512]
    - [94, 0.711]
  - - [5124, 1500, 1, 2048]
    - [61, 59.492]
  - - [3072, 1500, 1, 1024]
    - [16, 49.917]
  - - [1024, 2, 1, 500000]
    - [167, 1.038]
  - - [7680, 16, 1, 2560]
    - [13, 8.838]
  - - [6144, 1500, 1, 2560]
    - [70, 75.666]
  - - [3072, 1, 1, 1024]
    - [15, 0.21]
  - - [1024, 48000, 1, 2816]
    - [22, 77.138]
  - - [8448, 2, 1, 2816]
    - [13, 1.235]
  - - [4608, 4, 1, 1536]
    - [15, 1.595]
  - - [1024, 6000, 1, 1536]
    - [16, 58.581]
  - - [8448, 32, 1, 2816]
    - [13, 14.597]
  - - [512, 3000, 1, 2048]
    - [60, 48.351]
  - - [6144, 24000, 1, 2560]
    - [70, 77.724]
  - - [4608, 6000, 1, 1536]
    - [70, 70.538]
  - - [512, 1500, 1, 2048]
    - [57, 40.092]
  - - [512, 1500, 1, 1536]
    - [42, 34.611]
  - - [128, 1, 1, 1024]
    - [94, 0.009]
  - - [3072, 3000, 1, 1024]
    - [68, 62.424]
  - - [1024, 48000, 1, 2048]
    - [22, 75.182]
  - - [12544, 1024, 1, 256]
    - [38, 39.122]
  - - [3136, 512, 1, 2048]
    - [44, 49.53]
  - - [12544, 256, 1, 1024]
    - [68, 50.761]
  - - [3136, 2048, 1, 512]
    - [14, 46.602]
  - - [3072, 256, 2, 1024]
    - [151, 39.16]
  - - [768, 2048, 2, 512]
    - [44, 37.261]
  - - [2904, 256, 2, 1024]
    - [18, 39.434]
  - - [864, 2048, 2, 512]
    - [50, 37.595]
  - - [2992, 256, 2, 1024]
    - [44, 40.535]
  - - [3400, 256, 2, 1024]
    - [16, 33.664]
  - - [4032, 256, 2, 1024]
    - [124, 41.146]
  - - [3400, 256, 1, 1024]
    - [58, 22.268]
  - - [15200, 128, 2, 512]
    - [132, 34.639]
  - - [12288, 128, 2, 512]
    - [162, 36.148]
  - - [888, 2048, 2, 512]
    - [14, 38.498]
  - - [13600, 128, 2, 512]
    - [146, 30.597]
  - - [12880, 128, 2, 512]
    - [33, 36.932]
  - - [3456, 256, 2, 1024]
    - [44, 46.186]
  - - [2944, 256, 2, 1024]
    - [113, 37.37]
  - - [2688, 256, 2, 1024]
    - [44, 37.272]
  - - [13824, 128, 2, 512]
    - [132, 32.064]
  - - [3800, 256, 1, 1024]
    - [44, 27.109]
  - - [3168, 256, 2, 1024]
    - [44, 41.864]
  - - [3360, 256, 2, 1024]
    - [16, 32.503]
  - - [3552, 256, 2, 1024]
    - [16, 36.112]
  - - [11616, 128, 2, 512]
    - [45, 32.988]
  - - [4200, 256, 2, 1024]
    - [16, 42.554]
  - - [840, 2048, 2, 512]
    - [47, 36.89]
  - - [14208, 128, 2, 512]
    - [132, 34.452]
  - - [11968, 128, 2, 512]
    - [162, 34.654]
  - - [3264, 256, 2, 1024]
    - [66, 41.26]
  - - [13600, 256, 2, 512]
    - [18, 40.729]
  - - [12880, 256, 2, 512]
    - [38, 42.409]
  - - [12288, 256, 2, 512]
    - [131, 45.083]
  - - [2816, 256, 2, 1024]
    - [44, 38.774]
  - - [672, 2048, 2, 512]
    - [18, 32.207]
  - - [13440, 128, 2, 512]
    - [132, 30.742]
  - - [13824, 256, 2, 512]
    - [143, 42.418]
  - - [15200, 256, 2, 512]
    - [38, 42.918]
  - - [864, 512, 2, 2048]
    - [58, 33.073]
  - - [3600, 256, 2, 1024]
    - [16, 37.242]
  - - [888, 512, 2, 2048]
    - [58, 34.734]
  - - [4032, 1024, 2, 256]
    - [50, 34.268]
  - - [16128, 128, 2, 512]
    - [132, 37.684]
  - - [51520, 64, 2, 256]
    - [174, 24.511]
  - - [46464, 64, 2, 256]
    - [83, 26.39]
  - - [768, 3, 2, 256]
    - [15, 0.112]
  - - [768, 12, 2, 256]
    - [15, 0.436]
  - - [49152, 64, 2, 256]
    - [83, 27.084]
  - - [864, 12, 2, 256]
    - [15, 0.494]
  - - [864, 3, 2, 256]
    - [94, 0.065]
  - - [15200, 128, 1, 512]
    - [146, 23.197]
  - - [12288, 12, 2, 256]
    - [13, 4.43]
  - - [12288, 3, 2, 256]
    - [175, 1.229]
  - - [13600, 128, 1, 512]
    - [146, 22.338]
  - - [216, 3, 2, 256]
    - [15, 0.031]
  - - [51520, 12, 2, 256]
    - [28, 7.02]
  - - [2904, 1024, 2, 256]
    - [54, 30.876]
  - - [176, 12, 2, 256]
    - [15, 0.102]
  - - [51520, 3, 2, 256]
    - [175, 2.045]
  - - [176, 3, 2, 256]
    - [15, 0.026]
  - - [2992, 1024, 2, 256]
    - [14, 31.391]
  - - [192, 12, 2, 256]
    - [15, 0.112]
  - - [15200, 12, 2, 256]
    - [13, 5.01]
  - - [1536, 512, 1, 1024]
    - [42, 30.652]
  - - [1728, 512, 1, 1024]
    - [58, 22.414]
  - - [1536, 2048, 1, 1024]
    - [160, 49.632]
  - - [24576, 128, 1, 256]
    - [143, 24.994]
  - - [24576, 512, 1, 256]
    - [52, 37.923]
  - - [25760, 128, 1, 256]
    - [18, 20.894]
  - - [25760, 512, 1, 256]
    - [38, 35.585]
  - - [6144, 256, 1, 512]
    - [44, 32.404]
  - - [6440, 256, 1, 512]
    - [44, 33.605]
  - - [15200, 3, 2, 256]
    - [175, 1.437]
  - - [51520, 64, 2, 64]
    - [12, 10.856]
  - - [3456, 3, 2, 256]
    - [107, 0.252]
  - - [13600, 12, 2, 256]
    - [12, 4.755]
  - - [12880, 3, 2, 256]
    - [175, 1.259]
  - - [3400, 3, 2, 256]
    - [15, 0.486]
  - - [12880, 12, 2, 256]
    - [13, 4.572]
  - - [13824, 12, 2, 256]
    - [12, 4.761]
  - - [13824, 3, 2, 256]
    - [175, 1.375]
  - - [13600, 3, 2, 256]
    - [175, 0.792]
  - - [13600, 512, 1, 128]
    - [50, 21.185]
  - - [9408, 512, 2, 128]
    - [50, 24.036]
  - - [3456, 12, 2, 256]
    - [15, 1.929]
  - - [56000, 256, 2, 64]
    - [38, 15.058]
  - - [3800, 3, 2, 256]
    - [13, 0.526]
  - - [2816, 1024, 2, 256]
    - [49, 30.577]
  - - [60800, 256, 1, 64]
    - [92, 14.5]
  - - [3400, 12, 2, 256]
    - [13, 1.853]
  - - [3800, 12, 2, 256]
    - [8, 2.023]
  - - [192, 3, 2, 256]
    - [99, 0.028]
  - - [216, 12, 2, 256]
    - [8, 0.126]
  - - [2944, 1024, 2, 256]
    - [50, 31.675]
  - - [55296, 64, 2, 64]
    - [47, 10.744]
  - - [55296, 3, 2, 256]
    - [175, 1.933]
  - - [49152, 64, 2, 64]
    - [14, 10.172]
  - - [11776, 512, 2, 128]
    - [50, 23.855]
  - - [54400, 64, 2, 64]
    - [38, 10.637]
  - - [42240, 64, 2, 256]
    - [132, 27.748]
  - - [3072, 3, 2, 256]
    - [15, 0.429]
  - - [11616, 512, 2, 128]
    - [38, 23.693]
  - - [4200, 1024, 2, 256]
    - [50, 36.324]
  - - [3072, 12, 2, 256]
    - [15, 1.743]
  - - [672, 512, 2, 2048]
    - [42, 36.333]
  - - [54400, 256, 1, 64]
    - [55, 14.047]
  - - [54400, 64, 2, 256]
    - [44, 28.05]
  - - [15200, 512, 1, 128]
    - [50, 21.459]
  - - [56832, 64, 2, 256]
    - [44, 26.592]
  - - [2688, 1024, 2, 256]
    - [50, 29.403]
  - - [54400, 3, 2, 256]
    - [175, 1.941]
  - - [12672, 512, 2, 128]
    - [173, 24.262]
  - - [11968, 512, 2, 128]
    - [14, 23.931]
  - - [46464, 256, 2, 64]
    - [154, 15.903]
  - - [55296, 64, 2, 256]
    - [146, 28.393]
  - - [60800, 64, 2, 64]
    - [46, 10.689]
  - - [2400, 256, 2, 1024]
    - [115, 33.318]
  - - [2520, 256, 2, 1024]
    - [44, 35.357]
  - - [768, 512, 2, 2048]
    - [42, 43.0]
  - - [2400, 1024, 2, 256]
    - [91, 26.524]
  - - [10752, 128, 2, 512]
    - [18, 32.338]
  - - [45632, 256, 2, 64]
    - [48, 14.687]
  - - [2520, 1024, 2, 256]
    - [46, 33.375]
  - - [53760, 256, 2, 64]
    - [158, 16.445]
  - - [43008, 64, 2, 256]
    - [44, 25.486]
  - - [2352, 256, 2, 1024]
    - [44, 33.64]
  - - [47872, 256, 2, 64]
    - [158, 16.145]
  - - [47104, 256, 2, 64]
    - [158, 16.147]
  - - [50688, 256, 2, 64]
    - [158, 15.226]
  - - [45056, 256, 2, 64]
    - [38, 15.108]
  - - [13440, 512, 2, 128]
    - [50, 24.871]
  - - [2352, 1024, 2, 256]
    - [33, 28.074]
  - - [11264, 512, 2, 128]
    - [48, 23.628]
  - - [10560, 128, 2, 512]
    - [44, 27.633]
  - - [16128, 512, 2, 128]
    - [14, 25.418]
  - - [864, 256, 2, 2048]
    - [116, 21.108]
  - - [37632, 256, 2, 64]
    - [45, 14.859]
  - - [51520, 256, 2, 64]
    - [48, 14.871]
  - - [14000, 512, 2, 128]
    - [50, 25.94]
  - - [768, 256, 2, 2048]
    - [80, 28.622]
  - - [60800, 12, 2, 256]
    - [83, 6.177]
  - - [10560, 512, 2, 128]
    - [50, 23.699]
  - - [60800, 3, 2, 256]
    - [135, 1.985]
  - - [64512, 256, 2, 64]
    - [92, 17.11]
  - - [54400, 256, 2, 64]
    - [154, 16.355]
  - - [45632, 64, 2, 256]
    - [44, 23.077]
  - - [3264, 1024, 2, 256]
    - [14, 31.974]
  - - [60800, 64, 2, 256]
    - [146, 27.609]
  - - [10752, 512, 2, 128]
    - [50, 24.13]
  - - [3168, 1024, 2, 256]
    - [152, 29.645]
  - - [55296, 256, 2, 256]
    - [173, 40.605]
  - - [51520, 256, 2, 256]
    - [162, 37.131]
  - - [11408, 128, 2, 512]
    - [162, 34.171]
  - - [60800, 256, 2, 256]
    - [129, 40.535]
  - - [54400, 256, 2, 256]
    - [130, 40.288]
  - - [60800, 256, 2, 64]
    - [158, 15.807]
  - - [3800, 1024, 1, 256]
    - [50, 29.151]
  - - [3400, 1024, 1, 256]
    - [47, 26.922]
  - - [3072, 1024, 2, 256]
    - [50, 33.113]
  - - [3600, 1024, 2, 256]
    - [50, 35.033]
  - - [12288, 512, 2, 128]
    - [173, 23.615]
  - - [49152, 256, 2, 256]
    - [130, 40.28]
  - - [12880, 512, 2, 128]
    - [14, 24.416]
  - - [11408, 512, 2, 128]
    - [50, 24.17]
  - - [42240, 256, 2, 64]
    - [33, 15.199]
  - - [1008, 2048, 2, 512]
    - [132, 36.475]
  - - [3360, 1024, 2, 256]
    - [46, 32.483]
  - - [14208, 512, 2, 128]
    - [14, 24.919]
  - - [56832, 256, 2, 64]
    - [158, 15.326]
  - - [43008, 256, 2, 64]
    - [92, 15.18]
  - - [13600, 512, 2, 128]
    - [50, 24.825]
  - - [2640, 1024, 2, 256]
    - [50, 29.931]
  - - [13824, 512, 2, 128]
    - [152, 25.296]
  - - [3800, 256, 2, 1024]
    - [112, 36.831]
  - - [55296, 256, 2, 64]
    - [158, 16.705]
  - - [2640, 256, 2, 1024]
    - [44, 36.52]
  - - [15200, 512, 2, 128]
    - [152, 24.666]
  - - [3552, 1024, 2, 256]
    - [47, 33.896]
  - - [3456, 1024, 2, 256]
    - [53, 32.551]
  - - [49152, 256, 2, 64]
    - [154, 15.046]
  - - [3400, 1024, 2, 256]
    - [47, 33.754]
  - - [3800, 1024, 2, 256]
    - [38, 36.262]
  - - [6912, 256, 1, 512]
    - [44, 35.319]
  - - [6800, 256, 1, 512]
    - [44, 33.925]
  - - [27648, 128, 1, 256]
    - [52, 27.512]
  - - [27200, 128, 1, 256]
    - [132, 24.256]
  - - [30400, 128, 1, 256]
    - [18, 23.285]
  - - [7600, 256, 1, 512]
    - [16, 28.851]
  - - [6144, 1024, 1, 512]
    - [22, 45.195]
  - - [6912, 1024, 1, 512]
    - [38, 46.472]
  - - [6440, 1024, 1, 512]
    - [176, 47.97]
  - - [27648, 512, 1, 256]
    - [48, 37.99]
  - - [1728, 2048, 1, 1024]
    - [16, 49.609]
  - - [27200, 512, 1, 256]
    - [38, 35.546]
  - - [6800, 1024, 1, 512]
    - [38, 46.286]
  - - [7600, 1024, 1, 512]
    - [48, 47.809]
  - - [30400, 512, 1, 256]
    - [38, 35.771]
  - - [12544, 1024, 1, 1024]
    - [70, 60.985]
  - - [173280, 128, 1, 64]
    - [152, 12.815]
  - - [231040, 128, 1, 64]
    - [162, 13.002]
  - - [25992, 128, 1, 64]
    - [50, 9.482]
  - - [950, 512, 2, 2048]
    - [115, 31.749]
  - - [2852, 256, 2, 1024]
    - [77, 35.317]
  - - [3220, 256, 2, 1024]
    - [77, 39.791]
  - - [850, 2048, 2, 512]
    - [79, 33.641]
  - - [805, 2048, 2, 512]
    - [65, 31.283]
  - - [3036, 256, 2, 1024]
    - [77, 36.376]
  - - [713, 2048, 2, 512]
    - [77, 27.189]
  - - [850, 512, 2, 2048]
    - [115, 28.096]
  - - [850, 2048, 1, 512]
    - [61, 22.719]
  - - [660, 2048, 2, 512]
    - [77, 28.199]
  - - [726, 2048, 2, 512]
    - [61, 29.626]
  - - [805, 512, 2, 2048]
    - [180, 36.187]
  - - [3500, 256, 2, 1024]
    - [77, 29.434]
  - - [3700, 256, 2, 1024]
    - [61, 32.915]
  - - [748, 2048, 2, 512]
    - [79, 29.554]
  - - [950, 256, 2, 2048]
    - [90, 21.136]
  - - [850, 3, 2, 256]
    - [177, 0.102]
  - - [850, 12, 2, 256]
    - [25, 0.403]
  - - [805, 12, 2, 256]
    - [177, 0.384]
  - - [805, 3, 2, 256]
    - [177, 0.098]
  - - [247, 3, 2, 256]
    - [25, 0.032]
  - - [950, 3, 2, 256]
    - [178, 0.125]
  - - [187, 12, 2, 256]
    - [27, 0.089]
  - - [247, 12, 2, 256]
    - [26, 0.115]
  - - [187, 3, 2, 256]
    - [26, 0.025]
  - - [228, 12, 2, 256]
    - [26, 0.058]
  - - [221, 12, 2, 256]
    - [177, 0.103]
  - - [950, 12, 2, 256]
    - [177, 0.447]
  - - [228, 3, 2, 256]
    - [25, 0.029]
  - - [1900, 512, 1, 1024]
    - [115, 21.469]
  - - [1700, 512, 1, 1024]
    - [77, 20.099]
  - - [1610, 512, 1, 1024]
    - [180, 24.897]
  - - [3036, 1024, 2, 256]
    - [95, 27.391]
  - - [221, 3, 2, 256]
    - [170, 0.029]
  - - [2852, 1024, 2, 256]
    - [77, 26.572]
  - - [3220, 3, 2, 256]
    - [179, 0.379]
  - - [3220, 12, 2, 256]
    - [179, 1.486]
  - - [660, 512, 2, 2048]
    - [180, 29.148]
  - - [726, 512, 2, 2048]
    - [180, 30.741]
  - - [713, 512, 2, 2048]
    - [90, 29.555]
  - - [805, 256, 2, 2048]
    - [34, 22.971]
  - - [950, 2048, 1, 512]
    - [61, 24.83]
  - - [850, 256, 2, 2048]
    - [90, 18.602]
  - - [3700, 1024, 2, 256]
    - [65, 30.229]
  - - [3500, 1024, 2, 256]
    - [79, 30.225]
  - - [3220, 1024, 2, 256]
    - [79, 28.389]
  - - [950, 2048, 2, 512]
    - [182, 32.158]
  - - [1610, 2048, 1, 1024]
    - [61, 44.494]
  - - [1700, 2048, 1, 1024]
    - [61, 44.879]
  - - [1900, 2048, 1, 1024]
    - [65, 46.812]
  - - [100, 128, 120, 512]
    - [77, 15.653]
  - - [100, 128, 139, 512]
    - [77, 17.249]
  - - [100, 128, 160, 512]
    - [108, 18.842]
  - - [100, 128, 18, 512]
    - [186, 4.492]
  - - [100, 128, 19, 512]
    - [181, 4.932]
  - - [1444, 256, 120, 128]
    - [108, 26.588]
  - - [1444, 256, 139, 128]
    - [96, 26.809]
  - - [1444, 256, 160, 128]
    - [134, 27.104]
  - - [1444, 256, 18, 128]
    - [77, 16.864]
  - - [1444, 256, 19, 128]
    - [183, 17.494]
  - - [1444, 256, 120, 256]
    - [96, 39.404]
  - - [1444, 256, 139, 256]
    - [134, 39.426]
  - - [1444, 256, 160, 256]
    - [96, 40.262]
  - - [1444, 256, 18, 256]
    - [184, 27.107]
  - - [1444, 256, 19, 256]
    - [95, 27.865]
  - - [25, 128, 120, 256]
    - [185, 5.456]
  - - [25, 128, 139, 256]
    - [185, 6.08]
  - - [25, 128, 160, 256]
    - [185, 6.652]
  - - [25, 128, 18, 256]
    - [177, 0.627]
  - - [25, 128, 19, 256]
    - [25, 0.653]
  - - [361, 256, 120, 512]
    - [95, 34.673]
  - - [361, 256, 139, 512]
    - [96, 35.643]
  - - [361, 256, 160, 512]
    - [96, 36.296]
  - - [361, 256, 18, 512]
    - [77, 25.521]
  - - [361, 256, 19, 512]
    - [61, 21.551]
  - - [9, 128, 120, 256]
    - [186, 2.024]
  - - [9, 128, 139, 256]
    - [186, 2.275]
  - - [9, 128, 160, 256]
    - [186, 2.508]
  - - [9, 128, 18, 256]
    - [177, 0.427]
  - - [9, 128, 19, 256]
    - [177, 0.448]
  - - [1444, 128, 1, 576]
    - [179, 6.183]
  - - [200716, 128, 1, 64]
    - [187, 11.535]
  - - [22500, 64, 1, 147]
    - [82, 8.966]
  - - [25, 256, 1, 1152]
    - [27, 0.417]
  - - [27436, 128, 1, 64]
    - [82, 8.732]
  - - [361, 512, 1, 2304]
    - [181, 13.988]
  - - [9, 256, 1, 1152]
    - [177, 0.151]
  - - [64, 32, 16, 32]
    - [9, 0.13]
  - - [64, 48, 16, 48]
    - [9, 0.242]
  - - [64, 64, 16, 64]
    - [9, 0.473]
  - - [64, 80, 16, 80]
    - [9, 0.62]
  - - [64, 96, 16, 96]
    - [13, 0.967]
  - - [64, 112, 16, 112]
    - [13, 1.122]
  - - [64, 128, 16, 128]
    - [99, 1.616]
  - - [64, 144, 16, 144]
    - [149, 0.968]
  - - [64, 160, 16, 160]
    - [9, 1.279]
  - - [64, 176, 16, 176]
    - [93, 2.553]
  - - [64, 192, 16, 192]
    - [93, 3.375]
  - - [64, 208, 16, 208]
    - [9, 3.466]
  - - [64, 224, 16, 224]
    - [9, 4.32]
  - - [64, 240, 16, 240]
    - [7, 4.233]
  - - [64, 256, 16, 256]
    - [13, 5.601]
  - - [64, 272, 16, 272]
    - [9, 5.142]
  - - [64, 288, 16, 288]
    - [13, 6.884]
  - - [64, 304, 16, 304]
    - [9, 6.346]
  - - [64, 320, 16, 320]
    - [88, 4.519]
  - - [64, 336, 16, 336]
    - [186, 6.819]
  - - [64, 352, 16, 352]
    - [76, 8.263]
  - - [64, 368, 16, 368]
    - [101, 7.851]
  - - [64, 384, 16, 384]
    - [125, 8.954]
  - - [64, 400, 16, 400]
    - [37, 5.779]
  - - [64, 416, 16, 416]
    - [37, 6.769]
  - - [64, 432, 16, 432]
    - [101, 6.259]
  - - [64, 448, 16, 448]
    - [37, 12.123]
  - - [64, 464, 16, 464]
    - [37, 10.615]
  - - [64, 480, 16, 480]
    - [37, 13.291]
  - - [64, 496, 16, 496]
    - [37, 11.491]
  - - [1024, 6688, 1, 1024]
    - [16, 57.512]
  - - [1024, 6688, 1, 4096]
    - [29, 75.861]
  - - [4096, 6688, 1, 1024]
    - [70, 74.679]
  - - [1024, 5664, 1, 1024]
    - [61, 60.337]
  - - [1024, 5984, 1, 1024]
    - [16, 60.473]
  - - [1024, 7872, 1, 3072]
    - [61, 84.749]
  - - [1024, 7872, 1, 4096]
    - [67, 81.88]
  - - [1024, 5920, 1, 1024]
    - [56, 59.98]
  - - [1024, 7344, 1, 3072]
    - [16, 77.166]
  - - [1024, 7344, 1, 1024]
    - [16, 63.098]
  - - [1024, 7760, 1, 3072]
    - [16, 81.056]
  - - [1024, 7760, 1, 1024]
    - [16, 66.383]
  - - [1024, 7760, 1, 4096]
    - [67, 78.232]
  - - [4096, 5136, 1, 1024]
    - [48, 72.993]
  - - [1024, 5936, 1, 1024]
    - [16, 60.091]
  - - [1024, 6608, 1, 1024]
    - [68, 60.941]
  - - [1024, 6608, 1, 4096]
    - [29, 74.951]
  - - [1024, 6624, 1, 1024]
    - [61, 58.124]
  - - [1024, 6624, 1, 4096]
    - [61, 75.369]
  - - [1024, 6416, 1, 1024]
    - [16, 65.006]
  - - [1024, 7024, 1, 3072]
    - [16, 75.639]
  - - [1024, 7536, 1, 3072]
    - [16, 79.16]
  - - [1024, 7536, 1, 1024]
    - [16, 64.842]
  - - [1024, 7040, 1, 3072]
    - [61, 75.509]
  - - [1024, 6544, 1, 1024]
    - [21, 63.472]
  - - [1024, 6544, 1, 4096]
    - [70, 82.244]
  - - [4096, 5472, 1, 1024]
    - [48, 73.523]
  - - [1024, 7232, 1, 3072]
    - [16, 76.17]
  - - [1024, 7232, 1, 1024]
    - [16, 62.272]
  - - [1024, 6368, 1, 1024]
    - [16, 64.686]
  - - [1024, 7152, 1, 3072]
    - [61, 75.215]
  - - [1024, 5872, 1, 1024]
    - [16, 59.957]
  - - [1024, 6000, 1, 1024]
    - [16, 61.105]
  - - [1024, 6960, 1, 3072]
    - [29, 75.467]
  - - [1024, 6960, 1, 1024]
    - [16, 59.075]
  - - [1024, 6960, 1, 4096]
    - [31, 79.189]
  - - [4096, 6960, 1, 1024]
    - [21, 74.919]
  - - [1024, 8016, 1, 1024]
    - [56, 62.673]
  - - [1024, 6976, 1, 3072]
    - [16, 75.545]
  - - [1024, 6976, 1, 1024]
    - [44, 63.2]
  - - [1024, 5632, 1, 1024]
    - [44, 58.364]
  - - [1024, 6176, 1, 1024]
    - [122, 57.377]
  - - [4096, 6176, 1, 1024]
    - [48, 74.318]
  - - [4096, 5504, 1, 1024]
    - [48, 73.265]
  - - [4096, 5488, 1, 1024]
    - [48, 73.196]
  - - [1024, 5456, 1, 1024]
    - [18, 56.097]
  - - [4096, 5456, 1, 1024]
    - [48, 73.079]
  - - [1024, 6640, 1, 1024]
    - [16, 56.402]
  - - [1024, 6640, 1, 4096]
    - [31, 75.185]
  - - [1024, 7440, 1, 3072]
    - [137, 71.776]
  - - [1024, 7440, 1, 1024]
    - [16, 64.203]
  - - [1024, 6288, 1, 1024]
    - [22, 57.192]
  - - [1024, 6256, 1, 1024]
    - [16, 63.168]
  - - [1024, 7264, 1, 3072]
    - [16, 78.319]
  - - [1024, 7264, 1, 1024]
    - [16, 62.411]
  - - [1024, 6672, 1, 1024]
    - [38, 56.811]
  - - [1024, 6672, 1, 4096]
    - [29, 75.321]
  - - [1024, 6208, 1, 1024]
    - [176, 56.95]
  - - [4096, 6208, 1, 1024]
    - [48, 74.684]
  - - [1024, 7376, 1, 3072]
    - [16, 77.25]
  - - [1024, 7376, 1, 1024]
    - [16, 63.604]
  - - [1024, 6224, 1, 1024]
    - [16, 62.684]
  - - [4096, 6224, 1, 1024]
    - [48, 74.648]
  - - [1024, 6320, 1, 1024]
    - [22, 58.321]
  - - [1024, 8304, 1, 1024]
    - [38, 63.087]
  - - [1024, 6560, 1, 1024]
    - [56, 65.399]
  - - [1024, 6560, 1, 4096]
    - [19, 83.242]
  - - [1024, 5856, 1, 3072]
    - [61, 75.47]
  - - [1024, 5856, 1, 1024]
    - [61, 62.101]
  - - [1024, 5696, 1, 1024]
    - [44, 58.361]
  - - [1024, 7504, 1, 3072]
    - [16, 79.011]
  - - [1024, 4880, 1, 1024]
    - [16, 59.68]
  - - [1024, 7168, 1, 3072]
    - [16, 75.183]
  - - [1024, 7776, 1, 3072]
    - [61, 83.715]
  - - [1024, 7776, 1, 4096]
    - [61, 85.118]
  - - [1024, 6384, 1, 1024]
    - [16, 64.186]
  - - [1024, 4624, 1, 1024]
    - [16, 56.784]
  - - [1024, 7488, 1, 3072]
    - [61, 80.984]
  - - [1024, 7472, 1, 1024]
    - [16, 63.919]
  - - [1024, 6576, 1, 1024]
    - [70, 61.123]
  - - [1024, 6576, 1, 4096]
    - [68, 82.69]
  - - [1024, 6928, 1, 3072]
    - [61, 75.587]
  - - [1024, 6928, 1, 1024]
    - [16, 58.581]
  - - [1024, 6928, 1, 4096]
    - [31, 78.585]
  - - [1024, 5792, 1, 1024]
    - [16, 58.383]
  - - [1024, 6704, 1, 1024]
    - [16, 56.639]
  - - [1024, 6016, 1, 1024]
    - [16, 59.518]
  - - [1024, 11248, 1, 3072]
    - [61, 80.485]
  - - [1024, 11248, 1, 4096]
    - [61, 82.05]
  - - [1024, 27, 1, 2]
    - [9, 0.006]
  - - [1024, 14912, 1, 1024]
    - [56, 65.685]
  - - [1024, 2098, 1, 30528]
    - [32, 73.943]
  - - [1024, 2100, 1, 30528]
    - [32, 73.762]
  - - [1024, 2107, 1, 30528]
    - [32, 74.038]
  - - [1024, 2112, 1, 30528]
    - [32, 74.302]
  - - [1024, 2121, 1, 30528]
    - [32, 74.619]
  - - [1024, 2146, 1, 30528]
    - [32, 75.423]
  - - [1024, 2158, 1, 30528]
    - [32, 75.724]
  - - [1024, 2182, 1, 30528]
    - [32, 76.164]
  - - [1024, 2217, 1, 30528]
    - [32, 77.225]
  - - [1024, 2243, 1, 30528]
    - [32, 78.154]
  - - [1024, 2251, 1, 30528]
    - [32, 78.604]
  - - [1024, 12368, 1, 1024]
    - [56, 62.388]
  - - [1024, 13904, 1, 1024]
    - [70, 66.02]
  - - [1024, 14208, 1, 3072]
    - [61, 76.807]
  - - [1024, 14224, 1, 3072]
    - [61, 76.277]
  - - [1024, 14240, 1, 3072]
    - [61, 76.225]
  - - [1024, 14256, 1, 3072]
    - [61, 76.276]
  - - [1024, 14272, 1, 3072]
    - [61, 75.971]
  - - [1024, 14288, 1, 3072]
    - [61, 75.988]
  - - [1024, 14304, 1, 3072]
    - [61, 77.409]
  - - [1024, 14320, 1, 3072]
    - [61, 76.688]
  - - [1024, 14400, 1, 3072]
    - [61, 77.668]
  - - [1024, 14416, 1, 3072]
    - [61, 76.554]
  - - [1024, 14496, 1, 3072]
    - [61, 78.114]
  - - [1024, 14880, 1, 1024]
    - [56, 65.471]
  - - [1024, 14896, 1, 1024]
    - [56, 65.885]
  - - [1024, 14944, 1, 1024]
    - [56, 65.557]
  - - [1024, 14960, 1, 1024]
    - [56, 65.167]
  - - [1024, 15520, 1, 1024]
    - [47, 64.925]
  - - [1024, 16928, 1, 3072]
    - [70, 79.717]
  - - [1024, 1751, 1, 1024]
    - [40, 35.975]
  - - [1024, 1751, 1, 30528]
    - [19, 70.544]
  - - [1024, 1759, 1, 1024]
    - [40, 35.89]
  - - [1024, 1759, 1, 30528]
    - [59, 70.802]
  - - [1024, 1768, 1, 1024]
    - [40, 35.341]
  - - [1024, 1768, 1, 30528]
    - [59, 70.736]
  - - [1024, 1788, 1, 1024]
    - [40, 35.741]
  - - [1024, 1799, 1, 1024]
    - [40, 36.455]
  - - [1024, 1928, 1, 1024]
    - [16, 37.899]
  - - [1024, 1936, 1, 1024]
    - [16, 38.056]
  - - [1024, 1995, 1, 1024]
    - [19, 38.261]
  - - [1024, 2080, 1, 1024]
    - [62, 42.148]
  - - [1024, 2081, 1, 30528]
    - [32, 73.27]
  - - [1024, 2082, 1, 30528]
    - [32, 73.349]
  - - [1024, 2083, 1, 30528]
    - [32, 73.48]
  - - [1024, 2084, 1, 30528]
    - [32, 73.405]
  - - [1024, 2085, 1, 30528]
    - [32, 73.206]
  - - [1024, 2086, 1, 30528]
    - [32, 73.366]
  - - [1024, 2087, 1, 30528]
    - [32, 73.298]
  - - [1024, 2088, 1, 30528]
    - [32, 73.26]
  - - [1024, 2089, 1, 30528]
    - [32, 73.493]
  - - [1024, 2090, 1, 30528]
    - [32, 73.587]
  - - [1024, 2091, 1, 30528]
    - [32, 73.681]
  - - [1024, 2092, 1, 30528]
    - [32, 73.511]
  - - [1024, 2093, 1, 30528]
    - [32, 73.421]
  - - [1024, 2094, 1, 30528]
    - [32, 73.603]
  - - [1024, 2095, 1, 30528]
    - [32, 73.734]
  - - [1024, 2096, 1, 30528]
    - [32, 73.666]
  - - [1024, 2097, 1, 30528]
    - [32, 73.694]
  - - [1024, 2099, 1, 30528]
    - [32, 73.838]
  - - [1024, 2101, 1, 30528]
    - [32, 74.048]
  - - [1024, 2102, 1, 30528]
    - [32, 73.818]
  - - [1024, 2103, 1, 30528]
    - [32, 74.201]
  - - [1024, 2104, 1, 30528]
    - [32, 73.844]
  - - [1024, 2105, 1, 30528]
    - [32, 74.167]
  - - [1024, 2106, 1, 30528]
    - [32, 73.936]
  - - [1024, 2108, 1, 30528]
    - [32, 74.132]
  - - [1024, 2109, 1, 30528]
    - [32, 73.938]
  - - [1024, 2110, 1, 30528]
    - [32, 74.232]
  - - [1024, 2111, 1, 30528]
    - [32, 74.164]
  - - [1024, 2113, 1, 30528]
    - [32, 74.152]
  - - [1024, 2114, 1, 30528]
    - [32, 74.455]
  - - [1024, 2115, 1, 30528]
    - [32, 74.193]
  - - [1024, 2116, 1, 30528]
    - [32, 74.295]
  - - [1024, 2117, 1, 30528]
    - [32, 74.434]
  - - [1024, 2118, 1, 30528]
    - [32, 74.328]
  - - [1024, 2119, 1, 30528]
    - [32, 74.75]
  - - [1024, 2120, 1, 30528]
    - [32, 74.48]
  - - [1024, 2122, 1, 30528]
    - [32, 74.498]
  - - [1024, 2123, 1, 30528]
    - [32, 74.54]
  - - [1024, 2124, 1, 30528]
    - [32, 74.762]
  - - [1024, 2125, 1, 30528]
    - [32, 74.492]
  - - [1024, 2126, 1, 30528]
    - [32, 74.862]
  - - [1024, 2127, 1, 30528]
    - [32, 75.002]
  - - [1024, 2128, 1, 30528]
    - [32, 74.716]
  - - [1024, 2129, 1, 30528]
    - [32, 74.998]
  - - [1024, 2130, 1, 30528]
    - [32, 74.734]
  - - [1024, 2131, 1, 30528]
    - [32, 74.829]
  - - [1024, 2132, 1, 30528]
    - [32, 74.871]
  - - [1024, 2133, 1, 30528]
    - [32, 74.921]
  - - [1024, 2134, 1, 30528]
    - [32, 75.151]
  - - [1024, 2135, 1, 30528]
    - [32, 74.947]
  - - [1024, 2136, 1, 30528]
    - [32, 75.132]
  - - [1024, 2137, 1, 30528]
    - [32, 75.122]
  - - [1024, 2138, 1, 30528]
    - [32, 74.985]
  - - [1024, 2139, 1, 30528]
    - [32, 75.177]
  - - [1024, 2140, 1, 30528]
    - [32, 75.003]
  - - [1024, 2141, 1, 30528]
    - [32, 75.489]
  - - [1024, 2142, 1, 30528]
    - [32, 75.328]
  - - [1024, 2143, 1, 30528]
    - [32, 75.295]
  - - [1024, 2144, 1, 30528]
    - [32, 75.195]
  - - [1024, 2145, 1, 30528]
    - [32, 75.253]
  - - [1024, 2147, 1, 30528]
    - [32, 75.293]
  - - [1024, 2148, 1, 30528]
    - [32, 75.403]
  - - [1024, 2149, 1, 30528]
    - [32, 75.521]
  - - [1024, 2150, 1, 30528]
    - [32, 75.383]
  - - [1024, 2151, 1, 30528]
    - [32, 75.614]
  - - [1024, 2152, 1, 30528]
    - [32, 75.483]
  - - [1024, 2153, 1, 30528]
    - [32, 75.647]
  - - [1024, 2154, 1, 30528]
    - [32, 75.584]
  - - [1024, 2155, 1, 30528]
    - [32, 75.619]
  - - [1024, 2156, 1, 30528]
    - [32, 75.888]
  - - [1024, 2157, 1, 30528]
    - [32, 75.704]
  - - [1024, 2159, 1, 30528]
    - [32, 75.369]
  - - [1024, 2160, 1, 30528]
    - [32, 75.756]
  - - [1024, 2161, 1, 30528]
    - [32, 75.867]
  - - [1024, 2162, 1, 30528]
    - [32, 75.834]
  - - [1024, 2163, 1, 30528]
    - [32, 76.013]
  - - [1024, 2164, 1, 30528]
    - [32, 75.889]
  - - [1024, 2165, 1, 30528]
    - [32, 76.015]
  - - [1024, 2166, 1, 30528]
    - [32, 75.974]
  - - [1024, 2167, 1, 30528]
    - [32, 76.176]
  - - [1024, 2168, 1, 30528]
    - [32, 76.022]
  - - [1024, 2169, 1, 30528]
    - [32, 75.959]
  - - [1024, 2170, 1, 30528]
    - [32, 76.145]
  - - [1024, 2171, 1, 30528]
    - [32, 75.961]
  - - [1024, 2172, 1, 30528]
    - [32, 76.109]
  - - [1024, 2173, 1, 30528]
    - [32, 76.357]
  - - [1024, 2174, 1, 30528]
    - [32, 76.202]
  - - [1024, 2175, 1, 30528]
    - [32, 76.343]
  - - [1024, 2176, 1, 30528]
    - [32, 76.234]
  - - [1024, 2177, 1, 30528]
    - [32, 75.959]
  - - [1024, 2178, 1, 30528]
    - [32, 76.085]
  - - [1024, 2179, 1, 30528]
    - [32, 76.218]
  - - [1024, 2180, 1, 30528]
    - [32, 76.094]
  - - [1024, 2181, 1, 30528]
    - [32, 76.22]
  - - [1024, 2183, 1, 30528]
    - [32, 76.206]
  - - [1024, 2184, 1, 30528]
    - [32, 76.302]
  - - [1024, 2185, 1, 30528]
    - [32, 76.125]
  - - [1024, 2186, 1, 30528]
    - [32, 76.615]
  - - [1024, 2187, 1, 30528]
    - [32, 76.597]
  - - [1024, 2188, 1, 30528]
    - [32, 76.426]
  - - [1024, 2189, 1, 30528]
    - [32, 76.492]
  - - [1024, 2190, 1, 30528]
    - [32, 76.549]
  - - [1024, 2191, 1, 30528]
    - [32, 76.357]
  - - [1024, 2192, 1, 30528]
    - [32, 76.612]
  - - [1024, 2193, 1, 30528]
    - [32, 76.502]
  - - [1024, 2194, 1, 30528]
    - [32, 76.872]
  - - [1024, 2195, 1, 30528]
    - [32, 76.762]
  - - [1024, 2196, 1, 30528]
    - [32, 76.683]
  - - [1024, 2197, 1, 30528]
    - [32, 76.589]
  - - [1024, 2198, 1, 30528]
    - [32, 76.692]
  - - [1024, 2199, 1, 30528]
    - [32, 76.681]
  - - [1024, 2200, 1, 30528]
    - [32, 76.785]
  - - [1024, 2201, 1, 30528]
    - [32, 76.728]
  - - [1024, 2202, 1, 30528]
    - [32, 76.839]
  - - [1024, 2203, 1, 30528]
    - [32, 76.821]
  - - [1024, 2204, 1, 30528]
    - [32, 77.154]
  - - [1024, 2205, 1, 30528]
    - [32, 76.868]
  - - [1024, 2206, 1, 30528]
    - [32, 77.07]
  - - [1024, 2207, 1, 30528]
    - [32, 77.098]
  - - [1024, 2208, 1, 30528]
    - [32, 76.965]
  - - [1024, 2209, 1, 30528]
    - [32, 77.106]
  - - [1024, 2210, 1, 30528]
    - [32, 76.981]
  - - [1024, 2211, 1, 30528]
    - [32, 77.108]
  - - [1024, 2212, 1, 30528]
    - [32, 77.265]
  - - [1024, 2213, 1, 30528]
    - [32, 77.215]
  - - [1024, 2214, 1, 30528]
    - [32, 77.535]
  - - [1024, 2215, 1, 30528]
    - [32, 77.064]
  - - [1024, 2216, 1, 30528]
    - [32, 77.198]
  - - [1024, 2218, 1, 30528]
    - [32, 77.321]
  - - [1024, 2219, 1, 30528]
    - [32, 77.402]
  - - [1024, 2220, 1, 30528]
    - [32, 77.345]
  - - [1024, 2221, 1, 30528]
    - [32, 77.364]
  - - [1024, 2222, 1, 30528]
    - [32, 77.761]
  - - [1024, 2223, 1, 30528]
    - [32, 77.457]
  - - [1024, 2224, 1, 30528]
    - [32, 77.522]
  - - [1024, 2225, 1, 30528]
    - [32, 77.673]
  - - [1024, 2226, 1, 30528]
    - [32, 77.515]
  - - [1024, 2227, 1, 30528]
    - [32, 77.627]
  - - [1024, 2228, 1, 30528]
    - [32, 77.885]
  - - [1024, 2229, 1, 30528]
    - [32, 77.643]
  - - [1024, 2230, 1, 30528]
    - [32, 78.033]
  - - [1024, 2231, 1, 30528]
    - [32, 77.751]
  - - [1024, 2232, 1, 30528]
    - [32, 77.817]
  - - [1024, 2233, 1, 30528]
    - [32, 77.736]
  - - [1024, 2234, 1, 30528]
    - [32, 77.91]
  - - [1024, 2235, 1, 30528]
    - [32, 77.929]
  - - [1024, 2236, 1, 30528]
    - [32, 77.81]
  - - [1024, 2237, 1, 30528]
    - [32, 77.86]
  - - [1024, 2238, 1, 30528]
    - [32, 77.81]
  - - [1024, 2239, 1, 30528]
    - [32, 78.007]
  - - [1024, 2240, 1, 30528]
    - [32, 78.103]
  - - [1024, 2241, 1, 30528]
    - [32, 78.13]
  - - [1024, 2242, 1, 30528]
    - [32, 78.08]
  - - [1024, 2244, 1, 30528]
    - [32, 78.212]
  - - [1024, 2245, 1, 30528]
    - [32, 78.503]
  - - [1024, 2246, 1, 30528]
    - [32, 78.073]
  - - [1024, 2247, 1, 30528]
    - [32, 78.185]
  - - [1024, 2248, 1, 30528]
    - [32, 78.258]
  - - [1024, 2249, 1, 30528]
    - [32, 78.17]
  - - [1024, 2250, 1, 30528]
    - [32, 78.282]
  - - [1024, 2252, 1, 30528]
    - [32, 78.631]
  - - [1024, 2253, 1, 30528]
    - [32, 78.401]
  - - [1024, 2254, 1, 30528]
    - [32, 78.428]
  - - [1024, 2255, 1, 30528]
    - [32, 78.518]
  - - [1024, 2256, 1, 30528]
    - [29, 76.217]
  - - [1024, 2257, 1, 30528]
    - [32, 78.618]
  - - [1024, 2258, 1, 30528]
    - [32, 78.903]
  - - [1024, 2259, 1, 30528]
    - [32, 78.579]
  - - [1024, 2260, 1, 30528]
    - [32, 78.505]
  - - [1024, 2261, 1, 30528]
    - [32, 78.758]
  - - [1024, 2262, 1, 30528]
    - [32, 78.652]
  - - [1024, 2263, 1, 30528]
    - [32, 78.788]
  - - [1024, 2264, 1, 30528]
    - [32, 78.909]
  - - [1024, 2265, 1, 30528]
    - [32, 79.061]
  - - [1024, 2266, 1, 30528]
    - [32, 78.869]
  - - [1024, 2267, 1, 30528]
    - [32, 78.873]
  - - [1024, 2268, 1, 30528]
    - [32, 78.923]
  - - [1024, 2269, 1, 30528]
    - [32, 79.013]
  - - [1024, 2270, 1, 30528]
    - [32, 79.189]
  - - [1024, 2271, 1, 30528]
    - [32, 79.036]
  - - [1024, 2272, 1, 30528]
    - [32, 79.109]
  - - [1024, 2273, 1, 30528]
    - [32, 79.09]
  - - [1024, 2274, 1, 30528]
    - [32, 79.101]
  - - [1024, 2275, 1, 30528]
    - [32, 79.183]
  - - [1024, 2276, 1, 30528]
    - [32, 79.038]
  - - [1024, 2277, 1, 30528]
    - [32, 79.002]
  - - [1024, 2278, 1, 30528]
    - [32, 79.405]
  - - [1024, 2279, 1, 30528]
    - [32, 79.361]
  - - [1024, 2280, 1, 30528]
    - [32, 79.522]
  - - [1024, 2281, 1, 30528]
    - [32, 79.227]
  - - [1024, 2282, 1, 30528]
    - [32, 79.473]
  - - [1024, 2283, 1, 30528]
    - [32, 79.603]
  - - [1024, 2284, 1, 30528]
    - [32, 79.48]
  - - [1024, 2285, 1, 30528]
    - [32, 79.594]
  - - [1024, 2286, 1, 30528]
    - [32, 79.456]
  - - [1024, 2287, 1, 30528]
    - [32, 79.326]
  - - [1024, 2288, 1, 30528]
    - [32, 79.415]
  - - [1024, 2289, 1, 30528]
    - [32, 79.694]
  - - [1024, 2290, 1, 30528]
    - [32, 79.634]
  - - [1024, 2291, 1, 30528]
    - [32, 79.629]
  - - [1024, 2292, 1, 30528]
    - [32, 79.656]
  - - [1024, 2293, 1, 30528]
    - [32, 79.793]
  - - [1024, 2294, 1, 30528]
    - [32, 79.734]
  - - [1024, 2295, 1, 30528]
    - [32, 79.643]
  - - [1024, 2296, 1, 30528]
    - [32, 79.819]
  - - [1024, 2297, 1, 30528]
    - [32, 79.854]
  - - [1024, 2298, 1, 30528]
    - [32, 80.015]
  - - [1024, 2299, 1, 30528]
    - [32, 79.844]
  - - [1024, 2300, 1, 30528]
    - [32, 79.761]
  - - [1024, 2301, 1, 30528]
    - [32, 79.819]
  - - [1024, 2302, 1, 30528]
    - [32, 79.642]
  - - [1024, 2303, 1, 30528]
    - [32, 80.039]
  - - [1024, 2330, 1, 30528]
    - [29, 78.259]
  - - [1024, 2339, 1, 30528]
    - [30, 78.591]
  - - [1024, 2340, 1, 1024]
    - [16, 45.769]
  - - [1024, 2352, 1, 30528]
    - [29, 78.81]
  - - [1024, 2353, 1, 1024]
    - [16, 45.347]
  - - [1024, 2353, 1, 30528]
    - [29, 78.918]
  - - [1024, 2354, 1, 1024]
    - [16, 46.272]
  - - [1024, 2354, 1, 30528]
    - [30, 78.922]
  - - [1024, 2363, 1, 30528]
    - [29, 79.224]
  - - [1024, 2384, 1, 30528]
    - [30, 79.928]
  - - [1024, 2386, 1, 1024]
    - [16, 46.058]
  - - [1024, 2386, 1, 30528]
    - [29, 79.934]
  - - [1024, 2387, 1, 30528]
    - [29, 79.914]
  - - [1024, 2391, 1, 30528]
    - [29, 80.086]
  - - [1024, 2392, 1, 1024]
    - [16, 45.726]
  - - [1024, 2396, 1, 30528]
    - [29, 80.223]
  - - [1024, 2400, 1, 1024]
    - [61, 50.006]
  - - [1024, 2412, 1, 30528]
    - [29, 80.743]
  - - [1024, 2413, 1, 30528]
    - [29, 80.846]
  - - [1024, 2465, 1, 30528]
    - [29, 82.455]
  - - [4096, 13440, 1, 1024]
    - [70, 71.634]
  - - [64, 16, 16, 16]
    - [9, 0.023]
  - - [2400, 1024, 1, 256]
    - [16, 23.786]
  - - [2400, 512, 1, 256]
    - [123, 14.525]
  - - [256, 1024, 1, 12840]
    - [105, 40.299]
  - - [256, 1024, 1, 2400]
    - [37, 17.809]
  - - [256, 1024, 1, 256]
    - [181, 4.421]
  - - [256, 1024, 1, 3200]
    - [80, 23.278]
  - - [256, 1024, 1, 9630]
    - [105, 33.738]
  - - [256, 512, 1, 12840]
    - [100, 22.228]
  - - [256, 512, 1, 2400]
    - [36, 9.683]
  - - [256, 512, 1, 256]
    - [188, 2.378]
  - - [256, 512, 1, 3200]
    - [181, 12.771]
  - - [256, 512, 1, 9630]
    - [100, 18.255]
  - - [4800, 1024, 1, 256]
    - [47, 35.352]
  - - [4800, 512, 1, 256]
    - [44, 22.081]
  - - [642, 163840, 1, 10]
    - [65, 3.766]
  - - [642, 163840, 1, 30]
    - [79, 10.638]
  - - [642, 81920, 1, 10]
    - [79, 3.516]
  - - [642, 81920, 1, 30]
    - [65, 9.886]
  - - [15, 642, 1024, 160]
    - [186, 8.489]
  - - [15, 642, 512, 160]
    - [185, 8.007]
  - - [20, 642, 1024, 160]
    - [186, 11.693]
  - - [20, 642, 512, 160]
    - [186, 10.628]
  - - [40, 642, 1024, 160]
    - [189, 20.745]
  - - [40, 642, 512, 160]
    - [189, 19.022]
  - - [642, 160, 1024, 15]
    - [82, 3.824]
  - - [642, 160, 512, 15]
    - [82, 3.686]
  - - [642, 160, 1024, 40]
    - [82, 9.39]
  - - [642, 160, 512, 40]
    - [82, 9.081]
  - - [512, 1024, 1, 1024]
    - [190, 34.937]
  - - [1024, 1, 1, 256]
    - [153, 0.019]
  - - [1024, 1, 1, 512]
    - [94, 0.035]
  - - [2200, 1, 1, 1024]
    - [94, 0.124]
  - - [2200, 1, 1, 256]
    - [8, 0.038]
  - - [2200, 1, 1, 512]
    - [94, 0.072]
  - - [4000, 1, 1, 1024]
    - [8, 0.22]
  - - [4000, 1, 1, 256]
    - [8, 0.073]
  - - [4000, 1, 1, 512]
    - [94, 0.129]
  - - [1024, 1024, 1, 1]
    - [28, 0.057]
  - - [1024, 256, 1, 1]
    - [7, 0.019]
  - - [2200, 1024, 1, 1]
    - [28, 0.098]
  - - [2200, 1024, 1, 2200]
    - [16, 49.989]
  - - [2200, 256, 1, 1]
    - [104, 0.035]
  - - [2200, 256, 1, 2200]
    - [110, 26.897]
  - - [2200, 512, 1, 1]
    - [28, 0.062]
  - - [2200, 512, 1, 2200]
    - [58, 39.212]
  - - [4000, 1024, 1, 1]
    - [10, 0.135]
  - - [4000, 1024, 1, 4000]
    - [112, 69.787]
  - - [4000, 256, 1, 1]
    - [28, 0.057]
  - - [4000, 256, 1, 4000]
    - [140, 46.849]
  - - [4000, 512, 1, 1]
    - [41, 0.086]
  - - [4000, 512, 1, 4000]
    - [112, 64.767]
  - - [1, 1024, 1, 1024]
    - [191, 0.026]
  - - [1, 1024, 1, 2200]
    - [192, 0.046]
  - - [1, 1024, 1, 4000]
    - [192, 0.062]
  - - [1, 256, 1, 1024]
    - [191, 0.008]
  - - [1, 256, 1, 2200]
    - [192, 0.015]
  - - [1, 256, 1, 4000]
    - [192, 0.023]
  - - [1, 512, 1, 1024]
    - [191, 0.016]
  - - [1, 512, 1, 2200]
    - [192, 0.028]
  - - [1, 512, 1, 4000]
    - [192, 0.039]
  - - [256, 1024, 1, 7616]
    - [127, 31.815]
  - - [256, 512, 1, 7616]
    - [127, 16.836]
  - - [7616, 1024, 1, 256]
    - [50, 35.59]
  - - [7616, 512, 1, 256]
    - [44, 24.238]
  - - [1024, 1024, 1, 2048]
    - [58, 40.526]
  - - [1024, 512, 1, 2048]
    - [42, 28.067]
  - - [2048, 1024, 1, 1024]
    - [16, 40.19]
  - - [2048, 512, 1, 1024]
    - [77, 28.067]
  - - [128, 1024, 1, 3465]
    - [39, 11.345]
  - - [128, 1024, 1, 9375]
    - [100, 17.524]
  - - [128, 512, 1, 3465]
    - [120, 7.009]
  - - [128, 512, 1, 9375]
    - [100, 11.237]
  - - [3465, 1024, 1, 2048]
    - [115, 52.886]
  - - [3465, 512, 1, 2048]
    - [90, 44.062]
  - - [9375, 1024, 1, 2048]
    - [103, 61.994]
  - - [9375, 512, 1, 2048]
    - [108, 54.991]
  - - [8, 256, 1, 8192]
    - [193, 0.765]
  - - [8, 256, 1, 4096]
    - [194, 0.415]
  - - [1, 2048, 1, 2048]
    - [195, 0.312]
  - - [2, 64, 1, 64]
    - [197, 0.001]
  - - [2, 64, 1, 128]
    - [198, 0.001]
  - - [2, 64, 1, 256]
    - [199, 0.002]
  - - [2, 64, 1, 512]
    - [200, 0.004]
  - - [2, 64, 1, 1024]
    - [200, 0.006]
  - - [2, 64, 1, 2048]
    - [201, 0.01]
  - - [2, 64, 1, 4096]
    - [200, 0.015]
  - - [2, 64, 1, 8192]
    - [202, 0.027]
  - - [2, 128, 1, 64]
    - [203, 0.001]
  - - [2, 128, 1, 128]
    - [204, 0.003]
  - - [2, 128, 1, 256]
    - [204, 0.005]
  - - [2, 128, 1, 512]
    - [205, 0.007]
  - - [2, 128, 1, 1024]
    - [200, 0.013]
  - - [2, 128, 1, 2048]
    - [200, 0.021]
  - - [2, 128, 1, 4096]
    - [206, 0.03]
  - - [2, 128, 1, 8192]
    - [207, 0.054]
  - - [2, 256, 1, 64]
    - [199, 0.002]
  - - [2, 256, 1, 128]
    - [5, 0.005]
  - - [2, 256, 1, 256]
    - [76, 0.009]
  - - [2, 256, 1, 512]
    - [200, 0.015]
  - - [2, 256, 1, 1024]
    - [200, 0.027]
  - - [2, 256, 1, 2048]
    - [200, 0.044]
  - - [2, 256, 1, 4096]
    - [200, 0.062]
  - - [2, 256, 1, 8192]
    - [202, 0.106]
  - - [2, 512, 1, 64]
    - [5, 0.005]
  - - [2, 512, 1, 128]
    - [76, 0.009]
  - - [2, 512, 1, 256]
    - [76, 0.017]
  - - [2, 512, 1, 512]
    - [200, 0.03]
  - - [2, 512, 1, 1024]
    - [200, 0.054]
  - - [2, 512, 1, 2048]
    - [200, 0.087]
  - - [2, 512, 1, 4096]
    - [200, 0.125]
  - - [2, 512, 1, 8192]
    - [208, 0.2]
  - - [2, 1024, 1, 64]
    - [209, 0.009]
  - - [2, 1024, 1, 128]
    - [210, 0.018]
  - - [2, 1024, 1, 256]
    - [199, 0.033]
  - - [2, 1024, 1, 512]
    - [200, 0.06]
  - - [2, 1024, 1, 1024]
    - [211, 0.107]
  - - [2, 1024, 1, 2048]
    - [200, 0.172]
  - - [2, 1024, 1, 4096]
    - [200, 0.251]
  - - [2, 1024, 1, 8192]
    - [212, 0.35]
  - - [2, 2048, 1, 64]
    - [5, 0.019]
  - - [2, 2048, 1, 128]
    - [76, 0.036]
  - - [2, 2048, 1, 256]
    - [213, 0.066]
  - - [2, 2048, 1, 512]
    - [201, 0.119]
  - - [2, 2048, 1, 1024]
    - [201, 0.216]
  - - [2, 2048, 1, 2048]
    - [298, 0.651]
  - - [2, 2048, 1, 4096]
    - [200, 0.496]
  - - [2, 2048, 1, 8192]
    - [200, 0.621]
  - - [2, 4096, 1, 64]
    - [198, 0.037]
  - - [2, 4096, 1, 128]
    - [214, 0.07]
  - - [2, 4096, 1, 256]
    - [215, 0.131]
  - - [2, 4096, 1, 512]
    - [201, 0.242]
  - - [2, 4096, 1, 1024]
    - [201, 0.42]
  - - [2, 4096, 1, 2048]
    - [201, 0.654]
  - - [2, 4096, 1, 4096]
    - [201, 0.911]
  - - [2, 4096, 1, 8192]
    - [216, 0.893]
  - - [2, 8192, 1, 64]
    - [203, 0.074]
  - - [2, 8192, 1, 128]
    - [199, 0.137]
  - - [2, 8192, 1, 256]
    - [217, 0.258]
  - - [2, 8192, 1, 512]
    - [200, 0.463]
  - - [2, 8192, 1, 1024]
    - [211, 0.75]
  - - [2, 8192, 1, 2048]
    - [201, 0.982]
  - - [2, 8192, 1, 4096]
    - [218, 1.217]
  - - [2, 8192, 1, 8192]
    - [202, 1.161]
  - - [4, 64, 1, 64]
    - [186, 0.001]
  - - [4, 64, 1, 128]
    - [186, 0.003]
  - - [4, 64, 1, 256]
    - [186, 0.005]
  - - [4, 64, 1, 512]
    - [219, 0.008]
  - - [4, 64, 1, 1024]
    - [220, 0.013]
  - - [4, 64, 1, 2048]
    - [221, 0.021]
  - - [4, 64, 1, 4096]
    - [222, 0.031]
  - - [4, 64, 1, 8192]
    - [223, 0.054]
  - - [4, 128, 1, 64]
    - [224, 0.002]
  - - [4, 128, 1, 128]
    - [225, 0.005]
  - - [4, 128, 1, 256]
    - [179, 0.009]
  - - [4, 128, 1, 512]
    - [226, 0.015]
  - - [4, 128, 1, 1024]
    - [220, 0.027]
  - - [4, 128, 1, 2048]
    - [222, 0.044]
  - - [4, 128, 1, 4096]
    - [226, 0.065]
  - - [4, 128, 1, 8192]
    - [223, 0.108]
  - - [4, 256, 1, 64]
    - [177, 0.005]
  - - [4, 256, 1, 128]
    - [170, 0.01]
  - - [4, 256, 1, 256]
    - [25, 0.019]
  - - [4, 256, 1, 512]
    - [25, 0.034]
  - - [4, 256, 1, 1024]
    - [226, 0.057]
  - - [4, 256, 1, 2048]
    - [222, 0.093]
  - - [4, 256, 1, 4096]
    - [226, 0.135]
  - - [4, 256, 1, 8192]
    - [223, 0.212]
  - - [4, 512, 1, 64]
    - [170, 0.011]
  - - [4, 512, 1, 128]
    - [25, 0.02]
  - - [4, 512, 1, 256]
    - [25, 0.036]
  - - [4, 512, 1, 512]
    - [25, 0.066]
  - - [4, 512, 1, 1024]
    - [222, 0.114]
  - - [4, 512, 1, 2048]
    - [226, 0.185]
  - - [4, 512, 1, 4096]
    - [226, 0.268]
  - - [4, 512, 1, 8192]
    - [223, 0.4]
  - - [4, 1024, 1, 64]
    - [177, 0.021]
  - - [4, 1024, 1, 128]
    - [224, 0.037]
  - - [4, 1024, 1, 256]
    - [227, 0.069]
  - - [4, 1024, 1, 512]
    - [222, 0.126]
  - - [4, 1024, 1, 1024]
    - [228, 0.232]
  - - [4, 1024, 1, 2048]
    - [226, 0.365]
  - - [4, 1024, 1, 4096]
    - [226, 0.531]
  - - [4, 1024, 1, 8192]
    - [229, 0.707]
  - - [4, 2048, 1, 64]
    - [224, 0.04]
  - - [4, 2048, 1, 128]
    - [230, 0.073]
  - - [4, 2048, 1, 256]
    - [227, 0.137]
  - - [4, 2048, 1, 512]
    - [226, 0.257]
  - - [4, 2048, 1, 1024]
    - [222, 0.454]
  - - [4, 2048, 1, 2048]
    - [298, 1.312]
  - - [4, 2048, 1, 4096]
    - [220, 1.036]
  - - [4, 2048, 1, 8192]
    - [226, 1.26]
  - - [4, 4096, 1, 64]
    - [224, 0.076]
  - - [4, 4096, 1, 128]
    - [224, 0.145]
  - - [4, 4096, 1, 256]
    - [224, 0.273]
  - - [4, 4096, 1, 512]
    - [226, 0.503]
  - - [4, 4096, 1, 1024]
    - [228, 0.855]
  - - [4, 4096, 1, 2048]
    - [226, 1.35]
  - - [4, 4096, 1, 4096]
    - [221, 1.837]
  - - [4, 4096, 1, 8192]
    - [231, 1.79]
  - - [4, 8192, 1, 64]
    - [224, 0.154]
  - - [4, 8192, 1, 128]
    - [215, 0.286]
  - - [4, 8192, 1, 256]
    - [224, 0.54]
  - - [4, 8192, 1, 512]
    - [232, 0.927]
  - - [4, 8192, 1, 1024]
    - [222, 1.477]
  - - [4, 8192, 1, 2048]
    - [226, 2.0]
  - - [4, 8192, 1, 4096]
    - [233, 2.475]
  - - [4, 8192, 1, 8192]
    - [234, 2.24]
  - - [8, 64, 1, 64]
    - [8, 0.003]
  - - [8, 64, 1, 128]
    - [8, 0.005]
  - - [8, 64, 1, 256]
    - [235, 0.009]
  - - [8, 64, 1, 512]
    - [94, 0.017]
  - - [8, 64, 1, 1024]
    - [120, 0.029]
  - - [8, 64, 1, 2048]
    - [94, 0.048]
  - - [8, 64, 1, 4096]
    - [94, 0.065]
  - - [8, 64, 1, 8192]
    - [236, 0.109]
  - - [8, 128, 1, 64]
    - [107, 0.006]
  - - [8, 128, 1, 128]
    - [7, 0.01]
  - - [8, 128, 1, 256]
    - [235, 0.019]
  - - [8, 128, 1, 512]
    - [8, 0.035]
  - - [8, 128, 1, 1024]
    - [120, 0.058]
  - - [8, 128, 1, 2048]
    - [148, 0.101]
  - - [8, 128, 1, 4096]
    - [99, 0.141]
  - - [8, 128, 1, 8192]
    - [237, 0.212]
  - - [8, 256, 1, 64]
    - [7, 0.011]
  - - [8, 256, 1, 128]
    - [7, 0.02]
  - - [8, 256, 1, 256]
    - [15, 0.039]
  - - [8, 256, 1, 512]
    - [15, 0.071]
  - - [8, 256, 1, 1024]
    - [94, 0.122]
  - - [8, 256, 1, 2048]
    - [94, 0.196]
  - - [8, 512, 1, 64]
    - [94, 0.022]
  - - [8, 512, 1, 128]
    - [7, 0.04]
  - - [8, 512, 1, 256]
    - [153, 0.076]
  - - [8, 512, 1, 512]
    - [153, 0.139]
  - - [8, 512, 1, 1024]
    - [8, 0.239]
  - - [8, 512, 1, 2048]
    - [94, 0.389]
  - - [8, 512, 1, 4096]
    - [94, 0.551]
  - - [8, 512, 1, 8192]
    - [223, 0.788]
  - - [8, 1024, 1, 64]
    - [94, 0.043]
  - - [8, 1024, 1, 128]
    - [153, 0.081]
  - - [8, 1024, 1, 256]
    - [235, 0.15]
  - - [8, 1024, 1, 512]
    - [94, 0.281]
  - - [8, 1024, 1, 1024]
    - [153, 0.477]
  - - [8, 1024, 1, 2048]
    - [8, 0.771]
  - - [8, 1024, 1, 4096]
    - [94, 1.083]
  - - [8, 1024, 1, 8192]
    - [238, 1.39]
  - - [8, 2048, 1, 64]
    - [153, 0.086]
  - - [8, 2048, 1, 128]
    - [235, 0.16]
  - - [8, 2048, 1, 256]
    - [153, 0.311]
  - - [8, 2048, 1, 512]
    - [153, 0.537]
  - - [8, 2048, 1, 1024]
    - [94, 0.955]
  - - [8, 2048, 1, 2048]
    - [298, 2.488]
  - - [8, 2048, 1, 4096]
    - [239, 2.094]
  - - [8, 2048, 1, 8192]
    - [239, 2.567]
  - - [8, 4096, 1, 64]
    - [11, 0.166]
  - - [8, 4096, 1, 128]
    - [153, 0.319]
  - - [8, 4096, 1, 256]
    - [94, 0.602]
  - - [8, 4096, 1, 512]
    - [153, 1.105]
  - - [8, 4096, 1, 1024]
    - [153, 1.809]
  - - [8, 4096, 1, 2048]
    - [153, 2.749]
  - - [8, 4096, 1, 4096]
    - [220, 3.752]
  - - [8, 4096, 1, 8192]
    - [240, 3.648]
  - - [8, 8192, 1, 64]
    - [94, 0.321]
  - - [8, 8192, 1, 128]
    - [148, 0.622]
  - - [8, 8192, 1, 256]
    - [148, 1.125]
  - - [8, 8192, 1, 512]
    - [94, 2.022]
  - - [8, 8192, 1, 1024]
    - [94, 3.086]
  - - [8, 8192, 1, 2048]
    - [94, 4.109]
  - - [8, 8192, 1, 4096]
    - [241, 5.126]
  - - [8, 8192, 1, 8192]
    - [242, 4.487]
  - - [16, 64, 1, 64]
    - [241, 0.006]
  - - [16, 64, 1, 128]
    - [241, 0.01]
  - - [16, 64, 1, 256]
    - [243, 0.019]
  - - [16, 64, 1, 512]
    - [241, 0.035]
  - - [16, 64, 1, 1024]
    - [243, 0.061]
  - - [16, 64, 1, 2048]
    - [243, 0.095]
  - - [16, 64, 1, 4096]
    - [241, 0.139]
  - - [16, 64, 1, 8192]
    - [167, 0.219]
  - - [16, 128, 1, 64]
    - [107, 0.012]
  - - [16, 128, 1, 128]
    - [244, 0.021]
  - - [16, 128, 1, 256]
    - [243, 0.039]
  - - [16, 128, 1, 512]
    - [243, 0.071]
  - - [16, 128, 1, 1024]
    - [94, 0.122]
  - - [16, 128, 1, 2048]
    - [243, 0.194]
  - - [16, 128, 1, 4096]
    - [239, 0.279]
  - - [16, 128, 1, 8192]
    - [166, 0.425]
  - - [16, 256, 1, 64]
    - [171, 0.023]
  - - [16, 256, 1, 128]
    - [245, 0.041]
  - - [16, 256, 1, 256]
    - [94, 0.077]
  - - [16, 256, 1, 512]
    - [222, 0.142]
  - - [16, 256, 1, 1024]
    - [99, 0.253]
  - - [16, 256, 1, 2048]
    - [246, 0.4]
  - - [16, 256, 1, 4096]
    - [241, 0.563]
  - - [16, 256, 1, 8192]
    - [166, 0.836]
  - - [16, 512, 1, 64]
    - [241, 0.044]
  - - [16, 512, 1, 128]
    - [8, 0.083]
  - - [16, 512, 1, 256]
    - [243, 0.158]
  - - [16, 512, 1, 512]
    - [94, 0.283]
  - - [16, 512, 1, 1024]
    - [241, 0.495]
  - - [16, 512, 1, 2048]
    - [247, 0.794]
  - - [16, 512, 1, 4096]
    - [239, 1.112]
  - - [16, 512, 1, 8192]
    - [248, 1.569]
  - - [16, 1024, 1, 64]
    - [241, 0.091]
  - - [16, 1024, 1, 128]
    - [244, 0.163]
  - - [16, 1024, 1, 256]
    - [235, 0.305]
  - - [16, 1024, 1, 512]
    - [240, 0.563]
  - - [16, 1024, 1, 1024]
    - [249, 0.984]
  - - [16, 1024, 1, 2048]
    - [243, 1.575]
  - - [16, 1024, 1, 4096]
    - [243, 2.211]
  - - [16, 1024, 1, 8192]
    - [247, 2.691]
  - - [16, 2048, 1, 64]
    - [250, 0.174]
  - - [16, 2048, 1, 128]
    - [243, 0.324]
  - - [16, 2048, 1, 256]
    - [243, 0.618]
  - - [16, 2048, 1, 512]
    - [243, 1.112]
  - - [16, 2048, 1, 1024]
    - [240, 1.929]
  - - [16, 2048, 1, 2048]
    - [251, 2.988]
  - - [16, 2048, 1, 4096]
    - [243, 4.272]
  - - [16, 2048, 1, 8192]
    - [252, 5.143]
  - - [16, 4096, 1, 64]
    - [93, 0.338]
  - - [16, 4096, 1, 128]
    - [235, 0.639]
  - - [16, 4096, 1, 256]
    - [94, 1.174]
  - - [16, 4096, 1, 512]
    - [253, 2.16]
  - - [16, 4096, 1, 1024]
    - [94, 3.635]
  - - [16, 4096, 1, 2048]
    - [148, 5.439]
  - - [16, 4096, 1, 4096]
    - [240, 7.523]
  - - [16, 4096, 1, 8192]
    - [254, 7.279]
  - - [16, 8192, 1, 64]
    - [255, 0.639]
  - - [16, 8192, 1, 128]
    - [256, 1.235]
  - - [16, 8192, 1, 256]
    - [94, 2.305]
  - - [16, 8192, 1, 512]
    - [241, 4.022]
  - - [16, 8192, 1, 1024]
    - [94, 6.197]
  - - [16, 8192, 1, 2048]
    - [94, 8.196]
  - - [16, 8192, 1, 4096]
    - [241, 10.217]
  - - [16, 8192, 1, 8192]
    - [202, 8.616]
  - - [64, 64, 1, 64]
    - [257, 0.013]
  - - [64, 64, 1, 128]
    - [258, 0.024]
  - - [64, 64, 1, 512]
    - [258, 0.087]
  - - [64, 64, 1, 1024]
    - [259, 0.162]
  - - [64, 64, 1, 2048]
    - [254, 0.288]
  - - [64, 64, 1, 4096]
    - [236, 0.532]
  - - [64, 64, 1, 8192]
    - [236, 0.982]
  - - [64, 128, 1, 64]
    - [260, 0.026]
  - - [64, 128, 1, 256]
    - [261, 0.099]
  - - [64, 128, 1, 512]
    - [258, 0.18]
  - - [64, 128, 1, 1024]
    - [262, 0.333]
  - - [64, 128, 1, 2048]
    - [259, 0.566]
  - - [64, 128, 1, 4096]
    - [236, 0.98]
  - - [64, 128, 1, 8192]
    - [202, 1.88]
  - - [64, 256, 1, 64]
    - [257, 0.051]
  - - [64, 256, 1, 128]
    - [263, 0.103]
  - - [64, 256, 1, 512]
    - [263, 0.355]
  - - [64, 256, 1, 1024]
    - [262, 0.648]
  - - [64, 256, 1, 2048]
    - [220, 1.103]
  - - [64, 256, 1, 4096]
    - [229, 1.741]
  - - [64, 256, 1, 8192]
    - [264, 3.249]
  - - [64, 512, 1, 64]
    - [263, 0.104]
  - - [64, 512, 1, 128]
    - [265, 0.199]
  - - [64, 512, 1, 256]
    - [266, 0.368]
  - - [64, 512, 1, 1024]
    - [267, 1.295]
  - - [64, 512, 1, 2048]
    - [268, 2.253]
  - - [64, 512, 1, 4096]
    - [269, 3.296]
  - - [64, 512, 1, 8192]
    - [270, 5.638]
  - - [64, 1024, 1, 64]
    - [257, 0.19]
  - - [64, 1024, 1, 128]
    - [266, 0.364]
  - - [64, 1024, 1, 512]
    - [263, 1.371]
  - - [64, 1024, 1, 1024]
    - [271, 2.526]
  - - [64, 1024, 1, 2048]
    - [263, 4.315]
  - - [64, 1024, 1, 4096]
    - [268, 6.504]
  - - [64, 1024, 1, 8192]
    - [270, 10.091]
  - - [64, 2048, 1, 64]
    - [258, 0.366]
  - - [64, 2048, 1, 128]
    - [272, 0.709]
  - - [64, 2048, 1, 256]
    - [273, 1.406]
  - - [64, 2048, 1, 512]
    - [273, 2.616]
  - - [64, 2048, 1, 1024]
    - [274, 4.531]
  - - [64, 2048, 1, 2048]
    - [272, 7.677]
  - - [64, 2048, 1, 4096]
    - [272, 11.052]
  - - [64, 2048, 1, 8192]
    - [275, 15.156]
  - - [64, 4096, 1, 64]
    - [257, 0.716]
  - - [64, 4096, 1, 128]
    - [201, 1.373]
  - - [64, 4096, 1, 256]
    - [257, 2.687]
  - - [64, 4096, 1, 512]
    - [276, 4.908]
  - - [64, 4096, 1, 1024]
    - [277, 8.685]
  - - [64, 4096, 1, 2048]
    - [278, 14.123]
  - - [64, 4096, 1, 4096]
    - [278, 20.612]
  - - [64, 4096, 1, 8192]
    - [279, 25.282]
  - - [64, 8192, 1, 64]
    - [280, 1.423]
  - - [64, 8192, 1, 128]
    - [279, 2.748]
  - - [64, 8192, 1, 256]
    - [279, 5.188]
  - - [64, 8192, 1, 512]
    - [281, 9.448]
  - - [64, 8192, 1, 1024]
    - [282, 15.178]
  - - [64, 8192, 1, 2048]
    - [282, 23.346]
  - - [64, 8192, 1, 4096]
    - [282, 32.612]
  - - [64, 8192, 1, 8192]
    - [283, 30.253]
  - - [256, 64, 1, 64]
    - [257, 0.051]
  - - [256, 64, 1, 128]
    - [267, 0.098]
  - - [256, 64, 1, 512]
    - [268, 0.358]
  - - [256, 64, 1, 1024]
    - [261, 0.651]
  - - [256, 64, 1, 2048]
    - [267, 1.094]
  - - [256, 64, 1, 4096]
    - [270, 1.745]
  - - [256, 64, 1, 8192]
    - [264, 3.256]
  - - [256, 128, 1, 64]
    - [268, 0.103]
  - - [256, 128, 1, 128]
    - [267, 0.196]
  - - [256, 128, 1, 512]
    - [268, 0.743]
  - - [256, 128, 1, 1024]
    - [268, 1.287]
  - - [256, 128, 1, 2048]
    - [251, 2.231]
  - - [256, 128, 1, 4096]
    - [262, 3.288]
  - - [256, 128, 1, 8192]
    - [264, 6.069]
  - - [256, 256, 1, 64]
    - [284, 0.194]
  - - [256, 256, 1, 128]
    - [255, 0.361]
  - - [256, 256, 1, 512]
    - [268, 1.375]
  - - [256, 256, 1, 1024]
    - [271, 2.494]
  - - [256, 256, 1, 2048]
    - [285, 4.388]
  - - [256, 256, 1, 4096]
    - [268, 6.688]
  - - [256, 256, 1, 8192]
    - [270, 11.2]
  - - [256, 512, 1, 64]
    - [263, 0.369]
  - - [256, 512, 1, 128]
    - [260, 0.715]
  - - [256, 512, 1, 512]
    - [263, 2.684]
  - - [256, 512, 1, 1024]
    - [272, 4.608]
  - - [256, 512, 1, 2048]
    - [272, 7.595]
  - - [256, 512, 1, 4096]
    - [270, 11.304]
  - - [256, 512, 1, 8192]
    - [270, 19.466]
  - - [256, 1024, 1, 64]
    - [286, 0.717]
  - - [256, 1024, 1, 128]
    - [287, 1.444]
  - - [256, 1024, 1, 512]
    - [276, 5.064]
  - - [256, 1024, 1, 1024]
    - [277, 8.824]
  - - [256, 1024, 1, 2048]
    - [278, 14.663]
  - - [256, 1024, 1, 4096]
    - [278, 21.588]
  - - [256, 1024, 1, 8192]
    - [288, 30.519]
  - - [256, 2048, 1, 64]
    - [281, 1.41]
  - - [256, 2048, 1, 128]
    - [279, 2.782]
  - - [256, 2048, 1, 256]
    - [279, 5.284]
  - - [256, 2048, 1, 512]
    - [281, 9.777]
  - - [256, 2048, 1, 1024]
    - [289, 16.039]
  - - [256, 2048, 1, 2048]
    - [282, 24.512]
  - - [256, 2048, 1, 4096]
    - [282, 34.312]
  - - [256, 2048, 1, 8192]
    - [282, 42.704]
  - - [256, 4096, 1, 64]
    - [290, 2.687]
  - - [256, 4096, 1, 256]
    - [291, 9.825]
  - - [256, 4096, 1, 512]
    - [196, 16.276]
  - - [256, 4096, 1, 1024]
    - [292, 25.113]
  - - [256, 4096, 1, 2048]
    - [292, 37.311]
  - - [256, 4096, 1, 4096]
    - [293, 50.52]
  - - [256, 4096, 1, 8192]
    - [292, 62.079]
  - - [256, 8192, 1, 64]
    - [294, 4.809]
  - - [256, 8192, 1, 128]
    - [291, 8.713]
  - - [256, 8192, 1, 256]
    - [295, 15.997]
  - - [256, 8192, 1, 512]
    - [296, 26.705]
  - - [256, 8192, 1, 1024]
    - [296, 41.513]
  - - [256, 8192, 1, 2048]
    - [296, 56.312]
  - - [256, 8192, 1, 4096]
    - [297, 70.027]
  - - [256, 8192, 1, 8192]
    - [296, 78.615]
  - - [2048, 1, 1, 2048]
    - [299, 0.527]
  - - [1, 1104, 1, 4608]
    - [300, 0.4]
  - - [1, 4608, 1, 320]
    - [301, 0.237]
  - - [1, 16, 1, 4608]
    - [302, 0.01]
  - - [1, 768, 1, 4608]
    - [303, 0.328]
  - - [1, 4608, 1, 768]
    - [304, 0.33]
- null
