library/src/blas3/Tensile/Logic/asm_full/aldebaran_104cu/aldebaran_Cijk_Alik_Bjlk_HHS_BH.yaml
- {MinimumRequiredVersion: 4.35.0}
- aldebaran
- gfx90a
- [Device 0050, Device 0051, Device 0052, Device 0054, Device 0062, Device 7400, Device
    SolutionIndex: 0
    SolutionNameMin: Cijk_Alik_Bjlk_HHS_BH_MT64x64x4_SN_AF0EM1_AMAS0_ASEM1_BL0_EPS0_GRVW1_ISA000_IU1_KLS_LBSPP0_LPA0_LDL1_LRVW1_FMA_PGR0_PLR0_SIA1_SS0_SU32_SUS256_SVW4_SNLL0_TT4_4_TLDS0_USFGRO0_VS1_VW1_WSGRB0_WG16_16_1_WGM8
    SolutionIndex: 1
    SolutionNameMin: Cijk_Alik_Bjlk_HHS_BH_MT64x64x4_SN_AF0EM1_AMAS0_ASEM1_BL0_EPS0_GRVW1_ISA000_IU1_KLS_LBSPP0_LPA0_LDL1_LRVW1_FMA_PGR1_PLR0_SIA1_SS0_SU32_SUS256_SVW4_SNLL0_TT4_4_TLDS0_USFGRO0_VS1_VW1_WSGRB0_WG16_16_1_WGM8
    SolutionIndex: 2
    SolutionNameMin: Cijk_Alik_Bjlk_HHS_BH_MT64x64x4_SN_AF0EM1_AMAS0_ASEM1_BL0_EPS0_GRVW1_ISA000_IU1_KLS_LBSPP0_LPA0_LDL1_LRVW1_FMA_PGR0_PLR1_SIA1_SS0_SU32_SUS256_SVW4_SNLL0_TT4_4_TLDS0_USFGRO0_VS1_VW1_WSGRB0_WG16_16_1_WGM8
    SolutionIndex: 3
    SolutionNameMin: Cijk_Alik_Bjlk_HHS_BH_MT64x64x8_SN_AF0EM1_AMAS0_ASEM1_BL0_EPS0_GRVW1_ISA000_IU1_KLS_LBSPP0_LPA0_LDL1_LRVW1_FMA_PGR1_PLR1_SIA1_SS0_SU32_SUS256_SVW4_SNLL0_TT4_4_TLDS0_USFGRO0_VS1_VW1_WSGRB0_WG16_16_1_WGM8
    SolutionIndex: 4
    SolutionNameMin: Cijk_Alik_Bjlk_HHS_BH_MT64x64x32_MI16x16x16x1_SN_SU2
    SolutionIndex: 5
    SolutionNameMin: Cijk_Alik_Bjlk_HHS_BH_MT64x64x32_MI16x16x16x1_SN_SU16
- - - [1024, 1, 1024, 8]
    - [2, 0.061]
  - - [122880, 1, 1, 96]
    - [2, 0.101]
  - - [2256, 1, 1, 96]
    - [3, 0.007]
  - - [20480, 1, 1, 96]
    - [2, 0.046]
  - - [235520, 1, 1, 96]
    - [0, 0.115]
  - - [10240, 1, 1, 96]
    - [2, 0.027]
  - - [70938, 1, 1, 96]
    - [2, 0.085]
  - - [70298, 1, 1, 96]
    - [2, 0.086]
  - - [512000, 1, 1, 96]
    - [0, 0.124]
  - - [1988, 1, 1, 96]
    - [3, 0.006]
  - - [2298, 1, 1, 96]
    - [1, 0.007]
  - - [61440, 1, 1, 96]
    - [2, 0.082]
  - - [192, 196, 128, 192]
    - [4, 19.403]
  - - [192, 196, 352, 192]
    - [4, 23.918]
  - - [192, 196, 464, 192]
    - [5, 24.542]
  - - [192, 784, 128, 192]
    - [4, 31.36]
  - - [192, 784, 352, 192]
    - [5, 33.97]
  - - [192, 784, 464, 192]
    - [5, 34.244]
  - - [64, 3136, 128, 64]
    - [4, 17.591]
  - - [64, 3136, 352, 64]
    - [5, 18.646]
  - - [64, 3136, 464, 64]
    - [5, 18.704]
  - - [64, 784, 128, 64]
    - [5, 12.687]
  - - [64, 784, 352, 64]
    - [5, 16.079]
  - - [64, 784, 464, 64]
    - [5, 16.687]
  - - [192, 196, 256, 192]
    - [4, 22.193]
  - - [192, 784, 256, 192]
    - [4, 33.517]
  - - [64, 3136, 256, 64]
    - [5, 18.57]
  - - [64, 784, 256, 64]
    - [5, 15.385]
- null
- null
- DeviceEfficiency
