library/src/blas3/Tensile/Logic/asm_full/aldebaran_104cu/aldebaran_Cijk_Ailk_Bljk_I8II_BH.yaml
- {MinimumRequiredVersion: 4.32.1}
- aldebaran
- {Architecture: gfx90a, CUCount: 104}
- [Device 7400, Device 7408, Device 740c]
    SolutionIndex: 0
    SolutionNameMin: Cijk_Ailk_Bljk_I8II_BH_MT64x64x64_MI32x32x8x1_SE_1LDSB0_AF0EM1_EPS1_GRVW4_LPB4_LRVW4_OPLV0_PK0_PAP0_PGR1_PLR1_SU32_SUS256_SRVW0_TT1_32_WG64_4_1_WGM8
    SolutionIndex: 1
    SolutionNameMin: Cijk_Ailk_Bljk_I8II_BH_MT64x64x32_MI32x32x8x1_SE_1LDSB0_AF0EM4_EPS1_GRVW4_LPB4_LRVW4_OPLV0_PK0_PAP0_PGR1_PLR1_SU32_SUS256_SRVW0_TT1_32_WG64_4_1_WGM8
    SolutionIndex: 2
    SolutionNameMin: Cijk_Ailk_Bljk_I8II_BH_MT64x64x64_MI32x32x8x1_SE_1LDSB0_AF0EM8_EPS0_GRVW16_LPB16_LRVW16_OPLV0_PK0_PAP0_PGR2_PLR9_SU0_SUS0_SRVW4_TT1_32_WG64_4_1_WGM2
    SolutionIndex: 3
    SolutionNameMin: Cijk_Ailk_Bljk_I8II_BH_MT128x96x64_MI32x32x8x1_SE_1LDSB0_AF0EM8_EPS0_GRVW8_LPB16_LRVW16_OPLV0_PK0_PAP0_PGR2_PLR9_SU0_SUS0_SRVW4_TT1_96_WG128_2_1_WGM1
    SolutionIndex: 4
    SolutionNameMin: Cijk_Ailk_Bljk_I8II_BH_MT128x256x64_MI32x32x8x1_SE_1LDSB1_AF0EM8_EPS1_GRVW16_LPB16_LRVW16_OPLV0_PK0_PAP0_PGR1_PLR9_SU0_SUS0_SRVW4_TT1_256_WG128_2_1_WGM1
    SolutionIndex: 5
    SolutionNameMin: Cijk_Ailk_Bljk_I8II_BH_MT64x64x64_MI32x32x8x1_SE_1LDSB0_AF0EM8_EPS0_GRVW8_LPB16_LRVW16_OPLV0_PK0_PAP0_PGR2_PLR9_SU0_SUS0_SRVW4_TT1_32_WG64_4_1_WGM2
    SolutionIndex: 6
    SolutionNameMin: Cijk_Ailk_Bljk_I8II_BH_MT128x96x64_MI32x32x8x1_SE_1LDSB0_AF0EM8_EPS0_GRVW8_LPB16_LRVW16_OPLV0_PK0_PAP0_PGR2_PLR9_SU0_SUS0_SRVW4_TT1_96_WG128_2_1_WGM2
    SolutionIndex: 7
    SolutionNameMin: Cijk_Ailk_Bljk_I8II_BH_MT128x64x64_MI32x32x8x1_SE_1LDSB0_AF0EM8_EPS0_GRVW16_LPB16_LRVW16_OPLV0_PK0_PAP0_PGR2_PLR9_SU0_SUS0_SRVW4_TT1_64_WG128_2_1_WGM1
    SolutionIndex: 8
    SolutionNameMin: Cijk_Ailk_Bljk_I8II_BH_MT32x64x128_MI16x16x16x1_SE_1LDSB0_AF0EM8_EPS0_GRVW8_LPB32_LRVW16_OPLV0_PK0_PAP0_PGR2_PLR9_SU0_SUS0_SRVW0_TT1_32_WG32_8_1_WGM1
    SolutionIndex: 9
    SolutionNameMin: Cijk_Ailk_Bljk_I8II_BH_MT32x32x128_MI16x16x16x1_SE_1LDSB0_AF0EM8_EPS0_GRVW8_LPB32_LRVW16_OPLV0_PK0_PAP0_PGR2_PLR9_SU0_SUS0_SRVW0_TT1_16_WG32_8_1_WGM1
    SolutionIndex: 10
    SolutionNameMin: Cijk_Ailk_Bljk_I8II_BH_MT128x64x64_MI32x32x8x1_SE_1LDSB0_AF0EM8_EPS1_GRVW16_LPB16_LRVW16_OPLV0_PK0_PAP0_PGR1_PLR9_SU0_SUS0_SRVW4_TT1_64_WG128_2_1_WGM1
    SolutionIndex: 11
    SolutionNameMin: Cijk_Ailk_Bljk_I8II_BH_MT128x64x64_MI32x32x8x1_SE_1LDSB0_AF0EM8_EPS0_GRVW8_LPB16_LRVW16_OPLV0_PK0_PAP0_PGR2_PLR9_SU0_SUS0_SRVW4_TT1_64_WG128_2_1_WGM2
    SolutionIndex: 12
    SolutionNameMin: Cijk_Ailk_Bljk_I8II_BH_MT64x64x64_MI32x32x8x1_SE_1LDSB0_AF0EM8_EPS0_GRVW8_LPB16_LRVW16_OPLV0_PK0_PAP0_PGR2_PLR9_SU0_SUS0_SRVW4_TT1_32_WG64_4_1_WGM1
    SolutionIndex: 13
    SolutionNameMin: Cijk_Ailk_Bljk_I8II_BH_MT128x64x64_MI32x32x8x1_SE_1LDSB0_AF0EM8_EPS0_GRVW16_LPB16_LRVW16_OPLV0_PK0_PAP0_PGR2_PLR9_SU0_SUS0_SRVW4_TT1_64_WG128_2_1_WGM15
    SolutionIndex: 14
    SolutionNameMin: Cijk_Ailk_Bljk_I8II_BH_MT64x128x64_MI32x32x8x1_SE_1LDSB0_AF0EM8_EPS1_GRVW16_LPB16_LRVW16_OPLV0_PK0_PAP0_PGR1_PLR9_SU0_SUS0_SRVW4_TT1_64_WG64_4_1_WGM15
    SolutionIndex: 15
    SolutionNameMin: Cijk_Ailk_Bljk_I8II_BH_MT128x96x64_MI32x32x8x1_SE_1LDSB0_AF0EM8_EPS0_GRVW4_LPB16_LRVW16_OPLV0_PK0_PAP0_PGR2_PLR9_SU0_SUS0_SRVW4_TT1_96_WG128_2_1_WGM15
    SolutionIndex: 16
    SolutionNameMin: Cijk_Ailk_Bljk_I8II_BH_MT128x64x64_MI32x32x8x1_SE_1LDSB0_AF0EM8_EPS0_GRVW16_LPB16_LRVW16_OPLV0_PK0_PAP0_PGR2_PLR9_SU0_SUS0_SRVW4_TT1_64_WG128_2_1_WGM2
    SolutionIndex: 17
    SolutionNameMin: Cijk_Ailk_Bljk_I8II_BH_MT128x96x64_MI32x32x8x1_SE_1LDSB0_AF0EM8_EPS0_GRVW4_LPB16_LRVW16_OPLV0_PK0_PAP0_PGR2_PLR9_SU0_SUS0_SRVW4_TT1_96_WG128_2_1_WGM1
    SolutionIndex: 18
    SolutionNameMin: Cijk_Ailk_Bljk_I8II_BH_MT32x32x128_MI16x16x16x1_SE_1LDSB0_AF0EM8_EPS0_GRVW8_LPB32_LRVW16_OPLV0_PK0_PAP0_PGR2_PLR9_SU0_SUS0_SRVW0_TT1_16_WG32_8_1_WGM2
    SolutionIndex: 19
    SolutionNameMin: Cijk_Ailk_Bljk_I8II_BH_MT64x32x128_MI16x16x16x1_SE_1LDSB0_AF0EM8_EPS0_GRVW8_LPB32_LRVW16_OPLV0_PK0_PAP0_PGR2_PLR9_SU32_SUS256_SRVW0_TT2_16_WG32_8_1_WGM1
    SolutionIndex: 20
    SolutionNameMin: Cijk_Ailk_Bljk_I8II_BH_MT32x64x128_MI16x16x16x1_SE_1LDSB0_AF0EM8_EPS1_GRVW8_LPB32_LRVW16_OPLV0_PK0_PAP0_PGR1_PLR9_SU0_SUS0_SRVW0_TT1_32_WG32_8_1_WGM2
    SolutionIndex: 21
    SolutionNameMin: Cijk_Ailk_Bljk_I8II_BH_MT128x96x64_MI32x32x8x1_SE_1LDSB0_AF0EM8_EPS0_GRVW8_LPB16_LRVW16_OPLV0_PK0_PAP0_PGR2_PLR9_SU32_SUS128_SRVW4_TT1_96_WG128_2_1_WGM1
    SolutionIndex: 22
    SolutionNameMin: Cijk_Ailk_Bljk_I8II_BH_MT64x128x64_MI32x32x8x1_SE_1LDSB0_AF0EM8_EPS0_GRVW16_LPB16_LRVW16_OPLV0_PK0_PAP0_PGR2_PLR9_SU0_SUS0_SRVW4_TT1_64_WG64_4_1_WGM1
    SolutionIndex: 23
    SolutionNameMin: Cijk_Ailk_Bljk_I8II_BH_MT32x64x128_MI16x16x16x1_SE_1LDSB0_AF0EM8_EPS0_GRVW16_LPB32_LRVW16_OPLV0_PK0_PAP0_PGR2_PLR9_SU0_SUS0_SRVW0_TT1_32_WG32_8_1_WGM1
    SolutionIndex: 24
    SolutionNameMin: Cijk_Ailk_Bljk_I8II_BH_MT32x64x128_MI16x16x16x1_SE_1LDSB0_AF0EM8_EPS1_GRVW8_LPB32_LRVW16_OPLV0_PK0_PAP0_PGR1_PLR9_SU0_SUS0_SRVW0_TT1_32_WG32_8_1_WGM1
    SolutionIndex: 25
    SolutionNameMin: Cijk_Ailk_Bljk_I8II_BH_MT128x96x64_MI32x32x8x1_SE_1LDSB0_AF0EM8_EPS0_GRVW4_LPB16_LRVW16_OPLV0_PK0_PAP0_PGR2_PLR9_SU0_SUS0_SRVW4_TT1_96_WG128_2_1_WGM2
    SolutionIndex: 26
    SolutionNameMin: Cijk_Ailk_Bljk_I8II_BH_MT32x64x128_MI16x16x16x1_SE_1LDSB0_AF0EM8_EPS0_GRVW8_LPB32_LRVW16_OPLV0_PK0_PAP0_PGR2_PLR9_SU32_SUS128_SRVW0_TT1_32_WG32_8_1_WGM1
    SolutionIndex: 27
    SolutionNameMin: Cijk_Ailk_Bljk_I8II_BH_MT64x64x128_MI32x32x8x1_SE_1LDSB0_AF0EM8_EPS0_GRVW8_LPB16_LRVW16_OPLV0_PK0_PAP0_PGR2_PLR17_SU0_SUS0_SRVW4_TT1_32_WG64_4_1_WGM2
    SolutionIndex: 28
    SolutionNameMin: Cijk_Ailk_Bljk_I8II_BH_MT64x64x64_MI32x32x8x1_SE_GRVW8_LBSPP128_LPA8_NTD0_NEPBS4_TT1_32_VW4_WG64_4_1_WGM1
    SolutionIndex: 29
    SolutionNameMin: Cijk_Ailk_Bljk_I8II_BH_MT128x64x64_MI32x32x8x1_SE_GRVW16_LBSPP128_LPA0_NTD3_NEPBS1_TT1_64_VW8_WG128_2_1_WGM1
    SolutionIndex: 30
    SolutionNameMin: Cijk_Ailk_Bljk_I8II_BH_MT64x64x64_MI32x32x8x1_SE_GRVW16_LBSPP64_LPA0_NTD3_NEPBS4_TT1_32_VW8_WG64_4_1_WGM1
    SolutionIndex: 31
    SolutionNameMin: Cijk_Ailk_Bljk_I8II_BH_MT128x64x64_MI32x32x8x1_SN_GRVW16_LBSPP128_LPA0_NTD3_NEPBS1_TT1_64_VW2_WG128_2_1_WGM1
    SolutionIndex: 32
    SolutionNameMin: Cijk_Ailk_Bljk_I8II_BH_MT128x256x64_MI32x32x8x1_SE_LBSPP128_LPA0_NTD0_SU32_SUM0_SUS128_VW4_WGM1
    SolutionIndex: 33
    SolutionNameMin: Cijk_Ailk_Bljk_I8II_BH_MT128x256x64_MI32x32x8x1_SE_LBSPP128_LPA0_NTD0_SU0_SUM0_SUS0_VW4_WGM1
    SolutionIndex: 34
    SolutionNameMin: Cijk_Ailk_Bljk_I8II_BH_MT128x256x64_MI32x32x8x1_SE_LBSPP128_LPA0_NTD0_SU32_SUM0_SUS128_VW4_WGM8
    SolutionIndex: 35
    SolutionNameMin: Cijk_Ailk_Bljk_I8II_BH_MT128x256x64_MI32x32x8x1_SE_LBSPP128_LPA16_NTD0_SU32_SUM1_SUS256_VW4_WGM1
    SolutionIndex: 36
    SolutionNameMin: Cijk_Ailk_Bljk_I8II_BH_MT128x256x64_MI32x32x8x1_SE_LBSPP128_LPA0_NTD3_SU32_SUM0_SUS128_VW4_WGM8
    SolutionIndex: 37
    SolutionNameMin: Cijk_Ailk_Bljk_I8II_BH_MT128x256x64_MI32x32x8x1_SE_LBSPP128_LPA16_NTD0_SU32_SUM0_SUS256_VW8_WGM1
    SolutionIndex: 38
    SolutionNameMin: Cijk_Ailk_Bljk_I8II_BH_MT128x256x64_MI32x32x8x1_SE_LBSPP128_LPA0_NTD3_SU32_SUM0_SUS256_VW4_WGM1
    SolutionIndex: 39
    SolutionNameMin: Cijk_Ailk_Bljk_I8II_BH_MT128x256x64_MI32x32x8x1_SE_LBSPP128_LPA8_NTD3_SU32_SUM0_SUS128_VW4_WGM8
    SolutionIndex: 40
    SolutionNameMin: Cijk_Ailk_Bljk_I8II_BH_MT128x256x64_MI32x32x8x1_SE_LBSPP128_LPA16_NTD0_SU32_SUM0_SUS256_VW4_WGM1
    SolutionIndex: 41
    SolutionNameMin: Cijk_Ailk_Bljk_I8II_BH_MT128x256x64_MI32x32x8x1_SE_LBSPP128_LPA0_NTD3_SU32_SUM0_SUS128_VW8_WGM8
    SolutionIndex: 42
    SolutionNameMin: Cijk_Ailk_Bljk_I8II_BH_MT128x256x64_MI32x32x8x1_SE_LBSPP128_LPA8_NTD3_SU32_SUM0_SUS256_VW8_WGM1
    SolutionIndex: 43
    SolutionNameMin: Cijk_Ailk_Bljk_I8II_BH_MT128x256x64_MI32x32x8x1_SE_LBSPP128_LPA0_NTD0_SU32_SUM0_SUS256_VW8_WGM1
    SolutionIndex: 44
    SolutionNameMin: Cijk_Ailk_Bljk_I8II_BH_MT128x256x64_MI32x32x8x1_SE_LBSPP128_LPA8_NTD0_SU32_SUM0_SUS128_VW4_WGM1
    SolutionIndex: 45
    SolutionNameMin: Cijk_Ailk_Bljk_I8II_BH_MT128x256x64_MI32x32x8x1_SE_LBSPP128_LPA16_NTD0_NEPBS1_SU0_SUM0_SUS0_VW8_WGM1
    SolutionIndex: 46
    SolutionNameMin: Cijk_Ailk_Bljk_I8II_BH_MT128x256x64_MI32x32x8x1_SE_LBSPP128_LPA0_NTD0_NEPBS4_SU32_SUM2_SUS256_VW4_WGM1
    SolutionIndex: 47
    SolutionNameMin: Cijk_Ailk_Bljk_I8II_BH_MT128x256x64_MI32x32x8x1_SE_LBSPP128_LPA16_NTD0_NEPBS4_SU32_SUM2_SUS128_VW4_WGM1
    SolutionIndex: 48
    SolutionNameMin: Cijk_Ailk_Bljk_I8II_BH_MT128x256x64_MI32x32x8x1_SE_LBSPP128_LPA8_NTD0_NEPBS4_SU32_SUM4_SUS256_VW8_WGM1
    SolutionIndex: 49
    SolutionNameMin: Cijk_Ailk_Bljk_I8II_BH_MT128x256x64_MI32x32x8x1_SE_LBSPP128_LPA0_NTD0_NEPBS1_SU32_SUM0_SUS128_VW4_WGM8
    SolutionIndex: 50
    SolutionNameMin: Cijk_Ailk_Bljk_I8II_BH_MT128x256x64_MI32x32x8x1_SE_LBSPP0_LPA0_NTD0_NEPBS1_SU32_SUM0_SUS128_VW4_WGM8
    SolutionIndex: 51
    SolutionNameMin: Cijk_Ailk_Bljk_I8II_BH_MT128x256x64_MI32x32x8x1_SE_LBSPP128_LPA0_NTD3_NEPBS4_SU32_SUM0_SUS256_VW8_WGM1
    SolutionIndex: 52
    SolutionNameMin: Cijk_Ailk_Bljk_I8II_BH_MT128x256x64_MI32x32x8x1_SE_LBSPP128_LPA16_NTD3_NEPBS4_SU32_SUM0_SUS256_VW8_WGM1
    SolutionIndex: 53
    SolutionNameMin: Cijk_Ailk_Bljk_I8II_BH_MT128x256x64_MI32x32x8x1_SE_LBSPP0_LPA0_NTD3_NEPBS1_SU32_SUM0_SUS128_VW4_WGM8
    SolutionIndex: 54
    SolutionNameMin: Cijk_Ailk_Bljk_I8II_BH_MT128x256x64_MI32x32x8x1_SE_LBSPP128_LPA16_NTD3_NEPBS4_SU32_SUM0_SUS256_VW4_WGM1
    SolutionIndex: 55
    SolutionNameMin: Cijk_Ailk_Bljk_I8II_BH_MT128x256x64_MI32x32x8x1_SE_LBSPP64_LPA0_NTD0_NEPBS4_SU32_SUM0_SUS256_VW4_WGM1
    SolutionIndex: 56
    SolutionNameMin: Cijk_Ailk_Bljk_I8II_BH_MT128x256x64_MI32x32x8x1_SE_LBSPP128_LPA16_NTD0_NEPBS4_SU32_SUM0_SUS128_VW4_WGM1
    SolutionIndex: 57
    SolutionNameMin: Cijk_Ailk_Bljk_I8II_BH_MT128x256x64_MI32x32x8x1_SE_LBSPP0_LPA0_NTD0_NEPBS1_SU32_SUM0_SUS128_VW8_WGM8
    SolutionIndex: 58
    SolutionNameMin: Cijk_Ailk_Bljk_I8II_BH_MT128x256x64_MI32x32x8x1_SE_LBSPP64_LPA8_NTD3_NEPBS1_SU32_SUM0_SUS128_VW8_WGM8
    SolutionIndex: 59
    SolutionNameMin: Cijk_Ailk_Bljk_I8II_BH_MT128x256x64_MI32x32x8x1_SE_LBSPP128_LPA16_NTD0_NEPBS4_SU32_SUM0_SUS128_VW8_WGM1
    SolutionIndex: 60
    SolutionNameMin: Cijk_Ailk_Bljk_I8II_BH_MT64x64x64_MI32x32x8x1_SN_EPS0_LBSPP256_LPA0_LPB4_LRVW4_PGR2_SS1_SU32_SUM1_SUS128_SRVW0_SSO0_SVW1_WSGRA1_WSGRB0
    SolutionIndex: 61
    SolutionNameMin: Cijk_Ailk_Bljk_I8II_BH_MT64x64x64_MI32x32x8x1_SN_EPS0_LBSPP256_LPA0_LPB4_LRVW4_PGR2_SS1_SU32_SUM2_SUS128_SRVW0_SSO0_SVW1_WSGRA1_WSGRB1
    SolutionIndex: 62
    SolutionNameMin: Cijk_Ailk_Bljk_I8II_BH_MT64x64x64_MI32x32x8x1_SN_EPS1_LBSPP128_LPA0_LPB0_LRVW8_PGR1_SS1_SU0_SUM0_SUS0_SRVW0_SSO0_SVW1_WSGRA0_WSGRB1
    SolutionIndex: 63
    SolutionNameMin: Cijk_Ailk_Bljk_I8II_BH_MT64x64x64_MI32x32x8x1_SN_EPS1_LBSPP128_LPA0_LPB0_LRVW8_PGR1_SS1_SU0_SUM0_SUS0_SRVW0_SSO0_SVW1_WSGRA1_WSGRB0
- - - [35, 35, 1, 512]
    - [0, 0.027]
  - - [4, 64, 1, 128]
    - [1, 0.003]
  - - [480, 512, 1, 512]
    - [23, 5.135]
  - - [960, 1024, 1, 1024]
    - [2, 30.651]
  - - [1920, 2048, 1, 2048]
    - [16, 67.634]
  - - [3840, 4096, 1, 4096]
    - [3, 75.294]
  - - [7680, 8192, 1, 8192]
    - [4, 79.773]
  - - [704, 1024, 1, 128]
    - [5, 3.833]
  - - [1024, 1024, 1, 3328]
    - [6, 48.901]
  - - [1856, 448, 1, 3328]
    - [2, 52.931]
  - - [2944, 4288, 1, 1280]
    - [7, 63.19]
  - - [2368, 64, 1, 3328]
    - [8, 14.207]
  - - [1760, 32, 1, 1760]
    - [18, 3.338]
  - - [2368, 5888, 1, 256]
    - [10, 31.689]
  - - [5888, 1856, 1, 256]
    - [11, 30.104]
  - - [64, 3584, 1, 1280]
    - [23, 10.364]
  - - [512, 24000, 1, 1536]
    - [11, 66.535]
  - - [128, 6784, 1, 3328]
    - [12, 55.091]
  - - [5888, 1408, 1, 256]
    - [7, 29.303]
  - - [5888, 1856, 1, 3328]
    - [13, 70.379]
  - - [512, 4, 1, 512]
    - [18, 0.046]
  - - [1856, 4288, 1, 256]
    - [10, 28.693]
  - - [1024, 5056, 1, 128]
    - [10, 16.057]
  - - [5056, 5056, 1, 3328]
    - [13, 73.419]
  - - [1408, 5888, 1, 1280]
    - [7, 60.811]
  - - [2368, 448, 1, 128]
    - [5, 5.191]
  - - [6144, 6000, 1, 2560]
    - [15, 73.317]
  - - [2368, 6784, 1, 128]
    - [10, 18.001]
  - - [1024, 3584, 1, 3328]
    - [3, 67.027]
  - - [512, 48000, 1, 2048]
    - [6, 83.9]
  - - [1408, 64, 1, 128]
    - [8, 0.543]
  - - [256, 4288, 1, 3328]
    - [6, 50.689]
  - - [5888, 1408, 1, 1280]
    - [16, 59.897]
  - - [704, 1856, 1, 3328]
    - [7, 53.468]
  - - [1408, 4288, 1, 256]
    - [11, 27.728]
  - - [1024, 2368, 1, 256]
    - [25, 17.088]
  - - [64, 4, 1, 256]
    - [18, 0.009]
  - - [1408, 1856, 1, 1280]
    - [11, 55.257]
  - - [1408, 64, 1, 1280]
    - [8, 4.512]
  - - [448, 1024, 1, 1280]
    - [2, 23.377]
  - - [4096, 32, 1, 4096]
    - [19, 14.034]
  - - [256, 1408, 1, 3328]
    - [2, 29.763]
  - - [5056, 5056, 1, 1280]
    - [6, 66.173]
  - - [448, 5056, 1, 256]
    - [14, 14.942]
  - - [704, 1856, 1, 1280]
    - [13, 35.388]
  - - [128, 5056, 1, 128]
    - [19, 3.078]
  - - [2368, 128, 1, 256]
    - [26, 3.203]
  - - [1856, 1408, 1, 128]
    - [2, 12.52]
  - - [64, 5056, 1, 256]
    - [8, 3.507]
  - - [6784, 256, 1, 3328]
    - [2, 55.144]
  - - [1408, 3584, 1, 256]
    - [11, 27.103]
  - - [4288, 448, 1, 256]
    - [7, 13.739]
  - - [64, 704, 1, 128]
    - [18, 0.276]
  - - [1024, 1856, 1, 128]
    - [21, 10.382]
  - - [4288, 2944, 1, 1280]
    - [16, 62.863]
  - - [704, 5056, 1, 1280]
    - [22, 56.594]
  - - [2368, 704, 1, 3328]
    - [5, 62.947]
  - - [256, 5888, 1, 256]
    - [13, 12.379]
  - - [1856, 4288, 1, 3328]
    - [22, 71.286]
  - - [256, 2944, 1, 256]
    - [12, 7.295]
  - - [5888, 1024, 1, 256]
    - [22, 27.129]
  - - [448, 64, 1, 1280]
    - [9, 1.472]
  - - [3072, 64, 1, 1024]
    - [26, 7.179]
  - - [3584, 4, 1, 1280]
    - [23, 0.966]
  - - [2560, 16, 1, 2560]
    - [18, 3.252]
  - - [2944, 64, 1, 256]
    - [9, 2.038]
  - - [128, 4, 1, 1280]
    - [18, 0.054]
  - - [1408, 2944, 1, 256]
    - [16, 22.767]
  - - [256, 1856, 1, 1280]
    - [2, 24.127]
  - - [6784, 5056, 1, 3328]
    - [4, 75.754]
  - - [5056, 5056, 1, 256]
    - [25, 34.325]
  - - [128, 256, 1, 256]
    - [9, 0.367]
  - - [64, 1024, 1, 1280]
    - [18, 3.05]
  - - [2944, 4, 1, 256]
    - [8, 0.121]
  - - [704, 5056, 1, 128]
    - [5, 11.243]
  - - [2368, 2944, 1, 1280]
    - [7, 61.153]
  - - [448, 448, 1, 3328]
    - [8, 18.619]
  - - [6784, 6784, 1, 1280]
    - [4, 69.027]
  - - [1024, 256, 1, 3328]
    - [2, 24.947]
  - - [1408, 4288, 1, 1280]
    - [11, 60.632]
  - - [3584, 4288, 1, 1280]
    - [16, 64.128]
  - - [512, 6000, 1, 2560]
    - [11, 59.908]
  - - [2368, 704, 1, 1280]
    - [12, 42.758]
  - - [5056, 4288, 1, 3328]
    - [13, 72.827]
  - - [3584, 2368, 1, 3328]
    - [13, 70.153]
  - - [5888, 6784, 1, 1280]
    - [4, 68.041]
  - - [64, 704, 1, 1280]
    - [18, 2.341]
  - - [4288, 256, 1, 256]
    - [11, 9.773]
  - - [2944, 128, 1, 128]
    - [24, 2.135]
  - - [6144, 32, 1, 2560]
    - [19, 13.863]
  - - [6784, 448, 1, 1280]
    - [7, 51.382]
  - - [2944, 5888, 1, 256]
    - [7, 32.849]
  - - [64, 64, 1, 1280]
    - [18, 0.419]
  - - [4288, 2944, 1, 256]
    - [11, 30.987]
  - - [5888, 704, 1, 1280]
    - [11, 56.447]
  - - [5056, 4, 1, 3328]
    - [19, 1.975]
  - - [1856, 64, 1, 1280]
    - [8, 5.635]
  - - [1760, 16, 1, 1760]
    - [18, 1.665]
  - - [448, 5888, 1, 128]
    - [5, 12.68]
  - - [5888, 64, 1, 3328]
    - [27, 35.147]
  - - [2944, 256, 1, 3328]
    - [5, 48.088]
  - - [1024, 64, 1, 128]
    - [20, 0.387]
  - - [5056, 2368, 1, 1280]
    - [16, 62.603]
  - - [448, 3584, 1, 1280]
    - [22, 47.352]
  - - [6784, 5888, 1, 256]
    - [17, 36.412]
  - - [64, 1024, 1, 3328]
    - [18, 6.876]
  - - [704, 128, 1, 1280]
    - [8, 4.4]
  - - [1024, 1024, 1, 1024]
    - [28, 30.395]
  - - [2048, 2048, 1, 1024]
    - [29, 54.247]
  - - [1024, 1024, 1, 2048]
    - [30, 41.217]
  - - [2048, 2048, 1, 2048]
    - [31, 65.478]
  - - [4096, 4096, 1, 1024]
    - [32, 65.213]
  - - [8192, 8192, 1, 1024]
    - [33, 73.177]
  - - [12288, 12288, 1, 1024]
    - [34, 74.275]
  - - [16384, 16384, 1, 1024]
    - [35, 74.774]
  - - [20480, 20480, 1, 1024]
    - [36, 76.451]
  - - [24576, 24576, 1, 1024]
    - [37, 74.636]
  - - [28672, 28672, 1, 1024]
    - [36, 77.166]
  - - [32768, 32768, 1, 1024]
    - [38, 72.842]
  - - [36864, 36864, 1, 1024]
    - [39, 77.226]
  - - [40960, 40960, 1, 1024]
    - [37, 75.922]
  - - [45056, 45056, 1, 1024]
    - [36, 77.36]
  - - [49152, 49152, 1, 1024]
    - [40, 76.0]
  - - [53248, 53248, 1, 1024]
    - [41, 77.384]
  - - [57344, 57344, 1, 1024]
    - [42, 76.657]
  - - [61440, 61440, 1, 1024]
    - [36, 77.132]
  - - [65536, 65536, 1, 1024]
    - [43, 70.23]
  - - [69632, 69632, 1, 1024]
    - [41, 77.141]
  - - [73728, 73728, 1, 1024]
    - [44, 75.777]
  - - [77824, 77824, 1, 1024]
    - [41, 76.649]
  - - [81920, 81920, 1, 1024]
    - [32, 75.223]
  - - [86016, 86016, 1, 1024]
    - [41, 75.57]
  - - [90112, 90112, 1, 1024]
    - [32, 73.683]
  - - [4096, 4096, 1, 2048]
    - [45, 71.913]
  - - [8192, 8192, 1, 2048]
    - [46, 78.302]
  - - [12288, 12288, 1, 2048]
    - [47, 79.715]
  - - [16384, 16384, 1, 2048]
    - [48, 79.759]
  - - [20480, 20480, 1, 2048]
    - [49, 80.874]
  - - [24576, 24576, 1, 2048]
    - [43, 80.14]
  - - [28672, 28672, 1, 2048]
    - [50, 81.478]
  - - [32768, 32768, 1, 2048]
    - [51, 79.444]
  - - [36864, 36864, 1, 2048]
    - [50, 81.743]
  - - [40960, 40960, 1, 2048]
    - [43, 80.582]
  - - [45056, 45056, 1, 2048]
    - [50, 81.651]
  - - [49152, 49152, 1, 2048]
    - [52, 80.182]
  - - [53248, 53248, 1, 2048]
    - [53, 81.663]
  - - [57344, 57344, 1, 2048]
    - [54, 80.837]
  - - [61440, 61440, 1, 2048]
    - [50, 81.505]
  - - [65536, 65536, 1, 2048]
    - [55, 77.523]
  - - [69632, 69632, 1, 2048]
    - [50, 81.316]
  - - [73728, 73728, 1, 2048]
    - [56, 80.411]
  - - [77824, 77824, 1, 2048]
    - [57, 81.155]
  - - [81920, 81920, 1, 2048]
    - [44, 80.039]
  - - [86016, 86016, 1, 2048]
    - [58, 80.631]
  - - [90112, 90112, 1, 2048]
    - [59, 79.07]
  - - [3025, 256, 1, 64]
    - [60, 3.051]
  - - [3024, 256, 1, 64]
    - [61, 3.001]
  - - [3024, 256, 1, 128]
    - [62, 5.554]
  - - [3072, 256, 1, 64]
    - [63, 3.416]
  - - [3072, 256, 1, 128]
    - [62, 6.13]
- null
