library/src/blas3/Tensile/Logic/asm_full/aldebaran_104cu/aldebaran_Cijk_Ailk_Bljk_HHS_BH.yaml
- {MinimumRequiredVersion: 4.32.1}
- aldebaran
- {Architecture: gfx90a, CUCount: 104}
- [Device 0050, Device 0051, Device 0052, Device 0054, Device 0062, Device 7400, Device
    SolutionIndex: 0
    SolutionNameMin: Cijk_Ailk_Bljk_HHS_BH_MT064x064x04_PGR1_PLR1_TT04_04
    SolutionIndex: 1
    SolutionNameMin: Cijk_Ailk_Bljk_HHS_BH_MT064x064x08_PGR1_PLR1_TT04_04
    SolutionIndex: 2
    SolutionNameMin: Cijk_Ailk_Bljk_HHS_BH_MT064x064x16_PGR1_PLR1_TT04_04
    SolutionIndex: 3
    SolutionNameMin: Cijk_Ailk_Bljk_HHS_BH_MT32x32x32_MI16x16x16x1_SE_GRVW2_LPB16_PLR2_SU0_SUS256_SRVW4_TT1_16_WG32_8_1_WGM1
    SolutionIndex: 4
    SolutionNameMin: Cijk_Ailk_Bljk_HHS_BH_MT128x96x64_MI32x32x8x1_SE_1LDSB0_AF0EM8_EPS0_GRVW8_GSU1_GSUAMB_LBSPP128_LPB8_LRVW8_NLCA1_PGR2_PLR9_SU0_SUS0_SRVW4_TT1_96_TLDS1_VAW2_WSGRA1_WSGRB1_WG128_2_1_WGM15
    SolutionIndex: 5
    SolutionNameMin: Cijk_Ailk_Bljk_HHS_BH_MT128x96x32_MI32x32x8x1_SE_1LDSB0_AF0EM8_EPS0_GRVW4_GSU1_GSUAMB_LBSPP128_LPB8_LRVW8_NLCA1_PGR2_PLR5_SU32_SUS128_SRVW4_TT1_96_TLDS1_VAW2_WSGRA1_WSGRB1_WG128_2_1_WGM1
    SolutionIndex: 6
    SolutionNameMin: Cijk_Ailk_Bljk_HHS_BH_MT32x64x64_MI16x16x16x1_SE_1LDSB0_AF0EM8_EPS0_GRVW8_GSU1_GSUAMB_LBSPP128_LPB16_LRVW8_NLCA1_PGR2_PLR5_SU32_SUS256_SRVW4_TT1_32_TLDS1_VAW2_WSGRA1_WSGRB1_WG32_8_1_WGM15
    SolutionIndex: 7
    SolutionNameMin: Cijk_Ailk_Bljk_HHS_BH_MT128x96x32_MI32x32x8x1_SE_1LDSB1_AF0EM8_EPS1_GRVW2_GSU1_GSUAMB_LBSPP128_LPB8_LRVW8_NLCA1_PGR1_PLR5_SU32_SUS128_SRVW4_TT1_96_TLDS1_VAW2_WSGRA1_WSGRB1_WG128_2_1_WGM2
    SolutionIndex: 8
    SolutionNameMin: Cijk_Ailk_Bljk_HHS_BH_MT32x64x64_MI16x16x16x1_SE_1LDSB0_AF0EM8_EPS0_GRVW8_GSU1_GSUAMB_LBSPP128_LPB16_LRVW8_NLCA1_PGR2_PLR5_SU32_SUS256_SRVW4_TT1_32_TLDS1_VAW2_WSGRA1_WSGRB1_WG32_8_1_WGM1
    SolutionIndex: 9
    SolutionNameMin: Cijk_Ailk_Bljk_HHS_BH_MT64x128x64_MI32x32x8x1_SE_1LDSB0_AF0EM8_EPS0_GRVW8_GSU1_GSUAMB_LBSPP128_LPB8_LRVW8_NLCA1_PGR2_PLR9_SU32_SUS128_SRVW4_TT1_64_TLDS1_VAW2_WSGRA1_WSGRB1_WG64_4_1_WGM1
    SolutionIndex: 10
    SolutionNameMin: Cijk_Ailk_Bljk_HHS_BH_MT128x96x32_MI32x32x8x1_SE_1LDSB0_AF0EM1_EPS0_GRVW4_GSU1_GSUAMB_LBSPP128_LPB8_LRVW8_NLCA1_PGR2_PLR5_SU0_SUS0_SRVW4_TT1_96_TLDS1_VAW2_WSGRA1_WSGRB1_WG128_2_1_WGM15
    SolutionIndex: 11
    SolutionNameMin: Cijk_Ailk_Bljk_HHS_BH_MT256x128x32_MI32x32x8x1_SE_1LDSB0_AF0EM8_EPS0_GRVW8_GSU1_GSUAMB_LBSPP128_LPB8_LRVW8_NLCA1_PGR2_PLR5_SU0_SUS0_SRVW4_TT4_64_TLDS1_VAW2_WSGRA1_WSGRB1_WG64_4_1_WGM1
    SolutionIndex: 12
    SolutionNameMin: Cijk_Ailk_Bljk_HHS_BH_MT128x160x32_MI32x32x8x1_SE_1LDSB1_AF0EM8_EPS1_GRVW2_GSU1_GSUAMB_LBSPP128_LPB8_LRVW8_NLCA1_PGR1_PLR5_SU32_SUS128_SRVW4_TT1_160_TLDS1_VAW2_WSGRA1_WSGRB1_WG128_2_1_WGM2
    SolutionIndex: 13
    SolutionNameMin: Cijk_Ailk_Bljk_HHS_BH_MT256x160x32_MI32x32x8x1_SE_1LDSB0_AF0EM8_EPS0_GRVW4_GSU1_GSUAMB_LBSPP128_LPB8_LRVW8_NLCA1_PGR2_PLR5_SU0_SUS0_SRVW4_TT2_160_TLDS1_VAW2_WSGRA1_WSGRB1_WG128_2_1_WGM2
    SolutionIndex: 14
    SolutionNameMin: Cijk_Ailk_Bljk_HHS_BH_MT128x160x32_MI32x32x8x1_SE_1LDSB1_AF0EM8_EPS1_GRVW2_GSU1_GSUAMB_LBSPP128_LPB8_LRVW8_NLCA1_PGR1_PLR5_SU0_SUS0_SRVW4_TT1_160_TLDS1_VAW2_WSGRA1_WSGRB1_WG128_2_1_WGM1
    SolutionIndex: 15
    SolutionNameMin: Cijk_Ailk_Bljk_HHS_BH_MT64x128x64_MI32x32x8x1_SE_1LDSB0_AF0EM8_EPS0_GRVW8_GSU1_GSUAMB_LBSPP128_LPB8_LRVW8_NLCA1_PGR2_PLR9_SU0_SUS0_SRVW4_TT1_64_TLDS1_VAW2_WSGRA1_WSGRB1_WG64_4_1_WGM15
    SolutionIndex: 16
    SolutionNameMin: Cijk_Ailk_Bljk_HHS_BH_MT128x160x32_MI32x32x8x1_SE_1LDSB1_AF0EM8_EPS1_GRVW2_GSU1_GSUAMB_LBSPP128_LPB8_LRVW8_NLCA1_PGR1_PLR5_SU32_SUS128_SRVW4_TT1_160_TLDS1_VAW2_WSGRA1_WSGRB1_WG128_2_1_WGM1
    SolutionIndex: 17
    SolutionNameMin: Cijk_Ailk_Bljk_HHS_BH_MT128x128x32_MI32x32x8x1_SE_1LDSB0_AF0EM8_EPS0_GRVW8_GSU1_GSUAMB_LBSPP128_LPB8_LRVW8_NLCA1_PGR2_PLR5_SU32_SUS128_SRVW4_TT2_64_TLDS1_VAW2_WSGRA1_WSGRB1_WG64_4_1_WGM15
    SolutionIndex: 18
    SolutionNameMin: Cijk_Ailk_Bljk_HHS_BH_MT128x256x32_MI32x32x8x1_SE_1LDSB1_AF0EM8_EPS0_GRVW8_GSU1_GSUAMB_LBSPP128_LPB8_LRVW8_NLCA1_PGR2_PLR5_SU0_SUS0_SRVW4_TT2_128_TLDS1_VAW2_WSGRA1_WSGRB1_WG64_4_1_WGM1
    SolutionIndex: 19
    SolutionNameMin: Cijk_Ailk_Bljk_HHS_BH_MT64x16x64_MI16x16x16x1_SE_1LDSB0_AF0EM8_EPS0_GRVW8_GSU1_GSUAMB_LBSPP128_LPB16_LRVW8_NLCA1_PGR2_PLR5_SU0_SUS0_SRVW0_TT1_16_TLDS1_VAW2_WSGRA1_WSGRB1_WG64_4_1_WGM1
    SolutionIndex: 20
    SolutionNameMin: Cijk_Ailk_Bljk_HHS_BH_MT64x128x64_MI32x32x8x1_SE_1LDSB0_AF0EM8_EPS0_GRVW8_GSU1_GSUAMB_LBSPP128_LPB8_LRVW8_NLCA1_PGR2_PLR9_SU0_SUS0_SRVW4_TT1_64_TLDS1_VAW2_WSGRA1_WSGRB1_WG64_4_1_WGM1
    SolutionIndex: 21
    SolutionNameMin: Cijk_Ailk_Bljk_HHS_BH_MT128x96x32_MI32x32x8x1_SE_1LDSB1_AF0EM8_EPS1_GRVW2_GSU1_GSUAMB_LBSPP128_LPB8_LRVW8_NLCA1_PGR1_PLR5_SU32_SUS128_SRVW4_TT1_96_TLDS1_VAW2_WSGRA1_WSGRB1_WG128_2_1_WGM15
    SolutionIndex: 22
    SolutionNameMin: Cijk_Ailk_Bljk_HHS_BH_MT128x64x32_MI32x32x8x1_SE_1LDSB0_AF0EM8_EPS0_GRVW8_GSU1_GSUAMB_LBSPP128_LPB8_LRVW8_NLCA1_PGR2_PLR5_SU0_SUS0_SRVW4_TT2_32_TLDS1_VAW2_WSGRA1_WSGRB1_WG64_4_1_WGM1
    SolutionIndex: 23
    SolutionNameMin: Cijk_Ailk_Bljk_HHS_BH_MT96x128x32_MI32x32x8x1_SE_1LDSB0_AF0EM8_EPS0_GRVW4_GSU1_GSUAMB_LBSPP128_LPB8_LRVW8_NLCA3_PGR2_PLR5_SU32_SUS128_SRVW0_TT3_32_TLDS1_VAW2_WSGRA1_WSGRB1_WG32_8_1_WGM1
    SolutionIndex: 24
    SolutionNameMin: Cijk_Ailk_Bljk_HHS_BH_MT128x192x32_MI32x32x8x1_SE_1LDSB0_AF0EM8_EPS0_GRVW8_GSU1_GSUAMB_LBSPP128_LPB8_LRVW8_NLCA1_PGR2_PLR5_SU0_SUS0_SRVW4_TT2_96_TLDS1_VAW2_WSGRA1_WSGRB1_WG64_4_1_WGM15
    SolutionIndex: 25
    SolutionNameMin: Cijk_Ailk_Bljk_HHS_BH_MT128x96x32_MI32x32x8x1_SE_1LDSB1_AF0EM8_EPS1_GRVW2_GSU1_GSUAMB_LBSPP128_LPB8_LRVW8_NLCA1_PGR1_PLR5_SU0_SUS0_SRVW4_TT1_96_TLDS1_VAW2_WSGRA1_WSGRB1_WG128_2_1_WGM1
    SolutionIndex: 26
    SolutionNameMin: Cijk_Ailk_Bljk_HHS_BH_MT64x64x32_MI32x32x8x1_SE_1LDSB0_AF0EM8_EPS0_GRVW8_GSU1_GSUAMB_LBSPP128_LPB8_LRVW8_NLCA1_PGR2_PLR5_SU0_SUS0_SRVW4_TT1_32_TLDS1_VAW2_WSGRA1_WSGRB1_WG64_4_1_WGM1
    SolutionIndex: 27
    SolutionNameMin: Cijk_Ailk_Bljk_HHS_BH_MT128x256x32_MI32x32x8x1_SE_1LDSB1_AF0EM8_EPS0_GRVW8_GSU1_GSUAMB_LBSPP128_LPB8_LRVW8_NLCA1_PGR2_PLR5_SU0_SUS0_SRVW4_TT2_128_TLDS1_VAW2_WSGRA1_WSGRB1_WG64_4_1_WGM2
    SolutionIndex: 28
    SolutionNameMin: Cijk_Ailk_Bljk_HHS_BH_MT16x64x64_MI16x16x16x1_SE_1LDSB0_AF0EM8_EPS0_GRVW8_GSU1_GSUAMB_LBSPP128_LPB16_LRVW8_NLCA1_PGR2_PLR5_SU0_SUS0_SRVW0_TT1_16_TLDS1_VAW2_WSGRA1_WSGRB1_WG16_16_1_WGM15
    SolutionIndex: 29
    SolutionNameMin: Cijk_Ailk_Bljk_HHS_BH_MT128x128x32_MI32x32x8x1_SE_1LDSB0_AF0EM8_EPS0_GRVW8_GSU1_GSUAMB_LBSPP128_LPB8_LRVW8_NLCA1_PGR2_PLR5_SU32_SUS256_SRVW4_TT2_64_TLDS1_VAW2_WSGRA1_WSGRB1_WG64_4_1_WGM1
    SolutionIndex: 30
    SolutionNameMin: Cijk_Ailk_Bljk_HHS_BH_MT64x64x64_MI32x32x8x1_SE_1LDSB0_AF0EM8_EPS0_GRVW8_GSU1_GSUAMB_LBSPP128_LPB8_LRVW8_NLCA1_PGR2_PLR9_SU0_SUS0_SRVW4_TT1_32_TLDS1_VAW2_WSGRA1_WSGRB1_WG64_4_1_WGM2
    SolutionIndex: 31
    SolutionNameMin: Cijk_Ailk_Bljk_HHS_BH_MT256x160x32_MI32x32x8x1_SE_1LDSB0_AF0EM8_EPS0_GRVW4_GSU1_GSUAMB_LBSPP128_LPB8_LRVW8_NLCA1_PGR2_PLR5_SU0_SUS0_SRVW4_TT2_160_TLDS1_VAW2_WSGRA1_WSGRB1_WG128_2_1_WGM15
    SolutionIndex: 32
    SolutionNameMin: Cijk_Ailk_Bljk_HHS_BH_MT16x64x64_MI16x16x16x1_SE_1LDSB0_AF0EM8_EPS0_GRVW8_GSU1_GSUAMB_LBSPP128_LPB16_LRVW8_NLCA1_PGR2_PLR5_SU0_SUS0_SRVW0_TT1_16_TLDS1_VAW2_WSGRA1_WSGRB1_WG16_16_1_WGM1
    SolutionIndex: 33
    SolutionNameMin: Cijk_Ailk_Bljk_HHS_BH_MT128x128x32_MI32x32x8x1_SE_1LDSB0_AF0EM8_EPS0_GRVW8_GSU1_GSUAMB_LBSPP128_LPB8_LRVW8_NLCA1_PGR2_PLR5_SU0_SUS0_SRVW4_TT2_64_TLDS1_VAW2_WSGRA1_WSGRB1_WG64_4_1_WGM15
    SolutionIndex: 34
    SolutionNameMin: Cijk_Ailk_Bljk_HHS_BH_MT64x64x64_MI32x32x8x1_SE_1LDSB0_AF0EM1_EPS0_GRVW8_GSU1_GSUAMB_LBSPP128_LPB8_LRVW8_NLCA1_PGR2_PLR9_SU0_SUS0_SRVW4_TT1_32_TLDS1_VAW2_WSGRA1_WSGRB1_WG64_4_1_WGM1
    SolutionIndex: 35
    SolutionNameMin: Cijk_Ailk_Bljk_HHS_BH_MT128x128x32_MI32x32x8x1_SE_1LDSB1_AF0EM8_EPS1_GRVW2_GSU1_GSUAMB_LBSPP128_LPB8_LRVW8_NLCA1_PGR1_PLR5_SU32_SUS128_SRVW4_TT2_64_TLDS1_VAW2_WSGRA1_WSGRB1_WG64_4_1_WGM15
    SolutionIndex: 36
    SolutionNameMin: Cijk_Ailk_Bljk_HHS_BH_MT128x144x32_MI16x16x16x1_SE_1LDSB1_AF0EM8_EPS1_GRVW2_GSU1_GSUAMB_LBSPP128_LPB16_LRVW8_NLCA1_PGR1_PLR2_SU32_SUS256_SRVW4_TT2_144_TLDS1_VAW2_WSGRA1_WSGRB1_WG64_4_1_WGM1
    SolutionIndex: 37
    SolutionNameMin: Cijk_Ailk_Bljk_HHS_BH_MT128x64x32_MI32x32x8x1_SE_1LDSB0_AF0EM8_EPS0_GRVW8_GSU1_GSUAMB_LBSPP128_LPB8_LRVW8_NLCA1_PGR2_PLR5_SU0_SUS0_SRVW4_TT2_32_TLDS1_VAW2_WSGRA1_WSGRB1_WG64_4_1_WGM15
    SolutionIndex: 38
    SolutionNameMin: Cijk_Ailk_Bljk_HHS_BH_MT128x96x32_MI32x32x8x1_SE_1LDSB1_AF0EM8_EPS1_GRVW2_GSU1_GSUAMB_LBSPP128_LPB8_LRVW8_NLCA1_PGR1_PLR5_SU32_SUS128_SRVW4_TT1_96_TLDS1_VAW2_WSGRA1_WSGRB1_WG128_2_1_WGM1
    SolutionIndex: 39
    SolutionNameMin: Cijk_Ailk_Bljk_HHS_BH_MT64x64x32_MI32x32x8x1_SE_1LDSB0_AF0EM8_EPS0_GRVW8_GSU1_GSUAMB_LBSPP128_LPB8_LRVW8_NLCA1_PGR2_PLR5_SU0_SUS0_SRVW4_TT1_32_TLDS1_VAW2_WSGRA1_WSGRB1_WG64_4_1_WGM2
    SolutionIndex: 40
    SolutionNameMin: Cijk_Ailk_Bljk_HHS_BH_MT128x96x32_MI32x32x8x1_SE_1LDSB0_AF0EM8_EPS1_GRVW4_GSU1_GSUAMB_LBSPP128_LPB8_LRVW8_NLCA1_PGR1_PLR5_SU0_SUS0_SRVW4_TT1_96_TLDS1_VAW2_WSGRA1_WSGRB1_WG128_2_1_WGM1
    SolutionIndex: 41
    SolutionNameMin: Cijk_Ailk_Bljk_HHS_BH_MT128x96x32_MI32x32x8x1_SE_1LDSB0_AF0EM8_EPS1_GRVW4_GSU1_GSUAMB_LBSPP128_LPB8_LRVW8_NLCA1_PGR1_PLR5_SU32_SUS256_SRVW4_TT1_96_TLDS1_VAW2_WSGRA1_WSGRB1_WG128_2_1_WGM2
    SolutionIndex: 42
    SolutionNameMin: Cijk_Ailk_Bljk_HHS_BH_MT64x64x64_MI32x32x8x1_SE_1LDSB0_AF0EM8_EPS0_GRVW8_GSU1_GSUAMB_LBSPP128_LPB8_LRVW8_NLCA1_PGR2_PLR9_SU0_SUS0_SRVW4_TT1_32_TLDS1_VAW2_WSGRA1_WSGRB1_WG64_4_1_WGM15
    SolutionIndex: 43
    SolutionNameMin: Cijk_Ailk_Bljk_HHS_BH_MT64x128x32_MI32x32x8x1_SE_1LDSB0_AF0EM8_EPS1_GRVW8_GSU1_GSUAMB_LBSPP128_LPB8_LRVW8_NLCA1_PGR1_PLR5_SU0_SUS0_SRVW4_TT1_64_TLDS1_VAW2_WSGRA1_WSGRB1_WG64_4_1_WGM1
    SolutionIndex: 44
    SolutionNameMin: Cijk_Ailk_Bljk_HHS_BH_MT64x64x64_MI32x32x8x1_SE_1LDSB0_AF0EM8_EPS0_GRVW8_GSU1_GSUAMB_LBSPP128_LPB8_LRVW8_NLCA1_PGR2_PLR9_SU0_SUS0_SRVW4_TT1_32_TLDS1_VAW2_WSGRA1_WSGRB1_WG64_4_1_WGM1
    SolutionIndex: 45
    SolutionNameMin: Cijk_Ailk_Bljk_HHS_BH_MT128x160x32_MI32x32x8x1_SE_1LDSB0_AF0EM8_EPS0_GRVW4_GSU1_GSUAMB_LBSPP128_LPB8_LRVW8_NLCA1_PGR2_PLR5_SU32_SUS128_SRVW4_TT1_160_TLDS1_VAW2_WSGRA1_WSGRB1_WG128_2_1_WGM2
    SolutionIndex: 46
    SolutionNameMin: Cijk_Ailk_Bljk_HHS_BH_MT32x64x64_MI16x16x16x1_SE_1LDSB0_AF0EM8_EPS1_GRVW8_GSU1_GSUAMB_LBSPP128_LPB16_LRVW8_NLCA1_PGR1_PLR5_SU0_SUS0_SRVW4_TT1_32_TLDS1_VAW2_WSGRA1_WSGRB1_WG32_8_1_WGM1
    SolutionIndex: 47
    SolutionNameMin: Cijk_Ailk_Bljk_HHS_BH_MT128x128x32_MI32x32x8x1_SE_1LDSB0_AF0EM8_EPS0_GRVW8_GSU1_GSUAMB_LBSPP128_LPB8_LRVW8_NLCA1_PGR2_PLR5_SU32_SUS128_SRVW4_TT2_64_TLDS1_VAW2_WSGRA1_WSGRB1_WG64_4_1_WGM2
    SolutionIndex: 48
    SolutionNameMin: Cijk_Ailk_Bljk_HHS_BH_MT128x96x32_MI32x32x8x1_SE_1LDSB1_AF0EM8_EPS1_GRVW2_GSU1_GSUAMB_LBSPP128_LPB8_LRVW8_NLCA1_PGR1_PLR5_SU32_SUS256_SRVW4_TT1_96_TLDS1_VAW2_WSGRA1_WSGRB1_WG128_2_1_WGM1
    SolutionIndex: 49
    SolutionNameMin: Cijk_Ailk_Bljk_HHS_BH_MT128x96x64_MI32x32x8x1_SE_1LDSB0_AF0EM8_EPS0_GRVW8_GSU1_GSUAMB_LBSPP128_LPB8_LRVW8_NLCA1_PGR2_PLR9_SU0_SUS0_SRVW4_TT1_96_TLDS1_VAW2_WSGRA1_WSGRB1_WG128_2_1_WGM1
    SolutionIndex: 50
    SolutionNameMin: Cijk_Ailk_Bljk_HHS_BH_MT32x32x32_MI16x16x16x1_SE_1LDSB0_AF0EM8_EPS0_GRVW8_GSU1_GSUAMB_LBSPP128_LPB16_LRVW8_NLCA1_PGR2_PLR2_SU0_SUS0_SRVW4_TT1_16_TLDS1_VAW2_WSGRA1_WSGRB1_WG32_8_1_WGM1
    SolutionIndex: 51
    SolutionNameMin: Cijk_Ailk_Bljk_HHS_BH_MT64x16x32_MI16x16x16x1_SE_1LDSB0_AF0EM8_EPS0_GRVW8_GSU1_GSUAMB_LBSPP128_LPB16_LRVW8_NLCA1_PGR2_PLR2_SU0_SUS0_SRVW0_TT1_16_TLDS1_VAW2_WSGRA1_WSGRB1_WG64_4_1_WGM15
    SolutionIndex: 52
    SolutionNameMin: Cijk_Ailk_Bljk_HHS_BH_MT64x16x32_MI16x16x16x1_SE_1LDSB0_AF0EM8_EPS0_GRVW2_GSU1_GSUAMB_LBSPP128_LPB16_LRVW8_NLCA1_PGR2_PLR2_SU0_SUS0_SRVW0_TT1_16_TLDS1_VAW2_WSGRA1_WSGRB1_WG64_4_1_WGM1
    SolutionIndex: 53
    SolutionNameMin: Cijk_Ailk_Bljk_HHS_BH_MT32x32x64_MI16x16x16x1_SE_1LDSB0_AF0EM8_EPS0_GRVW8_GSU1_GSUAMB_LBSPP128_LPB16_LRVW8_NLCA1_PGR2_PLR5_SU32_SUS128_SRVW4_TT1_16_TLDS1_VAW2_WSGRA1_WSGRB1_WG32_8_1_WGM2
    SolutionIndex: 54
    SolutionNameMin: Cijk_Ailk_Bljk_HHS_BH_MT32x64x64_MI16x16x16x1_SE_1LDSB0_AF0EM8_EPS0_GRVW8_GSU1_GSUAMB_LBSPP128_LPB16_LRVW8_NLCA1_PGR2_PLR5_SU32_SUS128_SRVW4_TT1_32_TLDS1_VAW2_WSGRA1_WSGRB1_WG32_8_1_WGM1
    SolutionIndex: 55
    SolutionNameMin: Cijk_Ailk_Bljk_HHS_BH_MT16x16x64_MI16x16x16x1_SE_1LDSB0_AF0EM8_EPS0_GRVW8_GSU1_GSUAMB_LBSPP128_LPB16_LRVW8_NLCA1_PGR2_PLR5_SU32_SUS128_SRVW0_TT1_16_TLDS1_VAW2_WSGRA1_WSGRB1_WG16_4_1_WGM2
    SolutionIndex: 56
    SolutionNameMin: Cijk_Ailk_Bljk_HHS_BH_MT128x256x32_MI32x32x8x1_SE_1LDSB1_AF0EM8_EPS0_GRVW8_GSU1_GSUAMB_LBSPP128_LPB8_LRVW8_NLCA1_PGR2_PLR5_SU0_SUS0_SRVW4_TT2_128_TLDS1_VAW2_WSGRA1_WSGRB1_WG64_4_1_WGM15
    SolutionIndex: 57
    SolutionNameMin: Cijk_Ailk_Bljk_HHS_BH_MT64x128x64_MI32x32x8x1_SE_1LDSB0_AF0EM8_EPS0_GRVW8_GSU1_GSUAMB_LBSPP128_LPB8_LRVW8_NLCA1_PGR2_PLR9_SU0_SUS0_SRVW4_TT1_64_TLDS1_VAW2_WSGRA1_WSGRB1_WG64_4_1_WGM2
    SolutionIndex: 58
    SolutionNameMin: Cijk_Ailk_Bljk_HHS_BH_MT128x128x32_MI32x32x8x1_SE_1LDSB1_AF0EM8_EPS1_GRVW2_GSU1_GSUAMB_LBSPP128_LPB8_LRVW8_NLCA1_PGR1_PLR5_SU0_SUS0_SRVW4_TT2_64_TLDS1_VAW2_WSGRA1_WSGRB1_WG64_4_1_WGM1
    SolutionIndex: 59
    SolutionNameMin: Cijk_Ailk_Bljk_HHS_BH_MT64x128x64_MI32x32x8x1_SE_1LDSB0_AF0EM8_EPS0_GRVW8_GSU1_GSUAMB_LBSPP128_LPB8_LRVW8_NLCA1_PGR2_PLR9_SU32_SUS256_SRVW4_TT1_64_TLDS1_VAW2_WSGRA1_WSGRB1_WG64_4_1_WGM2
    SolutionIndex: 60
    SolutionNameMin: Cijk_Ailk_Bljk_HHS_BH_MT128x96x32_MI32x32x8x1_SE_1LDSB1_AF0EM8_EPS1_GRVW2_GSU1_GSUAMB_LBSPP128_LPB8_LRVW8_NLCA1_PGR1_PLR5_SU0_SUS0_SRVW4_TT1_96_TLDS1_VAW2_WSGRA1_WSGRB1_WG128_2_1_WGM15
    SolutionIndex: 61
    SolutionNameMin: Cijk_Ailk_Bljk_HHS_BH_MT16x16x64_MI16x16x16x1_SE_1LDSB0_AF0EM8_EPS0_GRVW8_GSU1_GSUAMB_LBSPP128_LPB16_LRVW8_NLCA1_PGR2_PLR5_SU32_SUS256_SRVW0_TT1_16_TLDS1_VAW2_WSGRA1_WSGRB1_WG16_4_1_WGM1
    SolutionIndex: 62
    SolutionNameMin: Cijk_Ailk_Bljk_HHS_BH_MT128x256x32_MI32x32x8x1_SE_1LDSB1_AF0EM1_EPS0_GRVW8_GSU1_GSUAMB_LBSPP128_LPB8_LRVW8_NLCA1_PGR2_PLR5_SU32_SUS128_SRVW4_TT2_128_TLDS1_VAW2_WSGRA1_WSGRB1_WG64_4_1_WGM2
    SolutionIndex: 63
    SolutionNameMin: Cijk_Ailk_Bljk_HHS_BH_MT128x96x32_MI32x32x8x1_SE_1LDSB1_AF0EM8_EPS1_GRVW2_GSU1_GSUAMB_LBSPP128_LPB8_LRVW8_NLCA1_PGR1_PLR5_SU32_SUS256_SRVW4_TT1_96_TLDS1_VAW2_WSGRA1_WSGRB1_WG128_2_1_WGM15
    SolutionIndex: 64
    SolutionNameMin: Cijk_Ailk_Bljk_HHS_BH_MT128x128x32_MI32x32x8x1_SE_1LDSB0_AF0EM8_EPS0_GRVW8_GSU1_GSUAMB_LBSPP128_LPB8_LRVW8_NLCA1_PGR2_PLR5_SU0_SUS0_SRVW4_TT2_64_TLDS1_VAW2_WSGRA1_WSGRB1_WG64_4_1_WGM1
    SolutionIndex: 65
    SolutionNameMin: Cijk_Ailk_Bljk_HHS_BH_MT128x64x32_MI32x32x8x1_SE_1LDSB0_AF0EM8_EPS0_GRVW8_GSU1_GSUAMB_LBSPP128_LPB8_LRVW8_NLCA1_PGR2_PLR5_SU32_SUS256_SRVW4_TT2_32_TLDS1_VAW2_WSGRA1_WSGRB1_WG64_4_1_WGM15
    SolutionIndex: 66
    SolutionNameMin: Cijk_Ailk_Bljk_HHS_BH_MT16x16x64_MI16x16x16x1_SE_1LDSB0_AF0EM8_EPS0_GRVW4_GSU1_GSUAMB_LBSPP128_LPB16_LRVW8_NLCA1_PGR2_PLR5_SU0_SUS0_SRVW0_TT1_16_TLDS1_VAW2_WSGRA1_WSGRB1_WG16_4_1_WGM1
    SolutionIndex: 67
    SolutionNameMin: Cijk_Ailk_Bljk_HHS_BH_MT128x96x32_MI32x32x8x1_SE_1LDSB1_AF0EM8_EPS1_GRVW2_GSU1_GSUAMB_LBSPP128_LPB8_LRVW8_NLCA1_PGR1_PLR5_SU32_SUS256_SRVW4_TT1_96_TLDS1_VAW2_WSGRA1_WSGRB1_WG128_2_1_WGM2
    SolutionIndex: 68
    SolutionNameMin: Cijk_Ailk_Bljk_HHS_BH_MT128x160x32_MI32x32x8x1_SE_1LDSB0_AF0EM8_EPS0_GRVW4_GSU1_GSUAMB_LBSPP128_LPB8_LRVW8_NLCA1_PGR2_PLR5_SU0_SUS0_SRVW4_TT1_160_TLDS1_VAW2_WSGRA1_WSGRB1_WG128_2_1_WGM2
    SolutionIndex: 69
    SolutionNameMin: Cijk_Ailk_Bljk_HHS_BH_MT32x64x32_MI16x16x16x1_SE_1LDSB1_AF0EM8_EPS1_GRVW2_GSU1_GSUAMB_LBSPP128_LPB16_LRVW8_NLCA1_PGR1_PLR2_SU0_SUS0_SRVW4_TT1_32_TLDS1_VAW2_WSGRA1_WSGRB1_WG32_8_1_WGM15
    SolutionIndex: 70
    SolutionNameMin: Cijk_Ailk_Bljk_HHS_BH_MT128x256x32_MI32x32x8x1_SE_1LDSB1_AF0EM8_EPS1_GRVW8_GSU1_GSUAMB_LBSPP128_LPB8_LRVW8_NLCA1_PGR1_PLR5_SU0_SUS0_SRVW4_TT2_128_TLDS1_VAW2_WSGRA1_WSGRB1_WG64_4_1_WGM1
    SolutionIndex: 71
    SolutionNameMin: Cijk_Ailk_Bljk_HHS_BH_MT256x128x32_MI32x32x8x1_SE_1LDSB0_AF0EM8_EPS0_GRVW8_GSU1_GSUAMB_LBSPP128_LPB8_LRVW8_NLCA1_PGR2_PLR5_SU0_SUS0_SRVW4_TT4_64_TLDS1_VAW2_WSGRA1_WSGRB1_WG64_4_1_WGM2
    SolutionIndex: 72
    SolutionNameMin: Cijk_Ailk_Bljk_HHS_BH_MT128x160x32_MI32x32x8x1_SE_1LDSB0_AF0EM8_EPS0_GRVW4_GSU1_GSUAMB_LBSPP128_LPB8_LRVW8_NLCA1_PGR2_PLR5_SU32_SUS256_SRVW4_TT1_160_TLDS1_VAW2_WSGRA1_WSGRB1_WG128_2_1_WGM1
    SolutionIndex: 73
    SolutionNameMin: Cijk_Ailk_Bljk_HHS_BH_MT128x96x32_MI32x32x8x1_SE_1LDSB1_AF0EM8_EPS1_GRVW2_GSU1_GSUAMB_LBSPP128_LPB8_LRVW8_NLCA1_PGR1_PLR5_SU0_SUS0_SRVW4_TT1_96_TLDS1_VAW2_WSGRA1_WSGRB1_WG128_2_1_WGM2
    SolutionIndex: 74
    SolutionNameMin: Cijk_Ailk_Bljk_HHS_BH_MT128x192x32_MI32x32x8x1_SE_1LDSB0_AF0EM8_EPS0_GRVW8_GSU1_GSUAMB_LBSPP128_LPB8_LRVW8_NLCA1_PGR2_PLR5_SU32_SUS128_SRVW4_TT2_96_TLDS1_VAW2_WSGRA1_WSGRB1_WG64_4_1_WGM15
    SolutionIndex: 75
    SolutionNameMin: Cijk_Ailk_Bljk_HHS_BH_MT256x128x32_MI32x32x8x1_SE_1LDSB1_AF0EM8_EPS0_GRVW8_GSU1_GSUAMB_LBSPP128_LPB8_LRVW8_NLCA1_PGR2_PLR5_SU0_SUS0_SRVW4_TT4_64_TLDS1_VAW2_WSGRA1_WSGRB1_WG64_4_1_WGM15
    SolutionIndex: 76
    SolutionNameMin: Cijk_Ailk_Bljk_HHS_BH_MT128x64x32_MI32x32x8x1_SE_1LDSB0_AF0EM8_EPS0_GRVW8_GSU1_GSUAMB_LBSPP128_LPB8_LRVW8_NLCA1_PGR2_PLR5_SU32_SUS256_SRVW4_TT2_32_TLDS1_VAW2_WSGRA1_WSGRB1_WG64_4_1_WGM2
    SolutionIndex: 77
    SolutionNameMin: Cijk_Ailk_Bljk_HHS_BH_MT64x64x32_MI32x32x8x1_SE_1LDSB0_AF0EM8_EPS0_GRVW2_GSU1_GSUAMB_LBSPP128_LPB8_LRVW8_NLCA1_PGR2_PLR5_SU0_SUS0_SRVW4_TT1_32_TLDS1_VAW2_WSGRA1_WSGRB1_WG64_4_1_WGM2
    SolutionIndex: 78
    SolutionNameMin: Cijk_Ailk_Bljk_HHS_BH_MT128x256x32_MI32x32x8x1_SE_1LDSB1_AF0EM8_EPS1_GRVW8_GSU1_GSUAMB_LBSPP128_LPB8_LRVW8_NLCA1_PGR1_PLR5_SU32_SUS128_SRVW4_TT2_128_TLDS1_VAW2_WSGRA1_WSGRB1_WG64_4_1_WGM1
    SolutionIndex: 79
    SolutionNameMin: Cijk_Ailk_Bljk_HHS_BH_MT256x64x32_MI32x32x8x1_SE_1LDSB0_AF0EM1_EPS0_GRVW8_GSU1_GSUAMB_LBSPP128_LPB8_LRVW8_NLCA1_PGR2_PLR5_SU0_SUS0_SRVW4_TT4_32_TLDS1_VAW2_WSGRA1_WSGRB1_WG64_4_1_WGM1
    SolutionIndex: 80
    SolutionNameMin: Cijk_Ailk_Bljk_HHS_BH_MT64x32x64_MI16x16x16x1_SE_1LDSB0_AF0EM8_EPS0_GRVW8_GSU1_GSUAMB_LBSPP128_LPB16_LRVW8_NLCA1_PGR2_PLR5_SU0_SUS0_SRVW4_TT2_16_TLDS1_VAW2_WSGRA1_WSGRB1_WG32_8_1_WGM1
    SolutionIndex: 81
    SolutionNameMin: Cijk_Ailk_Bljk_HHS_BH_MT128x64x64_MI32x32x8x1_SE_1LDSB0_AF0EM8_EPS0_GRVW8_GSU1_GSUAMB_LBSPP128_LPB8_LRVW8_NLCA1_PGR2_PLR9_SU0_SUS0_SRVW4_TT2_32_TLDS1_VAW2_WSGRA1_WSGRB1_WG64_4_1_WGM15
    SolutionIndex: 82
    SolutionNameMin: Cijk_Ailk_Bljk_HHS_BH_MT64x64x64_MI32x32x8x1_SE_1LDSB0_AF0EM8_EPS0_GRVW8_GSU1_GSUAMB_LBSPP128_LPB8_LRVW8_NLCA1_PGR2_PLR9_SU32_SUS256_SRVW4_TT1_32_TLDS1_VAW2_WSGRA1_WSGRB1_WG64_4_1_WGM1
    SolutionIndex: 83
    SolutionNameMin: Cijk_Ailk_Bljk_HHS_BH_MT128x160x32_MI32x32x8x1_SE_1LDSB0_AF0EM8_EPS0_GRVW4_GSU1_GSUAMB_LBSPP128_LPB8_LRVW8_NLCA1_PGR2_PLR5_SU32_SUS256_SRVW4_TT1_160_TLDS1_VAW2_WSGRA1_WSGRB1_WG128_2_1_WGM2
    SolutionIndex: 84
    SolutionNameMin: Cijk_Ailk_Bljk_HHS_BH_MT64x64x64_MI32x32x8x1_SE_1LDSB0_AF0EM8_EPS0_GRVW8_GSU1_GSUAMB_LBSPP128_LPB8_LRVW8_NLCA1_PGR2_PLR9_SU32_SUS128_SRVW4_TT1_32_TLDS1_VAW2_WSGRA1_WSGRB1_WG64_4_1_WGM1
    SolutionIndex: 85
    SolutionNameMin: Cijk_Ailk_Bljk_HHS_BH_MT128x160x32_MI32x32x8x1_SE_1LDSB0_AF0EM8_EPS0_GRVW4_GSU1_GSUAMB_LBSPP128_LPB8_LRVW8_NLCA1_PGR2_PLR5_SU0_SUS0_SRVW4_TT1_160_TLDS1_VAW2_WSGRA1_WSGRB1_WG128_2_1_WGM15
    SolutionIndex: 86
    SolutionNameMin: Cijk_Ailk_Bljk_HHS_BH_MT32x32x64_MI16x16x16x1_SE_1LDSB0_AF0EM8_EPS0_GRVW8_GSU1_GSUAMB_LBSPP128_LPB16_LRVW8_NLCA1_PGR2_PLR5_SU0_SUS0_SRVW4_TT1_16_TLDS1_VAW2_WSGRA1_WSGRB1_WG32_8_1_WGM1
    SolutionIndex: 87
    SolutionNameMin: Cijk_Ailk_Bljk_HHS_BH_MT128x256x32_MI32x32x8x1_SE_1LDSB1_AF0EM8_EPS0_GRVW8_GSU1_GSUAMB_LBSPP128_LPB8_LRVW8_NLCA1_PGR2_PLR5_SU32_SUS256_SRVW4_TT2_128_TLDS1_VAW2_WSGRA1_WSGRB1_WG64_4_1_WGM1
    SolutionIndex: 88
    SolutionNameMin: Cijk_Ailk_Bljk_HHS_BH_MT16x16x64_MI16x16x16x1_SE_1LDSB0_AF0EM8_EPS0_GRVW8_GSU1_GSUAMB_LBSPP128_LPB16_LRVW8_NLCA1_PGR2_PLR5_SU0_SUS0_SRVW0_TT1_16_TLDS1_VAW2_WSGRA1_WSGRB1_WG16_4_1_WGM1
    SolutionIndex: 89
    SolutionNameMin: Cijk_Ailk_Bljk_HHS_BH_MT128x128x32_MI32x32x8x1_SE_1LDSB1_AF0EM8_EPS1_GRVW2_GSU1_GSUAMB_LBSPP128_LPB8_LRVW8_NLCA1_PGR1_PLR5_SU32_SUS128_SRVW4_TT2_64_TLDS1_VAW2_WSGRA1_WSGRB1_WG64_4_1_WGM1
    SolutionIndex: 90
    SolutionNameMin: Cijk_Ailk_Bljk_HHS_BH_MT128x256x32_MI32x32x8x1_SE_1LDSB0_AF0EM8_EPS0_GRVW8_GSU1_GSUAMB_LBSPP128_LPB8_LRVW8_NLCA1_PGR2_PLR5_SU0_SUS0_SRVW4_TT2_128_TLDS1_VAW2_WSGRA1_WSGRB1_WG64_4_1_WGM15
    SolutionIndex: 91
    SolutionNameMin: Cijk_Ailk_Bljk_HHS_BH_MT192x192x32_MI32x32x8x1_SE_1LDSB0_AF0EM8_EPS0_GRVW8_GSU1_GSUAMB_LBSPP128_LPB8_LRVW8_NLCA3_PGR2_PLR5_SU0_SUS0_SRVW0_TT3_96_TLDS1_VAW2_WSGRA1_WSGRB1_WG64_4_1_WGM1
    SolutionIndex: 92
    SolutionNameMin: Cijk_Ailk_Bljk_HHS_BH_MT64x128x32_MI32x32x8x1_SE_1LDSB0_AF0EM8_EPS1_GRVW8_GSU1_GSUAMB_LBSPP128_LPB8_LRVW8_NLCA1_PGR1_PLR5_SU32_SUS128_SRVW4_TT1_64_TLDS1_VAW2_WSGRA1_WSGRB1_WG64_4_1_WGM1
    SolutionIndex: 93
    SolutionNameMin: Cijk_Ailk_Bljk_HHS_BH_MT64x16x32_MI16x16x16x1_SE_1LDSB0_AF0EM8_EPS0_GRVW4_GSU1_GSUAMB_LBSPP128_LPB16_LRVW8_NLCA1_PGR2_PLR2_SU0_SUS0_SRVW0_TT1_16_TLDS1_VAW2_WSGRA1_WSGRB1_WG64_4_1_WGM1
    SolutionIndex: 94
    SolutionNameMin: Cijk_Ailk_Bljk_HHS_BH_MT128x64x32_MI32x32x8x1_SE_1LDSB0_AF0EM1_EPS0_GRVW8_GSU1_GSUAMB_LBSPP128_LPB8_LRVW8_NLCA1_PGR2_PLR5_SU0_SUS0_SRVW4_TT2_32_TLDS1_VAW2_WSGRA1_WSGRB1_WG64_4_1_WGM1
    SolutionIndex: 95
    SolutionNameMin: Cijk_Ailk_Bljk_HHS_BH_MT192x128x32_MI32x32x8x1_SE_1LDSB0_AF0EM8_EPS0_GRVW4_GSU1_GSUAMB_LBSPP128_LPB8_LRVW8_NLCA3_PGR2_PLR5_SU32_SUS128_SRVW0_TT3_64_TLDS1_VAW2_WSGRA1_WSGRB1_WG64_4_1_WGM1
    SolutionIndex: 96
    SolutionNameMin: Cijk_Ailk_Bljk_HHS_BH_MT256x160x32_MI32x32x8x1_SE_1LDSB0_AF0EM8_EPS1_GRVW4_GSU1_GSUAMB_LBSPP128_LPB8_LRVW8_NLCA1_PGR1_PLR5_SU32_SUS256_SRVW4_TT2_160_TLDS1_VAW2_WSGRA1_WSGRB1_WG128_2_1_WGM15
    SolutionIndex: 97
    SolutionNameMin: Cijk_Ailk_Bljk_HHS_BH_MT128x144x32_MI16x16x16x1_SE_1LDSB1_AF0EM8_EPS1_GRVW2_GSU1_GSUAMB_LBSPP128_LPB16_LRVW8_NLCA1_PGR1_PLR2_SU32_SUS128_SRVW4_TT2_144_TLDS1_VAW2_WSGRA1_WSGRB1_WG64_4_1_WGM2
    SolutionIndex: 98
    SolutionNameMin: Cijk_Ailk_Bljk_HHS_BH_MT128x128x32_MI32x32x8x1_SE_1LDSB0_AF0EM8_EPS0_GRVW8_GSU1_GSUAMB_LBSPP128_LPB8_LRVW8_NLCA1_PGR2_PLR5_SU32_SUS256_SRVW4_TT2_64_TLDS1_VAW2_WSGRA1_WSGRB1_WG64_4_1_WGM15
    SolutionIndex: 99
    SolutionNameMin: Cijk_Ailk_Bljk_HHS_BH_MT64x16x32_MI16x16x16x1_SE_1LDSB0_AF0EM8_EPS1_GRVW2_GSU1_GSUAMB_LBSPP128_LPB16_LRVW8_NLCA1_PGR1_PLR2_SU0_SUS0_SRVW0_TT1_16_TLDS1_VAW2_WSGRA1_WSGRB1_WG64_4_1_WGM1
    SolutionIndex: 100
    SolutionNameMin: Cijk_Ailk_Bljk_HHS_BH_MT128x144x32_MI16x16x16x1_SE_1LDSB1_AF0EM8_EPS0_GRVW2_GSU1_GSUAMB_LBSPP128_LPB16_LRVW8_NLCA1_PGR2_PLR2_SU0_SUS0_SRVW4_TT2_144_TLDS1_VAW2_WSGRA1_WSGRB1_WG64_4_1_WGM15
    SolutionIndex: 101
    SolutionNameMin: Cijk_Ailk_Bljk_HHS_BH_MT192x256x32_MI32x32x8x1_SE_1LDSB0_AF0EM8_EPS1_GRVW8_GSU1_GSUAMB_LBSPP128_LPB8_LRVW8_NLCA3_PGR1_PLR5_SU32_SUS256_SRVW0_TT3_128_TLDS1_VAW2_WSGRA1_WSGRB1_WG64_4_1_WGM1
    SolutionIndex: 102
    SolutionNameMin: Cijk_Ailk_Bljk_HHS_BH_MT128x256x32_MI32x32x8x1_SE_1LDSB0_AF0EM8_EPS0_GRVW8_GSU1_GSUAMB_LBSPP128_LPB8_LRVW8_NLCA1_PGR2_PLR5_SU32_SUS128_SRVW4_TT2_128_TLDS1_VAW2_WSGRA1_WSGRB1_WG64_4_1_WGM2
    SolutionIndex: 103
    SolutionNameMin: Cijk_Ailk_Bljk_HHS_BH_MT128x128x32_MI32x32x8x1_SE_1LDSB1_AF0EM8_EPS1_GRVW2_GSU1_GSUAMB_LBSPP128_LPB8_LRVW8_NLCA1_PGR1_PLR5_SU32_SUS256_SRVW4_TT2_64_TLDS1_VAW2_WSGRA1_WSGRB1_WG64_4_1_WGM1
    SolutionIndex: 104
    SolutionNameMin: Cijk_Ailk_Bljk_HHS_BH_MT64x128x32_MI32x32x8x1_SE_1LDSB0_AF0EM8_EPS1_GRVW8_GSU1_GSUAMB_LBSPP128_LPB8_LRVW8_NLCA1_PGR1_PLR5_SU32_SUS256_SRVW4_TT1_64_TLDS1_VAW2_WSGRA1_WSGRB1_WG64_4_1_WGM2
    SolutionIndex: 105
    SolutionNameMin: Cijk_Ailk_Bljk_HHS_BH_MT64x128x32_MI32x32x8x1_SE_1LDSB0_AF0EM8_EPS0_GRVW8_GSU1_GSUAMB_LBSPP128_LPB8_LRVW8_NLCA1_PGR2_PLR5_SU32_SUS256_SRVW4_TT1_64_TLDS1_VAW2_WSGRA1_WSGRB1_WG64_4_1_WGM15
    SolutionIndex: 106
    SolutionNameMin: Cijk_Ailk_Bljk_HHS_BH_MT128x256x32_MI32x32x8x1_SE_1LDSB1_AF0EM8_EPS0_GRVW8_GSU1_GSUAMB_LBSPP128_LPB8_LRVW8_NLCA1_PGR2_PLR5_SU32_SUS128_SRVW4_TT2_128_TLDS1_VAW2_WSGRA1_WSGRB1_WG64_4_1_WGM1
    SolutionIndex: 107
    SolutionNameMin: Cijk_Ailk_Bljk_HHS_BH_MT64x128x32_MI32x32x8x1_SE_1LDSB0_AF0EM8_EPS0_GRVW8_GSU1_GSUAMB_LBSPP128_LPB8_LRVW8_NLCA1_PGR2_PLR5_SU32_SUS256_SRVW4_TT1_64_TLDS1_VAW2_WSGRA1_WSGRB1_WG64_4_1_WGM2
    SolutionIndex: 108
    SolutionNameMin: Cijk_Ailk_Bljk_HHS_BH_MT256x192x32_MI32x32x8x1_SE_1LDSB1_AF0EM8_EPS0_GRVW8_GSU1_GSUAMB_LBSPP128_LPB8_LRVW8_NLCA1_PGR2_PLR5_SU0_SUS0_SRVW4_TT4_96_TLDS1_VAW2_WSGRA1_WSGRB1_WG64_4_1_WGM1
    SolutionIndex: 109
    SolutionNameMin: Cijk_Ailk_Bljk_HHS_BH_MT32x64x32_MI16x16x16x1_SE_1LDSB0_AF0EM8_EPS0_GRVW8_GSU1_GSUAMB_LBSPP128_LPB16_LRVW8_NLCA1_PGR2_PLR2_SU32_SUS128_SRVW4_TT1_32_TLDS1_VAW2_WSGRA1_WSGRB1_WG32_8_1_WGM15
    SolutionIndex: 110
    SolutionNameMin: Cijk_Ailk_Bljk_HHS_BH_MT64x16x32_MI16x16x16x1_SE_1LDSB0_AF0EM8_EPS0_GRVW8_GSU1_GSUAMB_LBSPP128_LPB16_LRVW8_NLCA1_PGR2_PLR2_SU0_SUS0_SRVW0_TT1_16_TLDS1_VAW2_WSGRA1_WSGRB1_WG64_4_1_WGM1
    SolutionIndex: 111
    SolutionNameMin: Cijk_Ailk_Bljk_HHS_BH_MT128x144x32_MI16x16x16x1_SE_1LDSB1_AF0EM8_EPS1_GRVW2_GSU1_GSUAMB_LBSPP128_LPB16_LRVW8_NLCA1_PGR1_PLR2_SU32_SUS256_SRVW4_TT2_144_TLDS1_VAW2_WSGRA1_WSGRB1_WG64_4_1_WGM15
    SolutionIndex: 112
    SolutionNameMin: Cijk_Ailk_Bljk_HHS_BH_MT128x128x32_MI32x32x8x1_SE_1LDSB0_AF0EM1_EPS0_GRVW8_GSU1_GSUAMB_LBSPP128_LPB8_LRVW8_NLCA1_PGR2_PLR5_SU32_SUS128_SRVW4_TT2_64_TLDS1_VAW2_WSGRA1_WSGRB1_WG64_4_1_WGM2
    SolutionIndex: 113
    SolutionNameMin: Cijk_Ailk_Bljk_HHS_BH_MT128x256x32_MI32x32x8x1_SE_1LDSB1_AF0EM1_EPS0_GRVW8_GSU1_GSUAMB_LBSPP128_LPB8_LRVW8_NLCA1_PGR2_PLR5_SU0_SUS0_SRVW4_TT2_128_TLDS1_VAW2_WSGRA1_WSGRB1_WG64_4_1_WGM1
    SolutionIndex: 114
    SolutionNameMin: Cijk_Ailk_Bljk_HHS_BH_MT64x128x32_MI32x32x8x1_SE_1LDSB0_AF0EM8_EPS0_GRVW8_GSU1_GSUAMB_LBSPP128_LPB8_LRVW8_NLCA1_PGR2_PLR5_SU32_SUS128_SRVW4_TT1_64_TLDS1_VAW2_WSGRA1_WSGRB1_WG64_4_1_WGM1
    SolutionIndex: 115
    SolutionNameMin: Cijk_Ailk_Bljk_HHS_BH_MT160x128x32_MI32x32x8x1_SE_1LDSB0_AF0EM8_EPS0_GRVW4_GSU1_GSUAMB_LBSPP128_LPB8_LRVW8_NLCA5_PGR2_PLR5_SU32_SUS256_SRVW0_TT5_32_TLDS1_VAW2_WSGRA1_WSGRB1_WG32_8_1_WGM15
    SolutionIndex: 116
    SolutionNameMin: Cijk_Ailk_Bljk_HHS_BH_MT32x32x64_MI16x16x16x1_SE_1LDSB0_AF0EM8_EPS0_GRVW8_GSU1_GSUAMB_LBSPP128_LPB16_LRVW8_NLCA1_PGR2_PLR5_SU0_SUS0_SRVW4_TT1_16_TLDS1_VAW2_WSGRA1_WSGRB1_WG32_8_1_WGM2
    SolutionIndex: 117
    SolutionNameMin: Cijk_Ailk_Bljk_HHS_BH_MT128x160x32_MI32x32x8x1_SE_1LDSB1_AF0EM8_EPS1_GRVW2_GSU1_GSUAMB_LBSPP128_LPB8_LRVW8_NLCA1_PGR1_PLR5_SU32_SUS256_SRVW4_TT1_160_TLDS1_VAW2_WSGRA1_WSGRB1_WG128_2_1_WGM15
    SolutionIndex: 118
    SolutionNameMin: Cijk_Ailk_Bljk_HHS_BH_MT128x256x32_MI32x32x8x1_SE_1LDSB1_AF0EM8_EPS1_GRVW8_GSU1_GSUAMB_LBSPP128_LPB8_LRVW8_NLCA1_PGR1_PLR5_SU32_SUS128_SRVW4_TT2_128_TLDS1_VAW2_WSGRA1_WSGRB1_WG64_4_1_WGM2
    SolutionIndex: 119
    SolutionNameMin: Cijk_Ailk_Bljk_HHS_BH_MT32x32x64_MI16x16x16x1_SE_1LDSB0_AF0EM8_EPS0_GRVW8_GSU1_GSUAMB_LBSPP128_LPB16_LRVW8_NLCA1_PGR2_PLR5_SU32_SUS256_SRVW4_TT1_16_TLDS1_VAW2_WSGRA1_WSGRB1_WG32_8_1_WGM2
    SolutionIndex: 120
    SolutionNameMin: Cijk_Ailk_Bljk_HHS_BH_MT64x32x32_MI16x16x16x1_SE_1LDSB1_AF0EM8_EPS1_GRVW2_GSU1_GSUAMB_LBSPP128_LPB16_LRVW8_NLCA1_PGR1_PLR2_SU0_SUS0_SRVW4_TT2_16_TLDS1_VAW2_WSGRA1_WSGRB1_WG32_8_1_WGM15
    SolutionIndex: 121
    SolutionNameMin: Cijk_Ailk_Bljk_HHS_BH_MT64x16x64_MI16x16x16x1_SE_1LDSB0_AF0EM8_EPS0_GRVW2_GSU1_GSUAMB_LBSPP128_LPB16_LRVW8_NLCA1_PGR2_PLR5_SU0_SUS0_SRVW0_TT1_16_TLDS1_VAW2_WSGRA1_WSGRB1_WG64_4_1_WGM2
    SolutionIndex: 122
    SolutionNameMin: Cijk_Ailk_Bljk_HHS_BH_MT128x64x64_MI32x32x8x1_SE_1LDSB0_AF0EM8_EPS1_GRVW8_GSU15_GSUAMB_LBSPP128_LPB8_LRVW8_NLCA1_PGR1_PLR9_SU0_SUS0_SRVW0_TT2_32_TLDS1_VAW1_WSGRA1_WSGRB1_WG64_4_1_WGM1
    SolutionIndex: 123
    SolutionNameMin: Cijk_Ailk_Bljk_HHS_BH_MT16x64x64_MI16x16x16x1_SE_1LDSB0_AF0EM8_EPS0_GRVW8_GSU1_GSUAMB_LBSPP128_LPB16_LRVW8_NLCA1_PGR2_PLR5_SU32_SUS256_SRVW0_TT1_16_TLDS1_VAW2_WSGRA1_WSGRB1_WG16_16_1_WGM1
    SolutionIndex: 124
    SolutionNameMin: Cijk_Ailk_Bljk_HHS_BH_MT64x128x32_MI32x32x8x1_SE_1LDSB0_AF0EM8_EPS1_GRVW8_GSU1_GSUAMB_LBSPP128_LPB8_LRVW8_NLCA1_PGR1_PLR5_SU0_SUS0_SRVW4_TT1_64_TLDS1_VAW2_WSGRA1_WSGRB1_WG64_4_1_WGM15
    SolutionIndex: 125
    SolutionNameMin: Cijk_Ailk_Bljk_HHS_BH_MT128x128x32_MI32x32x8x1_SE_1LDSB1_AF0EM8_EPS1_GRVW2_GSU1_GSUAMB_LBSPP128_LPB8_LRVW8_NLCA1_PGR1_PLR5_SU0_SUS0_SRVW4_TT2_64_TLDS1_VAW2_WSGRA1_WSGRB1_WG64_4_1_WGM2
    SolutionIndex: 126
    SolutionNameMin: Cijk_Ailk_Bljk_HHS_BH_MT256x192x32_MI32x32x8x1_SE_1LDSB1_AF0EM8_EPS1_GRVW8_GSU1_GSUAMB_LBSPP128_LPB8_LRVW8_NLCA1_PGR1_PLR5_SU0_SUS0_SRVW4_TT4_96_TLDS1_VAW2_WSGRA1_WSGRB1_WG64_4_1_WGM1
    SolutionIndex: 127
    SolutionNameMin: Cijk_Ailk_Bljk_HHS_BH_MT128x64x64_MI32x32x8x1_SE_1LDSB0_AF0EM1_EPS0_GRVW8_GSU1_GSUAMB_LBSPP128_LPB8_LRVW8_NLCA1_PGR2_PLR9_SU32_SUS256_SRVW4_TT2_32_TLDS1_VAW2_WSGRA1_WSGRB1_WG64_4_1_WGM15
    SolutionIndex: 128
    SolutionNameMin: Cijk_Ailk_Bljk_HHS_BH_MT64x128x32_MI32x32x8x1_SE_1LDSB0_AF0EM1_EPS0_GRVW4_GSU1_GSUAMB_LBSPP128_LPB8_LRVW8_NLCA1_PGR2_PLR5_SU0_SUS0_SRVW4_TT1_64_TLDS1_VAW2_WSGRA1_WSGRB1_WG64_4_1_WGM15
    SolutionIndex: 129
    SolutionNameMin: Cijk_Ailk_Bljk_HHS_BH_MT96x128x64_MI32x32x8x1_SE_1LDSB0_AF0EM1_EPS0_GRVW8_GSU1_GSUAMB_LBSPP128_LPB8_LRVW8_NLCA3_PGR2_PLR9_SU0_SUS0_SRVW0_TT3_32_TLDS1_VAW2_WSGRA1_WSGRB1_WG32_8_1_WGM1
    SolutionIndex: 130
    SolutionNameMin: Cijk_Ailk_Bljk_HHS_BH_MT128x64x64_MI32x32x8x1_SE_1LDSB0_AF0EM8_EPS1_GRVW8_GSU15_GSUAMB_LBSPP128_LPB8_LRVW8_NLCA1_PGR1_PLR9_SU32_SUS256_SRVW0_TT2_32_TLDS1_VAW1_WSGRA1_WSGRB1_WG64_4_1_WGM2
    SolutionIndex: 131
    SolutionNameMin: Cijk_Ailk_Bljk_HHS_BH_MT64x16x64_MI16x16x16x1_SE_1LDSB0_AF0EM8_EPS0_GRVW2_GSU1_GSUAMB_LBSPP128_LPB16_LRVW8_NLCA1_PGR2_PLR5_SU0_SUS0_SRVW0_TT1_16_TLDS1_VAW2_WSGRA1_WSGRB1_WG64_4_1_WGM1
    SolutionIndex: 132
    SolutionNameMin: Cijk_Ailk_Bljk_HHS_BH_MT128x64x64_MI32x32x8x1_SE_1LDSB0_AF0EM8_EPS1_GRVW8_GSU7_GSUAMB_LBSPP128_LPB8_LRVW8_NLCA1_PGR1_PLR9_SU0_SUS0_SRVW0_TT2_32_TLDS1_VAW1_WSGRA1_WSGRB1_WG64_4_1_WGM15
    SolutionIndex: 133
    SolutionNameMin: Cijk_Ailk_Bljk_HHS_BH_MT128x128x32_MI32x32x8x1_SE_1LDSB1_AF0EM8_EPS1_GRVW2_GSU1_GSUAMB_LBSPP128_LPB8_LRVW8_NLCA1_PGR1_PLR5_SU32_SUS128_SRVW4_TT2_64_TLDS1_VAW2_WSGRA1_WSGRB1_WG64_4_1_WGM2
    SolutionIndex: 134
    SolutionNameMin: Cijk_Ailk_Bljk_HHS_BH_MT64x32x32_MI16x16x16x1_SE_1LDSB1_AF0EM8_EPS1_GRVW2_GSU1_GSUAMB_LBSPP128_LPB16_LRVW8_NLCA1_PGR1_PLR2_SU0_SUS0_SRVW4_TT2_16_TLDS1_VAW2_WSGRA1_WSGRB1_WG32_8_1_WGM1
    SolutionIndex: 135
    SolutionNameMin: Cijk_Ailk_Bljk_HHS_BH_MT128x64x32_MI32x32x8x1_SE_1LDSB0_AF0EM8_EPS1_GRVW8_GSU1_GSUAMB_LBSPP128_LPB8_LRVW8_NLCA1_PGR1_PLR5_SU0_SUS0_SRVW4_TT2_32_TLDS1_VAW2_WSGRA1_WSGRB1_WG64_4_1_WGM2
    SolutionIndex: 136
    SolutionNameMin: Cijk_Ailk_Bljk_HHS_BH_MT128x64x32_MI32x32x8x1_SE_1LDSB0_AF0EM8_EPS1_GRVW8_GSU1_GSUAMB_LBSPP128_LPB8_LRVW8_NLCA1_PGR1_PLR5_SU0_SUS0_SRVW4_TT2_32_TLDS1_VAW2_WSGRA1_WSGRB1_WG64_4_1_WGM15
    SolutionIndex: 137
    SolutionNameMin: Cijk_Ailk_Bljk_HHS_BH_MT64x32x32_MI16x16x16x1_SE_1LDSB1_AF0EM8_EPS1_GRVW2_GSU1_GSUAMB_LBSPP128_LPB16_LRVW8_NLCA1_PGR1_PLR2_SU32_SUS256_SRVW4_TT2_16_TLDS1_VAW2_WSGRA1_WSGRB1_WG32_8_1_WGM1
    SolutionIndex: 138
    SolutionNameMin: Cijk_Ailk_Bljk_HHS_BH_MT128x128x32_MI32x32x8x1_SE_1LDSB1_AF0EM8_EPS1_GRVW2_GSU1_GSUAMB_LBSPP128_LPB8_LRVW8_NLCA1_PGR1_PLR5_SU0_SUS0_SRVW4_TT2_64_TLDS1_VAW2_WSGRA1_WSGRB1_WG64_4_1_WGM15
    SolutionIndex: 139
    SolutionNameMin: Cijk_Ailk_Bljk_HHS_BH_MT16x64x32_MI16x16x16x1_SE_1LDSB0_AF0EM8_EPS0_GRVW8_GSU1_GSUAMB_LBSPP128_LPB16_LRVW8_NLCA1_PGR2_PLR2_SU0_SUS0_SRVW0_TT1_16_TLDS1_VAW2_WSGRA1_WSGRB1_WG16_16_1_WGM1
    SolutionIndex: 140
    SolutionNameMin: Cijk_Ailk_Bljk_HHS_BH_MT32x32x32_MI16x16x16x1_SE_1LDSB0_AF0EM8_EPS1_GRVW8_GSU1_GSUAMB_LBSPP128_LPB16_LRVW8_NLCA1_PGR1_PLR2_SU0_SUS0_SRVW4_TT1_16_TLDS1_VAW2_WSGRA1_WSGRB1_WG32_8_1_WGM1
    SolutionIndex: 141
    SolutionNameMin: Cijk_Ailk_Bljk_HHS_BH_MT64x16x32_MI16x16x16x1_SE_1LDSB0_AF0EM8_EPS1_GRVW4_GSU1_GSUAMB_LBSPP128_LPB16_LRVW8_NLCA1_PGR1_PLR2_SU0_SUS0_SRVW0_TT1_16_TLDS1_VAW2_WSGRA1_WSGRB1_WG64_4_1_WGM1
    SolutionIndex: 142
    SolutionNameMin: Cijk_Ailk_Bljk_HHS_BH_MT64x64x32_MI32x32x8x1_SE_1LDSB0_AF0EM8_EPS0_GRVW2_GSU1_GSUAMB_LBSPP128_LPB8_LRVW8_NLCA1_PGR2_PLR5_SU0_SUS0_SRVW4_TT1_32_TLDS1_VAW2_WSGRA1_WSGRB1_WG64_4_1_WGM15
    SolutionIndex: 143
    SolutionNameMin: Cijk_Ailk_Bljk_HHS_BH_MT256x160x32_MI32x32x8x1_SE_1LDSB0_AF0EM8_EPS0_GRVW4_GSU1_GSUAMB_LBSPP128_LPB8_LRVW8_NLCA1_PGR2_PLR5_SU32_SUS256_SRVW4_TT2_160_TLDS1_VAW2_WSGRA1_WSGRB1_WG128_2_1_WGM15
    SolutionIndex: 144
    SolutionNameMin: Cijk_Ailk_Bljk_HHS_BH_MT256x160x32_MI32x32x8x1_SE_1LDSB0_AF0EM8_EPS0_GRVW4_GSU1_GSUAMB_LBSPP128_LPB8_LRVW8_NLCA1_PGR2_PLR5_SU32_SUS128_SRVW4_TT2_160_TLDS1_VAW2_WSGRA1_WSGRB1_WG128_2_1_WGM2
    SolutionIndex: 145
    SolutionNameMin: Cijk_Ailk_Bljk_HHS_BH_MT32x64x32_MI16x16x16x1_SE_1LDSB1_AF0EM8_EPS1_GRVW2_GSU1_GSUAMB_LBSPP128_LPB16_LRVW8_NLCA1_PGR1_PLR2_SU0_SUS0_SRVW4_TT1_32_TLDS1_VAW2_WSGRA1_WSGRB1_WG32_8_1_WGM1
    SolutionIndex: 146
    SolutionNameMin: Cijk_Ailk_Bljk_HHS_BH_MT64x4x32_MI4x4x4x16_SE_1LDSB0_AF0EM8_EPS1_GRVW4_GSU1_GSUAMB_LBSPP128_LPB8_LRVW8_NLCA1_PGR1_PLR9_SU0_SUS0_SRVW0_TT1_4_TLDS1_VAW2_WSGRA1_WSGRB1_WG64_1_1_WGM15
    SolutionIndex: 147
    SolutionNameMin: Cijk_Ailk_Bljk_HHS_BH_MT32x32x64_MI16x16x16x1_SE_1LDSB0_AF0EM1_EPS0_GRVW8_GSU1_GSUAMB_LBSPP128_LPB16_LRVW8_NLCA1_PGR2_PLR5_SU0_SUS0_SRVW4_TT1_16_TLDS1_VAW2_WSGRA1_WSGRB1_WG32_8_1_WGM2
    SolutionIndex: 148
    SolutionNameMin: Cijk_Ailk_Bljk_HHS_BH_MT32x32x64_MI16x16x16x1_SE_1LDSB0_AF0EM1_EPS0_GRVW8_GSU1_GSUAMB_LBSPP128_LPB16_LRVW8_NLCA1_PGR2_PLR5_SU0_SUS0_SRVW4_TT1_16_TLDS1_VAW2_WSGRA1_WSGRB1_WG32_8_1_WGM1
    SolutionIndex: 149
    SolutionNameMin: Cijk_Ailk_Bljk_HHS_BH_MT32x32x64_MI16x16x16x1_SE_1LDSB0_AF0EM1_EPS0_GRVW4_GSU1_GSUAMB_LBSPP128_LPB16_LRVW8_NLCA1_PGR2_PLR5_SU0_SUS0_SRVW4_TT1_16_TLDS1_VAW2_WSGRA1_WSGRB1_WG32_8_1_WGM1
    SolutionIndex: 150
    SolutionNameMin: Cijk_Ailk_Bljk_HHS_BH_MT64x32x32_MI16x16x16x1_SE_1LDSB1_AF0EM8_EPS1_GRVW2_GSU1_GSUAMB_LBSPP128_LPB16_LRVW8_NLCA1_PGR1_PLR2_SU0_SUS0_SRVW4_TT2_16_TLDS1_VAW2_WSGRA1_WSGRB1_WG32_8_1_WGM2
    SolutionIndex: 151
    SolutionNameMin: Cijk_Ailk_Bljk_HHS_BH_MT128x192x32_MI32x32x8x1_SE_1LDSB0_AF0EM8_EPS0_GRVW8_GSU1_GSUAMB_LBSPP128_LPB8_LRVW8_NLCA1_PGR2_PLR5_SU0_SUS0_SRVW4_TT2_96_TLDS1_VAW2_WSGRA1_WSGRB1_WG64_4_1_WGM2
    SolutionIndex: 152
    SolutionNameMin: Cijk_Ailk_Bljk_HHS_BH_MT128x192x32_MI32x32x8x1_SE_1LDSB0_AF0EM8_EPS0_GRVW4_GSU1_GSUAMB_LBSPP128_LPB8_LRVW8_NLCA1_PGR2_PLR5_SU0_SUS0_SRVW4_TT2_96_TLDS1_VAW2_WSGRA1_WSGRB1_WG64_4_1_WGM15
    SolutionIndex: 153
    SolutionNameMin: Cijk_Ailk_Bljk_HHS_BH_MT64x64x64_MI32x32x8x1_SE_1LDSB0_AF0EM1_EPS0_GRVW8_GSU1_GSUAMB_LBSPP128_LPB8_LRVW8_NLCA1_PGR2_PLR9_SU32_SUS128_SRVW4_TT1_32_TLDS1_VAW2_WSGRA1_WSGRB1_WG64_4_1_WGM2
    SolutionIndex: 154
    SolutionNameMin: Cijk_Ailk_Bljk_HHS_BH_MT96x96x64_MI16x16x16x1_SE_1LDSB0_AF0EM8_EPS0_GRVW8_GSU1_GSUAMB_LBSPP128_LPB16_LRVW8_NLCA3_PGR2_PLR5_SU0_SUS0_SRVW0_TT3_48_TLDS1_VAW2_WSGRA1_WSGRB1_WG32_8_1_WGM1
    SolutionIndex: 155
    SolutionNameMin: Cijk_Ailk_Bljk_HHS_BH_MT128x64x32_MI32x32x8x1_SE_1LDSB0_AF0EM8_EPS1_GRVW2_GSU1_GSUAMB_LBSPP128_LPB8_LRVW8_NLCA1_PGR1_PLR5_SU0_SUS0_SRVW4_TT2_32_TLDS1_VAW2_WSGRA1_WSGRB1_WG64_4_1_WGM1
    SolutionIndex: 156
    SolutionNameMin: Cijk_Ailk_Bljk_HHS_BH_MT128x192x32_MI32x32x8x1_SE_1LDSB0_AF0EM1_EPS0_GRVW8_GSU1_GSUAMB_LBSPP128_LPB8_LRVW8_NLCA1_PGR2_PLR5_SU0_SUS0_SRVW4_TT2_96_TLDS1_VAW2_WSGRA1_WSGRB1_WG64_4_1_WGM1
    SolutionIndex: 157
    SolutionNameMin: Cijk_Ailk_Bljk_HHS_BH_MT256x160x32_MI32x32x8x1_SE_1LDSB0_AF0EM8_EPS0_GRVW4_GSU3_GSUAMB_LBSPP128_LPB8_LRVW8_NLCA1_PGR2_PLR5_SU0_SUS0_SRVW4_TT2_160_TLDS1_VAW1_WSGRA1_WSGRB1_WG128_2_1_WGM15
    SolutionIndex: 158
    SolutionNameMin: Cijk_Ailk_Bljk_HHS_BH_MT256x160x32_MI32x32x8x1_SE_1LDSB0_AF0EM8_EPS0_GRVW4_GSU5_GSUAMB_LBSPP128_LPB8_LRVW8_NLCA1_PGR2_PLR5_SU0_SUS0_SRVW4_TT2_160_TLDS1_VAW1_WSGRA1_WSGRB1_WG128_2_1_WGM2
    SolutionIndex: 159
    SolutionNameMin: Cijk_Ailk_Bljk_HHS_BH_MT256x192x32_MI32x32x8x1_SE_1LDSB0_AF0EM8_EPS0_GRVW8_GSU1_GSUAMB_LBSPP128_LPB8_LRVW8_NLCA1_PGR2_PLR5_SU32_SUS256_SRVW4_TT4_96_TLDS1_VAW2_WSGRA1_WSGRB1_WG64_4_1_WGM15
    SolutionIndex: 160
    SolutionNameMin: Cijk_Ailk_Bljk_HHS_BH_MT64x64x32_MI32x32x8x1_SE_1LDSB0_AF0EM1_EPS0_GRVW2_GSU1_GSUAMB_LBSPP128_LPB8_LRVW8_NLCA1_PGR2_PLR5_SU32_SUS256_SRVW4_TT1_32_TLDS1_VAW2_WSGRA1_WSGRB1_WG64_4_1_WGM15
    SolutionIndex: 161
    SolutionNameMin: Cijk_Ailk_Bljk_HHS_BH_MT64x32x32_MI16x16x16x1_SE_1LDSB0_AF0EM1_EPS0_GRVW2_GSU1_GSUAMB_LBSPP128_LPB16_LRVW8_NLCA1_PGR2_PLR2_SU0_SUS0_SRVW4_TT2_16_TLDS1_VAW2_WSGRA1_WSGRB1_WG32_8_1_WGM1
    SolutionIndex: 162
    SolutionNameMin: Cijk_Ailk_Bljk_HHS_BH_MT64x32x32_MI16x16x16x1_SE_1LDSB1_AF0EM1_EPS1_GRVW2_GSU1_GSUAMB_LBSPP128_LPB16_LRVW8_NLCA1_PGR1_PLR2_SU0_SUS0_SRVW4_TT2_16_TLDS1_VAW2_WSGRA1_WSGRB1_WG32_8_1_WGM15
    SolutionIndex: 163
    SolutionNameMin: Cijk_Ailk_Bljk_HHS_BH_MT128x64x32_MI32x32x8x1_SE_1LDSB0_AF0EM1_EPS0_GRVW4_GSU1_GSUAMB_LBSPP128_LPB8_LRVW8_NLCA1_PGR2_PLR5_SU0_SUS0_SRVW4_TT2_32_TLDS1_VAW2_WSGRA1_WSGRB1_WG64_4_1_WGM1
    SolutionIndex: 164
    SolutionNameMin: Cijk_Ailk_Bljk_HHS_BH_MT64x128x32_MI32x32x8x1_SE_1LDSB0_AF0EM1_EPS0_GRVW4_GSU1_GSUAMB_LBSPP128_LPB8_LRVW8_NLCA1_PGR2_PLR5_SU0_SUS0_SRVW4_TT1_64_TLDS1_VAW2_WSGRA1_WSGRB1_WG64_4_1_WGM2
    SolutionIndex: 165
    SolutionNameMin: Cijk_Ailk_Bljk_HHS_BH_MT128x96x32_MI32x32x8x1_SE_1LDSB1_AF0EM1_EPS1_GRVW2_GSU1_GSUAMB_LBSPP128_LPB8_LRVW8_NLCA1_PGR1_PLR5_SU0_SUS0_SRVW4_TT1_96_TLDS1_VAW2_WSGRA1_WSGRB1_WG128_2_1_WGM15
    SolutionIndex: 166
    SolutionNameMin: Cijk_Ailk_Bljk_HHS_BH_MT128x96x32_MI32x32x8x1_SE_1LDSB0_AF0EM1_EPS1_GRVW4_GSU1_GSUAMB_LBSPP128_LPB8_LRVW8_NLCA1_PGR1_PLR5_SU0_SUS0_SRVW4_TT1_96_TLDS1_VAW2_WSGRA1_WSGRB1_WG128_2_1_WGM2
    SolutionIndex: 167
    SolutionNameMin: Cijk_Ailk_Bljk_HHS_BH_MT64x128x32_MI32x32x8x1_SE_1LDSB0_AF0EM1_EPS0_GRVW2_GSU1_GSUAMB_LBSPP128_LPB8_LRVW8_NLCA1_PGR2_PLR5_SU0_SUS0_SRVW4_TT1_64_TLDS1_VAW2_WSGRA1_WSGRB1_WG64_4_1_WGM15
    SolutionIndex: 168
    SolutionNameMin: Cijk_Ailk_Bljk_HHS_BH_MT32x64x64_MI16x16x16x1_SE_1LDSB0_AF0EM1_EPS0_GRVW4_GSU1_GSUAMB_LBSPP128_LPB16_LRVW8_NLCA1_PGR2_PLR5_SU0_SUS0_SRVW4_TT1_32_TLDS1_VAW2_WSGRA1_WSGRB1_WG32_8_1_WGM1
    SolutionIndex: 169
    SolutionNameMin: Cijk_Ailk_Bljk_HHS_BH_MT128x128x32_MI32x32x8x1_SE_1LDSB1_AF0EM1_EPS1_GRVW2_GSU1_GSUAMB_LBSPP128_LPB8_LRVW8_NLCA1_PGR1_PLR5_SU0_SUS0_SRVW4_TT2_64_TLDS1_VAW2_WSGRA1_WSGRB1_WG64_4_1_WGM1
    SolutionIndex: 170
    SolutionNameMin: Cijk_Ailk_Bljk_HHS_BH_MT128x96x32_MI32x32x8x1_SE_1LDSB1_AF0EM1_EPS1_GRVW2_GSU1_GSUAMB_LBSPP128_LPB8_LRVW8_NLCA1_PGR1_PLR5_SU0_SUS0_SRVW4_TT1_96_TLDS1_VAW2_WSGRA1_WSGRB1_WG128_2_1_WGM2
    SolutionIndex: 171
    SolutionNameMin: Cijk_Ailk_Bljk_HHS_BH_MT64x128x64_MI32x32x8x1_SE_1LDSB0_AF0EM1_EPS0_GRVW8_GSU1_GSUAMB_LBSPP128_LPB8_LRVW8_NLCA1_PGR2_PLR9_SU0_SUS0_SRVW4_TT1_64_TLDS1_VAW2_WSGRA1_WSGRB1_WG64_4_1_WGM15
    SolutionIndex: 172
    SolutionNameMin: Cijk_Ailk_Bljk_HHS_BH_MT128x128x32_MI32x32x8x1_SE_1LDSB1_AF0EM8_EPS1_GRVW2_GSU1_GSUAMB_LBSPP128_LPB8_LRVW8_NLCA1_PGR1_PLR5_SU32_SUS256_SRVW4_TT2_64_TLDS1_VAW2_WSGRA1_WSGRB1_WG64_4_1_WGM15
    SolutionIndex: 173
    SolutionNameMin: Cijk_Ailk_Bljk_HHS_BH_MT128x128x32_MI32x32x8x1_SE_1LDSB1_AF0EM8_EPS1_GRVW2_GSU1_GSUAMB_LBSPP128_LPB8_LRVW8_NLCA1_PGR1_PLR5_SU32_SUS256_SRVW4_TT2_64_TLDS1_VAW2_WSGRA1_WSGRB1_WG64_4_1_WGM2
    SolutionIndex: 174
    SolutionNameMin: Cijk_Ailk_Bljk_HHS_BH_MT128x64x32_MI32x32x8x1_SE_1LDSB0_AF0EM1_EPS0_GRVW2_GSU1_GSUAMB_LBSPP128_LPB8_LRVW8_NLCA1_PGR2_PLR5_SU0_SUS0_SRVW4_TT2_32_TLDS1_VAW2_WSGRA1_WSGRB1_WG64_4_1_WGM15
    SolutionIndex: 175
    SolutionNameMin: Cijk_Ailk_Bljk_HHS_BH_MT128x256x32_MI32x32x8x1_SE_1LDSB1_AF0EM1_EPS0_GRVW8_GSU1_GSUAMB_LBSPP128_LPB8_LRVW8_NLCA1_PGR2_PLR5_SU0_SUS0_SRVW4_TT2_128_TLDS1_VAW2_WSGRA1_WSGRB1_WG64_4_1_WGM2
    SolutionIndex: 176
    SolutionNameMin: Cijk_Ailk_Bljk_HHS_BH_MT128x96x64_MI32x32x8x1_SE_1LDSB0_AF0EM8_EPS0_GRVW8_GSU15_GSUAMB_LBSPP128_LPB8_LRVW8_NLCA1_PGR2_PLR9_SU0_SUS0_SRVW4_TT1_96_TLDS1_VAW1_WSGRA1_WSGRB1_WG128_2_1_WGM15
    SolutionIndex: 177
    SolutionNameMin: Cijk_Ailk_Bljk_HHS_BH_MT128x128x32_MI32x32x8x1_SE_1LDSB0_AF0EM1_EPS0_GRVW8_GSU5_GSUAMB_LBSPP128_LPB8_LRVW8_NLCA1_PGR2_PLR5_SU0_SUS0_SRVW4_TT2_64_TLDS1_VAW1_WSGRA1_WSGRB1_WG64_4_1_WGM2
    SolutionIndex: 178
    SolutionNameMin: Cijk_Ailk_Bljk_HHS_BH_MT128x96x64_MI32x32x8x1_SE_1LDSB0_AF0EM8_EPS1_GRVW8_GSU3_GSUAMB_LBSPP128_LPB8_LRVW8_NLCA1_PGR1_PLR9_SU0_SUS0_SRVW0_TT1_96_TLDS1_VAW1_WSGRA1_WSGRB1_WG128_2_1_WGM2
    SolutionIndex: 179
    SolutionNameMin: Cijk_Ailk_Bljk_HHS_BH_MT128x96x64_MI32x32x8x1_SE_1LDSB0_AF0EM8_EPS1_GRVW8_GSU5_GSUAMB_LBSPP128_LPB8_LRVW8_NLCA1_PGR1_PLR9_SU0_SUS0_SRVW0_TT1_96_TLDS1_VAW1_WSGRA1_WSGRB1_WG128_2_1_WGM1
    SolutionIndex: 180
    SolutionNameMin: Cijk_Ailk_Bljk_HHS_BH_MT128x128x32_MI32x32x8x1_SE_1LDSB1_AF0EM1_EPS1_GRVW2_GSU1_GSUAMB_LBSPP128_LPB8_LRVW8_NLCA1_PGR1_PLR5_SU32_SUS256_SRVW4_TT2_64_TLDS1_VAW2_WSGRA1_WSGRB1_WG64_4_1_WGM2
    SolutionIndex: 181
    SolutionNameMin: Cijk_Ailk_Bljk_HHS_BH_MT256x160x32_MI32x32x8x1_SE_1LDSB0_AF0EM8_EPS0_GRVW4_GSU5_GSUAMB_LBSPP128_LPB8_LRVW8_NLCA1_PGR2_PLR5_SU0_SUS0_SRVW4_TT2_160_TLDS1_VAW1_WSGRA1_WSGRB1_WG128_2_1_WGM1
    SolutionIndex: 182
    SolutionNameMin: Cijk_Ailk_Bljk_HHS_BH_MT16x64x32_MI16x16x16x1_SE_1LDSB0_AF0EM8_EPS1_GRVW2_GSU1_GSUAMB_LBSPP128_LPB16_LRVW8_NLCA1_PGR1_PLR2_SU0_SUS0_SRVW0_TT1_16_TLDS1_VAW2_WSGRA1_WSGRB1_WG16_16_1_WGM1
    SolutionIndex: 183
    SolutionNameMin: Cijk_Ailk_Bljk_HHS_BH_MT160x128x32_MI32x32x8x1_SE_1LDSB0_AF0EM8_EPS0_GRVW4_GSU1_GSUAMB_LBSPP128_LPB8_LRVW8_NLCA5_PGR2_PLR5_SU0_SUS0_SRVW0_TT5_32_TLDS1_VAW2_WSGRA1_WSGRB1_WG32_8_1_WGM1
    SolutionIndex: 184
    SolutionNameMin: Cijk_Ailk_Bljk_HHS_BH_MT256x128x32_MI32x32x8x1_SE_1LDSB0_AF0EM8_EPS0_GRVW4_GSU3_GSUAMB_LBSPP128_LPB8_LRVW8_NLCA1_PGR2_PLR5_SU0_SUS0_SRVW0_TT4_64_TLDS1_VAW1_WSGRA1_WSGRB1_WG64_4_1_WGM15
    SolutionIndex: 185
    SolutionNameMin: Cijk_Ailk_Bljk_HHS_BH_MT64x128x64_MI32x32x8x1_SE_1LDSB0_AF0EM8_EPS0_GRVW8_GSU1_GSUAMB_LBSPP128_LPB8_LRVW8_NLCA1_PGR2_PLR9_SU32_SUS128_SRVW4_TT1_64_TLDS1_VAW2_WSGRA1_WSGRB1_WG64_4_1_WGM2
    SolutionIndex: 186
    SolutionNameMin: Cijk_Ailk_Bljk_HHS_BH_MT64x128x64_MI32x32x8x1_SE_1LDSB0_AF0EM8_EPS0_GRVW8_GSU1_GSUAMB_LBSPP128_LPB8_LRVW8_NLCA1_PGR2_PLR9_SU32_SUS256_SRVW4_TT1_64_TLDS1_VAW2_WSGRA1_WSGRB1_WG64_4_1_WGM1
    SolutionIndex: 187
    SolutionNameMin: Cijk_Ailk_Bljk_HHS_BH_MT256x128x32_MI32x32x8x1_SE_1LDSB0_AF0EM8_EPS1_GRVW8_GSU1_GSUAMB_LBSPP128_LPB8_LRVW8_NLCA1_PGR1_PLR5_SU32_SUS128_SRVW4_TT4_64_TLDS1_VAW2_WSGRA1_WSGRB1_WG64_4_1_WGM1
    SolutionIndex: 188
    SolutionNameMin: Cijk_Ailk_Bljk_HHS_BH_MT64x128x32_MI32x32x8x1_SE_1LDSB0_AF0EM8_EPS0_GRVW4_GSU1_GSUAMB_LBSPP128_LPB8_LRVW8_NLCA1_PGR2_PLR5_SU0_SUS0_SRVW4_TT1_64_TLDS1_VAW2_WSGRA1_WSGRB1_WG64_4_1_WGM1
    SolutionIndex: 189
    SolutionNameMin: Cijk_Ailk_Bljk_HHS_BH_MT128x96x64_MI32x32x8x1_SE_1LDSB0_AF0EM8_EPS1_GRVW8_GSU5_GSUAMB_LBSPP128_LPB8_LRVW8_NLCA1_PGR1_PLR9_SU0_SUS0_SRVW0_TT1_96_TLDS1_VAW1_WSGRA1_WSGRB1_WG128_2_1_WGM2
    SolutionIndex: 190
    SolutionNameMin: Cijk_Ailk_Bljk_HHS_BH_MT128x64x32_MI32x32x8x1_SE_1LDSB0_AF0EM8_EPS0_GRVW4_GSU1_GSUAMB_LBSPP128_LPB8_LRVW8_NLCA1_PGR2_PLR5_SU0_SUS0_SRVW4_TT2_32_TLDS1_VAW2_WSGRA1_WSGRB1_WG64_4_1_WGM15
    SolutionIndex: 191
    SolutionNameMin: Cijk_Ailk_Bljk_HHS_BH_MT128x256x32_MI32x32x8x1_SE_1LDSB1_AF0EM8_EPS1_GRVW8_GSU1_GSUAMB_LBSPP128_LPB8_LRVW8_NLCA1_PGR1_PLR5_SU32_SUS128_SRVW4_TT2_128_TLDS1_VAW2_WSGRA1_WSGRB1_WG64_4_1_WGM15
    SolutionIndex: 192
    SolutionNameMin: Cijk_Ailk_Bljk_HHS_BH_MT128x256x32_MI32x32x8x1_SE_1LDSB1_AF0EM8_EPS0_GRVW8_GSU1_GSUAMB_LBSPP128_LPB8_LRVW8_NLCA1_PGR2_PLR5_SU32_SUS128_SRVW4_TT2_128_TLDS1_VAW2_WSGRA1_WSGRB1_WG64_4_1_WGM15
    SolutionIndex: 193
    SolutionNameMin: Cijk_Ailk_Bljk_HHS_BH_MT128x128x32_MI32x32x8x1_SE_1LDSB1_AF0EM1_EPS1_GRVW2_GSU1_GSUAMB_LBSPP128_LPB8_LRVW8_NLCA1_PGR1_PLR5_SU32_SUS128_SRVW4_TT2_64_TLDS1_VAW2_WSGRA1_WSGRB1_WG64_4_1_WGM1
    SolutionIndex: 194
    SolutionNameMin: Cijk_Ailk_Bljk_HHS_BH_MT64x128x32_MI32x32x8x1_SE_1LDSB0_AF0EM8_EPS0_GRVW2_GSU1_GSUAMB_LBSPP128_LPB8_LRVW8_NLCA1_PGR2_PLR5_SU0_SUS0_SRVW4_TT1_64_TLDS1_VAW2_WSGRA1_WSGRB1_WG64_4_1_WGM1
    SolutionIndex: 195
    SolutionNameMin: Cijk_Ailk_Bljk_HHS_BH_MT128x128x32_MI32x32x8x1_SE_1LDSB1_AF0EM1_EPS1_GRVW2_GSU1_GSUAMB_LBSPP128_LPB8_LRVW8_NLCA1_PGR1_PLR5_SU0_SUS0_SRVW4_TT2_64_TLDS1_VAW2_WSGRA1_WSGRB1_WG64_4_1_WGM2
    SolutionIndex: 196
    SolutionNameMin: Cijk_Ailk_Bljk_HHS_BH_MT32x32x64_MI16x16x16x1_SE_1LDSB0_AF0EM1_EPS0_GRVW8_GSU1_GSUAMB_LBSPP128_LPB16_LRVW8_NLCA1_PGR2_PLR5_SU0_SUS0_SRVW4_TT1_16_TLDS1_VAW2_WSGRA1_WSGRB1_WG32_8_1_WGM15
    SolutionIndex: 197
    SolutionNameMin: Cijk_Ailk_Bljk_HHS_BH_MT32x64x64_MI16x16x16x1_SE_1LDSB0_AF0EM1_EPS0_GRVW8_GSU7_GSUAMB_LBSPP128_LPB16_LRVW8_NLCA1_PGR2_PLR5_SU32_SUS128_SRVW4_TT1_32_TLDS1_VAW1_WSGRA1_WSGRB1_WG32_8_1_WGM15
    SolutionIndex: 198
    SolutionNameMin: Cijk_Ailk_Bljk_HHS_BH_MT128x256x32_MI32x32x8x1_SE_1LDSB1_AF0EM1_EPS0_GRVW8_GSU1_GSUAMB_LBSPP128_LPB8_LRVW8_NLCA1_PGR2_PLR5_SU0_SUS0_SRVW4_TT2_128_TLDS1_VAW2_WSGRA1_WSGRB1_WG64_4_1_WGM15
    SolutionIndex: 199
    SolutionNameMin: Cijk_Ailk_Bljk_HHS_BH_MT128x256x32_MI32x32x8x1_SE_1LDSB1_AF0EM8_EPS1_GRVW8_GSU1_GSUAMB_LBSPP128_LPB8_LRVW8_NLCA1_PGR1_PLR5_SU32_SUS256_SRVW4_TT2_128_TLDS1_VAW2_WSGRA1_WSGRB1_WG64_4_1_WGM2
    SolutionIndex: 200
    SolutionNameMin: Cijk_Ailk_Bljk_HHS_BH_MT64x4x32_MI4x4x4x16_SE_1LDSB0_AF0EM8_EPS0_GRVW8_GSU1_GSUAMB_LBSPP128_LPB8_LRVW8_NLCA1_PGR2_PLR9_SU0_SUS0_SRVW0_TT1_4_TLDS1_VAW2_WSGRA1_WSGRB1_WG64_1_1_WGM1
    SolutionIndex: 201
    SolutionNameMin: Cijk_Ailk_Bljk_HHS_BH_MT64x32x32_MI16x16x16x1_SE_1LDSB0_AF0EM8_EPS1_GRVW2_GSU1_GSUAMB_LBSPP128_LPB16_LRVW8_NLCA1_PGR1_PLR2_SU0_SUS0_SRVW4_TT2_16_TLDS1_VAW2_WSGRA1_WSGRB1_WG32_8_1_WGM1
    SolutionIndex: 202
    SolutionNameMin: Cijk_Ailk_Bljk_HHS_BH_MT64x4x32_MI4x4x4x16_SE_1LDSB0_AF0EM8_EPS1_GRVW4_GSU1_GSUAMB_LBSPP128_LPB8_LRVW8_NLCA1_PGR1_PLR9_SU0_SUS0_SRVW0_TT1_4_TLDS1_VAW2_WSGRA1_WSGRB1_WG64_1_1_WGM1
    SolutionIndex: 203
    SolutionNameMin: Cijk_Ailk_Bljk_HHS_BH_MT128x256x32_MI32x32x8x1_SE_1LDSB1_AF0EM8_EPS0_GRVW8_GSU1_GSUAMB_LBSPP128_LPB8_LRVW8_NLCA1_PGR2_PLR5_SU32_SUS128_SRVW4_TT2_128_TLDS1_VAW2_WSGRA1_WSGRB1_WG64_4_1_WGM2
    SolutionIndex: 204
    SolutionNameMin: Cijk_Ailk_Bljk_HHS_BH_MT128x256x32_MI32x32x8x1_SE_1LDSB1_AF0EM8_EPS1_GRVW8_GSU1_GSUAMB_LBSPP128_LPB8_LRVW8_NLCA1_PGR1_PLR5_SU32_SUS256_SRVW4_TT2_128_TLDS1_VAW2_WSGRA1_WSGRB1_WG64_4_1_WGM1
    SolutionIndex: 205
    SolutionNameMin: Cijk_Ailk_Bljk_HHS_BH_MT96x96x64_MI16x16x16x1_SE_1LDSB0_AF0EM1_EPS0_GRVW8_GSU1_GSUAMB_LBSPP128_LPB16_LRVW8_NLCA3_PGR2_PLR5_SU0_SUS0_SRVW0_TT3_48_TLDS1_VAW2_WSGRA1_WSGRB1_WG32_8_1_WGM1
    SolutionIndex: 206
    SolutionNameMin: Cijk_Ailk_Bljk_HHS_BH_MT64x128x64_MI32x32x8x1_SE_1LDSB0_AF0EM1_EPS0_GRVW8_GSU1_GSUAMB_LBSPP128_LPB8_LRVW8_NLCA1_PGR2_PLR9_SU0_SUS0_SRVW4_TT1_64_TLDS1_VAW2_WSGRA1_WSGRB1_WG64_4_1_WGM2
    SolutionIndex: 207
    SolutionNameMin: Cijk_Ailk_Bljk_HHS_BH_MT32x32x64_MI16x16x16x1_SE_1LDSB0_AF0EM1_EPS0_GRVW4_GSU1_GSUAMB_LBSPP128_LPB16_LRVW8_NLCA1_PGR2_PLR5_SU0_SUS0_SRVW4_TT1_16_TLDS1_VAW2_WSGRA1_WSGRB1_WG32_8_1_WGM2
    SolutionIndex: 208
    SolutionNameMin: Cijk_Ailk_Bljk_HHS_BH_MT32x32x32_MI16x16x16x1_SE_1LDSB0_AF0EM1_EPS0_GRVW8_GSU1_GSUAMB_LBSPP128_LPB16_LRVW8_NLCA1_PGR2_PLR2_SU0_SUS0_SRVW4_TT1_16_TLDS1_VAW2_WSGRA1_WSGRB1_WG32_8_1_WGM1
    SolutionIndex: 209
    SolutionNameMin: Cijk_Ailk_Bljk_HHS_BH_MT64x64x64_MI32x32x8x1_SE_1LDSB0_AF0EM1_EPS0_GRVW8_GSU1_GSUAMB_LBSPP128_LPB8_LRVW8_NLCA1_PGR2_PLR9_SU0_SUS0_SRVW4_TT1_32_TLDS1_VAW2_WSGRA1_WSGRB1_WG64_4_1_WGM15
    SolutionIndex: 210
    SolutionNameMin: Cijk_Ailk_Bljk_HHS_BH_MT32x64x64_MI16x16x16x1_SE_1LDSB0_AF0EM1_EPS0_GRVW8_GSU1_GSUAMB_LBSPP128_LPB16_LRVW8_NLCA1_PGR2_PLR5_SU32_SUS256_SRVW4_TT1_32_TLDS1_VAW2_WSGRA1_WSGRB1_WG32_8_1_WGM15
    SolutionIndex: 211
    SolutionNameMin: Cijk_Ailk_Bljk_HHS_BH_MT128x128x32_MI32x32x8x1_SE_1LDSB1_AF0EM1_EPS1_GRVW2_GSU1_GSUAMB_LBSPP128_LPB8_LRVW8_NLCA1_PGR1_PLR5_SU32_SUS256_SRVW4_TT2_64_TLDS1_VAW2_WSGRA1_WSGRB1_WG64_4_1_WGM15
    SolutionIndex: 212
    SolutionNameMin: Cijk_Ailk_Bljk_HHS_BH_MT128x128x32_MI32x32x8x1_SE_1LDSB1_AF0EM1_EPS1_GRVW2_GSU1_GSUAMB_LBSPP128_LPB8_LRVW8_NLCA1_PGR1_PLR5_SU0_SUS0_SRVW4_TT2_64_TLDS1_VAW2_WSGRA1_WSGRB1_WG64_4_1_WGM15
    SolutionIndex: 213
    SolutionNameMin: Cijk_Ailk_Bljk_HHS_BH_MT32x64x32_MI16x16x16x1_SE_1LDSB0_AF0EM1_EPS0_GRVW2_GSU1_GSUAMB_LBSPP128_LPB16_LRVW8_NLCA1_PGR2_PLR2_SU0_SUS0_SRVW4_TT1_32_TLDS1_VAW2_WSGRA1_WSGRB1_WG32_8_1_WGM1
    SolutionIndex: 214
    SolutionNameMin: Cijk_Ailk_Bljk_HHS_BH_MT32x32x32_MI16x16x16x1_SE_1LDSB0_AF0EM1_EPS0_GRVW4_GSU1_GSUAMB_LBSPP128_LPB16_LRVW8_NLCA1_PGR2_PLR2_SU0_SUS0_SRVW4_TT1_16_TLDS1_VAW2_WSGRA1_WSGRB1_WG32_8_1_WGM15
    SolutionIndex: 215
    SolutionNameMin: Cijk_Ailk_Bljk_HHS_BH_MT32x64x32_MI16x16x16x1_SE_1LDSB1_AF0EM1_EPS1_GRVW2_GSU1_GSUAMB_LBSPP128_LPB16_LRVW8_NLCA1_PGR1_PLR2_SU32_SUS128_SRVW4_TT1_32_TLDS1_VAW2_WSGRA1_WSGRB1_WG32_8_1_WGM1
    SolutionIndex: 216
    SolutionNameMin: Cijk_Ailk_Bljk_HHS_BH_MT32x128x32_MI4x4x4x16_SN_SIA3
    SolutionIndex: 217
    SolutionNameMin: Cijk_Ailk_Bljk_HHS_BH_MT32x128x32_MI4x4x4x16_SN_SIA0
    SolutionIndex: 218
    SolutionNameMin: Cijk_Ailk_Bljk_HHS_BH_MT256x128x16_MI32x32x8x1_SN_GRVW8_LPB8
    SolutionIndex: 219
    SolutionNameMin: Cijk_Ailk_Bljk_HHS_BH_MT128x16x64_MI16x16x16x1_SN_1LDSB0_GRVW8_GSU5_LPB16_LRVW8_NEPBS2_NLCA1_PLR5_TT2_16_VAW1_WG64_4_1
    SolutionIndex: 220
    SolutionNameMin: Cijk_Ailk_Bljk_HHS_BH_MT128x16x64_MI16x16x16x1_SN_1LDSB0_GRVW8_GSU1_LPB16_LRVW8_NEPBS2_NLCA1_PLR5_TT2_16_VAW2_WG64_4_1
    SolutionIndex: 221
    SolutionNameMin: Cijk_Ailk_Bljk_HHS_BH_MT128x16x64_MI16x16x16x1_SN_1LDSB0_GRVW8_GSU7_LPB8_LRVW4_NEPBS2_NLCA1_PLR5_TT2_16_VAW1_WG64_4_1
    SolutionIndex: 222
    SolutionNameMin: Cijk_Ailk_Bljk_HHS_BH_MT128x16x64_MI16x16x16x1_SN_1LDSB0_GRVW8_GSU1_LPB16_LRVW8_NEPBS0_NLCA1_PLR5_TT2_16_VAW2_WG64_4_1
    SolutionIndex: 223
    SolutionNameMin: Cijk_Ailk_Bljk_HHS_BH_MT128x256x32_MI32x32x8x1_SN_1LDSB0_GRVW8_GSU3_LPB8_LRVW4_NEPBS2_NLCA1_PLR5_TT4_64_VAW1_WG32_8_1
    SolutionIndex: 224
    SolutionNameMin: Cijk_Ailk_Bljk_HHS_BH_MT128x256x32_MI32x32x8x1_SN_1LDSB1_GRVW8_GSU1_LPB8_LRVW8_NEPBS0_NLCA1_PLR5_TT4_64_VAW2_WG32_8_1
    SolutionIndex: 225
    SolutionNameMin: Cijk_Ailk_Bljk_HHS_BH_MT256x256x32_MI32x32x8x1_SN_1LDSB1_GRVW8_GSU5_LPB8_LRVW8_NEPBS0_NLCA1_PLR5_TT8_64_VAW1_WG32_8_1
    SolutionIndex: 226
    SolutionNameMin: Cijk_Ailk_Bljk_HHS_BH_MT256x256x32_MI32x32x8x1_SN_1LDSB1_GRVW8_GSU1_LPB8_LRVW8_NEPBS2_NLCA1_PLR5_TT4_128_VAW2_WG64_4_1
    SolutionIndex: 227
    SolutionNameMin: Cijk_Ailk_Bljk_HHS_BH_MT128x96x64_MI32x32x8x1_SN_AMAS0_GRVW4_GSUAMB_LBSPP128_LPB4_TLDS1_VW1_WSGRA0_WSGRB0_WGM1
    SolutionIndex: 228
    SolutionNameMin: Cijk_Ailk_Bljk_HHS_BH_MT128x160x32_MI32x32x8x1_SN_1LDSB0_GRVW4_GSUASB_LBSPP128_LRVW8_PLR5_SU64_SUS64_TLDS1_WSGRA0_WSGRB0_WGM15
    SolutionIndex: 229
    SolutionNameMin: Cijk_Ailk_Bljk_HHS_BH_MT256x192x16_MI32x32x8x1_SN_AMAS0_GSUAMB_LBSPP128_LPB4_TLDS1_VW1_WSGRA0_WSGRB0
    SolutionIndex: 230
    SolutionNameMin: Cijk_Ailk_Bljk_HHS_BH_MT4x16x64_SN_GSU8_LDL2_PGR0
    SolutionIndex: 231
    SolutionNameMin: Cijk_Ailk_Bljk_HHS_BH_MT4x16x64_SN_GSU8_LDL4_PGR0
    SolutionIndex: 232
    SolutionNameMin: Cijk_Ailk_Bljk_HHS_BH_MT4x16x16_SN_GSU4_LDL1_PGR1
    SolutionIndex: 233
    SolutionNameMin: Cijk_Ailk_Bljk_HHS_BH_MT128x96x32_MI32x32x8x1_SE_1LDSB0_AF0EM1_AF1EM1_AMAS3_EPS0_GRVW4_GSU1_GSUAMB_LPB8_LRVW8_NEPBS0_NLCA1_PGR2_PLR5_SIA3_SS0_SU0_SUM0_SUS0_SRVW4_SVW4_TT1_96_VAW2_VW2_WSGRA1_WSGRB1_WG128_2_1_WGM15
    SolutionIndex: 234
    SolutionNameMin: Cijk_Ailk_Bljk_HHS_BH_MT32x32x64_MI16x16x16x1_SE_1LDSB0_AF0EM8_AF1EM1_AMAS3_EPS0_GRVW8_GSU1_GSUAMB_LPB16_LRVW8_NEPBS0_NLCA1_PGR2_PLR5_SIA3_SS0_SU0_SUM0_SUS0_SRVW4_SVW4_TT1_16_VAW2_VW2_WSGRA1_WSGRB1_WG32_8_1_WGM2
    SolutionIndex: 235
    SolutionNameMin: Cijk_Ailk_Bljk_HHS_BH_MT128x64x32_MI32x32x8x1_SE_1LDSB0_AF0EM1_AF1EM1_AMAS3_EPS0_GRVW8_GSU1_GSUAMB_LPB8_LRVW8_NEPBS0_NLCA1_PGR2_PLR5_SIA3_SS0_SU0_SUM0_SUS0_SRVW4_SVW4_TT2_32_VAW2_VW2_WSGRA1_WSGRB1_WG64_4_1_WGM1
    SolutionIndex: 236
    SolutionNameMin: Cijk_Ailk_Bljk_HHS_BH_MT4x16x32_SN_GSU16_LDL4_PGR0
    SolutionIndex: 237
    SolutionNameMin: Cijk_Ailk_Bljk_HHS_BH_MT64x128x32_MI16x16x16x1_SN_1LDSB0_IU1_MIAV1_PLR1_SIA3_SS1_SU8_SUS128_SVW2_TT2_64_WG32_8_1_WGM7
    SolutionIndex: 238
    SolutionNameMin: Cijk_Ailk_Bljk_HHS_BH_MT128x128x32_MI32x32x8x1_SN_1LDSB1_GSU16_LBSPP128_LPB4_MIAV0_PLR1_SS1_TT2_64_TLDS1_WG64_4_1_WGM1
    SolutionIndex: 239
    SolutionNameMin: Cijk_Ailk_Bljk_HHS_BH_MT128x160x32_MI32x32x8x1_SN_1LDSB0_GSU1_LPB4_LRVW4_PLR1_SU0_SUS0_TT1_160_VAW2_WG128_2_1_WGM15
    SolutionIndex: 240
    SolutionNameMin: Cijk_Ailk_Bljk_HHS_BH_MT64x192x32_MI32x32x8x1_SE_1LDSB1_AF0EM8_AF1EM1_AMAS3_EPS1_GRVW4_GSU1_GSUAMB_LPB8_LRVW8_LDW0_MAC_MIAV0_NTD0_NEPBS0_NLCA1_PGR1_PLR5_SIA3_SS0_SU0_SUM0_SUS0_SPO0_SRVW4_SVW4_TT1_96_VAW2_VW2_WSGRA1_WSGRB1_WG64_4_1_WGM15
    SolutionIndex: 241
    SolutionNameMin: Cijk_Ailk_Bljk_HHS_BH_MT64x64x64_MI32x32x8x1_SE_1LDSB0_AF0EM1_AF1EM1_AMAS3_ASE_BL1_EPS0_GRVW8_GSU1_GSUAMB_ISA90a_KLA_LBSPP128_LPB8_LDL1_LRVW8_LDW0_MAC_MIAV0_NTD0_NEPBS0_NLCA1_PGR2_PLR9_SIA3_SS0_SU0_SUM0_SUS0_SPO0_SRVW4_SVW4_TT1_32_TLDS1_USFGROn1_VAW2_VSn1_VW2_WSGRA1_WSGRB1_WG64_4_1_WGM15
    SolutionIndex: 242
    SolutionNameMin: Cijk_Ailk_Bljk_HHS_BH_MT256x128x16_MI32x32x8x1_SN_1LDSB0_AF0EM1_AF1EM1_AMAS3_ASE_BL1_EPS0_GRVW8_GSU1_GSUASB_ISA90a_KLA_LBSPP128_LPB8_LDL1_LRVW4_LDW0_MAC_MIAV0_NTD0_NEPBS0_NLCA1_PGR2_PLR1_SIA3_SS1_SU32_SUM3_SUS64_SPO0_SRVW0_SVW2_TT4_64_TLDS1_USFGROn1_VAW2_VSn1_VW2_WSGRA0_WSGRB0_WG64_4_1_WGM16
    SolutionIndex: 243
    SolutionNameMin: Cijk_Ailk_Bljk_HHS_BH_MT64x128x64_MI32x32x8x1_SE_1LDSB0_AF0EM8_AF1EM1_AMAS3_ASE_BL1_EPS0_GRVW8_GSU1_GSUAMB_ISA90a_KLA_LBSPP128_LPB8_LDL1_LRVW8_LDW0_MAC_MIAV0_NTD0_NEPBS0_NLCA1_PGR2_PLR9_SIA3_SS0_SU0_SUM0_SUS0_SPO0_SRVW4_SVW4_TT1_64_TLDS1_USFGROn1_VAW2_VSn1_VW2_WSGRA1_WSGRB1_WG64_4_1_WGM1
    SolutionIndex: 244
    SolutionNameMin: Cijk_Ailk_Bljk_HHS_BH_MT128x96x64_MI32x32x8x1_SE_1LDSB0_AF0EM8_AF1EM1_AMAS3_ASE_BL1_EPS0_GRVW8_GSU15_GSUAMB_ISA90a_KLA_LBSPP128_LPB8_LDL1_LRVW8_LDW0_MAC_MIAV0_NTD0_NEPBS0_NLCA1_PGR2_PLR9_SIA3_SS0_SU0_SUM0_SUS0_SPO0_SRVW4_SVW4_TT1_96_TLDS1_USFGROn1_VAW1_VSn1_VW2_WSGRA1_WSGRB1_WG128_2_1_WGM15
    SolutionIndex: 245
    SolutionNameMin: Cijk_Ailk_Bljk_HHS_BH_MT128x96x32_MI32x32x8x1_SE_1LDSB1_AF0EM1_AF1EM1_AMAS3_ASE_BL1_EPS1_GRVW2_GSU1_GSUAMB_ISA90a_KLA_LBSPP128_LPB8_LDL1_LRVW8_LDW0_MAC_MIAV0_NTD0_NEPBS0_NLCA1_PGR1_PLR5_SIA3_SS0_SU0_SUM0_SUS0_SPO0_SRVW4_SVW4_TT1_96_TLDS1_USFGROn1_VAW2_VSn1_VW2_WSGRA1_WSGRB1_WG128_2_1_WGM2
    SolutionIndex: 246
    SolutionNameMin: Cijk_Ailk_Bljk_HHS_BH_MT128x192x32_MI32x32x8x1_SE_1LDSB0_AF0EM8_AF1EM1_AMAS3_ASE_BL1_EPS0_GRVW8_GSU1_GSUAMB_ISA90a_KLA_LBSPP128_LPB8_LDL1_LRVW8_LDW0_MAC_MIAV0_NTD0_NEPBS0_NLCA1_PGR2_PLR5_SIA3_SS0_SU0_SUM0_SUS0_SPO0_SRVW4_SVW4_TT2_96_TLDS1_USFGROn1_VAW2_VSn1_VW2_WSGRA1_WSGRB1_WG64_4_1_WGM15
    SolutionIndex: 247
    SolutionNameMin: Cijk_Ailk_Bljk_HHS_BH_MT256x160x32_MI32x32x8x1_SE_1LDSB0_AF0EM8_AF1EM1_AMAS3_ASE_BL1_EPS0_GRVW4_GSU1_GSUAMB_ISA90a_KLA_LBSPP128_LPB8_LDL1_LRVW8_LDW0_MAC_MIAV0_NTD0_NEPBS0_NLCA1_PGR2_PLR5_SIA3_SS0_SU0_SUM0_SUS0_SPO0_SRVW4_SVW4_TT2_160_TLDS1_USFGROn1_VAW2_VSn1_VW2_WSGRA1_WSGRB1_WG128_2_1_WGM2
    SolutionIndex: 248
    SolutionNameMin: Cijk_Ailk_Bljk_HHS_BH_MT128x192x32_MI32x32x8x1_SE_1LDSB0_AF0EM8_AF1EM1_AMAS3_ASE_BL1_EPS0_GRVW8_GSU1_GSUAMB_ISA90a_KLA_LBSPP128_LPB8_LDL1_LRVW8_LDW0_MAC_MIAV0_NTD0_NEPBS0_NLCA1_PGR2_PLR5_SIA3_SS0_SU0_SUM0_SUS0_SPO0_SRVW4_SVW4_TT2_96_TLDS1_USFGROn1_VAW2_VSn1_VW2_WSGRA1_WSGRB1_WG64_4_1_WGM2
    SolutionIndex: 249
    SolutionNameMin: Cijk_Ailk_Bljk_HHS_BH_MT128x96x64_MI32x32x8x1_SN_1LDSB0_AF0EM8_AF1EM8_AMAS0_ASE_BL1_EPS0_GRVW4_GSU1_GSUAMB_ISA90a_KLA_LBSPP128_LPB4_LDL1_LRVW4_LDW0_MAC_MIAV0_NTD0_NEPBS0_NLCA1_PGR2_PLR1_SIA3_SS0_SU0_SUM0_SUS0_SPO0_SRVW4_SVW4_TT1_96_TLDS1_USFGROn1_VAW2_VSn1_VW1_WSGRA0_WSGRB0_WG128_2_1_WGM1
    SolutionIndex: 250
    SolutionNameMin: Cijk_Ailk_Bljk_HHS_BH_MT96x128x64_MI32x32x8x1_SE_1LDSB0_AF0EM1_AF1EM1_AMAS3_ASE_BL1_EPS0_GRVW8_GSU1_GSUAMB_ISA90a_KLA_LBSPP128_LPB8_LDL1_LRVW8_LDW0_MAC_MIAV0_NTD0_NEPBS0_NLCA3_PGR2_PLR9_SIA3_SS0_SU0_SUM0_SUS0_SPO0_SRVW0_SVW4_TT3_32_TLDS1_USFGROn1_VAW2_VSn1_VW2_WSGRA1_WSGRB1_WG32_8_1_WGM1
    SolutionIndex: 251
    SolutionNameMin: Cijk_Ailk_Bljk_HHS_BH_MT256x64x32_MI32x32x8x1_SE_1LDSB0_AMAS0_EPS0_GRVW4_LRVW8_PGR2_PLR5_SU0_SUM0_SUS0_SVW4_TT4_32_VW1_WG64_4_1_WGM1
    SolutionIndex: 252
    SolutionNameMin: Cijk_Ailk_Bljk_HHS_BH_MT256x128x32_MI32x32x8x1_SN_AMAS3_LRVW8_MIAV1_NEPBS4_NLCA1_SPO1_SSO4_SVW2_TT2_128_VW2_WG128_2_1
    SolutionIndex: 253
    SolutionNameMin: Cijk_Ailk_Bljk_HHS_BH_MT128x192x32_MI32x32x8x1_SN_AMAS3_LRVW8_MIAV1_NEPBS2_NLCA1_SPO0_SSO0_SVW2_TT2_96_VW2_WG64_4_1
    SolutionIndex: 254
    SolutionNameMin: Cijk_Ailk_Bljk_HHS_BH_MT128x192x32_MI32x32x8x1_SN_AMAS0_LRVW8_MIAV1_NEPBS4_NLCA1_SPO0_SSO4_SVW1_TT2_96_VW1_WG64_4_1
    SolutionIndex: 255
    SolutionNameMin: Cijk_Ailk_Bljk_HHS_BH_MT128x192x32_MI32x32x8x1_SN_AMAS3_LRVW8_MIAV1_NEPBS0_NLCA1_SPO1_SSO4_SVW2_TT2_96_VW2_WG64_4_1
    SolutionIndex: 256
    SolutionNameMin: Cijk_Ailk_Bljk_HHS_BH_MT128x192x32_MI32x32x8x1_SN_AMAS0_LRVW8_MIAV1_NEPBS4_NLCA1_SPO1_SSO0_SVW1_TT2_96_VW1_WG64_4_1
    SolutionIndex: 257
    SolutionNameMin: Cijk_Ailk_Bljk_HHS_BH_MT256x64x32_MI32x32x8x1_SN_AMAS3_LRVW4_MIAV0_NEPBS0_NLCA1_SPO0_SSO4_SVW2_TT2_64_VW2_WG128_2_1
    SolutionIndex: 258
    SolutionNameMin: Cijk_Ailk_Bljk_HHS_BH_MT128x192x32_MI32x32x8x1_SN_AMAS3_LRVW8_MIAV1_NEPBS0_NLCA1_SPO1_SSO0_SVW2_TT2_96_VW2_WG64_4_1
    SolutionIndex: 259
    SolutionNameMin: Cijk_Ailk_Bljk_HHS_BH_MT128x192x32_MI32x32x8x1_SN_AMAS0_LRVW8_MIAV1_NEPBS4_NLCA1_SPO0_SSO0_SVW1_TT2_96_VW1_WG64_4_1
    SolutionIndex: 260
    SolutionNameMin: Cijk_Ailk_Bljk_HHS_BH_MT256x64x32_MI32x32x8x1_SN_AMAS3_LRVW4_MIAV1_NEPBS0_NLCA1_SPO0_SSO0_SVW2_TT2_64_VW2_WG128_2_1
    SolutionIndex: 261
    SolutionNameMin: Cijk_Ailk_Bljk_HHS_BH_MT32x16x64_MI16x16x16x1_SN_MIAV1
    SolutionIndex: 262
    SolutionNameMin: Cijk_Ailk_Bljk_HHS_BH_MT16x16x64_MI16x16x16x1_SN_MIAV1
    SolutionIndex: 263
    SolutionNameMin: Cijk_Ailk_Bljk_HHS_BH_MT16x32x64_MI16x16x16x1_SN_LPA4_LPB4_MIAV1
    SolutionIndex: 264
    SolutionNameMin: Cijk_Ailk_Bljk_HHS_BH_MT32x16x64_MI16x16x16x1_SN_GRVW2_MIAV1_SSO1_SVW2_VW8
    SolutionIndex: 265
    SolutionNameMin: Cijk_Ailk_Bljk_HHS_BH_MT4x32x64_SN_
    SolutionIndex: 266
    SolutionNameMin: Cijk_Ailk_Bljk_HHS_BH_MT4x16x64_SN_
    SolutionIndex: 267
    SolutionNameMin: Cijk_Ailk_Bljk_HHS_BH_MT8x8x64_SN_GSU16_LDL2_LDW1
    SolutionIndex: 268
    SolutionNameMin: Cijk_Ailk_Bljk_HHS_BH_MT4x32x64_SN_GSU16_LPA2_LPB2_LDL8_LDW1
    SolutionIndex: 269
    SolutionNameMin: Cijk_Ailk_Bljk_HHS_BH_MT4x32x64_SN_LDL4_LDW1
    SolutionIndex: 270
    SolutionNameMin: Cijk_Ailk_Bljk_HHS_BH_MT128x128x32_MI32x32x8x1_SN_1LDSB1_AMAS0_GRVW8_LPB8_LRVW4_NLCA1_PLR5_SS1_SU32_SUS256_SVW1_TT2_64_VW1_WG64_4_1_WGM15
    SolutionIndex: 271
    SolutionNameMin: Cijk_Ailk_Bljk_HHS_BH_MT256x64x32_MI32x32x8x1_SN_1LDSB1_AMAS0_GRVW2_LPB8_LRVW8_NLCA2_PLR5_SS1_SU0_SUS0_SVW1_TT4_32_VW1_WG64_4_1_WGM1
    SolutionIndex: 272
    SolutionNameMin: Cijk_Ailk_Bljk_HHS_BH_MT128x128x32_MI32x32x8x1_SN_1LDSB1_AMAS3_GRVW8_LPB8_LRVW4_NLCA1_PLR5_SS1_SU0_SUS0_SVW2_TT2_64_VW2_WG64_4_1_WGM1
    SolutionIndex: 273
    SolutionNameMin: Cijk_Ailk_Bljk_HHS_BH_MT128x128x32_MI32x32x8x1_SN_1LDSB0_AMAS0_GRVW8_LPB8_LRVW8_NLCA1_PLR5_SS1_SU0_SUS0_SVW1_TT2_64_VW1_WG64_4_1_WGM1
    SolutionIndex: 274
    SolutionNameMin: Cijk_Ailk_Bljk_HHS_BH_MT128x96x64_MI32x32x8x1_SN_1LDSB0_AMAS0_GRVW4_LPB8_LRVW8_NLCA1_PLR9_SS1_SU0_SUS0_SVW1_TT1_96_VW1_WG128_2_1_WGM2
    SolutionIndex: 275
    SolutionNameMin: Cijk_Ailk_Bljk_HHS_BH_MT128x96x64_MI32x32x8x1_SN_1LDSB0_AMAS0_GRVW8_LPB8_LRVW8_NLCA1_PLR9_SS1_SU0_SUS0_SVW1_TT1_96_VW1_WG128_2_1_WGM1
    SolutionIndex: 276
    SolutionNameMin: Cijk_Ailk_Bljk_HHS_BH_MT64x64x64_MI32x32x8x1_SN_1LDSB0_AMAS0_GRVW8_LPB8_LRVW8_NLCA1_PLR5_SS1_SU0_SUS0_SVW1_TT1_32_VW1_WG64_4_2_WGM2
    SolutionIndex: 277
    SolutionNameMin: Cijk_Ailk_Bljk_HHS_BH_MT64x64x64_MI32x32x8x1_SN_1LDSB0_AMAS0_GRVW8_LPB8_LRVW8_NLCA1_PLR9_SS1_SU0_SUS0_SVW1_TT1_32_VW1_WG64_4_1_WGM2
    SolutionIndex: 278
    SolutionNameMin: Cijk_Ailk_Bljk_HHS_BH_MT256x64x32_MI32x32x8x1_SN_1LDSB1_AMAS3_GRVW8_LPB8_LRVW8_NLCA1_PLR5_SS1_SU0_SUS0_SVW4_TT4_32_VW4_WG64_4_1_WGM2
    SolutionIndex: 279
    SolutionNameMin: Cijk_Ailk_Bljk_HHS_BH_MT64x64x64_MI32x32x8x1_SN_1LDSB0_AMAS0_GRVW4_LPB8_LRVW8_NLCA1_PLR9_SS1_SU0_SUS0_SVW1_TT1_32_VW1_WG64_4_1_WGM1
    SolutionIndex: 280
    SolutionNameMin: Cijk_Ailk_Bljk_HHS_BH_MT16x16x64_MI16x16x16x1_SN_AMAS0_GRVW4_LPB4_LRVW4_PLR3_SS0_SU32_SUS256_SVW1_VW1_WG16_4_2_WGM8
    SolutionIndex: 281
    SolutionNameMin: Cijk_Ailk_Bljk_HHS_BH_MT16x16x64_MI16x16x16x1_SN_AMAS0_GRVW4_LPB4_LRVW4_PLR3_SS1_SU32_SUS256_SVW1_VW1_WG16_4_2_WGM15
    SolutionIndex: 282
    SolutionNameMin: Cijk_Ailk_Bljk_HHS_BH_MT64x16x128_MI16x16x16x1_SN_1LDSB0_AMAS0_GRVW8_LBSPP256_LPB16_LRVW8_MIAV1_NEPBS16_PLR9_SVW1_TT1_16_VW1_WG64_4_1_WGM1
    SolutionIndex: 283
    SolutionNameMin: Cijk_Ailk_Bljk_HHS_BH_MT64x16x128_MI16x16x16x1_SN_1LDSB0_AMAS0_GRVW8_LBSPP256_LPB16_LRVW8_MIAV0_NEPBS0_PLR9_SVW1_TT1_16_VW1_WG64_4_1_WGM1
    SolutionIndex: 284
    SolutionNameMin: Cijk_Ailk_Bljk_HHS_BH_MT128x256x32_MI32x32x8x1_SN_1LDSB0_AMAS0_GRVW8_LBSPP128_LPB8_LRVW8_MIAV0_NEPBS0_PLR5_SVW1_TT2_128_VW1_WG64_4_1_WGM15
    SolutionIndex: 285
    SolutionNameMin: Cijk_Ailk_Bljk_HHS_BH_MT128x128x32_MI32x32x8x1_SN_1LDSB1_AMAS0_GRVW8_LBSPP128_LPB8_LRVW4_MIAV1_NEPBS16_PLR5_SVW1_TT2_64_VW1_WG64_4_1_WGM2
    SolutionIndex: 286
    SolutionNameMin: Cijk_Ailk_Bljk_HHS_BH_MT64x64x16_MI32x32x8x1_SN_1LDSB0_AMAS0_GRVW8_LBSPP128_LPB8_LRVW4_MIAV1_NEPBS16_PLR3_SVW1_TT1_32_VW1_WG64_4_1_WGM2
    SolutionIndex: 287
    SolutionNameMin: Cijk_Ailk_Bljk_HHS_BH_MT128x48x64_MI16x16x16x1_SN_1LDSB0_AMAS3_GRVW4_LBSPP128_LPB4_LRVW4_MIAV0_NEPBS16_PLR5_SVW2_TT2_48_VW2_WG64_4_1_WGM1
    SolutionIndex: 288
    SolutionNameMin: Cijk_Ailk_Bljk_HHS_BH_MT256x64x32_MI32x32x8x1_SN_1LDSB1_AMAS3_GRVW8_LBSPP128_LPB8_LRVW4_MIAV0_NEPBS16_PLR5_SVW4_TT4_32_VW4_WG64_4_1_WGM15
    SolutionIndex: 289
    SolutionNameMin: Cijk_Ailk_Bljk_HHS_BH_MT64x128x64_MI32x32x8x1_SN_1LDSB0_AMAS3_GRVW8_LBSPP128_LPB8_LRVW8_MIAV0_NEPBS16_PLR9_SVW2_TT2_32_VW2_WG32_8_1_WGM15
    SolutionIndex: 290
    SolutionNameMin: Cijk_Ailk_Bljk_HHS_BH_MT64x64x64_MI16x16x16x1_SN_1LDSB1_AMAS0_GRVW8_LBSPP128_LPB16_LRVW8_MIAV1_NEPBS0_PLR5_SVW1_TT1_64_VW1_WG64_4_1_WGM1
    SolutionIndex: 291
    SolutionNameMin: Cijk_Ailk_Bljk_HHS_BH_MT256x128x32_MI32x32x8x1_SN_1LDSB1_AMAS3_GRVW8_GSU1_LPB8_LRVW8_NLCA1_PLR5_SU0_SUS0_SVW2_TT2_128_VW2_WG128_2_1
    SolutionIndex: 292
    SolutionNameMin: Cijk_Ailk_Bljk_HHS_BH_MT128x96x64_MI32x32x8x1_SN_1LDSB0_AMAS0_GRVW4_GSU1_LPB8_LRVW8_NLCA1_PLR9_SU0_SUS0_SVW1_TT1_96_VW1_WG128_2_1
    SolutionIndex: 293
    SolutionNameMin: Cijk_Ailk_Bljk_HHS_BH_MT128x96x32_MI32x32x8x1_SN_1LDSB0_AMAS0_GRVW2_LPB4_LRVW4_NTC0_NTD0_NEPBS0_PLR5_SU0_SUS0_SPO1_SSO0_SVW1_TT1_96_VW1_WG128_2_1
    SolutionIndex: 294
    SolutionNameMin: Cijk_Ailk_Bljk_HHS_BH_MT256x128x32_MI32x32x8x1_SN_1LDSB1_AMAS3_GRVW8_LPB8_LRVW8_NTD3_NLCA1_PLR5_SU0_SUS0_SPO1_SSO2_SVW2_TT4_64_VW2_WG64_4_1_WGM2
    SolutionIndex: 295
    SolutionNameMin: Cijk_Ailk_Bljk_HHS_BH_MT256x128x32_MI32x32x8x1_SN_1LDSB1_AMAS3_GRVW8_LPB8_LRVW8_NTD3_NEPBS2_NLCA1_PLR5_SU0_SUS0_SPO0_SSO0_SVW2_TT4_64_VW2_WG64_4_1_WGM16
    SolutionIndex: 296
    SolutionNameMin: Cijk_Ailk_Bljk_HHS_BH_MT128x128x32_MI32x32x8x1_SN_1LDSB1_AMAS3_GRVW8_LPB8_LRVW4_NTD3_NEPBS2_NLCA1_PLR5_SU0_SUS0_SPO1_SSO2_SVW2_TT2_64_VW2_WG64_4_1_WGM2
    SolutionIndex: 297
    SolutionNameMin: Cijk_Ailk_Bljk_HHS_BH_MT128x96x32_MI32x32x8x1_SN_1LDSB1_AMAS0_GRVW4_LPB8_LRVW8_NTD3_NEPBS0_NLCA1_PLR5_SU0_SUS0_SPO1_SSO2_SVW1_TT1_96_VW1_WG128_2_1_WGM2
    SolutionIndex: 298
    SolutionNameMin: Cijk_Ailk_Bljk_HHS_BH_MT256x128x32_MI32x32x8x1_SN_1LDSB1_AMAS3_GRVW8_LPB8_LRVW8_NTD3_NEPBS2_NLCA1_PLR5_SU0_SUS0_SPO1_SSO0_SVW2_TT4_64_VW2_WG64_4_1_WGM2
    SolutionIndex: 299
    SolutionNameMin: Cijk_Ailk_Bljk_HHS_BH_MT128x128x32_MI32x32x8x1_SN_1LDSB1_AMAS3_GRVW8_LPB8_LRVW4_NTD3_NEPBS0_NLCA1_PLR5_SU0_SUS0_SPO1_SSO2_SVW2_TT2_64_VW2_WG64_4_1_WGM8
    SolutionIndex: 300
    SolutionNameMin: Cijk_Ailk_Bljk_HHS_BH_MT128x128x32_MI32x32x8x1_SN_1LDSB0_AMAS3_GRVW4_GSU4_GSUAMB_LPB4_LRVW4_MIAV0_NTC0_NTD3_PLR5_SU32_SUS256_SVW2_TT2_64_VW2_WG64_4_1_WGM15
    SolutionIndex: 301
    SolutionNameMin: Cijk_Ailk_Bljk_HHS_BH_MT128x128x32_MI32x32x8x1_SN_AMAS3_GRVW2_LPB8_LRVW8_SS1_SPO0_SVW2_TT2_64_VW2_WG64_4_1
- - - [1024, 1024, 1, 3328]
    - [4, 56.086]
  - - [2944, 4288, 1, 1280]
    - [18, 70.976]
  - - [2368, 64, 1, 3328]
    - [6, 16.098]
  - - [2368, 5888, 1, 256]
    - [7, 45.134]
  - - [256, 704, 1, 1280]
    - [8, 12.495]
  - - [128, 6784, 1, 3328]
    - [49, 41.409]
  - - [5888, 1856, 1, 3328]
    - [10, 77.137]
  - - [5888, 2944, 1, 3328]
    - [10, 81.741]
  - - [1856, 4288, 1, 256]
    - [12, 38.067]
  - - [5056, 5056, 1, 3328]
    - [18, 86.924]
  - - [1408, 5888, 1, 1280]
    - [14, 65.618]
  - - [1024, 3584, 1, 3328]
    - [4, 73.547]
  - - [448, 3584, 1, 3328]
    - [15, 64.114]
  - - [256, 4288, 1, 3328]
    - [4, 58.883]
  - - [5888, 1408, 1, 1280]
    - [112, 66.044]
  - - [704, 1856, 1, 3328]
    - [17, 56.183]
  - - [1024, 2368, 1, 256]
    - [5, 27.213]
  - - [5056, 6784, 1, 1280]
    - [18, 81.023]
  - - [1408, 64, 1, 1280]
    - [19, 7.384]
  - - [448, 1024, 1, 1280]
    - [20, 23.46]
  - - [5056, 5056, 1, 1280]
    - [18, 77.759]
  - - [4288, 6784, 1, 256]
    - [7, 50.665]
  - - [6784, 448, 1, 256]
    - [22, 27.056]
  - - [5056, 256, 1, 1280]
    - [29, 34.608]
  - - [5888, 704, 1, 1280]
    - [22, 59.011]
  - - [3584, 1024, 1, 256]
    - [7, 30.33]
  - - [6784, 4288, 1, 3328]
    - [18, 87.396]
  - - [1856, 2368, 1, 3328]
    - [24, 68.549]
  - - [5888, 2944, 1, 1280]
    - [21, 74.643]
  - - [5888, 1024, 1, 256]
    - [25, 35.49]
  - - [448, 64, 1, 1280]
    - [19, 2.349]
  - - [1024, 704, 1, 256]
    - [26, 13.243]
  - - [1408, 2944, 1, 256]
    - [22, 30.115]
  - - [256, 1856, 1, 1280]
    - [20, 22.764]
  - - [6784, 5056, 1, 3328]
    - [27, 88.628]
  - - [5056, 5056, 1, 256]
    - [7, 49.219]
  - - [256, 2944, 1, 3328]
    - [20, 54.239]
  - - [64, 1024, 1, 1280]
    - [28, 5.222]
  - - [1024, 3584, 1, 1280]
    - [5, 56.717]
  - - [2368, 2944, 1, 1280]
    - [5, 62.4]
  - - [128, 3584, 1, 1280]
    - [15, 22.426]
  - - [6784, 6784, 1, 1280]
    - [21, 79.428]
  - - [1024, 256, 1, 3328]
    - [30, 25.464]
  - - [1408, 4288, 1, 1280]
    - [5, 65.073]
  - - [3584, 4288, 1, 1280]
    - [14, 73.581]
  - - [2368, 704, 1, 1280]
    - [26, 38.079]
  - - [5056, 4288, 1, 3328]
    - [27, 83.71]
  - - [3584, 2368, 1, 3328]
    - [49, 77.887]
  - - [5888, 6784, 1, 1280]
    - [21, 79.279]
  - - [64, 704, 1, 1280]
    - [32, 3.692]
  - - [4288, 256, 1, 256]
    - [22, 16.237]
  - - [6784, 448, 1, 1280]
    - [22, 49.78]
  - - [2944, 5888, 1, 256]
    - [7, 47.033]
  - - [256, 128, 1, 256]
    - [32, 0.822]
  - - [4288, 2944, 1, 256]
    - [25, 44.08]
  - - [5888, 64, 1, 3328]
    - [34, 35.148]
  - - [2944, 256, 1, 3328]
    - [15, 45.79]
  - - [5056, 2368, 1, 1280]
    - [60, 68.439]
  - - [448, 3584, 1, 1280]
    - [15, 47.94]
  - - [6784, 5888, 1, 256]
    - [118, 51.435]
  - - [64, 1024, 1, 3328]
    - [19, 8.358]
  - - [704, 128, 1, 1280]
    - [19, 7.26]
  - - [1408, 448, 1, 1280]
    - [20, 30.322]
  - - [1024, 1408, 1, 256]
    - [22, 21.436]
  - - [2368, 2368, 1, 3328]
    - [10, 69.596]
  - - [5056, 704, 1, 3328]
    - [31, 66.41]
  - - [1408, 1856, 1, 256]
    - [21, 18.477]
  - - [1408, 256, 1, 1280]
    - [30, 22.899]
  - - [5888, 1856, 1, 256]
    - [38, 41.527]
  - - [704, 5888, 1, 256]
    - [25, 31.297]
  - - [6784, 64, 1, 256]
    - [39, 8.577]
  - - [3584, 704, 1, 3328]
    - [22, 67.239]
  - - [1408, 1408, 1, 256]
    - [40, 22.781]
  - - [1024, 64, 1, 1280]
    - [19, 5.495]
  - - [448, 4288, 1, 256]
    - [41, 22.707]
  - - [64, 3584, 1, 3328]
    - [42, 21.773]
  - - [704, 2368, 1, 1280]
    - [72, 38.072]
  - - [1856, 2368, 1, 1280]
    - [5, 58.578]
  - - [2368, 128, 1, 3328]
    - [44, 29.366]
  - - [1408, 1408, 1, 3328]
    - [45, 68.763]
  - - [2944, 128, 1, 256]
    - [46, 7.548]
  - - [448, 1408, 1, 256]
    - [39, 11.737]
  - - [64, 5056, 1, 3328]
    - [44, 28.683]
  - - [1408, 1024, 1, 1280]
    - [47, 47.908]
  - - [704, 6784, 1, 256]
    - [60, 25.574]
  - - [6784, 704, 1, 256]
    - [25, 34.266]
  - - [256, 3584, 1, 3328]
    - [49, 48.936]
  - - [5056, 704, 1, 256]
    - [22, 31.11]
  - - [1408, 3584, 1, 256]
    - [58, 27.886]
  - - [3584, 4288, 1, 3328]
    - [18, 81.497]
  - - [5888, 1856, 1, 1280]
    - [21, 68.639]
  - - [256, 1408, 1, 256]
    - [44, 3.691]
  - - [5056, 64, 1, 1280]
    - [44, 20.557]
  - - [2368, 128, 1, 256]
    - [82, 3.322]
  - - [2368, 3584, 1, 1280]
    - [18, 62.009]
  - - [1024, 256, 1, 256]
    - [39, 2.716]
  - - [448, 448, 1, 256]
    - [52, 4.488]
  - - [2944, 3584, 1, 3328]
    - [10, 78.465]
  - - [256, 256, 1, 3328]
    - [53, 8.387]
  - - [128, 1024, 1, 3328]
    - [54, 13.922]
  - - [6784, 2944, 1, 256]
    - [25, 47.333]
  - - [64, 1856, 1, 1280]
    - [6, 8.275]
  - - [448, 256, 1, 256]
    - [55, 2.605]
  - - [1856, 2368, 1, 256]
    - [25, 32.255]
  - - [3584, 6784, 1, 3328]
    - [18, 89.246]
  - - [256, 1024, 1, 256]
    - [50, 5.861]
  - - [1024, 128, 1, 1280]
    - [6, 9.132]
  - - [4288, 128, 1, 1280]
    - [206, 19.354]
  - - [5056, 4288, 1, 1280]
    - [21, 75.338]
  - - [5888, 64, 1, 256]
    - [50, 7.548]
  - - [6784, 1856, 1, 3328]
    - [11, 80.501]
  - - [1408, 5056, 1, 1280]
    - [5, 63.181]
  - - [1856, 256, 1, 1280]
    - [57, 23.958]
  - - [64, 5888, 1, 3328]
    - [44, 31.823]
  - - [6784, 5888, 1, 3328]
    - [18, 86.189]
  - - [448, 256, 1, 3328]
    - [8, 12.148]
  - - [2368, 5056, 1, 1280]
    - [25, 68.713]
  - - [1024, 704, 1, 1280]
    - [15, 35.241]
  - - [256, 1408, 1, 3328]
    - [44, 35.013]
  - - [6784, 128, 1, 3328]
    - [23, 34.519]
  - - [1024, 5056, 1, 1280]
    - [5, 67.814]
  - - [4288, 1024, 1, 256]
    - [22, 32.556]
  - - [2368, 1408, 1, 256]
    - [48, 21.37]
  - - [704, 704, 1, 3328]
    - [9, 35.875]
  - - [5888, 448, 1, 1280]
    - [98, 45.632]
  - - [3584, 256, 1, 3328]
    - [4, 48.522]
  - - [704, 5888, 1, 3328]
    - [57, 70.55]
  - - [1024, 6784, 1, 1280]
    - [10, 60.836]
  - - [128, 3584, 1, 3328]
    - [57, 33.206]
  - - [128, 704, 1, 1280]
    - [19, 7.18]
  - - [3584, 2944, 1, 1280]
    - [5, 72.562]
  - - [1856, 128, 1, 3328]
    - [44, 23.503]
  - - [128, 2944, 1, 1280]
    - [44, 23.939]
  - - [448, 1856, 1, 1280]
    - [26, 27.964]
  - - [1408, 5056, 1, 3328]
    - [24, 77.175]
  - - [1856, 1856, 1, 3328]
    - [91, 69.929]
  - - [3584, 128, 1, 256]
    - [39, 8.375]
  - - [448, 1408, 1, 3328]
    - [59, 46.194]
  - - [2368, 2368, 1, 256]
    - [25, 29.495]
  - - [4288, 4288, 1, 1280]
    - [60, 74.421]
  - - [64, 448, 1, 1280]
    - [19, 1.426]
  - - [5888, 1024, 1, 1280]
    - [18, 62.576]
  - - [704, 1024, 1, 256]
    - [26, 13.329]
  - - [704, 6784, 1, 3328]
    - [20, 70.036]
  - - [5888, 5888, 1, 3328]
    - [18, 89.759]
  - - [5056, 1024, 1, 1280]
    - [63, 65.552]
  - - [448, 5888, 1, 3328]
    - [64, 59.793]
  - - [1024, 2944, 1, 1280]
    - [64, 55.101]
  - - [5056, 5888, 1, 1280]
    - [18, 78.6]
  - - [448, 6784, 1, 256]
    - [124, 20.28]
  - - [256, 3584, 1, 256]
    - [37, 13.855]
  - - [256, 448, 1, 256]
    - [93, 1.234]
  - - [3584, 5888, 1, 256]
    - [38, 48.344]
  - - [2944, 3584, 1, 256]
    - [38, 43.544]
  - - [1408, 704, 1, 256]
    - [65, 14.586]
  - - [6784, 1024, 1, 3328]
    - [49, 73.967]
  - - [6784, 2944, 1, 3328]
    - [47, 83.551]
  - - [64, 64, 1, 3328]
    - [197, 0.477]
  - - [6784, 2368, 1, 1280]
    - [21, 71.641]
  - - [4288, 3584, 1, 256]
    - [25, 45.933]
  - - [4288, 5888, 1, 1280]
    - [18, 77.849]
  - - [448, 2944, 1, 3328]
    - [47, 55.069]
  - - [4288, 1856, 1, 1280]
    - [22, 66.303]
  - - [1856, 2944, 1, 3328]
    - [18, 68.02]
  - - [256, 6784, 1, 3328]
    - [68, 56.664]
  - - [64, 5888, 1, 256]
    - [6, 3.802]
  - - [5056, 1024, 1, 256]
    - [67, 36.962]
  - - [704, 64, 1, 3328]
    - [197, 4.506]
  - - [5056, 1856, 1, 3328]
    - [11, 79.2]
  - - [448, 448, 1, 3328]
    - [8, 20.904]
  - - [448, 2368, 1, 1280]
    - [49, 32.197]
  - - [1408, 128, 1, 1280]
    - [54, 12.495]
  - - [5056, 256, 1, 3328]
    - [33, 52.322]
  - - [704, 704, 1, 256]
    - [26, 9.405]
  - - [1024, 5888, 1, 1280]
    - [5, 64.455]
  - - [64, 128, 1, 256]
    - [66, 0.205]
  - - [128, 1856, 1, 1280]
    - [209, 9.405]
  - - [5056, 3584, 1, 256]
    - [38, 47.556]
  - - [1856, 1024, 1, 1280]
    - [115, 43.262]
  - - [1856, 1856, 1, 1280]
    - [4, 52.572]
  - - [128, 4288, 1, 3328]
    - [20, 39.729]
  - - [1856, 1024, 1, 3328]
    - [115, 60.446]
  - - [256, 2368, 1, 256]
    - [39, 6.086]
  - - [1024, 448, 1, 3328]
    - [9, 33.079]
  - - [1856, 704, 1, 1280]
    - [29, 36.983]
  - - [6784, 1024, 1, 256]
    - [25, 32.463]
  - - [5056, 5888, 1, 3328]
    - [27, 86.128]
  - - [1856, 1024, 1, 256]
    - [41, 22.283]
  - - [5056, 1408, 1, 3328]
    - [95, 76.177]
  - - [1024, 1024, 1, 1280]
    - [4, 38.478]
  - - [448, 5888, 1, 256]
    - [194, 18.233]
  - - [1408, 6784, 1, 3328]
    - [27, 79.979]
  - - [2944, 1408, 1, 3328]
    - [72, 75.448]
  - - [2944, 4288, 1, 3328]
    - [27, 82.169]
  - - [256, 2944, 1, 256]
    - [39, 13.336]
  - - [5056, 2944, 1, 256]
    - [16, 45.526]
  - - [2368, 1856, 1, 256]
    - [73, 31.93]
  - - [128, 6784, 1, 1280]
    - [49, 27.675]
  - - [1408, 3584, 1, 3328]
    - [17, 78.265]
  - - [2368, 6784, 1, 256]
    - [7, 46.103]
  - - [4288, 2368, 1, 3328]
    - [83, 79.746]
  - - [704, 3584, 1, 1280]
    - [20, 53.431]
  - - [1408, 5888, 1, 3328]
    - [47, 78.2]
  - - [1856, 5056, 1, 256]
    - [25, 40.396]
  - - [6784, 6784, 1, 256]
    - [36, 51.71]
  - - [1408, 704, 1, 3328]
    - [4, 53.17]
  - - [128, 5888, 1, 1280]
    - [15, 37.222]
  - - [2368, 4288, 1, 1280]
    - [27, 73.326]
  - - [3584, 1856, 1, 1280]
    - [94, 60.784]
  - - [704, 1408, 1, 3328]
    - [4, 53.17]
  - - [704, 64, 1, 1280]
    - [19, 3.756]
  - - [3584, 448, 1, 256]
    - [76, 23.272]
  - - [3584, 3584, 1, 1280]
    - [18, 72.586]
  - - [256, 6784, 1, 256]
    - [37, 25.556]
  - - [1856, 3584, 1, 3328]
    - [20, 73.454]
  - - [128, 448, 1, 256]
    - [32, 1.402]
  - - [3584, 3584, 1, 256]
    - [48, 44.21]
  - - [6784, 4288, 1, 1280]
    - [21, 77.045]
  - - [448, 704, 1, 1280]
    - [30, 20.396]
  - - [3584, 5056, 1, 256]
    - [38, 46.706]
  - - [6784, 128, 1, 256]
    - [37, 7.754]
  - - [64, 1408, 1, 3328]
    - [53, 11.263]
  - - [704, 448, 1, 256]
    - [44, 3.405]
  - - [2944, 2368, 1, 1280]
    - [5, 62.62]
  - - [448, 64, 1, 3328]
    - [55, 3.785]
  - - [6784, 3584, 1, 256]
    - [78, 48.297]
  - - [256, 1856, 1, 3328]
    - [57, 34.326]
  - - [256, 704, 1, 256]
    - [50, 4.093]
  - - [128, 1408, 1, 256]
    - [39, 1.954]
  - - [64, 128, 1, 3328]
    - [197, 0.887]
  - - [1856, 1408, 1, 256]
    - [22, 27.408]
  - - [2944, 2944, 1, 3328]
    - [49, 79.342]
  - - [5056, 6784, 1, 256]
    - [38, 51.714]
  - - [1408, 4288, 1, 3328]
    - [45, 74.86]
  - - [6784, 256, 1, 1280]
    - [5, 36.545]
  - - [1024, 704, 1, 3328]
    - [15, 52.793]
  - - [2368, 704, 1, 3328]
    - [83, 55.516]
  - - [128, 4288, 1, 256]
    - [39, 9.956]
  - - [3584, 6784, 1, 256]
    - [16, 48.733]
  - - [128, 128, 1, 3328]
    - [197, 1.709]
  - - [5056, 1856, 1, 256]
    - [25, 40.639]
  - - [704, 4288, 1, 256]
    - [37, 27.294]
  - - [256, 448, 1, 3328]
    - [54, 12.182]
  - - [1408, 6784, 1, 1280]
    - [18, 69.186]
  - - [64, 2368, 1, 1280]
    - [6, 10.558]
  - - [64, 6784, 1, 3328]
    - [206, 26.676]
  - - [2944, 256, 1, 1280]
    - [57, 37.739]
  - - [5056, 2368, 1, 3328]
    - [13, 81.069]
  - - [2944, 4288, 1, 256]
    - [38, 43.762]
  - - [1408, 3584, 1, 1280]
    - [33, 62.645]
  - - [2368, 64, 1, 256]
    - [52, 3.497]
  - - [256, 256, 1, 256]
    - [32, 1.644]
  - - [704, 128, 1, 3328]
    - [19, 11.453]
  - - [1856, 704, 1, 256]
    - [37, 19.227]
  - - [2368, 6784, 1, 3328]
    - [18, 82.523]
  - - [5056, 704, 1, 1280]
    - [45, 49.672]
  - - [1856, 4288, 1, 3328]
    - [29, 76.823]
  - - [1408, 5888, 1, 256]
    - [7, 38.442]
  - - [704, 2944, 1, 1280]
    - [5, 48.6]
  - - [4288, 64, 1, 1280]
    - [34, 17.59]
  - - [704, 1856, 1, 256]
    - [190, 10.958]
  - - [3584, 704, 1, 1280]
    - [22, 55.807]
  - - [5888, 5056, 1, 256]
    - [7, 49.574]
  - - [3584, 448, 1, 3328]
    - [79, 59.607]
  - - [704, 2368, 1, 3328]
    - [85, 54.174]
  - - [2944, 448, 1, 256]
    - [22, 19.609]
  - - [448, 5056, 1, 3328]
    - [57, 60.747]
  - - [2368, 128, 1, 1280]
    - [44, 19.256]
  - - [4288, 448, 1, 256]
    - [76, 13.896]
  - - [64, 6784, 1, 256]
    - [77, 4.479]
  - - [64, 5056, 1, 1280]
    - [30, 19.942]
  - - [5888, 2368, 1, 256]
    - [73, 40.355]
  - - [704, 448, 1, 3328]
    - [44, 30.716]
  - - [6784, 704, 1, 3328]
    - [37, 68.518]
  - - [128, 64, 1, 1280]
    - [55, 0.667]
  - - [2368, 256, 1, 1280]
    - [15, 30.461]
  - - [1408, 2944, 1, 3328]
    - [20, 70.008]
  - - [64, 1024, 1, 256]
    - [32, 1.602]
  - - [2368, 448, 1, 1280]
    - [4, 32.496]
  - - [128, 3584, 1, 256]
    - [77, 4.608]
  - - [1856, 448, 1, 3328]
    - [44, 41.338]
  - - [128, 5056, 1, 256]
    - [39, 11.965]
  - - [4288, 4288, 1, 256]
    - [38, 48.036]
  - - [2368, 704, 1, 256]
    - [22, 24.162]
  - - [3584, 2368, 1, 256]
    - [38, 39.165]
  - - [5888, 5056, 1, 1280]
    - [21, 77.368]
  - - [128, 1024, 1, 1280]
    - [54, 9.311]
  - - [64, 704, 1, 256]
    - [19, 1.101]
  - - [4288, 256, 1, 1280]
    - [4, 34.137]
  - - [3584, 3584, 1, 3328]
    - [113, 83.748]
  - - [128, 1024, 1, 256]
    - [86, 1.476]
  - - [5888, 6784, 1, 256]
    - [38, 51.318]
  - - [4288, 2944, 1, 3328]
    - [18, 82.864]
  - - [1856, 64, 1, 256]
    - [52, 2.719]
  - - [4288, 128, 1, 3328]
    - [9, 40.591]
  - - [256, 5056, 1, 1280]
    - [22, 34.943]
  - - [6784, 5888, 1, 1280]
    - [113, 82.281]
  - - [704, 128, 1, 256]
    - [19, 2.221]
  - - [5888, 4288, 1, 1280]
    - [21, 77.206]
  - - [448, 256, 1, 1280]
    - [6, 8.068]
  - - [448, 2368, 1, 3328]
    - [4, 56.988]
  - - [1, 1, 1, 1280]
    - [2, 0.0]
  - - [256, 1408, 1, 1280]
    - [82, 22.699]
  - - [1408, 1856, 1, 1280]
    - [47, 44.721]
  - - [5888, 448, 1, 3328]
    - [33, 60.459]
  - - [704, 5888, 1, 1280]
    - [20, 56.986]
  - - [256, 64, 1, 3328]
    - [197, 1.663]
  - - [128, 2368, 1, 256]
    - [109, 3.107]
  - - [6784, 64, 1, 3328]
    - [81, 23.832]
  - - [5056, 2944, 1, 3328]
    - [29, 82.564]
  - - [448, 128, 1, 256]
    - [32, 1.39]
  - - [1856, 128, 1, 1280]
    - [84, 15.159]
  - - [448, 4288, 1, 1280]
    - [183, 42.267]
  - - [64, 3584, 1, 256]
    - [80, 2.422]
  - - [128, 2944, 1, 3328]
    - [44, 35.952]
  - - [3584, 704, 1, 256]
    - [76, 25.445]
  - - [2944, 448, 1, 3328]
    - [17, 56.646]
  - - [3584, 1408, 1, 3328]
    - [47, 77.8]
  - - [2368, 1024, 1, 1280]
    - [95, 49.201]
  - - [2944, 6784, 1, 1280]
    - [14, 75.955]
  - - [1856, 6784, 1, 256]
    - [38, 44.18]
  - - [4288, 448, 1, 3328]
    - [83, 66.081]
  - - [6784, 704, 1, 1280]
    - [65, 56.193]
  - - [5888, 1024, 1, 3328]
    - [18, 75.181]
  - - [704, 6784, 1, 1280]
    - [20, 54.335]
  - - [5888, 128, 1, 256]
    - [26, 13.017]
  - - [5056, 1024, 1, 3328]
    - [4, 79.009]
  - - [704, 5056, 1, 1280]
    - [183, 49.135]
  - - [64, 704, 1, 3328]
    - [86, 5.825]
  - - [2944, 1856, 1, 256]
    - [25, 33.389]
  - - [5056, 64, 1, 256]
    - [6, 3.265]
  - - [5888, 5056, 1, 3328]
    - [18, 85.377]
  - - [128, 5056, 1, 3328]
    - [15, 46.755]
  - - [3584, 6784, 1, 1280]
    - [18, 78.883]
  - - [1856, 5888, 1, 256]
    - [38, 42.536]
  - - [64, 448, 1, 3328]
    - [197, 2.945]
  - - [4288, 4288, 1, 3328]
    - [10, 83.616]
  - - [4288, 1408, 1, 1280]
    - [87, 64.542]
  - - [64, 1856, 1, 256]
    - [66, 2.785]
  - - [4288, 2368, 1, 256]
    - [25, 42.506]
  - - [2944, 5056, 1, 1280]
    - [25, 71.681]
  - - [256, 4288, 1, 1280]
    - [49, 39.876]
  - - [6784, 2368, 1, 3328]
    - [27, 82.219]
  - - [256, 1024, 1, 1280]
    - [30, 16.654]
  - - [4288, 128, 1, 256]
    - [26, 10.28]
  - - [4288, 1856, 1, 3328]
    - [31, 78.779]
  - - [1856, 2944, 1, 1280]
    - [22, 59.515]
  - - [3584, 64, 1, 1280]
    - [34, 9.357]
  - - [4288, 6784, 1, 3328]
    - [27, 88.017]
  - - [3584, 1024, 1, 1280]
    - [5, 62.634]
  - - [1024, 4288, 1, 256]
    - [38, 31.661]
  - - [5888, 3584, 1, 3328]
    - [18, 89.761]
  - - [5056, 3584, 1, 3328]
    - [29, 83.052]
  - - [1408, 128, 1, 3328]
    - [54, 18.363]
  - - [2368, 1408, 1, 1280]
    - [171, 52.353]
  - - [5056, 2944, 1, 1280]
    - [18, 70.177]
  - - [3584, 256, 1, 256]
    - [37, 14.024]
  - - [1024, 6784, 1, 256]
    - [21, 36.831]
  - - [2944, 5056, 1, 3328]
    - [10, 83.169]
  - - [3584, 2944, 1, 256]
    - [48, 43.289]
  - - [448, 128, 1, 3328]
    - [19, 7.466]
  - - [64, 2944, 1, 3328]
    - [6, 19.355]
  - - [64, 4288, 1, 3328]
    - [44, 25.22]
  - - [5056, 6784, 1, 3328]
    - [18, 89.336]
  - - [128, 2944, 1, 256]
    - [80, 7.654]
  - - [3584, 4288, 1, 256]
    - [7, 45.184]
  - - [1856, 6784, 1, 3328]
    - [18, 80.646]
  - - [3584, 128, 1, 3328]
    - [9, 33.142]
  - - [128, 256, 1, 1280]
    - [66, 2.685]
  - - [64, 448, 1, 256]
    - [28, 0.351]
  - - [64, 256, 1, 1280]
    - [55, 1.366]
  - - [5056, 1408, 1, 1280]
    - [60, 62.579]
  - - [5888, 5888, 1, 256]
    - [38, 50.706]
  - - [4288, 1024, 1, 1280]
    - [29, 55.341]
  - - [5888, 128, 1, 3328]
    - [9, 53.018]
  - - [448, 6784, 1, 3328]
    - [20, 64.007]
  - - [2944, 1408, 1, 1280]
    - [22, 60.078]
  - - [64, 128, 1, 1280]
    - [61, 0.691]
  - - [2944, 1856, 1, 3328]
    - [10, 68.36]
  - - [448, 5056, 1, 256]
    - [39, 15.983]
  - - [64, 64, 1, 256]
    - [88, 0.101]
  - - [3584, 5888, 1, 1280]
    - [27, 80.254]
  - - [6784, 1856, 1, 1280]
    - [12, 71.319]
  - - [5888, 256, 1, 3328]
    - [29, 64.739]
  - - [1856, 5888, 1, 3328]
    - [47, 77.976]
  - - [3584, 1408, 1, 256]
    - [89, 28.29]
  - - [704, 3584, 1, 3328]
    - [57, 68.228]
  - - [5056, 448, 1, 1280]
    - [5, 53.55]
  - - [3584, 1856, 1, 3328]
    - [79, 75.43]
  - - [1408, 704, 1, 1280]
    - [4, 35.826]
  - - [2944, 1024, 1, 256]
    - [65, 20.169]
  - - [448, 1408, 1, 1280]
    - [57, 32.03]
  - - [2368, 4288, 1, 3328]
    - [72, 78.825]
  - - [1024, 1408, 1, 1280]
    - [29, 47.798]
  - - [256, 128, 1, 1280]
    - [28, 1.629]
  - - [704, 1408, 1, 1280]
    - [49, 31.538]
  - - [6784, 5056, 1, 256]
    - [36, 50.397]
  - - [4288, 5888, 1, 256]
    - [106, 48.973]
  - - [448, 2944, 1, 256]
    - [92, 19.212]
  - - [2944, 6784, 1, 256]
    - [38, 47.844]
  - - [2368, 2368, 1, 1280]
    - [22, 61.123]
  - - [1856, 3584, 1, 1280]
    - [5, 59.919]
  - - [64, 2944, 1, 256]
    - [44, 1.989]
  - - [3584, 1408, 1, 1280]
    - [29, 62.981]
  - - [5056, 3584, 1, 1280]
    - [60, 74.155]
  - - [256, 5888, 1, 256]
    - [94, 12.108]
  - - [128, 256, 1, 3328]
    - [197, 3.327]
  - - [1856, 1408, 1, 3328]
    - [33, 59.24]
  - - [1024, 4288, 1, 3328]
    - [64, 69.051]
  - - [448, 2368, 1, 256]
    - [22, 16.02]
  - - [64, 1408, 1, 1280]
    - [19, 7.063]
  - - [64, 6784, 1, 1280]
    - [59, 15.521]
  - - [2944, 2368, 1, 3328]
    - [24, 76.166]
  - - [704, 4288, 1, 3328]
    - [27, 68.227]
  - - [1024, 1856, 1, 1280]
    - [68, 48.0]
  - - [6784, 1856, 1, 256]
    - [12, 43.44]
  - - [128, 2368, 1, 3328]
    - [44, 29.291]
  - - [1024, 5888, 1, 256]
    - [73, 30.074]
  - - [64, 2944, 1, 1280]
    - [44, 8.079]
  - - [5056, 64, 1, 3328]
    - [44, 31.596]
  - - [1408, 2368, 1, 256]
    - [22, 28.535]
  - - [2944, 704, 1, 3328]
    - [74, 61.432]
  - - [256, 64, 1, 256]
    - [51, 0.195]
  - - [2944, 2944, 1, 1280]
    - [5, 66.576]
  - - [6784, 256, 1, 3328]
    - [183, 50.837]
  - - [1408, 5056, 1, 256]
    - [21, 36.797]
  - - [5056, 128, 1, 3328]
    - [15, 39.26]
  - - [128, 128, 1, 1280]
    - [55, 1.335]
  - - [448, 704, 1, 256]
    - [80, 3.445]
  - - [1856, 256, 1, 3328]
    - [57, 34.932]
  - - [2944, 128, 1, 3328]
    - [34, 37.182]
  - - [704, 256, 1, 256]
    - [51, 3.998]
  - - [256, 448, 1, 1280]
    - [6, 8.068]
  - - [704, 256, 1, 1280]
    - [42, 7.287]
  - - [64, 2368, 1, 3328]
    - [8, 15.829]
  - - [256, 704, 1, 3328]
    - [54, 19.036]
  - - [1024, 1024, 1, 256]
    - [22, 15.67]
  - - [1408, 4288, 1, 256]
    - [7, 29.864]
  - - [5888, 2368, 1, 1280]
    - [21, 71.53]
  - - [128, 256, 1, 256]
    - [123, 0.389]
  - - [256, 64, 1, 1280]
    - [66, 1.382]
  - - [2368, 5888, 1, 1280]
    - [14, 69.904]
  - - [5888, 256, 1, 1280]
    - [47, 50.087]
  - - [704, 1024, 1, 1280]
    - [57, 37.396]
  - - [2368, 1856, 1, 3328]
    - [101, 68.663]
  - - [2944, 704, 1, 256]
    - [40, 23.911]
  - - [2368, 6784, 1, 1280]
    - [18, 74.21]
  - - [2368, 1024, 1, 3328]
    - [95, 71.646]
  - - [1856, 4288, 1, 1280]
    - [14, 64.118]
  - - [704, 3584, 1, 256]
    - [21, 17.714]
  - - [704, 2944, 1, 3328]
    - [74, 61.383]
  - - [1856, 5056, 1, 3328]
    - [27, 79.174]
  - - [3584, 5056, 1, 1280]
    - [21, 74.008]
  - - [2944, 1024, 1, 3328]
    - [102, 70.077]
  - - [256, 4288, 1, 256]
    - [94, 16.404]
  - - [2368, 256, 1, 256]
    - [26, 11.428]
  - - [1408, 6784, 1, 256]
    - [60, 36.101]
  - - [6784, 1408, 1, 3328]
    - [71, 79.976]
  - - [1024, 2368, 1, 1280]
    - [152, 52.531]
  - - [704, 64, 1, 256]
    - [19, 1.101]
  - - [256, 2368, 1, 3328]
    - [57, 43.796]
  - - [6784, 2944, 1, 1280]
    - [27, 76.055]
  - - [3584, 448, 1, 1280]
    - [94, 51.228]
  - - [2944, 6784, 1, 3328]
    - [29, 83.922]
  - - [448, 5056, 1, 1280]
    - [15, 44.214]
  - - [4288, 5056, 1, 1280]
    - [14, 74.547]
  - - [128, 448, 1, 1280]
    - [19, 4.646]
  - - [4288, 704, 1, 256]
    - [22, 27.38]
  - - [64, 64, 1, 1280]
    - [61, 0.35]
  - - [5888, 704, 1, 256]
    - [48, 30.267]
  - - [256, 5888, 1, 3328]
    - [64, 65.037]
  - - [6784, 4288, 1, 256]
    - [97, 49.412]
  - - [5888, 256, 1, 256]
    - [22, 21.957]
  - - [6784, 1024, 1, 1280]
    - [63, 60.279]
  - - [704, 448, 1, 1280]
    - [44, 12.527]
  - - [128, 64, 1, 3328]
    - [197, 0.861]
  - - [448, 64, 1, 256]
    - [51, 0.335]
  - - [2944, 704, 1, 1280]
    - [5, 50.065]
  - - [6784, 3584, 1, 1280]
    - [18, 80.347]
  - - [2944, 64, 1, 1280]
    - [54, 12.58]
  - - [1408, 2944, 1, 1280]
    - [94, 59.599]
  - - [256, 1856, 1, 256]
    - [39, 4.586]
  - - [1408, 2368, 1, 3328]
    - [49, 67.071]
  - - [128, 1408, 1, 3328]
    - [54, 18.667]
  - - [2368, 2944, 1, 256]
    - [103, 37.938]
  - - [64, 5056, 1, 256]
    - [8, 3.463]
  - - [1408, 256, 1, 3328]
    - [30, 35.195]
  - - [3584, 1856, 1, 256]
    - [67, 35.463]
  - - [4288, 3584, 1, 1280]
    - [18, 72.909]
  - - [2368, 448, 1, 256]
    - [104, 15.772]
  - - [4288, 256, 1, 3328]
    - [49, 58.465]
  - - [1408, 64, 1, 256]
    - [19, 2.166]
  - - [4288, 2944, 1, 1280]
    - [18, 71.169]
  - - [5056, 448, 1, 3328]
    - [49, 64.191]
  - - [1024, 64, 1, 256]
    - [19, 1.629]
  - - [64, 2368, 1, 256]
    - [52, 3.312]
  - - [4288, 5056, 1, 3328]
    - [18, 83.892]
  - - [2944, 256, 1, 256]
    - [39, 13.845]
  - - [1024, 128, 1, 3328]
    - [6, 13.766]
  - - [256, 5056, 1, 3328]
    - [98, 51.272]
  - - [5056, 2368, 1, 256]
    - [38, 42.95]
  - - [4288, 704, 1, 3328]
    - [102, 68.557]
  - - [448, 3584, 1, 256]
    - [105, 23.039]
  - - [2368, 64, 1, 1280]
    - [8, 10.661]
  - - [1024, 1408, 1, 3328]
    - [47, 61.995]
  - - [2944, 5888, 1, 1280]
    - [25, 73.101]
  - - [5888, 3584, 1, 256]
    - [38, 48.038]
  - - [1408, 1856, 1, 3328]
    - [29, 60.066]
  - - [6784, 1408, 1, 1280]
    - [21, 65.399]
  - - [704, 2944, 1, 256]
    - [40, 24.3]
  - - [4288, 64, 1, 256]
    - [52, 6.089]
  - - [2944, 5888, 1, 3328]
    - [24, 82.879]
  - - [64, 4288, 1, 1280]
    - [44, 17.207]
  - - [6784, 64, 1, 1280]
    - [26, 14.854]
  - - [704, 1856, 1, 1280]
    - [22, 42.535]
  - - [1408, 64, 1, 3328]
    - [19, 11.114]
  - - [1408, 1408, 1, 1280]
    - [85, 49.377]
  - - [448, 1024, 1, 3328]
    - [57, 33.794]
  - - [448, 4288, 1, 3328]
    - [183, 60.811]
  - - [704, 2368, 1, 256]
    - [107, 23.454]
  - - [2944, 448, 1, 1280]
    - [94, 43.032]
  - - [5888, 2368, 1, 3328]
    - [45, 79.677]
  - - [4288, 5056, 1, 256]
    - [25, 48.473]
  - - [4288, 448, 1, 1280]
    - [85, 48.517]
  - - [5888, 704, 1, 3328]
    - [37, 69.447]
  - - [4288, 3584, 1, 3328]
    - [18, 81.736]
  - - [2944, 64, 1, 256]
    - [51, 4.279]
  - - [1024, 6784, 1, 3328]
    - [24, 75.967]
  - - [1408, 1024, 1, 256]
    - [65, 21.217]
  - - [448, 1024, 1, 256]
    - [109, 8.705]
  - - [6784, 6784, 1, 3328]
    - [18, 89.668]
  - - [1024, 448, 1, 1280]
    - [39, 22.657]
  - - [704, 5056, 1, 3328]
    - [143, 66.18]
  - - [256, 2368, 1, 1280]
    - [20, 29.044]
  - - [3584, 5056, 1, 3328]
    - [29, 82.805]
  - - [2368, 2944, 1, 3328]
    - [29, 80.132]
  - - [448, 448, 1, 1280]
    - [6, 14.119]
  - - [2368, 3584, 1, 256]
    - [38, 40.797]
  - - [1024, 256, 1, 1280]
    - [30, 16.802]
  - - [128, 5056, 1, 1280]
    - [59, 31.11]
  - - [3584, 2368, 1, 1280]
    - [5, 65.848]
  - - [1856, 1856, 1, 256]
    - [25, 30.383]
  - - [4288, 1408, 1, 3328]
    - [27, 75.158]
  - - [3584, 64, 1, 3328]
    - [44, 22.223]
  - - [1, 1, 1, 1]
    - [0, 0.0]
  - - [256, 1024, 1, 3328]
    - [44, 25.464]
  - - [1856, 64, 1, 3328]
    - [8, 12.617]
  - - [5888, 1408, 1, 3328]
    - [29, 78.595]
  - - [256, 5056, 1, 256]
    - [37, 19.243]
  - - [1856, 64, 1, 1280]
    - [6, 8.316]
  - - [1408, 256, 1, 256]
    - [50, 7.479]
  - - [2368, 5056, 1, 256]
    - [38, 43.219]
  - - [128, 5888, 1, 3328]
    - [15, 54.448]
  - - [1024, 5056, 1, 256]
    - [7, 36.422]
  - - [2368, 1408, 1, 3328]
    - [206, 70.102]
  - - [5888, 448, 1, 256]
    - [37, 26.326]
  - - [6784, 5056, 1, 1280]
    - [27, 79.333]
  - - [4288, 6784, 1, 1280]
    - [18, 79.139]
  - - [2368, 448, 1, 3328]
    - [49, 56.502]
  - - [1024, 128, 1, 256]
    - [110, 2.977]
  - - [448, 128, 1, 1280]
    - [32, 2.79]
  - - [1024, 64, 1, 3328]
    - [19, 8.415]
  - - [64, 3584, 1, 1280]
    - [44, 14.445]
  - - [6784, 1408, 1, 256]
    - [25, 35.07]
  - - [5888, 4288, 1, 256]
    - [38, 49.004]
  - - [5056, 5888, 1, 256]
    - [25, 50.507]
  - - [2368, 1024, 1, 256]
    - [58, 16.963]
  - - [1856, 6784, 1, 1280]
    - [18, 71.263]
  - - [3584, 128, 1, 1280]
    - [57, 22.657]
  - - [128, 64, 1, 256]
    - [66, 0.204]
  - - [1408, 448, 1, 256]
    - [39, 11.231]
  - - [64, 256, 1, 3328]
    - [197, 1.685]
  - - [6784, 448, 1, 3328]
    - [37, 62.294]
  - - [5056, 1856, 1, 1280]
    - [63, 65.034]
  - - [1408, 1024, 1, 3328]
    - [112, 61.854]
  - - [2368, 256, 1, 3328]
    - [9, 45.099]
  - - [5888, 3584, 1, 1280]
    - [113, 80.551]
  - - [5888, 128, 1, 1280]
    - [20, 36.109]
  - - [1024, 2944, 1, 256]
    - [22, 26.754]
  - - [448, 6784, 1, 1280]
    - [20, 47.83]
  - - [256, 3584, 1, 1280]
    - [49, 27.332]
  - - [704, 5056, 1, 256]
    - [22, 22.02]
  - - [3584, 1024, 1, 3328]
    - [49, 73.391]
  - - [2944, 1856, 1, 1280]
    - [5, 59.923]
  - - [5056, 256, 1, 256]
    - [114, 19.047]
  - - [128, 5888, 1, 256]
    - [39, 13.758]
  - - [2368, 3584, 1, 3328]
    - [47, 79.139]
  - - [3584, 5888, 1, 3328]
    - [18, 90.252]
  - - [2944, 3584, 1, 1280]
    - [5, 66.706]
  - - [1856, 5888, 1, 1280]
    - [5, 67.812]
  - - [256, 256, 1, 1280]
    - [19, 5.37]
  - - [4288, 1408, 1, 256]
    - [25, 36.507]
  - - [3584, 64, 1, 256]
    - [51, 5.209]
  - - [64, 1856, 1, 3328]
    - [8, 12.441]
  - - [1408, 128, 1, 256]
    - [110, 1.853]
  - - [4288, 2368, 1, 1280]
    - [16, 67.341]
  - - [2944, 5056, 1, 256]
    - [7, 45.191]
  - - [256, 128, 1, 3328]
    - [19, 4.281]
  - - [6784, 2368, 1, 256]
    - [38, 45.16]
  - - [1408, 448, 1, 3328]
    - [15, 46.014]
  - - [4288, 1856, 1, 256]
    - [25, 38.257]
  - - [1856, 2944, 1, 256]
    - [14, 33.531]
  - - [64, 5888, 1, 1280]
    - [82, 22.364]
  - - [1856, 1408, 1, 1280]
    - [29, 45.326]
  - - [128, 704, 1, 256]
    - [32, 2.203]
  - - [1024, 4288, 1, 1280]
    - [24, 53.599]
  - - [2368, 5056, 1, 3328]
    - [10, 79.586]
  - - [4288, 1024, 1, 3328]
    - [151, 69.475]
  - - [1024, 5056, 1, 3328]
    - [68, 66.479]
  - - [1024, 1856, 1, 3328]
    - [68, 66.661]
  - - [704, 704, 1, 1280]
    - [15, 17.634]
  - - [128, 2368, 1, 1280]
    - [44, 19.602]
  - - [3584, 256, 1, 1280]
    - [49, 33.583]
  - - [5888, 64, 1, 1280]
    - [44, 23.424]
  - - [128, 704, 1, 3328]
    - [116, 11.3]
  - - [3584, 2944, 1, 3328]
    - [10, 77.992]
  - - [128, 1856, 1, 256]
    - [44, 2.45]
  - - [64, 4288, 1, 256]
    - [51, 5.82]
  - - [5888, 2944, 1, 256]
    - [38, 47.345]
  - - [5056, 128, 1, 1280]
    - [15, 22.122]
  - - [448, 1856, 1, 3328]
    - [209, 41.82]
  - - [5056, 4288, 1, 256]
    - [14, 48.7]
  - - [1024, 448, 1, 256]
    - [39, 4.623]
  - - [1024, 3584, 1, 256]
    - [38, 31.318]
  - - [2944, 128, 1, 1280]
    - [44, 23.834]
  - - [64, 256, 1, 256]
    - [88, 0.407]
  - - [704, 256, 1, 3328]
    - [6, 19.197]
  - - [5056, 1408, 1, 256]
    - [25, 38.023]
  - - [5888, 5888, 1, 1280]
    - [18, 80.678]
  - - [448, 5888, 1, 1280]
    - [64, 45.275]
  - - [1, 1, 1, 256]
    - [1, 0.0]
  - - [4288, 704, 1, 1280]
    - [33, 54.281]
  - - [2944, 1408, 1, 256]
    - [22, 24.316]
  - - [256, 2944, 1, 1280]
    - [57, 37.739]
  - - [2368, 5888, 1, 3328]
    - [45, 79.211]
  - - [704, 1024, 1, 3328]
    - [9, 53.419]
  - - [2368, 1856, 1, 1280]
    - [5, 58.523]
  - - [1856, 448, 1, 1280]
    - [39, 38.188]
  - - [128, 6784, 1, 256]
    - [39, 15.272]
  - - [5888, 4288, 1, 3328]
    - [10, 84.728]
  - - [1856, 128, 1, 256]
    - [51, 5.353]
  - - [5056, 448, 1, 256]
    - [5, 26.775]
  - - [1856, 5056, 1, 1280]
    - [27, 68.764]
  - - [2944, 1024, 1, 1280]
    - [98, 52.184]
  - - [2368, 4288, 1, 256]
    - [25, 42.754]
  - - [1024, 2368, 1, 3328]
    - [74, 71.646]
  - - [4288, 64, 1, 3328]
    - [44, 26.796]
  - - [704, 1408, 1, 256]
    - [107, 15.047]
  - - [4288, 5888, 1, 3328]
    - [18, 86.264]
  - - [448, 2944, 1, 1280]
    - [22, 42.838]
  - - [1024, 2944, 1, 3328]
    - [11, 69.904]
  - - [256, 6784, 1, 1280]
    - [5, 36.627]
  - - [1856, 3584, 1, 256]
    - [48, 30.705]
  - - [128, 448, 1, 3328]
    - [197, 6.325]
  - - [1856, 256, 1, 256]
    - [39, 8.957]
  - - [5056, 128, 1, 256]
    - [142, 6.62]
  - - [256, 5888, 1, 1280]
    - [64, 50.086]
  - - [6784, 128, 1, 1280]
    - [22, 22.892]
  - - [64, 1408, 1, 256]
    - [32, 2.26]
  - - [2944, 2368, 1, 256]
    - [38, 36.164]
  - - [1856, 448, 1, 256]
    - [39, 15.674]
  - - [1024, 1856, 1, 256]
    - [40, 22.193]
  - - [6784, 3584, 1, 3328]
    - [18, 89.641]
  - - [2944, 64, 1, 3328]
    - [54, 18.739]
  - - [1024, 5888, 1, 3328]
    - [113, 74.463]
  - - [1408, 2368, 1, 1280]
    - [22, 52.506]
  - - [128, 1408, 1, 1280]
    - [54, 12.616]
  - - [128, 1856, 1, 3328]
    - [44, 22.958]
  - - [2944, 2944, 1, 256]
    - [7, 39.617]
  - - [6784, 256, 1, 256]
    - [65, 24.921]
  - - [128, 4288, 1, 1280]
    - [9, 26.209]
  - - [5888, 1408, 1, 256]
    - [38, 38.381]
  - - [128, 128, 1, 256]
    - [28, 0.188]
  - - [448, 704, 1, 3328]
    - [30, 30.796]
  - - [448, 1856, 1, 256]
    - [39, 15.473]
  - - [1856, 704, 1, 3328]
    - [64, 56.119]
  - - [5888, 6784, 1, 3328]
    - [71, 87.804]
  - - [704, 4288, 1, 1280]
    - [33, 54.012]
  - - [4096, 7000, 1, 4096]
    - [11, 90.447]
  - - [5124, 9124, 1, 1760]
    - [113, 82.228]
  - - [1760, 32, 1, 1760]
    - [119, 4.596]
  - - [1024, 1500, 1, 1536]
    - [98, 45.397]
  - - [512, 24000, 1, 2048]
    - [151, 77.623]
  - - [3072, 24000, 1, 1024]
    - [18, 79.673]
  - - [1024, 3000, 1, 2560]
    - [47, 66.519]
  - - [512, 3136, 1, 2048]
    - [29, 59.088]
  - - [7680, 4, 1, 2560]
    - [51, 2.307]
  - - [64, 193600, 1, 64]
    - [120, 16.215]
  - - [8448, 1500, 1, 2816]
    - [56, 79.47]
  - - [2560, 7000, 1, 2560]
    - [47, 79.715]
  - - [3072, 16, 1, 1024]
    - [19, 2.85]
  - - [512, 48000, 1, 2048]
    - [27, 84.788]
  - - [1760, 64, 1, 1760]
    - [51, 5.842]
  - - [1024, 16, 1, 512]
    - [55, 0.733]
  - - [196, 256, 64, 1024]
    - [94, 35.589]
  - - [512, 48000, 1, 1536]
    - [18, 80.427]
  - - [2560, 32, 1, 2560]
    - [19, 9.158]
  - - [4608, 1500, 1, 1536]
    - [5, 64.435]
  - - [2048, 128, 1, 2048]
    - [44, 21.075]
  - - [1024, 24000, 1, 2560]
    - [27, 87.813]
  - - [4608, 3000, 1, 1536]
    - [18, 79.215]
  - - [5124, 9124, 1, 2048]
    - [113, 81.927]
  - - [2048, 16, 1, 2048]
    - [19, 3.331]
  - - [1024, 700, 1, 512]
    - [186, 13.385]
  - - [3072, 1, 1, 128]
    - [99, 0.043]
  - - [5124, 700, 1, 2560]
    - [10, 64.336]
  - - [8448, 16, 1, 2816]
    - [93, 9.746]
  - - [6144, 6000, 1, 2560]
    - [18, 85.271]
  - - [4608, 32, 1, 1536]
    - [80, 10.207]
  - - [3072, 64, 1, 1024]
    - [44, 9.611]
  - - [512, 16, 1, 512]
    - [19, 0.181]
  - - [7680, 2, 1, 2560]
    - [51, 1.166]
  - - [4224, 1, 1, 128]
    - [51, 0.057]
  - - [7680, 1, 1, 2560]
    - [52, 0.58]
  - - [128, 1500, 1, 1280]
    - [54, 13.506]
  - - [1024, 1500, 1, 2816]
    - [33, 58.465]
  - - [6144, 2, 1, 2560]
    - [121, 1.279]
  - - [8448, 48000, 1, 2816]
    - [18, 92.737]
  - - [512, 6000, 1, 2048]
    - [18, 63.362]
  - - [4224, 1500, 1, 176]
    - [172, 20.879]
  - - [1024, 6000, 1, 2816]
    - [18, 74.315]
  - - [1024, 48000, 1, 1536]
    - [18, 83.844]
  - - [1024, 48000, 1, 2560]
    - [18, 89.066]
  - - [4096, 32, 1, 4096]
    - [44, 13.382]
  - - [512, 16, 1, 500000]
    - [122, 7.954]
  - - [2560, 128, 1, 2560]
    - [44, 29.08]
  - - [4608, 24000, 1, 1536]
    - [18, 86.741]
  - - [512, 2, 1, 500000]
    - [122, 1.043]
  - - [7680, 48000, 1, 2560]
    - [18, 92.056]
  - - [3072, 48000, 1, 1024]
    - [21, 80.713]
  - - [1760, 16, 1, 1760]
    - [116, 1.558]
  - - [1024, 1500, 1, 2048]
    - [33, 49.987]
  - - [1024, 16, 1, 500000]
    - [122, 8.536]
  - - [64, 193600, 1, 256]
    - [124, 26.355]
  - - [1024, 3000, 1, 2048]
    - [17, 63.007]
  - - [6144, 4, 1, 2560]
    - [121, 2.55]
  - - [1024, 6000, 1, 2048]
    - [5, 71.096]
  - - [512, 24000, 1, 2816]
    - [31, 80.665]
  - - [6144, 48000, 1, 2560]
    - [18, 91.507]
  - - [1760, 7000, 1, 1760]
    - [70, 75.806]
  - - [8448, 3000, 1, 2816]
    - [27, 84.502]
  - - [3072, 4, 1, 1024]
    - [19, 0.875]
  - - [4608, 48000, 1, 1536]
    - [18, 87.129]
  - - [2048, 32, 1, 2048]
    - [19, 6.691]
  - - [7680, 1500, 1, 2560]
    - [10, 77.577]
  - - [4096, 128, 1, 4096]
    - [9, 39.729]
  - - [4608, 16, 1, 1536]
    - [19, 6.412]
  - - [512, 3000, 1, 1536]
    - [64, 52.018]
  - - [3072, 2, 1, 1024]
    - [19, 0.432]
  - - [8448, 1, 1, 2816]
    - [51, 0.641]
  - - [1024, 3000, 1, 2816]
    - [87, 67.309]
  - - [128, 1, 1, 1408]
    - [123, 0.011]
  - - [64, 1, 1, 1216]
    - [61, 0.005]
  - - [1024, 2, 1, 512]
    - [55, 0.095]
  - - [1024, 4, 1, 500000]
    - [122, 2.171]
  - - [6144, 1, 1, 2560]
    - [121, 0.631]
  - - [5124, 9124, 1, 2560]
    - [113, 84.008]
  - - [512, 48000, 1, 2816]
    - [18, 87.206]
  - - [512, 3000, 1, 2816]
    - [17, 63.124]
  - - [1024, 24000, 1, 1536]
    - [27, 81.945]
  - - [7680, 6000, 1, 2560]
    - [11, 86.207]
  - - [1760, 128, 1, 1760]
    - [30, 10.771]
  - - [512, 1500, 1, 2816]
    - [20, 43.46]
  - - [512, 1, 1, 512]
    - [88, 0.023]
  - - [512, 6000, 1, 2560]
    - [17, 65.342]
  - - [512, 8, 1, 500000]
    - [122, 3.973]
  - - [512, 24000, 1, 2560]
    - [13, 79.329]
  - - [6144, 3000, 1, 2560]
    - [10, 81.114]
  - - [1024, 24000, 1, 2816]
    - [18, 88.573]
  - - [2048, 7000, 1, 2048]
    - [14, 76.271]
  - - [7680, 3000, 1, 2560]
    - [18, 83.035]
  - - [1024, 4, 1, 512]
    - [19, 0.093]
  - - [5124, 700, 1, 2048]
    - [10, 60.321]
  - - [5124, 9124, 1, 4096]
    - [113, 87.121]
  - - [4096, 64, 1, 4096]
    - [44, 25.849]
  - - [256, 193600, 1, 64]
    - [100, 19.898]
  - - [7680, 32, 1, 2560]
    - [51, 15.082]
  - - [2560, 64, 1, 2560]
    - [6, 15.244]
  - - [3072, 128, 1, 1024]
    - [44, 18.823]
  - - [8448, 6000, 1, 2816]
    - [18, 86.698]
  - - [7680, 64, 1, 2560]
    - [127, 29.972]
  - - [5124, 1500, 1, 2560]
    - [10, 71.719]
  - - [1024, 1500, 1, 2560]
    - [29, 61.53]
  - - [512, 4, 1, 512]
    - [32, 0.093]
  - - [1024, 6000, 1, 2560]
    - [18, 73.256]
  - - [3072, 32, 1, 1024]
    - [19, 5.587]
  - - [6144, 32, 1, 2560]
    - [44, 17.08]
  - - [196, 1024, 64, 256]
    - [128, 26.219]
  - - [512, 50176, 1, 128]
    - [7, 29.901]
  - - [4608, 1, 1, 1536]
    - [19, 0.409]
  - - [1024, 32, 1, 512]
    - [19, 1.432]
  - - [7680, 24000, 1, 2560]
    - [18, 91.084]
  - - [8448, 4, 1, 2816]
    - [51, 2.553]
  - - [512, 1, 1, 500000]
    - [122, 0.516]
  - - [176, 1500, 1, 1408]
    - [44, 17.234]
  - - [512, 3000, 1, 2560]
    - [64, 61.701]
  - - [8448, 24000, 1, 2816]
    - [18, 91.791]
  - - [4608, 2, 1, 1536]
    - [19, 0.814]
  - - [512, 6000, 1, 1536]
    - [47, 57.349]
  - - [7680, 128, 1, 2560]
    - [129, 41.452]
  - - [3072, 6000, 1, 1024]
    - [21, 72.502]
  - - [3072, 1500, 1, 128]
    - [38, 20.384]
  - - [2048, 3136, 1, 512]
    - [48, 52.625]
  - - [1024, 3000, 1, 1536]
    - [47, 58.484]
  - - [512, 4, 1, 500000]
    - [130, 2.037]
  - - [512, 6000, 1, 2816]
    - [106, 67.17]
  - - [128, 50176, 1, 512]
    - [78, 44.21]
  - - [256, 12544, 1, 1024]
    - [11, 50.819]
  - - [1024, 12544, 1, 256]
    - [7, 43.948]
  - - [512, 48000, 1, 2560]
    - [18, 86.717]
  - - [2560, 16, 1, 2560]
    - [19, 4.509]
  - - [2048, 64, 1, 2048]
    - [8, 11.456]
  - - [512, 2, 1, 512]
    - [55, 0.045]
  - - [1024, 1, 1, 512]
    - [19, 0.047]
  - - [512, 1500, 1, 2560]
    - [15, 51.039]
  - - [512, 24000, 1, 1536]
    - [10, 72.459]
  - - [1024, 1, 1, 500000]
    - [130, 0.547]
  - - [6144, 16, 1, 2560]
    - [131, 9.743]
  - - [1024, 24000, 1, 2048]
    - [18, 85.893]
  - - [4096, 16, 1, 4096]
    - [19, 7.815]
  - - [512, 32, 1, 512]
    - [19, 0.383]
  - - [5124, 1500, 1, 2048]
    - [10, 69.276]
  - - [3072, 1500, 1, 1024]
    - [5, 57.911]
  - - [1024, 2, 1, 500000]
    - [132, 1.061]
  - - [1024, 8, 1, 500000]
    - [122, 4.324]
  - - [7680, 16, 1, 2560]
    - [51, 9.064]
  - - [6144, 1500, 1, 2560]
    - [27, 76.379]
  - - [3072, 1, 1, 1024]
    - [19, 0.216]
  - - [1024, 48000, 1, 2816]
    - [18, 89.529]
  - - [8448, 2, 1, 2816]
    - [51, 1.285]
  - - [4608, 4, 1, 1536]
    - [19, 1.603]
  - - [1024, 6000, 1, 1536]
    - [5, 67.766]
  - - [8448, 32, 1, 2816]
    - [51, 16.752]
  - - [512, 3000, 1, 2048]
    - [64, 57.072]
  - - [6144, 24000, 1, 2560]
    - [18, 90.22]
  - - [4608, 6000, 1, 1536]
    - [18, 82.139]
  - - [1024, 1024, 1, 1024]
    - [49, 35.167]
  - - [512, 1500, 1, 2048]
    - [15, 45.672]
  - - [512, 1500, 1, 1536]
    - [20, 39.911]
  - - [128, 1, 1, 1024]
    - [55, 0.009]
  - - [3072, 3000, 1, 1024]
    - [27, 62.16]
  - - [1024, 48000, 1, 2048]
    - [18, 87.274]
  - - [3136, 64, 128, 64]
    - [120, 15.698]
  - - [784, 512, 64, 128]
    - [133, 30.467]
  - - [3136, 256, 64, 64]
    - [134, 18.902]
  - - [12544, 1024, 1, 256]
    - [63, 42.438]
  - - [784, 128, 128, 512]
    - [125, 43.896]
  - - [784, 512, 256, 128]
    - [133, 33.46]
  - - [3136, 64, 64, 256]
    - [135, 28.586]
  - - [3136, 512, 1, 2048]
    - [64, 57.618]
  - - [12544, 256, 1, 1024]
    - [62, 54.724]
  - - [3136, 2048, 1, 512]
    - [78, 45.697]
  - - [3136, 256, 256, 64]
    - [89, 21.209]
  - - [3136, 64, 128, 256]
    - [136, 29.65]
  - - [784, 128, 64, 512]
    - [22, 38.794]
  - - [3136, 64, 256, 64]
    - [137, 16.129]
  - - [784, 512, 128, 128]
    - [133, 32.328]
  - - [3136, 64, 64, 64]
    - [134, 14.404]
  - - [784, 128, 256, 512]
    - [138, 46.704]
  - - [3136, 64, 256, 256]
    - [136, 29.462]
  - - [3136, 256, 128, 64]
    - [58, 20.724]
  - - [64, 14, 1, 14]
    - [139, 0.001]
  - - [64, 14, 1, 15]
    - [139, 0.001]
  - - [64, 15, 1, 15]
    - [3, 0.001]
  - - [64, 15, 1, 15]
    - [93, 0.001]
  - - [64, 15, 1, 17]
    - [139, 0.002]
  - - [64, 17, 1, 17]
    - [3, 0.002]
  - - [64, 17, 1, 17]
    - [93, 0.002]
  - - [64, 17, 1, 21]
    - [93, 0.002]
  - - [64, 21, 1, 21]
    - [50, 0.003]
  - - [64, 24, 1, 24]
    - [140, 0.004]
  - - [64, 24, 1, 34]
    - [110, 0.003]
  - - [64, 30, 1, 30]
    - [93, 0.005]
  - - [64, 31, 1, 30]
    - [93, 0.006]
  - - [64, 31, 1, 31]
    - [139, 0.006]
  - - [64, 32, 1, 32]
    - [141, 0.004]
  - - [64, 34, 1, 34]
    - [99, 0.008]
  - - [64, 35, 1, 32]
    - [99, 0.009]
  - - [64, 35, 1, 35]
    - [141, 0.008]
  - - [64, 128, 512, 128]
    - [162, 14.034]
  - - [64, 512, 1, 512]
    - [116, 0.751]
  - - [64, 512, 64, 512]
    - [188, 22.825]
  - - [128, 128, 512, 64]
    - [120, 13.178]
  - - [512, 512, 1, 64]
    - [52, 0.762]
  - - [512, 512, 64, 64]
    - [25, 16.709]
  - - [1024, 4, 1, 2]
    - [99, 0.001]
  - - [1024, 4, 1, 1024]
    - [55, 0.295]
  - - [1024, 32, 1, 2]
    - [99, 0.007]
  - - [1024, 32, 1, 1024]
    - [19, 2.408]
  - - [1024, 2048, 1, 2]
    - [134, 0.226]
  - - [1024, 2048, 1, 1024]
    - [85, 48.005]
  - - [1024, 2048, 1, 4096]
    - [68, 74.964]
  - - [1024, 2048, 1, 30528]
    - [45, 94.171]
  - - [1024, 4096, 1, 1024]
    - [96, 54.143]
  - - [1024, 4096, 1, 4096]
    - [143, 78.331]
  - - [1024, 4096, 1, 30528]
    - [144, 91.327]
  - - [4096, 2048, 1, 1024]
    - [173, 62.524]
  - - [4096, 4096, 1, 1024]
    - [113, 73.596]
  - - [32, 33, 1600, 33]
    - [145, 2.379]
  - - [32, 200, 1, 1]
    - [52, 0.0]
  - - [64, 3, 512, 3]
    - [146, 0.027]
  - - [64, 5, 512, 5]
    - [134, 0.063]
  - - [64, 5, 960, 5]
    - [52, 0.091]
  - - [64, 9, 512, 9]
    - [134, 0.198]
  - - [64, 512, 1, 1]
    - [139, 0.003]
  - - [67, 512, 1, 2048]
    - [147, 3.244]
  - - [74, 512, 1, 2048]
    - [148, 3.736]
  - - [74, 960, 1, 2048]
    - [149, 6.691]
  - - [100, 512, 1, 2048]
    - [149, 4.822]
  - - [128, 27, 32768, 27]
    - [150, 4.511]
  - - [256, 1024, 1, 1]
    - [140, 0.025]
  - - [256, 8976, 1, 1536]
    - [5, 56.807]
  - - [256, 8976, 1, 2048]
    - [5, 60.182]
  - - [256, 8976, 1, 2304]
    - [24, 61.875]
  - - [256, 8976, 1, 2560]
    - [151, 63.24]
  - - [256, 8976, 1, 2816]
    - [24, 64.918]
  - - [256, 8976, 1, 3072]
    - [24, 66.609]
  - - [256, 8976, 1, 4352]
    - [151, 71.535]
  - - [256, 8976, 1, 4864]
    - [74, 72.746]
  - - [256, 8976, 1, 5376]
    - [152, 73.213]
  - - [256, 8976, 1, 5632]
    - [151, 73.751]
  - - [256, 8976, 1, 5888]
    - [24, 74.54]
  - - [256, 8976, 1, 6144]
    - [74, 75.029]
  - - [256, 8976, 1, 6656]
    - [74, 75.445]
  - - [256, 8976, 1, 7168]
    - [24, 76.493]
  - - [256, 8976, 1, 7424]
    - [151, 76.451]
  - - [256, 8976, 1, 8192]
    - [24, 77.177]
  - - [256, 8976, 1, 8448]
    - [151, 77.501]
  - - [256, 8976, 1, 8960]
    - [74, 77.736]
  - - [256, 8976, 1, 9472]
    - [74, 78.245]
  - - [256, 8976, 1, 9728]
    - [74, 78.432]
  - - [256, 8976, 1, 9984]
    - [24, 78.397]
  - - [256, 8976, 1, 10240]
    - [24, 79.088]
  - - [256, 8976, 1, 10496]
    - [151, 78.785]
  - - [256, 8976, 1, 11008]
    - [74, 79.228]
  - - [256, 8976, 1, 11520]
    - [74, 79.425]
  - - [256, 8976, 1, 12288]
    - [74, 79.991]
  - - [256, 8976, 1, 14336]
    - [74, 80.806]
  - - [256, 8976, 1, 14848]
    - [74, 80.722]
  - - [256, 8976, 1, 15104]
    - [24, 80.807]
  - - [256, 8976, 1, 15872]
    - [74, 81.031]
  - - [256, 8976, 1, 17152]
    - [74, 81.387]
  - - [256, 8976, 1, 19712]
    - [74, 82.019]
  - - [256, 8976, 1, 19968]
    - [24, 81.925]
  - - [256, 8976, 1, 20480]
    - [24, 81.897]
  - - [256, 8976, 1, 20992]
    - [24, 82.131]
  - - [256, 8976, 1, 22016]
    - [74, 82.294]
  - - [256, 8976, 1, 26112]
    - [74, 82.844]
  - - [256, 8976, 1, 33536]
    - [74, 83.345]
  - - [256, 8976, 1, 44505]
    - [74, 83.214]
  - - [256, 32768, 1, 128]
    - [21, 20.902]
  - - [257, 1024, 1, 4096]
    - [153, 23.628]
  - - [480, 32768, 1, 1024]
    - [27, 69.712]
  - - [512, 200, 1, 1]
    - [52, 0.005]
  - - [512, 200, 1, 32]
    - [208, 0.17]
  - - [512, 215, 1, 2048]
    - [8, 6.819]
  - - [512, 256, 1, 2048]
    - [54, 11.814]
  - - [512, 1600, 1, 32]
    - [26, 1.15]
  - - [512, 1600, 1, 512]
    - [20, 15.831]
  - - [512, 32768, 1, 256]
    - [60, 43.673]
  - - [560, 200, 1, 1024]
    - [110, 4.064]
  - - [560, 1600, 1, 1024]
    - [154, 24.444]
  - - [768, 215, 1, 2048]
    - [8, 10.778]
  - - [768, 256, 1, 2048]
    - [54, 17.583]
  - - [1024, 200, 1, 1]
    - [110, 0.009]
  - - [1024, 512, 1, 1]
    - [109, 0.024]
  - - [1024, 512, 1, 64]
    - [201, 1.628]
  - - [1024, 512, 1, 1024]
    - [15, 15.546]
  - - [1024, 960, 1, 64]
    - [22, 2.678]
  - - [1024, 960, 1, 1024]
    - [49, 26.074]
  - - [1024, 1600, 1, 1]
    - [40, 0.062]
  - - [1024, 1600, 1, 1024]
    - [29, 40.394]
  - - [1024, 1792, 1, 256]
    - [41, 13.632]
  - - [1024, 2048, 1, 256]
    - [37, 16.527]
  - - [1024, 2560, 1, 256]
    - [22, 18.394]
  - - [1024, 3072, 1, 256]
    - [187, 21.756]
  - - [1024, 3328, 1, 256]
    - [75, 22.65]
  - - [1024, 3840, 1, 256]
    - [12, 24.85]
  - - [1024, 4096, 1, 256]
    - [63, 30.782]
  - - [1024, 4608, 1, 256]
    - [7, 28.317]
  - - [1024, 4864, 1, 256]
    - [21, 28.798]
  - - [1024, 5120, 1, 256]
    - [48, 36.614]
  - - [1024, 5632, 1, 256]
    - [21, 29.597]
  - - [1024, 6144, 1, 256]
    - [25, 32.407]
  - - [1024, 6400, 1, 256]
    - [27, 31.769]
  - - [1024, 7168, 1, 256]
    - [21, 38.352]
  - - [1024, 7424, 1, 256]
    - [38, 39.365]
  - - [1024, 7680, 1, 256]
    - [38, 40.723]
  - - [1024, 7936, 1, 256]
    - [38, 38.361]
  - - [1024, 8192, 1, 256]
    - [21, 39.405]
  - - [1024, 8448, 1, 256]
    - [38, 39.73]
  - - [1024, 8704, 1, 256]
    - [25, 35.432]
  - - [1024, 8960, 1, 256]
    - [7, 41.284]
  - - [1024, 9728, 1, 256]
    - [38, 41.459]
  - - [1024, 9984, 1, 256]
    - [38, 42.125]
  - - [1024, 10240, 1, 256]
    - [38, 42.838]
  - - [1024, 10496, 1, 256]
    - [38, 43.784]
  - - [1024, 11008, 1, 256]
    - [7, 42.278]
  - - [1024, 11264, 1, 256]
    - [38, 42.871]
  - - [1024, 11520, 1, 256]
    - [38, 43.901]
  - - [1024, 12288, 1, 256]
    - [38, 43.884]
  - - [1024, 13312, 1, 256]
    - [97, 43.929]
  - - [1024, 13568, 1, 256]
    - [97, 44.328]
  - - [1024, 14336, 1, 256]
    - [7, 45.774]
  - - [1024, 14592, 1, 256]
    - [38, 45.222]
  - - [1024, 14848, 1, 256]
    - [60, 40.428]
  - - [1024, 15104, 1, 256]
    - [38, 45.334]
  - - [1024, 16128, 1, 256]
    - [38, 45.626]
  - - [1024, 17152, 1, 256]
    - [12, 46.052]
  - - [1024, 18944, 1, 256]
    - [7, 46.82]
  - - [1024, 19712, 1, 256]
    - [38, 47.102]
  - - [1024, 19968, 1, 256]
    - [38, 47.029]
  - - [1024, 20480, 1, 256]
    - [38, 47.218]
  - - [1024, 20992, 1, 256]
    - [38, 47.691]
  - - [1024, 21504, 1, 256]
    - [97, 48.371]
  - - [1024, 22016, 1, 256]
    - [38, 47.881]
  - - [1024, 23552, 1, 256]
    - [7, 48.339]
  - - [1024, 28672, 1, 256]
    - [7, 49.119]
  - - [1024, 32768, 1, 512]
    - [60, 64.508]
  - - [1024, 32768, 1, 1024]
    - [14, 77.346]
  - - [1024, 33536, 1, 256]
    - [97, 49.898]
  - - [1024, 40448, 1, 256]
    - [97, 50.835]
  - - [1600, 512, 1, 1024]
    - [20, 35.8]
  - - [2048, 512, 1, 1]
    - [155, 0.045]
  - - [2048, 512, 1, 2048]
    - [4, 44.459]
  - - [2048, 960, 1, 2048]
    - [45, 62.314]
  - - [2048, 1024, 1, 1]
    - [60, 0.074]
  - - [2048, 1024, 1, 256]
    - [40, 24.588]
  - - [3200, 1024, 1, 2048]
    - [90, 68.672]
  - - [4096, 1024, 1, 1]
    - [111, 0.124]
  - - [64, 14, 10880, 14]
    - [120, 1.567]
  - - [64, 14, 10880, 15]
    - [120, 1.651]
  - - [64, 15, 7680, 15]
    - [120, 1.672]
  - - [64, 15, 10880, 15]
    - [120, 1.739]
  - - [64, 15, 7680, 17]
    - [120, 1.776]
  - - [64, 17, 6144, 17]
    - [150, 1.92]
  - - [64, 17, 7680, 17]
    - [150, 1.973]
  - - [64, 17, 6144, 21]
    - [120, 2.336]
  - - [64, 21, 6144, 21]
    - [150, 2.779]
  - - [64, 24, 4736, 24]
    - [120, 3.563]
  - - [64, 24, 4736, 34]
    - [134, 4.66]
  - - [64, 30, 2048, 30]
    - [150, 4.14]
  - - [64, 31, 2048, 30]
    - [120, 4.265]
  - - [64, 31, 2048, 31]
    - [120, 4.211]
  - - [64, 32, 4608, 32]
    - [134, 7.913]
  - - [64, 34, 4736, 34]
    - [69, 3.984]
  - - [64, 35, 4608, 32]
    - [134, 6.461]
  - - [64, 35, 4608, 35]
    - [120, 4.026]
  - - [1024, 3840, 1, 1024]
    - [31, 51.897]
  - - [1024, 3840, 1, 4096]
    - [31, 77.618]
  - - [1024, 3968, 1, 1024]
    - [22, 54.763]
  - - [1024, 3968, 1, 4096]
    - [13, 76.13]
  - - [1024, 3968, 1, 42720]
    - [13, 89.08]
  - - [1024, 6528, 1, 1024]
    - [10, 68.491]
  - - [1024, 6528, 1, 4096]
    - [49, 84.701]
  - - [1024, 6528, 1, 42720]
    - [11, 96.423]
  - - [1024, 7104, 1, 1024]
    - [10, 63.388]
  - - [1024, 7104, 1, 4096]
    - [156, 79.948]
  - - [1024, 7104, 1, 42720]
    - [152, 93.459]
  - - [1024, 7200, 1, 1024]
    - [10, 64.341]
  - - [1024, 7200, 1, 4096]
    - [74, 80.358]
  - - [1024, 7200, 1, 42720]
    - [152, 94.648]
  - - [1024, 8064, 1, 1024]
    - [14, 63.809]
  - - [1024, 8064, 1, 4096]
    - [31, 80.428]
  - - [1024, 8160, 1, 1024]
    - [14, 64.525]
  - - [1024, 8160, 1, 4096]
    - [13, 82.588]
  - - [1024, 9216, 1, 1024]
    - [10, 70.653]
  - - [1024, 9216, 1, 4096]
    - [113, 84.018]
  - - [1024, 9520, 1, 1024]
    - [18, 66.588]
  - - [1024, 9520, 1, 4096]
    - [18, 83.572]
  - - [1024, 9520, 1, 42720]
    - [158, 91.728]
  - - [1024, 10064, 1, 1024]
    - [14, 64.503]
  - - [1024, 10064, 1, 4096]
    - [83, 82.307]
  - - [1024, 10080, 1, 1024]
    - [14, 64.833]
  - - [1024, 10080, 1, 4096]
    - [83, 82.686]
  - - [1024, 10080, 1, 42720]
    - [68, 95.007]
  - - [1024, 10200, 1, 1024]
    - [14, 65.571]
  - - [1024, 10200, 1, 4096]
    - [45, 83.502]
  - - [4096, 3840, 1, 1024]
    - [14, 73.199]
  - - [4096, 3968, 1, 1024]
    - [18, 71.224]
  - - [4096, 6528, 1, 1024]
    - [14, 75.405]
  - - [4096, 7104, 1, 1024]
    - [21, 75.252]
  - - [4096, 7200, 1, 1024]
    - [21, 75.424]
  - - [4096, 8064, 1, 1024]
    - [14, 75.879]
  - - [4096, 8160, 1, 1024]
    - [14, 76.63]
  - - [4096, 9216, 1, 1024]
    - [18, 77.547]
  - - [4096, 9520, 1, 1024]
    - [21, 76.184]
  - - [4096, 10064, 1, 1024]
    - [18, 77.531]
  - - [4096, 10080, 1, 1024]
    - [18, 77.415]
  - - [4096, 10200, 1, 1024]
    - [18, 78.082]
  - - [64, 27, 1920, 27]
    - [120, 3.287]
  - - [64, 33, 1920, 27]
    - [120, 2.273]
  - - [64, 33, 1920, 33]
    - [150, 3.134]
  - - [1024, 3240, 1, 1024]
    - [75, 54.026]
  - - [1024, 3240, 1, 4096]
    - [87, 77.249]
  - - [1024, 3960, 1, 1024]
    - [85, 54.589]
  - - [1024, 3960, 1, 4096]
    - [13, 75.792]
  - - [1024, 3960, 1, 42720]
    - [31, 88.908]
  - - [4096, 3240, 1, 1024]
    - [21, 71.08]
  - - [4096, 3960, 1, 1024]
    - [18, 70.06]
  - - [64, 192, 64, 1280]
    - [42, 22.503]
  - - [64, 320, 64, 1280]
    - [15, 30.635]
  - - [64, 384, 64, 1280]
    - [15, 34.109]
  - - [64, 448, 64, 1280]
    - [9, 30.487]
  - - [64, 192, 64, 2048]
    - [30, 27.917]
  - - [64, 320, 64, 2048]
    - [57, 31.234]
  - - [64, 384, 64, 2048]
    - [9, 35.546]
  - - [64, 448, 64, 2048]
    - [59, 33.193]
  - - [1225, 32, 64, 192]
    - [161, 12.983]
  - - [1225, 48, 64, 192]
    - [161, 13.004]
  - - [1225, 64, 64, 192]
    - [160, 18.15]
  - - [1225, 48, 64, 256]
    - [162, 14.828]
  - - [1225, 64, 64, 256]
    - [163, 20.149]
  - - [1225, 48, 64, 288]
    - [94, 15.555]
  - - [1225, 64, 64, 288]
    - [94, 23.093]
  - - [5329, 80, 64, 64]
    - [162, 10.757]
  - - [289, 128, 64, 768]
    - [94, 27.719]
  - - [289, 160, 64, 768]
    - [94, 27.241]
  - - [289, 192, 64, 768]
    - [165, 34.066]
  - - [64, 192, 32, 1280]
    - [153, 15.531]
  - - [64, 320, 32, 1280]
    - [20, 27.716]
  - - [64, 384, 32, 1280]
    - [15, 30.652]
  - - [64, 448, 32, 1280]
    - [30, 21.907]
  - - [64, 192, 32, 2048]
    - [34, 25.849]
  - - [64, 320, 32, 2048]
    - [59, 26.208]
  - - [64, 384, 32, 2048]
    - [57, 32.873]
  - - [64, 448, 32, 2048]
    - [72, 27.423]
  - - [1225, 32, 32, 192]
    - [162, 10.641]
  - - [1225, 48, 32, 192]
    - [161, 10.971]
  - - [1225, 64, 32, 192]
    - [163, 12.408]
  - - [1225, 48, 32, 256]
    - [161, 12.306]
  - - [1225, 64, 32, 256]
    - [94, 17.606]
  - - [1225, 48, 32, 288]
    - [162, 13.448]
  - - [1225, 64, 32, 288]
    - [94, 19.199]
  - - [5329, 80, 32, 64]
    - [162, 10.058]
  - - [289, 128, 32, 768]
    - [94, 21.745]
  - - [289, 160, 32, 768]
    - [10, 20.536]
  - - [289, 192, 32, 768]
    - [166, 30.008]
  - - [49, 2048, 64, 512]
    - [164, 20.435]
  - - [49, 512, 64, 2048]
    - [34, 24.12]
  - - [3136, 256, 32, 64]
    - [172, 17.88]
  - - [3136, 64, 32, 64]
    - [134, 12.723]
  - - [3136, 64, 32, 256]
    - [135, 26.924]
  - - [784, 512, 32, 128]
    - [25, 27.443]
  - - [784, 128, 32, 512]
    - [43, 33.927]
  - - [196, 1024, 32, 256]
    - [167, 23.301]
  - - [196, 256, 32, 1024]
    - [10, 31.397]
  - - [49, 2048, 32, 512]
    - [128, 19.665]
  - - [49, 512, 32, 2048]
    - [168, 20.651]
  - - [3136, 128, 64, 64]
    - [173, 17.393]
  - - [3136, 256, 64, 128]
    - [58, 31.107]
  - - [784, 512, 64, 256]
    - [138, 43.306]
  - - [3136, 128, 64, 256]
    - [138, 39.54]
  - - [3136, 256, 64, 256]
    - [18, 50.48]
  - - [196, 1024, 64, 512]
    - [10, 36.465]
  - - [784, 256, 64, 512]
    - [58, 48.271]
  - - [784, 512, 64, 512]
    - [169, 54.988]
  - - [196, 512, 64, 1024]
    - [170, 42.389]
  - - [196, 1024, 64, 1024]
    - [10, 48.224]
  - - [49, 2048, 64, 1024]
    - [171, 26.139]
  - - [49, 1024, 64, 2048]
    - [171, 27.961]
  - - [3136, 128, 32, 64]
    - [134, 15.259]
  - - [3136, 256, 32, 128]
    - [172, 29.103]
  - - [784, 512, 32, 256]
    - [58, 38.632]
  - - [3136, 128, 32, 256]
    - [138, 35.985]
  - - [3136, 256, 32, 256]
    - [173, 42.979]
  - - [196, 1024, 32, 512]
    - [165, 34.02]
  - - [784, 256, 32, 512]
    - [25, 42.148]
  - - [784, 512, 32, 512]
    - [58, 50.405]
  - - [196, 512, 32, 1024]
    - [174, 36.074]
  - - [196, 1024, 32, 1024]
    - [165, 44.475]
  - - [49, 2048, 32, 1024]
    - [171, 24.579]
  - - [49, 1024, 32, 2048]
    - [34, 24.47]
  - - [7680, 8192, 1, 8192]
    - [175, 94.708]
  - - [3840, 4096, 1, 4096]
    - [18, 84.906]
  - - [1920, 2048, 1, 2048]
    - [13, 67.31]
  - - [960, 1024, 1, 1024]
    - [49, 26.152]
  - - [480, 512, 1, 512]
    - [210, 4.966]
  - - [8192, 7680, 1, 8192]
    - [113, 94.568]
  - - [4096, 3840, 1, 4096]
    - [18, 85.852]
  - - [2048, 1920, 1, 2048]
    - [144, 65.658]
  - - [512, 480, 1, 512]
    - [26, 5.104]
  - - [8192, 8192, 1, 8192]
    - [113, 95.699]
  - - [4096, 4096, 1, 4096]
    - [18, 87.751]
  - - [2048, 2048, 1, 2048]
    - [143, 71.024]
  - - [512, 512, 1, 512]
    - [51, 9.165]
  - - [64, 512, 16, 512]
    - [15, 12.654]
  - - [64, 512, 128, 512]
    - [15, 28.198]
  - - [1024, 8, 1, 1024]
    - [55, 0.594]
  - - [1024, 77, 1, 1024]
    - [19, 5.65]
  - - [1024, 77, 1, 30522]
    - [176, 24.852]
  - - [1024, 512, 1, 2]
    - [120, 0.086]
  - - [1024, 512, 1, 4096]
    - [9, 40.527]
  - - [1024, 616, 1, 1024]
    - [15, 18.237]
  - - [1024, 4096, 1, 2]
    - [173, 0.32]
  - - [4096, 512, 1, 1024]
    - [5, 48.005]
  - - [64, 128, 128, 128]
    - [134, 7.523]
  - - [64, 128, 160, 128]
    - [120, 10.501]
  - - [1024, 10, 1, 2]
    - [51, 0.002]
  - - [1024, 10, 1, 1024]
    - [66, 0.734]
  - - [1024, 160, 1, 1024]
    - [54, 10.054]
  - - [1024, 200, 1, 1024]
    - [44, 11.582]
  - - [1024, 200, 1, 30522]
    - [177, 42.974]
  - - [1024, 1024, 1, 2]
    - [137, 0.086]
  - - [1024, 1024, 1, 4096]
    - [49, 57.675]
  - - [1024, 1280, 1, 2]
    - [145, 0.103]
  - - [1024, 1280, 1, 1024]
    - [47, 32.016]
  - - [1024, 1280, 1, 4096]
    - [64, 59.301]
  - - [4096, 1024, 1, 1024]
    - [22, 56.398]
  - - [4096, 1280, 1, 1024]
    - [18, 52.819]
  - - [64, 128, 624, 128]
    - [150, 15.326]
  - - [1024, 39, 1, 2]
    - [93, 0.004]
  - - [1024, 39, 1, 1024]
    - [119, 1.682]
  - - [1024, 780, 1, 1024]
    - [81, 24.236]
  - - [1024, 780, 1, 30522]
    - [181, 78.712]
  - - [1024, 4992, 1, 2]
    - [133, 0.372]
  - - [1024, 4992, 1, 1024]
    - [108, 61.414]
  - - [1024, 4992, 1, 4096]
    - [126, 85.994]
  - - [4096, 4992, 1, 1024]
    - [18, 74.182]
  - - [1024, 308, 1, 1024]
    - [44, 10.335]
  - - [1024, 308, 1, 30522]
    - [178, 42.005]
  - - [64, 128, 640, 128]
    - [43, 15.654]
  - - [1024, 40, 1, 2]
    - [141, 0.004]
  - - [1024, 40, 1, 1024]
    - [19, 1.715]
  - - [1024, 800, 1, 1024]
    - [81, 24.006]
  - - [1024, 800, 1, 30522]
    - [158, 81.343]
  - - [1024, 5120, 1, 2]
    - [133, 0.381]
  - - [1024, 5120, 1, 1024]
    - [5, 64.83]
  - - [1024, 5120, 1, 4096]
    - [10, 69.411]
  - - [4096, 5120, 1, 1024]
    - [18, 76.906]
  - - [64, 128, 656, 128]
    - [92, 15.913]
  - - [1024, 41, 1, 2]
    - [51, 0.004]
  - - [1024, 41, 1, 1024]
    - [61, 1.76]
  - - [1024, 820, 1, 1024]
    - [81, 25.615]
  - - [1024, 820, 1, 30522]
    - [81, 72.007]
  - - [1024, 5248, 1, 2]
    - [58, 0.286]
  - - [1024, 5248, 1, 1024]
    - [5, 65.956]
  - - [1024, 5248, 1, 4096]
    - [64, 83.726]
  - - [4096, 5248, 1, 1024]
    - [21, 73.83]
  - - [64, 512, 80, 512]
    - [167, 27.494]
  - - [1024, 5, 1, 2]
    - [99, 0.001]
  - - [1024, 5, 1, 1024]
    - [19, 0.219]
  - - [1024, 385, 1, 1024]
    - [26, 11.631]
  - - [1024, 385, 1, 30522]
    - [179, 40.982]
  - - [1024, 2560, 1, 2]
    - [173, 0.173]
  - - [1024, 2560, 1, 1024]
    - [5, 58.384]
  - - [1024, 2560, 1, 4096]
    - [64, 62.29]
  - - [4096, 2560, 1, 1024]
    - [12, 66.842]
  - - [64, 512, 96, 512]
    - [43, 27.123]
  - - [1024, 6, 1, 2]
    - [99, 0.001]
  - - [1024, 6, 1, 1024]
    - [88, 0.263]
  - - [1024, 462, 1, 1024]
    - [39, 21.155]
  - - [1024, 462, 1, 30522]
    - [179, 48.117]
  - - [1024, 3072, 1, 2]
    - [133, 0.295]
  - - [1024, 3072, 1, 1024]
    - [71, 51.349]
  - - [1024, 3072, 1, 4096]
    - [18, 75.412]
  - - [4096, 3072, 1, 1024]
    - [180, 70.676]
  - - [1024, 8, 1, 2]
    - [139, 0.002]
  - - [1024, 160, 1, 30522]
    - [176, 38.275]
  - - [64, 128, 144, 128]
    - [120, 9.89]
  - - [1024, 9, 1, 2]
    - [51, 0.002]
  - - [1024, 9, 1, 1024]
    - [88, 0.344]
  - - [1024, 180, 1, 1024]
    - [54, 11.371]
  - - [1024, 180, 1, 30522]
    - [176, 42.856]
  - - [1024, 1152, 1, 2]
    - [120, 0.158]
  - - [1024, 1152, 1, 1024]
    - [49, 41.492]
  - - [1024, 1152, 1, 4096]
    - [4, 67.042]
  - - [4096, 1152, 1, 1024]
    - [5, 58.915]
  - - [479, 32768, 1, 1024]
    - [175, 58.063]
  - - [64, 4, 32768, 4]
    - [120, 0.148]
  - - [64, 4, 38400, 4]
    - [120, 0.149]
  - - [1024, 8192, 1, 1024]
    - [64, 62.982]
  - - [1024, 8192, 1, 4096]
    - [64, 84.108]
  - - [1024, 8192, 1, 33712]
    - [33, 95.492]
  - - [1024, 9600, 1, 1024]
    - [18, 67.307]
  - - [1024, 9600, 1, 4096]
    - [18, 84.009]
  - - [1024, 9600, 1, 33712]
    - [181, 90.325]
  - - [4096, 8192, 1, 1024]
    - [18, 75.756]
  - - [4096, 9600, 1, 1024]
    - [18, 77.946]
  - - [128, 128, 1, 64]
    - [28, 0.051]
  - - [64, 128, 1, 128]
    - [141, 0.111]
  - - [64, 5, 1, 5]
    - [182, 0.0]
  - - [32, 33, 1, 33]
    - [93, 0.004]
  - - [1024, 1024, 64, 64]
    - [36, 20.323]
  - - [64, 1024, 32, 1024]
    - [57, 31.504]
  - - [1024, 16384, 1, 3072]
    - [18, 85.531]
  - - [1024, 2048, 1, 30592]
    - [68, 87.065]
  - - [640, 2048, 1, 2560]
    - [47, 48.57]
  - - [1024, 1024, 64, 96]
    - [36, 28.298]
  - - [2048, 2, 1, 2048]
    - [19, 0.428]
  - - [2048, 2, 1, 2]
    - [51, 0.001]
  - - [1536, 4096, 1, 4608]
    - [18, 82.529]
  - - [512, 512, 256, 64]
    - [36, 19.488]
  - - [2048, 1024, 1, 8192]
    - [183, 75.875]
  - - [4096, 16384, 1, 1024]
    - [18, 80.809]
  - - [1024, 8192, 1, 50304]
    - [47, 92.51]
  - - [1536, 8192, 1, 50304]
    - [95, 96.246]
  - - [6144, 8192, 1, 1536]
    - [18, 87.083]
  - - [1024, 4096, 1, 30592]
    - [144, 91.23]
  - - [1536, 4096, 1, 6144]
    - [113, 84.556]
  - - [1024, 16384, 1, 4096]
    - [18, 87.602]
  - - [1024, 16384, 1, 50304]
    - [184, 93.29]
  - - [1024, 4096, 1, 3072]
    - [144, 74.56]
  - - [1536, 8192, 1, 1536]
    - [18, 74.734]
  - - [1024, 2048, 1, 3072]
    - [72, 70.744]
  - - [2560, 2048, 1, 7680]
    - [83, 73.82]
  - - [96, 1024, 64, 1024]
    - [129, 45.111]
  - - [2048, 1024, 1, 2048]
    - [183, 54.432]
  - - [2048, 1024, 1, 30592]
    - [183, 83.302]
  - - [64, 1024, 256, 1024]
    - [20, 40.358]
  - - [8192, 1024, 1, 2048]
    - [47, 74.103]
  - - [2560, 2048, 1, 2560]
    - [10, 64.781]
  - - [1536, 8192, 1, 4608]
    - [47, 86.432]
  - - [64, 512, 256, 512]
    - [124, 31.523]
  - - [1024, 2048, 1, 50304]
    - [85, 87.788]
  - - [1024, 1024, 32, 64]
    - [36, 18.991]
  - - [1536, 8192, 1, 6144]
    - [95, 87.275]
  - - [1024, 1024, 256, 64]
    - [36, 21.357]
  - - [512, 512, 40, 64]
    - [138, 14.913]
  - - [1536, 4096, 1, 50304]
    - [129, 92.484]
  - - [1024, 1024, 128, 96]
    - [36, 29.226]
  - - [1024, 8192, 1, 3072]
    - [64, 80.61]
  - - [64, 1024, 64, 1024]
    - [185, 37.08]
  - - [1024, 1024, 128, 64]
    - [36, 20.934]
  - - [64, 1024, 128, 1024]
    - [186, 38.836]
  - - [1024, 4096, 1, 50304]
    - [13, 92.166]
  - - [96, 1024, 128, 1024]
    - [129, 48.373]
  - - [6144, 4096, 1, 1536]
    - [18, 85.712]
  - - [1024, 16, 1, 2]
    - [51, 0.003]
  - - [1024, 16, 1, 1024]
    - [66, 1.189]
  - - [2560, 4, 1, 2]
    - [51, 0.002]
  - - [1024, 16384, 1, 1024]
    - [18, 73.289]
  - - [2560, 2048, 1, 1920]
    - [5, 74.126]
  - - [2048, 1024, 1, 6144]
    - [183, 72.295]
  - - [2560, 4, 1, 2560]
    - [19, 1.154]
  - - [512, 512, 128, 64]
    - [36, 17.975]
  - - [1024, 8192, 1, 30592]
    - [47, 91.519]
  - - [1536, 4096, 1, 1536]
    - [18, 69.703]
  - - [64, 512, 40, 512]
    - [105, 17.235]
  - - [1024, 1, 1, 2]
    - [99, 0.0]
  - - [1024, 1, 1, 1024]
    - [196, 0.04]
  - - [1024, 1, 1, 200]
    - [51, 0.018]
  - - [1024, 1, 1, 1600]
    - [88, 0.097]
  - - [2048, 1, 1, 512]
    - [19, 0.088]
  - - [128, 128, 1024, 64]
    - [125, 13.794]
  - - [64, 128, 1024, 128]
    - [137, 17.869]
  - - [1024, 64, 1, 2]
    - [93, 0.007]
  - - [1024, 8192, 1, 30528]
    - [31, 91.767]
  - - [1024, 64, 1, 1024]
    - [19, 3.897]
  - - [1024, 3456, 1, 1024]
    - [5, 50.75]
  - - [1024, 3456, 1, 512]
    - [5, 35.903]
  - - [1024, 4096, 1, 512]
    - [37, 44.639]
  - - [1024, 6912, 1, 1024]
    - [170, 59.846]
  - - [1024, 6912, 1, 512]
    - [165, 46.965]
  - - [1024, 864, 1, 1024]
    - [154, 23.926]
  - - [1024, 864, 1, 512]
    - [154, 14.469]
  - - [256, 3456, 1, 128]
    - [39, 8.68]
  - - [256, 4096, 1, 128]
    - [37, 5.303]
  - - [256, 55296, 1, 128]
    - [100, 26.005]
  - - [256, 6912, 1, 128]
    - [136, 14.176]
  - - [256, 864, 1, 128]
    - [80, 1.207]
  - - [480, 3456, 1, 1024]
    - [205, 33.45]
  - - [480, 4096, 1, 1024]
    - [83, 45.916]
  - - [480, 6912, 1, 1024]
    - [37, 54.838]
  - - [480, 864, 1, 1024]
    - [26, 12.184]
  - - [512, 3456, 1, 256]
    - [37, 25.518]
  - - [512, 4096, 1, 256]
    - [68, 16.029]
  - - [512, 55296, 1, 256]
    - [73, 46.715]
  - - [512, 6912, 1, 256]
    - [48, 23.467]
  - - [512, 864, 1, 256]
    - [39, 4.402]
  - - [1024, 640, 1, 30528]
    - [177, 80.339]
  - - [1024, 1280, 1, 30528]
    - [157, 84.072]
  - - [1024, 1600, 1, 30528]
    - [98, 87.762]
  - - [1024, 10240, 1, 1024]
    - [14, 64.717]
  - - [1024, 10240, 1, 4096]
    - [45, 83.379]
  - - [4096, 10240, 1, 1024]
    - [18, 78.939]
  - - [1024, 80, 1, 1024]
    - [19, 5.87]
  - - [1024, 80, 1, 2]
    - [99, 0.017]
  - - [128, 128, 1280, 64]
    - [111, 14.199]
  - - [64, 128, 1280, 128]
    - [188, 16.636]
  - - [1024, 1640, 1, 30528]
    - [17, 89.956]
  - - [1024, 10496, 1, 1024]
    - [73, 64.009]
  - - [1024, 10496, 1, 4096]
    - [49, 79.978]
  - - [4096, 10496, 1, 1024]
    - [18, 80.952]
  - - [1024, 82, 1, 1024]
    - [19, 5.943]
  - - [1024, 82, 1, 2]
    - [99, 0.018]
  - - [128, 128, 1312, 64]
    - [138, 14.285]
  - - [64, 128, 1312, 128]
    - [188, 16.829]
  - - [1024, 160, 1, 30528]
    - [189, 40.717]
  - - [1024, 240, 1, 30528]
    - [177, 51.053]
  - - [1024, 6144, 1, 4096]
    - [18, 80.403]
  - - [1024, 12, 1, 1024]
    - [55, 0.875]
  - - [4096, 6144, 1, 1024]
    - [18, 79.916]
  - - [1024, 6144, 1, 1024]
    - [218, 63.115]
  - - [1024, 12, 1, 2]
    - [99, 0.003]
  - - [512, 512, 192, 64]
    - [218, 20.218]
  - - [64, 512, 192, 512]
    - [59, 31.178]
  - - [256, 4096, 1, 1]
    - [37, 0.04]
  - - [256, 6912, 1, 1]
    - [190, 0.116]
  - - [1024, 10224, 1, 1024]
    - [14, 64.126]
  - - [1024, 10192, 1, 1024]
    - [14, 64.847]
  - - [1024, 10208, 1, 1024]
    - [14, 64.211]
  - - [1024, 10224, 1, 4096]
    - [72, 83.032]
  - - [1024, 10224, 1, 3072]
    - [68, 79.755]
  - - [4096, 10224, 1, 1024]
    - [18, 78.419]
  - - [1024, 10240, 1, 3072]
    - [68, 81.188]
  - - [1024, 10192, 1, 3072]
    - [68, 80.114]
  - - [4096, 10192, 1, 1024]
    - [18, 77.92]
  - - [1024, 10192, 1, 4096]
    - [45, 82.922]
  - - [1024, 10200, 1, 3072]
    - [68, 80.51]
  - - [1024, 10184, 1, 1024]
    - [14, 63.472]
  - - [4096, 10208, 1, 1024]
    - [18, 77.942]
  - - [1024, 10208, 1, 3072]
    - [68, 80.503]
  - - [1024, 10208, 1, 4096]
    - [45, 83.269]
  - - [1024, 10224, 1, 2048]
    - [68, 75.176]
  - - [1024, 10240, 1, 2048]
    - [85, 75.795]
  - - [1024, 10120, 1, 1024]
    - [14, 64.294]
  - - [1024, 10192, 1, 2048]
    - [68, 75.416]
  - - [64, 24, 6816, 24]
    - [120, 3.805]
  - - [1024, 10152, 1, 1024]
    - [14, 64.553]
  - - [1024, 10080, 1, 3072]
    - [68, 79.648]
  - - [64, 26, 6272, 26]
    - [120, 4.294]
  - - [100352, 512, 1, 256]
    - [191, 46.252]
  - - [12544, 2048, 1, 1024]
    - [21, 73.127]
  - - [12544, 64, 1, 147]
    - [120, 7.821]
  - - [200704, 512, 1, 256]
    - [191, 43.382]
  - - [25088, 1024, 1, 512]
    - [63, 60.561]
  - - [3136, 64, 1, 576]
    - [54, 8.192]
  - - [50176, 1024, 1, 512]
    - [192, 64.334]
  - - [6272, 2048, 1, 1024]
    - [175, 69.777]
  - - [784, 128, 1, 1152]
    - [123, 7.485]
  - - [3136, 128, 128, 256]
    - [58, 41.816]
  - - [3136, 128, 256, 256]
    - [58, 43.123]
  - - [784, 256, 128, 512]
    - [125, 52.644]
  - - [784, 256, 256, 512]
    - [138, 55.029]
  - - [128, 128, 2048, 64]
    - [117, 14.825]
  - - [64, 128, 2048, 128]
    - [137, 17.003]
  - - [1024, 2560, 1, 30528]
    - [157, 85.732]
  - - [1024, 128, 1, 1024]
    - [54, 6.811]
  - - [1024, 128, 1, 2]
    - [99, 0.027]
  - - [128, 128, 1536, 64]
    - [193, 14.563]
  - - [64, 128, 1536, 128]
    - [120, 18.535]
  - - [1024, 12288, 1, 4096]
    - [151, 87.676]
  - - [1024, 12288, 1, 1024]
    - [18, 68.483]
  - - [4096, 12288, 1, 1024]
    - [18, 81.201]
  - - [1024, 1920, 1, 30528]
    - [85, 84.899]
  - - [1024, 96, 1, 1024]
    - [19, 7.088]
  - - [1024, 96, 1, 2]
    - [141, 0.02]
  - - [128, 128, 192, 64]
    - [173, 6.305]
  - - [64, 128, 192, 128]
    - [114, 9.819]
  - - [768, 2048, 1, 2]
    - [155, 0.201]
  - - [3072, 2048, 1, 768]
    - [218, 58.409]
  - - [768, 2048, 1, 3072]
    - [47, 66.469]
  - - [768, 2048, 1, 768]
    - [94, 41.241]
  - - [384, 384, 144, 64]
    - [111, 17.107]
  - - [64, 384, 144, 384]
    - [43, 25.819]
  - - [768, 4608, 1, 2]
    - [173, 0.315]
  - - [3072, 4608, 1, 768]
    - [18, 69.952]
  - - [768, 4608, 1, 3072]
    - [49, 70.517]
  - - [768, 4608, 1, 768]
    - [10, 44.972]
  - - [512, 512, 48, 64]
    - [138, 14.972]
  - - [64, 512, 48, 512]
    - [124, 24.259]
  - - [128, 128, 256, 64]
    - [120, 10.429]
  - - [64, 128, 256, 128]
    - [120, 12.395]
  - - [384, 384, 192, 64]
    - [36, 17.389]
  - - [64, 384, 192, 384]
    - [92, 24.536]
  - - [1024, 4608, 1, 2]
    - [133, 0.352]
  - - [4096, 4608, 1, 1024]
    - [21, 73.466]
  - - [1024, 4608, 1, 4096]
    - [151, 76.836]
  - - [1024, 4608, 1, 1024]
    - [10, 59.822]
  - - [8192, 1024, 1, 1024]
    - [133, 64.39]
  - - [8192, 4096, 1, 1024]
    - [18, 75.92]
  - - [196, 256, 1, 2304]
    - [196, 5.088]
  - - [49, 512, 1, 4608]
    - [197, 3.323]
  - - [196, 1024, 128, 256]
    - [170, 27.783]
  - - [196, 1024, 256, 256]
    - [165, 28.848]
  - - [196, 256, 128, 1024]
    - [212, 39.701]
  - - [196, 256, 256, 1024]
    - [10, 42.719]
  - - [196, 512, 128, 1024]
    - [198, 44.69]
  - - [196, 512, 256, 1024]
    - [195, 47.331]
  - - [49, 2048, 128, 512]
    - [164, 21.602]
  - - [49, 2048, 256, 512]
    - [128, 21.883]
  - - [49, 512, 128, 2048]
    - [171, 27.392]
  - - [49, 512, 256, 2048]
    - [171, 28.184]
  - - [3072, 256, 2, 1024]
    - [22, 47.01]
  - - [768, 2048, 2, 512]
    - [22, 41.715]
  - - [2904, 256, 2, 1024]
    - [22, 45.141]
  - - [864, 2048, 2, 512]
    - [5, 42.707]
  - - [2992, 256, 2, 1024]
    - [37, 46.265]
  - - [3400, 256, 2, 1024]
    - [115, 33.923]
  - - [4032, 256, 2, 1024]
    - [5, 47.443]
  - - [3400, 256, 1, 1024]
    - [59, 35.736]
  - - [15200, 128, 2, 512]
    - [76, 38.902]
  - - [12288, 128, 2, 512]
    - [76, 39.62]
  - - [888, 2048, 2, 512]
    - [5, 44.546]
  - - [13600, 128, 2, 512]
    - [76, 41.495]
  - - [12880, 128, 2, 512]
    - [35, 40.127]
  - - [3456, 256, 2, 1024]
    - [37, 51.681]
  - - [2944, 256, 2, 1024]
    - [94, 45.052]
  - - [2688, 256, 2, 1024]
    - [94, 41.348]
  - - [13824, 128, 2, 512]
    - [76, 43.434]
  - - [3800, 256, 1, 1024]
    - [49, 32.437]
  - - [3168, 256, 2, 1024]
    - [22, 48.229]
  - - [3360, 256, 2, 1024]
    - [5, 33.175]
  - - [3552, 256, 2, 1024]
    - [183, 40.427]
  - - [11616, 128, 2, 512]
    - [65, 37.209]
  - - [4200, 256, 2, 1024]
    - [5, 40.259]
  - - [840, 2048, 2, 512]
    - [5, 42.409]
  - - [14208, 128, 2, 512]
    - [65, 38.01]
  - - [11968, 128, 2, 512]
    - [22, 38.505]
  - - [3264, 256, 2, 1024]
    - [17, 42.195]
  - - [13600, 256, 2, 512]
    - [60, 42.348]
  - - [12880, 256, 2, 512]
    - [199, 48.707]
  - - [12288, 256, 2, 512]
    - [191, 50.972]
  - - [2816, 256, 2, 1024]
    - [94, 42.981]
  - - [672, 2048, 2, 512]
    - [22, 36.925]
  - - [13440, 128, 2, 512]
    - [76, 42.408]
  - - [13824, 256, 2, 512]
    - [21, 43.686]
  - - [15200, 256, 2, 512]
    - [60, 47.555]
  - - [864, 512, 2, 2048]
    - [49, 34.54]
  - - [3600, 256, 2, 1024]
    - [5, 41.943]
  - - [888, 512, 2, 2048]
    - [4, 42.301]
  - - [4032, 1024, 2, 256]
    - [25, 38.853]
  - - [16128, 128, 2, 512]
    - [65, 41.784]
  - - [51520, 64, 2, 256]
    - [136, 26.751]
  - - [46464, 64, 2, 256]
    - [190, 28.121]
  - - [768, 3, 2, 256]
    - [66, 0.112]
  - - [768, 12, 2, 256]
    - [66, 0.439]
  - - [49152, 64, 2, 256]
    - [190, 28.621]
  - - [864, 12, 2, 256]
    - [55, 0.494]
  - - [864, 3, 2, 256]
    - [19, 0.125]
  - - [15200, 128, 1, 512]
    - [65, 29.849]
  - - [12288, 12, 2, 256]
    - [120, 4.674]
  - - [12288, 3, 2, 256]
    - [200, 1.215]
  - - [13600, 128, 1, 512]
    - [65, 37.191]
  - - [216, 3, 2, 256]
    - [32, 0.033]
  - - [51520, 12, 2, 256]
    - [150, 7.161]
  - - [2904, 1024, 2, 256]
    - [12, 37.209]
  - - [176, 12, 2, 256]
    - [32, 0.105]
  - - [51520, 3, 2, 256]
    - [146, 2.148]
  - - [176, 3, 2, 256]
    - [32, 0.027]
  - - [2992, 1024, 2, 256]
    - [48, 38.337]
  - - [192, 12, 2, 256]
    - [19, 0.114]
  - - [15200, 12, 2, 256]
    - [51, 5.235]
  - - [1536, 512, 1, 1024]
    - [20, 34.368]
  - - [1728, 512, 1, 1024]
    - [49, 22.73]
  - - [1536, 2048, 1, 1024]
    - [75, 52.273]
  - - [24576, 128, 1, 256]
    - [103, 27.577]
  - - [24576, 512, 1, 256]
    - [62, 38.234]
  - - [25760, 128, 1, 256]
    - [37, 27.094]
  - - [25760, 512, 1, 256]
    - [21, 39.584]
  - - [6144, 256, 1, 512]
    - [47, 22.921]
  - - [6440, 256, 1, 512]
    - [22, 37.149]
  - - [1024, 1024, 1, 320]
    - [163, 18.088]
  - - [15200, 3, 2, 256]
    - [146, 1.445]
  - - [51520, 64, 2, 64]
    - [25, 11.458]
  - - [3456, 3, 2, 256]
    - [19, 0.478]
  - - [13600, 12, 2, 256]
    - [120, 4.878]
  - - [12880, 3, 2, 256]
    - [200, 1.274]
  - - [3400, 3, 2, 256]
    - [66, 0.474]
  - - [12880, 12, 2, 256]
    - [120, 4.926]
  - - [13824, 12, 2, 256]
    - [201, 4.833]
  - - [13824, 3, 2, 256]
    - [146, 1.322]
  - - [13600, 3, 2, 256]
    - [200, 1.3]
  - - [13600, 512, 1, 128]
    - [133, 18.806]
  - - [9408, 512, 2, 128]
    - [25, 26.164]
  - - [3456, 12, 2, 256]
    - [131, 1.826]
  - - [56000, 256, 2, 64]
    - [63, 15.475]
  - - [3800, 3, 2, 256]
    - [66, 0.514]
  - - [2816, 1024, 2, 256]
    - [12, 35.618]
  - - [60800, 256, 1, 64]
    - [36, 16.079]
  - - [3400, 12, 2, 256]
    - [66, 1.839]
  - - [3800, 12, 2, 256]
    - [66, 2.023]
  - - [192, 3, 2, 256]
    - [66, 0.028]
  - - [216, 12, 2, 256]
    - [32, 0.127]
  - - [2944, 1024, 2, 256]
    - [16, 36.304]
  - - [55296, 64, 2, 64]
    - [67, 11.924]
  - - [55296, 3, 2, 256]
    - [202, 1.925]
  - - [49152, 64, 2, 64]
    - [48, 11.814]
  - - [11776, 512, 2, 128]
    - [38, 25.955]
  - - [54400, 64, 2, 64]
    - [25, 11.87]
  - - [42240, 64, 2, 256]
    - [76, 30.222]
  - - [3072, 3, 2, 256]
    - [19, 0.439]
  - - [11616, 512, 2, 128]
    - [25, 26.149]
  - - [4200, 1024, 2, 256]
    - [7, 40.406]
  - - [3072, 12, 2, 256]
    - [55, 1.688]
  - - [672, 512, 2, 2048]
    - [9, 40.401]
  - - [54400, 256, 1, 64]
    - [36, 14.877]
  - - [54400, 64, 2, 256]
    - [22, 29.753]
  - - [15200, 512, 1, 128]
    - [25, 23.879]
  - - [56832, 64, 2, 256]
    - [22, 28.315]
  - - [2688, 1024, 2, 256]
    - [12, 33.427]
  - - [54400, 3, 2, 256]
    - [22, 1.619]
  - - [12672, 512, 2, 128]
    - [25, 26.964]
  - - [11968, 512, 2, 128]
    - [133, 26.737]
  - - [46464, 256, 2, 64]
    - [111, 16.306]
  - - [55296, 64, 2, 256]
    - [65, 30.11]
  - - [60800, 64, 2, 64]
    - [63, 12.042]
  - - [2400, 256, 2, 1024]
    - [22, 37.014]
  - - [2520, 256, 2, 1024]
    - [37, 39.589]
  - - [768, 512, 2, 2048]
    - [57, 47.878]
  - - [2400, 1024, 2, 256]
    - [133, 28.767]
  - - [10752, 128, 2, 512]
    - [37, 36.333]
  - - [45632, 256, 2, 64]
    - [36, 15.441]
  - - [2520, 1024, 2, 256]
    - [25, 37.78]
  - - [53760, 256, 2, 64]
    - [111, 16.539]
  - - [43008, 64, 2, 256]
    - [76, 27.71]
  - - [2352, 256, 2, 1024]
    - [22, 37.247]
  - - [47872, 256, 2, 64]
    - [100, 16.517]
  - - [47104, 256, 2, 64]
    - [111, 16.593]
  - - [50688, 256, 2, 64]
    - [36, 17.012]
  - - [45056, 256, 2, 64]
    - [111, 16.308]
  - - [13440, 512, 2, 128]
    - [70, 28.152]
  - - [2352, 1024, 2, 256]
    - [7, 35.9]
  - - [11264, 512, 2, 128]
    - [25, 25.789]
  - - [10560, 128, 2, 512]
    - [37, 28.665]
  - - [16128, 512, 2, 128]
    - [25, 27.157]
  - - [864, 256, 2, 2048]
    - [15, 21.545]
  - - [37632, 256, 2, 64]
    - [36, 16.287]
  - - [51520, 256, 2, 64]
    - [100, 15.59]
  - - [14000, 512, 2, 128]
    - [18, 28.714]
  - - [768, 256, 2, 2048]
    - [34, 31.947]
  - - [60800, 12, 2, 256]
    - [25, 7.05]
  - - [10560, 512, 2, 128]
    - [25, 26.297]
  - - [60800, 3, 2, 256]
    - [146, 2.035]
  - - [64512, 256, 2, 64]
    - [111, 18.167]
  - - [54400, 256, 2, 64]
    - [111, 16.667]
  - - [45632, 64, 2, 256]
    - [136, 24.847]
  - - [3264, 1024, 2, 256]
    - [25, 31.304]
  - - [60800, 64, 2, 256]
    - [190, 28.814]
  - - [10752, 512, 2, 128]
    - [25, 26.115]
  - - [3168, 1024, 2, 256]
    - [5, 36.477]
  - - [55296, 256, 2, 256]
    - [111, 44.306]
  - - [51520, 256, 2, 256]
    - [125, 39.441]
  - - [11408, 128, 2, 512]
    - [172, 37.271]
  - - [60800, 256, 2, 256]
    - [118, 44.251]
  - - [54400, 256, 2, 256]
    - [97, 44.14]
  - - [60800, 256, 2, 64]
    - [100, 17.4]
  - - [3800, 1024, 1, 256]
    - [73, 33.804]
  - - [3400, 1024, 1, 256]
    - [7, 23.457]
  - - [3072, 1024, 2, 256]
    - [67, 37.726]
  - - [3600, 1024, 2, 256]
    - [38, 39.897]
  - - [12288, 512, 2, 128]
    - [25, 26.764]
  - - [49152, 256, 2, 256]
    - [118, 44.53]
  - - [12880, 512, 2, 128]
    - [48, 26.979]
  - - [11408, 512, 2, 128]
    - [58, 26.447]
  - - [42240, 256, 2, 64]
    - [36, 17.08]
  - - [1008, 2048, 2, 512]
    - [13, 39.894]
  - - [3360, 1024, 2, 256]
    - [58, 38.241]
  - - [14208, 512, 2, 128]
    - [25, 27.426]
  - - [56832, 256, 2, 64]
    - [100, 16.92]
  - - [43008, 256, 2, 64]
    - [36, 16.103]
  - - [13600, 512, 2, 128]
    - [18, 27.778]
  - - [2640, 1024, 2, 256]
    - [16, 34.198]
  - - [13824, 512, 2, 128]
    - [25, 24.345]
  - - [3800, 256, 2, 1024]
    - [5, 43.585]
  - - [55296, 256, 2, 64]
    - [111, 16.706]
  - - [2640, 256, 2, 1024]
    - [22, 41.696]
  - - [15200, 512, 2, 128]
    - [133, 26.564]
  - - [3552, 1024, 2, 256]
    - [25, 38.569]
  - - [3456, 1024, 2, 256]
    - [7, 31.748]
  - - [49152, 256, 2, 64]
    - [36, 16.927]
  - - [3400, 1024, 2, 256]
    - [133, 38.327]
  - - [3800, 1024, 2, 256]
    - [48, 41.414]
  - - [6912, 256, 1, 512]
    - [94, 38.373]
  - - [6800, 256, 1, 512]
    - [22, 38.327]
  - - [27648, 128, 1, 256]
    - [65, 20.396]
  - - [27200, 128, 1, 256]
    - [37, 28.207]
  - - [30400, 128, 1, 256]
    - [190, 25.86]
  - - [7600, 256, 1, 512]
    - [5, 33.402]
  - - [6144, 1024, 1, 512]
    - [113, 46.363]
  - - [6912, 1024, 1, 512]
    - [21, 46.034]
  - - [6440, 1024, 1, 512]
    - [87, 54.813]
  - - [27648, 512, 1, 256]
    - [204, 43.159]
  - - [1728, 2048, 1, 1024]
    - [5, 57.103]
  - - [27200, 512, 1, 256]
    - [63, 39.418]
  - - [6800, 1024, 1, 512]
    - [60, 45.138]
  - - [7600, 1024, 1, 512]
    - [60, 54.087]
  - - [30400, 512, 1, 256]
    - [63, 39.976]
  - - [1024, 1024, 1, 81]
    - [190, 3.011]
  - - [12544, 1024, 1, 1024]
    - [63, 70.167]
  - - [173280, 128, 1, 64]
    - [58, 13.53]
  - - [231040, 128, 1, 64]
    - [100, 14.169]
  - - [25992, 128, 1, 64]
    - [25, 10.662]
  - - [950, 512, 2, 2048]
    - [10, 35.182]
  - - [2852, 256, 2, 1024]
    - [94, 40.594]
  - - [3220, 256, 2, 1024]
    - [112, 37.575]
  - - [850, 2048, 2, 512]
    - [165, 38.109]
  - - [805, 2048, 2, 512]
    - [10, 36.092]
  - - [3036, 256, 2, 1024]
    - [94, 41.802]
  - - [713, 2048, 2, 512]
    - [165, 31.197]
  - - [850, 512, 2, 2048]
    - [10, 28.704]
  - - [850, 2048, 1, 512]
    - [10, 25.551]
  - - [660, 2048, 2, 512]
    - [94, 32.286]
  - - [726, 2048, 2, 512]
    - [165, 32.488]
  - - [805, 512, 2, 2048]
    - [171, 37.09]
  - - [3500, 256, 2, 1024]
    - [10, 30.578]
  - - [3700, 256, 2, 1024]
    - [10, 36.305]
  - - [748, 2048, 2, 512]
    - [165, 32.668]
  - - [950, 256, 2, 2048]
    - [206, 22.673]
  - - [850, 3, 2, 256]
    - [148, 0.105]
  - - [850, 12, 2, 256]
    - [207, 0.411]
  - - [805, 12, 2, 256]
    - [196, 0.392]
  - - [805, 3, 2, 256]
    - [149, 0.1]
  - - [247, 3, 2, 256]
    - [196, 0.03]
  - - [950, 3, 2, 256]
    - [149, 0.116]
  - - [187, 12, 2, 256]
    - [148, 0.092]
  - - [247, 12, 2, 256]
    - [148, 0.121]
  - - [187, 3, 2, 256]
    - [148, 0.023]
  - - [228, 12, 2, 256]
    - [148, 0.113]
  - - [221, 12, 2, 256]
    - [196, 0.108]
  - - [950, 12, 2, 256]
    - [196, 0.46]
  - - [228, 3, 2, 256]
    - [148, 0.028]
  - - [1900, 512, 1, 1024]
    - [94, 26.722]
  - - [1700, 512, 1, 1024]
    - [94, 20.728]
  - - [1610, 512, 1, 1024]
    - [171, 24.04]
  - - [3036, 1024, 2, 256]
    - [94, 30.499]
  - - [221, 3, 2, 256]
    - [149, 0.027]
  - - [2852, 1024, 2, 256]
    - [163, 30.854]
  - - [3220, 3, 2, 256]
    - [208, 0.379]
  - - [3220, 12, 2, 256]
    - [208, 1.527]
  - - [660, 512, 2, 2048]
    - [206, 31.064]
  - - [726, 512, 2, 2048]
    - [206, 35.151]
  - - [713, 512, 2, 2048]
    - [171, 33.828]
  - - [805, 256, 2, 2048]
    - [209, 25.984]
  - - [950, 2048, 1, 512]
    - [10, 29.075]
  - - [850, 256, 2, 2048]
    - [206, 18.584]
  - - [3700, 1024, 2, 256]
    - [165, 32.965]
  - - [3500, 1024, 2, 256]
    - [170, 34.004]
  - - [3220, 1024, 2, 256]
    - [193, 32.238]
  - - [950, 2048, 2, 512]
    - [94, 36.797]
  - - [1610, 2048, 1, 1024]
    - [165, 43.889]
  - - [1700, 2048, 1, 1024]
    - [10, 52.713]
  - - [1900, 2048, 1, 1024]
    - [163, 44.119]
  - - [100, 128, 120, 512]
    - [160, 17.205]
  - - [100, 128, 139, 512]
    - [163, 19.292]
  - - [100, 128, 160, 512]
    - [169, 20.299]
  - - [100, 128, 18, 512]
    - [168, 7.262]
  - - [100, 128, 19, 512]
    - [168, 7.583]
  - - [1444, 256, 120, 128]
    - [211, 27.96]
  - - [1444, 256, 139, 128]
    - [195, 28.467]
  - - [1444, 256, 160, 128]
    - [195, 28.787]
  - - [1444, 256, 18, 128]
    - [195, 18.927]
  - - [1444, 256, 19, 128]
    - [94, 20.217]
  - - [1444, 256, 120, 256]
    - [212, 41.907]
  - - [1444, 256, 139, 256]
    - [212, 42.127]
  - - [1444, 256, 160, 256]
    - [212, 42.467]
  - - [1444, 256, 18, 256]
    - [169, 27.933]
  - - [1444, 256, 19, 256]
    - [163, 30.787]
  - - [25, 128, 120, 256]
    - [213, 5.829]
  - - [25, 128, 139, 256]
    - [213, 6.414]
  - - [25, 128, 160, 256]
    - [213, 7.032]
  - - [25, 128, 18, 256]
    - [148, 1.195]
  - - [25, 128, 19, 256]
    - [149, 1.244]
  - - [361, 256, 120, 512]
    - [165, 37.454]
  - - [361, 256, 139, 512]
    - [212, 38.177]
  - - [361, 256, 160, 512]
    - [94, 38.948]
  - - [361, 256, 18, 512]
    - [94, 28.559]
  - - [361, 256, 19, 512]
    - [10, 23.338]
  - - [9, 128, 120, 256]
    - [213, 2.144]
  - - [9, 128, 139, 256]
    - [213, 2.356]
  - - [9, 128, 160, 256]
    - [213, 2.712]
  - - [9, 128, 18, 256]
    - [149, 0.437]
  - - [9, 128, 19, 256]
    - [148, 0.457]
  - - [100, 512, 1, 2304]
    - [149, 5.112]
  - - [1444, 128, 1, 576]
    - [214, 6.59]
  - - [200716, 128, 1, 64]
    - [174, 12.654]
  - - [22500, 64, 1, 147]
    - [162, 9.578]
  - - [25, 256, 1, 1152]
    - [148, 0.422]
  - - [27436, 128, 1, 64]
    - [215, 9.208]
  - - [361, 512, 1, 2304]
    - [210, 15.088]
  - - [9, 256, 1, 1152]
    - [196, 0.157]
  - - [64, 16, 16, 16]
    - [52, 0.026]
  - - [64, 32, 16, 32]
    - [93, 0.099]
  - - [64, 48, 16, 48]
    - [141, 0.242]
  - - [64, 64, 16, 64]
    - [28, 0.358]
  - - [64, 80, 16, 80]
    - [141, 0.6]
  - - [64, 96, 16, 96]
    - [93, 0.886]
  - - [64, 112, 16, 112]
    - [99, 1.08]
  - - [64, 128, 16, 128]
    - [139, 1.26]
  - - [64, 144, 16, 144]
    - [139, 1.721]
  - - [64, 160, 16, 160]
    - [93, 2.326]
  - - [64, 176, 16, 176]
    - [139, 2.499]
  - - [64, 208, 16, 208]
    - [93, 3.241]
  - - [64, 224, 16, 224]
    - [50, 4.048]
  - - [64, 240, 16, 240]
    - [141, 4.077]
  - - [64, 256, 16, 256]
    - [26, 5.143]
  - - [64, 272, 16, 272]
    - [141, 5.081]
  - - [64, 288, 16, 288]
    - [26, 6.214]
  - - [64, 304, 16, 304]
    - [141, 6.235]
  - - [64, 320, 16, 320]
    - [26, 7.573]
  - - [64, 336, 16, 336]
    - [26, 7.236]
  - - [64, 352, 16, 352]
    - [26, 8.56]
  - - [64, 368, 16, 368]
    - [26, 8.137]
  - - [64, 384, 16, 384]
    - [54, 9.347]
  - - [64, 400, 16, 400]
    - [77, 8.352]
  - - [64, 416, 16, 416]
    - [26, 10.792]
  - - [64, 432, 16, 432]
    - [26, 10.302]
  - - [64, 448, 16, 448]
    - [26, 12.317]
  - - [64, 464, 16, 464]
    - [39, 10.57]
  - - [64, 480, 16, 480]
    - [26, 13.224]
  - - [64, 496, 16, 496]
    - [39, 11.777]
  - - [1024, 4896, 1, 4096]
    - [108, 81.541]
  - - [1024, 5552, 1, 3072]
    - [18, 69.653]
  - - [1024, 5552, 1, 4096]
    - [45, 72.596]
  - - [1024, 6128, 1, 1024]
    - [5, 63.784]
  - - [1024, 6688, 1, 1024]
    - [5, 58.042]
  - - [1024, 6688, 1, 4096]
    - [151, 76.781]
  - - [4096, 6688, 1, 1024]
    - [18, 76.784]
  - - [1024, 5664, 1, 3072]
    - [10, 72.996]
  - - [1024, 5664, 1, 4096]
    - [10, 74.431]
  - - [1024, 5984, 1, 1024]
    - [5, 62.45]
  - - [1024, 7872, 1, 3072]
    - [10, 84.698]
  - - [1024, 7872, 1, 1024]
    - [10, 69.298]
  - - [1024, 7872, 1, 4096]
    - [13, 82.192]
  - - [1024, 5920, 1, 3072]
    - [18, 74.507]
  - - [1024, 5920, 1, 1024]
    - [5, 62.222]
  - - [1024, 7760, 1, 3072]
    - [31, 76.838]
  - - [1024, 7760, 1, 1024]
    - [5, 68.109]
  - - [1024, 7760, 1, 4096]
    - [13, 80.182]
  - - [4096, 5136, 1, 1024]
    - [21, 73.39]
  - - [1024, 7184, 1, 3072]
    - [24, 76.921]
  - - [1024, 5936, 1, 3072]
    - [18, 74.709]
  - - [1024, 5936, 1, 1024]
    - [5, 62.114]
  - - [1024, 6608, 1, 1024]
    - [106, 64.946]
  - - [1024, 6608, 1, 4096]
    - [18, 84.854]
  - - [1024, 5616, 1, 3072]
    - [10, 71.648]
  - - [1024, 5616, 1, 4096]
    - [45, 73.554]
  - - [1024, 6624, 1, 1024]
    - [56, 64.996]
  - - [1024, 6624, 1, 4096]
    - [18, 84.921]
  - - [1024, 6416, 1, 1024]
    - [5, 66.43]
  - - [1024, 5344, 1, 3072]
    - [10, 67.618]
  - - [1024, 5344, 1, 4096]
    - [45, 70.089]
  - - [1024, 7024, 1, 3072]
    - [24, 77.623]
  - - [1024, 7024, 1, 4096]
    - [74, 80.953]
  - - [1024, 5776, 1, 3072]
    - [10, 72.721]
  - - [1024, 7536, 1, 3072]
    - [13, 74.915]
  - - [1024, 7536, 1, 1024]
    - [5, 66.242]
  - - [1024, 7040, 1, 3072]
    - [24, 77.285]
  - - [1024, 7040, 1, 1024]
    - [5, 59.935]
  - - [1024, 7040, 1, 4096]
    - [24, 80.905]
  - - [1024, 6512, 1, 1024]
    - [5, 66.781]
  - - [1024, 6544, 1, 1024]
    - [14, 64.748]
  - - [1024, 6544, 1, 4096]
    - [56, 84.055]
  - - [1024, 5472, 1, 3072]
    - [10, 70.063]
  - - [1024, 5472, 1, 4096]
    - [10, 71.848]
  - - [1024, 7232, 1, 3072]
    - [74, 77.295]
  - - [1024, 7232, 1, 1024]
    - [5, 63.902]
  - - [1024, 6368, 1, 1024]
    - [27, 59.318]
  - - [1024, 6736, 1, 4096]
    - [151, 77.922]
  - - [4096, 6736, 1, 1024]
    - [18, 76.738]
  - - [1024, 7152, 1, 3072]
    - [74, 76.533]
  - - [1024, 5296, 1, 3072]
    - [10, 67.932]
  - - [1024, 5296, 1, 4096]
    - [10, 69.344]
  - - [1024, 5312, 1, 3072]
    - [10, 67.382]
  - - [1024, 8736, 1, 4096]
    - [18, 78.742]
  - - [1024, 5872, 1, 3072]
    - [10, 73.956]
  - - [1024, 6000, 1, 1024]
    - [5, 62.728]
  - - [1024, 6960, 1, 3072]
    - [24, 76.883]
  - - [1024, 6960, 1, 1024]
    - [5, 59.556]
  - - [1024, 6960, 1, 4096]
    - [151, 80.223]
  - - [1024, 6848, 1, 4096]
    - [74, 78.814]
  - - [1024, 6976, 1, 3072]
    - [74, 76.833]
  - - [1024, 6976, 1, 1024]
    - [5, 59.301]
  - - [1024, 6976, 1, 4096]
    - [151, 80.448]
  - - [1024, 5744, 1, 3072]
    - [18, 72.164]
  - - [1024, 5728, 1, 3072]
    - [18, 71.937]
  - - [1024, 5632, 1, 4096]
    - [18, 73.948]
  - - [1024, 6176, 1, 1024]
    - [56, 59.04]
  - - [1024, 5504, 1, 3072]
    - [10, 70.498]
  - - [1024, 5504, 1, 4096]
    - [45, 71.789]
  - - [1024, 5488, 1, 3072]
    - [10, 70.344]
  - - [1024, 5488, 1, 4096]
    - [10, 72.339]
  - - [1024, 5456, 1, 3072]
    - [18, 68.667]
  - - [1024, 5456, 1, 4096]
    - [45, 71.006]
  - - [1024, 6640, 1, 1024]
    - [18, 64.669]
  - - [1024, 6640, 1, 4096]
    - [74, 76.233]
  - - [1024, 7440, 1, 3072]
    - [47, 73.803]
  - - [1024, 7440, 1, 1024]
    - [5, 65.691]
  - - [1024, 6288, 1, 1024]
    - [56, 59.49]
  - - [1024, 4704, 1, 3072]
    - [10, 75.063]
  - - [1024, 7264, 1, 3072]
    - [74, 77.731]
  - - [1024, 7264, 1, 1024]
    - [5, 64.233]
  - - [1024, 6672, 1, 1024]
    - [5, 57.343]
  - - [1024, 6672, 1, 4096]
    - [24, 76.542]
  - - [4096, 6672, 1, 1024]
    - [18, 76.285]
  - - [1024, 6304, 1, 1024]
    - [56, 59.601]
  - - [1024, 5520, 1, 3072]
    - [10, 69.97]
  - - [1024, 5520, 1, 4096]
    - [49, 71.76]
  - - [1024, 6208, 1, 1024]
    - [56, 59.46]
  - - [1024, 4976, 1, 1024]
    - [5, 62.405]
  - - [1024, 4976, 1, 4096]
    - [24, 82.045]
  - - [1024, 5360, 1, 3072]
    - [45, 67.387]
  - - [1024, 5360, 1, 4096]
    - [45, 70.397]
  - - [1024, 5392, 1, 3072]
    - [10, 68.939]
  - - [1024, 5392, 1, 4096]
    - [45, 70.386]
  - - [1024, 5376, 1, 3072]
    - [10, 68.884]
  - - [1024, 5376, 1, 4096]
    - [113, 70.567]
  - - [1024, 5328, 1, 3072]
    - [10, 67.657]
  - - [1024, 5424, 1, 3072]
    - [10, 69.0]
  - - [1024, 5424, 1, 4096]
    - [10, 70.961]
  - - [1024, 7376, 1, 3072]
    - [4, 77.846]
  - - [1024, 7376, 1, 1024]
    - [5, 64.932]
  - - [1024, 6224, 1, 1024]
    - [27, 59.396]
  - - [1024, 6320, 1, 1024]
    - [27, 59.577]
  - - [1024, 6560, 1, 1024]
    - [203, 61.414]
  - - [1024, 6560, 1, 4096]
    - [27, 84.49]
  - - [1024, 5856, 1, 3072]
    - [10, 75.774]
  - - [1024, 5696, 1, 3072]
    - [10, 72.695]
  - - [1024, 5696, 1, 4096]
    - [45, 74.293]
  - - [1024, 7504, 1, 3072]
    - [13, 74.768]
  - - [1024, 7504, 1, 1024]
    - [5, 66.256]
  - - [1024, 6096, 1, 1024]
    - [5, 63.788]
  - - [1024, 4880, 1, 1024]
    - [5, 61.659]
  - - [1024, 4880, 1, 4096]
    - [159, 81.507]
  - - [1024, 7168, 1, 3072]
    - [24, 77.24]
  - - [1024, 7776, 1, 3072]
    - [10, 83.868]
  - - [1024, 7776, 1, 1024]
    - [10, 68.863]
  - - [1024, 7776, 1, 4096]
    - [144, 80.556]
  - - [1024, 6384, 1, 1024]
    - [56, 59.246]
  - - [1024, 5712, 1, 3072]
    - [10, 72.352]
  - - [1024, 4624, 1, 3072]
    - [74, 73.194]
  - - [1024, 4624, 1, 1024]
    - [5, 58.739]
  - - [1024, 7488, 1, 3072]
    - [10, 80.934]
  - - [1024, 7472, 1, 3072]
    - [64, 74.188]
  - - [1024, 7472, 1, 1024]
    - [5, 65.973]
  - - [1024, 6576, 1, 1024]
    - [18, 64.739]
  - - [1024, 6576, 1, 4096]
    - [27, 84.834]
  - - [1024, 6928, 1, 3072]
    - [74, 75.979]
  - - [1024, 6928, 1, 1024]
    - [73, 58.663]
  - - [1024, 6928, 1, 4096]
    - [151, 79.877]
  - - [1024, 6864, 1, 3072]
    - [151, 75.447]
  - - [1024, 6864, 1, 4096]
    - [24, 78.813]
  - - [1024, 5792, 1, 3072]
    - [10, 72.715]
  - - [1024, 6704, 1, 1024]
    - [5, 56.817]
  - - [1024, 6704, 1, 4096]
    - [74, 77.323]
  - - [4096, 6704, 1, 1024]
    - [18, 76.227]
  - - [1024, 6800, 1, 4096]
    - [24, 78.361]
  - - [4096, 6800, 1, 1024]
    - [18, 77.561]
  - - [1024, 6016, 1, 1024]
    - [5, 62.784]
  - - [1024, 6880, 1, 4096]
    - [151, 79.313]
  - - [1024, 11248, 1, 3072]
    - [10, 81.256]
  - - [1024, 11248, 1, 1024]
    - [60, 68.319]
  - - [1024, 11248, 1, 4096]
    - [64, 83.331]
  - - [1024, 27, 1, 1024]
    - [61, 1.957]
  - - [1024, 27, 1, 2]
    - [141, 0.006]
  - - [1000, 224, 1, 4000]
    - [44, 19.376]
  - - [1280, 1792, 1, 5120]
    - [24, 67.096]
  - - [1664, 32, 1, 1000]
    - [32, 2.752]
  - - [1920, 32, 1, 1000]
    - [19, 3.235]
  - - [2048, 32, 1, 1000]
    - [19, 3.418]
  - - [25088, 32, 1, 4096]
    - [76, 28.854]
  - - [4096, 32, 1, 1000]
    - [93, 6.205]
  - - [768, 32, 1, 100]
    - [51, 0.204]
  - - [768, 32, 1, 768]
    - [19, 1.305]
  - - [768, 7168, 1, 3072]
    - [18, 63.873]
  - - [196, 128, 32, 1024]
    - [129, 19.664]
  - - [196, 128, 32, 1056]
    - [128, 21.085]
  - - [196, 128, 32, 1088]
    - [94, 20.502]
  - - [196, 128, 32, 1152]
    - [129, 20.633]
  - - [196, 128, 32, 1184]
    - [164, 22.035]
  - - [196, 128, 32, 1216]
    - [94, 21.823]
  - - [196, 128, 32, 1760]
    - [164, 24.604]
  - - [196, 128, 32, 288]
    - [215, 9.72]
  - - [196, 128, 32, 352]
    - [162, 10.829]
  - - [196, 128, 32, 416]
    - [164, 12.06]
  - - [196, 128, 32, 544]
    - [128, 14.688]
  - - [196, 128, 32, 576]
    - [164, 15.189]
  - - [196, 128, 32, 768]
    - [94, 17.068]
  - - [196, 128, 32, 928]
    - [164, 20.129]
  - - [196, 128, 32, 960]
    - [94, 19.339]
  - - [196, 128, 32, 992]
    - [164, 21.013]
  - - [196, 896, 32, 1792]
    - [10, 45.713]
  - - [224, 224, 384, 64]
    - [7, 15.25]
  - - [224, 224, 512, 64]
    - [67, 16.108]
  - - [3136, 128, 32, 160]
    - [58, 28.516]
  - - [3136, 128, 32, 224]
    - [172, 34.97]
  - - [49, 128, 32, 1056]
    - [214, 8.683]
  - - [49, 128, 32, 1088]
    - [168, 9.39]
  - - [49, 128, 32, 1120]
    - [214, 8.673]
  - - [49, 128, 32, 1152]
    - [210, 9.172]
  - - [49, 128, 32, 640]
    - [168, 6.762]
  - - [49, 128, 32, 736]
    - [214, 7.205]
  - - [49, 128, 32, 832]
    - [168, 8.109]
  - - [64, 224, 160, 224]
    - [134, 16.976]
  - - [64, 224, 384, 224]
    - [120, 21.573]
  - - [64, 224, 512, 224]
    - [134, 22.757]
  - - [784, 128, 32, 128]
    - [124, 15.385]
  - - [1024, 14080, 1, 1024]
    - [18, 71.605]
  - - [1024, 2092, 1, 1024]
    - [5, 43.359]
  - - [1024, 2098, 1, 30528]
    - [178, 74.45]
  - - [1024, 2100, 1, 30528]
    - [184, 74.386]
  - - [1024, 2106, 1, 1024]
    - [5, 42.97]
  - - [1024, 2107, 1, 30528]
    - [178, 74.769]
  - - [1024, 2112, 1, 30528]
    - [178, 74.924]
  - - [1024, 2121, 1, 30528]
    - [184, 75.258]
  - - [1024, 2146, 1, 30528]
    - [184, 75.794]
  - - [1024, 2147, 1, 1024]
    - [5, 43.883]
  - - [1024, 2158, 1, 30528]
    - [184, 76.302]
  - - [1024, 2182, 1, 30528]
    - [184, 77.011]
  - - [1024, 2217, 1, 30528]
    - [184, 77.911]
  - - [1024, 2220, 1, 1024]
    - [5, 46.092]
  - - [1024, 2243, 1, 30528]
    - [184, 78.833]
  - - [1024, 2274, 1, 1024]
    - [5, 46.966]
  - - [1024, 2182, 1, 1024]
    - [5, 44.83]
  - - [1024, 2251, 1, 30528]
    - [184, 79.248]
  - - [1024, 12368, 1, 1024]
    - [14, 63.61]
  - - [1024, 13024, 1, 1024]
    - [14, 66.781]
  - - [1024, 13088, 1, 1024]
    - [14, 66.332]
  - - [1024, 13168, 1, 1024]
    - [18, 65.861]
  - - [1024, 13184, 1, 1024]
    - [70, 65.913]
  - - [1024, 13216, 1, 1024]
    - [18, 65.99]
  - - [1024, 13232, 1, 1024]
    - [18, 66.014]
  - - [1024, 13248, 1, 1024]
    - [27, 66.205]
  - - [1024, 13280, 1, 1024]
    - [18, 66.309]
  - - [1024, 13296, 1, 1024]
    - [18, 65.943]
  - - [1024, 13312, 1, 1024]
    - [27, 68.169]
  - - [1024, 13328, 1, 1024]
    - [18, 67.288]
  - - [1024, 13344, 1, 1024]
    - [27, 67.225]
  - - [1024, 13360, 1, 1024]
    - [18, 67.45]
  - - [1024, 13376, 1, 1024]
    - [27, 67.329]
  - - [1024, 13392, 1, 1024]
    - [27, 67.467]
  - - [1024, 13392, 1, 3072]
    - [18, 79.85]
  - - [1024, 13408, 1, 1024]
    - [70, 67.375]
  - - [1024, 13424, 1, 1024]
    - [18, 67.227]
  - - [1024, 13440, 1, 1024]
    - [27, 67.279]
  - - [1024, 13456, 1, 1024]
    - [27, 67.103]
  - - [1024, 13472, 1, 1024]
    - [18, 67.211]
  - - [1024, 13488, 1, 1024]
    - [18, 67.092]
  - - [1024, 13504, 1, 3072]
    - [18, 80.127]
  - - [1024, 13520, 1, 1024]
    - [27, 67.28]
  - - [1024, 13536, 1, 1024]
    - [18, 67.303]
  - - [1024, 13552, 1, 1024]
    - [18, 67.297]
  - - [1024, 13568, 1, 1024]
    - [175, 69.001]
  - - [1024, 13584, 1, 1024]
    - [27, 68.202]
  - - [1024, 13600, 1, 1024]
    - [27, 68.253]
  - - [1024, 13616, 1, 1024]
    - [18, 68.596]
  - - [1024, 13632, 1, 1024]
    - [18, 67.98]
  - - [1024, 13648, 1, 1024]
    - [18, 68.61]
  - - [1024, 13664, 1, 1024]
    - [70, 68.054]
  - - [1024, 13680, 1, 1024]
    - [18, 68.364]
  - - [1024, 13696, 1, 1024]
    - [27, 67.558]
  - - [1024, 13712, 1, 1024]
    - [27, 68.408]
  - - [1024, 13728, 1, 1024]
    - [27, 68.257]
  - - [1024, 13744, 1, 1024]
    - [27, 68.626]
  - - [1024, 13760, 1, 1024]
    - [27, 67.874]
  - - [1024, 13776, 1, 1024]
    - [27, 68.41]
  - - [1024, 13792, 1, 1024]
    - [27, 67.721]
  - - [1024, 13808, 1, 1024]
    - [18, 67.63]
  - - [1024, 13824, 1, 1024]
    - [27, 70.394]
  - - [1024, 13840, 1, 1024]
    - [27, 69.134]
  - - [1024, 13856, 1, 1024]
    - [27, 68.952]
  - - [1024, 13872, 1, 1024]
    - [18, 69.206]
  - - [1024, 13888, 1, 1024]
    - [27, 69.374]
  - - [1024, 13904, 1, 1024]
    - [18, 69.191]
  - - [1024, 13920, 1, 1024]
    - [27, 69.009]
  - - [1024, 13936, 1, 1024]
    - [18, 69.321]
  - - [1024, 13952, 1, 1024]
    - [18, 69.255]
  - - [1024, 13968, 1, 1024]
    - [27, 69.247]
  - - [1024, 14000, 1, 1024]
    - [27, 68.742]
  - - [1024, 14016, 1, 1024]
    - [18, 69.165]
  - - [1024, 14032, 1, 1024]
    - [27, 69.506]
  - - [1024, 14064, 1, 3072]
    - [27, 82.511]
  - - [1024, 14208, 1, 3072]
    - [10, 77.481]
  - - [1024, 14224, 1, 3072]
    - [10, 76.894]
  - - [1024, 14240, 1, 3072]
    - [10, 76.981]
  - - [1024, 14256, 1, 3072]
    - [10, 77.091]
  - - [1024, 14272, 1, 3072]
    - [10, 76.989]
  - - [1024, 14304, 1, 3072]
    - [10, 77.885]
  - - [1024, 14320, 1, 3072]
    - [10, 77.46]
  - - [1024, 14352, 1, 3072]
    - [10, 77.456]
  - - [1024, 14496, 1, 3072]
    - [10, 78.604]
  - - [1024, 14496, 1, 4096]
    - [49, 79.708]
  - - [1024, 14576, 1, 3072]
    - [151, 74.202]
  - - [1024, 15104, 1, 1024]
    - [14, 67.131]
  - - [1024, 15440, 1, 4096]
    - [24, 80.612]
  - - [1024, 1751, 1, 1024]
    - [154, 37.679]
  - - [1024, 1751, 1, 30528]
    - [83, 71.139]
  - - [1024, 1759, 1, 1024]
    - [154, 37.99]
  - - [1024, 1759, 1, 30528]
    - [68, 71.687]
  - - [1024, 1768, 1, 1024]
    - [154, 37.976]
  - - [1024, 1768, 1, 30528]
    - [83, 71.573]
  - - [1024, 1783, 1, 1024]
    - [68, 38.091]
  - - [1024, 1788, 1, 1024]
    - [154, 37.991]
  - - [1024, 1799, 1, 1024]
    - [154, 38.783]
  - - [1024, 1808, 1, 1024]
    - [154, 38.835]
  - - [1024, 1818, 1, 1024]
    - [154, 38.909]
  - - [1024, 1912, 1, 30528]
    - [83, 76.913]
  - - [1024, 1916, 1, 30528]
    - [68, 77.404]
  - - [1024, 1942, 1, 1024]
    - [83, 41.487]
  - - [1024, 1982, 1, 30528]
    - [68, 79.271]
  - - [1024, 1995, 1, 30528]
    - [83, 79.718]
  - - [1024, 2013, 1, 30528]
    - [83, 80.529]
  - - [1024, 2029, 1, 1024]
    - [68, 42.35]
  - - [1024, 2032, 1, 30528]
    - [85, 81.206]
  - - [1024, 2033, 1, 1024]
    - [68, 42.584]
  - - [1024, 2035, 1, 1024]
    - [68, 42.702]
  - - [1024, 2069, 1, 30528]
    - [68, 82.61]
  - - [1024, 2081, 1, 1024]
    - [5, 43.131]
  - - [1024, 2081, 1, 30528]
    - [184, 74.04]
  - - [1024, 2082, 1, 1024]
    - [5, 43.001]
  - - [1024, 2082, 1, 30528]
    - [178, 73.845]
  - - [1024, 2083, 1, 1024]
    - [5, 42.946]
  - - [1024, 2083, 1, 30528]
    - [178, 73.895]
  - - [1024, 2084, 1, 1024]
    - [5, 42.892]
  - - [1024, 2084, 1, 30528]
    - [178, 73.841]
  - - [1024, 2085, 1, 1024]
    - [5, 43.289]
  - - [1024, 2085, 1, 30528]
    - [184, 74.078]
  - - [1024, 2086, 1, 1024]
    - [5, 42.71]
  - - [1024, 2086, 1, 30528]
    - [178, 74.016]
  - - [1024, 2087, 1, 1024]
    - [5, 43.561]
  - - [1024, 2087, 1, 30528]
    - [184, 73.851]
  - - [1024, 2088, 1, 1024]
    - [5, 42.974]
  - - [1024, 2088, 1, 30528]
    - [178, 73.931]
  - - [1024, 2089, 1, 1024]
    - [40, 40.792]
  - - [1024, 2089, 1, 30528]
    - [184, 74.213]
  - - [1024, 2090, 1, 1024]
    - [5, 43.547]
  - - [1024, 2090, 1, 30528]
    - [178, 74.241]
  - - [1024, 2091, 1, 1024]
    - [5, 43.262]
  - - [1024, 2091, 1, 30528]
    - [178, 74.171]
  - - [1024, 2092, 1, 30528]
    - [184, 74.237]
  - - [1024, 2093, 1, 1024]
    - [5, 42.705]
  - - [1024, 2093, 1, 30528]
    - [178, 74.026]
  - - [1024, 2094, 1, 1024]
    - [5, 42.432]
  - - [1024, 2094, 1, 30528]
    - [184, 74.33]
  - - [1024, 2095, 1, 1024]
    - [5, 43.651]
  - - [1024, 2095, 1, 30528]
    - [184, 74.388]
  - - [1024, 2096, 1, 1024]
    - [5, 43.063]
  - - [1024, 2096, 1, 30528]
    - [178, 74.154]
  - - [1024, 2097, 1, 1024]
    - [5, 42.566]
  - - [1024, 2097, 1, 30528]
    - [184, 74.227]
  - - [1024, 2098, 1, 1024]
    - [5, 42.733]
  - - [1024, 2099, 1, 1024]
    - [5, 42.827]
  - - [1024, 2099, 1, 30528]
    - [178, 74.613]
  - - [1024, 2100, 1, 1024]
    - [5, 42.774]
  - - [1024, 2101, 1, 1024]
    - [5, 42.868]
  - - [1024, 2101, 1, 30528]
    - [178, 74.526]
  - - [1024, 2102, 1, 1024]
    - [5, 42.963]
  - - [1024, 2102, 1, 30528]
    - [178, 74.524]
  - - [1024, 2103, 1, 1024]
    - [5, 42.109]
  - - [1024, 2103, 1, 30528]
    - [178, 74.74]
  - - [1024, 2104, 1, 1024]
    - [5, 43.379]
  - - [1024, 2104, 1, 30528]
    - [178, 74.678]
  - - [1024, 2105, 1, 1024]
    - [5, 41.655]
  - - [1024, 2105, 1, 30528]
    - [178, 74.69]
  - - [1024, 2106, 1, 30528]
    - [184, 74.546]
  - - [1024, 2107, 1, 1024]
    - [5, 43.365]
  - - [1024, 2108, 1, 1024]
    - [5, 43.311]
  - - [1024, 2108, 1, 30528]
    - [184, 74.632]
  - - [1024, 2109, 1, 1024]
    - [5, 41.319]
  - - [1024, 2109, 1, 30528]
    - [178, 74.584]
  - - [1024, 2110, 1, 1024]
    - [37, 40.664]
  - - [1024, 2110, 1, 30528]
    - [178, 74.86]
  - - [1024, 2111, 1, 1024]
    - [5, 43.147]
  - - [1024, 2111, 1, 30528]
    - [184, 74.663]
  - - [1024, 2112, 1, 1024]
    - [10, 44.396]
  - - [1024, 2113, 1, 1024]
    - [5, 43.413]
  - - [1024, 2113, 1, 30528]
    - [184, 74.763]
  - - [1024, 2114, 1, 1024]
    - [5, 44.36]
  - - [1024, 2114, 1, 30528]
    - [184, 74.98]
  - - [1024, 2115, 1, 1024]
    - [5, 43.08]
  - - [1024, 2115, 1, 30528]
    - [184, 74.632]
  - - [1024, 2116, 1, 1024]
    - [5, 44.088]
  - - [1024, 2116, 1, 30528]
    - [184, 74.802]
  - - [1024, 2117, 1, 1024]
    - [5, 42.972]
  - - [1024, 2117, 1, 30528]
    - [184, 74.875]
  - - [1024, 2118, 1, 1024]
    - [5, 43.82]
  - - [1024, 2118, 1, 30528]
    - [184, 74.963]
  - - [1024, 2119, 1, 1024]
    - [5, 43.996]
  - - [1024, 2119, 1, 30528]
    - [184, 74.886]
  - - [1024, 2120, 1, 1024]
    - [5, 42.886]
  - - [1024, 2120, 1, 30528]
    - [184, 75.155]
  - - [1024, 2121, 1, 1024]
    - [5, 43.883]
  - - [1024, 2122, 1, 1024]
    - [5, 43.447]
  - - [1024, 2122, 1, 30528]
    - [184, 75.074]
  - - [1024, 2123, 1, 1024]
    - [5, 43.924]
  - - [1024, 2123, 1, 30528]
    - [184, 74.757]
  - - [1024, 2124, 1, 1024]
    - [5, 42.602]
  - - [1024, 2124, 1, 30528]
    - [184, 75.258]
  - - [1024, 2125, 1, 1024]
    - [5, 44.197]
  - - [1024, 2125, 1, 30528]
    - [184, 75.188]
  - - [1024, 2126, 1, 1024]
    - [40, 41.514]
  - - [1024, 2126, 1, 30528]
    - [184, 75.36]
  - - [1024, 2127, 1, 1024]
    - [5, 44.553]
  - - [1024, 2127, 1, 30528]
    - [184, 75.183]
  - - [1024, 2128, 1, 1024]
    - [5, 42.828]
  - - [1024, 2128, 1, 30528]
    - [184, 75.514]
  - - [1024, 2129, 1, 1024]
    - [5, 42.486]
  - - [1024, 2129, 1, 30528]
    - [184, 75.231]
  - - [1024, 2130, 1, 1024]
    - [5, 44.458]
  - - [1024, 2130, 1, 30528]
    - [184, 75.41]
  - - [1024, 2131, 1, 1024]
    - [5, 42.961]
  - - [1024, 2131, 1, 30528]
    - [184, 75.476]
  - - [1024, 2132, 1, 1024]
    - [5, 43.88]
  - - [1024, 2132, 1, 30528]
    - [184, 75.315]
  - - [1024, 2133, 1, 1024]
    - [5, 44.521]
  - - [1024, 2133, 1, 30528]
    - [184, 75.395]
  - - [1024, 2134, 1, 1024]
    - [5, 43.466]
  - - [1024, 2134, 1, 30528]
    - [184, 75.643]
  - - [1024, 2135, 1, 1024]
    - [5, 44.72]
  - - [1024, 2135, 1, 30528]
    - [184, 75.496]
  - - [1024, 2136, 1, 1024]
    - [5, 43.886]
  - - [1024, 2136, 1, 30528]
    - [184, 75.729]
  - - [1024, 2137, 1, 1024]
    - [5, 44.213]
  - - [1024, 2137, 1, 30528]
    - [184, 75.704]
  - - [1024, 2138, 1, 1024]
    - [5, 44.625]
  - - [1024, 2138, 1, 30528]
    - [184, 75.565]
  - - [1024, 2139, 1, 1024]
    - [5, 44.411]
  - - [1024, 2139, 1, 30528]
    - [184, 75.328]
  - - [1024, 2140, 1, 1024]
    - [5, 43.664]
  - - [1024, 2140, 1, 30528]
    - [184, 75.81]
  - - [1024, 2141, 1, 1024]
    - [5, 43.912]
  - - [1024, 2141, 1, 30528]
    - [184, 75.663]
  - - [1024, 2142, 1, 1024]
    - [5, 44.009]
  - - [1024, 2142, 1, 30528]
    - [184, 75.973]
  - - [1024, 2143, 1, 1024]
    - [5, 43.801]
  - - [1024, 2143, 1, 30528]
    - [184, 75.665]
  - - [1024, 2144, 1, 1024]
    - [5, 44.437]
  - - [1024, 2144, 1, 30528]
    - [184, 75.739]
  - - [1024, 2145, 1, 1024]
    - [5, 44.614]
  - - [1024, 2145, 1, 30528]
    - [184, 75.964]
  - - [1024, 2146, 1, 1024]
    - [5, 43.938]
  - - [1024, 2147, 1, 30528]
    - [184, 75.799]
  - - [1024, 2148, 1, 1024]
    - [5, 44.598]
  - - [1024, 2148, 1, 30528]
    - [184, 75.88]
  - - [1024, 2149, 1, 1024]
    - [5, 44.384]
  - - [1024, 2149, 1, 30528]
    - [184, 75.915]
  - - [1024, 2150, 1, 1024]
    - [5, 43.27]
  - - [1024, 2150, 1, 30528]
    - [184, 76.004]
  - - [1024, 2151, 1, 1024]
    - [5, 44.66]
  - - [1024, 2151, 1, 30528]
    - [184, 76.055]
  - - [1024, 2152, 1, 1024]
    - [5, 44.759]
  - - [1024, 2152, 1, 30528]
    - [184, 75.93]
  - - [1024, 2153, 1, 1024]
    - [5, 44.544]
  - - [1024, 2153, 1, 30528]
    - [184, 76.11]
  - - [1024, 2154, 1, 1024]
    - [5, 44.644]
  - - [1024, 2154, 1, 30528]
    - [184, 76.016]
  - - [1024, 2155, 1, 1024]
    - [5, 43.297]
  - - [1024, 2155, 1, 30528]
    - [184, 76.158]
  - - [1024, 2156, 1, 1024]
    - [5, 45.161]
  - - [1024, 2156, 1, 30528]
    - [184, 76.109]
  - - [1024, 2157, 1, 1024]
    - [5, 43.634]
  - - [1024, 2157, 1, 30528]
    - [184, 76.114]
  - - [1024, 2158, 1, 1024]
    - [5, 44.493]
  - - [1024, 2159, 1, 1024]
    - [5, 44.358]
  - - [1024, 2159, 1, 30528]
    - [184, 76.468]
  - - [1024, 2160, 1, 1024]
    - [5, 45.325]
  - - [1024, 2160, 1, 30528]
    - [184, 76.296]
  - - [1024, 2161, 1, 1024]
    - [5, 44.867]
  - - [1024, 2161, 1, 30528]
    - [184, 76.347]
  - - [1024, 2162, 1, 1024]
    - [5, 44.731]
  - - [1024, 2162, 1, 30528]
    - [184, 76.321]
  - - [1024, 2163, 1, 1024]
    - [5, 44.44]
  - - [1024, 2163, 1, 30528]
    - [184, 76.486]
  - - [1024, 2164, 1, 1024]
    - [5, 45.088]
  - - [1024, 2164, 1, 30528]
    - [184, 76.284]
  - - [1024, 2165, 1, 1024]
    - [5, 44.327]
  - - [1024, 2165, 1, 30528]
    - [184, 76.419]
  - - [1024, 2166, 1, 1024]
    - [40, 41.406]
  - - [1024, 2166, 1, 30528]
    - [184, 76.47]
  - - [1024, 2167, 1, 1024]
    - [5, 45.071]
  - - [1024, 2167, 1, 30528]
    - [184, 76.559]
  - - [1024, 2168, 1, 1024]
    - [5, 44.62]
  - - [1024, 2168, 1, 30528]
    - [184, 76.586]
  - - [1024, 2169, 1, 1024]
    - [5, 45.034]
  - - [1024, 2169, 1, 30528]
    - [184, 76.53]
  - - [1024, 2170, 1, 1024]
    - [5, 45.213]
  - - [1024, 2170, 1, 30528]
    - [184, 76.534]
  - - [1024, 2171, 1, 1024]
    - [5, 44.45]
  - - [1024, 2171, 1, 30528]
    - [184, 76.615]
  - - [1024, 2172, 1, 1024]
    - [5, 45.255]
  - - [1024, 2172, 1, 30528]
    - [184, 76.612]
  - - [1024, 2173, 1, 1024]
    - [5, 44.109]
  - - [1024, 2173, 1, 30528]
    - [184, 76.648]
  - - [1024, 2174, 1, 1024]
    - [5, 44.512]
  - - [1024, 2174, 1, 30528]
    - [184, 76.821]
  - - [1024, 2175, 1, 1024]
    - [5, 45.398]
  - - [1024, 2175, 1, 30528]
    - [184, 76.711]
  - - [1024, 2176, 1, 1024]
    - [5, 43.571]
  - - [1024, 2176, 1, 30528]
    - [184, 76.792]
  - - [1024, 2177, 1, 1024]
    - [5, 43.665]
  - - [1024, 2177, 1, 30528]
    - [184, 76.605]
  - - [1024, 2178, 1, 1024]
    - [5, 45.46]
  - - [1024, 2178, 1, 30528]
    - [184, 76.625]
  - - [1024, 2179, 1, 1024]
    - [5, 43.779]
  - - [1024, 2179, 1, 30528]
    - [184, 76.782]
  - - [1024, 2180, 1, 1024]
    - [5, 44.789]
  - - [1024, 2180, 1, 30528]
    - [184, 76.726]
  - - [1024, 2181, 1, 1024]
    - [5, 44.655]
  - - [1024, 2181, 1, 30528]
    - [184, 76.868]
  - - [1024, 2183, 1, 1024]
    - [5, 44.774]
  - - [1024, 2183, 1, 30528]
    - [184, 76.77]
  - - [1024, 2184, 1, 1024]
    - [5, 44.716]
  - - [1024, 2184, 1, 30528]
    - [184, 77.005]
  - - [1024, 2185, 1, 1024]
    - [5, 44.582]
  - - [1024, 2185, 1, 30528]
    - [184, 76.901]
  - - [1024, 2186, 1, 1024]
    - [5, 44.913]
  - - [1024, 2186, 1, 30528]
    - [184, 76.875]
  - - [1024, 2187, 1, 1024]
    - [5, 45.169]
  - - [1024, 2187, 1, 30528]
    - [184, 77.034]
  - - [1024, 2188, 1, 1024]
    - [5, 45.19]
  - - [1024, 2188, 1, 30528]
    - [184, 76.938]
  - - [1024, 2189, 1, 1024]
    - [5, 44.897]
  - - [1024, 2189, 1, 30528]
    - [184, 77.073]
  - - [1024, 2190, 1, 1024]
    - [5, 45.231]
  - - [1024, 2190, 1, 30528]
    - [184, 76.993]
  - - [1024, 2191, 1, 1024]
    - [5, 43.576]
  - - [1024, 2191, 1, 30528]
    - [184, 77.036]
  - - [1024, 2192, 1, 1024]
    - [5, 44.191]
  - - [1024, 2192, 1, 30528]
    - [184, 77.071]
  - - [1024, 2193, 1, 1024]
    - [5, 44.287]
  - - [1024, 2193, 1, 30528]
    - [184, 77.014]
  - - [1024, 2194, 1, 1024]
    - [5, 42.913]
  - - [1024, 2194, 1, 30528]
    - [184, 77.11]
  - - [1024, 2195, 1, 1024]
    - [5, 44.555]
  - - [1024, 2195, 1, 30528]
    - [184, 76.931]
  - - [1024, 2196, 1, 1024]
    - [5, 44.807]
  - - [1024, 2196, 1, 30528]
    - [184, 77.15]
  - - [1024, 2197, 1, 1024]
    - [5, 43.549]
  - - [1024, 2197, 1, 30528]
    - [184, 77.27]
  - - [1024, 2198, 1, 1024]
    - [5, 43.789]
  - - [1024, 2198, 1, 30528]
    - [184, 77.259]
  - - [1024, 2199, 1, 1024]
    - [5, 45.338]
  - - [1024, 2199, 1, 30528]
    - [184, 77.348]
  - - [1024, 2200, 1, 1024]
    - [5, 45.201]
  - - [1024, 2200, 1, 30528]
    - [184, 77.314]
  - - [1024, 2201, 1, 1024]
    - [5, 45.142]
  - - [1024, 2201, 1, 30528]
    - [184, 77.465]
  - - [1024, 2202, 1, 1024]
    - [5, 45.163]
  - - [1024, 2202, 1, 30528]
    - [184, 77.43]
  - - [1024, 2203, 1, 1024]
    - [5, 45.262]
  - - [1024, 2203, 1, 30528]
    - [184, 77.357]
  - - [1024, 2204, 1, 1024]
    - [5, 45.126]
  - - [1024, 2204, 1, 30528]
    - [184, 77.462]
  - - [1024, 2205, 1, 1024]
    - [5, 45.068]
  - - [1024, 2205, 1, 30528]
    - [184, 77.466]
  - - [1024, 2206, 1, 1024]
    - [5, 44.097]
  - - [1024, 2206, 1, 30528]
    - [184, 77.61]
  - - [1024, 2207, 1, 1024]
    - [5, 45.344]
  - - [1024, 2207, 1, 30528]
    - [184, 77.606]
  - - [1024, 2208, 1, 1024]
    - [10, 47.774]
  - - [1024, 2208, 1, 30528]
    - [184, 77.595]
  - - [1024, 2209, 1, 1024]
    - [5, 45.864]
  - - [1024, 2209, 1, 30528]
    - [184, 77.653]
  - - [1024, 2210, 1, 1024]
    - [5, 44.176]
  - - [1024, 2210, 1, 30528]
    - [184, 77.618]
  - - [1024, 2211, 1, 1024]
    - [5, 45.348]
  - - [1024, 2211, 1, 30528]
    - [184, 77.607]
  - - [1024, 2212, 1, 1024]
    - [5, 45.686]
  - - [1024, 2212, 1, 30528]
    - [184, 78.031]
  - - [1024, 2213, 1, 1024]
    - [5, 45.468]
  - - [1024, 2213, 1, 30528]
    - [184, 77.802]
  - - [1024, 2214, 1, 1024]
    - [5, 45.968]
  - - [1024, 2214, 1, 30528]
    - [184, 77.759]
  - - [1024, 2215, 1, 1024]
    - [5, 46.07]
  - - [1024, 2215, 1, 30528]
    - [184, 77.431]
  - - [1024, 2216, 1, 1024]
    - [5, 43.272]
  - - [1024, 2216, 1, 30528]
    - [184, 77.868]
  - - [1024, 2217, 1, 1024]
    - [5, 45.788]
  - - [1024, 2218, 1, 1024]
    - [5, 43.965]
  - - [1024, 2218, 1, 30528]
    - [184, 77.915]
  - - [1024, 2219, 1, 1024]
    - [5, 45.991]
  - - [1024, 2219, 1, 30528]
    - [184, 77.834]
  - - [1024, 2220, 1, 30528]
    - [184, 78.009]
  - - [1024, 2221, 1, 1024]
    - [5, 46.032]
  - - [1024, 2221, 1, 30528]
    - [184, 78.044]
  - - [1024, 2222, 1, 1024]
    - [5, 45.973]
  - - [1024, 2222, 1, 30528]
    - [184, 78.157]
  - - [1024, 2223, 1, 1024]
    - [5, 45.124]
  - - [1024, 2223, 1, 30528]
    - [184, 78.091]
  - - [1024, 2224, 1, 1024]
    - [5, 45.615]
  - - [1024, 2224, 1, 30528]
    - [184, 78.345]
  - - [1024, 2225, 1, 1024]
    - [5, 44.628]
  - - [1024, 2225, 1, 30528]
    - [184, 78.052]
  - - [1024, 2226, 1, 1024]
    - [5, 44.8]
  - - [1024, 2226, 1, 30528]
    - [184, 78.087]
  - - [1024, 2227, 1, 1024]
    - [5, 45.755]
  - - [1024, 2227, 1, 30528]
    - [184, 78.184]
  - - [1024, 2228, 1, 1024]
    - [5, 46.178]
  - - [1024, 2228, 1, 30528]
    - [184, 78.235]
  - - [1024, 2229, 1, 1024]
    - [5, 44.937]
  - - [1024, 2229, 1, 30528]
    - [184, 78.301]
  - - [1024, 2230, 1, 1024]
    - [5, 46.057]
  - - [1024, 2230, 1, 30528]
    - [184, 78.266]
  - - [1024, 2231, 1, 1024]
    - [5, 44.748]
  - - [1024, 2231, 1, 30528]
    - [184, 78.325]
  - - [1024, 2232, 1, 1024]
    - [5, 46.505]
  - - [1024, 2232, 1, 30528]
    - [184, 78.352]
  - - [1024, 2233, 1, 1024]
    - [5, 46.119]
  - - [1024, 2233, 1, 30528]
    - [184, 78.442]
  - - [1024, 2234, 1, 1024]
    - [5, 45.899]
  - - [1024, 2234, 1, 30528]
    - [184, 78.438]
  - - [1024, 2235, 1, 1024]
    - [5, 46.241]
  - - [1024, 2235, 1, 30528]
    - [184, 78.364]
  - - [1024, 2236, 1, 1024]
    - [5, 45.94]
  - - [1024, 2236, 1, 30528]
    - [184, 78.414]
  - - [1024, 2237, 1, 30528]
    - [184, 78.834]
  - - [1024, 2238, 1, 1024]
    - [5, 46.062]
  - - [1024, 2238, 1, 30528]
    - [184, 78.539]
  - - [1024, 2239, 1, 1024]
    - [5, 46.082]
  - - [1024, 2239, 1, 30528]
    - [184, 78.582]
  - - [1024, 2240, 1, 1024]
    - [5, 45.784]
  - - [1024, 2240, 1, 30528]
    - [184, 78.437]
  - - [1024, 2241, 1, 1024]
    - [5, 44.949]
  - - [1024, 2241, 1, 30528]
    - [184, 78.621]
  - - [1024, 2242, 1, 1024]
    - [5, 45.667]
  - - [1024, 2242, 1, 30528]
    - [184, 78.586]
  - - [1024, 2243, 1, 1024]
    - [37, 43.087]
  - - [1024, 2244, 1, 1024]
    - [5, 46.428]
  - - [1024, 2244, 1, 30528]
    - [184, 78.75]
  - - [1024, 2245, 1, 1024]
    - [5, 46.045]
  - - [1024, 2245, 1, 30528]
    - [184, 78.753]
  - - [1024, 2246, 1, 1024]
    - [5, 45.827]
  - - [1024, 2246, 1, 30528]
    - [184, 78.726]
  - - [1024, 2247, 1, 1024]
    - [5, 45.454]
  - - [1024, 2247, 1, 30528]
    - [184, 78.761]
  - - [1024, 2248, 1, 1024]
    - [5, 46.348]
  - - [1024, 2248, 1, 30528]
    - [184, 78.772]
  - - [1024, 2249, 1, 1024]
    - [5, 45.652]
  - - [1024, 2249, 1, 30528]
    - [184, 79.17]
  - - [1024, 2250, 1, 1024]
    - [5, 46.067]
  - - [1024, 2250, 1, 30528]
    - [184, 78.945]
  - - [1024, 2251, 1, 1024]
    - [5, 44.619]
  - - [1024, 2252, 1, 1024]
    - [5, 46.511]
  - - [1024, 2252, 1, 30528]
    - [184, 78.795]
  - - [1024, 2253, 1, 1024]
    - [5, 46.614]
  - - [1024, 2253, 1, 30528]
    - [184, 78.877]
  - - [1024, 2254, 1, 1024]
    - [5, 43.582]
  - - [1024, 2254, 1, 30528]
    - [184, 79.362]
  - - [1024, 2255, 1, 1024]
    - [5, 46.655]
  - - [1024, 2255, 1, 30528]
    - [184, 78.869]
  - - [1024, 2256, 1, 1024]
    - [5, 44.793]
  - - [1024, 2256, 1, 30528]
    - [184, 79.092]
  - - [1024, 2257, 1, 1024]
    - [5, 44.662]
  - - [1024, 2257, 1, 30528]
    - [184, 79.301]
  - - [1024, 2258, 1, 1024]
    - [5, 46.717]
  - - [1024, 2258, 1, 30528]
    - [184, 79.178]
  - - [1024, 2259, 1, 1024]
    - [5, 46.494]
  - - [1024, 2259, 1, 30528]
    - [184, 78.727]
  - - [1024, 2260, 1, 1024]
    - [5, 45.024]
  - - [1024, 2260, 1, 30528]
    - [184, 79.256]
  - - [1024, 2261, 1, 1024]
    - [5, 45.66]
  - - [1024, 2261, 1, 30528]
    - [184, 79.189]
  - - [1024, 2262, 1, 1024]
    - [5, 45.916]
  - - [1024, 2262, 1, 30528]
    - [184, 79.334]
  - - [1024, 2263, 1, 1024]
    - [5, 46.576]
  - - [1024, 2263, 1, 30528]
    - [184, 79.204]
  - - [1024, 2264, 1, 1024]
    - [5, 46.516]
  - - [1024, 2264, 1, 30528]
    - [184, 79.381]
  - - [1024, 2265, 1, 1024]
    - [5, 46.536]
  - - [1024, 2265, 1, 30528]
    - [184, 79.447]
  - - [1024, 2266, 1, 1024]
    - [5, 45.296]
  - - [1024, 2266, 1, 30528]
    - [184, 79.482]
  - - [1024, 2267, 1, 1024]
    - [5, 46.986]
  - - [1024, 2267, 1, 30528]
    - [184, 79.351]
  - - [1024, 2268, 1, 1024]
    - [5, 46.276]
  - - [1024, 2268, 1, 30528]
    - [184, 79.719]
  - - [1024, 2269, 1, 1024]
    - [5, 46.945]
  - - [1024, 2269, 1, 30528]
    - [184, 79.453]
  - - [1024, 2270, 1, 1024]
    - [5, 47.214]
  - - [1024, 2270, 1, 30528]
    - [184, 79.67]
  - - [1024, 2271, 1, 1024]
    - [5, 46.986]
  - - [1024, 2271, 1, 30528]
    - [184, 79.531]
  - - [1024, 2272, 1, 1024]
    - [5, 45.961]
  - - [1024, 2272, 1, 30528]
    - [184, 79.661]
  - - [1024, 2273, 1, 1024]
    - [5, 46.297]
  - - [1024, 2273, 1, 30528]
    - [184, 79.72]
  - - [1024, 2274, 1, 30528]
    - [184, 79.668]
  - - [1024, 2275, 1, 1024]
    - [5, 46.339]
  - - [1024, 2275, 1, 30528]
    - [184, 79.822]
  - - [1024, 2276, 1, 1024]
    - [5, 47.007]
  - - [1024, 2276, 1, 30528]
    - [184, 79.73]
  - - [1024, 2277, 1, 1024]
    - [5, 46.701]
  - - [1024, 2277, 1, 30528]
    - [184, 79.868]
  - - [1024, 2278, 1, 1024]
    - [5, 46.803]
  - - [1024, 2278, 1, 30528]
    - [184, 79.911]
  - - [1024, 2279, 1, 1024]
    - [5, 45.556]
  - - [1024, 2279, 1, 30528]
    - [184, 79.97]
  - - [1024, 2280, 1, 1024]
    - [5, 46.52]
  - - [1024, 2280, 1, 30528]
    - [184, 79.981]
  - - [1024, 2281, 1, 1024]
    - [5, 44.912]
  - - [1024, 2281, 1, 30528]
    - [184, 79.818]
  - - [1024, 2282, 1, 1024]
    - [5, 45.849]
  - - [1024, 2282, 1, 30528]
    - [184, 79.948]
  - - [1024, 2283, 1, 1024]
    - [5, 45.713]
  - - [1024, 2283, 1, 30528]
    - [184, 79.999]
  - - [1024, 2284, 1, 1024]
    - [5, 46.442]
  - - [1024, 2284, 1, 30528]
    - [184, 79.962]
  - - [1024, 2285, 1, 1024]
    - [5, 46.703]
  - - [1024, 2285, 1, 30528]
    - [184, 80.165]
  - - [1024, 2286, 1, 1024]
    - [5, 47.131]
  - - [1024, 2286, 1, 30528]
    - [184, 80.128]
  - - [1024, 2287, 1, 1024]
    - [5, 46.907]
  - - [1024, 2287, 1, 30528]
    - [184, 80.099]
  - - [1024, 2288, 1, 1024]
    - [5, 46.845]
  - - [1024, 2288, 1, 30528]
    - [184, 80.094]
  - - [1024, 2289, 1, 1024]
    - [5, 47.111]
  - - [1024, 2289, 1, 30528]
    - [184, 80.329]
  - - [1024, 2290, 1, 1024]
    - [5, 47.297]
  - - [1024, 2290, 1, 30528]
    - [184, 80.26]
  - - [1024, 2291, 1, 1024]
    - [5, 47.235]
  - - [1024, 2291, 1, 30528]
    - [184, 80.08]
  - - [1024, 2292, 1, 1024]
    - [5, 46.766]
  - - [1024, 2292, 1, 30528]
    - [184, 80.314]
  - - [1024, 2293, 1, 1024]
    - [5, 46.465]
  - - [1024, 2293, 1, 30528]
    - [184, 80.309]
  - - [1024, 2294, 1, 1024]
    - [5, 44.573]
  - - [1024, 2294, 1, 30528]
    - [184, 80.257]
  - - [1024, 2295, 1, 1024]
    - [5, 45.798]
  - - [1024, 2295, 1, 30528]
    - [184, 80.459]
  - - [1024, 2296, 1, 1024]
    - [5, 46.052]
  - - [1024, 2296, 1, 30528]
    - [184, 80.406]
  - - [1024, 2297, 1, 1024]
    - [5, 44.928]
  - - [1024, 2297, 1, 30528]
    - [184, 80.489]
  - - [1024, 2298, 1, 1024]
    - [5, 45.781]
  - - [1024, 2298, 1, 30528]
    - [184, 80.373]
  - - [1024, 2299, 1, 1024]
    - [5, 46.587]
  - - [1024, 2299, 1, 30528]
    - [184, 80.648]
  - - [1024, 2300, 1, 1024]
    - [5, 46.929]
  - - [1024, 2300, 1, 30528]
    - [184, 80.635]
  - - [1024, 2301, 1, 1024]
    - [5, 46.627]
  - - [1024, 2301, 1, 30528]
    - [184, 80.71]
  - - [1024, 2302, 1, 1024]
    - [5, 46.808]
  - - [1024, 2302, 1, 30528]
    - [184, 80.545]
  - - [1024, 2303, 1, 1024]
    - [5, 47.153]
  - - [1024, 2303, 1, 30528]
    - [184, 80.428]
  - - [1024, 2312, 1, 30528]
    - [24, 78.379]
  - - [1024, 2356, 1, 30528]
    - [24, 79.786]
  - - [1024, 2364, 1, 30528]
    - [24, 80.088]
  - - [1024, 2374, 1, 30528]
    - [24, 80.443]
  - - [1024, 2377, 1, 30528]
    - [24, 80.467]
  - - [1024, 2386, 1, 1024]
    - [5, 48.349]
  - - [1024, 2405, 1, 30528]
    - [24, 81.36]
  - - [1024, 2492, 1, 30528]
    - [24, 84.206]
  - - [4096, 12192, 1, 1024]
    - [18, 75.115]
  - - [4096, 13536, 1, 1024]
    - [18, 73.337]
  - - [4096, 14224, 1, 1024]
    - [27, 73.076]
  - - [1000, 1024, 1, 100]
    - [134, 5.416]
  - - [1024, 10752, 1, 1024]
    - [14, 64.511]
  - - [1024, 10752, 1, 4096]
    - [45, 77.405]
  - - [1024, 3584, 1, 1024]
    - [5, 52.992]
  - - [1024, 896, 1, 4096]
    - [154, 51.635]
  - - [1280, 224, 1, 100]
    - [51, 2.197]
  - - [1280, 224, 1, 5120]
    - [30, 29.377]
  - - [1280, 896, 1, 1280]
    - [5, 37.419]
  - - [1280, 896, 1, 5120]
    - [49, 61.313]
  - - [1664, 256, 1, 1000]
    - [26, 16.959]
  - - [1664, 64, 1, 1000]
    - [86, 5.581]
  - - [18816, 1024, 1, 512]
    - [21, 56.619]
  - - [1920, 256, 1, 1000]
    - [26, 17.414]
  - - [1920, 64, 1, 1000]
    - [50, 5.842]
  - - [2048, 256, 1, 1000]
    - [39, 18.812]
  - - [2048, 96, 1, 1000]
    - [51, 9.004]
  - - [224, 32768, 1, 4000]
    - [33, 65.776]
  - - [224, 8192, 1, 4000]
    - [83, 59.366]
  - - [2304, 896, 1, 768]
    - [5, 37.136]
  - - [25088, 256, 1, 4096]
    - [18, 75.053]
  - - [25088, 96, 1, 4096]
    - [49, 66.354]
  - - [3072, 3584, 1, 768]
    - [38, 57.702]
  - - [3072, 5376, 1, 768]
    - [27, 63.398]
  - - [3072, 896, 1, 768]
    - [37, 38.727]
  - - [3840, 5376, 1, 1280]
    - [18, 73.399]
  - - [3840, 896, 1, 1280]
    - [29, 57.097]
  - - [4096, 256, 1, 4096]
    - [49, 53.587]
  - - [4096, 896, 1, 1024]
    - [5, 52.728]
  - - [4096, 96, 1, 1000]
    - [26, 14.337]
  - - [768, 10752, 1, 3072]
    - [13, 71.378]
  - - [768, 10752, 1, 768]
    - [14, 54.5]
  - - [768, 224, 1, 100]
    - [51, 1.375]
  - - [768, 224, 1, 768]
    - [8, 7.753]
  - - [768, 3584, 1, 3072]
    - [90, 59.135]
  - - [768, 5376, 1, 3072]
    - [13, 67.95]
  - - [768, 5376, 1, 768]
    - [37, 46.517]
  - - [768, 896, 1, 768]
    - [20, 23.078]
  - - [196, 128, 64, 1088]
    - [174, 26.741]
  - - [196, 128, 64, 1760]
    - [174, 30.941]
  - - [196, 128, 16, 320]
    - [213, 7.025]
  - - [196, 128, 64, 384]
    - [174, 16.345]
  - - [196, 128, 64, 512]
    - [174, 19.019]
  - - [196, 128, 64, 544]
    - [174, 20.166]
  - - [196, 128, 16, 672]
    - [160, 10.516]
  - - [196, 128, 16, 704]
    - [160, 10.829]
  - - [196, 128, 16, 736]
    - [160, 11.132]
  - - [196, 128, 16, 800]
    - [160, 12.02]
  - - [196, 128, 16, 832]
    - [160, 12.217]
  - - [196, 128, 64, 896]
    - [174, 24.301]
  - - [3136, 128, 16, 256]
    - [58, 31.185]
  - - [3136, 128, 96, 256]
    - [138, 40.832]
  - - [3136, 128, 16, 64]
    - [134, 12.483]
  - - [3136, 128, 16, 96]
    - [37, 16.539]
  - - [3136, 128, 64, 96]
    - [138, 23.35]
  - - [3136, 256, 96, 64]
    - [103, 20.208]
  - - [49, 128, 16, 1760]
    - [208, 6.357]
  - - [49, 128, 16, 1792]
    - [168, 7.011]
  - - [49, 128, 64, 1792]
    - [171, 15.148]
  - - [49, 128, 16, 1824]
    - [208, 6.193]
  - - [49, 128, 16, 1856]
    - [210, 7.211]
  - - [49, 128, 64, 1888]
    - [160, 16.233]
  - - [49, 128, 64, 672]
    - [213, 10.063]
  - - [49, 128, 64, 704]
    - [160, 10.205]
  - - [49, 128, 64, 736]
    - [213, 10.807]
  - - [49, 128, 64, 768]
    - [168, 10.246]
  - - [49, 128, 64, 832]
    - [160, 11.299]
  - - [64, 224, 192, 224]
    - [134, 17.996]
  - - [64, 224, 256, 224]
    - [114, 19.582]
  - - [64, 224, 288, 224]
    - [124, 19.961]
  - - [64, 224, 480, 224]
    - [134, 22.495]
  - - [64, 224, 576, 224]
    - [134, 22.75]
  - - [64, 224, 64, 224]
    - [134, 10.43]
  - - [64, 224, 768, 224]
    - [43, 23.81]
  - - [64, 224, 80, 224]
    - [188, 12.476]
  - - [1, 256, 1, 2200]
    - [230, 0.171]
  - - [1, 256, 1, 4000]
    - [231, 0.261]
  - - [1, 256, 1, 1024]
    - [232, 0.093]
  - - [1, 2048, 1, 9217]
    - [236, 0.34]
  - - [32, 851, 2048, 160]
    - [213, 20.538]
  - - [32, 379, 2048, 160]
    - [109, 19.997]
  - - [39488, 2048, 1, 512]
    - [218, 80.922]
  - - [1536, 3, 1, 1536]
    - [19, 0.356]
  - - [1536, 3, 1, 2]
    - [93, 0.001]
  - - [1536, 384, 1, 1536]
    - [57, 28.118]
  - - [1536, 384, 1, 6144]
    - [15, 47.474]
  - - [1536, 4, 1, 1]
    - [52, 0.0]
  - - [1536, 4, 1, 2]
    - [51, 0.001]
  - - [1536, 512, 1, 1536]
    - [15, 35.908]
  - - [1536, 512, 1, 6144]
    - [15, 61.028]
  - - [6144, 384, 1, 1536]
    - [10, 56.159]
  - - [6144, 512, 1, 1536]
    - [203, 58.409]
  - - [64, 128, 72, 512]
    - [26, 13.448]
  - - [64, 128, 96, 512]
    - [15, 15.751]
  - - [2304, 6144, 1, 1]
    - [218, 0.23]
  - - [3072, 3072, 1, 1024]
    - [10, 67.708]
  - - [768, 768, 1, 768]
    - [15, 19.114]
  - - [768, 768, 1, 3072]
    - [9, 39.032]
  - - [1024, 64, 1, 1]
    - [51, 0.006]
  - - [768, 131072, 1, 3072]
    - [218, 90.731]
  - - [2304, 12288, 1, 768]
    - [218, 75.747]
  - - [2304, 24576, 1, 1]
    - [218, 0.372]
  - - [2304, 256, 1, 768]
    - [15, 19.043]
  - - [3072, 12288, 1, 1]
    - [218, 0.333]
  - - [2304, 512, 1, 768]
    - [49, 28.997]
  - - [1024, 768, 1, 1024]
    - [20, 29.747]
  - - [4096, 16, 1, 1024]
    - [121, 3.653]
  - - [2304, 768, 1, 768]
    - [76, 39.975]
  - - [3072, 128, 1, 768]
    - [44, 15.257]
  - - [768, 1024, 1, 3072]
    - [15, 51.259]
  - - [1024, 256, 1, 1024]
    - [44, 12.924]
  - - [768, 98304, 1, 768]
    - [218, 80.36]
  - - [2304, 2048, 1, 768]
    - [5, 50.405]
  - - [768, 4096, 1, 1]
    - [216, 0.127]
  - - [2304, 12288, 1, 1]
    - [218, 0.308]
  - - [768, 24576, 1, 768]
    - [218, 67.096]
  - - [3072, 512, 1, 1024]
    - [33, 40.961]
  - - [3072, 98304, 1, 768]
    - [218, 84.933]
  - - [3072, 768, 1, 1024]
    - [10, 49.76]
  - - [768, 16, 1, 3072]
    - [66, 1.376]
  - - [768, 384, 1, 1]
    - [51, 0.022]
  - - [2304, 384, 1, 768]
    - [15, 28.041]
  - - [1024, 128, 1, 1]
    - [51, 0.01]
  - - [768, 32768, 1, 768]
    - [218, 74.982]
  - - [3072, 32768, 1, 768]
    - [218, 82.122]
  - - [2304, 1024, 1, 768]
    - [5, 42.44]
  - - [3072, 16, 1, 1]
    - [51, 0.004]
  - - [4096, 1536, 1, 1024]
    - [218, 62.896]
  - - [1024, 32, 1, 1]
    - [99, 0.003]
  - - [768, 128, 1, 1]
    - [51, 0.008]
  - - [2304, 131072, 1, 768]
    - [218, 83.575]
  - - [3072, 512, 1, 768]
    - [273, 43.619]
  - - [3072, 16384, 1, 768]
    - [218, 79.354]
  - - [3072, 1024, 1, 1]
    - [216, 0.124]
  - - [1024, 384, 1, 1024]
    - [42, 18.823]
  - - [2304, 131072, 1, 1]
    - [218, 0.457]
  - - [2304, 128, 1, 768]
    - [44, 11.705]
  - - [4096, 128, 1, 1024]
    - [9, 20.028]
  - - [3072, 49152, 1, 1]
    - [218, 0.428]
  - - [768, 256, 1, 768]
    - [51, 8.298]
  - - [2304, 49152, 1, 1]
    - [218, 0.423]
  - - [2304, 98304, 1, 1]
    - [218, 0.445]
  - - [2304, 16, 1, 1]
    - [51, 0.003]
  - - [3072, 8192, 1, 1]
    - [218, 0.291]
  - - [2304, 384, 1, 1]
    - [134, 0.054]
  - - [768, 8192, 1, 3072]
    - [18, 75.293]
  - - [2304, 768, 1, 1]
    - [217, 0.093]
  - - [3072, 65536, 1, 1]
    - [218, 0.444]
  - - [2304, 8192, 1, 768]
    - [218, 67.595]
  - - [4096, 64, 1, 1024]
    - [44, 12.601]
  - - [768, 64, 1, 1]
    - [93, 0.004]
  - - [768, 24576, 1, 3072]
    - [151, 83.706]
  - - [768, 3072, 1, 768]
    - [10, 43.434]
  - - [4096, 384, 1, 1024]
    - [17, 40.777]
  - - [2304, 16, 1, 768]
    - [19, 1.772]
  - - [2304, 3072, 1, 768]
    - [218, 65.359]
  - - [768, 1536, 1, 768]
    - [275, 38.228]
  - - [1024, 768, 1, 4096]
    - [9, 55.07]
  - - [2304, 32768, 1, 1]
    - [218, 0.4]
  - - [3072, 16384, 1, 1]
    - [218, 0.363]
  - - [3072, 64, 1, 1]
    - [51, 0.015]
  - - [768, 32768, 1, 3072]
    - [218, 88.849]
  - - [768, 1024, 1, 1]
    - [216, 0.052]
  - - [1024, 65536, 1, 4096]
    - [113, 90.705]
  - - [3072, 384, 1, 1]
    - [217, 0.068]
  - - [768, 512, 1, 768]
    - [277, 18.902]
  - - [768, 384, 1, 768]
    - [42, 11.652]
  - - [2304, 32768, 1, 768]
    - [218, 80.221]
  - - [768, 16384, 1, 768]
    - [218, 64.27]
  - - [1024, 8, 1, 1]
    - [51, 0.001]
  - - [3072, 256, 1, 1]
    - [216, 0.05]
  - - [768, 65536, 1, 768]
    - [218, 78.51]
  - - [2304, 16384, 1, 768]
    - [218, 75.572]
  - - [2304, 24576, 1, 768]
    - [218, 78.452]
  - - [768, 2048, 1, 1]
    - [217, 0.085]
  - - [768, 131072, 1, 768]
    - [218, 81.416]
  - - [2304, 98304, 1, 768]
    - [218, 82.997]
  - - [2304, 65536, 1, 768]
    - [218, 82.616]
  - - [1024, 384, 1, 4096]
    - [209, 37.569]
  - - [3072, 512, 1, 1]
    - [217, 0.082]
  - - [3072, 49152, 1, 1024]
    - [218, 83.508]
  - - [768, 12288, 1, 3072]
    - [10, 81.717]
  - - [768, 12288, 1, 768]
    - [297, 63.644]
  - - [1024, 32, 1, 4096]
    - [19, 3.979]
  - - [3072, 384, 1, 768]
    - [5, 30.744]
  - - [768, 49152, 1, 768]
    - [218, 75.154]
  - - [3072, 32768, 1, 1024]
    - [218, 83.219]
  - - [2304, 8192, 1, 1]
    - [218, 0.257]
  - - [3072, 256, 1, 1024]
    - [15, 29.553]
  - - [2304, 16384, 1, 1]
    - [218, 0.338]
  - - [3072, 768, 1, 768]
    - [10, 43.526]
  - - [1024, 1536, 1, 1024]
    - [29, 40.869]
  - - [768, 256, 1, 3072]
    - [210, 17.86]
  - - [2304, 64, 1, 768]
    - [51, 6.194]
  - - [768, 98304, 1, 3072]
    - [218, 90.54]
  - - [3072, 2048, 1, 1]
    - [218, 0.175]
  - - [4096, 768, 1, 1024]
    - [87, 49.714]
  - - [2304, 512, 1, 1]
    - [216, 0.068]
  - - [1024, 65536, 1, 1024]
    - [218, 81.445]
  - - [3072, 6144, 1, 1]
    - [218, 0.257]
  - - [4096, 65536, 1, 1024]
    - [78, 81.858]
  - - [768, 8192, 1, 768]
    - [218, 58.159]
  - - [3072, 12288, 1, 768]
    - [296, 75.87]
  - - [3072, 128, 1, 1]
    - [50, 0.027]
  - - [1024, 4, 1, 1]
    - [51, 0.0]
  - - [768, 6144, 1, 3072]
    - [126, 70.697]
  - - [2304, 49152, 1, 768]
    - [218, 80.767]
  - - [3072, 65536, 1, 1024]
    - [218, 84.303]
  - - [2304, 1024, 1, 1]
    - [40, 0.103]
  - - [2304, 65536, 1, 1]
    - [218, 0.434]
  - - [1024, 64, 1, 4096]
    - [19, 8.174]
  - - [3072, 384, 1, 1024]
    - [49, 36.291]
  - - [3072, 32, 1, 768]
    - [19, 4.362]
  - - [3072, 16, 1, 768]
    - [19, 2.337]
  - - [3072, 32768, 1, 1]
    - [218, 0.413]
  - - [4096, 32, 1, 1024]
    - [80, 6.407]
  - - [3072, 24576, 1, 1]
    - [218, 0.396]
  - - [3072, 49152, 1, 768]
    - [218, 83.168]
  - - [3072, 4096, 1, 1]
    - [218, 0.222]
  - - [3072, 24576, 1, 768]
    - [218, 80.827]
  - - [3072, 65536, 1, 768]
    - [218, 83.616]
  - - [768, 4096, 1, 3072]
    - [203, 68.951]
  - - [768, 65536, 1, 3072]
    - [218, 90.053]
  - - [1024, 16, 1, 4096]
    - [61, 2.022]
  - - [3072, 131072, 1, 768]
    - [218, 84.923]
  - - [64, 256, 1024, 256]
    - [194, 24.488]
  - - [512, 512, 12, 64]
    - [134, 8.401]
  - - [64, 384, 12, 384]
    - [51, 7.049]
  - - [64, 512, 512, 512]
    - [59, 33.452]
  - - [64, 128, 384, 128]
    - [134, 13.421]
  - - [64, 64, 512, 64]
    - [134, 6.632]
  - - [64, 16, 384, 16]
    - [134, 0.4]
  - - [64, 256, 64, 256]
    - [124, 12.049]
  - - [64, 256, 2048, 256]
    - [43, 25.381]
  - - [64, 64, 3072, 64]
    - [134, 13.054]
  - - [32, 32, 12, 64]
    - [51, 0.07]
  - - [64, 128, 96, 128]
    - [26, 6.301]
  - - [64, 128, 12, 128]
    - [139, 0.971]
  - - [64, 512, 1536, 512]
    - [59, 34.75]
  - - [64, 512, 2048, 512]
    - [185, 34.431]
  - - [64, 64, 2048, 64]
    - [134, 12.049]
  - - [64, 32, 128, 32]
    - [93, 0.661]
  - - [64, 32, 768, 32]
    - [134, 3.032]
  - - [384, 384, 12, 64]
    - [134, 6.105]
  - - [16, 16, 384, 64]
    - [50, 0.476]
  - - [64, 64, 128, 64]
    - [134, 2.378]
  - - [16, 16, 96, 64]
    - [93, 0.132]
  - - [64, 64, 192, 64]
    - [26, 3.416]
  - - [64, 16, 24, 16]
    - [93, 0.032]
  - - [64, 256, 1536, 256]
    - [104, 25.602]
  - - [256, 256, 96, 64]
    - [21, 11.341]
  - - [512, 512, 96, 64]
    - [138, 17.331]
  - - [64, 512, 1024, 512]
    - [59, 34.718]
  - - [64, 512, 768, 512]
    - [59, 34.084]
  - - [64, 16, 128, 16]
    - [51, 0.156]
  - - [64, 128, 64, 128]
    - [26, 4.421]
  - - [256, 256, 24, 64]
    - [134, 5.757]
  - - [512, 512, 384, 64]
    - [218, 22.947]
  - - [64, 64, 1024, 64]
    - [134, 9.601]
  - - [64, 64, 768, 64]
    - [134, 8.401]
  - - [16, 16, 24, 64]
    - [93, 0.036]
  - - [64, 512, 32, 512]
    - [26, 17.634]
  - - [128, 128, 24, 64]
    - [50, 1.817]
  - - [64, 32, 1536, 32]
    - [134, 4.686]
  - - [256, 256, 48, 64]
    - [134, 8.495]
  - - [64, 32, 96, 32]
    - [51, 0.51]
  - - [64, 512, 384, 512]
    - [185, 33.341]
  - - [16, 16, 192, 64]
    - [51, 0.253]
  - - [64, 32, 192, 32]
    - [50, 0.958]
  - - [64, 16, 768, 16]
    - [134, 0.685]
  - - [16, 16, 48, 64]
    - [139, 0.071]
  - - [64, 16, 3072, 16]
    - [134, 1.414]
  - - [64, 256, 768, 256]
    - [124, 24.857]
  - - [64, 32, 32, 32]
    - [110, 0.186]
  - - [64, 16, 96, 16]
    - [51, 0.117]
  - - [64, 128, 48, 128]
    - [26, 3.396]
  - - [64, 256, 96, 256]
    - [124, 16.26]
  - - [64, 64, 384, 64]
    - [134, 5.671]
  - - [64, 32, 256, 32]
    - [134, 1.252]
  - - [64, 64, 256, 64]
    - [145, 4.37]
  - - [64, 32, 64, 32]
    - [134, 0.35]
  - - [32, 32, 96, 64]
    - [51, 0.506]
  - - [64, 32, 24, 32]
    - [93, 0.148]
  - - [64, 16, 192, 16]
    - [93, 0.23]
  - - [32, 32, 24, 64]
    - [99, 0.14]
  - - [64, 128, 24, 128]
    - [51, 1.865]
  - - [64, 64, 32, 64]
    - [139, 0.67]
  - - [64, 64, 64, 64]
    - [51, 1.304]
  - - [64, 16, 48, 16]
    - [93, 0.063]
  - - [64, 32, 48, 32]
    - [134, 0.266]
  - - [16, 16, 12, 64]
    - [51, 0.018]
  - - [64, 512, 12, 512]
    - [279, 13.421]
  - - [64, 512, 24, 512]
    - [26, 17.86]
  - - [64, 32, 384, 32]
    - [134, 1.794]
  - - [64, 16, 512, 16]
    - [134, 0.522]
  - - [64, 128, 32, 128]
    - [51, 2.554]
  - - [256, 256, 12, 64]
    - [145, 3.278]
  - - [64, 256, 192, 256]
    - [114, 19.263]
  - - [64, 256, 512, 256]
    - [188, 23.197]
  - - [64, 512, 3072, 512]
    - [185, 34.6]
  - - [64, 32, 1024, 32]
    - [120, 3.618]
  - - [512, 512, 24, 64]
    - [38, 11.285]
  - - [64, 256, 3072, 256]
    - [124, 25.607]
  - - [128, 128, 96, 64]
    - [134, 5.614]
  - - [64, 32, 2048, 32]
    - [134, 5.559]
  - - [64, 16, 256, 16]
    - [93, 0.295]
  - - [64, 16, 64, 16]
    - [93, 0.086]
  - - [768, 384, 1, 3072]
    - [44, 25.71]
  - - [960, 16, 1, 5120]
    - [219, 2.348]
  - - [5120, 16, 1, 320]
    - [220, 1.981]
  - - [1280, 16, 1, 5120]
    - [221, 2.928]
  - - [5120, 16, 1, 1280]
    - [222, 4.369]
  - - [960, 1024, 1, 5120]
    - [223, 33.931]
  - - [5120, 1024, 1, 320]
    - [224, 39.993]
  - - [1280, 1024, 1, 5120]
    - [225, 42.873]
  - - [5120, 1024, 1, 1280]
    - [226, 52.997]
  - - [512, 2048, 1, 39488]
    - [184, 81.368]
  - - [1024, 2048, 1, 1414]
    - [228, 62.373]
  - - [4096, 2048, 1, 1414]
    - [16, 65.813]
  - - [1750, 1024, 1, 1414]
    - [233, 37.171]
  - - [1750, 1024, 1, 1750]
    - [233, 40.987]
  - - [96, 1024, 1, 1750]
    - [234, 7.286]
  - - [1450, 1024, 1, 1987]
    - [235, 42.342]
  - - [1450, 1024, 1, 1450]
    - [235, 38.078]
  - - [64, 379, 512, 160]
    - [237, 30.932]
  - - [512, 512, 1, 12128]
    - [238, 44.914]
  - - [512, 4096, 1, 4096]
    - [239, 72.833]
  - - [512, 77824, 1, 512]
    - [218, 76.39]
  - - [512, 35840, 1, 512]
    - [60, 66.251]
  - - [512, 101376, 1, 512]
    - [170, 78.116]
  - - [512, 44544, 1, 512]
    - [218, 70.379]
  - - [512, 4096, 1, 512]
    - [68, 27.527]
  - - [512, 4096, 1, 2048]
    - [228, 58.806]
  - - [31544, 3824, 1, 512]
    - [229, 80.623]
  - - [2048, 3824, 1, 512]
    - [138, 52.524]
  - - [512, 2048, 1, 2048]
    - [4, 38.809]
  - - [512, 47616, 1, 512]
    - [170, 71.303]
  - - [512, 66560, 1, 512]
    - [73, 73.578]
  - - [512, 752, 1, 2048]
    - [42, 20.191]
  - - [512, 35328, 1, 512]
    - [165, 67.336]
  - - [512, 52640, 1, 512]
    - [60, 71.199]
  - - [512, 1024, 1, 512]
    - [30, 9.176]
  - - [512, 32256, 1, 512]
    - [218, 67.665]
  - - [512, 74752, 1, 512]
    - [170, 74.442]
  - - [512, 106496, 1, 512]
    - [165, 76.829]
  - - [512, 240, 1, 2048]
    - [54, 7.008]
  - - [512, 37888, 1, 512]
    - [218, 68.671]
  - - [512, 3824, 1, 512]
    - [37, 25.582]
  - - [2048, 1024, 1, 512]
    - [190, 26.876]
  - - [512, 190464, 1, 512]
    - [218, 81.233]
  - - [512, 30720, 1, 512]
    - [170, 65.875]
  - - [512, 155648, 1, 512]
    - [218, 81.262]
  - - [512, 50688, 1, 512]
    - [170, 71.982]
  - - [512, 512, 1, 2048]
    - [209, 14.38]
  - - [512, 69632, 1, 512]
    - [218, 74.246]
  - - [512, 752, 1, 512]
    - [209, 7.052]
  - - [512, 1776, 1, 512]
    - [190, 14.517]
  - - [31544, 1024, 1, 512]
    - [192, 70.81]
  - - [512, 33280, 1, 512]
    - [60, 65.772]
  - - [512, 29696, 1, 512]
    - [60, 63.794]
  - - [512, 75776, 1, 512]
    - [218, 74.915]
  - - [512, 36864, 1, 512]
    - [170, 68.464]
  - - [512, 38912, 1, 512]
    - [218, 70.223]
  - - [31544, 1776, 1, 512]
    - [192, 76.104]
  - - [512, 1776, 1, 2048]
    - [49, 34.001]
  - - [512, 95232, 1, 512]
    - [170, 77.56]
  - - [2048, 752, 1, 512]
    - [37, 21.977]
  - - [512, 425984, 1, 512]
    - [218, 85.944]
  - - [512, 36352, 1, 512]
    - [60, 66.547]
  - - [31544, 752, 1, 512]
    - [172, 67.028]
  - - [512, 37376, 1, 512]
    - [218, 67.412]
  - - [31544, 512, 1, 512]
    - [203, 65.304]
  - - [512, 53248, 1, 512]
    - [165, 71.459]
  - - [512, 27136, 1, 512]
    - [165, 62.496]
  - - [2048, 240, 1, 512]
    - [186, 8.897]
  - - [2048, 4096, 1, 512]
    - [89, 57.009]
  - - [512, 178176, 1, 512]
    - [170, 80.66]
  - - [512, 34816, 1, 512]
    - [73, 64.914]
  - - [512, 32768, 1, 512]
    - [218, 66.992]
  - - [512, 89088, 1, 512]
    - [170, 76.964]
  - - [2048, 512, 1, 512]
    - [206, 16.793]
  - - [512, 240, 1, 512]
    - [39, 2.455]
  - - [31544, 2048, 1, 512]
    - [218, 75.71]
  - - [512, 10560, 1, 512]
    - [37, 44.655]
  - - [512, 378576, 1, 512]
    - [218, 84.556]
  - - [512, 1024, 1, 2048]
    - [186, 23.896]
  - - [31544, 240, 1, 512]
    - [133, 47.626]
  - - [512, 212992, 1, 512]
    - [218, 82.754]
  - - [512, 31232, 1, 512]
    - [218, 65.319]
  - - [31544, 4096, 1, 512]
    - [62, 81.39]
  - - [512, 2048, 1, 512]
    - [37, 17.192]
  - - [2048, 2048, 1, 512]
    - [96, 44.142]
  - - [2048, 1776, 1, 512]
    - [22, 36.656]
  - - [512, 380928, 1, 512]
    - [218, 84.665]
  - - [512, 3824, 1, 2048]
    - [228, 52.807]
  - - [512, 202752, 1, 512]
    - [218, 82.637]
  - - [512, 131424, 1, 512]
    - [170, 79.211]
  - - [512, 61440, 1, 512]
    - [170, 74.223]
  - - [93, 93, 2048, 64]
    - [165, 12.049]
  - - [64, 93, 2048, 93]
    - [150, 13.902]
  - - [64, 63, 1024, 63]
    - [69, 6.384]
  - - [87, 87, 1024, 64]
    - [165, 8.603]
  - - [64, 87, 2048, 87]
    - [120, 12.323]
  - - [58, 58, 1024, 64]
    - [162, 5.187]
  - - [93, 93, 1024, 64]
    - [170, 9.645]
  - - [64, 87, 1024, 87]
    - [134, 9.574]
  - - [65, 65, 1024, 64]
    - [165, 5.121]
  - - [87, 87, 2048, 64]
    - [170, 11.125]
  - - [72, 72, 1024, 64]
    - [73, 9.22]
  - - [76, 76, 2048, 64]
    - [170, 9.275]
  - - [73, 73, 1024, 64]
    - [165, 6.515]
  - - [64, 71, 1024, 71]
    - [134, 7.104]
  - - [64, 74, 1024, 74]
    - [120, 7.978]
  - - [68, 68, 1024, 64]
    - [165, 6.01]
  - - [99, 99, 1024, 64]
    - [195, 9.52]
  - - [65, 65, 2048, 64]
    - [165, 6.874]
  - - [73, 73, 2048, 64]
    - [170, 8.441]
  - - [64, 99, 7648, 99]
    - [134, 15.646]
  - - [76, 76, 1024, 64]
    - [165, 7.069]
  - - [64, 87, 4096, 87]
    - [120, 14.406]
  - - [64, 61, 1024, 61]
    - [120, 6.314]
  - - [99, 99, 4096, 64]
    - [212, 12.691]
  - - [71, 71, 1024, 64]
    - [170, 6.245]
  - - [70, 70, 1504, 64]
    - [165, 7.355]
  - - [64, 76, 2048, 76]
    - [134, 10.891]
  - - [64, 58, 1024, 58]
    - [134, 5.508]
  - - [64, 65, 2048, 65]
    - [134, 7.768]
  - - [74, 74, 2048, 64]
    - [170, 8.893]
  - - [64, 65, 1024, 65]
    - [134, 6.051]
  - - [69, 69, 1024, 64]
    - [170, 6.06]
  - - [68, 68, 2048, 64]
    - [195, 6.417]
  - - [64, 99, 4096, 99]
    - [134, 14.765]
  - - [64, 99, 2048, 99]
    - [105, 13.029]
  - - [93, 93, 4096, 64]
    - [165, 14.314]
  - - [44, 44, 480, 64]
    - [215, 1.932]
  - - [64, 99, 1024, 99]
    - [114, 11.227]
  - - [60, 60, 1024, 64]
    - [162, 5.658]
  - - [104, 104, 1024, 64]
    - [35, 15.607]
  - - [64, 74, 3552, 74]
    - [134, 11.856]
  - - [64, 104, 8192, 104]
    - [134, 17.679]
  - - [64, 104, 1024, 104]
    - [134, 12.232]
  - - [64, 93, 8192, 93]
    - [120, 16.922]
  - - [70, 70, 1024, 64]
    - [195, 5.379]
  - - [64, 68, 1024, 68]
    - [150, 6.812]
  - - [64, 72, 1024, 72]
    - [150, 7.414]
  - - [93, 93, 8192, 64]
    - [170, 15.3]
  - - [64, 44, 480, 44]
    - [120, 1.912]
  - - [64, 70, 1504, 70]
    - [134, 8.291]
  - - [64, 53, 1024, 53]
    - [150, 4.572]
  - - [104, 104, 8192, 64]
    - [172, 26.634]
  - - [104, 104, 4096, 64]
    - [103, 24.032]
  - - [64, 76, 4096, 76]
    - [120, 12.695]
  - - [64, 76, 1024, 76]
    - [134, 8.35]
  - - [64, 60, 1024, 60]
    - [120, 5.979]
  - - [99, 99, 7648, 64]
    - [212, 13.483]
  - - [99, 99, 2048, 64]
    - [169, 11.362]
  - - [64, 93, 1024, 93]
    - [120, 11.016]
  - - [64, 69, 1024, 69]
    - [134, 6.805]
  - - [64, 73, 2048, 73]
    - [134, 9.878]
  - - [63, 63, 1024, 64]
    - [162, 5.98]
  - - [64, 60, 2048, 60]
    - [120, 8.657]
  - - [64, 68, 2048, 68]
    - [134, 8.873]
  - - [104, 104, 2048, 64]
    - [125, 20.194]
  - - [64, 74, 2048, 74]
    - [134, 10.428]
  - - [64, 70, 1024, 70]
    - [134, 7.151]
  - - [60, 60, 2048, 64]
    - [162, 8.313]
  - - [87, 87, 4096, 64]
    - [165, 12.88]
  - - [64, 104, 4096, 104]
    - [134, 16.655]
  - - [74, 74, 3552, 64]
    - [165, 10.019]
  - - [64, 93, 4096, 93]
    - [134, 15.794]
  - - [53, 53, 1024, 64]
    - [162, 4.099]
  - - [64, 73, 1024, 73]
    - [134, 7.547]
  - - [76, 76, 4096, 64]
    - [170, 10.817]
  - - [74, 74, 1024, 64]
    - [212, 5.997]
  - - [64, 104, 2048, 104]
    - [134, 14.829]
  - - [61, 61, 1024, 64]
    - [213, 5.042]
  - - [1456, 2048, 1, 128]
    - [114, 11.881]
  - - [256, 2048, 1, 256]
    - [44, 5.449]
  - - [23744, 2048, 1, 256]
    - [229, 64.313]
  - - [2048, 2048, 1, 3840]
    - [13, 82.691]
  - - [3840, 2048, 1, 128]
    - [133, 25.055]
  - - [2048, 2048, 1, 1456]
    - [13, 63.898]
  - - [128, 2048, 1, 1456]
    - [39, 10.3]
  - - [128, 2048, 1, 3840]
    - [44, 20.818]
  - - [2048, 2048, 1, 1024]
    - [13, 59.877]
  - - [128, 2048, 1, 64]
    - [51, 0.738]
  - - [256, 2048, 1, 1456]
    - [39, 18.667]
  - - [1024, 2048, 1, 2048]
    - [68, 59.62]
  - - [32, 742, 2048, 128]
    - [213, 17.427]
  - - [256, 1024, 1, 15040]
    - [177, 43.489]
  - - [15040, 1024, 1, 256]
    - [60, 49.093]
  - - [1, 1024, 1024, 8]
    - [0, 0.051]
  - - [7, 128, 1024, 8]
    - [216, 0.201]
  - - [128, 1024, 1, 953]
    - [214, 4.056]
  - - [96, 1988, 1, 192]
    - [80, 1.582]
  - - [96, 70938, 1, 192]
    - [25, 26.112]
  - - [8192, 4096, 1, 3200]
    - [113, 93.684]
  - - [96, 70298, 1, 192]
    - [25, 26.212]
  - - [96, 2298, 1, 192]
    - [8, 1.823]
  - - [96, 1024, 1, 192]
    - [55, 0.828]
  - - [96, 235520, 1, 192]
    - [5, 39.5]
  - - [96, 10240, 1, 192]
    - [65, 7.193]
  - - [96, 122880, 1, 192]
    - [21, 32.842]
  - - [96, 20480, 1, 192]
    - [5, 12.257]
  - - [96, 512000, 1, 192]
    - [5, 44.863]
  - - [96, 2256, 1, 192]
    - [51, 1.756]
  - - [96, 61440, 1, 192]
    - [21, 24.628]
  - - [32, 1234, 2048, 160]
    - [213, 21.446]
  - - [1024, 2048, 1, 5120]
    - [85, 78.278]
  - - [160, 2048, 1, 64]
    - [54, 0.936]
  - - [1414, 2048, 1, 512]
    - [193, 31.014]
  - - [4096, 2048, 1, 4096]
    - [31, 87.182]
  - - [32, 4, 2048, 160]
    - [200, 1.169]
  - - [512, 2048, 1, 328]
    - [76, 11.069]
  - - [768, 2048, 1, 120]
    - [237, 6.3]
  - - [384, 2048, 1, 480]
    - [237, 12.616]
  - - [512, 2048, 1, 23744]
    - [223, 77.081]
  - - [256, 2048, 1, 5552]
    - [9, 35.961]
  - - [1, 2048, 1, 2561]
    - [231, 0.135]
  - - [384, 2048, 1, 3200]
    - [15, 43.883]
  - - [384, 2048, 1, 2048]
    - [57, 36.063]
  - - [512, 2048, 1, 4096]
    - [4, 50.79]
  - - [4096, 2048, 1, 256]
    - [224, 35.028]
  - - [768, 2048, 1, 704]
    - [64, 27.637]
  - - [128, 1024, 1, 128]
    - [51, 0.756]
  - - [1080, 1024, 1, 1024]
    - [4, 28.75]
  - - [8200, 1024, 1, 15296]
    - [33, 91.565]
  - - [256, 1024, 1, 384]
    - [8, 4.179]
  - - [384, 1024, 1, 946]
    - [160, 11.202]
  - - [7, 1024, 1, 128]
    - [208, 0.041]
  - - [160, 2048, 1, 2048]
    - [42, 18.458]
  - - [8192, 2048, 1, 3200]
    - [18, 88.931]
  - - [288, 2048, 1, 768]
    - [9, 14.382]
  - - [5120, 2048, 1, 512]
    - [16, 52.431]
  - - [512, 2048, 1, 6534]
    - [227, 57.676]
  - - [1536, 25216, 1, 384]
    - [218, 66.126]
  - - [1536, 69344, 1, 384]
    - [218, 72.946]
  - - [1536, 91408, 1, 384]
    - [218, 73.716]
  - - [192, 100352, 1, 192]
    - [237, 35.592]
  - - [192, 100352, 1, 768]
    - [91, 54.163]
  - - [192, 275968, 1, 192]
    - [237, 40.343]
  - - [192, 275968, 1, 768]
    - [101, 57.516]
  - - [192, 363776, 1, 192]
    - [237, 41.28]
  - - [192, 363776, 1, 768]
    - [95, 58.977]
  - - [196, 384, 1, 1728]
    - [196, 5.593]
  - - [256, 1103872, 1, 64]
    - [224, 27.924]
  - - [256, 1455104, 1, 64]
    - [224, 28.163]
  - - [256, 401408, 1, 64]
    - [224, 25.427]
  - - [3136, 64, 1, 147]
    - [93, 1.826]
  - - [384, 128, 1, 1000]
    - [116, 2.346]
  - - [384, 17600, 1, 384]
    - [14, 42.622]
  - - [384, 23200, 1, 384]
    - [14, 46.213]
  - - [384, 25216, 1, 1536]
    - [27, 69.155]
  - - [384, 25216, 1, 384]
    - [60, 44.003]
  - - [384, 352, 1, 1000]
    - [50, 5.949]
  - - [384, 464, 1, 1000]
    - [8, 7.811]
  - - [384, 6400, 1, 384]
    - [22, 28.428]
  - - [384, 69344, 1, 1536]
    - [14, 75.952]
  - - [384, 69344, 1, 384]
    - [60, 53.259]
  - - [384, 91408, 1, 1536]
    - [18, 78.855]
  - - [384, 91408, 1, 384]
    - [60, 54.821]
  - - [64, 1103872, 1, 256]
    - [124, 27.655]
  - - [64, 1103872, 1, 64]
    - [150, 19.208]
  - - [64, 1455104, 1, 256]
    - [92, 27.497]
  - - [64, 1455104, 1, 64]
    - [150, 19.526]
  - - [64, 401408, 1, 256]
    - [237, 27.351]
  - - [64, 401408, 1, 64]
    - [150, 17.658]
  - - [768, 100352, 1, 192]
    - [218, 54.393]
  - - [768, 275968, 1, 192]
    - [218, 59.397]
  - - [768, 363776, 1, 192]
    - [218, 60.743]
  - - [784, 192, 1, 576]
    - [8, 4.909]
  - - [192, 192, 128, 196]
    - [63, 18.842]
  - - [192, 192, 352, 196]
    - [73, 24.553]
  - - [192, 192, 464, 196]
    - [63, 25.8]
  - - [192, 192, 128, 784]
    - [60, 37.413]
  - - [192, 192, 352, 784]
    - [73, 44.083]
  - - [192, 192, 464, 784]
    - [229, 45.797]
  - - [192, 196, 128, 192]
    - [194, 19.549]
  - - [192, 196, 352, 192]
    - [194, 24.938]
  - - [192, 196, 464, 192]
    - [73, 25.87]
  - - [192, 784, 128, 192]
    - [237, 31.791]
  - - [192, 784, 352, 192]
    - [237, 35.907]
  - - [192, 784, 464, 192]
    - [237, 36.301]
  - - [196, 1, 192, 9]
    - [162, 0.016]
  - - [196, 1, 384, 9]
    - [162, 0.023]
  - - [196, 784, 1056, 64]
    - [237, 13.08]
  - - [196, 784, 1392, 64]
    - [237, 13.127]
  - - [196, 784, 384, 64]
    - [237, 12.547]
  - - [3136, 1, 64, 9]
    - [150, 0.052]
  - - [49, 1, 384, 9]
    - [161, 0.009]
  - - [50, 197, 2112, 64]
    - [217, 7.991]
  - - [50, 197, 2784, 64]
    - [217, 8.252]
  - - [50, 197, 768, 64]
    - [217, 6.87]
  - - [64, 197, 2112, 50]
    - [120, 9.214]
  - - [64, 197, 2784, 50]
    - [134, 9.443]
  - - [64, 197, 768, 50]
    - [150, 7.882]
  - - [64, 3136, 128, 64]
    - [134, 16.979]
  - - [64, 3136, 352, 64]
    - [150, 18.544]
  - - [64, 3136, 464, 64]
    - [150, 18.746]
  - - [64, 3136, 128, 784]
    - [43, 35.164]
  - - [64, 3136, 352, 784]
    - [124, 35.723]
  - - [64, 3136, 464, 784]
    - [124, 35.723]
  - - [64, 64, 128, 3136]
    - [39, 23.779]
  - - [64, 64, 352, 3136]
    - [42, 27.402]
  - - [64, 64, 464, 3136]
    - [84, 28.635]
  - - [64, 64, 128, 784]
    - [39, 13.462]
  - - [64, 64, 352, 784]
    - [137, 18.783]
  - - [64, 64, 464, 784]
    - [77, 18.968]
  - - [64, 784, 1056, 196]
    - [237, 21.611]
  - - [64, 784, 1392, 196]
    - [237, 21.695]
  - - [64, 784, 384, 196]
    - [237, 20.445]
  - - [64, 784, 128, 64]
    - [150, 12.187]
  - - [64, 784, 352, 64]
    - [150, 16.12]
  - - [64, 784, 464, 64]
    - [150, 16.905]
  - - [784, 1, 192, 9]
    - [134, 0.045]
  - - [784, 1, 64, 9]
    - [150, 0.025]
  - - [1536, 50432, 1, 384]
    - [218, 72.806]
  - - [192, 200704, 1, 192]
    - [237, 39.393]
  - - [192, 200704, 1, 768]
    - [91, 56.322]
  - - [256, 802816, 1, 64]
    - [224, 27.407]
  - - [384, 12800, 1, 384]
    - [60, 37.57]
  - - [384, 256, 1, 1000]
    - [116, 4.693]
  - - [384, 50432, 1, 1536]
    - [14, 73.46]
  - - [384, 50432, 1, 384]
    - [14, 50.9]
  - - [64, 802816, 1, 256]
    - [237, 27.422]
  - - [64, 802816, 1, 64]
    - [120, 18.796]
  - - [768, 200704, 1, 192]
    - [218, 58.599]
  - - [192, 192, 256, 196]
    - [60, 22.976]
  - - [192, 192, 256, 784]
    - [240, 42.55]
  - - [192, 196, 256, 192]
    - [114, 23.789]
  - - [192, 784, 256, 192]
    - [237, 35.186]
  - - [196, 784, 768, 64]
    - [237, 12.95]
  - - [50, 197, 1536, 64]
    - [217, 7.748]
  - - [64, 197, 1536, 50]
    - [134, 8.876]
  - - [64, 3136, 256, 64]
    - [134, 18.169]
  - - [64, 3136, 256, 784]
    - [104, 35.349]
  - - [64, 64, 256, 3136]
    - [82, 27.061]
  - - [64, 64, 256, 784]
    - [137, 17.984]
  - - [64, 784, 768, 196]
    - [237, 21.499]
  - - [64, 784, 256, 64]
    - [150, 15.134]
  - - [144, 2048, 1, 9216]
    - [241, 32.442]
  - - [256, 589824, 1, 256]
    - [242, 58.931]
  - - [256, 589824, 1, 768]
    - [242, 77.447]
  - - [256, 589824, 1, 1024]
    - [242, 83.693]
  - - [576, 1024, 1, 4608]
    - [243, 40.324]
  - - [768, 192, 1, 30522]
    - [244, 42.472]
  - - [768, 9408, 1, 768]
    - [245, 52.829]
  - - [768, 9408, 1, 3072]
    - [246, 76.775]
  - - [1024, 36864, 1, 3072]
    - [247, 85.155]
  - - [1024, 36864, 1, 4096]
    - [248, 88.265]
  - - [1024, 589824, 1, 256]
    - [242, 65.542]
  - - [2048, 9216, 1, 6144]
    - [249, 86.955]
  - - [2048, 9216, 1, 8192]
    - [249, 88.757]
  - - [2304, 512, 1, 2304]
    - [250, 42.549]
  - - [1024, 1695, 1, 30528]
    - [251, 80.562]
  - - [4096, 28672, 1, 1024]
    - [252, 82.329]
  - - [1024, 28672, 1, 4096]
    - [253, 81.605]
  - - [1024, 28672, 1, 1024]
    - [252, 73.924]
  - - [1024, 28672, 1, 3072]
    - [254, 80.424]
  - - [1024, 12672, 1, 3072]
    - [255, 77.66]
  - - [1024, 14416, 1, 1024]
    - [256, 65.603]
  - - [1024, 11136, 1, 4096]
    - [257, 72.523]
  - - [1024, 12672, 1, 4096]
    - [258, 78.843]
  - - [1024, 12576, 1, 4096]
    - [259, 77.128]
  - - [1024, 12032, 1, 3072]
    - [260, 76.365]
  - - [1104, 1, 1, 4608]
    - [261, 0.484]
  - - [1104, 16, 1, 4608]
    - [261, 6.565]
  - - [16, 1, 1, 4608]
    - [262, 0.01]
  - - [16, 16, 1, 4608]
    - [262, 0.154]
  - - [16, 1335, 1, 4608]
    - [263, 6.658]
  - - [768, 1, 1, 4608]
    - [264, 0.397]
  - - [768, 16, 1, 4608]
    - [264, 5.655]
  - - [1, 1104, 1, 4608]
    - [265, 0.406]
  - - [1, 4608, 1, 320]
    - [266, 0.232]
  - - [1, 16, 1, 4608]
    - [267, 0.01]
  - - [1, 768, 1, 4608]
    - [268, 0.339]
  - - [1, 4608, 1, 768]
    - [269, 0.31]
  - - [3072, 3560, 1, 768]
    - [270, 65.988]
  - - [768, 128, 1, 3129]
    - [282, 10.501]
  - - [768, 128, 1, 768]
    - [283, 5.523]
  - - [768, 20, 1, 768]
    - [281, 0.874]
  - - [768, 3560, 1, 768]
    - [285, 44.301]
  - - [768, 83, 1, 3129]
    - [283, 6.893]
  - - [178, 178, 1944, 64]
    - [271, 16.861]
  - - [64, 178, 3072, 178]
    - [286, 19.615]
  - - [3072, 1536, 1, 768]
    - [272, 59.777]
  - - [768, 1536, 1, 3072]
    - [274, 64.806]
  - - [768, 512, 1, 3072]
    - [276, 38.336]
  - - [768, 768, 1, 512]
    - [287, 18.491]
  - - [512, 512, 288, 64]
    - [288, 29.111]
  - - [512, 512, 36, 64]
    - [278, 19.008]
  - - [64, 512, 288, 512]
    - [289, 36.316]
  - - [64, 512, 36, 512]
    - [290, 23.303]
  - - [768, 20, 1, 3129]
    - [280, 1.836]
  - - [768, 3560, 1, 3072]
    - [284, 63.211]
  - - [768, 83, 1, 768]
    - [283, 3.536]
  - - [3072, 14774, 1, 768]
    - [295, 75.345]
  - - [3072, 22784, 1, 768]
    - [298, 78.376]
  - - [768, 14774, 1, 3072]
    - [293, 72.494]
  - - [768, 14774, 1, 768]
    - [299, 63.014]
  - - [768, 22784, 1, 3072]
    - [291, 80.235]
  - - [768, 22784, 1, 768]
    - [294, 71.891]
  - - [768, 1536, 1, 30522]
    - [292, 71.555]
  - - [768, 512, 1, 30522]
    - [300, 60.042]
  - - [768, 12288, 1, 30522]
    - [292, 81.083]
  - - [128, 512, 128, 512]
    - [301, 35.447]
- null
