library/src/blas3/Tensile/Logic/gfx900-rocm-1.6/Fiji_Cijk_Ailk_Bljk_SB.yaml
- {MinimumRequiredVersion: 3.0.6}
- Fiji
- [R9 Nano]
- AssignedDerivedParameters: true
- - - [4096, 7000, 1, 4096]
    - [57, 6565.45]
  - - [7680, 64, 1, 2560]
    - [12, 4839.46]
  - - [7680, 128, 1, 2560]
    - [6, 5401.97]
  - - [2048, 7000, 1, 2048]
    - [52, 6395.02]
  - - [3072, 32, 1, 1024]
    - [2, 2216.83]
  - - [5124, 9124, 1, 4096]
    - [57, 6369.65]
  - - [5124, 9124, 1, 1760]
    - [57, 6714.16]
  - - [4096, 32, 1, 4096]
    - [25, 3544.04]
  - - [1760, 64, 1, 1760]
    - [8, 3191.72]
  - - [4096, 128, 1, 4096]
    - [6, 5407.63]
  - - [2560, 16, 1, 2560]
    - [28, 1704.45]
  - - [3072, 16, 1, 1024]
    - [28, 1392.34]
  - - [2560, 64, 1, 2560]
    - [6, 4072.03]
  - - [2560, 7000, 1, 2560]
    - [57, 6503.79]
  - - [1760, 32, 1, 1760]
    - [9, 2191.86]
  - - [2048, 64, 1, 2048]
    - [25, 3285.38]
  - - [1760, 128, 1, 1760]
    - [8, 4058.0]
  - - [2560, 128, 1, 2560]
    - [8, 4621.23]
  - - [35, 8457, 1, 1760]
    - [12, 2246.14]
  - - [4096, 16, 1, 4096]
    - [22, 2003.2]
  - - [35, 8457, 1, 2048]
    - [21, 2103.17]
  - - [3072, 128, 1, 1024]
    - [12, 3449.03]
  - - [1760, 7000, 1, 1760]
    - [52, 6849.61]
  - - [1760, 16, 1, 1760]
    - [21, 1365.44]
  - - [2560, 32, 1, 2560]
    - [2, 2949.05]
  - - [2048, 32, 1, 2048]
    - [36, 2409.44]
  - - [35, 8457, 1, 2560]
    - [21, 2262.12]
  - - [5124, 9124, 1, 2560]
    - [57, 6508.16]
  - - [3072, 64, 1, 1024]
    - [49, 2939.79]
  - - [5124, 9124, 1, 2048]
    - [57, 6340.48]
  - - [2048, 16, 1, 2048]
    - [21, 1485.15]
  - - [7680, 16, 1, 2560]
    - [59, 2246.88]
  - - [2048, 128, 1, 2048]
    - [8, 4072.81]
  - - [4096, 64, 1, 4096]
    - [11, 4725.39]
  - - [35, 8457, 1, 4096]
    - [21, 2308.61]
  - - [7680, 32, 1, 2560]
    - [25, 3379.72]
- - - -1
    - - - -1
        - - - 32
            - - [32, 2]
              - [224, 8]
              - [352, 12]
              - [512, 3]
              - [704, 1]
              - [1792, 0]
              - [-1, 16]
          - - 64
            - - [64, 37]
              - [224, 24]
              - [352, 29]
              - [704, 2]
              - [928, 9]
              - [1184, 20]
              - [1792, 8]
              - [2144, 11]
              - [2528, 33]
              - [2944, 5]
              - [3392, 4]
              - [-1, 3]
          - - 128
            - - [32, 37]
              - [128, 24]
              - [352, 2]
              - [512, 9]
              - [928, 8]
              - [1184, 12]
              - [1792, 8]
              - [2144, 19]
              - [2528, 1]
              - [2944, 3]
              - [3392, 6]
              - [-1, 0]
          - - 224
            - - [64, 24]
              - [128, 2]
              - [224, 13]
              - [352, 20]
              - [512, 8]
              - [704, 33]
              - [928, 17]
              - [1184, 12]
              - [1472, 33]
              - [1792, 26]
              - [2144, 8]
              - [2528, 3]
              - [3392, 8]
              - [-1, 11]
          - - 352
            - - [32, 24]
              - [64, 29]
              - [128, 2]
              - [224, 20]
              - [352, 11]
              - [512, 8]
              - [704, 15]
              - [928, 33]
              - [1184, 12]
              - [1472, 14]
              - [2144, 8]
              - [2528, 6]
              - [2944, 11]
              - [3392, 0]
              - [-1, 3]
          - - 512
            - - [32, 24]
              - [64, 2]
              - [128, 9]
              - [352, 8]
              - [512, 3]
              - [928, 12]
              - [1472, 8]
              - [1792, 3]
              - [2144, 6]
              - [2528, 0]
              - [2944, 45]
              - [3392, 16]
              - [-1, 3]
          - - 704
            - - [32, 29]
              - [64, 2]
              - [128, 8]
              - [224, 20]
              - [352, 19]
              - [512, 8]
              - [928, 12]
              - [1184, 11]
              - [1472, 3]
              - [1792, 6]
              - [2144, 3]
              - [2528, 16]
              - [2944, 0]
              - [3392, 3]
              - [-1, 16]
          - - 928
            - - [32, 2]
              - [64, 9]
              - [128, 8]
              - [224, 3]
              - [352, 11]
              - [512, 8]
              - [704, 12]
              - [928, 11]
              - [1472, 3]
              - [1792, 16]
              - [2528, 0]
              - [2944, 16]
              - [-1, 0]
          - - 1184
            - - [32, 13]
              - [64, 20]
              - [512, 12]
              - [704, 1]
              - [1184, 3]
              - [1792, 0]
              - [2144, 1]
              - [2528, 45]
              - [2944, 0]
              - [3392, 16]
              - [-1, 0]
          - - 1472
            - - [32, 2]
              - [128, 8]
              - [224, 3]
              - [352, 12]
              - [704, 3]
              - [1472, 0]
              - [1792, 1]
              - [2144, 0]
              - [-1, 16]
          - - 1792
            - - [32, 9]
              - [128, 8]
              - [224, 3]
              - [352, 11]
              - [512, 3]
              - [704, 0]
              - [928, 16]
              - [1184, 0]
              - [1472, 1]
              - [1792, 0]
              - [2944, 16]
              - [-1, 18]
          - - 2144
            - - [32, 17]
              - [64, 11]
              - [128, 19]
              - [224, 11]
              - [352, 8]
              - [512, 3]
              - [704, 0]
              - [928, 16]
              - [1184, 1]
              - [1472, 0]
              - [1792, 18]
              - [2144, 0]
              - [2528, 45]
              - [-1, 16]
          - - 2528
            - - [32, 2]
              - [64, 6]
              - [128, 8]
              - [224, 3]
              - [352, 8]
              - [512, 16]
              - [928, 0]
              - [1184, 16]
              - [1792, 0]
              - [3392, 16]
              - [-1, 18]
          - - 2944
            - - [32, 2]
              - [64, 8]
              - [128, 3]
              - [224, 8]
              - [352, 1]
              - [512, 3]
              - [704, 16]
              - [1184, 0]
              - [2528, 16]
              - [3392, 18]
              - [-1, 16]
          - - 3392
            - - [32, 2]
              - [64, 11]
              - [224, 6]
              - [352, 16]
              - [704, 1]
              - [1184, 0]
              - [1472, 16]
              - [1792, 18]
              - [2144, 16]
              - [2944, 18]
              - [-1, 16]
          - - -1
            - - [32, 25]
              - [128, 3]
              - [224, 10]
              - [352, 45]
              - [512, 18]
              - [704, 0]
              - [1472, 16]
              - [1792, 18]
              - [2144, 16]
              - [2528, 18]
              - [-1, 16]
