library/src/blas3/Tensile/Logic/gfx900-rocm-1.6/Fiji_Cijk_Alik_Bljk_SB.yaml
- {MinimumRequiredVersion: 3.0.6}
- Fiji
- [R9 Nano]
- AssignedDerivedParameters: true
- - - [4096, 7000, 1, 4096]
    - [78, 5428.18]
  - - [7680, 64, 1, 2560]
    - [72, 3584.03]
  - - [7680, 128, 1, 2560]
    - [5, 4454.02]
  - - [2048, 7000, 1, 2048]
    - [78, 4897.05]
  - - [3072, 32, 1, 1024]
    - [23, 1673.54]
  - - [5124, 9124, 1, 4096]
    - [78, 5424.5]
  - - [5124, 9124, 1, 1760]
    - [78, 6495.91]
  - - [4096, 32, 1, 4096]
    - [23, 2868.62]
  - - [1760, 64, 1, 1760]
    - [59, 2784.87]
  - - [4096, 128, 1, 4096]
    - [27, 3783.65]
  - - [2560, 16, 1, 2560]
    - [42, 1524.55]
  - - [3072, 16, 1, 1024]
    - [42, 973.439]
  - - [2560, 64, 1, 2560]
    - [56, 2966.03]
  - - [2560, 7000, 1, 2560]
    - [78, 6015.11]
  - - [1760, 32, 1, 1760]
    - [32, 1982.4]
  - - [2048, 64, 1, 2048]
    - [4, 2470.2]
  - - [1760, 128, 1, 1760]
    - [50, 3942.91]
  - - [2560, 128, 1, 2560]
    - [34, 3747.91]
  - - [35, 8457, 1, 1760]
    - [46, 2267.13]
  - - [4096, 16, 1, 4096]
    - [42, 1699.32]
  - - [35, 8457, 1, 2048]
    - [59, 1935.3]
  - - [3072, 128, 1, 1024]
    - [24, 2726.02]
  - - [1760, 7000, 1, 1760]
    - [78, 6186.64]
  - - [1760, 16, 1, 1760]
    - [42, 1343.51]
  - - [2560, 32, 1, 2560]
    - [56, 2484.5]
  - - [2048, 32, 1, 2048]
    - [56, 2014.34]
  - - [35, 8457, 1, 2560]
    - [59, 2152.86]
  - - [5124, 9124, 1, 2560]
    - [78, 5966.76]
  - - [3072, 64, 1, 1024]
    - [17, 2258.28]
  - - [5124, 9124, 1, 2048]
    - [78, 5410.99]
  - - [2048, 16, 1, 2048]
    - [42, 1121.92]
  - - [7680, 16, 1, 2560]
    - [0, 1886.55]
  - - [2048, 128, 1, 2048]
    - [24, 3157.29]
  - - [4096, 64, 1, 4096]
    - [17, 3222.93]
  - - [35, 8457, 1, 4096]
    - [72, 2146.76]
  - - [7680, 32, 1, 2560]
    - [17, 2996.91]
- - - -1
    - - - -1
        - - - 32
            - - [32, 56]
              - [64, 61]
              - [224, 34]
              - [352, 36]
              - [512, 50]
              - [704, 36]
              - [928, 46]
              - [2144, 64]
              - [3392, 55]
              - [-1, 16]
          - - 64
            - - [32, 1]
              - [224, 42]
              - [352, 0]
              - [512, 56]
              - [704, 23]
              - [928, 61]
              - [1184, 7]
              - [1472, 61]
              - [1792, 59]
              - [2144, 15]
              - [2944, 34]
              - [3392, 15]
              - [-1, 50]
          - - 128
            - - [128, 42]
              - [224, 56]
              - [352, 23]
              - [704, 61]
              - [1472, 34]
              - [1792, 50]
              - [2144, 36]
              - [2528, 53]
              - [2944, 46]
              - [3392, 15]
              - [-1, 6]
          - - 224
            - - [64, 42]
              - [224, 56]
              - [352, 61]
              - [704, 34]
              - [928, 50]
              - [1184, 53]
              - [1472, 46]
              - [1792, 64]
              - [2144, 34]
              - [2528, 21]
              - [2944, 55]
              - [3392, 46]
              - [-1, 6]
          - - 352
            - - [32, 42]
              - [64, 0]
              - [128, 23]
              - [224, 61]
              - [352, 15]
              - [512, 34]
              - [704, 36]
              - [928, 46]
              - [1184, 6]
              - [1472, 34]
              - [1792, 21]
              - [2144, 36]
              - [2528, 64]
              - [2944, 50]
              - [3392, 3]
              - [-1, 55]
          - - 512
            - - [32, 42]
              - [64, 56]
              - [128, 61]
              - [224, 59]
              - [352, 34]
              - [512, 50]
              - [704, 46]
              - [928, 64]
              - [1184, 21]
              - [1472, 55]
              - [2144, 36]
              - [2944, 64]
              - [3392, 36]
              - [-1, 16]
          - - 704
            - - [32, 0]
              - [64, 23]
              - [128, 61]
              - [224, 34]
              - [352, 36]
              - [704, 15]
              - [928, 36]
              - [1184, 46]
              - [1472, 3]
              - [1792, 55]
              - [2144, 44]
              - [2944, 55]
              - [-1, 64]
          - - 928
            - - [32, 56]
              - [64, 61]
              - [128, 34]
              - [224, 50]
              - [352, 46]
              - [512, 6]
              - [704, 46]
              - [928, 6]
              - [1184, 36]
              - [1472, 44]
              - [1792, 64]
              - [2144, 55]
              - [2944, 3]
              - [3392, 64]
              - [-1, 16]
          - - 1184
            - - [32, 17]
              - [64, 59]
              - [128, 34]
              - [224, 36]
              - [352, 6]
              - [512, 46]
              - [928, 36]
              - [1184, 55]
              - [1472, 64]
              - [1792, 36]
              - [2144, 21]
              - [2528, 44]
              - [2944, 55]
              - [3392, 64]
              - [-1, 16]
          - - 1472
            - - [32, 4]
              - [64, 61]
              - [128, 34]
              - [224, 46]
              - [352, 15]
              - [512, 55]
              - [704, 3]
              - [928, 55]
              - [1184, 16]
              - [1472, 64]
              - [1792, 21]
              - [2528, 64]
              - [2944, 21]
              - [3392, 44]
              - [-1, 16]
          - - 1792
            - - [32, 56]
              - [64, 65]
              - [128, 50]
              - [224, 34]
              - [352, 21]
              - [512, 36]
              - [704, 21]
              - [928, 46]
              - [1184, 55]
              - [1792, 64]
              - [2144, 16]
              - [2528, 43]
              - [2944, 55]
              - [-1, 16]
          - - 2144
            - - [32, 56]
              - [64, 27]
              - [128, 36]
              - [224, 34]
              - [704, 36]
              - [928, 3]
              - [1184, 21]
              - [1472, 55]
              - [2144, 16]
              - [2944, 21]
              - [-1, 16]
          - - 2528
            - - [32, 56]
              - [64, 61]
              - [128, 53]
              - [224, 21]
              - [352, 43]
              - [512, 21]
              - [704, 16]
              - [928, 44]
              - [1184, 64]
              - [1472, 16]
              - [1792, 43]
              - [2144, 16]
              - [2944, 55]
              - [-1, 16]
          - - 2944
            - - [32, 51]
              - [64, 61]
              - [128, 46]
              - [224, 55]
              - [352, 36]
              - [512, 55]
              - [928, 3]
              - [1184, 16]
              - [1472, 43]
              - [1792, 44]
              - [2144, 55]
              - [-1, 16]
          - - 3392
            - - [32, 56]
              - [64, 59]
              - [128, 50]
              - [512, 64]
              - [704, 55]
              - [1184, 3]
              - [1472, 44]
              - [1792, 16]
              - [2144, 55]
              - [-1, 16]
          - - -1
            - - [32, 32]
              - [64, 12]
              - [128, 6]
              - [224, 43]
              - [352, 44]
              - [2528, 16]
              - [2944, 44]
              - [-1, 16]
