library/src/blas3/Tensile/Logic/asm_full/arcturus/arcturus_Cijk_Ailk_Bljk_HSS_BH.yaml
- {MinimumRequiredVersion: 4.23.0}
- arcturus
- gfx908
- [Device 7380, Device 7388, Device 738c, Device 7390]
    SolutionIndex: 0
    SolutionNameMin: Cijk_Ailk_Bljk_HSS_BH_MT32x64x64_MI16x16x16x1_SE_1LDSB0_AF0EM1_AMAS3_ASEM1_EPS1_GRVW4_GSU15_ISA908_KLA_LBSPP128_LPB8_LRVW8_MAC_NLCA1_NLCB1_PGR1_PLR5_SIA3_SU0_SUS0_SRVW0_TT1_32_TLDS1_VAW1_VW2_WSGRA1_WSGRB1_WG32_8_1_WGM15
    SolutionIndex: 1
    SolutionNameMin: Cijk_Ailk_Bljk_HSS_BH_MT128x96x64_MI32x32x8x1_SE_1LDSB0_AF0EM8_AMAS3_ASEM1_EPS1_GRVW8_GSU15_ISA908_KLA_LBSPP128_LPB8_LRVW8_MAC_NLCA1_NLCB1_PGR1_PLR9_SIA3_SU32_SUS128_SRVW0_TT1_96_TLDS1_VAW1_VW2_WSGRA1_WSGRB1_WG128_2_1_WGM1
    SolutionIndex: 2
    SolutionNameMin: Cijk_Ailk_Bljk_HSS_BH_MT32x32x128_MI16x16x16x1_SE_1LDSB0_AF0EM4_AMAS3_ASEM1_EPS1_GRVW8_GSU1_ISA908_KLA_LBSPP256_LPB8_LRVW4_MAC_NLCA1_NLCB1_PGR1_PLR1_SIA3_SU0_SUS0_SRVW0_TT1_16_TLDS1_VAW2_VW2_WSGRA1_WSGRB1_WG32_8_1_WGM1
    SolutionIndex: 3
    SolutionNameMin: Cijk_Ailk_Bljk_HSS_BH_MT32x32x128_MI16x16x16x1_SE_1LDSB0_AF0EM4_AMAS3_ASEM1_EPS1_GRVW8_GSU1_ISA908_KLA_LBSPP256_LPB8_LRVW4_MAC_NLCA1_NLCB1_PGR1_PLR1_SIA3_SU32_SUS256_SRVW0_TT1_16_TLDS1_VAW2_VW2_WSGRA1_WSGRB1_WG32_8_1_WGM1
    SolutionIndex: 4
    SolutionNameMin: Cijk_Ailk_Bljk_HSS_BH_MT32x32x64_MI16x16x16x1_SE_1LDSB0_AF0EM8_AMAS3_ASEM1_EPS1_GRVW4_GSU5_ISA908_KLA_LBSPP128_LPB8_LRVW8_MAC_NLCA1_NLCB1_PGR1_PLR5_SIA3_SU0_SUS0_SRVW0_TT1_16_TLDS1_VAW1_VW2_WSGRA1_WSGRB1_WG32_8_1_WGM2
    SolutionIndex: 5
    SolutionNameMin: Cijk_Ailk_Bljk_HSS_BH_MT32x32x64_MI16x16x16x1_SE_1LDSB0_AF0EM4_AMAS3_ASEM1_EPS1_GRVW4_GSU1_ISA908_KLA_LBSPP128_LPB4_LRVW4_MAC_NLCA1_NLCB1_PGR1_PLR1_SIA3_SU0_SUS0_SRVW0_TT1_16_TLDS1_VAW2_VW2_WSGRA1_WSGRB1_WG32_8_1_WGM15
    SolutionIndex: 6
    SolutionNameMin: Cijk_Ailk_Bljk_HSS_BH_MT32x32x32_MI16x16x16x1_SE_1LDSB0_AF0EM4_AMAS3_ASEM1_EPS1_GRVW4_GSU1_ISA908_KLA_LBSPP128_LPB4_LRVW4_MAC_NLCA1_NLCB1_PGR1_PLR1_SIA3_SU0_SUS0_SRVW0_TT1_16_TLDS1_VAW2_VW2_WSGRA1_WSGRB1_WG32_8_1_WGM1
    SolutionIndex: 7
    SolutionNameMin: Cijk_Ailk_Bljk_HSS_BH_MT32x32x64_MI16x16x16x1_SE_1LDSB0_AF0EM8_AMAS3_ASEM1_EPS1_GRVW8_GSU1_ISA908_KLA_LBSPP128_LPB8_LRVW8_MAC_NLCA1_NLCB1_PGR1_PLR5_SIA3_SU0_SUS0_SRVW4_TT1_16_TLDS1_VAW2_VW2_WSGRA1_WSGRB1_WG32_8_1_WGM15
    SolutionIndex: 8
    SolutionNameMin: Cijk_Ailk_Bljk_HSS_BH_MT32x32x32_MI16x16x16x1_SE_1LDSB0_AF0EM4_AMAS3_ASEM1_EPS1_GRVW2_GSU1_ISA908_KLA_LBSPP128_LPB4_LRVW4_MAC_NLCA1_NLCB1_PGR1_PLR1_SIA3_SU0_SUS0_SRVW0_TT1_16_TLDS1_VAW2_VW2_WSGRA1_WSGRB1_WG32_8_1_WGM15
    SolutionIndex: 9
    SolutionNameMin: Cijk_Ailk_Bljk_HSS_BH_MT32x32x128_MI16x16x16x1_SE_1LDSB0_AF0EM4_AMAS3_ASEM1_EPS1_GRVW8_GSU1_ISA908_KLA_LBSPP256_LPB8_LRVW4_MAC_NLCA1_NLCB1_PGR1_PLR1_SIA3_SU0_SUS0_SRVW0_TT1_16_TLDS1_VAW2_VW2_WSGRA1_WSGRB1_WG32_8_1_WGM2
    SolutionIndex: 10
    SolutionNameMin: Cijk_Ailk_Bljk_HSS_BH_MT32x32x128_MI16x16x16x1_SE_1LDSB0_AF0EM4_AMAS3_ASEM1_EPS1_GRVW8_GSU1_ISA908_KLA_LBSPP256_LPB8_LRVW4_MAC_NLCA1_NLCB1_PGR1_PLR1_SIA3_SU16_SUS256_SRVW0_TT1_16_TLDS1_VAW2_VW2_WSGRA1_WSGRB1_WG32_8_1_WGM2
    SolutionIndex: 11
    SolutionNameMin: Cijk_Ailk_Bljk_HSS_BH_MT32x32x64_MI16x16x16x1_SE_1LDSB0_AF0EM8_AMAS3_ASEM1_EPS1_GRVW8_GSU1_ISA908_KLA_LBSPP128_LPB8_LRVW8_MAC_NLCA1_NLCB1_PGR1_PLR5_SIA3_SU0_SUS0_SRVW4_TT1_16_TLDS1_VAW2_VW2_WSGRA1_WSGRB1_WG32_8_1_WGM2
    SolutionIndex: 12
    SolutionNameMin: Cijk_Ailk_Bljk_HSS_BH_MT32x32x32_MI16x16x16x1_SE_1LDSB0_AF0EM8_AMAS3_ASEM1_EPS1_GRVW4_GSU1_ISA908_KLA_LBSPP128_LPB8_LRVW8_MAC_NLCA1_NLCB1_PGR1_PLR2_SIA3_SU0_SUS0_SRVW4_TT1_16_TLDS1_VAW2_VW2_WSGRA1_WSGRB1_WG32_8_1_WGM1
    SolutionIndex: 13
    SolutionNameMin: Cijk_Ailk_Bljk_HSS_BH_MT64x32x64_MI16x16x16x1_SE_1LDSB0_AF0EM8_AMAS3_ASEM1_EPS1_GRVW8_GSU7_ISA908_KLA_LBSPP128_LPB8_LRVW8_MAC_NLCA1_NLCB1_PGR1_PLR5_SIA3_SU0_SUS0_SRVW0_TT2_16_TLDS1_VAW1_VW2_WSGRA1_WSGRB1_WG32_8_1_WGM1
    SolutionIndex: 14
    SolutionNameMin: Cijk_Ailk_Bljk_HSS_BH_MT64x32x64_MI16x16x16x1_SE_1LDSB0_AF0EM8_AMAS3_ASEM1_EPS1_GRVW8_GSU5_ISA908_KLA_LBSPP128_LPB8_LRVW8_MAC_NLCA1_NLCB1_PGR1_PLR5_SIA3_SU0_SUS0_SRVW0_TT2_16_TLDS1_VAW1_VW2_WSGRA1_WSGRB1_WG32_8_1_WGM15
    SolutionIndex: 15
    SolutionNameMin: Cijk_Ailk_Bljk_HSS_BH_MT32x32x64_MI16x16x16x1_SE_1LDSB0_AF0EM8_AMAS3_ASEM1_EPS1_GRVW8_GSU1_ISA908_KLA_LBSPP128_LPB8_LRVW8_MAC_NLCA1_NLCB1_PGR1_PLR5_SIA3_SU32_SUS128_SRVW4_TT1_16_TLDS1_VAW2_VW2_WSGRA1_WSGRB1_WG32_8_1_WGM1
    SolutionIndex: 16
    SolutionNameMin: Cijk_Ailk_Bljk_HSS_BH_MT64x16x32_MI16x16x16x1_SE_1LDSB0_AF0EM8_AMAS3_ASEM1_EPS1_GRVW4_GSU1_ISA908_KLA_LBSPP128_LPB8_LRVW8_MAC_NLCA1_NLCB1_PGR1_PLR2_SIA3_SU0_SUS0_SRVW0_TT1_16_TLDS1_VAW2_VW2_WSGRA1_WSGRB1_WG64_4_1_WGM2
    SolutionIndex: 17
    SolutionNameMin: Cijk_Ailk_Bljk_HSS_BH_MT32x64x32_MI16x16x16x1_SE_1LDSB0_AF0EM8_AMAS3_ASEM1_EPS1_GRVW8_GSU1_ISA908_KLA_LBSPP128_LPB8_LRVW8_MAC_NLCA1_NLCB1_PGR1_PLR2_SIA3_SU0_SUS0_SRVW4_TT1_32_TLDS1_VAW2_VW2_WSGRA1_WSGRB1_WG32_8_1_WGM1
    SolutionIndex: 18
    SolutionNameMin: Cijk_Ailk_Bljk_HSS_BH_MT64x64x32_MI32x32x8x1_SE_1LDSB0_AF0EM8_AMAS3_ASEM1_EPS1_GRVW8_GSU1_ISA908_KLA_LBSPP128_LPB8_LRVW8_MAC_NLCA1_NLCB1_PGR1_PLR5_SIA3_SU0_SUS0_SRVW4_TT1_32_TLDS1_VAW2_VW2_WSGRA1_WSGRB1_WG64_4_1_WGM1
    SolutionIndex: 19
    SolutionNameMin: Cijk_Ailk_Bljk_HSS_BH_MT32x32x32_MI16x16x16x1_SE_1LDSB0_AF0EM4_AMAS3_ASEM1_EPS1_GRVW8_GSU1_ISA908_KLA_LBSPP128_LPB8_LRVW4_MAC_NLCA1_NLCB1_PGR1_PLR1_SIA3_SU0_SUS0_SRVW0_TT1_16_TLDS1_VAW2_VW2_WSGRA1_WSGRB1_WG32_8_1_WGM15
    SolutionIndex: 20
    SolutionNameMin: Cijk_Ailk_Bljk_HSS_BH_MT32x32x128_MI16x16x16x1_SE_1LDSB0_AF0EM4_AMAS3_ASEM1_EPS1_GRVW8_GSU1_ISA908_KLA_LBSPP256_LPB8_LRVW4_MAC_NLCA1_NLCB1_PGR1_PLR1_SIA3_SU16_SUS256_SRVW0_TT1_16_TLDS1_VAW2_VW2_WSGRA1_WSGRB1_WG32_8_1_WGM1
    SolutionIndex: 21
    SolutionNameMin: Cijk_Ailk_Bljk_HSS_BH_MT32x32x128_MI16x16x16x1_SE_1LDSB0_AF0EM1_AMAS3_ASEM1_EPS1_GRVW8_GSU1_ISA908_KLA_LBSPP256_LPB8_LRVW4_MAC_NLCA1_NLCB1_PGR1_PLR1_SIA3_SU16_SUS256_SRVW0_TT1_16_TLDS1_VAW2_VW2_WSGRA1_WSGRB1_WG32_8_1_WGM1
    SolutionIndex: 22
    SolutionNameMin: Cijk_Ailk_Bljk_HSS_BH_MT32x32x128_MI16x16x16x1_SE_1LDSB0_AF0EM1_AMAS3_ASEM1_EPS1_GRVW8_GSU1_ISA908_KLA_LBSPP256_LPB8_LRVW4_MAC_NLCA1_NLCB1_PGR1_PLR1_SIA3_SU32_SUS256_SRVW0_TT1_16_TLDS1_VAW2_VW2_WSGRA1_WSGRB1_WG32_8_1_WGM1
    SolutionIndex: 23
    SolutionNameMin: Cijk_Ailk_Bljk_HSS_BH_MT32x64x128_MI16x16x16x1_SE_1LDSB0_AF0EM4_AMAS3_ASEM1_EPS1_GRVW8_GSU1_ISA908_KLA_LBSPP256_LPB8_LRVW4_MAC_NLCA1_NLCB1_PGR1_PLR1_SIA3_SU16_SUS256_SRVW0_TT1_32_TLDS1_VAW2_VW2_WSGRA1_WSGRB1_WG32_8_1_WGM2
    SolutionIndex: 24
    SolutionNameMin: Cijk_Ailk_Bljk_HSS_BH_MT32x64x128_MI16x16x16x1_SE_1LDSB0_AF0EM4_AMAS3_ASEM1_EPS1_GRVW8_GSU1_ISA908_KLA_LBSPP256_LPB8_LRVW4_MAC_NLCA1_NLCB1_PGR1_PLR1_SIA3_SU16_SUS256_SRVW0_TT1_32_TLDS1_VAW2_VW2_WSGRA1_WSGRB1_WG32_8_1_WGM15
    SolutionIndex: 25
    SolutionNameMin: Cijk_Ailk_Bljk_HSS_BH_MT32x64x128_MI16x16x16x1_SE_1LDSB0_AF0EM4_AMAS3_ASEM1_EPS1_GRVW8_GSU1_ISA908_KLA_LBSPP256_LPB8_LRVW4_MAC_NLCA1_NLCB1_PGR1_PLR1_SIA3_SU32_SUS256_SRVW0_TT1_32_TLDS1_VAW2_VW2_WSGRA1_WSGRB1_WG32_8_1_WGM1
    SolutionIndex: 26
    SolutionNameMin: Cijk_Ailk_Bljk_HSS_BH_MT32x64x64_MI16x16x16x1_SE_1LDSB0_AF0EM8_AMAS3_ASEM1_EPS1_GRVW8_GSU1_ISA908_KLA_LBSPP128_LPB8_LRVW8_MAC_NLCA1_NLCB1_PGR1_PLR5_SIA3_SU0_SUS0_SRVW4_TT1_32_TLDS1_VAW2_VW2_WSGRA1_WSGRB1_WG32_8_1_WGM15
    SolutionIndex: 27
    SolutionNameMin: Cijk_Ailk_Bljk_HSS_BH_MT32x64x64_MI16x16x16x1_SE_1LDSB0_AF0EM8_AMAS3_ASEM1_EPS1_GRVW8_GSU1_ISA908_KLA_LBSPP128_LPB8_LRVW8_MAC_NLCA1_NLCB1_PGR1_PLR5_SIA3_SU0_SUS0_SRVW4_TT1_32_TLDS1_VAW2_VW2_WSGRA1_WSGRB1_WG32_8_1_WGM2
    SolutionIndex: 28
    SolutionNameMin: Cijk_Ailk_Bljk_HSS_BH_MT64x80x64_MI16x16x16x1_SE_1LDSB0_AF0EM4_AMAS3_ASEM1_EPS1_GRVW2_GSU1_ISA908_KLA_LBSPP128_LPB4_LRVW4_MAC_NLCA1_NLCB1_PGR1_PLR1_SIA3_SU16_SUS128_SRVW0_TT1_80_TLDS1_VAW2_VW2_WSGRA1_WSGRB1_WG64_4_1_WGM2
    SolutionIndex: 29
    SolutionNameMin: Cijk_Ailk_Bljk_HSS_BH_MT64x128x64_MI32x32x8x1_SE_1LDSB0_AF0EM8_AMAS3_ASEM1_EPS1_GRVW8_GSU1_ISA908_KLA_LBSPP128_LPB8_LRVW8_MAC_NLCA1_NLCB1_PGR1_PLR9_SIA3_SU32_SUS128_SRVW4_TT1_64_TLDS1_VAW2_VW2_WSGRA1_WSGRB1_WG64_4_1_WGM15
    SolutionIndex: 30
    SolutionNameMin: Cijk_Ailk_Bljk_HSS_BH_MT64x128x64_MI32x32x8x1_SE_1LDSB0_AF0EM8_AMAS3_ASEM1_EPS1_GRVW8_GSU1_ISA908_KLA_LBSPP128_LPB8_LRVW8_MAC_NLCA1_NLCB1_PGR1_PLR9_SIA3_SU0_SUS0_SRVW4_TT1_64_TLDS1_VAW2_VW2_WSGRA1_WSGRB1_WG64_4_1_WGM2
    SolutionIndex: 31
    SolutionNameMin: Cijk_Ailk_Bljk_HSS_BH_MT64x128x64_MI32x32x8x1_SE_1LDSB0_AF0EM1_AMAS3_ASEM1_EPS1_GRVW8_GSU1_ISA908_KLA_LBSPP128_LPB8_LRVW8_MAC_NLCA1_NLCB1_PGR1_PLR9_SIA3_SU32_SUS256_SRVW4_TT1_64_TLDS1_VAW2_VW2_WSGRA1_WSGRB1_WG64_4_1_WGM2
    SolutionIndex: 32
    SolutionNameMin: Cijk_Ailk_Bljk_HSS_BH_MT32x64x64_MI16x16x16x1_SE_1LDSB0_AF0EM1_AMAS3_ASEM1_EPS1_GRVW8_GSU7_ISA908_KLA_LBSPP128_LPB8_LRVW8_MAC_NLCA1_NLCB1_PGR1_PLR5_SIA3_SU0_SUS0_SRVW0_TT1_32_TLDS1_VAW1_VW2_WSGRA1_WSGRB1_WG32_8_1_WGM2
    SolutionIndex: 33
    SolutionNameMin: Cijk_Ailk_Bljk_HSS_BH_MT64x128x64_MI32x32x8x1_SE_1LDSB0_AF0EM1_AMAS3_ASEM1_EPS1_GRVW8_GSU3_ISA908_KLA_LBSPP128_LPB8_LRVW8_MAC_NLCA1_NLCB1_PGR1_PLR9_SIA3_SU0_SUS0_SRVW0_TT1_64_TLDS1_VAW1_VW2_WSGRA1_WSGRB1_WG64_4_1_WGM1
    SolutionIndex: 34
    SolutionNameMin: Cijk_Ailk_Bljk_HSS_BH_MT64x64x64_MI32x32x8x1_SE_1LDSB0_AF0EM8_AMAS3_ASEM1_EPS1_GRVW8_GSU1_ISA908_KLA_LBSPP128_LPB8_LRVW8_MAC_NLCA1_NLCB1_PGR1_PLR9_SIA3_SU32_SUS256_SRVW4_TT1_32_TLDS1_VAW2_VW2_WSGRA1_WSGRB1_WG64_4_1_WGM15
    SolutionIndex: 35
    SolutionNameMin: Cijk_Ailk_Bljk_HSS_BH_MT128x96x64_MI32x32x8x1_SE_1LDSB0_AF0EM8_AMAS3_ASEM1_EPS1_GRVW8_GSU2_ISA908_KLA_LBSPP128_LPB8_LRVW8_MAC_NLCA1_NLCB1_PGR1_PLR9_SIA3_SU32_SUS256_SRVW0_TT1_96_TLDS1_VAW1_VW2_WSGRA1_WSGRB1_WG128_2_1_WGM1
    SolutionIndex: 36
    SolutionNameMin: Cijk_Ailk_Bljk_HSS_BH_MT64x128x64_MI32x32x8x1_SE_1LDSB0_AF0EM8_AMAS3_ASEM1_EPS1_GRVW8_GSU1_ISA908_KLA_LBSPP128_LPB8_LRVW8_MAC_NLCA1_NLCB1_PGR1_PLR9_SIA3_SU0_SUS0_SRVW4_TT1_64_TLDS1_VAW2_VW2_WSGRA1_WSGRB1_WG64_4_1_WGM15
    SolutionIndex: 37
    SolutionNameMin: Cijk_Ailk_Bljk_HSS_BH_MT128x64x64_MI32x32x8x1_SE_1LDSB0_AF0EM4_AMAS3_ASEM1_EPS1_GRVW8_GSU1_ISA908_KLA_LBSPP128_LPB8_LRVW4_MAC_NLCA1_NLCB1_PGR1_PLR1_SIA3_SU0_SUS0_SRVW4_TT2_32_TLDS1_VAW2_VW2_WSGRA1_WSGRB1_WG64_4_1_WGM15
    SolutionIndex: 38
    SolutionNameMin: Cijk_Ailk_Bljk_HSS_BH_MT32x32x64_MI16x16x16x1_SE_1LDSB0_AF0EM8_AMAS3_ASEM1_EPS1_GRVW4_GSU1_ISA908_KLA_LBSPP128_LPB8_LRVW8_MAC_NLCA1_NLCB1_PGR1_PLR5_SIA3_SU0_SUS0_SRVW4_TT1_16_TLDS1_VAW2_VW2_WSGRA1_WSGRB1_WG32_8_1_WGM2
    SolutionIndex: 39
    SolutionNameMin: Cijk_Ailk_Bljk_HSS_BH_MT64x32x32_MI16x16x16x1_SE_1LDSB0_AF0EM8_AMAS3_ASEM1_EPS1_GRVW8_GSU1_ISA908_KLA_LBSPP128_LPB8_LRVW8_MAC_NLCA1_NLCB1_PGR1_PLR2_SIA3_SU0_SUS0_SRVW4_TT2_16_TLDS1_VAW2_VW2_WSGRA1_WSGRB1_WG32_8_1_WGM15
    SolutionIndex: 40
    SolutionNameMin: Cijk_Ailk_Bljk_HSS_BH_MT32x32x128_MI16x16x16x1_SE_1LDSB0_AF0EM1_AMAS3_ASEM1_EPS1_GRVW8_GSU1_ISA908_KLA_LBSPP256_LPB8_LRVW4_MAC_NLCA1_NLCB1_PGR1_PLR1_SIA3_SU16_SUS256_SRVW0_TT1_16_TLDS1_VAW2_VW2_WSGRA1_WSGRB1_WG32_8_1_WGM2
    SolutionIndex: 41
    SolutionNameMin: Cijk_Ailk_Bljk_HSS_BH_MT32x32x64_MI16x16x16x1_SE_1LDSB0_AF0EM8_AMAS3_ASEM1_EPS1_GRVW8_GSU1_ISA908_KLA_LBSPP128_LPB8_LRVW8_MAC_NLCA1_NLCB1_PGR1_PLR5_SIA3_SU32_SUS256_SRVW4_TT1_16_TLDS1_VAW2_VW2_WSGRA1_WSGRB1_WG32_8_1_WGM15
    SolutionIndex: 42
    SolutionNameMin: Cijk_Ailk_Bljk_HSS_BH_MT32x64x128_MI16x16x16x1_SE_1LDSB0_AF0EM4_AMAS3_ASEM1_EPS1_GRVW8_GSU1_ISA908_KLA_LBSPP256_LPB8_LRVW4_MAC_NLCA1_NLCB1_PGR1_PLR1_SIA3_SU16_SUS256_SRVW0_TT1_32_TLDS1_VAW2_VW2_WSGRA1_WSGRB1_WG32_8_1_WGM1
    SolutionIndex: 43
    SolutionNameMin: Cijk_Ailk_Bljk_HSS_BH_MT64x64x64_MI32x32x8x1_SE_1LDSB0_AF0EM4_AMAS3_ASEM1_EPS1_GRVW8_GSU1_ISA908_KLA_LBSPP128_LPB8_LRVW4_MAC_NLCA1_NLCB1_PGR1_PLR1_SIA3_SU16_SUS128_SRVW4_TT1_32_TLDS1_VAW2_VW2_WSGRA1_WSGRB1_WG64_4_1_WGM2
    SolutionIndex: 44
    SolutionNameMin: Cijk_Ailk_Bljk_HSS_BH_MT64x128x64_MI32x32x8x1_SE_1LDSB0_AF0EM1_AMAS3_ASEM1_EPS1_GRVW8_GSU1_ISA908_KLA_LBSPP128_LPB8_LRVW8_MAC_NLCA1_NLCB1_PGR1_PLR9_SIA3_SU32_SUS128_SRVW4_TT1_64_TLDS1_VAW2_VW2_WSGRA1_WSGRB1_WG64_4_1_WGM1
    SolutionIndex: 45
    SolutionNameMin: Cijk_Ailk_Bljk_HSS_BH_MT64x128x64_MI32x32x8x1_SE_1LDSB0_AF0EM4_AMAS3_ASEM1_EPS1_GRVW8_GSU1_ISA908_KLA_LBSPP128_LPB8_LRVW4_MAC_NLCA1_NLCB1_PGR1_PLR1_SIA3_SU16_SUS128_SRVW4_TT1_64_TLDS1_VAW2_VW2_WSGRA1_WSGRB1_WG64_4_1_WGM1
    SolutionIndex: 46
    SolutionNameMin: Cijk_Ailk_Bljk_HSS_BH_MT64x32x128_MI16x16x16x1_SE_1LDSB0_AF0EM4_AMAS3_ASEM1_EPS1_GRVW8_GSU1_ISA908_KLA_LBSPP256_LPB8_LRVW4_MAC_NLCA1_NLCB1_PGR1_PLR1_SIA3_SU0_SUS0_SRVW0_TT2_16_TLDS1_VAW2_VW2_WSGRA1_WSGRB1_WG32_8_1_WGM15
    SolutionIndex: 47
    SolutionNameMin: Cijk_Ailk_Bljk_HSS_BH_MT32x32x32_MI16x16x16x1_SE_1LDSB0_AF0EM8_AMAS3_ASEM1_EPS1_GRVW2_GSU1_ISA908_KLA_LBSPP128_LPB8_LRVW8_MAC_NLCA1_NLCB1_PGR1_PLR2_SIA3_SU0_SUS0_SRVW4_TT1_16_TLDS1_VAW2_VW2_WSGRA1_WSGRB1_WG32_8_1_WGM1
    SolutionIndex: 48
    SolutionNameMin: Cijk_Ailk_Bljk_HSS_BH_MT64x64x32_MI32x32x8x1_SE_1LDSB0_AF0EM4_AMAS3_ASEM1_EPS1_GRVW4_GSU1_ISA908_KLA_LBSPP128_LPB4_LRVW4_MAC_NLCA1_NLCB1_PGR1_PLR1_SIA3_SU32_SUS128_SRVW4_TT1_32_TLDS1_VAW2_VW2_WSGRA1_WSGRB1_WG64_4_1_WGM15
    SolutionIndex: 49
    SolutionNameMin: Cijk_Ailk_Bljk_HSS_BH_MT32x64x32_MI16x16x16x1_SE_1LDSB1_AF0EM8_AMAS3_ASEM1_EPS1_GRVW2_GSU1_ISA908_KLA_LBSPP128_LPB8_LRVW8_MAC_NLCA1_NLCB1_PGR1_PLR2_SIA3_SU0_SUS0_SRVW4_TT1_32_TLDS1_VAW2_VW2_WSGRA1_WSGRB1_WG32_8_1_WGM15
    SolutionIndex: 50
    SolutionNameMin: Cijk_Ailk_Bljk_HSS_BH_MT64x128x32_MI32x32x8x1_SE_1LDSB0_AF0EM8_AMAS3_ASEM1_EPS1_GRVW8_GSU1_ISA908_KLA_LBSPP128_LPB8_LRVW8_MAC_NLCA1_NLCB1_PGR1_PLR5_SIA3_SU32_SUS128_SRVW4_TT1_64_TLDS1_VAW2_VW2_WSGRA1_WSGRB1_WG64_4_1_WGM1
    SolutionIndex: 51
    SolutionNameMin: Cijk_Ailk_Bljk_HSS_BH_MT64x128x32_MI32x32x8x1_SE_1LDSB0_AF0EM8_AMAS3_ASEM1_EPS1_GRVW8_GSU1_ISA908_KLA_LBSPP128_LPB8_LRVW8_MAC_NLCA1_NLCB1_PGR1_PLR5_SIA3_SU0_SUS0_SRVW4_TT1_64_TLDS1_VAW2_VW2_WSGRA1_WSGRB1_WG64_4_1_WGM1
    SolutionIndex: 52
    SolutionNameMin: Cijk_Ailk_Bljk_HSS_BH_MT64x128x32_MI32x32x8x1_SE_1LDSB0_AF0EM1_AMAS3_ASEM1_EPS1_GRVW8_GSU1_ISA908_KLA_LBSPP128_LPB8_LRVW8_MAC_NLCA1_NLCB1_PGR1_PLR5_SIA3_SU0_SUS0_SRVW4_TT1_64_TLDS1_VAW2_VW2_WSGRA1_WSGRB1_WG64_4_1_WGM1
    SolutionIndex: 53
    SolutionNameMin: Cijk_Ailk_Bljk_HSS_BH_MT64x80x32_MI16x16x16x1_SE_1LDSB0_AF0EM4_AMAS3_ASEM1_EPS1_GRVW2_GSU1_ISA908_KLA_LBSPP128_LPB4_LRVW4_MAC_NLCA1_NLCB1_PGR1_PLR1_SIA3_SU0_SUS0_SRVW0_TT1_80_TLDS1_VAW2_VW2_WSGRA1_WSGRB1_WG64_4_1_WGM1
    SolutionIndex: 54
    SolutionNameMin: Cijk_Ailk_Bljk_HSS_BH_MT128x80x32_MI16x16x16x1_SE_1LDSB0_AF0EM4_AMAS3_ASEM1_EPS1_GRVW2_GSU1_ISA908_KLA_LBSPP128_LPB4_LRVW4_MAC_NLCA1_NLCB1_PGR1_PLR1_SIA3_SU0_SUS0_SRVW4_TT2_80_TLDS1_VAW2_VW2_WSGRA1_WSGRB1_WG64_4_1_WGM1
    SolutionIndex: 55
    SolutionNameMin: Cijk_Ailk_Bljk_HSS_BH_MT128x96x32_MI32x32x8x1_SE_1LDSB0_AF0EM4_AMAS3_ASEM1_EPS1_GRVW4_GSU1_ISA908_KLA_LBSPP128_LPB4_LRVW4_MAC_NLCA1_NLCB1_PGR1_PLR1_SIA3_SU0_SUS0_SRVW4_TT1_96_TLDS1_VAW2_VW2_WSGRA1_WSGRB1_WG128_2_1_WGM15
    SolutionIndex: 56
    SolutionNameMin: Cijk_Ailk_Bljk_HSS_BH_MT96x96x32_MI16x16x16x1_SE_1LDSB1_AF0EM8_AMAS3_ASEM1_EPS1_GRVW4_GSU1_ISA908_KLA_LBSPP128_LPB8_LRVW8_MAC_NLCA3_NLCB1_PGR1_PLR2_SIA3_SU0_SUS0_SRVW0_TT3_48_TLDS1_VAW2_VW2_WSGRA1_WSGRB1_WG32_8_1_WGM1
    SolutionIndex: 57
    SolutionNameMin: Cijk_Ailk_Bljk_HSS_BH_MT64x80x32_MI16x16x16x1_SE_1LDSB0_AF0EM4_AMAS3_ASEM1_EPS1_GRVW2_GSU1_ISA908_KLA_LBSPP128_LPB4_LRVW4_MAC_NLCA1_NLCB1_PGR1_PLR1_SIA3_SU32_SUS128_SRVW0_TT1_80_TLDS1_VAW2_VW2_WSGRA1_WSGRB1_WG64_4_1_WGM1
    SolutionIndex: 58
    SolutionNameMin: Cijk_Ailk_Bljk_HSS_BH_MT64x128x32_MI32x32x8x1_SE_1LDSB0_AF0EM8_AMAS3_ASEM1_EPS1_GRVW8_GSU1_ISA908_KLA_LBSPP128_LPB8_LRVW8_MAC_NLCA1_NLCB1_PGR1_PLR5_SIA3_SU32_SUS128_SRVW4_TT1_64_TLDS1_VAW2_VW2_WSGRA1_WSGRB1_WG64_4_1_WGM2
    SolutionIndex: 59
    SolutionNameMin: Cijk_Ailk_Bljk_HSS_BH_MT128x96x32_MI32x32x8x1_SE_1LDSB0_AF0EM8_AMAS3_ASEM1_EPS1_GRVW4_GSU1_ISA908_KLA_LBSPP128_LPB8_LRVW8_MAC_NLCA1_NLCB1_PGR1_PLR5_SIA3_SU0_SUS0_SRVW4_TT1_96_TLDS1_VAW2_VW2_WSGRA1_WSGRB1_WG128_2_1_WGM15
    SolutionIndex: 60
    SolutionNameMin: Cijk_Ailk_Bljk_HSS_BH_MT128x144x32_MI16x16x16x1_SE_1LDSB1_AF0EM8_AMAS3_ASEM1_EPS1_GRVW2_GSU1_ISA908_KLA_LBSPP128_LPB8_LRVW8_MAC_NLCA1_NLCB1_PGR1_PLR2_SIA3_SU0_SUS0_SRVW4_TT2_144_TLDS1_VAW2_VW2_WSGRA1_WSGRB1_WG64_4_1_WGM1
    SolutionIndex: 61
    SolutionNameMin: Cijk_Ailk_Bljk_HSS_BH_MT128x80x32_MI16x16x16x1_SE_1LDSB0_AF0EM4_AMAS3_ASEM1_EPS1_GRVW2_GSU1_ISA908_KLA_LBSPP128_LPB4_LRVW4_MAC_NLCA1_NLCB1_PGR1_PLR1_SIA3_SU16_SUS128_SRVW4_TT2_80_TLDS1_VAW2_VW2_WSGRA1_WSGRB1_WG64_4_1_WGM1
    SolutionIndex: 62
    SolutionNameMin: Cijk_Ailk_Bljk_HSS_BH_MT128x96x32_MI32x32x8x1_SE_1LDSB0_AF0EM8_AMAS3_ASEM1_EPS1_GRVW4_GSU1_ISA908_KLA_LBSPP128_LPB8_LRVW8_MAC_NLCA1_NLCB1_PGR1_PLR5_SIA3_SU0_SUS0_SRVW4_TT1_96_TLDS1_VAW2_VW2_WSGRA1_WSGRB1_WG128_2_1_WGM2
    SolutionIndex: 63
    SolutionNameMin: Cijk_Ailk_Bljk_HSS_BH_MT128x160x32_MI32x32x8x1_SE_1LDSB1_AF0EM8_AMAS3_ASEM1_EPS1_GRVW2_GSU1_ISA908_KLA_LBSPP128_LPB8_LRVW8_MAC_NLCA1_NLCB1_PGR1_PLR5_SIA3_SU0_SUS0_SRVW4_TT1_160_TLDS1_VAW2_VW2_WSGRA1_WSGRB1_WG128_2_1_WGM1
    SolutionIndex: 64
    SolutionNameMin: Cijk_Ailk_Bljk_HSS_BH_MT128x160x32_MI32x32x8x1_SE_1LDSB1_AF0EM8_AMAS3_ASEM1_EPS1_GRVW2_GSU1_ISA908_KLA_LBSPP128_LPB8_LRVW8_MAC_NLCA1_NLCB1_PGR1_PLR5_SIA3_SU32_SUS256_SRVW4_TT1_160_TLDS1_VAW2_VW2_WSGRA1_WSGRB1_WG128_2_1_WGM15
    SolutionIndex: 65
    SolutionNameMin: Cijk_Ailk_Bljk_HSS_BH_MT128x96x32_MI32x32x8x1_SE_1LDSB1_AF0EM8_AMAS3_ASEM1_EPS1_GRVW2_GSU1_ISA908_KLA_LBSPP128_LPB8_LRVW8_MAC_NLCA1_NLCB1_PGR1_PLR5_SIA3_SU0_SUS0_SRVW4_TT1_96_TLDS1_VAW2_VW2_WSGRA1_WSGRB1_WG128_2_1_WGM1
    SolutionIndex: 66
    SolutionNameMin: Cijk_Ailk_Bljk_HSS_BH_MT64x80x32_MI16x16x16x1_SE_1LDSB0_AF0EM4_AMAS3_ASEM1_EPS1_GRVW2_GSU1_ISA908_KLA_LBSPP128_LPB4_LRVW4_MAC_NLCA1_NLCB1_PGR1_PLR1_SIA3_SU0_SUS0_SRVW0_TT1_80_TLDS1_VAW2_VW2_WSGRA1_WSGRB1_WG64_4_1_WGM2
    SolutionIndex: 67
    SolutionNameMin: Cijk_Ailk_Bljk_HSS_BH_MT128x160x32_MI32x32x8x1_SE_1LDSB1_AF0EM8_AMAS3_ASEM1_EPS1_GRVW2_GSU1_ISA908_KLA_LBSPP128_LPB8_LRVW8_MAC_NLCA1_NLCB1_PGR1_PLR5_SIA3_SU32_SUS128_SRVW4_TT1_160_TLDS1_VAW2_VW2_WSGRA1_WSGRB1_WG128_2_1_WGM2
    SolutionIndex: 68
    SolutionNameMin: Cijk_Ailk_Bljk_HSS_BH_MT32x32x32_MI16x16x16x1_SE_1LDSB0_AF0EM4_AMAS3_ASEM1_EPS1_GRVW8_GSU1_ISA908_KLA_LBSPP128_LPB8_LRVW4_MAC_NLCA1_NLCB1_PGR1_PLR1_SIA3_SU0_SUS0_SRVW0_TT1_16_TLDS1_VAW2_VW2_WSGRA1_WSGRB1_WG32_8_1_WGM1
    SolutionIndex: 69
    SolutionNameMin: Cijk_Ailk_Bljk_HSS_BH_MT64x128x32_MI32x32x8x1_SE_1LDSB0_AF0EM8_AMAS3_ASEM1_EPS1_GRVW8_GSU1_ISA908_KLA_LBSPP128_LPB8_LRVW8_MAC_NLCA1_NLCB1_PGR1_PLR5_SIA3_SU0_SUS0_SRVW4_TT1_64_TLDS1_VAW2_VW2_WSGRA1_WSGRB1_WG64_4_1_WGM15
    SolutionIndex: 70
    SolutionNameMin: Cijk_Ailk_Bljk_HSS_BH_MT128x96x32_MI32x32x8x1_SE_1LDSB1_AF0EM8_AMAS3_ASEM1_EPS1_GRVW2_GSU1_ISA908_KLA_LBSPP128_LPB8_LRVW8_MAC_NLCA1_NLCB1_PGR1_PLR5_SIA3_SU0_SUS0_SRVW4_TT1_96_TLDS1_VAW2_VW2_WSGRA1_WSGRB1_WG128_2_1_WGM2
    SolutionIndex: 71
    SolutionNameMin: Cijk_Ailk_Bljk_HSS_BH_MT64x64x32_MI32x32x8x1_SE_1LDSB0_AF0EM1_AMAS3_ASEM1_EPS1_GRVW8_GSU1_ISA908_KLA_LBSPP128_LPB8_LRVW4_MAC_NLCA1_NLCB1_PGR1_PLR1_SIA3_SU0_SUS0_SRVW4_TT1_32_TLDS1_VAW2_VW2_WSGRA1_WSGRB1_WG64_4_1_WGM1
    SolutionIndex: 72
    SolutionNameMin: Cijk_Ailk_Bljk_HSS_BH_MT128x96x32_MI32x32x8x1_SE_1LDSB0_AF0EM4_AMAS3_ASEM1_EPS1_GRVW4_GSU1_ISA908_KLA_LBSPP128_LPB4_LRVW4_MAC_NLCA1_NLCB1_PGR1_PLR1_SIA3_SU0_SUS0_SRVW4_TT1_96_TLDS1_VAW2_VW2_WSGRA1_WSGRB1_WG128_2_1_WGM2
    SolutionIndex: 73
    SolutionNameMin: Cijk_Ailk_Bljk_HSS_BH_MT128x96x32_MI32x32x8x1_SE_1LDSB1_AF0EM8_AMAS3_ASEM1_EPS1_GRVW2_GSU1_ISA908_KLA_LBSPP128_LPB8_LRVW8_MAC_NLCA1_NLCB1_PGR1_PLR5_SIA3_SU0_SUS0_SRVW4_TT1_96_TLDS1_VAW2_VW2_WSGRA1_WSGRB1_WG128_2_1_WGM15
    SolutionIndex: 74
    SolutionNameMin: Cijk_Ailk_Bljk_HSS_BH_MT32x64x64_MI16x16x16x1_SE_1LDSB0_AF0EM1_AMAS3_ASEM1_EPS1_GRVW2_GSU1_ISA908_KLA_LBSPP128_LPB4_LRVW4_MAC_NLCA1_NLCB1_PGR1_PLR1_SIA3_SU16_SUS256_SRVW4_TT1_32_TLDS1_VAW2_VW2_WSGRA1_WSGRB1_WG32_8_1_WGM2
    SolutionIndex: 75
    SolutionNameMin: Cijk_Ailk_Bljk_HSS_BH_MT128x96x64_MI32x32x8x1_SE_1LDSB0_AF0EM4_AMAS3_ASEM1_EPS1_GRVW8_GSU1_ISA908_KLA_LBSPP128_LPB8_LRVW4_MAC_NLCA1_NLCB1_PGR1_PLR1_SIA3_SU16_SUS128_SRVW4_TT1_96_TLDS1_VAW2_VW2_WSGRA1_WSGRB1_WG128_2_1_WGM15
    SolutionIndex: 76
    SolutionNameMin: Cijk_Ailk_Bljk_HSS_BH_MT128x96x64_MI32x32x8x1_SE_1LDSB0_AF0EM4_AMAS3_ASEM1_EPS1_GRVW8_GSU1_ISA908_KLA_LBSPP128_LPB8_LRVW4_MAC_NLCA1_NLCB1_PGR1_PLR1_SIA3_SU0_SUS0_SRVW4_TT1_96_TLDS1_VAW2_VW2_WSGRA1_WSGRB1_WG128_2_1_WGM15
    SolutionIndex: 77
    SolutionNameMin: Cijk_Ailk_Bljk_HSS_BH_MT128x96x64_MI32x32x8x1_SE_1LDSB0_AF0EM4_AMAS3_ASEM1_EPS1_GRVW8_GSU1_ISA908_KLA_LBSPP128_LPB8_LRVW4_MAC_NLCA1_NLCB1_PGR1_PLR1_SIA3_SU32_SUS128_SRVW4_TT1_96_TLDS1_VAW2_VW2_WSGRA1_WSGRB1_WG128_2_1_WGM2
    SolutionIndex: 78
    SolutionNameMin: Cijk_Ailk_Bljk_HSS_BH_MT128x160x32_MI32x32x8x1_SE_1LDSB0_AF0EM4_AMAS3_ASEM1_EPS1_GRVW4_GSU1_ISA908_KLA_LBSPP128_LPB4_LRVW4_MAC_NLCA1_NLCB1_PGR1_PLR1_SIA3_SU32_SUS128_SRVW4_TT1_160_TLDS1_VAW2_VW2_WSGRA1_WSGRB1_WG128_2_1_WGM2
    SolutionIndex: 79
    SolutionNameMin: Cijk_Ailk_Bljk_HSS_BH_MT128x160x32_MI32x32x8x1_SE_1LDSB0_AF0EM4_AMAS3_ASEM1_EPS1_GRVW4_GSU1_ISA908_KLA_LBSPP128_LPB4_LRVW4_MAC_NLCA1_NLCB1_PGR1_PLR1_SIA3_SU16_SUS128_SRVW4_TT1_160_TLDS1_VAW2_VW2_WSGRA1_WSGRB1_WG128_2_1_WGM2
    SolutionIndex: 80
    SolutionNameMin: Cijk_Ailk_Bljk_HSS_BH_MT128x256x32_MI32x32x8x1_SE_1LDSB0_AF0EM4_AMAS3_ASEM1_EPS1_GRVW8_GSU1_ISA908_KLA_LBSPP128_LPB8_LRVW4_MAC_NLCA1_NLCB1_PGR1_PLR1_SIA3_SU16_SUS128_SRVW4_TT2_128_TLDS1_VAW2_VW2_WSGRA1_WSGRB1_WG64_4_1_WGM1
    SolutionIndex: 81
    SolutionNameMin: Cijk_Ailk_Bljk_HSS_BH_MT128x128x32_MI32x32x8x1_SE_1LDSB0_AF0EM4_AMAS3_ASEM1_EPS1_GRVW8_GSU1_ISA908_KLA_LBSPP128_LPB8_LRVW4_MAC_NLCA1_NLCB1_PGR1_PLR1_SIA3_SU32_SUS256_SRVW4_TT2_64_TLDS1_VAW2_VW2_WSGRA1_WSGRB1_WG64_4_1_WGM15
    SolutionIndex: 82
    SolutionNameMin: Cijk_Ailk_Bljk_HSS_BH_MT128x256x32_MI32x32x8x1_SE_1LDSB1_AF0EM8_AMAS3_ASEM1_EPS1_GRVW8_GSU1_ISA908_KLA_LBSPP128_LPB8_LRVW8_MAC_NLCA1_NLCB1_PGR1_PLR5_SIA3_SU32_SUS128_SRVW4_TT2_128_TLDS1_VAW2_VW2_WSGRA1_WSGRB1_WG64_4_1_WGM2
    SolutionIndex: 83
    SolutionNameMin: Cijk_Ailk_Bljk_HSS_BH_MT128x256x32_MI32x32x8x1_SE_1LDSB0_AF0EM4_AMAS3_ASEM1_EPS1_GRVW8_GSU1_ISA908_KLA_LBSPP128_LPB8_LRVW4_MAC_NLCA1_NLCB1_PGR1_PLR1_SIA3_SU32_SUS256_SRVW4_TT2_128_TLDS1_VAW2_VW2_WSGRA1_WSGRB1_WG64_4_1_WGM1
    SolutionIndex: 84
    SolutionNameMin: Cijk_Ailk_Bljk_HSS_BH_MT256x144x32_MI16x16x16x1_SE_1LDSB0_AF0EM4_AMAS3_ASEM1_EPS1_GRVW2_GSU1_ISA908_KLA_LBSPP128_LPB4_LRVW4_MAC_NLCA2_NLCB1_PGR1_PLR1_SIA3_SU32_SUS256_SRVW4_TT4_144_TLDS1_VAW2_VW2_WSGRA1_WSGRB1_WG64_4_1_WGM2
    SolutionIndex: 85
    SolutionNameMin: Cijk_Ailk_Bljk_HSS_BH_MT64x128x32_MI32x32x8x1_SE_1LDSB0_AF0EM4_AMAS3_ASEM1_EPS1_GRVW8_GSU1_ISA908_KLA_LBSPP128_LPB8_LRVW4_MAC_NLCA1_NLCB1_PGR1_PLR1_SIA3_SU0_SUS0_SRVW4_TT1_64_TLDS1_VAW2_VW2_WSGRA1_WSGRB1_WG64_4_1_WGM1
    SolutionIndex: 86
    SolutionNameMin: Cijk_Ailk_Bljk_HSS_BH_MT128x256x32_MI32x32x8x1_SE_1LDSB0_AF0EM4_AMAS3_ASEM1_EPS1_GRVW8_GSU1_ISA908_KLA_LBSPP128_LPB8_LRVW4_MAC_NLCA1_NLCB1_PGR1_PLR1_SIA3_SU16_SUS128_SRVW4_TT2_128_TLDS1_VAW2_VW2_WSGRA1_WSGRB1_WG64_4_1_WGM2
    SolutionIndex: 87
    SolutionNameMin: Cijk_Ailk_Bljk_HSS_BH_MT128x256x32_MI32x32x8x1_SE_1LDSB0_AF0EM1_AMAS3_ASEM1_EPS1_GRVW8_GSU1_ISA908_KLA_LBSPP128_LPB8_LRVW4_MAC_NLCA1_NLCB1_PGR1_PLR1_SIA3_SU16_SUS128_SRVW4_TT2_128_TLDS1_VAW2_VW2_WSGRA1_WSGRB1_WG64_4_1_WGM2
    SolutionIndex: 88
    SolutionNameMin: Cijk_Ailk_Bljk_HSS_BH_MT256x160x32_MI32x32x8x1_SE_1LDSB0_AF0EM8_AMAS3_ASEM1_EPS1_GRVW4_GSU1_ISA908_KLA_LBSPP128_LPB8_LRVW8_MAC_NLCA1_NLCB1_PGR1_PLR5_SIA3_SU32_SUS256_SRVW4_TT2_160_TLDS1_VAW2_VW2_WSGRA1_WSGRB1_WG128_2_1_WGM15
    SolutionIndex: 89
    SolutionNameMin: Cijk_Ailk_Bljk_HSS_BH_MT128x160x32_MI32x32x8x1_SE_1LDSB1_AF0EM8_AMAS3_ASEM1_EPS1_GRVW2_GSU1_ISA908_KLA_LBSPP128_LPB8_LRVW8_MAC_NLCA1_NLCB1_PGR1_PLR5_SIA3_SU0_SUS0_SRVW4_TT1_160_TLDS1_VAW2_VW2_WSGRA1_WSGRB1_WG128_2_1_WGM15
    SolutionIndex: 90
    SolutionNameMin: Cijk_Ailk_Bljk_HSS_BH_MT128x256x32_MI32x32x8x1_SE_1LDSB0_AF0EM4_AMAS3_ASEM1_EPS1_GRVW8_GSU1_ISA908_KLA_LBSPP128_LPB8_LRVW4_MAC_NLCA1_NLCB1_PGR1_PLR1_SIA3_SU32_SUS128_SRVW4_TT2_128_TLDS1_VAW2_VW2_WSGRA1_WSGRB1_WG64_4_1_WGM2
    SolutionIndex: 91
    SolutionNameMin: Cijk_Ailk_Bljk_HSS_BH_MT128x160x32_MI32x32x8x1_SE_1LDSB1_AF0EM8_AMAS3_ASEM1_EPS1_GRVW2_GSU1_ISA908_KLA_LBSPP128_LPB8_LRVW8_MAC_NLCA1_NLCB1_PGR1_PLR5_SIA3_SU32_SUS128_SRVW4_TT1_160_TLDS1_VAW2_VW2_WSGRA1_WSGRB1_WG128_2_1_WGM1
    SolutionIndex: 92
    SolutionNameMin: Cijk_Ailk_Bljk_HSS_BH_MT128x160x32_MI32x32x8x1_SE_1LDSB1_AF0EM8_AMAS3_ASEM1_EPS1_GRVW2_GSU1_ISA908_KLA_LBSPP128_LPB8_LRVW8_MAC_NLCA1_NLCB1_PGR1_PLR5_SIA3_SU32_SUS256_SRVW4_TT1_160_TLDS1_VAW2_VW2_WSGRA1_WSGRB1_WG128_2_1_WGM2
    SolutionIndex: 93
    SolutionNameMin: Cijk_Ailk_Bljk_HSS_BH_MT64x128x32_MI32x32x8x1_SE_1LDSB0_AF0EM4_AMAS3_ASEM1_EPS1_GRVW4_GSU1_ISA908_KLA_LBSPP128_LPB4_LRVW4_MAC_NLCA1_NLCB1_PGR1_PLR1_SIA3_SU0_SUS0_SRVW4_TT1_64_TLDS1_VAW2_VW2_WSGRA1_WSGRB1_WG64_4_1_WGM2
    SolutionIndex: 94
    SolutionNameMin: Cijk_Ailk_Bljk_HSS_BH_MT128x256x32_MI32x32x8x1_SE_1LDSB0_AF0EM4_AMAS3_ASEM1_EPS1_GRVW8_GSU1_ISA908_KLA_LBSPP128_LPB8_LRVW4_MAC_NLCA1_NLCB1_PGR1_PLR1_SIA3_SU0_SUS0_SRVW4_TT2_128_TLDS1_VAW2_VW2_WSGRA1_WSGRB1_WG64_4_1_WGM1
    SolutionIndex: 95
    SolutionNameMin: Cijk_Ailk_Bljk_HSS_BH_MT128x96x64_MI32x32x8x1_SE_1LDSB1_AF0EM8_AMAS3_ASEM1_EPS1_GRVW2_GSU1_ISA908_KLA_LBSPP128_LPB8_LRVW8_MAC_NLCA1_NLCB1_PGR1_PLR9_SIA3_SU0_SUS0_SRVW4_TT1_96_TLDS1_VAW2_VW2_WSGRA1_WSGRB1_WG128_2_1_WGM1
    SolutionIndex: 96
    SolutionNameMin: Cijk_Ailk_Bljk_HSS_BH_MT256x144x32_MI16x16x16x1_SE_1LDSB0_AF0EM4_AMAS3_ASEM1_EPS1_GRVW2_GSU1_ISA908_KLA_LBSPP128_LPB4_LRVW4_MAC_NLCA2_NLCB1_PGR1_PLR1_SIA3_SU16_SUS128_SRVW4_TT4_144_TLDS1_VAW2_VW2_WSGRA1_WSGRB1_WG64_4_1_WGM2
    SolutionIndex: 97
    SolutionNameMin: Cijk_Ailk_Bljk_HSS_BH_MT64x80x64_MI16x16x16x1_SE_1LDSB0_AF0EM4_AMAS3_ASEM1_EPS1_GRVW2_GSU1_ISA908_KLA_LBSPP128_LPB4_LRVW4_MAC_NLCA1_NLCB1_PGR1_PLR1_SIA3_SU16_SUS256_SRVW0_TT1_80_TLDS1_VAW2_VW2_WSGRA1_WSGRB1_WG64_4_1_WGM15
    SolutionIndex: 98
    SolutionNameMin: Cijk_Ailk_Bljk_HSS_BH_MT128x96x64_MI32x32x8x1_SE_1LDSB1_AF0EM8_AMAS3_ASEM1_EPS1_GRVW2_GSU1_ISA908_KLA_LBSPP128_LPB8_LRVW8_MAC_NLCA1_NLCB1_PGR1_PLR9_SIA3_SU0_SUS0_SRVW4_TT1_96_TLDS1_VAW2_VW2_WSGRA1_WSGRB1_WG128_2_1_WGM2
    SolutionIndex: 99
    SolutionNameMin: Cijk_Ailk_Bljk_HSS_BH_MT256x144x32_MI16x16x16x1_SE_1LDSB0_AF0EM4_AMAS3_ASEM1_EPS1_GRVW2_GSU1_ISA908_KLA_LBSPP128_LPB4_LRVW4_MAC_NLCA2_NLCB1_PGR1_PLR1_SIA3_SU32_SUS128_SRVW4_TT4_144_TLDS1_VAW2_VW2_WSGRA1_WSGRB1_WG64_4_1_WGM2
    SolutionIndex: 100
    SolutionNameMin: Cijk_Ailk_Bljk_HSS_BH_MT128x256x32_MI32x32x8x1_SE_1LDSB0_AF0EM4_AMAS3_ASEM1_EPS1_GRVW8_GSU1_ISA908_KLA_LBSPP128_LPB8_LRVW4_MAC_NLCA1_NLCB1_PGR1_PLR1_SIA3_SU32_SUS128_SRVW4_TT2_128_TLDS1_VAW2_VW2_WSGRA1_WSGRB1_WG64_4_1_WGM1
    SolutionIndex: 101
    SolutionNameMin: Cijk_Ailk_Bljk_HSS_BH_MT128x256x32_MI32x32x8x1_SE_1LDSB0_AF0EM4_AMAS3_ASEM1_EPS1_GRVW8_GSU1_ISA908_KLA_LBSPP128_LPB8_LRVW4_MAC_NLCA1_NLCB1_PGR1_PLR1_SIA3_SU0_SUS0_SRVW4_TT2_128_TLDS1_VAW2_VW2_WSGRA1_WSGRB1_WG64_4_1_WGM15
    SolutionIndex: 102
    SolutionNameMin: Cijk_Ailk_Bljk_HSS_BH_MT128x256x32_MI32x32x8x1_SE_1LDSB0_AF0EM8_AMAS3_ASEM1_EPS1_GRVW8_GSU1_ISA908_KLA_LBSPP128_LPB8_LRVW8_MAC_NLCA1_NLCB1_PGR1_PLR5_SIA3_SU0_SUS0_SRVW4_TT2_128_TLDS1_VAW2_VW2_WSGRA1_WSGRB1_WG64_4_1_WGM15
    SolutionIndex: 103
    SolutionNameMin: Cijk_Ailk_Bljk_HSS_BH_MT128x256x32_MI32x32x8x1_SE_1LDSB0_AF0EM1_AMAS3_ASEM1_EPS1_GRVW8_GSU1_ISA908_KLA_LBSPP128_LPB8_LRVW4_MAC_NLCA1_NLCB1_PGR1_PLR1_SIA3_SU32_SUS128_SRVW4_TT2_128_TLDS1_VAW2_VW2_WSGRA1_WSGRB1_WG64_4_1_WGM1
    SolutionIndex: 104
    SolutionNameMin: Cijk_Ailk_Bljk_HSS_BH_MT256x144x32_MI16x16x16x1_SE_1LDSB0_AF0EM4_AMAS3_ASEM1_EPS1_GRVW2_GSU1_ISA908_KLA_LBSPP128_LPB4_LRVW4_MAC_NLCA2_NLCB1_PGR1_PLR1_SIA3_SU0_SUS0_SRVW0_TT4_144_TLDS1_VAW2_VW2_WSGRA1_WSGRB1_WG64_4_1_WGM15
    SolutionIndex: 105
    SolutionNameMin: Cijk_Ailk_Bljk_HSS_BH_MT128x96x64_MI32x32x8x1_SE_1LDSB1_AF0EM8_AMAS3_ASEM1_EPS1_GRVW2_GSU1_ISA908_KLA_LBSPP128_LPB8_LRVW8_MAC_NLCA1_NLCB1_PGR1_PLR9_SIA3_SU0_SUS0_SRVW4_TT1_96_TLDS1_VAW2_VW2_WSGRA1_WSGRB1_WG128_2_1_WGM15
    SolutionIndex: 106
    SolutionNameMin: Cijk_Ailk_Bljk_HSS_BH_MT128x160x32_MI32x32x8x1_SE_1LDSB1_AF0EM8_AMAS3_ASEM1_EPS1_GRVW2_GSU1_ISA908_KLA_LBSPP128_LPB8_LRVW8_MAC_NLCA1_NLCB1_PGR1_PLR5_SIA3_SU32_SUS256_SRVW4_TT1_160_TLDS1_VAW2_VW2_WSGRA1_WSGRB1_WG128_2_1_WGM1
    SolutionIndex: 107
    SolutionNameMin: Cijk_Ailk_Bljk_HSS_BH_MT64x128x32_MI32x32x8x1_SE_1LDSB0_AF0EM4_AMAS3_ASEM1_EPS1_GRVW8_GSU1_ISA908_KLA_LBSPP128_LPB8_LRVW4_MAC_NLCA1_NLCB1_PGR1_PLR1_SIA3_SU0_SUS0_SRVW4_TT1_64_TLDS1_VAW2_VW2_WSGRA1_WSGRB1_WG64_4_1_WGM15
    SolutionIndex: 108
    SolutionNameMin: Cijk_Ailk_Bljk_HSS_BH_MT160x160x64_MI16x16x16x1_SE_1LDSB1_AF0EM8_AMAS3_ASEM1_EPS1_GRVW8_GSU1_ISA908_KLA_LBSPP128_LPB8_LRVW8_MAC_NLCA5_NLCB1_PGR1_PLR5_SIA3_SU0_SUS0_SRVW0_TT5_80_TLDS1_VAW2_VW2_WSGRA1_WSGRB1_WG32_8_1_WGM15
    SolutionIndex: 109
    SolutionNameMin: Cijk_Ailk_Bljk_HSS_BH_MT128x160x32_MI32x32x8x1_SE_1LDSB1_AF0EM8_AMAS3_ASEM1_EPS1_GRVW2_GSU1_ISA908_KLA_LBSPP128_LPB8_LRVW8_MAC_NLCA1_NLCB1_PGR1_PLR5_SIA3_SU0_SUS0_SRVW4_TT1_160_TLDS1_VAW2_VW2_WSGRA1_WSGRB1_WG128_2_1_WGM2
    SolutionIndex: 110
    SolutionNameMin: Cijk_Ailk_Bljk_HSS_BH_MT128x128x64_MI32x32x8x1_SE_1LDSB1_AF0EM8_AMAS3_ASEM1_EPS1_GRVW2_GSU1_ISA908_KLA_LBSPP128_LPB8_LRVW8_MAC_NLCA1_NLCB1_PGR1_PLR9_SIA3_SU32_SUS128_SRVW4_TT2_64_TLDS1_VAW2_VW2_WSGRA1_WSGRB1_WG64_4_1_WGM1
    SolutionIndex: 111
    SolutionNameMin: Cijk_Ailk_Bljk_HSS_BH_MT64x128x64_MI32x32x8x1_SE_1LDSB0_AF0EM8_AMAS3_ASEM1_EPS1_GRVW8_GSU1_ISA908_KLA_LBSPP128_LPB8_LRVW8_MAC_NLCA1_NLCB1_PGR1_PLR9_SIA3_SU0_SUS0_SRVW4_TT1_64_TLDS1_VAW2_VW2_WSGRA1_WSGRB1_WG64_4_1_WGM1
    SolutionIndex: 112
    SolutionNameMin: Cijk_Ailk_Bljk_HSS_BH_MT128x160x64_MI32x32x8x1_SE_1LDSB1_AF0EM8_AMAS3_ASEM1_EPS1_GRVW2_GSU1_ISA908_KLA_LBSPP128_LPB8_LRVW8_MAC_NLCA1_NLCB1_PGR1_PLR9_SIA3_SU32_SUS128_SRVW4_TT1_160_TLDS1_VAW2_VW2_WSGRA1_WSGRB1_WG128_2_1_WGM1
    SolutionIndex: 113
    SolutionNameMin: Cijk_Ailk_Bljk_HSS_BH_MT256x128x32_MI32x32x4x2_SE_1LDSB0_AF0EM4_AMAS3_ASEM1_EPS1_GRVW8_GSU1_ISA908_KLA_LBSPP128_LPB8_LRVW4_MAC_NLCA1_NLCB1_PGR1_PLR1_SIA3_SU0_SUS0_SRVW0_TT2_64_TLDS1_VAW2_VW2_WSGRA1_WSGRB1_WG128_2_1_WGM2
    SolutionIndex: 114
    SolutionNameMin: Cijk_Ailk_Bljk_HSS_BH_MT256x128x32_MI32x32x8x1_SE_1LDSB0_AF0EM4_AMAS3_ASEM1_EPS1_GRVW8_GSU1_ISA908_KLA_LBSPP128_LPB8_LRVW4_MAC_NLCA1_NLCB1_PGR1_PLR1_SIA3_SU0_SUS0_SRVW0_TT4_64_TLDS1_VAW2_VW2_WSGRA1_WSGRB1_WG64_4_1_WGM15
    SolutionIndex: 115
    SolutionNameMin: Cijk_Ailk_Bljk_HSS_BH_MT256x144x32_MI16x16x16x1_SE_1LDSB0_AF0EM4_AMAS3_ASEM1_EPS1_GRVW2_GSU1_ISA908_KLA_LBSPP128_LPB4_LRVW4_MAC_NLCA2_NLCB1_PGR1_PLR1_SIA3_SU32_SUS128_SRVW4_TT4_144_TLDS1_VAW2_VW2_WSGRA1_WSGRB1_WG64_4_1_WGM15
    SolutionIndex: 116
    SolutionNameMin: Cijk_Ailk_Bljk_HSS_BH_MT64x64x64_MI32x32x8x1_SE_1LDSB0_AF0EM8_AMAS3_ASEM1_EPS1_GRVW8_GSU1_ISA908_KLA_LBSPP128_LPB8_LRVW8_MAC_NLCA1_NLCB1_PGR1_PLR9_SIA3_SU0_SUS0_SRVW4_TT1_32_TLDS1_VAW2_VW2_WSGRA1_WSGRB1_WG64_4_1_WGM1
    SolutionIndex: 117
    SolutionNameMin: Cijk_Ailk_Bljk_HSS_BH_MT256x128x32_MI32x32x4x2_SE_1LDSB0_AF0EM4_AMAS3_ASEM1_EPS1_GRVW8_GSU1_ISA908_KLA_LBSPP128_LPB8_LRVW4_MAC_NLCA1_NLCB1_PGR1_PLR1_SIA3_SU16_SUS128_SRVW0_TT2_64_TLDS1_VAW2_VW2_WSGRA1_WSGRB1_WG128_2_1_WGM15
    SolutionIndex: 118
    SolutionNameMin: Cijk_Ailk_Bljk_HSS_BH_MT256x160x32_MI32x32x8x1_SE_1LDSB0_AF0EM8_AMAS3_ASEM1_EPS1_GRVW4_GSU1_ISA908_KLA_LBSPP128_LPB8_LRVW8_MAC_NLCA1_NLCB1_PGR1_PLR5_SIA3_SU0_SUS0_SRVW4_TT2_160_TLDS1_VAW2_VW2_WSGRA1_WSGRB1_WG128_2_1_WGM2
    SolutionIndex: 119
    SolutionNameMin: Cijk_Ailk_Bljk_HSS_BH_MT256x144x32_MI16x16x16x1_SE_1LDSB0_AF0EM4_AMAS3_ASEM1_EPS1_GRVW2_GSU1_ISA908_KLA_LBSPP128_LPB4_LRVW4_MAC_NLCA2_NLCB1_PGR1_PLR1_SIA3_SU16_SUS128_SRVW4_TT4_144_TLDS1_VAW2_VW2_WSGRA1_WSGRB1_WG64_4_1_WGM15
    SolutionIndex: 120
    SolutionNameMin: Cijk_Ailk_Bljk_HSS_BH_MT256x160x32_MI32x32x8x1_SE_1LDSB0_AF0EM8_AMAS3_ASEM1_EPS1_GRVW4_GSU1_ISA908_KLA_LBSPP128_LPB8_LRVW8_MAC_NLCA1_NLCB1_PGR1_PLR5_SIA3_SU32_SUS128_SRVW4_TT2_160_TLDS1_VAW2_VW2_WSGRA1_WSGRB1_WG128_2_1_WGM2
    SolutionIndex: 121
    SolutionNameMin: Cijk_Ailk_Bljk_HSS_BH_MT256x128x32_MI32x32x4x2_SE_1LDSB0_AF0EM4_AMAS3_ASEM1_EPS1_GRVW8_GSU1_ISA908_KLA_LBSPP128_LPB8_LRVW4_MAC_NLCA1_NLCB1_PGR1_PLR1_SIA3_SU0_SUS0_SRVW0_TT2_64_TLDS1_VAW2_VW2_WSGRA1_WSGRB1_WG128_2_1_WGM15
    SolutionIndex: 122
    SolutionNameMin: Cijk_Ailk_Bljk_HSS_BH_MT128x160x64_MI32x32x8x1_SE_1LDSB1_AF0EM8_AMAS3_ASEM1_EPS1_GRVW2_GSU1_ISA908_KLA_LBSPP128_LPB8_LRVW8_MAC_NLCA1_NLCB1_PGR1_PLR9_SIA3_SU0_SUS0_SRVW4_TT1_160_TLDS1_VAW2_VW2_WSGRA1_WSGRB1_WG128_2_1_WGM2
    SolutionIndex: 123
    SolutionNameMin: Cijk_Ailk_Bljk_HSS_BH_MT128x128x64_MI32x32x8x1_SE_1LDSB1_AF0EM8_AMAS3_ASEM1_EPS1_GRVW2_GSU1_ISA908_KLA_LBSPP128_LPB8_LRVW8_MAC_NLCA1_NLCB1_PGR1_PLR9_SIA3_SU0_SUS0_SRVW4_TT2_64_TLDS1_VAW2_VW2_WSGRA1_WSGRB1_WG64_4_1_WGM1
    SolutionIndex: 124
    SolutionNameMin: Cijk_Ailk_Bljk_HSS_BH_MT256x128x32_MI32x32x4x2_SE_1LDSB0_AF0EM1_AMAS3_ASEM1_EPS1_GRVW8_GSU1_ISA908_KLA_LBSPP128_LPB8_LRVW4_MAC_NLCA1_NLCB1_PGR1_PLR1_SIA3_SU0_SUS0_SRVW0_TT2_64_TLDS1_VAW2_VW2_WSGRA1_WSGRB1_WG128_2_1_WGM15
    SolutionIndex: 125
    SolutionNameMin: Cijk_Ailk_Bljk_HSS_BH_MT256x160x32_MI32x32x8x1_SE_1LDSB0_AF0EM8_AMAS3_ASEM1_EPS1_GRVW4_GSU1_ISA908_KLA_LBSPP128_LPB8_LRVW8_MAC_NLCA1_NLCB1_PGR1_PLR5_SIA3_SU32_SUS128_SRVW4_TT2_160_TLDS1_VAW2_VW2_WSGRA1_WSGRB1_WG128_2_1_WGM15
    SolutionIndex: 126
    SolutionNameMin: Cijk_Ailk_Bljk_HSS_BH_MT256x128x32_MI32x32x4x2_SE_1LDSB0_AF0EM4_AMAS3_ASEM1_EPS1_GRVW8_GSU1_ISA908_KLA_LBSPP128_LPB8_LRVW4_MAC_NLCA1_NLCB1_PGR1_PLR1_SIA3_SU0_SUS0_SRVW0_TT2_64_TLDS1_VAW2_VW2_WSGRA1_WSGRB1_WG128_2_1_WGM1
    SolutionIndex: 127
    SolutionNameMin: Cijk_Ailk_Bljk_HSS_BH_MT256x144x32_MI16x16x16x1_SE_1LDSB0_AF0EM4_AMAS3_ASEM1_EPS1_GRVW2_GSU1_ISA908_KLA_LBSPP128_LPB4_LRVW4_MAC_NLCA2_NLCB1_PGR1_PLR1_SIA3_SU0_SUS0_SRVW4_TT4_144_TLDS1_VAW2_VW2_WSGRA1_WSGRB1_WG64_4_1_WGM15
    SolutionIndex: 128
    SolutionNameMin: Cijk_Ailk_Bljk_HSS_BH_MT64x128x64_MI32x32x8x1_SE_1LDSB0_AF0EM4_AMAS3_ASEM1_EPS1_GRVW8_GSU1_ISA908_KLA_LBSPP128_LPB8_LRVW4_MAC_NLCA1_NLCB1_PGR1_PLR1_SIA3_SU0_SUS0_SRVW4_TT1_64_TLDS1_VAW2_VW2_WSGRA1_WSGRB1_WG64_4_1_WGM15
    SolutionIndex: 129
    SolutionNameMin: Cijk_Ailk_Bljk_HSS_BH_MT128x288x32_MI32x32x8x1_SE_1LDSB0_AF0EM4_AMAS3_ASEM1_EPS1_GRVW4_GSU1_ISA908_KLA_LBSPP128_LPB4_LRVW4_MAC_NLCA1_NLCB1_PGR1_PLR1_SIA3_SU0_SUS0_SRVW4_TT1_288_TLDS1_VAW2_VW2_WSGRA1_WSGRB1_WG128_2_1_WGM2
    SolutionIndex: 130
    SolutionNameMin: Cijk_Ailk_Bljk_HSS_BH_MT256x160x32_MI32x32x8x1_SE_1LDSB0_AF0EM8_AMAS3_ASEM1_EPS1_GRVW4_GSU1_ISA908_KLA_LBSPP128_LPB8_LRVW8_MAC_NLCA1_NLCB1_PGR1_PLR5_SIA3_SU0_SUS0_SRVW4_TT2_160_TLDS1_VAW2_VW2_WSGRA1_WSGRB1_WG128_2_1_WGM15
    SolutionIndex: 131
    SolutionNameMin: Cijk_Ailk_Bljk_HSS_BH_MT128x288x32_MI32x32x8x1_SE_1LDSB0_AF0EM4_AMAS3_ASEM1_EPS1_GRVW4_GSU1_ISA908_KLA_LBSPP128_LPB4_LRVW4_MAC_NLCA1_NLCB1_PGR1_PLR1_SIA3_SU0_SUS0_SRVW4_TT1_288_TLDS1_VAW2_VW2_WSGRA1_WSGRB1_WG128_2_1_WGM1
    SolutionIndex: 132
    SolutionNameMin: Cijk_Ailk_Bljk_HSS_BH_MT64x32x32_MI16x16x16x1_SE_1LDSB1_AF0EM8_AMAS3_ASEM1_EPS1_GRVW2_GSU1_ISA908_KLA_LBSPP128_LPB8_LRVW8_MAC_NLCA1_NLCB1_PGR1_PLR2_SIA3_SU32_SUS128_SRVW4_TT2_16_TLDS1_VAW2_VW2_WSGRA1_WSGRB1_WG32_8_1_WGM15
    SolutionIndex: 133
    SolutionNameMin: Cijk_Ailk_Bljk_HSS_BH_MT64x32x32_MI16x16x16x1_SE_1LDSB1_AF0EM8_AMAS3_ASEM1_EPS1_GRVW2_GSU1_ISA908_KLA_LBSPP128_LPB8_LRVW8_MAC_NLCA1_NLCB1_PGR1_PLR2_SIA3_SU0_SUS0_SRVW4_TT2_16_TLDS1_VAW2_VW2_WSGRA1_WSGRB1_WG32_8_1_WGM1
    SolutionIndex: 134
    SolutionNameMin: Cijk_Ailk_Bljk_HSS_BH_MT64x32x32_MI16x16x16x1_SE_1LDSB1_AF0EM8_AMAS3_ASEM1_EPS1_GRVW2_GSU1_ISA908_KLA_LBSPP128_LPB8_LRVW8_MAC_NLCA1_NLCB1_PGR1_PLR2_SIA3_SU0_SUS0_SRVW4_TT2_16_TLDS1_VAW2_VW2_WSGRA1_WSGRB1_WG32_8_1_WGM15
    SolutionIndex: 135
    SolutionNameMin: Cijk_Ailk_Bljk_HSS_BH_MT128x96x32_MI32x32x8x1_SE_1LDSB0_AF0EM4_AMAS3_ASEM1_EPS1_GRVW2_GSU1_ISA908_KLA_LBSPP128_LPB4_LRVW4_MAC_NLCA1_NLCB1_PGR1_PLR1_SIA3_SU0_SUS0_SRVW4_TT1_96_TLDS1_VAW2_VW2_WSGRA1_WSGRB1_WG128_2_1_WGM15
    SolutionIndex: 136
    SolutionNameMin: Cijk_Ailk_Bljk_HSS_BH_MT32x32x128_MI16x16x16x1_SE_1LDSB0_AF0EM1_AMAS3_ASEM1_EPS1_GRVW8_GSU1_ISA908_KLA_LBSPP256_LPB8_LRVW4_MAC_NLCA1_NLCB1_PGR1_PLR1_SIA3_SU0_SUS0_SRVW0_TT1_16_TLDS1_VAW2_VW2_WSGRA1_WSGRB1_WG32_8_1_WGM15
    SolutionIndex: 137
    SolutionNameMin: Cijk_Ailk_Bljk_HSS_BH_MT32x32x128_MI16x16x16x1_SE_1LDSB0_AF0EM4_AMAS3_ASEM1_EPS1_GRVW8_GSU1_ISA908_KLA_LBSPP256_LPB8_LRVW4_MAC_NLCA1_NLCB1_PGR1_PLR1_SIA3_SU0_SUS0_SRVW0_TT1_16_TLDS1_VAW2_VW2_WSGRA1_WSGRB1_WG32_8_1_WGM15
    SolutionIndex: 138
    SolutionNameMin: Cijk_Ailk_Bljk_HSS_BH_MT64x32x32_MI16x16x16x1_SE_1LDSB0_AF0EM4_AMAS3_ASEM1_EPS1_GRVW2_GSU1_ISA908_KLA_LBSPP128_LPB4_LRVW4_MAC_NLCA1_NLCB1_PGR1_PLR1_SIA3_SU0_SUS0_SRVW4_TT2_16_TLDS1_VAW2_VW2_WSGRA1_WSGRB1_WG32_8_1_WGM1
    SolutionIndex: 139
    SolutionNameMin: Cijk_Ailk_Bljk_HSS_BH_MT64x32x32_MI16x16x16x1_SE_1LDSB0_AF0EM8_AMAS3_ASEM1_EPS1_GRVW8_GSU1_ISA908_KLA_LBSPP128_LPB8_LRVW8_MAC_NLCA1_NLCB1_PGR1_PLR2_SIA3_SU0_SUS0_SRVW4_TT2_16_TLDS1_VAW2_VW2_WSGRA1_WSGRB1_WG32_8_1_WGM1
    SolutionIndex: 140
    SolutionNameMin: Cijk_Ailk_Bljk_HSS_BH_MT32x64x32_MI16x16x16x1_SE_1LDSB1_AF0EM8_AMAS3_ASEM1_EPS1_GRVW2_GSU1_ISA908_KLA_LBSPP128_LPB8_LRVW8_MAC_NLCA1_NLCB1_PGR1_PLR2_SIA3_SU0_SUS0_SRVW4_TT1_32_TLDS1_VAW2_VW2_WSGRA1_WSGRB1_WG32_8_1_WGM1
    SolutionIndex: 141
    SolutionNameMin: Cijk_Ailk_Bljk_HSS_BH_MT64x32x32_MI16x16x16x1_SE_1LDSB1_AF0EM8_AMAS3_ASEM1_EPS1_GRVW2_GSU1_ISA908_KLA_LBSPP128_LPB8_LRVW8_MAC_NLCA1_NLCB1_PGR1_PLR2_SIA3_SU32_SUS128_SRVW4_TT2_16_TLDS1_VAW2_VW2_WSGRA1_WSGRB1_WG32_8_1_WGM1
    SolutionIndex: 142
    SolutionNameMin: Cijk_Ailk_Bljk_HSS_BH_MT64x32x32_MI16x16x16x1_SE_1LDSB1_AF0EM8_AMAS3_ASEM1_EPS1_GRVW2_GSU1_ISA908_KLA_LBSPP128_LPB8_LRVW8_MAC_NLCA1_NLCB1_PGR1_PLR2_SIA3_SU32_SUS128_SRVW4_TT2_16_TLDS1_VAW2_VW2_WSGRA1_WSGRB1_WG32_8_1_WGM2
    SolutionIndex: 143
    SolutionNameMin: Cijk_Ailk_Bljk_HSS_BH_MT64x32x32_MI16x16x16x1_SE_1LDSB0_AF0EM4_AMAS3_ASEM1_EPS1_GRVW4_GSU1_ISA908_KLA_LBSPP128_LPB4_LRVW4_MAC_NLCA1_NLCB1_PGR1_PLR1_SIA3_SU0_SUS0_SRVW0_TT2_16_TLDS1_VAW2_VW2_WSGRA1_WSGRB1_WG32_8_1_WGM2
    SolutionIndex: 144
    SolutionNameMin: Cijk_Ailk_Bljk_HSS_BH_MT64x32x32_MI16x16x16x1_SE_1LDSB0_AF0EM4_AMAS3_ASEM1_EPS1_GRVW2_GSU1_ISA908_KLA_LBSPP128_LPB4_LRVW4_MAC_NLCA1_NLCB1_PGR1_PLR1_SIA3_SU0_SUS0_SRVW0_TT2_16_TLDS1_VAW2_VW2_WSGRA1_WSGRB1_WG32_8_1_WGM1
    SolutionIndex: 145
    SolutionNameMin: Cijk_Ailk_Bljk_HSS_BH_MT64x32x32_MI16x16x16x1_SE_1LDSB0_AF0EM4_AMAS3_ASEM1_EPS1_GRVW2_GSU1_ISA908_KLA_LBSPP128_LPB4_LRVW4_MAC_NLCA1_NLCB1_PGR1_PLR1_SIA3_SU16_SUS256_SRVW0_TT2_16_TLDS1_VAW2_VW2_WSGRA1_WSGRB1_WG32_8_1_WGM1
    SolutionIndex: 146
    SolutionNameMin: Cijk_Ailk_Bljk_HSS_BH_MT64x32x32_MI16x16x16x1_SE_1LDSB1_AF0EM8_AMAS3_ASEM1_EPS1_GRVW2_GSU1_ISA908_KLA_LBSPP128_LPB8_LRVW8_MAC_NLCA1_NLCB1_PGR1_PLR2_SIA3_SU32_SUS256_SRVW4_TT2_16_TLDS1_VAW2_VW2_WSGRA1_WSGRB1_WG32_8_1_WGM2
    SolutionIndex: 147
    SolutionNameMin: Cijk_Ailk_Bljk_HSS_BH_MT64x32x32_MI16x16x16x1_SE_1LDSB1_AF0EM8_AMAS3_ASEM1_EPS1_GRVW2_GSU1_ISA908_KLA_LBSPP128_LPB8_LRVW8_MAC_NLCA1_NLCB1_PGR1_PLR2_SIA3_SU0_SUS0_SRVW4_TT2_16_TLDS1_VAW2_VW2_WSGRA1_WSGRB1_WG32_8_1_WGM2
    SolutionIndex: 148
    SolutionNameMin: Cijk_Ailk_Bljk_HSS_BH_MT64x64x4_SE_1LDSB0_AF0EM1_AMAS2_ASEM1_EPS0_GRVW2_GSU1_ISA000_KLS_LBSPP0_LPB0_LRVW2_FMA_NLCA1_NLCB1_PGR0_PLR0_SIA1_SU32_SUS256_SRVW0_TT4_4_TLDS0_VAW2_VW2_WSGRA0_WSGRB0_WG16_16_1_WGM8
    SolutionIndex: 149
    SolutionNameMin: Cijk_Ailk_Bljk_HSS_BH_MT64x64x4_SE_1LDSB0_AF0EM1_AMAS0_ASEM1_EPS0_GRVW1_GSU1_ISA000_KLS_LBSPP0_LPB0_LRVW1_FMA_NLCA1_NLCB1_PGR1_PLR0_SIA1_SU32_SUS256_SRVW0_TT4_4_TLDS0_VAW2_VW1_WSGRA0_WSGRB0_WG16_16_1_WGM8
    SolutionIndex: 150
    SolutionNameMin: Cijk_Ailk_Bljk_HSS_BH_MT64x64x8_SE_1LDSB0_AF0EM1_AMAS0_ASEM1_EPS0_GRVW1_GSU1_ISA000_KLS_LBSPP0_LPB0_LRVW1_FMA_NLCA1_NLCB1_PGR1_PLR0_SIA1_SU32_SUS256_SRVW0_TT4_4_TLDS0_VAW2_VW1_WSGRA0_WSGRB0_WG16_16_1_WGM8
    SolutionIndex: 151
    SolutionNameMin: Cijk_Ailk_Bljk_HSS_BH_MT64x64x8_SE_1LDSB0_AF0EM1_AMAS0_ASEM1_EPS0_GRVW1_GSU1_ISA000_KLS_LBSPP0_LPB0_LRVW1_FMA_NLCA1_NLCB1_PGR1_PLR1_SIA1_SU32_SUS256_SRVW0_TT4_4_TLDS0_VAW2_VW1_WSGRA0_WSGRB0_WG16_16_1_WGM8
    SolutionIndex: 152
    SolutionNameMin: Cijk_Ailk_Bljk_HSS_BH_MT64x64x16_SE_1LDSB0_AF0EM1_AMAS0_ASEM1_EPS0_GRVW1_GSU1_ISA000_KLS_LBSPP0_LPB0_LRVW1_FMA_NLCA1_NLCB1_PGR1_PLR0_SIA1_SU32_SUS256_SRVW0_TT4_4_TLDS0_VAW2_VW1_WSGRA0_WSGRB0_WG16_16_1_WGM8
    SolutionIndex: 153
    SolutionNameMin: Cijk_Ailk_Bljk_HSS_BH_MT32x32x32_MI16x16x16x1_SE_1LDSB0_AF0EM4_AMAS3_ASEM1_EPS1_GRVW2_GSU1_ISA908_KLA_LBSPP128_LPB4_LRVW4_MAC_NLCA1_NLCB1_PGR1_PLR1_SIA3_SU0_SUS0_SRVW0_TT1_16_TLDS1_VAW2_VW2_WSGRA1_WSGRB1_WG32_8_1_WGM1
    SolutionIndex: 154
    SolutionNameMin: Cijk_Ailk_Bljk_HSS_BH_MT64x128x32_MI32x32x8x1_SE_1LDSB0_AF0EM4_AMAS3_ASEM1_EPS1_GRVW2_GSU1_ISA908_KLA_LBSPP128_LPB4_LRVW4_MAC_NLCA1_NLCB1_PGR1_PLR1_SIA3_SU0_SUS0_SRVW4_TT1_64_TLDS1_VAW2_VW2_WSGRA1_WSGRB1_WG64_4_1_WGM2
    SolutionIndex: 155
    SolutionNameMin: Cijk_Ailk_Bljk_HSS_BH_MT64x32x32_MI16x16x16x1_SE_1LDSB0_AF0EM4_AMAS3_ASEM1_EPS1_GRVW8_GSU1_ISA908_KLA_LBSPP128_LPB8_LRVW4_MAC_NLCA1_NLCB1_PGR1_PLR1_SIA3_SU0_SUS0_SRVW0_TT2_16_TLDS1_VAW2_VW2_WSGRA1_WSGRB1_WG32_8_1_WGM1
    SolutionIndex: 156
    SolutionNameMin: Cijk_Ailk_Bljk_HSS_BH_MT128x96x32_MI32x32x8x1_SE_1LDSB0_AF0EM4_AMAS3_ASEM1_EPS1_GRVW4_GSU1_ISA908_KLA_LBSPP128_LPB4_LRVW4_MAC_NLCA1_NLCB1_PGR1_PLR1_SIA3_SU32_SUS128_SRVW4_TT1_96_TLDS1_VAW2_VW2_WSGRA1_WSGRB1_WG128_2_1_WGM2
    SolutionIndex: 157
    SolutionNameMin: Cijk_Ailk_Bljk_HSS_BH_MT64x128x32_MI32x32x8x1_SE_1LDSB0_AF0EM8_AMAS3_ASEM1_EPS1_GRVW8_GSU1_ISA908_KLA_LBSPP128_LPB8_LRVW8_MAC_NLCA1_NLCB1_PGR1_PLR5_SIA3_SU0_SUS0_SRVW4_TT1_64_TLDS1_VAW2_VW2_WSGRA1_WSGRB1_WG64_4_1_WGM2
    SolutionIndex: 158
    SolutionNameMin: Cijk_Ailk_Bljk_HSS_BH_MT64x64x32_MI32x32x8x1_SE_1LDSB0_AF0EM4_AMAS3_ASEM1_EPS1_GRVW2_GSU1_ISA908_KLA_LBSPP128_LPB4_LRVW4_MAC_NLCA1_NLCB1_PGR1_PLR1_SIA3_SU0_SUS0_SRVW4_TT1_32_TLDS1_VAW2_VW2_WSGRA1_WSGRB1_WG64_4_1_WGM2
    SolutionIndex: 159
    SolutionNameMin: Cijk_Ailk_Bljk_HSS_BH_MT64x128x32_MI32x32x8x1_SE_1LDSB0_AF0EM8_AMAS3_ASEM1_EPS1_GRVW4_GSU1_ISA908_KLA_LBSPP128_LPB8_LRVW8_MAC_NLCA1_NLCB1_PGR1_PLR5_SIA3_SU0_SUS0_SRVW4_TT1_64_TLDS1_VAW2_VW2_WSGRA1_WSGRB1_WG64_4_1_WGM2
    SolutionIndex: 160
    SolutionNameMin: Cijk_Ailk_Bljk_HSS_BH_MT64x64x4_SE_1LDSB0_AF0EM1_AMAS2_ASEM1_EPS0_GRVW2_GSU1_ISA000_KLS_LBSPP0_LPB0_LRVW2_FMA_NLCA1_NLCB1_PGR0_PLR1_SIA1_SU32_SUS256_SRVW0_TT4_4_TLDS0_VAW2_VW2_WSGRA0_WSGRB0_WG16_16_1_WGM8
    SolutionIndex: 161
    SolutionNameMin: Cijk_Ailk_Bljk_HSS_BH_MT128x256x32_MI32x32x8x1_SE_1LDSB0_AF0EM1_AMAS3_ASEM1_EPS1_GRVW8_GSU1_ISA908_KLA_LBSPP128_LPB8_LRVW4_MAC_NLCA1_NLCB1_PGR1_PLR1_SIA3_SU16_SUS128_SRVW4_TT2_128_TLDS1_VAW2_VW2_WSGRA1_WSGRB1_WG64_4_1_WGM1
    SolutionIndex: 162
    SolutionNameMin: Cijk_Ailk_Bljk_HSS_BH_MT64x16x32_SE_1LDSB0_AF0EM2_AMAS3_ASEM2_EPS1_GRVW2_GSU1_ISA908_KLA_LBSPP0_LPB0_LRVW2_MAC_NLCA1_NLCB1_PGR1_PLR1_SIA1_SU32_SUS256_SRVW0_TT2_2_TLDS0_VAW2_VW2_WSGRA0_WSGRB0_WG32_8_1_WGM1
    SolutionIndex: 163
    SolutionNameMin: Cijk_Ailk_Bljk_HSS_BH_MT64x64x16_SE_1LDSB0_AF0EM2_AMAS3_ASEM2_EPS1_GRVW2_GSU1_ISA908_KLA_LBSPP0_LPB2_LRVW2_MAC_NLCA1_NLCB1_PGR1_PLR1_SIA1_SU32_SUS256_SRVW0_TT2_4_TLDS0_VAW2_VW2_WSGRA0_WSGRB0_WG32_16_1_WGM8
    SolutionIndex: 164
    SolutionNameMin: Cijk_Ailk_Bljk_HSS_BH_MT128x96x64_MI32x32x8x1_SE_1LDSB1_AF0EM8_AMAS3_ASEM1_EPS1_GRVW2_GSU1_ISA908_KLA_LBSPP128_LPB8_LRVW8_MAC_NLCA1_NLCB1_PGR1_PLR9_SIA3_SU32_SUS128_SRVW4_TT1_96_TLDS1_VAW2_VW2_WSGRA1_WSGRB1_WG128_2_1_WGM2
    SolutionIndex: 165
    SolutionNameMin: Cijk_Ailk_Bljk_HSS_BH_MT32x8x32_SE_1LDSB0_AF0EM2_AMAS3_ASEM2_EPS1_GRVW2_GSU1_ISA908_KLA_LBSPP0_LPB0_LRVW2_MAC_NLCA1_NLCB1_PGR1_PLR1_SIA1_SU32_SUS256_SRVW0_TT2_2_TLDS0_VAW2_VW2_WSGRA0_WSGRB0_WG16_4_1_WGM1
    SolutionIndex: 166
    SolutionNameMin: Cijk_Ailk_Bljk_HSS_BH_MT256x128x32_MI32x32x8x1_SE_1LDSB1_AF0EM8_AMAS3_ASEM1_EPS1_GRVW8_GSU15_ISA908_KLA_LBSPP128_LPB8_LRVW8_MAC_NLCA1_NLCB1_PGR1_PLR5_SIA3_SU0_SUS0_SRVW0_TT4_64_TLDS1_VAW1_VW2_WSGRA1_WSGRB1_WG64_4_1_WGM1
    SolutionIndex: 167
    SolutionNameMin: Cijk_Ailk_Bljk_HSS_BH_MT64x64x8_SE_1LDSB0_AF0EM2_AMAS3_ASEM2_EPS1_GRVW4_GSU1_ISA908_KLA_LBSPP0_LPB0_LRVW4_MAC_NLCA1_NLCB1_PGR1_PLR1_SIA1_SU32_SUS256_SRVW0_TT4_4_TLDS0_VAW2_VW4_WSGRA0_WSGRB0_WG16_16_1_WGM1
    SolutionIndex: 168
    SolutionNameMin: Cijk_Ailk_Bljk_HSS_BH_MT128x96x64_MI32x32x8x1_SE_1LDSB1_AF0EM8_AMAS3_ASEM1_EPS1_GRVW2_GSU1_ISA908_KLA_LBSPP128_LPB8_LRVW8_MAC_NLCA1_NLCB1_PGR1_PLR9_SIA3_SU32_SUS128_SRVW4_TT1_96_TLDS1_VAW2_VW2_WSGRA1_WSGRB1_WG128_2_1_WGM1
    SolutionIndex: 169
    SolutionNameMin: Cijk_Ailk_Bljk_HSS_BH_MT256x160x32_MI32x32x8x1_SE_1LDSB0_AF0EM8_AMAS3_ASEM1_EPS1_GRVW4_GSU5_ISA908_KLA_LBSPP128_LPB8_LRVW8_MAC_NLCA1_NLCB1_PGR1_PLR5_SIA3_SU0_SUS0_SRVW0_TT2_160_TLDS1_VAW1_VW2_WSGRA1_WSGRB1_WG128_2_1_WGM15
    SolutionIndex: 170
    SolutionNameMin: Cijk_Ailk_Bljk_HSS_BH_MT256x160x32_MI32x32x8x1_SE_1LDSB0_AF0EM8_AMAS3_ASEM1_EPS1_GRVW4_GSU15_ISA908_KLA_LBSPP128_LPB8_LRVW8_MAC_NLCA1_NLCB1_PGR1_PLR5_SIA3_SU32_SUS128_SRVW0_TT2_160_TLDS1_VAW1_VW2_WSGRA1_WSGRB1_WG128_2_1_WGM1
    SolutionIndex: 171
    SolutionNameMin: Cijk_Ailk_Bljk_HSS_BH_MT128x160x64_MI32x32x8x1_SE_1LDSB1_AF0EM8_AMAS3_ASEM1_EPS1_GRVW2_GSU1_ISA908_KLA_LBSPP128_LPB8_LRVW8_MAC_NLCA1_NLCB1_PGR1_PLR9_SIA3_SU0_SUS0_SRVW4_TT1_160_TLDS1_VAW2_VW2_WSGRA1_WSGRB1_WG128_2_1_WGM15
    SolutionIndex: 172
    SolutionNameMin: Cijk_Ailk_Bljk_HSS_BH_MT96x96x32_MI16x16x16x1_SE_1LDSB0_AF0EM8_AMAS3_ASEM1_EPS1_GRVW4_GSU1_ISA908_KLA_LBSPP128_LPB8_LRVW8_MAC_NLCA3_NLCB1_PGR1_PLR2_SIA3_SU0_SUS0_SRVW0_TT3_48_TLDS1_VAW2_VW2_WSGRA1_WSGRB1_WG32_8_1_WGM1
    SolutionIndex: 173
    SolutionNameMin: Cijk_Ailk_Bljk_HSS_BH_MT16x16x8_SE_1LDSB0_AF0EM2_AMAS3_ASEM2_EPS1_GRVW2_GSU1_ISA908_KLA_LBSPP0_LPB0_LRVW2_MAC_NLCA1_NLCB1_PGR1_PLR1_SIA1_SU32_SUS256_SRVW0_TT2_2_TLDS0_VAW2_VW2_WSGRA0_WSGRB0_WG8_8_1_WGM1
    SolutionIndex: 174
    SolutionNameMin: Cijk_Ailk_Bljk_HSS_BH_MT256x256x32_MI32x32x8x1_SE_1LDSB1_AF0EM8_AMAS3_ASEM1_EPS1_GRVW8_GSU15_ISA908_KLA_LBSPP128_LPB8_LRVW8_MAC_NLCA1_NLCB1_PGR1_PLR5_SIA3_SU32_SUS128_SRVW0_TT4_128_TLDS1_VAW1_VW2_WSGRA1_WSGRB1_WG64_4_1_WGM1
    SolutionIndex: 175
    SolutionNameMin: Cijk_Ailk_Bljk_HSS_BH_MT64x128x32_MI32x32x8x1_SE_1LDSB0_AF0EM8_AMAS3_ASEM1_EPS1_GRVW2_GSU1_ISA908_KLA_LBSPP128_LPB8_LRVW8_MAC_NLCA1_NLCB1_PGR1_PLR5_SIA3_SU0_SUS0_SRVW4_TT1_64_TLDS1_VAW2_VW2_WSGRA1_WSGRB1_WG64_4_1_WGM1
    SolutionIndex: 176
    SolutionNameMin: Cijk_Ailk_Bljk_HSS_BH_MT16x16x32_SE_1LDSB0_AF0EM2_AMAS3_ASEM2_EPS1_GRVW2_GSU1_ISA908_KLA_LBSPP0_LPB0_LRVW2_MAC_NLCA1_NLCB1_PGR1_PLR1_SIA1_SU32_SUS256_SRVW0_TT2_2_TLDS0_VAW2_VW2_WSGRA0_WSGRB0_WG8_8_1_WGM1
    SolutionIndex: 177
    SolutionNameMin: Cijk_Ailk_Bljk_HSS_BH_MT64x64x8_SE_1LDSB0_AF0EM2_AMAS3_ASEM2_EPS1_GRVW4_GSU1_ISA908_KLA_LBSPP0_LPB4_LRVW4_MAC_NLCA1_NLCB1_PGR1_PLR1_SIA1_SU32_SUS256_SRVW0_TT4_4_TLDS0_VAW2_VW4_WSGRA0_WSGRB0_WG16_16_1_WGM1
    SolutionIndex: 178
    SolutionNameMin: Cijk_Ailk_Bljk_HSS_BH_MT128x256x32_MI32x32x8x1_SE_1LDSB0_AF0EM4_AMAS3_ASEM1_EPS1_GRVW8_GSU1_ISA908_KLA_LBSPP128_LPB8_LRVW4_MAC_NLCA1_NLCB1_PGR1_PLR1_SIA3_SU16_SUS256_SRVW4_TT2_128_TLDS1_VAW2_VW2_WSGRA1_WSGRB1_WG64_4_1_WGM15
    SolutionIndex: 179
    SolutionNameMin: Cijk_Ailk_Bljk_HSS_BH_MT32x8x16_SE_1LDSB0_AF0EM2_AMAS3_ASEM2_EPS1_GRVW2_GSU1_ISA908_KLA_LBSPP0_LPB0_LRVW2_MAC_NLCA1_NLCB1_PGR1_PLR1_SIA1_SU32_SUS256_SRVW0_TT2_2_TLDS0_VAW2_VW2_WSGRA0_WSGRB0_WG16_4_1_WGM8
    SolutionIndex: 180
    SolutionNameMin: Cijk_Ailk_Bljk_HSS_BH_MT128x96x64_MI32x32x8x1_SE_1LDSB1_AF0EM8_AMAS3_ASEM1_EPS1_GRVW2_GSU1_ISA908_KLA_LBSPP128_LPB8_LRVW8_MAC_NLCA1_NLCB1_PGR1_PLR9_SIA3_SU32_SUS256_SRVW4_TT1_96_TLDS1_VAW2_VW2_WSGRA1_WSGRB1_WG128_2_1_WGM2
    SolutionIndex: 181
    SolutionNameMin: Cijk_Ailk_Bljk_HSS_BH_MT128x96x32_MI32x32x8x1_SE_1LDSB1_AF0EM1_AMAS3_ASEM1_EPS1_GRVW2_GSU1_ISA908_KLA_LBSPP128_LPB8_LRVW8_MAC_NLCA1_NLCB1_PGR1_PLR5_SIA3_SU0_SUS0_SRVW4_TT1_96_TLDS1_VAW2_VW2_WSGRA1_WSGRB1_WG128_2_1_WGM15
    SolutionIndex: 182
    SolutionNameMin: Cijk_Ailk_Bljk_HSS_BH_MT128x288x32_MI32x32x8x1_SE_1LDSB0_AF0EM1_AMAS3_ASEM1_EPS1_GRVW4_GSU1_ISA908_KLA_LBSPP128_LPB4_LRVW4_MAC_NLCA1_NLCB1_PGR1_PLR1_SIA3_SU0_SUS0_SRVW4_TT1_288_TLDS1_VAW2_VW2_WSGRA1_WSGRB1_WG128_2_1_WGM15
    SolutionIndex: 183
    SolutionNameMin: Cijk_Ailk_Bljk_HSS_BH_MT256x160x32_MI32x32x8x1_SE_1LDSB0_AF0EM8_AMAS3_ASEM1_EPS1_GRVW4_GSU2_ISA908_KLA_LBSPP128_LPB8_LRVW8_MAC_NLCA1_NLCB1_PGR1_PLR5_SIA3_SU32_SUS256_SRVW0_TT2_160_TLDS1_VAW1_VW2_WSGRA1_WSGRB1_WG128_2_1_WGM2
    SolutionIndex: 184
    SolutionNameMin: Cijk_Ailk_Bljk_HSS_BH_MT128x256x32_MI32x32x8x1_SE_1LDSB0_AF0EM1_AMAS3_ASEM1_EPS1_GRVW8_GSU1_ISA908_KLA_LBSPP128_LPB8_LRVW4_MAC_NLCA1_NLCB1_PGR1_PLR1_SIA3_SU0_SUS0_SRVW4_TT2_128_TLDS1_VAW2_VW2_WSGRA1_WSGRB1_WG64_4_1_WGM15
    SolutionIndex: 185
    SolutionNameMin: Cijk_Ailk_Bljk_HSS_BH_MT128x256x32_MI32x32x8x1_SE_1LDSB0_AF0EM1_AMAS3_ASEM1_EPS1_GRVW8_GSU1_ISA908_KLA_LBSPP128_LPB8_LRVW4_MAC_NLCA1_NLCB1_PGR1_PLR1_SIA3_SU16_SUS256_SRVW4_TT2_128_TLDS1_VAW2_VW2_WSGRA1_WSGRB1_WG64_4_1_WGM2
    SolutionIndex: 186
    SolutionNameMin: Cijk_Ailk_Bljk_HSS_BH_MT32x16x16_SE_1LDSB0_AF0EM2_AMAS3_ASEM2_EPS1_GRVW2_GSU1_ISA908_KLA_LBSPP0_LPB0_LRVW2_MAC_NLCA1_NLCB1_PGR1_PLR1_SIA1_SU32_SUS256_SRVW0_TT2_2_TLDS0_VAW2_VW2_WSGRA0_WSGRB0_WG16_8_1_WGM8
    SolutionIndex: 187
    SolutionNameMin: Cijk_Ailk_Bljk_HSS_BH_MT64x32x16_SE_1LDSB0_AF0EM2_AMAS3_ASEM2_EPS1_GRVW2_GSU1_ISA908_KLA_LBSPP0_LPB2_LRVW2_MAC_NLCA1_NLCB1_PGR1_PLR1_SIA1_SU32_SUS256_SRVW0_TT2_4_TLDS0_VAW2_VW2_WSGRA0_WSGRB0_WG32_8_1_WGM1
    SolutionIndex: 188
    SolutionNameMin: Cijk_Ailk_Bljk_HSS_BH_MT64x32x16_SE_1LDSB0_AF0EM2_AMAS3_ASEM2_EPS1_GRVW2_GSU1_ISA908_KLA_LBSPP0_LPB2_LRVW2_MAC_NLCA1_NLCB1_PGR1_PLR1_SIA1_SU32_SUS256_SRVW0_TT4_2_TLDS0_VAW2_VW2_WSGRA0_WSGRB0_WG16_16_1_WGM1
    SolutionIndex: 189
    SolutionNameMin: Cijk_Ailk_Bljk_HSS_BH_MT64x32x32_MI16x16x16x1_SE_1LDSB1_AF0EM1_AMAS3_ASEM1_EPS1_GRVW2_GSU1_ISA908_KLA_LBSPP128_LPB8_LRVW8_MAC_NLCA1_NLCB1_PGR1_PLR2_SIA3_SU0_SUS0_SRVW4_TT2_16_TLDS1_VAW2_VW2_WSGRA1_WSGRB1_WG32_8_1_WGM1
    SolutionIndex: 190
    SolutionNameMin: Cijk_Ailk_Bljk_HSS_BH_MT256x160x32_MI32x32x8x1_SE_1LDSB0_AF0EM8_AMAS3_ASEM1_EPS1_GRVW4_GSU2_ISA908_KLA_LBSPP128_LPB8_LRVW8_MAC_NLCA1_NLCB1_PGR1_PLR5_SIA3_SU0_SUS0_SRVW0_TT2_160_TLDS1_VAW1_VW2_WSGRA1_WSGRB1_WG128_2_1_WGM2
    SolutionIndex: 191
    SolutionNameMin: Cijk_Ailk_Bljk_HSS_BH_MT256x160x32_MI32x32x8x1_SE_1LDSB0_AF0EM8_AMAS3_ASEM1_EPS1_GRVW4_GSU2_ISA908_KLA_LBSPP128_LPB8_LRVW8_MAC_NLCA1_NLCB1_PGR1_PLR5_SIA3_SU32_SUS256_SRVW0_TT2_160_TLDS1_VAW1_VW2_WSGRA1_WSGRB1_WG128_2_1_WGM15
    SolutionIndex: 192
    SolutionNameMin: Cijk_Ailk_Bljk_HSS_BH_MT256x160x32_MI32x32x8x1_SE_1LDSB0_AF0EM8_AMAS3_ASEM1_EPS1_GRVW4_GSU2_ISA908_KLA_LBSPP128_LPB8_LRVW8_MAC_NLCA1_NLCB1_PGR1_PLR5_SIA3_SU0_SUS0_SRVW0_TT2_160_TLDS1_VAW1_VW2_WSGRA1_WSGRB1_WG128_2_1_WGM1
    SolutionIndex: 193
    SolutionNameMin: Cijk_Ailk_Bljk_HSS_BH_MT256x160x32_MI32x32x8x1_SE_1LDSB0_AF0EM8_AMAS3_ASEM1_EPS1_GRVW4_GSU2_ISA908_KLA_LBSPP128_LPB8_LRVW8_MAC_NLCA1_NLCB1_PGR1_PLR5_SIA3_SU32_SUS128_SRVW0_TT2_160_TLDS1_VAW1_VW2_WSGRA1_WSGRB1_WG128_2_1_WGM1
    SolutionIndex: 194
    SolutionNameMin: Cijk_Ailk_Bljk_HSS_BH_MT256x160x32_MI32x32x8x1_SE_1LDSB0_AF0EM8_AMAS3_ASEM1_EPS1_GRVW4_GSU2_ISA908_KLA_LBSPP128_LPB8_LRVW8_MAC_NLCA1_NLCB1_PGR1_PLR5_SIA3_SU32_SUS256_SRVW0_TT2_160_TLDS1_VAW1_VW2_WSGRA1_WSGRB1_WG128_2_1_WGM1
    SolutionIndex: 195
    SolutionNameMin: Cijk_Ailk_Bljk_HSS_BH_MT256x160x32_MI32x32x8x1_SE_1LDSB0_AF0EM8_AMAS3_ASEM1_EPS1_GRVW4_GSU2_ISA908_KLA_LBSPP128_LPB8_LRVW8_MAC_NLCA1_NLCB1_PGR1_PLR5_SIA3_SU0_SUS0_SRVW0_TT2_160_TLDS1_VAW1_VW2_WSGRA1_WSGRB1_WG128_2_1_WGM15
    SolutionIndex: 196
    SolutionNameMin: Cijk_Ailk_Bljk_HSS_BH_MT256x160x32_MI32x32x8x1_SE_1LDSB0_AF0EM8_AMAS3_ASEM1_EPS1_GRVW4_GSU2_ISA908_KLA_LBSPP128_LPB8_LRVW8_MAC_NLCA1_NLCB1_PGR1_PLR5_SIA3_SU32_SUS128_SRVW0_TT2_160_TLDS1_VAW1_VW2_WSGRA1_WSGRB1_WG128_2_1_WGM15
    SolutionIndex: 197
    SolutionNameMin: Cijk_Ailk_Bljk_HSS_BH_MT128x96x32_MI32x32x8x1_SE_1LDSB1_AF0EM8_AMAS3_ASEM1_EPS1_GRVW2_GSU1_ISA908_KLA_LBSPP128_LPB8_LRVW8_MAC_NLCA1_NLCB1_PGR1_PLR5_SIA3_SU32_SUS128_SRVW4_TT1_96_TLDS1_VAW2_VW2_WSGRA1_WSGRB1_WG128_2_1_WGM15
    SolutionIndex: 198
    SolutionNameMin: Cijk_Ailk_Bljk_HSS_BH_MT128x160x32_MI32x32x8x1_SE_1LDSB0_AF0EM1_AMAS3_ASEM1_EPS1_GRVW4_GSU1_ISA908_KLA_LBSPP128_LPB4_LRVW4_MAC_NLCA1_NLCB1_PGR1_PLR1_SIA3_SU16_SUS256_SRVW4_TT1_160_TLDS1_VAW2_VW2_WSGRA1_WSGRB1_WG128_2_1_WGM15
    SolutionIndex: 199
    SolutionNameMin: Cijk_Ailk_Bljk_HSS_BH_MT128x256x32_MI32x32x8x1_SE_1LDSB0_AF0EM1_AMAS3_ASEM1_EPS1_GRVW8_GSU1_ISA908_KLA_LBSPP128_LPB8_LRVW4_MAC_NLCA1_NLCB1_PGR1_PLR1_SIA3_SU32_SUS256_SRVW4_TT2_128_TLDS1_VAW2_VW2_WSGRA1_WSGRB1_WG64_4_1_WGM15
    SolutionIndex: 200
    SolutionNameMin: Cijk_Ailk_Bljk_HSS_BH_MT32x16x16_SE_1LDSB0_AF0EM2_AMAS3_ASEM2_EPS1_GRVW2_GSU1_ISA908_KLA_LBSPP0_LPB0_LRVW2_MAC_NLCA1_NLCB1_PGR1_PLR1_SIA1_SU32_SUS256_SRVW0_TT2_2_TLDS0_VAW2_VW2_WSGRA0_WSGRB0_WG16_8_1_WGM1
    SolutionIndex: 201
    SolutionNameMin: Cijk_Ailk_Bljk_HSS_BH_MT128x80x32_MI16x16x16x1_SE_1LDSB0_AF0EM4_AMAS3_ASEM1_EPS1_GRVW2_GSU1_ISA908_KLA_LBSPP128_LPB4_LRVW4_MAC_NLCA1_NLCB1_PGR1_PLR1_SIA3_SU16_SUS256_SRVW0_TT2_80_TLDS1_VAW2_VW2_WSGRA1_WSGRB1_WG64_4_1_WGM1
    SolutionIndex: 202
    SolutionNameMin: Cijk_Ailk_Bljk_HSS_BH_MT256x160x32_MI32x32x8x1_SE_1LDSB0_AF0EM8_AMAS3_ASEM1_EPS1_GRVW4_GSU2_ISA908_KLA_LBSPP128_LPB8_LRVW8_MAC_NLCA1_NLCB1_PGR1_PLR5_SIA3_SU32_SUS128_SRVW0_TT2_160_TLDS1_VAW1_VW2_WSGRA1_WSGRB1_WG128_2_1_WGM2
    SolutionIndex: 203
    SolutionNameMin: Cijk_Ailk_Bljk_HSS_BH_MT64x256x64_MI32x32x8x1_SE_1LDSB1_AF0EM8_AMAS3_ASEM1_EPS1_GRVW2_GSU1_ISA908_KLA_LBSPP128_LPB8_LRVW8_MAC_NLCA1_NLCB1_PGR1_PLR9_SIA3_SU0_SUS0_SRVW4_TT1_128_TLDS1_VAW2_VW2_WSGRA1_WSGRB1_WG64_4_1_WGM1
    SolutionIndex: 204
    SolutionNameMin: Cijk_Ailk_Bljk_HSS_BH_MT64x128x64_MI32x32x4x2_SE_1LDSB0_AF0EM4_AMAS3_ASEM1_EPS1_GRVW2_GSU1_ISA908_KLA_LBSPP128_LPB4_LRVW4_MAC_NLCA1_NLCB1_PGR1_PLR1_SIA3_SU0_SUS0_SRVW4_TT1_32_TLDS1_VAW2_VW2_WSGRA1_WSGRB1_WG64_4_1_WGM15
    SolutionIndex: 205
    SolutionNameMin: Cijk_Ailk_Bljk_HSS_BH_MT64x16x32_SE_1LDSB0_AF0EM2_AMAS3_ASEM2_EPS1_GRVW2_GSU1_ISA908_KLA_LBSPP0_LPB0_LRVW2_MAC_NLCA1_NLCB1_PGR1_PLR1_SIA1_SU32_SUS256_SRVW0_TT2_2_TLDS0_VAW2_VW2_WSGRA0_WSGRB0_WG32_8_1_WGM8
    SolutionIndex: 206
    SolutionNameMin: Cijk_Ailk_Bljk_HSS_BH_MT256x160x32_MI32x32x8x1_SE_1LDSB0_AF0EM8_AMAS3_ASEM1_EPS1_GRVW4_GSU7_ISA908_KLA_LBSPP128_LPB8_LRVW8_MAC_NLCA1_NLCB1_PGR1_PLR5_SIA3_SU0_SUS0_SRVW0_TT2_160_TLDS1_VAW1_VW2_WSGRA1_WSGRB1_WG128_2_1_WGM2
    SolutionIndex: 207
    SolutionNameMin: Cijk_Ailk_Bljk_HSS_BH_MT256x160x32_MI32x32x8x1_SE_1LDSB0_AF0EM8_AMAS3_ASEM1_EPS1_GRVW4_GSU3_ISA908_KLA_LBSPP128_LPB8_LRVW8_MAC_NLCA1_NLCB1_PGR1_PLR5_SIA3_SU0_SUS0_SRVW0_TT2_160_TLDS1_VAW1_VW2_WSGRA1_WSGRB1_WG128_2_1_WGM15
    SolutionIndex: 208
    SolutionNameMin: Cijk_Ailk_Bljk_HSS_BH_MT256x128x32_MI32x32x8x1_SE_1LDSB1_AF0EM8_AMAS3_ASEM1_EPS1_GRVW8_GSU2_ISA908_KLA_LBSPP128_LPB8_LRVW8_MAC_NLCA1_NLCB1_PGR1_PLR5_SIA3_SU0_SUS0_SRVW0_TT4_64_TLDS1_VAW1_VW2_WSGRA1_WSGRB1_WG64_4_1_WGM15
    SolutionIndex: 209
    SolutionNameMin: Cijk_Ailk_Bljk_HSS_BH_MT128x160x64_MI32x32x8x1_SE_1LDSB1_AF0EM8_AMAS3_ASEM1_EPS1_GRVW2_GSU15_ISA908_KLA_LBSPP128_LPB8_LRVW8_MAC_NLCA1_NLCB1_PGR1_PLR9_SIA3_SU0_SUS0_SRVW0_TT1_160_TLDS1_VAW1_VW2_WSGRA1_WSGRB1_WG128_2_1_WGM1
    SolutionIndex: 210
    SolutionNameMin: Cijk_Ailk_Bljk_HSS_BH_MT64x64x32_MI32x32x8x1_SE_1LDSB0_AF0EM1_AMAS3_ASEM1_EPS1_GRVW8_GSU1_ISA908_KLA_LBSPP128_LPB8_LRVW8_MAC_NLCA1_NLCB1_PGR1_PLR5_SIA3_SU0_SUS0_SRVW4_TT1_32_TLDS1_VAW2_VW2_WSGRA1_WSGRB1_WG64_4_1_WGM1
    SolutionIndex: 211
    SolutionNameMin: Cijk_Ailk_Bljk_HSS_BH_MT64x128x32_MI32x32x8x1_SE_1LDSB0_AF0EM8_AMAS3_ASEM1_EPS1_GRVW2_GSU1_ISA908_KLA_LBSPP128_LPB8_LRVW8_MAC_NLCA1_NLCB1_PGR1_PLR5_SIA3_SU32_SUS256_SRVW4_TT1_64_TLDS1_VAW2_VW2_WSGRA1_WSGRB1_WG64_4_1_WGM1
    SolutionIndex: 212
    SolutionNameMin: Cijk_Ailk_Bljk_HSS_BH_MT128x96x32_MI32x32x8x1_SE_1LDSB1_AF0EM8_AMAS3_ASEM1_EPS1_GRVW2_GSU1_ISA908_KLA_LBSPP128_LPB8_LRVW8_MAC_NLCA1_NLCB1_PGR1_PLR5_SIA3_SU32_SUS256_SRVW4_TT1_96_TLDS1_VAW2_VW2_WSGRA1_WSGRB1_WG128_2_1_WGM15
    SolutionIndex: 213
    SolutionNameMin: Cijk_Ailk_Bljk_HSS_BH_MT256x256x32_MI32x32x8x1_SE_1LDSB1_AF0EM8_AMAS3_ASEM1_EPS1_GRVW8_GSU3_ISA908_KLA_LBSPP128_LPB8_LRVW8_MAC_NLCA1_NLCB1_PGR1_PLR5_SIA3_SU32_SUS128_SRVW0_TT4_128_TLDS1_VAW1_VW2_WSGRA1_WSGRB1_WG64_4_1_WGM1
    SolutionIndex: 214
    SolutionNameMin: Cijk_Ailk_Bljk_HSS_BH_MT128x256x32_MI32x32x8x1_SE_1LDSB0_AF0EM4_AMAS3_ASEM1_EPS1_GRVW8_GSU1_ISA908_KLA_LBSPP128_LPB8_LRVW4_MAC_NLCA1_NLCB1_PGR1_PLR1_SIA3_SU16_SUS128_SRVW4_TT2_128_TLDS1_VAW2_VW2_WSGRA1_WSGRB1_WG64_4_1_WGM15
    SolutionIndex: 215
    SolutionNameMin: Cijk_Ailk_Bljk_HSS_BH_MT96x96x32_MI16x16x16x1_SE_1LDSB1_AF0EM1_AMAS3_ASEM1_EPS1_GRVW2_GSU1_ISA908_KLA_LBSPP128_LPB8_LRVW8_MAC_NLCA3_NLCB1_PGR1_PLR2_SIA3_SU32_SUS128_SRVW0_TT3_48_TLDS1_VAW2_VW2_WSGRA1_WSGRB1_WG32_8_1_WGM15
    SolutionIndex: 216
    SolutionNameMin: Cijk_Ailk_Bljk_HSS_BH_MT64x128x32_MI32x32x8x1_SE_1LDSB0_AF0EM1_AMAS3_ASEM1_EPS1_GRVW4_GSU1_ISA908_KLA_LBSPP128_LPB8_LRVW8_MAC_NLCA1_NLCB1_PGR1_PLR5_SIA3_SU0_SUS0_SRVW4_TT1_64_TLDS1_VAW2_VW2_WSGRA1_WSGRB1_WG64_4_1_WGM2
    SolutionIndex: 217
    SolutionNameMin: Cijk_Ailk_Bljk_HSS_BH_MT64x64x32_MI32x32x8x1_SE_1LDSB0_AF0EM1_AMAS3_ASEM1_EPS1_GRVW4_GSU1_ISA908_KLA_LBSPP128_LPB8_LRVW8_MAC_NLCA1_NLCB1_PGR1_PLR5_SIA3_SU0_SUS0_SRVW4_TT1_32_TLDS1_VAW2_VW2_WSGRA1_WSGRB1_WG64_4_1_WGM15
    SolutionIndex: 218
    SolutionNameMin: Cijk_Ailk_Bljk_HSS_BH_MT64x64x32_MI32x32x8x1_SE_1LDSB0_AF0EM1_AMAS3_ASEM1_EPS1_GRVW4_GSU1_ISA908_KLA_LBSPP128_LPB8_LRVW8_MAC_NLCA1_NLCB1_PGR1_PLR5_SIA3_SU0_SUS0_SRVW4_TT1_32_TLDS1_VAW2_VW2_WSGRA1_WSGRB1_WG64_4_1_WGM2
    SolutionIndex: 219
    SolutionNameMin: Cijk_Ailk_Bljk_HSS_BH_MT128x160x32_MI32x32x8x1_SE_1LDSB1_AF0EM1_AMAS3_ASEM1_EPS1_GRVW2_GSU1_ISA908_KLA_LBSPP128_LPB8_LRVW8_MAC_NLCA1_NLCB1_PGR1_PLR5_SIA3_SU0_SUS0_SRVW4_TT1_160_TLDS1_VAW2_VW2_WSGRA1_WSGRB1_WG128_2_1_WGM15
    SolutionIndex: 220
    SolutionNameMin: Cijk_Ailk_Bljk_HSS_BH_MT128x96x32_MI32x32x8x1_SE_1LDSB0_AF0EM1_AMAS3_ASEM1_EPS1_GRVW4_GSU1_ISA908_KLA_LBSPP128_LPB8_LRVW8_MAC_NLCA1_NLCB1_PGR1_PLR5_SIA3_SU0_SUS0_SRVW4_TT1_96_TLDS1_VAW2_VW2_WSGRA1_WSGRB1_WG128_2_1_WGM1
    SolutionIndex: 221
    SolutionNameMin: Cijk_Ailk_Bljk_HSS_BH_MT64x32x32_MI16x16x16x1_SE_1LDSB1_AF0EM1_AMAS3_ASEM1_EPS1_GRVW2_GSU1_ISA908_KLA_LBSPP128_LPB8_LRVW8_MAC_NLCA1_NLCB1_PGR1_PLR2_SIA3_SU0_SUS0_SRVW4_TT2_16_TLDS1_VAW2_VW2_WSGRA1_WSGRB1_WG32_8_1_WGM2
    SolutionIndex: 222
    SolutionNameMin: Cijk_Ailk_Bljk_HSS_BH_MT64x128x32_MI32x32x8x1_SE_1LDSB0_AF0EM1_AMAS3_ASEM1_EPS1_GRVW8_GSU1_ISA908_KLA_LBSPP128_LPB8_LRVW8_MAC_NLCA1_NLCB1_PGR1_PLR5_SIA3_SU0_SUS0_SRVW4_TT1_64_TLDS1_VAW2_VW2_WSGRA1_WSGRB1_WG64_4_1_WGM15
    SolutionIndex: 223
    SolutionNameMin: Cijk_Ailk_Bljk_HSS_BH_MT128x96x32_MI32x32x8x1_SE_1LDSB0_AF0EM1_AMAS3_ASEM1_EPS1_GRVW4_GSU1_ISA908_KLA_LBSPP128_LPB8_LRVW8_MAC_NLCA1_NLCB1_PGR1_PLR5_SIA3_SU0_SUS0_SRVW4_TT1_96_TLDS1_VAW2_VW2_WSGRA1_WSGRB1_WG128_2_1_WGM15
    SolutionIndex: 224
    SolutionNameMin: Cijk_Ailk_Bljk_HSS_BH_MT64x128x64_MI32x32x8x1_SE_1LDSB0_AF0EM1_AMAS3_ASEM1_EPS1_GRVW2_GSU1_ISA908_KLA_LBSPP128_LPB8_LRVW8_MAC_NLCA1_NLCB1_PGR1_PLR9_SIA3_SU0_SUS0_SRVW4_TT1_64_TLDS1_VAW2_VW2_WSGRA1_WSGRB1_WG64_4_1_WGM2
- - - [512, 1, 1, 500000]
    - [0, 0.518]
  - - [512, 2, 1, 500000]
    - [0, 1.049]
  - - [512, 4, 1, 500000]
    - [0, 2.105]
  - - [512, 8, 1, 500000]
    - [0, 4.197]
  - - [512, 16, 1, 500000]
    - [0, 8.346]
  - - [1024, 1, 1, 500000]
    - [1, 0.737]
  - - [1024, 2, 1, 500000]
    - [1, 1.449]
  - - [1024, 4, 1, 500000]
    - [1, 2.87]
  - - [1024, 8, 1, 500000]
    - [1, 5.665]
  - - [1024, 16, 1, 500000]
    - [1, 11.127]
  - - [64, 1, 1, 1216]
    - [2, 0.004]
  - - [128, 1, 1, 1024]
    - [3, 0.008]
  - - [128, 1, 1, 1408]
    - [4, 0.01]
  - - [512, 1, 1, 512]
    - [5, 0.02]
  - - [3072, 1, 1, 128]
    - [6, 0.047]
  - - [512, 2, 1, 512]
    - [7, 0.042]
  - - [1024, 1, 1, 512]
    - [7, 0.041]
  - - [4224, 1, 1, 128]
    - [8, 0.06]
  - - [512, 4, 1, 512]
    - [3, 0.082]
  - - [1024, 2, 1, 512]
    - [7, 0.084]
  - - [1024, 4, 1, 512]
    - [3, 0.16]
  - - [3072, 1, 1, 1024]
    - [9, 0.176]
  - - [512, 16, 1, 512]
    - [7, 0.314]
  - - [3072, 2, 1, 1024]
    - [9, 0.357]
  - - [4608, 1, 1, 1536]
    - [7, 0.288]
  - - [1024, 16, 1, 512]
    - [3, 0.628]
  - - [3072, 4, 1, 1024]
    - [10, 0.714]
  - - [4608, 2, 1, 1536]
    - [7, 0.573]
  - - [6144, 1, 1, 2560]
    - [7, 0.446]
  - - [7680, 1, 1, 2560]
    - [11, 0.532]
  - - [8448, 1, 1, 2816]
    - [12, 0.457]
  - - [4608, 4, 1, 1536]
    - [7, 1.157]
  - - [6144, 2, 1, 2560]
    - [7, 0.868]
  - - [7680, 2, 1, 2560]
    - [11, 1.054]
  - - [8448, 2, 1, 2816]
    - [12, 0.93]
  - - [1760, 16, 1, 1760]
    - [4, 1.791]
  - - [3072, 16, 1, 1024]
    - [3, 2.771]
  - - [6144, 4, 1, 2560]
    - [11, 1.697]
  - - [2048, 16, 1, 2048]
    - [13, 2.639]
  - - [7680, 4, 1, 2560]
    - [7, 2.115]
  - - [8448, 4, 1, 2816]
    - [12, 1.855]
  - - [2560, 16, 1, 2560]
    - [14, 3.848]
  - - [4608, 16, 1, 1536]
    - [7, 4.398]
  - - [6144, 16, 1, 2560]
    - [7, 6.597]
  - - [4096, 16, 1, 4096]
    - [13, 5.266]
  - - [7680, 16, 1, 2560]
    - [7, 8.021]
  - - [8448, 16, 1, 2816]
    - [12, 7.196]
  - - [64, 64, 1, 256]
    - [5, 0.097]
  - - [128, 64, 1, 256]
    - [7, 0.196]
  - - [64, 128, 1, 256]
    - [5, 0.2]
  - - [128, 128, 1, 256]
    - [15, 0.396]
  - - [64, 256, 1, 256]
    - [5, 0.396]
  - - [128, 256, 1, 256]
    - [5, 0.793]
  - - [64, 448, 1, 256]
    - [7, 0.694]
  - - [128, 448, 1, 256]
    - [7, 1.334]
  - - [64, 704, 1, 256]
    - [5, 1.058]
  - - [128, 704, 1, 256]
    - [5, 2.056]
  - - [64, 1024, 1, 256]
    - [8, 1.495]
  - - [128, 1024, 1, 256]
    - [11, 2.935]
  - - [64, 1408, 1, 256]
    - [7, 2.096]
  - - [128, 1408, 1, 256]
    - [7, 4.035]
  - - [64, 1856, 1, 256]
    - [7, 2.763]
  - - [128, 1856, 1, 256]
    - [5, 5.174]
  - - [64, 2368, 1, 256]
    - [7, 3.393]
  - - [128, 2368, 1, 256]
    - [8, 6.426]
  - - [64, 2944, 1, 256]
    - [7, 4.219]
  - - [128, 2944, 1, 256]
    - [12, 7.586]
  - - [64, 3584, 1, 256]
    - [15, 4.906]
  - - [128, 3584, 1, 256]
    - [6, 9.236]
  - - [64, 4288, 1, 256]
    - [16, 5.818]
  - - [128, 4288, 1, 256]
    - [6, 9.669]
  - - [64, 5056, 1, 256]
    - [12, 6.8]
  - - [128, 5056, 1, 256]
    - [17, 10.996]
  - - [64, 5888, 1, 256]
    - [8, 7.716]
  - - [128, 5888, 1, 256]
    - [18, 11.356]
  - - [64, 6784, 1, 256]
    - [19, 8.668]
  - - [128, 6784, 1, 256]
    - [17, 13.002]
  - - [64, 64, 1, 1280]
    - [4, 0.292]
  - - [128, 64, 1, 1280]
    - [4, 0.577]
  - - [64, 128, 1, 1280]
    - [4, 0.577]
  - - [128, 128, 1, 1280]
    - [20, 1.096]
  - - [64, 256, 1, 1280]
    - [3, 1.109]
  - - [128, 256, 1, 1280]
    - [3, 2.323]
  - - [64, 448, 1, 1280]
    - [10, 1.94]
  - - [128, 448, 1, 1280]
    - [10, 3.948]
  - - [64, 704, 1, 1280]
    - [3, 3.102]
  - - [128, 704, 1, 1280]
    - [21, 6.168]
  - - [64, 1024, 1, 1280]
    - [22, 4.591]
  - - [128, 1024, 1, 1280]
    - [23, 7.477]
  - - [64, 1408, 1, 1280]
    - [3, 6.239]
  - - [128, 1408, 1, 1280]
    - [24, 10.088]
  - - [64, 1856, 1, 1280]
    - [3, 7.994]
  - - [128, 1856, 1, 1280]
    - [7, 12.935]
  - - [64, 2368, 1, 1280]
    - [25, 8.645]
  - - [128, 2368, 1, 1280]
    - [26, 14.408]
  - - [64, 2944, 1, 1280]
    - [7, 10.748]
  - - [128, 2944, 1, 1280]
    - [27, 17.912]
  - - [64, 3584, 1, 1280]
    - [7, 12.96]
  - - [128, 3584, 1, 1280]
    - [27, 20.894]
  - - [64, 4288, 1, 1280]
    - [27, 13.149]
  - - [128, 4288, 1, 1280]
    - [28, 22.137]
  - - [64, 5056, 1, 1280]
    - [27, 15.757]
  - - [128, 5056, 1, 1280]
    - [29, 24.15]
  - - [64, 5888, 1, 1280]
    - [26, 18.056]
  - - [128, 5888, 1, 1280]
    - [30, 26.092]
  - - [64, 6784, 1, 1280]
    - [26, 20.476]
  - - [128, 6784, 1, 1280]
    - [31, 30.238]
  - - [64, 64, 1, 3328]
    - [13, 0.616]
  - - [128, 64, 1, 3328]
    - [32, 1.221]
  - - [64, 128, 1, 3328]
    - [13, 1.165]
  - - [128, 128, 1, 3328]
    - [32, 2.219]
  - - [64, 256, 1, 3328]
    - [4, 2.268]
  - - [128, 256, 1, 3328]
    - [13, 4.149]
  - - [64, 448, 1, 3328]
    - [13, 3.768]
  - - [128, 448, 1, 3328]
    - [32, 7.115]
  - - [64, 704, 1, 3328]
    - [13, 5.658]
  - - [128, 704, 1, 3328]
    - [14, 9.952]
  - - [64, 1024, 1, 3328]
    - [13, 7.731]
  - - [128, 1024, 1, 3328]
    - [32, 11.277]
  - - [64, 1408, 1, 3328]
    - [14, 9.418]
  - - [128, 1408, 1, 3328]
    - [25, 13.69]
  - - [64, 1856, 1, 3328]
    - [21, 11.383]
  - - [128, 1856, 1, 3328]
    - [24, 17.328]
  - - [64, 2368, 1, 3328]
    - [23, 12.454]
  - - [128, 2368, 1, 3328]
    - [33, 19.265]
  - - [64, 2944, 1, 3328]
    - [25, 15.817]
  - - [128, 2944, 1, 3328]
    - [34, 22.657]
  - - [64, 3584, 1, 3328]
    - [24, 19.0]
  - - [128, 3584, 1, 3328]
    - [34, 27.743]
  - - [64, 4288, 1, 3328]
    - [27, 16.825]
  - - [128, 4288, 1, 3328]
    - [35, 28.73]
  - - [64, 5056, 1, 3328]
    - [27, 19.123]
  - - [128, 5056, 1, 3328]
    - [35, 32.934]
  - - [64, 5888, 1, 3328]
    - [27, 22.396]
  - - [128, 5888, 1, 3328]
    - [36, 34.878]
  - - [64, 6784, 1, 3328]
    - [26, 25.37]
  - - [128, 6784, 1, 3328]
    - [37, 39.138]
  - - [256, 64, 1, 256]
    - [7, 0.409]
  - - [448, 64, 1, 256]
    - [7, 0.687]
  - - [704, 64, 1, 256]
    - [3, 1.048]
  - - [1024, 64, 1, 256]
    - [7, 1.602]
  - - [1408, 64, 1, 256]
    - [15, 2.117]
  - - [1856, 64, 1, 256]
    - [3, 2.71]
  - - [2368, 64, 1, 256]
    - [7, 3.425]
  - - [2944, 64, 1, 256]
    - [38, 4.141]
  - - [3584, 64, 1, 256]
    - [5, 5.234]
  - - [4288, 64, 1, 256]
    - [12, 5.87]
  - - [5056, 64, 1, 256]
    - [12, 7.047]
  - - [5888, 64, 1, 256]
    - [6, 7.586]
  - - [6784, 64, 1, 256]
    - [6, 8.457]
  - - [256, 128, 1, 256]
    - [5, 0.77]
  - - [448, 128, 1, 256]
    - [2, 1.334]
  - - [704, 128, 1, 256]
    - [15, 2.076]
  - - [1024, 128, 1, 256]
    - [6, 2.881]
  - - [1408, 128, 1, 256]
    - [7, 3.998]
  - - [1856, 128, 1, 256]
    - [5, 5.222]
  - - [2368, 128, 1, 256]
    - [8, 6.37]
  - - [2944, 128, 1, 256]
    - [8, 7.4]
  - - [3584, 128, 1, 256]
    - [27, 8.863]
  - - [4288, 128, 1, 256]
    - [8, 9.669]
  - - [5056, 128, 1, 256]
    - [39, 10.767]
  - - [5888, 128, 1, 256]
    - [18, 11.649]
  - - [6784, 128, 1, 256]
    - [18, 12.842]
  - - [256, 64, 1, 1280]
    - [20, 1.084]
  - - [448, 64, 1, 1280]
    - [3, 1.985]
  - - [704, 64, 1, 1280]
    - [10, 3.156]
  - - [1024, 64, 1, 1280]
    - [3, 4.435]
  - - [1408, 64, 1, 1280]
    - [10, 5.898]
  - - [1856, 64, 1, 1280]
    - [40, 8.039]
  - - [2368, 64, 1, 1280]
    - [25, 8.728]
  - - [2944, 64, 1, 1280]
    - [7, 10.646]
  - - [3584, 64, 1, 1280]
    - [7, 12.546]
  - - [4288, 64, 1, 1280]
    - [34, 12.993]
  - - [5056, 64, 1, 1280]
    - [12, 14.794]
  - - [5888, 64, 1, 1280]
    - [26, 17.295]
  - - [6784, 64, 1, 1280]
    - [26, 20.237]
  - - [256, 128, 1, 1280]
    - [3, 2.295]
  - - [448, 128, 1, 1280]
    - [21, 3.881]
  - - [704, 128, 1, 1280]
    - [10, 5.931]
  - - [1024, 128, 1, 1280]
    - [41, 7.548]
  - - [1408, 128, 1, 1280]
    - [25, 10.088]
  - - [1856, 128, 1, 1280]
    - [7, 13.175]
  - - [2368, 128, 1, 1280]
    - [26, 14.351]
  - - [2944, 128, 1, 1280]
    - [27, 17.984]
  - - [3584, 128, 1, 1280]
    - [27, 21.299]
  - - [4288, 128, 1, 1280]
    - [29, 21.277]
  - - [5056, 128, 1, 1280]
    - [29, 24.302]
  - - [5888, 128, 1, 1280]
    - [29, 27.44]
  - - [6784, 128, 1, 1280]
    - [29, 30.591]
  - - [256, 64, 1, 3328]
    - [13, 2.278]
  - - [448, 64, 1, 3328]
    - [4, 3.615]
  - - [704, 64, 1, 3328]
    - [13, 5.658]
  - - [1024, 64, 1, 3328]
    - [13, 7.702]
  - - [1408, 64, 1, 3328]
    - [14, 9.418]
  - - [1856, 64, 1, 3328]
    - [20, 11.279]
  - - [2368, 64, 1, 3328]
    - [25, 12.861]
  - - [2944, 64, 1, 3328]
    - [23, 14.313]
  - - [3584, 64, 1, 3328]
    - [42, 16.929]
  - - [4288, 64, 1, 3328]
    - [43, 16.5]
  - - [5056, 64, 1, 3328]
    - [34, 19.159]
  - - [5888, 64, 1, 3328]
    - [34, 22.019]
  - - [6784, 64, 1, 3328]
    - [27, 24.321]
  - - [256, 128, 1, 3328]
    - [4, 4.149]
  - - [448, 128, 1, 3328]
    - [13, 7.087]
  - - [704, 128, 1, 3328]
    - [14, 9.418]
  - - [1024, 128, 1, 3328]
    - [32, 11.063]
  - - [1408, 128, 1, 3328]
    - [25, 14.246]
  - - [1856, 128, 1, 3328]
    - [25, 18.875]
  - - [2368, 128, 1, 3328]
    - [33, 20.611]
  - - [2944, 128, 1, 3328]
    - [34, 22.613]
  - - [3584, 128, 1, 3328]
    - [43, 26.459]
  - - [4288, 128, 1, 3328]
    - [29, 26.38]
  - - [5056, 128, 1, 3328]
    - [44, 30.401]
  - - [5888, 128, 1, 3328]
    - [44, 34.267]
  - - [6784, 128, 1, 3328]
    - [45, 37.719]
  - - [256, 256, 1, 256]
    - [5, 1.57]
  - - [448, 256, 1, 256]
    - [3, 2.568]
  - - [256, 448, 1, 256]
    - [7, 2.668]
  - - [448, 448, 1, 256]
    - [5, 4.293]
  - - [256, 256, 1, 1280]
    - [40, 4.538]
  - - [448, 256, 1, 1280]
    - [22, 7.466]
  - - [256, 448, 1, 1280]
    - [3, 7.59]
  - - [448, 448, 1, 1280]
    - [25, 11.394]
  - - [256, 256, 1, 3328]
    - [13, 7.79]
  - - [448, 256, 1, 3328]
    - [3, 10.791]
  - - [256, 448, 1, 3328]
    - [40, 10.506]
  - - [448, 448, 1, 3328]
    - [23, 16.669]
  - - [512, 32, 1, 512]
    - [40, 0.643]
  - - [1024, 32, 1, 512]
    - [15, 1.256]
  - - [1760, 32, 1, 1760]
    - [21, 3.568]
  - - [3072, 32, 1, 1024]
    - [10, 5.292]
  - - [2048, 32, 1, 2048]
    - [21, 5.148]
  - - [1760, 64, 1, 1760]
    - [3, 6.771]
  - - [3072, 64, 1, 1024]
    - [23, 9.516]
  - - [2560, 32, 1, 2560]
    - [14, 7.378]
  - - [4608, 32, 1, 1536]
    - [41, 8.378]
  - - [128, 1500, 1, 1280]
    - [25, 11.165]
  - - [2048, 64, 1, 2048]
    - [42, 8.845]
  - - [176, 1500, 1, 1408]
    - [26, 12.884]
  - - [1760, 128, 1, 1760]
    - [5, 12.578]
  - - [3072, 128, 1, 1024]
    - [34, 15.967]
  - - [2560, 64, 1, 2560]
    - [25, 11.931]
  - - [6144, 32, 1, 2560]
    - [46, 12.799]
  - - [2048, 128, 1, 2048]
    - [34, 13.841]
  - - [4096, 32, 1, 4096]
    - [13, 9.588]
  - - [7680, 32, 1, 2560]
    - [7, 15.534]
  - - [8448, 32, 1, 2816]
    - [47, 13.467]
  - - [2560, 128, 1, 2560]
    - [34, 19.147]
  - - [4096, 64, 1, 4096]
    - [34, 16.129]
  - - [7680, 64, 1, 2560]
    - [27, 25.324]
  - - [4096, 128, 1, 4096]
    - [31, 25.216]
  - - [7680, 128, 1, 2560]
    - [31, 39.715]
  - - [704, 256, 1, 256]
    - [7, 3.998]
  - - [1024, 256, 1, 256]
    - [8, 5.509]
  - - [1408, 256, 1, 256]
    - [8, 7.509]
  - - [1856, 256, 1, 256]
    - [8, 8.893]
  - - [2368, 256, 1, 256]
    - [8, 10.448]
  - - [2944, 256, 1, 256]
    - [48, 11.356]
  - - [3584, 256, 1, 256]
    - [18, 13.568]
  - - [4288, 256, 1, 256]
    - [49, 13.487]
  - - [5056, 256, 1, 256]
    - [50, 15.053]
  - - [5888, 256, 1, 256]
    - [51, 17.196]
  - - [6784, 256, 1, 256]
    - [52, 18.912]
  - - [704, 448, 1, 256]
    - [12, 6.458]
  - - [1024, 448, 1, 256]
    - [12, 8.723]
  - - [1408, 448, 1, 256]
    - [17, 10.951]
  - - [1856, 448, 1, 256]
    - [18, 12.528]
  - - [2368, 448, 1, 256]
    - [53, 14.278]
  - - [2944, 448, 1, 256]
    - [50, 15.878]
  - - [3584, 448, 1, 256]
    - [50, 17.727]
  - - [4288, 448, 1, 256]
    - [54, 18.119]
  - - [5056, 448, 1, 256]
    - [55, 20.478]
  - - [5888, 448, 1, 256]
    - [55, 22.174]
  - - [6784, 448, 1, 256]
    - [56, 21.166]
  - - [256, 704, 1, 256]
    - [7, 3.998]
  - - [448, 704, 1, 256]
    - [12, 6.403]
  - - [704, 704, 1, 256]
    - [8, 8.928]
  - - [1024, 704, 1, 256]
    - [17, 11.669]
  - - [1408, 704, 1, 256]
    - [57, 13.267]
  - - [1856, 704, 1, 256]
    - [58, 15.652]
  - - [2368, 704, 1, 256]
    - [58, 18.072]
  - - [2944, 704, 1, 256]
    - [59, 19.171]
  - - [3584, 704, 1, 256]
    - [55, 21.435]
  - - [4288, 704, 1, 256]
    - [56, 20.842]
  - - [5056, 704, 1, 256]
    - [50, 21.865]
  - - [5888, 704, 1, 256]
    - [60, 23.311]
  - - [6784, 704, 1, 256]
    - [61, 22.93]
  - - [256, 1024, 1, 256]
    - [8, 5.558]
  - - [448, 1024, 1, 256]
    - [12, 8.935]
  - - [704, 1024, 1, 256]
    - [17, 11.911]
  - - [1024, 1024, 1, 256]
    - [53, 13.803]
  - - [1408, 1024, 1, 256]
    - [50, 16.85]
  - - [1856, 1024, 1, 256]
    - [51, 19.883]
  - - [2368, 1024, 1, 256]
    - [62, 20.822]
  - - [2944, 1024, 1, 256]
    - [56, 20.814]
  - - [3584, 1024, 1, 256]
    - [60, 22.203]
  - - [4288, 1024, 1, 256]
    - [63, 23.908]
  - - [5056, 1024, 1, 256]
    - [56, 23.945]
  - - [5888, 1024, 1, 256]
    - [64, 24.318]
  - - [6784, 1024, 1, 256]
    - [65, 26.168]
  - - [256, 1408, 1, 256]
    - [6, 7.444]
  - - [448, 1408, 1, 256]
    - [17, 10.951]
  - - [704, 1408, 1, 256]
    - [66, 13.341]
  - - [1024, 1408, 1, 256]
    - [52, 16.141]
  - - [1408, 1408, 1, 256]
    - [56, 19.229]
  - - [1856, 1408, 1, 256]
    - [55, 21.89]
  - - [2368, 1408, 1, 256]
    - [60, 20.534]
  - - [2944, 1408, 1, 256]
    - [65, 23.815]
  - - [3584, 1408, 1, 256]
    - [56, 23.294]
  - - [4288, 1408, 1, 256]
    - [60, 26.736]
  - - [5056, 1408, 1, 256]
    - [65, 26.816]
  - - [5888, 1408, 1, 256]
    - [60, 27.357]
  - - [6784, 1408, 1, 256]
    - [67, 27.941]
  - - [256, 1856, 1, 256]
    - [68, 9.106]
  - - [448, 1856, 1, 256]
    - [18, 12.608]
  - - [704, 1856, 1, 256]
    - [69, 15.971]
  - - [1024, 1856, 1, 256]
    - [69, 20.236]
  - - [1408, 1856, 1, 256]
    - [59, 21.814]
  - - [1856, 1856, 1, 256]
    - [65, 21.325]
  - - [2368, 1856, 1, 256]
    - [63, 24.039]
  - - [2944, 1856, 1, 256]
    - [60, 24.332]
  - - [3584, 1856, 1, 256]
    - [64, 26.254]
  - - [4288, 1856, 1, 256]
    - [60, 27.159]
  - - [5056, 1856, 1, 256]
    - [63, 28.279]
  - - [5888, 1856, 1, 256]
    - [60, 29.583]
  - - [6784, 1856, 1, 256]
    - [60, 29.372]
  - - [256, 2368, 1, 256]
    - [17, 10.679]
  - - [448, 2368, 1, 256]
    - [57, 14.441]
  - - [704, 2368, 1, 256]
    - [50, 18.405]
  - - [1024, 2368, 1, 256]
    - [55, 20.822]
  - - [1408, 2368, 1, 256]
    - [60, 20.64]
  - - [1856, 2368, 1, 256]
    - [63, 23.398]
  - - [2368, 2368, 1, 256]
    - [60, 25.157]
  - - [2944, 2368, 1, 256]
    - [67, 27.069]
  - - [3584, 2368, 1, 256]
    - [60, 27.701]
  - - [4288, 2368, 1, 256]
    - [60, 29.133]
  - - [5056, 2368, 1, 256]
    - [63, 29.358]
  - - [5888, 2368, 1, 256]
    - [60, 29.613]
  - - [6784, 2368, 1, 256]
    - [60, 29.696]
  - - [256, 2944, 1, 256]
    - [18, 11.501]
  - - [448, 2944, 1, 256]
    - [69, 15.191]
  - - [704, 2944, 1, 256]
    - [54, 19.023]
  - - [1024, 2944, 1, 256]
    - [56, 20.995]
  - - [1408, 2944, 1, 256]
    - [70, 23.987]
  - - [1856, 2944, 1, 256]
    - [62, 24.468]
  - - [2368, 2944, 1, 256]
    - [65, 26.68]
  - - [2944, 2944, 1, 256]
    - [65, 27.539]
  - - [3584, 2944, 1, 256]
    - [60, 29.704]
  - - [4288, 2944, 1, 256]
    - [60, 30.426]
  - - [5056, 2944, 1, 256]
    - [60, 31.254]
  - - [5888, 2944, 1, 256]
    - [60, 30.335]
  - - [6784, 2944, 1, 256]
    - [60, 30.731]
  - - [256, 3584, 1, 256]
    - [71, 13.403]
  - - [448, 3584, 1, 256]
    - [69, 18.145]
  - - [704, 3584, 1, 256]
    - [72, 21.21]
  - - [1024, 3584, 1, 256]
    - [73, 21.763]
  - - [1408, 3584, 1, 256]
    - [56, 23.798]
  - - [1856, 3584, 1, 256]
    - [67, 26.211]
  - - [2368, 3584, 1, 256]
    - [60, 27.292]
  - - [2944, 3584, 1, 256]
    - [60, 29.122]
  - - [3584, 3584, 1, 256]
    - [60, 30.589]
  - - [4288, 3584, 1, 256]
    - [65, 29.549]
  - - [5056, 3584, 1, 256]
    - [60, 30.274]
  - - [5888, 3584, 1, 256]
    - [60, 31.519]
  - - [6784, 3584, 1, 256]
    - [60, 30.722]
  - - [256, 4288, 1, 256]
    - [53, 14.775]
  - - [448, 4288, 1, 256]
    - [69, 19.419]
  - - [704, 4288, 1, 256]
    - [56, 21.588]
  - - [1024, 4288, 1, 256]
    - [73, 24.127]
  - - [1408, 4288, 1, 256]
    - [60, 26.109]
  - - [1856, 4288, 1, 256]
    - [70, 27.006]
  - - [2368, 4288, 1, 256]
    - [60, 29.486]
  - - [2944, 4288, 1, 256]
    - [60, 29.974]
  - - [3584, 4288, 1, 256]
    - [60, 31.388]
  - - [4288, 4288, 1, 256]
    - [60, 31.577]
  - - [5056, 4288, 1, 256]
    - [60, 32.544]
  - - [5888, 4288, 1, 256]
    - [60, 32.089]
  - - [6784, 4288, 1, 256]
    - [60, 31.75]
  - - [256, 5056, 1, 256]
    - [69, 14.766]
  - - [448, 5056, 1, 256]
    - [55, 20.248]
  - - [704, 5056, 1, 256]
    - [70, 21.978]
  - - [1024, 5056, 1, 256]
    - [59, 23.716]
  - - [1408, 5056, 1, 256]
    - [67, 26.816]
  - - [1856, 5056, 1, 256]
    - [60, 27.927]
  - - [2368, 5056, 1, 256]
    - [60, 29.419]
  - - [2944, 5056, 1, 256]
    - [60, 31.144]
  - - [3584, 5056, 1, 256]
    - [60, 30.943]
  - - [4288, 5056, 1, 256]
    - [60, 31.709]
  - - [5056, 5056, 1, 256]
    - [60, 32.891]
  - - [5888, 5056, 1, 256]
    - [60, 32.566]
  - - [6784, 5056, 1, 256]
    - [60, 32.415]
  - - [256, 5888, 1, 256]
    - [69, 17.196]
  - - [448, 5888, 1, 256]
    - [56, 19.687]
  - - [704, 5888, 1, 256]
    - [63, 23.203]
  - - [1024, 5888, 1, 256]
    - [60, 24.692]
  - - [1408, 5888, 1, 256]
    - [60, 27.357]
  - - [1856, 5888, 1, 256]
    - [70, 28.458]
  - - [2368, 5888, 1, 256]
    - [60, 29.771]
  - - [2944, 5888, 1, 256]
    - [60, 31.581]
  - - [3584, 5888, 1, 256]
    - [60, 31.977]
  - - [4288, 5888, 1, 256]
    - [60, 32.59]
  - - [5056, 5888, 1, 256]
    - [60, 32.836]
  - - [5888, 5888, 1, 256]
    - [60, 33.064]
  - - [6784, 5888, 1, 256]
    - [60, 32.264]
  - - [256, 6784, 1, 256]
    - [69, 19.086]
  - - [448, 6784, 1, 256]
    - [56, 21.8]
  - - [704, 6784, 1, 256]
    - [62, 23.115]
  - - [1024, 6784, 1, 256]
    - [64, 25.763]
  - - [1408, 6784, 1, 256]
    - [60, 27.906]
  - - [1856, 6784, 1, 256]
    - [60, 30.624]
  - - [2368, 6784, 1, 256]
    - [60, 31.138]
  - - [2944, 6784, 1, 256]
    - [65, 30.77]
  - - [3584, 6784, 1, 256]
    - [60, 32.005]
  - - [4288, 6784, 1, 256]
    - [60, 32.688]
  - - [5056, 6784, 1, 256]
    - [60, 33.609]
  - - [5888, 6784, 1, 256]
    - [60, 32.472]
  - - [6784, 6784, 1, 256]
    - [60, 32.766]
  - - [704, 256, 1, 1280]
    - [25, 10.48]
  - - [1024, 256, 1, 1280]
    - [74, 11.894]
  - - [1408, 256, 1, 1280]
    - [26, 17.134]
  - - [1856, 256, 1, 1280]
    - [26, 21.397]
  - - [2368, 256, 1, 1280]
    - [29, 22.98]
  - - [2944, 256, 1, 1280]
    - [44, 28.39]
  - - [3584, 256, 1, 1280]
    - [31, 32.136]
  - - [4288, 256, 1, 1280]
    - [75, 34.604]
  - - [5056, 256, 1, 1280]
    - [76, 38.664]
  - - [5888, 256, 1, 1280]
    - [50, 38.417]
  - - [6784, 256, 1, 1280]
    - [50, 40.474]
  - - [704, 448, 1, 1280]
    - [26, 14.816]
  - - [1024, 448, 1, 1280]
    - [34, 19.983]
  - - [1408, 448, 1, 1280]
    - [29, 25.441]
  - - [1856, 448, 1, 1280]
    - [29, 30.836]
  - - [2368, 448, 1, 1280]
    - [77, 34.532]
  - - [2944, 448, 1, 1280]
    - [75, 38.628]
  - - [3584, 448, 1, 1280]
    - [50, 38.699]
  - - [4288, 448, 1, 1280]
    - [78, 38.74]
  - - [5056, 448, 1, 1280]
    - [79, 43.482]
  - - [5888, 448, 1, 1280]
    - [55, 47.875]
  - - [6784, 448, 1, 1280]
    - [80, 45.225]
  - - [256, 704, 1, 1280]
    - [42, 10.183]
  - - [448, 704, 1, 1280]
    - [26, 14.816]
  - - [704, 704, 1, 1280]
    - [29, 19.989]
  - - [1024, 704, 1, 1280]
    - [29, 26.986]
  - - [1408, 704, 1, 1280]
    - [75, 30.761]
  - - [1856, 704, 1, 1280]
    - [75, 39.129]
  - - [2368, 704, 1, 1280]
    - [81, 40.18]
  - - [2944, 704, 1, 1280]
    - [78, 42.294]
  - - [3584, 704, 1, 1280]
    - [55, 46.214]
  - - [4288, 704, 1, 1280]
    - [82, 45.831]
  - - [5056, 704, 1, 1280]
    - [83, 51.997]
  - - [5888, 704, 1, 1280]
    - [84, 49.604]
  - - [6784, 704, 1, 1280]
    - [55, 46.398]
  - - [256, 1024, 1, 1280]
    - [27, 13.03]
  - - [448, 1024, 1, 1280]
    - [26, 21.217]
  - - [704, 1024, 1, 1280]
    - [44, 26.327]
  - - [1024, 1024, 1, 1280]
    - [75, 31.639]
  - - [1408, 1024, 1, 1280]
    - [52, 35.683]
  - - [1856, 1024, 1, 1280]
    - [85, 42.395]
  - - [2368, 1024, 1, 1280]
    - [55, 45.456]
  - - [2944, 1024, 1, 1280]
    - [86, 45.309]
  - - [3584, 1024, 1, 1280]
    - [87, 51.842]
  - - [4288, 1024, 1, 1280]
    - [88, 52.703]
  - - [5056, 1024, 1, 1280]
    - [55, 49.773]
  - - [5888, 1024, 1, 1280]
    - [89, 51.222]
  - - [6784, 1024, 1, 1280]
    - [86, 54.282]
  - - [256, 1408, 1, 1280]
    - [27, 16.735]
  - - [448, 1408, 1, 1280]
    - [44, 24.14]
  - - [704, 1408, 1, 1280]
    - [75, 31.663]
  - - [1024, 1408, 1, 1280]
    - [76, 39.979]
  - - [1408, 1408, 1, 1280]
    - [54, 39.513]
  - - [1856, 1408, 1, 1280]
    - [55, 48.011]
  - - [2368, 1408, 1, 1280]
    - [90, 48.943]
  - - [2944, 1408, 1, 1280]
    - [70, 50.979]
  - - [3584, 1408, 1, 1280]
    - [55, 49.265]
  - - [4288, 1408, 1, 1280]
    - [91, 52.105]
  - - [5056, 1408, 1, 1280]
    - [92, 58.168]
  - - [5888, 1408, 1, 1280]
    - [84, 54.177]
  - - [6784, 1408, 1, 1280]
    - [67, 58.797]
  - - [256, 1856, 1, 1280]
    - [34, 21.237]
  - - [448, 1856, 1, 1280]
    - [36, 31.028]
  - - [704, 1856, 1, 1280]
    - [76, 40.866]
  - - [1024, 1856, 1, 1280]
    - [93, 39.87]
  - - [1408, 1856, 1, 1280]
    - [55, 47.501]
  - - [1856, 1856, 1, 1280]
    - [94, 50.444]
  - - [2368, 1856, 1, 1280]
    - [88, 52.489]
  - - [2944, 1856, 1, 1280]
    - [95, 50.896]
  - - [3584, 1856, 1, 1280]
    - [92, 55.18]
  - - [4288, 1856, 1, 1280]
    - [96, 52.728]
  - - [5056, 1856, 1, 1280]
    - [89, 58.79]
  - - [5888, 1856, 1, 1280]
    - [89, 56.841]
  - - [6784, 1856, 1, 1280]
    - [96, 55.944]
  - - [256, 2368, 1, 1280]
    - [97, 23.126]
  - - [448, 2368, 1, 1280]
    - [75, 33.797]
  - - [704, 2368, 1, 1280]
    - [69, 39.7]
  - - [1024, 2368, 1, 1280]
    - [98, 43.224]
  - - [1408, 2368, 1, 1280]
    - [94, 49.005]
  - - [1856, 2368, 1, 1280]
    - [88, 51.614]
  - - [2368, 2368, 1, 1280]
    - [55, 52.889]
  - - [2944, 2368, 1, 1280]
    - [63, 57.315]
  - - [3584, 2368, 1, 1280]
    - [99, 54.423]
  - - [4288, 2368, 1, 1280]
    - [100, 54.324]
  - - [5056, 2368, 1, 1280]
    - [89, 61.158]
  - - [5888, 2368, 1, 1280]
    - [89, 60.251]
  - - [6784, 2368, 1, 1280]
    - [63, 59.91]
  - - [256, 2944, 1, 1280]
    - [29, 26.631]
  - - [448, 2944, 1, 1280]
    - [69, 32.177]
  - - [704, 2944, 1, 1280]
    - [54, 41.796]
  - - [1024, 2944, 1, 1280]
    - [101, 43.56]
  - - [1408, 2944, 1, 1280]
    - [65, 50.927]
  - - [1856, 2944, 1, 1280]
    - [98, 51.456]
  - - [2368, 2944, 1, 1280]
    - [80, 53.738]
  - - [2944, 2944, 1, 1280]
    - [65, 54.99]
  - - [3584, 2944, 1, 1280]
    - [90, 55.679]
  - - [4288, 2944, 1, 1280]
    - [96, 57.149]
  - - [5056, 2944, 1, 1280]
    - [90, 58.003]
  - - [5888, 2944, 1, 1280]
    - [63, 58.722]
  - - [6784, 2944, 1, 1280]
    - [63, 59.468]
  - - [256, 3584, 1, 1280]
    - [29, 30.959]
  - - [448, 3584, 1, 1280]
    - [69, 38.777]
  - - [704, 3584, 1, 1280]
    - [59, 46.57]
  - - [1024, 3584, 1, 1280]
    - [102, 48.416]
  - - [1408, 3584, 1, 1280]
    - [55, 48.358]
  - - [1856, 3584, 1, 1280]
    - [63, 56.352]
  - - [2368, 3584, 1, 1280]
    - [92, 54.278]
  - - [2944, 3584, 1, 1280]
    - [103, 56.124]
  - - [3584, 3584, 1, 1280]
    - [96, 57.306]
  - - [4288, 3584, 1, 1280]
    - [63, 58.909]
  - - [5056, 3584, 1, 1280]
    - [63, 60.211]
  - - [5888, 3584, 1, 1280]
    - [63, 62.246]
  - - [6784, 3584, 1, 1280]
    - [63, 60.15]
  - - [256, 4288, 1, 1280]
    - [77, 33.039]
  - - [448, 4288, 1, 1280]
    - [51, 42.852]
  - - [704, 4288, 1, 1280]
    - [94, 45.6]
  - - [1024, 4288, 1, 1280]
    - [104, 50.574]
  - - [1408, 4288, 1, 1280]
    - [63, 51.111]
  - - [1856, 4288, 1, 1280]
    - [65, 52.409]
  - - [2368, 4288, 1, 1280]
    - [86, 53.867]
  - - [2944, 4288, 1, 1280]
    - [99, 55.82]
  - - [3584, 4288, 1, 1280]
    - [86, 58.815]
  - - [4288, 4288, 1, 1280]
    - [63, 61.73]
  - - [5056, 4288, 1, 1280]
    - [63, 63.683]
  - - [5888, 4288, 1, 1280]
    - [63, 61.621]
  - - [6784, 4288, 1, 1280]
    - [63, 64.125]
  - - [256, 5056, 1, 1280]
    - [77, 37.27]
  - - [448, 5056, 1, 1280]
    - [55, 42.132]
  - - [704, 5056, 1, 1280]
    - [94, 51.494]
  - - [1024, 5056, 1, 1280]
    - [105, 48.001]
  - - [1408, 5056, 1, 1280]
    - [63, 58.367]
  - - [1856, 5056, 1, 1280]
    - [63, 58.76]
  - - [2368, 5056, 1, 1280]
    - [63, 54.181]
  - - [2944, 5056, 1, 1280]
    - [80, 58.729]
  - - [3584, 5056, 1, 1280]
    - [106, 60.413]
  - - [4288, 5056, 1, 1280]
    - [63, 59.715]
  - - [5056, 5056, 1, 1280]
    - [63, 62.774]
  - - [5888, 5056, 1, 1280]
    - [63, 62.409]
  - - [6784, 5056, 1, 1280]
    - [63, 62.065]
  - - [256, 5888, 1, 1280]
    - [107, 36.699]
  - - [448, 5888, 1, 1280]
    - [108, 42.074]
  - - [704, 5888, 1, 1280]
    - [88, 49.505]
  - - [1024, 5888, 1, 1280]
    - [89, 49.741]
  - - [1408, 5888, 1, 1280]
    - [95, 53.621]
  - - [1856, 5888, 1, 1280]
    - [63, 57.389]
  - - [2368, 5888, 1, 1280]
    - [63, 60.999]
  - - [2944, 5888, 1, 1280]
    - [63, 57.774]
  - - [3584, 5888, 1, 1280]
    - [63, 62.338]
  - - [4288, 5888, 1, 1280]
    - [109, 62.268]
  - - [5056, 5888, 1, 1280]
    - [109, 61.867]
  - - [5888, 5888, 1, 1280]
    - [63, 62.722]
  - - [6784, 5888, 1, 1280]
    - [63, 63.4]
  - - [256, 6784, 1, 1280]
    - [52, 41.113]
  - - [448, 6784, 1, 1280]
    - [94, 45.679]
  - - [704, 6784, 1, 1280]
    - [55, 47.635]
  - - [1024, 6784, 1, 1280]
    - [89, 55.624]
  - - [1408, 6784, 1, 1280]
    - [109, 59.07]
  - - [1856, 6784, 1, 1280]
    - [63, 56.489]
  - - [2368, 6784, 1, 1280]
    - [89, 60.532]
  - - [2944, 6784, 1, 1280]
    - [63, 59.13]
  - - [3584, 6784, 1, 1280]
    - [63, 60.463]
  - - [4288, 6784, 1, 1280]
    - [63, 61.97]
  - - [5056, 6784, 1, 1280]
    - [63, 62.862]
  - - [5888, 6784, 1, 1280]
    - [63, 63.865]
  - - [6784, 6784, 1, 1280]
    - [109, 65.303]
  - - [704, 256, 1, 3328]
    - [24, 15.211]
  - - [1024, 256, 1, 3328]
    - [33, 18.388]
  - - [1408, 256, 1, 3328]
    - [43, 21.756]
  - - [1856, 256, 1, 3328]
    - [34, 27.353]
  - - [2368, 256, 1, 3328]
    - [35, 30.6]
  - - [2944, 256, 1, 3328]
    - [29, 34.878]
  - - [3584, 256, 1, 3328]
    - [44, 40.418]
  - - [4288, 256, 1, 3328]
    - [75, 46.263]
  - - [5056, 256, 1, 3328]
    - [76, 51.285]
  - - [5888, 256, 1, 3328]
    - [110, 45.183]
  - - [6784, 256, 1, 3328]
    - [110, 50.175]
  - - [704, 448, 1, 3328]
    - [26, 18.854]
  - - [1024, 448, 1, 3328]
    - [34, 25.559]
  - - [1408, 448, 1, 3328]
    - [35, 32.048]
  - - [1856, 448, 1, 3328]
    - [111, 39.059]
  - - [2368, 448, 1, 3328]
    - [77, 44.892]
  - - [2944, 448, 1, 3328]
    - [76, 52.194]
  - - [3584, 448, 1, 3328]
    - [110, 47.4]
  - - [4288, 448, 1, 3328]
    - [112, 47.409]
  - - [5056, 448, 1, 3328]
    - [112, 55.07]
  - - [5888, 448, 1, 3328]
    - [55, 57.855]
  - - [6784, 448, 1, 3328]
    - [113, 57.752]
  - - [256, 704, 1, 3328]
    - [24, 14.068]
  - - [448, 704, 1, 3328]
    - [27, 19.0]
  - - [704, 704, 1, 3328]
    - [35, 26.752]
  - - [1024, 704, 1, 3328]
    - [44, 33.164]
  - - [1408, 704, 1, 3328]
    - [77, 40.998]
  - - [1856, 704, 1, 3328]
    - [77, 51.123]
  - - [2368, 704, 1, 3328]
    - [110, 49.401]
  - - [2944, 704, 1, 3328]
    - [112, 51.352]
  - - [3584, 704, 1, 3328]
    - [55, 55.223]
  - - [4288, 704, 1, 3328]
    - [114, 57.574]
  - - [5056, 704, 1, 3328]
    - [114, 67.105]
  - - [5888, 704, 1, 3328]
    - [115, 65.532]
  - - [6784, 704, 1, 3328]
    - [55, 53.18]
  - - [256, 1024, 1, 3328]
    - [33, 18.987]
  - - [448, 1024, 1, 3328]
    - [116, 26.806]
  - - [704, 1024, 1, 3328]
    - [37, 34.226]
  - - [1024, 1024, 1, 3328]
    - [76, 42.914]
  - - [1408, 1024, 1, 3328]
    - [110, 43.47]
  - - [1856, 1024, 1, 3328]
    - [110, 54.304]
  - - [2368, 1024, 1, 3328]
    - [55, 55.407]
  - - [2944, 1024, 1, 3328]
    - [117, 56.188]
  - - [3584, 1024, 1, 3328]
    - [113, 66.454]
  - - [4288, 1024, 1, 3328]
    - [118, 68.998]
  - - [5056, 1024, 1, 3328]
    - [55, 58.935]
  - - [5888, 1024, 1, 3328]
    - [89, 60.36]
  - - [6784, 1024, 1, 3328]
    - [113, 66.797]
  - - [256, 1408, 1, 3328]
    - [27, 21.261]
  - - [448, 1408, 1, 3328]
    - [35, 31.183]
  - - [704, 1408, 1, 3328]
    - [75, 44.165]
  - - [1024, 1408, 1, 3328]
    - [75, 52.642]
  - - [1408, 1408, 1, 3328]
    - [112, 48.693]
  - - [1856, 1408, 1, 3328]
    - [55, 58.807]
  - - [2368, 1408, 1, 3328]
    - [114, 61.994]
  - - [2944, 1408, 1, 3328]
    - [96, 66.375]
  - - [3584, 1408, 1, 3328]
    - [55, 58.252]
  - - [4288, 1408, 1, 3328]
    - [89, 60.539]
  - - [5056, 1408, 1, 3328]
    - [89, 69.242]
  - - [5888, 1408, 1, 3328]
    - [119, 68.56]
  - - [6784, 1408, 1, 3328]
    - [89, 70.579]
  - - [256, 1856, 1, 3328]
    - [116, 27.816]
  - - [448, 1856, 1, 3328]
    - [111, 39.118]
  - - [704, 1856, 1, 3328]
    - [76, 52.987]
  - - [1024, 1856, 1, 3328]
    - [110, 51.47]
  - - [1408, 1856, 1, 3328]
    - [55, 57.235]
  - - [1856, 1856, 1, 3328]
    - [114, 66.307]
  - - [2368, 1856, 1, 3328]
    - [120, 69.027]
  - - [2944, 1856, 1, 3328]
    - [55, 60.864]
  - - [3584, 1856, 1, 3328]
    - [121, 65.623]
  - - [4288, 1856, 1, 3328]
    - [99, 68.076]
  - - [5056, 1856, 1, 3328]
    - [120, 74.404]
  - - [5888, 1856, 1, 3328]
    - [121, 71.864]
  - - [6784, 1856, 1, 3328]
    - [99, 70.352]
  - - [256, 2368, 1, 3328]
    - [97, 30.55]
  - - [448, 2368, 1, 3328]
    - [75, 45.826]
  - - [704, 2368, 1, 3328]
    - [110, 49.26]
  - - [1024, 2368, 1, 3328]
    - [122, 57.781]
  - - [1408, 2368, 1, 3328]
    - [114, 64.139]
  - - [1856, 2368, 1, 3328]
    - [88, 67.965]
  - - [2368, 2368, 1, 3328]
    - [55, 63.047]
  - - [2944, 2368, 1, 3328]
    - [89, 68.622]
  - - [3584, 2368, 1, 3328]
    - [99, 69.449]
  - - [4288, 2368, 1, 3328]
    - [113, 66.354]
  - - [5056, 2368, 1, 3328]
    - [89, 73.344]
  - - [5888, 2368, 1, 3328]
    - [120, 74.792]
  - - [6784, 2368, 1, 3328]
    - [89, 71.291]
  - - [256, 2944, 1, 3328]
    - [37, 34.417]
  - - [448, 2944, 1, 3328]
    - [123, 39.496]
  - - [704, 2944, 1, 3328]
    - [122, 51.722]
  - - [1024, 2944, 1, 3328]
    - [124, 55.754]
  - - [1408, 2944, 1, 3328]
    - [125, 65.334]
  - - [1856, 2944, 1, 3328]
    - [55, 61.017]
  - - [2368, 2944, 1, 3328]
    - [113, 67.85]
  - - [2944, 2944, 1, 3328]
    - [125, 69.249]
  - - [3584, 2944, 1, 3328]
    - [117, 67.966]
  - - [4288, 2944, 1, 3328]
    - [99, 72.353]
  - - [5056, 2944, 1, 3328]
    - [126, 72.435]
  - - [5888, 2944, 1, 3328]
    - [120, 71.082]
  - - [6784, 2944, 1, 3328]
    - [63, 70.032]
  - - [256, 3584, 1, 3328]
    - [29, 41.353]
  - - [448, 3584, 1, 3328]
    - [69, 46.822]
  - - [704, 3584, 1, 3328]
    - [72, 56.251]
  - - [1024, 3584, 1, 3328]
    - [121, 64.723]
  - - [1408, 3584, 1, 3328]
    - [55, 57.675]
  - - [1856, 3584, 1, 3328]
    - [63, 66.041]
  - - [2368, 3584, 1, 3328]
    - [88, 68.335]
  - - [2944, 3584, 1, 3328]
    - [117, 69.622]
  - - [3584, 3584, 1, 3328]
    - [96, 71.758]
  - - [4288, 3584, 1, 3328]
    - [126, 74.624]
  - - [5056, 3584, 1, 3328]
    - [120, 73.773]
  - - [5888, 3584, 1, 3328]
    - [63, 72.92]
  - - [6784, 3584, 1, 3328]
    - [96, 70.514]
  - - [256, 4288, 1, 3328]
    - [76, 44.057]
  - - [448, 4288, 1, 3328]
    - [51, 51.268]
  - - [704, 4288, 1, 3328]
    - [114, 58.908]
  - - [1024, 4288, 1, 3328]
    - [127, 67.566]
  - - [1408, 4288, 1, 3328]
    - [89, 60.133]
  - - [1856, 4288, 1, 3328]
    - [115, 67.009]
  - - [2368, 4288, 1, 3328]
    - [113, 67.271]
  - - [2944, 4288, 1, 3328]
    - [96, 69.871]
  - - [3584, 4288, 1, 3328]
    - [113, 74.092]
  - - [4288, 4288, 1, 3328]
    - [120, 74.886]
  - - [5056, 4288, 1, 3328]
    - [89, 75.326]
  - - [5888, 4288, 1, 3328]
    - [96, 73.147]
  - - [6784, 4288, 1, 3328]
    - [89, 75.594]
  - - [256, 5056, 1, 3328]
    - [75, 49.767]
  - - [448, 5056, 1, 3328]
    - [76, 50.389]
  - - [704, 5056, 1, 3328]
    - [114, 67.761]
  - - [1024, 5056, 1, 3328]
    - [105, 55.988]
  - - [1408, 5056, 1, 3328]
    - [117, 69.091]
  - - [1856, 5056, 1, 3328]
    - [63, 69.552]
  - - [2368, 5056, 1, 3328]
    - [96, 68.119]
  - - [2944, 5056, 1, 3328]
    - [121, 72.73]
  - - [3584, 5056, 1, 3328]
    - [120, 73.898]
  - - [4288, 5056, 1, 3328]
    - [120, 71.786]
  - - [5056, 5056, 1, 3328]
    - [96, 74.344]
  - - [5888, 5056, 1, 3328]
    - [96, 74.043]
  - - [6784, 5056, 1, 3328]
    - [126, 75.229]
  - - [256, 5888, 1, 3328]
    - [107, 43.069]
  - - [448, 5888, 1, 3328]
    - [108, 53.907]
  - - [704, 5888, 1, 3328]
    - [120, 64.711]
  - - [1024, 5888, 1, 3328]
    - [89, 58.118]
  - - [1408, 5888, 1, 3328]
    - [88, 66.375]
  - - [1856, 5888, 1, 3328]
    - [100, 67.664]
  - - [2368, 5888, 1, 3328]
    - [63, 71.906]
  - - [2944, 5888, 1, 3328]
    - [120, 70.877]
  - - [3584, 5888, 1, 3328]
    - [63, 73.401]
  - - [4288, 5888, 1, 3328]
    - [99, 73.966]
  - - [5056, 5888, 1, 3328]
    - [99, 75.062]
  - - [5888, 5888, 1, 3328]
    - [126, 75.808]
  - - [6784, 5888, 1, 3328]
    - [63, 74.78]
  - - [256, 6784, 1, 3328]
    - [85, 49.898]
  - - [448, 6784, 1, 3328]
    - [94, 57.541]
  - - [704, 6784, 1, 3328]
    - [55, 55.564]
  - - [1024, 6784, 1, 3328]
    - [121, 65.661]
  - - [1408, 6784, 1, 3328]
    - [89, 70.696]
  - - [1856, 6784, 1, 3328]
    - [125, 68.689]
  - - [2368, 6784, 1, 3328]
    - [89, 71.72]
  - - [2944, 6784, 1, 3328]
    - [63, 69.414]
  - - [3584, 6784, 1, 3328]
    - [96, 70.592]
  - - [4288, 6784, 1, 3328]
    - [96, 73.182]
  - - [5056, 6784, 1, 3328]
    - [96, 75.261]
  - - [5888, 6784, 1, 3328]
    - [63, 74.857]
  - - [6784, 6784, 1, 3328]
    - [89, 76.429]
  - - [1024, 1024, 1, 1024]
    - [75, 28.068]
  - - [1024, 700, 1, 512]
    - [111, 16.355]
  - - [3072, 1500, 1, 128]
    - [63, 14.081]
  - - [4224, 1500, 1, 176]
    - [63, 17.136]
  - - [512, 1500, 1, 1536]
    - [36, 29.439]
  - - [512, 1500, 1, 2048]
    - [37, 29.978]
  - - [512, 1500, 1, 2560]
    - [36, 33.698]
  - - [512, 1500, 1, 2816]
    - [128, 33.958]
  - - [512, 3000, 1, 1536]
    - [107, 38.94]
  - - [1024, 1500, 1, 1536]
    - [107, 37.613]
  - - [512, 3000, 1, 2048]
    - [69, 40.217]
  - - [1024, 1500, 1, 2048]
    - [123, 39.044]
  - - [512, 3000, 1, 2560]
    - [69, 42.989]
  - - [1024, 1500, 1, 2560]
    - [123, 41.116]
  - - [512, 3000, 1, 2816]
    - [107, 42.609]
  - - [1024, 1500, 1, 2816]
    - [110, 42.077]
  - - [512, 6000, 1, 1536]
    - [94, 47.431]
  - - [1024, 3000, 1, 1536]
    - [101, 47.38]
  - - [3072, 1500, 1, 1024]
    - [118, 48.74]
  - - [512, 6000, 1, 2048]
    - [101, 51.065]
  - - [1024, 3000, 1, 2048]
    - [114, 51.243]
  - - [5124, 700, 1, 2048]
    - [96, 53.208]
  - - [512, 6000, 1, 2560]
    - [94, 54.076]
  - - [1024, 3000, 1, 2560]
    - [114, 54.678]
  - - [512, 6000, 1, 2816]
    - [117, 53.649]
  - - [1024, 3000, 1, 2816]
    - [114, 55.832]
  - - [5124, 700, 1, 2560]
    - [96, 56.608]
  - - [1024, 6000, 1, 1536]
    - [89, 52.258]
  - - [3072, 3000, 1, 1024]
    - [89, 53.46]
  - - [4608, 1500, 1, 1536]
    - [63, 59.282]
  - - [1024, 6000, 1, 2048]
    - [89, 55.571]
  - - [1024, 6000, 1, 2560]
    - [89, 57.074]
  - - [5124, 1500, 1, 2048]
    - [119, 59.906]
  - - [1024, 6000, 1, 2816]
    - [89, 57.703]
  - - [512, 24000, 1, 1536]
    - [89, 63.128]
  - - [3072, 6000, 1, 1024]
    - [63, 56.468]
  - - [5124, 1500, 1, 2560]
    - [119, 63.039]
  - - [4608, 3000, 1, 1536]
    - [63, 62.943]
  - - [1760, 7000, 1, 1760]
    - [129, 65.437]
  - - [6144, 1500, 1, 2560]
    - [130, 70.204]
  - - [512, 24000, 1, 2048]
    - [89, 66.641]
  - - [2048, 7000, 1, 2048]
    - [120, 67.443]
  - - [7680, 1500, 1, 2560]
    - [121, 71.057]
  - - [512, 24000, 1, 2560]
    - [89, 69.268]
  - - [512, 24000, 1, 2816]
    - [89, 69.805]
  - - [8448, 1500, 1, 2816]
    - [130, 67.491]
  - - [512, 48000, 1, 1536]
    - [120, 66.043]
  - - [1024, 24000, 1, 1536]
    - [125, 65.154]
  - - [4608, 6000, 1, 1536]
    - [63, 64.843]
  - - [2560, 7000, 1, 2560]
    - [120, 69.559]
  - - [6144, 3000, 1, 2560]
    - [120, 71.303]
  - - [512, 48000, 1, 2048]
    - [120, 71.022]
  - - [1024, 24000, 1, 2048]
    - [125, 70.481]
  - - [7680, 3000, 1, 2560]
    - [120, 72.079]
  - - [512, 48000, 1, 2560]
    - [120, 74.623]
  - - [1024, 24000, 1, 2560]
    - [125, 74.303]
  - - [512, 48000, 1, 2816]
    - [120, 75.856]
  - - [1024, 24000, 1, 2816]
    - [125, 75.696]
  - - [8448, 3000, 1, 2816]
    - [96, 71.863]
  - - [1024, 48000, 1, 1536]
    - [125, 66.944]
  - - [3072, 24000, 1, 1024]
    - [89, 61.411]
  - - [5124, 9124, 1, 1760]
    - [131, 70.38]
  - - [6144, 6000, 1, 2560]
    - [120, 72.629]
  - - [5124, 9124, 1, 2048]
    - [126, 66.739]
  - - [1024, 48000, 1, 2048]
    - [125, 71.945]
  - - [4096, 7000, 1, 4096]
    - [118, 76.621]
  - - [7680, 6000, 1, 2560]
    - [89, 73.912]
  - - [5124, 9124, 1, 2560]
    - [126, 70.629]
  - - [1024, 48000, 1, 2560]
    - [125, 75.78]
  - - [1024, 48000, 1, 2816]
    - [125, 76.946]
  - - [8448, 6000, 1, 2816]
    - [63, 75.289]
  - - [3072, 48000, 1, 1024]
    - [89, 61.174]
  - - [4608, 24000, 1, 1536]
    - [109, 69.516]
  - - [5124, 9124, 1, 4096]
    - [126, 75.822]
  - - [4608, 48000, 1, 1536]
    - [106, 70.523]
  - - [6144, 24000, 1, 2560]
    - [120, 77.269]
  - - [7680, 24000, 1, 2560]
    - [120, 77.298]
  - - [8448, 24000, 1, 2816]
    - [120, 78.244]
  - - [6144, 48000, 1, 2560]
    - [120, 77.872]
  - - [7680, 48000, 1, 2560]
    - [120, 78.335]
  - - [8448, 48000, 1, 2816]
    - [120, 80.074]
  - - [256, 193600, 1, 64]
    - [132, 10.264]
  - - [64, 193600, 1, 64]
    - [133, 8.731]
  - - [64, 193600, 1, 256]
    - [134, 19.789]
  - - [512, 50176, 1, 128]
    - [60, 18.145]
  - - [128, 50176, 1, 512]
    - [60, 35.992]
  - - [256, 12544, 1, 1024]
    - [90, 41.755]
  - - [1024, 12544, 1, 256]
    - [60, 28.104]
  - - [2048, 3136, 1, 512]
    - [92, 37.437]
  - - [512, 3136, 1, 2048]
    - [51, 40.07]
  - - [196, 256, 64, 1024]
    - [55, 31.498]
  - - [784, 512, 64, 128]
    - [65, 18.091]
  - - [3136, 512, 1, 2048]
    - [81, 43.404]
  - - [196, 1024, 64, 256]
    - [135, 23.727]
  - - [3136, 2048, 1, 512]
    - [63, 38.855]
  - - [32, 32, 1, 32]
    - [6, 0.005]
  - - [32, 64, 1, 256]
    - [38, 0.049]
  - - [32, 128, 1, 256]
    - [15, 0.1]
  - - [32, 256, 1, 256]
    - [5, 0.2]
  - - [32, 448, 1, 256]
    - [7, 0.343]
  - - [32, 704, 1, 256]
    - [5, 0.551]
  - - [32, 1024, 1, 256]
    - [3, 0.793]
  - - [32, 1408, 1, 256]
    - [7, 1.069]
  - - [32, 1856, 1, 256]
    - [7, 1.409]
  - - [32, 2368, 1, 256]
    - [3, 1.797]
  - - [32, 2944, 1, 256]
    - [7, 2.213]
  - - [32, 3584, 1, 256]
    - [8, 2.668]
  - - [32, 4288, 1, 256]
    - [5, 3.101]
  - - [32, 5056, 1, 256]
    - [7, 3.657]
  - - [32, 5888, 1, 256]
    - [7, 4.258]
  - - [32, 6784, 1, 256]
    - [7, 4.861]
  - - [32, 64, 1, 1280]
    - [4, 0.15]
  - - [32, 128, 1, 1280]
    - [4, 0.294]
  - - [32, 256, 1, 1280]
    - [4, 0.561]
  - - [32, 448, 1, 1280]
    - [3, 0.959]
  - - [32, 704, 1, 1280]
    - [21, 1.587]
  - - [32, 1024, 1, 1280]
    - [2, 2.23]
  - - [32, 1408, 1, 1280]
    - [20, 3.049]
  - - [32, 1856, 1, 1280]
    - [136, 4.042]
  - - [32, 2368, 1, 1280]
    - [3, 5.071]
  - - [32, 2944, 1, 1280]
    - [20, 6.376]
  - - [32, 3584, 1, 1280]
    - [3, 7.895]
  - - [32, 4288, 1, 1280]
    - [7, 7.902]
  - - [32, 5056, 1, 1280]
    - [42, 9.142]
  - - [32, 5888, 1, 1280]
    - [23, 10.498]
  - - [32, 6784, 1, 1280]
    - [25, 11.82]
  - - [32, 64, 1, 3328]
    - [13, 0.317]
  - - [32, 128, 1, 3328]
    - [13, 0.625]
  - - [32, 256, 1, 3328]
    - [4, 1.165]
  - - [32, 448, 1, 3328]
    - [4, 1.984]
  - - [32, 704, 1, 3328]
    - [4, 2.876]
  - - [32, 1024, 1, 3328]
    - [13, 4.132]
  - - [32, 1408, 1, 3328]
    - [4, 5.525]
  - - [32, 1856, 1, 3328]
    - [32, 6.776]
  - - [32, 2368, 1, 3328]
    - [137, 7.712]
  - - [32, 2944, 1, 3328]
    - [2, 9.557]
  - - [32, 3584, 1, 3328]
    - [137, 11.448]
  - - [32, 4288, 1, 3328]
    - [42, 11.838]
  - - [32, 5056, 1, 3328]
    - [25, 13.843]
  - - [32, 5888, 1, 3328]
    - [25, 15.86]
  - - [32, 6784, 1, 3328]
    - [42, 17.16]
  - - [64, 32, 1, 256]
    - [38, 0.048]
  - - [128, 32, 1, 256]
    - [15, 0.096]
  - - [256, 32, 1, 256]
    - [38, 0.192]
  - - [448, 32, 1, 256]
    - [15, 0.34]
  - - [704, 32, 1, 256]
    - [15, 0.54]
  - - [1024, 32, 1, 256]
    - [7, 0.818]
  - - [1408, 32, 1, 256]
    - [7, 1.09]
  - - [1856, 32, 1, 256]
    - [7, 1.423]
  - - [2368, 32, 1, 256]
    - [5, 1.763]
  - - [2944, 32, 1, 256]
    - [15, 2.17]
  - - [3584, 32, 1, 256]
    - [7, 2.668]
  - - [4288, 32, 1, 256]
    - [16, 3.072]
  - - [5056, 32, 1, 256]
    - [5, 3.727]
  - - [5888, 32, 1, 256]
    - [7, 4.382]
  - - [6784, 32, 1, 256]
    - [12, 4.906]
  - - [64, 32, 1, 1280]
    - [4, 0.144]
  - - [128, 32, 1, 1280]
    - [4, 0.296]
  - - [256, 32, 1, 1280]
    - [4, 0.581]
  - - [448, 32, 1, 1280]
    - [3, 0.965]
  - - [704, 32, 1, 1280]
    - [10, 1.533]
  - - [1024, 32, 1, 1280]
    - [3, 2.181]
  - - [1408, 32, 1, 1280]
    - [3, 2.871]
  - - [1856, 32, 1, 1280]
    - [21, 4.112]
  - - [2368, 32, 1, 1280]
    - [10, 5.043]
  - - [2944, 32, 1, 1280]
    - [10, 5.908]
  - - [3584, 32, 1, 1280]
    - [10, 7.193]
  - - [4288, 32, 1, 1280]
    - [7, 7.681]
  - - [5056, 32, 1, 1280]
    - [7, 9.363]
  - - [5888, 32, 1, 1280]
    - [7, 10.353]
  - - [6784, 32, 1, 1280]
    - [7, 11.557]
  - - [64, 32, 1, 3328]
    - [32, 0.304]
  - - [128, 32, 1, 3328]
    - [13, 0.593]
  - - [256, 32, 1, 3328]
    - [13, 1.203]
  - - [448, 32, 1, 3328]
    - [4, 1.993]
  - - [704, 32, 1, 3328]
    - [4, 2.864]
  - - [1024, 32, 1, 3328]
    - [4, 4.05]
  - - [1408, 32, 1, 3328]
    - [13, 5.704]
  - - [1856, 32, 1, 3328]
    - [13, 7.17]
  - - [2368, 32, 1, 3328]
    - [14, 7.712]
  - - [2944, 32, 1, 3328]
    - [14, 9.588]
  - - [3584, 32, 1, 3328]
    - [40, 9.813]
  - - [4288, 32, 1, 3328]
    - [13, 10.474]
  - - [5056, 32, 1, 3328]
    - [46, 12.504]
  - - [5888, 32, 1, 3328]
    - [46, 13.647]
  - - [6784, 32, 1, 3328]
    - [46, 14.892]
  - - [64, 64, 1, 32]
    - [16, 0.019]
  - - [128, 64, 1, 32]
    - [8, 0.038]
  - - [256, 64, 1, 32]
    - [6, 0.073]
  - - [448, 64, 1, 32]
    - [68, 0.132]
  - - [704, 64, 1, 32]
    - [68, 0.201]
  - - [1024, 64, 1, 32]
    - [68, 0.307]
  - - [1408, 64, 1, 32]
    - [6, 0.397]
  - - [1856, 64, 1, 32]
    - [6, 0.516]
  - - [2368, 64, 1, 32]
    - [68, 0.63]
  - - [2944, 64, 1, 32]
    - [68, 0.762]
  - - [3584, 64, 1, 32]
    - [6, 0.916]
  - - [4288, 64, 1, 32]
    - [16, 1.054]
  - - [5056, 64, 1, 32]
    - [6, 1.242]
  - - [5888, 64, 1, 32]
    - [12, 1.428]
  - - [6784, 64, 1, 32]
    - [68, 1.567]
  - - [64, 128, 1, 32]
    - [8, 0.039]
  - - [128, 128, 1, 32]
    - [8, 0.075]
  - - [256, 128, 1, 32]
    - [6, 0.149]
  - - [448, 128, 1, 32]
    - [68, 0.264]
  - - [704, 128, 1, 32]
    - [6, 0.391]
  - - [1024, 128, 1, 32]
    - [68, 0.561]
  - - [1408, 128, 1, 32]
    - [68, 0.739]
  - - [1856, 128, 1, 32]
    - [68, 0.988]
  - - [2368, 128, 1, 32]
    - [16, 1.164]
  - - [2944, 128, 1, 32]
    - [6, 1.376]
  - - [3584, 128, 1, 32]
    - [12, 1.597]
  - - [4288, 128, 1, 32]
    - [12, 1.911]
  - - [5056, 128, 1, 32]
    - [39, 1.998]
  - - [5888, 128, 1, 32]
    - [138, 2.213]
  - - [6784, 128, 1, 32]
    - [139, 2.549]
  - - [64, 256, 1, 32]
    - [68, 0.073]
  - - [128, 256, 1, 32]
    - [68, 0.149]
  - - [256, 256, 1, 32]
    - [6, 0.312]
  - - [448, 256, 1, 32]
    - [6, 0.498]
  - - [704, 256, 1, 32]
    - [8, 0.75]
  - - [1024, 256, 1, 32]
    - [6, 1.075]
  - - [1408, 256, 1, 32]
    - [8, 1.384]
  - - [1856, 256, 1, 32]
    - [6, 1.714]
  - - [2368, 256, 1, 32]
    - [8, 2.017]
  - - [2944, 256, 1, 32]
    - [134, 2.303]
  - - [3584, 256, 1, 32]
    - [134, 2.694]
  - - [4288, 256, 1, 32]
    - [140, 2.786]
  - - [5056, 256, 1, 32]
    - [49, 2.959]
  - - [5888, 256, 1, 32]
    - [134, 3.247]
  - - [6784, 256, 1, 32]
    - [141, 3.313]
  - - [64, 448, 1, 32]
    - [6, 0.132]
  - - [128, 448, 1, 32]
    - [6, 0.256]
  - - [256, 448, 1, 32]
    - [68, 0.491]
  - - [448, 448, 1, 32]
    - [68, 0.812]
  - - [704, 448, 1, 32]
    - [6, 1.196]
  - - [1024, 448, 1, 32]
    - [12, 1.655]
  - - [1408, 448, 1, 32]
    - [39, 1.968]
  - - [1856, 448, 1, 32]
    - [139, 2.465]
  - - [2368, 448, 1, 32]
    - [134, 2.739]
  - - [2944, 448, 1, 32]
    - [49, 3.086]
  - - [3584, 448, 1, 32]
    - [49, 3.271]
  - - [4288, 448, 1, 32]
    - [133, 3.529]
  - - [5056, 448, 1, 32]
    - [142, 3.687]
  - - [5888, 448, 1, 32]
    - [133, 3.78]
  - - [6784, 448, 1, 32]
    - [142, 3.923]
  - - [64, 704, 1, 32]
    - [12, 0.204]
  - - [128, 704, 1, 32]
    - [68, 0.397]
  - - [256, 704, 1, 32]
    - [68, 0.75]
  - - [448, 704, 1, 32]
    - [8, 1.196]
  - - [704, 704, 1, 32]
    - [68, 1.668]
  - - [1024, 704, 1, 32]
    - [39, 2.272]
  - - [1408, 704, 1, 32]
    - [134, 2.604]
  - - [1856, 704, 1, 32]
    - [49, 3.033]
  - - [2368, 704, 1, 32]
    - [49, 3.328]
  - - [2944, 704, 1, 32]
    - [134, 3.63]
  - - [3584, 704, 1, 32]
    - [140, 3.778]
  - - [4288, 704, 1, 32]
    - [141, 3.965]
  - - [5056, 704, 1, 32]
    - [6, 4.053]
  - - [5888, 704, 1, 32]
    - [133, 4.251]
  - - [6784, 704, 1, 32]
    - [133, 4.414]
  - - [64, 1024, 1, 32]
    - [68, 0.302]
  - - [128, 1024, 1, 32]
    - [68, 0.523]
  - - [256, 1024, 1, 32]
    - [68, 1.006]
  - - [448, 1024, 1, 32]
    - [6, 1.635]
  - - [704, 1024, 1, 32]
    - [134, 2.272]
  - - [1024, 1024, 1, 32]
    - [68, 2.661]
  - - [1408, 1024, 1, 32]
    - [140, 3.246]
  - - [1856, 1024, 1, 32]
    - [133, 3.492]
  - - [2368, 1024, 1, 32]
    - [140, 3.782]
  - - [2944, 1024, 1, 32]
    - [133, 3.977]
  - - [3584, 1024, 1, 32]
    - [133, 4.132]
  - - [4288, 1024, 1, 32]
    - [133, 4.283]
  - - [5056, 1024, 1, 32]
    - [143, 4.52]
  - - [5888, 1024, 1, 32]
    - [133, 4.678]
  - - [6784, 1024, 1, 32]
    - [133, 4.761]
  - - [64, 1408, 1, 32]
    - [19, 0.403]
  - - [128, 1408, 1, 32]
    - [6, 0.729]
  - - [256, 1408, 1, 32]
    - [6, 1.384]
  - - [448, 1408, 1, 32]
    - [144, 1.968]
  - - [704, 1408, 1, 32]
    - [134, 2.581]
  - - [1024, 1408, 1, 32]
    - [133, 3.175]
  - - [1408, 1408, 1, 32]
    - [134, 3.665]
  - - [1856, 1408, 1, 32]
    - [140, 3.874]
  - - [2368, 1408, 1, 32]
    - [133, 4.026]
  - - [2944, 1408, 1, 32]
    - [145, 4.237]
  - - [3584, 1408, 1, 32]
    - [142, 4.498]
  - - [4288, 1408, 1, 32]
    - [133, 4.684]
  - - [5056, 1408, 1, 32]
    - [133, 4.812]
  - - [5888, 1408, 1, 32]
    - [133, 4.926]
  - - [6784, 1408, 1, 32]
    - [143, 5.018]
  - - [64, 1856, 1, 32]
    - [19, 0.523]
  - - [128, 1856, 1, 32]
    - [8, 0.961]
  - - [256, 1856, 1, 32]
    - [6, 1.655]
  - - [448, 1856, 1, 32]
    - [134, 2.394]
  - - [704, 1856, 1, 32]
    - [146, 3.033]
  - - [1024, 1856, 1, 32]
    - [133, 3.513]
  - - [1408, 1856, 1, 32]
    - [140, 3.762]
  - - [1856, 1856, 1, 32]
    - [144, 4.014]
  - - [2368, 1856, 1, 32]
    - [133, 4.358]
  - - [2944, 1856, 1, 32]
    - [133, 4.545]
  - - [3584, 1856, 1, 32]
    - [133, 4.754]
  - - [4288, 1856, 1, 32]
    - [142, 4.904]
  - - [5056, 1856, 1, 32]
    - [142, 5.036]
  - - [5888, 1856, 1, 32]
    - [133, 5.129]
  - - [6784, 1856, 1, 32]
    - [133, 5.165]
  - - [64, 2368, 1, 32]
    - [6, 0.622]
  - - [128, 2368, 1, 32]
    - [16, 1.135]
  - - [256, 2368, 1, 32]
    - [6, 2.017]
  - - [448, 2368, 1, 32]
    - [134, 2.715]
  - - [704, 2368, 1, 32]
    - [140, 3.351]
  - - [1024, 2368, 1, 32]
    - [133, 3.667]
  - - [1408, 2368, 1, 32]
    - [143, 3.947]
  - - [1856, 2368, 1, 32]
    - [145, 4.344]
  - - [2368, 2368, 1, 32]
    - [133, 4.613]
  - - [2944, 2368, 1, 32]
    - [133, 4.866]
  - - [3584, 2368, 1, 32]
    - [141, 4.964]
  - - [4288, 2368, 1, 32]
    - [142, 5.111]
  - - [5056, 2368, 1, 32]
    - [133, 5.219]
  - - [5888, 2368, 1, 32]
    - [141, 5.259]
  - - [6784, 2368, 1, 32]
    - [142, 5.316]
  - - [64, 2944, 1, 32]
    - [19, 0.784]
  - - [128, 2944, 1, 32]
    - [6, 1.343]
  - - [256, 2944, 1, 32]
    - [39, 2.235]
  - - [448, 2944, 1, 32]
    - [146, 3.062]
  - - [704, 2944, 1, 32]
    - [133, 3.588]
  - - [1024, 2944, 1, 32]
    - [134, 3.925]
  - - [1408, 2944, 1, 32]
    - [142, 4.295]
  - - [1856, 2944, 1, 32]
    - [145, 4.558]
  - - [2368, 2944, 1, 32]
    - [133, 4.81]
  - - [2944, 2944, 1, 32]
    - [141, 4.953]
  - - [3584, 2944, 1, 32]
    - [146, 5.121]
  - - [4288, 2944, 1, 32]
    - [133, 5.258]
  - - [5056, 2944, 1, 32]
    - [133, 5.345]
  - - [5888, 2944, 1, 32]
    - [133, 5.346]
  - - [6784, 2944, 1, 32]
    - [133, 5.422]
  - - [64, 3584, 1, 32]
    - [6, 0.928]
  - - [128, 3584, 1, 32]
    - [16, 1.597]
  - - [256, 3584, 1, 32]
    - [139, 2.668]
  - - [448, 3584, 1, 32]
    - [141, 3.249]
  - - [704, 3584, 1, 32]
    - [140, 3.759]
  - - [1024, 3584, 1, 32]
    - [132, 4.071]
  - - [1408, 3584, 1, 32]
    - [142, 4.552]
  - - [1856, 3584, 1, 32]
    - [134, 4.754]
  - - [2368, 3584, 1, 32]
    - [133, 4.983]
  - - [2944, 3584, 1, 32]
    - [133, 5.088]
  - - [3584, 3584, 1, 32]
    - [133, 5.226]
  - - [4288, 3584, 1, 32]
    - [133, 5.327]
  - - [5056, 3584, 1, 32]
    - [133, 5.41]
  - - [5888, 3584, 1, 32]
    - [133, 5.471]
  - - [6784, 3584, 1, 32]
    - [133, 5.479]
  - - [64, 4288, 1, 32]
    - [19, 1.054]
  - - [128, 4288, 1, 32]
    - [6, 1.826]
  - - [256, 4288, 1, 32]
    - [141, 2.762]
  - - [448, 4288, 1, 32]
    - [133, 3.508]
  - - [704, 4288, 1, 32]
    - [133, 3.982]
  - - [1024, 4288, 1, 32]
    - [133, 4.311]
  - - [1408, 4288, 1, 32]
    - [144, 4.684]
  - - [1856, 4288, 1, 32]
    - [142, 4.914]
  - - [2368, 4288, 1, 32]
    - [142, 5.111]
  - - [2944, 4288, 1, 32]
    - [133, 5.229]
  - - [3584, 4288, 1, 32]
    - [133, 5.327]
  - - [4288, 4288, 1, 32]
    - [143, 5.425]
  - - [5056, 4288, 1, 32]
    - [141, 5.54]
  - - [5888, 4288, 1, 32]
    - [146, 5.515]
  - - [6784, 4288, 1, 32]
    - [133, 5.574]
  - - [64, 5056, 1, 32]
    - [68, 1.227]
  - - [128, 5056, 1, 32]
    - [139, 2.019]
  - - [256, 5056, 1, 32]
    - [134, 3.052]
  - - [448, 5056, 1, 32]
    - [133, 3.707]
  - - [704, 5056, 1, 32]
    - [140, 4.084]
  - - [1024, 5056, 1, 32]
    - [133, 4.455]
  - - [1408, 5056, 1, 32]
    - [133, 4.823]
  - - [1856, 5056, 1, 32]
    - [133, 5.045]
  - - [2368, 5056, 1, 32]
    - [133, 5.211]
  - - [2944, 5056, 1, 32]
    - [133, 5.338]
  - - [3584, 5056, 1, 32]
    - [133, 5.389]
  - - [4288, 5056, 1, 32]
    - [133, 5.516]
  - - [5056, 5056, 1, 32]
    - [143, 5.551]
  - - [5888, 5056, 1, 32]
    - [133, 5.589]
  - - [6784, 5056, 1, 32]
    - [141, 5.585]
  - - [64, 5888, 1, 32]
    - [19, 1.393]
  - - [128, 5888, 1, 32]
    - [134, 2.257]
  - - [256, 5888, 1, 32]
    - [141, 3.201]
  - - [448, 5888, 1, 32]
    - [132, 3.816]
  - - [704, 5888, 1, 32]
    - [142, 4.325]
  - - [1024, 5888, 1, 32]
    - [133, 4.63]
  - - [1408, 5888, 1, 32]
    - [132, 4.906]
  - - [1856, 5888, 1, 32]
    - [133, 5.17]
  - - [2368, 5888, 1, 32]
    - [142, 5.285]
  - - [2944, 5888, 1, 32]
    - [133, 5.352]
  - - [3584, 5888, 1, 32]
    - [133, 5.495]
  - - [4288, 5888, 1, 32]
    - [145, 5.572]
  - - [5056, 5888, 1, 32]
    - [142, 5.603]
  - - [5888, 5888, 1, 32]
    - [141, 5.621]
  - - [6784, 5888, 1, 32]
    - [133, 5.629]
  - - [64, 6784, 1, 32]
    - [16, 1.567]
  - - [128, 6784, 1, 32]
    - [134, 2.5]
  - - [256, 6784, 1, 32]
    - [134, 3.422]
  - - [448, 6784, 1, 32]
    - [142, 4.009]
  - - [704, 6784, 1, 32]
    - [134, 4.428]
  - - [1024, 6784, 1, 32]
    - [134, 4.761]
  - - [1408, 6784, 1, 32]
    - [142, 5.036]
  - - [1856, 6784, 1, 32]
    - [141, 5.252]
  - - [2368, 6784, 1, 32]
    - [142, 5.363]
  - - [2944, 6784, 1, 32]
    - [147, 5.432]
  - - [3584, 6784, 1, 32]
    - [133, 5.562]
  - - [4288, 6784, 1, 32]
    - [133, 5.599]
  - - [5056, 6784, 1, 32]
    - [133, 5.647]
  - - [5888, 6784, 1, 32]
    - [133, 5.645]
  - - [6784, 6784, 1, 32]
    - [133, 5.651]
  - - [32, 32, 1, 256]
    - [5, 0.026]
  - - [32, 32, 1, 1280]
    - [4, 0.071]
  - - [32, 32, 1, 3328]
    - [13, 0.162]
  - - [32, 64, 1, 32]
    - [6, 0.009]
  - - [32, 128, 1, 32]
    - [19, 0.019]
  - - [32, 256, 1, 32]
    - [8, 0.04]
  - - [32, 448, 1, 32]
    - [6, 0.068]
  - - [32, 704, 1, 32]
    - [8, 0.112]
  - - [32, 1024, 1, 32]
    - [68, 0.158]
  - - [32, 1408, 1, 32]
    - [19, 0.214]
  - - [32, 1856, 1, 32]
    - [8, 0.296]
  - - [32, 2368, 1, 32]
    - [19, 0.349]
  - - [32, 2944, 1, 32]
    - [8, 0.434]
  - - [32, 3584, 1, 32]
    - [19, 0.505]
  - - [32, 4288, 1, 32]
    - [8, 0.596]
  - - [32, 5056, 1, 32]
    - [6, 0.682]
  - - [32, 5888, 1, 32]
    - [19, 0.773]
  - - [32, 6784, 1, 32]
    - [68, 0.903]
  - - [64, 32, 1, 32]
    - [6, 0.009]
  - - [128, 32, 1, 32]
    - [6, 0.018]
  - - [256, 32, 1, 32]
    - [19, 0.038]
  - - [448, 32, 1, 32]
    - [6, 0.066]
  - - [704, 32, 1, 32]
    - [6, 0.102]
  - - [1024, 32, 1, 32]
    - [6, 0.156]
  - - [1408, 32, 1, 32]
    - [6, 0.208]
  - - [1856, 32, 1, 32]
    - [68, 0.269]
  - - [2368, 32, 1, 32]
    - [6, 0.329]
  - - [2944, 32, 1, 32]
    - [6, 0.415]
  - - [3584, 32, 1, 32]
    - [6, 0.491]
  - - [4288, 32, 1, 32]
    - [6, 0.563]
  - - [5056, 32, 1, 32]
    - [6, 0.673]
  - - [5888, 32, 1, 32]
    - [6, 0.773]
  - - [6784, 32, 1, 32]
    - [6, 0.867]
  - - [1, 1, 1, 1]
    - [148, 0.0]
  - - [1, 64, 1, 256]
    - [149, 0.0]
  - - [1, 128, 1, 256]
    - [150, 0.001]
  - - [1, 256, 1, 256]
    - [150, 0.001]
  - - [1, 448, 1, 256]
    - [149, 0.003]
  - - [1, 704, 1, 256]
    - [149, 0.004]
  - - [1, 1024, 1, 256]
    - [150, 0.006]
  - - [1, 1408, 1, 256]
    - [150, 0.009]
  - - [1, 1856, 1, 256]
    - [151, 0.011]
  - - [1, 2368, 1, 256]
    - [149, 0.013]
  - - [1, 2944, 1, 256]
    - [150, 0.017]
  - - [1, 3584, 1, 256]
    - [149, 0.021]
  - - [1, 4288, 1, 256]
    - [149, 0.023]
  - - [1, 5056, 1, 256]
    - [149, 0.028]
  - - [1, 5888, 1, 256]
    - [149, 0.033]
  - - [1, 6784, 1, 256]
    - [149, 0.036]
  - - [1, 64, 1, 1280]
    - [152, 0.001]
  - - [1, 128, 1, 1280]
    - [152, 0.001]
  - - [1, 256, 1, 1280]
    - [150, 0.002]
  - - [1, 448, 1, 1280]
    - [150, 0.003]
  - - [1, 704, 1, 1280]
    - [150, 0.006]
  - - [1, 1024, 1, 1280]
    - [150, 0.008]
  - - [1, 1408, 1, 1280]
    - [150, 0.011]
  - - [1, 1856, 1, 1280]
    - [150, 0.015]
  - - [1, 2368, 1, 1280]
    - [150, 0.018]
  - - [1, 2944, 1, 1280]
    - [150, 0.023]
  - - [1, 3584, 1, 1280]
    - [150, 0.027]
  - - [1, 4288, 1, 1280]
    - [150, 0.033]
  - - [1, 5056, 1, 1280]
    - [150, 0.039]
  - - [1, 5888, 1, 1280]
    - [150, 0.045]
  - - [1, 6784, 1, 1280]
    - [150, 0.052]
  - - [1, 64, 1, 3328]
    - [150, 0.001]
  - - [1, 128, 1, 3328]
    - [150, 0.001]
  - - [1, 256, 1, 3328]
    - [150, 0.002]
  - - [1, 448, 1, 3328]
    - [150, 0.004]
  - - [1, 704, 1, 3328]
    - [150, 0.006]
  - - [1, 1024, 1, 3328]
    - [150, 0.009]
  - - [1, 1408, 1, 3328]
    - [150, 0.012]
  - - [1, 1856, 1, 3328]
    - [150, 0.015]
  - - [1, 2368, 1, 3328]
    - [150, 0.02]
  - - [1, 2944, 1, 3328]
    - [150, 0.024]
  - - [1, 3584, 1, 3328]
    - [150, 0.03]
  - - [1, 4288, 1, 3328]
    - [150, 0.035]
  - - [1, 5056, 1, 3328]
    - [150, 0.042]
  - - [1, 5888, 1, 3328]
    - [150, 0.048]
  - - [1, 6784, 1, 3328]
    - [150, 0.056]
  - - [64, 1, 1, 256]
    - [5, 0.002]
  - - [128, 1, 1, 256]
    - [38, 0.003]
  - - [256, 1, 1, 256]
    - [5, 0.006]
  - - [448, 1, 1, 256]
    - [15, 0.011]
  - - [704, 1, 1, 256]
    - [5, 0.017]
  - - [1024, 1, 1, 256]
    - [68, 0.025]
  - - [1408, 1, 1, 256]
    - [7, 0.035]
  - - [1856, 1, 1, 256]
    - [5, 0.045]
  - - [2368, 1, 1, 256]
    - [7, 0.058]
  - - [2944, 1, 1, 256]
    - [7, 0.071]
  - - [3584, 1, 1, 256]
    - [5, 0.083]
  - - [4288, 1, 1, 256]
    - [5, 0.101]
  - - [5056, 1, 1, 256]
    - [7, 0.125]
  - - [5888, 1, 1, 256]
    - [8, 0.142]
  - - [6784, 1, 1, 256]
    - [6, 0.163]
  - - [64, 1, 1, 1280]
    - [4, 0.005]
  - - [128, 1, 1, 1280]
    - [4, 0.009]
  - - [256, 1, 1, 1280]
    - [4, 0.019]
  - - [448, 1, 1, 1280]
    - [4, 0.032]
  - - [704, 1, 1, 1280]
    - [4, 0.051]
  - - [1024, 1, 1, 1280]
    - [4, 0.078]
  - - [1408, 1, 1, 1280]
    - [4, 0.106]
  - - [1856, 1, 1, 1280]
    - [2, 0.128]
  - - [2368, 1, 1, 1280]
    - [40, 0.158]
  - - [2944, 1, 1, 1280]
    - [20, 0.193]
  - - [3584, 1, 1, 1280]
    - [3, 0.233]
  - - [4288, 1, 1, 1280]
    - [41, 0.256]
  - - [5056, 1, 1, 1280]
    - [11, 0.297]
  - - [5888, 1, 1, 1280]
    - [7, 0.346]
  - - [6784, 1, 1, 1280]
    - [7, 0.396]
  - - [64, 1, 1, 3328]
    - [13, 0.01]
  - - [128, 1, 1, 3328]
    - [13, 0.02]
  - - [256, 1, 1, 3328]
    - [13, 0.039]
  - - [448, 1, 1, 3328]
    - [32, 0.067]
  - - [704, 1, 1, 3328]
    - [32, 0.105]
  - - [1024, 1, 1, 3328]
    - [13, 0.153]
  - - [1408, 1, 1, 3328]
    - [4, 0.216]
  - - [1856, 1, 1, 3328]
    - [13, 0.263]
  - - [2368, 1, 1, 3328]
    - [14, 0.285]
  - - [2944, 1, 1, 3328]
    - [14, 0.332]
  - - [3584, 1, 1, 3328]
    - [13, 0.341]
  - - [4288, 1, 1, 3328]
    - [13, 0.387]
  - - [5056, 1, 1, 3328]
    - [46, 0.399]
  - - [5888, 1, 1, 3328]
    - [7, 0.443]
  - - [6784, 1, 1, 3328]
    - [7, 0.504]
  - - [64, 64, 1, 1]
    - [6, 0.0]
  - - [128, 64, 1, 1]
    - [6, 0.001]
  - - [256, 64, 1, 1]
    - [68, 0.002]
  - - [448, 64, 1, 1]
    - [68, 0.003]
  - - [704, 64, 1, 1]
    - [153, 0.006]
  - - [1024, 64, 1, 1]
    - [6, 0.008]
  - - [1408, 64, 1, 1]
    - [6, 0.011]
  - - [1856, 64, 1, 1]
    - [8, 0.015]
  - - [2368, 64, 1, 1]
    - [6, 0.018]
  - - [2944, 64, 1, 1]
    - [6, 0.021]
  - - [3584, 64, 1, 1]
    - [144, 0.026]
  - - [4288, 64, 1, 1]
    - [68, 0.031]
  - - [5056, 64, 1, 1]
    - [6, 0.035]
  - - [5888, 64, 1, 1]
    - [68, 0.039]
  - - [6784, 64, 1, 1]
    - [68, 0.046]
  - - [64, 128, 1, 1]
    - [8, 0.001]
  - - [128, 128, 1, 1]
    - [153, 0.002]
  - - [256, 128, 1, 1]
    - [153, 0.004]
  - - [448, 128, 1, 1]
    - [6, 0.007]
  - - [704, 128, 1, 1]
    - [153, 0.011]
  - - [1024, 128, 1, 1]
    - [68, 0.015]
  - - [1408, 128, 1, 1]
    - [6, 0.021]
  - - [1856, 128, 1, 1]
    - [68, 0.027]
  - - [2368, 128, 1, 1]
    - [68, 0.033]
  - - [2944, 128, 1, 1]
    - [144, 0.039]
  - - [3584, 128, 1, 1]
    - [6, 0.047]
  - - [4288, 128, 1, 1]
    - [8, 0.052]
  - - [5056, 128, 1, 1]
    - [144, 0.058]
  - - [5888, 128, 1, 1]
    - [138, 0.061]
  - - [6784, 128, 1, 1]
    - [144, 0.068]
  - - [64, 256, 1, 1]
    - [68, 0.002]
  - - [128, 256, 1, 1]
    - [153, 0.004]
  - - [256, 256, 1, 1]
    - [6, 0.008]
  - - [448, 256, 1, 1]
    - [8, 0.013]
  - - [704, 256, 1, 1]
    - [68, 0.02]
  - - [1024, 256, 1, 1]
    - [8, 0.028]
  - - [1408, 256, 1, 1]
    - [8, 0.037]
  - - [1856, 256, 1, 1]
    - [6, 0.047]
  - - [2368, 256, 1, 1]
    - [68, 0.055]
  - - [2944, 256, 1, 1]
    - [134, 0.06]
  - - [3584, 256, 1, 1]
    - [138, 0.072]
  - - [4288, 256, 1, 1]
    - [6, 0.073]
  - - [5056, 256, 1, 1]
    - [133, 0.08]
  - - [5888, 256, 1, 1]
    - [154, 0.085]
  - - [6784, 256, 1, 1]
    - [93, 0.094]
  - - [64, 448, 1, 1]
    - [8, 0.003]
  - - [128, 448, 1, 1]
    - [68, 0.007]
  - - [256, 448, 1, 1]
    - [68, 0.014]
  - - [448, 448, 1, 1]
    - [68, 0.022]
  - - [704, 448, 1, 1]
    - [6, 0.032]
  - - [1024, 448, 1, 1]
    - [6, 0.043]
  - - [1408, 448, 1, 1]
    - [143, 0.054]
  - - [1856, 448, 1, 1]
    - [18, 0.064]
  - - [2368, 448, 1, 1]
    - [53, 0.071]
  - - [2944, 448, 1, 1]
    - [49, 0.081]
  - - [3584, 448, 1, 1]
    - [49, 0.089]
  - - [4288, 448, 1, 1]
    - [143, 0.096]
  - - [5056, 448, 1, 1]
    - [54, 0.1]
  - - [5888, 448, 1, 1]
    - [72, 0.106]
  - - [6784, 448, 1, 1]
    - [143, 0.109]
  - - [64, 704, 1, 1]
    - [153, 0.006]
  - - [128, 704, 1, 1]
    - [8, 0.011]
  - - [256, 704, 1, 1]
    - [68, 0.02]
  - - [448, 704, 1, 1]
    - [8, 0.034]
  - - [704, 704, 1, 1]
    - [8, 0.046]
  - - [1024, 704, 1, 1]
    - [133, 0.057]
  - - [1408, 704, 1, 1]
    - [49, 0.068]
  - - [1856, 704, 1, 1]
    - [49, 0.079]
  - - [2368, 704, 1, 1]
    - [93, 0.091]
  - - [2944, 704, 1, 1]
    - [54, 0.096]
  - - [3584, 704, 1, 1]
    - [55, 0.108]
  - - [4288, 704, 1, 1]
    - [143, 0.107]
  - - [5056, 704, 1, 1]
    - [143, 0.114]
  - - [5888, 704, 1, 1]
    - [143, 0.119]
  - - [6784, 704, 1, 1]
    - [144, 0.123]
  - - [64, 1024, 1, 1]
    - [8, 0.009]
  - - [128, 1024, 1, 1]
    - [68, 0.015]
  - - [256, 1024, 1, 1]
    - [8, 0.029]
  - - [448, 1024, 1, 1]
    - [8, 0.047]
  - - [704, 1024, 1, 1]
    - [155, 0.059]
  - - [1024, 1024, 1, 1]
    - [134, 0.069]
  - - [1408, 1024, 1, 1]
    - [49, 0.084]
  - - [1856, 1024, 1, 1]
    - [69, 0.097]
  - - [2368, 1024, 1, 1]
    - [55, 0.102]
  - - [2944, 1024, 1, 1]
    - [145, 0.106]
  - - [3584, 1024, 1, 1]
    - [145, 0.114]
  - - [4288, 1024, 1, 1]
    - [143, 0.12]
  - - [5056, 1024, 1, 1]
    - [145, 0.127]
  - - [5888, 1024, 1, 1]
    - [143, 0.132]
  - - [6784, 1024, 1, 1]
    - [144, 0.135]
  - - [64, 1408, 1, 1]
    - [8, 0.012]
  - - [128, 1408, 1, 1]
    - [8, 0.021]
  - - [256, 1408, 1, 1]
    - [8, 0.037]
  - - [448, 1408, 1, 1]
    - [144, 0.053]
  - - [704, 1408, 1, 1]
    - [57, 0.068]
  - - [1024, 1408, 1, 1]
    - [133, 0.084]
  - - [1408, 1408, 1, 1]
    - [61, 0.095]
  - - [1856, 1408, 1, 1]
    - [156, 0.104]
  - - [2368, 1408, 1, 1]
    - [143, 0.111]
  - - [2944, 1408, 1, 1]
    - [144, 0.119]
  - - [3584, 1408, 1, 1]
    - [145, 0.125]
  - - [4288, 1408, 1, 1]
    - [143, 0.133]
  - - [5056, 1408, 1, 1]
    - [145, 0.137]
  - - [5888, 1408, 1, 1]
    - [143, 0.14]
  - - [6784, 1408, 1, 1]
    - [144, 0.143]
  - - [64, 1856, 1, 1]
    - [8, 0.015]
  - - [128, 1856, 1, 1]
    - [8, 0.028]
  - - [256, 1856, 1, 1]
    - [8, 0.047]
  - - [448, 1856, 1, 1]
    - [18, 0.065]
  - - [704, 1856, 1, 1]
    - [133, 0.08]
  - - [1024, 1856, 1, 1]
    - [93, 0.092]
  - - [1408, 1856, 1, 1]
    - [62, 0.106]
  - - [1856, 1856, 1, 1]
    - [143, 0.111]
  - - [2368, 1856, 1, 1]
    - [145, 0.121]
  - - [2944, 1856, 1, 1]
    - [145, 0.128]
  - - [3584, 1856, 1, 1]
    - [145, 0.135]
  - - [4288, 1856, 1, 1]
    - [145, 0.139]
  - - [5056, 1856, 1, 1]
    - [143, 0.143]
  - - [5888, 1856, 1, 1]
    - [145, 0.147]
  - - [6784, 1856, 1, 1]
    - [143, 0.148]
  - - [64, 2368, 1, 1]
    - [8, 0.018]
  - - [128, 2368, 1, 1]
    - [8, 0.034]
  - - [256, 2368, 1, 1]
    - [8, 0.057]
  - - [448, 2368, 1, 1]
    - [57, 0.074]
  - - [704, 2368, 1, 1]
    - [157, 0.091]
  - - [1024, 2368, 1, 1]
    - [72, 0.101]
  - - [1408, 2368, 1, 1]
    - [143, 0.109]
  - - [1856, 2368, 1, 1]
    - [143, 0.12]
  - - [2368, 2368, 1, 1]
    - [145, 0.129]
  - - [2944, 2368, 1, 1]
    - [144, 0.134]
  - - [3584, 2368, 1, 1]
    - [145, 0.142]
  - - [4288, 2368, 1, 1]
    - [145, 0.145]
  - - [5056, 2368, 1, 1]
    - [143, 0.148]
  - - [5888, 2368, 1, 1]
    - [145, 0.15]
  - - [6784, 2368, 1, 1]
    - [145, 0.152]
  - - [64, 2944, 1, 1]
    - [68, 0.023]
  - - [128, 2944, 1, 1]
    - [8, 0.038]
  - - [256, 2944, 1, 1]
    - [158, 0.06]
  - - [448, 2944, 1, 1]
    - [133, 0.08]
  - - [704, 2944, 1, 1]
    - [54, 0.095]
  - - [1024, 2944, 1, 1]
    - [143, 0.104]
  - - [1408, 2944, 1, 1]
    - [145, 0.118]
  - - [1856, 2944, 1, 1]
    - [145, 0.128]
  - - [2368, 2944, 1, 1]
    - [143, 0.134]
  - - [2944, 2944, 1, 1]
    - [144, 0.139]
  - - [3584, 2944, 1, 1]
    - [145, 0.146]
  - - [4288, 2944, 1, 1]
    - [57, 0.151]
  - - [5056, 2944, 1, 1]
    - [145, 0.151]
  - - [5888, 2944, 1, 1]
    - [143, 0.154]
  - - [6784, 2944, 1, 1]
    - [57, 0.156]
  - - [64, 3584, 1, 1]
    - [68, 0.028]
  - - [128, 3584, 1, 1]
    - [6, 0.045]
  - - [256, 3584, 1, 1]
    - [138, 0.071]
  - - [448, 3584, 1, 1]
    - [159, 0.088]
  - - [704, 3584, 1, 1]
    - [55, 0.104]
  - - [1024, 3584, 1, 1]
    - [144, 0.111]
  - - [1408, 3584, 1, 1]
    - [143, 0.124]
  - - [1856, 3584, 1, 1]
    - [143, 0.134]
  - - [2368, 3584, 1, 1]
    - [144, 0.14]
  - - [2944, 3584, 1, 1]
    - [57, 0.146]
  - - [3584, 3584, 1, 1]
    - [144, 0.149]
  - - [4288, 3584, 1, 1]
    - [145, 0.151]
  - - [5056, 3584, 1, 1]
    - [144, 0.154]
  - - [5888, 3584, 1, 1]
    - [143, 0.156]
  - - [6784, 3584, 1, 1]
    - [57, 0.158]
  - - [64, 4288, 1, 1]
    - [8, 0.031]
  - - [128, 4288, 1, 1]
    - [68, 0.052]
  - - [256, 4288, 1, 1]
    - [57, 0.076]
  - - [448, 4288, 1, 1]
    - [93, 0.098]
  - - [704, 4288, 1, 1]
    - [57, 0.106]
  - - [1024, 4288, 1, 1]
    - [145, 0.118]
  - - [1408, 4288, 1, 1]
    - [143, 0.128]
  - - [1856, 4288, 1, 1]
    - [145, 0.138]
  - - [2368, 4288, 1, 1]
    - [145, 0.144]
  - - [2944, 4288, 1, 1]
    - [53, 0.148]
  - - [3584, 4288, 1, 1]
    - [57, 0.152]
  - - [4288, 4288, 1, 1]
    - [57, 0.155]
  - - [5056, 4288, 1, 1]
    - [57, 0.157]
  - - [5888, 4288, 1, 1]
    - [57, 0.159]
  - - [6784, 4288, 1, 1]
    - [57, 0.161]
  - - [64, 5056, 1, 1]
    - [68, 0.036]
  - - [128, 5056, 1, 1]
    - [143, 0.059]
  - - [256, 5056, 1, 1]
    - [133, 0.081]
  - - [448, 5056, 1, 1]
    - [57, 0.098]
  - - [704, 5056, 1, 1]
    - [143, 0.111]
  - - [1024, 5056, 1, 1]
    - [145, 0.123]
  - - [1408, 5056, 1, 1]
    - [144, 0.135]
  - - [1856, 5056, 1, 1]
    - [57, 0.143]
  - - [2368, 5056, 1, 1]
    - [53, 0.148]
  - - [2944, 5056, 1, 1]
    - [57, 0.152]
  - - [3584, 5056, 1, 1]
    - [57, 0.155]
  - - [4288, 5056, 1, 1]
    - [57, 0.158]
  - - [5056, 5056, 1, 1]
    - [57, 0.16]
  - - [5888, 5056, 1, 1]
    - [57, 0.161]
  - - [6784, 5056, 1, 1]
    - [66, 0.162]
  - - [64, 5888, 1, 1]
    - [8, 0.04]
  - - [128, 5888, 1, 1]
    - [39, 0.061]
  - - [256, 5888, 1, 1]
    - [49, 0.084]
  - - [448, 5888, 1, 1]
    - [143, 0.1]
  - - [704, 5888, 1, 1]
    - [145, 0.117]
  - - [1024, 5888, 1, 1]
    - [145, 0.127]
  - - [1408, 5888, 1, 1]
    - [66, 0.137]
  - - [1856, 5888, 1, 1]
    - [57, 0.145]
  - - [2368, 5888, 1, 1]
    - [57, 0.15]
  - - [2944, 5888, 1, 1]
    - [57, 0.153]
  - - [3584, 5888, 1, 1]
    - [57, 0.158]
  - - [4288, 5888, 1, 1]
    - [57, 0.161]
  - - [5056, 5888, 1, 1]
    - [57, 0.161]
  - - [5888, 5888, 1, 1]
    - [57, 0.164]
  - - [6784, 5888, 1, 1]
    - [57, 0.165]
  - - [64, 6784, 1, 1]
    - [8, 0.045]
  - - [128, 6784, 1, 1]
    - [138, 0.068]
  - - [256, 6784, 1, 1]
    - [107, 0.093]
  - - [448, 6784, 1, 1]
    - [57, 0.106]
  - - [704, 6784, 1, 1]
    - [143, 0.121]
  - - [1024, 6784, 1, 1]
    - [144, 0.131]
  - - [1408, 6784, 1, 1]
    - [144, 0.142]
  - - [1856, 6784, 1, 1]
    - [143, 0.149]
  - - [2368, 6784, 1, 1]
    - [53, 0.153]
  - - [2944, 6784, 1, 1]
    - [57, 0.156]
  - - [3584, 6784, 1, 1]
    - [57, 0.159]
  - - [4288, 6784, 1, 1]
    - [57, 0.162]
  - - [5056, 6784, 1, 1]
    - [57, 0.163]
  - - [5888, 6784, 1, 1]
    - [57, 0.166]
  - - [6784, 6784, 1, 1]
    - [57, 0.166]
  - - [1, 1, 1, 256]
    - [148, 0.0]
  - - [1, 1, 1, 1280]
    - [148, 0.0]
  - - [1, 1, 1, 3328]
    - [150, 0.0]
  - - [1, 64, 1, 1]
    - [160, 0.0]
  - - [1, 128, 1, 1]
    - [148, 0.0]
  - - [1, 256, 1, 1]
    - [160, 0.0]
  - - [1, 448, 1, 1]
    - [160, 0.0]
  - - [1, 704, 1, 1]
    - [160, 0.0]
  - - [1, 1024, 1, 1]
    - [160, 0.0]
  - - [1, 1408, 1, 1]
    - [148, 0.0]
  - - [1, 1856, 1, 1]
    - [148, 0.0]
  - - [1, 2368, 1, 1]
    - [148, 0.0]
  - - [1, 2944, 1, 1]
    - [148, 0.0]
  - - [1, 3584, 1, 1]
    - [160, 0.0]
  - - [1, 4288, 1, 1]
    - [148, 0.0]
  - - [1, 5056, 1, 1]
    - [148, 0.001]
  - - [1, 5888, 1, 1]
    - [148, 0.001]
  - - [1, 6784, 1, 1]
    - [148, 0.001]
  - - [64, 1, 1, 1]
    - [151, 0.0]
  - - [128, 1, 1, 1]
    - [153, 0.0]
  - - [256, 1, 1, 1]
    - [8, 0.0]
  - - [448, 1, 1, 1]
    - [8, 0.0]
  - - [704, 1, 1, 1]
    - [68, 0.0]
  - - [1024, 1, 1, 1]
    - [153, 0.0]
  - - [1408, 1, 1, 1]
    - [153, 0.0]
  - - [1856, 1, 1, 1]
    - [8, 0.0]
  - - [2368, 1, 1, 1]
    - [6, 0.0]
  - - [2944, 1, 1, 1]
    - [6, 0.0]
  - - [3584, 1, 1, 1]
    - [6, 0.0]
  - - [4288, 1, 1, 1]
    - [68, 0.001]
  - - [5056, 1, 1, 1]
    - [153, 0.001]
  - - [5888, 1, 1, 1]
    - [19, 0.001]
  - - [6784, 1, 1, 1]
    - [8, 0.001]
  - - [7680, 8192, 1, 8192]
    - [120, 87.67]
  - - [3840, 4096, 1, 4096]
    - [126, 78.463]
  - - [1920, 2048, 1, 2048]
    - [161, 60.436]
  - - [960, 1024, 1, 1024]
    - [44, 29.624]
  - - [480, 512, 1, 512]
    - [7, 8.723]
  - - [8192, 7680, 1, 8192]
    - [120, 87.119]
  - - [4096, 3840, 1, 4096]
    - [94, 69.244]
  - - [2048, 1920, 1, 2048]
    - [121, 59.529]
  - - [1024, 960, 1, 1024]
    - [75, 27.148]
  - - [512, 480, 1, 512]
    - [41, 8.658]
  - - [8192, 8192, 1, 8192]
    - [120, 86.053]
  - - [4096, 4096, 1, 4096]
    - [63, 69.872]
  - - [2048, 2048, 1, 2048]
    - [104, 58.252]
  - - [512, 512, 1, 512]
    - [12, 8.263]
  - - [64, 512, 16, 512]
    - [97, 13.222]
  - - [64, 512, 128, 512]
    - [66, 22.133]
  - - [1024, 1, 1, 2]
    - [162, 0.0]
  - - [1024, 1, 1, 1024]
    - [10, 0.062]
  - - [1024, 8, 1, 1024]
    - [10, 0.488]
  - - [1024, 77, 1, 1024]
    - [20, 4.752]
  - - [1024, 77, 1, 30522]
    - [1, 27.839]
  - - [1024, 512, 1, 2]
    - [163, 0.12]
  - - [1024, 512, 1, 1024]
    - [28, 18.817]
  - - [1024, 512, 1, 4096]
    - [35, 28.466]
  - - [1024, 616, 1, 1024]
    - [29, 20.989]
  - - [1024, 4096, 1, 2]
    - [163, 0.301]
  - - [1024, 4096, 1, 1024]
    - [98, 46.253]
  - - [1024, 4096, 1, 4096]
    - [88, 66.629]
  - - [4096, 512, 1, 1024]
    - [164, 34.65]
  - - [4096, 4096, 1, 1024]
    - [63, 56.651]
  - - [64, 128, 128, 128]
    - [134, 7.9]
  - - [64, 128, 160, 128]
    - [134, 8.921]
  - - [1024, 10, 1, 2]
    - [165, 0.003]
  - - [1024, 10, 1, 1024]
    - [10, 0.609]
  - - [1024, 160, 1, 1024]
    - [25, 8.441]
  - - [1024, 200, 1, 1024]
    - [15, 10.275]
  - - [1024, 200, 1, 30522]
    - [166, 42.918]
  - - [1024, 1024, 1, 2]
    - [167, 0.192]
  - - [1024, 1024, 1, 4096]
    - [76, 41.056]
  - - [1024, 1280, 1, 2]
    - [167, 0.225]
  - - [1024, 1280, 1, 1024]
    - [76, 35.382]
  - - [1024, 1280, 1, 4096]
    - [76, 47.895]
  - - [4096, 1024, 1, 1024]
    - [118, 45.313]
  - - [4096, 1280, 1, 1024]
    - [168, 43.88]
  - - [64, 128, 624, 128]
    - [134, 11.532]
  - - [1024, 39, 1, 2]
    - [162, 0.011]
  - - [1024, 39, 1, 1024]
    - [3, 2.407]
  - - [1024, 780, 1, 1024]
    - [29, 26.951]
  - - [1024, 780, 1, 30522]
    - [169, 64.049]
  - - [1024, 4992, 1, 2]
    - [163, 0.312]
  - - [1024, 4992, 1, 1024]
    - [55, 44.777]
  - - [1024, 4992, 1, 4096]
    - [105, 55.508]
  - - [4096, 4992, 1, 1024]
    - [63, 54.856]
  - - [64, 512, 64, 512]
    - [53, 21.425]
  - - [1024, 4, 1, 2]
    - [162, 0.001]
  - - [1024, 4, 1, 1024]
    - [40, 0.25]
  - - [1024, 308, 1, 1024]
    - [26, 13.433]
  - - [1024, 308, 1, 30522]
    - [170, 54.532]
  - - [1024, 2048, 1, 2]
    - [163, 0.26]
  - - [1024, 2048, 1, 1024]
    - [55, 36.016]
  - - [1024, 2048, 1, 4096]
    - [171, 52.336]
  - - [4096, 2048, 1, 1024]
    - [63, 48.927]
  - - [64, 128, 640, 128]
    - [147, 11.46]
  - - [1024, 40, 1, 2]
    - [162, 0.011]
  - - [1024, 40, 1, 1024]
    - [3, 2.532]
  - - [1024, 800, 1, 1024]
    - [29, 27.258]
  - - [1024, 800, 1, 30522]
    - [169, 65.544]
  - - [1024, 5120, 1, 2]
    - [167, 0.312]
  - - [1024, 5120, 1, 1024]
    - [98, 45.182]
  - - [1024, 5120, 1, 4096]
    - [105, 56.579]
  - - [4096, 5120, 1, 1024]
    - [63, 56.404]
  - - [64, 128, 656, 128]
    - [141, 11.516]
  - - [1024, 41, 1, 2]
    - [165, 0.011]
  - - [1024, 41, 1, 1024]
    - [3, 2.613]
  - - [1024, 820, 1, 1024]
    - [29, 27.843]
  - - [1024, 820, 1, 30522]
    - [169, 64.577]
  - - [1024, 5248, 1, 2]
    - [167, 0.313]
  - - [1024, 5248, 1, 1024]
    - [55, 46.352]
  - - [1024, 5248, 1, 4096]
    - [105, 57.653]
  - - [4096, 5248, 1, 1024]
    - [63, 56.298]
  - - [64, 512, 80, 512]
    - [172, 21.181]
  - - [1024, 5, 1, 2]
    - [173, 0.001]
  - - [1024, 5, 1, 1024]
    - [3, 0.315]
  - - [1024, 385, 1, 1024]
    - [116, 16.355]
  - - [1024, 385, 1, 30522]
    - [174, 47.918]
  - - [1024, 2560, 1, 2]
    - [163, 0.273]
  - - [1024, 2560, 1, 1024]
    - [55, 42.434]
  - - [1024, 2560, 1, 4096]
    - [105, 54.404]
  - - [4096, 2560, 1, 1024]
    - [63, 50.192]
  - - [64, 512, 96, 512]
    - [175, 22.396]
  - - [1024, 6, 1, 2]
    - [176, 0.002]
  - - [1024, 6, 1, 1024]
    - [3, 0.368]
  - - [1024, 462, 1, 1024]
    - [28, 17.503]
  - - [1024, 462, 1, 30522]
    - [174, 56.164]
  - - [1024, 3072, 1, 2]
    - [177, 0.275]
  - - [1024, 3072, 1, 1024]
    - [178, 40.958]
  - - [1024, 3072, 1, 4096]
    - [124, 60.23]
  - - [4096, 3072, 1, 1024]
    - [92, 50.096]
  - - [1024, 8, 1, 2]
    - [179, 0.002]
  - - [1024, 160, 1, 30522]
    - [166, 35.561]
  - - [64, 128, 144, 128]
    - [49, 8.616]
  - - [1024, 9, 1, 2]
    - [176, 0.002]
  - - [1024, 9, 1, 1024]
    - [3, 0.559]
  - - [1024, 180, 1, 1024]
    - [25, 9.346]
  - - [1024, 180, 1, 30522]
    - [166, 39.144]
  - - [1024, 1152, 1, 2]
    - [167, 0.21]
  - - [1024, 1152, 1, 1024]
    - [75, 31.142]
  - - [1024, 1152, 1, 4096]
    - [77, 43.395]
  - - [4096, 1152, 1, 1024]
    - [180, 40.884]
  - - [256, 32768, 1, 128]
    - [70, 15.874]
  - - [479, 32768, 1, 1024]
    - [181, 44.566]
  - - [512, 32768, 1, 256]
    - [60, 29.928]
  - - [1024, 32768, 1, 512]
    - [89, 44.45]
  - - [1024, 32768, 1, 1024]
    - [89, 58.432]
  - - [64, 128, 512, 128]
    - [134, 11.14]
  - - [128, 128, 512, 64]
    - [133, 8.263]
  - - [1024, 32, 1, 2]
    - [176, 0.009]
  - - [1024, 32, 1, 1024]
    - [3, 1.975]
  - - [1024, 4096, 1, 30528]
    - [182, 86.625]
  - - [512, 512, 64, 64]
    - [141, 9.453]
  - - [1024, 2048, 1, 30528]
    - [183, 75.165]
  - - [64, 4, 32768, 4]
    - [179, 0.331]
  - - [64, 4, 38400, 4]
    - [179, 0.334]
  - - [1024, 8192, 1, 1024]
    - [89, 49.683]
  - - [1024, 8192, 1, 4096]
    - [88, 68.59]
  - - [1024, 8192, 1, 33712]
    - [130, 80.119]
  - - [1024, 9600, 1, 1024]
    - [89, 55.219]
  - - [1024, 9600, 1, 4096]
    - [88, 77.582]
  - - [1024, 9600, 1, 33712]
    - [130, 93.295]
  - - [4096, 8192, 1, 1024]
    - [63, 58.104]
  - - [4096, 9600, 1, 1024]
    - [63, 57.302]
  - - [1024, 10064, 1, 1024]
    - [98, 50.258]
  - - [1024, 10064, 1, 4096]
    - [121, 68.712]
  - - [1024, 10080, 1, 1024]
    - [98, 50.518]
  - - [1024, 10080, 1, 4096]
    - [121, 68.477]
  - - [1024, 10080, 1, 42720]
    - [121, 83.018]
  - - [1024, 10200, 1, 1024]
    - [89, 50.654]
  - - [1024, 10200, 1, 4096]
    - [121, 69.304]
  - - [1024, 3840, 1, 1024]
    - [184, 46.521]
  - - [1024, 3840, 1, 4096]
    - [121, 72.291]
  - - [1024, 3968, 1, 1024]
    - [105, 45.015]
  - - [1024, 3968, 1, 4096]
    - [104, 65.059]
  - - [1024, 3968, 1, 42720]
    - [127, 84.496]
  - - [1024, 6528, 1, 1024]
    - [89, 50.881]
  - - [1024, 6528, 1, 4096]
    - [121, 66.262]
  - - [1024, 6528, 1, 42720]
    - [114, 80.724]
  - - [1024, 7104, 1, 1024]
    - [89, 53.997]
  - - [1024, 7104, 1, 4096]
    - [121, 71.079]
  - - [1024, 7104, 1, 42720]
    - [121, 87.487]
  - - [1024, 7200, 1, 1024]
    - [89, 54.349]
  - - [1024, 7200, 1, 4096]
    - [121, 71.893]
  - - [1024, 7200, 1, 42720]
    - [121, 88.454]
  - - [1024, 8064, 1, 1024]
    - [89, 48.998]
  - - [1024, 8064, 1, 4096]
    - [88, 67.619]
  - - [1024, 8160, 1, 1024]
    - [89, 49.459]
  - - [1024, 8160, 1, 4096]
    - [88, 67.902]
  - - [1024, 9216, 1, 1024]
    - [89, 53.895]
  - - [1024, 9216, 1, 4096]
    - [125, 75.175]
  - - [1024, 9520, 1, 1024]
    - [89, 55.115]
  - - [1024, 9520, 1, 4096]
    - [88, 77.206]
  - - [1024, 9520, 1, 42720]
    - [125, 93.591]
  - - [4096, 10064, 1, 1024]
    - [63, 58.41]
  - - [4096, 10080, 1, 1024]
    - [63, 58.799]
  - - [4096, 10200, 1, 1024]
    - [63, 57.59]
  - - [4096, 3840, 1, 1024]
    - [185, 53.298]
  - - [4096, 3968, 1, 1024]
    - [63, 55.094]
  - - [4096, 6528, 1, 1024]
    - [63, 57.985]
  - - [4096, 7104, 1, 1024]
    - [63, 56.779]
  - - [4096, 7200, 1, 1024]
    - [118, 57.676]
  - - [4096, 8064, 1, 1024]
    - [63, 57.155]
  - - [4096, 8160, 1, 1024]
    - [63, 58.32]
  - - [4096, 9216, 1, 1024]
    - [63, 58.233]
  - - [4096, 9520, 1, 1024]
    - [118, 57.889]
  - - [64, 14, 10880, 14]
    - [186, 1.794]
  - - [64, 14, 10880, 15]
    - [133, 1.29]
  - - [64, 15, 7680, 15]
    - [134, 1.335]
  - - [64, 15, 10880, 15]
    - [133, 1.359]
  - - [64, 15, 7680, 17]
    - [133, 1.446]
  - - [64, 17, 6144, 17]
    - [141, 1.555]
  - - [64, 17, 7680, 17]
    - [134, 1.625]
  - - [64, 17, 6144, 21]
    - [134, 1.896]
  - - [64, 21, 6144, 21]
    - [134, 2.205]
  - - [64, 24, 4736, 24]
    - [187, 2.812]
  - - [64, 24, 4736, 34]
    - [187, 3.481]
  - - [64, 30, 2048, 30]
    - [188, 3.008]
  - - [64, 31, 2048, 30]
    - [187, 3.05]
  - - [64, 31, 2048, 31]
    - [133, 3.186]
  - - [64, 32, 4608, 32]
    - [189, 3.936]
  - - [64, 34, 4736, 34]
    - [177, 3.545]
  - - [64, 35, 4608, 32]
    - [140, 3.854]
  - - [64, 35, 4608, 35]
    - [140, 3.139]
  - - [64, 512, 1, 512]
    - [3, 1.287]
  - - [512, 512, 1, 64]
    - [6, 1.915]
  - - [128, 128, 1, 64]
    - [7, 0.133]
  - - [64, 128, 1, 128]
    - [6, 0.117]
  - - [1024, 512, 1, 64]
    - [6, 3.204]
  - - [74, 512, 1, 2048]
    - [22, 3.09]
  - - [64, 5, 1, 5]
    - [68, 0.0]
  - - [2048, 512, 1, 2048]
    - [77, 35.444]
  - - [512, 1600, 1, 512]
    - [111, 19.054]
  - - [32, 33, 1, 33]
    - [8, 0.004]
  - - [560, 1600, 1, 1024]
    - [29, 28.717]
  - - [512, 1600, 1, 32]
    - [133, 2.314]
  - - [1024, 1600, 1, 1024]
    - [107, 34.281]
  - - [32, 33, 1600, 33]
    - [49, 2.022]
  - - [32, 200, 1, 1]
    - [153, 0.001]
  - - [64, 3, 512, 3]
    - [134, 0.025]
  - - [64, 5, 512, 5]
    - [134, 0.068]
  - - [64, 5, 960, 5]
    - [16, 0.1]
  - - [64, 9, 512, 9]
    - [134, 0.212]
  - - [64, 512, 1, 1]
    - [6, 0.004]
  - - [67, 512, 1, 2048]
    - [22, 2.834]
  - - [74, 960, 1, 2048]
    - [22, 5.697]
  - - [100, 512, 1, 2048]
    - [3, 4.266]
  - - [128, 27, 32768, 27]
    - [133, 3.384]
  - - [256, 8976, 1, 1536]
    - [72, 45.685]
  - - [256, 8976, 1, 2048]
    - [171, 49.317]
  - - [256, 8976, 1, 2304]
    - [171, 50.555]
  - - [256, 8976, 1, 2560]
    - [122, 52.479]
  - - [256, 8976, 1, 2816]
    - [171, 53.212]
  - - [256, 8976, 1, 3072]
    - [171, 54.415]
  - - [256, 8976, 1, 4352]
    - [171, 57.841]
  - - [256, 8976, 1, 4864]
    - [122, 58.894]
  - - [256, 8976, 1, 5376]
    - [190, 59.993]
  - - [256, 8976, 1, 5632]
    - [191, 60.951]
  - - [256, 8976, 1, 5888]
    - [192, 61.644]
  - - [256, 8976, 1, 6144]
    - [193, 62.321]
  - - [256, 8976, 1, 6656]
    - [194, 64.098]
  - - [256, 8976, 1, 7168]
    - [190, 65.397]
  - - [256, 8976, 1, 7424]
    - [190, 66.326]
  - - [256, 8976, 1, 8192]
    - [194, 66.201]
  - - [256, 8976, 1, 8448]
    - [190, 68.245]
  - - [256, 8976, 1, 8960]
    - [195, 69.234]
  - - [256, 8976, 1, 9472]
    - [194, 70.14]
  - - [256, 8976, 1, 9728]
    - [191, 70.388]
  - - [256, 8976, 1, 9984]
    - [183, 70.857]
  - - [256, 8976, 1, 10240]
    - [190, 71.24]
  - - [256, 8976, 1, 10496]
    - [190, 71.585]
  - - [256, 8976, 1, 11008]
    - [194, 72.391]
  - - [256, 8976, 1, 11520]
    - [190, 72.925]
  - - [256, 8976, 1, 12288]
    - [193, 73.462]
  - - [256, 8976, 1, 14336]
    - [194, 75.69]
  - - [256, 8976, 1, 14848]
    - [193, 76.004]
  - - [256, 8976, 1, 15104]
    - [190, 76.351]
  - - [256, 8976, 1, 15872]
    - [190, 76.872]
  - - [256, 8976, 1, 17152]
    - [196, 77.602]
  - - [256, 8976, 1, 19712]
    - [194, 79.083]
  - - [256, 8976, 1, 19968]
    - [194, 79.356]
  - - [256, 8976, 1, 20480]
    - [194, 79.424]
  - - [256, 8976, 1, 20992]
    - [190, 79.615]
  - - [256, 8976, 1, 22016]
    - [194, 80.189]
  - - [256, 8976, 1, 26112]
    - [190, 81.674]
  - - [256, 8976, 1, 33536]
    - [193, 83.217]
  - - [256, 8976, 1, 44505]
    - [190, 83.973]
  - - [257, 1024, 1, 4096]
    - [33, 17.423]
  - - [480, 32768, 1, 1024]
    - [89, 57.05]
  - - [512, 200, 1, 1]
    - [68, 0.012]
  - - [512, 200, 1, 32]
    - [6, 0.444]
  - - [512, 215, 1, 2048]
    - [10, 8.865]
  - - [512, 256, 1, 2048]
    - [23, 9.27]
  - - [560, 200, 1, 1024]
    - [25, 5.802]
  - - [768, 215, 1, 2048]
    - [25, 11.508]
  - - [768, 256, 1, 2048]
    - [42, 13.268]
  - - [1024, 1, 1, 200]
    - [6, 0.019]
  - - [1024, 1, 1, 1600]
    - [4, 0.092]
  - - [1024, 200, 1, 1]
    - [6, 0.023]
  - - [1024, 512, 1, 1]
    - [6, 0.048]
  - - [1024, 960, 1, 64]
    - [39, 4.906]
  - - [1024, 1600, 1, 1]
    - [159, 0.09]
  - - [1024, 1792, 1, 256]
    - [50, 18.868]
  - - [1024, 2048, 1, 256]
    - [59, 18.747]
  - - [1024, 2560, 1, 256]
    - [73, 21.217]
  - - [1024, 3072, 1, 256]
    - [56, 21.594]
  - - [1024, 3328, 1, 256]
    - [197, 20.462]
  - - [1024, 3840, 1, 256]
    - [73, 22.977]
  - - [1024, 4096, 1, 256]
    - [73, 23.755]
  - - [1024, 4608, 1, 256]
    - [92, 23.355]
  - - [1024, 4864, 1, 256]
    - [59, 22.903]
  - - [1024, 5120, 1, 256]
    - [55, 23.699]
  - - [1024, 5632, 1, 256]
    - [55, 23.863]
  - - [1024, 6144, 1, 256]
    - [89, 24.429]
  - - [1024, 6400, 1, 256]
    - [60, 25.447]
  - - [1024, 7168, 1, 256]
    - [89, 25.86]
  - - [1024, 7424, 1, 256]
    - [73, 24.712]
  - - [1024, 7680, 1, 256]
    - [60, 25.461]
  - - [1024, 7936, 1, 256]
    - [60, 25.787]
  - - [1024, 8192, 1, 256]
    - [73, 26.27]
  - - [1024, 8448, 1, 256]
    - [73, 26.435]
  - - [1024, 8704, 1, 256]
    - [89, 26.46]
  - - [1024, 8960, 1, 256]
    - [89, 26.676]
  - - [1024, 9728, 1, 256]
    - [73, 26.516]
  - - [1024, 9984, 1, 256]
    - [70, 26.886]
  - - [1024, 10240, 1, 256]
    - [60, 27.666]
  - - [1024, 10496, 1, 256]
    - [60, 27.598]
  - - [1024, 11008, 1, 256]
    - [89, 27.389]
  - - [1024, 11264, 1, 256]
    - [64, 27.306]
  - - [1024, 11520, 1, 256]
    - [89, 27.981]
  - - [1024, 12288, 1, 256]
    - [60, 27.758]
  - - [1024, 13312, 1, 256]
    - [89, 28.202]
  - - [1024, 13568, 1, 256]
    - [89, 28.089]
  - - [1024, 14336, 1, 256]
    - [89, 28.686]
  - - [1024, 14592, 1, 256]
    - [60, 28.753]
  - - [1024, 14848, 1, 256]
    - [60, 28.978]
  - - [1024, 15104, 1, 256]
    - [60, 28.903]
  - - [1024, 16128, 1, 256]
    - [60, 28.922]
  - - [1024, 17152, 1, 256]
    - [60, 29.864]
  - - [1024, 18944, 1, 256]
    - [60, 29.964]
  - - [1024, 19712, 1, 256]
    - [98, 29.096]
  - - [1024, 19968, 1, 256]
    - [60, 29.474]
  - - [1024, 20480, 1, 256]
    - [60, 29.782]
  - - [1024, 20992, 1, 256]
    - [60, 30.383]
  - - [1024, 21504, 1, 256]
    - [109, 29.738]
  - - [1024, 22016, 1, 256]
    - [60, 29.322]
  - - [1024, 23552, 1, 256]
    - [60, 30.701]
  - - [1024, 28672, 1, 256]
    - [60, 30.437]
  - - [1024, 33536, 1, 256]
    - [60, 30.86]
  - - [1024, 40448, 1, 256]
    - [60, 31.591]
  - - [1600, 512, 1, 1024]
    - [29, 26.255]
  - - [2048, 1, 1, 512]
    - [2, 0.08]
  - - [2048, 512, 1, 1]
    - [57, 0.071]
  - - [2048, 960, 1, 2048]
    - [198, 42.771]
  - - [2048, 1024, 1, 1]
    - [61, 0.095]
  - - [2048, 1024, 1, 256]
    - [72, 18.27]
  - - [3200, 1024, 1, 2048]
    - [199, 54.706]
  - - [4096, 1024, 1, 1]
    - [145, 0.12]
  - - [2048, 1024, 1, 2048]
    - [112, 45.263]
  - - [2048, 1024, 1, 30592]
    - [195, 74.583]
  - - [2048, 1024, 1, 6144]
    - [195, 57.148]
  - - [2048, 1024, 1, 8192]
    - [195, 61.742]
  - - [2048, 2, 1, 2]
    - [200, 0.001]
  - - [2048, 2, 1, 2048]
    - [13, 0.385]
  - - [8192, 1024, 1, 2048]
    - [120, 61.671]
  - - [1024, 16, 1, 1024]
    - [20, 0.975]
  - - [1024, 16, 1, 2]
    - [176, 0.005]
  - - [1024, 8192, 1, 30592]
    - [88, 78.818]
  - - [1024, 8192, 1, 3072]
    - [88, 65.856]
  - - [512, 512, 256, 64]
    - [201, 10.186]
  - - [64, 512, 256, 512]
    - [36, 23.996]
  - - [1024, 2048, 1, 30592]
    - [202, 73.931]
  - - [1024, 2048, 1, 3072]
    - [122, 50.159]
  - - [1024, 4096, 1, 30592]
    - [130, 79.109]
  - - [1024, 4096, 1, 3072]
    - [104, 66.072]
  - - [512, 512, 128, 64]
    - [201, 9.929]
  - - [2560, 2048, 1, 1920]
    - [59, 54.485]
  - - [2560, 2048, 1, 2560]
    - [55, 57.776]
  - - [2560, 2048, 1, 7680]
    - [55, 62.771]
  - - [2560, 4, 1, 2]
    - [165, 0.003]
  - - [2560, 4, 1, 2560]
    - [14, 0.981]
  - - [640, 2048, 1, 2560]
    - [76, 49.764]
  - - [512, 512, 40, 64]
    - [133, 9.115]
  - - [64, 512, 40, 512]
    - [72, 20.727]
  - - [1536, 4096, 1, 1536]
    - [63, 54.545]
  - - [1536, 4096, 1, 4608]
    - [117, 64.628]
  - - [1536, 4096, 1, 50304]
    - [117, 74.124]
  - - [1536, 4096, 1, 6144]
    - [117, 66.866]
  - - [6144, 4096, 1, 1536]
    - [63, 62.978]
  - - [1024, 1024, 64, 96]
    - [60, 14.655]
  - - [96, 1024, 64, 1024]
    - [172, 37.682]
  - - [1536, 8192, 1, 1536]
    - [99, 58.744]
  - - [1536, 8192, 1, 4608]
    - [96, 72.639]
  - - [1536, 8192, 1, 50304]
    - [125, 78.833]
  - - [1536, 8192, 1, 6144]
    - [84, 75.45]
  - - [6144, 8192, 1, 1536]
    - [63, 66.272]
  - - [1024, 1024, 128, 96]
    - [60, 14.99]
  - - [96, 1024, 128, 1024]
    - [95, 38.76]
  - - [1024, 16384, 1, 1024]
    - [89, 56.952]
  - - [1024, 16384, 1, 3072]
    - [89, 70.443]
  - - [1024, 16384, 1, 4096]
    - [89, 70.834]
  - - [1024, 16384, 1, 50304]
    - [88, 79.042]
  - - [4096, 16384, 1, 1024]
    - [63, 59.365]
  - - [1024, 1024, 256, 64]
    - [54, 10.536]
  - - [64, 1024, 256, 1024]
    - [203, 32.104]
  - - [1024, 2048, 1, 50304]
    - [196, 75.484]
  - - [1024, 1024, 32, 64]
    - [133, 10.013]
  - - [64, 1024, 32, 1024]
    - [57, 25.965]
  - - [1024, 4096, 1, 50304]
    - [125, 79.969]
  - - [1024, 1024, 64, 64]
    - [201, 10.288]
  - - [64, 1024, 64, 1024]
    - [55, 27.72]
  - - [1024, 8192, 1, 50304]
    - [88, 79.239]
  - - [1024, 1024, 128, 64]
    - [201, 10.441]
  - - [64, 1024, 128, 1024]
    - [204, 30.764]
  - - [128, 128, 1024, 64]
    - [189, 8.692]
  - - [64, 128, 1024, 128]
    - [134, 12.107]
  - - [1024, 64, 1, 2]
    - [205, 0.018]
  - - [1024, 8192, 1, 30528]
    - [104, 85.88]
  - - [1024, 64, 1, 1024]
    - [40, 3.925]
  - - [1024, 3456, 1, 1024]
    - [101, 45.218]
  - - [1024, 3456, 1, 512]
    - [94, 32.36]
  - - [1024, 4096, 1, 512]
    - [73, 35.887]
  - - [1024, 6912, 1, 1024]
    - [89, 52.99]
  - - [1024, 6912, 1, 512]
    - [89, 40.182]
  - - [1024, 864, 1, 1024]
    - [111, 27.527]
  - - [1024, 864, 1, 512]
    - [29, 19.535]
  - - [256, 3456, 1, 128]
    - [17, 8.345]
  - - [256, 4096, 1, 128]
    - [66, 8.545]
  - - [256, 55296, 1, 128]
    - [70, 16.479]
  - - [256, 6912, 1, 128]
    - [157, 11.097]
  - - [256, 864, 1, 128]
    - [6, 2.912]
  - - [480, 3456, 1, 1024]
    - [85, 36.461]
  - - [480, 4096, 1, 1024]
    - [55, 35.616]
  - - [480, 6912, 1, 1024]
    - [117, 44.343]
  - - [480, 864, 1, 1024]
    - [116, 16.491]
  - - [512, 3456, 1, 256]
    - [51, 19.182]
  - - [512, 4096, 1, 256]
    - [54, 18.677]
  - - [512, 55296, 1, 256]
    - [60, 31.665]
  - - [512, 6912, 1, 256]
    - [65, 21.519]
  - - [512, 864, 1, 256]
    - [6, 8.478]
  - - [1024, 640, 1, 30528]
    - [206, 69.525]
  - - [1024, 1280, 1, 30528]
    - [207, 68.987]
  - - [1024, 1600, 1, 30528]
    - [207, 84.49]
  - - [1024, 10240, 1, 1024]
    - [89, 50.673]
  - - [1024, 10240, 1, 4096]
    - [121, 69.793]
  - - [4096, 10240, 1, 1024]
    - [63, 57.609]
  - - [1024, 80, 1, 1024]
    - [3, 4.937]
  - - [1024, 80, 1, 2]
    - [162, 0.023]
  - - [128, 128, 1280, 64]
    - [133, 8.796]
  - - [64, 128, 1280, 128]
    - [142, 12.23]
  - - [1024, 1640, 1, 30528]
    - [208, 73.048]
  - - [1024, 10496, 1, 1024]
    - [89, 51.576]
  - - [1024, 10496, 1, 4096]
    - [124, 71.377]
  - - [4096, 10496, 1, 1024]
    - [63, 58.704]
  - - [1024, 82, 1, 1024]
    - [10, 4.967]
  - - [1024, 82, 1, 2]
    - [162, 0.023]
  - - [128, 128, 1312, 64]
    - [133, 8.782]
  - - [64, 128, 1312, 128]
    - [134, 12.25]
  - - [1024, 160, 1, 30528]
    - [209, 40.317]
  - - [1024, 240, 1, 30528]
    - [166, 52.241]
  - - [1024, 6144, 1, 4096]
    - [121, 62.737]
  - - [1024, 12, 1, 1024]
    - [20, 0.714]
  - - [4096, 6144, 1, 1024]
    - [63, 55.06]
  - - [1024, 6144, 1, 1024]
    - [89, 48.977]
  - - [1024, 12, 1, 2]
    - [165, 0.003]
  - - [512, 512, 192, 64]
    - [201, 10.092]
  - - [64, 512, 192, 512]
    - [111, 23.189]
  - - [256, 4096, 1, 1]
    - [134, 0.073]
  - - [256, 6912, 1, 1]
    - [93, 0.093]
  - - [3136, 128, 64, 64]
    - [146, 9.794]
  - - [3136, 256, 64, 64]
    - [146, 10.386]
  - - [3136, 256, 64, 128]
    - [60, 18.318]
  - - [784, 512, 64, 256]
    - [63, 30.544]
  - - [3136, 128, 64, 256]
    - [60, 27.245]
  - - [3136, 256, 64, 256]
    - [60, 31.84]
  - - [784, 256, 64, 512]
    - [63, 36.965]
  - - [784, 512, 64, 512]
    - [63, 41.997]
  - - [3136, 128, 32, 64]
    - [133, 9.394]
  - - [3136, 256, 32, 64]
    - [147, 10.083]
  - - [3136, 256, 32, 128]
    - [60, 17.585]
  - - [784, 512, 32, 256]
    - [65, 28.001]
  - - [3136, 128, 32, 256]
    - [60, 25.991]
  - - [3136, 256, 32, 256]
    - [60, 29.892]
  - - [784, 256, 32, 512]
    - [73, 33.854]
  - - [784, 512, 32, 512]
    - [63, 38.88]
  - - [3136, 64, 64, 64]
    - [142, 8.683]
  - - [3136, 64, 64, 256]
    - [201, 20.14]
  - - [784, 128, 64, 512]
    - [63, 31.725]
  - - [64, 192, 64, 1280]
    - [210, 22.81]
  - - [64, 320, 64, 1280]
    - [211, 24.118]
  - - [64, 384, 64, 1280]
    - [51, 27.871]
  - - [64, 448, 64, 1280]
    - [18, 27.272]
  - - [64, 192, 64, 2048]
    - [158, 22.632]
  - - [64, 320, 64, 2048]
    - [111, 24.947]
  - - [64, 384, 64, 2048]
    - [154, 27.912]
  - - [64, 448, 64, 2048]
    - [158, 28.249]
  - - [64, 192, 32, 1280]
    - [27, 18.544]
  - - [64, 320, 32, 1280]
    - [111, 22.689]
  - - [64, 384, 32, 1280]
    - [36, 24.217]
  - - [64, 448, 32, 1280]
    - [18, 26.23]
  - - [64, 192, 32, 2048]
    - [26, 18.701]
  - - [64, 320, 32, 2048]
    - [36, 24.155]
  - - [64, 384, 32, 2048]
    - [111, 26.964]
  - - [64, 448, 32, 2048]
    - [158, 27.476]
  - - [1024, 10224, 1, 1024]
    - [89, 49.79]
  - - [1024, 10192, 1, 1024]
    - [89, 50.334]
  - - [1024, 10208, 1, 1024]
    - [89, 50.286]
  - - [1024, 10224, 1, 4096]
    - [121, 68.753]
  - - [1024, 10224, 1, 3072]
    - [121, 64.979]
  - - [4096, 10224, 1, 1024]
    - [63, 57.776]
  - - [1024, 10240, 1, 3072]
    - [121, 66.007]
  - - [1024, 10192, 1, 3072]
    - [121, 65.425]
  - - [4096, 10192, 1, 1024]
    - [63, 57.281]
  - - [1024, 10192, 1, 4096]
    - [121, 69.321]
  - - [1024, 10200, 1, 3072]
    - [121, 65.462]
  - - [1024, 10184, 1, 1024]
    - [89, 50.523]
  - - [4096, 10208, 1, 1024]
    - [63, 57.611]
  - - [1024, 10208, 1, 3072]
    - [117, 65.286]
  - - [1024, 10208, 1, 4096]
    - [121, 68.917]
  - - [1024, 10224, 1, 2048]
    - [114, 59.737]
  - - [1024, 10240, 1, 2048]
    - [124, 59.83]
  - - [1024, 10120, 1, 1024]
    - [89, 49.953]
  - - [1024, 10192, 1, 2048]
    - [121, 59.817]
  - - [64, 24, 6816, 24]
    - [187, 2.903]
  - - [1024, 10152, 1, 1024]
    - [89, 50.364]
  - - [1024, 10080, 1, 3072]
    - [121, 64.467]
  - - [64, 26, 6272, 26]
    - [187, 3.151]
  - - [100352, 512, 1, 256]
    - [212, 28.733]
  - - [12544, 2048, 1, 1024]
    - [67, 57.967]
  - - [12544, 64, 1, 147]
    - [49, 7.125]
  - - [200704, 512, 1, 256]
    - [60, 27.934]
  - - [25088, 1024, 1, 512]
    - [64, 45.828]
  - - [3136, 64, 1, 576]
    - [41, 7.673]
  - - [50176, 1024, 1, 512]
    - [64, 48.329]
  - - [6272, 2048, 1, 1024]
    - [63, 53.195]
  - - [784, 128, 1, 1152]
    - [3, 6.254]
  - - [3136, 128, 128, 256]
    - [60, 28.454]
  - - [3136, 128, 256, 256]
    - [60, 29.007]
  - - [3136, 256, 128, 64]
    - [133, 10.488]
  - - [3136, 256, 256, 64]
    - [133, 10.513]
  - - [3136, 64, 128, 256]
    - [201, 21.165]
  - - [3136, 64, 256, 256]
    - [201, 21.775]
  - - [3136, 64, 128, 64]
    - [141, 9.062]
  - - [3136, 64, 256, 64]
    - [132, 9.194]
  - - [784, 128, 128, 512]
    - [63, 33.705]
  - - [784, 128, 256, 512]
    - [109, 35.971]
  - - [784, 256, 128, 512]
    - [63, 40.03]
  - - [784, 256, 256, 512]
    - [63, 41.691]
  - - [784, 512, 128, 128]
    - [65, 18.816]
  - - [784, 512, 256, 128]
    - [65, 19.111]
  - - [128, 128, 2048, 64]
    - [141, 8.912]
  - - [64, 128, 2048, 128]
    - [134, 12.648]
  - - [1024, 2560, 1, 30528]
    - [213, 86.571]
  - - [1024, 128, 1, 1024]
    - [23, 6.717]
  - - [1024, 128, 1, 2]
    - [176, 0.034]
  - - [128, 128, 1536, 64]
    - [133, 8.82]
  - - [64, 128, 1536, 128]
    - [134, 12.446]
  - - [1024, 12288, 1, 4096]
    - [88, 68.992]
  - - [1024, 12288, 1, 1024]
    - [89, 50.9]
  - - [4096, 12288, 1, 1024]
    - [63, 58.485]
  - - [1024, 1920, 1, 30528]
    - [208, 85.04]
  - - [1024, 96, 1, 1024]
    - [3, 5.851]
  - - [1024, 96, 1, 2]
    - [200, 0.027]
  - - [128, 128, 192, 64]
    - [134, 7.11]
  - - [64, 128, 192, 128]
    - [157, 9.374]
  - - [768, 2048, 1, 2]
    - [167, 0.243]
  - - [3072, 2048, 1, 768]
    - [109, 44.288]
  - - [768, 2048, 1, 3072]
    - [110, 45.445]
  - - [768, 2048, 1, 768]
    - [52, 32.391]
  - - [384, 384, 144, 64]
    - [133, 9.874]
  - - [64, 384, 144, 384]
    - [66, 20.446]
  - - [768, 4608, 1, 2]
    - [188, 0.296]
  - - [3072, 4608, 1, 768]
    - [109, 51.049]
  - - [768, 4608, 1, 3072]
    - [117, 64.597]
  - - [768, 4608, 1, 768]
    - [214, 39.805]
  - - [512, 512, 48, 64]
    - [141, 9.304]
  - - [64, 512, 48, 512]
    - [211, 22.101]
  - - [128, 128, 256, 64]
    - [189, 7.389]
  - - [64, 128, 256, 128]
    - [134, 9.552]
  - - [384, 384, 192, 64]
    - [134, 10.004]
  - - [64, 384, 192, 384]
    - [66, 20.654]
  - - [1024, 4608, 1, 2]
    - [167, 0.307]
  - - [4096, 4608, 1, 1024]
    - [63, 56.611]
  - - [1024, 4608, 1, 4096]
    - [88, 73.05]
  - - [1024, 4608, 1, 1024]
    - [89, 48.465]
  - - [8192, 1024, 1, 1024]
    - [120, 48.898]
  - - [8192, 4096, 1, 1024]
    - [120, 58.978]
  - - [196, 1024, 64, 512]
    - [72, 32.056]
  - - [196, 512, 64, 1024]
    - [113, 33.431]
  - - [196, 1024, 64, 1024]
    - [121, 40.187]
  - - [49, 2048, 64, 1024]
    - [52, 20.633]
  - - [49, 1024, 64, 2048]
    - [215, 21.558]
  - - [196, 1024, 32, 512]
    - [55, 30.959]
  - - [196, 512, 32, 1024]
    - [55, 30.499]
  - - [196, 1024, 32, 1024]
    - [55, 37.851]
  - - [49, 2048, 32, 1024]
    - [215, 18.471]
  - - [49, 1024, 32, 2048]
    - [215, 20.312]
  - - [49, 2048, 64, 512]
    - [216, 16.222]
  - - [49, 512, 64, 2048]
    - [189, 18.242]
  - - [1225, 32, 64, 192]
    - [189, 10.836]
  - - [1225, 48, 64, 192]
    - [189, 9.915]
  - - [1225, 64, 64, 192]
    - [217, 14.153]
  - - [1225, 48, 64, 256]
    - [189, 11.089]
  - - [1225, 64, 64, 256]
    - [218, 15.571]
  - - [1225, 48, 64, 288]
    - [189, 11.631]
  - - [1225, 64, 64, 288]
    - [210, 17.271]
  - - [5329, 80, 64, 64]
    - [189, 7.476]
  - - [289, 128, 64, 768]
    - [31, 22.809]
  - - [289, 160, 64, 768]
    - [219, 26.753]
  - - [289, 192, 64, 768]
    - [220, 28.614]
  - - [1225, 32, 32, 192]
    - [189, 9.51]
  - - [1225, 48, 32, 192]
    - [189, 8.714]
  - - [1225, 64, 32, 192]
    - [210, 12.487]
  - - [1225, 48, 32, 256]
    - [189, 10.04]
  - - [1225, 64, 32, 256]
    - [218, 14.076]
  - - [1225, 48, 32, 288]
    - [221, 10.478]
  - - [1225, 64, 32, 288]
    - [210, 15.616]
  - - [5329, 80, 32, 64]
    - [189, 7.218]
  - - [289, 128, 32, 768]
    - [222, 19.076]
  - - [289, 160, 32, 768]
    - [223, 19.231]
  - - [289, 192, 32, 768]
    - [220, 25.781]
  - - [196, 256, 1, 2304]
    - [3, 4.416]
  - - [49, 512, 1, 4608]
    - [0, 3.809]
  - - [196, 1024, 128, 256]
    - [55, 24.857]
  - - [196, 1024, 256, 256]
    - [135, 25.698]
  - - [196, 256, 128, 1024]
    - [126, 32.983]
  - - [196, 256, 256, 1024]
    - [121, 39.529]
  - - [196, 512, 128, 1024]
    - [126, 40.24]
  - - [196, 512, 256, 1024]
    - [121, 44.859]
  - - [49, 2048, 128, 512]
    - [52, 17.322]
  - - [49, 2048, 256, 512]
    - [52, 17.66]
  - - [49, 512, 128, 2048]
    - [224, 20.688]
  - - [49, 512, 256, 2048]
    - [224, 22.94]
- null
