library/src/blas3/Tensile/Logic/asm_full/arcturus/arcturus_Cijk_Ailk_Bjlk_CB_GB.yaml
- {MinimumRequiredVersion: 4.26.0}
- arcturus
- gfx908
- [Device 7380, Device 7388, Device 738c, Device 7390]
    SolutionIndex: 0
    SolutionNameMin: Cijk_Ailk_Bjlk_CB_GB_MT32x32x8_MI16x16x4x1_SN_1LDSB0_EPS1_GRVW1_NLCA1_NLCB1_PGR1_SRVW1_TT1_16_WG32_8_1_WGM1
    SolutionIndex: 1
    SolutionNameMin: Cijk_Ailk_Bjlk_CB_GB_MT64x32x8_MI16x16x4x1_SN_1LDSB0_EPS1_GRVW1_NLCA1_NLCB1_PGR1_SRVW1_TT2_16_WG32_8_1_WGM1
    SolutionIndex: 2
    SolutionNameMin: Cijk_Ailk_Bjlk_CB_GB_MT32x32x8_MI16x16x4x1_SN_1LDSB0_EPS0_GRVW1_NLCA1_NLCB1_PGR2_SRVW1_TT1_16_WG32_8_1_WGM1
    SolutionIndex: 3
    SolutionNameMin: Cijk_Ailk_Bjlk_CB_GB_MT64x32x8_MI16x16x4x1_SN_1LDSB0_EPS0_GRVW1_NLCA1_NLCB1_PGR2_SRVW1_TT2_16_WG32_8_1_WGM1
    SolutionIndex: 4
    SolutionNameMin: Cijk_Ailk_Bjlk_CB_GB_MT32x32x16_MI16x16x4x1_SN_1LDSB0_EPS1_GRVW1_NLCA1_NLCB1_PGR1_SRVW1_TT1_16_WG32_8_1_WGM1
    SolutionIndex: 5
    SolutionNameMin: Cijk_Ailk_Bjlk_CB_GB_MT32x32x16_MI16x16x4x1_SN_1LDSB0_EPS0_GRVW1_NLCA1_NLCB1_PGR2_SRVW1_TT1_16_WG32_8_1_WGM1
    SolutionIndex: 6
    SolutionNameMin: Cijk_Ailk_Bjlk_CB_GB_MT32x32x32_MI16x16x4x1_SN_1LDSB0_EPS0_GRVW1_NLCA1_NLCB1_PGR2_SRVW1_TT1_16_WG32_8_1_WGM1
    SolutionIndex: 7
    SolutionNameMin: Cijk_Ailk_Bjlk_CB_GB_MT32x32x8_MI16x16x4x1_SN_1LDSB0_EPS1_GRVW2_NLCA1_NLCB1_PGR1_SRVW1_TT1_16_WG32_8_1_WGM1
    SolutionIndex: 8
    SolutionNameMin: Cijk_Ailk_Bjlk_CB_GB_MT64x32x8_MI16x16x4x1_SN_1LDSB0_EPS1_GRVW2_NLCA1_NLCB1_PGR1_SRVW1_TT2_16_WG32_8_1_WGM1
    SolutionIndex: 9
    SolutionNameMin: Cijk_Ailk_Bjlk_CB_GB_MT128x128x8_MI32x32x2x1_SN_1LDSB0_EPS1_GRVW2_NLCA1_NLCB1_PGR1_SRVW0_TT2_64_WG64_4_1_WGM1
    SolutionIndex: 10
    SolutionNameMin: Cijk_Ailk_Bjlk_CB_GB_MT32x32x8_MI16x16x4x1_SN_1LDSB0_EPS0_GRVW2_NLCA1_NLCB1_PGR2_SRVW1_TT1_16_WG32_8_1_WGM1
    SolutionIndex: 11
    SolutionNameMin: Cijk_Ailk_Bjlk_CB_GB_MT64x32x8_MI16x16x4x1_SN_1LDSB0_EPS0_GRVW2_NLCA1_NLCB1_PGR2_SRVW1_TT2_16_WG32_8_1_WGM1
    SolutionIndex: 12
    SolutionNameMin: Cijk_Ailk_Bjlk_CB_GB_MT32x32x16_MI16x16x4x1_SN_1LDSB0_EPS1_GRVW2_NLCA1_NLCB1_PGR1_SRVW1_TT1_16_WG32_8_1_WGM1
    SolutionIndex: 13
    SolutionNameMin: Cijk_Ailk_Bjlk_CB_GB_MT32x32x16_MI16x16x4x1_SN_1LDSB0_EPS0_GRVW2_NLCA1_NLCB1_PGR2_SRVW1_TT1_16_WG32_8_1_WGM1
    SolutionIndex: 14
    SolutionNameMin: Cijk_Ailk_Bjlk_CB_GB_MT32x32x32_MI16x16x4x1_SN_1LDSB0_EPS1_GRVW2_NLCA1_NLCB1_PGR1_SRVW1_TT1_16_WG32_8_1_WGM1
    SolutionIndex: 15
    SolutionNameMin: Cijk_Ailk_Bjlk_CB_GB_MT32x32x32_MI16x16x4x1_SN_1LDSB0_EPS0_GRVW2_NLCA1_NLCB1_PGR2_SRVW1_TT1_16_WG32_8_1_WGM1
    SolutionIndex: 16
    SolutionNameMin: Cijk_Ailk_Bjlk_CB_GB_MT32x32x8_MI16x16x4x1_SN_1LDSB0_EPS1_GRVW1_NLCA1_NLCB1_PGR1_SRVW1_TT1_16_WG32_8_1_WGM2
    SolutionIndex: 17
    SolutionNameMin: Cijk_Ailk_Bjlk_CB_GB_MT32x32x8_MI16x16x4x1_SN_1LDSB0_EPS0_GRVW1_NLCA1_NLCB1_PGR2_SRVW1_TT1_16_WG32_8_1_WGM2
    SolutionIndex: 18
    SolutionNameMin: Cijk_Ailk_Bjlk_CB_GB_MT64x32x8_MI16x16x4x1_SN_1LDSB0_EPS0_GRVW1_NLCA1_NLCB1_PGR2_SRVW1_TT2_16_WG32_8_1_WGM2
    SolutionIndex: 19
    SolutionNameMin: Cijk_Ailk_Bjlk_CB_GB_MT32x32x16_MI16x16x4x1_SN_1LDSB0_EPS1_GRVW1_NLCA1_NLCB1_PGR1_SRVW1_TT1_16_WG32_8_1_WGM2
    SolutionIndex: 20
    SolutionNameMin: Cijk_Ailk_Bjlk_CB_GB_MT32x32x16_MI16x16x4x1_SN_1LDSB0_EPS0_GRVW1_NLCA1_NLCB1_PGR2_SRVW1_TT1_16_WG32_8_1_WGM2
    SolutionIndex: 21
    SolutionNameMin: Cijk_Ailk_Bjlk_CB_GB_MT32x32x8_MI16x16x4x1_SN_1LDSB0_EPS1_GRVW2_NLCA1_NLCB1_PGR1_SRVW1_TT1_16_WG32_8_1_WGM2
    SolutionIndex: 22
    SolutionNameMin: Cijk_Ailk_Bjlk_CB_GB_MT64x32x8_MI16x16x4x1_SN_1LDSB0_EPS1_GRVW2_NLCA1_NLCB1_PGR1_SRVW1_TT2_16_WG32_8_1_WGM2
    SolutionIndex: 23
    SolutionNameMin: Cijk_Ailk_Bjlk_CB_GB_MT32x32x8_MI16x16x4x1_SN_1LDSB0_EPS0_GRVW2_NLCA1_NLCB1_PGR2_SRVW1_TT1_16_WG32_8_1_WGM2
    SolutionIndex: 24
    SolutionNameMin: Cijk_Ailk_Bjlk_CB_GB_MT64x32x8_MI16x16x4x1_SN_1LDSB0_EPS0_GRVW2_NLCA1_NLCB1_PGR2_SRVW1_TT2_16_WG32_8_1_WGM2
    SolutionIndex: 25
    SolutionNameMin: Cijk_Ailk_Bjlk_CB_GB_MT32x32x16_MI16x16x4x1_SN_1LDSB0_EPS1_GRVW2_NLCA1_NLCB1_PGR1_SRVW1_TT1_16_WG32_8_1_WGM2
    SolutionIndex: 26
    SolutionNameMin: Cijk_Ailk_Bjlk_CB_GB_MT32x32x16_MI16x16x4x1_SN_1LDSB0_EPS0_GRVW2_NLCA1_NLCB1_PGR2_SRVW1_TT1_16_WG32_8_1_WGM2
    SolutionIndex: 27
    SolutionNameMin: Cijk_Ailk_Bjlk_CB_GB_MT32x32x32_MI16x16x4x1_SN_1LDSB0_EPS1_GRVW2_NLCA1_NLCB1_PGR1_SRVW1_TT1_16_WG32_8_1_WGM2
    SolutionIndex: 28
    SolutionNameMin: Cijk_Ailk_Bjlk_CB_GB_MT32x32x32_MI16x16x4x1_SN_1LDSB0_EPS0_GRVW2_NLCA1_NLCB1_PGR2_SRVW1_TT1_16_WG32_8_1_WGM2
    SolutionIndex: 29
    SolutionNameMin: Cijk_Ailk_Bjlk_CB_GB_MT32x32x8_MI16x16x4x1_SN_1LDSB0_EPS1_GRVW1_NLCA1_NLCB1_PGR1_SRVW1_TT1_16_WG32_8_1_WGM15
    SolutionIndex: 30
    SolutionNameMin: Cijk_Ailk_Bjlk_CB_GB_MT64x32x8_MI16x16x4x1_SN_1LDSB0_EPS1_GRVW1_NLCA1_NLCB1_PGR1_SRVW1_TT2_16_WG32_8_1_WGM15
    SolutionIndex: 31
    SolutionNameMin: Cijk_Ailk_Bjlk_CB_GB_MT32x32x8_MI16x16x4x1_SN_1LDSB0_EPS0_GRVW1_NLCA1_NLCB1_PGR2_SRVW1_TT1_16_WG32_8_1_WGM15
    SolutionIndex: 32
    SolutionNameMin: Cijk_Ailk_Bjlk_CB_GB_MT64x32x8_MI16x16x4x1_SN_1LDSB0_EPS0_GRVW1_NLCA1_NLCB1_PGR2_SRVW1_TT2_16_WG32_8_1_WGM15
    SolutionIndex: 33
    SolutionNameMin: Cijk_Ailk_Bjlk_CB_GB_MT32x32x16_MI16x16x4x1_SN_1LDSB0_EPS0_GRVW1_NLCA1_NLCB1_PGR2_SRVW1_TT1_16_WG32_8_1_WGM15
    SolutionIndex: 34
    SolutionNameMin: Cijk_Ailk_Bjlk_CB_GB_MT32x32x8_MI16x16x4x1_SN_1LDSB0_EPS1_GRVW2_NLCA1_NLCB1_PGR1_SRVW1_TT1_16_WG32_8_1_WGM15
    SolutionIndex: 35
    SolutionNameMin: Cijk_Ailk_Bjlk_CB_GB_MT64x32x8_MI16x16x4x1_SN_1LDSB0_EPS1_GRVW2_NLCA1_NLCB1_PGR1_SRVW1_TT2_16_WG32_8_1_WGM15
    SolutionIndex: 36
    SolutionNameMin: Cijk_Ailk_Bjlk_CB_GB_MT128x128x8_MI32x32x2x1_SN_1LDSB0_EPS1_GRVW2_NLCA1_NLCB1_PGR1_SRVW0_TT2_64_WG64_4_1_WGM15
    SolutionIndex: 37
    SolutionNameMin: Cijk_Ailk_Bjlk_CB_GB_MT32x32x8_MI16x16x4x1_SN_1LDSB0_EPS0_GRVW2_NLCA1_NLCB1_PGR2_SRVW1_TT1_16_WG32_8_1_WGM15
    SolutionIndex: 38
    SolutionNameMin: Cijk_Ailk_Bjlk_CB_GB_MT64x32x8_MI16x16x4x1_SN_1LDSB0_EPS0_GRVW2_NLCA1_NLCB1_PGR2_SRVW1_TT2_16_WG32_8_1_WGM15
    SolutionIndex: 39
    SolutionNameMin: Cijk_Ailk_Bjlk_CB_GB_MT32x32x16_MI16x16x4x1_SN_1LDSB0_EPS1_GRVW2_NLCA1_NLCB1_PGR1_SRVW1_TT1_16_WG32_8_1_WGM15
    SolutionIndex: 40
    SolutionNameMin: Cijk_Ailk_Bjlk_CB_GB_MT32x32x16_MI16x16x4x1_SN_1LDSB0_EPS0_GRVW2_NLCA1_NLCB1_PGR2_SRVW1_TT1_16_WG32_8_1_WGM15
    SolutionIndex: 41
    SolutionNameMin: Cijk_Ailk_Bjlk_CB_GB_MT32x32x32_MI16x16x4x1_SN_1LDSB0_EPS1_GRVW2_NLCA1_NLCB1_PGR1_SRVW1_TT1_16_WG32_8_1_WGM15
    SolutionIndex: 42
    SolutionNameMin: Cijk_Ailk_Bjlk_CB_GB_MT32x32x32_MI16x16x4x1_SN_1LDSB0_EPS0_GRVW2_NLCA1_NLCB1_PGR2_SRVW1_TT1_16_WG32_8_1_WGM15
    SolutionIndex: 43
    SolutionNameMin: Cijk_Ailk_Bjlk_CB_GB_MT64x32x8_MI16x16x4x1_SN_1LDSB1_EPS0_GRVW1_NLCA1_NLCB1_PGR2_SRVW1_TT2_16_WG32_8_1_WGM1
    SolutionIndex: 44
    SolutionNameMin: Cijk_Ailk_Bjlk_CB_GB_MT64x32x16_MI16x16x4x1_SN_1LDSB1_EPS1_GRVW1_NLCA1_NLCB1_PGR1_SRVW1_TT2_16_WG32_8_1_WGM1
    SolutionIndex: 45
    SolutionNameMin: Cijk_Ailk_Bjlk_CB_GB_MT32x64x16_MI16x16x4x1_SN_1LDSB1_EPS0_GRVW1_NLCA1_NLCB1_PGR2_SRVW1_TT1_32_WG32_8_1_WGM1
    SolutionIndex: 46
    SolutionNameMin: Cijk_Ailk_Bjlk_CB_GB_MT64x32x16_MI16x16x4x1_SN_1LDSB1_EPS0_GRVW1_NLCA1_NLCB1_PGR2_SRVW1_TT2_16_WG32_8_1_WGM1
    SolutionIndex: 47
    SolutionNameMin: Cijk_Ailk_Bjlk_CB_GB_MT64x32x8_MI16x16x4x1_SN_1LDSB1_EPS1_GRVW2_NLCA1_NLCB1_PGR1_SRVW1_TT2_16_WG32_8_1_WGM1
    SolutionIndex: 48
    SolutionNameMin: Cijk_Ailk_Bjlk_CB_GB_MT64x32x8_MI16x16x4x1_SN_1LDSB1_EPS0_GRVW2_NLCA1_NLCB1_PGR2_SRVW1_TT2_16_WG32_8_1_WGM1
    SolutionIndex: 49
    SolutionNameMin: Cijk_Ailk_Bjlk_CB_GB_MT64x32x16_MI16x16x4x1_SN_1LDSB1_EPS1_GRVW2_NLCA1_NLCB1_PGR1_SRVW1_TT2_16_WG32_8_1_WGM1
    SolutionIndex: 50
    SolutionNameMin: Cijk_Ailk_Bjlk_CB_GB_MT64x32x16_MI16x16x4x1_SN_1LDSB1_EPS0_GRVW2_NLCA1_NLCB1_PGR2_SRVW1_TT2_16_WG32_8_1_WGM1
    SolutionIndex: 51
    SolutionNameMin: Cijk_Ailk_Bjlk_CB_GB_MT64x32x8_MI16x16x4x1_SN_1LDSB1_EPS0_GRVW1_NLCA1_NLCB1_PGR2_SRVW1_TT2_16_WG32_8_1_WGM2
    SolutionIndex: 52
    SolutionNameMin: Cijk_Ailk_Bjlk_CB_GB_MT32x64x16_MI16x16x4x1_SN_1LDSB1_EPS0_GRVW1_NLCA1_NLCB1_PGR2_SRVW1_TT1_32_WG32_8_1_WGM2
    SolutionIndex: 53
    SolutionNameMin: Cijk_Ailk_Bjlk_CB_GB_MT64x32x16_MI16x16x4x1_SN_1LDSB1_EPS0_GRVW1_NLCA1_NLCB1_PGR2_SRVW1_TT2_16_WG32_8_1_WGM2
    SolutionIndex: 54
    SolutionNameMin: Cijk_Ailk_Bjlk_CB_GB_MT128x128x8_MI32x32x2x1_SN_1LDSB1_EPS1_GRVW2_NLCA1_NLCB1_PGR1_SRVW0_TT2_64_WG64_4_1_WGM2
    SolutionIndex: 55
    SolutionNameMin: Cijk_Ailk_Bjlk_CB_GB_MT256x32x8_MI32x32x2x1_SN_1LDSB1_EPS1_GRVW2_NLCA2_NLCB1_PGR1_SRVW0_TT2_32_WG128_2_1_WGM2
    SolutionIndex: 56
    SolutionNameMin: Cijk_Ailk_Bjlk_CB_GB_MT64x32x8_MI16x16x4x1_SN_1LDSB1_EPS0_GRVW2_NLCA1_NLCB1_PGR2_SRVW1_TT2_16_WG32_8_1_WGM2
    SolutionIndex: 57
    SolutionNameMin: Cijk_Ailk_Bjlk_CB_GB_MT64x32x16_MI16x16x4x1_SN_1LDSB1_EPS1_GRVW2_NLCA1_NLCB1_PGR1_SRVW1_TT2_16_WG32_8_1_WGM2
    SolutionIndex: 58
    SolutionNameMin: Cijk_Ailk_Bjlk_CB_GB_MT64x32x16_MI16x16x4x1_SN_1LDSB1_EPS0_GRVW2_NLCA1_NLCB1_PGR2_SRVW1_TT2_16_WG32_8_1_WGM2
    SolutionIndex: 59
    SolutionNameMin: Cijk_Ailk_Bjlk_CB_GB_MT64x32x16_MI16x16x4x1_SN_1LDSB1_EPS0_GRVW1_NLCA1_NLCB1_PGR2_SRVW1_TT2_16_WG32_8_1_WGM15
    SolutionIndex: 60
    SolutionNameMin: Cijk_Ailk_Bjlk_CB_GB_MT128x128x8_MI32x32x2x1_SN_1LDSB1_EPS1_GRVW2_NLCA1_NLCB1_PGR1_SRVW0_TT2_64_WG64_4_1_WGM15
    SolutionIndex: 61
    SolutionNameMin: Cijk_Ailk_Bjlk_CB_GB_MT32x64x8_MI16x16x4x1_SN_1LDSB1_EPS0_GRVW2_NLCA1_NLCB1_PGR2_SRVW1_TT1_32_WG32_8_1_WGM15
    SolutionIndex: 62
    SolutionNameMin: Cijk_Ailk_Bjlk_CB_GB_MT64x32x8_MI16x16x4x1_SN_1LDSB1_EPS0_GRVW2_NLCA1_NLCB1_PGR2_SRVW1_TT2_16_WG32_8_1_WGM15
    SolutionIndex: 63
    SolutionNameMin: Cijk_Ailk_Bjlk_CB_GB_MT64x32x16_MI16x16x4x1_SN_1LDSB1_EPS1_GRVW2_NLCA1_NLCB1_PGR1_SRVW1_TT2_16_WG32_8_1_WGM15
    SolutionIndex: 64
    SolutionNameMin: Cijk_Ailk_Bjlk_CB_GB_MT64x32x16_MI16x16x4x1_SN_1LDSB1_EPS0_GRVW2_NLCA1_NLCB1_PGR2_SRVW1_TT2_16_WG32_8_1_WGM15
    SolutionIndex: 65
    SolutionNameMin: Cijk_Ailk_Bjlk_CB_GB_MT16x16x4_MI16x16x4x1_SN_1LDSB0_EPS1_GRVW1_NLCA1_NLCB1_PGR1_SRVW1_TT1_16_WG16_4_1_WGM1
    SolutionIndex: 66
    SolutionNameMin: Cijk_Ailk_Bjlk_CB_GB_MT16x16x4_MI16x16x4x1_SN_1LDSB0_EPS0_GRVW1_NLCA1_NLCB1_PGR2_SRVW1_TT1_16_WG16_4_1_WGM1
    SolutionIndex: 67
    SolutionNameMin: Cijk_Ailk_Bjlk_CB_GB_MT16x16x8_MI16x16x4x1_SN_1LDSB0_EPS1_GRVW1_NLCA1_NLCB1_PGR1_SRVW1_TT1_16_WG16_4_1_WGM1
    SolutionIndex: 68
    SolutionNameMin: Cijk_Ailk_Bjlk_CB_GB_MT16x16x8_MI16x16x4x1_SN_1LDSB0_EPS1_GRVW2_NLCA1_NLCB1_PGR1_SRVW1_TT1_16_WG16_4_1_WGM1
    SolutionIndex: 69
    SolutionNameMin: Cijk_Ailk_Bjlk_CB_GB_MT16x16x8_MI16x16x4x1_SN_1LDSB0_EPS0_GRVW2_NLCA1_NLCB1_PGR2_SRVW1_TT1_16_WG16_4_1_WGM1
    SolutionIndex: 70
    SolutionNameMin: Cijk_Ailk_Bjlk_CB_GB_MT16x32x8_MI16x16x4x1_SN_1LDSB0_EPS0_GRVW2_NLCA1_NLCB1_PGR2_SRVW1_TT1_16_WG16_8_1_WGM1
    SolutionIndex: 71
    SolutionNameMin: Cijk_Ailk_Bjlk_CB_GB_MT16x16x8_MI16x16x4x1_SN_1LDSB0_EPS1_GRVW1_NLCA1_NLCB1_PGR1_SRVW1_TT1_16_WG16_4_1_WGM2
    SolutionIndex: 72
    SolutionNameMin: Cijk_Ailk_Bjlk_CB_GB_MT16x16x8_MI16x16x4x1_SN_1LDSB0_EPS1_GRVW1_NLCA1_NLCB1_PGR1_SRVW1_TT1_16_WG16_4_1_WGM15
    SolutionIndex: 73
    SolutionNameMin: Cijk_Ailk_Bjlk_CB_GB_MT16x16x8_MI16x16x4x1_SN_1LDSB0_EPS1_GRVW2_NLCA1_NLCB1_PGR1_SRVW1_TT1_16_WG16_4_1_WGM15
    SolutionIndex: 74
    SolutionNameMin: Cijk_Ailk_Bjlk_CB_GB_MT16x16x4_MI16x16x4x1_SN_1LDSB1_EPS0_GRVW1_NLCA1_NLCB1_PGR2_SRVW1_TT1_16_WG16_4_1_WGM1
    SolutionIndex: 75
    SolutionNameMin: Cijk_Ailk_Bjlk_CB_GB_MT16x16x4_MI16x16x4x1_SN_1LDSB1_EPS0_GRVW1_NLCA1_NLCB1_PGR2_SRVW1_TT1_16_WG16_4_1_WGM15
- - - [192, 192, 1000, 32, 192, 192, 192, 192]
    - [45, 5411.0]
  - - [1536, 1536, 168, 32, 1536, 1536, 1536, 1536]
    - [61, 5531.0]
  - - [1536, 32, 168, 1536, 1536, 1536, 1536, 32]
    - [55, 6804.0]
  - - [32, 1536, 168, 32, 32, 32, 32, 1536]
    - [52, 3741.0]
  - - [384, 384, 1024, 384, 384, 384, 384, 384]
    - [61, 7985.0]
  - - [1, 1, 1000, 1, 1, 1, 1, 1]
    - [65, 0.0]
  - - [2, 2, 1000, 2, 2, 2, 2, 2]
    - [65, 2.0]
  - - [3, 3, 1000, 3, 3, 3, 3, 3]
    - [65, 6.0]
  - - [4, 4, 1000, 4, 4, 4, 4, 4]
    - [65, 15.0]
  - - [5, 5, 1000, 5, 5, 5, 5, 5]
    - [67, 27.0]
  - - [6, 6, 1000, 6, 6, 6, 6, 6]
    - [65, 47.0]
  - - [7, 7, 1000, 7, 7, 7, 7, 7]
    - [67, 74.0]
  - - [8, 8, 1000, 8, 8, 8, 8, 8]
    - [66, 112.0]
  - - [9, 9, 1000, 9, 9, 9, 9, 9]
    - [74, 149.0]
  - - [10, 10, 1000, 10, 10, 10, 10, 10]
    - [71, 195.0]
  - - [11, 11, 1000, 11, 11, 11, 11, 11]
    - [67, 256.0]
  - - [12, 12, 1000, 12, 12, 12, 12, 12]
    - [66, 343.0]
  - - [13, 13, 1000, 13, 13, 13, 13, 13]
    - [72, 392.0]
  - - [14, 14, 1000, 14, 14, 14, 14, 14]
    - [72, 490.0]
  - - [15, 15, 1000, 15, 15, 15, 15, 15]
    - [72, 578.0]
  - - [16, 16, 1000, 16, 16, 16, 16, 16]
    - [75, 721.0]
  - - [17, 17, 1000, 17, 17, 17, 17, 17]
    - [17, 512.0]
  - - [18, 18, 1000, 18, 18, 18, 18, 18]
    - [2, 593.0]
  - - [19, 19, 1000, 19, 19, 19, 19, 19]
    - [7, 686.0]
  - - [20, 20, 1000, 20, 20, 20, 20, 20]
    - [37, 787.0]
  - - [21, 21, 1000, 21, 21, 21, 21, 21]
    - [17, 864.0]
  - - [22, 22, 1000, 22, 22, 22, 22, 22]
    - [31, 993.0]
  - - [23, 23, 1000, 23, 23, 23, 23, 23]
    - [2, 1071.0]
  - - [24, 24, 1000, 24, 24, 24, 24, 24]
    - [21, 1243.0]
  - - [25, 25, 1000, 25, 25, 25, 25, 25]
    - [31, 1228.0]
  - - [26, 26, 1000, 26, 26, 26, 26, 26]
    - [16, 1348.0]
  - - [27, 27, 1000, 27, 27, 27, 27, 27]
    - [17, 1473.0]
  - - [28, 28, 1000, 28, 28, 28, 28, 28]
    - [21, 1595.0]
  - - [29, 29, 1000, 29, 29, 29, 29, 29]
    - [7, 1675.0]
  - - [30, 30, 1000, 30, 30, 30, 30, 30]
    - [29, 1795.0]
  - - [31, 31, 1000, 31, 31, 31, 31, 31]
    - [17, 1910.0]
  - - [32, 32, 1000, 32, 32, 32, 32, 32]
    - [0, 2058.0]
  - - [33, 33, 1000, 33, 33, 33, 33, 33]
    - [69, 1033.0]
  - - [34, 34, 1000, 34, 34, 34, 34, 34]
    - [69, 1129.0]
  - - [35, 35, 1000, 35, 35, 35, 35, 35]
    - [70, 1204.0]
  - - [36, 36, 1000, 36, 36, 36, 36, 36]
    - [68, 1399.0]
  - - [37, 37, 1000, 37, 37, 37, 37, 37]
    - [70, 1303.0]
  - - [38, 38, 1000, 38, 38, 38, 38, 38]
    - [73, 1429.0]
  - - [39, 39, 1000, 39, 39, 39, 39, 39]
    - [43, 1489.0]
  - - [40, 40, 1000, 40, 40, 40, 40, 40]
    - [69, 2005.0]
  - - [41, 41, 1000, 41, 41, 41, 41, 41]
    - [70, 1654.0]
  - - [42, 42, 1000, 42, 42, 42, 42, 42]
    - [70, 1781.0]
  - - [43, 43, 1000, 43, 43, 43, 43, 43]
    - [48, 1893.0]
  - - [44, 44, 1000, 44, 44, 44, 44, 44]
    - [70, 2080.0]
  - - [45, 45, 1000, 45, 45, 45, 45, 45]
    - [43, 2023.0]
  - - [46, 46, 1000, 46, 46, 46, 46, 46]
    - [48, 2200.0]
  - - [47, 47, 1000, 47, 47, 47, 47, 47]
    - [48, 2313.0]
  - - [48, 48, 1000, 48, 48, 48, 48, 48]
    - [73, 2705.0]
  - - [49, 49, 1000, 49, 49, 49, 49, 49]
    - [50, 2549.0]
  - - [50, 50, 1000, 50, 50, 50, 50, 50]
    - [50, 2708.0]
  - - [51, 51, 1000, 51, 51, 51, 51, 51]
    - [53, 2839.0]
  - - [52, 52, 1000, 52, 52, 52, 52, 52]
    - [50, 3004.0]
  - - [53, 53, 1000, 53, 53, 53, 53, 53]
    - [48, 2968.0]
  - - [54, 54, 1000, 54, 54, 54, 54, 54]
    - [48, 3139.0]
  - - [55, 55, 1000, 55, 55, 55, 55, 55]
    - [3, 3244.0]
  - - [56, 56, 1000, 56, 56, 56, 56, 56]
    - [0, 3599.0]
  - - [57, 57, 1000, 57, 57, 57, 57, 57]
    - [43, 3424.0]
  - - [58, 58, 1000, 58, 58, 58, 58, 58]
    - [48, 3629.0]
  - - [59, 59, 1000, 59, 59, 59, 59, 59]
    - [44, 3748.0]
  - - [60, 60, 1000, 60, 60, 60, 60, 60]
    - [48, 3942.0]
  - - [61, 61, 1000, 61, 61, 61, 61, 61]
    - [48, 3957.0]
  - - [62, 62, 1000, 62, 62, 62, 62, 62]
    - [48, 4109.0]
  - - [63, 63, 1000, 63, 63, 63, 63, 63]
    - [11, 4241.0]
  - - [64, 64, 1000, 64, 64, 64, 64, 64]
    - [49, 4622.0]
  - - [65, 65, 1000, 65, 65, 65, 65, 65]
    - [7, 2278.0]
  - - [66, 66, 1000, 66, 66, 66, 66, 66]
    - [16, 2413.0]
  - - [67, 67, 1000, 67, 67, 67, 67, 67]
    - [13, 2446.0]
  - - [68, 68, 1000, 68, 68, 68, 68, 68]
    - [31, 2685.0]
  - - [69, 69, 1000, 69, 69, 69, 69, 69]
    - [10, 2566.0]
  - - [70, 70, 1000, 70, 70, 70, 70, 70]
    - [17, 2726.0]
  - - [71, 71, 1000, 71, 71, 71, 71, 71]
    - [12, 2750.0]
  - - [72, 72, 1000, 72, 72, 72, 72, 72]
    - [23, 3267.0]
  - - [73, 73, 1000, 73, 73, 73, 73, 73]
    - [2, 2884.0]
  - - [74, 74, 1000, 74, 74, 74, 74, 74]
    - [2, 3050.0]
  - - [75, 75, 1000, 75, 75, 75, 75, 75]
    - [12, 3073.0]
  - - [76, 76, 1000, 76, 76, 76, 76, 76]
    - [2, 3389.0]
  - - [77, 77, 1000, 77, 77, 77, 77, 77]
    - [2, 3215.0]
  - - [78, 78, 1000, 78, 78, 78, 78, 78]
    - [2, 3365.0]
  - - [79, 79, 1000, 79, 79, 79, 79, 79]
    - [13, 3403.0]
  - - [80, 80, 1000, 80, 80, 80, 80, 80]
    - [10, 4066.0]
  - - [81, 81, 1000, 81, 81, 81, 81, 81]
    - [13, 3672.0]
  - - [82, 82, 1000, 82, 82, 82, 82, 82]
    - [13, 3814.0]
  - - [83, 83, 1000, 83, 83, 83, 83, 83]
    - [13, 3887.0]
  - - [84, 84, 1000, 84, 84, 84, 84, 84]
    - [2, 4102.0]
  - - [85, 85, 1000, 85, 85, 85, 85, 85]
    - [13, 3990.0]
  - - [86, 86, 1000, 86, 86, 86, 86, 86]
    - [13, 4143.0]
  - - [87, 87, 1000, 87, 87, 87, 87, 87]
    - [13, 4228.0]
  - - [88, 88, 1000, 88, 88, 88, 88, 88]
    - [17, 4938.0]
  - - [89, 89, 1000, 89, 89, 89, 89, 89]
    - [13, 4356.0]
  - - [90, 90, 1000, 90, 90, 90, 90, 90]
    - [13, 4518.0]
  - - [91, 91, 1000, 91, 91, 91, 91, 91]
    - [13, 4529.0]
  - - [92, 92, 1000, 92, 92, 92, 92, 92]
    - [17, 4923.0]
  - - [93, 93, 1000, 93, 93, 93, 93, 93]
    - [10, 4644.0]
  - - [94, 94, 1000, 94, 94, 94, 94, 94]
    - [2, 4856.0]
  - - [95, 95, 1000, 95, 95, 95, 95, 95]
    - [17, 4819.0]
  - - [96, 96, 1000, 96, 96, 96, 96, 96]
    - [13, 5772.0]
  - - [97, 97, 1000, 97, 97, 97, 97, 97]
    - [57, 3474.0]
  - - [98, 98, 1000, 98, 98, 98, 98, 98]
    - [57, 3597.0]
  - - [99, 99, 1000, 99, 99, 99, 99, 99]
    - [57, 3666.0]
  - - [100, 100, 1000, 100, 100, 100, 100, 100]
    - [57, 3809.0]
  - - [101, 101, 1000, 101, 101, 101, 101, 101]
    - [57, 3741.0]
  - - [102, 102, 1000, 102, 102, 102, 102, 102]
    - [57, 3865.0]
  - - [103, 103, 1000, 103, 103, 103, 103, 103]
    - [57, 3957.0]
  - - [104, 104, 1000, 104, 104, 104, 104, 104]
    - [11, 4293.0]
  - - [105, 105, 1000, 105, 105, 105, 105, 105]
    - [48, 4081.0]
  - - [106, 106, 1000, 106, 106, 106, 106, 106]
    - [56, 4206.0]
  - - [107, 107, 1000, 107, 107, 107, 107, 107]
    - [48, 4299.0]
  - - [108, 108, 1000, 108, 108, 108, 108, 108]
    - [48, 4456.0]
  - - [109, 109, 1000, 109, 109, 109, 109, 109]
    - [48, 4417.0]
  - - [110, 110, 1000, 110, 110, 110, 110, 110]
    - [24, 4526.0]
  - - [111, 111, 1000, 111, 111, 111, 111, 111]
    - [48, 4640.0]
  - - [112, 112, 1000, 112, 112, 112, 112, 112]
    - [49, 5015.0]
  - - [113, 113, 1000, 113, 113, 113, 113, 113]
    - [48, 4778.0]
  - - [114, 114, 1000, 114, 114, 114, 114, 114]
    - [48, 4925.0]
  - - [115, 115, 1000, 115, 115, 115, 115, 115]
    - [48, 5025.0]
  - - [116, 116, 1000, 116, 116, 116, 116, 116]
    - [48, 5192.0]
  - - [117, 117, 1000, 117, 117, 117, 117, 117]
    - [48, 5120.0]
  - - [118, 118, 1000, 118, 118, 118, 118, 118]
    - [11, 5257.0]
  - - [119, 119, 1000, 119, 119, 119, 119, 119]
    - [48, 5357.0]
  - - [120, 120, 1000, 120, 120, 120, 120, 120]
    - [11, 5743.0]
  - - [121, 121, 1000, 121, 121, 121, 121, 121]
    - [48, 5520.0]
  - - [122, 122, 1000, 122, 122, 122, 122, 122]
    - [48, 5676.0]
  - - [123, 123, 1000, 123, 123, 123, 123, 123]
    - [48, 5763.0]
  - - [124, 124, 1000, 124, 124, 124, 124, 124]
    - [48, 5976.0]
  - - [125, 125, 1000, 125, 125, 125, 125, 125]
    - [48, 5867.0]
  - - [126, 126, 1000, 126, 126, 126, 126, 126]
    - [48, 6031.0]
  - - [127, 127, 1000, 127, 127, 127, 127, 127]
    - [48, 6039.0]
  - - [128, 128, 1000, 128, 128, 128, 128, 128]
    - [49, 6774.0]
  - - [129, 129, 1000, 129, 129, 129, 129, 129]
    - [12, 3954.0]
  - - [130, 130, 1000, 130, 130, 130, 130, 130]
    - [39, 4099.0]
  - - [131, 131, 1000, 131, 131, 131, 131, 131]
    - [12, 4122.0]
  - - [132, 132, 1000, 132, 132, 132, 132, 132]
    - [12, 4355.0]
  - - [133, 133, 1000, 133, 133, 133, 133, 133]
    - [12, 4216.0]
  - - [134, 134, 1000, 134, 134, 134, 134, 134]
    - [12, 4346.0]
  - - [135, 135, 1000, 135, 135, 135, 135, 135]
    - [12, 4356.0]
  - - [136, 136, 1000, 136, 136, 136, 136, 136]
    - [2, 4786.0]
  - - [137, 137, 1000, 137, 137, 137, 137, 137]
    - [12, 4418.0]
  - - [138, 138, 1000, 138, 138, 138, 138, 138]
    - [13, 4566.0]
  - - [139, 139, 1000, 139, 139, 139, 139, 139]
    - [13, 4555.0]
  - - [140, 140, 1000, 140, 140, 140, 140, 140]
    - [13, 4832.0]
  - - [141, 141, 1000, 141, 141, 141, 141, 141]
    - [13, 4617.0]
  - - [142, 142, 1000, 142, 142, 142, 142, 142]
    - [13, 4759.0]
  - - [143, 143, 1000, 143, 143, 143, 143, 143]
    - [13, 4701.0]
  - - [144, 144, 1000, 144, 144, 144, 144, 144]
    - [13, 5446.0]
  - - [145, 145, 1000, 145, 145, 145, 145, 145]
    - [12, 4704.0]
  - - [146, 146, 1000, 146, 146, 146, 146, 146]
    - [13, 4778.0]
  - - [147, 147, 1000, 147, 147, 147, 147, 147]
    - [39, 4838.0]
  - - [148, 148, 1000, 148, 148, 148, 148, 148]
    - [12, 5237.0]
  - - [149, 149, 1000, 149, 149, 149, 149, 149]
    - [13, 4941.0]
  - - [150, 150, 1000, 150, 150, 150, 150, 150]
    - [13, 5124.0]
  - - [32, 32, 8, 32, 32, 32, 32, 32]
    - [10, 46.0]
  - - [32, 32, 8, 64, 32, 32, 32, 32]
    - [14, 82.0]
  - - [32, 32, 8, 128, 32, 32, 32, 32]
    - [28, 125.0]
  - - [32, 32, 8, 256, 32, 32, 32, 32]
    - [14, 187.0]
  - - [32, 32, 8, 512, 32, 32, 32, 32]
    - [14, 245.0]
  - - [32, 32, 8, 1024, 32, 32, 32, 32]
    - [27, 295.0]
  - - [32, 32, 8, 2048, 32, 32, 32, 32]
    - [14, 333.0]
  - - [32, 64, 8, 32, 32, 32, 32, 64]
    - [6, 91.0]
  - - [32, 64, 8, 64, 32, 32, 32, 64]
    - [14, 160.0]
  - - [32, 64, 8, 128, 32, 32, 32, 64]
    - [14, 257.0]
  - - [32, 64, 8, 256, 32, 32, 32, 64]
    - [14, 383.0]
  - - [32, 64, 8, 512, 32, 32, 32, 64]
    - [27, 502.0]
  - - [32, 64, 8, 1024, 32, 32, 32, 64]
    - [27, 599.0]
  - - [32, 64, 8, 2048, 32, 32, 32, 64]
    - [27, 666.0]
  - - [32, 128, 8, 32, 32, 32, 32, 128]
    - [6, 185.0]
  - - [32, 128, 8, 64, 32, 32, 32, 128]
    - [19, 305.0]
  - - [32, 128, 8, 128, 32, 32, 32, 128]
    - [27, 495.0]
  - - [32, 128, 8, 256, 32, 32, 32, 128]
    - [27, 733.0]
  - - [32, 128, 8, 512, 32, 32, 32, 128]
    - [14, 989.0]
  - - [32, 128, 8, 1024, 32, 32, 32, 128]
    - [14, 1205.0]
  - - [32, 128, 8, 2048, 32, 32, 32, 128]
    - [14, 1332.0]
  - - [32, 256, 8, 32, 32, 32, 32, 256]
    - [6, 374.0]
  - - [32, 256, 8, 64, 32, 32, 32, 256]
    - [2, 610.0]
  - - [32, 256, 8, 128, 32, 32, 32, 256]
    - [14, 989.0]
  - - [32, 256, 8, 256, 32, 32, 32, 256]
    - [27, 1477.0]
  - - [32, 256, 8, 512, 32, 32, 32, 256]
    - [14, 2066.0]
  - - [32, 256, 8, 1024, 32, 32, 32, 256]
    - [27, 2404.0]
  - - [32, 256, 8, 2048, 32, 32, 32, 256]
    - [27, 2672.0]
  - - [32, 512, 8, 32, 32, 32, 32, 512]
    - [23, 783.0]
  - - [32, 512, 8, 64, 32, 32, 32, 512]
    - [5, 1248.0]
  - - [32, 512, 8, 128, 32, 32, 32, 512]
    - [27, 1824.0]
  - - [32, 512, 8, 256, 32, 32, 32, 512]
    - [13, 2356.0]
  - - [32, 512, 8, 512, 32, 32, 32, 512]
    - [27, 2863.0]
  - - [32, 512, 8, 1024, 32, 32, 32, 512]
    - [14, 3214.0]
  - - [32, 512, 8, 2048, 32, 32, 32, 512]
    - [14, 3403.0]
  - - [32, 1024, 8, 32, 32, 32, 32, 1024]
    - [2, 1295.0]
  - - [32, 1024, 8, 64, 32, 32, 32, 1024]
    - [25, 1942.0]
  - - [32, 1024, 8, 128, 32, 32, 32, 1024]
    - [25, 2621.0]
  - - [32, 1024, 8, 256, 32, 32, 32, 1024]
    - [13, 3355.0]
  - - [32, 1024, 8, 512, 32, 32, 32, 1024]
    - [13, 3976.0]
  - - [32, 1024, 8, 1024, 32, 32, 32, 1024]
    - [40, 4242.0]
  - - [32, 1024, 8, 2048, 32, 32, 32, 1024]
    - [25, 4435.0]
  - - [32, 2048, 8, 32, 32, 32, 32, 2048]
    - [13, 1872.0]
  - - [32, 2048, 8, 64, 32, 32, 32, 2048]
    - [39, 2706.0]
  - - [32, 2048, 8, 128, 32, 32, 32, 2048]
    - [4, 3647.0]
  - - [32, 2048, 8, 256, 32, 32, 32, 2048]
    - [13, 4498.0]
  - - [32, 2048, 8, 512, 32, 32, 32, 2048]
    - [40, 5023.0]
  - - [32, 2048, 8, 1024, 32, 32, 32, 2048]
    - [13, 5313.0]
  - - [32, 2048, 8, 2048, 32, 32, 32, 2048]
    - [40, 5539.0]
  - - [64, 32, 8, 32, 64, 64, 64, 32]
    - [6, 95.0]
  - - [64, 32, 8, 64, 64, 64, 64, 32]
    - [6, 160.0]
  - - [64, 32, 8, 128, 64, 64, 64, 32]
    - [14, 255.0]
  - - [64, 32, 8, 256, 64, 64, 64, 32]
    - [27, 369.0]
  - - [64, 32, 8, 512, 64, 64, 64, 32]
    - [14, 499.0]
  - - [64, 32, 8, 1024, 64, 64, 64, 32]
    - [27, 596.0]
  - - [64, 32, 8, 2048, 64, 64, 64, 32]
    - [27, 670.0]
  - - [64, 64, 8, 32, 64, 64, 64, 64]
    - [6, 180.0]
  - - [64, 64, 8, 64, 64, 64, 64, 64]
    - [39, 320.0]
  - - [64, 64, 8, 128, 64, 64, 64, 64]
    - [12, 499.0]
  - - [64, 64, 8, 256, 64, 64, 64, 64]
    - [41, 723.0]
  - - [64, 64, 8, 512, 64, 64, 64, 64]
    - [14, 994.0]
  - - [64, 64, 8, 1024, 64, 64, 64, 64]
    - [27, 1202.0]
  - - [64, 64, 8, 2048, 64, 64, 64, 64]
    - [41, 1342.0]
  - - [64, 128, 8, 32, 64, 64, 64, 128]
    - [14, 374.0]
  - - [64, 128, 8, 64, 64, 64, 64, 128]
    - [5, 617.0]
  - - [64, 128, 8, 128, 64, 64, 64, 128]
    - [25, 1028.0]
  - - [64, 128, 8, 256, 64, 64, 64, 128]
    - [14, 1487.0]
  - - [64, 128, 8, 512, 64, 64, 64, 128]
    - [27, 2016.0]
  - - [64, 128, 8, 1024, 64, 64, 64, 128]
    - [27, 2411.0]
  - - [64, 128, 8, 2048, 64, 64, 64, 128]
    - [27, 2680.0]
  - - [64, 256, 8, 32, 64, 64, 64, 256]
    - [13, 794.0]
  - - [64, 256, 8, 64, 64, 64, 64, 256]
    - [12, 1248.0]
  - - [64, 256, 8, 128, 64, 64, 64, 256]
    - [39, 1824.0]
  - - [64, 256, 8, 256, 64, 64, 64, 256]
    - [25, 2397.0]
  - - [64, 256, 8, 512, 64, 64, 64, 256]
    - [39, 2853.0]
  - - [64, 256, 8, 1024, 64, 64, 64, 256]
    - [27, 3196.0]
  - - [64, 256, 8, 2048, 64, 64, 64, 256]
    - [14, 3342.0]
  - - [64, 512, 8, 32, 64, 64, 64, 512]
    - [4, 1311.0]
  - - [64, 512, 8, 64, 64, 64, 64, 512]
    - [25, 1997.0]
  - - [64, 512, 8, 128, 64, 64, 64, 512]
    - [12, 2796.0]
  - - [64, 512, 8, 256, 64, 64, 64, 512]
    - [5, 3369.0]
  - - [64, 512, 8, 512, 64, 64, 64, 512]
    - [39, 3920.0]
  - - [64, 512, 8, 1024, 64, 64, 64, 512]
    - [25, 4307.0]
  - - [64, 512, 8, 2048, 64, 64, 64, 512]
    - [39, 4462.0]
  - - [64, 1024, 8, 32, 64, 64, 64, 1024]
    - [56, 2016.0]
  - - [64, 1024, 8, 64, 64, 64, 64, 1024]
    - [8, 2796.0]
  - - [64, 1024, 8, 128, 64, 64, 64, 1024]
    - [40, 3762.0]
  - - [64, 1024, 8, 256, 64, 64, 64, 1024]
    - [19, 4269.0]
  - - [64, 1024, 8, 512, 64, 64, 64, 1024]
    - [27, 4726.0]
  - - [64, 1024, 8, 1024, 64, 64, 64, 1024]
    - [27, 5080.0]
  - - [64, 1024, 8, 2048, 64, 64, 64, 1024]
    - [42, 5313.0]
  - - [64, 2048, 8, 32, 64, 64, 64, 2048]
    - [46, 2724.0]
  - - [64, 2048, 8, 64, 64, 64, 64, 2048]
    - [38, 3745.0]
  - - [64, 2048, 8, 128, 64, 64, 64, 2048]
    - [49, 4780.0]
  - - [64, 2048, 8, 256, 64, 64, 64, 2048]
    - [49, 5492.0]
  - - [64, 2048, 8, 512, 64, 64, 64, 2048]
    - [63, 5949.0]
  - - [64, 2048, 8, 1024, 64, 64, 64, 2048]
    - [49, 6177.0]
  - - [64, 2048, 8, 2048, 64, 64, 64, 2048]
    - [63, 6325.0]
  - - [128, 32, 8, 32, 128, 128, 128, 32]
    - [39, 185.0]
  - - [128, 32, 8, 64, 128, 128, 128, 32]
    - [5, 312.0]
  - - [128, 32, 8, 128, 128, 128, 128, 32]
    - [13, 499.0]
  - - [128, 32, 8, 256, 128, 128, 128, 32]
    - [15, 704.0]
  - - [128, 32, 8, 512, 128, 128, 128, 32]
    - [27, 999.0]
  - - [128, 32, 8, 1024, 128, 128, 128, 32]
    - [14, 1195.0]
  - - [128, 32, 8, 2048, 128, 128, 128, 32]
    - [27, 1344.0]
  - - [128, 64, 8, 32, 128, 128, 128, 64]
    - [27, 369.0]
  - - [128, 64, 8, 64, 128, 128, 128, 64]
    - [4, 624.0]
  - - [128, 64, 8, 128, 128, 128, 128, 64]
    - [39, 989.0]
  - - [128, 64, 8, 256, 128, 128, 128, 64]
    - [27, 1487.0]
  - - [128, 64, 8, 512, 128, 128, 128, 64]
    - [14, 2007.0]
  - - [128, 64, 8, 1024, 128, 128, 128, 64]
    - [14, 2417.0]
  - - [128, 64, 8, 2048, 128, 128, 128, 64]
    - [27, 2672.0]
  - - [128, 128, 8, 32, 128, 128, 128, 128]
    - [33, 794.0]
  - - [128, 128, 8, 64, 128, 128, 128, 128]
    - [12, 1311.0]
  - - [128, 128, 8, 128, 128, 128, 128, 128]
    - [39, 1840.0]
  - - [128, 128, 8, 256, 128, 128, 128, 128]
    - [39, 2383.0]
  - - [128, 128, 8, 512, 128, 128, 128, 128]
    - [39, 2815.0]
  - - [128, 128, 8, 1024, 128, 128, 128, 128]
    - [41, 3184.0]
  - - [128, 128, 8, 2048, 128, 128, 128, 128]
    - [41, 3362.0]
  - - [128, 256, 8, 32, 128, 128, 128, 256]
    - [2, 1327.0]
  - - [128, 256, 8, 64, 128, 128, 128, 256]
    - [39, 2097.0]
  - - [128, 256, 8, 128, 128, 128, 128, 256]
    - [39, 2834.0]
  - - [128, 256, 8, 256, 128, 128, 128, 256]
    - [12, 3495.0]
  - - [128, 256, 8, 512, 128, 128, 128, 256]
    - [13, 4014.0]
  - - [128, 256, 8, 1024, 128, 128, 128, 256]
    - [13, 4409.0]
  - - [128, 256, 8, 2048, 128, 128, 128, 256]
    - [25, 4654.0]
  - - [128, 512, 8, 32, 128, 128, 128, 512]
    - [31, 1997.0]
  - - [128, 512, 8, 64, 128, 128, 128, 512]
    - [12, 2834.0]
  - - [128, 512, 8, 128, 128, 128, 128, 512]
    - [10, 3884.0]
  - - [128, 512, 8, 256, 128, 128, 128, 512]
    - [64, 4237.0]
  - - [128, 512, 8, 512, 128, 128, 128, 512]
    - [15, 4726.0]
  - - [128, 512, 8, 1024, 128, 128, 128, 512]
    - [15, 4927.0]
  - - [128, 512, 8, 2048, 128, 128, 128, 512]
    - [42, 5200.0]
  - - [128, 1024, 8, 32, 128, 128, 128, 1024]
    - [59, 2741.0]
  - - [128, 1024, 8, 64, 128, 128, 128, 1024]
    - [8, 3728.0]
  - - [128, 1024, 8, 128, 128, 128, 128, 1024]
    - [38, 4780.0]
  - - [128, 1024, 8, 256, 128, 128, 128, 1024]
    - [63, 5456.0]
  - - [128, 1024, 8, 512, 128, 128, 128, 1024]
    - [63, 5902.0]
  - - [128, 1024, 8, 1024, 128, 128, 128, 1024]
    - [63, 6143.0]
  - - [128, 1024, 8, 2048, 128, 128, 128, 1024]
    - [49, 6312.0]
  - - [128, 2048, 8, 32, 128, 128, 128, 2048]
    - [0, 3510.0]
  - - [128, 2048, 8, 64, 128, 128, 128, 2048]
    - [62, 4647.0]
  - - [128, 2048, 8, 128, 128, 128, 128, 2048]
    - [11, 5746.0]
  - - [128, 2048, 8, 256, 128, 128, 128, 2048]
    - [63, 6410.0]
  - - [128, 2048, 8, 512, 128, 128, 128, 2048]
    - [57, 6789.0]
  - - [128, 2048, 8, 1024, 128, 128, 128, 2048]
    - [57, 7062.0]
  - - [128, 2048, 8, 2048, 128, 128, 128, 2048]
    - [57, 7186.0]
  - - [256, 32, 8, 32, 256, 256, 256, 32]
    - [5, 369.0]
  - - [256, 32, 8, 64, 256, 256, 256, 32]
    - [27, 596.0]
  - - [256, 32, 8, 128, 256, 256, 256, 32]
    - [13, 971.0]
  - - [256, 32, 8, 256, 256, 256, 256, 32]
    - [13, 1407.0]
  - - [256, 32, 8, 512, 256, 256, 256, 32]
    - [14, 1978.0]
  - - [256, 32, 8, 1024, 256, 256, 256, 32]
    - [27, 2390.0]
  - - [256, 32, 8, 2048, 256, 256, 256, 32]
    - [27, 2621.0]
  - - [256, 64, 8, 32, 256, 256, 256, 64]
    - [20, 807.0]
  - - [256, 64, 8, 64, 256, 256, 256, 64]
    - [26, 1279.0]
  - - [256, 64, 8, 128, 256, 256, 256, 64]
    - [26, 1777.0]
  - - [256, 64, 8, 256, 256, 256, 256, 64]
    - [42, 2243.0]
  - - [256, 64, 8, 512, 256, 256, 256, 64]
    - [12, 2815.0]
  - - [256, 64, 8, 1024, 256, 256, 256, 64]
    - [27, 3118.0]
  - - [256, 64, 8, 2048, 256, 256, 256, 64]
    - [14, 3306.0]
  - - [256, 128, 8, 32, 256, 256, 256, 128]
    - [12, 1344.0]
  - - [256, 128, 8, 64, 256, 256, 256, 128]
    - [12, 2097.0]
  - - [256, 128, 8, 128, 256, 256, 256, 128]
    - [25, 2689.0]
  - - [256, 128, 8, 256, 256, 256, 256, 128]
    - [25, 3107.0]
  - - [256, 128, 8, 512, 256, 256, 256, 128]
    - [39, 4043.0]
  - - [256, 128, 8, 1024, 256, 256, 256, 128]
    - [12, 4403.0]
  - - [256, 128, 8, 2048, 256, 256, 256, 128]
    - [12, 4641.0]
  - - [256, 256, 8, 32, 256, 256, 256, 256]
    - [48, 2036.0]
  - - [256, 256, 8, 64, 256, 256, 256, 256]
    - [35, 2873.0]
  - - [256, 256, 8, 128, 256, 256, 256, 256]
    - [8, 3616.0]
  - - [256, 256, 8, 256, 256, 256, 256, 256]
    - [35, 4153.0]
  - - [256, 256, 8, 512, 256, 256, 256, 256]
    - [63, 4596.0]
  - - [256, 256, 8, 1024, 256, 256, 256, 256]
    - [42, 5053.0]
  - - [256, 256, 8, 2048, 256, 256, 256, 256]
    - [42, 5212.0]
  - - [256, 512, 8, 32, 256, 256, 256, 512]
    - [46, 2724.0]
  - - [256, 512, 8, 64, 256, 256, 256, 512]
    - [47, 3866.0]
  - - [256, 512, 8, 128, 256, 256, 256, 512]
    - [48, 4821.0]
  - - [256, 512, 8, 256, 256, 256, 256, 512]
    - [49, 5377.0]
  - - [256, 512, 8, 512, 256, 256, 256, 512]
    - [63, 5841.0]
  - - [256, 512, 8, 1024, 256, 256, 256, 512]
    - [49, 6137.0]
  - - [256, 512, 8, 2048, 256, 256, 256, 512]
    - [49, 6272.0]
  - - [256, 1024, 8, 32, 256, 256, 256, 1024]
    - [59, 3410.0]
  - - [256, 1024, 8, 64, 256, 256, 256, 1024]
    - [35, 4609.0]
  - - [256, 1024, 8, 128, 256, 256, 256, 1024]
    - [38, 5687.0]
  - - [256, 1024, 8, 256, 256, 256, 256, 1024]
    - [63, 6272.0]
  - - [256, 1024, 8, 512, 256, 256, 256, 1024]
    - [63, 6621.0]
  - - [256, 1024, 8, 1024, 256, 256, 256, 1024]
    - [63, 6901.0]
  - - [256, 1024, 8, 2048, 256, 256, 256, 1024]
    - [63, 7089.0]
  - - [256, 2048, 8, 32, 256, 256, 256, 2048]
    - [59, 3985.0]
  - - [256, 2048, 8, 64, 256, 256, 256, 2048]
    - [35, 5139.0]
  - - [256, 2048, 8, 128, 256, 256, 256, 2048]
    - [63, 6129.0]
  - - [256, 2048, 8, 256, 256, 256, 256, 2048]
    - [63, 6711.0]
  - - [256, 2048, 8, 512, 256, 256, 256, 2048]
    - [49, 6967.0]
  - - [256, 2048, 8, 1024, 256, 256, 256, 2048]
    - [49, 7182.0]
  - - [256, 2048, 8, 2048, 256, 256, 256, 2048]
    - [49, 7294.0]
  - - [512, 32, 8, 32, 512, 512, 512, 32]
    - [5, 760.0]
  - - [512, 32, 8, 64, 512, 512, 512, 32]
    - [12, 1234.0]
  - - [512, 32, 8, 128, 512, 512, 512, 32]
    - [12, 1792.0]
  - - [512, 32, 8, 256, 512, 512, 512, 32]
    - [13, 2343.0]
  - - [512, 32, 8, 512, 512, 512, 512, 32]
    - [41, 2741.0]
  - - [512, 32, 8, 1024, 512, 512, 512, 32]
    - [41, 3056.0]
  - - [512, 32, 8, 2048, 512, 512, 512, 32]
    - [27, 3242.0]
  - - [512, 64, 8, 32, 512, 512, 512, 64]
    - [2, 1311.0]
  - - [512, 64, 8, 64, 512, 512, 512, 64]
    - [13, 1907.0]
  - - [512, 64, 8, 128, 512, 512, 512, 64]
    - [27, 2638.0]
  - - [512, 64, 8, 256, 512, 512, 512, 64]
    - [41, 3342.0]
  - - [512, 64, 8, 512, 512, 512, 512, 64]
    - [39, 4004.0]
  - - [512, 64, 8, 1024, 512, 512, 512, 64]
    - [27, 4158.0]
  - - [512, 64, 8, 2048, 512, 512, 512, 64]
    - [41, 4316.0]
  - - [512, 128, 8, 32, 512, 512, 512, 128]
    - [56, 2056.0]
  - - [512, 128, 8, 64, 512, 512, 512, 128]
    - [4, 2913.0]
  - - [512, 128, 8, 128, 512, 512, 512, 128]
    - [40, 3813.0]
  - - [512, 128, 8, 256, 512, 512, 512, 128]
    - [39, 4335.0]
  - - [512, 128, 8, 512, 512, 512, 512, 128]
    - [40, 4780.0]
  - - [512, 128, 8, 1024, 512, 512, 512, 128]
    - [28, 5080.0]
  - - [512, 128, 8, 2048, 512, 512, 512, 128]
    - [27, 5292.0]
  - - [512, 256, 8, 32, 512, 512, 512, 256]
    - [38, 2741.0]
  - - [512, 256, 8, 64, 512, 512, 512, 256]
    - [56, 3796.0]
  - - [512, 256, 8, 128, 512, 512, 512, 256]
    - [34, 4522.0]
  - - [512, 256, 8, 256, 512, 512, 512, 256]
    - [25, 5178.0]
  - - [512, 256, 8, 512, 512, 512, 512, 256]
    - [63, 5514.0]
  - - [512, 256, 8, 1024, 512, 512, 512, 256]
    - [63, 5968.0]
  - - [512, 256, 8, 2048, 512, 512, 512, 256]
    - [49, 6194.0]
  - - [512, 512, 8, 32, 512, 512, 512, 512]
    - [34, 3481.0]
  - - [512, 512, 8, 64, 512, 512, 512, 512]
    - [34, 4438.0]
  - - [512, 512, 8, 128, 512, 512, 512, 512]
    - [24, 5276.0]
  - - [512, 512, 8, 256, 512, 512, 512, 512]
    - [38, 5621.0]
  - - [512, 512, 8, 512, 512, 512, 512, 512]
    - [38, 6197.0]
  - - [512, 512, 8, 1024, 512, 512, 512, 512]
    - [63, 6641.0]
  - - [512, 512, 8, 2048, 512, 512, 512, 512]
    - [63, 6859.0]
  - - [512, 1024, 8, 32, 512, 512, 512, 1024]
    - [29, 3728.0]
  - - [512, 1024, 8, 64, 512, 512, 512, 1024]
    - [31, 4609.0]
  - - [512, 1024, 8, 128, 512, 512, 512, 1024]
    - [56, 5726.0]
  - - [512, 1024, 8, 256, 512, 512, 512, 1024]
    - [50, 6134.0]
  - - [512, 1024, 8, 512, 512, 512, 512, 1024]
    - [49, 6681.0]
  - - [512, 1024, 8, 1024, 512, 512, 512, 1024]
    - [50, 6947.0]
  - - [512, 1024, 8, 2048, 512, 512, 512, 1024]
    - [57, 7134.0]
  - - [512, 2048, 8, 32, 512, 512, 512, 2048]
    - [29, 4048.0]
  - - [512, 2048, 8, 64, 512, 512, 512, 2048]
    - [62, 4924.0]
  - - [512, 2048, 8, 128, 512, 512, 512, 2048]
    - [57, 6272.0]
  - - [512, 2048, 8, 256, 512, 512, 512, 2048]
    - [50, 6750.0]
  - - [512, 2048, 8, 512, 512, 512, 512, 2048]
    - [49, 7086.0]
  - - [512, 2048, 8, 1024, 512, 512, 512, 2048]
    - [49, 7235.0]
  - - [512, 2048, 8, 2048, 512, 512, 512, 2048]
    - [49, 7312.0]
  - - [1024, 32, 8, 32, 1024, 1024, 1024, 32]
    - [17, 1279.0]
  - - [1024, 32, 8, 64, 1024, 1024, 1024, 32]
    - [12, 1960.0]
  - - [1024, 32, 8, 128, 1024, 1024, 1024, 32]
    - [12, 2796.0]
  - - [1024, 32, 8, 256, 1024, 1024, 1024, 32]
    - [39, 3525.0]
  - - [1024, 32, 8, 512, 1024, 1024, 1024, 32]
    - [12, 4004.0]
  - - [1024, 32, 8, 1024, 1024, 1024, 1024, 32]
    - [12, 4330.0]
  - - [1024, 32, 8, 2048, 1024, 1024, 1024, 32]
    - [12, 4544.0]
  - - [1024, 64, 8, 32, 1024, 1024, 1024, 64]
    - [43, 2016.0]
  - - [1024, 64, 8, 64, 1024, 1024, 1024, 64]
    - [1, 2834.0]
  - - [1024, 64, 8, 128, 1024, 1024, 1024, 64]
    - [26, 3745.0]
  - - [1024, 64, 8, 256, 1024, 1024, 1024, 64]
    - [40, 4427.0]
  - - [1024, 64, 8, 512, 1024, 1024, 1024, 64]
    - [41, 4821.0]
  - - [1024, 64, 8, 1024, 1024, 1024, 1024, 64]
    - [41, 5046.0]
  - - [1024, 64, 8, 2048, 1024, 1024, 1024, 64]
    - [15, 5218.0]
  - - [1024, 128, 8, 32, 1024, 1024, 1024, 128]
    - [56, 2655.0]
  - - [1024, 128, 8, 64, 1024, 1024, 1024, 128]
    - [47, 3762.0]
  - - [1024, 128, 8, 128, 1024, 1024, 1024, 128]
    - [38, 4753.0]
  - - [1024, 128, 8, 256, 1024, 1024, 1024, 128]
    - [38, 5438.0]
  - - [1024, 128, 8, 512, 1024, 1024, 1024, 128]
    - [63, 5836.0]
  - - [1024, 128, 8, 1024, 1024, 1024, 1024, 128]
    - [57, 6087.0]
  - - [1024, 128, 8, 2048, 1024, 1024, 1024, 128]
    - [57, 6205.0]
  - - [1024, 256, 8, 32, 1024, 1024, 1024, 256]
    - [30, 3239.0]
  - - [1024, 256, 8, 64, 1024, 1024, 1024, 256]
    - [11, 4559.0]
  - - [1024, 256, 8, 128, 1024, 1024, 1024, 256]
    - [32, 5519.0]
  - - [1024, 256, 8, 256, 1024, 1024, 1024, 256]
    - [58, 6168.0]
  - - [1024, 256, 8, 512, 1024, 1024, 1024, 256]
    - [24, 6391.0]
  - - [1024, 256, 8, 1024, 1024, 1024, 1024, 256]
    - [24, 6604.0]
  - - [1024, 256, 8, 2048, 1024, 1024, 1024, 256]
    - [58, 6786.0]
  - - [1024, 512, 8, 32, 1024, 1024, 1024, 512]
    - [38, 3737.0]
  - - [1024, 512, 8, 64, 1024, 1024, 1024, 512]
    - [24, 4821.0]
  - - [1024, 512, 8, 128, 1024, 1024, 1024, 512]
    - [48, 5751.0]
  - - [1024, 512, 8, 256, 1024, 1024, 1024, 512]
    - [24, 6493.0]
  - - [1024, 512, 8, 512, 1024, 1024, 1024, 512]
    - [56, 6731.0]
  - - [1024, 512, 8, 1024, 1024, 1024, 1024, 512]
    - [58, 6851.0]
  - - [1024, 512, 8, 2048, 1024, 1024, 1024, 512]
    - [24, 6910.0]
  - - [1024, 1024, 8, 32, 1024, 1024, 1024, 1024]
    - [38, 3929.0]
  - - [1024, 1024, 8, 64, 1024, 1024, 1024, 1024]
    - [35, 4913.0]
  - - [1024, 1024, 8, 128, 1024, 1024, 1024, 1024]
    - [49, 5808.0]
  - - [1024, 1024, 8, 256, 1024, 1024, 1024, 1024]
    - [57, 6721.0]
  - - [1024, 1024, 8, 512, 1024, 1024, 1024, 1024]
    - [58, 6991.0]
  - - [1024, 1024, 8, 1024, 1024, 1024, 1024, 1024]
    - [58, 7140.0]
  - - [1024, 1024, 8, 2048, 1024, 1024, 1024, 1024]
    - [58, 7127.0]
  - - [1024, 2048, 8, 32, 1024, 1024, 1024, 2048]
    - [38, 4192.0]
  - - [1024, 2048, 8, 64, 1024, 1024, 1024, 2048]
    - [35, 5261.0]
  - - [1024, 2048, 8, 128, 1024, 1024, 1024, 2048]
    - [11, 6482.0]
  - - [1024, 2048, 8, 256, 1024, 1024, 1024, 2048]
    - [48, 6948.0]
  - - [1024, 2048, 8, 512, 1024, 1024, 1024, 2048]
    - [24, 7158.0]
  - - [1024, 2048, 8, 1024, 1024, 1024, 1024, 2048]
    - [9, 7464.0]
  - - [1024, 2048, 8, 2048, 1024, 1024, 1024, 2048]
    - [9, 7628.0]
  - - [2048, 32, 8, 32, 2048, 2048, 2048, 32]
    - [35, 1889.0]
  - - [2048, 32, 8, 64, 2048, 2048, 2048, 32]
    - [24, 2759.0]
  - - [2048, 32, 8, 128, 2048, 2048, 2048, 32]
    - [19, 3679.0]
  - - [2048, 32, 8, 256, 2048, 2048, 2048, 32]
    - [13, 4450.0]
  - - [2048, 32, 8, 512, 2048, 2048, 2048, 32]
    - [40, 5008.0]
  - - [2048, 32, 8, 1024, 2048, 2048, 2048, 32]
    - [13, 5272.0]
  - - [2048, 32, 8, 2048, 2048, 2048, 2048, 32]
    - [13, 5449.0]
  - - [2048, 64, 8, 32, 2048, 2048, 2048, 64]
    - [53, 2724.0]
  - - [2048, 64, 8, 64, 2048, 2048, 2048, 64]
    - [24, 3745.0]
  - - [2048, 64, 8, 128, 2048, 2048, 2048, 64]
    - [63, 4780.0]
  - - [2048, 64, 8, 256, 2048, 2048, 2048, 64]
    - [63, 5474.0]
  - - [2048, 64, 8, 512, 2048, 2048, 2048, 64]
    - [57, 5902.0]
  - - [2048, 64, 8, 1024, 2048, 2048, 2048, 64]
    - [57, 6106.0]
  - - [2048, 64, 8, 2048, 2048, 2048, 2048, 64]
    - [63, 6266.0]
  - - [2048, 128, 8, 32, 2048, 2048, 2048, 128]
    - [37, 3466.0]
  - - [2048, 128, 8, 64, 2048, 2048, 2048, 128]
    - [31, 4609.0]
  - - [2048, 128, 8, 128, 2048, 2048, 2048, 128]
    - [63, 5765.0]
  - - [2048, 128, 8, 256, 2048, 2048, 2048, 128]
    - [63, 6367.0]
  - - [2048, 128, 8, 512, 2048, 2048, 2048, 128]
    - [63, 6792.0]
  - - [2048, 128, 8, 1024, 2048, 2048, 2048, 128]
    - [63, 7027.0]
  - - [2048, 128, 8, 2048, 2048, 2048, 2048, 128]
    - [63, 7166.0]
  - - [2048, 256, 8, 32, 2048, 2048, 2048, 256]
    - [18, 3728.0]
  - - [2048, 256, 8, 64, 2048, 2048, 2048, 256]
    - [22, 5076.0]
  - - [2048, 256, 8, 128, 2048, 2048, 2048, 256]
    - [63, 6168.0]
  - - [2048, 256, 8, 256, 2048, 2048, 2048, 256]
    - [57, 6687.0]
  - - [2048, 256, 8, 512, 2048, 2048, 2048, 256]
    - [57, 7023.0]
  - - [2048, 256, 8, 1024, 2048, 2048, 2048, 256]
    - [63, 7211.0]
  - - [2048, 256, 8, 2048, 2048, 2048, 2048, 256]
    - [63, 7318.0]
  - - [2048, 512, 8, 32, 2048, 2048, 2048, 512]
    - [62, 3897.0]
  - - [2048, 512, 8, 64, 2048, 2048, 2048, 512]
    - [51, 5127.0]
  - - [2048, 512, 8, 128, 2048, 2048, 2048, 512]
    - [63, 6197.0]
  - - [2048, 512, 8, 256, 2048, 2048, 2048, 512]
    - [57, 6869.0]
  - - [2048, 512, 8, 512, 2048, 2048, 2048, 512]
    - [57, 7114.0]
  - - [2048, 512, 8, 1024, 2048, 2048, 2048, 512]
    - [58, 7229.0]
  - - [2048, 512, 8, 2048, 2048, 2048, 2048, 512]
    - [63, 7339.0]
  - - [2048, 1024, 8, 32, 2048, 2048, 2048, 1024]
    - [63, 3943.0]
  - - [2048, 1024, 8, 64, 2048, 2048, 2048, 1024]
    - [63, 5241.0]
  - - [2048, 1024, 8, 128, 2048, 2048, 2048, 1024]
    - [50, 6150.0]
  - - [2048, 1024, 8, 256, 2048, 2048, 2048, 1024]
    - [57, 7005.0]
  - - [2048, 1024, 8, 512, 2048, 2048, 2048, 1024]
    - [57, 7268.0]
  - - [2048, 1024, 8, 1024, 2048, 2048, 2048, 1024]
    - [60, 7459.0]
  - - [2048, 1024, 8, 2048, 2048, 2048, 2048, 1024]
    - [36, 7622.0]
  - - [2048, 2048, 8, 32, 2048, 2048, 2048, 2048]
    - [63, 4075.0]
  - - [2048, 2048, 8, 64, 2048, 2048, 2048, 2048]
    - [56, 5576.0]
  - - [2048, 2048, 8, 128, 2048, 2048, 2048, 2048]
    - [57, 6771.0]
  - - [2048, 2048, 8, 256, 2048, 2048, 2048, 2048]
    - [49, 7200.0]
  - - [2048, 2048, 8, 512, 2048, 2048, 2048, 2048]
    - [57, 7423.0]
  - - [2048, 2048, 8, 1024, 2048, 2048, 2048, 2048]
    - [63, 7524.0]
  - - [2048, 2048, 8, 2048, 2048, 2048, 2048, 2048]
    - [54, 7647.0]
- null
