library/src/blas3/Tensile/Logic/asm_full/arcturus/arcturus_Cijk_Alik_Bljk_BSS_BH.yaml
- {MinimumRequiredVersion: 4.24.0}
- arcturus
- gfx908
- [Device 7380, Device 7388, Device 738c, Device 7390]
    SolutionIndex: 0
    SolutionNameMin: Cijk_Alik_Bljk_BSS_BH_MT128x96x32_MI32x32x4x1_SE_1LDSB1_AF0EM1_GRVW2_GSU1_LBSPP128_LPA4_LPB4_PLR9_SU32_SUS256_SRVW4_TT1_96_WG128_2_1_WGM15
    SolutionIndex: 1
    SolutionNameMin: Cijk_Alik_Bljk_BSS_BH_MT64x256x32_MI32x32x4x1_SE_1LDSB1_AF0EM8_GRVW8_GSU1_LBSPP128_LPA8_LPB8_PLR9_SU0_SUS0_SRVW4_TT1_128_WG64_4_1_WGM1
    SolutionIndex: 2
    SolutionNameMin: Cijk_Alik_Bljk_BSS_BH_MT64x128x32_MI32x32x4x1_SE_1LDSB1_AF0EM1_GRVW8_GSU1_LBSPP128_LPA8_LPB8_PLR9_SU0_SUS0_SRVW4_TT1_64_WG64_4_1_WGM15
    SolutionIndex: 3
    SolutionNameMin: Cijk_Alik_Bljk_BSS_BH_MT64x64x64_MI32x32x4x1_SE_1LDSB1_AF0EM8_GRVW8_GSU1_LBSPP128_LPA8_LPB8_PLR17_SU0_SUS0_SRVW4_TT1_32_WG64_4_1_WGM15
    SolutionIndex: 4
    SolutionNameMin: Cijk_Alik_Bljk_BSS_BH_MT32x32x64_MI16x16x8x1_SE_1LDSB0_AF0EM8_GRVW8_GSU1_LBSPP128_LPA8_LPB8_PLR9_SU32_SUS256_SRVW4_TT1_16_WG32_8_1_WGM15
    SolutionIndex: 5
    SolutionNameMin: Cijk_Alik_Bljk_BSS_BH_MT32x32x64_MI16x16x8x1_SE_1LDSB1_AF0EM1_GRVW8_GSU1_LBSPP128_LPA8_LPB8_PLR9_SU0_SUS0_SRVW4_TT1_16_WG32_8_1_WGM15
    SolutionIndex: 6
    SolutionNameMin: Cijk_Alik_Bljk_BSS_BH_MT128x160x32_MI32x32x4x1_SE_1LDSB1_AF0EM8_GRVW2_GSU1_LBSPP128_LPA4_LPB4_PLR9_SU0_SUS0_SRVW4_TT1_160_WG128_2_1_WGM2
    SolutionIndex: 7
    SolutionNameMin: Cijk_Alik_Bljk_BSS_BH_MT128x96x32_MI32x32x4x1_SE_1LDSB1_AF0EM8_GRVW2_GSU1_LBSPP128_LPA4_LPB4_PLR9_SU0_SUS0_SRVW4_TT1_96_WG128_2_1_WGM2
    SolutionIndex: 8
    SolutionNameMin: Cijk_Alik_Bljk_BSS_BH_MT64x32x32_MI16x16x8x1_SE_1LDSB1_AF0EM1_GRVW4_GSU1_LBSPP128_LPA4_LPB4_PLR5_SU0_SUS0_SRVW4_TT2_16_WG32_8_1_WGM1
    SolutionIndex: 9
    SolutionNameMin: Cijk_Alik_Bljk_BSS_BH_MT64x32x64_MI16x16x8x1_SE_1LDSB1_AF0EM8_GRVW2_GSU1_LBSPP128_LPA4_LPB4_PLR9_SU0_SUS0_SRVW4_TT2_16_WG32_8_1_WGM1
    SolutionIndex: 10
    SolutionNameMin: Cijk_Alik_Bljk_BSS_BH_MT16x16x128_MI16x16x8x1_SE_1LDSB0_AF0EM8_GRVW8_GSU1_LBSPP256_LPA8_LPB8_PLR17_SU0_SUS0_SRVW0_TT1_16_WG16_4_1_WGM15
    SolutionIndex: 11
    SolutionNameMin: Cijk_Alik_Bljk_BSS_BH_MT16x16x128_MI16x16x8x1_SE_1LDSB1_AF0EM1_GRVW8_GSU1_LBSPP256_LPA8_LPB8_PLR17_SU0_SUS0_SRVW0_TT1_16_WG16_4_1_WGM15
    SolutionIndex: 12
    SolutionNameMin: Cijk_Alik_Bljk_BSS_BH_MT128x128x32_MI32x32x4x1_SE_1LDSB0_AF0EM8_GRVW8_GSU3_LBSPP128_LPA8_LPB8_PLR9_SU0_SUS0_SRVW0_TT2_64_WG64_4_1_WGM15
    SolutionIndex: 13
    SolutionNameMin: Cijk_Alik_Bljk_BSS_BH_MT64x64x64_MI32x32x4x1_SE_1LDSB1_AF0EM8_GRVW4_GSU1_LBSPP128_LPA4_LPB4_PLR17_SU32_SUS128_SRVW4_TT1_32_WG64_4_1_WGM2
    SolutionIndex: 14
    SolutionNameMin: Cijk_Alik_Bljk_BSS_BH_MT32x64x32_MI16x16x8x1_SE_1LDSB1_AF0EM8_GRVW2_GSU1_LBSPP128_LPA4_LPB4_PLR5_SU0_SUS0_SRVW4_TT1_32_WG32_8_1_WGM1
    SolutionIndex: 15
    SolutionNameMin: Cijk_Alik_Bljk_BSS_BH_MT64x128x32_MI32x32x4x1_SE_1LDSB1_AF0EM8_GRVW8_GSU1_LBSPP128_LPA8_LPB8_PLR9_SU0_SUS0_SRVW4_TT1_64_WG64_4_1_WGM2
    SolutionIndex: 16
    SolutionNameMin: Cijk_Alik_Bljk_BSS_BH_MT16x16x128_MI16x16x8x1_SE_1LDSB0_AF0EM1_GRVW8_GSU1_LBSPP256_LPA8_LPB8_PLR17_SU0_SUS0_SRVW0_TT1_16_WG16_4_1_WGM1
    SolutionIndex: 17
    SolutionNameMin: Cijk_Alik_Bljk_BSS_BH_MT32x32x64_MI16x16x8x1_SE_1LDSB1_AF0EM8_GRVW8_GSU1_LBSPP128_LPA8_LPB8_PLR9_SU0_SUS0_SRVW4_TT1_16_WG32_8_1_WGM15
    SolutionIndex: 18
    SolutionNameMin: Cijk_Alik_Bljk_BSS_BH_MT128x96x64_MI32x32x4x1_SE_1LDSB1_AF0EM8_GRVW2_GSU1_LBSPP128_LPA4_LPB4_PLR17_SU32_SUS128_SRVW4_TT1_96_WG128_2_1_WGM15
    SolutionIndex: 19
    SolutionNameMin: Cijk_Alik_Bljk_BSS_BH_MT64x128x32_MI32x32x4x1_SE_1LDSB1_AF0EM8_GRVW8_GSU1_LBSPP128_LPA8_LPB8_PLR9_SU32_SUS128_SRVW4_TT1_64_WG64_4_1_WGM2
    SolutionIndex: 20
    SolutionNameMin: Cijk_Alik_Bljk_BSS_BH_MT64x32x64_MI16x16x8x1_SE_1LDSB1_AF0EM8_GRVW4_GSU1_LBSPP128_LPA4_LPB4_PLR9_SU0_SUS0_SRVW4_TT2_16_WG32_8_1_WGM15
    SolutionIndex: 21
    SolutionNameMin: Cijk_Alik_Bljk_BSS_BH_MT64x64x64_MI32x32x4x1_SE_1LDSB1_AF0EM8_GRVW4_GSU1_LBSPP128_LPA4_LPB4_PLR17_SU0_SUS0_SRVW4_TT1_32_WG64_4_1_WGM15
    SolutionIndex: 22
    SolutionNameMin: Cijk_Alik_Bljk_BSS_BH_MT96x96x64_MI16x16x8x1_SE_1LDSB1_AF0EM8_GRVW2_GSU1_LBSPP128_LPA4_LPB4_PLR9_SU0_SUS0_SRVW0_TT3_48_WG32_8_1_WGM15
    SolutionIndex: 23
    SolutionNameMin: Cijk_Alik_Bljk_BSS_BH_MT128x96x32_MI32x32x4x1_SE_1LDSB1_AF0EM8_GRVW4_GSU1_LBSPP128_LPA4_LPB4_PLR9_SU32_SUS256_SRVW4_TT1_96_WG128_2_1_WGM2
    SolutionIndex: 24
    SolutionNameMin: Cijk_Alik_Bljk_BSS_BH_MT64x64x64_MI32x32x4x1_SE_1LDSB1_AF0EM8_GRVW8_GSU1_LBSPP128_LPA8_LPB8_PLR17_SU32_SUS128_SRVW4_TT1_32_WG64_4_1_WGM15
    SolutionIndex: 25
    SolutionNameMin: Cijk_Alik_Bljk_BSS_BH_MT128x144x64_MI16x16x8x1_SE_1LDSB1_AF0EM8_GRVW2_GSU1_LBSPP128_LPA4_LPB4_PLR9_SU0_SUS0_SRVW4_TT2_144_WG64_4_1_WGM15
    SolutionIndex: 26
    SolutionNameMin: Cijk_Alik_Bljk_BSS_BH_MT64x32x64_MI16x16x8x1_SE_1LDSB1_AF0EM8_GRVW8_GSU1_LBSPP128_LPA8_LPB8_PLR9_SU0_SUS0_SRVW4_TT2_16_WG32_8_1_WGM1
    SolutionIndex: 27
    SolutionNameMin: Cijk_Alik_Bljk_BSS_BH_MT96x96x64_MI16x16x8x1_SE_1LDSB1_AF0EM8_GRVW2_GSU1_LBSPP128_LPA4_LPB4_PLR9_SU0_SUS0_SRVW0_TT3_48_WG32_8_1_WGM2
    SolutionIndex: 28
    SolutionNameMin: Cijk_Alik_Bljk_BSS_BH_MT64x128x32_MI32x32x4x1_SE_1LDSB1_AF0EM8_GRVW8_GSU1_LBSPP128_LPA8_LPB8_PLR9_SU32_SUS128_SRVW4_TT1_64_WG64_4_1_WGM15
    SolutionIndex: 29
    SolutionNameMin: Cijk_Alik_Bljk_BSS_BH_MT64x32x64_MI16x16x8x1_SE_1LDSB1_AF0EM1_GRVW8_GSU1_LBSPP128_LPA8_LPB8_PLR9_SU0_SUS0_SRVW4_TT2_16_WG32_8_1_WGM2
    SolutionIndex: 30
    SolutionNameMin: Cijk_Alik_Bljk_BSS_BH_MT16x16x128_MI16x16x8x1_SE_1LDSB0_AF0EM8_GRVW8_GSU1_LBSPP256_LPA8_LPB8_PLR17_SU0_SUS0_SRVW0_TT1_16_WG16_4_1_WGM1
    SolutionIndex: 31
    SolutionNameMin: Cijk_Alik_Bljk_BSS_BH_MT64x64x64_MI32x32x4x1_SE_1LDSB0_AF0EM8_GRVW8_GSU1_LBSPP128_LPA8_LPB8_PLR17_SU32_SUS256_SRVW4_TT1_32_WG64_4_1_WGM15
    SolutionIndex: 32
    SolutionNameMin: Cijk_Alik_Bljk_BSS_BH_MT64x128x32_MI32x32x4x1_SE_1LDSB1_AF0EM8_GRVW8_GSU1_LBSPP128_LPA8_LPB8_PLR9_SU32_SUS128_SRVW4_TT1_64_WG64_4_1_WGM1
    SolutionIndex: 33
    SolutionNameMin: Cijk_Alik_Bljk_BSS_BH_MT128x96x64_MI32x32x4x1_SE_1LDSB1_AF0EM8_GRVW2_GSU1_LBSPP128_LPA4_LPB4_PLR17_SU0_SUS0_SRVW4_TT1_96_WG128_2_1_WGM2
    SolutionIndex: 34
    SolutionNameMin: Cijk_Alik_Bljk_BSS_BH_MT16x16x128_MI16x16x8x1_SE_1LDSB0_AF0EM8_GRVW8_GSU1_LBSPP256_LPA8_LPB8_PLR17_SU32_SUS256_SRVW0_TT1_16_WG16_4_1_WGM1
    SolutionIndex: 35
    SolutionNameMin: Cijk_Alik_Bljk_BSS_BH_MT64x32x64_MI16x16x8x1_SE_1LDSB0_AF0EM8_GRVW8_GSU1_LBSPP128_LPA8_LPB8_PLR9_SU0_SUS0_SRVW4_TT2_16_WG32_8_1_WGM15
    SolutionIndex: 36
    SolutionNameMin: Cijk_Alik_Bljk_BSS_BH_MT16x16x64_MI16x16x8x1_SE_1LDSB1_AF0EM1_GRVW8_GSU1_LBSPP128_LPA8_LPB8_PLR9_SU0_SUS0_SRVW4_TT1_16_WG16_4_1_WGM15
    SolutionIndex: 37
    SolutionNameMin: Cijk_Alik_Bljk_BSS_BH_MT128x96x32_MI32x32x4x1_SE_1LDSB1_AF0EM8_GRVW2_GSU1_LBSPP128_LPA4_LPB4_PLR9_SU32_SUS256_SRVW4_TT1_96_WG128_2_1_WGM1
    SolutionIndex: 38
    SolutionNameMin: Cijk_Alik_Bljk_BSS_BH_MT32x32x64_MI16x16x8x1_SE_1LDSB0_AF0EM8_GRVW8_GSU1_LBSPP128_LPA8_LPB8_PLR9_SU0_SUS0_SRVW4_TT1_16_WG32_8_1_WGM15
    SolutionIndex: 39
    SolutionNameMin: Cijk_Alik_Bljk_BSS_BH_MT128x96x64_MI32x32x4x1_SE_1LDSB1_AF0EM1_GRVW2_GSU1_LBSPP128_LPA4_LPB4_PLR17_SU0_SUS0_SRVW4_TT1_96_WG128_2_1_WGM15
    SolutionIndex: 40
    SolutionNameMin: Cijk_Alik_Bljk_BSS_BH_MT128x96x32_MI32x32x4x1_SE_1LDSB1_AF0EM8_GRVW4_GSU1_LBSPP128_LPA4_LPB4_PLR9_SU0_SUS0_SRVW4_TT1_96_WG128_2_1_WGM1
    SolutionIndex: 41
    SolutionNameMin: Cijk_Alik_Bljk_BSS_BH_MT128x96x64_MI32x32x4x1_SE_1LDSB1_AF0EM8_GRVW8_GSU1_LBSPP128_LPA8_LPB8_PLR17_SU32_SUS128_SRVW4_TT1_96_WG128_2_1_WGM2
    SolutionIndex: 42
    SolutionNameMin: Cijk_Alik_Bljk_BSS_BH_MT64x32x32_MI16x16x8x1_SE_1LDSB1_AF0EM1_GRVW2_GSU1_LBSPP128_LPA4_LPB4_PLR5_SU0_SUS0_SRVW4_TT2_16_WG32_8_1_WGM1
    SolutionIndex: 43
    SolutionNameMin: Cijk_Alik_Bljk_BSS_BH_MT128x160x32_MI32x32x4x1_SE_1LDSB1_AF0EM8_GRVW4_GSU1_LBSPP128_LPA4_LPB4_PLR9_SU0_SUS0_SRVW4_TT1_160_WG128_2_1_WGM15
    SolutionIndex: 44
    SolutionNameMin: Cijk_Alik_Bljk_BSS_BH_MT16x16x64_MI16x16x8x1_SE_1LDSB1_AF0EM1_GRVW8_GSU1_LBSPP128_LPA8_LPB8_PLR9_SU0_SUS0_SRVW0_TT1_16_WG16_4_1_WGM1
    SolutionIndex: 45
    SolutionNameMin: Cijk_Alik_Bljk_BSS_BH_MT128x160x32_MI32x32x4x1_SE_1LDSB1_AF0EM8_GRVW2_GSU1_LBSPP128_LPA4_LPB4_PLR9_SU0_SUS0_SRVW4_TT1_160_WG128_2_1_WGM1
    SolutionIndex: 46
    SolutionNameMin: Cijk_Alik_Bljk_BSS_BH_MT64x64x64_MI32x32x4x1_SE_1LDSB1_AF0EM8_GRVW8_GSU1_LBSPP128_LPA8_LPB8_PLR17_SU0_SUS0_SRVW4_TT1_32_WG64_4_1_WGM2
    SolutionIndex: 47
    SolutionNameMin: Cijk_Alik_Bljk_BSS_BH_MT128x160x32_MI32x32x4x1_SE_1LDSB1_AF0EM8_GRVW2_GSU1_LBSPP128_LPA4_LPB4_PLR9_SU0_SUS0_SRVW4_TT1_160_WG128_2_1_WGM15
    SolutionIndex: 48
    SolutionNameMin: Cijk_Alik_Bljk_BSS_BH_MT128x160x32_MI32x32x4x1_SE_1LDSB1_AF0EM1_GRVW2_GSU1_LBSPP128_LPA4_LPB4_PLR9_SU0_SUS0_SRVW4_TT1_160_WG128_2_1_WGM1
    SolutionIndex: 49
    SolutionNameMin: Cijk_Alik_Bljk_BSS_BH_MT128x160x32_MI32x32x4x1_SE_1LDSB1_AF0EM8_GRVW2_GSU1_LBSPP128_LPA4_LPB4_PLR9_SU32_SUS128_SRVW4_TT1_160_WG128_2_1_WGM15
    SolutionIndex: 50
    SolutionNameMin: Cijk_Alik_Bljk_BSS_BH_MT128x96x64_MI32x32x4x1_SE_1LDSB1_AF0EM8_GRVW2_GSU1_LBSPP128_LPA4_LPB4_PLR17_SU0_SUS0_SRVW4_TT1_96_WG128_2_1_WGM15
    SolutionIndex: 51
    SolutionNameMin: Cijk_Alik_Bljk_BSS_BH_MT64x128x32_MI32x32x4x1_SE_1LDSB1_AF0EM8_GRVW8_GSU1_LBSPP128_LPA8_LPB8_PLR9_SU0_SUS0_SRVW4_TT1_64_WG64_4_1_WGM15
    SolutionIndex: 52
    SolutionNameMin: Cijk_Alik_Bljk_BSS_BH_MT128x128x64_MI32x32x4x1_SE_1LDSB1_AF0EM8_GRVW2_GSU1_LBSPP128_LPA4_LPB4_PLR17_SU0_SUS0_SRVW4_TT2_64_WG64_4_1_WGM15
    SolutionIndex: 53
    SolutionNameMin: Cijk_Alik_Bljk_BSS_BH_MT128x160x32_MI32x32x4x1_SE_1LDSB1_AF0EM1_GRVW2_GSU1_LBSPP128_LPA4_LPB4_PLR9_SU0_SUS0_SRVW4_TT1_160_WG128_2_1_WGM15
    SolutionIndex: 54
    SolutionNameMin: Cijk_Alik_Bljk_BSS_BH_MT128x96x32_MI32x32x4x1_SE_1LDSB1_AF0EM8_GRVW2_GSU1_LBSPP128_LPA4_LPB4_PLR9_SU32_SUS128_SRVW4_TT1_96_WG128_2_1_WGM1
    SolutionIndex: 55
    SolutionNameMin: Cijk_Alik_Bljk_BSS_BH_MT128x160x32_MI32x32x4x1_SE_1LDSB1_AF0EM1_GRVW2_GSU1_LBSPP128_LPA4_LPB4_PLR9_SU32_SUS128_SRVW4_TT1_160_WG128_2_1_WGM15
    SolutionIndex: 56
    SolutionNameMin: Cijk_Alik_Bljk_BSS_BH_MT32x32x64_MI16x16x8x1_SE_1LDSB1_AF0EM8_GRVW8_GSU1_LBSPP128_LPA8_LPB8_PLR9_SU0_SUS0_SRVW4_TT1_16_WG32_8_1_WGM2
    SolutionIndex: 57
    SolutionNameMin: Cijk_Alik_Bljk_BSS_BH_MT32x32x64_MI16x16x8x1_SE_1LDSB1_AF0EM8_GRVW4_GSU1_LBSPP128_LPA4_LPB4_PLR9_SU0_SUS0_SRVW4_TT1_16_WG32_8_1_WGM1
    SolutionIndex: 58
    SolutionNameMin: Cijk_Alik_Bljk_BSS_BH_MT32x32x64_MI16x16x8x1_SE_1LDSB1_AF0EM8_GRVW2_GSU1_LBSPP128_LPA4_LPB4_PLR9_SU0_SUS0_SRVW4_TT1_16_WG32_8_1_WGM2
    SolutionIndex: 59
    SolutionNameMin: Cijk_Alik_Bljk_BSS_BH_MT16x16x128_MI16x16x8x1_SE_1LDSB1_AF0EM1_GRVW8_GSU1_LBSPP256_LPA8_LPB8_PLR17_SU0_SUS0_SRVW0_TT1_16_WG16_4_1_WGM1
    SolutionIndex: 60
    SolutionNameMin: Cijk_Alik_Bljk_BSS_BH_MT16x16x64_MI16x16x8x1_SE_1LDSB1_AF0EM8_GRVW8_GSU1_LBSPP128_LPA8_LPB8_PLR9_SU0_SUS0_SRVW0_TT1_16_WG16_4_1_WGM1
    SolutionIndex: 61
    SolutionNameMin: Cijk_Alik_Bljk_BSS_BH_MT16x16x64_MI16x16x8x1_SE_1LDSB1_AF0EM1_GRVW4_GSU1_LBSPP128_LPA4_LPB4_PLR9_SU0_SUS0_SRVW0_TT1_16_WG16_4_1_WGM1
    SolutionIndex: 62
    SolutionNameMin: Cijk_Alik_Bljk_BSS_BH_MT16x16x128_MI16x16x8x1_SE_1LDSB1_AF0EM1_GRVW8_GSU1_LBSPP256_LPA8_LPB8_PLR17_SU0_SUS0_SRVW0_TT1_16_WG16_4_1_WGM2
    SolutionIndex: 63
    SolutionNameMin: Cijk_Alik_Bljk_BSS_BH_MT32x64x64_MI16x16x8x1_SE_1LDSB1_AF0EM8_GRVW8_GSU1_LBSPP128_LPA8_LPB8_PLR9_SU0_SUS0_SRVW4_TT1_32_WG32_8_1_WGM15
    SolutionIndex: 64
    SolutionNameMin: Cijk_Alik_Bljk_BSS_BH_MT32x64x32_MI16x16x8x1_SE_1LDSB1_AF0EM8_GRVW2_GSU1_LBSPP128_LPA4_LPB4_PLR5_SU0_SUS0_SRVW4_TT1_32_WG32_8_1_WGM15
    SolutionIndex: 65
    SolutionNameMin: Cijk_Alik_Bljk_BSS_BH_MT32x32x64_MI16x16x8x1_SE_1LDSB1_AF0EM8_GRVW8_GSU7_LBSPP128_LPA8_LPB8_PLR9_SU0_SUS0_SRVW0_TT1_16_WG32_8_1_WGM2
    SolutionIndex: 66
    SolutionNameMin: Cijk_Alik_Bljk_BSS_BH_MT64x64x64_MI32x32x4x1_SE_1LDSB1_AF0EM1_GRVW8_GSU1_LBSPP128_LPA8_LPB8_PLR17_SU0_SUS0_SRVW4_TT1_32_WG64_4_1_WGM1
    SolutionIndex: 67
    SolutionNameMin: Cijk_Alik_Bljk_BSS_BH_MT64x32x64_MI16x16x8x1_SE_1LDSB1_AF0EM8_GRVW8_GSU1_LBSPP128_LPA8_LPB8_PLR9_SU0_SUS0_SRVW4_TT2_16_WG32_8_1_WGM15
    SolutionIndex: 68
    SolutionNameMin: Cijk_Alik_Bljk_BSS_BH_MT64x128x64_MI32x32x4x1_SE_1LDSB1_AF0EM8_GRVW8_GSU1_LBSPP128_LPA8_LPB8_PLR17_SU0_SUS0_SRVW4_TT1_64_WG64_4_1_WGM15
    SolutionIndex: 69
    SolutionNameMin: Cijk_Alik_Bljk_BSS_BH_MT128x96x64_MI32x32x4x1_SE_1LDSB1_AF0EM8_GRVW2_GSU1_LBSPP128_LPA4_LPB4_PLR17_SU32_SUS128_SRVW4_TT1_96_WG128_2_1_WGM2
    SolutionIndex: 70
    SolutionNameMin: Cijk_Alik_Bljk_BSS_BH_MT128x96x32_MI32x32x4x1_SE_1LDSB1_AF0EM8_GRVW4_GSU1_LBSPP128_LPA4_LPB4_PLR9_SU0_SUS0_SRVW4_TT1_96_WG128_2_1_WGM15
    SolutionIndex: 71
    SolutionNameMin: Cijk_Alik_Bljk_BSS_BH_MT32x32x64_MI16x16x8x1_SE_1LDSB0_AF0EM8_GRVW8_GSU7_LBSPP128_LPA8_LPB8_PLR9_SU0_SUS0_SRVW0_TT1_16_WG32_8_1_WGM2
    SolutionIndex: 72
    SolutionNameMin: Cijk_Alik_Bljk_BSS_BH_MT128x96x64_MI32x32x4x1_SE_1LDSB1_AF0EM8_GRVW8_GSU1_LBSPP128_LPA8_LPB8_PLR17_SU32_SUS128_SRVW4_TT1_96_WG128_2_1_WGM15
    SolutionIndex: 73
    SolutionNameMin: Cijk_Alik_Bljk_BSS_BH_MT96x96x64_MI16x16x8x1_SE_1LDSB1_AF0EM8_GRVW8_GSU1_LBSPP128_LPA8_LPB8_PLR9_SU0_SUS0_SRVW0_TT3_48_WG32_8_1_WGM1
    SolutionIndex: 74
    SolutionNameMin: Cijk_Alik_Bljk_BSS_BH_MT64x32x64_MI16x16x8x1_SE_1LDSB0_AF0EM8_GRVW4_GSU1_LBSPP128_LPA4_LPB4_PLR9_SU0_SUS0_SRVW4_TT2_16_WG32_8_1_WGM15
    SolutionIndex: 75
    SolutionNameMin: Cijk_Alik_Bljk_BSS_BH_MT32x64x32_MI16x16x8x1_SE_1LDSB1_AF0EM8_GRVW8_GSU1_LBSPP128_LPA8_LPB8_PLR5_SU0_SUS0_SRVW4_TT1_32_WG32_8_1_WGM15
    SolutionIndex: 76
    SolutionNameMin: Cijk_Alik_Bljk_BSS_BH_MT96x96x32_MI16x16x8x1_SE_1LDSB0_AF0EM8_GRVW4_GSU1_LBSPP128_LPA4_LPB4_PLR5_SU0_SUS0_SRVW0_TT3_48_WG32_8_1_WGM1
    SolutionIndex: 77
    SolutionNameMin: Cijk_Alik_Bljk_BSS_BH_MT96x96x32_MI16x16x8x1_SE_1LDSB1_AF0EM8_GRVW4_GSU1_LBSPP128_LPA4_LPB4_PLR5_SU0_SUS0_SRVW0_TT3_48_WG32_8_1_WGM1
    SolutionIndex: 78
    SolutionNameMin: Cijk_Alik_Bljk_BSS_BH_MT64x128x64_MI32x32x4x1_SE_1LDSB1_AF0EM8_GRVW8_GSU1_LBSPP128_LPA8_LPB8_PLR17_SU32_SUS256_SRVW4_TT1_64_WG64_4_1_WGM2
    SolutionIndex: 79
    SolutionNameMin: Cijk_Alik_Bljk_BSS_BH_MT128x96x64_MI32x32x4x1_SE_1LDSB1_AF0EM8_GRVW8_GSU1_LBSPP128_LPA8_LPB8_PLR17_SU32_SUS128_SRVW4_TT1_96_WG128_2_1_WGM1
    SolutionIndex: 80
    SolutionNameMin: Cijk_Alik_Bljk_BSS_BH_MT96x96x64_MI16x16x8x1_SE_1LDSB1_AF0EM8_GRVW8_GSU1_LBSPP128_LPA8_LPB8_PLR9_SU0_SUS0_SRVW0_TT3_48_WG32_8_1_WGM15
    SolutionIndex: 81
    SolutionNameMin: Cijk_Alik_Bljk_BSS_BH_MT128x96x64_MI32x32x4x1_SE_1LDSB1_AF0EM8_GRVW8_GSU1_LBSPP128_LPA8_LPB8_PLR17_SU0_SUS0_SRVW4_TT1_96_WG128_2_1_WGM2
    SolutionIndex: 82
    SolutionNameMin: Cijk_Alik_Bljk_BSS_BH_MT128x96x32_MI32x32x4x1_SE_1LDSB1_AF0EM8_GRVW2_GSU1_LBSPP128_LPA4_LPB4_PLR9_SU0_SUS0_SRVW4_TT1_96_WG128_2_1_WGM1
    SolutionIndex: 83
    SolutionNameMin: Cijk_Alik_Bljk_BSS_BH_MT16x16x128_MI16x16x8x1_SE_1LDSB1_AF0EM8_GRVW8_GSU1_LBSPP256_LPA8_LPB8_PLR17_SU32_SUS256_SRVW0_TT1_16_WG16_4_1_WGM1
    SolutionIndex: 84
    SolutionNameMin: Cijk_Alik_Bljk_BSS_BH_MT64x128x64_MI32x32x4x1_SE_1LDSB1_AF0EM1_GRVW8_GSU1_LBSPP128_LPA8_LPB8_PLR17_SU0_SUS0_SRVW4_TT1_64_WG64_4_1_WGM1
    SolutionIndex: 85
    SolutionNameMin: Cijk_Alik_Bljk_BSS_BH_MT64x64x64_MI32x32x4x1_SE_1LDSB1_AF0EM8_GRVW8_GSU1_LBSPP128_LPA8_LPB8_PLR17_SU32_SUS256_SRVW4_TT1_32_WG64_4_1_WGM2
    SolutionIndex: 86
    SolutionNameMin: Cijk_Alik_Bljk_BSS_BH_MT16x16x128_MI16x16x8x1_SE_1LDSB0_AF0EM1_GRVW8_GSU1_LBSPP256_LPA8_LPB8_PLR17_SU0_SUS0_SRVW0_TT1_16_WG16_4_1_WGM2
    SolutionIndex: 87
    SolutionNameMin: Cijk_Alik_Bljk_BSS_BH_MT64x64x64_MI32x32x4x1_SE_1LDSB1_AF0EM8_GRVW8_GSU1_LBSPP128_LPA8_LPB8_PLR17_SU32_SUS128_SRVW4_TT1_32_WG64_4_1_WGM1
    SolutionIndex: 88
    SolutionNameMin: Cijk_Alik_Bljk_BSS_BH_MT64x128x64_MI32x32x4x1_SE_1LDSB1_AF0EM8_GRVW8_GSU1_LBSPP128_LPA8_LPB8_PLR17_SU32_SUS128_SRVW4_TT1_64_WG64_4_1_WGM2
    SolutionIndex: 89
    SolutionNameMin: Cijk_Alik_Bljk_BSS_BH_MT64x128x64_MI32x32x4x1_SE_1LDSB1_AF0EM8_GRVW8_GSU1_LBSPP128_LPA8_LPB8_PLR17_SU32_SUS128_SRVW4_TT1_64_WG64_4_1_WGM15
    SolutionIndex: 90
    SolutionNameMin: Cijk_Alik_Bljk_BSS_BH_MT64x32x64_MI16x16x8x1_SE_1LDSB1_AF0EM8_GRVW4_GSU1_LBSPP128_LPA4_LPB4_PLR9_SU0_SUS0_SRVW4_TT2_16_WG32_8_1_WGM1
    SolutionIndex: 91
    SolutionNameMin: Cijk_Alik_Bljk_BSS_BH_MT64x64x64_MI32x32x4x1_SE_1LDSB1_AF0EM8_GRVW8_GSU1_LBSPP128_LPA8_LPB8_PLR17_SU32_SUS256_SRVW4_TT1_32_WG64_4_1_WGM15
    SolutionIndex: 92
    SolutionNameMin: Cijk_Alik_Bljk_BSS_BH_MT64x64x32_MI32x32x4x1_SE_1LDSB1_AF0EM8_GRVW8_GSU1_LBSPP128_LPA8_LPB8_PLR9_SU32_SUS256_SRVW4_TT1_32_WG64_4_1_WGM15
    SolutionIndex: 93
    SolutionNameMin: Cijk_Alik_Bljk_BSS_BH_MT32x32x64_MI16x16x8x1_SE_1LDSB1_AF0EM8_GRVW8_GSU1_LBSPP128_LPA8_LPB8_PLR9_SU0_SUS0_SRVW4_TT1_16_WG32_8_1_WGM1
    SolutionIndex: 94
    SolutionNameMin: Cijk_Alik_Bljk_BSS_BH_MT16x16x128_MI16x16x8x1_SE_1LDSB1_AF0EM8_GRVW8_GSU1_LBSPP256_LPA8_LPB8_PLR17_SU0_SUS0_SRVW0_TT1_16_WG16_4_1_WGM1
    SolutionIndex: 95
    SolutionNameMin: Cijk_Alik_Bljk_BSS_BH_MT16x16x64_MI16x16x8x1_SE_1LDSB1_AF0EM1_GRVW8_GSU1_LBSPP128_LPA8_LPB8_PLR9_SU0_SUS0_SRVW0_TT1_16_WG16_4_1_WGM15
    SolutionIndex: 96
    SolutionNameMin: Cijk_Alik_Bljk_BSS_BH_MT64x128x64_MI32x32x4x1_SE_1LDSB1_AF0EM8_GRVW8_GSU1_LBSPP128_LPA8_LPB8_PLR17_SU0_SUS0_SRVW4_TT1_64_WG64_4_1_WGM1
    SolutionIndex: 97
    SolutionNameMin: Cijk_Alik_Bljk_BSS_BH_MT32x32x32_MI16x16x8x1_SE_1LDSB0_AF0EM8_GRVW4_GSU1_LBSPP128_LPA4_LPB4_PLR5_SU0_SUS0_SRVW4_TT1_16_WG32_8_1_WGM15
    SolutionIndex: 98
    SolutionNameMin: Cijk_Alik_Bljk_BSS_BH_MT64x128x64_MI32x32x4x1_SE_1LDSB1_AF0EM8_GRVW8_GSU1_LBSPP128_LPA8_LPB8_PLR17_SU0_SUS0_SRVW4_TT1_64_WG64_4_1_WGM2
    SolutionIndex: 99
    SolutionNameMin: Cijk_Alik_Bljk_BSS_BH_MT32x32x64_MI16x16x8x1_SE_1LDSB1_AF0EM8_GRVW8_GSU1_LBSPP128_LPA8_LPB8_PLR9_SU32_SUS128_SRVW4_TT1_16_WG32_8_1_WGM2
    SolutionIndex: 100
    SolutionNameMin: Cijk_Alik_Bljk_BSS_BH_MT32x32x32_MI16x16x8x1_SE_1LDSB0_AF0EM8_GRVW8_GSU1_LBSPP128_LPA8_LPB8_PLR5_SU0_SUS0_SRVW4_TT1_16_WG32_8_1_WGM15
    SolutionIndex: 101
    SolutionNameMin: Cijk_Alik_Bljk_BSS_BH_MT32x64x32_MI16x16x8x1_SE_1LDSB0_AF0EM8_GRVW4_GSU1_LBSPP128_LPA4_LPB4_PLR5_SU0_SUS0_SRVW4_TT1_32_WG32_8_1_WGM15
    SolutionIndex: 102
    SolutionNameMin: Cijk_Alik_Bljk_BSS_BH_MT32x32x32_MI16x16x8x1_SE_1LDSB0_AF0EM8_GRVW4_GSU1_LBSPP128_LPA4_LPB4_PLR5_SU0_SUS0_SRVW4_TT1_16_WG32_8_1_WGM2
    SolutionIndex: 103
    SolutionNameMin: Cijk_Alik_Bljk_BSS_BH_MT128x64x64_MI32x32x4x1_SE_1LDSB0_AF0EM8_GRVW8_GSU1_LBSPP128_LPA8_LPB8_PLR17_SU0_SUS0_SRVW4_TT2_32_WG64_4_1_WGM15
    SolutionIndex: 104
    SolutionNameMin: Cijk_Alik_Bljk_BSS_BH_MT128x64x64_MI32x32x4x1_SE_1LDSB1_AF0EM8_GRVW8_GSU2_LBSPP128_LPA8_LPB8_PLR17_SU0_SUS0_SRVW0_TT2_32_WG64_4_1_WGM1
    SolutionIndex: 105
    SolutionNameMin: Cijk_Alik_Bljk_BSS_BH_MT128x64x64_MI32x32x4x1_SE_1LDSB1_AF0EM8_GRVW2_GSU7_LBSPP128_LPA4_LPB4_PLR17_SU0_SUS0_SRVW0_TT2_32_WG64_4_1_WGM15
    SolutionIndex: 106
    SolutionNameMin: Cijk_Alik_Bljk_BSS_BH_MT128x64x64_MI32x32x4x1_SE_1LDSB1_AF0EM8_GRVW8_GSU3_LBSPP128_LPA8_LPB8_PLR17_SU0_SUS0_SRVW0_TT2_32_WG64_4_1_WGM15
    SolutionIndex: 107
    SolutionNameMin: Cijk_Alik_Bljk_BSS_BH_MT64x128x32_MI32x32x4x1_SE_1LDSB1_AF0EM8_GRVW2_GSU1_LBSPP128_LPA4_LPB4_PLR9_SU0_SUS0_SRVW4_TT1_64_WG64_4_1_WGM1
    SolutionIndex: 108
    SolutionNameMin: Cijk_Alik_Bljk_BSS_BH_MT128x128x64_MI32x32x4x1_SE_1LDSB1_AF0EM8_GRVW2_GSU3_LBSPP128_LPA4_LPB4_PLR17_SU0_SUS0_SRVW0_TT2_64_WG64_4_1_WGM1
    SolutionIndex: 109
    SolutionNameMin: Cijk_Alik_Bljk_BSS_BH_MT128x64x64_MI32x32x4x1_SE_1LDSB1_AF0EM8_GRVW2_GSU2_LBSPP128_LPA4_LPB4_PLR17_SU32_SUS128_SRVW0_TT2_32_WG64_4_1_WGM1
    SolutionIndex: 110
    SolutionNameMin: Cijk_Alik_Bljk_BSS_BH_MT64x128x64_MI32x32x4x1_SE_1LDSB1_AF0EM8_GRVW2_GSU1_LBSPP128_LPA4_LPB4_PLR17_SU0_SUS0_SRVW4_TT1_64_WG64_4_1_WGM15
    SolutionIndex: 111
    SolutionNameMin: Cijk_Alik_Bljk_BSS_BH_MT64x32x64_MI16x16x8x1_SE_1LDSB0_AF0EM8_GRVW2_GSU3_LBSPP128_LPA4_LPB4_PLR9_SU0_SUS0_SRVW0_TT2_16_WG32_8_1_WGM1
    SolutionIndex: 112
    SolutionNameMin: Cijk_Alik_Bljk_BSS_BH_MT64x32x64_MI16x16x8x1_SE_1LDSB1_AF0EM8_GRVW2_GSU2_LBSPP128_LPA4_LPB4_PLR9_SU32_SUS256_SRVW0_TT2_16_WG32_8_1_WGM2
    SolutionIndex: 113
    SolutionNameMin: Cijk_Alik_Bljk_BSS_BH_MT64x32x64_MI16x16x8x1_SE_1LDSB0_AF0EM8_GRVW2_GSU5_LBSPP128_LPA4_LPB4_PLR9_SU0_SUS0_SRVW0_TT2_16_WG32_8_1_WGM2
    SolutionIndex: 114
    SolutionNameMin: Cijk_Alik_Bljk_BSS_BH_MT64x128x64_MI32x32x4x1_SE_1LDSB1_AF0EM8_GRVW8_GSU1_LBSPP128_LPA8_LPB8_PLR17_SU32_SUS256_SRVW4_TT1_64_WG64_4_1_WGM15
    SolutionIndex: 115
    SolutionNameMin: Cijk_Alik_Bljk_BSS_BH_MT64x64x64_MI32x32x4x1_SE_1LDSB1_AF0EM8_GRVW4_GSU1_LBSPP128_LPA4_LPB4_PLR17_SU32_SUS128_SRVW4_TT1_32_WG64_4_1_WGM15
    SolutionIndex: 116
    SolutionNameMin: Cijk_Alik_Bljk_BSS_BH_MT160x128x32_MI32x32x4x1_SE_1LDSB1_AF0EM8_GRVW2_GSU1_LBSPP128_LPA4_LPB4_PLR9_SU32_SUS128_SRVW0_TT5_32_WG32_8_1_WGM2
    SolutionIndex: 117
    SolutionNameMin: Cijk_Alik_Bljk_BSS_BH_MT96x128x64_MI32x32x4x1_SE_1LDSB1_AF0EM8_GRVW2_GSU1_LBSPP128_LPA4_LPB4_PLR17_SU0_SUS0_SRVW0_TT3_32_WG32_8_1_WGM15
    SolutionIndex: 118
    SolutionNameMin: Cijk_Alik_Bljk_BSS_BH_MT128x96x32_MI32x32x4x1_SE_1LDSB1_AF0EM1_GRVW2_GSU1_LBSPP128_LPA4_LPB4_PLR9_SU32_SUS128_SRVW4_TT1_96_WG128_2_1_WGM1
    SolutionIndex: 119
    SolutionNameMin: Cijk_Alik_Bljk_BSS_BH_MT64x128x64_MI32x32x4x1_SE_1LDSB1_AF0EM1_GRVW8_GSU1_LBSPP128_LPA8_LPB8_PLR17_SU32_SUS128_SRVW4_TT1_64_WG64_4_1_WGM1
    SolutionIndex: 120
    SolutionNameMin: Cijk_Alik_Bljk_BSS_BH_MT128x96x64_MI32x32x4x1_SE_1LDSB1_AF0EM1_GRVW2_GSU1_LBSPP128_LPA4_LPB4_PLR17_SU32_SUS256_SRVW4_TT1_96_WG128_2_1_WGM15
    SolutionIndex: 121
    SolutionNameMin: Cijk_Alik_Bljk_BSS_BH_MT32x32x64_MI16x16x8x1_SE_1LDSB1_AF0EM1_GRVW4_GSU1_LBSPP128_LPA4_LPB4_PLR9_SU0_SUS0_SRVW4_TT1_16_WG32_8_1_WGM1
    SolutionIndex: 122
    SolutionNameMin: Cijk_Alik_Bljk_BSS_BH_MT32x32x64_MI16x16x8x1_SE_1LDSB1_AF0EM1_GRVW2_GSU1_LBSPP128_LPA4_LPB4_PLR9_SU0_SUS0_SRVW4_TT1_16_WG32_8_1_WGM15
    SolutionIndex: 123
    SolutionNameMin: Cijk_Alik_Bljk_BSS_BH_MT32x32x64_MI16x16x8x1_SE_1LDSB1_AF0EM1_GRVW2_GSU1_LBSPP128_LPA4_LPB4_PLR9_SU0_SUS0_SRVW4_TT1_16_WG32_8_1_WGM2
    SolutionIndex: 124
    SolutionNameMin: Cijk_Alik_Bljk_BSS_BH_MT16x16x64_MI16x16x8x1_SE_1LDSB0_AF0EM1_GRVW8_GSU1_LBSPP128_LPA8_LPB8_PLR9_SU0_SUS0_SRVW0_TT1_16_WG16_4_1_WGM1
    SolutionIndex: 125
    SolutionNameMin: Cijk_Alik_Bljk_BSS_BH_MT32x32x32_MI16x16x8x1_SE_1LDSB0_AF0EM1_GRVW2_GSU1_LBSPP128_LPA4_LPB4_PLR5_SU0_SUS0_SRVW4_TT1_16_WG32_8_1_WGM1
    SolutionIndex: 126
    SolutionNameMin: Cijk_Alik_Bljk_BSS_BH_MT32x32x64_MI16x16x8x1_SE_1LDSB0_AF0EM1_GRVW8_GSU5_LBSPP128_LPA8_LPB8_PLR9_SU0_SUS0_SRVW0_TT1_16_WG32_8_1_WGM1
    SolutionIndex: 127
    SolutionNameMin: Cijk_Alik_Bljk_BSS_BH_MT16x16x128_MI16x16x8x1_SE_1LDSB0_AF0EM1_GRVW8_GSU1_LBSPP256_LPA8_LPB8_PLR17_SU0_SUS0_SRVW0_TT1_16_WG16_4_1_WGM15
    SolutionIndex: 128
    SolutionNameMin: Cijk_Alik_Bljk_BSS_BH_MT32x32x64_MI16x16x8x1_SE_1LDSB0_AF0EM1_GRVW8_GSU1_LBSPP128_LPA8_LPB8_PLR9_SU0_SUS0_SRVW4_TT1_16_WG32_8_1_WGM1
    SolutionIndex: 129
    SolutionNameMin: Cijk_Alik_Bljk_BSS_BH_MT32x32x64_MI16x16x8x1_SE_1LDSB1_AF0EM1_GRVW2_GSU1_LBSPP128_LPA4_LPB4_PLR9_SU0_SUS0_SRVW4_TT1_16_WG32_8_1_WGM1
    SolutionIndex: 130
    SolutionNameMin: Cijk_Alik_Bljk_BSS_BH_MT32x32x64_MI16x16x8x1_SE_1LDSB1_AF0EM1_GRVW8_GSU15_LBSPP128_LPA8_LPB8_PLR9_SU0_SUS0_SRVW0_TT1_16_WG32_8_1_WGM2
- - - [7680, 8192, 1, 8192]
    - [0, 94.763]
  - - [3840, 4096, 1, 4096]
    - [1, 89.492]
  - - [1920, 2048, 1, 2048]
    - [2, 80.345]
  - - [960, 1024, 1, 1024]
    - [3, 56.41]
  - - [480, 512, 1, 512]
    - [4, 18.841]
  - - [8192, 7680, 1, 8192]
    - [0, 94.171]
  - - [4096, 3840, 1, 4096]
    - [1, 89.386]
  - - [2048, 1920, 1, 2048]
    - [2, 79.08]
  - - [1024, 960, 1, 1024]
    - [3, 56.579]
  - - [512, 480, 1, 512]
    - [5, 18.399]
  - - [8192, 8192, 1, 8192]
    - [0, 93.998]
  - - [4096, 4096, 1, 4096]
    - [6, 90.317]
  - - [2048, 2048, 1, 2048]
    - [7, 78.889]
  - - [1024, 1024, 1, 1024]
    - [3, 46.521]
  - - [512, 512, 1, 512]
    - [5, 18.073]
  - - [512, 512, 16, 64]
    - [8, 15.95]
  - - [512, 512, 128, 64]
    - [9, 20.107]
  - - [1024, 1, 1, 1024]
    - [10, 0.162]
  - - [1024, 77, 1, 1024]
    - [11, 10.568]
  - - [1024, 512, 1, 1024]
    - [5, 33.607]
  - - [1024, 512, 1, 4096]
    - [12, 47.065]
  - - [4096, 512, 1, 1024]
    - [13, 57.833]
  - - [128, 128, 128, 64]
    - [14, 12.498]
  - - [128, 128, 160, 64]
    - [15, 13.594]
  - - [1024, 10, 1, 1024]
    - [16, 1.521]
  - - [1024, 200, 1, 1024]
    - [17, 21.103]
  - - [1024, 1280, 1, 1024]
    - [3, 56.579]
  - - [1024, 1280, 1, 4096]
    - [18, 70.714]
  - - [4096, 1280, 1, 1024]
    - [19, 68.684]
  - - [128, 128, 624, 64]
    - [20, 17.033]
  - - [1024, 39, 1, 1024]
    - [10, 5.799]
  - - [1024, 780, 1, 1024]
    - [21, 47.394]
  - - [1024, 4992, 1, 1024]
    - [22, 70.23]
  - - [1024, 4992, 1, 4096]
    - [22, 82.312]
  - - [4096, 4992, 1, 1024]
    - [23, 79.523]
  - - [512, 512, 64, 64]
    - [9, 19.324]
  - - [1024, 4, 1, 1024]
    - [16, 0.633]
  - - [1024, 308, 1, 1024]
    - [24, 26.986]
  - - [1024, 2048, 1, 1024]
    - [21, 58.421]
  - - [1024, 2048, 1, 4096]
    - [25, 74.261]
  - - [4096, 2048, 1, 1024]
    - [19, 74.124]
  - - [128, 128, 640, 64]
    - [26, 17.136]
  - - [1024, 40, 1, 1024]
    - [10, 5.858]
  - - [1024, 800, 1, 1024]
    - [21, 49.218]
  - - [1024, 5120, 1, 1024]
    - [27, 71.063]
  - - [1024, 5120, 1, 4096]
    - [27, 84.352]
  - - [4096, 5120, 1, 1024]
    - [28, 78.504]
  - - [128, 128, 656, 64]
    - [29, 17.098]
  - - [1024, 41, 1, 1024]
    - [10, 6.005]
  - - [1024, 820, 1, 1024]
    - [21, 49.215]
  - - [1024, 5248, 1, 1024]
    - [7, 69.828]
  - - [1024, 5248, 1, 4096]
    - [7, 81.905]
  - - [4096, 5248, 1, 1024]
    - [28, 79.198]
  - - [512, 512, 80, 64]
    - [9, 19.534]
  - - [1024, 5, 1, 1024]
    - [30, 0.779]
  - - [1024, 385, 1, 1024]
    - [31, 33.732]
  - - [1024, 2560, 1, 1024]
    - [32, 63.598]
  - - [1024, 2560, 1, 4096]
    - [33, 77.714]
  - - [4096, 2560, 1, 1024]
    - [19, 76.182]
  - - [512, 512, 96, 64]
    - [9, 19.833]
  - - [1024, 6, 1, 1024]
    - [34, 0.927]
  - - [1024, 462, 1, 1024]
    - [35, 38.097]
  - - [1024, 3072, 1, 1024]
    - [27, 68.125]
  - - [1024, 3072, 1, 4096]
    - [27, 83.16]
  - - [4096, 3072, 1, 1024]
    - [19, 77.246]
  - - [1024, 8, 1, 1024]
    - [30, 1.266]
  - - [1024, 160, 1, 1024]
    - [36, 18.151]
  - - [1024, 1024, 1, 4096]
    - [33, 57.502]
  - - [4096, 1024, 1, 1024]
    - [37, 70.702]
  - - [128, 128, 144, 64]
    - [8, 13.206]
  - - [1024, 9, 1, 1024]
    - [34, 1.369]
  - - [1024, 180, 1, 1024]
    - [38, 19.517]
  - - [1024, 1152, 1, 1024]
    - [3, 51.501]
  - - [1024, 1152, 1, 4096]
    - [39, 64.459]
  - - [4096, 1152, 1, 1024]
    - [32, 71.718]
  - - [128, 32768, 1, 256]
    - [40, 40.931]
  - - [256, 32768, 1, 512]
    - [41, 63.699]
  - - [512, 32768, 1, 13]
    - [42, 3.88]
  - - [512, 32768, 1, 1024]
    - [43, 78.696]
  - - [1024, 32768, 1, 479]
    - [6, 64.973]
  - - [1024, 32768, 1, 1024]
    - [33, 81.169]
  - - [32768, 1, 1, 256]
    - [44, 0.849]
  - - [64, 128, 512, 128]
    - [9, 22.734]
  - - [128, 128, 512, 64]
    - [9, 16.86]
  - - [1024, 32, 1, 1024]
    - [34, 4.758]
  - - [1024, 4096, 1, 1024]
    - [27, 70.515]
  - - [1024, 4096, 1, 4096]
    - [33, 83.759]
  - - [4096, 4096, 1, 1024]
    - [45, 78.696]
  - - [30528, 4096, 1, 1024]
    - [28, 84.344]
  - - [64, 512, 64, 512]
    - [46, 43.312]
  - - [30528, 2048, 1, 1024]
    - [28, 83.237]
  - - [1024, 8192, 1, 1024]
    - [7, 74.056]
  - - [1024, 8192, 1, 4096]
    - [7, 86.461]
  - - [1024, 9600, 1, 1024]
    - [6, 77.951]
  - - [1024, 9600, 1, 4096]
    - [47, 91.627]
  - - [4096, 8192, 1, 1024]
    - [28, 81.117]
  - - [4096, 9600, 1, 1024]
    - [48, 82.158]
  - - [33712, 8192, 1, 1024]
    - [18, 86.856]
  - - [33712, 9600, 1, 1024]
    - [49, 88.077]
  - - [1024, 10064, 1, 1024]
    - [50, 77.457]
  - - [1024, 10064, 1, 4096]
    - [50, 89.994]
  - - [1024, 10080, 1, 1024]
    - [33, 78.07]
  - - [1024, 10080, 1, 4096]
    - [33, 90.168]
  - - [1024, 10200, 1, 1024]
    - [51, 76.231]
  - - [1024, 10200, 1, 4096]
    - [51, 87.226]
  - - [1024, 3840, 1, 1024]
    - [2, 72.118]
  - - [1024, 3840, 1, 4096]
    - [52, 85.277]
  - - [1024, 3968, 1, 1024]
    - [7, 69.039]
  - - [1024, 3968, 1, 4096]
    - [7, 81.588]
  - - [1024, 6528, 1, 1024]
    - [51, 74.271]
  - - [1024, 6528, 1, 4096]
    - [51, 85.312]
  - - [1024, 7104, 1, 1024]
    - [6, 75.979]
  - - [1024, 7104, 1, 4096]
    - [6, 89.56]
  - - [1024, 7200, 1, 1024]
    - [7, 76.589]
  - - [1024, 7200, 1, 4096]
    - [53, 90.931]
  - - [1024, 8064, 1, 1024]
    - [33, 72.798]
  - - [1024, 8064, 1, 4096]
    - [39, 84.667]
  - - [1024, 8160, 1, 1024]
    - [51, 73.8]
  - - [1024, 8160, 1, 4096]
    - [39, 85.594]
  - - [1024, 9216, 1, 1024]
    - [51, 75.458]
  - - [1024, 9216, 1, 4096]
    - [47, 88.176]
  - - [1024, 9520, 1, 1024]
    - [51, 77.947]
  - - [1024, 9520, 1, 4096]
    - [47, 90.808]
  - - [4096, 10064, 1, 1024]
    - [18, 81.592]
  - - [4096, 10080, 1, 1024]
    - [54, 81.663]
  - - [4096, 10200, 1, 1024]
    - [28, 81.268]
  - - [4096, 3840, 1, 1024]
    - [32, 78.667]
  - - [4096, 3968, 1, 1024]
    - [28, 77.277]
  - - [4096, 6528, 1, 1024]
    - [6, 80.45]
  - - [4096, 7104, 1, 1024]
    - [6, 80.591]
  - - [4096, 7200, 1, 1024]
    - [6, 81.456]
  - - [4096, 8064, 1, 1024]
    - [28, 80.932]
  - - [4096, 8160, 1, 1024]
    - [28, 80.882]
  - - [4096, 9216, 1, 1024]
    - [18, 80.918]
  - - [4096, 9520, 1, 1024]
    - [45, 81.331]
  - - [42720, 10080, 1, 1024]
    - [55, 88.727]
  - - [42720, 3968, 1, 1024]
    - [49, 86.845]
  - - [42720, 6528, 1, 1024]
    - [0, 87.421]
  - - [42720, 7104, 1, 1024]
    - [0, 88.282]
  - - [42720, 7200, 1, 1024]
    - [0, 88.49]
  - - [42720, 9520, 1, 1024]
    - [55, 87.674]
  - - [24, 24, 4736, 64]
    - [56, 8.336]
  - - [32, 32, 4608, 64]
    - [57, 10.725]
  - - [32, 35, 4608, 64]
    - [58, 10.408]
  - - [64, 512, 1, 512]
    - [59, 3.237]
  - - [512, 512, 1, 64]
    - [60, 3.975]
  - - [128, 128, 1, 64]
    - [61, 0.312]
  - - [64, 128, 1, 128]
    - [62, 0.297]
  - - [2048, 512, 1, 2048]
    - [37, 53.096]
  - - [1024, 512, 1, 1600]
    - [63, 42.32]
  - - [2048, 512, 1, 74]
    - [64, 9.077]
  - - [512, 1, 1, 2048]
    - [65, 0.12]
  - - [64, 512, 1, 1024]
    - [10, 4.945]
  - - [1024, 1600, 1, 560]
    - [51, 43.585]
  - - [1600, 1, 1, 1024]
    - [30, 0.26]
  - - [512, 1600, 1, 512]
    - [66, 37.206]
  - - [1024, 1600, 1, 1024]
    - [15, 56.477]
  - - [32, 1600, 1, 512]
    - [16, 5.007]
  - - [64, 960, 1, 1024]
    - [59, 9.2]
  - - [200, 1, 1, 1024]
    - [30, 0.034]
  - - [256, 684, 1, 1024]
    - [17, 18.645]
  - - [256, 1280, 1, 1024]
    - [63, 29.211]
  - - [256, 1536, 1, 1024]
    - [63, 33.495]
  - - [256, 2304, 1, 1024]
    - [67, 36.466]
  - - [256, 2560, 1, 1024]
    - [21, 40.649]
  - - [256, 2816, 1, 1024]
    - [21, 43.312]
  - - [256, 3328, 1, 1024]
    - [21, 50.71]
  - - [256, 3584, 1, 1024]
    - [3, 54.274]
  - - [256, 4608, 1, 1024]
    - [3, 52.095]
  - - [256, 4864, 1, 1024]
    - [21, 54.239]
  - - [256, 5376, 1, 1024]
    - [3, 58.746]
  - - [256, 5888, 1, 1024]
    - [3, 52.814]
  - - [256, 6144, 1, 1024]
    - [68, 54.414]
  - - [256, 6400, 1, 1024]
    - [68, 56.887]
  - - [256, 6656, 1, 1024]
    - [68, 58.842]
  - - [256, 7168, 1, 1024]
    - [15, 62.579]
  - - [256, 7424, 1, 1024]
    - [51, 64.699]
  - - [256, 7936, 1, 1024]
    - [21, 57.857]
  - - [256, 8192, 1, 1024]
    - [3, 59.022]
  - - [256, 8448, 1, 1024]
    - [3, 60.335]
  - - [256, 8960, 1, 1024]
    - [21, 62.983]
  - - [256, 9984, 1, 1024]
    - [69, 62.008]
  - - [256, 10496, 1, 1024]
    - [50, 64.373]
  - - [256, 11264, 1, 1024]
    - [50, 68.654]
  - - [256, 11520, 1, 1024]
    - [69, 70.477]
  - - [256, 11776, 1, 1024]
    - [21, 62.329]
  - - [256, 12544, 1, 1024]
    - [21, 64.991]
  - - [256, 13312, 1, 1024]
    - [21, 66.444]
  - - [256, 14336, 1, 1024]
    - [51, 68.825]
  - - [256, 14592, 1, 1024]
    - [51, 69.308]
  - - [256, 14848, 1, 1024]
    - [51, 70.661]
  - - [256, 15104, 1, 1024]
    - [51, 71.809]
  - - [256, 16128, 1, 1024]
    - [39, 69.475]
  - - [256, 18176, 1, 1024]
    - [51, 70.778]
  - - [256, 18944, 1, 1024]
    - [51, 73.477]
  - - [256, 19200, 1, 1024]
    - [51, 74.352]
  - - [256, 20480, 1, 1024]
    - [70, 68.45]
  - - [256, 20992, 1, 1024]
    - [51, 69.734]
  - - [256, 21248, 1, 1024]
    - [7, 70.441]
  - - [256, 21504, 1, 1024]
    - [51, 71.242]
  - - [256, 22016, 1, 1024]
    - [51, 72.938]
  - - [256, 22344, 1, 1024]
    - [51, 73.925]
  - - [256, 23296, 1, 1024]
    - [3, 67.276]
  - - [256, 23552, 1, 1024]
    - [2, 67.775]
  - - [256, 31488, 1, 1024]
    - [2, 71.992]
  - - [256, 33536, 1, 1024]
    - [70, 75.687]
  - - [256, 44505, 1, 1024]
    - [51, 76.645]
  - - [960, 1, 1, 2048]
    - [71, 0.224]
  - - [1024, 200, 1, 560]
    - [38, 13.416]
  - - [1024, 960, 1, 1600]
    - [13, 64.559]
  - - [1024, 32768, 1, 480]
    - [15, 75.723]
  - - [1280, 8976, 1, 256]
    - [72, 50.691]
  - - [1792, 8976, 1, 256]
    - [73, 54.047]
  - - [2048, 114, 1, 512]
    - [17, 15.981]
  - - [2048, 114, 1, 768]
    - [17, 20.845]
  - - [2048, 215, 1, 512]
    - [74, 26.538]
  - - [2048, 215, 1, 768]
    - [67, 33.138]
  - - [2048, 256, 1, 512]
    - [17, 27.158]
  - - [2048, 256, 1, 768]
    - [17, 33.054]
  - - [2048, 512, 1, 67]
    - [64, 8.067]
  - - [2048, 512, 1, 100]
    - [75, 10.903]
  - - [2048, 684, 1, 512]
    - [3, 45.973]
  - - [2048, 684, 1, 768]
    - [3, 54.867]
  - - [2048, 960, 1, 74]
    - [76, 12.103]
  - - [2048, 960, 1, 2048]
    - [22, 70.897]
  - - [2048, 1536, 1, 512]
    - [77, 54.121]
  - - [2048, 1536, 1, 768]
    - [27, 61.858]
  - - [2048, 8976, 1, 256]
    - [32, 52.119]
  - - [2304, 8976, 1, 256]
    - [32, 54.178]
  - - [2560, 8976, 1, 256]
    - [73, 54.777]
  - - [2816, 8976, 1, 256]
    - [32, 54.702]
  - - [3072, 8976, 1, 256]
    - [78, 54.55]
  - - [3328, 8976, 1, 256]
    - [79, 55.52]
  - - [3840, 8976, 1, 256]
    - [41, 55.776]
  - - [4096, 8976, 1, 256]
    - [41, 55.536]
  - - [4352, 8976, 1, 256]
    - [72, 55.989]
  - - [4608, 8976, 1, 256]
    - [72, 56.381]
  - - [4864, 8976, 1, 256]
    - [72, 56.159]
  - - [5120, 8976, 1, 256]
    - [72, 56.448]
  - - [5376, 8976, 1, 256]
    - [80, 56.421]
  - - [5632, 8976, 1, 256]
    - [80, 56.806]
  - - [5888, 8976, 1, 256]
    - [72, 56.83]
  - - [6144, 8976, 1, 256]
    - [80, 56.031]
  - - [6400, 8976, 1, 256]
    - [80, 56.811]
  - - [7168, 8976, 1, 256]
    - [72, 57.43]
  - - [7936, 8976, 1, 256]
    - [80, 57.219]
  - - [8192, 8976, 1, 256]
    - [81, 56.147]
  - - [8448, 8976, 1, 256]
    - [80, 57.362]
  - - [8960, 8976, 1, 256]
    - [80, 58.175]
  - - [9472, 8976, 1, 256]
    - [80, 58.38]
  - - [9728, 8976, 1, 256]
    - [80, 58.068]
  - - [9984, 8976, 1, 256]
    - [80, 58.026]
  - - [10240, 8976, 1, 256]
    - [80, 58.124]
  - - [10496, 8976, 1, 256]
    - [80, 57.933]
  - - [11264, 8976, 1, 256]
    - [80, 57.556]
  - - [11776, 8976, 1, 256]
    - [80, 58.382]
  - - [12544, 8976, 1, 256]
    - [80, 57.503]
  - - [13312, 8976, 1, 256]
    - [80, 58.866]
  - - [13568, 8976, 1, 256]
    - [80, 57.616]
  - - [13824, 8976, 1, 256]
    - [80, 58.895]
  - - [15104, 8976, 1, 256]
    - [72, 58.862]
  - - [15360, 8976, 1, 256]
    - [80, 58.972]
  - - [15872, 8976, 1, 256]
    - [72, 58.409]
  - - [16128, 8976, 1, 256]
    - [80, 59.382]
  - - [17152, 8976, 1, 256]
    - [80, 59.208]
  - - [18176, 8976, 1, 256]
    - [80, 59.109]
  - - [18688, 8976, 1, 256]
    - [80, 59.514]
  - - [18944, 8976, 1, 256]
    - [80, 58.691]
  - - [19712, 8976, 1, 256]
    - [80, 59.013]
  - - [19968, 8976, 1, 256]
    - [80, 59.362]
  - - [20480, 8976, 1, 256]
    - [6, 55.921]
  - - [20992, 8976, 1, 256]
    - [80, 59.424]
  - - [21248, 8976, 1, 256]
    - [80, 58.114]
  - - [23552, 8976, 1, 256]
    - [80, 59.392]
  - - [28672, 8976, 1, 256]
    - [6, 56.261]
  - - [31488, 8976, 1, 256]
    - [80, 59.645]
  - - [33536, 8976, 1, 256]
    - [80, 59.803]
  - - [2048, 1024, 1, 2048]
    - [49, 66.546]
  - - [2048, 1024, 1, 8192]
    - [6, 77.389]
  - - [2048, 2, 1, 2048]
    - [30, 0.897]
  - - [30592, 1024, 1, 2048]
    - [28, 87.771]
  - - [6144, 1024, 1, 2048]
    - [22, 80.549]
  - - [8192, 1024, 1, 2048]
    - [82, 81.138]
  - - [1024, 16, 1, 1024]
    - [83, 2.473]
  - - [30592, 8192, 1, 1024]
    - [0, 85.508]
  - - [3072, 8192, 1, 1024]
    - [28, 81.722]
  - - [512, 512, 256, 64]
    - [9, 20.465]
  - - [64, 512, 256, 512]
    - [84, 50.622]
  - - [30592, 2048, 1, 1024]
    - [28, 82.905]
  - - [3072, 2048, 1, 1024]
    - [19, 71.098]
  - - [30592, 4096, 1, 1024]
    - [0, 84.068]
  - - [3072, 4096, 1, 1024]
    - [28, 78.223]
  - - [64, 512, 128, 512]
    - [3, 47.85]
  - - [1920, 2048, 1, 2560]
    - [15, 81.774]
  - - [2560, 2048, 1, 2560]
    - [22, 82.473]
  - - [2560, 2048, 1, 640]
    - [85, 64.612]
  - - [2560, 4, 1, 2560]
    - [86, 2.393]
  - - [7680, 2048, 1, 2560]
    - [28, 89.282]
  - - [512, 512, 40, 64]
    - [9, 18.337]
  - - [64, 512, 40, 512]
    - [87, 41.454]
  - - [1536, 4096, 1, 1536]
    - [22, 77.561]
  - - [1536, 4096, 1, 6144]
    - [22, 87.674]
  - - [4608, 4096, 1, 1536]
    - [28, 84.704]
  - - [50304, 4096, 1, 1536]
    - [28, 89.646]
  - - [6144, 4096, 1, 1536]
    - [28, 85.448]
  - - [1024, 1024, 64, 96]
    - [15, 29.331]
  - - [96, 1024, 64, 1024]
    - [27, 69.862]
  - - [1536, 8192, 1, 1536]
    - [32, 82.684]
  - - [1536, 8192, 1, 6144]
    - [15, 90.595]
  - - [4608, 8192, 1, 1536]
    - [28, 87.745]
  - - [50304, 8192, 1, 1536]
    - [0, 89.944]
  - - [6144, 8192, 1, 1536]
    - [28, 88.284]
  - - [1024, 1024, 128, 96]
    - [15, 29.612]
  - - [96, 1024, 128, 1024]
    - [27, 71.753]
  - - [1024, 16384, 1, 1024]
    - [43, 78.85]
  - - [1024, 16384, 1, 4096]
    - [47, 90.367]
  - - [3072, 16384, 1, 1024]
    - [28, 83.426]
  - - [4096, 16384, 1, 1024]
    - [18, 82.868]
  - - [50304, 16384, 1, 1024]
    - [43, 86.584]
  - - [1024, 1024, 256, 64]
    - [9, 21.073]
  - - [64, 1024, 256, 1024]
    - [88, 62.607]
  - - [50304, 2048, 1, 1024]
    - [28, 83.599]
  - - [1024, 1024, 32, 64]
    - [9, 20.239]
  - - [64, 1024, 32, 1024]
    - [87, 53.166]
  - - [50304, 4096, 1, 1024]
    - [0, 84.8]
  - - [1024, 1024, 64, 64]
    - [9, 20.82]
  - - [64, 1024, 64, 1024]
    - [87, 56.891]
  - - [50304, 8192, 1, 1024]
    - [0, 85.826]
  - - [1024, 1024, 128, 64]
    - [9, 21.008]
  - - [64, 1024, 128, 1024]
    - [89, 61.576]
  - - [1024, 64, 1, 1024]
    - [11, 8.487]
  - - [30528, 8192, 1, 1024]
    - [0, 85.448]
  - - [128, 128, 1024, 64]
    - [90, 17.753]
  - - [64, 128, 1024, 128]
    - [9, 24.538]
  - - [1024, 3456, 1, 1024]
    - [19, 66.044]
  - - [1024, 3456, 1, 480]
    - [32, 56.074]
  - - [1024, 4096, 1, 480]
    - [40, 59.062]
  - - [1024, 6912, 1, 1024]
    - [33, 73.926]
  - - [1024, 6912, 1, 480]
    - [28, 64.36]
  - - [1024, 864, 1, 1024]
    - [91, 51.075]
  - - [1024, 864, 1, 480]
    - [92, 36.629]
  - - [128, 3456, 1, 256]
    - [93, 18.757]
  - - [128, 4096, 1, 256]
    - [5, 18.888]
  - - [128, 55296, 1, 256]
    - [3, 44.8]
  - - [128, 6912, 1, 256]
    - [3, 27.174]
  - - [128, 864, 1, 256]
    - [94, 6.091]
  - - [256, 3456, 1, 512]
    - [3, 39.992]
  - - [256, 4096, 1, 512]
    - [3, 36.808]
  - - [256, 55296, 1, 512]
    - [81, 67.456]
  - - [256, 6912, 1, 512]
    - [3, 47.765]
  - - [256, 864, 1, 512]
    - [95, 16.957]
  - - [3456, 1, 1, 256]
    - [59, 0.193]
  - - [4096, 1, 1, 256]
    - [59, 0.226]
  - - [512, 3456, 1, 1024]
    - [96, 60.024]
  - - [512, 3456, 1, 13]
    - [42, 2.278]
  - - [512, 4096, 1, 1024]
    - [3, 59.283]
  - - [512, 4096, 1, 13]
    - [8, 2.418]
  - - [512, 55296, 1, 13]
    - [8, 4.059]
  - - [512, 6912, 1, 1024]
    - [2, 66.237]
  - - [512, 6912, 1, 13]
    - [42, 2.851]
  - - [512, 864, 1, 1024]
    - [24, 36.388]
  - - [512, 864, 1, 13]
    - [97, 1.015]
  - - [6912, 1, 1, 256]
    - [60, 0.36]
  - - [864, 1, 1, 256]
    - [59, 0.048]
  - - [30528, 640, 1, 1024]
    - [28, 80.564]
  - - [30528, 1280, 1, 1024]
    - [43, 81.903]
  - - [30528, 1600, 1, 1024]
    - [43, 82.444]
  - - [1024, 10240, 1, 1024]
    - [2, 76.182]
  - - [1024, 80, 1, 1024]
    - [11, 10.903]
  - - [4096, 10240, 1, 1024]
    - [28, 81.405]
  - - [1024, 10240, 1, 4096]
    - [28, 86.475]
  - - [64, 128, 1280, 128]
    - [26, 24.996]
  - - [128, 128, 1280, 64]
    - [9, 17.88]
  - - [1024, 10496, 1, 4096]
    - [28, 86.725]
  - - [30528, 1640, 1, 1024]
    - [28, 81.86]
  - - [1024, 82, 1, 1024]
    - [11, 11.414]
  - - [4096, 10496, 1, 1024]
    - [28, 81.38]
  - - [1024, 10496, 1, 1024]
    - [51, 77.998]
  - - [64, 128, 1312, 128]
    - [9, 25.096]
  - - [128, 128, 1312, 64]
    - [9, 18.082]
  - - [30528, 160, 1, 1024]
    - [47, 71.791]
  - - [1024, 12, 1, 1024]
    - [94, 1.826]
  - - [30528, 240, 1, 1024]
    - [19, 73.061]
  - - [1024, 6144, 1, 1024]
    - [27, 72.032]
  - - [4096, 6144, 1, 1024]
    - [28, 79.935]
  - - [1024, 6144, 1, 4096]
    - [27, 84.782]
  - - [64, 512, 192, 512]
    - [98, 49.257]
  - - [512, 512, 192, 64]
    - [9, 20.286]
  - - [1024, 10224, 1, 1024]
    - [51, 76.006]
  - - [1024, 10192, 1, 1024]
    - [51, 76.375]
  - - [1024, 10208, 1, 1024]
    - [51, 76.146]
  - - [1024, 10224, 1, 4096]
    - [51, 86.601]
  - - [4096, 10224, 1, 1024]
    - [28, 81.352]
  - - [3072, 10224, 1, 1024]
    - [28, 82.337]
  - - [3072, 10240, 1, 1024]
    - [28, 82.353]
  - - [1024, 10192, 1, 4096]
    - [28, 86.451]
  - - [4096, 10192, 1, 1024]
    - [28, 81.419]
  - - [3072, 10192, 1, 1024]
    - [28, 82.034]
  - - [3072, 10200, 1, 1024]
    - [28, 82.076]
  - - [1024, 10184, 1, 1024]
    - [51, 76.491]
  - - [3072, 10208, 1, 1024]
    - [28, 82.141]
  - - [1024, 10208, 1, 4096]
    - [51, 86.568]
  - - [4096, 10208, 1, 1024]
    - [28, 81.167]
  - - [2048, 10224, 1, 1024]
    - [28, 78.534]
  - - [2048, 10240, 1, 1024]
    - [28, 78.765]
  - - [1024, 10120, 1, 1024]
    - [51, 75.865]
  - - [2048, 10192, 1, 1024]
    - [28, 78.922]
  - - [24, 24, 6816, 64]
    - [99, 8.84]
  - - [1024, 10152, 1, 1024]
    - [51, 76.017]
  - - [3072, 10080, 1, 1024]
    - [28, 82.144]
  - - [1024, 2048, 1, 49]
    - [77, 8.15]
  - - [1024, 256, 1, 196]
    - [100, 7.693]
  - - [1024, 512, 1, 196]
    - [101, 12.571]
  - - [1152, 128, 1, 784]
    - [93, 12.364]
  - - [128, 512, 1, 784]
    - [44, 5.828]
  - - [2048, 512, 1, 49]
    - [14, 6.369]
  - - [2304, 256, 1, 196]
    - [97, 14.235]
  - - [256, 1024, 1, 196]
    - [102, 7.948]
  - - [256, 128, 1, 3136]
    - [71, 7.693]
  - - [256, 512, 1, 784]
    - [4, 11.182]
  - - [256, 64, 1, 3136]
    - [65, 4.452]
  - - [4608, 512, 1, 49]
    - [70, 8.832]
  - - [512, 1024, 1, 196]
    - [8, 12.996]
  - - [512, 128, 1, 784]
    - [44, 5.9]
  - - [512, 2048, 1, 49]
    - [14, 6.498]
  - - [512, 256, 1, 784]
    - [95, 10.928]
  - - [576, 64, 1, 3136]
    - [65, 8.519]
  - - [64, 256, 1, 3136]
    - [71, 4.473]
  - - [64, 64, 1, 3136]
    - [65, 1.307]
  - - [128, 128, 49, 12800]
    - [103, 66.574]
  - - [128, 128, 25, 25088]
    - [104, 64.628]
  - - [128, 128, 49, 25600]
    - [105, 69.812]
  - - [128, 128, 25, 50176]
    - [105, 70.452]
  - - [256, 256, 25, 12544]
    - [106, 78.745]
  - - [256, 256, 49, 3200]
    - [3, 75.811]
  - - [256, 256, 25, 6272]
    - [52, 73.298]
  - - [256, 256, 49, 6400]
    - [46, 79.264]
  - - [512, 512, 49, 1152]
    - [89, 76.424]
  - - [512, 512, 25, 2048]
    - [107, 77.225]
  - - [512, 512, 49, 2304]
    - [24, 82.453]
  - - [512, 512, 25, 4096]
    - [96, 81.364]
  - - [64, 128, 2048, 128]
    - [26, 25.536]
  - - [128, 128, 2048, 64]
    - [9, 18.387]
  - - [30528, 2560, 1, 1024]
    - [28, 84.172]
  - - [1024, 128, 1, 1024]
    - [95, 14.691]
  - - [64, 128, 1536, 128]
    - [90, 25.184]
  - - [128, 128, 1536, 64]
    - [9, 18.182]
  - - [1024, 12288, 1, 1024]
    - [2, 77.694]
  - - [1024, 12288, 1, 4096]
    - [28, 86.976]
  - - [30528, 1920, 1, 1024]
    - [28, 83.492]
  - - [1024, 96, 1, 1024]
    - [11, 13.175]
  - - [4096, 12288, 1, 1024]
    - [18, 82.35]
  - - [128, 128, 36, 12544]
    - [108, 68.487]
  - - [128, 128, 49, 9216]
    - [103, 65.475]
  - - [128, 128, 64, 6400]
    - [3, 56.681]
  - - [128, 128, 81, 12544]
    - [109, 69.705]
  - - [128, 128, 121, 9216]
    - [106, 62.93]
  - - [128, 128, 169, 6400]
    - [110, 73.903]
  - - [256, 256, 36, 4096]
    - [33, 70.024]
  - - [256, 256, 49, 2304]
    - [66, 75.057]
  - - [256, 256, 64, 2304]
    - [3, 77.197]
  - - [256, 256, 81, 4096]
    - [52, 78.112]
  - - [256, 256, 121, 2304]
    - [66, 78.738]
  - - [256, 256, 169, 2304]
    - [46, 81.449]
  - - [512, 512, 81, 1024]
    - [96, 77.679]
  - - [512, 512, 121, 1024]
    - [84, 79.447]
  - - [512, 512, 169, 1024]
    - [96, 80.33]
  - - [512, 512, 36, 1024]
    - [1, 73.021]
  - - [512, 512, 49, 1024]
    - [89, 74.197]
  - - [512, 512, 64, 1024]
    - [84, 76.053]
  - - [64, 64, 36, 50176]
    - [111, 40.011]
  - - [64, 64, 49, 36864]
    - [112, 40.563]
  - - [64, 64, 64, 25600]
    - [113, 40.091]
  - - [128, 128, 192, 64]
    - [8, 14.166]
  - - [64, 128, 192, 128]
    - [114, 18.747]
  - - [768, 2048, 1, 768]
    - [3, 50.921]
  - - [3072, 2048, 1, 768]
    - [85, 68.357]
  - - [768, 2048, 1, 3072]
    - [110, 64.969]
  - - [768, 16, 1, 768]
    - [30, 1.536]
  - - [384, 384, 144, 64]
    - [42, 19.918]
  - - [64, 384, 144, 384]
    - [3, 41.024]
  - - [768, 4608, 1, 768]
    - [66, 62.648]
  - - [3072, 4608, 1, 768]
    - [19, 74.263]
  - - [768, 4608, 1, 3072]
    - [1, 76.411]
  - - [768, 12, 1, 768]
    - [30, 1.142]
  - - [512, 512, 48, 64]
    - [9, 18.959]
  - - [64, 512, 48, 512]
    - [15, 41.869]
  - - [768, 4, 1, 768]
    - [16, 0.394]
  - - [128, 128, 256, 64]
    - [8, 15.088]
  - - [64, 128, 256, 128]
    - [93, 19.703]
  - - [384, 384, 192, 64]
    - [42, 20.103]
  - - [64, 384, 192, 384]
    - [46, 42.766]
  - - [1024, 4608, 1, 1024]
    - [51, 71.266]
  - - [4096, 4608, 1, 1024]
    - [23, 78.743]
  - - [1024, 4608, 1, 4096]
    - [6, 86.171]
  - - [2880, 3072, 1, 3072]
    - [27, 88.347]
  - - [3072, 3072, 1, 3072]
    - [6, 86.749]
  - - [3072, 512, 1, 3072]
    - [115, 65.015]
  - - [4096, 512, 1, 4096]
    - [116, 72.552]
  - - [512, 1024, 1, 1024]
    - [63, 32.731]
  - - [512, 2048, 1, 2048]
    - [21, 53.026]
  - - [512, 3072, 1, 3072]
    - [110, 65.015]
  - - [512, 4096, 1, 4096]
    - [25, 72.552]
  - - [512, 8192, 1, 8192]
    - [50, 86.765]
  - - [64, 1024, 1, 1024]
    - [59, 9.588]
  - - [8192, 512, 1, 8192]
    - [117, 84.808]
  - - [2, 1, 1, 1024]
    - [11, 0.0]
  - - [2, 8, 1, 1024]
    - [11, 0.003]
  - - [30522, 77, 1, 1024]
    - [118, 46.533]
  - - [30522, 616, 1, 1024]
    - [2, 75.229]
  - - [2, 10, 1, 1024]
    - [62, 0.004]
  - - [30522, 160, 1, 1024]
    - [55, 63.889]
  - - [30522, 200, 1, 1024]
    - [119, 55.58]
  - - [2, 39, 1, 1024]
    - [62, 0.017]
  - - [30522, 780, 1, 1024]
    - [0, 74.789]
  - - [2, 4, 1, 1024]
    - [62, 0.002]
  - - [30522, 308, 1, 1024]
    - [48, 65.045]
  - - [2, 40, 1, 1024]
    - [62, 0.017]
  - - [30522, 800, 1, 1024]
    - [53, 78.376]
  - - [2, 41, 1, 1024]
    - [62, 0.017]
  - - [30522, 820, 1, 1024]
    - [0, 77.644]
  - - [2, 5, 1, 1024]
    - [11, 0.002]
  - - [30522, 385, 1, 1024]
    - [0, 67.33]
  - - [2, 6, 1, 1024]
    - [11, 0.002]
  - - [30522, 462, 1, 1024]
    - [120, 72.866]
  - - [2, 9, 1, 1024]
    - [62, 0.004]
  - - [30522, 180, 1, 1024]
    - [118, 60.585]
  - - [2, 32, 1, 1024]
    - [62, 0.013]
  - - [4, 4, 32768, 64]
    - [44, 1.185]
  - - [4, 4, 38400, 64]
    - [44, 1.216]
  - - [14, 14, 10880, 64]
    - [61, 5.727]
  - - [15, 14, 10880, 64]
    - [61, 5.976]
  - - [15, 15, 7680, 64]
    - [95, 5.702]
  - - [15, 15, 10880, 64]
    - [61, 6.109]
  - - [17, 15, 7680, 64]
    - [121, 4.297]
  - - [17, 17, 6144, 64]
    - [121, 5.064]
  - - [17, 17, 7680, 64]
    - [121, 5.244]
  - - [21, 17, 6144, 64]
    - [122, 5.944]
  - - [21, 21, 6144, 64]
    - [123, 7.04]
  - - [30, 30, 2048, 64]
    - [121, 6.856]
  - - [30, 31, 2048, 64]
    - [121, 7.13]
  - - [31, 31, 2048, 64]
    - [5, 7.461]
  - - [34, 24, 4736, 64]
    - [29, 7.29]
  - - [34, 34, 4736, 64]
    - [95, 7.547]
  - - [35, 35, 4608, 64]
    - [44, 7.463]
  - - [2, 2048, 1, 1024]
    - [59, 0.633]
  - - [2, 1024, 1, 1024]
    - [16, 0.319]
  - - [5, 5, 1, 64]
    - [95, 0.001]
  - - [33, 33, 1, 32]
    - [124, 0.008]
  - - [3, 3, 512, 64]
    - [124, 0.08]
  - - [5, 5, 512, 64]
    - [61, 0.216]
  - - [5, 5, 960, 64]
    - [95, 0.359]
  - - [9, 9, 512, 64]
    - [44, 0.662]
  - - [27, 27, 32768, 128]
    - [123, 12.974]
  - - [33, 33, 1600, 32]
    - [125, 2.577]
  - - [684, 8976, 1, 256]
    - [66, 40.298]
  - - [44505, 8976, 1, 256]
    - [55, 61.418]
  - - [2, 2, 1, 2048]
    - [11, 0.001]
  - - [2, 16, 1, 1024]
    - [11, 0.006]
  - - [2, 4, 1, 2560]
    - [126, 0.002]
  - - [2, 64, 1, 1024]
    - [11, 0.022]
  - - [2, 80, 1, 1024]
    - [127, 0.029]
  - - [2, 82, 1, 1024]
    - [127, 0.028]
  - - [2, 12, 1, 1024]
    - [127, 0.005]
  - - [1, 4096, 1, 256]
    - [128, 0.236]
  - - [1, 6912, 1, 256]
    - [95, 0.364]
  - - [26, 26, 6272, 64]
    - [129, 8.409]
  - - [147, 64, 1, 12544]
    - [130, 8.211]
  - - [2, 128, 1, 1024]
    - [86, 0.048]
  - - [2, 96, 1, 1024]
    - [127, 0.035]
  - - [2, 2048, 1, 768]
    - [16, 0.526]
  - - [2, 4608, 1, 768]
    - [11, 1.077]
  - - [2, 4608, 1, 1024]
    - [11, 1.338]
- null
