library/src/blas3/Tensile/Logic/asm_full/arcturus/arcturus_Cijk_Alik_Bljk_I8II_BH_GB.yaml
- {MinimumRequiredVersion: 4.26.0}
- arcturus
- gfx908
- [Device 7380, Device 7388, Device 738c, Device 7390]
    SolutionIndex: 0
    SolutionNameMin: Cijk_Alik_Bljk_I8II_BH_GB_MT64x64x32_MI32x32x8x1_SN_1LDSB0_EPS1_GRVW4_LPA4_LPB4_OPLV0_PK0_PAP0_PGR1_PLR1_SU32_SUS256_SRVW0_TT1_32_WG64_4_1_WGM8
    SolutionIndex: 1
    SolutionNameMin: Cijk_Alik_Bljk_I8II_BH_GB_MT64x64x64_MI32x32x8x1_SN_1LDSB0_EPS1_GRVW4_LPA4_LPB4_OPLV0_PK0_PAP0_PGR1_PLR1_SU32_SUS256_SRVW0_TT1_32_WG64_4_1_WGM8
    SolutionIndex: 2
    SolutionNameMin: Cijk_Alik_Bljk_I8II_BH_GB_MT64x64x64_MI32x32x8x1_SN_1LDSB0_EPS1_GRVW8_LPA16_LPB16_OPLV0_PKn1_PAP0_PGR1_PLR9_SU0_SUS128_SRVW4_TT1_32_WG64_4_1_WGM1
    SolutionIndex: 3
    SolutionNameMin: Cijk_Alik_Bljk_I8II_BH_GB_MT256x128x64_MI32x32x8x1_SN_1LDSB1_EPS1_GRVW16_LPA16_LPB16_OPLV0_PKn1_PAP0_PGR1_PLR9_SU0_SUS128_SRVW0_TT4_64_WG64_4_1_WGM1
    SolutionIndex: 4
    SolutionNameMin: Cijk_Alik_Bljk_I8II_BH_GB_MT64x64x64_MI32x32x8x1_SN_1LDSB0_EPS1_GRVW8_LPA16_LPB16_OPLV0_PKn1_PAP0_PGR1_PLR9_SU0_SUS256_SRVW4_TT1_32_WG64_4_1_WGM1
    SolutionIndex: 5
    SolutionNameMin: Cijk_Alik_Bljk_I8II_BH_GB_MT64x64x128_MI32x32x8x1_SN_1LDSB1_EPS0_GRVW16_LPA16_LPB16_OPLV0_PKn1_PAP0_PGR2_PLR17_SU32_SUS128_SRVW4_TT1_32_WG64_4_1_WGM1
    SolutionIndex: 6
    SolutionNameMin: Cijk_Alik_Bljk_I8II_BH_GB_MT64x64x64_MI32x32x8x1_SN_1LDSB0_EPS0_GRVW4_LPA16_LPB16_OPLV0_PKn1_PAP0_PGR2_PLR9_SU32_SUS256_SRVW4_TT1_32_WG64_4_1_WGM1
    SolutionIndex: 7
    SolutionNameMin: Cijk_Alik_Bljk_I8II_BH_GB_MT32x32x128_MI16x16x16x1_SN_1LDSB0_EPS1_GRVW4_LPA32_LPB32_OPLV0_PK0_PAP0_PGR1_PLR9_SU0_SUS128_SRVW0_TT1_16_WG32_8_1_WGM1
    SolutionIndex: 8
    SolutionNameMin: Cijk_Alik_Bljk_I8II_BH_GB_MT64x64x64_MI32x32x8x1_SN_1LDSB0_EPS1_GRVW16_LPA16_LPB16_OPLV0_PK0_PAP0_PGR1_PLR9_SU0_SUS128_SRVW0_TT1_32_WG64_4_1_WGM1
    SolutionIndex: 9
    SolutionNameMin: Cijk_Alik_Bljk_I8II_BH_GB_MT32x32x128_MI16x16x16x1_SN_1LDSB0_EPS1_GRVW16_LPA32_LPB32_OPLV0_PK0_PAP0_PGR1_PLR9_SU0_SUS128_SRVW0_TT1_16_WG32_8_1_WGM1
    SolutionIndex: 10
    SolutionNameMin: Cijk_Alik_Bljk_I8II_BH_GB_MT32x32x128_MI16x16x16x1_SN_1LDSB0_EPS0_GRVW16_LPA32_LPB32_OPLV0_PK0_PAP0_PGR2_PLR9_SU0_SUS128_SRVW0_TT1_16_WG32_8_1_WGM1
    SolutionIndex: 11
    SolutionNameMin: Cijk_Alik_Bljk_I8II_BH_GB_MT64x32x128_MI16x16x16x1_SN_1LDSB0_EPS0_GRVW16_LPA32_LPB32_OPLV0_PK0_PAP0_PGR2_PLR9_SU0_SUS128_SRVW0_TT2_16_WG32_8_1_WGM1
    SolutionIndex: 12
    SolutionNameMin: Cijk_Alik_Bljk_I8II_BH_GB_MT64x128x64_MI32x32x8x1_SN_1LDSB0_EPS1_GRVW4_LPA16_LPB16_OPLV0_PK0_PAP0_PGR1_PLR9_SU0_SUS128_SRVW4_TT1_64_WG64_4_1_WGM1
    SolutionIndex: 13
    SolutionNameMin: Cijk_Alik_Bljk_I8II_BH_GB_MT64x128x64_MI32x32x8x1_SN_1LDSB0_EPS1_GRVW8_LPA16_LPB16_OPLV0_PK0_PAP0_PGR1_PLR9_SU0_SUS128_SRVW4_TT1_64_WG64_4_1_WGM1
    SolutionIndex: 14
    SolutionNameMin: Cijk_Alik_Bljk_I8II_BH_GB_MT64x128x64_MI32x32x8x1_SN_1LDSB0_EPS1_GRVW16_LPA16_LPB16_OPLV0_PK0_PAP0_PGR1_PLR9_SU0_SUS128_SRVW4_TT1_64_WG64_4_1_WGM1
    SolutionIndex: 15
    SolutionNameMin: Cijk_Alik_Bljk_I8II_BH_GB_MT64x64x64_MI32x32x8x1_SN_1LDSB0_EPS0_GRVW4_LPA16_LPB16_OPLV0_PK0_PAP0_PGR2_PLR9_SU0_SUS128_SRVW4_TT1_32_WG64_4_1_WGM1
    SolutionIndex: 16
    SolutionNameMin: Cijk_Alik_Bljk_I8II_BH_GB_MT64x128x64_MI32x32x8x1_SN_1LDSB0_EPS0_GRVW8_LPA16_LPB16_OPLV0_PK0_PAP0_PGR2_PLR9_SU0_SUS128_SRVW4_TT1_64_WG64_4_1_WGM1
    SolutionIndex: 17
    SolutionNameMin: Cijk_Alik_Bljk_I8II_BH_GB_MT64x64x64_MI32x32x8x1_SN_1LDSB0_EPS0_GRVW16_LPA16_LPB16_OPLV0_PK0_PAP0_PGR2_PLR9_SU0_SUS128_SRVW4_TT1_32_WG64_4_1_WGM1
    SolutionIndex: 18
    SolutionNameMin: Cijk_Alik_Bljk_I8II_BH_GB_MT32x32x128_MI16x16x16x1_SN_1LDSB0_EPS0_GRVW16_LPA32_LPB32_OPLV0_PK0_PAP0_PGR2_PLR9_SU0_SUS128_SRVW4_TT1_16_WG32_8_1_WGM1
    SolutionIndex: 19
    SolutionNameMin: Cijk_Alik_Bljk_I8II_BH_GB_MT32x32x128_MI16x16x16x1_SN_1LDSB1_EPS1_GRVW4_LPA32_LPB32_OPLV0_PK0_PAP0_PGR1_PLR9_SU0_SUS128_SRVW0_TT1_16_WG32_8_1_WGM1
    SolutionIndex: 20
    SolutionNameMin: Cijk_Alik_Bljk_I8II_BH_GB_MT32x32x128_MI16x16x16x1_SN_1LDSB1_EPS1_GRVW8_LPA32_LPB32_OPLV0_PK0_PAP0_PGR1_PLR9_SU0_SUS128_SRVW0_TT1_16_WG32_8_1_WGM1
    SolutionIndex: 21
    SolutionNameMin: Cijk_Alik_Bljk_I8II_BH_GB_MT64x32x128_MI16x16x16x1_SN_1LDSB1_EPS1_GRVW8_LPA32_LPB32_OPLV0_PK0_PAP0_PGR1_PLR9_SU0_SUS128_SRVW0_TT2_16_WG32_8_1_WGM1
    SolutionIndex: 22
    SolutionNameMin: Cijk_Alik_Bljk_I8II_BH_GB_MT32x64x128_MI16x16x16x1_SN_1LDSB1_EPS1_GRVW16_LPA32_LPB32_OPLV0_PK0_PAP0_PGR1_PLR9_SU0_SUS128_SRVW0_TT1_32_WG32_8_1_WGM1
    SolutionIndex: 23
    SolutionNameMin: Cijk_Alik_Bljk_I8II_BH_GB_MT64x32x128_MI16x16x16x1_SN_1LDSB1_EPS1_GRVW16_LPA32_LPB32_OPLV0_PK0_PAP0_PGR1_PLR9_SU0_SUS128_SRVW0_TT2_16_WG32_8_1_WGM1
    SolutionIndex: 24
    SolutionNameMin: Cijk_Alik_Bljk_I8II_BH_GB_MT64x64x64_MI32x32x8x1_SN_1LDSB1_EPS0_GRVW4_LPA16_LPB16_OPLV0_PK0_PAP0_PGR2_PLR9_SU0_SUS128_SRVW0_TT1_32_WG64_4_1_WGM1
    SolutionIndex: 25
    SolutionNameMin: Cijk_Alik_Bljk_I8II_BH_GB_MT32x32x128_MI16x16x16x1_SN_1LDSB1_EPS0_GRVW4_LPA32_LPB32_OPLV0_PK0_PAP0_PGR2_PLR9_SU0_SUS128_SRVW0_TT1_16_WG32_8_1_WGM1
    SolutionIndex: 26
    SolutionNameMin: Cijk_Alik_Bljk_I8II_BH_GB_MT32x32x128_MI16x16x16x1_SN_1LDSB1_EPS0_GRVW8_LPA32_LPB32_OPLV0_PK0_PAP0_PGR2_PLR9_SU0_SUS128_SRVW0_TT1_16_WG32_8_1_WGM1
    SolutionIndex: 27
    SolutionNameMin: Cijk_Alik_Bljk_I8II_BH_GB_MT64x32x128_MI16x16x16x1_SN_1LDSB1_EPS0_GRVW8_LPA32_LPB32_OPLV0_PK0_PAP0_PGR2_PLR9_SU0_SUS128_SRVW0_TT2_16_WG32_8_1_WGM1
    SolutionIndex: 28
    SolutionNameMin: Cijk_Alik_Bljk_I8II_BH_GB_MT64x128x64_MI32x32x8x1_SN_1LDSB1_EPS0_GRVW16_LPA16_LPB16_OPLV0_PK0_PAP0_PGR2_PLR9_SU0_SUS128_SRVW0_TT1_64_WG64_4_1_WGM1
    SolutionIndex: 29
    SolutionNameMin: Cijk_Alik_Bljk_I8II_BH_GB_MT128x64x64_MI32x32x8x1_SN_1LDSB1_EPS0_GRVW16_LPA16_LPB16_OPLV0_PK0_PAP0_PGR2_PLR9_SU0_SUS128_SRVW0_TT2_32_WG64_4_1_WGM1
    SolutionIndex: 30
    SolutionNameMin: Cijk_Alik_Bljk_I8II_BH_GB_MT32x32x128_MI16x16x16x1_SN_1LDSB1_EPS0_GRVW16_LPA32_LPB32_OPLV0_PK0_PAP0_PGR2_PLR9_SU0_SUS128_SRVW0_TT1_16_WG32_8_1_WGM1
    SolutionIndex: 31
    SolutionNameMin: Cijk_Alik_Bljk_I8II_BH_GB_MT64x32x128_MI16x16x16x1_SN_1LDSB1_EPS0_GRVW16_LPA32_LPB32_OPLV0_PK0_PAP0_PGR2_PLR9_SU0_SUS128_SRVW0_TT2_16_WG32_8_1_WGM1
    SolutionIndex: 32
    SolutionNameMin: Cijk_Alik_Bljk_I8II_BH_GB_MT32x64x128_MI16x16x16x1_SN_1LDSB1_EPS1_GRVW16_LPA32_LPB32_OPLV0_PK0_PAP0_PGR1_PLR9_SU0_SUS128_SRVW4_TT1_32_WG32_8_1_WGM1
    SolutionIndex: 33
    SolutionNameMin: Cijk_Alik_Bljk_I8II_BH_GB_MT64x32x128_MI16x16x16x1_SN_1LDSB1_EPS1_GRVW16_LPA32_LPB32_OPLV0_PK0_PAP0_PGR1_PLR9_SU0_SUS128_SRVW4_TT2_16_WG32_8_1_WGM1
    SolutionIndex: 34
    SolutionNameMin: Cijk_Alik_Bljk_I8II_BH_GB_MT32x32x128_MI16x16x16x1_SN_1LDSB1_EPS0_GRVW16_LPA32_LPB32_OPLV0_PK0_PAP0_PGR2_PLR9_SU0_SUS128_SRVW4_TT1_16_WG32_8_1_WGM1
    SolutionIndex: 35
    SolutionNameMin: Cijk_Alik_Bljk_I8II_BH_GB_MT64x32x128_MI16x16x16x1_SN_1LDSB1_EPS0_GRVW16_LPA32_LPB32_OPLV0_PK0_PAP0_PGR2_PLR9_SU0_SUS128_SRVW4_TT2_16_WG32_8_1_WGM1
    SolutionIndex: 36
    SolutionNameMin: Cijk_Alik_Bljk_I8II_BH_GB_MT64x64x128_MI32x32x8x1_SN_1LDSB1_EPS1_GRVW4_LPA16_LPB16_OPLV0_PK0_PAP0_PGR1_PLR17_SU0_SUS128_SRVW4_TT1_32_WG64_4_1_WGM1
    SolutionIndex: 37
    SolutionNameMin: Cijk_Alik_Bljk_I8II_BH_GB_MT64x64x128_MI32x32x8x1_SN_1LDSB1_EPS1_GRVW8_LPA16_LPB16_OPLV0_PK0_PAP0_PGR1_PLR17_SU0_SUS128_SRVW4_TT1_32_WG64_4_1_WGM1
    SolutionIndex: 38
    SolutionNameMin: Cijk_Alik_Bljk_I8II_BH_GB_MT64x64x128_MI32x32x8x1_SN_1LDSB1_EPS1_GRVW16_LPA16_LPB16_OPLV0_PK0_PAP0_PGR1_PLR17_SU0_SUS128_SRVW4_TT1_32_WG64_4_1_WGM1
    SolutionIndex: 39
    SolutionNameMin: Cijk_Alik_Bljk_I8II_BH_GB_MT64x64x128_MI32x32x8x1_SN_1LDSB1_EPS0_GRVW8_LPA16_LPB16_OPLV0_PK0_PAP0_PGR2_PLR17_SU0_SUS128_SRVW4_TT1_32_WG64_4_1_WGM1
    SolutionIndex: 40
    SolutionNameMin: Cijk_Alik_Bljk_I8II_BH_GB_MT64x64x128_MI32x32x8x1_SN_1LDSB1_EPS0_GRVW16_LPA16_LPB16_OPLV0_PK0_PAP0_PGR2_PLR17_SU0_SUS128_SRVW4_TT1_32_WG64_4_1_WGM1
    SolutionIndex: 41
    SolutionNameMin: Cijk_Alik_Bljk_I8II_BH_GB_MT32x64x128_MI16x16x16x1_SN_1LDSB0_EPS1_GRVW16_LPA32_LPB32_OPLV0_PK0_PAP0_PGR1_PLR9_SU0_SUS256_SRVW0_TT1_32_WG32_8_1_WGM1
    SolutionIndex: 42
    SolutionNameMin: Cijk_Alik_Bljk_I8II_BH_GB_MT32x32x128_MI16x16x16x1_SN_1LDSB0_EPS0_GRVW16_LPA32_LPB32_OPLV0_PK0_PAP0_PGR2_PLR9_SU0_SUS256_SRVW0_TT1_16_WG32_8_1_WGM1
    SolutionIndex: 43
    SolutionNameMin: Cijk_Alik_Bljk_I8II_BH_GB_MT64x32x128_MI16x16x16x1_SN_1LDSB0_EPS0_GRVW16_LPA32_LPB32_OPLV0_PK0_PAP0_PGR2_PLR9_SU0_SUS256_SRVW0_TT2_16_WG32_8_1_WGM1
    SolutionIndex: 44
    SolutionNameMin: Cijk_Alik_Bljk_I8II_BH_GB_MT64x64x64_MI32x32x8x1_SN_1LDSB0_EPS0_GRVW4_LPA16_LPB16_OPLV0_PK0_PAP0_PGR2_PLR9_SU0_SUS256_SRVW4_TT1_32_WG64_4_1_WGM1
    SolutionIndex: 45
    SolutionNameMin: Cijk_Alik_Bljk_I8II_BH_GB_MT64x128x64_MI32x32x8x1_SN_1LDSB0_EPS0_GRVW4_LPA16_LPB16_OPLV0_PK0_PAP0_PGR2_PLR9_SU0_SUS256_SRVW4_TT1_64_WG64_4_1_WGM1
    SolutionIndex: 46
    SolutionNameMin: Cijk_Alik_Bljk_I8II_BH_GB_MT64x64x64_MI32x32x8x1_SN_1LDSB0_EPS0_GRVW16_LPA16_LPB16_OPLV0_PK0_PAP0_PGR2_PLR9_SU0_SUS256_SRVW4_TT1_32_WG64_4_1_WGM1
    SolutionIndex: 47
    SolutionNameMin: Cijk_Alik_Bljk_I8II_BH_GB_MT64x128x64_MI32x32x8x1_SN_1LDSB0_EPS0_GRVW16_LPA16_LPB16_OPLV0_PK0_PAP0_PGR2_PLR9_SU0_SUS256_SRVW4_TT1_64_WG64_4_1_WGM1
    SolutionIndex: 48
    SolutionNameMin: Cijk_Alik_Bljk_I8II_BH_GB_MT64x32x128_MI16x16x16x1_SN_1LDSB1_EPS1_GRVW8_LPA32_LPB32_OPLV0_PK0_PAP0_PGR1_PLR9_SU0_SUS256_SRVW0_TT2_16_WG32_8_1_WGM1
    SolutionIndex: 49
    SolutionNameMin: Cijk_Alik_Bljk_I8II_BH_GB_MT32x32x128_MI16x16x16x1_SN_1LDSB1_EPS1_GRVW16_LPA32_LPB32_OPLV0_PK0_PAP0_PGR1_PLR9_SU0_SUS256_SRVW0_TT1_16_WG32_8_1_WGM1
    SolutionIndex: 50
    SolutionNameMin: Cijk_Alik_Bljk_I8II_BH_GB_MT64x32x128_MI16x16x16x1_SN_1LDSB1_EPS1_GRVW16_LPA32_LPB32_OPLV0_PK0_PAP0_PGR1_PLR9_SU0_SUS256_SRVW0_TT2_16_WG32_8_1_WGM1
    SolutionIndex: 51
    SolutionNameMin: Cijk_Alik_Bljk_I8II_BH_GB_MT64x64x64_MI32x32x8x1_SN_1LDSB1_EPS0_GRVW4_LPA16_LPB16_OPLV0_PK0_PAP0_PGR2_PLR9_SU0_SUS256_SRVW0_TT1_32_WG64_4_1_WGM1
    SolutionIndex: 52
    SolutionNameMin: Cijk_Alik_Bljk_I8II_BH_GB_MT64x128x64_MI32x32x8x1_SN_1LDSB1_EPS0_GRVW4_LPA16_LPB16_OPLV0_PK0_PAP0_PGR2_PLR9_SU0_SUS256_SRVW0_TT1_64_WG64_4_1_WGM1
    SolutionIndex: 53
    SolutionNameMin: Cijk_Alik_Bljk_I8II_BH_GB_MT32x32x128_MI16x16x16x1_SN_1LDSB1_EPS0_GRVW4_LPA32_LPB32_OPLV0_PK0_PAP0_PGR2_PLR9_SU0_SUS256_SRVW0_TT1_16_WG32_8_1_WGM1
    SolutionIndex: 54
    SolutionNameMin: Cijk_Alik_Bljk_I8II_BH_GB_MT32x32x128_MI16x16x16x1_SN_1LDSB1_EPS0_GRVW8_LPA32_LPB32_OPLV0_PK0_PAP0_PGR2_PLR9_SU0_SUS256_SRVW0_TT1_16_WG32_8_1_WGM1
    SolutionIndex: 55
    SolutionNameMin: Cijk_Alik_Bljk_I8II_BH_GB_MT32x64x128_MI16x16x16x1_SN_1LDSB1_EPS0_GRVW8_LPA32_LPB32_OPLV0_PK0_PAP0_PGR2_PLR9_SU0_SUS256_SRVW0_TT1_32_WG32_8_1_WGM1
    SolutionIndex: 56
    SolutionNameMin: Cijk_Alik_Bljk_I8II_BH_GB_MT64x32x128_MI16x16x16x1_SN_1LDSB1_EPS1_GRVW4_LPA32_LPB32_OPLV0_PK0_PAP0_PGR1_PLR9_SU0_SUS256_SRVW4_TT2_16_WG32_8_1_WGM1
    SolutionIndex: 57
    SolutionNameMin: Cijk_Alik_Bljk_I8II_BH_GB_MT64x256x64_MI32x32x8x1_SN_1LDSB1_EPS1_GRVW16_LPA16_LPB16_OPLV0_PK0_PAP0_PGR1_PLR9_SU0_SUS256_SRVW4_TT1_128_WG64_4_1_WGM1
    SolutionIndex: 58
    SolutionNameMin: Cijk_Alik_Bljk_I8II_BH_GB_MT64x32x128_MI16x16x16x1_SN_1LDSB1_EPS1_GRVW16_LPA32_LPB32_OPLV0_PK0_PAP0_PGR1_PLR9_SU0_SUS256_SRVW4_TT2_16_WG32_8_1_WGM1
    SolutionIndex: 59
    SolutionNameMin: Cijk_Alik_Bljk_I8II_BH_GB_MT32x32x128_MI16x16x16x1_SN_1LDSB1_EPS0_GRVW16_LPA32_LPB32_OPLV0_PK0_PAP0_PGR2_PLR9_SU0_SUS256_SRVW4_TT1_16_WG32_8_1_WGM1
    SolutionIndex: 60
    SolutionNameMin: Cijk_Alik_Bljk_I8II_BH_GB_MT64x64x128_MI32x32x8x1_SN_1LDSB1_EPS1_GRVW8_LPA16_LPB16_OPLV0_PK0_PAP0_PGR1_PLR17_SU0_SUS256_SRVW4_TT1_32_WG64_4_1_WGM1
    SolutionIndex: 61
    SolutionNameMin: Cijk_Alik_Bljk_I8II_BH_GB_MT64x64x128_MI32x32x8x1_SN_1LDSB1_EPS1_GRVW16_LPA16_LPB16_OPLV0_PK0_PAP0_PGR1_PLR17_SU0_SUS256_SRVW4_TT1_32_WG64_4_1_WGM1
    SolutionIndex: 62
    SolutionNameMin: Cijk_Alik_Bljk_I8II_BH_GB_MT64x64x128_MI32x32x8x1_SN_1LDSB1_EPS0_GRVW8_LPA16_LPB16_OPLV0_PK0_PAP0_PGR2_PLR17_SU0_SUS256_SRVW4_TT1_32_WG64_4_1_WGM1
    SolutionIndex: 63
    SolutionNameMin: Cijk_Alik_Bljk_I8II_BH_GB_MT64x64x64_MI32x32x8x1_SN_1LDSB0_EPS0_GRVW16_LPA16_LPB16_OPLV0_PK0_PAP0_PGR2_PLR9_SU32_SUS128_SRVW4_TT1_32_WG64_4_1_WGM1
    SolutionIndex: 64
    SolutionNameMin: Cijk_Alik_Bljk_I8II_BH_GB_MT32x32x128_MI16x16x16x1_SN_1LDSB1_EPS1_GRVW8_LPA32_LPB32_OPLV0_PK0_PAP0_PGR1_PLR9_SU32_SUS128_SRVW0_TT1_16_WG32_8_1_WGM1
    SolutionIndex: 65
    SolutionNameMin: Cijk_Alik_Bljk_I8II_BH_GB_MT32x64x128_MI16x16x16x1_SN_1LDSB1_EPS1_GRVW16_LPA32_LPB32_OPLV0_PK0_PAP0_PGR1_PLR9_SU32_SUS128_SRVW4_TT1_32_WG32_8_1_WGM1
    SolutionIndex: 66
    SolutionNameMin: Cijk_Alik_Bljk_I8II_BH_GB_MT64x64x128_MI32x32x8x1_SN_1LDSB1_EPS1_GRVW8_LPA16_LPB16_OPLV0_PK0_PAP0_PGR1_PLR17_SU32_SUS128_SRVW4_TT1_32_WG64_4_1_WGM1
    SolutionIndex: 67
    SolutionNameMin: Cijk_Alik_Bljk_I8II_BH_GB_MT64x128x128_MI32x32x8x1_SN_1LDSB1_EPS1_GRVW16_LPA16_LPB16_OPLV0_PK0_PAP0_PGR1_PLR17_SU32_SUS128_SRVW4_TT1_64_WG64_4_1_WGM1
    SolutionIndex: 68
    SolutionNameMin: Cijk_Alik_Bljk_I8II_BH_GB_MT64x64x128_MI32x32x8x1_SN_1LDSB1_EPS0_GRVW8_LPA16_LPB16_OPLV0_PK0_PAP0_PGR2_PLR17_SU32_SUS128_SRVW4_TT1_32_WG64_4_1_WGM1
    SolutionIndex: 69
    SolutionNameMin: Cijk_Alik_Bljk_I8II_BH_GB_MT64x64x128_MI32x32x8x1_SN_1LDSB1_EPS0_GRVW16_LPA16_LPB16_OPLV0_PK0_PAP0_PGR2_PLR17_SU32_SUS128_SRVW4_TT1_32_WG64_4_1_WGM1
    SolutionIndex: 70
    SolutionNameMin: Cijk_Alik_Bljk_I8II_BH_GB_MT32x32x128_MI16x16x16x1_SN_1LDSB0_EPS0_GRVW16_LPA32_LPB32_OPLV0_PK0_PAP0_PGR2_PLR9_SU32_SUS256_SRVW0_TT1_16_WG32_8_1_WGM1
    SolutionIndex: 71
    SolutionNameMin: Cijk_Alik_Bljk_I8II_BH_GB_MT64x256x64_MI32x32x8x1_SN_1LDSB1_EPS1_GRVW4_LPA16_LPB16_OPLV0_PK0_PAP0_PGR1_PLR9_SU32_SUS256_SRVW4_TT1_128_WG64_4_1_WGM1
    SolutionIndex: 72
    SolutionNameMin: Cijk_Alik_Bljk_I8II_BH_GB_MT64x64x128_MI32x32x8x1_SN_1LDSB1_EPS1_GRVW16_LPA16_LPB16_OPLV0_PK0_PAP0_PGR1_PLR17_SU32_SUS256_SRVW4_TT1_32_WG64_4_1_WGM1
    SolutionIndex: 73
    SolutionNameMin: Cijk_Alik_Bljk_I8II_BH_GB_MT64x64x128_MI32x32x8x1_SN_1LDSB1_EPS0_GRVW16_LPA16_LPB16_OPLV0_PK0_PAP0_PGR2_PLR17_SU32_SUS256_SRVW4_TT1_32_WG64_4_1_WGM1
    SolutionIndex: 74
    SolutionNameMin: Cijk_Alik_Bljk_I8II_BH_GB_MT64x64x64_MI32x32x8x1_SN_1LDSB0_EPS1_GRVW8_LPA16_LPB16_OPLV0_PK0_PAP0_PGR1_PLR9_SU0_SUS128_SRVW0_TT1_32_WG64_4_1_WGM2
    SolutionIndex: 75
    SolutionNameMin: Cijk_Alik_Bljk_I8II_BH_GB_MT32x32x128_MI16x16x16x1_SN_1LDSB0_EPS0_GRVW16_LPA32_LPB32_OPLV0_PK0_PAP0_PGR2_PLR9_SU0_SUS128_SRVW0_TT1_16_WG32_8_1_WGM2
    SolutionIndex: 76
    SolutionNameMin: Cijk_Alik_Bljk_I8II_BH_GB_MT64x64x64_MI32x32x8x1_SN_1LDSB0_EPS1_GRVW16_LPA16_LPB16_OPLV0_PK0_PAP0_PGR1_PLR9_SU0_SUS128_SRVW4_TT1_32_WG64_4_1_WGM2
    SolutionIndex: 77
    SolutionNameMin: Cijk_Alik_Bljk_I8II_BH_GB_MT64x64x64_MI32x32x8x1_SN_1LDSB1_EPS1_GRVW4_LPA16_LPB16_OPLV0_PK0_PAP0_PGR1_PLR9_SU0_SUS128_SRVW0_TT1_32_WG64_4_1_WGM2
    SolutionIndex: 78
    SolutionNameMin: Cijk_Alik_Bljk_I8II_BH_GB_MT128x128x64_MI32x32x8x1_SN_1LDSB1_EPS1_GRVW4_LPA16_LPB16_OPLV0_PK0_PAP0_PGR1_PLR9_SU0_SUS128_SRVW0_TT2_64_WG64_4_1_WGM2
    SolutionIndex: 79
    SolutionNameMin: Cijk_Alik_Bljk_I8II_BH_GB_MT64x64x64_MI32x32x8x1_SN_1LDSB1_EPS1_GRVW16_LPA16_LPB16_OPLV0_PK0_PAP0_PGR1_PLR9_SU0_SUS128_SRVW0_TT1_32_WG64_4_1_WGM2
    SolutionIndex: 80
    SolutionNameMin: Cijk_Alik_Bljk_I8II_BH_GB_MT32x32x128_MI16x16x16x1_SN_1LDSB1_EPS1_GRVW16_LPA32_LPB32_OPLV0_PK0_PAP0_PGR1_PLR9_SU0_SUS128_SRVW0_TT1_16_WG32_8_1_WGM2
    SolutionIndex: 81
    SolutionNameMin: Cijk_Alik_Bljk_I8II_BH_GB_MT64x32x128_MI16x16x16x1_SN_1LDSB1_EPS1_GRVW16_LPA32_LPB32_OPLV0_PK0_PAP0_PGR1_PLR9_SU0_SUS128_SRVW0_TT2_16_WG32_8_1_WGM2
    SolutionIndex: 82
    SolutionNameMin: Cijk_Alik_Bljk_I8II_BH_GB_MT64x64x64_MI32x32x8x1_SN_1LDSB1_EPS0_GRVW8_LPA16_LPB16_OPLV0_PK0_PAP0_PGR2_PLR9_SU0_SUS128_SRVW0_TT1_32_WG64_4_1_WGM2
    SolutionIndex: 83
    SolutionNameMin: Cijk_Alik_Bljk_I8II_BH_GB_MT32x32x128_MI16x16x16x1_SN_1LDSB1_EPS0_GRVW16_LPA32_LPB32_OPLV0_PK0_PAP0_PGR2_PLR9_SU0_SUS128_SRVW0_TT1_16_WG32_8_1_WGM2
    SolutionIndex: 84
    SolutionNameMin: Cijk_Alik_Bljk_I8II_BH_GB_MT64x256x64_MI32x32x8x1_SN_1LDSB1_EPS0_GRVW16_LPA16_LPB16_OPLV0_PK0_PAP0_PGR2_PLR9_SU0_SUS128_SRVW4_TT1_128_WG64_4_1_WGM2
    SolutionIndex: 85
    SolutionNameMin: Cijk_Alik_Bljk_I8II_BH_GB_MT64x64x128_MI32x32x8x1_SN_1LDSB1_EPS1_GRVW16_LPA16_LPB16_OPLV0_PK0_PAP0_PGR1_PLR17_SU0_SUS128_SRVW4_TT1_32_WG64_4_1_WGM2
    SolutionIndex: 86
    SolutionNameMin: Cijk_Alik_Bljk_I8II_BH_GB_MT64x64x128_MI32x32x8x1_SN_1LDSB1_EPS0_GRVW8_LPA16_LPB16_OPLV0_PK0_PAP0_PGR2_PLR17_SU0_SUS128_SRVW4_TT1_32_WG64_4_1_WGM2
    SolutionIndex: 87
    SolutionNameMin: Cijk_Alik_Bljk_I8II_BH_GB_MT64x64x128_MI32x32x8x1_SN_1LDSB1_EPS0_GRVW16_LPA16_LPB16_OPLV0_PK0_PAP0_PGR2_PLR17_SU0_SUS128_SRVW4_TT1_32_WG64_4_1_WGM2
    SolutionIndex: 88
    SolutionNameMin: Cijk_Alik_Bljk_I8II_BH_GB_MT64x64x64_MI32x32x8x1_SN_1LDSB0_EPS1_GRVW16_LPA16_LPB16_OPLV0_PK0_PAP0_PGR1_PLR9_SU0_SUS256_SRVW4_TT1_32_WG64_4_1_WGM2
    SolutionIndex: 89
    SolutionNameMin: Cijk_Alik_Bljk_I8II_BH_GB_MT64x64x64_MI32x32x8x1_SN_1LDSB1_EPS1_GRVW4_LPA16_LPB16_OPLV0_PK0_PAP0_PGR1_PLR9_SU0_SUS256_SRVW0_TT1_32_WG64_4_1_WGM2
    SolutionIndex: 90
    SolutionNameMin: Cijk_Alik_Bljk_I8II_BH_GB_MT32x64x128_MI16x16x16x1_SN_1LDSB1_EPS1_GRVW4_LPA32_LPB32_OPLV0_PK0_PAP0_PGR1_PLR9_SU0_SUS256_SRVW0_TT1_32_WG32_8_1_WGM2
    SolutionIndex: 91
    SolutionNameMin: Cijk_Alik_Bljk_I8II_BH_GB_MT32x32x128_MI16x16x16x1_SN_1LDSB1_EPS1_GRVW16_LPA32_LPB32_OPLV0_PK0_PAP0_PGR1_PLR9_SU0_SUS256_SRVW0_TT1_16_WG32_8_1_WGM2
    SolutionIndex: 92
    SolutionNameMin: Cijk_Alik_Bljk_I8II_BH_GB_MT64x64x64_MI32x32x8x1_SN_1LDSB1_EPS0_GRVW16_LPA16_LPB16_OPLV0_PK0_PAP0_PGR2_PLR9_SU0_SUS256_SRVW0_TT1_32_WG64_4_1_WGM2
    SolutionIndex: 93
    SolutionNameMin: Cijk_Alik_Bljk_I8II_BH_GB_MT32x32x128_MI16x16x16x1_SN_1LDSB1_EPS0_GRVW16_LPA32_LPB32_OPLV0_PK0_PAP0_PGR2_PLR9_SU0_SUS256_SRVW0_TT1_16_WG32_8_1_WGM2
    SolutionIndex: 94
    SolutionNameMin: Cijk_Alik_Bljk_I8II_BH_GB_MT64x256x64_MI32x32x8x1_SN_1LDSB1_EPS0_GRVW16_LPA16_LPB16_OPLV0_PK0_PAP0_PGR2_PLR9_SU0_SUS256_SRVW4_TT1_128_WG64_4_1_WGM2
    SolutionIndex: 95
    SolutionNameMin: Cijk_Alik_Bljk_I8II_BH_GB_MT64x64x128_MI32x32x8x1_SN_1LDSB1_EPS1_GRVW16_LPA16_LPB16_OPLV0_PK0_PAP0_PGR1_PLR17_SU0_SUS256_SRVW4_TT1_32_WG64_4_1_WGM2
    SolutionIndex: 96
    SolutionNameMin: Cijk_Alik_Bljk_I8II_BH_GB_MT64x64x128_MI32x32x8x1_SN_1LDSB1_EPS0_GRVW8_LPA16_LPB16_OPLV0_PK0_PAP0_PGR2_PLR17_SU0_SUS256_SRVW4_TT1_32_WG64_4_1_WGM2
    SolutionIndex: 97
    SolutionNameMin: Cijk_Alik_Bljk_I8II_BH_GB_MT64x64x128_MI32x32x8x1_SN_1LDSB1_EPS0_GRVW16_LPA16_LPB16_OPLV0_PK0_PAP0_PGR2_PLR17_SU0_SUS256_SRVW4_TT1_32_WG64_4_1_WGM2
    SolutionIndex: 98
    SolutionNameMin: Cijk_Alik_Bljk_I8II_BH_GB_MT64x64x64_MI32x32x8x1_SN_1LDSB0_EPS0_GRVW4_LPA16_LPB16_OPLV0_PK0_PAP0_PGR2_PLR9_SU32_SUS128_SRVW4_TT1_32_WG64_4_1_WGM2
    SolutionIndex: 99
    SolutionNameMin: Cijk_Alik_Bljk_I8II_BH_GB_MT32x32x128_MI16x16x16x1_SN_1LDSB1_EPS0_GRVW16_LPA32_LPB32_OPLV0_PK0_PAP0_PGR2_PLR9_SU32_SUS128_SRVW0_TT1_16_WG32_8_1_WGM2
    SolutionIndex: 100
    SolutionNameMin: Cijk_Alik_Bljk_I8II_BH_GB_MT64x256x64_MI32x32x8x1_SN_1LDSB1_EPS1_GRVW4_LPA16_LPB16_OPLV0_PK0_PAP0_PGR1_PLR9_SU32_SUS128_SRVW4_TT1_128_WG64_4_1_WGM2
    SolutionIndex: 101
    SolutionNameMin: Cijk_Alik_Bljk_I8II_BH_GB_MT64x128x128_MI32x32x8x1_SN_1LDSB1_EPS1_GRVW16_LPA16_LPB16_OPLV0_PK0_PAP0_PGR1_PLR17_SU32_SUS128_SRVW4_TT1_64_WG64_4_1_WGM2
    SolutionIndex: 102
    SolutionNameMin: Cijk_Alik_Bljk_I8II_BH_GB_MT64x64x128_MI32x32x8x1_SN_1LDSB1_EPS0_GRVW16_LPA16_LPB16_OPLV0_PK0_PAP0_PGR2_PLR17_SU32_SUS128_SRVW4_TT1_32_WG64_4_1_WGM2
    SolutionIndex: 103
    SolutionNameMin: Cijk_Alik_Bljk_I8II_BH_GB_MT64x128x64_MI32x32x8x1_SN_1LDSB0_EPS0_GRVW16_LPA16_LPB16_OPLV0_PK0_PAP0_PGR2_PLR9_SU32_SUS256_SRVW4_TT1_64_WG64_4_1_WGM2
    SolutionIndex: 104
    SolutionNameMin: Cijk_Alik_Bljk_I8II_BH_GB_MT32x64x128_MI16x16x16x1_SN_1LDSB1_EPS1_GRVW16_LPA32_LPB32_OPLV0_PK0_PAP0_PGR1_PLR9_SU32_SUS256_SRVW4_TT1_32_WG32_8_1_WGM2
    SolutionIndex: 105
    SolutionNameMin: Cijk_Alik_Bljk_I8II_BH_GB_MT64x128x128_MI32x32x8x1_SN_1LDSB1_EPS0_GRVW16_LPA16_LPB16_OPLV0_PK0_PAP0_PGR2_PLR17_SU32_SUS256_SRVW4_TT1_64_WG64_4_1_WGM2
    SolutionIndex: 106
    SolutionNameMin: Cijk_Alik_Bljk_I8II_BH_GB_MT64x64x64_MI32x32x8x1_SN_1LDSB0_EPS1_GRVW8_LPA16_LPB16_OPLV0_PK0_PAP0_PGR1_PLR9_SU0_SUS128_SRVW0_TT1_32_WG64_4_1_WGM15
    SolutionIndex: 107
    SolutionNameMin: Cijk_Alik_Bljk_I8II_BH_GB_MT32x32x128_MI16x16x16x1_SN_1LDSB0_EPS0_GRVW16_LPA32_LPB32_OPLV0_PK0_PAP0_PGR2_PLR9_SU0_SUS128_SRVW0_TT1_16_WG32_8_1_WGM15
    SolutionIndex: 108
    SolutionNameMin: Cijk_Alik_Bljk_I8II_BH_GB_MT64x128x64_MI32x32x8x1_SN_1LDSB0_EPS1_GRVW16_LPA16_LPB16_OPLV0_PK0_PAP0_PGR1_PLR9_SU0_SUS128_SRVW4_TT1_64_WG64_4_1_WGM15
    SolutionIndex: 109
    SolutionNameMin: Cijk_Alik_Bljk_I8II_BH_GB_MT256x128x64_MI32x32x8x1_SN_1LDSB1_EPS1_GRVW4_LPA16_LPB16_OPLV0_PK0_PAP0_PGR1_PLR9_SU0_SUS128_SRVW0_TT4_64_WG64_4_1_WGM15
    SolutionIndex: 110
    SolutionNameMin: Cijk_Alik_Bljk_I8II_BH_GB_MT32x32x128_MI16x16x16x1_SN_1LDSB1_EPS1_GRVW16_LPA32_LPB32_OPLV0_PK0_PAP0_PGR1_PLR9_SU0_SUS128_SRVW0_TT1_16_WG32_8_1_WGM15
    SolutionIndex: 111
    SolutionNameMin: Cijk_Alik_Bljk_I8II_BH_GB_MT32x64x128_MI16x16x16x1_SN_1LDSB1_EPS1_GRVW16_LPA32_LPB32_OPLV0_PK0_PAP0_PGR1_PLR9_SU0_SUS128_SRVW0_TT1_32_WG32_8_1_WGM15
    SolutionIndex: 112
    SolutionNameMin: Cijk_Alik_Bljk_I8II_BH_GB_MT32x32x128_MI16x16x16x1_SN_1LDSB1_EPS0_GRVW16_LPA32_LPB32_OPLV0_PK0_PAP0_PGR2_PLR9_SU0_SUS128_SRVW0_TT1_16_WG32_8_1_WGM15
    SolutionIndex: 113
    SolutionNameMin: Cijk_Alik_Bljk_I8II_BH_GB_MT32x64x128_MI16x16x16x1_SN_1LDSB1_EPS0_GRVW16_LPA32_LPB32_OPLV0_PK0_PAP0_PGR2_PLR9_SU0_SUS128_SRVW0_TT1_32_WG32_8_1_WGM15
    SolutionIndex: 114
    SolutionNameMin: Cijk_Alik_Bljk_I8II_BH_GB_MT32x32x128_MI16x16x16x1_SN_1LDSB1_EPS1_GRVW4_LPA32_LPB32_OPLV0_PK0_PAP0_PGR1_PLR9_SU0_SUS128_SRVW4_TT1_16_WG32_8_1_WGM15
    SolutionIndex: 115
    SolutionNameMin: Cijk_Alik_Bljk_I8II_BH_GB_MT32x64x128_MI16x16x16x1_SN_1LDSB1_EPS1_GRVW16_LPA32_LPB32_OPLV0_PK0_PAP0_PGR1_PLR9_SU0_SUS128_SRVW4_TT1_32_WG32_8_1_WGM15
    SolutionIndex: 116
    SolutionNameMin: Cijk_Alik_Bljk_I8II_BH_GB_MT64x64x128_MI32x32x8x1_SN_1LDSB1_EPS1_GRVW8_LPA16_LPB16_OPLV0_PK0_PAP0_PGR1_PLR17_SU0_SUS128_SRVW4_TT1_32_WG64_4_1_WGM15
    SolutionIndex: 117
    SolutionNameMin: Cijk_Alik_Bljk_I8II_BH_GB_MT64x64x128_MI32x32x8x1_SN_1LDSB1_EPS1_GRVW16_LPA16_LPB16_OPLV0_PK0_PAP0_PGR1_PLR17_SU0_SUS128_SRVW4_TT1_32_WG64_4_1_WGM15
    SolutionIndex: 118
    SolutionNameMin: Cijk_Alik_Bljk_I8II_BH_GB_MT64x64x128_MI32x32x8x1_SN_1LDSB1_EPS0_GRVW16_LPA16_LPB16_OPLV0_PK0_PAP0_PGR2_PLR17_SU0_SUS128_SRVW4_TT1_32_WG64_4_1_WGM15
    SolutionIndex: 119
    SolutionNameMin: Cijk_Alik_Bljk_I8II_BH_GB_MT32x32x128_MI16x16x16x1_SN_1LDSB0_EPS0_GRVW16_LPA32_LPB32_OPLV0_PK0_PAP0_PGR2_PLR9_SU0_SUS256_SRVW0_TT1_16_WG32_8_1_WGM15
    SolutionIndex: 120
    SolutionNameMin: Cijk_Alik_Bljk_I8II_BH_GB_MT64x64x64_MI32x32x8x1_SN_1LDSB0_EPS0_GRVW8_LPA16_LPB16_OPLV0_PK0_PAP0_PGR2_PLR9_SU0_SUS256_SRVW4_TT1_32_WG64_4_1_WGM15
    SolutionIndex: 121
    SolutionNameMin: Cijk_Alik_Bljk_I8II_BH_GB_MT64x128x64_MI32x32x8x1_SN_1LDSB0_EPS0_GRVW16_LPA16_LPB16_OPLV0_PK0_PAP0_PGR2_PLR9_SU0_SUS256_SRVW4_TT1_64_WG64_4_1_WGM15
    SolutionIndex: 122
    SolutionNameMin: Cijk_Alik_Bljk_I8II_BH_GB_MT32x32x128_MI16x16x16x1_SN_1LDSB0_EPS0_GRVW16_LPA32_LPB32_OPLV0_PK0_PAP0_PGR2_PLR9_SU0_SUS256_SRVW4_TT1_16_WG32_8_1_WGM15
    SolutionIndex: 123
    SolutionNameMin: Cijk_Alik_Bljk_I8II_BH_GB_MT64x64x64_MI32x32x8x1_SN_1LDSB1_EPS1_GRVW16_LPA16_LPB16_OPLV0_PK0_PAP0_PGR1_PLR9_SU0_SUS256_SRVW0_TT1_32_WG64_4_1_WGM15
    SolutionIndex: 124
    SolutionNameMin: Cijk_Alik_Bljk_I8II_BH_GB_MT32x32x128_MI16x16x16x1_SN_1LDSB1_EPS1_GRVW16_LPA32_LPB32_OPLV0_PK0_PAP0_PGR1_PLR9_SU0_SUS256_SRVW0_TT1_16_WG32_8_1_WGM15
    SolutionIndex: 125
    SolutionNameMin: Cijk_Alik_Bljk_I8II_BH_GB_MT32x64x128_MI16x16x16x1_SN_1LDSB1_EPS1_GRVW16_LPA32_LPB32_OPLV0_PK0_PAP0_PGR1_PLR9_SU0_SUS256_SRVW0_TT1_32_WG32_8_1_WGM15
    SolutionIndex: 126
    SolutionNameMin: Cijk_Alik_Bljk_I8II_BH_GB_MT64x64x64_MI32x32x8x1_SN_1LDSB1_EPS0_GRVW8_LPA16_LPB16_OPLV0_PK0_PAP0_PGR2_PLR9_SU0_SUS256_SRVW0_TT1_32_WG64_4_1_WGM15
    SolutionIndex: 127
    SolutionNameMin: Cijk_Alik_Bljk_I8II_BH_GB_MT64x64x64_MI32x32x8x1_SN_1LDSB1_EPS0_GRVW16_LPA16_LPB16_OPLV0_PK0_PAP0_PGR2_PLR9_SU0_SUS256_SRVW0_TT1_32_WG64_4_1_WGM15
    SolutionIndex: 128
    SolutionNameMin: Cijk_Alik_Bljk_I8II_BH_GB_MT32x32x128_MI16x16x16x1_SN_1LDSB1_EPS0_GRVW16_LPA32_LPB32_OPLV0_PK0_PAP0_PGR2_PLR9_SU0_SUS256_SRVW0_TT1_16_WG32_8_1_WGM15
    SolutionIndex: 129
    SolutionNameMin: Cijk_Alik_Bljk_I8II_BH_GB_MT32x64x128_MI16x16x16x1_SN_1LDSB1_EPS0_GRVW16_LPA32_LPB32_OPLV0_PK0_PAP0_PGR2_PLR9_SU0_SUS256_SRVW0_TT1_32_WG32_8_1_WGM15
    SolutionIndex: 130
    SolutionNameMin: Cijk_Alik_Bljk_I8II_BH_GB_MT32x32x128_MI16x16x16x1_SN_1LDSB1_EPS1_GRVW16_LPA32_LPB32_OPLV0_PK0_PAP0_PGR1_PLR9_SU0_SUS256_SRVW4_TT1_16_WG32_8_1_WGM15
    SolutionIndex: 131
    SolutionNameMin: Cijk_Alik_Bljk_I8II_BH_GB_MT64x64x128_MI32x32x8x1_SN_1LDSB1_EPS1_GRVW16_LPA16_LPB16_OPLV0_PK0_PAP0_PGR1_PLR17_SU0_SUS256_SRVW4_TT1_32_WG64_4_1_WGM15
    SolutionIndex: 132
    SolutionNameMin: Cijk_Alik_Bljk_I8II_BH_GB_MT64x64x128_MI32x32x8x1_SN_1LDSB1_EPS0_GRVW16_LPA16_LPB16_OPLV0_PK0_PAP0_PGR2_PLR17_SU0_SUS256_SRVW4_TT1_32_WG64_4_1_WGM15
    SolutionIndex: 133
    SolutionNameMin: Cijk_Alik_Bljk_I8II_BH_GB_MT64x128x64_MI32x32x8x1_SN_1LDSB0_EPS1_GRVW4_LPA16_LPB16_OPLV0_PK0_PAP0_PGR1_PLR9_SU32_SUS128_SRVW4_TT1_64_WG64_4_1_WGM15
    SolutionIndex: 134
    SolutionNameMin: Cijk_Alik_Bljk_I8II_BH_GB_MT64x128x64_MI32x32x8x1_SN_1LDSB0_EPS0_GRVW16_LPA16_LPB16_OPLV0_PK0_PAP0_PGR2_PLR9_SU32_SUS128_SRVW4_TT1_64_WG64_4_1_WGM15
    SolutionIndex: 135
    SolutionNameMin: Cijk_Alik_Bljk_I8II_BH_GB_MT64x64x64_MI32x32x8x1_SN_1LDSB1_EPS1_GRVW4_LPA16_LPB16_OPLV0_PK0_PAP0_PGR1_PLR9_SU32_SUS128_SRVW0_TT1_32_WG64_4_1_WGM15
    SolutionIndex: 136
    SolutionNameMin: Cijk_Alik_Bljk_I8II_BH_GB_MT64x64x128_MI32x32x8x1_SN_1LDSB1_EPS1_GRVW4_LPA16_LPB16_OPLV0_PK0_PAP0_PGR1_PLR17_SU32_SUS128_SRVW4_TT1_32_WG64_4_1_WGM15
    SolutionIndex: 137
    SolutionNameMin: Cijk_Alik_Bljk_I8II_BH_GB_MT64x64x128_MI32x32x8x1_SN_1LDSB1_EPS1_GRVW16_LPA16_LPB16_OPLV0_PK0_PAP0_PGR1_PLR17_SU32_SUS128_SRVW4_TT1_32_WG64_4_1_WGM15
    SolutionIndex: 138
    SolutionNameMin: Cijk_Alik_Bljk_I8II_BH_GB_MT64x64x128_MI32x32x8x1_SN_1LDSB1_EPS0_GRVW16_LPA16_LPB16_OPLV0_PK0_PAP0_PGR2_PLR17_SU32_SUS128_SRVW4_TT1_32_WG64_4_1_WGM15
    SolutionIndex: 139
    SolutionNameMin: Cijk_Alik_Bljk_I8II_BH_GB_MT64x64x128_MI32x32x8x1_SN_1LDSB1_EPS1_GRVW16_LPA16_LPB16_OPLV0_PK0_PAP0_PGR1_PLR17_SU32_SUS256_SRVW4_TT1_32_WG64_4_1_WGM15
- - - [35, 35, 1, 512, 35, 35, 512, 512]
    - [1, 59.0]
  - - [4, 64, 1, 128, 4, 4, 128, 128]
    - [0, 5.0]
  - - [480, 512, 1, 512, 704, 704, 704, 704]
    - [110, 22469.0]
  - - [960, 1024, 1, 1024, 1216, 1216, 1216, 1216]
    - [46, 83331.0]
  - - [1920, 2048, 1, 2048, 2240, 2240, 2240, 2240]
    - [71, 131072.0]
  - - [3840, 4096, 1, 4096, 4288, 4288, 4288, 4288]
    - [3, 142456.0]
  - - [7680, 8192, 1, 8192, 8416, 8416, 8416, 8416]
    - [109, 146466.0]
  - - [32, 32, 8, 32, 32, 32, 32, 32]
    - [9, 46.0]
  - - [32, 32, 8, 64, 32, 32, 64, 64]
    - [82, 102.0]
  - - [32, 32, 8, 128, 32, 32, 128, 128]
    - [112, 257.0]
  - - [32, 32, 8, 256, 32, 32, 256, 256]
    - [93, 477.0]
  - - [32, 32, 8, 512, 32, 32, 512, 512]
    - [26, 794.0]
  - - [32, 32, 8, 1024, 32, 32, 1024, 1024]
    - [112, 1234.0]
  - - [32, 32, 8, 2048, 32, 32, 2048, 2048]
    - [93, 1889.0]
  - - [32, 64, 8, 32, 32, 32, 32, 32]
    - [93, 91.0]
  - - [32, 64, 8, 64, 32, 32, 64, 64]
    - [8, 205.0]
  - - [32, 64, 8, 128, 32, 32, 128, 128]
    - [83, 504.0]
  - - [32, 64, 8, 256, 32, 32, 256, 256]
    - [91, 904.0]
  - - [32, 64, 8, 512, 32, 32, 512, 512]
    - [10, 1565.0]
  - - [32, 64, 8, 1024, 32, 32, 1024, 1024]
    - [128, 2527.0]
  - - [32, 64, 8, 2048, 32, 32, 2048, 2048]
    - [112, 3679.0]
  - - [32, 128, 8, 32, 32, 32, 32, 32]
    - [83, 180.0]
  - - [32, 128, 8, 64, 32, 32, 64, 64]
    - [8, 416.0]
  - - [32, 128, 8, 128, 32, 32, 128, 128]
    - [7, 1008.0]
  - - [32, 128, 8, 256, 32, 32, 256, 256]
    - [54, 1777.0]
  - - [32, 128, 8, 512, 32, 32, 512, 512]
    - [83, 3130.0]
  - - [32, 128, 8, 1024, 32, 32, 1024, 1024]
    - [93, 4934.0]
  - - [32, 128, 8, 2048, 32, 32, 2048, 2048]
    - [112, 7490.0]
  - - [32, 256, 8, 32, 32, 32, 32, 32]
    - [25, 354.0]
  - - [32, 256, 8, 64, 32, 32, 64, 64]
    - [123, 794.0]
  - - [32, 256, 8, 128, 32, 32, 128, 128]
    - [80, 1978.0]
  - - [32, 256, 8, 256, 32, 32, 256, 256]
    - [124, 3495.0]
  - - [32, 256, 8, 512, 32, 32, 512, 512]
    - [112, 6079.0]
  - - [32, 256, 8, 1024, 32, 32, 1024, 1024]
    - [93, 9869.0]
  - - [32, 256, 8, 2048, 32, 32, 2048, 2048]
    - [122, 14463.0]
  - - [32, 512, 8, 32, 32, 32, 32, 32]
    - [25, 672.0]
  - - [32, 512, 8, 64, 32, 32, 64, 64]
    - [79, 1589.0]
  - - [32, 512, 8, 128, 32, 32, 128, 128]
    - [91, 3745.0]
  - - [32, 512, 8, 256, 32, 32, 256, 256]
    - [112, 6764.0]
  - - [32, 512, 8, 512, 32, 32, 512, 512]
    - [112, 11185.0]
  - - [32, 512, 8, 1024, 32, 32, 1024, 1024]
    - [112, 17848.0]
  - - [32, 512, 8, 2048, 32, 32, 2048, 2048]
    - [10, 22982.0]
  - - [32, 1024, 8, 32, 32, 32, 32, 32]
    - [19, 1165.0]
  - - [32, 1024, 8, 64, 32, 32, 64, 64]
    - [8, 2834.0]
  - - [32, 1024, 8, 128, 32, 32, 128, 128]
    - [93, 7108.0]
  - - [32, 1024, 8, 256, 32, 32, 256, 256]
    - [80, 11815.0]
  - - [32, 1024, 8, 512, 32, 32, 512, 512]
    - [59, 17660.0]
  - - [32, 1024, 8, 1024, 32, 32, 1024, 1024]
    - [34, 24672.0]
  - - [32, 1024, 8, 2048, 32, 32, 2048, 2048]
    - [22, 30784.0]
  - - [32, 2048, 8, 32, 32, 32, 32, 32]
    - [51, 2016.0]
  - - [32, 2048, 8, 64, 32, 32, 64, 64]
    - [126, 5178.0]
  - - [32, 2048, 8, 128, 32, 32, 128, 128]
    - [54, 11984.0]
  - - [32, 2048, 8, 256, 32, 32, 256, 256]
    - [80, 17848.0]
  - - [32, 2048, 8, 512, 32, 32, 512, 512]
    - [130, 24855.0]
  - - [32, 2048, 8, 1024, 32, 32, 1024, 1024]
    - [32, 31213.0]
  - - [32, 2048, 8, 2048, 32, 32, 2048, 2048]
    - [65, 35696.0]
  - - [64, 32, 8, 32, 64, 64, 32, 32]
    - [83, 91.0]
  - - [64, 32, 8, 64, 64, 64, 64, 64]
    - [82, 196.0]
  - - [64, 32, 8, 128, 64, 64, 128, 128]
    - [110, 535.0]
  - - [64, 32, 8, 256, 64, 64, 256, 256]
    - [93, 953.0]
  - - [64, 32, 8, 512, 64, 64, 512, 512]
    - [83, 1613.0]
  - - [64, 32, 8, 1024, 64, 64, 1024, 1024]
    - [128, 2589.0]
  - - [64, 32, 8, 2048, 64, 64, 2048, 2048]
    - [42, 3712.0]
  - - [64, 64, 8, 32, 64, 64, 32, 32]
    - [10, 180.0]
  - - [64, 64, 8, 64, 64, 64, 64, 64]
    - [88, 437.0]
  - - [64, 64, 8, 128, 64, 64, 128, 128]
    - [93, 1028.0]
  - - [64, 64, 8, 256, 64, 64, 256, 256]
    - [80, 1777.0]
  - - [64, 64, 8, 512, 64, 64, 512, 512]
    - [83, 3226.0]
  - - [64, 64, 8, 1024, 64, 64, 1024, 1024]
    - [75, 5178.0]
  - - [64, 64, 8, 2048, 64, 64, 2048, 2048]
    - [70, 7767.0]
  - - [64, 128, 8, 32, 64, 64, 32, 32]
    - [112, 369.0]
  - - [64, 128, 8, 64, 64, 64, 64, 64]
    - [88, 874.0]
  - - [64, 128, 8, 128, 64, 64, 128, 128]
    - [83, 2097.0]
  - - [64, 128, 8, 256, 64, 64, 256, 256]
    - [80, 3616.0]
  - - [64, 128, 8, 512, 64, 64, 512, 512]
    - [128, 6554.0]
  - - [64, 128, 8, 1024, 64, 64, 1024, 1024]
    - [93, 10356.0]
  - - [64, 128, 8, 2048, 64, 64, 2048, 2048]
    - [42, 15534.0]
  - - [64, 256, 8, 32, 64, 64, 32, 32]
    - [25, 681.0]
  - - [64, 256, 8, 64, 64, 64, 64, 64]
    - [17, 1719.0]
  - - [64, 256, 8, 128, 64, 64, 128, 128]
    - [112, 4033.0]
  - - [64, 256, 8, 256, 64, 64, 256, 256]
    - [124, 6876.0]
  - - [64, 256, 8, 512, 64, 64, 512, 512]
    - [83, 11815.0]
  - - [64, 256, 8, 1024, 64, 64, 1024, 1024]
    - [30, 18641.0]
  - - [64, 256, 8, 2048, 64, 64, 2048, 2048]
    - [107, 27060.0]
  - - [64, 512, 8, 32, 64, 64, 32, 32]
    - [25, 1192.0]
  - - [64, 512, 8, 64, 64, 64, 64, 64]
    - [46, 3438.0]
  - - [64, 512, 8, 128, 64, 64, 128, 128]
    - [20, 7358.0]
  - - [64, 512, 8, 256, 64, 64, 256, 256]
    - [128, 12710.0]
  - - [64, 512, 8, 512, 64, 64, 512, 512]
    - [124, 19507.0]
  - - [64, 512, 8, 1024, 64, 64, 1024, 1024]
    - [93, 28926.0]
  - - [64, 512, 8, 2048, 64, 64, 2048, 2048]
    - [93, 38791.0]
  - - [64, 1024, 8, 32, 64, 64, 32, 32]
    - [44, 2208.0]
  - - [64, 1024, 8, 64, 64, 64, 64, 64]
    - [15, 6355.0]
  - - [64, 1024, 8, 128, 64, 64, 128, 128]
    - [20, 12520.0]
  - - [64, 1024, 8, 256, 64, 64, 256, 256]
    - [129, 20214.0]
  - - [64, 1024, 8, 512, 64, 64, 512, 512]
    - [111, 30784.0]
  - - [64, 1024, 8, 1024, 64, 64, 1024, 1024]
    - [113, 43296.0]
  - - [64, 1024, 8, 2048, 64, 64, 2048, 2048]
    - [125, 53687.0]
  - - [64, 2048, 8, 32, 64, 64, 32, 32]
    - [51, 3495.0]
  - - [64, 2048, 8, 64, 64, 64, 64, 64]
    - [108, 10107.0]
  - - [64, 2048, 8, 128, 64, 64, 128, 128]
    - [62, 20713.0]
  - - [64, 2048, 8, 256, 64, 64, 256, 256]
    - [62, 31655.0]
  - - [64, 2048, 8, 512, 64, 64, 512, 512]
    - [113, 42474.0]
  - - [64, 2048, 8, 1024, 64, 64, 1024, 1024]
    - [129, 55462.0]
  - - [64, 2048, 8, 2048, 64, 64, 2048, 2048]
    - [35, 61568.0]
  - - [128, 32, 8, 32, 128, 128, 32, 32]
    - [25, 185.0]
  - - [128, 32, 8, 64, 128, 128, 64, 64]
    - [8, 386.0]
  - - [128, 32, 8, 128, 128, 128, 128, 128]
    - [80, 1049.0]
  - - [128, 32, 8, 256, 128, 128, 256, 256]
    - [91, 1808.0]
  - - [128, 32, 8, 512, 128, 128, 512, 512]
    - [93, 3277.0]
  - - [128, 32, 8, 1024, 128, 128, 1024, 1024]
    - [112, 5377.0]
  - - [128, 32, 8, 2048, 128, 128, 2048, 2048]
    - [18, 7696.0]
  - - [128, 64, 8, 32, 128, 128, 32, 32]
    - [93, 359.0]
  - - [128, 64, 8, 64, 128, 128, 64, 64]
    - [88, 859.0]
  - - [128, 64, 8, 128, 128, 128, 128, 128]
    - [93, 2056.0]
  - - [128, 64, 8, 256, 128, 128, 256, 256]
    - [91, 3616.0]
  - - [128, 64, 8, 512, 128, 128, 512, 512]
    - [112, 6657.0]
  - - [128, 64, 8, 1024, 128, 128, 1024, 1024]
    - [83, 10486.0]
  - - [128, 64, 8, 2048, 128, 128, 2048, 2048]
    - [128, 15828.0]
  - - [128, 128, 8, 32, 128, 128, 32, 32]
    - [19, 681.0]
  - - [128, 128, 8, 64, 128, 128, 64, 64]
    - [88, 1719.0]
  - - [128, 128, 8, 128, 128, 128, 128, 128]
    - [91, 3884.0]
  - - [128, 128, 8, 256, 128, 128, 256, 256]
    - [112, 6991.0]
  - - [128, 128, 8, 512, 128, 128, 512, 512]
    - [112, 12157.0]
  - - [128, 128, 8, 1024, 128, 128, 1024, 1024]
    - [83, 20460.0]
  - - [128, 128, 8, 2048, 128, 128, 2048, 2048]
    - [119, 29434.0]
  - - [128, 256, 8, 32, 128, 128, 32, 32]
    - [76, 1178.0]
  - - [128, 256, 8, 64, 128, 128, 64, 64]
    - [74, 3277.0]
  - - [128, 256, 8, 128, 128, 128, 128, 128]
    - [80, 7232.0]
  - - [128, 256, 8, 256, 128, 128, 256, 256]
    - [112, 12906.0]
  - - [128, 256, 8, 512, 128, 128, 512, 512]
    - [54, 21237.0]
  - - [128, 256, 8, 1024, 128, 128, 1024, 1024]
    - [26, 31359.0]
  - - [128, 256, 8, 2048, 128, 128, 2048, 2048]
    - [49, 40427.0]
  - - [128, 512, 8, 32, 128, 128, 32, 32]
    - [15, 2140.0]
  - - [128, 512, 8, 64, 128, 128, 64, 64]
    - [88, 6355.0]
  - - [128, 512, 8, 128, 128, 128, 128, 128]
    - [23, 12710.0]
  - - [128, 512, 8, 256, 128, 128, 256, 256]
    - [54, 20972.0]
  - - [128, 512, 8, 512, 128, 128, 512, 512]
    - [35, 31655.0]
  - - [128, 512, 8, 1024, 128, 128, 1024, 1024]
    - [81, 45965.0]
  - - [128, 512, 8, 2048, 128, 128, 2048, 2048]
    - [22, 59388.0]
  - - [128, 1024, 8, 32, 128, 128, 32, 32]
    - [77, 3466.0]
  - - [128, 1024, 8, 64, 128, 128, 64, 64]
    - [13, 10356.0]
  - - [128, 1024, 8, 128, 128, 128, 128, 128]
    - [23, 20460.0]
  - - [128, 1024, 8, 256, 128, 128, 256, 256]
    - [38, 32264.0]
  - - [128, 1024, 8, 512, 128, 128, 512, 512]
    - [131, 47935.0]
  - - [128, 1024, 8, 1024, 128, 128, 1024, 1024]
    - [118, 66444.0]
  - - [128, 1024, 8, 2048, 128, 128, 2048, 2048]
    - [37, 79419.0]
  - - [128, 2048, 8, 32, 128, 128, 32, 32]
    - [52, 4739.0]
  - - [128, 2048, 8, 64, 128, 128, 64, 64]
    - [92, 14218.0]
  - - [128, 2048, 8, 128, 128, 128, 128, 128]
    - [23, 29178.0]
  - - [128, 2048, 8, 256, 128, 128, 256, 256]
    - [87, 43862.0]
  - - [128, 2048, 8, 512, 128, 128, 512, 512]
    - [38, 66115.0]
  - - [128, 2048, 8, 1024, 128, 128, 1024, 1024]
    - [117, 82596.0]
  - - [128, 2048, 8, 2048, 128, 128, 2048, 2048]
    - [131, 90995.0]
  - - [256, 32, 8, 32, 256, 256, 32, 32]
    - [112, 364.0]
  - - [256, 32, 8, 64, 256, 256, 64, 64]
    - [8, 771.0]
  - - [256, 32, 8, 128, 256, 256, 128, 128]
    - [80, 2056.0]
  - - [256, 32, 8, 256, 256, 256, 256, 256]
    - [83, 3616.0]
  - - [256, 32, 8, 512, 256, 256, 512, 512]
    - [128, 6355.0]
  - - [256, 32, 8, 1024, 256, 256, 1024, 1024]
    - [93, 10618.0]
  - - [256, 32, 8, 2048, 256, 256, 2048, 2048]
    - [75, 15828.0]
  - - [256, 64, 8, 32, 256, 256, 32, 32]
    - [53, 672.0]
  - - [256, 64, 8, 64, 256, 256, 64, 64]
    - [46, 1719.0]
  - - [256, 64, 8, 128, 256, 256, 128, 128]
    - [128, 3957.0]
  - - [256, 64, 8, 256, 256, 256, 256, 256]
    - [128, 7109.0]
  - - [256, 64, 8, 512, 256, 256, 512, 512]
    - [93, 11984.0]
  - - [256, 64, 8, 1024, 256, 256, 1024, 1024]
    - [128, 19738.0]
  - - [256, 64, 8, 2048, 256, 256, 2048, 2048]
    - [122, 27280.0]
  - - [256, 128, 8, 32, 256, 256, 32, 32]
    - [53, 1192.0]
  - - [256, 128, 8, 64, 256, 256, 64, 64]
    - [76, 3383.0]
  - - [256, 128, 8, 128, 256, 256, 128, 128]
    - [128, 7358.0]
  - - [256, 128, 8, 256, 256, 256, 256, 256]
    - [124, 13107.0]
  - - [256, 128, 8, 512, 256, 256, 512, 512]
    - [80, 21789.0]
  - - [256, 128, 8, 1024, 256, 256, 1024, 1024]
    - [124, 31359.0]
  - - [256, 128, 8, 2048, 256, 256, 2048, 2048]
    - [41, 41171.0]
  - - [256, 256, 8, 32, 256, 256, 32, 32]
    - [46, 2140.0]
  - - [256, 256, 8, 64, 256, 256, 64, 64]
    - [46, 6260.0]
  - - [256, 256, 8, 128, 256, 256, 128, 128]
    - [22, 12520.0]
  - - [256, 256, 8, 256, 256, 256, 256, 256]
    - [55, 20713.0]
  - - [256, 256, 8, 512, 256, 256, 512, 512]
    - [23, 31957.0]
  - - [256, 256, 8, 1024, 256, 256, 1024, 1024]
    - [104, 44739.0]
  - - [256, 256, 8, 2048, 256, 256, 2048, 2048]
    - [115, 56394.0]
  - - [256, 512, 8, 32, 256, 256, 32, 32]
    - [89, 3438.0]
  - - [256, 512, 8, 64, 256, 256, 64, 64]
    - [13, 10230.0]
  - - [256, 512, 8, 128, 256, 256, 128, 128]
    - [72, 20214.0]
  - - [256, 512, 8, 256, 256, 256, 256, 256]
    - [39, 32897.0]
  - - [256, 512, 8, 512, 256, 256, 512, 512]
    - [118, 47935.0]
  - - [256, 512, 8, 1024, 256, 256, 1024, 1024]
    - [97, 65154.0]
  - - [256, 512, 8, 2048, 256, 256, 2048, 2048]
    - [61, 82342.0]
  - - [256, 1024, 8, 32, 256, 256, 32, 32]
    - [89, 4793.0]
  - - [256, 1024, 8, 64, 256, 256, 64, 64]
    - [15, 14589.0]
  - - [256, 1024, 8, 128, 256, 256, 128, 128]
    - [38, 29178.0]
  - - [256, 1024, 8, 256, 256, 256, 256, 256]
    - [86, 45652.0]
  - - [256, 1024, 8, 512, 256, 256, 512, 512]
    - [85, 68827.0]
  - - [256, 1024, 8, 1024, 256, 256, 1024, 1024]
    - [131, 90382.0]
  - - [256, 1024, 8, 2048, 256, 256, 2048, 2048]
    - [131, 99237.0]
  - - [256, 2048, 8, 32, 256, 256, 32, 32]
    - [89, 6057.0]
  - - [256, 2048, 8, 64, 256, 256, 64, 64]
    - [76, 18957.0]
  - - [256, 2048, 8, 128, 256, 256, 128, 128]
    - [95, 34951.0]
  - - [256, 2048, 8, 256, 256, 256, 256, 256]
    - [117, 52842.0]
  - - [256, 2048, 8, 512, 256, 256, 512, 512]
    - [117, 80130.0]
  - - [256, 2048, 8, 1024, 256, 256, 1024, 1024]
    - [131, 97613.0]
  - - [256, 2048, 8, 2048, 256, 256, 2048, 2048]
    - [132, 101584.0]
  - - [512, 32, 8, 32, 512, 512, 32, 32]
    - [114, 664.0]
  - - [512, 32, 8, 64, 512, 512, 64, 64]
    - [106, 1565.0]
  - - [512, 32, 8, 128, 512, 512, 128, 128]
    - [91, 3813.0]
  - - [512, 32, 8, 256, 512, 512, 256, 256]
    - [93, 6991.0]
  - - [512, 32, 8, 512, 512, 512, 512, 512]
    - [128, 11491.0]
  - - [512, 32, 8, 1024, 512, 512, 1024, 1024]
    - [93, 17660.0]
  - - [512, 32, 8, 2048, 512, 512, 2048, 2048]
    - [99, 23797.0]
  - - [512, 64, 8, 32, 512, 512, 32, 32]
    - [90, 1178.0]
  - - [512, 64, 8, 64, 512, 512, 64, 64]
    - [120, 3329.0]
  - - [512, 64, 8, 128, 512, 512, 128, 128]
    - [91, 7109.0]
  - - [512, 64, 8, 256, 512, 512, 256, 256]
    - [54, 12710.0]
  - - [512, 64, 8, 512, 512, 512, 512, 512]
    - [11, 19973.0]
  - - [512, 64, 8, 1024, 512, 512, 1024, 1024]
    - [43, 29178.0]
  - - [512, 64, 8, 2048, 512, 512, 2048, 2048]
    - [43, 39017.0]
  - - [512, 128, 8, 32, 512, 512, 32, 32]
    - [46, 2097.0]
  - - [512, 128, 8, 64, 512, 512, 64, 64]
    - [46, 6079.0]
  - - [512, 128, 8, 128, 512, 512, 128, 128]
    - [50, 12906.0]
  - - [512, 128, 8, 256, 512, 512, 256, 256]
    - [21, 20713.0]
  - - [512, 128, 8, 512, 512, 512, 512, 512]
    - [23, 32897.0]
  - - [512, 128, 8, 1024, 512, 512, 1024, 1024]
    - [58, 45040.0]
  - - [512, 128, 8, 2048, 512, 512, 2048, 2048]
    - [23, 56394.0]
  - - [512, 256, 8, 32, 512, 512, 32, 32]
    - [51, 3303.0]
  - - [512, 256, 8, 64, 512, 512, 64, 64]
    - [47, 10106.0]
  - - [512, 256, 8, 128, 512, 512, 128, 128]
    - [48, 19973.0]
  - - [512, 256, 8, 256, 512, 512, 256, 256]
    - [61, 32577.0]
  - - [512, 256, 8, 512, 512, 512, 512, 512]
    - [40, 49345.0]
  - - [512, 256, 8, 1024, 512, 512, 1024, 1024]
    - [40, 63310.0]
  - - [512, 256, 8, 2048, 512, 512, 2048, 2048]
    - [40, 78034.0]
  - - [512, 512, 8, 32, 512, 512, 32, 32]
    - [135, 4534.0]
  - - [512, 512, 8, 64, 512, 512, 64, 64]
    - [16, 13865.0]
  - - [512, 512, 8, 128, 512, 512, 128, 128]
    - [31, 29434.0]
  - - [512, 512, 8, 256, 512, 512, 256, 256]
    - [40, 45965.0]
  - - [512, 512, 8, 512, 512, 512, 512, 512]
    - [72, 66444.0]
  - - [512, 512, 8, 1024, 512, 512, 1024, 1024]
    - [117, 87154.0]
  - - [512, 512, 8, 2048, 512, 512, 2048, 2048]
    - [131, 100350.0]
  - - [512, 1024, 8, 32, 512, 512, 32, 32]
    - [51, 5907.0]
  - - [512, 1024, 8, 64, 512, 512, 64, 64]
    - [13, 17848.0]
  - - [512, 1024, 8, 128, 512, 512, 128, 128]
    - [56, 35320.0]
  - - [512, 1024, 8, 256, 512, 512, 256, 256]
    - [62, 55007.0]
  - - [512, 1024, 8, 512, 512, 512, 512, 512]
    - [61, 81344.0]
  - - [512, 1024, 8, 1024, 512, 512, 1024, 1024]
    - [132, 99237.0]
  - - [512, 1024, 8, 2048, 512, 512, 2048, 2048]
    - [61, 100632.0]
  - - [512, 2048, 8, 32, 512, 512, 32, 32]
    - [47, 7005.0]
  - - [512, 2048, 8, 64, 512, 512, 64, 64]
    - [45, 19452.0]
  - - [512, 2048, 8, 128, 512, 512, 128, 128]
    - [138, 38129.0]
  - - [512, 2048, 8, 256, 512, 512, 256, 256]
    - [61, 59256.0]
  - - [512, 2048, 8, 512, 512, 512, 512, 512]
    - [38, 84547.0]
  - - [512, 2048, 8, 1024, 512, 512, 1024, 1024]
    - [118, 101296.0]
  - - [512, 2048, 8, 2048, 512, 512, 2048, 2048]
    - [61, 107914.0]
  - - [1024, 32, 8, 32, 1024, 1024, 32, 32]
    - [25, 1128.0]
  - - [1024, 32, 8, 64, 1024, 1024, 64, 64]
    - [63, 2796.0]
  - - [1024, 32, 8, 128, 1024, 1024, 128, 128]
    - [20, 6991.0]
  - - [1024, 32, 8, 256, 1024, 1024, 256, 256]
    - [54, 11336.0]
  - - [1024, 32, 8, 512, 1024, 1024, 512, 512]
    - [93, 17660.0]
  - - [1024, 32, 8, 1024, 1024, 1024, 1024, 1024]
    - [93, 23630.0]
  - - [1024, 32, 8, 2048, 1024, 1024, 2048, 2048]
    - [83, 28802.0]
  - - [1024, 64, 8, 32, 1024, 1024, 32, 32]
    - [46, 2118.0]
  - - [1024, 64, 8, 64, 1024, 1024, 64, 64]
    - [76, 6355.0]
  - - [1024, 64, 8, 128, 1024, 1024, 128, 128]
    - [93, 12520.0]
  - - [1024, 64, 8, 256, 1024, 1024, 256, 256]
    - [27, 19973.0]
  - - [1024, 64, 8, 512, 1024, 1024, 512, 512]
    - [23, 30229.0]
  - - [1024, 64, 8, 1024, 1024, 1024, 1024, 1024]
    - [33, 41943.0]
  - - [1024, 64, 8, 2048, 1024, 1024, 2048, 2048]
    - [31, 51033.0]
  - - [1024, 128, 8, 32, 1024, 1024, 32, 32]
    - [12, 3277.0]
  - - [1024, 128, 8, 64, 1024, 1024, 64, 64]
    - [121, 9754.0]
  - - [1024, 128, 8, 128, 1024, 1024, 128, 128]
    - [61, 20972.0]
  - - [1024, 128, 8, 256, 1024, 1024, 256, 256]
    - [62, 33222.0]
  - - [1024, 128, 8, 512, 1024, 1024, 512, 512]
    - [66, 48630.0]
  - - [1024, 128, 8, 1024, 1024, 1024, 1024, 1024]
    - [62, 62719.0]
  - - [1024, 128, 8, 2048, 1024, 1024, 2048, 2048]
    - [38, 72747.0]
  - - [1024, 256, 8, 32, 1024, 1024, 32, 32]
    - [77, 4462.0]
  - - [1024, 256, 8, 64, 1024, 1024, 64, 64]
    - [76, 14463.0]
  - - [1024, 256, 8, 128, 1024, 1024, 128, 128]
    - [40, 29178.0]
  - - [1024, 256, 8, 256, 1024, 1024, 256, 256]
    - [73, 42207.0]
  - - [1024, 256, 8, 512, 1024, 1024, 512, 512]
    - [85, 62138.0]
  - - [1024, 256, 8, 1024, 1024, 1024, 1024, 1024]
    - [61, 80370.0]
  - - [1024, 256, 8, 2048, 1024, 1024, 2048, 2048]
    - [38, 92724.0]
  - - [1024, 512, 8, 32, 1024, 1024, 32, 32]
    - [51, 5785.0]
  - - [1024, 512, 8, 64, 1024, 1024, 64, 64]
    - [14, 17848.0]
  - - [1024, 512, 8, 128, 1024, 1024, 128, 128]
    - [68, 34592.0]
  - - [1024, 512, 8, 256, 1024, 1024, 256, 256]
    - [96, 52225.0]
  - - [1024, 512, 8, 512, 1024, 1024, 512, 512]
    - [61, 76260.0]
  - - [1024, 512, 8, 1024, 1024, 1024, 1024, 1024]
    - [138, 93695.0]
  - - [1024, 512, 8, 2048, 1024, 1024, 2048, 2048]
    - [139, 102849.0]
  - - [1024, 1024, 8, 32, 1024, 1024, 32, 32]
    - [47, 6976.0]
  - - [1024, 1024, 8, 64, 1024, 1024, 64, 64]
    - [98, 19622.0]
  - - [1024, 1024, 8, 128, 1024, 1024, 128, 128]
    - [38, 38458.0]
  - - [1024, 1024, 8, 256, 1024, 1024, 256, 256]
    - [101, 58867.0]
  - - [1024, 1024, 8, 512, 1024, 1024, 512, 512]
    - [38, 82978.0]
  - - [1024, 1024, 8, 1024, 1024, 1024, 1024, 1024]
    - [133, 100820.0]
  - - [1024, 1024, 8, 2048, 1024, 1024, 2048, 2048]
    - [28, 109175.0]
  - - [1024, 2048, 8, 32, 1024, 1024, 32, 32]
    - [57, 7831.0]
  - - [1024, 2048, 8, 64, 1024, 1024, 64, 64]
    - [6, 21004.0]
  - - [1024, 2048, 8, 128, 1024, 1024, 128, 128]
    - [116, 41234.0]
  - - [1024, 2048, 8, 256, 1024, 1024, 256, 256]
    - [101, 64996.0]
  - - [1024, 2048, 8, 512, 1024, 1024, 512, 512]
    - [67, 88739.0]
  - - [1024, 2048, 8, 1024, 1024, 1024, 1024, 1024]
    - [69, 102164.0]
  - - [1024, 2048, 8, 2048, 1024, 1024, 2048, 2048]
    - [29, 117348.0]
  - - [2048, 32, 8, 32, 2048, 2048, 32, 32]
    - [89, 1840.0]
  - - [2048, 32, 8, 64, 2048, 2048, 64, 64]
    - [82, 4821.0]
  - - [2048, 32, 8, 128, 2048, 2048, 128, 128]
    - [93, 11984.0]
  - - [2048, 32, 8, 256, 2048, 2048, 256, 256]
    - [64, 17660.0]
  - - [2048, 32, 8, 512, 2048, 2048, 512, 512]
    - [110, 25811.0]
  - - [2048, 32, 8, 1024, 2048, 2048, 1024, 1024]
    - [49, 31359.0]
  - - [2048, 32, 8, 2048, 2048, 2048, 2048, 2048]
    - [33, 33723.0]
  - - [2048, 64, 8, 32, 2048, 2048, 32, 32]
    - [51, 3202.0]
  - - [2048, 64, 8, 64, 2048, 2048, 64, 64]
    - [46, 9218.0]
  - - [2048, 64, 8, 128, 2048, 2048, 128, 128]
    - [31, 19065.0]
  - - [2048, 64, 8, 256, 2048, 2048, 256, 256]
    - [62, 30504.0]
  - - [2048, 64, 8, 512, 2048, 2048, 512, 512]
    - [38, 39709.0]
  - - [2048, 64, 8, 1024, 2048, 2048, 1024, 1024]
    - [61, 50458.0]
  - - [2048, 64, 8, 2048, 2048, 2048, 2048, 2048]
    - [38, 57235.0]
  - - [2048, 128, 8, 32, 2048, 2048, 32, 32]
    - [24, 4415.0]
  - - [2048, 128, 8, 64, 2048, 2048, 64, 64]
    - [127, 13981.0]
  - - [2048, 128, 8, 128, 2048, 2048, 128, 128]
    - [31, 26631.0]
  - - [2048, 128, 8, 256, 2048, 2048, 256, 256]
    - [62, 38348.0]
  - - [2048, 128, 8, 512, 2048, 2048, 512, 512]
    - [85, 55924.0]
  - - [2048, 128, 8, 1024, 2048, 2048, 1024, 1024]
    - [61, 72355.0]
  - - [2048, 128, 8, 2048, 2048, 2048, 2048, 2048]
    - [38, 82978.0]
  - - [2048, 256, 8, 32, 2048, 2048, 32, 32]
    - [51, 5785.0]
  - - [2048, 256, 8, 64, 2048, 2048, 64, 64]
    - [46, 17207.0]
  - - [2048, 256, 8, 128, 2048, 2048, 128, 128]
    - [23, 33059.0]
  - - [2048, 256, 8, 256, 2048, 2048, 256, 256]
    - [86, 49895.0]
  - - [2048, 256, 8, 512, 2048, 2048, 512, 512]
    - [61, 73544.0]
  - - [2048, 256, 8, 1024, 2048, 2048, 1024, 1024]
    - [137, 91459.0]
  - - [2048, 256, 8, 2048, 2048, 2048, 2048, 2048]
    - [136, 99054.0]
  - - [2048, 512, 8, 32, 2048, 2048, 32, 32]
    - [103, 6976.0]
  - - [2048, 512, 8, 64, 2048, 2048, 64, 64]
    - [46, 19508.0]
  - - [2048, 512, 8, 128, 2048, 2048, 128, 128]
    - [60, 37077.0]
  - - [2048, 512, 8, 256, 2048, 2048, 256, 256]
    - [101, 58483.0]
  - - [2048, 512, 8, 512, 2048, 2048, 512, 512]
    - [72, 82216.0]
  - - [2048, 512, 8, 1024, 2048, 2048, 1024, 1024]
    - [137, 98508.0]
  - - [2048, 512, 8, 2048, 2048, 2048, 2048, 2048]
    - [133, 108131.0]
  - - [2048, 1024, 8, 32, 2048, 2048, 32, 32]
    - [84, 7822.0]
  - - [2048, 1024, 8, 64, 2048, 2048, 64, 64]
    - [4, 20617.0]
  - - [2048, 1024, 8, 128, 2048, 2048, 128, 128]
    - [36, 41425.0]
  - - [2048, 1024, 8, 256, 2048, 2048, 256, 256]
    - [5, 62718.0]
  - - [2048, 1024, 8, 512, 2048, 2048, 512, 512]
    - [105, 87796.0]
  - - [2048, 1024, 8, 1024, 2048, 2048, 1024, 1024]
    - [100, 101728.0]
  - - [2048, 1024, 8, 2048, 2048, 2048, 2048, 2048]
    - [78, 116268.0]
  - - [2048, 2048, 8, 32, 2048, 2048, 32, 32]
    - [94, 8721.0]
  - - [2048, 2048, 8, 64, 2048, 2048, 64, 64]
    - [2, 22130.0]
  - - [2048, 2048, 8, 128, 2048, 2048, 128, 128]
    - [102, 43826.0]
  - - [2048, 2048, 8, 256, 2048, 2048, 256, 256]
    - [67, 66692.0]
  - - [2048, 2048, 8, 512, 2048, 2048, 512, 512]
    - [67, 91969.0]
  - - [2048, 2048, 8, 1024, 2048, 2048, 1024, 1024]
    - [134, 108431.0]
  - - [2048, 2048, 8, 2048, 2048, 2048, 2048, 2048]
    - [133, 121515.0]
- null
