library/src/blas3/Tensile/Logic/asm_full/arcturus/arcturus_Cijk_Ailk_Bljk_DB.yaml
- {MinimumRequiredVersion: 4.7.2}
- arcturus
- gfx908
- [Device 7380, Device 7388, Device 738c, Device 7390]
    SolutionIndex: 0
    SolutionNameMin: Cijk_Ailk_Bljk_DB_MT32x64x4_SN_AF0EM1_AF1EM1_AMAS3_ASEM1_EPS1_FL1_GRVW2_GSU1_IU1_LPB0_LRVW2_NLCA1_PK0_PGR1_PLR1_SU0_SUM0_SUS256_SVW2_SNLL1_TT4_4_USFGRO0_VS1_VW2_WG8_16_1_WGM8
    SolutionIndex: 1
    SolutionNameMin: Cijk_Ailk_Bljk_DB_MT32x64x8_SE_AF0EM1_AF1EM1_AMAS3_ASEM1_EPS1_FL1_GRVW2_GSU1_IU1_LPB0_LRVW2_NLCA1_PK0_PGR1_PLR1_SU0_SUM0_SUS256_SVW2_SNLL1_TT4_4_USFGRO0_VS1_VW2_WG8_16_1_WGM1
    SolutionIndex: 2
    SolutionNameMin: Cijk_Ailk_Bljk_DB_MT32x32x16_SE_AF0EM1_AF1EM1_AMAS3_ASEM1_EPS0_FL0_GRVW2_GSU1_IU2_LPB2_LRVW2_NLCA1_PK0_PGR0_PLR1_SU32_SUM1_SUS128_SVW4_SNLL0_TT2_4_USFGROn1_VSn1_VW2_WG16_8_1_WGM8
    SolutionIndex: 3
    SolutionNameMin: Cijk_Ailk_Bljk_DB_MT64x64x8_SN_AF0EM1_AF1EM1_AMAS3_ASEM1_EPS1_FL1_GRVW2_GSU1_IU1_LPB0_LRVW2_NLCA1_PK0_PGR1_PLR1_SU0_SUM0_SUS256_SVW2_SNLL0_TT4_4_USFGRO0_VS1_VW2_WG16_16_1_WGM1
    SolutionIndex: 4
    SolutionNameMin: Cijk_Ailk_Bljk_DB_MT64x48x4_SN_AF0EM1_AF1EM1_AMAS3_ASEM1_EPS1_FL1_GRVW2_GSU1_IU1_LPB0_LRVW2_NLCA1_PK0_PGR1_PLR1_SU0_SUM0_SUS256_SVW2_SNLL1_TT4_6_USFGRO0_VS1_VW2_WG16_8_1_WGM8
    SolutionIndex: 5
    SolutionNameMin: Cijk_Ailk_Bljk_DB_MT32x64x8_SN_AF0EM2_AF1EM2_AMAS3_ASEM2_EPS1_FL0_GRVW2_GSU1_IU1_LPB0_LRVW2_NLCA1_PK0_PGR1_PLR1_SU32_SUM0_SUS256_SVW2_SNLL1_TT4_4_USFGRO1_VS1_VW2_WG8_16_1_WGM8
    SolutionIndex: 6
    SolutionNameMin: Cijk_Ailk_Bljk_DB_MT128x64x4_SN_AF0EM1_AF1EM1_AMAS3_ASEM1_EPS1_FL1_GRVW2_GSU1_IU1_LPB0_LRVW2_NLCA1_PK0_PGR1_PLR1_SU32_SUM0_SUS256_SVW2_SNLL0_TT8_4_USFGRO0_VS1_VW2_WG16_16_1_WGM1
    SolutionIndex: 7
    SolutionNameMin: Cijk_Ailk_Bljk_DB_MT64x96x8_SN_AF0EM1_AF1EM1_AMAS3_ASEM1_EPS1_FL1_GRVW2_GSU1_IU1_LPB0_LRVW2_NLCA1_PK2_PGR1_PLR1_SU0_SUM0_SUS256_SVW2_SNLL0_TT4_6_USFGRO0_VS1_VW2_WG16_16_1_WGM8
    SolutionIndex: 8
    SolutionNameMin: Cijk_Ailk_Bljk_DB_MT64x32x8_SN_AF0EM2_AF1EM2_AMAS3_ASEM2_EPS1_FL0_GRVW2_GSU1_IU1_LPB0_LRVW2_NLCA1_PK0_PGR1_PLR1_SU32_SUM0_SUS256_SVW2_SNLL1_TT4_4_USFGRO1_VS1_VW2_WG16_8_1_WGM8
    SolutionIndex: 9
    SolutionNameMin: Cijk_Ailk_Bljk_DB_MT64x64x8_SN_AF0EM2_AF1EM2_AMAS3_ASEM2_EPS1_FL0_GRVW2_GSU1_IU1_LPB0_LRVW2_NLCA1_PK0_PGR1_PLR1_SU32_SUM0_SUS256_SVW2_SNLL1_TT4_4_USFGRO1_VS1_VW2_WG16_16_1_WGM8
    SolutionIndex: 10
    SolutionNameMin: Cijk_Ailk_Bljk_DB_MT64x48x4_SE_AF0EM1_AF1EM1_AMAS3_ASEM1_EPS1_FL1_GRVW2_GSU1_IU1_LPB0_LRVW2_NLCA1_PK0_PGR1_PLR0_SU0_SUM0_SUS256_SVW4_SNLL0_TT4_6_USFGROn1_VSn1_VW2_WG16_8_1_WGM8
    SolutionIndex: 11
    SolutionNameMin: Cijk_Ailk_Bljk_DB_MT128x64x4_SN_AF0EM1_AF1EM1_AMAS3_ASEM1_EPS1_FL1_GRVW2_GSU1_IU1_LPB0_LRVW2_NLCA1_PK4_PGR1_PLR1_SU32_SUM0_SUS256_SVW2_SNLL0_TT8_4_USFGRO0_VS1_VW2_WG16_16_1_WGM1
    SolutionIndex: 12
    SolutionNameMin: Cijk_Ailk_Bljk_DB_MT64x48x4_SN_AF0EM1_AF1EM1_AMAS3_ASEM1_EPS1_FL1_GRVW2_GSU1_IU1_LPB0_LRVW2_NLCA1_PK0_PGR1_PLR0_SU0_SUM0_SUS256_SVW2_SNLL0_TT4_6_USFGRO0_VS1_VW2_WG16_8_1_WGM8
    SolutionIndex: 13
    SolutionNameMin: Cijk_Ailk_Bljk_DB_MT64x64x8_SN_AF0EM1_AF1EM1_AMAS3_ASEM1_EPS1_FL1_GRVW2_GSU1_IU1_LPB0_LRVW2_NLCA1_PK0_PGR1_PLR1_SU32_SUM0_SUS256_SVW2_SNLL1_TT4_4_USFGRO0_VS1_VW2_WG16_16_1_WGM8
    SolutionIndex: 14
    SolutionNameMin: Cijk_Ailk_Bljk_DB_MT64x64x8_SN_AF0EM1_AF1EM1_AMAS3_ASEM1_EPS1_FL1_GRVW2_GSU1_IU1_LPB0_LRVW2_NLCA1_PK0_PGR1_PLR1_SU32_SUM0_SUS256_SVW2_SNLL0_TT4_4_USFGRO0_VS1_VW2_WG16_16_1_WGM8
    SolutionIndex: 15
    SolutionNameMin: Cijk_Ailk_Bljk_DB_MT64x64x8_SE_AF0EM1_AF1EM1_AMAS3_ASEM1_EPS1_FL1_GRVW2_GSU1_IU1_LPB0_LRVW2_NLCA1_PK0_PGR1_PLR1_SU32_SUM0_SUS256_SVW2_SNLL0_TT4_4_USFGRO0_VS1_VW2_WG16_16_1_WGM8
    SolutionIndex: 16
    SolutionNameMin: Cijk_Ailk_Bljk_DB_MT32x32x16_SE_AF0EM1_AF1EM1_AMAS3_ASEM1_EPS0_FL0_GRVW2_GSU1_IU2_LPB2_LRVW2_NLCA1_PK0_PGR0_PLR1_SU16_SUM1_SUS128_SVW4_SNLL0_TT2_4_USFGROn1_VSn1_VW2_WG16_8_1_WGM8
    SolutionIndex: 17
    SolutionNameMin: Cijk_Ailk_Bljk_DB_MT64x96x8_SN_AF0EM1_AF1EM1_AMAS3_ASEM1_EPS1_FL1_GRVW2_GSU1_IU1_LPB0_LRVW2_NLCA1_PK2_PGR1_PLR1_SU32_SUM0_SUS256_SVW2_SNLL0_TT4_6_USFGRO0_VS1_VW2_WG16_16_1_WGM1
    SolutionIndex: 18
    SolutionNameMin: Cijk_Ailk_Bljk_DB_MT128x64x4_SN_AF0EM1_AF1EM1_AMAS3_ASEM1_EPS1_FL1_GRVW2_GSU1_IU1_LPB0_LRVW2_NLCA1_PK0_PGR1_PLR1_SU32_SUM0_SUS256_SVW2_SNLL0_TT8_4_USFGRO0_VS1_VW2_WG16_16_1_WGM8
    SolutionIndex: 19
    SolutionNameMin: Cijk_Ailk_Bljk_DB_MT128x64x4_SN_AF0EM2_AF1EM2_AMAS3_ASEM2_EPS1_FL0_GRVW2_GSU1_IU1_LPB0_LRVW2_NLCA1_PK0_PGR1_PLR1_SU32_SUM0_SUS256_SVW2_SNLL1_TT8_4_USFGRO1_VS1_VW2_WG16_16_1_WGM8
    SolutionIndex: 20
    SolutionNameMin: Cijk_Ailk_Bljk_DB_MT64x64x8_SN_AF0EM1_AF1EM1_AMAS3_ASEM1_EPS1_FL1_GRVW2_GSU1_IU1_LPB0_LRVW2_NLCA1_PK4_PGR1_PLR1_SU32_SUM0_SUS256_SVW2_SNLL0_TT4_4_USFGRO0_VS1_VW2_WG16_16_1_WGM1
    SolutionIndex: 21
    SolutionNameMin: Cijk_Ailk_Bljk_DB_MT32x96x8_SN_AF0EM2_AF1EM2_AMAS3_ASEM2_EPS1_FL0_GRVW2_GSU1_IU1_LPB0_LRVW2_NLCA1_PK0_PGR1_PLR1_SU32_SUM0_SUS256_SVW2_SNLL1_TT4_6_USFGRO1_VS1_VW2_WG8_16_1_WGM8
    SolutionIndex: 22
    SolutionNameMin: Cijk_Ailk_Bljk_DB_MT64x32x4_SN_AF0EM1_AF1EM1_AMAS3_ASEM1_EPS1_FL1_GRVW2_GSU1_IU1_LPB0_LRVW2_NLCA1_PK0_PGR1_PLR0_SU0_SUM0_SUS256_SVW2_SNLL0_TT4_4_USFGRO0_VS1_VW2_WG16_8_1_WGM8
    SolutionIndex: 23
    SolutionNameMin: Cijk_Ailk_Bljk_DB_MT64x64x8_SE_AF0EM1_AF1EM1_AMAS3_ASEM1_EPS1_FL1_GRVW2_GSU1_IU1_LPB0_LRVW2_NLCA1_PK0_PGR1_PLR1_SU0_SUM0_SUS256_SVW2_SNLL0_TT4_4_USFGRO0_VS1_VW2_WG16_16_1_WGM1
    SolutionIndex: 24
    SolutionNameMin: Cijk_Ailk_Bljk_DB_MT64x32x4_SN_AF0EM1_AF1EM1_AMAS3_ASEM1_EPS1_FL1_GRVW2_GSU1_IU1_LPB0_LRVW2_NLCA1_PK0_PGR1_PLR0_SU0_SUM0_SUS256_SVW2_SNLL0_TT4_4_USFGRO0_VS1_VW2_WG16_8_1_WGM1
    SolutionIndex: 25
    SolutionNameMin: Cijk_Ailk_Bljk_DB_MT64x48x4_SN_AF0EM1_AF1EM1_AMAS3_ASEM1_EPS1_FL1_GRVW2_GSU1_IU1_LPB0_LRVW2_NLCA1_PK0_PGR1_PLR0_SU0_SUM0_SUS256_SVW2_SNLL0_TT4_6_USFGRO0_VS1_VW2_WG16_8_1_WGM1
    SolutionIndex: 26
    SolutionNameMin: Cijk_Ailk_Bljk_DB_MT64x64x8_SE_AF0EM1_AF1EM1_AMAS3_ASEM1_EPS1_FL1_GRVW2_GSU1_IU1_LPB0_LRVW2_NLCA1_PK4_PGR1_PLR0_SU32_SUM0_SUS256_SVW2_SNLL0_TT4_4_USFGRO0_VS1_VW2_WG16_16_1_WGM8
    SolutionIndex: 27
    SolutionNameMin: Cijk_Ailk_Bljk_DB_MT64x96x8_SN_AF0EM1_AF1EM1_AMAS3_ASEM1_EPS1_FL1_GRVW2_GSU1_IU1_LPB0_LRVW2_NLCA1_PK0_PGR1_PLR1_SU32_SUM0_SUS256_SVW2_SNLL0_TT4_6_USFGRO0_VS1_VW2_WG16_16_1_WGM1
    SolutionIndex: 28
    SolutionNameMin: Cijk_Ailk_Bljk_DB_MT64x96x8_SN_AF0EM1_AF1EM1_AMAS3_ASEM1_EPS1_FL1_GRVW2_GSU1_IU1_LPB0_LRVW2_NLCA1_PK4_PGR1_PLR1_SU0_SUM0_SUS256_SVW2_SNLL0_TT4_6_USFGRO0_VS1_VW2_WG16_16_1_WGM8
    SolutionIndex: 29
    SolutionNameMin: Cijk_Ailk_Bljk_DB_MT64x64x8_SN_AF0EM1_AF1EM1_AMAS3_ASEM1_EPS1_FL1_GRVW2_GSU1_IU1_LPB0_LRVW2_NLCA1_PK0_PGR1_PLR1_SU0_SUM0_SUS256_SVW2_SNLL1_TT4_4_USFGRO0_VS1_VW2_WG16_16_1_WGM1
    SolutionIndex: 30
    SolutionNameMin: Cijk_Ailk_Bljk_DB_MT64x32x4_SE_AF0EM1_AF1EM1_AMAS3_ASEM1_EPS1_FL1_GRVW2_GSU1_IU1_LPB0_LRVW2_NLCA1_PK0_PGR1_PLR1_SU0_SUM0_SUS256_SVW2_SNLL0_TT4_4_USFGRO0_VS1_VW2_WG16_8_1_WGM8
    SolutionIndex: 31
    SolutionNameMin: Cijk_Ailk_Bljk_DB_MT64x32x8_SN_AF0EM1_AF1EM1_AMAS3_ASEM1_EPS1_FL1_GRVW2_GSU1_IU1_LPB0_LRVW2_NLCA1_PK0_PGR1_PLR1_SU0_SUM0_SUS256_SVW2_SNLL0_TT4_4_USFGRO0_VS1_VW2_WG16_8_1_WGM8
    SolutionIndex: 32
    SolutionNameMin: Cijk_Ailk_Bljk_DB_MT64x32x8_SN_AF0EM1_AF1EM1_AMAS3_ASEM1_EPS1_FL1_GRVW2_GSU1_IU1_LPB0_LRVW2_NLCA1_PK0_PGR1_PLR0_SU0_SUM0_SUS256_SVW2_SNLL1_TT4_4_USFGRO0_VS1_VW2_WG16_8_1_WGM1
    SolutionIndex: 33
    SolutionNameMin: Cijk_Ailk_Bljk_DB_MT64x96x8_SN_AF0EM1_AF1EM1_AMAS3_ASEM1_EPS1_FL1_GRVW2_GSU1_IU1_LPB0_LRVW2_NLCA1_PK2_PGR1_PLR1_SU0_SUM0_SUS256_SVW2_SNLL1_TT4_6_USFGRO0_VS1_VW2_WG16_16_1_WGM1
    SolutionIndex: 34
    SolutionNameMin: Cijk_Ailk_Bljk_DB_MT128x64x8_SN_AF0EM1_AF1EM1_AMAS3_ASEM1_EPS1_FL1_GRVW2_GSU1_IU1_LPB0_LRVW2_NLCA1_PK4_PGR1_PLR0_SU0_SUM0_SUS256_SVW2_SNLL1_TT4_4_USFGRO0_VS1_VW2_WG32_16_1_WGM1
    SolutionIndex: 35
    SolutionNameMin: Cijk_Ailk_Bljk_DB_MT64x32x4_SN_AF0EM1_AF1EM1_AMAS3_ASEM1_EPS1_FL1_GRVW2_GSU1_IU1_LPB0_LRVW2_NLCA1_PK0_PGR1_PLR0_SU32_SUM0_SUS256_SVW2_SNLL1_TT4_4_USFGRO0_VS1_VW2_WG16_8_1_WGM1
    SolutionIndex: 36
    SolutionNameMin: Cijk_Ailk_Bljk_DB_MT64x64x8_SE_AF0EM1_AF1EM1_AMAS3_ASEM1_EPS1_FL1_GRVW2_GSU1_IU1_LPB0_LRVW2_NLCA1_PK4_PGR1_PLR0_SU0_SUM0_SUS256_SVW2_SNLL1_TT4_4_USFGRO0_VS1_VW2_WG16_16_1_WGM1
    SolutionIndex: 37
    SolutionNameMin: Cijk_Ailk_Bljk_DB_MT64x64x8_SE_AF0EM1_AF1EM1_AMAS3_ASEM1_EPS1_FL1_GRVW2_GSU1_IU1_LPB0_LRVW2_NLCA1_PK0_PGR1_PLR1_SU0_SUM0_SUS256_SVW2_SNLL1_TT4_4_USFGRO0_VS1_VW2_WG16_16_1_WGM8
    SolutionIndex: 38
    SolutionNameMin: Cijk_Ailk_Bljk_DB_MT64x32x4_SN_AF0EM1_AF1EM1_AMAS3_ASEM1_EPS1_FL1_GRVW2_GSU1_IU1_LPB0_LRVW2_NLCA1_PK0_PGR1_PLR1_SU32_SUM0_SUS256_SVW2_SNLL1_TT4_4_USFGRO0_VS1_VW2_WG16_8_1_WGM8
    SolutionIndex: 39
    SolutionNameMin: Cijk_Ailk_Bljk_DB_MT64x64x8_SN_AF0EM1_AF1EM1_AMAS3_ASEM1_EPS1_FL1_GRVW2_GSU1_IU1_LPB0_LRVW2_NLCA1_PK4_PGR1_PLR0_SU32_SUM0_SUS256_SVW2_SNLL0_TT4_4_USFGRO0_VS1_VW2_WG16_16_1_WGM8
    SolutionIndex: 40
    SolutionNameMin: Cijk_Ailk_Bljk_DB_MT64x32x4_SE_AF0EM1_AF1EM1_AMAS3_ASEM1_EPS1_FL1_GRVW2_GSU1_IU1_LPB0_LRVW2_NLCA1_PK0_PGR1_PLR1_SU0_SUM0_SUS256_SVW2_SNLL1_TT4_4_USFGRO0_VS1_VW2_WG16_8_1_WGM8
    SolutionIndex: 41
    SolutionNameMin: Cijk_Ailk_Bljk_DB_MT64x96x8_SN_AF0EM1_AF1EM1_AMAS3_ASEM1_EPS1_FL1_GRVW2_GSU1_IU1_LPB0_LRVW2_NLCA1_PK2_PGR1_PLR1_SU32_SUM0_SUS256_SVW2_SNLL0_TT4_6_USFGRO0_VS1_VW2_WG16_16_1_WGM8
    SolutionIndex: 42
    SolutionNameMin: Cijk_Ailk_Bljk_DB_MT64x96x8_SN_AF0EM1_AF1EM1_AMAS3_ASEM1_EPS1_FL1_GRVW2_GSU1_IU1_LPB0_LRVW2_NLCA1_PK4_PGR1_PLR1_SU0_SUM0_SUS256_SVW2_SNLL1_TT4_6_USFGRO0_VS1_VW2_WG16_16_1_WGM1
    SolutionIndex: 43
    SolutionNameMin: Cijk_Ailk_Bljk_DB_MT64x96x8_SN_AF0EM1_AF1EM1_AMAS3_ASEM1_EPS1_FL1_GRVW2_GSU1_IU1_LPB0_LRVW2_NLCA1_PK0_PGR1_PLR1_SU32_SUM0_SUS256_SVW2_SNLL1_TT4_6_USFGRO0_VS1_VW2_WG16_16_1_WGM1
    SolutionIndex: 44
    SolutionNameMin: Cijk_Ailk_Bljk_DB_MT64x64x8_SN_AF0EM1_AF1EM1_AMAS3_ASEM1_EPS1_FL1_GRVW2_GSU1_IU1_LPB0_LRVW2_NLCA1_PK0_PGR1_PLR1_SU0_SUM0_SUS256_SVW2_SNLL0_TT4_4_USFGRO0_VS1_VW2_WG16_16_1_WGM8
    SolutionIndex: 45
    SolutionNameMin: Cijk_Ailk_Bljk_DB_MT64x64x8_SE_AF0EM1_AF1EM1_AMAS3_ASEM1_EPS1_FL1_GRVW2_GSU1_IU1_LPB0_LRVW2_NLCA1_PK0_PGR1_PLR0_SU0_SUM0_SUS256_SVW2_SNLL0_TT4_4_USFGRO0_VS1_VW2_WG16_16_1_WGM1
    SolutionIndex: 46
    SolutionNameMin: Cijk_Ailk_Bljk_DB_MT64x48x4_SN_AF0EM1_AF1EM1_AMAS3_ASEM1_EPS1_FL1_GRVW2_GSU1_IU1_LPB0_LRVW2_NLCA1_PK0_PGR1_PLR0_SU0_SUM0_SUS256_SVW2_SNLL1_TT4_6_USFGRO0_VS1_VW2_WG16_8_1_WGM8
    SolutionIndex: 47
    SolutionNameMin: Cijk_Ailk_Bljk_DB_MT64x96x8_SN_AF0EM1_AF1EM1_AMAS3_ASEM1_EPS1_FL1_GRVW2_GSU1_IU1_LPB0_LRVW2_NLCA1_PK4_PGR1_PLR1_SU0_SUM0_SUS256_SVW2_SNLL0_TT4_6_USFGRO0_VS1_VW2_WG16_16_1_WGM1
    SolutionIndex: 48
    SolutionNameMin: Cijk_Ailk_Bljk_DB_MT64x48x4_SN_AF0EM1_AF1EM1_AMAS3_ASEM1_EPS1_FL1_GRVW2_GSU1_IU1_LPB0_LRVW2_NLCA1_PK0_PGR1_PLR0_SU0_SUM0_SUS256_SVW2_SNLL1_TT4_6_USFGRO0_VS1_VW2_WG16_8_1_WGM1
    SolutionIndex: 49
    SolutionNameMin: Cijk_Ailk_Bljk_DB_MT64x48x4_SN_AF0EM1_AF1EM1_AMAS3_ASEM1_EPS1_FL1_GRVW2_GSU1_IU1_LPB0_LRVW2_NLCA1_PK0_PGR1_PLR0_SU32_SUM0_SUS256_SVW2_SNLL0_TT4_6_USFGRO0_VS1_VW2_WG16_8_1_WGM8
    SolutionIndex: 50
    SolutionNameMin: Cijk_Ailk_Bljk_DB_MT64x32x4_SN_AF0EM1_AF1EM1_AMAS3_ASEM1_EPS1_FL1_GRVW2_GSU1_IU1_LPB0_LRVW2_NLCA1_PK0_PGR1_PLR1_SU0_SUM0_SUS256_SVW2_SNLL0_TT4_4_USFGRO0_VS1_VW2_WG16_8_1_WGM8
    SolutionIndex: 51
    SolutionNameMin: Cijk_Ailk_Bljk_DB_MT64x32x4_SN_AF0EM1_AF1EM1_AMAS3_ASEM1_EPS1_FL1_GRVW2_GSU1_IU1_LPB0_LRVW2_NLCA1_PK0_PGR1_PLR1_SU32_SUM0_SUS256_SVW2_SNLL0_TT4_4_USFGRO0_VS1_VW2_WG16_8_1_WGM1
    SolutionIndex: 52
    SolutionNameMin: Cijk_Ailk_Bljk_DB_MT64x32x8_SN_AF0EM1_AF1EM1_AMAS3_ASEM1_EPS1_FL1_GRVW2_GSU1_IU1_LPB0_LRVW2_NLCA1_PK0_PGR1_PLR1_SU32_SUM0_SUS256_SVW2_SNLL0_TT4_4_USFGRO0_VS1_VW2_WG16_8_1_WGM8
    SolutionIndex: 53
    SolutionNameMin: Cijk_Ailk_Bljk_DB_MT64x32x4_SE_AF0EM1_AF1EM1_AMAS3_ASEM1_EPS1_FL1_GRVW2_GSU1_IU1_LPB0_LRVW2_NLCA1_PK0_PGR1_PLR0_SU0_SUM0_SUS256_SVW2_SNLL0_TT4_4_USFGRO0_VS1_VW2_WG16_8_1_WGM8
    SolutionIndex: 54
    SolutionNameMin: Cijk_Ailk_Bljk_DB_MT64x32x4_SN_AF0EM1_AF1EM1_AMAS3_ASEM1_EPS1_FL1_GRVW2_GSU1_IU1_LPB0_LRVW2_NLCA1_PK0_PGR1_PLR0_SU0_SUM0_SUS256_SVW2_SNLL1_TT4_4_USFGRO0_VS1_VW2_WG16_8_1_WGM1
    SolutionIndex: 55
    SolutionNameMin: Cijk_Ailk_Bljk_DB_MT64x64x8_SN_AF0EM1_AF1EM1_AMAS3_ASEM1_EPS1_FL1_GRVW2_GSU1_IU1_LPB0_LRVW2_NLCA1_PK4_PGR1_PLR1_SU32_SUM0_SUS256_SVW2_SNLL0_TT4_4_USFGRO0_VS1_VW2_WG16_16_1_WGM8
    SolutionIndex: 56
    SolutionNameMin: Cijk_Ailk_Bljk_DB_MT64x32x4_SN_AF0EM1_AF1EM1_AMAS3_ASEM1_EPS1_FL1_GRVW2_GSU1_IU1_LPB0_LRVW2_NLCA1_PK0_PGR1_PLR1_SU32_SUM0_SUS256_SVW2_SNLL1_TT4_4_USFGRO0_VS1_VW2_WG16_8_1_WGM1
    SolutionIndex: 57
    SolutionNameMin: Cijk_Ailk_Bljk_DB_MT96x64x4_SN_AF0EM1_AF1EM1_AMAS3_ASEM1_EPS1_FL1_GRVW2_GSU1_IU1_LPB0_LRVW2_NLCA1_PK0_PGR1_PLR0_SU32_SUM0_SUS256_SVW2_SNLL0_TT6_4_USFGRO0_VS1_VW2_WG16_16_1_WGM8
    SolutionIndex: 58
    SolutionNameMin: Cijk_Ailk_Bljk_DB_MT32x64x8_SN_AF0EM1_AF1EM1_AMAS3_ASEM1_EPS1_FL1_GRVW2_GSU1_IU1_LPB0_LRVW2_NLCA1_PK0_PGR1_PLR1_SU0_SUM0_SUS256_SVW2_SNLL1_TT4_4_USFGRO0_VS1_VW2_WG8_16_1_WGM1
    SolutionIndex: 59
    SolutionNameMin: Cijk_Ailk_Bljk_DB_MT64x32x4_SN_AF0EM1_AF1EM1_AMAS3_ASEM1_EPS1_FL1_GRVW2_GSU1_IU1_LPB0_LRVW2_NLCA1_PK0_PGR1_PLR0_SU0_SUM0_SUS256_SVW2_SNLL1_TT4_4_USFGRO0_VS1_VW2_WG16_8_1_WGM8
    SolutionIndex: 60
    SolutionNameMin: Cijk_Ailk_Bljk_DB_MT96x64x8_SN_AF0EM1_AF1EM1_AMAS3_ASEM1_EPS1_FL1_GRVW2_GSU1_IU1_LPB0_LRVW2_NLCA1_PK4_PGR1_PLR1_SU0_SUM0_SUS256_SVW2_SNLL0_TT6_4_USFGRO0_VS1_VW2_WG16_16_1_WGM8
    SolutionIndex: 61
    SolutionNameMin: Cijk_Ailk_Bljk_DB_MT64x32x4_SN_AF0EM1_AF1EM1_AMAS3_ASEM1_EPS1_FL1_GRVW2_GSU1_IU1_LPB0_LRVW2_NLCA1_PK0_PGR1_PLR1_SU0_SUM0_SUS256_SVW2_SNLL1_TT4_4_USFGRO0_VS1_VW2_WG16_8_1_WGM8
    SolutionIndex: 62
    SolutionNameMin: Cijk_Ailk_Bljk_DB_MT96x64x8_SN_AF0EM1_AF1EM1_AMAS3_ASEM1_EPS1_FL1_GRVW2_GSU1_IU1_LPB0_LRVW2_NLCA1_PK0_PGR1_PLR1_SU32_SUM0_SUS256_SVW2_SNLL0_TT6_4_USFGRO0_VS1_VW2_WG16_16_1_WGM1
    SolutionIndex: 63
    SolutionNameMin: Cijk_Ailk_Bljk_DB_MT64x32x8_SE_AF0EM1_AF1EM1_AMAS3_ASEM1_EPS1_FL1_GRVW2_GSU1_IU1_LPB0_LRVW2_NLCA1_PK4_PGR1_PLR1_SU0_SUM0_SUS256_SVW2_SNLL0_TT4_4_USFGRO0_VS1_VW2_WG16_8_1_WGM8
    SolutionIndex: 64
    SolutionNameMin: Cijk_Ailk_Bljk_DB_MT96x32x4_SN_AF0EM1_AF1EM1_AMAS3_ASEM1_EPS1_FL1_GRVW2_GSU1_IU1_LPB0_LRVW2_NLCA1_PK0_PGR1_PLR1_SU0_SUM0_SUS256_SVW2_SNLL0_TT6_4_USFGRO0_VS1_VW2_WG16_8_1_WGM1
    SolutionIndex: 65
    SolutionNameMin: Cijk_Ailk_Bljk_DB_MT64x96x8_SN_AF0EM1_AF1EM1_AMAS3_ASEM1_EPS1_FL1_GRVW2_GSU1_IU1_LPB0_LRVW2_NLCA1_PK2_PGR1_PLR1_SU0_SUM0_SUS256_SVW2_SNLL0_TT4_6_USFGRO0_VS1_VW2_WG16_16_1_WGM1
    SolutionIndex: 66
    SolutionNameMin: Cijk_Ailk_Bljk_DB_MT64x64x8_SE_AF0EM1_AF1EM1_AMAS3_ASEM1_EPS1_FL1_GRVW2_GSU1_IU1_LPB0_LRVW2_NLCA1_PK0_PGR1_PLR0_SU0_SUM0_SUS256_SVW2_SNLL1_TT4_4_USFGRO0_VS1_VW2_WG16_16_1_WGM1
    SolutionIndex: 67
    SolutionNameMin: Cijk_Ailk_Bljk_DB_MT64x64x8_SE_AF0EM1_AF1EM1_AMAS3_ASEM1_EPS1_FL1_GRVW2_GSU1_IU1_LPB0_LRVW2_NLCA1_PK0_PGR1_PLR0_SU32_SUM0_SUS256_SVW2_SNLL1_TT4_4_USFGRO0_VS1_VW2_WG16_16_1_WGM8
    SolutionIndex: 68
    SolutionNameMin: Cijk_Ailk_Bljk_DB_MT64x48x8_SN_AF0EM1_AF1EM1_AMAS3_ASEM1_EPS1_FL1_GRVW2_GSU1_IU1_LPB0_LRVW2_NLCA1_PK0_PGR1_PLR1_SU32_SUM0_SUS256_SVW2_SNLL1_TT4_6_USFGRO0_VS1_VW2_WG16_8_1_WGM8
    SolutionIndex: 69
    SolutionNameMin: Cijk_Ailk_Bljk_DB_MT32x32x16_SE_AF0EM1_AF1EM1_AMAS3_ASEM1_EPS0_FL0_GRVW2_GSU1_IU2_LPB2_LRVW2_NLCA1_PK0_PGR0_PLR0_SU32_SUM1_SUS128_SVW4_SNLL0_TT2_4_USFGROn1_VSn1_VW2_WG16_8_1_WGM8
    SolutionIndex: 70
    SolutionNameMin: Cijk_Ailk_Bljk_DB_MT64x32x4_SE_AF0EM1_AF1EM1_AMAS3_ASEM1_EPS1_FL1_GRVW2_GSU1_IU1_LPB0_LRVW2_NLCA1_PK0_PGR1_PLR0_SU32_SUM0_SUS256_SVW2_SNLL0_TT4_4_USFGRO0_VS1_VW2_WG16_8_1_WGM1
    SolutionIndex: 71
    SolutionNameMin: Cijk_Ailk_Bljk_DB_MT64x32x8_SE_AF0EM1_AF1EM1_AMAS3_ASEM1_EPS1_FL1_GRVW2_GSU1_IU1_LPB0_LRVW2_NLCA1_PK0_PGR1_PLR1_SU0_SUM0_SUS256_SVW2_SNLL0_TT4_4_USFGRO0_VS1_VW2_WG16_8_1_WGM8
    SolutionIndex: 72
    SolutionNameMin: Cijk_Ailk_Bljk_DB_MT64x32x8_SN_AF0EM1_AF1EM1_AMAS3_ASEM1_EPS1_FL1_GRVW2_GSU1_IU1_LPB0_LRVW2_NLCA1_PK0_PGR1_PLR1_SU0_SUM0_SUS256_SVW2_SNLL1_TT4_4_USFGRO0_VS1_VW2_WG16_8_1_WGM1
    SolutionIndex: 73
    SolutionNameMin: Cijk_Ailk_Bljk_DB_MT96x32x4_SN_AF0EM1_AF1EM1_AMAS3_ASEM1_EPS1_FL1_GRVW2_GSU1_IU1_LPB0_LRVW2_NLCA1_PK0_PGR1_PLR1_SU0_SUM0_SUS256_SVW2_SNLL0_TT6_4_USFGRO0_VS1_VW2_WG16_8_1_WGM8
    SolutionIndex: 74
    SolutionNameMin: Cijk_Ailk_Bljk_DB_MT64x32x4_SN_AF0EM1_AF1EM1_AMAS3_ASEM1_EPS1_FL1_GRVW2_GSU1_IU1_LPB0_LRVW2_NLCA1_PK0_PGR1_PLR0_SU32_SUM0_SUS256_SVW2_SNLL0_TT4_4_USFGRO0_VS1_VW2_WG16_8_1_WGM8
    SolutionIndex: 75
    SolutionNameMin: Cijk_Ailk_Bljk_DB_MT64x32x4_SN_AF0EM1_AF1EM1_AMAS3_ASEM1_EPS1_FL1_GRVW2_GSU1_IU1_LPB0_LRVW2_NLCA1_PK0_PGR1_PLR1_SU0_SUM0_SUS256_SVW2_SNLL0_TT4_4_USFGRO0_VS1_VW2_WG16_8_1_WGM1
    SolutionIndex: 76
    SolutionNameMin: Cijk_Ailk_Bljk_DB_MT64x32x4_SE_AF0EM1_AF1EM1_AMAS3_ASEM1_EPS1_FL1_GRVW2_GSU1_IU1_LPB0_LRVW2_NLCA1_PK0_PGR1_PLR0_SU32_SUM0_SUS256_SVW2_SNLL0_TT4_4_USFGRO0_VS1_VW2_WG16_8_1_WGM8
    SolutionIndex: 77
    SolutionNameMin: Cijk_Ailk_Bljk_DB_MT64x32x8_SN_AF0EM1_AF1EM1_AMAS3_ASEM1_EPS1_FL1_GRVW2_GSU1_IU1_LPB0_LRVW2_NLCA1_PK0_PGR1_PLR1_SU32_SUM0_SUS256_SVW2_SNLL1_TT4_4_USFGRO0_VS1_VW2_WG16_8_1_WGM1
    SolutionIndex: 78
    SolutionNameMin: Cijk_Ailk_Bljk_DB_MT96x64x8_SN_AF0EM1_AF1EM1_AMAS3_ASEM1_EPS1_FL1_GRVW2_GSU1_IU1_LPB0_LRVW2_NLCA1_PK2_PGR1_PLR1_SU32_SUM0_SUS256_SVW2_SNLL0_TT6_4_USFGRO0_VS1_VW2_WG16_16_1_WGM1
    SolutionIndex: 79
    SolutionNameMin: Cijk_Ailk_Bljk_DB_MT128x32x4_SE_AF0EM1_AF1EM1_AMAS3_ASEM1_EPS1_FL1_GRVW2_GSU1_IU1_LPB0_LRVW2_NLCA1_PK0_PGR1_PLR0_SU0_SUM0_SUS256_SVW4_SNLL0_TT8_4_USFGROn1_VSn1_VW2_WG16_8_1_WGM8
    SolutionIndex: 80
    SolutionNameMin: Cijk_Ailk_Bljk_DB_MT96x64x4_SN_AF0EM1_AF1EM1_AMAS3_ASEM1_EPS1_FL1_GRVW2_GSU1_IU1_LPB0_LRVW2_NLCA1_PK0_PGR1_PLR0_SU32_SUM0_SUS256_SVW2_SNLL1_TT6_4_USFGRO0_VS1_VW2_WG16_16_1_WGM8
    SolutionIndex: 81
    SolutionNameMin: Cijk_Ailk_Bljk_DB_MT64x32x8_SE_AF0EM1_AF1EM1_AMAS3_ASEM1_EPS1_FL1_GRVW2_GSU1_IU1_LPB0_LRVW2_NLCA1_PK0_PGR1_PLR1_SU0_SUM0_SUS256_SVW4_SNLL0_TT4_4_USFGROn1_VSn1_VW2_WG16_8_1_WGM8
    SolutionIndex: 82
    SolutionNameMin: Cijk_Ailk_Bljk_DB_MT64x32x4_SN_AF0EM1_AF1EM1_AMAS3_ASEM1_EPS1_FL1_GRVW2_GSU1_IU1_LPB0_LRVW2_NLCA1_PK0_PGR1_PLR0_SU32_SUM0_SUS256_SVW2_SNLL1_TT4_4_USFGRO0_VS1_VW2_WG16_8_1_WGM8
    SolutionIndex: 83
    SolutionNameMin: Cijk_Ailk_Bljk_DB_MT64x32x8_SE_AF0EM1_AF1EM1_AMAS3_ASEM1_EPS1_FL1_GRVW2_GSU1_IU1_LPB0_LRVW2_NLCA1_PK4_PGR1_PLR1_SU0_SUM0_SUS256_SVW2_SNLL1_TT4_4_USFGRO0_VS1_VW2_WG16_8_1_WGM8
    SolutionIndex: 84
    SolutionNameMin: Cijk_Ailk_Bljk_DB_MT96x32x8_SE_AF0EM1_AF1EM1_AMAS3_ASEM1_EPS1_FL1_GRVW2_GSU1_IU1_LPB0_LRVW2_NLCA1_PK0_PGR1_PLR1_SU32_SUM0_SUS256_SVW4_SNLL0_TT6_4_USFGROn1_VSn1_VW2_WG16_8_1_WGM8
    SolutionIndex: 85
    SolutionNameMin: Cijk_Ailk_Bljk_DB_MT64x32x4_SE_AF0EM1_AF1EM1_AMAS3_ASEM1_EPS1_FL1_GRVW2_GSU1_IU1_LPB0_LRVW2_NLCA1_PK0_PGR1_PLR1_SU0_SUM0_SUS256_SVW2_SNLL0_TT4_4_USFGRO0_VS1_VW2_WG16_8_1_WGM1
    SolutionIndex: 86
    SolutionNameMin: Cijk_Ailk_Bljk_DB_MT64x48x4_SN_AF0EM1_AF1EM1_AMAS3_ASEM1_EPS1_FL1_GRVW2_GSU1_IU1_LPB0_LRVW2_NLCA1_PK0_PGR1_PLR0_SU32_SUM0_SUS256_SVW2_SNLL1_TT4_6_USFGRO0_VS1_VW2_WG16_8_1_WGM1
    SolutionIndex: 87
    SolutionNameMin: Cijk_Ailk_Bljk_DB_MT64x32x4_SN_AF0EM1_AF1EM1_AMAS3_ASEM1_EPS1_FL1_GRVW2_GSU1_IU1_LPB0_LRVW2_NLCA1_PK0_PGR1_PLR0_SU32_SUM0_SUS256_SVW2_SNLL0_TT4_4_USFGRO0_VS1_VW2_WG16_8_1_WGM1
    SolutionIndex: 88
    SolutionNameMin: Cijk_Ailk_Bljk_DB_MT64x32x8_SN_AF0EM1_AF1EM1_AMAS3_ASEM1_EPS1_FL1_GRVW2_GSU1_IU1_LPB0_LRVW2_NLCA1_PK0_PGR1_PLR1_SU0_SUM0_SUS256_SVW2_SNLL0_TT4_4_USFGRO0_VS1_VW2_WG16_8_1_WGM1
    SolutionIndex: 89
    SolutionNameMin: Cijk_Ailk_Bljk_DB_MT64x32x4_SE_AF0EM1_AF1EM1_AMAS3_ASEM1_EPS1_FL1_GRVW2_GSU1_IU1_LPB0_LRVW2_NLCA1_PK0_PGR1_PLR1_SU32_SUM0_SUS256_SVW2_SNLL1_TT4_4_USFGRO0_VS1_VW2_WG16_8_1_WGM8
    SolutionIndex: 90
    SolutionNameMin: Cijk_Ailk_Bljk_DB_MT96x64x8_SN_AF0EM1_AF1EM1_AMAS3_ASEM1_EPS1_FL1_GRVW2_GSU1_IU1_LPB0_LRVW2_NLCA1_PK2_PGR1_PLR1_SU0_SUM0_SUS256_SVW2_SNLL0_TT6_4_USFGRO0_VS1_VW2_WG16_16_1_WGM1
    SolutionIndex: 91
    SolutionNameMin: Cijk_Ailk_Bljk_DB_MT64x64x8_SN_AF0EM1_AF1EM1_AMAS3_ASEM1_EPS1_FL1_GRVW2_GSU1_IU1_LPB0_LRVW2_NLCA1_PK4_PGR1_PLR0_SU32_SUM0_SUS256_SVW2_SNLL0_TT4_4_USFGRO0_VS1_VW2_WG16_16_1_WGM1
    SolutionIndex: 92
    SolutionNameMin: Cijk_Ailk_Bljk_DB_MT64x64x8_SE_AF0EM1_AF1EM1_AMAS3_ASEM1_EPS1_FL1_GRVW2_GSU1_IU1_LPB0_LRVW2_NLCA1_PK0_PGR1_PLR0_SU32_SUM0_SUS256_SVW2_SNLL0_TT4_4_USFGRO0_VS1_VW2_WG16_16_1_WGM1
    SolutionIndex: 93
    SolutionNameMin: Cijk_Ailk_Bljk_DB_MT64x32x4_SN_AF0EM1_AF1EM1_AMAS3_ASEM1_EPS1_FL1_GRVW2_GSU1_IU1_LPB0_LRVW2_NLCA1_PK0_PGR1_PLR1_SU32_SUM0_SUS256_SVW2_SNLL0_TT4_4_USFGRO0_VS1_VW2_WG16_8_1_WGM8
    SolutionIndex: 94
    SolutionNameMin: Cijk_Ailk_Bljk_DB_MT96x64x8_SN_AF0EM1_AF1EM1_AMAS3_ASEM1_EPS1_FL1_GRVW2_GSU1_IU1_LPB0_LRVW2_NLCA1_PK2_PGR1_PLR1_SU32_SUM0_SUS256_SVW2_SNLL0_TT6_4_USFGRO0_VS1_VW2_WG16_16_1_WGM8
    SolutionIndex: 95
    SolutionNameMin: Cijk_Ailk_Bljk_DB_MT64x32x4_SE_AF0EM1_AF1EM1_AMAS3_ASEM1_EPS1_FL1_GRVW2_GSU1_IU1_LPB0_LRVW2_NLCA1_PK0_PGR1_PLR0_SU0_SUM0_SUS256_SVW2_SNLL1_TT4_4_USFGRO0_VS1_VW2_WG16_8_1_WGM8
    SolutionIndex: 96
    SolutionNameMin: Cijk_Ailk_Bljk_DB_MT64x48x4_SN_AF0EM1_AF1EM1_AMAS3_ASEM1_EPS1_FL1_GRVW2_GSU1_IU1_LPB0_LRVW2_NLCA1_PK0_PGR1_PLR1_SU32_SUM0_SUS256_SVW2_SNLL0_TT4_6_USFGRO0_VS1_VW2_WG16_8_1_WGM8
    SolutionIndex: 97
    SolutionNameMin: Cijk_Ailk_Bljk_DB_MT64x32x8_SN_AF0EM1_AF1EM1_AMAS3_ASEM1_EPS1_FL1_GRVW2_GSU1_IU1_LPB0_LRVW2_NLCA1_PK0_PGR1_PLR0_SU32_SUM0_SUS256_SVW2_SNLL1_TT4_4_USFGRO0_VS1_VW2_WG16_8_1_WGM1
    SolutionIndex: 98
    SolutionNameMin: Cijk_Ailk_Bljk_DB_MT64x64x8_SN_AF0EM1_AF1EM1_AMAS3_ASEM1_EPS1_FL1_GRVW2_GSU1_IU1_LPB0_LRVW2_NLCA1_PK0_PGR1_PLR1_SU32_SUM0_SUS256_SVW2_SNLL0_TT4_4_USFGRO0_VS1_VW2_WG16_16_1_WGM1
    SolutionIndex: 99
    SolutionNameMin: Cijk_Ailk_Bljk_DB_MT64x32x4_SN_AF0EM1_AF1EM1_AMAS3_ASEM1_EPS1_FL1_GRVW2_GSU1_IU1_LPB0_LRVW2_NLCA1_PK0_PGR1_PLR1_SU0_SUM0_SUS256_SVW2_SNLL1_TT4_4_USFGRO0_VS1_VW2_WG16_8_1_WGM1
    SolutionIndex: 100
    SolutionNameMin: Cijk_Ailk_Bljk_DB_MT128x64x4_SE_AF0EM1_AF1EM1_AMAS3_ASEM1_EPS1_FL1_GRVW2_GSU1_IU1_LPB0_LRVW2_NLCA1_PK0_PGR1_PLR1_SU32_SUM0_SUS256_SVW2_SNLL0_TT8_4_USFGRO0_VS1_VW2_WG16_16_1_WGM1
    SolutionIndex: 101
    SolutionNameMin: Cijk_Ailk_Bljk_DB_MT96x64x4_SE_AF0EM1_AF1EM1_AMAS3_ASEM1_EPS1_FL1_GRVW2_GSU1_IU1_LPB0_LRVW2_NLCA1_PK0_PGR1_PLR0_SU32_SUM0_SUS256_SVW2_SNLL0_TT6_4_USFGRO0_VS1_VW2_WG16_16_1_WGM8
    SolutionIndex: 102
    SolutionNameMin: Cijk_Ailk_Bljk_DB_MT64x64x8_SN_AF0EM1_AF1EM1_AMAS3_ASEM1_EPS1_FL1_GRVW2_GSU1_IU1_LPB0_LRVW2_NLCA1_PK4_PGR1_PLR0_SU32_SUM0_SUS256_SVW2_SNLL1_TT4_4_USFGRO0_VS1_VW2_WG16_16_1_WGM1
    SolutionIndex: 103
    SolutionNameMin: Cijk_Ailk_Bljk_DB_MT64x64x8_SN_AF0EM1_AF1EM1_AMAS3_ASEM1_EPS1_FL1_GRVW2_GSU1_IU1_LPB0_LRVW2_NLCA1_PK0_PGR1_PLR0_SU32_SUM0_SUS256_SVW2_SNLL1_TT4_4_USFGRO0_VS1_VW2_WG16_16_1_WGM1
    SolutionIndex: 104
    SolutionNameMin: Cijk_Ailk_Bljk_DB_MT96x32x8_SN_AF0EM1_AF1EM1_AMAS3_ASEM1_EPS1_FL1_GRVW2_GSU1_IU1_LPB0_LRVW2_NLCA1_PK0_PGR1_PLR0_SU32_SUM0_SUS256_SVW2_SNLL1_TT6_4_USFGRO0_VS1_VW2_WG16_8_1_WGM1
    SolutionIndex: 105
    SolutionNameMin: Cijk_Ailk_Bljk_DB_MT128x64x8_SN_AF0EM1_AF1EM1_AMAS3_ASEM1_EPS1_FL1_GRVW2_GSU1_IU1_LPB0_LRVW2_NLCA1_PK0_PGR1_PLR0_SU32_SUM0_SUS256_SVW2_SNLL0_TT8_4_USFGRO0_VS1_VW2_WG16_16_1_WGM1
    SolutionIndex: 106
    SolutionNameMin: Cijk_Ailk_Bljk_DB_MT64x32x8_SN_AF0EM1_AF1EM1_AMAS3_ASEM1_EPS1_FL1_GRVW2_GSU1_IU1_LPB0_LRVW2_NLCA1_PK0_PGR1_PLR1_SU32_SUM0_SUS256_SVW2_SNLL0_TT4_4_USFGRO0_VS1_VW2_WG16_8_1_WGM1
    SolutionIndex: 107
    SolutionNameMin: Cijk_Ailk_Bljk_DB_MT96x64x8_SN_AF0EM1_AF1EM1_AMAS3_ASEM1_EPS1_FL1_GRVW2_GSU1_IU1_LPB0_LRVW2_NLCA1_PK2_PGR1_PLR1_SU0_SUM0_SUS256_SVW2_SNLL0_TT6_4_USFGRO0_VS1_VW2_WG16_16_1_WGM8
    SolutionIndex: 108
    SolutionNameMin: Cijk_Ailk_Bljk_DB_MT64x32x8_SE_AF0EM1_AF1EM1_AMAS3_ASEM1_EPS1_FL1_GRVW2_GSU1_IU1_LPB0_LRVW2_NLCA1_PK0_PGR1_PLR1_SU0_SUM0_SUS256_SVW2_SNLL1_TT4_4_USFGRO0_VS1_VW2_WG16_8_1_WGM8
    SolutionIndex: 109
    SolutionNameMin: Cijk_Ailk_Bljk_DB_MT64x96x8_SN_AF0EM1_AF1EM1_AMAS3_ASEM1_EPS1_FL1_GRVW2_GSU1_IU1_LPB0_LRVW2_NLCA1_PK2_PGR1_PLR1_SU32_SUM0_SUS256_SVW2_SNLL1_TT4_6_USFGRO0_VS1_VW2_WG16_16_1_WGM1
    SolutionIndex: 110
    SolutionNameMin: Cijk_Ailk_Bljk_DB_MT64x64x4_SN_AF0EM1_AF1EM1_AMAS3_ASEM1_EPS1_FL0_GRVW2_GSU1_IU1_LPB0_LRVW2_NLCA1_PK0_PGR1_PLR1_SU32_SUM0_SUS256_SVW2_SNLL1_TT4_4_USFGRO1_VS1_VW2_WG16_16_1_WGM8
    SolutionIndex: 111
    SolutionNameMin: Cijk_Ailk_Bljk_DB_MT128x64x8_SN_AF0EM1_AF1EM1_AMAS3_ASEM1_EPS1_FL1_GRVW2_GSU1_IU1_LPB0_LRVW2_NLCA1_PK2_PGR1_PLR0_SU32_SUM0_SUS256_SVW2_SNLL1_TT4_4_USFGRO0_VS1_VW2_WG32_16_1_WGM1
    SolutionIndex: 112
    SolutionNameMin: Cijk_Ailk_Bljk_DB_MT96x64x8_SN_AF0EM1_AF1EM1_AMAS3_ASEM1_EPS1_FL1_GRVW2_GSU1_IU1_LPB0_LRVW2_NLCA1_PK0_PGR1_PLR1_SU0_SUM0_SUS256_SVW2_SNLL0_TT6_4_USFGRO0_VS1_VW2_WG16_16_1_WGM1
    SolutionIndex: 113
    SolutionNameMin: Cijk_Ailk_Bljk_DB_MT64x64x8_SE_AF0EM1_AF1EM1_AMAS3_ASEM1_EPS1_FL1_GRVW2_GSU1_IU1_LPB0_LRVW2_NLCA1_PK4_PGR1_PLR0_SU32_SUM0_SUS256_SVW2_SNLL1_TT4_4_USFGRO0_VS1_VW2_WG16_16_1_WGM1
    SolutionIndex: 114
    SolutionNameMin: Cijk_Ailk_Bljk_DB_MT64x32x4_SN_AF0EM1_AF1EM1_AMAS3_ASEM1_EPS1_FL1_GRVW2_GSU1_IU1_LPB0_LRVW2_NLCA1_PK4_PGR1_PLR1_SU0_SUM0_SUS256_SVW2_SNLL1_TT4_4_USFGRO0_VS1_VW2_WG16_8_1_WGM1
    SolutionIndex: 115
    SolutionNameMin: Cijk_Ailk_Bljk_DB_MT32x32x8_SE_AF0EM1_AF1EM1_AMAS3_ASEM1_EPS0_FL0_GRVW2_GSU1_IU2_LPB2_LRVW2_NLCA1_PK0_PGR0_PLR0_SU16_SUM1_SUS128_SVW4_SNLL0_TT2_4_USFGROn1_VSn1_VW2_WG16_8_1_WGM8
    SolutionIndex: 116
    SolutionNameMin: Cijk_Ailk_Bljk_DB_MT64x32x4_SE_AF0EM1_AF1EM1_AMAS3_ASEM1_EPS1_FL1_GRVW2_GSU1_IU1_LPB0_LRVW2_NLCA1_PK0_PGR1_PLR1_SU32_SUM0_SUS256_SVW2_SNLL0_TT4_4_USFGRO0_VS1_VW2_WG16_8_1_WGM8
    SolutionIndex: 117
    SolutionNameMin: Cijk_Ailk_Bljk_DB_MT64x48x8_SN_AF0EM1_AF1EM1_AMAS3_ASEM1_EPS1_FL1_GRVW2_GSU1_IU1_LPB0_LRVW2_NLCA1_PK0_PGR1_PLR1_SU0_SUM0_SUS256_SVW2_SNLL0_TT4_6_USFGRO0_VS1_VW2_WG16_8_1_WGM1
    SolutionIndex: 118
    SolutionNameMin: Cijk_Ailk_Bljk_DB_MT96x32x8_SN_AF0EM1_AF1EM1_AMAS3_ASEM1_EPS1_FL1_GRVW2_GSU1_IU1_LPB0_LRVW2_NLCA1_PK0_PGR1_PLR1_SU0_SUM0_SUS256_SVW2_SNLL0_TT6_4_USFGRO0_VS1_VW2_WG16_8_1_WGM8
    SolutionIndex: 119
    SolutionNameMin: Cijk_Ailk_Bljk_DB_MT64x32x8_SE_AF0EM1_AF1EM1_AMAS3_ASEM1_EPS1_FL1_GRVW2_GSU1_IU1_LPB0_LRVW2_NLCA1_PK4_PGR1_PLR1_SU32_SUM0_SUS256_SVW2_SNLL1_TT4_4_USFGRO0_VS1_VW2_WG16_8_1_WGM1
    SolutionIndex: 120
    SolutionNameMin: Cijk_Ailk_Bljk_DB_MT64x48x4_SN_AF0EM1_AF1EM1_AMAS3_ASEM1_EPS1_FL1_GRVW2_GSU1_IU1_LPB0_LRVW2_NLCA1_PK0_PGR1_PLR1_SU32_SUM0_SUS256_SVW2_SNLL1_TT4_6_USFGRO0_VS1_VW2_WG16_8_1_WGM1
    SolutionIndex: 121
    SolutionNameMin: Cijk_Ailk_Bljk_DB_MT128x32x4_SN_AF0EM1_AF1EM1_AMAS3_ASEM1_EPS1_FL1_GRVW2_GSU1_IU1_LPB0_LRVW2_NLCA1_PK0_PGR1_PLR0_SU0_SUM0_SUS256_SVW2_SNLL1_TT8_4_USFGRO0_VS1_VW2_WG16_8_1_WGM8
    SolutionIndex: 122
    SolutionNameMin: Cijk_Ailk_Bljk_DB_MT64x48x8_SN_AF0EM1_AF1EM1_AMAS3_ASEM1_EPS1_FL1_GRVW2_GSU1_IU1_LPB0_LRVW2_NLCA1_PK0_PGR1_PLR1_SU0_SUM0_SUS256_SVW2_SNLL1_TT4_6_USFGRO0_VS1_VW2_WG16_8_1_WGM1
    SolutionIndex: 123
    SolutionNameMin: Cijk_Ailk_Bljk_DB_MT64x64x8_SN_AF0EM1_AF1EM1_AMAS3_ASEM1_EPS1_FL1_GRVW2_GSU1_IU1_LPB0_LRVW2_NLCA1_PK0_PGR1_PLR0_SU32_SUM0_SUS256_SVW2_SNLL0_TT4_4_USFGRO0_VS1_VW2_WG16_16_1_WGM8
    SolutionIndex: 124
    SolutionNameMin: Cijk_Ailk_Bljk_DB_MT64x32x8_SN_AF0EM1_AF1EM1_AMAS3_ASEM1_EPS1_FL1_GRVW2_GSU1_IU1_LPB0_LRVW2_NLCA1_PK4_PGR1_PLR1_SU0_SUM0_SUS256_SVW2_SNLL0_TT4_4_USFGRO0_VS1_VW2_WG16_8_1_WGM1
    SolutionIndex: 125
    SolutionNameMin: Cijk_Ailk_Bljk_DB_MT128x32x4_SN_AF0EM1_AF1EM1_AMAS3_ASEM1_EPS1_FL1_GRVW2_GSU1_IU1_LPB0_LRVW2_NLCA1_PK0_PGR1_PLR0_SU32_SUM0_SUS256_SVW2_SNLL0_TT8_4_USFGRO0_VS1_VW2_WG16_8_1_WGM8
    SolutionIndex: 126
    SolutionNameMin: Cijk_Ailk_Bljk_DB_MT96x64x8_SE_AF0EM1_AF1EM1_AMAS3_ASEM1_EPS1_FL1_GRVW2_GSU1_IU1_LPB0_LRVW2_NLCA1_PK0_PGR1_PLR1_SU32_SUM0_SUS256_SVW2_SNLL1_TT6_4_USFGRO0_VS1_VW2_WG16_16_1_WGM1
    SolutionIndex: 127
    SolutionNameMin: Cijk_Ailk_Bljk_DB_MT64x64x8_SN_AF0EM1_AF1EM1_AMAS3_ASEM1_EPS1_FL1_GRVW2_GSU1_IU1_LPB0_LRVW2_NLCA1_PK0_PGR1_PLR0_SU32_SUM0_SUS256_SVW2_SNLL1_TT4_4_USFGRO0_VS1_VW2_WG16_16_1_WGM8
    SolutionIndex: 128
    SolutionNameMin: Cijk_Ailk_Bljk_DB_MT96x64x4_SE_AF0EM1_AF1EM1_AMAS3_ASEM1_EPS1_FL1_GRVW2_GSU1_IU1_LPB0_LRVW2_NLCA1_PK0_PGR1_PLR0_SU32_SUM0_SUS256_SVW2_SNLL1_TT6_4_USFGRO0_VS1_VW2_WG16_16_1_WGM8
    SolutionIndex: 129
    SolutionNameMin: Cijk_Ailk_Bljk_DB_MT32x64x8_SE_AF0EM1_AF1EM1_AMAS3_ASEM1_EPS1_FL1_GRVW2_GSU1_IU1_LPB0_LRVW2_NLCA1_PK0_PGR1_PLR1_SU0_SUM0_SUS256_SVW2_SNLL1_TT4_4_USFGRO0_VS1_VW2_WG8_16_1_WGM8
    SolutionIndex: 130
    SolutionNameMin: Cijk_Ailk_Bljk_DB_MT96x64x8_SN_AF0EM1_AF1EM1_AMAS3_ASEM1_EPS1_FL1_GRVW2_GSU1_IU1_LPB0_LRVW2_NLCA1_PK4_PGR1_PLR1_SU32_SUM0_SUS256_SVW2_SNLL0_TT6_4_USFGRO0_VS1_VW2_WG16_16_1_WGM1
    SolutionIndex: 131
    SolutionNameMin: Cijk_Ailk_Bljk_DB_MT64x32x8_SN_AF0EM1_AF1EM1_AMAS3_ASEM1_EPS1_FL1_GRVW2_GSU1_IU1_LPB0_LRVW2_NLCA1_PK4_PGR1_PLR1_SU32_SUM0_SUS256_SVW2_SNLL0_TT4_4_USFGRO0_VS1_VW2_WG16_8_1_WGM8
    SolutionIndex: 132
    SolutionNameMin: Cijk_Ailk_Bljk_DB_MT64x32x8_SE_AF0EM1_AF1EM1_AMAS3_ASEM1_EPS1_FL1_GRVW2_GSU1_IU1_LPB0_LRVW2_NLCA1_PK0_PGR1_PLR1_SU0_SUM0_SUS256_SVW2_SNLL1_TT4_4_USFGRO0_VS1_VW2_WG16_8_1_WGM1
    SolutionIndex: 133
    SolutionNameMin: Cijk_Ailk_Bljk_DB_MT64x48x8_SN_AF0EM1_AF1EM1_AMAS3_ASEM1_EPS1_FL1_GRVW2_GSU1_IU1_LPB0_LRVW2_NLCA1_PK4_PGR1_PLR1_SU0_SUM0_SUS256_SVW2_SNLL0_TT4_6_USFGRO0_VS1_VW2_WG16_8_1_WGM8
    SolutionIndex: 134
    SolutionNameMin: Cijk_Ailk_Bljk_DB_MT64x32x8_SN_AF0EM1_AF1EM1_AMAS3_ASEM1_EPS1_FL1_GRVW2_GSU1_IU1_LPB0_LRVW2_NLCA1_PK0_PGR1_PLR1_SU0_SUM0_SUS256_SVW2_SNLL1_TT4_4_USFGRO0_VS1_VW2_WG16_8_1_WGM8
    SolutionIndex: 135
    SolutionNameMin: Cijk_Ailk_Bljk_DB_MT64x32x4_SE_AF0EM1_AF1EM1_AMAS3_ASEM1_EPS1_FL1_GRVW2_GSU1_IU1_LPB0_LRVW2_NLCA1_PK4_PGR1_PLR1_SU0_SUM0_SUS256_SVW2_SNLL0_TT4_4_USFGRO0_VS1_VW2_WG16_8_1_WGM1
    SolutionIndex: 136
    SolutionNameMin: Cijk_Ailk_Bljk_DB_MT64x32x8_SN_AF0EM1_AF1EM1_AMAS3_ASEM1_EPS1_FL1_GRVW2_GSU1_IU1_LPB0_LRVW2_NLCA1_PK0_PGR1_PLR0_SU0_SUM0_SUS256_SVW2_SNLL1_TT4_4_USFGRO0_VS1_VW2_WG16_8_1_WGM8
    SolutionIndex: 137
    SolutionNameMin: Cijk_Ailk_Bljk_DB_MT32x64x4_SN_AF0EM1_AF1EM1_AMAS3_ASEM1_EPS1_FL1_GRVW2_GSU1_IU1_LPB0_LRVW2_NLCA1_PK0_PGR1_PLR1_SU0_SUM0_SUS256_SVW2_SNLL1_TT4_4_USFGRO0_VS1_VW2_WG8_16_1_WGM1
    SolutionIndex: 138
    SolutionNameMin: Cijk_Ailk_Bljk_DB_MT64x48x8_SN_AF0EM1_AF1EM1_AMAS3_ASEM1_EPS1_FL1_GRVW2_GSU1_IU1_LPB0_LRVW2_NLCA1_PK4_PGR1_PLR1_SU0_SUM0_SUS256_SVW2_SNLL0_TT4_6_USFGRO0_VS1_VW2_WG16_8_1_WGM1
    SolutionIndex: 139
    SolutionNameMin: Cijk_Ailk_Bljk_DB_MT96x64x4_SN_AF0EM1_AF1EM1_AMAS3_ASEM1_EPS1_FL1_GRVW2_GSU1_IU1_LPB0_LRVW2_NLCA1_PK0_PGR1_PLR0_SU32_SUM0_SUS256_SVW2_SNLL0_TT6_4_USFGRO0_VS1_VW2_WG16_16_1_WGM1
    SolutionIndex: 140
    SolutionNameMin: Cijk_Ailk_Bljk_DB_MT96x32x8_SN_AF0EM1_AF1EM1_AMAS3_ASEM1_EPS1_FL1_GRVW2_GSU1_IU1_LPB0_LRVW2_NLCA1_PK0_PGR1_PLR1_SU0_SUM0_SUS256_SVW2_SNLL1_TT6_4_USFGRO0_VS1_VW2_WG16_8_1_WGM8
    SolutionIndex: 141
    SolutionNameMin: Cijk_Ailk_Bljk_DB_MT96x32x4_SN_AF0EM1_AF1EM1_AMAS3_ASEM1_EPS1_FL1_GRVW2_GSU1_IU1_LPB0_LRVW2_NLCA1_PK0_PGR1_PLR1_SU32_SUM0_SUS256_SVW2_SNLL1_TT6_4_USFGRO0_VS1_VW2_WG16_8_1_WGM8
    SolutionIndex: 142
    SolutionNameMin: Cijk_Ailk_Bljk_DB_MT64x32x4_SE_AF0EM1_AF1EM1_AMAS3_ASEM1_EPS1_FL1_GRVW2_GSU1_IU1_LPB0_LRVW2_NLCA1_PK0_PGR1_PLR0_SU32_SUM0_SUS256_SVW2_SNLL1_TT4_4_USFGRO0_VS1_VW2_WG16_8_1_WGM8
    SolutionIndex: 143
    SolutionNameMin: Cijk_Ailk_Bljk_DB_MT128x64x8_SN_AF0EM1_AF1EM1_AMAS3_ASEM1_EPS1_FL1_GRVW2_GSU1_IU1_LPB0_LRVW2_NLCA1_PK0_PGR1_PLR0_SU0_SUM0_SUS256_SVW2_SNLL0_TT8_4_USFGRO0_VS1_VW2_WG16_16_1_WGM1
    SolutionIndex: 144
    SolutionNameMin: Cijk_Ailk_Bljk_DB_MT64x32x4_SE_AF0EM1_AF1EM1_AMAS3_ASEM1_EPS1_FL1_GRVW2_GSU1_IU1_LPB0_LRVW2_NLCA1_PK0_PGR1_PLR1_SU0_SUM0_SUS256_SVW2_SNLL1_TT4_4_USFGRO0_VS1_VW2_WG16_8_1_WGM1
    SolutionIndex: 145
    SolutionNameMin: Cijk_Ailk_Bljk_DB_MT64x48x8_SN_AF0EM1_AF1EM1_AMAS3_ASEM1_EPS1_FL1_GRVW2_GSU1_IU1_LPB0_LRVW2_NLCA1_PK4_PGR1_PLR1_SU32_SUM0_SUS256_SVW2_SNLL1_TT4_6_USFGRO0_VS1_VW2_WG16_8_1_WGM8
    SolutionIndex: 146
    SolutionNameMin: Cijk_Ailk_Bljk_DB_MT96x64x8_SN_AF0EM1_AF1EM1_AMAS3_ASEM1_EPS1_FL1_GRVW2_GSU1_IU1_LPB0_LRVW2_NLCA1_PK0_PGR1_PLR1_SU32_SUM0_SUS256_SVW2_SNLL0_TT6_4_USFGRO0_VS1_VW2_WG16_16_1_WGM8
    SolutionIndex: 147
    SolutionNameMin: Cijk_Ailk_Bljk_DB_MT192x64x8_SE_AF0EM1_AF1EM1_AMAS3_ASEM1_EPS1_FL1_GRVW2_GSU1_IU1_LPB0_LRVW2_NLCA1_PK0_PGR1_PLR1_SU0_SUM0_SUS256_SVW4_SNLL0_TT6_4_USFGROn1_VSn1_VW2_WG32_16_1_WGM1
    SolutionIndex: 148
    SolutionNameMin: Cijk_Ailk_Bljk_DB_MT32x32x16_SE_AF0EM1_AF1EM1_AMAS3_ASEM1_EPS0_FL0_GRVW2_GSU1_IU2_LPB2_LRVW2_NLCA1_PK0_PGR0_PLR0_SU16_SUM1_SUS128_SVW4_SNLL0_TT2_4_USFGROn1_VSn1_VW2_WG16_8_1_WGM8
    SolutionIndex: 149
    SolutionNameMin: Cijk_Ailk_Bljk_DB_MT96x64x4_SN_AF0EM1_AF1EM1_AMAS3_ASEM1_EPS1_FL1_GRVW2_GSU1_IU1_LPB0_LRVW2_NLCA1_PK0_PGR1_PLR0_SU32_SUM0_SUS256_SVW2_SNLL1_TT6_4_USFGRO0_VS1_VW2_WG16_16_1_WGM1
    SolutionIndex: 150
    SolutionNameMin: Cijk_Ailk_Bljk_DB_MT64x48x8_SN_AF0EM1_AF1EM1_AMAS3_ASEM1_EPS1_FL1_GRVW2_GSU1_IU1_LPB0_LRVW2_NLCA1_PK0_PGR1_PLR1_SU32_SUM0_SUS256_SVW2_SNLL0_TT4_6_USFGRO0_VS1_VW2_WG16_8_1_WGM1
    SolutionIndex: 151
    SolutionNameMin: Cijk_Ailk_Bljk_DB_MT96x32x8_SN_AF0EM1_AF1EM1_AMAS3_ASEM1_EPS1_FL1_GRVW2_GSU1_IU1_LPB0_LRVW2_NLCA1_PK0_PGR1_PLR1_SU32_SUM0_SUS256_SVW2_SNLL1_TT6_4_USFGRO0_VS1_VW2_WG16_8_1_WGM8
    SolutionIndex: 152
    SolutionNameMin: Cijk_Ailk_Bljk_DB_MT96x64x8_SN_AF0EM1_AF1EM1_AMAS3_ASEM1_EPS1_FL1_GRVW2_GSU1_IU1_LPB0_LRVW2_NLCA1_PK4_PGR1_PLR1_SU32_SUM0_SUS256_SVW2_SNLL0_TT6_4_USFGRO0_VS1_VW2_WG16_16_1_WGM8
    SolutionIndex: 153
    SolutionNameMin: Cijk_Ailk_Bljk_DB_MT64x32x8_SE_AF0EM1_AF1EM1_AMAS3_ASEM1_EPS1_FL1_GRVW2_GSU1_IU1_LPB0_LRVW2_NLCA1_PK0_PGR1_PLR1_SU32_SUM0_SUS256_SVW2_SNLL1_TT4_4_USFGRO0_VS1_VW2_WG16_8_1_WGM1
    SolutionIndex: 154
    SolutionNameMin: Cijk_Ailk_Bljk_DB_MT64x48x4_SN_AF0EM1_AF1EM1_AMAS3_ASEM1_EPS1_FL1_GRVW2_GSU1_IU1_LPB0_LRVW2_NLCA1_PK0_PGR1_PLR0_SU32_SUM0_SUS256_SVW2_SNLL0_TT4_6_USFGRO0_VS1_VW2_WG16_8_1_WGM1
    SolutionIndex: 155
    SolutionNameMin: Cijk_Ailk_Bljk_DB_MT64x64x8_SE_AF0EM1_AF1EM1_AMAS3_ASEM1_EPS1_FL1_GRVW2_GSU1_IU1_LPB0_LRVW2_NLCA1_PK4_PGR1_PLR0_SU0_SUM0_SUS256_SVW2_SNLL0_TT4_4_USFGRO0_VS1_VW2_WG16_16_1_WGM1
    SolutionIndex: 156
    SolutionNameMin: Cijk_Ailk_Bljk_DB_MT96x32x4_SN_AF0EM1_AF1EM1_AMAS3_ASEM1_EPS1_FL1_GRVW2_GSU1_IU1_LPB0_LRVW2_NLCA1_PK0_PGR1_PLR1_SU0_SUM0_SUS256_SVW2_SNLL1_TT6_4_USFGRO0_VS1_VW2_WG16_8_1_WGM8
    SolutionIndex: 157
    SolutionNameMin: Cijk_Ailk_Bljk_DB_MT64x96x8_SN_AF0EM1_AF1EM1_AMAS3_ASEM1_EPS1_FL1_GRVW2_GSU1_IU1_LPB0_LRVW2_NLCA1_PK0_PGR1_PLR1_SU0_SUM0_SUS256_SVW2_SNLL1_TT4_6_USFGRO0_VS1_VW2_WG16_16_1_WGM1
    SolutionIndex: 158
    SolutionNameMin: Cijk_Ailk_Bljk_DB_MT64x32x4_SE_AF0EM1_AF1EM1_AMAS3_ASEM1_EPS1_FL1_GRVW2_GSU1_IU1_LPB0_LRVW2_NLCA1_PK0_PGR1_PLR1_SU32_SUM0_SUS256_SVW2_SNLL0_TT4_4_USFGRO0_VS1_VW2_WG16_8_1_WGM1
    SolutionIndex: 159
    SolutionNameMin: Cijk_Ailk_Bljk_DB_MT64x32x8_SE_AF0EM1_AF1EM1_AMAS3_ASEM1_EPS1_FL1_GRVW2_GSU1_IU1_LPB0_LRVW2_NLCA1_PK0_PGR1_PLR1_SU32_SUM0_SUS256_SVW2_SNLL1_TT4_4_USFGRO0_VS1_VW2_WG16_8_1_WGM8
    SolutionIndex: 160
    SolutionNameMin: Cijk_Ailk_Bljk_DB_MT64x48x4_SN_AF0EM1_AF1EM1_AMAS3_ASEM1_EPS1_FL1_GRVW2_GSU1_IU1_LPB0_LRVW2_NLCA1_PK0_PGR1_PLR0_SU32_SUM0_SUS256_SVW2_SNLL1_TT4_6_USFGRO0_VS1_VW2_WG16_8_1_WGM8
    SolutionIndex: 161
    SolutionNameMin: Cijk_Ailk_Bljk_DB_MT128x64x8_SE_AF0EM1_AF1EM1_AMAS3_ASEM1_EPS1_FL0_GRVW2_GSU1_IU1_LPB0_LRVW2_NLCA1_PK0_PGR1_PLR0_SU32_SUM0_SUS256_SVW4_SNLL0_TT4_4_USFGROn1_VSn1_VW2_WG32_16_1_WGM8
    SolutionIndex: 162
    SolutionNameMin: Cijk_Ailk_Bljk_DB_MT64x32x4_SE_AF0EM1_AF1EM1_AMAS3_ASEM1_EPS1_FL1_GRVW2_GSU1_IU1_LPB0_LRVW2_NLCA1_PK0_PGR1_PLR0_SU32_SUM0_SUS256_SVW2_SNLL1_TT4_4_USFGRO0_VS1_VW2_WG16_8_1_WGM1
    SolutionIndex: 163
    SolutionNameMin: Cijk_Ailk_Bljk_DB_MT96x64x8_SN_AF0EM1_AF1EM1_AMAS3_ASEM1_EPS1_FL1_GRVW2_GSU1_IU1_LPB0_LRVW2_NLCA1_PK4_PGR1_PLR1_SU0_SUM0_SUS256_SVW2_SNLL0_TT6_4_USFGRO0_VS1_VW2_WG16_16_1_WGM1
    SolutionIndex: 164
    SolutionNameMin: Cijk_Ailk_Bljk_DB_MT64x64x8_SE_AF0EM1_AF1EM1_AMAS3_ASEM1_EPS1_FL1_GRVW2_GSU1_IU1_LPB0_LRVW2_NLCA1_PK4_PGR1_PLR0_SU32_SUM0_SUS256_SVW2_SNLL1_TT4_4_USFGRO0_VS1_VW2_WG16_16_1_WGM8
    SolutionIndex: 165
    SolutionNameMin: Cijk_Ailk_Bljk_DB_MT64x96x8_SN_AF0EM1_AF1EM1_AMAS3_ASEM1_EPS1_FL1_GRVW2_GSU1_IU1_LPB0_LRVW2_NLCA1_PK2_PGR1_PLR1_SU32_SUM0_SUS256_SVW2_SNLL1_TT4_6_USFGRO0_VS1_VW2_WG16_16_1_WGM8
    SolutionIndex: 166
    SolutionNameMin: Cijk_Ailk_Bljk_DB_MT96x64x8_SN_AF0EM1_AF1EM1_AMAS3_ASEM1_EPS1_FL1_GRVW2_GSU1_IU1_LPB0_LRVW2_NLCA1_PK0_PGR1_PLR1_SU0_SUM0_SUS256_SVW2_SNLL1_TT6_4_USFGRO0_VS1_VW2_WG16_16_1_WGM1
    SolutionIndex: 167
    SolutionNameMin: Cijk_Ailk_Bljk_DB_MT64x32x8_SN_AF0EM1_AF1EM1_AMAS3_ASEM1_EPS1_FL1_GRVW2_GSU1_IU1_LPB0_LRVW2_NLCA1_PK0_PGR1_PLR1_SU32_SUM0_SUS256_SVW2_SNLL1_TT4_4_USFGRO0_VS1_VW2_WG16_8_1_WGM8
    SolutionIndex: 168
    SolutionNameMin: Cijk_Ailk_Bljk_DB_MT96x32x8_SN_AF0EM1_AF1EM1_AMAS3_ASEM1_EPS1_FL1_GRVW2_GSU1_IU1_LPB0_LRVW2_NLCA1_PK0_PGR1_PLR1_SU0_SUM0_SUS256_SVW2_SNLL1_TT6_4_USFGRO0_VS1_VW2_WG16_8_1_WGM1
    SolutionIndex: 169
    SolutionNameMin: Cijk_Ailk_Bljk_DB_MT32x64x4_SE_AF0EM1_AF1EM1_AMAS3_ASEM1_EPS1_FL1_GRVW2_GSU1_IU1_LPB0_LRVW2_NLCA1_PK0_PGR1_PLR1_SU0_SUM0_SUS256_SVW2_SNLL1_TT4_4_USFGRO0_VS1_VW2_WG8_16_1_WGM1
    SolutionIndex: 170
    SolutionNameMin: Cijk_Ailk_Bljk_DB_MT96x32x8_SE_AF0EM1_AF1EM1_AMAS3_ASEM1_EPS1_FL0_GRVW2_GSU1_IU1_LPB0_LRVW2_NLCA3_PK0_PGR1_PLR1_SU32_SUM0_SUS256_SVW4_SNLL0_TT6_4_USFGROn1_VSn1_VW2_WG16_8_1_WGM8
    SolutionIndex: 171
    SolutionNameMin: Cijk_Ailk_Bljk_DB_MT64x64x8_SE_AF0EM1_AF1EM1_AMAS3_ASEM1_EPS1_FL1_GRVW2_GSU1_IU1_LPB0_LRVW2_NLCA1_PK0_PGR1_PLR1_SU0_SUM0_SUS256_SVW2_SNLL1_TT4_4_USFGRO0_VS1_VW2_WG16_16_1_WGM1
    SolutionIndex: 172
    SolutionNameMin: Cijk_Ailk_Bljk_DB_MT64x64x8_SE_AF0EM1_AF1EM1_AMAS3_ASEM1_EPS1_FL1_GRVW2_GSU1_IU1_LPB0_LRVW2_NLCA1_PK4_PGR1_PLR1_SU32_SUM0_SUS256_SVW2_SNLL0_TT4_4_USFGRO0_VS1_VW2_WG16_16_1_WGM8
    SolutionIndex: 173
    SolutionNameMin: Cijk_Ailk_Bljk_DB_MT64x48x4_SN_AF0EM1_AF1EM1_AMAS3_ASEM1_EPS1_FL1_GRVW2_GSU1_IU1_LPB0_LRVW2_NLCA1_PK0_PGR1_PLR1_SU32_SUM0_SUS256_SVW2_SNLL0_TT4_6_USFGRO0_VS1_VW2_WG16_8_1_WGM1
    SolutionIndex: 174
    SolutionNameMin: Cijk_Ailk_Bljk_DB_MT96x32x8_SN_AF0EM1_AF1EM1_AMAS3_ASEM1_EPS1_FL1_GRVW2_GSU1_IU1_LPB0_LRVW2_NLCA1_PK0_PGR1_PLR1_SU32_SUM0_SUS256_SVW2_SNLL0_TT6_4_USFGRO0_VS1_VW2_WG16_8_1_WGM8
    SolutionIndex: 175
    SolutionNameMin: Cijk_Ailk_Bljk_DB_MT128x64x8_SE_AF0EM1_AF1EM1_AMAS3_ASEM1_EPS1_FL1_GRVW2_GSU1_IU1_LPB0_LRVW2_NLCA1_PK0_PGR1_PLR0_SU0_SUM0_SUS256_SVW4_SNLL0_TT8_4_USFGROn1_VSn1_VW2_WG16_16_1_WGM1
    SolutionIndex: 176
    SolutionNameMin: Cijk_Ailk_Bljk_DB_MT96x32x4_SN_AF0EM1_AF1EM1_AMAS3_ASEM1_EPS1_FL1_GRVW2_GSU1_IU1_LPB0_LRVW2_NLCA1_PK0_PGR1_PLR1_SU0_SUM0_SUS256_SVW2_SNLL1_TT6_4_USFGRO0_VS1_VW2_WG16_8_1_WGM1
    SolutionIndex: 177
    SolutionNameMin: Cijk_Ailk_Bljk_DB_MT64x64x8_SE_AF0EM1_AF1EM1_AMAS3_ASEM1_EPS1_FL1_GRVW2_GSU1_IU1_LPB0_LRVW2_NLCA1_PK0_PGR1_PLR1_SU32_SUM0_SUS256_SVW2_SNLL0_TT4_4_USFGRO0_VS1_VW2_WG16_16_1_WGM1
    SolutionIndex: 178
    SolutionNameMin: Cijk_Ailk_Bljk_DB_MT128x32x4_SN_AF0EM1_AF1EM1_AMAS3_ASEM1_EPS1_FL1_GRVW2_GSU1_IU1_LPB0_LRVW2_NLCA1_PK0_PGR1_PLR0_SU32_SUM0_SUS256_SVW2_SNLL1_TT8_4_USFGRO0_VS1_VW2_WG16_8_1_WGM1
    SolutionIndex: 179
    SolutionNameMin: Cijk_Ailk_Bljk_DB_MT32x64x8_SE_AF0EM1_AF1EM1_AMAS3_ASEM1_EPS1_FL1_GRVW2_GSU1_IU1_LPB0_LRVW2_NLCA1_PK0_PGR1_PLR1_SU32_SUM0_SUS256_SVW2_SNLL1_TT4_4_USFGRO0_VS1_VW2_WG8_16_1_WGM8
    SolutionIndex: 180
    SolutionNameMin: Cijk_Ailk_Bljk_DB_MT64x48x4_SN_AF0EM1_AF1EM1_AMAS3_ASEM1_EPS1_FL1_GRVW2_GSU1_IU1_LPB0_LRVW2_NLCA1_PK0_PGR1_PLR1_SU32_SUM0_SUS256_SVW2_SNLL1_TT4_6_USFGRO0_VS1_VW2_WG16_8_1_WGM8
    SolutionIndex: 181
    SolutionNameMin: Cijk_Ailk_Bljk_DB_MT64x32x8_SE_AF0EM1_AF1EM1_AMAS0_ASEM1_EPS1_FL0_GRVW1_GSU1_IU1_LPB0_LRVW1_NLCA1_PK0_PGR1_PLR1_SU32_SUM0_SUS256_SVW2_SNLL0_TT4_4_USFGRO1_VS1_VW1_WG16_8_1_WGM1
    SolutionIndex: 182
    SolutionNameMin: Cijk_Ailk_Bljk_DB_MT64x48x8_SN_AF0EM1_AF1EM1_AMAS3_ASEM1_EPS1_FL1_GRVW2_GSU1_IU1_LPB0_LRVW2_NLCA1_PK0_PGR1_PLR1_SU32_SUM0_SUS256_SVW2_SNLL0_TT4_6_USFGRO0_VS1_VW2_WG16_8_1_WGM8
    SolutionIndex: 183
    SolutionNameMin: Cijk_Ailk_Bljk_DB_MT64x64x8_SE_AF0EM1_AF1EM1_AMAS3_ASEM1_EPS1_FL1_GRVW2_GSU1_IU1_LPB0_LRVW2_NLCA1_PK0_PGR1_PLR0_SU32_SUM0_SUS256_SVW2_SNLL1_TT4_4_USFGRO0_VS1_VW2_WG16_16_1_WGM1
    SolutionIndex: 184
    SolutionNameMin: Cijk_Ailk_Bljk_DB_MT64x64x8_SE_AF0EM1_AF1EM1_AMAS3_ASEM1_EPS1_FL1_GRVW2_GSU1_IU1_LPB0_LRVW2_NLCA1_PK0_PGR1_PLR1_SU32_SUM0_SUS256_SVW2_SNLL1_TT4_4_USFGRO0_VS1_VW2_WG16_16_1_WGM1
    SolutionIndex: 185
    SolutionNameMin: Cijk_Ailk_Bljk_DB_MT64x64x8_SN_AF0EM1_AF1EM1_AMAS3_ASEM1_EPS1_FL1_GRVW2_GSU1_IU1_LPB0_LRVW2_NLCA1_PK4_PGR1_PLR1_SU32_SUM0_SUS256_SVW2_SNLL1_TT4_4_USFGRO0_VS1_VW2_WG16_16_1_WGM1
    SolutionIndex: 186
    SolutionNameMin: Cijk_Ailk_Bljk_DB_MT128x64x4_SN_AF0EM1_AF1EM1_AMAS3_ASEM1_EPS1_FL1_GRVW2_GSU1_IU1_LPB0_LRVW2_NLCA1_PK2_PGR1_PLR1_SU32_SUM0_SUS256_SVW2_SNLL0_TT8_4_USFGRO0_VS1_VW2_WG16_16_1_WGM1
    SolutionIndex: 187
    SolutionNameMin: Cijk_Ailk_Bljk_DB_MT64x48x4_SE_AF0EM1_AF1EM1_AMAS3_ASEM1_EPS1_FL1_GRVW2_GSU1_IU1_LPB0_LRVW2_NLCA1_PK0_PGR1_PLR1_SU0_SUM0_SUS256_SVW2_SNLL1_TT4_6_USFGRO0_VS1_VW2_WG16_8_1_WGM1
    SolutionIndex: 188
    SolutionNameMin: Cijk_Ailk_Bljk_DB_MT128x32x4_SN_AF0EM1_AF1EM1_AMAS3_ASEM1_EPS1_FL1_GRVW2_GSU1_IU1_LPB0_LRVW2_NLCA1_PK0_PGR1_PLR0_SU32_SUM0_SUS256_SVW2_SNLL0_TT8_4_USFGRO0_VS1_VW2_WG16_8_1_WGM1
    SolutionIndex: 189
    SolutionNameMin: Cijk_Ailk_Bljk_DB_MT64x64x8_SE_AF0EM1_AF1EM1_AMAS3_ASEM1_EPS1_FL1_GRVW2_GSU1_IU1_LPB0_LRVW2_NLCA1_PK4_PGR1_PLR0_SU32_SUM0_SUS256_SVW2_SNLL0_TT4_4_USFGRO0_VS1_VW2_WG16_16_1_WGM1
    SolutionIndex: 190
    SolutionNameMin: Cijk_Ailk_Bljk_DB_MT64x32x4_SE_AF0EM1_AF1EM1_AMAS3_ASEM1_EPS1_FL1_GRVW2_GSU1_IU1_LPB0_LRVW2_NLCA1_PK0_PGR1_PLR0_SU0_SUM0_SUS256_SVW2_SNLL0_TT4_4_USFGRO0_VS1_VW2_WG16_8_1_WGM1
    SolutionIndex: 191
    SolutionNameMin: Cijk_Ailk_Bljk_DB_MT64x64x8_SE_AF0EM1_AF1EM1_AMAS3_ASEM1_EPS1_FL1_GRVW2_GSU1_IU1_LPB0_LRVW2_NLCA1_PK4_PGR1_PLR1_SU32_SUM0_SUS256_SVW2_SNLL0_TT4_4_USFGRO0_VS1_VW2_WG16_16_1_WGM1
    SolutionIndex: 192
    SolutionNameMin: Cijk_Ailk_Bljk_DB_MT64x48x8_SN_AF0EM1_AF1EM1_AMAS3_ASEM1_EPS1_FL1_GRVW2_GSU1_IU1_LPB0_LRVW2_NLCA1_PK0_PGR1_PLR1_SU32_SUM0_SUS256_SVW2_SNLL1_TT4_6_USFGRO0_VS1_VW2_WG16_8_1_WGM1
    SolutionIndex: 193
    SolutionNameMin: Cijk_Ailk_Bljk_DB_MT128x64x8_SN_AF0EM1_AF1EM1_AMAS3_ASEM1_EPS1_FL1_GRVW2_GSU1_IU1_LPB0_LRVW2_NLCA1_PK0_PGR1_PLR0_SU32_SUM0_SUS256_SVW2_SNLL0_TT4_4_USFGRO0_VS1_VW2_WG32_16_1_WGM1
    SolutionIndex: 194
    SolutionNameMin: Cijk_Ailk_Bljk_DB_MT64x32x8_SE_AF0EM1_AF1EM1_AMAS3_ASEM1_EPS1_FL1_GRVW2_GSU1_IU1_LPB0_LRVW2_NLCA1_PK4_PGR1_PLR1_SU0_SUM0_SUS256_SVW2_SNLL0_TT4_4_USFGRO0_VS1_VW2_WG16_8_1_WGM1
    SolutionIndex: 195
    SolutionNameMin: Cijk_Ailk_Bljk_DB_MT64x96x8_SN_AF0EM1_AF1EM1_AMAS3_ASEM1_EPS1_FL1_GRVW2_GSU1_IU1_LPB0_LRVW2_NLCA1_PK0_PGR1_PLR1_SU0_SUM0_SUS256_SVW2_SNLL0_TT4_6_USFGRO0_VS1_VW2_WG16_16_1_WGM1
    SolutionIndex: 196
    SolutionNameMin: Cijk_Ailk_Bljk_DB_MT64x32x8_SN_AF0EM1_AF1EM1_AMAS3_ASEM1_EPS1_FL1_GRVW2_GSU1_IU1_LPB0_LRVW2_NLCA1_PK4_PGR1_PLR1_SU0_SUM0_SUS256_SVW2_SNLL1_TT4_4_USFGRO0_VS1_VW2_WG16_8_1_WGM1
    SolutionIndex: 197
    SolutionNameMin: Cijk_Ailk_Bljk_DB_MT96x64x8_SN_AF0EM1_AF1EM1_AMAS3_ASEM1_EPS1_FL1_GRVW2_GSU1_IU1_LPB0_LRVW2_NLCA1_PK2_PGR1_PLR1_SU0_SUM0_SUS256_SVW2_SNLL1_TT6_4_USFGRO0_VS1_VW2_WG16_16_1_WGM8
    SolutionIndex: 198
    SolutionNameMin: Cijk_Ailk_Bljk_DB_MT64x64x8_SN_AF0EM1_AF1EM1_AMAS3_ASEM1_EPS1_FL1_GRVW2_GSU1_IU1_LPB0_LRVW2_NLCA1_PK0_PGR1_PLR1_SU32_SUM0_SUS256_SVW2_SNLL1_TT4_4_USFGRO0_VS1_VW2_WG16_16_1_WGM1
    SolutionIndex: 199
    SolutionNameMin: Cijk_Ailk_Bljk_DB_MT64x32x4_SE_AF0EM1_AF1EM1_AMAS3_ASEM1_EPS1_FL1_GRVW2_GSU1_IU1_LPB0_LRVW2_NLCA1_PK0_PGR1_PLR0_SU0_SUM0_SUS256_SVW2_SNLL1_TT4_4_USFGRO0_VS1_VW2_WG16_8_1_WGM1
    SolutionIndex: 200
    SolutionNameMin: Cijk_Ailk_Bljk_DB_MT64x48x4_SN_AF0EM1_AF1EM1_AMAS3_ASEM1_EPS1_FL1_GRVW2_GSU1_IU1_LPB0_LRVW2_NLCA1_PK0_PGR1_PLR1_SU0_SUM0_SUS256_SVW2_SNLL1_TT4_6_USFGRO0_VS1_VW2_WG16_8_1_WGM1
    SolutionIndex: 201
    SolutionNameMin: Cijk_Ailk_Bljk_DB_MT64x48x4_SN_AF0EM1_AF1EM1_AMAS3_ASEM1_EPS1_FL1_GRVW2_GSU1_IU1_LPB0_LRVW2_NLCA1_PK0_PGR1_PLR1_SU0_SUM0_SUS256_SVW2_SNLL0_TT4_6_USFGRO0_VS1_VW2_WG16_8_1_WGM1
    SolutionIndex: 202
    SolutionNameMin: Cijk_Ailk_Bljk_DB_MT96x64x8_SE_AF0EM1_AF1EM1_AMAS3_ASEM1_EPS1_FL1_GRVW2_GSU1_IU1_LPB0_LRVW2_NLCA1_PK4_PGR1_PLR1_SU0_SUM0_SUS256_SVW2_SNLL1_TT6_4_USFGRO0_VS1_VW2_WG16_16_1_WGM8
    SolutionIndex: 203
    SolutionNameMin: Cijk_Ailk_Bljk_DB_MT64x64x8_SN_AF0EM1_AF1EM1_AMAS3_ASEM1_EPS1_FL1_GRVW2_GSU1_IU1_LPB0_LRVW2_NLCA1_PK4_PGR1_PLR0_SU32_SUM0_SUS256_SVW2_SNLL1_TT4_4_USFGRO0_VS1_VW2_WG16_16_1_WGM8
    SolutionIndex: 204
    SolutionNameMin: Cijk_Ailk_Bljk_DB_MT96x64x4_SN_AF0EM1_AF1EM1_AMAS3_ASEM1_EPS1_FL1_GRVW2_GSU1_IU1_LPB0_LRVW2_NLCA1_PK4_PGR1_PLR0_SU32_SUM0_SUS256_SVW2_SNLL0_TT6_4_USFGRO0_VS1_VW2_WG16_16_1_WGM8
    SolutionIndex: 205
    SolutionNameMin: Cijk_Ailk_Bljk_DB_MT64x48x4_SN_AF0EM1_AF1EM1_AMAS3_ASEM1_EPS1_FL1_GRVW2_GSU1_IU1_LPB0_LRVW2_NLCA1_PK4_PGR1_PLR1_SU0_SUM0_SUS256_SVW2_SNLL0_TT4_6_USFGRO0_VS1_VW2_WG16_8_1_WGM1
    SolutionIndex: 206
    SolutionNameMin: Cijk_Ailk_Bljk_DB_MT96x32x8_SN_AF0EM1_AF1EM1_AMAS3_ASEM1_EPS1_FL1_GRVW2_GSU1_IU1_LPB0_LRVW2_NLCA1_PK4_PGR1_PLR1_SU32_SUM0_SUS256_SVW2_SNLL1_TT6_4_USFGRO0_VS1_VW2_WG16_8_1_WGM8
    SolutionIndex: 207
    SolutionNameMin: Cijk_Ailk_Bljk_DB_MT64x32x4_SE_AF0EM1_AF1EM1_AMAS3_ASEM1_EPS1_FL1_GRVW2_GSU1_IU1_LPB0_LRVW2_NLCA1_PK0_PGR1_PLR1_SU32_SUM0_SUS256_SVW2_SNLL1_TT4_4_USFGRO0_VS1_VW2_WG16_8_1_WGM1
    SolutionIndex: 208
    SolutionNameMin: Cijk_Ailk_Bljk_DB_MT64x96x8_SE_AF0EM1_AF1EM1_AMAS3_ASEM1_EPS1_FL1_GRVW2_GSU1_IU1_LPB0_LRVW2_NLCA1_PK4_PGR1_PLR1_SU32_SUM0_SUS256_SVW2_SNLL0_TT4_6_USFGRO0_VS1_VW2_WG16_16_1_WGM8
    SolutionIndex: 209
    SolutionNameMin: Cijk_Ailk_Bljk_DB_MT64x64x8_SE_AF0EM1_AF1EM1_AMAS3_ASEM1_EPS1_FL1_GRVW2_GSU1_IU1_LPB0_LRVW2_NLCA1_PK4_PGR1_PLR1_SU32_SUM0_SUS256_SVW2_SNLL1_TT4_4_USFGRO0_VS1_VW2_WG16_16_1_WGM1
    SolutionIndex: 210
    SolutionNameMin: Cijk_Ailk_Bljk_DB_MT96x96x4_SN_AF0EM1_AF1EM1_AMAS3_ASEM1_EPS1_FL1_GRVW2_GSU1_IU1_LPB0_LRVW2_NLCA1_PK2_PGR1_PLR0_SU32_SUM0_SUS256_SVW2_SNLL0_TT6_6_USFGRO0_VS1_VW2_WG16_16_1_WGM1
    SolutionIndex: 211
    SolutionNameMin: Cijk_Ailk_Bljk_DB_MT32x64x4_SE_AF0EM1_AF1EM1_AMAS3_ASEM1_EPS1_FL1_GRVW2_GSU1_IU1_LPB0_LRVW2_NLCA1_PK0_PGR1_PLR1_SU0_SUM0_SUS256_SVW2_SNLL1_TT4_4_USFGRO0_VS1_VW2_WG8_16_1_WGM8
    SolutionIndex: 212
    SolutionNameMin: Cijk_Ailk_Bljk_DB_MT64x48x4_SN_AF0EM1_AF1EM1_AMAS3_ASEM1_EPS1_FL1_GRVW2_GSU1_IU1_LPB0_LRVW2_NLCA1_PK0_PGR1_PLR1_SU0_SUM0_SUS256_SVW2_SNLL0_TT4_6_USFGRO0_VS1_VW2_WG16_8_1_WGM8
    SolutionIndex: 213
    SolutionNameMin: Cijk_Ailk_Bljk_DB_MT128x64x4_SE_AF0EM1_AF1EM1_AMAS3_ASEM1_EPS1_FL1_GRVW2_GSU1_IU1_LPB0_LRVW2_NLCA1_PK0_PGR1_PLR1_SU32_SUM0_SUS256_SVW2_SNLL1_TT8_4_USFGRO0_VS1_VW2_WG16_16_1_WGM1
    SolutionIndex: 214
    SolutionNameMin: Cijk_Ailk_Bljk_DB_MT128x64x4_SN_AF0EM1_AF1EM1_AMAS3_ASEM1_EPS1_FL1_GRVW2_GSU1_IU1_LPB0_LRVW2_NLCA1_PK4_PGR1_PLR1_SU32_SUM0_SUS256_SVW2_SNLL0_TT8_4_USFGRO0_VS1_VW2_WG16_16_1_WGM8
    SolutionIndex: 215
    SolutionNameMin: Cijk_Ailk_Bljk_DB_MT96x64x4_SE_AF0EM1_AF1EM1_AMAS3_ASEM1_EPS1_FL1_GRVW2_GSU1_IU1_LPB0_LRVW2_NLCA1_PK0_PGR1_PLR0_SU32_SUM0_SUS256_SVW2_SNLL1_TT6_4_USFGRO0_VS1_VW2_WG16_16_1_WGM1
    SolutionIndex: 216
    SolutionNameMin: Cijk_Ailk_Bljk_DB_MT96x96x4_SE_AF0EM1_AF1EM1_AMAS3_ASEM1_EPS1_FL1_GRVW2_GSU1_IU1_LPB0_LRVW2_NLCA1_PK0_PGR1_PLR0_SU0_SUM0_SUS256_SVW4_SNLL0_TT6_6_USFGROn1_VSn1_VW2_WG16_16_1_WGM8
    SolutionIndex: 217
    SolutionNameMin: Cijk_Ailk_Bljk_DB_MT96x32x4_SN_AF0EM1_AF1EM1_AMAS3_ASEM1_EPS1_FL1_GRVW2_GSU1_IU1_LPB0_LRVW2_NLCA1_PK0_PGR1_PLR1_SU32_SUM0_SUS256_SVW2_SNLL0_TT6_4_USFGRO0_VS1_VW2_WG16_8_1_WGM1
    SolutionIndex: 218
    SolutionNameMin: Cijk_Ailk_Bljk_DB_MT64x64x8_SE_AF0EM1_AF1EM1_AMAS3_ASEM1_EPS1_FL1_GRVW2_GSU1_IU1_LPB0_LRVW2_NLCA1_PK0_PGR1_PLR0_SU0_SUM0_SUS256_SVW2_SNLL1_TT4_4_USFGRO0_VS1_VW2_WG16_16_1_WGM8
    SolutionIndex: 219
    SolutionNameMin: Cijk_Ailk_Bljk_DB_MT64x96x8_SN_AF0EM1_AF1EM1_AMAS3_ASEM1_EPS1_FL1_GRVW2_GSU1_IU1_LPB0_LRVW2_NLCA1_PK4_PGR1_PLR1_SU32_SUM0_SUS256_SVW2_SNLL0_TT4_6_USFGRO0_VS1_VW2_WG16_16_1_WGM1
    SolutionIndex: 220
    SolutionNameMin: Cijk_Ailk_Bljk_DB_MT64x32x8_SN_AF0EM1_AF1EM1_AMAS3_ASEM1_EPS1_FL1_GRVW2_GSU1_IU1_LPB0_LRVW2_NLCA1_PK4_PGR1_PLR1_SU32_SUM0_SUS256_SVW2_SNLL1_TT4_4_USFGRO0_VS1_VW2_WG16_8_1_WGM8
    SolutionIndex: 221
    SolutionNameMin: Cijk_Ailk_Bljk_DB_MT128x128x8_SN_AF0EM2_AF1EM2_AMAS3_ASEM2_EPS1_FL0_GRVW2_GSU1_IU1_LPB0_LRVW2_NLCA1_PK0_PGR1_PLR1_SU32_SUM0_SUS256_SVW2_SNLL1_TT8_4_USFGRO1_VS1_VW2_WG16_32_1_WGM8
    SolutionIndex: 222
    SolutionNameMin: Cijk_Ailk_Bljk_DB_MT96x32x4_SN_AF0EM1_AF1EM1_AMAS3_ASEM1_EPS1_FL1_GRVW2_GSU1_IU1_LPB0_LRVW2_NLCA1_PK0_PGR1_PLR1_SU32_SUM0_SUS256_SVW2_SNLL1_TT6_4_USFGRO0_VS1_VW2_WG16_8_1_WGM1
    SolutionIndex: 223
    SolutionNameMin: Cijk_Ailk_Bljk_DB_MT64x32x8_SN_AF0EM1_AF1EM1_AMAS3_ASEM1_EPS1_FL1_GRVW2_GSU1_IU1_LPB0_LRVW2_NLCA1_PK4_PGR1_PLR1_SU32_SUM0_SUS256_SVW2_SNLL1_TT4_4_USFGRO0_VS1_VW2_WG16_8_1_WGM1
    SolutionIndex: 224
    SolutionNameMin: Cijk_Ailk_Bljk_DB_MT64x64x8_SE_AF0EM1_AF1EM1_AMAS3_ASEM1_EPS1_FL1_GRVW2_GSU1_IU1_LPB0_LRVW2_NLCA1_PK4_PGR1_PLR1_SU32_SUM0_SUS256_SVW2_SNLL1_TT4_4_USFGRO0_VS1_VW2_WG16_16_1_WGM8
    SolutionIndex: 225
    SolutionNameMin: Cijk_Ailk_Bljk_DB_MT96x64x4_SE_AF0EM1_AF1EM1_AMAS3_ASEM1_EPS1_FL1_GRVW2_GSU1_IU1_LPB0_LRVW2_NLCA1_PK0_PGR1_PLR0_SU32_SUM0_SUS256_SVW2_SNLL0_TT6_4_USFGRO0_VS1_VW2_WG16_16_1_WGM1
    SolutionIndex: 226
    SolutionNameMin: Cijk_Ailk_Bljk_DB_MT128x64x8_SN_AF0EM1_AF1EM1_AMAS3_ASEM1_EPS1_FL1_GRVW2_GSU1_IU1_LPB0_LRVW2_NLCA1_PK0_PGR1_PLR0_SU0_SUM0_SUS256_SVW2_SNLL1_TT4_4_USFGRO0_VS1_VW2_WG32_16_1_WGM1
    SolutionIndex: 227
    SolutionNameMin: Cijk_Ailk_Bljk_DB_MT96x64x8_SE_AF0EM1_AF1EM1_AMAS3_ASEM1_EPS1_FL1_GRVW2_GSU1_IU1_LPB0_LRVW2_NLCA1_PK0_PGR1_PLR1_SU32_SUM0_SUS256_SVW2_SNLL0_TT6_4_USFGRO0_VS1_VW2_WG16_16_1_WGM8
    SolutionIndex: 228
    SolutionNameMin: Cijk_Ailk_Bljk_DB_MT96x64x8_SN_AF0EM1_AF1EM1_AMAS3_ASEM1_EPS1_FL1_GRVW2_GSU1_IU1_LPB0_LRVW2_NLCA1_PK0_PGR1_PLR1_SU32_SUM0_SUS256_SVW2_SNLL1_TT6_4_USFGRO0_VS1_VW2_WG16_16_1_WGM1
    SolutionIndex: 229
    SolutionNameMin: Cijk_Ailk_Bljk_DB_MT64x64x8_SE_AF0EM1_AF1EM1_AMAS3_ASEM1_EPS1_FL1_GRVW2_GSU1_IU1_LPB0_LRVW2_NLCA1_PK0_PGR1_PLR1_SU32_SUM0_SUS256_SVW2_SNLL1_TT4_4_USFGRO0_VS1_VW2_WG16_16_1_WGM8
    SolutionIndex: 230
    SolutionNameMin: Cijk_Ailk_Bljk_DB_MT128x64x8_SN_AF0EM1_AF1EM1_AMAS3_ASEM1_EPS1_FL1_GRVW2_GSU1_IU1_LPB0_LRVW2_NLCA1_PK2_PGR1_PLR0_SU0_SUM0_SUS256_SVW2_SNLL0_TT4_4_USFGRO0_VS1_VW2_WG32_16_1_WGM8
    SolutionIndex: 231
    SolutionNameMin: Cijk_Ailk_Bljk_DB_MT64x48x4_SN_AF0EM1_AF1EM1_AMAS3_ASEM1_EPS1_FL1_GRVW2_GSU1_IU1_LPB0_LRVW2_NLCA1_PK4_PGR1_PLR1_SU32_SUM0_SUS256_SVW2_SNLL0_TT4_6_USFGRO0_VS1_VW2_WG16_8_1_WGM1
    SolutionIndex: 232
    SolutionNameMin: Cijk_Ailk_Bljk_DB_MT64x64x8_SN_AF0EM1_AF1EM1_AMAS3_ASEM1_EPS1_FL1_GRVW2_GSU1_IU1_LPB0_LRVW2_NLCA1_PK0_PGR1_PLR0_SU32_SUM0_SUS256_SVW2_SNLL0_TT4_4_USFGRO0_VS1_VW2_WG16_16_1_WGM1
    SolutionIndex: 233
    SolutionNameMin: Cijk_Ailk_Bljk_DB_MT64x32x8_SE_AF0EM1_AF1EM1_AMAS3_ASEM1_EPS1_FL1_GRVW2_GSU1_IU1_LPB0_LRVW2_NLCA1_PK4_PGR1_PLR1_SU0_SUM0_SUS256_SVW2_SNLL1_TT4_4_USFGRO0_VS1_VW2_WG16_8_1_WGM1
    SolutionIndex: 234
    SolutionNameMin: Cijk_Ailk_Bljk_DB_MT64x32x4_SN_AF0EM1_AF1EM1_AMAS3_ASEM1_EPS1_FL1_GRVW2_GSU1_IU1_LPB0_LRVW2_NLCA1_PK4_PGR1_PLR1_SU32_SUM0_SUS256_SVW2_SNLL0_TT4_4_USFGRO0_VS1_VW2_WG16_8_1_WGM8
    SolutionIndex: 235
    SolutionNameMin: Cijk_Ailk_Bljk_DB_MT64x64x4_SN_AF0EM1_AF1EM1_AMAS3_ASEM1_EPS1_FL1_GRVW2_GSU1_IU1_LPB0_LRVW2_NLCA1_PK0_PGR1_PLR0_SU32_SUM0_SUS256_SVW2_SNLL1_TT4_8_USFGRO0_VS1_VW2_WG16_8_1_WGM1
    SolutionIndex: 236
    SolutionNameMin: Cijk_Ailk_Bljk_DB_MT64x64x8_SE_AF0EM1_AF1EM1_AMAS3_ASEM1_EPS1_FL1_GRVW2_GSU1_IU1_LPB0_LRVW2_NLCA1_PK0_PGR1_PLR0_SU32_SUM0_SUS256_SVW2_SNLL0_TT4_4_USFGRO0_VS1_VW2_WG16_16_1_WGM8
    SolutionIndex: 237
    SolutionNameMin: Cijk_Ailk_Bljk_DB_MT96x32x8_SN_AF0EM1_AF1EM1_AMAS3_ASEM1_EPS1_FL1_GRVW2_GSU1_IU1_LPB0_LRVW2_NLCA1_PK0_PGR1_PLR1_SU32_SUM0_SUS256_SVW2_SNLL1_TT6_4_USFGRO0_VS1_VW2_WG16_8_1_WGM1
    SolutionIndex: 238
    SolutionNameMin: Cijk_Ailk_Bljk_DB_MT96x32x4_SN_AF0EM1_AF1EM1_AMAS3_ASEM1_EPS1_FL1_GRVW2_GSU1_IU1_LPB0_LRVW2_NLCA1_PK0_PGR1_PLR1_SU32_SUM0_SUS256_SVW2_SNLL0_TT6_4_USFGRO0_VS1_VW2_WG16_8_1_WGM8
    SolutionIndex: 239
    SolutionNameMin: Cijk_Ailk_Bljk_DB_MT64x32x4_SE_AF0EM1_AF1EM1_AMAS3_ASEM1_EPS1_FL1_GRVW2_GSU1_IU1_LPB0_LRVW2_NLCA1_PK4_PGR1_PLR1_SU0_SUM0_SUS256_SVW2_SNLL0_TT4_4_USFGRO0_VS1_VW2_WG16_8_1_WGM8
    SolutionIndex: 240
    SolutionNameMin: Cijk_Ailk_Bljk_DB_MT96x64x8_SN_AF0EM1_AF1EM1_AMAS3_ASEM1_EPS1_FL1_GRVW2_GSU1_IU1_LPB0_LRVW2_NLCA1_PK0_PGR1_PLR1_SU0_SUM0_SUS256_SVW2_SNLL1_TT6_4_USFGRO0_VS1_VW2_WG16_16_1_WGM8
    SolutionIndex: 241
    SolutionNameMin: Cijk_Ailk_Bljk_DB_MT128x64x8_SN_AF0EM1_AF1EM1_AMAS3_ASEM1_EPS1_FL1_GRVW2_GSU1_IU1_LPB0_LRVW2_NLCA1_PK0_PGR1_PLR0_SU32_SUM0_SUS256_SVW2_SNLL0_TT4_4_USFGRO0_VS1_VW2_WG32_16_1_WGM8
    SolutionIndex: 248
    SolutionNameMin: Cijk_Ailk_Bljk_DB_MT96x64x8_SN_AF0EM1_AF1EM1_AMAS3_ASEM1_EPS1_FL1_GRVW2_GSU1_IU1_LPB0_LRVW2_NLCA1_PK4_PGR1_PLR1_SU0_SUM0_SUS256_SVW2_SNLL1_TT6_4_USFGRO0_VS1_VW2_WG16_16_1_WGM8
- - - [41728, 41728, 1, 256]
    - [57, 87.777]
  - - [12032, 12032, 1, 256]
    - [101, 86.073]
  - - [15360, 15360, 1, 256]
    - [57, 87.468]
  - - [7680, 7680, 1, 384]
    - [12, 87.752]
  - - [35328, 35328, 1, 384]
    - [12, 90.826]
  - - [41088, 41088, 1, 384]
    - [10, 90.576]
  - - [21504, 21504, 1, 384]
    - [10, 90.511]
  - - [44544, 44544, 1, 384]
    - [12, 90.33]
  - - [33280, 33280, 1, 256]
    - [170, 88.214]
  - - [1152, 1152, 1, 384]
    - [112, 59.359]
  - - [13312, 13312, 1, 256]
    - [57, 86.791]
  - - [29952, 29952, 1, 256]
    - [170, 88.112]
  - - [13824, 13824, 1, 256]
    - [57, 87.229]
  - - [24576, 24576, 1, 384]
    - [170, 89.712]
  - - [44544, 44544, 1, 256]
    - [170, 87.933]
  - - [20736, 20736, 1, 384]
    - [12, 90.276]
  - - [31488, 31488, 1, 256]
    - [170, 88.167]
  - - [17664, 17664, 1, 384]
    - [12, 90.465]
  - - [26880, 26880, 1, 384]
    - [10, 90.716]
  - - [31872, 31872, 1, 384]
    - [57, 89.631]
  - - [4864, 4864, 1, 256]
    - [90, 80.266]
  - - [10240, 10240, 1, 256]
    - [57, 85.586]
  - - [16896, 16896, 1, 384]
    - [12, 90.551]
  - - [1, 1, 1, 64]
    - [0, 0.0]
  - - [9984, 9984, 1, 384]
    - [49, 88.952]
  - - [26496, 26496, 1, 384]
    - [10, 90.341]
  - - [2816, 2816, 1, 256]
    - [163, 71.317]
  - - [24832, 24832, 1, 256]
    - [170, 87.822]
  - - [8832, 8832, 1, 384]
    - [49, 88.661]
  - - [29184, 29184, 1, 384]
    - [10, 90.805]
  - - [42624, 42624, 1, 384]
    - [10, 90.695]
  - - [22272, 22272, 1, 384]
    - [10, 90.383]
  - - [39552, 39552, 1, 384]
    - [12, 90.576]
  - - [40448, 40448, 1, 256]
    - [170, 87.992]
  - - [44800, 44800, 1, 256]
    - [170, 87.872]
  - - [39680, 39680, 1, 256]
    - [170, 87.979]
  - - [30464, 30464, 1, 256]
    - [170, 87.941]
  - - [32768, 32768, 1, 256]
    - [90, 85.989]
  - - [12672, 12672, 1, 384]
    - [46, 89.673]
  - - [41984, 41984, 1, 256]
    - [170, 88.1]
  - - [11008, 11008, 1, 256]
    - [101, 86.391]
  - - [26112, 26112, 1, 384]
    - [10, 90.714]
  - - [3072, 3072, 1, 384]
    - [163, 78.732]
  - - [9984, 9984, 1, 256]
    - [160, 85.639]
  - - [38016, 38016, 1, 384]
    - [170, 90.354]
  - - [17408, 17408, 1, 256]
    - [101, 87.38]
  - - [43008, 43008, 1, 384]
    - [170, 90.649]
  - - [36096, 36096, 1, 384]
    - [10, 90.746]
  - - [33024, 33024, 1, 256]
    - [170, 88.193]
  - - [8448, 8448, 1, 256]
    - [107, 85.008]
  - - [23552, 23552, 1, 256]
    - [101, 87.632]
  - - [24064, 24064, 1, 256]
    - [170, 87.788]
  - - [41472, 41472, 1, 384]
    - [170, 90.552]
  - - [5120, 5120, 1, 256]
    - [101, 80.755]
  - - [7680, 7680, 1, 256]
    - [57, 84.752]
  - - [6400, 6400, 1, 256]
    - [101, 82.975]
  - - [8704, 8704, 1, 256]
    - [80, 84.797]
  - - [19968, 19968, 1, 256]
    - [170, 87.582]
  - - [40320, 40320, 1, 384]
    - [170, 90.568]
  - - [18432, 18432, 1, 256]
    - [170, 87.491]
  - - [19712, 19712, 1, 256]
    - [57, 87.562]
  - - [43776, 43776, 1, 384]
    - [10, 90.791]
  - - [25344, 25344, 1, 256]
    - [170, 87.946]
  - - [12800, 12800, 1, 256]
    - [57, 86.617]
  - - [10368, 10368, 1, 384]
    - [12, 88.913]
  - - [1280, 1280, 1, 256]
    - [18, 52.547]
  - - [10496, 10496, 1, 256]
    - [57, 85.528]
  - - [24960, 24960, 1, 384]
    - [10, 90.636]
  - - [6144, 6144, 1, 256]
    - [80, 82.239]
  - - [15616, 15616, 1, 256]
    - [57, 87.341]
  - - [9600, 9600, 1, 384]
    - [107, 88.906]
  - - [30720, 30720, 1, 256]
    - [170, 88.089]
  - - [1792, 1792, 1, 256]
    - [92, 57.94]
  - - [20480, 20480, 1, 256]
    - [170, 86.979]
  - - [17920, 17920, 1, 256]
    - [57, 87.574]
  - - [10752, 10752, 1, 384]
    - [49, 89.4]
  - - [39424, 39424, 1, 256]
    - [170, 88.019]
  - - [4224, 4224, 1, 384]
    - [65, 81.008]
  - - [29568, 29568, 1, 384]
    - [170, 90.163]
  - - [33792, 33792, 1, 256]
    - [170, 88.164]
  - - [25344, 25344, 1, 384]
    - [12, 90.726]
  - - [35072, 35072, 1, 256]
    - [170, 88.093]
  - - [1536, 1536, 1, 384]
    - [44, 60.033]
  - - [15744, 15744, 1, 384]
    - [10, 90.183]
  - - [29184, 29184, 1, 256]
    - [170, 88.122]
  - - [40192, 40192, 1, 256]
    - [170, 88.095]
  - - [9728, 9728, 1, 256]
    - [80, 85.472]
  - - [17152, 17152, 1, 256]
    - [101, 87.499]
  - - [30720, 30720, 1, 384]
    - [10, 90.665]
  - - [8192, 8192, 1, 256]
    - [90, 83.205]
  - - [31744, 31744, 1, 256]
    - [170, 88.156]
  - - [16128, 16128, 1, 384]
    - [12, 90.271]
  - - [34816, 34816, 1, 256]
    - [170, 87.985]
  - - [36352, 36352, 1, 256]
    - [170, 88.09]
  - - [38656, 38656, 1, 256]
    - [170, 88.113]
  - - [44032, 44032, 1, 256]
    - [170, 88.138]
  - - [9472, 9472, 1, 256]
    - [57, 85.457]
  - - [23296, 23296, 1, 256]
    - [57, 87.673]
  - - [34304, 34304, 1, 256]
    - [170, 88.013]
  - - [43520, 43520, 1, 256]
    - [170, 87.743]
  - - [19456, 19456, 1, 256]
    - [101, 87.709]
  - - [21120, 21120, 1, 384]
    - [10, 90.506]
  - - [6528, 6528, 1, 384]
    - [90, 86.424]
  - - [9216, 9216, 1, 256]
    - [101, 85.543]
  - - [25856, 25856, 1, 256]
    - [170, 87.725]
  - - [34176, 34176, 1, 384]
    - [57, 89.875]
  - - [32256, 32256, 1, 384]
    - [12, 90.788]
  - - [39936, 39936, 1, 384]
    - [10, 90.818]
  - - [9216, 9216, 1, 384]
    - [57, 88.178]
  - - [14848, 14848, 1, 256]
    - [101, 87.159]
  - - [23040, 23040, 1, 256]
    - [170, 87.95]
  - - [19200, 19200, 1, 256]
    - [57, 87.792]
  - - [1, 64, 1, 64]
    - [0, 0.001]
  - - [14592, 14592, 1, 384]
    - [12, 90.25]
  - - [21888, 21888, 1, 384]
    - [10, 90.55]
  - - [768, 768, 1, 256]
    - [106, 34.478]
  - - [26112, 26112, 1, 256]
    - [57, 87.85]
  - - [27648, 27648, 1, 384]
    - [12, 90.775]
  - - [20992, 20992, 1, 256]
    - [101, 87.727]
  - - [15104, 15104, 1, 256]
    - [57, 87.174]
  - - [13056, 13056, 1, 384]
    - [46, 89.782]
  - - [19968, 19968, 1, 384]
    - [10, 90.586]
  - - [25728, 25728, 1, 384]
    - [170, 90.403]
  - - [44160, 44160, 1, 384]
    - [10, 90.665]
  - - [27136, 27136, 1, 256]
    - [170, 87.883]
  - - [6912, 6912, 1, 384]
    - [78, 87.88]
  - - [37632, 37632, 1, 256]
    - [170, 88.147]
  - - [10752, 10752, 1, 256]
    - [101, 86.443]
  - - [5376, 5376, 1, 384]
    - [152, 85.137]
  - - [35584, 35584, 1, 256]
    - [170, 88.15]
  - - [28800, 28800, 1, 384]
    - [170, 90.184]
  - - [24320, 24320, 1, 256]
    - [101, 87.69]
  - - [38400, 38400, 1, 384]
    - [10, 90.731]
  - - [13440, 13440, 1, 384]
    - [10, 90.162]
  - - [32640, 32640, 1, 384]
    - [248, 89.33]
  - - [11904, 11904, 1, 384]
    - [49, 89.611]
  - - [256, 256, 1, 256]
    - [1, 4.553]
  - - [36096, 36096, 1, 256]
    - [101, 87.907]
  - - [31488, 31488, 1, 384]
    - [12, 90.832]
  - - [32512, 32512, 1, 256]
    - [170, 88.132]
  - - [34560, 34560, 1, 384]
    - [10, 90.808]
  - - [18944, 18944, 1, 256]
    - [101, 87.488]
  - - [35840, 35840, 1, 256]
    - [170, 88.079]
  - - [35328, 35328, 1, 256]
    - [170, 88.171]
  - - [21504, 21504, 1, 256]
    - [57, 87.857]
  - - [21760, 21760, 1, 256]
    - [57, 87.376]
  - - [7936, 7936, 1, 256]
    - [78, 84.135]
  - - [30976, 30976, 1, 256]
    - [170, 88.055]
  - - [13824, 13824, 1, 384]
    - [160, 89.732]
  - - [43776, 43776, 1, 256]
    - [170, 88.217]
  - - [42240, 42240, 1, 384]
    - [12, 90.782]
  - - [24576, 24576, 1, 256]
    - [78, 86.467]
  - - [15360, 15360, 1, 384]
    - [160, 90.0]
  - - [22656, 22656, 1, 384]
    - [12, 90.354]
  - - [20736, 20736, 1, 256]
    - [57, 87.602]
  - - [17664, 17664, 1, 256]
    - [57, 87.658]
  - - [5632, 5632, 1, 256]
    - [197, 80.934]
  - - [26880, 26880, 1, 256]
    - [170, 87.978]
  - - [27264, 27264, 1, 384]
    - [10, 90.465]
  - - [41216, 41216, 1, 256]
    - [170, 88.05]
  - - [22528, 22528, 1, 256]
    - [170, 87.756]
  - - [7424, 7424, 1, 256]
    - [57, 82.73]
  - - [15872, 15872, 1, 256]
    - [57, 87.253]
  - - [37248, 37248, 1, 384]
    - [170, 90.461]
  - - [28672, 28672, 1, 256]
    - [170, 87.543]
  - - [42240, 42240, 1, 256]
    - [170, 88.221]
  - - [37888, 37888, 1, 256]
    - [170, 88.127]
  - - [31104, 31104, 1, 384]
    - [170, 90.024]
  - - [1024, 1024, 1, 256]
    - [62, 41.547]
  - - [36480, 36480, 1, 384]
    - [170, 90.472]
  - - [14976, 14976, 1, 384]
    - [10, 90.013]
  - - [2304, 2304, 1, 384]
    - [3, 71.709]
  - - [2048, 2048, 1, 256]
    - [39, 62.33]
  - - [11520, 11520, 1, 256]
    - [57, 86.694]
  - - [22272, 22272, 1, 256]
    - [101, 87.682]
  - - [11264, 11264, 1, 256]
    - [57, 86.061]
  - - [2688, 2688, 1, 384]
    - [163, 77.885]
  - - [12544, 12544, 1, 256]
    - [101, 86.423]
  - - [33024, 33024, 1, 384]
    - [10, 90.812]
  - - [29440, 29440, 1, 256]
    - [170, 88.106]
  - - [18816, 18816, 1, 384]
    - [12, 90.342]
  - - [25088, 25088, 1, 256]
    - [170, 87.764]
  - - [23040, 23040, 1, 384]
    - [10, 90.702]
  - - [38912, 38912, 1, 256]
    - [170, 87.946]
  - - [1536, 1536, 1, 256]
    - [3, 58.502]
  - - [18176, 18176, 1, 256]
    - [170, 87.206]
  - - [17280, 17280, 1, 384]
    - [10, 90.339]
  - - [38144, 38144, 1, 256]
    - [170, 88.02]
  - - [8960, 8960, 1, 256]
    - [101, 84.247]
  - - [12288, 12288, 1, 256]
    - [202, 86.065]
  - - [12288, 12288, 1, 384]
    - [12, 89.025]
  - - [16640, 16640, 1, 256]
    - [57, 87.27]
  - - [43008, 43008, 1, 256]
    - [170, 88.037]
  - - [28160, 28160, 1, 256]
    - [170, 87.823]
  - - [14208, 14208, 1, 384]
    - [49, 90.029]
  - - [29952, 29952, 1, 384]
    - [12, 90.765]
  - - [37120, 37120, 1, 256]
    - [170, 88.123]
  - - [29696, 29696, 1, 256]
    - [170, 88.0]
  - - [43392, 43392, 1, 384]
    - [12, 90.755]
  - - [23808, 23808, 1, 256]
    - [57, 87.677]
  - - [64, 1, 1, 64]
    - [2, 0.002]
  - - [41472, 41472, 1, 256]
    - [170, 87.991]
  - - [42496, 42496, 1, 256]
    - [170, 87.845]
  - - [34560, 34560, 1, 256]
    - [170, 88.25]
  - - [2560, 2560, 1, 256]
    - [3, 66.134]
  - - [8448, 8448, 1, 384]
    - [90, 88.358]
  - - [21248, 21248, 1, 256]
    - [101, 87.379]
  - - [3584, 3584, 1, 256]
    - [202, 75.293]
  - - [39936, 39936, 1, 256]
    - [170, 88.268]
  - - [36864, 36864, 1, 256]
    - [170, 87.789]
  - - [5760, 5760, 1, 384]
    - [94, 86.82]
  - - [6144, 6144, 1, 384]
    - [152, 85.939]
  - - [13568, 13568, 1, 256]
    - [57, 86.72]
  - - [20352, 20352, 1, 384]
    - [10, 90.446]
  - - [23808, 23808, 1, 384]
    - [10, 90.456]
  - - [35712, 35712, 1, 384]
    - [101, 90.026]
  - - [6912, 6912, 1, 256]
    - [248, 82.743]
  - - [30336, 30336, 1, 384]
    - [170, 90.087]
  - - [3072, 3072, 1, 256]
    - [90, 71.575]
  - - [11136, 11136, 1, 384]
    - [10, 89.242]
  - - [41856, 41856, 1, 384]
    - [170, 90.647]
  - - [27392, 27392, 1, 256]
    - [170, 87.902]
  - - [2304, 2304, 1, 256]
    - [164, 63.912]
  - - [28032, 28032, 1, 384]
    - [10, 90.445]
  - - [4608, 4608, 1, 384]
    - [107, 85.287]
  - - [25600, 25600, 1, 256]
    - [170, 87.709]
  - - [26368, 26368, 1, 256]
    - [170, 87.944]
  - - [28928, 28928, 1, 256]
    - [170, 87.896]
  - - [33408, 33408, 1, 384]
    - [170, 89.867]
  - - [6656, 6656, 1, 256]
    - [49, 82.334]
  - - [16128, 16128, 1, 256]
    - [170, 87.638]
  - - [33536, 33536, 1, 256]
    - [170, 88.045]
  - - [3840, 3840, 1, 256]
    - [107, 78.917]
  - - [3456, 3456, 1, 384]
    - [154, 78.648]
  - - [38784, 38784, 1, 384]
    - [170, 90.399]
  - - [33792, 33792, 1, 384]
    - [10, 90.698]
  - - [14080, 14080, 1, 256]
    - [57, 86.95]
  - - [7168, 7168, 1, 256]
    - [94, 83.661]
  - - [22784, 22784, 1, 256]
    - [57, 87.584]
  - - [3840, 3840, 1, 384]
    - [90, 83.556]
  - - [20224, 20224, 1, 256]
    - [101, 87.689]
  - - [27904, 27904, 1, 256]
    - [170, 87.929]
  - - [31232, 31232, 1, 256]
    - [170, 87.939]
  - - [36864, 36864, 1, 384]
    - [170, 90.473]
  - - [18688, 18688, 1, 256]
    - [101, 87.541]
  - - [44928, 44928, 1, 384]
    - [170, 90.631]
  - - [37376, 37376, 1, 256]
    - [170, 88.053]
  - - [32000, 32000, 1, 256]
    - [170, 88.075]
  - - [32256, 32256, 1, 256]
    - [170, 88.215]
  - - [43264, 43264, 1, 256]
    - [170, 88.183]
  - - [38400, 38400, 1, 256]
    - [170, 88.134]
  - - [1920, 1920, 1, 384]
    - [12, 65.64]
  - - [28416, 28416, 1, 256]
    - [170, 88.118]
  - - [16512, 16512, 1, 384]
    - [10, 90.484]
  - - [5376, 5376, 1, 256]
    - [152, 81.631]
  - - [14592, 14592, 1, 256]
    - [101, 87.215]
  - - [18432, 18432, 1, 384]
    - [12, 90.427]
  - - [36608, 36608, 1, 256]
    - [170, 88.042]
  - - [26624, 26624, 1, 256]
    - [170, 87.736]
  - - [3328, 3328, 1, 256]
    - [202, 73.722]
  - - [30208, 30208, 1, 256]
    - [170, 88.031]
  - - [42752, 42752, 1, 256]
    - [170, 88.115]
  - - [27648, 27648, 1, 256]
    - [170, 88.056]
  - - [39168, 39168, 1, 256]
    - [170, 88.188]
  - - [4352, 4352, 1, 256]
    - [152, 78.257]
  - - [7296, 7296, 1, 384]
    - [107, 87.192]
  - - [13056, 13056, 1, 256]
    - [57, 86.88]
  - - [19200, 19200, 1, 384]
    - [46, 90.424]
  - - [34944, 34944, 1, 384]
    - [216, 89.968]
  - - [512, 512, 1, 256]
    - [153, 15.072]
  - - [18048, 18048, 1, 384]
    - [10, 90.495]
  - - [14336, 14336, 1, 256]
    - [101, 86.774]
  - - [768, 768, 1, 384]
    - [8, 33.632]
  - - [11776, 11776, 1, 256]
    - [57, 86.514]
  - - [4608, 4608, 1, 256]
    - [90, 81.481]
  - - [28416, 28416, 1, 384]
    - [10, 90.815]
  - - [4096, 4096, 1, 256]
    - [163, 79.581]
  - - [11520, 11520, 1, 384]
    - [12, 89.21]
  - - [23424, 23424, 1, 384]
    - [12, 90.537]
  - - [19584, 19584, 1, 384]
    - [46, 90.438]
  - - [44288, 44288, 1, 256]
    - [170, 88.141]
  - - [37632, 37632, 1, 384]
    - [10, 90.793]
  - - [5888, 5888, 1, 256]
    - [152, 81.019]
  - - [40960, 40960, 1, 256]
    - [90, 86.566]
  - - [24192, 24192, 1, 384]
    - [10, 90.665]
  - - [4992, 4992, 1, 384]
    - [90, 85.439]
  - - [34048, 34048, 1, 256]
    - [170, 88.146]
  - - [39168, 39168, 1, 384]
    - [10, 90.836]
  - - [22016, 22016, 1, 256]
    - [170, 87.704]
  - - [40704, 40704, 1, 384]
    - [10, 90.78]
  - - [40704, 40704, 1, 256]
    - [170, 88.222]
  - - [16384, 16384, 1, 256]
    - [90, 85.875]
  - - [8064, 8064, 1, 384]
    - [107, 87.689]
  - - [16896, 16896, 1, 256]
    - [170, 87.638]
  - - [128, 35968, 1, 256]
    - [3, 60.7]
  - - [128, 20608, 1, 384]
    - [4, 61.772]
  - - [128, 2688, 1, 128]
    - [5, 15.028]
  - - [128, 11648, 1, 384]
    - [6, 51.844]
  - - [128, 38528, 1, 256]
    - [7, 61.033]
  - - [128, 3968, 1, 128]
    - [8, 19.125]
  - - [128, 14208, 1, 384]
    - [9, 56.264]
  - - [128, 30848, 1, 256]
    - [10, 57.083]
  - - [128, 37248, 1, 128]
    - [11, 44.426]
  - - [128, 6528, 1, 384]
    - [9, 46.381]
  - - [128, 33408, 1, 256]
    - [12, 59.112]
  - - [128, 24448, 1, 256]
    - [13, 57.573]
  - - [128, 28288, 1, 128]
    - [14, 47.991]
  - - [128, 25728, 1, 256]
    - [15, 53.974]
  - - [128, 1408, 1, 384]
    - [16, 14.147]
  - - [128, 19328, 1, 256]
    - [17, 47.942]
  - - [128, 44928, 1, 384]
    - [18, 71.103]
  - - [128, 20608, 1, 256]
    - [18, 51.25]
  - - [128, 11648, 1, 128]
    - [19, 37.624]
  - - [128, 11648, 1, 256]
    - [18, 50.05]
  - - [128, 9088, 1, 128]
    - [14, 33.073]
  - - [128, 15488, 1, 128]
    - [20, 41.506]
  - - [128, 7808, 1, 384]
    - [21, 47.347]
  - - [128, 14208, 1, 256]
    - [19, 56.361]
  - - [128, 9088, 1, 384]
    - [22, 51.666]
  - - [128, 18048, 1, 128]
    - [14, 44.155]
  - - [128, 41088, 1, 384]
    - [23, 68.436]
  - - [128, 19328, 1, 384]
    - [9, 57.873]
  - - [128, 24448, 1, 128]
    - [20, 48.022]
  - - [128, 9088, 1, 256]
    - [24, 46.931]
  - - [128, 12928, 1, 128]
    - [18, 34.296]
  - - [128, 1408, 1, 256]
    - [8, 11.11]
  - - [128, 27008, 1, 384]
    - [25, 63.024]
  - - [128, 35968, 1, 384]
    - [26, 65.125]
  - - [128, 19328, 1, 128]
    - [20, 44.546]
  - - [128, 44928, 1, 256]
    - [23, 63.518]
  - - [128, 29568, 1, 384]
    - [3, 65.292]
  - - [128, 21888, 1, 384]
    - [27, 65.277]
  - - [128, 32128, 1, 384]
    - [10, 67.608]
  - - [128, 7808, 1, 256]
    - [21, 42.102]
  - - [128, 14208, 1, 128]
    - [12, 42.607]
  - - [128, 39808, 1, 256]
    - [28, 62.393]
  - - [128, 43648, 1, 128]
    - [14, 52.76]
  - - [128, 41088, 1, 256]
    - [29, 63.439]
  - - [128, 6528, 1, 128]
    - [30, 24.572]
  - - [128, 6528, 1, 256]
    - [14, 42.259]
  - - [128, 32128, 1, 256]
    - [25, 59.474]
  - - [128, 35968, 1, 128]
    - [20, 44.823]
  - - [128, 27008, 1, 128]
    - [14, 46.753]
  - - [128, 2688, 1, 256]
    - [31, 24.023]
  - - [128, 32128, 1, 128]
    - [32, 38.259]
  - - [128, 28288, 1, 384]
    - [33, 65.829]
  - - [128, 34688, 1, 256]
    - [14, 56.951]
  - - [128, 38528, 1, 128]
    - [34, 47.558]
  - - [128, 1408, 1, 128]
    - [5, 7.619]
  - - [128, 27008, 1, 256]
    - [35, 54.755]
  - - [128, 30848, 1, 128]
    - [3, 48.312]
  - - [128, 23168, 1, 384]
    - [36, 58.518]
  - - [128, 29568, 1, 256]
    - [19, 59.019]
  - - [128, 33408, 1, 128]
    - [37, 44.783]
  - - [128, 21888, 1, 128]
    - [14, 50.026]
  - - [128, 42368, 1, 128]
    - [14, 51.423]
  - - [128, 15488, 1, 384]
    - [17, 57.79]
  - - [128, 21888, 1, 256]
    - [38, 56.642]
  - - [128, 25728, 1, 128]
    - [39, 50.381]
  - - [128, 18048, 1, 384]
    - [40, 55.913]
  - - [128, 44928, 1, 128]
    - [6, 51.0]
  - - [128, 10368, 1, 384]
    - [21, 55.789]
  - - [128, 16768, 1, 256]
    - [17, 54.917]
  - - [128, 20608, 1, 128]
    - [9, 42.098]
  - - [128, 42368, 1, 384]
    - [12, 70.435]
  - - [128, 28288, 1, 256]
    - [14, 54.412]
  - - [128, 34688, 1, 128]
    - [20, 41.084]
  - - [128, 3968, 1, 384]
    - [5, 31.621]
  - - [128, 16768, 1, 384]
    - [17, 61.069]
  - - [128, 5248, 1, 384]
    - [8, 43.548]
  - - [128, 23168, 1, 128]
    - [20, 46.075]
  - - [128, 39808, 1, 128]
    - [17, 48.898]
  - - [128, 37248, 1, 384]
    - [29, 66.457]
  - - [128, 23168, 1, 256]
    - [31, 57.268]
  - - [128, 29568, 1, 128]
    - [14, 48.05]
  - - [128, 39808, 1, 384]
    - [41, 71.38]
  - - [128, 128, 1, 384]
    - [16, 1.398]
  - - [128, 3968, 1, 256]
    - [8, 29.499]
  - - [128, 10368, 1, 128]
    - [27, 37.091]
  - - [128, 18048, 1, 256]
    - [15, 58.632]
  - - [128, 43648, 1, 384]
    - [42, 70.556]
  - - [128, 10368, 1, 256]
    - [43, 47.004]
  - - [128, 16768, 1, 128]
    - [44, 43.649]
  - - [128, 42368, 1, 256]
    - [45, 63.847]
  - - [128, 34688, 1, 384]
    - [15, 61.658]
  - - [128, 12928, 1, 256]
    - [19, 50.118]
  - - [128, 38528, 1, 384]
    - [46, 64.34]
  - - [128, 43648, 1, 256]
    - [3, 63.595]
  - - [128, 12928, 1, 384]
    - [18, 53.483]
  - - [128, 5248, 1, 128]
    - [5, 26.532]
  - - [128, 5248, 1, 256]
    - [8, 38.378]
  - - [128, 30848, 1, 384]
    - [47, 65.095]
  - - [128, 37248, 1, 256]
    - [14, 62.968]
  - - [128, 41088, 1, 128]
    - [48, 51.34]
  - - [128, 33408, 1, 384]
    - [48, 68.549]
  - - [128, 7808, 1, 128]
    - [21, 30.085]
  - - [128, 24448, 1, 384]
    - [14, 62.486]
  - - [128, 128, 1, 256]
    - [2, 1.262]
  - - [128, 25728, 1, 384]
    - [9, 66.1]
  - - [128, 15488, 1, 256]
    - [49, 53.719]
  - - [128, 128, 1, 128]
    - [16, 0.803]
  - - [128, 2688, 1, 384]
    - [5, 25.217]
  - - [256, 66, 1, 66]
    - [16, 0.486]
  - - [12544, 66, 1, 66]
    - [24, 17.757]
  - - [3872, 32, 1, 32]
    - [5, 2.123]
  - - [24832, 66, 1, 66]
    - [50, 23.673]
  - - [37200, 48, 1, 48]
    - [14, 19.895]
  - - [21472, 32, 1, 32]
    - [8, 8.094]
  - - [15068, 30, 1, 36]
    - [8, 7.208]
  - - [19200, 30, 1, 36]
    - [51, 6.957]
  - - [23040, 58, 1, 66]
    - [50, 23.227]
  - - [38784, 96, 1, 96]
    - [52, 41.42]
  - - [2160, 48, 1, 48]
    - [8, 1.951]
  - - [24064, 58, 1, 66]
    - [19, 22.948]
  - - [13824, 58, 1, 66]
    - [9, 18.313]
  - - [10656, 96, 1, 96]
    - [53, 27.502]
  - - [26522, 30, 1, 36]
    - [54, 10.114]
  - - [37120, 58, 1, 66]
    - [55, 24.832]
  - - [23998, 66, 1, 66]
    - [27, 19.131]
  - - [3672, 30, 1, 36]
    - [5, 1.672]
  - - [20448, 32, 1, 32]
    - [8, 9.107]
  - - [15520, 32, 1, 32]
    - [8, 7.389]
  - - [28768, 32, 1, 32]
    - [56, 10.318]
  - - [9664, 64, 1, 64]
    - [5, 14.443]
  - - [40672, 32, 1, 32]
    - [8, 11.913]
  - - [18000, 48, 1, 48]
    - [54, 14.689]
  - - [31232, 58, 1, 66]
    - [57, 22.467]
  - - [2528, 32, 1, 32]
    - [58, 1.073]
  - - [18240, 64, 1, 64]
    - [3, 21.212]
  - - [29184, 66, 1, 66]
    - [59, 25.418]
  - - [31104, 96, 1, 96]
    - [17, 39.02]
  - - [1248, 32, 1, 32]
    - [16, 0.535]
  - - [28416, 128, 1, 128]
    - [60, 48.135]
  - - [5340, 30, 1, 36]
    - [5, 2.841]
  - - [43264, 66, 1, 66]
    - [61, 26.571]
  - - [43008, 66, 1, 66]
    - [17, 26.357]
  - - [32768, 66, 1, 66]
    - [8, 24.07]
  - - [20544, 64, 1, 64]
    - [62, 24.112]
  - - [9264, 48, 1, 48]
    - [8, 8.645]
  - - [34944, 48, 1, 48]
    - [14, 18.966]
  - - [16800, 96, 1, 96]
    - [63, 30.199]
  - - [22880, 32, 1, 32]
    - [8, 10.333]
  - - [25088, 124, 1, 132]
    - [3, 48.664]
  - - [39168, 58, 1, 66]
    - [9, 27.083]
  - - [22752, 32, 1, 32]
    - [8, 8.736]
  - - [43488, 32, 1, 32]
    - [64, 13.561]
  - - [17664, 192, 1, 192]
    - [3, 49.321]
  - - [25600, 58, 1, 66]
    - [54, 24.949]
  - - [39936, 192, 1, 192]
    - [57, 64.945]
  - - [7680, 30, 1, 36]
    - [2, 3.12]
  - - [39008, 32, 1, 32]
    - [8, 10.881]
  - - [42752, 58, 1, 66]
    - [20, 27.116]
  - - [8208, 48, 1, 48]
    - [5, 7.657]
  - - [40448, 30, 1, 36]
    - [35, 11.999]
  - - [28320, 96, 1, 96]
    - [65, 38.715]
  - - [19648, 64, 1, 64]
    - [66, 24.369]
  - - [33470, 66, 1, 66]
    - [22, 22.817]
  - - [26736, 48, 1, 48]
    - [67, 13.304]
  - - [30464, 30, 1, 36]
    - [8, 10.162]
  - - [256, 30, 1, 36]
    - [2, 0.13]
  - - [14304, 96, 1, 96]
    - [68, 28.153]
  - - [2106, 58, 1, 66]
    - [69, 2.525]
  - - [416, 32, 1, 32]
    - [2, 0.153]
  - - [20956, 30, 1, 36]
    - [15, 6.386]
  - - [39936, 48, 1, 48]
    - [56, 16.851]
  - - [38656, 30, 1, 36]
    - [70, 12.946]
  - - [36864, 66, 1, 66]
    - [22, 25.976]
  - - [38202, 58, 1, 66]
    - [9, 29.696]
  - - [5632, 58, 1, 66]
    - [5, 9.405]
  - - [29696, 124, 1, 132]
    - [3, 50.496]
  - - [13296, 48, 1, 48]
    - [71, 10.793]
  - - [30464, 66, 1, 66]
    - [53, 22.423]
  - - [28032, 48, 1, 48]
    - [19, 17.963]
  - - [9056, 32, 1, 32]
    - [72, 4.97]
  - - [23360, 64, 1, 64]
    - [19, 23.881]
  - - [41560, 30, 1, 36]
    - [73, 13.258]
  - - [28928, 30, 1, 36]
    - [74, 9.901]
  - - [43008, 96, 1, 96]
    - [17, 42.776]
  - - [27224, 30, 1, 36]
    - [8, 10.94]
  - - [6720, 64, 1, 64]
    - [14, 9.419]
  - - [44288, 66, 1, 66]
    - [17, 26.417]
  - - [40272, 48, 1, 48]
    - [48, 21.99]
  - - [43840, 64, 1, 64]
    - [14, 27.089]
  - - [43872, 32, 1, 32]
    - [63, 13.958]
  - - [35840, 66, 1, 66]
    - [8, 24.95]
  - - [38336, 64, 1, 64]
    - [14, 30.476]
  - - [27600, 48, 1, 48]
    - [19, 17.676]
  - - [1488, 48, 1, 48]
    - [75, 1.144]
  - - [27326, 66, 1, 66]
    - [76, 21.739]
  - - [30480, 48, 1, 48]
    - [54, 16.403]
  - - [1632, 32, 1, 32]
    - [16, 0.806]
  - - [14112, 32, 1, 32]
    - [77, 6.888]
  - - [27200, 64, 1, 64]
    - [19, 27.668]
  - - [8832, 48, 1, 48]
    - [75, 6.524]
  - - [24320, 128, 1, 128]
    - [78, 44.144]
  - - [14746, 30, 1, 36]
    - [8, 7.221]
  - - [11864, 30, 1, 36]
    - [3, 5.448]
  - - [3006, 66, 1, 66]
    - [8, 5.768]
  - - [11184, 48, 1, 48]
    - [9, 8.514]
  - - [8638, 66, 1, 66]
    - [8, 14.09]
  - - [12186, 30, 1, 36]
    - [3, 5.096]
  - - [22784, 30, 1, 36]
    - [8, 7.88]
  - - [26784, 96, 1, 96]
    - [17, 37.45]
  - - [42400, 32, 1, 32]
    - [8, 13.583]
  - - [36384, 32, 1, 32]
    - [8, 12.123]
  - - [40960, 30, 1, 36]
    - [79, 11.74]
  - - [21504, 58, 1, 66]
    - [9, 24.153]
  - - [38640, 48, 1, 48]
    - [9, 20.536]
  - - [40560, 48, 1, 48]
    - [3, 19.364]
  - - [18520, 30, 1, 36]
    - [8, 8.799]
  - - [22416, 48, 1, 48]
    - [9, 15.943]
  - - [29696, 58, 1, 66]
    - [19, 25.196]
  - - [25008, 48, 1, 48]
    - [18, 14.901]
  - - [34048, 58, 1, 66]
    - [80, 20.598]
  - - [8192, 66, 1, 66]
    - [81, 13.36]
  - - [29248, 64, 1, 64]
    - [14, 25.397]
  - - [7712, 32, 1, 32]
    - [8, 4.024]
  - - [20000, 32, 1, 32]
    - [8, 9.001]
  - - [17664, 58, 1, 66]
    - [9, 21.132]
  - - [41712, 48, 1, 48]
    - [9, 21.384]
  - - [15072, 96, 1, 96]
    - [27, 33.871]
  - - [10042, 58, 1, 66]
    - [5, 13.324]
  - - [11674, 30, 1, 36]
    - [8, 5.698]
  - - [15002, 30, 1, 36]
    - [16, 7.083]
  - - [34874, 58, 1, 66]
    - [3, 26.735]
  - - [2304, 58, 1, 66]
    - [5, 3.371]
  - - [3232, 32, 1, 32]
    - [8, 1.155]
  - - [24960, 96, 1, 96]
    - [50, 35.702]
  - - [14848, 124, 1, 132]
    - [19, 39.725]
  - - [35712, 192, 1, 192]
    - [14, 59.323]
  - - [40704, 58, 1, 66]
    - [9, 28.457]
  - - [33850, 58, 1, 66]
    - [8, 25.194]
  - - [5464, 30, 1, 36]
    - [5, 2.939]
  - - [20032, 64, 1, 64]
    - [14, 24.23]
  - - [6848, 64, 1, 64]
    - [8, 12.468]
  - - [18432, 30, 1, 36]
    - [8, 8.674]
  - - [23808, 66, 1, 66]
    - [82, 19.476]
  - - [25856, 58, 1, 66]
    - [19, 23.245]
  - - [42048, 64, 1, 64]
    - [61, 29.706]
  - - [3408, 48, 1, 48]
    - [21, 3.666]
  - - [16640, 128, 1, 128]
    - [14, 43.411]
  - - [33024, 96, 1, 96]
    - [83, 42.974]
  - - [23230, 66, 1, 66]
    - [8, 20.31]
  - - [30288, 48, 1, 48]
    - [6, 17.877]
  - - [41440, 32, 1, 32]
    - [84, 14.093]
  - - [30304, 32, 1, 32]
    - [8, 10.646]
  - - [36064, 32, 1, 32]
    - [85, 11.1]
  - - [2400, 96, 1, 96]
    - [8, 7.098]
  - - [33792, 30, 1, 36]
    - [86, 10.748]
  - - [6108, 30, 1, 36]
    - [5, 3.288]
  - - [27744, 32, 1, 32]
    - [32, 11.391]
  - - [27232, 32, 1, 32]
    - [8, 9.353]
  - - [42304, 64, 1, 64]
    - [78, 29.608]
  - - [31008, 96, 1, 96]
    - [63, 41.198]
  - - [16176, 48, 1, 48]
    - [87, 13.355]
  - - [20832, 32, 1, 32]
    - [88, 8.922]
  - - [34362, 58, 1, 66]
    - [9, 28.029]
  - - [9472, 128, 1, 128]
    - [89, 33.656]
  - - [41180, 30, 1, 36]
    - [8, 12.292]
  - - [29568, 192, 1, 192]
    - [90, 59.194]
  - - [31034, 58, 1, 66]
    - [8, 23.873]
  - - [38848, 64, 1, 64]
    - [91, 31.96]
  - - [22080, 64, 1, 64]
    - [92, 26.155]
  - - [12288, 192, 1, 192]
    - [3, 50.96]
  - - [36030, 66, 1, 66]
    - [81, 24.749]
  - - [1280, 30, 1, 36]
    - [56, 0.621]
  - - [38400, 128, 1, 128]
    - [93, 47.809]
  - - [17760, 32, 1, 32]
    - [72, 7.381]
  - - [31488, 124, 1, 132]
    - [73, 37.207]
  - - [2832, 48, 1, 48]
    - [16, 2.975]
  - - [15872, 30, 1, 36]
    - [8, 7.671]
  - - [29040, 48, 1, 48]
    - [4, 17.858]
  - - [33338, 58, 1, 66]
    - [94, 25.757]
  - - [41662, 66, 1, 66]
    - [95, 26.6]
  - - [29424, 48, 1, 48]
    - [96, 17.41]
  - - [24160, 32, 1, 32]
    - [97, 8.819]
  - - [29696, 128, 1, 128]
    - [98, 50.038]
  - - [2874, 58, 1, 66]
    - [2, 4.948]
  - - [19104, 96, 1, 96]
    - [12, 37.065]
  - - [12448, 32, 1, 32]
    - [8, 6.37]
  - - [33888, 96, 1, 96]
    - [27, 39.355]
  - - [20538, 58, 1, 66]
    - [9, 21.171]
  - - [17728, 64, 1, 64]
    - [99, 22.232]
  - - [25056, 96, 1, 96]
    - [17, 35.604]
  - - [26528, 32, 1, 32]
    - [100, 6.931]
  - - [14080, 124, 1, 132]
    - [101, 36.907]
  - - [1776, 48, 1, 48]
    - [89, 1.344]
  - - [16224, 96, 1, 96]
    - [95, 32.138]
  - - [9440, 32, 1, 32]
    - [8, 4.087]
  - - [27904, 128, 1, 128]
    - [53, 49.747]
  - - [17240, 30, 1, 36]
    - [8, 8.503]
  - - [18652, 30, 1, 36]
    - [8, 8.543]
  - - [22016, 66, 1, 66]
    - [17, 21.503]
  - - [24512, 64, 1, 64]
    - [19, 25.756]
  - - [10368, 96, 1, 96]
    - [27, 26.474]
  - - [13532, 30, 1, 36]
    - [9, 6.504]
  - - [40640, 64, 1, 64]
    - [102, 28.069]
  - - [39680, 30, 1, 36]
    - [54, 13.579]
  - - [37208, 30, 1, 36]
    - [8, 11.509]
  - - [33696, 96, 1, 96]
    - [76, 38.534]
  - - [36608, 124, 1, 132]
    - [3, 44.926]
  - - [40602, 30, 1, 36]
    - [9, 9.979]
  - - [2256, 48, 1, 48]
    - [8, 2.339]
  - - [28928, 128, 1, 128]
    - [14, 45.244]
  - - [36240, 48, 1, 48]
    - [8, 18.911]
  - - [28736, 64, 1, 64]
    - [103, 28.582]
  - - [34012, 30, 1, 36]
    - [104, 9.919]
  - - [26200, 30, 1, 36]
    - [8, 9.661]
  - - [12672, 48, 1, 48]
    - [9, 10.616]
  - - [32512, 128, 1, 128]
    - [39, 48.274]
  - - [22938, 30, 1, 36]
    - [8, 9.847]
  - - [33536, 30, 1, 36]
    - [99, 10.299]
  - - [6846, 66, 1, 66]
    - [8, 11.735]
  - - [23008, 32, 1, 32]
    - [56, 7.988]
  - - [41024, 64, 1, 64]
    - [14, 32.2]
  - - [15024, 48, 1, 48]
    - [8, 13.322]
  - - [24768, 64, 1, 64]
    - [105, 26.196]
  - - [5786, 30, 1, 36]
    - [99, 2.654]
  - - [10560, 64, 1, 64]
    - [8, 13.657]
  - - [29280, 32, 1, 32]
    - [106, 11.513]
  - - [38042, 30, 1, 36]
    - [59, 12.712]
  - - [40448, 128, 1, 128]
    - [3, 47.359]
  - - [14976, 192, 1, 192]
    - [107, 55.928]
  - - [43008, 58, 1, 66]
    - [90, 29.585]
  - - [10336, 32, 1, 32]
    - [108, 4.647]
  - - [38400, 96, 1, 96]
    - [109, 43.154]
  - - [31648, 32, 1, 32]
    - [110, 8.388]
  - - [33536, 124, 1, 132]
    - [111, 41.707]
  - - [4752, 48, 1, 48]
    - [5, 4.93]
  - - [29850, 30, 1, 36]
    - [87, 9.543]
  - - [16896, 58, 1, 66]
    - [83, 17.346]
  - - [40896, 64, 1, 64]
    - [112, 26.946]
  - - [26778, 30, 1, 36]
    - [8, 10.477]
  - - [28944, 48, 1, 48]
    - [82, 18.118]
  - - [3680, 32, 1, 32]
    - [5, 1.514]
  - - [9472, 58, 1, 66]
    - [8, 14.036]
  - - [1792, 66, 1, 66]
    - [5, 3.222]
  - - [11776, 66, 1, 66]
    - [54, 13.785]
  - - [26558, 66, 1, 66]
    - [17, 20.402]
  - - [33024, 124, 1, 132]
    - [113, 44.052]
  - - [1312, 32, 1, 32]
    - [9, 0.611]
  - - [17952, 96, 1, 96]
    - [114, 29.626]
  - - [39552, 192, 1, 192]
    - [12, 63.772]
  - - [43456, 64, 1, 64]
    - [90, 33.944]
  - - [13056, 48, 1, 48]
    - [8, 11.933]
  - - [3696, 48, 1, 48]
    - [5, 3.036]
  - - [18048, 48, 1, 48]
    - [64, 11.657]
  - - [5376, 96, 1, 96]
    - [8, 16.625]
  - - [13312, 58, 1, 66]
    - [3, 15.95]
  - - [1056, 32, 1, 32]
    - [115, 0.422]
  - - [11136, 192, 1, 192]
    - [49, 52.896]
  - - [1112, 30, 1, 36]
    - [2, 0.432]
  - - [31320, 30, 1, 36]
    - [70, 9.13]
  - - [32000, 66, 1, 66]
    - [22, 21.933]
  - - [23552, 66, 1, 66]
    - [116, 21.854]
  - - [35760, 48, 1, 48]
    - [9, 18.381]
  - - [13392, 48, 1, 48]
    - [9, 11.101]
  - - [30096, 48, 1, 48]
    - [117, 18.557]
  - - [27194, 58, 1, 66]
    - [24, 21.002]
  - - [31422, 66, 1, 66]
    - [22, 21.831]
  - - [11264, 124, 1, 132]
    - [118, 37.366]
  - - [34528, 32, 1, 32]
    - [8, 11.86]
  - - [12800, 66, 1, 66]
    - [50, 17.328]
  - - [44256, 32, 1, 32]
    - [119, 14.124]
  - - [38488, 30, 1, 36]
    - [8, 11.682]
  - - [736, 32, 1, 32]
    - [2, 0.321]
  - - [732, 30, 1, 36]
    - [16, 0.317]
  - - [38400, 192, 1, 192]
    - [17, 62.279]
  - - [31104, 48, 1, 48]
    - [10, 19.755]
  - - [42480, 48, 1, 48]
    - [14, 22.017]
  - - [28416, 124, 1, 132]
    - [14, 51.063]
  - - [16944, 48, 1, 48]
    - [120, 13.596]
  - - [35328, 96, 1, 96]
    - [17, 39.97]
  - - [29952, 192, 1, 192]
    - [90, 61.422]
  - - [43578, 58, 1, 66]
    - [9, 27.394]
  - - [15192, 30, 1, 36]
    - [8, 7.53]
  - - [38912, 66, 1, 66]
    - [76, 24.752]
  - - [29472, 32, 1, 32]
    - [121, 8.991]
  - - [14272, 64, 1, 64]
    - [8, 19.336]
  - - [29280, 96, 1, 96]
    - [122, 42.306]
  - - [768, 192, 1, 192]
    - [77, 8.359]
  - - [27264, 192, 1, 192]
    - [123, 57.176]
  - - [17664, 66, 1, 66]
    - [76, 17.612]
  - - [42972, 30, 1, 36]
    - [124, 12.469]
  - - [11264, 30, 1, 36]
    - [8, 4.989]
  - - [22624, 32, 1, 32]
    - [112, 7.601]
  - - [25344, 30, 1, 36]
    - [8, 8.667]
  - - [22272, 48, 1, 48]
    - [9, 17.279]
  - - [37852, 30, 1, 36]
    - [89, 11.437]
  - - [42328, 30, 1, 36]
    - [53, 13.588]
  - - [15888, 48, 1, 48]
    - [117, 13.215]
  - - [18688, 128, 1, 128]
    - [14, 48.592]
  - - [32992, 32, 1, 32]
    - [125, 11.181]
  - - [35184, 48, 1, 48]
    - [9, 20.63]
  - - [40448, 124, 1, 132]
    - [14, 48.073]
  - - [21760, 128, 1, 128]
    - [14, 48.06]
  - - [11776, 30, 1, 36]
    - [8, 5.3]
  - - [9786, 58, 1, 66]
    - [8, 14.849]
  - - [576, 64, 1, 64]
    - [5, 0.998]
  - - [1952, 32, 1, 32]
    - [2, 0.757]
  - - [40480, 32, 1, 32]
    - [72, 12.106]
  - - [28350, 66, 1, 66]
    - [17, 22.453]
  - - [20926, 66, 1, 66]
    - [25, 22.91]
  - - [5216, 32, 1, 32]
    - [21, 2.555]
  - - [20480, 66, 1, 66]
    - [126, 15.395]
  - - [39360, 64, 1, 64]
    - [127, 30.424]
  - - [43996, 30, 1, 36]
    - [99, 13.72]
  - - [12032, 58, 1, 66]
    - [1, 15.971]
  - - [19932, 30, 1, 36]
    - [8, 9.004]
  - - [35328, 30, 1, 36]
    - [75, 13.321]
  - - [32976, 48, 1, 48]
    - [128, 16.269]
  - - [22720, 64, 1, 64]
    - [129, 21.39]
  - - [12384, 32, 1, 32]
    - [8, 4.763]
  - - [35328, 124, 1, 132]
    - [60, 43.134]
  - - [42298, 58, 1, 66]
    - [9, 26.725]
  - - [23328, 32, 1, 32]
    - [8, 9.876]
  - - [32704, 64, 1, 64]
    - [94, 29.188]
  - - [8064, 96, 1, 96]
    - [8, 23.253]
  - - [16352, 32, 1, 32]
    - [8, 5.983]
  - - [34112, 64, 1, 64]
    - [14, 29.369]
  - - [37946, 58, 1, 66]
    - [9, 28.323]
  - - [20282, 58, 1, 66]
    - [74, 20.302]
  - - [42144, 32, 1, 32]
    - [22, 13.424]
  - - [4864, 124, 1, 132]
    - [51, 19.121]
  - - [30752, 32, 1, 32]
    - [20, 9.895]
  - - [20736, 96, 1, 96]
    - [17, 34.764]
  - - [32784, 48, 1, 48]
    - [14, 18.402]
  - - [30528, 64, 1, 64]
    - [9, 25.591]
  - - [3552, 96, 1, 96]
    - [5, 12.339]
  - - [7936, 128, 1, 128]
    - [35, 31.31]
  - - [11232, 32, 1, 32]
    - [5, 5.569]
  - - [11096, 30, 1, 36]
    - [5, 5.622]
  - - [2494, 66, 1, 66]
    - [106, 4.859]
  - - [44160, 192, 1, 192]
    - [130, 63.514]
  - - [20352, 96, 1, 96]
    - [8, 34.883]
  - - [6576, 48, 1, 48]
    - [5, 6.349]
  - - [1434, 30, 1, 36]
    - [61, 0.646]
  - - [37104, 48, 1, 48]
    - [48, 20.559]
  - - [28892, 30, 1, 36]
    - [8, 11.825]
  - - [36864, 96, 1, 96]
    - [131, 44.058]
  - - [18656, 32, 1, 32]
    - [132, 8.275]
  - - [18074, 30, 1, 36]
    - [8, 8.265]
  - - [34176, 96, 1, 96]
    - [133, 38.78]
  - - [21024, 32, 1, 32]
    - [8, 9.82]
  - - [43360, 32, 1, 32]
    - [8, 13.717]
  - - [18432, 124, 1, 132]
    - [9, 40.601]
  - - [32832, 64, 1, 64]
    - [107, 25.198]
  - - [38714, 58, 1, 66]
    - [9, 27.119]
  - - [38624, 32, 1, 32]
    - [134, 13.546]
  - - [8032, 32, 1, 32]
    - [8, 3.904]
  - - [40992, 96, 1, 96]
    - [27, 38.25]
  - - [31936, 64, 1, 64]
    - [14, 26.057]
  - - [36704, 32, 1, 32]
    - [135, 12.65]
  - - [30384, 48, 1, 48]
    - [12, 19.829]
  - - [32576, 64, 1, 64]
    - [14, 28.854]
  - - [23424, 48, 1, 48]
    - [122, 17.402]
  - - [9728, 66, 1, 66]
    - [136, 12.547]
  - - [28248, 30, 1, 36]
    - [99, 8.727]
  - - [3104, 32, 1, 32]
    - [8, 1.387]
  - - [5760, 192, 1, 192]
    - [24, 41.793]
  - - [3616, 32, 1, 32]
    - [137, 1.752]
  - - [13280, 32, 1, 32]
    - [72, 5.827]
  - - [41984, 124, 1, 132]
    - [113, 47.08]
  - - [10298, 58, 1, 66]
    - [8, 14.318]
  - - [42554, 58, 1, 66]
    - [9, 29.248]
  - - [8858, 30, 1, 36]
    - [30, 4.218]
  - - [4464, 48, 1, 48]
    - [77, 4.581]
  - - [14080, 58, 1, 66]
    - [5, 18.405]
  - - [12704, 32, 1, 32]
    - [8, 5.331]
  - - [36912, 48, 1, 48]
    - [46, 19.781]
  - - [37720, 30, 1, 36]
    - [59, 13.046]
  - - [33280, 66, 1, 66]
    - [53, 24.113]
  - - [28928, 58, 1, 66]
    - [99, 22.894]
  - - [27696, 48, 1, 48]
    - [105, 15.606]
  - - [13144, 30, 1, 36]
    - [112, 5.487]
  - - [8832, 192, 1, 192]
    - [19, 49.092]
  - - [15418, 58, 1, 66]
    - [74, 16.956]
  - - [31552, 64, 1, 64]
    - [78, 27.483]
  - - [32256, 96, 1, 96]
    - [54, 38.097]
  - - [41856, 96, 1, 96]
    - [138, 41.673]
  - - [17232, 48, 1, 48]
    - [24, 12.066]
  - - [18944, 58, 1, 66]
    - [85, 22.07]
  - - [35664, 48, 1, 48]
    - [3, 18.408]
  - - [40320, 48, 1, 48]
    - [9, 21.328]
  - - [44032, 58, 1, 66]
    - [8, 28.711]
  - - [20992, 66, 1, 66]
    - [8, 20.638]
  - - [35072, 124, 1, 132]
    - [60, 43.337]
  - - [3936, 96, 1, 96]
    - [8, 11.532]
  - - [1500, 30, 1, 36]
    - [2, 0.747]
  - - [34976, 32, 1, 32]
    - [8, 9.838]
  - - [41882, 30, 1, 36]
    - [8, 13.588]
  - - [32672, 32, 1, 32]
    - [54, 11.859]
  - - [11568, 48, 1, 48]
    - [9, 10.572]
  - - [19584, 192, 1, 192]
    - [6, 55.049]
  - - [17978, 58, 1, 66]
    - [9, 19.99]
  - - [12672, 192, 1, 192]
    - [3, 56.123]
  - - [26272, 32, 1, 32]
    - [8, 9.945]
  - - [23384, 30, 1, 36]
    - [8, 9.002]
  - - [36096, 66, 1, 66]
    - [17, 23.966]
  - - [22464, 64, 1, 64]
    - [35, 24.847]
  - - [14112, 96, 1, 96]
    - [21, 31.124]
  - - [19968, 192, 1, 192]
    - [14, 55.538]
  - - [17408, 58, 1, 66]
    - [75, 20.089]
  - - [19646, 66, 1, 66]
    - [54, 17.875]
  - - [42496, 58, 1, 66]
    - [78, 29.581]
  - - [6912, 30, 1, 36]
    - [24, 3.131]
  - - [1792, 58, 1, 66]
    - [2, 2.806]
  - - [35744, 32, 1, 32]
    - [12, 10.143]
  - - [36828, 30, 1, 36]
    - [8, 12.289]
  - - [10512, 48, 1, 48]
    - [52, 9.357]
  - - [25278, 66, 1, 66]
    - [89, 22.224]
  - - [5376, 48, 1, 48]
    - [5, 5.779]
  - - [17568, 32, 1, 32]
    - [8, 8.149]
  - - [15872, 124, 1, 132]
    - [139, 45.634]
  - - [30010, 58, 1, 66]
    - [19, 26.591]
  - - [20064, 96, 1, 96]
    - [12, 36.509]
  - - [41136, 48, 1, 48]
    - [9, 19.094]
  - - [6458, 58, 1, 66]
    - [106, 7.756]
  - - [11936, 32, 1, 32]
    - [8, 5.978]
  - - [39834, 30, 1, 36]
    - [8, 12.228]
  - - [37888, 124, 1, 132]
    - [107, 45.965]
  - - [512, 128, 1, 128]
    - [2, 2.929]
  - - [23616, 64, 1, 64]
    - [19, 23.672]
  - - [15600, 48, 1, 48]
    - [9, 12.787]
  - - [17664, 128, 1, 128]
    - [55, 47.399]
  - - [27680, 32, 1, 32]
    - [87, 11.107]
  - - [30912, 64, 1, 64]
    - [14, 29.086]
  - - [10080, 96, 1, 96]
    - [8, 27.609]
  - - [36512, 32, 1, 32]
    - [63, 11.801]
  - - [41312, 32, 1, 32]
    - [8, 12.618]
  - - [28128, 96, 1, 96]
    - [17, 40.477]
  - - [41184, 32, 1, 32]
    - [140, 13.992]
  - - [13120, 64, 1, 64]
    - [9, 19.023]
  - - [3548, 30, 1, 36]
    - [5, 1.651]
  - - [31072, 32, 1, 32]
    - [37, 8.976]
  - - [11232, 96, 1, 96]
    - [21, 24.197]
  - - [20824, 30, 1, 36]
    - [8, 9.282]
  - - [26112, 192, 1, 192]
    - [14, 58.231]
  - - [43264, 30, 1, 36]
    - [141, 13.477]
  - - [768, 124, 1, 132]
    - [134, 4.027]
  - - [5632, 124, 1, 132]
    - [62, 23.435]
  - - [12544, 128, 1, 128]
    - [19, 37.776]
  - - [38944, 32, 1, 32]
    - [3, 10.158]
  - - [32400, 48, 1, 48]
    - [37, 18.637]
  - - [40192, 58, 1, 66]
    - [107, 28.154]
  - - [19008, 64, 1, 64]
    - [3, 23.357]
  - - [4320, 96, 1, 96]
    - [88, 14.448]
  - - [27992, 30, 1, 36]
    - [8, 10.972]
  - - [35328, 128, 1, 128]
    - [18, 43.83]
  - - [4286, 66, 1, 66]
    - [16, 7.89]
  - - [41408, 64, 1, 64]
    - [20, 29.948]
  - - [38364, 30, 1, 36]
    - [87, 13.837]
  - - [4272, 48, 1, 48]
    - [5, 4.378]
  - - [13466, 30, 1, 36]
    - [3, 5.881]
  - - [6528, 96, 1, 96]
    - [8, 20.919]
  - - [38144, 58, 1, 66]
    - [9, 29.047]
  - - [16992, 96, 1, 96]
    - [54, 33.836]
  - - [21760, 124, 1, 132]
    - [78, 46.707]
  - - [2048, 128, 1, 128]
    - [8, 12.742]
  - - [42394, 30, 1, 36]
    - [89, 12.008]
  - - [29754, 58, 1, 66]
    - [19, 22.81]
  - - [18912, 32, 1, 32]
    - [8, 6.912]
  - - [14048, 32, 1, 32]
    - [8, 6.195]
  - - [18576, 48, 1, 48]
    - [9, 13.821]
  - - [15840, 32, 1, 32]
    - [8, 6.451]
  - - [30000, 48, 1, 48]
    - [19, 18.13]
  - - [43930, 30, 1, 36]
    - [3, 12.632]
  - - [29632, 64, 1, 64]
    - [14, 24.437]
  - - [7424, 66, 1, 66]
    - [8, 10.446]
  - - [768, 66, 1, 66]
    - [16, 1.381]
  - - [16640, 124, 1, 132]
    - [9, 43.025]
  - - [6944, 32, 1, 32]
    - [27, 2.999]
  - - [34560, 128, 1, 128]
    - [62, 41.157]
  - - [33880, 30, 1, 36]
    - [87, 11.891]
  - - [28826, 30, 1, 36]
    - [8, 10.295]
  - - [24510, 66, 1, 66]
    - [99, 19.557]
  - - [25688, 30, 1, 36]
    - [8, 10.129]
  - - [17520, 48, 1, 48]
    - [24, 14.062]
  - - [1152, 192, 1, 192]
    - [5, 13.492]
  - - [10080, 32, 1, 32]
    - [8, 4.88]
  - - [512, 58, 1, 66]
    - [16, 0.84]
  - - [4384, 32, 1, 32]
    - [5, 2.336]
  - - [39424, 124, 1, 132]
    - [14, 49.053]
  - - [6752, 32, 1, 32]
    - [5, 3.519]
  - - [1536, 66, 1, 66]
    - [137, 2.03]
  - - [4032, 64, 1, 64]
    - [8, 7.549]
  - - [6744, 30, 1, 36]
    - [5, 3.516]
  - - [7424, 124, 1, 132]
    - [9, 31.872]
  - - [15616, 66, 1, 66]
    - [14, 15.943]
  - - [40704, 124, 1, 132]
    - [14, 48.822]
  - - [37274, 30, 1, 36]
    - [3, 10.197]
  - - [27582, 66, 1, 66]
    - [22, 24.552]
  - - [34080, 96, 1, 96]
    - [142, 38.02]
  - - [21072, 48, 1, 48]
    - [9, 13.674]
  - - [8448, 128, 1, 128]
    - [117, 32.751]
  - - [3328, 124, 1, 132]
    - [5, 18.649]
  - - [16960, 64, 1, 64]
    - [14, 17.338]
  - - [24416, 32, 1, 32]
    - [99, 9.077]
  - - [23808, 30, 1, 36]
    - [93, 10.115]
  - - [26208, 96, 1, 96]
    - [17, 39.212]
  - - [37340, 30, 1, 36]
    - [99, 12.125]
  - - [12512, 32, 1, 32]
    - [8, 5.517]
  - - [220, 30, 1, 36]
    - [115, 0.11]
  - - [37680, 48, 1, 48]
    - [14, 20.782]
  - - [36384, 96, 1, 96]
    - [61, 44.001]
  - - [23896, 30, 1, 36]
    - [8, 9.751]
  - - [33408, 48, 1, 48]
    - [9, 18.794]
  - - [19544, 30, 1, 36]
    - [8, 7.529]
  - - [12336, 48, 1, 48]
    - [71, 10.61]
  - - [20672, 64, 1, 64]
    - [14, 25.153]
  - - [18912, 96, 1, 96]
    - [8, 34.277]
  - - [34464, 32, 1, 32]
    - [99, 12.261]
  - - [43776, 48, 1, 48]
    - [9, 22.217]
  - - [21888, 96, 1, 96]
    - [30, 33.661]
  - - [20736, 192, 1, 192]
    - [107, 55.455]
  - - [30688, 32, 1, 32]
    - [8, 9.922]
  - - [2560, 30, 1, 36]
    - [19, 1.007]
  - - [39900, 30, 1, 36]
    - [24, 13.927]
  - - [39000, 30, 1, 36]
    - [50, 11.986]
  - - [23568, 48, 1, 48]
    - [143, 14.824]
  - - [22656, 192, 1, 192]
    - [90, 55.041]
  - - [26112, 48, 1, 48]
    - [19, 17.799]
  - - [31344, 48, 1, 48]
    - [9, 17.825]
  - - [28474, 58, 1, 66]
    - [95, 24.321]
  - - [24064, 124, 1, 132]
    - [9, 48.054]
  - - [38112, 96, 1, 96]
    - [17, 40.689]
  - - [8960, 30, 1, 36]
    - [99, 4.567]
  - - [16604, 30, 1, 36]
    - [8, 7.521]
  - - [1082, 58, 1, 66]
    - [2, 1.723]
  - - [36416, 64, 1, 64]
    - [14, 30.558]
  - - [7584, 32, 1, 32]
    - [5, 3.669]
  - - [24096, 32, 1, 32]
    - [8, 8.173]
  - - [28800, 96, 1, 96]
    - [17, 40.556]
  - - [15104, 30, 1, 36]
    - [8, 6.505]
  - - [29440, 58, 1, 66]
    - [19, 25.998]
  - - [4608, 96, 1, 96]
    - [8, 13.616]
  - - [13024, 32, 1, 32]
    - [32, 6.009]
  - - [12288, 58, 1, 66]
    - [9, 17.075]
  - - [38656, 124, 1, 132]
    - [78, 47.812]
  - - [4080, 48, 1, 48]
    - [8, 3.442]
  - - [18944, 30, 1, 36]
    - [8, 8.711]
  - - [17664, 96, 1, 96]
    - [54, 34.782]
  - - [7520, 32, 1, 32]
    - [5, 3.14]
  - - [41472, 48, 1, 48]
    - [6, 18.69]
  - - [27872, 32, 1, 32]
    - [8, 8.619]
  - - [13888, 64, 1, 64]
    - [144, 17.414]
  - - [41406, 66, 1, 66]
    - [22, 26.013]
  - - [20768, 32, 1, 32]
    - [8, 9.126]
  - - [4560, 48, 1, 48]
    - [8, 5.058]
  - - [16512, 192, 1, 192]
    - [14, 46.389]
  - - [16656, 48, 1, 48]
    - [99, 13.706]
  - - [33690, 30, 1, 36]
    - [99, 12.204]
  - - [15616, 58, 1, 66]
    - [44, 16.202]
  - - [33792, 96, 1, 96]
    - [145, 38.35]
  - - [40160, 32, 1, 32]
    - [8, 12.26]
  - - [22784, 124, 1, 132]
    - [14, 40.13]
  - - [10592, 32, 1, 32]
    - [8, 4.126]
  - - [38912, 58, 1, 66]
    - [110, 23.361]
  - - [12376, 30, 1, 36]
    - [8, 5.636]
  - - [10174, 66, 1, 66]
    - [53, 14.948]
  - - [1968, 48, 1, 48]
    - [8, 1.835]
  - - [7296, 192, 1, 192]
    - [117, 47.642]
  - - [7066, 30, 1, 36]
    - [69, 3.07]
  - - [37632, 128, 1, 128]
    - [20, 45.401]
  - - [18908, 30, 1, 36]
    - [85, 8.204]
  - - [34816, 128, 1, 128]
    - [62, 42.668]
  - - [7360, 64, 1, 64]
    - [95, 9.575]
  - - [29952, 124, 1, 132]
    - [22, 44.841]
  - - [2816, 128, 1, 128]
    - [48, 12.534]
  - - [34268, 30, 1, 36]
    - [14, 10.213]
  - - [22872, 30, 1, 36]
    - [8, 9.401]
  - - [22240, 32, 1, 32]
    - [122, 7.262]
  - - [35584, 124, 1, 132]
    - [71, 43.417]
  - - [912, 48, 1, 48]
    - [9, 0.805]
  - - [27392, 66, 1, 66]
    - [8, 22.924]
  - - [15552, 64, 1, 64]
    - [146, 19.461]
  - - [24032, 32, 1, 32]
    - [8, 9.996]
  - - [23472, 48, 1, 48]
    - [19, 14.037]
  - - [16416, 96, 1, 96]
    - [54, 31.235]
  - - [16192, 64, 1, 64]
    - [35, 13.91]
  - - [7168, 66, 1, 66]
    - [81, 7.797]
  - - [43104, 32, 1, 32]
    - [14, 12.364]
  - - [10784, 32, 1, 32]
    - [5, 5.054]
  - - [42752, 128, 1, 128]
    - [107, 52.721]
  - - [10430, 66, 1, 66]
    - [147, 11.927]
  - - [32928, 32, 1, 32]
    - [3, 10.731]
  - - [38208, 64, 1, 64]
    - [3, 33.375]
  - - [17504, 32, 1, 32]
    - [8, 4.592]
  - - [12602, 58, 1, 66]
    - [8, 17.213]
  - - [25402, 58, 1, 66]
    - [54, 23.898]
  - - [35264, 64, 1, 64]
    - [14, 32.259]
  - - [3994, 30, 1, 36]
    - [148, 1.896]
  - - [14208, 96, 1, 96]
    - [27, 32.959]
  - - [6000, 48, 1, 48]
    - [5, 6.561]
  - - [32256, 58, 1, 66]
    - [149, 26.61]
  - - [1280, 58, 1, 66]
    - [2, 2.071]
  - - [13344, 96, 1, 96]
    - [117, 30.305]
  - - [21336, 30, 1, 36]
    - [8, 9.513]
  - - [34714, 30, 1, 36]
    - [8, 11.809]
  - - [8536, 30, 1, 36]
    - [8, 4.102]
  - - [13056, 96, 1, 96]
    - [122, 31.147]
  - - [33248, 32, 1, 32]
    - [14, 10.164]
  - - [20480, 124, 1, 132]
    - [9, 45.957]
  - - [14688, 32, 1, 32]
    - [8, 5.182]
  - - [33632, 32, 1, 32]
    - [142, 12.026]
  - - [6480, 48, 1, 48]
    - [1, 7.119]
  - - [28800, 192, 1, 192]
    - [127, 58.741]
  - - [26656, 32, 1, 32]
    - [8, 11.219]
  - - [1504, 32, 1, 32]
    - [54, 0.713]
  - - [28752, 48, 1, 48]
    - [150, 17.012]
  - - [5472, 32, 1, 32]
    - [5, 2.878]
  - - [32000, 30, 1, 36]
    - [8, 9.883]
  - - [27904, 58, 1, 66]
    - [19, 26.137]
  - - [31680, 64, 1, 64]
    - [20, 26.862]
  - - [18688, 124, 1, 132]
    - [20, 45.73]
  - - [4064, 32, 1, 32]
    - [16, 1.577]
  - - [9180, 30, 1, 36]
    - [8, 4.399]
  - - [23872, 64, 1, 64]
    - [88, 20.454]
  - - [36768, 96, 1, 96]
    - [17, 38.953]
  - - [10752, 96, 1, 96]
    - [22, 25.751]
  - - [18366, 66, 1, 66]
    - [17, 16.978]
  - - [30672, 48, 1, 48]
    - [8, 18.183]
  - - [19248, 48, 1, 48]
    - [9, 15.283]
  - - [9888, 32, 1, 32]
    - [14, 4.081]
  - - [33280, 124, 1, 132]
    - [59, 43.429]
  - - [30944, 32, 1, 32]
    - [151, 11.335]
  - - [32864, 32, 1, 32]
    - [8, 11.423]
  - - [29856, 96, 1, 96]
    - [134, 40.466]
  - - [3072, 192, 1, 192]
    - [58, 29.59]
  - - [1024, 58, 1, 66]
    - [69, 1.365]
  - - [12544, 30, 1, 36]
    - [146, 5.235]
  - - [37248, 192, 1, 192]
    - [152, 61.524]
  - - [19360, 32, 1, 32]
    - [56, 8.321]
  - - [18192, 48, 1, 48]
    - [12, 14.963]
  - - [10496, 128, 1, 128]
    - [98, 38.084]
  - - [20992, 58, 1, 66]
    - [9, 23.282]
  - - [21744, 48, 1, 48]
    - [9, 15.027]
  - - [13536, 96, 1, 96]
    - [54, 28.441]
  - - [39424, 66, 1, 66]
    - [82, 25.423]
  - - [17664, 48, 1, 48]
    - [150, 14.432]
  - - [25248, 96, 1, 96]
    - [27, 38.629]
  - - [1850, 58, 1, 66]
    - [8, 2.808]
  - - [8736, 96, 1, 96]
    - [8, 22.599]
  - - [38656, 128, 1, 128]
    - [6, 46.403]
  - - [23296, 30, 1, 36]
    - [8, 8.549]
  - - [29504, 64, 1, 64]
    - [3, 25.48]
  - - [4848, 48, 1, 48]
    - [77, 5.059]
  - - [11296, 32, 1, 32]
    - [16, 4.207]
  - - [12000, 32, 1, 32]
    - [69, 6.069]
  - - [20128, 32, 1, 32]
    - [8, 7.926]
  - - [27136, 124, 1, 132]
    - [6, 47.961]
  - - [4352, 30, 1, 36]
    - [16, 2.253]
  - - [28094, 66, 1, 66]
    - [76, 24.15]
  - - [42208, 32, 1, 32]
    - [8, 12.066]
  - - [35416, 30, 1, 36]
    - [115, 10.516]
  - - [1152, 96, 1, 96]
    - [5, 3.83]
  - - [3804, 30, 1, 36]
    - [5, 2.156]
  - - [27706, 58, 1, 66]
    - [19, 25.242]
  - - [24064, 30, 1, 36]
    - [134, 10.113]
  - - [28960, 32, 1, 32]
    - [106, 11.157]
  - - [24664, 30, 1, 36]
    - [8, 9.932]
  - - [3072, 124, 1, 132]
    - [8, 14.392]
  - - [30176, 32, 1, 32]
    - [99, 12.094]
  - - [34704, 48, 1, 48]
    - [9, 20.499]
  - - [42496, 124, 1, 132]
    - [9, 50.207]
  - - [7392, 96, 1, 96]
    - [153, 22.852]
  - - [23808, 58, 1, 66]
    - [9, 22.021]
  - - [43616, 32, 1, 32]
    - [8, 13.322]
  - - [2624, 64, 1, 64]
    - [134, 3.811]
  - - [4192, 32, 1, 32]
    - [5, 1.929]
  - - [39168, 66, 1, 66]
    - [82, 25.058]
  - - [24766, 66, 1, 66]
    - [116, 19.622]
  - - [26588, 30, 1, 36]
    - [8, 11.324]
  - - [14014, 66, 1, 66]
    - [75, 15.453]
  - - [3036, 30, 1, 36]
    - [56, 1.294]
  - - [5808, 48, 1, 48]
    - [5, 5.172]
  - - [666, 30, 1, 36]
    - [99, 0.294]
  - - [11072, 64, 1, 64]
    - [5, 14.067]
  - - [17824, 32, 1, 32]
    - [16, 7.855]
  - - [7296, 48, 1, 48]
    - [8, 7.579]
  - - [37120, 30, 1, 36]
    - [99, 13.887]
  - - [5280, 32, 1, 32]
    - [5, 2.826]
  - - [13440, 96, 1, 96]
    - [27, 31.299]
  - - [40416, 96, 1, 96]
    - [95, 39.083]
  - - [11008, 124, 1, 132]
    - [30, 35.026]
  - - [20112, 48, 1, 48]
    - [142, 13.901]
  - - [23744, 64, 1, 64]
    - [18, 22.02]
  - - [13824, 48, 1, 48]
    - [8, 12.796]
  - - [32304, 48, 1, 48]
    - [154, 15.43]
  - - [39256, 30, 1, 36]
    - [35, 13.084]
  - - [1880, 30, 1, 36]
    - [5, 0.892]
  - - [27546, 30, 1, 36]
    - [3, 8.926]
  - - [13248, 64, 1, 64]
    - [88, 19.366]
  - - [4864, 66, 1, 66]
    - [3, 7.934]
  - - [4096, 66, 1, 66]
    - [8, 7.449]
  - - [37280, 32, 1, 32]
    - [8, 11.648]
  - - [4672, 64, 1, 64]
    - [75, 6.468]
  - - [9120, 96, 1, 96]
    - [56, 23.491]
  - - [18176, 128, 1, 128]
    - [55, 47.242]
  - - [32768, 58, 1, 66]
    - [139, 27.081]
  - - [41626, 30, 1, 36]
    - [54, 11.037]
  - - [18622, 66, 1, 66]
    - [3, 18.033]
  - - [26880, 66, 1, 66]
    - [17, 20.468]
  - - [19296, 32, 1, 32]
    - [87, 7.551]
  - - [13632, 64, 1, 64]
    - [101, 14.52]
  - - [16794, 30, 1, 36]
    - [134, 5.859]
  - - [26682, 58, 1, 66]
    - [19, 21.367]
  - - [18720, 96, 1, 96]
    - [85, 31.612]
  - - [6768, 48, 1, 48]
    - [21, 6.633]
  - - [25248, 32, 1, 32]
    - [75, 10.262]
  - - [8192, 58, 1, 66]
    - [5, 12.405]
  - - [11808, 32, 1, 32]
    - [59, 5.769]
  - - [5984, 32, 1, 32]
    - [5, 2.745]
  - - [23040, 124, 1, 132]
    - [155, 44.958]
  - - [29664, 96, 1, 96]
    - [21, 38.43]
  - - [11040, 32, 1, 32]
    - [8, 5.485]
  - - [40382, 66, 1, 66]
    - [17, 24.273]
  - - [36192, 32, 1, 32]
    - [75, 12.527]
  - - [4184, 30, 1, 36]
    - [5, 2.182]
  - - [24928, 32, 1, 32]
    - [8, 10.249]
  - - [11712, 64, 1, 64]
    - [14, 17.854]
  - - [33408, 192, 1, 192]
    - [107, 63.353]
  - - [32928, 96, 1, 96]
    - [17, 40.428]
  - - [36832, 32, 1, 32]
    - [115, 12.24]
  - - [28672, 124, 1, 132]
    - [6, 48.859]
  - - [32154, 30, 1, 36]
    - [110, 9.13]
  - - [9918, 66, 1, 66]
    - [87, 14.897]
  - - [36952, 30, 1, 36]
    - [99, 13.303]
  - - [16464, 48, 1, 48]
    - [150, 13.509]
  - - [34848, 32, 1, 32]
    - [99, 12.468]
  - - [42176, 64, 1, 64]
    - [14, 33.044]
  - - [32256, 48, 1, 48]
    - [46, 19.873]
  - - [3584, 124, 1, 132]
    - [5, 17.194]
  - - [7104, 64, 1, 64]
    - [8, 12.579]
  - - [18878, 66, 1, 66]
    - [8, 17.978]
  - - [17184, 96, 1, 96]
    - [8, 31.38]
  - - [26880, 124, 1, 132]
    - [55, 52.674]
  - - [3840, 48, 1, 48]
    - [8, 4.432]
  - - [7900, 30, 1, 36]
    - [5, 4.075]
  - - [25440, 32, 1, 32]
    - [153, 8.83]
  - - [35936, 32, 1, 32]
    - [156, 10.127]
  - - [27840, 64, 1, 64]
    - [83, 28.29]
  - - [37312, 64, 1, 64]
    - [91, 27.164]
  - - [18586, 30, 1, 36]
    - [8, 8.673]
  - - [37952, 64, 1, 64]
    - [9, 31.444]
  - - [7728, 48, 1, 48]
    - [5, 7.862]
  - - [3840, 192, 1, 192]
    - [27, 33.924]
  - - [41472, 124, 1, 132]
    - [14, 49.074]
  - - [7968, 96, 1, 96]
    - [31, 19.877]
  - - [17664, 124, 1, 132]
    - [9, 35.498]
  - - [16128, 192, 1, 192]
    - [60, 40.053]
  - - [6144, 30, 1, 36]
    - [44, 2.113]
  - - [20688, 48, 1, 48]
    - [9, 16.297]
  - - [20224, 30, 1, 36]
    - [8, 8.445]
  - - [1536, 96, 1, 96]
    - [2, 5.805]
  - - [36480, 96, 1, 96]
    - [108, 39.852]
  - - [28416, 192, 1, 192]
    - [94, 57.392]
  - - [18960, 48, 1, 48]
    - [9, 14.883]
  - - [15216, 48, 1, 48]
    - [9, 13.225]
  - - [41232, 48, 1, 48]
    - [48, 24.279]
  - - [33056, 32, 1, 32]
    - [95, 11.842]
  - - [2048, 30, 1, 36]
    - [99, 0.948]
  - - [14848, 66, 1, 66]
    - [157, 15.634]
  - - [4666, 58, 1, 66]
    - [8, 6.463]
  - - [12544, 124, 1, 132]
    - [63, 36.529]
  - - [5024, 32, 1, 32]
    - [21, 2.067]
  - - [32256, 124, 1, 132]
    - [14, 39.049]
  - - [29082, 30, 1, 36]
    - [8, 11.546]
  - - [22170, 30, 1, 36]
    - [8, 9.691]
  - - [20414, 66, 1, 66]
    - [8, 18.034]
  - - [14592, 58, 1, 66]
    - [52, 18.54]
  - - [28314, 30, 1, 36]
    - [8, 11.761]
  - - [11760, 48, 1, 48]
    - [132, 10.935]
  - - [42240, 128, 1, 128]
    - [20, 52.525]
  - - [34656, 96, 1, 96]
    - [7, 38.164]
  - - [14816, 32, 1, 32]
    - [8, 7.22]
  - - [10464, 96, 1, 96]
    - [54, 25.794]
  - - [39744, 64, 1, 64]
    - [112, 31.968]
  - - [16640, 58, 1, 66]
    - [158, 16.737]
  - - [11136, 96, 1, 96]
    - [9, 26.404]
  - - [35840, 58, 1, 66]
    - [9, 24.56]
  - - [11424, 32, 1, 32]
    - [4, 4.391]
  - - [37440, 64, 1, 64]
    - [14, 28.922]
  - - [41304, 30, 1, 36]
    - [24, 10.745]
  - - [21408, 32, 1, 32]
    - [81, 9.082]
  - - [12032, 124, 1, 132]
    - [86, 34.586]
  - - [4352, 128, 1, 128]
    - [8, 22.51]
  - - [23098, 58, 1, 66]
    - [19, 20.033]
  - - [43710, 66, 1, 66]
    - [95, 27.306]
  - - [31248, 48, 1, 48]
    - [8, 15.655]
  - - [22560, 96, 1, 96]
    - [17, 36.943]
  - - [17306, 30, 1, 36]
    - [8, 6.381]
  - - [23552, 128, 1, 128]
    - [26, 46.034]
  - - [6400, 124, 1, 132]
    - [9, 29.024]
  - - [1888, 32, 1, 32]
    - [8, 0.753]
  - - [40704, 128, 1, 128]
    - [14, 49.095]
  - - [22528, 58, 1, 66]
    - [3, 20.992]
  - - [44000, 32, 1, 32]
    - [124, 14.099]
  - - [6304, 32, 1, 32]
    - [5, 3.295]
  - - [21216, 96, 1, 96]
    - [10, 34.945]
  - - [9560, 30, 1, 36]
    - [5, 4.277]
  - - [1470, 66, 1, 66]
    - [5, 2.675]
  - - [25344, 192, 1, 192]
    - [107, 57.957]
  - - [21936, 48, 1, 48]
    - [150, 16.074]
  - - [14526, 66, 1, 66]
    - [118, 18.301]
  - - [38458, 58, 1, 66]
    - [98, 24.415]
  - - [192, 64, 1, 64]
    - [2, 0.281]
  - - [12698, 30, 1, 36]
    - [53, 4.676]
  - - [9984, 96, 1, 96]
    - [8, 23.607]
  - - [30368, 32, 1, 32]
    - [159, 9.779]
  - - [23194, 30, 1, 36]
    - [8, 9.075]
  - - [17280, 192, 1, 192]
    - [112, 46.166]
  - - [35130, 58, 1, 66]
    - [8, 25.657]
  - - [21080, 30, 1, 36]
    - [8, 9.489]
  - - [10368, 192, 1, 192]
    - [46, 51.246]
  - - [21562, 58, 1, 66]
    - [9, 22.025]
  - - [27612, 30, 1, 36]
    - [8, 9.19]
  - - [14656, 64, 1, 64]
    - [14, 20.804]
  - - [29696, 66, 1, 66]
    - [17, 24.555]
  - - [34560, 48, 1, 48]
    - [20, 19.797]
  - - [18396, 30, 1, 36]
    - [8, 7.621]
  - - [39840, 32, 1, 32]
    - [8, 12.997]
  - - [19200, 124, 1, 132]
    - [3, 40.746]
  - - [20880, 48, 1, 48]
    - [160, 16.131]
  - - [39424, 128, 1, 128]
    - [62, 48.073]
  - - [34992, 48, 1, 48]
    - [14, 19.461]
  - - [17056, 32, 1, 32]
    - [161, 5.681]
  - - [4608, 66, 1, 66]
    - [8, 8.604]
  - - [17248, 32, 1, 32]
    - [134, 7.94]
  - - [14368, 32, 1, 32]
    - [16, 7.196]
  - - [24634, 58, 1, 66]
    - [19, 20.408]
  - - [29568, 96, 1, 96]
    - [65, 36.362]
  - - [17376, 96, 1, 96]
    - [63, 28.753]
  - - [16544, 32, 1, 32]
    - [8, 6.672]
  - - [12858, 58, 1, 66]
    - [9, 13.623]
  - - [16318, 66, 1, 66]
    - [8, 15.314]
  - - [11418, 30, 1, 36]
    - [5, 5.682]
  - - [43072, 64, 1, 64]
    - [14, 33.965]
  - - [19824, 48, 1, 48]
    - [9, 15.872]
  - - [38144, 128, 1, 128]
    - [152, 47.495]
  - - [31776, 32, 1, 32]
    - [162, 10.597]
  - - [2240, 64, 1, 64]
    - [5, 3.856]
  - - [8960, 58, 1, 66]
    - [5, 10.853]
  - - [9504, 96, 1, 96]
    - [77, 19.853]
  - - [40608, 32, 1, 32]
    - [106, 11.077]
  - - [18330, 30, 1, 36]
    - [8, 6.472]
  - - [8448, 48, 1, 48]
    - [5, 8.754]
  - - [12120, 30, 1, 36]
    - [8, 5.973]
  - - [39512, 30, 1, 36]
    - [8, 11.607]
  - - [8352, 96, 1, 96]
    - [8, 22.574]
  - - [11968, 64, 1, 64]
    - [9, 16.233]
  - - [42336, 96, 1, 96]
    - [17, 39.434]
  - - [35584, 128, 1, 128]
    - [163, 43.409]
  - - [4096, 124, 1, 132]
    - [31, 20.321]
  - - [43392, 192, 1, 192]
    - [130, 62.804]
  - - [21408, 96, 1, 96]
    - [25, 35.969]
  - - [8668, 30, 1, 36]
    - [5, 4.164]
  - - [8016, 48, 1, 48]
    - [8, 6.979]
  - - [33024, 128, 1, 128]
    - [164, 48.256]
  - - [10272, 32, 1, 32]
    - [5, 4.606]
  - - [39614, 66, 1, 66]
    - [8, 25.246]
  - - [27984, 48, 1, 48]
    - [19, 18.391]
  - - [15296, 64, 1, 64]
    - [8, 20.706]
  - - [7680, 48, 1, 48]
    - [5, 7.804]
  - - [4572, 30, 1, 36]
    - [35, 1.686]
  - - [7488, 64, 1, 64]
    - [3, 10.746]
  - - [37344, 96, 1, 96]
    - [165, 42.715]
  - - [32032, 32, 1, 32]
    - [64, 11.983]
  - - [12736, 64, 1, 64]
    - [14, 17.039]
  - - [12576, 96, 1, 96]
    - [99, 30.113]
  - - [13152, 32, 1, 32]
    - [8, 5.009]
  - - [33824, 32, 1, 32]
    - [148, 10.681]
  - - [10752, 48, 1, 48]
    - [9, 10.576]
  - - [12288, 128, 1, 128]
    - [19, 38.913]
  - - [4896, 32, 1, 32]
    - [115, 1.864]
  - - [35168, 32, 1, 32]
    - [87, 10.669]
  - - [38464, 64, 1, 64]
    - [55, 28.551]
  - - [23040, 192, 1, 192]
    - [39, 54.528]
  - - [544, 32, 1, 32]
    - [9, 0.256]
  - - [33552, 48, 1, 48]
    - [25, 21.866]
  - - [5888, 30, 1, 36]
    - [5, 2.503]
  - - [43322, 58, 1, 66]
    - [166, 26.695]
  - - [28864, 64, 1, 64]
    - [14, 28.674]
  - - [2336, 32, 1, 32]
    - [16, 0.981]
  - - [19098, 30, 1, 36]
    - [8, 8.769]
  - - [1296, 48, 1, 48]
    - [2, 1.405]
  - - [13856, 32, 1, 32]
    - [8, 6.709]
  - - [4608, 58, 1, 66]
    - [8, 7.575]
  - - [29536, 32, 1, 32]
    - [167, 9.05]
  - - [36336, 48, 1, 48]
    - [14, 18.85]
  - - [40544, 32, 1, 32]
    - [8, 12.57]
  - - [9472, 30, 1, 36]
    - [8, 4.043]
  - - [23040, 66, 1, 66]
    - [17, 22.148]
  - - [39936, 96, 1, 96]
    - [142, 41.094]
  - - [7008, 32, 1, 32]
    - [5, 3.676]
  - - [5434, 58, 1, 66]
    - [8, 8.952]
  - - [20736, 124, 1, 132]
    - [9, 44.063]
  - - [6816, 32, 1, 32]
    - [5, 3.563]
  - - [35840, 30, 1, 36]
    - [168, 12.867]
  - - [20992, 128, 1, 128]
    - [9, 46.873]
  - - [28672, 30, 1, 36]
    - [54, 11.572]
  - - [25944, 30, 1, 36]
    - [8, 9.849]
  - - [34304, 30, 1, 36]
    - [98, 9.006]
  - - [33280, 128, 1, 128]
    - [105, 41.467]
  - - [39322, 30, 1, 36]
    - [51, 11.205]
  - - [6432, 96, 1, 96]
    - [8, 13.131]
  - - [38976, 64, 1, 64]
    - [84, 30.495]
  - - [18672, 48, 1, 48]
    - [54, 15.141]
  - - [11680, 32, 1, 32]
    - [8, 5.924]
  - - [5088, 32, 1, 32]
    - [5, 2.798]
  - - [26464, 32, 1, 32]
    - [8, 11.066]
  - - [43248, 48, 1, 48]
    - [10, 20.751]
  - - [40960, 128, 1, 128]
    - [3, 50.846]
  - - [31520, 32, 1, 32]
    - [64, 11.383]
  - - [36250, 30, 1, 36]
    - [24, 10.736]
  - - [40352, 32, 1, 32]
    - [8, 11.406]
  - - [19032, 30, 1, 36]
    - [8, 8.758]
  - - [3904, 64, 1, 64]
    - [5, 7.018]
  - - [2012, 30, 1, 36]
    - [169, 0.757]
  - - [43056, 48, 1, 48]
    - [3, 21.91]
  - - [39680, 128, 1, 128]
    - [3, 47.058]
  - - [16480, 32, 1, 32]
    - [8, 7.595]
  - - [37920, 96, 1, 96]
    - [33, 41.982]
  - - [18432, 58, 1, 66]
    - [24, 21.335]
  - - [8280, 30, 1, 36]
    - [67, 3.451]
  - - [512, 124, 1, 132]
    - [8, 2.775]
  - - [39168, 30, 1, 36]
    - [54, 12.627]
  - - [25344, 66, 1, 66]
    - [21, 21.806]
  - - [13792, 32, 1, 32]
    - [99, 6.46]
  - - [24720, 48, 1, 48]
    - [19, 17.159]
  - - [26208, 32, 1, 32]
    - [8, 10.139]
  - - [43968, 64, 1, 64]
    - [3, 33.356]
  - - [43424, 32, 1, 32]
    - [54, 14.553]
  - - [38256, 48, 1, 48]
    - [9, 19.948]
  - - [5728, 32, 1, 32]
    - [5, 2.725]
  - - [11454, 66, 1, 66]
    - [54, 15.129]
  - - [30654, 66, 1, 66]
    - [53, 26.159]
  - - [40024, 30, 1, 36]
    - [24, 11.249]
  - - [19632, 48, 1, 48]
    - [9, 12.652]
  - - [13882, 58, 1, 66]
    - [8, 14.671]
  - - [8346, 30, 1, 36]
    - [8, 3.997]
  - - [11328, 64, 1, 64]
    - [5, 15.611]
  - - [28928, 66, 1, 66]
    - [170, 25.853]
  - - [26624, 128, 1, 128]
    - [20, 51.198]
  - - [33568, 32, 1, 32]
    - [94, 10.033]
  - - [1984, 64, 1, 64]
    - [171, 3.45]
  - - [26848, 32, 1, 32]
    - [8, 11.27]
  - - [36672, 64, 1, 64]
    - [3, 32.855]
  - - [18432, 128, 1, 128]
    - [55, 49.0]
  - - [19200, 128, 1, 128]
    - [14, 46.671]
  - - [29216, 32, 1, 32]
    - [54, 10.421]
  - - [768, 96, 1, 96]
    - [8, 2.228]
  - - [14680, 30, 1, 36]
    - [8, 6.946]
  - - [30106, 30, 1, 36]
    - [8, 11.884]
  - - [6144, 66, 1, 66]
    - [8, 10.818]
  - - [30464, 58, 1, 66]
    - [19, 27.08]
  - - [9360, 48, 1, 48]
    - [8, 9.668]
  - - [39168, 128, 1, 128]
    - [14, 48.902]
  - - [16954, 58, 1, 66]
    - [9, 19.129]
  - - [21182, 66, 1, 66]
    - [8, 20.169]
  - - [28464, 48, 1, 48]
    - [96, 16.111]
  - - [40768, 64, 1, 64]
    - [81, 29.233]
  - - [36060, 30, 1, 36]
    - [8, 10.514]
  - - [18944, 66, 1, 66]
    - [8, 18.679]
  - - [2304, 66, 1, 66]
    - [2, 4.526]
  - - [9472, 66, 1, 66]
    - [14, 12.831]
  - - [20896, 32, 1, 32]
    - [3, 8.345]
  - - [5920, 32, 1, 32]
    - [2, 3.225]
  - - [43834, 58, 1, 66]
    - [94, 29.427]
  - - [43632, 48, 1, 48]
    - [9, 21.666]
  - - [20352, 192, 1, 192]
    - [143, 56.96]
  - - [15456, 96, 1, 96]
    - [72, 29.12]
  - - [36816, 48, 1, 48]
    - [14, 18.535]
  - - [20592, 48, 1, 48]
    - [9, 13.708]
  - - [13568, 128, 1, 128]
    - [19, 41.436]
  - - [7680, 58, 1, 66]
    - [5, 12.251]
  - - [8992, 32, 1, 32]
    - [69, 3.934]
  - - [16032, 32, 1, 32]
    - [8, 5.865]
  - - [39520, 32, 1, 32]
    - [8, 11.379]
  - - [34304, 66, 1, 66]
    - [22, 23.424]
  - - [20158, 66, 1, 66]
    - [125, 20.669]
  - - [13912, 30, 1, 36]
    - [87, 6.481]
  - - [31264, 32, 1, 32]
    - [116, 8.869]
  - - [1214, 66, 1, 66]
    - [8, 1.727]
  - - [41530, 58, 1, 66]
    - [172, 25.681]
  - - [28160, 128, 1, 128]
    - [14, 52.175]
  - - [8480, 32, 1, 32]
    - [8, 4.222]
  - - [43104, 96, 1, 96]
    - [17, 39.403]
  - - [20568, 30, 1, 36]
    - [8, 8.022]
  - - [11856, 48, 1, 48]
    - [8, 11.012]
  - - [33024, 58, 1, 66]
    - [8, 24.929]
  - - [21248, 66, 1, 66]
    - [8, 18.542]
  - - [25792, 64, 1, 64]
    - [3, 23.11]
  - - [6096, 48, 1, 48]
    - [5, 6.197]
  - - [17280, 48, 1, 48]
    - [160, 11.726]
  - - [1632, 96, 1, 96]
    - [5, 5.194]
  - - [7388, 30, 1, 36]
    - [8, 3.603]
  - - [16896, 124, 1, 132]
    - [128, 44.749]
  - - [19456, 124, 1, 132]
    - [14, 43.971]
  - - [20928, 64, 1, 64]
    - [14, 23.174]
  - - [29952, 48, 1, 48]
    - [173, 21.327]
  - - [3120, 48, 1, 48]
    - [8, 2.755]
  - - [30398, 66, 1, 66]
    - [17, 23.679]
  - - [25754, 30, 1, 36]
    - [8, 10.805]
  - - [23962, 30, 1, 36]
    - [8, 9.431]
  - - [38912, 128, 1, 128]
    - [163, 47.073]
  - - [30112, 32, 1, 32]
    - [8, 10.546]
  - - [25176, 30, 1, 36]
    - [8, 9.918]
  - - [11520, 192, 1, 192]
    - [101, 53.335]
  - - [1536, 30, 1, 36]
    - [9, 0.708]
  - - [38912, 30, 1, 36]
    - [158, 13.65]
  - - [24192, 48, 1, 48]
    - [142, 13.952]
  - - [35280, 48, 1, 48]
    - [49, 19.045]
  - - [43936, 32, 1, 32]
    - [174, 14.32]
  - - [35712, 96, 1, 96]
    - [31, 41.436]
  - - [2064, 48, 1, 48]
    - [115, 2.017]
  - - [35072, 128, 1, 128]
    - [175, 43.026]
  - - [26880, 96, 1, 96]
    - [17, 40.215]
  - - [35952, 48, 1, 48]
    - [160, 19.959]
  - - [4768, 32, 1, 32]
    - [2, 2.626]
  - - [13568, 30, 1, 36]
    - [8, 6.92]
  - - [21760, 58, 1, 66]
    - [168, 22.807]
  - - [15360, 96, 1, 96]
    - [49, 33.975]
  - - [4154, 58, 1, 66]
    - [5, 6.779]
  - - [2464, 32, 1, 32]
    - [169, 1.156]
  - - [12346, 58, 1, 66]
    - [8, 16.834]
  - - [21504, 30, 1, 36]
    - [8, 9.663]
  - - [10752, 58, 1, 66]
    - [8, 15.521]
  - - [18336, 32, 1, 32]
    - [8, 8.375]
  - - [30048, 32, 1, 32]
    - [176, 8.992]
  - - [7152, 48, 1, 48]
    - [14, 5.745]
  - - [25856, 128, 1, 128]
    - [103, 51.586]
  - - [20026, 58, 1, 66]
    - [24, 19.243]
  - - [6624, 96, 1, 96]
    - [72, 20.495]
  - - [25296, 48, 1, 48]
    - [150, 18.523]
  - - [39712, 32, 1, 32]
    - [168, 10.766]
  - - [37728, 32, 1, 32]
    - [99, 12.129]
  - - [40416, 32, 1, 32]
    - [125, 12.372]
  - - [15776, 32, 1, 32]
    - [8, 7.703]
  - - [384, 96, 1, 96]
    - [16, 1.466]
  - - [33536, 128, 1, 128]
    - [177, 47.247]
  - - [19456, 58, 1, 66]
    - [9, 22.152]
  - - [18144, 96, 1, 96]
    - [55, 31.895]
  - - [37376, 66, 1, 66]
    - [17, 24.469]
  - - [16472, 30, 1, 36]
    - [8, 7.241]
  - - [9472, 124, 1, 132]
    - [24, 31.491]
  - - [35672, 30, 1, 36]
    - [178, 11.905]
  - - [21696, 64, 1, 64]
    - [14, 25.592]
  - - [21984, 32, 1, 32]
    - [8, 9.185]
  - - [27408, 48, 1, 48]
    - [46, 18.425]
  - - [18008, 30, 1, 36]
    - [8, 8.286]
  - - [9568, 32, 1, 32]
    - [5, 4.791]
  - - [30976, 66, 1, 66]
    - [14, 23.0]
  - - [35520, 64, 1, 64]
    - [3, 31.604]
  - - [27616, 32, 1, 32]
    - [151, 10.947]
  - - [43264, 124, 1, 132]
    - [171, 48.246]
  - - [12888, 30, 1, 36]
    - [88, 6.307]
  - - [5054, 66, 1, 66]
    - [8, 8.436]
  - - [36768, 32, 1, 32]
    - [144, 10.109]
  - - [15448, 30, 1, 36]
    - [8, 7.012]
  - - [5040, 48, 1, 48]
    - [8, 5.554]
  - - [13758, 66, 1, 66]
    - [70, 17.649]
  - - [22074, 58, 1, 66]
    - [112, 20.834]
  - - [6042, 30, 1, 36]
    - [69, 3.223]
  - - [18746, 58, 1, 66]
    - [14, 19.8]
  - - [35424, 32, 1, 32]
    - [99, 12.884]
  - - [32208, 48, 1, 48]
    - [10, 17.81]
  - - [9984, 128, 1, 128]
    - [14, 35.555]
  - - [24864, 32, 1, 32]
    - [8, 10.788]
  - - [34816, 124, 1, 132]
    - [20, 43.285]
  - - [20378, 30, 1, 36]
    - [8, 8.836]
  - - [33726, 66, 1, 66]
    - [17, 23.289]
  - - [33264, 48, 1, 48]
    - [38, 18.694]
  - - [16272, 48, 1, 48]
    - [146, 11.019]
  - - [14592, 128, 1, 128]
    - [14, 42.904]
  - - [38400, 48, 1, 48]
    - [49, 19.382]
  - - [34224, 48, 1, 48]
    - [10, 20.059]
  - - [41948, 30, 1, 36]
    - [76, 12.759]
  - - [27648, 96, 1, 96]
    - [27, 38.754]
  - - [2048, 66, 1, 66]
    - [5, 3.47]
  - - [29088, 32, 1, 32]
    - [8, 9.264]
  - - [37120, 66, 1, 66]
    - [95, 24.101]
  - - [1568, 32, 1, 32]
    - [5, 0.594]
  - - [33024, 66, 1, 66]
    - [22, 23.6]
  - - [40704, 96, 1, 96]
    - [17, 39.012]
  - - [43198, 66, 1, 66]
    - [118, 25.438]
  - - [39200, 32, 1, 32]
    - [59, 12.351]
  - - [13656, 30, 1, 36]
    - [8, 5.94]
  - - [11066, 58, 1, 66]
    - [75, 15.151]
  - - [16384, 66, 1, 66]
    - [160, 20.052]
  - - [25312, 32, 1, 32]
    - [51, 10.171]
  - - [8602, 30, 1, 36]
    - [179, 4.132]
  - - [26688, 64, 1, 64]
    - [19, 27.455]
  - - [9072, 48, 1, 48]
    - [8, 8.364]
  - - [14848, 30, 1, 36]
    - [8, 6.859]
  - - [12544, 58, 1, 66]
    - [8, 17.209]
  - - [8352, 32, 1, 32]
    - [5, 4.095]
  - - [24224, 32, 1, 32]
    - [8, 10.16]
  - - [41216, 30, 1, 36]
    - [170, 14.417]
  - - [28986, 58, 1, 66]
    - [178, 25.731]
  - - [28896, 32, 1, 32]
    - [106, 11.437]
  - - [7512, 30, 1, 36]
    - [8, 3.92]
  - - [31802, 58, 1, 66]
    - [9, 26.181]
  - - [11040, 96, 1, 96]
    - [14, 26.009]
  - - [38620, 30, 1, 36]
    - [158, 9.494]
  - - [18176, 30, 1, 36]
    - [82, 7.845]
  - - [24320, 58, 1, 66]
    - [19, 20.707]
  - - [16096, 32, 1, 32]
    - [146, 6.547]
  - - [17312, 32, 1, 32]
    - [81, 8.067]
  - - [21840, 48, 1, 48]
    - [14, 16.074]
  - - [43552, 32, 1, 32]
    - [8, 14.259]
  - - [19002, 58, 1, 66]
    - [75, 21.448]
  - - [38688, 96, 1, 96]
    - [142, 38.863]
  - - [27216, 48, 1, 48]
    - [19, 17.468]
  - - [34848, 96, 1, 96]
    - [160, 41.027]
  - - [28368, 48, 1, 48]
    - [19, 16.198]
  - - [19456, 128, 1, 128]
    - [39, 43.241]
  - - [26400, 32, 1, 32]
    - [77, 11.149]
  - - [23808, 48, 1, 48]
    - [180, 17.422]
  - - [2688, 48, 1, 48]
    - [2, 3.184]
  - - [7136, 32, 1, 32]
    - [14, 3.382]
  - - [8156, 30, 1, 36]
    - [75, 3.824]
  - - [28862, 66, 1, 66]
    - [53, 25.349]
  - - [32088, 30, 1, 36]
    - [118, 10.407]
  - - [41692, 30, 1, 36]
    - [61, 14.235]
  - - [23040, 128, 1, 128]
    - [37, 52.5]
  - - [10032, 48, 1, 48]
    - [181, 9.825]
  - - [28416, 58, 1, 66]
    - [44, 24.876]
  - - [17440, 32, 1, 32]
    - [8, 7.563]
  - - [27290, 30, 1, 36]
    - [8, 10.257]
  - - [35872, 32, 1, 32]
    - [93, 12.417]
  - - [600, 30, 1, 36]
    - [16, 0.305]
  - - [6144, 192, 1, 192]
    - [170, 41.133]
  - - [20480, 30, 1, 36]
    - [38, 8.541]
  - - [33792, 58, 1, 66]
    - [9, 25.879]
  - - [3328, 30, 1, 36]
    - [5, 1.696]
  - - [26944, 64, 1, 64]
    - [159, 27.422]
  - - [21888, 48, 1, 48]
    - [48, 17.171]
  - - [16830, 66, 1, 66]
    - [53, 19.056]
  - - [21264, 48, 1, 48]
    - [162, 16.304]
  - - [43264, 128, 1, 128]
    - [44, 52.527]
  - - [26352, 48, 1, 48]
    - [48, 17.31]
  - - [43328, 64, 1, 64]
    - [3, 34.052]
  - - [17920, 128, 1, 128]
    - [172, 46.463]
  - - [42096, 48, 1, 48]
    - [49, 22.21]
  - - [4922, 58, 1, 66]
    - [52, 7.843]
  - - [14496, 32, 1, 32]
    - [77, 6.769]
  - - [19456, 30, 1, 36]
    - [87, 8.679]
  - - [17088, 64, 1, 64]
    - [89, 22.427]
  - - [15360, 48, 1, 48]
    - [182, 13.863]
  - - [16736, 32, 1, 32]
    - [72, 7.426]
  - - [11104, 32, 1, 32]
    - [8, 5.308]
  - - [20208, 48, 1, 48]
    - [14, 14.687]
  - - [2272, 32, 1, 32]
    - [115, 1.168]
  - - [33184, 32, 1, 32]
    - [38, 11.884]
  - - [24576, 128, 1, 128]
    - [183, 48.017]
  - - [15136, 32, 1, 32]
    - [8, 7.416]
  - - [39232, 64, 1, 64]
    - [102, 32.292]
  - - [37632, 124, 1, 132]
    - [164, 50.856]
  - - [23968, 32, 1, 32]
    - [153, 9.507]
  - - [32320, 64, 1, 64]
    - [149, 28.219]
  - - [9536, 64, 1, 64]
    - [88, 13.8]
  - - [6364, 30, 1, 36]
    - [5, 3.34]
  - - [8160, 32, 1, 32]
    - [16, 4.017]
  - - [19584, 48, 1, 48]
    - [182, 16.06]
  - - [28384, 32, 1, 32]
    - [134, 11.284]
  - - [17562, 30, 1, 36]
    - [61, 7.599]
  - - [30560, 32, 1, 32]
    - [167, 11.783]
  - - [6144, 124, 1, 132]
    - [184, 26.134]
  - - [42496, 30, 1, 36]
    - [53, 14.639]
  - - [14848, 58, 1, 66]
    - [77, 19.247]
  - - [19296, 96, 1, 96]
    - [25, 36.864]
  - - [33168, 48, 1, 48]
    - [9, 19.865]
  - - [22304, 32, 1, 32]
    - [153, 9.442]
  - - [27040, 32, 1, 32]
    - [116, 10.248]
  - - [35392, 64, 1, 64]
    - [185, 30.896]
  - - [3168, 32, 1, 32]
    - [9, 1.462]
  - - [11424, 96, 1, 96]
    - [53, 28.498]
  - - [8544, 96, 1, 96]
    - [31, 24.769]
  - - [37296, 48, 1, 48]
    - [154, 21.458]
  - - [37596, 30, 1, 36]
    - [119, 12.284]
  - - [702, 66, 1, 66]
    - [2, 1.321]
  - - [14270, 66, 1, 66]
    - [118, 17.284]
  - - [23640, 30, 1, 36]
    - [115, 8.198]
  - - [8880, 48, 1, 48]
    - [181, 8.409]
  - - [7834, 30, 1, 36]
    - [5, 3.967]
  - - [11584, 64, 1, 64]
    - [3, 16.786]
  - - [20700, 30, 1, 36]
    - [8, 9.498]
  - - [41856, 192, 1, 192]
    - [15, 64.509]
  - - [17184, 32, 1, 32]
    - [8, 7.447]
  - - [38144, 124, 1, 132]
    - [107, 47.233]
  - - [12800, 128, 1, 128]
    - [131, 39.789]
  - - [23392, 32, 1, 32]
    - [153, 9.778]
  - - [10240, 124, 1, 132]
    - [25, 35.137]
  - - [38240, 32, 1, 32]
    - [75, 13.32]
  - - [43776, 124, 1, 132]
    - [14, 51.1]
  - - [23184, 48, 1, 48]
    - [160, 15.593]
  - - [22784, 128, 1, 128]
    - [39, 49.56]
  - - [570, 58, 1, 66]
    - [2, 0.807]
  - - [41216, 58, 1, 66]
    - [9, 29.388]
  - - [30768, 48, 1, 48]
    - [128, 18.936]
  - - [24384, 64, 1, 64]
    - [162, 25.278]
  - - [19676, 30, 1, 36]
    - [81, 8.093]
  - - [3840, 66, 1, 66]
    - [8, 6.956]
  - - [8704, 66, 1, 66]
    - [89, 12.45]
  - - [20056, 30, 1, 36]
    - [8, 8.211]
  - - [3360, 32, 1, 32]
    - [38, 1.491]
  - - [8448, 66, 1, 66]
    - [8, 13.18]
  - - [33792, 124, 1, 132]
    - [186, 41.838]
  - - [25696, 32, 1, 32]
    - [81, 10.528]
  - - [29984, 32, 1, 32]
    - [75, 11.113]
  - - [40894, 66, 1, 66]
    - [22, 28.364]
  - - [42072, 30, 1, 36]
    - [22, 14.415]
  - - [22128, 48, 1, 48]
    - [187, 16.813]
  - - [18176, 66, 1, 66]
    - [10, 22.033]
  - - [7168, 58, 1, 66]
    - [153, 11.336]
  - - [2080, 32, 1, 32]
    - [169, 0.921]
  - - [37530, 30, 1, 36]
    - [38, 12.959]
  - - [17920, 66, 1, 66]
    - [49, 20.66]
  - - [33024, 48, 1, 48]
    - [10, 20.413]
  - - [3160, 30, 1, 36]
    - [99, 1.392]
  - - [17632, 32, 1, 32]
    - [8, 6.772]
  - - [14044, 30, 1, 36]
    - [181, 6.254]
  - - [24288, 32, 1, 32]
    - [108, 9.491]
  - - [7248, 48, 1, 48]
    - [72, 7.12]
  - - [38400, 30, 1, 36]
    - [141, 13.053]
  - - [12288, 124, 1, 132]
    - [12, 38.176]
  - - [36696, 30, 1, 36]
    - [38, 12.302]
  - - [40192, 30, 1, 36]
    - [188, 13.102]
  - - [39872, 64, 1, 64]
    - [146, 32.355]
  - - [41520, 48, 1, 48]
    - [3, 21.397]
  - - [15712, 32, 1, 32]
    - [99, 5.988]
  - - [22656, 48, 1, 48]
    - [9, 14.918]
  - - [9312, 96, 1, 96]
    - [8, 24.738]
  - - [2780, 30, 1, 36]
    - [99, 1.144]
  - - [33120, 32, 1, 32]
    - [74, 9.374]
  - - [20832, 96, 1, 96]
    - [48, 32.983]
  - - [8928, 96, 1, 96]
    - [81, 26.959]
  - - [24480, 32, 1, 32]
    - [8, 9.156]
  - - [4160, 64, 1, 64]
    - [5, 7.27]
  - - [10800, 48, 1, 48]
    - [8, 10.118]
  - - [33280, 30, 1, 36]
    - [70, 12.091]
  - - [25632, 32, 1, 32]
    - [8, 10.618]
  - - [36864, 48, 1, 48]
    - [12, 22.321]
  - - [26880, 192, 1, 192]
    - [78, 60.454]
  - - [22528, 128, 1, 128]
    - [9, 49.978]
  - - [22784, 58, 1, 66]
    - [54, 23.597]
  - - [37696, 64, 1, 64]
    - [189, 28.053]
  - - [18688, 66, 1, 66]
    - [54, 19.306]
  - - [19200, 192, 1, 192]
    - [6, 52.627]
  - - [5120, 30, 1, 36]
    - [56, 2.442]
  - - [13824, 128, 1, 128]
    - [19, 42.038]
  - - [26368, 58, 1, 66]
    - [190, 25.766]
  - - [19904, 64, 1, 64]
    - [9, 21.762]
  - - [39680, 124, 1, 132]
    - [107, 49.46]
  - - [9744, 48, 1, 48]
    - [8, 9.181]
  - - [31488, 66, 1, 66]
    - [53, 21.895]
  - - [31488, 128, 1, 128]
    - [39, 49.934]
  - - [17086, 66, 1, 66]
    - [70, 19.152]
  - - [32112, 48, 1, 48]
    - [3, 18.951]
  - - [512, 30, 1, 36]
    - [181, 0.222]
  - - [3642, 58, 1, 66]
    - [5, 5.983]
  - - [24028, 30, 1, 36]
    - [8, 8.083]
  - - [12192, 32, 1, 32]
    - [8, 5.345]
  - - [43740, 30, 1, 36]
    - [89, 12.548]
  - - [768, 58, 1, 66]
    - [115, 1.062]
  - - [14832, 48, 1, 48]
    - [8, 12.923]
  - - [19488, 32, 1, 32]
    - [8, 9.122]
  - - [384, 48, 1, 48]
    - [2, 0.436]
  - - [38810, 30, 1, 36]
    - [8, 11.562]
  - - [41088, 48, 1, 48]
    - [191, 20.471]
  - - [29024, 32, 1, 32]
    - [8, 11.468]
  - - [26400, 96, 1, 96]
    - [27, 40.277]
  - - [38298, 30, 1, 36]
    - [61, 11.52]
  - - [6208, 64, 1, 64]
    - [5, 11.131]
  - - [35898, 58, 1, 66]
    - [20, 26.829]
  - - [16348, 30, 1, 36]
    - [8, 6.873]
  - - [33312, 96, 1, 96]
    - [53, 40.123]
  - - [26332, 30, 1, 36]
    - [70, 10.706]
  - - [9692, 30, 1, 36]
    - [35, 3.396]
  - - [19456, 66, 1, 66]
    - [22, 21.124]
  - - [9168, 48, 1, 48]
    - [9, 8.471]
  - - [37120, 128, 1, 128]
    - [78, 44.744]
  - - [29712, 48, 1, 48]
    - [182, 18.265]
  - - [17920, 124, 1, 132]
    - [9, 45.577]
  - - [29568, 48, 1, 48]
    - [192, 20.707]
  - - [19712, 30, 1, 36]
    - [8, 8.879]
  - - [43520, 128, 1, 128]
    - [14, 53.383]
  - - [39168, 124, 1, 132]
    - [14, 47.786]
  - - [4960, 32, 1, 32]
    - [5, 2.659]
  - - [19136, 64, 1, 64]
    - [9, 22.03]
  - - [27968, 64, 1, 64]
    - [193, 24.581]
  - - [3928, 30, 1, 36]
    - [5, 2.143]
  - - [12734, 66, 1, 66]
    - [38, 16.642]
  - - [16448, 64, 1, 64]
    - [146, 19.941]
  - - [432, 48, 1, 48]
    - [16, 0.407]
  - - [10942, 66, 1, 66]
    - [112, 14.098]
  - - [37920, 32, 1, 32]
    - [87, 13.147]
  - - [32960, 64, 1, 64]
    - [14, 29.594]
  - - [3482, 30, 1, 36]
    - [21, 1.704]
  - - [37376, 124, 1, 132]
    - [78, 45.196]
  - - [37472, 32, 1, 32]
    - [54, 11.464]
  - - [12764, 30, 1, 36]
    - [3, 4.744]
  - - [30142, 66, 1, 66]
    - [194, 20.725]
  - - [26176, 64, 1, 64]
    - [131, 22.788]
  - - [24576, 30, 1, 36]
    - [8, 8.48]
  - - [42688, 64, 1, 64]
    - [14, 29.642]
  - - [20188, 30, 1, 36]
    - [8, 7.405]
  - - [42496, 128, 1, 128]
    - [143, 49.727]
  - - [11664, 48, 1, 48]
    - [144, 9.14]
  - - [31386, 30, 1, 36]
    - [8, 10.946]
  - - [27312, 48, 1, 48]
    - [182, 19.163]
  - - [42840, 30, 1, 36]
    - [8, 13.987]
  - - [24320, 30, 1, 36]
    - [8, 9.984]
  - - [21440, 64, 1, 64]
    - [9, 24.252]
  - - [3584, 66, 1, 66]
    - [8, 6.338]
  - - [25728, 96, 1, 96]
    - [17, 37.908]
  - - [672, 96, 1, 96]
    - [69, 2.412]
  - - [16640, 66, 1, 66]
    - [8, 18.145]
  - - [4800, 64, 1, 64]
    - [5, 7.039]
  - - [26814, 66, 1, 66]
    - [174, 20.71]
  - - [40346, 30, 1, 36]
    - [8, 12.95]
  - - [39644, 30, 1, 36]
    - [51, 13.964]
  - - [11322, 58, 1, 66]
    - [8, 15.558]
  - - [9882, 30, 1, 36]
    - [14, 4.014]
  - - [30624, 32, 1, 32]
    - [24, 9.892]
  - - [42686, 66, 1, 66]
    - [17, 24.175]
  - - [22896, 48, 1, 48]
    - [9, 16.396]
  - - [25728, 192, 1, 192]
    - [65, 58.22]
  - - [26368, 66, 1, 66]
    - [195, 21.545]
  - - [7936, 58, 1, 66]
    - [5, 9.585]
  - - [5536, 32, 1, 32]
    - [5, 2.771]
  - - [17760, 96, 1, 96]
    - [71, 34.316]
  - - [19232, 32, 1, 32]
    - [8, 8.88]
  - - [36096, 96, 1, 96]
    - [38, 42.637]
  - - [43066, 58, 1, 66]
    - [94, 25.853]
  - - [7000, 30, 1, 36]
    - [5, 3.641]
  - - [3648, 64, 1, 64]
    - [88, 7.021]
  - - [30240, 32, 1, 32]
    - [24, 12.293]
  - - [30720, 48, 1, 48]
    - [10, 17.166]
  - - [41274, 58, 1, 66]
    - [107, 26.459]
  - - [29184, 96, 1, 96]
    - [27, 42.25]
  - - [24896, 64, 1, 64]
    - [19, 26.314]
  - - [22236, 30, 1, 36]
    - [70, 8.332]
  - - [1792, 30, 1, 36]
    - [8, 0.752]
  - - [928, 32, 1, 32]
    - [54, 0.421]
  - - [11088, 48, 1, 48]
    - [179, 10.264]
  - - [43040, 32, 1, 32]
    - [8, 12.816]
  - - [41808, 48, 1, 48]
    - [12, 21.312]
  - - [32592, 48, 1, 48]
    - [57, 18.652]
  - - [36506, 30, 1, 36]
    - [8, 11.426]
  - - [3072, 128, 1, 128]
    - [5, 17.398]
  - - [41114, 30, 1, 36]
    - [8, 12.391]
  - - [19680, 32, 1, 32]
    - [8, 8.556]
  - - [4576, 32, 1, 32]
    - [72, 2.088]
  - - [11740, 30, 1, 36]
    - [151, 5.201]
  - - [39904, 32, 1, 32]
    - [75, 13.174]
  - - [40256, 64, 1, 64]
    - [14, 30.985]
  - - [6528, 48, 1, 48]
    - [179, 6.333]
  - - [32000, 124, 1, 132]
    - [196, 39.883]
  - - [32640, 96, 1, 96]
    - [154, 40.485]
  - - [5424, 48, 1, 48]
    - [5, 5.892]
  - - [20224, 66, 1, 66]
    - [49, 19.116]
  - - [24796, 30, 1, 36]
    - [8, 9.378]
  - - [23712, 96, 1, 96]
    - [145, 32.99]
  - - [14650, 58, 1, 66]
    - [8, 15.883]
  - - [21920, 32, 1, 32]
    - [8, 8.837]
  - - [13824, 192, 1, 192]
    - [197, 54.149]
  - - [2688, 192, 1, 192]
    - [8, 26.171]
  - - [768, 30, 1, 36]
    - [16, 0.379]
  - - [22016, 128, 1, 128]
    - [3, 49.912]
  - - [15104, 124, 1, 132]
    - [101, 44.2]
  - - [4368, 48, 1, 48]
    - [5, 3.644]
  - - [34800, 48, 1, 48]
    - [9, 17.899]
  - - [31642, 30, 1, 36]
    - [140, 8.969]
  - - [16128, 30, 1, 36]
    - [8, 6.138]
  - - [8506, 58, 1, 66]
    - [8, 11.504]
  - - [13984, 32, 1, 32]
    - [35, 6.235]
  - - [27360, 96, 1, 96]
    - [17, 36.158]
  - - [28032, 192, 1, 192]
    - [39, 60.248]
  - - [14784, 64, 1, 64]
    - [198, 20.384]
  - - [4832, 32, 1, 32]
    - [21, 2.397]
  - - [9456, 48, 1, 48]
    - [5, 7.291]
  - - [38016, 192, 1, 192]
    - [39, 62.757]
  - - [7008, 96, 1, 96]
    - [21, 21.735]
  - - [28800, 48, 1, 48]
    - [82, 18.09]
  - - [15168, 64, 1, 64]
    - [5, 20.961]
  - - [24832, 58, 1, 66]
    - [19, 21.939]
  - - [6976, 64, 1, 64]
    - [5, 11.903]
  - - [476, 30, 1, 36]
    - [115, 0.181]
  - - [18976, 32, 1, 32]
    - [8, 8.762]
  - - [38078, 66, 1, 66]
    - [17, 24.269]
  - - [28256, 32, 1, 32]
    - [199, 11.26]
  - - [32256, 128, 1, 128]
    - [128, 48.708]
  - - [22016, 124, 1, 132]
    - [146, 40.566]
  - - [29600, 32, 1, 32]
    - [8, 11.427]
  - - [7680, 124, 1, 132]
    - [8, 29.963]
  - - [19968, 48, 1, 48]
    - [200, 13.084]
  - - [29328, 48, 1, 48]
    - [201, 19.68]
  - - [31744, 128, 1, 128]
    - [39, 44.785]
  - - [19420, 30, 1, 36]
    - [8, 8.97]
  - - [608, 32, 1, 32]
    - [16, 0.266]
  - - [16896, 128, 1, 128]
    - [107, 41.834]
  - - [24096, 96, 1, 96]
    - [50, 33.995]
  - - [29904, 48, 1, 48]
    - [5, 18.314]
  - - [35036, 30, 1, 36]
    - [8, 10.991]
  - - [17152, 30, 1, 36]
    - [8, 6.994]
  - - [6334, 66, 1, 66]
    - [8, 11.035]
  - - [31200, 96, 1, 96]
    - [17, 36.634]
  - - [22704, 48, 1, 48]
    - [75, 15.979]
  - - [13344, 32, 1, 32]
    - [99, 4.96]
  - - [7322, 30, 1, 36]
    - [88, 3.554]
  - - [3456, 96, 1, 96]
    - [5, 10.441]
  - - [19968, 30, 1, 36]
    - [8, 7.243]
  - - [31968, 32, 1, 32]
    - [8, 10.949]
  - - [4096, 128, 1, 128]
    - [8, 21.437]
  - - [40848, 48, 1, 48]
    - [48, 22.633]
  - - [39066, 30, 1, 36]
    - [59, 12.6]
  - - [34176, 48, 1, 48]
    - [86, 17.241]
  - - [384, 192, 1, 192]
    - [148, 4.382]
  - - [31008, 32, 1, 32]
    - [89, 11.216]
  - - [36256, 32, 1, 32]
    - [54, 13.105]
  - - [15264, 32, 1, 32]
    - [153, 5.75]
  - - [12432, 48, 1, 48]
    - [8, 11.309]
  - - [40448, 66, 1, 66]
    - [17, 25.786]
  - - [23706, 30, 1, 36]
    - [81, 8.79]
  - - [14640, 48, 1, 48]
    - [5, 10.782]
  - - [1280, 66, 1, 66]
    - [158, 1.92]
  - - [14080, 66, 1, 66]
    - [117, 17.813]
  - - [800, 32, 1, 32]
    - [2, 0.412]
  - - [43824, 48, 1, 48]
    - [49, 22.881]
  - - [17408, 124, 1, 132]
    - [20, 42.258]
  - - [39648, 96, 1, 96]
    - [160, 39.936]
  - - [11376, 48, 1, 48]
    - [5, 9.005]
  - - [39424, 30, 1, 36]
    - [54, 12.94]
  - - [43200, 64, 1, 64]
    - [102, 34.055]
  - - [2560, 58, 1, 66]
    - [56, 3.857]
  - - [6048, 96, 1, 96]
    - [8, 20.322]
  - - [31776, 96, 1, 96]
    - [17, 39.287]
  - - [42624, 96, 1, 96]
    - [17, 42.055]
  - - [8792, 30, 1, 36]
    - [5, 4.294]
  - - [8128, 64, 1, 64]
    - [8, 13.12]
  - - [39936, 58, 1, 66]
    - [9, 25.566]
  - - [20160, 64, 1, 64]
    - [14, 23.847]
  - - [21468, 30, 1, 36]
    - [8, 7.785]
  - - [28416, 48, 1, 48]
    - [187, 17.496]
  - - [33856, 64, 1, 64]
    - [90, 30.118]
  - - [14928, 48, 1, 48]
    - [99, 10.984]
  - - [256, 124, 1, 132]
    - [5, 1.423]
  - - [44032, 128, 1, 128]
    - [3, 54.119]
  - - [37248, 96, 1, 96]
    - [17, 40.308]
  - - [21504, 96, 1, 96]
    - [17, 37.026]
  - - [6368, 32, 1, 32]
    - [16, 3.48]
  - - [2268, 30, 1, 36]
    - [35, 1.1]
  - - [21504, 48, 1, 48]
    - [9, 16.737]
  - - [15680, 64, 1, 64]
    - [82, 21.092]
  - - [14848, 128, 1, 128]
    - [3, 43.943]
  - - [6192, 48, 1, 48]
    - [5, 5.641]
  - - [16896, 30, 1, 36]
    - [8, 7.768]
  - - [28416, 66, 1, 66]
    - [21, 23.383]
  - - [35328, 192, 1, 192]
    - [94, 62.024]
  - - [8064, 48, 1, 48]
    - [75, 7.828]
  - - [24576, 96, 1, 96]
    - [40, 33.707]
  - - [17854, 66, 1, 66]
    - [76, 17.303]
  - - [34048, 124, 1, 132]
    - [146, 42.426]
  - - [14592, 192, 1, 192]
    - [112, 57.749]
  - - [15104, 128, 1, 128]
    - [14, 44.187]
  - - [14016, 64, 1, 64]
    - [8, 19.982]
  - - [24576, 48, 1, 48]
    - [81, 13.665]
  - - [4608, 30, 1, 36]
    - [2, 1.921]
  - - [6240, 32, 1, 32]
    - [16, 2.798]
  - - [17408, 66, 1, 66]
    - [54, 17.213]
  - - [23104, 64, 1, 64]
    - [105, 24.479]
  - - [23296, 124, 1, 132]
    - [9, 47.441]
  - - [17424, 48, 1, 48]
    - [187, 14.348]
  - - [28272, 48, 1, 48]
    - [182, 16.377]
  - - [37536, 32, 1, 32]
    - [87, 9.477]
  - - [15968, 32, 1, 32]
    - [2, 6.573]
  - - [14080, 30, 1, 36]
    - [50, 5.677]
  - - [25242, 30, 1, 36]
    - [8, 10.651]
  - - [3130, 58, 1, 66]
    - [2, 5.54]
  - - [28928, 124, 1, 132]
    - [14, 45.608]
  - - [9632, 32, 1, 32]
    - [31, 4.854]
  - - [44032, 30, 1, 36]
    - [40, 14.146]
  - - [17372, 30, 1, 36]
    - [8, 8.269]
  - - [8896, 64, 1, 64]
    - [8, 14.844]
  - - [44016, 48, 1, 48]
    - [3, 22.202]
  - - [20640, 32, 1, 32]
    - [8, 9.632]
  - - [40858, 30, 1, 36]
    - [8, 12.805]
  - - [27356, 30, 1, 36]
    - [8, 10.996]
  - - [41472, 128, 1, 128]
    - [50, 47.202]
  - - [25888, 32, 1, 32]
    - [8, 10.219]
  - - [22976, 64, 1, 64]
    - [37, 26.171]
  - - [36798, 66, 1, 66]
    - [82, 26.668]
  - - [5120, 58, 1, 66]
    - [0, 6.005]
  - - [21592, 30, 1, 36]
    - [93, 6.733]
  - - [22512, 48, 1, 48]
    - [9, 16.559]
  - - [22944, 96, 1, 96]
    - [160, 35.087]
  - - [31200, 32, 1, 32]
    - [3, 9.348]
  - - [8544, 32, 1, 32]
    - [2, 4.522]
  - - [9048, 30, 1, 36]
    - [8, 3.744]
  - - [10460, 30, 1, 36]
    - [9, 3.859]
  - - [16320, 64, 1, 64]
    - [146, 16.967]
  - - [16608, 32, 1, 32]
    - [8, 7.553]
  - - [36096, 124, 1, 132]
    - [78, 44.062]
  - - [7744, 64, 1, 64]
    - [8, 8.957]
  - - [31104, 192, 1, 192]
    - [202, 55.7]
  - - [20192, 32, 1, 32]
    - [81, 7.735]
  - - [27936, 32, 1, 32]
    - [8, 10.359]
  - - [4352, 124, 1, 132]
    - [8, 19.166]
  - - [41040, 48, 1, 48]
    - [95, 21.038]
  - - [25872, 48, 1, 48]
    - [19, 17.771]
  - - [39936, 128, 1, 128]
    - [40, 49.054]
  - - [4448, 32, 1, 32]
    - [5, 2.394]
  - - [37888, 30, 1, 36]
    - [116, 10.989]
  - - [17952, 32, 1, 32]
    - [8, 8.204]
  - - [43344, 48, 1, 48]
    - [9, 22.085]
  - - [36184, 30, 1, 36]
    - [59, 13.107]
  - - [31840, 32, 1, 32]
    - [95, 11.547]
  - - [9304, 30, 1, 36]
    - [1, 4.574]
  - - [4030, 66, 1, 66]
    - [8, 7.476]
  - - [38846, 66, 1, 66]
    - [22, 24.102]
  - - [20400, 48, 1, 48]
    - [84, 14.433]
  - - [12222, 66, 1, 66]
    - [54, 15.606]
  - - [16576, 64, 1, 64]
    - [112, 19.125]
  - - [9114, 30, 1, 36]
    - [177, 3.946]
  - - [448, 64, 1, 64]
    - [115, 0.639]
  - - [20992, 124, 1, 132]
    - [14, 45.762]
  - - [21088, 32, 1, 32]
    - [8, 7.2]
  - - [18688, 58, 1, 66]
    - [75, 19.968]
  - - [25052, 30, 1, 36]
    - [19, 9.126]
  - - [27392, 128, 1, 128]
    - [203, 46.217]
  - - [27504, 48, 1, 48]
    - [96, 18.525]
  - - [26304, 64, 1, 64]
    - [3, 26.49]
  - - [39388, 30, 1, 36]
    - [70, 11.197]
  - - [21856, 32, 1, 32]
    - [8, 8.191]
  - - [9600, 48, 1, 48]
    - [5, 9.417]
  - - [26112, 128, 1, 128]
    - [98, 48.256]
  - - [38656, 58, 1, 66]
    - [9, 28.208]
  - - [40000, 64, 1, 64]
    - [90, 31.998]
  - - [19344, 48, 1, 48]
    - [9, 14.248]
  - - [34944, 192, 1, 192]
    - [103, 61.071]
  - - [32688, 48, 1, 48]
    - [9, 17.61]
  - - [26456, 30, 1, 36]
    - [8, 10.536]
  - - [44252, 30, 1, 36]
    - [148, 13.1]
  - - [17408, 128, 1, 128]
    - [20, 45.905]
  - - [35232, 96, 1, 96]
    - [27, 38.241]
  - - [9216, 66, 1, 66]
    - [8, 14.632]
  - - [14496, 96, 1, 96]
    - [27, 32.683]
  - - [28064, 32, 1, 32]
    - [134, 8.563]
  - - [25600, 124, 1, 132]
    - [204, 42.485]
  - - [23260, 30, 1, 36]
    - [8, 9.098]
  - - [13626, 58, 1, 66]
    - [9, 17.693]
  - - [32702, 66, 1, 66]
    - [10, 23.251]
  - - [5018, 30, 1, 36]
    - [5, 2.012]
  - - [18176, 124, 1, 132]
    - [9, 45.196]
  - - [24432, 48, 1, 48]
    - [4, 14.458]
  - - [24218, 30, 1, 36]
    - [108, 7.774]
  - - [3328, 58, 1, 66]
    - [5, 5.604]
  - - [10272, 96, 1, 96]
    - [54, 21.879]
  - - [18272, 32, 1, 32]
    - [8, 8.094]
  - - [16864, 32, 1, 32]
    - [8, 5.37]
  - - [39168, 192, 1, 192]
    - [67, 63.43]
  - - [2392, 30, 1, 36]
    - [137, 1.229]
  - - [6912, 96, 1, 96]
    - [8, 18.675]
  - - [15360, 58, 1, 66]
    - [9, 19.779]
  - - [25344, 58, 1, 66]
    - [19, 24.502]
  - - [39936, 124, 1, 132]
    - [3, 48.337]
  - - [15360, 66, 1, 66]
    - [21, 19.343]
  - - [35774, 66, 1, 66]
    - [17, 23.593]
  - - [336, 48, 1, 48]
    - [144, 0.339]
  - - [34464, 96, 1, 96]
    - [145, 38.758]
  - - [25680, 48, 1, 48]
    - [160, 18.241]
  - - [30208, 124, 1, 132]
    - [9, 48.192]
  - - [38108, 30, 1, 36]
    - [8, 11.827]
  - - [29088, 96, 1, 96]
    - [27, 41.488]
  - - [6112, 32, 1, 32]
    - [21, 2.591]
  - - [11228, 30, 1, 36]
    - [73, 4.863]
  - - [39264, 32, 1, 32]
    - [8, 11.715]
  - - [43520, 124, 1, 132]
    - [3, 50.204]
  - - [33504, 96, 1, 96]
    - [27, 38.218]
  - - [20224, 124, 1, 132]
    - [78, 43.486]
  - - [13104, 48, 1, 48]
    - [9, 11.863]
  - - [1594, 58, 1, 66]
    - [8, 2.461]
  - - [34896, 48, 1, 48]
    - [9, 17.381]
  - - [5822, 66, 1, 66]
    - [8, 9.217]
  - - [4864, 128, 1, 128]
    - [8, 24.805]
  - - [21280, 32, 1, 32]
    - [81, 8.625]
  - - [26046, 66, 1, 66]
    - [59, 20.606]
  - - [38928, 48, 1, 48]
    - [9, 19.629]
  - - [33368, 30, 1, 36]
    - [162, 10.351]
  - - [21504, 192, 1, 192]
    - [94, 53.77]
  - - [23296, 128, 1, 128]
    - [22, 47.832]
  - - [22208, 64, 1, 64]
    - [74, 25.243]
  - - [38880, 32, 1, 32]
    - [87, 11.518]
  - - [6400, 30, 1, 36]
    - [5, 3.152]
  - - [5632, 128, 1, 128]
    - [5, 25.265]
  - - [24576, 58, 1, 66]
    - [161, 21.127]
  - - [18592, 32, 1, 32]
    - [8, 7.165]
  - - [12048, 48, 1, 48]
    - [5, 9.835]
  - - [30960, 48, 1, 48]
    - [9, 16.072]
  - - [43008, 30, 1, 36]
    - [8, 12.08]
  - - [14976, 96, 1, 96]
    - [21, 31.978]
  - - [29952, 58, 1, 66]
    - [19, 27.224]
  - - [12090, 58, 1, 66]
    - [49, 12.458]
  - - [2592, 96, 1, 96]
    - [5, 9.685]
  - - [28704, 32, 1, 32]
    - [8, 11.398]
  - - [19744, 32, 1, 32]
    - [132, 8.929]
  - - [24960, 48, 1, 48]
    - [46, 17.981]
  - - [30624, 96, 1, 96]
    - [205, 35.757]
  - - [3168, 96, 1, 96]
    - [3, 9.101]
  - - [23280, 48, 1, 48]
    - [19, 15.445]
  - - [1280, 128, 1, 128]
    - [8, 6.752]
  - - [38656, 66, 1, 66]
    - [82, 24.433]
  - - [41120, 32, 1, 32]
    - [24, 11.806]
  - - [8928, 32, 1, 32]
    - [181, 4.412]
  - - [1920, 48, 1, 48]
    - [115, 1.965]
  - - [39168, 48, 1, 48]
    - [9, 19.392]
  - - [31440, 48, 1, 48]
    - [14, 18.293]
  - - [44090, 58, 1, 66]
    - [8, 28.385]
  - - [4416, 64, 1, 64]
    - [5, 7.988]
  - - [8924, 30, 1, 36]
    - [8, 4.597]
  - - [19712, 66, 1, 66]
    - [48, 20.16]
  - - [40928, 32, 1, 32]
    - [194, 13.203]
  - - [4440, 30, 1, 36]
    - [144, 1.524]
  - - [15744, 48, 1, 48]
    - [117, 10.51]
  - - [21792, 96, 1, 96]
    - [10, 36.166]
  - - [11472, 48, 1, 48]
    - [5, 10.153]
  - - [22560, 32, 1, 32]
    - [31, 8.611]
  - - [29888, 64, 1, 64]
    - [105, 28.128]
  - - [31632, 48, 1, 48]
    - [8, 18.066]
  - - [42592, 32, 1, 32]
    - [8, 13.573]
  - - [15360, 128, 1, 128]
    - [19, 43.673]
  - - [9216, 96, 1, 96]
    - [31, 22.388]
  - - [15584, 32, 1, 32]
    - [8, 6.004]
  - - [32352, 96, 1, 96]
    - [17, 38.756]
  - - [14432, 32, 1, 32]
    - [8, 6.82]
  - - [10944, 64, 1, 64]
    - [8, 16.411]
  - - [35808, 32, 1, 32]
    - [54, 12.724]
  - - [30880, 32, 1, 32]
    - [8, 10.109]
  - - [7870, 66, 1, 66]
    - [8, 11.361]
  - - [25498, 30, 1, 36]
    - [81, 7.862]
  - - [41728, 128, 1, 128]
    - [206, 47.741]
  - - [32220, 30, 1, 36]
    - [85, 10.261]
  - - [32512, 124, 1, 132]
    - [62, 40.402]
  - - [24240, 48, 1, 48]
    - [54, 14.058]
  - - [37376, 30, 1, 36]
    - [99, 13.335]
  - - [10906, 30, 1, 36]
    - [8, 4.363]
  - - [12096, 64, 1, 64]
    - [9, 16.196]
  - - [19152, 48, 1, 48]
    - [3, 12.856]
  - - [7584, 96, 1, 96]
    - [8, 21.66]
  - - [43232, 32, 1, 32]
    - [8, 13.678]
  - - [43418, 30, 1, 36]
    - [116, 12.775]
  - - [11776, 128, 1, 128]
    - [86, 36.271]
  - - [21760, 66, 1, 66]
    - [207, 17.699]
  - - [7776, 96, 1, 96]
    - [8, 21.708]
  - - [43008, 124, 1, 132]
    - [14, 52.796]
  - - [30522, 58, 1, 66]
    - [8, 24.4]
  - - [7616, 64, 1, 64]
    - [8, 13.336]
  - - [36576, 96, 1, 96]
    - [208, 40.962]
  - - [13968, 48, 1, 48]
    - [9, 11.784]
  - - [32800, 32, 1, 32]
    - [107, 9.841]
  - - [15806, 66, 1, 66]
    - [22, 18.8]
  - - [29232, 48, 1, 48]
    - [19, 17.042]
  - - [8064, 192, 1, 192]
    - [74, 44.786]
  - - [6912, 66, 1, 66]
    - [8, 11.89]
  - - [1024, 66, 1, 66]
    - [2, 1.459]
  - - [27802, 30, 1, 36]
    - [51, 8.506]
  - - [2976, 96, 1, 96]
    - [5, 10.248]
  - - [30336, 192, 1, 192]
    - [17, 60.786]
  - - [16442, 58, 1, 66]
    - [162, 15.839]
  - - [16128, 96, 1, 96]
    - [8, 26.416]
  - - [37856, 32, 1, 32]
    - [81, 11.843]
  - - [24480, 96, 1, 96]
    - [8, 37.353]
  - - [22368, 32, 1, 32]
    - [2, 9.639]
  - - [16512, 96, 1, 96]
    - [160, 34.187]
  - - [22682, 30, 1, 36]
    - [8, 9.994]
  - - [41904, 48, 1, 48]
    - [160, 24.307]
  - - [29148, 30, 1, 36]
    - [8, 10.839]
  - - [33504, 32, 1, 32]
    - [24, 10.009]
  - - [37392, 48, 1, 48]
    - [160, 17.456]
  - - [26368, 124, 1, 132]
    - [3, 45.943]
  - - [624, 48, 1, 48]
    - [99, 0.624]
  - - [2048, 58, 1, 66]
    - [148, 2.669]
  - - [12832, 32, 1, 32]
    - [8, 5.728]
  - - [36288, 64, 1, 64]
    - [14, 30.785]
  - - [31488, 58, 1, 66]
    - [57, 22.311]
  - - [4320, 32, 1, 32]
    - [5, 2.279]
  - - [6232, 30, 1, 36]
    - [5, 2.99]
  - - [5568, 64, 1, 64]
    - [5, 9.613]
  - - [23552, 58, 1, 66]
    - [3, 20.258]
  - - [3776, 64, 1, 64]
    - [8, 6.335]
  - - [7296, 96, 1, 96]
    - [77, 23.149]
  - - [32512, 58, 1, 66]
    - [107, 22.501]
  - - [25504, 32, 1, 32]
    - [87, 10.33]
  - - [13056, 124, 1, 132]
    - [19, 38.798]
  - - [10320, 48, 1, 48]
    - [5, 9.408]
  - - [18110, 66, 1, 66]
    - [8, 18.964]
  - - [35006, 66, 1, 66]
    - [76, 23.294]
  - - [42464, 32, 1, 32]
    - [30, 11.151]
  - - [8704, 124, 1, 132]
    - [112, 32.024]
  - - [19680, 96, 1, 96]
    - [27, 32.213]
  - - [26496, 192, 1, 192]
    - [107, 60.317]
  - - [36096, 58, 1, 66]
    - [184, 27.679]
  - - [10720, 32, 1, 32]
    - [8, 4.065]
  - - [1760, 32, 1, 32]
    - [54, 0.704]
  - - [9948, 30, 1, 36]
    - [8, 5.027]
  - - [31712, 32, 1, 32]
    - [38, 11.159]
  - - [44288, 128, 1, 128]
    - [14, 53.879]
  - - [31708, 30, 1, 36]
    - [8, 9.699]
  - - [19258, 58, 1, 66]
    - [9, 22.166]
  - - [42460, 30, 1, 36]
    - [85, 12.315]
  - - [36928, 64, 1, 64]
    - [9, 31.462]
  - - [1584, 48, 1, 48]
    - [99, 1.53]
  - - [13056, 192, 1, 192]
    - [112, 50.555]
  - - [28570, 30, 1, 36]
    - [8, 11.064]
  - - [23520, 96, 1, 96]
    - [51, 36.935]
  - - [23040, 96, 1, 96]
    - [65, 38.682]
  - - [21050, 58, 1, 66]
    - [9, 22.537]
  - - [43808, 32, 1, 32]
    - [125, 13.273]
  - - [9984, 192, 1, 192]
    - [19, 53.214]
  - - [14304, 32, 1, 32]
    - [8, 6.488]
  - - [8192, 30, 1, 36]
    - [148, 4.245]
  - - [35136, 64, 1, 64]
    - [20, 31.456]
  - - [40668, 30, 1, 36]
    - [76, 13.818]
  - - [26912, 32, 1, 32]
    - [8, 8.95]
  - - [9952, 32, 1, 32]
    - [2, 5.216]
  - - [12816, 48, 1, 48]
    - [8, 11.104]
  - - [42336, 32, 1, 32]
    - [22, 11.78]
  - - [36720, 48, 1, 48]
    - [9, 19.688]
  - - [3072, 30, 1, 36]
    - [5, 1.457]
  - - [6714, 58, 1, 66]
    - [132, 10.576]
  - - [7072, 32, 1, 32]
    - [69, 3.816]
  - - [25088, 128, 1, 128]
    - [14, 47.188]
  - - [13056, 58, 1, 66]
    - [8, 17.924]
  - - [6592, 64, 1, 64]
    - [40, 10.91]
  - - [11520, 58, 1, 66]
    - [8, 16.719]
  - - [1920, 96, 1, 96]
    - [2, 7.481]
  - - [5616, 48, 1, 48]
    - [5, 6.021]
  - - [36410, 58, 1, 66]
    - [110, 25.314]
  - - [13920, 32, 1, 32]
    - [8, 6.776]
  - - [28192, 32, 1, 32]
    - [8, 10.192]
  - - [30720, 66, 1, 66]
    - [17, 22.995]
  - - [13376, 64, 1, 64]
    - [3, 19.405]
  - - [19584, 96, 1, 96]
    - [24, 35.923]
  - - [8288, 32, 1, 32]
    - [9, 3.573]
  - - [3808, 32, 1, 32]
    - [5, 1.927]
  - - [32856, 30, 1, 36]
    - [199, 12.561]
  - - [5888, 124, 1, 132]
    - [8, 26.816]
  - - [33280, 58, 1, 66]
    - [101, 28.156]
  - - [28176, 48, 1, 48]
    - [46, 16.666]
  - - [37728, 96, 1, 96]
    - [17, 38.082]
  - - [8832, 96, 1, 96]
    - [8, 25.155]
  - - [42204, 30, 1, 36]
    - [87, 13.555]
  - - [38784, 192, 1, 192]
    - [9, 64.261]
  - - [39132, 30, 1, 36]
    - [8, 12.968]
  - - [37632, 48, 1, 48]
    - [3, 20.202]
  - - [23776, 32, 1, 32]
    - [8, 9.805]
  - - [34392, 30, 1, 36]
    - [8, 11.87]
  - - [12128, 32, 1, 32]
    - [2, 6.098]
  - - [30778, 58, 1, 66]
    - [149, 26.427]
  - - [32958, 66, 1, 66]
    - [22, 24.17]
  - - [42768, 48, 1, 48]
    - [154, 24.451]
  - - [19800, 30, 1, 36]
    - [8, 7.533]
  - - [15456, 32, 1, 32]
    - [8, 7.127]
  - - [10584, 30, 1, 36]
    - [98, 5.012]
  - - [3518, 66, 1, 66]
    - [9, 5.229]
  - - [25088, 58, 1, 66]
    - [19, 24.531]
  - - [35904, 64, 1, 64]
    - [20, 32.188]
  - - [288, 96, 1, 96]
    - [16, 1.105]
  - - [15792, 48, 1, 48]
    - [54, 10.519]
  - - [3262, 66, 1, 66]
    - [2, 6.456]
  - - [40704, 66, 1, 66]
    - [25, 26.657]
  - - [40960, 66, 1, 66]
    - [53, 28.113]
  - - [6554, 30, 1, 36]
    - [199, 3.087]
  - - [25584, 48, 1, 48]
    - [54, 16.982]
  - - [13568, 124, 1, 132]
    - [9, 40.27]
  - - [26592, 32, 1, 32]
    - [8, 11.211]
  - - [21914, 30, 1, 36]
    - [8, 9.297]
  - - [35226, 30, 1, 36]
    - [74, 12.654]
  - - [15808, 64, 1, 64]
    - [62, 20.073]
  - - [5856, 32, 1, 32]
    - [58, 2.807]
  - - [32640, 192, 1, 192]
    - [3, 61.97]
  - - [14736, 48, 1, 48]
    - [77, 12.589]
  - - [40992, 32, 1, 32]
    - [30, 13.837]
  - - [25952, 32, 1, 32]
    - [8, 9.239]
  - - [7648, 32, 1, 32]
    - [21, 3.242]
  - - [31920, 48, 1, 48]
    - [8, 18.678]
  - - [38736, 48, 1, 48]
    - [25, 20.611]
  - - [35738, 30, 1, 36]
    - [74, 12.27]
  - - [17722, 58, 1, 66]
    - [75, 20.321]
  - - [6656, 66, 1, 66]
    - [8, 9.36]
  - - [32, 32, 1, 32]
    - [99, 0.015]
  - - [3072, 48, 1, 48]
    - [2, 3.203]
  - - [41728, 124, 1, 132]
    - [203, 51.266]
  - - [9216, 124, 1, 132]
    - [54, 31.624]
  - - [1120, 32, 1, 32]
    - [115, 0.483]
  - - [9018, 58, 1, 66]
    - [9, 11.076]
  - - [16896, 96, 1, 96]
    - [8, 32.002]
  - - [41696, 32, 1, 32]
    - [110, 10.577]
  - - [4250, 30, 1, 36]
    - [2, 2.108]
  - - [13680, 48, 1, 48]
    - [9, 11.912]
  - - [11008, 58, 1, 66]
    - [71, 14.426]
  - - [14240, 32, 1, 32]
    - [2, 6.237]
  - - [37584, 48, 1, 48]
    - [22, 20.054]
  - - [36320, 32, 1, 32]
    - [50, 10.607]
  - - [6144, 96, 1, 96]
    - [14, 18.545]
  - - [28218, 58, 1, 66]
    - [128, 24.689]
  - - [5976, 30, 1, 36]
    - [5, 2.983]
  - - [26064, 48, 1, 48]
    - [24, 14.884]
  - - [13056, 128, 1, 128]
    - [19, 37.146]
  - - [23072, 32, 1, 32]
    - [50, 9.19]
  - - [11616, 32, 1, 32]
    - [9, 5.176]
  - - [34560, 30, 1, 36]
    - [8, 12.025]
  - - [2400, 32, 1, 32]
    - [115, 1.258]
  - - [1472, 64, 1, 64]
    - [2, 2.676]
  - - [21248, 124, 1, 132]
    - [9, 47.42]
  - - [1872, 48, 1, 48]
    - [50, 1.86]
  - - [35386, 58, 1, 66]
    - [3, 27.132]
  - - [24912, 48, 1, 48]
    - [48, 18.093]
  - - [42816, 64, 1, 64]
    - [3, 33.72]
  - - [21724, 30, 1, 36]
    - [8, 9.723]
  - - [1920, 192, 1, 192]
    - [5, 20.829]
  - - [42784, 32, 1, 32]
    - [142, 12.817]
  - - [2304, 124, 1, 132]
    - [5, 11.155]
  - - [11744, 32, 1, 32]
    - [8, 5.165]
  - - [6620, 30, 1, 36]
    - [5, 2.645]
  - - [36864, 128, 1, 128]
    - [14, 45.834]
  - - [27450, 58, 1, 66]
    - [19, 23.873]
  - - [14976, 48, 1, 48]
    - [182, 13.18]
  - - [8496, 48, 1, 48]
    - [72, 8.743]
  - - [29152, 32, 1, 32]
    - [8, 10.569]
  - - [5120, 128, 1, 128]
    - [8, 26.636]
  - - [1056, 96, 1, 96]
    - [16, 3.078]
  - - [40762, 58, 1, 66]
    - [209, 26.443]
  - - [9662, 66, 1, 66]
    - [75, 13.417]
  - - [16984, 30, 1, 36]
    - [8, 7.958]
  - - [16896, 192, 1, 192]
    - [86, 45.968]
  - - [36864, 30, 1, 36]
    - [174, 11.249]
  - - [22496, 32, 1, 32]
    - [8, 8.48]
  - - [7936, 30, 1, 36]
    - [148, 4.107]
  - - [16092, 30, 1, 36]
    - [8, 6.705]
  - - [41984, 66, 1, 66]
    - [210, 27.202]
  - - [18144, 32, 1, 32]
    - [8, 8.169]
  - - [34048, 30, 1, 36]
    - [25, 11.163]
  - - [30808, 30, 1, 36]
    - [82, 11.588]
  - - [19728, 48, 1, 48]
    - [9, 15.634]
  - - [20512, 32, 1, 32]
    - [8, 9.013]
  - - [20976, 48, 1, 48]
    - [112, 14.884]
  - - [27488, 32, 1, 32]
    - [75, 10.882]
  - - [7482, 58, 1, 66]
    - [14, 10.802]
  - - [8864, 32, 1, 32]
    - [167, 4.456]
  - - [25568, 32, 1, 32]
    - [8, 8.424]
  - - [5664, 96, 1, 96]
    - [8, 15.671]
  - - [22336, 64, 1, 64]
    - [112, 25.708]
  - - [21248, 58, 1, 66]
    - [9, 23.767]
  - - [12528, 48, 1, 48]
    - [81, 11.361]
  - - [16062, 66, 1, 66]
    - [88, 17.383]
  - - [11616, 96, 1, 96]
    - [24, 27.886]
  - - [3744, 32, 1, 32]
    - [211, 1.748]
  - - [20736, 30, 1, 36]
    - [93, 8.543]
  - - [8416, 32, 1, 32]
    - [77, 3.182]
  - - [5952, 64, 1, 64]
    - [8, 8.568]
  - - [24544, 32, 1, 32]
    - [97, 7.926]
  - - [36608, 58, 1, 66]
    - [3, 29.017]
  - - [28672, 66, 1, 66]
    - [17, 21.457]
  - - [720, 48, 1, 48]
    - [2, 0.684]
  - - [21648, 48, 1, 48]
    - [212, 16.961]
  - - [26112, 124, 1, 132]
    - [14, 44.216]
  - - [14208, 192, 1, 192]
    - [94, 55.212]
  - - [35072, 58, 1, 66]
    - [14, 27.937]
  - - [7776, 32, 1, 32]
    - [32, 3.833]
  - - [36864, 192, 1, 192]
    - [47, 63.321]
  - - [10240, 58, 1, 66]
    - [8, 13.851]
  - - [23648, 32, 1, 32]
    - [8, 9.237]
  - - [13502, 66, 1, 66]
    - [21, 14.982]
  - - [42960, 48, 1, 48]
    - [86, 20.166]
  - - [13488, 48, 1, 48]
    - [5, 11.046]
  - - [31872, 192, 1, 192]
    - [3, 58.797]
  - - [38400, 58, 1, 66]
    - [3, 25.873]
  - - [10394, 30, 1, 36]
    - [2, 4.197]
  - - [12352, 64, 1, 64]
    - [3, 18.452]
  - - [41792, 64, 1, 64]
    - [3, 33.767]
  - - [37084, 30, 1, 36]
    - [30, 13.784]
  - - [22528, 66, 1, 66]
    - [12, 21.563]
  - - [10496, 58, 1, 66]
    - [8, 15.728]
  - - [38334, 66, 1, 66]
    - [17, 25.624]
  - - [40736, 32, 1, 32]
    - [3, 11.142]
  - - [11264, 128, 1, 128]
    - [146, 36.604]
  - - [27424, 32, 1, 32]
    - [71, 10.439]
  - - [31934, 66, 1, 66]
    - [14, 22.251]
  - - [27168, 96, 1, 96]
    - [27, 37.465]
  - - [28380, 30, 1, 36]
    - [8, 9.85]
  - - [37888, 66, 1, 66]
    - [53, 23.805]
  - - [23424, 96, 1, 96]
    - [150, 36.327]
  - - [9370, 30, 1, 36]
    - [5, 4.324]
  - - [25392, 48, 1, 48]
    - [19, 17.383]
  - - [21760, 30, 1, 36]
    - [8, 9.736]
  - - [4352, 66, 1, 66]
    - [8, 7.571]
  - - [14592, 66, 1, 66]
    - [74, 19.71]
  - - [36440, 30, 1, 36]
    - [54, 13.063]
  - - [7968, 32, 1, 32]
    - [16, 4.231]
  - - [35994, 30, 1, 36]
    - [116, 12.389]
  - - [40752, 48, 1, 48]
    - [48, 23.152]
  - - [17210, 58, 1, 66]
    - [24, 18.274]
  - - [21504, 128, 1, 128]
    - [14, 48.197]
  - - [17120, 32, 1, 32]
    - [8, 7.402]
  - - [38816, 32, 1, 32]
    - [70, 12.661]
  - - [14448, 48, 1, 48]
    - [9, 10.549]
  - - [34560, 66, 1, 66]
    - [21, 22.718]
  - - [1536, 58, 1, 66]
    - [2, 2.128]
  - - [4512, 96, 1, 96]
    - [81, 11.792]
  - - [41760, 32, 1, 32]
    - [51, 12.074]
  - - [28896, 96, 1, 96]
    - [27, 42.118]
  - - [20794, 58, 1, 66]
    - [9, 21.346]
  - - [34144, 32, 1, 32]
    - [119, 10.74]
  - - [7768, 30, 1, 36]
    - [8, 3.176]
  - - [21248, 128, 1, 128]
    - [9, 45.753]
  - - [40704, 192, 1, 192]
    - [15, 64.164]
  - - [33088, 64, 1, 64]
    - [20, 29.868]
  - - [15770, 30, 1, 36]
    - [8, 6.578]
  - - [39936, 66, 1, 66]
    - [116, 24.716]
  - - [15312, 48, 1, 48]
    - [9, 12.158]
  - - [5712, 48, 1, 48]
    - [132, 5.515]
  - - [18464, 32, 1, 32]
    - [8, 7.697]
  - - [3024, 48, 1, 48]
    - [99, 3.331]
  - - [19104, 32, 1, 32]
    - [8, 8.673]
  - - [37786, 30, 1, 36]
    - [10, 10.655]
  - - [19712, 58, 1, 66]
    - [9, 21.188]
  - - [31296, 64, 1, 64]
    - [107, 27.62]
  - - [5344, 32, 1, 32]
    - [5, 2.861]
  - - [37776, 48, 1, 48]
    - [48, 17.337]
  - - [1244, 30, 1, 36]
    - [69, 0.543]
  - - [33244, 30, 1, 36]
    - [190, 10.467]
  - - [19552, 32, 1, 32]
    - [8, 8.906]
  - - [40224, 32, 1, 32]
    - [140, 13.527]
  - - [2784, 32, 1, 32]
    - [8, 1.208]
  - - [21552, 48, 1, 48]
    - [10, 16.81]
  - - [42016, 32, 1, 32]
    - [8, 13.912]
  - - [32732, 30, 1, 36]
    - [86, 11.157]
  - - [37344, 32, 1, 32]
    - [8, 12.838]
  - - [33792, 192, 1, 192]
    - [60, 61.647]
  - - [31576, 30, 1, 36]
    - [54, 11.357]
  - - [22752, 96, 1, 96]
    - [86, 40.3]
  - - [22842, 58, 1, 66]
    - [9, 24.17]
  - - [5376, 192, 1, 192]
    - [24, 34.639]
  - - [41504, 32, 1, 32]
    - [99, 11.682]
  - - [3584, 30, 1, 36]
    - [16, 1.932]
  - - [26010, 30, 1, 36]
    - [8, 10.046]
  - - [42810, 58, 1, 66]
    - [74, 27.187]
  - - [27712, 64, 1, 64]
    - [9, 27.535]
  - - [20496, 48, 1, 48]
    - [9, 15.785]
  - - [32880, 48, 1, 48]
    - [12, 19.429]
  - - [23354, 58, 1, 66]
    - [19, 22.425]
  - - [10496, 30, 1, 36]
    - [8, 5.468]
  - - [39504, 48, 1, 48]
    - [46, 22.45]
  - - [38112, 32, 1, 32]
    - [144, 11.043]
  - - [37008, 48, 1, 48]
    - [10, 21.066]
  - - [14394, 58, 1, 66]
    - [168, 17.846]
  - - [4512, 32, 1, 32]
    - [5, 1.933]
  - - [30464, 128, 1, 128]
    - [14, 50.001]
  - - [41664, 64, 1, 64]
    - [107, 31.234]
  - - [992, 32, 1, 32]
    - [16, 0.539]
  - - [42672, 48, 1, 48]
    - [48, 23.706]
  - - [11776, 58, 1, 66]
    - [5, 13.097]
  - - [8448, 96, 1, 96]
    - [8, 24.015]
  - - [1008, 48, 1, 48]
    - [2, 0.965]
  - - [24254, 66, 1, 66]
    - [8, 20.204]
  - - [2912, 32, 1, 32]
    - [8, 1.404]
  - - [41816, 30, 1, 36]
    - [8, 11.721]
  - - [43228, 30, 1, 36]
    - [2, 13.418]
  - - [24128, 64, 1, 64]
    - [19, 24.51]
  - - [10816, 64, 1, 64]
    - [3, 15.449]
  - - [27168, 32, 1, 32]
    - [8, 9.631]
  - - [32736, 32, 1, 32]
    - [168, 9.759]
  - - [40960, 124, 1, 132]
    - [3, 46.829]
  - - [28058, 30, 1, 36]
    - [106, 10.41]
  - - [29184, 30, 1, 36]
    - [8, 10.638]
  - - [40704, 48, 1, 48]
    - [8, 19.946]
  - - [33624, 30, 1, 36]
    - [59, 11.879]
  - - [39408, 48, 1, 48]
    - [49, 22.187]
  - - [35160, 30, 1, 36]
    - [8, 12.08]
  - - [11520, 124, 1, 132]
    - [213, 32.1]
  - - [27392, 30, 1, 36]
    - [8, 10.674]
  - - [36624, 48, 1, 48]
    - [14, 20.524]
  - - [31392, 32, 1, 32]
    - [148, 11.515]
  - - [34304, 124, 1, 132]
    - [130, 48.159]
  - - [922, 30, 1, 36]
    - [69, 0.432]
  - - [31166, 66, 1, 66]
    - [82, 25.986]
  - - [18848, 32, 1, 32]
    - [8, 8.531]
  - - [3424, 32, 1, 32]
    - [3, 1.365]
  - - [43776, 66, 1, 66]
    - [49, 27.911]
  - - [9816, 30, 1, 36]
    - [99, 5.091]
  - - [7102, 66, 1, 66]
    - [8, 9.91]
  - - [35584, 58, 1, 66]
    - [9, 23.576]
  - - [864, 32, 1, 32]
    - [40, 0.4]
  - - [10686, 66, 1, 66]
    - [21, 14.292]
  - - [8090, 30, 1, 36]
    - [8, 4.176]
  - - [960, 64, 1, 64]
    - [9, 1.618]
  - - [20352, 48, 1, 48]
    - [59, 13.657]
  - - [42944, 64, 1, 64]
    - [14, 31.096]
  - - [14880, 96, 1, 96]
    - [27, 31.727]
  - - [3840, 128, 1, 128]
    - [5, 21.585]
  - - [43162, 30, 1, 36]
    - [8, 12.399]
  - - [36572, 30, 1, 36]
    - [40, 11.43]
  - - [13312, 66, 1, 66]
    - [21, 15.988]
  - - [96, 96, 1, 96]
    - [16, 0.379]
  - - [23456, 32, 1, 32]
    - [6, 7.653]
  - - [10128, 48, 1, 48]
    - [177, 8.532]
  - - [24608, 32, 1, 32]
    - [8, 10.099]
  - - [31152, 48, 1, 48]
    - [14, 16.925]
  - - [2688, 96, 1, 96]
    - [5, 10.061]
  - - [19354, 30, 1, 36]
    - [153, 8.057]
  - - [12288, 66, 1, 66]
    - [4, 16.161]
  - - [5280, 96, 1, 96]
    - [132, 17.109]
  - - [38448, 48, 1, 48]
    - [133, 21.081]
  - - [28032, 96, 1, 96]
    - [74, 40.421]
  - - [28416, 30, 1, 36]
    - [19, 9.953]
  - - [3898, 58, 1, 66]
    - [8, 6.741]
  - - [18336, 96, 1, 96]
    - [10, 30.513]
  - - [5530, 30, 1, 36]
    - [5, 2.623]
  - - [2928, 48, 1, 48]
    - [115, 2.725]
  - - [15392, 32, 1, 32]
    - [8, 7.176]
  - - [37566, 66, 1, 66]
    - [53, 25.617]
  - - [6400, 58, 1, 66]
    - [8, 10.146]
  - - [1184, 32, 1, 32]
    - [115, 0.598]
  - - [42576, 48, 1, 48]
    - [20, 20.842]
  - - [19264, 64, 1, 64]
    - [98, 23.971]
  - - [14944, 32, 1, 32]
    - [8, 5.749]
  - - [1368, 30, 1, 36]
    - [115, 0.67]
  - - [23128, 30, 1, 36]
    - [8, 9.213]
  - - [42174, 66, 1, 66]
    - [63, 26.742]
  - - [33344, 64, 1, 64]
    - [14, 26.862]
  - - [28636, 30, 1, 36]
    - [8, 11.434]
  - - [36352, 128, 1, 128]
    - [112, 45.22]
  - - [16672, 32, 1, 32]
    - [2, 8.085]
  - - [42496, 66, 1, 66]
    - [140, 27.897]
  - - [15696, 48, 1, 48]
    - [9, 12.464]
  - - [33984, 64, 1, 64]
    - [14, 28.766]
  - - [36432, 48, 1, 48]
    - [154, 21.059]
  - - [26432, 64, 1, 64]
    - [74, 28.304]
  - - [38876, 30, 1, 36]
    - [14, 11.195]
  - - [31968, 96, 1, 96]
    - [8, 41.147]
  - - [25760, 32, 1, 32]
    - [8, 9.93]
  - - [9184, 32, 1, 32]
    - [148, 4.67]
  - - [10204, 30, 1, 36]
    - [8, 4.949]
  - - [42000, 48, 1, 48]
    - [49, 23.262]
  - - [27034, 30, 1, 36]
    - [8, 10.841]
  - - [15648, 32, 1, 32]
    - [8, 7.855]
  - - [37216, 32, 1, 32]
    - [76, 12.151]
  - - [37632, 192, 1, 192]
    - [214, 61.341]
  - - [3888, 48, 1, 48]
    - [5, 4.385]
  - - [36608, 66, 1, 66]
    - [8, 25.751]
  - - [12768, 32, 1, 32]
    - [8, 5.369]
  - - [11520, 128, 1, 128]
    - [14, 39.885]
  - - [41952, 96, 1, 96]
    - [109, 41.801]
  - - [38304, 32, 1, 32]
    - [50, 13.919]
  - - [24576, 192, 1, 192]
    - [90, 55.756]
  - - [15840, 96, 1, 96]
    - [54, 28.075]
  - - [5376, 30, 1, 36]
    - [5, 2.538]
  - - [25600, 66, 1, 66]
    - [167, 22.284]
  - - [26112, 96, 1, 96]
    - [17, 37.031]
  - - [13246, 66, 1, 66]
    - [8, 14.843]
  - - [15120, 48, 1, 48]
    - [9, 12.036]
  - - [1536, 48, 1, 48]
    - [38, 1.452]
  - - [35568, 48, 1, 48]
    - [46, 18.905]
  - - [22360, 30, 1, 36]
    - [9, 9.067]
  - - [39424, 58, 1, 66]
    - [9, 29.505]
  - - [32736, 96, 1, 96]
    - [210, 34.51]
  - - [6970, 58, 1, 66]
    - [8, 11.015]
  - - [25152, 64, 1, 64]
    - [70, 25.665]
  - - [160, 32, 1, 32]
    - [5, 0.077]
  - - [20480, 58, 1, 66]
    - [140, 18.857]
  - - [34494, 66, 1, 66]
    - [59, 21.619]
  - - [28832, 32, 1, 32]
    - [150, 8.121]
  - - [22272, 124, 1, 132]
    - [170, 45.121]
  - - [35548, 30, 1, 36]
    - [134, 10.818]
  - - [37690, 58, 1, 66]
    - [9, 29.308]
  - - [32192, 64, 1, 64]
    - [20, 27.623]
  - - [29784, 30, 1, 36]
    - [8, 11.538]
  - - [14064, 48, 1, 48]
    - [117, 12.036]
  - - [34048, 128, 1, 128]
    - [79, 40.481]
  - - [11520, 48, 1, 48]
    - [8, 10.727]
  - - [19488, 96, 1, 96]
    - [54, 34.168]
  - - [16608, 96, 1, 96]
    - [54, 32.852]
  - - [40126, 66, 1, 66]
    - [21, 24.908]
  - - [3392, 64, 1, 64]
    - [132, 6.278]
  - - [3292, 30, 1, 36]
    - [70, 1.438]
  - - [35360, 32, 1, 32]
    - [207, 11.508]
  - - [36000, 32, 1, 32]
    - [8, 10.895]
  - - [44160, 96, 1, 96]
    - [210, 39.73]
  - - [20224, 58, 1, 66]
    - [168, 22.151]
  - - [28512, 32, 1, 32]
    - [8, 11.355]
  - - [27104, 32, 1, 32]
    - [52, 10.835]
  - - [17152, 124, 1, 132]
    - [215, 42.87]
  - - [8192, 124, 1, 132]
    - [24, 30.033]
  - - [14906, 58, 1, 66]
    - [8, 18.354]
  - - [23040, 48, 1, 48]
    - [51, 14.936]
  - - [17808, 48, 1, 48]
    - [200, 13.792]
  - - [9728, 124, 1, 132]
    - [62, 34.525]
  - - [27584, 64, 1, 64]
    - [18, 27.306]
  - - [36096, 48, 1, 48]
    - [49, 18.744]
  - - [16848, 48, 1, 48]
    - [24, 11.422]
  - - [2784, 96, 1, 96]
    - [8, 10.534]
  - - [43712, 64, 1, 64]
    - [113, 30.915]
  - - [43674, 30, 1, 36]
    - [8, 12.754]
  - - [19776, 64, 1, 64]
    - [14, 24.098]
  - - [21888, 192, 1, 192]
    - [189, 54.576]
  - - [2750, 66, 1, 66]
    - [8, 5.188]
  - - [23264, 32, 1, 32]
    - [8, 7.795]
  - - [34458, 30, 1, 36]
    - [54, 10.312]
  - - [2736, 48, 1, 48]
    - [132, 2.518]
  - - [36096, 128, 1, 128]
    - [172, 46.79]
  - - [32512, 66, 1, 66]
    - [59, 23.128]
  - - [1690, 30, 1, 36]
    - [2, 0.887]
  - - [12608, 64, 1, 64]
    - [3, 18.944]
  - - [25408, 64, 1, 64]
    - [54, 22.922]
  - - [32666, 30, 1, 36]
    - [24, 10.645]
  - - [39024, 48, 1, 48]
    - [3, 20.573]
  - - [21950, 66, 1, 66]
    - [48, 18.105]
  - - [17984, 64, 1, 64]
    - [30, 18.774]
  - - [26266, 30, 1, 36]
    - [51, 8.272]
  - - [34304, 128, 1, 128]
    - [78, 40.685]
  - - [17050, 30, 1, 36]
    - [8, 6.011]
  - - [40384, 64, 1, 64]
    - [14, 32.305]
  - - [17040, 48, 1, 48]
    - [62, 13.528]
  - - [42042, 58, 1, 66]
    - [94, 28.539]
  - - [26976, 96, 1, 96]
    - [33, 40.389]
  - - [30240, 96, 1, 96]
    - [17, 43.176]
  - - [25600, 128, 1, 128]
    - [3, 51.858]
  - - [5888, 66, 1, 66]
    - [81, 9.944]
  - - [5632, 66, 1, 66]
    - [62, 8.034]
  - - [20444, 30, 1, 36]
    - [8, 8.225]
  - - [13600, 32, 1, 32]
    - [75, 5.134]
  - - [37248, 48, 1, 48]
    - [3, 19.707]
  - - [24576, 66, 1, 66]
    - [27, 20.076]
  - - [41472, 96, 1, 96]
    - [133, 43.127]
  - - [43776, 192, 1, 192]
    - [112, 63.808]
  - - [22432, 32, 1, 32]
    - [122, 8.042]
  - - [15984, 48, 1, 48]
    - [112, 11.791]
  - - [23584, 32, 1, 32]
    - [24, 7.971]
  - - [9216, 58, 1, 66]
    - [5, 13.577]
  - - [6816, 96, 1, 96]
    - [8, 17.941]
  - - [21984, 96, 1, 96]
    - [216, 34.202]
  - - [23136, 32, 1, 32]
    - [99, 9.749]
  - - [20416, 64, 1, 64]
    - [3, 23.407]
  - - [37088, 32, 1, 32]
    - [61, 12.252]
  - - [13400, 30, 1, 36]
    - [217, 5.658]
  - - [14880, 32, 1, 32]
    - [2, 6.755]
  - - [36544, 64, 1, 64]
    - [14, 32.231]
  - - [16704, 64, 1, 64]
    - [146, 17.587]
  - - [1104, 48, 1, 48]
    - [2, 0.987]
  - - [4224, 192, 1, 192]
    - [8, 36.495]
  - - [15104, 58, 1, 66]
    - [9, 19.554]
  - - [13312, 124, 1, 132]
    - [6, 38.293]
  - - [2720, 32, 1, 32]
    - [9, 1.115]
  - - [1856, 64, 1, 64]
    - [153, 2.954]
  - - [34592, 32, 1, 32]
    - [75, 12.97]
  - - [14912, 64, 1, 64]
    - [44, 21.171]
  - - [768, 48, 1, 48]
    - [115, 0.623]
  - - [12032, 128, 1, 128]
    - [19, 36.611]
  - - [4828, 30, 1, 36]
    - [1, 2.074]
  - - [40280, 30, 1, 36]
    - [22, 13.712]
  - - [23840, 32, 1, 32]
    - [72, 8.142]
  - - [4544, 64, 1, 64]
    - [5, 8.174]
  - - [26302, 66, 1, 66]
    - [22, 22.987]
  - - [39984, 48, 1, 48]
    - [145, 20.698]
  - - [4656, 48, 1, 48]
    - [5, 4.819]
  - - [34304, 58, 1, 66]
    - [78, 26.951]
  - - [36096, 192, 1, 192]
    - [67, 62.144]
  - - [22784, 66, 1, 66]
    - [46, 22.45]
  - - [19872, 96, 1, 96]
    - [17, 32.05]
  - - [988, 30, 1, 36]
    - [99, 0.463]
  - - [25120, 32, 1, 32]
    - [88, 9.951]
  - - [30400, 64, 1, 64]
    - [19, 27.882]
  - - [7168, 30, 1, 36]
    - [8, 3.89]
  - - [42720, 32, 1, 32]
    - [148, 13.49]
  - - [3600, 48, 1, 48]
    - [8, 3.708]
  - - [29184, 58, 1, 66]
    - [19, 25.147]
  - - [3264, 64, 1, 64]
    - [5, 4.307]
  - - [16752, 48, 1, 48]
    - [54, 12.377]
  - - [40176, 48, 1, 48]
    - [20, 20.39]
  - - [30552, 30, 1, 36]
    - [74, 11.663]
  - - [30428, 30, 1, 36]
    - [8, 11.791]
  - - [9728, 30, 1, 36]
    - [75, 4.839]
  - - [43484, 30, 1, 36]
    - [190, 13.328]
  - - [21728, 32, 1, 32]
    - [134, 9.153]
  - - [5690, 58, 1, 66]
    - [16, 7.849]
  - - [6048, 32, 1, 32]
    - [5, 3.039]
  - - [28672, 58, 1, 66]
    - [153, 23.814]
  - - [30910, 66, 1, 66]
    - [59, 21.945]
  - - [40080, 48, 1, 48]
    - [78, 20.752]
  - - [17752, 30, 1, 36]
    - [8, 8.327]
  - - [25344, 48, 1, 48]
    - [12, 18.718]
  - - [5888, 58, 1, 66]
    - [5, 9.601]
  - - [37976, 30, 1, 36]
    - [199, 13.845]
  - - [8688, 48, 1, 48]
    - [8, 8.827]
  - - [36352, 58, 1, 66]
    - [172, 28.638]
  - - [12000, 96, 1, 96]
    - [76, 25.486]
  - - [33434, 30, 1, 36]
    - [75, 11.73]
  - - [26076, 30, 1, 36]
    - [8, 10.935]
  - - [30208, 66, 1, 66]
    - [17, 25.19]
  - - [36286, 66, 1, 66]
    - [31, 25.462]
  - - [35296, 32, 1, 32]
    - [24, 12.578]
  - - [64, 64, 1, 64]
    - [2, 0.108]
  - - [17152, 128, 1, 128]
    - [101, 45.076]
  - - [27904, 66, 1, 66]
    - [17, 22.27]
  - - [24576, 124, 1, 132]
    - [3, 46.766]
  - - [41056, 32, 1, 32]
    - [119, 13.937]
  - - [36576, 32, 1, 32]
    - [54, 13.414]
  - - [24064, 128, 1, 128]
    - [218, 44.885]
  - - [8960, 124, 1, 132]
    - [87, 34.389]
  - - [5312, 64, 1, 64]
    - [132, 9.596]
  - - [26640, 48, 1, 48]
    - [19, 17.959]
  - - [41824, 32, 1, 32]
    - [87, 12.991]
  - - [25088, 66, 1, 66]
    - [27, 21.374]
  - - [26880, 30, 1, 36]
    - [14, 9.136]
  - - [4224, 48, 1, 48]
    - [71, 4.428]
  - - [40192, 124, 1, 132]
    - [78, 50.103]
  - - [21504, 124, 1, 132]
    - [9, 48.371]
  - - [44112, 48, 1, 48]
    - [138, 19.553]
  - - [4952, 30, 1, 36]
    - [5, 2.388]
  - - [6590, 66, 1, 66]
    - [106, 11.134]
  - - [19200, 48, 1, 48]
    - [81, 11.786]
  - - [20384, 32, 1, 32]
    - [8, 8.887]
  - - [18864, 48, 1, 48]
    - [9, 13.509]
  - - [11966, 66, 1, 66]
    - [99, 15.029]
  - - [13722, 30, 1, 36]
    - [8, 6.267]
  - - [11520, 96, 1, 96]
    - [54, 25.407]
  - - [27480, 30, 1, 36]
    - [88, 10.475]
  - - [32608, 32, 1, 32]
    - [124, 11.604]
  - - [15872, 66, 1, 66]
    - [46, 18.885]
  - - [26560, 64, 1, 64]
    - [6, 24.863]
  - - [20256, 96, 1, 96]
    - [8, 37.498]
  - - [7424, 128, 1, 128]
    - [40, 30.348]
  - - [35680, 32, 1, 32]
    - [99, 12.775]
  - - [29952, 66, 1, 66]
    - [205, 22.618]
  - - [25344, 96, 1, 96]
    - [27, 38.27]
  - - [20448, 96, 1, 96]
    - [17, 35.452]
  - - [22816, 32, 1, 32]
    - [56, 9.012]
  - - [14336, 30, 1, 36]
    - [99, 6.623]
  - - [5520, 48, 1, 48]
    - [21, 5.557]
  - - [36528, 48, 1, 48]
    - [25, 19.485]
  - - [13824, 66, 1, 66]
    - [30, 17.168]
  - - [41216, 124, 1, 132]
    - [3, 50.259]
  - - [7200, 32, 1, 32]
    - [8, 3.535]
  - - [33888, 32, 1, 32]
    - [119, 12.049]
  - - [8250, 58, 1, 66]
    - [8, 12.397]
  - - [38176, 32, 1, 32]
    - [8, 10.744]
  - - [2714, 30, 1, 36]
    - [14, 1.045]
  - - [16512, 48, 1, 48]
    - [150, 14.157]
  - - [5376, 128, 1, 128]
    - [8, 27.292]
  - - [9984, 58, 1, 66]
    - [52, 14.966]
  - - [10656, 32, 1, 32]
    - [8, 5.362]
  - - [39968, 32, 1, 32]
    - [99, 11.047]
  - - [24832, 30, 1, 36]
    - [8, 9.797]
  - - [29472, 96, 1, 96]
    - [17, 37.436]
  - - [41280, 64, 1, 64]
    - [209, 28.561]
  - - [856, 30, 1, 36]
    - [2, 0.429]
  - - [8384, 64, 1, 64]
    - [8, 14.326]
  - - [31744, 58, 1, 66]
    - [8, 23.628]
  - - [19968, 128, 1, 128]
    - [20, 45.211]
  - - [42584, 30, 1, 36]
    - [99, 14.038]
  - - [34240, 64, 1, 64]
    - [20, 29.622]
  - - [39888, 48, 1, 48]
    - [12, 23.154]
  - - [4944, 48, 1, 48]
    - [8, 4.328]
  - - [256, 128, 1, 128]
    - [16, 1.691]
  - - [17600, 64, 1, 64]
    - [75, 22.125]
  - - [17888, 32, 1, 32]
    - [8, 7.973]
  - - [29520, 48, 1, 48]
    - [19, 18.314]
  - - [41856, 48, 1, 48]
    - [20, 22.394]
  - - [38016, 48, 1, 48]
    - [49, 21.469]
  - - [14752, 32, 1, 32]
    - [8, 6.95]
  - - [6624, 32, 1, 32]
    - [5, 3.314]
  - - [5596, 30, 1, 36]
    - [58, 2.892]
  - - [31424, 64, 1, 64]
    - [185, 28.754]
  - - [15704, 30, 1, 36]
    - [71, 7.419]
  - - [32922, 30, 1, 36]
    - [116, 12.121]
  - - [6656, 128, 1, 128]
    - [9, 29.76]
  - - [27360, 32, 1, 32]
    - [81, 8.735]
  - - [23856, 48, 1, 48]
    - [19, 17.046]
  - - [30362, 30, 1, 36]
    - [81, 10.903]
  - - [9728, 58, 1, 66]
    - [8, 14.587]
  - - [22206, 66, 1, 66]
    - [8, 21.113]
  - - [32640, 48, 1, 48]
    - [46, 20.072]
  - - [28160, 66, 1, 66]
    - [35, 22.136]
  - - [4704, 96, 1, 96]
    - [8, 14.618]
  - - [37872, 48, 1, 48]
    - [150, 17.561]
  - - [7680, 192, 1, 192]
    - [21, 48.135]
  - - [17466, 58, 1, 66]
    - [9, 19.778]
  - - [2816, 30, 1, 36]
    - [69, 1.336]
  - - [42976, 32, 1, 32]
    - [99, 11.768]
  - - [34618, 58, 1, 66]
    - [14, 25.417]
  - - [20320, 32, 1, 32]
    - [8, 9.159]
  - - [39680, 66, 1, 66]
    - [63, 27.535]
  - - [31064, 30, 1, 36]
    - [8, 10.294]
  - - [31728, 48, 1, 48]
    - [25, 19.881]
  - - [38554, 30, 1, 36]
    - [8, 12.247]
  - - [10554, 58, 1, 66]
    - [8, 15.281]
  - - [7200, 96, 1, 96]
    - [8, 22.199]
  - - [18048, 192, 1, 192]
    - [219, 49.512]
  - - [26976, 32, 1, 32]
    - [8, 11.139]
  - - [704, 64, 1, 64]
    - [0, 1.139]
  - - [33536, 66, 1, 66]
    - [17, 21.317]
  - - [22848, 64, 1, 64]
    - [9, 22.744]
  - - [3312, 48, 1, 48]
    - [16, 3.698]
  - - [42240, 96, 1, 96]
    - [17, 42.331]
  - - [4608, 48, 1, 48]
    - [8, 5.137]
  - - [41376, 32, 1, 32]
    - [8, 13.493]
  - - [8192, 128, 1, 128]
    - [59, 31.228]
  - - [38304, 96, 1, 96]
    - [33, 41.406]
  - - [15936, 64, 1, 64]
    - [146, 20.212]
  - - [832, 64, 1, 64]
    - [75, 1.173]
  - - [13788, 30, 1, 36]
    - [8, 5.102]
  - - [20640, 96, 1, 96]
    - [17, 34.272]
  - - [40320, 192, 1, 192]
    - [152, 62.426]
  - - [26624, 66, 1, 66]
    - [27, 23.121]
  - - [29660, 30, 1, 36]
    - [8, 12.139]
  - - [34524, 30, 1, 36]
    - [3, 9.81]
  - - [24540, 30, 1, 36]
    - [71, 10.117]
  - - [26832, 48, 1, 48]
    - [220, 17.565]
  - - [36480, 48, 1, 48]
    - [10, 20.215]
  - - [1536, 124, 1, 132]
    - [8, 7.624]
  - - [17884, 30, 1, 36]
    - [8, 8.267]
  - - [26256, 48, 1, 48]
    - [19, 17.881]
  - - [40656, 48, 1, 48]
    - [9, 18.971]
  - - [26368, 128, 1, 128]
    - [189, 49.486]
  - - [27904, 30, 1, 36]
    - [8, 11.958]
  - - [15674, 58, 1, 66]
    - [9, 16.126]
  - - [11200, 64, 1, 64]
    - [134, 17.767]
  - - [13920, 96, 1, 96]
    - [21, 27.119]
  - - [10848, 32, 1, 32]
    - [8, 5.591]
  - - [38970, 58, 1, 66]
    - [132, 26.04]
  - - [23552, 124, 1, 132]
    - [20, 44.225]
  - - [190, 66, 1, 66]
    - [2, 0.327]
  - - [16560, 48, 1, 48]
    - [12, 11.484]
  - - [19712, 128, 1, 128]
    - [20, 45.734]
  - - [37968, 48, 1, 48]
    - [9, 21.322]
  - - [1178, 30, 1, 36]
    - [5, 0.525]
  - - [8768, 64, 1, 64]
    - [8, 14.502]
  - - [38560, 32, 1, 32]
    - [8, 12.554]
  - - [43264, 58, 1, 66]
    - [61, 25.526]
  - - [41728, 58, 1, 66]
    - [9, 28.518]
  - - [9600, 96, 1, 96]
    - [81, 27.682]
  - - [14336, 128, 1, 128]
    - [221, 40.833]
  - - [38144, 66, 1, 66]
    - [8, 26.52]
  - - [2016, 32, 1, 32]
    - [9, 0.912]
  - - [30976, 30, 1, 36]
    - [8, 10.65]
  - - [6288, 48, 1, 48]
    - [5, 7.04]
  - - [6400, 128, 1, 128]
    - [9, 29.945]
  - - [36144, 48, 1, 48]
    - [14, 20.22]
  - - [19920, 48, 1, 48]
    - [9, 15.935]
  - - [18264, 30, 1, 36]
    - [8, 8.1]
  - - [11520, 66, 1, 66]
    - [87, 16.386]
  - - [11008, 66, 1, 66]
    - [35, 16.276]
  - - [42384, 48, 1, 48]
    - [9, 23.036]
  - - [31130, 30, 1, 36]
    - [222, 10.377]
  - - [1440, 96, 1, 96]
    - [8, 4.494]
  - - [31744, 30, 1, 36]
    - [99, 12.027]
  - - [29760, 64, 1, 64]
    - [19, 25.252]
  - - [9312, 32, 1, 32]
    - [159, 4.071]
  - - [29184, 128, 1, 128]
    - [102, 53.429]
  - - [42912, 96, 1, 96]
    - [174, 40.316]
  - - [15514, 30, 1, 36]
    - [8, 6.324]
  - - [42752, 124, 1, 132]
    - [14, 52.547]
  - - [5232, 48, 1, 48]
    - [5, 5.865]
  - - [12800, 58, 1, 66]
    - [8, 17.529]
  - - [6432, 32, 1, 32]
    - [5, 2.863]
  - - [40096, 32, 1, 32]
    - [131, 11.261]
  - - [20704, 32, 1, 32]
    - [106, 8.575]
  - - [10840, 30, 1, 36]
    - [8, 4.986]
  - - [12288, 96, 1, 96]
    - [99, 29.642]
  - - [21438, 66, 1, 66]
    - [8, 20.43]
  - - [21024, 96, 1, 96]
    - [10, 37.396]
  - - [42752, 30, 1, 36]
    - [40, 14.279]
  - - [42432, 64, 1, 64]
    - [3, 33.128]
  - - [22528, 124, 1, 132]
    - [14, 47.444]
  - - [22272, 30, 1, 36]
    - [52, 9.557]
  - - [8784, 48, 1, 48]
    - [5, 6.615]
  - - [22016, 30, 1, 36]
    - [181, 7.79]
  - - [31584, 96, 1, 96]
    - [142, 39.416]
  - - [1280, 124, 1, 132]
    - [148, 6.358]
  - - [20312, 30, 1, 36]
    - [88, 7.183]
  - - [27962, 58, 1, 66]
    - [19, 20.751]
  - - [22944, 32, 1, 32]
    - [8, 8.147]
  - - [22104, 30, 1, 36]
    - [16, 7.244]
  - - [224, 32, 1, 32]
    - [16, 0.119]
  - - [4316, 30, 1, 36]
    - [5, 2.403]
  - - [35642, 58, 1, 66]
    - [9, 27.03]
  - - [35552, 32, 1, 32]
    - [51, 13.002]
  - - [48, 48, 1, 48]
    - [5, 0.046]
  - - [32000, 128, 1, 128]
    - [203, 51.255]
  - - [17920, 58, 1, 66]
    - [51, 21.71]
  - - [32256, 192, 1, 192]
    - [3, 60.571]
  - - [28730, 58, 1, 66]
    - [19, 24.996]
  - - [6144, 128, 1, 128]
    - [3, 25.835]
  - - [20736, 58, 1, 66]
    - [6, 17.092]
  - - [8448, 192, 1, 192]
    - [19, 42.968]
  - - [25658, 58, 1, 66]
    - [19, 23.93]
  - - [6656, 30, 1, 36]
    - [5, 2.729]
  - - [36608, 30, 1, 36]
    - [8, 12.773]
  - - [43296, 32, 1, 32]
    - [95, 9.301]
  - - [3520, 64, 1, 64]
    - [2, 3.753]
  - - [26336, 32, 1, 32]
    - [122, 8.0]
  - - [24992, 32, 1, 32]
    - [61, 8.17]
  - - [11280, 48, 1, 48]
    - [85, 10.53]
  - - [2304, 128, 1, 128]
    - [8, 11.662]
  - - [15104, 66, 1, 66]
    - [21, 16.267]
  - - [25200, 48, 1, 48]
    - [10, 15.476]
  - - [27552, 96, 1, 96]
    - [84, 39.789]
  - - [22224, 48, 1, 48]
    - [9, 16.791]
  - - [31964, 30, 1, 36]
    - [8, 11.28]
  - - [11008, 30, 1, 36]
    - [5, 5.177]
  - - [20256, 32, 1, 32]
    - [54, 7.479]
  - - [24730, 30, 1, 36]
    - [8, 10.603]
  - - [13370, 58, 1, 66]
    - [8, 17.995]
  - - [22992, 48, 1, 48]
    - [46, 16.414]
  - - [3488, 32, 1, 32]
    - [5, 1.785]
  - - [27792, 48, 1, 48]
    - [19, 16.687]
  - - [17568, 96, 1, 96]
    - [8, 32.645]
  - - [33760, 32, 1, 32]
    - [8, 11.402]
  - - [31392, 96, 1, 96]
    - [17, 35.84]
  - - [37632, 58, 1, 66]
    - [3, 27.925]
  - - [14336, 58, 1, 66]
    - [75, 18.291]
  - - [16368, 48, 1, 48]
    - [9, 13.429]
  - - [13440, 192, 1, 192]
    - [133, 48.563]
  - - [19968, 58, 1, 66]
    - [9, 18.836]
  - - [2016, 96, 1, 96]
    - [129, 7.173]
  - - [44064, 96, 1, 96]
    - [7, 43.581]
  - - [19040, 32, 1, 32]
    - [8, 7.462]
  - - [18784, 32, 1, 32]
    - [8, 6.958]
  - - [19902, 66, 1, 66]
    - [48, 20.77]
  - - [21980, 30, 1, 36]
    - [8, 8.322]
  - - [1600, 64, 1, 64]
    - [2, 2.926]
  - - [768, 128, 1, 128]
    - [77, 4.316]
  - - [19514, 58, 1, 66]
    - [9, 21.857]
  - - [30048, 96, 1, 96]
    - [118, 42.376]
  - - [33952, 32, 1, 32]
    - [99, 12.514]
  - - [41436, 30, 1, 36]
    - [8, 12.562]
  - - [23486, 66, 1, 66]
    - [8, 21.184]
  - - [14592, 124, 1, 132]
    - [3, 40.327]
  - - [22176, 96, 1, 96]
    - [12, 40.66]
  - - [22800, 48, 1, 48]
    - [9, 16.37]
  - - [34400, 32, 1, 32]
    - [3, 10.115]
  - - [19392, 64, 1, 64]
    - [123, 22.79]
  - - [42240, 192, 1, 192]
    - [28, 65.924]
  - - [34048, 66, 1, 66]
    - [59, 26.035]
  - - [6496, 32, 1, 32]
    - [58, 3.093]
  - - [2752, 64, 1, 64]
    - [5, 4.889]
  - - [33120, 96, 1, 96]
    - [7, 37.194]
  - - [30172, 30, 1, 36]
    - [8, 11.116]
  - - [31744, 124, 1, 132]
    - [143, 38.238]
  - - [10752, 128, 1, 128]
    - [146, 37.478]
  - - [10328, 30, 1, 36]
    - [8, 4.812]
  - - [6078, 66, 1, 66]
    - [77, 10.931]
  - - [16832, 64, 1, 64]
    - [146, 20.709]
  - - [36542, 66, 1, 66]
    - [53, 23.15]
  - - [24320, 124, 1, 132]
    - [189, 44.957]
  - - [14256, 48, 1, 48]
    - [8, 12.866]
  - - [9150, 66, 1, 66]
    - [8, 14.096]
  - - [21536, 32, 1, 32]
    - [14, 8.045]
  - - [2970, 30, 1, 36]
    - [144, 1.1]
  - - [25856, 66, 1, 66]
    - [84, 19.701]
  - - [32160, 96, 1, 96]
    - [63, 40.418]
  - - [9792, 64, 1, 64]
    - [81, 15.185]
  - - [41952, 32, 1, 32]
    - [83, 13.259]
  - - [13568, 66, 1, 66]
    - [21, 14.432]
  - - [26496, 48, 1, 48]
    - [54, 15.17]
  - - [29856, 32, 1, 32]
    - [72, 11.727]
  - - [22330, 58, 1, 66]
    - [104, 23.09]
  - - [26144, 32, 1, 32]
    - [8, 10.759]
  - - [19808, 32, 1, 32]
    - [8, 7.843]
  - - [13200, 48, 1, 48]
    - [14, 10.739]
  - - [36352, 30, 1, 36]
    - [38, 14.155]
  - - [40608, 96, 1, 96]
    - [63, 43.008]
  - - [29616, 48, 1, 48]
    - [200, 19.127]
  - - [19968, 124, 1, 132]
    - [62, 41.765]
  - - [29952, 30, 1, 36]
    - [8, 11.952]
  - - [32544, 32, 1, 32]
    - [3, 10.412]
  - - [5056, 64, 1, 64]
    - [8, 7.431]
  - - [11264, 66, 1, 66]
    - [54, 13.739]
  - - [6688, 32, 1, 32]
    - [5, 3.253]
  - - [34648, 30, 1, 36]
    - [8, 11.838]
  - - [42528, 96, 1, 96]
    - [17, 41.289]
  - - [2362, 58, 1, 66]
    - [199, 3.145]
  - - [10138, 30, 1, 36]
    - [5, 4.689]
  - - [15162, 58, 1, 66]
    - [9, 19.715]
  - - [15836, 30, 1, 36]
    - [73, 5.948]
  - - [39312, 48, 1, 48]
    - [20, 20.481]
  - - [9984, 66, 1, 66]
    - [81, 15.289]
  - - [34560, 96, 1, 96]
    - [165, 38.916]
  - - [13568, 58, 1, 66]
    - [9, 18.434]
  - - [7840, 32, 1, 32]
    - [134, 3.911]
  - - [2848, 32, 1, 32]
    - [99, 1.039]
  - - [32190, 66, 1, 66]
    - [59, 24.086]
  - - [12632, 30, 1, 36]
    - [5, 6.224]
  - - [1728, 64, 1, 64]
    - [2, 3.36]
  - - [39456, 32, 1, 32]
    - [99, 10.766]
  - - [35040, 96, 1, 96]
    - [65, 42.184]
  - - [3456, 48, 1, 48]
    - [16, 4.118]
  - - [21658, 30, 1, 36]
    - [3, 8.496]
  - - [16026, 30, 1, 36]
    - [8, 6.747]
  - - [18768, 48, 1, 48]
    - [40, 15.35]
  - - [22608, 48, 1, 48]
    - [9, 15.477]
  - - [26624, 58, 1, 66]
    - [3, 23.444]
  - - [30432, 96, 1, 96]
    - [133, 43.288]
  - - [34970, 30, 1, 36]
    - [14, 9.814]
  - - [39488, 64, 1, 64]
    - [112, 32.139]
  - - [5472, 96, 1, 96]
    - [8, 16.148]
  - - [36608, 128, 1, 128]
    - [214, 45.111]
  - - [5084, 30, 1, 36]
    - [5, 2.527]
  - - [23520, 32, 1, 32]
    - [8, 9.993]
  - - [27648, 124, 1, 132]
    - [9, 46.424]
  - - [10976, 32, 1, 32]
    - [32, 5.208]
  - - [16288, 32, 1, 32]
    - [8, 7.844]
  - - [6960, 48, 1, 48]
    - [5, 7.262]
  - - [25088, 30, 1, 36]
    - [54, 10.045]
  - - [23808, 96, 1, 96]
    - [8, 37.747]
  - - [1792, 128, 1, 128]
    - [5, 11.345]
  - - [33376, 32, 1, 32]
    - [50, 11.5]
  - - [36666, 58, 1, 66]
    - [3, 27.683]
  - - [26880, 48, 1, 48]
    - [19, 17.972]
  - - [32544, 96, 1, 96]
    - [81, 39.481]
  - - [15360, 192, 1, 192]
    - [78, 60.254]
  - - [8448, 30, 1, 36]
    - [8, 4.454]
  - - [15264, 96, 1, 96]
    - [24, 27.718]
  - - [3136, 64, 1, 64]
    - [8, 5.033]
  - - [5904, 48, 1, 48]
    - [181, 5.568]
  - - [23296, 66, 1, 66]
    - [50, 17.939]
  - - [21120, 96, 1, 96]
    - [145, 33.958]
  - - [27888, 48, 1, 48]
    - [117, 18.524]
  - - [12960, 32, 1, 32]
    - [49, 5.204]
  - - [15258, 30, 1, 36]
    - [8, 7.069]
  - - [13978, 30, 1, 36]
    - [8, 6.982]
  - - [33728, 64, 1, 64]
    - [14, 30.685]
  - - [13536, 32, 1, 32]
    - [8, 6.558]
  - - [5946, 58, 1, 66]
    - [5, 9.875]
  - - [37120, 124, 1, 132]
    - [130, 44.778]
  - - [7328, 32, 1, 32]
    - [5, 3.691]
  - - [39104, 64, 1, 64]
    - [78, 28.11]
  - - [28512, 96, 1, 96]
    - [81, 40.331]
  - - [37568, 64, 1, 64]
    - [20, 33.441]
  - - [20890, 30, 1, 36]
    - [2, 8.827]
  - - [34080, 32, 1, 32]
    - [54, 12.023]
  - - [26496, 96, 1, 96]
    - [17, 38.04]
  - - [24528, 48, 1, 48]
    - [19, 17.219]
  - - [17136, 48, 1, 48]
    - [9, 13.841]
  - - [27136, 30, 1, 36]
    - [8, 9.257]
  - - [28160, 58, 1, 66]
    - [19, 23.203]
  - - [14528, 64, 1, 64]
    - [9, 16.804]
  - - [39392, 32, 1, 32]
    - [8, 11.752]
  - - [12384, 96, 1, 96]
    - [53, 30.733]
  - - [35584, 66, 1, 66]
    - [7, 23.66]
  - - [15744, 96, 1, 96]
    - [223, 31.418]
  - - [6464, 64, 1, 64]
    - [9, 9.536]
  - - [1756, 30, 1, 36]
    - [8, 0.674]
  - - [21694, 66, 1, 66]
    - [99, 20.683]
  - - [37184, 64, 1, 64]
    - [20, 32.205]
  - - [18140, 30, 1, 36]
    - [8, 7.047]
  - - [15872, 128, 1, 128]
    - [57, 45.809]
  - - [27136, 66, 1, 66]
    - [40, 23.938]
  - - [13760, 64, 1, 64]
    - [5, 19.213]
  - - [16128, 48, 1, 48]
    - [14, 10.961]
  - - [43440, 48, 1, 48]
    - [78, 21.08]
  - - [39680, 58, 1, 66]
    - [9, 28.047]
  - - [5328, 48, 1, 48]
    - [5, 5.806]
  - - [25022, 66, 1, 66]
    - [30, 23.51]
  - - [35518, 66, 1, 66]
    - [8, 23.025]
  - - [28560, 48, 1, 48]
    - [66, 16.101]
  - - [40792, 30, 1, 36]
    - [8, 13.372]
  - - [23516, 30, 1, 36]
    - [8, 8.291]
  - - [4896, 96, 1, 96]
    - [134, 17.701]
  - - [96, 32, 1, 32]
    - [2, 0.043]
  - - [22586, 58, 1, 66]
    - [9, 23.544]
  - - [18816, 48, 1, 48]
    - [76, 14.74]
  - - [1726, 66, 1, 66]
    - [129, 2.468]
  - - [25024, 64, 1, 64]
    - [6, 25.931]
  - - [18096, 48, 1, 48]
    - [117, 14.278]
  - - [12954, 30, 1, 36]
    - [51, 5.197]
  - - [11904, 96, 1, 96]
    - [30, 29.393]
  - - [19288, 30, 1, 36]
    - [112, 7.736]
  - - [40288, 32, 1, 32]
    - [54, 13.295]
  - - [26880, 58, 1, 66]
    - [161, 20.799]
  - - [36922, 58, 1, 66]
    - [16, 25.049]
  - - [5376, 124, 1, 132]
    - [8, 24.639]
  - - [16384, 30, 1, 36]
    - [8, 7.465]
  - - [34496, 64, 1, 64]
    - [20, 31.338]
  - - [43454, 66, 1, 66]
    - [8, 25.566]
  - - [25914, 58, 1, 66]
    - [19, 22.345]
  - - [14812, 30, 1, 36]
    - [8, 7.164]
  - - [31808, 64, 1, 64]
    - [139, 21.111]
  - - [7824, 48, 1, 48]
    - [8, 6.815]
  - - [26160, 48, 1, 48]
    - [142, 17.75]
  - - [41632, 32, 1, 32]
    - [8, 12.399]
  - - [28160, 124, 1, 132]
    - [15, 49.214]
  - - [25824, 96, 1, 96]
    - [8, 38.231]
  - - [42240, 58, 1, 66]
    - [20, 29.68]
  - - [10368, 48, 1, 48]
    - [5, 8.027]
  - - [8960, 66, 1, 66]
    - [8, 11.691]
  - - [10240, 66, 1, 66]
    - [89, 13.048]
  - - [44160, 48, 1, 48]
    - [8, 20.901]
  - - [288, 32, 1, 32]
    - [16, 0.146]
  - - [19056, 48, 1, 48]
    - [112, 13.567]
  - - [23040, 30, 1, 36]
    - [8, 9.17]
  - - [24122, 58, 1, 66]
    - [100, 21.085]
  - - [26816, 64, 1, 64]
    - [14, 23.827]
  - - [4096, 58, 1, 66]
    - [5, 6.905]
  - - [9760, 32, 1, 32]
    - [5, 3.717]
  - - [42430, 66, 1, 66]
    - [30, 26.475]
  - - [27456, 64, 1, 64]
    - [19, 27.378]
  - - [16640, 30, 1, 36]
    - [8, 6.47]
  - - [37178, 58, 1, 66]
    - [9, 25.721]
  - - [30720, 96, 1, 96]
    - [205, 41.472]
  - - [88, 30, 1, 36]
    - [16, 0.039]
  - - [30720, 30, 1, 36]
    - [8, 10.538]
  - - [36128, 32, 1, 32]
    - [56, 10.769]
  - - [17598, 66, 1, 66]
    - [74, 21.155]
  - - [41616, 48, 1, 48]
    - [48, 21.6]
  - - [24378, 58, 1, 66]
    - [190, 23.787]
  - - [26048, 64, 1, 64]
    - [63, 23.813]
  - - [11198, 66, 1, 66]
    - [35, 15.513]
  - - [17472, 64, 1, 64]
    - [53, 21.824]
  - - [4176, 48, 1, 48]
    - [5, 4.685]
  - - [5632, 30, 1, 36]
    - [5, 2.946]
  - - [8672, 32, 1, 32]
    - [8, 3.461]
  - - [3792, 48, 1, 48]
    - [5, 4.235]
  - - [35488, 32, 1, 32]
    - [2, 10.738]
  - - [34624, 64, 1, 64]
    - [20, 29.749]
  - - [27648, 128, 1, 128]
    - [60, 51.268]
  - - [26624, 124, 1, 132]
    - [224, 48.548]
  - - [20634, 30, 1, 36]
    - [8, 8.777]
  - - [6240, 96, 1, 96]
    - [8, 20.297]
  - - [11996, 30, 1, 36]
    - [8, 5.923]
  - - [37054, 66, 1, 66]
    - [17, 24.613]
  - - [32256, 66, 1, 66]
    - [22, 22.425]
  - - [37152, 96, 1, 96]
    - [46, 38.203]
  - - [20016, 48, 1, 48]
    - [9, 16.022]
  - - [15616, 128, 1, 128]
    - [107, 42.122]
  - - [28000, 32, 1, 32]
    - [8, 10.964]
  - - [4288, 64, 1, 64]
    - [8, 7.844]
  - - [34560, 192, 1, 192]
    - [107, 64.617]
  - - [25632, 96, 1, 96]
    - [145, 38.455]
  - - [8800, 32, 1, 32]
    - [8, 4.207]
  - - [4992, 192, 1, 192]
    - [14, 41.456]
  - - [39226, 58, 1, 66]
    - [9, 28.191]
  - - [39136, 32, 1, 32]
    - [50, 13.296]
  - - [26968, 30, 1, 36]
    - [54, 11.361]
  - - [12640, 32, 1, 32]
    - [8, 6.251]
  - - [41984, 58, 1, 66]
    - [94, 29.518]
  - - [44222, 66, 1, 66]
    - [17, 26.739]
  - - [10240, 30, 1, 36]
    - [15, 4.473]
  - - [6912, 124, 1, 132]
    - [77, 28.201]
  - - [6672, 48, 1, 48]
    - [5, 6.795]
  - - [29242, 58, 1, 66]
    - [92, 22.855]
  - - [36032, 64, 1, 64]
    - [9, 31.615]
  - - [28128, 32, 1, 32]
    - [132, 11.157]
  - - [33648, 48, 1, 48]
    - [9, 17.264]
  - - [21152, 32, 1, 32]
    - [159, 8.927]
  - - [20288, 64, 1, 64]
    - [62, 23.958]
  - - [23450, 30, 1, 36]
    - [8, 10.158]
  - - [12288, 30, 1, 36]
    - [8, 4.498]
  - - [9152, 64, 1, 64]
    - [81, 12.619]
  - - [8762, 58, 1, 66]
    - [8, 13.335]
  - - [32344, 30, 1, 36]
    - [151, 11.625]
  - - [9120, 32, 1, 32]
    - [5, 3.757]
  - - [20736, 66, 1, 66]
    - [25, 22.272]
  - - [39264, 96, 1, 96]
    - [89, 43.348]
  - - [4256, 32, 1, 32]
    - [61, 2.027]
  - - [25920, 64, 1, 64]
    - [19, 24.42]
  - - [37984, 32, 1, 32]
    - [207, 12.832]
  - - [8448, 58, 1, 66]
    - [5, 12.592]
  - - [24048, 48, 1, 48]
    - [19, 16.988]
  - - [37632, 30, 1, 36]
    - [59, 11.021]
  - - [14208, 48, 1, 48]
    - [182, 11.586]
  - - [28320, 32, 1, 32]
    - [3, 9.164]
  - - [2656, 32, 1, 32]
    - [169, 0.952]
  - - [35482, 30, 1, 36]
    - [50, 12.025]
  - - [35808, 96, 1, 96]
    - [7, 45.124]
  - - [19712, 124, 1, 132]
    - [20, 44.797]
  - - [7232, 64, 1, 64]
    - [5, 12.547]
  - - [30720, 58, 1, 66]
    - [8, 23.224]
  - - [42240, 124, 1, 132]
    - [3, 52.037]
  - - [19164, 30, 1, 36]
    - [14, 7.529]
  - - [22492, 30, 1, 36]
    - [153, 8.899]
  - - [7936, 124, 1, 132]
    - [22, 31.336]
  - - [42848, 32, 1, 32]
    - [75, 11.985]
  - - [38080, 64, 1, 64]
    - [14, 31.239]
  - - [25104, 48, 1, 48]
    - [19, 17.641]
  - - [16216, 30, 1, 36]
    - [8, 6.252]
  - - [18016, 32, 1, 32]
    - [81, 7.864]
  - - [3008, 64, 1, 64]
    - [99, 5.095]
  - - [35232, 32, 1, 32]
    - [99, 10.553]
  - - [43584, 64, 1, 64]
    - [102, 33.706]
  - - [14176, 32, 1, 32]
    - [9, 5.888]
  - - [36480, 192, 1, 192]
    - [214, 59.319]
  - - [33792, 48, 1, 48]
    - [206, 17.721]
  - - [32480, 32, 1, 32]
    - [190, 11.687]
  - - [15360, 124, 1, 132]
    - [19, 44.435]
  - - [3416, 30, 1, 36]
    - [21, 1.292]
  - - [5566, 66, 1, 66]
    - [8, 7.566]
  - - [43536, 48, 1, 48]
    - [20, 21.823]
  - - [38832, 48, 1, 48]
    - [14, 18.849]
  - - [9648, 48, 1, 48]
    - [5, 9.028]
  - - [12478, 66, 1, 66]
    - [22, 17.624]
  - - [5152, 32, 1, 32]
    - [129, 1.953]
  - - [38496, 96, 1, 96]
    - [59, 37.701]
  - - [410, 30, 1, 36]
    - [9, 0.2]
  - - [4704, 32, 1, 32]
    - [5, 2.465]
  - - [30816, 96, 1, 96]
    - [59, 38.632]
  - - [11008, 128, 1, 128]
    - [112, 39.124]
  - - [37888, 58, 1, 66]
    - [20, 27.535]
  - - [9920, 64, 1, 64]
    - [31, 15.432]
  - - [23742, 66, 1, 66]
    - [8, 21.365]
  - - [15744, 192, 1, 192]
    - [3, 43.995]
  - - [13472, 32, 1, 32]
    - [8, 6.602]
  - - [9728, 128, 1, 128]
    - [146, 36.101]
  - - [13824, 96, 1, 96]
    - [21, 27.335]
  - - [25824, 32, 1, 32]
    - [132, 8.369]
  - - [34904, 30, 1, 36]
    - [61, 13.285]
  - - [8592, 48, 1, 48]
    - [5, 8.684]
  - - [39168, 96, 1, 96]
    - [53, 38.432]
  - - [28848, 48, 1, 48]
    - [19, 15.611]
  - - [12768, 96, 1, 96]
    - [74, 30.016]
  - - [1024, 128, 1, 128]
    - [5, 4.662]
  - - [43520, 66, 1, 66]
    - [76, 28.602]
  - - [512, 66, 1, 66]
    - [2, 0.919]
  - - [9888, 96, 1, 96]
    - [8, 27.552]
  - - [21504, 66, 1, 66]
    - [86, 23.831]
  - - [38232, 30, 1, 36]
    - [99, 12.749]
  - - [43168, 32, 1, 32]
    - [8, 12.873]
  - - [21824, 64, 1, 64]
    - [146, 22.968]
  - - [33214, 66, 1, 66]
    - [53, 25.198]
  - - [2618, 58, 1, 66]
    - [69, 3.762]
  - - [5274, 30, 1, 36]
    - [137, 1.877]
  - - [1792, 124, 1, 132]
    - [8, 8.984]
  - - [7536, 48, 1, 48]
    - [9, 7.522]
  - - [15872, 58, 1, 66]
    - [75, 17.333]
  - - [4864, 58, 1, 66]
    - [5, 8.17]
  - - [3360, 96, 1, 96]
    - [8, 12.456]
  - - [35648, 64, 1, 64]
    - [3, 29.488]
  - - [38784, 48, 1, 48]
    - [10, 19.123]
  - - [28608, 64, 1, 64]
    - [66, 28.297]
  - - [8024, 30, 1, 36]
    - [8, 4.249]
  - - [20576, 32, 1, 32]
    - [3, 7.807]
  - - [32570, 58, 1, 66]
    - [9, 23.278]
  - - [19390, 66, 1, 66]
    - [59, 18.214]
  - - [20304, 48, 1, 48]
    - [173, 15.703]
  - - [23296, 58, 1, 66]
    - [19, 19.24]
  - - [34128, 48, 1, 48]
    - [48, 19.521]
  - - [43680, 32, 1, 32]
    - [8, 14.309]
  - - [16896, 48, 1, 48]
    - [9, 13.086]
  - - [2560, 124, 1, 132]
    - [5, 12.173]
  - - [5600, 32, 1, 32]
    - [200, 2.168]
  - - [20224, 128, 1, 128]
    - [170, 45.817]
  - - [10496, 66, 1, 66]
    - [54, 14.824]
  - - [42138, 30, 1, 36]
    - [20, 11.528]
  - - [39994, 58, 1, 66]
    - [9, 28.123]
  - - [3840, 124, 1, 132]
    - [8, 21.798]
  - - [2352, 48, 1, 48]
    - [2, 2.416]
  - - [29440, 124, 1, 132]
    - [20, 45.212]
  - - [10240, 128, 1, 128]
    - [146, 33.83]
  - - [31136, 32, 1, 32]
    - [8, 10.118]
  - - [6864, 48, 1, 48]
    - [8, 6.364]
  - - [16992, 32, 1, 32]
    - [8, 6.811]
  - - [14560, 32, 1, 32]
    - [8, 6.172]
  - - [10752, 192, 1, 192]
    - [107, 50.464]
  - - [6912, 128, 1, 128]
    - [14, 26.518]
  - - [5824, 64, 1, 64]
    - [8, 9.487]
  - - [36192, 96, 1, 96]
    - [25, 42.532]
  - - [9984, 30, 1, 36]
    - [8, 4.489]
  - - [30720, 124, 1, 132]
    - [14, 46.24]
  - - [30816, 32, 1, 32]
    - [54, 11.512]
  - - [34560, 58, 1, 66]
    - [215, 26.583]
  - - [40412, 30, 1, 36]
    - [8, 12.608]
  - - [13584, 48, 1, 48]
    - [108, 12.435]
  - - [32256, 30, 1, 36]
    - [8, 11.588]
  - - [11456, 64, 1, 64]
    - [5, 16.03]
  - - [864, 96, 1, 96]
    - [5, 2.832]
  - - [30192, 48, 1, 48]
    - [19, 19.129]
  - - [38744, 30, 1, 36]
    - [8, 13.234]
  - - [12064, 32, 1, 32]
    - [8, 5.051]
  - - [17344, 64, 1, 64]
    - [146, 21.424]
  - - [4542, 66, 1, 66]
    - [8, 6.929]
  - - [40128, 64, 1, 64]
    - [14, 30.165]
  - - [9530, 58, 1, 66]
    - [8, 14.074]
  - - [10912, 32, 1, 32]
    - [74, 4.214]
  - - [36864, 58, 1, 66]
    - [9, 27.607]
  - - [33472, 64, 1, 64]
    - [20, 30.245]
  - - [39102, 66, 1, 66]
    - [59, 23.861]
  - - [4506, 30, 1, 36]
    - [5, 2.042]
  - - [28606, 66, 1, 66]
    - [8, 23.449]
  - - [30464, 124, 1, 132]
    - [14, 48.881]
  - - [6384, 48, 1, 48]
    - [51, 5.096]
  - - [22272, 66, 1, 66]
    - [49, 18.476]
  - - [9216, 48, 1, 48]
    - [181, 8.176]
  - - [36762, 30, 1, 36]
    - [8, 12.363]
  - - [24800, 32, 1, 32]
    - [30, 9.465]
  - - [20736, 48, 1, 48]
    - [54, 13.987]
  - - [34016, 32, 1, 32]
    - [174, 9.424]
  - - [27904, 124, 1, 132]
    - [14, 50.497]
  - - [8000, 64, 1, 64]
    - [8, 13.392]
  - - [4060, 30, 1, 36]
    - [16, 1.96]
  - - [5310, 66, 1, 66]
    - [8, 9.062]
  - - [29728, 32, 1, 32]
    - [8, 9.495]
  - - [20800, 64, 1, 64]
    - [193, 22.329]
  - - [19866, 30, 1, 36]
    - [8, 9.045]
  - - [27648, 66, 1, 66]
    - [21, 21.832]
  - - [4608, 124, 1, 132]
    - [8, 22.475]
  - - [31290, 58, 1, 66]
    - [94, 24.623]
  - - [13504, 64, 1, 64]
    - [3, 19.623]
  - - [19134, 66, 1, 66]
    - [194, 19.349]
  - - [30864, 48, 1, 48]
    - [25, 20.212]
  - - [24408, 30, 1, 36]
    - [8, 9.481]
  - - [9824, 32, 1, 32]
    - [8, 5.308]
  - - [11904, 192, 1, 192]
    - [3, 52.543]
  - - [8382, 66, 1, 66]
    - [8, 13.25]
  - - [37376, 128, 1, 128]
    - [186, 46.075]
  - - [7358, 66, 1, 66]
    - [88, 12.611]
  - - [39648, 32, 1, 32]
    - [99, 13.509]
  - - [7344, 48, 1, 48]
    - [8, 7.649]
  - - [40090, 30, 1, 36]
    - [144, 9.786]
  - - [34880, 64, 1, 64]
    - [44, 31.778]
  - - [12442, 30, 1, 36]
    - [8, 5.966]
  - - [5184, 64, 1, 64]
    - [8, 8.892]
  - - [41370, 30, 1, 36]
    - [199, 11.935]
  - - [25564, 30, 1, 36]
    - [8, 10.308]
  - - [1440, 32, 1, 32]
    - [2, 0.711]
  - - [34368, 64, 1, 64]
    - [20, 27.017]
  - - [13312, 128, 1, 128]
    - [59, 42.024]
  - - [18112, 64, 1, 64]
    - [54, 22.601]
  - - [34784, 32, 1, 32]
    - [142, 13.04]
  - - [26112, 30, 1, 36]
    - [61, 11.382]
  - - [8400, 48, 1, 48]
    - [5, 8.968]
  - - [24672, 96, 1, 96]
    - [61, 34.127]
  - - [43096, 30, 1, 36]
    - [162, 12.81]
  - - [16224, 32, 1, 32]
    - [69, 6.638]
  - - [16416, 32, 1, 32]
    - [8, 5.957]
  - - [14592, 96, 1, 96]
    - [192, 33.91]
  - - [34608, 48, 1, 48]
    - [10, 19.012]
  - - [4762, 30, 1, 36]
    - [5, 2.607]
  - - [20064, 32, 1, 32]
    - [8, 8.13]
  - - [6400, 66, 1, 66]
    - [8, 11.137]
  - - [3328, 66, 1, 66]
    - [8, 6.477]
  - - [1824, 32, 1, 32]
    - [0, 0.854]
  - - [16384, 58, 1, 66]
    - [62, 18.768]
  - - [40512, 64, 1, 64]
    - [14, 28.621]
  - - [39578, 30, 1, 36]
    - [76, 11.093]
  - - [41424, 48, 1, 48]
    - [160, 20.663]
  - - [33536, 58, 1, 66]
    - [78, 26.539]
  - - [18496, 64, 1, 64]
    - [3, 23.317]
  - - [8304, 48, 1, 48]
    - [8, 8.774]
  - - [3584, 58, 1, 66]
    - [10, 4.864]
  - - [13728, 96, 1, 96]
    - [27, 29.649]
  - - [36448, 32, 1, 32]
    - [8, 12.33]
  - - [15324, 30, 1, 36]
    - [9, 6.992]
  - - [1624, 30, 1, 36]
    - [148, 0.807]
  - - [16800, 32, 1, 32]
    - [72, 7.45]
  - - [3072, 96, 1, 96]
    - [5, 11.118]
  - - [22112, 32, 1, 32]
    - [8, 9.756]
  - - [42272, 32, 1, 32]
    - [10, 11.165]
  - - [39696, 48, 1, 48]
    - [20, 20.44]
  - - [18816, 192, 1, 192]
    - [107, 51.887]
  - - [1088, 64, 1, 64]
    - [8, 1.766]
  - - [24144, 48, 1, 48]
    - [19, 15.432]
  - - [41216, 128, 1, 128]
    - [20, 50.588]
  - - [26080, 32, 1, 32]
    - [35, 10.76]
  - - [12240, 48, 1, 48]
    - [5, 11.123]
  - - [40638, 66, 1, 66]
    - [53, 26.582]
  - - [38368, 32, 1, 32]
    - [75, 14.419]
  - - [7392, 32, 1, 32]
    - [81, 3.884]
  - - [25600, 30, 1, 36]
    - [8, 10.459]
  - - [11484, 30, 1, 36]
    - [16, 5.677]
  - - [15328, 32, 1, 32]
    - [9, 5.75]
  - - [34176, 192, 1, 192]
    - [101, 61.413]
  - - [19200, 58, 1, 66]
    - [9, 22.16]
  - - [40864, 32, 1, 32]
    - [63, 13.988]
  - - [15408, 48, 1, 48]
    - [73, 12.241]
  - - [26170, 58, 1, 66]
    - [19, 22.741]
  - - [30720, 192, 1, 192]
    - [107, 63.528]
  - - [36352, 66, 1, 66]
    - [95, 23.211]
  - - [30656, 64, 1, 64]
    - [67, 27.028]
  - - [34780, 30, 1, 36]
    - [199, 10.821]
  - - [23808, 192, 1, 192]
    - [78, 51.807]
  - - [35088, 48, 1, 48]
    - [25, 17.945]
  - - [27838, 66, 1, 66]
    - [27, 21.576]
  - - [13824, 30, 1, 36]
    - [8, 5.828]
  - - [18752, 64, 1, 64]
    - [14, 22.019]
  - - [24284, 30, 1, 36]
    - [8, 7.928]
  - - [30208, 128, 1, 128]
    - [14, 48.723]
  - - [35804, 30, 1, 36]
    - [8, 12.034]
  - - [27936, 96, 1, 96]
    - [17, 40.513]
  - - [14352, 48, 1, 48]
    - [8, 11.071]
  - - [29808, 48, 1, 48]
    - [12, 19.325]
  - - [32058, 58, 1, 66]
    - [128, 24.787]
  - - [39552, 96, 1, 96]
    - [17, 38.68]
  - - [11520, 30, 1, 36]
    - [8, 5.873]
  - - [44288, 124, 1, 132]
    - [184, 49.074]
  - - [58, 58, 1, 66]
    - [8, 0.083]
  - - [15960, 30, 1, 36]
    - [8, 7.335]
  - - [6560, 32, 1, 32]
    - [5, 3.288]
  - - [34136, 30, 1, 36]
    - [3, 9.414]
  - - [21600, 32, 1, 32]
    - [8, 8.673]
  - - [3456, 192, 1, 192]
    - [8, 31.643]
  - - [27744, 96, 1, 96]
    - [17, 39.705]
  - - [8704, 58, 1, 66]
    - [179, 10.391]
  - - [19440, 48, 1, 48]
    - [120, 14.108]
  - - [3936, 32, 1, 32]
    - [69, 2.078]
  - - [41184, 96, 1, 96]
    - [17, 40.118]
  - - [16384, 128, 1, 128]
    - [90, 42.132]
  - - [314, 58, 1, 66]
    - [16, 0.442]
  - - [28504, 30, 1, 36]
    - [8, 9.111]
  - - [40320, 96, 1, 96]
    - [220, 39.394]
  - - [12672, 96, 1, 96]
    - [27, 28.717]
  - - [22528, 30, 1, 36]
    - [8, 9.755]
  - - [43008, 48, 1, 48]
    - [9, 20.008]
  - - [32448, 64, 1, 64]
    - [189, 28.298]
  - - [28992, 64, 1, 64]
    - [6, 28.711]
  - - [42716, 30, 1, 36]
    - [170, 14.556]
  - - [43872, 96, 1, 96]
    - [49, 40.036]
  - - [19968, 96, 1, 96]
    - [54, 33.231]
  - - [37152, 32, 1, 32]
    - [3, 11.204]
  - - [41048, 30, 1, 36]
    - [84, 13.697]
  - - [7632, 48, 1, 48]
    - [5, 8.133]
  - - [37536, 96, 1, 96]
    - [17, 38.316]
  - - [38880, 96, 1, 96]
    - [17, 37.727]
  - - [20736, 128, 1, 128]
    - [146, 46.372]
  - - [16080, 48, 1, 48]
    - [70, 13.072]
  - - [25820, 30, 1, 36]
    - [162, 10.164]
  - - [36096, 30, 1, 36]
    - [190, 13.046]
  - - [41472, 66, 1, 66]
    - [22, 27.087]
  - - [29952, 96, 1, 96]
    - [133, 37.82]
  - - [13664, 32, 1, 32]
    - [8, 6.003]
  - - [32512, 30, 1, 36]
    - [162, 12.016]
  - - [16574, 66, 1, 66]
    - [142, 19.61]
  - - [44096, 64, 1, 64]
    - [14, 34.391]
  - - [43392, 48, 1, 48]
    - [49, 24.371]
  - - [2648, 30, 1, 36]
    - [69, 1.249]
  - - [958, 66, 1, 66]
    - [2, 1.957]
  - - [40944, 48, 1, 48]
    - [9, 20.723]
  - - [29338, 30, 1, 36]
    - [8, 9.857]
  - - [17328, 48, 1, 48]
    - [95, 12.441]
  - - [11710, 66, 1, 66]
    - [24, 16.583]
  - - [24320, 66, 1, 66]
    - [8, 20.511]
  - - [1946, 30, 1, 36]
    - [56, 0.772]
  - - [44120, 30, 1, 36]
    - [118, 13.325]
  - - [43864, 30, 1, 36]
    - [54, 13.905]
  - - [35040, 32, 1, 32]
    - [87, 12.896]
  - - [30874, 30, 1, 36]
    - [178, 10.54]
  - - [5888, 128, 1, 128]
    - [14, 28.182]
  - - [18720, 32, 1, 32]
    - [8, 8.641]
  - - [40224, 96, 1, 96]
    - [131, 40.644]
  - - [3984, 48, 1, 48]
    - [5, 4.222]
  - - [41472, 58, 1, 66]
    - [9, 28.053]
  - - [27100, 30, 1, 36]
    - [8, 8.787]
  - - [29374, 66, 1, 66]
    - [3, 21.489]
  - - [28080, 48, 1, 48]
    - [173, 19.072]
  - - [1338, 58, 1, 66]
    - [16, 1.943]
  - - [14336, 66, 1, 66]
    - [21, 17.792]
  - - [5664, 32, 1, 32]
    - [0, 2.775]
  - - [21184, 64, 1, 64]
    - [92, 22.844]
  - - [41984, 30, 1, 36]
    - [10, 12.844]
  - - [13114, 58, 1, 66]
    - [9, 17.252]
  - - [38400, 124, 1, 132]
    - [218, 45.773]
  - - [2458, 30, 1, 36]
    - [8, 1.164]
  - - [21360, 48, 1, 48]
    - [3, 13.513]
  - - [42752, 66, 1, 66]
    - [22, 29.486]
  - - [256, 58, 1, 66]
    - [16, 0.379]
  - - [10400, 32, 1, 32]
    - [31, 4.622]
  - - [22748, 30, 1, 36]
    - [148, 7.768]
  - - [43920, 48, 1, 48]
    - [25, 21.852]
  - - [29696, 30, 1, 36]
    - [8, 12.28]
  - - [11608, 30, 1, 36]
    - [8, 5.752]
  - - [15616, 124, 1, 132]
    - [78, 39.428]
  - - [12992, 64, 1, 64]
    - [8, 19.189]
  - - [25056, 32, 1, 32]
    - [84, 8.429]
  - - [31872, 96, 1, 96]
    - [63, 37.061]
  - - [26016, 96, 1, 96]
    - [17, 37.411]
  - - [16186, 58, 1, 66]
    - [24, 18.31]
  - - [35928, 30, 1, 36]
    - [48, 11.398]
  - - [28760, 30, 1, 36]
    - [8, 10.314]
  - - [9552, 48, 1, 48]
    - [106, 8.795]
  - - [30208, 30, 1, 36]
    - [127, 9.313]
  - - [35328, 58, 1, 66]
    - [9, 28.586]
  - - [34272, 32, 1, 32]
    - [8, 11.045]
  - - [33360, 48, 1, 48]
    - [9, 20.111]
  - - [27296, 32, 1, 32]
    - [31, 10.871]
  - - [25146, 58, 1, 66]
    - [54, 20.97]
  - - [41760, 96, 1, 96]
    - [210, 38.85]
  - - [30296, 30, 1, 36]
    - [56, 11.465]
  - - [3040, 32, 1, 32]
    - [99, 1.457]
  - - [12252, 30, 1, 36]
    - [8, 6.198]
  - - [18490, 58, 1, 66]
    - [62, 19.524]
  - - [34944, 96, 1, 96]
    - [131, 43.44]
  - - [9600, 192, 1, 192]
    - [3, 49.958]
  - - [27392, 58, 1, 66]
    - [19, 25.149]
  - - [43744, 32, 1, 32]
    - [15, 12.428]
  - - [39216, 48, 1, 48]
    - [86, 21.956]
  - - [27736, 30, 1, 36]
    - [8, 11.556]
  - - [22320, 48, 1, 48]
    - [9, 17.078]
  - - [22368, 96, 1, 96]
    - [17, 37.818]
  - - [42656, 32, 1, 32]
    - [8, 11.483]
  - - [39768, 30, 1, 36]
    - [8, 12.098]
  - - [35072, 30, 1, 36]
    - [8, 10.328]
  - - [18432, 192, 1, 192]
    - [93, 51.81]
  - - [42240, 66, 1, 66]
    - [17, 26.47]
  - - [7424, 30, 1, 36]
    - [5, 4.229]
  - - [34202, 30, 1, 36]
    - [82, 10.853]
  - - [18176, 58, 1, 66]
    - [9, 20.574]
  - - [14424, 30, 1, 36]
    - [8, 6.967]
  - - [8976, 48, 1, 48]
    - [8, 9.419]
  - - [39738, 58, 1, 66]
    - [83, 26.232]
  - - [32496, 48, 1, 48]
    - [9, 18.418]
  - - [44192, 32, 1, 32]
    - [190, 12.414]
  - - [826, 58, 1, 66]
    - [8, 1.281]
  - - [24152, 30, 1, 36]
    - [93, 8.962]
  - - [2208, 32, 1, 32]
    - [8, 0.9]
  - - [22718, 66, 1, 66]
    - [8, 21.018]
  - - [29792, 32, 1, 32]
    - [8, 10.715]
  - - [31168, 64, 1, 64]
    - [225, 23.941]
  - - [21216, 32, 1, 32]
    - [99, 8.212]
  - - [35072, 66, 1, 66]
    - [17, 22.774]
  - - [22592, 64, 1, 64]
    - [14, 24.203]
  - - [7920, 48, 1, 48]
    - [150, 7.653]
  - - [44064, 32, 1, 32]
    - [8, 13.975]
  - - [29184, 48, 1, 48]
    - [19, 18.563]
  - - [10848, 96, 1, 96]
    - [21, 26.957]
  - - [30336, 96, 1, 96]
    - [17, 43.018]
  - - [37018, 30, 1, 36]
    - [70, 12.959]
  - - [18816, 96, 1, 96]
    - [10, 37.785]
  - - [43520, 30, 1, 36]
    - [20, 12.656]
  - - [5440, 64, 1, 64]
    - [8, 9.8]
  - - [12508, 30, 1, 36]
    - [8, 5.355]
  - - [31678, 66, 1, 66]
    - [53, 22.064]
  - - [21120, 192, 1, 192]
    - [152, 55.118]
  - - [2048, 124, 1, 132]
    - [2, 12.021]
  - - [154, 30, 1, 36]
    - [2, 0.073]
  - - [40368, 48, 1, 48]
    - [86, 22.055]
  - - [27024, 48, 1, 48]
    - [48, 18.623]
  - - [39584, 32, 1, 32]
    - [87, 13.589]
  - - [33408, 96, 1, 96]
    - [12, 39.397]
  - - [35616, 96, 1, 96]
    - [17, 39.445]
  - - [44288, 30, 1, 36]
    - [8, 13.815]
  - - [31898, 30, 1, 36]
    - [20, 10.26]
  - - [39358, 66, 1, 66]
    - [25, 24.907]
  - - [30976, 124, 1, 132]
    - [143, 38.053]
  - - [7264, 32, 1, 32]
    - [8, 2.977]
  - - [39600, 48, 1, 48]
    - [68, 17.686]
  - - [4798, 66, 1, 66]
    - [5, 8.27]
  - - [21168, 48, 1, 48]
    - [110, 14.578]
  - - [22016, 58, 1, 66]
    - [226, 18.68]
  - - [11930, 30, 1, 36]
    - [132, 4.375]
  - - [1344, 64, 1, 64]
    - [16, 2.288]
  - - [23610, 58, 1, 66]
    - [19, 19.896]
  - - [10464, 32, 1, 32]
    - [8, 4.634]
  - - [8704, 128, 1, 128]
    - [227, 33.093]
  - - [27264, 48, 1, 48]
    - [19, 16.329]
  - - [15550, 66, 1, 66]
    - [24, 16.115]
  - - [38048, 32, 1, 32]
    - [115, 11.519]
  - - [21344, 32, 1, 32]
    - [8, 9.587]
  - - [30432, 32, 1, 32]
    - [134, 11.949]
  - - [36048, 48, 1, 48]
    - [25, 22.043]
  - - [15648, 96, 1, 96]
    - [24, 30.561]
  - - [26712, 30, 1, 36]
    - [8, 11.299]
  - - [10896, 48, 1, 48]
    - [5, 10.872]
  - - [41328, 48, 1, 48]
    - [160, 19.157]
  - - [32224, 32, 1, 32]
    - [8, 10.545]
  - - [24624, 48, 1, 48]
    - [71, 15.806]
  - - [39456, 96, 1, 96]
    - [22, 38.017]
  - - [36800, 64, 1, 64]
    - [14, 29.929]
  - - [30940, 30, 1, 36]
    - [24, 11.707]
  - - [7936, 66, 1, 66]
    - [95, 11.127]
  - - [2560, 66, 1, 66]
    - [2, 5.11]
  - - [7456, 32, 1, 32]
    - [8, 3.925]
  - - [28224, 64, 1, 64]
    - [8, 24.929]
  - - [27648, 48, 1, 48]
    - [19, 17.733]
  - - [34512, 48, 1, 48]
    - [3, 19.04]
  - - [17152, 58, 1, 66]
    - [54, 17.161]
  - - [9840, 48, 1, 48]
    - [8, 7.875]
  - - [11264, 58, 1, 66]
    - [51, 15.548]
  - - [3744, 96, 1, 96]
    - [8, 14.078]
  - - [29528, 30, 1, 36]
    - [8, 11.938]
  - - [35616, 32, 1, 32]
    - [16, 12.336]
  - - [39776, 32, 1, 32]
    - [142, 12.14]
  - - [7256, 30, 1, 36]
    - [8, 3.271]
  - - [23808, 124, 1, 132]
    - [9, 47.616]
  - - [26624, 30, 1, 36]
    - [212, 8.984]
  - - [19200, 96, 1, 96]
    - [8, 34.767]
  - - [29916, 30, 1, 36]
    - [8, 10.679]
  - - [43966, 66, 1, 66]
    - [22, 26.78]
  - - [19536, 48, 1, 48]
    - [9, 12.893]
  - - [24832, 128, 1, 128]
    - [93, 43.272]
  - - [43520, 58, 1, 66]
    - [9, 31.616]
  - - [38544, 48, 1, 48]
    - [9, 19.629]
  - - [9696, 32, 1, 32]
    - [5, 4.947]
  - - [14336, 124, 1, 132]
    - [19, 40.012]
  - - [21402, 30, 1, 36]
    - [8, 9.586]
  - - [29498, 58, 1, 66]
    - [19, 25.915]
  - - [39328, 32, 1, 32]
    - [54, 12.009]
  - - [6880, 32, 1, 32]
    - [5, 2.772]
  - - [14300, 30, 1, 36]
    - [8, 6.41]
  - - [6876, 30, 1, 36]
    - [16, 3.514]
  - - [26784, 32, 1, 32]
    - [77, 10.2]
  - - [32064, 64, 1, 64]
    - [20, 26.877]
  - - [17116, 30, 1, 36]
    - [181, 7.67]
  - - [31232, 128, 1, 128]
    - [39, 43.719]
  - - [26426, 58, 1, 66]
    - [19, 23.011]
  - - [23088, 48, 1, 48]
    - [86, 15.869]
  - - [37056, 64, 1, 64]
    - [14, 31.706]
  - - [20960, 32, 1, 32]
    - [69, 9.023]
  - - [33024, 192, 1, 192]
    - [3, 62.586]
  - - [41568, 32, 1, 32]
    - [51, 13.561]
  - - [29920, 32, 1, 32]
    - [8, 11.692]
  - - [19968, 66, 1, 66]
    - [17, 19.515]
  - - [34238, 66, 1, 66]
    - [76, 21.853]
  - - [6912, 192, 1, 192]
    - [228, 42.629]
  - - [9216, 30, 1, 36]
    - [5, 4.851]
  - - [2368, 64, 1, 64]
    - [2, 4.519]
  - - [9626, 30, 1, 36]
    - [5, 4.229]
  - - [33792, 66, 1, 66]
    - [76, 26.643]
  - - [27552, 32, 1, 32]
    - [24, 9.186]
  - - [26592, 96, 1, 96]
    - [96, 33.989]
  - - [22032, 48, 1, 48]
    - [201, 15.692]
  - - [25440, 96, 1, 96]
    - [27, 39.357]
  - - [25968, 48, 1, 48]
    - [35, 16.999]
  - - [40032, 32, 1, 32]
    - [220, 10.311]
  - - [10752, 30, 1, 36]
    - [8, 5.255]
  - - [36640, 32, 1, 32]
    - [50, 12.635]
  - - [41920, 64, 1, 64]
    - [3, 33.344]
  - - [7738, 58, 1, 66]
    - [5, 11.001]
  - - [8096, 32, 1, 32]
    - [88, 4.09]
  - - [14080, 128, 1, 128]
    - [19, 38.311]
  - - [25280, 64, 1, 64]
    - [76, 23.516]
  - - [37024, 32, 1, 32]
    - [8, 12.413]
  - - [31872, 48, 1, 48]
    - [10, 16.973]
  - - [31488, 30, 1, 36]
    - [8, 10.383]
  - - [29408, 32, 1, 32]
    - [8, 10.265]
  - - [2816, 58, 1, 66]
    - [2, 3.527]
  - - [352, 32, 1, 32]
    - [8, 0.166]
  - - [30784, 64, 1, 64]
    - [149, 30.109]
  - - [2544, 48, 1, 48]
    - [16, 3.054]
  - - [26928, 48, 1, 48]
    - [9, 17.647]
  - - [11360, 32, 1, 32]
    - [5, 5.231]
  - - [25432, 30, 1, 36]
    - [8, 10.205]
  - - [26844, 30, 1, 36]
    - [8, 8.72]
  - - [23424, 192, 1, 192]
    - [163, 50.779]
  - - [40192, 128, 1, 128]
    - [163, 49.726]
  - - [33946, 30, 1, 36]
    - [84, 12.575]
  - - [2112, 64, 1, 64]
    - [171, 3.563]
  - - [16064, 64, 1, 64]
    - [77, 15.643]
  - - [39120, 48, 1, 48]
    - [8, 19.584]
  - - [21952, 64, 1, 64]
    - [14, 25.242]
  - - [39870, 66, 1, 66]
    - [95, 26.064]
  - - [2816, 124, 1, 132]
    - [5, 16.17]
  - - [17152, 66, 1, 66]
    - [10, 20.452]
  - - [35856, 48, 1, 48]
    - [46, 21.778]
  - - [15008, 32, 1, 32]
    - [8, 7.12]
  - - [9436, 30, 1, 36]
    - [8, 4.626]
  - - [32000, 58, 1, 66]
    - [3, 25.948]
  - - [35776, 64, 1, 64]
    - [9, 27.958]
  - - [14782, 66, 1, 66]
    - [118, 18.339]
  - - [9696, 96, 1, 96]
    - [8, 26.63]
  - - [34336, 32, 1, 32]
    - [93, 10.358]
  - - [37408, 32, 1, 32]
    - [158, 11.3]
  - - [39072, 32, 1, 32]
    - [8, 12.822]
  - - [14168, 30, 1, 36]
    - [8, 6.117]
  - - [446, 66, 1, 66]
    - [16, 0.908]
  - - [33216, 64, 1, 64]
    - [57, 27.513]
  - - [12720, 48, 1, 48]
    - [88, 11.332]
  - - [12990, 66, 1, 66]
    - [120, 17.402]
  - - [7578, 30, 1, 36]
    - [8, 3.847]
  - - [9408, 64, 1, 64]
    - [8, 15.469]
  - - [33600, 64, 1, 64]
    - [14, 26.019]
  - - [17920, 30, 1, 36]
    - [148, 8.188]
  - - [25376, 32, 1, 32]
    - [24, 10.046]
  - - [41568, 96, 1, 96]
    - [17, 41.377]
  - - [26016, 32, 1, 32]
    - [148, 8.815]
  - - [43776, 128, 1, 128]
    - [3, 50.804]
  - - [28160, 30, 1, 36]
    - [8, 11.456]
  - - [24960, 192, 1, 192]
    - [229, 52.949]
  - - [17342, 66, 1, 66]
    - [142, 17.099]
  - - [23952, 48, 1, 48]
    - [82, 16.793]
  - - [8224, 32, 1, 32]
    - [8, 3.73]
  - - [42624, 192, 1, 192]
    - [49, 62.046]
  - - [33456, 48, 1, 48]
    - [9, 20.387]
  - - [36352, 124, 1, 132]
    - [62, 45.26]
  - - [33792, 128, 1, 128]
    - [111, 42.54]
  - - [15616, 30, 1, 36]
    - [8, 5.88]
  - - [7680, 66, 1, 66]
    - [167, 12.71]
  - - [12864, 64, 1, 64]
    - [3, 19.317]
  - - [12960, 96, 1, 96]
    - [21, 28.81]
  - - [24986, 30, 1, 36]
    - [8, 7.674]
  - - [5178, 58, 1, 66]
    - [5, 8.07]
  - - [3738, 30, 1, 36]
    - [179, 1.61]
  - - [34560, 124, 1, 132]
    - [230, 41.981]
  - - [10608, 48, 1, 48]
    - [99, 10.194]
  - - [32314, 58, 1, 66]
    - [9, 26.609]
  - - [35008, 64, 1, 64]
    - [191, 31.503]
  - - [3840, 58, 1, 66]
    - [88, 4.993]
  - - [1824, 96, 1, 96]
    - [5, 6.296]
  - - [32410, 30, 1, 36]
    - [8, 11.54]
  - - [2904, 30, 1, 36]
    - [29, 1.035]
  - - [10432, 64, 1, 64]
    - [9, 13.456]
  - - [25790, 66, 1, 66]
    - [231, 22.188]
  - - [38432, 32, 1, 32]
    - [54, 13.423]
  - - [23904, 32, 1, 32]
    - [8, 10.09]
  - - [36864, 124, 1, 132]
    - [19, 43.801]
  - - [31744, 66, 1, 66]
    - [53, 23.17]
  - - [25664, 64, 1, 64]
    - [95, 26.78]
  - - [23376, 48, 1, 48]
    - [120, 16.212]
  - - [33756, 30, 1, 36]
    - [8, 11.166]
  - - [43680, 96, 1, 96]
    - [17, 40.288]
  - - [26448, 48, 1, 48]
    - [35, 17.098]
  - - [10016, 32, 1, 32]
    - [8, 4.982]
  - - [27070, 66, 1, 66]
    - [65, 20.189]
  - - [34032, 48, 1, 48]
    - [10, 18.04]
  - - [480, 32, 1, 32]
    - [16, 0.245]
  - - [17408, 30, 1, 36]
    - [8, 6.553]
  - - [7644, 30, 1, 36]
    - [44, 3.356]
  - - [44032, 124, 1, 132]
    - [232, 52.902]
  - - [21248, 30, 1, 36]
    - [8, 8.706]
  - - [34816, 66, 1, 66]
    - [17, 23.257]
  - - [42560, 64, 1, 64]
    - [14, 32.228]
  - - [17712, 48, 1, 48]
    - [54, 14.536]
  - - [41472, 30, 1, 36]
    - [8, 13.812]
  - - [4608, 128, 1, 128]
    - [8, 24.327]
  - - [41728, 66, 1, 66]
    - [59, 26.611]
  - - [18688, 30, 1, 36]
    - [8, 8.662]
  - - [30976, 58, 1, 66]
    - [89, 24.466]
  - - [1536, 192, 1, 192]
    - [5, 16.999]
  - - [33312, 32, 1, 32]
    - [54, 10.166]
  - - [37632, 96, 1, 96]
    - [145, 38.327]
  - - [4864, 30, 1, 36]
    - [5, 2.602]
  - - [17818, 30, 1, 36]
    - [8, 7.685]
  - - [35104, 32, 1, 32]
    - [233, 10.82]
  - - [28096, 64, 1, 64]
    - [105, 26.595]
  - - [21312, 64, 1, 64]
    - [14, 24.974]
  - - [41472, 192, 1, 192]
    - [14, 62.283]
  - - [19520, 64, 1, 64]
    - [9, 23.956]
  - - [1152, 48, 1, 48]
    - [144, 1.196]
  - - [26880, 128, 1, 128]
    - [94, 49.306]
  - - [37376, 58, 1, 66]
    - [20, 28.768]
  - - [44224, 64, 1, 64]
    - [3, 34.549]
  - - [28656, 48, 1, 48]
    - [137, 16.514]
  - - [28480, 64, 1, 64]
    - [183, 29.518]
  - - [43392, 96, 1, 96]
    - [17, 42.615]
  - - [42240, 30, 1, 36]
    - [35, 10.919]
  - - [37310, 66, 1, 66]
    - [59, 27.476]
  - - [4410, 58, 1, 66]
    - [8, 6.634]
  - - [1696, 32, 1, 32]
    - [2, 0.812]
  - - [13408, 32, 1, 32]
    - [31, 6.657]
  - - [21306, 58, 1, 66]
    - [9, 22.017]
  - - [10144, 32, 1, 32]
    - [8, 4.511]
  - - [15200, 32, 1, 32]
    - [3, 5.626]
  - - [35712, 48, 1, 48]
    - [145, 18.116]
  - - [3552, 32, 1, 32]
    - [21, 1.891]
  - - [41152, 64, 1, 64]
    - [78, 33.141]
  - - [25728, 48, 1, 48]
    - [19, 17.008]
  - - [38352, 48, 1, 48]
    - [46, 22.144]
  - - [2880, 64, 1, 64]
    - [8, 5.0]
  - - [2524, 30, 1, 36]
    - [5, 1.188]
  - - [32988, 30, 1, 36]
    - [234, 9.551]
  - - [24256, 64, 1, 64]
    - [19, 25.948]
  - - [19616, 32, 1, 32]
    - [8, 8.856]
  - - [32768, 124, 1, 132]
    - [163, 41.692]
  - - [30144, 64, 1, 64]
    - [14, 27.283]
  - - [15294, 66, 1, 66]
    - [174, 19.29]
  - - [35328, 48, 1, 48]
    - [138, 21.224]
  - - [21568, 64, 1, 64]
    - [14, 26.334]
  - - [9936, 48, 1, 48]
    - [5, 10.155]
  - - [41088, 192, 1, 192]
    - [219, 63.215]
  - - [41150, 66, 1, 66]
    - [95, 25.108]
  - - [35472, 48, 1, 48]
    - [9, 18.209]
  - - [23200, 32, 1, 32]
    - [8, 9.369]
  - - [17628, 30, 1, 36]
    - [8, 7.543]
  - - [31232, 30, 1, 36]
    - [99, 11.896]
  - - [22974, 66, 1, 66]
    - [17, 21.317]
  - - [35262, 66, 1, 66]
    - [22, 26.562]
  - - [12896, 32, 1, 32]
    - [2, 6.099]
  - - [16128, 128, 1, 128]
    - [107, 43.074]
  - - [42528, 32, 1, 32]
    - [99, 12.156]
  - - [27328, 64, 1, 64]
    - [103, 26.721]
  - - [21212, 30, 1, 36]
    - [8, 9.642]
  - - [2238, 66, 1, 66]
    - [5, 4.391]
  - - [21600, 96, 1, 96]
    - [17, 34.877]
  - - [41376, 96, 1, 96]
    - [27, 39.919]
  - - [24640, 64, 1, 64]
    - [19, 26.089]
  - - [10416, 48, 1, 48]
    - [72, 10.024]
  - - [16128, 66, 1, 66]
    - [160, 18.372]
  - - [3226, 30, 1, 36]
    - [0, 1.572]
  - - [5696, 64, 1, 64]
    - [8, 9.806]
  - - [9024, 64, 1, 64]
    - [14, 13.227]
  - - [16282, 30, 1, 36]
    - [62, 5.942]
  - - [33936, 48, 1, 48]
    - [3, 18.728]
  - - [34752, 64, 1, 64]
    - [14, 30.904]
  - - [34208, 32, 1, 32]
    - [3, 10.58]
  - - [29272, 30, 1, 36]
    - [8, 11.875]
  - - [32768, 30, 1, 36]
    - [14, 9.964]
  - - [21664, 32, 1, 32]
    - [8, 9.858]
  - - [24000, 64, 1, 64]
    - [19, 21.479]
  - - [27392, 124, 1, 132]
    - [6, 46.077]
  - - [144, 48, 1, 48]
    - [5, 0.142]
  - - [33072, 48, 1, 48]
    - [110, 16.562]
  - - [27264, 96, 1, 96]
    - [133, 40.422]
  - - [9216, 128, 1, 128]
    - [95, 35.087]
  - - [5376, 66, 1, 66]
    - [8, 9.401]
  - - [12032, 66, 1, 66]
    - [30, 16.882]
  - - [23328, 96, 1, 96]
    - [8, 37.2]
  - - [21056, 64, 1, 64]
    - [9, 25.259]
  - - [13088, 32, 1, 32]
    - [8, 6.206]
  - - [43608, 30, 1, 36]
    - [22, 14.915]
  - - [32826, 58, 1, 66]
    - [9, 25.899]
  - - [24736, 32, 1, 32]
    - [8, 10.139]
  - - [30016, 64, 1, 64]
    - [14, 28.591]
  - - [33178, 30, 1, 36]
    - [170, 12.246]
  - - [38592, 64, 1, 64]
    - [8, 30.877]
  - - [27072, 64, 1, 64]
    - [149, 28.256]
  - - [27136, 128, 1, 128]
    - [94, 51.613]
  - - [23664, 48, 1, 48]
    - [19, 16.142]
  - - [40506, 58, 1, 66]
    - [78, 25.948]
  - - [6656, 58, 1, 66]
    - [8, 10.028]
  - - [11552, 32, 1, 32]
    - [8, 4.561]
  - - [33024, 30, 1, 36]
    - [86, 9.69]
  - - [4352, 58, 1, 66]
    - [5, 5.467]
  - - [4696, 30, 1, 36]
    - [2, 2.091]
  - - [14936, 30, 1, 36]
    - [52, 6.542]
  - - [12224, 64, 1, 64]
    - [5, 16.589]
  - - [33982, 66, 1, 66]
    - [17, 22.94]
  - - [33112, 30, 1, 36]
    - [70, 11.124]
  - - [40704, 30, 1, 36]
    - [70, 14.106]
  - - [41248, 32, 1, 32]
    - [199, 13.421]
  - - [7904, 32, 1, 32]
    - [2, 4.051]
  - - [17280, 96, 1, 96]
    - [8, 31.66]
  - - [2640, 48, 1, 48]
    - [8, 2.358]
  - - [27136, 58, 1, 66]
    - [235, 22.781]
  - - [15038, 66, 1, 66]
    - [54, 17.771]
  - - [10496, 124, 1, 132]
    - [9, 34.336]
  - - [18208, 32, 1, 32]
    - [8, 7.299]
  - - [23488, 64, 1, 64]
    - [19, 24.538]
  - - [29136, 48, 1, 48]
    - [5, 18.265]
  - - [14592, 48, 1, 48]
    - [31, 12.271]
  - - [14556, 30, 1, 36]
    - [8, 6.024]
  - - [39616, 64, 1, 64]
    - [14, 30.505]
  - - [18842, 30, 1, 36]
    - [181, 8.074]
  - - [29440, 30, 1, 36]
    - [8, 12.178]
  - - [37488, 48, 1, 48]
    - [14, 17.889]
  - - [42942, 66, 1, 66]
    - [82, 25.192]
  - - [37822, 66, 1, 66]
    - [154, 25.888]
  - - [18480, 48, 1, 48]
    - [51, 14.13]
  - - [9248, 32, 1, 32]
    - [8, 4.582]
  - - [21848, 30, 1, 36]
    - [8, 9.141]
  - - [29184, 192, 1, 192]
    - [25, 56.217]
  - - [4928, 64, 1, 64]
    - [106, 9.412]
  - - [25184, 32, 1, 32]
    - [19, 8.706]
  - - [2304, 192, 1, 192]
    - [5, 24.773]
  - - [34816, 58, 1, 66]
    - [44, 26.617]
  - - [8704, 30, 1, 36]
    - [9, 4.194]
  - - [38912, 124, 1, 132]
    - [236, 44.008]
  - - [39840, 96, 1, 96]
    - [17, 39.379]
  - - [42906, 30, 1, 36]
    - [54, 14.373]
  - - [5136, 48, 1, 48]
    - [5, 4.887]
  - - [34416, 48, 1, 48]
    - [160, 20.584]
  - - [11136, 48, 1, 48]
    - [106, 10.979]
  - - [3840, 30, 1, 36]
    - [5, 1.815]
  - - [31232, 66, 1, 66]
    - [53, 22.855]
  - - [25536, 64, 1, 64]
    - [19, 26.116]
  - - [42240, 48, 1, 48]
    - [20, 21.26]
  - - [7226, 58, 1, 66]
    - [8, 10.704]
  - - [13728, 32, 1, 32]
    - [77, 6.5]
  - - [30576, 48, 1, 48]
    - [150, 20.929]
  - - [43008, 192, 1, 192]
    - [236, 62.143]
  - - [20122, 30, 1, 36]
    - [8, 9.43]
  - - [3072, 58, 1, 66]
    - [75, 4.729]
  - - [14400, 64, 1, 64]
    - [9, 20.729]
  - - [10224, 48, 1, 48]
    - [72, 10.053]
  - - [6336, 64, 1, 64]
    - [5, 11.143]
  - - [40800, 96, 1, 96]
    - [27, 39.929]
  - - [11904, 48, 1, 48]
    - [9, 11.003]
  - - [18944, 124, 1, 132]
    - [29, 42.792]
  - - [22426, 30, 1, 36]
    - [8, 8.952]
  - - [33082, 58, 1, 66]
    - [14, 24.227]
  - - [40960, 58, 1, 66]
    - [3, 27.933]
  - - [35424, 96, 1, 96]
    - [10, 39.044]
  - - [13776, 48, 1, 48]
    - [8, 12.338]
  - - [11840, 64, 1, 64]
    - [8, 16.617]
  - - [31488, 96, 1, 96]
    - [22, 39.757]
  - - [27808, 32, 1, 32]
    - [24, 9.126]
  - - [29016, 30, 1, 36]
    - [8, 10.761]
  - - [24672, 32, 1, 32]
    - [8, 9.911]
  - - [7680, 128, 1, 128]
    - [8, 29.738]
  - - [37792, 32, 1, 32]
    - [134, 10.905]
  - - [10704, 48, 1, 48]
    - [5, 9.444]
  - - [25308, 30, 1, 36]
    - [8, 8.547]
  - - [39482, 58, 1, 66]
    - [94, 24.893]
  - - [32352, 32, 1, 32]
    - [8, 10.532]
  - - [32016, 48, 1, 48]
    - [9, 19.614]
  - - [32600, 30, 1, 36]
    - [38, 10.219]
  - - [41888, 32, 1, 32]
    - [8, 12.773]
  - - [31546, 58, 1, 66]
    - [3, 21.207]
  - - [5760, 48, 1, 48]
    - [14, 4.652]
  - - [31196, 30, 1, 36]
    - [8, 11.121]
  - - [22688, 32, 1, 32]
    - [8, 8.938]
  - - [22656, 96, 1, 96]
    - [10, 37.007]
  - - [29404, 30, 1, 36]
    - [8, 11.783]
  - - [11352, 30, 1, 36]
    - [229, 5.462]
  - - [8126, 66, 1, 66]
    - [112, 10.793]
  - - [15072, 32, 1, 32]
    - [8, 5.739]
  - - [18384, 48, 1, 48]
    - [9, 14.771]
  - - [8112, 48, 1, 48]
    - [5, 7.23]
  - - [1982, 66, 1, 66]
    - [5, 3.322]
  - - [13210, 30, 1, 36]
    - [8, 5.881]
  - - [2496, 64, 1, 64]
    - [8, 4.391]
  - - [17216, 64, 1, 64]
    - [87, 21.773]
  - - [24474, 30, 1, 36]
    - [8, 9.062]
  - - [33500, 30, 1, 36]
    - [3, 9.834]
  - - [10176, 64, 1, 64]
    - [5, 14.996]
  - - [37464, 30, 1, 36]
    - [76, 11.627]
  - - [8960, 128, 1, 128]
    - [14, 33.791]
  - - [4640, 32, 1, 32]
    - [5, 2.631]
  - - [23904, 96, 1, 96]
    - [8, 35.867]
  - - [38016, 96, 1, 96]
    - [17, 39.643]
  - - [34912, 32, 1, 32]
    - [50, 12.138]
  - - [37664, 32, 1, 32]
    - [70, 13.314]
  - - [41918, 66, 1, 66]
    - [22, 26.483]
  - - [29118, 66, 1, 66]
    - [61, 24.963]
  - - [7056, 48, 1, 48]
    - [8, 6.594]
  - - [41786, 58, 1, 66]
    - [9, 28.573]
  - - [26544, 48, 1, 48]
    - [160, 18.062]
  - - [33440, 32, 1, 32]
    - [35, 11.102]
  - - [8608, 32, 1, 32]
    - [8, 3.929]
  - - [34106, 58, 1, 66]
    - [9, 27.081]
  - - [37888, 128, 1, 128]
    - [60, 47.301]
  - - [5120, 66, 1, 66]
    - [8, 9.531]
  - - [24832, 124, 1, 132]
    - [9, 46.991]
  - - [8736, 32, 1, 32]
    - [5, 4.446]
  - - [39936, 30, 1, 36]
    - [95, 13.768]
  - - [41018, 58, 1, 66]
    - [20, 28.367]
  - - [21120, 48, 1, 48]
    - [14, 15.833]
  - - [41088, 96, 1, 96]
    - [17, 38.902]
  - - [11578, 58, 1, 66]
    - [8, 15.49]
  - - [21792, 32, 1, 32]
    - [8, 8.94]
  - - [37434, 58, 1, 66]
    - [9, 29.413]
  - - [11162, 30, 1, 36]
    - [167, 5.157]
  - - [43296, 96, 1, 96]
    - [17, 42.793]
  - - [12144, 48, 1, 48]
    - [9, 11.433]
  - - [15930, 58, 1, 66]
    - [112, 16.227]
  - - [18624, 64, 1, 64]
    - [45, 21.963]
  - - [7424, 58, 1, 66]
    - [9, 11.092]
  - - [672, 32, 1, 32]
    - [16, 0.327]
  - - [18048, 96, 1, 96]
    - [48, 35.171]
  - - [22048, 32, 1, 32]
    - [56, 9.371]
  - - [6488, 30, 1, 36]
    - [69, 3.436]
  - - [29440, 128, 1, 128]
    - [14, 45.937]
  - - [16538, 30, 1, 36]
    - [146, 6.758]
  - - [28640, 32, 1, 32]
    - [8, 11.406]
  - - [23712, 32, 1, 32]
    - [8, 9.945]
  - - [8512, 64, 1, 64]
    - [81, 14.504]
  - - [36960, 32, 1, 32]
    - [116, 12.915]
  - - [3584, 128, 1, 128]
    - [14, 20.06]
  - - [17856, 64, 1, 64]
    - [112, 22.154]
  - - [18528, 96, 1, 96]
    - [54, 33.028]
  - - [12624, 48, 1, 48]
    - [9, 11.678]
  - - [29440, 66, 1, 66]
    - [17, 21.431]
  - - [1216, 64, 1, 64]
    - [99, 2.053]
  - - [31824, 48, 1, 48]
    - [9, 16.628]
  - - [38752, 32, 1, 32]
    - [54, 13.298]
  - - [36154, 58, 1, 66]
    - [9, 27.617]
  - - [3296, 32, 1, 32]
    - [2, 1.794]
  - - [10208, 32, 1, 32]
    - [169, 4.228]
  - - [1024, 30, 1, 36]
    - [148, 0.496]
  - - [7132, 30, 1, 36]
    - [5, 3.456]
  - - [15040, 64, 1, 64]
    - [8, 20.973]
  - - [11808, 96, 1, 96]
    - [59, 29.549]
  - - [18432, 66, 1, 66]
    - [25, 21.266]
  - - [29120, 64, 1, 64]
    - [14, 28.696]
  - - [31488, 48, 1, 48]
    - [9, 17.588]
  - - [23866, 58, 1, 66]
    - [19, 23.581]
  - - [816, 48, 1, 48]
    - [75, 0.818]
  - - [8412, 30, 1, 36]
    - [5, 3.406]
  - - [6080, 64, 1, 64]
    - [5, 8.41]
  - - [42080, 32, 1, 32]
    - [196, 12.152]
  - - [9216, 192, 1, 192]
    - [19, 48.062]
  - - [16928, 32, 1, 32]
    - [8, 8.136]
  - - [2304, 30, 1, 36]
    - [148, 0.88]
  - - [29630, 66, 1, 66]
    - [27, 21.334]
  - - [32476, 30, 1, 36]
    - [170, 9.072]
  - - [18234, 58, 1, 66]
    - [112, 17.664]
  - - [33744, 48, 1, 48]
    - [160, 21.106]
  - - [24336, 48, 1, 48]
    - [19, 17.121]
  - - [36896, 32, 1, 32]
    - [61, 9.059]
  - - [2304, 96, 1, 96]
    - [5, 7.354]
  - - [8894, 66, 1, 66]
    - [8, 14.061]
  - - [24816, 48, 1, 48]
    - [19, 17.114]
  - - [40156, 30, 1, 36]
    - [93, 13.087]
  - - [25856, 30, 1, 36]
    - [136, 10.623]
  - - [28448, 32, 1, 32]
    - [8, 11.37]
  - - [32096, 32, 1, 32]
    - [140, 9.757]
  - - [7994, 58, 1, 66]
    - [8, 12.088]
  - - [9376, 32, 1, 32]
    - [8, 4.877]
  - - [32288, 32, 1, 32]
    - [237, 12.056]
  - - [40448, 58, 1, 66]
    - [9, 24.019]
  - - [4224, 96, 1, 96]
    - [72, 15.369]
  - - [10992, 48, 1, 48]
    - [5, 10.656]
  - - [32446, 66, 1, 66]
    - [17, 21.788]
  - - [6912, 48, 1, 48]
    - [52, 7.499]
  - - [43776, 58, 1, 66]
    - [20, 27.287]
  - - [30618, 30, 1, 36]
    - [19, 8.779]
  - - [18432, 96, 1, 96]
    - [131, 30.427]
  - - [23136, 96, 1, 96]
    - [40, 36.955]
  - - [320, 64, 1, 64]
    - [16, 0.572]
  - - [10972, 30, 1, 36]
    - [5, 4.822]
  - - [27648, 58, 1, 66]
    - [19, 25.576]
  - - [7872, 64, 1, 64]
    - [8, 13.619]
  - - [19936, 32, 1, 32]
    - [8, 7.007]
  - - [21146, 30, 1, 36]
    - [38, 7.599]
  - - [16384, 124, 1, 132]
    - [185, 39.657]
  - - [36960, 96, 1, 96]
    - [234, 39.585]
  - - [44032, 66, 1, 66]
    - [82, 29.953]
  - - [28124, 30, 1, 36]
    - [8, 11.27]
  - - [40464, 48, 1, 48]
    - [94, 20.111]
  - - [13216, 32, 1, 32]
    - [8, 5.6]
  - - [4992, 96, 1, 96]
    - [8, 18.258]
  - - [1024, 124, 1, 132]
    - [5, 4.714]
  - - [42288, 48, 1, 48]
    - [138, 19.987]
  - - [25488, 48, 1, 48]
    - [142, 16.015]
  - - [16896, 66, 1, 66]
    - [54, 19.897]
  - - [2144, 32, 1, 32]
    - [99, 1.013]
  - - [22272, 96, 1, 96]
    - [99, 32.531]
  - - [7168, 124, 1, 132]
    - [9, 31.343]
  - - [18944, 128, 1, 128]
    - [98, 44.309]
  - - [3774, 66, 1, 66]
    - [58, 6.9]
  - - [24864, 96, 1, 96]
    - [27, 33.599]
  - - [8256, 64, 1, 64]
    - [8, 11.355]
  - - [11952, 48, 1, 48]
    - [9, 11.277]
  - - [3328, 128, 1, 128]
    - [8, 19.847]
  - - [30266, 58, 1, 66]
    - [19, 25.734]
  - - [36316, 30, 1, 36]
    - [8, 12.609]
  - - [6810, 30, 1, 36]
    - [5, 3.639]
  - - [14144, 64, 1, 64]
    - [8, 20.034]
  - - [22176, 32, 1, 32]
    - [8, 7.755]
  - - [29184, 124, 1, 132]
    - [102, 49.512]
  - - [42144, 96, 1, 96]
    - [8, 39.583]
  - - [43008, 128, 1, 128]
    - [29, 52.478]
  - - [26938, 58, 1, 66]
    - [19, 23.408]
  - - [18368, 64, 1, 64]
    - [9, 23.058]
  - - [6528, 192, 1, 192]
    - [146, 44.783]
  - - [38160, 48, 1, 48]
    - [8, 20.082]
  - - [39792, 48, 1, 48]
    - [9, 18.163]
  - - [12288, 48, 1, 48]
    - [117, 10.379]
  - - [27648, 192, 1, 192]
    - [23, 61.691]
  - - [1536, 128, 1, 128]
    - [8, 7.429]
  - - [14624, 32, 1, 32]
    - [132, 6.911]
  - - [1680, 48, 1, 48]
    - [2, 1.333]
  - - [16032, 96, 1, 96]
    - [59, 31.314]
  - - [23004, 30, 1, 36]
    - [8, 10.368]
  - - [35376, 48, 1, 48]
    - [9, 20.083]
  - - [38144, 30, 1, 36]
    - [59, 13.542]
  - - [35328, 66, 1, 66]
    - [17, 23.651]
  - - [1376, 32, 1, 32]
    - [16, 0.654]
  - - [2816, 66, 1, 66]
    - [71, 5.156]
  - - [3072, 66, 1, 66]
    - [8, 5.421]
  - - [38400, 66, 1, 66]
    - [17, 26.679]
  - - [10528, 32, 1, 32]
    - [8, 4.844]
  - - [15360, 30, 1, 36]
    - [8, 6.104]
  - - [41216, 66, 1, 66]
    - [210, 24.768]
  - - [29376, 64, 1, 64]
    - [105, 25.991]
  - - [23760, 48, 1, 48]
    - [160, 16.272]
  - - [31452, 30, 1, 36]
    - [190, 10.613]
  - - [35584, 30, 1, 36]
    - [162, 12.902]
  - - [10688, 64, 1, 64]
    - [106, 14.037]
  - - [42192, 48, 1, 48]
    - [14, 20.46]
  - - [12912, 48, 1, 48]
    - [9, 10.769]
  - - [29952, 128, 1, 128]
    - [39, 47.114]
  - - [6144, 58, 1, 66]
    - [8, 8.435]
  - - [2592, 32, 1, 32]
    - [16, 1.011]
  - - [32416, 32, 1, 32]
    - [95, 9.521]
  - - [20480, 128, 1, 128]
    - [20, 38.371]
  - - [35292, 30, 1, 36]
    - [87, 10.673]
  - - [2136, 30, 1, 36]
    - [54, 1.027]
  - - [7680, 96, 1, 96]
    - [9, 22.878]
  - - [29886, 66, 1, 66]
    - [205, 23.923]
  - - [31904, 32, 1, 32]
    - [71, 9.929]
  - - [16728, 30, 1, 36]
    - [8, 7.486]
  - - [5856, 96, 1, 96]
    - [8, 16.421]
  - - [26368, 30, 1, 36]
    - [140, 9.008]
  - - [43488, 96, 1, 96]
    - [47, 42.559]
  - - [19610, 30, 1, 36]
    - [8, 7.786]
  - - [37632, 66, 1, 66]
    - [74, 28.245]
  - - [480, 96, 1, 96]
    - [148, 1.549]
  - - [13008, 48, 1, 48]
    - [5, 10.644]
  - - [40250, 58, 1, 66]
    - [8, 25.286]
  - - [38496, 32, 1, 32]
    - [8, 11.755]
  - - [42624, 48, 1, 48]
    - [9, 22.418]
  - - [31040, 64, 1, 64]
    - [107, 26.721]
  - - [11488, 32, 1, 32]
    - [8, 5.928]
  - - [17664, 30, 1, 36]
    - [8, 8.604]
  - - [5720, 30, 1, 36]
    - [21, 2.928]
  - - [9984, 48, 1, 48]
    - [8, 9.422]
  - - [24192, 192, 1, 192]
    - [14, 54.129]
  - - [5852, 30, 1, 36]
    - [5, 3.074]
  - - [23232, 64, 1, 64]
    - [220, 24.823]
  - - [35840, 124, 1, 132]
    - [78, 43.175]
  - - [13056, 30, 1, 36]
    - [9, 6.101]
  - - [12192, 96, 1, 96]
    - [144, 29.837]
  - - [19168, 32, 1, 32]
    - [8, 8.272]
  - - [34656, 32, 1, 32]
    - [134, 10.161]
  - - [13872, 48, 1, 48]
    - [8, 12.253]
  - - [31488, 192, 1, 192]
    - [94, 59.788]
  - - [18080, 32, 1, 32]
    - [8, 8.369]
  - - [38064, 48, 1, 48]
    - [14, 18.024]
  - - [43728, 48, 1, 48]
    - [145, 22.099]
  - - [2304, 48, 1, 48]
    - [10, 2.075]
  - - [39072, 96, 1, 96]
    - [82, 38.853]
  - - [30272, 64, 1, 64]
    - [6, 29.041]
  - - [22272, 192, 1, 192]
    - [160, 54.433]
  - - [9274, 58, 1, 66]
    - [8, 12.957]
  - - [4096, 30, 1, 36]
    - [162, 1.569]
  - - [43352, 30, 1, 36]
    - [190, 14.759]
  - - [30336, 48, 1, 48]
    - [117, 21.918]
  - - [22616, 30, 1, 36]
    - [8, 7.638]
  - - [528, 48, 1, 48]
    - [2, 0.534]
  - - [5088, 96, 1, 96]
    - [134, 18.175]
  - - [12320, 32, 1, 32]
    - [16, 6.139]
  - - [18288, 48, 1, 48]
    - [3, 14.264]
  - - [38720, 64, 1, 64]
    - [94, 29.098]
  - - [15580, 30, 1, 36]
    - [8, 6.206]
  - - [13312, 30, 1, 36]
    - [8, 5.216]
  - - [21818, 58, 1, 66]
    - [168, 23.719]
  - - [10810, 58, 1, 66]
    - [52, 14.616]
  - - [11168, 32, 1, 32]
    - [8, 5.507]
  - - [27648, 30, 1, 36]
    - [54, 11.167]
  - - [28416, 96, 1, 96]
    - [17, 42.048]
  - - [17376, 32, 1, 32]
    - [8, 6.731]
  - - [9504, 32, 1, 32]
    - [8, 4.854]
  - - [43776, 96, 1, 96]
    - [17, 41.873]
  - - [5376, 58, 1, 66]
    - [5, 9.505]
  - - [34720, 32, 1, 32]
    - [76, 11.378]
  - - [5208, 30, 1, 36]
    - [5, 2.097]
  - - [17904, 48, 1, 48]
    - [9, 14.951]
  - - [11872, 32, 1, 32]
    - [8, 5.889]
  - - [5760, 96, 1, 96]
    - [8, 18.504]
  - - [29664, 32, 1, 32]
    - [8, 9.579]
  - - [32768, 128, 1, 128]
    - [237, 39.961]
  - - [16698, 58, 1, 66]
    - [9, 16.364]
  - - [2202, 30, 1, 36]
    - [8, 0.913]
  - - [32160, 32, 1, 32]
    - [115, 10.846]
  - - [9280, 64, 1, 64]
    - [5, 13.857]
  - - [18432, 48, 1, 48]
    - [9, 14.095]
  - - [40924, 30, 1, 36]
    - [59, 14.156]
  - - [36000, 96, 1, 96]
    - [85, 40.444]
  - - [25344, 124, 1, 132]
    - [14, 50.153]
  - - [9984, 124, 1, 132]
    - [9, 35.67]
  - - [34320, 48, 1, 48]
    - [231, 18.24]
  - - [24192, 96, 1, 96]
    - [27, 35.65]
  - - [43152, 48, 1, 48]
    - [14, 19.197]
  - - [30496, 32, 1, 32]
    - [24, 11.915]
  - - [16128, 58, 1, 66]
    - [112, 19.13]
  - - [13440, 48, 1, 48]
    - [108, 9.774]
  - - [13020, 30, 1, 36]
    - [12, 5.557]
  - - [344, 30, 1, 36]
    - [16, 0.137]
  - - [7614, 66, 1, 66]
    - [21, 10.481]
  - - [22462, 66, 1, 66]
    - [86, 22.869]
  - - [38590, 66, 1, 66]
    - [121, 25.156]
  - - [31832, 30, 1, 36]
    - [14, 10.118]
  - - [3504, 48, 1, 48]
    - [5, 4.0]
  - - [12800, 30, 1, 36]
    - [132, 5.498]
  - - [30208, 58, 1, 66]
    - [14, 24.542]
  - - [10650, 30, 1, 36]
    - [8, 5.316]
  - - [28352, 64, 1, 64]
    - [3, 28.556]
  - - [33840, 48, 1, 48]
    - [14, 19.231]
  - - [26112, 58, 1, 66]
    - [19, 24.652]
  - - [33594, 58, 1, 66]
    - [94, 25.266]
  - - [18528, 32, 1, 32]
    - [8, 8.165]
  - - [22272, 58, 1, 66]
    - [9, 22.811]
  - - [29344, 32, 1, 32]
    - [56, 11.201]
  - - [21456, 48, 1, 48]
    - [9, 14.077]
  - - [2448, 48, 1, 48]
    - [8, 2.447]
  - - [30976, 128, 1, 128]
    - [102, 45.62]
  - - [25776, 48, 1, 48]
    - [86, 15.563]
  - - [44288, 58, 1, 66]
    - [94, 28.431]
  - - [27868, 30, 1, 36]
    - [8, 10.4]
  - - [16160, 32, 1, 32]
    - [8, 6.714]
  - - [10752, 66, 1, 66]
    - [59, 15.995]
  - - [8448, 124, 1, 132]
    - [24, 32.784]
  - - [4128, 32, 1, 32]
    - [5, 2.026]
  - - [23552, 30, 1, 36]
    - [8, 8.693]
  - - [42864, 48, 1, 48]
    - [9, 22.715]
  - - [31456, 32, 1, 32]
    - [168, 11.48]
  - - [30040, 30, 1, 36]
    - [115, 11.061]
  - - [11834, 58, 1, 66]
    - [8, 15.951]
  - - [5408, 32, 1, 32]
    - [5, 2.914]
  - - [18880, 64, 1, 64]
    - [50, 23.252]
  - - [40032, 96, 1, 96]
    - [81, 39.066]
  - - [6298, 30, 1, 36]
    - [5, 3.018]
  - - [17496, 30, 1, 36]
    - [8, 8.211]
  - - [1392, 48, 1, 48]
    - [2, 1.482]
  - - [6912, 58, 1, 66]
    - [72, 11.287]
  - - [4000, 32, 1, 32]
    - [99, 1.848]
  - - [16860, 30, 1, 36]
    - [8, 6.639]
  - - [31232, 124, 1, 132]
    - [143, 37.825]
  - - [31328, 32, 1, 32]
    - [3, 9.189]
  - - [28672, 128, 1, 128]
    - [107, 48.207]
  - - [26112, 66, 1, 66]
    - [142, 23.355]
  - - [25344, 128, 1, 128]
    - [232, 48.1]
  - - [10072, 30, 1, 36]
    - [8, 5.18]
  - - [34272, 96, 1, 96]
    - [133, 43.381]
  - - [34816, 30, 1, 36]
    - [141, 11.496]
  - - [40192, 66, 1, 66]
    - [53, 25.091]
  - - [12256, 32, 1, 32]
    - [8, 6.263]
  - - [24920, 30, 1, 36]
    - [81, 9.477]
  - - [33696, 32, 1, 32]
    - [162, 10.441]
  - - [44186, 30, 1, 36]
    - [8, 13.543]
  - - [14160, 48, 1, 48]
    - [8, 12.945]
  - - [13056, 66, 1, 66]
    - [21, 17.597]
  - - [31056, 48, 1, 48]
    - [166, 14.944]
  - - [13824, 124, 1, 132]
    - [19, 41.463]
  - - [29594, 30, 1, 36]
    - [8, 11.336]
  - - [35840, 128, 1, 128]
    - [60, 42.298]
  - - [19770, 58, 1, 66]
    - [9, 20.62]
  - - [20670, 66, 1, 66]
    - [17, 19.927]
  - - [13152, 96, 1, 96]
    - [49, 31.031]
  - - [10716, 30, 1, 36]
    - [5, 4.696]
  - - [42650, 30, 1, 36]
    - [50, 11.876]
  - - [8160, 96, 1, 96]
    - [8, 21.431]
  - - [17616, 48, 1, 48]
    - [112, 13.098]
  - - [44128, 32, 1, 32]
    - [3, 11.768]
  - - [20784, 48, 1, 48]
    - [9, 14.841]
  - - [23808, 128, 1, 128]
    - [164, 44.942]
  - - [12480, 64, 1, 64]
    - [14, 17.391]
  - - [7168, 128, 1, 128]
    - [29, 29.456]
  - - [30720, 128, 1, 128]
    - [203, 46.85]
  - - [25856, 124, 1, 132]
    - [15, 51.706]
  - - [4608, 192, 1, 192]
    - [177, 40.623]
  - - [2208, 96, 1, 96]
    - [16, 9.084]
  - - [12032, 30, 1, 36]
    - [16, 6.083]
  - - [18776, 30, 1, 36]
    - [181, 6.56]
  - - [24288, 96, 1, 96]
    - [27, 34.105]
  - - [2976, 32, 1, 32]
    - [0, 1.315]
  - - [7440, 48, 1, 48]
    - [8, 7.64]
  - - [27120, 48, 1, 48]
    - [76, 17.05]
  - - [28704, 96, 1, 96]
    - [133, 39.457]
  - - [23772, 30, 1, 36]
    - [158, 9.905]
  - - [19872, 32, 1, 32]
    - [8, 6.115]
  - - [3386, 58, 1, 66]
    - [88, 5.827]
  - - [40536, 30, 1, 36]
    - [87, 14.065]
  - - [4128, 96, 1, 96]
    - [8, 15.401]
  - - [22272, 128, 1, 128]
    - [9, 51.124]
  - - [15904, 32, 1, 32]
    - [108, 6.559]
  - - [3840, 96, 1, 96]
    - [8, 14.19]
  - - [14688, 96, 1, 96]
    - [27, 33.082]
  - - [5120, 124, 1, 132]
    - [5, 25.09]
  - - [17696, 32, 1, 32]
    - [8, 7.26]
  - - [37600, 32, 1, 32]
    - [8, 12.097]
  - - [42912, 32, 1, 32]
    - [168, 13.511]
  - - [240, 48, 1, 48]
    - [5, 0.196]
  - - [6144, 48, 1, 48]
    - [8, 5.398]
  - - [10752, 124, 1, 132]
    - [198, 34.588]
  - - [14234, 30, 1, 36]
    - [8, 7.108]
  - - [24890, 58, 1, 66]
    - [19, 23.16]
  - - [37824, 64, 1, 64]
    - [14, 28.401]
  - - [10048, 64, 1, 64]
    - [5, 12.908]
  - - [13276, 30, 1, 36]
    - [5, 5.28]
  - - [43776, 30, 1, 36]
    - [142, 13.763]
  - - [14544, 48, 1, 48]
    - [89, 12.165]
  - - [42720, 96, 1, 96]
    - [49, 43.283]
  - - [12576, 32, 1, 32]
    - [8, 6.015]
  - - [41728, 30, 1, 36]
    - [99, 13.756]
  - - [41536, 64, 1, 64]
    - [107, 32.026]
  - - [6656, 124, 1, 132]
    - [5, 29.373]
  - - [30684, 30, 1, 36]
    - [8, 12.334]
  - - [6176, 32, 1, 32]
    - [2, 3.478]
  - - [34750, 66, 1, 66]
    - [25, 24.904]
  - - [3216, 48, 1, 48]
    - [8, 3.052]
  - - [4992, 48, 1, 48]
    - [5, 4.152]
  - - [38688, 32, 1, 32]
    - [54, 12.653]
  - - [31584, 32, 1, 32]
    - [75, 11.729]
  - - [1248, 96, 1, 96]
    - [2, 5.179]
  - - [6202, 58, 1, 66]
    - [5, 9.96]
  - - [40800, 32, 1, 32]
    - [238, 13.835]
  - - [36160, 64, 1, 64]
    - [14, 31.836]
  - - [39552, 48, 1, 48]
    - [9, 21.537]
  - - [2560, 128, 1, 128]
    - [8, 14.88]
  - - [9406, 66, 1, 66]
    - [99, 14.455]
  - - [8640, 64, 1, 64]
    - [8, 14.385]
  - - [28576, 32, 1, 32]
    - [8, 11.165]
  - - [16128, 124, 1, 132]
    - [225, 39.859]
  - - [1200, 48, 1, 48]
    - [2, 1.156]
  - - [20992, 30, 1, 36]
    - [8, 7.521]
  - - [14490, 30, 1, 36]
    - [8, 5.693]
  - - [10304, 64, 1, 64]
    - [8, 15.694]
  - - [5792, 32, 1, 32]
    - [21, 2.642]
  - - [12800, 124, 1, 132]
    - [19, 39.77]
  - - [14592, 30, 1, 36]
    - [8, 6.945]
  - - [24064, 66, 1, 66]
    - [14, 19.754]
  - - [18400, 32, 1, 32]
    - [88, 8.618]
  - - [26720, 32, 1, 32]
    - [159, 10.98]
  - - [14138, 58, 1, 66]
    - [8, 17.144]
  - - [25534, 66, 1, 66]
    - [21, 19.775]
  - - [15424, 64, 1, 64]
    - [227, 19.692]
  - - [15504, 48, 1, 48]
    - [9, 12.132]
  - - [19200, 66, 1, 66]
    - [46, 22.498]
  - - [19424, 32, 1, 32]
    - [134, 9.001]
  - - [31536, 48, 1, 48]
    - [9, 18.592]
  - - [11776, 124, 1, 132]
    - [19, 32.949]
  - - [41984, 128, 1, 128]
    - [107, 52.119]
  - - [24352, 32, 1, 32]
    - [99, 7.769]
  - - [128, 1, 1, 128]
    - [2, 0.006]
  - - [1408, 64, 1, 64]
    - [8, 1.932]
  - - [26240, 16, 1, 16]
    - [8, 3.288]
  - - [29952, 16, 1, 16]
    - [115, 3.593]
  - - [14208, 32, 1, 32]
    - [8, 7.096]
  - - [1152, 64, 1, 64]
    - [5, 1.967]
  - - [14720, 16, 1, 16]
    - [97, 1.945]
  - - [35072, 64, 1, 64]
    - [20, 32.036]
  - - [41472, 32, 1, 32]
    - [230, 10.553]
  - - [36992, 32, 1, 32]
    - [3, 10.808]
  - - [33792, 32, 1, 32]
    - [54, 12.553]
  - - [39296, 64, 1, 64]
    - [45, 26.605]
  - - [39552, 16, 1, 16]
    - [127, 3.87]
  - - [27136, 64, 1, 64]
    - [88, 23.653]
  - - [2944, 32, 1, 32]
    - [69, 1.203]
  - - [42752, 32, 1, 32]
    - [8, 11.766]
  - - [30848, 64, 1, 64]
    - [101, 29.415]
  - - [23936, 16, 1, 16]
    - [8, 2.986]
  - - [38272, 32, 1, 32]
    - [8, 12.688]
  - - [34816, 16, 1, 16]
    - [3, 3.361]
  - - [17920, 32, 1, 32]
    - [8, 7.153]
  - - [23424, 64, 1, 64]
    - [6, 23.228]
  - - [15488, 16, 1, 16]
    - [75, 2.04]
  - - [19456, 64, 1, 64]
    - [14, 23.53]
  - - [27392, 16, 1, 16]
    - [8, 2.926]
  - - [30976, 32, 1, 32]
    - [3, 10.166]
  - - [23168, 64, 1, 64]
    - [71, 25.49]
  - - [30592, 32, 1, 32]
    - [54, 9.85]
  - - [36608, 64, 1, 64]
    - [14, 29.428]
  - - [18944, 16, 1, 16]
    - [16, 2.369]
  - - [30720, 32, 1, 32]
    - [8, 10.054]
  - - [32384, 16, 1, 16]
    - [238, 3.52]
  - - [13952, 32, 1, 32]
    - [71, 7.048]
  - - [44288, 16, 1, 16]
    - [14, 4.121]
  - - [3840, 64, 1, 64]
    - [106, 7.437]
  - - [40064, 64, 1, 64]
    - [14, 30.286]
  - - [10624, 32, 1, 32]
    - [5, 5.354]
  - - [39424, 32, 1, 32]
    - [8, 12.961]
  - - [16256, 64, 1, 64]
    - [38, 20.073]
  - - [26752, 32, 1, 32]
    - [74, 6.606]
  - - [36608, 16, 1, 16]
    - [199, 2.898]
  - - [21376, 16, 1, 16]
    - [167, 2.683]
  - - [23552, 32, 1, 32]
    - [8, 10.244]
  - - [29056, 64, 1, 64]
    - [18, 27.899]
  - - [29312, 16, 1, 16]
    - [8, 3.106]
  - - [43648, 32, 1, 32]
    - [99, 14.458]
  - - [33280, 64, 1, 64]
    - [14, 26.861]
  - - [11520, 16, 1, 16]
    - [235, 1.322]
  - - [2560, 16, 1, 16]
    - [5, 0.297]
  - - [19840, 32, 1, 32]
    - [8, 9.093]
  - - [17664, 64, 1, 64]
    - [99, 18.845]
  - - [8192, 16, 1, 16]
    - [74, 1.125]
  - - [40448, 32, 1, 32]
    - [38, 14.231]
  - - [35968, 32, 1, 32]
    - [88, 11.734]
  - - [9216, 64, 1, 64]
    - [14, 14.445]
  - - [768, 16, 1, 16]
    - [99, 0.079]
  - - [1792, 64, 1, 64]
    - [5, 3.082]
  - - [33280, 16, 1, 16]
    - [115, 3.644]
  - - [26112, 64, 1, 64]
    - [54, 26.275]
  - - [42240, 16, 1, 16]
    - [8, 4.323]
  - - [14336, 32, 1, 32]
    - [56, 5.425]
  - - [29824, 64, 1, 64]
    - [14, 26.989]
  - - [10624, 16, 1, 16]
    - [2, 1.465]
  - - [41344, 32, 1, 32]
    - [170, 11.538]
  - - [14592, 64, 1, 64]
    - [12, 18.19]
  - - [17408, 16, 1, 16]
    - [99, 1.513]
  - - [4608, 32, 1, 32]
    - [16, 1.926]
  - - [4864, 32, 1, 32]
    - [5, 2.029]
  - - [128, 32, 1, 32]
    - [2, 0.055]
  - - [26368, 16, 1, 16]
    - [170, 2.473]
  - - [38144, 32, 1, 32]
    - [8, 11.583]
  - - [22144, 64, 1, 64]
    - [3, 24.206]
  - - [896, 32, 1, 32]
    - [99, 0.349]
  - - [31488, 64, 1, 64]
    - [14, 25.046]
  - - [1536, 16, 1, 16]
    - [99, 0.199]
  - - [2432, 64, 1, 64]
    - [8, 3.721]
  - - [35456, 16, 1, 16]
    - [174, 3.096]
  - - [8832, 32, 1, 32]
    - [75, 3.572]
  - - [6656, 64, 1, 64]
    - [5, 11.223]
  - - [4992, 64, 1, 64]
    - [71, 9.08]
  - - [22272, 32, 1, 32]
    - [8, 7.65]
  - - [26752, 64, 1, 64]
    - [54, 27.28]
  - - [3456, 16, 1, 16]
    - [5, 0.509]
  - - [14336, 16, 1, 16]
    - [5, 1.378]
  - - [30208, 32, 1, 32]
    - [129, 9.634]
  - - [19328, 64, 1, 64]
    - [9, 20.315]
  - - [27776, 16, 1, 16]
    - [94, 2.58]
  - - [15360, 64, 1, 64]
    - [9, 19.6]
  - - [6912, 16, 1, 16]
    - [5, 0.889]
  - - [26880, 32, 1, 32]
    - [8, 10.189]
  - - [2688, 64, 1, 64]
    - [8, 4.224]
  - - [20352, 16, 1, 16]
    - [8, 2.346]
  - - [26496, 32, 1, 32]
    - [8, 9.083]
  - - [31232, 16, 1, 16]
    - [190, 2.98]
  - - [43008, 32, 1, 32]
    - [61, 14.846]
  - - [11648, 64, 1, 64]
    - [14, 18.143]
  - - [11904, 16, 1, 16]
    - [9, 1.599]
  - - [38528, 16, 1, 16]
    - [8, 4.163]
  - - [13696, 64, 1, 64]
    - [52, 19.923]
  - - [19584, 64, 1, 64]
    - [240, 22.7]
  - - [33152, 16, 1, 16]
    - [72, 3.247]
  - - [39296, 32, 1, 32]
    - [54, 13.475]
  - - [2560, 32, 1, 32]
    - [99, 1.026]
  - - [28544, 64, 1, 64]
    - [14, 28.411]
  - - [24704, 16, 1, 16]
    - [99, 3.131]
  - - [6272, 32, 1, 32]
    - [5, 3.338]
  - - [4096, 64, 1, 64]
    - [16, 7.892]
  - - [32512, 16, 1, 16]
    - [53, 3.757]
  - - [36480, 64, 1, 64]
    - [14, 32.49]
  - - [896, 16, 1, 16]
    - [115, 0.115]
  - - [2304, 16, 1, 16]
    - [137, 0.303]
  - - [13056, 64, 1, 64]
    - [70, 15.171]
  - - [7680, 16, 1, 16]
    - [211, 1.059]
  - - [19456, 32, 1, 32]
    - [8, 8.774]
  - - [41344, 64, 1, 64]
    - [6, 28.938]
  - - [28416, 32, 1, 32]
    - [88, 11.736]
  - - [23168, 32, 1, 32]
    - [81, 10.467]
  - - [20736, 16, 1, 16]
    - [2, 2.011]
  - - [9856, 16, 1, 16]
    - [181, 0.979]
  - - [20224, 32, 1, 32]
    - [92, 6.561]
  - - [29952, 64, 1, 64]
    - [232, 29.578]
  - - [4096, 16, 1, 16]
    - [5, 0.607]
  - - [36352, 32, 1, 32]
    - [53, 13.065]
  - - [17280, 64, 1, 64]
    - [62, 22.068]
  - - [21504, 64, 1, 64]
    - [62, 21.43]
  - - [8832, 64, 1, 64]
    - [241, 11.593]
  - - [34688, 16, 1, 16]
    - [8, 3.597]
  - - [16384, 32, 1, 32]
    - [72, 7.128]
  - - [18048, 16, 1, 16]
    - [24, 1.851]
  - - [5632, 64, 1, 64]
    - [16, 10.218]
  - - [21760, 16, 1, 16]
    - [132, 2.775]
  - - [7808, 32, 1, 32]
    - [167, 4.146]
  - - [25728, 64, 1, 64]
    - [18, 23.584]
  - - [6528, 16, 1, 16]
    - [16, 0.806]
  - - [4480, 32, 1, 32]
    - [5, 2.318]
  - - [29696, 16, 1, 16]
    - [8, 3.208]
  - - [512, 32, 1, 32]
    - [69, 0.263]
  - - [42880, 64, 1, 64]
    - [172, 31.243]
  - - [14464, 16, 1, 16]
    - [8, 1.913]
  - - [28800, 32, 1, 32]
    - [8, 11.727]
  - - [43264, 16, 1, 16]
    - [3, 4.115]
  - - [2048, 64, 1, 64]
    - [56, 2.734]
  - - [5888, 16, 1, 16]
    - [69, 0.633]
  - - [43776, 32, 1, 32]
    - [170, 13.864]
  - - [1664, 64, 1, 64]
    - [58, 2.806]
  - - [13184, 32, 1, 32]
    - [106, 6.486]
  - - [11008, 64, 1, 64]
    - [8, 17.292]
  - - [13824, 16, 1, 16]
    - [8, 1.909]
  - - [31104, 64, 1, 64]
    - [3, 27.798]
  - - [18944, 64, 1, 64]
    - [50, 23.962]
  - - [7936, 32, 1, 32]
    - [158, 4.023]
  - - [34560, 32, 1, 32]
    - [99, 11.704]
  - - [22656, 64, 1, 64]
    - [54, 24.063]
  - - [15744, 16, 1, 16]
    - [8, 2.058]
  - - [27904, 64, 1, 64]
    - [3, 25.837]
  - - [26624, 16, 1, 16]
    - [18, 2.824]
  - - [42496, 32, 1, 32]
    - [82, 11.883]
  - - [15232, 64, 1, 64]
    - [54, 21.109]
  - - [7296, 16, 1, 16]
    - [137, 1.046]
  - - [38016, 32, 1, 32]
    - [196, 12.359]
  - - [44032, 64, 1, 64]
    - [84, 32.704]
  - - [19200, 16, 1, 16]
    - [99, 2.536]
  - - [22784, 32, 1, 32]
    - [88, 10.032]
  - - [14976, 64, 1, 64]
    - [88, 21.012]
  - - [22400, 32, 1, 32]
    - [8, 7.781]
  - - [28416, 64, 1, 64]
    - [3, 24.544]
  - - [10752, 16, 1, 16]
    - [5, 1.491]
  - - [22528, 32, 1, 32]
    - [8, 10.016]
  - - [23936, 64, 1, 64]
    - [3, 23.89]
  - - [24192, 16, 1, 16]
    - [50, 2.909]
  - - [38528, 32, 1, 32]
    - [8, 12.752]
  - - [3584, 64, 1, 64]
    - [8, 5.959]
  - - [36096, 16, 1, 16]
    - [8, 3.791]
  - - [13824, 64, 1, 64]
    - [8, 19.873]
  - - [31872, 64, 1, 64]
    - [57, 28.844]
  - - [35200, 32, 1, 32]
    - [144, 12.632]
  - - [41216, 64, 1, 64]
    - [94, 28.987]
  - - [40832, 64, 1, 64]
    - [134, 31.372]
  - - [4224, 16, 1, 16]
    - [129, 0.669]
  - - [18560, 32, 1, 32]
    - [8, 7.852]
  - - [16384, 64, 1, 64]
    - [22, 20.973]
  - - [28416, 16, 1, 16]
    - [8, 3.567]
  - - [23808, 32, 1, 32]
    - [71, 10.209]
  - - [13184, 16, 1, 16]
    - [8, 1.891]
  - - [27520, 32, 1, 32]
    - [8, 9.292]
  - - [36352, 16, 1, 16]
    - [237, 3.512]
  - - [35456, 32, 1, 32]
    - [24, 13.175]
  - - [25088, 64, 1, 64]
    - [194, 26.641]
  - - [12416, 16, 1, 16]
    - [8, 1.677]
  - - [13568, 16, 1, 16]
    - [8, 1.63]
  - - [20608, 64, 1, 64]
    - [14, 25.393]
  - - [44416, 32, 1, 32]
    - [3, 12.84]
  - - [42240, 64, 1, 64]
    - [20, 33.549]
  - - [13184, 64, 1, 64]
    - [146, 16.795]
  - - [38016, 16, 1, 16]
    - [50, 3.176]
  - - [27776, 32, 1, 32]
    - [8, 10.548]
  - - [33792, 64, 1, 64]
    - [94, 30.292]
  - - [20736, 32, 1, 32]
    - [61, 9.069]
  - - [4736, 64, 1, 64]
    - [5, 8.697]
  - - [41728, 32, 1, 32]
    - [54, 14.508]
  - - [26368, 64, 1, 64]
    - [8, 24.834]
  - - [25088, 16, 1, 16]
    - [8, 3.255]
  - - [12288, 32, 1, 32]
    - [8, 4.598]
  - - [5504, 64, 1, 64]
    - [8, 7.252]
  - - [44672, 32, 1, 32]
    - [89, 12.227]
  - - [1280, 16, 1, 16]
    - [2, 0.179]
  - - [6912, 32, 1, 32]
    - [9, 3.542]
  - - [2432, 16, 1, 16]
    - [99, 0.302]
  - - [33152, 32, 1, 32]
    - [8, 11.388]
  - - [6400, 64, 1, 64]
    - [8, 11.402]
  - - [9216, 16, 1, 16]
    - [54, 1.294]
  - - [29184, 32, 1, 32]
    - [75, 11.203]
  - - [22400, 64, 1, 64]
    - [14, 25.736]
  - - [10368, 16, 1, 16]
    - [5, 1.491]
  - - [14336, 64, 1, 64]
    - [9, 17.033]
  - - [23296, 64, 1, 64]
    - [241, 24.856]
  - - [37888, 32, 1, 32]
    - [158, 11.854]
  - - [33408, 32, 1, 32]
    - [74, 12.407]
  - - [31232, 64, 1, 64]
    - [14, 28.52]
  - - [768, 64, 1, 64]
    - [16, 1.19]
  - - [18560, 64, 1, 64]
    - [51, 21.523]
  - - [28032, 16, 1, 16]
    - [8, 3.052]
  - - [42368, 32, 1, 32]
    - [8, 12.559]
  - - [40192, 64, 1, 64]
    - [112, 32.278]
  - - [38912, 16, 1, 16]
    - [99, 3.247]
  - - [22016, 32, 1, 32]
    - [24, 9.86]
  - - [11136, 64, 1, 64]
    - [8, 17.163]
  - - [17536, 32, 1, 32]
    - [112, 6.855]
  - - [39936, 64, 1, 64]
    - [14, 28.224]
  - - [31488, 16, 1, 16]
    - [59, 3.507]
  - - [18688, 32, 1, 32]
    - [8, 8.004]
  - - [27264, 64, 1, 64]
    - [3, 27.499]
  - - [18304, 32, 1, 32]
    - [88, 6.527]
  - - [7936, 64, 1, 64]
    - [5, 12.601]
  - - [2048, 32, 1, 32]
    - [8, 0.845]
  - - [3456, 64, 1, 64]
    - [8, 5.179]
  - - [36480, 16, 1, 16]
    - [8, 3.357]
  - - [15616, 16, 1, 16]
    - [8, 2.002]
  - - [7296, 64, 1, 64]
    - [5, 13.008]
  - - [44160, 64, 1, 64]
    - [14, 34.411]
  - - [20736, 64, 1, 64]
    - [199, 24.256]
  - - [7168, 16, 1, 16]
    - [8, 1.031]
  - - [27136, 32, 1, 32]
    - [8, 9.523]
  - - [20352, 64, 1, 64]
    - [9, 24.451]
  - - [16512, 16, 1, 16]
    - [8, 2.134]
  - - [30848, 32, 1, 32]
    - [2, 8.955]
  - - [24320, 16, 1, 16]
    - [8, 2.892]
  - - [19712, 32, 1, 32]
    - [198, 7.792]
  - - [6400, 16, 1, 16]
    - [5, 0.681]
  - - [25472, 16, 1, 16]
    - [8, 2.503]
  - - [39808, 32, 1, 32]
    - [83, 12.106]
  - - [37632, 64, 1, 64]
    - [26, 32.05]
  - - [32256, 16, 1, 16]
    - [239, 3.207]
  - - [44032, 32, 1, 32]
    - [75, 15.174]
  - - [33152, 64, 1, 64]
    - [107, 29.513]
  - - [640, 16, 1, 16]
    - [115, 0.08]
  - - [4480, 16, 1, 16]
    - [5, 0.663]
  - - [16512, 64, 1, 64]
    - [99, 21.161]
  - - [9600, 16, 1, 16]
    - [8, 1.367]
  - - [21760, 64, 1, 64]
    - [194, 23.548]
  - - [44800, 128, 1, 128]
    - [14, 53.686]
  - - [41856, 64, 1, 64]
    - [94, 30.364]
  - - [13312, 64, 1, 64]
    - [9, 19.679]
  - - [16640, 32, 1, 32]
    - [51, 7.62]
  - - [33408, 64, 1, 64]
    - [30, 26.567]
  - - [38656, 64, 1, 64]
    - [131, 26.083]
  - - [4608, 16, 1, 16]
    - [137, 0.577]
  - - [40960, 32, 1, 32]
    - [196, 12.947]
  - - [44544, 128, 1, 128]
    - [60, 51.241]
  - - [40576, 32, 1, 32]
    - [71, 11.715]
  - - [384, 32, 1, 32]
    - [8, 0.185]
  - - [18688, 64, 1, 64]
    - [99, 23.167]
  - - [25088, 32, 1, 32]
    - [167, 10.082]
  - - [34688, 64, 1, 64]
    - [20, 30.559]
  - - [39040, 16, 1, 16]
    - [8, 3.723]
  - - [20608, 32, 1, 32]
    - [8, 8.895]
  - - [42240, 32, 1, 32]
    - [8, 11.56]
  - - [37760, 32, 1, 32]
    - [85, 13.036]
  - - [35584, 64, 1, 64]
    - [3, 32.112]
  - - [38400, 16, 1, 16]
    - [22, 4.025]
  - - [17408, 32, 1, 32]
    - [8, 7.837]
  - - [22912, 64, 1, 64]
    - [14, 24.715]
  - - [23168, 16, 1, 16]
    - [8, 3.013]
  - - [10368, 32, 1, 32]
    - [3, 4.966]
  - - [26368, 32, 1, 32]
    - [72, 11.223]
  - - [25344, 32, 1, 32]
    - [159, 9.559]
  - - [21888, 32, 1, 32]
    - [8, 8.494]
  - - [18432, 16, 1, 16]
    - [2, 2.297]
  - - [44544, 96, 1, 96]
    - [133, 44.747]
  - - [29824, 32, 1, 32]
    - [51, 10.836]
  - - [20224, 64, 1, 64]
    - [9, 21.99]
  - - [16000, 16, 1, 16]
    - [99, 1.765]
  - - [28160, 64, 1, 64]
    - [18, 28.458]
  - - [27904, 16, 1, 16]
    - [31, 2.942]
  - - [2304, 64, 1, 64]
    - [2, 4.499]
  - - [23680, 64, 1, 64]
    - [18, 24.763]
  - - [37248, 16, 1, 16]
    - [45, 3.116]
  - - [33024, 64, 1, 64]
    - [94, 29.261]
  - - [23040, 32, 1, 32]
    - [3, 8.389]
  - - [28800, 16, 1, 16]
    - [8, 3.122]
  - - [40960, 64, 1, 64]
    - [14, 32.52]
  - - [20224, 16, 1, 16]
    - [8, 2.596]
  - - [40576, 64, 1, 64]
    - [172, 30.56]
  - - [12928, 16, 1, 16]
    - [8, 1.777]
  - - [27264, 32, 1, 32]
    - [118, 8.985]
  - - [16896, 64, 1, 64]
    - [146, 21.338]
  - - [11776, 16, 1, 16]
    - [8, 1.673]
  - - [5120, 16, 1, 16]
    - [5, 0.736]
  - - [3456, 32, 1, 32]
    - [137, 1.665]
  - - [1280, 64, 1, 64]
    - [16, 2.269]
  - - [24064, 32, 1, 32]
    - [19, 8.322]
  - - [37760, 64, 1, 64]
    - [110, 28.199]
  - - [19584, 32, 1, 32]
    - [8, 9.024]
  - - [29312, 64, 1, 64]
    - [3, 29.002]
  - - [38784, 16, 1, 16]
    - [8, 3.54]
  - - [16896, 16, 1, 16]
    - [8, 1.846]
  - - [36864, 32, 1, 32]
    - [61, 13.348]
  - - [30080, 64, 1, 64]
    - [82, 28.187]
  - - [17152, 32, 1, 32]
    - [8, 7.049]
  - - [36480, 32, 1, 32]
    - [8, 12.371]
  - - [9728, 64, 1, 64]
    - [5, 15.462]
  - - [25856, 16, 1, 16]
    - [8, 3.234]
  - - [8704, 32, 1, 32]
    - [8, 4.341]
  - - [13440, 64, 1, 64]
    - [112, 16.488]
  - - [24960, 32, 1, 32]
    - [72, 7.791]
  - - [1024, 16, 1, 16]
    - [115, 0.116]
  - - [34944, 16, 1, 16]
    - [142, 3.085]
  - - [38912, 64, 1, 64]
    - [94, 29.373]
  - - [9984, 16, 1, 16]
    - [8, 1.483]
  - - [21760, 32, 1, 32]
    - [132, 9.757]
  - - [5760, 64, 1, 64]
    - [106, 10.705]
  - - [43904, 16, 1, 16]
    - [35, 4.187]
  - - [15104, 64, 1, 64]
    - [161, 20.223]
  - - [29696, 32, 1, 32]
    - [8, 11.569]
  - - [19072, 16, 1, 16]
    - [56, 1.924]
  - - [12416, 64, 1, 64]
    - [9, 14.986]
  - - [5888, 32, 1, 32]
    - [16, 3.13]
  - - [10368, 64, 1, 64]
    - [3, 16.157]
  - - [34176, 32, 1, 32]
    - [190, 8.641]
  - - [32000, 64, 1, 64]
    - [78, 28.656]
  - - [13824, 32, 1, 32]
    - [217, 5.812]
  - - [2944, 64, 1, 64]
    - [56, 4.372]
  - - [11392, 16, 1, 16]
    - [9, 1.61]
  - - [42112, 32, 1, 32]
    - [136, 13.315]
  - - [10496, 32, 1, 32]
    - [8, 4.761]
  - - [3968, 16, 1, 16]
    - [21, 0.499]
  - - [10112, 32, 1, 32]
    - [8, 3.791]
  - - [32512, 64, 1, 64]
    - [14, 28.013]
  - - [14848, 16, 1, 16]
    - [8, 1.845]
  - - [26624, 32, 1, 32]
    - [8, 11.425]
  - - [42624, 32, 1, 32]
    - [35, 14.607]
  - - [40448, 64, 1, 64]
    - [94, 32.228]
  - - [40192, 16, 1, 16]
    - [82, 3.987]
  - - [14208, 64, 1, 64]
    - [5, 19.692]
  - - [3200, 64, 1, 64]
    - [8, 4.8]
  - - [16768, 16, 1, 16]
    - [69, 2.164]
  - - [22912, 32, 1, 32]
    - [8, 9.572]
  - - [256, 16, 1, 16]
    - [24, 0.031]
  - - [12160, 64, 1, 64]
    - [13, 18.546]
  - - [8320, 16, 1, 16]
    - [52, 0.888]
  - - [16128, 16, 1, 16]
    - [8, 1.921]
  - - [44288, 32, 1, 32]
    - [86, 12.098]
  - - [20096, 64, 1, 64]
    - [62, 19.885]
  - - [31616, 32, 1, 32]
    - [16, 8.659]
  - - [3072, 32, 1, 32]
    - [99, 1.483]
  - - [24960, 64, 1, 64]
    - [6, 22.591]
  - - [768, 32, 1, 32]
    - [115, 0.357]
  - - [6784, 32, 1, 32]
    - [52, 3.503]
  - - [4352, 16, 1, 16]
    - [21, 0.665]
  - - [6272, 16, 1, 16]
    - [5, 0.87]
  - - [41088, 64, 1, 64]
    - [107, 29.205]
  - - [34176, 16, 1, 16]
    - [54, 3.679]
  - - [23296, 32, 1, 32]
    - [8, 8.646]
  - - [13568, 64, 1, 64]
    - [9, 18.107]
  - - [8448, 16, 1, 16]
    - [5, 1.248]
  - - [19968, 32, 1, 32]
    - [167, 9.048]
  - - [896, 64, 1, 64]
    - [8, 1.383]
  - - [42112, 16, 1, 16]
    - [20, 3.817]
  - - [5120, 64, 1, 64]
    - [8, 9.467]
  - - [41216, 32, 1, 32]
    - [22, 13.484]
  - - [18304, 16, 1, 16]
    - [31, 2.256]
  - - [40832, 32, 1, 32]
    - [8, 11.853]
  - - [30464, 64, 1, 64]
    - [8, 26.789]
  - - [29184, 16, 1, 16]
    - [8, 3.744]
  - - [42368, 64, 1, 64]
    - [20, 33.367]
  - - [1664, 16, 1, 16]
    - [16, 0.221]
  - - [32384, 32, 1, 32]
    - [125, 10.22]
  - - [44544, 64, 1, 64]
    - [3, 32.523]
  - - [5376, 16, 1, 16]
    - [21, 0.625]
  - - [4224, 32, 1, 32]
    - [5, 2.138]
  - - [9344, 64, 1, 64]
    - [8, 14.799]
  - - [43264, 64, 1, 64]
    - [203, 34.989]
  - - [13312, 16, 1, 16]
    - [8, 1.859]
  - - [26496, 64, 1, 64]
    - [14, 23.564]
  - - [12416, 32, 1, 32]
    - [106, 5.869]
  - - [34048, 32, 1, 32]
    - [2, 10.223]
  - - [39808, 16, 1, 16]
    - [64, 4.121]
  - - [41984, 32, 1, 32]
    - [8, 12.636]
  - - [14720, 64, 1, 64]
    - [99, 18.06]
  - - [37504, 32, 1, 32]
    - [99, 10.921]
  - - [33536, 32, 1, 32]
    - [118, 11.657]
  - - [2560, 64, 1, 64]
    - [2, 4.114]
  - - [4096, 32, 1, 32]
    - [58, 2.126]
  - - [18176, 32, 1, 32]
    - [24, 7.387]
  - - [6272, 64, 1, 64]
    - [8, 11.706]
  - - [11520, 64, 1, 64]
    - [8, 18.829]
  - - [10240, 16, 1, 16]
    - [9, 1.086]
  - - [26112, 32, 1, 32]
    - [8, 8.541]
  - - [21632, 32, 1, 32]
    - [24, 8.477]
  - - [27648, 64, 1, 64]
    - [105, 27.251]
  - - [2816, 16, 1, 16]
    - [99, 0.323]
  - - [6400, 32, 1, 32]
    - [16, 3.614]
  - - [11008, 32, 1, 32]
    - [31, 5.053]
  - - [6016, 32, 1, 32]
    - [69, 2.429]
  - - [12032, 64, 1, 64]
    - [235, 13.181]
  - - [6144, 32, 1, 32]
    - [179, 2.123]
  - - [7552, 64, 1, 64]
    - [88, 9.761]
  - - [7808, 16, 1, 16]
    - [81, 1.061]
  - - [22144, 32, 1, 32]
    - [54, 9.041]
  - - [19712, 16, 1, 16]
    - [8, 2.456]
  - - [10240, 64, 1, 64]
    - [167, 16.508]
  - - [15488, 64, 1, 64]
    - [53, 19.738]
  - - [29056, 16, 1, 16]
    - [181, 3.43]
  - - [18816, 32, 1, 32]
    - [75, 8.283]
  - - [24832, 64, 1, 64]
    - [19, 23.314]
  - - [44032, 16, 1, 16]
    - [14, 3.442]
  - - [24448, 64, 1, 64]
    - [143, 25.216]
  - - [2176, 32, 1, 32]
    - [148, 0.956]
  - - [15104, 32, 1, 32]
    - [8, 5.566]
