library/src/blas3/Tensile/Logic/asm_full/arcturus/arcturus_Cijk_Ailk_Bljk_BSS_BH.yaml
- {MinimumRequiredVersion: 4.23.0}
- arcturus
- gfx908
- [Device 7380, Device 7388, Device 738c, Device 7390]
    SolutionIndex: 0
    SolutionNameMin: Cijk_Ailk_Bljk_BSS_BH_MT128x96x32_MI32x32x4x1_SE_1LDSB0_AF0EM8_GRVW4_GSU1_LBSPP128_LPB4_LRVW4_NLCA1_PLR9_SU32_SUS128_SRVW4_TT1_96_WG128_2_1_WGM15
    SolutionIndex: 1
    SolutionNameMin: Cijk_Ailk_Bljk_BSS_BH_MT128x128x32_MI32x32x4x1_SE_1LDSB0_AF0EM8_GRVW8_GSU1_LBSPP128_LPB8_LRVW4_NLCA1_PLR9_SU0_SUS128_SRVW4_TT2_64_WG64_4_1_WGM1
    SolutionIndex: 2
    SolutionNameMin: Cijk_Ailk_Bljk_BSS_BH_MT64x128x32_MI32x32x4x1_SE_1LDSB0_AF0EM1_GRVW8_GSU1_LBSPP128_LPB8_LRVW4_NLCA1_PLR9_SU0_SUS256_SRVW4_TT1_64_WG64_4_1_WGM15
    SolutionIndex: 3
    SolutionNameMin: Cijk_Ailk_Bljk_BSS_BH_MT64x128x64_MI32x32x2x2_SE_1LDSB0_AF0EM4_GRVW8_GSU1_LBSPP128_LPB8_LRVW2_NLCA1_PLR1_SU16_SUS128_SRVW4_TT1_32_WG64_4_1_WGM1
    SolutionIndex: 4
    SolutionNameMin: Cijk_Ailk_Bljk_BSS_BH_MT32x64x128_MI16x16x8x1_SE_1LDSB0_AF0EM1_GRVW8_GSU1_LBSPP256_LPB8_LRVW2_NLCA1_PLR1_SU16_SUS256_SRVW0_TT1_32_WG32_8_1_WGM15
    SolutionIndex: 5
    SolutionNameMin: Cijk_Ailk_Bljk_BSS_BH_MT128x144x32_MI16x16x8x1_SE_1LDSB1_AF0EM8_GRVW2_GSU1_LBSPP128_LPB4_LRVW4_NLCA1_PLR5_SU0_SUS128_SRVW4_TT2_144_WG64_4_1_WGM2
    SolutionIndex: 6
    SolutionNameMin: Cijk_Ailk_Bljk_BSS_BH_MT128x256x32_MI32x32x4x1_SE_1LDSB0_AF0EM8_GRVW8_GSU1_LBSPP128_LPB8_LRVW4_NLCA1_PLR9_SU32_SUS128_SRVW4_TT2_128_WG64_4_1_WGM2
    SolutionIndex: 7
    SolutionNameMin: Cijk_Ailk_Bljk_BSS_BH_MT128x64x64_MI32x32x4x1_SE_1LDSB0_AF0EM4_GRVW4_GSU1_LBSPP128_LPB4_LRVW2_NLCA1_PLR1_SU0_SUS256_SRVW4_TT2_32_WG64_4_1_WGM1
    SolutionIndex: 8
    SolutionNameMin: Cijk_Ailk_Bljk_BSS_BH_MT32x32x32_MI16x16x8x1_SE_1LDSB0_AF0EM4_GRVW8_GSU1_LBSPP128_LPB8_LRVW2_NLCA1_PLR1_SU0_SUS256_SRVW0_TT1_16_WG32_8_1_WGM1
    SolutionIndex: 9
    SolutionNameMin: Cijk_Ailk_Bljk_BSS_BH_MT128x144x32_MI16x16x8x1_SE_1LDSB1_AF0EM8_GRVW2_GSU1_LBSPP128_LPB4_LRVW4_NLCA1_PLR5_SU0_SUS256_SRVW4_TT2_144_WG64_4_1_WGM1
    SolutionIndex: 10
    SolutionNameMin: Cijk_Ailk_Bljk_BSS_BH_MT128x96x32_MI32x32x4x1_SE_1LDSB0_AF0EM4_GRVW2_GSU1_LBSPP128_LPB2_LRVW2_NLCA1_PLR1_SU16_SUS128_SRVW4_TT1_96_WG128_2_1_WGM2
    SolutionIndex: 11
    SolutionNameMin: Cijk_Ailk_Bljk_BSS_BH_MT128x80x64_MI16x16x8x1_SE_1LDSB0_AF0EM4_GRVW2_GSU1_LBSPP128_LPB2_LRVW2_NLCA1_PLR1_SU0_SUS128_SRVW4_TT2_80_WG64_4_1_WGM15
    SolutionIndex: 12
    SolutionNameMin: Cijk_Ailk_Bljk_BSS_BH_MT32x64x64_MI16x16x8x1_SE_1LDSB0_AF0EM1_GRVW8_GSU1_LBSPP128_LPB8_LRVW2_NLCA1_PLR1_SU16_SUS256_SRVW0_TT1_32_WG32_8_1_WGM15
    SolutionIndex: 13
    SolutionNameMin: Cijk_Ailk_Bljk_BSS_BH_MT64x80x64_MI16x16x8x1_SE_1LDSB0_AF0EM4_GRVW2_GSU1_LBSPP128_LPB2_LRVW2_NLCA1_PLR1_SU16_SUS256_SRVW0_TT1_80_WG64_4_1_WGM15
    SolutionIndex: 14
    SolutionNameMin: Cijk_Ailk_Bljk_BSS_BH_MT64x16x32_MI16x16x8x1_SE_1LDSB0_AF0EM8_GRVW4_GSU1_LBSPP128_LPB4_LRVW4_NLCA1_PLR5_SU0_SUS256_SRVW0_TT1_16_WG64_4_1_WGM1
    SolutionIndex: 15
    SolutionNameMin: Cijk_Ailk_Bljk_BSS_BH_MT32x32x128_MI16x16x8x1_SE_1LDSB0_AF0EM1_GRVW8_GSU1_LBSPP256_LPB8_LRVW2_NLCA1_PLR1_SU16_SUS256_SRVW0_TT1_16_WG32_8_1_WGM1
    SolutionIndex: 16
    SolutionNameMin: Cijk_Ailk_Bljk_BSS_BH_MT32x32x64_MI16x16x8x1_SE_1LDSB0_AF0EM4_GRVW4_GSU1_LBSPP128_LPB4_LRVW2_NLCA1_PLR1_SU0_SUS128_SRVW0_TT1_16_WG32_8_1_WGM1
    SolutionIndex: 17
    SolutionNameMin: Cijk_Ailk_Bljk_BSS_BH_MT32x32x128_MI16x16x8x1_SE_1LDSB0_AF0EM4_GRVW8_GSU1_LBSPP256_LPB8_LRVW2_NLCA1_PLR1_SU0_SUS256_SRVW4_TT1_16_WG32_8_1_WGM1
    SolutionIndex: 18
    SolutionNameMin: Cijk_Ailk_Bljk_BSS_BH_MT128x96x32_MI32x32x4x1_SE_1LDSB0_AF0EM8_GRVW4_GSU15_LBSPP128_LPB4_LRVW4_NLCA1_PLR9_SU0_SUS256_SRVW0_TT1_96_WG128_2_1_WGM15
    SolutionIndex: 19
    SolutionNameMin: Cijk_Ailk_Bljk_BSS_BH_MT64x32x32_MI16x16x8x1_SE_1LDSB0_AF0EM4_GRVW2_GSU1_LBSPP128_LPB2_LRVW2_NLCA1_PLR1_SU0_SUS256_SRVW0_TT2_16_WG32_8_1_WGM15
    SolutionIndex: 20
    SolutionNameMin: Cijk_Ailk_Bljk_BSS_BH_MT64x128x64_MI32x32x4x1_SE_1LDSB0_AF0EM4_GRVW4_GSU1_LBSPP128_LPB4_LRVW2_NLCA1_PLR1_SU0_SUS256_SRVW4_TT1_64_WG64_4_1_WGM1
    SolutionIndex: 21
    SolutionNameMin: Cijk_Ailk_Bljk_BSS_BH_MT64x80x64_MI16x16x8x1_SE_1LDSB0_AF0EM4_GRVW2_GSU1_LBSPP128_LPB2_LRVW2_NLCA1_PLR1_SU16_SUS256_SRVW4_TT1_80_WG64_4_1_WGM15
    SolutionIndex: 22
    SolutionNameMin: Cijk_Ailk_Bljk_BSS_BH_MT64x32x32_MI16x16x8x1_SE_1LDSB0_AF0EM1_GRVW4_GSU1_LBSPP128_LPB4_LRVW4_NLCA1_PLR5_SU0_SUS256_SRVW4_TT2_16_WG32_8_1_WGM15
    SolutionIndex: 23
    SolutionNameMin: Cijk_Ailk_Bljk_BSS_BH_MT96x96x32_MI16x16x8x1_SE_1LDSB1_AF0EM8_GRVW4_GSU1_LBSPP128_LPB4_LRVW4_NLCA3_PLR5_SU0_SUS256_SRVW0_TT3_48_WG32_8_1_WGM1
    SolutionIndex: 24
    SolutionNameMin: Cijk_Ailk_Bljk_BSS_BH_MT128x96x32_MI32x32x4x1_SE_1LDSB0_AF0EM4_GRVW4_GSU1_LBSPP128_LPB4_LRVW2_NLCA1_PLR1_SU16_SUS128_SRVW4_TT1_96_WG128_2_1_WGM2
    SolutionIndex: 25
    SolutionNameMin: Cijk_Ailk_Bljk_BSS_BH_MT144x128x32_MI16x16x8x1_SE_1LDSB0_AF0EM8_GRVW2_GSU1_LBSPP128_LPB4_LRVW4_NLCA9_PLR5_SU0_SUS256_SRVW0_TT9_32_WG16_16_1_WGM2
    SolutionIndex: 26
    SolutionNameMin: Cijk_Ailk_Bljk_BSS_BH_MT32x32x32_MI16x16x8x1_SE_1LDSB0_AF0EM4_GRVW8_GSU1_LBSPP128_LPB8_LRVW2_NLCA1_PLR1_SU32_SUS128_SRVW0_TT1_16_WG32_8_1_WGM15
    SolutionIndex: 27
    SolutionNameMin: Cijk_Ailk_Bljk_BSS_BH_MT64x32x32_MI16x16x8x1_SE_1LDSB0_AF0EM8_GRVW2_GSU1_LBSPP128_LPB4_LRVW4_NLCA1_PLR5_SU0_SUS256_SRVW4_TT2_16_WG32_8_1_WGM1
    SolutionIndex: 28
    SolutionNameMin: Cijk_Ailk_Bljk_BSS_BH_MT32x32x32_MI16x16x8x1_SE_1LDSB0_AF0EM4_GRVW8_GSU1_LBSPP128_LPB8_LRVW2_NLCA1_PLR1_SU0_SUS128_SRVW0_TT1_16_WG32_8_1_WGM2
    SolutionIndex: 29
    SolutionNameMin: Cijk_Ailk_Bljk_BSS_BH_MT32x64x64_MI16x16x8x1_SE_1LDSB0_AF0EM8_GRVW4_GSU1_LBSPP128_LPB4_LRVW4_NLCA1_PLR9_SU0_SUS128_SRVW4_TT1_32_WG32_8_1_WGM15
    SolutionIndex: 30
    SolutionNameMin: Cijk_Ailk_Bljk_BSS_BH_MT32x32x64_MI16x16x8x1_SE_1LDSB0_AF0EM1_GRVW8_GSU1_LBSPP128_LPB8_LRVW2_NLCA1_PLR1_SU0_SUS128_SRVW0_TT1_16_WG32_8_1_WGM1
    SolutionIndex: 31
    SolutionNameMin: Cijk_Ailk_Bljk_BSS_BH_MT32x32x64_MI16x16x8x1_SE_1LDSB0_AF0EM8_GRVW8_GSU1_LBSPP128_LPB8_LRVW4_NLCA1_PLR9_SU32_SUS128_SRVW4_TT1_16_WG32_8_1_WGM15
    SolutionIndex: 32
    SolutionNameMin: Cijk_Ailk_Bljk_BSS_BH_MT64x256x32_MI32x32x4x1_SE_1LDSB0_AF0EM8_GRVW8_GSU7_LBSPP128_LPB8_LRVW4_NLCA1_PLR9_SU0_SUS256_SRVW0_TT1_128_WG64_4_1_WGM15
    SolutionIndex: 33
    SolutionNameMin: Cijk_Ailk_Bljk_BSS_BH_MT64x80x32_MI16x16x8x1_SE_1LDSB0_AF0EM4_GRVW2_GSU1_LBSPP128_LPB2_LRVW2_NLCA1_PLR1_SU32_SUS256_SRVW4_TT1_80_WG64_4_1_WGM1
    SolutionIndex: 34
    SolutionNameMin: Cijk_Ailk_Bljk_BSS_BH_MT128x80x64_MI16x16x8x1_SE_1LDSB0_AF0EM4_GRVW2_GSU1_LBSPP128_LPB2_LRVW2_NLCA1_PLR1_SU16_SUS128_SRVW0_TT2_80_WG64_4_1_WGM15
    SolutionIndex: 35
    SolutionNameMin: Cijk_Ailk_Bljk_BSS_BH_MT64x32x32_MI16x16x8x1_SE_1LDSB0_AF0EM4_GRVW4_GSU1_LBSPP128_LPB4_LRVW2_NLCA1_PLR1_SU16_SUS128_SRVW0_TT2_16_WG32_8_1_WGM2
    SolutionIndex: 36
    SolutionNameMin: Cijk_Ailk_Bljk_BSS_BH_MT128x96x32_MI32x32x4x1_SE_1LDSB0_AF0EM4_GRVW4_GSU1_LBSPP128_LPB4_LRVW2_NLCA1_PLR1_SU0_SUS256_SRVW4_TT1_96_WG128_2_1_WGM15
    SolutionIndex: 37
    SolutionNameMin: Cijk_Ailk_Bljk_BSS_BH_MT128x96x64_MI32x32x4x1_SE_1LDSB0_AF0EM4_GRVW8_GSU1_LBSPP128_LPB8_LRVW2_NLCA1_PLR1_SU0_SUS256_SRVW0_TT1_96_WG128_2_1_WGM15
    SolutionIndex: 38
    SolutionNameMin: Cijk_Ailk_Bljk_BSS_BH_MT128x96x32_MI32x32x4x1_SE_1LDSB0_AF0EM4_GRVW4_GSU1_LBSPP128_LPB4_LRVW2_NLCA1_PLR1_SU32_SUS128_SRVW4_TT1_96_WG128_2_1_WGM2
    SolutionIndex: 39
    SolutionNameMin: Cijk_Ailk_Bljk_BSS_BH_MT128x96x32_MI32x32x4x1_SE_1LDSB0_AF0EM4_GRVW4_GSU1_LBSPP128_LPB4_LRVW2_NLCA1_PLR1_SU0_SUS256_SRVW4_TT1_96_WG128_2_1_WGM1
    SolutionIndex: 40
    SolutionNameMin: Cijk_Ailk_Bljk_BSS_BH_MT64x32x32_MI16x16x8x1_SE_1LDSB0_AF0EM1_GRVW4_GSU1_LBSPP128_LPB4_LRVW4_NLCA1_PLR5_SU0_SUS128_SRVW4_TT2_16_WG32_8_1_WGM2
    SolutionIndex: 41
    SolutionNameMin: Cijk_Ailk_Bljk_BSS_BH_MT32x32x32_MI16x16x8x1_SE_1LDSB0_AF0EM4_GRVW2_GSU1_LBSPP128_LPB2_LRVW2_NLCA1_PLR1_SU16_SUS256_SRVW0_TT1_16_WG32_8_1_WGM1
    SolutionIndex: 42
    SolutionNameMin: Cijk_Ailk_Bljk_BSS_BH_MT32x32x64_MI16x16x8x1_SE_1LDSB0_AF0EM8_GRVW8_GSU1_LBSPP128_LPB8_LRVW4_NLCA1_PLR9_SU32_SUS128_SRVW4_TT1_16_WG32_8_1_WGM1
    SolutionIndex: 43
    SolutionNameMin: Cijk_Ailk_Bljk_BSS_BH_MT64x128x64_MI32x32x4x1_SE_1LDSB0_AF0EM8_GRVW8_GSU1_LBSPP128_LPB8_LRVW4_NLCA1_PLR17_SU0_SUS256_SRVW4_TT1_64_WG64_4_1_WGM15
    SolutionIndex: 44
    SolutionNameMin: Cijk_Ailk_Bljk_BSS_BH_MT128x160x32_MI32x32x4x1_SE_1LDSB0_AF0EM8_GRVW4_GSU3_LBSPP128_LPB4_LRVW4_NLCA1_PLR9_SU0_SUS128_SRVW0_TT1_160_WG128_2_1_WGM15
    SolutionIndex: 45
    SolutionNameMin: Cijk_Ailk_Bljk_BSS_BH_MT64x32x32_MI16x16x8x1_SE_1LDSB0_AF0EM4_GRVW2_GSU1_LBSPP128_LPB2_LRVW2_NLCA1_PLR1_SU0_SUS128_SRVW0_TT2_16_WG32_8_1_WGM1
    SolutionIndex: 46
    SolutionNameMin: Cijk_Ailk_Bljk_BSS_BH_MT64x128x32_MI32x32x4x1_SE_1LDSB0_AF0EM4_GRVW8_GSU1_LBSPP128_LPB8_LRVW2_NLCA1_PLR1_SU0_SUS128_SRVW4_TT1_64_WG64_4_1_WGM1
    SolutionIndex: 47
    SolutionNameMin: Cijk_Ailk_Bljk_BSS_BH_MT96x96x64_MI16x16x8x1_SE_1LDSB1_AF0EM8_GRVW8_GSU1_LBSPP128_LPB8_LRVW4_NLCA3_PLR9_SU0_SUS256_SRVW0_TT3_48_WG32_8_1_WGM1
    SolutionIndex: 48
    SolutionNameMin: Cijk_Ailk_Bljk_BSS_BH_MT128x96x32_MI32x32x4x1_SE_1LDSB0_AF0EM8_GRVW2_GSU1_LBSPP128_LPB4_LRVW4_NLCA1_PLR9_SU32_SUS256_SRVW4_TT1_96_WG128_2_1_WGM2
    SolutionIndex: 49
    SolutionNameMin: Cijk_Ailk_Bljk_BSS_BH_MT64x80x32_MI16x16x8x1_SE_1LDSB0_AF0EM4_GRVW2_GSU1_LBSPP128_LPB2_LRVW2_NLCA1_PLR1_SU0_SUS256_SRVW4_TT1_80_WG64_4_1_WGM1
    SolutionIndex: 50
    SolutionNameMin: Cijk_Ailk_Bljk_BSS_BH_MT64x32x32_MI16x16x8x1_SE_1LDSB0_AF0EM4_GRVW2_GSU1_LBSPP128_LPB2_LRVW2_NLCA1_PLR1_SU0_SUS128_SRVW0_TT2_16_WG32_8_1_WGM2
    SolutionIndex: 51
    SolutionNameMin: Cijk_Ailk_Bljk_BSS_BH_MT32x32x128_MI16x16x8x1_SE_1LDSB0_AF0EM4_GRVW8_GSU1_LBSPP256_LPB8_LRVW2_NLCA1_PLR1_SU0_SUS256_SRVW0_TT1_16_WG32_8_1_WGM15
    SolutionIndex: 52
    SolutionNameMin: Cijk_Ailk_Bljk_BSS_BH_MT64x64x64_MI32x32x4x1_SE_1LDSB0_AF0EM4_GRVW8_GSU1_LBSPP128_LPB8_LRVW2_NLCA1_PLR1_SU0_SUS256_SRVW4_TT1_32_WG64_4_1_WGM1
    SolutionIndex: 53
    SolutionNameMin: Cijk_Ailk_Bljk_BSS_BH_MT128x160x32_MI32x32x4x1_SE_1LDSB0_AF0EM8_GRVW4_GSU15_LBSPP128_LPB4_LRVW4_NLCA1_PLR9_SU0_SUS256_SRVW0_TT1_160_WG128_2_1_WGM2
    SolutionIndex: 54
    SolutionNameMin: Cijk_Ailk_Bljk_BSS_BH_MT128x80x32_MI16x16x8x1_SE_1LDSB0_AF0EM4_GRVW2_GSU1_LBSPP128_LPB2_LRVW2_NLCA1_PLR1_SU0_SUS128_SRVW4_TT2_80_WG64_4_1_WGM1
    SolutionIndex: 55
    SolutionNameMin: Cijk_Ailk_Bljk_BSS_BH_MT128x144x32_MI16x16x8x1_SE_1LDSB0_AF0EM1_GRVW2_GSU1_LBSPP128_LPB2_LRVW2_NLCA1_PLR1_SU0_SUS128_SRVW4_TT2_144_WG64_4_1_WGM15
    SolutionIndex: 56
    SolutionNameMin: Cijk_Ailk_Bljk_BSS_BH_MT128x144x32_MI16x16x8x1_SE_1LDSB0_AF0EM1_GRVW2_GSU1_LBSPP128_LPB2_LRVW2_NLCA1_PLR1_SU0_SUS128_SRVW0_TT2_144_WG64_4_1_WGM15
    SolutionIndex: 57
    SolutionNameMin: Cijk_Ailk_Bljk_BSS_BH_MT32x32x32_MI16x16x8x1_SE_1LDSB0_AF0EM4_GRVW4_GSU1_LBSPP128_LPB4_LRVW2_NLCA1_PLR1_SU0_SUS256_SRVW0_TT1_16_WG32_8_1_WGM1
    SolutionIndex: 58
    SolutionNameMin: Cijk_Ailk_Bljk_BSS_BH_MT32x32x128_MI16x16x8x1_SE_1LDSB0_AF0EM4_GRVW8_GSU1_LBSPP256_LPB8_LRVW2_NLCA1_PLR1_SU16_SUS256_SRVW0_TT1_16_WG32_8_1_WGM15
    SolutionIndex: 59
    SolutionNameMin: Cijk_Ailk_Bljk_BSS_BH_MT64x128x64_MI32x32x4x1_SE_1LDSB0_AF0EM4_GRVW4_GSU1_LBSPP128_LPB4_LRVW2_NLCA1_PLR1_SU16_SUS256_SRVW4_TT1_64_WG64_4_1_WGM2
    SolutionIndex: 60
    SolutionNameMin: Cijk_Ailk_Bljk_BSS_BH_MT64x32x32_MI16x16x8x1_SE_1LDSB0_AF0EM4_GRVW4_GSU1_LBSPP128_LPB4_LRVW2_NLCA1_PLR1_SU32_SUS256_SRVW0_TT2_16_WG32_8_1_WGM1
    SolutionIndex: 61
    SolutionNameMin: Cijk_Ailk_Bljk_BSS_BH_MT128x96x32_MI32x32x4x1_SE_1LDSB0_AF0EM4_GRVW4_GSU1_LBSPP128_LPB4_LRVW2_NLCA1_PLR1_SU16_SUS256_SRVW4_TT1_96_WG128_2_1_WGM2
    SolutionIndex: 62
    SolutionNameMin: Cijk_Ailk_Bljk_BSS_BH_MT96x96x64_MI16x16x8x1_SE_1LDSB1_AF0EM8_GRVW8_GSU1_LBSPP128_LPB8_LRVW4_NLCA3_PLR9_SU0_SUS128_SRVW0_TT3_48_WG32_8_1_WGM2
    SolutionIndex: 63
    SolutionNameMin: Cijk_Ailk_Bljk_BSS_BH_MT32x32x64_MI16x16x8x1_SE_1LDSB0_AF0EM8_GRVW8_GSU3_LBSPP128_LPB8_LRVW4_NLCA1_PLR9_SU0_SUS128_SRVW0_TT1_16_WG32_8_1_WGM1
    SolutionIndex: 64
    SolutionNameMin: Cijk_Ailk_Bljk_BSS_BH_MT64x128x64_MI32x32x4x1_SE_1LDSB0_AF0EM4_GRVW8_GSU1_LBSPP128_LPB8_LRVW2_NLCA1_PLR1_SU0_SUS128_SRVW4_TT1_64_WG64_4_1_WGM2
    SolutionIndex: 65
    SolutionNameMin: Cijk_Ailk_Bljk_BSS_BH_MT128x144x32_MI16x16x8x1_SE_1LDSB1_AF0EM8_GRVW2_GSU5_LBSPP128_LPB4_LRVW4_NLCA1_PLR5_SU0_SUS128_SRVW0_TT2_144_WG64_4_1_WGM15
    SolutionIndex: 66
    SolutionNameMin: Cijk_Ailk_Bljk_BSS_BH_MT128x96x32_MI32x32x4x1_SE_1LDSB0_AF0EM4_GRVW4_GSU1_LBSPP128_LPB4_LRVW2_NLCA1_PLR1_SU0_SUS128_SRVW4_TT1_96_WG128_2_1_WGM2
    SolutionIndex: 67
    SolutionNameMin: Cijk_Ailk_Bljk_BSS_BH_MT128x96x32_MI32x32x4x1_SE_1LDSB0_AF0EM8_GRVW2_GSU1_LBSPP128_LPB4_LRVW4_NLCA1_PLR9_SU0_SUS128_SRVW4_TT1_96_WG128_2_1_WGM15
    SolutionIndex: 68
    SolutionNameMin: Cijk_Ailk_Bljk_BSS_BH_MT128x96x32_MI32x32x4x1_SE_1LDSB0_AF0EM1_GRVW4_GSU1_LBSPP128_LPB4_LRVW2_NLCA1_PLR1_SU0_SUS128_SRVW4_TT1_96_WG128_2_1_WGM15
    SolutionIndex: 69
    SolutionNameMin: Cijk_Ailk_Bljk_BSS_BH_MT32x32x128_MI16x16x8x1_SE_1LDSB0_AF0EM4_GRVW8_GSU1_LBSPP256_LPB8_LRVW2_NLCA1_PLR1_SU0_SUS256_SRVW0_TT1_16_WG32_8_1_WGM2
    SolutionIndex: 70
    SolutionNameMin: Cijk_Ailk_Bljk_BSS_BH_MT64x64x64_MI32x32x4x1_SE_1LDSB0_AF0EM4_GRVW8_GSU1_LBSPP128_LPB8_LRVW2_NLCA1_PLR1_SU16_SUS256_SRVW4_TT1_32_WG64_4_1_WGM2
    SolutionIndex: 71
    SolutionNameMin: Cijk_Ailk_Bljk_BSS_BH_MT128x144x32_MI16x16x8x1_SE_1LDSB0_AF0EM8_GRVW2_GSU5_LBSPP128_LPB4_LRVW4_NLCA1_PLR5_SU0_SUS128_SRVW0_TT2_144_WG64_4_1_WGM15
    SolutionIndex: 72
    SolutionNameMin: Cijk_Ailk_Bljk_BSS_BH_MT128x96x32_MI32x32x4x1_SE_1LDSB0_AF0EM8_GRVW4_GSU1_LBSPP128_LPB4_LRVW4_NLCA1_PLR9_SU0_SUS128_SRVW4_TT1_96_WG128_2_1_WGM2
    SolutionIndex: 73
    SolutionNameMin: Cijk_Ailk_Bljk_BSS_BH_MT128x96x32_MI32x32x4x1_SE_1LDSB0_AF0EM8_GRVW4_GSU1_LBSPP128_LPB4_LRVW4_NLCA1_PLR9_SU0_SUS128_SRVW4_TT1_96_WG128_2_1_WGM15
    SolutionIndex: 74
    SolutionNameMin: Cijk_Ailk_Bljk_BSS_BH_MT64x128x32_MI32x32x4x1_SE_1LDSB0_AF0EM8_GRVW8_GSU1_LBSPP128_LPB8_LRVW4_NLCA1_PLR9_SU32_SUS256_SRVW4_TT1_64_WG64_4_1_WGM1
    SolutionIndex: 75
    SolutionNameMin: Cijk_Ailk_Bljk_BSS_BH_MT32x32x128_MI16x16x8x1_SE_1LDSB0_AF0EM4_GRVW8_GSU1_LBSPP256_LPB8_LRVW2_NLCA1_PLR1_SU32_SUS256_SRVW0_TT1_16_WG32_8_1_WGM2
    SolutionIndex: 76
    SolutionNameMin: Cijk_Ailk_Bljk_BSS_BH_MT64x32x64_MI16x16x8x1_SE_1LDSB0_AF0EM1_GRVW4_GSU1_LBSPP128_LPB4_LRVW2_NLCA1_PLR1_SU32_SUS128_SRVW0_TT2_16_WG32_8_1_WGM1
    SolutionIndex: 77
    SolutionNameMin: Cijk_Ailk_Bljk_BSS_BH_MT128x96x64_MI32x32x4x1_SE_1LDSB0_AF0EM8_GRVW8_GSU3_LBSPP128_LPB8_LRVW4_NLCA1_PLR17_SU32_SUS128_SRVW0_TT1_96_WG128_2_1_WGM2
    SolutionIndex: 78
    SolutionNameMin: Cijk_Ailk_Bljk_BSS_BH_MT128x144x32_MI16x16x8x1_SE_1LDSB1_AF0EM8_GRVW2_GSU1_LBSPP128_LPB4_LRVW4_NLCA1_PLR5_SU32_SUS128_SRVW4_TT2_144_WG64_4_1_WGM15
    SolutionIndex: 79
    SolutionNameMin: Cijk_Ailk_Bljk_BSS_BH_MT96x96x64_MI16x16x8x1_SE_1LDSB1_AF0EM8_GRVW8_GSU1_LBSPP128_LPB8_LRVW4_NLCA3_PLR9_SU0_SUS256_SRVW0_TT3_48_WG32_8_1_WGM15
    SolutionIndex: 80
    SolutionNameMin: Cijk_Ailk_Bljk_BSS_BH_MT96x96x64_MI16x16x8x1_SE_1LDSB1_AF0EM8_GRVW8_GSU1_LBSPP128_LPB8_LRVW4_NLCA3_PLR9_SU32_SUS256_SRVW0_TT3_48_WG32_8_1_WGM15
    SolutionIndex: 81
    SolutionNameMin: Cijk_Ailk_Bljk_BSS_BH_MT128x144x32_MI16x16x8x1_SE_1LDSB1_AF0EM8_GRVW2_GSU1_LBSPP128_LPB4_LRVW4_NLCA1_PLR5_SU32_SUS256_SRVW4_TT2_144_WG64_4_1_WGM2
    SolutionIndex: 82
    SolutionNameMin: Cijk_Ailk_Bljk_BSS_BH_MT64x16x32_MI16x16x8x1_SE_1LDSB0_AF0EM8_GRVW2_GSU1_LBSPP128_LPB4_LRVW4_NLCA1_PLR5_SU0_SUS256_SRVW0_TT1_16_WG64_4_1_WGM1
    SolutionIndex: 83
    SolutionNameMin: Cijk_Ailk_Bljk_BSS_BH_MT128x160x32_MI32x32x4x1_SE_1LDSB0_AF0EM8_GRVW4_GSU15_LBSPP128_LPB4_LRVW4_NLCA1_PLR9_SU0_SUS256_SRVW0_TT1_160_WG128_2_1_WGM1
    SolutionIndex: 84
    SolutionNameMin: Cijk_Ailk_Bljk_BSS_BH_MT64x32x32_MI16x16x8x1_SE_1LDSB0_AF0EM4_GRVW2_GSU1_LBSPP128_LPB2_LRVW2_NLCA1_PLR1_SU32_SUS256_SRVW0_TT2_16_WG32_8_1_WGM1
    SolutionIndex: 85
    SolutionNameMin: Cijk_Ailk_Bljk_BSS_BH_MT32x32x64_MI16x16x8x1_SE_1LDSB0_AF0EM8_GRVW8_GSU1_LBSPP128_LPB8_LRVW4_NLCA1_PLR9_SU0_SUS128_SRVW4_TT1_16_WG32_8_1_WGM2
    SolutionIndex: 86
    SolutionNameMin: Cijk_Ailk_Bljk_BSS_BH_MT64x128x32_MI32x32x4x1_SE_1LDSB0_AF0EM1_GRVW8_GSU1_LBSPP128_LPB8_LRVW2_NLCA1_PLR1_SU32_SUS256_SRVW4_TT1_64_WG64_4_1_WGM2
    SolutionIndex: 87
    SolutionNameMin: Cijk_Ailk_Bljk_BSS_BH_MT128x80x64_MI16x16x8x1_SE_1LDSB0_AF0EM4_GRVW2_GSU1_LBSPP128_LPB2_LRVW2_NLCA1_PLR1_SU0_SUS256_SRVW0_TT2_80_WG64_4_1_WGM15
    SolutionIndex: 88
    SolutionNameMin: Cijk_Ailk_Bljk_BSS_BH_MT128x144x32_MI16x16x8x1_SE_1LDSB1_AF0EM8_GRVW2_GSU1_LBSPP128_LPB4_LRVW4_NLCA1_PLR5_SU0_SUS256_SRVW4_TT2_144_WG64_4_1_WGM15
    SolutionIndex: 89
    SolutionNameMin: Cijk_Ailk_Bljk_BSS_BH_MT96x96x32_MI16x16x8x1_SE_1LDSB1_AF0EM1_GRVW4_GSU1_LBSPP128_LPB4_LRVW4_NLCA3_PLR5_SU0_SUS256_SRVW0_TT3_48_WG32_8_1_WGM2
    SolutionIndex: 90
    SolutionNameMin: Cijk_Ailk_Bljk_BSS_BH_MT128x80x32_MI16x16x8x1_SE_1LDSB0_AF0EM4_GRVW2_GSU1_LBSPP128_LPB2_LRVW2_NLCA1_PLR1_SU32_SUS128_SRVW4_TT2_80_WG64_4_1_WGM15
    SolutionIndex: 91
    SolutionNameMin: Cijk_Ailk_Bljk_BSS_BH_MT64x32x32_MI16x16x8x1_SE_1LDSB0_AF0EM1_GRVW4_GSU1_LBSPP128_LPB4_LRVW4_NLCA1_PLR5_SU0_SUS128_SRVW4_TT2_16_WG32_8_1_WGM1
    SolutionIndex: 92
    SolutionNameMin: Cijk_Ailk_Bljk_BSS_BH_MT32x32x128_MI16x16x8x1_SE_1LDSB0_AF0EM4_GRVW4_GSU1_LBSPP256_LPB4_LRVW2_NLCA1_PLR1_SU32_SUS256_SRVW0_TT1_16_WG32_8_1_WGM15
    SolutionIndex: 93
    SolutionNameMin: Cijk_Ailk_Bljk_BSS_BH_MT128x96x32_MI32x32x4x1_SE_1LDSB0_AF0EM4_GRVW4_GSU1_LBSPP128_LPB4_LRVW2_NLCA1_PLR1_SU16_SUS128_SRVW4_TT1_96_WG128_2_1_WGM15
    SolutionIndex: 94
    SolutionNameMin: Cijk_Ailk_Bljk_BSS_BH_MT128x80x32_MI16x16x8x1_SE_1LDSB0_AF0EM4_GRVW2_GSU1_LBSPP128_LPB2_LRVW2_NLCA1_PLR1_SU16_SUS256_SRVW4_TT2_80_WG64_4_1_WGM1
    SolutionIndex: 95
    SolutionNameMin: Cijk_Ailk_Bljk_BSS_BH_MT128x144x32_MI16x16x8x1_SE_1LDSB0_AF0EM4_GRVW2_GSU1_LBSPP128_LPB2_LRVW2_NLCA1_PLR1_SU0_SUS256_SRVW4_TT2_144_WG64_4_1_WGM15
    SolutionIndex: 96
    SolutionNameMin: Cijk_Ailk_Bljk_BSS_BH_MT64x16x32_MI16x16x8x1_SE_1LDSB0_AF0EM8_GRVW4_GSU1_LBSPP128_LPB4_LRVW4_NLCA1_PLR5_SU0_SUS256_SRVW0_TT1_16_WG64_4_1_WGM2
    SolutionIndex: 97
    SolutionNameMin: Cijk_Ailk_Bljk_BSS_BH_MT128x96x32_MI32x32x4x1_SE_1LDSB0_AF0EM1_GRVW4_GSU1_LBSPP128_LPB4_LRVW4_NLCA1_PLR9_SU0_SUS256_SRVW4_TT1_96_WG128_2_1_WGM2
    SolutionIndex: 98
    SolutionNameMin: Cijk_Ailk_Bljk_BSS_BH_MT128x160x32_MI32x32x4x1_SE_1LDSB0_AF0EM1_GRVW2_GSU1_LBSPP128_LPB2_LRVW2_NLCA1_PLR1_SU0_SUS128_SRVW4_TT1_160_WG128_2_1_WGM15
    SolutionIndex: 99
    SolutionNameMin: Cijk_Ailk_Bljk_BSS_BH_MT256x160x32_MI32x32x4x1_SE_1LDSB0_AF0EM8_GRVW2_GSU1_LBSPP128_LPB4_LRVW4_NLCA2_PLR9_SU0_SUS256_SRVW4_TT2_160_WG128_2_1_WGM1
    SolutionIndex: 100
    SolutionNameMin: Cijk_Ailk_Bljk_BSS_BH_MT128x96x32_MI32x32x4x1_SE_1LDSB0_AF0EM4_GRVW4_GSU1_LBSPP128_LPB4_LRVW2_NLCA1_PLR1_SU32_SUS128_SRVW4_TT1_96_WG128_2_1_WGM15
    SolutionIndex: 101
    SolutionNameMin: Cijk_Ailk_Bljk_BSS_BH_MT128x128x32_MI32x32x4x1_SE_1LDSB0_AF0EM4_GRVW8_GSU1_LBSPP128_LPB8_LRVW2_NLCA1_PLR1_SU0_SUS256_SRVW4_TT2_64_WG64_4_1_WGM15
    SolutionIndex: 102
    SolutionNameMin: Cijk_Ailk_Bljk_BSS_BH_MT128x256x32_MI32x32x4x1_SE_1LDSB0_AF0EM4_GRVW8_GSU1_LBSPP128_LPB8_LRVW2_NLCA1_PLR1_SU0_SUS128_SRVW4_TT2_128_WG64_4_1_WGM15
    SolutionIndex: 103
    SolutionNameMin: Cijk_Ailk_Bljk_BSS_BH_MT64x128x64_MI32x32x4x1_SE_1LDSB0_AF0EM8_GRVW8_GSU1_LBSPP128_LPB8_LRVW4_NLCA1_PLR17_SU0_SUS256_SRVW4_TT1_64_WG64_4_1_WGM2
    SolutionIndex: 104
    SolutionNameMin: Cijk_Ailk_Bljk_BSS_BH_MT128x160x32_MI32x32x4x1_SE_1LDSB0_AF0EM4_GRVW2_GSU1_LBSPP128_LPB2_LRVW2_NLCA1_PLR1_SU16_SUS256_SRVW0_TT1_160_WG128_2_1_WGM2
    SolutionIndex: 105
    SolutionNameMin: Cijk_Ailk_Bljk_BSS_BH_MT128x160x32_MI32x32x4x1_SE_1LDSB0_AF0EM4_GRVW2_GSU1_LBSPP128_LPB2_LRVW2_NLCA1_PLR1_SU16_SUS128_SRVW4_TT1_160_WG128_2_1_WGM15
    SolutionIndex: 106
    SolutionNameMin: Cijk_Ailk_Bljk_BSS_BH_MT128x160x32_MI32x32x4x1_SE_1LDSB0_AF0EM8_GRVW2_GSU1_LBSPP128_LPB4_LRVW4_NLCA1_PLR9_SU32_SUS128_SRVW4_TT1_160_WG128_2_1_WGM15
    SolutionIndex: 107
    SolutionNameMin: Cijk_Ailk_Bljk_BSS_BH_MT128x96x32_MI32x32x4x1_SE_1LDSB0_AF0EM8_GRVW4_GSU1_LBSPP128_LPB4_LRVW4_NLCA1_PLR9_SU0_SUS256_SRVW4_TT1_96_WG128_2_1_WGM1
    SolutionIndex: 108
    SolutionNameMin: Cijk_Ailk_Bljk_BSS_BH_MT64x128x32_MI32x32x4x1_SE_1LDSB0_AF0EM8_GRVW8_GSU1_LBSPP128_LPB8_LRVW4_NLCA1_PLR9_SU32_SUS256_SRVW4_TT1_64_WG64_4_1_WGM2
    SolutionIndex: 109
    SolutionNameMin: Cijk_Ailk_Bljk_BSS_BH_MT64x128x32_MI32x32x4x1_SE_1LDSB0_AF0EM8_GRVW8_GSU1_LBSPP128_LPB8_LRVW4_NLCA1_PLR9_SU0_SUS128_SRVW4_TT1_64_WG64_4_1_WGM1
    SolutionIndex: 110
    SolutionNameMin: Cijk_Ailk_Bljk_BSS_BH_MT128x80x32_MI16x16x8x1_SE_1LDSB0_AF0EM4_GRVW2_GSU1_LBSPP128_LPB2_LRVW2_NLCA1_PLR1_SU0_SUS128_SRVW4_TT2_80_WG64_4_1_WGM15
    SolutionIndex: 111
    SolutionNameMin: Cijk_Ailk_Bljk_BSS_BH_MT128x96x32_MI32x32x4x1_SE_1LDSB0_AF0EM4_GRVW4_GSU1_LBSPP128_LPB4_LRVW2_NLCA1_PLR1_SU32_SUS256_SRVW4_TT1_96_WG128_2_1_WGM2
    SolutionIndex: 112
    SolutionNameMin: Cijk_Ailk_Bljk_BSS_BH_MT128x160x32_MI32x32x4x1_SE_1LDSB0_AF0EM4_GRVW2_GSU1_LBSPP128_LPB2_LRVW2_NLCA1_PLR1_SU0_SUS128_SRVW4_TT1_160_WG128_2_1_WGM1
    SolutionIndex: 113
    SolutionNameMin: Cijk_Ailk_Bljk_BSS_BH_MT128x96x32_MI32x32x4x1_SE_1LDSB0_AF0EM1_GRVW4_GSU1_LBSPP128_LPB4_LRVW2_NLCA1_PLR1_SU16_SUS128_SRVW4_TT1_96_WG128_2_1_WGM1
    SolutionIndex: 114
    SolutionNameMin: Cijk_Ailk_Bljk_BSS_BH_MT128x144x32_MI16x16x8x1_SE_1LDSB1_AF0EM8_GRVW2_GSU1_LBSPP128_LPB4_LRVW4_NLCA1_PLR5_SU32_SUS256_SRVW4_TT2_144_WG64_4_1_WGM1
    SolutionIndex: 115
    SolutionNameMin: Cijk_Ailk_Bljk_BSS_BH_MT64x16x32_MI16x16x8x1_SE_1LDSB0_AF0EM8_GRVW2_GSU1_LBSPP128_LPB4_LRVW4_NLCA1_PLR5_SU32_SUS256_SRVW0_TT1_16_WG64_4_1_WGM15
    SolutionIndex: 116
    SolutionNameMin: Cijk_Ailk_Bljk_BSS_BH_MT64x16x32_MI16x16x8x1_SE_1LDSB0_AF0EM8_GRVW2_GSU1_LBSPP128_LPB4_LRVW4_NLCA1_PLR5_SU0_SUS256_SRVW0_TT1_16_WG64_4_1_WGM2
    SolutionIndex: 117
    SolutionNameMin: Cijk_Ailk_Bljk_BSS_BH_MT64x32x32_MI16x16x8x1_SE_1LDSB0_AF0EM4_GRVW4_GSU1_LBSPP128_LPB4_LRVW2_NLCA1_PLR1_SU0_SUS128_SRVW0_TT2_16_WG32_8_1_WGM1
    SolutionIndex: 118
    SolutionNameMin: Cijk_Ailk_Bljk_BSS_BH_MT32x32x32_MI16x16x8x1_SE_1LDSB0_AF0EM4_GRVW2_GSU1_LBSPP128_LPB2_LRVW2_NLCA1_PLR1_SU0_SUS256_SRVW0_TT1_16_WG32_8_1_WGM1
    SolutionIndex: 119
    SolutionNameMin: Cijk_Ailk_Bljk_BSS_BH_MT64x64x32_MI32x32x4x1_SE_1LDSB0_AF0EM4_GRVW2_GSU1_LBSPP128_LPB2_LRVW2_NLCA1_PLR1_SU0_SUS256_SRVW4_TT1_32_WG64_4_1_WGM1
    SolutionIndex: 120
    SolutionNameMin: Cijk_Ailk_Bljk_BSS_BH_MT64x80x32_MI16x16x8x1_SE_1LDSB0_AF0EM4_GRVW2_GSU1_LBSPP128_LPB2_LRVW2_NLCA1_PLR1_SU0_SUS128_SRVW0_TT1_80_WG64_4_1_WGM1
    SolutionIndex: 121
    SolutionNameMin: Cijk_Ailk_Bljk_BSS_BH_MT64x64x32_MI32x32x4x1_SE_1LDSB0_AF0EM4_GRVW8_GSU1_LBSPP128_LPB8_LRVW2_NLCA1_PLR1_SU0_SUS256_SRVW4_TT1_32_WG64_4_1_WGM2
    SolutionIndex: 122
    SolutionNameMin: Cijk_Ailk_Bljk_BSS_BH_MT32x32x128_MI16x16x8x1_SE_1LDSB0_AF0EM4_GRVW4_GSU1_LBSPP256_LPB4_LRVW2_NLCA1_PLR1_SU32_SUS256_SRVW0_TT1_16_WG32_8_1_WGM1
    SolutionIndex: 123
    SolutionNameMin: Cijk_Ailk_Bljk_BSS_BH_MT32x32x128_MI16x16x8x1_SE_1LDSB0_AF0EM4_GRVW4_GSU1_LBSPP256_LPB4_LRVW2_NLCA1_PLR1_SU16_SUS256_SRVW0_TT1_16_WG32_8_1_WGM15
    SolutionIndex: 124
    SolutionNameMin: Cijk_Ailk_Bljk_BSS_BH_MT32x32x64_MI16x16x8x1_SE_1LDSB0_AF0EM1_GRVW4_GSU5_LBSPP128_LPB4_LRVW4_NLCA1_PLR9_SU0_SUS128_SRVW0_TT1_16_WG32_8_1_WGM1
    SolutionIndex: 125
    SolutionNameMin: Cijk_Ailk_Bljk_BSS_BH_MT64x32x32_MI16x16x8x1_SE_1LDSB0_AF0EM4_GRVW8_GSU1_LBSPP128_LPB8_LRVW2_NLCA1_PLR1_SU0_SUS128_SRVW0_TT2_16_WG32_8_1_WGM1
    SolutionIndex: 126
    SolutionNameMin: Cijk_Ailk_Bljk_BSS_BH_MT32x32x32_MI16x16x8x1_SE_1LDSB0_AF0EM4_GRVW8_GSU1_LBSPP128_LPB8_LRVW2_NLCA1_PLR1_SU0_SUS128_SRVW0_TT1_16_WG32_8_1_WGM15
    SolutionIndex: 127
    SolutionNameMin: Cijk_Ailk_Bljk_BSS_BH_MT32x64x64_MI16x16x8x1_SE_1LDSB0_AF0EM1_GRVW4_GSU7_LBSPP128_LPB4_LRVW4_NLCA1_PLR9_SU0_SUS128_SRVW0_TT1_32_WG32_8_1_WGM1
    SolutionIndex: 128
    SolutionNameMin: Cijk_Ailk_Bljk_BSS_BH_MT32x32x32_MI16x16x8x1_SE_1LDSB0_AF0EM8_GRVW4_GSU1_LBSPP128_LPB4_LRVW4_NLCA1_PLR5_SU0_SUS128_SRVW4_TT1_16_WG32_8_1_WGM2
    SolutionIndex: 129
    SolutionNameMin: Cijk_Ailk_Bljk_BSS_BH_MT128x160x32_MI32x32x4x1_SE_1LDSB0_AF0EM4_GRVW2_GSU1_LBSPP128_LPB2_LRVW2_NLCA1_PLR1_SU0_SUS256_SRVW4_TT1_160_WG128_2_1_WGM2
    SolutionIndex: 130
    SolutionNameMin: Cijk_Ailk_Bljk_BSS_BH_MT128x160x32_MI32x32x4x1_SE_1LDSB0_AF0EM4_GRVW2_GSU1_LBSPP128_LPB2_LRVW2_NLCA1_PLR1_SU32_SUS128_SRVW4_TT1_160_WG128_2_1_WGM15
    SolutionIndex: 131
    SolutionNameMin: Cijk_Ailk_Bljk_BSS_BH_MT128x160x32_MI32x32x4x1_SE_1LDSB0_AF0EM8_GRVW2_GSU1_LBSPP128_LPB4_LRVW4_NLCA1_PLR9_SU0_SUS128_SRVW4_TT1_160_WG128_2_1_WGM2
    SolutionIndex: 132
    SolutionNameMin: Cijk_Ailk_Bljk_BSS_BH_MT128x160x32_MI32x32x4x1_SE_1LDSB0_AF0EM4_GRVW2_GSU1_LBSPP128_LPB2_LRVW2_NLCA1_PLR1_SU0_SUS128_SRVW0_TT1_160_WG128_2_1_WGM2
    SolutionIndex: 133
    SolutionNameMin: Cijk_Ailk_Bljk_BSS_BH_MT128x80x32_MI16x16x8x1_SE_1LDSB0_AF0EM4_GRVW2_GSU1_LBSPP128_LPB2_LRVW2_NLCA1_PLR1_SU0_SUS256_SRVW4_TT2_80_WG64_4_1_WGM2
    SolutionIndex: 134
    SolutionNameMin: Cijk_Ailk_Bljk_BSS_BH_MT128x160x32_MI32x32x4x1_SE_1LDSB0_AF0EM8_GRVW2_GSU1_LBSPP128_LPB4_LRVW4_NLCA1_PLR9_SU0_SUS128_SRVW4_TT1_160_WG128_2_1_WGM1
    SolutionIndex: 135
    SolutionNameMin: Cijk_Ailk_Bljk_BSS_BH_MT128x160x32_MI32x32x4x1_SE_1LDSB0_AF0EM8_GRVW2_GSU1_LBSPP128_LPB4_LRVW4_NLCA1_PLR9_SU0_SUS128_SRVW4_TT1_160_WG128_2_1_WGM15
    SolutionIndex: 136
    SolutionNameMin: Cijk_Ailk_Bljk_BSS_BH_MT128x160x32_MI32x32x4x1_SE_1LDSB0_AF0EM8_GRVW2_GSU1_LBSPP128_LPB4_LRVW4_NLCA1_PLR9_SU32_SUS128_SRVW4_TT1_160_WG128_2_1_WGM2
    SolutionIndex: 137
    SolutionNameMin: Cijk_Ailk_Bljk_BSS_BH_MT128x160x32_MI32x32x4x1_SE_1LDSB0_AF0EM8_GRVW4_GSU1_LBSPP128_LPB4_LRVW4_NLCA1_PLR9_SU0_SUS256_SRVW4_TT1_160_WG128_2_1_WGM2
    SolutionIndex: 138
    SolutionNameMin: Cijk_Ailk_Bljk_BSS_BH_MT128x160x32_MI32x32x4x1_SE_1LDSB0_AF0EM4_GRVW2_GSU1_LBSPP128_LPB2_LRVW2_NLCA1_PLR1_SU16_SUS256_SRVW4_TT1_160_WG128_2_1_WGM2
    SolutionIndex: 139
    SolutionNameMin: Cijk_Ailk_Bljk_BSS_BH_MT128x160x32_MI32x32x4x1_SE_1LDSB0_AF0EM4_GRVW2_GSU1_LBSPP128_LPB2_LRVW2_NLCA1_PLR1_SU32_SUS256_SRVW0_TT1_160_WG128_2_1_WGM2
    SolutionIndex: 140
    SolutionNameMin: Cijk_Ailk_Bljk_BSS_BH_MT128x160x32_MI32x32x4x1_SE_1LDSB0_AF0EM4_GRVW2_GSU1_LBSPP128_LPB2_LRVW2_NLCA1_PLR1_SU16_SUS128_SRVW0_TT1_160_WG128_2_1_WGM2
    SolutionIndex: 141
    SolutionNameMin: Cijk_Ailk_Bljk_BSS_BH_MT128x160x32_MI32x32x4x1_SE_1LDSB0_AF0EM4_GRVW2_GSU1_LBSPP128_LPB2_LRVW2_NLCA1_PLR1_SU16_SUS256_SRVW0_TT1_160_WG128_2_1_WGM15
    SolutionIndex: 142
    SolutionNameMin: Cijk_Ailk_Bljk_BSS_BH_MT128x160x32_MI32x32x4x1_SE_1LDSB0_AF0EM4_GRVW2_GSU1_LBSPP128_LPB2_LRVW2_NLCA1_PLR1_SU32_SUS128_SRVW0_TT1_160_WG128_2_1_WGM2
    SolutionIndex: 143
    SolutionNameMin: Cijk_Ailk_Bljk_BSS_BH_MT128x160x32_MI32x32x4x1_SE_1LDSB0_AF0EM4_GRVW2_GSU1_LBSPP128_LPB2_LRVW2_NLCA1_PLR1_SU0_SUS128_SRVW0_TT1_160_WG128_2_1_WGM1
    SolutionIndex: 144
    SolutionNameMin: Cijk_Ailk_Bljk_BSS_BH_MT128x160x32_MI32x32x4x1_SE_1LDSB0_AF0EM4_GRVW4_GSU1_LBSPP128_LPB4_LRVW2_NLCA1_PLR1_SU0_SUS128_SRVW0_TT1_160_WG128_2_1_WGM1
    SolutionIndex: 145
    SolutionNameMin: Cijk_Ailk_Bljk_BSS_BH_MT64x128x64_MI32x32x4x1_SE_1LDSB0_AF0EM1_GRVW8_GSU3_LBSPP128_LPB8_LRVW4_NLCA1_PLR17_SU0_SUS128_SRVW0_TT1_64_WG64_4_1_WGM1
    SolutionIndex: 146
    SolutionNameMin: Cijk_Ailk_Bljk_BSS_BH_MT32x64x64_MI16x16x8x1_SE_1LDSB0_AF0EM4_GRVW8_GSU1_LBSPP128_LPB8_LRVW2_NLCA1_PLR1_SU32_SUS128_SRVW0_TT1_32_WG32_8_1_WGM1
    SolutionIndex: 147
    SolutionNameMin: Cijk_Ailk_Bljk_BSS_BH_MT32x64x128_MI16x16x8x1_SE_1LDSB0_AF0EM4_GRVW8_GSU1_LBSPP256_LPB8_LRVW2_NLCA1_PLR1_SU16_SUS256_SRVW4_TT1_32_WG32_8_1_WGM1
    SolutionIndex: 148
    SolutionNameMin: Cijk_Ailk_Bljk_BSS_BH_MT32x64x128_MI16x16x8x1_SE_1LDSB0_AF0EM4_GRVW8_GSU1_LBSPP256_LPB8_LRVW2_NLCA1_PLR1_SU32_SUS256_SRVW4_TT1_32_WG32_8_1_WGM1
    SolutionIndex: 149
    SolutionNameMin: Cijk_Ailk_Bljk_BSS_BH_MT32x32x128_MI16x16x8x1_SE_1LDSB0_AF0EM4_GRVW8_GSU1_LBSPP256_LPB8_LRVW2_NLCA1_PLR1_SU16_SUS256_SRVW0_TT1_16_WG32_8_1_WGM1
    SolutionIndex: 150
    SolutionNameMin: Cijk_Ailk_Bljk_BSS_BH_MT32x32x64_MI16x16x8x1_SE_1LDSB0_AF0EM8_GRVW8_GSU5_LBSPP128_LPB8_LRVW4_NLCA1_PLR9_SU0_SUS128_SRVW0_TT1_16_WG32_8_1_WGM1
    SolutionIndex: 151
    SolutionNameMin: Cijk_Ailk_Bljk_BSS_BH_MT64x32x32_MI16x16x8x1_SE_1LDSB0_AF0EM8_GRVW8_GSU1_LBSPP128_LPB8_LRVW4_NLCA1_PLR5_SU0_SUS256_SRVW4_TT2_16_WG32_8_1_WGM1
    SolutionIndex: 152
    SolutionNameMin: Cijk_Ailk_Bljk_BSS_BH_MT64x128x32_MI32x32x4x1_SE_1LDSB0_AF0EM4_GRVW4_GSU1_LBSPP128_LPB4_LRVW2_NLCA1_PLR1_SU0_SUS256_SRVW4_TT1_64_WG64_4_1_WGM15
    SolutionIndex: 153
    SolutionNameMin: Cijk_Ailk_Bljk_BSS_BH_MT128x80x32_MI16x16x8x1_SE_1LDSB0_AF0EM4_GRVW2_GSU1_LBSPP128_LPB2_LRVW2_NLCA1_PLR1_SU16_SUS256_SRVW4_TT2_80_WG64_4_1_WGM2
    SolutionIndex: 154
    SolutionNameMin: Cijk_Ailk_Bljk_BSS_BH_MT128x80x32_MI16x16x8x1_SE_1LDSB0_AF0EM4_GRVW2_GSU1_LBSPP128_LPB2_LRVW2_NLCA1_PLR1_SU16_SUS128_SRVW4_TT2_80_WG64_4_1_WGM15
    SolutionIndex: 155
    SolutionNameMin: Cijk_Ailk_Bljk_BSS_BH_MT128x80x32_MI16x16x8x1_SE_1LDSB0_AF0EM1_GRVW2_GSU1_LBSPP128_LPB2_LRVW2_NLCA1_PLR1_SU32_SUS128_SRVW4_TT2_80_WG64_4_1_WGM15
    SolutionIndex: 156
    SolutionNameMin: Cijk_Ailk_Bljk_BSS_BH_MT64x128x32_MI32x32x4x1_SE_1LDSB0_AF0EM4_GRVW4_GSU1_LBSPP128_LPB4_LRVW2_NLCA1_PLR1_SU0_SUS128_SRVW4_TT1_64_WG64_4_1_WGM1
    SolutionIndex: 157
    SolutionNameMin: Cijk_Ailk_Bljk_BSS_BH_MT64x128x32_MI32x32x4x1_SE_1LDSB0_AF0EM4_GRVW8_GSU1_LBSPP128_LPB8_LRVW2_NLCA1_PLR1_SU0_SUS256_SRVW4_TT1_64_WG64_4_1_WGM2
    SolutionIndex: 158
    SolutionNameMin: Cijk_Ailk_Bljk_BSS_BH_MT128x144x32_MI16x16x8x1_SE_1LDSB1_AF0EM8_GRVW2_GSU1_LBSPP128_LPB4_LRVW4_NLCA1_PLR5_SU32_SUS128_SRVW4_TT2_144_WG64_4_1_WGM2
    SolutionIndex: 159
    SolutionNameMin: Cijk_Ailk_Bljk_BSS_BH_MT128x80x32_MI16x16x8x1_SE_1LDSB0_AF0EM4_GRVW2_GSU1_LBSPP128_LPB2_LRVW2_NLCA1_PLR1_SU32_SUS128_SRVW4_TT2_80_WG64_4_1_WGM2
    SolutionIndex: 160
    SolutionNameMin: Cijk_Ailk_Bljk_BSS_BH_MT32x32x64_MI16x16x8x1_SE_1LDSB0_AF0EM4_GRVW8_GSU1_LBSPP128_LPB8_LRVW2_NLCA1_PLR1_SU0_SUS256_SRVW0_TT1_16_WG32_8_1_WGM1
    SolutionIndex: 161
    SolutionNameMin: Cijk_Ailk_Bljk_BSS_BH_MT128x96x64_MI32x32x4x1_SE_1LDSB0_AF0EM8_GRVW2_GSU2_LBSPP128_LPB4_LRVW4_NLCA1_PLR17_SU0_SUS128_SRVW0_TT1_96_WG128_2_1_WGM1
    SolutionIndex: 162
    SolutionNameMin: Cijk_Ailk_Bljk_BSS_BH_MT64x32x64_MI16x16x8x1_SE_1LDSB0_AF0EM8_GRVW8_GSU7_LBSPP128_LPB8_LRVW4_NLCA1_PLR9_SU0_SUS128_SRVW0_TT2_16_WG32_8_1_WGM1
    SolutionIndex: 163
    SolutionNameMin: Cijk_Ailk_Bljk_BSS_BH_MT128x80x32_MI16x16x8x1_SE_1LDSB0_AF0EM4_GRVW2_GSU1_LBSPP128_LPB2_LRVW2_NLCA1_PLR1_SU32_SUS256_SRVW4_TT2_80_WG64_4_1_WGM15
    SolutionIndex: 164
    SolutionNameMin: Cijk_Ailk_Bljk_BSS_BH_MT128x96x32_MI32x32x4x1_SE_1LDSB0_AF0EM1_GRVW4_GSU1_LBSPP128_LPB4_LRVW4_NLCA1_PLR9_SU0_SUS128_SRVW4_TT1_96_WG128_2_1_WGM15
    SolutionIndex: 165
    SolutionNameMin: Cijk_Ailk_Bljk_BSS_BH_MT128x144x32_MI16x16x8x1_SE_1LDSB1_AF0EM8_GRVW2_GSU1_LBSPP128_LPB4_LRVW4_NLCA1_PLR5_SU32_SUS128_SRVW4_TT2_144_WG64_4_1_WGM1
    SolutionIndex: 166
    SolutionNameMin: Cijk_Ailk_Bljk_BSS_BH_MT128x96x32_MI32x32x4x1_SE_1LDSB0_AF0EM1_GRVW4_GSU1_LBSPP128_LPB4_LRVW2_NLCA1_PLR1_SU16_SUS128_SRVW4_TT1_96_WG128_2_1_WGM15
    SolutionIndex: 167
    SolutionNameMin: Cijk_Ailk_Bljk_BSS_BH_MT64x128x32_MI32x32x4x1_SE_1LDSB0_AF0EM4_GRVW8_GSU1_LBSPP128_LPB8_LRVW2_NLCA1_PLR1_SU16_SUS256_SRVW4_TT1_64_WG64_4_1_WGM15
    SolutionIndex: 168
    SolutionNameMin: Cijk_Ailk_Bljk_BSS_BH_MT64x128x64_MI32x32x4x1_SE_1LDSB0_AF0EM1_GRVW8_GSU1_LBSPP128_LPB8_LRVW4_NLCA1_PLR17_SU32_SUS256_SRVW4_TT1_64_WG64_4_1_WGM2
    SolutionIndex: 169
    SolutionNameMin: Cijk_Ailk_Bljk_BSS_BH_MT96x96x32_MI16x16x8x1_SE_1LDSB1_AF0EM8_GRVW4_GSU1_LBSPP128_LPB4_LRVW4_NLCA3_PLR5_SU0_SUS256_SRVW0_TT3_48_WG32_8_1_WGM15
    SolutionIndex: 170
    SolutionNameMin: Cijk_Ailk_Bljk_BSS_BH_MT128x96x64_MI32x32x4x1_SE_1LDSB0_AF0EM8_GRVW8_GSU2_LBSPP128_LPB8_LRVW4_NLCA1_PLR17_SU0_SUS128_SRVW0_TT1_96_WG128_2_1_WGM2
    SolutionIndex: 171
    SolutionNameMin: Cijk_Ailk_Bljk_BSS_BH_MT64x128x32_MI32x32x4x1_SE_1LDSB0_AF0EM8_GRVW2_GSU1_LBSPP128_LPB4_LRVW4_NLCA1_PLR9_SU0_SUS128_SRVW4_TT1_64_WG64_4_1_WGM1
    SolutionIndex: 172
    SolutionNameMin: Cijk_Ailk_Bljk_BSS_BH_MT64x64x32_MI32x32x4x1_SE_1LDSB0_AF0EM8_GRVW8_GSU1_LBSPP128_LPB8_LRVW4_NLCA1_PLR9_SU0_SUS256_SRVW4_TT1_32_WG64_4_1_WGM1
    SolutionIndex: 173
    SolutionNameMin: Cijk_Ailk_Bljk_BSS_BH_MT64x128x64_MI32x32x4x1_SE_1LDSB0_AF0EM8_GRVW8_GSU1_LBSPP128_LPB8_LRVW4_NLCA1_PLR17_SU0_SUS256_SRVW4_TT1_64_WG64_4_1_WGM1
    SolutionIndex: 174
    SolutionNameMin: Cijk_Ailk_Bljk_BSS_BH_MT128x128x32_MI32x32x4x1_SE_1LDSB0_AF0EM8_GRVW4_GSU3_LBSPP128_LPB4_LRVW4_NLCA1_PLR9_SU0_SUS256_SRVW0_TT2_64_WG64_4_1_WGM2
    SolutionIndex: 175
    SolutionNameMin: Cijk_Ailk_Bljk_BSS_BH_MT256x128x32_MI32x32x4x1_SE_1LDSB1_AF0EM8_GRVW8_GSU3_LBSPP128_LPB8_LRVW4_NLCA1_PLR9_SU32_SUS256_SRVW0_TT4_64_WG64_4_1_WGM15
    SolutionIndex: 176
    SolutionNameMin: Cijk_Ailk_Bljk_BSS_BH_MT256x160x32_MI32x32x4x1_SE_1LDSB0_AF0EM8_GRVW4_GSU3_LBSPP128_LPB4_LRVW4_NLCA1_PLR9_SU0_SUS256_SRVW0_TT2_160_WG128_2_1_WGM2
    SolutionIndex: 177
    SolutionNameMin: Cijk_Ailk_Bljk_BSS_BH_MT32x32x32_MI16x16x8x1_SE_1LDSB0_AF0EM4_GRVW4_GSU1_LBSPP128_LPB4_LRVW2_NLCA1_PLR1_SU16_SUS128_SRVW0_TT1_16_WG32_8_1_WGM15
    SolutionIndex: 178
    SolutionNameMin: Cijk_Ailk_Bljk_BSS_BH_MT64x128x32_MI32x32x4x1_SE_1LDSB0_AF0EM4_GRVW8_GSU1_LBSPP128_LPB8_LRVW2_NLCA1_PLR1_SU16_SUS256_SRVW4_TT1_64_WG64_4_1_WGM2
    SolutionIndex: 179
    SolutionNameMin: Cijk_Ailk_Bljk_BSS_BH_MT64x32x32_MI16x16x8x1_SE_1LDSB0_AF0EM8_GRVW2_GSU1_LBSPP128_LPB4_LRVW4_NLCA1_PLR5_SU0_SUS256_SRVW4_TT2_16_WG32_8_1_WGM2
    SolutionIndex: 180
    SolutionNameMin: Cijk_Ailk_Bljk_BSS_BH_MT64x128x32_MI32x32x4x1_SE_1LDSB0_AF0EM1_GRVW8_GSU1_LBSPP128_LPB8_LRVW2_NLCA1_PLR1_SU16_SUS128_SRVW4_TT1_64_WG64_4_1_WGM1
    SolutionIndex: 181
    SolutionNameMin: Cijk_Ailk_Bljk_BSS_BH_MT64x128x32_MI32x32x4x1_SE_1LDSB0_AF0EM4_GRVW8_GSU1_LBSPP128_LPB8_LRVW2_NLCA1_PLR1_SU32_SUS128_SRVW4_TT1_64_WG64_4_1_WGM1
    SolutionIndex: 182
    SolutionNameMin: Cijk_Ailk_Bljk_BSS_BH_MT64x128x32_MI32x32x4x1_SE_1LDSB0_AF0EM1_GRVW8_GSU1_LBSPP128_LPB8_LRVW2_NLCA1_PLR1_SU32_SUS128_SRVW4_TT1_64_WG64_4_1_WGM15
    SolutionIndex: 183
    SolutionNameMin: Cijk_Ailk_Bljk_BSS_BH_MT128x96x32_MI32x32x4x1_SE_1LDSB0_AF0EM8_GRVW4_GSU1_LBSPP128_LPB4_LRVW4_NLCA1_PLR9_SU32_SUS128_SRVW4_TT1_96_WG128_2_1_WGM1
    SolutionIndex: 184
    SolutionNameMin: Cijk_Ailk_Bljk_BSS_BH_MT64x64x32_MI32x32x4x1_SE_1LDSB0_AF0EM1_GRVW8_GSU1_LBSPP128_LPB8_LRVW4_NLCA1_PLR9_SU0_SUS256_SRVW4_TT1_32_WG64_4_1_WGM1
    SolutionIndex: 185
    SolutionNameMin: Cijk_Ailk_Bljk_BSS_BH_MT64x64x32_MI32x32x4x1_SE_1LDSB0_AF0EM8_GRVW8_GSU1_LBSPP128_LPB8_LRVW4_NLCA1_PLR9_SU32_SUS256_SRVW4_TT1_32_WG64_4_1_WGM15
    SolutionIndex: 186
    SolutionNameMin: Cijk_Ailk_Bljk_BSS_BH_MT64x128x32_MI32x32x4x1_SE_1LDSB0_AF0EM8_GRVW8_GSU1_LBSPP128_LPB8_LRVW4_NLCA1_PLR9_SU0_SUS256_SRVW4_TT1_64_WG64_4_1_WGM2
    SolutionIndex: 187
    SolutionNameMin: Cijk_Ailk_Bljk_BSS_BH_MT64x128x32_MI32x32x4x1_SE_1LDSB0_AF0EM1_GRVW8_GSU1_LBSPP128_LPB8_LRVW2_NLCA1_PLR1_SU16_SUS128_SRVW4_TT1_64_WG64_4_1_WGM2
    SolutionIndex: 188
    SolutionNameMin: Cijk_Ailk_Bljk_BSS_BH_MT64x64x32_MI32x32x4x1_SE_1LDSB0_AF0EM8_GRVW8_GSU1_LBSPP128_LPB8_LRVW4_NLCA1_PLR9_SU32_SUS128_SRVW4_TT1_32_WG64_4_1_WGM1
    SolutionIndex: 189
    SolutionNameMin: Cijk_Ailk_Bljk_BSS_BH_MT64x64x32_MI32x32x4x1_SE_1LDSB0_AF0EM1_GRVW8_GSU1_LBSPP128_LPB8_LRVW2_NLCA1_PLR1_SU0_SUS128_SRVW4_TT1_32_WG64_4_1_WGM15
    SolutionIndex: 190
    SolutionNameMin: Cijk_Ailk_Bljk_BSS_BH_MT64x64x32_MI32x32x4x1_SE_1LDSB0_AF0EM8_GRVW8_GSU1_LBSPP128_LPB8_LRVW4_NLCA1_PLR9_SU0_SUS128_SRVW4_TT1_32_WG64_4_1_WGM2
    SolutionIndex: 191
    SolutionNameMin: Cijk_Ailk_Bljk_BSS_BH_MT32x64x64_MI16x16x8x1_SE_1LDSB0_AF0EM8_GRVW8_GSU1_LBSPP128_LPB8_LRVW4_NLCA1_PLR9_SU0_SUS256_SRVW4_TT1_32_WG32_8_1_WGM15
    SolutionIndex: 192
    SolutionNameMin: Cijk_Ailk_Bljk_BSS_BH_MT64x64x32_MI32x32x4x1_SE_1LDSB0_AF0EM1_GRVW4_GSU1_LBSPP128_LPB4_LRVW4_NLCA1_PLR9_SU0_SUS128_SRVW4_TT1_32_WG64_4_1_WGM1
    SolutionIndex: 193
    SolutionNameMin: Cijk_Ailk_Bljk_BSS_BH_MT128x80x32_MI16x16x8x1_SE_1LDSB0_AF0EM4_GRVW2_GSU1_LBSPP128_LPB2_LRVW2_NLCA1_PLR1_SU0_SUS128_SRVW0_TT2_80_WG64_4_1_WGM2
    SolutionIndex: 194
    SolutionNameMin: Cijk_Ailk_Bljk_BSS_BH_MT64x128x32_MI32x32x4x1_SE_1LDSB0_AF0EM8_GRVW8_GSU1_LBSPP128_LPB8_LRVW4_NLCA1_PLR9_SU32_SUS128_SRVW4_TT1_64_WG64_4_1_WGM2
    SolutionIndex: 195
    SolutionNameMin: Cijk_Ailk_Bljk_BSS_BH_MT64x128x32_MI32x32x4x1_SE_1LDSB0_AF0EM1_GRVW8_GSU1_LBSPP128_LPB8_LRVW4_NLCA1_PLR9_SU0_SUS128_SRVW4_TT1_64_WG64_4_1_WGM1
    SolutionIndex: 196
    SolutionNameMin: Cijk_Ailk_Bljk_BSS_BH_MT64x16x32_MI16x16x8x1_SE_1LDSB0_AF0EM8_GRVW8_GSU1_LBSPP128_LPB8_LRVW4_NLCA1_PLR5_SU32_SUS256_SRVW4_TT1_16_WG64_4_1_WGM15
    SolutionIndex: 197
    SolutionNameMin: Cijk_Ailk_Bljk_BSS_BH_MT64x128x32_MI32x32x4x1_SE_1LDSB0_AF0EM1_GRVW2_GSU1_LBSPP128_LPB2_LRVW2_NLCA1_PLR1_SU0_SUS128_SRVW4_TT1_64_WG64_4_1_WGM15
    SolutionIndex: 198
    SolutionNameMin: Cijk_Ailk_Bljk_BSS_BH_MT128x128x32_MI32x32x4x1_SE_1LDSB0_AF0EM1_GRVW8_GSU1_LBSPP128_LPB8_LRVW2_NLCA1_PLR1_SU0_SUS256_SRVW4_TT2_64_WG64_4_1_WGM15
    SolutionIndex: 199
    SolutionNameMin: Cijk_Ailk_Bljk_BSS_BH_MT64x128x32_MI32x32x4x1_SE_1LDSB0_AF0EM1_GRVW4_GSU1_LBSPP128_LPB4_LRVW4_NLCA1_PLR9_SU32_SUS128_SRVW4_TT1_64_WG64_4_1_WGM2
    SolutionIndex: 200
    SolutionNameMin: Cijk_Ailk_Bljk_BSS_BH_MT128x64x64_MI32x32x4x1_SE_1LDSB0_AF0EM1_GRVW8_GSU1_LBSPP128_LPB8_LRVW2_NLCA1_PLR1_SU0_SUS128_SRVW4_TT2_32_WG64_4_1_WGM2
    SolutionIndex: 201
    SolutionNameMin: Cijk_Ailk_Bljk_BSS_BH_MT64x128x32_MI32x32x4x1_SE_1LDSB0_AF0EM8_GRVW8_GSU1_LBSPP128_LPB8_LRVW4_NLCA1_PLR9_SU32_SUS128_SRVW4_TT1_64_WG64_4_1_WGM1
    SolutionIndex: 202
    SolutionNameMin: Cijk_Ailk_Bljk_BSS_BH_MT128x96x32_MI32x32x4x1_SE_1LDSB0_AF0EM1_GRVW4_GSU1_LBSPP128_LPB4_LRVW2_NLCA1_PLR1_SU32_SUS256_SRVW4_TT1_96_WG128_2_1_WGM2
    SolutionIndex: 203
    SolutionNameMin: Cijk_Ailk_Bljk_BSS_BH_MT128x96x32_MI32x32x4x1_SE_1LDSB0_AF0EM4_GRVW4_GSU1_LBSPP128_LPB4_LRVW2_NLCA1_PLR1_SU16_SUS128_SRVW4_TT1_96_WG128_2_1_WGM1
    SolutionIndex: 204
    SolutionNameMin: Cijk_Ailk_Bljk_BSS_BH_MT64x128x32_MI32x32x4x1_SE_1LDSB0_AF0EM1_GRVW8_GSU1_LBSPP128_LPB8_LRVW4_NLCA1_PLR9_SU0_SUS128_SRVW4_TT1_64_WG64_4_1_WGM2
    SolutionIndex: 205
    SolutionNameMin: Cijk_Ailk_Bljk_BSS_BH_MT64x128x64_MI32x32x4x1_SE_1LDSB0_AF0EM1_GRVW8_GSU1_LBSPP128_LPB8_LRVW2_NLCA1_PLR1_SU0_SUS128_SRVW4_TT1_64_WG64_4_1_WGM2
    SolutionIndex: 206
    SolutionNameMin: Cijk_Ailk_Bljk_BSS_BH_MT96x96x32_MI16x16x8x1_SE_1LDSB1_AF0EM1_GRVW4_GSU1_LBSPP128_LPB4_LRVW4_NLCA3_PLR5_SU0_SUS128_SRVW0_TT3_48_WG32_8_1_WGM1
    SolutionIndex: 207
    SolutionNameMin: Cijk_Ailk_Bljk_BSS_BH_MT128x64x64_MI32x32x4x1_SE_1LDSB0_AF0EM4_GRVW8_GSU1_LBSPP128_LPB8_LRVW2_NLCA1_PLR1_SU0_SUS128_SRVW4_TT2_32_WG64_4_1_WGM15
    SolutionIndex: 208
    SolutionNameMin: Cijk_Ailk_Bljk_BSS_BH_MT64x128x64_MI32x32x4x1_SE_1LDSB0_AF0EM1_GRVW2_GSU1_LBSPP128_LPB2_LRVW2_NLCA1_PLR1_SU16_SUS256_SRVW4_TT1_64_WG64_4_1_WGM15
    SolutionIndex: 209
    SolutionNameMin: Cijk_Ailk_Bljk_BSS_BH_MT64x32x32_MI16x16x8x1_SE_1LDSB0_AF0EM1_GRVW8_GSU1_LBSPP128_LPB8_LRVW4_NLCA1_PLR5_SU0_SUS256_SRVW4_TT2_16_WG32_8_1_WGM1
    SolutionIndex: 210
    SolutionNameMin: Cijk_Ailk_Bljk_BSS_BH_MT128x96x32_MI32x32x4x1_SE_1LDSB0_AF0EM4_GRVW2_GSU1_LBSPP128_LPB2_LRVW2_NLCA1_PLR1_SU0_SUS128_SRVW4_TT1_96_WG128_2_1_WGM2
    SolutionIndex: 211
    SolutionNameMin: Cijk_Ailk_Bljk_BSS_BH_MT64x128x32_MI32x32x4x1_SE_1LDSB0_AF0EM1_GRVW8_GSU1_LBSPP128_LPB8_LRVW2_NLCA1_PLR1_SU32_SUS128_SRVW4_TT1_64_WG64_4_1_WGM2
    SolutionIndex: 212
    SolutionNameMin: Cijk_Ailk_Bljk_BSS_BH_MT64x128x64_MI32x32x4x1_SE_1LDSB0_AF0EM1_GRVW2_GSU1_LBSPP128_LPB4_LRVW4_NLCA1_PLR17_SU0_SUS128_SRVW4_TT1_64_WG64_4_1_WGM2
- - - [7680, 8192, 1, 8192]
    - [0, 94.617]
  - - [3840, 4096, 1, 4096]
    - [1, 87.93]
  - - [1920, 2048, 1, 2048]
    - [2, 69.242]
  - - [960, 1024, 1, 1024]
    - [3, 36.562]
  - - [480, 512, 1, 512]
    - [4, 6.87]
  - - [8192, 7680, 1, 8192]
    - [5, 94.42]
  - - [4096, 3840, 1, 4096]
    - [6, 88.053]
  - - [2048, 1920, 1, 2048]
    - [0, 66.751]
  - - [1024, 960, 1, 1024]
    - [7, 36.263]
  - - [512, 480, 1, 512]
    - [8, 7.269]
  - - [8192, 8192, 1, 8192]
    - [5, 94.251]
  - - [4096, 4096, 1, 4096]
    - [9, 87.55]
  - - [2048, 2048, 1, 2048]
    - [10, 67.849]
  - - [1024, 1024, 1, 1024]
    - [11, 32.895]
  - - [512, 512, 1, 512]
    - [12, 6.777]
  - - [64, 512, 16, 512]
    - [13, 11.458]
  - - [64, 512, 128, 512]
    - [3, 35.762]
  - - [1024, 1, 1, 2]
    - [14, 0.0]
  - - [1024, 1, 1, 1024]
    - [15, 0.055]
  - - [1024, 8, 1, 1024]
    - [16, 0.425]
  - - [1024, 77, 1, 1024]
    - [17, 4.36]
  - - [1024, 77, 1, 30522]
    - [18, 42.352]
  - - [1024, 512, 1, 2]
    - [19, 0.067]
  - - [1024, 512, 1, 1024]
    - [20, 17.664]
  - - [1024, 512, 1, 4096]
    - [21, 40.119]
  - - [1024, 616, 1, 1024]
    - [22, 22.989]
  - - [1024, 4096, 1, 2]
    - [23, 0.308]
  - - [1024, 4096, 1, 1024]
    - [5, 60.693]
  - - [1024, 4096, 1, 4096]
    - [24, 79.414]
  - - [4096, 512, 1, 1024]
    - [25, 45.815]
  - - [4096, 4096, 1, 1024]
    - [9, 72.902]
  - - [64, 128, 128, 128]
    - [26, 6.124]
  - - [64, 128, 160, 128]
    - [27, 8.591]
  - - [1024, 10, 1, 2]
    - [28, 0.001]
  - - [1024, 10, 1, 1024]
    - [29, 0.566]
  - - [1024, 160, 1, 1024]
    - [30, 7.5]
  - - [1024, 200, 1, 1024]
    - [31, 11.746]
  - - [1024, 200, 1, 30522]
    - [32, 47.205]
  - - [1024, 1024, 1, 2]
    - [33, 0.116]
  - - [1024, 1024, 1, 4096]
    - [34, 55.598]
  - - [1024, 1280, 1, 2]
    - [35, 0.149]
  - - [1024, 1280, 1, 1024]
    - [36, 37.976]
  - - [1024, 1280, 1, 4096]
    - [37, 65.335]
  - - [4096, 1024, 1, 1024]
    - [38, 61.95]
  - - [4096, 1280, 1, 1024]
    - [39, 54.904]
  - - [64, 128, 624, 128]
    - [40, 16.587]
  - - [1024, 39, 1, 2]
    - [41, 0.007]
  - - [1024, 39, 1, 1024]
    - [42, 2.262]
  - - [1024, 780, 1, 1024]
    - [43, 30.276]
  - - [1024, 780, 1, 30522]
    - [44, 80.813]
  - - [1024, 4992, 1, 2]
    - [45, 0.34]
  - - [1024, 4992, 1, 1024]
    - [46, 50.098]
  - - [1024, 4992, 1, 4096]
    - [47, 76.036]
  - - [4096, 4992, 1, 1024]
    - [48, 74.876]
  - - [64, 512, 64, 512]
    - [49, 28.527]
  - - [1024, 4, 1, 2]
    - [50, 0.001]
  - - [1024, 4, 1, 1024]
    - [51, 0.251]
  - - [1024, 308, 1, 1024]
    - [52, 14.69]
  - - [1024, 308, 1, 30522]
    - [53, 61.065]
  - - [1024, 2048, 1, 2]
    - [54, 0.21]
  - - [1024, 2048, 1, 1024]
    - [55, 47.416]
  - - [1024, 2048, 1, 4096]
    - [56, 64.289]
  - - [4096, 2048, 1, 1024]
    - [46, 64.84]
  - - [64, 128, 640, 128]
    - [19, 16.423]
  - - [1024, 40, 1, 2]
    - [57, 0.006]
  - - [1024, 40, 1, 1024]
    - [58, 2.266]
  - - [1024, 800, 1, 1024]
    - [59, 31.218]
  - - [1024, 800, 1, 30522]
    - [44, 81.171]
  - - [1024, 5120, 1, 2]
    - [60, 0.319]
  - - [1024, 5120, 1, 1024]
    - [61, 56.938]
  - - [1024, 5120, 1, 4096]
    - [62, 78.041]
  - - [4096, 5120, 1, 1024]
    - [5, 75.493]
  - - [64, 128, 656, 128]
    - [19, 16.409]
  - - [1024, 41, 1, 2]
    - [30, 0.006]
  - - [1024, 41, 1, 1024]
    - [63, 2.516]
  - - [1024, 820, 1, 1024]
    - [64, 29.344]
  - - [1024, 820, 1, 30522]
    - [65, 76.847]
  - - [1024, 5248, 1, 2]
    - [66, 0.342]
  - - [1024, 5248, 1, 1024]
    - [67, 57.466]
  - - [1024, 5248, 1, 4096]
    - [68, 78.546]
  - - [4096, 5248, 1, 1024]
    - [9, 76.185]
  - - [64, 512, 80, 512]
    - [64, 32.777]
  - - [1024, 5, 1, 2]
    - [8, 0.001]
  - - [1024, 5, 1, 1024]
    - [69, 0.294]
  - - [1024, 385, 1, 1024]
    - [70, 18.41]
  - - [1024, 385, 1, 30522]
    - [71, 63.286]
  - - [1024, 2560, 1, 2]
    - [66, 0.251]
  - - [1024, 2560, 1, 1024]
    - [72, 53.117]
  - - [1024, 2560, 1, 4096]
    - [73, 71.288]
  - - [4096, 2560, 1, 1024]
    - [9, 66.17]
  - - [64, 512, 96, 512]
    - [74, 33.553]
  - - [1024, 6, 1, 2]
    - [8, 0.001]
  - - [1024, 6, 1, 1024]
    - [75, 0.347]
  - - [1024, 462, 1, 1024]
    - [76, 20.584]
  - - [1024, 462, 1, 30522]
    - [77, 77.435]
  - - [1024, 3072, 1, 2]
    - [78, 0.259]
  - - [1024, 3072, 1, 1024]
    - [79, 53.108]
  - - [1024, 3072, 1, 4096]
    - [80, 75.435]
  - - [4096, 3072, 1, 1024]
    - [81, 71.589]
  - - [1024, 8, 1, 2]
    - [82, 0.001]
  - - [1024, 160, 1, 30522]
    - [83, 59.472]
  - - [64, 128, 144, 128]
    - [28, 8.099]
  - - [1024, 9, 1, 2]
    - [84, 0.001]
  - - [1024, 9, 1, 1024]
    - [85, 0.551]
  - - [1024, 180, 1, 1024]
    - [30, 9.715]
  - - [1024, 180, 1, 30522]
    - [18, 49.21]
  - - [1024, 1152, 1, 2]
    - [86, 0.145]
  - - [1024, 1152, 1, 1024]
    - [87, 35.285]
  - - [1024, 1152, 1, 4096]
    - [11, 62.038]
  - - [4096, 1152, 1, 1024]
    - [54, 61.326]
  - - [256, 32768, 1, 128]
    - [88, 24.232]
  - - [479, 32768, 1, 1024]
    - [89, 64.453]
  - - [512, 32768, 1, 256]
    - [90, 40.068]
  - - [1024, 32768, 1, 512]
    - [5, 67.316]
  - - [1024, 32768, 1, 1024]
    - [88, 79.712]
  - - [64, 128, 512, 128]
    - [91, 15.293]
  - - [128, 128, 512, 64]
    - [45, 11.344]
  - - [1024, 32, 1, 2]
    - [8, 0.004]
  - - [1024, 32, 1, 1024]
    - [92, 1.977]
  - - [1024, 4096, 1, 30528]
    - [93, 90.538]
  - - [512, 512, 64, 64]
    - [94, 14.167]
  - - [1024, 2048, 1, 30528]
    - [95, 87.031]
  - - [64, 4, 32768, 4]
    - [14, 0.215]
  - - [64, 4, 38400, 4]
    - [96, 0.229]
  - - [1024, 8192, 1, 1024]
    - [97, 65.774]
  - - [1024, 8192, 1, 4096]
    - [88, 84.306]
  - - [1024, 8192, 1, 33712]
    - [65, 92.014]
  - - [1024, 9600, 1, 1024]
    - [9, 64.91]
  - - [1024, 9600, 1, 4096]
    - [98, 85.898]
  - - [1024, 9600, 1, 33712]
    - [99, 96.235]
  - - [4096, 8192, 1, 1024]
    - [81, 76.989]
  - - [4096, 9600, 1, 1024]
    - [9, 81.494]
  - - [1024, 10064, 1, 1024]
    - [66, 68.497]
  - - [1024, 10064, 1, 4096]
    - [0, 86.593]
  - - [1024, 10080, 1, 1024]
    - [66, 66.442]
  - - [1024, 10080, 1, 4096]
    - [93, 87.635]
  - - [1024, 10080, 1, 42720]
    - [100, 96.423]
  - - [1024, 10200, 1, 1024]
    - [5, 68.307]
  - - [1024, 10200, 1, 4096]
    - [88, 84.359]
  - - [1024, 3840, 1, 1024]
    - [101, 59.444]
  - - [1024, 3840, 1, 4096]
    - [102, 77.875]
  - - [1024, 3968, 1, 1024]
    - [9, 57.944]
  - - [1024, 3968, 1, 4096]
    - [100, 77.722]
  - - [1024, 3968, 1, 42720]
    - [44, 92.182]
  - - [1024, 6528, 1, 1024]
    - [36, 65.321]
  - - [1024, 6528, 1, 4096]
    - [36, 79.257]
  - - [1024, 6528, 1, 42720]
    - [103, 91.566]
  - - [1024, 7104, 1, 1024]
    - [36, 65.958]
  - - [1024, 7104, 1, 4096]
    - [38, 85.979]
  - - [1024, 7104, 1, 42720]
    - [104, 94.923]
  - - [1024, 7200, 1, 1024]
    - [73, 64.21]
  - - [1024, 7200, 1, 4096]
    - [105, 85.758]
  - - [1024, 7200, 1, 42720]
    - [106, 96.067]
  - - [1024, 8064, 1, 1024]
    - [107, 64.569]
  - - [1024, 8064, 1, 4096]
    - [5, 82.931]
  - - [1024, 8160, 1, 1024]
    - [108, 65.648]
  - - [1024, 8160, 1, 4096]
    - [9, 82.097]
  - - [1024, 9216, 1, 1024]
    - [109, 62.016]
  - - [1024, 9216, 1, 4096]
    - [110, 82.371]
  - - [1024, 9520, 1, 1024]
    - [111, 63.758]
  - - [1024, 9520, 1, 4096]
    - [112, 84.845]
  - - [1024, 9520, 1, 42720]
    - [99, 95.735]
  - - [4096, 10064, 1, 1024]
    - [9, 82.669]
  - - [4096, 10080, 1, 1024]
    - [9, 83.02]
  - - [4096, 10200, 1, 1024]
    - [5, 82.543]
  - - [4096, 3840, 1, 1024]
    - [113, 70.648]
  - - [4096, 3968, 1, 1024]
    - [114, 71.714]
  - - [4096, 6528, 1, 1024]
    - [5, 76.53]
  - - [4096, 7104, 1, 1024]
    - [5, 78.12]
  - - [4096, 7200, 1, 1024]
    - [5, 76.556]
  - - [4096, 8064, 1, 1024]
    - [9, 83.237]
  - - [4096, 8160, 1, 1024]
    - [78, 79.034]
  - - [4096, 9216, 1, 1024]
    - [78, 79.811]
  - - [4096, 9520, 1, 1024]
    - [9, 82.301]
  - - [64, 14, 10880, 14]
    - [82, 1.771]
  - - [64, 14, 10880, 15]
    - [115, 1.883]
  - - [64, 15, 7680, 15]
    - [115, 2.094]
  - - [64, 15, 10880, 15]
    - [82, 1.937]
  - - [64, 15, 7680, 17]
    - [116, 2.155]
  - - [64, 17, 6144, 17]
    - [45, 1.946]
  - - [64, 17, 7680, 17]
    - [45, 2.205]
  - - [64, 17, 6144, 21]
    - [45, 2.704]
  - - [64, 21, 6144, 21]
    - [117, 3.104]
  - - [64, 24, 4736, 24]
    - [84, 3.757]
  - - [64, 24, 4736, 34]
    - [35, 4.92]
  - - [64, 30, 2048, 30]
    - [118, 3.31]
  - - [64, 31, 2048, 30]
    - [50, 3.598]
  - - [64, 31, 2048, 31]
    - [27, 4.044]
  - - [64, 32, 4608, 32]
    - [119, 5.755]
  - - [64, 34, 4736, 34]
    - [119, 4.271]
  - - [64, 35, 4608, 32]
    - [120, 5.087]
  - - [64, 35, 4608, 35]
    - [121, 4.408]
  - - [64, 512, 1, 512]
    - [122, 1.1]
  - - [512, 512, 1, 64]
    - [41, 1.315]
  - - [128, 128, 1, 64]
    - [41, 0.075]
  - - [64, 128, 1, 128]
    - [123, 0.056]
  - - [1024, 512, 1, 64]
    - [76, 2.053]
  - - [74, 512, 1, 2048]
    - [124, 3.373]
  - - [64, 5, 1, 5]
    - [41, 0.0]
  - - [2048, 512, 1, 2048]
    - [87, 46.914]
  - - [512, 1600, 1, 512]
    - [59, 16.473]
  - - [32, 33, 1, 33]
    - [14, 0.003]
  - - [560, 1600, 1, 1024]
    - [43, 33.032]
  - - [512, 1600, 1, 32]
    - [125, 1.628]
  - - [1024, 1600, 1, 1024]
    - [46, 41.705]
  - - [32, 33, 1600, 33]
    - [118, 1.957]
  - - [32, 200, 1, 1]
    - [126, 0.0]
  - - [64, 3, 512, 3]
    - [35, 0.016]
  - - [64, 5, 512, 5]
    - [19, 0.043]
  - - [64, 5, 960, 5]
    - [35, 0.086]
  - - [64, 9, 512, 9]
    - [82, 0.163]
  - - [64, 512, 1, 1]
    - [30, 0.002]
  - - [67, 512, 1, 2048]
    - [127, 2.66]
  - - [74, 960, 1, 2048]
    - [127, 4.548]
  - - [100, 512, 1, 2048]
    - [58, 4.469]
  - - [128, 27, 32768, 27]
    - [84, 6.044]
  - - [256, 1024, 1, 1]
    - [128, 0.022]
  - - [256, 8976, 1, 1536]
    - [129, 58.864]
  - - [256, 8976, 1, 2048]
    - [130, 63.15]
  - - [256, 8976, 1, 2304]
    - [131, 65.464]
  - - [256, 8976, 1, 2560]
    - [132, 58.384]
  - - [256, 8976, 1, 2816]
    - [54, 61.691]
  - - [256, 8976, 1, 3072]
    - [133, 65.089]
  - - [256, 8976, 1, 4352]
    - [134, 74.273]
  - - [256, 8976, 1, 4864]
    - [135, 76.473]
  - - [256, 8976, 1, 5376]
    - [136, 73.072]
  - - [256, 8976, 1, 5632]
    - [130, 74.187]
  - - [256, 8976, 1, 5888]
    - [112, 78.007]
  - - [256, 8976, 1, 6144]
    - [137, 75.435]
  - - [256, 8976, 1, 6656]
    - [112, 74.359]
  - - [256, 8976, 1, 7168]
    - [132, 79.266]
  - - [256, 8976, 1, 7424]
    - [138, 80.011]
  - - [256, 8976, 1, 8192]
    - [130, 81.42]
  - - [256, 8976, 1, 8448]
    - [11, 78.13]
  - - [256, 8976, 1, 8960]
    - [106, 80.131]
  - - [256, 8976, 1, 9472]
    - [139, 78.867]
  - - [256, 8976, 1, 9728]
    - [105, 81.422]
  - - [256, 8976, 1, 9984]
    - [140, 83.112]
  - - [256, 8976, 1, 10240]
    - [141, 81.766]
  - - [256, 8976, 1, 10496]
    - [142, 80.321]
  - - [256, 8976, 1, 11008]
    - [104, 83.588]
  - - [256, 8976, 1, 11520]
    - [98, 81.793]
  - - [256, 8976, 1, 12288]
    - [140, 85.08]
  - - [256, 8976, 1, 14336]
    - [104, 82.957]
  - - [256, 8976, 1, 14848]
    - [106, 85.846]
  - - [256, 8976, 1, 15104]
    - [138, 85.237]
  - - [256, 8976, 1, 15872]
    - [137, 85.795]
  - - [256, 8976, 1, 17152]
    - [131, 86.358]
  - - [256, 8976, 1, 19712]
    - [112, 86.764]
  - - [256, 8976, 1, 19968]
    - [137, 86.422]
  - - [256, 8976, 1, 20480]
    - [143, 86.869]
  - - [256, 8976, 1, 20992]
    - [105, 87.664]
  - - [256, 8976, 1, 22016]
    - [136, 87.624]
  - - [256, 8976, 1, 26112]
    - [112, 88.501]
  - - [256, 8976, 1, 33536]
    - [135, 88.425]
  - - [256, 8976, 1, 44505]
    - [144, 87.662]
  - - [257, 1024, 1, 4096]
    - [145, 24.081]
  - - [480, 32768, 1, 1024]
    - [90, 69.373]
  - - [512, 200, 1, 1]
    - [146, 0.007]
  - - [512, 200, 1, 32]
    - [82, 0.285]
  - - [512, 215, 1, 2048]
    - [58, 8.914]
  - - [512, 256, 1, 2048]
    - [147, 11.142]
  - - [560, 200, 1, 1024]
    - [29, 5.752]
  - - [768, 215, 1, 2048]
    - [4, 14.106]
  - - [768, 256, 1, 2048]
    - [148, 14.657]
  - - [1024, 1, 1, 200]
    - [149, 0.012]
  - - [1024, 1, 1, 1600]
    - [150, 0.091]
  - - [1024, 200, 1, 1]
    - [82, 0.017]
  - - [1024, 512, 1, 1]
    - [33, 0.033]
  - - [1024, 960, 1, 64]
    - [151, 4.042]
  - - [1024, 1600, 1, 1]
    - [46, 0.092]
  - - [1024, 1792, 1, 256]
    - [152, 19.29]
  - - [1024, 2048, 1, 256]
    - [153, 19.479]
  - - [1024, 2560, 1, 256]
    - [111, 23.8]
  - - [1024, 3072, 1, 256]
    - [62, 26.707]
  - - [1024, 3328, 1, 256]
    - [94, 26.758]
  - - [1024, 3840, 1, 256]
    - [9, 29.948]
  - - [1024, 4096, 1, 256]
    - [36, 30.264]
  - - [1024, 4608, 1, 256]
    - [154, 32.919]
  - - [1024, 4864, 1, 256]
    - [78, 28.295]
  - - [1024, 5120, 1, 256]
    - [88, 33.459]
  - - [1024, 5632, 1, 256]
    - [5, 35.163]
  - - [1024, 6144, 1, 256]
    - [133, 33.967]
  - - [1024, 6400, 1, 256]
    - [88, 38.734]
  - - [1024, 7168, 1, 256]
    - [133, 38.086]
  - - [1024, 7424, 1, 256]
    - [133, 31.166]
  - - [1024, 7680, 1, 256]
    - [9, 39.799]
  - - [1024, 7936, 1, 256]
    - [24, 37.724]
  - - [1024, 8192, 1, 256]
    - [94, 35.556]
  - - [1024, 8448, 1, 256]
    - [88, 39.945]
  - - [1024, 8704, 1, 256]
    - [88, 38.184]
  - - [1024, 8960, 1, 256]
    - [94, 38.046]
  - - [1024, 9728, 1, 256]
    - [5, 36.295]
  - - [1024, 9984, 1, 256]
    - [9, 39.549]
  - - [1024, 10240, 1, 256]
    - [155, 38.115]
  - - [1024, 10496, 1, 256]
    - [24, 36.399]
  - - [1024, 11008, 1, 256]
    - [5, 39.614]
  - - [1024, 11264, 1, 256]
    - [61, 38.169]
  - - [1024, 11520, 1, 256]
    - [24, 38.582]
  - - [1024, 12288, 1, 256]
    - [88, 41.735]
  - - [1024, 13312, 1, 256]
    - [88, 41.418]
  - - [1024, 13568, 1, 256]
    - [88, 41.649]
  - - [1024, 14336, 1, 256]
    - [9, 46.722]
  - - [1024, 14592, 1, 256]
    - [94, 36.538]
  - - [1024, 14848, 1, 256]
    - [156, 36.472]
  - - [1024, 15104, 1, 256]
    - [157, 37.567]
  - - [1024, 16128, 1, 256]
    - [80, 39.83]
  - - [1024, 17152, 1, 256]
    - [24, 40.93]
  - - [1024, 18944, 1, 256]
    - [9, 40.643]
  - - [1024, 19712, 1, 256]
    - [158, 43.753]
  - - [1024, 19968, 1, 256]
    - [107, 41.33]
  - - [1024, 20480, 1, 256]
    - [88, 46.221]
  - - [1024, 20992, 1, 256]
    - [155, 42.031]
  - - [1024, 21504, 1, 256]
    - [54, 42.615]
  - - [1024, 22016, 1, 256]
    - [133, 43.673]
  - - [1024, 23552, 1, 256]
    - [88, 47.326]
  - - [1024, 28672, 1, 256]
    - [159, 47.817]
  - - [1024, 33536, 1, 256]
    - [62, 48.487]
  - - [1024, 40448, 1, 256]
    - [81, 48.195]
  - - [1600, 512, 1, 1024]
    - [59, 27.752]
  - - [2048, 1, 1, 512]
    - [160, 0.062]
  - - [2048, 512, 1, 1]
    - [26, 0.063]
  - - [2048, 960, 1, 2048]
    - [7, 60.135]
  - - [2048, 1024, 1, 1]
    - [61, 0.086]
  - - [2048, 1024, 1, 256]
    - [153, 17.962]
  - - [3200, 1024, 1, 2048]
    - [11, 62.692]
  - - [4096, 1024, 1, 1]
    - [84, 0.151]
  - - [2048, 1024, 1, 2048]
    - [129, 58.142]
  - - [2048, 1024, 1, 30592]
    - [161, 85.103]
  - - [2048, 1024, 1, 6144]
    - [138, 72.408]
  - - [2048, 1024, 1, 8192]
    - [131, 75.48]
  - - [2048, 2, 1, 2]
    - [57, 0.001]
  - - [2048, 2, 1, 2048]
    - [162, 0.427]
  - - [8192, 1024, 1, 2048]
    - [107, 77.556]
  - - [1024, 16, 1, 1024]
    - [51, 0.962]
  - - [1024, 16, 1, 2]
    - [57, 0.003]
  - - [1024, 8192, 1, 30592]
    - [65, 91.439]
  - - [1024, 8192, 1, 3072]
    - [88, 83.469]
  - - [512, 512, 256, 64]
    - [163, 18.571]
  - - [64, 512, 256, 512]
    - [59, 40.281]
  - - [1024, 2048, 1, 30592]
    - [95, 87.721]
  - - [1024, 2048, 1, 3072]
    - [90, 61.486]
  - - [1024, 4096, 1, 30592]
    - [164, 89.987]
  - - [1024, 4096, 1, 3072]
    - [165, 75.96]
  - - [512, 512, 128, 64]
    - [94, 16.767]
  - - [2560, 2048, 1, 1920]
    - [166, 68.703]
  - - [2560, 2048, 1, 2560]
    - [47, 75.129]
  - - [2560, 2048, 1, 7680]
    - [79, 83.803]
  - - [2560, 4, 1, 2]
    - [126, 0.002]
  - - [2560, 4, 1, 2560]
    - [122, 1.021]
  - - [640, 2048, 1, 2560]
    - [0, 57.423]
  - - [512, 512, 40, 64]
    - [91, 12.036]
  - - [64, 512, 40, 512]
    - [167, 24.216]
  - - [1536, 4096, 1, 1536]
    - [88, 73.554]
  - - [1536, 4096, 1, 4608]
    - [47, 82.113]
  - - [1536, 4096, 1, 50304]
    - [77, 91.547]
  - - [1536, 4096, 1, 6144]
    - [9, 86.741]
  - - [6144, 4096, 1, 1536]
    - [9, 82.303]
  - - [1024, 1024, 64, 96]
    - [88, 26.032]
  - - [96, 1024, 64, 1024]
    - [80, 59.338]
  - - [1536, 8192, 1, 1536]
    - [114, 76.726]
  - - [1536, 8192, 1, 4608]
    - [88, 86.32]
  - - [1536, 8192, 1, 50304]
    - [168, 93.677]
  - - [1536, 8192, 1, 6144]
    - [88, 88.014]
  - - [6144, 8192, 1, 1536]
    - [9, 88.09]
  - - [1024, 1024, 128, 96]
    - [165, 28.353]
  - - [96, 1024, 128, 1024]
    - [169, 62.34]
  - - [1024, 16384, 1, 1024]
    - [9, 72.492]
  - - [1024, 16384, 1, 3072]
    - [88, 85.177]
  - - [1024, 16384, 1, 4096]
    - [9, 86.506]
  - - [1024, 16384, 1, 50304]
    - [142, 94.285]
  - - [4096, 16384, 1, 1024]
    - [158, 84.152]
  - - [1024, 1024, 256, 64]
    - [54, 20.422]
  - - [64, 1024, 256, 1024]
    - [3, 57.592]
  - - [1024, 2048, 1, 50304]
    - [170, 88.695]
  - - [1024, 1024, 32, 64]
    - [163, 16.426]
  - - [64, 1024, 32, 1024]
    - [59, 38.512]
  - - [1024, 4096, 1, 50304]
    - [100, 90.596]
  - - [1024, 1024, 64, 64]
    - [81, 18.339]
  - - [64, 1024, 64, 1024]
    - [171, 41.164]
  - - [1024, 8192, 1, 50304]
    - [65, 93.343]
  - - [1024, 1024, 128, 64]
    - [153, 20.098]
  - - [64, 1024, 128, 1024]
    - [59, 55.593]
  - - [128, 128, 1024, 64]
    - [84, 13.659]
  - - [64, 128, 1024, 128]
    - [27, 19.59]
  - - [1024, 64, 1, 2]
    - [57, 0.01]
  - - [1024, 8192, 1, 30528]
    - [65, 92.052]
  - - [1024, 64, 1, 1024]
    - [92, 3.822]
  - - [1024, 3456, 1, 1024]
    - [163, 57.314]
  - - [1024, 3456, 1, 512]
    - [133, 41.969]
  - - [1024, 4096, 1, 512]
    - [88, 47.722]
  - - [1024, 6912, 1, 1024]
    - [113, 65.546]
  - - [1024, 6912, 1, 512]
    - [67, 50.495]
  - - [1024, 864, 1, 1024]
    - [43, 35.03]
  - - [1024, 864, 1, 512]
    - [103, 18.07]
  - - [256, 3456, 1, 128]
    - [172, 7.191]
  - - [256, 4096, 1, 128]
    - [50, 7.468]
  - - [256, 55296, 1, 128]
    - [88, 24.773]
  - - [256, 6912, 1, 128]
    - [152, 10.288]
  - - [256, 864, 1, 128]
    - [125, 2.211]
  - - [480, 3456, 1, 1024]
    - [173, 44.231]
  - - [480, 4096, 1, 1024]
    - [62, 43.81]
  - - [480, 6912, 1, 1024]
    - [79, 57.886]
  - - [480, 864, 1, 1024]
    - [12, 19.381]
  - - [512, 3456, 1, 256]
    - [156, 18.639]
  - - [512, 4096, 1, 256]
    - [153, 21.236]
  - - [512, 55296, 1, 256]
    - [9, 46.215]
  - - [512, 6912, 1, 256]
    - [163, 27.115]
  - - [512, 864, 1, 256]
    - [26, 7.57]
  - - [1024, 640, 1, 30528]
    - [174, 77.725]
  - - [1024, 1280, 1, 30528]
    - [175, 87.417]
  - - [1024, 1600, 1, 30528]
    - [176, 90.318]
  - - [1024, 10240, 1, 1024]
    - [5, 69.239]
  - - [1024, 10240, 1, 4096]
    - [114, 84.613]
  - - [4096, 10240, 1, 1024]
    - [9, 80.851]
  - - [1024, 80, 1, 1024]
    - [123, 5.075]
  - - [1024, 80, 1, 2]
    - [51, 0.012]
  - - [128, 128, 1280, 64]
    - [152, 12.666]
  - - [64, 128, 1280, 128]
    - [45, 18.827]
  - - [1024, 1640, 1, 30528]
    - [65, 85.094]
  - - [1024, 10496, 1, 1024]
    - [158, 69.197]
  - - [1024, 10496, 1, 4096]
    - [9, 86.759]
  - - [4096, 10496, 1, 1024]
    - [158, 81.308]
  - - [1024, 82, 1, 1024]
    - [122, 4.389]
  - - [1024, 82, 1, 2]
    - [177, 0.013]
  - - [128, 128, 1312, 64]
    - [50, 13.518]
  - - [64, 128, 1312, 128]
    - [84, 18.714]
  - - [1024, 160, 1, 30528]
    - [83, 63.017]
  - - [1024, 240, 1, 30528]
    - [32, 56.506]
  - - [1024, 6144, 1, 4096]
    - [78, 82.58]
  - - [1024, 12, 1, 1024]
    - [42, 0.676]
  - - [4096, 6144, 1, 1024]
    - [5, 77.739]
  - - [1024, 6144, 1, 1024]
    - [178, 61.122]
  - - [1024, 12, 1, 2]
    - [84, 0.002]
  - - [512, 512, 192, 64]
    - [114, 17.085]
  - - [64, 512, 192, 512]
    - [3, 39.477]
  - - [256, 4096, 1, 1]
    - [35, 0.06]
  - - [256, 6912, 1, 1]
    - [152, 0.078]
  - - [3136, 128, 64, 64]
    - [179, 15.074]
  - - [3136, 256, 64, 64]
    - [35, 16.892]
  - - [3136, 256, 64, 128]
    - [47, 31.623]
  - - [784, 512, 64, 256]
    - [24, 41.408]
  - - [3136, 128, 64, 256]
    - [180, 42.061]
  - - [3136, 256, 64, 256]
    - [114, 51.559]
  - - [784, 256, 64, 512]
    - [181, 50.513]
  - - [784, 512, 64, 512]
    - [182, 57.591]
  - - [3136, 128, 32, 64]
    - [179, 13.378]
  - - [3136, 256, 32, 64]
    - [94, 15.441]
  - - [3136, 256, 32, 128]
    - [72, 25.202]
  - - [784, 512, 32, 256]
    - [183, 39.77]
  - - [3136, 128, 32, 256]
    - [184, 30.485]
  - - [3136, 256, 32, 256]
    - [5, 44.912]
  - - [784, 256, 32, 512]
    - [109, 48.398]
  - - [784, 512, 32, 512]
    - [157, 51.187]
  - - [3136, 64, 64, 64]
    - [172, 12.852]
  - - [3136, 64, 64, 256]
    - [66, 31.104]
  - - [784, 512, 64, 128]
    - [46, 24.618]
  - - [784, 128, 64, 512]
    - [2, 47.843]
  - - [64, 192, 64, 1280]
    - [185, 29.362]
  - - [64, 320, 64, 1280]
    - [186, 35.251]
  - - [64, 384, 64, 1280]
    - [187, 41.304]
  - - [64, 448, 64, 1280]
    - [188, 43.924]
  - - [64, 192, 64, 2048]
    - [189, 34.85]
  - - [64, 320, 64, 2048]
    - [173, 39.804]
  - - [64, 384, 64, 2048]
    - [181, 46.546]
  - - [64, 448, 64, 2048]
    - [190, 47.085]
  - - [64, 192, 32, 1280]
    - [191, 21.447]
  - - [64, 320, 32, 1280]
    - [64, 28.003]
  - - [64, 384, 32, 1280]
    - [173, 32.248]
  - - [64, 448, 32, 1280]
    - [52, 33.011]
  - - [64, 192, 32, 2048]
    - [29, 25.865]
  - - [64, 320, 32, 2048]
    - [64, 32.331]
  - - [64, 384, 32, 2048]
    - [103, 41.094]
  - - [64, 448, 32, 2048]
    - [121, 42.714]
  - - [1024, 10224, 1, 1024]
    - [9, 67.178]
  - - [1024, 10192, 1, 1024]
    - [9, 66.619]
  - - [1024, 10208, 1, 1024]
    - [88, 68.341]
  - - [1024, 10224, 1, 4096]
    - [88, 84.477]
  - - [1024, 10224, 1, 3072]
    - [5, 80.447]
  - - [4096, 10224, 1, 1024]
    - [5, 81.604]
  - - [1024, 10240, 1, 3072]
    - [78, 80.996]
  - - [1024, 10192, 1, 3072]
    - [9, 82.179]
  - - [4096, 10192, 1, 1024]
    - [9, 83.899]
  - - [1024, 10192, 1, 4096]
    - [88, 84.836]
  - - [1024, 10200, 1, 3072]
    - [114, 81.086]
  - - [1024, 10184, 1, 1024]
    - [88, 67.635]
  - - [4096, 10208, 1, 1024]
    - [165, 80.695]
  - - [1024, 10208, 1, 3072]
    - [5, 81.047]
  - - [1024, 10208, 1, 4096]
    - [88, 84.57]
  - - [1024, 10224, 1, 2048]
    - [9, 78.082]
  - - [1024, 10240, 1, 2048]
    - [88, 80.063]
  - - [1024, 10120, 1, 1024]
    - [165, 67.259]
  - - [1024, 10192, 1, 2048]
    - [5, 76.339]
  - - [64, 24, 6816, 24]
    - [179, 3.6]
  - - [1024, 10152, 1, 1024]
    - [9, 67.656]
  - - [1024, 10080, 1, 3072]
    - [93, 85.614]
  - - [64, 26, 6272, 26]
    - [19, 3.944]
  - - [100352, 512, 1, 256]
    - [5, 51.786]
  - - [12544, 2048, 1, 1024]
    - [88, 75.52]
  - - [12544, 64, 1, 147]
    - [192, 6.161]
  - - [200704, 512, 1, 256]
    - [88, 53.945]
  - - [25088, 1024, 1, 512]
    - [90, 60.48]
  - - [3136, 64, 1, 576]
    - [146, 5.207]
  - - [50176, 1024, 1, 512]
    - [78, 69.36]
  - - [6272, 2048, 1, 1024]
    - [113, 64.704]
  - - [784, 128, 1, 1152]
    - [58, 5.419]
  - - [3136, 128, 128, 256]
    - [5, 50.623]
  - - [3136, 128, 256, 256]
    - [5, 53.841]
  - - [3136, 256, 128, 64]
    - [47, 18.571]
  - - [3136, 256, 256, 64]
    - [94, 19.404]
  - - [3136, 64, 128, 256]
    - [193, 36.598]
  - - [3136, 64, 256, 256]
    - [193, 40.158]
  - - [3136, 64, 128, 64]
    - [50, 14.194]
  - - [3136, 64, 256, 64]
    - [22, 15.909]
  - - [784, 128, 128, 512]
    - [46, 50.212]
  - - [784, 128, 256, 512]
    - [9, 56.398]
  - - [784, 256, 128, 512]
    - [194, 58.567]
  - - [784, 256, 256, 512]
    - [195, 62.621]
  - - [784, 512, 128, 128]
    - [193, 31.99]
  - - [784, 512, 256, 128]
    - [47, 35.966]
  - - [128, 128, 2048, 64]
    - [46, 15.031]
  - - [64, 128, 2048, 128]
    - [27, 19.846]
  - - [1024, 2560, 1, 30528]
    - [175, 91.14]
  - - [1024, 128, 1, 1024]
    - [30, 5.689]
  - - [1024, 128, 1, 2]
    - [196, 0.021]
  - - [128, 128, 1536, 64]
    - [22, 13.526]
  - - [64, 128, 1536, 128]
    - [197, 15.479]
  - - [1024, 12288, 1, 4096]
    - [88, 86.35]
  - - [1024, 12288, 1, 1024]
    - [88, 70.064]
  - - [4096, 12288, 1, 1024]
    - [165, 82.795]
  - - [1024, 1920, 1, 30528]
    - [101, 92.609]
  - - [1024, 96, 1, 1024]
    - [58, 5.752]
  - - [1024, 96, 1, 2]
    - [57, 0.015]
  - - [128, 128, 192, 64]
    - [45, 8.45]
  - - [64, 128, 192, 128]
    - [46, 9.84]
  - - [768, 2048, 1, 2]
    - [117, 0.17]
  - - [3072, 2048, 1, 768]
    - [5, 59.42]
  - - [768, 2048, 1, 3072]
    - [198, 57.977]
  - - [768, 2048, 1, 768]
    - [199, 35.172]
  - - [384, 384, 144, 64]
    - [22, 12.413]
  - - [64, 384, 144, 384]
    - [120, 30.719]
  - - [768, 4608, 1, 2]
    - [158, 0.302]
  - - [3072, 4608, 1, 768]
    - [9, 62.944]
  - - [768, 4608, 1, 3072]
    - [200, 69.894]
  - - [768, 4608, 1, 768]
    - [94, 52.376]
  - - [512, 512, 48, 64]
    - [120, 13.263]
  - - [64, 512, 48, 512]
    - [201, 24.783]
  - - [128, 128, 256, 64]
    - [22, 9.846]
  - - [64, 128, 256, 128]
    - [19, 11.369]
  - - [384, 384, 192, 64]
    - [202, 15.431]
  - - [64, 384, 192, 384]
    - [120, 30.882]
  - - [1024, 4608, 1, 2]
    - [114, 0.329]
  - - [4096, 4608, 1, 1024]
    - [5, 73.957]
  - - [1024, 4608, 1, 4096]
    - [105, 77.529]
  - - [1024, 4608, 1, 1024]
    - [110, 62.8]
  - - [8192, 1024, 1, 1024]
    - [183, 65.558]
  - - [8192, 4096, 1, 1024]
    - [81, 77.606]
  - - [16384, 16384, 1, 16384]
    - [9, 96.609]
  - - [196, 1024, 64, 512]
    - [36, 41.983]
  - - [196, 512, 64, 1024]
    - [203, 42.965]
  - - [196, 1024, 64, 1024]
    - [36, 56.574]
  - - [49, 2048, 64, 1024]
    - [204, 37.612]
  - - [49, 1024, 64, 2048]
    - [205, 39.123]
  - - [196, 1024, 32, 512]
    - [36, 44.982]
  - - [196, 512, 32, 1024]
    - [54, 44.284]
  - - [196, 1024, 32, 1024]
    - [24, 48.747]
  - - [49, 2048, 32, 1024]
    - [91, 29.751]
  - - [49, 1024, 32, 2048]
    - [206, 31.0]
  - - [196, 1024, 64, 256]
    - [38, 30.497]
  - - [196, 256, 64, 1024]
    - [207, 40.975]
  - - [49, 2048, 64, 512]
    - [184, 25.593]
  - - [49, 512, 64, 2048]
    - [208, 30.397]
  - - [1225, 32, 64, 192]
    - [91, 14.343]
  - - [1225, 48, 64, 192]
    - [209, 12.654]
  - - [1225, 64, 64, 192]
    - [189, 21.298]
  - - [1225, 48, 64, 256]
    - [209, 16.157]
  - - [1225, 64, 64, 256]
    - [192, 22.604]
  - - [1225, 48, 64, 288]
    - [209, 18.538]
  - - [1225, 64, 64, 288]
    - [184, 27.787]
  - - [5329, 80, 64, 64]
    - [155, 12.926]
  - - [289, 128, 64, 768]
    - [204, 33.898]
  - - [289, 160, 64, 768]
    - [155, 32.485]
  - - [289, 192, 64, 768]
    - [184, 37.293]
  - - [1225, 32, 32, 192]
    - [209, 8.872]
  - - [1225, 48, 32, 192]
    - [209, 11.271]
  - - [1225, 64, 32, 192]
    - [184, 16.628]
  - - [1225, 48, 32, 256]
    - [209, 11.625]
  - - [1225, 64, 32, 256]
    - [184, 20.377]
  - - [1225, 48, 32, 288]
    - [91, 15.148]
  - - [1225, 64, 32, 288]
    - [184, 21.681]
  - - [5329, 80, 32, 64]
    - [155, 11.05]
  - - [289, 128, 32, 768]
    - [195, 22.76]
  - - [289, 160, 32, 768]
    - [184, 27.267]
  - - [289, 192, 32, 768]
    - [68, 30.083]
  - - [196, 256, 1, 2304]
    - [124, 3.993]
  - - [49, 512, 1, 4608]
    - [127, 3.074]
  - - [196, 1024, 128, 256]
    - [36, 41.398]
  - - [196, 1024, 256, 256]
    - [39, 46.467]
  - - [196, 256, 128, 1024]
    - [195, 50.757]
  - - [196, 256, 256, 1024]
    - [101, 52.306]
  - - [196, 512, 128, 1024]
    - [210, 52.086]
  - - [196, 512, 256, 1024]
    - [195, 57.419]
  - - [49, 2048, 128, 512]
    - [211, 31.43]
  - - [49, 2048, 256, 512]
    - [2, 33.713]
  - - [49, 512, 128, 2048]
    - [199, 36.085]
  - - [49, 512, 256, 2048]
    - [212, 42.396]
- null
