library/src/blas3/Tensile/Logic/asm_full/arcturus/arcturus_Cijk_Ailk_Bjlk_BSS_BH.yaml
- {MinimumRequiredVersion: 4.23.0}
- arcturus
- gfx908
- [Device 7380, Device 7388, Device 738c, Device 7390]
    SolutionIndex: 0
    SolutionNameMin: Cijk_Ailk_Bjlk_BSS_BH_MT128x256x16_MI32x32x4x1_SE_1LDSB0_AF0EM8_GRVW8_GSU1_NLCA1_NLCB1_SU0_SUS128_SRVW4_TT2_128_WG64_4_1_WGM1
    SolutionIndex: 1
    SolutionNameMin: Cijk_Ailk_Bjlk_BSS_BH_MT128x256x16_MI32x32x4x1_SE_1LDSB0_AF0EM8_GRVW8_GSU1_NLCA1_NLCB1_SU32_SUS128_SRVW4_TT2_128_WG64_4_1_WGM15
    SolutionIndex: 2
    SolutionNameMin: Cijk_Ailk_Bjlk_BSS_BH_MT128x256x16_MI32x32x4x1_SE_1LDSB0_AF0EM4_GRVW8_GSU1_NLCA1_NLCB1_SU16_SUS128_SRVW4_TT2_128_WG64_4_1_WGM15
    SolutionIndex: 3
    SolutionNameMin: Cijk_Ailk_Bjlk_BSS_BH_MT64x64x64_MI32x32x4x1_SE_1LDSB0_AF0EM1_GRVW8_GSU1_NLCA1_NLCB1_SU32_SUS256_SRVW4_TT1_32_WG64_4_1_WGM2
    SolutionIndex: 4
    SolutionNameMin: Cijk_Ailk_Bjlk_BSS_BH_MT32x32x64_MI16x16x8x1_SE_1LDSB0_AF0EM4_GRVW8_GSU1_NLCA1_NLCB1_SU16_SUS256_SRVW0_TT1_16_WG32_8_1_WGM2
    SolutionIndex: 5
    SolutionNameMin: Cijk_Ailk_Bjlk_BSS_BH_MT64x128x32_MI32x32x4x1_SE_1LDSB0_AF0EM8_GRVW8_GSU1_NLCA1_NLCB1_SU32_SUS128_SRVW4_TT1_64_WG64_4_1_WGM2
    SolutionIndex: 6
    SolutionNameMin: Cijk_Ailk_Bjlk_BSS_BH_MT128x64x64_MI32x32x4x1_SE_1LDSB0_AF0EM4_GRVW4_GSU1_NLCA1_NLCB1_SU16_SUS128_SRVW4_TT2_32_WG64_4_1_WGM2
    SolutionIndex: 7
    SolutionNameMin: Cijk_Ailk_Bjlk_BSS_BH_MT32x32x64_MI16x16x8x1_SE_1LDSB0_AF0EM4_GRVW8_GSU1_NLCA1_NLCB1_SU32_SUS128_SRVW0_TT1_16_WG32_8_1_WGM15
    SolutionIndex: 8
    SolutionNameMin: Cijk_Ailk_Bjlk_BSS_BH_MT128x96x32_MI32x32x4x1_SE_1LDSB0_AF0EM8_GRVW4_GSU1_NLCA1_NLCB3_SU0_SUS128_SRVW4_TT1_96_WG128_2_1_WGM1
    SolutionIndex: 9
    SolutionNameMin: Cijk_Ailk_Bjlk_BSS_BH_MT128x96x32_MI32x32x4x1_SE_1LDSB0_AF0EM4_GRVW4_GSU1_NLCA1_NLCB3_SU0_SUS256_SRVW4_TT1_96_WG128_2_1_WGM2
    SolutionIndex: 10
    SolutionNameMin: Cijk_Ailk_Bjlk_BSS_BH_MT64x64x32_MI32x32x4x1_SE_1LDSB0_AF0EM1_GRVW8_GSU1_NLCA1_NLCB1_SU0_SUS256_SRVW4_TT1_32_WG64_4_1_WGM15
    SolutionIndex: 11
    SolutionNameMin: Cijk_Ailk_Bjlk_BSS_BH_MT32x32x32_MI16x16x8x1_SE_1LDSB0_AF0EM4_GRVW4_GSU1_NLCA1_NLCB1_SU0_SUS128_SRVW0_TT1_16_WG32_8_1_WGM15
    SolutionIndex: 12
    SolutionNameMin: Cijk_Ailk_Bjlk_BSS_BH_MT64x32x16_MI16x16x8x1_SE_1LDSB0_AF0EM4_GRVW2_GSU1_NLCA1_NLCB1_SU32_SUS128_SRVW0_TT2_16_WG32_8_1_WGM2
    SolutionIndex: 13
    SolutionNameMin: Cijk_Ailk_Bjlk_BSS_BH_MT32x32x128_MI16x16x8x1_SE_1LDSB0_AF0EM4_GRVW2_GSU1_NLCA1_NLCB1_SU0_SUS256_SRVW0_TT1_16_WG32_8_1_WGM2
    SolutionIndex: 14
    SolutionNameMin: Cijk_Ailk_Bjlk_BSS_BH_MT32x64x16_MI16x16x8x1_SE_1LDSB0_AF0EM1_GRVW4_GSU1_NLCA1_NLCB1_SU0_SUS256_SRVW0_TT1_32_WG32_8_1_WGM1
    SolutionIndex: 15
    SolutionNameMin: Cijk_Ailk_Bjlk_BSS_BH_MT32x32x16_MI16x16x8x1_SE_1LDSB0_AF0EM1_GRVW4_GSU1_NLCA1_NLCB1_SU0_SUS128_SRVW0_TT1_16_WG32_8_1_WGM15
    SolutionIndex: 16
    SolutionNameMin: Cijk_Ailk_Bjlk_BSS_BH_MT128x80x64_MI16x16x8x1_SE_1LDSB0_AF0EM4_GRVW2_GSU1_NLCA1_NLCB5_SU32_SUS128_SRVW0_TT2_80_WG64_4_1_WGM2
    SolutionIndex: 17
    SolutionNameMin: Cijk_Ailk_Bjlk_BSS_BH_MT128x96x32_MI32x32x4x1_SE_1LDSB0_AF0EM4_GRVW4_GSU1_NLCA1_NLCB3_SU16_SUS256_SRVW4_TT1_96_WG128_2_1_WGM2
    SolutionIndex: 18
    SolutionNameMin: Cijk_Ailk_Bjlk_BSS_BH_MT128x96x16_MI32x32x4x1_SE_1LDSB0_AF0EM8_GRVW2_GSU1_NLCA1_NLCB3_SU32_SUS256_SRVW4_TT1_96_WG128_2_1_WGM1
    SolutionIndex: 19
    SolutionNameMin: Cijk_Ailk_Bjlk_BSS_BH_MT64x64x32_MI32x32x4x1_SE_1LDSB0_AF0EM1_GRVW8_GSU1_NLCA1_NLCB1_SU0_SUS128_SRVW4_TT1_32_WG64_4_1_WGM1
    SolutionIndex: 20
    SolutionNameMin: Cijk_Ailk_Bjlk_BSS_BH_MT64x16x32_MI16x16x8x1_SE_1LDSB0_AF0EM8_GRVW8_GSU1_NLCA1_NLCB1_SU0_SUS256_SRVW0_TT1_16_WG64_4_1_WGM2
    SolutionIndex: 21
    SolutionNameMin: Cijk_Ailk_Bjlk_BSS_BH_MT32x32x64_MI16x16x8x1_SE_1LDSB0_AF0EM8_GRVW2_GSU5_NLCA1_NLCB1_SU0_SUS256_SRVW0_TT1_16_WG32_8_1_WGM1
    SolutionIndex: 22
    SolutionNameMin: Cijk_Ailk_Bjlk_BSS_BH_MT64x32x16_MI16x16x8x1_SE_1LDSB0_AF0EM8_GRVW2_GSU1_NLCA1_NLCB1_SU0_SUS128_SRVW4_TT2_16_WG32_8_1_WGM15
    SolutionIndex: 23
    SolutionNameMin: Cijk_Ailk_Bjlk_BSS_BH_MT32x64x16_MI16x16x8x1_SE_1LDSB0_AF0EM1_GRVW4_GSU1_NLCA1_NLCB1_SU32_SUS128_SRVW4_TT1_32_WG32_8_1_WGM1
    SolutionIndex: 24
    SolutionNameMin: Cijk_Ailk_Bjlk_BSS_BH_MT128x80x64_MI16x16x8x1_SE_1LDSB0_AF0EM4_GRVW2_GSU1_NLCA1_NLCB5_SU16_SUS256_SRVW0_TT2_80_WG64_4_1_WGM15
    SolutionIndex: 25
    SolutionNameMin: Cijk_Ailk_Bjlk_BSS_BH_MT128x96x32_MI32x32x4x1_SE_1LDSB0_AF0EM4_GRVW4_GSU1_NLCA1_NLCB3_SU32_SUS128_SRVW4_TT1_96_WG128_2_1_WGM1
    SolutionIndex: 26
    SolutionNameMin: Cijk_Ailk_Bjlk_BSS_BH_MT128x96x16_MI32x32x4x1_SE_1LDSB0_AF0EM8_GRVW2_GSU1_NLCA1_NLCB3_SU0_SUS128_SRVW4_TT1_96_WG128_2_1_WGM2
    SolutionIndex: 27
    SolutionNameMin: Cijk_Ailk_Bjlk_BSS_BH_MT64x64x32_MI32x32x4x1_SE_1LDSB0_AF0EM1_GRVW8_GSU1_NLCA1_NLCB1_SU0_SUS128_SRVW4_TT1_32_WG64_4_1_WGM2
    SolutionIndex: 28
    SolutionNameMin: Cijk_Ailk_Bjlk_BSS_BH_MT32x32x16_MI16x16x8x1_SE_1LDSB0_AF0EM8_GRVW4_GSU1_NLCA1_NLCB1_SU0_SUS256_SRVW4_TT1_16_WG32_8_1_WGM1
    SolutionIndex: 29
    SolutionNameMin: Cijk_Ailk_Bjlk_BSS_BH_MT32x32x32_MI16x16x8x1_SE_1LDSB0_AF0EM1_GRVW2_GSU15_NLCA1_NLCB1_SU0_SUS256_SRVW0_TT1_16_WG32_8_1_WGM15
    SolutionIndex: 30
    SolutionNameMin: Cijk_Ailk_Bjlk_BSS_BH_MT32x32x16_MI16x16x8x1_SE_1LDSB0_AF0EM1_GRVW4_GSU1_NLCA1_NLCB1_SU0_SUS256_SRVW0_TT1_16_WG32_8_1_WGM2
    SolutionIndex: 31
    SolutionNameMin: Cijk_Ailk_Bjlk_BSS_BH_MT64x64x32_MI32x32x4x1_SE_1LDSB0_AF0EM8_GRVW2_GSU1_NLCA1_NLCB1_SU0_SUS256_SRVW4_TT1_32_WG64_4_1_WGM2
    SolutionIndex: 32
    SolutionNameMin: Cijk_Ailk_Bjlk_BSS_BH_MT128x288x16_MI32x32x4x1_SE_1LDSB0_AF0EM4_GRVW2_GSU1_NLCA1_NLCB9_SU16_SUS128_SRVW4_TT1_288_WG128_2_1_WGM2
    SolutionIndex: 33
    SolutionNameMin: Cijk_Ailk_Bjlk_BSS_BH_MT128x96x32_MI32x32x4x1_SE_1LDSB0_AF0EM8_GRVW4_GSU1_NLCA1_NLCB3_SU32_SUS256_SRVW4_TT1_96_WG128_2_1_WGM15
    SolutionIndex: 34
    SolutionNameMin: Cijk_Ailk_Bjlk_BSS_BH_MT64x64x32_MI32x32x4x1_SE_1LDSB0_AF0EM4_GRVW4_GSU1_NLCA1_NLCB1_SU0_SUS256_SRVW4_TT1_32_WG64_4_1_WGM1
    SolutionIndex: 35
    SolutionNameMin: Cijk_Ailk_Bjlk_BSS_BH_MT32x32x16_MI16x16x8x1_SE_1LDSB0_AF0EM1_GRVW2_GSU1_NLCA1_NLCB1_SU0_SUS128_SRVW0_TT1_16_WG32_8_1_WGM1
    SolutionIndex: 36
    SolutionNameMin: Cijk_Ailk_Bjlk_BSS_BH_MT64x16x64_MI16x16x8x1_SE_1LDSB0_AF0EM1_GRVW2_GSU7_NLCA1_NLCB1_SU0_SUS256_SRVW0_TT1_16_WG64_4_1_WGM1
    SolutionIndex: 37
    SolutionNameMin: Cijk_Ailk_Bjlk_BSS_BH_MT64x32x16_MI16x16x8x1_SE_1LDSB0_AF0EM4_GRVW2_GSU1_NLCA1_NLCB1_SU32_SUS256_SRVW0_TT2_16_WG32_8_1_WGM2
    SolutionIndex: 38
    SolutionNameMin: Cijk_Ailk_Bjlk_BSS_BH_MT64x64x32_MI32x32x4x1_SE_1LDSB0_AF0EM4_GRVW8_GSU1_NLCA1_NLCB1_SU0_SUS128_SRVW4_TT1_32_WG64_4_1_WGM15
    SolutionIndex: 39
    SolutionNameMin: Cijk_Ailk_Bjlk_BSS_BH_MT128x80x64_MI16x16x8x1_SE_1LDSB0_AF0EM4_GRVW2_GSU1_NLCA1_NLCB5_SU32_SUS128_SRVW0_TT2_80_WG64_4_1_WGM15
    SolutionIndex: 40
    SolutionNameMin: Cijk_Ailk_Bjlk_BSS_BH_MT128x288x16_MI32x32x4x1_SE_1LDSB0_AF0EM4_GRVW2_GSU1_NLCA1_NLCB9_SU16_SUS256_SRVW4_TT1_288_WG128_2_1_WGM2
    SolutionIndex: 41
    SolutionNameMin: Cijk_Ailk_Bjlk_BSS_BH_MT128x96x16_MI32x32x4x1_SE_1LDSB0_AF0EM1_GRVW2_GSU1_NLCA1_NLCB3_SU0_SUS256_SRVW4_TT1_96_WG128_2_1_WGM2
    SolutionIndex: 42
    SolutionNameMin: Cijk_Ailk_Bjlk_BSS_BH_MT128x96x32_MI32x32x4x1_SE_1LDSB0_AF0EM1_GRVW4_GSU1_NLCA1_NLCB3_SU0_SUS128_SRVW4_TT1_96_WG128_2_1_WGM1
    SolutionIndex: 43
    SolutionNameMin: Cijk_Ailk_Bjlk_BSS_BH_MT64x128x16_MI32x32x4x1_SE_1LDSB0_AF0EM4_GRVW4_GSU1_NLCA1_NLCB1_SU0_SUS256_SRVW4_TT1_64_WG64_4_1_WGM2
    SolutionIndex: 44
    SolutionNameMin: Cijk_Ailk_Bjlk_BSS_BH_MT64x32x16_MI16x16x8x1_SE_1LDSB0_AF0EM4_GRVW2_GSU1_NLCA1_NLCB1_SU0_SUS256_SRVW0_TT2_16_WG32_8_1_WGM1
    SolutionIndex: 45
    SolutionNameMin: Cijk_Ailk_Bjlk_BSS_BH_MT64x16x32_MI16x16x8x1_SE_1LDSB0_AF0EM8_GRVW8_GSU15_NLCA1_NLCB1_SU0_SUS256_SRVW0_TT1_16_WG64_4_1_WGM1
    SolutionIndex: 46
    SolutionNameMin: Cijk_Ailk_Bjlk_BSS_BH_MT64x64x32_MI32x32x4x1_SE_1LDSB0_AF0EM8_GRVW8_GSU1_NLCA1_NLCB1_SU0_SUS256_SRVW4_TT1_32_WG64_4_1_WGM2
    SolutionIndex: 47
    SolutionNameMin: Cijk_Ailk_Bjlk_BSS_BH_MT128x80x64_MI16x16x8x1_SE_1LDSB0_AF0EM4_GRVW2_GSU1_NLCA1_NLCB5_SU0_SUS128_SRVW4_TT2_80_WG64_4_1_WGM2
    SolutionIndex: 48
    SolutionNameMin: Cijk_Ailk_Bjlk_BSS_BH_MT128x96x32_MI32x32x4x1_SE_1LDSB0_AF0EM8_GRVW4_GSU1_NLCA1_NLCB3_SU32_SUS256_SRVW4_TT1_96_WG128_2_1_WGM2
    SolutionIndex: 49
    SolutionNameMin: Cijk_Ailk_Bjlk_BSS_BH_MT128x96x32_MI32x32x4x1_SE_1LDSB0_AF0EM4_GRVW4_GSU1_NLCA1_NLCB3_SU16_SUS128_SRVW4_TT1_96_WG128_2_1_WGM1
    SolutionIndex: 50
    SolutionNameMin: Cijk_Ailk_Bjlk_BSS_BH_MT128x96x64_MI32x32x4x1_SE_1LDSB0_AF0EM8_GRVW8_GSU1_NLCA1_NLCB3_SU32_SUS128_SRVW4_TT1_96_WG128_2_1_WGM15
    SolutionIndex: 51
    SolutionNameMin: Cijk_Ailk_Bjlk_BSS_BH_MT64x64x32_MI32x32x4x1_SE_1LDSB0_AF0EM1_GRVW4_GSU1_NLCA1_NLCB1_SU32_SUS128_SRVW4_TT1_32_WG64_4_1_WGM15
    SolutionIndex: 52
    SolutionNameMin: Cijk_Ailk_Bjlk_BSS_BH_MT64x32x16_MI16x16x8x1_SE_1LDSB0_AF0EM4_GRVW2_GSU1_NLCA1_NLCB1_SU0_SUS128_SRVW0_TT2_16_WG32_8_1_WGM2
    SolutionIndex: 53
    SolutionNameMin: Cijk_Ailk_Bjlk_BSS_BH_MT64x64x32_MI32x32x4x1_SE_1LDSB0_AF0EM8_GRVW8_GSU1_NLCA1_NLCB1_SU32_SUS256_SRVW4_TT1_32_WG64_4_1_WGM15
    SolutionIndex: 54
    SolutionNameMin: Cijk_Ailk_Bjlk_BSS_BH_MT128x96x32_MI32x32x4x1_SE_1LDSB0_AF0EM4_GRVW4_GSU1_NLCA1_NLCB3_SU32_SUS128_SRVW4_TT1_96_WG128_2_1_WGM15
    SolutionIndex: 55
    SolutionNameMin: Cijk_Ailk_Bjlk_BSS_BH_MT64x64x64_MI32x32x4x1_SE_1LDSB0_AF0EM1_GRVW8_GSU1_NLCA1_NLCB1_SU16_SUS256_SRVW4_TT1_32_WG64_4_1_WGM2
    SolutionIndex: 56
    SolutionNameMin: Cijk_Ailk_Bjlk_BSS_BH_MT32x64x16_MI16x16x8x1_SE_1LDSB0_AF0EM1_GRVW4_GSU1_NLCA1_NLCB1_SU32_SUS256_SRVW4_TT1_32_WG32_8_1_WGM2
    SolutionIndex: 57
    SolutionNameMin: Cijk_Ailk_Bjlk_BSS_BH_MT64x64x32_MI32x32x4x1_SE_1LDSB0_AF0EM8_GRVW4_GSU1_NLCA1_NLCB1_SU0_SUS128_SRVW4_TT1_32_WG64_4_1_WGM2
    SolutionIndex: 58
    SolutionNameMin: Cijk_Ailk_Bjlk_BSS_BH_MT128x80x64_MI16x16x8x1_SE_1LDSB0_AF0EM4_GRVW2_GSU1_NLCA1_NLCB5_SU0_SUS256_SRVW0_TT2_80_WG64_4_1_WGM15
    SolutionIndex: 59
    SolutionNameMin: Cijk_Ailk_Bjlk_BSS_BH_MT64x128x32_MI32x32x4x1_SE_1LDSB0_AF0EM8_GRVW8_GSU1_NLCA1_NLCB1_SU0_SUS256_SRVW4_TT1_64_WG64_4_1_WGM2
    SolutionIndex: 60
    SolutionNameMin: Cijk_Ailk_Bjlk_BSS_BH_MT32x32x64_MI16x16x8x1_SE_1LDSB0_AF0EM8_GRVW2_GSU7_NLCA1_NLCB1_SU0_SUS256_SRVW0_TT1_16_WG32_8_1_WGM1
    SolutionIndex: 61
    SolutionNameMin: Cijk_Ailk_Bjlk_BSS_BH_MT64x64x32_MI32x32x4x1_SE_1LDSB0_AF0EM1_GRVW4_GSU1_NLCA1_NLCB1_SU0_SUS128_SRVW4_TT1_32_WG64_4_1_WGM15
    SolutionIndex: 62
    SolutionNameMin: Cijk_Ailk_Bjlk_BSS_BH_MT128x80x64_MI16x16x8x1_SE_1LDSB0_AF0EM4_GRVW2_GSU1_NLCA1_NLCB5_SU0_SUS256_SRVW0_TT2_80_WG64_4_1_WGM2
    SolutionIndex: 63
    SolutionNameMin: Cijk_Ailk_Bjlk_BSS_BH_MT128x288x16_MI32x32x4x1_SE_1LDSB0_AF0EM4_GRVW2_GSU1_NLCA1_NLCB9_SU32_SUS128_SRVW4_TT1_288_WG128_2_1_WGM15
    SolutionIndex: 64
    SolutionNameMin: Cijk_Ailk_Bjlk_BSS_BH_MT128x96x16_MI32x32x4x1_SE_1LDSB0_AF0EM4_GRVW2_GSU1_NLCA1_NLCB3_SU0_SUS128_SRVW4_TT1_96_WG128_2_1_WGM2
    SolutionIndex: 65
    SolutionNameMin: Cijk_Ailk_Bjlk_BSS_BH_MT32x32x64_MI16x16x8x1_SE_1LDSB0_AF0EM4_GRVW2_GSU1_NLCA1_NLCB1_SU0_SUS256_SRVW0_TT1_16_WG32_8_1_WGM1
    SolutionIndex: 66
    SolutionNameMin: Cijk_Ailk_Bjlk_BSS_BH_MT32x32x16_MI16x16x8x1_SE_1LDSB0_AF0EM1_GRVW8_GSU1_NLCA1_NLCB1_SU32_SUS256_SRVW4_TT1_16_WG32_8_1_WGM15
    SolutionIndex: 67
    SolutionNameMin: Cijk_Ailk_Bjlk_BSS_BH_MT128x96x32_MI32x32x4x1_SE_1LDSB0_AF0EM8_GRVW4_GSU1_NLCA1_NLCB3_SU32_SUS128_SRVW4_TT1_96_WG128_2_1_WGM2
    SolutionIndex: 68
    SolutionNameMin: Cijk_Ailk_Bjlk_BSS_BH_MT64x64x32_MI32x32x4x1_SE_1LDSB0_AF0EM8_GRVW8_GSU1_NLCA1_NLCB1_SU0_SUS128_SRVW4_TT1_32_WG64_4_1_WGM1
    SolutionIndex: 69
    SolutionNameMin: Cijk_Ailk_Bjlk_BSS_BH_MT32x32x64_MI16x16x8x1_SE_1LDSB0_AF0EM4_GRVW2_GSU1_NLCA1_NLCB1_SU0_SUS128_SRVW0_TT1_16_WG32_8_1_WGM15
    SolutionIndex: 70
    SolutionNameMin: Cijk_Ailk_Bjlk_BSS_BH_MT32x64x16_MI16x16x8x1_SE_1LDSB0_AF0EM1_GRVW8_GSU1_NLCA1_NLCB1_SU16_SUS128_SRVW4_TT1_32_WG32_8_1_WGM2
    SolutionIndex: 71
    SolutionNameMin: Cijk_Ailk_Bjlk_BSS_BH_MT64x64x16_MI32x32x4x1_SE_1LDSB0_AF0EM4_GRVW8_GSU1_NLCA1_NLCB1_SU0_SUS128_SRVW4_TT1_32_WG64_4_1_WGM15
    SolutionIndex: 72
    SolutionNameMin: Cijk_Ailk_Bjlk_BSS_BH_MT64x128x16_MI32x32x4x1_SE_1LDSB0_AF0EM8_GRVW8_GSU1_NLCA1_NLCB1_SU0_SUS256_SRVW4_TT1_64_WG64_4_1_WGM1
    SolutionIndex: 73
    SolutionNameMin: Cijk_Ailk_Bjlk_BSS_BH_MT16x64x64_MI16x16x8x1_SE_1LDSB0_AF0EM1_GRVW8_GSU15_NLCA1_NLCB1_SU0_SUS256_SRVW4_TT1_16_WG16_16_1_WGM1
    SolutionIndex: 74
    SolutionNameMin: Cijk_Ailk_Bjlk_BSS_BH_MT64x64x64_MI32x32x4x1_SE_1LDSB0_AF0EM8_GRVW8_GSU15_NLCA1_NLCB1_SU0_SUS256_SRVW0_TT1_32_WG64_4_1_WGM1
    SolutionIndex: 75
    SolutionNameMin: Cijk_Ailk_Bjlk_BSS_BH_MT64x32x16_MI16x16x8x1_SE_1LDSB0_AF0EM4_GRVW4_GSU1_NLCA1_NLCB1_SU0_SUS256_SRVW0_TT2_16_WG32_8_1_WGM15
    SolutionIndex: 76
    SolutionNameMin: Cijk_Ailk_Bjlk_BSS_BH_MT96x128x64_MI32x32x4x1_SE_1LDSB0_AF0EM1_GRVW8_GSU3_NLCA3_NLCB1_SU32_SUS256_SRVW0_TT3_32_WG32_8_1_WGM1
    SolutionIndex: 77
    SolutionNameMin: Cijk_Ailk_Bjlk_BSS_BH_MT128x128x32_MI32x32x4x1_SE_1LDSB0_AF0EM8_GRVW8_GSU15_NLCA1_NLCB1_SU0_SUS256_SRVW0_TT2_64_WG64_4_1_WGM1
    SolutionIndex: 78
    SolutionNameMin: Cijk_Ailk_Bjlk_BSS_BH_MT128x256x16_MI32x32x4x1_SE_1LDSB1_AF0EM8_GRVW4_GSU7_NLCA1_NLCB1_SU0_SUS256_SRVW0_TT2_128_WG64_4_1_WGM2
    SolutionIndex: 79
    SolutionNameMin: Cijk_Ailk_Bjlk_BSS_BH_MT64x32x16_MI16x16x8x1_SE_1LDSB0_AF0EM8_GRVW8_GSU1_NLCA1_NLCB1_SU0_SUS256_SRVW4_TT2_16_WG32_8_1_WGM1
    SolutionIndex: 80
    SolutionNameMin: Cijk_Ailk_Bjlk_BSS_BH_MT64x256x16_MI32x32x4x1_SE_1LDSB0_AF0EM8_GRVW8_GSU1_NLCA1_NLCB1_SU0_SUS128_SRVW4_TT1_128_WG64_4_1_WGM1
    SolutionIndex: 81
    SolutionNameMin: Cijk_Ailk_Bjlk_BSS_BH_MT128x96x32_MI32x32x4x1_SE_1LDSB0_AF0EM4_GRVW4_GSU1_NLCA1_NLCB3_SU32_SUS256_SRVW4_TT1_96_WG128_2_1_WGM2
    SolutionIndex: 82
    SolutionNameMin: Cijk_Ailk_Bjlk_BSS_BH_MT64x64x64_MI32x32x4x1_SE_1LDSB0_AF0EM8_GRVW8_GSU1_NLCA1_NLCB1_SU32_SUS128_SRVW4_TT1_32_WG64_4_1_WGM1
    SolutionIndex: 83
    SolutionNameMin: Cijk_Ailk_Bjlk_BSS_BH_MT64x128x32_MI32x32x4x1_SE_1LDSB0_AF0EM8_GRVW8_GSU1_NLCA1_NLCB1_SU0_SUS256_SRVW4_TT1_64_WG64_4_1_WGM1
    SolutionIndex: 84
    SolutionNameMin: Cijk_Ailk_Bjlk_BSS_BH_MT32x64x16_MI16x16x8x1_SE_1LDSB0_AF0EM4_GRVW2_GSU1_NLCA1_NLCB1_SU16_SUS128_SRVW0_TT1_32_WG32_8_1_WGM15
    SolutionIndex: 85
    SolutionNameMin: Cijk_Ailk_Bjlk_BSS_BH_MT64x32x16_MI16x16x8x1_SE_1LDSB0_AF0EM4_GRVW2_GSU1_NLCA1_NLCB1_SU16_SUS256_SRVW0_TT2_16_WG32_8_1_WGM2
    SolutionIndex: 86
    SolutionNameMin: Cijk_Ailk_Bjlk_BSS_BH_MT64x32x16_MI16x16x8x1_SE_1LDSB0_AF0EM4_GRVW2_GSU1_NLCA1_NLCB1_SU32_SUS128_SRVW0_TT2_16_WG32_8_1_WGM1
    SolutionIndex: 87
    SolutionNameMin: Cijk_Ailk_Bjlk_BSS_BH_MT128x160x32_MI32x32x4x1_SE_1LDSB0_AF0EM8_GRVW4_GSU2_NLCA1_NLCB5_SU0_SUS256_SRVW0_TT1_160_WG128_2_1_WGM2
    SolutionIndex: 88
    SolutionNameMin: Cijk_Ailk_Bjlk_BSS_BH_MT128x96x32_MI32x32x4x1_SE_1LDSB0_AF0EM4_GRVW4_GSU1_NLCA1_NLCB3_SU16_SUS128_SRVW4_TT1_96_WG128_2_1_WGM15
    SolutionIndex: 89
    SolutionNameMin: Cijk_Ailk_Bjlk_BSS_BH_MT128x96x32_MI32x32x4x1_SE_1LDSB0_AF0EM1_GRVW4_GSU1_NLCA1_NLCB3_SU32_SUS128_SRVW4_TT1_96_WG128_2_1_WGM15
    SolutionIndex: 90
    SolutionNameMin: Cijk_Ailk_Bjlk_BSS_BH_MT128x256x16_MI32x32x4x1_SE_1LDSB0_AF0EM4_GRVW8_GSU1_NLCA1_NLCB1_SU16_SUS128_SRVW4_TT2_128_WG64_4_1_WGM2
    SolutionIndex: 91
    SolutionNameMin: Cijk_Ailk_Bjlk_BSS_BH_MT160x128x32_MI32x32x4x1_SE_1LDSB0_AF0EM8_GRVW4_GSU2_NLCA5_NLCB1_SU0_SUS256_SRVW0_TT5_32_WG32_8_1_WGM1
    SolutionIndex: 92
    SolutionNameMin: Cijk_Ailk_Bjlk_BSS_BH_MT128x160x32_MI32x32x4x1_SE_1LDSB0_AF0EM8_GRVW2_GSU2_NLCA1_NLCB5_SU0_SUS128_SRVW0_TT1_160_WG128_2_1_WGM15
    SolutionIndex: 93
    SolutionNameMin: Cijk_Ailk_Bjlk_BSS_BH_MT128x160x32_MI32x32x4x1_SE_1LDSB0_AF0EM8_GRVW2_GSU2_NLCA1_NLCB5_SU0_SUS128_SRVW0_TT1_160_WG128_2_1_WGM2
    SolutionIndex: 94
    SolutionNameMin: Cijk_Ailk_Bjlk_BSS_BH_MT128x80x64_MI16x16x8x1_SE_1LDSB0_AF0EM4_GRVW2_GSU1_NLCA1_NLCB5_SU32_SUS256_SRVW0_TT2_80_WG64_4_1_WGM2
    SolutionIndex: 95
    SolutionNameMin: Cijk_Ailk_Bjlk_BSS_BH_MT128x160x32_MI32x32x4x1_SE_1LDSB0_AF0EM8_GRVW4_GSU2_NLCA1_NLCB5_SU0_SUS256_SRVW0_TT1_160_WG128_2_1_WGM15
    SolutionIndex: 96
    SolutionNameMin: Cijk_Ailk_Bjlk_BSS_BH_MT128x96x32_MI32x32x4x1_SE_1LDSB0_AF0EM8_GRVW4_GSU1_NLCA1_NLCB3_SU32_SUS128_SRVW4_TT1_96_WG128_2_1_WGM15
    SolutionIndex: 97
    SolutionNameMin: Cijk_Ailk_Bjlk_BSS_BH_MT128x80x64_MI16x16x8x1_SE_1LDSB0_AF0EM4_GRVW2_GSU1_NLCA1_NLCB5_SU0_SUS256_SRVW4_TT2_80_WG64_4_1_WGM15
    SolutionIndex: 98
    SolutionNameMin: Cijk_Ailk_Bjlk_BSS_BH_MT128x80x64_MI16x16x8x1_SE_1LDSB0_AF0EM4_GRVW2_GSU1_NLCA1_NLCB5_SU16_SUS256_SRVW4_TT2_80_WG64_4_1_WGM2
    SolutionIndex: 99
    SolutionNameMin: Cijk_Ailk_Bjlk_BSS_BH_MT128x288x16_MI32x32x4x1_SE_1LDSB0_AF0EM4_GRVW2_GSU1_NLCA1_NLCB9_SU32_SUS128_SRVW4_TT1_288_WG128_2_1_WGM2
    SolutionIndex: 100
    SolutionNameMin: Cijk_Ailk_Bjlk_BSS_BH_MT128x288x16_MI32x32x4x1_SE_1LDSB0_AF0EM4_GRVW2_GSU1_NLCA1_NLCB9_SU16_SUS128_SRVW4_TT1_288_WG128_2_1_WGM1
    SolutionIndex: 101
    SolutionNameMin: Cijk_Ailk_Bjlk_BSS_BH_MT128x288x16_MI32x32x4x1_SE_1LDSB0_AF0EM4_GRVW2_GSU1_NLCA1_NLCB9_SU32_SUS256_SRVW4_TT1_288_WG128_2_1_WGM2
    SolutionIndex: 102
    SolutionNameMin: Cijk_Ailk_Bjlk_BSS_BH_MT128x288x16_MI32x32x4x1_SE_1LDSB0_AF0EM4_GRVW2_GSU1_NLCA1_NLCB9_SU16_SUS128_SRVW4_TT1_288_WG128_2_1_WGM15
    SolutionIndex: 103
    SolutionNameMin: Cijk_Ailk_Bjlk_BSS_BH_MT128x96x32_MI32x32x4x1_SE_1LDSB0_AF0EM4_GRVW4_GSU1_NLCA1_NLCB3_SU16_SUS128_SRVW4_TT1_96_WG128_2_1_WGM2
    SolutionIndex: 104
    SolutionNameMin: Cijk_Ailk_Bjlk_BSS_BH_MT32x64x16_MI16x16x8x1_SE_1LDSB0_AF0EM1_GRVW2_GSU1_NLCA1_NLCB1_SU32_SUS256_SRVW4_TT1_32_WG32_8_1_WGM1
    SolutionIndex: 105
    SolutionNameMin: Cijk_Ailk_Bjlk_BSS_BH_MT32x64x16_MI16x16x8x1_SE_1LDSB0_AF0EM1_GRVW4_GSU1_NLCA1_NLCB1_SU16_SUS128_SRVW4_TT1_32_WG32_8_1_WGM1
    SolutionIndex: 106
    SolutionNameMin: Cijk_Ailk_Bjlk_BSS_BH_MT32x64x16_MI16x16x8x1_SE_1LDSB0_AF0EM1_GRVW2_GSU1_NLCA1_NLCB1_SU16_SUS128_SRVW4_TT1_32_WG32_8_1_WGM15
    SolutionIndex: 107
    SolutionNameMin: Cijk_Ailk_Bjlk_BSS_BH_MT32x64x16_MI16x16x8x1_SE_1LDSB0_AF0EM1_GRVW4_GSU1_NLCA1_NLCB1_SU0_SUS256_SRVW4_TT1_32_WG32_8_1_WGM15
    SolutionIndex: 108
    SolutionNameMin: Cijk_Ailk_Bjlk_BSS_BH_MT32x64x16_MI16x16x8x1_SE_1LDSB0_AF0EM1_GRVW2_GSU1_NLCA1_NLCB1_SU32_SUS128_SRVW4_TT1_32_WG32_8_1_WGM2
    SolutionIndex: 109
    SolutionNameMin: Cijk_Ailk_Bjlk_BSS_BH_MT32x64x16_MI16x16x8x1_SE_1LDSB0_AF0EM1_GRVW8_GSU1_NLCA1_NLCB1_SU0_SUS128_SRVW4_TT1_32_WG32_8_1_WGM15
    SolutionIndex: 110
    SolutionNameMin: Cijk_Ailk_Bjlk_BSS_BH_MT32x64x16_MI16x16x8x1_SE_1LDSB0_AF0EM4_GRVW2_GSU1_NLCA1_NLCB1_SU0_SUS128_SRVW0_TT1_32_WG32_8_1_WGM2
    SolutionIndex: 111
    SolutionNameMin: Cijk_Ailk_Bjlk_BSS_BH_MT32x64x16_MI16x16x8x1_SE_1LDSB0_AF0EM1_GRVW2_GSU1_NLCA1_NLCB1_SU32_SUS128_SRVW4_TT1_32_WG32_8_1_WGM15
    SolutionIndex: 112
    SolutionNameMin: Cijk_Ailk_Bjlk_BSS_BH_MT32x32x32_MI16x16x8x1_SE_1LDSB0_AF0EM1_GRVW4_GSU1_NLCA1_NLCB1_SU32_SUS128_SRVW4_TT1_16_WG32_8_1_WGM1
    SolutionIndex: 113
    SolutionNameMin: Cijk_Ailk_Bjlk_BSS_BH_MT32x64x16_MI16x16x8x1_SE_1LDSB0_AF0EM1_GRVW4_GSU1_NLCA1_NLCB1_SU32_SUS128_SRVW4_TT1_32_WG32_8_1_WGM2
    SolutionIndex: 114
    SolutionNameMin: Cijk_Ailk_Bjlk_BSS_BH_MT32x64x16_MI16x16x8x1_SE_1LDSB0_AF0EM1_GRVW8_GSU1_NLCA1_NLCB1_SU0_SUS256_SRVW4_TT1_32_WG32_8_1_WGM1
    SolutionIndex: 115
    SolutionNameMin: Cijk_Ailk_Bjlk_BSS_BH_MT64x32x16_MI16x16x8x1_SE_1LDSB0_AF0EM4_GRVW2_GSU1_NLCA1_NLCB1_SU32_SUS256_SRVW0_TT2_16_WG32_8_1_WGM1
    SolutionIndex: 116
    SolutionNameMin: Cijk_Ailk_Bjlk_BSS_BH_MT64x32x16_MI16x16x8x1_SE_1LDSB0_AF0EM4_GRVW2_GSU1_NLCA1_NLCB1_SU16_SUS256_SRVW0_TT2_16_WG32_8_1_WGM15
    SolutionIndex: 117
    SolutionNameMin: Cijk_Ailk_Bjlk_BSS_BH_MT64x32x16_MI16x16x8x1_SE_1LDSB0_AF0EM4_GRVW4_GSU1_NLCA1_NLCB1_SU16_SUS128_SRVW4_TT2_16_WG32_8_1_WGM1
    SolutionIndex: 118
    SolutionNameMin: Cijk_Ailk_Bjlk_BSS_BH_MT64x32x16_MI16x16x8x1_SE_1LDSB0_AF0EM8_GRVW2_GSU1_NLCA1_NLCB1_SU0_SUS128_SRVW4_TT2_16_WG32_8_1_WGM1
    SolutionIndex: 119
    SolutionNameMin: Cijk_Ailk_Bjlk_BSS_BH_MT32x64x16_MI16x16x8x1_SE_1LDSB0_AF0EM4_GRVW2_GSU1_NLCA1_NLCB1_SU32_SUS128_SRVW0_TT1_32_WG32_8_1_WGM1
    SolutionIndex: 120
    SolutionNameMin: Cijk_Ailk_Bjlk_BSS_BH_MT32x64x16_MI16x16x8x1_SE_1LDSB0_AF0EM4_GRVW2_GSU1_NLCA1_NLCB1_SU32_SUS256_SRVW0_TT1_32_WG32_8_1_WGM1
    SolutionIndex: 121
    SolutionNameMin: Cijk_Ailk_Bjlk_BSS_BH_MT32x32x64_MI16x16x8x1_SE_1LDSB0_AF0EM8_GRVW8_GSU1_NLCA1_NLCB1_SU32_SUS256_SRVW4_TT1_16_WG32_8_1_WGM1
    SolutionIndex: 122
    SolutionNameMin: Cijk_Ailk_Bjlk_BSS_BH_MT64x32x128_MI16x16x8x1_SE_1LDSB0_AF0EM1_GRVW8_GSU1_NLCA1_NLCB1_SU0_SUS256_SRVW0_TT2_16_WG32_8_1_WGM2
    SolutionIndex: 123
    SolutionNameMin: Cijk_Ailk_Bjlk_BSS_BH_MT32x32x64_MI16x16x8x1_SE_1LDSB0_AF0EM1_GRVW4_GSU1_NLCA1_NLCB1_SU16_SUS128_SRVW0_TT1_16_WG32_8_1_WGM1
    SolutionIndex: 124
    SolutionNameMin: Cijk_Ailk_Bjlk_BSS_BH_MT32x32x32_MI16x16x8x1_SE_1LDSB0_AF0EM4_GRVW2_GSU1_NLCA1_NLCB1_SU0_SUS128_SRVW0_TT1_16_WG32_8_1_WGM1
    SolutionIndex: 125
    SolutionNameMin: Cijk_Ailk_Bjlk_BSS_BH_MT32x32x64_MI16x16x8x1_SE_1LDSB0_AF0EM1_GRVW8_GSU1_NLCA1_NLCB1_SU16_SUS128_SRVW0_TT1_16_WG32_8_1_WGM1
    SolutionIndex: 126
    SolutionNameMin: Cijk_Ailk_Bjlk_BSS_BH_MT64x32x16_MI16x16x8x1_SE_1LDSB0_AF0EM4_GRVW2_GSU1_NLCA1_NLCB1_SU32_SUS128_SRVW0_TT2_16_WG32_8_1_WGM15
    SolutionIndex: 127
    SolutionNameMin: Cijk_Ailk_Bjlk_BSS_BH_MT64x128x32_MI32x32x4x1_SE_1LDSB0_AF0EM1_GRVW8_GSU1_NLCA1_NLCB1_SU32_SUS128_SRVW4_TT1_64_WG64_4_1_WGM1
    SolutionIndex: 128
    SolutionNameMin: Cijk_Ailk_Bjlk_BSS_BH_MT32x32x64_MI16x16x8x1_SE_1LDSB0_AF0EM8_GRVW8_GSU5_NLCA1_NLCB1_SU32_SUS256_SRVW0_TT1_16_WG32_8_1_WGM2
    SolutionIndex: 129
    SolutionNameMin: Cijk_Ailk_Bjlk_BSS_BH_MT64x16x32_MI16x16x8x1_SE_1LDSB0_AF0EM1_GRVW8_GSU1_NLCA1_NLCB1_SU0_SUS128_SRVW0_TT1_16_WG64_4_1_WGM1
    SolutionIndex: 130
    SolutionNameMin: Cijk_Ailk_Bjlk_BSS_BH_MT64x80x64_MI16x16x8x1_SE_1LDSB0_AF0EM4_GRVW2_GSU1_NLCA1_NLCB5_SU0_SUS256_SRVW0_TT1_80_WG64_4_1_WGM1
    SolutionIndex: 131
    SolutionNameMin: Cijk_Ailk_Bjlk_BSS_BH_MT64x64x64_MI32x32x4x1_SE_1LDSB0_AF0EM8_GRVW8_GSU1_NLCA1_NLCB1_SU0_SUS128_SRVW4_TT1_32_WG64_4_1_WGM1
    SolutionIndex: 132
    SolutionNameMin: Cijk_Ailk_Bjlk_BSS_BH_MT16x16x16_MI16x16x8x1_SE_1LDSB0_AF0EM1_GRVW4_GSU1_NLCA1_NLCB1_SU0_SUS128_SRVW4_TT1_16_WG16_4_1_WGM1
    SolutionIndex: 133
    SolutionNameMin: Cijk_Ailk_Bjlk_BSS_BH_MT32x64x16_MI16x16x8x1_SE_1LDSB0_AF0EM1_GRVW2_GSU1_NLCA1_NLCB1_SU0_SUS256_SRVW0_TT1_32_WG32_8_1_WGM2
    SolutionIndex: 134
    SolutionNameMin: Cijk_Ailk_Bjlk_BSS_BH_MT32x64x16_MI16x16x8x1_SE_1LDSB0_AF0EM1_GRVW2_GSU1_NLCA1_NLCB1_SU32_SUS128_SRVW4_TT1_32_WG32_8_1_WGM1
    SolutionIndex: 135
    SolutionNameMin: Cijk_Ailk_Bjlk_BSS_BH_MT64x32x16_MI16x16x8x1_SE_1LDSB0_AF0EM1_GRVW4_GSU1_NLCA1_NLCB1_SU0_SUS128_SRVW4_TT2_16_WG32_8_1_WGM1
    SolutionIndex: 136
    SolutionNameMin: Cijk_Ailk_Bjlk_BSS_BH_MT64x64x32_MI32x32x4x1_SE_1LDSB0_AF0EM4_GRVW8_GSU1_NLCA1_NLCB1_SU0_SUS128_SRVW4_TT1_32_WG64_4_1_WGM2
    SolutionIndex: 137
    SolutionNameMin: Cijk_Ailk_Bjlk_BSS_BH_MT64x64x64_MI32x32x4x1_SE_1LDSB0_AF0EM8_GRVW8_GSU3_NLCA1_NLCB1_SU32_SUS128_SRVW0_TT1_32_WG64_4_1_WGM2
    SolutionIndex: 138
    SolutionNameMin: Cijk_Ailk_Bjlk_BSS_BH_MT64x128x32_MI32x32x4x1_SE_1LDSB0_AF0EM8_GRVW8_GSU3_NLCA1_NLCB1_SU0_SUS256_SRVW0_TT1_64_WG64_4_1_WGM15
    SolutionIndex: 139
    SolutionNameMin: Cijk_Ailk_Bjlk_BSS_BH_MT128x96x32_MI32x32x4x1_SE_1LDSB0_AF0EM8_GRVW4_GSU2_NLCA1_NLCB3_SU0_SUS256_SRVW0_TT1_96_WG128_2_1_WGM15
    SolutionIndex: 140
    SolutionNameMin: Cijk_Ailk_Bjlk_BSS_BH_MT64x128x32_MI32x32x4x1_SE_1LDSB0_AF0EM1_GRVW8_GSU1_NLCA1_NLCB1_SU16_SUS128_SRVW4_TT1_64_WG64_4_1_WGM1
    SolutionIndex: 141
    SolutionNameMin: Cijk_Ailk_Bjlk_BSS_BH_MT64x64x64_MI32x32x4x1_SE_1LDSB0_AF0EM8_GRVW8_GSU1_NLCA1_NLCB1_SU0_SUS128_SRVW4_TT1_32_WG64_4_1_WGM15
    SolutionIndex: 142
    SolutionNameMin: Cijk_Ailk_Bjlk_BSS_BH_MT128x64x64_MI32x32x4x1_SE_1LDSB0_AF0EM4_GRVW4_GSU1_NLCA1_NLCB1_SU0_SUS128_SRVW4_TT2_32_WG64_4_1_WGM2
    SolutionIndex: 143
    SolutionNameMin: Cijk_Ailk_Bjlk_BSS_BH_MT128x128x32_MI32x32x4x1_SE_1LDSB0_AF0EM8_GRVW8_GSU3_NLCA1_NLCB1_SU0_SUS256_SRVW0_TT2_64_WG64_4_1_WGM1
    SolutionIndex: 144
    SolutionNameMin: Cijk_Ailk_Bjlk_BSS_BH_MT256x160x16_MI32x32x4x1_SE_1LDSB0_AF0EM8_GRVW2_GSU3_NLCA2_NLCB5_SU32_SUS128_SRVW0_TT2_160_WG128_2_1_WGM1
    SolutionIndex: 145
    SolutionNameMin: Cijk_Ailk_Bjlk_BSS_BH_MT128x128x32_MI32x32x4x1_SE_1LDSB0_AF0EM1_GRVW8_GSU1_NLCA1_NLCB1_SU32_SUS128_SRVW4_TT2_64_WG64_4_1_WGM2
    SolutionIndex: 146
    SolutionNameMin: Cijk_Ailk_Bjlk_BSS_BH_MT128x144x32_MI16x16x8x1_SE_1LDSB0_AF0EM8_GRVW2_GSU1_NLCA1_NLCB9_SU0_SUS256_SRVW4_TT2_144_WG64_4_1_WGM2
    SolutionIndex: 147
    SolutionNameMin: Cijk_Ailk_Bjlk_BSS_BH_MT128x160x32_MI32x32x4x1_SE_1LDSB0_AF0EM4_GRVW2_GSU1_NLCA1_NLCB5_SU16_SUS128_SRVW4_TT1_160_WG128_2_1_WGM2
    SolutionIndex: 148
    SolutionNameMin: Cijk_Ailk_Bjlk_BSS_BH_MT128x256x16_MI32x32x4x1_SE_1LDSB0_AF0EM8_GRVW8_GSU3_NLCA1_NLCB1_SU0_SUS128_SRVW0_TT2_128_WG64_4_1_WGM2
    SolutionIndex: 149
    SolutionNameMin: Cijk_Ailk_Bjlk_BSS_BH_MT64x128x32_MI32x32x4x1_SE_1LDSB0_AF0EM8_GRVW8_GSU3_NLCA1_NLCB1_SU32_SUS256_SRVW0_TT1_64_WG64_4_1_WGM2
    SolutionIndex: 150
    SolutionNameMin: Cijk_Ailk_Bjlk_BSS_BH_MT128x256x16_MI32x32x4x1_SE_1LDSB0_AF0EM4_GRVW8_GSU1_NLCA1_NLCB1_SU0_SUS128_SRVW4_TT2_128_WG64_4_1_WGM2
    SolutionIndex: 151
    SolutionNameMin: Cijk_Ailk_Bjlk_BSS_BH_MT128x256x16_MI32x32x4x1_SE_1LDSB0_AF0EM4_GRVW4_GSU1_NLCA1_NLCB1_SU16_SUS256_SRVW4_TT2_128_WG64_4_1_WGM2
    SolutionIndex: 152
    SolutionNameMin: Cijk_Ailk_Bjlk_BSS_BH_MT128x256x16_MI32x32x4x1_SE_1LDSB0_AF0EM1_GRVW8_GSU1_NLCA1_NLCB1_SU0_SUS256_SRVW4_TT2_128_WG64_4_1_WGM1
    SolutionIndex: 153
    SolutionNameMin: Cijk_Ailk_Bjlk_BSS_BH_MT128x256x16_MI32x32x4x1_SE_1LDSB0_AF0EM4_GRVW8_GSU1_NLCA1_NLCB1_SU16_SUS128_SRVW4_TT2_128_WG64_4_1_WGM1
    SolutionIndex: 154
    SolutionNameMin: Cijk_Ailk_Bjlk_BSS_BH_MT256x160x16_MI32x32x4x1_SE_1LDSB0_AF0EM8_GRVW2_GSU1_NLCA2_NLCB5_SU32_SUS256_SRVW4_TT2_160_WG128_2_1_WGM2
    SolutionIndex: 155
    SolutionNameMin: Cijk_Ailk_Bjlk_BSS_BH_MT128x256x16_MI32x32x4x1_SE_1LDSB0_AF0EM8_GRVW8_GSU3_NLCA1_NLCB1_SU0_SUS256_SRVW0_TT2_128_WG64_4_1_WGM1
    SolutionIndex: 156
    SolutionNameMin: Cijk_Ailk_Bjlk_BSS_BH_MT64x128x32_MI32x32x4x1_SE_1LDSB0_AF0EM1_GRVW8_GSU1_NLCA1_NLCB1_SU0_SUS256_SRVW4_TT1_64_WG64_4_1_WGM1
    SolutionIndex: 157
    SolutionNameMin: Cijk_Ailk_Bjlk_BSS_BH_MT32x32x64_MI16x16x8x1_SE_1LDSB0_AF0EM4_GRVW8_GSU1_NLCA1_NLCB1_SU0_SUS256_SRVW0_TT1_16_WG32_8_1_WGM1
    SolutionIndex: 158
    SolutionNameMin: Cijk_Ailk_Bjlk_BSS_BH_MT32x32x64_MI16x16x8x1_SE_1LDSB0_AF0EM4_GRVW8_GSU1_NLCA1_NLCB1_SU32_SUS128_SRVW0_TT1_16_WG32_8_1_WGM1
    SolutionIndex: 159
    SolutionNameMin: Cijk_Ailk_Bjlk_BSS_BH_MT64x64x64_MI32x32x4x1_SE_1LDSB0_AF0EM4_GRVW8_GSU1_NLCA1_NLCB1_SU32_SUS128_SRVW4_TT1_32_WG64_4_1_WGM2
    SolutionIndex: 160
    SolutionNameMin: Cijk_Ailk_Bjlk_BSS_BH_MT128x128x32_MI32x32x4x1_SE_1LDSB0_AF0EM8_GRVW8_GSU7_NLCA1_NLCB1_SU0_SUS256_SRVW0_TT2_64_WG64_4_1_WGM1
    SolutionIndex: 161
    SolutionNameMin: Cijk_Ailk_Bjlk_BSS_BH_MT128x128x32_MI32x32x4x1_SE_1LDSB0_AF0EM8_GRVW8_GSU7_NLCA1_NLCB1_SU32_SUS256_SRVW0_TT2_64_WG64_4_1_WGM1
    SolutionIndex: 162
    SolutionNameMin: Cijk_Ailk_Bjlk_BSS_BH_MT256x64x32_MI32x32x4x1_SE_1LDSB0_AF0EM8_GRVW8_GSU7_NLCA1_NLCB1_SU0_SUS256_SRVW0_TT4_32_WG64_4_1_WGM1
    SolutionIndex: 163
    SolutionNameMin: Cijk_Ailk_Bjlk_BSS_BH_MT128x128x16_MI32x32x4x1_SE_1LDSB0_AF0EM8_GRVW8_GSU7_NLCA1_NLCB1_SU32_SUS256_SRVW0_TT2_64_WG64_4_1_WGM1
    SolutionIndex: 164
    SolutionNameMin: Cijk_Ailk_Bjlk_BSS_BH_MT96x128x32_MI32x32x4x1_SE_1LDSB0_AF0EM8_GRVW4_GSU5_NLCA3_NLCB1_SU0_SUS128_SRVW0_TT3_32_WG32_8_1_WGM15
    SolutionIndex: 165
    SolutionNameMin: Cijk_Ailk_Bjlk_BSS_BH_MT256x64x32_MI32x32x4x1_SE_1LDSB0_AF0EM8_GRVW8_GSU7_NLCA1_NLCB1_SU0_SUS256_SRVW0_TT4_32_WG64_4_1_WGM2
    SolutionIndex: 166
    SolutionNameMin: Cijk_Ailk_Bjlk_BSS_BH_MT96x128x32_MI32x32x4x1_SE_1LDSB0_AF0EM8_GRVW4_GSU5_NLCA3_NLCB1_SU32_SUS128_SRVW0_TT3_32_WG32_8_1_WGM15
    SolutionIndex: 167
    SolutionNameMin: Cijk_Ailk_Bjlk_BSS_BH_MT256x64x32_MI32x32x4x1_SE_1LDSB0_AF0EM8_GRVW8_GSU7_NLCA1_NLCB1_SU32_SUS128_SRVW0_TT4_32_WG64_4_1_WGM1
    SolutionIndex: 168
    SolutionNameMin: Cijk_Ailk_Bjlk_BSS_BH_MT128x128x16_MI32x32x4x1_SE_1LDSB0_AF0EM8_GRVW8_GSU7_NLCA1_NLCB1_SU0_SUS256_SRVW0_TT2_64_WG64_4_1_WGM1
    SolutionIndex: 169
    SolutionNameMin: Cijk_Ailk_Bjlk_BSS_BH_MT128x128x16_MI32x32x4x1_SE_1LDSB0_AF0EM8_GRVW8_GSU15_NLCA1_NLCB1_SU0_SUS128_SRVW0_TT2_64_WG64_4_1_WGM1
    SolutionIndex: 170
    SolutionNameMin: Cijk_Ailk_Bjlk_BSS_BH_MT64x128x32_MI32x32x4x1_SE_1LDSB0_AF0EM8_GRVW8_GSU1_NLCA1_NLCB1_SU32_SUS128_SRVW4_TT1_64_WG64_4_1_WGM1
    SolutionIndex: 171
    SolutionNameMin: Cijk_Ailk_Bjlk_BSS_BH_MT64x64x64_MI32x32x4x1_SE_1LDSB0_AF0EM4_GRVW8_GSU1_NLCA1_NLCB1_SU32_SUS128_SRVW4_TT1_32_WG64_4_1_WGM1
    SolutionIndex: 172
    SolutionNameMin: Cijk_Ailk_Bjlk_BSS_BH_MT64x32x16_MI16x16x8x1_SE_1LDSB0_AF0EM8_GRVW4_GSU1_NLCA1_NLCB1_SU0_SUS256_SRVW4_TT2_16_WG32_8_1_WGM2
    SolutionIndex: 173
    SolutionNameMin: Cijk_Ailk_Bjlk_BSS_BH_MT64x128x32_MI32x32x4x1_SE_1LDSB0_AF0EM1_GRVW8_GSU1_NLCA1_NLCB1_SU32_SUS256_SRVW4_TT1_64_WG64_4_1_WGM1
    SolutionIndex: 174
    SolutionNameMin: Cijk_Ailk_Bjlk_BSS_BH_MT32x32x16_MI16x16x8x1_SE_1LDSB0_AF0EM4_GRVW4_GSU1_NLCA1_NLCB1_SU0_SUS256_SRVW0_TT1_16_WG32_8_1_WGM1
    SolutionIndex: 175
    SolutionNameMin: Cijk_Ailk_Bjlk_BSS_BH_MT96x96x32_MI16x16x8x1_SE_1LDSB0_AF0EM8_GRVW2_GSU1_NLCA3_NLCB3_SU0_SUS128_SRVW0_TT3_48_WG32_8_1_WGM1
    SolutionIndex: 176
    SolutionNameMin: Cijk_Ailk_Bjlk_BSS_BH_MT64x128x16_MI32x32x4x1_SE_1LDSB0_AF0EM1_GRVW2_GSU1_NLCA1_NLCB1_SU16_SUS256_SRVW4_TT1_64_WG64_4_1_WGM1
    SolutionIndex: 177
    SolutionNameMin: Cijk_Ailk_Bjlk_BSS_BH_MT64x128x32_MI32x32x4x1_SE_1LDSB0_AF0EM4_GRVW8_GSU1_NLCA1_NLCB1_SU32_SUS128_SRVW4_TT1_64_WG64_4_1_WGM15
    SolutionIndex: 178
    SolutionNameMin: Cijk_Ailk_Bjlk_BSS_BH_MT96x96x64_MI16x16x8x1_SE_1LDSB0_AF0EM8_GRVW2_GSU1_NLCA3_NLCB3_SU32_SUS128_SRVW0_TT3_48_WG32_8_1_WGM1
    SolutionIndex: 179
    SolutionNameMin: Cijk_Ailk_Bjlk_BSS_BH_MT64x128x32_MI32x32x4x1_SE_1LDSB0_AF0EM8_GRVW8_GSU1_NLCA1_NLCB1_SU0_SUS256_SRVW4_TT1_64_WG64_4_1_WGM15
    SolutionIndex: 180
    SolutionNameMin: Cijk_Ailk_Bjlk_BSS_BH_MT64x128x32_MI32x32x4x1_SE_1LDSB0_AF0EM4_GRVW8_GSU1_NLCA1_NLCB1_SU0_SUS256_SRVW4_TT1_64_WG64_4_1_WGM15
    SolutionIndex: 181
    SolutionNameMin: Cijk_Ailk_Bjlk_BSS_BH_MT16x16x16_MI16x16x8x1_SE_1LDSB0_AF0EM8_GRVW2_GSU1_NLCA1_NLCB1_SU0_SUS128_SRVW0_TT1_16_WG16_4_1_WGM1
    SolutionIndex: 182
    SolutionNameMin: Cijk_Ailk_Bjlk_BSS_BH_MT64x32x16_MI16x16x8x1_SE_1LDSB0_AF0EM1_GRVW2_GSU1_NLCA1_NLCB1_SU32_SUS256_SRVW4_TT2_16_WG32_8_1_WGM1
    SolutionIndex: 183
    SolutionNameMin: Cijk_Ailk_Bjlk_BSS_BH_MT160x128x32_MI32x32x4x1_SE_1LDSB0_AF0EM8_GRVW2_GSU1_NLCA5_NLCB1_SU0_SUS256_SRVW0_TT5_32_WG32_8_1_WGM2
    SolutionIndex: 184
    SolutionNameMin: Cijk_Ailk_Bjlk_BSS_BH_MT64x256x16_MI32x32x4x1_SE_1LDSB0_AF0EM8_GRVW8_GSU1_NLCA1_NLCB1_SU32_SUS256_SRVW4_TT1_128_WG64_4_1_WGM1
    SolutionIndex: 185
    SolutionNameMin: Cijk_Ailk_Bjlk_BSS_BH_MT96x96x32_MI16x16x8x1_SE_1LDSB0_AF0EM8_GRVW2_GSU1_NLCA3_NLCB3_SU0_SUS256_SRVW0_TT3_48_WG32_8_1_WGM2
    SolutionIndex: 186
    SolutionNameMin: Cijk_Ailk_Bjlk_BSS_BH_MT128x160x32_MI32x32x4x1_SE_1LDSB0_AF0EM8_GRVW2_GSU1_NLCA1_NLCB5_SU0_SUS256_SRVW4_TT1_160_WG128_2_1_WGM2
    SolutionIndex: 187
    SolutionNameMin: Cijk_Ailk_Bjlk_BSS_BH_MT128x160x16_MI32x32x4x1_SE_1LDSB0_AF0EM4_GRVW2_GSU1_NLCA1_NLCB5_SU16_SUS128_SRVW4_TT1_160_WG128_2_1_WGM15
    SolutionIndex: 188
    SolutionNameMin: Cijk_Ailk_Bjlk_BSS_BH_MT128x64x64_MI32x32x4x1_SE_1LDSB0_AF0EM4_GRVW8_GSU1_NLCA1_NLCB1_SU0_SUS256_SRVW4_TT2_32_WG64_4_1_WGM15
    SolutionIndex: 189
    SolutionNameMin: Cijk_Ailk_Bjlk_BSS_BH_MT64x128x16_MI32x32x4x1_SE_1LDSB0_AF0EM1_GRVW8_GSU1_NLCA1_NLCB1_SU32_SUS128_SRVW4_TT1_64_WG64_4_1_WGM1
    SolutionIndex: 190
    SolutionNameMin: Cijk_Ailk_Bjlk_BSS_BH_MT64x64x64_MI32x32x4x1_SE_1LDSB0_AF0EM1_GRVW8_GSU1_NLCA1_NLCB1_SU32_SUS256_SRVW4_TT1_32_WG64_4_1_WGM1
    SolutionIndex: 191
    SolutionNameMin: Cijk_Ailk_Bjlk_BSS_BH_MT128x160x16_MI32x32x4x1_SE_1LDSB0_AF0EM4_GRVW2_GSU1_NLCA1_NLCB5_SU32_SUS128_SRVW4_TT1_160_WG128_2_1_WGM15
    SolutionIndex: 192
    SolutionNameMin: Cijk_Ailk_Bjlk_BSS_BH_MT64x64x64_MI32x32x4x1_SE_1LDSB0_AF0EM4_GRVW8_GSU1_NLCA1_NLCB1_SU0_SUS256_SRVW4_TT1_32_WG64_4_1_WGM1
    SolutionIndex: 193
    SolutionNameMin: Cijk_Ailk_Bjlk_BSS_BH_MT64x128x32_MI32x32x4x1_SE_1LDSB0_AF0EM4_GRVW8_GSU1_NLCA1_NLCB1_SU32_SUS256_SRVW4_TT1_64_WG64_4_1_WGM1
    SolutionIndex: 194
    SolutionNameMin: Cijk_Ailk_Bjlk_BSS_BH_MT64x64x32_MI32x32x4x1_SE_1LDSB0_AF0EM1_GRVW2_GSU1_NLCA1_NLCB1_SU0_SUS128_SRVW4_TT1_32_WG64_4_1_WGM2
    SolutionIndex: 195
    SolutionNameMin: Cijk_Ailk_Bjlk_BSS_BH_MT64x64x32_MI32x32x4x1_SE_1LDSB0_AF0EM8_GRVW2_GSU1_NLCA1_NLCB1_SU0_SUS256_SRVW4_TT1_32_WG64_4_1_WGM15
    SolutionIndex: 196
    SolutionNameMin: Cijk_Ailk_Bjlk_BSS_BH_MT64x64x32_MI32x32x4x1_SE_1LDSB0_AF0EM4_GRVW8_GSU1_NLCA1_NLCB1_SU32_SUS256_SRVW4_TT1_32_WG64_4_1_WGM15
    SolutionIndex: 197
    SolutionNameMin: Cijk_Ailk_Bjlk_BSS_BH_MT64x128x32_MI32x32x4x1_SE_1LDSB0_AF0EM1_GRVW8_GSU1_NLCA1_NLCB1_SU32_SUS128_SRVW4_TT1_64_WG64_4_1_WGM15
    SolutionIndex: 198
    SolutionNameMin: Cijk_Ailk_Bjlk_BSS_BH_MT32x32x64_MI16x16x8x1_SE_1LDSB0_AF0EM8_GRVW2_GSU7_NLCA1_NLCB1_SU0_SUS128_SRVW0_TT1_16_WG32_8_1_WGM2
    SolutionIndex: 199
    SolutionNameMin: Cijk_Ailk_Bjlk_BSS_BH_MT64x32x64_MI16x16x8x1_SE_1LDSB0_AF0EM8_GRVW8_GSU15_NLCA1_NLCB1_SU0_SUS256_SRVW0_TT2_16_WG32_8_1_WGM1
    SolutionIndex: 200
    SolutionNameMin: Cijk_Ailk_Bjlk_BSS_BH_MT64x64x16_MI32x32x4x1_SE_1LDSB0_AF0EM4_GRVW8_GSU1_NLCA1_NLCB1_SU32_SUS256_SRVW4_TT1_32_WG64_4_1_WGM15
    SolutionIndex: 201
    SolutionNameMin: Cijk_Ailk_Bjlk_BSS_BH_MT32x32x16_MI16x16x8x1_SE_1LDSB0_AF0EM4_GRVW2_GSU1_NLCA1_NLCB1_SU32_SUS128_SRVW0_TT1_16_WG32_8_1_WGM15
    SolutionIndex: 202
    SolutionNameMin: Cijk_Ailk_Bjlk_BSS_BH_MT32x32x16_MI16x16x8x1_SE_1LDSB0_AF0EM1_GRVW4_GSU1_NLCA1_NLCB1_SU16_SUS256_SRVW4_TT1_16_WG32_8_1_WGM15
    SolutionIndex: 203
    SolutionNameMin: Cijk_Ailk_Bjlk_BSS_BH_MT96x128x32_MI32x32x4x1_SE_1LDSB0_AF0EM8_GRVW4_GSU3_NLCA3_NLCB1_SU32_SUS128_SRVW0_TT3_32_WG32_8_1_WGM1
    SolutionIndex: 204
    SolutionNameMin: Cijk_Ailk_Bjlk_BSS_BH_MT96x128x32_MI32x32x4x1_SE_1LDSB0_AF0EM8_GRVW4_GSU3_NLCA3_NLCB1_SU0_SUS128_SRVW0_TT3_32_WG32_8_1_WGM1
    SolutionIndex: 205
    SolutionNameMin: Cijk_Ailk_Bjlk_BSS_BH_MT64x128x32_MI32x32x4x1_SE_1LDSB0_AF0EM8_GRVW8_GSU7_NLCA1_NLCB1_SU32_SUS128_SRVW0_TT1_64_WG64_4_1_WGM1
    SolutionIndex: 206
    SolutionNameMin: Cijk_Ailk_Bjlk_BSS_BH_MT64x64x32_MI32x32x4x1_SE_1LDSB0_AF0EM8_GRVW8_GSU7_NLCA1_NLCB1_SU0_SUS128_SRVW0_TT1_32_WG64_4_1_WGM2
    SolutionIndex: 207
    SolutionNameMin: Cijk_Ailk_Bjlk_BSS_BH_MT32x32x64_MI16x16x8x1_SE_1LDSB0_AF0EM4_GRVW2_GSU1_NLCA1_NLCB1_SU0_SUS256_SRVW0_TT1_16_WG32_8_1_WGM2
    SolutionIndex: 208
    SolutionNameMin: Cijk_Ailk_Bjlk_BSS_BH_MT64x256x16_MI32x32x4x1_SE_1LDSB0_AF0EM8_GRVW8_GSU1_NLCA1_NLCB1_SU32_SUS128_SRVW4_TT1_128_WG64_4_1_WGM15
    SolutionIndex: 209
    SolutionNameMin: Cijk_Ailk_Bjlk_BSS_BH_MT64x64x32_MI32x32x4x1_SE_1LDSB0_AF0EM1_GRVW8_GSU1_NLCA1_NLCB1_SU32_SUS256_SRVW4_TT1_32_WG64_4_1_WGM2
    SolutionIndex: 210
    SolutionNameMin: Cijk_Ailk_Bjlk_BSS_BH_MT64x64x32_MI32x32x4x1_SE_1LDSB0_AF0EM4_GRVW4_GSU1_NLCA1_NLCB1_SU16_SUS256_SRVW4_TT1_32_WG64_4_1_WGM2
    SolutionIndex: 211
    SolutionNameMin: Cijk_Ailk_Bjlk_BSS_BH_MT128x256x32_MI32x32x4x1_SE_1LDSB1_AF0EM8_GRVW8_GSU7_NLCA1_NLCB1_SU0_SUS256_SRVW0_TT2_128_WG64_4_1_WGM1
    SolutionIndex: 212
    SolutionNameMin: Cijk_Ailk_Bjlk_BSS_BH_MT32x64x16_MI16x16x8x1_SE_1LDSB0_AF0EM4_GRVW2_GSU1_NLCA1_NLCB1_SU0_SUS128_SRVW0_TT1_32_WG32_8_1_WGM1
    SolutionIndex: 213
    SolutionNameMin: Cijk_Ailk_Bjlk_BSS_BH_MT64x64x32_MI32x32x4x1_SE_1LDSB0_AF0EM4_GRVW4_GSU1_NLCA1_NLCB1_SU16_SUS256_SRVW4_TT1_32_WG64_4_1_WGM15
    SolutionIndex: 214
    SolutionNameMin: Cijk_Ailk_Bjlk_BSS_BH_MT128x96x64_MI32x32x4x1_SE_1LDSB0_AF0EM4_GRVW8_GSU1_NLCA1_NLCB3_SU0_SUS128_SRVW4_TT1_96_WG128_2_1_WGM2
    SolutionIndex: 215
    SolutionNameMin: Cijk_Ailk_Bjlk_BSS_BH_MT64x64x16_MI32x32x4x1_SE_1LDSB0_AF0EM1_GRVW4_GSU1_NLCA1_NLCB1_SU0_SUS128_SRVW4_TT1_32_WG64_4_1_WGM1
    SolutionIndex: 216
    SolutionNameMin: Cijk_Ailk_Bjlk_BSS_BH_MT64x128x16_MI32x32x4x1_SE_1LDSB0_AF0EM8_GRVW2_GSU1_NLCA1_NLCB1_SU0_SUS128_SRVW4_TT1_64_WG64_4_1_WGM1
    SolutionIndex: 217
    SolutionNameMin: Cijk_Ailk_Bjlk_BSS_BH_MT64x32x16_MI16x16x8x1_SE_1LDSB0_AF0EM8_GRVW4_GSU1_NLCA1_NLCB1_SU0_SUS256_SRVW4_TT2_16_WG32_8_1_WGM1
    SolutionIndex: 218
    SolutionNameMin: Cijk_Ailk_Bjlk_BSS_BH_MT64x64x32_MI32x32x4x1_SE_1LDSB0_AF0EM4_GRVW4_GSU1_NLCA1_NLCB1_SU0_SUS256_SRVW4_TT1_32_WG64_4_1_WGM15
    SolutionIndex: 219
    SolutionNameMin: Cijk_Ailk_Bjlk_BSS_BH_MT64x128x32_MI32x32x4x1_SE_1LDSB0_AF0EM8_GRVW8_GSU1_NLCA1_NLCB1_SU32_SUS256_SRVW4_TT1_64_WG64_4_1_WGM15
    SolutionIndex: 220
    SolutionNameMin: Cijk_Ailk_Bjlk_BSS_BH_MT64x128x16_MI32x32x4x1_SE_1LDSB0_AF0EM8_GRVW8_GSU1_NLCA1_NLCB1_SU32_SUS256_SRVW4_TT1_64_WG64_4_1_WGM1
    SolutionIndex: 221
    SolutionNameMin: Cijk_Ailk_Bjlk_BSS_BH_MT64x128x16_MI32x32x4x1_SE_1LDSB0_AF0EM8_GRVW8_GSU1_NLCA1_NLCB1_SU0_SUS128_SRVW4_TT1_64_WG64_4_1_WGM15
    SolutionIndex: 222
    SolutionNameMin: Cijk_Ailk_Bjlk_BSS_BH_MT64x128x32_MI32x32x4x1_SE_1LDSB0_AF0EM1_GRVW8_GSU1_NLCA1_NLCB1_SU0_SUS256_SRVW4_TT1_64_WG64_4_1_WGM15
    SolutionIndex: 223
    SolutionNameMin: Cijk_Ailk_Bjlk_BSS_BH_MT128x160x32_MI32x32x4x1_SE_1LDSB0_AF0EM8_GRVW4_GSU2_NLCA1_NLCB5_SU0_SUS256_SRVW0_TT1_160_WG128_2_1_WGM1
    SolutionIndex: 224
    SolutionNameMin: Cijk_Ailk_Bjlk_BSS_BH_MT160x128x32_MI32x32x4x1_SE_1LDSB0_AF0EM8_GRVW2_GSU2_NLCA5_NLCB1_SU32_SUS256_SRVW0_TT5_32_WG32_8_1_WGM1
    SolutionIndex: 225
    SolutionNameMin: Cijk_Ailk_Bjlk_BSS_BH_MT128x144x32_MI16x16x8x1_SE_1LDSB0_AF0EM8_GRVW2_GSU1_NLCA1_NLCB9_SU0_SUS256_SRVW4_TT2_144_WG64_4_1_WGM1
    SolutionIndex: 226
    SolutionNameMin: Cijk_Ailk_Bjlk_BSS_BH_MT64x256x16_MI32x32x4x1_SE_1LDSB0_AF0EM8_GRVW8_GSU1_NLCA1_NLCB1_SU0_SUS128_SRVW4_TT1_128_WG64_4_1_WGM15
    SolutionIndex: 227
    SolutionNameMin: Cijk_Ailk_Bjlk_BSS_BH_MT64x256x16_MI32x32x4x1_SE_1LDSB0_AF0EM1_GRVW8_GSU1_NLCA1_NLCB1_SU0_SUS256_SRVW4_TT1_128_WG64_4_1_WGM2
    SolutionIndex: 228
    SolutionNameMin: Cijk_Ailk_Bjlk_BSS_BH_MT64x64x32_MI32x32x4x1_SE_1LDSB0_AF0EM4_GRVW8_GSU1_NLCA1_NLCB1_SU16_SUS128_SRVW4_TT1_32_WG64_4_1_WGM1
    SolutionIndex: 229
    SolutionNameMin: Cijk_Ailk_Bjlk_BSS_BH_MT64x64x32_MI32x32x4x1_SE_1LDSB0_AF0EM8_GRVW4_GSU1_NLCA1_NLCB1_SU0_SUS256_SRVW4_TT1_32_WG64_4_1_WGM15
    SolutionIndex: 230
    SolutionNameMin: Cijk_Ailk_Bjlk_BSS_BH_MT64x32x16_MI16x16x8x1_SE_1LDSB0_AF0EM4_GRVW2_GSU1_NLCA1_NLCB1_SU32_SUS256_SRVW4_TT2_16_WG32_8_1_WGM15
    SolutionIndex: 231
    SolutionNameMin: Cijk_Ailk_Bjlk_BSS_BH_MT128x96x16_MI32x32x4x1_SE_1LDSB0_AF0EM4_GRVW2_GSU1_NLCA1_NLCB3_SU0_SUS128_SRVW4_TT1_96_WG128_2_1_WGM1
    SolutionIndex: 232
    SolutionNameMin: Cijk_Ailk_Bjlk_BSS_BH_MT64x256x16_MI32x32x4x1_SE_1LDSB0_AF0EM1_GRVW8_GSU1_NLCA1_NLCB1_SU0_SUS256_SRVW4_TT1_128_WG64_4_1_WGM15
    SolutionIndex: 233
    SolutionNameMin: Cijk_Ailk_Bjlk_BSS_BH_MT64x128x32_MI32x32x4x1_SE_1LDSB0_AF0EM1_GRVW8_GSU1_NLCA1_NLCB1_SU32_SUS256_SRVW4_TT1_64_WG64_4_1_WGM15
    SolutionIndex: 234
    SolutionNameMin: Cijk_Ailk_Bjlk_BSS_BH_MT64x128x16_MI32x32x4x1_SE_1LDSB0_AF0EM1_GRVW8_GSU1_NLCA1_NLCB1_SU16_SUS256_SRVW4_TT1_64_WG64_4_1_WGM1
    SolutionIndex: 235
    SolutionNameMin: Cijk_Ailk_Bjlk_BSS_BH_MT32x64x16_MI16x16x8x1_SE_1LDSB0_AF0EM1_GRVW4_GSU1_NLCA1_NLCB1_SU32_SUS256_SRVW4_TT1_32_WG32_8_1_WGM1
    SolutionIndex: 236
    SolutionNameMin: Cijk_Ailk_Bjlk_BSS_BH_MT128x160x32_MI32x32x4x1_SE_1LDSB0_AF0EM4_GRVW2_GSU1_NLCA1_NLCB5_SU32_SUS128_SRVW4_TT1_160_WG128_2_1_WGM15
    SolutionIndex: 237
    SolutionNameMin: Cijk_Ailk_Bjlk_BSS_BH_MT128x160x32_MI32x32x4x1_SE_1LDSB0_AF0EM4_GRVW2_GSU1_NLCA1_NLCB5_SU32_SUS256_SRVW4_TT1_160_WG128_2_1_WGM15
    SolutionIndex: 238
    SolutionNameMin: Cijk_Ailk_Bjlk_BSS_BH_MT64x128x16_MI32x32x4x1_SE_1LDSB0_AF0EM4_GRVW8_GSU1_NLCA1_NLCB1_SU32_SUS128_SRVW4_TT1_64_WG64_4_1_WGM2
    SolutionIndex: 239
    SolutionNameMin: Cijk_Ailk_Bjlk_BSS_BH_MT16x16x64_MI16x16x8x1_SE_1LDSB0_AF0EM1_GRVW8_GSU7_NLCA1_NLCB1_SU0_SUS256_SRVW0_TT1_16_WG16_4_1_WGM1
    SolutionIndex: 240
    SolutionNameMin: Cijk_Ailk_Bjlk_BSS_BH_MT16x64x64_MI16x16x8x1_SE_1LDSB0_AF0EM1_GRVW2_GSU15_NLCA1_NLCB1_SU0_SUS256_SRVW0_TT1_16_WG16_16_1_WGM1
    SolutionIndex: 241
    SolutionNameMin: Cijk_Ailk_Bjlk_BSS_BH_MT16x16x32_MI16x16x8x1_SE_1LDSB0_AF0EM1_GRVW8_GSU3_NLCA1_NLCB1_SU0_SUS128_SRVW0_TT1_16_WG16_4_1_WGM15
    SolutionIndex: 242
    SolutionNameMin: Cijk_Ailk_Bjlk_BSS_BH_MT64x128x32_MI32x32x4x1_SE_1LDSB0_AF0EM1_GRVW8_GSU1_NLCA1_NLCB1_SU16_SUS128_SRVW4_TT1_64_WG64_4_1_WGM15
    SolutionIndex: 243
    SolutionNameMin: Cijk_Ailk_Bjlk_BSS_BH_MT64x128x32_MI32x32x4x1_SE_1LDSB0_AF0EM1_GRVW8_GSU1_NLCA1_NLCB1_SU0_SUS128_SRVW4_TT1_64_WG64_4_1_WGM2
    SolutionIndex: 244
    SolutionNameMin: Cijk_Ailk_Bjlk_BSS_BH_MT64x256x16_MI32x32x4x1_SE_1LDSB0_AF0EM1_GRVW8_GSU1_NLCA1_NLCB1_SU0_SUS128_SRVW4_TT1_128_WG64_4_1_WGM1
    SolutionIndex: 245
    SolutionNameMin: Cijk_Ailk_Bjlk_BSS_BH_MT128x128x32_MI32x32x4x1_SE_1LDSB0_AF0EM1_GRVW8_GSU1_NLCA1_NLCB1_SU16_SUS128_SRVW4_TT2_64_WG64_4_1_WGM1
    SolutionIndex: 246
    SolutionNameMin: Cijk_Ailk_Bjlk_BSS_BH_MT64x128x32_MI32x32x4x1_SE_1LDSB0_AF0EM1_GRVW8_GSU1_NLCA1_NLCB1_SU32_SUS256_SRVW4_TT1_64_WG64_4_1_WGM2
    SolutionIndex: 247
    SolutionNameMin: Cijk_Ailk_Bjlk_BSS_BH_MT64x64x32_MI32x32x4x1_SE_1LDSB0_AF0EM1_GRVW8_GSU1_NLCA1_NLCB1_SU32_SUS128_SRVW4_TT1_32_WG64_4_1_WGM1
    SolutionIndex: 248
    SolutionNameMin: Cijk_Ailk_Bjlk_BSS_BH_MT64x128x32_MI32x32x4x1_SE_1LDSB0_AF0EM1_GRVW8_GSU1_NLCA1_NLCB1_SU32_SUS128_SRVW4_TT1_64_WG64_4_1_WGM2
    SolutionIndex: 249
    SolutionNameMin: Cijk_Ailk_Bjlk_BSS_BH_MT32x32x64_MI16x16x8x1_SE_1LDSB0_AF0EM1_GRVW8_GSU1_NLCA1_NLCB1_SU0_SUS256_SRVW4_TT1_16_WG32_8_1_WGM15
- - - [7680, 8192, 1, 8192]
    - [0, 94.054]
  - - [3840, 4096, 1, 4096]
    - [1, 87.857]
  - - [1920, 2048, 1, 2048]
    - [2, 73.595]
  - - [960, 1024, 1, 1024]
    - [3, 35.008]
  - - [480, 512, 1, 512]
    - [4, 7.183]
  - - [8192, 7680, 1, 8192]
    - [0, 94.012]
  - - [4096, 3840, 1, 4096]
    - [0, 88.038]
  - - [2048, 1920, 1, 2048]
    - [5, 70.177]
  - - [1024, 960, 1, 1024]
    - [6, 35.718]
  - - [512, 480, 1, 512]
    - [7, 6.495]
  - - [8192, 8192, 1, 8192]
    - [8, 92.978]
  - - [4096, 4096, 1, 4096]
    - [8, 84.761]
  - - [2048, 2048, 1, 2048]
    - [9, 66.743]
  - - [1024, 1024, 1, 1024]
    - [10, 29.843]
  - - [512, 512, 1, 512]
    - [11, 7.869]
  - - [64, 512, 16, 512]
    - [3, 12.105]
  - - [1024, 2, 1, 1]
    - [12, 0.0]
  - - [1024, 2, 1, 512]
    - [13, 0.05]
  - - [1024, 1024, 1, 1]
    - [14, 0.054]
  - - [1024, 1024, 1, 77]
    - [15, 3.921]
  - - [1024, 1024, 1, 512]
    - [16, 18.621]
  - - [1024, 4096, 1, 512]
    - [17, 41.325]
  - - [1024, 30522, 1, 77]
    - [18, 18.316]
  - - [4096, 1024, 1, 512]
    - [8, 43.805]
  - - [64, 128, 160, 128]
    - [19, 8.314]
  - - [1024, 2, 1, 10]
    - [20, 0.001]
  - - [1024, 2, 1, 1280]
    - [21, 0.141]
  - - [1024, 1024, 1, 10]
    - [22, 0.612]
  - - [1024, 1024, 1, 200]
    - [23, 9.473]
  - - [1024, 1024, 1, 1280]
    - [24, 37.22]
  - - [1024, 4096, 1, 1280]
    - [25, 59.148]
  - - [1024, 30522, 1, 200]
    - [26, 39.63]
  - - [4096, 1024, 1, 1280]
    - [25, 58.096]
  - - [64, 128, 624, 128]
    - [27, 16.785]
  - - [1024, 2, 1, 39]
    - [28, 0.005]
  - - [1024, 2, 1, 4992]
    - [29, 0.438]
  - - [1024, 1024, 1, 39]
    - [30, 2.128]
  - - [1024, 1024, 1, 780]
    - [31, 24.282]
  - - [1024, 1024, 1, 4992]
    - [16, 47.817]
  - - [1024, 4096, 1, 4992]
    - [32, 78.748]
  - - [1024, 30522, 1, 780]
    - [33, 70.21]
  - - [4096, 1024, 1, 4992]
    - [8, 81.094]
  - - [64, 512, 64, 512]
    - [34, 28.741]
  - - [1024, 2, 1, 4]
    - [35, 0.001]
  - - [1024, 2, 1, 2048]
    - [36, 0.233]
  - - [1024, 1024, 1, 4]
    - [37, 0.251]
  - - [1024, 1024, 1, 308]
    - [38, 13.87]
  - - [1024, 1024, 1, 2048]
    - [39, 45.76]
  - - [1024, 4096, 1, 2048]
    - [40, 66.424]
  - - [1024, 30522, 1, 308]
    - [41, 48.652]
  - - [4096, 1024, 1, 2048]
    - [42, 65.389]
  - - [64, 128, 640, 128]
    - [43, 16.92]
  - - [1024, 2, 1, 40]
    - [44, 0.006]
  - - [1024, 2, 1, 5120]
    - [45, 0.513]
  - - [1024, 1024, 1, 40]
    - [44, 2.563]
  - - [1024, 1024, 1, 800]
    - [46, 27.875]
  - - [1024, 1024, 1, 5120]
    - [47, 51.039]
  - - [1024, 4096, 1, 5120]
    - [48, 78.594]
  - - [1024, 30522, 1, 800]
    - [49, 71.811]
  - - [4096, 1024, 1, 5120]
    - [50, 78.283]
  - - [64, 128, 656, 128]
    - [51, 17.545]
  - - [1024, 2, 1, 41]
    - [52, 0.005]
  - - [1024, 2, 1, 5248]
    - [36, 0.406]
  - - [1024, 1024, 1, 41]
    - [15, 2.529]
  - - [1024, 1024, 1, 820]
    - [53, 25.227]
  - - [1024, 1024, 1, 5248]
    - [39, 50.831]
  - - [1024, 4096, 1, 5248]
    - [54, 78.565]
  - - [1024, 30522, 1, 820]
    - [9, 71.891]
  - - [4096, 1024, 1, 5248]
    - [48, 80.194]
  - - [64, 512, 80, 512]
    - [55, 33.0]
  - - [1024, 2, 1, 5]
    - [52, 0.001]
  - - [1024, 2, 1, 2560]
    - [36, 0.28]
  - - [1024, 1024, 1, 5]
    - [56, 0.339]
  - - [1024, 1024, 1, 385]
    - [57, 17.054]
  - - [1024, 1024, 1, 2560]
    - [58, 49.047]
  - - [1024, 4096, 1, 2560]
    - [17, 70.067]
  - - [1024, 30522, 1, 385]
    - [9, 54.335]
  - - [4096, 1024, 1, 2560]
    - [8, 73.152]
  - - [64, 512, 96, 512]
    - [59, 34.67]
  - - [1024, 2, 1, 6]
    - [20, 0.001]
  - - [1024, 2, 1, 3072]
    - [60, 0.262]
  - - [1024, 1024, 1, 6]
    - [44, 0.395]
  - - [1024, 1024, 1, 462]
    - [61, 18.157]
  - - [1024, 1024, 1, 3072]
    - [62, 51.301]
  - - [1024, 4096, 1, 3072]
    - [63, 76.076]
  - - [1024, 30522, 1, 462]
    - [64, 57.346]
  - - [4096, 1024, 1, 3072]
    - [8, 76.091]
  - - [64, 128, 128, 128]
    - [12, 6.824]
  - - [1024, 2, 1, 8]
    - [52, 0.001]
  - - [1024, 2, 1, 1024]
    - [65, 0.097]
  - - [1024, 1024, 1, 8]
    - [66, 0.508]
  - - [1024, 1024, 1, 160]
    - [31, 9.253]
  - - [1024, 4096, 1, 1024]
    - [67, 60.49]
  - - [1024, 30522, 1, 160]
    - [64, 33.284]
  - - [4096, 1024, 1, 1024]
    - [17, 60.114]
  - - [64, 128, 144, 128]
    - [68, 8.295]
  - - [1024, 2, 1, 9]
    - [44, 0.001]
  - - [1024, 2, 1, 1152]
    - [69, 0.096]
  - - [1024, 1024, 1, 9]
    - [70, 0.634]
  - - [1024, 1024, 1, 180]
    - [71, 9.687]
  - - [1024, 1024, 1, 1152]
    - [39, 34.591]
  - - [1024, 4096, 1, 1152]
    - [54, 62.836]
  - - [1024, 30522, 1, 180]
    - [72, 35.984]
  - - [4096, 1024, 1, 1152]
    - [17, 62.185]
  - - [13, 512, 1, 32768]
    - [73, 5.805]
  - - [256, 128, 1, 32768]
    - [74, 26.63]
  - - [256, 32768, 1, 1]
    - [75, 0.231]
  - - [479, 1024, 1, 32768]
    - [76, 74.989]
  - - [512, 256, 1, 32768]
    - [77, 59.066]
  - - [1024, 512, 1, 32768]
    - [77, 75.338]
  - - [1024, 1024, 1, 32768]
    - [78, 80.15]
  - - [64, 128, 512, 128]
    - [34, 15.303]
  - - [128, 64, 512, 128]
    - [52, 15.482]
  - - [1024, 2, 1, 32]
    - [75, 0.004]
  - - [1024, 1024, 1, 32]
    - [79, 2.325]
  - - [1024, 1024, 1, 4096]
    - [47, 57.717]
  - - [1024, 4096, 1, 4096]
    - [25, 78.371]
  - - [1024, 30528, 1, 4096]
    - [80, 89.57]
  - - [4096, 1024, 1, 4096]
    - [81, 77.347]
  - - [512, 64, 64, 512]
    - [82, 29.962]
  - - [1024, 30528, 1, 2048]
    - [83, 84.828]
  - - [4, 64, 32768, 4]
    - [84, 0.317]
  - - [4, 64, 38400, 4]
    - [84, 0.298]
  - - [64, 4, 32768, 4]
    - [85, 0.32]
  - - [64, 4, 38400, 4]
    - [86, 0.337]
  - - [1024, 1024, 1, 8192]
    - [87, 62.733]
  - - [1024, 1024, 1, 9600]
    - [62, 65.421]
  - - [1024, 4096, 1, 8192]
    - [67, 84.848]
  - - [1024, 4096, 1, 9600]
    - [88, 84.97]
  - - [1024, 33712, 1, 8192]
    - [89, 91.466]
  - - [1024, 33712, 1, 9600]
    - [90, 92.074]
  - - [4096, 1024, 1, 8192]
    - [54, 84.259]
  - - [4096, 1024, 1, 9600]
    - [9, 85.3]
  - - [1024, 1024, 1, 10064]
    - [91, 63.844]
  - - [1024, 1024, 1, 10080]
    - [92, 65.565]
  - - [1024, 1024, 1, 10200]
    - [93, 62.875]
  - - [1024, 1024, 1, 3840]
    - [16, 57.104]
  - - [1024, 1024, 1, 3968]
    - [94, 57.906]
  - - [1024, 1024, 1, 6528]
    - [47, 59.428]
  - - [1024, 1024, 1, 7104]
    - [95, 60.387]
  - - [1024, 1024, 1, 7200]
    - [96, 55.941]
  - - [1024, 1024, 1, 8064]
    - [97, 62.127]
  - - [1024, 1024, 1, 8160]
    - [95, 61.658]
  - - [1024, 1024, 1, 9216]
    - [98, 60.479]
  - - [1024, 1024, 1, 9520]
    - [16, 63.613]
  - - [1024, 4096, 1, 10064]
    - [99, 85.096]
  - - [1024, 4096, 1, 10080]
    - [100, 86.124]
  - - [1024, 4096, 1, 10200]
    - [63, 86.056]
  - - [1024, 4096, 1, 3840]
    - [54, 79.072]
  - - [1024, 4096, 1, 3968]
    - [100, 77.162]
  - - [1024, 4096, 1, 6528]
    - [100, 83.287]
  - - [1024, 4096, 1, 7104]
    - [88, 83.327]
  - - [1024, 4096, 1, 7200]
    - [63, 85.282]
  - - [1024, 4096, 1, 8064]
    - [101, 85.65]
  - - [1024, 4096, 1, 8160]
    - [48, 83.05]
  - - [1024, 4096, 1, 9216]
    - [8, 85.118]
  - - [1024, 4096, 1, 9520]
    - [102, 85.261]
  - - [1024, 42720, 1, 10080]
    - [89, 93.27]
  - - [1024, 42720, 1, 3968]
    - [8, 90.577]
  - - [1024, 42720, 1, 6528]
    - [8, 92.222]
  - - [1024, 42720, 1, 7104]
    - [9, 92.421]
  - - [1024, 42720, 1, 7200]
    - [9, 92.418]
  - - [1024, 42720, 1, 9520]
    - [9, 93.246]
  - - [4096, 1024, 1, 10064]
    - [103, 83.55]
  - - [4096, 1024, 1, 10080]
    - [89, 84.891]
  - - [4096, 1024, 1, 10200]
    - [8, 84.949]
  - - [4096, 1024, 1, 3840]
    - [9, 78.721]
  - - [4096, 1024, 1, 3968]
    - [17, 78.289]
  - - [4096, 1024, 1, 6528]
    - [33, 82.299]
  - - [4096, 1024, 1, 7104]
    - [81, 83.845]
  - - [4096, 1024, 1, 7200]
    - [54, 84.087]
  - - [4096, 1024, 1, 8064]
    - [17, 83.22]
  - - [4096, 1024, 1, 8160]
    - [9, 83.813]
  - - [4096, 1024, 1, 9216]
    - [9, 84.651]
  - - [4096, 1024, 1, 9520]
    - [67, 84.84]
  - - [14, 64, 10880, 14]
    - [70, 1.765]
  - - [15, 64, 10880, 14]
    - [104, 1.812]
  - - [15, 64, 7680, 15]
    - [105, 1.833]
  - - [15, 64, 10880, 15]
    - [106, 1.868]
  - - [17, 64, 7680, 15]
    - [70, 1.901]
  - - [17, 64, 6144, 17]
    - [107, 2.097]
  - - [17, 64, 7680, 17]
    - [108, 2.25]
  - - [21, 64, 6144, 17]
    - [107, 2.292]
  - - [21, 64, 6144, 21]
    - [109, 3.012]
  - - [24, 64, 4736, 24]
    - [110, 4.28]
  - - [30, 64, 2048, 30]
    - [23, 3.27]
  - - [30, 64, 2048, 31]
    - [108, 3.365]
  - - [31, 64, 2048, 31]
    - [111, 3.179]
  - - [32, 64, 4608, 32]
    - [112, 5.613]
  - - [32, 64, 4608, 35]
    - [106, 6.717]
  - - [34, 64, 4736, 24]
    - [113, 3.671]
  - - [34, 64, 4736, 34]
    - [114, 4.832]
  - - [35, 64, 4608, 35]
    - [23, 5.225]
  - - [64, 14, 10880, 14]
    - [44, 2.505]
  - - [64, 15, 10880, 14]
    - [115, 2.494]
  - - [64, 15, 7680, 15]
    - [52, 2.711]
  - - [64, 15, 10880, 15]
    - [22, 2.59]
  - - [64, 17, 7680, 15]
    - [52, 2.818]
  - - [64, 17, 6144, 17]
    - [37, 2.885]
  - - [64, 17, 7680, 17]
    - [86, 3.079]
  - - [64, 21, 6144, 17]
    - [12, 3.208]
  - - [64, 21, 6144, 21]
    - [37, 3.906]
  - - [64, 24, 4736, 24]
    - [116, 4.116]
  - - [64, 30, 2048, 30]
    - [44, 3.818]
  - - [64, 30, 2048, 31]
    - [115, 4.309]
  - - [64, 31, 2048, 31]
    - [117, 4.166]
  - - [64, 32, 4608, 32]
    - [68, 5.895]
  - - [64, 32, 4608, 35]
    - [118, 5.867]
  - - [64, 34, 4736, 24]
    - [119, 4.034]
  - - [64, 34, 4736, 34]
    - [120, 5.665]
  - - [64, 35, 4608, 35]
    - [119, 5.707]
  - - [512, 64, 1, 512]
    - [121, 0.887]
  - - [64, 512, 1, 512]
    - [122, 0.988]
  - - [64, 128, 1, 128]
    - [123, 0.075]
  - - [128, 64, 1, 128]
    - [124, 0.074]
  - - [74, 2048, 1, 512]
    - [123, 4.138]
  - - [2048, 2048, 1, 512]
    - [54, 41.27]
  - - [1024, 64, 1, 512]
    - [125, 2.025]
  - - [5, 64, 1, 5]
    - [15, 0.0]
  - - [2048, 512, 1, 1]
    - [126, 0.064]
  - - [1600, 1024, 1, 512]
    - [127, 30.472]
  - - [512, 32, 1, 1600]
    - [128, 1.171]
  - - [33, 32, 1, 33]
    - [129, 0.002]
  - - [560, 1024, 1, 1600]
    - [130, 27.951]
  - - [1024, 1600, 1, 1]
    - [86, 0.086]
  - - [1024, 1024, 1, 1600]
    - [47, 39.627]
  - - [512, 512, 1, 1600]
    - [131, 15.76]
  - - [3, 64, 512, 3]
    - [15, 0.018]
  - - [5, 64, 512, 5]
    - [132, 0.049]
  - - [5, 64, 960, 5]
    - [133, 0.09]
  - - [9, 64, 512, 9]
    - [56, 0.15]
  - - [27, 128, 32768, 27]
    - [134, 5.249]
  - - [33, 32, 200, 33]
    - [135, 0.424]
  - - [33, 32, 1600, 33]
    - [112, 2.13]
  - - [67, 2048, 1, 512]
    - [125, 4.724]
  - - [74, 2048, 1, 960]
    - [123, 6.189]
  - - [100, 2048, 1, 512]
    - [136, 5.297]
  - - [256, 1280, 1, 8976]
    - [137, 48.95]
  - - [256, 2560, 1, 8976]
    - [138, 53.258]
  - - [256, 2816, 1, 8976]
    - [139, 52.343]
  - - [256, 3328, 1, 8976]
    - [140, 58.581]
  - - [256, 3584, 1, 8976]
    - [141, 67.975]
  - - [256, 3840, 1, 8976]
    - [142, 75.941]
  - - [256, 4096, 1, 8976]
    - [97, 60.144]
  - - [256, 4352, 1, 8976]
    - [62, 65.986]
  - - [256, 4864, 1, 8976]
    - [25, 68.805]
  - - [256, 5120, 1, 8976]
    - [143, 73.456]
  - - [256, 5632, 1, 8976]
    - [17, 71.455]
  - - [256, 5888, 1, 8976]
    - [144, 65.0]
  - - [256, 6144, 1, 8976]
    - [144, 68.078]
  - - [256, 7168, 1, 8976]
    - [145, 79.351]
  - - [256, 8192, 1, 8976]
    - [146, 73.966]
  - - [256, 8960, 1, 8976]
    - [147, 79.733]
  - - [256, 9728, 1, 8976]
    - [9, 74.341]
  - - [256, 9984, 1, 8976]
    - [49, 76.513]
  - - [256, 10240, 1, 8976]
    - [148, 78.352]
  - - [256, 10496, 1, 8976]
    - [33, 79.231]
  - - [256, 11008, 1, 8976]
    - [25, 83.537]
  - - [256, 11264, 1, 8976]
    - [8, 86.364]
  - - [256, 11520, 1, 8976]
    - [49, 88.439]
  - - [256, 11776, 1, 8976]
    - [149, 72.285]
  - - [256, 12544, 1, 8976]
    - [144, 78.86]
  - - [256, 12800, 1, 8976]
    - [143, 78.015]
  - - [256, 13312, 1, 8976]
    - [150, 77.614]
  - - [256, 13568, 1, 8976]
    - [151, 79.335]
  - - [256, 14336, 1, 8976]
    - [152, 83.413]
  - - [256, 14848, 1, 8976]
    - [0, 86.077]
  - - [256, 15104, 1, 8976]
    - [153, 87.878]
  - - [256, 15872, 1, 8976]
    - [96, 82.379]
  - - [256, 16128, 1, 8976]
    - [32, 84.659]
  - - [256, 17152, 1, 8976]
    - [63, 89.376]
  - - [256, 17408, 1, 8976]
    - [154, 81.445]
  - - [256, 18688, 1, 8976]
    - [147, 86.28]
  - - [256, 19968, 1, 8976]
    - [139, 80.405]
  - - [256, 20480, 1, 8976]
    - [155, 82.348]
  - - [256, 20992, 1, 8976]
    - [54, 82.975]
  - - [256, 21248, 1, 8976]
    - [8, 83.517]
  - - [256, 22016, 1, 8976]
    - [8, 86.48]
  - - [256, 26112, 1, 8976]
    - [156, 85.473]
  - - [256, 32512, 1, 8976]
    - [8, 85.182]
  - - [256, 33536, 1, 8976]
    - [49, 88.952]
  - - [256, 44505, 1, 8976]
    - [0, 88.985]
  - - [257, 4096, 1, 1024]
    - [19, 31.075]
  - - [480, 1024, 1, 32768]
    - [76, 75.528]
  - - [512, 32, 1, 200]
    - [157, 0.23]
  - - [512, 512, 1, 200]
    - [157, 3.505]
  - - [512, 2048, 1, 256]
    - [24, 14.017]
  - - [560, 1024, 1, 200]
    - [44, 5.484]
  - - [768, 2048, 1, 256]
    - [131, 15.154]
  - - [1024, 64, 1, 960]
    - [158, 3.274]
  - - [1024, 256, 1, 1024]
    - [131, 12.661]
  - - [1024, 256, 1, 1280]
    - [159, 14.721]
  - - [1024, 256, 1, 2304]
    - [137, 19.675]
  - - [1024, 256, 1, 2816]
    - [160, 19.326]
  - - [1024, 256, 1, 3072]
    - [161, 24.208]
  - - [1024, 256, 1, 3328]
    - [162, 25.909]
  - - [1024, 256, 1, 3584]
    - [163, 28.018]
  - - [1024, 256, 1, 4096]
    - [162, 30.433]
  - - [1024, 256, 1, 4352]
    - [160, 31.042]
  - - [1024, 256, 1, 4608]
    - [162, 33.424]
  - - [1024, 256, 1, 5120]
    - [164, 31.382]
  - - [1024, 256, 1, 5376]
    - [160, 32.377]
  - - [1024, 256, 1, 5632]
    - [164, 31.681]
  - - [1024, 256, 1, 6144]
    - [161, 37.237]
  - - [1024, 256, 1, 6400]
    - [165, 37.531]
  - - [1024, 256, 1, 7680]
    - [161, 39.365]
  - - [1024, 256, 1, 7936]
    - [160, 42.866]
  - - [1024, 256, 1, 8192]
    - [162, 39.404]
  - - [1024, 256, 1, 8448]
    - [166, 46.242]
  - - [1024, 256, 1, 9728]
    - [160, 47.302]
  - - [1024, 256, 1, 9984]
    - [162, 48.852]
  - - [1024, 256, 1, 10496]
    - [167, 51.839]
  - - [1024, 256, 1, 11520]
    - [165, 51.149]
  - - [1024, 256, 1, 12032]
    - [161, 54.875]
  - - [1024, 256, 1, 13568]
    - [167, 52.769]
  - - [1024, 256, 1, 14336]
    - [168, 54.641]
  - - [1024, 256, 1, 14848]
    - [162, 58.165]
  - - [1024, 256, 1, 15104]
    - [162, 59.647]
  - - [1024, 256, 1, 15872]
    - [161, 55.393]
  - - [1024, 256, 1, 16128]
    - [160, 55.33]
  - - [1024, 256, 1, 17152]
    - [165, 56.547]
  - - [1024, 256, 1, 17408]
    - [160, 60.867]
  - - [1024, 256, 1, 18944]
    - [167, 59.451]
  - - [1024, 256, 1, 19712]
    - [167, 58.826]
  - - [1024, 256, 1, 19968]
    - [160, 62.57]
  - - [1024, 256, 1, 21248]
    - [169, 52.802]
  - - [1024, 256, 1, 21504]
    - [74, 49.858]
  - - [1024, 256, 1, 22016]
    - [161, 51.314]
  - - [1024, 256, 1, 28672]
    - [162, 66.415]
  - - [1024, 256, 1, 33536]
    - [160, 65.32]
  - - [1024, 1024, 1, 960]
    - [58, 31.474]
  - - [1600, 1024, 1, 960]
    - [170, 41.869]
  - - [2048, 256, 1, 1024]
    - [171, 17.372]
  - - [2048, 960, 1, 1]
    - [172, 0.103]
  - - [2048, 2048, 1, 960]
    - [33, 58.895]
  - - [2048, 2048, 1, 1024]
    - [8, 55.774]
  - - [3200, 2048, 1, 1024]
    - [9, 60.883]
  - - [4096, 4096, 1, 1024]
    - [67, 68.44]
  - - [2048, 2, 1, 2]
    - [44, 0.001]
  - - [2048, 2048, 1, 2]
    - [52, 0.322]
  - - [2048, 30592, 1, 1024]
    - [8, 79.446]
  - - [2048, 6144, 1, 1024]
    - [173, 67.469]
  - - [2048, 8192, 1, 1024]
    - [88, 68.42]
  - - [8192, 2048, 1, 1024]
    - [9, 68.978]
  - - [1024, 1024, 1, 16]
    - [118, 1.216]
  - - [1024, 2, 1, 16]
    - [174, 0.003]
  - - [1024, 30592, 1, 8192]
    - [0, 92.746]
  - - [1024, 3072, 1, 8192]
    - [175, 77.49]
  - - [512, 64, 256, 512]
    - [142, 41.063]
  - - [64, 512, 256, 512]
    - [176, 41.003]
  - - [1024, 30592, 1, 2048]
    - [17, 83.59]
  - - [1024, 3072, 1, 2048]
    - [177, 61.161]
  - - [1024, 30592, 1, 4096]
    - [80, 89.204]
  - - [1024, 3072, 1, 4096]
    - [178, 70.146]
  - - [512, 64, 128, 512]
    - [57, 38.018]
  - - [64, 512, 128, 512]
    - [179, 39.588]
  - - [2560, 1920, 1, 2048]
    - [180, 74.669]
  - - [2560, 2, 1, 4]
    - [181, 0.001]
  - - [2560, 2560, 1, 2048]
    - [179, 74.766]
  - - [2560, 2560, 1, 4]
    - [182, 0.843]
  - - [2560, 7680, 1, 2048]
    - [179, 83.156]
  - - [640, 2560, 1, 2048]
    - [170, 56.285]
  - - [512, 64, 40, 512]
    - [61, 26.315]
  - - [64, 512, 40, 512]
    - [61, 26.016]
  - - [1536, 1536, 1, 4096]
    - [183, 74.315]
  - - [1536, 4608, 1, 4096]
    - [89, 83.345]
  - - [1536, 50304, 1, 4096]
    - [25, 92.125]
  - - [1536, 6144, 1, 4096]
    - [177, 82.499]
  - - [6144, 1536, 1, 4096]
    - [184, 84.018]
  - - [1024, 96, 64, 1024]
    - [175, 58.644]
  - - [96, 1024, 64, 1024]
    - [185, 59.679]
  - - [1536, 1536, 1, 8192]
    - [186, 81.625]
  - - [1536, 4608, 1, 8192]
    - [25, 87.202]
  - - [1536, 50304, 1, 8192]
    - [49, 93.745]
  - - [1536, 6144, 1, 8192]
    - [154, 87.811]
  - - [6144, 1536, 1, 8192]
    - [83, 86.924]
  - - [1024, 96, 128, 1024]
    - [185, 62.413]
  - - [96, 1024, 128, 1024]
    - [185, 62.934]
  - - [1024, 1024, 1, 16384]
    - [165, 68.951]
  - - [1024, 3072, 1, 16384]
    - [143, 82.918]
  - - [1024, 4096, 1, 16384]
    - [100, 87.363]
  - - [1024, 50304, 1, 16384]
    - [187, 95.053]
  - - [4096, 1024, 1, 16384]
    - [9, 87.194]
  - - [1024, 64, 256, 1024]
    - [188, 57.385]
  - - [64, 1024, 256, 1024]
    - [189, 62.218]
  - - [1024, 50304, 1, 2048]
    - [89, 87.306]
  - - [1024, 64, 32, 1024]
    - [10, 44.03]
  - - [64, 1024, 32, 1024]
    - [190, 44.197]
  - - [1024, 50304, 1, 4096]
    - [191, 91.469]
  - - [1024, 64, 64, 1024]
    - [192, 49.22]
  - - [64, 1024, 64, 1024]
    - [59, 52.724]
  - - [1024, 50304, 1, 8192]
    - [9, 93.909]
  - - [1024, 64, 128, 1024]
    - [27, 55.205]
  - - [64, 1024, 128, 1024]
    - [193, 55.266]
  - - [1024, 2, 1, 64]
    - [124, 0.008]
  - - [1024, 30528, 1, 8192]
    - [0, 92.839]
  - - [1024, 1024, 1, 64]
    - [194, 3.958]
  - - [64, 128, 1024, 128]
    - [195, 20.031]
  - - [128, 64, 1024, 128]
    - [38, 17.83]
  - - [1024, 1024, 1, 3456]
    - [24, 54.516]
  - - [1024, 1024, 1, 6912]
    - [25, 56.149]
  - - [1024, 1024, 1, 864]
    - [196, 30.172]
  - - [1024, 512, 1, 3456]
    - [149, 36.893]
  - - [1024, 512, 1, 4096]
    - [130, 41.437]
  - - [1024, 512, 1, 6912]
    - [164, 49.316]
  - - [1024, 512, 1, 864]
    - [197, 17.209]
  - - [256, 128, 1, 3456]
    - [198, 4.667]
  - - [256, 128, 1, 4096]
    - [199, 6.158]
  - - [256, 128, 1, 55296]
    - [74, 37.107]
  - - [256, 128, 1, 6912]
    - [198, 10.177]
  - - [256, 128, 1, 864]
    - [157, 1.404]
  - - [256, 3456, 1, 1]
    - [200, 0.059]
  - - [256, 4096, 1, 1]
    - [109, 0.064]
  - - [256, 6912, 1, 1]
    - [201, 0.093]
  - - [256, 864, 1, 1]
    - [202, 0.017]
  - - [480, 1024, 1, 3456]
    - [203, 37.118]
  - - [480, 1024, 1, 4096]
    - [204, 39.548]
  - - [480, 1024, 1, 6912]
    - [76, 53.343]
  - - [480, 1024, 1, 864]
    - [68, 16.307]
  - - [512, 256, 1, 3456]
    - [205, 14.169]
  - - [512, 256, 1, 4096]
    - [169, 15.504]
  - - [512, 256, 1, 55296]
    - [77, 66.602]
  - - [512, 256, 1, 6912]
    - [206, 28.915]
  - - [512, 256, 1, 864]
    - [207, 6.402]
  - - [30528, 1024, 1, 640]
    - [208, 65.198]
  - - [30528, 1024, 1, 1280]
    - [96, 79.359]
  - - [4096, 1024, 1, 10240]
    - [17, 84.716]
  - - [1024, 4096, 1, 10240]
    - [40, 86.415]
  - - [30528, 1024, 1, 1600]
    - [88, 80.684]
  - - [1024, 2, 1, 80]
    - [15, 0.011]
  - - [1024, 1024, 1, 10240]
    - [17, 59.386]
  - - [1024, 1024, 1, 80]
    - [86, 4.413]
  - - [64, 128, 1280, 128]
    - [209, 18.136]
  - - [128, 64, 1280, 128]
    - [210, 18.406]
  - - [1024, 4096, 1, 10496]
    - [89, 84.656]
  - - [30528, 1024, 1, 1640]
    - [103, 79.755]
  - - [4096, 1024, 1, 10496]
    - [49, 85.247]
  - - [1024, 1024, 1, 10496]
    - [211, 62.54]
  - - [1024, 1024, 1, 82]
    - [212, 4.04]
  - - [1024, 2, 1, 82]
    - [118, 0.009]
  - - [128, 64, 1312, 128]
    - [210, 18.867]
  - - [64, 128, 1312, 128]
    - [213, 19.155]
  - - [30528, 1024, 1, 160]
    - [177, 32.481]
  - - [1024, 4096, 1, 6144]
    - [8, 82.011]
  - - [30528, 1024, 1, 240]
    - [64, 41.986]
  - - [4096, 1024, 1, 6144]
    - [214, 79.512]
  - - [1024, 1024, 1, 12]
    - [107, 0.614]
  - - [1024, 2, 1, 12]
    - [52, 0.002]
  - - [1024, 1024, 1, 6144]
    - [47, 61.058]
  - - [64, 512, 192, 512]
    - [179, 42.567]
  - - [512, 64, 192, 512]
    - [57, 41.172]
  - - [3136, 64, 64, 128]
    - [209, 21.682]
  - - [3136, 64, 64, 256]
    - [215, 30.852]
  - - [3136, 128, 64, 256]
    - [179, 43.632]
  - - [784, 256, 64, 512]
    - [216, 50.349]
  - - [3136, 256, 64, 128]
    - [80, 31.66]
  - - [3136, 256, 64, 256]
    - [96, 48.175]
  - - [784, 512, 64, 256]
    - [17, 43.352]
  - - [784, 512, 64, 512]
    - [177, 60.657]
  - - [3136, 64, 32, 128]
    - [53, 19.916]
  - - [3136, 64, 32, 256]
    - [38, 32.319]
  - - [3136, 128, 32, 256]
    - [217, 31.36]
  - - [784, 256, 32, 512]
    - [127, 49.685]
  - - [3136, 256, 32, 128]
    - [216, 27.238]
  - - [3136, 256, 32, 256]
    - [218, 42.123]
  - - [784, 512, 32, 256]
    - [83, 38.405]
  - - [784, 512, 32, 512]
    - [196, 50.514]
  - - [3136, 256, 32, 64]
    - [136, 15.524]
  - - [3136, 64, 32, 64]
    - [182, 11.024]
  - - [784, 512, 32, 128]
    - [8, 24.471]
  - - [784, 128, 32, 512]
    - [179, 38.269]
  - - [3136, 64, 64, 64]
    - [85, 12.408]
  - - [3136, 256, 64, 64]
    - [182, 18.138]
  - - [784, 128, 64, 512]
    - [59, 48.505]
  - - [784, 512, 64, 128]
    - [72, 29.225]
  - - [64, 1280, 64, 192]
    - [197, 24.665]
  - - [64, 1280, 64, 320]
    - [46, 31.858]
  - - [64, 1280, 64, 384]
    - [173, 36.56]
  - - [64, 1280, 64, 448]
    - [83, 42.006]
  - - [64, 2048, 64, 192]
    - [19, 27.959]
  - - [64, 2048, 64, 320]
    - [193, 37.714]
  - - [64, 2048, 64, 384]
    - [177, 40.389]
  - - [64, 2048, 64, 448]
    - [219, 42.558]
  - - [64, 1280, 32, 192]
    - [220, 17.699]
  - - [64, 1280, 32, 320]
    - [221, 26.563]
  - - [64, 1280, 32, 384]
    - [222, 30.221]
  - - [64, 1280, 32, 448]
    - [83, 34.282]
  - - [64, 2048, 32, 192]
    - [38, 22.256]
  - - [64, 2048, 32, 320]
    - [68, 31.18]
  - - [64, 2048, 32, 384]
    - [68, 33.34]
  - - [64, 2048, 32, 448]
    - [46, 35.805]
  - - [1024, 1024, 1, 10224]
    - [223, 63.18]
  - - [1024, 1024, 1, 10192]
    - [58, 64.031]
  - - [1024, 1024, 1, 10208]
    - [224, 66.124]
  - - [1024, 4096, 1, 10224]
    - [101, 86.432]
  - - [4096, 1024, 1, 10224]
    - [9, 84.324]
  - - [1024, 3072, 1, 10224]
    - [175, 78.764]
  - - [1024, 3072, 1, 10240]
    - [143, 79.467]
  - - [4096, 1024, 1, 10192]
    - [89, 85.138]
  - - [1024, 3072, 1, 10192]
    - [175, 78.442]
  - - [1024, 4096, 1, 10192]
    - [99, 86.321]
  - - [1024, 3072, 1, 10200]
    - [175, 76.195]
  - - [1024, 1024, 1, 10184]
    - [93, 59.751]
  - - [4096, 1024, 1, 10208]
    - [9, 84.557]
  - - [1024, 3072, 1, 10208]
    - [175, 78.602]
  - - [1024, 4096, 1, 10208]
    - [99, 85.571]
  - - [1024, 2048, 1, 10224]
    - [225, 78.248]
  - - [1024, 2048, 1, 10240]
    - [225, 78.521]
  - - [1024, 1024, 1, 10120]
    - [95, 64.572]
  - - [1024, 2048, 1, 10192]
    - [146, 76.884]
  - - [64, 24, 6816, 24]
    - [37, 4.275]
  - - [1024, 1024, 1, 10152]
    - [91, 63.281]
  - - [1024, 3072, 1, 10080]
    - [185, 77.787]
  - - [64, 26, 6272, 26]
    - [116, 4.551]
  - - [100352, 256, 1, 512]
    - [80, 56.734]
  - - [12544, 1024, 1, 2048]
    - [96, 79.453]
  - - [12544, 147, 1, 64]
    - [68, 6.369]
  - - [200704, 256, 1, 512]
    - [226, 57.328]
  - - [25088, 512, 1, 1024]
    - [197, 66.007]
  - - [3136, 576, 1, 64]
    - [196, 5.857]
  - - [50176, 512, 1, 1024]
    - [179, 72.721]
  - - [6272, 1024, 1, 2048]
    - [5, 71.947]
  - - [784, 1152, 1, 128]
    - [38, 7.344]
  - - [3136, 256, 128, 128]
    - [184, 34.166]
  - - [3136, 256, 256, 128]
    - [227, 35.614]
  - - [3136, 256, 128, 64]
    - [135, 19.24]
  - - [3136, 256, 256, 64]
    - [135, 19.868]
  - - [3136, 64, 128, 256]
    - [228, 36.126]
  - - [3136, 64, 256, 256]
    - [229, 40.437]
  - - [3136, 64, 128, 64]
    - [86, 13.992]
  - - [3136, 64, 256, 64]
    - [230, 15.972]
  - - [784, 128, 128, 512]
    - [193, 48.86]
  - - [784, 128, 256, 512]
    - [127, 57.334]
  - - [784, 512, 128, 128]
    - [80, 33.498]
  - - [784, 512, 256, 128]
    - [231, 36.068]
  - - [784, 512, 128, 256]
    - [25, 52.106]
  - - [784, 512, 256, 256]
    - [49, 55.934]
  - - [64, 128, 2048, 128]
    - [213, 20.348]
  - - [128, 64, 2048, 128]
    - [82, 20.402]
  - - [30528, 1024, 1, 2560]
    - [232, 85.23]
  - - [1024, 1024, 1, 128]
    - [52, 7.465]
  - - [1024, 2, 1, 128]
    - [44, 0.018]
  - - [128, 64, 1536, 128]
    - [136, 18.76]
  - - [64, 128, 1536, 128]
    - [57, 19.751]
  - - [1024, 4096, 1, 12288]
    - [99, 87.782]
  - - [30528, 1024, 1, 1920]
    - [208, 82.439]
  - - [1024, 1024, 1, 96]
    - [56, 5.477]
  - - [1024, 1024, 1, 12288]
    - [58, 62.38]
  - - [4096, 1024, 1, 12288]
    - [96, 84.811]
  - - [1024, 2, 1, 96]
    - [124, 0.014]
  - - [25600, 128, 25, 128]
    - [38, 29.486]
  - - [12544, 128, 36, 128]
    - [156, 29.5]
  - - [9216, 128, 49, 128]
    - [233, 29.44]
  - - [6400, 128, 64, 128]
    - [234, 29.946]
  - - [6400, 256, 25, 256]
    - [179, 47.629]
  - - [4096, 256, 36, 256]
    - [96, 46.221]
  - - [2304, 256, 49, 256]
    - [234, 43.884]
  - - [2304, 256, 64, 256]
    - [103, 47.558]
  - - [2304, 512, 25, 512]
    - [221, 62.941]
  - - [1024, 512, 36, 512]
    - [222, 56.932]
  - - [1024, 512, 49, 512]
    - [83, 59.083]
  - - [1024, 512, 64, 512]
    - [80, 63.428]
  - - [92416, 64, 25, 64]
    - [230, 16.293]
  - - [50176, 64, 36, 64]
    - [172, 16.308]
  - - [36864, 64, 49, 64]
    - [22, 16.565]
  - - [25600, 64, 64, 64]
    - [172, 16.426]
  - - [64, 128, 192, 128]
    - [235, 10.079]
  - - [128, 64, 192, 128]
    - [115, 9.992]
  - - [768, 2, 1, 2048]
    - [198, 0.166]
  - - [3072, 768, 1, 2048]
    - [236, 65.098]
  - - [768, 3072, 1, 2048]
    - [237, 65.256]
  - - [768, 768, 1, 2048]
    - [130, 35.717]
  - - [64, 384, 144, 384]
    - [180, 33.022]
  - - [384, 64, 144, 384]
    - [61, 31.214]
  - - [768, 2, 1, 4608]
    - [45, 0.363]
  - - [3072, 768, 1, 4608]
    - [24, 71.086]
  - - [768, 3072, 1, 4608]
    - [24, 70.287]
  - - [768, 768, 1, 4608]
    - [143, 47.22]
  - - [64, 512, 48, 512]
    - [59, 28.18]
  - - [512, 64, 48, 512]
    - [82, 26.736]
  - - [64, 128, 256, 128]
    - [31, 11.683]
  - - [128, 64, 256, 128]
    - [79, 11.567]
  - - [64, 384, 192, 384]
    - [238, 35.72]
  - - [384, 64, 192, 384]
    - [34, 33.863]
  - - [1024, 2, 1, 4608]
    - [29, 0.387]
  - - [4096, 1024, 1, 4608]
    - [25, 78.139]
  - - [1024, 4096, 1, 4608]
    - [103, 76.933]
  - - [1024, 1024, 1, 4608]
    - [42, 45.855]
  - - [13, 512, 1, 3456]
    - [239, 1.19]
  - - [13, 512, 1, 4096]
    - [73, 1.369]
  - - [13, 512, 1, 55296]
    - [240, 7.576]
  - - [13, 512, 1, 6912]
    - [73, 2.132]
  - - [13, 512, 1, 864]
    - [241, 0.299]
  - - [196, 512, 64, 1024]
    - [197, 49.848]
  - - [196, 1024, 64, 512]
    - [103, 43.754]
  - - [196, 1024, 64, 1024]
    - [9, 55.746]
  - - [49, 1024, 64, 2048]
    - [242, 43.952]
  - - [49, 2048, 64, 1024]
    - [243, 42.192]
  - - [196, 512, 32, 1024]
    - [243, 43.614]
  - - [196, 1024, 32, 512]
    - [88, 44.907]
  - - [196, 1024, 32, 1024]
    - [243, 50.64]
  - - [49, 1024, 32, 2048]
    - [3, 30.857]
  - - [49, 2048, 32, 1024]
    - [244, 31.302]
  - - [196, 1024, 32, 256]
    - [88, 33.699]
  - - [196, 256, 32, 1024]
    - [38, 35.155]
  - - [49, 2048, 32, 512]
    - [19, 27.242]
  - - [49, 512, 32, 2048]
    - [10, 29.273]
  - - [196, 256, 64, 1024]
    - [180, 44.132]
  - - [196, 1024, 64, 256]
    - [9, 31.161]
  - - [49, 512, 64, 2048]
    - [233, 30.708]
  - - [49, 2048, 64, 512]
    - [127, 31.332]
  - - [1225, 192, 64, 32]
    - [19, 7.177]
  - - [1225, 192, 64, 48]
    - [215, 10.286]
  - - [1225, 192, 64, 64]
    - [19, 13.332]
  - - [1225, 256, 64, 48]
    - [30, 9.035]
  - - [1225, 256, 64, 64]
    - [245, 11.918]
  - - [1225, 288, 64, 48]
    - [105, 10.144]
  - - [1225, 288, 64, 64]
    - [61, 13.576]
  - - [5329, 64, 64, 80]
    - [135, 16.239]
  - - [289, 768, 64, 128]
    - [246, 22.42]
  - - [289, 768, 64, 160]
    - [114, 20.795]
  - - [289, 768, 64, 192]
    - [247, 25.715]
  - - [1225, 192, 32, 32]
    - [19, 6.548]
  - - [1225, 192, 32, 48]
    - [108, 9.453]
  - - [1225, 192, 32, 64]
    - [27, 12.281]
  - - [1225, 256, 32, 48]
    - [182, 8.755]
  - - [1225, 256, 32, 64]
    - [19, 12.227]
  - - [1225, 288, 32, 48]
    - [182, 9.105]
  - - [1225, 288, 32, 64]
    - [182, 11.68]
  - - [5329, 64, 32, 80]
    - [215, 13.393]
  - - [289, 768, 32, 128]
    - [156, 20.392]
  - - [289, 768, 32, 160]
    - [140, 23.125]
  - - [289, 768, 32, 192]
    - [248, 25.364]
  - - [196, 2304, 1, 256]
    - [19, 6.756]
  - - [49, 4608, 1, 512]
    - [249, 6.494]
  - - [196, 1024, 128, 256]
    - [9, 42.231]
  - - [196, 1024, 256, 256]
    - [54, 43.768]
  - - [196, 1024, 128, 512]
    - [64, 51.285]
  - - [196, 1024, 256, 512]
    - [54, 56.117]
  - - [196, 256, 128, 1024]
    - [197, 50.38]
  - - [196, 256, 256, 1024]
    - [43, 52.49]
  - - [49, 2048, 128, 512]
    - [140, 32.44]
  - - [49, 2048, 256, 512]
    - [227, 35.996]
  - - [49, 512, 128, 2048]
    - [10, 42.435]
  - - [49, 512, 256, 2048]
    - [248, 50.302]
- null
