library/src/blas3/Tensile/Logic/asm_full/arcturus/arcturus_Cijk_Ailk_Bjlk_DB_GB.yaml
- {MinimumRequiredVersion: 4.26.0}
- arcturus
- gfx908
- [Device 7380, Device 7388, Device 738c, Device 7390]
    SolutionIndex: 0
    SolutionNameMin: Cijk_Ailk_Bjlk_DB_GB_MT32x128x8_SN_PLR1_SU0_SUM0_SUS256_SNLL1_TT4_4_WG8_32_1_WGM1
    SolutionIndex: 1
    SolutionNameMin: Cijk_Ailk_Bjlk_DB_GB_MT64x64x8_SN_PLR1_SU0_SUM0_SUS256_SNLL1_TT4_4_WG16_16_1_WGM1
    SolutionIndex: 2
    SolutionNameMin: Cijk_Ailk_Bjlk_DB_GB_MT64x64x8_SN_PLR0_SU0_SUM0_SUS256_SNLL1_TT4_4_WG16_16_1_WGM1
    SolutionIndex: 3
    SolutionNameMin: Cijk_Ailk_Bjlk_DB_GB_MT128x32x8_SN_PLR1_SU0_SUM0_SUS256_SNLL1_TT4_4_WG32_8_1_WGM1
    SolutionIndex: 4
    SolutionNameMin: Cijk_Ailk_Bjlk_DB_GB_MT32x128x16_SN_PLR1_SU0_SUM0_SUS256_SNLL1_TT4_4_WG8_32_1_WGM1
    SolutionIndex: 5
    SolutionNameMin: Cijk_Ailk_Bjlk_DB_GB_MT64x64x16_SN_PLR1_SU0_SUM0_SUS256_SNLL1_TT4_4_WG16_16_1_WGM1
    SolutionIndex: 6
    SolutionNameMin: Cijk_Ailk_Bjlk_DB_GB_MT128x32x16_SN_PLR1_SU0_SUM0_SUS256_SNLL1_TT4_4_WG32_8_1_WGM1
    SolutionIndex: 7
    SolutionNameMin: Cijk_Ailk_Bjlk_DB_GB_MT64x64x8_SN_PLR1_SU32_SUM0_SUS128_SNLL1_TT4_4_WG16_16_1_WGM1
    SolutionIndex: 8
    SolutionNameMin: Cijk_Ailk_Bjlk_DB_GB_MT128x32x8_SN_PLR1_SU32_SUM0_SUS128_SNLL1_TT4_4_WG32_8_1_WGM1
    SolutionIndex: 9
    SolutionNameMin: Cijk_Ailk_Bjlk_DB_GB_MT32x128x8_SN_PLR1_SU32_SUM3_SUS128_SNLL1_TT4_4_WG8_32_1_WGM1
    SolutionIndex: 10
    SolutionNameMin: Cijk_Ailk_Bjlk_DB_GB_MT64x64x8_SN_PLR1_SU32_SUM3_SUS128_SNLL1_TT4_4_WG16_16_1_WGM1
    SolutionIndex: 11
    SolutionNameMin: Cijk_Ailk_Bjlk_DB_GB_MT128x32x8_SN_PLR1_SU32_SUM3_SUS128_SNLL1_TT4_4_WG32_8_1_WGM1
    SolutionIndex: 12
    SolutionNameMin: Cijk_Ailk_Bjlk_DB_GB_MT128x32x16_SN_PLR1_SU32_SUM3_SUS128_SNLL1_TT4_4_WG32_8_1_WGM1
    SolutionIndex: 13
    SolutionNameMin: Cijk_Ailk_Bjlk_DB_GB_MT32x128x8_SN_PLR1_SU32_SUM0_SUS256_SNLL1_TT4_4_WG8_32_1_WGM1
    SolutionIndex: 14
    SolutionNameMin: Cijk_Ailk_Bjlk_DB_GB_MT32x128x8_SN_PLR1_SU32_SUM3_SUS256_SNLL1_TT4_4_WG8_32_1_WGM1
    SolutionIndex: 15
    SolutionNameMin: Cijk_Ailk_Bjlk_DB_GB_MT128x32x8_SN_PLR1_SU32_SUM3_SUS256_SNLL1_TT4_4_WG32_8_1_WGM1
    SolutionIndex: 16
    SolutionNameMin: Cijk_Ailk_Bjlk_DB_GB_MT32x128x8_SN_PLR1_SU0_SUM0_SUS256_SNLL1_TT4_4_WG8_32_1_WGM8
    SolutionIndex: 17
    SolutionNameMin: Cijk_Ailk_Bjlk_DB_GB_MT64x64x8_SN_PLR1_SU0_SUM0_SUS256_SNLL1_TT4_4_WG16_16_1_WGM8
    SolutionIndex: 18
    SolutionNameMin: Cijk_Ailk_Bjlk_DB_GB_MT128x32x8_SN_PLR1_SU0_SUM0_SUS256_SNLL1_TT4_4_WG32_8_1_WGM8
    SolutionIndex: 19
    SolutionNameMin: Cijk_Ailk_Bjlk_DB_GB_MT64x64x16_SN_PLR1_SU0_SUM0_SUS256_SNLL1_TT4_4_WG16_16_1_WGM8
    SolutionIndex: 20
    SolutionNameMin: Cijk_Ailk_Bjlk_DB_GB_MT32x128x8_SN_PLR1_SU32_SUM0_SUS128_SNLL1_TT4_4_WG8_32_1_WGM8
    SolutionIndex: 21
    SolutionNameMin: Cijk_Ailk_Bjlk_DB_GB_MT128x32x8_SN_PLR1_SU32_SUM0_SUS128_SNLL1_TT4_4_WG32_8_1_WGM8
    SolutionIndex: 22
    SolutionNameMin: Cijk_Ailk_Bjlk_DB_GB_MT32x128x8_SN_PLR1_SU32_SUM3_SUS128_SNLL1_TT4_4_WG8_32_1_WGM8
    SolutionIndex: 23
    SolutionNameMin: Cijk_Ailk_Bjlk_DB_GB_MT64x64x8_SN_PLR1_SU32_SUM3_SUS128_SNLL1_TT4_4_WG16_16_1_WGM8
    SolutionIndex: 24
    SolutionNameMin: Cijk_Ailk_Bjlk_DB_GB_MT64x64x8_SN_PLR1_SU32_SUM0_SUS256_SNLL1_TT4_4_WG16_16_1_WGM8
    SolutionIndex: 25
    SolutionNameMin: Cijk_Ailk_Bjlk_DB_GB_MT64x64x16_SN_PLR1_SU32_SUM0_SUS256_SNLL1_TT4_4_WG16_16_1_WGM8
    SolutionIndex: 26
    SolutionNameMin: Cijk_Ailk_Bjlk_DB_GB_MT128x32x8_SN_PLR1_SU32_SUM3_SUS256_SNLL1_TT4_4_WG32_8_1_WGM8
    SolutionIndex: 27
    SolutionNameMin: Cijk_Ailk_Bjlk_DB_GB_MT32x128x8_SN_PLR1_SU0_SUM0_SUS256_SNLL1_TT4_4_WG8_32_1_WGM15
    SolutionIndex: 28
    SolutionNameMin: Cijk_Ailk_Bjlk_DB_GB_MT64x64x8_SN_PLR1_SU0_SUM0_SUS256_SNLL1_TT4_4_WG16_16_1_WGM15
    SolutionIndex: 29
    SolutionNameMin: Cijk_Ailk_Bjlk_DB_GB_MT64x64x8_SN_PLR0_SU0_SUM0_SUS256_SNLL1_TT4_4_WG16_16_1_WGM15
    SolutionIndex: 30
    SolutionNameMin: Cijk_Ailk_Bjlk_DB_GB_MT128x32x8_SN_PLR1_SU0_SUM0_SUS256_SNLL1_TT4_4_WG32_8_1_WGM15
    SolutionIndex: 31
    SolutionNameMin: Cijk_Ailk_Bjlk_DB_GB_MT64x64x16_SN_PLR1_SU0_SUM0_SUS256_SNLL1_TT4_4_WG16_16_1_WGM15
    SolutionIndex: 32
    SolutionNameMin: Cijk_Ailk_Bjlk_DB_GB_MT128x32x8_SN_PLR1_SU32_SUM0_SUS128_SNLL1_TT4_4_WG32_8_1_WGM15
    SolutionIndex: 33
    SolutionNameMin: Cijk_Ailk_Bjlk_DB_GB_MT64x64x16_SN_PLR1_SU32_SUM0_SUS128_SNLL1_TT4_4_WG16_16_1_WGM15
    SolutionIndex: 34
    SolutionNameMin: Cijk_Ailk_Bjlk_DB_GB_MT64x64x8_SN_PLR1_SU32_SUM3_SUS128_SNLL1_TT4_4_WG16_16_1_WGM15
    SolutionIndex: 35
    SolutionNameMin: Cijk_Ailk_Bjlk_DB_GB_MT32x128x8_SN_PLR1_SU0_SUM0_SUS256_SNLL0_TT4_4_WG8_32_1_WGM1
    SolutionIndex: 36
    SolutionNameMin: Cijk_Ailk_Bjlk_DB_GB_MT64x64x8_SN_PLR1_SU0_SUM0_SUS256_SNLL0_TT4_4_WG16_16_1_WGM1
    SolutionIndex: 37
    SolutionNameMin: Cijk_Ailk_Bjlk_DB_GB_MT64x64x8_SN_PLR0_SU0_SUM0_SUS256_SNLL0_TT4_4_WG16_16_1_WGM1
    SolutionIndex: 38
    SolutionNameMin: Cijk_Ailk_Bjlk_DB_GB_MT128x32x8_SN_PLR1_SU0_SUM0_SUS256_SNLL0_TT4_4_WG32_8_1_WGM1
    SolutionIndex: 39
    SolutionNameMin: Cijk_Ailk_Bjlk_DB_GB_MT192x32x8_SN_PLR0_SU0_SUM0_SUS256_SNLL0_TT6_4_WG32_8_1_WGM1
    SolutionIndex: 40
    SolutionNameMin: Cijk_Ailk_Bjlk_DB_GB_MT32x128x8_SN_PLR1_SU32_SUM0_SUS128_SNLL0_TT4_4_WG8_32_1_WGM1
    SolutionIndex: 41
    SolutionNameMin: Cijk_Ailk_Bjlk_DB_GB_MT64x64x8_SN_PLR1_SU32_SUM0_SUS128_SNLL0_TT4_4_WG16_16_1_WGM1
    SolutionIndex: 42
    SolutionNameMin: Cijk_Ailk_Bjlk_DB_GB_MT64x64x8_SN_PLR0_SU32_SUM0_SUS128_SNLL0_TT4_4_WG16_16_1_WGM1
    SolutionIndex: 43
    SolutionNameMin: Cijk_Ailk_Bjlk_DB_GB_MT32x128x8_SN_PLR1_SU32_SUM3_SUS128_SNLL0_TT4_4_WG8_32_1_WGM1
    SolutionIndex: 44
    SolutionNameMin: Cijk_Ailk_Bjlk_DB_GB_MT64x64x8_SN_PLR1_SU32_SUM3_SUS128_SNLL0_TT4_4_WG16_16_1_WGM1
    SolutionIndex: 45
    SolutionNameMin: Cijk_Ailk_Bjlk_DB_GB_MT64x64x8_SN_PLR0_SU32_SUM3_SUS128_SNLL0_TT4_4_WG16_16_1_WGM1
    SolutionIndex: 46
    SolutionNameMin: Cijk_Ailk_Bjlk_DB_GB_MT64x64x8_SN_PLR1_SU32_SUM0_SUS256_SNLL0_TT4_4_WG16_16_1_WGM1
    SolutionIndex: 47
    SolutionNameMin: Cijk_Ailk_Bjlk_DB_GB_MT64x64x8_SN_PLR0_SU32_SUM0_SUS256_SNLL0_TT4_4_WG16_16_1_WGM1
    SolutionIndex: 48
    SolutionNameMin: Cijk_Ailk_Bjlk_DB_GB_MT128x32x8_SN_PLR1_SU32_SUM0_SUS256_SNLL0_TT4_4_WG32_8_1_WGM1
    SolutionIndex: 49
    SolutionNameMin: Cijk_Ailk_Bjlk_DB_GB_MT64x64x8_SN_PLR1_SU32_SUM3_SUS256_SNLL0_TT4_4_WG16_16_1_WGM1
    SolutionIndex: 50
    SolutionNameMin: Cijk_Ailk_Bjlk_DB_GB_MT64x64x8_SN_PLR0_SU32_SUM3_SUS256_SNLL0_TT4_4_WG16_16_1_WGM1
    SolutionIndex: 51
    SolutionNameMin: Cijk_Ailk_Bjlk_DB_GB_MT128x32x8_SN_PLR1_SU32_SUM3_SUS256_SNLL0_TT4_4_WG32_8_1_WGM1
    SolutionIndex: 52
    SolutionNameMin: Cijk_Ailk_Bjlk_DB_GB_MT32x128x8_SN_PLR1_SU0_SUM0_SUS256_SNLL0_TT4_4_WG8_32_1_WGM8
    SolutionIndex: 53
    SolutionNameMin: Cijk_Ailk_Bjlk_DB_GB_MT64x64x8_SN_PLR1_SU0_SUM0_SUS256_SNLL0_TT4_4_WG16_16_1_WGM8
    SolutionIndex: 54
    SolutionNameMin: Cijk_Ailk_Bjlk_DB_GB_MT64x64x8_SN_PLR0_SU0_SUM0_SUS256_SNLL0_TT4_4_WG16_16_1_WGM8
    SolutionIndex: 55
    SolutionNameMin: Cijk_Ailk_Bjlk_DB_GB_MT128x32x8_SN_PLR1_SU0_SUM0_SUS256_SNLL0_TT4_4_WG32_8_1_WGM8
    SolutionIndex: 56
    SolutionNameMin: Cijk_Ailk_Bjlk_DB_GB_MT32x128x8_SN_PLR1_SU32_SUM0_SUS128_SNLL0_TT4_4_WG8_32_1_WGM8
    SolutionIndex: 57
    SolutionNameMin: Cijk_Ailk_Bjlk_DB_GB_MT64x64x8_SN_PLR1_SU32_SUM0_SUS128_SNLL0_TT4_4_WG16_16_1_WGM8
    SolutionIndex: 58
    SolutionNameMin: Cijk_Ailk_Bjlk_DB_GB_MT64x64x8_SN_PLR0_SU32_SUM0_SUS128_SNLL0_TT4_4_WG16_16_1_WGM8
    SolutionIndex: 59
    SolutionNameMin: Cijk_Ailk_Bjlk_DB_GB_MT32x128x8_SN_PLR1_SU32_SUM3_SUS128_SNLL0_TT4_4_WG8_32_1_WGM8
    SolutionIndex: 60
    SolutionNameMin: Cijk_Ailk_Bjlk_DB_GB_MT64x64x8_SN_PLR1_SU32_SUM3_SUS128_SNLL0_TT4_4_WG16_16_1_WGM8
    SolutionIndex: 61
    SolutionNameMin: Cijk_Ailk_Bjlk_DB_GB_MT32x128x8_SN_PLR1_SU32_SUM0_SUS256_SNLL0_TT4_4_WG8_32_1_WGM8
    SolutionIndex: 62
    SolutionNameMin: Cijk_Ailk_Bjlk_DB_GB_MT64x64x8_SN_PLR1_SU32_SUM0_SUS256_SNLL0_TT4_4_WG16_16_1_WGM8
    SolutionIndex: 63
    SolutionNameMin: Cijk_Ailk_Bjlk_DB_GB_MT32x128x8_SN_PLR1_SU32_SUM3_SUS256_SNLL0_TT4_4_WG8_32_1_WGM8
    SolutionIndex: 64
    SolutionNameMin: Cijk_Ailk_Bjlk_DB_GB_MT64x64x8_SN_PLR1_SU32_SUM3_SUS256_SNLL0_TT4_4_WG16_16_1_WGM8
    SolutionIndex: 65
    SolutionNameMin: Cijk_Ailk_Bjlk_DB_GB_MT128x32x8_SN_PLR1_SU32_SUM3_SUS256_SNLL0_TT4_4_WG32_8_1_WGM8
    SolutionIndex: 66
    SolutionNameMin: Cijk_Ailk_Bjlk_DB_GB_MT32x128x8_SN_PLR1_SU0_SUM0_SUS256_SNLL0_TT4_4_WG8_32_1_WGM15
    SolutionIndex: 67
    SolutionNameMin: Cijk_Ailk_Bjlk_DB_GB_MT64x64x8_SN_PLR1_SU0_SUM0_SUS256_SNLL0_TT4_4_WG16_16_1_WGM15
    SolutionIndex: 68
    SolutionNameMin: Cijk_Ailk_Bjlk_DB_GB_MT64x64x8_SN_PLR0_SU0_SUM0_SUS256_SNLL0_TT4_4_WG16_16_1_WGM15
    SolutionIndex: 69
    SolutionNameMin: Cijk_Ailk_Bjlk_DB_GB_MT128x32x8_SN_PLR1_SU0_SUM0_SUS256_SNLL0_TT4_4_WG32_8_1_WGM15
    SolutionIndex: 70
    SolutionNameMin: Cijk_Ailk_Bjlk_DB_GB_MT32x128x8_SN_PLR1_SU32_SUM0_SUS128_SNLL0_TT4_4_WG8_32_1_WGM15
    SolutionIndex: 71
    SolutionNameMin: Cijk_Ailk_Bjlk_DB_GB_MT64x64x8_SN_PLR1_SU32_SUM0_SUS128_SNLL0_TT4_4_WG16_16_1_WGM15
    SolutionIndex: 72
    SolutionNameMin: Cijk_Ailk_Bjlk_DB_GB_MT128x32x8_SN_PLR1_SU32_SUM0_SUS128_SNLL0_TT4_4_WG32_8_1_WGM15
    SolutionIndex: 73
    SolutionNameMin: Cijk_Ailk_Bjlk_DB_GB_MT64x64x8_SN_PLR1_SU32_SUM3_SUS128_SNLL0_TT4_4_WG16_16_1_WGM15
    SolutionIndex: 74
    SolutionNameMin: Cijk_Ailk_Bjlk_DB_GB_MT128x32x8_SN_PLR1_SU32_SUM0_SUS256_SNLL0_TT4_4_WG32_8_1_WGM15
    SolutionIndex: 75
    SolutionNameMin: Cijk_Ailk_Bjlk_DB_GB_MT64x64x8_SN_PLR1_SU32_SUM3_SUS256_SNLL0_TT4_4_WG16_16_1_WGM15
    SolutionIndex: 76
    SolutionNameMin: Cijk_Ailk_Bjlk_DB_GB_MT16x16x4_SN_PLR1_SU0_SUM0_SUS256_SNLL1_TT2_2_WG8_8_1_WGM1
    SolutionIndex: 77
    SolutionNameMin: Cijk_Ailk_Bjlk_DB_GB_MT16x8x8_SN_PLR0_SU0_SUM0_SUS256_SNLL1_TT2_1_WG8_8_1_WGM1
    SolutionIndex: 78
    SolutionNameMin: Cijk_Ailk_Bjlk_DB_GB_MT8x8x8_SN_PLR1_SU0_SUM0_SUS256_SNLL1_TT1_1_WG8_8_1_WGM15
    SolutionIndex: 79
    SolutionNameMin: Cijk_Ailk_Bjlk_DB_GB_MT16x16x8_SN_PLR0_SU0_SUM0_SUS256_SNLL1_TT2_1_WG8_16_1_WGM15
    SolutionIndex: 80
    SolutionNameMin: Cijk_Ailk_Bjlk_DB_GB_MT16x16x4_SN_PLR1_SU0_SUM0_SUS256_SNLL0_TT2_2_WG8_8_1_WGM1
    SolutionIndex: 81
    SolutionNameMin: Cijk_Ailk_Bjlk_DB_GB_MT8x8x8_SN_PLR1_SU0_SUM0_SUS256_SNLL0_TT1_1_WG8_8_1_WGM1
    SolutionIndex: 82
    SolutionNameMin: Cijk_Ailk_Bjlk_DB_GB_MT8x8x8_SN_PLR0_SU0_SUM0_SUS256_SNLL0_TT1_1_WG8_8_1_WGM1
    SolutionIndex: 83
    SolutionNameMin: Cijk_Ailk_Bjlk_DB_GB_MT16x16x8_SN_PLR1_SU0_SUM0_SUS256_SNLL0_TT2_1_WG8_16_1_WGM1
    SolutionIndex: 84
    SolutionNameMin: Cijk_Ailk_Bjlk_DB_GB_MT16x16x8_SN_PLR0_SU0_SUM0_SUS256_SNLL0_TT2_1_WG8_16_1_WGM1
    SolutionIndex: 85
    SolutionNameMin: Cijk_Ailk_Bjlk_DB_GB_MT8x8x16_SN_PLR1_SU0_SUM0_SUS256_SNLL0_TT1_1_WG8_8_1_WGM1
    SolutionIndex: 86
    SolutionNameMin: Cijk_Ailk_Bjlk_DB_GB_MT32x32x8_SN_PLR1_SU32_SUM0_SUS128_SNLL0_TT2_2_WG16_16_1_WGM1
    SolutionIndex: 87
    SolutionNameMin: Cijk_Ailk_Bjlk_DB_GB_MT32x32x8_SN_PLR0_SU32_SUM0_SUS128_SNLL0_TT2_2_WG16_16_1_WGM1
    SolutionIndex: 88
    SolutionNameMin: Cijk_Ailk_Bjlk_DB_GB_MT32x32x8_SN_PLR1_SU32_SUM3_SUS128_SNLL0_TT2_2_WG16_16_1_WGM1
    SolutionIndex: 89
    SolutionNameMin: Cijk_Ailk_Bjlk_DB_GB_MT32x32x8_SN_PLR1_SU32_SUM0_SUS256_SNLL0_TT2_2_WG16_16_1_WGM1
    SolutionIndex: 90
    SolutionNameMin: Cijk_Ailk_Bjlk_DB_GB_MT16x16x4_SN_PLR1_SU32_SUM3_SUS256_SNLL0_TT2_2_WG8_8_1_WGM1
    SolutionIndex: 91
    SolutionNameMin: Cijk_Ailk_Bjlk_DB_GB_MT32x32x8_SN_PLR1_SU32_SUM3_SUS256_SNLL0_TT2_2_WG16_16_1_WGM1
    SolutionIndex: 92
    SolutionNameMin: Cijk_Ailk_Bjlk_DB_GB_MT8x16x8_SN_PLR1_SU0_SUM0_SUS256_SNLL0_TT1_2_WG8_8_1_WGM8
    SolutionIndex: 93
    SolutionNameMin: Cijk_Ailk_Bjlk_DB_GB_MT32x32x8_SN_PLR1_SU0_SUM0_SUS256_SNLL0_TT2_2_WG16_16_1_WGM8
    SolutionIndex: 94
    SolutionNameMin: Cijk_Ailk_Bjlk_DB_GB_MT32x32x8_SN_PLR1_SU32_SUM0_SUS128_SNLL0_TT2_2_WG16_16_1_WGM8
    SolutionIndex: 95
    SolutionNameMin: Cijk_Ailk_Bjlk_DB_GB_MT32x32x8_SN_PLR1_SU32_SUM3_SUS128_SNLL0_TT2_2_WG16_16_1_WGM8
    SolutionIndex: 96
    SolutionNameMin: Cijk_Ailk_Bjlk_DB_GB_MT32x32x8_SN_PLR1_SU32_SUM3_SUS256_SNLL0_TT2_2_WG16_16_1_WGM8
    SolutionIndex: 97
    SolutionNameMin: Cijk_Ailk_Bjlk_DB_GB_MT32x32x8_SN_PLR0_SU32_SUM3_SUS256_SNLL0_TT2_2_WG16_16_1_WGM8
    SolutionIndex: 98
    SolutionNameMin: Cijk_Ailk_Bjlk_DB_GB_MT16x16x8_SN_PLR1_SU0_SUM0_SUS256_SNLL0_TT2_1_WG8_16_1_WGM15
    SolutionIndex: 99
    SolutionNameMin: Cijk_Ailk_Bjlk_DB_GB_MT32x32x8_SN_PLR1_SU0_SUM0_SUS256_SNLL0_TT2_2_WG16_16_1_WGM15
    SolutionIndex: 100
    SolutionNameMin: Cijk_Ailk_Bjlk_DB_GB_MT32x32x8_SN_PLR1_SU32_SUM3_SUS128_SNLL0_TT2_2_WG16_16_1_WGM15
    SolutionIndex: 101
    SolutionNameMin: Cijk_Ailk_Bjlk_DB_GB_MT16x16x4_SN_PLR1_SU32_SUM3_SUS256_SNLL0_TT2_2_WG8_8_1_WGM15
    SolutionIndex: 102
    SolutionNameMin: Cijk_Ailk_Bjlk_DB_GB_MT32x32x8_SN_PLR1_SU32_SUM3_SUS256_SNLL0_TT2_2_WG16_16_1_WGM15
    SolutionIndex: 103
    SolutionNameMin: Cijk_Ailk_Bjlk_DB_GB_MT32x32x8_SN_PLR1_SU0_SUM0_SUS256_SNLL1_TT4_4_WG8_8_1_WGM1
    SolutionIndex: 104
    SolutionNameMin: Cijk_Ailk_Bjlk_DB_GB_MT32x32x8_SN_PLR1_SU0_SUM0_SUS256_SNLL1_TT4_4_WG8_8_1_WGM8
    SolutionIndex: 105
    SolutionNameMin: Cijk_Ailk_Bjlk_DB_GB_MT24x24x8_SN_PLR1_SU0_SUM0_SUS256_SNLL0_TT3_3_WG8_8_1_WGM1
    SolutionIndex: 106
    SolutionNameMin: Cijk_Ailk_Bjlk_DB_GB_MT32x32x8_SN_PLR1_SU0_SUM0_SUS256_SNLL0_TT4_4_WG8_8_1_WGM1
    SolutionIndex: 107
    SolutionNameMin: Cijk_Ailk_Bjlk_DB_GB_MT40x40x8_SN_PLR1_SU0_SUM0_SUS256_SNLL0_TT5_5_WG8_8_1_WGM1
    SolutionIndex: 108
    SolutionNameMin: Cijk_Ailk_Bjlk_DB_GB_MT48x48x8_SN_PLR1_SU0_SUM0_SUS256_SNLL0_TT6_6_WG8_8_1_WGM1
    SolutionIndex: 109
    SolutionNameMin: Cijk_Ailk_Bjlk_DB_GB_MT48x48x16_SN_PLR1_SU0_SUM0_SUS256_SNLL0_TT3_3_WG16_16_1_WGM1
    SolutionIndex: 110
    SolutionNameMin: Cijk_Ailk_Bjlk_DB_GB_MT40x40x8_SN_PLR1_SU32_SUM3_SUS128_SNLL0_TT5_5_WG8_8_1_WGM1
    SolutionIndex: 111
    SolutionNameMin: Cijk_Ailk_Bjlk_DB_GB_MT24x24x8_SN_PLR1_SU0_SUM0_SUS256_SNLL0_TT3_3_WG8_8_1_WGM8
    SolutionIndex: 112
    SolutionNameMin: Cijk_Ailk_Bjlk_DB_GB_MT32x32x8_SN_PLR1_SU0_SUM0_SUS256_SNLL0_TT4_4_WG8_8_1_WGM8
    SolutionIndex: 113
    SolutionNameMin: Cijk_Ailk_Bjlk_DB_GB_MT40x40x8_SN_PLR1_SU0_SUM0_SUS256_SNLL0_TT5_5_WG8_8_1_WGM8
    SolutionIndex: 114
    SolutionNameMin: Cijk_Ailk_Bjlk_DB_GB_MT48x48x8_SN_PLR1_SU0_SUM0_SUS256_SNLL0_TT6_6_WG8_8_1_WGM8
    SolutionIndex: 115
    SolutionNameMin: Cijk_Ailk_Bjlk_DB_GB_MT48x48x16_SN_PLR1_SU0_SUM0_SUS256_SNLL0_TT3_3_WG16_16_1_WGM8
    SolutionIndex: 116
    SolutionNameMin: Cijk_Ailk_Bjlk_DB_GB_MT40x40x8_SN_PLR1_SU32_SUM0_SUS128_SNLL0_TT5_5_WG8_8_1_WGM8
    SolutionIndex: 117
    SolutionNameMin: Cijk_Ailk_Bjlk_DB_GB_MT40x40x8_SN_PLR1_SU32_SUM3_SUS256_SNLL0_TT5_5_WG8_8_1_WGM8
    SolutionIndex: 118
    SolutionNameMin: Cijk_Ailk_Bjlk_DB_GB_MT24x24x8_SN_PLR1_SU0_SUM0_SUS256_SNLL0_TT3_3_WG8_8_1_WGM15
    SolutionIndex: 119
    SolutionNameMin: Cijk_Ailk_Bjlk_DB_GB_MT32x32x8_SN_PLR1_SU0_SUM0_SUS256_SNLL0_TT4_4_WG8_8_1_WGM15
    SolutionIndex: 120
    SolutionNameMin: Cijk_Ailk_Bjlk_DB_GB_MT48x48x8_SN_PLR1_SU0_SUM0_SUS256_SNLL0_TT6_6_WG8_8_1_WGM15
    SolutionIndex: 121
    SolutionNameMin: Cijk_Ailk_Bjlk_DB_GB_MT24x24x8_SN_PLR1_SU32_SUM0_SUS256_SNLL0_TT3_3_WG8_8_1_WGM15
    SolutionIndex: 122
    SolutionNameMin: Cijk_Ailk_Bjlk_DB_GB_MT40x40x8_SN_PLR1_SU32_SUM0_SUS256_SNLL0_TT5_5_WG8_8_1_WGM15
    SolutionIndex: 123
    SolutionNameMin: Cijk_Ailk_Bjlk_DB_GB_MT64x128x8_SN_PLR0_SU32_SUM0_SUS128_SNLL0_TT4_8_WG16_16_1_WGM8
    SolutionIndex: 124
    SolutionNameMin: Cijk_Ailk_Bjlk_DB_GB_MT256x32x8_SN_PLR1_SU32_SUM3_SUS256_SNLL0_TT8_4_WG32_8_1_WGM8
    SolutionIndex: 125
    SolutionNameMin: Cijk_Ailk_Bjlk_DB_GB_MT64x128x8_SN_PLR0_SU32_SUM0_SUS128_SNLL0_TT8_4_WG8_32_1_WGM15
- - - [192, 192, 1000, 32, 192, 192, 192, 192]
    - [36, 5335.0]
  - - [1536, 1536, 168, 32, 1536, 1536, 1536, 1536]
    - [68, 5956.0]
  - - [1536, 32, 168, 1536, 1536, 1536, 1536, 32]
    - [39, 6767.0]
  - - [32, 1536, 168, 32, 32, 32, 32, 1536]
    - [35, 3642.0]
  - - [384, 384, 1024, 384, 384, 384, 384, 384]
    - [67, 7402.0]
  - - [1, 1, 1000, 1, 1, 1, 1, 1]
    - [76, 0.0]
  - - [2, 2, 1000, 2, 2, 2, 2, 2]
    - [76, 2.0]
  - - [3, 3, 1000, 3, 3, 3, 3, 3]
    - [77, 8.0]
  - - [4, 4, 1000, 4, 4, 4, 4, 4]
    - [78, 18.0]
  - - [5, 5, 1000, 5, 5, 5, 5, 5]
    - [82, 35.0]
  - - [6, 6, 1000, 6, 6, 6, 6, 6]
    - [81, 57.0]
  - - [7, 7, 1000, 7, 7, 7, 7, 7]
    - [85, 91.0]
  - - [8, 8, 1000, 8, 8, 8, 8, 8]
    - [82, 139.0]
  - - [9, 9, 1000, 9, 9, 9, 9, 9]
    - [92, 157.0]
  - - [10, 10, 1000, 10, 10, 10, 10, 10]
    - [80, 212.0]
  - - [11, 11, 1000, 11, 11, 11, 11, 11]
    - [83, 273.0]
  - - [12, 12, 1000, 12, 12, 12, 12, 12]
    - [90, 348.0]
  - - [13, 13, 1000, 13, 13, 13, 13, 13]
    - [98, 410.0]
  - - [14, 14, 1000, 14, 14, 14, 14, 14]
    - [79, 490.0]
  - - [15, 15, 1000, 15, 15, 15, 15, 15]
    - [84, 586.0]
  - - [16, 16, 1000, 16, 16, 16, 16, 16]
    - [101, 764.0]
  - - [17, 17, 1000, 17, 17, 17, 17, 17]
    - [99, 543.0]
  - - [18, 18, 1000, 18, 18, 18, 18, 18]
    - [89, 602.0]
  - - [19, 19, 1000, 19, 19, 19, 19, 19]
    - [99, 691.0]
  - - [20, 20, 1000, 20, 20, 20, 20, 20]
    - [100, 769.0]
  - - [21, 21, 1000, 21, 21, 21, 21, 21]
    - [88, 845.0]
  - - [22, 22, 1000, 22, 22, 22, 22, 22]
    - [97, 958.0]
  - - [23, 23, 1000, 23, 23, 23, 23, 23]
    - [87, 1042.0]
  - - [24, 24, 1000, 24, 24, 24, 24, 24]
    - [93, 1243.0]
  - - [25, 25, 1000, 25, 25, 25, 25, 25]
    - [102, 1268.0]
  - - [26, 26, 1000, 26, 26, 26, 26, 26]
    - [95, 1323.0]
  - - [27, 27, 1000, 27, 27, 27, 27, 27]
    - [86, 1414.0]
  - - [28, 28, 1000, 28, 28, 28, 28, 28]
    - [86, 1524.0]
  - - [29, 29, 1000, 29, 29, 29, 29, 29]
    - [96, 1613.0]
  - - [30, 30, 1000, 30, 30, 30, 30, 30]
    - [94, 1679.0]
  - - [31, 31, 1000, 31, 31, 31, 31, 31]
    - [91, 1782.0]
  - - [32, 32, 1000, 32, 32, 32, 32, 32]
    - [100, 2202.0]
  - - [33, 33, 1000, 33, 33, 33, 33, 33]
    - [113, 1280.0]
  - - [34, 34, 1000, 34, 34, 34, 34, 34]
    - [110, 1361.0]
  - - [35, 35, 1000, 35, 35, 35, 35, 35]
    - [122, 1445.0]
  - - [36, 36, 1000, 36, 36, 36, 36, 36]
    - [116, 1572.0]
  - - [37, 37, 1000, 37, 37, 37, 37, 37]
    - [110, 1611.0]
  - - [38, 38, 1000, 38, 38, 38, 38, 38]
    - [109, 1706.0]
  - - [39, 39, 1000, 39, 39, 39, 39, 39]
    - [117, 1787.0]
  - - [40, 40, 1000, 40, 40, 40, 40, 40]
    - [107, 2216.0]
  - - [41, 41, 1000, 41, 41, 41, 41, 41]
    - [109, 1958.0]
  - - [42, 42, 1000, 42, 42, 42, 42, 42]
    - [109, 2053.0]
  - - [43, 43, 1000, 43, 43, 43, 43, 43]
    - [109, 2133.0]
  - - [44, 44, 1000, 44, 44, 44, 44, 44]
    - [105, 2340.0]
  - - [45, 45, 1000, 45, 45, 45, 45, 45]
    - [115, 2256.0]
  - - [46, 46, 1000, 46, 46, 46, 46, 46]
    - [118, 2419.0]
  - - [47, 47, 1000, 47, 47, 47, 47, 47]
    - [121, 2467.0]
  - - [48, 48, 1000, 48, 48, 48, 48, 48]
    - [109, 3093.0]
  - - [49, 49, 1000, 49, 49, 49, 49, 49]
    - [71, 2419.0]
  - - [50, 50, 1000, 50, 50, 50, 50, 50]
    - [75, 2532.0]
  - - [51, 51, 1000, 51, 51, 51, 51, 51]
    - [67, 2583.0]
  - - [52, 52, 1000, 52, 52, 52, 52, 52]
    - [49, 2790.0]
  - - [53, 53, 1000, 53, 53, 53, 53, 53]
    - [67, 2757.0]
  - - [54, 54, 1000, 54, 54, 54, 54, 54]
    - [44, 2916.0]
  - - [55, 55, 1000, 55, 55, 55, 55, 55]
    - [17, 2913.0]
  - - [56, 56, 1000, 56, 56, 56, 56, 56]
    - [53, 3346.0]
  - - [57, 57, 1000, 57, 57, 57, 57, 57]
    - [23, 3141.0]
  - - [58, 58, 1000, 58, 58, 58, 58, 58]
    - [1, 3278.0]
  - - [59, 59, 1000, 59, 59, 59, 59, 59]
    - [28, 3321.0]
  - - [60, 60, 1000, 60, 60, 60, 60, 60]
    - [28, 3548.0]
  - - [61, 61, 1000, 61, 61, 61, 61, 61]
    - [46, 3529.0]
  - - [62, 62, 1000, 62, 62, 62, 62, 62]
    - [28, 3757.0]
  - - [63, 63, 1000, 63, 63, 63, 63, 63]
    - [36, 3730.0]
  - - [64, 64, 1000, 64, 64, 64, 64, 64]
    - [60, 4206.0]
  - - [65, 65, 1000, 65, 65, 65, 65, 65]
    - [105, 2686.0]
  - - [66, 66, 1000, 66, 66, 66, 66, 66]
    - [118, 2854.0]
  - - [67, 67, 1000, 67, 67, 67, 67, 67]
    - [118, 2876.0]
  - - [68, 68, 1000, 68, 68, 68, 68, 68]
    - [118, 3206.0]
  - - [69, 69, 1000, 69, 69, 69, 69, 69]
    - [105, 3028.0]
  - - [70, 70, 1000, 70, 70, 70, 70, 70]
    - [111, 3209.0]
  - - [71, 71, 1000, 71, 71, 71, 71, 71]
    - [111, 3168.0]
  - - [72, 72, 1000, 72, 72, 72, 72, 72]
    - [111, 3981.0]
  - - [73, 73, 1000, 73, 73, 73, 73, 73]
    - [106, 2981.0]
  - - [74, 74, 1000, 74, 74, 74, 74, 74]
    - [106, 3055.0]
  - - [75, 75, 1000, 75, 75, 75, 75, 75]
    - [106, 3109.0]
  - - [76, 76, 1000, 76, 76, 76, 76, 76]
    - [106, 3290.0]
  - - [77, 77, 1000, 77, 77, 77, 77, 77]
    - [106, 3257.0]
  - - [78, 78, 1000, 78, 78, 78, 78, 78]
    - [106, 3333.0]
  - - [79, 79, 1000, 79, 79, 79, 79, 79]
    - [106, 3373.0]
  - - [80, 80, 1000, 80, 80, 80, 80, 80]
    - [106, 3858.0]
  - - [81, 81, 1000, 81, 81, 81, 81, 81]
    - [106, 3511.0]
  - - [82, 82, 1000, 82, 82, 82, 82, 82]
    - [112, 3629.0]
  - - [83, 83, 1000, 83, 83, 83, 83, 83]
    - [104, 3623.0]
  - - [84, 84, 1000, 84, 84, 84, 84, 84]
    - [106, 3863.0]
  - - [85, 85, 1000, 85, 85, 85, 85, 85]
    - [106, 3698.0]
  - - [86, 86, 1000, 86, 86, 86, 86, 86]
    - [103, 3833.0]
  - - [87, 87, 1000, 87, 87, 87, 87, 87]
    - [112, 3857.0]
  - - [88, 88, 1000, 88, 88, 88, 88, 88]
    - [119, 4572.0]
  - - [89, 89, 1000, 89, 89, 89, 89, 89]
    - [112, 4037.0]
  - - [90, 90, 1000, 90, 90, 90, 90, 90]
    - [119, 4180.0]
  - - [91, 91, 1000, 91, 91, 91, 91, 91]
    - [106, 4150.0]
  - - [92, 92, 1000, 92, 92, 92, 92, 92]
    - [106, 4490.0]
  - - [93, 93, 1000, 93, 93, 93, 93, 93]
    - [106, 4277.0]
  - - [94, 94, 1000, 94, 94, 94, 94, 94]
    - [112, 4437.0]
  - - [95, 95, 1000, 95, 95, 95, 95, 95]
    - [106, 4409.0]
  - - [96, 96, 1000, 96, 96, 96, 96, 96]
    - [112, 5546.0]
  - - [97, 97, 1000, 97, 97, 97, 97, 97]
    - [2, 3691.0]
  - - [98, 98, 1000, 98, 98, 98, 98, 98]
    - [37, 3772.0]
  - - [99, 99, 1000, 99, 99, 99, 99, 99]
    - [54, 3850.0]
  - - [100, 100, 1000, 100, 100, 100, 100, 100]
    - [68, 3961.0]
  - - [101, 101, 1000, 101, 101, 101, 101, 101]
    - [37, 3995.0]
  - - [102, 102, 1000, 102, 102, 102, 102, 102]
    - [54, 4072.0]
  - - [103, 103, 1000, 103, 103, 103, 103, 103]
    - [68, 4137.0]
  - - [104, 104, 1000, 104, 104, 104, 104, 104]
    - [54, 4352.0]
  - - [105, 105, 1000, 105, 105, 105, 105, 105]
    - [37, 4310.0]
  - - [106, 106, 1000, 106, 106, 106, 106, 106]
    - [54, 4384.0]
  - - [107, 107, 1000, 107, 107, 107, 107, 107]
    - [54, 4485.0]
  - - [108, 108, 1000, 108, 108, 108, 108, 108]
    - [68, 4616.0]
  - - [109, 109, 1000, 109, 109, 109, 109, 109]
    - [37, 4637.0]
  - - [110, 110, 1000, 110, 110, 110, 110, 110]
    - [54, 4725.0]
  - - [111, 111, 1000, 111, 111, 111, 111, 111]
    - [53, 4761.0]
  - - [112, 112, 1000, 112, 112, 112, 112, 112]
    - [37, 5009.0]
  - - [113, 113, 1000, 113, 113, 113, 113, 113]
    - [29, 4940.0]
  - - [114, 114, 1000, 114, 114, 114, 114, 114]
    - [54, 5043.0]
  - - [115, 115, 1000, 115, 115, 115, 115, 115]
    - [68, 5121.0]
  - - [116, 116, 1000, 116, 116, 116, 116, 116]
    - [68, 5269.0]
  - - [117, 117, 1000, 117, 117, 117, 117, 117]
    - [37, 5253.0]
  - - [118, 118, 1000, 118, 118, 118, 118, 118]
    - [36, 5365.0]
  - - [119, 119, 1000, 119, 119, 119, 119, 119]
    - [37, 5390.0]
  - - [120, 120, 1000, 120, 120, 120, 120, 120]
    - [68, 5698.0]
  - - [121, 121, 1000, 121, 121, 121, 121, 121]
    - [29, 5574.0]
  - - [122, 122, 1000, 122, 122, 122, 122, 122]
    - [68, 5682.0]
  - - [123, 123, 1000, 123, 123, 123, 123, 123]
    - [37, 5719.0]
  - - [124, 124, 1000, 124, 124, 124, 124, 124]
    - [54, 5914.0]
  - - [125, 125, 1000, 125, 125, 125, 125, 125]
    - [28, 5849.0]
  - - [126, 126, 1000, 126, 126, 126, 126, 126]
    - [36, 5949.0]
  - - [127, 127, 1000, 127, 127, 127, 127, 127]
    - [67, 6022.0]
  - - [128, 128, 1000, 128, 128, 128, 128, 128]
    - [67, 6888.0]
  - - [129, 129, 1000, 129, 129, 129, 129, 129]
    - [120, 3985.0]
  - - [130, 130, 1000, 130, 130, 130, 130, 130]
    - [108, 4072.0]
  - - [131, 131, 1000, 131, 131, 131, 131, 131]
    - [108, 4125.0]
  - - [132, 132, 1000, 132, 132, 132, 132, 132]
    - [108, 4234.0]
  - - [133, 133, 1000, 133, 133, 133, 133, 133]
    - [114, 4248.0]
  - - [134, 134, 1000, 134, 134, 134, 134, 134]
    - [120, 4319.0]
  - - [135, 135, 1000, 135, 135, 135, 135, 135]
    - [114, 4360.0]
  - - [136, 136, 1000, 136, 136, 136, 136, 136]
    - [108, 4695.0]
  - - [137, 137, 1000, 137, 137, 137, 137, 137]
    - [108, 4533.0]
  - - [138, 138, 1000, 138, 138, 138, 138, 138]
    - [120, 4607.0]
  - - [139, 139, 1000, 139, 139, 139, 139, 139]
    - [108, 4652.0]
  - - [140, 140, 1000, 140, 140, 140, 140, 140]
    - [120, 4768.0]
  - - [141, 141, 1000, 141, 141, 141, 141, 141]
    - [108, 4776.0]
  - - [142, 142, 1000, 142, 142, 142, 142, 142]
    - [108, 4864.0]
  - - [143, 143, 1000, 143, 143, 143, 143, 143]
    - [114, 4887.0]
  - - [144, 144, 1000, 144, 144, 144, 144, 144]
    - [108, 5383.0]
  - - [145, 145, 1000, 145, 145, 145, 145, 145]
    - [119, 4656.0]
  - - [146, 146, 1000, 146, 146, 146, 146, 146]
    - [106, 4773.0]
  - - [147, 147, 1000, 147, 147, 147, 147, 147]
    - [106, 4702.0]
  - - [148, 148, 1000, 148, 148, 148, 148, 148]
    - [106, 5086.0]
  - - [149, 149, 1000, 149, 149, 149, 149, 149]
    - [112, 4795.0]
  - - [150, 150, 1000, 150, 150, 150, 150, 150]
    - [106, 4943.0]
  - - [32, 32, 8, 32, 32, 32, 32, 32]
    - [8, 21.0]
  - - [32, 32, 8, 64, 32, 32, 32, 32]
    - [1, 33.0]
  - - [32, 32, 8, 128, 32, 32, 32, 32]
    - [1, 47.0]
  - - [32, 32, 8, 256, 32, 32, 32, 32]
    - [1, 59.0]
  - - [32, 32, 8, 512, 32, 32, 32, 32]
    - [5, 69.0]
  - - [32, 32, 8, 1024, 32, 32, 32, 32]
    - [5, 77.0]
  - - [32, 32, 8, 2048, 32, 32, 32, 32]
    - [5, 82.0]
  - - [32, 64, 8, 32, 32, 32, 32, 64]
    - [3, 42.0]
  - - [32, 64, 8, 64, 32, 32, 32, 64]
    - [3, 66.0]
  - - [32, 64, 8, 128, 32, 32, 32, 64]
    - [3, 95.0]
  - - [32, 64, 8, 256, 32, 32, 32, 64]
    - [3, 119.0]
  - - [32, 64, 8, 512, 32, 32, 32, 64]
    - [17, 138.0]
  - - [32, 64, 8, 1024, 32, 32, 32, 64]
    - [5, 155.0]
  - - [32, 64, 8, 2048, 32, 32, 32, 64]
    - [5, 164.0]
  - - [32, 128, 8, 32, 32, 32, 32, 128]
    - [22, 91.0]
  - - [32, 128, 8, 64, 32, 32, 32, 128]
    - [13, 146.0]
  - - [32, 128, 8, 128, 32, 32, 32, 128]
    - [14, 196.0]
  - - [32, 128, 8, 256, 32, 32, 32, 128]
    - [0, 244.0]
  - - [32, 128, 8, 512, 32, 32, 32, 128]
    - [31, 279.0]
  - - [32, 128, 8, 1024, 32, 32, 32, 128]
    - [25, 310.0]
  - - [32, 128, 8, 2048, 32, 32, 32, 128]
    - [5, 328.0]
  - - [32, 256, 8, 32, 32, 32, 32, 256]
    - [14, 187.0]
  - - [32, 256, 8, 64, 32, 32, 32, 256]
    - [9, 290.0]
  - - [32, 256, 8, 128, 32, 32, 32, 256]
    - [27, 405.0]
  - - [32, 256, 8, 256, 32, 32, 32, 256]
    - [14, 490.0]
  - - [32, 256, 8, 512, 32, 32, 32, 256]
    - [35, 556.0]
  - - [32, 256, 8, 1024, 32, 32, 32, 256]
    - [5, 616.0]
  - - [32, 256, 8, 2048, 32, 32, 32, 256]
    - [5, 654.0]
  - - [32, 512, 8, 32, 32, 32, 32, 512]
    - [18, 460.0]
  - - [32, 512, 8, 64, 32, 32, 32, 512]
    - [74, 624.0]
  - - [32, 512, 8, 128, 32, 32, 32, 512]
    - [27, 785.0]
  - - [32, 512, 8, 256, 32, 32, 32, 512]
    - [0, 982.0]
  - - [32, 512, 8, 512, 32, 32, 32, 512]
    - [52, 1113.0]
  - - [32, 512, 8, 1024, 32, 32, 32, 512]
    - [33, 1230.0]
  - - [32, 512, 8, 2048, 32, 32, 32, 512]
    - [5, 1313.0]
  - - [32, 1024, 8, 32, 32, 32, 32, 1024]
    - [36, 904.0]
  - - [32, 1024, 8, 64, 32, 32, 32, 1024]
    - [23, 1263.0]
  - - [32, 1024, 8, 128, 32, 32, 32, 1024]
    - [20, 1565.0]
  - - [32, 1024, 8, 256, 32, 32, 32, 1024]
    - [66, 1951.0]
  - - [32, 1024, 8, 512, 32, 32, 32, 1024]
    - [0, 2225.0]
  - - [32, 1024, 8, 1024, 32, 32, 32, 1024]
    - [4, 2423.0]
  - - [32, 1024, 8, 2048, 32, 32, 32, 1024]
    - [4, 2557.0]
  - - [32, 2048, 8, 32, 32, 32, 32, 2048]
    - [63, 1840.0]
  - - [32, 2048, 8, 64, 32, 32, 32, 2048]
    - [52, 2497.0]
  - - [32, 2048, 8, 128, 32, 32, 32, 2048]
    - [56, 2985.0]
  - - [32, 2048, 8, 256, 32, 32, 32, 2048]
    - [61, 3355.0]
  - - [32, 2048, 8, 512, 32, 32, 32, 2048]
    - [56, 3554.0]
  - - [32, 2048, 8, 1024, 32, 32, 32, 2048]
    - [56, 3673.0]
  - - [32, 2048, 8, 2048, 32, 32, 32, 2048]
    - [70, 3725.0]
  - - [64, 32, 8, 32, 64, 64, 64, 32]
    - [18, 42.0]
  - - [64, 32, 8, 64, 64, 64, 64, 32]
    - [22, 67.0]
  - - [64, 32, 8, 128, 64, 64, 64, 32]
    - [3, 94.0]
  - - [64, 32, 8, 256, 64, 64, 64, 32]
    - [1, 119.0]
  - - [64, 32, 8, 512, 64, 64, 64, 32]
    - [28, 139.0]
  - - [64, 32, 8, 1024, 64, 64, 64, 32]
    - [19, 155.0]
  - - [64, 32, 8, 2048, 64, 64, 64, 32]
    - [31, 165.0]
  - - [64, 64, 8, 32, 64, 64, 64, 64]
    - [1, 87.0]
  - - [64, 64, 8, 64, 64, 64, 64, 64]
    - [34, 142.0]
  - - [64, 64, 8, 128, 64, 64, 64, 64]
    - [28, 200.0]
  - - [64, 64, 8, 256, 64, 64, 64, 64]
    - [1, 247.0]
  - - [64, 64, 8, 512, 64, 64, 64, 64]
    - [67, 286.0]
  - - [64, 64, 8, 1024, 64, 64, 64, 64]
    - [5, 313.0]
  - - [64, 64, 8, 2048, 64, 64, 64, 64]
    - [19, 331.0]
  - - [64, 128, 8, 32, 64, 64, 64, 128]
    - [0, 183.0]
  - - [64, 128, 8, 64, 64, 64, 64, 128]
    - [13, 290.0]
  - - [64, 128, 8, 128, 64, 64, 64, 128]
    - [0, 400.0]
  - - [64, 128, 8, 256, 64, 64, 64, 128]
    - [34, 498.0]
  - - [64, 128, 8, 512, 64, 64, 64, 128]
    - [28, 573.0]
  - - [64, 128, 8, 1024, 64, 64, 64, 128]
    - [25, 626.0]
  - - [64, 128, 8, 2048, 64, 64, 64, 128]
    - [31, 663.0]
  - - [64, 256, 8, 32, 64, 64, 64, 256]
    - [0, 388.0]
  - - [64, 256, 8, 64, 64, 64, 64, 256]
    - [0, 589.0]
  - - [64, 256, 8, 128, 64, 64, 64, 256]
    - [27, 797.0]
  - - [64, 256, 8, 256, 64, 64, 64, 256]
    - [28, 999.0]
  - - [64, 256, 8, 512, 64, 64, 64, 256]
    - [36, 1135.0]
  - - [64, 256, 8, 1024, 64, 64, 64, 256]
    - [5, 1252.0]
  - - [64, 256, 8, 2048, 64, 64, 64, 256]
    - [5, 1321.0]
  - - [64, 512, 8, 32, 64, 64, 64, 512]
    - [55, 920.0]
  - - [64, 512, 8, 64, 64, 64, 64, 512]
    - [38, 1219.0]
  - - [64, 512, 8, 128, 64, 64, 64, 512]
    - [10, 1565.0]
  - - [64, 512, 8, 256, 64, 64, 64, 512]
    - [53, 1978.0]
  - - [64, 512, 8, 512, 64, 64, 64, 512]
    - [67, 2267.0]
  - - [64, 512, 8, 1024, 64, 64, 64, 512]
    - [5, 2493.0]
  - - [64, 512, 8, 2048, 64, 64, 64, 512]
    - [5, 2648.0]
  - - [64, 1024, 8, 32, 64, 64, 64, 1024]
    - [36, 1942.0]
  - - [64, 1024, 8, 64, 64, 64, 64, 1024]
    - [60, 2621.0]
  - - [64, 1024, 8, 128, 64, 64, 64, 1024]
    - [44, 3178.0]
  - - [64, 1024, 8, 256, 64, 64, 64, 1024]
    - [36, 3577.0]
  - - [64, 1024, 8, 512, 64, 64, 64, 1024]
    - [67, 3800.0]
  - - [64, 1024, 8, 1024, 64, 64, 64, 1024]
    - [41, 3931.0]
  - - [64, 1024, 8, 2048, 64, 64, 64, 1024]
    - [46, 3995.0]
  - - [64, 2048, 8, 32, 64, 64, 64, 2048]
    - [42, 2853.0]
  - - [64, 2048, 8, 64, 64, 64, 64, 2048]
    - [37, 3728.0]
  - - [64, 2048, 8, 128, 64, 64, 64, 2048]
    - [46, 4369.0]
  - - [64, 2048, 8, 256, 64, 64, 64, 2048]
    - [41, 4733.0]
  - - [64, 2048, 8, 512, 64, 64, 64, 2048]
    - [46, 4949.0]
  - - [64, 2048, 8, 1024, 64, 64, 64, 2048]
    - [41, 5063.0]
  - - [64, 2048, 8, 2048, 64, 64, 64, 2048]
    - [46, 5118.0]
  - - [128, 32, 8, 32, 128, 128, 128, 32]
    - [3, 92.0]
  - - [128, 32, 8, 64, 128, 128, 128, 32]
    - [11, 145.0]
  - - [128, 32, 8, 128, 128, 128, 128, 32]
    - [11, 199.0]
  - - [128, 32, 8, 256, 128, 128, 128, 32]
    - [21, 242.0]
  - - [128, 32, 8, 512, 128, 128, 128, 32]
    - [1, 279.0]
  - - [128, 32, 8, 1024, 128, 128, 128, 32]
    - [5, 309.0]
  - - [128, 32, 8, 2048, 128, 128, 128, 32]
    - [5, 329.0]
  - - [128, 64, 8, 32, 128, 128, 128, 64]
    - [3, 189.0]
  - - [128, 64, 8, 64, 128, 128, 128, 64]
    - [11, 290.0]
  - - [128, 64, 8, 128, 128, 128, 128, 64]
    - [1, 402.0]
  - - [128, 64, 8, 256, 128, 128, 128, 64]
    - [53, 503.0]
  - - [128, 64, 8, 512, 128, 128, 128, 64]
    - [17, 570.0]
  - - [128, 64, 8, 1024, 128, 128, 128, 64]
    - [19, 626.0]
  - - [128, 64, 8, 2048, 128, 128, 128, 64]
    - [31, 661.0]
  - - [128, 128, 8, 32, 128, 128, 128, 128]
    - [3, 380.0]
  - - [128, 128, 8, 64, 128, 128, 128, 128]
    - [36, 589.0]
  - - [128, 128, 8, 128, 128, 128, 128, 128]
    - [27, 800.0]
  - - [128, 128, 8, 256, 128, 128, 128, 128]
    - [24, 994.0]
  - - [128, 128, 8, 512, 128, 128, 128, 128]
    - [1, 1143.0]
  - - [128, 128, 8, 1024, 128, 128, 128, 128]
    - [19, 1251.0]
  - - [128, 128, 8, 2048, 128, 128, 128, 128]
    - [31, 1323.0]
  - - [128, 256, 8, 32, 128, 128, 128, 256]
    - [21, 733.0]
  - - [128, 256, 8, 64, 128, 128, 128, 256]
    - [34, 1172.0]
  - - [128, 256, 8, 128, 128, 128, 128, 256]
    - [17, 1607.0]
  - - [128, 256, 8, 256, 128, 128, 128, 256]
    - [17, 1974.0]
  - - [128, 256, 8, 512, 128, 128, 128, 256]
    - [53, 2286.0]
  - - [128, 256, 8, 1024, 128, 128, 128, 256]
    - [19, 2493.0]
  - - [128, 256, 8, 2048, 128, 128, 128, 256]
    - [31, 2644.0]
  - - [128, 512, 8, 32, 128, 128, 128, 512]
    - [36, 1942.0]
  - - [128, 512, 8, 64, 128, 128, 128, 512]
    - [41, 2589.0]
  - - [128, 512, 8, 128, 128, 128, 128, 512]
    - [49, 3166.0]
  - - [128, 512, 8, 256, 128, 128, 128, 512]
    - [67, 3562.0]
  - - [128, 512, 8, 512, 128, 128, 128, 512]
    - [41, 3796.0]
  - - [128, 512, 8, 1024, 128, 128, 128, 512]
    - [46, 3936.0]
  - - [128, 512, 8, 2048, 128, 128, 128, 512]
    - [53, 4003.0]
  - - [128, 1024, 8, 32, 128, 128, 128, 1024]
    - [36, 2873.0]
  - - [128, 1024, 8, 64, 128, 128, 128, 1024]
    - [54, 3762.0]
  - - [128, 1024, 8, 128, 128, 128, 128, 1024]
    - [58, 4369.0]
  - - [128, 1024, 8, 256, 128, 128, 128, 1024]
    - [62, 4733.0]
  - - [128, 1024, 8, 512, 128, 128, 128, 1024]
    - [41, 4960.0]
  - - [128, 1024, 8, 1024, 128, 128, 128, 1024]
    - [41, 5072.0]
  - - [128, 1024, 8, 2048, 128, 128, 128, 1024]
    - [41, 5128.0]
  - - [128, 2048, 8, 32, 128, 128, 128, 2048]
    - [67, 3570.0]
  - - [128, 2048, 8, 64, 128, 128, 128, 2048]
    - [67, 4726.0]
  - - [128, 2048, 8, 128, 128, 128, 128, 2048]
    - [67, 5537.0]
  - - [128, 2048, 8, 256, 128, 128, 128, 2048]
    - [71, 5918.0]
  - - [128, 2048, 8, 512, 128, 128, 128, 2048]
    - [46, 6115.0]
  - - [128, 2048, 8, 1024, 128, 128, 128, 2048]
    - [57, 6207.0]
  - - [128, 2048, 8, 2048, 128, 128, 128, 2048]
    - [41, 6262.0]
  - - [256, 32, 8, 32, 256, 256, 256, 32]
    - [124, 203.0]
  - - [256, 32, 8, 64, 256, 256, 256, 32]
    - [11, 288.0]
  - - [256, 32, 8, 128, 256, 256, 256, 32]
    - [26, 396.0]
  - - [256, 32, 8, 256, 256, 256, 256, 32]
    - [3, 488.0]
  - - [256, 32, 8, 512, 256, 256, 256, 32]
    - [12, 552.0]
  - - [256, 32, 8, 1024, 256, 256, 256, 32]
    - [5, 616.0]
  - - [256, 32, 8, 2048, 256, 256, 256, 32]
    - [5, 657.0]
  - - [256, 64, 8, 32, 256, 256, 256, 64]
    - [3, 372.0]
  - - [256, 64, 8, 64, 256, 256, 256, 64]
    - [26, 570.0]
  - - [256, 64, 8, 128, 256, 256, 256, 64]
    - [3, 800.0]
  - - [256, 64, 8, 256, 256, 256, 256, 64]
    - [67, 982.0]
  - - [256, 64, 8, 512, 256, 256, 256, 64]
    - [28, 1126.0]
  - - [256, 64, 8, 1024, 256, 256, 256, 64]
    - [19, 1245.0]
  - - [256, 64, 8, 2048, 256, 256, 256, 64]
    - [19, 1322.0]
  - - [256, 128, 8, 32, 256, 256, 256, 128]
    - [11, 738.0]
  - - [256, 128, 8, 64, 256, 256, 256, 128]
    - [27, 1140.0]
  - - [256, 128, 8, 128, 256, 256, 256, 128]
    - [15, 1601.0]
  - - [256, 128, 8, 256, 256, 256, 256, 128]
    - [53, 1997.0]
  - - [256, 128, 8, 512, 256, 256, 256, 128]
    - [17, 2249.0]
  - - [256, 128, 8, 1024, 256, 256, 256, 128]
    - [19, 2484.0]
  - - [256, 128, 8, 2048, 256, 256, 256, 128]
    - [19, 2644.0]
  - - [256, 256, 8, 32, 256, 256, 256, 256]
    - [72, 1907.0]
  - - [256, 256, 8, 64, 256, 256, 256, 256]
    - [41, 2589.0]
  - - [256, 256, 8, 128, 256, 256, 256, 256]
    - [71, 3154.0]
  - - [256, 256, 8, 256, 256, 256, 256, 256]
    - [67, 3539.0]
  - - [256, 256, 8, 512, 256, 256, 256, 256]
    - [41, 3796.0]
  - - [256, 256, 8, 1024, 256, 256, 256, 256]
    - [41, 3936.0]
  - - [256, 256, 8, 2048, 256, 256, 256, 256]
    - [60, 4002.0]
  - - [256, 512, 8, 32, 256, 256, 256, 512]
    - [44, 2741.0]
  - - [256, 512, 8, 64, 256, 256, 256, 512]
    - [45, 3745.0]
  - - [256, 512, 8, 128, 256, 256, 256, 512]
    - [68, 4335.0]
  - - [256, 512, 8, 256, 256, 256, 256, 512]
    - [71, 4726.0]
  - - [256, 512, 8, 512, 256, 256, 256, 512]
    - [41, 4934.0]
  - - [256, 512, 8, 1024, 256, 256, 256, 512]
    - [46, 5071.0]
  - - [256, 512, 8, 2048, 256, 256, 256, 512]
    - [57, 5127.0]
  - - [256, 1024, 8, 32, 256, 256, 256, 1024]
    - [67, 3290.0]
  - - [256, 1024, 8, 64, 256, 256, 256, 1024]
    - [64, 4584.0]
  - - [256, 1024, 8, 128, 256, 256, 256, 1024]
    - [44, 5465.0]
  - - [256, 1024, 8, 256, 256, 256, 256, 1024]
    - [57, 5861.0]
  - - [256, 1024, 8, 512, 256, 256, 256, 1024]
    - [57, 6104.0]
  - - [256, 1024, 8, 1024, 256, 256, 256, 1024]
    - [67, 6205.0]
  - - [256, 1024, 8, 2048, 256, 256, 256, 1024]
    - [41, 6272.0]
  - - [256, 2048, 8, 32, 256, 256, 256, 2048]
    - [62, 4014.0]
  - - [256, 2048, 8, 64, 256, 256, 256, 2048]
    - [64, 5430.0]
  - - [256, 2048, 8, 128, 256, 256, 256, 2048]
    - [53, 6214.0]
  - - [256, 2048, 8, 256, 256, 256, 256, 2048]
    - [60, 6605.0]
  - - [256, 2048, 8, 512, 256, 256, 256, 2048]
    - [62, 6794.0]
  - - [256, 2048, 8, 1024, 256, 256, 256, 2048]
    - [53, 6894.0]
  - - [256, 2048, 8, 2048, 256, 256, 256, 2048]
    - [41, 6946.0]
  - - [512, 32, 8, 32, 512, 512, 512, 32]
    - [43, 460.0]
  - - [512, 32, 8, 64, 512, 512, 512, 32]
    - [59, 624.0]
  - - [512, 32, 8, 128, 512, 512, 512, 32]
    - [32, 780.0]
  - - [512, 32, 8, 256, 512, 512, 512, 32]
    - [26, 960.0]
  - - [512, 32, 8, 512, 512, 512, 512, 32]
    - [28, 1102.0]
  - - [512, 32, 8, 1024, 512, 512, 512, 32]
    - [31, 1223.0]
  - - [512, 32, 8, 2048, 512, 512, 512, 32]
    - [19, 1309.0]
  - - [512, 64, 8, 32, 512, 512, 512, 64]
    - [16, 813.0]
  - - [512, 64, 8, 64, 512, 512, 512, 64]
    - [40, 1192.0]
  - - [512, 64, 8, 128, 512, 512, 512, 64]
    - [3, 1589.0]
  - - [512, 64, 8, 256, 512, 512, 512, 64]
    - [38, 1955.0]
  - - [512, 64, 8, 512, 512, 512, 512, 64]
    - [28, 2273.0]
  - - [512, 64, 8, 1024, 512, 512, 512, 64]
    - [19, 2475.0]
  - - [512, 64, 8, 2048, 512, 512, 512, 64]
    - [31, 2634.0]
  - - [512, 128, 8, 32, 512, 512, 512, 128]
    - [41, 1907.0]
  - - [512, 128, 8, 64, 512, 512, 512, 128]
    - [49, 2655.0]
  - - [512, 128, 8, 128, 512, 512, 512, 128]
    - [49, 3190.0]
  - - [512, 128, 8, 256, 512, 512, 512, 128]
    - [41, 3562.0]
  - - [512, 128, 8, 512, 512, 512, 512, 128]
    - [53, 3787.0]
  - - [512, 128, 8, 1024, 512, 512, 512, 128]
    - [41, 3924.0]
  - - [512, 128, 8, 2048, 512, 512, 512, 128]
    - [53, 4001.0]
  - - [512, 256, 8, 32, 512, 512, 512, 256]
    - [41, 2913.0]
  - - [512, 256, 8, 64, 512, 512, 512, 256]
    - [58, 3779.0]
  - - [512, 256, 8, 128, 512, 512, 512, 256]
    - [60, 4346.0]
  - - [512, 256, 8, 256, 512, 512, 512, 256]
    - [73, 4713.0]
  - - [512, 256, 8, 512, 512, 512, 512, 256]
    - [41, 4949.0]
  - - [512, 256, 8, 1024, 512, 512, 512, 256]
    - [57, 5069.0]
  - - [512, 256, 8, 2048, 512, 512, 512, 256]
    - [41, 5133.0]
  - - [512, 512, 8, 32, 512, 512, 512, 512]
    - [36, 3424.0]
  - - [512, 512, 8, 64, 512, 512, 512, 512]
    - [73, 4700.0]
  - - [512, 512, 8, 128, 512, 512, 512, 512]
    - [49, 5483.0]
  - - [512, 512, 8, 256, 512, 512, 512, 512]
    - [57, 5902.0]
  - - [512, 512, 8, 512, 512, 512, 512, 512]
    - [41, 6117.0]
  - - [512, 512, 8, 1024, 512, 512, 512, 512]
    - [41, 6212.0]
  - - [512, 512, 8, 2048, 512, 512, 512, 512]
    - [41, 6276.0]
  - - [512, 1024, 8, 32, 512, 512, 512, 1024]
    - [36, 4205.0]
  - - [512, 1024, 8, 64, 512, 512, 512, 1024]
    - [67, 5528.0]
  - - [512, 1024, 8, 128, 512, 512, 512, 1024]
    - [36, 6272.0]
  - - [512, 1024, 8, 256, 512, 512, 512, 1024]
    - [67, 6644.0]
  - - [512, 1024, 8, 512, 512, 512, 512, 1024]
    - [67, 6799.0]
  - - [512, 1024, 8, 1024, 512, 512, 512, 1024]
    - [57, 6906.0]
  - - [512, 1024, 8, 2048, 512, 512, 512, 1024]
    - [73, 6949.0]
  - - [512, 2048, 8, 32, 512, 512, 512, 2048]
    - [67, 4759.0]
  - - [512, 2048, 8, 64, 512, 512, 512, 2048]
    - [60, 6051.0]
  - - [512, 2048, 8, 128, 512, 512, 512, 2048]
    - [57, 6621.0]
  - - [512, 2048, 8, 256, 512, 512, 512, 2048]
    - [36, 6839.0]
  - - [512, 2048, 8, 512, 512, 512, 512, 2048]
    - [60, 6940.0]
  - - [512, 2048, 8, 1024, 512, 512, 512, 2048]
    - [53, 7001.0]
  - - [512, 2048, 8, 2048, 512, 512, 512, 2048]
    - [67, 7027.0]
  - - [1024, 32, 8, 32, 1024, 1024, 1024, 32]
    - [7, 896.0]
  - - [1024, 32, 8, 64, 1024, 1024, 1024, 32]
    - [44, 1248.0]
  - - [1024, 32, 8, 128, 1024, 1024, 1024, 32]
    - [8, 1571.0]
  - - [1024, 32, 8, 256, 1024, 1024, 1024, 32]
    - [30, 1933.0]
  - - [1024, 32, 8, 512, 1024, 1024, 1024, 32]
    - [3, 2205.0]
  - - [1024, 32, 8, 1024, 1024, 1024, 1024, 32]
    - [6, 2414.0]
  - - [1024, 32, 8, 2048, 1024, 1024, 1024, 32]
    - [6, 2542.0]
  - - [1024, 64, 8, 32, 1024, 1024, 1024, 64]
    - [44, 1942.0]
  - - [1024, 64, 8, 64, 1024, 1024, 1024, 64]
    - [57, 2621.0]
  - - [1024, 64, 8, 128, 1024, 1024, 1024, 64]
    - [41, 3166.0]
  - - [1024, 64, 8, 256, 1024, 1024, 1024, 64]
    - [57, 3554.0]
  - - [1024, 64, 8, 512, 1024, 1024, 1024, 64]
    - [44, 3783.0]
  - - [1024, 64, 8, 1024, 1024, 1024, 1024, 64]
    - [53, 3924.0]
  - - [1024, 64, 8, 2048, 1024, 1024, 1024, 64]
    - [46, 3999.0]
  - - [1024, 128, 8, 32, 1024, 1024, 1024, 128]
    - [44, 2893.0]
  - - [1024, 128, 8, 64, 1024, 1024, 1024, 128]
    - [47, 3745.0]
  - - [1024, 128, 8, 128, 1024, 1024, 1024, 128]
    - [64, 4346.0]
  - - [1024, 128, 8, 256, 1024, 1024, 1024, 128]
    - [62, 4726.0]
  - - [1024, 128, 8, 512, 1024, 1024, 1024, 128]
    - [57, 4931.0]
  - - [1024, 128, 8, 1024, 1024, 1024, 1024, 128]
    - [41, 5063.0]
  - - [1024, 128, 8, 2048, 1024, 1024, 1024, 128]
    - [62, 5122.0]
  - - [1024, 256, 8, 32, 1024, 1024, 1024, 256]
    - [53, 3495.0]
  - - [1024, 256, 8, 64, 1024, 1024, 1024, 256]
    - [67, 4739.0]
  - - [1024, 256, 8, 128, 1024, 1024, 1024, 256]
    - [53, 5465.0]
  - - [1024, 256, 8, 256, 1024, 1024, 1024, 256]
    - [46, 5907.0]
  - - [1024, 256, 8, 512, 1024, 1024, 1024, 256]
    - [36, 6104.0]
  - - [1024, 256, 8, 1024, 1024, 1024, 1024, 256]
    - [53, 6209.0]
  - - [1024, 256, 8, 2048, 1024, 1024, 1024, 256]
    - [67, 6260.0]
  - - [1024, 512, 8, 32, 1024, 1024, 1024, 512]
    - [62, 4163.0]
  - - [1024, 512, 8, 64, 1024, 1024, 1024, 512]
    - [49, 5537.0]
  - - [1024, 512, 8, 128, 1024, 1024, 1024, 512]
    - [67, 6266.0]
  - - [1024, 512, 8, 256, 1024, 1024, 1024, 512]
    - [64, 6638.0]
  - - [1024, 512, 8, 512, 1024, 1024, 1024, 512]
    - [64, 6799.0]
  - - [1024, 512, 8, 1024, 1024, 1024, 1024, 512]
    - [62, 6898.0]
  - - [1024, 512, 8, 2048, 1024, 1024, 1024, 512]
    - [62, 6949.0]
  - - [1024, 1024, 8, 32, 1024, 1024, 1024, 1024]
    - [46, 4706.0]
  - - [1024, 1024, 8, 64, 1024, 1024, 1024, 1024]
    - [36, 5944.0]
  - - [1024, 1024, 8, 128, 1024, 1024, 1024, 1024]
    - [49, 6583.0]
  - - [1024, 1024, 8, 256, 1024, 1024, 1024, 1024]
    - [49, 6837.0]
  - - [1024, 1024, 8, 512, 1024, 1024, 1024, 1024]
    - [64, 6947.0]
  - - [1024, 1024, 8, 1024, 1024, 1024, 1024, 1024]
    - [36, 6995.0]
  - - [1024, 1024, 8, 2048, 1024, 1024, 1024, 1024]
    - [46, 7022.0]
  - - [1024, 2048, 8, 32, 1024, 1024, 1024, 2048]
    - [67, 5080.0]
  - - [1024, 2048, 8, 64, 1024, 1024, 1024, 2048]
    - [64, 6361.0]
  - - [1024, 2048, 8, 128, 1024, 1024, 1024, 2048]
    - [64, 6899.0]
  - - [1024, 2048, 8, 256, 1024, 1024, 1024, 2048]
    - [53, 7095.0]
  - - [1024, 2048, 8, 512, 1024, 1024, 1024, 2048]
    - [75, 7188.0]
  - - [1024, 2048, 8, 1024, 1024, 1024, 1024, 2048]
    - [46, 7238.0]
  - - [1024, 2048, 8, 2048, 1024, 1024, 1024, 2048]
    - [125, 7304.0]
  - - [2048, 32, 8, 32, 2048, 2048, 2048, 32]
    - [48, 1808.0]
  - - [2048, 32, 8, 64, 2048, 2048, 2048, 32]
    - [38, 2439.0]
  - - [2048, 32, 8, 128, 2048, 2048, 2048, 32]
    - [69, 2893.0]
  - - [2048, 32, 8, 256, 2048, 2048, 2048, 32]
    - [51, 3270.0]
  - - [2048, 32, 8, 512, 2048, 2048, 2048, 32]
    - [3, 3474.0]
  - - [2048, 32, 8, 1024, 2048, 2048, 2048, 32]
    - [65, 3575.0]
  - - [2048, 32, 8, 2048, 2048, 2048, 2048, 32]
    - [38, 3630.0]
  - - [2048, 64, 8, 32, 2048, 2048, 2048, 64]
    - [34, 2759.0]
  - - [2048, 64, 8, 64, 2048, 2048, 2048, 64]
    - [50, 3695.0]
  - - [2048, 64, 8, 128, 2048, 2048, 2048, 64]
    - [68, 4324.0]
  - - [2048, 64, 8, 256, 2048, 2048, 2048, 64]
    - [49, 4706.0]
  - - [2048, 64, 8, 512, 2048, 2048, 2048, 64]
    - [62, 4924.0]
  - - [2048, 64, 8, 1024, 2048, 2048, 2048, 64]
    - [60, 5051.0]
  - - [2048, 64, 8, 2048, 2048, 2048, 2048, 64]
    - [60, 5121.0]
  - - [2048, 128, 8, 32, 2048, 2048, 2048, 128]
    - [60, 3452.0]
  - - [2048, 128, 8, 64, 2048, 2048, 2048, 128]
    - [67, 4739.0]
  - - [2048, 128, 8, 128, 2048, 2048, 2048, 128]
    - [71, 5474.0]
  - - [2048, 128, 8, 256, 2048, 2048, 2048, 128]
    - [53, 5907.0]
  - - [2048, 128, 8, 512, 2048, 2048, 2048, 128]
    - [60, 6095.0]
  - - [2048, 128, 8, 1024, 2048, 2048, 2048, 128]
    - [41, 6195.0]
  - - [2048, 128, 8, 2048, 2048, 2048, 2048, 128]
    - [73, 6262.0]
  - - [2048, 256, 8, 32, 2048, 2048, 2048, 256]
    - [67, 4215.0]
  - - [2048, 256, 8, 64, 2048, 2048, 2048, 256]
    - [53, 5565.0]
  - - [2048, 256, 8, 128, 2048, 2048, 2048, 256]
    - [67, 6289.0]
  - - [2048, 256, 8, 256, 2048, 2048, 2048, 256]
    - [60, 6648.0]
  - - [2048, 256, 8, 512, 2048, 2048, 2048, 256]
    - [75, 6811.0]
  - - [2048, 256, 8, 1024, 2048, 2048, 2048, 256]
    - [67, 6901.0]
  - - [2048, 256, 8, 2048, 2048, 2048, 2048, 256]
    - [60, 6949.0]
  - - [2048, 512, 8, 32, 2048, 2048, 2048, 512]
    - [36, 4793.0]
  - - [2048, 512, 8, 64, 2048, 2048, 2048, 512]
    - [49, 6008.0]
  - - [2048, 512, 8, 128, 2048, 2048, 2048, 512]
    - [73, 6621.0]
  - - [2048, 512, 8, 256, 2048, 2048, 2048, 512]
    - [75, 6846.0]
  - - [2048, 512, 8, 512, 2048, 2048, 2048, 512]
    - [64, 6950.0]
  - - [2048, 512, 8, 1024, 2048, 2048, 2048, 512]
    - [57, 7001.0]
  - - [2048, 512, 8, 2048, 2048, 2048, 2048, 512]
    - [53, 7027.0]
  - - [2048, 1024, 8, 32, 2048, 2048, 2048, 1024]
    - [58, 4978.0]
  - - [2048, 1024, 8, 64, 2048, 2048, 2048, 1024]
    - [67, 6301.0]
  - - [2048, 1024, 8, 128, 2048, 2048, 2048, 1024]
    - [60, 6885.0]
  - - [2048, 1024, 8, 256, 2048, 2048, 2048, 1024]
    - [62, 7103.0]
  - - [2048, 1024, 8, 512, 2048, 2048, 2048, 1024]
    - [44, 7196.0]
  - - [2048, 1024, 8, 1024, 2048, 2048, 2048, 1024]
    - [57, 7240.0]
  - - [2048, 1024, 8, 2048, 2048, 2048, 2048, 1024]
    - [123, 7301.0]
  - - [2048, 2048, 8, 32, 2048, 2048, 2048, 2048]
    - [68, 5284.0]
  - - [2048, 2048, 8, 64, 2048, 2048, 2048, 2048]
    - [45, 6530.0]
  - - [2048, 2048, 8, 128, 2048, 2048, 2048, 2048]
    - [49, 7074.0]
  - - [2048, 2048, 8, 256, 2048, 2048, 2048, 2048]
    - [41, 7246.0]
  - - [2048, 2048, 8, 512, 2048, 2048, 2048, 2048]
    - [60, 7328.0]
  - - [2048, 2048, 8, 1024, 2048, 2048, 2048, 2048]
    - [53, 7368.0]
  - - [2048, 2048, 8, 2048, 2048, 2048, 2048, 2048]
    - [64, 7385.0]
- null
