library/src/blas3/Tensile/Logic/asm_full/arcturus/arcturus_Cijk_Ailk_Bljk_CB_GB.yaml
- {MinimumRequiredVersion: 4.26.0}
- arcturus
- gfx908
- [Device 7380, Device 7388, Device 738c, Device 7390]
    SolutionIndex: 0
    SolutionNameMin: Cijk_Ailk_Bljk_CB_GB_MT32x32x16_MI16x16x4x1_SN_1LDSB0_EPS1_GRVW1_LBSPP128_LPB4_NLCA1_PGR1_PLR5_SRVW1_TT1_16_WG32_8_1_WGM1
    SolutionIndex: 1
    SolutionNameMin: Cijk_Ailk_Bljk_CB_GB_MT32x32x16_MI16x16x4x1_SN_1LDSB0_EPS0_GRVW1_LBSPP128_LPB4_NLCA1_PGR2_PLR5_SRVW1_TT1_16_WG32_8_1_WGM1
    SolutionIndex: 2
    SolutionNameMin: Cijk_Ailk_Bljk_CB_GB_MT32x32x32_MI16x16x4x1_SN_1LDSB0_EPS0_GRVW1_LBSPP256_LPB4_NLCA1_PGR2_PLR9_SRVW1_TT1_16_WG32_8_1_WGM1
    SolutionIndex: 3
    SolutionNameMin: Cijk_Ailk_Bljk_CB_GB_MT32x32x16_MI16x16x4x1_SN_1LDSB0_EPS1_GRVW2_LBSPP128_LPB4_NLCA1_PGR1_PLR5_SRVW1_TT1_16_WG32_8_1_WGM1
    SolutionIndex: 4
    SolutionNameMin: Cijk_Ailk_Bljk_CB_GB_MT64x32x16_MI16x16x4x1_SN_1LDSB0_EPS1_GRVW2_LBSPP128_LPB4_NLCA1_PGR1_PLR5_SRVW1_TT2_16_WG32_8_1_WGM1
    SolutionIndex: 5
    SolutionNameMin: Cijk_Ailk_Bljk_CB_GB_MT32x32x16_MI16x16x4x1_SN_1LDSB0_EPS0_GRVW2_LBSPP128_LPB4_NLCA1_PGR2_PLR5_SRVW1_TT1_16_WG32_8_1_WGM1
    SolutionIndex: 6
    SolutionNameMin: Cijk_Ailk_Bljk_CB_GB_MT64x32x16_MI16x16x4x1_SN_1LDSB0_EPS0_GRVW2_LBSPP128_LPB4_NLCA1_PGR2_PLR5_SRVW1_TT2_16_WG32_8_1_WGM1
    SolutionIndex: 7
    SolutionNameMin: Cijk_Ailk_Bljk_CB_GB_MT32x32x32_MI16x16x4x1_SN_1LDSB0_EPS1_GRVW2_LBSPP256_LPB4_NLCA1_PGR1_PLR9_SRVW1_TT1_16_WG32_8_1_WGM1
    SolutionIndex: 8
    SolutionNameMin: Cijk_Ailk_Bljk_CB_GB_MT32x32x32_MI16x16x4x1_SN_1LDSB0_EPS0_GRVW2_LBSPP256_LPB4_NLCA1_PGR2_PLR9_SRVW1_TT1_16_WG32_8_1_WGM1
    SolutionIndex: 9
    SolutionNameMin: Cijk_Ailk_Bljk_CB_GB_MT32x32x16_MI16x16x4x1_SN_1LDSB0_EPS0_GRVW1_LBSPP128_LPB4_NLCA1_PGR2_PLR5_SRVW1_TT1_16_WG32_8_1_WGM2
    SolutionIndex: 10
    SolutionNameMin: Cijk_Ailk_Bljk_CB_GB_MT32x32x16_MI16x16x4x1_SN_1LDSB0_EPS1_GRVW2_LBSPP128_LPB4_NLCA1_PGR1_PLR5_SRVW1_TT1_16_WG32_8_1_WGM2
    SolutionIndex: 11
    SolutionNameMin: Cijk_Ailk_Bljk_CB_GB_MT32x32x16_MI16x16x4x1_SN_1LDSB0_EPS0_GRVW2_LBSPP128_LPB4_NLCA1_PGR2_PLR5_SRVW1_TT1_16_WG32_8_1_WGM2
    SolutionIndex: 12
    SolutionNameMin: Cijk_Ailk_Bljk_CB_GB_MT32x32x32_MI16x16x4x1_SN_1LDSB0_EPS1_GRVW2_LBSPP256_LPB4_NLCA1_PGR1_PLR9_SRVW1_TT1_16_WG32_8_1_WGM2
    SolutionIndex: 13
    SolutionNameMin: Cijk_Ailk_Bljk_CB_GB_MT32x32x16_MI16x16x4x1_SN_1LDSB0_EPS1_GRVW2_LBSPP128_LPB4_NLCA1_PGR1_PLR5_SRVW1_TT1_16_WG32_8_1_WGM15
    SolutionIndex: 14
    SolutionNameMin: Cijk_Ailk_Bljk_CB_GB_MT32x32x16_MI16x16x4x1_SN_1LDSB0_EPS0_GRVW2_LBSPP128_LPB4_NLCA1_PGR2_PLR5_SRVW1_TT1_16_WG32_8_1_WGM15
    SolutionIndex: 15
    SolutionNameMin: Cijk_Ailk_Bljk_CB_GB_MT64x32x16_MI16x16x4x1_SN_1LDSB0_EPS0_GRVW2_LBSPP128_LPB4_NLCA1_PGR2_PLR5_SRVW1_TT2_16_WG32_8_1_WGM15
    SolutionIndex: 16
    SolutionNameMin: Cijk_Ailk_Bljk_CB_GB_MT32x32x32_MI16x16x4x1_SN_1LDSB0_EPS1_GRVW2_LBSPP256_LPB4_NLCA1_PGR1_PLR9_SRVW1_TT1_16_WG32_8_1_WGM15
    SolutionIndex: 17
    SolutionNameMin: Cijk_Ailk_Bljk_CB_GB_MT32x64x16_MI16x16x4x1_SN_1LDSB1_EPS1_GRVW2_LBSPP128_LPB4_NLCA1_PGR1_PLR5_SRVW1_TT1_32_WG32_8_1_WGM1
    SolutionIndex: 18
    SolutionNameMin: Cijk_Ailk_Bljk_CB_GB_MT64x32x16_MI16x16x4x1_SN_1LDSB1_EPS1_GRVW2_LBSPP128_LPB4_NLCA1_PGR1_PLR5_SRVW1_TT2_16_WG32_8_1_WGM1
    SolutionIndex: 19
    SolutionNameMin: Cijk_Ailk_Bljk_CB_GB_MT32x64x16_MI16x16x4x1_SN_1LDSB1_EPS0_GRVW2_LBSPP128_LPB4_NLCA1_PGR2_PLR5_SRVW1_TT1_32_WG32_8_1_WGM1
    SolutionIndex: 20
    SolutionNameMin: Cijk_Ailk_Bljk_CB_GB_MT64x32x16_MI16x16x4x1_SN_1LDSB1_EPS0_GRVW2_LBSPP128_LPB4_NLCA1_PGR2_PLR5_SRVW1_TT2_16_WG32_8_1_WGM1
    SolutionIndex: 21
    SolutionNameMin: Cijk_Ailk_Bljk_CB_GB_MT32x64x16_MI16x16x4x1_SN_1LDSB1_EPS1_GRVW2_LBSPP128_LPB4_NLCA1_PGR1_PLR5_SRVW1_TT1_32_WG32_8_1_WGM2
    SolutionIndex: 22
    SolutionNameMin: Cijk_Ailk_Bljk_CB_GB_MT64x32x16_MI16x16x4x1_SN_1LDSB1_EPS1_GRVW2_LBSPP128_LPB4_NLCA1_PGR1_PLR5_SRVW1_TT2_16_WG32_8_1_WGM2
    SolutionIndex: 23
    SolutionNameMin: Cijk_Ailk_Bljk_CB_GB_MT64x32x16_MI16x16x4x1_SN_1LDSB1_EPS0_GRVW2_LBSPP128_LPB4_NLCA1_PGR2_PLR5_SRVW1_TT2_16_WG32_8_1_WGM2
    SolutionIndex: 24
    SolutionNameMin: Cijk_Ailk_Bljk_CB_GB_MT32x64x16_MI16x16x4x1_SN_1LDSB1_EPS1_GRVW2_LBSPP128_LPB4_NLCA1_PGR1_PLR5_SRVW1_TT1_32_WG32_8_1_WGM15
    SolutionIndex: 25
    SolutionNameMin: Cijk_Ailk_Bljk_CB_GB_MT64x32x16_MI16x16x4x1_SN_1LDSB1_EPS1_GRVW2_LBSPP128_LPB4_NLCA1_PGR1_PLR5_SRVW1_TT2_16_WG32_8_1_WGM15
    SolutionIndex: 26
    SolutionNameMin: Cijk_Ailk_Bljk_CB_GB_MT64x32x16_MI16x16x4x1_SN_1LDSB1_EPS0_GRVW2_LBSPP128_LPB4_NLCA1_PGR2_PLR5_SRVW1_TT2_16_WG32_8_1_WGM15
    SolutionIndex: 27
    SolutionNameMin: Cijk_Ailk_Bljk_CB_GB_MT32x32x8_MI32x32x2x1_SN_1LDSB0_EPS1_GRVW1_LBSPP128_LPB2_NLCA1_PGR1_PLR5_SRVW1_TT1_32_WG32_2_1_WGM1
    SolutionIndex: 28
    SolutionNameMin: Cijk_Ailk_Bljk_CB_GB_MT32x32x8_MI32x32x2x1_SN_1LDSB0_EPS0_GRVW1_LBSPP128_LPB2_NLCA1_PGR2_PLR5_SRVW1_TT1_32_WG32_2_1_WGM1
    SolutionIndex: 29
    SolutionNameMin: Cijk_Ailk_Bljk_CB_GB_MT16x16x16_MI16x16x4x1_SN_1LDSB0_EPS1_GRVW1_LBSPP128_LPB4_NLCA1_PGR1_PLR5_SRVW1_TT1_16_WG16_4_1_WGM1
    SolutionIndex: 30
    SolutionNameMin: Cijk_Ailk_Bljk_CB_GB_MT16x16x16_MI16x16x4x1_SN_1LDSB0_EPS0_GRVW1_LBSPP128_LPB4_NLCA1_PGR2_PLR5_SRVW1_TT1_16_WG16_4_1_WGM1
    SolutionIndex: 31
    SolutionNameMin: Cijk_Ailk_Bljk_CB_GB_MT32x32x8_MI32x32x2x1_SN_1LDSB0_EPS1_GRVW2_LBSPP128_LPB2_NLCA1_PGR1_PLR5_SRVW1_TT1_32_WG32_2_1_WGM1
    SolutionIndex: 32
    SolutionNameMin: Cijk_Ailk_Bljk_CB_GB_MT32x32x8_MI32x32x2x1_SN_1LDSB0_EPS0_GRVW2_LBSPP128_LPB2_NLCA1_PGR2_PLR5_SRVW1_TT1_32_WG32_2_1_WGM1
    SolutionIndex: 33
    SolutionNameMin: Cijk_Ailk_Bljk_CB_GB_MT32x32x8_MI32x32x2x1_SN_1LDSB0_EPS1_GRVW1_LBSPP128_LPB2_NLCA1_PGR1_PLR5_SRVW1_TT1_32_WG32_2_1_WGM2
    SolutionIndex: 34
    SolutionNameMin: Cijk_Ailk_Bljk_CB_GB_MT16x16x16_MI16x16x4x1_SN_1LDSB0_EPS1_GRVW1_LBSPP128_LPB4_NLCA1_PGR1_PLR5_SRVW1_TT1_16_WG16_4_1_WGM2
    SolutionIndex: 35
    SolutionNameMin: Cijk_Ailk_Bljk_CB_GB_MT16x16x16_MI16x16x4x1_SN_1LDSB0_EPS0_GRVW1_LBSPP128_LPB4_NLCA1_PGR2_PLR5_SRVW1_TT1_16_WG16_4_1_WGM2
    SolutionIndex: 36
    SolutionNameMin: Cijk_Ailk_Bljk_CB_GB_MT32x32x8_MI32x32x2x1_SN_1LDSB0_EPS1_GRVW2_LBSPP128_LPB2_NLCA1_PGR1_PLR5_SRVW1_TT1_32_WG32_2_1_WGM2
    SolutionIndex: 37
    SolutionNameMin: Cijk_Ailk_Bljk_CB_GB_MT32x32x8_MI32x32x2x1_SN_1LDSB0_EPS0_GRVW2_LBSPP128_LPB2_NLCA1_PGR2_PLR5_SRVW1_TT1_32_WG32_2_1_WGM2
    SolutionIndex: 38
    SolutionNameMin: Cijk_Ailk_Bljk_CB_GB_MT32x32x8_MI32x32x2x1_SN_1LDSB0_EPS1_GRVW1_LBSPP128_LPB2_NLCA1_PGR1_PLR5_SRVW1_TT1_32_WG32_2_1_WGM15
    SolutionIndex: 39
    SolutionNameMin: Cijk_Ailk_Bljk_CB_GB_MT32x32x8_MI32x32x2x1_SN_1LDSB0_EPS0_GRVW1_LBSPP128_LPB2_NLCA1_PGR2_PLR5_SRVW1_TT1_32_WG32_2_1_WGM15
    SolutionIndex: 40
    SolutionNameMin: Cijk_Ailk_Bljk_CB_GB_MT16x16x16_MI16x16x4x1_SN_1LDSB0_EPS1_GRVW1_LBSPP128_LPB4_NLCA1_PGR1_PLR5_SRVW1_TT1_16_WG16_4_1_WGM15
    SolutionIndex: 41
    SolutionNameMin: Cijk_Ailk_Bljk_CB_GB_MT96x96x16_MI16x16x4x1_SN_1LDSB1_EPS1_GRVW1_LBSPP128_LPB4_NLCA3_PGR1_PLR5_SRVW0_TT3_48_WG32_8_1_WGM1
    SolutionIndex: 42
    SolutionNameMin: Cijk_Ailk_Bljk_CB_GB_MT96x96x16_MI16x16x4x1_SN_1LDSB1_EPS1_GRVW2_LBSPP128_LPB4_NLCA3_PGR1_PLR5_SRVW0_TT3_48_WG32_8_1_WGM1
    SolutionIndex: 43
    SolutionNameMin: Cijk_Ailk_Bljk_CB_GB_MT96x96x16_MI16x16x4x1_SN_1LDSB1_EPS0_GRVW2_LBSPP128_LPB4_NLCA3_PGR2_PLR5_SRVW0_TT3_48_WG32_8_1_WGM1
    SolutionIndex: 44
    SolutionNameMin: Cijk_Ailk_Bljk_CB_GB_MT96x96x16_MI16x16x4x1_SN_1LDSB1_EPS0_GRVW1_LBSPP128_LPB4_NLCA3_PGR2_PLR5_SRVW0_TT3_48_WG32_8_1_WGM2
    SolutionIndex: 45
    SolutionNameMin: Cijk_Ailk_Bljk_CB_GB_MT96x96x16_MI16x16x4x1_SN_1LDSB1_EPS1_GRVW2_LBSPP128_LPB4_NLCA3_PGR1_PLR5_SRVW0_TT3_48_WG32_8_1_WGM2
    SolutionIndex: 46
    SolutionNameMin: Cijk_Ailk_Bljk_CB_GB_MT96x96x16_MI16x16x4x1_SN_1LDSB1_EPS0_GRVW2_LBSPP128_LPB4_NLCA3_PGR2_PLR5_SRVW0_TT3_48_WG32_8_1_WGM2
    SolutionIndex: 47
    SolutionNameMin: Cijk_Ailk_Bljk_CB_GB_MT96x96x16_MI16x16x4x1_SN_1LDSB1_EPS1_GRVW2_LBSPP128_LPB4_NLCA3_PGR1_PLR5_SRVW0_TT3_48_WG32_8_1_WGM15
- - - [192, 192, 1000, 32, 192, 192, 192, 32]
    - [24, 4792.0]
  - - [1536, 1536, 168, 32, 1536, 1536, 1536, 32]
    - [21, 4936.0]
  - - [1536, 32, 168, 1536, 1536, 1536, 1536, 1536]
    - [15, 6544.0]
  - - [32, 1536, 168, 32, 32, 32, 32, 32]
    - [19, 3430.0]
  - - [384, 384, 1024, 384, 384, 384, 384, 384]
    - [17, 7797.0]
  - - [1, 1, 1000, 1, 1, 1, 1, 1]
    - [27, 0.0]
  - - [2, 2, 1000, 2, 2, 2, 2, 2]
    - [27, 1.0]
  - - [3, 3, 1000, 3, 3, 3, 3, 3]
    - [29, 5.0]
  - - [4, 4, 1000, 4, 4, 4, 4, 4]
    - [29, 11.0]
  - - [5, 5, 1000, 5, 5, 5, 5, 5]
    - [29, 20.0]
  - - [6, 6, 1000, 6, 6, 6, 6, 6]
    - [30, 35.0]
  - - [7, 7, 1000, 7, 7, 7, 7, 7]
    - [29, 52.0]
  - - [8, 8, 1000, 8, 8, 8, 8, 8]
    - [29, 80.0]
  - - [9, 9, 1000, 9, 9, 9, 9, 9]
    - [30, 106.0]
  - - [10, 10, 1000, 10, 10, 10, 10, 10]
    - [40, 142.0]
  - - [11, 11, 1000, 11, 11, 11, 11, 11]
    - [40, 187.0]
  - - [12, 12, 1000, 12, 12, 12, 12, 12]
    - [34, 243.0]
  - - [13, 13, 1000, 13, 13, 13, 13, 13]
    - [30, 289.0]
  - - [14, 14, 1000, 14, 14, 14, 14, 14]
    - [40, 361.0]
  - - [15, 15, 1000, 15, 15, 15, 15, 15]
    - [29, 435.0]
  - - [16, 16, 1000, 16, 16, 16, 16, 16]
    - [35, 602.0]
  - - [17, 17, 1000, 17, 17, 17, 17, 17]
    - [28, 366.0]
  - - [18, 18, 1000, 18, 18, 18, 18, 18]
    - [32, 429.0]
  - - [19, 19, 1000, 19, 19, 19, 19, 19]
    - [37, 471.0]
  - - [20, 20, 1000, 20, 20, 20, 20, 20]
    - [33, 549.0]
  - - [21, 21, 1000, 21, 21, 21, 21, 21]
    - [39, 609.0]
  - - [22, 22, 1000, 22, 22, 22, 22, 22]
    - [32, 697.0]
  - - [23, 23, 1000, 23, 23, 23, 23, 23]
    - [32, 749.0]
  - - [24, 24, 1000, 24, 24, 24, 24, 24]
    - [38, 944.0]
  - - [25, 25, 1000, 25, 25, 25, 25, 25]
    - [33, 908.0]
  - - [26, 26, 1000, 26, 26, 26, 26, 26]
    - [27, 999.0]
  - - [27, 27, 1000, 27, 27, 27, 27, 27]
    - [27, 1070.0]
  - - [28, 28, 1000, 28, 28, 28, 28, 28]
    - [36, 1198.0]
  - - [29, 29, 1000, 29, 29, 29, 29, 29]
    - [27, 1239.0]
  - - [30, 30, 1000, 30, 30, 30, 30, 30]
    - [31, 1355.0]
  - - [31, 31, 1000, 31, 31, 31, 31, 31]
    - [27, 1416.0]
  - - [32, 32, 1000, 32, 32, 32, 32, 32]
    - [5, 1773.0]
  - - [33, 33, 1000, 33, 33, 33, 33, 33]
    - [18, 919.0]
  - - [34, 34, 1000, 34, 34, 34, 34, 34]
    - [18, 1021.0]
  - - [35, 35, 1000, 35, 35, 35, 35, 35]
    - [18, 1089.0]
  - - [36, 36, 1000, 36, 36, 36, 36, 36]
    - [20, 1210.0]
  - - [37, 37, 1000, 37, 37, 37, 37, 37]
    - [18, 1204.0]
  - - [38, 38, 1000, 38, 38, 38, 38, 38]
    - [18, 1324.0]
  - - [39, 39, 1000, 39, 39, 39, 39, 39]
    - [23, 1399.0]
  - - [40, 40, 1000, 40, 40, 40, 40, 40]
    - [18, 1518.0]
  - - [41, 41, 1000, 41, 41, 41, 41, 41]
    - [22, 1501.0]
  - - [42, 42, 1000, 42, 42, 42, 42, 42]
    - [23, 1642.0]
  - - [43, 43, 1000, 43, 43, 43, 43, 43]
    - [23, 1714.0]
  - - [44, 44, 1000, 44, 44, 44, 44, 44]
    - [23, 1871.0]
  - - [45, 45, 1000, 45, 45, 45, 45, 45]
    - [25, 1837.0]
  - - [46, 46, 1000, 46, 46, 46, 46, 46]
    - [18, 2001.0]
  - - [47, 47, 1000, 47, 47, 47, 47, 47]
    - [25, 2080.0]
  - - [48, 48, 1000, 48, 48, 48, 48, 48]
    - [23, 2664.0]
  - - [49, 49, 1000, 49, 49, 49, 49, 49]
    - [20, 2439.0]
  - - [50, 50, 1000, 50, 50, 50, 50, 50]
    - [20, 2613.0]
  - - [51, 51, 1000, 51, 51, 51, 51, 51]
    - [18, 2692.0]
  - - [52, 52, 1000, 52, 52, 52, 52, 52]
    - [20, 2900.0]
  - - [53, 53, 1000, 53, 53, 53, 53, 53]
    - [20, 2833.0]
  - - [54, 54, 1000, 54, 54, 54, 54, 54]
    - [18, 3005.0]
  - - [55, 55, 1000, 55, 55, 55, 55, 55]
    - [22, 3095.0]
  - - [56, 56, 1000, 56, 56, 56, 56, 56]
    - [20, 3336.0]
  - - [57, 57, 1000, 57, 57, 57, 57, 57]
    - [22, 3279.0]
  - - [58, 58, 1000, 58, 58, 58, 58, 58]
    - [18, 3430.0]
  - - [59, 59, 1000, 59, 59, 59, 59, 59]
    - [18, 3576.0]
  - - [60, 60, 1000, 60, 60, 60, 60, 60]
    - [18, 3709.0]
  - - [61, 61, 1000, 61, 61, 61, 61, 61]
    - [25, 3733.0]
  - - [62, 62, 1000, 62, 62, 62, 62, 62]
    - [18, 3894.0]
  - - [63, 63, 1000, 63, 63, 63, 63, 63]
    - [22, 3992.0]
  - - [64, 64, 1000, 64, 64, 64, 64, 64]
    - [18, 4495.0]
  - - [65, 65, 1000, 65, 65, 65, 65, 65]
    - [47, 2077.0]
  - - [66, 66, 1000, 66, 66, 66, 66, 66]
    - [45, 2173.0]
  - - [67, 67, 1000, 67, 67, 67, 67, 67]
    - [45, 2253.0]
  - - [68, 68, 1000, 68, 68, 68, 68, 68]
    - [42, 2348.0]
  - - [69, 69, 1000, 69, 69, 69, 69, 69]
    - [45, 2291.0]
  - - [70, 70, 1000, 70, 70, 70, 70, 70]
    - [45, 2413.0]
  - - [71, 71, 1000, 71, 71, 71, 71, 71]
    - [45, 2441.0]
  - - [72, 72, 1000, 72, 72, 72, 72, 72]
    - [47, 2759.0]
  - - [73, 73, 1000, 73, 73, 73, 73, 73]
    - [42, 2467.0]
  - - [74, 74, 1000, 74, 74, 74, 74, 74]
    - [47, 2549.0]
  - - [75, 75, 1000, 75, 75, 75, 75, 75]
    - [42, 2671.0]
  - - [76, 76, 1000, 76, 76, 76, 76, 76]
    - [47, 2787.0]
  - - [77, 77, 1000, 77, 77, 77, 77, 77]
    - [43, 2825.0]
  - - [78, 78, 1000, 78, 78, 78, 78, 78]
    - [43, 2863.0]
  - - [79, 79, 1000, 79, 79, 79, 79, 79]
    - [44, 2987.0]
  - - [80, 80, 1000, 80, 80, 80, 80, 80]
    - [41, 3252.0]
  - - [81, 81, 1000, 81, 81, 81, 81, 81]
    - [44, 3061.0]
  - - [82, 82, 1000, 82, 82, 82, 82, 82]
    - [46, 3116.0]
  - - [83, 83, 1000, 83, 83, 83, 83, 83]
    - [44, 3199.0]
  - - [84, 84, 1000, 84, 84, 84, 84, 84]
    - [23, 3330.0]
  - - [85, 85, 1000, 85, 85, 85, 85, 85]
    - [23, 3313.0]
  - - [86, 86, 1000, 86, 86, 86, 86, 86]
    - [23, 3427.0]
  - - [87, 87, 1000, 87, 87, 87, 87, 87]
    - [23, 3533.0]
  - - [88, 88, 1000, 88, 88, 88, 88, 88]
    - [46, 3916.0]
  - - [89, 89, 1000, 89, 89, 89, 89, 89]
    - [26, 3652.0]
  - - [90, 90, 1000, 90, 90, 90, 90, 90]
    - [26, 3794.0]
  - - [91, 91, 1000, 91, 91, 91, 91, 91]
    - [22, 3886.0]
  - - [92, 92, 1000, 92, 92, 92, 92, 92]
    - [23, 4051.0]
  - - [93, 93, 1000, 93, 93, 93, 93, 93]
    - [23, 3999.0]
  - - [94, 94, 1000, 94, 94, 94, 94, 94]
    - [22, 4138.0]
  - - [95, 95, 1000, 95, 95, 95, 95, 95]
    - [23, 4228.0]
  - - [96, 96, 1000, 96, 96, 96, 96, 96]
    - [46, 5197.0]
  - - [97, 97, 1000, 97, 97, 97, 97, 97]
    - [22, 3413.0]
  - - [98, 98, 1000, 98, 98, 98, 98, 98]
    - [22, 3526.0]
  - - [99, 99, 1000, 99, 99, 99, 99, 99]
    - [22, 3624.0]
  - - [100, 100, 1000, 100, 100, 100, 100, 100]
    - [22, 3772.0]
  - - [101, 101, 1000, 101, 101, 101, 101, 101]
    - [22, 3695.0]
  - - [102, 102, 1000, 102, 102, 102, 102, 102]
    - [22, 3824.0]
  - - [103, 103, 1000, 103, 103, 103, 103, 103]
    - [22, 3891.0]
  - - [104, 104, 1000, 104, 104, 104, 104, 104]
    - [22, 4108.0]
  - - [105, 105, 1000, 105, 105, 105, 105, 105]
    - [22, 4020.0]
  - - [106, 106, 1000, 106, 106, 106, 106, 106]
    - [22, 4150.0]
  - - [107, 107, 1000, 107, 107, 107, 107, 107]
    - [22, 4230.0]
  - - [108, 108, 1000, 108, 108, 108, 108, 108]
    - [22, 4410.0]
  - - [109, 109, 1000, 109, 109, 109, 109, 109]
    - [22, 4360.0]
  - - [110, 110, 1000, 110, 110, 110, 110, 110]
    - [22, 4500.0]
  - - [111, 111, 1000, 111, 111, 111, 111, 111]
    - [22, 4572.0]
  - - [112, 112, 1000, 112, 112, 112, 112, 112]
    - [18, 5058.0]
  - - [113, 113, 1000, 113, 113, 113, 113, 113]
    - [22, 4643.0]
  - - [114, 114, 1000, 114, 114, 114, 114, 114]
    - [22, 4784.0]
  - - [115, 115, 1000, 115, 115, 115, 115, 115]
    - [22, 4872.0]
  - - [116, 116, 1000, 116, 116, 116, 116, 116]
    - [22, 5053.0]
  - - [117, 117, 1000, 117, 117, 117, 117, 117]
    - [22, 4984.0]
  - - [118, 118, 1000, 118, 118, 118, 118, 118]
    - [22, 5134.0]
  - - [119, 119, 1000, 119, 119, 119, 119, 119]
    - [22, 5213.0]
  - - [120, 120, 1000, 120, 120, 120, 120, 120]
    - [18, 5519.0]
  - - [121, 121, 1000, 121, 121, 121, 121, 121]
    - [18, 5350.0]
  - - [122, 122, 1000, 122, 122, 122, 122, 122]
    - [18, 5491.0]
  - - [123, 123, 1000, 123, 123, 123, 123, 123]
    - [18, 5557.0]
  - - [124, 124, 1000, 124, 124, 124, 124, 124]
    - [18, 5773.0]
  - - [125, 125, 1000, 125, 125, 125, 125, 125]
    - [18, 5641.0]
  - - [126, 126, 1000, 126, 126, 126, 126, 126]
    - [18, 5795.0]
  - - [127, 127, 1000, 127, 127, 127, 127, 127]
    - [22, 5811.0]
  - - [128, 128, 1000, 128, 128, 128, 128, 128]
    - [22, 6580.0]
  - - [129, 129, 1000, 129, 129, 129, 129, 129]
    - [18, 3519.0]
  - - [130, 130, 1000, 130, 130, 130, 130, 130]
    - [18, 3607.0]
  - - [131, 131, 1000, 131, 131, 131, 131, 131]
    - [18, 3683.0]
  - - [132, 132, 1000, 132, 132, 132, 132, 132]
    - [18, 3789.0]
  - - [133, 133, 1000, 133, 133, 133, 133, 133]
    - [18, 3748.0]
  - - [134, 134, 1000, 134, 134, 134, 134, 134]
    - [18, 3831.0]
  - - [135, 135, 1000, 135, 135, 135, 135, 135]
    - [18, 3907.0]
  - - [136, 136, 1000, 136, 136, 136, 136, 136]
    - [18, 4052.0]
  - - [137, 137, 1000, 137, 137, 137, 137, 137]
    - [18, 3968.0]
  - - [138, 138, 1000, 138, 138, 138, 138, 138]
    - [18, 4056.0]
  - - [139, 139, 1000, 139, 139, 139, 139, 139]
    - [18, 4127.0]
  - - [140, 140, 1000, 140, 140, 140, 140, 140]
    - [18, 4248.0]
  - - [141, 141, 1000, 141, 141, 141, 141, 141]
    - [18, 4204.0]
  - - [142, 142, 1000, 142, 142, 142, 142, 142]
    - [18, 4293.0]
  - - [143, 143, 1000, 143, 143, 143, 143, 143]
    - [18, 4358.0]
  - - [144, 144, 1000, 144, 144, 144, 144, 144]
    - [18, 4799.0]
  - - [145, 145, 1000, 145, 145, 145, 145, 145]
    - [18, 4513.0]
  - - [146, 146, 1000, 146, 146, 146, 146, 146]
    - [18, 4624.0]
  - - [147, 147, 1000, 147, 147, 147, 147, 147]
    - [25, 4690.0]
  - - [148, 148, 1000, 148, 148, 148, 148, 148]
    - [18, 4861.0]
  - - [149, 149, 1000, 149, 149, 149, 149, 149]
    - [18, 4762.0]
  - - [150, 150, 1000, 150, 150, 150, 150, 150]
    - [18, 4883.0]
  - - [32, 32, 8, 32, 32, 32, 32, 32]
    - [1, 46.0]
  - - [32, 32, 8, 64, 32, 32, 32, 64]
    - [14, 81.0]
  - - [32, 32, 8, 128, 32, 32, 32, 128]
    - [5, 126.0]
  - - [32, 32, 8, 256, 32, 32, 32, 256]
    - [8, 187.0]
  - - [32, 32, 8, 512, 32, 32, 32, 512]
    - [8, 247.0]
  - - [32, 32, 8, 1024, 32, 32, 32, 1024]
    - [8, 296.0]
  - - [32, 32, 8, 2048, 32, 32, 32, 2048]
    - [7, 328.0]
  - - [32, 64, 8, 32, 32, 32, 32, 32]
    - [0, 95.0]
  - - [32, 64, 8, 64, 32, 32, 32, 64]
    - [8, 160.0]
  - - [32, 64, 8, 128, 32, 32, 32, 128]
    - [11, 255.0]
  - - [32, 64, 8, 256, 32, 32, 32, 256]
    - [12, 367.0]
  - - [32, 64, 8, 512, 32, 32, 32, 512]
    - [7, 490.0]
  - - [32, 64, 8, 1024, 32, 32, 32, 1024]
    - [16, 591.0]
  - - [32, 64, 8, 2048, 32, 32, 32, 2048]
    - [7, 662.0]
  - - [32, 128, 8, 32, 32, 32, 32, 32]
    - [0, 180.0]
  - - [32, 128, 8, 64, 32, 32, 32, 64]
    - [1, 320.0]
  - - [32, 128, 8, 128, 32, 32, 32, 128]
    - [14, 519.0]
  - - [32, 128, 8, 256, 32, 32, 32, 256]
    - [8, 733.0]
  - - [32, 128, 8, 512, 32, 32, 32, 512]
    - [8, 999.0]
  - - [32, 128, 8, 1024, 32, 32, 32, 1024]
    - [12, 1178.0]
  - - [32, 128, 8, 2048, 32, 32, 32, 2048]
    - [12, 1334.0]
  - - [32, 256, 8, 32, 32, 32, 32, 32]
    - [0, 364.0]
  - - [32, 256, 8, 64, 32, 32, 32, 64]
    - [1, 632.0]
  - - [32, 256, 8, 128, 32, 32, 32, 128]
    - [5, 1018.0]
  - - [32, 256, 8, 256, 32, 32, 32, 256]
    - [8, 1498.0]
  - - [32, 256, 8, 512, 32, 32, 32, 512]
    - [7, 1969.0]
  - - [32, 256, 8, 1024, 32, 32, 32, 1024]
    - [7, 2356.0]
  - - [32, 256, 8, 2048, 32, 32, 32, 2048]
    - [7, 2680.0]
  - - [32, 512, 8, 32, 32, 32, 32, 32]
    - [0, 760.0]
  - - [32, 512, 8, 64, 32, 32, 32, 64]
    - [1, 1205.0]
  - - [32, 512, 8, 128, 32, 32, 32, 128]
    - [13, 1792.0]
  - - [32, 512, 8, 256, 32, 32, 32, 256]
    - [10, 2267.0]
  - - [32, 512, 8, 512, 32, 32, 32, 512]
    - [5, 2806.0]
  - - [32, 512, 8, 1024, 32, 32, 32, 1024]
    - [14, 3095.0]
  - - [32, 512, 8, 2048, 32, 32, 32, 2048]
    - [11, 3267.0]
  - - [32, 1024, 8, 32, 32, 32, 32, 32]
    - [3, 1140.0]
  - - [32, 1024, 8, 64, 32, 32, 32, 64]
    - [5, 1808.0]
  - - [32, 1024, 8, 128, 32, 32, 32, 128]
    - [11, 2573.0]
  - - [32, 1024, 8, 256, 32, 32, 32, 256]
    - [5, 3239.0]
  - - [32, 1024, 8, 512, 32, 32, 32, 512]
    - [5, 3671.0]
  - - [32, 1024, 8, 1024, 32, 32, 32, 1024]
    - [14, 4033.0]
  - - [32, 1024, 8, 2048, 32, 32, 32, 2048]
    - [7, 3753.0]
  - - [32, 2048, 8, 32, 32, 32, 32, 32]
    - [11, 1613.0]
  - - [32, 2048, 8, 64, 32, 32, 32, 64]
    - [5, 2512.0]
  - - [32, 2048, 8, 128, 32, 32, 32, 128]
    - [5, 3424.0]
  - - [32, 2048, 8, 256, 32, 32, 32, 256]
    - [11, 4082.0]
  - - [32, 2048, 8, 512, 32, 32, 32, 512]
    - [11, 4667.0]
  - - [32, 2048, 8, 1024, 32, 32, 32, 1024]
    - [14, 4716.0]
  - - [32, 2048, 8, 2048, 32, 32, 32, 2048]
    - [7, 4512.0]
  - - [64, 32, 8, 32, 64, 64, 64, 32]
    - [2, 96.0]
  - - [64, 32, 8, 64, 64, 64, 64, 64]
    - [11, 158.0]
  - - [64, 32, 8, 128, 64, 64, 64, 128]
    - [8, 250.0]
  - - [64, 32, 8, 256, 64, 64, 64, 256]
    - [8, 369.0]
  - - [64, 32, 8, 512, 64, 64, 64, 512]
    - [7, 499.0]
  - - [64, 32, 8, 1024, 64, 64, 64, 1024]
    - [12, 592.0]
  - - [64, 32, 8, 2048, 64, 64, 64, 2048]
    - [16, 663.0]
  - - [64, 64, 8, 32, 64, 64, 64, 32]
    - [8, 190.0]
  - - [64, 64, 8, 64, 64, 64, 64, 64]
    - [1, 312.0]
  - - [64, 64, 8, 128, 64, 64, 64, 128]
    - [7, 499.0]
  - - [64, 64, 8, 256, 64, 64, 64, 256]
    - [7, 744.0]
  - - [64, 64, 8, 512, 64, 64, 64, 512]
    - [7, 1018.0]
  - - [64, 64, 8, 1024, 64, 64, 64, 1024]
    - [12, 1195.0]
  - - [64, 64, 8, 2048, 64, 64, 64, 2048]
    - [7, 1338.0]
  - - [64, 128, 8, 32, 64, 64, 64, 32]
    - [8, 369.0]
  - - [64, 128, 8, 64, 64, 64, 64, 64]
    - [0, 610.0]
  - - [64, 128, 8, 128, 64, 64, 64, 128]
    - [13, 1038.0]
  - - [64, 128, 8, 256, 64, 64, 64, 256]
    - [5, 1436.0]
  - - [64, 128, 8, 512, 64, 64, 64, 512]
    - [7, 1942.0]
  - - [64, 128, 8, 1024, 64, 64, 64, 1024]
    - [7, 2397.0]
  - - [64, 128, 8, 2048, 64, 64, 64, 2048]
    - [7, 2655.0]
  - - [64, 256, 8, 32, 64, 64, 64, 32]
    - [0, 771.0]
  - - [64, 256, 8, 64, 64, 64, 64, 64]
    - [5, 1234.0]
  - - [64, 256, 8, 128, 64, 64, 64, 128]
    - [10, 1792.0]
  - - [64, 256, 8, 256, 64, 64, 64, 256]
    - [11, 2343.0]
  - - [64, 256, 8, 512, 64, 64, 64, 512]
    - [13, 2787.0]
  - - [64, 256, 8, 1024, 64, 64, 64, 1024]
    - [13, 3107.0]
  - - [64, 256, 8, 2048, 64, 64, 64, 2048]
    - [5, 3245.0]
  - - [64, 512, 8, 32, 64, 64, 64, 32]
    - [4, 1178.0]
  - - [64, 512, 8, 64, 64, 64, 64, 64]
    - [11, 1792.0]
  - - [64, 512, 8, 128, 64, 64, 64, 128]
    - [14, 2655.0]
  - - [64, 512, 8, 256, 64, 64, 64, 256]
    - [5, 3251.0]
  - - [64, 512, 8, 512, 64, 64, 64, 512]
    - [14, 3779.0]
  - - [64, 512, 8, 1024, 64, 64, 64, 1024]
    - [14, 4052.0]
  - - [64, 512, 8, 2048, 64, 64, 64, 2048]
    - [5, 4307.0]
  - - [64, 1024, 8, 32, 64, 64, 64, 32]
    - [20, 1872.0]
  - - [64, 1024, 8, 64, 64, 64, 64, 64]
    - [23, 2689.0]
  - - [64, 1024, 8, 128, 64, 64, 64, 128]
    - [23, 3554.0]
  - - [64, 1024, 8, 256, 64, 64, 64, 256]
    - [5, 4237.0]
  - - [64, 1024, 8, 512, 64, 64, 64, 512]
    - [18, 4673.0]
  - - [64, 1024, 8, 1024, 64, 64, 64, 1024]
    - [22, 4920.0]
  - - [64, 1024, 8, 2048, 64, 64, 64, 2048]
    - [14, 5379.0]
  - - [64, 2048, 8, 32, 64, 64, 64, 32]
    - [26, 2621.0]
  - - [64, 2048, 8, 64, 64, 64, 64, 64]
    - [23, 3695.0]
  - - [64, 2048, 8, 128, 64, 64, 64, 128]
    - [18, 4807.0]
  - - [64, 2048, 8, 256, 64, 64, 64, 256]
    - [18, 5492.0]
  - - [64, 2048, 8, 512, 64, 64, 64, 512]
    - [18, 5928.0]
  - - [64, 2048, 8, 1024, 64, 64, 64, 1024]
    - [18, 6177.0]
  - - [64, 2048, 8, 2048, 64, 64, 64, 2048]
    - [18, 6309.0]
  - - [128, 32, 8, 32, 128, 128, 128, 32]
    - [9, 180.0]
  - - [128, 32, 8, 64, 128, 128, 128, 64]
    - [5, 301.0]
  - - [128, 32, 8, 128, 128, 128, 128, 128]
    - [5, 514.0]
  - - [128, 32, 8, 256, 128, 128, 128, 256]
    - [8, 738.0]
  - - [128, 32, 8, 512, 128, 128, 128, 512]
    - [16, 971.0]
  - - [128, 32, 8, 1024, 128, 128, 128, 1024]
    - [7, 1188.0]
  - - [128, 32, 8, 2048, 128, 128, 128, 2048]
    - [12, 1336.0]
  - - [128, 64, 8, 32, 128, 128, 128, 32]
    - [8, 364.0]
  - - [128, 64, 8, 64, 128, 128, 128, 64]
    - [8, 624.0]
  - - [128, 64, 8, 128, 128, 128, 128, 128]
    - [3, 980.0]
  - - [128, 64, 8, 256, 128, 128, 128, 256]
    - [5, 1456.0]
  - - [128, 64, 8, 512, 128, 128, 128, 512]
    - [7, 1978.0]
  - - [128, 64, 8, 1024, 128, 128, 128, 1024]
    - [7, 2370.0]
  - - [128, 64, 8, 2048, 128, 128, 128, 2048]
    - [7, 2663.0]
  - - [128, 128, 8, 32, 128, 128, 128, 32]
    - [14, 771.0]
  - - [128, 128, 8, 64, 128, 128, 128, 64]
    - [11, 1248.0]
  - - [128, 128, 8, 128, 128, 128, 128, 128]
    - [14, 1824.0]
  - - [128, 128, 8, 256, 128, 128, 128, 256]
    - [0, 2280.0]
  - - [128, 128, 8, 512, 128, 128, 128, 512]
    - [13, 2778.0]
  - - [128, 128, 8, 1024, 128, 128, 128, 1024]
    - [11, 3078.0]
  - - [128, 128, 8, 2048, 128, 128, 128, 2048]
    - [3, 3255.0]
  - - [128, 256, 8, 32, 128, 128, 128, 32]
    - [6, 1205.0]
  - - [128, 256, 8, 64, 128, 128, 128, 64]
    - [11, 1840.0]
  - - [128, 256, 8, 128, 128, 128, 128, 128]
    - [3, 2605.0]
  - - [128, 256, 8, 256, 128, 128, 128, 256]
    - [14, 3290.0]
  - - [128, 256, 8, 512, 128, 128, 128, 512]
    - [14, 3753.0]
  - - [128, 256, 8, 1024, 128, 128, 128, 1024]
    - [5, 4087.0]
  - - [128, 256, 8, 2048, 128, 128, 128, 2048]
    - [14, 4291.0]
  - - [128, 512, 8, 32, 128, 128, 128, 32]
    - [26, 1942.0]
  - - [128, 512, 8, 64, 128, 128, 128, 64]
    - [25, 2724.0]
  - - [128, 512, 8, 128, 128, 128, 128, 128]
    - [14, 3585.0]
  - - [128, 512, 8, 256, 128, 128, 128, 256]
    - [5, 4258.0]
  - - [128, 512, 8, 512, 128, 128, 128, 512]
    - [18, 4686.0]
  - - [128, 512, 8, 1024, 128, 128, 128, 1024]
    - [14, 4934.0]
  - - [128, 512, 8, 2048, 128, 128, 128, 2048]
    - [14, 5182.0]
  - - [128, 1024, 8, 32, 128, 128, 128, 32]
    - [26, 2655.0]
  - - [128, 1024, 8, 64, 128, 128, 128, 64]
    - [26, 3712.0]
  - - [128, 1024, 8, 128, 128, 128, 128, 128]
    - [18, 4807.0]
  - - [128, 1024, 8, 256, 128, 128, 128, 256]
    - [22, 5483.0]
  - - [128, 1024, 8, 512, 128, 128, 128, 512]
    - [22, 5913.0]
  - - [128, 1024, 8, 1024, 128, 128, 128, 1024]
    - [25, 6154.0]
  - - [128, 1024, 8, 2048, 128, 128, 128, 2048]
    - [18, 6315.0]
  - - [128, 2048, 8, 32, 128, 128, 128, 32]
    - [23, 3303.0]
  - - [128, 2048, 8, 64, 128, 128, 128, 64]
    - [22, 4522.0]
  - - [128, 2048, 8, 128, 128, 128, 128, 128]
    - [22, 5836.0]
  - - [128, 2048, 8, 256, 128, 128, 128, 256]
    - [25, 6410.0]
  - - [128, 2048, 8, 512, 128, 128, 128, 512]
    - [25, 6806.0]
  - - [128, 2048, 8, 1024, 128, 128, 128, 1024]
    - [25, 7051.0]
  - - [128, 2048, 8, 2048, 128, 128, 128, 2048]
    - [22, 7192.0]
  - - [256, 32, 8, 32, 256, 256, 256, 32]
    - [8, 369.0]
  - - [256, 32, 8, 64, 256, 256, 256, 64]
    - [11, 610.0]
  - - [256, 32, 8, 128, 256, 256, 256, 128]
    - [5, 962.0]
  - - [256, 32, 8, 256, 256, 256, 256, 256]
    - [5, 1467.0]
  - - [256, 32, 8, 512, 256, 256, 256, 512]
    - [12, 1915.0]
  - - [256, 32, 8, 1024, 256, 256, 256, 1024]
    - [7, 2411.0]
  - - [256, 32, 8, 2048, 256, 256, 256, 2048]
    - [7, 2626.0]
  - - [256, 64, 8, 32, 256, 256, 256, 32]
    - [11, 783.0]
  - - [256, 64, 8, 64, 256, 256, 256, 64]
    - [13, 1263.0]
  - - [256, 64, 8, 128, 256, 256, 256, 128]
    - [10, 1748.0]
  - - [256, 64, 8, 256, 256, 256, 256, 256]
    - [3, 2208.0]
  - - [256, 64, 8, 512, 256, 256, 256, 512]
    - [3, 2759.0]
  - - [256, 64, 8, 1024, 256, 256, 256, 1024]
    - [11, 3101.0]
  - - [256, 64, 8, 2048, 256, 256, 256, 2048]
    - [11, 3236.0]
  - - [256, 128, 8, 32, 256, 256, 256, 32]
    - [20, 1192.0]
  - - [256, 128, 8, 64, 256, 256, 256, 64]
    - [3, 1856.0]
  - - [256, 128, 8, 128, 256, 256, 256, 128]
    - [5, 2542.0]
  - - [256, 128, 8, 256, 256, 256, 256, 256]
    - [14, 3178.0]
  - - [256, 128, 8, 512, 256, 256, 256, 512]
    - [11, 3671.0]
  - - [256, 128, 8, 1024, 256, 256, 256, 1024]
    - [11, 4018.0]
  - - [256, 128, 8, 2048, 256, 256, 256, 2048]
    - [5, 4258.0]
  - - [256, 256, 8, 32, 256, 256, 256, 32]
    - [18, 1872.0]
  - - [256, 256, 8, 64, 256, 256, 256, 64]
    - [18, 2834.0]
  - - [256, 256, 8, 128, 256, 256, 256, 128]
    - [18, 3616.0]
  - - [256, 256, 8, 256, 256, 256, 256, 256]
    - [18, 4102.0]
  - - [256, 256, 8, 512, 256, 256, 256, 512]
    - [22, 4609.0]
  - - [256, 256, 8, 1024, 256, 256, 256, 1024]
    - [18, 4902.0]
  - - [256, 256, 8, 2048, 256, 256, 256, 2048]
    - [22, 5053.0]
  - - [256, 512, 8, 32, 256, 256, 256, 32]
    - [26, 2655.0]
  - - [256, 512, 8, 64, 256, 256, 256, 64]
    - [20, 3712.0]
  - - [256, 512, 8, 128, 256, 256, 256, 128]
    - [18, 4821.0]
  - - [256, 512, 8, 256, 256, 256, 256, 256]
    - [18, 5352.0]
  - - [256, 512, 8, 512, 256, 256, 256, 512]
    - [18, 5825.0]
  - - [256, 512, 8, 1024, 256, 256, 256, 1024]
    - [25, 6120.0]
  - - [256, 512, 8, 2048, 256, 256, 256, 2048]
    - [18, 6262.0]
  - - [256, 1024, 8, 32, 256, 256, 256, 32]
    - [26, 3316.0]
  - - [256, 1024, 8, 64, 256, 256, 256, 64]
    - [25, 4534.0]
  - - [256, 1024, 8, 128, 256, 256, 256, 128]
    - [25, 5649.0]
  - - [256, 1024, 8, 256, 256, 256, 256, 256]
    - [25, 6289.0]
  - - [256, 1024, 8, 512, 256, 256, 256, 512]
    - [18, 6691.0]
  - - [256, 1024, 8, 1024, 256, 256, 256, 1024]
    - [25, 6958.0]
  - - [256, 1024, 8, 2048, 256, 256, 256, 2048]
    - [25, 7134.0]
  - - [256, 2048, 8, 32, 256, 256, 256, 32]
    - [25, 3822.0]
  - - [256, 2048, 8, 64, 256, 256, 256, 64]
    - [25, 5016.0]
  - - [256, 2048, 8, 128, 256, 256, 256, 128]
    - [25, 6106.0]
  - - [256, 2048, 8, 256, 256, 256, 256, 256]
    - [18, 6724.0]
  - - [256, 2048, 8, 512, 256, 256, 256, 512]
    - [22, 6978.0]
  - - [256, 2048, 8, 1024, 256, 256, 256, 1024]
    - [18, 7177.0]
  - - [256, 2048, 8, 2048, 256, 256, 256, 2048]
    - [25, 7299.0]
  - - [512, 32, 8, 32, 512, 512, 512, 32]
    - [0, 749.0]
  - - [512, 32, 8, 64, 512, 512, 512, 64]
    - [1, 1219.0]
  - - [512, 32, 8, 128, 512, 512, 512, 128]
    - [5, 1777.0]
  - - [512, 32, 8, 256, 512, 512, 512, 256]
    - [5, 2305.0]
  - - [512, 32, 8, 512, 512, 512, 512, 512]
    - [5, 2750.0]
  - - [512, 32, 8, 1024, 512, 512, 512, 1024]
    - [5, 2996.0]
  - - [512, 32, 8, 2048, 512, 512, 512, 2048]
    - [14, 3163.0]
  - - [512, 64, 8, 32, 512, 512, 512, 32]
    - [23, 1192.0]
  - - [512, 64, 8, 64, 512, 512, 512, 64]
    - [11, 1840.0]
  - - [512, 64, 8, 128, 512, 512, 512, 128]
    - [5, 2573.0]
  - - [512, 64, 8, 256, 512, 512, 512, 256]
    - [5, 3290.0]
  - - [512, 64, 8, 512, 512, 512, 512, 512]
    - [5, 3720.0]
  - - [512, 64, 8, 1024, 512, 512, 512, 1024]
    - [11, 3990.0]
  - - [512, 64, 8, 2048, 512, 512, 512, 2048]
    - [14, 4192.0]
  - - [512, 128, 8, 32, 512, 512, 512, 32]
    - [22, 1872.0]
  - - [512, 128, 8, 64, 512, 512, 512, 64]
    - [22, 2689.0]
  - - [512, 128, 8, 128, 512, 512, 512, 128]
    - [14, 3539.0]
  - - [512, 128, 8, 256, 512, 512, 512, 256]
    - [11, 4280.0]
  - - [512, 128, 8, 512, 512, 512, 512, 512]
    - [14, 4733.0]
  - - [512, 128, 8, 1024, 512, 512, 512, 1024]
    - [22, 4881.0]
  - - [512, 128, 8, 2048, 512, 512, 512, 2048]
    - [14, 4989.0]
  - - [512, 256, 8, 32, 512, 512, 512, 32]
    - [26, 2655.0]
  - - [512, 256, 8, 64, 512, 512, 512, 64]
    - [22, 3570.0]
  - - [512, 256, 8, 128, 512, 512, 512, 128]
    - [25, 4427.0]
  - - [512, 256, 8, 256, 512, 512, 512, 256]
    - [11, 4942.0]
  - - [512, 256, 8, 512, 512, 512, 512, 512]
    - [25, 5514.0]
  - - [512, 256, 8, 1024, 512, 512, 512, 1024]
    - [25, 6019.0]
  - - [512, 256, 8, 2048, 512, 512, 512, 2048]
    - [25, 6187.0]
  - - [512, 512, 8, 32, 512, 512, 512, 32]
    - [23, 3214.0]
  - - [512, 512, 8, 64, 512, 512, 512, 64]
    - [22, 4247.0]
  - - [512, 512, 8, 128, 512, 512, 512, 128]
    - [22, 5268.0]
  - - [512, 512, 8, 256, 512, 512, 512, 256]
    - [18, 5501.0]
  - - [512, 512, 8, 512, 512, 512, 512, 512]
    - [20, 6171.0]
  - - [512, 512, 8, 1024, 512, 512, 512, 1024]
    - [25, 6584.0]
  - - [512, 512, 8, 2048, 512, 512, 512, 2048]
    - [25, 6919.0]
  - - [512, 1024, 8, 32, 512, 512, 512, 32]
    - [22, 3624.0]
  - - [512, 1024, 8, 64, 512, 512, 512, 64]
    - [18, 4584.0]
  - - [512, 1024, 8, 128, 512, 512, 512, 128]
    - [22, 5955.0]
  - - [512, 1024, 8, 256, 512, 512, 512, 256]
    - [20, 6289.0]
  - - [512, 1024, 8, 512, 512, 512, 512, 512]
    - [18, 6774.0]
  - - [512, 1024, 8, 1024, 512, 512, 512, 1024]
    - [18, 6963.0]
  - - [512, 1024, 8, 2048, 512, 512, 512, 2048]
    - [25, 7181.0]
  - - [512, 2048, 8, 32, 512, 512, 512, 32]
    - [22, 3906.0]
  - - [512, 2048, 8, 64, 512, 512, 512, 64]
    - [25, 4863.0]
  - - [512, 2048, 8, 128, 512, 512, 512, 128]
    - [22, 6425.0]
  - - [512, 2048, 8, 256, 512, 512, 512, 256]
    - [20, 6779.0]
  - - [512, 2048, 8, 512, 512, 512, 512, 512]
    - [18, 7148.0]
  - - [512, 2048, 8, 1024, 512, 512, 512, 1024]
    - [25, 7172.0]
  - - [512, 2048, 8, 2048, 512, 512, 512, 2048]
    - [25, 7329.0]
  - - [1024, 32, 8, 32, 1024, 1024, 1024, 32]
    - [5, 1140.0]
  - - [1024, 32, 8, 64, 1024, 1024, 1024, 64]
    - [5, 1762.0]
  - - [1024, 32, 8, 128, 1024, 1024, 1024, 128]
    - [11, 2527.0]
  - - [1024, 32, 8, 256, 1024, 1024, 1024, 256]
    - [5, 3214.0]
  - - [1024, 32, 8, 512, 1024, 1024, 1024, 512]
    - [14, 3631.0]
  - - [1024, 32, 8, 1024, 1024, 1024, 1024, 1024]
    - [5, 3920.0]
  - - [1024, 32, 8, 2048, 1024, 1024, 1024, 2048]
    - [5, 4062.0]
  - - [1024, 64, 8, 32, 1024, 1024, 1024, 32]
    - [25, 1856.0]
  - - [1024, 64, 8, 64, 1024, 1024, 1024, 64]
    - [5, 2589.0]
  - - [1024, 64, 8, 128, 1024, 1024, 1024, 128]
    - [22, 3631.0]
  - - [1024, 64, 8, 256, 1024, 1024, 1024, 256]
    - [11, 4280.0]
  - - [1024, 64, 8, 512, 1024, 1024, 1024, 512]
    - [5, 4559.0]
  - - [1024, 64, 8, 1024, 1024, 1024, 1024, 1024]
    - [22, 4852.0]
  - - [1024, 64, 8, 2048, 1024, 1024, 1024, 2048]
    - [5, 5014.0]
  - - [1024, 128, 8, 32, 1024, 1024, 1024, 32]
    - [23, 2589.0]
  - - [1024, 128, 8, 64, 1024, 1024, 1024, 64]
    - [23, 3600.0]
  - - [1024, 128, 8, 128, 1024, 1024, 1024, 128]
    - [26, 4596.0]
  - - [1024, 128, 8, 256, 1024, 1024, 1024, 256]
    - [25, 5352.0]
  - - [1024, 128, 8, 512, 1024, 1024, 1024, 512]
    - [25, 5815.0]
  - - [1024, 128, 8, 1024, 1024, 1024, 1024, 1024]
    - [22, 6043.0]
  - - [1024, 128, 8, 2048, 1024, 1024, 1024, 2048]
    - [25, 6157.0]
  - - [1024, 256, 8, 32, 1024, 1024, 1024, 32]
    - [26, 3190.0]
  - - [1024, 256, 8, 64, 1024, 1024, 1024, 64]
    - [25, 4302.0]
  - - [1024, 256, 8, 128, 1024, 1024, 1024, 128]
    - [22, 5343.0]
  - - [1024, 256, 8, 256, 1024, 1024, 1024, 256]
    - [22, 5981.0]
  - - [1024, 256, 8, 512, 1024, 1024, 1024, 512]
    - [23, 6251.0]
  - - [1024, 256, 8, 1024, 1024, 1024, 1024, 1024]
    - [22, 6457.0]
  - - [1024, 256, 8, 2048, 1024, 1024, 1024, 2048]
    - [22, 6614.0]
  - - [1024, 512, 8, 32, 1024, 1024, 1024, 32]
    - [25, 3488.0]
  - - [1024, 512, 8, 64, 1024, 1024, 1024, 64]
    - [23, 4686.0]
  - - [1024, 512, 8, 128, 1024, 1024, 1024, 128]
    - [18, 5800.0]
  - - [1024, 512, 8, 256, 1024, 1024, 1024, 256]
    - [23, 6416.0]
  - - [1024, 512, 8, 512, 1024, 1024, 1024, 512]
    - [22, 6659.0]
  - - [1024, 512, 8, 1024, 1024, 1024, 1024, 1024]
    - [22, 6777.0]
  - - [1024, 512, 8, 2048, 1024, 1024, 1024, 2048]
    - [22, 6829.0]
  - - [1024, 1024, 8, 32, 1024, 1024, 1024, 32]
    - [25, 3804.0]
  - - [1024, 1024, 8, 64, 1024, 1024, 1024, 64]
    - [22, 5053.0]
  - - [1024, 1024, 8, 128, 1024, 1024, 1024, 128]
    - [20, 6194.0]
  - - [1024, 1024, 8, 256, 1024, 1024, 1024, 256]
    - [23, 6638.0]
  - - [1024, 1024, 8, 512, 1024, 1024, 1024, 512]
    - [22, 6920.0]
  - - [1024, 1024, 8, 1024, 1024, 1024, 1024, 1024]
    - [22, 6986.0]
  - - [1024, 1024, 8, 2048, 1024, 1024, 1024, 2048]
    - [23, 7015.0]
  - - [1024, 2048, 8, 32, 1024, 1024, 1024, 32]
    - [25, 3966.0]
  - - [1024, 2048, 8, 64, 1024, 1024, 1024, 64]
    - [22, 5208.0]
  - - [1024, 2048, 8, 128, 1024, 1024, 1024, 128]
    - [20, 6393.0]
  - - [1024, 2048, 8, 256, 1024, 1024, 1024, 256]
    - [23, 6774.0]
  - - [1024, 2048, 8, 512, 1024, 1024, 1024, 512]
    - [22, 7002.0]
  - - [1024, 2048, 8, 1024, 1024, 1024, 1024, 1024]
    - [23, 7051.0]
  - - [1024, 2048, 8, 2048, 1024, 1024, 1024, 2048]
    - [23, 7064.0]
  - - [2048, 32, 8, 32, 2048, 2048, 2048, 32]
    - [26, 1777.0]
  - - [2048, 32, 8, 64, 2048, 2048, 2048, 64]
    - [20, 2542.0]
  - - [2048, 32, 8, 128, 2048, 2048, 2048, 128]
    - [5, 3424.0]
  - - [2048, 32, 8, 256, 2048, 2048, 2048, 256]
    - [22, 3957.0]
  - - [2048, 32, 8, 512, 2048, 2048, 2048, 512]
    - [11, 4628.0]
  - - [2048, 32, 8, 1024, 2048, 2048, 2048, 1024]
    - [14, 4924.0]
  - - [2048, 32, 8, 2048, 2048, 2048, 2048, 2048]
    - [5, 5123.0]
  - - [2048, 64, 8, 32, 2048, 2048, 2048, 32]
    - [20, 2605.0]
  - - [2048, 64, 8, 64, 2048, 2048, 2048, 64]
    - [22, 3647.0]
  - - [2048, 64, 8, 128, 2048, 2048, 2048, 128]
    - [22, 4766.0]
  - - [2048, 64, 8, 256, 2048, 2048, 2048, 256]
    - [22, 5421.0]
  - - [2048, 64, 8, 512, 2048, 2048, 2048, 512]
    - [22, 5861.0]
  - - [2048, 64, 8, 1024, 2048, 2048, 2048, 1024]
    - [25, 6062.0]
  - - [2048, 64, 8, 2048, 2048, 2048, 2048, 2048]
    - [25, 6214.0]
  - - [2048, 128, 8, 32, 2048, 2048, 2048, 32]
    - [25, 3290.0]
  - - [2048, 128, 8, 64, 2048, 2048, 2048, 64]
    - [22, 4498.0]
  - - [2048, 128, 8, 128, 2048, 2048, 2048, 128]
    - [25, 5639.0]
  - - [2048, 128, 8, 256, 2048, 2048, 2048, 256]
    - [22, 6266.0]
  - - [2048, 128, 8, 512, 2048, 2048, 2048, 512]
    - [25, 6714.0]
  - - [2048, 128, 8, 1024, 2048, 2048, 2048, 1024]
    - [25, 6943.0]
  - - [2048, 128, 8, 2048, 2048, 2048, 2048, 2048]
    - [25, 7151.0]
  - - [2048, 256, 8, 32, 2048, 2048, 2048, 32]
    - [23, 3822.0]
  - - [2048, 256, 8, 64, 2048, 2048, 2048, 64]
    - [22, 5076.0]
  - - [2048, 256, 8, 128, 2048, 2048, 2048, 128]
    - [25, 6197.0]
  - - [2048, 256, 8, 256, 2048, 2048, 2048, 256]
    - [22, 6674.0]
  - - [2048, 256, 8, 512, 2048, 2048, 2048, 512]
    - [25, 6998.0]
  - - [2048, 256, 8, 1024, 2048, 2048, 2048, 1024]
    - [22, 7134.0]
  - - [2048, 256, 8, 2048, 2048, 2048, 2048, 2048]
    - [25, 7299.0]
  - - [2048, 512, 8, 32, 2048, 2048, 2048, 32]
    - [23, 4143.0]
  - - [2048, 512, 8, 64, 2048, 2048, 2048, 64]
    - [22, 5373.0]
  - - [2048, 512, 8, 128, 2048, 2048, 2048, 128]
    - [18, 6434.0]
  - - [2048, 512, 8, 256, 2048, 2048, 2048, 256]
    - [22, 6878.0]
  - - [2048, 512, 8, 512, 2048, 2048, 2048, 512]
    - [22, 7133.0]
  - - [2048, 512, 8, 1024, 2048, 2048, 2048, 1024]
    - [25, 7301.0]
  - - [2048, 512, 8, 2048, 2048, 2048, 2048, 2048]
    - [25, 7453.0]
  - - [2048, 1024, 8, 32, 2048, 2048, 2048, 32]
    - [22, 4332.0]
  - - [2048, 1024, 8, 64, 2048, 2048, 2048, 64]
    - [22, 5553.0]
  - - [2048, 1024, 8, 128, 2048, 2048, 2048, 128]
    - [18, 6628.0]
  - - [2048, 1024, 8, 256, 2048, 2048, 2048, 256]
    - [22, 7021.0]
  - - [2048, 1024, 8, 512, 2048, 2048, 2048, 512]
    - [22, 7268.0]
  - - [2048, 1024, 8, 1024, 2048, 2048, 2048, 1024]
    - [25, 7441.0]
  - - [2048, 1024, 8, 2048, 2048, 2048, 2048, 2048]
    - [26, 7554.0]
  - - [2048, 2048, 8, 32, 2048, 2048, 2048, 32]
    - [22, 4415.0]
  - - [2048, 2048, 8, 64, 2048, 2048, 2048, 64]
    - [22, 5644.0]
  - - [2048, 2048, 8, 128, 2048, 2048, 2048, 128]
    - [18, 6760.0]
  - - [2048, 2048, 8, 256, 2048, 2048, 2048, 256]
    - [22, 7106.0]
  - - [2048, 2048, 8, 512, 2048, 2048, 2048, 512]
    - [22, 7326.0]
  - - [2048, 2048, 8, 1024, 2048, 2048, 2048, 1024]
    - [25, 7491.0]
  - - [2048, 2048, 8, 2048, 2048, 2048, 2048, 2048]
    - [25, 7601.0]
- null
