library/src/blas3/Tensile/Logic/asm_full/arcturus/arcturus_Cijk_Alik_Bjlk_HHS_BH.yaml
- {MinimumRequiredVersion: 4.6.0}
- arcturus
- gfx908
- [Device 7380, Device 7388, Device 738c, Device 7390]
    SolutionIndex: 0
    SolutionNameMin: Cijk_Alik_Bjlk_HHS_BH_MT16x16x32_SN_AF0EM2_AMAS3_ASEM2_BL1_EPS1_GRVW2_ISA908_IU1_KLA_LDL1_LRVW2_MAC_PGR1_PLR1_SNLL1_TT2_2_VW2_WG8_8_1_WGM1
    SolutionIndex: 1
    SolutionNameMin: Cijk_Alik_Bjlk_HHS_BH_MT64x64x8_SN_AF0EM1_AMAS2_ASEM1_BL0_EPS0_GRVW2_ISA000_IU1_KLS_LDL1_LRVW2_FMA_PGR0_PLR0_SNLL0_TT4_4_VW2_WG16_16_1_WGM8
    SolutionIndex: 2
    SolutionNameMin: Cijk_Alik_Bjlk_HHS_BH_MT64x64x16_SN_AF0EM1_AMAS2_ASEM1_BL0_EPS0_GRVW2_ISA000_IU1_KLS_LDL1_LRVW2_FMA_PGR1_PLR1_SNLL0_TT4_4_VW2_WG16_16_1_WGM8
    SolutionIndex: 3
    SolutionNameMin: Cijk_Alik_Bjlk_HHS_BH_MT32x32x16_SN_AF0EM2_AMAS3_ASEM2_BL1_EPS1_GRVW2_ISA908_IU1_KLA_LDL1_LRVW2_MAC_PGR1_PLR1_SNLL1_TT2_2_VW2_WG16_16_1_WGM1
    SolutionIndex: 4
    SolutionNameMin: Cijk_Alik_Bjlk_HHS_BH_MT64x64x16_SN_AF0EM1_AMAS0_ASEM1_BL0_EPS0_GRVW1_ISA000_IU1_KLS_LDL1_LRVW1_FMA_PGR1_PLR0_SNLL0_TT4_4_VW1_WG16_16_1_WGM8
    SolutionIndex: 5
    SolutionNameMin: Cijk_Alik_Bjlk_HHS_BH_MT64x64x16_SN_AF0EM1_AMAS0_ASEM1_BL0_EPS0_GRVW1_ISA000_IU1_KLS_LDL1_LRVW1_FMA_PGR0_PLR1_SNLL0_TT4_4_VW1_WG16_16_1_WGM8
    SolutionIndex: 6
    SolutionNameMin: Cijk_Alik_Bjlk_HHS_BH_MT64x64x8_SN_AF0EM1_AMAS2_ASEM1_BL0_EPS0_GRVW2_ISA000_IU1_KLS_LDL1_LRVW2_FMA_PGR1_PLR1_SNLL0_TT4_4_VW2_WG16_16_1_WGM8
    SolutionIndex: 7
    SolutionNameMin: Cijk_Alik_Bjlk_HHS_BH_MT64x64x16_SN_AF0EM1_AMAS2_ASEM1_BL0_EPS0_GRVW2_ISA000_IU1_KLS_LDL1_LRVW2_FMA_PGR0_PLR0_SNLL0_TT4_4_VW2_WG16_16_1_WGM8
    SolutionIndex: 8
    SolutionNameMin: Cijk_Alik_Bjlk_HHS_BH_MT32x32x32_SN_AF0EM2_AMAS3_ASEM2_BL1_EPS1_GRVW4_ISA908_IU2_KLA_LDL2_LRVW4_MAC_PGR1_PLR1_SNLL0_TT4_4_VW4_WG8_8_1_WGM1
    SolutionIndex: 9
    SolutionNameMin: Cijk_Alik_Bjlk_HHS_BH_MT64x64x8_SN_AF0EM1_AMAS2_ASEM1_BL0_EPS0_GRVW2_ISA000_IU1_KLS_LDL1_LRVW2_FMA_PGR1_PLR0_SNLL0_TT4_4_VW2_WG16_16_1_WGM8
    SolutionIndex: 10
    SolutionNameMin: Cijk_Alik_Bjlk_HHS_BH_MT32x64x32_SN_AF0EM2_AMAS3_ASEM2_BL1_EPS1_GRVW4_ISA908_IU2_KLA_LDL2_LRVW4_MAC_PGR1_PLR1_SNLL0_TT4_4_VW4_WG8_16_1_WGM1
    SolutionIndex: 11
    SolutionNameMin: Cijk_Alik_Bjlk_HHS_BH_MT16x16x8_SN_AF0EM2_AMAS3_ASEM2_BL1_EPS1_GRVW2_ISA908_IU1_KLA_LDL1_LRVW2_MAC_PGR1_PLR1_SNLL1_TT2_2_VW2_WG8_8_1_WGM1
    SolutionIndex: 12
    SolutionNameMin: Cijk_Alik_Bjlk_HHS_BH_MT64x64x4_SN_AF0EM1_AMAS2_ASEM1_BL0_EPS0_GRVW2_ISA000_IU1_KLS_LDL1_LRVW2_FMA_PGR0_PLR1_SNLL0_TT4_4_VW2_WG16_16_1_WGM8
    SolutionIndex: 13
    SolutionNameMin: Cijk_Alik_Bjlk_HHS_BH_MT64x64x4_SN_AF0EM1_AMAS0_ASEM1_BL0_EPS0_GRVW1_ISA000_IU1_KLS_LDL1_LRVW1_FMA_PGR0_PLR0_SNLL0_TT4_4_VW1_WG16_16_1_WGM8
    SolutionIndex: 14
    SolutionNameMin: Cijk_Alik_Bjlk_HHS_BH_MT32x64x32_SN_AF0EM2_AMAS3_ASEM2_BL1_EPS1_GRVW4_ISA908_IU2_KLA_LDL2_LRVW4_MAC_PGR1_PLR1_SNLL0_TT4_4_VW4_WG8_16_1_WGM4
    SolutionIndex: 15
    SolutionNameMin: Cijk_Alik_Bjlk_HHS_BH_MT64x64x4_SN_AF0EM1_AMAS0_ASEM1_BL0_EPS0_GRVW1_ISA000_IU1_KLS_LDL1_LRVW1_FMA_PGR1_PLR0_SNLL0_TT4_4_VW1_WG16_16_1_WGM8
    SolutionIndex: 16
    SolutionNameMin: Cijk_Alik_Bjlk_HHS_BH_MT64x64x8_SN_AF0EM1_AMAS0_ASEM1_BL0_EPS0_GRVW1_ISA000_IU1_KLS_LDL1_LRVW1_FMA_PGR0_PLR1_SNLL0_TT4_4_VW1_WG16_16_1_WGM8
    SolutionIndex: 17
    SolutionNameMin: Cijk_Alik_Bjlk_HHS_BH_MT32x64x16_SN_AF0EM2_AMAS3_ASEM2_BL1_EPS1_GRVW4_ISA908_IU2_KLA_LDL2_LRVW4_MAC_PGR1_PLR1_SNLL0_TT4_4_VW4_WG8_16_1_WGM4
    SolutionIndex: 18
    SolutionNameMin: Cijk_Alik_Bjlk_HHS_BH_MT64x64x8_SN_AF0EM1_AMAS0_ASEM1_BL0_EPS0_GRVW1_ISA000_IU1_KLS_LDL1_LRVW1_FMA_PGR1_PLR1_SNLL0_TT4_4_VW1_WG16_16_1_WGM8
    SolutionIndex: 19
    SolutionNameMin: Cijk_Alik_Bjlk_HHS_BH_MT32x32x8_SN_AF0EM2_AMAS3_ASEM2_BL1_EPS1_GRVW4_ISA908_IU2_KLA_LDL2_LRVW4_MAC_PGR1_PLR1_SNLL0_TT4_4_VW4_WG8_8_1_WGM1
    SolutionIndex: 20
    SolutionNameMin: Cijk_Alik_Bjlk_HHS_BH_MT32x128x32_SN_AF0EM2_AMAS3_ASEM2_BL1_EPS1_GRVW4_ISA908_IU2_KLA_LDL2_LRVW4_MAC_PGR1_PLR1_SNLL0_TT4_4_VW4_WG8_32_1_WGM1
    SolutionIndex: 21
    SolutionNameMin: Cijk_Alik_Bjlk_HHS_BH_MT32x32x16_SN_AF0EM2_AMAS3_ASEM2_BL1_EPS1_GRVW4_ISA908_IU2_KLA_LDL2_LRVW4_MAC_PGR1_PLR1_SNLL0_TT4_4_VW4_WG8_8_1_WGM1
    SolutionIndex: 22
    SolutionNameMin: Cijk_Alik_Bjlk_HHS_BH_MT64x64x16_SN_AF0EM1_AMAS0_ASEM1_BL0_EPS0_GRVW1_ISA000_IU1_KLS_LDL1_LRVW1_FMA_PGR0_PLR0_SNLL0_TT4_4_VW1_WG16_16_1_WGM8
    SolutionIndex: 23
    SolutionNameMin: Cijk_Alik_Bjlk_HHS_BH_MT32x128x64_SN_AF0EM2_AMAS3_ASEM2_BL1_EPS1_GRVW4_ISA908_IU2_KLA_LDL2_LRVW4_MAC_PGR1_PLR1_SNLL0_TT4_4_VW4_WG8_32_1_WGM1
    SolutionIndex: 24
    SolutionNameMin: Cijk_Alik_Bjlk_HHS_BH_MT64x64x4_SN_AF0EM1_AMAS2_ASEM1_BL0_EPS0_GRVW2_ISA000_IU1_KLS_LDL1_LRVW2_FMA_PGR1_PLR0_SNLL0_TT4_4_VW2_WG16_16_1_WGM8
    SolutionIndex: 25
    SolutionNameMin: Cijk_Alik_Bjlk_HHS_BH_MT32x64x16_SN_AF0EM2_AMAS3_ASEM2_BL1_EPS1_GRVW4_ISA908_IU2_KLA_LDL2_LRVW4_MAC_PGR1_PLR1_SNLL0_TT4_4_VW4_WG8_16_1_WGM1
    SolutionIndex: 26
    SolutionNameMin: Cijk_Alik_Bjlk_HHS_BH_MT128x128x4_SN_AF0EM1_AMAS0_ASEM1_BL0_EPS0_GRVW1_ISA000_IU1_KLS_LDL1_LRVW1_FMA_PGR0_PLR1_SNLL0_TT8_8_VW1_WG16_16_1_WGM8
    SolutionIndex: 27
    SolutionNameMin: Cijk_Alik_Bjlk_HHS_BH_MT64x64x16_SN_AF0EM1_AMAS2_ASEM1_BL0_EPS0_GRVW2_ISA000_IU1_KLS_LDL1_LRVW2_FMA_PGR1_PLR0_SNLL0_TT4_4_VW2_WG16_16_1_WGM8
    SolutionIndex: 28
    SolutionNameMin: Cijk_Alik_Bjlk_HHS_BH_MT64x64x4_SN_AF0EM1_AMAS0_ASEM1_BL0_EPS0_GRVW1_ISA000_IU1_KLS_LDL1_LRVW1_FMA_PGR0_PLR1_SNLL0_TT4_4_VW1_WG16_16_1_WGM8
    SolutionIndex: 29
    SolutionNameMin: Cijk_Alik_Bjlk_HHS_BH_MT64x64x16_SN_AF0EM2_AMAS3_ASEM2_BL1_EPS1_GRVW8_ISA908_IU2_KLA_LDL2_LRVW8_MAC_PGR1_PLR1_SNLL0_TT8_8_VW8_WG8_8_1_WGM1
    SolutionIndex: 30
    SolutionNameMin: Cijk_Alik_Bjlk_HHS_BH_MT64x64x32_MI16x16x16x1_SN_AMAS3_GRVW2_LBSPP128_LPA4_SIA0_SU0_SUS0_SVW2_TLDS1_VW2_WSGRA1_WSGRB1
    SolutionIndex: 31
    SolutionNameMin: Cijk_Alik_Bjlk_HHS_BH_MT64x64x32_MI16x16x16x1_SN_AMAS3_GRVW2_LBSPP128_LPA4_SIA0_SU8_SUS64_SVW2_TLDS1_VW2_WSGRA1_WSGRB1
- - - [64, 448, 1, 3328]
    - [0, 0.62]
  - - [1, 64, 1, 1280]
    - [1, 0.0]
  - - [1, 2944, 1, 3328]
    - [2, 0.024]
  - - [64, 128, 1, 256]
    - [3, 0.047]
  - - [128, 64, 1, 1280]
    - [0, 0.127]
  - - [1, 2368, 1, 1280]
    - [4, 0.014]
  - - [1, 128, 1, 1]
    - [5, 0.0]
  - - [64, 1408, 1, 3328]
    - [0, 2.07]
  - - [64, 1024, 1, 3328]
    - [0, 1.519]
  - - [1, 64, 1, 3328]
    - [6, 0.001]
  - - [64, 448, 1, 1280]
    - [0, 0.537]
  - - [1, 256, 1, 1280]
    - [7, 0.002]
  - - [64, 64, 1, 1280]
    - [0, 0.06]
  - - [64, 5056, 1, 256]
    - [8, 1.621]
  - - [1, 1, 1, 3328]
    - [4, 0.0]
  - - [1, 1408, 1, 1280]
    - [7, 0.008]
  - - [1, 2368, 1, 3328]
    - [9, 0.019]
  - - [1, 64, 1, 1]
    - [5, 0.0]
  - - [1, 128, 1, 1280]
    - [6, 0.001]
  - - [64, 1856, 1, 256]
    - [8, 0.764]
  - - [64, 1024, 1, 1280]
    - [0, 1.118]
  - - [64, 256, 1, 1280]
    - [0, 0.254]
  - - [1, 1024, 1, 256]
    - [9, 0.004]
  - - [1, 704, 1, 3328]
    - [6, 0.006]
  - - [64, 2368, 1, 3328]
    - [8, 3.075]
  - - [64, 3584, 1, 1280]
    - [10, 3.646]
  - - [1, 256, 1, 1]
    - [4, 0.0]
  - - [1, 3584, 1, 1280]
    - [4, 0.021]
  - - [128, 64, 1, 256]
    - [11, 0.048]
  - - [64, 128, 1, 3328]
    - [0, 0.181]
  - - [64, 256, 1, 3328]
    - [0, 0.371]
  - - [1, 1, 1, 256]
    - [12, 0.0]
  - - [1, 2944, 1, 1]
    - [13, 0.0]
  - - [1, 1408, 1, 3328]
    - [9, 0.011]
  - - [64, 2944, 1, 256]
    - [8, 1.181]
  - - [64, 1408, 1, 1280]
    - [0, 1.526]
  - - [64, 2368, 1, 1280]
    - [8, 2.396]
  - - [64, 3584, 1, 3328]
    - [10, 3.465]
  - - [1, 704, 1, 1]
    - [6, 0.0]
  - - [64, 6784, 1, 3328]
    - [14, 6.624]
  - - [1, 704, 1, 1280]
    - [15, 0.004]
  - - [1, 2944, 1, 256]
    - [6, 0.006]
  - - [64, 1856, 1, 3328]
    - [0, 1.746]
  - - [64, 448, 1, 256]
    - [11, 0.093]
  - - [1, 448, 1, 1280]
    - [16, 0.002]
  - - [64, 5056, 1, 3328]
    - [17, 4.866]
  - - [64, 128, 1, 1280]
    - [0, 0.123]
  - - [1, 5056, 1, 256]
    - [6, 0.019]
  - - [1, 1856, 1, 256]
    - [6, 0.007]
  - - [1, 1856, 1, 1280]
    - [7, 0.011]
  - - [1, 1, 1, 1]
    - [18, 0.0]
  - - [256, 64, 1, 256]
    - [19, 0.094]
  - - [1, 4288, 1, 1280]
    - [2, 0.025]
  - - [1, 1408, 1, 1]
    - [7, 0.0]
  - - [64, 6784, 1, 1280]
    - [17, 6.36]
  - - [64, 1856, 1, 1280]
    - [3, 1.886]
  - - [64, 6784, 1, 256]
    - [20, 2.662]
  - - [64, 5056, 1, 1280]
    - [21, 4.721]
  - - [1, 448, 1, 3328]
    - [2, 0.004]
  - - [64, 4288, 1, 256]
    - [14, 1.627]
  - - [1, 1408, 1, 256]
    - [6, 0.005]
  - - [1, 2368, 1, 256]
    - [6, 0.009]
  - - [1, 4288, 1, 1]
    - [22, 0.0]
  - - [1, 128, 1, 256]
    - [4, 0.0]
  - - [64, 5888, 1, 3328]
    - [23, 5.872]
  - - [1, 1024, 1, 3328]
    - [6, 0.008]
  - - [1, 1856, 1, 3328]
    - [6, 0.015]
  - - [64, 1024, 1, 256]
    - [0, 0.406]
  - - [64, 256, 1, 256]
    - [3, 0.095]
  - - [1, 4288, 1, 3328]
    - [9, 0.035]
  - - [1, 1024, 1, 1280]
    - [18, 0.006]
  - - [1, 2368, 1, 1]
    - [15, 0.0]
  - - [1, 3584, 1, 3328]
    - [2, 0.029]
  - - [1, 1, 1, 1280]
    - [24, 0.0]
  - - [64, 704, 1, 256]
    - [0, 0.253]
  - - [64, 2944, 1, 3328]
    - [8, 3.779]
  - - [64, 64, 1, 256]
    - [0, 0.024]
  - - [1, 5056, 1, 1]
    - [13, 0.0]
  - - [128, 64, 1, 3328]
    - [0, 0.175]
  - - [1, 448, 1, 256]
    - [15, 0.002]
  - - [1, 3584, 1, 256]
    - [15, 0.013]
  - - [64, 4288, 1, 1280]
    - [25, 3.966]
  - - [1, 1024, 1, 1]
    - [26, 0.0]
  - - [64, 2944, 1, 1280]
    - [8, 2.746]
  - - [64, 5888, 1, 1280]
    - [17, 5.499]
  - - [64, 704, 1, 3328]
    - [0, 1.029]
  - - [1, 256, 1, 256]
    - [9, 0.001]
  - - [64, 1408, 1, 256]
    - [0, 0.581]
  - - [64, 2368, 1, 256]
    - [21, 0.923]
  - - [64, 3584, 1, 256]
    - [17, 1.421]
  - - [1, 5056, 1, 1280]
    - [27, 0.03]
  - - [1, 3584, 1, 1]
    - [12, 0.0]
  - - [1, 704, 1, 256]
    - [9, 0.003]
  - - [1, 128, 1, 3328]
    - [9, 0.001]
  - - [1, 2944, 1, 1280]
    - [9, 0.017]
  - - [64, 4288, 1, 3328]
    - [25, 4.196]
  - - [64, 64, 1, 3328]
    - [0, 0.09]
  - - [1, 448, 1, 1]
    - [28, 0.0]
  - - [1, 64, 1, 256]
    - [6, 0.0]
  - - [64, 5888, 1, 256]
    - [25, 2.284]
  - - [64, 704, 1, 1280]
    - [0, 0.698]
  - - [1, 1856, 1, 1]
    - [24, 0.0]
  - - [1, 256, 1, 3328]
    - [2, 0.002]
  - - [1, 4288, 1, 256]
    - [24, 0.016]
  - - [1024, 1024, 1, 1024]
    - [29, 7.768]
  - - [64, 160, 2048, 851]
    - [30, 25.744]
  - - [64, 160, 2048, 379]
    - [31, 25.3]
- null
