library/src/blas3/Tensile/Logic/asm_full/arcturus/arcturus_Cijk_Alik_Bjlk_SB.yaml
- {MinimumRequiredVersion: 4.6.0}
- arcturus
- gfx908
- [Device 7380, Device 7388, Device 738c, Device 7390]
    SolutionIndex: 0
    SolutionNameMin: Cijk_Alik_Bjlk_SB_MT16x16x16_SN_AMAS3_BL1_DTL0_EPS1_GRVW2_GSU2_ISA908_KLA_LRVW2_MAC_NLCA1_NLCB1_PGR1_TT2_2_TLDS0_USFGRO1_VS1_VW2_WG8_8_4_WGM1
    SolutionIndex: 1
    SolutionNameMin: Cijk_Alik_Bjlk_SB_MT16x16x16_SN_AMAS3_BL1_DTL0_EPS1_GRVW2_GSU8_ISA908_KLA_LRVW2_MAC_NLCA1_NLCB1_PGR1_TT2_2_TLDS0_USFGRO1_VS1_VW2_WG8_8_4_WGM1
    SolutionIndex: 2
    SolutionNameMin: Cijk_Alik_Bjlk_SB_MT16x32x32_SN_AMAS3_BL1_DTL0_EPS1_GRVW4_GSU4_ISA908_KLA_LRVW4_MAC_NLCA1_NLCB1_PGR1_TT4_4_TLDS0_USFGRO0_VS1_VW4_WG4_8_4_WGM4
    SolutionIndex: 3
    SolutionNameMin: Cijk_Alik_Bjlk_SB_MT32x128x16_MI32x32x2x1_SE_AMAS0_BL1_DTL0_EPS1_GRVW1_GSU1_ISA908_KLA_LRVW1_MAC_NLCA1_NLCB1_PGR1_TT1_32_TLDS0_USFGROn1_VSn1_VW1_WG16_16_1_WGM16
    SolutionIndex: 4
    SolutionNameMin: Cijk_Alik_Bjlk_SB_MT64x128x8_MI32x32x1x2_SE_AMAS0_BL1_DTL0_EPS1_GRVW1_GSU1_ISA908_KLA_LRVW1_MAC_NLCA1_NLCB1_PGR1_TT1_32_TLDS0_USFGROn1_VSn1_VW1_WG64_4_1_WGM8
    SolutionIndex: 5
    SolutionNameMin: Cijk_Alik_Bjlk_SB_MT32x32x16_SN_AMAS3_BL1_DTL0_EPS1_GRVW4_GSU4_ISA908_KLA_LRVW4_MAC_NLCA1_NLCB1_PGR1_TT4_4_TLDS0_USFGRO0_VS1_VW4_WG8_8_2_WGM1
    SolutionIndex: 6
    SolutionNameMin: Cijk_Alik_Bjlk_SB_MT64x128x8_MI32x32x1x2_SE_AMAS0_BL1_DTL0_EPS1_GRVW1_GSU1_ISA908_KLA_LRVW1_MAC_NLCA1_NLCB1_PGR1_TT1_32_TLDS1_USFGROn1_VSn1_VW1_WG64_4_1_WGM4
    SolutionIndex: 7
    SolutionNameMin: Cijk_Alik_Bjlk_SB_MT8x16x32_SN_AMAS3_BL1_DTL0_EPS1_GRVW2_GSU4_ISA908_KLA_LRVW2_MAC_NLCA1_NLCB1_PGR1_TT2_2_TLDS0_USFGRO0_VS1_VW2_WG4_8_4_WGM1
    SolutionIndex: 8
    SolutionNameMin: Cijk_Alik_Bjlk_SB_MT32x128x16_MI32x32x2x1_SE_AMAS0_BL1_DTL0_EPS1_GRVW1_GSU1_ISA908_KLA_LRVW1_MAC_NLCA1_NLCB1_PGR1_TT1_32_TLDS0_USFGROn1_VSn1_VW1_WG16_16_1_WGM8
    SolutionIndex: 9
    SolutionNameMin: Cijk_Alik_Bjlk_SB_MT8x8x8_SN_AMAS3_BL1_DTL0_EPS1_GRVW2_GSU8_ISA908_KLA_LRVW2_MAC_NLCA1_NLCB1_PGR1_TT2_2_TLDS0_USFGRO1_VS1_VW2_WG4_4_4_WGM1
    SolutionIndex: 10
    SolutionNameMin: Cijk_Alik_Bjlk_SB_MT128x128x8_MI32x32x1x2_SE_AMAS0_BL1_DTL0_EPS1_GRVW1_GSU1_ISA908_KLA_LRVW1_MAC_NLCA1_NLCB1_PGR1_TT2_32_TLDS0_USFGROn1_VSn1_VW1_WG64_4_1_WGM4
    SolutionIndex: 11
    SolutionNameMin: Cijk_Alik_Bjlk_SB_MT64x64x16_SN_AMAS3_BL1_DTL0_EPS1_GRVW4_GSU1_ISA908_KLA_LRVW4_MAC_NLCA1_NLCB1_PGR1_TT4_4_TLDS0_USFGRO0_VS1_VW4_WG16_16_1_WGM4
    SolutionIndex: 12
    SolutionNameMin: Cijk_Alik_Bjlk_SB_MT64x128x8_MI32x32x1x2_SE_AMAS0_BL1_DTL1_EPS1_GRVW1_GSU1_ISA908_KLA_LRVW1_MAC_NLCA1_NLCB1_PGR1_TT1_32_TLDS1_USFGROn1_VSn1_VW1_WG64_4_1_WGM4
    SolutionIndex: 13
    SolutionNameMin: Cijk_Alik_Bjlk_SB_MT64x64x32_SN_AMAS3_BL1_DTL0_EPS0_GRVW4_GSU1_ISA908_KLA_LRVW4_MAC_NLCA1_NLCB1_PGR0_TT4_4_TLDS0_USFGRO0_VS1_VW4_WG16_16_1_WGM4
    SolutionIndex: 14
    SolutionNameMin: Cijk_Alik_Bjlk_SB_MT64x256x8_MI32x32x1x2_SE_AMAS0_BL1_DTL1_EPS1_GRVW1_GSU1_ISA908_KLA_LRVW1_MAC_NLCA1_NLCB1_PGR1_TT2_32_TLDS0_USFGROn1_VSn1_VW1_WG16_16_1_WGM16
    SolutionIndex: 15
    SolutionNameMin: Cijk_Alik_Bjlk_SB_MT16x32x8_SN_AMAS2_BL0_DTL0_EPS0_GRVW2_GSU1_ISA000_KLS_LRVW2_FMA_NLCA1_NLCB1_PGR1_TT2_2_TLDS0_USFGRO0_VS1_VW2_WG8_16_1_WGM1
    SolutionIndex: 16
    SolutionNameMin: Cijk_Alik_Bjlk_SB_MT64x128x8_MI32x32x1x2_SE_AMAS0_BL1_DTL0_EPS1_GRVW1_GSU1_ISA908_KLA_LRVW1_MAC_NLCA1_NLCB1_PGR1_TT1_32_TLDS0_USFGROn1_VSn1_VW1_WG64_4_1_WGM4
    SolutionIndex: 17
    SolutionNameMin: Cijk_Alik_Bjlk_SB_MT8x16x16_SN_AMAS3_BL1_DTL0_EPS1_GRVW2_GSU2_ISA908_KLA_LRVW2_MAC_NLCA1_NLCB1_PGR1_TT2_2_TLDS0_USFGRO0_VS1_VW2_WG4_8_4_WGM4
    SolutionIndex: 18
    SolutionNameMin: Cijk_Alik_Bjlk_SB_MT64x64x16_SN_AMAS3_BL1_DTL0_EPS1_GRVW4_GSU1_ISA908_KLA_LRVW4_MAC_NLCA1_NLCB1_PGR1_TT4_4_TLDS0_USFGRO0_VS1_VW4_WG16_16_1_WGM1
    SolutionIndex: 19
    SolutionNameMin: Cijk_Alik_Bjlk_SB_MT16x64x16_SN_AMAS3_BL1_DTL0_EPS1_GRVW2_GSU4_ISA908_KLA_LRVW2_MAC_NLCA1_NLCB1_PGR1_TT2_4_TLDS0_USFGRO0_VS1_VW2_WG8_16_2_WGM1
    SolutionIndex: 20
    SolutionNameMin: Cijk_Alik_Bjlk_SB_MT32x64x32_SN_AMAS3_BL1_DTL0_EPS1_GRVW4_GSU4_ISA908_KLA_LRVW4_MAC_NLCA1_NLCB1_PGR1_TT4_4_TLDS0_USFGRO0_VS1_VW4_WG8_16_2_WGM1
    SolutionIndex: 21
    SolutionNameMin: Cijk_Alik_Bjlk_SB_MT8x8x8_SN_AMAS3_BL1_DTL0_EPS1_GRVW2_GSU2_ISA908_KLA_LRVW2_MAC_NLCA1_NLCB1_PGR1_TT2_2_TLDS0_USFGRO1_VS1_VW2_WG4_4_4_WGM1
    SolutionIndex: 22
    SolutionNameMin: Cijk_Alik_Bjlk_SB_MT64x128x16_SN_AMAS3_BL1_DTL0_EPS0_GRVW4_GSU1_ISA908_KLA_LRVW4_MAC_NLCA1_NLCB1_PGR0_TT4_8_TLDS0_USFGRO0_VS1_VW4_WG16_16_1_WGM1
    SolutionIndex: 23
    SolutionNameMin: Cijk_Alik_Bjlk_SB_MT16x16x16_SN_AMAS3_BL1_DTL0_EPS1_GRVW2_GSU4_ISA908_KLA_LRVW2_MAC_NLCA1_NLCB1_PGR1_TT2_2_TLDS0_USFGRO1_VS1_VW2_WG8_8_4_WGM1
    SolutionIndex: 24
    SolutionNameMin: Cijk_Alik_Bjlk_SB_MT16x16x8_SN_AMAS3_BL1_DTL0_EPS1_GRVW2_GSU8_ISA908_KLA_LRVW2_MAC_NLCA1_NLCB1_PGR1_TT2_2_TLDS0_USFGRO1_VS1_VW2_WG8_8_2_WGM1
    SolutionIndex: 25
    SolutionNameMin: Cijk_Alik_Bjlk_SB_MT8x8x8_SN_AMAS3_BL1_DTL0_EPS1_GRVW2_GSU16_ISA908_KLA_LRVW2_MAC_NLCA1_NLCB1_PGR1_TT2_2_TLDS0_USFGRO1_VS1_VW2_WG4_4_4_WGM1
    SolutionIndex: 26
    SolutionNameMin: Cijk_Alik_Bjlk_SB_MT8x16x16_SN_AMAS3_BL1_DTL0_EPS1_GRVW2_GSU8_ISA908_KLA_LRVW2_MAC_NLCA1_NLCB1_PGR1_TT2_2_TLDS0_USFGRO0_VS1_VW2_WG4_8_4_WGM1
    SolutionIndex: 27
    SolutionNameMin: Cijk_Alik_Bjlk_SB_MT8x32x32_SN_AMAS3_BL1_DTL0_EPS1_GRVW2_GSU2_ISA908_KLA_LRVW2_MAC_NLCA1_NLCB1_PGR1_TT2_4_TLDS0_USFGRO0_VS1_VW2_WG4_8_4_WGM4
    SolutionIndex: 28
    SolutionNameMin: Cijk_Alik_Bjlk_SB_MT32x128x8_MI32x32x2x1_SE_AMAS0_BL1_DTL0_EPS1_GRVW1_GSU1_ISA908_KLA_LRVW1_MAC_NLCA1_NLCB1_PGR1_TT1_32_TLDS0_USFGROn1_VSn1_VW1_WG16_16_1_WGM4
    SolutionIndex: 29
    SolutionNameMin: Cijk_Alik_Bjlk_SB_MT16x32x32_SN_AMAS3_BL1_DTL0_EPS1_GRVW4_GSU2_ISA908_KLA_LRVW4_MAC_NLCA1_NLCB1_PGR1_TT4_4_TLDS0_USFGRO0_VS1_VW4_WG4_8_4_WGM4
    SolutionIndex: 30
    SolutionNameMin: Cijk_Alik_Bjlk_SB_MT32x64x16_SN_AMAS3_BL1_DTL0_EPS1_GRVW4_GSU4_ISA908_KLA_LRVW4_MAC_NLCA1_NLCB1_PGR1_TT4_8_TLDS0_USFGRO0_VS1_VW4_WG8_8_2_WGM4
    SolutionIndex: 31
    SolutionNameMin: Cijk_Alik_Bjlk_SB_MT16x16x8_SN_AMAS2_BL0_DTL0_EPS0_GRVW2_GSU1_ISA000_KLS_LRVW2_FMA_NLCA1_NLCB1_PGR1_TT2_2_TLDS0_USFGRO0_VS1_VW2_WG8_8_1_WGM4
    SolutionIndex: 32
    SolutionNameMin: Cijk_Alik_Bjlk_SB_MT16x32x16_SN_AMAS3_BL1_DTL0_EPS1_GRVW2_GSU2_ISA908_KLA_LRVW2_MAC_NLCA1_NLCB1_PGR1_TT2_4_TLDS0_USFGRO0_VS1_VW2_WG8_8_2_WGM1
    SolutionIndex: 33
    SolutionNameMin: Cijk_Alik_Bjlk_SB_MT64x64x16_SN_AMAS3_BL1_DTL0_EPS0_GRVW4_GSU1_ISA908_KLA_LRVW4_MAC_NLCA1_NLCB1_PGR0_TT4_4_TLDS0_USFGRO0_VS1_VW4_WG16_16_1_WGM4
    SolutionIndex: 34
    SolutionNameMin: Cijk_Alik_Bjlk_SB_MT64x256x8_MI32x32x1x2_SE_AMAS0_BL1_DTL0_EPS1_GRVW1_GSU1_ISA908_KLA_LRVW1_MAC_NLCA1_NLCB1_PGR1_TT2_32_TLDS0_USFGROn1_VSn1_VW1_WG16_16_1_WGM8
    SolutionIndex: 35
    SolutionNameMin: Cijk_Alik_Bjlk_SB_MT32x32x16_SN_AMAS3_BL1_DTL0_EPS1_GRVW4_GSU2_ISA908_KLA_LRVW4_MAC_NLCA1_NLCB1_PGR1_TT4_4_TLDS0_USFGRO0_VS1_VW4_WG8_8_2_WGM4
    SolutionIndex: 36
    SolutionNameMin: Cijk_Alik_Bjlk_SB_MT64x64x32_SN_AMAS3_BL1_DTL0_EPS1_GRVW4_GSU2_ISA908_KLA_LRVW4_MAC_NLCA1_NLCB1_PGR1_TT4_8_TLDS0_USFGRO0_VS1_VW4_WG16_8_4_WGM4
    SolutionIndex: 37
    SolutionNameMin: Cijk_Alik_Bjlk_SB_MT32x32x16_SN_AMAS3_BL1_DTL0_EPS1_GRVW4_GSU2_ISA908_KLA_LRVW4_MAC_NLCA1_NLCB1_PGR1_TT4_4_TLDS0_USFGRO0_VS1_VW4_WG8_8_2_WGM1
    SolutionIndex: 38
    SolutionNameMin: Cijk_Alik_Bjlk_SB_MT8x16x32_SN_AMAS3_BL1_DTL0_EPS1_GRVW2_GSU4_ISA908_KLA_LRVW2_MAC_NLCA1_NLCB1_PGR1_TT2_2_TLDS0_USFGRO0_VS1_VW2_WG4_8_4_WGM4
    SolutionIndex: 39
    SolutionNameMin: Cijk_Alik_Bjlk_SB_MT8x32x16_SN_AMAS3_BL1_DTL0_EPS1_GRVW2_GSU8_ISA908_KLA_LRVW2_MAC_NLCA1_NLCB1_PGR1_TT2_4_TLDS0_USFGRO0_VS1_VW2_WG4_8_4_WGM4
    SolutionIndex: 40
    SolutionNameMin: Cijk_Alik_Bjlk_SB_MT64x256x8_MI32x32x1x2_SE_AMAS0_BL1_DTL1_EPS1_GRVW1_GSU1_ISA908_KLA_LRVW1_MAC_NLCA1_NLCB1_PGR1_TT1_64_TLDS1_USFGROn1_VSn1_VW1_WG64_4_1_WGM8
    SolutionIndex: 41
    SolutionNameMin: Cijk_Alik_Bjlk_SB_MT32x64x16_SN_AMAS3_BL1_DTL0_EPS1_GRVW4_GSU2_ISA908_KLA_LRVW4_MAC_NLCA1_NLCB1_PGR1_TT4_8_TLDS0_USFGRO0_VS1_VW4_WG8_8_2_WGM1
    SolutionIndex: 42
    SolutionNameMin: Cijk_Alik_Bjlk_SB_MT8x32x32_SN_AMAS3_BL1_DTL0_EPS1_GRVW2_GSU2_ISA908_KLA_LRVW2_MAC_NLCA1_NLCB1_PGR1_TT2_4_TLDS0_USFGRO0_VS1_VW2_WG4_8_4_WGM1
    SolutionIndex: 43
    SolutionNameMin: Cijk_Alik_Bjlk_SB_MT8x16x32_SN_AMAS3_BL1_DTL0_EPS1_GRVW2_GSU8_ISA908_KLA_LRVW2_MAC_NLCA1_NLCB1_PGR1_TT2_2_TLDS0_USFGRO0_VS1_VW2_WG4_8_4_WGM1
    SolutionIndex: 44
    SolutionNameMin: Cijk_Alik_Bjlk_SB_MT8x16x16_SN_AMAS3_BL1_DTL0_EPS1_GRVW2_GSU2_ISA908_KLA_LRVW2_MAC_NLCA1_NLCB1_PGR1_TT2_2_TLDS0_USFGRO0_VS1_VW2_WG4_8_4_WGM1
    SolutionIndex: 45
    SolutionNameMin: Cijk_Alik_Bjlk_SB_MT8x32x32_SN_AMAS3_BL1_DTL0_EPS1_GRVW2_GSU4_ISA908_KLA_LRVW2_MAC_NLCA1_NLCB1_PGR1_TT2_4_TLDS0_USFGRO0_VS1_VW2_WG4_8_4_WGM4
    SolutionIndex: 46
    SolutionNameMin: Cijk_Alik_Bjlk_SB_MT64x256x8_MI32x32x1x2_SE_AMAS0_BL1_DTL1_EPS1_GRVW1_GSU1_ISA908_KLA_LRVW1_MAC_NLCA1_NLCB1_PGR1_TT1_64_TLDS1_USFGROn1_VSn1_VW1_WG64_4_1_WGM4
    SolutionIndex: 47
    SolutionNameMin: Cijk_Alik_Bjlk_SB_MT64x64x16_SN_AMAS3_BL1_DTL0_EPS0_GRVW4_GSU1_ISA908_KLA_LRVW4_MAC_NLCA1_NLCB1_PGR0_TT4_4_TLDS0_USFGRO0_VS1_VW4_WG16_16_1_WGM1
    SolutionIndex: 48
    SolutionNameMin: Cijk_Alik_Bjlk_SB_MT128x256x8_MI32x32x1x2_SE_AMAS0_BL1_DTL1_EPS1_GRVW1_GSU1_ISA908_KLA_LRVW1_MAC_NLCA1_NLCB1_PGR1_TT2_64_TLDS1_USFGROn1_VSn1_VW1_WG64_4_1_WGM4
    SolutionIndex: 49
    SolutionNameMin: Cijk_Alik_Bjlk_SB_MT32x32x32_SN_AMAS3_BL1_DTL0_EPS1_GRVW2_GSU2_ISA908_KLA_LRVW2_MAC_NLCA1_NLCB1_PGR1_TT2_4_TLDS0_USFGRO0_VS1_VW2_WG16_8_4_WGM1
    SolutionIndex: 50
    SolutionNameMin: Cijk_Alik_Bjlk_SB_MT64x256x8_MI32x32x1x2_SE_AMAS0_BL1_DTL1_EPS1_GRVW1_GSU1_ISA908_KLA_LRVW1_MAC_NLCA1_NLCB1_PGR1_TT1_64_TLDS0_USFGROn1_VSn1_VW1_WG64_4_1_WGM16
    SolutionIndex: 51
    SolutionNameMin: Cijk_Alik_Bjlk_SB_MT128x64x16_SN_AMAS3_BL1_DTL0_EPS0_GRVW4_GSU1_ISA908_KLA_LRVW4_MAC_NLCA1_NLCB1_PGR0_TT8_4_TLDS0_USFGRO0_VS1_VW4_WG16_16_1_WGM4
    SolutionIndex: 52
    SolutionNameMin: Cijk_Alik_Bjlk_SB_MT32x64x32_SN_AMAS3_BL1_DTL0_EPS1_GRVW4_GSU2_ISA908_KLA_LRVW4_MAC_NLCA1_NLCB1_PGR1_TT4_4_TLDS0_USFGRO0_VS1_VW4_WG8_16_2_WGM4
    SolutionIndex: 53
    SolutionNameMin: Cijk_Alik_Bjlk_SB_MT128x256x8_MI32x32x1x2_SE_AMAS0_BL1_DTL1_EPS1_GRVW1_GSU1_ISA908_KLA_LRVW1_MAC_NLCA1_NLCB1_PGR1_TT4_32_TLDS0_USFGROn1_VSn1_VW1_WG16_16_1_WGM16
    SolutionIndex: 54
    SolutionNameMin: Cijk_Alik_Bjlk_SB_MT64x128x16_SN_AMAS3_BL1_DTL0_EPS1_GRVW4_GSU1_ISA908_KLA_LRVW4_MAC_NLCA1_NLCB1_PGR1_TT4_8_TLDS0_USFGRO0_VS1_VW4_WG16_16_1_WGM1
    SolutionIndex: 55
    SolutionNameMin: Cijk_Alik_Bjlk_SB_MT32x32x8_SN_AMAS2_BL0_DTL0_EPS0_GRVW2_GSU1_ISA000_KLS_LRVW2_FMA_NLCA1_NLCB1_PGR1_TT2_2_TLDS0_USFGRO0_VS1_VW2_WG16_16_1_WGM1
    SolutionIndex: 56
    SolutionNameMin: Cijk_Alik_Bjlk_SB_MT64x128x16_SN_AMAS3_BL1_DTL0_EPS0_GRVW4_GSU1_ISA908_KLA_LRVW4_MAC_NLCA1_NLCB1_PGR0_TT4_8_TLDS0_USFGRO0_VS1_VW4_WG16_16_1_WGM4
    SolutionIndex: 57
    SolutionNameMin: Cijk_Alik_Bjlk_SB_MT8x8x8_SN_AMAS3_BL1_DTL0_EPS1_GRVW2_GSU4_ISA908_KLA_LRVW2_MAC_NLCA1_NLCB1_PGR1_TT2_2_TLDS0_USFGRO1_VS1_VW2_WG4_4_4_WGM1
    SolutionIndex: 58
    SolutionNameMin: Cijk_Alik_Bjlk_SB_MT128x64x16_SN_AMAS3_BL1_DTL0_EPS1_GRVW4_GSU1_ISA908_KLA_LRVW4_MAC_NLCA1_NLCB1_PGR1_TT8_4_TLDS0_USFGRO0_VS1_VW4_WG16_16_1_WGM1
    SolutionIndex: 59
    SolutionNameMin: Cijk_Alik_Bjlk_SB_MT8x32x16_SN_AMAS3_BL1_DTL0_EPS1_GRVW2_GSU4_ISA908_KLA_LRVW2_MAC_NLCA1_NLCB1_PGR1_TT2_4_TLDS0_USFGRO0_VS1_VW2_WG4_8_4_WGM1
    SolutionIndex: 60
    SolutionNameMin: Cijk_Alik_Bjlk_SB_MT16x16x16_SN_AMAS3_BL1_DTL0_EPS1_GRVW2_GSU16_ISA908_KLA_LRVW2_MAC_NLCA1_NLCB1_PGR1_TT2_2_TLDS0_USFGRO1_VS1_VW2_WG8_8_4_WGM1
    SolutionIndex: 61
    SolutionNameMin: Cijk_Alik_Bjlk_SB_MT128x64x16_SN_AMAS3_BL1_DTL0_EPS0_GRVW4_GSU1_ISA908_KLA_LRVW4_MAC_NLCA1_NLCB1_PGR0_TT8_4_TLDS0_USFGRO0_VS1_VW4_WG16_16_1_WGM1
    SolutionIndex: 62
    SolutionNameMin: Cijk_Alik_Bjlk_SB_MT128x64x16_SN_AMAS3_BL1_DTL0_EPS1_GRVW4_GSU1_ISA908_KLA_LRVW4_MAC_NLCA1_NLCB1_PGR1_TT8_4_TLDS0_USFGRO0_VS1_VW4_WG16_16_1_WGM4
    SolutionIndex: 63
    SolutionNameMin: Cijk_Alik_Bjlk_SB_MT16x32x16_SN_AMAS3_BL1_DTL0_EPS1_GRVW2_GSU2_ISA908_KLA_LRVW2_MAC_NLCA1_NLCB1_PGR1_TT2_2_TLDS0_USFGRO0_VS1_VW2_WG8_16_2_WGM4
    SolutionIndex: 64
    SolutionNameMin: Cijk_Alik_Bjlk_SB_MT32x32x16_SN_AMAS3_BL1_DTL0_EPS1_GRVW4_GSU4_ISA908_KLA_LRVW4_MAC_NLCA1_NLCB1_PGR1_TT4_4_TLDS0_USFGRO0_VS1_VW4_WG8_8_2_WGM4
    SolutionIndex: 65
    SolutionNameMin: Cijk_Alik_Bjlk_SB_MT16x32x16_SN_AMAS3_BL1_DTL0_EPS1_GRVW2_GSU2_ISA908_KLA_LRVW2_MAC_NLCA1_NLCB1_PGR1_TT2_2_TLDS0_USFGRO0_VS1_VW2_WG8_16_2_WGM1
    SolutionIndex: 66
    SolutionNameMin: Cijk_Alik_Bjlk_SB_MT16x32x8_SN_AMAS2_BL0_DTL0_EPS0_GRVW2_GSU1_ISA000_KLS_LRVW2_FMA_NLCA1_NLCB1_PGR1_TT2_2_TLDS0_USFGRO0_VS1_VW2_WG8_16_1_WGM4
    SolutionIndex: 67
    SolutionNameMin: Cijk_Alik_Bjlk_SB_MT64x256x8_MI32x32x1x2_SE_AMAS0_BL1_DTL1_EPS1_GRVW1_GSU1_ISA908_KLA_LRVW1_MAC_NLCA1_NLCB1_PGR1_TT1_64_TLDS0_USFGROn1_VSn1_VW1_WG64_4_1_WGM8
    SolutionIndex: 68
    SolutionNameMin: Cijk_Alik_Bjlk_SB_MT8x16x32_SN_AMAS3_BL1_DTL0_EPS1_GRVW2_GSU2_ISA908_KLA_LRVW2_MAC_NLCA1_NLCB1_PGR1_TT2_2_TLDS0_USFGRO0_VS1_VW2_WG4_8_4_WGM1
    SolutionIndex: 69
    SolutionNameMin: Cijk_Alik_Bjlk_SB_MT16x32x32_SN_AMAS3_BL1_DTL0_EPS1_GRVW4_GSU4_ISA908_KLA_LRVW4_MAC_NLCA1_NLCB1_PGR1_TT4_4_TLDS0_USFGRO0_VS1_VW4_WG4_8_4_WGM1
    SolutionIndex: 70
    SolutionNameMin: Cijk_Alik_Bjlk_SB_MT64x128x16_SN_AMAS3_BL1_DTL0_EPS1_GRVW4_GSU1_ISA908_KLA_LRVW4_MAC_NLCA1_NLCB1_PGR1_TT4_8_TLDS0_USFGRO0_VS1_VW4_WG16_16_1_WGM4
    SolutionIndex: 71
    SolutionNameMin: Cijk_Alik_Bjlk_SB_MT16x16x4_SN_AMAS2_BL0_DTL0_EPS0_GRVW2_GSU1_ISA000_KLS_LRVW2_FMA_NLCA1_NLCB1_PGR1_TT2_2_TLDS0_USFGRO0_VS1_VW2_WG8_8_1_WGM1
    SolutionIndex: 72
    SolutionNameMin: Cijk_Alik_Bjlk_SB_MT64x64x32_SN_AMAS3_BL1_DTL0_EPS1_GRVW4_GSU1_ISA908_KLA_LRVW4_MAC_NLCA1_NLCB1_PGR1_TT4_4_TLDS0_USFGRO0_VS1_VW4_WG16_16_1_WGM4
    SolutionIndex: 73
    SolutionNameMin: Cijk_Alik_Bjlk_SB_MT32x64x32_SN_AMAS3_BL1_DTL0_EPS1_GRVW4_GSU2_ISA908_KLA_LRVW4_MAC_NLCA1_NLCB1_PGR1_TT4_4_TLDS0_USFGRO0_VS1_VW4_WG8_16_2_WGM1
    SolutionIndex: 74
    SolutionNameMin: Cijk_Alik_Bjlk_SB_MT32x16x32_SN_AMAS3_BL1_DTL0_EPS1_GRVW2_GSU4_ISA908_KLA_LRVW2_MAC_NLCA1_NLCB1_PGR1_TT2_2_TLDS0_USFGRO0_VS1_VW2_WG16_8_4_WGM1
    SolutionIndex: 75
    SolutionNameMin: Cijk_Alik_Bjlk_SB_MT32x16x8_SN_AMAS2_BL0_DTL0_EPS0_GRVW2_GSU1_ISA000_KLS_LRVW2_FMA_NLCA1_NLCB1_PGR1_TT2_2_TLDS0_USFGRO0_VS1_VW2_WG16_8_1_WGM1
    SolutionIndex: 76
    SolutionNameMin: Cijk_Alik_Bjlk_SB_MT64x64x32_SN_AMAS3_BL1_DTL0_EPS0_GRVW4_GSU1_ISA908_KLA_LRVW4_MAC_NLCA1_NLCB1_PGR0_TT4_4_TLDS0_USFGRO0_VS1_VW4_WG16_16_1_WGM1
    SolutionIndex: 77
    SolutionNameMin: Cijk_Alik_Bjlk_SB_MT16x64x16_SN_AMAS3_BL1_DTL0_EPS1_GRVW2_GSU2_ISA908_KLA_LRVW2_MAC_NLCA1_NLCB1_PGR1_TT2_4_TLDS0_USFGRO0_VS1_VW2_WG8_16_2_WGM4
    SolutionIndex: 78
    SolutionNameMin: Cijk_Alik_Bjlk_SB_MT8x16x16_SN_AMAS3_BL1_DTL0_EPS1_GRVW2_GSU4_ISA908_KLA_LRVW2_MAC_NLCA1_NLCB1_PGR1_TT2_2_TLDS0_USFGRO0_VS1_VW2_WG4_8_4_WGM1
    SolutionIndex: 79
    SolutionNameMin: Cijk_Alik_Bjlk_SB_MT128x256x8_MI32x32x1x2_SE_AMAS0_BL1_DTL1_EPS1_GRVW1_GSU1_ISA908_KLA_LRVW1_MAC_NLCA1_NLCB1_PGR1_TT2_64_TLDS1_USFGROn1_VSn1_VW1_WG64_4_1_WGM16
    SolutionIndex: 80
    SolutionNameMin: Cijk_Alik_Bjlk_SB_MT64x64x32_SN_AMAS3_BL1_DTL0_EPS1_GRVW4_GSU1_ISA908_KLA_LRVW4_MAC_NLCA1_NLCB1_PGR1_TT4_4_TLDS0_USFGRO0_VS1_VW4_WG16_16_1_WGM1
    SolutionIndex: 81
    SolutionNameMin: Cijk_Alik_Bjlk_SB_MT128x128x16_SN_AMAS3_BL1_DTL0_EPS1_GRVW4_GSU1_ISA908_KLA_LRVW4_MAC_NLCA1_NLCB1_PGR1_TT8_8_TLDS0_USFGRO0_VS1_VW4_WG16_16_1_WGM1
- - - [1024, 128, 1, 128]
    - [0, 1.688]
  - - [4, 704, 1, 1280]
    - [1, 0.37]
  - - [4, 1856, 1, 3328]
    - [2, 2.036]
  - - [1856, 448, 1, 3328]
    - [3, 42.073]
  - - [2944, 4288, 1, 1280]
    - [4, 67.268]
  - - [2368, 64, 1, 3328]
    - [5, 17.419]
  - - [2368, 5888, 1, 256]
    - [6, 39.12]
  - - [128, 64, 1, 256]
    - [7, 0.207]
  - - [5888, 1024, 1, 1280]
    - [4, 57.564]
  - - [128, 6784, 1, 3328]
    - [8, 44.523]
  - - [64, 4, 1, 256]
    - [9, 0.009]
  - - [5888, 1856, 1, 3328]
    - [10, 76.326]
  - - [5056, 704, 1, 256]
    - [10, 28.837]
  - - [5888, 2944, 1, 3328]
    - [10, 83.69]
  - - [1856, 4288, 1, 256]
    - [6, 31.853]
  - - [1024, 5056, 1, 128]
    - [11, 26.599]
  - - [5056, 5056, 1, 3328]
    - [10, 80.898]
  - - [1408, 5888, 1, 1280]
    - [12, 65.336]
  - - [2368, 448, 1, 128]
    - [13, 10.028]
  - - [1024, 3584, 1, 3328]
    - [14, 68.203]
  - - [4, 2944, 1, 1280]
    - [9, 1.121]
  - - [1408, 64, 1, 128]
    - [15, 1.013]
  - - [256, 4288, 1, 3328]
    - [12, 39.923]
  - - [5888, 1408, 1, 1280]
    - [16, 65.413]
  - - [704, 1856, 1, 3328]
    - [12, 46.974]
  - - [4, 1408, 1, 128]
    - [17, 0.086]
  - - [1024, 2368, 1, 256]
    - [18, 25.967]
  - - [1408, 1856, 1, 1280]
    - [4, 50.704]
  - - [1408, 64, 1, 1280]
    - [19, 7.49]
  - - [448, 1024, 1, 1280]
    - [3, 23.909]
  - - [256, 1408, 1, 3328]
    - [20, 22.021]
  - - [5056, 5056, 1, 1280]
    - [10, 71.562]
  - - [448, 5056, 1, 256]
    - [11, 25.371]
  - - [704, 1856, 1, 1280]
    - [12, 39.831]
  - - [128, 5056, 1, 128]
    - [11, 7.489]
  - - [2368, 128, 1, 256]
    - [8, 7.562]
  - - [1856, 1408, 1, 128]
    - [16, 20.575]
  - - [64, 5056, 1, 256]
    - [3, 7.627]
  - - [6784, 256, 1, 3328]
    - [12, 64.517]
  - - [6784, 4288, 1, 3328]
    - [10, 81.295]
  - - [4288, 448, 1, 256]
    - [11, 24.357]
  - - [64, 704, 1, 128]
    - [21, 0.542]
  - - [1856, 2368, 1, 3328]
    - [12, 63.046]
  - - [4288, 2944, 1, 1280]
    - [4, 70.086]
  - - [704, 5056, 1, 1280]
    - [4, 56.488]
  - - [2368, 704, 1, 3328]
    - [12, 60.37]
  - - [256, 5888, 1, 256]
    - [8, 22.793]
  - - [1856, 4288, 1, 3328]
    - [4, 68.917]
  - - [256, 2944, 1, 256]
    - [3, 15.675]
  - - [5888, 1024, 1, 256]
    - [22, 29.456]
  - - [448, 64, 1, 1280]
    - [23, 3.146]
  - - [448, 5056, 1, 3328]
    - [4, 53.184]
  - - [3584, 4, 1, 1280]
    - [24, 1.185]
  - - [2944, 64, 1, 256]
    - [8, 4.181]
  - - [128, 4, 1, 1280]
    - [25, 0.068]
  - - [1408, 2944, 1, 256]
    - [3, 32.21]
  - - [256, 1856, 1, 1280]
    - [8, 24.069]
  - - [6784, 5056, 1, 3328]
    - [10, 85.241]
  - - [5056, 5056, 1, 256]
    - [10, 47.058]
  - - [1408, 6784, 1, 128]
    - [10, 28.483]
  - - [64, 1024, 1, 1280]
    - [1, 4.906]
  - - [2944, 4, 1, 256]
    - [9, 0.328]
  - - [704, 5056, 1, 128]
    - [11, 22.619]
  - - [4, 2368, 1, 1280]
    - [26, 0.974]
  - - [2368, 2944, 1, 1280]
    - [10, 62.111]
  - - [128, 3584, 1, 1280]
    - [3, 26.112]
  - - [6784, 6784, 1, 1280]
    - [10, 79.736]
  - - [1024, 256, 1, 3328]
    - [3, 16.135]
  - - [1408, 4288, 1, 1280]
    - [16, 60.574]
  - - [3584, 4288, 1, 1280]
    - [10, 73.903]
  - - [2368, 704, 1, 1280]
    - [16, 40.196]
  - - [5056, 4288, 1, 3328]
    - [10, 79.441]
  - - [3584, 2368, 1, 3328]
    - [16, 72.093]
  - - [64, 704, 1, 1280]
    - [27, 4.417]
  - - [4288, 256, 1, 256]
    - [28, 18.036]
  - - [2944, 128, 1, 128]
    - [3, 5.034]
  - - [6784, 448, 1, 1280]
    - [10, 42.789]
  - - [1408, 2944, 1, 128]
    - [18, 23.154]
  - - [4288, 2944, 1, 256]
    - [4, 39.69]
  - - [5888, 704, 1, 1280]
    - [4, 50.733]
  - - [1856, 64, 1, 1280]
    - [29, 9.907]
  - - [448, 5888, 1, 128]
    - [16, 20.541]
  - - [5888, 64, 1, 3328]
    - [30, 19.218]
  - - [2944, 256, 1, 3328]
    - [8, 39.043]
  - - [1024, 64, 1, 128]
    - [31, 0.925]
  - - [5056, 2368, 1, 1280]
    - [10, 65.11]
  - - [448, 3584, 1, 1280]
    - [12, 48.633]
  - - [6784, 5888, 1, 256]
    - [10, 51.267]
  - - [64, 1024, 1, 3328]
    - [29, 10.143]
  - - [704, 128, 1, 1280]
    - [29, 7.792]
  - - [5888, 2944, 1, 128]
    - [4, 31.847]
  - - [4, 3584, 1, 128]
    - [32, 0.192]
  - - [1408, 448, 1, 1280]
    - [8, 28.843]
  - - [1024, 1408, 1, 256]
    - [28, 20.921]
  - - [2368, 2368, 1, 3328]
    - [12, 69.337]
  - - [1856, 6784, 1, 128]
    - [33, 29.174]
  - - [5056, 704, 1, 3328]
    - [34, 63.58]
  - - [1408, 1856, 1, 256]
    - [8, 26.608]
  - - [1408, 704, 1, 3328]
    - [28, 35.508]
  - - [2368, 5056, 1, 256]
    - [8, 35.823]
  - - [5888, 1856, 1, 256]
    - [12, 34.573]
  - - [4288, 64, 1, 3328]
    - [35, 20.667]
  - - [2368, 4, 1, 1280]
    - [9, 1.023]
  - - [704, 5888, 1, 256]
    - [3, 30.925]
  - - [4288, 64, 1, 256]
    - [11, 4.649]
  - - [6784, 64, 1, 256]
    - [11, 10.129]
  - - [2944, 256, 1, 256]
    - [8, 14.697]
  - - [2944, 6784, 1, 3328]
    - [10, 80.352]
  - - [704, 1408, 1, 3328]
    - [28, 36.115]
  - - [3584, 704, 1, 3328]
    - [16, 60.872]
  - - [2944, 256, 1, 128]
    - [3, 8.424]
  - - [6784, 4, 1, 1280]
    - [1, 1.807]
  - - [1024, 64, 1, 1280]
    - [0, 4.575]
  - - [448, 4288, 1, 256]
    - [3, 22.694]
  - - [64, 3584, 1, 3328]
    - [36, 21.918]
  - - [704, 2368, 1, 1280]
    - [16, 45.556]
  - - [448, 2944, 1, 128]
    - [11, 14.156]
  - - [1856, 2368, 1, 1280]
    - [12, 54.082]
  - - [2368, 128, 1, 3328]
    - [37, 22.441]
  - - [2944, 128, 1, 256]
    - [3, 7.34]
  - - [448, 1408, 1, 256]
    - [3, 13.825]
  - - [1856, 4288, 1, 1280]
    - [12, 60.813]
  - - [64, 5056, 1, 3328]
    - [8, 22.816]
  - - [4, 704, 1, 256]
    - [38, 0.084]
  - - [1024, 448, 1, 128]
    - [11, 5.051]
  - - [704, 4, 1, 1280]
    - [38, 0.322]
  - - [704, 256, 1, 128]
    - [28, 2.448]
  - - [704, 2944, 1, 128]
    - [11, 15.862]
  - - [1408, 1024, 1, 1280]
    - [12, 44.675]
  - - [704, 6784, 1, 256]
    - [3, 33.008]
  - - [6784, 704, 1, 256]
    - [10, 31.628]
  - - [5056, 1408, 1, 128]
    - [11, 27.533]
  - - [256, 3584, 1, 3328]
    - [8, 44.826]
  - - [4, 5888, 1, 3328]
    - [39, 3.237]
  - - [128, 1408, 1, 128]
    - [28, 2.562]
  - - [3584, 4288, 1, 3328]
    - [10, 82.231]
  - - [5888, 1856, 1, 1280]
    - [10, 68.432]
  - - [5056, 1024, 1, 3328]
    - [40, 68.308]
  - - [5056, 64, 1, 1280]
    - [41, 15.679]
  - - [1024, 704, 1, 256]
    - [28, 13.581]
  - - [1024, 4288, 1, 128]
    - [18, 24.178]
  - - [4288, 64, 1, 1280]
    - [35, 13.862]
  - - [2368, 3584, 1, 1280]
    - [12, 64.625]
  - - [2368, 6784, 1, 1280]
    - [10, 70.722]
  - - [1024, 256, 1, 256]
    - [3, 6.788]
  - - [1856, 4, 1, 1280]
    - [9, 0.923]
  - - [448, 448, 1, 256]
    - [8, 4.742]
  - - [2944, 3584, 1, 3328]
    - [10, 75.618]
  - - [128, 4288, 1, 128]
    - [8, 6.402]
  - - [64, 448, 1, 256]
    - [42, 0.863]
  - - [128, 1024, 1, 3328]
    - [5, 14.661]
  - - [4, 1408, 1, 3328]
    - [43, 1.669]
  - - [6784, 2944, 1, 256]
    - [10, 46.367]
  - - [64, 1856, 1, 1280]
    - [29, 9.952]
  - - [64, 1024, 1, 128]
    - [44, 1.03]
  - - [4288, 2368, 1, 3328]
    - [4, 72.73]
  - - [1856, 2368, 1, 256]
    - [8, 29.726]
  - - [3584, 256, 1, 128]
    - [11, 9.974]
  - - [3584, 6784, 1, 3328]
    - [10, 82.792]
  - - [256, 1024, 1, 256]
    - [3, 6.745]
  - - [4, 6784, 1, 3328]
    - [45, 3.077]
  - - [1024, 5888, 1, 3328]
    - [16, 67.841]
  - - [1024, 128, 1, 1280]
    - [37, 8.65]
  - - [4288, 128, 1, 1280]
    - [3, 25.723]
  - - [5056, 4288, 1, 1280]
    - [10, 73.567]
  - - [5888, 64, 1, 256]
    - [18, 6.409]
  - - [1408, 5056, 1, 1280]
    - [10, 65.335]
  - - [1856, 256, 1, 1280]
    - [8, 27.409]
  - - [64, 5888, 1, 3328]
    - [3, 22.454]
  - - [2944, 5888, 1, 128]
    - [10, 32.736]
  - - [704, 5888, 1, 1280]
    - [3, 51.672]
  - - [2368, 3584, 1, 128]
    - [11, 29.335]
  - - [6784, 5888, 1, 3328]
    - [10, 86.044]
  - - [704, 1024, 1, 1280]
    - [3, 31.361]
  - - [448, 256, 1, 3328]
    - [20, 14.734]
  - - [448, 1856, 1, 128]
    - [11, 9.831]
  - - [128, 1024, 1, 128]
    - [15, 1.903]
  - - [2944, 4, 1, 128]
    - [44, 0.198]
  - - [1024, 704, 1, 1280]
    - [8, 32.681]
  - - [128, 5888, 1, 256]
    - [3, 16.16]
  - - [1024, 5056, 1, 1280]
    - [4, 58.264]
  - - [4288, 1024, 1, 256]
    - [16, 32.768]
  - - [2944, 2368, 1, 128]
    - [11, 29.74]
  - - [704, 704, 1, 3328]
    - [3, 25.466]
  - - [704, 1408, 1, 1280]
    - [28, 35.677]
  - - [5888, 448, 1, 1280]
    - [10, 43.789]
  - - [3584, 256, 1, 3328]
    - [3, 46.68]
  - - [704, 5888, 1, 3328]
    - [12, 60.293]
  - - [704, 1856, 1, 128]
    - [11, 13.79]
  - - [128, 3584, 1, 3328]
    - [8, 27.377]
  - - [4, 4288, 1, 128]
    - [44, 0.277]
  - - [128, 704, 1, 1280]
    - [29, 8.296]
  - - [3584, 2944, 1, 256]
    - [10, 40.076]
  - - [1856, 128, 1, 3328]
    - [36, 22.205]
  - - [4, 64, 1, 1280]
    - [43, 0.036]
  - - [4, 5056, 1, 3328]
    - [44, 2.824]
  - - [128, 2944, 1, 1280]
    - [8, 20.409]
  - - [2368, 1024, 1, 3328]
    - [4, 57.252]
  - - [128, 256, 1, 3328]
    - [2, 6.483]
  - - [1408, 5056, 1, 3328]
    - [10, 73.956]
  - - [1856, 1856, 1, 3328]
    - [40, 64.524]
  - - [3584, 128, 1, 256]
    - [8, 11.172]
  - - [448, 1408, 1, 3328]
    - [8, 32.33]
  - - [2368, 2368, 1, 256]
    - [4, 31.74]
  - - [4288, 4288, 1, 1280]
    - [10, 71.293]
  - - [64, 448, 1, 1280]
    - [45, 3.492]
  - - [1408, 4288, 1, 256]
    - [18, 29.086]
  - - [448, 4, 1, 256]
    - [8, 0.049]
  - - [5888, 448, 1, 128]
    - [18, 19.577]
  - - [448, 4, 1, 1280]
    - [1, 0.263]
  - - [704, 6784, 1, 3328]
    - [16, 69.492]
  - - [5888, 5888, 1, 1280]
    - [10, 80.366]
  - - [5056, 1024, 1, 1280]
    - [46, 56.067]
  - - [448, 5888, 1, 3328]
    - [4, 63.111]
  - - [128, 4, 1, 128]
    - [7, 0.009]
  - - [1024, 2944, 1, 1280]
    - [4, 48.577]
  - - [5056, 5888, 1, 1280]
    - [10, 75.565]
  - - [4288, 5888, 1, 128]
    - [12, 35.138]
  - - [256, 3584, 1, 256]
    - [3, 16.023]
  - - [1408, 3584, 1, 128]
    - [11, 24.158]
  - - [256, 2944, 1, 3328]
    - [8, 36.805]
  - - [448, 3584, 1, 128]
    - [11, 14.007]
  - - [5888, 2944, 1, 1280]
    - [10, 76.543]
  - - [4, 6784, 1, 1280]
    - [21, 1.91]
  - - [2368, 5888, 1, 128]
    - [47, 26.096]
  - - [64, 2944, 1, 128]
    - [28, 2.412]
  - - [3584, 5888, 1, 256]
    - [10, 47.302]
  - - [2368, 704, 1, 128]
    - [11, 14.064]
  - - [3584, 2944, 1, 1280]
    - [12, 66.312]
  - - [3584, 2368, 1, 128]
    - [11, 29.418]
  - - [5056, 704, 1, 128]
    - [11, 21.073]
  - - [448, 2368, 1, 128]
    - [11, 10.835]
  - - [5056, 1408, 1, 3328]
    - [10, 72.171]
  - - [1408, 704, 1, 256]
    - [28, 15.595]
  - - [6784, 1024, 1, 3328]
    - [48, 69.819]
  - - [6784, 2944, 1, 3328]
    - [4, 78.294]
  - - [2944, 5056, 1, 3328]
    - [10, 81.036]
  - - [1856, 1856, 1, 256]
    - [34, 28.827]
  - - [1024, 5888, 1, 128]
    - [11, 25.535]
  - - [6784, 2368, 1, 1280]
    - [10, 70.255]
  - - [256, 4, 1, 128]
    - [49, 0.014]
  - - [4288, 5888, 1, 1280]
    - [14, 75.459]
  - - [4288, 4288, 1, 256]
    - [10, 40.419]
  - - [448, 2944, 1, 3328]
    - [12, 45.512]
  - - [4288, 1856, 1, 1280]
    - [4, 62.786]
  - - [1856, 2944, 1, 3328]
    - [10, 70.962]
  - - [256, 6784, 1, 3328]
    - [12, 62.843]
  - - [64, 5888, 1, 256]
    - [8, 8.919]
  - - [256, 5056, 1, 128]
    - [18, 13.305]
  - - [5056, 1024, 1, 256]
    - [50, 35.705]
  - - [704, 64, 1, 3328]
    - [2, 9.419]
  - - [5056, 1856, 1, 3328]
    - [10, 77.015]
  - - [4, 2944, 1, 3328]
    - [45, 2.544]
  - - [4, 5056, 1, 256]
    - [3, 0.523]
  - - [1856, 1408, 1, 256]
    - [8, 29.207]
  - - [3584, 4, 1, 128]
    - [17, 0.242]
  - - [448, 448, 1, 3328]
    - [36, 18.538]
  - - [6784, 128, 1, 3328]
    - [8, 43.743]
  - - [4288, 1408, 1, 128]
    - [18, 28.137]
  - - [4288, 5056, 1, 256]
    - [16, 43.145]
  - - [1408, 128, 1, 1280]
    - [37, 11.371]
  - - [5056, 256, 1, 3328]
    - [12, 46.72]
  - - [704, 704, 1, 256]
    - [28, 9.897]
  - - [1024, 5888, 1, 1280]
    - [12, 58.97]
  - - [6784, 2368, 1, 128]
    - [33, 30.106]
  - - [4, 5056, 1, 1280]
    - [42, 1.731]
  - - [64, 128, 1, 256]
    - [1, 0.223]
  - - [128, 1856, 1, 1280]
    - [37, 12.893]
  - - [5056, 3584, 1, 256]
    - [46, 40.807]
  - - [1856, 1024, 1, 1280]
    - [50, 45.184]
  - - [6784, 4288, 1, 1280]
    - [10, 73.915]
  - - [1856, 1856, 1, 1280]
    - [12, 56.267]
  - - [6784, 2944, 1, 128]
    - [51, 32.27]
  - - [128, 4288, 1, 3328]
    - [3, 27.356]
  - - [4, 2368, 1, 3328]
    - [45, 2.015]
  - - [5888, 1856, 1, 128]
    - [11, 26.523]
  - - [448, 704, 1, 1280]
    - [3, 18.247]
  - - [2368, 1024, 1, 128]
    - [18, 19.684]
  - - [1024, 448, 1, 3328]
    - [52, 23.794]
  - - [1856, 704, 1, 1280]
    - [12, 42.002]
  - - [5056, 3584, 1, 128]
    - [18, 32.981]
  - - [5888, 5888, 1, 3328]
    - [10, 86.432]
  - - [6784, 1024, 1, 256]
    - [53, 33.472]
  - - [2944, 2368, 1, 256]
    - [11, 32.225]
  - - [256, 448, 1, 256]
    - [8, 2.816]
  - - [5056, 5888, 1, 3328]
    - [10, 82.541]
  - - [1856, 1024, 1, 256]
    - [54, 26.229]
  - - [448, 1408, 1, 1280]
    - [3, 31.284]
  - - [3584, 448, 1, 1280]
    - [6, 37.783]
  - - [1024, 1024, 1, 1280]
    - [12, 34.985]
  - - [448, 5888, 1, 256]
    - [8, 30.011]
  - - [704, 64, 1, 128]
    - [0, 0.715]
  - - [1408, 6784, 1, 3328]
    - [10, 79.055]
  - - [448, 1024, 1, 128]
    - [3, 6.69]
  - - [4288, 704, 1, 128]
    - [18, 18.736]
  - - [128, 1856, 1, 128]
    - [15, 2.564]
  - - [448, 2368, 1, 3328]
    - [28, 39.247]
  - - [5056, 64, 1, 128]
    - [55, 3.093]
  - - [5056, 2944, 1, 256]
    - [10, 42.657]
  - - [6784, 5888, 1, 128]
    - [56, 36.658]
  - - [704, 1024, 1, 256]
    - [3, 13.824]
  - - [1024, 4, 1, 256]
    - [9, 0.13]
  - - [2368, 1856, 1, 256]
    - [8, 29.798]
  - - [128, 6784, 1, 1280]
    - [3, 37.023]
  - - [1408, 3584, 1, 3328]
    - [14, 67.677]
  - - [2368, 6784, 1, 256]
    - [12, 41.219]
  - - [5056, 1408, 1, 1280]
    - [10, 65.877]
  - - [256, 256, 1, 128]
    - [0, 0.936]
  - - [5056, 4288, 1, 128]
    - [18, 33.228]
  - - [1408, 1856, 1, 128]
    - [11, 17.744]
  - - [1408, 5888, 1, 3328]
    - [4, 73.077]
  - - [1856, 256, 1, 256]
    - [8, 9.329]
  - - [6784, 6784, 1, 256]
    - [10, 52.887]
  - - [64, 256, 1, 128]
    - [57, 0.208]
  - - [4288, 2368, 1, 128]
    - [13, 23.297]
  - - [1856, 4288, 1, 128]
    - [11, 28.199]
  - - [256, 4288, 1, 1280]
    - [28, 34.025]
  - - [2368, 2944, 1, 256]
    - [16, 32.254]
  - - [4, 1856, 1, 256]
    - [9, 0.196]
  - - [3584, 1856, 1, 1280]
    - [40, 60.5]
  - - [6784, 6784, 1, 128]
    - [10, 38.195]
  - - [256, 1856, 1, 128]
    - [3, 5.108]
  - - [704, 64, 1, 1280]
    - [1, 3.964]
  - - [5888, 5056, 1, 256]
    - [10, 46.721]
  - - [3584, 448, 1, 256]
    - [58, 21.496]
  - - [448, 4288, 1, 128]
    - [11, 15.916]
  - - [2944, 4288, 1, 3328]
    - [10, 77.479]
  - - [256, 6784, 1, 256]
    - [8, 23.212]
  - - [1408, 4288, 1, 128]
    - [11, 27.206]
  - - [2944, 704, 1, 3328]
    - [16, 49.973]
  - - [128, 448, 1, 256]
    - [0, 1.322]
  - - [3584, 3584, 1, 256]
    - [16, 40.512]
  - - [448, 1408, 1, 128]
    - [3, 6.596]
  - - [128, 256, 1, 1280]
    - [59, 2.672]
  - - [3584, 5056, 1, 256]
    - [10, 44.15]
  - - [6784, 128, 1, 256]
    - [8, 16.773]
  - - [4288, 4, 1, 256]
    - [23, 0.541]
  - - [64, 1408, 1, 3328]
    - [29, 14.996]
  - - [704, 448, 1, 256]
    - [3, 6.968]
  - - [2944, 2368, 1, 1280]
    - [48, 62.42]
  - - [448, 64, 1, 3328]
    - [1, 4.142]
  - - [1408, 3584, 1, 256]
    - [10, 35.374]
  - - [3584, 4, 1, 3328]
    - [5, 1.988]
  - - [6784, 3584, 1, 256]
    - [10, 47.525]
  - - [256, 128, 1, 128]
    - [15, 0.47]
  - - [704, 1408, 1, 128]
    - [3, 8.775]
  - - [4, 2368, 1, 256]
    - [43, 0.242]
  - - [2944, 448, 1, 128]
    - [18, 11.772]
  - - [128, 1408, 1, 256]
    - [8, 3.813]
  - - [4, 2944, 1, 256]
    - [23, 0.285]
  - - [64, 128, 1, 3328]
    - [60, 2.107]
  - - [5056, 2368, 1, 128]
    - [56, 27.849]
  - - [2944, 2944, 1, 3328]
    - [16, 73.971]
  - - [5056, 6784, 1, 256]
    - [12, 48.45]
  - - [1856, 3584, 1, 128]
    - [11, 27.348]
  - - [128, 2944, 1, 128]
    - [3, 4.384]
  - - [1024, 704, 1, 3328]
    - [8, 35.142]
  - - [6784, 448, 1, 256]
    - [18, 26.455]
  - - [3584, 6784, 1, 128]
    - [61, 34.115]
  - - [128, 4288, 1, 256]
    - [3, 9.826]
  - - [704, 448, 1, 3328]
    - [3, 19.379]
  - - [1024, 1024, 1, 3328]
    - [12, 36.149]
  - - [128, 128, 1, 3328]
    - [1, 4.005]
  - - [5056, 1856, 1, 256]
    - [4, 36.004]
  - - [256, 128, 1, 256]
    - [44, 0.916]
  - - [1024, 1856, 1, 256]
    - [62, 24.807]
  - - [4288, 64, 1, 128]
    - [15, 3.387]
  - - [256, 448, 1, 3328]
    - [20, 13.789]
  - - [1408, 6784, 1, 1280]
    - [46, 68.221]
  - - [3584, 3584, 1, 1280]
    - [10, 71.017]
  - - [64, 2368, 1, 1280]
    - [37, 9.871]
  - - [448, 2368, 1, 1280]
    - [12, 34.395]
  - - [5888, 5888, 1, 128]
    - [10, 37.999]
  - - [64, 6784, 1, 3328]
    - [3, 27.024]
  - - [2944, 256, 1, 1280]
    - [3, 33.614]
  - - [5056, 5888, 1, 128]
    - [22, 34.614]
  - - [256, 2368, 1, 128]
    - [18, 7.289]
  - - [5056, 2368, 1, 3328]
    - [4, 73.896]
  - - [2944, 4288, 1, 256]
    - [10, 40.726]
  - - [1408, 3584, 1, 1280]
    - [10, 61.191]
  - - [2368, 64, 1, 256]
    - [63, 3.75]
  - - [64, 448, 1, 3328]
    - [1, 6.125]
  - - [256, 256, 1, 3328]
    - [64, 10.152]
  - - [5888, 4, 1, 128]
    - [21, 0.357]
  - - [1856, 704, 1, 256]
    - [18, 20.529]
  - - [4, 4288, 1, 1280]
    - [57, 1.652]
  - - [1408, 448, 1, 3328]
    - [8, 31.395]
  - - [1024, 4, 1, 3328]
    - [26, 1.131]
  - - [2368, 256, 1, 256]
    - [3, 10.723]
  - - [2368, 6784, 1, 3328]
    - [10, 77.321]
  - - [1856, 1408, 1, 1280]
    - [16, 49.32]
  - - [1856, 448, 1, 1280]
    - [3, 34.811]
  - - [6784, 704, 1, 128]
    - [11, 23.808]
  - - [4, 4, 1, 256]
    - [57, 0.001]
  - - [128, 5888, 1, 128]
    - [8, 8.885]
  - - [1408, 5888, 1, 256]
    - [4, 38.997]
  - - [704, 2944, 1, 1280]
    - [12, 39.299]
  - - [1856, 2368, 1, 128]
    - [11, 23.881]
  - - [256, 64, 1, 256]
    - [0, 0.448]
  - - [1024, 1024, 1, 256]
    - [8, 16.12]
  - - [704, 1856, 1, 256]
    - [3, 18.356]
  - - [64, 6784, 1, 256]
    - [3, 8.855]
  - - [3584, 704, 1, 1280]
    - [16, 48.958]
  - - [256, 128, 1, 1280]
    - [0, 2.652]
  - - [2368, 4, 1, 256]
    - [57, 0.287]
  - - [256, 2368, 1, 1280]
    - [3, 28.78]
  - - [2944, 6784, 1, 128]
    - [16, 30.179]
  - - [3584, 448, 1, 3328]
    - [12, 50.971]
  - - [1408, 4, 1, 256]
    - [9, 0.168]
  - - [704, 2368, 1, 3328]
    - [12, 57.343]
  - - [2944, 448, 1, 256]
    - [18, 18.868]
  - - [1856, 448, 1, 128]
    - [11, 9.414]
  - - [2368, 128, 1, 1280]
    - [3, 16.434]
  - - [256, 5888, 1, 128]
    - [62, 12.536]
  - - [2368, 256, 1, 128]
    - [8, 6.266]
  - - [64, 5056, 1, 1280]
    - [3, 16.805]
  - - [4, 6784, 1, 128]
    - [3, 0.272]
  - - [2944, 2944, 1, 1280]
    - [16, 67.257]
  - - [5888, 2368, 1, 256]
    - [48, 38.993]
  - - [4, 3584, 1, 1280]
    - [39, 1.309]
  - - [1408, 128, 1, 128]
    - [8, 2.561]
  - - [6784, 704, 1, 3328]
    - [4, 62.641]
  - - [128, 64, 1, 1280]
    - [26, 1.155]
  - - [2368, 256, 1, 1280]
    - [8, 27.459]
  - - [4, 448, 1, 3328]
    - [1, 0.475]
  - - [5888, 4288, 1, 128]
    - [18, 33.85]
  - - [4, 5888, 1, 256]
    - [27, 0.591]
  - - [1408, 2944, 1, 3328]
    - [16, 60.09]
  - - [3584, 704, 1, 128]
    - [18, 17.876]
  - - [64, 1024, 1, 256]
    - [0, 1.382]
  - - [5056, 5056, 1, 128]
    - [33, 31.309]
  - - [2368, 448, 1, 1280]
    - [28, 31.997]
  - - [128, 3584, 1, 256]
    - [3, 10.152]
  - - [704, 448, 1, 1280]
    - [8, 16.612]
  - - [448, 5056, 1, 128]
    - [18, 16.348]
  - - [256, 4, 1, 1280]
    - [43, 0.117]
  - - [128, 5056, 1, 256]
    - [8, 10.465]
  - - [1408, 5056, 1, 128]
    - [11, 27.682]
  - - [2944, 3584, 1, 128]
    - [4, 25.11]
  - - [3584, 2368, 1, 256]
    - [61, 31.884]
  - - [5888, 5056, 1, 1280]
    - [10, 76.342]
  - - [2368, 5056, 1, 128]
    - [51, 28.256]
  - - [64, 704, 1, 256]
    - [65, 1.061]
  - - [4288, 256, 1, 1280]
    - [12, 35.364]
  - - [3584, 3584, 1, 3328]
    - [10, 79.075]
  - - [1024, 256, 1, 128]
    - [8, 3.184]
  - - [4, 704, 1, 128]
    - [8, 0.035]
  - - [5888, 6784, 1, 256]
    - [10, 53.262]
  - - [4288, 2944, 1, 3328]
    - [10, 76.735]
  - - [2944, 64, 1, 128]
    - [66, 2.546]
  - - [1856, 64, 1, 256]
    - [0, 2.95]
  - - [4288, 128, 1, 3328]
    - [3, 27.612]
  - - [4288, 704, 1, 1280]
    - [10, 49.372]
  - - [256, 5056, 1, 1280]
    - [12, 37.536]
  - - [1408, 256, 1, 128]
    - [8, 4.333]
  - - [2944, 5888, 1, 3328]
    - [10, 82.32]
  - - [6784, 5888, 1, 1280]
    - [10, 79.441]
  - - [704, 128, 1, 256]
    - [3, 2.097]
  - - [5888, 4288, 1, 1280]
    - [10, 72.955]
  - - [448, 256, 1, 1280]
    - [23, 6.835]
  - - [5888, 3584, 1, 128]
    - [56, 33.374]
  - - [1856, 1856, 1, 128]
    - [11, 20.215]
  - - [5056, 4, 1, 1280]
    - [23, 1.512]
  - - [256, 1408, 1, 1280]
    - [3, 20.307]
  - - [3584, 1024, 1, 3328]
    - [67, 68.194]
  - - [704, 3584, 1, 128]
    - [16, 19.301]
  - - [5888, 448, 1, 3328]
    - [4, 50.464]
  - - [2368, 4288, 1, 1280]
    - [4, 63.509]
  - - [4288, 2944, 1, 128]
    - [56, 27.727]
  - - [1024, 6784, 1, 3328]
    - [10, 70.154]
  - - [128, 2368, 1, 256]
    - [3, 6.96]
  - - [6784, 64, 1, 3328]
    - [3, 21.733]
  - - [5056, 2944, 1, 3328]
    - [10, 80.377]
  - - [448, 128, 1, 256]
    - [44, 1.552]
  - - [2944, 3584, 1, 256]
    - [16, 40.451]
  - - [1408, 1408, 1, 3328]
    - [16, 46.381]
  - - [1856, 128, 1, 1280]
    - [35, 15.061]
  - - [3584, 3584, 1, 128]
    - [11, 29.864]
  - - [64, 3584, 1, 256]
    - [3, 5.956]
  - - [1408, 4, 1, 3328]
    - [25, 1.512]
  - - [128, 2944, 1, 3328]
    - [37, 23.094]
  - - [3584, 704, 1, 256]
    - [11, 24.812]
  - - [2944, 448, 1, 3328]
    - [12, 46.315]
  - - [3584, 1408, 1, 3328]
    - [16, 66.428]
  - - [704, 3584, 1, 1280]
    - [16, 48.901]
  - - [2944, 6784, 1, 1280]
    - [10, 74.287]
  - - [1856, 6784, 1, 256]
    - [12, 40.188]
  - - [4288, 448, 1, 3328]
    - [8, 45.212]
  - - [6784, 4288, 1, 128]
    - [18, 34.111]
  - - [6784, 704, 1, 1280]
    - [4, 53.222]
  - - [256, 4288, 1, 256]
    - [18, 17.408]
  - - [3584, 64, 1, 128]
    - [66, 3.294]
  - - [5888, 1024, 1, 3328]
    - [12, 63.548]
  - - [448, 64, 1, 128]
    - [68, 0.399]
  - - [704, 6784, 1, 1280]
    - [12, 59.957]
  - - [5888, 128, 1, 256]
    - [3, 15.72]
  - - [2368, 448, 1, 3328]
    - [12, 38.556]
  - - [1856, 5056, 1, 3328]
    - [10, 74.913]
  - - [4, 6784, 1, 256]
    - [27, 0.672]
  - - [1024, 3584, 1, 128]
    - [18, 19.697]
  - - [1024, 1408, 1, 128]
    - [11, 12.948]
  - - [2368, 2944, 1, 128]
    - [11, 26.865]
  - - [5056, 64, 1, 256]
    - [15, 5.431]
  - - [4, 448, 1, 1280]
    - [1, 0.257]
  - - [5056, 2944, 1, 128]
    - [13, 28.338]
  - - [5888, 5056, 1, 3328]
    - [10, 83.422]
  - - [1024, 704, 1, 128]
    - [18, 9.491]
  - - [1408, 2368, 1, 128]
    - [11, 21.545]
  - - [5888, 2368, 1, 128]
    - [16, 26.143]
  - - [128, 5056, 1, 3328]
    - [3, 32.468]
  - - [3584, 6784, 1, 1280]
    - [10, 75.164]
  - - [1856, 5888, 1, 256]
    - [67, 36.92]
  - - [256, 256, 1, 256]
    - [23, 1.671]
  - - [256, 64, 1, 128]
    - [68, 0.254]
  - - [4288, 4288, 1, 3328]
    - [10, 79.898]
  - - [4288, 1408, 1, 1280]
    - [12, 61.092]
  - - [3584, 5056, 1, 128]
    - [22, 29.693]
  - - [4, 1024, 1, 3328]
    - [7, 1.118]
  - - [4288, 2368, 1, 256]
    - [40, 32.969]
  - - [2944, 5056, 1, 1280]
    - [10, 71.069]
  - - [448, 6784, 1, 256]
    - [8, 28.099]
  - - [704, 1024, 1, 128]
    - [4, 7.696]
  - - [6784, 2368, 1, 3328]
    - [10, 77.757]
  - - [256, 1024, 1, 1280]
    - [3, 14.666]
  - - [704, 4, 1, 128]
    - [57, 0.037]
  - - [256, 4, 1, 256]
    - [38, 0.035]
  - - [4288, 128, 1, 256]
    - [8, 11.848]
  - - [4288, 1856, 1, 3328]
    - [16, 68.704]
  - - [3584, 448, 1, 128]
    - [18, 16.481]
  - - [256, 4, 1, 3328]
    - [60, 0.296]
  - - [4, 1408, 1, 1280]
    - [7, 0.82]
  - - [3584, 64, 1, 1280]
    - [52, 15.435]
  - - [1408, 448, 1, 128]
    - [11, 7.709]
  - - [3584, 1024, 1, 1280]
    - [14, 59.283]
  - - [1856, 5056, 1, 256]
    - [4, 36.675]
  - - [4, 3584, 1, 256]
    - [11, 0.266]
  - - [1024, 4288, 1, 256]
    - [18, 30.366]
  - - [5888, 3584, 1, 3328]
    - [10, 84.207]
  - - [4, 256, 1, 256]
    - [24, 0.029]
  - - [5056, 3584, 1, 3328]
    - [10, 80.318]
  - - [128, 5888, 1, 1280]
    - [3, 36.872]
  - - [704, 448, 1, 128]
    - [8, 3.944]
  - - [2368, 1408, 1, 1280]
    - [12, 53.512]
  - - [5056, 2944, 1, 1280]
    - [10, 72.165]
  - - [4, 4, 1, 128]
    - [23, 0.0]
  - - [3584, 256, 1, 256]
    - [3, 17.534]
  - - [128, 1856, 1, 3328]
    - [36, 22.061]
  - - [1024, 6784, 1, 256]
    - [12, 32.216]
  - - [4, 128, 1, 256]
    - [9, 0.014]
  - - [64, 64, 1, 1280]
    - [1, 0.53]
  - - [6784, 4, 1, 128]
    - [3, 0.357]
  - - [2944, 1408, 1, 128]
    - [11, 22.882]
  - - [448, 128, 1, 3328]
    - [69, 9.478]
  - - [64, 2944, 1, 3328]
    - [5, 17.676]
  - - [64, 4288, 1, 3328]
    - [3, 16.49]
  - - [5056, 6784, 1, 3328]
    - [10, 84.836]
  - - [128, 2944, 1, 256]
    - [8, 9.312]
  - - [128, 6784, 1, 128]
    - [8, 10.027]
  - - [3584, 4288, 1, 256]
    - [10, 42.019]
  - - [448, 1856, 1, 256]
    - [8, 15.896]
  - - [1856, 6784, 1, 3328]
    - [10, 74.411]
  - - [3584, 128, 1, 3328]
    - [3, 28.321]
  - - [64, 1856, 1, 256]
    - [8, 2.733]
  - - [1024, 448, 1, 1280]
    - [8, 19.602]
  - - [5888, 4288, 1, 256]
    - [10, 45.335]
  - - [4, 448, 1, 128]
    - [43, 0.035]
  - - [5056, 1408, 1, 256]
    - [18, 34.096]
  - - [64, 256, 1, 1280]
    - [1, 2.167]
  - - [3584, 1024, 1, 256]
    - [10, 34.584]
  - - [256, 704, 1, 256]
    - [3, 4.079]
  - - [5888, 5888, 1, 256]
    - [10, 52.818]
  - - [4288, 1024, 1, 1280]
    - [4, 53.541]
  - - [5888, 128, 1, 3328]
    - [8, 37.133]
  - - [448, 6784, 1, 3328]
    - [4, 56.335]
  - - [2944, 1408, 1, 1280]
    - [4, 50.699]
  - - [2944, 1856, 1, 3328]
    - [10, 72.0]
  - - [2368, 64, 1, 128]
    - [0, 2.071]
  - - [2944, 2944, 1, 128]
    - [18, 31.276]
  - - [4, 128, 1, 3328]
    - [1, 0.143]
  - - [3584, 5888, 1, 1280]
    - [10, 75.536]
  - - [64, 4, 1, 128]
    - [23, 0.004]
  - - [6784, 1856, 1, 1280]
    - [10, 68.457]
  - - [2944, 5056, 1, 256]
    - [16, 38.796]
  - - [5888, 256, 1, 3328]
    - [12, 51.484]
  - - [1856, 5888, 1, 3328]
    - [14, 75.148]
  - - [3584, 1408, 1, 256]
    - [10, 38.952]
  - - [704, 3584, 1, 3328]
    - [4, 58.738]
  - - [5056, 448, 1, 1280]
    - [16, 43.328]
  - - [3584, 1856, 1, 3328]
    - [4, 73.001]
  - - [64, 1408, 1, 128]
    - [23, 1.074]
  - - [1408, 704, 1, 1280]
    - [28, 32.436]
  - - [2944, 1024, 1, 256]
    - [10, 30.334]
  - - [1024, 2368, 1, 128]
    - [18, 17.987]
  - - [2368, 4288, 1, 3328]
    - [4, 72.649]
  - - [4, 1408, 1, 256]
    - [23, 0.161]
  - - [1024, 1408, 1, 1280]
    - [12, 44.375]
  - - [64, 64, 1, 256]
    - [1, 0.099]
  - - [704, 256, 1, 3328]
    - [35, 18.955]
  - - [6784, 5056, 1, 256]
    - [10, 49.09]
  - - [4, 4288, 1, 3328]
    - [59, 2.806]
  - - [448, 6784, 1, 128]
    - [18, 19.81]
  - - [4, 704, 1, 3328]
    - [43, 0.9]
  - - [448, 2944, 1, 256]
    - [8, 21.074]
  - - [2944, 6784, 1, 256]
    - [6, 43.206]
  - - [2368, 2368, 1, 1280]
    - [16, 60.955]
  - - [4, 4, 1, 1280]
    - [25, 0.002]
  - - [1856, 3584, 1, 1280]
    - [16, 66.498]
  - - [64, 2944, 1, 256]
    - [3, 4.913]
  - - [3584, 1408, 1, 1280]
    - [16, 56.498]
  - - [448, 256, 1, 128]
    - [3, 1.399]
  - - [4288, 448, 1, 128]
    - [18, 16.347]
  - - [5056, 256, 1, 1280]
    - [12, 41.345]
  - - [1856, 1408, 1, 3328]
    - [4, 62.611]
  - - [128, 128, 1, 128]
    - [17, 0.207]
  - - [1024, 4288, 1, 3328]
    - [4, 65.185]
  - - [448, 2368, 1, 256]
    - [28, 16.29]
  - - [1024, 4, 1, 128]
    - [23, 0.059]
  - - [5056, 448, 1, 256]
    - [11, 24.485]
  - - [2944, 2368, 1, 3328]
    - [14, 70.707]
  - - [704, 128, 1, 3328]
    - [5, 13.371]
  - - [64, 64, 1, 3328]
    - [60, 1.236]
  - - [1024, 1856, 1, 1280]
    - [16, 43.913]
  - - [6784, 1856, 1, 256]
    - [10, 40.267]
  - - [128, 2368, 1, 3328]
    - [52, 18.511]
  - - [1024, 5888, 1, 256]
    - [33, 28.479]
  - - [5056, 128, 1, 1280]
    - [3, 32.982]
  - - [5056, 64, 1, 3328]
    - [64, 19.872]
  - - [128, 704, 1, 128]
    - [0, 1.326]
  - - [1408, 2368, 1, 256]
    - [14, 31.469]
  - - [1408, 1408, 1, 256]
    - [3, 26.727]
  - - [4, 64, 1, 128]
    - [57, 0.004]
  - - [64, 128, 1, 1280]
    - [1, 1.258]
  - - [2368, 2368, 1, 128]
    - [18, 26.749]
  - - [64, 5888, 1, 128]
    - [8, 5.071]
  - - [5888, 4, 1, 3328]
    - [43, 2.368]
  - - [6784, 1408, 1, 128]
    - [10, 28.663]
  - - [4288, 5888, 1, 256]
    - [4, 45.84]
  - - [1408, 5056, 1, 256]
    - [34, 33.733]
  - - [5056, 128, 1, 3328]
    - [3, 32.423]
  - - [128, 128, 1, 1280]
    - [1, 1.985]
  - - [448, 704, 1, 256]
    - [8, 6.453]
  - - [4288, 3584, 1, 128]
    - [16, 29.016]
  - - [2944, 128, 1, 3328]
    - [8, 23.349]
  - - [128, 5056, 1, 1280]
    - [3, 29.25]
  - - [3584, 5056, 1, 1280]
    - [10, 70.283]
  - - [256, 448, 1, 1280]
    - [37, 8.869]
  - - [704, 704, 1, 128]
    - [18, 7.11]
  - - [5056, 4, 1, 128]
    - [15, 0.286]
  - - [704, 256, 1, 1280]
    - [37, 11.349]
  - - [64, 2368, 1, 3328]
    - [64, 16.862]
  - - [1856, 1024, 1, 128]
    - [70, 18.54]
  - - [1856, 64, 1, 128]
    - [31, 1.39]
  - - [64, 6784, 1, 1280]
    - [3, 23.786]
  - - [704, 4288, 1, 256]
    - [8, 28.061]
  - - [5888, 2368, 1, 1280]
    - [10, 66.746]
  - - [128, 256, 1, 256]
    - [7, 0.849]
  - - [256, 64, 1, 1280]
    - [43, 1.982]
  - - [2368, 5888, 1, 1280]
    - [4, 67.047]
  - - [5888, 256, 1, 1280]
    - [12, 46.044]
  - - [4, 5888, 1, 1280]
    - [59, 2.201]
  - - [704, 128, 1, 128]
    - [28, 1.18]
  - - [1024, 4, 1, 1280]
    - [26, 0.512]
  - - [2368, 1856, 1, 3328]
    - [4, 65.435]
  - - [2368, 128, 1, 128]
    - [3, 4.111]
  - - [2944, 704, 1, 256]
    - [18, 22.068]
  - - [5056, 128, 1, 128]
    - [8, 7.344]
  - - [256, 704, 1, 3328]
    - [35, 19.1]
  - - [704, 3584, 1, 256]
    - [8, 26.66]
  - - [1024, 1024, 1, 1024]
    - [12, 31.351]
  - - [704, 2944, 1, 3328]
    - [16, 51.849]
  - - [6784, 1024, 1, 128]
    - [11, 27.125]
  - - [256, 448, 1, 128]
    - [71, 1.271]
  - - [448, 1024, 1, 3328]
    - [8, 27.703]
  - - [2944, 1024, 1, 3328]
    - [14, 55.663]
  - - [2944, 5056, 1, 128]
    - [13, 28.239]
  - - [1408, 6784, 1, 256]
    - [10, 36.062]
  - - [6784, 1408, 1, 3328]
    - [10, 78.588]
  - - [4288, 6784, 1, 128]
    - [22, 35.58]
  - - [704, 64, 1, 256]
    - [0, 1.13]
  - - [5888, 4, 1, 1280]
    - [38, 1.719]
  - - [256, 2368, 1, 3328]
    - [8, 29.499]
  - - [6784, 2944, 1, 1280]
    - [10, 72.408]
  - - [4288, 1856, 1, 128]
    - [11, 28.157]
  - - [1856, 2944, 1, 128]
    - [18, 25.959]
  - - [6784, 448, 1, 128]
    - [11, 19.585]
  - - [64, 3584, 1, 128]
    - [8, 3.003]
  - - [448, 5056, 1, 1280]
    - [3, 42.898]
  - - [2368, 1856, 1, 128]
    - [11, 23.5]
  - - [128, 448, 1, 1280]
    - [42, 5.063]
  - - [4288, 704, 1, 256]
    - [11, 26.812]
  - - [256, 3584, 1, 128]
    - [72, 11.193]
  - - [5888, 704, 1, 256]
    - [18, 29.618]
  - - [3584, 1024, 1, 128]
    - [10, 21.404]
  - - [256, 5888, 1, 3328]
    - [12, 53.741]
  - - [1408, 4288, 1, 3328]
    - [4, 66.329]
  - - [6784, 4288, 1, 256]
    - [46, 44.642]
  - - [4288, 256, 1, 128]
    - [18, 11.063]
  - - [5888, 256, 1, 256]
    - [12, 22.627]
  - - [6784, 1024, 1, 1280]
    - [40, 62.533]
  - - [5888, 1024, 1, 128]
    - [11, 26.622]
  - - [1024, 128, 1, 256]
    - [8, 3.117]
  - - [128, 64, 1, 3328]
    - [60, 2.571]
  - - [448, 64, 1, 256]
    - [68, 0.695]
  - - [2944, 704, 1, 1280]
    - [12, 39.45]
  - - [6784, 3584, 1, 1280]
    - [10, 75.074]
  - - [1024, 6784, 1, 1280]
    - [10, 63.477]
  - - [2944, 64, 1, 1280]
    - [73, 11.007]
  - - [1408, 2944, 1, 1280]
    - [3, 52.247]
  - - [256, 1856, 1, 256]
    - [3, 11.484]
  - - [1408, 2368, 1, 3328]
    - [14, 63.03]
  - - [2944, 4, 1, 3328]
    - [60, 1.856]
  - - [128, 1408, 1, 3328]
    - [37, 18.543]
  - - [2944, 1856, 1, 128]
    - [18, 27.397]
  - - [256, 2944, 1, 128]
    - [3, 7.902]
  - - [256, 6784, 1, 128]
    - [16, 16.44]
  - - [2368, 4, 1, 128]
    - [68, 0.15]
  - - [1408, 256, 1, 3328]
    - [52, 22.499]
  - - [1856, 4, 1, 128]
    - [74, 0.132]
  - - [5056, 6784, 1, 128]
    - [56, 36.949]
  - - [4288, 5056, 1, 128]
    - [11, 33.459]
  - - [1856, 5888, 1, 128]
    - [22, 25.835]
  - - [2944, 5888, 1, 256]
    - [10, 47.961]
  - - [3584, 1856, 1, 256]
    - [51, 32.026]
  - - [4288, 3584, 1, 1280]
    - [10, 73.658]
  - - [2368, 448, 1, 256]
    - [18, 14.202]
  - - [4288, 256, 1, 3328]
    - [28, 39.504]
  - - [1856, 704, 1, 128]
    - [18, 12.007]
  - - [1408, 64, 1, 256]
    - [63, 2.09]
  - - [64, 1856, 1, 128]
    - [75, 1.464]
  - - [4, 256, 1, 128]
    - [43, 0.015]
  - - [704, 4288, 1, 3328]
    - [10, 57.054]
  - - [704, 5888, 1, 128]
    - [11, 22.798]
  - - [6784, 3584, 1, 128]
    - [12, 33.927]
  - - [1024, 64, 1, 256]
    - [65, 1.444]
  - - [64, 2368, 1, 256]
    - [32, 3.155]
  - - [4288, 5056, 1, 3328]
    - [10, 80.383]
  - - [4, 1856, 1, 1280]
    - [9, 0.849]
  - - [4288, 128, 1, 128]
    - [8, 7.042]
  - - [1408, 1408, 1, 128]
    - [18, 14.838]
  - - [1024, 128, 1, 3328]
    - [64, 14.18]
  - - [1856, 128, 1, 128]
    - [3, 2.718]
  - - [5056, 2368, 1, 256]
    - [12, 38.492]
  - - [4288, 704, 1, 3328]
    - [16, 56.079]
  - - [448, 3584, 1, 256]
    - [40, 21.7]
  - - [64, 128, 1, 128]
    - [9, 0.116]
  - - [2368, 64, 1, 1280]
    - [8, 8.308]
  - - [2368, 1024, 1, 1280]
    - [12, 45.918]
  - - [2944, 1408, 1, 3328]
    - [12, 60.736]
  - - [1408, 448, 1, 256]
    - [18, 11.692]
  - - [1024, 1408, 1, 3328]
    - [12, 49.36]
  - - [2944, 5888, 1, 1280]
    - [10, 76.298]
  - - [1408, 4, 1, 1280]
    - [1, 0.761]
  - - [5888, 3584, 1, 256]
    - [10, 46.485]
  - - [128, 1024, 1, 1280]
    - [20, 7.44]
  - - [1408, 1856, 1, 3328]
    - [4, 62.092]
  - - [4, 4, 1, 3328]
    - [60, 0.006]
  - - [6784, 1408, 1, 1280]
    - [10, 70.374]
  - - [4, 1024, 1, 1280]
    - [9, 0.517]
  - - [704, 2944, 1, 256]
    - [3, 25.249]
  - - [704, 4288, 1, 128]
    - [11, 19.119]
  - - [2368, 4288, 1, 128]
    - [76, 22.877]
  - - [64, 4288, 1, 1280]
    - [8, 15.756]
  - - [6784, 64, 1, 1280]
    - [8, 19.765]
  - - [3584, 128, 1, 128]
    - [3, 6.338]
  - - [1024, 6784, 1, 128]
    - [18, 29.277]
  - - [4, 1856, 1, 128]
    - [59, 0.123]
  - - [1408, 64, 1, 3328]
    - [29, 15.292]
  - - [6784, 4, 1, 256]
    - [57, 0.763]
  - - [1408, 1408, 1, 1280]
    - [3, 40.601]
  - - [256, 2368, 1, 256]
    - [3, 12.705]
  - - [448, 4288, 1, 3328]
    - [4, 61.615]
  - - [2368, 1408, 1, 256]
    - [8, 32.103]
  - - [5888, 5056, 1, 128]
    - [10, 32.875]
  - - [704, 2368, 1, 256]
    - [11, 22.281]
  - - [2944, 448, 1, 1280]
    - [34, 31.143]
  - - [5888, 2368, 1, 3328]
    - [10, 75.556]
  - - [64, 2944, 1, 1280]
    - [73, 13.063]
  - - [448, 1856, 1, 1280]
    - [8, 37.858]
  - - [4288, 448, 1, 1280]
    - [58, 36.368]
  - - [5888, 704, 1, 3328]
    - [12, 60.367]
  - - [5056, 256, 1, 128]
    - [33, 12.947]
  - - [1856, 256, 1, 128]
    - [3, 6.223]
  - - [5056, 128, 1, 256]
    - [18, 12.483]
  - - [704, 4, 1, 256]
    - [1, 0.077]
  - - [1408, 5888, 1, 128]
    - [18, 29.192]
  - - [4288, 4, 1, 128]
    - [8, 0.221]
  - - [1408, 1024, 1, 256]
    - [3, 20.231]
  - - [1024, 1856, 1, 128]
    - [62, 16.144]
  - - [256, 704, 1, 128]
    - [8, 1.994]
  - - [256, 1024, 1, 128]
    - [3, 3.343]
  - - [448, 1024, 1, 256]
    - [3, 10.037]
  - - [128, 4, 1, 3328]
    - [60, 0.152]
  - - [5056, 6784, 1, 1280]
    - [10, 77.717]
  - - [704, 5056, 1, 3328]
    - [10, 67.541]
  - - [64, 1408, 1, 1280]
    - [77, 6.786]
  - - [3584, 5056, 1, 3328]
    - [10, 79.568]
  - - [1856, 4, 1, 3328]
    - [26, 1.663]
  - - [4, 2944, 1, 128]
    - [68, 0.205]
  - - [2368, 2944, 1, 3328]
    - [10, 73.397]
  - - [448, 448, 1, 1280]
    - [52, 13.763]
  - - [2368, 3584, 1, 256]
    - [12, 38.971]
  - - [1024, 256, 1, 1280]
    - [3, 13.896]
  - - [5056, 3584, 1, 1280]
    - [10, 70.357]
  - - [448, 4, 1, 3328]
    - [60, 0.478]
  - - [1856, 2944, 1, 1280]
    - [16, 60.167]
  - - [3584, 2368, 1, 1280]
    - [16, 66.985]
  - - [128, 1024, 1, 256]
    - [3, 2.682]
  - - [2944, 1408, 1, 256]
    - [3, 33.946]
  - - [4288, 1408, 1, 3328]
    - [4, 68.981]
  - - [3584, 64, 1, 3328]
    - [52, 21.58]
  - - [1408, 128, 1, 256]
    - [75, 3.533]
  - - [2944, 1024, 1, 128]
    - [11, 19.288]
  - - [4288, 5056, 1, 1280]
    - [12, 66.934]
  - - [5888, 6784, 1, 1280]
    - [10, 79.22]
  - - [6784, 5056, 1, 128]
    - [51, 34.401]
  - - [256, 1024, 1, 3328]
    - [35, 21.471]
  - - [3584, 4, 1, 256]
    - [68, 0.446]
  - - [1856, 64, 1, 3328]
    - [20, 17.957]
  - - [64, 6784, 1, 128]
    - [11, 6.506]
  - - [5888, 1408, 1, 3328]
    - [4, 72.995]
  - - [5888, 64, 1, 1280]
    - [3, 16.742]
  - - [256, 5056, 1, 256]
    - [8, 18.973]
  - - [128, 3584, 1, 128]
    - [3, 6.55]
  - - [448, 3584, 1, 3328]
    - [12, 56.004]
  - - [704, 2368, 1, 128]
    - [18, 14.719]
  - - [5888, 256, 1, 128]
    - [16, 14.141]
  - - [4, 5056, 1, 128]
    - [15, 0.262]
  - - [448, 256, 1, 256]
    - [3, 2.853]
  - - [704, 4, 1, 3328]
    - [60, 0.825]
  - - [1408, 256, 1, 256]
    - [8, 7.759]
  - - [3584, 1856, 1, 128]
    - [11, 27.96]
  - - [4288, 4288, 1, 128]
    - [56, 29.319]
  - - [1856, 1024, 1, 3328]
    - [40, 60.311]
  - - [128, 5888, 1, 3328]
    - [8, 36.878]
  - - [1024, 5056, 1, 256]
    - [10, 33.782]
  - - [2368, 1408, 1, 3328]
    - [34, 62.682]
  - - [5888, 448, 1, 256]
    - [18, 23.888]
  - - [5888, 6784, 1, 128]
    - [51, 37.23]
  - - [2368, 4, 1, 3328]
    - [78, 1.81]
  - - [6784, 5056, 1, 1280]
    - [10, 77.506]
  - - [5056, 704, 1, 1280]
    - [10, 58.009]
  - - [1408, 256, 1, 1280]
    - [8, 20.976]
  - - [4288, 6784, 1, 1280]
    - [10, 74.614]
  - - [128, 704, 1, 256]
    - [0, 2.561]
  - - [1024, 1024, 1, 128]
    - [18, 12.09]
  - - [448, 128, 1, 1280]
    - [29, 5.488]
  - - [6784, 4, 1, 3328]
    - [78, 2.654]
  - - [4288, 4, 1, 1280]
    - [60, 1.341]
  - - [1024, 64, 1, 3328]
    - [1, 8.354]
  - - [1856, 4, 1, 256]
    - [9, 0.191]
  - - [64, 3584, 1, 1280]
    - [73, 12.642]
  - - [6784, 1408, 1, 256]
    - [10, 39.771]
  - - [3584, 5888, 1, 128]
    - [22, 33.01]
  - - [5056, 5888, 1, 256]
    - [10, 46.115]
  - - [2368, 1024, 1, 256]
    - [4, 24.948]
  - - [2944, 1856, 1, 256]
    - [10, 37.723]
  - - [1856, 6784, 1, 1280]
    - [12, 68.594]
  - - [64, 5056, 1, 128]
    - [8, 4.15]
  - - [5888, 64, 1, 128]
    - [11, 4.067]
  - - [448, 704, 1, 128]
    - [3, 3.29]
  - - [4, 1024, 1, 128]
    - [60, 0.051]
  - - [4288, 3584, 1, 256]
    - [14, 42.389]
  - - [1408, 704, 1, 128]
    - [13, 8.723]
  - - [64, 256, 1, 3328]
    - [1, 3.634]
  - - [5056, 1856, 1, 1280]
    - [16, 67.264]
  - - [1408, 1024, 1, 3328]
    - [12, 52.527]
  - - [2368, 256, 1, 3328]
    - [3, 30.08]
  - - [5888, 3584, 1, 1280]
    - [10, 76.237]
  - - [1856, 3584, 1, 3328]
    - [4, 70.511]
  - - [5888, 128, 1, 1280]
    - [3, 35.995]
  - - [1024, 2944, 1, 256]
    - [10, 27.733]
  - - [448, 6784, 1, 1280]
    - [16, 48.18]
  - - [256, 3584, 1, 1280]
    - [3, 39.61]
  - - [448, 128, 1, 128]
    - [17, 0.749]
  - - [704, 5056, 1, 256]
    - [3, 27.77]
  - - [2944, 1856, 1, 1280]
    - [16, 60.795]
  - - [128, 256, 1, 128]
    - [0, 0.39]
  - - [5056, 256, 1, 256]
    - [28, 18.822]
  - - [2368, 3584, 1, 3328]
    - [4, 71.618]
  - - [3584, 5888, 1, 3328]
    - [10, 84.839]
  - - [128, 4, 1, 256]
    - [9, 0.017]
  - - [2944, 3584, 1, 1280]
    - [79, 66.362]
  - - [1856, 5888, 1, 1280]
    - [10, 68.325]
  - - [256, 256, 1, 1280]
    - [64, 5.366]
  - - [5056, 448, 1, 3328]
    - [12, 53.585]
  - - [4288, 1408, 1, 256]
    - [70, 29.172]
  - - [3584, 64, 1, 256]
    - [15, 4.996]
  - - [64, 1856, 1, 3328]
    - [20, 17.103]
  - - [256, 1408, 1, 128]
    - [8, 5.369]
  - - [5888, 1408, 1, 128]
    - [18, 31.619]
  - - [4288, 2368, 1, 1280]
    - [16, 63.514]
  - - [4, 4288, 1, 256]
    - [44, 0.492]
  - - [256, 4288, 1, 128]
    - [11, 10.949]
  - - [256, 128, 1, 3328]
    - [60, 6.022]
  - - [6784, 2368, 1, 256]
    - [48, 39.257]
  - - [5888, 128, 1, 128]
    - [8, 9.331]
  - - [4288, 1856, 1, 256]
    - [56, 30.987]
  - - [1856, 256, 1, 3328]
    - [8, 28.289]
  - - [1856, 2944, 1, 256]
    - [3, 33.781]
  - - [5056, 1024, 1, 128]
    - [11, 24.481]
  - - [64, 5888, 1, 1280]
    - [8, 20.058]
  - - [6784, 256, 1, 128]
    - [4, 14.596]
  - - [5888, 704, 1, 128]
    - [11, 24.007]
  - - [6784, 64, 1, 128]
    - [80, 5.276]
  - - [1024, 4288, 1, 1280]
    - [4, 53.185]
  - - [2368, 5056, 1, 3328]
    - [10, 73.747]
  - - [448, 4, 1, 128]
    - [26, 0.032]
  - - [4, 256, 1, 3328]
    - [43, 0.361]
  - - [4288, 1024, 1, 3328]
    - [16, 60.338]
  - - [1024, 5056, 1, 3328]
    - [10, 68.414]
  - - [1024, 1856, 1, 3328]
    - [4, 60.048]
  - - [704, 704, 1, 1280]
    - [8, 21.111]
  - - [128, 2368, 1, 1280]
    - [3, 15.594]
  - - [1408, 128, 1, 3328]
    - [36, 16.649]
  - - [3584, 256, 1, 1280]
    - [3, 39.925]
  - - [4, 128, 1, 128]
    - [60, 0.008]
  - - [704, 6784, 1, 128]
    - [18, 26.379]
  - - [3584, 128, 1, 1280]
    - [3, 26.814]
  - - [4, 256, 1, 1280]
    - [1, 0.127]
  - - [128, 704, 1, 3328]
    - [2, 10.487]
  - - [4288, 6784, 1, 256]
    - [10, 48.112]
  - - [3584, 2944, 1, 3328]
    - [4, 75.495]
  - - [128, 1856, 1, 256]
    - [3, 5.682]
  - - [64, 4288, 1, 256]
    - [8, 6.22]
  - - [4, 3584, 1, 3328]
    - [45, 2.492]
  - - [64, 4, 1, 3328]
    - [60, 0.072]
  - - [4, 64, 1, 3328]
    - [60, 0.067]
  - - [5888, 2944, 1, 256]
    - [10, 45.73]
  - - [2368, 6784, 1, 128]
    - [51, 28.762]
  - - [448, 4288, 1, 1280]
    - [40, 46.099]
  - - [448, 1856, 1, 3328]
    - [8, 41.084]
  - - [4, 1024, 1, 256]
    - [26, 0.098]
  - - [5056, 4288, 1, 256]
    - [10, 42.251]
  - - [1024, 448, 1, 256]
    - [72, 8.636]
  - - [1024, 3584, 1, 256]
    - [10, 34.714]
  - - [2944, 128, 1, 1280]
    - [8, 21.116]
  - - [1856, 5056, 1, 128]
    - [18, 23.079]
  - - [64, 256, 1, 256]
    - [45, 0.477]
  - - [1408, 4, 1, 128]
    - [17, 0.087]
  - - [128, 2368, 1, 128]
    - [8, 4.016]
  - - [256, 704, 1, 1280]
    - [73, 10.62]
  - - [64, 2368, 1, 128]
    - [15, 2.001]
  - - [6784, 6784, 1, 3328]
    - [10, 86.449]
  - - [448, 5888, 1, 1280]
    - [12, 51.498]
  - - [5056, 448, 1, 128]
    - [18, 17.0]
  - - [3584, 2944, 1, 128]
    - [81, 24.116]
  - - [6784, 256, 1, 1280]
    - [34, 42.475]
  - - [256, 2944, 1, 1280]
    - [3, 36.879]
  - - [64, 4288, 1, 128]
    - [8, 3.767]
  - - [2368, 5888, 1, 3328]
    - [4, 75.608]
  - - [4, 64, 1, 256]
    - [23, 0.007]
  - - [704, 1024, 1, 3328]
    - [8, 35.802]
  - - [2368, 1856, 1, 1280]
    - [12, 54.524]
  - - [128, 448, 1, 128]
    - [55, 0.637]
  - - [128, 6784, 1, 256]
    - [8, 14.733]
  - - [3584, 4288, 1, 128]
    - [47, 29.272]
  - - [64, 448, 1, 128]
    - [23, 0.333]
  - - [5888, 4288, 1, 3328]
    - [10, 79.983]
  - - [2368, 704, 1, 256]
    - [54, 20.569]
  - - [256, 1856, 1, 3328]
    - [8, 29.619]
  - - [1856, 128, 1, 256]
    - [15, 4.404]
  - - [6784, 128, 1, 128]
    - [8, 10.842]
  - - [3584, 1408, 1, 128]
    - [18, 24.925]
  - - [1856, 5056, 1, 1280]
    - [4, 63.146]
  - - [2944, 1024, 1, 1280]
    - [4, 48.247]
  - - [5056, 4, 1, 256]
    - [35, 0.56]
  - - [2368, 4288, 1, 256]
    - [50, 33.075]
  - - [1024, 2368, 1, 3328]
    - [16, 56.883]
  - - [64, 704, 1, 3328]
    - [2, 9.042]
  - - [704, 1408, 1, 256]
    - [3, 15.691]
  - - [6784, 1856, 1, 3328]
    - [10, 75.891]
  - - [1024, 2944, 1, 128]
    - [18, 20.659]
  - - [1024, 3584, 1, 1280]
    - [46, 59.856]
  - - [4288, 5888, 1, 3328]
    - [40, 82.091]
  - - [4288, 4, 1, 3328]
    - [17, 2.385]
  - - [256, 1408, 1, 256]
    - [8, 9.375]
  - - [448, 2944, 1, 1280]
    - [12, 43.615]
  - - [4, 5888, 1, 128]
    - [15, 0.33]
  - - [1024, 2944, 1, 3328]
    - [4, 57.09]
  - - [3584, 6784, 1, 256]
    - [10, 48.872]
  - - [256, 6784, 1, 1280]
    - [28, 41.953]
  - - [1856, 3584, 1, 256]
    - [22, 31.857]
  - - [128, 448, 1, 3328]
    - [2, 9.49]
  - - [6784, 1856, 1, 128]
    - [51, 30.368]
  - - [4, 448, 1, 256]
    - [7, 0.057]
  - - [2944, 704, 1, 128]
    - [18, 16.416]
  - - [256, 5888, 1, 1280]
    - [12, 47.153]
  - - [4, 128, 1, 1280]
    - [60, 0.064]
  - - [4288, 6784, 1, 3328]
    - [10, 81.394]
  - - [6784, 128, 1, 1280]
    - [3, 38.463]
  - - [64, 1408, 1, 256]
    - [65, 1.997]
  - - [2368, 1408, 1, 128]
    - [18, 23.889]
  - - [1856, 448, 1, 256]
    - [18, 15.179]
  - - [1408, 1024, 1, 128]
    - [11, 12.798]
  - - [128, 64, 1, 128]
    - [9, 0.101]
  - - [6784, 3584, 1, 3328]
    - [10, 82.778]
  - - [2944, 64, 1, 3328]
    - [5, 17.333]
  - - [64, 64, 1, 128]
    - [44, 0.041]
  - - [2368, 5056, 1, 1280]
    - [10, 63.613]
  - - [64, 4, 1, 1280]
    - [60, 0.04]
  - - [1408, 2368, 1, 1280]
    - [40, 54.685]
  - - [128, 1408, 1, 1280]
    - [37, 10.89]
  - - [256, 64, 1, 3328]
    - [1, 3.655]
  - - [2944, 4288, 1, 128]
    - [61, 29.414]
  - - [2944, 2944, 1, 256]
    - [16, 41.295]
  - - [2944, 4, 1, 1280]
    - [9, 1.143]
  - - [5888, 4, 1, 256]
    - [21, 0.534]
  - - [6784, 256, 1, 256]
    - [4, 25.731]
  - - [256, 5056, 1, 3328]
    - [12, 46.461]
  - - [128, 4288, 1, 1280]
    - [8, 23.666]
  - - [5056, 1856, 1, 128]
    - [81, 22.345]
  - - [5888, 1408, 1, 256]
    - [16, 37.81]
  - - [128, 128, 1, 256]
    - [23, 0.418]
  - - [5056, 4, 1, 3328]
    - [44, 2.275]
  - - [4288, 3584, 1, 3328]
    - [10, 82.411]
  - - [448, 704, 1, 3328]
    - [52, 19.442]
  - - [448, 448, 1, 128]
    - [8, 2.517]
  - - [1024, 2368, 1, 1280]
    - [12, 46.74]
  - - [1856, 704, 1, 3328]
    - [12, 46.876]
  - - [4, 2368, 1, 128]
    - [9, 0.136]
  - - [5888, 6784, 1, 3328]
    - [10, 85.228]
  - - [704, 4288, 1, 1280]
    - [4, 49.72]
  - - [704, 256, 1, 256]
    - [3, 4.754]
  - - [6784, 448, 1, 3328]
    - [10, 57.183]
  - - [4288, 1024, 1, 128]
    - [11, 24.858]
  - - [960, 1024, 1, 1024]
    - [12, 37.855]
  - - [1920, 2048, 1, 2048]
    - [40, 68.118]
  - - [2880, 3072, 1, 3072]
    - [10, 71.53]
  - - [3840, 4096, 1, 4096]
    - [79, 82.973]
  - - [7680, 8192, 1, 8192]
    - [79, 86.498]
  - - [512, 512, 1, 512]
    - [8, 9.975]
  - - [2048, 2048, 1, 2048]
    - [4, 52.944]
  - - [3072, 3072, 1, 3072]
    - [10, 78.082]
  - - [4096, 4096, 1, 4096]
    - [10, 79.962]
  - - [8192, 8192, 1, 8192]
    - [10, 85.442]
  - - [384, 384, 1, 384]
    - [3, 4.834]
  - - [768, 768, 1, 768]
    - [8, 23.251]
  - - [1152, 1152, 1, 1152]
    - [12, 40.189]
  - - [1536, 1536, 1, 1536]
    - [8, 46.228]
  - - [1920, 1920, 1, 1920]
    - [4, 62.47]
  - - [2304, 2304, 1, 2304]
    - [40, 67.794]
  - - [2688, 2688, 1, 2688]
    - [10, 73.64]
  - - [3456, 3456, 1, 3456]
    - [4, 74.366]
  - - [3840, 3840, 1, 3840]
    - [10, 80.813]
  - - [4224, 4224, 1, 4224]
    - [10, 78.76]
  - - [4608, 4608, 1, 4608]
    - [10, 86.244]
  - - [4992, 4992, 1, 4992]
    - [10, 86.199]
  - - [5376, 5376, 1, 5376]
    - [10, 86.82]
  - - [5760, 5760, 1, 5760]
    - [10, 88.082]
  - - [6144, 6144, 1, 6144]
    - [10, 85.982]
  - - [6528, 6528, 1, 6528]
    - [10, 86.313]
  - - [6912, 6912, 1, 6912]
    - [10, 85.63]
  - - [7296, 7296, 1, 7296]
    - [79, 85.927]
  - - [7680, 7680, 1, 7680]
    - [79, 89.16]
- null
