library/src/blas3/Tensile/Logic/asm_full/arcturus/arcturus_Cijk_Alik_Bljk_HSS_BH.yaml
- {MinimumRequiredVersion: 4.23.0}
- arcturus
- gfx908
- [Device 7380, Device 7388, Device 738c, Device 7390]
    SolutionIndex: 0
    SolutionNameMin: Cijk_Alik_Bljk_HSS_BH_MT32x32x64_MI16x16x16x1_SE_1LDSB0_AF0EM8_AMAS3_ASEM1_EPS1_GRVW8_GSU7_ISA908_KLA_LBSPP128_LPA8_LPB8_LRVW8_MAC_NLCA1_NLCB1_PGR1_PLR5_SIA3_SU32_SUS256_SRVW0_TT1_16_TLDS1_VAW1_VW2_WSGRA1_WSGRB1_WG32_8_1_WGM1
    SolutionIndex: 1
    SolutionNameMin: Cijk_Alik_Bljk_HSS_BH_MT32x32x64_MI16x16x16x1_SE_1LDSB0_AF0EM1_AMAS3_ASEM1_EPS1_GRVW8_GSU15_ISA908_KLA_LBSPP128_LPA8_LPB8_LRVW8_MAC_NLCA1_NLCB1_PGR1_PLR5_SIA3_SU0_SUS0_SRVW0_TT1_16_TLDS1_VAW1_VW2_WSGRA1_WSGRB1_WG32_8_1_WGM2
    SolutionIndex: 2
    SolutionNameMin: Cijk_Alik_Bljk_HSS_BH_MT64x32x64_MI16x16x16x1_SE_1LDSB1_AF0EM8_AMAS3_ASEM1_EPS1_GRVW8_GSU7_ISA908_KLA_LBSPP128_LPA8_LPB8_LRVW8_MAC_NLCA1_NLCB1_PGR1_PLR5_SIA3_SU0_SUS0_SRVW0_TT2_16_TLDS1_VAW1_VW2_WSGRA1_WSGRB1_WG32_8_1_WGM1
    SolutionIndex: 3
    SolutionNameMin: Cijk_Alik_Bljk_HSS_BH_MT16x16x128_MI16x16x16x1_SE_1LDSB1_AF0EM8_AMAS3_ASEM1_EPS1_GRVW8_GSU1_ISA908_KLA_LBSPP256_LPA8_LPB8_LRVW8_MAC_NLCA1_NLCB1_PGR1_PLR9_SIA3_SU32_SUS256_SRVW0_TT1_16_TLDS1_VAW2_VW2_WSGRA1_WSGRB1_WG16_4_1_WGM1
    SolutionIndex: 4
    SolutionNameMin: Cijk_Alik_Bljk_HSS_BH_MT16x16x128_MI16x16x16x1_SE_1LDSB0_AF0EM1_AMAS3_ASEM1_EPS1_GRVW8_GSU1_ISA908_KLA_LBSPP256_LPA8_LPB8_LRVW8_MAC_NLCA1_NLCB1_PGR1_PLR9_SIA3_SU32_SUS256_SRVW0_TT1_16_TLDS1_VAW2_VW2_WSGRA1_WSGRB1_WG16_4_1_WGM1
    SolutionIndex: 5
    SolutionNameMin: Cijk_Alik_Bljk_HSS_BH_MT16x16x128_MI16x16x16x1_SE_1LDSB1_AF0EM1_AMAS3_ASEM1_EPS1_GRVW8_GSU1_ISA908_KLA_LBSPP256_LPA8_LPB8_LRVW8_MAC_NLCA1_NLCB1_PGR1_PLR9_SIA3_SU0_SUS0_SRVW0_TT1_16_TLDS1_VAW2_VW2_WSGRA1_WSGRB1_WG16_4_1_WGM1
    SolutionIndex: 6
    SolutionNameMin: Cijk_Alik_Bljk_HSS_BH_MT16x16x128_MI16x16x16x1_SE_1LDSB1_AF0EM8_AMAS3_ASEM1_EPS1_GRVW8_GSU1_ISA908_KLA_LBSPP256_LPA8_LPB8_LRVW8_MAC_NLCA1_NLCB1_PGR1_PLR9_SIA3_SU0_SUS0_SRVW0_TT1_16_TLDS1_VAW2_VW2_WSGRA1_WSGRB1_WG16_4_1_WGM2
    SolutionIndex: 7
    SolutionNameMin: Cijk_Alik_Bljk_HSS_BH_MT16x16x128_MI16x16x16x1_SE_1LDSB1_AF0EM1_AMAS3_ASEM1_EPS1_GRVW8_GSU1_ISA908_KLA_LBSPP256_LPA8_LPB8_LRVW8_MAC_NLCA1_NLCB1_PGR1_PLR9_SIA3_SU32_SUS256_SRVW0_TT1_16_TLDS1_VAW2_VW2_WSGRA1_WSGRB1_WG16_4_1_WGM1
    SolutionIndex: 8
    SolutionNameMin: Cijk_Alik_Bljk_HSS_BH_MT16x16x128_MI16x16x16x1_SE_1LDSB0_AF0EM8_AMAS3_ASEM1_EPS1_GRVW8_GSU1_ISA908_KLA_LBSPP256_LPA8_LPB8_LRVW8_MAC_NLCA1_NLCB1_PGR1_PLR9_SIA3_SU32_SUS256_SRVW0_TT1_16_TLDS1_VAW2_VW2_WSGRA1_WSGRB1_WG16_4_1_WGM1
    SolutionIndex: 9
    SolutionNameMin: Cijk_Alik_Bljk_HSS_BH_MT16x16x128_MI16x16x16x1_SE_1LDSB0_AF0EM1_AMAS3_ASEM1_EPS1_GRVW8_GSU1_ISA908_KLA_LBSPP256_LPA8_LPB8_LRVW8_MAC_NLCA1_NLCB1_PGR1_PLR9_SIA3_SU0_SUS0_SRVW0_TT1_16_TLDS1_VAW2_VW2_WSGRA1_WSGRB1_WG16_4_1_WGM15
    SolutionIndex: 10
    SolutionNameMin: Cijk_Alik_Bljk_HSS_BH_MT16x16x128_MI16x16x16x1_SE_1LDSB1_AF0EM8_AMAS3_ASEM1_EPS1_GRVW8_GSU1_ISA908_KLA_LBSPP256_LPA8_LPB8_LRVW8_MAC_NLCA1_NLCB1_PGR1_PLR9_SIA3_SU0_SUS0_SRVW0_TT1_16_TLDS1_VAW2_VW2_WSGRA1_WSGRB1_WG16_4_1_WGM15
    SolutionIndex: 11
    SolutionNameMin: Cijk_Alik_Bljk_HSS_BH_MT32x32x64_MI16x16x16x1_SE_1LDSB0_AF0EM1_AMAS3_ASEM1_EPS1_GRVW4_GSU1_ISA908_KLA_LBSPP128_LPA8_LPB8_LRVW8_MAC_NLCA1_NLCB1_PGR1_PLR5_SIA3_SU0_SUS0_SRVW4_TT1_16_TLDS1_VAW2_VW2_WSGRA1_WSGRB1_WG32_8_1_WGM1
    SolutionIndex: 12
    SolutionNameMin: Cijk_Alik_Bljk_HSS_BH_MT64x32x64_MI16x16x16x1_SE_1LDSB1_AF0EM8_AMAS3_ASEM1_EPS1_GRVW8_GSU1_ISA908_KLA_LBSPP128_LPA8_LPB8_LRVW8_MAC_NLCA1_NLCB1_PGR1_PLR5_SIA3_SU0_SUS0_SRVW4_TT2_16_TLDS1_VAW2_VW2_WSGRA1_WSGRB1_WG32_8_1_WGM1
    SolutionIndex: 13
    SolutionNameMin: Cijk_Alik_Bljk_HSS_BH_MT16x16x128_MI16x16x16x1_SE_1LDSB1_AF0EM8_AMAS3_ASEM1_EPS1_GRVW4_GSU1_ISA908_KLA_LBSPP256_LPA8_LPB8_LRVW8_MAC_NLCA1_NLCB1_PGR1_PLR9_SIA3_SU0_SUS0_SRVW0_TT1_16_TLDS1_VAW2_VW2_WSGRA1_WSGRB1_WG16_4_1_WGM1
    SolutionIndex: 14
    SolutionNameMin: Cijk_Alik_Bljk_HSS_BH_MT32x64x64_MI16x16x16x1_SE_1LDSB1_AF0EM8_AMAS3_ASEM1_EPS1_GRVW8_GSU1_ISA908_KLA_LBSPP128_LPA8_LPB8_LRVW8_MAC_NLCA1_NLCB1_PGR1_PLR5_SIA3_SU0_SUS0_SRVW4_TT1_32_TLDS1_VAW2_VW2_WSGRA1_WSGRB1_WG32_8_1_WGM1
    SolutionIndex: 15
    SolutionNameMin: Cijk_Alik_Bljk_HSS_BH_MT32x32x64_MI16x16x16x1_SE_1LDSB0_AF0EM8_AMAS3_ASEM1_EPS1_GRVW8_GSU1_ISA908_KLA_LBSPP128_LPA8_LPB8_LRVW8_MAC_NLCA1_NLCB1_PGR1_PLR5_SIA3_SU0_SUS0_SRVW4_TT1_16_TLDS1_VAW2_VW2_WSGRA1_WSGRB1_WG32_8_1_WGM1
    SolutionIndex: 16
    SolutionNameMin: Cijk_Alik_Bljk_HSS_BH_MT64x32x64_MI16x16x16x1_SE_1LDSB1_AF0EM8_AMAS3_ASEM1_EPS1_GRVW8_GSU1_ISA908_KLA_LBSPP128_LPA8_LPB8_LRVW8_MAC_NLCA1_NLCB1_PGR1_PLR5_SIA3_SU32_SUS128_SRVW4_TT2_16_TLDS1_VAW2_VW2_WSGRA1_WSGRB1_WG32_8_1_WGM2
    SolutionIndex: 17
    SolutionNameMin: Cijk_Alik_Bljk_HSS_BH_MT32x32x32_MI16x16x16x1_SE_1LDSB1_AF0EM1_AMAS3_ASEM1_EPS1_GRVW8_GSU1_ISA908_KLA_LBSPP128_LPA8_LPB8_LRVW8_MAC_NLCA1_NLCB1_PGR1_PLR2_SIA3_SU0_SUS0_SRVW4_TT1_16_TLDS1_VAW2_VW2_WSGRA1_WSGRB1_WG32_8_1_WGM1
    SolutionIndex: 18
    SolutionNameMin: Cijk_Alik_Bljk_HSS_BH_MT64x64x64_MI32x32x8x1_SE_1LDSB1_AF0EM8_AMAS3_ASEM1_EPS1_GRVW8_GSU1_ISA908_KLA_LBSPP128_LPA8_LPB8_LRVW8_MAC_NLCA1_NLCB1_PGR1_PLR9_SIA3_SU0_SUS0_SRVW4_TT1_32_TLDS1_VAW2_VW2_WSGRA1_WSGRB1_WG64_4_1_WGM1
    SolutionIndex: 19
    SolutionNameMin: Cijk_Alik_Bljk_HSS_BH_MT64x64x64_MI32x32x8x1_SE_1LDSB1_AF0EM8_AMAS3_ASEM1_EPS1_GRVW8_GSU1_ISA908_KLA_LBSPP128_LPA8_LPB8_LRVW8_MAC_NLCA1_NLCB1_PGR1_PLR9_SIA3_SU0_SUS0_SRVW4_TT1_32_TLDS1_VAW2_VW2_WSGRA1_WSGRB1_WG64_4_1_WGM15
    SolutionIndex: 20
    SolutionNameMin: Cijk_Alik_Bljk_HSS_BH_MT32x64x64_MI16x16x16x1_SE_1LDSB1_AF0EM8_AMAS3_ASEM1_EPS1_GRVW8_GSU1_ISA908_KLA_LBSPP128_LPA8_LPB8_LRVW8_MAC_NLCA1_NLCB1_PGR1_PLR5_SIA3_SU32_SUS128_SRVW4_TT1_32_TLDS1_VAW2_VW2_WSGRA1_WSGRB1_WG32_8_1_WGM1
    SolutionIndex: 21
    SolutionNameMin: Cijk_Alik_Bljk_HSS_BH_MT16x16x128_MI16x16x16x1_SE_1LDSB0_AF0EM1_AMAS3_ASEM1_EPS1_GRVW8_GSU1_ISA908_KLA_LBSPP256_LPA8_LPB8_LRVW8_MAC_NLCA1_NLCB1_PGR1_PLR9_SIA3_SU0_SUS0_SRVW0_TT1_16_TLDS1_VAW2_VW2_WSGRA1_WSGRB1_WG16_4_1_WGM1
    SolutionIndex: 22
    SolutionNameMin: Cijk_Alik_Bljk_HSS_BH_MT16x16x128_MI16x16x16x1_SE_1LDSB0_AF0EM8_AMAS3_ASEM1_EPS1_GRVW8_GSU1_ISA908_KLA_LBSPP256_LPA8_LPB8_LRVW8_MAC_NLCA1_NLCB1_PGR1_PLR9_SIA3_SU0_SUS0_SRVW0_TT1_16_TLDS1_VAW2_VW2_WSGRA1_WSGRB1_WG16_4_1_WGM2
    SolutionIndex: 23
    SolutionNameMin: Cijk_Alik_Bljk_HSS_BH_MT16x16x128_MI16x16x16x1_SE_1LDSB0_AF0EM8_AMAS3_ASEM1_EPS1_GRVW8_GSU1_ISA908_KLA_LBSPP256_LPA8_LPB8_LRVW8_MAC_NLCA1_NLCB1_PGR1_PLR9_SIA3_SU0_SUS0_SRVW0_TT1_16_TLDS1_VAW2_VW2_WSGRA1_WSGRB1_WG16_4_1_WGM15
    SolutionIndex: 24
    SolutionNameMin: Cijk_Alik_Bljk_HSS_BH_MT32x32x64_MI16x16x16x1_SE_1LDSB0_AF0EM8_AMAS3_ASEM1_EPS1_GRVW8_GSU1_ISA908_KLA_LBSPP128_LPA8_LPB8_LRVW8_MAC_NLCA1_NLCB1_PGR1_PLR5_SIA3_SU0_SUS0_SRVW4_TT1_16_TLDS1_VAW2_VW2_WSGRA1_WSGRB1_WG32_8_1_WGM15
    SolutionIndex: 25
    SolutionNameMin: Cijk_Alik_Bljk_HSS_BH_MT16x16x128_MI16x16x16x1_SE_1LDSB1_AF0EM1_AMAS3_ASEM1_EPS1_GRVW8_GSU1_ISA908_KLA_LBSPP256_LPA8_LPB8_LRVW8_MAC_NLCA1_NLCB1_PGR1_PLR9_SIA3_SU0_SUS0_SRVW0_TT1_16_TLDS1_VAW2_VW2_WSGRA1_WSGRB1_WG16_4_1_WGM2
    SolutionIndex: 26
    SolutionNameMin: Cijk_Alik_Bljk_HSS_BH_MT16x16x64_MI16x16x16x1_SE_1LDSB0_AF0EM1_AMAS3_ASEM1_EPS1_GRVW8_GSU1_ISA908_KLA_LBSPP128_LPA8_LPB8_LRVW8_MAC_NLCA1_NLCB1_PGR1_PLR5_SIA3_SU0_SUS0_SRVW0_TT1_16_TLDS1_VAW2_VW2_WSGRA1_WSGRB1_WG16_4_1_WGM15
    SolutionIndex: 27
    SolutionNameMin: Cijk_Alik_Bljk_HSS_BH_MT32x64x64_MI16x16x16x1_SE_1LDSB1_AF0EM1_AMAS3_ASEM1_EPS1_GRVW8_GSU1_ISA908_KLA_LBSPP128_LPA8_LPB8_LRVW8_MAC_NLCA1_NLCB1_PGR1_PLR5_SIA3_SU0_SUS0_SRVW4_TT1_32_TLDS1_VAW2_VW2_WSGRA1_WSGRB1_WG32_8_1_WGM1
    SolutionIndex: 28
    SolutionNameMin: Cijk_Alik_Bljk_HSS_BH_MT32x32x64_MI16x16x16x1_SE_1LDSB0_AF0EM8_AMAS3_ASEM1_EPS1_GRVW8_GSU7_ISA908_KLA_LBSPP128_LPA8_LPB8_LRVW8_MAC_NLCA1_NLCB1_PGR1_PLR5_SIA3_SU0_SUS0_SRVW0_TT1_16_TLDS1_VAW1_VW2_WSGRA1_WSGRB1_WG32_8_1_WGM1
    SolutionIndex: 29
    SolutionNameMin: Cijk_Alik_Bljk_HSS_BH_MT16x16x128_MI16x16x16x1_SE_1LDSB1_AF0EM1_AMAS3_ASEM1_EPS1_GRVW8_GSU1_ISA908_KLA_LBSPP256_LPA8_LPB8_LRVW8_MAC_NLCA1_NLCB1_PGR1_PLR9_SIA3_SU0_SUS0_SRVW0_TT1_16_TLDS1_VAW2_VW2_WSGRA1_WSGRB1_WG16_4_1_WGM15
    SolutionIndex: 30
    SolutionNameMin: Cijk_Alik_Bljk_HSS_BH_MT32x32x64_MI16x16x16x1_SE_1LDSB0_AF0EM8_AMAS3_ASEM1_EPS1_GRVW8_GSU1_ISA908_KLA_LBSPP128_LPA8_LPB8_LRVW8_MAC_NLCA1_NLCB1_PGR1_PLR5_SIA3_SU0_SUS0_SRVW4_TT1_16_TLDS1_VAW2_VW2_WSGRA1_WSGRB1_WG32_8_1_WGM2
    SolutionIndex: 31
    SolutionNameMin: Cijk_Alik_Bljk_HSS_BH_MT64x64x64_MI32x32x8x1_SE_1LDSB1_AF0EM8_AMAS3_ASEM1_EPS1_GRVW2_GSU1_ISA908_KLA_LBSPP128_LPA8_LPB8_LRVW8_MAC_NLCA1_NLCB1_PGR1_PLR9_SIA3_SU32_SUS128_SRVW4_TT1_32_TLDS1_VAW2_VW2_WSGRA1_WSGRB1_WG64_4_1_WGM1
    SolutionIndex: 32
    SolutionNameMin: Cijk_Alik_Bljk_HSS_BH_MT128x128x64_MI32x32x8x1_SE_1LDSB1_AF0EM8_AMAS3_ASEM1_EPS1_GRVW8_GSU3_ISA908_KLA_LBSPP128_LPA8_LPB8_LRVW8_MAC_NLCA1_NLCB1_PGR1_PLR9_SIA3_SU0_SUS0_SRVW0_TT2_64_TLDS1_VAW1_VW2_WSGRA1_WSGRB1_WG64_4_1_WGM1
    SolutionIndex: 33
    SolutionNameMin: Cijk_Alik_Bljk_HSS_BH_MT32x64x64_MI16x16x16x1_SE_1LDSB1_AF0EM8_AMAS3_ASEM1_EPS1_GRVW8_GSU1_ISA908_KLA_LBSPP128_LPA8_LPB8_LRVW8_MAC_NLCA1_NLCB1_PGR1_PLR5_SIA3_SU32_SUS256_SRVW4_TT1_32_TLDS1_VAW2_VW2_WSGRA1_WSGRB1_WG32_8_1_WGM2
    SolutionIndex: 34
    SolutionNameMin: Cijk_Alik_Bljk_HSS_BH_MT64x64x64_MI32x32x8x1_SE_1LDSB1_AF0EM8_AMAS3_ASEM1_EPS1_GRVW8_GSU1_ISA908_KLA_LBSPP128_LPA8_LPB8_LRVW8_MAC_NLCA1_NLCB1_PGR1_PLR9_SIA3_SU0_SUS0_SRVW4_TT1_32_TLDS1_VAW2_VW2_WSGRA1_WSGRB1_WG64_4_1_WGM2
    SolutionIndex: 35
    SolutionNameMin: Cijk_Alik_Bljk_HSS_BH_MT64x64x64_MI32x32x8x1_SE_1LDSB1_AF0EM8_AMAS3_ASEM1_EPS1_GRVW2_GSU1_ISA908_KLA_LBSPP128_LPA8_LPB8_LRVW8_MAC_NLCA1_NLCB1_PGR1_PLR9_SIA3_SU0_SUS0_SRVW4_TT1_32_TLDS1_VAW2_VW2_WSGRA1_WSGRB1_WG64_4_1_WGM1
    SolutionIndex: 36
    SolutionNameMin: Cijk_Alik_Bljk_HSS_BH_MT64x128x64_MI32x32x8x1_SE_1LDSB1_AF0EM8_AMAS3_ASEM1_EPS1_GRVW8_GSU1_ISA908_KLA_LBSPP128_LPA8_LPB8_LRVW8_MAC_NLCA1_NLCB1_PGR1_PLR9_SIA3_SU32_SUS256_SRVW4_TT1_64_TLDS1_VAW2_VW2_WSGRA1_WSGRB1_WG64_4_1_WGM2
    SolutionIndex: 37
    SolutionNameMin: Cijk_Alik_Bljk_HSS_BH_MT64x64x64_MI32x32x8x1_SE_1LDSB1_AF0EM8_AMAS3_ASEM1_EPS1_GRVW8_GSU1_ISA908_KLA_LBSPP128_LPA8_LPB8_LRVW8_MAC_NLCA1_NLCB1_PGR1_PLR9_SIA3_SU32_SUS128_SRVW4_TT1_32_TLDS1_VAW2_VW2_WSGRA1_WSGRB1_WG64_4_1_WGM1
    SolutionIndex: 38
    SolutionNameMin: Cijk_Alik_Bljk_HSS_BH_MT64x32x64_MI16x16x16x1_SE_1LDSB1_AF0EM1_AMAS3_ASEM1_EPS1_GRVW8_GSU1_ISA908_KLA_LBSPP128_LPA8_LPB8_LRVW8_MAC_NLCA1_NLCB1_PGR1_PLR5_SIA3_SU0_SUS0_SRVW4_TT2_16_TLDS1_VAW2_VW2_WSGRA1_WSGRB1_WG32_8_1_WGM1
    SolutionIndex: 39
    SolutionNameMin: Cijk_Alik_Bljk_HSS_BH_MT32x32x64_MI16x16x16x1_SE_1LDSB0_AF0EM8_AMAS3_ASEM1_EPS1_GRVW8_GSU1_ISA908_KLA_LBSPP128_LPA8_LPB8_LRVW8_MAC_NLCA1_NLCB1_PGR1_PLR5_SIA3_SU32_SUS128_SRVW4_TT1_16_TLDS1_VAW2_VW2_WSGRA1_WSGRB1_WG32_8_1_WGM1
    SolutionIndex: 40
    SolutionNameMin: Cijk_Alik_Bljk_HSS_BH_MT16x16x128_MI16x16x16x1_SE_1LDSB0_AF0EM8_AMAS3_ASEM1_EPS1_GRVW8_GSU1_ISA908_KLA_LBSPP256_LPA8_LPB8_LRVW8_MAC_NLCA1_NLCB1_PGR1_PLR9_SIA3_SU32_SUS256_SRVW0_TT1_16_TLDS1_VAW2_VW2_WSGRA1_WSGRB1_WG16_4_1_WGM15
    SolutionIndex: 41
    SolutionNameMin: Cijk_Alik_Bljk_HSS_BH_MT64x64x64_MI32x32x8x1_SE_1LDSB1_AF0EM8_AMAS3_ASEM1_EPS1_GRVW8_GSU1_ISA908_KLA_LBSPP128_LPA8_LPB8_LRVW8_MAC_NLCA1_NLCB1_PGR1_PLR9_SIA3_SU32_SUS256_SRVW4_TT1_32_TLDS1_VAW2_VW2_WSGRA1_WSGRB1_WG64_4_1_WGM1
    SolutionIndex: 42
    SolutionNameMin: Cijk_Alik_Bljk_HSS_BH_MT64x64x64_MI32x32x8x1_SE_1LDSB1_AF0EM8_AMAS3_ASEM1_EPS1_GRVW8_GSU1_ISA908_KLA_LBSPP128_LPA8_LPB8_LRVW8_MAC_NLCA1_NLCB1_PGR1_PLR9_SIA3_SU32_SUS128_SRVW4_TT1_32_TLDS1_VAW2_VW2_WSGRA1_WSGRB1_WG64_4_1_WGM2
    SolutionIndex: 43
    SolutionNameMin: Cijk_Alik_Bljk_HSS_BH_MT64x64x64_MI32x32x8x1_SE_1LDSB1_AF0EM8_AMAS3_ASEM1_EPS1_GRVW8_GSU1_ISA908_KLA_LBSPP128_LPA8_LPB8_LRVW8_MAC_NLCA1_NLCB1_PGR1_PLR9_SIA3_SU32_SUS256_SRVW4_TT1_32_TLDS1_VAW2_VW2_WSGRA1_WSGRB1_WG64_4_1_WGM2
    SolutionIndex: 44
    SolutionNameMin: Cijk_Alik_Bljk_HSS_BH_MT32x32x64_MI16x16x16x1_SE_1LDSB0_AF0EM8_AMAS3_ASEM1_EPS1_GRVW4_GSU1_ISA908_KLA_LBSPP128_LPA8_LPB8_LRVW8_MAC_NLCA1_NLCB1_PGR1_PLR5_SIA3_SU0_SUS0_SRVW4_TT1_16_TLDS1_VAW2_VW2_WSGRA1_WSGRB1_WG32_8_1_WGM15
    SolutionIndex: 45
    SolutionNameMin: Cijk_Alik_Bljk_HSS_BH_MT64x64x64_MI32x32x8x1_SE_1LDSB1_AF0EM8_AMAS3_ASEM1_EPS1_GRVW8_GSU2_ISA908_KLA_LBSPP128_LPA8_LPB8_LRVW8_MAC_NLCA1_NLCB1_PGR1_PLR9_SIA3_SU32_SUS128_SRVW0_TT1_32_TLDS1_VAW1_VW2_WSGRA1_WSGRB1_WG64_4_1_WGM15
    SolutionIndex: 46
    SolutionNameMin: Cijk_Alik_Bljk_HSS_BH_MT128x128x64_MI32x32x8x1_SE_1LDSB1_AF0EM8_AMAS3_ASEM1_EPS1_GRVW4_GSU3_ISA908_KLA_LBSPP128_LPA8_LPB8_LRVW8_MAC_NLCA1_NLCB1_PGR1_PLR9_SIA3_SU32_SUS256_SRVW0_TT2_64_TLDS1_VAW1_VW2_WSGRA1_WSGRB1_WG64_4_1_WGM15
    SolutionIndex: 47
    SolutionNameMin: Cijk_Alik_Bljk_HSS_BH_MT64x128x64_MI32x32x8x1_SE_1LDSB1_AF0EM8_AMAS3_ASEM1_EPS1_GRVW8_GSU1_ISA908_KLA_LBSPP128_LPA8_LPB8_LRVW8_MAC_NLCA1_NLCB1_PGR1_PLR9_SIA3_SU32_SUS128_SRVW4_TT1_64_TLDS1_VAW2_VW2_WSGRA1_WSGRB1_WG64_4_1_WGM2
    SolutionIndex: 48
    SolutionNameMin: Cijk_Alik_Bljk_HSS_BH_MT64x128x64_MI32x32x8x1_SE_1LDSB1_AF0EM8_AMAS3_ASEM1_EPS1_GRVW8_GSU1_ISA908_KLA_LBSPP128_LPA8_LPB8_LRVW8_MAC_NLCA1_NLCB1_PGR1_PLR9_SIA3_SU32_SUS256_SRVW4_TT1_64_TLDS1_VAW2_VW2_WSGRA1_WSGRB1_WG64_4_1_WGM1
    SolutionIndex: 49
    SolutionNameMin: Cijk_Alik_Bljk_HSS_BH_MT64x64x64_MI32x32x8x1_SE_1LDSB1_AF0EM1_AMAS3_ASEM1_EPS1_GRVW8_GSU1_ISA908_KLA_LBSPP128_LPA8_LPB8_LRVW8_MAC_NLCA1_NLCB1_PGR1_PLR9_SIA3_SU0_SUS0_SRVW4_TT1_32_TLDS1_VAW2_VW2_WSGRA1_WSGRB1_WG64_4_1_WGM1
    SolutionIndex: 50
    SolutionNameMin: Cijk_Alik_Bljk_HSS_BH_MT64x64x32_MI32x32x8x1_SE_1LDSB1_AF0EM1_AMAS3_ASEM1_EPS1_GRVW8_GSU1_ISA908_KLA_LBSPP128_LPA8_LPB8_LRVW8_MAC_NLCA1_NLCB1_PGR1_PLR5_SIA3_SU0_SUS0_SRVW4_TT1_32_TLDS1_VAW2_VW2_WSGRA1_WSGRB1_WG64_4_1_WGM1
    SolutionIndex: 51
    SolutionNameMin: Cijk_Alik_Bljk_HSS_BH_MT64x128x64_MI32x32x8x1_SE_1LDSB1_AF0EM8_AMAS3_ASEM1_EPS1_GRVW8_GSU1_ISA908_KLA_LBSPP128_LPA8_LPB8_LRVW8_MAC_NLCA1_NLCB1_PGR1_PLR9_SIA3_SU0_SUS0_SRVW4_TT1_64_TLDS1_VAW2_VW2_WSGRA1_WSGRB1_WG64_4_1_WGM1
    SolutionIndex: 52
    SolutionNameMin: Cijk_Alik_Bljk_HSS_BH_MT96x96x64_MI16x16x16x1_SE_1LDSB1_AF0EM8_AMAS3_ASEM1_EPS1_GRVW8_GSU1_ISA908_KLA_LBSPP128_LPA8_LPB8_LRVW8_MAC_NLCA1_NLCB1_PGR1_PLR5_SIA3_SU32_SUS256_SRVW0_TT3_48_TLDS1_VAW2_VW2_WSGRA1_WSGRB1_WG32_8_1_WGM2
    SolutionIndex: 53
    SolutionNameMin: Cijk_Alik_Bljk_HSS_BH_MT128x96x64_MI32x32x8x1_SE_1LDSB1_AF0EM8_AMAS3_ASEM1_EPS1_GRVW8_GSU1_ISA908_KLA_LBSPP128_LPA8_LPB8_LRVW8_MAC_NLCA1_NLCB1_PGR1_PLR9_SIA3_SU32_SUS128_SRVW4_TT1_96_TLDS1_VAW2_VW2_WSGRA1_WSGRB1_WG128_2_1_WGM1
    SolutionIndex: 54
    SolutionNameMin: Cijk_Alik_Bljk_HSS_BH_MT32x32x32_MI16x16x16x1_SE_1LDSB0_AF0EM1_AMAS3_ASEM1_EPS1_GRVW2_GSU1_ISA908_KLA_LBSPP128_LPA8_LPB8_LRVW8_MAC_NLCA1_NLCB1_PGR1_PLR2_SIA3_SU0_SUS0_SRVW4_TT1_16_TLDS1_VAW2_VW2_WSGRA1_WSGRB1_WG32_8_1_WGM1
    SolutionIndex: 55
    SolutionNameMin: Cijk_Alik_Bljk_HSS_BH_MT128x96x64_MI32x32x8x1_SE_1LDSB1_AF0EM8_AMAS3_ASEM1_EPS1_GRVW8_GSU1_ISA908_KLA_LBSPP128_LPA8_LPB8_LRVW8_MAC_NLCA1_NLCB1_PGR1_PLR9_SIA3_SU0_SUS0_SRVW4_TT1_96_TLDS1_VAW2_VW2_WSGRA1_WSGRB1_WG128_2_1_WGM15
    SolutionIndex: 56
    SolutionNameMin: Cijk_Alik_Bljk_HSS_BH_MT128x160x32_MI32x32x8x1_SE_1LDSB1_AF0EM8_AMAS3_ASEM1_EPS1_GRVW4_GSU1_ISA908_KLA_LBSPP128_LPA8_LPB8_LRVW8_MAC_NLCA1_NLCB1_PGR1_PLR5_SIA3_SU0_SUS0_SRVW4_TT1_160_TLDS1_VAW2_VW2_WSGRA1_WSGRB1_WG128_2_1_WGM15
    SolutionIndex: 57
    SolutionNameMin: Cijk_Alik_Bljk_HSS_BH_MT128x96x64_MI32x32x8x1_SE_1LDSB1_AF0EM8_AMAS3_ASEM1_EPS1_GRVW8_GSU1_ISA908_KLA_LBSPP128_LPA8_LPB8_LRVW8_MAC_NLCA1_NLCB1_PGR1_PLR9_SIA3_SU0_SUS0_SRVW4_TT1_96_TLDS1_VAW2_VW2_WSGRA1_WSGRB1_WG128_2_1_WGM1
    SolutionIndex: 58
    SolutionNameMin: Cijk_Alik_Bljk_HSS_BH_MT64x64x64_MI32x32x8x1_SE_1LDSB1_AF0EM8_AMAS3_ASEM1_EPS1_GRVW4_GSU1_ISA908_KLA_LBSPP128_LPA8_LPB8_LRVW8_MAC_NLCA1_NLCB1_PGR1_PLR9_SIA3_SU0_SUS0_SRVW4_TT1_32_TLDS1_VAW2_VW2_WSGRA1_WSGRB1_WG64_4_1_WGM1
    SolutionIndex: 59
    SolutionNameMin: Cijk_Alik_Bljk_HSS_BH_MT64x64x64_MI32x32x8x1_SE_1LDSB1_AF0EM8_AMAS3_ASEM1_EPS1_GRVW4_GSU1_ISA908_KLA_LBSPP128_LPA8_LPB8_LRVW8_MAC_NLCA1_NLCB1_PGR1_PLR9_SIA3_SU32_SUS256_SRVW4_TT1_32_TLDS1_VAW2_VW2_WSGRA1_WSGRB1_WG64_4_1_WGM1
    SolutionIndex: 60
    SolutionNameMin: Cijk_Alik_Bljk_HSS_BH_MT128x144x32_MI16x16x16x1_SE_1LDSB1_AF0EM8_AMAS3_ASEM1_EPS1_GRVW2_GSU1_ISA908_KLA_LBSPP128_LPA8_LPB8_LRVW8_MAC_NLCA1_NLCB1_PGR1_PLR2_SIA3_SU0_SUS0_SRVW4_TT2_144_TLDS1_VAW2_VW2_WSGRA1_WSGRB1_WG64_4_1_WGM1
    SolutionIndex: 61
    SolutionNameMin: Cijk_Alik_Bljk_HSS_BH_MT128x160x32_MI32x32x8x1_SE_1LDSB1_AF0EM8_AMAS3_ASEM1_EPS1_GRVW4_GSU1_ISA908_KLA_LBSPP128_LPA8_LPB8_LRVW8_MAC_NLCA1_NLCB1_PGR1_PLR5_SIA3_SU32_SUS128_SRVW4_TT1_160_TLDS1_VAW2_VW2_WSGRA1_WSGRB1_WG128_2_1_WGM2
    SolutionIndex: 62
    SolutionNameMin: Cijk_Alik_Bljk_HSS_BH_MT128x160x32_MI32x32x8x1_SE_1LDSB1_AF0EM8_AMAS3_ASEM1_EPS1_GRVW4_GSU1_ISA908_KLA_LBSPP128_LPA8_LPB8_LRVW8_MAC_NLCA1_NLCB1_PGR1_PLR5_SIA3_SU0_SUS0_SRVW4_TT1_160_TLDS1_VAW2_VW2_WSGRA1_WSGRB1_WG128_2_1_WGM1
    SolutionIndex: 63
    SolutionNameMin: Cijk_Alik_Bljk_HSS_BH_MT128x96x64_MI32x32x8x1_SE_1LDSB1_AF0EM8_AMAS3_ASEM1_EPS1_GRVW8_GSU1_ISA908_KLA_LBSPP128_LPA8_LPB8_LRVW8_MAC_NLCA1_NLCB1_PGR1_PLR9_SIA3_SU0_SUS0_SRVW4_TT1_96_TLDS1_VAW2_VW2_WSGRA1_WSGRB1_WG128_2_1_WGM2
    SolutionIndex: 64
    SolutionNameMin: Cijk_Alik_Bljk_HSS_BH_MT128x96x32_MI32x32x8x1_SE_1LDSB1_AF0EM8_AMAS3_ASEM1_EPS1_GRVW4_GSU1_ISA908_KLA_LBSPP128_LPA8_LPB8_LRVW8_MAC_NLCA1_NLCB1_PGR1_PLR5_SIA3_SU0_SUS0_SRVW4_TT1_96_TLDS1_VAW2_VW2_WSGRA1_WSGRB1_WG128_2_1_WGM1
    SolutionIndex: 65
    SolutionNameMin: Cijk_Alik_Bljk_HSS_BH_MT128x96x64_MI32x32x8x1_SE_1LDSB1_AF0EM8_AMAS3_ASEM1_EPS1_GRVW8_GSU1_ISA908_KLA_LBSPP128_LPA8_LPB8_LRVW8_MAC_NLCA1_NLCB1_PGR1_PLR9_SIA3_SU32_SUS128_SRVW4_TT1_96_TLDS1_VAW2_VW2_WSGRA1_WSGRB1_WG128_2_1_WGM2
    SolutionIndex: 66
    SolutionNameMin: Cijk_Alik_Bljk_HSS_BH_MT128x160x32_MI32x32x8x1_SE_1LDSB1_AF0EM8_AMAS3_ASEM1_EPS1_GRVW4_GSU1_ISA908_KLA_LBSPP128_LPA8_LPB8_LRVW8_MAC_NLCA1_NLCB1_PGR1_PLR5_SIA3_SU32_SUS128_SRVW4_TT1_160_TLDS1_VAW2_VW2_WSGRA1_WSGRB1_WG128_2_1_WGM15
    SolutionIndex: 67
    SolutionNameMin: Cijk_Alik_Bljk_HSS_BH_MT64x64x64_MI32x32x8x1_SE_1LDSB1_AF0EM8_AMAS3_ASEM1_EPS1_GRVW4_GSU1_ISA908_KLA_LBSPP128_LPA8_LPB8_LRVW8_MAC_NLCA1_NLCB1_PGR1_PLR9_SIA3_SU0_SUS0_SRVW4_TT1_32_TLDS1_VAW2_VW2_WSGRA1_WSGRB1_WG64_4_1_WGM15
    SolutionIndex: 68
    SolutionNameMin: Cijk_Alik_Bljk_HSS_BH_MT128x96x32_MI32x32x8x1_SE_1LDSB1_AF0EM8_AMAS3_ASEM1_EPS1_GRVW4_GSU1_ISA908_KLA_LBSPP128_LPA8_LPB8_LRVW8_MAC_NLCA1_NLCB1_PGR1_PLR5_SIA3_SU0_SUS0_SRVW4_TT1_96_TLDS1_VAW2_VW2_WSGRA1_WSGRB1_WG128_2_1_WGM15
    SolutionIndex: 69
    SolutionNameMin: Cijk_Alik_Bljk_HSS_BH_MT128x96x32_MI32x32x8x1_SE_1LDSB1_AF0EM8_AMAS3_ASEM1_EPS1_GRVW4_GSU1_ISA908_KLA_LBSPP128_LPA8_LPB8_LRVW8_MAC_NLCA1_NLCB1_PGR1_PLR5_SIA3_SU0_SUS0_SRVW4_TT1_96_TLDS1_VAW2_VW2_WSGRA1_WSGRB1_WG128_2_1_WGM2
    SolutionIndex: 70
    SolutionNameMin: Cijk_Alik_Bljk_HSS_BH_MT64x128x64_MI32x32x8x1_SE_1LDSB1_AF0EM8_AMAS3_ASEM1_EPS1_GRVW8_GSU1_ISA908_KLA_LBSPP128_LPA8_LPB8_LRVW8_MAC_NLCA1_NLCB1_PGR1_PLR9_SIA3_SU0_SUS0_SRVW4_TT1_64_TLDS1_VAW2_VW2_WSGRA1_WSGRB1_WG64_4_1_WGM15
    SolutionIndex: 71
    SolutionNameMin: Cijk_Alik_Bljk_HSS_BH_MT64x128x32_MI32x32x8x1_SE_1LDSB1_AF0EM8_AMAS3_ASEM1_EPS1_GRVW8_GSU1_ISA908_KLA_LBSPP128_LPA8_LPB8_LRVW8_MAC_NLCA1_NLCB1_PGR1_PLR5_SIA3_SU0_SUS0_SRVW4_TT1_64_TLDS1_VAW2_VW2_WSGRA1_WSGRB1_WG64_4_1_WGM1
    SolutionIndex: 72
    SolutionNameMin: Cijk_Alik_Bljk_HSS_BH_MT128x160x32_MI32x32x8x1_SE_1LDSB1_AF0EM8_AMAS3_ASEM1_EPS1_GRVW4_GSU1_ISA908_KLA_LBSPP128_LPA8_LPB8_LRVW8_MAC_NLCA1_NLCB1_PGR1_PLR5_SIA3_SU0_SUS0_SRVW4_TT1_160_TLDS1_VAW2_VW2_WSGRA1_WSGRB1_WG128_2_1_WGM2
    SolutionIndex: 73
    SolutionNameMin: Cijk_Alik_Bljk_HSS_BH_MT128x96x64_MI32x32x8x1_SE_1LDSB1_AF0EM8_AMAS3_ASEM1_EPS1_GRVW8_GSU1_ISA908_KLA_LBSPP128_LPA8_LPB8_LRVW8_MAC_NLCA1_NLCB1_PGR1_PLR9_SIA3_SU32_SUS128_SRVW4_TT1_96_TLDS1_VAW2_VW2_WSGRA1_WSGRB1_WG128_2_1_WGM15
    SolutionIndex: 74
    SolutionNameMin: Cijk_Alik_Bljk_HSS_BH_MT32x64x64_MI16x16x16x1_SE_1LDSB0_AF0EM8_AMAS3_ASEM1_EPS1_GRVW8_GSU1_ISA908_KLA_LBSPP128_LPA8_LPB8_LRVW8_MAC_NLCA1_NLCB1_PGR1_PLR5_SIA3_SU32_SUS128_SRVW4_TT1_32_TLDS1_VAW2_VW2_WSGRA1_WSGRB1_WG32_8_1_WGM1
    SolutionIndex: 75
    SolutionNameMin: Cijk_Alik_Bljk_HSS_BH_MT128x128x64_MI32x32x8x1_SE_1LDSB1_AF0EM8_AMAS3_ASEM1_EPS1_GRVW8_GSU1_ISA908_KLA_LBSPP128_LPA8_LPB8_LRVW8_MAC_NLCA1_NLCB1_PGR1_PLR9_SIA3_SU32_SUS128_SRVW4_TT2_64_TLDS1_VAW2_VW2_WSGRA1_WSGRB1_WG64_4_1_WGM2
    SolutionIndex: 76
    SolutionNameMin: Cijk_Alik_Bljk_HSS_BH_MT128x128x64_MI32x32x8x1_SE_1LDSB1_AF0EM8_AMAS3_ASEM1_EPS1_GRVW8_GSU1_ISA908_KLA_LBSPP128_LPA8_LPB8_LRVW8_MAC_NLCA1_NLCB1_PGR1_PLR9_SIA3_SU32_SUS128_SRVW4_TT2_64_TLDS1_VAW2_VW2_WSGRA1_WSGRB1_WG64_4_1_WGM15
    SolutionIndex: 77
    SolutionNameMin: Cijk_Alik_Bljk_HSS_BH_MT128x96x64_MI32x32x8x1_SE_1LDSB1_AF0EM8_AMAS3_ASEM1_EPS1_GRVW8_GSU1_ISA908_KLA_LBSPP128_LPA8_LPB8_LRVW8_MAC_NLCA1_NLCB1_PGR1_PLR9_SIA3_SU32_SUS256_SRVW4_TT1_96_TLDS1_VAW2_VW2_WSGRA1_WSGRB1_WG128_2_1_WGM15
    SolutionIndex: 78
    SolutionNameMin: Cijk_Alik_Bljk_HSS_BH_MT128x128x64_MI32x32x8x1_SE_1LDSB1_AF0EM8_AMAS3_ASEM1_EPS1_GRVW8_GSU1_ISA908_KLA_LBSPP128_LPA8_LPB8_LRVW8_MAC_NLCA1_NLCB1_PGR1_PLR9_SIA3_SU0_SUS0_SRVW4_TT2_64_TLDS1_VAW2_VW2_WSGRA1_WSGRB1_WG64_4_1_WGM15
    SolutionIndex: 79
    SolutionNameMin: Cijk_Alik_Bljk_HSS_BH_MT128x160x64_MI32x32x8x1_SE_1LDSB1_AF0EM8_AMAS3_ASEM1_EPS1_GRVW8_GSU1_ISA908_KLA_LBSPP128_LPA8_LPB8_LRVW8_MAC_NLCA1_NLCB1_PGR1_PLR9_SIA3_SU32_SUS128_SRVW4_TT1_160_TLDS1_VAW2_VW2_WSGRA1_WSGRB1_WG128_2_1_WGM15
    SolutionIndex: 80
    SolutionNameMin: Cijk_Alik_Bljk_HSS_BH_MT128x128x64_MI32x32x8x1_SE_1LDSB1_AF0EM8_AMAS3_ASEM1_EPS1_GRVW8_GSU1_ISA908_KLA_LBSPP128_LPA8_LPB8_LRVW8_MAC_NLCA1_NLCB1_PGR1_PLR9_SIA3_SU32_SUS256_SRVW4_TT2_64_TLDS1_VAW2_VW2_WSGRA1_WSGRB1_WG64_4_1_WGM2
    SolutionIndex: 81
    SolutionNameMin: Cijk_Alik_Bljk_HSS_BH_MT128x96x64_MI32x32x8x1_SE_1LDSB1_AF0EM8_AMAS3_ASEM1_EPS1_GRVW8_GSU1_ISA908_KLA_LBSPP128_LPA8_LPB8_LRVW8_MAC_NLCA1_NLCB1_PGR1_PLR9_SIA3_SU32_SUS256_SRVW4_TT1_96_TLDS1_VAW2_VW2_WSGRA1_WSGRB1_WG128_2_1_WGM1
    SolutionIndex: 82
    SolutionNameMin: Cijk_Alik_Bljk_HSS_BH_MT128x160x64_MI32x32x8x1_SE_1LDSB1_AF0EM8_AMAS3_ASEM1_EPS1_GRVW8_GSU1_ISA908_KLA_LBSPP128_LPA8_LPB8_LRVW8_MAC_NLCA1_NLCB1_PGR1_PLR9_SIA3_SU0_SUS0_SRVW4_TT1_160_TLDS1_VAW2_VW2_WSGRA1_WSGRB1_WG128_2_1_WGM1
    SolutionIndex: 83
    SolutionNameMin: Cijk_Alik_Bljk_HSS_BH_MT64x64x64_MI32x32x8x1_SE_1LDSB1_AF0EM8_AMAS3_ASEM1_EPS1_GRVW8_GSU1_ISA908_KLA_LBSPP128_LPA8_LPB8_LRVW8_MAC_NLCA1_NLCB1_PGR1_PLR9_SIA3_SU32_SUS128_SRVW4_TT1_32_TLDS1_VAW2_VW2_WSGRA1_WSGRB1_WG64_4_1_WGM15
    SolutionIndex: 84
    SolutionNameMin: Cijk_Alik_Bljk_HSS_BH_MT96x128x64_MI32x32x8x1_SE_1LDSB1_AF0EM8_AMAS3_ASEM1_EPS1_GRVW8_GSU1_ISA908_KLA_LBSPP128_LPA8_LPB8_LRVW8_MAC_NLCA1_NLCB1_PGR1_PLR9_SIA3_SU32_SUS256_SRVW0_TT3_32_TLDS1_VAW2_VW2_WSGRA1_WSGRB1_WG32_8_1_WGM2
    SolutionIndex: 85
    SolutionNameMin: Cijk_Alik_Bljk_HSS_BH_MT128x256x64_MI32x32x8x1_SE_1LDSB1_AF0EM8_AMAS3_ASEM1_EPS1_GRVW4_GSU1_ISA908_KLA_LBSPP128_LPA8_LPB8_LRVW8_MAC_NLCA1_NLCB1_PGR1_PLR9_SIA3_SU32_SUS128_SRVW4_TT2_128_TLDS1_VAW2_VW2_WSGRA1_WSGRB1_WG64_4_1_WGM1
    SolutionIndex: 86
    SolutionNameMin: Cijk_Alik_Bljk_HSS_BH_MT128x256x64_MI32x32x8x1_SE_1LDSB1_AF0EM8_AMAS3_ASEM1_EPS1_GRVW4_GSU1_ISA908_KLA_LBSPP128_LPA8_LPB8_LRVW8_MAC_NLCA1_NLCB1_PGR1_PLR9_SIA3_SU32_SUS128_SRVW4_TT2_128_TLDS1_VAW2_VW2_WSGRA1_WSGRB1_WG64_4_1_WGM15
    SolutionIndex: 87
    SolutionNameMin: Cijk_Alik_Bljk_HSS_BH_MT96x96x64_MI16x16x16x1_SE_1LDSB0_AF0EM8_AMAS3_ASEM1_EPS1_GRVW8_GSU1_ISA908_KLA_LBSPP128_LPA8_LPB8_LRVW8_MAC_NLCA1_NLCB1_PGR1_PLR5_SIA3_SU0_SUS0_SRVW0_TT3_48_TLDS1_VAW2_VW2_WSGRA1_WSGRB1_WG32_8_1_WGM2
    SolutionIndex: 88
    SolutionNameMin: Cijk_Alik_Bljk_HSS_BH_MT128x256x64_MI32x32x8x1_SE_1LDSB1_AF0EM8_AMAS3_ASEM1_EPS1_GRVW4_GSU1_ISA908_KLA_LBSPP128_LPA8_LPB8_LRVW8_MAC_NLCA1_NLCB1_PGR1_PLR9_SIA3_SU32_SUS128_SRVW4_TT2_128_TLDS1_VAW2_VW2_WSGRA1_WSGRB1_WG64_4_1_WGM2
    SolutionIndex: 89
    SolutionNameMin: Cijk_Alik_Bljk_HSS_BH_MT128x96x64_MI32x32x8x1_SE_1LDSB0_AF0EM8_AMAS3_ASEM1_EPS1_GRVW8_GSU1_ISA908_KLA_LBSPP128_LPA8_LPB8_LRVW8_MAC_NLCA1_NLCB1_PGR1_PLR9_SIA3_SU0_SUS0_SRVW4_TT1_96_TLDS1_VAW2_VW2_WSGRA1_WSGRB1_WG128_2_1_WGM15
    SolutionIndex: 90
    SolutionNameMin: Cijk_Alik_Bljk_HSS_BH_MT128x256x64_MI32x32x8x1_SE_1LDSB1_AF0EM8_AMAS3_ASEM1_EPS1_GRVW4_GSU1_ISA908_KLA_LBSPP128_LPA8_LPB8_LRVW8_MAC_NLCA1_NLCB1_PGR1_PLR9_SIA3_SU32_SUS256_SRVW4_TT2_128_TLDS1_VAW2_VW2_WSGRA1_WSGRB1_WG64_4_1_WGM2
    SolutionIndex: 91
    SolutionNameMin: Cijk_Alik_Bljk_HSS_BH_MT128x160x64_MI32x32x8x1_SE_1LDSB1_AF0EM8_AMAS3_ASEM1_EPS1_GRVW4_GSU1_ISA908_KLA_LBSPP128_LPA8_LPB8_LRVW8_MAC_NLCA1_NLCB1_PGR1_PLR9_SIA3_SU32_SUS256_SRVW4_TT1_160_TLDS1_VAW2_VW2_WSGRA1_WSGRB1_WG128_2_1_WGM2
    SolutionIndex: 92
    SolutionNameMin: Cijk_Alik_Bljk_HSS_BH_MT128x96x64_MI32x32x8x1_SE_1LDSB1_AF0EM8_AMAS3_ASEM1_EPS1_GRVW8_GSU1_ISA908_KLA_LBSPP128_LPA8_LPB8_LRVW8_MAC_NLCA1_NLCB1_PGR1_PLR9_SIA3_SU32_SUS256_SRVW4_TT1_96_TLDS1_VAW2_VW2_WSGRA1_WSGRB1_WG128_2_1_WGM2
    SolutionIndex: 93
    SolutionNameMin: Cijk_Alik_Bljk_HSS_BH_MT128x128x64_MI32x32x8x1_SE_1LDSB1_AF0EM8_AMAS3_ASEM1_EPS1_GRVW8_GSU1_ISA908_KLA_LBSPP128_LPA8_LPB8_LRVW8_MAC_NLCA1_NLCB1_PGR1_PLR9_SIA3_SU0_SUS0_SRVW4_TT2_64_TLDS1_VAW2_VW2_WSGRA1_WSGRB1_WG64_4_1_WGM2
    SolutionIndex: 94
    SolutionNameMin: Cijk_Alik_Bljk_HSS_BH_MT128x160x64_MI32x32x8x1_SE_1LDSB1_AF0EM8_AMAS3_ASEM1_EPS1_GRVW8_GSU1_ISA908_KLA_LBSPP128_LPA8_LPB8_LRVW8_MAC_NLCA1_NLCB1_PGR1_PLR9_SIA3_SU0_SUS0_SRVW4_TT1_160_TLDS1_VAW2_VW2_WSGRA1_WSGRB1_WG128_2_1_WGM15
    SolutionIndex: 95
    SolutionNameMin: Cijk_Alik_Bljk_HSS_BH_MT96x128x64_MI32x32x8x1_SE_1LDSB1_AF0EM8_AMAS3_ASEM1_EPS1_GRVW8_GSU1_ISA908_KLA_LBSPP128_LPA8_LPB8_LRVW8_MAC_NLCA1_NLCB1_PGR1_PLR9_SIA3_SU0_SUS0_SRVW0_TT3_32_TLDS1_VAW2_VW2_WSGRA1_WSGRB1_WG32_8_1_WGM1
    SolutionIndex: 96
    SolutionNameMin: Cijk_Alik_Bljk_HSS_BH_MT64x64x64_MI32x32x8x1_SE_1LDSB1_AF0EM8_AMAS3_ASEM1_EPS1_GRVW8_GSU3_ISA908_KLA_LBSPP128_LPA8_LPB8_LRVW8_MAC_NLCA1_NLCB1_PGR1_PLR9_SIA3_SU0_SUS0_SRVW0_TT1_32_TLDS1_VAW1_VW2_WSGRA1_WSGRB1_WG64_4_1_WGM1
    SolutionIndex: 97
    SolutionNameMin: Cijk_Alik_Bljk_HSS_BH_MT128x128x64_MI32x32x8x1_SE_1LDSB1_AF0EM8_AMAS3_ASEM1_EPS1_GRVW8_GSU1_ISA908_KLA_LBSPP128_LPA8_LPB8_LRVW8_MAC_NLCA1_NLCB1_PGR1_PLR9_SIA3_SU32_SUS256_SRVW4_TT2_64_TLDS1_VAW2_VW2_WSGRA1_WSGRB1_WG64_4_1_WGM1
    SolutionIndex: 98
    SolutionNameMin: Cijk_Alik_Bljk_HSS_BH_MT160x128x64_MI32x32x8x1_SE_1LDSB1_AF0EM8_AMAS3_ASEM1_EPS1_GRVW4_GSU1_ISA908_KLA_LBSPP128_LPA8_LPB8_LRVW8_MAC_NLCA1_NLCB1_PGR1_PLR9_SIA3_SU0_SUS0_SRVW0_TT5_32_TLDS1_VAW2_VW2_WSGRA1_WSGRB1_WG32_8_1_WGM1
    SolutionIndex: 99
    SolutionNameMin: Cijk_Alik_Bljk_HSS_BH_MT144x256x64_MI16x16x16x1_SE_1LDSB1_AF0EM8_AMAS3_ASEM1_EPS1_GRVW2_GSU1_ISA908_KLA_LBSPP128_LPA8_LPB8_LRVW8_MAC_NLCA1_NLCB1_PGR1_PLR5_SIA3_SU32_SUS256_SRVW0_TT9_64_TLDS1_VAW2_VW2_WSGRA1_WSGRB1_WG16_16_1_WGM1
    SolutionIndex: 100
    SolutionNameMin: Cijk_Alik_Bljk_HSS_BH_MT128x160x64_MI32x32x8x1_SE_1LDSB1_AF0EM8_AMAS3_ASEM1_EPS1_GRVW4_GSU1_ISA908_KLA_LBSPP128_LPA8_LPB8_LRVW8_MAC_NLCA1_NLCB1_PGR1_PLR9_SIA3_SU32_SUS128_SRVW4_TT1_160_TLDS1_VAW2_VW2_WSGRA1_WSGRB1_WG128_2_1_WGM15
    SolutionIndex: 101
    SolutionNameMin: Cijk_Alik_Bljk_HSS_BH_MT128x288x64_MI32x32x8x1_SE_1LDSB1_AF0EM8_AMAS3_ASEM1_EPS1_GRVW4_GSU1_ISA908_KLA_LBSPP128_LPA8_LPB8_LRVW8_MAC_NLCA1_NLCB1_PGR1_PLR9_SIA3_SU32_SUS128_SRVW4_TT1_288_TLDS1_VAW2_VW2_WSGRA1_WSGRB1_WG128_2_1_WGM2
    SolutionIndex: 102
    SolutionNameMin: Cijk_Alik_Bljk_HSS_BH_MT128x288x64_MI32x32x8x1_SE_1LDSB1_AF0EM8_AMAS3_ASEM1_EPS1_GRVW4_GSU1_ISA908_KLA_LBSPP128_LPA8_LPB8_LRVW8_MAC_NLCA1_NLCB1_PGR1_PLR9_SIA3_SU32_SUS256_SRVW4_TT1_288_TLDS1_VAW2_VW2_WSGRA1_WSGRB1_WG128_2_1_WGM2
    SolutionIndex: 103
    SolutionNameMin: Cijk_Alik_Bljk_HSS_BH_MT128x160x64_MI32x32x8x1_SE_1LDSB1_AF0EM8_AMAS3_ASEM1_EPS1_GRVW4_GSU1_ISA908_KLA_LBSPP128_LPA8_LPB8_LRVW8_MAC_NLCA1_NLCB1_PGR1_PLR9_SIA3_SU32_SUS128_SRVW4_TT1_160_TLDS1_VAW2_VW2_WSGRA1_WSGRB1_WG128_2_1_WGM2
    SolutionIndex: 104
    SolutionNameMin: Cijk_Alik_Bljk_HSS_BH_MT64x64x64_MI32x32x8x1_SE_1LDSB0_AF0EM8_AMAS3_ASEM1_EPS1_GRVW8_GSU1_ISA908_KLA_LBSPP128_LPA8_LPB8_LRVW8_MAC_NLCA1_NLCB1_PGR1_PLR9_SIA3_SU32_SUS256_SRVW4_TT1_32_TLDS1_VAW2_VW2_WSGRA1_WSGRB1_WG64_4_1_WGM15
    SolutionIndex: 105
    SolutionNameMin: Cijk_Alik_Bljk_HSS_BH_MT64x128x64_MI32x32x8x1_SE_1LDSB0_AF0EM8_AMAS3_ASEM1_EPS1_GRVW8_GSU1_ISA908_KLA_LBSPP128_LPA8_LPB8_LRVW8_MAC_NLCA1_NLCB1_PGR1_PLR9_SIA3_SU0_SUS0_SRVW4_TT1_64_TLDS1_VAW2_VW2_WSGRA1_WSGRB1_WG64_4_1_WGM15
    SolutionIndex: 106
    SolutionNameMin: Cijk_Alik_Bljk_HSS_BH_MT128x96x64_MI32x32x8x1_SE_1LDSB0_AF0EM8_AMAS3_ASEM1_EPS1_GRVW8_GSU1_ISA908_KLA_LBSPP128_LPA8_LPB8_LRVW8_MAC_NLCA1_NLCB1_PGR1_PLR9_SIA3_SU0_SUS0_SRVW4_TT1_96_TLDS1_VAW2_VW2_WSGRA1_WSGRB1_WG128_2_1_WGM2
    SolutionIndex: 107
    SolutionNameMin: Cijk_Alik_Bljk_HSS_BH_MT128x288x64_MI32x32x8x1_SE_1LDSB1_AF0EM8_AMAS3_ASEM1_EPS1_GRVW4_GSU1_ISA908_KLA_LBSPP128_LPA8_LPB8_LRVW8_MAC_NLCA1_NLCB1_PGR1_PLR9_SIA3_SU32_SUS128_SRVW4_TT1_288_TLDS1_VAW2_VW2_WSGRA1_WSGRB1_WG128_2_1_WGM1
    SolutionIndex: 108
    SolutionNameMin: Cijk_Alik_Bljk_HSS_BH_MT256x160x64_MI32x32x8x1_SE_1LDSB1_AF0EM8_AMAS3_ASEM1_EPS1_GRVW2_GSU1_ISA908_KLA_LBSPP128_LPA8_LPB8_LRVW8_MAC_NLCA1_NLCB1_PGR1_PLR9_SIA3_SU0_SUS0_SRVW4_TT2_160_TLDS1_VAW2_VW2_WSGRA1_WSGRB1_WG128_2_1_WGM2
    SolutionIndex: 109
    SolutionNameMin: Cijk_Alik_Bljk_HSS_BH_MT256x160x64_MI32x32x8x1_SE_1LDSB1_AF0EM8_AMAS3_ASEM1_EPS1_GRVW2_GSU1_ISA908_KLA_LBSPP128_LPA8_LPB8_LRVW8_MAC_NLCA1_NLCB1_PGR1_PLR9_SIA3_SU32_SUS128_SRVW4_TT2_160_TLDS1_VAW2_VW2_WSGRA1_WSGRB1_WG128_2_1_WGM1
    SolutionIndex: 110
    SolutionNameMin: Cijk_Alik_Bljk_HSS_BH_MT128x160x64_MI32x32x8x1_SE_1LDSB1_AF0EM8_AMAS3_ASEM1_EPS1_GRVW4_GSU1_ISA908_KLA_LBSPP128_LPA8_LPB8_LRVW8_MAC_NLCA1_NLCB1_PGR1_PLR9_SIA3_SU0_SUS0_SRVW4_TT1_160_TLDS1_VAW2_VW2_WSGRA1_WSGRB1_WG128_2_1_WGM15
    SolutionIndex: 111
    SolutionNameMin: Cijk_Alik_Bljk_HSS_BH_MT128x128x64_MI32x32x8x1_SE_1LDSB1_AF0EM8_AMAS3_ASEM1_EPS1_GRVW8_GSU1_ISA908_KLA_LBSPP128_LPA8_LPB8_LRVW8_MAC_NLCA1_NLCB1_PGR1_PLR9_SIA3_SU32_SUS128_SRVW4_TT2_64_TLDS1_VAW2_VW2_WSGRA1_WSGRB1_WG64_4_1_WGM1
    SolutionIndex: 112
    SolutionNameMin: Cijk_Alik_Bljk_HSS_BH_MT128x288x64_MI32x32x8x1_SE_1LDSB1_AF0EM8_AMAS3_ASEM1_EPS1_GRVW4_GSU1_ISA908_KLA_LBSPP128_LPA8_LPB8_LRVW8_MAC_NLCA1_NLCB1_PGR1_PLR9_SIA3_SU32_SUS128_SRVW4_TT1_288_TLDS1_VAW2_VW2_WSGRA1_WSGRB1_WG128_2_1_WGM15
    SolutionIndex: 113
    SolutionNameMin: Cijk_Alik_Bljk_HSS_BH_MT128x160x32_MI32x32x8x1_SE_1LDSB1_AF0EM8_AMAS3_ASEM1_EPS1_GRVW2_GSU1_ISA908_KLA_LBSPP128_LPA8_LPB8_LRVW8_MAC_NLCA1_NLCB1_PGR1_PLR5_SIA3_SU0_SUS0_SRVW4_TT1_160_TLDS1_VAW2_VW2_WSGRA1_WSGRB1_WG128_2_1_WGM1
    SolutionIndex: 114
    SolutionNameMin: Cijk_Alik_Bljk_HSS_BH_MT160x160x64_MI16x16x16x1_SE_1LDSB1_AF0EM8_AMAS3_ASEM1_EPS1_GRVW2_GSU1_ISA908_KLA_LBSPP128_LPA8_LPB8_LRVW8_MAC_NLCA1_NLCB1_PGR1_PLR5_SIA3_SU32_SUS128_SRVW0_TT5_80_TLDS1_VAW2_VW2_WSGRA1_WSGRB1_WG32_8_1_WGM2
    SolutionIndex: 115
    SolutionNameMin: Cijk_Alik_Bljk_HSS_BH_MT128x128x64_MI32x32x8x1_SE_1LDSB1_AF0EM8_AMAS3_ASEM1_EPS1_GRVW8_GSU1_ISA908_KLA_LBSPP128_LPA8_LPB8_LRVW8_MAC_NLCA1_NLCB1_PGR1_PLR9_SIA3_SU32_SUS256_SRVW4_TT2_64_TLDS1_VAW2_VW2_WSGRA1_WSGRB1_WG64_4_1_WGM15
    SolutionIndex: 116
    SolutionNameMin: Cijk_Alik_Bljk_HSS_BH_MT128x160x32_MI32x32x8x1_SE_1LDSB1_AF0EM8_AMAS3_ASEM1_EPS1_GRVW2_GSU1_ISA908_KLA_LBSPP128_LPA8_LPB8_LRVW8_MAC_NLCA1_NLCB1_PGR1_PLR5_SIA3_SU0_SUS0_SRVW4_TT1_160_TLDS1_VAW2_VW2_WSGRA1_WSGRB1_WG128_2_1_WGM15
    SolutionIndex: 117
    SolutionNameMin: Cijk_Alik_Bljk_HSS_BH_MT64x128x32_MI32x32x8x1_SE_1LDSB1_AF0EM8_AMAS3_ASEM1_EPS1_GRVW8_GSU1_ISA908_KLA_LBSPP128_LPA8_LPB8_LRVW8_MAC_NLCA1_NLCB1_PGR1_PLR5_SIA3_SU32_SUS256_SRVW4_TT1_64_TLDS1_VAW2_VW2_WSGRA1_WSGRB1_WG64_4_1_WGM15
    SolutionIndex: 118
    SolutionNameMin: Cijk_Alik_Bljk_HSS_BH_MT128x256x32_MI32x32x8x1_SE_1LDSB1_AF0EM8_AMAS3_ASEM1_EPS1_GRVW8_GSU1_ISA908_KLA_LBSPP128_LPA8_LPB8_LRVW8_MAC_NLCA1_NLCB1_PGR1_PLR5_SIA3_SU0_SUS0_SRVW4_TT2_128_TLDS1_VAW2_VW2_WSGRA1_WSGRB1_WG64_4_1_WGM1
    SolutionIndex: 119
    SolutionNameMin: Cijk_Alik_Bljk_HSS_BH_MT128x160x32_MI32x32x8x1_SE_1LDSB1_AF0EM8_AMAS3_ASEM1_EPS1_GRVW4_GSU1_ISA908_KLA_LBSPP128_LPA8_LPB8_LRVW8_MAC_NLCA1_NLCB1_PGR1_PLR5_SIA3_SU32_SUS256_SRVW4_TT1_160_TLDS1_VAW2_VW2_WSGRA1_WSGRB1_WG128_2_1_WGM2
    SolutionIndex: 120
    SolutionNameMin: Cijk_Alik_Bljk_HSS_BH_MT128x96x64_MI32x32x8x1_SE_1LDSB1_AF0EM8_AMAS3_ASEM1_EPS1_GRVW4_GSU1_ISA908_KLA_LBSPP128_LPA8_LPB8_LRVW8_MAC_NLCA1_NLCB1_PGR1_PLR9_SIA3_SU0_SUS0_SRVW4_TT1_96_TLDS1_VAW2_VW2_WSGRA1_WSGRB1_WG128_2_1_WGM15
    SolutionIndex: 121
    SolutionNameMin: Cijk_Alik_Bljk_HSS_BH_MT256x160x64_MI32x32x8x1_SE_1LDSB1_AF0EM8_AMAS3_ASEM1_EPS1_GRVW2_GSU1_ISA908_KLA_LBSPP128_LPA8_LPB8_LRVW8_MAC_NLCA1_NLCB1_PGR1_PLR9_SIA3_SU0_SUS0_SRVW4_TT2_160_TLDS1_VAW2_VW2_WSGRA1_WSGRB1_WG128_2_1_WGM1
    SolutionIndex: 122
    SolutionNameMin: Cijk_Alik_Bljk_HSS_BH_MT256x160x64_MI32x32x8x1_SE_1LDSB1_AF0EM1_AMAS3_ASEM1_EPS1_GRVW2_GSU1_ISA908_KLA_LBSPP128_LPA8_LPB8_LRVW8_MAC_NLCA1_NLCB1_PGR1_PLR9_SIA3_SU0_SUS0_SRVW4_TT2_160_TLDS1_VAW2_VW2_WSGRA1_WSGRB1_WG128_2_1_WGM15
    SolutionIndex: 123
    SolutionNameMin: Cijk_Alik_Bljk_HSS_BH_MT256x160x64_MI32x32x8x1_SE_1LDSB1_AF0EM8_AMAS3_ASEM1_EPS1_GRVW2_GSU1_ISA908_KLA_LBSPP128_LPA8_LPB8_LRVW8_MAC_NLCA1_NLCB1_PGR1_PLR9_SIA3_SU32_SUS128_SRVW4_TT2_160_TLDS1_VAW2_VW2_WSGRA1_WSGRB1_WG128_2_1_WGM15
    SolutionIndex: 124
    SolutionNameMin: Cijk_Alik_Bljk_HSS_BH_MT128x160x32_MI32x32x8x1_SE_1LDSB1_AF0EM1_AMAS3_ASEM1_EPS1_GRVW2_GSU1_ISA908_KLA_LBSPP128_LPA8_LPB8_LRVW8_MAC_NLCA1_NLCB1_PGR1_PLR5_SIA3_SU32_SUS128_SRVW4_TT1_160_TLDS1_VAW2_VW2_WSGRA1_WSGRB1_WG128_2_1_WGM15
    SolutionIndex: 125
    SolutionNameMin: Cijk_Alik_Bljk_HSS_BH_MT128x96x64_MI32x32x8x1_SE_1LDSB1_AF0EM1_AMAS3_ASEM1_EPS1_GRVW8_GSU1_ISA908_KLA_LBSPP128_LPA8_LPB8_LRVW8_MAC_NLCA1_NLCB1_PGR1_PLR9_SIA3_SU32_SUS128_SRVW4_TT1_96_TLDS1_VAW2_VW2_WSGRA1_WSGRB1_WG128_2_1_WGM15
    SolutionIndex: 126
    SolutionNameMin: Cijk_Alik_Bljk_HSS_BH_MT128x160x32_MI32x32x8x1_SE_1LDSB1_AF0EM1_AMAS3_ASEM1_EPS1_GRVW4_GSU1_ISA908_KLA_LBSPP128_LPA8_LPB8_LRVW8_MAC_NLCA1_NLCB1_PGR1_PLR5_SIA3_SU32_SUS128_SRVW4_TT1_160_TLDS1_VAW2_VW2_WSGRA1_WSGRB1_WG128_2_1_WGM15
    SolutionIndex: 127
    SolutionNameMin: Cijk_Alik_Bljk_HSS_BH_MT16x16x32_MI16x16x16x1_SE_1LDSB1_AF0EM1_AMAS3_ASEM1_EPS1_GRVW2_GSU1_ISA908_KLA_LBSPP128_LPA8_LPB8_LRVW8_MAC_NLCA1_NLCB1_PGR1_PLR2_SIA3_SU0_SUS0_SRVW0_TT1_16_TLDS1_VAW2_VW2_WSGRA1_WSGRB1_WG16_4_1_WGM2
    SolutionIndex: 128
    SolutionNameMin: Cijk_Alik_Bljk_HSS_BH_MT16x16x64_MI16x16x16x1_SE_1LDSB0_AF0EM1_AMAS3_ASEM1_EPS1_GRVW8_GSU1_ISA908_KLA_LBSPP128_LPA8_LPB8_LRVW8_MAC_NLCA1_NLCB1_PGR1_PLR5_SIA3_SU0_SUS0_SRVW0_TT1_16_TLDS1_VAW2_VW2_WSGRA1_WSGRB1_WG16_4_1_WGM1
    SolutionIndex: 129
    SolutionNameMin: Cijk_Alik_Bljk_HSS_BH_MT16x16x32_MI16x16x16x1_SE_1LDSB1_AF0EM1_AMAS3_ASEM1_EPS1_GRVW8_GSU1_ISA908_KLA_LBSPP128_LPA8_LPB8_LRVW8_MAC_NLCA1_NLCB1_PGR1_PLR2_SIA3_SU0_SUS0_SRVW0_TT1_16_TLDS1_VAW2_VW2_WSGRA1_WSGRB1_WG16_4_1_WGM1
    SolutionIndex: 130
    SolutionNameMin: Cijk_Alik_Bljk_HSS_BH_MT32x32x32_MI16x16x16x1_SE_1LDSB1_AF0EM8_AMAS3_ASEM1_EPS1_GRVW4_GSU1_ISA908_KLA_LBSPP128_LPA8_LPB8_LRVW8_MAC_NLCA1_NLCB1_PGR1_PLR2_SIA3_SU0_SUS0_SRVW4_TT1_16_TLDS1_VAW2_VW2_WSGRA1_WSGRB1_WG32_8_1_WGM1
    SolutionIndex: 131
    SolutionNameMin: Cijk_Alik_Bljk_HSS_BH_MT64x32x32_MI16x16x16x1_SE_1LDSB1_AF0EM8_AMAS3_ASEM1_EPS1_GRVW4_GSU1_ISA908_KLA_LBSPP128_LPA8_LPB8_LRVW8_MAC_NLCA1_NLCB1_PGR1_PLR2_SIA3_SU0_SUS0_SRVW4_TT2_16_TLDS1_VAW2_VW2_WSGRA1_WSGRB1_WG32_8_1_WGM1
    SolutionIndex: 132
    SolutionNameMin: Cijk_Alik_Bljk_HSS_BH_MT32x32x32_MI16x16x16x1_SE_1LDSB1_AF0EM1_AMAS3_ASEM1_EPS1_GRVW2_GSU1_ISA908_KLA_LBSPP128_LPA8_LPB8_LRVW8_MAC_NLCA1_NLCB1_PGR1_PLR2_SIA3_SU0_SUS0_SRVW4_TT1_16_TLDS1_VAW2_VW2_WSGRA1_WSGRB1_WG32_8_1_WGM1
    SolutionIndex: 133
    SolutionNameMin: Cijk_Alik_Bljk_HSS_BH_MT32x32x32_MI16x16x16x1_SE_1LDSB0_AF0EM8_AMAS3_ASEM1_EPS1_GRVW8_GSU1_ISA908_KLA_LBSPP128_LPA8_LPB8_LRVW8_MAC_NLCA1_NLCB1_PGR1_PLR2_SIA3_SU0_SUS0_SRVW4_TT1_16_TLDS1_VAW2_VW2_WSGRA1_WSGRB1_WG32_8_1_WGM1
    SolutionIndex: 134
    SolutionNameMin: Cijk_Alik_Bljk_HSS_BH_MT32x32x32_MI16x16x16x1_SE_1LDSB1_AF0EM8_AMAS3_ASEM1_EPS1_GRVW4_GSU1_ISA908_KLA_LBSPP128_LPA8_LPB8_LRVW8_MAC_NLCA1_NLCB1_PGR1_PLR2_SIA3_SU0_SUS0_SRVW4_TT1_16_TLDS1_VAW2_VW2_WSGRA1_WSGRB1_WG32_8_1_WGM15
    SolutionIndex: 135
    SolutionNameMin: Cijk_Alik_Bljk_HSS_BH_MT64x32x32_MI16x16x16x1_SE_1LDSB1_AF0EM8_AMAS3_ASEM1_EPS1_GRVW8_GSU1_ISA908_KLA_LBSPP128_LPA8_LPB8_LRVW8_MAC_NLCA1_NLCB1_PGR1_PLR2_SIA3_SU0_SUS0_SRVW4_TT2_16_TLDS1_VAW2_VW2_WSGRA1_WSGRB1_WG32_8_1_WGM1
    SolutionIndex: 136
    SolutionNameMin: Cijk_Alik_Bljk_HSS_BH_MT16x16x32_MI16x16x16x1_SE_1LDSB0_AF0EM1_AMAS3_ASEM1_EPS1_GRVW8_GSU1_ISA908_KLA_LBSPP128_LPA8_LPB8_LRVW8_MAC_NLCA1_NLCB1_PGR1_PLR2_SIA3_SU0_SUS0_SRVW0_TT1_16_TLDS1_VAW2_VW2_WSGRA1_WSGRB1_WG16_4_1_WGM1
    SolutionIndex: 137
    SolutionNameMin: Cijk_Alik_Bljk_HSS_BH_MT32x64x32_MI16x16x16x1_SE_1LDSB1_AF0EM8_AMAS3_ASEM1_EPS1_GRVW2_GSU1_ISA908_KLA_LBSPP128_LPA8_LPB8_LRVW8_MAC_NLCA1_NLCB1_PGR1_PLR2_SIA3_SU0_SUS0_SRVW4_TT1_32_TLDS1_VAW2_VW2_WSGRA1_WSGRB1_WG32_8_1_WGM1
    SolutionIndex: 138
    SolutionNameMin: Cijk_Alik_Bljk_HSS_BH_MT32x64x32_MI16x16x16x1_SE_1LDSB1_AF0EM1_AMAS3_ASEM1_EPS1_GRVW2_GSU1_ISA908_KLA_LBSPP128_LPA8_LPB8_LRVW8_MAC_NLCA1_NLCB1_PGR1_PLR2_SIA3_SU0_SUS0_SRVW4_TT1_32_TLDS1_VAW2_VW2_WSGRA1_WSGRB1_WG32_8_1_WGM2
    SolutionIndex: 139
    SolutionNameMin: Cijk_Alik_Bljk_HSS_BH_MT16x16x128_MI16x16x16x1_SE_1LDSB0_AF0EM1_AMAS3_ASEM1_EPS1_GRVW8_GSU1_ISA908_KLA_LBSPP256_LPA8_LPB8_LRVW8_MAC_NLCA1_NLCB1_PGR1_PLR9_SIA3_SU0_SUS0_SRVW0_TT1_16_TLDS1_VAW2_VW2_WSGRA1_WSGRB1_WG16_4_1_WGM2
    SolutionIndex: 140
    SolutionNameMin: Cijk_Alik_Bljk_HSS_BH_MT32x32x64_MI16x16x16x1_SE_1LDSB0_AF0EM1_AMAS3_ASEM1_EPS1_GRVW4_GSU5_ISA908_KLA_LBSPP128_LPA8_LPB8_LRVW8_MAC_NLCA1_NLCB1_PGR1_PLR5_SIA3_SU0_SUS0_SRVW0_TT1_16_TLDS1_VAW1_VW2_WSGRA1_WSGRB1_WG32_8_1_WGM1
    SolutionIndex: 141
    SolutionNameMin: Cijk_Alik_Bljk_HSS_BH_MT32x32x64_MI16x16x16x1_SE_1LDSB0_AF0EM8_AMAS3_ASEM1_EPS1_GRVW2_GSU1_ISA908_KLA_LBSPP128_LPA8_LPB8_LRVW8_MAC_NLCA1_NLCB1_PGR1_PLR5_SIA3_SU0_SUS0_SRVW4_TT1_16_TLDS1_VAW2_VW2_WSGRA1_WSGRB1_WG32_8_1_WGM2
    SolutionIndex: 142
    SolutionNameMin: Cijk_Alik_Bljk_HSS_BH_MT64x64x32_MI32x32x8x1_SE_1LDSB1_AF0EM8_AMAS3_ASEM1_EPS1_GRVW4_GSU1_ISA908_KLA_LBSPP128_LPA8_LPB8_LRVW8_MAC_NLCA1_NLCB1_PGR1_PLR5_SIA3_SU0_SUS0_SRVW4_TT1_32_TLDS1_VAW2_VW2_WSGRA1_WSGRB1_WG64_4_1_WGM15
    SolutionIndex: 143
    SolutionNameMin: Cijk_Alik_Bljk_HSS_BH_MT64x128x32_MI32x32x8x1_SE_1LDSB1_AF0EM8_AMAS3_ASEM1_EPS1_GRVW8_GSU1_ISA908_KLA_LBSPP128_LPA8_LPB8_LRVW8_MAC_NLCA1_NLCB1_PGR1_PLR5_SIA3_SU0_SUS0_SRVW4_TT1_64_TLDS1_VAW2_VW2_WSGRA1_WSGRB1_WG64_4_1_WGM2
    SolutionIndex: 144
    SolutionNameMin: Cijk_Alik_Bljk_HSS_BH_MT32x32x32_MI16x16x16x1_SE_1LDSB1_AF0EM8_AMAS3_ASEM1_EPS1_GRVW8_GSU1_ISA908_KLA_LBSPP128_LPA8_LPB8_LRVW8_MAC_NLCA1_NLCB1_PGR1_PLR2_SIA3_SU0_SUS0_SRVW4_TT1_16_TLDS1_VAW2_VW2_WSGRA1_WSGRB1_WG32_8_1_WGM1
    SolutionIndex: 145
    SolutionNameMin: Cijk_Alik_Bljk_HSS_BH_MT128x96x32_MI32x32x8x1_SE_1LDSB1_AF0EM8_AMAS3_ASEM1_EPS1_GRVW2_GSU1_ISA908_KLA_LBSPP128_LPA8_LPB8_LRVW8_MAC_NLCA1_NLCB1_PGR1_PLR5_SIA3_SU0_SUS0_SRVW4_TT1_96_TLDS1_VAW2_VW2_WSGRA1_WSGRB1_WG128_2_1_WGM1
    SolutionIndex: 146
    SolutionNameMin: Cijk_Alik_Bljk_HSS_BH_MT32x32x32_MI16x16x16x1_SE_1LDSB0_AF0EM1_AMAS3_ASEM1_EPS1_GRVW4_GSU1_ISA908_KLA_LBSPP128_LPA8_LPB8_LRVW8_MAC_NLCA1_NLCB1_PGR1_PLR2_SIA3_SU0_SUS0_SRVW4_TT1_16_TLDS1_VAW2_VW2_WSGRA1_WSGRB1_WG32_8_1_WGM1
    SolutionIndex: 147
    SolutionNameMin: Cijk_Alik_Bljk_HSS_BH_MT128x256x64_MI32x32x8x1_SE_1LDSB1_AF0EM8_AMAS3_ASEM1_EPS1_GRVW2_GSU1_ISA908_KLA_LBSPP128_LPA8_LPB8_LRVW8_MAC_NLCA1_NLCB1_PGR1_PLR9_SIA3_SU0_SUS0_SRVW4_TT2_128_TLDS1_VAW2_VW2_WSGRA1_WSGRB1_WG64_4_1_WGM1
    SolutionIndex: 148
    SolutionNameMin: Cijk_Alik_Bljk_HSS_BH_MT128x256x64_MI32x32x8x1_SE_1LDSB1_AF0EM8_AMAS3_ASEM1_EPS1_GRVW2_GSU1_ISA908_KLA_LBSPP128_LPA8_LPB8_LRVW8_MAC_NLCA1_NLCB1_PGR1_PLR9_SIA3_SU32_SUS128_SRVW4_TT2_128_TLDS1_VAW2_VW2_WSGRA1_WSGRB1_WG64_4_1_WGM2
    SolutionIndex: 149
    SolutionNameMin: Cijk_Alik_Bljk_HSS_BH_MT144x128x64_MI16x16x16x1_SE_1LDSB1_AF0EM8_AMAS3_ASEM1_EPS1_GRVW4_GSU1_ISA908_KLA_LBSPP128_LPA8_LPB8_LRVW8_MAC_NLCA1_NLCB1_PGR1_PLR5_SIA3_SU0_SUS0_SRVW0_TT9_32_TLDS1_VAW2_VW2_WSGRA1_WSGRB1_WG16_16_1_WGM1
    SolutionIndex: 150
    SolutionNameMin: Cijk_Alik_Bljk_HSS_BH_MT128x96x64_MI32x32x8x1_SE_1LDSB1_AF0EM1_AMAS3_ASEM1_EPS1_GRVW8_GSU1_ISA908_KLA_LBSPP128_LPA8_LPB8_LRVW8_MAC_NLCA1_NLCB1_PGR1_PLR9_SIA3_SU0_SUS0_SRVW4_TT1_96_TLDS1_VAW2_VW2_WSGRA1_WSGRB1_WG128_2_1_WGM15
    SolutionIndex: 151
    SolutionNameMin: Cijk_Alik_Bljk_HSS_BH_MT128x96x64_MI32x32x8x1_SE_1LDSB1_AF0EM1_AMAS3_ASEM1_EPS1_GRVW8_GSU1_ISA908_KLA_LBSPP128_LPA8_LPB8_LRVW8_MAC_NLCA1_NLCB1_PGR1_PLR9_SIA3_SU32_SUS128_SRVW4_TT1_96_TLDS1_VAW2_VW2_WSGRA1_WSGRB1_WG128_2_1_WGM1
    SolutionIndex: 152
    SolutionNameMin: Cijk_Alik_Bljk_HSS_BH_MT64x32x64_MI16x16x16x1_SE_1LDSB1_AF0EM8_AMAS3_ASEM1_EPS1_GRVW2_GSU1_ISA908_KLA_LBSPP128_LPA8_LPB8_LRVW8_MAC_NLCA1_NLCB1_PGR1_PLR5_SIA3_SU0_SUS0_SRVW4_TT2_16_TLDS1_VAW2_VW2_WSGRA1_WSGRB1_WG32_8_1_WGM1
    SolutionIndex: 153
    SolutionNameMin: Cijk_Alik_Bljk_HSS_BH_MT160x160x64_MI16x16x16x1_SE_1LDSB1_AF0EM8_AMAS3_ASEM1_EPS1_GRVW2_GSU1_ISA908_KLA_LBSPP128_LPA8_LPB8_LRVW8_MAC_NLCA1_NLCB1_PGR1_PLR5_SIA3_SU0_SUS0_SRVW0_TT5_80_TLDS1_VAW2_VW2_WSGRA1_WSGRB1_WG32_8_1_WGM1
    SolutionIndex: 154
    SolutionNameMin: Cijk_Alik_Bljk_HSS_BH_MT64x32x64_MI16x16x16x1_SE_1LDSB1_AF0EM8_AMAS3_ASEM1_EPS1_GRVW2_GSU1_ISA908_KLA_LBSPP128_LPA8_LPB8_LRVW8_MAC_NLCA1_NLCB1_PGR1_PLR5_SIA3_SU32_SUS256_SRVW4_TT2_16_TLDS1_VAW2_VW2_WSGRA1_WSGRB1_WG32_8_1_WGM1
    SolutionIndex: 155
    SolutionNameMin: Cijk_Alik_Bljk_HSS_BH_MT64x64x64_MI32x32x8x1_SE_1LDSB0_AF0EM8_AMAS3_ASEM1_EPS1_GRVW8_GSU1_ISA908_KLA_LBSPP128_LPA8_LPB8_LRVW8_MAC_NLCA1_NLCB1_PGR1_PLR9_SIA3_SU0_SUS0_SRVW4_TT1_32_TLDS1_VAW2_VW2_WSGRA1_WSGRB1_WG64_4_1_WGM15
    SolutionIndex: 156
    SolutionNameMin: Cijk_Alik_Bljk_HSS_BH_MT128x256x64_MI32x32x8x1_SE_1LDSB1_AF0EM8_AMAS3_ASEM1_EPS1_GRVW2_GSU1_ISA908_KLA_LBSPP128_LPA8_LPB8_LRVW8_MAC_NLCA1_NLCB1_PGR1_PLR9_SIA3_SU0_SUS0_SRVW4_TT2_128_TLDS1_VAW2_VW2_WSGRA1_WSGRB1_WG64_4_1_WGM15
    SolutionIndex: 157
    SolutionNameMin: Cijk_Alik_Bljk_HSS_BH_MT64x4x64_MI4x4x4x16_SE_1LDSB1_AF0EM8_AMAS3_ASEM1_EPS1_GRVW8_GSU1_ISA908_KLA_LBSPP128_LPA8_LPB8_LRVW8_MAC_NLCA1_NLCB1_PGR1_PLR17_SIA3_SU32_SUS256_SRVW4_TT1_4_TLDS1_VAW2_VW2_WSGRA1_WSGRB1_WG64_1_1_WGM1
    SolutionIndex: 158
    SolutionNameMin: Cijk_Alik_Bljk_HSS_BH_MT128x288x64_MI32x32x8x1_SE_1LDSB1_AF0EM8_AMAS3_ASEM1_EPS1_GRVW4_GSU1_ISA908_KLA_LBSPP128_LPA8_LPB8_LRVW8_MAC_NLCA1_NLCB1_PGR1_PLR9_SIA3_SU0_SUS0_SRVW4_TT1_288_TLDS1_VAW2_VW2_WSGRA1_WSGRB1_WG128_2_1_WGM15
    SolutionIndex: 159
    SolutionNameMin: Cijk_Alik_Bljk_HSS_BH_MT256x160x64_MI32x32x8x1_SE_1LDSB1_AF0EM8_AMAS3_ASEM1_EPS1_GRVW2_GSU1_ISA908_KLA_LBSPP128_LPA8_LPB8_LRVW8_MAC_NLCA1_NLCB1_PGR1_PLR9_SIA3_SU32_SUS256_SRVW4_TT2_160_TLDS1_VAW2_VW2_WSGRA1_WSGRB1_WG128_2_1_WGM2
    SolutionIndex: 160
    SolutionNameMin: Cijk_Alik_Bljk_HSS_BH_MT32x64x32_MI16x16x16x1_SE_1LDSB1_AF0EM8_AMAS3_ASEM1_EPS1_GRVW4_GSU1_ISA908_KLA_LBSPP128_LPA8_LPB8_LRVW8_MAC_NLCA1_NLCB1_PGR1_PLR2_SIA3_SU0_SUS0_SRVW4_TT1_32_TLDS1_VAW2_VW2_WSGRA1_WSGRB1_WG32_8_1_WGM15
    SolutionIndex: 161
    SolutionNameMin: Cijk_Alik_Bljk_HSS_BH_MT32x64x32_MI16x16x16x1_SE_1LDSB1_AF0EM1_AMAS3_ASEM1_EPS1_GRVW2_GSU1_ISA908_KLA_LBSPP128_LPA8_LPB8_LRVW8_MAC_NLCA1_NLCB1_PGR1_PLR2_SIA3_SU0_SUS0_SRVW4_TT1_32_TLDS1_VAW2_VW2_WSGRA1_WSGRB1_WG32_8_1_WGM15
    SolutionIndex: 162
    SolutionNameMin: Cijk_Alik_Bljk_HSS_BH_MT96x96x32_MI16x16x16x1_SE_1LDSB0_AF0EM8_AMAS3_ASEM1_EPS1_GRVW4_GSU1_ISA908_KLA_LBSPP128_LPA8_LPB8_LRVW8_MAC_NLCA1_NLCB1_PGR1_PLR2_SIA3_SU0_SUS0_SRVW0_TT3_48_TLDS1_VAW2_VW2_WSGRA1_WSGRB1_WG32_8_1_WGM1
    SolutionIndex: 163
    SolutionNameMin: Cijk_Alik_Bljk_HSS_BH_MT64x64x64_MI32x32x8x1_SE_1LDSB0_AF0EM8_AMAS3_ASEM1_EPS1_GRVW8_GSU1_ISA908_KLA_LBSPP128_LPA8_LPB8_LRVW8_MAC_NLCA1_NLCB1_PGR1_PLR9_SIA3_SU0_SUS0_SRVW4_TT1_32_TLDS1_VAW2_VW2_WSGRA1_WSGRB1_WG64_4_1_WGM2
    SolutionIndex: 164
    SolutionNameMin: Cijk_Alik_Bljk_HSS_BH_MT128x96x64_MI32x32x8x1_SE_1LDSB1_AF0EM1_AMAS3_ASEM1_EPS1_GRVW8_GSU1_ISA908_KLA_LBSPP128_LPA8_LPB8_LRVW8_MAC_NLCA1_NLCB1_PGR1_PLR9_SIA3_SU32_SUS256_SRVW4_TT1_96_TLDS1_VAW2_VW2_WSGRA1_WSGRB1_WG128_2_1_WGM15
    SolutionIndex: 165
    SolutionNameMin: Cijk_Alik_Bljk_HSS_BH_MT128x96x64_MI32x32x8x1_SE_1LDSB1_AF0EM1_AMAS3_ASEM1_EPS1_GRVW8_GSU1_ISA908_KLA_LBSPP128_LPA8_LPB8_LRVW8_MAC_NLCA1_NLCB1_PGR1_PLR9_SIA3_SU0_SUS0_SRVW4_TT1_96_TLDS1_VAW2_VW2_WSGRA1_WSGRB1_WG128_2_1_WGM2
    SolutionIndex: 166
    SolutionNameMin: Cijk_Alik_Bljk_HSS_BH_MT32x64x32_MI16x16x16x1_SE_1LDSB1_AF0EM8_AMAS3_ASEM1_EPS1_GRVW2_GSU1_ISA908_KLA_LBSPP128_LPA8_LPB8_LRVW8_MAC_NLCA1_NLCB1_PGR1_PLR2_SIA3_SU0_SUS0_SRVW4_TT1_32_TLDS1_VAW2_VW2_WSGRA1_WSGRB1_WG32_8_1_WGM15
    SolutionIndex: 167
    SolutionNameMin: Cijk_Alik_Bljk_HSS_BH_MT128x256x32_MI32x32x8x1_SE_1LDSB1_AF0EM8_AMAS3_ASEM1_EPS1_GRVW8_GSU1_ISA908_KLA_LBSPP128_LPA8_LPB8_LRVW8_MAC_NLCA1_NLCB1_PGR1_PLR5_SIA3_SU32_SUS128_SRVW4_TT2_128_TLDS1_VAW2_VW2_WSGRA1_WSGRB1_WG64_4_1_WGM15
    SolutionIndex: 168
    SolutionNameMin: Cijk_Alik_Bljk_HSS_BH_MT96x128x64_MI32x32x8x1_SE_1LDSB1_AF0EM8_AMAS3_ASEM1_EPS1_GRVW2_GSU1_ISA908_KLA_LBSPP128_LPA8_LPB8_LRVW8_MAC_NLCA1_NLCB1_PGR1_PLR9_SIA3_SU32_SUS128_SRVW0_TT3_32_TLDS1_VAW2_VW2_WSGRA1_WSGRB1_WG32_8_1_WGM1
    SolutionIndex: 169
    SolutionNameMin: Cijk_Alik_Bljk_HSS_BH_MT64x32x64_MI16x16x16x1_SE_1LDSB1_AF0EM8_AMAS3_ASEM1_EPS1_GRVW4_GSU1_ISA908_KLA_LBSPP128_LPA8_LPB8_LRVW8_MAC_NLCA1_NLCB1_PGR1_PLR5_SIA3_SU0_SUS0_SRVW4_TT2_16_TLDS1_VAW2_VW2_WSGRA1_WSGRB1_WG32_8_1_WGM1
    SolutionIndex: 170
    SolutionNameMin: Cijk_Alik_Bljk_HSS_BH_MT128x96x64_MI32x32x8x1_SE_1LDSB1_AF0EM8_AMAS3_ASEM1_EPS1_GRVW4_GSU1_ISA908_KLA_LBSPP128_LPA8_LPB8_LRVW8_MAC_NLCA1_NLCB1_PGR1_PLR9_SIA3_SU32_SUS256_SRVW4_TT1_96_TLDS1_VAW2_VW2_WSGRA1_WSGRB1_WG128_2_1_WGM15
    SolutionIndex: 171
    SolutionNameMin: Cijk_Alik_Bljk_HSS_BH_MT128x256x64_MI32x32x8x1_SE_1LDSB1_AF0EM8_AMAS3_ASEM1_EPS1_GRVW2_GSU1_ISA908_KLA_LBSPP128_LPA8_LPB8_LRVW8_MAC_NLCA1_NLCB1_PGR1_PLR9_SIA3_SU32_SUS128_SRVW4_TT2_128_TLDS1_VAW2_VW2_WSGRA1_WSGRB1_WG64_4_1_WGM15
    SolutionIndex: 172
    SolutionNameMin: Cijk_Alik_Bljk_HSS_BH_MT32x64x32_MI16x16x16x1_SE_1LDSB0_AF0EM8_AMAS3_ASEM1_EPS1_GRVW4_GSU1_ISA908_KLA_LBSPP128_LPA8_LPB8_LRVW8_MAC_NLCA1_NLCB1_PGR1_PLR2_SIA3_SU0_SUS0_SRVW4_TT1_32_TLDS1_VAW2_VW2_WSGRA1_WSGRB1_WG32_8_1_WGM15
    SolutionIndex: 173
    SolutionNameMin: Cijk_Alik_Bljk_HSS_BH_MT128x128x64_MI32x32x8x1_SE_1LDSB1_AF0EM8_AMAS3_ASEM1_EPS1_GRVW2_GSU2_ISA908_KLA_LBSPP128_LPA8_LPB8_LRVW8_MAC_NLCA1_NLCB1_PGR1_PLR9_SIA3_SU0_SUS0_SRVW0_TT2_64_TLDS1_VAW1_VW2_WSGRA1_WSGRB1_WG64_4_1_WGM15
    SolutionIndex: 174
    SolutionNameMin: Cijk_Alik_Bljk_HSS_BH_MT128x128x64_MI32x32x8x1_SE_1LDSB1_AF0EM8_AMAS3_ASEM1_EPS1_GRVW2_GSU3_ISA908_KLA_LBSPP128_LPA8_LPB8_LRVW8_MAC_NLCA1_NLCB1_PGR1_PLR9_SIA3_SU0_SUS0_SRVW0_TT2_64_TLDS1_VAW1_VW2_WSGRA1_WSGRB1_WG64_4_1_WGM1
    SolutionIndex: 175
    SolutionNameMin: Cijk_Alik_Bljk_HSS_BH_MT128x128x64_MI32x32x8x1_SE_1LDSB1_AF0EM8_AMAS3_ASEM1_EPS1_GRVW2_GSU2_ISA908_KLA_LBSPP128_LPA8_LPB8_LRVW8_MAC_NLCA1_NLCB1_PGR1_PLR9_SIA3_SU0_SUS0_SRVW0_TT2_64_TLDS1_VAW1_VW2_WSGRA1_WSGRB1_WG64_4_1_WGM2
    SolutionIndex: 176
    SolutionNameMin: Cijk_Alik_Bljk_HSS_BH_MT128x96x64_MI32x32x8x1_SE_1LDSB1_AF0EM8_AMAS3_ASEM1_EPS1_GRVW2_GSU1_ISA908_KLA_LBSPP128_LPA8_LPB8_LRVW8_MAC_NLCA1_NLCB1_PGR1_PLR9_SIA3_SU0_SUS0_SRVW4_TT1_96_TLDS1_VAW2_VW2_WSGRA1_WSGRB1_WG128_2_1_WGM1
    SolutionIndex: 177
    SolutionNameMin: Cijk_Alik_Bljk_HSS_BH_MT128x128x64_MI32x32x8x1_SE_1LDSB1_AF0EM8_AMAS3_ASEM1_EPS1_GRVW4_GSU1_ISA908_KLA_LBSPP128_LPA8_LPB8_LRVW8_MAC_NLCA1_NLCB1_PGR1_PLR9_SIA3_SU0_SUS0_SRVW4_TT2_64_TLDS1_VAW2_VW2_WSGRA1_WSGRB1_WG64_4_1_WGM15
    SolutionIndex: 178
    SolutionNameMin: Cijk_Alik_Bljk_HSS_BH_MT128x256x64_MI32x32x8x1_SE_1LDSB1_AF0EM8_AMAS3_ASEM1_EPS1_GRVW2_GSU1_ISA908_KLA_LBSPP128_LPA8_LPB8_LRVW8_MAC_NLCA1_NLCB1_PGR1_PLR9_SIA3_SU0_SUS0_SRVW4_TT2_128_TLDS1_VAW2_VW2_WSGRA1_WSGRB1_WG64_4_1_WGM2
    SolutionIndex: 179
    SolutionNameMin: Cijk_Alik_Bljk_HSS_BH_MT64x32x64_MI16x16x16x1_SE_1LDSB0_AF0EM8_AMAS3_ASEM1_EPS1_GRVW8_GSU5_ISA908_KLA_LBSPP128_LPA8_LPB8_LRVW8_MAC_NLCA1_NLCB1_PGR1_PLR5_SIA3_SU0_SUS0_SRVW0_TT2_16_TLDS1_VAW1_VW2_WSGRA1_WSGRB1_WG32_8_1_WGM1
    SolutionIndex: 180
    SolutionNameMin: Cijk_Alik_Bljk_HSS_BH_MT64x128x64_MI32x32x8x1_SE_1LDSB1_AF0EM8_AMAS3_ASEM1_EPS1_GRVW8_GSU1_ISA908_KLA_LBSPP128_LPA8_LPB8_LRVW8_MAC_NLCA1_NLCB1_PGR1_PLR9_SIA3_SU0_SUS0_SRVW4_TT1_64_TLDS1_VAW2_VW2_WSGRA1_WSGRB1_WG64_4_1_WGM2
    SolutionIndex: 181
    SolutionNameMin: Cijk_Alik_Bljk_HSS_BH_MT256x160x64_MI32x32x8x1_SE_1LDSB1_AF0EM8_AMAS3_ASEM1_EPS1_GRVW2_GSU1_ISA908_KLA_LBSPP128_LPA8_LPB8_LRVW8_MAC_NLCA1_NLCB1_PGR1_PLR9_SIA3_SU32_SUS128_SRVW4_TT2_160_TLDS1_VAW2_VW2_WSGRA1_WSGRB1_WG128_2_1_WGM2
    SolutionIndex: 182
    SolutionNameMin: Cijk_Alik_Bljk_HSS_BH_MT288x128x64_MI32x32x8x1_SE_1LDSB1_AF0EM8_AMAS3_ASEM1_EPS1_GRVW4_GSU1_ISA908_KLA_LBSPP128_LPA8_LPB8_LRVW8_MAC_NLCA1_NLCB1_PGR1_PLR9_SIA3_SU0_SUS0_SRVW0_TT9_32_TLDS1_VAW2_VW2_WSGRA1_WSGRB1_WG32_8_1_WGM1
    SolutionIndex: 183
    SolutionNameMin: Cijk_Alik_Bljk_HSS_BH_MT32x32x32_MI16x16x16x1_SE_1LDSB1_AF0EM1_AMAS3_ASEM1_EPS1_GRVW2_GSU1_ISA908_KLA_LBSPP128_LPA8_LPB8_LRVW8_MAC_NLCA1_NLCB1_PGR1_PLR2_SIA3_SU0_SUS0_SRVW4_TT1_16_TLDS1_VAW2_VW2_WSGRA1_WSGRB1_WG32_8_1_WGM2
- - - [512, 8, 1, 500000]
    - [0, 3.093]
  - - [512, 16, 1, 500000]
    - [1, 4.414]
  - - [1024, 8, 1, 500000]
    - [1, 2.815]
  - - [1024, 16, 1, 500000]
    - [2, 4.695]
  - - [1760, 16, 1, 1760]
    - [3, 2.061]
  - - [3072, 16, 1, 1024]
    - [4, 3.596]
  - - [2048, 16, 1, 2048]
    - [4, 3.034]
  - - [2560, 16, 1, 2560]
    - [5, 4.787]
  - - [4608, 16, 1, 1536]
    - [6, 6.056]
  - - [6144, 16, 1, 2560]
    - [5, 8.627]
  - - [4096, 16, 1, 4096]
    - [7, 6.172]
  - - [7680, 16, 1, 2560]
    - [5, 9.2]
  - - [8448, 16, 1, 2816]
    - [5, 9.706]
  - - [64, 64, 1, 256]
    - [8, 0.123]
  - - [128, 64, 1, 256]
    - [7, 0.239]
  - - [64, 128, 1, 256]
    - [9, 0.248]
  - - [128, 128, 1, 256]
    - [7, 0.467]
  - - [64, 256, 1, 256]
    - [9, 0.503]
  - - [128, 256, 1, 256]
    - [9, 0.994]
  - - [64, 448, 1, 256]
    - [9, 0.87]
  - - [128, 448, 1, 256]
    - [9, 1.717]
  - - [64, 704, 1, 256]
    - [9, 1.349]
  - - [128, 704, 1, 256]
    - [5, 2.601]
  - - [64, 1024, 1, 256]
    - [10, 1.915]
  - - [128, 1024, 1, 256]
    - [10, 3.568]
  - - [64, 1408, 1, 256]
    - [7, 2.57]
  - - [128, 1408, 1, 256]
    - [10, 4.643]
  - - [64, 1856, 1, 256]
    - [5, 3.348]
  - - [128, 1856, 1, 256]
    - [11, 5.808]
  - - [64, 2368, 1, 256]
    - [6, 4.034]
  - - [128, 2368, 1, 256]
    - [12, 6.601]
  - - [64, 2944, 1, 256]
    - [13, 4.752]
  - - [128, 2944, 1, 256]
    - [14, 7.989]
  - - [64, 3584, 1, 256]
    - [15, 5.551]
  - - [128, 3584, 1, 256]
    - [16, 9.314]
  - - [64, 4288, 1, 256]
    - [17, 5.87]
  - - [128, 4288, 1, 256]
    - [18, 10.038]
  - - [64, 5056, 1, 256]
    - [17, 6.984]
  - - [128, 5056, 1, 256]
    - [19, 11.398]
  - - [64, 5888, 1, 256]
    - [20, 7.586]
  - - [128, 5888, 1, 256]
    - [19, 12.897]
  - - [64, 6784, 1, 256]
    - [12, 8.815]
  - - [128, 6784, 1, 256]
    - [18, 14.347]
  - - [64, 64, 1, 1280]
    - [7, 0.375]
  - - [128, 64, 1, 1280]
    - [21, 0.755]
  - - [64, 128, 1, 1280]
    - [21, 0.743]
  - - [128, 128, 1, 1280]
    - [22, 1.487]
  - - [64, 256, 1, 1280]
    - [7, 1.51]
  - - [128, 256, 1, 1280]
    - [9, 2.886]
  - - [64, 448, 1, 1280]
    - [7, 2.602]
  - - [128, 448, 1, 1280]
    - [23, 5.088]
  - - [64, 704, 1, 1280]
    - [10, 4.152]
  - - [128, 704, 1, 1280]
    - [10, 7.822]
  - - [64, 1024, 1, 1280]
    - [6, 5.993]
  - - [128, 1024, 1, 1280]
    - [5, 9.346]
  - - [64, 1408, 1, 1280]
    - [10, 7.937]
  - - [128, 1408, 1, 1280]
    - [24, 11.669]
  - - [64, 1856, 1, 1280]
    - [25, 9.423]
  - - [128, 1856, 1, 1280]
    - [24, 14.899]
  - - [64, 2368, 1, 1280]
    - [26, 10.616]
  - - [128, 2368, 1, 1280]
    - [14, 15.995]
  - - [64, 2944, 1, 1280]
    - [15, 12.005]
  - - [128, 2944, 1, 1280]
    - [14, 18.887]
  - - [64, 3584, 1, 1280]
    - [24, 14.385]
  - - [128, 3584, 1, 1280]
    - [27, 20.815]
  - - [64, 4288, 1, 1280]
    - [27, 14.61]
  - - [128, 4288, 1, 1280]
    - [19, 24.261]
  - - [64, 5056, 1, 1280]
    - [27, 16.355]
  - - [128, 5056, 1, 1280]
    - [19, 26.368]
  - - [64, 5888, 1, 1280]
    - [27, 18.128]
  - - [128, 5888, 1, 1280]
    - [19, 29.311]
  - - [64, 6784, 1, 1280]
    - [12, 19.334]
  - - [128, 6784, 1, 1280]
    - [19, 31.05]
  - - [64, 64, 1, 3328]
    - [28, 0.679]
  - - [128, 64, 1, 3328]
    - [28, 1.269]
  - - [64, 128, 1, 3328]
    - [28, 1.315]
  - - [128, 128, 1, 3328]
    - [0, 2.362]
  - - [64, 256, 1, 3328]
    - [28, 2.373]
  - - [128, 256, 1, 3328]
    - [9, 4.306]
  - - [64, 448, 1, 3328]
    - [8, 4.022]
  - - [128, 448, 1, 3328]
    - [9, 7.731]
  - - [64, 704, 1, 3328]
    - [9, 6.237]
  - - [128, 704, 1, 3328]
    - [29, 11.181]
  - - [64, 1024, 1, 3328]
    - [10, 8.874]
  - - [128, 1024, 1, 3328]
    - [5, 12.561]
  - - [64, 1408, 1, 3328]
    - [25, 11.226]
  - - [128, 1408, 1, 3328]
    - [24, 15.17]
  - - [64, 1856, 1, 3328]
    - [25, 12.89]
  - - [128, 1856, 1, 3328]
    - [24, 18.923]
  - - [64, 2368, 1, 3328]
    - [26, 13.923]
  - - [128, 2368, 1, 3328]
    - [14, 20.657]
  - - [64, 2944, 1, 3328]
    - [24, 15.946]
  - - [128, 2944, 1, 3328]
    - [27, 23.614]
  - - [64, 3584, 1, 3328]
    - [30, 18.365]
  - - [128, 3584, 1, 3328]
    - [31, 26.656]
  - - [64, 4288, 1, 3328]
    - [14, 18.581]
  - - [128, 4288, 1, 3328]
    - [19, 29.99]
  - - [64, 5056, 1, 3328]
    - [27, 20.779]
  - - [128, 5056, 1, 3328]
    - [32, 32.988]
  - - [64, 5888, 1, 3328]
    - [33, 22.701]
  - - [128, 5888, 1, 3328]
    - [34, 35.404]
  - - [64, 6784, 1, 3328]
    - [35, 24.452]
  - - [128, 6784, 1, 3328]
    - [36, 37.824]
  - - [256, 64, 1, 256]
    - [9, 0.491]
  - - [448, 64, 1, 256]
    - [9, 0.859]
  - - [704, 64, 1, 256]
    - [7, 1.301]
  - - [1024, 64, 1, 256]
    - [10, 1.805]
  - - [1408, 64, 1, 256]
    - [6, 2.426]
  - - [1856, 64, 1, 256]
    - [29, 3.197]
  - - [2368, 64, 1, 256]
    - [26, 4.034]
  - - [2944, 64, 1, 256]
    - [10, 4.702]
  - - [3584, 64, 1, 256]
    - [24, 5.284]
  - - [4288, 64, 1, 256]
    - [12, 5.818]
  - - [5056, 64, 1, 256]
    - [16, 6.741]
  - - [5888, 64, 1, 256]
    - [16, 8.061]
  - - [6784, 64, 1, 256]
    - [12, 8.741]
  - - [256, 128, 1, 256]
    - [21, 0.924]
  - - [448, 128, 1, 256]
    - [9, 1.675]
  - - [704, 128, 1, 256]
    - [29, 2.51]
  - - [1024, 128, 1, 256]
    - [26, 3.413]
  - - [1408, 128, 1, 256]
    - [29, 4.545]
  - - [1856, 128, 1, 256]
    - [24, 5.692]
  - - [2368, 128, 1, 256]
    - [16, 6.426]
  - - [2944, 128, 1, 256]
    - [33, 7.783]
  - - [3584, 128, 1, 256]
    - [33, 9.009]
  - - [4288, 128, 1, 256]
    - [12, 10.038]
  - - [5056, 128, 1, 256]
    - [37, 11.658]
  - - [5888, 128, 1, 256]
    - [37, 12.897]
  - - [6784, 128, 1, 256]
    - [37, 14.347]
  - - [256, 64, 1, 1280]
    - [4, 1.498]
  - - [448, 64, 1, 1280]
    - [8, 2.602]
  - - [704, 64, 1, 1280]
    - [9, 4.058]
  - - [1024, 64, 1, 1280]
    - [5, 5.49]
  - - [1408, 64, 1, 1280]
    - [29, 7.101]
  - - [1856, 64, 1, 1280]
    - [10, 9.063]
  - - [2368, 64, 1, 1280]
    - [10, 10.374]
  - - [2944, 64, 1, 1280]
    - [24, 11.817]
  - - [3584, 64, 1, 1280]
    - [24, 13.67]
  - - [4288, 64, 1, 1280]
    - [38, 14.741]
  - - [5056, 64, 1, 1280]
    - [12, 17.075]
  - - [5888, 64, 1, 1280]
    - [38, 18.966]
  - - [6784, 64, 1, 1280]
    - [37, 20.887]
  - - [256, 128, 1, 1280]
    - [7, 2.886]
  - - [448, 128, 1, 1280]
    - [5, 5.014]
  - - [704, 128, 1, 1280]
    - [29, 7.244]
  - - [1024, 128, 1, 1280]
    - [29, 9.574]
  - - [1408, 128, 1, 1280]
    - [39, 11.244]
  - - [1856, 128, 1, 1280]
    - [24, 14.745]
  - - [2368, 128, 1, 1280]
    - [16, 15.855]
  - - [2944, 128, 1, 1280]
    - [16, 19.046]
  - - [3584, 128, 1, 1280]
    - [37, 21.807]
  - - [4288, 128, 1, 1280]
    - [37, 23.735]
  - - [5056, 128, 1, 1280]
    - [37, 27.49]
  - - [5888, 128, 1, 1280]
    - [37, 30.093]
  - - [6784, 128, 1, 1280]
    - [37, 31.616]
  - - [256, 64, 1, 3328]
    - [28, 2.33]
  - - [448, 64, 1, 3328]
    - [7, 4.059]
  - - [704, 64, 1, 3328]
    - [40, 5.971]
  - - [1024, 64, 1, 3328]
    - [10, 7.673]
  - - [1408, 64, 1, 3328]
    - [10, 10.28]
  - - [1856, 64, 1, 3328]
    - [29, 11.707]
  - - [2368, 64, 1, 3328]
    - [26, 13.681]
  - - [2944, 64, 1, 3328]
    - [39, 15.483]
  - - [3584, 64, 1, 3328]
    - [24, 17.683]
  - - [4288, 64, 1, 3328]
    - [12, 18.5]
  - - [5056, 64, 1, 3328]
    - [38, 21.442]
  - - [5888, 64, 1, 3328]
    - [16, 23.194]
  - - [6784, 64, 1, 3328]
    - [37, 25.275]
  - - [256, 128, 1, 3328]
    - [40, 4.306]
  - - [448, 128, 1, 3328]
    - [40, 7.231]
  - - [704, 128, 1, 3328]
    - [10, 10.433]
  - - [1024, 128, 1, 3328]
    - [29, 12.37]
  - - [1408, 128, 1, 3328]
    - [39, 15.008]
  - - [1856, 128, 1, 3328]
    - [24, 18.684]
  - - [2368, 128, 1, 3328]
    - [12, 21.025]
  - - [2944, 128, 1, 3328]
    - [16, 24.249]
  - - [3584, 128, 1, 3328]
    - [41, 27.215]
  - - [4288, 128, 1, 3328]
    - [37, 31.423]
  - - [5056, 128, 1, 3328]
    - [41, 34.811]
  - - [5888, 128, 1, 3328]
    - [42, 36.562]
  - - [6784, 128, 1, 3328]
    - [43, 38.69]
  - - [256, 256, 1, 256]
    - [29, 1.847]
  - - [448, 256, 1, 256]
    - [29, 3.087]
  - - [256, 448, 1, 256]
    - [5, 3.158]
  - - [448, 448, 1, 256]
    - [24, 4.857]
  - - [256, 256, 1, 1280]
    - [6, 5.377]
  - - [448, 256, 1, 1280]
    - [10, 8.695]
  - - [256, 448, 1, 1280]
    - [10, 8.081]
  - - [448, 448, 1, 1280]
    - [24, 12.522]
  - - [256, 256, 1, 3328]
    - [29, 8.331]
  - - [448, 256, 1, 3328]
    - [10, 11.711]
  - - [256, 448, 1, 3328]
    - [5, 10.694]
  - - [448, 448, 1, 3328]
    - [24, 16.11]
  - - [1760, 32, 1, 1760]
    - [9, 3.981]
  - - [3072, 32, 1, 1024]
    - [25, 5.851]
  - - [2048, 32, 1, 2048]
    - [6, 5.414]
  - - [1760, 64, 1, 1760]
    - [26, 7.276]
  - - [3072, 64, 1, 1024]
    - [39, 9.813]
  - - [2560, 32, 1, 2560]
    - [6, 8.84]
  - - [4608, 32, 1, 1536]
    - [10, 10.24]
  - - [2048, 64, 1, 2048]
    - [39, 9.339]
  - - [1760, 128, 1, 1760]
    - [44, 13.642]
  - - [3072, 128, 1, 1024]
    - [42, 17.774]
  - - [2560, 64, 1, 2560]
    - [24, 13.04]
  - - [6144, 32, 1, 2560]
    - [24, 14.23]
  - - [2048, 128, 1, 2048]
    - [42, 15.652]
  - - [4096, 32, 1, 4096]
    - [45, 9.57]
  - - [7680, 32, 1, 2560]
    - [15, 16.539]
  - - [8448, 32, 1, 2816]
    - [38, 15.589]
  - - [2560, 128, 1, 2560]
    - [16, 20.934]
  - - [4096, 64, 1, 4096]
    - [41, 16.86]
  - - [7680, 64, 1, 2560]
    - [42, 26.462]
  - - [4096, 128, 1, 4096]
    - [46, 27.758]
  - - [7680, 128, 1, 2560]
    - [47, 40.675]
  - - [704, 256, 1, 256]
    - [29, 4.545]
  - - [1024, 256, 1, 256]
    - [12, 5.558]
  - - [1408, 256, 1, 256]
    - [17, 7.444]
  - - [1856, 256, 1, 256]
    - [38, 9.486]
  - - [2368, 256, 1, 256]
    - [38, 11.346]
  - - [2944, 256, 1, 256]
    - [19, 13.375]
  - - [3584, 256, 1, 256]
    - [19, 15.371]
  - - [4288, 256, 1, 256]
    - [19, 14.61]
  - - [5056, 256, 1, 256]
    - [19, 16.671]
  - - [5888, 256, 1, 256]
    - [48, 17.877]
  - - [6784, 256, 1, 256]
    - [36, 18.999]
  - - [704, 448, 1, 256]
    - [16, 6.687]
  - - [1024, 448, 1, 256]
    - [38, 9.083]
  - - [1408, 448, 1, 256]
    - [38, 11.536]
  - - [1856, 448, 1, 256]
    - [41, 14.128]
  - - [2368, 448, 1, 256]
    - [49, 14.12]
  - - [2944, 448, 1, 256]
    - [50, 16.807]
  - - [3584, 448, 1, 256]
    - [51, 18.856]
  - - [4288, 448, 1, 256]
    - [52, 18.862]
  - - [5056, 448, 1, 256]
    - [53, 20.712]
  - - [5888, 448, 1, 256]
    - [53, 22.252]
  - - [6784, 448, 1, 256]
    - [52, 20.803]
  - - [256, 704, 1, 256]
    - [29, 4.593]
  - - [448, 704, 1, 256]
    - [54, 6.869]
  - - [704, 704, 1, 256]
    - [38, 9.499]
  - - [1024, 704, 1, 256]
    - [49, 12.606]
  - - [1408, 704, 1, 256]
    - [52, 14.569]
  - - [1856, 704, 1, 256]
    - [19, 17.013]
  - - [2368, 704, 1, 256]
    - [51, 19.016]
  - - [2944, 704, 1, 256]
    - [55, 19.097]
  - - [3584, 704, 1, 256]
    - [53, 21.588]
  - - [4288, 704, 1, 256]
    - [52, 20.604]
  - - [5056, 704, 1, 256]
    - [51, 22.862]
  - - [5888, 704, 1, 256]
    - [56, 23.477]
  - - [6784, 704, 1, 256]
    - [57, 23.543]
  - - [256, 1024, 1, 256]
    - [54, 5.658]
  - - [448, 1024, 1, 256]
    - [12, 9.236]
  - - [704, 1024, 1, 256]
    - [12, 12.699]
  - - [1024, 1024, 1, 256]
    - [49, 14.034]
  - - [1408, 1024, 1, 256]
    - [19, 18.18]
  - - [1856, 1024, 1, 256]
    - [51, 21.08]
  - - [2368, 1024, 1, 256]
    - [57, 21.279]
  - - [2944, 1024, 1, 256]
    - [58, 20.754]
  - - [3584, 1024, 1, 256]
    - [48, 22.897]
  - - [4288, 1024, 1, 256]
    - [56, 23.8]
  - - [5056, 1024, 1, 256]
    - [53, 24.807]
  - - [5888, 1024, 1, 256]
    - [52, 24.195]
  - - [6784, 1024, 1, 256]
    - [57, 25.409]
  - - [256, 1408, 1, 256]
    - [17, 7.71]
  - - [448, 1408, 1, 256]
    - [12, 11.806]
  - - [704, 1408, 1, 256]
    - [52, 14.48]
  - - [1024, 1408, 1, 256]
    - [49, 17.897]
  - - [1408, 1408, 1, 256]
    - [52, 19.386]
  - - [1856, 1408, 1, 256]
    - [53, 22.28]
  - - [2368, 1408, 1, 256]
    - [59, 21.301]
  - - [2944, 1408, 1, 256]
    - [60, 23.645]
  - - [3584, 1408, 1, 256]
    - [53, 24.131]
  - - [4288, 1408, 1, 256]
    - [60, 24.853]
  - - [5056, 1408, 1, 256]
    - [61, 26.564]
  - - [5888, 1408, 1, 256]
    - [53, 26.624]
  - - [6784, 1408, 1, 256]
    - [62, 27.017]
  - - [256, 1856, 1, 256]
    - [38, 9.486]
  - - [448, 1856, 1, 256]
    - [19, 14.028]
  - - [704, 1856, 1, 256]
    - [49, 17.2]
  - - [1024, 1856, 1, 256]
    - [51, 20.886]
  - - [1408, 1856, 1, 256]
    - [63, 22.849]
  - - [1856, 1856, 1, 256]
    - [51, 21.949]
  - - [2368, 1856, 1, 256]
    - [62, 23.876]
  - - [2944, 1856, 1, 256]
    - [53, 25.418]
  - - [3584, 1856, 1, 256]
    - [61, 25.58]
  - - [4288, 1856, 1, 256]
    - [53, 26.262]
  - - [5056, 1856, 1, 256]
    - [62, 27.35]
  - - [5888, 1856, 1, 256]
    - [60, 28.091]
  - - [6784, 1856, 1, 256]
    - [57, 27.398]
  - - [256, 2368, 1, 256]
    - [38, 11.712]
  - - [448, 2368, 1, 256]
    - [18, 14.359]
  - - [704, 2368, 1, 256]
    - [51, 19.201]
  - - [1024, 2368, 1, 256]
    - [55, 20.747]
  - - [1408, 2368, 1, 256]
    - [51, 21.53]
  - - [1856, 2368, 1, 256]
    - [61, 23.555]
  - - [2368, 2368, 1, 256]
    - [63, 25.588]
  - - [2944, 2368, 1, 256]
    - [61, 25.894]
  - - [3584, 2368, 1, 256]
    - [53, 27.11]
  - - [4288, 2368, 1, 256]
    - [60, 27.425]
  - - [5056, 2368, 1, 256]
    - [62, 28.315]
  - - [5888, 2368, 1, 256]
    - [57, 28.141]
  - - [6784, 2368, 1, 256]
    - [57, 28.257]
  - - [256, 2944, 1, 256]
    - [49, 13.375]
  - - [448, 2944, 1, 256]
    - [18, 17.266]
  - - [704, 2944, 1, 256]
    - [63, 19.32]
  - - [1024, 2944, 1, 256]
    - [48, 20.46]
  - - [1408, 2944, 1, 256]
    - [60, 23.758]
  - - [1856, 2944, 1, 256]
    - [57, 25.718]
  - - [2368, 2944, 1, 256]
    - [64, 26.137]
  - - [2944, 2944, 1, 256]
    - [65, 27.539]
  - - [3584, 2944, 1, 256]
    - [60, 27.596]
  - - [4288, 2944, 1, 256]
    - [60, 28.749]
  - - [5056, 2944, 1, 256]
    - [60, 29.326]
  - - [5888, 2944, 1, 256]
    - [65, 28.94]
  - - [6784, 2944, 1, 256]
    - [53, 29.104]
  - - [256, 3584, 1, 256]
    - [19, 15.814]
  - - [448, 3584, 1, 256]
    - [51, 18.856]
  - - [704, 3584, 1, 256]
    - [63, 22.64]
  - - [1024, 3584, 1, 256]
    - [51, 22.661]
  - - [1408, 3584, 1, 256]
    - [57, 24.571]
  - - [1856, 3584, 1, 256]
    - [61, 26.082]
  - - [2368, 3584, 1, 256]
    - [60, 27.626]
  - - [2944, 3584, 1, 256]
    - [60, 28.056]
  - - [3584, 3584, 1, 256]
    - [52, 28.104]
  - - [4288, 3584, 1, 256]
    - [53, 28.585]
  - - [5056, 3584, 1, 256]
    - [52, 28.846]
  - - [5888, 3584, 1, 256]
    - [66, 29.6]
  - - [6784, 3584, 1, 256]
    - [53, 29.271]
  - - [256, 4288, 1, 256]
    - [49, 14.942]
  - - [448, 4288, 1, 256]
    - [51, 20.546]
  - - [704, 4288, 1, 256]
    - [67, 20.663]
  - - [1024, 4288, 1, 256]
    - [68, 23.481]
  - - [1408, 4288, 1, 256]
    - [52, 24.433]
  - - [1856, 4288, 1, 256]
    - [53, 26.704]
  - - [2368, 4288, 1, 256]
    - [60, 28.254]
  - - [2944, 4288, 1, 256]
    - [60, 28.318]
  - - [3584, 4288, 1, 256]
    - [60, 28.675]
  - - [4288, 4288, 1, 256]
    - [53, 29.505]
  - - [5056, 4288, 1, 256]
    - [60, 30.607]
  - - [5888, 4288, 1, 256]
    - [63, 29.841]
  - - [6784, 4288, 1, 256]
    - [66, 30.039]
  - - [256, 5056, 1, 256]
    - [19, 16.942]
  - - [448, 5056, 1, 256]
    - [69, 20.478]
  - - [704, 5056, 1, 256]
    - [19, 22.382]
  - - [1024, 5056, 1, 256]
    - [55, 24.131]
  - - [1408, 5056, 1, 256]
    - [61, 26.319]
  - - [1856, 5056, 1, 256]
    - [61, 27.789]
  - - [2368, 5056, 1, 256]
    - [52, 28.287]
  - - [2944, 5056, 1, 256]
    - [60, 29.11]
  - - [3584, 5056, 1, 256]
    - [52, 29.273]
  - - [4288, 5056, 1, 256]
    - [52, 29.833]
  - - [5056, 5056, 1, 256]
    - [60, 30.545]
  - - [5888, 5056, 1, 256]
    - [60, 30.285]
  - - [6784, 5056, 1, 256]
    - [60, 30.211]
  - - [256, 5888, 1, 256]
    - [70, 17.966]
  - - [448, 5888, 1, 256]
    - [71, 21.065]
  - - [704, 5888, 1, 256]
    - [56, 22.725]
  - - [1024, 5888, 1, 256]
    - [49, 24.074]
  - - [1408, 5888, 1, 256]
    - [53, 26.767]
  - - [1856, 5888, 1, 256]
    - [63, 28.273]
  - - [2368, 5888, 1, 256]
    - [65, 29.56]
  - - [2944, 5888, 1, 256]
    - [65, 29.812]
  - - [3584, 5888, 1, 256]
    - [61, 29.739]
  - - [4288, 5888, 1, 256]
    - [53, 30.41]
  - - [5056, 5888, 1, 256]
    - [60, 30.741]
  - - [5888, 5888, 1, 256]
    - [60, 30.637]
  - - [6784, 5888, 1, 256]
    - [66, 30.38]
  - - [256, 6784, 1, 256]
    - [70, 19.442]
  - - [448, 6784, 1, 256]
    - [19, 20.396]
  - - [704, 6784, 1, 256]
    - [63, 24.241]
  - - [1024, 6784, 1, 256]
    - [72, 25.37]
  - - [1408, 6784, 1, 256]
    - [61, 27.439]
  - - [1856, 6784, 1, 256]
    - [60, 29.866]
  - - [2368, 6784, 1, 256]
    - [60, 29.696]
  - - [2944, 6784, 1, 256]
    - [65, 29.849]
  - - [3584, 6784, 1, 256]
    - [52, 30.497]
  - - [4288, 6784, 1, 256]
    - [53, 30.634]
  - - [5056, 6784, 1, 256]
    - [60, 31.352]
  - - [5888, 6784, 1, 256]
    - [73, 30.99]
  - - [6784, 6784, 1, 256]
    - [66, 30.893]
  - - [704, 256, 1, 1280]
    - [24, 11.186]
  - - [1024, 256, 1, 1280]
    - [33, 13.773]
  - - [1408, 256, 1, 1280]
    - [74, 18.452]
  - - [1856, 256, 1, 1280]
    - [41, 22.766]
  - - [2368, 256, 1, 1280]
    - [42, 25.934]
  - - [2944, 256, 1, 1280]
    - [49, 30.5]
  - - [3584, 256, 1, 1280]
    - [36, 33.508]
  - - [4288, 256, 1, 1280]
    - [57, 36.526]
  - - [5056, 256, 1, 1280]
    - [73, 40.482]
  - - [5888, 256, 1, 1280]
    - [75, 41.223]
  - - [6784, 256, 1, 1280]
    - [76, 46.127]
  - - [704, 448, 1, 1280]
    - [16, 16.791]
  - - [1024, 448, 1, 1280]
    - [42, 22.069]
  - - [1408, 448, 1, 1280]
    - [42, 27.678]
  - - [1856, 448, 1, 1280]
    - [47, 31.822]
  - - [2368, 448, 1, 1280]
    - [77, 35.898]
  - - [2944, 448, 1, 1280]
    - [53, 40.93]
  - - [3584, 448, 1, 1280]
    - [78, 42.932]
  - - [4288, 448, 1, 1280]
    - [52, 45.12]
  - - [5056, 448, 1, 1280]
    - [79, 48.625]
  - - [5888, 448, 1, 1280]
    - [77, 51.546]
  - - [6784, 448, 1, 1280]
    - [80, 44.67]
  - - [256, 704, 1, 1280]
    - [15, 11.071]
  - - [448, 704, 1, 1280]
    - [33, 16.942]
  - - [704, 704, 1, 1280]
    - [41, 22.235]
  - - [1024, 704, 1, 1280]
    - [48, 29.472]
  - - [1408, 704, 1, 1280]
    - [52, 35.872]
  - - [1856, 704, 1, 1280]
    - [81, 42.999]
  - - [2368, 704, 1, 1280]
    - [80, 45.801]
  - - [2944, 704, 1, 1280]
    - [82, 44.413]
  - - [3584, 704, 1, 1280]
    - [77, 49.466]
  - - [4288, 704, 1, 1280]
    - [78, 44.369]
  - - [5056, 704, 1, 1280]
    - [80, 50.399]
  - - [5888, 704, 1, 1280]
    - [66, 48.968]
  - - [6784, 704, 1, 1280]
    - [77, 51.08]
  - - [256, 1024, 1, 1280]
    - [38, 13.653]
  - - [448, 1024, 1, 1280]
    - [83, 21.382]
  - - [704, 1024, 1, 1280]
    - [41, 29.573]
  - - [1024, 1024, 1, 1280]
    - [65, 33.495]
  - - [1408, 1024, 1, 1280]
    - [84, 41.023]
  - - [1856, 1024, 1, 1280]
    - [80, 50.145]
  - - [2368, 1024, 1, 1280]
    - [63, 49.148]
  - - [2944, 1024, 1, 1280]
    - [85, 43.719]
  - - [3584, 1024, 1, 1280]
    - [86, 51.903]
  - - [4288, 1024, 1, 1280]
    - [56, 51.015]
  - - [5056, 1024, 1, 1280]
    - [55, 54.022]
  - - [5888, 1024, 1, 1280]
    - [73, 51.295]
  - - [6784, 1024, 1, 1280]
    - [77, 56.685]
  - - [256, 1408, 1, 1280]
    - [27, 18.373]
  - - [448, 1408, 1, 1280]
    - [19, 27.374]
  - - [704, 1408, 1, 1280]
    - [87, 35.026]
  - - [1024, 1408, 1, 1280]
    - [73, 42.644]
  - - [1408, 1408, 1, 1280]
    - [52, 45.319]
  - - [1856, 1408, 1, 1280]
    - [55, 51.233]
  - - [2368, 1408, 1, 1280]
    - [88, 49.065]
  - - [2944, 1408, 1, 1280]
    - [53, 54.03]
  - - [3584, 1408, 1, 1280]
    - [73, 52.747]
  - - [4288, 1408, 1, 1280]
    - [77, 51.769]
  - - [5056, 1408, 1, 1280]
    - [73, 57.852]
  - - [5888, 1408, 1, 1280]
    - [73, 57.602]
  - - [6784, 1408, 1, 1280]
    - [73, 57.962]
  - - [256, 1856, 1, 1280]
    - [41, 21.477]
  - - [448, 1856, 1, 1280]
    - [49, 31.924]
  - - [704, 1856, 1, 1280]
    - [89, 42.764]
  - - [1024, 1856, 1, 1280]
    - [75, 47.728]
  - - [1408, 1856, 1, 1280]
    - [57, 51.741]
  - - [1856, 1856, 1, 1280]
    - [90, 50.26]
  - - [2368, 1856, 1, 1280]
    - [91, 50.965]
  - - [2944, 1856, 1, 1280]
    - [92, 55.657]
  - - [3584, 1856, 1, 1280]
    - [73, 55.296]
  - - [4288, 1856, 1, 1280]
    - [73, 55.914]
  - - [5056, 1856, 1, 1280]
    - [61, 57.263]
  - - [5888, 1856, 1, 1280]
    - [73, 58.077]
  - - [6784, 1856, 1, 1280]
    - [73, 59.031]
  - - [256, 2368, 1, 1280]
    - [19, 26.027]
  - - [448, 2368, 1, 1280]
    - [89, 35.696]
  - - [704, 2368, 1, 1280]
    - [93, 46.333]
  - - [1024, 2368, 1, 1280]
    - [94, 48.491]
  - - [1408, 2368, 1, 1280]
    - [88, 48.119]
  - - [1856, 2368, 1, 1280]
    - [82, 50.428]
  - - [2368, 2368, 1, 1280]
    - [57, 57.166]
  - - [2944, 2368, 1, 1280]
    - [92, 56.963]
  - - [3584, 2368, 1, 1280]
    - [77, 57.894]
  - - [4288, 2368, 1, 1280]
    - [73, 57.536]
  - - [5056, 2368, 1, 1280]
    - [62, 59.287]
  - - [5888, 2368, 1, 1280]
    - [73, 59.862]
  - - [6784, 2368, 1, 1280]
    - [73, 60.286]
  - - [256, 2944, 1, 1280]
    - [34, 29.993]
  - - [448, 2944, 1, 1280]
    - [84, 38.161]
  - - [704, 2944, 1, 1280]
    - [94, 46.232]
  - - [1024, 2944, 1, 1280]
    - [76, 43.508]
  - - [1408, 2944, 1, 1280]
    - [92, 54.148]
  - - [1856, 2944, 1, 1280]
    - [63, 56.816]
  - - [2368, 2944, 1, 1280]
    - [57, 57.751]
  - - [2944, 2944, 1, 1280]
    - [81, 59.191]
  - - [3584, 2944, 1, 1280]
    - [73, 56.174]
  - - [4288, 2944, 1, 1280]
    - [73, 58.407]
  - - [5056, 2944, 1, 1280]
    - [73, 58.383]
  - - [5888, 2944, 1, 1280]
    - [73, 60.082]
  - - [6784, 2944, 1, 1280]
    - [73, 60.414]
  - - [256, 3584, 1, 1280]
    - [52, 32.906]
  - - [448, 3584, 1, 1280]
    - [78, 43.812]
  - - [704, 3584, 1, 1280]
    - [63, 50.206]
  - - [1024, 3584, 1, 1280]
    - [88, 50.3]
  - - [1408, 3584, 1, 1280]
    - [65, 52.885]
  - - [1856, 3584, 1, 1280]
    - [57, 56.352]
  - - [2368, 3584, 1, 1280]
    - [73, 55.462]
  - - [2944, 3584, 1, 1280]
    - [73, 57.268]
  - - [3584, 3584, 1, 1280]
    - [77, 59.685]
  - - [4288, 3584, 1, 1280]
    - [73, 59.964]
  - - [5056, 3584, 1, 1280]
    - [73, 60.683]
  - - [5888, 3584, 1, 1280]
    - [73, 61.34]
  - - [6784, 3584, 1, 1280]
    - [73, 61.639]
  - - [256, 4288, 1, 1280]
    - [95, 34.243]
  - - [448, 4288, 1, 1280]
    - [52, 44.682]
  - - [704, 4288, 1, 1280]
    - [78, 45.314]
  - - [1024, 4288, 1, 1280]
    - [65, 54.732]
  - - [1408, 4288, 1, 1280]
    - [53, 50.504]
  - - [1856, 4288, 1, 1280]
    - [73, 57.395]
  - - [2368, 4288, 1, 1280]
    - [77, 56.625]
  - - [2944, 4288, 1, 1280]
    - [73, 59.723]
  - - [3584, 4288, 1, 1280]
    - [73, 60.536]
  - - [4288, 4288, 1, 1280]
    - [73, 61.266]
  - - [5056, 4288, 1, 1280]
    - [73, 61.996]
  - - [5888, 4288, 1, 1280]
    - [73, 62.512]
  - - [6784, 4288, 1, 1280]
    - [73, 62.785]
  - - [256, 5056, 1, 1280]
    - [73, 38.568]
  - - [448, 5056, 1, 1280]
    - [73, 45.678]
  - - [704, 5056, 1, 1280]
    - [78, 51.185]
  - - [1024, 5056, 1, 1280]
    - [63, 52.602]
  - - [1408, 5056, 1, 1280]
    - [65, 57.931]
  - - [1856, 5056, 1, 1280]
    - [62, 58.333]
  - - [2368, 5056, 1, 1280]
    - [73, 58.489]
  - - [2944, 5056, 1, 1280]
    - [73, 59.853]
  - - [3584, 5056, 1, 1280]
    - [73, 61.076]
  - - [4288, 5056, 1, 1280]
    - [73, 61.467]
  - - [5056, 5056, 1, 1280]
    - [73, 61.974]
  - - [5888, 5056, 1, 1280]
    - [73, 62.782]
  - - [6784, 5056, 1, 1280]
    - [73, 62.891]
  - - [256, 5888, 1, 1280]
    - [70, 39.858]
  - - [448, 5888, 1, 1280]
    - [95, 46.263]
  - - [704, 5888, 1, 1280]
    - [61, 48.775]
  - - [1024, 5888, 1, 1280]
    - [73, 50.016]
  - - [1408, 5888, 1, 1280]
    - [53, 57.837]
  - - [1856, 5888, 1, 1280]
    - [57, 59.502]
  - - [2368, 5888, 1, 1280]
    - [57, 60.121]
  - - [2944, 5888, 1, 1280]
    - [73, 60.696]
  - - [3584, 5888, 1, 1280]
    - [73, 61.28]
  - - [4288, 5888, 1, 1280]
    - [73, 61.408]
  - - [5056, 5888, 1, 1280]
    - [73, 61.696]
  - - [5888, 5888, 1, 1280]
    - [73, 62.855]
  - - [6784, 5888, 1, 1280]
    - [73, 63.032]
  - - [256, 6784, 1, 1280]
    - [80, 44.739]
  - - [448, 6784, 1, 1280]
    - [78, 45.337]
  - - [704, 6784, 1, 1280]
    - [55, 52.342]
  - - [1024, 6784, 1, 1280]
    - [65, 55.476]
  - - [1408, 6784, 1, 1280]
    - [65, 57.729]
  - - [1856, 6784, 1, 1280]
    - [57, 60.499]
  - - [2368, 6784, 1, 1280]
    - [73, 60.399]
  - - [2944, 6784, 1, 1280]
    - [73, 61.612]
  - - [3584, 6784, 1, 1280]
    - [73, 62.433]
  - - [4288, 6784, 1, 1280]
    - [73, 62.56]
  - - [5056, 6784, 1, 1280]
    - [73, 62.882]
  - - [5888, 6784, 1, 1280]
    - [73, 63.678]
  - - [6784, 6784, 1, 1280]
    - [73, 63.667]
  - - [704, 256, 1, 3328]
    - [15, 14.849]
  - - [1024, 256, 1, 3328]
    - [96, 18.347]
  - - [1408, 256, 1, 3328]
    - [74, 23.834]
  - - [1856, 256, 1, 3328]
    - [42, 28.026]
  - - [2368, 256, 1, 3328]
    - [43, 34.08]
  - - [2944, 256, 1, 3328]
    - [43, 37.081]
  - - [3584, 256, 1, 3328]
    - [48, 40.88]
  - - [4288, 256, 1, 3328]
    - [55, 46.388]
  - - [5056, 256, 1, 3328]
    - [63, 51.748]
  - - [5888, 256, 1, 3328]
    - [97, 52.985]
  - - [6784, 256, 1, 3328]
    - [76, 59.569]
  - - [704, 448, 1, 3328]
    - [38, 21.4]
  - - [1024, 448, 1, 3328]
    - [83, 27.009]
  - - [1408, 448, 1, 3328]
    - [43, 34.166]
  - - [1856, 448, 1, 3328]
    - [51, 40.337]
  - - [2368, 448, 1, 3328]
    - [65, 46.21]
  - - [2944, 448, 1, 3328]
    - [73, 52.128]
  - - [3584, 448, 1, 3328]
    - [97, 56.954]
  - - [4288, 448, 1, 3328]
    - [52, 55.448]
  - - [5056, 448, 1, 3328]
    - [91, 63.612]
  - - [5888, 448, 1, 3328]
    - [55, 62.332]
  - - [6784, 448, 1, 3328]
    - [86, 57.401]
  - - [256, 704, 1, 3328]
    - [15, 14.732]
  - - [448, 704, 1, 3328]
    - [12, 21.541]
  - - [704, 704, 1, 3328]
    - [83, 28.322]
  - - [1024, 704, 1, 3328]
    - [18, 36.448]
  - - [1408, 704, 1, 3328]
    - [87, 43.237]
  - - [1856, 704, 1, 3328]
    - [57, 54.697]
  - - [2368, 704, 1, 3328]
    - [93, 59.952]
  - - [2944, 704, 1, 3328]
    - [91, 59.713]
  - - [3584, 704, 1, 3328]
    - [57, 60.494]
  - - [4288, 704, 1, 3328]
    - [90, 57.084]
  - - [5056, 704, 1, 3328]
    - [90, 65.908]
  - - [5888, 704, 1, 3328]
    - [91, 61.388]
  - - [6784, 704, 1, 3328]
    - [78, 59.641]
  - - [256, 1024, 1, 3328]
    - [96, 18.769]
  - - [448, 1024, 1, 3328]
    - [37, 26.806]
  - - [704, 1024, 1, 3328]
    - [19, 36.928]
  - - [1024, 1024, 1, 3328]
    - [65, 42.357]
  - - [1408, 1024, 1, 3328]
    - [95, 53.713]
  - - [1856, 1024, 1, 3328]
    - [80, 65.696]
  - - [2368, 1024, 1, 3328]
    - [98, 63.569]
  - - [2944, 1024, 1, 3328]
    - [85, 55.36]
  - - [3584, 1024, 1, 3328]
    - [90, 66.223]
  - - [4288, 1024, 1, 3328]
    - [99, 65.652]
  - - [5056, 1024, 1, 3328]
    - [73, 64.473]
  - - [5888, 1024, 1, 3328]
    - [56, 60.672]
  - - [6784, 1024, 1, 3328]
    - [55, 66.755]
  - - [256, 1408, 1, 3328]
    - [38, 22.957]
  - - [448, 1408, 1, 3328]
    - [19, 33.989]
  - - [704, 1408, 1, 3328]
    - [73, 44.229]
  - - [1024, 1408, 1, 3328]
    - [73, 55.574]
  - - [1408, 1408, 1, 3328]
    - [100, 55.725]
  - - [1856, 1408, 1, 3328]
    - [57, 62.994]
  - - [2368, 1408, 1, 3328]
    - [85, 63.511]
  - - [2944, 1408, 1, 3328]
    - [101, 65.934]
  - - [3584, 1408, 1, 3328]
    - [77, 62.74]
  - - [4288, 1408, 1, 3328]
    - [77, 61.449]
  - - [5056, 1408, 1, 3328]
    - [91, 68.748]
  - - [5888, 1408, 1, 3328]
    - [102, 69.129]
  - - [6784, 1408, 1, 3328]
    - [103, 69.345]
  - - [256, 1856, 1, 3328]
    - [104, 27.763]
  - - [448, 1856, 1, 3328]
    - [105, 40.4]
  - - [704, 1856, 1, 3328]
    - [106, 54.844]
  - - [1024, 1856, 1, 3328]
    - [76, 63.784]
  - - [1408, 1856, 1, 3328]
    - [63, 62.655]
  - - [1856, 1856, 1, 3328]
    - [88, 65.378]
  - - [2368, 1856, 1, 3328]
    - [91, 64.384]
  - - [2944, 1856, 1, 3328]
    - [80, 66.191]
  - - [3584, 1856, 1, 3328]
    - [100, 65.066]
  - - [4288, 1856, 1, 3328]
    - [107, 66.972]
  - - [5056, 1856, 1, 3328]
    - [108, 69.371]
  - - [5888, 1856, 1, 3328]
    - [73, 67.29]
  - - [6784, 1856, 1, 3328]
    - [77, 68.33]
  - - [256, 2368, 1, 3328]
    - [83, 33.123]
  - - [448, 2368, 1, 3328]
    - [73, 46.733]
  - - [704, 2368, 1, 3328]
    - [78, 60.443]
  - - [1024, 2368, 1, 3328]
    - [100, 65.957]
  - - [1408, 2368, 1, 3328]
    - [86, 62.479]
  - - [1856, 2368, 1, 3328]
    - [91, 64.023]
  - - [2368, 2368, 1, 3328]
    - [57, 66.861]
  - - [2944, 2368, 1, 3328]
    - [91, 67.702]
  - - [3584, 2368, 1, 3328]
    - [55, 68.23]
  - - [4288, 2368, 1, 3328]
    - [86, 66.215]
  - - [5056, 2368, 1, 3328]
    - [56, 71.283]
  - - [5888, 2368, 1, 3328]
    - [109, 69.791]
  - - [6784, 2368, 1, 3328]
    - [66, 69.858]
  - - [256, 2944, 1, 3328]
    - [19, 36.562]
  - - [448, 2944, 1, 3328]
    - [95, 50.712]
  - - [704, 2944, 1, 3328]
    - [110, 59.99]
  - - [1024, 2944, 1, 3328]
    - [88, 56.903]
  - - [1408, 2944, 1, 3328]
    - [65, 64.069]
  - - [1856, 2944, 1, 3328]
    - [111, 67.13]
  - - [2368, 2944, 1, 3328]
    - [57, 67.66]
  - - [2944, 2944, 1, 3328]
    - [57, 68.581]
  - - [3584, 2944, 1, 3328]
    - [86, 68.404]
  - - [4288, 2944, 1, 3328]
    - [99, 68.675]
  - - [5056, 2944, 1, 3328]
    - [88, 72.063]
  - - [5888, 2944, 1, 3328]
    - [75, 70.222]
  - - [6784, 2944, 1, 3328]
    - [77, 69.09]
  - - [256, 3584, 1, 3328]
    - [87, 42.209]
  - - [448, 3584, 1, 3328]
    - [78, 57.811]
  - - [704, 3584, 1, 3328]
    - [63, 61.488]
  - - [1024, 3584, 1, 3328]
    - [90, 64.577]
  - - [1408, 3584, 1, 3328]
    - [65, 62.59]
  - - [1856, 3584, 1, 3328]
    - [62, 66.636]
  - - [2368, 3584, 1, 3328]
    - [99, 66.212]
  - - [2944, 3584, 1, 3328]
    - [88, 67.797]
  - - [3584, 3584, 1, 3328]
    - [99, 68.868]
  - - [4288, 3584, 1, 3328]
    - [88, 73.591]
  - - [5056, 3584, 1, 3328]
    - [88, 70.554]
  - - [5888, 3584, 1, 3328]
    - [107, 72.231]
  - - [6784, 3584, 1, 3328]
    - [107, 70.232]
  - - [256, 4288, 1, 3328]
    - [95, 46.076]
  - - [448, 4288, 1, 3328]
    - [110, 55.346]
  - - [704, 4288, 1, 3328]
    - [88, 57.538]
  - - [1024, 4288, 1, 3328]
    - [112, 67.365]
  - - [1408, 4288, 1, 3328]
    - [103, 59.355]
  - - [1856, 4288, 1, 3328]
    - [101, 66.828]
  - - [2368, 4288, 1, 3328]
    - [85, 66.633]
  - - [2944, 4288, 1, 3328]
    - [101, 70.751]
  - - [3584, 4288, 1, 3328]
    - [85, 73.966]
  - - [4288, 4288, 1, 3328]
    - [88, 71.689]
  - - [5056, 4288, 1, 3328]
    - [113, 73.609]
  - - [5888, 4288, 1, 3328]
    - [66, 72.12]
  - - [6784, 4288, 1, 3328]
    - [56, 73.193]
  - - [256, 5056, 1, 3328]
    - [95, 51.615]
  - - [448, 5056, 1, 3328]
    - [98, 61.184]
  - - [704, 5056, 1, 3328]
    - [88, 66.621]
  - - [1024, 5056, 1, 3328]
    - [73, 62.815]
  - - [1408, 5056, 1, 3328]
    - [103, 68.642]
  - - [1856, 5056, 1, 3328]
    - [62, 70.086]
  - - [2368, 5056, 1, 3328]
    - [114, 69.078]
  - - [2944, 5056, 1, 3328]
    - [85, 72.187]
  - - [3584, 5056, 1, 3328]
    - [88, 70.926]
  - - [4288, 5056, 1, 3328]
    - [99, 71.158]
  - - [5056, 5056, 1, 3328]
    - [101, 72.622]
  - - [5888, 5056, 1, 3328]
    - [107, 72.936]
  - - [6784, 5056, 1, 3328]
    - [85, 74.573]
  - - [256, 5888, 1, 3328]
    - [80, 49.054]
  - - [448, 5888, 1, 3328]
    - [95, 58.892]
  - - [704, 5888, 1, 3328]
    - [99, 61.446]
  - - [1024, 5888, 1, 3328]
    - [100, 59.032]
  - - [1408, 5888, 1, 3328]
    - [101, 68.343]
  - - [1856, 5888, 1, 3328]
    - [88, 70.161]
  - - [2368, 5888, 1, 3328]
    - [62, 70.955]
  - - [2944, 5888, 1, 3328]
    - [75, 70.914]
  - - [3584, 5888, 1, 3328]
    - [101, 72.247]
  - - [4288, 5888, 1, 3328]
    - [101, 72.14]
  - - [5056, 5888, 1, 3328]
    - [101, 72.936]
  - - [5888, 5888, 1, 3328]
    - [88, 74.909]
  - - [6784, 5888, 1, 3328]
    - [56, 72.16]
  - - [256, 6784, 1, 3328]
    - [115, 56.697]
  - - [448, 6784, 1, 3328]
    - [85, 58.0]
  - - [704, 6784, 1, 3328]
    - [55, 61.389]
  - - [1024, 6784, 1, 3328]
    - [100, 67.358]
  - - [1408, 6784, 1, 3328]
    - [103, 69.965]
  - - [1856, 6784, 1, 3328]
    - [107, 70.912]
  - - [2368, 6784, 1, 3328]
    - [56, 71.18]
  - - [2944, 6784, 1, 3328]
    - [77, 70.024]
  - - [3584, 6784, 1, 3328]
    - [77, 70.665]
  - - [4288, 6784, 1, 3328]
    - [88, 71.512]
  - - [5056, 6784, 1, 3328]
    - [88, 74.298]
  - - [5888, 6784, 1, 3328]
    - [56, 73.962]
  - - [6784, 6784, 1, 3328]
    - [116, 74.974]
  - - [1024, 1024, 1, 1024]
    - [73, 30.085]
  - - [1760, 800, 1, 1760]
    - [117, 39.71]
  - - [1760, 1600, 1, 1760]
    - [68, 55.88]
  - - [1760, 3200, 1, 1760]
    - [68, 59.578]
  - - [1760, 6400, 1, 1760]
    - [62, 69.904]
  - - [2048, 800, 1, 2048]
    - [78, 49.296]
  - - [2048, 1600, 1, 2048]
    - [90, 54.516]
  - - [2048, 3200, 1, 2048]
    - [116, 57.068]
  - - [2048, 6400, 1, 2048]
    - [60, 60.635]
  - - [2560, 800, 1, 2560]
    - [91, 54.456]
  - - [2560, 1600, 1, 2560]
    - [112, 63.025]
  - - [2560, 3200, 1, 2560]
    - [112, 64.559]
  - - [2560, 6400, 1, 2560]
    - [66, 68.134]
  - - [2048, 400, 1, 512]
    - [19, 20.233]
  - - [2048, 800, 1, 512]
    - [80, 27.258]
  - - [2048, 1600, 1, 512]
    - [118, 31.591]
  - - [2048, 3200, 1, 512]
    - [65, 37.652]
  - - [4096, 400, 1, 1024]
    - [52, 34.431]
  - - [4096, 800, 1, 1024]
    - [80, 42.898]
  - - [4096, 1600, 1, 1024]
    - [119, 49.724]
  - - [4096, 3200, 1, 1024]
    - [73, 51.414]
  - - [8192, 400, 1, 2048]
    - [120, 46.694]
  - - [8192, 800, 1, 2048]
    - [103, 56.426]
  - - [8192, 1600, 1, 2048]
    - [108, 61.048]
  - - [8192, 3200, 1, 2048]
    - [88, 64.24]
  - - [16384, 400, 1, 4096]
    - [99, 53.133]
  - - [16384, 800, 1, 4096]
    - [121, 68.628]
  - - [16384, 1600, 1, 4096]
    - [121, 69.147]
  - - [16384, 3200, 1, 4096]
    - [121, 75.309]
  - - [8448, 48000, 1, 2816]
    - [122, 76.096]
  - - [8448, 24000, 1, 2816]
    - [123, 75.046]
  - - [8448, 12000, 1, 2816]
    - [124, 74.467]
  - - [8448, 5984, 1, 2816]
    - [124, 73.352]
  - - [6144, 48000, 1, 2048]
    - [123, 71.876]
  - - [6144, 24000, 1, 2048]
    - [122, 70.782]
  - - [6144, 12000, 1, 2048]
    - [124, 70.319]
  - - [6144, 5984, 1, 2048]
    - [124, 66.646]
  - - [4608, 48000, 1, 1536]
    - [125, 67.517]
  - - [4608, 24000, 1, 1536]
    - [125, 67.141]
  - - [4608, 12000, 1, 1536]
    - [66, 67.013]
  - - [4608, 5984, 1, 1536]
    - [73, 64.723]
  - - [7680, 48000, 1, 2560]
    - [123, 75.007]
  - - [7680, 24000, 1, 2560]
    - [123, 74.092]
  - - [7680, 12000, 1, 2560]
    - [101, 73.204]
  - - [7680, 5984, 1, 2560]
    - [56, 72.516]
  - - [1024, 700, 1, 512]
    - [19, 20.69]
  - - [512, 24000, 1, 1536]
    - [116, 60.887]
  - - [1760, 7000, 1, 1760]
    - [72, 65.226]
  - - [512, 24000, 1, 2048]
    - [116, 63.911]
  - - [2048, 7000, 1, 2048]
    - [116, 64.864]
  - - [512, 24000, 1, 2560]
    - [100, 67.957]
  - - [512, 24000, 1, 2816]
    - [100, 69.238]
  - - [512, 48000, 1, 1536]
    - [56, 63.526]
  - - [1024, 24000, 1, 1536]
    - [56, 63.974]
  - - [2560, 7000, 1, 2560]
    - [85, 66.986]
  - - [512, 48000, 1, 2048]
    - [122, 67.685]
  - - [1024, 24000, 1, 2048]
    - [116, 68.195]
  - - [512, 48000, 1, 2560]
    - [123, 70.971]
  - - [1024, 24000, 1, 2560]
    - [122, 70.86]
  - - [512, 48000, 1, 2816]
    - [122, 72.234]
  - - [1024, 24000, 1, 2816]
    - [123, 72.17]
  - - [1024, 48000, 1, 1536]
    - [56, 65.395]
  - - [3072, 24000, 1, 1024]
    - [66, 59.668]
  - - [5124, 9124, 1, 1760]
    - [126, 74.212]
  - - [5124, 9124, 1, 2048]
    - [124, 67.789]
  - - [1024, 48000, 1, 2048]
    - [116, 69.678]
  - - [4096, 7000, 1, 4096]
    - [108, 75.139]
  - - [5124, 9124, 1, 2560]
    - [124, 70.803]
  - - [1024, 48000, 1, 2560]
    - [56, 72.545]
  - - [1024, 48000, 1, 2816]
    - [56, 73.401]
  - - [3072, 48000, 1, 1024]
    - [56, 59.427]
  - - [5124, 9124, 1, 4096]
    - [122, 68.194]
  - - [6144, 24000, 1, 2560]
    - [123, 73.823]
  - - [6144, 48000, 1, 2560]
    - [123, 74.699]
  - - [32, 32, 1, 32]
    - [127, 0.005]
  - - [32, 64, 1, 256]
    - [9, 0.061]
  - - [32, 128, 1, 256]
    - [7, 0.123]
  - - [32, 256, 1, 256]
    - [6, 0.248]
  - - [32, 448, 1, 256]
    - [9, 0.458]
  - - [32, 704, 1, 256]
    - [21, 0.692]
  - - [32, 1024, 1, 256]
    - [21, 0.994]
  - - [32, 1408, 1, 256]
    - [21, 1.333]
  - - [32, 1856, 1, 256]
    - [9, 1.779]
  - - [32, 2368, 1, 256]
    - [10, 2.161]
  - - [32, 2944, 1, 256]
    - [10, 2.719]
  - - [32, 3584, 1, 256]
    - [10, 3.158]
  - - [32, 4288, 1, 256]
    - [10, 3.736]
  - - [32, 5056, 1, 256]
    - [10, 4.213]
  - - [32, 5888, 1, 256]
    - [5, 4.752]
  - - [32, 6784, 1, 256]
    - [24, 5.201]
  - - [32, 64, 1, 1280]
    - [5, 0.187]
  - - [32, 128, 1, 1280]
    - [22, 0.369]
  - - [32, 256, 1, 1280]
    - [7, 0.761]
  - - [32, 448, 1, 1280]
    - [5, 1.311]
  - - [32, 704, 1, 1280]
    - [29, 2.092]
  - - [32, 1024, 1, 1280]
    - [10, 3.191]
  - - [32, 1408, 1, 1280]
    - [22, 4.283]
  - - [32, 1856, 1, 1280]
    - [9, 5.515]
  - - [32, 2368, 1, 1280]
    - [5, 6.825]
  - - [32, 2944, 1, 1280]
    - [10, 7.947]
  - - [32, 3584, 1, 1280]
    - [25, 9.159]
  - - [32, 4288, 1, 1280]
    - [6, 9.784]
  - - [32, 5056, 1, 1280]
    - [25, 10.708]
  - - [32, 5888, 1, 1280]
    - [15, 11.574]
  - - [32, 6784, 1, 1280]
    - [15, 12.562]
  - - [32, 64, 1, 3328]
    - [0, 0.332]
  - - [32, 128, 1, 3328]
    - [28, 0.651]
  - - [32, 256, 1, 3328]
    - [28, 1.276]
  - - [32, 448, 1, 3328]
    - [0, 2.096]
  - - [32, 704, 1, 3328]
    - [9, 3.16]
  - - [32, 1024, 1, 3328]
    - [22, 4.681]
  - - [32, 1408, 1, 3328]
    - [22, 6.321]
  - - [32, 1856, 1, 3328]
    - [9, 8.221]
  - - [32, 2368, 1, 3328]
    - [6, 10.0]
  - - [32, 2944, 1, 3328]
    - [29, 11.417]
  - - [32, 3584, 1, 3328]
    - [29, 12.849]
  - - [32, 4288, 1, 3328]
    - [10, 12.989]
  - - [32, 5056, 1, 3328]
    - [7, 13.509]
  - - [32, 5888, 1, 3328]
    - [24, 14.67]
  - - [32, 6784, 1, 3328]
    - [24, 16.253]
  - - [64, 32, 1, 256]
    - [9, 0.062]
  - - [128, 32, 1, 256]
    - [6, 0.131]
  - - [256, 32, 1, 256]
    - [7, 0.245]
  - - [448, 32, 1, 256]
    - [3, 0.419]
  - - [704, 32, 1, 256]
    - [4, 0.65]
  - - [1024, 32, 1, 256]
    - [9, 0.981]
  - - [1408, 32, 1, 256]
    - [8, 1.27]
  - - [1856, 32, 1, 256]
    - [26, 1.674]
  - - [2368, 32, 1, 256]
    - [5, 2.063]
  - - [2944, 32, 1, 256]
    - [5, 2.536]
  - - [3584, 32, 1, 256]
    - [128, 3.122]
  - - [4288, 32, 1, 256]
    - [6, 3.535]
  - - [5056, 32, 1, 256]
    - [10, 4.168]
  - - [5888, 32, 1, 256]
    - [10, 4.702]
  - - [6784, 32, 1, 256]
    - [15, 5.362]
  - - [64, 32, 1, 1280]
    - [5, 0.195]
  - - [128, 32, 1, 1280]
    - [4, 0.369]
  - - [256, 32, 1, 1280]
    - [4, 0.743]
  - - [448, 32, 1, 1280]
    - [3, 1.301]
  - - [704, 32, 1, 1280]
    - [7, 2.014]
  - - [1024, 32, 1, 1280]
    - [5, 3.091]
  - - [1408, 32, 1, 1280]
    - [23, 4.058]
  - - [1856, 32, 1, 1280]
    - [6, 5.155]
  - - [2368, 32, 1, 1280]
    - [25, 6.392]
  - - [2944, 32, 1, 1280]
    - [10, 7.376]
  - - [3584, 32, 1, 1280]
    - [10, 8.64]
  - - [4288, 32, 1, 1280]
    - [6, 9.669]
  - - [5056, 32, 1, 1280]
    - [29, 10.42]
  - - [5888, 32, 1, 1280]
    - [24, 11.285]
  - - [6784, 32, 1, 1280]
    - [15, 12.747]
  - - [64, 32, 1, 3328]
    - [28, 0.332]
  - - [128, 32, 1, 3328]
    - [0, 0.664]
  - - [256, 32, 1, 3328]
    - [0, 1.276]
  - - [448, 32, 1, 3328]
    - [28, 2.058]
  - - [704, 32, 1, 3328]
    - [7, 3.218]
  - - [1024, 32, 1, 3328]
    - [8, 4.476]
  - - [1408, 32, 1, 3328]
    - [21, 5.921]
  - - [1856, 32, 1, 3328]
    - [9, 7.707]
  - - [2368, 32, 1, 3328]
    - [6, 9.147]
  - - [2944, 32, 1, 3328]
    - [6, 10.827]
  - - [3584, 32, 1, 3328]
    - [25, 11.522]
  - - [4288, 32, 1, 3328]
    - [6, 12.757]
  - - [5056, 32, 1, 3328]
    - [24, 13.122]
  - - [5888, 32, 1, 3328]
    - [24, 14.856]
  - - [6784, 32, 1, 3328]
    - [24, 16.292]
  - - [64, 64, 1, 32]
    - [129, 0.018]
  - - [128, 64, 1, 32]
    - [127, 0.038]
  - - [256, 64, 1, 32]
    - [129, 0.078]
  - - [448, 64, 1, 32]
    - [127, 0.128]
  - - [704, 64, 1, 32]
    - [129, 0.208]
  - - [1024, 64, 1, 32]
    - [129, 0.297]
  - - [1408, 64, 1, 32]
    - [129, 0.403]
  - - [1856, 64, 1, 32]
    - [129, 0.516]
  - - [2368, 64, 1, 32]
    - [129, 0.63]
  - - [2944, 64, 1, 32]
    - [129, 0.742]
  - - [3584, 64, 1, 32]
    - [17, 0.892]
  - - [4288, 64, 1, 32]
    - [129, 1.04]
  - - [5056, 64, 1, 32]
    - [17, 1.227]
  - - [5888, 64, 1, 32]
    - [17, 1.393]
  - - [6784, 64, 1, 32]
    - [17, 1.567]
  - - [64, 128, 1, 32]
    - [129, 0.039]
  - - [128, 128, 1, 32]
    - [129, 0.078]
  - - [256, 128, 1, 32]
    - [129, 0.156]
  - - [448, 128, 1, 32]
    - [129, 0.264]
  - - [704, 128, 1, 32]
    - [127, 0.391]
  - - [1024, 128, 1, 32]
    - [129, 0.561]
  - - [1408, 128, 1, 32]
    - [129, 0.72]
  - - [1856, 128, 1, 32]
    - [130, 0.924]
  - - [2368, 128, 1, 32]
    - [130, 1.179]
  - - [2944, 128, 1, 32]
    - [131, 1.328]
  - - [3584, 128, 1, 32]
    - [132, 1.635]
  - - [4288, 128, 1, 32]
    - [130, 1.806]
  - - [5056, 128, 1, 32]
    - [131, 2.13]
  - - [5888, 128, 1, 32]
    - [131, 2.257]
  - - [6784, 128, 1, 32]
    - [131, 2.477]
  - - [64, 256, 1, 32]
    - [129, 0.077]
  - - [128, 256, 1, 32]
    - [127, 0.149]
  - - [256, 256, 1, 32]
    - [129, 0.297]
  - - [448, 256, 1, 32]
    - [129, 0.52]
  - - [704, 256, 1, 32]
    - [17, 0.75]
  - - [1024, 256, 1, 32]
    - [133, 1.02]
  - - [1408, 256, 1, 32]
    - [134, 1.316]
  - - [1856, 256, 1, 32]
    - [17, 1.674]
  - - [2368, 256, 1, 32]
    - [130, 2.04]
  - - [2944, 256, 1, 32]
    - [131, 2.351]
  - - [3584, 256, 1, 32]
    - [131, 2.72]
  - - [4288, 256, 1, 32]
    - [135, 2.859]
  - - [5056, 256, 1, 32]
    - [131, 3.101]
  - - [5888, 256, 1, 32]
    - [131, 3.42]
  - - [6784, 256, 1, 32]
    - [135, 3.444]
  - - [64, 448, 1, 32]
    - [127, 0.136]
  - - [128, 448, 1, 32]
    - [127, 0.256]
  - - [256, 448, 1, 32]
    - [129, 0.505]
  - - [448, 448, 1, 32]
    - [136, 0.823]
  - - [704, 448, 1, 32]
    - [129, 1.196]
  - - [1024, 448, 1, 32]
    - [17, 1.696]
  - - [1408, 448, 1, 32]
    - [131, 2.053]
  - - [1856, 448, 1, 32]
    - [17, 2.49]
  - - [2368, 448, 1, 32]
    - [131, 2.888]
  - - [2944, 448, 1, 32]
    - [135, 3.16]
  - - [3584, 448, 1, 32]
    - [131, 3.51]
  - - [4288, 448, 1, 32]
    - [131, 3.712]
  - - [5056, 448, 1, 32]
    - [137, 3.727]
  - - [5888, 448, 1, 32]
    - [138, 3.891]
  - - [6784, 448, 1, 32]
    - [135, 4.063]
  - - [64, 704, 1, 32]
    - [129, 0.204]
  - - [128, 704, 1, 32]
    - [129, 0.397]
  - - [256, 704, 1, 32]
    - [129, 0.76]
  - - [448, 704, 1, 32]
    - [17, 1.211]
  - - [704, 704, 1, 32]
    - [131, 1.726]
  - - [1024, 704, 1, 32]
    - [131, 2.272]
  - - [1408, 704, 1, 32]
    - [137, 2.699]
  - - [1856, 704, 1, 32]
    - [131, 3.156]
  - - [2368, 704, 1, 32]
    - [131, 3.516]
  - - [2944, 704, 1, 32]
    - [131, 3.808]
  - - [3584, 704, 1, 32]
    - [137, 3.778]
  - - [4288, 704, 1, 32]
    - [131, 4.166]
  - - [5056, 704, 1, 32]
    - [131, 4.264]
  - - [5888, 704, 1, 32]
    - [131, 4.386]
  - - [6784, 704, 1, 32]
    - [17, 4.456]
  - - [64, 1024, 1, 32]
    - [127, 0.297]
  - - [128, 1024, 1, 32]
    - [129, 0.569]
  - - [256, 1024, 1, 32]
    - [129, 1.047]
  - - [448, 1024, 1, 32]
    - [17, 1.616]
  - - [704, 1024, 1, 32]
    - [131, 2.347]
  - - [1024, 1024, 1, 32]
    - [131, 2.684]
  - - [1408, 1024, 1, 32]
    - [131, 3.373]
  - - [1856, 1024, 1, 32]
    - [131, 3.672]
  - - [2368, 1024, 1, 32]
    - [135, 3.842]
  - - [2944, 1024, 1, 32]
    - [131, 4.18]
  - - [3584, 1024, 1, 32]
    - [131, 4.344]
  - - [4288, 1024, 1, 32]
    - [131, 4.427]
  - - [5056, 1024, 1, 32]
    - [131, 4.67]
  - - [5888, 1024, 1, 32]
    - [131, 4.802]
  - - [6784, 1024, 1, 32]
    - [131, 4.883]
  - - [64, 1408, 1, 32]
    - [127, 0.415]
  - - [128, 1408, 1, 32]
    - [127, 0.739]
  - - [256, 1408, 1, 32]
    - [129, 1.349]
  - - [448, 1408, 1, 32]
    - [17, 2.122]
  - - [704, 1408, 1, 32]
    - [131, 2.8]
  - - [1024, 1408, 1, 32]
    - [131, 3.347]
  - - [1408, 1408, 1, 32]
    - [131, 3.757]
  - - [1856, 1408, 1, 32]
    - [131, 4.034]
  - - [2368, 1408, 1, 32]
    - [131, 4.109]
  - - [2944, 1408, 1, 32]
    - [131, 4.465]
  - - [3584, 1408, 1, 32]
    - [135, 4.593]
  - - [4288, 1408, 1, 32]
    - [131, 4.809]
  - - [5056, 1408, 1, 32]
    - [131, 4.935]
  - - [5888, 1408, 1, 32]
    - [131, 5.046]
  - - [6784, 1408, 1, 32]
    - [135, 5.135]
  - - [64, 1856, 1, 32]
    - [129, 0.531]
  - - [128, 1856, 1, 32]
    - [129, 0.961]
  - - [256, 1856, 1, 32]
    - [17, 1.694]
  - - [448, 1856, 1, 32]
    - [131, 2.567]
  - - [704, 1856, 1, 32]
    - [131, 3.207]
  - - [1024, 1856, 1, 32]
    - [131, 3.513]
  - - [1408, 1856, 1, 32]
    - [131, 3.874]
  - - [1856, 1856, 1, 32]
    - [131, 4.176]
  - - [2368, 1856, 1, 32]
    - [131, 4.538]
  - - [2944, 1856, 1, 32]
    - [131, 4.743]
  - - [3584, 1856, 1, 32]
    - [135, 4.919]
  - - [4288, 1856, 1, 32]
    - [131, 5.082]
  - - [5056, 1856, 1, 32]
    - [135, 5.175]
  - - [5888, 1856, 1, 32]
    - [135, 5.253]
  - - [6784, 1856, 1, 32]
    - [131, 5.296]
  - - [64, 2368, 1, 32]
    - [129, 0.63]
  - - [128, 2368, 1, 32]
    - [129, 1.179]
  - - [256, 2368, 1, 32]
    - [130, 2.04]
  - - [448, 2368, 1, 32]
    - [131, 2.888]
  - - [704, 2368, 1, 32]
    - [131, 3.491]
  - - [1024, 2368, 1, 32]
    - [131, 3.883]
  - - [1408, 2368, 1, 32]
    - [131, 4.16]
  - - [1856, 2368, 1, 32]
    - [135, 4.417]
  - - [2368, 2368, 1, 32]
    - [135, 4.744]
  - - [2944, 2368, 1, 32]
    - [131, 4.833]
  - - [3584, 2368, 1, 32]
    - [131, 5.043]
  - - [4288, 2368, 1, 32]
    - [135, 5.207]
  - - [5056, 2368, 1, 32]
    - [135, 5.288]
  - - [5888, 2368, 1, 32]
    - [131, 5.353]
  - - [6784, 2368, 1, 32]
    - [135, 5.387]
  - - [64, 2944, 1, 32]
    - [127, 0.795]
  - - [128, 2944, 1, 32]
    - [133, 1.393]
  - - [256, 2944, 1, 32]
    - [131, 2.401]
  - - [448, 2944, 1, 32]
    - [131, 3.185]
  - - [704, 2944, 1, 32]
    - [135, 3.785]
  - - [1024, 2944, 1, 32]
    - [131, 4.067]
  - - [1408, 2944, 1, 32]
    - [131, 4.465]
  - - [1856, 2944, 1, 32]
    - [131, 4.729]
  - - [2368, 2944, 1, 32]
    - [131, 4.912]
  - - [2944, 2944, 1, 32]
    - [131, 5.089]
  - - [3584, 2944, 1, 32]
    - [131, 5.231]
  - - [4288, 2944, 1, 32]
    - [131, 5.325]
  - - [5056, 2944, 1, 32]
    - [131, 5.403]
  - - [5888, 2944, 1, 32]
    - [131, 5.413]
  - - [6784, 2944, 1, 32]
    - [131, 5.518]
  - - [64, 3584, 1, 32]
    - [129, 0.941]
  - - [128, 3584, 1, 32]
    - [131, 1.597]
  - - [256, 3584, 1, 32]
    - [131, 2.748]
  - - [448, 3584, 1, 32]
    - [137, 3.435]
  - - [704, 3584, 1, 32]
    - [131, 3.956]
  - - [1024, 3584, 1, 32]
    - [131, 4.227]
  - - [1408, 3584, 1, 32]
    - [131, 4.679]
  - - [1856, 3584, 1, 32]
    - [135, 4.98]
  - - [2368, 3584, 1, 32]
    - [131, 5.053]
  - - [2944, 3584, 1, 32]
    - [131, 5.24]
  - - [3584, 3584, 1, 32]
    - [135, 5.328]
  - - [4288, 3584, 1, 32]
    - [135, 5.446]
  - - [5056, 3584, 1, 32]
    - [135, 5.503]
  - - [5888, 3584, 1, 32]
    - [131, 5.543]
  - - [6784, 3584, 1, 32]
    - [131, 5.575]
  - - [64, 4288, 1, 32]
    - [129, 1.067]
  - - [128, 4288, 1, 32]
    - [129, 1.911]
  - - [256, 4288, 1, 32]
    - [131, 2.909]
  - - [448, 4288, 1, 32]
    - [135, 3.736]
  - - [704, 4288, 1, 32]
    - [131, 4.128]
  - - [1024, 4288, 1, 32]
    - [135, 4.413]
  - - [1408, 4288, 1, 32]
    - [131, 4.873]
  - - [1856, 4288, 1, 32]
    - [131, 5.071]
  - - [2368, 4288, 1, 32]
    - [135, 5.225]
  - - [2944, 4288, 1, 32]
    - [135, 5.265]
  - - [3584, 4288, 1, 32]
    - [131, 5.44]
  - - [4288, 4288, 1, 32]
    - [135, 5.495]
  - - [5056, 4288, 1, 32]
    - [135, 5.568]
  - - [5888, 4288, 1, 32]
    - [135, 5.621]
  - - [6784, 4288, 1, 32]
    - [131, 5.624]
  - - [64, 5056, 1, 32]
    - [129, 1.275]
  - - [128, 5056, 1, 32]
    - [17, 2.153]
  - - [256, 5056, 1, 32]
    - [131, 3.285]
  - - [448, 5056, 1, 32]
    - [135, 3.832]
  - - [704, 5056, 1, 32]
    - [131, 4.264]
  - - [1024, 5056, 1, 32]
    - [131, 4.56]
  - - [1408, 5056, 1, 32]
    - [131, 5.028]
  - - [1856, 5056, 1, 32]
    - [131, 5.137]
  - - [2368, 5056, 1, 32]
    - [131, 5.351]
  - - [2944, 5056, 1, 32]
    - [131, 5.397]
  - - [3584, 5056, 1, 32]
    - [135, 5.492]
  - - [4288, 5056, 1, 32]
    - [131, 5.568]
  - - [5056, 5056, 1, 32]
    - [131, 5.617]
  - - [5888, 5056, 1, 32]
    - [135, 5.635]
  - - [6784, 5056, 1, 32]
    - [135, 5.675]
  - - [64, 5888, 1, 32]
    - [129, 1.411]
  - - [128, 5888, 1, 32]
    - [131, 2.327]
  - - [256, 5888, 1, 32]
    - [135, 3.394]
  - - [448, 5888, 1, 32]
    - [131, 4.051]
  - - [704, 5888, 1, 32]
    - [135, 4.402]
  - - [1024, 5888, 1, 32]
    - [131, 4.702]
  - - [1408, 5888, 1, 32]
    - [135, 5.067]
  - - [1856, 5888, 1, 32]
    - [131, 5.278]
  - - [2368, 5888, 1, 32]
    - [131, 5.402]
  - - [2944, 5888, 1, 32]
    - [131, 5.407]
  - - [3584, 5888, 1, 32]
    - [131, 5.593]
  - - [4288, 5888, 1, 32]
    - [135, 5.605]
  - - [5056, 5888, 1, 32]
    - [135, 5.657]
  - - [5888, 5888, 1, 32]
    - [135, 5.646]
  - - [6784, 5888, 1, 32]
    - [131, 5.699]
  - - [64, 6784, 1, 32]
    - [131, 1.567]
  - - [128, 6784, 1, 32]
    - [131, 2.575]
  - - [256, 6784, 1, 32]
    - [131, 3.562]
  - - [448, 6784, 1, 32]
    - [131, 4.081]
  - - [704, 6784, 1, 32]
    - [131, 4.569]
  - - [1024, 6784, 1, 32]
    - [135, 4.827]
  - - [1408, 6784, 1, 32]
    - [131, 5.229]
  - - [1856, 6784, 1, 32]
    - [135, 5.341]
  - - [2368, 6784, 1, 32]
    - [135, 5.473]
  - - [2944, 6784, 1, 32]
    - [135, 5.523]
  - - [3584, 6784, 1, 32]
    - [135, 5.597]
  - - [4288, 6784, 1, 32]
    - [135, 5.657]
  - - [5056, 6784, 1, 32]
    - [135, 5.684]
  - - [5888, 6784, 1, 32]
    - [131, 5.718]
  - - [6784, 6784, 1, 32]
    - [131, 5.698]
  - - [32, 32, 1, 256]
    - [5, 0.031]
  - - [32, 32, 1, 1280]
    - [5, 0.1]
  - - [32, 32, 1, 3328]
    - [28, 0.168]
  - - [32, 64, 1, 32]
    - [131, 0.009]
  - - [32, 128, 1, 32]
    - [129, 0.02]
  - - [32, 256, 1, 32]
    - [129, 0.039]
  - - [32, 448, 1, 32]
    - [129, 0.069]
  - - [32, 704, 1, 32]
    - [129, 0.105]
  - - [32, 1024, 1, 32]
    - [129, 0.153]
  - - [32, 1408, 1, 32]
    - [129, 0.208]
  - - [32, 1856, 1, 32]
    - [129, 0.269]
  - - [32, 2368, 1, 32]
    - [130, 0.334]
  - - [32, 2944, 1, 32]
    - [136, 0.415]
  - - [32, 3584, 1, 32]
    - [129, 0.498]
  - - [32, 4288, 1, 32]
    - [129, 0.579]
  - - [32, 5056, 1, 32]
    - [136, 0.682]
  - - [32, 5888, 1, 32]
    - [129, 0.762]
  - - [32, 6784, 1, 32]
    - [129, 0.903]
  - - [64, 32, 1, 32]
    - [127, 0.01]
  - - [128, 32, 1, 32]
    - [127, 0.019]
  - - [256, 32, 1, 32]
    - [129, 0.038]
  - - [448, 32, 1, 32]
    - [136, 0.068]
  - - [704, 32, 1, 32]
    - [127, 0.102]
  - - [1024, 32, 1, 32]
    - [129, 0.146]
  - - [1408, 32, 1, 32]
    - [127, 0.208]
  - - [1856, 32, 1, 32]
    - [132, 0.265]
  - - [2368, 32, 1, 32]
    - [133, 0.329]
  - - [2944, 32, 1, 32]
    - [17, 0.409]
  - - [3584, 32, 1, 32]
    - [17, 0.491]
  - - [4288, 32, 1, 32]
    - [127, 0.571]
  - - [5056, 32, 1, 32]
    - [129, 0.673]
  - - [5888, 32, 1, 32]
    - [17, 0.762]
  - - [6784, 32, 1, 32]
    - [136, 0.879]
  - - [1, 1, 1, 1]
    - [5, 0.0]
  - - [1, 64, 1, 256]
    - [25, 0.002]
  - - [1, 128, 1, 256]
    - [25, 0.005]
  - - [1, 256, 1, 256]
    - [128, 0.008]
  - - [1, 448, 1, 256]
    - [21, 0.015]
  - - [1, 704, 1, 256]
    - [21, 0.021]
  - - [1, 1024, 1, 256]
    - [26, 0.03]
  - - [1, 1408, 1, 256]
    - [29, 0.04]
  - - [1, 1856, 1, 256]
    - [4, 0.055]
  - - [1, 2368, 1, 256]
    - [5, 0.068]
  - - [1, 2944, 1, 256]
    - [25, 0.086]
  - - [1, 3584, 1, 256]
    - [21, 0.101]
  - - [1, 4288, 1, 256]
    - [128, 0.121]
  - - [1, 5056, 1, 256]
    - [128, 0.139]
  - - [1, 5888, 1, 256]
    - [128, 0.158]
  - - [1, 6784, 1, 256]
    - [128, 0.185]
  - - [1, 64, 1, 1280]
    - [5, 0.006]
  - - [1, 128, 1, 1280]
    - [5, 0.014]
  - - [1, 256, 1, 1280]
    - [4, 0.027]
  - - [1, 448, 1, 1280]
    - [5, 0.046]
  - - [1, 704, 1, 1280]
    - [139, 0.069]
  - - [1, 1024, 1, 1280]
    - [29, 0.098]
  - - [1, 1408, 1, 1280]
    - [7, 0.135]
  - - [1, 1856, 1, 1280]
    - [21, 0.182]
  - - [1, 2368, 1, 1280]
    - [4, 0.225]
  - - [1, 2944, 1, 1280]
    - [21, 0.289]
  - - [1, 3584, 1, 1280]
    - [9, 0.335]
  - - [1, 4288, 1, 1280]
    - [25, 0.375]
  - - [1, 5056, 1, 1280]
    - [5, 0.406]
  - - [1, 5888, 1, 1280]
    - [7, 0.427]
  - - [1, 6784, 1, 1280]
    - [5, 0.47]
  - - [1, 64, 1, 3328]
    - [140, 0.01]
  - - [1, 128, 1, 3328]
    - [140, 0.02]
  - - [1, 256, 1, 3328]
    - [140, 0.04]
  - - [1, 448, 1, 3328]
    - [140, 0.069]
  - - [1, 704, 1, 3328]
    - [140, 0.11]
  - - [1, 1024, 1, 3328]
    - [140, 0.159]
  - - [1, 1408, 1, 3328]
    - [7, 0.213]
  - - [1, 1856, 1, 3328]
    - [4, 0.277]
  - - [1, 2368, 1, 3328]
    - [21, 0.355]
  - - [1, 2944, 1, 3328]
    - [4, 0.421]
  - - [1, 3584, 1, 3328]
    - [9, 0.492]
  - - [1, 4288, 1, 3328]
    - [25, 0.524]
  - - [1, 5056, 1, 3328]
    - [29, 0.564]
  - - [1, 5888, 1, 3328]
    - [29, 0.597]
  - - [1, 6784, 1, 3328]
    - [5, 0.611]
  - - [64, 1, 1, 256]
    - [6, 0.002]
  - - [128, 1, 1, 256]
    - [10, 0.004]
  - - [256, 1, 1, 256]
    - [6, 0.008]
  - - [448, 1, 1, 256]
    - [22, 0.013]
  - - [704, 1, 1, 256]
    - [9, 0.021]
  - - [1024, 1, 1, 256]
    - [6, 0.03]
  - - [1408, 1, 1, 256]
    - [9, 0.042]
  - - [1856, 1, 1, 256]
    - [10, 0.054]
  - - [2368, 1, 1, 256]
    - [4, 0.068]
  - - [2944, 1, 1, 256]
    - [6, 0.084]
  - - [3584, 1, 1, 256]
    - [9, 0.105]
  - - [4288, 1, 1, 256]
    - [10, 0.117]
  - - [5056, 1, 1, 256]
    - [25, 0.135]
  - - [5888, 1, 1, 256]
    - [26, 0.155]
  - - [6784, 1, 1, 256]
    - [128, 0.177]
  - - [64, 1, 1, 1280]
    - [5, 0.007]
  - - [128, 1, 1, 1280]
    - [22, 0.012]
  - - [256, 1, 1, 1280]
    - [6, 0.023]
  - - [448, 1, 1, 1280]
    - [23, 0.041]
  - - [704, 1, 1, 1280]
    - [22, 0.067]
  - - [1024, 1, 1, 1280]
    - [9, 0.101]
  - - [1408, 1, 1, 1280]
    - [23, 0.135]
  - - [1856, 1, 1, 1280]
    - [10, 0.179]
  - - [2368, 1, 1, 1280]
    - [22, 0.229]
  - - [2944, 1, 1, 1280]
    - [22, 0.278]
  - - [3584, 1, 1, 1280]
    - [10, 0.328]
  - - [4288, 1, 1, 1280]
    - [6, 0.367]
  - - [5056, 1, 1, 1280]
    - [10, 0.396]
  - - [5888, 1, 1, 1280]
    - [10, 0.433]
  - - [6784, 1, 1, 1280]
    - [5, 0.454]
  - - [64, 1, 1, 3328]
    - [28, 0.011]
  - - [128, 1, 1, 3328]
    - [28, 0.022]
  - - [256, 1, 1, 3328]
    - [28, 0.046]
  - - [448, 1, 1, 3328]
    - [28, 0.079]
  - - [704, 1, 1, 3328]
    - [28, 0.124]
  - - [1024, 1, 1, 3328]
    - [28, 0.175]
  - - [1408, 1, 1, 3328]
    - [2, 0.211]
  - - [1856, 1, 1, 3328]
    - [10, 0.271]
  - - [2368, 1, 1, 3328]
    - [9, 0.334]
  - - [2944, 1, 1, 3328]
    - [8, 0.413]
  - - [3584, 1, 1, 3328]
    - [3, 0.477]
  - - [4288, 1, 1, 3328]
    - [25, 0.526]
  - - [5056, 1, 1, 3328]
    - [25, 0.566]
  - - [5888, 1, 1, 3328]
    - [6, 0.578]
  - - [6784, 1, 1, 3328]
    - [25, 0.599]
  - - [64, 64, 1, 1]
    - [136, 0.0]
  - - [128, 64, 1, 1]
    - [136, 0.001]
  - - [256, 64, 1, 1]
    - [141, 0.002]
  - - [448, 64, 1, 1]
    - [17, 0.003]
  - - [704, 64, 1, 1]
    - [129, 0.005]
  - - [1024, 64, 1, 1]
    - [132, 0.007]
  - - [1408, 64, 1, 1]
    - [129, 0.01]
  - - [1856, 64, 1, 1]
    - [129, 0.013]
  - - [2368, 64, 1, 1]
    - [131, 0.016]
  - - [2944, 64, 1, 1]
    - [135, 0.021]
  - - [3584, 64, 1, 1]
    - [17, 0.026]
  - - [4288, 64, 1, 1]
    - [17, 0.029]
  - - [5056, 64, 1, 1]
    - [17, 0.034]
  - - [5888, 64, 1, 1]
    - [17, 0.038]
  - - [6784, 64, 1, 1]
    - [137, 0.041]
  - - [64, 128, 1, 1]
    - [129, 0.001]
  - - [128, 128, 1, 1]
    - [136, 0.002]
  - - [256, 128, 1, 1]
    - [129, 0.003]
  - - [448, 128, 1, 1]
    - [129, 0.006]
  - - [704, 128, 1, 1]
    - [129, 0.01]
  - - [1024, 128, 1, 1]
    - [127, 0.014]
  - - [1408, 128, 1, 1]
    - [17, 0.019]
  - - [1856, 128, 1, 1]
    - [17, 0.025]
  - - [2368, 128, 1, 1]
    - [134, 0.03]
  - - [2944, 128, 1, 1]
    - [17, 0.038]
  - - [3584, 128, 1, 1]
    - [17, 0.045]
  - - [4288, 128, 1, 1]
    - [131, 0.05]
  - - [5056, 128, 1, 1]
    - [131, 0.057]
  - - [5888, 128, 1, 1]
    - [131, 0.062]
  - - [6784, 128, 1, 1]
    - [142, 0.068]
  - - [64, 256, 1, 1]
    - [129, 0.002]
  - - [128, 256, 1, 1]
    - [17, 0.004]
  - - [256, 256, 1, 1]
    - [17, 0.007]
  - - [448, 256, 1, 1]
    - [17, 0.012]
  - - [704, 256, 1, 1]
    - [17, 0.018]
  - - [1024, 256, 1, 1]
    - [17, 0.026]
  - - [1408, 256, 1, 1]
    - [17, 0.035]
  - - [1856, 256, 1, 1]
    - [17, 0.044]
  - - [2368, 256, 1, 1]
    - [131, 0.053]
  - - [2944, 256, 1, 1]
    - [131, 0.061]
  - - [3584, 256, 1, 1]
    - [135, 0.072]
  - - [4288, 256, 1, 1]
    - [131, 0.077]
  - - [5056, 256, 1, 1]
    - [131, 0.081]
  - - [5888, 256, 1, 1]
    - [71, 0.088]
  - - [6784, 256, 1, 1]
    - [143, 0.093]
  - - [64, 448, 1, 1]
    - [144, 0.003]
  - - [128, 448, 1, 1]
    - [129, 0.006]
  - - [256, 448, 1, 1]
    - [17, 0.012]
  - - [448, 448, 1, 1]
    - [17, 0.02]
  - - [704, 448, 1, 1]
    - [17, 0.03]
  - - [1024, 448, 1, 1]
    - [17, 0.041]
  - - [1408, 448, 1, 1]
    - [17, 0.053]
  - - [1856, 448, 1, 1]
    - [135, 0.063]
  - - [2368, 448, 1, 1]
    - [131, 0.074]
  - - [2944, 448, 1, 1]
    - [131, 0.083]
  - - [3584, 448, 1, 1]
    - [137, 0.091]
  - - [4288, 448, 1, 1]
    - [131, 0.091]
  - - [5056, 448, 1, 1]
    - [71, 0.097]
  - - [5888, 448, 1, 1]
    - [145, 0.102]
  - - [6784, 448, 1, 1]
    - [131, 0.106]
  - - [64, 704, 1, 1]
    - [144, 0.005]
  - - [128, 704, 1, 1]
    - [17, 0.01]
  - - [256, 704, 1, 1]
    - [17, 0.018]
  - - [448, 704, 1, 1]
    - [17, 0.03]
  - - [704, 704, 1, 1]
    - [144, 0.044]
  - - [1024, 704, 1, 1]
    - [131, 0.057]
  - - [1408, 704, 1, 1]
    - [131, 0.068]
  - - [1856, 704, 1, 1]
    - [131, 0.08]
  - - [2368, 704, 1, 1]
    - [143, 0.091]
  - - [2944, 704, 1, 1]
    - [131, 0.095]
  - - [3584, 704, 1, 1]
    - [143, 0.104]
  - - [4288, 704, 1, 1]
    - [131, 0.105]
  - - [5056, 704, 1, 1]
    - [135, 0.112]
  - - [5888, 704, 1, 1]
    - [60, 0.117]
  - - [6784, 704, 1, 1]
    - [135, 0.12]
  - - [64, 1024, 1, 1]
    - [17, 0.007]
  - - [128, 1024, 1, 1]
    - [131, 0.014]
  - - [256, 1024, 1, 1]
    - [17, 0.026]
  - - [448, 1024, 1, 1]
    - [131, 0.043]
  - - [704, 1024, 1, 1]
    - [131, 0.059]
  - - [1024, 1024, 1, 1]
    - [131, 0.071]
  - - [1408, 1024, 1, 1]
    - [131, 0.085]
  - - [1856, 1024, 1, 1]
    - [71, 0.097]
  - - [2368, 1024, 1, 1]
    - [71, 0.1]
  - - [2944, 1024, 1, 1]
    - [131, 0.106]
  - - [3584, 1024, 1, 1]
    - [135, 0.113]
  - - [4288, 1024, 1, 1]
    - [131, 0.119]
  - - [5056, 1024, 1, 1]
    - [135, 0.123]
  - - [5888, 1024, 1, 1]
    - [135, 0.13]
  - - [6784, 1024, 1, 1]
    - [131, 0.135]
  - - [64, 1408, 1, 1]
    - [17, 0.01]
  - - [128, 1408, 1, 1]
    - [131, 0.019]
  - - [256, 1408, 1, 1]
    - [17, 0.034]
  - - [448, 1408, 1, 1]
    - [131, 0.053]
  - - [704, 1408, 1, 1]
    - [131, 0.069]
  - - [1024, 1408, 1, 1]
    - [131, 0.084]
  - - [1408, 1408, 1, 1]
    - [131, 0.092]
  - - [1856, 1408, 1, 1]
    - [143, 0.105]
  - - [2368, 1408, 1, 1]
    - [131, 0.108]
  - - [2944, 1408, 1, 1]
    - [60, 0.116]
  - - [3584, 1408, 1, 1]
    - [131, 0.123]
  - - [4288, 1408, 1, 1]
    - [131, 0.13]
  - - [5056, 1408, 1, 1]
    - [135, 0.134]
  - - [5888, 1408, 1, 1]
    - [131, 0.138]
  - - [6784, 1408, 1, 1]
    - [135, 0.141]
  - - [64, 1856, 1, 1]
    - [17, 0.013]
  - - [128, 1856, 1, 1]
    - [17, 0.024]
  - - [256, 1856, 1, 1]
    - [17, 0.043]
  - - [448, 1856, 1, 1]
    - [131, 0.064]
  - - [704, 1856, 1, 1]
    - [135, 0.078]
  - - [1024, 1856, 1, 1]
    - [143, 0.091]
  - - [1408, 1856, 1, 1]
    - [143, 0.102]
  - - [1856, 1856, 1, 1]
    - [131, 0.11]
  - - [2368, 1856, 1, 1]
    - [131, 0.119]
  - - [2944, 1856, 1, 1]
    - [131, 0.126]
  - - [3584, 1856, 1, 1]
    - [135, 0.13]
  - - [4288, 1856, 1, 1]
    - [131, 0.138]
  - - [5056, 1856, 1, 1]
    - [131, 0.142]
  - - [5888, 1856, 1, 1]
    - [135, 0.143]
  - - [6784, 1856, 1, 1]
    - [131, 0.149]
  - - [64, 2368, 1, 1]
    - [17, 0.016]
  - - [128, 2368, 1, 1]
    - [131, 0.03]
  - - [256, 2368, 1, 1]
    - [144, 0.05]
  - - [448, 2368, 1, 1]
    - [131, 0.072]
  - - [704, 2368, 1, 1]
    - [143, 0.09]
  - - [1024, 2368, 1, 1]
    - [68, 0.099]
  - - [1408, 2368, 1, 1]
    - [131, 0.109]
  - - [1856, 2368, 1, 1]
    - [131, 0.119]
  - - [2368, 2368, 1, 1]
    - [131, 0.124]
  - - [2944, 2368, 1, 1]
    - [131, 0.134]
  - - [3584, 2368, 1, 1]
    - [135, 0.138]
  - - [4288, 2368, 1, 1]
    - [135, 0.143]
  - - [5056, 2368, 1, 1]
    - [135, 0.147]
  - - [5888, 2368, 1, 1]
    - [135, 0.148]
  - - [6784, 2368, 1, 1]
    - [135, 0.152]
  - - [64, 2944, 1, 1]
    - [144, 0.021]
  - - [128, 2944, 1, 1]
    - [17, 0.036]
  - - [256, 2944, 1, 1]
    - [131, 0.061]
  - - [448, 2944, 1, 1]
    - [142, 0.081]
  - - [704, 2944, 1, 1]
    - [131, 0.093]
  - - [1024, 2944, 1, 1]
    - [135, 0.103]
  - - [1408, 2944, 1, 1]
    - [131, 0.116]
  - - [1856, 2944, 1, 1]
    - [135, 0.126]
  - - [2368, 2944, 1, 1]
    - [135, 0.132]
  - - [2944, 2944, 1, 1]
    - [131, 0.14]
  - - [3584, 2944, 1, 1]
    - [135, 0.144]
  - - [4288, 2944, 1, 1]
    - [131, 0.147]
  - - [5056, 2944, 1, 1]
    - [135, 0.151]
  - - [5888, 2944, 1, 1]
    - [135, 0.155]
  - - [6784, 2944, 1, 1]
    - [135, 0.156]
  - - [64, 3584, 1, 1]
    - [17, 0.026]
  - - [128, 3584, 1, 1]
    - [130, 0.044]
  - - [256, 3584, 1, 1]
    - [131, 0.072]
  - - [448, 3584, 1, 1]
    - [71, 0.089]
  - - [704, 3584, 1, 1]
    - [143, 0.105]
  - - [1024, 3584, 1, 1]
    - [131, 0.112]
  - - [1408, 3584, 1, 1]
    - [131, 0.122]
  - - [1856, 3584, 1, 1]
    - [131, 0.131]
  - - [2368, 3584, 1, 1]
    - [131, 0.139]
  - - [2944, 3584, 1, 1]
    - [131, 0.142]
  - - [3584, 3584, 1, 1]
    - [131, 0.149]
  - - [4288, 3584, 1, 1]
    - [135, 0.153]
  - - [5056, 3584, 1, 1]
    - [135, 0.155]
  - - [5888, 3584, 1, 1]
    - [135, 0.158]
  - - [6784, 3584, 1, 1]
    - [131, 0.159]
  - - [64, 4288, 1, 1]
    - [144, 0.028]
  - - [128, 4288, 1, 1]
    - [17, 0.051]
  - - [256, 4288, 1, 1]
    - [131, 0.076]
  - - [448, 4288, 1, 1]
    - [71, 0.097]
  - - [704, 4288, 1, 1]
    - [131, 0.105]
  - - [1024, 4288, 1, 1]
    - [131, 0.118]
  - - [1408, 4288, 1, 1]
    - [131, 0.13]
  - - [1856, 4288, 1, 1]
    - [131, 0.137]
  - - [2368, 4288, 1, 1]
    - [135, 0.143]
  - - [2944, 4288, 1, 1]
    - [135, 0.147]
  - - [3584, 4288, 1, 1]
    - [131, 0.152]
  - - [4288, 4288, 1, 1]
    - [135, 0.154]
  - - [5056, 4288, 1, 1]
    - [131, 0.158]
  - - [5888, 4288, 1, 1]
    - [131, 0.158]
  - - [6784, 4288, 1, 1]
    - [131, 0.161]
  - - [64, 5056, 1, 1]
    - [17, 0.033]
  - - [128, 5056, 1, 1]
    - [17, 0.056]
  - - [256, 5056, 1, 1]
    - [131, 0.081]
  - - [448, 5056, 1, 1]
    - [68, 0.099]
  - - [704, 5056, 1, 1]
    - [135, 0.11]
  - - [1024, 5056, 1, 1]
    - [131, 0.124]
  - - [1408, 5056, 1, 1]
    - [131, 0.133]
  - - [1856, 5056, 1, 1]
    - [135, 0.14]
  - - [2368, 5056, 1, 1]
    - [135, 0.147]
  - - [2944, 5056, 1, 1]
    - [131, 0.151]
  - - [3584, 5056, 1, 1]
    - [131, 0.157]
  - - [4288, 5056, 1, 1]
    - [131, 0.157]
  - - [5056, 5056, 1, 1]
    - [131, 0.161]
  - - [5888, 5056, 1, 1]
    - [135, 0.162]
  - - [6784, 5056, 1, 1]
    - [135, 0.162]
  - - [64, 5888, 1, 1]
    - [131, 0.039]
  - - [128, 5888, 1, 1]
    - [131, 0.061]
  - - [256, 5888, 1, 1]
    - [131, 0.083]
  - - [448, 5888, 1, 1]
    - [71, 0.104]
  - - [704, 5888, 1, 1]
    - [135, 0.116]
  - - [1024, 5888, 1, 1]
    - [131, 0.129]
  - - [1408, 5888, 1, 1]
    - [131, 0.139]
  - - [1856, 5888, 1, 1]
    - [135, 0.144]
  - - [2368, 5888, 1, 1]
    - [131, 0.147]
  - - [2944, 5888, 1, 1]
    - [131, 0.155]
  - - [3584, 5888, 1, 1]
    - [135, 0.157]
  - - [4288, 5888, 1, 1]
    - [131, 0.16]
  - - [5056, 5888, 1, 1]
    - [131, 0.161]
  - - [5888, 5888, 1, 1]
    - [135, 0.163]
  - - [6784, 5888, 1, 1]
    - [135, 0.165]
  - - [64, 6784, 1, 1]
    - [131, 0.041]
  - - [128, 6784, 1, 1]
    - [131, 0.068]
  - - [256, 6784, 1, 1]
    - [143, 0.092]
  - - [448, 6784, 1, 1]
    - [131, 0.106]
  - - [704, 6784, 1, 1]
    - [131, 0.119]
  - - [1024, 6784, 1, 1]
    - [131, 0.132]
  - - [1408, 6784, 1, 1]
    - [135, 0.142]
  - - [1856, 6784, 1, 1]
    - [131, 0.148]
  - - [2368, 6784, 1, 1]
    - [131, 0.154]
  - - [2944, 6784, 1, 1]
    - [135, 0.159]
  - - [3584, 6784, 1, 1]
    - [135, 0.16]
  - - [4288, 6784, 1, 1]
    - [135, 0.16]
  - - [5056, 6784, 1, 1]
    - [131, 0.162]
  - - [5888, 6784, 1, 1]
    - [131, 0.164]
  - - [6784, 6784, 1, 1]
    - [135, 0.166]
  - - [1, 1, 1, 256]
    - [25, 0.0]
  - - [1, 1, 1, 1280]
    - [5, 0.0]
  - - [1, 1, 1, 3328]
    - [140, 0.0]
  - - [1, 64, 1, 1]
    - [128, 0.0]
  - - [1, 128, 1, 1]
    - [146, 0.0]
  - - [1, 256, 1, 1]
    - [129, 0.0]
  - - [1, 448, 1, 1]
    - [132, 0.0]
  - - [1, 704, 1, 1]
    - [127, 0.0]
  - - [1, 1024, 1, 1]
    - [132, 0.0]
  - - [1, 1408, 1, 1]
    - [127, 0.0]
  - - [1, 1856, 1, 1]
    - [129, 0.0]
  - - [1, 2368, 1, 1]
    - [129, 0.0]
  - - [1, 2944, 1, 1]
    - [129, 0.0]
  - - [1, 3584, 1, 1]
    - [129, 0.0]
  - - [1, 4288, 1, 1]
    - [129, 0.001]
  - - [1, 5056, 1, 1]
    - [17, 0.001]
  - - [1, 5888, 1, 1]
    - [17, 0.001]
  - - [1, 6784, 1, 1]
    - [129, 0.001]
  - - [64, 1, 1, 1]
    - [146, 0.0]
  - - [128, 1, 1, 1]
    - [133, 0.0]
  - - [256, 1, 1, 1]
    - [134, 0.0]
  - - [448, 1, 1, 1]
    - [24, 0.0]
  - - [704, 1, 1, 1]
    - [127, 0.0]
  - - [1024, 1, 1, 1]
    - [134, 0.0]
  - - [1408, 1, 1, 1]
    - [144, 0.0]
  - - [1856, 1, 1, 1]
    - [24, 0.0]
  - - [2368, 1, 1, 1]
    - [144, 0.0]
  - - [2944, 1, 1, 1]
    - [129, 0.0]
  - - [3584, 1, 1, 1]
    - [144, 0.0]
  - - [4288, 1, 1, 1]
    - [144, 0.001]
  - - [5056, 1, 1, 1]
    - [129, 0.001]
  - - [5888, 1, 1, 1]
    - [133, 0.001]
  - - [6784, 1, 1, 1]
    - [144, 0.001]
  - - [7680, 8192, 1, 8192]
    - [108, 81.786]
  - - [3840, 4096, 1, 4096]
    - [147, 73.48]
  - - [1920, 2048, 1, 2048]
    - [85, 62.181]
  - - [960, 1024, 1, 1024]
    - [48, 30.988]
  - - [480, 512, 1, 512]
    - [15, 9.732]
  - - [8192, 7680, 1, 8192]
    - [108, 81.883]
  - - [4096, 3840, 1, 4096]
    - [148, 73.346]
  - - [2048, 1920, 1, 2048]
    - [75, 56.158]
  - - [1024, 960, 1, 1024]
    - [19, 30.685]
  - - [512, 480, 1, 512]
    - [24, 9.42]
  - - [8192, 8192, 1, 8192]
    - [108, 81.252]
  - - [4096, 4096, 1, 4096]
    - [116, 70.554]
  - - [2048, 2048, 1, 2048]
    - [120, 56.333]
  - - [512, 512, 1, 512]
    - [16, 8.723]
  - - [512, 512, 16, 64]
    - [131, 8.13]
  - - [512, 512, 128, 64]
    - [38, 10.114]
  - - [1024, 1, 1, 1024]
    - [9, 0.087]
  - - [1024, 77, 1, 1024]
    - [10, 5.397]
  - - [1024, 512, 1, 1024]
    - [42, 20.847]
  - - [1024, 512, 1, 4096]
    - [46, 28.833]
  - - [4096, 512, 1, 1024]
    - [149, 40.194]
  - - [128, 128, 128, 64]
    - [135, 6.408]
  - - [128, 128, 160, 64]
    - [131, 7.009]
  - - [1024, 10, 1, 1024]
    - [3, 0.825]
  - - [1024, 200, 1, 1024]
    - [44, 10.552]
  - - [1024, 1280, 1, 1024]
    - [89, 36.943]
  - - [1024, 1280, 1, 4096]
    - [55, 47.443]
  - - [4096, 1280, 1, 1024]
    - [53, 48.543]
  - - [128, 128, 624, 64]
    - [16, 8.649]
  - - [1024, 39, 1, 1024]
    - [40, 3.111]
  - - [1024, 780, 1, 1024]
    - [47, 28.667]
  - - [1024, 4992, 1, 1024]
    - [150, 48.694]
  - - [1024, 4992, 1, 4096]
    - [114, 59.703]
  - - [4096, 4992, 1, 1024]
    - [151, 54.902]
  - - [512, 512, 64, 64]
    - [38, 9.653]
  - - [1024, 4, 1, 1024]
    - [7, 0.35]
  - - [1024, 308, 1, 1024]
    - [16, 14.257]
  - - [1024, 2048, 1, 1024]
    - [79, 39.954]
  - - [1024, 2048, 1, 4096]
    - [79, 56.452]
  - - [4096, 2048, 1, 1024]
    - [53, 51.663]
  - - [128, 128, 640, 64]
    - [152, 8.615]
  - - [1024, 40, 1, 1024]
    - [40, 3.115]
  - - [1024, 800, 1, 1024]
    - [47, 28.651]
  - - [1024, 5120, 1, 1024]
    - [55, 49.549]
  - - [1024, 5120, 1, 4096]
    - [153, 61.289]
  - - [4096, 5120, 1, 1024]
    - [119, 54.94]
  - - [128, 128, 656, 64]
    - [154, 8.606]
  - - [1024, 41, 1, 1024]
    - [40, 3.298]
  - - [1024, 820, 1, 1024]
    - [47, 29.049]
  - - [1024, 5248, 1, 1024]
    - [55, 49.613]
  - - [1024, 5248, 1, 4096]
    - [153, 62.234]
  - - [4096, 5248, 1, 1024]
    - [119, 56.144]
  - - [512, 512, 80, 64]
    - [12, 9.914]
  - - [1024, 5, 1, 1024]
    - [3, 0.427]
  - - [1024, 385, 1, 1024]
    - [155, 17.99]
  - - [1024, 2560, 1, 1024]
    - [55, 46.179]
  - - [1024, 2560, 1, 4096]
    - [153, 55.855]
  - - [4096, 2560, 1, 1024]
    - [73, 50.217]
  - - [512, 512, 96, 64]
    - [12, 9.929]
  - - [1024, 6, 1, 1024]
    - [8, 0.503]
  - - [1024, 462, 1, 1024]
    - [37, 19.049]
  - - [1024, 3072, 1, 1024]
    - [75, 41.352]
  - - [1024, 3072, 1, 4096]
    - [156, 56.959]
  - - [4096, 3072, 1, 1024]
    - [92, 52.656]
  - - [1024, 8, 1, 1024]
    - [8, 0.671]
  - - [1024, 160, 1, 1024]
    - [24, 9.29]
  - - [1024, 1024, 1, 4096]
    - [77, 38.574]
  - - [4096, 1024, 1, 1024]
    - [65, 48.898]
  - - [128, 128, 144, 64]
    - [137, 6.634]
  - - [1024, 9, 1, 1024]
    - [8, 0.748]
  - - [1024, 180, 1, 1024]
    - [24, 9.868]
  - - [1024, 1152, 1, 1024]
    - [65, 32.958]
  - - [1024, 1152, 1, 4096]
    - [84, 42.498]
  - - [4096, 1152, 1, 1024]
    - [92, 44.594]
  - - [128, 32768, 1, 256]
    - [60, 22.33]
  - - [256, 32768, 1, 512]
    - [55, 40.034]
  - - [512, 32768, 1, 13]
    - [131, 1.987]
  - - [512, 32768, 1, 1024]
    - [56, 55.079]
  - - [1024, 32768, 1, 479]
    - [113, 35.127]
  - - [1024, 32768, 1, 1024]
    - [56, 57.215]
  - - [32768, 1, 1, 256]
    - [157, 0.441]
  - - [64, 128, 512, 128]
    - [152, 11.392]
  - - [128, 128, 512, 64]
    - [12, 8.473]
  - - [1024, 32, 1, 1024]
    - [40, 2.617]
  - - [1024, 4096, 1, 1024]
    - [55, 48.483]
  - - [1024, 4096, 1, 4096]
    - [158, 66.546]
  - - [4096, 4096, 1, 1024]
    - [61, 55.459]
  - - [30528, 4096, 1, 1024]
    - [66, 61.096]
  - - [64, 512, 64, 512]
    - [19, 22.53]
  - - [30528, 2048, 1, 1024]
    - [66, 58.71]
  - - [1024, 8192, 1, 1024]
    - [55, 52.336]
  - - [1024, 8192, 1, 4096]
    - [112, 67.952]
  - - [1024, 9600, 1, 1024]
    - [116, 53.253]
  - - [1024, 9600, 1, 4096]
    - [159, 75.063]
  - - [4096, 8192, 1, 1024]
    - [62, 57.174]
  - - [4096, 9600, 1, 1024]
    - [62, 58.07]
  - - [33712, 8192, 1, 1024]
    - [56, 60.366]
  - - [33712, 9600, 1, 1024]
    - [124, 63.496]
  - - [1024, 10064, 1, 1024]
    - [63, 53.585]
  - - [1024, 10064, 1, 4096]
    - [156, 64.515]
  - - [1024, 10080, 1, 1024]
    - [150, 53.993]
  - - [1024, 10080, 1, 4096]
    - [86, 64.639]
  - - [1024, 10200, 1, 1024]
    - [73, 50.576]
  - - [1024, 10200, 1, 4096]
    - [156, 65.016]
  - - [1024, 3840, 1, 1024]
    - [85, 48.496]
  - - [1024, 3840, 1, 4096]
    - [156, 69.427]
  - - [1024, 3968, 1, 1024]
    - [63, 47.776]
  - - [1024, 3968, 1, 4096]
    - [112, 64.869]
  - - [1024, 6528, 1, 1024]
    - [63, 50.203]
  - - [1024, 6528, 1, 4096]
    - [100, 63.019]
  - - [1024, 7104, 1, 1024]
    - [56, 53.093]
  - - [1024, 7104, 1, 4096]
    - [116, 67.862]
  - - [1024, 7200, 1, 1024]
    - [150, 52.452]
  - - [1024, 7200, 1, 4096]
    - [156, 68.116]
  - - [1024, 8064, 1, 1024]
    - [55, 52.026]
  - - [1024, 8064, 1, 4096]
    - [112, 67.289]
  - - [1024, 8160, 1, 1024]
    - [55, 52.439]
  - - [1024, 8160, 1, 4096]
    - [112, 68.003]
  - - [1024, 9216, 1, 1024]
    - [56, 52.305]
  - - [1024, 9216, 1, 4096]
    - [108, 71.689]
  - - [1024, 9520, 1, 1024]
    - [56, 53.505]
  - - [1024, 9520, 1, 4096]
    - [123, 74.26]
  - - [4096, 10064, 1, 1024]
    - [62, 57.484]
  - - [4096, 10080, 1, 1024]
    - [62, 57.769]
  - - [4096, 10200, 1, 1024]
    - [73, 55.964]
  - - [4096, 3840, 1, 1024]
    - [88, 55.272]
  - - [4096, 3968, 1, 1024]
    - [119, 54.155]
  - - [4096, 6528, 1, 1024]
    - [119, 57.106]
  - - [4096, 7104, 1, 1024]
    - [62, 57.387]
  - - [4096, 7200, 1, 1024]
    - [62, 57.36]
  - - [4096, 8064, 1, 1024]
    - [62, 56.593]
  - - [4096, 8160, 1, 1024]
    - [62, 56.77]
  - - [4096, 9216, 1, 1024]
    - [62, 56.514]
  - - [4096, 9520, 1, 1024]
    - [62, 57.988]
  - - [42720, 10080, 1, 1024]
    - [73, 60.326]
  - - [42720, 3968, 1, 1024]
    - [56, 59.338]
  - - [42720, 6528, 1, 1024]
    - [77, 59.907]
  - - [42720, 7104, 1, 1024]
    - [73, 60.226]
  - - [42720, 7200, 1, 1024]
    - [73, 60.301]
  - - [42720, 9520, 1, 1024]
    - [56, 60.063]
  - - [24, 24, 4736, 64]
    - [130, 4.074]
  - - [32, 32, 4608, 64]
    - [17, 5.373]
  - - [32, 35, 4608, 64]
    - [160, 5.284]
  - - [64, 512, 1, 512]
    - [29, 1.635]
  - - [512, 512, 1, 64]
    - [129, 1.915]
  - - [128, 128, 1, 64]
    - [26, 0.151]
  - - [64, 128, 1, 128]
    - [13, 0.138]
  - - [2048, 512, 1, 2048]
    - [77, 38.5]
  - - [1024, 512, 1, 1600]
    - [37, 25.161]
  - - [2048, 512, 1, 74]
    - [161, 4.685]
  - - [512, 1, 1, 2048]
    - [9, 0.061]
  - - [64, 512, 1, 1024]
    - [8, 2.617]
  - - [1024, 1600, 1, 560]
    - [162, 23.269]
  - - [1600, 1, 1, 1024]
    - [7, 0.136]
  - - [512, 1600, 1, 512]
    - [83, 20.444]
  - - [1024, 1600, 1, 1024]
    - [93, 38.482]
  - - [32, 1600, 1, 512]
    - [9, 2.555]
  - - [64, 960, 1, 1024]
    - [9, 4.673]
  - - [200, 1, 1, 1024]
    - [6, 0.018]
  - - [256, 684, 1, 1024]
    - [24, 9.813]
  - - [256, 1280, 1, 1024]
    - [83, 14.404]
  - - [256, 1536, 1, 1024]
    - [163, 17.051]
  - - [256, 2304, 1, 1024]
    - [19, 23.26]
  - - [256, 2560, 1, 1024]
    - [19, 24.726]
  - - [256, 2816, 1, 1024]
    - [19, 25.398]
  - - [256, 3328, 1, 1024]
    - [19, 28.748]
  - - [256, 3584, 1, 1024]
    - [87, 30.008]
  - - [256, 4608, 1, 1024]
    - [164, 33.151]
  - - [256, 4864, 1, 1024]
    - [77, 34.688]
  - - [256, 5376, 1, 1024]
    - [73, 37.574]
  - - [256, 5888, 1, 1024]
    - [75, 36.662]
  - - [256, 6144, 1, 1024]
    - [80, 37.871]
  - - [256, 6400, 1, 1024]
    - [115, 38.672]
  - - [256, 6656, 1, 1024]
    - [80, 39.924]
  - - [256, 7168, 1, 1024]
    - [76, 41.968]
  - - [256, 7424, 1, 1024]
    - [76, 42.955]
  - - [256, 7936, 1, 1024]
    - [82, 38.86]
  - - [256, 8192, 1, 1024]
    - [79, 40.436]
  - - [256, 8448, 1, 1024]
    - [55, 40.399]
  - - [256, 8960, 1, 1024]
    - [100, 43.7]
  - - [256, 9984, 1, 1024]
    - [165, 45.781]
  - - [256, 10496, 1, 1024]
    - [55, 46.228]
  - - [256, 11264, 1, 1024]
    - [55, 47.644]
  - - [256, 11520, 1, 1024]
    - [165, 48.227]
  - - [256, 11776, 1, 1024]
    - [85, 39.847]
  - - [256, 12544, 1, 1024]
    - [85, 41.755]
  - - [256, 13312, 1, 1024]
    - [88, 43.777]
  - - [256, 14336, 1, 1024]
    - [88, 45.675]
  - - [256, 14592, 1, 1024]
    - [76, 46.25]
  - - [256, 14848, 1, 1024]
    - [88, 47.183]
  - - [256, 15104, 1, 1024]
    - [86, 46.963]
  - - [256, 16128, 1, 1024]
    - [150, 47.785]
  - - [256, 18176, 1, 1024]
    - [100, 47.135]
  - - [256, 18944, 1, 1024]
    - [103, 49.493]
  - - [256, 19200, 1, 1024]
    - [100, 49.633]
  - - [256, 20480, 1, 1024]
    - [55, 48.684]
  - - [256, 20992, 1, 1024]
    - [55, 49.518]
  - - [256, 21248, 1, 1024]
    - [55, 49.834]
  - - [256, 21504, 1, 1024]
    - [150, 50.052]
  - - [256, 22016, 1, 1024]
    - [63, 50.619]
  - - [256, 22344, 1, 1024]
    - [65, 50.474]
  - - [256, 23296, 1, 1024]
    - [73, 44.965]
  - - [256, 23552, 1, 1024]
    - [63, 45.856]
  - - [256, 31488, 1, 1024]
    - [150, 50.854]
  - - [256, 33536, 1, 1024]
    - [55, 52.469]
  - - [256, 44505, 1, 1024]
    - [55, 53.207]
  - - [960, 1, 1, 2048]
    - [28, 0.11]
  - - [1024, 200, 1, 560]
    - [24, 7.015]
  - - [1024, 960, 1, 1600]
    - [19, 41.347]
  - - [1024, 32768, 1, 480]
    - [62, 48.528]
  - - [1280, 8976, 1, 256]
    - [65, 28.202]
  - - [1792, 8976, 1, 256]
    - [65, 29.711]
  - - [2048, 114, 1, 512]
    - [16, 7.878]
  - - [2048, 114, 1, 768]
    - [14, 10.232]
  - - [2048, 215, 1, 512]
    - [16, 12.558]
  - - [2048, 215, 1, 768]
    - [37, 16.744]
  - - [2048, 256, 1, 512]
    - [49, 14.605]
  - - [2048, 256, 1, 768]
    - [41, 19.031]
  - - [2048, 512, 1, 67]
    - [161, 4.215]
  - - [2048, 512, 1, 100]
    - [166, 5.947]
  - - [2048, 684, 1, 512]
    - [19, 24.497]
  - - [2048, 684, 1, 768]
    - [48, 30.979]
  - - [2048, 960, 1, 74]
    - [162, 5.998]
  - - [2048, 960, 1, 2048]
    - [100, 49.974]
  - - [2048, 1536, 1, 512]
    - [167, 30.573]
  - - [2048, 1536, 1, 768]
    - [80, 36.584]
  - - [2048, 8976, 1, 256]
    - [53, 28.803]
  - - [2304, 8976, 1, 256]
    - [52, 30.082]
  - - [2560, 8976, 1, 256]
    - [52, 30.516]
  - - [2816, 8976, 1, 256]
    - [65, 30.384]
  - - [3072, 8976, 1, 256]
    - [63, 30.179]
  - - [3328, 8976, 1, 256]
    - [53, 31.048]
  - - [3840, 8976, 1, 256]
    - [60, 31.41]
  - - [4096, 8976, 1, 256]
    - [63, 30.798]
  - - [4352, 8976, 1, 256]
    - [60, 31.468]
  - - [4608, 8976, 1, 256]
    - [63, 31.438]
  - - [4864, 8976, 1, 256]
    - [60, 31.705]
  - - [5120, 8976, 1, 256]
    - [61, 31.146]
  - - [5376, 8976, 1, 256]
    - [53, 31.287]
  - - [5632, 8976, 1, 256]
    - [66, 31.465]
  - - [5888, 8976, 1, 256]
    - [126, 31.583]
  - - [6144, 8976, 1, 256]
    - [66, 31.197]
  - - [6400, 8976, 1, 256]
    - [73, 31.472]
  - - [7168, 8976, 1, 256]
    - [126, 31.821]
  - - [7936, 8976, 1, 256]
    - [66, 31.892]
  - - [8192, 8976, 1, 256]
    - [72, 30.911]
  - - [8448, 8976, 1, 256]
    - [66, 31.843]
  - - [8960, 8976, 1, 256]
    - [66, 32.475]
  - - [9472, 8976, 1, 256]
    - [126, 32.476]
  - - [9728, 8976, 1, 256]
    - [126, 32.438]
  - - [9984, 8976, 1, 256]
    - [66, 32.232]
  - - [10240, 8976, 1, 256]
    - [73, 32.011]
  - - [10496, 8976, 1, 256]
    - [126, 32.258]
  - - [11264, 8976, 1, 256]
    - [66, 32.47]
  - - [11776, 8976, 1, 256]
    - [126, 32.275]
  - - [12544, 8976, 1, 256]
    - [66, 31.553]
  - - [13312, 8976, 1, 256]
    - [126, 33.14]
  - - [13568, 8976, 1, 256]
    - [66, 31.929]
  - - [13824, 8976, 1, 256]
    - [126, 32.779]
  - - [15104, 8976, 1, 256]
    - [126, 32.729]
  - - [15360, 8976, 1, 256]
    - [126, 32.549]
  - - [15872, 8976, 1, 256]
    - [66, 32.749]
  - - [16128, 8976, 1, 256]
    - [126, 33.554]
  - - [17152, 8976, 1, 256]
    - [66, 33.074]
  - - [18176, 8976, 1, 256]
    - [126, 33.307]
  - - [18688, 8976, 1, 256]
    - [126, 33.32]
  - - [18944, 8976, 1, 256]
    - [66, 32.593]
  - - [19712, 8976, 1, 256]
    - [126, 32.99]
  - - [19968, 8976, 1, 256]
    - [126, 33.137]
  - - [20480, 8976, 1, 256]
    - [72, 30.503]
  - - [20992, 8976, 1, 256]
    - [126, 33.063]
  - - [21248, 8976, 1, 256]
    - [126, 32.364]
  - - [23552, 8976, 1, 256]
    - [66, 33.346]
  - - [28672, 8976, 1, 256]
    - [72, 30.361]
  - - [31488, 8976, 1, 256]
    - [126, 33.484]
  - - [33536, 8976, 1, 256]
    - [66, 33.671]
  - - [2048, 1024, 1, 2048]
    - [103, 51.597]
  - - [2048, 1024, 1, 8192]
    - [94, 65.039]
  - - [2048, 2, 1, 2048]
    - [21, 0.459]
  - - [30592, 1024, 1, 2048]
    - [88, 66.644]
  - - [6144, 1024, 1, 2048]
    - [56, 57.75]
  - - [8192, 1024, 1, 2048]
    - [99, 60.103]
  - - [1024, 16, 1, 1024]
    - [7, 1.319]
  - - [30592, 8192, 1, 1024]
    - [108, 57.996]
  - - [3072, 8192, 1, 1024]
    - [73, 55.928]
  - - [512, 512, 256, 64]
    - [38, 10.373]
  - - [64, 512, 256, 512]
    - [51, 25.423]
  - - [30592, 2048, 1, 1024]
    - [66, 57.333]
  - - [3072, 2048, 1, 1024]
    - [60, 48.622]
  - - [30592, 4096, 1, 1024]
    - [66, 59.899]
  - - [3072, 4096, 1, 1024]
    - [73, 53.71]
  - - [64, 512, 128, 512]
    - [49, 24.389]
  - - [1920, 2048, 1, 2560]
    - [88, 67.0]
  - - [2560, 2048, 1, 2560]
    - [55, 62.089]
  - - [2560, 2048, 1, 640]
    - [57, 41.867]
  - - [2560, 4, 1, 2560]
    - [8, 1.284]
  - - [7680, 2048, 1, 2560]
    - [85, 71.953]
  - - [512, 512, 40, 64]
    - [34, 9.263]
  - - [64, 512, 40, 512]
    - [52, 22.114]
  - - [1536, 4096, 1, 1536]
    - [73, 54.843]
  - - [1536, 4096, 1, 6144]
    - [100, 65.238]
  - - [4608, 4096, 1, 1536]
    - [73, 63.958]
  - - [50304, 4096, 1, 1536]
    - [73, 67.056]
  - - [6144, 4096, 1, 1536]
    - [73, 63.732]
  - - [1024, 1024, 64, 96]
    - [143, 14.799]
  - - [96, 1024, 64, 1024]
    - [52, 39.329]
  - - [1536, 8192, 1, 1536]
    - [73, 61.752]
  - - [1536, 8192, 1, 6144]
    - [107, 74.54]
  - - [4608, 8192, 1, 1536]
    - [73, 65.509]
  - - [50304, 8192, 1, 1536]
    - [73, 67.116]
  - - [6144, 8192, 1, 1536]
    - [66, 66.235]
  - - [1024, 1024, 128, 96]
    - [143, 14.974]
  - - [96, 1024, 128, 1024]
    - [168, 40.944]
  - - [1024, 16384, 1, 1024]
    - [56, 55.864]
  - - [1024, 16384, 1, 4096]
    - [116, 70.959]
  - - [3072, 16384, 1, 1024]
    - [56, 58.042]
  - - [4096, 16384, 1, 1024]
    - [62, 57.968]
  - - [50304, 16384, 1, 1024]
    - [123, 60.485]
  - - [1024, 1024, 256, 64]
    - [152, 10.683]
  - - [64, 1024, 256, 1024]
    - [70, 32.966]
  - - [50304, 2048, 1, 1024]
    - [66, 59.812]
  - - [1024, 1024, 32, 64]
    - [152, 10.243]
  - - [64, 1024, 32, 1024]
    - [49, 27.72]
  - - [50304, 4096, 1, 1024]
    - [124, 60.781]
  - - [1024, 1024, 64, 64]
    - [152, 10.484]
  - - [64, 1024, 64, 1024]
    - [18, 29.511]
  - - [50304, 8192, 1, 1024]
    - [123, 59.297]
  - - [1024, 1024, 128, 64]
    - [152, 10.619]
  - - [64, 1024, 128, 1024]
    - [51, 31.267]
  - - [1024, 64, 1, 1024]
    - [10, 4.486]
  - - [30528, 8192, 1, 1024]
    - [56, 58.815]
  - - [128, 128, 1024, 64]
    - [169, 8.94]
  - - [64, 128, 1024, 128]
    - [38, 12.345]
  - - [1024, 3456, 1, 1024]
    - [75, 44.682]
  - - [1024, 3456, 1, 480]
    - [64, 33.467]
  - - [1024, 4096, 1, 480]
    - [145, 36.513]
  - - [1024, 6912, 1, 1024]
    - [72, 52.417]
  - - [1024, 6912, 1, 480]
    - [62, 41.291]
  - - [1024, 864, 1, 1024]
    - [47, 28.74]
  - - [1024, 864, 1, 480]
    - [131, 18.925]
  - - [128, 3456, 1, 256]
    - [16, 8.906]
  - - [128, 4096, 1, 256]
    - [12, 9.588]
  - - [128, 55296, 1, 256]
    - [170, 24.121]
  - - [128, 6912, 1, 256]
    - [19, 14.618]
  - - [128, 864, 1, 256]
    - [10, 3.081]
  - - [256, 3456, 1, 512]
    - [19, 22.312]
  - - [256, 4096, 1, 512]
    - [19, 20.847]
  - - [256, 55296, 1, 512]
    - [63, 42.418]
  - - [256, 6912, 1, 512]
    - [70, 29.959]
  - - [256, 864, 1, 512]
    - [24, 8.832]
  - - [3456, 1, 1, 256]
    - [23, 0.097]
  - - [4096, 1, 1, 256]
    - [6, 0.117]
  - - [512, 3456, 1, 1024]
    - [76, 41.459]
  - - [512, 3456, 1, 13]
    - [143, 1.157]
  - - [512, 4096, 1, 1024]
    - [55, 39.875]
  - - [512, 4096, 1, 13]
    - [131, 1.221]
  - - [512, 55296, 1, 13]
    - [131, 2.086]
  - - [512, 6912, 1, 1024]
    - [88, 45.038]
  - - [512, 6912, 1, 13]
    - [131, 1.464]
  - - [512, 864, 1, 1024]
    - [104, 18.841]
  - - [512, 864, 1, 13]
    - [131, 0.538]
  - - [6912, 1, 1, 256]
    - [10, 0.182]
  - - [864, 1, 1, 256]
    - [7, 0.025]
  - - [30528, 640, 1, 1024]
    - [66, 58.146]
  - - [30528, 1280, 1, 1024]
    - [66, 59.185]
  - - [30528, 1600, 1, 1024]
    - [66, 59.258]
  - - [1024, 10240, 1, 1024]
    - [60, 51.059]
  - - [1024, 80, 1, 1024]
    - [10, 5.73]
  - - [4096, 10240, 1, 1024]
    - [73, 56.129]
  - - [1024, 10240, 1, 4096]
    - [156, 65.622]
  - - [64, 128, 1280, 128]
    - [38, 12.511]
  - - [128, 128, 1280, 64]
    - [152, 9.043]
  - - [1024, 10496, 1, 4096]
    - [156, 66.957]
  - - [30528, 1640, 1, 1024]
    - [66, 58.753]
  - - [1024, 82, 1, 1024]
    - [10, 5.474]
  - - [4096, 10496, 1, 1024]
    - [62, 57.228]
  - - [1024, 10496, 1, 1024]
    - [73, 51.653]
  - - [64, 128, 1312, 128]
    - [38, 12.512]
  - - [128, 128, 1312, 64]
    - [152, 9.092]
  - - [30528, 160, 1, 1024]
    - [61, 47.376]
  - - [1024, 12, 1, 1024]
    - [4, 0.981]
  - - [30528, 240, 1, 1024]
    - [76, 48.155]
  - - [1024, 6144, 1, 1024]
    - [72, 47.926]
  - - [4096, 6144, 1, 1024]
    - [125, 54.972]
  - - [1024, 6144, 1, 4096]
    - [100, 60.578]
  - - [64, 512, 192, 512]
    - [49, 25.1]
  - - [512, 512, 192, 64]
    - [38, 10.317]
  - - [1024, 10224, 1, 1024]
    - [73, 50.644]
  - - [1024, 10192, 1, 1024]
    - [55, 50.461]
  - - [1024, 10208, 1, 1024]
    - [73, 50.719]
  - - [1024, 10224, 1, 4096]
    - [156, 65.317]
  - - [4096, 10224, 1, 1024]
    - [73, 56.033]
  - - [3072, 10224, 1, 1024]
    - [66, 57.726]
  - - [3072, 10240, 1, 1024]
    - [66, 58.241]
  - - [1024, 10192, 1, 4096]
    - [171, 65.028]
  - - [4096, 10192, 1, 1024]
    - [73, 55.897]
  - - [3072, 10192, 1, 1024]
    - [66, 57.845]
  - - [3072, 10200, 1, 1024]
    - [66, 57.635]
  - - [1024, 10184, 1, 1024]
    - [55, 50.193]
  - - [3072, 10208, 1, 1024]
    - [66, 57.768]
  - - [1024, 10208, 1, 4096]
    - [171, 64.972]
  - - [4096, 10208, 1, 1024]
    - [73, 56.008]
  - - [2048, 10224, 1, 1024]
    - [56, 54.172]
  - - [2048, 10240, 1, 1024]
    - [56, 54.537]
  - - [1024, 10120, 1, 1024]
    - [60, 50.77]
  - - [2048, 10192, 1, 1024]
    - [56, 54.164]
  - - [24, 24, 6816, 64]
    - [134, 4.33]
  - - [1024, 10152, 1, 1024]
    - [60, 50.492]
  - - [3072, 10080, 1, 1024]
    - [66, 57.609]
  - - [1024, 2048, 1, 49]
    - [64, 4.218]
  - - [1024, 256, 1, 196]
    - [17, 4.041]
  - - [1024, 512, 1, 196]
    - [134, 6.542]
  - - [1152, 128, 1, 784]
    - [26, 6.327]
  - - [128, 512, 1, 784]
    - [26, 3.005]
  - - [2048, 512, 1, 49]
    - [137, 3.293]
  - - [2304, 256, 1, 196]
    - [172, 7.36]
  - - [256, 1024, 1, 196]
    - [17, 4.11]
  - - [256, 128, 1, 3136]
    - [28, 3.831]
  - - [256, 512, 1, 784]
    - [26, 5.69]
  - - [256, 64, 1, 3136]
    - [0, 2.247]
  - - [4608, 512, 1, 49]
    - [68, 4.546]
  - - [512, 1024, 1, 196]
    - [134, 6.918]
  - - [512, 128, 1, 784]
    - [128, 2.95]
  - - [512, 2048, 1, 49]
    - [137, 3.362]
  - - [512, 256, 1, 784]
    - [26, 5.591]
  - - [576, 64, 1, 3136]
    - [2, 4.161]
  - - [64, 256, 1, 3136]
    - [28, 2.236]
  - - [64, 64, 1, 3136]
    - [28, 0.646]
  - - [128, 128, 49, 12800]
    - [173, 39.156]
  - - [128, 128, 25, 25088]
    - [45, 34.717]
  - - [128, 128, 49, 25600]
    - [173, 42.561]
  - - [128, 128, 25, 50176]
    - [174, 36.344]
  - - [256, 256, 25, 12544]
    - [76, 61.764]
  - - [256, 256, 49, 3200]
    - [88, 55.047]
  - - [256, 256, 25, 6272]
    - [97, 58.674]
  - - [256, 256, 49, 6400]
    - [171, 61.272]
  - - [512, 512, 49, 1152]
    - [57, 53.058]
  - - [512, 512, 25, 2048]
    - [85, 54.21]
  - - [512, 512, 49, 2304]
    - [76, 61.207]
  - - [512, 512, 25, 4096]
    - [156, 61.137]
  - - [64, 128, 2048, 128]
    - [41, 12.85]
  - - [128, 128, 2048, 64]
    - [169, 9.219]
  - - [30528, 2560, 1, 1024]
    - [126, 59.613]
  - - [1024, 128, 1, 1024]
    - [26, 7.753]
  - - [64, 128, 1536, 128]
    - [37, 12.666]
  - - [128, 128, 1536, 64]
    - [152, 9.129]
  - - [1024, 12288, 1, 1024]
    - [63, 53.237]
  - - [1024, 12288, 1, 4096]
    - [112, 69.012]
  - - [30528, 1920, 1, 1024]
    - [66, 58.859]
  - - [1024, 96, 1, 1024]
    - [10, 6.497]
  - - [4096, 12288, 1, 1024]
    - [62, 57.406]
  - - [128, 128, 36, 12544]
    - [32, 34.62]
  - - [128, 128, 49, 9216]
    - [173, 37.488]
  - - [128, 128, 64, 6400]
    - [75, 34.564]
  - - [128, 128, 81, 12544]
    - [111, 38.821]
  - - [128, 128, 121, 9216]
    - [175, 32.537]
  - - [128, 128, 169, 6400]
    - [173, 38.911]
  - - [256, 256, 36, 4096]
    - [176, 50.693]
  - - [256, 256, 49, 2304]
    - [88, 51.633]
  - - [256, 256, 64, 2304]
    - [57, 49.204]
  - - [256, 256, 81, 4096]
    - [177, 55.429]
  - - [256, 256, 121, 2304]
    - [55, 52.935]
  - - [256, 256, 169, 2304]
    - [148, 60.199]
  - - [512, 512, 81, 1024]
    - [78, 50.156]
  - - [512, 512, 121, 1024]
    - [165, 50.434]
  - - [512, 512, 169, 1024]
    - [178, 52.213]
  - - [512, 512, 36, 1024]
    - [78, 49.608]
  - - [512, 512, 49, 1024]
    - [165, 48.577]
  - - [512, 512, 64, 1024]
    - [165, 49.378]
  - - [64, 64, 36, 50176]
    - [96, 19.406]
  - - [64, 64, 49, 36864]
    - [45, 20.503]
  - - [64, 64, 64, 25600]
    - [179, 19.855]
  - - [128, 128, 192, 64]
    - [135, 7.191]
  - - [64, 128, 192, 128]
    - [180, 9.813]
  - - [768, 2048, 1, 768]
    - [51, 34.783]
  - - [3072, 2048, 1, 768]
    - [60, 44.948]
  - - [768, 2048, 1, 3072]
    - [76, 52.457]
  - - [768, 16, 1, 768]
    - [7, 0.818]
  - - [384, 384, 144, 64]
    - [131, 9.92]
  - - [64, 384, 144, 384]
    - [70, 21.231]
  - - [768, 4608, 1, 768]
    - [151, 40.118]
  - - [3072, 4608, 1, 768]
    - [73, 51.177]
  - - [768, 4608, 1, 3072]
    - [86, 62.764]
  - - [768, 12, 1, 768]
    - [40, 0.613]
  - - [512, 512, 48, 64]
    - [12, 9.468]
  - - [64, 512, 48, 512]
    - [180, 23.551]
  - - [768, 4, 1, 768]
    - [7, 0.208]
  - - [128, 128, 256, 64]
    - [131, 7.706]
  - - [64, 128, 256, 128]
    - [19, 10.129]
  - - [384, 384, 192, 64]
    - [131, 10.081]
  - - [64, 384, 192, 384]
    - [49, 21.767]
  - - [1024, 4608, 1, 1024]
    - [100, 48.002]
  - - [4096, 4608, 1, 1024]
    - [62, 54.926]
  - - [1024, 4608, 1, 4096]
    - [159, 69.009]
  - - [2880, 3072, 1, 3072]
    - [99, 68.688]
  - - [3072, 3072, 1, 3072]
    - [181, 68.547]
  - - [3072, 512, 1, 3072]
    - [115, 52.518]
  - - [4096, 512, 1, 4096]
    - [98, 55.211]
  - - [512, 1024, 1, 1024]
    - [19, 20.761]
  - - [512, 2048, 1, 2048]
    - [65, 37.99]
  - - [512, 3072, 1, 3072]
    - [115, 50.921]
  - - [512, 4096, 1, 4096]
    - [100, 58.848]
  - - [512, 8192, 1, 8192]
    - [107, 73.869]
  - - [64, 1024, 1, 1024]
    - [25, 4.906]
  - - [8192, 512, 1, 8192]
    - [182, 70.146]
  - - [2, 1, 1, 1024]
    - [25, 0.0]
  - - [2, 8, 1, 1024]
    - [5, 0.001]
  - - [30522, 77, 1, 1024]
    - [164, 28.763]
  - - [30522, 616, 1, 1024]
    - [150, 52.729]
  - - [2, 10, 1, 1024]
    - [5, 0.002]
  - - [30522, 160, 1, 1024]
    - [126, 42.66]
  - - [30522, 200, 1, 1024]
    - [125, 39.931]
  - - [2, 39, 1, 1024]
    - [5, 0.008]
  - - [30522, 780, 1, 1024]
    - [150, 53.554]
  - - [2, 4, 1, 1024]
    - [25, 0.001]
  - - [30522, 308, 1, 1024]
    - [125, 45.269]
  - - [2, 40, 1, 1024]
    - [5, 0.008]
  - - [30522, 800, 1, 1024]
    - [126, 57.267]
  - - [2, 41, 1, 1024]
    - [5, 0.008]
  - - [30522, 820, 1, 1024]
    - [164, 54.031]
  - - [2, 5, 1, 1024]
    - [25, 0.001]
  - - [30522, 385, 1, 1024]
    - [125, 48.706]
  - - [2, 6, 1, 1024]
    - [5, 0.001]
  - - [30522, 462, 1, 1024]
    - [125, 49.956]
  - - [2, 9, 1, 1024]
    - [25, 0.002]
  - - [30522, 180, 1, 1024]
    - [125, 37.155]
  - - [2, 32, 1, 1024]
    - [25, 0.007]
  - - [4, 4, 32768, 64]
    - [129, 0.678]
  - - [4, 4, 38400, 64]
    - [129, 0.7]
  - - [14, 14, 10880, 64]
    - [127, 2.777]
  - - [15, 14, 10880, 64]
    - [136, 2.875]
  - - [15, 15, 7680, 64]
    - [127, 2.782]
  - - [15, 15, 10880, 64]
    - [136, 2.98]
  - - [17, 15, 7680, 64]
    - [183, 2.137]
  - - [17, 17, 6144, 64]
    - [17, 2.55]
  - - [17, 17, 7680, 64]
    - [17, 2.702]
  - - [21, 17, 6144, 64]
    - [183, 3.006]
  - - [21, 21, 6144, 64]
    - [183, 3.438]
  - - [30, 30, 2048, 64]
    - [17, 3.355]
  - - [30, 31, 2048, 64]
    - [132, 3.467]
  - - [31, 31, 2048, 64]
    - [54, 3.54]
  - - [34, 24, 4736, 64]
    - [38, 3.733]
  - - [34, 34, 4736, 64]
    - [127, 3.858]
  - - [35, 35, 4608, 64]
    - [129, 3.794]
  - - [2, 2048, 1, 1024]
    - [7, 0.347]
  - - [2, 1024, 1, 1024]
    - [5, 0.175]
  - - [5, 5, 1, 64]
    - [146, 0.0]
  - - [33, 33, 1, 32]
    - [136, 0.006]
  - - [3, 3, 512, 64]
    - [128, 0.039]
  - - [5, 5, 512, 64]
    - [26, 0.105]
  - - [5, 5, 960, 64]
    - [129, 0.189]
  - - [9, 9, 512, 64]
    - [128, 0.34]
  - - [27, 27, 32768, 128]
    - [38, 6.297]
  - - [33, 33, 1600, 32]
    - [129, 2.192]
  - - [684, 8976, 1, 256]
    - [165, 22.947]
  - - [44505, 8976, 1, 256]
    - [125, 33.341]
  - - [2, 2, 1, 2048]
    - [5, 0.001]
  - - [2, 16, 1, 1024]
    - [25, 0.003]
  - - [2, 4, 1, 2560]
    - [25, 0.001]
  - - [2, 64, 1, 1024]
    - [139, 0.011]
  - - [2, 80, 1, 1024]
    - [5, 0.015]
  - - [2, 82, 1, 1024]
    - [7, 0.014]
  - - [2, 12, 1, 1024]
    - [25, 0.003]
  - - [1, 4096, 1, 256]
    - [26, 0.114]
  - - [1, 6912, 1, 256]
    - [26, 0.184]
  - - [26, 26, 6272, 64]
    - [183, 4.063]
  - - [147, 64, 1, 12544]
    - [1, 4.314]
  - - [2, 128, 1, 1024]
    - [139, 0.024]
  - - [2, 96, 1, 1024]
    - [4, 0.019]
  - - [2, 2048, 1, 768]
    - [5, 0.283]
  - - [2, 4608, 1, 768]
    - [29, 0.586]
  - - [2, 4608, 1, 1024]
    - [5, 0.712]
- null
