library/src/blas3/Tensile/Logic/asm_full/arcturus/arcturus_Cijk_Alik_Bjlk_HSS_BH.yaml
- {MinimumRequiredVersion: 4.23.0}
- arcturus
- gfx908
- [Device 7380, Device 7388, Device 738c, Device 7390]
    SolutionIndex: 0
    SolutionNameMin: Cijk_Alik_Bjlk_HSS_BH_MT16x16x8_SE_AF0EM2_AMAS3_ASEM2_EPS1_GRVW2_ISA908_KLA_LRVW2_MAC_NLCA1_PGR1_PLR1_TT2_2_VW2_WG8_8_1_WGM4
    SolutionIndex: 1
    SolutionNameMin: Cijk_Alik_Bjlk_HSS_BH_MT16x16x16_SE_AF0EM2_AMAS3_ASEM2_EPS1_GRVW2_ISA908_KLA_LRVW2_MAC_NLCA1_PGR1_PLR1_TT2_2_VW2_WG8_8_1_WGM4
    SolutionIndex: 2
    SolutionNameMin: Cijk_Alik_Bjlk_HSS_BH_MT16x16x16_SE_AF0EM2_AMAS3_ASEM2_EPS1_GRVW2_ISA908_KLA_LRVW2_MAC_NLCA1_PGR1_PLR1_TT2_2_VW2_WG8_8_1_WGM1
    SolutionIndex: 3
    SolutionNameMin: Cijk_Alik_Bjlk_HSS_BH_MT16x32x16_SE_AF0EM2_AMAS3_ASEM2_EPS1_GRVW2_ISA908_KLA_LRVW2_MAC_NLCA1_PGR1_PLR1_TT2_2_VW2_WG8_16_1_WGM1
    SolutionIndex: 4
    SolutionNameMin: Cijk_Alik_Bjlk_HSS_BH_MT16x64x16_SE_AF0EM2_AMAS3_ASEM2_EPS1_GRVW2_ISA908_KLA_LRVW2_MAC_NLCA1_PGR1_PLR1_TT2_4_VW2_WG8_16_1_WGM1
    SolutionIndex: 5
    SolutionNameMin: Cijk_Alik_Bjlk_HSS_BH_MT16x64x16_SE_AF0EM2_AMAS3_ASEM2_EPS1_GRVW2_ISA908_KLA_LRVW2_MAC_NLCA1_PGR1_PLR1_TT2_4_VW2_WG8_16_1_WGM4
    SolutionIndex: 6
    SolutionNameMin: Cijk_Alik_Bjlk_HSS_BH_MT16x64x32_SE_AF0EM2_AMAS3_ASEM2_EPS1_GRVW2_ISA908_KLA_LRVW2_MAC_NLCA1_PGR1_PLR1_TT2_2_VW2_WG8_32_1_WGM4
    SolutionIndex: 7
    SolutionNameMin: Cijk_Alik_Bjlk_HSS_BH_MT16x32x16_SE_AF0EM2_AMAS3_ASEM2_EPS1_GRVW2_ISA908_KLA_LRVW2_MAC_NLCA1_PGR1_PLR1_TT2_4_VW2_WG8_8_1_WGM1
    SolutionIndex: 8
    SolutionNameMin: Cijk_Alik_Bjlk_HSS_BH_MT8x64x32_SE_AF0EM2_AMAS3_ASEM2_EPS1_GRVW2_ISA908_KLA_LRVW2_MAC_NLCA1_PGR1_PLR1_TT2_2_VW2_WG4_32_1_WGM1
    SolutionIndex: 9
    SolutionNameMin: Cijk_Alik_Bjlk_HSS_BH_MT16x16x24_SE_AF0EM2_AMAS3_ASEM2_EPS1_GRVW2_ISA908_KLA_LRVW2_MAC_NLCA3_PGR1_PLR1_TT2_2_VW2_WG8_8_1_WGM1
    SolutionIndex: 10
    SolutionNameMin: Cijk_Alik_Bjlk_HSS_BH_MT16x32x32_SE_AF0EM2_AMAS3_ASEM2_EPS1_GRVW2_ISA908_KLA_LRVW2_MAC_NLCA1_PGR1_PLR1_TT2_2_VW2_WG8_16_1_WGM4
    SolutionIndex: 11
    SolutionNameMin: Cijk_Alik_Bjlk_HSS_BH_MT8x64x32_SE_AF0EM2_AMAS3_ASEM2_EPS1_GRVW2_ISA908_KLA_LRVW2_MAC_NLCA1_PGR1_PLR1_TT2_2_VW2_WG4_32_1_WGM4
    SolutionIndex: 12
    SolutionNameMin: Cijk_Alik_Bjlk_HSS_BH_MT16x64x32_SE_AF0EM2_AMAS3_ASEM2_EPS1_GRVW2_ISA908_KLA_LRVW2_MAC_NLCA1_PGR1_PLR1_TT2_2_VW2_WG8_32_1_WGM1
    SolutionIndex: 13
    SolutionNameMin: Cijk_Alik_Bjlk_HSS_BH_MT16x32x24_SE_AF0EM2_AMAS3_ASEM2_EPS1_GRVW2_ISA908_KLA_LRVW2_MAC_NLCA3_PGR1_PLR1_TT2_4_VW2_WG8_8_1_WGM1
    SolutionIndex: 14
    SolutionNameMin: Cijk_Alik_Bjlk_HSS_BH_MT32x64x16_SE_AF0EM2_AMAS3_ASEM2_EPS1_GRVW2_ISA908_KLA_LRVW2_MAC_NLCA1_PGR1_PLR1_TT2_4_VW2_WG16_16_1_WGM4
    SolutionIndex: 15
    SolutionNameMin: Cijk_Alik_Bjlk_HSS_BH_MT64x64x16_SE_AF0EM2_AMAS3_ASEM2_EPS1_GRVW4_ISA908_KLA_LRVW4_MAC_NLCA1_PGR1_PLR1_TT4_4_VW4_WG16_16_1_WGM1
    SolutionIndex: 16
    SolutionNameMin: Cijk_Alik_Bjlk_HSS_BH_MT64x64x16_SE_AF0EM2_AMAS3_ASEM2_EPS1_GRVW4_ISA908_KLA_LRVW4_MAC_NLCA1_PGR1_PLR1_TT4_4_VW4_WG16_16_1_WGM4
    SolutionIndex: 17
    SolutionNameMin: Cijk_Alik_Bjlk_HSS_BH_MT32x32x16_SE_AF0EM2_AMAS3_ASEM2_EPS1_GRVW4_ISA908_KLA_LRVW4_MAC_NLCA1_PGR1_PLR1_TT4_4_VW4_WG8_8_1_WGM1
    SolutionIndex: 18
    SolutionNameMin: Cijk_Alik_Bjlk_HSS_BH_MT16x32x8_SE_AF0EM2_AMAS3_ASEM2_EPS1_GRVW2_ISA908_KLA_LRVW2_MAC_NLCA1_PGR1_PLR1_TT2_4_VW2_WG8_8_1_WGM1
    SolutionIndex: 19
    SolutionNameMin: Cijk_Alik_Bjlk_HSS_BH_MT32x32x16_SE_AF0EM2_AMAS3_ASEM2_EPS1_GRVW4_ISA908_KLA_LRVW4_MAC_NLCA1_PGR1_PLR1_TT4_4_VW4_WG8_8_1_WGM4
    SolutionIndex: 20
    SolutionNameMin: Cijk_Alik_Bjlk_HSS_BH_MT64x128x16_SE_AF0EM2_AMAS3_ASEM2_EPS1_GRVW4_ISA908_KLA_LRVW4_MAC_NLCA1_PGR1_PLR1_TT4_8_VW4_WG16_16_1_WGM4
    SolutionIndex: 21
    SolutionNameMin: Cijk_Alik_Bjlk_HSS_BH_MT64x64x16_SE_AF0EM1_AMAS0_ASEM1_EPS0_GRVW1_ISA000_KLS_LRVW1_FMA_NLCA1_PGR1_PLR0_TT4_4_VW1_WG16_16_1_WGM8
    SolutionIndex: 22
    SolutionNameMin: Cijk_Alik_Bjlk_HSS_BH_MT16x16x32_SE_AF0EM2_AMAS3_ASEM2_EPS1_GRVW2_ISA908_KLA_LRVW2_MAC_NLCA1_PGR1_PLR1_TT2_2_VW2_WG8_8_1_WGM4
    SolutionIndex: 23
    SolutionNameMin: Cijk_Alik_Bjlk_HSS_BH_MT16x16x32_SE_AF0EM2_AMAS3_ASEM2_EPS1_GRVW2_ISA908_KLA_LRVW2_MAC_NLCA1_PGR1_PLR1_TT2_2_VW2_WG8_8_1_WGM1
    SolutionIndex: 24
    SolutionNameMin: Cijk_Alik_Bjlk_HSS_BH_MT8x64x64_SE_AF0EM2_AMAS3_ASEM2_EPS1_GRVW2_ISA908_KLA_LRVW2_MAC_NLCA1_PGR1_PLR1_TT2_2_VW2_WG4_32_1_WGM4
    SolutionIndex: 25
    SolutionNameMin: Cijk_Alik_Bjlk_HSS_BH_MT64x64x8_SE_AF0EM1_AMAS0_ASEM1_EPS0_GRVW1_ISA000_KLS_LRVW1_FMA_NLCA1_PGR1_PLR1_TT4_4_VW1_WG16_16_1_WGM8
    SolutionIndex: 26
    SolutionNameMin: Cijk_Alik_Bjlk_HSS_BH_MT64x64x16_SE_AF0EM1_AMAS0_ASEM1_EPS0_GRVW1_ISA000_KLS_LRVW1_FMA_NLCA1_PGR1_PLR1_TT4_4_VW1_WG16_16_1_WGM8
    SolutionIndex: 27
    SolutionNameMin: Cijk_Alik_Bjlk_HSS_BH_MT64x64x4_SE_AF0EM1_AMAS0_ASEM1_EPS0_GRVW1_ISA000_KLS_LRVW1_FMA_NLCA1_PGR1_PLR0_TT4_4_VW1_WG16_16_1_WGM8
    SolutionIndex: 28
    SolutionNameMin: Cijk_Alik_Bjlk_HSS_BH_MT64x64x8_SE_AF0EM1_AMAS2_ASEM1_EPS0_GRVW2_ISA000_KLS_LRVW2_FMA_NLCA1_PGR0_PLR1_TT4_4_VW2_WG16_16_1_WGM8
    SolutionIndex: 29
    SolutionNameMin: Cijk_Alik_Bjlk_HSS_BH_MT64x64x8_SE_AF0EM1_AMAS0_ASEM1_EPS0_GRVW1_ISA000_KLS_LRVW1_FMA_NLCA1_PGR1_PLR0_TT4_4_VW1_WG16_16_1_WGM8
    SolutionIndex: 30
    SolutionNameMin: Cijk_Alik_Bjlk_HSS_BH_MT64x64x16_SE_AF0EM1_AMAS2_ASEM1_EPS0_GRVW2_ISA000_KLS_LRVW2_FMA_NLCA1_PGR1_PLR1_TT4_4_VW2_WG16_16_1_WGM8
    SolutionIndex: 31
    SolutionNameMin: Cijk_Alik_Bjlk_HSS_BH_MT64x64x16_SE_AF0EM1_AMAS2_ASEM1_EPS0_GRVW2_ISA000_KLS_LRVW2_FMA_NLCA1_PGR0_PLR1_TT4_4_VW2_WG16_16_1_WGM8
    SolutionIndex: 32
    SolutionNameMin: Cijk_Alik_Bjlk_HSS_BH_MT64x64x16_SE_AF0EM1_AMAS2_ASEM1_EPS0_GRVW2_ISA000_KLS_LRVW2_FMA_NLCA1_PGR1_PLR0_TT4_4_VW2_WG16_16_1_WGM8
    SolutionIndex: 33
    SolutionNameMin: Cijk_Alik_Bjlk_HSS_BH_MT64x64x4_SE_AF0EM1_AMAS2_ASEM1_EPS0_GRVW2_ISA000_KLS_LRVW2_FMA_NLCA1_PGR0_PLR1_TT4_4_VW2_WG16_16_1_WGM8
    SolutionIndex: 34
    SolutionNameMin: Cijk_Alik_Bjlk_HSS_BH_MT64x64x4_SE_AF0EM1_AMAS0_ASEM1_EPS0_GRVW1_ISA000_KLS_LRVW1_FMA_NLCA1_PGR1_PLR1_TT4_4_VW1_WG16_16_1_WGM8
    SolutionIndex: 35
    SolutionNameMin: Cijk_Alik_Bjlk_HSS_BH_MT64x64x4_SE_AF0EM1_AMAS2_ASEM1_EPS0_GRVW2_ISA000_KLS_LRVW2_FMA_NLCA1_PGR0_PLR0_TT4_4_VW2_WG16_16_1_WGM8
    SolutionIndex: 36
    SolutionNameMin: Cijk_Alik_Bjlk_HSS_BH_MT64x64x8_SE_AF0EM1_AMAS0_ASEM1_EPS0_GRVW1_ISA000_KLS_LRVW1_FMA_NLCA1_PGR0_PLR1_TT4_4_VW1_WG16_16_1_WGM8
    SolutionIndex: 37
    SolutionNameMin: Cijk_Alik_Bjlk_HSS_BH_MT64x64x4_SE_AF0EM1_AMAS0_ASEM1_EPS0_GRVW1_ISA000_KLS_LRVW1_FMA_NLCA1_PGR0_PLR1_TT4_4_VW1_WG16_16_1_WGM8
    SolutionIndex: 38
    SolutionNameMin: Cijk_Alik_Bjlk_HSS_BH_MT64x64x4_SE_AF0EM1_AMAS0_ASEM1_EPS0_GRVW1_ISA000_KLS_LRVW1_FMA_NLCA1_PGR0_PLR0_TT4_4_VW1_WG16_16_1_WGM8
    SolutionIndex: 39
    SolutionNameMin: Cijk_Alik_Bjlk_HSS_BH_MT64x64x16_SE_AF0EM1_AMAS2_ASEM1_EPS0_GRVW2_ISA000_KLS_LRVW2_FMA_NLCA1_PGR0_PLR0_TT4_4_VW2_WG16_16_1_WGM8
    SolutionIndex: 40
    SolutionNameMin: Cijk_Alik_Bjlk_HSS_BH_MT64x64x8_SE_AF0EM1_AMAS0_ASEM1_EPS0_GRVW1_ISA000_KLS_LRVW1_FMA_NLCA1_PGR0_PLR0_TT4_4_VW1_WG16_16_1_WGM8
- - - [64, 64, 1, 256]
    - [0, 0.049]
  - - [128, 64, 1, 256]
    - [1, 0.107]
  - - [64, 128, 1, 256]
    - [2, 0.103]
  - - [128, 128, 1, 256]
    - [2, 0.207]
  - - [64, 256, 1, 256]
    - [1, 0.208]
  - - [128, 256, 1, 256]
    - [1, 0.401]
  - - [64, 448, 1, 256]
    - [2, 0.345]
  - - [128, 448, 1, 256]
    - [1, 0.694]
  - - [64, 704, 1, 256]
    - [1, 0.542]
  - - [128, 704, 1, 256]
    - [1, 1.079]
  - - [64, 1024, 1, 256]
    - [2, 0.801]
  - - [128, 1024, 1, 256]
    - [2, 1.547]
  - - [64, 1408, 1, 256]
    - [1, 1.085]
  - - [128, 1408, 1, 256]
    - [1, 2.096]
  - - [64, 1856, 1, 256]
    - [1, 1.402]
  - - [128, 1856, 1, 256]
    - [3, 2.685]
  - - [64, 2368, 1, 256]
    - [1, 1.771]
  - - [128, 2368, 1, 256]
    - [2, 3.271]
  - - [64, 2944, 1, 256]
    - [1, 2.181]
  - - [128, 2944, 1, 256]
    - [3, 3.655]
  - - [64, 3584, 1, 256]
    - [1, 2.568]
  - - [128, 3584, 1, 256]
    - [2, 4.163]
  - - [64, 4288, 1, 256]
    - [1, 3.044]
  - - [128, 4288, 1, 256]
    - [3, 4.834]
  - - [64, 5056, 1, 256]
    - [0, 3.415]
  - - [128, 5056, 1, 256]
    - [3, 5.256]
  - - [64, 5888, 1, 256]
    - [3, 3.7]
  - - [128, 5888, 1, 256]
    - [3, 5.556]
  - - [64, 6784, 1, 256]
    - [0, 4.016]
  - - [128, 6784, 1, 256]
    - [3, 5.844]
  - - [64, 64, 1, 1280]
    - [1, 0.092]
  - - [128, 64, 1, 1280]
    - [1, 0.189]
  - - [64, 128, 1, 1280]
    - [1, 0.183]
  - - [128, 128, 1, 1280]
    - [2, 0.367]
  - - [64, 256, 1, 1280]
    - [1, 0.371]
  - - [128, 256, 1, 1280]
    - [1, 0.742]
  - - [64, 448, 1, 1280]
    - [1, 0.646]
  - - [128, 448, 1, 1280]
    - [1, 1.284]
  - - [64, 704, 1, 1280]
    - [2, 1.007]
  - - [128, 704, 1, 1280]
    - [3, 1.988]
  - - [64, 1024, 1, 1280]
    - [2, 1.454]
  - - [128, 1024, 1, 1280]
    - [1, 2.755]
  - - [64, 1408, 1, 1280]
    - [2, 1.977]
  - - [128, 1408, 1, 1280]
    - [3, 3.755]
  - - [64, 1856, 1, 1280]
    - [2, 2.606]
  - - [128, 1856, 1, 1280]
    - [1, 4.658]
  - - [64, 2368, 1, 1280]
    - [3, 3.163]
  - - [128, 2368, 1, 1280]
    - [3, 5.379]
  - - [64, 2944, 1, 1280]
    - [1, 3.743]
  - - [128, 2944, 1, 1280]
    - [3, 5.478]
  - - [64, 3584, 1, 1280]
    - [2, 4.446]
  - - [128, 3584, 1, 1280]
    - [4, 6.511]
  - - [64, 4288, 1, 1280]
    - [3, 4.899]
  - - [128, 4288, 1, 1280]
    - [5, 6.555]
  - - [64, 5056, 1, 1280]
    - [6, 5.21]
  - - [128, 5056, 1, 1280]
    - [7, 7.06]
  - - [64, 5888, 1, 1280]
    - [4, 5.491]
  - - [128, 5888, 1, 1280]
    - [4, 7.31]
  - - [64, 6784, 1, 1280]
    - [4, 6.177]
  - - [128, 6784, 1, 1280]
    - [4, 8.014]
  - - [64, 64, 1, 3328]
    - [8, 0.106]
  - - [128, 64, 1, 3328]
    - [9, 0.214]
  - - [64, 128, 1, 3328]
    - [10, 0.212]
  - - [128, 128, 1, 3328]
    - [11, 0.423]
  - - [64, 256, 1, 3328]
    - [1, 0.424]
  - - [128, 256, 1, 3328]
    - [1, 0.85]
  - - [64, 448, 1, 3328]
    - [1, 0.742]
  - - [128, 448, 1, 3328]
    - [1, 1.483]
  - - [64, 704, 1, 3328]
    - [8, 1.166]
  - - [128, 704, 1, 3328]
    - [11, 2.3]
  - - [64, 1024, 1, 3328]
    - [8, 1.695]
  - - [128, 1024, 1, 3328]
    - [11, 3.192]
  - - [64, 1408, 1, 3328]
    - [9, 2.306]
  - - [128, 1408, 1, 3328]
    - [11, 4.341]
  - - [64, 1856, 1, 3328]
    - [8, 3.02]
  - - [128, 1856, 1, 3328]
    - [6, 5.255]
  - - [64, 2368, 1, 3328]
    - [11, 3.688]
  - - [128, 2368, 1, 3328]
    - [11, 5.922]
  - - [64, 2944, 1, 3328]
    - [12, 4.204]
  - - [128, 2944, 1, 3328]
    - [4, 5.957]
  - - [64, 3584, 1, 3328]
    - [11, 5.18]
  - - [128, 3584, 1, 3328]
    - [4, 7.194]
  - - [64, 4288, 1, 3328]
    - [11, 5.444]
  - - [128, 4288, 1, 3328]
    - [5, 7.061]
  - - [64, 5056, 1, 3328]
    - [6, 5.792]
  - - [128, 5056, 1, 3328]
    - [7, 7.558]
  - - [64, 5888, 1, 3328]
    - [13, 5.967]
  - - [128, 5888, 1, 3328]
    - [4, 7.798]
  - - [64, 6784, 1, 3328]
    - [13, 6.833]
  - - [128, 6784, 1, 3328]
    - [4, 8.588]
  - - [256, 64, 1, 256]
    - [0, 0.2]
  - - [448, 64, 1, 256]
    - [1, 0.347]
  - - [704, 64, 1, 256]
    - [1, 0.54]
  - - [1024, 64, 1, 256]
    - [2, 0.789]
  - - [1408, 64, 1, 256]
    - [1, 1.074]
  - - [1856, 64, 1, 256]
    - [1, 1.395]
  - - [2368, 64, 1, 256]
    - [1, 1.763]
  - - [2944, 64, 1, 256]
    - [3, 2.15]
  - - [3584, 64, 1, 256]
    - [1, 2.617]
  - - [4288, 64, 1, 256]
    - [1, 3.044]
  - - [5056, 64, 1, 256]
    - [3, 3.508]
  - - [5888, 64, 1, 256]
    - [3, 3.793]
  - - [6784, 64, 1, 256]
    - [3, 4.079]
  - - [256, 128, 1, 256]
    - [1, 0.396]
  - - [448, 128, 1, 256]
    - [0, 0.673]
  - - [704, 128, 1, 256]
    - [1, 1.069]
  - - [1024, 128, 1, 256]
    - [1, 1.517]
  - - [1408, 128, 1, 256]
    - [1, 2.076]
  - - [1856, 128, 1, 256]
    - [2, 2.623]
  - - [2368, 128, 1, 256]
    - [3, 3.213]
  - - [2944, 128, 1, 256]
    - [3, 3.597]
  - - [3584, 128, 1, 256]
    - [3, 4.243]
  - - [4288, 128, 1, 256]
    - [3, 4.696]
  - - [5056, 128, 1, 256]
    - [3, 4.922]
  - - [5888, 128, 1, 256]
    - [3, 5.455]
  - - [6784, 128, 1, 256]
    - [3, 5.715]
  - - [256, 64, 1, 1280]
    - [1, 0.37]
  - - [448, 64, 1, 1280]
    - [1, 0.642]
  - - [704, 64, 1, 1280]
    - [1, 1.011]
  - - [1024, 64, 1, 1280]
    - [1, 1.448]
  - - [1408, 64, 1, 1280]
    - [1, 1.977]
  - - [1856, 64, 1, 1280]
    - [3, 2.582]
  - - [2368, 64, 1, 1280]
    - [3, 3.146]
  - - [2944, 64, 1, 1280]
    - [2, 3.7]
  - - [3584, 64, 1, 1280]
    - [12, 4.453]
  - - [4288, 64, 1, 1280]
    - [3, 4.921]
  - - [5056, 64, 1, 1280]
    - [12, 5.245]
  - - [5888, 64, 1, 1280]
    - [3, 5.412]
  - - [6784, 64, 1, 1280]
    - [4, 6.214]
  - - [256, 128, 1, 1280]
    - [1, 0.739]
  - - [448, 128, 1, 1280]
    - [1, 1.286]
  - - [704, 128, 1, 1280]
    - [2, 1.995]
  - - [1024, 128, 1, 1280]
    - [1, 2.75]
  - - [1408, 128, 1, 1280]
    - [3, 3.722]
  - - [1856, 128, 1, 1280]
    - [6, 4.62]
  - - [2368, 128, 1, 1280]
    - [3, 5.379]
  - - [2944, 128, 1, 1280]
    - [3, 5.425]
  - - [3584, 128, 1, 1280]
    - [4, 6.488]
  - - [4288, 128, 1, 1280]
    - [5, 6.575]
  - - [5056, 128, 1, 1280]
    - [7, 7.067]
  - - [5888, 128, 1, 1280]
    - [4, 7.364]
  - - [6784, 128, 1, 1280]
    - [4, 8.12]
  - - [256, 64, 1, 3328]
    - [8, 0.424]
  - - [448, 64, 1, 3328]
    - [1, 0.745]
  - - [704, 64, 1, 3328]
    - [9, 1.16]
  - - [1024, 64, 1, 3328]
    - [8, 1.685]
  - - [1408, 64, 1, 3328]
    - [8, 2.287]
  - - [1856, 64, 1, 3328]
    - [8, 3.013]
  - - [2368, 64, 1, 3328]
    - [11, 3.676]
  - - [2944, 64, 1, 3328]
    - [12, 4.186]
  - - [3584, 64, 1, 3328]
    - [12, 5.077]
  - - [4288, 64, 1, 3328]
    - [8, 5.444]
  - - [5056, 64, 1, 3328]
    - [12, 5.819]
  - - [5888, 64, 1, 3328]
    - [4, 5.967]
  - - [6784, 64, 1, 3328]
    - [4, 6.788]
  - - [256, 128, 1, 3328]
    - [1, 0.848]
  - - [448, 128, 1, 3328]
    - [8, 1.478]
  - - [704, 128, 1, 3328]
    - [9, 2.306]
  - - [1024, 128, 1, 3328]
    - [11, 3.209]
  - - [1408, 128, 1, 3328]
    - [11, 4.351]
  - - [1856, 128, 1, 3328]
    - [12, 5.251]
  - - [2368, 128, 1, 3328]
    - [11, 6.024]
  - - [2944, 128, 1, 3328]
    - [4, 5.939]
  - - [3584, 128, 1, 3328]
    - [4, 7.187]
  - - [4288, 128, 1, 3328]
    - [5, 7.09]
  - - [5056, 128, 1, 3328]
    - [14, 7.217]
  - - [5888, 128, 1, 3328]
    - [4, 7.829]
  - - [6784, 128, 1, 3328]
    - [4, 8.66]
  - - [256, 256, 1, 256]
    - [1, 0.793]
  - - [448, 256, 1, 256]
    - [2, 1.367]
  - - [256, 448, 1, 256]
    - [2, 1.374]
  - - [448, 448, 1, 256]
    - [1, 2.323]
  - - [256, 256, 1, 1280]
    - [3, 1.446]
  - - [448, 256, 1, 1280]
    - [2, 2.521]
  - - [256, 448, 1, 1280]
    - [2, 2.502]
  - - [448, 448, 1, 1280]
    - [2, 3.922]
  - - [256, 256, 1, 3328]
    - [11, 1.692]
  - - [448, 256, 1, 3328]
    - [8, 2.921]
  - - [256, 448, 1, 3328]
    - [8, 2.911]
  - - [448, 448, 1, 3328]
    - [6, 4.459]
  - - [704, 256, 1, 256]
    - [2, 2.066]
  - - [1024, 256, 1, 256]
    - [1, 2.855]
  - - [1408, 256, 1, 256]
    - [3, 3.755]
  - - [1856, 256, 1, 256]
    - [3, 4.295]
  - - [2368, 256, 1, 256]
    - [3, 4.874]
  - - [2944, 256, 1, 256]
    - [3, 5.539]
  - - [3584, 256, 1, 256]
    - [14, 5.973]
  - - [4288, 256, 1, 256]
    - [5, 6.383]
  - - [5056, 256, 1, 256]
    - [14, 6.712]
  - - [5888, 256, 1, 256]
    - [14, 6.958]
  - - [6784, 256, 1, 256]
    - [15, 7.579]
  - - [704, 448, 1, 256]
    - [3, 3.329]
  - - [1024, 448, 1, 256]
    - [3, 4.086]
  - - [1408, 448, 1, 256]
    - [3, 4.906]
  - - [1856, 448, 1, 256]
    - [3, 5.564]
  - - [2368, 448, 1, 256]
    - [5, 6.245]
  - - [2944, 448, 1, 256]
    - [15, 6.752]
  - - [3584, 448, 1, 256]
    - [14, 7.383]
  - - [4288, 448, 1, 256]
    - [15, 8.175]
  - - [5056, 448, 1, 256]
    - [15, 8.148]
  - - [5888, 448, 1, 256]
    - [14, 8.598]
  - - [6784, 448, 1, 256]
    - [15, 8.815]
  - - [256, 704, 1, 256]
    - [2, 2.076]
  - - [448, 704, 1, 256]
    - [3, 3.271]
  - - [704, 704, 1, 256]
    - [3, 4.333]
  - - [1024, 704, 1, 256]
    - [3, 5.431]
  - - [1408, 704, 1, 256]
    - [5, 5.878]
  - - [1856, 704, 1, 256]
    - [14, 6.776]
  - - [2368, 704, 1, 256]
    - [14, 7.71]
  - - [2944, 704, 1, 256]
    - [15, 7.512]
  - - [3584, 704, 1, 256]
    - [14, 8.303]
  - - [4288, 704, 1, 256]
    - [15, 8.724]
  - - [5056, 704, 1, 256]
    - [14, 9.024]
  - - [5888, 704, 1, 256]
    - [15, 9.494]
  - - [6784, 704, 1, 256]
    - [16, 10.081]
  - - [256, 1024, 1, 256]
    - [2, 2.935]
  - - [448, 1024, 1, 256]
    - [3, 4.132]
  - - [704, 1024, 1, 256]
    - [3, 5.298]
  - - [1024, 1024, 1, 256]
    - [5, 6.039]
  - - [1408, 1024, 1, 256]
    - [16, 7.334]
  - - [1856, 1024, 1, 256]
    - [16, 8.102]
  - - [2368, 1024, 1, 256]
    - [16, 8.556]
  - - [2944, 1024, 1, 256]
    - [15, 8.733]
  - - [3584, 1024, 1, 256]
    - [14, 9.245]
  - - [4288, 1024, 1, 256]
    - [16, 9.98]
  - - [5056, 1024, 1, 256]
    - [16, 10.076]
  - - [5888, 1024, 1, 256]
    - [16, 10.094]
  - - [6784, 1024, 1, 256]
    - [16, 10.192]
  - - [256, 1408, 1, 256]
    - [3, 3.821]
  - - [448, 1408, 1, 256]
    - [3, 4.875]
  - - [704, 1408, 1, 256]
    - [4, 5.849]
  - - [1024, 1408, 1, 256]
    - [16, 7.272]
  - - [1408, 1408, 1, 256]
    - [14, 7.636]
  - - [1856, 1408, 1, 256]
    - [14, 8.426]
  - - [2368, 1408, 1, 256]
    - [15, 9.67]
  - - [2944, 1408, 1, 256]
    - [15, 9.53]
  - - [3584, 1408, 1, 256]
    - [15, 9.781]
  - - [4288, 1408, 1, 256]
    - [15, 10.094]
  - - [5056, 1408, 1, 256]
    - [15, 10.444]
  - - [5888, 1408, 1, 256]
    - [16, 10.812]
  - - [6784, 1408, 1, 256]
    - [15, 10.723]
  - - [256, 1856, 1, 256]
    - [3, 4.295]
  - - [448, 1856, 1, 256]
    - [3, 5.692]
  - - [704, 1856, 1, 256]
    - [16, 6.761]
  - - [1024, 1856, 1, 256]
    - [15, 8.16]
  - - [1408, 1856, 1, 256]
    - [14, 8.565]
  - - [1856, 1856, 1, 256]
    - [16, 8.912]
  - - [2368, 1856, 1, 256]
    - [16, 10.057]
  - - [2944, 1856, 1, 256]
    - [15, 9.82]
  - - [3584, 1856, 1, 256]
    - [15, 10.382]
  - - [4288, 1856, 1, 256]
    - [16, 10.453]
  - - [5056, 1856, 1, 256]
    - [15, 10.594]
  - - [5888, 1856, 1, 256]
    - [16, 10.81]
  - - [6784, 1856, 1, 256]
    - [15, 11.037]
  - - [256, 2368, 1, 256]
    - [3, 4.841]
  - - [448, 2368, 1, 256]
    - [4, 6.214]
  - - [704, 2368, 1, 256]
    - [14, 7.77]
  - - [1024, 2368, 1, 256]
    - [16, 8.697]
  - - [1408, 2368, 1, 256]
    - [15, 9.659]
  - - [1856, 2368, 1, 256]
    - [15, 10.095]
  - - [2368, 2368, 1, 256]
    - [15, 10.048]
  - - [2944, 2368, 1, 256]
    - [16, 10.278]
  - - [3584, 2368, 1, 256]
    - [15, 10.562]
  - - [4288, 2368, 1, 256]
    - [16, 10.894]
  - - [5056, 2368, 1, 256]
    - [15, 10.898]
  - - [5888, 2368, 1, 256]
    - [16, 11.057]
  - - [6784, 2368, 1, 256]
    - [15, 11.217]
  - - [256, 2944, 1, 256]
    - [3, 5.422]
  - - [448, 2944, 1, 256]
    - [17, 6.766]
  - - [704, 2944, 1, 256]
    - [15, 7.569]
  - - [1024, 2944, 1, 256]
    - [16, 8.743]
  - - [1408, 2944, 1, 256]
    - [15, 9.595]
  - - [1856, 2944, 1, 256]
    - [16, 9.828]
  - - [2368, 2944, 1, 256]
    - [16, 10.284]
  - - [2944, 2944, 1, 256]
    - [15, 10.759]
  - - [3584, 2944, 1, 256]
    - [15, 10.849]
  - - [4288, 2944, 1, 256]
    - [16, 11.078]
  - - [5056, 2944, 1, 256]
    - [16, 11.068]
  - - [5888, 2944, 1, 256]
    - [15, 11.146]
  - - [6784, 2944, 1, 256]
    - [16, 11.306]
  - - [256, 3584, 1, 256]
    - [3, 6.123]
  - - [448, 3584, 1, 256]
    - [14, 7.455]
  - - [704, 3584, 1, 256]
    - [14, 8.258]
  - - [1024, 3584, 1, 256]
    - [14, 9.255]
  - - [1408, 3584, 1, 256]
    - [16, 9.821]
  - - [1856, 3584, 1, 256]
    - [15, 10.389]
  - - [2368, 3584, 1, 256]
    - [16, 10.551]
  - - [2944, 3584, 1, 256]
    - [15, 10.863]
  - - [3584, 3584, 1, 256]
    - [15, 10.905]
  - - [4288, 3584, 1, 256]
    - [16, 11.086]
  - - [5056, 3584, 1, 256]
    - [16, 11.326]
  - - [5888, 3584, 1, 256]
    - [16, 11.417]
  - - [6784, 3584, 1, 256]
    - [16, 11.368]
  - - [256, 4288, 1, 256]
    - [18, 6.591]
  - - [448, 4288, 1, 256]
    - [16, 8.248]
  - - [704, 4288, 1, 256]
    - [15, 8.798]
  - - [1024, 4288, 1, 256]
    - [15, 10.076]
  - - [1408, 4288, 1, 256]
    - [15, 10.094]
  - - [1856, 4288, 1, 256]
    - [15, 10.482]
  - - [2368, 4288, 1, 256]
    - [16, 10.904]
  - - [2944, 4288, 1, 256]
    - [15, 11.082]
  - - [3584, 4288, 1, 256]
    - [16, 11.07]
  - - [4288, 4288, 1, 256]
    - [16, 11.24]
  - - [5056, 4288, 1, 256]
    - [15, 11.252]
  - - [5888, 4288, 1, 256]
    - [16, 11.37]
  - - [6784, 4288, 1, 256]
    - [15, 11.399]
  - - [256, 5056, 1, 256]
    - [18, 6.937]
  - - [448, 5056, 1, 256]
    - [15, 8.31]
  - - [704, 5056, 1, 256]
    - [15, 9.111]
  - - [1024, 5056, 1, 256]
    - [16, 10.068]
  - - [1408, 5056, 1, 256]
    - [15, 10.457]
  - - [1856, 5056, 1, 256]
    - [16, 10.599]
  - - [2368, 5056, 1, 256]
    - [16, 10.931]
  - - [2944, 5056, 1, 256]
    - [15, 11.075]
  - - [3584, 5056, 1, 256]
    - [15, 11.32]
  - - [4288, 5056, 1, 256]
    - [16, 11.262]
  - - [5056, 5056, 1, 256]
    - [15, 11.331]
  - - [5888, 5056, 1, 256]
    - [15, 11.466]
  - - [6784, 5056, 1, 256]
    - [16, 11.54]
  - - [256, 5888, 1, 256]
    - [14, 7.067]
  - - [448, 5888, 1, 256]
    - [14, 8.621]
  - - [704, 5888, 1, 256]
    - [15, 9.595]
  - - [1024, 5888, 1, 256]
    - [15, 10.087]
  - - [1408, 5888, 1, 256]
    - [16, 10.841]
  - - [1856, 5888, 1, 256]
    - [16, 10.818]
  - - [2368, 5888, 1, 256]
    - [15, 11.046]
  - - [2944, 5888, 1, 256]
    - [15, 11.179]
  - - [3584, 5888, 1, 256]
    - [16, 11.425]
  - - [4288, 5888, 1, 256]
    - [15, 11.376]
  - - [5056, 5888, 1, 256]
    - [15, 11.465]
  - - [5888, 5888, 1, 256]
    - [16, 11.518]
  - - [6784, 5888, 1, 256]
    - [15, 11.52]
  - - [256, 6784, 1, 256]
    - [16, 7.662]
  - - [448, 6784, 1, 256]
    - [15, 8.858]
  - - [704, 6784, 1, 256]
    - [16, 10.117]
  - - [1024, 6784, 1, 256]
    - [15, 10.242]
  - - [1408, 6784, 1, 256]
    - [15, 10.744]
  - - [1856, 6784, 1, 256]
    - [15, 11.033]
  - - [2368, 6784, 1, 256]
    - [16, 11.221]
  - - [2944, 6784, 1, 256]
    - [15, 11.33]
  - - [3584, 6784, 1, 256]
    - [16, 11.359]
  - - [4288, 6784, 1, 256]
    - [16, 11.402]
  - - [5056, 6784, 1, 256]
    - [16, 11.548]
  - - [5888, 6784, 1, 256]
    - [16, 11.518]
  - - [6784, 6784, 1, 256]
    - [16, 11.594]
  - - [704, 256, 1, 1280]
    - [11, 3.703]
  - - [1024, 256, 1, 1280]
    - [3, 4.816]
  - - [1408, 256, 1, 1280]
    - [12, 5.803]
  - - [1856, 256, 1, 1280]
    - [4, 6.696]
  - - [2368, 256, 1, 1280]
    - [5, 7.24]
  - - [2944, 256, 1, 1280]
    - [4, 7.364]
  - - [3584, 256, 1, 1280]
    - [4, 8.546]
  - - [4288, 256, 1, 1280]
    - [4, 8.539]
  - - [5056, 256, 1, 1280]
    - [17, 8.839]
  - - [5888, 256, 1, 1280]
    - [14, 8.279]
  - - [6784, 256, 1, 1280]
    - [19, 9.401]
  - - [704, 448, 1, 1280]
    - [3, 5.119]
  - - [1024, 448, 1, 1280]
    - [4, 6.565]
  - - [1408, 448, 1, 1280]
    - [5, 7.279]
  - - [1856, 448, 1, 1280]
    - [4, 8.151]
  - - [2368, 448, 1, 1280]
    - [5, 8.23]
  - - [2944, 448, 1, 1280]
    - [19, 8.987]
  - - [3584, 448, 1, 1280]
    - [14, 8.79]
  - - [4288, 448, 1, 1280]
    - [15, 10.351]
  - - [5056, 448, 1, 1280]
    - [16, 9.795]
  - - [5888, 448, 1, 1280]
    - [16, 9.792]
  - - [6784, 448, 1, 1280]
    - [16, 9.861]
  - - [256, 704, 1, 1280]
    - [3, 3.742]
  - - [448, 704, 1, 1280]
    - [3, 5.359]
  - - [704, 704, 1, 1280]
    - [5, 6.07]
  - - [1024, 704, 1, 1280]
    - [7, 7.683]
  - - [1408, 704, 1, 1280]
    - [5, 7.801]
  - - [1856, 704, 1, 1280]
    - [19, 8.918]
  - - [2368, 704, 1, 1280]
    - [14, 9.131]
  - - [2944, 704, 1, 1280]
    - [14, 9.094]
  - - [3584, 704, 1, 1280]
    - [15, 9.378]
  - - [4288, 704, 1, 1280]
    - [15, 9.816]
  - - [5056, 704, 1, 1280]
    - [15, 10.215]
  - - [5888, 704, 1, 1280]
    - [16, 10.632]
  - - [6784, 704, 1, 1280]
    - [15, 11.085]
  - - [256, 1024, 1, 1280]
    - [3, 4.765]
  - - [448, 1024, 1, 1280]
    - [4, 6.503]
  - - [704, 1024, 1, 1280]
    - [14, 7.562]
  - - [1024, 1024, 1, 1280]
    - [5, 8.156]
  - - [1408, 1024, 1, 1280]
    - [16, 9.791]
  - - [1856, 1024, 1, 1280]
    - [16, 10.241]
  - - [2368, 1024, 1, 1280]
    - [15, 10.467]
  - - [2944, 1024, 1, 1280]
    - [15, 9.8]
  - - [3584, 1024, 1, 1280]
    - [16, 10.515]
  - - [4288, 1024, 1, 1280]
    - [16, 11.224]
  - - [5056, 1024, 1, 1280]
    - [15, 11.002]
  - - [5888, 1024, 1, 1280]
    - [16, 10.928]
  - - [6784, 1024, 1, 1280]
    - [16, 10.974]
  - - [256, 1408, 1, 1280]
    - [12, 5.819]
  - - [448, 1408, 1, 1280]
    - [5, 7.286]
  - - [704, 1408, 1, 1280]
    - [5, 7.781]
  - - [1024, 1408, 1, 1280]
    - [16, 9.796]
  - - [1408, 1408, 1, 1280]
    - [14, 8.74]
  - - [1856, 1408, 1, 1280]
    - [16, 9.697]
  - - [2368, 1408, 1, 1280]
    - [15, 10.826]
  - - [2944, 1408, 1, 1280]
    - [16, 10.617]
  - - [3584, 1408, 1, 1280]
    - [16, 10.714]
  - - [4288, 1408, 1, 1280]
    - [16, 10.938]
  - - [5056, 1408, 1, 1280]
    - [15, 11.247]
  - - [5888, 1408, 1, 1280]
    - [16, 11.603]
  - - [6784, 1408, 1, 1280]
    - [16, 11.442]
  - - [256, 1856, 1, 1280]
    - [4, 6.833]
  - - [448, 1856, 1, 1280]
    - [4, 8.137]
  - - [704, 1856, 1, 1280]
    - [16, 8.908]
  - - [1024, 1856, 1, 1280]
    - [16, 10.246]
  - - [1408, 1856, 1, 1280]
    - [16, 9.706]
  - - [1856, 1856, 1, 1280]
    - [15, 9.91]
  - - [2368, 1856, 1, 1280]
    - [16, 11.244]
  - - [2944, 1856, 1, 1280]
    - [16, 10.711]
  - - [3584, 1856, 1, 1280]
    - [15, 11.227]
  - - [4288, 1856, 1, 1280]
    - [16, 11.147]
  - - [5056, 1856, 1, 1280]
    - [16, 11.237]
  - - [5888, 1856, 1, 1280]
    - [16, 11.422]
  - - [6784, 1856, 1, 1280]
    - [16, 11.677]
  - - [256, 2368, 1, 1280]
    - [4, 7.269]
  - - [448, 2368, 1, 1280]
    - [5, 8.241]
  - - [704, 2368, 1, 1280]
    - [14, 9.143]
  - - [1024, 2368, 1, 1280]
    - [15, 10.437]
  - - [1408, 2368, 1, 1280]
    - [15, 10.812]
  - - [1856, 2368, 1, 1280]
    - [15, 11.23]
  - - [2368, 2368, 1, 1280]
    - [15, 10.974]
  - - [2944, 2368, 1, 1280]
    - [15, 11.028]
  - - [3584, 2368, 1, 1280]
    - [16, 11.258]
  - - [4288, 2368, 1, 1280]
    - [16, 11.581]
  - - [5056, 2368, 1, 1280]
    - [16, 11.531]
  - - [5888, 2368, 1, 1280]
    - [16, 11.608]
  - - [6784, 2368, 1, 1280]
    - [15, 11.78]
  - - [256, 2944, 1, 1280]
    - [4, 7.382]
  - - [448, 2944, 1, 1280]
    - [16, 9.018]
  - - [704, 2944, 1, 1280]
    - [14, 9.104]
  - - [1024, 2944, 1, 1280]
    - [15, 9.813]
  - - [1408, 2944, 1, 1280]
    - [15, 10.623]
  - - [1856, 2944, 1, 1280]
    - [16, 10.698]
  - - [2368, 2944, 1, 1280]
    - [16, 11.03]
  - - [2944, 2944, 1, 1280]
    - [16, 11.49]
  - - [3584, 2944, 1, 1280]
    - [16, 11.511]
  - - [4288, 2944, 1, 1280]
    - [16, 11.7]
  - - [5056, 2944, 1, 1280]
    - [15, 11.613]
  - - [5888, 2944, 1, 1280]
    - [16, 11.679]
  - - [6784, 2944, 1, 1280]
    - [16, 11.838]
  - - [256, 3584, 1, 1280]
    - [4, 8.56]
  - - [448, 3584, 1, 1280]
    - [14, 8.798]
  - - [704, 3584, 1, 1280]
    - [16, 9.383]
  - - [1024, 3584, 1, 1280]
    - [16, 10.532]
  - - [1408, 3584, 1, 1280]
    - [15, 10.739]
  - - [1856, 3584, 1, 1280]
    - [16, 11.24]
  - - [2368, 3584, 1, 1280]
    - [16, 11.277]
  - - [2944, 3584, 1, 1280]
    - [16, 11.519]
  - - [3584, 3584, 1, 1280]
    - [16, 11.489]
  - - [4288, 3584, 1, 1280]
    - [16, 11.627]
  - - [5056, 3584, 1, 1280]
    - [16, 11.873]
  - - [5888, 3584, 1, 1280]
    - [16, 11.939]
  - - [6784, 3584, 1, 1280]
    - [16, 11.862]
  - - [256, 4288, 1, 1280]
    - [4, 8.577]
  - - [448, 4288, 1, 1280]
    - [15, 10.347]
  - - [704, 4288, 1, 1280]
    - [15, 9.813]
  - - [1024, 4288, 1, 1280]
    - [15, 11.234]
  - - [1408, 4288, 1, 1280]
    - [15, 10.964]
  - - [1856, 4288, 1, 1280]
    - [16, 11.158]
  - - [2368, 4288, 1, 1280]
    - [16, 11.582]
  - - [2944, 4288, 1, 1280]
    - [16, 11.697]
  - - [3584, 4288, 1, 1280]
    - [16, 11.637]
  - - [4288, 4288, 1, 1280]
    - [16, 11.749]
  - - [5056, 4288, 1, 1280]
    - [15, 11.734]
  - - [5888, 4288, 1, 1280]
    - [16, 11.862]
  - - [6784, 4288, 1, 1280]
    - [16, 11.848]
  - - [256, 5056, 1, 1280]
    - [15, 8.824]
  - - [448, 5056, 1, 1280]
    - [15, 9.785]
  - - [704, 5056, 1, 1280]
    - [16, 10.217]
  - - [1024, 5056, 1, 1280]
    - [15, 11.014]
  - - [1408, 5056, 1, 1280]
    - [16, 11.256]
  - - [1856, 5056, 1, 1280]
    - [16, 11.253]
  - - [2368, 5056, 1, 1280]
    - [15, 11.538]
  - - [2944, 5056, 1, 1280]
    - [15, 11.629]
  - - [3584, 5056, 1, 1280]
    - [15, 11.888]
  - - [4288, 5056, 1, 1280]
    - [16, 11.739]
  - - [5056, 5056, 1, 1280]
    - [16, 11.781]
  - - [5888, 5056, 1, 1280]
    - [16, 11.932]
  - - [6784, 5056, 1, 1280]
    - [16, 11.981]
  - - [256, 5888, 1, 1280]
    - [14, 8.283]
  - - [448, 5888, 1, 1280]
    - [16, 9.792]
  - - [704, 5888, 1, 1280]
    - [16, 10.626]
  - - [1024, 5888, 1, 1280]
    - [16, 10.943]
  - - [1408, 5888, 1, 1280]
    - [16, 11.613]
  - - [1856, 5888, 1, 1280]
    - [15, 11.44]
  - - [2368, 5888, 1, 1280]
    - [16, 11.63]
  - - [2944, 5888, 1, 1280]
    - [15, 11.692]
  - - [3584, 5888, 1, 1280]
    - [16, 11.945]
  - - [4288, 5888, 1, 1280]
    - [16, 11.844]
  - - [5056, 5888, 1, 1280]
    - [16, 11.934]
  - - [5888, 5888, 1, 1280]
    - [16, 11.944]
  - - [6784, 5888, 1, 1280]
    - [16, 11.937]
  - - [256, 6784, 1, 1280]
    - [16, 9.375]
  - - [448, 6784, 1, 1280]
    - [15, 9.885]
  - - [704, 6784, 1, 1280]
    - [16, 11.113]
  - - [1024, 6784, 1, 1280]
    - [16, 10.987]
  - - [1408, 6784, 1, 1280]
    - [16, 11.448]
  - - [1856, 6784, 1, 1280]
    - [15, 11.686]
  - - [2368, 6784, 1, 1280]
    - [16, 11.807]
  - - [2944, 6784, 1, 1280]
    - [16, 11.86]
  - - [3584, 6784, 1, 1280]
    - [16, 11.862]
  - - [4288, 6784, 1, 1280]
    - [16, 11.858]
  - - [5056, 6784, 1, 1280]
    - [16, 11.99]
  - - [5888, 6784, 1, 1280]
    - [20, 11.963]
  - - [6784, 6784, 1, 1280]
    - [20, 12.01]
  - - [704, 256, 1, 3328]
    - [11, 4.371]
  - - [1024, 256, 1, 3328]
    - [11, 5.368]
  - - [1408, 256, 1, 3328]
    - [6, 6.448]
  - - [1856, 256, 1, 3328]
    - [13, 7.455]
  - - [2368, 256, 1, 3328]
    - [5, 7.808]
  - - [2944, 256, 1, 3328]
    - [4, 7.856]
  - - [3584, 256, 1, 3328]
    - [4, 9.066]
  - - [4288, 256, 1, 3328]
    - [4, 8.976]
  - - [5056, 256, 1, 3328]
    - [16, 9.282]
  - - [5888, 256, 1, 3328]
    - [19, 8.506]
  - - [6784, 256, 1, 3328]
    - [16, 9.754]
  - - [704, 448, 1, 3328]
    - [12, 5.658]
  - - [1024, 448, 1, 3328]
    - [4, 7.245]
  - - [1408, 448, 1, 3328]
    - [5, 7.793]
  - - [1856, 448, 1, 3328]
    - [4, 8.647]
  - - [2368, 448, 1, 3328]
    - [5, 8.629]
  - - [2944, 448, 1, 3328]
    - [16, 9.454]
  - - [3584, 448, 1, 3328]
    - [19, 9.067]
  - - [4288, 448, 1, 3328]
    - [16, 10.734]
  - - [5056, 448, 1, 3328]
    - [16, 10.051]
  - - [5888, 448, 1, 3328]
    - [16, 9.998]
  - - [6784, 448, 1, 3328]
    - [16, 10.044]
  - - [256, 704, 1, 3328]
    - [11, 4.371]
  - - [448, 704, 1, 3328]
    - [3, 5.788]
  - - [704, 704, 1, 3328]
    - [5, 6.543]
  - - [1024, 704, 1, 3328]
    - [7, 8.356]
  - - [1408, 704, 1, 3328]
    - [4, 8.126]
  - - [1856, 704, 1, 3328]
    - [16, 9.364]
  - - [2368, 704, 1, 3328]
    - [19, 9.387]
  - - [2944, 704, 1, 3328]
    - [14, 9.297]
  - - [3584, 704, 1, 3328]
    - [16, 9.566]
  - - [4288, 704, 1, 3328]
    - [15, 9.974]
  - - [5056, 704, 1, 3328]
    - [16, 10.387]
  - - [5888, 704, 1, 3328]
    - [16, 10.778]
  - - [6784, 704, 1, 3328]
    - [15, 11.24]
  - - [256, 1024, 1, 3328]
    - [11, 5.281]
  - - [448, 1024, 1, 3328]
    - [4, 7.212]
  - - [704, 1024, 1, 3328]
    - [7, 8.105]
  - - [1024, 1024, 1, 3328]
    - [5, 8.581]
  - - [1408, 1024, 1, 3328]
    - [16, 10.306]
  - - [1856, 1024, 1, 3328]
    - [15, 10.635]
  - - [2368, 1024, 1, 3328]
    - [15, 10.736]
  - - [2944, 1024, 1, 3328]
    - [15, 9.966]
  - - [3584, 1024, 1, 3328]
    - [16, 10.722]
  - - [4288, 1024, 1, 3328]
    - [16, 11.408]
  - - [5056, 1024, 1, 3328]
    - [16, 11.143]
  - - [5888, 1024, 1, 3328]
    - [16, 11.059]
  - - [6784, 1024, 1, 3328]
    - [16, 11.104]
  - - [256, 1408, 1, 3328]
    - [12, 6.452]
  - - [448, 1408, 1, 3328]
    - [5, 7.768]
  - - [704, 1408, 1, 3328]
    - [5, 8.167]
  - - [1024, 1408, 1, 3328]
    - [16, 10.323]
  - - [1408, 1408, 1, 3328]
    - [14, 8.897]
  - - [1856, 1408, 1, 3328]
    - [16, 9.9]
  - - [2368, 1408, 1, 3328]
    - [15, 11.005]
  - - [2944, 1408, 1, 3328]
    - [15, 10.79]
  - - [3584, 1408, 1, 3328]
    - [15, 10.858]
  - - [4288, 1408, 1, 3328]
    - [16, 11.081]
  - - [5056, 1408, 1, 3328]
    - [16, 11.377]
  - - [5888, 1408, 1, 3328]
    - [16, 11.725]
  - - [6784, 1408, 1, 3328]
    - [16, 11.534]
  - - [256, 1856, 1, 3328]
    - [4, 7.41]
  - - [448, 1856, 1, 3328]
    - [4, 8.606]
  - - [704, 1856, 1, 3328]
    - [17, 9.383]
  - - [1024, 1856, 1, 3328]
    - [15, 10.625]
  - - [1408, 1856, 1, 3328]
    - [16, 9.892]
  - - [1856, 1856, 1, 3328]
    - [16, 10.069]
  - - [2368, 1856, 1, 3328]
    - [16, 11.418]
  - - [2944, 1856, 1, 3328]
    - [16, 10.84]
  - - [3584, 1856, 1, 3328]
    - [16, 11.363]
  - - [4288, 1856, 1, 3328]
    - [16, 11.272]
  - - [5056, 1856, 1, 3328]
    - [16, 11.344]
  - - [5888, 1856, 1, 3328]
    - [16, 11.522]
  - - [6784, 1856, 1, 3328]
    - [16, 11.758]
  - - [256, 2368, 1, 3328]
    - [5, 7.754]
  - - [448, 2368, 1, 3328]
    - [5, 8.658]
  - - [704, 2368, 1, 3328]
    - [19, 9.402]
  - - [1024, 2368, 1, 3328]
    - [15, 10.711]
  - - [1408, 2368, 1, 3328]
    - [15, 10.999]
  - - [1856, 2368, 1, 3328]
    - [16, 11.43]
  - - [2368, 2368, 1, 3328]
    - [15, 11.117]
  - - [2944, 2368, 1, 3328]
    - [15, 11.142]
  - - [3584, 2368, 1, 3328]
    - [15, 11.36]
  - - [4288, 2368, 1, 3328]
    - [16, 11.704]
  - - [5056, 2368, 1, 3328]
    - [16, 11.635]
  - - [5888, 2368, 1, 3328]
    - [16, 11.698]
  - - [6784, 2368, 1, 3328]
    - [16, 11.88]
  - - [256, 2944, 1, 3328]
    - [4, 7.835]
  - - [448, 2944, 1, 3328]
    - [16, 9.46]
  - - [704, 2944, 1, 3328]
    - [14, 9.292]
  - - [1024, 2944, 1, 3328]
    - [16, 9.965]
  - - [1408, 2944, 1, 3328]
    - [16, 10.785]
  - - [1856, 2944, 1, 3328]
    - [16, 10.845]
  - - [2368, 2944, 1, 3328]
    - [16, 11.143]
  - - [2944, 2944, 1, 3328]
    - [16, 11.606]
  - - [3584, 2944, 1, 3328]
    - [16, 11.615]
  - - [4288, 2944, 1, 3328]
    - [15, 11.8]
  - - [5056, 2944, 1, 3328]
    - [16, 11.704]
  - - [5888, 2944, 1, 3328]
    - [16, 11.771]
  - - [6784, 2944, 1, 3328]
    - [16, 11.918]
  - - [256, 3584, 1, 3328]
    - [4, 9.014]
  - - [448, 3584, 1, 3328]
    - [19, 9.087]
  - - [704, 3584, 1, 3328]
    - [16, 9.569]
  - - [1024, 3584, 1, 3328]
    - [16, 10.708]
  - - [1408, 3584, 1, 3328]
    - [15, 10.861]
  - - [1856, 3584, 1, 3328]
    - [16, 11.364]
  - - [2368, 3584, 1, 3328]
    - [16, 11.364]
  - - [2944, 3584, 1, 3328]
    - [16, 11.627]
  - - [3584, 3584, 1, 3328]
    - [15, 11.575]
  - - [4288, 3584, 1, 3328]
    - [16, 11.724]
  - - [5056, 3584, 1, 3328]
    - [16, 11.977]
  - - [5888, 3584, 1, 3328]
    - [16, 12.029]
  - - [6784, 3584, 1, 3328]
    - [16, 11.922]
  - - [256, 4288, 1, 3328]
    - [4, 8.892]
  - - [448, 4288, 1, 3328]
    - [16, 10.743]
  - - [704, 4288, 1, 3328]
    - [16, 9.975]
  - - [1024, 4288, 1, 3328]
    - [15, 11.4]
  - - [1408, 4288, 1, 3328]
    - [15, 11.067]
  - - [1856, 4288, 1, 3328]
    - [16, 11.263]
  - - [2368, 4288, 1, 3328]
    - [15, 11.693]
  - - [2944, 4288, 1, 3328]
    - [15, 11.801]
  - - [3584, 4288, 1, 3328]
    - [16, 11.712]
  - - [4288, 4288, 1, 3328]
    - [16, 11.84]
  - - [5056, 4288, 1, 3328]
    - [16, 11.812]
  - - [5888, 4288, 1, 3328]
    - [16, 11.916]
  - - [6784, 4288, 1, 3328]
    - [16, 11.91]
  - - [256, 5056, 1, 3328]
    - [17, 9.303]
  - - [448, 5056, 1, 3328]
    - [15, 10.043]
  - - [704, 5056, 1, 3328]
    - [16, 10.4]
  - - [1024, 5056, 1, 3328]
    - [16, 11.135]
  - - [1408, 5056, 1, 3328]
    - [15, 11.375]
  - - [1856, 5056, 1, 3328]
    - [16, 11.341]
  - - [2368, 5056, 1, 3328]
    - [15, 11.633]
  - - [2944, 5056, 1, 3328]
    - [15, 11.703]
  - - [3584, 5056, 1, 3328]
    - [16, 11.982]
  - - [4288, 5056, 1, 3328]
    - [16, 11.816]
  - - [5056, 5056, 1, 3328]
    - [15, 11.839]
  - - [5888, 5056, 1, 3328]
    - [16, 11.99]
  - - [6784, 5056, 1, 3328]
    - [16, 12.045]
  - - [256, 5888, 1, 3328]
    - [19, 8.54]
  - - [448, 5888, 1, 3328]
    - [16, 9.997]
  - - [704, 5888, 1, 3328]
    - [15, 10.792]
  - - [1024, 5888, 1, 3328]
    - [16, 11.073]
  - - [1408, 5888, 1, 3328]
    - [15, 11.725]
  - - [1856, 5888, 1, 3328]
    - [16, 11.524]
  - - [2368, 5888, 1, 3328]
    - [16, 11.714]
  - - [2944, 5888, 1, 3328]
    - [15, 11.777]
  - - [3584, 5888, 1, 3328]
    - [16, 12.034]
  - - [4288, 5888, 1, 3328]
    - [16, 11.94]
  - - [5056, 5888, 1, 3328]
    - [16, 11.999]
  - - [5888, 5888, 1, 3328]
    - [16, 12.039]
  - - [6784, 5888, 1, 3328]
    - [16, 11.999]
  - - [256, 6784, 1, 3328]
    - [15, 9.734]
  - - [448, 6784, 1, 3328]
    - [16, 10.047]
  - - [704, 6784, 1, 3328]
    - [16, 11.242]
  - - [1024, 6784, 1, 3328]
    - [15, 11.109]
  - - [1408, 6784, 1, 3328]
    - [16, 11.547]
  - - [1856, 6784, 1, 3328]
    - [16, 11.77]
  - - [2368, 6784, 1, 3328]
    - [15, 11.877]
  - - [2944, 6784, 1, 3328]
    - [15, 11.917]
  - - [3584, 6784, 1, 3328]
    - [16, 11.93]
  - - [4288, 6784, 1, 3328]
    - [20, 11.921]
  - - [5056, 6784, 1, 3328]
    - [16, 12.054]
  - - [5888, 6784, 1, 3328]
    - [20, 12.007]
  - - [6784, 6784, 1, 3328]
    - [20, 12.079]
  - - [1024, 1024, 1, 1024]
    - [5, 8.02]
  - - [32, 32, 1, 32]
    - [21, 0.003]
  - - [32, 64, 1, 256]
    - [2, 0.029]
  - - [32, 128, 1, 256]
    - [22, 0.054]
  - - [32, 256, 1, 256]
    - [1, 0.12]
  - - [32, 448, 1, 256]
    - [2, 0.184]
  - - [32, 704, 1, 256]
    - [1, 0.275]
  - - [32, 1024, 1, 256]
    - [1, 0.394]
  - - [32, 1408, 1, 256]
    - [1, 0.551]
  - - [32, 1856, 1, 256]
    - [2, 0.715]
  - - [32, 2368, 1, 256]
    - [0, 0.89]
  - - [32, 2944, 1, 256]
    - [1, 1.123]
  - - [32, 3584, 1, 256]
    - [2, 1.381]
  - - [32, 4288, 1, 256]
    - [0, 1.604]
  - - [32, 5056, 1, 256]
    - [0, 1.909]
  - - [32, 5888, 1, 256]
    - [1, 2.224]
  - - [32, 6784, 1, 256]
    - [0, 2.562]
  - - [32, 64, 1, 1280]
    - [2, 0.046]
  - - [32, 128, 1, 1280]
    - [22, 0.096]
  - - [32, 256, 1, 1280]
    - [1, 0.195]
  - - [32, 448, 1, 1280]
    - [2, 0.323]
  - - [32, 704, 1, 1280]
    - [1, 0.507]
  - - [32, 1024, 1, 1280]
    - [1, 0.739]
  - - [32, 1408, 1, 1280]
    - [2, 1.005]
  - - [32, 1856, 1, 1280]
    - [1, 1.337]
  - - [32, 2368, 1, 1280]
    - [1, 1.703]
  - - [32, 2944, 1, 1280]
    - [2, 2.082]
  - - [32, 3584, 1, 1280]
    - [2, 2.549]
  - - [32, 4288, 1, 1280]
    - [3, 2.894]
  - - [32, 5056, 1, 1280]
    - [3, 3.365]
  - - [32, 5888, 1, 1280]
    - [2, 3.724]
  - - [32, 6784, 1, 1280]
    - [2, 4.263]
  - - [32, 64, 1, 3328]
    - [11, 0.053]
  - - [32, 128, 1, 3328]
    - [22, 0.11]
  - - [32, 256, 1, 3328]
    - [9, 0.219]
  - - [32, 448, 1, 3328]
    - [1, 0.371]
  - - [32, 704, 1, 3328]
    - [1, 0.586]
  - - [32, 1024, 1, 3328]
    - [8, 0.852]
  - - [32, 1408, 1, 3328]
    - [8, 1.162]
  - - [32, 1856, 1, 3328]
    - [11, 1.535]
  - - [32, 2368, 1, 3328]
    - [1, 1.939]
  - - [32, 2944, 1, 3328]
    - [11, 2.395]
  - - [32, 3584, 1, 3328]
    - [8, 2.902]
  - - [32, 4288, 1, 3328]
    - [8, 3.328]
  - - [32, 5056, 1, 3328]
    - [11, 3.903]
  - - [32, 5888, 1, 3328]
    - [12, 4.183]
  - - [32, 6784, 1, 3328]
    - [6, 4.792]
  - - [64, 32, 1, 256]
    - [2, 0.026]
  - - [128, 32, 1, 256]
    - [9, 0.057]
  - - [256, 32, 1, 256]
    - [9, 0.105]
  - - [448, 32, 1, 256]
    - [2, 0.178]
  - - [704, 32, 1, 256]
    - [0, 0.266]
  - - [1024, 32, 1, 256]
    - [1, 0.387]
  - - [1408, 32, 1, 256]
    - [1, 0.532]
  - - [1856, 32, 1, 256]
    - [3, 0.704]
  - - [2368, 32, 1, 256]
    - [1, 0.908]
  - - [2944, 32, 1, 256]
    - [2, 1.14]
  - - [3584, 32, 1, 256]
    - [1, 1.367]
  - - [4288, 32, 1, 256]
    - [1, 1.58]
  - - [5056, 32, 1, 256]
    - [1, 1.873]
  - - [5888, 32, 1, 256]
    - [1, 2.16]
  - - [6784, 32, 1, 256]
    - [2, 2.453]
  - - [64, 32, 1, 1280]
    - [1, 0.046]
  - - [128, 32, 1, 1280]
    - [9, 0.097]
  - - [256, 32, 1, 1280]
    - [9, 0.192]
  - - [448, 32, 1, 1280]
    - [1, 0.324]
  - - [704, 32, 1, 1280]
    - [1, 0.508]
  - - [1024, 32, 1, 1280]
    - [1, 0.736]
  - - [1408, 32, 1, 1280]
    - [1, 1.018]
  - - [1856, 32, 1, 1280]
    - [1, 1.337]
  - - [2368, 32, 1, 1280]
    - [2, 1.672]
  - - [2944, 32, 1, 1280]
    - [2, 2.067]
  - - [3584, 32, 1, 1280]
    - [2, 2.484]
  - - [4288, 32, 1, 1280]
    - [3, 2.854]
  - - [5056, 32, 1, 1280]
    - [3, 3.341]
  - - [5888, 32, 1, 1280]
    - [2, 3.67]
  - - [6784, 32, 1, 1280]
    - [2, 4.201]
  - - [64, 32, 1, 3328]
    - [22, 0.053]
  - - [128, 32, 1, 3328]
    - [8, 0.109]
  - - [256, 32, 1, 3328]
    - [9, 0.214]
  - - [448, 32, 1, 3328]
    - [1, 0.372]
  - - [704, 32, 1, 3328]
    - [1, 0.588]
  - - [1024, 32, 1, 3328]
    - [1, 0.855]
  - - [1408, 32, 1, 3328]
    - [1, 1.166]
  - - [1856, 32, 1, 3328]
    - [1, 1.529]
  - - [2368, 32, 1, 3328]
    - [2, 1.909]
  - - [2944, 32, 1, 3328]
    - [2, 2.37]
  - - [3584, 32, 1, 3328]
    - [2, 2.867]
  - - [4288, 32, 1, 3328]
    - [9, 3.189]
  - - [5056, 32, 1, 3328]
    - [3, 3.733]
  - - [5888, 32, 1, 3328]
    - [2, 4.0]
  - - [6784, 32, 1, 3328]
    - [3, 4.59]
  - - [64, 64, 1, 32]
    - [0, 0.012]
  - - [128, 64, 1, 32]
    - [9, 0.029]
  - - [256, 64, 1, 32]
    - [2, 0.061]
  - - [448, 64, 1, 32]
    - [1, 0.093]
  - - [704, 64, 1, 32]
    - [0, 0.132]
  - - [1024, 64, 1, 32]
    - [0, 0.185]
  - - [1408, 64, 1, 32]
    - [0, 0.252]
  - - [1856, 64, 1, 32]
    - [0, 0.336]
  - - [2368, 64, 1, 32]
    - [0, 0.413]
  - - [2944, 64, 1, 32]
    - [0, 0.504]
  - - [3584, 64, 1, 32]
    - [0, 0.624]
  - - [4288, 64, 1, 32]
    - [0, 0.747]
  - - [5056, 64, 1, 32]
    - [0, 0.85]
  - - [5888, 64, 1, 32]
    - [0, 0.999]
  - - [6784, 64, 1, 32]
    - [0, 1.093]
  - - [64, 128, 1, 32]
    - [0, 0.023]
  - - [128, 128, 1, 32]
    - [9, 0.056]
  - - [256, 128, 1, 32]
    - [23, 0.101]
  - - [448, 128, 1, 32]
    - [0, 0.16]
  - - [704, 128, 1, 32]
    - [0, 0.257]
  - - [1024, 128, 1, 32]
    - [0, 0.363]
  - - [1408, 128, 1, 32]
    - [0, 0.478]
  - - [1856, 128, 1, 32]
    - [0, 0.635]
  - - [2368, 128, 1, 32]
    - [0, 0.803]
  - - [2944, 128, 1, 32]
    - [0, 0.933]
  - - [3584, 128, 1, 32]
    - [0, 1.117]
  - - [4288, 128, 1, 32]
    - [0, 1.294]
  - - [5056, 128, 1, 32]
    - [0, 1.468]
  - - [5888, 128, 1, 32]
    - [0, 1.647]
  - - [6784, 128, 1, 32]
    - [1, 1.793]
  - - [64, 256, 1, 32]
    - [0, 0.049]
  - - [128, 256, 1, 32]
    - [0, 0.098]
  - - [256, 256, 1, 32]
    - [0, 0.178]
  - - [448, 256, 1, 32]
    - [0, 0.327]
  - - [704, 256, 1, 32]
    - [0, 0.519]
  - - [1024, 256, 1, 32]
    - [0, 0.671]
  - - [1408, 256, 1, 32]
    - [2, 0.885]
  - - [1856, 256, 1, 32]
    - [0, 1.196]
  - - [2368, 256, 1, 32]
    - [0, 1.345]
  - - [2944, 256, 1, 32]
    - [1, 1.589]
  - - [3584, 256, 1, 32]
    - [1, 1.82]
  - - [4288, 256, 1, 32]
    - [1, 1.945]
  - - [5056, 256, 1, 32]
    - [1, 2.062]
  - - [5888, 256, 1, 32]
    - [1, 2.28]
  - - [6784, 256, 1, 32]
    - [1, 2.419]
  - - [64, 448, 1, 32]
    - [0, 0.085]
  - - [128, 448, 1, 32]
    - [0, 0.165]
  - - [256, 448, 1, 32]
    - [0, 0.324]
  - - [448, 448, 1, 32]
    - [0, 0.584]
  - - [704, 448, 1, 32]
    - [0, 0.814]
  - - [1024, 448, 1, 32]
    - [0, 1.135]
  - - [1408, 448, 1, 32]
    - [1, 1.389]
  - - [1856, 448, 1, 32]
    - [1, 1.717]
  - - [2368, 448, 1, 32]
    - [1, 1.902]
  - - [2944, 448, 1, 32]
    - [1, 2.147]
  - - [3584, 448, 1, 32]
    - [14, 2.346]
  - - [4288, 448, 1, 32]
    - [14, 2.546]
  - - [5056, 448, 1, 32]
    - [1, 2.713]
  - - [5888, 448, 1, 32]
    - [1, 2.724]
  - - [6784, 448, 1, 32]
    - [1, 2.917]
  - - [64, 704, 1, 32]
    - [0, 0.13]
  - - [128, 704, 1, 32]
    - [0, 0.257]
  - - [256, 704, 1, 32]
    - [0, 0.504]
  - - [448, 704, 1, 32]
    - [0, 0.807]
  - - [704, 704, 1, 32]
    - [0, 1.269]
  - - [1024, 704, 1, 32]
    - [1, 1.531]
  - - [1408, 704, 1, 32]
    - [1, 1.867]
  - - [1856, 704, 1, 32]
    - [1, 2.104]
  - - [2368, 704, 1, 32]
    - [14, 2.389]
  - - [2944, 704, 1, 32]
    - [1, 2.523]
  - - [3584, 704, 1, 32]
    - [14, 2.738]
  - - [4288, 704, 1, 32]
    - [14, 2.926]
  - - [5056, 704, 1, 32]
    - [1, 2.986]
  - - [5888, 704, 1, 32]
    - [16, 3.224]
  - - [6784, 704, 1, 32]
    - [15, 3.357]
  - - [64, 1024, 1, 32]
    - [0, 0.2]
  - - [128, 1024, 1, 32]
    - [0, 0.393]
  - - [256, 1024, 1, 32]
    - [0, 0.727]
  - - [448, 1024, 1, 32]
    - [0, 1.184]
  - - [704, 1024, 1, 32]
    - [1, 1.599]
  - - [1024, 1024, 1, 32]
    - [18, 1.754]
  - - [1408, 1024, 1, 32]
    - [14, 2.181]
  - - [1856, 1024, 1, 32]
    - [14, 2.541]
  - - [2368, 1024, 1, 32]
    - [14, 2.689]
  - - [2944, 1024, 1, 32]
    - [15, 2.912]
  - - [3584, 1024, 1, 32]
    - [14, 3.07]
  - - [4288, 1024, 1, 32]
    - [14, 3.223]
  - - [5056, 1024, 1, 32]
    - [15, 3.393]
  - - [5888, 1024, 1, 32]
    - [14, 3.575]
  - - [6784, 1024, 1, 32]
    - [16, 3.695]
  - - [64, 1408, 1, 32]
    - [0, 0.257]
  - - [128, 1408, 1, 32]
    - [0, 0.504]
  - - [256, 1408, 1, 32]
    - [0, 0.947]
  - - [448, 1408, 1, 32]
    - [0, 1.442]
  - - [704, 1408, 1, 32]
    - [1, 1.867]
  - - [1024, 1408, 1, 32]
    - [14, 2.159]
  - - [1408, 1408, 1, 32]
    - [14, 2.413]
  - - [1856, 1408, 1, 32]
    - [14, 2.756]
  - - [2368, 1408, 1, 32]
    - [14, 3.007]
  - - [2944, 1408, 1, 32]
    - [14, 3.191]
  - - [3584, 1408, 1, 32]
    - [14, 3.411]
  - - [4288, 1408, 1, 32]
    - [14, 3.616]
  - - [5056, 1408, 1, 32]
    - [16, 3.807]
  - - [5888, 1408, 1, 32]
    - [15, 3.885]
  - - [6784, 1408, 1, 32]
    - [16, 4.057]
  - - [64, 1856, 1, 32]
    - [0, 0.342]
  - - [128, 1856, 1, 32]
    - [1, 0.619]
  - - [256, 1856, 1, 32]
    - [0, 1.196]
  - - [448, 1856, 1, 32]
    - [1, 1.804]
  - - [704, 1856, 1, 32]
    - [14, 2.115]
  - - [1024, 1856, 1, 32]
    - [14, 2.552]
  - - [1408, 1856, 1, 32]
    - [15, 2.717]
  - - [1856, 1856, 1, 32]
    - [15, 3.043]
  - - [2368, 1856, 1, 32]
    - [14, 3.299]
  - - [2944, 1856, 1, 32]
    - [16, 3.489]
  - - [3584, 1856, 1, 32]
    - [16, 3.689]
  - - [4288, 1856, 1, 32]
    - [15, 3.901]
  - - [5056, 1856, 1, 32]
    - [16, 4.133]
  - - [5888, 1856, 1, 32]
    - [16, 4.228]
  - - [6784, 1856, 1, 32]
    - [15, 4.324]
  - - [64, 2368, 1, 32]
    - [0, 0.405]
  - - [128, 2368, 1, 32]
    - [0, 0.796]
  - - [256, 2368, 1, 32]
    - [0, 1.441]
  - - [448, 2368, 1, 32]
    - [1, 1.949]
  - - [704, 2368, 1, 32]
    - [14, 2.366]
  - - [1024, 2368, 1, 32]
    - [14, 2.74]
  - - [1408, 2368, 1, 32]
    - [14, 3.12]
  - - [1856, 2368, 1, 32]
    - [14, 3.324]
  - - [2368, 2368, 1, 32]
    - [15, 3.528]
  - - [2944, 2368, 1, 32]
    - [15, 3.775]
  - - [3584, 2368, 1, 32]
    - [14, 3.934]
  - - [4288, 2368, 1, 32]
    - [15, 4.188]
  - - [5056, 2368, 1, 32]
    - [16, 4.341]
  - - [5888, 2368, 1, 32]
    - [15, 4.391]
  - - [6784, 2368, 1, 32]
    - [16, 4.635]
  - - [64, 2944, 1, 32]
    - [0, 0.504]
  - - [128, 2944, 1, 32]
    - [0, 1.035]
  - - [256, 2944, 1, 32]
    - [0, 1.777]
  - - [448, 2944, 1, 32]
    - [14, 2.123]
  - - [704, 2944, 1, 32]
    - [18, 2.63]
  - - [1024, 2944, 1, 32]
    - [14, 2.884]
  - - [1408, 2944, 1, 32]
    - [14, 3.301]
  - - [1856, 2944, 1, 32]
    - [14, 3.596]
  - - [2368, 2944, 1, 32]
    - [15, 3.81]
  - - [2944, 2944, 1, 32]
    - [15, 4.018]
  - - [3584, 2944, 1, 32]
    - [16, 4.23]
  - - [4288, 2944, 1, 32]
    - [16, 4.442]
  - - [5056, 2944, 1, 32]
    - [16, 4.548]
  - - [5888, 2944, 1, 32]
    - [16, 4.668]
  - - [6784, 2944, 1, 32]
    - [16, 4.781]
  - - [64, 3584, 1, 32]
    - [0, 0.608]
  - - [128, 3584, 1, 32]
    - [0, 1.184]
  - - [256, 3584, 1, 32]
    - [1, 1.949]
  - - [448, 3584, 1, 32]
    - [14, 2.312]
  - - [704, 3584, 1, 32]
    - [14, 2.679]
  - - [1024, 3584, 1, 32]
    - [14, 3.061]
  - - [1408, 3584, 1, 32]
    - [16, 3.419]
  - - [1856, 3584, 1, 32]
    - [16, 3.751]
  - - [2368, 3584, 1, 32]
    - [16, 3.922]
  - - [2944, 3584, 1, 32]
    - [16, 4.276]
  - - [3584, 3584, 1, 32]
    - [16, 4.411]
  - - [4288, 3584, 1, 32]
    - [15, 4.611]
  - - [5056, 3584, 1, 32]
    - [16, 4.76]
  - - [5888, 3584, 1, 32]
    - [16, 4.843]
  - - [6784, 3584, 1, 32]
    - [16, 4.946]
  - - [64, 4288, 1, 32]
    - [0, 0.715]
  - - [128, 4288, 1, 32]
    - [0, 1.315]
  - - [256, 4288, 1, 32]
    - [0, 1.945]
  - - [448, 4288, 1, 32]
    - [14, 2.568]
  - - [704, 4288, 1, 32]
    - [14, 2.926]
  - - [1024, 4288, 1, 32]
    - [14, 3.337]
  - - [1408, 4288, 1, 32]
    - [14, 3.616]
  - - [1856, 4288, 1, 32]
    - [16, 3.946]
  - - [2368, 4288, 1, 32]
    - [15, 4.253]
  - - [2944, 4288, 1, 32]
    - [16, 4.406]
  - - [3584, 4288, 1, 32]
    - [15, 4.616]
  - - [4288, 4288, 1, 32]
    - [16, 4.83]
  - - [5056, 4288, 1, 32]
    - [15, 4.874]
  - - [5888, 4288, 1, 32]
    - [16, 4.987]
  - - [6784, 4288, 1, 32]
    - [16, 5.088]
  - - [64, 5056, 1, 32]
    - [0, 0.828]
  - - [128, 5056, 1, 32]
    - [0, 1.55]
  - - [256, 5056, 1, 32]
    - [0, 2.215]
  - - [448, 5056, 1, 32]
    - [18, 2.569]
  - - [704, 5056, 1, 32]
    - [14, 3.135]
  - - [1024, 5056, 1, 32]
    - [16, 3.476]
  - - [1408, 5056, 1, 32]
    - [16, 3.876]
  - - [1856, 5056, 1, 32]
    - [16, 4.127]
  - - [2368, 5056, 1, 32]
    - [15, 4.335]
  - - [2944, 5056, 1, 32]
    - [16, 4.619]
  - - [3584, 5056, 1, 32]
    - [15, 4.773]
  - - [4288, 5056, 1, 32]
    - [16, 4.842]
  - - [5056, 5056, 1, 32]
    - [16, 4.99]
  - - [5888, 5056, 1, 32]
    - [15, 5.094]
  - - [6784, 5056, 1, 32]
    - [15, 5.164]
  - - [64, 5888, 1, 32]
    - [0, 0.965]
  - - [128, 5888, 1, 32]
    - [0, 1.806]
  - - [256, 5888, 1, 32]
    - [1, 2.327]
  - - [448, 5888, 1, 32]
    - [14, 2.743]
  - - [704, 5888, 1, 32]
    - [14, 3.293]
  - - [1024, 5888, 1, 32]
    - [14, 3.618]
  - - [1408, 5888, 1, 32]
    - [16, 4.03]
  - - [1856, 5888, 1, 32]
    - [15, 4.278]
  - - [2368, 5888, 1, 32]
    - [16, 4.456]
  - - [2944, 5888, 1, 32]
    - [16, 4.694]
  - - [3584, 5888, 1, 32]
    - [16, 4.903]
  - - [4288, 5888, 1, 32]
    - [16, 4.991]
  - - [5056, 5888, 1, 32]
    - [16, 5.071]
  - - [5888, 5888, 1, 32]
    - [16, 5.228]
  - - [6784, 5888, 1, 32]
    - [15, 5.293]
  - - [64, 6784, 1, 32]
    - [0, 1.131]
  - - [128, 6784, 1, 32]
    - [0, 1.941]
  - - [256, 6784, 1, 32]
    - [14, 2.5]
  - - [448, 6784, 1, 32]
    - [14, 2.965]
  - - [704, 6784, 1, 32]
    - [14, 3.446]
  - - [1024, 6784, 1, 32]
    - [16, 3.824]
  - - [1408, 6784, 1, 32]
    - [16, 4.146]
  - - [1856, 6784, 1, 32]
    - [15, 4.441]
  - - [2368, 6784, 1, 32]
    - [16, 4.626]
  - - [2944, 6784, 1, 32]
    - [16, 4.781]
  - - [3584, 6784, 1, 32]
    - [15, 4.973]
  - - [4288, 6784, 1, 32]
    - [15, 5.085]
  - - [5056, 6784, 1, 32]
    - [16, 5.233]
  - - [5888, 6784, 1, 32]
    - [16, 5.293]
  - - [6784, 6784, 1, 32]
    - [15, 5.332]
  - - [32, 32, 1, 256]
    - [2, 0.012]
  - - [32, 32, 1, 1280]
    - [1, 0.023]
  - - [32, 32, 1, 3328]
    - [8, 0.027]
  - - [32, 64, 1, 32]
    - [2, 0.008]
  - - [32, 128, 1, 32]
    - [0, 0.012]
  - - [32, 256, 1, 32]
    - [24, 0.029]
  - - [32, 448, 1, 32]
    - [9, 0.052]
  - - [32, 704, 1, 32]
    - [0, 0.07]
  - - [32, 1024, 1, 32]
    - [0, 0.096]
  - - [32, 1408, 1, 32]
    - [0, 0.142]
  - - [32, 1856, 1, 32]
    - [0, 0.176]
  - - [32, 2368, 1, 32]
    - [0, 0.225]
  - - [32, 2944, 1, 32]
    - [0, 0.282]
  - - [32, 3584, 1, 32]
    - [0, 0.337]
  - - [32, 4288, 1, 32]
    - [0, 0.38]
  - - [32, 5056, 1, 32]
    - [0, 0.48]
  - - [32, 5888, 1, 32]
    - [0, 0.537]
  - - [32, 6784, 1, 32]
    - [0, 0.637]
  - - [64, 32, 1, 32]
    - [0, 0.006]
  - - [128, 32, 1, 32]
    - [9, 0.016]
  - - [256, 32, 1, 32]
    - [0, 0.032]
  - - [448, 32, 1, 32]
    - [1, 0.052]
  - - [704, 32, 1, 32]
    - [0, 0.065]
  - - [1024, 32, 1, 32]
    - [0, 0.098]
  - - [1408, 32, 1, 32]
    - [0, 0.13]
  - - [1856, 32, 1, 32]
    - [0, 0.173]
  - - [2368, 32, 1, 32]
    - [0, 0.227]
  - - [2944, 32, 1, 32]
    - [0, 0.277]
  - - [3584, 32, 1, 32]
    - [0, 0.34]
  - - [4288, 32, 1, 32]
    - [0, 0.377]
  - - [5056, 32, 1, 32]
    - [0, 0.457]
  - - [5888, 32, 1, 32]
    - [0, 0.527]
  - - [6784, 32, 1, 32]
    - [0, 0.613]
  - - [1, 1, 1, 1]
    - [25, 0.0]
  - - [1, 64, 1, 256]
    - [26, 0.0]
  - - [1, 128, 1, 256]
    - [21, 0.001]
  - - [1, 256, 1, 256]
    - [27, 0.001]
  - - [1, 448, 1, 256]
    - [28, 0.003]
  - - [1, 704, 1, 256]
    - [27, 0.004]
  - - [1, 1024, 1, 256]
    - [29, 0.006]
  - - [1, 1408, 1, 256]
    - [28, 0.008]
  - - [1, 1856, 1, 256]
    - [28, 0.01]
  - - [1, 2368, 1, 256]
    - [28, 0.013]
  - - [1, 2944, 1, 256]
    - [28, 0.016]
  - - [1, 3584, 1, 256]
    - [28, 0.02]
  - - [1, 4288, 1, 256]
    - [28, 0.024]
  - - [1, 5056, 1, 256]
    - [27, 0.027]
  - - [1, 5888, 1, 256]
    - [29, 0.031]
  - - [1, 6784, 1, 256]
    - [29, 0.037]
  - - [1, 64, 1, 1280]
    - [30, 0.001]
  - - [1, 128, 1, 1280]
    - [30, 0.001]
  - - [1, 256, 1, 1280]
    - [30, 0.002]
  - - [1, 448, 1, 1280]
    - [30, 0.004]
  - - [1, 704, 1, 1280]
    - [30, 0.006]
  - - [1, 1024, 1, 1280]
    - [30, 0.008]
  - - [1, 1408, 1, 1280]
    - [30, 0.012]
  - - [1, 1856, 1, 1280]
    - [30, 0.015]
  - - [1, 2368, 1, 1280]
    - [30, 0.019]
  - - [1, 2944, 1, 1280]
    - [30, 0.024]
  - - [1, 3584, 1, 1280]
    - [30, 0.029]
  - - [1, 4288, 1, 1280]
    - [30, 0.034]
  - - [1, 5056, 1, 1280]
    - [30, 0.04]
  - - [1, 5888, 1, 1280]
    - [30, 0.047]
  - - [1, 6784, 1, 1280]
    - [30, 0.054]
  - - [1, 64, 1, 3328]
    - [30, 0.001]
  - - [1, 128, 1, 3328]
    - [30, 0.001]
  - - [1, 256, 1, 3328]
    - [30, 0.002]
  - - [1, 448, 1, 3328]
    - [30, 0.004]
  - - [1, 704, 1, 3328]
    - [30, 0.006]
  - - [1, 1024, 1, 3328]
    - [30, 0.009]
  - - [1, 1408, 1, 3328]
    - [30, 0.013]
  - - [1, 1856, 1, 3328]
    - [30, 0.016]
  - - [1, 2368, 1, 3328]
    - [30, 0.021]
  - - [1, 2944, 1, 3328]
    - [30, 0.026]
  - - [1, 3584, 1, 3328]
    - [30, 0.032]
  - - [1, 4288, 1, 3328]
    - [30, 0.038]
  - - [1, 5056, 1, 3328]
    - [30, 0.044]
  - - [1, 5888, 1, 3328]
    - [30, 0.052]
  - - [1, 6784, 1, 3328]
    - [30, 0.06]
  - - [64, 1, 1, 256]
    - [26, 0.0]
  - - [128, 1, 1, 256]
    - [26, 0.001]
  - - [256, 1, 1, 256]
    - [27, 0.001]
  - - [448, 1, 1, 256]
    - [29, 0.003]
  - - [704, 1, 1, 256]
    - [27, 0.004]
  - - [1024, 1, 1, 256]
    - [29, 0.006]
  - - [1408, 1, 1, 256]
    - [29, 0.009]
  - - [1856, 1, 1, 256]
    - [27, 0.011]
  - - [2368, 1, 1, 256]
    - [29, 0.014]
  - - [2944, 1, 1, 256]
    - [27, 0.017]
  - - [3584, 1, 1, 256]
    - [27, 0.021]
  - - [4288, 1, 1, 256]
    - [27, 0.024]
  - - [5056, 1, 1, 256]
    - [29, 0.028]
  - - [5888, 1, 1, 256]
    - [27, 0.032]
  - - [6784, 1, 1, 256]
    - [29, 0.037]
  - - [64, 1, 1, 1280]
    - [26, 0.001]
  - - [128, 1, 1, 1280]
    - [26, 0.001]
  - - [256, 1, 1, 1280]
    - [29, 0.002]
  - - [448, 1, 1, 1280]
    - [29, 0.003]
  - - [704, 1, 1, 1280]
    - [29, 0.005]
  - - [1024, 1, 1, 1280]
    - [29, 0.008]
  - - [1408, 1, 1, 1280]
    - [29, 0.011]
  - - [1856, 1, 1, 1280]
    - [29, 0.015]
  - - [2368, 1, 1, 1280]
    - [29, 0.019]
  - - [2944, 1, 1, 1280]
    - [29, 0.023]
  - - [3584, 1, 1, 1280]
    - [29, 0.028]
  - - [4288, 1, 1, 1280]
    - [29, 0.033]
  - - [5056, 1, 1, 1280]
    - [29, 0.039]
  - - [5888, 1, 1, 1280]
    - [29, 0.046]
  - - [6784, 1, 1, 1280]
    - [29, 0.052]
  - - [64, 1, 1, 3328]
    - [29, 0.001]
  - - [128, 1, 1, 3328]
    - [29, 0.001]
  - - [256, 1, 1, 3328]
    - [29, 0.002]
  - - [448, 1, 1, 3328]
    - [29, 0.004]
  - - [704, 1, 1, 3328]
    - [29, 0.006]
  - - [1024, 1, 1, 3328]
    - [29, 0.008]
  - - [1408, 1, 1, 3328]
    - [29, 0.012]
  - - [1856, 1, 1, 3328]
    - [29, 0.015]
  - - [2368, 1, 1, 3328]
    - [29, 0.02]
  - - [2944, 1, 1, 3328]
    - [29, 0.024]
  - - [3584, 1, 1, 3328]
    - [29, 0.029]
  - - [4288, 1, 1, 3328]
    - [29, 0.035]
  - - [5056, 1, 1, 3328]
    - [29, 0.042]
  - - [5888, 1, 1, 3328]
    - [29, 0.048]
  - - [6784, 1, 1, 3328]
    - [29, 0.056]
  - - [64, 64, 1, 1]
    - [21, 0.0]
  - - [128, 64, 1, 1]
    - [26, 0.001]
  - - [256, 64, 1, 1]
    - [26, 0.001]
  - - [448, 64, 1, 1]
    - [31, 0.002]
  - - [704, 64, 1, 1]
    - [32, 0.003]
  - - [1024, 64, 1, 1]
    - [33, 0.005]
  - - [1408, 64, 1, 1]
    - [34, 0.006]
  - - [1856, 64, 1, 1]
    - [33, 0.008]
  - - [2368, 64, 1, 1]
    - [32, 0.009]
  - - [2944, 64, 1, 1]
    - [33, 0.012]
  - - [3584, 64, 1, 1]
    - [33, 0.014]
  - - [4288, 64, 1, 1]
    - [35, 0.017]
  - - [5056, 64, 1, 1]
    - [35, 0.019]
  - - [5888, 64, 1, 1]
    - [33, 0.021]
  - - [6784, 64, 1, 1]
    - [35, 0.023]
  - - [64, 128, 1, 1]
    - [26, 0.001]
  - - [128, 128, 1, 1]
    - [36, 0.001]
  - - [256, 128, 1, 1]
    - [33, 0.002]
  - - [448, 128, 1, 1]
    - [32, 0.004]
  - - [704, 128, 1, 1]
    - [33, 0.007]
  - - [1024, 128, 1, 1]
    - [28, 0.009]
  - - [1408, 128, 1, 1]
    - [28, 0.011]
  - - [1856, 128, 1, 1]
    - [33, 0.015]
  - - [2368, 128, 1, 1]
    - [33, 0.019]
  - - [2944, 128, 1, 1]
    - [33, 0.022]
  - - [3584, 128, 1, 1]
    - [35, 0.025]
  - - [4288, 128, 1, 1]
    - [35, 0.029]
  - - [5056, 128, 1, 1]
    - [33, 0.035]
  - - [5888, 128, 1, 1]
    - [35, 0.041]
  - - [6784, 128, 1, 1]
    - [33, 0.046]
  - - [64, 256, 1, 1]
    - [26, 0.001]
  - - [128, 256, 1, 1]
    - [32, 0.002]
  - - [256, 256, 1, 1]
    - [28, 0.005]
  - - [448, 256, 1, 1]
    - [32, 0.007]
  - - [704, 256, 1, 1]
    - [33, 0.012]
  - - [1024, 256, 1, 1]
    - [33, 0.016]
  - - [1408, 256, 1, 1]
    - [35, 0.021]
  - - [1856, 256, 1, 1]
    - [33, 0.026]
  - - [2368, 256, 1, 1]
    - [35, 0.032]
  - - [2944, 256, 1, 1]
    - [33, 0.039]
  - - [3584, 256, 1, 1]
    - [33, 0.049]
  - - [4288, 256, 1, 1]
    - [33, 0.056]
  - - [5056, 256, 1, 1]
    - [33, 0.065]
  - - [5888, 256, 1, 1]
    - [35, 0.07]
  - - [6784, 256, 1, 1]
    - [35, 0.079]
  - - [64, 448, 1, 1]
    - [26, 0.002]
  - - [128, 448, 1, 1]
    - [32, 0.004]
  - - [256, 448, 1, 1]
    - [33, 0.008]
  - - [448, 448, 1, 1]
    - [35, 0.013]
  - - [704, 448, 1, 1]
    - [33, 0.019]
  - - [1024, 448, 1, 1]
    - [35, 0.025]
  - - [1408, 448, 1, 1]
    - [33, 0.033]
  - - [1856, 448, 1, 1]
    - [35, 0.044]
  - - [2368, 448, 1, 1]
    - [33, 0.054]
  - - [2944, 448, 1, 1]
    - [35, 0.061]
  - - [3584, 448, 1, 1]
    - [33, 0.069]
  - - [4288, 448, 1, 1]
    - [35, 0.078]
  - - [5056, 448, 1, 1]
    - [35, 0.086]
  - - [5888, 448, 1, 1]
    - [37, 0.083]
  - - [6784, 448, 1, 1]
    - [27, 0.092]
  - - [64, 704, 1, 1]
    - [33, 0.003]
  - - [128, 704, 1, 1]
    - [32, 0.006]
  - - [256, 704, 1, 1]
    - [33, 0.012]
  - - [448, 704, 1, 1]
    - [35, 0.019]
  - - [704, 704, 1, 1]
    - [35, 0.027]
  - - [1024, 704, 1, 1]
    - [33, 0.036]
  - - [1408, 704, 1, 1]
    - [33, 0.052]
  - - [1856, 704, 1, 1]
    - [35, 0.065]
  - - [2368, 704, 1, 1]
    - [35, 0.076]
  - - [2944, 704, 1, 1]
    - [33, 0.085]
  - - [3584, 704, 1, 1]
    - [33, 0.081]
  - - [4288, 704, 1, 1]
    - [38, 0.091]
  - - [5056, 704, 1, 1]
    - [38, 0.101]
  - - [5888, 704, 1, 1]
    - [33, 0.106]
  - - [6784, 704, 1, 1]
    - [33, 0.111]
  - - [64, 1024, 1, 1]
    - [33, 0.004]
  - - [128, 1024, 1, 1]
    - [35, 0.008]
  - - [256, 1024, 1, 1]
    - [33, 0.017]
  - - [448, 1024, 1, 1]
    - [35, 0.025]
  - - [704, 1024, 1, 1]
    - [33, 0.039]
  - - [1024, 1024, 1, 1]
    - [33, 0.052]
  - - [1408, 1024, 1, 1]
    - [35, 0.067]
  - - [1856, 1024, 1, 1]
    - [33, 0.08]
  - - [2368, 1024, 1, 1]
    - [35, 0.088]
  - - [2944, 1024, 1, 1]
    - [38, 0.092]
  - - [3584, 1024, 1, 1]
    - [38, 0.101]
  - - [4288, 1024, 1, 1]
    - [33, 0.108]
  - - [5056, 1024, 1, 1]
    - [33, 0.108]
  - - [5888, 1024, 1, 1]
    - [33, 0.114]
  - - [6784, 1024, 1, 1]
    - [33, 0.121]
  - - [64, 1408, 1, 1]
    - [33, 0.006]
  - - [128, 1408, 1, 1]
    - [35, 0.013]
  - - [256, 1408, 1, 1]
    - [33, 0.021]
  - - [448, 1408, 1, 1]
    - [33, 0.035]
  - - [704, 1408, 1, 1]
    - [35, 0.053]
  - - [1024, 1408, 1, 1]
    - [34, 0.068]
  - - [1408, 1408, 1, 1]
    - [33, 0.082]
  - - [1856, 1408, 1, 1]
    - [35, 0.082]
  - - [2368, 1408, 1, 1]
    - [38, 0.097]
  - - [2944, 1408, 1, 1]
    - [33, 0.106]
  - - [3584, 1408, 1, 1]
    - [33, 0.109]
  - - [4288, 1408, 1, 1]
    - [33, 0.115]
  - - [5056, 1408, 1, 1]
    - [35, 0.122]
  - - [5888, 1408, 1, 1]
    - [33, 0.123]
  - - [6784, 1408, 1, 1]
    - [33, 0.127]
  - - [64, 1856, 1, 1]
    - [33, 0.007]
  - - [128, 1856, 1, 1]
    - [35, 0.015]
  - - [256, 1856, 1, 1]
    - [33, 0.025]
  - - [448, 1856, 1, 1]
    - [35, 0.044]
  - - [704, 1856, 1, 1]
    - [35, 0.066]
  - - [1024, 1856, 1, 1]
    - [34, 0.078]
  - - [1408, 1856, 1, 1]
    - [38, 0.083]
  - - [1856, 1856, 1, 1]
    - [27, 0.099]
  - - [2368, 1856, 1, 1]
    - [33, 0.109]
  - - [2944, 1856, 1, 1]
    - [38, 0.113]
  - - [3584, 1856, 1, 1]
    - [33, 0.119]
  - - [4288, 1856, 1, 1]
    - [33, 0.121]
  - - [5056, 1856, 1, 1]
    - [33, 0.126]
  - - [5888, 1856, 1, 1]
    - [33, 0.128]
  - - [6784, 1856, 1, 1]
    - [33, 0.13]
  - - [64, 2368, 1, 1]
    - [33, 0.01]
  - - [128, 2368, 1, 1]
    - [35, 0.018]
  - - [256, 2368, 1, 1]
    - [35, 0.032]
  - - [448, 2368, 1, 1]
    - [33, 0.054]
  - - [704, 2368, 1, 1]
    - [35, 0.077]
  - - [1024, 2368, 1, 1]
    - [33, 0.086]
  - - [1408, 2368, 1, 1]
    - [37, 0.097]
  - - [1856, 2368, 1, 1]
    - [33, 0.111]
  - - [2368, 2368, 1, 1]
    - [27, 0.113]
  - - [2944, 2368, 1, 1]
    - [33, 0.124]
  - - [3584, 2368, 1, 1]
    - [33, 0.123]
  - - [4288, 2368, 1, 1]
    - [33, 0.126]
  - - [5056, 2368, 1, 1]
    - [33, 0.132]
  - - [5888, 2368, 1, 1]
    - [35, 0.133]
  - - [6784, 2368, 1, 1]
    - [33, 0.135]
  - - [64, 2944, 1, 1]
    - [33, 0.012]
  - - [128, 2944, 1, 1]
    - [33, 0.021]
  - - [256, 2944, 1, 1]
    - [33, 0.039]
  - - [448, 2944, 1, 1]
    - [35, 0.066]
  - - [704, 2944, 1, 1]
    - [33, 0.084]
  - - [1024, 2944, 1, 1]
    - [38, 0.091]
  - - [1408, 2944, 1, 1]
    - [33, 0.107]
  - - [1856, 2944, 1, 1]
    - [38, 0.114]
  - - [2368, 2944, 1, 1]
    - [33, 0.122]
  - - [2944, 2944, 1, 1]
    - [33, 0.125]
  - - [3584, 2944, 1, 1]
    - [35, 0.127]
  - - [4288, 2944, 1, 1]
    - [33, 0.13]
  - - [5056, 2944, 1, 1]
    - [33, 0.133]
  - - [5888, 2944, 1, 1]
    - [33, 0.135]
  - - [6784, 2944, 1, 1]
    - [33, 0.137]
  - - [64, 3584, 1, 1]
    - [33, 0.014]
  - - [128, 3584, 1, 1]
    - [33, 0.025]
  - - [256, 3584, 1, 1]
    - [35, 0.049]
  - - [448, 3584, 1, 1]
    - [33, 0.073]
  - - [704, 3584, 1, 1]
    - [35, 0.085]
  - - [1024, 3584, 1, 1]
    - [34, 0.103]
  - - [1408, 3584, 1, 1]
    - [33, 0.11]
  - - [1856, 3584, 1, 1]
    - [35, 0.12]
  - - [2368, 3584, 1, 1]
    - [33, 0.124]
  - - [2944, 3584, 1, 1]
    - [33, 0.128]
  - - [3584, 3584, 1, 1]
    - [33, 0.131]
  - - [4288, 3584, 1, 1]
    - [33, 0.134]
  - - [5056, 3584, 1, 1]
    - [35, 0.136]
  - - [5888, 3584, 1, 1]
    - [33, 0.138]
  - - [6784, 3584, 1, 1]
    - [33, 0.139]
  - - [64, 4288, 1, 1]
    - [33, 0.017]
  - - [128, 4288, 1, 1]
    - [35, 0.029]
  - - [256, 4288, 1, 1]
    - [33, 0.058]
  - - [448, 4288, 1, 1]
    - [35, 0.081]
  - - [704, 4288, 1, 1]
    - [38, 0.092]
  - - [1024, 4288, 1, 1]
    - [33, 0.104]
  - - [1408, 4288, 1, 1]
    - [35, 0.117]
  - - [1856, 4288, 1, 1]
    - [33, 0.121]
  - - [2368, 4288, 1, 1]
    - [33, 0.128]
  - - [2944, 4288, 1, 1]
    - [33, 0.133]
  - - [3584, 4288, 1, 1]
    - [33, 0.134]
  - - [4288, 4288, 1, 1]
    - [33, 0.137]
  - - [5056, 4288, 1, 1]
    - [33, 0.138]
  - - [5888, 4288, 1, 1]
    - [33, 0.14]
  - - [6784, 4288, 1, 1]
    - [33, 0.141]
  - - [64, 5056, 1, 1]
    - [33, 0.019]
  - - [128, 5056, 1, 1]
    - [33, 0.034]
  - - [256, 5056, 1, 1]
    - [33, 0.065]
  - - [448, 5056, 1, 1]
    - [35, 0.09]
  - - [704, 5056, 1, 1]
    - [27, 0.101]
  - - [1024, 5056, 1, 1]
    - [38, 0.11]
  - - [1408, 5056, 1, 1]
    - [33, 0.123]
  - - [1856, 5056, 1, 1]
    - [33, 0.128]
  - - [2368, 5056, 1, 1]
    - [33, 0.133]
  - - [2944, 5056, 1, 1]
    - [35, 0.134]
  - - [3584, 5056, 1, 1]
    - [33, 0.137]
  - - [4288, 5056, 1, 1]
    - [33, 0.14]
  - - [5056, 5056, 1, 1]
    - [33, 0.139]
  - - [5888, 5056, 1, 1]
    - [33, 0.141]
  - - [6784, 5056, 1, 1]
    - [35, 0.142]
  - - [64, 5888, 1, 1]
    - [33, 0.022]
  - - [128, 5888, 1, 1]
    - [33, 0.039]
  - - [256, 5888, 1, 1]
    - [33, 0.068]
  - - [448, 5888, 1, 1]
    - [38, 0.085]
  - - [704, 5888, 1, 1]
    - [33, 0.107]
  - - [1024, 5888, 1, 1]
    - [35, 0.112]
  - - [1408, 5888, 1, 1]
    - [33, 0.124]
  - - [1856, 5888, 1, 1]
    - [35, 0.13]
  - - [2368, 5888, 1, 1]
    - [33, 0.135]
  - - [2944, 5888, 1, 1]
    - [33, 0.137]
  - - [3584, 5888, 1, 1]
    - [33, 0.139]
  - - [4288, 5888, 1, 1]
    - [33, 0.14]
  - - [5056, 5888, 1, 1]
    - [33, 0.141]
  - - [5888, 5888, 1, 1]
    - [33, 0.143]
  - - [6784, 5888, 1, 1]
    - [33, 0.143]
  - - [64, 6784, 1, 1]
    - [35, 0.024]
  - - [128, 6784, 1, 1]
    - [33, 0.047]
  - - [256, 6784, 1, 1]
    - [35, 0.077]
  - - [448, 6784, 1, 1]
    - [38, 0.092]
  - - [704, 6784, 1, 1]
    - [35, 0.113]
  - - [1024, 6784, 1, 1]
    - [34, 0.118]
  - - [1408, 6784, 1, 1]
    - [35, 0.13]
  - - [1856, 6784, 1, 1]
    - [35, 0.131]
  - - [2368, 6784, 1, 1]
    - [33, 0.136]
  - - [2944, 6784, 1, 1]
    - [33, 0.139]
  - - [3584, 6784, 1, 1]
    - [33, 0.14]
  - - [4288, 6784, 1, 1]
    - [33, 0.143]
  - - [5056, 6784, 1, 1]
    - [33, 0.143]
  - - [5888, 6784, 1, 1]
    - [33, 0.144]
  - - [6784, 6784, 1, 1]
    - [33, 0.144]
  - - [1, 1, 1, 256]
    - [35, 0.0]
  - - [1, 1, 1, 1280]
    - [35, 0.0]
  - - [1, 1, 1, 3328]
    - [35, 0.0]
  - - [1, 64, 1, 1]
    - [21, 0.0]
  - - [1, 128, 1, 1]
    - [26, 0.0]
  - - [1, 256, 1, 1]
    - [21, 0.0]
  - - [1, 448, 1, 1]
    - [35, 0.0]
  - - [1, 704, 1, 1]
    - [35, 0.0]
  - - [1, 1024, 1, 1]
    - [33, 0.0]
  - - [1, 1408, 1, 1]
    - [37, 0.0]
  - - [1, 1856, 1, 1]
    - [32, 0.0]
  - - [1, 2368, 1, 1]
    - [33, 0.0]
  - - [1, 2944, 1, 1]
    - [33, 0.0]
  - - [1, 3584, 1, 1]
    - [35, 0.0]
  - - [1, 4288, 1, 1]
    - [39, 0.0]
  - - [1, 5056, 1, 1]
    - [35, 0.0]
  - - [1, 5888, 1, 1]
    - [35, 0.0]
  - - [1, 6784, 1, 1]
    - [35, 0.0]
  - - [64, 1, 1, 1]
    - [25, 0.0]
  - - [128, 1, 1, 1]
    - [25, 0.0]
  - - [256, 1, 1, 1]
    - [25, 0.0]
  - - [448, 1, 1, 1]
    - [36, 0.0]
  - - [704, 1, 1, 1]
    - [40, 0.0]
  - - [1024, 1, 1, 1]
    - [27, 0.0]
  - - [1408, 1, 1, 1]
    - [35, 0.0]
  - - [1856, 1, 1, 1]
    - [33, 0.0]
  - - [2368, 1, 1, 1]
    - [35, 0.0]
  - - [2944, 1, 1, 1]
    - [33, 0.0]
  - - [3584, 1, 1, 1]
    - [35, 0.0]
  - - [4288, 1, 1, 1]
    - [35, 0.0]
  - - [5056, 1, 1, 1]
    - [35, 0.0]
  - - [5888, 1, 1, 1]
    - [35, 0.0]
  - - [6784, 1, 1, 1]
    - [35, 0.001]
- null
