library/src/blas3/Tensile/Logic/asm_full/aldebaran/aldebaran_Cijk_Ailk_Bljk_BSS_BH.yaml
- {MinimumRequiredVersion: 4.23.0}
- aldebaran
- gfx90a
- [Device 0050, Device 0051, Device 0052, Device 0054, Device 0062, Device 7400, Device
    SolutionIndex: 0
    SolutionNameMin: Cijk_Ailk_Bljk_BSS_BH_MT256x144x32_MI16x16x16x1_SE_1LDSB0_AF0EM4_GRVW2_GSU1_LBSPP128_LPB4_LRVW4_NLCA2_PLR1_SU16_SUS128_SRVW4_TT4_144_VAW2_WG64_4_1_WGM2
    SolutionIndex: 1
    SolutionNameMin: Cijk_Ailk_Bljk_BSS_BH_MT256x144x32_MI16x16x16x1_SE_1LDSB0_AF0EM4_GRVW2_GSU1_LBSPP128_LPB4_LRVW4_NLCA2_PLR1_SU0_SUS0_SRVW0_TT4_144_VAW2_WG64_4_1_WGM15
    SolutionIndex: 2
    SolutionNameMin: Cijk_Ailk_Bljk_BSS_BH_MT128x96x64_MI32x32x8x1_SE_1LDSB0_AF0EM4_GRVW8_GSU1_LBSPP128_LPB8_LRVW4_NLCA1_PLR1_SU32_SUS128_SRVW4_TT1_96_VAW2_WG128_2_1_WGM2
    SolutionIndex: 3
    SolutionNameMin: Cijk_Ailk_Bljk_BSS_BH_MT128x96x64_MI32x32x8x1_SE_1LDSB0_AF0EM4_GRVW8_GSU1_LBSPP128_LPB8_LRVW4_NLCA1_PLR1_SU0_SUS0_SRVW4_TT1_96_VAW2_WG128_2_1_WGM15
    SolutionIndex: 4
    SolutionNameMin: Cijk_Ailk_Bljk_BSS_BH_MT32x64x64_MI16x16x16x1_SE_1LDSB0_AF0EM8_GRVW8_GSU1_LBSPP128_LPB8_LRVW8_NLCA1_PLR5_SU0_SUS0_SRVW4_TT1_32_VAW2_WG32_8_1_WGM15
    SolutionIndex: 5
    SolutionNameMin: Cijk_Ailk_Bljk_BSS_BH_MT256x160x32_MI32x32x8x1_SE_1LDSB0_AF0EM8_GRVW4_GSU1_LBSPP128_LPB8_LRVW8_NLCA1_PLR5_SU0_SUS0_SRVW4_TT2_160_VAW2_WG128_2_1_WGM1
    SolutionIndex: 6
    SolutionNameMin: Cijk_Ailk_Bljk_BSS_BH_MT256x160x32_MI32x32x8x1_SE_1LDSB0_AF0EM8_GRVW4_GSU1_LBSPP128_LPB8_LRVW8_NLCA1_PLR5_SU32_SUS128_SRVW4_TT2_160_VAW2_WG128_2_1_WGM2
    SolutionIndex: 7
    SolutionNameMin: Cijk_Ailk_Bljk_BSS_BH_MT256x160x32_MI32x32x8x1_SE_1LDSB0_AF0EM8_GRVW4_GSU1_LBSPP128_LPB8_LRVW8_NLCA1_PLR5_SU32_SUS128_SRVW4_TT2_160_VAW2_WG128_2_1_WGM15
    SolutionIndex: 8
    SolutionNameMin: Cijk_Ailk_Bljk_BSS_BH_MT32x64x32_MI16x16x16x1_SE_1LDSB0_AF0EM4_GRVW2_GSU1_LBSPP128_LPB4_LRVW4_NLCA1_PLR1_SU0_SUS0_SRVW0_TT1_32_VAW2_WG32_8_1_WGM15
    SolutionIndex: 9
    SolutionNameMin: Cijk_Ailk_Bljk_BSS_BH_MT64x128x64_MI32x32x8x1_SE_1LDSB0_AF0EM8_GRVW8_GSU1_LBSPP128_LPB8_LRVW8_NLCA1_PLR9_SU32_SUS128_SRVW4_TT1_64_VAW2_WG64_4_1_WGM15
    SolutionIndex: 10
    SolutionNameMin: Cijk_Ailk_Bljk_BSS_BH_MT64x16x32_MI16x16x16x1_SE_1LDSB0_AF0EM8_GRVW4_GSU1_LBSPP128_LPB8_LRVW8_NLCA1_PLR2_SU0_SUS0_SRVW0_TT1_16_VAW2_WG64_4_1_WGM2
    SolutionIndex: 11
    SolutionNameMin: Cijk_Ailk_Bljk_BSS_BH_MT32x32x128_MI16x16x16x1_SE_1LDSB0_AF0EM4_GRVW8_GSU1_LBSPP256_LPB8_LRVW4_NLCA1_PLR1_SU0_SUS0_SRVW0_TT1_16_VAW2_WG32_8_1_WGM15
    SolutionIndex: 12
    SolutionNameMin: Cijk_Ailk_Bljk_BSS_BH_MT32x32x128_MI16x16x16x1_SE_1LDSB0_AF0EM4_GRVW8_GSU1_LBSPP256_LPB8_LRVW4_NLCA1_PLR1_SU16_SUS256_SRVW0_TT1_16_VAW2_WG32_8_1_WGM1
    SolutionIndex: 13
    SolutionNameMin: Cijk_Ailk_Bljk_BSS_BH_MT32x32x128_MI16x16x16x1_SE_1LDSB0_AF0EM4_GRVW4_GSU1_LBSPP256_LPB4_LRVW4_NLCA1_PLR1_SU32_SUS256_SRVW0_TT1_16_VAW2_WG32_8_1_WGM15
    SolutionIndex: 14
    SolutionNameMin: Cijk_Ailk_Bljk_BSS_BH_MT128x96x64_MI32x32x8x1_SE_1LDSB0_AF0EM8_GRVW8_GSU15_LBSPP128_LPB8_LRVW8_NLCA1_PLR9_SU32_SUS128_SRVW0_TT1_96_VAW1_WG128_2_1_WGM1
    SolutionIndex: 15
    SolutionNameMin: Cijk_Ailk_Bljk_BSS_BH_MT64x32x32_MI16x16x16x1_SE_1LDSB0_AF0EM8_GRVW8_GSU1_LBSPP128_LPB8_LRVW8_NLCA1_PLR2_SU0_SUS0_SRVW4_TT2_16_VAW2_WG32_8_1_WGM15
    SolutionIndex: 16
    SolutionNameMin: Cijk_Ailk_Bljk_BSS_BH_MT128x64x64_MI32x32x8x1_SE_1LDSB0_AF0EM4_GRVW8_GSU1_LBSPP128_LPB8_LRVW4_NLCA1_PLR1_SU0_SUS0_SRVW4_TT2_32_VAW2_WG64_4_1_WGM15
    SolutionIndex: 17
    SolutionNameMin: Cijk_Ailk_Bljk_BSS_BH_MT64x32x32_MI16x16x16x1_SE_1LDSB1_AF0EM8_GRVW2_GSU1_LBSPP128_LPB8_LRVW8_NLCA1_PLR2_SU0_SUS0_SRVW4_TT2_16_VAW2_WG32_8_1_WGM1
    SolutionIndex: 18
    SolutionNameMin: Cijk_Ailk_Bljk_BSS_BH_MT128x160x32_MI32x32x8x1_SE_1LDSB1_AF0EM8_GRVW2_GSU1_LBSPP128_LPB8_LRVW8_NLCA1_PLR5_SU0_SUS0_SRVW4_TT1_160_VAW2_WG128_2_1_WGM1
    SolutionIndex: 19
    SolutionNameMin: Cijk_Ailk_Bljk_BSS_BH_MT128x96x32_MI32x32x8x1_SE_1LDSB0_AF0EM4_GRVW4_GSU1_LBSPP128_LPB4_LRVW4_NLCA1_PLR1_SU0_SUS0_SRVW4_TT1_96_VAW2_WG128_2_1_WGM15
    SolutionIndex: 20
    SolutionNameMin: Cijk_Ailk_Bljk_BSS_BH_MT64x32x32_MI16x16x16x1_SE_1LDSB1_AF0EM1_GRVW2_GSU1_LBSPP128_LPB8_LRVW8_NLCA1_PLR2_SU0_SUS0_SRVW4_TT2_16_VAW2_WG32_8_1_WGM1
    SolutionIndex: 21
    SolutionNameMin: Cijk_Ailk_Bljk_BSS_BH_MT64x32x32_MI16x16x16x1_SE_1LDSB1_AF0EM8_GRVW2_GSU1_LBSPP128_LPB8_LRVW8_NLCA1_PLR2_SU0_SUS0_SRVW4_TT2_16_VAW2_WG32_8_1_WGM2
    SolutionIndex: 22
    SolutionNameMin: Cijk_Ailk_Bljk_BSS_BH_MT32x32x32_MI16x16x16x1_SE_1LDSB0_AF0EM4_GRVW8_GSU1_LBSPP128_LPB8_LRVW4_NLCA1_PLR1_SU0_SUS0_SRVW0_TT1_16_VAW2_WG32_8_1_WGM15
    SolutionIndex: 23
    SolutionNameMin: Cijk_Ailk_Bljk_BSS_BH_MT64x64x64_MI32x32x8x1_SE_1LDSB0_AF0EM8_GRVW8_GSU1_LBSPP128_LPB8_LRVW8_NLCA1_PLR9_SU0_SUS0_SRVW4_TT1_32_VAW2_WG64_4_1_WGM1
    SolutionIndex: 24
    SolutionNameMin: Cijk_Ailk_Bljk_BSS_BH_MT64x128x64_MI32x32x8x1_SE_1LDSB0_AF0EM1_GRVW8_GSU3_LBSPP128_LPB8_LRVW8_NLCA1_PLR9_SU0_SUS0_SRVW0_TT1_64_VAW1_WG64_4_1_WGM1
    SolutionIndex: 25
    SolutionNameMin: Cijk_Ailk_Bljk_BSS_BH_MT64x32x32_MI16x16x16x1_SE_1LDSB1_AF0EM8_GRVW2_GSU1_LBSPP128_LPB8_LRVW8_NLCA1_PLR2_SU32_SUS128_SRVW4_TT2_16_VAW2_WG32_8_1_WGM2
    SolutionIndex: 26
    SolutionNameMin: Cijk_Ailk_Bljk_BSS_BH_MT64x128x32_MI32x32x8x1_SE_1LDSB0_AF0EM8_GRVW8_GSU1_LBSPP128_LPB8_LRVW8_NLCA1_PLR5_SU0_SUS0_SRVW4_TT1_64_VAW2_WG64_4_1_WGM1
    SolutionIndex: 27
    SolutionNameMin: Cijk_Ailk_Bljk_BSS_BH_MT64x128x32_MI32x32x8x1_SE_1LDSB0_AF0EM8_GRVW8_GSU1_LBSPP128_LPB8_LRVW8_NLCA1_PLR5_SU0_SUS0_SRVW4_TT1_64_VAW2_WG64_4_1_WGM15
    SolutionIndex: 28
    SolutionNameMin: Cijk_Ailk_Bljk_BSS_BH_MT128x80x32_MI16x16x16x1_SE_1LDSB0_AF0EM4_GRVW2_GSU1_LBSPP128_LPB4_LRVW4_NLCA1_PLR1_SU0_SUS0_SRVW4_TT2_80_VAW2_WG64_4_1_WGM1
    SolutionIndex: 29
    SolutionNameMin: Cijk_Ailk_Bljk_BSS_BH_MT128x160x32_MI32x32x8x1_SE_1LDSB1_AF0EM8_GRVW2_GSU1_LBSPP128_LPB8_LRVW8_NLCA1_PLR5_SU32_SUS128_SRVW4_TT1_160_VAW2_WG128_2_1_WGM2
    SolutionIndex: 30
    SolutionNameMin: Cijk_Ailk_Bljk_BSS_BH_MT64x32x32_MI16x16x16x1_SE_1LDSB0_AF0EM8_GRVW8_GSU1_LBSPP128_LPB8_LRVW8_NLCA1_PLR2_SU0_SUS0_SRVW4_TT2_16_VAW2_WG32_8_1_WGM2
    SolutionIndex: 31
    SolutionNameMin: Cijk_Ailk_Bljk_BSS_BH_MT32x32x32_MI16x16x16x1_SE_1LDSB0_AF0EM4_GRVW2_GSU1_LBSPP128_LPB4_LRVW4_NLCA1_PLR1_SU0_SUS0_SRVW0_TT1_16_VAW2_WG32_8_1_WGM15
    SolutionIndex: 32
    SolutionNameMin: Cijk_Ailk_Bljk_BSS_BH_MT256x160x32_MI32x32x8x1_SE_1LDSB0_AF0EM8_GRVW4_GSU5_LBSPP128_LPB8_LRVW8_NLCA1_PLR5_SU0_SUS0_SRVW0_TT2_160_VAW1_WG128_2_1_WGM15
    SolutionIndex: 33
    SolutionNameMin: Cijk_Ailk_Bljk_BSS_BH_MT128x96x32_MI32x32x8x1_SE_1LDSB0_AF0EM4_GRVW4_GSU1_LBSPP128_LPB4_LRVW4_NLCA1_PLR1_SU0_SUS0_SRVW4_TT1_96_VAW2_WG128_2_1_WGM2
    SolutionIndex: 34
    SolutionNameMin: Cijk_Ailk_Bljk_BSS_BH_MT128x96x32_MI32x32x8x1_SE_1LDSB1_AF0EM8_GRVW2_GSU1_LBSPP128_LPB8_LRVW8_NLCA1_PLR5_SU32_SUS128_SRVW4_TT1_96_VAW2_WG128_2_1_WGM15
    SolutionIndex: 35
    SolutionNameMin: Cijk_Ailk_Bljk_BSS_BH_MT64x128x64_MI32x32x8x1_SE_1LDSB0_AF0EM8_GRVW8_GSU1_LBSPP128_LPB8_LRVW8_NLCA1_PLR9_SU0_SUS0_SRVW4_TT1_64_VAW2_WG64_4_1_WGM2
    SolutionIndex: 36
    SolutionNameMin: Cijk_Ailk_Bljk_BSS_BH_MT32x32x128_MI16x16x16x1_SE_1LDSB0_AF0EM4_GRVW8_GSU1_LBSPP256_LPB8_LRVW4_NLCA1_PLR1_SU0_SUS0_SRVW0_TT1_16_VAW2_WG32_8_1_WGM2
    SolutionIndex: 37
    SolutionNameMin: Cijk_Ailk_Bljk_BSS_BH_MT256x128x32_MI32x32x8x1_SE_1LDSB1_AF0EM8_GRVW8_GSU15_LBSPP128_LPB8_LRVW8_NLCA1_PLR5_SU0_SUS0_SRVW0_TT4_64_VAW1_WG64_4_1_WGM1
    SolutionIndex: 38
    SolutionNameMin: Cijk_Ailk_Bljk_BSS_BH_MT128x160x64_MI32x32x8x1_SE_1LDSB1_AF0EM8_GRVW2_GSU1_LBSPP128_LPB8_LRVW8_NLCA1_PLR9_SU32_SUS128_SRVW4_TT1_160_VAW2_WG128_2_1_WGM1
    SolutionIndex: 39
    SolutionNameMin: Cijk_Ailk_Bljk_BSS_BH_MT128x160x32_MI32x32x8x1_SE_1LDSB1_AF0EM8_GRVW2_GSU1_LBSPP128_LPB8_LRVW8_NLCA1_PLR5_SU32_SUS256_SRVW4_TT1_160_VAW2_WG128_2_1_WGM1
    SolutionIndex: 40
    SolutionNameMin: Cijk_Ailk_Bljk_BSS_BH_MT32x32x32_MI16x16x16x1_SE_1LDSB0_AF0EM4_GRVW2_GSU1_LBSPP128_LPB4_LRVW4_NLCA1_PLR1_SU0_SUS0_SRVW0_TT1_16_VAW2_WG32_8_1_WGM1
    SolutionIndex: 41
    SolutionNameMin: Cijk_Ailk_Bljk_BSS_BH_MT128x96x32_MI32x32x8x1_SE_1LDSB0_AF0EM8_GRVW4_GSU1_LBSPP128_LPB8_LRVW8_NLCA1_PLR5_SU0_SUS0_SRVW4_TT1_96_VAW2_WG128_2_1_WGM2
    SolutionIndex: 42
    SolutionNameMin: Cijk_Ailk_Bljk_BSS_BH_MT64x80x64_MI16x16x16x1_SE_1LDSB0_AF0EM4_GRVW2_GSU1_LBSPP128_LPB4_LRVW4_NLCA1_PLR1_SU16_SUS256_SRVW0_TT1_80_VAW2_WG64_4_1_WGM15
    SolutionIndex: 43
    SolutionNameMin: Cijk_Ailk_Bljk_BSS_BH_MT256x160x32_MI32x32x8x1_SE_1LDSB0_AF0EM8_GRVW4_GSU7_LBSPP128_LPB8_LRVW8_NLCA1_PLR5_SU0_SUS0_SRVW0_TT2_160_VAW1_WG128_2_1_WGM2
    SolutionIndex: 44
    SolutionNameMin: Cijk_Ailk_Bljk_BSS_BH_MT128x96x64_MI32x32x8x1_SE_1LDSB0_AF0EM4_GRVW8_GSU1_LBSPP128_LPB8_LRVW4_NLCA1_PLR1_SU16_SUS128_SRVW4_TT1_96_VAW2_WG128_2_1_WGM15
    SolutionIndex: 45
    SolutionNameMin: Cijk_Ailk_Bljk_BSS_BH_MT32x32x128_MI16x16x16x1_SE_1LDSB0_AF0EM4_GRVW8_GSU1_LBSPP256_LPB8_LRVW4_NLCA1_PLR1_SU0_SUS0_SRVW0_TT1_16_VAW2_WG32_8_1_WGM1
    SolutionIndex: 46
    SolutionNameMin: Cijk_Ailk_Bljk_BSS_BH_MT64x80x64_MI16x16x16x1_SE_1LDSB0_AF0EM4_GRVW2_GSU1_LBSPP128_LPB4_LRVW4_NLCA1_PLR1_SU16_SUS128_SRVW0_TT1_80_VAW2_WG64_4_1_WGM2
    SolutionIndex: 47
    SolutionNameMin: Cijk_Ailk_Bljk_BSS_BH_MT128x256x32_MI32x32x8x1_SE_1LDSB0_AF0EM4_GRVW8_GSU1_LBSPP128_LPB8_LRVW4_NLCA1_PLR1_SU16_SUS256_SRVW4_TT2_128_VAW2_WG64_4_1_WGM15
    SolutionIndex: 48
    SolutionNameMin: Cijk_Ailk_Bljk_BSS_BH_MT256x128x32_MI32x32x8x1_SE_1LDSB0_AF0EM4_GRVW8_GSU1_LBSPP128_LPB8_LRVW4_NLCA1_PLR1_SU0_SUS0_SRVW0_TT4_64_VAW2_WG64_4_1_WGM15
    SolutionIndex: 49
    SolutionNameMin: Cijk_Ailk_Bljk_BSS_BH_MT32x64x128_MI16x16x16x1_SE_1LDSB0_AF0EM4_GRVW8_GSU1_LBSPP256_LPB8_LRVW4_NLCA1_PLR1_SU32_SUS256_SRVW0_TT1_32_VAW2_WG32_8_1_WGM1
    SolutionIndex: 50
    SolutionNameMin: Cijk_Ailk_Bljk_BSS_BH_MT128x96x32_MI32x32x8x1_SE_1LDSB1_AF0EM1_GRVW2_GSU1_LBSPP128_LPB8_LRVW8_NLCA1_PLR5_SU0_SUS0_SRVW4_TT1_96_VAW2_WG128_2_1_WGM2
    SolutionIndex: 51
    SolutionNameMin: Cijk_Ailk_Bljk_BSS_BH_MT128x144x32_MI16x16x16x1_SE_1LDSB1_AF0EM8_GRVW2_GSU1_LBSPP128_LPB8_LRVW8_NLCA1_PLR2_SU0_SUS0_SRVW4_TT2_144_VAW2_WG64_4_1_WGM1
    SolutionIndex: 52
    SolutionNameMin: Cijk_Ailk_Bljk_BSS_BH_MT32x32x32_MI16x16x16x1_SE_1LDSB0_AF0EM4_GRVW8_GSU1_LBSPP128_LPB8_LRVW4_NLCA1_PLR1_SU0_SUS0_SRVW0_TT1_16_VAW2_WG32_8_1_WGM1
    SolutionIndex: 53
    SolutionNameMin: Cijk_Ailk_Bljk_BSS_BH_MT256x160x32_MI32x32x8x1_SE_1LDSB0_AF0EM8_GRVW4_GSU2_LBSPP128_LPB8_LRVW8_NLCA1_PLR5_SU32_SUS128_SRVW0_TT2_160_VAW1_WG128_2_1_WGM15
    SolutionIndex: 54
    SolutionNameMin: Cijk_Ailk_Bljk_BSS_BH_MT64x32x32_MI16x16x16x1_SE_1LDSB1_AF0EM8_GRVW2_GSU1_LBSPP128_LPB8_LRVW8_NLCA1_PLR2_SU32_SUS128_SRVW4_TT2_16_VAW2_WG32_8_1_WGM1
    SolutionIndex: 55
    SolutionNameMin: Cijk_Ailk_Bljk_BSS_BH_MT256x160x32_MI32x32x8x1_SE_1LDSB0_AF0EM8_GRVW4_GSU1_LBSPP128_LPB8_LRVW8_NLCA1_PLR5_SU0_SUS0_SRVW4_TT2_160_VAW2_WG128_2_1_WGM2
    SolutionIndex: 56
    SolutionNameMin: Cijk_Ailk_Bljk_BSS_BH_MT128x160x32_MI32x32x8x1_SE_1LDSB1_AF0EM8_GRVW2_GSU1_LBSPP128_LPB8_LRVW8_NLCA1_PLR5_SU0_SUS0_SRVW4_TT1_160_VAW2_WG128_2_1_WGM2
    SolutionIndex: 57
    SolutionNameMin: Cijk_Ailk_Bljk_BSS_BH_MT256x160x32_MI32x32x8x1_SE_1LDSB0_AF0EM8_GRVW4_GSU2_LBSPP128_LPB8_LRVW8_NLCA1_PLR5_SU0_SUS0_SRVW0_TT2_160_VAW1_WG128_2_1_WGM15
    SolutionIndex: 58
    SolutionNameMin: Cijk_Ailk_Bljk_BSS_BH_MT256x160x32_MI32x32x8x1_SE_1LDSB0_AF0EM8_GRVW4_GSU3_LBSPP128_LPB8_LRVW8_NLCA1_PLR5_SU0_SUS0_SRVW0_TT2_160_VAW1_WG128_2_1_WGM15
    SolutionIndex: 59
    SolutionNameMin: Cijk_Ailk_Bljk_BSS_BH_MT128x96x32_MI32x32x8x1_SE_1LDSB1_AF0EM1_GRVW2_GSU1_LBSPP128_LPB8_LRVW8_NLCA1_PLR5_SU0_SUS0_SRVW4_TT1_96_VAW2_WG128_2_1_WGM1
    SolutionIndex: 60
    SolutionNameMin: Cijk_Ailk_Bljk_BSS_BH_MT64x32x32_MI16x16x16x1_SE_1LDSB1_AF0EM8_GRVW2_GSU1_LBSPP128_LPB8_LRVW8_NLCA1_PLR2_SU0_SUS0_SRVW4_TT2_16_VAW2_WG32_8_1_WGM15
    SolutionIndex: 61
    SolutionNameMin: Cijk_Ailk_Bljk_BSS_BH_MT32x64x32_MI16x16x16x1_SE_1LDSB1_AF0EM8_GRVW2_GSU1_LBSPP128_LPB8_LRVW8_NLCA1_PLR2_SU0_SUS0_SRVW4_TT1_32_VAW2_WG32_8_1_WGM15
    SolutionIndex: 62
    SolutionNameMin: Cijk_Ailk_Bljk_BSS_BH_MT32x32x64_MI16x16x16x1_SE_1LDSB0_AF0EM8_GRVW8_GSU1_LBSPP128_LPB8_LRVW8_NLCA1_PLR5_SU32_SUS128_SRVW4_TT1_16_VAW2_WG32_8_1_WGM1
    SolutionIndex: 63
    SolutionNameMin: Cijk_Ailk_Bljk_BSS_BH_MT32x32x64_MI16x16x16x1_SE_1LDSB0_AF0EM8_GRVW8_GSU1_LBSPP128_LPB8_LRVW8_NLCA1_PLR5_SU0_SUS0_SRVW4_TT1_16_VAW2_WG32_8_1_WGM2
    SolutionIndex: 64
    SolutionNameMin: Cijk_Ailk_Bljk_BSS_BH_MT32x32x128_MI16x16x16x1_SE_1LDSB0_AF0EM1_GRVW8_GSU1_LBSPP256_LPB8_LRVW4_NLCA1_PLR1_SU16_SUS256_SRVW0_TT1_16_VAW2_WG32_8_1_WGM1
    SolutionIndex: 65
    SolutionNameMin: Cijk_Ailk_Bljk_BSS_BH_MT32x32x32_MI16x16x16x1_SE_1LDSB0_AF0EM4_GRVW4_GSU1_LBSPP128_LPB4_LRVW4_NLCA1_PLR1_SU0_SUS0_SRVW0_TT1_16_VAW2_WG32_8_1_WGM1
    SolutionIndex: 66
    SolutionNameMin: Cijk_Ailk_Bljk_BSS_BH_MT64x128x64_MI32x32x8x1_SE_1LDSB0_AF0EM8_GRVW8_GSU1_LBSPP128_LPB8_LRVW8_NLCA1_PLR9_SU0_SUS0_SRVW4_TT1_64_VAW2_WG64_4_1_WGM15
    SolutionIndex: 67
    SolutionNameMin: Cijk_Ailk_Bljk_BSS_BH_MT32x32x128_MI16x16x16x1_SE_1LDSB0_AF0EM1_GRVW8_GSU1_LBSPP256_LPB8_LRVW4_NLCA1_PLR1_SU0_SUS0_SRVW0_TT1_16_VAW2_WG32_8_1_WGM15
    SolutionIndex: 68
    SolutionNameMin: Cijk_Ailk_Bljk_BSS_BH_MT256x256x32_MI32x32x8x1_SE_1LDSB1_AF0EM8_GRVW8_GSU3_LBSPP128_LPB8_LRVW8_NLCA1_PLR5_SU32_SUS128_SRVW0_TT4_128_VAW1_WG64_4_1_WGM1
    SolutionIndex: 69
    SolutionNameMin: Cijk_Ailk_Bljk_BSS_BH_MT256x256x32_MI32x32x8x1_SE_1LDSB1_AF0EM8_GRVW8_GSU3_LBSPP128_LPB8_LRVW8_NLCA1_PLR5_SU0_SUS0_SRVW0_TT4_128_VAW1_WG64_4_1_WGM15
    SolutionIndex: 70
    SolutionNameMin: Cijk_Ailk_Bljk_BSS_BH_MT64x64x64_MI32x32x8x1_SE_1LDSB0_AF0EM1_GRVW2_GSU1_LBSPP128_LPB4_LRVW4_NLCA1_PLR1_SU32_SUS256_SRVW0_TT1_32_VAW2_WG64_4_1_WGM15
    SolutionIndex: 71
    SolutionNameMin: Cijk_Ailk_Bljk_BSS_BH_MT64x32x32_MI16x16x16x1_SE_1LDSB0_AF0EM4_GRVW2_GSU1_LBSPP128_LPB4_LRVW4_NLCA1_PLR1_SU0_SUS0_SRVW0_TT2_16_VAW2_WG32_8_1_WGM1
    SolutionIndex: 72
    SolutionNameMin: Cijk_Ailk_Bljk_BSS_BH_MT32x64x128_MI16x16x16x1_SE_1LDSB0_AF0EM4_GRVW8_GSU1_LBSPP256_LPB8_LRVW4_NLCA1_PLR1_SU16_SUS256_SRVW0_TT1_32_VAW2_WG32_8_1_WGM15
    SolutionIndex: 73
    SolutionNameMin: Cijk_Ailk_Bljk_BSS_BH_MT32x32x64_MI16x16x16x1_SE_1LDSB0_AF0EM8_GRVW8_GSU1_LBSPP128_LPB8_LRVW8_NLCA1_PLR5_SU32_SUS256_SRVW4_TT1_16_VAW2_WG32_8_1_WGM15
    SolutionIndex: 74
    SolutionNameMin: Cijk_Ailk_Bljk_BSS_BH_MT64x128x32_MI32x32x8x1_SE_1LDSB0_AF0EM4_GRVW4_GSU1_LBSPP128_LPB4_LRVW4_NLCA1_PLR1_SU0_SUS0_SRVW4_TT1_64_VAW2_WG64_4_1_WGM2
    SolutionIndex: 75
    SolutionNameMin: Cijk_Ailk_Bljk_BSS_BH_MT128x80x32_MI16x16x16x1_SE_1LDSB0_AF0EM4_GRVW2_GSU1_LBSPP128_LPB4_LRVW4_NLCA1_PLR1_SU16_SUS256_SRVW0_TT2_80_VAW2_WG64_4_1_WGM1
    SolutionIndex: 76
    SolutionNameMin: Cijk_Ailk_Bljk_BSS_BH_MT128x96x32_MI32x32x8x1_SE_1LDSB0_AF0EM8_GRVW4_GSU1_LBSPP128_LPB8_LRVW8_NLCA1_PLR5_SU0_SUS0_SRVW4_TT1_96_VAW2_WG128_2_1_WGM15
    SolutionIndex: 77
    SolutionNameMin: Cijk_Ailk_Bljk_BSS_BH_MT64x128x32_MI32x32x8x1_SE_1LDSB0_AF0EM8_GRVW8_GSU1_LBSPP128_LPB8_LRVW8_NLCA1_PLR5_SU32_SUS128_SRVW4_TT1_64_VAW2_WG64_4_1_WGM1
    SolutionIndex: 78
    SolutionNameMin: Cijk_Ailk_Bljk_BSS_BH_MT128x96x32_MI32x32x8x1_SE_1LDSB1_AF0EM8_GRVW2_GSU1_LBSPP128_LPB8_LRVW8_NLCA1_PLR5_SU0_SUS0_SRVW4_TT1_96_VAW2_WG128_2_1_WGM2
    SolutionIndex: 79
    SolutionNameMin: Cijk_Ailk_Bljk_BSS_BH_MT128x96x32_MI32x32x8x1_SE_1LDSB1_AF0EM8_GRVW2_GSU1_LBSPP128_LPB8_LRVW8_NLCA1_PLR5_SU0_SUS0_SRVW4_TT1_96_VAW2_WG128_2_1_WGM1
    SolutionIndex: 80
    SolutionNameMin: Cijk_Ailk_Bljk_BSS_BH_MT128x160x32_MI32x32x8x1_SE_1LDSB0_AF0EM1_GRVW4_GSU1_LBSPP128_LPB4_LRVW4_NLCA1_PLR1_SU16_SUS256_SRVW4_TT1_160_VAW2_WG128_2_1_WGM15
    SolutionIndex: 81
    SolutionNameMin: Cijk_Ailk_Bljk_BSS_BH_MT256x160x32_MI32x32x8x1_SE_1LDSB0_AF0EM8_GRVW4_GSU1_LBSPP128_LPB8_LRVW8_NLCA1_PLR5_SU32_SUS256_SRVW4_TT2_160_VAW2_WG128_2_1_WGM15
    SolutionIndex: 82
    SolutionNameMin: Cijk_Ailk_Bljk_BSS_BH_MT256x160x32_MI32x32x8x1_SE_1LDSB0_AF0EM8_GRVW4_GSU1_LBSPP128_LPB8_LRVW8_NLCA1_PLR5_SU0_SUS0_SRVW4_TT2_160_VAW2_WG128_2_1_WGM15
    SolutionIndex: 83
    SolutionNameMin: Cijk_Ailk_Bljk_BSS_BH_MT96x128x32_MI32x32x8x1_SE_1LDSB0_AF0EM8_GRVW4_GSU1_LBSPP128_LPB8_LRVW8_NLCA3_PLR5_SU32_SUS128_SRVW0_TT3_32_VAW2_WG32_8_1_WGM15
    SolutionIndex: 84
    SolutionNameMin: Cijk_Ailk_Bljk_BSS_BH_MT256x128x32_MI32x32x8x1_SE_1LDSB1_AF0EM8_GRVW8_GSU2_LBSPP128_LPB8_LRVW8_NLCA1_PLR5_SU0_SUS0_SRVW0_TT4_64_VAW1_WG64_4_1_WGM15
    SolutionIndex: 85
    SolutionNameMin: Cijk_Ailk_Bljk_BSS_BH_MT64x128x64_MI32x32x8x1_SE_1LDSB0_AF0EM1_GRVW8_GSU1_LBSPP128_LPB8_LRVW8_NLCA1_PLR9_SU32_SUS256_SRVW4_TT1_64_VAW2_WG64_4_1_WGM2
    SolutionIndex: 86
    SolutionNameMin: Cijk_Ailk_Bljk_BSS_BH_MT256x128x32_MI32x32x8x1_SE_1LDSB0_AF0EM1_GRVW8_GSU1_LBSPP128_LPB8_LRVW4_NLCA1_PLR1_SU0_SUS0_SRVW0_TT4_64_VAW2_WG64_4_1_WGM15
    SolutionIndex: 87
    SolutionNameMin: Cijk_Ailk_Bljk_BSS_BH_MT64x128x32_MI32x32x8x1_SE_1LDSB0_AF0EM8_GRVW8_GSU1_LBSPP128_LPB8_LRVW8_NLCA1_PLR5_SU32_SUS128_SRVW4_TT1_64_VAW2_WG64_4_1_WGM2
    SolutionIndex: 88
    SolutionNameMin: Cijk_Ailk_Bljk_BSS_BH_MT64x64x32_MI32x32x8x1_SE_1LDSB0_AF0EM8_GRVW8_GSU1_LBSPP128_LPB8_LRVW8_NLCA1_PLR5_SU0_SUS0_SRVW4_TT1_32_VAW2_WG64_4_1_WGM1
    SolutionIndex: 89
    SolutionNameMin: Cijk_Ailk_Bljk_BSS_BH_MT64x32x32_MI16x16x16x1_SE_1LDSB0_AF0EM8_GRVW8_GSU1_LBSPP128_LPB8_LRVW8_NLCA1_PLR2_SU0_SUS0_SRVW4_TT2_16_VAW2_WG32_8_1_WGM1
    SolutionIndex: 90
    SolutionNameMin: Cijk_Ailk_Bljk_BSS_BH_MT256x128x32_MI32x32x8x1_SE_1LDSB0_AF0EM8_GRVW8_GSU2_LBSPP128_LPB8_LRVW8_NLCA1_PLR5_SU0_SUS0_SRVW0_TT4_64_VAW1_WG64_4_1_WGM2
    SolutionIndex: 91
    SolutionNameMin: Cijk_Ailk_Bljk_BSS_BH_MT64x32x32_MI16x16x16x1_SE_1LDSB1_AF0EM8_GRVW2_GSU1_LBSPP128_LPB8_LRVW8_NLCA1_PLR2_SU32_SUS256_SRVW4_TT2_16_VAW2_WG32_8_1_WGM2
    SolutionIndex: 92
    SolutionNameMin: Cijk_Ailk_Bljk_BSS_BH_MT64x128x32_MI32x32x8x1_SE_1LDSB0_AF0EM4_GRVW2_GSU1_LBSPP128_LPB4_LRVW4_NLCA1_PLR1_SU16_SUS128_SRVW4_TT1_64_VAW2_WG64_4_1_WGM15
    SolutionIndex: 93
    SolutionNameMin: Cijk_Ailk_Bljk_BSS_BH_MT64x128x64_MI32x32x8x1_SE_1LDSB0_AF0EM8_GRVW8_GSU1_LBSPP128_LPB8_LRVW8_NLCA1_PLR9_SU0_SUS0_SRVW4_TT1_64_VAW2_WG64_4_1_WGM1
    SolutionIndex: 94
    SolutionNameMin: Cijk_Ailk_Bljk_BSS_BH_MT128x160x32_MI32x32x8x1_SE_1LDSB1_AF0EM8_GRVW2_GSU1_LBSPP128_LPB8_LRVW8_NLCA1_PLR5_SU32_SUS256_SRVW4_TT1_160_VAW2_WG128_2_1_WGM15
    SolutionIndex: 95
    SolutionNameMin: Cijk_Ailk_Bljk_BSS_BH_MT64x128x32_MI32x32x8x1_SE_1LDSB0_AF0EM8_GRVW8_GSU1_LBSPP128_LPB8_LRVW8_NLCA1_PLR5_SU0_SUS0_SRVW4_TT1_64_VAW2_WG64_4_1_WGM2
    SolutionIndex: 96
    SolutionNameMin: Cijk_Ailk_Bljk_BSS_BH_MT32x64x128_MI16x16x16x1_SE_1LDSB0_AF0EM4_GRVW8_GSU1_LBSPP256_LPB8_LRVW4_NLCA1_PLR1_SU16_SUS256_SRVW0_TT1_32_VAW2_WG32_8_1_WGM1
    SolutionIndex: 97
    SolutionNameMin: Cijk_Ailk_Bljk_BSS_BH_MT64x32x32_MI16x16x16x1_SE_1LDSB0_AF0EM4_GRVW4_GSU1_LBSPP128_LPB4_LRVW4_NLCA1_PLR1_SU0_SUS0_SRVW0_TT2_16_VAW2_WG32_8_1_WGM2
    SolutionIndex: 98
    SolutionNameMin: Cijk_Ailk_Bljk_BSS_BH_MT128x96x64_MI32x32x8x1_SE_1LDSB0_AF0EM8_GRVW8_GSU2_LBSPP128_LPB8_LRVW8_NLCA1_PLR9_SU32_SUS256_SRVW0_TT1_96_VAW1_WG128_2_1_WGM1
    SolutionIndex: 99
    SolutionNameMin: Cijk_Ailk_Bljk_BSS_BH_MT128x256x32_MI32x32x8x1_SE_1LDSB0_AF0EM1_GRVW8_GSU1_LBSPP128_LPB8_LRVW4_NLCA1_PLR1_SU16_SUS128_SRVW4_TT2_128_VAW2_WG64_4_1_WGM2
    SolutionIndex: 100
    SolutionNameMin: Cijk_Ailk_Bljk_BSS_BH_MT64x128x32_MI32x32x8x1_SE_1LDSB0_AF0EM1_GRVW8_GSU1_LBSPP128_LPB8_LRVW8_NLCA1_PLR5_SU0_SUS0_SRVW4_TT1_64_VAW2_WG64_4_1_WGM1
    SolutionIndex: 101
    SolutionNameMin: Cijk_Ailk_Bljk_BSS_BH_MT64x128x64_MI32x32x8x1_SE_1LDSB0_AF0EM1_GRVW8_GSU1_LBSPP128_LPB8_LRVW8_NLCA1_PLR9_SU0_SUS0_SRVW4_TT1_64_VAW2_WG64_4_1_WGM15
    SolutionIndex: 102
    SolutionNameMin: Cijk_Ailk_Bljk_BSS_BH_MT128x96x32_MI32x32x8x1_SE_1LDSB0_AF0EM4_GRVW2_GSU1_LBSPP128_LPB4_LRVW4_NLCA1_PLR1_SU0_SUS0_SRVW4_TT1_96_VAW2_WG128_2_1_WGM2
    SolutionIndex: 103
    SolutionNameMin: Cijk_Ailk_Bljk_BSS_BH_MT64x128x32_MI32x32x8x1_SE_1LDSB0_AF0EM1_GRVW8_GSU1_LBSPP128_LPB8_LRVW8_NLCA1_PLR5_SU0_SUS0_SRVW4_TT1_64_VAW2_WG64_4_1_WGM15
    SolutionIndex: 104
    SolutionNameMin: Cijk_Ailk_Bljk_BSS_BH_MT64x32x32_MI16x16x16x1_SE_1LDSB0_AF0EM1_GRVW8_GSU1_LBSPP128_LPB8_LRVW8_NLCA1_PLR2_SU0_SUS0_SRVW4_TT2_16_VAW2_WG32_8_1_WGM1
    SolutionIndex: 105
    SolutionNameMin: Cijk_Ailk_Bljk_BSS_BH_MT64x64x32_MI32x32x8x1_SE_1LDSB0_AF0EM1_GRVW8_GSU1_LBSPP128_LPB8_LRVW8_NLCA1_PLR5_SU0_SUS0_SRVW4_TT1_32_VAW2_WG64_4_1_WGM1
    SolutionIndex: 106
    SolutionNameMin: Cijk_Ailk_Bljk_BSS_BH_MT64x64x32_MI32x32x8x1_SE_1LDSB0_AF0EM1_GRVW8_GSU1_LBSPP128_LPB8_LRVW4_NLCA1_PLR1_SU0_SUS0_SRVW4_TT1_32_VAW2_WG64_4_1_WGM1
    SolutionIndex: 107
    SolutionNameMin: Cijk_Ailk_Bljk_BSS_BH_MT128x160x32_MI32x32x8x1_SE_1LDSB1_AF0EM1_GRVW2_GSU1_LBSPP128_LPB8_LRVW8_NLCA1_PLR5_SU0_SUS0_SRVW4_TT1_160_VAW2_WG128_2_1_WGM2
    SolutionIndex: 108
    SolutionNameMin: Cijk_Ailk_Bljk_BSS_BH_MT128x96x32_MI32x32x8x1_SE_1LDSB0_AF0EM1_GRVW4_GSU1_LBSPP128_LPB8_LRVW8_NLCA1_PLR5_SU0_SUS0_SRVW4_TT1_96_VAW2_WG128_2_1_WGM1
    SolutionIndex: 109
    SolutionNameMin: Cijk_Ailk_Bljk_BSS_BH_MT128x96x32_MI32x32x8x1_SE_1LDSB0_AF0EM1_GRVW4_GSU1_LBSPP128_LPB8_LRVW8_NLCA1_PLR5_SU0_SUS0_SRVW4_TT1_96_VAW2_WG128_2_1_WGM15
    SolutionIndex: 110
    SolutionNameMin: Cijk_Ailk_Bljk_BSS_BH_MT32x64x64_MI16x16x16x1_SE_1LDSB0_AF0EM1_GRVW8_GSU7_LBSPP128_LPB8_LRVW8_NLCA1_PLR5_SU0_SUS0_SRVW0_TT1_32_VAW1_WG32_8_1_WGM2
    SolutionIndex: 111
    SolutionNameMin: Cijk_Ailk_Bljk_BSS_BH_MT256x128x32_MI32x32x4x2_SE_1LDSB0_AF0EM4_GRVW8_GSU1_LBSPP128_LPB8_LRVW4_NLCA1_PLR1_SU0_SUS0_SRVW0_TT2_64_VAW2_WG128_2_1_WGM1
    SolutionIndex: 112
    SolutionNameMin: Cijk_Ailk_Bljk_BSS_BH_MT256x128x32_MI32x32x4x2_SE_1LDSB0_AF0EM4_GRVW8_GSU1_LBSPP128_LPB8_LRVW4_NLCA1_PLR1_SU16_SUS128_SRVW0_TT2_64_VAW2_WG128_2_1_WGM15
    SolutionIndex: 113
    SolutionNameMin: Cijk_Ailk_Bljk_BSS_BH_MT64x128x32_MI32x32x8x1_SE_1LDSB0_AF0EM1_GRVW4_GSU1_LBSPP128_LPB8_LRVW8_NLCA1_PLR5_SU0_SUS0_SRVW4_TT1_64_VAW2_WG64_4_1_WGM2
    SolutionIndex: 114
    SolutionNameMin: Cijk_Ailk_Bljk_BSS_BH_MT32x32x64_MI16x16x16x1_SE_1LDSB0_AF0EM4_GRVW4_GSU1_LBSPP128_LPB4_LRVW4_NLCA1_PLR1_SU0_SUS0_SRVW0_TT1_16_VAW2_WG32_8_1_WGM15
    SolutionIndex: 115
    SolutionNameMin: Cijk_Ailk_Bljk_BSS_BH_MT64x32x128_MI16x16x16x1_SE_1LDSB0_AF0EM4_GRVW8_GSU1_LBSPP256_LPB8_LRVW4_NLCA1_PLR1_SU0_SUS0_SRVW0_TT2_16_VAW2_WG32_8_1_WGM15
    SolutionIndex: 116
    SolutionNameMin: Cijk_Ailk_Bljk_BSS_BH_MT32x32x32_MI16x16x16x1_SE_1LDSB0_AF0EM8_GRVW4_GSU1_LBSPP128_LPB8_LRVW8_NLCA1_PLR2_SU0_SUS0_SRVW4_TT1_16_VAW2_WG32_8_1_WGM1
    SolutionIndex: 117
    SolutionNameMin: Cijk_Ailk_Bljk_BSS_BH_MT32x64x64_MI16x16x16x1_SE_1LDSB0_AF0EM8_GRVW8_GSU1_LBSPP128_LPB8_LRVW8_NLCA1_PLR5_SU0_SUS0_SRVW4_TT1_32_VAW2_WG32_8_1_WGM2
    SolutionIndex: 118
    SolutionNameMin: Cijk_Ailk_Bljk_BSS_BH_MT32x32x128_MI16x16x16x1_SE_1LDSB0_AF0EM4_GRVW8_GSU1_LBSPP256_LPB8_LRVW4_NLCA1_PLR1_SU32_SUS256_SRVW0_TT1_16_VAW2_WG32_8_1_WGM2
    SolutionIndex: 119
    SolutionNameMin: Cijk_Ailk_Bljk_BSS_BH_MT64x32x64_MI16x16x16x1_SE_1LDSB0_AF0EM8_GRVW8_GSU7_LBSPP128_LPB8_LRVW8_NLCA1_PLR5_SU0_SUS0_SRVW0_TT2_16_VAW1_WG32_8_1_WGM1
    SolutionIndex: 120
    SolutionNameMin: Cijk_Ailk_Bljk_BSS_BH_MT32x32x128_MI16x16x16x1_SE_1LDSB0_AF0EM4_GRVW8_GSU1_LBSPP256_LPB8_LRVW4_NLCA1_PLR1_SU32_SUS256_SRVW0_TT1_16_VAW2_WG32_8_1_WGM1
    SolutionIndex: 121
    SolutionNameMin: Cijk_Ailk_Bljk_BSS_BH_MT64x64x64_MI32x32x8x1_SE_1LDSB0_AF0EM8_GRVW8_GSU1_LBSPP128_LPB8_LRVW8_NLCA1_PLR9_SU32_SUS256_SRVW4_TT1_32_VAW2_WG64_4_1_WGM15
    SolutionIndex: 122
    SolutionNameMin: Cijk_Ailk_Bljk_BSS_BH_MT32x64x128_MI16x16x16x1_SE_1LDSB0_AF0EM4_GRVW8_GSU1_LBSPP256_LPB8_LRVW4_NLCA1_PLR1_SU16_SUS256_SRVW0_TT1_32_VAW2_WG32_8_1_WGM2
    SolutionIndex: 123
    SolutionNameMin: Cijk_Ailk_Bljk_BSS_BH_MT32x32x128_MI16x16x16x1_SE_1LDSB0_AF0EM4_GRVW8_GSU1_LBSPP256_LPB8_LRVW4_NLCA1_PLR1_SU16_SUS256_SRVW0_TT1_16_VAW2_WG32_8_1_WGM2
    SolutionIndex: 124
    SolutionNameMin: Cijk_Ailk_Bljk_BSS_BH_MT64x128x64_MI32x32x8x1_SE_1LDSB0_AF0EM4_GRVW8_GSU1_LBSPP128_LPB8_LRVW4_NLCA1_PLR1_SU16_SUS128_SRVW4_TT1_64_VAW2_WG64_4_1_WGM1
    SolutionIndex: 125
    SolutionNameMin: Cijk_Ailk_Bljk_BSS_BH_MT96x96x32_MI16x16x16x1_SE_1LDSB1_AF0EM8_GRVW4_GSU1_LBSPP128_LPB8_LRVW8_NLCA3_PLR2_SU0_SUS0_SRVW0_TT3_48_VAW2_WG32_8_1_WGM1
    SolutionIndex: 126
    SolutionNameMin: Cijk_Ailk_Bljk_BSS_BH_MT128x96x32_MI32x32x8x1_SE_1LDSB0_AF0EM4_GRVW4_GSU1_LBSPP128_LPB4_LRVW4_NLCA1_PLR1_SU32_SUS256_SRVW4_TT1_96_VAW2_WG128_2_1_WGM1
    SolutionIndex: 127
    SolutionNameMin: Cijk_Ailk_Bljk_BSS_BH_MT128x160x32_MI32x32x8x1_SE_1LDSB0_AF0EM4_GRVW4_GSU1_LBSPP128_LPB4_LRVW4_NLCA1_PLR1_SU32_SUS128_SRVW4_TT1_160_VAW2_WG128_2_1_WGM2
    SolutionIndex: 128
    SolutionNameMin: Cijk_Ailk_Bljk_BSS_BH_MT128x160x32_MI32x32x8x1_SE_1LDSB0_AF0EM4_GRVW4_GSU1_LBSPP128_LPB4_LRVW4_NLCA1_PLR1_SU16_SUS128_SRVW4_TT1_160_VAW2_WG128_2_1_WGM2
    SolutionIndex: 129
    SolutionNameMin: Cijk_Ailk_Bljk_BSS_BH_MT128x256x32_MI32x32x8x1_SE_1LDSB0_AF0EM8_GRVW8_GSU1_LBSPP128_LPB8_LRVW8_NLCA1_PLR5_SU32_SUS128_SRVW4_TT2_128_VAW2_WG64_4_1_WGM15
    SolutionIndex: 130
    SolutionNameMin: Cijk_Ailk_Bljk_BSS_BH_MT128x256x32_MI32x32x8x1_SE_1LDSB1_AF0EM8_GRVW8_GSU1_LBSPP128_LPB8_LRVW8_NLCA1_PLR5_SU32_SUS128_SRVW4_TT2_128_VAW2_WG64_4_1_WGM2
    SolutionIndex: 131
    SolutionNameMin: Cijk_Ailk_Bljk_BSS_BH_MT128x96x32_MI32x32x8x1_SE_1LDSB1_AF0EM8_GRVW2_GSU1_LBSPP128_LPB8_LRVW8_NLCA1_PLR5_SU32_SUS256_SRVW4_TT1_96_VAW2_WG128_2_1_WGM15
    SolutionIndex: 132
    SolutionNameMin: Cijk_Ailk_Bljk_BSS_BH_MT160x160x64_MI16x16x16x1_SE_1LDSB1_AF0EM8_GRVW8_GSU1_LBSPP128_LPB8_LRVW8_NLCA5_PLR5_SU0_SUS0_SRVW0_TT5_80_VAW2_WG32_8_1_WGM15
    SolutionIndex: 133
    SolutionNameMin: Cijk_Ailk_Bljk_BSS_BH_MT128x256x32_MI32x32x8x1_SE_1LDSB1_AF0EM8_GRVW8_GSU1_LBSPP128_LPB8_LRVW8_NLCA1_PLR5_SU0_SUS0_SRVW4_TT2_128_VAW2_WG64_4_1_WGM1
    SolutionIndex: 134
    SolutionNameMin: Cijk_Ailk_Bljk_BSS_BH_MT128x256x32_MI32x32x8x1_SE_1LDSB0_AF0EM8_GRVW8_GSU1_LBSPP128_LPB8_LRVW8_NLCA1_PLR5_SU0_SUS0_SRVW4_TT2_128_VAW2_WG64_4_1_WGM1
    SolutionIndex: 135
    SolutionNameMin: Cijk_Ailk_Bljk_BSS_BH_MT64x128x64_MI32x32x8x1_SE_1LDSB0_AF0EM1_GRVW8_GSU1_LBSPP128_LPB8_LRVW8_NLCA1_PLR9_SU32_SUS128_SRVW4_TT1_64_VAW2_WG64_4_1_WGM1
    SolutionIndex: 136
    SolutionNameMin: Cijk_Ailk_Bljk_BSS_BH_MT128x256x32_MI32x32x8x1_SE_1LDSB0_AF0EM4_GRVW8_GSU1_LBSPP128_LPB8_LRVW4_NLCA1_PLR1_SU32_SUS256_SRVW4_TT2_128_VAW2_WG64_4_1_WGM1
    SolutionIndex: 137
    SolutionNameMin: Cijk_Ailk_Bljk_BSS_BH_MT128x256x32_MI32x32x8x1_SE_1LDSB0_AF0EM4_GRVW8_GSU1_LBSPP128_LPB8_LRVW4_NLCA1_PLR1_SU32_SUS128_SRVW4_TT2_128_VAW2_WG64_4_1_WGM2
    SolutionIndex: 138
    SolutionNameMin: Cijk_Ailk_Bljk_BSS_BH_MT128x256x32_MI32x32x8x1_SE_1LDSB0_AF0EM8_GRVW8_GSU1_LBSPP128_LPB8_LRVW8_NLCA1_PLR5_SU0_SUS0_SRVW4_TT2_128_VAW2_WG64_4_1_WGM15
    SolutionIndex: 139
    SolutionNameMin: Cijk_Ailk_Bljk_BSS_BH_MT128x128x64_MI32x32x8x1_SE_1LDSB1_AF0EM8_GRVW2_GSU1_LBSPP128_LPB8_LRVW8_NLCA1_PLR9_SU0_SUS0_SRVW4_TT2_64_VAW2_WG64_4_1_WGM1
    SolutionIndex: 140
    SolutionNameMin: Cijk_Ailk_Bljk_BSS_BH_MT128x160x64_MI32x32x8x1_SE_1LDSB1_AF0EM8_GRVW2_GSU1_LBSPP128_LPB8_LRVW8_NLCA1_PLR9_SU0_SUS0_SRVW4_TT1_160_VAW2_WG128_2_1_WGM15
    SolutionIndex: 141
    SolutionNameMin: Cijk_Ailk_Bljk_BSS_BH_MT256x144x32_MI16x16x16x1_SE_1LDSB0_AF0EM4_GRVW2_GSU1_LBSPP128_LPB4_LRVW4_NLCA2_PLR1_SU32_SUS128_SRVW4_TT4_144_VAW2_WG64_4_1_WGM2
    SolutionIndex: 142
    SolutionNameMin: Cijk_Ailk_Bljk_BSS_BH_MT128x256x32_MI32x32x8x1_SE_1LDSB0_AF0EM4_GRVW8_GSU1_LBSPP128_LPB8_LRVW4_NLCA1_PLR1_SU0_SUS0_SRVW4_TT2_128_VAW2_WG64_4_1_WGM1
    SolutionIndex: 143
    SolutionNameMin: Cijk_Ailk_Bljk_BSS_BH_MT128x256x32_MI32x32x8x1_SE_1LDSB0_AF0EM4_GRVW8_GSU1_LBSPP128_LPB8_LRVW4_NLCA1_PLR1_SU32_SUS128_SRVW4_TT2_128_VAW2_WG64_4_1_WGM1
    SolutionIndex: 144
    SolutionNameMin: Cijk_Ailk_Bljk_BSS_BH_MT64x128x32_MI32x32x8x1_SE_1LDSB0_AF0EM4_GRVW8_GSU1_LBSPP128_LPB8_LRVW4_NLCA1_PLR1_SU0_SUS0_SRVW4_TT1_64_VAW2_WG64_4_1_WGM15
    SolutionIndex: 145
    SolutionNameMin: Cijk_Ailk_Bljk_BSS_BH_MT128x256x32_MI32x32x8x1_SE_1LDSB0_AF0EM4_GRVW8_GSU1_LBSPP128_LPB8_LRVW4_NLCA1_PLR1_SU0_SUS0_SRVW4_TT2_128_VAW2_WG64_4_1_WGM15
    SolutionIndex: 146
    SolutionNameMin: Cijk_Ailk_Bljk_BSS_BH_MT256x144x32_MI16x16x16x1_SE_1LDSB0_AF0EM4_GRVW2_GSU1_LBSPP128_LPB4_LRVW4_NLCA2_PLR1_SU16_SUS128_SRVW4_TT4_144_VAW2_WG64_4_1_WGM15
    SolutionIndex: 147
    SolutionNameMin: Cijk_Ailk_Bljk_BSS_BH_MT128x288x32_MI32x32x8x1_SE_1LDSB0_AF0EM4_GRVW4_GSU1_LBSPP128_LPB4_LRVW4_NLCA1_PLR1_SU0_SUS0_SRVW4_TT1_288_VAW2_WG128_2_1_WGM1
    SolutionIndex: 148
    SolutionNameMin: Cijk_Ailk_Bljk_BSS_BH_MT32x32x64_MI16x16x16x1_SE_1LDSB0_AF0EM8_GRVW4_GSU5_LBSPP128_LPB8_LRVW8_NLCA1_PLR5_SU0_SUS0_SRVW0_TT1_16_VAW1_WG32_8_1_WGM2
    SolutionIndex: 149
    SolutionNameMin: Cijk_Ailk_Bljk_BSS_BH_MT32x32x128_MI16x16x16x1_SE_1LDSB0_AF0EM1_GRVW8_GSU1_LBSPP256_LPB8_LRVW4_NLCA1_PLR1_SU16_SUS256_SRVW0_TT1_16_VAW2_WG32_8_1_WGM2
    SolutionIndex: 150
    SolutionNameMin: Cijk_Ailk_Bljk_BSS_BH_MT256x256x16_MI32x32x8x1_SN_FL2_LBSPP0_NTA0_NTB1_NTD2_ONLL0_PK0
    SolutionIndex: 151
    SolutionNameMin: Cijk_Ailk_Bljk_BSS_BH_MT256x256x16_MI32x32x8x1_SN_FL1_LBSPP128_NTA1_NTB1_NTD3_ONLL0_PK0
    SolutionIndex: 152
    SolutionNameMin: Cijk_Ailk_Bljk_BSS_BH_MT256x256x16_MI32x32x8x1_SN_FL2_LBSPP64_NTA0_NTB1_NTD3_ONLL1_PK0
    SolutionIndex: 153
    SolutionNameMin: Cijk_Ailk_Bljk_BSS_BH_MT256x256x16_MI32x32x8x1_SN_FL1_LBSPP0_NTA1_NTB0_NTD2_ONLL1_PK0
    SolutionIndex: 154
    SolutionNameMin: Cijk_Ailk_Bljk_BSS_BH_MT256x256x16_MI32x32x8x1_SN_FL2_LBSPP64_NTA1_NTB0_NTD3_ONLL1_PK0
    SolutionIndex: 155
    SolutionNameMin: Cijk_Ailk_Bljk_BSS_BH_MT256x256x16_MI32x32x8x1_SN_FL1_LBSPP64_NTA0_NTB1_NTD2_ONLL2_PK0
    SolutionIndex: 156
    SolutionNameMin: Cijk_Ailk_Bljk_BSS_BH_MT256x256x16_MI32x32x8x1_SN_FL0_LBSPP256_LPA0_LPB4_NTD2_NLCA2_NLCB1_ONLL2_PLR1_SU0_SUM0_SUS0_VAW2
    SolutionIndex: 157
    SolutionNameMin: Cijk_Ailk_Bljk_BSS_BH_MT256x256x16_MI32x32x8x1_SN_FL0_LBSPP256_LPA0_LPB4_NTD3_NLCA2_NLCB1_ONLL0_PLR3_SU0_SUM0_SUS0_VAW2
    SolutionIndex: 158
    SolutionNameMin: Cijk_Ailk_Bljk_BSS_BH_MT256x256x16_MI32x32x8x1_SN_FL0_LBSPP256_LPA4_LPB4_NTD2_NLCA1_NLCB1_ONLL2_PLR1_SU0_SUM0_SUS0_VAW1
    SolutionIndex: 159
    SolutionNameMin: Cijk_Ailk_Bljk_BSS_BH_MT256x256x16_MI32x32x8x1_SN_FL1_LBSPP64_LPA4_LPB4_NTD2_NLCA1_NLCB1_ONLL2_PLR1_SU0_SUM0_SUS0_VAW1
    SolutionIndex: 160
    SolutionNameMin: Cijk_Ailk_Bljk_BSS_BH_MT256x256x16_MI32x32x8x1_SN_FL0_NTA0_NTB0_NTC2_NTD3_ONLL2_PLR1_SPO0_SSO0
    SolutionIndex: 161
    SolutionNameMin: Cijk_Ailk_Bljk_BSS_BH_MT256x256x16_MI32x32x8x1_SN_FL0_NTA0_NTB0_NTC2_NTD2_ONLL2_PLR1_SPO0_SSO0
    SolutionIndex: 162
    SolutionNameMin: Cijk_Ailk_Bljk_BSS_BH_MT256x256x16_MI32x32x8x1_SN_FL2_NTA1_NTB1_NTC2_NTD2_ONLL2_PLR3_SPO0_SSO0
    SolutionIndex: 163
    SolutionNameMin: Cijk_Ailk_Bljk_BSS_BH_MT256x256x16_MI32x32x8x1_SN_FL0_NTA0_NTB1_NTC3_NTD2_ONLL1_PLR3_SPO0_SSO0
    SolutionIndex: 164
    SolutionNameMin: Cijk_Ailk_Bljk_BSS_BH_MT256x256x16_MI32x32x8x1_SN_FL0_NTA0_NTB0_NTC2_NTD3_ONLL1_PLR3_SPO0_SSO0
    SolutionIndex: 165
    SolutionNameMin: Cijk_Ailk_Bljk_BSS_BH_MT256x256x16_MI32x32x8x1_SN_FL2_NTA1_NTB0_NTC3_NTD2_ONLL1_PLR3_SPO0_SSO0
    SolutionIndex: 166
    SolutionNameMin: Cijk_Ailk_Bljk_BSS_BH_MT256x256x16_MI32x32x8x1_SN_FL0_NTA1_NTB0_NTC3_NTD2_ONLL1_PLR1_SPO0_SSO0
    SolutionIndex: 167
    SolutionNameMin: Cijk_Ailk_Bljk_BSS_BH_MT256x256x16_MI32x32x8x1_SN_FL0_NTA0_NTB1_NTC2_NTD3_ONLL2_PLR1_SPO0_SSO0
    SolutionIndex: 168
    SolutionNameMin: Cijk_Ailk_Bljk_BSS_BH_MT256x256x16_MI32x32x8x1_SN_FL0_NTA1_NTB1_NTC2_NTD2_ONLL1_PLR3_SPO0_SSO0
    SolutionIndex: 169
    SolutionNameMin: Cijk_Ailk_Bljk_BSS_BH_MT256x256x16_MI32x32x8x1_SN_FL2_LBSPP0_NTA1_NTB1_NTC2_NTD3_SUS128_SPO0_SSO0_WGM3
    SolutionIndex: 170
    SolutionNameMin: Cijk_Ailk_Bljk_BSS_BH_MT256x256x16_MI32x32x8x1_SN_FL1_LBSPP128_NTA1_NTB1_NTC2_NTD2_SUS64_SPO0_SSO0_WGM3
    SolutionIndex: 171
    SolutionNameMin: Cijk_Ailk_Bljk_BSS_BH_MT256x256x16_MI32x32x8x1_SN_FL0_LBSPP256_NTA0_NTB1_NTC3_NTD3_SUS128_SPO0_SSO0_WGM3
    SolutionIndex: 172
    SolutionNameMin: Cijk_Ailk_Bljk_BSS_BH_MT256x256x16_MI32x32x8x1_SN_FL0_LBSPP64_NTA1_NTB0_NTC3_NTD3_SUS128_SPO0_SSO0_WGM3
    SolutionIndex: 173
    SolutionNameMin: Cijk_Ailk_Bljk_BSS_BH_MT256x256x16_MI32x32x8x1_SN_FL2_LBSPP64_NTA0_NTB0_NTC3_NTD2_SUS128_SPO0_SSO0_WGM3
    SolutionIndex: 174
    SolutionNameMin: Cijk_Ailk_Bljk_BSS_BH_MT256x256x16_MI32x32x8x1_SN_FL0_LBSPP128_NTA1_NTB1_NTC3_NTD3_SUS128_SPO0_SSO0_WGM3
    SolutionIndex: 175
    SolutionNameMin: Cijk_Ailk_Bljk_BSS_BH_MT256x256x16_MI32x32x8x1_SN_FL0_LBSPP128_NTA0_NTB0_NTC3_NTD2_SUS128_SPO0_SSO0_WGM3
    SolutionIndex: 176
    SolutionNameMin: Cijk_Ailk_Bljk_BSS_BH_MT256x256x16_MI32x32x8x1_SN_FL1_LBSPP256_NTA1_NTB1_NTC2_NTD2_SUS128_SPO0_SSO0_WGM3
    SolutionIndex: 177
    SolutionNameMin: Cijk_Ailk_Bljk_BSS_BH_MT256x256x16_MI32x32x8x1_SN_FL2_LBSPP256_NTA0_NTB0_NTC3_NTD2_SUS128_SPO0_SSO0_WGM3
    SolutionIndex: 178
    SolutionNameMin: Cijk_Ailk_Bljk_BSS_BH_MT256x256x16_MI32x32x8x1_SN_FL0_LBSPP64_NTA0_NTB0_NTC2_NTD3_ONLL1_PLR3_SU32_SUS64_WSGRA1_WSGRB0
    SolutionIndex: 179
    SolutionNameMin: Cijk_Ailk_Bljk_BSS_BH_MT256x256x16_MI32x32x8x1_SN_FL0_LBSPP0_NTA0_NTB1_NTC2_NTD3_ONLL0_PLR3_SU32_SUS64_WSGRA1_WSGRB0
    SolutionIndex: 180
    SolutionNameMin: Cijk_Ailk_Bljk_BSS_BH_MT256x256x16_MI32x32x8x1_SN_FL0_LBSPP128_NTA1_NTB1_NTC3_NTD3_ONLL1_PLR3_SU32_SUS64_WSGRA1_WSGRB0
    SolutionIndex: 181
    SolutionNameMin: Cijk_Ailk_Bljk_BSS_BH_MT256x256x16_MI32x32x8x1_SN_FL2_LBSPP128_NTA0_NTB1_NTC2_NTD2_ONLL0_PLR3_SU32_SUS64_WSGRA0_WSGRB0
    SolutionIndex: 182
    SolutionNameMin: Cijk_Ailk_Bljk_BSS_BH_MT256x256x16_MI32x32x8x1_SN_FL0_LBSPP64_NTA1_NTB1_NTC2_NTD2_ONLL0_PLR3_SU32_SUS64_WSGRA0_WSGRB0
    SolutionIndex: 183
    SolutionNameMin: Cijk_Ailk_Bljk_BSS_BH_MT256x256x16_MI32x32x8x1_SN_FL0_LBSPP64_NTA1_NTB0_NTC3_NTD3_ONLL1_PLR1_SU32_SUS64_WSGRA1_WSGRB0
    SolutionIndex: 184
    SolutionNameMin: Cijk_Ailk_Bljk_BSS_BH_MT256x256x16_MI32x32x8x1_SN_FL0_LBSPP0_NTA1_NTB0_NTC2_NTD3_ONLL1_PLR1_SU32_SUS64_WSGRA1_WSGRB0
    SolutionIndex: 185
    SolutionNameMin: Cijk_Ailk_Bljk_BSS_BH_MT256x256x16_MI32x32x8x1_SN_FL0_LBSPP128_NTA1_NTB0_NTC2_NTD3_ONLL1_PLR1_SU32_SUS64_WSGRA1_WSGRB0
    SolutionIndex: 186
    SolutionNameMin: Cijk_Ailk_Bljk_BSS_BH_MT256x256x16_MI32x32x8x1_SN_FL0_LBSPP64_NTA0_NTB1_NTC2_NTD2_ONLL1_PLR3_SU32_SUS64_WSGRA1_WSGRB0
    SolutionIndex: 187
    SolutionNameMin: Cijk_Ailk_Bljk_BSS_BH_MT256x256x16_MI32x32x8x1_SN_FL0_LBSPP0_NTA1_NTB0_NTC3_NTD3_ONLL0_SU32_SUS128_WGM3
    SolutionIndex: 188
    SolutionNameMin: Cijk_Ailk_Bljk_BSS_BH_MT256x256x16_MI32x32x8x1_SN_FL1_LBSPP64_NTA0_NTB1_NTC2_NTD3_ONLL1_SU32_SUS128_WGM3
    SolutionIndex: 189
    SolutionNameMin: Cijk_Ailk_Bljk_BSS_BH_MT256x256x16_MI32x32x8x1_SN_FL0_LBSPP0_NTA0_NTB1_NTC3_NTD3_ONLL0_SU16_SUS128_WGM3
    SolutionIndex: 190
    SolutionNameMin: Cijk_Ailk_Bljk_BSS_BH_MT256x256x16_MI32x32x8x1_SN_FL2_LBSPP64_NTA0_NTB0_NTC3_NTD3_ONLL1_SU32_SUS128_WGM3
    SolutionIndex: 191
    SolutionNameMin: Cijk_Ailk_Bljk_BSS_BH_MT256x256x16_MI32x32x8x1_SN_FL2_LBSPP0_NTA1_NTB1_NTC3_NTD3_ONLL1_SU32_SUS128_WGM3
    SolutionIndex: 192
    SolutionNameMin: Cijk_Ailk_Bljk_BSS_BH_MT256x256x16_MI32x32x8x1_SN_FL2_LBSPP0_NTA0_NTB0_NTC3_NTD3_ONLL1_SU32_SUS128_WGM3
    SolutionIndex: 193
    SolutionNameMin: Cijk_Ailk_Bljk_BSS_BH_MT256x256x16_MI32x32x8x1_SN_FL2_LBSPP256_NTA0_NTB0_NTC2_NTD2_ONLL1_SU32_SUS64_WGM3
    SolutionIndex: 194
    SolutionNameMin: Cijk_Ailk_Bljk_BSS_BH_MT256x256x16_MI32x32x8x1_SN_FL0_LBSPP64_NTA0_NTB0_NTC3_NTD3_ONLL1_SU32_SUS128_WGM3
    SolutionIndex: 195
    SolutionNameMin: Cijk_Ailk_Bljk_BSS_BH_MT256x256x16_MI32x32x8x1_SN_FL2_LBSPP64_NTA1_NTB1_NTC2_NTD3_ONLL1_SU32_SUS128_WGM3
    SolutionIndex: 196
    SolutionNameMin: Cijk_Ailk_Bljk_BSS_BH_MT256x128x16_MI32x32x8x1_SN_1LDSB1_NTA0_NTB1_NTC2_NTD2_ONLL0_SU32_SUS64_TT4_64_WG64_4_1
    SolutionIndex: 197
    SolutionNameMin: Cijk_Ailk_Bljk_BSS_BH_MT256x128x16_MI32x32x8x1_SN_1LDSB1_NTA0_NTB0_NTC2_NTD3_ONLL0_SU32_SUS64_TT4_64_WG64_4_1
    SolutionIndex: 198
    SolutionNameMin: Cijk_Ailk_Bljk_BSS_BH_MT256x256x16_MI32x32x8x1_SN_1LDSB0_NTA1_NTB1_NTC3_NTD3_ONLL1_SU32_SUS128_TT8_64_WG32_8_1
    SolutionIndex: 199
    SolutionNameMin: Cijk_Ailk_Bljk_BSS_BH_MT256x128x16_MI32x32x8x1_SN_AMAS0_NTA1_NTB0_NTC2_NTD3_SU32_SUM0_SUS128_SVW1_VW1
    SolutionIndex: 200
    SolutionNameMin: Cijk_Ailk_Bljk_BSS_BH_MT256x256x32_MI32x32x8x1_SN_1LDSB1_FL1_NTA0_NTB1_NTC2_NTD3_TT4_128_WG64_4_1
    SolutionIndex: 201
    SolutionNameMin: Cijk_Ailk_Bljk_BSS_BH_MT256x256x32_MI32x32x8x1_SN_1LDSB1_FL1_NTA1_NTB0_NTC2_NTD2_TT4_128_WG64_4_1
    SolutionIndex: 202
    SolutionNameMin: Cijk_Ailk_Bljk_BSS_BH_MT256x256x32_MI32x32x8x1_SN_1LDSB1_FL0_NTA1_NTB0_NTC3_NTD2_TT4_128_WG64_4_1
    SolutionIndex: 203
    SolutionNameMin: Cijk_Ailk_Bljk_BSS_BH_MT256x256x32_MI32x32x8x1_SN_1LDSB1_FL2_NTA1_NTB0_NTC2_NTD2_TT4_128_WG64_4_1
    SolutionIndex: 204
    SolutionNameMin: Cijk_Ailk_Bljk_BSS_BH_MT256x256x32_MI32x32x8x1_SN_1LDSB1_FL0_NTA1_NTB1_NTC2_NTD2_TT4_128_WG64_4_1
    SolutionIndex: 205
    SolutionNameMin: Cijk_Ailk_Bljk_BSS_BH_MT256x256x32_MI32x32x8x1_SN_1LDSB1_FL2_NTA1_NTB1_NTC2_NTD3_TT4_128_WG64_4_1
    SolutionIndex: 206
    SolutionNameMin: Cijk_Ailk_Bljk_BSS_BH_MT256x256x32_MI32x32x8x1_SN_1LDSB1_FL1_NTA0_NTB1_NTC3_NTD3_TT4_128_WG64_4_1
    SolutionIndex: 207
    SolutionNameMin: Cijk_Ailk_Bljk_BSS_BH_MT256x256x32_MI32x32x8x1_SN_1LDSB1_FL1_NTA1_NTB0_NTC3_NTD3_TT4_128_WG64_4_1
    SolutionIndex: 208
    SolutionNameMin: Cijk_Ailk_Bljk_BSS_BH_MT256x256x32_MI32x32x8x1_SN_1LDSB1_FL2_NTA0_NTB0_NTC2_NTD3_TT4_128_WG64_4_1
    SolutionIndex: 209
    SolutionNameMin: Cijk_Ailk_Bljk_BSS_BH_MT256x256x16_MI32x32x8x1_SN_FL0_LBSPP256_NTB1_NTC3_NTD2_NEPBS0_SUM0_SUS128_TT8_64_WSGRA1_WSGRB0_WG32_8_1_WGM3
    SolutionIndex: 210
    SolutionNameMin: Cijk_Ailk_Bljk_BSS_BH_MT256x256x16_MI32x32x8x1_SN_FL0_LBSPP256_NTB1_NTC3_NTD3_NEPBS0_SUM0_SUS128_TT8_64_WSGRA1_WSGRB0_WG32_8_1_WGM3
- - - [7680, 8192, 1, 8192]
    - [0, 76.051]
  - - [3840, 4096, 1, 4096]
    - [1, 69.852]
  - - [1920, 2048, 1, 2048]
    - [2, 54.525]
  - - [960, 1024, 1, 1024]
    - [3, 28.142]
  - - [480, 512, 1, 512]
    - [4, 7.92]
  - - [8192, 7680, 1, 8192]
    - [5, 79.066]
  - - [4096, 3840, 1, 4096]
    - [0, 70.779]
  - - [2048, 1920, 1, 2048]
    - [2, 55.458]
  - - [1024, 960, 1, 1024]
    - [3, 28.353]
  - - [512, 480, 1, 512]
    - [4, 8.009]
  - - [8192, 8192, 1, 8192]
    - [0, 76.768]
  - - [4096, 4096, 1, 4096]
    - [6, 69.531]
  - - [2048, 2048, 1, 2048]
    - [7, 56.169]
  - - [1024, 1024, 1, 1024]
    - [3, 29.08]
  - - [512, 512, 1, 512]
    - [4, 8.641]
  - - [64, 512, 16, 512]
    - [8, 12.654]
  - - [64, 512, 128, 512]
    - [9, 23.582]
  - - [1024, 1, 1, 2]
    - [10, 0.0]
  - - [1024, 1, 1, 1024]
    - [11, 0.06]
  - - [1024, 8, 1, 1024]
    - [12, 0.47]
  - - [1024, 77, 1, 1024]
    - [13, 4.713]
  - - [1024, 77, 1, 30522]
    - [14, 21.366]
  - - [1024, 512, 1, 2]
    - [15, 0.082]
  - - [1024, 512, 1, 1024]
    - [9, 19.575]
  - - [1024, 512, 1, 4096]
    - [16, 29.796]
  - - [1024, 616, 1, 1024]
    - [9, 22.885]
  - - [1024, 4096, 1, 2]
    - [17, 0.263]
  - - [1024, 4096, 1, 1024]
    - [18, 44.763]
  - - [1024, 4096, 1, 4096]
    - [5, 65.701]
  - - [4096, 512, 1, 1024]
    - [19, 37.337]
  - - [4096, 4096, 1, 1024]
    - [18, 55.604]
  - - [64, 128, 128, 128]
    - [20, 8.001]
  - - [64, 128, 160, 128]
    - [21, 8.833]
  - - [1024, 10, 1, 2]
    - [22, 0.002]
  - - [1024, 10, 1, 1024]
    - [11, 0.582]
  - - [1024, 160, 1, 1024]
    - [4, 8.327]
  - - [1024, 200, 1, 1024]
    - [23, 9.723]
  - - [1024, 200, 1, 30522]
    - [24, 26.556]
  - - [1024, 1024, 1, 2]
    - [25, 0.128]
  - - [1024, 1024, 1, 4096]
    - [3, 47.91]
  - - [1024, 1280, 1, 2]
    - [17, 0.151]
  - - [1024, 1280, 1, 1024]
    - [26, 31.635]
  - - [1024, 1280, 1, 4096]
    - [27, 41.6]
  - - [4096, 1024, 1, 1024]
    - [28, 43.243]
  - - [4096, 1280, 1, 1024]
    - [29, 43.266]
  - - [64, 128, 624, 128]
    - [30, 12.165]
  - - [1024, 39, 1, 2]
    - [31, 0.009]
  - - [1024, 39, 1, 1024]
    - [13, 2.387]
  - - [1024, 780, 1, 1024]
    - [16, 26.479]
  - - [1024, 780, 1, 30522]
    - [32, 54.184]
  - - [1024, 4992, 1, 2]
    - [17, 0.279]
  - - [1024, 4992, 1, 1024]
    - [33, 46.291]
  - - [1024, 4992, 1, 4096]
    - [2, 62.689]
  - - [4096, 4992, 1, 1024]
    - [34, 54.505]
  - - [64, 512, 64, 512]
    - [35, 19.93]
  - - [1024, 4, 1, 2]
    - [10, 0.001]
  - - [1024, 4, 1, 1024]
    - [36, 0.236]
  - - [1024, 308, 1, 1024]
    - [23, 14.214]
  - - [1024, 308, 1, 30522]
    - [37, 34.806]
  - - [1024, 2048, 1, 2]
    - [17, 0.195]
  - - [1024, 2048, 1, 1024]
    - [28, 39.859]
  - - [1024, 2048, 1, 4096]
    - [38, 52.568]
  - - [4096, 2048, 1, 1024]
    - [39, 52.087]
  - - [64, 128, 640, 128]
    - [21, 12.314]
  - - [1024, 40, 1, 2]
    - [40, 0.009]
  - - [1024, 40, 1, 1024]
    - [13, 2.448]
  - - [1024, 800, 1, 1024]
    - [16, 26.773]
  - - [1024, 800, 1, 30522]
    - [32, 55.585]
  - - [1024, 5120, 1, 2]
    - [17, 0.283]
  - - [1024, 5120, 1, 1024]
    - [19, 47.292]
  - - [1024, 5120, 1, 4096]
    - [2, 63.804]
  - - [4096, 5120, 1, 1024]
    - [18, 55.569]
  - - [64, 128, 656, 128]
    - [15, 12.301]
  - - [1024, 41, 1, 2]
    - [31, 0.009]
  - - [1024, 41, 1, 1024]
    - [13, 2.471]
  - - [1024, 820, 1, 1024]
    - [16, 26.687]
  - - [1024, 820, 1, 30522]
    - [16, 50.988]
  - - [1024, 5248, 1, 2]
    - [17, 0.288]
  - - [1024, 5248, 1, 1024]
    - [41, 48.211]
  - - [1024, 5248, 1, 4096]
    - [2, 64.717]
  - - [4096, 5248, 1, 1024]
    - [18, 56.697]
  - - [64, 512, 80, 512]
    - [35, 23.016]
  - - [1024, 5, 1, 2]
    - [22, 0.001]
  - - [1024, 5, 1, 1024]
    - [13, 0.298]
  - - [1024, 385, 1, 1024]
    - [42, 15.63]
  - - [1024, 385, 1, 30522]
    - [43, 36.71]
  - - [1024, 2560, 1, 2]
    - [25, 0.216]
  - - [1024, 2560, 1, 1024]
    - [19, 43.391]
  - - [1024, 2560, 1, 4096]
    - [44, 61.439]
  - - [4096, 2560, 1, 1024]
    - [18, 53.292]
  - - [64, 512, 96, 512]
    - [26, 24.79]
  - - [1024, 6, 1, 2]
    - [31, 0.001]
  - - [1024, 6, 1, 1024]
    - [45, 0.36]
  - - [1024, 462, 1, 1024]
    - [46, 18.502]
  - - [1024, 462, 1, 30522]
    - [43, 43.452]
  - - [1024, 3072, 1, 2]
    - [17, 0.243]
  - - [1024, 3072, 1, 1024]
    - [47, 42.797]
  - - [1024, 3072, 1, 4096]
    - [48, 61.564]
  - - [4096, 3072, 1, 1024]
    - [18, 54.106]
  - - [1024, 8, 1, 2]
    - [31, 0.002]
  - - [1024, 160, 1, 30522]
    - [14, 30.438]
  - - [64, 128, 144, 128]
    - [20, 8.339]
  - - [1024, 9, 1, 2]
    - [31, 0.002]
  - - [1024, 9, 1, 1024]
    - [11, 0.537]
  - - [1024, 180, 1, 1024]
    - [49, 9.579]
  - - [1024, 180, 1, 30522]
    - [14, 33.536]
  - - [1024, 1152, 1, 2]
    - [17, 0.141]
  - - [1024, 1152, 1, 1024]
    - [3, 33.113]
  - - [1024, 1152, 1, 4096]
    - [44, 53.162]
  - - [4096, 1152, 1, 1024]
    - [33, 44.115]
  - - [256, 32768, 1, 128]
    - [25, 16.065]
  - - [479, 32768, 1, 1024]
    - [50, 45.012]
  - - [512, 32768, 1, 256]
    - [51, 29.578]
  - - [1024, 32768, 1, 512]
    - [51, 45.511]
  - - [1024, 32768, 1, 1024]
    - [18, 58.485]
  - - [64, 128, 512, 128]
    - [15, 12.097]
  - - [128, 128, 512, 64]
    - [25, 9.571]
  - - [1024, 32, 1, 2]
    - [52, 0.007]
  - - [1024, 32, 1, 1024]
    - [13, 1.89]
  - - [1024, 4096, 1, 30528]
    - [6, 77.07]
  - - [512, 512, 64, 64]
    - [17, 11.222]
  - - [1024, 2048, 1, 30528]
    - [53, 69.243]
  - - [64, 4, 32768, 4]
    - [54, 0.132]
  - - [64, 4, 38400, 4]
    - [54, 0.133]
  - - [1024, 8192, 1, 1024]
    - [18, 50.59]
  - - [1024, 8192, 1, 4096]
    - [55, 67.724]
  - - [1024, 8192, 1, 33712]
    - [7, 77.15]
  - - [1024, 9600, 1, 1024]
    - [34, 49.983]
  - - [1024, 9600, 1, 4096]
    - [48, 66.459]
  - - [1024, 9600, 1, 33712]
    - [48, 75.329]
  - - [4096, 8192, 1, 1024]
    - [18, 57.538]
  - - [4096, 9600, 1, 1024]
    - [18, 59.061]
  - - [1024, 10064, 1, 1024]
    - [18, 51.38]
  - - [1024, 10064, 1, 4096]
    - [48, 68.994]
  - - [1024, 10080, 1, 1024]
    - [18, 51.753]
  - - [1024, 10080, 1, 4096]
    - [48, 69.023]
  - - [1024, 10080, 1, 42720]
    - [48, 79.337]
  - - [1024, 10200, 1, 1024]
    - [18, 52.097]
  - - [1024, 10200, 1, 4096]
    - [48, 69.774]
  - - [1024, 3840, 1, 1024]
    - [1, 46.913]
  - - [1024, 3840, 1, 4096]
    - [1, 68.553]
  - - [1024, 3968, 1, 1024]
    - [56, 43.934]
  - - [1024, 3968, 1, 4096]
    - [55, 63.562]
  - - [1024, 3968, 1, 42720]
    - [6, 75.4]
  - - [1024, 6528, 1, 1024]
    - [18, 51.482]
  - - [1024, 6528, 1, 4096]
    - [48, 66.598]
  - - [1024, 6528, 1, 42720]
    - [57, 78.681]
  - - [1024, 7104, 1, 1024]
    - [34, 47.821]
  - - [1024, 7104, 1, 4096]
    - [1, 64.832]
  - - [1024, 7104, 1, 42720]
    - [58, 76.341]
  - - [1024, 7200, 1, 1024]
    - [59, 48.165]
  - - [1024, 7200, 1, 4096]
    - [1, 65.619]
  - - [1024, 7200, 1, 42720]
    - [58, 77.49]
  - - [1024, 8064, 1, 1024]
    - [18, 50.432]
  - - [1024, 8064, 1, 4096]
    - [5, 66.725]
  - - [1024, 8160, 1, 1024]
    - [18, 50.925]
  - - [1024, 8160, 1, 4096]
    - [55, 67.959]
  - - [1024, 9216, 1, 1024]
    - [50, 52.521]
  - - [1024, 9216, 1, 4096]
    - [2, 66.246]
  - - [1024, 9520, 1, 1024]
    - [34, 50.231]
  - - [1024, 9520, 1, 4096]
    - [48, 65.847]
  - - [1024, 9520, 1, 42720]
    - [32, 76.001]
  - - [4096, 10064, 1, 1024]
    - [18, 58.439]
  - - [4096, 10080, 1, 1024]
    - [18, 58.799]
  - - [4096, 10200, 1, 1024]
    - [18, 59.004]
  - - [4096, 3840, 1, 1024]
    - [18, 57.351]
  - - [4096, 3968, 1, 1024]
    - [18, 53.851]
  - - [4096, 6528, 1, 1024]
    - [18, 58.915]
  - - [4096, 7104, 1, 1024]
    - [18, 56.725]
  - - [4096, 7200, 1, 1024]
    - [18, 56.574]
  - - [4096, 8064, 1, 1024]
    - [18, 58.888]
  - - [4096, 8160, 1, 1024]
    - [18, 59.525]
  - - [4096, 9216, 1, 1024]
    - [18, 59.625]
  - - [4096, 9520, 1, 1024]
    - [18, 58.539]
  - - [64, 14, 10880, 14]
    - [17, 1.331]
  - - [64, 14, 10880, 15]
    - [60, 1.379]
  - - [64, 15, 7680, 15]
    - [54, 1.414]
  - - [64, 15, 10880, 15]
    - [21, 1.458]
  - - [64, 15, 7680, 17]
    - [21, 1.514]
  - - [64, 17, 6144, 17]
    - [60, 1.635]
  - - [64, 17, 7680, 17]
    - [21, 1.697]
  - - [64, 17, 6144, 21]
    - [54, 1.989]
  - - [64, 21, 6144, 21]
    - [60, 2.377]
  - - [64, 24, 4736, 24]
    - [17, 2.901]
  - - [64, 24, 4736, 34]
    - [17, 3.881]
  - - [64, 30, 2048, 30]
    - [17, 3.488]
  - - [64, 31, 2048, 30]
    - [60, 3.54]
  - - [64, 31, 2048, 31]
    - [21, 3.557]
  - - [64, 32, 4608, 32]
    - [60, 5.234]
  - - [64, 34, 4736, 34]
    - [61, 3.196]
  - - [64, 35, 4608, 32]
    - [61, 4.205]
  - - [64, 35, 4608, 35]
    - [61, 3.235]
  - - [64, 512, 1, 512]
    - [62, 1.212]
  - - [512, 512, 1, 64]
    - [23, 1.549]
  - - [128, 128, 1, 64]
    - [10, 0.116]
  - - [64, 128, 1, 128]
    - [63, 0.119]
  - - [1024, 512, 1, 64]
    - [15, 2.759]
  - - [74, 512, 1, 2048]
    - [64, 3.287]
  - - [64, 5, 1, 5]
    - [65, 0.0]
  - - [2048, 512, 1, 2048]
    - [3, 39.598]
  - - [512, 1600, 1, 512]
    - [66, 20.024]
  - - [32, 33, 1, 33]
    - [65, 0.004]
  - - [560, 1600, 1, 1024]
    - [44, 25.09]
  - - [512, 1600, 1, 32]
    - [15, 2.14]
  - - [1024, 1600, 1, 1024]
    - [27, 38.032]
  - - [32, 33, 1600, 33]
    - [61, 2.196]
  - - [32, 200, 1, 1]
    - [65, 0.001]
  - - [64, 3, 512, 3]
    - [10, 0.021]
  - - [64, 5, 512, 5]
    - [21, 0.058]
  - - [64, 5, 960, 5]
    - [10, 0.082]
  - - [64, 9, 512, 9]
    - [21, 0.183]
  - - [64, 512, 1, 1]
    - [65, 0.003]
  - - [67, 512, 1, 2048]
    - [67, 2.987]
  - - [74, 960, 1, 2048]
    - [64, 6.403]
  - - [100, 512, 1, 2048]
    - [64, 4.425]
  - - [128, 27, 32768, 27]
    - [17, 3.891]
  - - [256, 1024, 1, 1]
    - [10, 0.023]
  - - [256, 8976, 1, 1536]
    - [33, 43.746]
  - - [256, 8976, 1, 2048]
    - [44, 46.838]
  - - [256, 8976, 1, 2304]
    - [2, 48.22]
  - - [256, 8976, 1, 2560]
    - [3, 49.057]
  - - [256, 8976, 1, 2816]
    - [2, 50.278]
  - - [256, 8976, 1, 3072]
    - [3, 51.145]
  - - [256, 8976, 1, 4352]
    - [2, 54.746]
  - - [256, 8976, 1, 4864]
    - [2, 54.797]
  - - [256, 8976, 1, 5376]
    - [3, 55.94]
  - - [256, 8976, 1, 5632]
    - [3, 56.667]
  - - [256, 8976, 1, 5888]
    - [3, 56.624]
  - - [256, 8976, 1, 6144]
    - [3, 56.828]
  - - [256, 8976, 1, 6656]
    - [2, 57.65]
  - - [256, 8976, 1, 7168]
    - [3, 57.684]
  - - [256, 8976, 1, 7424]
    - [3, 58.119]
  - - [256, 8976, 1, 8192]
    - [44, 58.473]
  - - [256, 8976, 1, 8448]
    - [3, 58.447]
  - - [256, 8976, 1, 8960]
    - [2, 58.919]
  - - [256, 8976, 1, 9472]
    - [2, 59.26]
  - - [256, 8976, 1, 9728]
    - [3, 59.202]
  - - [256, 8976, 1, 9984]
    - [2, 59.378]
  - - [256, 8976, 1, 10240]
    - [3, 59.307]
  - - [256, 8976, 1, 10496]
    - [3, 59.433]
  - - [256, 8976, 1, 11008]
    - [3, 59.52]
  - - [256, 8976, 1, 11520]
    - [2, 59.648]
  - - [256, 8976, 1, 12288]
    - [3, 60.342]
  - - [256, 8976, 1, 14336]
    - [68, 62.022]
  - - [256, 8976, 1, 14848]
    - [68, 62.8]
  - - [256, 8976, 1, 15104]
    - [68, 62.896]
  - - [256, 8976, 1, 15872]
    - [69, 61.679]
  - - [256, 8976, 1, 17152]
    - [68, 64.928]
  - - [256, 8976, 1, 19712]
    - [69, 64.943]
  - - [256, 8976, 1, 19968]
    - [69, 66.36]
  - - [256, 8976, 1, 20480]
    - [69, 65.888]
  - - [256, 8976, 1, 20992]
    - [69, 66.074]
  - - [256, 8976, 1, 22016]
    - [69, 66.283]
  - - [256, 8976, 1, 26112]
    - [69, 68.346]
  - - [256, 8976, 1, 33536]
    - [69, 71.605]
  - - [256, 8976, 1, 44505]
    - [68, 72.863]
  - - [257, 1024, 1, 4096]
    - [70, 15.59]
  - - [480, 32768, 1, 1024]
    - [18, 52.009]
  - - [512, 200, 1, 1]
    - [71, 0.01]
  - - [512, 200, 1, 32]
    - [15, 0.355]
  - - [512, 215, 1, 2048]
    - [72, 8.355]
  - - [512, 256, 1, 2048]
    - [72, 9.819]
  - - [560, 200, 1, 1024]
    - [49, 5.769]
  - - [768, 215, 1, 2048]
    - [72, 12.095]
  - - [768, 256, 1, 2048]
    - [49, 14.356]
  - - [1024, 1, 1, 200]
    - [10, 0.017]
  - - [1024, 1, 1, 1600]
    - [73, 0.069]
  - - [1024, 200, 1, 1]
    - [10, 0.019]
  - - [1024, 512, 1, 1]
    - [15, 0.04]
  - - [1024, 960, 1, 64]
    - [61, 4.375]
  - - [1024, 1600, 1, 1]
    - [74, 0.086]
  - - [1024, 1792, 1, 256]
    - [28, 18.702]
  - - [1024, 2048, 1, 256]
    - [75, 20.365]
  - - [1024, 2560, 1, 256]
    - [76, 21.48]
  - - [1024, 3072, 1, 256]
    - [26, 20.715]
  - - [1024, 3328, 1, 256]
    - [77, 21.698]
  - - [1024, 3840, 1, 256]
    - [78, 24.13]
  - - [1024, 4096, 1, 256]
    - [28, 23.444]
  - - [1024, 4608, 1, 256]
    - [79, 23.465]
  - - [1024, 4864, 1, 256]
    - [34, 24.023]
  - - [1024, 5120, 1, 256]
    - [79, 25.119]
  - - [1024, 5632, 1, 256]
    - [51, 26.154]
  - - [1024, 6144, 1, 256]
    - [79, 26.185]
  - - [1024, 6400, 1, 256]
    - [18, 26.66]
  - - [1024, 7168, 1, 256]
    - [51, 26.798]
  - - [1024, 7424, 1, 256]
    - [51, 27.306]
  - - [1024, 7680, 1, 256]
    - [51, 28.177]
  - - [1024, 7936, 1, 256]
    - [51, 26.848]
  - - [1024, 8192, 1, 256]
    - [18, 26.913]
  - - [1024, 8448, 1, 256]
    - [78, 27.358]
  - - [1024, 8704, 1, 256]
    - [51, 27.701]
  - - [1024, 8960, 1, 256]
    - [79, 28.003]
  - - [1024, 9728, 1, 256]
    - [51, 29.139]
  - - [1024, 9984, 1, 256]
    - [79, 28.11]
  - - [1024, 10240, 1, 256]
    - [78, 28.451]
  - - [1024, 10496, 1, 256]
    - [79, 29.3]
  - - [1024, 11008, 1, 256]
    - [51, 29.745]
  - - [1024, 11264, 1, 256]
    - [51, 30.079]
  - - [1024, 11520, 1, 256]
    - [51, 30.433]
  - - [1024, 12288, 1, 256]
    - [78, 28.964]
  - - [1024, 13312, 1, 256]
    - [51, 30.62]
  - - [1024, 13568, 1, 256]
    - [51, 31.064]
  - - [1024, 14336, 1, 256]
    - [78, 29.859]
  - - [1024, 14592, 1, 256]
    - [51, 30.033]
  - - [1024, 14848, 1, 256]
    - [51, 30.666]
  - - [1024, 15104, 1, 256]
    - [51, 30.871]
  - - [1024, 16128, 1, 256]
    - [51, 30.398]
  - - [1024, 17152, 1, 256]
    - [51, 31.701]
  - - [1024, 18944, 1, 256]
    - [51, 31.917]
  - - [1024, 19712, 1, 256]
    - [51, 32.379]
  - - [1024, 19968, 1, 256]
    - [51, 31.336]
  - - [1024, 20480, 1, 256]
    - [51, 31.869]
  - - [1024, 20992, 1, 256]
    - [51, 32.511]
  - - [1024, 21504, 1, 256]
    - [51, 32.805]
  - - [1024, 22016, 1, 256]
    - [51, 31.827]
  - - [1024, 23552, 1, 256]
    - [51, 33.266]
  - - [1024, 28672, 1, 256]
    - [51, 33.365]
  - - [1024, 33536, 1, 256]
    - [51, 34.272]
  - - [1024, 40448, 1, 256]
    - [51, 34.23]
  - - [1600, 512, 1, 1024]
    - [9, 28.297]
  - - [2048, 1, 1, 512]
    - [45, 0.078]
  - - [2048, 512, 1, 1]
    - [20, 0.065]
  - - [2048, 960, 1, 2048]
    - [80, 46.576]
  - - [2048, 1024, 1, 1]
    - [25, 0.098]
  - - [2048, 1024, 1, 256]
    - [28, 19.767]
  - - [3200, 1024, 1, 2048]
    - [47, 56.382]
  - - [4096, 1024, 1, 1]
    - [17, 0.134]
  - - [2048, 1024, 1, 2048]
    - [28, 47.209]
  - - [2048, 1024, 1, 30592]
    - [69, 64.902]
  - - [2048, 1024, 1, 6144]
    - [3, 54.066]
  - - [2048, 1024, 1, 8192]
    - [3, 55.636]
  - - [2048, 2, 1, 2]
    - [31, 0.001]
  - - [2048, 2, 1, 2048]
    - [36, 0.334]
  - - [8192, 1024, 1, 2048]
    - [79, 54.4]
  - - [1024, 16, 1, 1024]
    - [13, 0.969]
  - - [1024, 16, 1, 2]
    - [22, 0.003]
  - - [1024, 8192, 1, 30592]
    - [5, 76.736]
  - - [1024, 8192, 1, 3072]
    - [81, 65.229]
  - - [512, 512, 256, 64]
    - [54, 12.013]
  - - [64, 512, 256, 512]
    - [26, 26.646]
  - - [1024, 2048, 1, 30592]
    - [57, 68.898]
  - - [1024, 2048, 1, 3072]
    - [28, 50.829]
  - - [1024, 4096, 1, 30592]
    - [82, 76.589]
  - - [1024, 4096, 1, 3072]
    - [6, 62.17]
  - - [512, 512, 128, 64]
    - [17, 11.734]
  - - [2560, 2048, 1, 1920]
    - [2, 54.656]
  - - [2560, 2048, 1, 2560]
    - [2, 57.804]
  - - [2560, 2048, 1, 7680]
    - [2, 66.89]
  - - [2560, 4, 1, 2]
    - [10, 0.002]
  - - [2560, 4, 1, 2560]
    - [12, 0.887]
  - - [640, 2048, 1, 2560]
    - [3, 51.574]
  - - [512, 512, 40, 64]
    - [17, 10.694]
  - - [64, 512, 40, 512]
    - [26, 20.829]
  - - [1536, 4096, 1, 1536]
    - [18, 54.329]
  - - [1536, 4096, 1, 4608]
    - [48, 64.196]
  - - [1536, 4096, 1, 50304]
    - [57, 74.898]
  - - [1536, 4096, 1, 6144]
    - [48, 66.408]
  - - [6144, 4096, 1, 1536]
    - [34, 61.852]
  - - [1024, 1024, 64, 96]
    - [75, 16.81]
  - - [96, 1024, 64, 1024]
    - [83, 37.222]
  - - [1536, 8192, 1, 1536]
    - [18, 57.606]
  - - [1536, 8192, 1, 4608]
    - [6, 69.245]
  - - [1536, 8192, 1, 50304]
    - [84, 79.558]
  - - [1536, 8192, 1, 6144]
    - [5, 71.324]
  - - [6144, 8192, 1, 1536]
    - [18, 63.679]
  - - [1024, 1024, 128, 96]
    - [75, 17.224]
  - - [96, 1024, 128, 1024]
    - [83, 41.194]
  - - [1024, 16384, 1, 1024]
    - [56, 54.523]
  - - [1024, 16384, 1, 3072]
    - [55, 66.234]
  - - [1024, 16384, 1, 4096]
    - [5, 68.777]
  - - [1024, 16384, 1, 50304]
    - [68, 79.674]
  - - [4096, 16384, 1, 1024]
    - [18, 60.605]
  - - [1024, 1024, 256, 64]
    - [75, 12.521]
  - - [64, 1024, 256, 1024]
    - [85, 32.503]
  - - [1024, 2048, 1, 50304]
    - [57, 71.725]
  - - [1024, 1024, 32, 64]
    - [17, 11.734]
  - - [64, 1024, 32, 1024]
    - [66, 25.96]
  - - [1024, 4096, 1, 50304]
    - [6, 77.187]
  - - [1024, 1024, 64, 64]
    - [75, 12.179]
  - - [64, 1024, 64, 1024]
    - [35, 30.395]
  - - [1024, 8192, 1, 50304]
    - [5, 77.283]
  - - [1024, 1024, 128, 64]
    - [75, 12.444]
  - - [64, 1024, 128, 1024]
    - [27, 32.142]
  - - [128, 128, 1024, 64]
    - [21, 10.217]
  - - [64, 128, 1024, 128]
    - [20, 12.842]
  - - [1024, 64, 1, 2]
    - [40, 0.014]
  - - [1024, 8192, 1, 30528]
    - [7, 77.407]
  - - [1024, 64, 1, 1024]
    - [64, 3.959]
  - - [1024, 3456, 1, 1024]
    - [48, 44.719]
  - - [1024, 3456, 1, 512]
    - [79, 32.926]
  - - [1024, 4096, 1, 512]
    - [56, 34.514]
  - - [1024, 6912, 1, 1024]
    - [86, 48.005]
  - - [1024, 6912, 1, 512]
    - [79, 36.782]
  - - [1024, 864, 1, 1024]
    - [44, 25.454]
  - - [1024, 864, 1, 512]
    - [87, 17.907]
  - - [256, 3456, 1, 128]
    - [88, 7.686]
  - - [256, 4096, 1, 128]
    - [61, 8.001]
  - - [256, 55296, 1, 128]
    - [25, 17.271]
  - - [256, 6912, 1, 128]
    - [26, 11.143]
  - - [256, 864, 1, 128]
    - [65, 2.512]
  - - [480, 3456, 1, 1024]
    - [27, 36.247]
  - - [480, 4096, 1, 1024]
    - [28, 37.553]
  - - [480, 6912, 1, 1024]
    - [48, 43.3]
  - - [480, 864, 1, 1024]
    - [4, 17.399]
  - - [512, 3456, 1, 256]
    - [77, 19.259]
  - - [512, 4096, 1, 256]
    - [28, 20.095]
  - - [512, 55296, 1, 256]
    - [51, 32.085]
  - - [512, 6912, 1, 256]
    - [79, 22.286]
  - - [512, 864, 1, 256]
    - [89, 7.686]
  - - [1024, 640, 1, 30528]
    - [37, 48.705]
  - - [1024, 1280, 1, 30528]
    - [58, 61.136]
  - - [1024, 1600, 1, 30528]
    - [84, 65.313]
  - - [1024, 10240, 1, 1024]
    - [18, 52.529]
  - - [1024, 10240, 1, 4096]
    - [48, 70.119]
  - - [4096, 10240, 1, 1024]
    - [18, 59.784]
  - - [1024, 80, 1, 1024]
    - [12, 4.822]
  - - [1024, 80, 1, 2]
    - [10, 0.017]
  - - [128, 128, 1280, 64]
    - [60, 10.287]
  - - [64, 128, 1280, 128]
    - [30, 13.092]
  - - [1024, 1640, 1, 30528]
    - [90, 66.468]
  - - [1024, 10496, 1, 1024]
    - [56, 53.263]
  - - [1024, 10496, 1, 4096]
    - [86, 71.551]
  - - [4096, 10496, 1, 1024]
    - [18, 58.662]
  - - [1024, 82, 1, 1024]
    - [13, 4.844]
  - - [1024, 82, 1, 2]
    - [65, 0.016]
  - - [128, 128, 1312, 64]
    - [91, 10.299]
  - - [64, 128, 1312, 128]
    - [15, 13.08]
  - - [1024, 160, 1, 30528]
    - [14, 31.376]
  - - [1024, 240, 1, 30528]
    - [24, 31.528]
  - - [1024, 6144, 1, 4096]
    - [86, 63.295]
  - - [1024, 12, 1, 1024]
    - [13, 0.702]
  - - [4096, 6144, 1, 1024]
    - [18, 56.017]
  - - [1024, 6144, 1, 1024]
    - [18, 48.878]
  - - [1024, 12, 1, 2]
    - [31, 0.003]
  - - [512, 512, 192, 64]
    - [17, 11.88]
  - - [64, 512, 192, 512]
    - [9, 25.45]
  - - [256, 4096, 1, 1]
    - [61, 0.068]
  - - [256, 6912, 1, 1]
    - [17, 0.093]
  - - [3136, 128, 64, 64]
    - [17, 11.585]
  - - [3136, 256, 64, 64]
    - [17, 12.329]
  - - [3136, 256, 64, 128]
    - [51, 19.256]
  - - [784, 512, 64, 256]
    - [79, 30.784]
  - - [3136, 128, 64, 256]
    - [51, 27.555]
  - - [3136, 256, 64, 256]
    - [51, 31.624]
  - - [784, 256, 64, 512]
    - [79, 36.127]
  - - [784, 512, 64, 512]
    - [18, 40.041]
  - - [3136, 128, 32, 64]
    - [20, 10.807]
  - - [3136, 256, 32, 64]
    - [17, 11.913]
  - - [3136, 256, 32, 128]
    - [51, 18.505]
  - - [784, 512, 32, 256]
    - [79, 28.52]
  - - [3136, 128, 32, 256]
    - [51, 25.764]
  - - [3136, 256, 32, 256]
    - [51, 30.182]
  - - [784, 256, 32, 512]
    - [79, 32.188]
  - - [784, 512, 32, 512]
    - [79, 37.574]
  - - [3136, 64, 64, 64]
    - [20, 10.089]
  - - [3136, 64, 64, 256]
    - [28, 20.48]
  - - [784, 512, 64, 128]
    - [79, 19.417]
  - - [784, 128, 64, 512]
    - [27, 30.618]
  - - [64, 192, 64, 1280]
    - [88, 24.028]
  - - [64, 320, 64, 1280]
    - [35, 26.036]
  - - [64, 384, 64, 1280]
    - [92, 29.845]
  - - [64, 448, 64, 1280]
    - [93, 24.965]
  - - [64, 192, 64, 2048]
    - [88, 24.098]
  - - [64, 320, 64, 2048]
    - [35, 28.585]
  - - [64, 384, 64, 2048]
    - [35, 31.232]
  - - [64, 448, 64, 2048]
    - [35, 28.208]
  - - [64, 192, 32, 1280]
    - [23, 18.531]
  - - [64, 320, 32, 1280]
    - [35, 23.569]
  - - [64, 384, 32, 1280]
    - [93, 26.939]
  - - [64, 448, 32, 1280]
    - [42, 21.238]
  - - [64, 192, 32, 2048]
    - [23, 21.149]
  - - [64, 320, 32, 2048]
    - [35, 27.1]
  - - [64, 384, 32, 2048]
    - [66, 29.315]
  - - [64, 448, 32, 2048]
    - [42, 23.68]
  - - [1024, 10224, 1, 1024]
    - [18, 52.22]
  - - [1024, 10192, 1, 1024]
    - [18, 52.419]
  - - [1024, 10208, 1, 1024]
    - [56, 51.981]
  - - [1024, 10224, 1, 4096]
    - [48, 69.949]
  - - [1024, 10224, 1, 3072]
    - [48, 66.597]
  - - [4096, 10224, 1, 1024]
    - [18, 59.39]
  - - [1024, 10240, 1, 3072]
    - [86, 66.799]
  - - [1024, 10192, 1, 3072]
    - [48, 66.461]
  - - [4096, 10192, 1, 1024]
    - [18, 59.204]
  - - [1024, 10192, 1, 4096]
    - [48, 69.629]
  - - [1024, 10200, 1, 3072]
    - [48, 66.673]
  - - [1024, 10184, 1, 1024]
    - [18, 51.858]
  - - [4096, 10208, 1, 1024]
    - [18, 59.072]
  - - [1024, 10208, 1, 3072]
    - [48, 66.713]
  - - [1024, 10208, 1, 4096]
    - [48, 69.738]
  - - [1024, 10224, 1, 2048]
    - [48, 61.562]
  - - [1024, 10240, 1, 2048]
    - [86, 61.361]
  - - [1024, 10120, 1, 1024]
    - [18, 51.868]
  - - [1024, 10192, 1, 2048]
    - [48, 60.78]
  - - [64, 24, 6816, 24]
    - [60, 3.077]
  - - [1024, 10152, 1, 1024]
    - [18, 52.145]
  - - [1024, 10080, 1, 3072]
    - [48, 65.986]
  - - [64, 26, 6272, 26]
    - [60, 3.47]
  - - [100352, 512, 1, 256]
    - [51, 28.259]
  - - [12544, 2048, 1, 1024]
    - [56, 54.988]
  - - [12544, 64, 1, 147]
    - [61, 6.819]
  - - [200704, 512, 1, 256]
    - [51, 26.536]
  - - [25088, 1024, 1, 512]
    - [94, 43.167]
  - - [3136, 64, 1, 576]
    - [4, 7.003]
  - - [50176, 1024, 1, 512]
    - [94, 45.731]
  - - [6272, 2048, 1, 1024]
    - [18, 54.442]
  - - [784, 128, 1, 1152]
    - [11, 6.115]
  - - [3136, 128, 128, 256]
    - [51, 28.34]
  - - [3136, 128, 256, 256]
    - [51, 28.842]
  - - [3136, 256, 128, 64]
    - [54, 12.485]
  - - [3136, 256, 256, 64]
    - [17, 12.595]
  - - [3136, 64, 128, 256]
    - [28, 21.128]
  - - [3136, 64, 256, 256]
    - [28, 21.53]
  - - [3136, 64, 128, 64]
    - [20, 10.597]
  - - [3136, 64, 256, 64]
    - [75, 10.801]
  - - [784, 128, 128, 512]
    - [95, 31.544]
  - - [784, 128, 256, 512]
    - [18, 32.946]
  - - [784, 256, 128, 512]
    - [79, 38.461]
  - - [784, 256, 256, 512]
    - [78, 39.853]
  - - [784, 512, 128, 128]
    - [79, 19.897]
  - - [784, 512, 256, 128]
    - [79, 20.278]
  - - [128, 128, 2048, 64]
    - [60, 10.465]
  - - [64, 128, 2048, 128]
    - [89, 13.375]
  - - [1024, 2560, 1, 30528]
    - [3, 72.153]
  - - [1024, 128, 1, 1024]
    - [96, 6.937]
  - - [1024, 128, 1, 2]
    - [97, 0.025]
  - - [128, 128, 1536, 64]
    - [21, 10.381]
  - - [64, 128, 1536, 128]
    - [89, 13.236]
  - - [1024, 12288, 1, 4096]
    - [5, 68.25]
  - - [1024, 12288, 1, 1024]
    - [56, 53.194]
  - - [4096, 12288, 1, 1024]
    - [18, 59.325]
  - - [1024, 1920, 1, 30528]
    - [98, 65.474]
  - - [1024, 96, 1, 1024]
    - [13, 5.671]
  - - [1024, 96, 1, 2]
    - [65, 0.019]
  - - [128, 128, 192, 64]
    - [20, 7.849]
  - - [64, 128, 192, 128]
    - [20, 9.611]
  - - [768, 2048, 1, 2]
    - [60, 0.175]
  - - [3072, 2048, 1, 768]
    - [39, 44.842]
  - - [768, 2048, 1, 3072]
    - [26, 47.01]
  - - [768, 2048, 1, 768]
    - [26, 32.715]
  - - [384, 384, 144, 64]
    - [17, 11.538]
  - - [64, 384, 144, 384]
    - [77, 21.625]
  - - [768, 4608, 1, 2]
    - [17, 0.25]
  - - [3072, 4608, 1, 768]
    - [34, 49.053]
  - - [768, 4608, 1, 3072]
    - [86, 63.861]
  - - [768, 4608, 1, 768]
    - [99, 39.614]
  - - [512, 512, 48, 64]
    - [17, 10.814]
  - - [64, 512, 48, 512]
    - [26, 23.384]
  - - [128, 128, 256, 64]
    - [17, 8.241]
  - - [64, 128, 256, 128]
    - [21, 10.393]
  - - [384, 384, 192, 64]
    - [17, 11.625]
  - - [64, 384, 192, 384]
    - [26, 21.176]
  - - [1024, 4608, 1, 2]
    - [25, 0.275]
  - - [4096, 4608, 1, 1024]
    - [18, 55.648]
  - - [1024, 4608, 1, 4096]
    - [2, 58.598]
  - - [1024, 4608, 1, 1024]
    - [59, 43.55]
  - - [8192, 1024, 1, 1024]
    - [78, 48.029]
  - - [8192, 4096, 1, 1024]
    - [18, 57.735]
  - - [16384, 16384, 1, 16384]
    - [6, 80.558]
  - - [196, 1024, 64, 512]
    - [19, 32.932]
  - - [196, 512, 64, 1024]
    - [33, 34.901]
  - - [196, 1024, 64, 1024]
    - [19, 40.15]
  - - [49, 2048, 64, 1024]
    - [100, 21.678]
  - - [49, 1024, 64, 2048]
    - [101, 23.198]
  - - [196, 1024, 32, 512]
    - [19, 29.52]
  - - [196, 512, 32, 1024]
    - [19, 31.883]
  - - [196, 1024, 32, 1024]
    - [19, 36.109]
  - - [49, 2048, 32, 1024]
    - [100, 19.54]
  - - [49, 1024, 32, 2048]
    - [101, 19.468]
  - - [196, 1024, 64, 256]
    - [102, 23.522]
  - - [196, 256, 64, 1024]
    - [19, 31.477]
  - - [49, 2048, 64, 512]
    - [103, 16.554]
  - - [49, 512, 64, 2048]
    - [101, 19.067]
  - - [1225, 32, 64, 192]
    - [104, 11.571]
  - - [1225, 48, 64, 192]
    - [20, 10.463]
  - - [1225, 64, 64, 192]
    - [105, 14.433]
  - - [1225, 48, 64, 256]
    - [20, 11.785]
  - - [1225, 64, 64, 256]
    - [106, 16.062]
  - - [1225, 48, 64, 288]
    - [20, 12.588]
  - - [1225, 64, 64, 288]
    - [105, 18.211]
  - - [5329, 80, 64, 64]
    - [20, 7.927]
  - - [289, 128, 64, 768]
    - [103, 22.511]
  - - [289, 160, 64, 768]
    - [107, 25.891]
  - - [289, 192, 64, 768]
    - [50, 27.833]
  - - [1225, 32, 32, 192]
    - [20, 9.588]
  - - [1225, 48, 32, 192]
    - [20, 8.946]
  - - [1225, 64, 32, 192]
    - [106, 12.921]
  - - [1225, 48, 32, 256]
    - [20, 10.337]
  - - [1225, 64, 32, 256]
    - [105, 14.797]
  - - [1225, 48, 32, 288]
    - [20, 11.141]
  - - [1225, 64, 32, 288]
    - [105, 16.281]
  - - [5329, 80, 32, 64]
    - [20, 7.532]
  - - [289, 128, 32, 768]
    - [103, 19.435]
  - - [289, 160, 32, 768]
    - [108, 20.194]
  - - [289, 192, 32, 768]
    - [109, 26.398]
  - - [196, 256, 1, 2304]
    - [13, 4.538]
  - - [49, 512, 1, 4608]
    - [110, 3.015]
  - - [196, 1024, 128, 256]
    - [19, 25.024]
  - - [196, 1024, 256, 256]
    - [19, 25.701]
  - - [196, 256, 128, 1024]
    - [19, 35.351]
  - - [196, 256, 256, 1024]
    - [111, 38.906]
  - - [196, 512, 128, 1024]
    - [112, 39.319]
  - - [196, 512, 256, 1024]
    - [111, 41.005]
  - - [49, 2048, 128, 512]
    - [113, 17.406]
  - - [49, 2048, 256, 512]
    - [100, 18.121]
  - - [49, 512, 128, 2048]
    - [101, 22.501]
  - - [49, 512, 256, 2048]
    - [113, 24.703]
  - - [512, 1, 1, 500000]
    - [14, 0.427]
  - - [512, 2, 1, 500000]
    - [14, 0.859]
  - - [512, 4, 1, 500000]
    - [14, 1.644]
  - - [512, 8, 1, 500000]
    - [14, 3.443]
  - - [512, 16, 1, 500000]
    - [14, 6.674]
  - - [1024, 2, 1, 500000]
    - [14, 0.907]
  - - [64, 1, 1, 1216]
    - [73, 0.004]
  - - [128, 1, 1, 1024]
    - [12, 0.007]
  - - [128, 1, 1, 1408]
    - [64, 0.009]
  - - [512, 1, 1, 512]
    - [64, 0.021]
  - - [3072, 1, 1, 128]
    - [10, 0.042]
  - - [512, 2, 1, 512]
    - [114, 0.037]
  - - [4224, 1, 1, 128]
    - [10, 0.054]
  - - [512, 4, 1, 512]
    - [114, 0.078]
  - - [1024, 2, 1, 512]
    - [114, 0.077]
  - - [3072, 1, 1, 1024]
    - [67, 0.175]
  - - [512, 16, 1, 512]
    - [73, 0.303]
  - - [3072, 2, 1, 1024]
    - [67, 0.356]
  - - [4608, 1, 1, 1536]
    - [115, 0.279]
  - - [3072, 4, 1, 1024]
    - [11, 0.705]
  - - [4608, 2, 1, 1536]
    - [115, 0.546]
  - - [6144, 1, 1, 2560]
    - [115, 0.454]
  - - [7680, 1, 1, 2560]
    - [116, 0.406]
  - - [8448, 1, 1, 2816]
    - [10, 0.451]
  - - [4608, 4, 1, 1536]
    - [115, 1.108]
  - - [6144, 2, 1, 2560]
    - [115, 0.895]
  - - [7680, 2, 1, 2560]
    - [10, 0.831]
  - - [8448, 2, 1, 2816]
    - [10, 0.919]
  - - [1760, 16, 1, 1760]
    - [11, 1.843]
  - - [3072, 16, 1, 1024]
    - [13, 2.793]
  - - [6144, 4, 1, 2560]
    - [115, 1.817]
  - - [2048, 16, 1, 2048]
    - [12, 2.653]
  - - [7680, 4, 1, 2560]
    - [10, 1.665]
  - - [8448, 4, 1, 2816]
    - [10, 1.852]
  - - [2560, 16, 1, 2560]
    - [12, 3.527]
  - - [4608, 16, 1, 1536]
    - [115, 4.281]
  - - [6144, 16, 1, 2560]
    - [115, 7.289]
  - - [4096, 16, 1, 4096]
    - [115, 5.57]
  - - [7680, 16, 1, 2560]
    - [116, 6.491]
  - - [8448, 16, 1, 2816]
    - [116, 7.088]
  - - [64, 64, 1, 256]
    - [62, 0.089]
  - - [128, 64, 1, 256]
    - [67, 0.189]
  - - [64, 256, 1, 256]
    - [13, 0.411]
  - - [128, 256, 1, 256]
    - [62, 0.727]
  - - [64, 448, 1, 256]
    - [62, 0.651]
  - - [128, 448, 1, 256]
    - [73, 1.292]
  - - [64, 704, 1, 256]
    - [62, 1.015]
  - - [128, 704, 1, 256]
    - [114, 1.999]
  - - [64, 1024, 1, 256]
    - [114, 1.454]
  - - [128, 1024, 1, 256]
    - [65, 2.7]
  - - [64, 1408, 1, 256]
    - [73, 1.999]
  - - [128, 1408, 1, 256]
    - [65, 3.635]
  - - [64, 1856, 1, 256]
    - [10, 2.396]
  - - [128, 1856, 1, 256]
    - [10, 4.693]
  - - [64, 2368, 1, 256]
    - [52, 2.973]
  - - [128, 2368, 1, 256]
    - [10, 5.907]
  - - [64, 2944, 1, 256]
    - [10, 3.722]
  - - [128, 2944, 1, 256]
    - [4, 6.923]
  - - [64, 3584, 1, 256]
    - [10, 4.411]
  - - [128, 3584, 1, 256]
    - [15, 7.693]
  - - [64, 4288, 1, 256]
    - [10, 5.277]
  - - [128, 4288, 1, 256]
    - [15, 9.204]
  - - [64, 5056, 1, 256]
    - [10, 6.06]
  - - [128, 5056, 1, 256]
    - [8, 10.144]
  - - [64, 5888, 1, 256]
    - [117, 6.879]
  - - [128, 5888, 1, 256]
    - [88, 11.501]
  - - [64, 6784, 1, 256]
    - [4, 8.027]
  - - [128, 6784, 1, 256]
    - [88, 12.843]
  - - [64, 64, 1, 1280]
    - [12, 0.292]
  - - [128, 64, 1, 1280]
    - [12, 0.549]
  - - [64, 256, 1, 1280]
    - [13, 1.27]
  - - [128, 256, 1, 1280]
    - [13, 2.261]
  - - [64, 448, 1, 1280]
    - [118, 2.037]
  - - [128, 448, 1, 1280]
    - [13, 3.957]
  - - [64, 704, 1, 1280]
    - [67, 3.139]
  - - [128, 704, 1, 1280]
    - [12, 6.159]
  - - [64, 1024, 1, 1280]
    - [36, 4.479]
  - - [128, 1024, 1, 1280]
    - [72, 7.591]
  - - [64, 1408, 1, 1280]
    - [13, 6.044]
  - - [128, 1408, 1, 1280]
    - [96, 10.233]
  - - [64, 1856, 1, 1280]
    - [49, 7.321]
  - - [128, 1856, 1, 1280]
    - [23, 12.063]
  - - [64, 2368, 1, 1280]
    - [72, 9.145]
  - - [128, 2368, 1, 1280]
    - [23, 15.073]
  - - [64, 2944, 1, 1280]
    - [72, 10.912]
  - - [128, 2944, 1, 1280]
    - [23, 18.675]
  - - [64, 3584, 1, 1280]
    - [4, 11.213]
  - - [128, 3584, 1, 1280]
    - [46, 19.458]
  - - [64, 4288, 1, 1280]
    - [4, 13.105]
  - - [128, 4288, 1, 1280]
    - [42, 23.009]
  - - [64, 5056, 1, 1280]
    - [4, 15.005]
  - - [128, 5056, 1, 1280]
    - [66, 26.364]
  - - [64, 5888, 1, 1280]
    - [23, 17.417]
  - - [128, 5888, 1, 1280]
    - [9, 29.217]
  - - [64, 6784, 1, 1280]
    - [23, 20.263]
  - - [128, 6784, 1, 1280]
    - [66, 33.483]
  - - [64, 64, 1, 3328]
    - [64, 0.445]
  - - [128, 64, 1, 3328]
    - [119, 0.893]
  - - [64, 256, 1, 3328]
    - [118, 1.812]
  - - [128, 256, 1, 3328]
    - [12, 3.242]
  - - [64, 448, 1, 3328]
    - [120, 3.134]
  - - [128, 448, 1, 3328]
    - [12, 5.673]
  - - [64, 704, 1, 3328]
    - [12, 4.883]
  - - [128, 704, 1, 3328]
    - [64, 8.891]
  - - [64, 1024, 1, 3328]
    - [118, 6.961]
  - - [128, 1024, 1, 3328]
    - [49, 11.019]
  - - [64, 1408, 1, 3328]
    - [118, 9.282]
  - - [128, 1408, 1, 3328]
    - [49, 14.754]
  - - [64, 1856, 1, 3328]
    - [49, 11.024]
  - - [128, 1856, 1, 3328]
    - [23, 16.619]
  - - [64, 2368, 1, 3328]
    - [72, 13.927]
  - - [128, 2368, 1, 3328]
    - [121, 21.203]
  - - [64, 2944, 1, 3328]
    - [122, 16.82]
  - - [128, 2944, 1, 3328]
    - [23, 25.458]
  - - [64, 3584, 1, 3328]
    - [23, 14.602]
  - - [128, 3584, 1, 3328]
    - [42, 25.673]
  - - [64, 4288, 1, 3328]
    - [23, 17.121]
  - - [128, 4288, 1, 3328]
    - [46, 30.762]
  - - [64, 5056, 1, 3328]
    - [23, 19.537]
  - - [128, 5056, 1, 3328]
    - [35, 35.065]
  - - [64, 5888, 1, 3328]
    - [23, 22.535]
  - - [128, 5888, 1, 3328]
    - [93, 39.97]
  - - [64, 6784, 1, 3328]
    - [4, 25.516]
  - - [128, 6784, 1, 3328]
    - [35, 45.857]
  - - [256, 64, 1, 256]
    - [62, 0.372]
  - - [448, 64, 1, 256]
    - [62, 0.641]
  - - [704, 64, 1, 256]
    - [62, 0.984]
  - - [1408, 64, 1, 256]
    - [62, 1.911]
  - - [1856, 64, 1, 256]
    - [10, 2.538]
  - - [2368, 64, 1, 256]
    - [10, 3.167]
  - - [2944, 64, 1, 256]
    - [10, 3.938]
  - - [3584, 64, 1, 256]
    - [4, 4.5]
  - - [4288, 64, 1, 256]
    - [10, 5.574]
  - - [5056, 64, 1, 256]
    - [4, 6.306]
  - - [5888, 64, 1, 256]
    - [4, 7.012]
  - - [6784, 64, 1, 256]
    - [4, 8.131]
  - - [256, 128, 1, 256]
    - [62, 0.744]
  - - [448, 128, 1, 256]
    - [114, 1.272]
  - - [704, 128, 1, 256]
    - [62, 1.969]
  - - [1408, 128, 1, 256]
    - [10, 3.687]
  - - [1856, 128, 1, 256]
    - [10, 4.825]
  - - [2368, 128, 1, 256]
    - [10, 6.113]
  - - [2944, 128, 1, 256]
    - [4, 6.967]
  - - [3584, 128, 1, 256]
    - [15, 7.783]
  - - [4288, 128, 1, 256]
    - [15, 8.944]
  - - [5056, 128, 1, 256]
    - [97, 10.256]
  - - [5888, 128, 1, 256]
    - [88, 11.624]
  - - [6784, 128, 1, 256]
    - [88, 12.778]
  - - [256, 64, 1, 1280]
    - [64, 1.131]
  - - [448, 64, 1, 1280]
    - [45, 2.047]
  - - [704, 64, 1, 1280]
    - [12, 3.079]
  - - [1408, 64, 1, 1280]
    - [64, 5.801]
  - - [1856, 64, 1, 1280]
    - [96, 7.049]
  - - [2368, 64, 1, 1280]
    - [49, 8.777]
  - - [2944, 64, 1, 1280]
    - [96, 10.491]
  - - [3584, 64, 1, 1280]
    - [23, 11.526]
  - - [4288, 64, 1, 1280]
    - [121, 13.554]
  - - [5056, 64, 1, 1280]
    - [121, 15.555]
  - - [5888, 64, 1, 1280]
    - [23, 18.297]
  - - [6784, 64, 1, 1280]
    - [23, 20.068]
  - - [256, 128, 1, 1280]
    - [123, 2.294]
  - - [448, 128, 1, 1280]
    - [67, 3.976]
  - - [704, 128, 1, 1280]
    - [67, 6.044]
  - - [1408, 128, 1, 1280]
    - [122, 10.522]
  - - [1856, 128, 1, 1280]
    - [23, 12.235]
  - - [2368, 128, 1, 1280]
    - [23, 14.97]
  - - [2944, 128, 1, 1280]
    - [23, 18.547]
  - - [3584, 128, 1, 1280]
    - [9, 18.688]
  - - [4288, 128, 1, 1280]
    - [9, 22.234]
  - - [5056, 128, 1, 1280]
    - [9, 26.514]
  - - [5888, 128, 1, 1280]
    - [9, 28.602]
  - - [6784, 128, 1, 1280]
    - [9, 32.192]
  - - [256, 64, 1, 3328]
    - [119, 1.697]
  - - [448, 64, 1, 3328]
    - [64, 3.045]
  - - [704, 64, 1, 3328]
    - [120, 4.745]
  - - [1408, 64, 1, 3328]
    - [120, 8.468]
  - - [1856, 64, 1, 3328]
    - [122, 10.784]
  - - [2368, 64, 1, 3328]
    - [96, 13.339]
  - - [2944, 64, 1, 3328]
    - [115, 15.358]
  - - [3584, 64, 1, 3328]
    - [23, 15.358]
  - - [4288, 64, 1, 3328]
    - [121, 17.589]
  - - [5056, 64, 1, 3328]
    - [121, 20.74]
  - - [5888, 64, 1, 3328]
    - [23, 23.588]
  - - [6784, 64, 1, 3328]
    - [23, 26.908]
  - - [256, 128, 1, 3328]
    - [119, 3.366]
  - - [448, 128, 1, 3328]
    - [12, 6.161]
  - - [704, 128, 1, 3328]
    - [12, 9.334]
  - - [1408, 128, 1, 3328]
    - [122, 14.983]
  - - [1856, 128, 1, 3328]
    - [23, 15.822]
  - - [2368, 128, 1, 3328]
    - [121, 19.662]
  - - [2944, 128, 1, 3328]
    - [23, 25.186]
  - - [3584, 128, 1, 3328]
    - [85, 23.89]
  - - [4288, 128, 1, 3328]
    - [16, 28.543]
  - - [5056, 128, 1, 3328]
    - [124, 33.24]
  - - [5888, 128, 1, 3328]
    - [16, 37.728]
  - - [6784, 128, 1, 3328]
    - [16, 43.124]
  - - [256, 256, 1, 256]
    - [114, 1.454]
  - - [448, 256, 1, 256]
    - [10, 2.414]
  - - [256, 448, 1, 256]
    - [31, 2.397]
  - - [448, 448, 1, 256]
    - [10, 4.077]
  - - [256, 256, 1, 1280]
    - [118, 4.566]
  - - [448, 256, 1, 1280]
    - [96, 6.806]
  - - [256, 448, 1, 1280]
    - [49, 6.92]
  - - [448, 448, 1, 1280]
    - [96, 12.11]
  - - [256, 256, 1, 3328]
    - [118, 6.641]
  - - [448, 256, 1, 3328]
    - [96, 10.859]
  - - [256, 448, 1, 3328]
    - [49, 9.863]
  - - [448, 448, 1, 3328]
    - [96, 18.046]
  - - [512, 32, 1, 512]
    - [62, 0.622]
  - - [1760, 32, 1, 1760]
    - [13, 3.568]
  - - [3072, 32, 1, 1024]
    - [13, 5.35]
  - - [2048, 32, 1, 2048]
    - [64, 5.232]
  - - [1760, 64, 1, 1760]
    - [13, 7.113]
  - - [3072, 64, 1, 1024]
    - [49, 10.172]
  - - [2560, 32, 1, 2560]
    - [123, 6.79]
  - - [4608, 32, 1, 1536]
    - [115, 8.45]
  - - [128, 1500, 1, 1280]
    - [49, 11.075]
  - - [2048, 64, 1, 2048]
    - [49, 9.249]
  - - [176, 1500, 1, 1408]
    - [23, 13.731]
  - - [1760, 128, 1, 1760]
    - [49, 11.603]
  - - [3072, 128, 1, 1024]
    - [23, 16.864]
  - - [2560, 64, 1, 2560]
    - [49, 12.242]
  - - [6144, 32, 1, 2560]
    - [115, 14.106]
  - - [2048, 128, 1, 2048]
    - [23, 15.834]
  - - [4096, 32, 1, 4096]
    - [115, 10.84]
  - - [7680, 32, 1, 2560]
    - [10, 12.635]
  - - [8448, 32, 1, 2816]
    - [10, 14.13]
  - - [2560, 128, 1, 2560]
    - [23, 21.143]
  - - [4096, 64, 1, 4096]
    - [121, 17.431]
  - - [7680, 64, 1, 2560]
    - [16, 23.987]
  - - [4096, 128, 1, 4096]
    - [85, 29.115]
  - - [7680, 128, 1, 2560]
    - [77, 31.573]
  - - [704, 256, 1, 256]
    - [10, 3.687]
  - - [1024, 256, 1, 256]
    - [10, 5.214]
  - - [1408, 256, 1, 256]
    - [4, 6.795]
  - - [1856, 256, 1, 256]
    - [15, 7.968]
  - - [2368, 256, 1, 256]
    - [15, 9.935]
  - - [2944, 256, 1, 256]
    - [88, 11.687]
  - - [3584, 256, 1, 256]
    - [77, 11.213]
  - - [4288, 256, 1, 256]
    - [87, 13.359]
  - - [5056, 256, 1, 256]
    - [77, 15.752]
  - - [5888, 256, 1, 256]
    - [26, 17.601]
  - - [6784, 256, 1, 256]
    - [77, 19.491]
  - - [704, 448, 1, 256]
    - [4, 6.146]
  - - [1024, 448, 1, 256]
    - [61, 7.648]
  - - [1408, 448, 1, 256]
    - [88, 9.942]
  - - [1856, 448, 1, 256]
    - [88, 13.033]
  - - [2368, 448, 1, 256]
    - [26, 13.479]
  - - [2944, 448, 1, 256]
    - [87, 15.785]
  - - [3584, 448, 1, 256]
    - [28, 16.481]
  - - [4288, 448, 1, 256]
    - [28, 19.373]
  - - [5056, 448, 1, 256]
    - [76, 19.678]
  - - [5888, 448, 1, 256]
    - [125, 19.116]
  - - [6784, 448, 1, 256]
    - [26, 20.529]
  - - [256, 704, 1, 256]
    - [65, 3.687]
  - - [448, 704, 1, 256]
    - [116, 5.945]
  - - [704, 704, 1, 256]
    - [15, 8.664]
  - - [1024, 704, 1, 256]
    - [88, 11.362]
  - - [1408, 704, 1, 256]
    - [95, 12.485]
  - - [1856, 704, 1, 256]
    - [27, 15.637]
  - - [2368, 704, 1, 256]
    - [28, 16.812]
  - - [2944, 704, 1, 256]
    - [28, 19.729]
  - - [3584, 704, 1, 256]
    - [125, 18.66]
  - - [4288, 704, 1, 256]
    - [77, 20.39]
  - - [5056, 704, 1, 256]
    - [79, 22.366]
  - - [5888, 704, 1, 256]
    - [28, 23.535]
  - - [6784, 704, 1, 256]
    - [79, 23.668]
  - - [448, 1024, 1, 256]
    - [15, 7.783]
  - - [704, 1024, 1, 256]
    - [88, 11.239]
  - - [1408, 1024, 1, 256]
    - [26, 17.042]
  - - [1856, 1024, 1, 256]
    - [28, 18.709]
  - - [2368, 1024, 1, 256]
    - [19, 20.155]
  - - [2944, 1024, 1, 256]
    - [87, 20.174]
  - - [3584, 1024, 1, 256]
    - [79, 22.331]
  - - [4288, 1024, 1, 256]
    - [51, 21.76]
  - - [5056, 1024, 1, 256]
    - [51, 25.139]
  - - [5888, 1024, 1, 256]
    - [79, 25.424]
  - - [6784, 1024, 1, 256]
    - [51, 26.329]
  - - [256, 1408, 1, 256]
    - [4, 6.751]
  - - [448, 1408, 1, 256]
    - [88, 9.834]
  - - [704, 1408, 1, 256]
    - [87, 12.218]
  - - [1024, 1408, 1, 256]
    - [26, 16.904]
  - - [1408, 1408, 1, 256]
    - [28, 19.317]
  - - [1856, 1408, 1, 256]
    - [125, 19.628]
  - - [2368, 1408, 1, 256]
    - [77, 21.806]
  - - [2944, 1408, 1, 256]
    - [28, 23.26]
  - - [3584, 1408, 1, 256]
    - [51, 24.177]
  - - [4288, 1408, 1, 256]
    - [79, 25.019]
  - - [5056, 1408, 1, 256]
    - [51, 26.805]
  - - [5888, 1408, 1, 256]
    - [51, 27.707]
  - - [6784, 1408, 1, 256]
    - [51, 30.408]
  - - [256, 1856, 1, 256]
    - [8, 8.256]
  - - [448, 1856, 1, 256]
    - [88, 12.757]
  - - [704, 1856, 1, 256]
    - [26, 15.382]
  - - [1024, 1856, 1, 256]
    - [28, 19.233]
  - - [1408, 1856, 1, 256]
    - [76, 21.352]
  - - [1856, 1856, 1, 256]
    - [77, 22.03]
  - - [2368, 1856, 1, 256]
    - [79, 21.856]
  - - [2944, 1856, 1, 256]
    - [51, 25.175]
  - - [3584, 1856, 1, 256]
    - [51, 24.884]
  - - [4288, 1856, 1, 256]
    - [51, 26.475]
  - - [5056, 1856, 1, 256]
    - [51, 29.04]
  - - [5888, 1856, 1, 256]
    - [51, 29.595]
  - - [6784, 1856, 1, 256]
    - [51, 30.44]
  - - [256, 2368, 1, 256]
    - [88, 9.66]
  - - [448, 2368, 1, 256]
    - [26, 12.965]
  - - [704, 2368, 1, 256]
    - [26, 18.637]
  - - [1024, 2368, 1, 256]
    - [41, 20.51]
  - - [1408, 2368, 1, 256]
    - [77, 21.275]
  - - [1856, 2368, 1, 256]
    - [125, 22.007]
  - - [2368, 2368, 1, 256]
    - [51, 26.128]
  - - [2944, 2368, 1, 256]
    - [51, 26.457]
  - - [3584, 2368, 1, 256]
    - [51, 27.753]
  - - [4288, 2368, 1, 256]
    - [51, 28.323]
  - - [5056, 2368, 1, 256]
    - [51, 29.439]
  - - [5888, 2368, 1, 256]
    - [51, 31.029]
  - - [6784, 2368, 1, 256]
    - [51, 31.649]
  - - [256, 2944, 1, 256]
    - [88, 11.814]
  - - [448, 2944, 1, 256]
    - [77, 15.277]
  - - [704, 2944, 1, 256]
    - [19, 18.507]
  - - [1024, 2944, 1, 256]
    - [77, 20.081]
  - - [1408, 2944, 1, 256]
    - [28, 22.347]
  - - [1856, 2944, 1, 256]
    - [51, 25.542]
  - - [2368, 2944, 1, 256]
    - [51, 25.878]
  - - [2944, 2944, 1, 256]
    - [51, 28.407]
  - - [3584, 2944, 1, 256]
    - [51, 29.432]
  - - [4288, 2944, 1, 256]
    - [51, 29.698]
  - - [5056, 2944, 1, 256]
    - [51, 31.777]
  - - [5888, 2944, 1, 256]
    - [51, 33.375]
  - - [6784, 2944, 1, 256]
    - [79, 30.771]
  - - [256, 3584, 1, 256]
    - [61, 11.556]
  - - [448, 3584, 1, 256]
    - [26, 17.949]
  - - [704, 3584, 1, 256]
    - [125, 19.252]
  - - [1024, 3584, 1, 256]
    - [78, 22.862]
  - - [1408, 3584, 1, 256]
    - [79, 24.097]
  - - [1856, 3584, 1, 256]
    - [79, 25.311]
  - - [2368, 3584, 1, 256]
    - [51, 27.411]
  - - [2944, 3584, 1, 256]
    - [51, 28.602]
  - - [3584, 3584, 1, 256]
    - [51, 30.145]
  - - [4288, 3584, 1, 256]
    - [51, 32.307]
  - - [5056, 3584, 1, 256]
    - [51, 31.791]
  - - [5888, 3584, 1, 256]
    - [51, 33.46]
  - - [6784, 3584, 1, 256]
    - [51, 33.553]
  - - [256, 4288, 1, 256]
    - [26, 13.359]
  - - [448, 4288, 1, 256]
    - [28, 18.593]
  - - [704, 4288, 1, 256]
    - [75, 19.924]
  - - [1024, 4288, 1, 256]
    - [28, 23.895]
  - - [1408, 4288, 1, 256]
    - [51, 26.914]
  - - [1856, 4288, 1, 256]
    - [51, 26.144]
  - - [2368, 4288, 1, 256]
    - [79, 28.079]
  - - [2944, 4288, 1, 256]
    - [51, 29.771]
  - - [3584, 4288, 1, 256]
    - [51, 32.26]
  - - [4288, 4288, 1, 256]
    - [51, 31.756]
  - - [5056, 4288, 1, 256]
    - [51, 33.709]
  - - [5888, 4288, 1, 256]
    - [51, 34.61]
  - - [6784, 4288, 1, 256]
    - [51, 34.641]
  - - [256, 5056, 1, 256]
    - [26, 15.49]
  - - [448, 5056, 1, 256]
    - [126, 18.882]
  - - [704, 5056, 1, 256]
    - [26, 22.173]
  - - [1024, 5056, 1, 256]
    - [51, 24.641]
  - - [1408, 5056, 1, 256]
    - [51, 26.156]
  - - [1856, 5056, 1, 256]
    - [51, 28.916]
  - - [2368, 5056, 1, 256]
    - [51, 28.776]
  - - [2944, 5056, 1, 256]
    - [51, 31.291]
  - - [3584, 5056, 1, 256]
    - [51, 32.422]
  - - [4288, 5056, 1, 256]
    - [51, 32.876]
  - - [5056, 5056, 1, 256]
    - [51, 33.468]
  - - [5888, 5056, 1, 256]
    - [51, 34.903]
  - - [6784, 5056, 1, 256]
    - [51, 35.332]
  - - [256, 5888, 1, 256]
    - [27, 17.39]
  - - [448, 5888, 1, 256]
    - [125, 19.608]
  - - [704, 5888, 1, 256]
    - [79, 21.273]
  - - [1024, 5888, 1, 256]
    - [51, 27.045]
  - - [1408, 5888, 1, 256]
    - [51, 26.132]
  - - [1856, 5888, 1, 256]
    - [51, 29.54]
  - - [2368, 5888, 1, 256]
    - [51, 29.921]
  - - [2944, 5888, 1, 256]
    - [51, 32.507]
  - - [3584, 5888, 1, 256]
    - [51, 33.043]
  - - [4288, 5888, 1, 256]
    - [51, 34.188]
  - - [5056, 5888, 1, 256]
    - [51, 34.946]
  - - [5888, 5888, 1, 256]
    - [51, 35.072]
  - - [6784, 5888, 1, 256]
    - [51, 36.025]
  - - [256, 6784, 1, 256]
    - [26, 18.831]
  - - [448, 6784, 1, 256]
    - [77, 19.743]
  - - [704, 6784, 1, 256]
    - [79, 23.347]
  - - [1024, 6784, 1, 256]
    - [51, 26.089]
  - - [1408, 6784, 1, 256]
    - [51, 29.092]
  - - [1856, 6784, 1, 256]
    - [51, 29.694]
  - - [2368, 6784, 1, 256]
    - [51, 30.972]
  - - [2944, 6784, 1, 256]
    - [51, 32.711]
  - - [3584, 6784, 1, 256]
    - [51, 33.845]
  - - [4288, 6784, 1, 256]
    - [51, 34.656]
  - - [5056, 6784, 1, 256]
    - [51, 34.386]
  - - [5888, 6784, 1, 256]
    - [51, 35.801]
  - - [6784, 6784, 1, 256]
    - [51, 35.759]
  - - [704, 256, 1, 1280]
    - [49, 10.696]
  - - [1024, 256, 1, 1280]
    - [23, 13.797]
  - - [1408, 256, 1, 1280]
    - [23, 17.741]
  - - [1856, 256, 1, 1280]
    - [9, 19.746]
  - - [2368, 256, 1, 1280]
    - [9, 24.352]
  - - [2944, 256, 1, 1280]
    - [9, 29.777]
  - - [3584, 256, 1, 1280]
    - [3, 28.701]
  - - [4288, 256, 1, 1280]
    - [3, 34.564]
  - - [5056, 256, 1, 1280]
    - [26, 34.759]
  - - [5888, 256, 1, 1280]
    - [77, 39.026]
  - - [6784, 256, 1, 1280]
    - [77, 42.521]
  - - [704, 448, 1, 1280]
    - [23, 15.471]
  - - [1024, 448, 1, 1280]
    - [42, 20.232]
  - - [1408, 448, 1, 1280]
    - [9, 26.367]
  - - [1856, 448, 1, 1280]
    - [16, 28.756]
  - - [2368, 448, 1, 1280]
    - [3, 33.477]
  - - [2944, 448, 1, 1280]
    - [26, 35.288]
  - - [3584, 448, 1, 1280]
    - [127, 34.82]
  - - [4288, 448, 1, 1280]
    - [128, 41.042]
  - - [5056, 448, 1, 1280]
    - [19, 41.506]
  - - [5888, 448, 1, 1280]
    - [129, 39.749]
  - - [6784, 448, 1, 1280]
    - [129, 44.999]
  - - [256, 704, 1, 1280]
    - [122, 10.396]
  - - [448, 704, 1, 1280]
    - [23, 15.523]
  - - [704, 704, 1, 1280]
    - [46, 20.96]
  - - [1024, 704, 1, 1280]
    - [35, 29.451]
  - - [1408, 704, 1, 1280]
    - [3, 31.348]
  - - [1856, 704, 1, 1280]
    - [26, 34.638]
  - - [2368, 704, 1, 1280]
    - [127, 37.273]
  - - [2944, 704, 1, 1280]
    - [28, 41.686]
  - - [3584, 704, 1, 1280]
    - [130, 37.942]
  - - [4288, 704, 1, 1280]
    - [129, 45.395]
  - - [5056, 704, 1, 1280]
    - [1, 47.049]
  - - [5888, 704, 1, 1280]
    - [28, 43.954]
  - - [6784, 704, 1, 1280]
    - [131, 47.896]
  - - [448, 1024, 1, 1280]
    - [42, 19.867]
  - - [704, 1024, 1, 1280]
    - [9, 28.959]
  - - [1408, 1024, 1, 1280]
    - [100, 36.35]
  - - [1856, 1024, 1, 1280]
    - [127, 41.03]
  - - [2368, 1024, 1, 1280]
    - [19, 44.433]
  - - [2944, 1024, 1, 1280]
    - [129, 45.715]
  - - [3584, 1024, 1, 1280]
    - [131, 46.508]
  - - [4288, 1024, 1, 1280]
    - [131, 43.7]
  - - [5056, 1024, 1, 1280]
    - [131, 50.244]
  - - [5888, 1024, 1, 1280]
    - [18, 51.419]
  - - [6784, 1024, 1, 1280]
    - [99, 53.659]
  - - [256, 1408, 1, 1280]
    - [23, 17.924]
  - - [448, 1408, 1, 1280]
    - [85, 25.339]
  - - [704, 1408, 1, 1280]
    - [3, 31.486]
  - - [1024, 1408, 1, 1280]
    - [26, 37.063]
  - - [1408, 1408, 1, 1280]
    - [28, 40.495]
  - - [1856, 1408, 1, 1280]
    - [132, 42.107]
  - - [2368, 1408, 1, 1280]
    - [48, 46.501]
  - - [2944, 1408, 1, 1280]
    - [55, 48.521]
  - - [3584, 1408, 1, 1280]
    - [126, 48.71]
  - - [4288, 1408, 1, 1280]
    - [18, 51.066]
  - - [5056, 1408, 1, 1280]
    - [48, 52.218]
  - - [5888, 1408, 1, 1280]
    - [39, 53.684]
  - - [6784, 1408, 1, 1280]
    - [34, 51.707]
  - - [256, 1856, 1, 1280]
    - [46, 20.701]
  - - [448, 1856, 1, 1280]
    - [93, 33.683]
  - - [704, 1856, 1, 1280]
    - [27, 34.638]
  - - [1024, 1856, 1, 1280]
    - [28, 39.779]
  - - [1408, 1856, 1, 1280]
    - [19, 46.354]
  - - [1856, 1856, 1, 1280]
    - [77, 44.956]
  - - [2368, 1856, 1, 1280]
    - [34, 44.446]
  - - [2944, 1856, 1, 1280]
    - [18, 46.903]
  - - [3584, 1856, 1, 1280]
    - [48, 50.119]
  - - [4288, 1856, 1, 1280]
    - [18, 51.398]
  - - [5056, 1856, 1, 1280]
    - [18, 50.798]
  - - [5888, 1856, 1, 1280]
    - [34, 52.549]
  - - [6784, 1856, 1, 1280]
    - [18, 56.654]
  - - [256, 2368, 1, 1280]
    - [9, 25.121]
  - - [448, 2368, 1, 1280]
    - [2, 33.477]
  - - [704, 2368, 1, 1280]
    - [26, 41.026]
  - - [1024, 2368, 1, 1280]
    - [33, 43.493]
  - - [1408, 2368, 1, 1280]
    - [133, 47.938]
  - - [1856, 2368, 1, 1280]
    - [34, 44.168]
  - - [2368, 2368, 1, 1280]
    - [18, 47.906]
  - - [2944, 2368, 1, 1280]
    - [34, 48.497]
  - - [3584, 2368, 1, 1280]
    - [18, 54.761]
  - - [4288, 2368, 1, 1280]
    - [56, 53.211]
  - - [5056, 2368, 1, 1280]
    - [18, 53.687]
  - - [5888, 2368, 1, 1280]
    - [34, 55.178]
  - - [6784, 2368, 1, 1280]
    - [34, 56.712]
  - - [256, 2944, 1, 1280]
    - [9, 29.777]
  - - [448, 2944, 1, 1280]
    - [100, 33.605]
  - - [704, 2944, 1, 1280]
    - [19, 38.467]
  - - [1024, 2944, 1, 1280]
    - [134, 44.226]
  - - [1408, 2944, 1, 1280]
    - [56, 47.293]
  - - [1856, 2944, 1, 1280]
    - [56, 46.598]
  - - [2368, 2944, 1, 1280]
    - [34, 48.172]
  - - [2944, 2944, 1, 1280]
    - [18, 55.379]
  - - [3584, 2944, 1, 1280]
    - [18, 55.392]
  - - [4288, 2944, 1, 1280]
    - [18, 56.05]
  - - [5056, 2944, 1, 1280]
    - [18, 57.272]
  - - [5888, 2944, 1, 1280]
    - [18, 58.694]
  - - [6784, 2944, 1, 1280]
    - [34, 57.952]
  - - [256, 3584, 1, 1280]
    - [3, 29.144]
  - - [448, 3584, 1, 1280]
    - [27, 39.446]
  - - [704, 3584, 1, 1280]
    - [135, 39.041]
  - - [1024, 3584, 1, 1280]
    - [1, 47.382]
  - - [1408, 3584, 1, 1280]
    - [34, 48.322]
  - - [1856, 3584, 1, 1280]
    - [136, 49.143]
  - - [2368, 3584, 1, 1280]
    - [18, 54.155]
  - - [2944, 3584, 1, 1280]
    - [18, 54.853]
  - - [3584, 3584, 1, 1280]
    - [18, 57.19]
  - - [4288, 3584, 1, 1280]
    - [34, 55.062]
  - - [5056, 3584, 1, 1280]
    - [34, 56.624]
  - - [5888, 3584, 1, 1280]
    - [18, 58.288]
  - - [6784, 3584, 1, 1280]
    - [34, 58.429]
  - - [256, 4288, 1, 1280]
    - [44, 33.826]
  - - [448, 4288, 1, 1280]
    - [28, 38.53]
  - - [704, 4288, 1, 1280]
    - [133, 43.534]
  - - [1024, 4288, 1, 1280]
    - [56, 49.278]
  - - [1408, 4288, 1, 1280]
    - [56, 50.183]
  - - [1856, 4288, 1, 1280]
    - [18, 51.352]
  - - [2368, 4288, 1, 1280]
    - [18, 53.287]
  - - [2944, 4288, 1, 1280]
    - [18, 55.284]
  - - [3584, 4288, 1, 1280]
    - [18, 58.461]
  - - [4288, 4288, 1, 1280]
    - [34, 57.134]
  - - [5056, 4288, 1, 1280]
    - [18, 59.102]
  - - [5888, 4288, 1, 1280]
    - [34, 59.571]
  - - [6784, 4288, 1, 1280]
    - [34, 60.136]
  - - [256, 5056, 1, 1280]
    - [2, 38.968]
  - - [448, 5056, 1, 1280]
    - [33, 40.882]
  - - [704, 5056, 1, 1280]
    - [1, 46.707]
  - - [1024, 5056, 1, 1280]
    - [33, 49.511]
  - - [1408, 5056, 1, 1280]
    - [137, 51.641]
  - - [1856, 5056, 1, 1280]
    - [34, 51.533]
  - - [2368, 5056, 1, 1280]
    - [56, 53.355]
  - - [2944, 5056, 1, 1280]
    - [18, 57.226]
  - - [3584, 5056, 1, 1280]
    - [34, 57.433]
  - - [4288, 5056, 1, 1280]
    - [18, 59.406]
  - - [5056, 5056, 1, 1280]
    - [34, 58.937]
  - - [5888, 5056, 1, 1280]
    - [34, 60.035]
  - - [6784, 5056, 1, 1280]
    - [34, 60.477]
  - - [256, 5888, 1, 1280]
    - [26, 37.285]
  - - [448, 5888, 1, 1280]
    - [135, 38.463]
  - - [704, 5888, 1, 1280]
    - [33, 41.657]
  - - [1024, 5888, 1, 1280]
    - [18, 51.147]
  - - [1408, 5888, 1, 1280]
    - [18, 52.761]
  - - [1856, 5888, 1, 1280]
    - [34, 52.27]
  - - [2368, 5888, 1, 1280]
    - [34, 54.432]
  - - [2944, 5888, 1, 1280]
    - [18, 58.42]
  - - [3584, 5888, 1, 1280]
    - [34, 58.355]
  - - [4288, 5888, 1, 1280]
    - [34, 58.284]
  - - [5056, 5888, 1, 1280]
    - [34, 59.281]
  - - [5888, 5888, 1, 1280]
    - [34, 60.638]
  - - [6784, 5888, 1, 1280]
    - [18, 61.681]
  - - [256, 6784, 1, 1280]
    - [26, 40.857]
  - - [448, 6784, 1, 1280]
    - [138, 44.361]
  - - [704, 6784, 1, 1280]
    - [76, 46.193]
  - - [1024, 6784, 1, 1280]
    - [86, 51.8]
  - - [1408, 6784, 1, 1280]
    - [34, 52.858]
  - - [1856, 6784, 1, 1280]
    - [56, 55.716]
  - - [2368, 6784, 1, 1280]
    - [34, 55.343]
  - - [2944, 6784, 1, 1280]
    - [18, 59.656]
  - - [3584, 6784, 1, 1280]
    - [18, 60.319]
  - - [4288, 6784, 1, 1280]
    - [34, 58.862]
  - - [5056, 6784, 1, 1280]
    - [34, 60.102]
  - - [5888, 6784, 1, 1280]
    - [18, 62.0]
  - - [6784, 6784, 1, 1280]
    - [18, 61.448]
  - - [704, 256, 1, 3328]
    - [49, 16.322]
  - - [1024, 256, 1, 3328]
    - [23, 18.406]
  - - [1408, 256, 1, 3328]
    - [121, 23.794]
  - - [1856, 256, 1, 3328]
    - [9, 25.342]
  - - [2368, 256, 1, 3328]
    - [16, 31.482]
  - - [2944, 256, 1, 3328]
    - [9, 38.136]
  - - [3584, 256, 1, 3328]
    - [44, 40.283]
  - - [4288, 256, 1, 3328]
    - [3, 47.859]
  - - [5056, 256, 1, 3328]
    - [26, 42.385]
  - - [5888, 256, 1, 3328]
    - [26, 47.019]
  - - [6784, 256, 1, 3328]
    - [139, 50.322]
  - - [704, 448, 1, 3328]
    - [23, 21.423]
  - - [1024, 448, 1, 3328]
    - [42, 26.792]
  - - [1408, 448, 1, 3328]
    - [93, 34.129]
  - - [1856, 448, 1, 3328]
    - [16, 41.569]
  - - [2368, 448, 1, 3328]
    - [3, 46.198]
  - - [2944, 448, 1, 3328]
    - [26, 43.002]
  - - [3584, 448, 1, 3328]
    - [16, 43.156]
  - - [4288, 448, 1, 3328]
    - [38, 47.201]
  - - [5056, 448, 1, 3328]
    - [3, 52.264]
  - - [5888, 448, 1, 3328]
    - [48, 51.008]
  - - [6784, 448, 1, 3328]
    - [48, 57.235]
  - - [256, 704, 1, 3328]
    - [72, 15.084]
  - - [448, 704, 1, 3328]
    - [23, 21.778]
  - - [704, 704, 1, 3328]
    - [46, 28.285]
  - - [1024, 704, 1, 3328]
    - [93, 39.345]
  - - [1408, 704, 1, 3328]
    - [3, 43.418]
  - - [1856, 704, 1, 3328]
    - [27, 42.676]
  - - [2368, 704, 1, 3328]
    - [16, 45.001]
  - - [2944, 704, 1, 3328]
    - [28, 49.529]
  - - [3584, 704, 1, 3328]
    - [48, 48.816]
  - - [4288, 704, 1, 3328]
    - [48, 56.936]
  - - [5056, 704, 1, 3328]
    - [1, 60.499]
  - - [5888, 704, 1, 3328]
    - [2, 50.169]
  - - [6784, 704, 1, 3328]
    - [44, 56.526]
  - - [448, 1024, 1, 3328]
    - [46, 26.101]
  - - [704, 1024, 1, 3328]
    - [16, 37.129]
  - - [1408, 1024, 1, 3328]
    - [26, 44.9]
  - - [1856, 1024, 1, 3328]
    - [140, 46.82]
  - - [2368, 1024, 1, 3328]
    - [3, 55.608]
  - - [2944, 1024, 1, 3328]
    - [48, 56.83]
  - - [3584, 1024, 1, 3328]
    - [3, 57.265]
  - - [4288, 1024, 1, 3328]
    - [44, 52.449]
  - - [5056, 1024, 1, 3328]
    - [3, 60.381]
  - - [5888, 1024, 1, 3328]
    - [18, 58.552]
  - - [6784, 1024, 1, 3328]
    - [48, 65.494]
  - - [256, 1408, 1, 3328]
    - [23, 24.22]
  - - [448, 1408, 1, 3328]
    - [9, 32.94]
  - - [704, 1408, 1, 3328]
    - [3, 43.673]
  - - [1024, 1408, 1, 3328]
    - [95, 44.457]
  - - [1408, 1408, 1, 3328]
    - [28, 48.205]
  - - [1856, 1408, 1, 3328]
    - [132, 54.405]
  - - [2368, 1408, 1, 3328]
    - [48, 62.134]
  - - [2944, 1408, 1, 3328]
    - [81, 62.847]
  - - [3584, 1408, 1, 3328]
    - [2, 59.406]
  - - [4288, 1408, 1, 3328]
    - [56, 58.662]
  - - [5056, 1408, 1, 3328]
    - [48, 67.2]
  - - [5888, 1408, 1, 3328]
    - [6, 64.935]
  - - [6784, 1408, 1, 3328]
    - [48, 62.286]
  - - [256, 1856, 1, 3328]
    - [46, 27.116]
  - - [448, 1856, 1, 3328]
    - [35, 45.781]
  - - [704, 1856, 1, 3328]
    - [27, 43.05]
  - - [1024, 1856, 1, 3328]
    - [28, 46.975]
  - - [1408, 1856, 1, 3328]
    - [2, 58.849]
  - - [1856, 1856, 1, 3328]
    - [1, 57.686]
  - - [2368, 1856, 1, 3328]
    - [2, 53.004]
  - - [2944, 1856, 1, 3328]
    - [48, 54.341]
  - - [3584, 1856, 1, 3328]
    - [48, 64.414]
  - - [4288, 1856, 1, 3328]
    - [6, 62.795]
  - - [5056, 1856, 1, 3328]
    - [48, 61.891]
  - - [5888, 1856, 1, 3328]
    - [1, 63.438]
  - - [6784, 1856, 1, 3328]
    - [5, 66.559]
  - - [256, 2368, 1, 3328]
    - [93, 33.674]
  - - [448, 2368, 1, 3328]
    - [3, 46.038]
  - - [704, 2368, 1, 3328]
    - [26, 50.005]
  - - [1024, 2368, 1, 3328]
    - [3, 55.779]
  - - [1408, 2368, 1, 3328]
    - [133, 61.281]
  - - [1856, 2368, 1, 3328]
    - [44, 52.868]
  - - [2368, 2368, 1, 3328]
    - [18, 55.431]
  - - [2944, 2368, 1, 3328]
    - [141, 59.651]
  - - [3584, 2368, 1, 3328]
    - [6, 65.815]
  - - [4288, 2368, 1, 3328]
    - [48, 65.114]
  - - [5056, 2368, 1, 3328]
    - [5, 63.884]
  - - [5888, 2368, 1, 3328]
    - [48, 67.709]
  - - [6784, 2368, 1, 3328]
    - [5, 64.97]
  - - [256, 2944, 1, 3328]
    - [9, 39.522]
  - - [448, 2944, 1, 3328]
    - [26, 40.601]
  - - [704, 2944, 1, 3328]
    - [3, 48.448]
  - - [1024, 2944, 1, 3328]
    - [86, 56.887]
  - - [1408, 2944, 1, 3328]
    - [56, 56.15]
  - - [1856, 2944, 1, 3328]
    - [18, 54.014]
  - - [2368, 2944, 1, 3328]
    - [1, 59.624]
  - - [2944, 2944, 1, 3328]
    - [18, 63.883]
  - - [3584, 2944, 1, 3328]
    - [86, 66.591]
  - - [4288, 2944, 1, 3328]
    - [5, 66.498]
  - - [5056, 2944, 1, 3328]
    - [18, 65.528]
  - - [5888, 2944, 1, 3328]
    - [5, 68.807]
  - - [6784, 2944, 1, 3328]
    - [137, 65.585]
  - - [256, 3584, 1, 3328]
    - [3, 41.003]
  - - [448, 3584, 1, 3328]
    - [27, 48.239]
  - - [704, 3584, 1, 3328]
    - [48, 48.218]
  - - [1024, 3584, 1, 3328]
    - [1, 61.652]
  - - [1408, 3584, 1, 3328]
    - [2, 59.593]
  - - [1856, 3584, 1, 3328]
    - [137, 60.625]
  - - [2368, 3584, 1, 3328]
    - [18, 62.31]
  - - [2944, 3584, 1, 3328]
    - [137, 64.633]
  - - [3584, 3584, 1, 3328]
    - [6, 67.615]
  - - [4288, 3584, 1, 3328]
    - [141, 66.624]
  - - [5056, 3584, 1, 3328]
    - [18, 64.11]
  - - [5888, 3584, 1, 3328]
    - [48, 68.458]
  - - [6784, 3584, 1, 3328]
    - [99, 68.581]
  - - [256, 4288, 1, 3328]
    - [3, 47.201]
  - - [448, 4288, 1, 3328]
    - [38, 46.651]
  - - [704, 4288, 1, 3328]
    - [142, 56.594]
  - - [1024, 4288, 1, 3328]
    - [81, 65.384]
  - - [1408, 4288, 1, 3328]
    - [18, 58.921]
  - - [1856, 4288, 1, 3328]
    - [7, 62.012]
  - - [2368, 4288, 1, 3328]
    - [143, 63.39]
  - - [2944, 4288, 1, 3328]
    - [55, 66.015]
  - - [3584, 4288, 1, 3328]
    - [18, 67.68]
  - - [4288, 4288, 1, 3328]
    - [141, 64.51]
  - - [5056, 4288, 1, 3328]
    - [5, 68.936]
  - - [5888, 4288, 1, 3328]
    - [55, 67.74]
  - - [6784, 4288, 1, 3328]
    - [5, 67.332]
  - - [256, 5056, 1, 3328]
    - [3, 54.713]
  - - [448, 5056, 1, 3328]
    - [2, 51.786]
  - - [704, 5056, 1, 3328]
    - [1, 59.554]
  - - [1024, 5056, 1, 3328]
    - [2, 60.778]
  - - [1408, 5056, 1, 3328]
    - [143, 64.056]
  - - [1856, 5056, 1, 3328]
    - [48, 60.905]
  - - [2368, 5056, 1, 3328]
    - [5, 63.28]
  - - [2944, 5056, 1, 3328]
    - [18, 65.69]
  - - [3584, 5056, 1, 3328]
    - [34, 64.061]
  - - [4288, 5056, 1, 3328]
    - [5, 69.036]
  - - [5056, 5056, 1, 3328]
    - [5, 68.255]
  - - [5888, 5056, 1, 3328]
    - [5, 68.467]
  - - [6784, 5056, 1, 3328]
    - [5, 69.069]
  - - [256, 5888, 1, 3328]
    - [26, 44.855]
  - - [448, 5888, 1, 3328]
    - [48, 50.231]
  - - [704, 5888, 1, 3328]
    - [2, 50.413]
  - - [1024, 5888, 1, 3328]
    - [56, 58.964]
  - - [1408, 5888, 1, 3328]
    - [18, 61.19]
  - - [1856, 5888, 1, 3328]
    - [1, 62.567]
  - - [2368, 5888, 1, 3328]
    - [137, 63.268]
  - - [2944, 5888, 1, 3328]
    - [18, 67.254]
  - - [3584, 5888, 1, 3328]
    - [86, 67.518]
  - - [4288, 5888, 1, 3328]
    - [5, 67.508]
  - - [5056, 5888, 1, 3328]
    - [5, 68.312]
  - - [5888, 5888, 1, 3328]
    - [55, 69.606]
  - - [6784, 5888, 1, 3328]
    - [18, 70.397]
  - - [256, 6784, 1, 3328]
    - [139, 50.4]
  - - [448, 6784, 1, 3328]
    - [48, 56.526]
  - - [704, 6784, 1, 3328]
    - [2, 56.615]
  - - [1024, 6784, 1, 3328]
    - [48, 66.311]
  - - [1408, 6784, 1, 3328]
    - [48, 62.146]
  - - [1856, 6784, 1, 3328]
    - [18, 64.092]
  - - [2368, 6784, 1, 3328]
    - [5, 63.942]
  - - [2944, 6784, 1, 3328]
    - [18, 68.993]
  - - [3584, 6784, 1, 3328]
    - [18, 69.248]
  - - [4288, 6784, 1, 3328]
    - [5, 67.072]
  - - [5056, 6784, 1, 3328]
    - [5, 68.829]
  - - [5888, 6784, 1, 3328]
    - [5, 71.19]
  - - [6784, 6784, 1, 3328]
    - [18, 69.713]
  - - [1024, 700, 1, 512]
    - [35, 17.822]
  - - [3072, 1500, 1, 128]
    - [21, 14.509]
  - - [4224, 1500, 1, 176]
    - [18, 18.051]
  - - [512, 1500, 1, 1536]
    - [35, 33.309]
  - - [512, 1500, 1, 2048]
    - [66, 36.613]
  - - [512, 1500, 1, 2560]
    - [35, 39.136]
  - - [512, 1500, 1, 2816]
    - [35, 40.542]
  - - [512, 3000, 1, 1536]
    - [27, 39.911]
  - - [1024, 1500, 1, 1536]
    - [26, 40.956]
  - - [512, 3000, 1, 2048]
    - [27, 41.794]
  - - [1024, 1500, 1, 2048]
    - [27, 42.649]
  - - [512, 3000, 1, 2560]
    - [26, 45.114]
  - - [1024, 1500, 1, 2560]
    - [144, 45.766]
  - - [512, 3000, 1, 2816]
    - [95, 44.873]
  - - [1024, 1500, 1, 2816]
    - [27, 46.723]
  - - [512, 6000, 1, 1536]
    - [133, 48.817]
  - - [1024, 3000, 1, 1536]
    - [134, 47.807]
  - - [3072, 1500, 1, 1024]
    - [33, 42.701]
  - - [512, 6000, 1, 2048]
    - [145, 51.439]
  - - [1024, 3000, 1, 2048]
    - [142, 51.739]
  - - [5124, 700, 1, 2048]
    - [0, 54.269]
  - - [512, 6000, 1, 2560]
    - [142, 55.101]
  - - [1024, 3000, 1, 2560]
    - [48, 54.965]
  - - [512, 6000, 1, 2816]
    - [142, 56.046]
  - - [1024, 3000, 1, 2816]
    - [48, 56.272]
  - - [5124, 700, 1, 2560]
    - [146, 57.377]
  - - [1024, 6000, 1, 1536]
    - [18, 53.645]
  - - [3072, 3000, 1, 1024]
    - [34, 50.848]
  - - [4608, 1500, 1, 1536]
    - [143, 54.718]
  - - [1024, 6000, 1, 2048]
    - [18, 57.025]
  - - [1024, 6000, 1, 2560]
    - [18, 58.215]
  - - [5124, 1500, 1, 2048]
    - [59, 55.334]
  - - [1024, 6000, 1, 2816]
    - [18, 58.572]
  - - [512, 24000, 1, 1536]
    - [18, 56.167]
  - - [3072, 6000, 1, 1024]
    - [34, 55.377]
  - - [5124, 1500, 1, 2560]
    - [59, 57.386]
  - - [4608, 3000, 1, 1536]
    - [143, 56.959]
  - - [1760, 7000, 1, 1760]
    - [56, 61.319]
  - - [6144, 1500, 1, 2560]
    - [34, 61.078]
  - - [512, 24000, 1, 2048]
    - [82, 59.779]
  - - [2048, 7000, 1, 2048]
    - [48, 61.922]
  - - [7680, 1500, 1, 2560]
    - [1, 63.725]
  - - [512, 24000, 1, 2560]
    - [7, 62.628]
  - - [512, 24000, 1, 2816]
    - [6, 63.795]
  - - [8448, 1500, 1, 2816]
    - [5, 65.171]
  - - [512, 48000, 1, 1536]
    - [18, 62.323]
  - - [1024, 24000, 1, 1536]
    - [18, 63.269]
  - - [4608, 6000, 1, 1536]
    - [34, 61.192]
  - - [2560, 7000, 1, 2560]
    - [18, 67.176]
  - - [6144, 3000, 1, 2560]
    - [34, 63.805]
  - - [512, 48000, 1, 2048]
    - [18, 65.647]
  - - [1024, 24000, 1, 2048]
    - [56, 66.307]
  - - [7680, 3000, 1, 2560]
    - [18, 64.737]
  - - [512, 48000, 1, 2560]
    - [18, 67.34]
  - - [1024, 24000, 1, 2560]
    - [18, 67.863]
  - - [512, 48000, 1, 2816]
    - [18, 68.133]
  - - [1024, 24000, 1, 2816]
    - [18, 68.606]
  - - [8448, 3000, 1, 2816]
    - [5, 66.419]
  - - [1024, 48000, 1, 1536]
    - [56, 64.63]
  - - [3072, 24000, 1, 1024]
    - [34, 60.266]
  - - [5124, 9124, 1, 1760]
    - [147, 64.624]
  - - [6144, 6000, 1, 2560]
    - [18, 67.358]
  - - [5124, 9124, 1, 2048]
    - [137, 63.857]
  - - [1024, 48000, 1, 2048]
    - [56, 67.814]
  - - [4096, 7000, 1, 4096]
    - [18, 70.919]
  - - [7680, 6000, 1, 2560]
    - [18, 68.23]
  - - [5124, 9124, 1, 2560]
    - [137, 64.551]
  - - [1024, 48000, 1, 2560]
    - [56, 69.414]
  - - [1024, 48000, 1, 2816]
    - [56, 70.234]
  - - [8448, 6000, 1, 2816]
    - [18, 69.064]
  - - [3072, 48000, 1, 1024]
    - [34, 61.082]
  - - [4608, 24000, 1, 1536]
    - [34, 65.285]
  - - [5124, 9124, 1, 4096]
    - [48, 67.494]
  - - [4608, 48000, 1, 1536]
    - [34, 65.885]
  - - [6144, 24000, 1, 2560]
    - [94, 70.485]
  - - [7680, 24000, 1, 2560]
    - [18, 70.6]
  - - [8448, 24000, 1, 2816]
    - [6, 71.396]
  - - [6144, 48000, 1, 2560]
    - [18, 70.933]
  - - [7680, 48000, 1, 2560]
    - [141, 70.932]
  - - [8448, 48000, 1, 2816]
    - [6, 72.735]
  - - [256, 193600, 1, 64]
    - [60, 12.31]
  - - [64, 193600, 1, 64]
    - [21, 10.7]
  - - [64, 193600, 1, 256]
    - [74, 19.909]
  - - [512, 50176, 1, 128]
    - [51, 19.077]
  - - [128, 50176, 1, 512]
    - [18, 33.896]
  - - [256, 12544, 1, 1024]
    - [47, 41.721]
  - - [1024, 12544, 1, 256]
    - [51, 29.31]
  - - [2048, 3136, 1, 512]
    - [34, 38.753]
  - - [512, 3136, 1, 2048]
    - [26, 43.74]
  - - [3136, 512, 1, 2048]
    - [26, 45.016]
  - - [3136, 2048, 1, 512]
    - [18, 38.916]
  - - [32, 32, 1, 32]
    - [65, 0.004]
  - - [32, 64, 1, 256]
    - [62, 0.045]
  - - [32, 128, 1, 256]
    - [45, 0.095]
  - - [32, 256, 1, 256]
    - [114, 0.205]
  - - [32, 448, 1, 256]
    - [62, 0.339]
  - - [32, 704, 1, 256]
    - [36, 0.516]
  - - [32, 1024, 1, 256]
    - [62, 0.727]
  - - [32, 1408, 1, 256]
    - [62, 1.007]
  - - [32, 1856, 1, 256]
    - [114, 1.328]
  - - [32, 2368, 1, 256]
    - [114, 1.668]
  - - [32, 2944, 1, 256]
    - [36, 2.028]
  - - [32, 3584, 1, 256]
    - [4, 2.25]
  - - [32, 4288, 1, 256]
    - [4, 2.674]
  - - [32, 5056, 1, 256]
    - [117, 3.174]
  - - [32, 5888, 1, 256]
    - [96, 3.623]
  - - [32, 6784, 1, 256]
    - [49, 4.119]
  - - [32, 64, 1, 1280]
    - [11, 0.144]
  - - [32, 128, 1, 1280]
    - [11, 0.291]
  - - [32, 256, 1, 1280]
    - [67, 0.588]
  - - [32, 448, 1, 1280]
    - [11, 1.039]
  - - [32, 704, 1, 1280]
    - [67, 1.641]
  - - [32, 1024, 1, 1280]
    - [36, 2.351]
  - - [32, 1408, 1, 1280]
    - [45, 3.298]
  - - [32, 1856, 1, 1280]
    - [45, 4.261]
  - - [32, 2368, 1, 1280]
    - [67, 5.383]
  - - [32, 2944, 1, 1280]
    - [67, 6.726]
  - - [32, 3584, 1, 1280]
    - [49, 7.098]
  - - [32, 4288, 1, 1280]
    - [96, 8.245]
  - - [32, 5056, 1, 1280]
    - [96, 9.803]
  - - [32, 5888, 1, 1280]
    - [49, 11.228]
  - - [32, 6784, 1, 1280]
    - [96, 12.99]
  - - [32, 64, 1, 3328]
    - [67, 0.235]
  - - [32, 128, 1, 3328]
    - [11, 0.471]
  - - [32, 256, 1, 3328]
    - [110, 0.963]
  - - [32, 448, 1, 3328]
    - [36, 1.649]
  - - [32, 704, 1, 3328]
    - [45, 2.575]
  - - [32, 1024, 1, 3328]
    - [67, 3.78]
  - - [32, 1408, 1, 3328]
    - [67, 5.198]
  - - [32, 1856, 1, 3328]
    - [67, 6.81]
  - - [32, 2368, 1, 3328]
    - [67, 8.636]
  - - [32, 2944, 1, 3328]
    - [67, 10.608]
  - - [32, 3584, 1, 3328]
    - [96, 10.805]
  - - [32, 4288, 1, 3328]
    - [49, 13.091]
  - - [32, 5056, 1, 3328]
    - [96, 15.358]
  - - [32, 5888, 1, 3328]
    - [96, 17.662]
  - - [32, 6784, 1, 3328]
    - [96, 19.853]
  - - [64, 32, 1, 256]
    - [11, 0.045]
  - - [128, 32, 1, 256]
    - [116, 0.095]
  - - [256, 32, 1, 256]
    - [10, 0.178]
  - - [448, 32, 1, 256]
    - [45, 0.356]
  - - [704, 32, 1, 256]
    - [62, 0.492]
  - - [1408, 32, 1, 256]
    - [10, 0.97]
  - - [1856, 32, 1, 256]
    - [62, 1.298]
  - - [2368, 32, 1, 256]
    - [62, 1.607]
  - - [2944, 32, 1, 256]
    - [114, 1.927]
  - - [3584, 32, 1, 256]
    - [10, 2.22]
  - - [4288, 32, 1, 256]
    - [10, 2.711]
  - - [5056, 32, 1, 256]
    - [10, 3.218]
  - - [5888, 32, 1, 256]
    - [10, 3.647]
  - - [6784, 32, 1, 256]
    - [10, 4.119]
  - - [64, 32, 1, 1280]
    - [67, 0.14]
  - - [128, 32, 1, 1280]
    - [120, 0.26]
  - - [256, 32, 1, 1280]
    - [64, 0.56]
  - - [448, 32, 1, 1280]
    - [120, 1.004]
  - - [704, 32, 1, 1280]
    - [120, 1.504]
  - - [1408, 32, 1, 1280]
    - [118, 2.862]
  - - [1856, 32, 1, 1280]
    - [64, 3.965]
  - - [2368, 32, 1, 1280]
    - [64, 5.083]
  - - [2944, 32, 1, 1280]
    - [67, 5.881]
  - - [3584, 32, 1, 1280]
    - [115, 6.148]
  - - [4288, 32, 1, 1280]
    - [115, 7.411]
  - - [5056, 32, 1, 1280]
    - [23, 8.484]
  - - [5888, 32, 1, 1280]
    - [23, 9.635]
  - - [6784, 32, 1, 1280]
    - [115, 10.985]
  - - [64, 32, 1, 3328]
    - [148, 0.222]
  - - [128, 32, 1, 3328]
    - [110, 0.46]
  - - [256, 32, 1, 3328]
    - [119, 0.906]
  - - [448, 32, 1, 3328]
    - [120, 1.531]
  - - [704, 32, 1, 3328]
    - [12, 2.346]
  - - [1408, 32, 1, 3328]
    - [119, 4.213]
  - - [1856, 32, 1, 3328]
    - [120, 6.002]
  - - [2368, 32, 1, 3328]
    - [149, 7.721]
  - - [2944, 32, 1, 3328]
    - [67, 8.471]
  - - [3584, 32, 1, 3328]
    - [115, 9.228]
  - - [4288, 32, 1, 3328]
    - [115, 11.209]
  - - [5056, 32, 1, 3328]
    - [115, 13.304]
  - - [5888, 32, 1, 3328]
    - [115, 15.095]
  - - [6784, 32, 1, 3328]
    - [115, 16.783]
  - - [64, 64, 1, 32]
    - [65, 0.016]
  - - [128, 64, 1, 32]
    - [65, 0.036]
  - - [256, 64, 1, 32]
    - [52, 0.069]
  - - [448, 64, 1, 32]
    - [22, 0.114]
  - - [704, 64, 1, 32]
    - [10, 0.179]
  - - [1408, 64, 1, 32]
    - [8, 0.312]
  - - [1856, 64, 1, 32]
    - [71, 0.412]
  - - [2368, 64, 1, 32]
    - [8, 0.506]
  - - [2944, 64, 1, 32]
    - [10, 0.596]
  - - [3584, 64, 1, 32]
    - [10, 0.713]
  - - [4288, 64, 1, 32]
    - [10, 0.86]
  - - [5056, 64, 1, 32]
    - [10, 0.972]
  - - [5888, 64, 1, 32]
    - [10, 1.171]
  - - [6784, 64, 1, 32]
    - [10, 1.273]
  - - [256, 128, 1, 32]
    - [10, 0.128]
  - - [448, 128, 1, 32]
    - [10, 0.222]
  - - [704, 128, 1, 32]
    - [10, 0.309]
  - - [1408, 128, 1, 32]
    - [8, 0.58]
  - - [1856, 128, 1, 32]
    - [10, 0.745]
  - - [2368, 128, 1, 32]
    - [10, 0.934]
  - - [2944, 128, 1, 32]
    - [10, 1.151]
  - - [3584, 128, 1, 32]
    - [8, 1.334]
  - - [4288, 128, 1, 32]
    - [15, 1.534]
  - - [5056, 128, 1, 32]
    - [15, 1.795]
  - - [5888, 128, 1, 32]
    - [15, 2.028]
  - - [6784, 128, 1, 32]
    - [15, 2.302]
  - - [64, 256, 1, 32]
    - [10, 0.067]
  - - [128, 256, 1, 32]
    - [10, 0.128]
  - - [256, 256, 1, 32]
    - [10, 0.244]
  - - [448, 256, 1, 32]
    - [71, 0.398]
  - - [704, 256, 1, 32]
    - [8, 0.585]
  - - [1024, 256, 1, 32]
    - [10, 0.808]
  - - [1408, 256, 1, 32]
    - [10, 1.101]
  - - [1856, 256, 1, 32]
    - [71, 1.36]
  - - [2368, 256, 1, 32]
    - [15, 1.681]
  - - [2944, 256, 1, 32]
    - [15, 1.998]
  - - [3584, 256, 1, 32]
    - [71, 2.281]
  - - [4288, 256, 1, 32]
    - [71, 2.521]
  - - [5056, 256, 1, 32]
    - [61, 2.828]
  - - [5888, 256, 1, 32]
    - [89, 3.088]
  - - [6784, 256, 1, 32]
    - [20, 3.385]
  - - [64, 448, 1, 32]
    - [10, 0.115]
  - - [128, 448, 1, 32]
    - [65, 0.218]
  - - [256, 448, 1, 32]
    - [8, 0.409]
  - - [448, 448, 1, 32]
    - [10, 0.64]
  - - [704, 448, 1, 32]
    - [10, 0.989]
  - - [1024, 448, 1, 32]
    - [71, 1.302]
  - - [1408, 448, 1, 32]
    - [15, 1.749]
  - - [1856, 448, 1, 32]
    - [15, 2.221]
  - - [2368, 448, 1, 32]
    - [71, 2.567]
  - - [2944, 448, 1, 32]
    - [17, 2.83]
  - - [3584, 448, 1, 32]
    - [91, 3.198]
  - - [4288, 448, 1, 32]
    - [20, 3.552]
  - - [5056, 448, 1, 32]
    - [89, 3.816]
  - - [5888, 448, 1, 32]
    - [17, 4.082]
  - - [6784, 448, 1, 32]
    - [17, 4.491]
  - - [64, 704, 1, 32]
    - [10, 0.18]
  - - [128, 704, 1, 32]
    - [10, 0.309]
  - - [256, 704, 1, 32]
    - [10, 0.591]
  - - [448, 704, 1, 32]
    - [10, 0.989]
  - - [704, 704, 1, 32]
    - [15, 1.429]
  - - [1024, 704, 1, 32]
    - [15, 1.969]
  - - [1408, 704, 1, 32]
    - [61, 2.415]
  - - [1856, 704, 1, 32]
    - [15, 2.821]
  - - [2368, 704, 1, 32]
    - [20, 3.284]
  - - [2944, 704, 1, 32]
    - [17, 3.755]
  - - [3584, 704, 1, 32]
    - [91, 4.007]
  - - [4288, 704, 1, 32]
    - [17, 4.442]
  - - [5056, 704, 1, 32]
    - [17, 4.683]
  - - [5888, 704, 1, 32]
    - [17, 4.965]
  - - [6784, 704, 1, 32]
    - [17, 5.109]
  - - [64, 1024, 1, 32]
    - [31, 0.239]
  - - [128, 1024, 1, 32]
    - [71, 0.45]
  - - [448, 1024, 1, 32]
    - [71, 1.345]
  - - [704, 1024, 1, 32]
    - [15, 1.969]
  - - [1408, 1024, 1, 32]
    - [89, 2.953]
  - - [1856, 1024, 1, 32]
    - [20, 3.55]
  - - [2368, 1024, 1, 32]
    - [17, 4.01]
  - - [2944, 1024, 1, 32]
    - [17, 4.365]
  - - [3584, 1024, 1, 32]
    - [17, 4.675]
  - - [4288, 1024, 1, 32]
    - [20, 5.042]
  - - [5056, 1024, 1, 32]
    - [17, 5.273]
  - - [5888, 1024, 1, 32]
    - [17, 5.381]
  - - [6784, 1024, 1, 32]
    - [25, 5.517]
  - - [64, 1408, 1, 32]
    - [15, 0.325]
  - - [128, 1408, 1, 32]
    - [10, 0.596]
  - - [256, 1408, 1, 32]
    - [15, 1.083]
  - - [448, 1408, 1, 32]
    - [15, 1.749]
  - - [704, 1408, 1, 32]
    - [15, 2.415]
  - - [1024, 1408, 1, 32]
    - [15, 3.058]
  - - [1408, 1408, 1, 32]
    - [21, 3.628]
  - - [1856, 1408, 1, 32]
    - [71, 4.061]
  - - [2368, 1408, 1, 32]
    - [17, 4.536]
  - - [2944, 1408, 1, 32]
    - [17, 4.932]
  - - [3584, 1408, 1, 32]
    - [91, 5.183]
  - - [4288, 1408, 1, 32]
    - [17, 5.483]
  - - [5056, 1408, 1, 32]
    - [17, 5.666]
  - - [5888, 1408, 1, 32]
    - [25, 5.792]
  - - [6784, 1408, 1, 32]
    - [54, 5.917]
  - - [64, 1856, 1, 32]
    - [15, 0.42]
  - - [128, 1856, 1, 32]
    - [10, 0.758]
  - - [256, 1856, 1, 32]
    - [15, 1.37]
  - - [448, 1856, 1, 32]
    - [15, 2.271]
  - - [704, 1856, 1, 32]
    - [17, 2.804]
  - - [1024, 1856, 1, 32]
    - [15, 3.532]
  - - [1408, 1856, 1, 32]
    - [89, 4.078]
  - - [1856, 1856, 1, 32]
    - [17, 4.617]
  - - [2368, 1856, 1, 32]
    - [21, 5.014]
  - - [2944, 1856, 1, 32]
    - [21, 5.267]
  - - [3584, 1856, 1, 32]
    - [17, 5.656]
  - - [4288, 1856, 1, 32]
    - [17, 5.904]
  - - [5056, 1856, 1, 32]
    - [17, 6.052]
  - - [5888, 1856, 1, 32]
    - [20, 6.043]
  - - [6784, 1856, 1, 32]
    - [17, 6.27]
  - - [64, 2368, 1, 32]
    - [8, 0.52]
  - - [128, 2368, 1, 32]
    - [10, 0.959]
  - - [256, 2368, 1, 32]
    - [15, 1.681]
  - - [448, 2368, 1, 32]
    - [61, 2.533]
  - - [704, 2368, 1, 32]
    - [17, 3.302]
  - - [1024, 2368, 1, 32]
    - [15, 3.903]
  - - [1408, 2368, 1, 32]
    - [17, 4.536]
  - - [1856, 2368, 1, 32]
    - [17, 5.03]
  - - [2368, 2368, 1, 32]
    - [97, 5.334]
  - - [2944, 2368, 1, 32]
    - [17, 5.61]
  - - [3584, 2368, 1, 32]
    - [21, 5.918]
  - - [4288, 2368, 1, 32]
    - [25, 6.021]
  - - [5056, 2368, 1, 32]
    - [17, 6.229]
  - - [5888, 2368, 1, 32]
    - [17, 6.299]
  - - [6784, 2368, 1, 32]
    - [54, 6.386]
  - - [64, 2944, 1, 32]
    - [88, 0.596]
  - - [128, 2944, 1, 32]
    - [10, 1.132]
  - - [256, 2944, 1, 32]
    - [15, 2.043]
  - - [448, 2944, 1, 32]
    - [15, 2.797]
  - - [704, 2944, 1, 32]
    - [97, 3.627]
  - - [1024, 2944, 1, 32]
    - [20, 4.33]
  - - [1408, 2944, 1, 32]
    - [17, 5.015]
  - - [1856, 2944, 1, 32]
    - [17, 5.397]
  - - [2368, 2944, 1, 32]
    - [91, 5.61]
  - - [2944, 2944, 1, 32]
    - [17, 5.986]
  - - [3584, 2944, 1, 32]
    - [91, 5.981]
  - - [4288, 2944, 1, 32]
    - [17, 6.278]
  - - [5056, 2944, 1, 32]
    - [17, 6.419]
  - - [5888, 2944, 1, 32]
    - [25, 6.49]
  - - [6784, 2944, 1, 32]
    - [17, 6.528]
  - - [64, 3584, 1, 32]
    - [88, 0.719]
  - - [128, 3584, 1, 32]
    - [15, 1.323]
  - - [256, 3584, 1, 32]
    - [71, 2.329]
  - - [448, 3584, 1, 32]
    - [15, 3.271]
  - - [704, 3584, 1, 32]
    - [21, 4.007]
  - - [1024, 3584, 1, 32]
    - [30, 4.675]
  - - [1408, 3584, 1, 32]
    - [17, 5.304]
  - - [1856, 3584, 1, 32]
    - [17, 5.656]
  - - [2368, 3584, 1, 32]
    - [17, 5.988]
  - - [2944, 3584, 1, 32]
    - [17, 6.096]
  - - [3584, 3584, 1, 32]
    - [17, 6.327]
  - - [4288, 3584, 1, 32]
    - [91, 6.443]
  - - [5056, 3584, 1, 32]
    - [17, 6.559]
  - - [5888, 3584, 1, 32]
    - [17, 6.645]
  - - [6784, 3584, 1, 32]
    - [21, 6.641]
  - - [64, 4288, 1, 32]
    - [10, 0.86]
  - - [128, 4288, 1, 32]
    - [15, 1.558]
  - - [256, 4288, 1, 32]
    - [21, 2.656]
  - - [448, 4288, 1, 32]
    - [20, 3.645]
  - - [704, 4288, 1, 32]
    - [21, 4.371]
  - - [1024, 4288, 1, 32]
    - [21, 4.978]
  - - [1408, 4288, 1, 32]
    - [91, 5.469]
  - - [1856, 4288, 1, 32]
    - [17, 5.916]
  - - [2368, 4288, 1, 32]
    - [25, 6.101]
  - - [2944, 4288, 1, 32]
    - [91, 6.304]
  - - [3584, 4288, 1, 32]
    - [91, 6.435]
  - - [4288, 4288, 1, 32]
    - [17, 6.629]
  - - [5056, 4288, 1, 32]
    - [17, 6.75]
  - - [5888, 4288, 1, 32]
    - [17, 6.698]
  - - [6784, 4288, 1, 32]
    - [17, 6.762]
  - - [64, 5056, 1, 32]
    - [10, 0.997]
  - - [128, 5056, 1, 32]
    - [15, 1.781]
  - - [256, 5056, 1, 32]
    - [89, 2.811]
  - - [448, 5056, 1, 32]
    - [71, 3.87]
  - - [704, 5056, 1, 32]
    - [71, 4.718]
  - - [1024, 5056, 1, 32]
    - [20, 5.156]
  - - [1408, 5056, 1, 32]
    - [17, 5.691]
  - - [1856, 5056, 1, 32]
    - [91, 6.063]
  - - [2368, 5056, 1, 32]
    - [17, 6.292]
  - - [2944, 5056, 1, 32]
    - [54, 6.381]
  - - [3584, 5056, 1, 32]
    - [54, 6.566]
  - - [4288, 5056, 1, 32]
    - [17, 6.715]
  - - [5056, 5056, 1, 32]
    - [17, 6.802]
  - - [5888, 5056, 1, 32]
    - [17, 6.784]
  - - [6784, 5056, 1, 32]
    - [54, 6.776]
  - - [64, 5888, 1, 32]
    - [10, 1.132]
  - - [128, 5888, 1, 32]
    - [15, 1.955]
  - - [256, 5888, 1, 32]
    - [15, 3.141]
  - - [448, 5888, 1, 32]
    - [15, 4.099]
  - - [704, 5888, 1, 32]
    - [20, 4.916]
  - - [1024, 5888, 1, 32]
    - [17, 5.381]
  - - [1408, 5888, 1, 32]
    - [17, 5.954]
  - - [1856, 5888, 1, 32]
    - [21, 6.175]
  - - [2368, 5888, 1, 32]
    - [17, 6.495]
  - - [2944, 5888, 1, 32]
    - [25, 6.51]
  - - [3584, 5888, 1, 32]
    - [17, 6.709]
  - - [4288, 5888, 1, 32]
    - [17, 6.803]
  - - [5056, 5888, 1, 32]
    - [17, 6.836]
  - - [5888, 5888, 1, 32]
    - [17, 6.86]
  - - [6784, 5888, 1, 32]
    - [17, 6.848]
  - - [64, 6784, 1, 32]
    - [10, 1.262]
  - - [128, 6784, 1, 32]
    - [15, 2.285]
  - - [256, 6784, 1, 32]
    - [15, 3.459]
  - - [448, 6784, 1, 32]
    - [17, 4.383]
  - - [704, 6784, 1, 32]
    - [17, 5.171]
  - - [1024, 6784, 1, 32]
    - [17, 5.566]
  - - [1408, 6784, 1, 32]
    - [21, 6.052]
  - - [1856, 6784, 1, 32]
    - [17, 6.403]
  - - [2368, 6784, 1, 32]
    - [25, 6.589]
  - - [2944, 6784, 1, 32]
    - [21, 6.673]
  - - [3584, 6784, 1, 32]
    - [17, 6.722]
  - - [4288, 6784, 1, 32]
    - [17, 6.895]
  - - [5056, 6784, 1, 32]
    - [17, 6.905]
  - - [5888, 6784, 1, 32]
    - [54, 6.897]
  - - [6784, 6784, 1, 32]
    - [54, 6.899]
  - - [32, 32, 1, 256]
    - [11, 0.022]
  - - [32, 32, 1, 1280]
    - [45, 0.073]
  - - [32, 32, 1, 3328]
    - [45, 0.118]
  - - [32, 64, 1, 32]
    - [10, 0.008]
  - - [32, 128, 1, 32]
    - [22, 0.017]
  - - [32, 256, 1, 32]
    - [31, 0.035]
  - - [32, 448, 1, 32]
    - [10, 0.06]
  - - [32, 704, 1, 32]
    - [10, 0.094]
  - - [32, 1024, 1, 32]
    - [65, 0.131]
  - - [32, 1408, 1, 32]
    - [65, 0.18]
  - - [32, 1856, 1, 32]
    - [22, 0.223]
  - - [32, 2368, 1, 32]
    - [40, 0.27]
  - - [32, 2944, 1, 32]
    - [8, 0.333]
  - - [32, 3584, 1, 32]
    - [8, 0.405]
  - - [32, 4288, 1, 32]
    - [8, 0.49]
  - - [32, 5056, 1, 32]
    - [8, 0.526]
  - - [32, 5888, 1, 32]
    - [8, 0.618]
  - - [32, 6784, 1, 32]
    - [52, 0.687]
  - - [64, 32, 1, 32]
    - [65, 0.008]
  - - [128, 32, 1, 32]
    - [40, 0.015]
  - - [256, 32, 1, 32]
    - [10, 0.034]
  - - [448, 32, 1, 32]
    - [116, 0.055]
  - - [704, 32, 1, 32]
    - [65, 0.085]
  - - [1408, 32, 1, 32]
    - [10, 0.173]
  - - [1856, 32, 1, 32]
    - [10, 0.23]
  - - [2368, 32, 1, 32]
    - [10, 0.279]
  - - [2944, 32, 1, 32]
    - [71, 0.323]
  - - [3584, 32, 1, 32]
    - [97, 0.398]
  - - [4288, 32, 1, 32]
    - [71, 0.462]
  - - [5056, 32, 1, 32]
    - [71, 0.54]
  - - [5888, 32, 1, 32]
    - [10, 0.618]
  - - [6784, 32, 1, 32]
    - [10, 0.687]
  - - [64, 1, 1, 256]
    - [65, 0.001]
  - - [128, 1, 1, 256]
    - [13, 0.003]
  - - [256, 1, 1, 256]
    - [118, 0.006]
  - - [448, 1, 1, 256]
    - [45, 0.01]
  - - [704, 1, 1, 256]
    - [36, 0.015]
  - - [1408, 1, 1, 256]
    - [114, 0.031]
  - - [1856, 1, 1, 256]
    - [10, 0.041]
  - - [2368, 1, 1, 256]
    - [67, 0.052]
  - - [2944, 1, 1, 256]
    - [10, 0.064]
  - - [3584, 1, 1, 256]
    - [10, 0.077]
  - - [4288, 1, 1, 256]
    - [10, 0.09]
  - - [5056, 1, 1, 256]
    - [10, 0.104]
  - - [5888, 1, 1, 256]
    - [4, 0.116]
  - - [6784, 1, 1, 256]
    - [10, 0.132]
  - - [64, 1, 1, 1280]
    - [120, 0.004]
  - - [128, 1, 1, 1280]
    - [118, 0.008]
  - - [256, 1, 1, 1280]
    - [45, 0.017]
  - - [448, 1, 1, 1280]
    - [13, 0.032]
  - - [704, 1, 1, 1280]
    - [36, 0.048]
  - - [1408, 1, 1, 1280]
    - [36, 0.091]
  - - [1856, 1, 1, 1280]
    - [67, 0.127]
  - - [2368, 1, 1, 1280]
    - [45, 0.167]
  - - [2944, 1, 1, 1280]
    - [36, 0.191]
  - - [3584, 1, 1, 1280]
    - [115, 0.197]
  - - [4288, 1, 1, 1280]
    - [115, 0.237]
  - - [5056, 1, 1, 1280]
    - [23, 0.274]
  - - [5888, 1, 1, 1280]
    - [115, 0.32]
  - - [6784, 1, 1, 1280]
    - [115, 0.366]
  - - [64, 1, 1, 3328]
    - [119, 0.007]
  - - [128, 1, 1, 3328]
    - [110, 0.015]
  - - [256, 1, 1, 3328]
    - [119, 0.029]
  - - [448, 1, 1, 3328]
    - [119, 0.05]
  - - [704, 1, 1, 3328]
    - [120, 0.078]
  - - [1408, 1, 1, 3328]
    - [119, 0.145]
  - - [1856, 1, 1, 3328]
    - [36, 0.204]
  - - [2368, 1, 1, 3328]
    - [45, 0.256]
  - - [2944, 1, 1, 3328]
    - [67, 0.275]
  - - [3584, 1, 1, 3328]
    - [115, 0.303]
  - - [4288, 1, 1, 3328]
    - [115, 0.362]
  - - [5056, 1, 1, 3328]
    - [115, 0.422]
  - - [5888, 1, 1, 3328]
    - [115, 0.486]
  - - [6784, 1, 1, 3328]
    - [115, 0.541]
  - - [64, 64, 1, 1]
    - [52, 0.0]
  - - [128, 64, 1, 1]
    - [65, 0.001]
  - - [256, 64, 1, 1]
    - [40, 0.002]
  - - [448, 64, 1, 1]
    - [22, 0.003]
  - - [704, 64, 1, 1]
    - [31, 0.005]
  - - [1408, 64, 1, 1]
    - [10, 0.009]
  - - [1856, 64, 1, 1]
    - [10, 0.011]
  - - [2368, 64, 1, 1]
    - [10, 0.014]
  - - [2944, 64, 1, 1]
    - [10, 0.018]
  - - [3584, 64, 1, 1]
    - [10, 0.021]
  - - [4288, 64, 1, 1]
    - [10, 0.025]
  - - [5056, 64, 1, 1]
    - [15, 0.029]
  - - [5888, 64, 1, 1]
    - [15, 0.033]
  - - [6784, 64, 1, 1]
    - [22, 0.037]
  - - [256, 128, 1, 1]
    - [65, 0.003]
  - - [448, 128, 1, 1]
    - [31, 0.006]
  - - [704, 128, 1, 1]
    - [10, 0.009]
  - - [1408, 128, 1, 1]
    - [10, 0.017]
  - - [1856, 128, 1, 1]
    - [10, 0.022]
  - - [2368, 128, 1, 1]
    - [10, 0.028]
  - - [2944, 128, 1, 1]
    - [71, 0.033]
  - - [3584, 128, 1, 1]
    - [8, 0.039]
  - - [4288, 128, 1, 1]
    - [15, 0.044]
  - - [5056, 128, 1, 1]
    - [8, 0.05]
  - - [5888, 128, 1, 1]
    - [15, 0.056]
  - - [6784, 128, 1, 1]
    - [30, 0.062]
  - - [64, 256, 1, 1]
    - [65, 0.002]
  - - [128, 256, 1, 1]
    - [114, 0.004]
  - - [256, 256, 1, 1]
    - [65, 0.007]
  - - [448, 256, 1, 1]
    - [10, 0.011]
  - - [704, 256, 1, 1]
    - [10, 0.017]
  - - [1024, 256, 1, 1]
    - [10, 0.024]
  - - [1408, 256, 1, 1]
    - [52, 0.031]
  - - [1856, 256, 1, 1]
    - [30, 0.039]
  - - [2368, 256, 1, 1]
    - [15, 0.048]
  - - [2944, 256, 1, 1]
    - [15, 0.057]
  - - [3584, 256, 1, 1]
    - [61, 0.06]
  - - [4288, 256, 1, 1]
    - [60, 0.067]
  - - [5056, 256, 1, 1]
    - [17, 0.077]
  - - [5888, 256, 1, 1]
    - [17, 0.086]
  - - [6784, 256, 1, 1]
    - [74, 0.091]
  - - [64, 448, 1, 1]
    - [65, 0.003]
  - - [128, 448, 1, 1]
    - [65, 0.006]
  - - [256, 448, 1, 1]
    - [65, 0.011]
  - - [448, 448, 1, 1]
    - [10, 0.019]
  - - [704, 448, 1, 1]
    - [10, 0.028]
  - - [1024, 448, 1, 1]
    - [71, 0.038]
  - - [1408, 448, 1, 1]
    - [71, 0.048]
  - - [1856, 448, 1, 1]
    - [89, 0.059]
  - - [2368, 448, 1, 1]
    - [71, 0.066]
  - - [2944, 448, 1, 1]
    - [17, 0.078]
  - - [3584, 448, 1, 1]
    - [17, 0.087]
  - - [4288, 448, 1, 1]
    - [17, 0.093]
  - - [5056, 448, 1, 1]
    - [25, 0.102]
  - - [5888, 448, 1, 1]
    - [17, 0.11]
  - - [6784, 448, 1, 1]
    - [25, 0.119]
  - - [64, 704, 1, 1]
    - [40, 0.005]
  - - [128, 704, 1, 1]
    - [65, 0.009]
  - - [256, 704, 1, 1]
    - [40, 0.017]
  - - [448, 704, 1, 1]
    - [10, 0.029]
  - - [704, 704, 1, 1]
    - [97, 0.04]
  - - [1024, 704, 1, 1]
    - [97, 0.052]
  - - [1408, 704, 1, 1]
    - [71, 0.062]
  - - [1856, 704, 1, 1]
    - [17, 0.078]
  - - [2368, 704, 1, 1]
    - [17, 0.087]
  - - [2944, 704, 1, 1]
    - [17, 0.096]
  - - [3584, 704, 1, 1]
    - [91, 0.109]
  - - [4288, 704, 1, 1]
    - [17, 0.118]
  - - [5056, 704, 1, 1]
    - [25, 0.124]
  - - [5888, 704, 1, 1]
    - [17, 0.132]
  - - [6784, 704, 1, 1]
    - [91, 0.139]
  - - [64, 1024, 1, 1]
    - [65, 0.007]
  - - [128, 1024, 1, 1]
    - [10, 0.013]
  - - [448, 1024, 1, 1]
    - [89, 0.037]
  - - [704, 1024, 1, 1]
    - [89, 0.054]
  - - [1408, 1024, 1, 1]
    - [17, 0.082]
  - - [1856, 1024, 1, 1]
    - [21, 0.091]
  - - [2368, 1024, 1, 1]
    - [17, 0.107]
  - - [2944, 1024, 1, 1]
    - [17, 0.119]
  - - [3584, 1024, 1, 1]
    - [25, 0.127]
  - - [4288, 1024, 1, 1]
    - [25, 0.134]
  - - [5056, 1024, 1, 1]
    - [25, 0.139]
  - - [5888, 1024, 1, 1]
    - [17, 0.147]
  - - [6784, 1024, 1, 1]
    - [17, 0.154]
  - - [64, 1408, 1, 1]
    - [52, 0.009]
  - - [128, 1408, 1, 1]
    - [10, 0.017]
  - - [256, 1408, 1, 1]
    - [31, 0.031]
  - - [448, 1408, 1, 1]
    - [71, 0.049]
  - - [704, 1408, 1, 1]
    - [97, 0.063]
  - - [1024, 1408, 1, 1]
    - [17, 0.079]
  - - [1408, 1408, 1, 1]
    - [17, 0.095]
  - - [1856, 1408, 1, 1]
    - [17, 0.109]
  - - [2368, 1408, 1, 1]
    - [17, 0.123]
  - - [2944, 1408, 1, 1]
    - [17, 0.135]
  - - [3584, 1408, 1, 1]
    - [17, 0.143]
  - - [4288, 1408, 1, 1]
    - [91, 0.147]
  - - [5056, 1408, 1, 1]
    - [91, 0.154]
  - - [5888, 1408, 1, 1]
    - [17, 0.16]
  - - [6784, 1408, 1, 1]
    - [17, 0.163]
  - - [64, 1856, 1, 1]
    - [71, 0.012]
  - - [128, 1856, 1, 1]
    - [52, 0.022]
  - - [256, 1856, 1, 1]
    - [89, 0.039]
  - - [448, 1856, 1, 1]
    - [15, 0.059]
  - - [704, 1856, 1, 1]
    - [17, 0.077]
  - - [1024, 1856, 1, 1]
    - [17, 0.093]
  - - [1408, 1856, 1, 1]
    - [25, 0.107]
  - - [1856, 1856, 1, 1]
    - [17, 0.124]
  - - [2368, 1856, 1, 1]
    - [91, 0.134]
  - - [2944, 1856, 1, 1]
    - [17, 0.144]
  - - [3584, 1856, 1, 1]
    - [17, 0.154]
  - - [4288, 1856, 1, 1]
    - [17, 0.16]
  - - [5056, 1856, 1, 1]
    - [25, 0.164]
  - - [5888, 1856, 1, 1]
    - [25, 0.168]
  - - [6784, 1856, 1, 1]
    - [17, 0.17]
  - - [64, 2368, 1, 1]
    - [71, 0.015]
  - - [128, 2368, 1, 1]
    - [10, 0.028]
  - - [256, 2368, 1, 1]
    - [97, 0.047]
  - - [448, 2368, 1, 1]
    - [21, 0.066]
  - - [704, 2368, 1, 1]
    - [26, 0.088]
  - - [1024, 2368, 1, 1]
    - [17, 0.109]
  - - [1408, 2368, 1, 1]
    - [17, 0.121]
  - - [1856, 2368, 1, 1]
    - [25, 0.135]
  - - [2368, 2368, 1, 1]
    - [17, 0.146]
  - - [2944, 2368, 1, 1]
    - [25, 0.155]
  - - [3584, 2368, 1, 1]
    - [25, 0.161]
  - - [4288, 2368, 1, 1]
    - [17, 0.167]
  - - [5056, 2368, 1, 1]
    - [17, 0.169]
  - - [5888, 2368, 1, 1]
    - [25, 0.172]
  - - [6784, 2368, 1, 1]
    - [17, 0.174]
  - - [64, 2944, 1, 1]
    - [10, 0.018]
  - - [128, 2944, 1, 1]
    - [52, 0.033]
  - - [256, 2944, 1, 1]
    - [15, 0.055]
  - - [448, 2944, 1, 1]
    - [17, 0.079]
  - - [704, 2944, 1, 1]
    - [17, 0.1]
  - - [1024, 2944, 1, 1]
    - [17, 0.118]
  - - [1408, 2944, 1, 1]
    - [17, 0.135]
  - - [1856, 2944, 1, 1]
    - [25, 0.143]
  - - [2368, 2944, 1, 1]
    - [17, 0.153]
  - - [2944, 2944, 1, 1]
    - [17, 0.16]
  - - [3584, 2944, 1, 1]
    - [17, 0.167]
  - - [4288, 2944, 1, 1]
    - [25, 0.169]
  - - [5056, 2944, 1, 1]
    - [25, 0.174]
  - - [5888, 2944, 1, 1]
    - [17, 0.178]
  - - [6784, 2944, 1, 1]
    - [17, 0.18]
  - - [64, 3584, 1, 1]
    - [10, 0.021]
  - - [128, 3584, 1, 1]
    - [8, 0.039]
  - - [256, 3584, 1, 1]
    - [71, 0.063]
  - - [448, 3584, 1, 1]
    - [60, 0.088]
  - - [704, 3584, 1, 1]
    - [17, 0.111]
  - - [1024, 3584, 1, 1]
    - [17, 0.126]
  - - [1408, 3584, 1, 1]
    - [17, 0.141]
  - - [1856, 3584, 1, 1]
    - [17, 0.153]
  - - [2368, 3584, 1, 1]
    - [17, 0.162]
  - - [2944, 3584, 1, 1]
    - [17, 0.166]
  - - [3584, 3584, 1, 1]
    - [25, 0.171]
  - - [4288, 3584, 1, 1]
    - [91, 0.174]
  - - [5056, 3584, 1, 1]
    - [17, 0.178]
  - - [5888, 3584, 1, 1]
    - [91, 0.179]
  - - [6784, 3584, 1, 1]
    - [17, 0.18]
  - - [64, 4288, 1, 1]
    - [10, 0.025]
  - - [128, 4288, 1, 1]
    - [15, 0.045]
  - - [256, 4288, 1, 1]
    - [17, 0.069]
  - - [448, 4288, 1, 1]
    - [60, 0.096]
  - - [704, 4288, 1, 1]
    - [17, 0.119]
  - - [1024, 4288, 1, 1]
    - [25, 0.134]
  - - [1408, 4288, 1, 1]
    - [17, 0.148]
  - - [1856, 4288, 1, 1]
    - [25, 0.157]
  - - [2368, 4288, 1, 1]
    - [17, 0.166]
  - - [2944, 4288, 1, 1]
    - [17, 0.17]
  - - [3584, 4288, 1, 1]
    - [17, 0.175]
  - - [4288, 4288, 1, 1]
    - [25, 0.178]
  - - [5056, 4288, 1, 1]
    - [17, 0.181]
  - - [5888, 4288, 1, 1]
    - [17, 0.183]
  - - [6784, 4288, 1, 1]
    - [17, 0.185]
  - - [64, 5056, 1, 1]
    - [10, 0.029]
  - - [128, 5056, 1, 1]
    - [15, 0.051]
  - - [256, 5056, 1, 1]
    - [60, 0.078]
  - - [448, 5056, 1, 1]
    - [60, 0.105]
  - - [704, 5056, 1, 1]
    - [25, 0.128]
  - - [1024, 5056, 1, 1]
    - [60, 0.137]
  - - [1408, 5056, 1, 1]
    - [91, 0.156]
  - - [1856, 5056, 1, 1]
    - [25, 0.163]
  - - [2368, 5056, 1, 1]
    - [17, 0.17]
  - - [2944, 5056, 1, 1]
    - [17, 0.175]
  - - [3584, 5056, 1, 1]
    - [17, 0.178]
  - - [4288, 5056, 1, 1]
    - [17, 0.181]
  - - [5056, 5056, 1, 1]
    - [17, 0.183]
  - - [5888, 5056, 1, 1]
    - [17, 0.186]
  - - [6784, 5056, 1, 1]
    - [17, 0.186]
  - - [64, 5888, 1, 1]
    - [65, 0.033]
  - - [128, 5888, 1, 1]
    - [15, 0.058]
  - - [256, 5888, 1, 1]
    - [17, 0.086]
  - - [448, 5888, 1, 1]
    - [25, 0.112]
  - - [704, 5888, 1, 1]
    - [60, 0.132]
  - - [1024, 5888, 1, 1]
    - [17, 0.148]
  - - [1408, 5888, 1, 1]
    - [17, 0.16]
  - - [1856, 5888, 1, 1]
    - [25, 0.167]
  - - [2368, 5888, 1, 1]
    - [17, 0.173]
  - - [2944, 5888, 1, 1]
    - [17, 0.177]
  - - [3584, 5888, 1, 1]
    - [17, 0.181]
  - - [4288, 5888, 1, 1]
    - [17, 0.183]
  - - [5056, 5888, 1, 1]
    - [17, 0.186]
  - - [5888, 5888, 1, 1]
    - [17, 0.188]
  - - [6784, 5888, 1, 1]
    - [17, 0.188]
  - - [64, 6784, 1, 1]
    - [31, 0.036]
  - - [128, 6784, 1, 1]
    - [15, 0.065]
  - - [256, 6784, 1, 1]
    - [17, 0.092]
  - - [448, 6784, 1, 1]
    - [17, 0.121]
  - - [704, 6784, 1, 1]
    - [25, 0.139]
  - - [1024, 6784, 1, 1]
    - [17, 0.153]
  - - [1408, 6784, 1, 1]
    - [25, 0.163]
  - - [1856, 6784, 1, 1]
    - [25, 0.17]
  - - [2368, 6784, 1, 1]
    - [91, 0.175]
  - - [2944, 6784, 1, 1]
    - [17, 0.18]
  - - [3584, 6784, 1, 1]
    - [17, 0.183]
  - - [4288, 6784, 1, 1]
    - [54, 0.185]
  - - [5056, 6784, 1, 1]
    - [17, 0.187]
  - - [5888, 6784, 1, 1]
    - [17, 0.189]
  - - [6784, 6784, 1, 1]
    - [17, 0.19]
  - - [64, 1, 1, 1]
    - [31, 0.0]
  - - [128, 1, 1, 1]
    - [40, 0.0]
  - - [256, 1, 1, 1]
    - [114, 0.0]
  - - [448, 1, 1, 1]
    - [40, 0.0]
  - - [704, 1, 1, 1]
    - [65, 0.0]
  - - [1408, 1, 1, 1]
    - [31, 0.0]
  - - [1856, 1, 1, 1]
    - [22, 0.0]
  - - [2368, 1, 1, 1]
    - [65, 0.0]
  - - [2944, 1, 1, 1]
    - [10, 0.0]
  - - [3584, 1, 1, 1]
    - [10, 0.0]
  - - [4288, 1, 1, 1]
    - [10, 0.0]
  - - [5056, 1, 1, 1]
    - [10, 0.001]
  - - [5888, 1, 1, 1]
    - [10, 0.001]
  - - [6784, 1, 1, 1]
    - [10, 0.001]
  - - [84480, 163840, 1, 2560]
    - [150, 80.61]
  - - [84480, 166400, 1, 2560]
    - [151, 80.626]
  - - [84480, 168960, 1, 2560]
    - [152, 80.631]
  - - [84480, 171520, 1, 2560]
    - [153, 80.636]
  - - [87040, 168960, 1, 2560]
    - [154, 80.567]
  - - [87040, 171520, 1, 2560]
    - [155, 80.568]
  - - [81920, 158720, 1, 2560]
    - [156, 80.204]
  - - [81920, 161280, 1, 2560]
    - [157, 80.171]
  - - [81920, 163840, 1, 2560]
    - [157, 80.181]
  - - [81920, 166400, 1, 2560]
    - [158, 80.239]
  - - [81920, 168960, 1, 2560]
    - [159, 80.178]
  - - [76800, 148480, 1, 2560]
    - [160, 80.39]
  - - [76800, 151040, 1, 2560]
    - [161, 80.392]
  - - [76800, 153600, 1, 2560]
    - [162, 80.379]
  - - [76800, 156160, 1, 2560]
    - [163, 80.361]
  - - [76800, 158720, 1, 2560]
    - [164, 80.348]
  - - [79360, 153600, 1, 2560]
    - [165, 80.401]
  - - [79360, 156160, 1, 2560]
    - [166, 80.411]
  - - [79360, 158720, 1, 2560]
    - [167, 80.381]
  - - [79360, 161280, 1, 2560]
    - [161, 80.428]
  - - [79360, 163840, 1, 2560]
    - [168, 80.402]
  - - [71680, 138240, 1, 2560]
    - [169, 80.59]
  - - [71680, 140800, 1, 2560]
    - [170, 80.592]
  - - [71680, 143360, 1, 2560]
    - [170, 80.595]
  - - [71680, 145920, 1, 2560]
    - [171, 80.582]
  - - [71680, 148480, 1, 2560]
    - [172, 80.562]
  - - [74240, 143360, 1, 2560]
    - [173, 80.566]
  - - [74240, 145920, 1, 2560]
    - [174, 80.59]
  - - [74240, 148480, 1, 2560]
    - [175, 80.58]
  - - [74240, 151040, 1, 2560]
    - [176, 80.57]
  - - [74240, 153600, 1, 2560]
    - [177, 80.587]
  - - [66560, 128000, 1, 2560]
    - [178, 80.782]
  - - [66560, 130560, 1, 2560]
    - [179, 80.85]
  - - [66560, 133120, 1, 2560]
    - [180, 80.821]
  - - [66560, 135680, 1, 2560]
    - [181, 80.841]
  - - [66560, 138240, 1, 2560]
    - [182, 80.814]
  - - [69120, 133120, 1, 2560]
    - [183, 80.887]
  - - [69120, 135680, 1, 2560]
    - [184, 80.899]
  - - [69120, 138240, 1, 2560]
    - [185, 80.867]
  - - [69120, 140800, 1, 2560]
    - [186, 80.87]
  - - [69120, 143360, 1, 2560]
    - [179, 80.874]
  - - [61440, 117760, 1, 2560]
    - [187, 80.299]
  - - [61440, 120320, 1, 2560]
    - [188, 80.324]
  - - [61440, 122880, 1, 2560]
    - [189, 80.291]
  - - [61440, 125440, 1, 2560]
    - [190, 80.326]
  - - [61440, 128000, 1, 2560]
    - [191, 80.328]
  - - [64000, 122880, 1, 2560]
    - [192, 80.372]
  - - [64000, 125440, 1, 2560]
    - [193, 80.359]
  - - [64000, 128000, 1, 2560]
    - [194, 80.362]
  - - [64000, 130560, 1, 2560]
    - [195, 80.41]
  - - [64000, 133120, 1, 2560]
    - [187, 80.388]
  - - [56320, 110080, 1, 2560]
    - [200, 82.548]
  - - [56320, 112640, 1, 2560]
    - [201, 82.565]
  - - [56320, 115200, 1, 2560]
    - [202, 82.485]
  - - [56320, 117760, 1, 2560]
    - [203, 82.566]
  - - [58880, 112640, 1, 2560]
    - [204, 82.638]
  - - [58880, 115200, 1, 2560]
    - [205, 82.686]
  - - [58880, 117760, 1, 2560]
    - [206, 82.684]
  - - [58880, 120320, 1, 2560]
    - [207, 82.686]
  - - [58880, 122880, 1, 2560]
    - [208, 82.676]
  - - [51200, 104960, 1, 2560]
    - [196, 82.256]
  - - [51200, 107520, 1, 2560]
    - [197, 82.149]
  - - [53760, 107520, 1, 2560]
    - [196, 82.095]
  - - [53760, 110080, 1, 2560]
    - [197, 82.269]
  - - [53760, 112640, 1, 2560]
    - [198, 80.996]
  - - [46080, 97280, 1, 2560]
    - [209, 80.9]
  - - [48640, 102400, 1, 2560]
    - [210, 80.91]
  - - [15360, 25600, 1, 2560]
    - [199, 83.39]
- null
