library/src/blas3/Tensile/Logic/asm_full/aldebaran/aldebaran_Cijk_Ailk_Bjlk_BSS_BH.yaml
- {MinimumRequiredVersion: 4.23.0}
- aldebaran
- gfx90a
- [Device 0050, Device 0051, Device 0052, Device 0054, Device 0062, Device 7400, Device
    SolutionIndex: 0
    SolutionNameMin: Cijk_Ailk_Bjlk_BSS_BH_MT128x256x32_MI32x32x8x1_SE_1LDSB0_AF0EM8_GRVW8_GSU1_NLCA1_NLCB1_SU0_SUS0_SRVW4_TT2_128_VAW2_WG64_4_1_WGM2
    SolutionIndex: 1
    SolutionNameMin: Cijk_Ailk_Bjlk_BSS_BH_MT128x128x32_MI32x32x8x1_SE_1LDSB0_AF0EM4_GRVW8_GSU1_NLCA1_NLCB1_SU0_SUS0_SRVW0_TT2_64_VAW2_WG64_4_1_WGM15
    SolutionIndex: 2
    SolutionNameMin: Cijk_Ailk_Bjlk_BSS_BH_MT256x160x32_MI32x32x8x1_SE_1LDSB0_AF0EM8_GRVW4_GSU1_NLCA1_NLCB5_SU0_SUS0_SRVW4_TT2_160_VAW2_WG128_2_1_WGM2
    SolutionIndex: 3
    SolutionNameMin: Cijk_Ailk_Bjlk_BSS_BH_MT64x64x32_MI32x32x8x1_SE_1LDSB0_AF0EM8_GRVW8_GSU1_NLCA1_NLCB1_SU0_SUS0_SRVW4_TT1_32_VAW2_WG64_4_1_WGM1
    SolutionIndex: 4
    SolutionNameMin: Cijk_Ailk_Bjlk_BSS_BH_MT32x32x64_MI16x16x16x1_SE_1LDSB0_AF0EM1_GRVW8_GSU1_NLCA1_NLCB1_SU0_SUS0_SRVW0_TT1_16_VAW2_WG32_8_1_WGM2
    SolutionIndex: 5
    SolutionNameMin: Cijk_Ailk_Bjlk_BSS_BH_MT128x128x32_MI32x32x8x1_SE_1LDSB0_AF0EM4_GRVW8_GSU1_NLCA1_NLCB1_SU0_SUS0_SRVW0_TT2_64_VAW2_WG64_4_1_WGM2
    SolutionIndex: 6
    SolutionNameMin: Cijk_Ailk_Bjlk_BSS_BH_MT128x256x32_MI32x32x8x1_SE_1LDSB0_AF0EM4_GRVW8_GSU1_NLCA1_NLCB1_SU0_SUS0_SRVW4_TT2_128_VAW2_WG64_4_1_WGM1
    SolutionIndex: 7
    SolutionNameMin: Cijk_Ailk_Bjlk_BSS_BH_MT64x64x64_MI32x32x8x1_SE_1LDSB0_AF0EM8_GRVW8_GSU1_NLCA1_NLCB1_SU0_SUS0_SRVW4_TT1_32_VAW2_WG64_4_1_WGM1
    SolutionIndex: 8
    SolutionNameMin: Cijk_Ailk_Bjlk_BSS_BH_MT32x32x16_MI16x16x16x1_SE_1LDSB0_AF0EM4_GRVW2_GSU1_NLCA1_NLCB1_SU0_SUS0_SRVW0_TT1_16_VAW2_WG32_8_1_WGM1
    SolutionIndex: 9
    SolutionNameMin: Cijk_Ailk_Bjlk_BSS_BH_MT32x32x32_MI16x16x16x1_SE_1LDSB0_AF0EM8_GRVW2_GSU1_NLCA1_NLCB1_SU0_SUS0_SRVW4_TT1_16_VAW2_WG32_8_1_WGM1
    SolutionIndex: 10
    SolutionNameMin: Cijk_Ailk_Bjlk_BSS_BH_MT64x32x16_MI16x16x16x1_SE_1LDSB0_AF0EM4_GRVW4_GSU1_NLCA1_NLCB1_SU0_SUS0_SRVW4_TT2_16_VAW2_WG32_8_1_WGM1
    SolutionIndex: 11
    SolutionNameMin: Cijk_Ailk_Bjlk_BSS_BH_MT64x32x16_MI16x16x16x1_SE_1LDSB0_AF0EM4_GRVW2_GSU1_NLCA1_NLCB1_SU0_SUS0_SRVW4_TT2_16_VAW2_WG32_8_1_WGM1
    SolutionIndex: 12
    SolutionNameMin: Cijk_Ailk_Bjlk_BSS_BH_MT128x160x16_MI32x32x8x1_SE_1LDSB0_AF0EM4_GRVW2_GSU1_NLCA1_NLCB5_SU0_SUS0_SRVW4_TT1_160_VAW2_WG128_2_1_WGM1
    SolutionIndex: 13
    SolutionNameMin: Cijk_Ailk_Bjlk_BSS_BH_MT64x32x16_MI16x16x16x1_SE_1LDSB0_AF0EM8_GRVW2_GSU1_NLCA1_NLCB1_SU0_SUS0_SRVW4_TT2_16_VAW2_WG32_8_1_WGM1
    SolutionIndex: 14
    SolutionNameMin: Cijk_Ailk_Bjlk_BSS_BH_MT64x128x32_MI32x32x8x1_SE_1LDSB0_AF0EM8_GRVW8_GSU1_NLCA1_NLCB1_SU32_SUS128_SRVW4_TT1_64_VAW2_WG64_4_1_WGM2
    SolutionIndex: 15
    SolutionNameMin: Cijk_Ailk_Bjlk_BSS_BH_MT32x32x16_MI16x16x16x1_SE_1LDSB0_AF0EM4_GRVW4_GSU1_NLCA1_NLCB1_SU0_SUS0_SRVW0_TT1_16_VAW2_WG32_8_1_WGM15
    SolutionIndex: 16
    SolutionNameMin: Cijk_Ailk_Bjlk_BSS_BH_MT32x32x128_MI16x16x16x1_SE_1LDSB0_AF0EM4_GRVW2_GSU1_NLCA1_NLCB1_SU0_SUS0_SRVW0_TT1_16_VAW2_WG32_8_1_WGM1
    SolutionIndex: 17
    SolutionNameMin: Cijk_Ailk_Bjlk_BSS_BH_MT128x96x64_MI32x32x8x1_SE_1LDSB0_AF0EM8_GRVW8_GSU1_NLCA1_NLCB3_SU32_SUS128_SRVW4_TT1_96_VAW2_WG128_2_1_WGM15
    SolutionIndex: 18
    SolutionNameMin: Cijk_Ailk_Bjlk_BSS_BH_MT128x96x16_MI32x32x8x1_SE_1LDSB0_AF0EM4_GRVW2_GSU1_NLCA1_NLCB3_SU0_SUS0_SRVW4_TT1_96_VAW2_WG128_2_1_WGM2
    SolutionIndex: 19
    SolutionNameMin: Cijk_Ailk_Bjlk_BSS_BH_MT160x256x32_MI32x32x8x1_SE_1LDSB0_AF0EM8_GRVW4_GSU1_NLCA5_NLCB1_SU0_SUS0_SRVW0_TT5_64_VAW2_WG32_8_1_WGM1
    SolutionIndex: 20
    SolutionNameMin: Cijk_Ailk_Bjlk_BSS_BH_MT64x128x16_MI32x32x8x1_SE_1LDSB0_AF0EM8_GRVW4_GSU1_NLCA1_NLCB1_SU0_SUS0_SRVW4_TT1_64_VAW2_WG64_4_1_WGM15
    SolutionIndex: 21
    SolutionNameMin: Cijk_Ailk_Bjlk_BSS_BH_MT64x16x32_MI16x16x16x1_SE_1LDSB0_AF0EM8_GRVW2_GSU15_NLCA1_NLCB1_SU0_SUS0_SRVW0_TT1_16_VAW1_WG64_4_1_WGM2
    SolutionIndex: 22
    SolutionNameMin: Cijk_Ailk_Bjlk_BSS_BH_MT256x160x32_MI32x32x8x1_SE_1LDSB0_AF0EM8_GRVW4_GSU1_NLCA1_NLCB5_SU0_SUS0_SRVW4_TT2_160_VAW2_WG128_2_1_WGM15
    SolutionIndex: 23
    SolutionNameMin: Cijk_Ailk_Bjlk_BSS_BH_MT64x128x16_MI32x32x8x1_SE_1LDSB0_AF0EM8_GRVW8_GSU1_NLCA1_NLCB1_SU0_SUS0_SRVW4_TT1_64_VAW2_WG64_4_1_WGM1
    SolutionIndex: 24
    SolutionNameMin: Cijk_Ailk_Bjlk_BSS_BH_MT32x32x16_MI16x16x16x1_SE_1LDSB0_AF0EM4_GRVW4_GSU1_NLCA1_NLCB1_SU0_SUS0_SRVW0_TT1_16_VAW2_WG32_8_1_WGM1
    SolutionIndex: 25
    SolutionNameMin: Cijk_Ailk_Bjlk_BSS_BH_MT64x64x32_MI32x32x8x1_SE_1LDSB0_AF0EM4_GRVW4_GSU1_NLCA1_NLCB1_SU0_SUS0_SRVW4_TT1_32_VAW2_WG64_4_1_WGM1
    SolutionIndex: 26
    SolutionNameMin: Cijk_Ailk_Bjlk_BSS_BH_MT128x96x16_MI32x32x8x1_SE_1LDSB0_AF0EM8_GRVW2_GSU1_NLCA1_NLCB3_SU0_SUS0_SRVW4_TT1_96_VAW2_WG128_2_1_WGM2
    SolutionIndex: 27
    SolutionNameMin: Cijk_Ailk_Bjlk_BSS_BH_MT64x128x16_MI32x32x8x1_SE_1LDSB0_AF0EM8_GRVW8_GSU1_NLCA1_NLCB1_SU0_SUS0_SRVW4_TT1_64_VAW2_WG64_4_1_WGM15
    SolutionIndex: 28
    SolutionNameMin: Cijk_Ailk_Bjlk_BSS_BH_MT16x16x16_MI16x16x16x1_SE_1LDSB0_AF0EM8_GRVW2_GSU1_NLCA1_NLCB1_SU0_SUS0_SRVW0_TT1_16_VAW2_WG16_4_1_WGM1
    SolutionIndex: 29
    SolutionNameMin: Cijk_Ailk_Bjlk_BSS_BH_MT64x16x32_MI16x16x16x1_SE_1LDSB0_AF0EM8_GRVW8_GSU15_NLCA1_NLCB1_SU0_SUS0_SRVW0_TT1_16_VAW1_WG64_4_1_WGM15
    SolutionIndex: 30
    SolutionNameMin: Cijk_Ailk_Bjlk_BSS_BH_MT256x160x32_MI32x32x8x1_SE_1LDSB0_AF0EM8_GRVW4_GSU1_NLCA1_NLCB5_SU32_SUS256_SRVW4_TT2_160_VAW2_WG128_2_1_WGM15
    SolutionIndex: 31
    SolutionNameMin: Cijk_Ailk_Bjlk_BSS_BH_MT160x256x32_MI32x32x8x1_SE_1LDSB0_AF0EM8_GRVW4_GSU1_NLCA5_NLCB1_SU0_SUS0_SRVW0_TT5_64_VAW2_WG32_8_1_WGM2
    SolutionIndex: 32
    SolutionNameMin: Cijk_Ailk_Bjlk_BSS_BH_MT64x16x32_MI16x16x16x1_SE_1LDSB0_AF0EM8_GRVW8_GSU7_NLCA1_NLCB1_SU0_SUS0_SRVW0_TT1_16_VAW1_WG64_4_1_WGM1
    SolutionIndex: 33
    SolutionNameMin: Cijk_Ailk_Bjlk_BSS_BH_MT64x128x32_MI32x32x8x1_SE_1LDSB0_AF0EM8_GRVW8_GSU1_NLCA1_NLCB1_SU0_SUS0_SRVW4_TT1_64_VAW2_WG64_4_1_WGM1
    SolutionIndex: 34
    SolutionNameMin: Cijk_Ailk_Bjlk_BSS_BH_MT160x256x32_MI32x32x8x1_SE_1LDSB0_AF0EM8_GRVW4_GSU1_NLCA5_NLCB1_SU32_SUS128_SRVW0_TT5_64_VAW2_WG32_8_1_WGM1
    SolutionIndex: 35
    SolutionNameMin: Cijk_Ailk_Bjlk_BSS_BH_MT16x16x32_MI16x16x16x1_SE_1LDSB0_AF0EM1_GRVW4_GSU15_NLCA1_NLCB1_SU0_SUS0_SRVW0_TT1_16_VAW1_WG16_4_1_WGM1
    SolutionIndex: 36
    SolutionNameMin: Cijk_Ailk_Bjlk_BSS_BH_MT64x64x64_MI32x32x8x1_SE_1LDSB0_AF0EM8_GRVW8_GSU15_NLCA1_NLCB1_SU0_SUS0_SRVW0_TT1_32_VAW1_WG64_4_1_WGM1
    SolutionIndex: 37
    SolutionNameMin: Cijk_Ailk_Bjlk_BSS_BH_MT128x256x32_MI32x32x8x1_SE_1LDSB0_AF0EM1_GRVW8_GSU7_NLCA1_NLCB1_SU32_SUS128_SRVW0_TT2_128_VAW1_WG64_4_1_WGM2
    SolutionIndex: 38
    SolutionNameMin: Cijk_Ailk_Bjlk_BSS_BH_MT256x128x32_MI32x32x8x1_SE_1LDSB0_AF0EM8_GRVW8_GSU15_NLCA1_NLCB1_SU0_SUS0_SRVW0_TT4_64_VAW1_WG64_4_1_WGM1
    SolutionIndex: 39
    SolutionNameMin: Cijk_Ailk_Bjlk_BSS_BH_MT128x128x64_MI32x32x8x1_SE_1LDSB0_AF0EM8_GRVW8_GSU3_NLCA1_NLCB1_SU0_SUS0_SRVW0_TT2_64_VAW1_WG64_4_1_WGM2
    SolutionIndex: 40
    SolutionNameMin: Cijk_Ailk_Bjlk_BSS_BH_MT128x256x32_MI32x32x8x1_SE_1LDSB0_AF0EM8_GRVW8_GSU3_NLCA1_NLCB1_SU0_SUS0_SRVW0_TT2_128_VAW1_WG64_4_1_WGM2
    SolutionIndex: 41
    SolutionNameMin: Cijk_Ailk_Bjlk_BSS_BH_MT64x64x32_MI32x32x8x1_SE_1LDSB0_AF0EM8_GRVW8_GSU1_NLCA1_NLCB1_SU32_SUS128_SRVW4_TT1_32_VAW2_WG64_4_1_WGM1
    SolutionIndex: 42
    SolutionNameMin: Cijk_Ailk_Bjlk_BSS_BH_MT32x64x16_MI16x16x16x1_SE_1LDSB0_AF0EM4_GRVW2_GSU1_NLCA1_NLCB1_SU0_SUS0_SRVW0_TT1_32_VAW2_WG32_8_1_WGM1
    SolutionIndex: 43
    SolutionNameMin: Cijk_Ailk_Bjlk_BSS_BH_MT128x256x32_MI32x32x8x1_SE_1LDSB0_AF0EM8_GRVW8_GSU3_NLCA1_NLCB1_SU0_SUS0_SRVW0_TT2_128_VAW1_WG64_4_1_WGM1
    SolutionIndex: 44
    SolutionNameMin: Cijk_Ailk_Bjlk_BSS_BH_MT256x128x32_MI32x32x8x1_SE_1LDSB0_AF0EM8_GRVW8_GSU3_NLCA1_NLCB1_SU0_SUS0_SRVW0_TT4_64_VAW1_WG64_4_1_WGM15
    SolutionIndex: 45
    SolutionNameMin: Cijk_Ailk_Bjlk_BSS_BH_MT256x128x32_MI32x32x8x1_SE_1LDSB0_AF0EM8_GRVW8_GSU3_NLCA1_NLCB1_SU0_SUS0_SRVW0_TT4_64_VAW1_WG64_4_1_WGM1
    SolutionIndex: 46
    SolutionNameMin: Cijk_Ailk_Bjlk_BSS_BH_MT32x64x16_MI16x16x16x1_SE_1LDSB0_AF0EM1_GRVW2_GSU1_NLCA1_NLCB1_SU0_SUS0_SRVW4_TT1_32_VAW2_WG32_8_1_WGM1
    SolutionIndex: 47
    SolutionNameMin: Cijk_Ailk_Bjlk_BSS_BH_MT16x16x16_MI16x16x16x1_SE_1LDSB0_AF0EM1_GRVW8_GSU1_NLCA1_NLCB1_SU0_SUS0_SRVW4_TT1_16_VAW2_WG16_4_1_WGM1
    SolutionIndex: 48
    SolutionNameMin: Cijk_Ailk_Bjlk_BSS_BH_MT32x64x16_MI16x16x16x1_SE_1LDSB0_AF0EM1_GRVW8_GSU1_NLCA1_NLCB1_SU0_SUS0_SRVW4_TT1_32_VAW2_WG32_8_1_WGM1
    SolutionIndex: 49
    SolutionNameMin: Cijk_Ailk_Bjlk_BSS_BH_MT32x64x16_MI16x16x16x1_SE_1LDSB0_AF0EM4_GRVW2_GSU1_NLCA1_NLCB1_SU0_SUS0_SRVW0_TT1_32_VAW2_WG32_8_1_WGM15
    SolutionIndex: 50
    SolutionNameMin: Cijk_Ailk_Bjlk_BSS_BH_MT32x64x16_MI16x16x16x1_SE_1LDSB0_AF0EM1_GRVW2_GSU1_NLCA1_NLCB1_SU32_SUS128_SRVW4_TT1_32_VAW2_WG32_8_1_WGM15
    SolutionIndex: 51
    SolutionNameMin: Cijk_Ailk_Bjlk_BSS_BH_MT32x64x16_MI16x16x16x1_SE_1LDSB0_AF0EM1_GRVW2_GSU1_NLCA1_NLCB1_SU0_SUS0_SRVW0_TT1_32_VAW2_WG32_8_1_WGM1
    SolutionIndex: 52
    SolutionNameMin: Cijk_Ailk_Bjlk_BSS_BH_MT32x64x16_MI16x16x16x1_SE_1LDSB0_AF0EM4_GRVW2_GSU1_NLCA1_NLCB1_SU0_SUS0_SRVW0_TT1_32_VAW2_WG32_8_1_WGM2
    SolutionIndex: 53
    SolutionNameMin: Cijk_Ailk_Bjlk_BSS_BH_MT64x32x16_MI16x16x16x1_SE_1LDSB0_AF0EM4_GRVW2_GSU1_NLCA1_NLCB1_SU0_SUS0_SRVW0_TT2_16_VAW2_WG32_8_1_WGM1
    SolutionIndex: 54
    SolutionNameMin: Cijk_Ailk_Bjlk_BSS_BH_MT64x32x16_MI16x16x16x1_SE_1LDSB1_AF0EM8_GRVW2_GSU1_NLCA1_NLCB1_SU0_SUS0_SRVW4_TT2_16_VAW2_WG32_8_1_WGM1
    SolutionIndex: 55
    SolutionNameMin: Cijk_Ailk_Bjlk_BSS_BH_MT64x32x16_MI16x16x16x1_SE_1LDSB0_AF0EM8_GRVW4_GSU1_NLCA1_NLCB1_SU0_SUS0_SRVW4_TT2_16_VAW2_WG32_8_1_WGM1
    SolutionIndex: 56
    SolutionNameMin: Cijk_Ailk_Bjlk_BSS_BH_MT32x32x64_MI16x16x16x1_SE_1LDSB0_AF0EM4_GRVW8_GSU1_NLCA1_NLCB1_SU32_SUS128_SRVW0_TT1_16_VAW2_WG32_8_1_WGM1
    SolutionIndex: 57
    SolutionNameMin: Cijk_Ailk_Bjlk_BSS_BH_MT32x32x64_MI16x16x16x1_SE_1LDSB0_AF0EM4_GRVW4_GSU1_NLCA1_NLCB1_SU32_SUS128_SRVW0_TT1_16_VAW2_WG32_8_1_WGM1
    SolutionIndex: 58
    SolutionNameMin: Cijk_Ailk_Bjlk_BSS_BH_MT32x32x32_MI16x16x16x1_SE_1LDSB0_AF0EM4_GRVW4_GSU1_NLCA1_NLCB1_SU0_SUS0_SRVW0_TT1_16_VAW2_WG32_8_1_WGM15
    SolutionIndex: 59
    SolutionNameMin: Cijk_Ailk_Bjlk_BSS_BH_MT32x32x64_MI16x16x16x1_SE_1LDSB0_AF0EM1_GRVW4_GSU1_NLCA1_NLCB1_SU0_SUS0_SRVW0_TT1_16_VAW2_WG32_8_1_WGM2
    SolutionIndex: 60
    SolutionNameMin: Cijk_Ailk_Bjlk_BSS_BH_MT32x32x16_MI16x16x16x1_SE_1LDSB0_AF0EM1_GRVW2_GSU1_NLCA1_NLCB1_SU0_SUS0_SRVW0_TT1_16_VAW2_WG32_8_1_WGM1
    SolutionIndex: 61
    SolutionNameMin: Cijk_Ailk_Bjlk_BSS_BH_MT64x64x16_MI32x32x8x1_SE_1LDSB0_AF0EM1_GRVW4_GSU1_NLCA1_NLCB1_SU0_SUS0_SRVW4_TT1_32_VAW2_WG64_4_1_WGM2
    SolutionIndex: 62
    SolutionNameMin: Cijk_Ailk_Bjlk_BSS_BH_MT64x64x64_MI32x32x8x1_SE_1LDSB0_AF0EM8_GRVW8_GSU1_NLCA1_NLCB1_SU0_SUS0_SRVW4_TT1_32_VAW2_WG64_4_1_WGM2
    SolutionIndex: 63
    SolutionNameMin: Cijk_Ailk_Bjlk_BSS_BH_MT64x32x16_MI16x16x16x1_SE_1LDSB1_AF0EM8_GRVW2_GSU1_NLCA1_NLCB1_SU0_SUS0_SRVW4_TT2_16_VAW2_WG32_8_1_WGM15
    SolutionIndex: 64
    SolutionNameMin: Cijk_Ailk_Bjlk_BSS_BH_MT32x64x16_MI16x16x16x1_SE_1LDSB1_AF0EM1_GRVW2_GSU1_NLCA1_NLCB1_SU32_SUS256_SRVW4_TT1_32_VAW2_WG32_8_1_WGM15
    SolutionIndex: 65
    SolutionNameMin: Cijk_Ailk_Bjlk_BSS_BH_MT128x128x64_MI32x32x8x1_SE_1LDSB0_AF0EM8_GRVW8_GSU5_NLCA1_NLCB1_SU0_SUS0_SRVW0_TT2_64_VAW1_WG64_4_1_WGM1
    SolutionIndex: 66
    SolutionNameMin: Cijk_Ailk_Bjlk_BSS_BH_MT256x128x32_MI32x32x8x1_SE_1LDSB0_AF0EM8_GRVW8_GSU5_NLCA1_NLCB1_SU0_SUS0_SRVW0_TT4_64_VAW1_WG64_4_1_WGM1
    SolutionIndex: 67
    SolutionNameMin: Cijk_Ailk_Bjlk_BSS_BH_MT128x128x64_MI32x32x8x1_SE_1LDSB0_AF0EM8_GRVW8_GSU2_NLCA1_NLCB1_SU0_SUS0_SRVW0_TT2_64_VAW1_WG64_4_1_WGM15
    SolutionIndex: 68
    SolutionNameMin: Cijk_Ailk_Bjlk_BSS_BH_MT128x96x64_MI32x32x8x1_SE_1LDSB0_AF0EM8_GRVW8_GSU1_NLCA1_NLCB3_SU0_SUS0_SRVW4_TT1_96_VAW2_WG128_2_1_WGM2
    SolutionIndex: 69
    SolutionNameMin: Cijk_Ailk_Bjlk_BSS_BH_MT128x96x64_MI32x32x8x1_SE_1LDSB0_AF0EM4_GRVW8_GSU1_NLCA1_NLCB3_SU16_SUS128_SRVW4_TT1_96_VAW2_WG128_2_1_WGM2
    SolutionIndex: 70
    SolutionNameMin: Cijk_Ailk_Bjlk_BSS_BH_MT128x128x64_MI32x32x8x1_SE_1LDSB0_AF0EM8_GRVW4_GSU1_NLCA1_NLCB1_SU0_SUS0_SRVW4_TT2_64_VAW2_WG64_4_1_WGM1
    SolutionIndex: 71
    SolutionNameMin: Cijk_Ailk_Bjlk_BSS_BH_MT128x160x32_MI32x32x8x1_SE_1LDSB0_AF0EM8_GRVW4_GSU1_NLCA1_NLCB5_SU32_SUS128_SRVW4_TT1_160_VAW2_WG128_2_1_WGM2
    SolutionIndex: 72
    SolutionNameMin: Cijk_Ailk_Bjlk_BSS_BH_MT128x160x32_MI32x32x8x1_SE_1LDSB0_AF0EM8_GRVW4_GSU1_NLCA1_NLCB5_SU32_SUS128_SRVW4_TT1_160_VAW2_WG128_2_1_WGM15
    SolutionIndex: 73
    SolutionNameMin: Cijk_Ailk_Bjlk_BSS_BH_MT128x96x32_MI32x32x8x1_SE_1LDSB0_AF0EM8_GRVW4_GSU1_NLCA1_NLCB3_SU0_SUS0_SRVW4_TT1_96_VAW2_WG128_2_1_WGM1
    SolutionIndex: 74
    SolutionNameMin: Cijk_Ailk_Bjlk_BSS_BH_MT128x96x32_MI32x32x8x1_SE_1LDSB0_AF0EM4_GRVW4_GSU1_NLCA1_NLCB3_SU0_SUS0_SRVW4_TT1_96_VAW2_WG128_2_1_WGM2
    SolutionIndex: 75
    SolutionNameMin: Cijk_Ailk_Bjlk_BSS_BH_MT128x96x32_MI32x32x8x1_SE_1LDSB0_AF0EM4_GRVW4_GSU1_NLCA1_NLCB3_SU32_SUS128_SRVW4_TT1_96_VAW2_WG128_2_1_WGM2
    SolutionIndex: 76
    SolutionNameMin: Cijk_Ailk_Bjlk_BSS_BH_MT128x256x32_MI32x32x8x1_SE_1LDSB0_AF0EM8_GRVW8_GSU1_NLCA1_NLCB1_SU0_SUS0_SRVW4_TT2_128_VAW2_WG64_4_1_WGM15
    SolutionIndex: 77
    SolutionNameMin: Cijk_Ailk_Bjlk_BSS_BH_MT128x288x32_MI32x32x8x1_SE_1LDSB0_AF0EM4_GRVW4_GSU1_NLCA1_NLCB9_SU0_SUS0_SRVW4_TT1_288_VAW2_WG128_2_1_WGM2
    SolutionIndex: 78
    SolutionNameMin: Cijk_Ailk_Bjlk_BSS_BH_MT128x288x32_MI32x32x8x1_SE_1LDSB0_AF0EM8_GRVW4_GSU1_NLCA1_NLCB9_SU0_SUS0_SRVW4_TT1_288_VAW2_WG128_2_1_WGM2
    SolutionIndex: 79
    SolutionNameMin: Cijk_Ailk_Bjlk_BSS_BH_MT256x256x16_MI32x32x8x1_SE_1LDSB0_AF0EM4_GRVW4_GSU1_NLCA1_NLCB1_SU16_SUS256_SRVW0_TT4_128_VAW2_WG64_4_1_WGM1
    SolutionIndex: 80
    SolutionNameMin: Cijk_Ailk_Bjlk_BSS_BH_MT64x64x32_MI32x32x8x1_SE_1LDSB0_AF0EM1_GRVW8_GSU1_NLCA1_NLCB1_SU0_SUS0_SRVW4_TT1_32_VAW2_WG64_4_1_WGM1
    SolutionIndex: 81
    SolutionNameMin: Cijk_Ailk_Bjlk_BSS_BH_MT32x32x32_MI16x16x16x1_SE_1LDSB0_AF0EM4_GRVW8_GSU1_NLCA1_NLCB1_SU0_SUS0_SRVW0_TT1_16_VAW2_WG32_8_1_WGM1
    SolutionIndex: 82
    SolutionNameMin: Cijk_Ailk_Bjlk_BSS_BH_MT64x64x128_MI32x32x8x1_SE_1LDSB0_AF0EM4_GRVW8_GSU1_NLCA1_NLCB1_SU16_SUS256_SRVW4_TT1_32_VAW2_WG64_4_1_WGM2
    SolutionIndex: 83
    SolutionNameMin: Cijk_Ailk_Bjlk_BSS_BH_MT64x64x128_MI32x32x8x1_SE_1LDSB0_AF0EM4_GRVW8_GSU1_NLCA1_NLCB1_SU16_SUS256_SRVW4_TT1_32_VAW2_WG64_4_1_WGM15
    SolutionIndex: 84
    SolutionNameMin: Cijk_Ailk_Bjlk_BSS_BH_MT64x64x128_MI32x32x8x1_SE_1LDSB0_AF0EM1_GRVW8_GSU1_NLCA1_NLCB1_SU32_SUS256_SRVW4_TT1_32_VAW2_WG64_4_1_WGM1
    SolutionIndex: 85
    SolutionNameMin: Cijk_Ailk_Bjlk_BSS_BH_MT96x128x64_MI32x32x8x1_SE_1LDSB0_AF0EM8_GRVW8_GSU5_NLCA3_NLCB1_SU32_SUS256_SRVW0_TT3_32_VAW1_WG32_8_1_WGM2
    SolutionIndex: 86
    SolutionNameMin: Cijk_Ailk_Bjlk_BSS_BH_MT96x128x64_MI32x32x8x1_SE_1LDSB0_AF0EM8_GRVW4_GSU5_NLCA3_NLCB1_SU32_SUS256_SRVW0_TT3_32_VAW1_WG32_8_1_WGM15
    SolutionIndex: 87
    SolutionNameMin: Cijk_Ailk_Bjlk_BSS_BH_MT128x256x32_MI32x32x8x1_SE_1LDSB0_AF0EM8_GRVW8_GSU1_NLCA1_NLCB1_SU0_SUS0_SRVW4_TT2_128_VAW2_WG64_4_1_WGM1
    SolutionIndex: 88
    SolutionNameMin: Cijk_Ailk_Bjlk_BSS_BH_MT128x256x32_MI32x32x8x1_SE_1LDSB0_AF0EM8_GRVW8_GSU1_NLCA1_NLCB1_SU32_SUS256_SRVW4_TT2_128_VAW2_WG64_4_1_WGM1
    SolutionIndex: 89
    SolutionNameMin: Cijk_Ailk_Bjlk_BSS_BH_MT128x64x64_MI32x32x8x1_SE_1LDSB0_AF0EM4_GRVW8_GSU1_NLCA1_NLCB1_SU0_SUS0_SRVW4_TT2_32_VAW2_WG64_4_1_WGM15
    SolutionIndex: 90
    SolutionNameMin: Cijk_Ailk_Bjlk_BSS_BH_MT64x128x32_MI32x32x8x1_SE_1LDSB0_AF0EM8_GRVW8_GSU1_NLCA1_NLCB1_SU0_SUS0_SRVW4_TT1_64_VAW2_WG64_4_1_WGM2
    SolutionIndex: 91
    SolutionNameMin: Cijk_Ailk_Bjlk_BSS_BH_MT128x96x32_MI32x32x8x1_SE_1LDSB0_AF0EM4_GRVW4_GSU1_NLCA1_NLCB3_SU0_SUS0_SRVW4_TT1_96_VAW2_WG128_2_1_WGM15
    SolutionIndex: 92
    SolutionNameMin: Cijk_Ailk_Bjlk_BSS_BH_MT96x128x32_MI32x32x8x1_SE_1LDSB0_AF0EM8_GRVW4_GSU1_NLCA3_NLCB1_SU0_SUS0_SRVW0_TT3_32_VAW2_WG32_8_1_WGM1
    SolutionIndex: 93
    SolutionNameMin: Cijk_Ailk_Bjlk_BSS_BH_MT96x128x16_MI32x32x8x1_SE_1LDSB0_AF0EM8_GRVW2_GSU1_NLCA3_NLCB1_SU0_SUS0_SRVW0_TT3_32_VAW2_WG32_8_1_WGM2
    SolutionIndex: 94
    SolutionNameMin: Cijk_Ailk_Bjlk_BSS_BH_MT256x128x32_MI32x32x8x1_SE_1LDSB0_AF0EM8_GRVW8_GSU3_NLCA1_NLCB1_SU32_SUS256_SRVW0_TT4_64_VAW1_WG64_4_1_WGM1
    SolutionIndex: 95
    SolutionNameMin: Cijk_Ailk_Bjlk_BSS_BH_MT128x64x16_MI32x32x8x1_SE_1LDSB0_AF0EM4_GRVW4_GSU1_NLCA1_NLCB1_SU0_SUS0_SRVW0_TT2_32_VAW2_WG64_4_1_WGM15
    SolutionIndex: 96
    SolutionNameMin: Cijk_Ailk_Bjlk_BSS_BH_MT64x128x32_MI32x32x8x1_SE_1LDSB0_AF0EM8_GRVW8_GSU1_NLCA1_NLCB1_SU32_SUS128_SRVW4_TT1_64_VAW2_WG64_4_1_WGM1
    SolutionIndex: 97
    SolutionNameMin: Cijk_Ailk_Bjlk_BSS_BH_MT64x128x16_MI32x32x8x1_SE_1LDSB0_AF0EM1_GRVW8_GSU1_NLCA1_NLCB1_SU0_SUS0_SRVW4_TT1_64_VAW2_WG64_4_1_WGM1
    SolutionIndex: 98
    SolutionNameMin: Cijk_Ailk_Bjlk_BSS_BH_MT64x128x32_MI32x32x8x1_SE_1LDSB0_AF0EM4_GRVW8_GSU1_NLCA1_NLCB1_SU0_SUS0_SRVW4_TT1_64_VAW2_WG64_4_1_WGM1
    SolutionIndex: 99
    SolutionNameMin: Cijk_Ailk_Bjlk_BSS_BH_MT64x16x32_MI16x16x16x1_SE_1LDSB0_AF0EM8_GRVW4_GSU1_NLCA1_NLCB1_SU0_SUS0_SRVW0_TT1_16_VAW2_WG64_4_1_WGM15
    SolutionIndex: 100
    SolutionNameMin: Cijk_Ailk_Bjlk_BSS_BH_MT128x96x64_MI32x32x8x1_SE_1LDSB0_AF0EM4_GRVW8_GSU1_NLCA1_NLCB3_SU0_SUS0_SRVW4_TT1_96_VAW2_WG128_2_1_WGM2
    SolutionIndex: 101
    SolutionNameMin: Cijk_Ailk_Bjlk_BSS_BH_MT32x32x64_MI16x16x16x1_SE_1LDSB0_AF0EM8_GRVW2_GSU7_NLCA1_NLCB1_SU0_SUS0_SRVW0_TT1_16_VAW1_WG32_8_1_WGM15
    SolutionIndex: 102
    SolutionNameMin: Cijk_Ailk_Bjlk_BSS_BH_MT32x32x64_MI16x16x16x1_SE_1LDSB0_AF0EM8_GRVW4_GSU5_NLCA1_NLCB1_SU0_SUS0_SRVW0_TT1_16_VAW1_WG32_8_1_WGM1
    SolutionIndex: 103
    SolutionNameMin: Cijk_Ailk_Bjlk_BSS_BH_MT32x32x16_MI16x16x16x1_SE_1LDSB0_AF0EM4_GRVW8_GSU1_NLCA1_NLCB1_SU0_SUS0_SRVW0_TT1_16_VAW2_WG32_8_1_WGM2
    SolutionIndex: 104
    SolutionNameMin: Cijk_Ailk_Bjlk_BSS_BH_MT128x128x64_MI32x32x8x1_SE_1LDSB0_AF0EM8_GRVW8_GSU3_NLCA1_NLCB1_SU0_SUS0_SRVW0_TT2_64_VAW1_WG64_4_1_WGM1
    SolutionIndex: 105
    SolutionNameMin: Cijk_Ailk_Bjlk_BSS_BH_MT32x64x128_MI16x16x16x1_SE_1LDSB0_AF0EM1_GRVW8_GSU1_NLCA1_NLCB1_SU32_SUS256_SRVW0_TT1_32_VAW2_WG32_8_1_WGM15
    SolutionIndex: 106
    SolutionNameMin: Cijk_Ailk_Bjlk_BSS_BH_MT64x64x32_MI32x32x8x1_SE_1LDSB0_AF0EM8_GRVW8_GSU7_NLCA1_NLCB1_SU0_SUS0_SRVW0_TT1_32_VAW1_WG64_4_1_WGM1
    SolutionIndex: 107
    SolutionNameMin: Cijk_Ailk_Bjlk_BSS_BH_MT144x256x32_MI16x16x16x1_SE_1LDSB0_AF0EM8_GRVW2_GSU1_NLCA9_NLCB2_SU0_SUS0_SRVW0_TT9_64_VAW2_WG16_16_1_WGM1
    SolutionIndex: 108
    SolutionNameMin: Cijk_Ailk_Bjlk_BSS_BH_MT64x32x16_MI16x16x16x1_SE_1LDSB0_AF0EM1_GRVW2_GSU1_NLCA1_NLCB1_SU0_SUS0_SRVW4_TT2_16_VAW2_WG32_8_1_WGM2
    SolutionIndex: 109
    SolutionNameMin: Cijk_Ailk_Bjlk_BSS_BH_MT128x96x16_MI32x32x8x1_SE_1LDSB0_AF0EM4_GRVW2_GSU1_NLCA1_NLCB3_SU16_SUS256_SRVW4_TT1_96_VAW2_WG128_2_1_WGM15
    SolutionIndex: 110
    SolutionNameMin: Cijk_Ailk_Bjlk_BSS_BH_MT64x128x16_MI32x32x8x1_SE_1LDSB0_AF0EM4_GRVW8_GSU1_NLCA1_NLCB1_SU0_SUS0_SRVW4_TT1_64_VAW2_WG64_4_1_WGM1
    SolutionIndex: 111
    SolutionNameMin: Cijk_Ailk_Bjlk_BSS_BH_MT64x128x32_MI32x32x8x1_SE_1LDSB0_AF0EM1_GRVW8_GSU1_NLCA1_NLCB1_SU0_SUS0_SRVW4_TT1_64_VAW2_WG64_4_1_WGM1
    SolutionIndex: 112
    SolutionNameMin: Cijk_Ailk_Bjlk_BSS_BH_MT64x128x16_MI32x32x8x1_SE_1LDSB0_AF0EM8_GRVW8_GSU1_NLCA1_NLCB1_SU0_SUS0_SRVW4_TT1_64_VAW2_WG64_4_1_WGM2
    SolutionIndex: 113
    SolutionNameMin: Cijk_Ailk_Bjlk_BSS_BH_MT64x128x16_MI32x32x8x1_SE_1LDSB0_AF0EM4_GRVW2_GSU1_NLCA1_NLCB1_SU0_SUS0_SRVW4_TT1_64_VAW2_WG64_4_1_WGM15
    SolutionIndex: 114
    SolutionNameMin: Cijk_Ailk_Bjlk_BSS_BH_MT64x64x32_MI32x32x8x1_SE_1LDSB0_AF0EM8_GRVW8_GSU1_NLCA1_NLCB1_SU0_SUS0_SRVW4_TT1_32_VAW2_WG64_4_1_WGM2
    SolutionIndex: 115
    SolutionNameMin: Cijk_Ailk_Bjlk_BSS_BH_MT64x16x32_MI16x16x16x1_SE_1LDSB0_AF0EM8_GRVW8_GSU1_NLCA1_NLCB1_SU0_SUS0_SRVW0_TT1_16_VAW2_WG64_4_1_WGM2
    SolutionIndex: 116
    SolutionNameMin: Cijk_Ailk_Bjlk_BSS_BH_MT256x144x32_MI16x16x16x1_SE_1LDSB0_AF0EM4_GRVW2_GSU1_NLCA2_NLCB9_SU0_SUS0_SRVW4_TT4_144_VAW2_WG64_4_1_WGM15
    SolutionIndex: 117
    SolutionNameMin: Cijk_Ailk_Bjlk_BSS_BH_MT128x96x16_MI32x32x8x1_SE_1LDSB0_AF0EM8_GRVW2_GSU1_NLCA1_NLCB3_SU0_SUS0_SRVW4_TT1_96_VAW2_WG128_2_1_WGM1
    SolutionIndex: 118
    SolutionNameMin: Cijk_Ailk_Bjlk_BSS_BH_MT64x64x64_MI32x32x8x1_SE_1LDSB0_AF0EM4_GRVW8_GSU1_NLCA1_NLCB1_SU0_SUS0_SRVW4_TT1_32_VAW2_WG64_4_1_WGM1
    SolutionIndex: 119
    SolutionNameMin: Cijk_Ailk_Bjlk_BSS_BH_MT64x16x32_MI16x16x16x1_SE_1LDSB0_AF0EM8_GRVW8_GSU15_NLCA1_NLCB1_SU0_SUS0_SRVW4_TT1_16_VAW1_WG64_4_1_WGM1
    SolutionIndex: 120
    SolutionNameMin: Cijk_Ailk_Bjlk_BSS_BH_MT16x16x64_MI16x16x16x1_SE_1LDSB0_AF0EM1_GRVW4_GSU7_NLCA1_NLCB1_SU0_SUS0_SRVW0_TT1_16_VAW1_WG16_4_1_WGM15
    SolutionIndex: 121
    SolutionNameMin: Cijk_Ailk_Bjlk_BSS_BH_MT32x32x64_MI16x16x16x1_SE_1LDSB0_AF0EM1_GRVW8_GSU1_NLCA1_NLCB1_SU0_SUS0_SRVW4_TT1_16_VAW2_WG32_8_1_WGM2
    SolutionIndex: 122
    SolutionNameMin: Cijk_Ailk_Bjlk_BSS_BH_MT64x256x16_MI32x32x8x1_SE_1LDSB0_AF0EM1_GRVW8_GSU1_NLCA1_NLCB1_SU0_SUS0_SRVW4_TT1_128_VAW2_WG64_4_1_WGM1
    SolutionIndex: 123
    SolutionNameMin: Cijk_Ailk_Bjlk_BSS_BH_MT64x128x16_MI32x32x8x1_SE_1LDSB0_AF0EM1_GRVW2_GSU1_NLCA1_NLCB1_SU0_SUS0_SRVW4_TT1_64_VAW2_WG64_4_1_WGM2
    SolutionIndex: 124
    SolutionNameMin: Cijk_Ailk_Bjlk_BSS_BH_MT64x64x32_MI32x32x8x1_SE_1LDSB0_AF0EM4_GRVW8_GSU1_NLCA1_NLCB1_SU16_SUS256_SRVW4_TT1_32_VAW2_WG64_4_1_WGM15
    SolutionIndex: 125
    SolutionNameMin: Cijk_Ailk_Bjlk_BSS_BH_MT32x32x64_MI16x16x16x1_SE_1LDSB0_AF0EM8_GRVW8_GSU1_NLCA1_NLCB1_SU0_SUS0_SRVW4_TT1_16_VAW2_WG32_8_1_WGM1
    SolutionIndex: 126
    SolutionNameMin: Cijk_Ailk_Bjlk_BSS_BH_MT64x64x64_MI32x32x8x1_SE_1LDSB0_AF0EM8_GRVW8_GSU1_NLCA1_NLCB1_SU0_SUS0_SRVW4_TT1_32_VAW2_WG64_4_1_WGM15
    SolutionIndex: 127
    SolutionNameMin: Cijk_Ailk_Bjlk_BSS_BH_MT32x32x128_MI16x16x16x1_SE_1LDSB0_AF0EM1_GRVW8_GSU1_NLCA1_NLCB1_SU0_SUS0_SRVW0_TT1_16_VAW2_WG32_8_1_WGM2
    SolutionIndex: 128
    SolutionNameMin: Cijk_Ailk_Bjlk_BSS_BH_MT64x32x128_MI16x16x16x1_SE_1LDSB0_AF0EM4_GRVW8_GSU1_NLCA1_NLCB1_SU0_SUS0_SRVW4_TT2_16_VAW2_WG32_8_1_WGM1
    SolutionIndex: 129
    SolutionNameMin: Cijk_Ailk_Bjlk_BSS_BH_MT32x64x128_MI16x16x16x1_SE_1LDSB0_AF0EM1_GRVW8_GSU1_NLCA1_NLCB1_SU16_SUS256_SRVW0_TT1_32_VAW2_WG32_8_1_WGM15
    SolutionIndex: 130
    SolutionNameMin: Cijk_Ailk_Bjlk_BSS_BH_MT32x32x128_MI16x16x16x1_SE_1LDSB0_AF0EM4_GRVW2_GSU1_NLCA1_NLCB1_SU16_SUS256_SRVW0_TT1_16_VAW2_WG32_8_1_WGM1
    SolutionIndex: 131
    SolutionNameMin: Cijk_Ailk_Bjlk_BSS_BH_MT64x64x128_MI32x32x8x1_SE_1LDSB0_AF0EM4_GRVW8_GSU1_NLCA1_NLCB1_SU32_SUS256_SRVW4_TT1_32_VAW2_WG64_4_1_WGM15
    SolutionIndex: 132
    SolutionNameMin: Cijk_Ailk_Bjlk_BSS_BH_MT64x128x64_MI32x32x8x1_SE_1LDSB0_AF0EM1_GRVW8_GSU1_NLCA1_NLCB1_SU16_SUS256_SRVW4_TT1_64_VAW2_WG64_4_1_WGM15
    SolutionIndex: 133
    SolutionNameMin: Cijk_Ailk_Bjlk_BSS_BH_MT32x32x64_MI16x16x16x1_SE_1LDSB0_AF0EM4_GRVW4_GSU1_NLCA1_NLCB1_SU32_SUS128_SRVW0_TT1_16_VAW2_WG32_8_1_WGM15
    SolutionIndex: 134
    SolutionNameMin: Cijk_Ailk_Bjlk_BSS_BH_MT64x64x64_MI32x32x8x1_SE_1LDSB0_AF0EM4_GRVW8_GSU1_NLCA1_NLCB1_SU16_SUS128_SRVW4_TT1_32_VAW2_WG64_4_1_WGM1
    SolutionIndex: 135
    SolutionNameMin: Cijk_Ailk_Bjlk_BSS_BH_MT32x32x128_MI16x16x16x1_SE_1LDSB0_AF0EM4_GRVW2_GSU1_NLCA1_NLCB1_SU32_SUS256_SRVW0_TT1_16_VAW2_WG32_8_1_WGM1
    SolutionIndex: 136
    SolutionNameMin: Cijk_Ailk_Bjlk_BSS_BH_MT64x32x64_MI16x16x16x1_SE_1LDSB0_AF0EM8_GRVW8_GSU5_NLCA1_NLCB1_SU32_SUS128_SRVW0_TT2_16_VAW1_WG32_8_1_WGM15
    SolutionIndex: 137
    SolutionNameMin: Cijk_Ailk_Bjlk_BSS_BH_MT64x128x64_MI32x32x8x1_SE_1LDSB0_AF0EM4_GRVW8_GSU1_NLCA1_NLCB1_SU32_SUS128_SRVW4_TT1_64_VAW2_WG64_4_1_WGM15
    SolutionIndex: 138
    SolutionNameMin: Cijk_Ailk_Bjlk_BSS_BH_MT64x64x64_MI32x32x8x1_SE_1LDSB0_AF0EM8_GRVW4_GSU7_NLCA1_NLCB1_SU0_SUS0_SRVW0_TT1_32_VAW1_WG64_4_1_WGM1
    SolutionIndex: 139
    SolutionNameMin: Cijk_Ailk_Bjlk_BSS_BH_MT64x256x16_MI32x32x8x1_SE_1LDSB0_AF0EM8_GRVW8_GSU1_NLCA1_NLCB1_SU0_SUS0_SRVW4_TT1_128_VAW2_WG64_4_1_WGM1
    SolutionIndex: 140
    SolutionNameMin: Cijk_Ailk_Bjlk_BSS_BH_MT64x128x32_MI32x32x8x1_SE_1LDSB0_AF0EM8_GRVW8_GSU1_NLCA1_NLCB1_SU32_SUS256_SRVW4_TT1_64_VAW2_WG64_4_1_WGM1
    SolutionIndex: 141
    SolutionNameMin: Cijk_Ailk_Bjlk_BSS_BH_MT64x128x16_MI32x32x8x1_SE_1LDSB0_AF0EM4_GRVW8_GSU1_NLCA1_NLCB1_SU0_SUS0_SRVW4_TT1_64_VAW2_WG64_4_1_WGM2
    SolutionIndex: 142
    SolutionNameMin: Cijk_Ailk_Bjlk_BSS_BH_MT64x128x16_MI32x32x8x1_SE_1LDSB0_AF0EM8_GRVW4_GSU1_NLCA1_NLCB1_SU0_SUS0_SRVW4_TT1_64_VAW2_WG64_4_1_WGM1
    SolutionIndex: 143
    SolutionNameMin: Cijk_Ailk_Bjlk_BSS_BH_MT128x96x16_MI32x32x8x1_SE_1LDSB0_AF0EM4_GRVW2_GSU1_NLCA1_NLCB3_SU32_SUS128_SRVW4_TT1_96_VAW2_WG128_2_1_WGM2
    SolutionIndex: 144
    SolutionNameMin: Cijk_Ailk_Bjlk_BSS_BH_MT128x96x64_MI32x32x8x1_SE_1LDSB0_AF0EM4_GRVW8_GSU1_NLCA1_NLCB3_SU0_SUS0_SRVW4_TT1_96_VAW2_WG128_2_1_WGM1
    SolutionIndex: 145
    SolutionNameMin: Cijk_Ailk_Bjlk_BSS_BH_MT64x64x32_MI32x32x8x1_SE_1LDSB0_AF0EM1_GRVW4_GSU1_NLCA1_NLCB1_SU16_SUS128_SRVW4_TT1_32_VAW2_WG64_4_1_WGM15
    SolutionIndex: 146
    SolutionNameMin: Cijk_Ailk_Bjlk_BSS_BH_MT128x96x32_MI32x32x8x1_SE_1LDSB0_AF0EM8_GRVW4_GSU1_NLCA1_NLCB3_SU0_SUS0_SRVW4_TT1_96_VAW2_WG128_2_1_WGM2
    SolutionIndex: 147
    SolutionNameMin: Cijk_Ailk_Bjlk_BSS_BH_MT128x96x32_MI32x32x8x1_SE_1LDSB0_AF0EM8_GRVW4_GSU1_NLCA1_NLCB3_SU0_SUS0_SRVW4_TT1_96_VAW2_WG128_2_1_WGM15
    SolutionIndex: 148
    SolutionNameMin: Cijk_Ailk_Bjlk_BSS_BH_MT128x256x32_MI32x32x8x1_SE_1LDSB0_AF0EM4_GRVW4_GSU1_NLCA1_NLCB1_SU16_SUS128_SRVW4_TT2_128_VAW2_WG64_4_1_WGM1
    SolutionIndex: 149
    SolutionNameMin: Cijk_Ailk_Bjlk_BSS_BH_MT128x256x32_MI32x32x8x1_SE_1LDSB0_AF0EM8_GRVW8_GSU1_NLCA1_NLCB1_SU32_SUS128_SRVW4_TT2_128_VAW2_WG64_4_1_WGM1
    SolutionIndex: 150
    SolutionNameMin: Cijk_Ailk_Bjlk_BSS_BH_MT128x128x64_MI32x32x8x1_SE_1LDSB0_AF0EM8_GRVW4_GSU1_NLCA1_NLCB1_SU32_SUS256_SRVW4_TT2_64_VAW2_WG64_4_1_WGM1
    SolutionIndex: 151
    SolutionNameMin: Cijk_Ailk_Bjlk_BSS_BH_MT256x128x32_MI32x32x8x1_SE_1LDSB0_AF0EM1_GRVW8_GSU1_NLCA1_NLCB1_SU0_SUS0_SRVW0_TT4_64_VAW2_WG64_4_1_WGM15
    SolutionIndex: 152
    SolutionNameMin: Cijk_Ailk_Bjlk_BSS_BH_MT128x160x32_MI32x32x8x1_SE_1LDSB0_AF0EM4_GRVW4_GSU1_NLCA1_NLCB5_SU16_SUS128_SRVW4_TT1_160_VAW2_WG128_2_1_WGM1
    SolutionIndex: 153
    SolutionNameMin: Cijk_Ailk_Bjlk_BSS_BH_MT32x32x32_MI16x16x16x1_SE_1LDSB0_AF0EM4_GRVW8_GSU1_NLCA1_NLCB1_SU0_SUS0_SRVW0_TT1_16_VAW2_WG32_8_1_WGM15
    SolutionIndex: 154
    SolutionNameMin: Cijk_Ailk_Bjlk_BSS_BH_MT64x32x16_MI16x16x16x1_SE_1LDSB1_AF0EM8_GRVW4_GSU1_NLCA1_NLCB1_SU0_SUS0_SRVW4_TT2_16_VAW2_WG32_8_1_WGM2
    SolutionIndex: 155
    SolutionNameMin: Cijk_Ailk_Bjlk_BSS_BH_MT16x16x16_MI16x16x16x1_SE_1LDSB0_AF0EM1_GRVW4_GSU1_NLCA1_NLCB1_SU0_SUS0_SRVW0_TT1_16_VAW2_WG16_4_1_WGM2
    SolutionIndex: 156
    SolutionNameMin: Cijk_Ailk_Bjlk_BSS_BH_MT32x32x16_MI16x16x16x1_SE_1LDSB0_AF0EM8_GRVW8_GSU1_NLCA1_NLCB1_SU0_SUS0_SRVW4_TT1_16_VAW2_WG32_8_1_WGM2
    SolutionIndex: 157
    SolutionNameMin: Cijk_Ailk_Bjlk_BSS_BH_MT64x32x16_MI16x16x16x1_SE_1LDSB0_AF0EM4_GRVW2_GSU1_NLCA1_NLCB1_SU16_SUS128_SRVW0_TT2_16_VAW2_WG32_8_1_WGM1
    SolutionIndex: 158
    SolutionNameMin: Cijk_Ailk_Bjlk_BSS_BH_MT64x32x16_MI16x16x16x1_SE_1LDSB0_AF0EM8_GRVW2_GSU1_NLCA1_NLCB1_SU0_SUS0_SRVW4_TT2_16_VAW2_WG32_8_1_WGM2
    SolutionIndex: 159
    SolutionNameMin: Cijk_Ailk_Bjlk_BSS_BH_MT128x96x64_MI32x32x8x1_SN_AMAS0_IU1_LBSPP256_LPA0_LPB0_NLCB3_PLR9_SPO0_SSO2_SVW1_TT1_96_VS0_VW1_WG128_2_1_WGM8
    SolutionIndex: 160
    SolutionNameMin: Cijk_Ailk_Bjlk_BSS_BH_MT128x128x32_MI32x32x8x1_SN_1LDSB1_AMAS3_EPS1_IU2_NEPBS4_NLCB1_PGR1_PLR1_SU0_SUS0_SPO1_SSO2_SVW2_TT2_64_VW2_WG64_4_1_WGM4
    SolutionIndex: 161
    SolutionNameMin: Cijk_Ailk_Bjlk_BSS_BH_MT128x128x32_MI32x32x8x1_SN_1LDSB1_AMAS0_EPS0_IU2_NEPBS4_NLCB1_PGR2_PLR1_SU32_SUS128_SPO0_SSO2_SVW1_TT2_64_VW1_WG64_4_1_WGM8
    SolutionIndex: 162
    SolutionNameMin: Cijk_Ailk_Bjlk_BSS_BH_MT128x128x32_MI32x32x8x1_SN_1LDSB1_AMAS3_EPS0_IU2_NEPBS2_NLCB1_PGR2_PLR1_SU0_SUS0_SPO0_SSO2_SVW2_TT2_64_VW2_WG64_4_1_WGM4
    SolutionIndex: 163
    SolutionNameMin: Cijk_Ailk_Bjlk_BSS_BH_MT128x128x32_MI32x32x8x1_SN_1LDSB1_AMAS0_EPS0_IU2_NEPBS4_NLCB1_PGR2_PLR1_SU32_SUS128_SPO0_SSO4_SVW1_TT2_64_VW1_WG64_4_1_WGM16
    SolutionIndex: 164
    SolutionNameMin: Cijk_Ailk_Bjlk_BSS_BH_MT128x128x32_MI32x32x8x1_SN_1LDSB1_AMAS3_EPS0_IU1_NEPBS2_NLCB1_PGR2_PLR5_SU0_SUS0_SPO1_SSO4_SVW2_TT2_64_VW2_WG64_4_1_WGM4
    SolutionIndex: 165
    SolutionNameMin: Cijk_Ailk_Bjlk_BSS_BH_MT128x128x32_MI32x32x8x1_SN_1LDSB1_AMAS0_EPS1_IU1_NEPBS4_NLCB1_PGR1_PLR5_SU32_SUS128_SPO0_SSO2_SVW1_TT2_64_VW1_WG64_4_1_WGM16
    SolutionIndex: 166
    SolutionNameMin: Cijk_Ailk_Bjlk_BSS_BH_MT128x128x32_MI32x32x8x1_SN_1LDSB1_AMAS0_EPS1_IU1_NEPBS4_NLCB1_PGR1_PLR5_SU0_SUS0_SPO1_SSO2_SVW1_TT2_64_VW1_WG64_4_1_WGM4
    SolutionIndex: 167
    SolutionNameMin: Cijk_Ailk_Bjlk_BSS_BH_MT128x128x32_MI32x32x8x1_SN_1LDSB1_AMAS0_EPS1_IU1_NEPBS4_NLCB1_PGR1_PLR5_SU32_SUS128_SPO1_SSO2_SVW1_TT2_64_VW1_WG64_4_1_WGM16
    SolutionIndex: 168
    SolutionNameMin: Cijk_Ailk_Bjlk_BSS_BH_MT128x128x32_MI32x32x8x1_SN_1LDSB1_AMAS0_EPS0_IU2_NEPBS2_NLCB1_PGR2_PLR1_SU0_SUS0_SPO0_SSO4_SVW1_TT2_64_VW1_WG64_4_1_WGM4
    SolutionIndex: 169
    SolutionNameMin: Cijk_Ailk_Bjlk_BSS_BH_MT128x128x32_MI32x32x8x1_SN_1LDSB1_AMAS3_EPS0_IU1_NEPBS2_NLCB1_PGR2_PLR5_SU32_SUS256_SPO1_SSO4_SVW2_TT2_64_VW2_WG64_4_1_WGM4
    SolutionIndex: 170
    SolutionNameMin: Cijk_Ailk_Bjlk_BSS_BH_MT128x128x32_MI32x32x8x1_SN_1LDSB1_AMAS0_EPS1_IU1_NEPBS4_NLCB1_PGR1_PLR5_SU32_SUS128_SPO1_SSO4_SVW1_TT2_64_VW1_WG64_4_1_WGM16
    SolutionIndex: 171
    SolutionNameMin: Cijk_Ailk_Bjlk_BSS_BH_MT128x128x32_MI32x32x8x1_SN_1LDSB1_AMAS3_EPS0_IU1_NEPBS1_NLCB1_PGR2_PLR5_SU0_SUS0_SPO1_SSO4_SVW2_TT2_64_VW2_WG64_4_1_WGM4
    SolutionIndex: 172
    SolutionNameMin: Cijk_Ailk_Bjlk_BSS_BH_MT128x128x32_MI32x32x8x1_SN_1LDSB1_AMAS0_EPS0_IU1_NEPBS4_NLCB1_PGR2_PLR5_SU32_SUS128_SPO1_SSO2_SVW1_TT2_64_VW1_WG64_4_1_WGM4
    SolutionIndex: 173
    SolutionNameMin: Cijk_Ailk_Bjlk_BSS_BH_MT128x96x64_MI32x32x8x1_SN_AMAS0_IU2_LBSPP0_NLCB3_PLR1_SPO0_SSO0_SVW1_TT1_96_VW1_WSGRA0_WG128_2_1_WGM8
    SolutionIndex: 174
    SolutionNameMin: Cijk_Ailk_Bjlk_BSS_BH_MT128x128x32_MI32x32x8x1_SN_AMAS3_IU1_LBSPP128_NLCB1_PLR1_SPO0_SSO4_SVW2_TT2_64_VW2_WSGRA1_WG64_4_1_WGM15
    SolutionIndex: 175
    SolutionNameMin: Cijk_Ailk_Bjlk_BSS_BH_MT128x128x32_MI32x32x8x1_SN_1LDSB1_AMAS0_EPS0_IU2_NEPBS4_NLCB1_PGR2_PLR1_SU32_SUS128_SPO0_SSO4_SVW1_TT2_64_VW1_WG64_4_1_WGM8
    SolutionIndex: 176
    SolutionNameMin: Cijk_Ailk_Bjlk_BSS_BH_MT128x128x32_MI32x32x8x1_SN_1LDSB1_AMAS3_EPS0_IU2_NEPBS1_NLCB1_PGR2_PLR1_SU0_SUS0_SPO0_SSO0_SVW2_TT2_64_VW2_WG64_4_1_WGM8
    SolutionIndex: 177
    SolutionNameMin: Cijk_Ailk_Bjlk_BSS_BH_MT128x128x32_MI32x32x8x1_SN_1LDSB0_AMAS3_EPS0_IU1_NEPBS1_NLCB1_PGR2_PLR1_SU32_SUS256_SPO1_SSO0_SVW2_TT2_64_VW2_WG64_4_1_WGM8
    SolutionIndex: 178
    SolutionNameMin: Cijk_Ailk_Bjlk_BSS_BH_MT128x128x32_MI32x32x8x1_SN_1LDSB1_AMAS0_EPS1_IU1_NEPBS4_NLCB1_PGR1_PLR5_SU32_SUS128_SPO0_SSO2_SVW1_TT2_64_VW1_WG64_4_1_WGM15
    SolutionIndex: 179
    SolutionNameMin: Cijk_Ailk_Bjlk_BSS_BH_MT128x128x32_MI32x32x8x1_SN_1LDSB1_AMAS0_EPS1_IU1_NEPBS4_NLCB1_PGR1_PLR5_SU32_SUS256_SPO0_SSO2_SVW1_TT2_64_VW1_WG64_4_1_WGM15
    SolutionIndex: 180
    SolutionNameMin: Cijk_Ailk_Bjlk_BSS_BH_MT128x128x32_MI32x32x8x1_SN_1LDSB1_AMAS0_EPS0_IU2_NEPBS1_NLCB1_PGR2_PLR1_SU0_SUS0_SPO0_SSO2_SVW1_TT2_64_VW1_WG64_4_1_WGM8
    SolutionIndex: 181
    SolutionNameMin: Cijk_Ailk_Bjlk_BSS_BH_MT128x128x32_MI32x32x8x1_SN_1LDSB1_AMAS0_EPS1_IU1_NEPBS4_NLCB1_PGR1_PLR5_SU32_SUS256_SPO1_SSO2_SVW1_TT2_64_VW1_WG64_4_1_WGM15
    SolutionIndex: 182
    SolutionNameMin: Cijk_Ailk_Bjlk_BSS_BH_MT128x128x32_MI32x32x8x1_SN_1LDSB0_AMAS3_EPS0_IU1_NEPBS2_NLCB1_PGR2_PLR1_SU0_SUS0_SPO1_SSO4_SVW2_TT2_64_VW2_WG64_4_1_WGM8
    SolutionIndex: 183
    SolutionNameMin: Cijk_Ailk_Bjlk_BSS_BH_MT128x128x32_MI32x32x8x1_SN_1LDSB1_AMAS0_EPS1_IU1_NEPBS4_NLCB1_PGR1_PLR5_SU32_SUS128_SPO1_SSO2_SVW1_TT2_64_VW1_WG64_4_1_WGM8
    SolutionIndex: 184
    SolutionNameMin: Cijk_Ailk_Bjlk_BSS_BH_MT128x128x32_MI32x32x8x1_SN_1LDSB0_AMAS3_EPS0_IU1_NEPBS2_NLCB1_PGR2_PLR1_SU0_SUS0_SPO1_SSO0_SVW2_TT2_64_VW2_WG64_4_1_WGM8
    SolutionIndex: 185
    SolutionNameMin: Cijk_Ailk_Bjlk_BSS_BH_MT128x128x32_MI32x32x8x1_SN_1LDSB0_AMAS0_EPS0_IU1_NEPBS4_NLCB1_PGR2_PLR5_SU0_SUS0_SPO1_SSO4_SVW1_TT2_64_VW1_WG64_4_1_WGM8
    SolutionIndex: 186
    SolutionNameMin: Cijk_Ailk_Bjlk_BSS_BH_MT128x128x32_MI32x32x8x1_SN_1LDSB0_AMAS0_EPS0_IU1_NEPBS2_NLCB1_PGR2_PLR1_SU0_SUS0_SPO0_SSO2_SVW1_TT2_64_VW1_WG64_4_1_WGM8
    SolutionIndex: 187
    SolutionNameMin: Cijk_Ailk_Bjlk_BSS_BH_MT128x128x32_MI32x32x8x1_SN_1LDSB1_AMAS0_EPS1_IU1_NEPBS1_NLCB1_PGR1_PLR5_SU32_SUS128_SPO1_SSO2_SVW1_TT2_64_VW1_WG64_4_1_WGM8
    SolutionIndex: 188
    SolutionNameMin: Cijk_Ailk_Bjlk_BSS_BH_MT128x128x32_MI32x32x8x1_SN_1LDSB0_AMAS0_EPS0_IU1_NEPBS4_NLCB1_PGR2_PLR5_SU0_SUS0_SPO1_SSO2_SVW1_TT2_64_VW1_WG64_4_1_WGM8
    SolutionIndex: 189
    SolutionNameMin: Cijk_Ailk_Bjlk_BSS_BH_MT128x128x32_MI32x32x8x1_SN_1LDSB0_AMAS0_EPS0_IU1_NEPBS4_NLCB1_PGR2_PLR1_SU0_SUS0_SPO1_SSO4_SVW1_TT2_64_VW1_WG64_4_1_WGM8
    SolutionIndex: 190
    SolutionNameMin: Cijk_Ailk_Bjlk_BSS_BH_MT128x128x32_MI32x32x8x1_SN_1LDSB1_AMAS0_EPS1_IU1_NEPBS2_NLCB1_PGR1_PLR5_SU32_SUS128_SPO1_SSO2_SVW1_TT2_64_VW1_WG64_4_1_WGM8
    SolutionIndex: 191
    SolutionNameMin: Cijk_Ailk_Bjlk_BSS_BH_MT128x128x32_MI32x32x8x1_SN_1LDSB0_AMAS0_EPS0_IU1_NEPBS2_NLCB1_PGR2_PLR1_SU0_SUS0_SPO1_SSO4_SVW1_TT2_64_VW1_WG64_4_1_WGM8
- - - [7680, 8192, 1, 8192]
    - [0, 78.071]
  - - [3840, 4096, 1, 4096]
    - [1, 69.36]
  - - [1920, 2048, 1, 2048]
    - [2, 51.318]
  - - [960, 1024, 1, 1024]
    - [3, 24.926]
  - - [480, 512, 1, 512]
    - [4, 6.719]
  - - [8192, 7680, 1, 8192]
    - [2, 79.33]
  - - [4096, 3840, 1, 4096]
    - [5, 69.148]
  - - [2048, 1920, 1, 2048]
    - [2, 53.942]
  - - [1024, 960, 1, 1024]
    - [3, 24.442]
  - - [512, 480, 1, 512]
    - [4, 6.687]
  - - [8192, 8192, 1, 8192]
    - [6, 78.668]
  - - [4096, 4096, 1, 4096]
    - [0, 70.353]
  - - [2048, 2048, 1, 2048]
    - [2, 54.157]
  - - [1024, 1024, 1, 1024]
    - [3, 26.185]
  - - [512, 512, 1, 512]
    - [4, 7.201]
  - - [64, 512, 16, 512]
    - [7, 13.265]
  - - [1024, 2, 1, 1]
    - [8, 0.0]
  - - [1024, 2, 1, 512]
    - [9, 0.062]
  - - [1024, 1024, 1, 1]
    - [10, 0.073]
  - - [1024, 1024, 1, 77]
    - [11, 4.865]
  - - [1024, 1024, 1, 512]
    - [3, 20.23]
  - - [1024, 4096, 1, 512]
    - [12, 31.545]
  - - [1024, 30522, 1, 77]
    - [13, 11.617]
  - - [4096, 1024, 1, 512]
    - [14, 30.821]
  - - [64, 128, 160, 128]
    - [3, 9.644]
  - - [1024, 2, 1, 10]
    - [15, 0.002]
  - - [1024, 2, 1, 1280]
    - [16, 0.116]
  - - [1024, 1024, 1, 10]
    - [11, 0.729]
  - - [1024, 1024, 1, 200]
    - [3, 10.012]
  - - [1024, 1024, 1, 1280]
    - [17, 28.16]
  - - [1024, 4096, 1, 1280]
    - [12, 45.139]
  - - [1024, 30522, 1, 200]
    - [18, 25.333]
  - - [4096, 1024, 1, 1280]
    - [19, 45.547]
  - - [64, 128, 624, 128]
    - [20, 12.821]
  - - [1024, 2, 1, 39]
    - [8, 0.008]
  - - [1024, 2, 1, 4992]
    - [21, 0.283]
  - - [1024, 1024, 1, 39]
    - [11, 2.648]
  - - [1024, 1024, 1, 780]
    - [3, 22.421]
  - - [1024, 1024, 1, 4992]
    - [17, 44.275]
  - - [1024, 4096, 1, 4992]
    - [22, 66.004]
  - - [1024, 30522, 1, 780]
    - [18, 46.458]
  - - [4096, 1024, 1, 4992]
    - [19, 66.152]
  - - [64, 512, 64, 512]
    - [23, 23.175]
  - - [1024, 2, 1, 4]
    - [24, 0.001]
  - - [1024, 2, 1, 2048]
    - [16, 0.147]
  - - [1024, 1024, 1, 4]
    - [11, 0.295]
  - - [1024, 1024, 1, 308]
    - [25, 13.628]
  - - [1024, 1024, 1, 2048]
    - [17, 34.465]
  - - [1024, 4096, 1, 2048]
    - [22, 53.736]
  - - [1024, 30522, 1, 308]
    - [26, 32.414]
  - - [4096, 1024, 1, 2048]
    - [19, 54.248]
  - - [64, 128, 640, 128]
    - [27, 13.104]
  - - [1024, 2, 1, 40]
    - [28, 0.008]
  - - [1024, 2, 1, 5120]
    - [29, 0.291]
  - - [1024, 1024, 1, 40]
    - [11, 2.764]
  - - [1024, 1024, 1, 800]
    - [3, 24.296]
  - - [1024, 1024, 1, 5120]
    - [17, 44.313]
  - - [1024, 4096, 1, 5120]
    - [2, 66.196]
  - - [1024, 30522, 1, 800]
    - [0, 49.903]
  - - [4096, 1024, 1, 5120]
    - [19, 66.469]
  - - [64, 128, 656, 128]
    - [20, 13.135]
  - - [1024, 2, 1, 41]
    - [28, 0.008]
  - - [1024, 2, 1, 5248]
    - [29, 0.298]
  - - [1024, 1024, 1, 41]
    - [11, 2.9]
  - - [1024, 1024, 1, 820]
    - [3, 22.902]
  - - [1024, 1024, 1, 5248]
    - [17, 44.927]
  - - [1024, 4096, 1, 5248]
    - [30, 66.469]
  - - [1024, 30522, 1, 820]
    - [26, 47.719]
  - - [4096, 1024, 1, 5248]
    - [31, 66.345]
  - - [64, 512, 80, 512]
    - [20, 27.051]
  - - [1024, 2, 1, 5]
    - [15, 0.001]
  - - [1024, 2, 1, 2560]
    - [32, 0.165]
  - - [1024, 1024, 1, 5]
    - [11, 0.376]
  - - [1024, 1024, 1, 385]
    - [3, 16.244]
  - - [1024, 1024, 1, 2560]
    - [17, 37.063]
  - - [1024, 4096, 1, 2560]
    - [22, 57.252]
  - - [1024, 30522, 1, 385]
    - [18, 35.676]
  - - [4096, 1024, 1, 2560]
    - [31, 57.47]
  - - [64, 512, 96, 512]
    - [33, 27.205]
  - - [1024, 2, 1, 6]
    - [24, 0.001]
  - - [1024, 2, 1, 3072]
    - [32, 0.181]
  - - [1024, 1024, 1, 6]
    - [11, 0.443]
  - - [1024, 1024, 1, 462]
    - [3, 17.778]
  - - [1024, 1024, 1, 3072]
    - [17, 39.707]
  - - [1024, 4096, 1, 3072]
    - [30, 60.236]
  - - [1024, 30522, 1, 462]
    - [26, 39.267]
  - - [4096, 1024, 1, 3072]
    - [31, 60.462]
  - - [64, 128, 128, 128]
    - [3, 8.001]
  - - [1024, 2, 1, 8]
    - [28, 0.002]
  - - [1024, 2, 1, 1024]
    - [16, 0.105]
  - - [1024, 1024, 1, 8]
    - [11, 0.583]
  - - [1024, 1024, 1, 160]
    - [3, 9.595]
  - - [1024, 4096, 1, 1024]
    - [12, 41.429]
  - - [1024, 30522, 1, 160]
    - [18, 22.581]
  - - [4096, 1024, 1, 1024]
    - [31, 40.835]
  - - [64, 128, 144, 128]
    - [3, 8.724]
  - - [1024, 2, 1, 9]
    - [15, 0.002]
  - - [1024, 2, 1, 1152]
    - [16, 0.111]
  - - [1024, 1024, 1, 9]
    - [11, 0.677]
  - - [1024, 1024, 1, 180]
    - [25, 8.897]
  - - [1024, 1024, 1, 1152]
    - [3, 27.165]
  - - [1024, 4096, 1, 1152]
    - [12, 43.481]
  - - [1024, 30522, 1, 180]
    - [26, 23.175]
  - - [4096, 1024, 1, 1152]
    - [34, 42.696]
  - - [13, 512, 1, 32768]
    - [35, 3.167]
  - - [256, 128, 1, 32768]
    - [36, 14.505]
  - - [256, 32768, 1, 1]
    - [10, 0.182]
  - - [479, 1024, 1, 32768]
    - [37, 29.212]
  - - [512, 256, 1, 32768]
    - [38, 30.453]
  - - [1024, 512, 1, 32768]
    - [39, 50.551]
  - - [1024, 1024, 1, 32768]
    - [40, 62.388]
  - - [64, 128, 512, 128]
    - [23, 12.097]
  - - [128, 64, 512, 128]
    - [3, 11.61]
  - - [1024, 2, 1, 32]
    - [8, 0.007]
  - - [1024, 1024, 1, 32]
    - [11, 2.439]
  - - [1024, 1024, 1, 4096]
    - [17, 42.484]
  - - [1024, 4096, 1, 4096]
    - [2, 64.177]
  - - [1024, 30528, 1, 4096]
    - [22, 73.445]
  - - [4096, 1024, 1, 4096]
    - [19, 64.177]
  - - [512, 64, 64, 512]
    - [41, 21.836]
  - - [1024, 30528, 1, 2048]
    - [0, 65.472]
  - - [4, 64, 32768, 4]
    - [42, 0.171]
  - - [4, 64, 38400, 4]
    - [42, 0.172]
  - - [64, 4, 32768, 4]
    - [28, 0.188]
  - - [64, 4, 38400, 4]
    - [28, 0.19]
  - - [1024, 1024, 1, 8192]
    - [40, 49.809]
  - - [1024, 1024, 1, 9600]
    - [43, 51.598]
  - - [1024, 4096, 1, 8192]
    - [22, 70.551]
  - - [1024, 4096, 1, 9600]
    - [22, 71.497]
  - - [1024, 33712, 1, 8192]
    - [0, 76.662]
  - - [1024, 33712, 1, 9600]
    - [0, 77.275]
  - - [4096, 1024, 1, 8192]
    - [19, 70.054]
  - - [4096, 1024, 1, 9600]
    - [19, 70.927]
  - - [1024, 1024, 1, 10064]
    - [17, 48.135]
  - - [1024, 1024, 1, 10080]
    - [17, 47.691]
  - - [1024, 1024, 1, 10200]
    - [17, 47.913]
  - - [1024, 1024, 1, 3840]
    - [17, 41.429]
  - - [1024, 1024, 1, 3968]
    - [17, 41.967]
  - - [1024, 1024, 1, 6528]
    - [17, 46.514]
  - - [1024, 1024, 1, 7104]
    - [44, 47.309]
  - - [1024, 1024, 1, 7200]
    - [45, 47.626]
  - - [1024, 1024, 1, 8064]
    - [40, 49.335]
  - - [1024, 1024, 1, 8160]
    - [44, 49.411]
  - - [1024, 1024, 1, 9216]
    - [44, 51.308]
  - - [1024, 1024, 1, 9520]
    - [17, 46.803]
  - - [1024, 4096, 1, 10064]
    - [2, 70.876]
  - - [1024, 4096, 1, 10080]
    - [2, 71.748]
  - - [1024, 4096, 1, 10200]
    - [22, 71.124]
  - - [1024, 4096, 1, 3840]
    - [30, 63.095]
  - - [1024, 4096, 1, 3968]
    - [2, 63.562]
  - - [1024, 4096, 1, 6528]
    - [22, 68.72]
  - - [1024, 4096, 1, 7104]
    - [2, 69.346]
  - - [1024, 4096, 1, 7200]
    - [2, 69.635]
  - - [1024, 4096, 1, 8064]
    - [2, 70.516]
  - - [1024, 4096, 1, 8160]
    - [30, 70.469]
  - - [1024, 4096, 1, 9216]
    - [2, 71.712]
  - - [1024, 4096, 1, 9520]
    - [2, 70.679]
  - - [1024, 42720, 1, 10080]
    - [2, 78.262]
  - - [1024, 42720, 1, 3968]
    - [2, 73.06]
  - - [1024, 42720, 1, 6528]
    - [2, 76.415]
  - - [1024, 42720, 1, 7104]
    - [2, 76.833]
  - - [1024, 42720, 1, 7200]
    - [2, 76.861]
  - - [1024, 42720, 1, 9520]
    - [2, 77.295]
  - - [4096, 1024, 1, 10064]
    - [34, 70.792]
  - - [4096, 1024, 1, 10080]
    - [31, 71.233]
  - - [4096, 1024, 1, 10200]
    - [31, 70.397]
  - - [4096, 1024, 1, 3840]
    - [34, 63.161]
  - - [4096, 1024, 1, 3968]
    - [31, 63.627]
  - - [4096, 1024, 1, 6528]
    - [19, 68.582]
  - - [4096, 1024, 1, 7104]
    - [31, 69.26]
  - - [4096, 1024, 1, 7200]
    - [31, 69.196]
  - - [4096, 1024, 1, 8064]
    - [31, 69.792]
  - - [4096, 1024, 1, 8160]
    - [19, 69.692]
  - - [4096, 1024, 1, 9216]
    - [31, 70.642]
  - - [4096, 1024, 1, 9520]
    - [34, 70.281]
  - - [14, 64, 10880, 14]
    - [46, 1.102]
  - - [15, 64, 10880, 14]
    - [47, 1.08]
  - - [15, 64, 7680, 15]
    - [46, 1.11]
  - - [15, 64, 10880, 15]
    - [46, 1.14]
  - - [17, 64, 7680, 15]
    - [48, 1.179]
  - - [17, 64, 6144, 17]
    - [46, 1.27]
  - - [17, 64, 7680, 17]
    - [46, 1.317]
  - - [21, 64, 6144, 17]
    - [46, 1.533]
  - - [21, 64, 6144, 21]
    - [48, 1.845]
  - - [24, 64, 4736, 24]
    - [49, 3.5]
  - - [30, 64, 2048, 30]
    - [48, 2.332]
  - - [30, 64, 2048, 31]
    - [50, 2.461]
  - - [31, 64, 2048, 31]
    - [50, 2.323]
  - - [32, 64, 4608, 32]
    - [51, 5.461]
  - - [32, 64, 4608, 35]
    - [52, 5.354]
  - - [34, 64, 4736, 24]
    - [51, 2.434]
  - - [34, 64, 4736, 34]
    - [51, 3.22]
  - - [35, 64, 4608, 35]
    - [51, 3.336]
  - - [64, 14, 10880, 14]
    - [53, 1.774]
  - - [64, 15, 10880, 14]
    - [53, 1.812]
  - - [64, 15, 7680, 15]
    - [53, 1.857]
  - - [64, 15, 10880, 15]
    - [53, 1.919]
  - - [64, 17, 7680, 15]
    - [53, 2.017]
  - - [64, 17, 6144, 17]
    - [53, 2.055]
  - - [64, 17, 7680, 17]
    - [53, 2.12]
  - - [64, 21, 6144, 17]
    - [53, 2.305]
  - - [64, 21, 6144, 21]
    - [53, 2.803]
  - - [64, 24, 4736, 24]
    - [54, 3.323]
  - - [64, 30, 2048, 30]
    - [55, 3.765]
  - - [64, 30, 2048, 31]
    - [55, 3.836]
  - - [64, 31, 2048, 31]
    - [54, 3.856]
  - - [64, 32, 4608, 32]
    - [11, 5.325]
  - - [64, 32, 4608, 35]
    - [54, 5.112]
  - - [64, 34, 4736, 24]
    - [42, 2.93]
  - - [64, 34, 4736, 34]
    - [42, 3.774]
  - - [64, 35, 4608, 35]
    - [42, 3.779]
  - - [512, 64, 1, 512]
    - [56, 1.074]
  - - [64, 512, 1, 512]
    - [57, 1.068]
  - - [64, 128, 1, 128]
    - [58, 0.098]
  - - [128, 64, 1, 128]
    - [57, 0.105]
  - - [74, 2048, 1, 512]
    - [59, 4.438]
  - - [2048, 2048, 1, 512]
    - [12, 31.627]
  - - [1024, 64, 1, 512]
    - [57, 2.124]
  - - [5, 64, 1, 5]
    - [60, 0.0]
  - - [2048, 512, 1, 1]
    - [10, 0.074]
  - - [1600, 1024, 1, 512]
    - [33, 27.474]
  - - [512, 32, 1, 1600]
    - [56, 0.938]
  - - [33, 32, 1, 33]
    - [61, 0.003]
  - - [560, 1024, 1, 1600]
    - [62, 22.769]
  - - [1024, 1600, 1, 1]
    - [63, 0.094]
  - - [1024, 1024, 1, 1600]
    - [17, 31.347]
  - - [512, 512, 1, 1600]
    - [62, 13.387]
  - - [3, 64, 512, 3]
    - [51, 0.021]
  - - [5, 64, 512, 5]
    - [47, 0.062]
  - - [5, 64, 960, 5]
    - [47, 0.088]
  - - [9, 64, 512, 9]
    - [51, 0.177]
  - - [27, 128, 32768, 27]
    - [64, 2.821]
  - - [33, 32, 200, 33]
    - [60, 0.573]
  - - [33, 32, 1600, 33]
    - [60, 1.848]
  - - [67, 2048, 1, 512]
    - [4, 4.018]
  - - [74, 2048, 1, 960]
    - [4, 6.256]
  - - [100, 2048, 1, 512]
    - [58, 5.419]
  - - [256, 1280, 1, 8976]
    - [65, 30.74]
  - - [256, 2560, 1, 8976]
    - [66, 42.566]
  - - [256, 2816, 1, 8976]
    - [66, 45.366]
  - - [256, 3328, 1, 8976]
    - [67, 47.839]
  - - [256, 3584, 1, 8976]
    - [40, 44.802]
  - - [256, 3840, 1, 8976]
    - [40, 47.43]
  - - [256, 4096, 1, 8976]
    - [40, 50.019]
  - - [256, 4352, 1, 8976]
    - [45, 52.065]
  - - [256, 4864, 1, 8976]
    - [68, 53.29]
  - - [256, 5120, 1, 8976]
    - [69, 56.429]
  - - [256, 5632, 1, 8976]
    - [70, 54.938]
  - - [256, 5888, 1, 8976]
    - [70, 57.07]
  - - [256, 6144, 1, 8976]
    - [70, 58.977]
  - - [256, 7168, 1, 8976]
    - [71, 49.592]
  - - [256, 8192, 1, 8976]
    - [72, 56.874]
  - - [256, 8960, 1, 8976]
    - [73, 53.057]
  - - [256, 9728, 1, 8976]
    - [73, 56.915]
  - - [256, 9984, 1, 8976]
    - [73, 58.019]
  - - [256, 10240, 1, 8976]
    - [74, 59.574]
  - - [256, 10496, 1, 8976]
    - [75, 60.817]
  - - [256, 11008, 1, 8976]
    - [76, 61.34]
  - - [256, 11264, 1, 8976]
    - [0, 62.672]
  - - [256, 11520, 1, 8976]
    - [0, 63.808]
  - - [256, 11776, 1, 8976]
    - [0, 64.976]
  - - [256, 12544, 1, 8976]
    - [0, 68.672]
  - - [256, 12800, 1, 8976]
    - [76, 69.734]
  - - [256, 13312, 1, 8976]
    - [0, 72.024]
  - - [256, 13568, 1, 8976]
    - [0, 73.149]
  - - [256, 14336, 1, 8976]
    - [77, 65.319]
  - - [256, 14848, 1, 8976]
    - [78, 67.843]
  - - [256, 15104, 1, 8976]
    - [77, 69.341]
  - - [256, 15872, 1, 8976]
    - [30, 68.622]
  - - [256, 16128, 1, 8976]
    - [2, 68.957]
  - - [256, 17152, 1, 8976]
    - [30, 73.348]
  - - [256, 17408, 1, 8976]
    - [2, 73.736]
  - - [256, 18688, 1, 8976]
    - [1, 65.522]
  - - [256, 19968, 1, 8976]
    - [5, 69.25]
  - - [256, 20480, 1, 8976]
    - [1, 70.6]
  - - [256, 20992, 1, 8976]
    - [5, 72.039]
  - - [256, 21248, 1, 8976]
    - [79, 61.182]
  - - [256, 22016, 1, 8976]
    - [79, 63.232]
  - - [256, 26112, 1, 8976]
    - [79, 73.051]
  - - [256, 32512, 1, 8976]
    - [22, 71.628]
  - - [256, 33536, 1, 8976]
    - [22, 73.291]
  - - [256, 44505, 1, 8976]
    - [5, 67.003]
  - - [257, 4096, 1, 1024]
    - [80, 23.673]
  - - [480, 1024, 1, 32768]
    - [39, 47.428]
  - - [512, 32, 1, 200]
    - [81, 0.253]
  - - [512, 512, 1, 200]
    - [58, 3.624]
  - - [512, 2048, 1, 256]
    - [3, 14.266]
  - - [560, 1024, 1, 200]
    - [3, 6.493]
  - - [768, 2048, 1, 256]
    - [33, 16.617]
  - - [1024, 64, 1, 960]
    - [56, 3.109]
  - - [1024, 256, 1, 1024]
    - [7, 10.687]
  - - [1024, 256, 1, 1280]
    - [7, 11.851]
  - - [1024, 256, 1, 2304]
    - [82, 15.361]
  - - [1024, 256, 1, 2816]
    - [82, 16.802]
  - - [1024, 256, 1, 3072]
    - [82, 17.448]
  - - [1024, 256, 1, 3328]
    - [82, 18.102]
  - - [1024, 256, 1, 3584]
    - [83, 18.636]
  - - [1024, 256, 1, 4096]
    - [84, 19.512]
  - - [1024, 256, 1, 4352]
    - [82, 19.744]
  - - [1024, 256, 1, 4608]
    - [83, 19.839]
  - - [1024, 256, 1, 5120]
    - [85, 21.12]
  - - [1024, 256, 1, 5376]
    - [86, 21.721]
  - - [1024, 256, 1, 5632]
    - [85, 22.478]
  - - [1024, 256, 1, 6144]
    - [85, 23.628]
  - - [1024, 256, 1, 6400]
    - [85, 24.548]
  - - [1024, 256, 1, 7680]
    - [85, 27.23]
  - - [1024, 256, 1, 7936]
    - [85, 27.87]
  - - [1024, 256, 1, 8192]
    - [85, 28.599]
  - - [1024, 256, 1, 8448]
    - [85, 28.812]
  - - [1024, 256, 1, 9728]
    - [85, 31.061]
  - - [1024, 256, 1, 9984]
    - [85, 31.236]
  - - [1024, 256, 1, 10496]
    - [85, 32.392]
  - - [1024, 256, 1, 11520]
    - [85, 33.956]
  - - [1024, 256, 1, 12032]
    - [85, 34.568]
  - - [1024, 256, 1, 13568]
    - [85, 36.696]
  - - [1024, 256, 1, 14336]
    - [85, 36.344]
  - - [1024, 256, 1, 14848]
    - [86, 37.513]
  - - [1024, 256, 1, 15104]
    - [86, 37.74]
  - - [1024, 256, 1, 15872]
    - [86, 38.019]
  - - [1024, 256, 1, 16128]
    - [85, 38.538]
  - - [1024, 256, 1, 17152]
    - [86, 38.938]
  - - [1024, 256, 1, 17408]
    - [85, 39.519]
  - - [1024, 256, 1, 18944]
    - [85, 40.81]
  - - [1024, 256, 1, 19712]
    - [85, 41.29]
  - - [1024, 256, 1, 19968]
    - [85, 40.983]
  - - [1024, 256, 1, 21248]
    - [86, 41.837]
  - - [1024, 256, 1, 21504]
    - [86, 42.597]
  - - [1024, 256, 1, 22016]
    - [86, 42.977]
  - - [1024, 256, 1, 28672]
    - [85, 45.948]
  - - [1024, 256, 1, 33536]
    - [85, 47.895]
  - - [1024, 1024, 1, 960]
    - [3, 25.544]
  - - [1600, 1024, 1, 960]
    - [33, 35.371]
  - - [2048, 256, 1, 1024]
    - [7, 18.385]
  - - [2048, 960, 1, 1]
    - [11, 0.104]
  - - [2048, 2048, 1, 960]
    - [12, 41.429]
  - - [2048, 2048, 1, 1024]
    - [160, 51.866]
  - - [3200, 2048, 1, 1024]
    - [0, 47.853]
  - - [4096, 4096, 1, 1024]
    - [161, 69.18]
  - - [2048, 2, 1, 2]
    - [24, 0.001]
  - - [2048, 2048, 1, 2]
    - [11, 0.296]
  - - [2048, 30592, 1, 1024]
    - [0, 57.724]
  - - [2048, 6144, 1, 1024]
    - [5, 51.333]
  - - [2048, 8192, 1, 1024]
    - [87, 52.355]
  - - [8192, 2048, 1, 1024]
    - [88, 52.583]
  - - [1024, 1024, 1, 16]
    - [11, 1.26]
  - - [1024, 2, 1, 16]
    - [28, 0.004]
  - - [1024, 30592, 1, 8192]
    - [22, 78.322]
  - - [1024, 3072, 1, 8192]
    - [0, 68.621]
  - - [512, 64, 256, 512]
    - [89, 27.541]
  - - [64, 512, 256, 512]
    - [90, 30.821]
  - - [1024, 30592, 1, 2048]
    - [0, 65.508]
  - - [1024, 3072, 1, 2048]
    - [0, 54.127]
  - - [1024, 30592, 1, 4096]
    - [22, 73.427]
  - - [1024, 3072, 1, 4096]
    - [0, 62.844]
  - - [512, 64, 128, 512]
    - [89, 25.255]
  - - [64, 512, 128, 512]
    - [14, 28.464]
  - - [2560, 1920, 1, 2048]
    - [1, 55.813]
  - - [2560, 2, 1, 4]
    - [24, 0.002]
  - - [2560, 2560, 1, 2048]
    - [0, 59.324]
  - - [2560, 2560, 1, 4]
    - [55, 0.662]
  - - [2560, 7680, 1, 2048]
    - [1, 63.967]
  - - [640, 2560, 1, 2048]
    - [70, 45.712]
  - - [512, 64, 40, 512]
    - [3, 22.37]
  - - [64, 512, 40, 512]
    - [3, 22.303]
  - - [1536, 1536, 1, 4096]
    - [73, 52.93]
  - - [1536, 4608, 1, 4096]
    - [0, 71.472]
  - - [1536, 50304, 1, 4096]
    - [0, 75.042]
  - - [1536, 6144, 1, 4096]
    - [0, 65.717]
  - - [6144, 1536, 1, 4096]
    - [6, 66.006]
  - - [1024, 96, 64, 1024]
    - [91, 43.725]
  - - [96, 1024, 64, 1024]
    - [92, 42.822]
  - - [1536, 1536, 1, 8192]
    - [17, 55.606]
  - - [1536, 4608, 1, 8192]
    - [0, 76.8]
  - - [1536, 50304, 1, 8192]
    - [0, 78.581]
  - - [1536, 6144, 1, 8192]
    - [0, 70.175]
  - - [6144, 1536, 1, 8192]
    - [0, 70.316]
  - - [1024, 96, 128, 1024]
    - [73, 46.203]
  - - [96, 1024, 128, 1024]
    - [93, 46.027]
  - - [1024, 1024, 1, 16384]
    - [94, 53.381]
  - - [1024, 3072, 1, 16384]
    - [0, 71.839]
  - - [1024, 4096, 1, 16384]
    - [22, 74.56]
  - - [1024, 50304, 1, 16384]
    - [87, 78.874]
  - - [4096, 1024, 1, 16384]
    - [31, 72.725]
  - - [1024, 64, 256, 1024]
    - [95, 39.868]
  - - [64, 1024, 256, 1024]
    - [96, 41.688]
  - - [1024, 50304, 1, 2048]
    - [6, 66.92]
  - - [1024, 64, 32, 1024]
    - [3, 28.498]
  - - [64, 1024, 32, 1024]
    - [97, 30.281]
  - - [1024, 50304, 1, 4096]
    - [6, 73.509]
  - - [1024, 64, 64, 1024]
    - [89, 34.441]
  - - [64, 1024, 64, 1024]
    - [98, 37.165]
  - - [1024, 50304, 1, 8192]
    - [6, 77.061]
  - - [1024, 64, 128, 1024]
    - [95, 37.599]
  - - [64, 1024, 128, 1024]
    - [90, 40.476]
  - - [1024, 2, 1, 64]
    - [99, 0.014]
  - - [1024, 30528, 1, 8192]
    - [22, 78.358]
  - - [1024, 1024, 1, 64]
    - [11, 4.528]
  - - [64, 128, 1024, 128]
    - [23, 13.323]
  - - [128, 64, 1024, 128]
    - [63, 12.801]
  - - [1024, 1024, 1, 3456]
    - [100, 40.707]
  - - [1024, 1024, 1, 6912]
    - [17, 46.876]
  - - [1024, 1024, 1, 864]
    - [3, 25.646]
  - - [1024, 512, 1, 3456]
    - [89, 27.439]
  - - [1024, 512, 1, 4096]
    - [89, 28.364]
  - - [1024, 512, 1, 6912]
    - [39, 36.716]
  - - [1024, 512, 1, 864]
    - [3, 15.8]
  - - [256, 128, 1, 3456]
    - [101, 3.031]
  - - [256, 128, 1, 4096]
    - [102, 3.533]
  - - [256, 128, 1, 55296]
    - [36, 17.97]
  - - [256, 128, 1, 6912]
    - [36, 5.488]
  - - [256, 128, 1, 864]
    - [81, 1.324]
  - - [256, 3456, 1, 1]
    - [63, 0.068]
  - - [256, 4096, 1, 1]
    - [53, 0.076]
  - - [256, 6912, 1, 1]
    - [11, 0.103]
  - - [256, 864, 1, 1]
    - [103, 0.021]
  - - [480, 1024, 1, 3456]
    - [89, 24.318]
  - - [480, 1024, 1, 4096]
    - [104, 27.263]
  - - [480, 1024, 1, 6912]
    - [39, 35.116]
  - - [480, 1024, 1, 864]
    - [3, 14.677]
  - - [512, 256, 1, 3456]
    - [105, 9.91]
  - - [512, 256, 1, 4096]
    - [106, 10.706]
  - - [512, 256, 1, 55296]
    - [38, 30.744]
  - - [512, 256, 1, 6912]
    - [106, 14.901]
  - - [512, 256, 1, 864]
    - [59, 5.104]
  - - [30528, 1024, 1, 640]
    - [107, 43.264]
  - - [30528, 1024, 1, 1280]
    - [76, 56.43]
  - - [4096, 1024, 1, 10240]
    - [31, 71.329]
  - - [1024, 4096, 1, 10240]
    - [2, 72.051]
  - - [30528, 1024, 1, 1600]
    - [0, 60.282]
  - - [1024, 2, 1, 80]
    - [28, 0.017]
  - - [1024, 1024, 1, 10240]
    - [17, 49.559]
  - - [1024, 1024, 1, 80]
    - [11, 5.495]
  - - [64, 128, 1280, 128]
    - [20, 13.574]
  - - [128, 64, 1280, 128]
    - [108, 12.991]
  - - [1024, 4096, 1, 10496]
    - [30, 72.071]
  - - [30528, 1024, 1, 1640]
    - [5, 57.634]
  - - [4096, 1024, 1, 10496]
    - [34, 71.572]
  - - [1024, 1024, 1, 10496]
    - [17, 49.421]
  - - [1024, 1024, 1, 82]
    - [11, 4.994]
  - - [1024, 2, 1, 82]
    - [24, 0.015]
  - - [128, 64, 1312, 128]
    - [3, 13.091]
  - - [64, 128, 1312, 128]
    - [20, 13.717]
  - - [30528, 1024, 1, 160]
    - [107, 19.122]
  - - [1024, 4096, 1, 6144]
    - [22, 67.979]
  - - [30528, 1024, 1, 240]
    - [109, 25.315]
  - - [4096, 1024, 1, 6144]
    - [31, 68.042]
  - - [1024, 1024, 1, 12]
    - [53, 0.881]
  - - [1024, 2, 1, 12]
    - [15, 0.003]
  - - [1024, 1024, 1, 6144]
    - [17, 46.056]
  - - [64, 512, 192, 512]
    - [90, 30.704]
  - - [512, 64, 192, 512]
    - [89, 27.725]
  - - [3136, 64, 64, 128]
    - [11, 14.563]
  - - [3136, 64, 64, 256]
    - [62, 20.412]
  - - [3136, 128, 64, 256]
    - [90, 24.609]
  - - [784, 256, 64, 512]
    - [5, 39.539]
  - - [3136, 256, 64, 128]
    - [3, 18.21]
  - - [3136, 256, 64, 256]
    - [107, 28.904]
  - - [784, 512, 64, 256]
    - [5, 31.055]
  - - [784, 512, 64, 512]
    - [5, 44.0]
  - - [3136, 64, 32, 128]
    - [10, 13.288]
  - - [3136, 64, 32, 256]
    - [3, 20.091]
  - - [3136, 128, 32, 256]
    - [33, 23.658]
  - - [784, 256, 32, 512]
    - [5, 34.083]
  - - [3136, 256, 32, 128]
    - [3, 17.65]
  - - [3136, 256, 32, 256]
    - [33, 26.779]
  - - [784, 512, 32, 256]
    - [1, 27.856]
  - - [784, 512, 32, 512]
    - [1, 40.292]
  - - [3136, 256, 32, 64]
    - [10, 11.491]
  - - [3136, 64, 32, 64]
    - [11, 9.063]
  - - [784, 512, 32, 128]
    - [110, 17.984]
  - - [784, 128, 32, 512]
    - [33, 29.877]
  - - [3136, 64, 64, 64]
    - [11, 10.002]
  - - [3136, 256, 64, 64]
    - [10, 11.878]
  - - [784, 128, 64, 512]
    - [33, 32.328]
  - - [784, 512, 64, 128]
    - [23, 19.918]
  - - [64, 1280, 64, 192]
    - [23, 18.411]
  - - [64, 1280, 64, 320]
    - [98, 24.806]
  - - [64, 1280, 64, 384]
    - [111, 27.1]
  - - [64, 1280, 64, 448]
    - [111, 29.502]
  - - [64, 2048, 64, 192]
    - [33, 18.961]
  - - [64, 2048, 64, 320]
    - [111, 25.415]
  - - [64, 2048, 64, 384]
    - [111, 27.831]
  - - [64, 2048, 64, 448]
    - [111, 30.222]
  - - [64, 1280, 32, 192]
    - [27, 16.248]
  - - [64, 1280, 32, 320]
    - [20, 22.774]
  - - [64, 1280, 32, 384]
    - [20, 24.602]
  - - [64, 1280, 32, 448]
    - [110, 26.73]
  - - [64, 2048, 32, 192]
    - [27, 17.023]
  - - [64, 2048, 32, 320]
    - [112, 23.016]
  - - [64, 2048, 32, 384]
    - [23, 24.995]
  - - [64, 2048, 32, 448]
    - [90, 26.832]
  - - [1024, 1024, 1, 10224]
    - [17, 47.59]
  - - [1024, 1024, 1, 10192]
    - [44, 48.259]
  - - [1024, 1024, 1, 10208]
    - [40, 48.549]
  - - [1024, 4096, 1, 10224]
    - [2, 71.018]
  - - [4096, 1024, 1, 10224]
    - [31, 70.686]
  - - [1024, 3072, 1, 10224]
    - [0, 68.641]
  - - [1024, 3072, 1, 10240]
    - [0, 69.833]
  - - [4096, 1024, 1, 10192]
    - [31, 70.817]
  - - [1024, 3072, 1, 10192]
    - [0, 68.751]
  - - [1024, 4096, 1, 10192]
    - [22, 71.194]
  - - [1024, 3072, 1, 10200]
    - [76, 68.583]
  - - [1024, 1024, 1, 10184]
    - [17, 48.357]
  - - [4096, 1024, 1, 10208]
    - [34, 70.97]
  - - [1024, 3072, 1, 10208]
    - [0, 69.776]
  - - [1024, 4096, 1, 10208]
    - [2, 71.912]
  - - [1024, 2048, 1, 10224]
    - [72, 55.971]
  - - [1024, 2048, 1, 10240]
    - [71, 57.524]
  - - [1024, 1024, 1, 10120]
    - [17, 48.344]
  - - [1024, 2048, 1, 10192]
    - [72, 56.41]
  - - [64, 24, 6816, 24]
    - [13, 3.495]
  - - [1024, 1024, 1, 10152]
    - [17, 47.536]
  - - [1024, 3072, 1, 10080]
    - [0, 69.707]
  - - [64, 26, 6272, 26]
    - [11, 3.846]
  - - [100352, 256, 1, 512]
    - [88, 36.34]
  - - [12544, 1024, 1, 2048]
    - [19, 59.924]
  - - [12544, 147, 1, 64]
    - [53, 5.806]
  - - [200704, 256, 1, 512]
    - [87, 34.803]
  - - [25088, 512, 1, 1024]
    - [6, 48.492]
  - - [3136, 576, 1, 64]
    - [3, 6.115]
  - - [50176, 512, 1, 1024]
    - [1, 51.172]
  - - [6272, 1024, 1, 2048]
    - [0, 58.183]
  - - [784, 1152, 1, 128]
    - [3, 7.443]
  - - [3136, 256, 128, 128]
    - [107, 18.634]
  - - [3136, 256, 256, 128]
    - [3, 18.643]
  - - [3136, 256, 128, 64]
    - [11, 12.069]
  - - [3136, 256, 256, 64]
    - [11, 12.171]
  - - [3136, 64, 128, 256]
    - [7, 20.878]
  - - [3136, 64, 256, 256]
    - [7, 20.875]
  - - [3136, 64, 128, 64]
    - [13, 10.513]
  - - [3136, 64, 256, 64]
    - [55, 10.795]
  - - [784, 128, 128, 512]
    - [5, 35.795]
  - - [784, 128, 256, 512]
    - [1, 37.795]
  - - [784, 512, 128, 128]
    - [112, 20.738]
  - - [784, 512, 256, 128]
    - [110, 21.186]
  - - [784, 512, 128, 256]
    - [5, 32.924]
  - - [784, 512, 256, 256]
    - [5, 33.888]
  - - [64, 128, 2048, 128]
    - [113, 14.157]
  - - [128, 64, 2048, 128]
    - [3, 13.479]
  - - [30528, 1024, 1, 2560]
    - [76, 66.856]
  - - [1024, 1024, 1, 128]
    - [3, 8.001]
  - - [1024, 2, 1, 128]
    - [28, 0.023]
  - - [128, 64, 1536, 128]
    - [114, 13.255]
  - - [64, 128, 1536, 128]
    - [20, 13.778]
  - - [1024, 4096, 1, 12288]
    - [22, 72.921]
  - - [30528, 1024, 1, 1920]
    - [0, 63.057]
  - - [1024, 1024, 1, 96]
    - [3, 6.336]
  - - [1024, 1024, 1, 12288]
    - [40, 51.351]
  - - [4096, 1024, 1, 12288]
    - [31, 72.196]
  - - [1024, 2, 1, 96]
    - [115, 0.019]
  - - [25600, 128, 25, 128]
    - [116, 16.786]
  - - [12544, 128, 36, 128]
    - [116, 16.189]
  - - [9216, 128, 49, 128]
    - [13, 16.507]
  - - [6400, 128, 64, 128]
    - [11, 16.415]
  - - [6400, 256, 25, 256]
    - [117, 28.405]
  - - [4096, 256, 36, 256]
    - [0, 29.01]
  - - [2304, 256, 49, 256]
    - [117, 28.029]
  - - [2304, 256, 64, 256]
    - [117, 28.765]
  - - [2304, 512, 25, 512]
    - [117, 40.265]
  - - [1024, 512, 36, 512]
    - [111, 38.926]
  - - [1024, 512, 49, 512]
    - [117, 40.009]
  - - [1024, 512, 64, 512]
    - [117, 41.2]
  - - [92416, 64, 25, 64]
    - [108, 8.241]
  - - [50176, 64, 36, 64]
    - [108, 8.608]
  - - [36864, 64, 49, 64]
    - [108, 8.58]
  - - [25600, 64, 64, 64]
    - [108, 8.889]
  - - [64, 128, 192, 128]
    - [33, 9.531]
  - - [128, 64, 192, 128]
    - [3, 9.146]
  - - [768, 2, 1, 2048]
    - [16, 0.106]
  - - [3072, 768, 1, 2048]
    - [73, 47.795]
  - - [768, 3072, 1, 2048]
    - [73, 47.544]
  - - [768, 768, 1, 2048]
    - [118, 25.678]
  - - [64, 384, 144, 384]
    - [111, 25.603]
  - - [384, 64, 144, 384]
    - [95, 23.483]
  - - [768, 2, 1, 4608]
    - [119, 0.21]
  - - [3072, 768, 1, 4608]
    - [73, 53.746]
  - - [768, 3072, 1, 4608]
    - [73, 53.464]
  - - [768, 768, 1, 4608]
    - [39, 33.212]
  - - [64, 512, 48, 512]
    - [33, 24.79]
  - - [512, 64, 48, 512]
    - [62, 19.985]
  - - [64, 128, 256, 128]
    - [23, 10.287]
  - - [128, 64, 256, 128]
    - [3, 10.393]
  - - [64, 384, 192, 384]
    - [111, 25.018]
  - - [384, 64, 192, 384]
    - [95, 22.458]
  - - [1024, 2, 1, 4608]
    - [119, 0.266]
  - - [4096, 1024, 1, 4608]
    - [31, 65.47]
  - - [1024, 4096, 1, 4608]
    - [22, 64.788]
  - - [1024, 1024, 1, 4608]
    - [68, 43.308]
  - - [13, 512, 1, 3456]
    - [120, 0.65]
  - - [13, 512, 1, 4096]
    - [120, 0.817]
  - - [13, 512, 1, 55296]
    - [35, 3.753]
  - - [13, 512, 1, 6912]
    - [35, 1.22]
  - - [13, 512, 1, 864]
    - [121, 0.27]
  - - [196, 512, 64, 1024]
    - [5, 40.379]
  - - [196, 1024, 64, 512]
    - [1, 34.951]
  - - [196, 1024, 64, 1024]
    - [1, 44.422]
  - - [49, 1024, 64, 2048]
    - [111, 29.485]
  - - [49, 2048, 64, 1024]
    - [122, 26.247]
  - - [196, 512, 32, 1024]
    - [1, 33.02]
  - - [196, 1024, 32, 512]
    - [1, 31.317]
  - - [196, 1024, 32, 1024]
    - [5, 40.757]
  - - [49, 1024, 32, 2048]
    - [97, 24.31]
  - - [49, 2048, 32, 1024]
    - [111, 23.948]
  - - [196, 1024, 32, 256]
    - [91, 21.515]
  - - [196, 256, 32, 1024]
    - [91, 28.542]
  - - [49, 2048, 32, 512]
    - [97, 17.676]
  - - [49, 512, 32, 2048]
    - [111, 18.999]
  - - [196, 256, 64, 1024]
    - [5, 32.104]
  - - [196, 1024, 64, 256]
    - [74, 24.183]
  - - [49, 512, 64, 2048]
    - [97, 23.917]
  - - [49, 2048, 64, 512]
    - [122, 19.366]
  - - [1225, 192, 64, 32]
    - [80, 5.689]
  - - [1225, 192, 64, 48]
    - [108, 7.608]
  - - [1225, 192, 64, 64]
    - [80, 9.761]
  - - [1225, 256, 64, 48]
    - [108, 7.775]
  - - [1225, 256, 64, 64]
    - [80, 10.127]
  - - [1225, 288, 64, 48]
    - [108, 7.908]
  - - [1225, 288, 64, 64]
    - [108, 9.527]
  - - [5329, 64, 64, 80]
    - [108, 10.526]
  - - [289, 768, 64, 128]
    - [111, 14.748]
  - - [289, 768, 64, 160]
    - [123, 17.186]
  - - [289, 768, 64, 192]
    - [97, 19.374]
  - - [1225, 192, 32, 32]
    - [108, 4.863]
  - - [1225, 192, 32, 48]
    - [108, 6.795]
  - - [1225, 192, 32, 64]
    - [80, 8.669]
  - - [1225, 256, 32, 48]
    - [108, 7.226]
  - - [1225, 256, 32, 64]
    - [80, 9.194]
  - - [1225, 288, 32, 48]
    - [108, 7.183]
  - - [1225, 288, 32, 64]
    - [108, 8.985]
  - - [5329, 64, 32, 80]
    - [108, 10.007]
  - - [289, 768, 32, 128]
    - [80, 12.965]
  - - [289, 768, 32, 160]
    - [97, 15.278]
  - - [289, 768, 32, 192]
    - [97, 17.052]
  - - [196, 2304, 1, 256]
    - [124, 6.645]
  - - [49, 4608, 1, 512]
    - [4, 5.894]
  - - [196, 1024, 128, 256]
    - [18, 26.444]
  - - [196, 1024, 256, 256]
    - [18, 27.804]
  - - [196, 1024, 128, 512]
    - [1, 37.862]
  - - [196, 1024, 256, 512]
    - [1, 39.418]
  - - [196, 256, 128, 1024]
    - [1, 39.413]
  - - [196, 256, 256, 1024]
    - [1, 42.781]
  - - [49, 2048, 128, 512]
    - [122, 20.52]
  - - [49, 2048, 256, 512]
    - [122, 21.87]
  - - [49, 512, 128, 2048]
    - [111, 28.731]
  - - [49, 512, 256, 2048]
    - [111, 31.33]
  - - [64, 64, 1, 256]
    - [57, 0.083]
  - - [128, 128, 1, 256]
    - [56, 0.35]
  - - [64, 256, 1, 256]
    - [81, 0.34]
  - - [128, 256, 1, 256]
    - [56, 0.68]
  - - [64, 448, 1, 256]
    - [57, 0.574]
  - - [128, 448, 1, 256]
    - [57, 1.149]
  - - [64, 704, 1, 256]
    - [125, 0.922]
  - - [128, 704, 1, 256]
    - [56, 1.78]
  - - [64, 1024, 1, 256]
    - [81, 1.341]
  - - [128, 1024, 1, 256]
    - [4, 2.487]
  - - [64, 1408, 1, 256]
    - [81, 1.768]
  - - [128, 1408, 1, 256]
    - [81, 3.512]
  - - [64, 1856, 1, 256]
    - [125, 2.269]
  - - [128, 1856, 1, 256]
    - [57, 4.337]
  - - [64, 2368, 1, 256]
    - [125, 2.857]
  - - [128, 2368, 1, 256]
    - [4, 5.43]
  - - [64, 2944, 1, 256]
    - [125, 3.552]
  - - [128, 2944, 1, 256]
    - [58, 6.106]
  - - [64, 3584, 1, 256]
    - [81, 4.324]
  - - [128, 3584, 1, 256]
    - [3, 7.351]
  - - [64, 4288, 1, 256]
    - [4, 4.978]
  - - [128, 4288, 1, 256]
    - [3, 8.332]
  - - [64, 5056, 1, 256]
    - [4, 5.691]
  - - [128, 5056, 1, 256]
    - [126, 9.929]
  - - [64, 5888, 1, 256]
    - [3, 6.246]
  - - [128, 5888, 1, 256]
    - [3, 11.322]
  - - [64, 6784, 1, 256]
    - [3, 6.843]
  - - [128, 6784, 1, 256]
    - [3, 12.844]
  - - [64, 64, 1, 1280]
    - [127, 0.254]
  - - [128, 128, 1, 1280]
    - [127, 0.941]
  - - [64, 256, 1, 1280]
    - [127, 0.972]
  - - [128, 256, 1, 1280]
    - [127, 1.868]
  - - [64, 448, 1, 1280]
    - [127, 1.798]
  - - [128, 448, 1, 1280]
    - [127, 3.23]
  - - [64, 704, 1, 1280]
    - [127, 2.73]
  - - [128, 704, 1, 1280]
    - [127, 4.904]
  - - [64, 1024, 1, 1280]
    - [127, 3.736]
  - - [128, 1024, 1, 1280]
    - [59, 6.386]
  - - [64, 1408, 1, 1280]
    - [127, 4.998]
  - - [128, 1408, 1, 1280]
    - [105, 8.663]
  - - [64, 1856, 1, 1280]
    - [128, 5.887]
  - - [128, 1856, 1, 1280]
    - [7, 10.382]
  - - [64, 2368, 1, 1280]
    - [129, 7.409]
  - - [128, 2368, 1, 1280]
    - [62, 13.048]
  - - [64, 2944, 1, 1280]
    - [128, 9.211]
  - - [128, 2944, 1, 1280]
    - [62, 16.271]
  - - [64, 3584, 1, 1280]
    - [7, 10.241]
  - - [128, 3584, 1, 1280]
    - [62, 17.832]
  - - [64, 4288, 1, 1280]
    - [7, 12.253]
  - - [128, 4288, 1, 1280]
    - [7, 20.995]
  - - [64, 5056, 1, 1280]
    - [7, 14.674]
  - - [128, 5056, 1, 1280]
    - [7, 24.56]
  - - [64, 5888, 1, 1280]
    - [62, 15.89]
  - - [128, 5888, 1, 1280]
    - [7, 28.157]
  - - [64, 6784, 1, 1280]
    - [7, 17.737]
  - - [128, 6784, 1, 1280]
    - [7, 32.028]
  - - [64, 64, 1, 3328]
    - [101, 0.425]
  - - [128, 128, 1, 3328]
    - [101, 1.674]
  - - [64, 256, 1, 3328]
    - [32, 1.621]
  - - [128, 256, 1, 3328]
    - [102, 2.932]
  - - [64, 448, 1, 3328]
    - [127, 2.715]
  - - [128, 448, 1, 3328]
    - [106, 4.876]
  - - [64, 704, 1, 3328]
    - [127, 4.31]
  - - [128, 704, 1, 3328]
    - [130, 7.25]
  - - [64, 1024, 1, 3328]
    - [127, 5.522]
  - - [128, 1024, 1, 3328]
    - [105, 9.469]
  - - [64, 1408, 1, 3328]
    - [130, 7.492]
  - - [128, 1408, 1, 3328]
    - [129, 13.071]
  - - [64, 1856, 1, 3328]
    - [106, 9.034]
  - - [128, 1856, 1, 3328]
    - [131, 15.992]
  - - [64, 2368, 1, 3328]
    - [128, 11.365]
  - - [128, 2368, 1, 3328]
    - [83, 19.799]
  - - [64, 2944, 1, 3328]
    - [129, 13.771]
  - - [128, 2944, 1, 3328]
    - [83, 24.658]
  - - [64, 3584, 1, 3328]
    - [84, 15.468]
  - - [128, 3584, 1, 3328]
    - [132, 22.874]
  - - [64, 4288, 1, 3328]
    - [84, 18.811]
  - - [128, 4288, 1, 3328]
    - [89, 26.901]
  - - [64, 5056, 1, 3328]
    - [84, 21.9]
  - - [128, 5056, 1, 3328]
    - [89, 31.845]
  - - [64, 5888, 1, 3328]
    - [131, 24.111]
  - - [128, 5888, 1, 3328]
    - [132, 35.998]
  - - [64, 6784, 1, 3328]
    - [82, 28.312]
  - - [128, 6784, 1, 3328]
    - [89, 41.11]
  - - [256, 64, 1, 256]
    - [81, 0.328]
  - - [448, 64, 1, 256]
    - [81, 0.591]
  - - [704, 64, 1, 256]
    - [56, 0.89]
  - - [1408, 64, 1, 256]
    - [57, 1.768]
  - - [1856, 64, 1, 256]
    - [125, 2.239]
  - - [2368, 64, 1, 256]
    - [133, 2.857]
  - - [2944, 64, 1, 256]
    - [125, 3.575]
  - - [3584, 64, 1, 256]
    - [133, 4.135]
  - - [4288, 64, 1, 256]
    - [4, 4.978]
  - - [5056, 64, 1, 256]
    - [4, 5.691]
  - - [5888, 64, 1, 256]
    - [58, 6.175]
  - - [6784, 64, 1, 256]
    - [58, 6.806]
  - - [448, 128, 1, 256]
    - [56, 1.141]
  - - [704, 128, 1, 256]
    - [57, 1.78]
  - - [1024, 128, 1, 256]
    - [57, 2.504]
  - - [1408, 128, 1, 256]
    - [57, 3.42]
  - - [1856, 128, 1, 256]
    - [125, 4.337]
  - - [2368, 128, 1, 256]
    - [58, 5.498]
  - - [2944, 128, 1, 256]
    - [58, 6.211]
  - - [3584, 128, 1, 256]
    - [81, 6.891]
  - - [4288, 128, 1, 256]
    - [3, 8.036]
  - - [5056, 128, 1, 256]
    - [3, 9.427]
  - - [5888, 128, 1, 256]
    - [3, 10.979]
  - - [6784, 128, 1, 256]
    - [3, 12.399]
  - - [256, 64, 1, 1280]
    - [127, 0.96]
  - - [448, 64, 1, 1280]
    - [127, 1.674]
  - - [704, 64, 1, 1280]
    - [127, 2.696]
  - - [1408, 64, 1, 1280]
    - [16, 4.795]
  - - [1856, 64, 1, 1280]
    - [128, 5.99]
  - - [2368, 64, 1, 1280]
    - [128, 7.511]
  - - [2944, 64, 1, 1280]
    - [128, 9.337]
  - - [3584, 64, 1, 1280]
    - [134, 9.845]
  - - [4288, 64, 1, 1280]
    - [62, 12.253]
  - - [5056, 64, 1, 1280]
    - [62, 14.098]
  - - [5888, 64, 1, 1280]
    - [134, 15.89]
  - - [6784, 64, 1, 1280]
    - [134, 18.308]
  - - [448, 128, 1, 1280]
    - [127, 3.282]
  - - [704, 128, 1, 1280]
    - [135, 4.813]
  - - [1024, 128, 1, 1280]
    - [57, 6.429]
  - - [1408, 128, 1, 1280]
    - [128, 8.781]
  - - [1856, 128, 1, 1280]
    - [62, 10.542]
  - - [2368, 128, 1, 1280]
    - [62, 13.367]
  - - [2944, 128, 1, 1280]
    - [126, 16.619]
  - - [3584, 128, 1, 1280]
    - [7, 17.642]
  - - [4288, 128, 1, 1280]
    - [118, 20.348]
  - - [5056, 128, 1, 1280]
    - [7, 23.688]
  - - [5888, 128, 1, 1280]
    - [7, 27.516]
  - - [6784, 128, 1, 1280]
    - [7, 30.997]
  - - [256, 64, 1, 3328]
    - [32, 1.638]
  - - [448, 64, 1, 3328]
    - [32, 2.757]
  - - [704, 64, 1, 3328]
    - [130, 4.071]
  - - [1408, 64, 1, 3328]
    - [136, 7.25]
  - - [1856, 64, 1, 3328]
    - [106, 9.127]
  - - [2368, 64, 1, 3328]
    - [128, 11.099]
  - - [2944, 64, 1, 3328]
    - [128, 13.38]
  - - [3584, 64, 1, 3328]
    - [84, 15.195]
  - - [4288, 64, 1, 3328]
    - [82, 18.743]
  - - [5056, 64, 1, 3328]
    - [84, 21.704]
  - - [5888, 64, 1, 3328]
    - [84, 23.628]
  - - [6784, 64, 1, 3328]
    - [84, 25.84]
  - - [448, 128, 1, 3328]
    - [130, 5.0]
  - - [704, 128, 1, 3328]
    - [130, 7.714]
  - - [1024, 128, 1, 3328]
    - [105, 9.636]
  - - [1408, 128, 1, 3328]
    - [129, 12.798]
  - - [1856, 128, 1, 3328]
    - [83, 16.588]
  - - [2368, 128, 1, 3328]
    - [82, 20.589]
  - - [2944, 128, 1, 3328]
    - [84, 24.573]
  - - [3584, 128, 1, 3328]
    - [132, 22.456]
  - - [4288, 128, 1, 3328]
    - [132, 27.043]
  - - [5056, 128, 1, 3328]
    - [137, 31.27]
  - - [5888, 128, 1, 3328]
    - [89, 36.369]
  - - [6784, 128, 1, 3328]
    - [89, 41.636]
  - - [256, 256, 1, 256]
    - [81, 1.38]
  - - [448, 256, 1, 256]
    - [125, 2.176]
  - - [256, 448, 1, 256]
    - [81, 2.176]
  - - [448, 448, 1, 256]
    - [125, 3.711]
  - - [256, 256, 1, 1280]
    - [127, 3.736]
  - - [448, 256, 1, 1280]
    - [128, 5.684]
  - - [256, 448, 1, 1280]
    - [128, 5.723]
  - - [448, 448, 1, 1280]
    - [128, 10.05]
  - - [256, 256, 1, 3328]
    - [138, 5.365]
  - - [448, 256, 1, 3328]
    - [106, 8.959]
  - - [256, 448, 1, 3328]
    - [106, 8.94]
  - - [448, 448, 1, 3328]
    - [128, 14.843]
  - - [512, 16, 1, 512]
    - [56, 0.273]
  - - [1024, 16, 1, 512]
    - [57, 0.543]
  - - [1024, 32, 1, 512]
    - [133, 1.074]
  - - [704, 256, 1, 256]
    - [81, 3.465]
  - - [1408, 256, 1, 256]
    - [3, 5.907]
  - - [1856, 256, 1, 256]
    - [3, 7.175]
  - - [2368, 256, 1, 256]
    - [3, 8.966]
  - - [2944, 256, 1, 256]
    - [114, 11.263]
  - - [3584, 256, 1, 256]
    - [3, 12.483]
  - - [4288, 256, 1, 256]
    - [3, 14.135]
  - - [5056, 256, 1, 256]
    - [114, 15.752]
  - - [5888, 256, 1, 256]
    - [14, 16.916]
  - - [6784, 256, 1, 256]
    - [33, 18.902]
  - - [704, 448, 1, 256]
    - [4, 5.547]
  - - [1024, 448, 1, 256]
    - [3, 7.114]
  - - [1408, 448, 1, 256]
    - [3, 9.282]
  - - [1856, 448, 1, 256]
    - [3, 11.991]
  - - [2368, 448, 1, 256]
    - [3, 13.782]
  - - [2944, 448, 1, 256]
    - [3, 16.188]
  - - [3584, 448, 1, 256]
    - [62, 14.939]
  - - [4288, 448, 1, 256]
    - [73, 17.207]
  - - [5056, 448, 1, 256]
    - [73, 18.773]
  - - [5888, 448, 1, 256]
    - [3, 19.761]
  - - [6784, 448, 1, 256]
    - [139, 19.877]
  - - [256, 704, 1, 256]
    - [57, 3.398]
  - - [448, 704, 1, 256]
    - [4, 5.721]
  - - [704, 704, 1, 256]
    - [3, 7.769]
  - - [1024, 704, 1, 256]
    - [3, 11.119]
  - - [1408, 704, 1, 256]
    - [3, 13.55]
  - - [1856, 704, 1, 256]
    - [25, 16.105]
  - - [2368, 704, 1, 256]
    - [23, 15.765]
  - - [2944, 704, 1, 256]
    - [73, 17.53]
  - - [3584, 704, 1, 256]
    - [3, 19.563]
  - - [4288, 704, 1, 256]
    - [139, 19.61]
  - - [5056, 704, 1, 256]
    - [3, 21.344]
  - - [5888, 704, 1, 256]
    - [114, 20.437]
  - - [6784, 704, 1, 256]
    - [73, 22.545]
  - - [256, 1024, 1, 256]
    - [58, 4.847]
  - - [448, 1024, 1, 256]
    - [3, 6.964]
  - - [704, 1024, 1, 256]
    - [3, 10.663]
  - - [1408, 1024, 1, 256]
    - [140, 15.288]
  - - [1856, 1024, 1, 256]
    - [41, 16.611]
  - - [2368, 1024, 1, 256]
    - [91, 19.32]
  - - [2944, 1024, 1, 256]
    - [139, 19.806]
  - - [3584, 1024, 1, 256]
    - [3, 21.213]
  - - [4288, 1024, 1, 256]
    - [3, 21.873]
  - - [5056, 1024, 1, 256]
    - [23, 22.694]
  - - [5888, 1024, 1, 256]
    - [3, 23.186]
  - - [6784, 1024, 1, 256]
    - [139, 23.881]
  - - [256, 1408, 1, 256]
    - [58, 6.009]
  - - [448, 1408, 1, 256]
    - [3, 9.729]
  - - [704, 1408, 1, 256]
    - [3, 13.236]
  - - [1024, 1408, 1, 256]
    - [90, 15.872]
  - - [1408, 1408, 1, 256]
    - [73, 17.119]
  - - [1856, 1408, 1, 256]
    - [141, 20.371]
  - - [2368, 1408, 1, 256]
    - [3, 20.905]
  - - [2944, 1408, 1, 256]
    - [23, 21.426]
  - - [3584, 1408, 1, 256]
    - [142, 22.777]
  - - [4288, 1408, 1, 256]
    - [3, 23.532]
  - - [5056, 1408, 1, 256]
    - [23, 24.299]
  - - [5888, 1408, 1, 256]
    - [3, 24.524]
  - - [6784, 1408, 1, 256]
    - [117, 25.0]
  - - [256, 1856, 1, 256]
    - [3, 7.571]
  - - [448, 1856, 1, 256]
    - [3, 12.622]
  - - [704, 1856, 1, 256]
    - [3, 16.385]
  - - [1024, 1856, 1, 256]
    - [73, 16.919]
  - - [1408, 1856, 1, 256]
    - [73, 20.538]
  - - [1856, 1856, 1, 256]
    - [3, 21.139]
  - - [2368, 1856, 1, 256]
    - [3, 22.317]
  - - [2944, 1856, 1, 256]
    - [41, 23.142]
  - - [3584, 1856, 1, 256]
    - [3, 24.133]
  - - [4288, 1856, 1, 256]
    - [41, 24.735]
  - - [5056, 1856, 1, 256]
    - [3, 25.414]
  - - [5888, 1856, 1, 256]
    - [73, 25.419]
  - - [6784, 1856, 1, 256]
    - [73, 26.508]
  - - [256, 2368, 1, 256]
    - [3, 9.554]
  - - [448, 2368, 1, 256]
    - [3, 14.57]
  - - [704, 2368, 1, 256]
    - [14, 17.808]
  - - [1024, 2368, 1, 256]
    - [73, 19.756]
  - - [1408, 2368, 1, 256]
    - [3, 20.815]
  - - [1856, 2368, 1, 256]
    - [3, 22.677]
  - - [2368, 2368, 1, 256]
    - [3, 23.338]
  - - [2944, 2368, 1, 256]
    - [3, 24.581]
  - - [3584, 2368, 1, 256]
    - [114, 25.106]
  - - [4288, 2368, 1, 256]
    - [3, 25.69]
  - - [5056, 2368, 1, 256]
    - [3, 26.26]
  - - [5888, 2368, 1, 256]
    - [117, 26.72]
  - - [6784, 2368, 1, 256]
    - [73, 27.08]
  - - [256, 2944, 1, 256]
    - [3, 11.624]
  - - [448, 2944, 1, 256]
    - [3, 16.685]
  - - [704, 2944, 1, 256]
    - [110, 17.582]
  - - [1024, 2944, 1, 256]
    - [114, 20.035]
  - - [1408, 2944, 1, 256]
    - [3, 21.503]
  - - [1856, 2944, 1, 256]
    - [114, 23.557]
  - - [2368, 2944, 1, 256]
    - [3, 24.664]
  - - [2944, 2944, 1, 256]
    - [3, 25.771]
  - - [3584, 2944, 1, 256]
    - [117, 26.625]
  - - [4288, 2944, 1, 256]
    - [3, 26.007]
  - - [5056, 2944, 1, 256]
    - [3, 26.468]
  - - [5888, 2944, 1, 256]
    - [117, 28.262]
  - - [6784, 2944, 1, 256]
    - [117, 28.716]
  - - [448, 3584, 1, 256]
    - [90, 17.28]
  - - [704, 3584, 1, 256]
    - [23, 19.993]
  - - [1024, 3584, 1, 256]
    - [3, 21.341]
  - - [1408, 3584, 1, 256]
    - [3, 22.957]
  - - [1856, 3584, 1, 256]
    - [3, 24.316]
  - - [2368, 3584, 1, 256]
    - [3, 25.419]
  - - [2944, 3584, 1, 256]
    - [26, 26.44]
  - - [3584, 3584, 1, 256]
    - [117, 26.482]
  - - [4288, 3584, 1, 256]
    - [73, 27.127]
  - - [5056, 3584, 1, 256]
    - [117, 27.8]
  - - [5888, 3584, 1, 256]
    - [117, 28.819]
  - - [6784, 3584, 1, 256]
    - [117, 28.8]
  - - [256, 4288, 1, 256]
    - [3, 14.391]
  - - [448, 4288, 1, 256]
    - [73, 17.049]
  - - [704, 4288, 1, 256]
    - [3, 20.108]
  - - [1024, 4288, 1, 256]
    - [3, 22.575]
  - - [1408, 4288, 1, 256]
    - [3, 23.756]
  - - [1856, 4288, 1, 256]
    - [3, 25.169]
  - - [2368, 4288, 1, 256]
    - [3, 26.125]
  - - [2944, 4288, 1, 256]
    - [41, 26.384]
  - - [3584, 4288, 1, 256]
    - [73, 27.094]
  - - [4288, 4288, 1, 256]
    - [117, 28.045]
  - - [5056, 4288, 1, 256]
    - [26, 28.104]
  - - [5888, 4288, 1, 256]
    - [117, 29.245]
  - - [6784, 4288, 1, 256]
    - [117, 29.285]
  - - [256, 5056, 1, 256]
    - [25, 16.231]
  - - [448, 5056, 1, 256]
    - [91, 18.666]
  - - [704, 5056, 1, 256]
    - [3, 21.613]
  - - [1024, 5056, 1, 256]
    - [73, 23.553]
  - - [1408, 5056, 1, 256]
    - [3, 24.828]
  - - [1856, 5056, 1, 256]
    - [3, 25.925]
  - - [2368, 5056, 1, 256]
    - [3, 26.32]
  - - [2944, 5056, 1, 256]
    - [3, 26.933]
  - - [3584, 5056, 1, 256]
    - [117, 27.668]
  - - [4288, 5056, 1, 256]
    - [18, 28.091]
  - - [5056, 5056, 1, 256]
    - [74, 28.611]
  - - [5888, 5056, 1, 256]
    - [26, 29.628]
  - - [6784, 5056, 1, 256]
    - [117, 29.637]
  - - [448, 5888, 1, 256]
    - [112, 20.343]
  - - [704, 5888, 1, 256]
    - [3, 21.659]
  - - [1024, 5888, 1, 256]
    - [3, 23.757]
  - - [1408, 5888, 1, 256]
    - [3, 25.117]
  - - [1856, 5888, 1, 256]
    - [3, 26.049]
  - - [2368, 5888, 1, 256]
    - [26, 27.19]
  - - [2944, 5888, 1, 256]
    - [26, 28.119]
  - - [3584, 5888, 1, 256]
    - [117, 28.751]
  - - [4288, 5888, 1, 256]
    - [26, 29.093]
  - - [5056, 5888, 1, 256]
    - [117, 29.165]
  - - [5888, 5888, 1, 256]
    - [117, 30.127]
  - - [6784, 5888, 1, 256]
    - [117, 29.994]
  - - [256, 6784, 1, 256]
    - [33, 18.831]
  - - [448, 6784, 1, 256]
    - [114, 19.968]
  - - [704, 6784, 1, 256]
    - [3, 22.582]
  - - [1024, 6784, 1, 256]
    - [3, 24.706]
  - - [1408, 6784, 1, 256]
    - [3, 25.772]
  - - [1856, 6784, 1, 256]
    - [117, 26.683]
  - - [2368, 6784, 1, 256]
    - [26, 27.336]
  - - [2944, 6784, 1, 256]
    - [18, 28.363]
  - - [3584, 6784, 1, 256]
    - [117, 29.014]
  - - [4288, 6784, 1, 256]
    - [18, 29.316]
  - - [5056, 6784, 1, 256]
    - [117, 29.575]
  - - [5888, 6784, 1, 256]
    - [26, 30.112]
  - - [6784, 6784, 1, 256]
    - [143, 30.107]
  - - [704, 256, 1, 1280]
    - [128, 8.931]
  - - [1408, 256, 1, 1280]
    - [7, 16.093]
  - - [1856, 256, 1, 1280]
    - [62, 18.272]
  - - [2368, 256, 1, 1280]
    - [62, 23.128]
  - - [2944, 256, 1, 1280]
    - [62, 27.585]
  - - [3584, 256, 1, 1280]
    - [68, 24.778]
  - - [4288, 256, 1, 1280]
    - [144, 30.096]
  - - [5056, 256, 1, 1280]
    - [145, 31.907]
  - - [5888, 256, 1, 1280]
    - [33, 36.109]
  - - [6784, 256, 1, 1280]
    - [33, 40.658]
  - - [704, 448, 1, 1280]
    - [7, 14.125]
  - - [1024, 448, 1, 1280]
    - [62, 17.595]
  - - [1408, 448, 1, 1280]
    - [7, 23.567]
  - - [1856, 448, 1, 1280]
    - [7, 30.204]
  - - [2368, 448, 1, 1280]
    - [17, 29.03]
  - - [2944, 448, 1, 1280]
    - [3, 32.85]
  - - [3584, 448, 1, 1280]
    - [89, 33.173]
  - - [4288, 448, 1, 1280]
    - [72, 35.793]
  - - [5056, 448, 1, 1280]
    - [73, 40.08]
  - - [5888, 448, 1, 1280]
    - [1, 38.463]
  - - [6784, 448, 1, 1280]
    - [1, 43.611]
  - - [256, 704, 1, 1280]
    - [128, 8.87]
  - - [448, 704, 1, 1280]
    - [62, 13.952]
  - - [704, 704, 1, 1280]
    - [62, 18.959]
  - - [1024, 704, 1, 1280]
    - [118, 26.794]
  - - [1408, 704, 1, 1280]
    - [17, 27.125]
  - - [1856, 704, 1, 1280]
    - [3, 33.116]
  - - [2368, 704, 1, 1280]
    - [7, 34.944]
  - - [2944, 704, 1, 1280]
    - [146, 37.502]
  - - [3584, 704, 1, 1280]
    - [1, 36.941]
  - - [4288, 704, 1, 1280]
    - [0, 43.534]
  - - [5056, 704, 1, 1280]
    - [107, 43.649]
  - - [5888, 704, 1, 1280]
    - [1, 42.216]
  - - [6784, 704, 1, 1280]
    - [5, 46.663]
  - - [256, 1024, 1, 1280]
    - [62, 12.195]
  - - [448, 1024, 1, 1280]
    - [118, 17.689]
  - - [704, 1024, 1, 1280]
    - [62, 26.725]
  - - [1408, 1024, 1, 1280]
    - [33, 34.654]
  - - [1856, 1024, 1, 1280]
    - [71, 36.206]
  - - [2368, 1024, 1, 1280]
    - [73, 42.438]
  - - [2944, 1024, 1, 1280]
    - [0, 45.052]
  - - [3584, 1024, 1, 1280]
    - [73, 42.82]
  - - [4288, 1024, 1, 1280]
    - [31, 45.457]
  - - [5056, 1024, 1, 1280]
    - [5, 50.688]
  - - [5888, 1024, 1, 1280]
    - [0, 48.521]
  - - [6784, 1024, 1, 1280]
    - [6, 54.064]
  - - [256, 1408, 1, 1280]
    - [7, 15.848]
  - - [448, 1408, 1, 1280]
    - [118, 23.505]
  - - [704, 1408, 1, 1280]
    - [68, 27.28]
  - - [1024, 1408, 1, 1280]
    - [90, 35.301]
  - - [1408, 1408, 1, 1280]
    - [147, 35.826]
  - - [1856, 1408, 1, 1280]
    - [92, 40.698]
  - - [2368, 1408, 1, 1280]
    - [5, 46.909]
  - - [2944, 1408, 1, 1280]
    - [30, 46.196]
  - - [3584, 1408, 1, 1280]
    - [5, 49.641]
  - - [4288, 1408, 1, 1280]
    - [0, 47.578]
  - - [5056, 1408, 1, 1280]
    - [1, 52.728]
  - - [5888, 1408, 1, 1280]
    - [5, 51.049]
  - - [6784, 1408, 1, 1280]
    - [0, 51.727]
  - - [256, 1856, 1, 1280]
    - [62, 17.937]
  - - [448, 1856, 1, 1280]
    - [7, 30.984]
  - - [704, 1856, 1, 1280]
    - [3, 33.435]
  - - [1024, 1856, 1, 1280]
    - [74, 35.139]
  - - [1408, 1856, 1, 1280]
    - [73, 45.133]
  - - [1856, 1856, 1, 1280]
    - [33, 43.311]
  - - [2368, 1856, 1, 1280]
    - [5, 44.199]
  - - [2944, 1856, 1, 1280]
    - [0, 43.85]
  - - [3584, 1856, 1, 1280]
    - [5, 50.489]
  - - [4288, 1856, 1, 1280]
    - [1, 49.343]
  - - [5056, 1856, 1, 1280]
    - [0, 50.761]
  - - [5888, 1856, 1, 1280]
    - [1, 50.447]
  - - [6784, 1856, 1, 1280]
    - [2, 53.171]
  - - [256, 2368, 1, 1280]
    - [7, 23.189]
  - - [448, 2368, 1, 1280]
    - [144, 28.92]
  - - [704, 2368, 1, 1280]
    - [33, 39.803]
  - - [1024, 2368, 1, 1280]
    - [146, 42.645]
  - - [1408, 2368, 1, 1280]
    - [1, 46.772]
  - - [1856, 2368, 1, 1280]
    - [5, 43.862]
  - - [2368, 2368, 1, 1280]
    - [0, 45.0]
  - - [2944, 2368, 1, 1280]
    - [5, 52.444]
  - - [3584, 2368, 1, 1280]
    - [5, 52.394]
  - - [4288, 2368, 1, 1280]
    - [5, 52.279]
  - - [5056, 2368, 1, 1280]
    - [1, 53.11]
  - - [5888, 2368, 1, 1280]
    - [5, 54.803]
  - - [6784, 2368, 1, 1280]
    - [0, 53.343]
  - - [256, 2944, 1, 1280]
    - [7, 28.157]
  - - [448, 2944, 1, 1280]
    - [3, 33.136]
  - - [704, 2944, 1, 1280]
    - [73, 37.882]
  - - [1024, 2944, 1, 1280]
    - [1, 43.388]
  - - [1408, 2944, 1, 1280]
    - [12, 43.89]
  - - [1856, 2944, 1, 1280]
    - [0, 44.12]
  - - [2368, 2944, 1, 1280]
    - [1, 51.983]
  - - [2944, 2944, 1, 1280]
    - [5, 53.12]
  - - [3584, 2944, 1, 1280]
    - [5, 54.676]
  - - [4288, 2944, 1, 1280]
    - [2, 53.107]
  - - [5056, 2944, 1, 1280]
    - [1, 52.858]
  - - [5888, 2944, 1, 1280]
    - [5, 55.062]
  - - [6784, 2944, 1, 1280]
    - [0, 55.378]
  - - [448, 3584, 1, 1280]
    - [33, 38.592]
  - - [704, 3584, 1, 1280]
    - [23, 39.68]
  - - [1024, 3584, 1, 1280]
    - [18, 44.068]
  - - [1408, 3584, 1, 1280]
    - [1, 49.709]
  - - [1856, 3584, 1, 1280]
    - [0, 51.053]
  - - [2368, 3584, 1, 1280]
    - [5, 52.506]
  - - [2944, 3584, 1, 1280]
    - [148, 56.066]
  - - [3584, 3584, 1, 1280]
    - [0, 53.23]
  - - [4288, 3584, 1, 1280]
    - [1, 54.161]
  - - [5056, 3584, 1, 1280]
    - [1, 53.19]
  - - [5888, 3584, 1, 1280]
    - [87, 57.648]
  - - [6784, 3584, 1, 1280]
    - [6, 57.566]
  - - [256, 4288, 1, 1280]
    - [17, 28.835]
  - - [448, 4288, 1, 1280]
    - [73, 35.746]
  - - [704, 4288, 1, 1280]
    - [5, 43.621]
  - - [1024, 4288, 1, 1280]
    - [2, 46.56]
  - - [1408, 4288, 1, 1280]
    - [75, 46.486]
  - - [1856, 4288, 1, 1280]
    - [1, 49.258]
  - - [2368, 4288, 1, 1280]
    - [0, 53.306]
  - - [2944, 4288, 1, 1280]
    - [2, 52.119]
  - - [3584, 4288, 1, 1280]
    - [5, 54.36]
  - - [4288, 4288, 1, 1280]
    - [73, 53.895]
  - - [5056, 4288, 1, 1280]
    - [2, 55.741]
  - - [5888, 4288, 1, 1280]
    - [73, 55.167]
  - - [6784, 4288, 1, 1280]
    - [5, 55.535]
  - - [256, 5056, 1, 1280]
    - [17, 33.154]
  - - [448, 5056, 1, 1280]
    - [91, 40.477]
  - - [704, 5056, 1, 1280]
    - [139, 46.12]
  - - [1024, 5056, 1, 1280]
    - [1, 50.688]
  - - [1408, 5056, 1, 1280]
    - [5, 53.138]
  - - [1856, 5056, 1, 1280]
    - [0, 50.308]
  - - [2368, 5056, 1, 1280]
    - [1, 53.241]
  - - [2944, 5056, 1, 1280]
    - [5, 53.041]
  - - [3584, 5056, 1, 1280]
    - [73, 53.288]
  - - [4288, 5056, 1, 1280]
    - [2, 55.791]
  - - [5056, 5056, 1, 1280]
    - [2, 55.654]
  - - [5888, 5056, 1, 1280]
    - [5, 56.355]
  - - [6784, 5056, 1, 1280]
    - [0, 57.732]
  - - [448, 5888, 1, 1280]
    - [97, 40.772]
  - - [704, 5888, 1, 1280]
    - [1, 42.366]
  - - [1024, 5888, 1, 1280]
    - [0, 48.092]
  - - [1408, 5888, 1, 1280]
    - [5, 51.268]
  - - [1856, 5888, 1, 1280]
    - [5, 50.903]
  - - [2368, 5888, 1, 1280]
    - [87, 55.544]
  - - [2944, 5888, 1, 1280]
    - [0, 56.969]
  - - [3584, 5888, 1, 1280]
    - [0, 57.922]
  - - [4288, 5888, 1, 1280]
    - [1, 54.967]
  - - [5056, 5888, 1, 1280]
    - [1, 56.304]
  - - [5888, 5888, 1, 1280]
    - [87, 58.605]
  - - [6784, 5888, 1, 1280]
    - [87, 58.186]
  - - [256, 6784, 1, 1280]
    - [33, 41.466]
  - - [448, 6784, 1, 1280]
    - [1, 43.961]
  - - [704, 6784, 1, 1280]
    - [1, 47.697]
  - - [1024, 6784, 1, 1280]
    - [1, 52.922]
  - - [1408, 6784, 1, 1280]
    - [76, 50.384]
  - - [1856, 6784, 1, 1280]
    - [0, 51.673]
  - - [2368, 6784, 1, 1280]
    - [0, 53.355]
  - - [2944, 6784, 1, 1280]
    - [6, 55.145]
  - - [3584, 6784, 1, 1280]
    - [0, 57.246]
  - - [4288, 6784, 1, 1280]
    - [1, 55.712]
  - - [5056, 6784, 1, 1280]
    - [6, 57.604]
  - - [5888, 6784, 1, 1280]
    - [0, 57.999]
  - - [6784, 6784, 1, 1280]
    - [149, 58.219]
  - - [704, 256, 1, 3328]
    - [128, 13.147]
  - - [1408, 256, 1, 3328]
    - [82, 24.351]
  - - [1856, 256, 1, 3328]
    - [89, 23.945]
  - - [2368, 256, 1, 3328]
    - [89, 30.106]
  - - [2944, 256, 1, 3328]
    - [132, 36.891]
  - - [3584, 256, 1, 3328]
    - [17, 35.502]
  - - [4288, 256, 1, 3328]
    - [68, 42.171]
  - - [5056, 256, 1, 3328]
    - [150, 42.091]
  - - [5888, 256, 1, 3328]
    - [150, 49.795]
  - - [6784, 256, 1, 3328]
    - [150, 55.514]
  - - [704, 448, 1, 3328]
    - [84, 21.94]
  - - [1024, 448, 1, 3328]
    - [89, 23.628]
  - - [1408, 448, 1, 3328]
    - [89, 31.662]
  - - [1856, 448, 1, 3328]
    - [89, 40.176]
  - - [2368, 448, 1, 3328]
    - [17, 40.755]
  - - [2944, 448, 1, 3328]
    - [150, 43.304]
  - - [3584, 448, 1, 3328]
    - [89, 42.758]
  - - [4288, 448, 1, 3328]
    - [71, 48.212]
  - - [5056, 448, 1, 3328]
    - [91, 49.121]
  - - [5888, 448, 1, 3328]
    - [0, 50.513]
  - - [6784, 448, 1, 3328]
    - [76, 56.95]
  - - [256, 704, 1, 3328]
    - [105, 13.121]
  - - [448, 704, 1, 3328]
    - [83, 21.859]
  - - [704, 704, 1, 3328]
    - [89, 25.421]
  - - [1024, 704, 1, 3328]
    - [89, 35.426]
  - - [1408, 704, 1, 3328]
    - [17, 38.395]
  - - [1856, 704, 1, 3328]
    - [150, 43.051]
  - - [2368, 704, 1, 3328]
    - [89, 44.3]
  - - [2944, 704, 1, 3328]
    - [73, 46.12]
  - - [3584, 704, 1, 3328]
    - [0, 48.74]
  - - [4288, 704, 1, 3328]
    - [76, 57.456]
  - - [5056, 704, 1, 3328]
    - [107, 57.206]
  - - [5888, 704, 1, 3328]
    - [1, 52.472]
  - - [6784, 704, 1, 3328]
    - [1, 59.159]
  - - [256, 1024, 1, 3328]
    - [83, 18.068]
  - - [448, 1024, 1, 3328]
    - [89, 23.435]
  - - [704, 1024, 1, 3328]
    - [89, 35.287]
  - - [1408, 1024, 1, 3328]
    - [150, 47.714]
  - - [1856, 1024, 1, 3328]
    - [71, 47.193]
  - - [2368, 1024, 1, 3328]
    - [91, 52.073]
  - - [2944, 1024, 1, 3328]
    - [76, 58.384]
  - - [3584, 1024, 1, 3328]
    - [30, 54.911]
  - - [4288, 1024, 1, 3328]
    - [19, 62.434]
  - - [5056, 1024, 1, 3328]
    - [1, 63.46]
  - - [5888, 1024, 1, 3328]
    - [0, 60.886]
  - - [6784, 1024, 1, 3328]
    - [0, 68.744]
  - - [256, 1408, 1, 3328]
    - [84, 23.836]
  - - [448, 1408, 1, 3328]
    - [89, 31.244]
  - - [704, 1408, 1, 3328]
    - [17, 38.715]
  - - [1024, 1408, 1, 3328]
    - [150, 47.714]
  - - [1408, 1408, 1, 3328]
    - [71, 48.743]
  - - [1856, 1408, 1, 3328]
    - [92, 52.595]
  - - [2368, 1408, 1, 3328]
    - [5, 60.161]
  - - [2944, 1408, 1, 3328]
    - [2, 61.627]
  - - [3584, 1408, 1, 3328]
    - [1, 62.24]
  - - [4288, 1408, 1, 3328]
    - [0, 60.015]
  - - [5056, 1408, 1, 3328]
    - [1, 66.431]
  - - [5888, 1408, 1, 3328]
    - [2, 64.464]
  - - [6784, 1408, 1, 3328]
    - [0, 64.242]
  - - [256, 1856, 1, 3328]
    - [89, 24.14]
  - - [448, 1856, 1, 3328]
    - [137, 39.315]
  - - [704, 1856, 1, 3328]
    - [150, 42.825]
  - - [1024, 1856, 1, 3328]
    - [72, 47.412]
  - - [1408, 1856, 1, 3328]
    - [73, 55.768]
  - - [1856, 1856, 1, 3328]
    - [107, 55.22]
  - - [2368, 1856, 1, 3328]
    - [1, 55.355]
  - - [2944, 1856, 1, 3328]
    - [0, 55.119]
  - - [3584, 1856, 1, 3328]
    - [1, 63.239]
  - - [4288, 1856, 1, 3328]
    - [2, 62.337]
  - - [5056, 1856, 1, 3328]
    - [6, 62.898]
  - - [5888, 1856, 1, 3328]
    - [78, 62.291]
  - - [6784, 1856, 1, 3328]
    - [2, 66.559]
  - - [256, 2368, 1, 3328]
    - [89, 30.799]
  - - [448, 2368, 1, 3328]
    - [17, 40.506]
  - - [704, 2368, 1, 3328]
    - [33, 48.72]
  - - [1024, 2368, 1, 3328]
    - [146, 52.313]
  - - [1408, 2368, 1, 3328]
    - [76, 61.827]
  - - [1856, 2368, 1, 3328]
    - [5, 55.336]
  - - [2368, 2368, 1, 3328]
    - [0, 56.534]
  - - [2944, 2368, 1, 3328]
    - [5, 65.332]
  - - [3584, 2368, 1, 3328]
    - [2, 65.409]
  - - [4288, 2368, 1, 3328]
    - [1, 64.508]
  - - [5056, 2368, 1, 3328]
    - [1, 65.544]
  - - [5888, 2368, 1, 3328]
    - [1, 66.947]
  - - [6784, 2368, 1, 3328]
    - [0, 65.224]
  - - [256, 2944, 1, 3328]
    - [89, 36.843]
  - - [448, 2944, 1, 3328]
    - [150, 43.115]
  - - [704, 2944, 1, 3328]
    - [146, 45.929]
  - - [1024, 2944, 1, 3328]
    - [151, 56.858]
  - - [1408, 2944, 1, 3328]
    - [19, 60.382]
  - - [1856, 2944, 1, 3328]
    - [0, 55.148]
  - - [2368, 2944, 1, 3328]
    - [5, 65.496]
  - - [2944, 2944, 1, 3328]
    - [1, 65.864]
  - - [3584, 2944, 1, 3328]
    - [151, 68.613]
  - - [4288, 2944, 1, 3328]
    - [2, 66.256]
  - - [5056, 2944, 1, 3328]
    - [1, 64.723]
  - - [5888, 2944, 1, 3328]
    - [2, 68.821]
  - - [6784, 2944, 1, 3328]
    - [0, 67.556]
  - - [448, 3584, 1, 3328]
    - [33, 46.924]
  - - [704, 3584, 1, 3328]
    - [76, 48.64]
  - - [1024, 3584, 1, 3328]
    - [78, 57.625]
  - - [1408, 3584, 1, 3328]
    - [1, 62.425]
  - - [1856, 3584, 1, 3328]
    - [0, 65.257]
  - - [2368, 3584, 1, 3328]
    - [1, 64.836]
  - - [2944, 3584, 1, 3328]
    - [0, 70.021]
  - - [3584, 3584, 1, 3328]
    - [2, 67.154]
  - - [4288, 3584, 1, 3328]
    - [1, 66.532]
  - - [5056, 3584, 1, 3328]
    - [1, 64.838]
  - - [5888, 3584, 1, 3328]
    - [6, 71.046]
  - - [6784, 3584, 1, 3328]
    - [0, 70.43]
  - - [256, 4288, 1, 3328]
    - [17, 41.659]
  - - [448, 4288, 1, 3328]
    - [152, 47.016]
  - - [704, 4288, 1, 3328]
    - [76, 56.821]
  - - [1024, 4288, 1, 3328]
    - [2, 63.567]
  - - [1408, 4288, 1, 3328]
    - [0, 59.416]
  - - [1856, 4288, 1, 3328]
    - [22, 61.705]
  - - [2368, 4288, 1, 3328]
    - [0, 67.064]
  - - [2944, 4288, 1, 3328]
    - [2, 66.016]
  - - [3584, 4288, 1, 3328]
    - [5, 66.34]
  - - [4288, 4288, 1, 3328]
    - [1, 65.261]
  - - [5056, 4288, 1, 3328]
    - [2, 69.089]
  - - [5888, 4288, 1, 3328]
    - [2, 67.983]
  - - [6784, 4288, 1, 3328]
    - [2, 67.545]
  - - [256, 5056, 1, 3328]
    - [17, 47.956]
  - - [448, 5056, 1, 3328]
    - [73, 48.923]
  - - [704, 5056, 1, 3328]
    - [78, 56.432]
  - - [1024, 5056, 1, 3328]
    - [5, 64.025]
  - - [1408, 5056, 1, 3328]
    - [0, 68.075]
  - - [1856, 5056, 1, 3328]
    - [0, 62.831]
  - - [2368, 5056, 1, 3328]
    - [1, 66.182]
  - - [2944, 5056, 1, 3328]
    - [1, 64.716]
  - - [3584, 5056, 1, 3328]
    - [1, 64.863]
  - - [4288, 5056, 1, 3328]
    - [2, 69.212]
  - - [5056, 5056, 1, 3328]
    - [2, 68.611]
  - - [5888, 5056, 1, 3328]
    - [2, 68.975]
  - - [6784, 5056, 1, 3328]
    - [0, 70.113]
  - - [448, 5888, 1, 3328]
    - [76, 50.617]
  - - [704, 5888, 1, 3328]
    - [5, 53.191]
  - - [1024, 5888, 1, 3328]
    - [76, 60.479]
  - - [1408, 5888, 1, 3328]
    - [5, 63.829]
  - - [1856, 5888, 1, 3328]
    - [78, 61.524]
  - - [2368, 5888, 1, 3328]
    - [0, 69.473]
  - - [2944, 5888, 1, 3328]
    - [0, 69.85]
  - - [3584, 5888, 1, 3328]
    - [6, 71.008]
  - - [4288, 5888, 1, 3328]
    - [2, 67.648]
  - - [5056, 5888, 1, 3328]
    - [2, 68.492]
  - - [5888, 5888, 1, 3328]
    - [0, 70.835]
  - - [6784, 5888, 1, 3328]
    - [6, 69.575]
  - - [256, 6784, 1, 3328]
    - [150, 55.372]
  - - [448, 6784, 1, 3328]
    - [76, 56.723]
  - - [704, 6784, 1, 3328]
    - [5, 59.771]
  - - [1024, 6784, 1, 3328]
    - [76, 67.097]
  - - [1408, 6784, 1, 3328]
    - [0, 63.513]
  - - [1856, 6784, 1, 3328]
    - [31, 64.805]
  - - [2368, 6784, 1, 3328]
    - [0, 65.372]
  - - [2944, 6784, 1, 3328]
    - [0, 67.69]
  - - [3584, 6784, 1, 3328]
    - [0, 70.246]
  - - [4288, 6784, 1, 3328]
    - [1, 67.688]
  - - [5056, 6784, 1, 3328]
    - [87, 69.873]
  - - [5888, 6784, 1, 3328]
    - [2, 71.187]
  - - [6784, 6784, 1, 3328]
    - [1, 69.64]
  - - [1760, 7133, 1, 1760]
    - [2, 58.449]
  - - [2048, 7133, 1, 2048]
    - [5, 57.59]
  - - [2560, 7133, 1, 2560]
    - [5, 61.578]
  - - [3072, 7435, 1, 1024]
    - [5, 51.851]
  - - [4096, 7133, 1, 4096]
    - [2, 70.079]
  - - [7680, 5481, 1, 2560]
    - [0, 67.811]
  - - [32, 32, 1, 32]
    - [24, 0.003]
  - - [32, 64, 1, 256]
    - [57, 0.04]
  - - [32, 128, 1, 256]
    - [125, 0.082]
  - - [32, 256, 1, 256]
    - [133, 0.176]
  - - [32, 448, 1, 256]
    - [125, 0.285]
  - - [32, 704, 1, 256]
    - [57, 0.442]
  - - [32, 1024, 1, 256]
    - [58, 0.661]
  - - [32, 1408, 1, 256]
    - [57, 0.896]
  - - [32, 1856, 1, 256]
    - [57, 1.215]
  - - [32, 2368, 1, 256]
    - [125, 1.518]
  - - [32, 2944, 1, 256]
    - [4, 1.811]
  - - [32, 3584, 1, 256]
    - [125, 2.25]
  - - [32, 4288, 1, 256]
    - [125, 2.604]
  - - [32, 5056, 1, 256]
    - [125, 3.111]
  - - [32, 5888, 1, 256]
    - [125, 3.484]
  - - [32, 6784, 1, 256]
    - [125, 4.014]
  - - [32, 64, 1, 1280]
    - [127, 0.127]
  - - [32, 128, 1, 1280]
    - [127, 0.228]
  - - [32, 256, 1, 1280]
    - [127, 0.49]
  - - [32, 448, 1, 1280]
    - [127, 0.887]
  - - [32, 704, 1, 1280]
    - [127, 1.406]
  - - [32, 1024, 1, 1280]
    - [127, 1.937]
  - - [32, 1408, 1, 1280]
    - [127, 2.589]
  - - [32, 1856, 1, 1280]
    - [127, 3.539]
  - - [32, 2368, 1, 1280]
    - [127, 4.46]
  - - [32, 2944, 1, 1280]
    - [16, 5.069]
  - - [32, 3584, 1, 1280]
    - [57, 5.569]
  - - [32, 4288, 1, 1280]
    - [129, 6.663]
  - - [32, 5056, 1, 1280]
    - [129, 7.726]
  - - [32, 5888, 1, 1280]
    - [105, 8.968]
  - - [32, 6784, 1, 1280]
    - [105, 10.002]
  - - [32, 64, 1, 3328]
    - [120, 0.212]
  - - [32, 128, 1, 3328]
    - [120, 0.454]
  - - [32, 256, 1, 3328]
    - [32, 0.839]
  - - [32, 448, 1, 3328]
    - [127, 1.375]
  - - [32, 704, 1, 3328]
    - [102, 2.171]
  - - [32, 1024, 1, 3328]
    - [101, 2.997]
  - - [32, 1408, 1, 3328]
    - [102, 3.994]
  - - [32, 1856, 1, 3328]
    - [127, 5.609]
  - - [32, 2368, 1, 3328]
    - [127, 6.749]
  - - [32, 2944, 1, 3328]
    - [16, 7.596]
  - - [32, 3584, 1, 3328]
    - [129, 8.382]
  - - [32, 4288, 1, 3328]
    - [105, 10.088]
  - - [32, 5056, 1, 3328]
    - [129, 11.965]
  - - [32, 5888, 1, 3328]
    - [129, 13.534]
  - - [32, 6784, 1, 3328]
    - [105, 15.805]
  - - [64, 32, 1, 256]
    - [81, 0.042]
  - - [128, 32, 1, 256]
    - [81, 0.081]
  - - [256, 32, 1, 256]
    - [57, 0.174]
  - - [448, 32, 1, 256]
    - [57, 0.281]
  - - [704, 32, 1, 256]
    - [56, 0.448]
  - - [1024, 32, 1, 256]
    - [58, 0.666]
  - - [1408, 32, 1, 256]
    - [57, 0.89]
  - - [1856, 32, 1, 256]
    - [56, 1.181]
  - - [2368, 32, 1, 256]
    - [81, 1.518]
  - - [2944, 32, 1, 256]
    - [99, 1.811]
  - - [3584, 32, 1, 256]
    - [57, 2.205]
  - - [4288, 32, 1, 256]
    - [125, 2.587]
  - - [5056, 32, 1, 256]
    - [125, 3.111]
  - - [5888, 32, 1, 256]
    - [115, 3.506]
  - - [6784, 32, 1, 256]
    - [125, 4.066]
  - - [64, 32, 1, 1280]
    - [127, 0.124]
  - - [128, 32, 1, 1280]
    - [127, 0.231]
  - - [256, 32, 1, 1280]
    - [127, 0.467]
  - - [448, 32, 1, 1280]
    - [127, 0.847]
  - - [704, 32, 1, 1280]
    - [127, 1.321]
  - - [1024, 32, 1, 1280]
    - [127, 1.832]
  - - [1408, 32, 1, 1280]
    - [127, 2.518]
  - - [1856, 32, 1, 1280]
    - [127, 3.51]
  - - [2368, 32, 1, 1280]
    - [127, 4.285]
  - - [2944, 32, 1, 1280]
    - [127, 5.069]
  - - [3584, 32, 1, 1280]
    - [128, 5.626]
  - - [4288, 32, 1, 1280]
    - [128, 6.823]
  - - [5056, 32, 1, 1280]
    - [128, 7.803]
  - - [5888, 32, 1, 1280]
    - [128, 8.968]
  - - [6784, 32, 1, 1280]
    - [128, 10.506]
  - - [64, 32, 1, 3328]
    - [120, 0.214]
  - - [128, 32, 1, 3328]
    - [120, 0.453]
  - - [256, 32, 1, 3328]
    - [32, 0.853]
  - - [448, 32, 1, 3328]
    - [32, 1.437]
  - - [704, 32, 1, 3328]
    - [101, 2.229]
  - - [1024, 32, 1, 3328]
    - [32, 3.064]
  - - [1408, 32, 1, 3328]
    - [102, 4.081]
  - - [1856, 32, 1, 3328]
    - [135, 5.119]
  - - [2368, 32, 1, 3328]
    - [130, 6.428]
  - - [2944, 32, 1, 3328]
    - [16, 7.359]
  - - [3584, 32, 1, 3328]
    - [128, 8.635]
  - - [4288, 32, 1, 3328]
    - [128, 10.31]
  - - [5056, 32, 1, 3328]
    - [128, 11.895]
  - - [5888, 32, 1, 3328]
    - [128, 13.691]
  - - [6784, 32, 1, 3328]
    - [128, 15.929]
  - - [64, 64, 1, 32]
    - [153, 0.014]
  - - [256, 64, 1, 32]
    - [81, 0.062]
  - - [448, 64, 1, 32]
    - [81, 0.109]
  - - [704, 64, 1, 32]
    - [81, 0.162]
  - - [1408, 64, 1, 32]
    - [58, 0.319]
  - - [1856, 64, 1, 32]
    - [58, 0.393]
  - - [2368, 64, 1, 32]
    - [58, 0.506]
  - - [2944, 64, 1, 32]
    - [58, 0.618]
  - - [3584, 64, 1, 32]
    - [58, 0.738]
  - - [4288, 64, 1, 32]
    - [58, 0.883]
  - - [5056, 64, 1, 32]
    - [58, 1.023]
  - - [5888, 64, 1, 32]
    - [58, 1.151]
  - - [6784, 64, 1, 32]
    - [58, 1.294]
  - - [128, 128, 1, 32]
    - [8, 0.062]
  - - [448, 128, 1, 32]
    - [81, 0.22]
  - - [704, 128, 1, 32]
    - [58, 0.315]
  - - [1024, 128, 1, 32]
    - [58, 0.438]
  - - [1408, 128, 1, 32]
    - [53, 0.575]
  - - [1856, 128, 1, 32]
    - [58, 0.779]
  - - [2368, 128, 1, 32]
    - [58, 0.942]
  - - [2944, 128, 1, 32]
    - [53, 1.161]
  - - [3584, 128, 1, 32]
    - [58, 1.334]
  - - [4288, 128, 1, 32]
    - [81, 1.534]
  - - [5056, 128, 1, 32]
    - [58, 1.809]
  - - [5888, 128, 1, 32]
    - [11, 1.998]
  - - [6784, 128, 1, 32]
    - [11, 2.269]
  - - [64, 256, 1, 32]
    - [28, 0.062]
  - - [128, 256, 1, 32]
    - [8, 0.124]
  - - [256, 256, 1, 32]
    - [81, 0.251]
  - - [448, 256, 1, 32]
    - [58, 0.383]
  - - [704, 256, 1, 32]
    - [58, 0.602]
  - - [1408, 256, 1, 32]
    - [28, 1.083]
  - - [1856, 256, 1, 32]
    - [58, 1.37]
  - - [2368, 256, 1, 32]
    - [11, 1.694]
  - - [2944, 256, 1, 32]
    - [3, 2.013]
  - - [3584, 256, 1, 32]
    - [11, 2.25]
  - - [4288, 256, 1, 32]
    - [53, 2.505]
  - - [5056, 256, 1, 32]
    - [3, 2.863]
  - - [5888, 256, 1, 32]
    - [11, 3.088]
  - - [6784, 256, 1, 32]
    - [10, 3.313]
  - - [64, 448, 1, 32]
    - [58, 0.108]
  - - [128, 448, 1, 32]
    - [24, 0.205]
  - - [256, 448, 1, 32]
    - [58, 0.394]
  - - [448, 448, 1, 32]
    - [58, 0.67]
  - - [704, 448, 1, 32]
    - [99, 0.972]
  - - [1024, 448, 1, 32]
    - [58, 1.367]
  - - [1408, 448, 1, 32]
    - [11, 1.723]
  - - [1856, 448, 1, 32]
    - [3, 2.157]
  - - [2368, 448, 1, 32]
    - [10, 2.436]
  - - [2944, 448, 1, 32]
    - [3, 2.953]
  - - [3584, 448, 1, 32]
    - [54, 3.198]
  - - [4288, 448, 1, 32]
    - [10, 3.516]
  - - [5056, 448, 1, 32]
    - [10, 3.945]
  - - [5888, 448, 1, 32]
    - [154, 4.013]
  - - [6784, 448, 1, 32]
    - [10, 4.348]
  - - [64, 704, 1, 32]
    - [81, 0.166]
  - - [128, 704, 1, 32]
    - [58, 0.322]
  - - [256, 704, 1, 32]
    - [58, 0.596]
  - - [448, 704, 1, 32]
    - [58, 1.034]
  - - [704, 704, 1, 32]
    - [58, 1.441]
  - - [1024, 704, 1, 32]
    - [10, 1.87]
  - - [1408, 704, 1, 32]
    - [58, 2.367]
  - - [1856, 704, 1, 32]
    - [3, 2.908]
  - - [2368, 704, 1, 32]
    - [10, 3.358]
  - - [2944, 704, 1, 32]
    - [13, 3.645]
  - - [3584, 704, 1, 32]
    - [13, 4.043]
  - - [4288, 704, 1, 32]
    - [55, 4.371]
  - - [5056, 704, 1, 32]
    - [10, 4.633]
  - - [5888, 704, 1, 32]
    - [54, 4.836]
  - - [6784, 704, 1, 32]
    - [11, 5.094]
  - - [64, 1024, 1, 32]
    - [58, 0.246]
  - - [128, 1024, 1, 32]
    - [42, 0.45]
  - - [256, 1024, 1, 32]
    - [58, 0.851]
  - - [448, 1024, 1, 32]
    - [58, 1.367]
  - - [704, 1024, 1, 32]
    - [3, 1.897]
  - - [1408, 1024, 1, 32]
    - [11, 2.953]
  - - [1856, 1024, 1, 32]
    - [55, 3.478]
  - - [2368, 1024, 1, 32]
    - [55, 3.956]
  - - [2944, 1024, 1, 32]
    - [54, 4.229]
  - - [3584, 1024, 1, 32]
    - [54, 4.643]
  - - [4288, 1024, 1, 32]
    - [11, 4.916]
  - - [5056, 1024, 1, 32]
    - [13, 5.058]
  - - [5888, 1024, 1, 32]
    - [13, 5.315]
  - - [6784, 1024, 1, 32]
    - [11, 5.386]
  - - [64, 1408, 1, 32]
    - [58, 0.319]
  - - [128, 1408, 1, 32]
    - [58, 0.619]
  - - [256, 1408, 1, 32]
    - [81, 1.14]
  - - [448, 1408, 1, 32]
    - [3, 1.736]
  - - [704, 1408, 1, 32]
    - [11, 2.367]
  - - [1024, 1408, 1, 32]
    - [11, 3.005]
  - - [1408, 1408, 1, 32]
    - [10, 3.592]
  - - [1856, 1408, 1, 32]
    - [3, 4.061]
  - - [2368, 1408, 1, 32]
    - [54, 4.536]
  - - [2944, 1408, 1, 32]
    - [53, 4.852]
  - - [3584, 1408, 1, 32]
    - [11, 5.11]
  - - [4288, 1408, 1, 32]
    - [13, 5.469]
  - - [5056, 1408, 1, 32]
    - [11, 5.729]
  - - [5888, 1408, 1, 32]
    - [11, 5.93]
  - - [6784, 1408, 1, 32]
    - [10, 5.937]
  - - [64, 1856, 1, 32]
    - [58, 0.397]
  - - [128, 1856, 1, 32]
    - [58, 0.772]
  - - [256, 1856, 1, 32]
    - [58, 1.44]
  - - [448, 1856, 1, 32]
    - [11, 2.141]
  - - [704, 1856, 1, 32]
    - [3, 2.872]
  - - [1024, 1856, 1, 32]
    - [10, 3.496]
  - - [1408, 1856, 1, 32]
    - [54, 4.026]
  - - [1856, 1856, 1, 32]
    - [11, 4.566]
  - - [2368, 1856, 1, 32]
    - [154, 5.062]
  - - [2944, 1856, 1, 32]
    - [11, 5.31]
  - - [3584, 1856, 1, 32]
    - [11, 5.616]
  - - [4288, 1856, 1, 32]
    - [11, 5.892]
  - - [5056, 1856, 1, 32]
    - [10, 6.151]
  - - [5888, 1856, 1, 32]
    - [54, 6.185]
  - - [6784, 1856, 1, 32]
    - [11, 6.322]
  - - [64, 2368, 1, 32]
    - [58, 0.501]
  - - [128, 2368, 1, 32]
    - [58, 0.967]
  - - [256, 2368, 1, 32]
    - [11, 1.681]
  - - [448, 2368, 1, 32]
    - [58, 2.468]
  - - [704, 2368, 1, 32]
    - [11, 3.358]
  - - [1024, 2368, 1, 32]
    - [11, 3.92]
  - - [1408, 2368, 1, 32]
    - [11, 4.519]
  - - [1856, 2368, 1, 32]
    - [10, 5.128]
  - - [2368, 2368, 1, 32]
    - [54, 5.334]
  - - [2944, 2368, 1, 32]
    - [54, 5.752]
  - - [3584, 2368, 1, 32]
    - [10, 5.918]
  - - [4288, 2368, 1, 32]
    - [13, 6.173]
  - - [5056, 2368, 1, 32]
    - [54, 6.442]
  - - [5888, 2368, 1, 32]
    - [11, 6.469]
  - - [6784, 2368, 1, 32]
    - [54, 6.537]
  - - [64, 2944, 1, 32]
    - [58, 0.629]
  - - [128, 2944, 1, 32]
    - [58, 1.151]
  - - [256, 2944, 1, 32]
    - [3, 2.013]
  - - [448, 2944, 1, 32]
    - [3, 2.847]
  - - [704, 2944, 1, 32]
    - [11, 3.645]
  - - [1024, 2944, 1, 32]
    - [11, 4.348]
  - - [1408, 2944, 1, 32]
    - [154, 4.948]
  - - [1856, 2944, 1, 32]
    - [54, 5.353]
  - - [2368, 2944, 1, 32]
    - [10, 5.712]
  - - [2944, 2944, 1, 32]
    - [11, 5.963]
  - - [3584, 2944, 1, 32]
    - [11, 6.155]
  - - [4288, 2944, 1, 32]
    - [54, 6.392]
  - - [5056, 2944, 1, 32]
    - [13, 6.497]
  - - [5888, 2944, 1, 32]
    - [13, 6.663]
  - - [6784, 2944, 1, 32]
    - [11, 6.673]
  - - [64, 3584, 1, 32]
    - [81, 0.719]
  - - [128, 3584, 1, 32]
    - [58, 1.345]
  - - [448, 3584, 1, 32]
    - [10, 3.27]
  - - [704, 3584, 1, 32]
    - [11, 4.043]
  - - [1024, 3584, 1, 32]
    - [154, 4.61]
  - - [1408, 3584, 1, 32]
    - [13, 5.139]
  - - [1856, 3584, 1, 32]
    - [11, 5.656]
  - - [2368, 3584, 1, 32]
    - [11, 6.047]
  - - [2944, 3584, 1, 32]
    - [54, 6.175]
  - - [3584, 3584, 1, 32]
    - [54, 6.459]
  - - [4288, 3584, 1, 32]
    - [54, 6.557]
  - - [5056, 3584, 1, 32]
    - [13, 6.749]
  - - [5888, 3584, 1, 32]
    - [11, 6.805]
  - - [6784, 3584, 1, 32]
    - [54, 6.811]
  - - [64, 4288, 1, 32]
    - [58, 0.876]
  - - [128, 4288, 1, 32]
    - [58, 1.583]
  - - [256, 4288, 1, 32]
    - [3, 2.604]
  - - [448, 4288, 1, 32]
    - [55, 3.552]
  - - [704, 4288, 1, 32]
    - [13, 4.406]
  - - [1024, 4288, 1, 32]
    - [54, 4.901]
  - - [1408, 4288, 1, 32]
    - [11, 5.497]
  - - [1856, 4288, 1, 32]
    - [13, 5.916]
  - - [2368, 4288, 1, 32]
    - [55, 6.205]
  - - [2944, 4288, 1, 32]
    - [11, 6.41]
  - - [3584, 4288, 1, 32]
    - [54, 6.518]
  - - [4288, 4288, 1, 32]
    - [13, 6.792]
  - - [5056, 4288, 1, 32]
    - [54, 6.899]
  - - [5888, 4288, 1, 32]
    - [13, 6.896]
  - - [6784, 4288, 1, 32]
    - [54, 6.877]
  - - [64, 5056, 1, 32]
    - [58, 0.98]
  - - [128, 5056, 1, 32]
    - [13, 1.703]
  - - [256, 5056, 1, 32]
    - [3, 2.811]
  - - [448, 5056, 1, 32]
    - [13, 3.798]
  - - [704, 5056, 1, 32]
    - [11, 4.65]
  - - [1024, 5056, 1, 32]
    - [13, 5.1]
  - - [1408, 5056, 1, 32]
    - [55, 5.716]
  - - [1856, 5056, 1, 32]
    - [13, 6.129]
  - - [2368, 5056, 1, 32]
    - [11, 6.423]
  - - [2944, 5056, 1, 32]
    - [11, 6.513]
  - - [3584, 5056, 1, 32]
    - [11, 6.721]
  - - [4288, 5056, 1, 32]
    - [11, 6.844]
  - - [5056, 5056, 1, 32]
    - [13, 6.998]
  - - [5888, 5056, 1, 32]
    - [54, 6.983]
  - - [6784, 5056, 1, 32]
    - [11, 6.975]
  - - [64, 5888, 1, 32]
    - [58, 1.171]
  - - [128, 5888, 1, 32]
    - [11, 2.059]
  - - [448, 5888, 1, 32]
    - [13, 4.064]
  - - [704, 5888, 1, 32]
    - [10, 4.916]
  - - [1024, 5888, 1, 32]
    - [154, 5.367]
  - - [1408, 5888, 1, 32]
    - [10, 5.942]
  - - [1856, 5888, 1, 32]
    - [11, 6.304]
  - - [2368, 5888, 1, 32]
    - [13, 6.511]
  - - [2944, 5888, 1, 32]
    - [54, 6.648]
  - - [3584, 5888, 1, 32]
    - [13, 6.751]
  - - [4288, 5888, 1, 32]
    - [13, 6.906]
  - - [5056, 5888, 1, 32]
    - [13, 7.043]
  - - [5888, 5888, 1, 32]
    - [54, 7.022]
  - - [6784, 5888, 1, 32]
    - [54, 7.028]
  - - [64, 6784, 1, 32]
    - [58, 1.294]
  - - [128, 6784, 1, 32]
    - [11, 2.236]
  - - [256, 6784, 1, 32]
    - [54, 3.385]
  - - [448, 6784, 1, 32]
    - [55, 4.401]
  - - [704, 6784, 1, 32]
    - [11, 5.109]
  - - [1024, 6784, 1, 32]
    - [55, 5.591]
  - - [1408, 6784, 1, 32]
    - [13, 6.042]
  - - [1856, 6784, 1, 32]
    - [11, 6.412]
  - - [2368, 6784, 1, 32]
    - [54, 6.589]
  - - [2944, 6784, 1, 32]
    - [54, 6.68]
  - - [3584, 6784, 1, 32]
    - [11, 6.827]
  - - [4288, 6784, 1, 32]
    - [13, 6.955]
  - - [5056, 6784, 1, 32]
    - [13, 7.054]
  - - [5888, 6784, 1, 32]
    - [11, 7.042]
  - - [6784, 6784, 1, 32]
    - [13, 7.043]
  - - [32, 32, 1, 256]
    - [125, 0.021]
  - - [32, 32, 1, 1280]
    - [127, 0.063]
  - - [32, 32, 1, 3328]
    - [101, 0.111]
  - - [32, 64, 1, 32]
    - [47, 0.008]
  - - [32, 128, 1, 32]
    - [24, 0.016]
  - - [32, 256, 1, 32]
    - [9, 0.034]
  - - [32, 448, 1, 32]
    - [58, 0.052]
  - - [32, 704, 1, 32]
    - [81, 0.086]
  - - [32, 1024, 1, 32]
    - [81, 0.128]
  - - [32, 1408, 1, 32]
    - [81, 0.171]
  - - [32, 1856, 1, 32]
    - [81, 0.223]
  - - [32, 2368, 1, 32]
    - [58, 0.276]
  - - [32, 2944, 1, 32]
    - [42, 0.33]
  - - [32, 3584, 1, 32]
    - [42, 0.383]
  - - [32, 4288, 1, 32]
    - [42, 0.462]
  - - [32, 5056, 1, 32]
    - [58, 0.525]
  - - [32, 5888, 1, 32]
    - [58, 0.618]
  - - [32, 6784, 1, 32]
    - [58, 0.693]
  - - [64, 32, 1, 32]
    - [81, 0.007]
  - - [128, 32, 1, 32]
    - [155, 0.016]
  - - [256, 32, 1, 32]
    - [81, 0.031]
  - - [448, 32, 1, 32]
    - [81, 0.051]
  - - [704, 32, 1, 32]
    - [81, 0.085]
  - - [1024, 32, 1, 32]
    - [81, 0.122]
  - - [1408, 32, 1, 32]
    - [81, 0.164]
  - - [1856, 32, 1, 32]
    - [81, 0.214]
  - - [2368, 32, 1, 32]
    - [58, 0.271]
  - - [2944, 32, 1, 32]
    - [115, 0.317]
  - - [3584, 32, 1, 32]
    - [53, 0.379]
  - - [4288, 32, 1, 32]
    - [53, 0.446]
  - - [5056, 32, 1, 32]
    - [115, 0.516]
  - - [5888, 32, 1, 32]
    - [58, 0.606]
  - - [6784, 32, 1, 32]
    - [28, 0.675]
  - - [64, 64, 1, 1]
    - [8, 0.0]
  - - [256, 64, 1, 1]
    - [28, 0.002]
  - - [448, 64, 1, 1]
    - [24, 0.003]
  - - [704, 64, 1, 1]
    - [58, 0.005]
  - - [1408, 64, 1, 1]
    - [24, 0.009]
  - - [1856, 64, 1, 1]
    - [58, 0.012]
  - - [2368, 64, 1, 1]
    - [58, 0.015]
  - - [2944, 64, 1, 1]
    - [58, 0.018]
  - - [3584, 64, 1, 1]
    - [24, 0.022]
  - - [4288, 64, 1, 1]
    - [58, 0.026]
  - - [5056, 64, 1, 1]
    - [11, 0.03]
  - - [5888, 64, 1, 1]
    - [11, 0.035]
  - - [6784, 64, 1, 1]
    - [53, 0.038]
  - - [128, 128, 1, 1]
    - [8, 0.002]
  - - [448, 128, 1, 1]
    - [8, 0.006]
  - - [704, 128, 1, 1]
    - [24, 0.009]
  - - [1024, 128, 1, 1]
    - [53, 0.013]
  - - [1408, 128, 1, 1]
    - [58, 0.017]
  - - [1856, 128, 1, 1]
    - [58, 0.022]
  - - [2368, 128, 1, 1]
    - [103, 0.028]
  - - [2944, 128, 1, 1]
    - [156, 0.034]
  - - [3584, 128, 1, 1]
    - [53, 0.039]
  - - [4288, 128, 1, 1]
    - [11, 0.048]
  - - [5056, 128, 1, 1]
    - [11, 0.056]
  - - [5888, 128, 1, 1]
    - [157, 0.059]
  - - [6784, 128, 1, 1]
    - [54, 0.067]
  - - [64, 256, 1, 1]
    - [8, 0.002]
  - - [128, 256, 1, 1]
    - [8, 0.004]
  - - [256, 256, 1, 1]
    - [58, 0.007]
  - - [448, 256, 1, 1]
    - [28, 0.011]
  - - [704, 256, 1, 1]
    - [58, 0.017]
  - - [1408, 256, 1, 1]
    - [8, 0.032]
  - - [1856, 256, 1, 1]
    - [10, 0.04]
  - - [2368, 256, 1, 1]
    - [11, 0.05]
  - - [2944, 256, 1, 1]
    - [11, 0.061]
  - - [3584, 256, 1, 1]
    - [10, 0.069]
  - - [4288, 256, 1, 1]
    - [54, 0.079]
  - - [5056, 256, 1, 1]
    - [11, 0.084]
  - - [5888, 256, 1, 1]
    - [11, 0.095]
  - - [6784, 256, 1, 1]
    - [54, 0.102]
  - - [64, 448, 1, 1]
    - [58, 0.003]
  - - [128, 448, 1, 1]
    - [60, 0.006]
  - - [256, 448, 1, 1]
    - [58, 0.011]
  - - [448, 448, 1, 1]
    - [15, 0.019]
  - - [704, 448, 1, 1]
    - [103, 0.029]
  - - [1024, 448, 1, 1]
    - [11, 0.038]
  - - [1408, 448, 1, 1]
    - [53, 0.051]
  - - [1856, 448, 1, 1]
    - [11, 0.065]
  - - [2368, 448, 1, 1]
    - [11, 0.077]
  - - [2944, 448, 1, 1]
    - [10, 0.084]
  - - [3584, 448, 1, 1]
    - [11, 0.096]
  - - [4288, 448, 1, 1]
    - [13, 0.106]
  - - [5056, 448, 1, 1]
    - [11, 0.118]
  - - [5888, 448, 1, 1]
    - [154, 0.122]
  - - [6784, 448, 1, 1]
    - [10, 0.133]
  - - [64, 704, 1, 1]
    - [24, 0.005]
  - - [128, 704, 1, 1]
    - [24, 0.009]
  - - [256, 704, 1, 1]
    - [24, 0.017]
  - - [448, 704, 1, 1]
    - [24, 0.029]
  - - [704, 704, 1, 1]
    - [58, 0.041]
  - - [1024, 704, 1, 1]
    - [10, 0.056]
  - - [1408, 704, 1, 1]
    - [11, 0.072]
  - - [1856, 704, 1, 1]
    - [11, 0.083]
  - - [2368, 704, 1, 1]
    - [55, 0.098]
  - - [2944, 704, 1, 1]
    - [54, 0.111]
  - - [3584, 704, 1, 1]
    - [53, 0.12]
  - - [4288, 704, 1, 1]
    - [154, 0.131]
  - - [5056, 704, 1, 1]
    - [13, 0.138]
  - - [5888, 704, 1, 1]
    - [10, 0.149]
  - - [6784, 704, 1, 1]
    - [11, 0.156]
  - - [64, 1024, 1, 1]
    - [60, 0.007]
  - - [128, 1024, 1, 1]
    - [60, 0.013]
  - - [256, 1024, 1, 1]
    - [60, 0.025]
  - - [448, 1024, 1, 1]
    - [55, 0.039]
  - - [704, 1024, 1, 1]
    - [10, 0.056]
  - - [1408, 1024, 1, 1]
    - [11, 0.088]
  - - [1856, 1024, 1, 1]
    - [55, 0.106]
  - - [2368, 1024, 1, 1]
    - [11, 0.118]
  - - [2944, 1024, 1, 1]
    - [154, 0.134]
  - - [3584, 1024, 1, 1]
    - [53, 0.141]
  - - [4288, 1024, 1, 1]
    - [54, 0.151]
  - - [5056, 1024, 1, 1]
    - [154, 0.16]
  - - [5888, 1024, 1, 1]
    - [55, 0.165]
  - - [6784, 1024, 1, 1]
    - [10, 0.172]
  - - [64, 1408, 1, 1]
    - [24, 0.009]
  - - [128, 1408, 1, 1]
    - [28, 0.017]
  - - [256, 1408, 1, 1]
    - [53, 0.032]
  - - [448, 1408, 1, 1]
    - [53, 0.051]
  - - [704, 1408, 1, 1]
    - [54, 0.071]
  - - [1024, 1408, 1, 1]
    - [11, 0.088]
  - - [1408, 1408, 1, 1]
    - [54, 0.106]
  - - [1856, 1408, 1, 1]
    - [154, 0.12]
  - - [2368, 1408, 1, 1]
    - [54, 0.133]
  - - [2944, 1408, 1, 1]
    - [11, 0.151]
  - - [3584, 1408, 1, 1]
    - [154, 0.16]
  - - [4288, 1408, 1, 1]
    - [13, 0.165]
  - - [5056, 1408, 1, 1]
    - [11, 0.172]
  - - [5888, 1408, 1, 1]
    - [10, 0.179]
  - - [6784, 1408, 1, 1]
    - [11, 0.185]
  - - [64, 1856, 1, 1]
    - [28, 0.012]
  - - [128, 1856, 1, 1]
    - [8, 0.023]
  - - [256, 1856, 1, 1]
    - [28, 0.04]
  - - [448, 1856, 1, 1]
    - [154, 0.064]
  - - [704, 1856, 1, 1]
    - [11, 0.083]
  - - [1024, 1856, 1, 1]
    - [10, 0.103]
  - - [1408, 1856, 1, 1]
    - [154, 0.121]
  - - [1856, 1856, 1, 1]
    - [53, 0.135]
  - - [2368, 1856, 1, 1]
    - [10, 0.149]
  - - [2944, 1856, 1, 1]
    - [154, 0.157]
  - - [3584, 1856, 1, 1]
    - [11, 0.172]
  - - [4288, 1856, 1, 1]
    - [11, 0.178]
  - - [5056, 1856, 1, 1]
    - [10, 0.185]
  - - [5888, 1856, 1, 1]
    - [55, 0.187]
  - - [6784, 1856, 1, 1]
    - [11, 0.192]
  - - [64, 2368, 1, 1]
    - [58, 0.015]
  - - [128, 2368, 1, 1]
    - [24, 0.028]
  - - [256, 2368, 1, 1]
    - [154, 0.049]
  - - [448, 2368, 1, 1]
    - [54, 0.075]
  - - [704, 2368, 1, 1]
    - [10, 0.097]
  - - [1024, 2368, 1, 1]
    - [11, 0.116]
  - - [1408, 2368, 1, 1]
    - [10, 0.132]
  - - [1856, 2368, 1, 1]
    - [54, 0.15]
  - - [2368, 2368, 1, 1]
    - [154, 0.159]
  - - [2944, 2368, 1, 1]
    - [10, 0.174]
  - - [3584, 2368, 1, 1]
    - [11, 0.183]
  - - [4288, 2368, 1, 1]
    - [10, 0.188]
  - - [5056, 2368, 1, 1]
    - [11, 0.192]
  - - [5888, 2368, 1, 1]
    - [11, 0.197]
  - - [6784, 2368, 1, 1]
    - [10, 0.198]
  - - [64, 2944, 1, 1]
    - [58, 0.019]
  - - [128, 2944, 1, 1]
    - [60, 0.034]
  - - [256, 2944, 1, 1]
    - [10, 0.06]
  - - [448, 2944, 1, 1]
    - [53, 0.084]
  - - [704, 2944, 1, 1]
    - [10, 0.111]
  - - [1024, 2944, 1, 1]
    - [154, 0.128]
  - - [1408, 2944, 1, 1]
    - [10, 0.149]
  - - [1856, 2944, 1, 1]
    - [154, 0.159]
  - - [2368, 2944, 1, 1]
    - [10, 0.172]
  - - [2944, 2944, 1, 1]
    - [55, 0.18]
  - - [3584, 2944, 1, 1]
    - [11, 0.187]
  - - [4288, 2944, 1, 1]
    - [11, 0.193]
  - - [5056, 2944, 1, 1]
    - [55, 0.197]
  - - [5888, 2944, 1, 1]
    - [55, 0.199]
  - - [6784, 2944, 1, 1]
    - [11, 0.201]
  - - [64, 3584, 1, 1]
    - [28, 0.022]
  - - [128, 3584, 1, 1]
    - [156, 0.04]
  - - [448, 3584, 1, 1]
    - [54, 0.097]
  - - [704, 3584, 1, 1]
    - [53, 0.119]
  - - [1024, 3584, 1, 1]
    - [154, 0.139]
  - - [1408, 3584, 1, 1]
    - [154, 0.157]
  - - [1856, 3584, 1, 1]
    - [154, 0.167]
  - - [2368, 3584, 1, 1]
    - [11, 0.179]
  - - [2944, 3584, 1, 1]
    - [10, 0.185]
  - - [3584, 3584, 1, 1]
    - [54, 0.193]
  - - [4288, 3584, 1, 1]
    - [154, 0.197]
  - - [5056, 3584, 1, 1]
    - [10, 0.201]
  - - [5888, 3584, 1, 1]
    - [10, 0.204]
  - - [6784, 3584, 1, 1]
    - [55, 0.206]
  - - [64, 4288, 1, 1]
    - [58, 0.026]
  - - [128, 4288, 1, 1]
    - [11, 0.049]
  - - [256, 4288, 1, 1]
    - [11, 0.08]
  - - [448, 4288, 1, 1]
    - [55, 0.108]
  - - [704, 4288, 1, 1]
    - [10, 0.133]
  - - [1024, 4288, 1, 1]
    - [54, 0.151]
  - - [1408, 4288, 1, 1]
    - [54, 0.165]
  - - [1856, 4288, 1, 1]
    - [11, 0.177]
  - - [2368, 4288, 1, 1]
    - [13, 0.185]
  - - [2944, 4288, 1, 1]
    - [13, 0.191]
  - - [3584, 4288, 1, 1]
    - [13, 0.197]
  - - [4288, 4288, 1, 1]
    - [10, 0.202]
  - - [5056, 4288, 1, 1]
    - [55, 0.206]
  - - [5888, 4288, 1, 1]
    - [11, 0.208]
  - - [6784, 4288, 1, 1]
    - [55, 0.208]
  - - [64, 5056, 1, 1]
    - [103, 0.03]
  - - [128, 5056, 1, 1]
    - [11, 0.055]
  - - [256, 5056, 1, 1]
    - [11, 0.085]
  - - [448, 5056, 1, 1]
    - [11, 0.118]
  - - [704, 5056, 1, 1]
    - [54, 0.138]
  - - [1024, 5056, 1, 1]
    - [11, 0.157]
  - - [1408, 5056, 1, 1]
    - [11, 0.173]
  - - [1856, 5056, 1, 1]
    - [11, 0.182]
  - - [2368, 5056, 1, 1]
    - [11, 0.19]
  - - [2944, 5056, 1, 1]
    - [10, 0.196]
  - - [3584, 5056, 1, 1]
    - [10, 0.203]
  - - [4288, 5056, 1, 1]
    - [11, 0.205]
  - - [5056, 5056, 1, 1]
    - [13, 0.206]
  - - [5888, 5056, 1, 1]
    - [10, 0.21]
  - - [6784, 5056, 1, 1]
    - [11, 0.21]
  - - [64, 5888, 1, 1]
    - [15, 0.034]
  - - [128, 5888, 1, 1]
    - [11, 0.061]
  - - [448, 5888, 1, 1]
    - [158, 0.121]
  - - [704, 5888, 1, 1]
    - [11, 0.15]
  - - [1024, 5888, 1, 1]
    - [154, 0.16]
  - - [1408, 5888, 1, 1]
    - [11, 0.178]
  - - [1856, 5888, 1, 1]
    - [13, 0.186]
  - - [2368, 5888, 1, 1]
    - [10, 0.196]
  - - [2944, 5888, 1, 1]
    - [10, 0.201]
  - - [3584, 5888, 1, 1]
    - [10, 0.205]
  - - [4288, 5888, 1, 1]
    - [10, 0.207]
  - - [5056, 5888, 1, 1]
    - [11, 0.21]
  - - [5888, 5888, 1, 1]
    - [10, 0.212]
  - - [6784, 5888, 1, 1]
    - [55, 0.212]
  - - [64, 6784, 1, 1]
    - [24, 0.038]
  - - [128, 6784, 1, 1]
    - [54, 0.067]
  - - [256, 6784, 1, 1]
    - [11, 0.1]
  - - [448, 6784, 1, 1]
    - [63, 0.133]
  - - [704, 6784, 1, 1]
    - [11, 0.155]
  - - [1024, 6784, 1, 1]
    - [154, 0.169]
  - - [1408, 6784, 1, 1]
    - [54, 0.182]
  - - [1856, 6784, 1, 1]
    - [55, 0.19]
  - - [2368, 6784, 1, 1]
    - [10, 0.2]
  - - [2944, 6784, 1, 1]
    - [11, 0.203]
  - - [3584, 6784, 1, 1]
    - [55, 0.208]
  - - [4288, 6784, 1, 1]
    - [11, 0.209]
  - - [5056, 6784, 1, 1]
    - [10, 0.211]
  - - [5888, 6784, 1, 1]
    - [55, 0.214]
  - - [6784, 6784, 1, 1]
    - [55, 0.213]
  - - [1152, 1152, 1, 1024]
    - [159, 39.26]
  - - [8192, 8192, 1, 1024]
    - [162, 76.47]
  - - [12288, 12288, 1, 1024]
    - [163, 78.678]
  - - [16384, 16384, 1, 1024]
    - [164, 77.231]
  - - [20480, 20480, 1, 1024]
    - [165, 79.707]
  - - [24576, 24576, 1, 1024]
    - [166, 79.294]
  - - [28672, 28672, 1, 1024]
    - [167, 79.885]
  - - [32768, 32768, 1, 1024]
    - [168, 71.805]
  - - [36864, 36864, 1, 1024]
    - [167, 79.756]
  - - [40960, 40960, 1, 1024]
    - [167, 79.106]
  - - [45056, 45056, 1, 1024]
    - [167, 79.488]
  - - [49152, 49152, 1, 1024]
    - [169, 76.406]
  - - [53248, 53248, 1, 1024]
    - [167, 78.916]
  - - [57344, 57344, 1, 1024]
    - [167, 78.209]
  - - [61440, 61440, 1, 1024]
    - [170, 78.271]
  - - [65536, 65536, 1, 1024]
    - [171, 60.66]
  - - [69632, 69632, 1, 1024]
    - [167, 77.434]
  - - [73728, 73728, 1, 1024]
    - [167, 76.497]
  - - [77824, 77824, 1, 1024]
    - [167, 76.013]
  - - [81920, 81920, 1, 1024]
    - [172, 72.715]
  - - [86016, 86016, 1, 1024]
    - [167, 74.154]
  - - [90112, 90112, 1, 1024]
    - [167, 73.356]
  - - [1152, 1152, 1, 2048]
    - [173, 50.366]
  - - [2176, 2176, 1, 2048]
    - [174, 65.306]
  - - [4096, 4096, 1, 2048]
    - [161, 73.879]
  - - [8192, 8192, 1, 2048]
    - [175, 79.726]
  - - [12288, 12288, 1, 2048]
    - [176, 81.442]
  - - [16384, 16384, 1, 2048]
    - [177, 80.134]
  - - [20480, 20480, 1, 2048]
    - [178, 80.474]
  - - [24576, 24576, 1, 2048]
    - [179, 80.197]
  - - [28672, 28672, 1, 2048]
    - [178, 80.434]
  - - [32768, 32768, 1, 2048]
    - [180, 78.251]
  - - [36864, 36864, 1, 2048]
    - [178, 80.25]
  - - [40960, 40960, 1, 2048]
    - [181, 79.891]
  - - [45056, 45056, 1, 2048]
    - [182, 79.877]
  - - [49152, 49152, 1, 2048]
    - [183, 79.497]
  - - [53248, 53248, 1, 2048]
    - [184, 79.472]
  - - [57344, 57344, 1, 2048]
    - [185, 79.213]
  - - [61440, 61440, 1, 2048]
    - [186, 80.278]
  - - [65536, 65536, 1, 2048]
    - [187, 72.983]
  - - [69632, 69632, 1, 2048]
    - [188, 78.679]
  - - [73728, 73728, 1, 2048]
    - [189, 78.274]
  - - [77824, 77824, 1, 2048]
    - [189, 78.028]
  - - [81920, 81920, 1, 2048]
    - [190, 77.424]
  - - [86016, 86016, 1, 2048]
    - [189, 77.042]
  - - [90112, 90112, 1, 2048]
    - [191, 78.42]
- null
