library/src/blas3/Tensile/Logic/asm_full/aldebaran/aldebaran_Cijk_AlikC_Bjlk_CB.yaml
- {MinimumRequiredVersion: 4.21.0}
- aldebaran
- gfx90a
- [Device 0050, Device 0051, Device 0052, Device 0054, Device 0062, Device 7400, Device
    SolutionIndex: 0
    SolutionNameMin: Cijk_AlikC_Bjlk_CB_MT128x128x8_MI16x16x4x1_SE_1LDSB1_IU2_SIA2_SRVW0
    SolutionIndex: 1
    SolutionNameMin: Cijk_AlikC_Bjlk_CB_MT128x64x8_MI16x16x4x1_SE_1LDSB0_IU2_SIA2_SRVW2
    SolutionIndex: 2
    SolutionNameMin: Cijk_AlikC_Bjlk_CB_MT32x64x32_MI16x16x4x1_SE_1LDSB0_IU1_SIA3_SRVW2
    SolutionIndex: 3
    SolutionNameMin: Cijk_AlikC_Bjlk_CB_MT64x64x8_MI16x16x4x1_SE_1LDSB1_IU2_SIA2_SRVW2
    SolutionIndex: 4
    SolutionNameMin: Cijk_AlikC_Bjlk_CB_MT128x128x8_MI16x16x4x1_SE_1LDSB1_IU2_SIA2_SRVW2
    SolutionIndex: 5
    SolutionNameMin: Cijk_AlikC_Bjlk_CB_MT64x64x8_MI16x16x4x1_SE_1LDSB0_IU2_SIA2_SRVW0
    SolutionIndex: 6
    SolutionNameMin: Cijk_AlikC_Bjlk_CB_MT64x64x16_MI16x16x4x1_SE_1LDSB0_IU1_SIA3_SRVW0
    SolutionIndex: 7
    SolutionNameMin: Cijk_AlikC_Bjlk_CB_MT64x64x16_MI16x16x4x1_SN_LRVW2_NEPBS0_PLR5_SU32_SUS256_TT2_32_WG32_8_1_WGM2
    SolutionIndex: 8
    SolutionNameMin: Cijk_AlikC_Bjlk_CB_MT256x64x8_MI32x32x2x1_SN_LRVW2_NEPBS0_PLR5_SU0_SUS0_TT2_64_WG128_2_1_WGM8
    SolutionIndex: 9
    SolutionNameMin: Cijk_AlikC_Bjlk_CB_MT256x64x8_MI32x32x2x1_SN_LRVW2_NEPBS0_PLR5_SU0_SUS0_TT2_64_WG128_2_1_WGM2
    SolutionIndex: 10
    SolutionNameMin: Cijk_AlikC_Bjlk_CB_MT256x64x8_MI32x32x2x1_SN_LRVW2_NEPBS0_PLR5_SU32_SUS256_TT2_64_WG128_2_1_WGM2
    SolutionIndex: 11
    SolutionNameMin: Cijk_AlikC_Bjlk_CB_MT256x64x8_MI32x32x2x1_SN_LRVW2_NEPBS0_PLR5_SU0_SUS0_TT2_64_WG128_2_1_WGM12
    SolutionIndex: 12
    SolutionNameMin: Cijk_AlikC_Bjlk_CB_MT256x64x8_MI32x32x2x1_SN_LRVW2_NEPBS0_PLR5_SU32_SUS256_TT2_64_WG128_2_1_WGM12
    SolutionIndex: 13
    SolutionNameMin: Cijk_AlikC_Bjlk_CB_MT128x64x8_MI16x16x4x1_SN_LRVW1_NEPBS0_PLR1_SU0_SUS0_TT2_64_WG64_4_1_WGM12
    SolutionIndex: 14
    SolutionNameMin: Cijk_AlikC_Bjlk_CB_MT64x64x16_MI16x16x4x1_SN_LRVW2_NEPBS0_PLR5_SU0_SUS0_TT2_32_WG32_8_1_WGM5
    SolutionIndex: 15
    SolutionNameMin: Cijk_AlikC_Bjlk_CB_MT64x64x16_MI16x16x4x1_SN_LRVW2_NEPBS0_PLR5_SU0_SUS0_TT2_32_WG32_8_1_WGM2
    SolutionIndex: 16
    SolutionNameMin: Cijk_AlikC_Bjlk_CB_MT128x64x8_MI16x16x4x1_SN_LRVW1_NEPBS0_PLR1_SU0_SUS0_TT2_64_WG64_4_1_WGM6
    SolutionIndex: 17
    SolutionNameMin: Cijk_AlikC_Bjlk_CB_MT128x64x8_MI16x16x4x1_SN_LRVW1_NEPBS0_PLR1_SU0_SUS0_TT2_64_WG64_4_1_WGM8
    SolutionIndex: 18
    SolutionNameMin: Cijk_AlikC_Bjlk_CB_MT128x64x8_MI16x16x4x1_SN_LRVW1_NEPBS1_PLR1_SU0_SUS0_TT2_64_WG64_4_1_WGM10
    SolutionIndex: 19
    SolutionNameMin: Cijk_AlikC_Bjlk_CB_MT128x64x8_MI16x16x4x1_SN_LRVW1_NEPBS1_PLR1_SU0_SUS0_TT2_64_WG64_4_1_WGM12
    SolutionIndex: 20
    SolutionNameMin: Cijk_AlikC_Bjlk_CB_MT128x64x8_MI16x16x4x1_SN_LRVW1_NEPBS1_PLR1_SU0_SUS0_TT2_64_WG64_4_1_WGM8
    SolutionIndex: 21
    SolutionNameMin: Cijk_AlikC_Bjlk_CB_MT64x64x16_MI16x16x4x1_SN_LRVW2_NEPBS1_PLR5_SU0_SUS0_TT2_32_WG32_8_1_WGM4
    SolutionIndex: 22
    SolutionNameMin: Cijk_AlikC_Bjlk_CB_MT64x64x16_MI16x16x4x1_SN_LRVW2_NEPBS1_PLR5_SU32_SUS256_TT2_32_WG32_8_1_WGM8
    SolutionIndex: 23
    SolutionNameMin: Cijk_AlikC_Bjlk_CB_MT64x64x16_MI16x16x4x1_SN_LRVW2_NEPBS1_PLR5_SU32_SUS256_TT2_32_WG32_8_1_WGM6
    SolutionIndex: 24
    SolutionNameMin: Cijk_AlikC_Bjlk_CB_MT64x64x16_MI16x16x4x1_SN_LRVW2_NEPBS1_PLR5_SU32_SUS256_TT2_32_WG32_8_1_WGM7
    SolutionIndex: 25
    SolutionNameMin: Cijk_AlikC_Bjlk_CB_MT128x64x8_MI16x16x4x1_SN_LRVW1_NEPBS1_PLR1_SU0_SUS0_TT2_64_WG64_4_1_WGM2
    SolutionIndex: 26
    SolutionNameMin: Cijk_AlikC_Bjlk_CB_MT64x64x16_MI16x16x4x1_SN_LRVW2_NEPBS1_PLR5_SU32_SUS256_TT2_32_WG32_8_1_WGM12
    SolutionIndex: 27
    SolutionNameMin: Cijk_AlikC_Bjlk_CB_MT128x64x8_MI16x16x4x1_SN_LRVW1_NEPBS0_PLR1_SU0_SUS0_TT2_64_WG64_4_1_WGM4
    SolutionIndex: 28
    SolutionNameMin: Cijk_AlikC_Bjlk_CB_MT64x64x16_MI16x16x4x1_SN_LRVW2_NEPBS1_PLR5_SU0_SUS0_TT2_32_WG32_8_1_WGM10
    SolutionIndex: 29
    SolutionNameMin: Cijk_AlikC_Bjlk_CB_MT64x64x16_MI16x16x4x1_SN_LRVW2_NEPBS1_PLR5_SU0_SUS0_TT2_32_WG32_8_1_WGM5
    SolutionIndex: 30
    SolutionNameMin: Cijk_AlikC_Bjlk_CB_MT64x64x16_MI16x16x4x1_SN_LRVW2_NEPBS1_PLR5_SU0_SUS0_TT2_32_WG32_8_1_WGM6
    SolutionIndex: 31
    SolutionNameMin: Cijk_AlikC_Bjlk_CB_MT128x64x8_MI16x16x4x1_SN_LRVW1_NEPBS1_PLR1_SU0_SUS0_TT2_64_WG64_4_1_WGM6
    SolutionIndex: 32
    SolutionNameMin: Cijk_AlikC_Bjlk_CB_MT64x64x16_MI16x16x4x1_SN_LRVW2_NEPBS1_PLR5_SU0_SUS0_TT2_32_WG32_8_1_WGM7
    SolutionIndex: 33
    SolutionNameMin: Cijk_AlikC_Bjlk_CB_MT64x64x16_MI16x16x4x1_SN_LRVW2_NEPBS1_PLR5_SU0_SUS0_TT2_32_WG32_8_1_WGM12
    SolutionIndex: 34
    SolutionNameMin: Cijk_AlikC_Bjlk_CB_MT128x64x8_MI16x16x4x1_SN_LRVW1_NEPBS0_PLR1_SU0_SUS0_TT2_64_WG64_4_1_WGM5
    SolutionIndex: 35
    SolutionNameMin: Cijk_AlikC_Bjlk_CB_MT64x64x16_MI16x16x4x1_SN_LRVW2_NEPBS1_PLR5_SU0_SUS0_TT2_32_WG32_8_1_WGM8
    SolutionIndex: 36
    SolutionNameMin: Cijk_AlikC_Bjlk_CB_MT128x64x8_MI16x16x4x1_SN_LRVW1_NEPBS0_PLR1_SU0_SUS0_TT2_64_WG64_4_1_WGM7
    SolutionIndex: 37
    SolutionNameMin: Cijk_AlikC_Bjlk_CB_MT64x64x16_MI16x16x4x1_SN_LRVW2_NEPBS0_PLR5_SU0_SUS0_TT2_32_WG32_8_1_WGM8
    SolutionIndex: 38
    SolutionNameMin: Cijk_AlikC_Bjlk_CB_MT64x64x16_MI16x16x4x1_SN_LRVW2_PLR5_TT2_32_WG32_8_1_WGM4
    SolutionIndex: 39
    SolutionNameMin: Cijk_AlikC_Bjlk_CB_MT128x64x8_MI16x16x4x1_SN_LRVW1_PLR1_TT2_64_WG64_4_1_WGM7
    SolutionIndex: 40
    SolutionNameMin: Cijk_AlikC_Bjlk_CB_MT128x64x8_MI16x16x4x1_SN_LRVW1_PLR1_TT2_64_WG64_4_1_WGM6
    SolutionIndex: 41
    SolutionNameMin: Cijk_AlikC_Bjlk_CB_MT128x64x8_MI16x16x4x1_SN_LRVW1_PLR1_TT2_64_WG64_4_1_WGM4
    SolutionIndex: 42
    SolutionNameMin: Cijk_AlikC_Bjlk_CB_MT128x64x8_MI16x16x4x1_SN_LRVW1_PLR1_TT2_64_WG64_4_1_WGM5
    SolutionIndex: 43
    SolutionNameMin: Cijk_AlikC_Bjlk_CB_MT128x64x8_MI16x16x4x1_SN_LRVW1_PLR1_TT2_64_WG64_4_1_WGM8
    SolutionIndex: 44
    SolutionNameMin: Cijk_AlikC_Bjlk_CB_MT256x64x8_MI32x32x2x1_SN_LRVW2_PLR5_TT2_64_WG128_2_1_WGM8
    SolutionIndex: 45
    SolutionNameMin: Cijk_AlikC_Bjlk_CB_MT256x64x8_MI32x32x2x1_SN_LRVW2_PLR5_TT2_64_WG128_2_1_WGM7
- - - [7680, 8192, 1, 8192]
    - [0, 99.184]
  - - [960, 1024, 1, 1024]
    - [3, 93.733]
  - - [1920, 2048, 1, 2048]
    - [1, 97.339]
  - - [3840, 4096, 1, 4096]
    - [4, 98.692]
  - - [1, 1, 1, 256]
    - [5, 0.0]
  - - [480, 512, 1, 512]
    - [2, 61.367]
  - - [64, 64, 1, 256]
    - [6, 0.515]
  - - [64, 64, 2, 64]
    - [5, 0.563]
  - - [1, 64, 1, 256]
    - [5, 0.012]
  - - [64, 1, 1, 256]
    - [5, 0.012]
  - - [2001, 2001, 1, 51]
    - [7, 44.597]
  - - [3001, 3001, 1, 51]
    - [8, 52.945]
  - - [4454, 4454, 1, 51]
    - [9, 68.21]
  - - [6454, 6454, 1, 51]
    - [9, 76.248]
  - - [7985, 7985, 1, 51]
    - [9, 75.617]
  - - [9603, 9603, 1, 51]
    - [10, 74.631]
  - - [11505, 11505, 1, 51]
    - [9, 71.05]
  - - [13179, 13179, 1, 51]
    - [11, 72.978]
  - - [15420, 15420, 1, 51]
    - [11, 82.638]
  - - [17445, 17445, 1, 51]
    - [12, 72.071]
  - - [19343, 19343, 1, 51]
    - [11, 71.602]
  - - [21581, 21581, 1, 51]
    - [11, 72.185]
  - - [25854, 25854, 1, 51]
    - [11, 74.097]
  - - [30421, 30421, 1, 51]
    - [11, 70.631]
  - - [35882, 35882, 1, 51]
    - [11, 75.325]
  - - [40401, 40401, 1, 51]
    - [11, 72.046]
  - - [45312, 45312, 1, 51]
    - [13, 92.231]
  - - [51821, 51821, 1, 51]
    - [11, 71.503]
  - - [60766, 60766, 1, 51]
    - [11, 75.794]
  - - [67143, 67143, 1, 51]
    - [11, 72.39]
  - - [2001, 2001, 1, 103]
    - [14, 70.143]
  - - [3001, 3001, 1, 103]
    - [15, 81.39]
  - - [4454, 4454, 1, 103]
    - [16, 89.786]
  - - [6454, 6454, 1, 103]
    - [17, 92.18]
  - - [7985, 7985, 1, 103]
    - [17, 93.358]
  - - [9603, 9603, 1, 103]
    - [18, 93.431]
  - - [11505, 11505, 1, 103]
    - [19, 95.219]
  - - [13179, 13179, 1, 103]
    - [19, 95.52]
  - - [15420, 15420, 1, 103]
    - [17, 96.004]
  - - [17445, 17445, 1, 103]
    - [19, 95.768]
  - - [19343, 19343, 1, 103]
    - [20, 95.865]
  - - [21581, 21581, 1, 103]
    - [18, 96.199]
  - - [25854, 25854, 1, 103]
    - [13, 96.872]
  - - [30421, 30421, 1, 103]
    - [19, 96.615]
  - - [35882, 35882, 1, 103]
    - [13, 96.752]
  - - [40401, 40401, 1, 103]
    - [19, 96.771]
  - - [45312, 45312, 1, 103]
    - [13, 97.169]
  - - [51821, 51821, 1, 103]
    - [18, 96.877]
  - - [60766, 60766, 1, 103]
    - [13, 96.998]
  - - [67143, 67143, 1, 103]
    - [19, 96.936]
  - - [2001, 2001, 1, 223]
    - [21, 82.36]
  - - [3001, 3001, 1, 223]
    - [22, 89.78]
  - - [4454, 4454, 1, 223]
    - [38, 93.531]
  - - [6454, 6454, 1, 223]
    - [23, 95.648]
  - - [7985, 7985, 1, 223]
    - [22, 96.162]
  - - [9603, 9603, 1, 223]
    - [22, 95.469]
  - - [11505, 11505, 1, 223]
    - [25, 96.721]
  - - [13179, 13179, 1, 223]
    - [25, 97.101]
  - - [15420, 15420, 1, 223]
    - [24, 97.171]
  - - [17445, 17445, 1, 223]
    - [26, 96.987]
  - - [19343, 19343, 1, 223]
    - [26, 96.906]
  - - [2001, 2001, 1, 511]
    - [27, 87.076]
  - - [3001, 3001, 1, 511]
    - [28, 93.185]
  - - [4454, 4454, 1, 511]
    - [21, 95.446]
  - - [6454, 6454, 1, 511]
    - [21, 96.809]
  - - [7985, 7985, 1, 511]
    - [29, 97.059]
  - - [9603, 9603, 1, 511]
    - [30, 96.062]
  - - [11505, 11505, 1, 511]
    - [31, 97.268]
  - - [13179, 13179, 1, 511]
    - [18, 97.614]
  - - [15420, 15420, 1, 511]
    - [32, 97.661]
  - - [17445, 17445, 1, 511]
    - [33, 97.45]
  - - [19343, 19343, 1, 511]
    - [28, 97.306]
  - - [2001, 2001, 1, 2201]
    - [34, 92.28]
  - - [3001, 3001, 1, 2201]
    - [28, 95.273]
  - - [4454, 4454, 1, 2201]
    - [28, 96.543]
  - - [6454, 6454, 1, 2201]
    - [35, 97.466]
  - - [7985, 7985, 1, 2201]
    - [30, 97.569]
  - - [9603, 9603, 1, 2201]
    - [29, 96.415]
  - - [11505, 11505, 1, 2201]
    - [13, 97.522]
  - - [13179, 13179, 1, 2201]
    - [17, 97.832]
  - - [15420, 15420, 1, 2201]
    - [32, 97.906]
  - - [17445, 17445, 1, 2201]
    - [30, 97.681]
  - - [19343, 19343, 1, 2201]
    - [28, 97.52]
  - - [2001, 2001, 1, 4101]
    - [36, 92.935]
  - - [3001, 3001, 1, 4101]
    - [37, 95.65]
  - - [4454, 4454, 1, 4101]
    - [21, 96.755]
  - - [6454, 6454, 1, 4101]
    - [29, 97.605]
  - - [7985, 7985, 1, 4101]
    - [29, 97.681]
  - - [9603, 9603, 1, 4101]
    - [30, 96.519]
  - - [11505, 11505, 1, 4101]
    - [13, 97.606]
  - - [13179, 13179, 1, 4101]
    - [17, 97.912]
  - - [15420, 15420, 1, 4101]
    - [30, 97.995]
  - - [17445, 17445, 1, 4101]
    - [29, 97.761]
  - - [19343, 19343, 1, 4101]
    - [35, 97.599]
  - - [21581, 21581, 1, 223]
    - [39, 97.003]
  - - [21581, 21581, 1, 511]
    - [40, 97.345]
  - - [21581, 21581, 1, 2201]
    - [24, 97.507]
  - - [21581, 21581, 1, 4101]
    - [23, 97.601]
  - - [25854, 25854, 1, 223]
    - [40, 97.595]
  - - [25854, 25854, 1, 511]
    - [39, 97.929]
  - - [25854, 25854, 1, 2201]
    - [41, 98.041]
  - - [25854, 25854, 1, 4101]
    - [42, 98.109]
  - - [30421, 30421, 1, 223]
    - [43, 97.315]
  - - [30421, 30421, 1, 511]
    - [40, 97.622]
  - - [30421, 30421, 1, 2201]
    - [44, 97.752]
  - - [30421, 30421, 1, 4101]
    - [22, 97.802]
  - - [35882, 35882, 1, 223]
    - [43, 97.353]
  - - [35882, 35882, 1, 511]
    - [23, 97.704]
  - - [35882, 35882, 1, 2201]
    - [38, 97.882]
  - - [35882, 35882, 1, 4101]
    - [38, 97.967]
  - - [40401, 40401, 1, 223]
    - [39, 97.432]
  - - [40401, 40401, 1, 511]
    - [42, 97.722]
  - - [40401, 40401, 1, 2201]
    - [44, 97.847]
  - - [40401, 40401, 1, 4101]
    - [24, 97.873]
  - - [45312, 45312, 1, 223]
    - [39, 97.707]
  - - [45312, 45312, 1, 511]
    - [39, 97.98]
  - - [45312, 45312, 1, 2201]
    - [45, 98.105]
  - - [45312, 45312, 1, 4101]
    - [41, 98.127]
  - - [51821, 51821, 1, 223]
    - [42, 97.626]
  - - [51821, 51821, 1, 511]
    - [43, 97.909]
  - - [51821, 51821, 1, 2201]
    - [39, 97.991]
  - - [51821, 51821, 1, 4101]
    - [43, 98.055]
  - - [60766, 60766, 1, 223]
    - [43, 97.606]
  - - [60766, 60766, 1, 511]
    - [41, 97.882]
  - - [60766, 60766, 1, 2201]
    - [40, 97.961]
  - - [60766, 60766, 1, 4101]
    - [43, 98.024]
  - - [67143, 67143, 1, 223]
    - [43, 97.557]
  - - [67143, 67143, 1, 511]
    - [40, 97.828]
  - - [67143, 67143, 1, 2201]
    - [43, 97.906]
  - - [67143, 67143, 1, 4101]
    - [43, 97.969]
- null
