library/src/blas3/Tensile/Logic/asm_full/aldebaran/aldebaran_Cijk_AlikC_Bljk_ZB.yaml
- {MinimumRequiredVersion: 4.28.0}
- aldebaran
- gfx90a
- [Device 7400, Device 7408, Device 740c]
    SolutionIndex: 0
    SolutionNameMin: Cijk_AlikC_Bljk_ZB_MT16x16x16_MI16x16x4x1_SN_1LDSB1_IU4_SIA2_TT1_16_WG16_4_1
    SolutionIndex: 1
    SolutionNameMin: Cijk_AlikC_Bljk_ZB_MT64x96x16_MI16x16x4x1_SN_ASGT_LWPMn1_NEPBS0_SU16_SUS256_WGM5
    SolutionIndex: 2
    SolutionNameMin: Cijk_AlikC_Bljk_ZB_MT64x96x16_MI16x16x4x1_SN_ASGT332_LWPMn1_NEPBS0_SU32_SUS256_WGM3
    SolutionIndex: 3
    SolutionNameMin: Cijk_AlikC_Bljk_ZB_MT64x96x16_MI16x16x4x1_SN_ASGT332_LWPM0p50_NEPBS0_SU32_SUS256_WGM3
    SolutionIndex: 4
    SolutionNameMin: Cijk_AlikC_Bljk_ZB_MT64x96x16_MI16x16x4x1_SN_ASGT_LWPM0p50_NEPBS0_SU32_SUS256_WGM5
    SolutionIndex: 5
    SolutionNameMin: Cijk_AlikC_Bljk_ZB_MT64x96x16_MI16x16x4x1_SN_ASGT_LWPM0p50_NEPBS0_SU0_SUS0_WGM5
    SolutionIndex: 6
    SolutionNameMin: Cijk_AlikC_Bljk_ZB_MT64x96x16_MI16x16x4x1_SN_ASGT_LWPM0p50_NEPBS0_SU32_SUS256_WGM3
    SolutionIndex: 7
    SolutionNameMin: Cijk_AlikC_Bljk_ZB_MT64x96x16_MI16x16x4x1_SN_ASGT332_LWPM0p50_NEPBS0_SU0_SUS0_WGM3
    SolutionIndex: 8
    SolutionNameMin: Cijk_AlikC_Bljk_ZB_MT64x96x16_MI16x16x4x1_SN_ASGT_LWPM0p50_NEPBS0_SU16_SUS256_WGM7
    SolutionIndex: 9
    SolutionNameMin: Cijk_AlikC_Bljk_ZB_MT64x96x16_MI16x16x4x1_SN_ASGT332_LWPM0p50_NEPBS0_SU32_SUS256_WGM5
    SolutionIndex: 10
    SolutionNameMin: Cijk_AlikC_Bljk_ZB_MT64x96x16_MI16x16x4x1_SN_ASGT_LWPM0p50_NEPBS0_SU0_SUS0_WGM3
    SolutionIndex: 11
    SolutionNameMin: Cijk_AlikC_Bljk_ZB_MT64x96x16_MI16x16x4x1_SN_ASGT332_LWPMn1_NEPBS0_SU0_SUS0_WGM7
    SolutionIndex: 12
    SolutionNameMin: Cijk_AlikC_Bljk_ZB_MT64x96x16_MI16x16x4x1_SN_ASGT_LWPM0p50_NEPBS0_SU16_SUS256_WGM3
    SolutionIndex: 13
    SolutionNameMin: Cijk_AlikC_Bljk_ZB_MT64x96x16_MI16x16x4x1_SN_ASGT_LWPM0p50_NEPBS0_SU4_SUS256_WGM3
    SolutionIndex: 14
    SolutionNameMin: Cijk_AlikC_Bljk_ZB_MT64x96x16_MI16x16x4x1_SN_ASGT_LWPM0p50_NEPBS0_SU4_SUS256_WGM7
    SolutionIndex: 15
    SolutionNameMin: Cijk_AlikC_Bljk_ZB_MT64x96x16_MI16x16x4x1_SN_ASGT_LWPMn1_NEPBS0_SU4_SUS256_WGM3
    SolutionIndex: 16
    SolutionNameMin: Cijk_AlikC_Bljk_ZB_MT64x96x16_MI16x16x4x1_SN_ASGT_LWPMn1_NEPBS0_SU32_SUS256_WGM7
    SolutionIndex: 17
    SolutionNameMin: Cijk_AlikC_Bljk_ZB_MT64x96x16_MI16x16x4x1_SN_ASGT_LWPMn1_NEPBS0_SU0_SUS0_WGM3
    SolutionIndex: 18
    SolutionNameMin: Cijk_AlikC_Bljk_ZB_MT64x96x16_MI16x16x4x1_SN_ASGT_LWPM0p50_NEPBS0_SU32_SUS256_WGM7
    SolutionIndex: 19
    SolutionNameMin: Cijk_AlikC_Bljk_ZB_MT16x16x64_MI16x16x4x1_SN_1LDSB1_FL1_GSU60_LBSPP1024_MIAV0_PLR5_TT1_16_WG16_4_4
    SolutionIndex: 20
    SolutionNameMin: Cijk_AlikC_Bljk_ZB_MT16x16x64_MI16x16x4x1_SN_1LDSB1_FL0_GSU40_LBSPP1024_MIAV1_PLR5_TT1_16_WG16_4_4
    SolutionIndex: 21
    SolutionNameMin: Cijk_AlikC_Bljk_ZB_MT16x16x64_MI16x16x4x1_SN_1LDSB1_FL0_GSU35_LBSPP1024_MIAV0_PLR5_TT1_16_WG16_4_4
    SolutionIndex: 22
    SolutionNameMin: Cijk_AlikC_Bljk_ZB_MT16x16x64_MI16x16x4x1_SN_1LDSB1_FL0_GSU25_LBSPP1024_MIAV1_PLR5_TT1_16_WG16_4_4
    SolutionIndex: 23
    SolutionNameMin: Cijk_AlikC_Bljk_ZB_MT16x16x64_MI16x16x4x1_SN_1LDSB1_FL2_GSU25_LBSPP1024_MIAV1_PLR5_TT1_16_WG16_4_4
    SolutionIndex: 24
    SolutionNameMin: Cijk_AlikC_Bljk_ZB_MT16x16x64_MI16x16x4x1_SN_1LDSB1_FL1_GSU16_LBSPP1024_MIAV1_PLR5_TT1_16_WG16_4_4
    SolutionIndex: 25
    SolutionNameMin: Cijk_AlikC_Bljk_ZB_MT16x16x64_MI16x16x4x1_SN_1LDSB1_FL0_GSU20_LBSPP1024_MIAV1_PLR5_TT1_16_WG16_4_4
    SolutionIndex: 26
    SolutionNameMin: Cijk_AlikC_Bljk_ZB_MT16x16x64_MI16x16x4x1_SN_1LDSB1_FL0_GSU30_LBSPP1024_MIAV1_PLR5_TT1_16_WG16_4_4
    SolutionIndex: 27
    SolutionNameMin: Cijk_AlikC_Bljk_ZB_MT16x16x64_MI16x16x4x1_SN_1LDSB1_FL1_GSU30_LBSPP1024_MIAV0_PLR5_TT1_16_WG16_4_4
    SolutionIndex: 28
    SolutionNameMin: Cijk_AlikC_Bljk_ZB_MT8x8x16_MI4x4x4x4_SN_1LDSB0_FL2_GSU17_LBSPP256_MIAV0_PLR5_TT1_4_WG8_8_1
    SolutionIndex: 29
    SolutionNameMin: Cijk_AlikC_Bljk_ZB_MT16x16x32_MI16x16x4x1_SN_1LDSB1_FL2_GSU25_LBSPP512_MIAV0_PLR2_TT1_16_WG16_4_4
    SolutionIndex: 30
    SolutionNameMin: Cijk_AlikC_Bljk_ZB_MT16x16x32_MI16x16x4x1_SN_1LDSB0_FL2_GSU25_LBSPP512_MIAV0_PLR2_TT1_16_WG16_4_4
    SolutionIndex: 31
    SolutionNameMin: Cijk_AlikC_Bljk_ZB_MT16x16x32_MI16x16x4x1_SN_1LDSB0_FL0_GSU17_LBSPP512_MIAV0_PLR3_TT1_16_WG16_4_4
    SolutionIndex: 32
    SolutionNameMin: Cijk_AlikC_Bljk_ZB_MT16x16x32_MI16x16x4x1_SN_1LDSB1_FL1_GSU17_LBSPP512_MIAV1_PLR2_TT1_16_WG16_4_4
    SolutionIndex: 33
    SolutionNameMin: Cijk_AlikC_Bljk_ZB_MT16x16x32_MI16x16x4x1_SN_1LDSB0_FL1_GSU8_LBSPP512_MIAV1_PLR2_TT1_16_WG16_4_4
    SolutionIndex: 34
    SolutionNameMin: Cijk_AlikC_Bljk_ZB_MT16x16x32_MI16x16x4x1_SN_1LDSB1_FL0_GSU8_LBSPP512_MIAV1_PLR2_TT1_16_WG16_4_4
    SolutionIndex: 35
    SolutionNameMin: Cijk_AlikC_Bljk_ZB_MT16x16x32_MI16x16x4x1_SN_1LDSB1_FL0_GSU8_LBSPP512_MIAV0_PLR2_TT1_16_WG16_4_4
    SolutionIndex: 36
    SolutionNameMin: Cijk_AlikC_Bljk_ZB_MT16x16x32_MI16x16x4x1_SN_1LDSB0_FL1_GSU3_LBSPP512_MIAV0_PLR3_TT1_16_WG16_4_4
    SolutionIndex: 37
    SolutionNameMin: Cijk_AlikC_Bljk_ZB_MT32x16x32_MI16x16x4x1_SN_1LDSB0_FL1_GSU4_LBSPP512_MIAV1_PLR2_TT1_16_WG32_4_4
    SolutionIndex: 38
    SolutionNameMin: Cijk_AlikC_Bljk_ZB_MT32x16x32_MI16x16x4x1_SN_1LDSB0_FL0_GSU3_LBSPP512_MIAV0_PLR2_TT1_16_WG32_4_4
    SolutionIndex: 39
    SolutionNameMin: Cijk_AlikC_Bljk_ZB_MT16x16x32_MI16x16x4x1_SN_1LDSB0_FL1_GSU70_LBSPP512_MIAV1_PLR3_TT1_16_WG16_4_4
    SolutionIndex: 40
    SolutionNameMin: Cijk_AlikC_Bljk_ZB_MT16x16x64_MI16x16x4x1_SN_1LDSB1_FL2_GSU70_LBSPP1024_MIAV1_PLR5_TT1_16_WG16_4_4
    SolutionIndex: 41
    SolutionNameMin: Cijk_AlikC_Bljk_ZB_MT16x16x32_MI16x16x4x1_SN_1LDSB0_FL0_GSU50_LBSPP512_MIAV0_PLR3_TT1_16_WG16_4_4
    SolutionIndex: 42
    SolutionNameMin: Cijk_AlikC_Bljk_ZB_MT16x16x32_MI16x16x4x1_SN_1LDSB0_FL2_GSU35_LBSPP512_MIAV0_PLR3_TT1_16_WG16_4_4
    SolutionIndex: 43
    SolutionNameMin: Cijk_AlikC_Bljk_ZB_MT16x8x32_MI4x4x4x4_SN_1LDSB0_FL1_GSU40_LBSPP512_MIAV0_PLR9_TT1_4_WG16_8_1
    SolutionIndex: 44
    SolutionNameMin: Cijk_AlikC_Bljk_ZB_MT16x8x64_MI4x4x4x4_SN_1LDSB0_FL1_GSU35_LBSPP1024_MIAV1_PLR9_TT1_8_WG16_4_2
    SolutionIndex: 45
    SolutionNameMin: Cijk_AlikC_Bljk_ZB_MT16x8x64_MI4x4x4x4_SN_1LDSB0_FL0_GSU25_LBSPP1024_MIAV1_PLR9_TT1_8_WG16_4_2
    SolutionIndex: 46
    SolutionNameMin: Cijk_AlikC_Bljk_ZB_MT16x4x16_MI4x4x4x4_SN_1LDSB0_FL2_GSU25_LBSPP256_MIAV1_PLR5_TT1_4_WG16_4_1
    SolutionIndex: 47
    SolutionNameMin: Cijk_AlikC_Bljk_ZB_MT32x4x16_MI4x4x4x4_SN_1LDSB0_FL1_GSU25_LBSPP256_MIAV1_PLR5_TT1_4_WG32_4_1
    SolutionIndex: 48
    SolutionNameMin: Cijk_AlikC_Bljk_ZB_MT8x8x32_MI4x4x4x4_SN_1LDSB0_FL2_GSU17_LBSPP512_MIAV1_PLR9_TT1_4_WG8_8_1
    SolutionIndex: 49
    SolutionNameMin: Cijk_AlikC_Bljk_ZB_MT16x8x32_MI4x4x4x4_SN_1LDSB1_FL1_GSU25_LBSPP512_MIAV1_PLR5_TT1_8_WG16_4_2
    SolutionIndex: 50
    SolutionNameMin: Cijk_AlikC_Bljk_ZB_MT64x16x16_MI16x16x4x1_SN_1LDSB0_FL2_GSU6_GSUAMB_LBSPP256_MIAV1_PLR5_TT1_16_WG64_4_1
    SolutionIndex: 51
    SolutionNameMin: Cijk_AlikC_Bljk_ZB_MT128x16x16_MI16x16x4x1_SN_1LDSB1_FL2_GSU6_GSUAMB_LBSPP256_MIAV0_PLR5_TT2_16_WG64_4_1
    SolutionIndex: 52
    SolutionNameMin: Cijk_AlikC_Bljk_ZB_MT64x64x8_MI16x16x4x1_SN_1LDSB1_FL2_GSU6_GSUAMB_LBSPP128_MIAV1_PLR3_TT2_32_WG32_8_1
    SolutionIndex: 53
    SolutionNameMin: Cijk_AlikC_Bljk_ZB_MT64x64x8_MI16x16x4x1_SN_1LDSB1_FL0_GSU4_GSUAMB_LBSPP128_MIAV0_PLR3_TT2_32_WG32_8_1
    SolutionIndex: 54
    SolutionNameMin: Cijk_AlikC_Bljk_ZB_MT128x128x8_MI16x16x4x1_SN_GSU220_LBSPP128_MIAV0_NEPBS4_PLR1_SU0_SUS0_TT4_64_WG32_8_1
    SolutionIndex: 55
    SolutionNameMin: Cijk_AlikC_Bljk_ZB_MT128x128x8_MI16x16x4x1_SN_GSU240_LBSPP128_MIAV0_NEPBS4_PLR1_SU32_SUS256_TT4_64_WG32_8_1
    SolutionIndex: 56
    SolutionNameMin: Cijk_AlikC_Bljk_ZB_MT128x128x8_MI16x16x4x1_SN_GSU120_LBSPP128_MIAV0_NEPBS0_PLR1_SU0_SUS0_TT2_128_WG64_4_1
    SolutionIndex: 57
    SolutionNameMin: Cijk_AlikC_Bljk_ZB_MT128x128x8_MI16x16x4x1_SN_GSU180_LBSPP128_MIAV0_NEPBS0_PLR1_SU0_SUS0_TT4_64_WG32_8_1
    SolutionIndex: 58
    SolutionNameMin: Cijk_AlikC_Bljk_ZB_MT32x4x32_MI4x4x4x4_SN_1LDSB0_FL0_GSU17_GSUAMB_LBSPP512_LPA1_LPB1_PLR5_TT2_4_WG16_4_2
    SolutionIndex: 59
    SolutionNameMin: Cijk_AlikC_Bljk_ZB_MT16x16x32_MI16x16x4x1_SN_1LDSB0_FL0_GSU25_GSUAMB_LBSPP512_LPA2_LPB2_PLR3_TT1_16_WG16_4_4
    SolutionIndex: 60
    SolutionNameMin: Cijk_AlikC_Bljk_ZB_MT16x16x32_MI16x16x4x1_SN_1LDSB1_FL0_GSU17_GSUAMB_LBSPP512_LPA2_LPB2_PLR2_TT1_16_WG16_4_4
    SolutionIndex: 61
    SolutionNameMin: Cijk_AlikC_Bljk_ZB_MT16x16x32_MI16x16x4x1_SN_1LDSB1_FL2_GSU17_GSUAMB_LBSPP512_LPA2_LPB2_PLR5_TT1_16_WG16_4_2
    SolutionIndex: 62
    SolutionNameMin: Cijk_AlikC_Bljk_ZB_MT16x16x32_MI16x16x4x1_SN_1LDSB1_FL0_GSU8_GSUAMB_LBSPP512_LPA2_LPB2_PLR2_TT1_16_WG16_4_4
    SolutionIndex: 63
    SolutionNameMin: Cijk_AlikC_Bljk_ZB_MT16x16x32_MI16x16x4x1_SN_1LDSB1_FL2_GSU17_GSUAMB_LBSPP512_LPA2_LPB2_PLR2_TT1_16_WG16_4_4
    SolutionIndex: 64
    SolutionNameMin: Cijk_AlikC_Bljk_ZB_MT32x16x32_MI16x16x4x1_SN_1LDSB0_FL2_GSU8_GSUAMB_LBSPP512_PLR3_TT2_16_WG16_4_4
    SolutionIndex: 65
    SolutionNameMin: Cijk_AlikC_Bljk_ZB_MT16x16x32_MI16x16x4x1_SN_1LDSB0_FL0_GSU4_GSUAMB_LBSPP512_PLR3_TT1_16_WG16_4_4
    SolutionIndex: 66
    SolutionNameMin: Cijk_AlikC_Bljk_ZB_MT16x16x16_MI16x16x4x1_SN_1LDSB1_FL0_GSU8_GSUAMB_LBSPP256_PLR2_TT1_16_WG16_4_2
    SolutionIndex: 67
    SolutionNameMin: Cijk_AlikC_Bljk_ZB_MT64x16x16_MI16x16x4x1_SN_1LDSB0_FL0_GSU8_GSUAMB_LBSPP256_PLR5_TT1_16_WG64_4_1
    SolutionIndex: 68
    SolutionNameMin: Cijk_AlikC_Bljk_ZB_MT16x16x32_MI16x16x4x1_SN_1LDSB0_FL2_GSU110_GSUAMB_LBSPP512_LPA2_LPB2_PLR3_TT1_16_WG16_4_4
    SolutionIndex: 69
    SolutionNameMin: Cijk_AlikC_Bljk_ZB_MT16x16x32_MI16x16x4x1_SN_1LDSB1_FL0_GSU110_GSUAMB_LBSPP512_LPA2_LPB2_PLR9_TT1_16_WG16_4_1
    SolutionIndex: 70
    SolutionNameMin: Cijk_AlikC_Bljk_ZB_MT16x16x32_MI16x16x4x1_SN_1LDSB0_FL2_GSU70_GSUAMB_LBSPP512_LPA2_LPB2_PLR5_TT1_16_WG16_4_2
    SolutionIndex: 71
    SolutionNameMin: Cijk_AlikC_Bljk_ZB_MT16x16x32_MI16x16x4x1_SN_1LDSB0_FL0_GSU110_GSUAMB_LBSPP512_LPA2_LPB2_PLR5_TT1_16_WG16_4_2
    SolutionIndex: 72
    SolutionNameMin: Cijk_AlikC_Bljk_ZB_MT16x16x32_MI16x16x4x1_SN_1LDSB0_FL2_GSU110_GSUASB_LBSPP512_LPA2_LPB2_PLR3_TT1_16_WG16_4_4
    SolutionIndex: 73
    SolutionNameMin: Cijk_AlikC_Bljk_ZB_MT16x16x32_MI16x16x4x1_SN_1LDSB0_FL0_GSU45_GSUASB_LBSPP512_LPA2_LPB2_PLR3_TT1_16_WG16_4_4
    SolutionIndex: 74
    SolutionNameMin: Cijk_AlikC_Bljk_ZB_MT16x16x32_MI16x16x4x1_SN_1LDSB0_FL2_GSU45_GSUAMB_LBSPP512_PLR3_TT1_16_WG16_4_4
    SolutionIndex: 75
    SolutionNameMin: Cijk_AlikC_Bljk_ZB_MT16x16x32_MI16x16x4x1_SN_1LDSB0_FL2_GSU45_GSUASB_LBSPP512_PLR3_TT1_16_WG16_4_4
    SolutionIndex: 76
    SolutionNameMin: Cijk_AlikC_Bljk_ZB_MT16x16x32_MI16x16x4x1_SN_1LDSB0_FL2_GSU30_GSUAMB_LBSPP512_PLR3_TT1_16_WG16_4_4
    SolutionIndex: 77
    SolutionNameMin: Cijk_AlikC_Bljk_ZB_MT64x96x8_MI16x16x4x1_SN_1LDSB1_LBSPP128_LPA2_LPB2_MIAV1_NEPBS1_PLR3_SU0_SUS0_TT1_96_TLDS1_WG64_4_1_WGM7
    SolutionIndex: 78
    SolutionNameMin: Cijk_AlikC_Bljk_ZB_MT128x64x8_MI16x16x4x1_SN_1LDSB1_LBSPP128_LPA2_LPB2_MIAV1_NEPBS1_PLR3_SU32_SUS256_TT2_64_TLDS1_WG64_4_1_WGM7
- - - [64, 1, 1, 256]
    - [0, 0.015]
  - - [64, 64, 1, 256]
    - [0, 1.112]
  - - [1, 1, 1, 256]
    - [0, 0.0]
  - - [1, 64, 1, 256]
    - [0, 0.015]
  - - [6454, 6454, 1, 689]
    - [1, 77.137]
  - - [7561, 7561, 1, 411]
    - [2, 71.542]
  - - [7985, 7985, 1, 701]
    - [3, 76.592]
  - - [7985, 7985, 1, 1948]
    - [4, 83.523]
  - - [8709, 8709, 1, 875]
    - [5, 78.908]
  - - [9603, 9603, 1, 1371]
    - [6, 81.324]
  - - [9603, 9603, 1, 701]
    - [7, 76.483]
  - - [10606, 10606, 1, 1239]
    - [8, 82.614]
  - - [11505, 11505, 1, 1278]
    - [9, 81.885]
  - - [12301, 12301, 1, 837]
    - [10, 78.763]
  - - [13179, 13179, 1, 1392]
    - [7, 84.044]
  - - [14487, 14487, 1, 1169]
    - [11, 81.667]
  - - [15420, 15420, 1, 2986]
    - [12, 86.711]
  - - [15420, 15420, 1, 701]
    - [13, 79.675]
  - - [17445, 17445, 1, 1266]
    - [10, 82.686]
  - - [18395, 18395, 1, 1008]
    - [6, 82.981]
  - - [19343, 19343, 1, 501]
    - [7, 74.991]
  - - [19343, 19343, 1, 1266]
    - [14, 82.155]
  - - [20342, 20342, 1, 1636]
    - [6, 85.489]
  - - [21581, 21581, 1, 701]
    - [15, 78.17]
  - - [21581, 21581, 1, 2921]
    - [16, 84.763]
  - - [24261, 24261, 1, 659]
    - [10, 78.177]
  - - [25109, 25109, 1, 1087]
    - [17, 80.598]
  - - [25854, 25854, 1, 701]
    - [7, 78.128]
  - - [25854, 25854, 1, 1820]
    - [6, 84.775]
  - - [27412, 27412, 1, 501]
    - [11, 75.336]
  - - [27412, 27412, 1, 1416]
    - [18, 84.29]
  - - [28005, 28005, 1, 701]
    - [16, 77.567]
  - - [28005, 28005, 1, 2572]
    - [7, 84.064]
  - - [29829, 29829, 1, 1582]
    - [6, 81.061]
  - - [30421, 30421, 1, 1186]
    - [6, 81.219]
  - - [16, 16, 1, 112485]
    - [19, 9.22]
  - - [32, 16, 1, 112485]
    - [20, 15.291]
  - - [48, 16, 1, 112485]
    - [21, 19.132]
  - - [80, 16, 1, 112485]
    - [20, 22.708]
  - - [128, 16, 1, 112485]
    - [22, 25.842]
  - - [192, 16, 1, 112485]
    - [23, 27.167]
  - - [304, 16, 1, 112485]
    - [24, 28.823]
  - - [432, 16, 1, 112485]
    - [25, 30.077]
  - - [576, 16, 1, 112485]
    - [26, 29.768]
  - - [832, 16, 1, 112485]
    - [21, 30.01]
  - - [1072, 16, 1, 112485]
    - [27, 30.189]
  - - [16, 16, 1, 2388]
    - [28, 0.417]
  - - [32, 16, 1, 2388]
    - [29, 0.835]
  - - [48, 16, 1, 2388]
    - [30, 1.229]
  - - [80, 16, 1, 2388]
    - [31, 2.018]
  - - [128, 16, 1, 2388]
    - [32, 3.16]
  - - [192, 16, 1, 2388]
    - [33, 4.608]
  - - [304, 16, 1, 2388]
    - [34, 6.69]
  - - [432, 16, 1, 2388]
    - [35, 8.936]
  - - [576, 16, 1, 2388]
    - [36, 10.752]
  - - [832, 16, 1, 2388]
    - [37, 13.776]
  - - [1072, 16, 1, 2388]
    - [38, 15.982]
  - - [8, 8, 1, 112485]
    - [39, 2.75]
  - - [16, 8, 1, 112485]
    - [40, 5.16]
  - - [24, 8, 1, 112485]
    - [41, 6.678]
  - - [40, 8, 1, 112485]
    - [42, 8.926]
  - - [72, 8, 1, 112485]
    - [43, 11.576]
  - - [136, 8, 1, 112485]
    - [44, 13.283]
  - - [200, 8, 1, 112485]
    - [45, 14.917]
  - - [8, 8, 1, 2388]
    - [46, 0.106]
  - - [16, 8, 1, 2388]
    - [47, 0.212]
  - - [24, 8, 1, 2388]
    - [48, 0.315]
  - - [40, 8, 1, 2388]
    - [49, 0.518]
  - - [128, 128, 1, 2080]
    - [50, 16.124]
  - - [256, 128, 1, 2080]
    - [51, 23.629]
  - - [512, 128, 1, 2080]
    - [52, 38.76]
  - - [768, 128, 1, 2080]
    - [53, 46.424]
  - - [128, 128, 1, 386819]
    - [54, 62.214]
  - - [256, 128, 1, 386819]
    - [55, 66.184]
  - - [512, 128, 1, 386819]
    - [56, 68.592]
  - - [768, 128, 1, 386819]
    - [57, 69.924]
  - - [16, 16, 1, 2080]
    - [58, 0.378]
  - - [32, 16, 1, 2080]
    - [59, 0.759]
  - - [48, 16, 1, 2080]
    - [60, 1.116]
  - - [80, 16, 1, 2080]
    - [61, 1.825]
  - - [128, 16, 1, 2080]
    - [62, 2.887]
  - - [192, 16, 1, 2080]
    - [63, 4.144]
  - - [304, 16, 1, 2080]
    - [64, 6.1]
  - - [432, 16, 1, 2080]
    - [65, 8.28]
  - - [576, 16, 1, 2080]
    - [66, 10.104]
  - - [768, 16, 1, 2080]
    - [67, 12.353]
  - - [16, 16, 1, 386819]
    - [68, 13.86]
  - - [32, 16, 1, 386819]
    - [69, 19.478]
  - - [48, 16, 1, 386819]
    - [70, 21.243]
  - - [80, 16, 1, 386819]
    - [71, 22.05]
  - - [128, 16, 1, 386819]
    - [72, 23.493]
  - - [192, 16, 1, 386819]
    - [73, 26.349]
  - - [304, 16, 1, 386819]
    - [74, 26.644]
  - - [432, 16, 1, 386819]
    - [75, 26.489]
  - - [576, 16, 1, 386819]
    - [76, 26.851]
  - - [768, 16, 1, 386819]
    - [75, 26.817]
  - - [1031, 1031, 1, 1031]
    - [77, 65.982]
  - - [4095, 4095, 1, 1031]
    - [78, 86.029]
- null
- null
- DeviceEfficiency
