library/src/blas3/Tensile/Logic/asm_full/aldebaran/aldebaran_Cijk_Alik_Bjlk_DB.yaml
- {MinimumRequiredVersion: 4.7.2}
- aldebaran
- gfx90a
- [Device 0050, Device 0051, Device 0052, Device 0054, Device 0062, Device 7400, Device
    SolutionIndex: 0
    SolutionNameMin: Cijk_Alik_Bjlk_DB_MT64x16x8_MI16x16x4x1_SN_IU1_NEPBS0_PLR3_SU0_SUS0_TLDS0_WGM11
    SolutionIndex: 1
    SolutionNameMin: Cijk_Alik_Bjlk_DB_MT64x16x8_MI16x16x4x1_SN_IU1_NEPBS0_PLR3_SU32_SUS128_TLDS0_WGM5
    SolutionIndex: 2
    SolutionNameMin: Cijk_Alik_Bjlk_DB_MT64x16x8_MI16x16x4x1_SN_IU1_NEPBS0_PLR3_SU0_SUS0_TLDS0_WGM5
    SolutionIndex: 3
    SolutionNameMin: Cijk_Alik_Bjlk_DB_MT64x16x8_MI16x16x4x1_SN_IU1_NEPBS0_PLR3_SU32_SUS128_TLDS0_WGM11
    SolutionIndex: 4
    SolutionNameMin: Cijk_Alik_Bjlk_DB_MT128x128x16_MI16x16x4x1_SN_NLCB1_SUS256_SSO4_WGM5
    SolutionIndex: 5
    SolutionNameMin: Cijk_Alik_Bjlk_DB_MT128x128x16_MI16x16x4x1_SN_NLCB2_SUS256_SSO4_WGM6
    SolutionIndex: 6
    SolutionNameMin: Cijk_Alik_Bjlk_DB_MT128x128x16_MI16x16x4x1_SN_NLCB1_SUS128_SSO4_WGM6
    SolutionIndex: 7
    SolutionNameMin: Cijk_Alik_Bjlk_DB_MT128x128x16_MI16x16x4x1_SN_NLCB2_SUS256_SSO4_WGM5
    SolutionIndex: 8
    SolutionNameMin: Cijk_Alik_Bjlk_DB_MT128x128x16_MI16x16x4x1_SN_NLCB1_SUS256_SSO4_WGM6
    SolutionIndex: 9
    SolutionNameMin: Cijk_Alik_Bjlk_DB_MT128x128x16_MI16x16x4x1_SN_NLCB2_SUS256_SSO4_WGM8
    SolutionIndex: 10
    SolutionNameMin: Cijk_Alik_Bjlk_DB_MT128x128x16_MI16x16x4x1_SN_NLCB1_SUS128_SSO4_WGM5
    SolutionIndex: 11
    SolutionNameMin: Cijk_Alik_Bjlk_DB_MT128x128x16_MI16x16x4x1_SN_NLCB1_SUS128_SSO4_WGM8
    SolutionIndex: 12
    SolutionNameMin: Cijk_Alik_Bjlk_DB_MT128x128x16_MI16x16x4x1_SN_NLCB2_SUS128_SSO4_WGM5
    SolutionIndex: 13
    SolutionNameMin: Cijk_Alik_Bjlk_DB_MT128x128x16_MI16x16x4x1_SN_NLCB1_SUS256_SSO4_WGM8
- - - [1, 64, 1, 64]
    - [1, 0.002]
  - - [64, 1, 1, 64]
    - [0, 0.002]
  - - [1, 1, 1, 64]
    - [2, 0.0]
  - - [64, 64, 1, 64]
    - [3, 0.163]
  - - [128, 1, 1, 128]
    - [0, 0.007]
  - - [6454, 6454, 1, 689]
    - [4, 61.387]
  - - [7561, 7561, 1, 411]
    - [5, 50.386]
  - - [7985, 7985, 1, 701]
    - [6, 61.963]
  - - [7985, 7985, 1, 1948]
    - [4, 78.009]
  - - [8709, 8709, 1, 875]
    - [4, 66.357]
  - - [9603, 9603, 1, 1371]
    - [5, 73.716]
  - - [9603, 9603, 1, 701]
    - [5, 62.635]
  - - [10606, 10606, 1, 1239]
    - [7, 74.451]
  - - [11505, 11505, 1, 1278]
    - [8, 74.486]
  - - [12301, 12301, 1, 837]
    - [6, 67.953]
  - - [13179, 13179, 1, 1392]
    - [7, 77.705]
  - - [14487, 14487, 1, 1169]
    - [8, 73.746]
  - - [15420, 15420, 1, 2986]
    - [4, 83.785]
  - - [15420, 15420, 1, 701]
    - [9, 65.478]
  - - [17445, 17445, 1, 1266]
    - [4, 75.55]
  - - [18395, 18395, 1, 1008]
    - [8, 74.033]
  - - [19343, 19343, 1, 501]
    - [9, 58.601]
  - - [19343, 19343, 1, 1266]
    - [4, 75.57]
  - - [20342, 20342, 1, 1636]
    - [8, 79.31]
  - - [21581, 21581, 1, 701]
    - [10, 64.976]
  - - [21581, 21581, 1, 2921]
    - [5, 83.345]
  - - [24261, 24261, 1, 659]
    - [11, 64.998]
  - - [25109, 25109, 1, 1087]
    - [7, 72.833]
  - - [25854, 25854, 1, 701]
    - [9, 65.593]
  - - [25854, 25854, 1, 1820]
    - [8, 79.93]
  - - [27412, 27412, 1, 501]
    - [11, 59.151]
  - - [27412, 27412, 1, 1416]
    - [7, 77.578]
  - - [28005, 28005, 1, 701]
    - [8, 65.616]
  - - [28005, 28005, 1, 2572]
    - [12, 83.058]
  - - [29829, 29829, 1, 1582]
    - [7, 77.693]
  - - [30421, 30421, 1, 1186]
    - [4, 75.107]
  - - [31256, 31256, 1, 415]
    - [11, 54.457]
  - - [31256, 31256, 1, 1186]
    - [5, 75.265]
  - - [32163, 32163, 1, 1796]
    - [4, 79.793]
  - - [33974, 33974, 1, 1225]
    - [7, 74.913]
  - - [35882, 35882, 1, 701]
    - [10, 65.324]
  - - [35882, 35882, 1, 2387]
    - [12, 82.318]
  - - [36653, 36653, 1, 501]
    - [11, 58.922]
  - - [36653, 36653, 1, 2845]
    - [12, 83.232]
  - - [37967, 37967, 1, 1339]
    - [8, 76.036]
  - - [38361, 38361, 1, 701]
    - [13, 65.188]
  - - [38361, 38361, 1, 3690]
    - [13, 85.135]
  - - [39067, 39067, 1, 1224]
    - [8, 75.267]
  - - [39761, 39761, 1, 3821]
    - [8, 85.338]
  - - [40401, 40401, 1, 701]
    - [9, 65.341]
  - - [40401, 40401, 1, 1925]
    - [4, 80.224]
  - - [41535, 41535, 1, 701]
    - [5, 65.294]
  - - [41535, 41535, 1, 2235]
    - [7, 81.482]
  - - [43623, 43623, 1, 701]
    - [9, 65.454]
  - - [43623, 43623, 1, 3812]
    - [8, 85.697]
  - - [45312, 45312, 1, 701]
    - [9, 66.95]
  - - [45312, 45312, 1, 3235]
    - [13, 85.581]
  - - [47463, 47463, 1, 3020]
    - [13, 84.105]
  - - [47463, 47463, 1, 701]
    - [9, 65.284]
  - - [49109, 49109, 1, 3250]
    - [8, 84.747]
  - - [51821, 51821, 1, 701]
    - [8, 65.315]
  - - [51821, 51821, 1, 3954]
    - [12, 85.9]
  - - [60766, 60766, 1, 701]
    - [9, 65.363]
  - - [60766, 60766, 1, 2493]
    - [12, 82.277]
  - - [67143, 67143, 1, 701]
    - [9, 64.957]
  - - [67143, 67143, 1, 3914]
    - [12, 85.541]
- null
