library/src/blas3/Tensile/Logic/asm_full/aldebaran/aldebaran_Cijk_Alik_Bljk_SB_GB.yaml
- {MinimumRequiredVersion: 4.20.0}
- aldebaran
- gfx90a
- [Device 0050, Device 0051, Device 0052, Device 0054, Device 0062, Device 7400, Device
    SolutionIndex: 0
    SolutionNameMin: Cijk_Alik_Bljk_SB_MT32x64x32_SE_GRVW2_ONLL1_SNLL0
    SolutionIndex: 1
    SolutionNameMin: Cijk_Alik_Bljk_SB_MT64x32x32_SE_GRVW2_ONLL1_SNLL0
    SolutionIndex: 2
    SolutionNameMin: Cijk_Alik_Bljk_SB_MT64x128x32_SE_
    SolutionIndex: 3
    SolutionNameMin: Cijk_Alik_Bljk_SB_MT64x128x32_SE_
    SolutionIndex: 4
    SolutionNameMin: Cijk_Alik_Bljk_SB_MT32x32x32_MI16x16x4x1_SN_1LDSB1_AMAS0_DTL0_EPS0_GRVW2_GSU1_IU1_LBSPP128_LPA2_LPB2_LRVW2_NEPBS4_NLCA1_NLCB1_ONLL1_PGR2_PLR9_SIA3_SS1_SU0_SUS256_SRVW0_SVW1_SNLL0_TT1_16_TLDS1_USFGROn1_VW1_WSGRA1_WSGRB1_WG32_8_1_WGM10
    SolutionIndex: 5
    SolutionNameMin: Cijk_Alik_Bljk_SB_MT64x64x16_MI32x32x2x1_SN_1LDSB1_AMAS0_DTL0_EPS0_GRVW4_GSU1_IU1_LBSPP128_LPA4_LPB4_LRVW2_NEPBS8_NLCA1_NLCB1_ONLL1_PGR2_PLR9_SIA3_SS1_SU0_SUS256_SRVW0_SVW1_SNLL0_TT1_32_TLDS1_USFGROn1_VW1_WSGRA1_WSGRB1_WG64_4_1_WGM5
    SolutionIndex: 6
    SolutionNameMin: Cijk_Alik_Bljk_SB_MT128x64x16_MI32x32x2x1_SN_1LDSB1_AMAS3_DTL0_EPS0_GRVW2_GSU1_IU1_LBSPP128_LPA2_LPB2_LRVW2_NEPBS2_NLCA1_NLCB1_ONLL1_PGR2_PLR9_SIA3_SS1_SU0_SUS256_SRVW0_SVW2_SNLL0_TT2_32_TLDS1_USFGROn1_VW2_WSGRA1_WSGRB1_WG64_4_1_WGM10
    SolutionIndex: 7
    SolutionNameMin: Cijk_Alik_Bljk_SB_MT96x96x16_MI16x16x4x1_SN_1LDSB1_AMAS0_DTL0_EPS0_GRVW2_GSU1_IU1_LBSPP128_LPA2_LPB2_LRVW2_NEPBS2_NLCA1_NLCB1_ONLL1_PGR2_PLR5_SIA3_SS1_SU0_SUS256_SRVW0_SVW1_SNLL0_TT3_48_TLDS1_USFGROn1_VW1_WSGRA1_WSGRB1_WG32_8_1_WGM5
    SolutionIndex: 8
    SolutionNameMin: Cijk_Alik_Bljk_SB_MT64x128x32_MI32x32x2x1_SE_1LDSB1_AMAS0_DTL0_EPS0_GRVW2_GSU1_IU1_LBSPP128_LPA2_LPB2_LRVW2_NEPBS0_NLCA1_NLCB1_ONLL1_PGR2_PLR17_SIA3_SS0_SU0_SUS256_SRVW2_SVW4_SNLL0_TT1_64_TLDS1_USFGROn1_VW1_WSGRA1_WSGRB1_WG64_4_1_WGM2
    SolutionIndex: 9
    SolutionNameMin: Cijk_Alik_Bljk_SB_MT96x96x32_MI16x16x4x1_SN_1LDSB1_AMAS0_DTL0_EPS0_GRVW2_GSU1_IU1_LBSPP128_LPA2_LPB2_LRVW2_NEPBS4_NLCA1_NLCB1_ONLL1_PGR2_PLR9_SIA3_SS1_SU32_SUS256_SRVW0_SVW1_SNLL0_TT3_48_TLDS1_USFGROn1_VW1_WSGRA1_WSGRB1_WG32_8_1_WGM5
    SolutionIndex: 10
    SolutionNameMin: Cijk_Alik_Bljk_SB_MT64x64x32_MI32x32x2x1_SE_1LDSB1_AMAS0_DTL0_EPS1_GRVW2_GSU1_IU1_LBSPP128_LPA2_LPB2_LRVW2_NEPBS0_NLCA1_NLCB1_ONLL1_PGR1_PLR17_SIA3_SS0_SU0_SUS256_SRVW2_SVW4_SNLL0_TT1_32_TLDS1_USFGROn1_VW1_WSGRA1_WSGRB1_WG64_4_1_WGM1
    SolutionIndex: 11
    SolutionNameMin: Cijk_Alik_Bljk_SB_MT64x64x32_MI32x32x2x1_SE_1LDSB1_AMAS0_DTL0_EPS0_GRVW4_GSU1_IU1_LBSPP128_LPA4_LPB4_LRVW2_NEPBS0_NLCA1_NLCB1_ONLL1_PGR2_PLR17_SIA3_SS0_SU0_SUS256_SRVW2_SVW4_SNLL0_TT1_32_TLDS1_USFGROn1_VW1_WSGRA1_WSGRB1_WG64_4_1_WGM15
    SolutionIndex: 12
    SolutionNameMin: Cijk_Alik_Bljk_SB_MT64x64x32_MI32x32x2x1_SE_1LDSB1_AMAS0_DTL0_EPS1_GRVW2_GSU1_IU1_LBSPP128_LPA2_LPB2_LRVW2_NEPBS0_NLCA1_NLCB1_ONLL1_PGR1_PLR17_SIA3_SS0_SU0_SUS256_SRVW2_SVW4_SNLL0_TT1_32_TLDS1_USFGROn1_VW1_WSGRA1_WSGRB1_WG64_4_1_WGM15
    SolutionIndex: 13
    SolutionNameMin: Cijk_Alik_Bljk_SB_MT64x64x32_MI32x32x2x1_SE_1LDSB1_AMAS0_DTL0_EPS1_GRVW4_GSU1_IU1_LBSPP128_LPA4_LPB4_LRVW2_NEPBS0_NLCA1_NLCB1_ONLL1_PGR1_PLR17_SIA3_SS0_SU0_SUS256_SRVW2_SVW4_SNLL0_TT1_32_TLDS1_USFGROn1_VW1_WSGRA1_WSGRB1_WG64_4_1_WGM1
    SolutionIndex: 14
    SolutionNameMin: Cijk_Alik_Bljk_SB_MT64x32x32_MI16x16x4x1_SE_1LDSB1_AMAS0_DTL0_EPS0_GRVW4_GSU1_IU1_LBSPP128_LPA4_LPB4_LRVW2_NEPBS0_NLCA1_NLCB1_ONLL1_PGR2_PLR9_SIA3_SS0_SU0_SUS256_SRVW2_SVW4_SNLL0_TT2_16_TLDS1_USFGROn1_VW1_WSGRA1_WSGRB1_WG32_8_1_WGM15
    SolutionIndex: 15
    SolutionNameMin: Cijk_Alik_Bljk_SB_MT64x64x32_MI32x32x2x1_SE_1LDSB1_AMAS0_DTL0_EPS1_GRVW4_GSU1_IU1_LBSPP128_LPA4_LPB4_LRVW2_NEPBS0_NLCA1_NLCB1_ONLL1_PGR1_PLR17_SIA3_SS0_SU32_SUS256_SRVW2_SVW4_SNLL0_TT1_32_TLDS1_USFGROn1_VW1_WSGRA1_WSGRB1_WG64_4_1_WGM15
    SolutionIndex: 16
    SolutionNameMin: Cijk_Alik_Bljk_SB_MT128x96x16_MI32x32x2x1_SE_1LDSB1_AMAS0_DTL0_EPS0_GRVW2_GSU1_IU1_LBSPP128_LPA2_LPB2_LRVW2_NEPBS0_NLCA1_NLCB1_ONLL1_PGR2_PLR9_SIA3_SS0_SU0_SUS256_SRVW2_SVW4_SNLL0_TT1_96_TLDS1_USFGROn1_VW1_WSGRA1_WSGRB1_WG128_2_1_WGM15
    SolutionIndex: 17
    SolutionNameMin: Cijk_Alik_Bljk_SB_MT64x64x32_MI32x32x2x1_SE_1LDSB1_AMAS0_DTL0_EPS1_GRVW4_GSU1_IU1_LBSPP128_LPA4_LPB4_LRVW2_NEPBS0_NLCA1_NLCB1_ONLL1_PGR1_PLR17_SIA3_SS0_SU0_SUS256_SRVW2_SVW4_SNLL0_TT1_32_TLDS1_USFGROn1_VW1_WSGRA1_WSGRB1_WG64_4_1_WGM15
    SolutionIndex: 18
    SolutionNameMin: Cijk_Alik_Bljk_SB_MT128x32x64_MI32x32x2x1_SE_1LDSB1_AMAS0_DTL0_EPS1_GRVW4_GSU1_IU1_LBSPP256_LPA4_LPB4_LRVW4_NEPBS0_NLCA1_NLCB1_ONLL1_PGR1_PLR33_SIA3_SS0_SU32_SUS256_SRVW0_SVW4_SNLL0_TT1_32_TLDS1_USFGROn1_VW1_WSGRA1_WSGRB1_WG128_2_1_WGM2
    SolutionIndex: 19
    SolutionNameMin: Cijk_Alik_Bljk_SB_MT96x96x16_MI16x16x4x1_SN_1LDSB1_AMAS0_DTL0_EPS0_GRVW2_GSU1_IU1_LBSPP128_LPA2_LPB2_LRVW2_NEPBS4_NLCA1_NLCB1_ONLL1_PGR2_PLR5_SIA3_SS1_SU32_SUS128_SRVW0_SVW1_SNLL0_TT3_48_TLDS1_USFGROn1_VW1_WSGRA1_WSGRB1_WG32_8_1_WGM5
    SolutionIndex: 20
    SolutionNameMin: Cijk_Alik_Bljk_SB_MT32x32x32_MI16x16x4x1_SE_1LDSB1_AMAS0_DTL0_EPS1_GRVW2_GSU1_IU1_LBSPP128_LPA2_LPB2_LRVW2_NEPBS0_NLCA1_NLCB1_ONLL1_PGR1_PLR9_SIA3_SS0_SU0_SUS256_SRVW2_SVW4_SNLL0_TT1_16_TLDS1_USFGROn1_VW1_WSGRA1_WSGRB1_WG32_8_1_WGM1
    SolutionIndex: 21
    SolutionNameMin: Cijk_Alik_Bljk_SB_MT16x16x32_MI16x16x4x1_SN_1LDSB0_AMAS0_DTL0_EPS0_GRVW4_GSU1_IU1_LBSPP128_LPA4_LPB4_LRVW2_NEPBS8_NLCA1_NLCB1_ONLL1_PGR2_PLR9_SIA3_SS1_SU32_SUS256_SRVW0_SVW1_SNLL0_TT1_16_TLDS1_USFGROn1_VW1_WSGRA1_WSGRB1_WG16_4_1_WGM10
    SolutionIndex: 22
    SolutionNameMin: Cijk_Alik_Bljk_SB_MT16x16x32_MI16x16x4x1_SN_1LDSB0_AMAS0_DTL0_EPS0_GRVW4_GSU1_IU1_LBSPP128_LPA4_LPB4_LRVW2_NEPBS4_NLCA1_NLCB1_ONLL1_PGR2_PLR9_SIA3_SS1_SU32_SUS128_SRVW0_SVW1_SNLL0_TT1_16_TLDS1_USFGROn1_VW1_WSGRA1_WSGRB1_WG16_4_1_WGM5
    SolutionIndex: 23
    SolutionNameMin: Cijk_Alik_Bljk_SB_MT16x16x32_MI16x16x4x1_SN_1LDSB0_AMAS0_DTL0_EPS0_GRVW4_GSU1_IU1_LBSPP128_LPA4_LPB4_LRVW2_NEPBS2_NLCA1_NLCB1_ONLL1_PGR2_PLR9_SIA3_SS1_SU0_SUS256_SRVW0_SVW1_SNLL0_TT1_16_TLDS1_USFGROn1_VW1_WSGRA1_WSGRB1_WG16_4_1_WGM8
    SolutionIndex: 24
    SolutionNameMin: Cijk_Alik_Bljk_SB_MT16x16x32_MI16x16x4x1_SE_1LDSB0_AMAS3_DTL0_EPS0_GRVW4_GSU1_IU1_LBSPP128_LPA4_LPB4_LRVW2_NEPBS0_NLCA1_NLCB1_ONLL1_PGR2_PLR9_SIA3_SS0_SU32_SUS128_SRVW0_SVW4_SNLL0_TT1_16_TLDS1_USFGROn1_VW2_WSGRA1_WSGRB1_WG16_4_1_WGM1
    SolutionIndex: 25
    SolutionNameMin: Cijk_Alik_Bljk_SB_MT16x16x32_MI16x16x4x1_SE_1LDSB0_AMAS3_DTL0_EPS0_GRVW4_GSU1_IU1_LBSPP128_LPA4_LPB4_LRVW2_NEPBS0_NLCA1_NLCB1_ONLL1_PGR2_PLR9_SIA3_SS0_SU0_SUS256_SRVW0_SVW4_SNLL0_TT1_16_TLDS1_USFGROn1_VW2_WSGRA1_WSGRB1_WG16_4_1_WGM1
    SolutionIndex: 26
    SolutionNameMin: Cijk_Alik_Bljk_SB_MT64x32x32_MI16x16x4x1_SN_1LDSB1_AMAS3_DTL0_EPS0_GRVW2_GSU1_IU1_LBSPP128_LPA2_LPB2_LRVW2_NEPBS4_NLCA1_NLCB1_ONLL1_PGR2_PLR9_SIA3_SS1_SU32_SUS256_SRVW0_SVW2_SNLL0_TT2_16_TLDS1_USFGROn1_VW2_WSGRA1_WSGRB1_WG32_8_1_WGM8
    SolutionIndex: 27
    SolutionNameMin: Cijk_Alik_Bljk_SB_MT64x128x32_MI32x32x2x1_SE_1LDSB1_AMAS0_DTL0_EPS1_GRVW4_GSU1_IU1_LBSPP128_LPA4_LPB4_LRVW2_NEPBS0_NLCA1_NLCB1_ONLL1_PGR1_PLR17_SIA3_SS0_SU0_SUS256_SRVW2_SVW4_SNLL0_TT1_64_TLDS1_USFGROn1_VW1_WSGRA1_WSGRB1_WG64_4_1_WGM15
    SolutionIndex: 28
    SolutionNameMin: Cijk_Alik_Bljk_SB_MT16x16x32_MI16x16x4x1_SE_1LDSB0_AMAS3_DTL0_EPS0_GRVW4_GSU1_IU1_LBSPP128_LPA4_LPB4_LRVW2_NEPBS0_NLCA1_NLCB1_ONLL1_PGR2_PLR9_SIA3_SS0_SU32_SUS256_SRVW0_SVW4_SNLL0_TT1_16_TLDS1_USFGROn1_VW2_WSGRA1_WSGRB1_WG16_4_1_WGM1
    SolutionIndex: 29
    SolutionNameMin: Cijk_Alik_Bljk_SB_MT16x16x32_MI16x16x4x1_SE_1LDSB0_AMAS3_DTL0_EPS0_GRVW2_GSU1_IU1_LBSPP128_LPA2_LPB2_LRVW2_NEPBS0_NLCA1_NLCB1_ONLL1_PGR2_PLR9_SIA3_SS0_SU0_SUS256_SRVW0_SVW4_SNLL0_TT1_16_TLDS1_USFGROn1_VW2_WSGRA1_WSGRB1_WG16_4_1_WGM2
    SolutionIndex: 30
    SolutionNameMin: Cijk_Alik_Bljk_SB_MT32x64x32_MI16x16x4x1_SE_1LDSB0_AMAS0_DTL0_EPS0_GRVW4_GSU1_IU1_LBSPP128_LPA4_LPB4_LRVW2_NEPBS0_NLCA1_NLCB1_ONLL1_PGR2_PLR9_SIA3_SS0_SU32_SUS128_SRVW2_SVW4_SNLL0_TT1_32_TLDS1_USFGROn1_VW1_WSGRA1_WSGRB1_WG32_8_1_WGM15
    SolutionIndex: 31
    SolutionNameMin: Cijk_Alik_Bljk_SB_MT128x64x32_MI32x32x2x1_SE_1LDSB0_AMAS0_DTL0_EPS0_GRVW1_GSU1_IU1_LBSPP128_LPA2_LPB2_LRVW2_NEPBS0_NLCA1_NLCB1_ONLL1_PGR2_PLR17_SIA3_SS0_SU0_SUS256_SRVW2_SVW4_SNLL0_TT2_32_TLDS1_USFGROn1_VW1_WSGRA1_WSGRB1_WG64_4_1_WGM2
    SolutionIndex: 32
    SolutionNameMin: Cijk_Alik_Bljk_SB_MT64x144x32_MI16x16x4x1_SE_1LDSB1_AMAS0_DTL0_EPS0_GRVW1_GSU1_IU1_LBSPP128_LPA2_LPB2_LRVW2_NEPBS0_NLCA1_NLCB1_ONLL1_PGR2_PLR9_SIA3_SS0_SU0_SUS256_SRVW2_SVW4_SNLL0_TT1_144_TLDS1_USFGROn1_VW1_WSGRA1_WSGRB1_WG64_4_1_WGM15
    SolutionIndex: 33
    SolutionNameMin: Cijk_Alik_Bljk_SB_MT128x96x16_MI32x32x2x1_SE_1LDSB0_AMAS0_DTL0_EPS0_GRVW2_GSU1_IU1_LBSPP128_LPA2_LPB2_LRVW2_NEPBS0_NLCA1_NLCB1_ONLL1_PGR2_PLR9_SIA3_SS0_SU0_SUS256_SRVW2_SVW4_SNLL0_TT1_96_TLDS1_USFGROn1_VW1_WSGRA1_WSGRB1_WG128_2_1_WGM15
    SolutionIndex: 34
    SolutionNameMin: Cijk_Alik_Bljk_SB_MT64x64x32_MI32x32x2x1_SE_1LDSB1_AMAS0_DTL0_EPS1_GRVW4_GSU1_IU1_LBSPP128_LPA4_LPB4_LRVW2_NEPBS0_NLCA1_NLCB1_ONLL1_PGR1_PLR17_SIA3_SS0_SU32_SUS128_SRVW2_SVW4_SNLL0_TT1_32_TLDS1_USFGROn1_VW1_WSGRA1_WSGRB1_WG64_4_1_WGM2
    SolutionIndex: 35
    SolutionNameMin: Cijk_Alik_Bljk_SB_MT64x64x32_MI32x32x2x1_SE_1LDSB1_AMAS0_DTL0_EPS0_GRVW4_GSU1_IU1_LBSPP128_LPA4_LPB4_LRVW2_NEPBS0_NLCA1_NLCB1_ONLL1_PGR2_PLR17_SIA3_SS0_SU0_SUS256_SRVW2_SVW4_SNLL0_TT1_32_TLDS1_USFGROn1_VW1_WSGRA1_WSGRB1_WG64_4_1_WGM1
    SolutionIndex: 36
    SolutionNameMin: Cijk_Alik_Bljk_SB_MT32x64x32_MI16x16x4x1_SE_1LDSB1_AMAS0_DTL0_EPS0_GRVW2_GSU1_IU1_LBSPP128_LPA2_LPB2_LRVW2_NEPBS0_NLCA1_NLCB1_ONLL1_PGR2_PLR9_SIA3_SS0_SU0_SUS256_SRVW2_SVW4_SNLL0_TT1_32_TLDS1_USFGROn1_VW1_WSGRA1_WSGRB1_WG32_8_1_WGM1
    SolutionIndex: 37
    SolutionNameMin: Cijk_Alik_Bljk_SB_MT64x192x16_MI32x32x2x1_SN_1LDSB1_AMAS0_DTL0_EPS0_GRVW2_GSU1_IU1_LBSPP128_LPA2_LPB2_LRVW2_NEPBS4_NLCA1_NLCB1_ONLL1_PGR2_PLR9_SIA3_SS1_SU32_SUS256_SRVW0_SVW1_SNLL0_TT1_96_TLDS1_USFGROn1_VW1_WSGRA1_WSGRB1_WG64_4_1_WGM10
    SolutionIndex: 38
    SolutionNameMin: Cijk_Alik_Bljk_SB_MT32x32x32_MI16x16x4x1_SE_1LDSB0_AMAS0_DTL0_EPS0_GRVW4_GSU1_IU1_LBSPP128_LPA4_LPB4_LRVW2_NEPBS0_NLCA1_NLCB1_ONLL1_PGR2_PLR9_SIA3_SS0_SU0_SUS256_SRVW2_SVW4_SNLL0_TT1_16_TLDS1_USFGROn1_VW1_WSGRA1_WSGRB1_WG32_8_1_WGM2
    SolutionIndex: 39
    SolutionNameMin: Cijk_Alik_Bljk_SB_MT64x32x32_MI16x16x4x1_SE_1LDSB0_AMAS0_DTL0_EPS0_GRVW1_GSU1_IU1_LBSPP128_LPA2_LPB2_LRVW2_NEPBS0_NLCA1_NLCB1_ONLL1_PGR2_PLR9_SIA3_SS0_SU32_SUS256_SRVW2_SVW4_SNLL0_TT2_16_TLDS1_USFGROn1_VW1_WSGRA1_WSGRB1_WG32_8_1_WGM1
    SolutionIndex: 40
    SolutionNameMin: Cijk_Alik_Bljk_SB_MT64x64x32_MI32x32x2x1_SE_1LDSB0_AMAS0_DTL0_EPS0_GRVW2_GSU1_IU1_LBSPP128_LPA2_LPB2_LRVW2_NEPBS0_NLCA1_NLCB1_ONLL1_PGR2_PLR17_SIA3_SS0_SU0_SUS256_SRVW2_SVW4_SNLL0_TT1_32_TLDS1_USFGROn1_VW1_WSGRA1_WSGRB1_WG64_4_1_WGM2
    SolutionIndex: 41
    SolutionNameMin: Cijk_Alik_Bljk_SB_MT64x32x32_MI16x16x4x1_SE_1LDSB1_AMAS0_DTL0_EPS0_GRVW2_GSU1_IU1_LBSPP128_LPA2_LPB2_LRVW2_NEPBS0_NLCA1_NLCB1_ONLL1_PGR2_PLR9_SIA3_SS0_SU0_SUS256_SRVW2_SVW4_SNLL0_TT2_16_TLDS1_USFGROn1_VW1_WSGRA1_WSGRB1_WG32_8_1_WGM15
    SolutionIndex: 42
    SolutionNameMin: Cijk_Alik_Bljk_SB_MT128x128x16_MI32x32x2x1_SE_1LDSB0_AMAS0_DTL0_EPS0_GRVW2_GSU1_IU1_LBSPP128_LPA2_LPB2_LRVW2_NEPBS0_NLCA1_NLCB1_ONLL1_PGR2_PLR9_SIA3_SS0_SU0_SUS256_SRVW2_SVW4_SNLL0_TT2_64_TLDS1_USFGROn1_VW1_WSGRA1_WSGRB1_WG64_4_1_WGM15
    SolutionIndex: 43
    SolutionNameMin: Cijk_Alik_Bljk_SB_MT128x64x16_MI32x32x2x1_SE_1LDSB0_AMAS0_DTL0_EPS0_GRVW2_GSU1_IU1_LBSPP128_LPA2_LPB2_LRVW2_NEPBS0_NLCA1_NLCB1_ONLL1_PGR2_PLR9_SIA3_SS0_SU0_SUS256_SRVW2_SVW4_SNLL0_TT2_32_TLDS1_USFGROn1_VW1_WSGRA1_WSGRB1_WG64_4_1_WGM2
    SolutionIndex: 44
    SolutionNameMin: Cijk_Alik_Bljk_SB_MT32x32x32_MI16x16x4x1_SE_1LDSB0_AMAS0_DTL0_EPS0_GRVW2_GSU1_IU1_LBSPP128_LPA2_LPB2_LRVW2_NEPBS0_NLCA1_NLCB1_ONLL1_PGR2_PLR9_SIA3_SS0_SU32_SUS128_SRVW2_SVW4_SNLL0_TT1_16_TLDS1_USFGROn1_VW1_WSGRA1_WSGRB1_WG32_8_1_WGM1
    SolutionIndex: 45
    SolutionNameMin: Cijk_Alik_Bljk_SB_MT32x32x32_MI16x16x4x1_SE_1LDSB0_AMAS0_DTL0_EPS0_GRVW1_GSU1_IU1_LBSPP128_LPA2_LPB2_LRVW2_NEPBS0_NLCA1_NLCB1_ONLL1_PGR2_PLR9_SIA3_SS0_SU32_SUS128_SRVW2_SVW4_SNLL0_TT1_16_TLDS1_USFGROn1_VW1_WSGRA1_WSGRB1_WG32_8_1_WGM2
    SolutionIndex: 46
    SolutionNameMin: Cijk_Alik_Bljk_SB_MT64x144x32_MI16x16x4x1_SE_1LDSB1_AMAS0_DTL0_EPS0_GRVW2_GSU1_IU1_LBSPP128_LPA2_LPB2_LRVW2_NEPBS0_NLCA1_NLCB1_ONLL1_PGR2_PLR9_SIA3_SS0_SU32_SUS256_SRVW2_SVW4_SNLL0_TT1_144_TLDS1_USFGROn1_VW1_WSGRA1_WSGRB1_WG64_4_1_WGM15
    SolutionIndex: 47
    SolutionNameMin: Cijk_Alik_Bljk_SB_MT32x32x32_MI16x16x4x1_SE_1LDSB1_AMAS0_DTL0_EPS1_GRVW2_GSU1_IU1_LBSPP128_LPA2_LPB2_LRVW2_NEPBS0_NLCA1_NLCB1_ONLL1_PGR1_PLR9_SIA3_SS0_SU32_SUS128_SRVW2_SVW4_SNLL0_TT1_16_TLDS1_USFGROn1_VW1_WSGRA1_WSGRB1_WG32_8_1_WGM1
    SolutionIndex: 48
    SolutionNameMin: Cijk_Alik_Bljk_SB_MT64x32x32_MI16x16x4x1_SE_1LDSB0_AMAS0_DTL0_EPS0_GRVW1_GSU1_IU1_LBSPP128_LPA2_LPB2_LRVW2_NEPBS0_NLCA1_NLCB1_ONLL1_PGR2_PLR9_SIA3_SS0_SU0_SUS256_SRVW2_SVW4_SNLL0_TT2_16_TLDS1_USFGROn1_VW1_WSGRA1_WSGRB1_WG32_8_1_WGM2
    SolutionIndex: 49
    SolutionNameMin: Cijk_Alik_Bljk_SB_MT32x32x32_MI16x16x4x1_SE_1LDSB0_AMAS0_DTL0_EPS0_GRVW2_GSU1_IU1_LBSPP128_LPA2_LPB2_LRVW2_NEPBS0_NLCA1_NLCB1_ONLL1_PGR2_PLR9_SIA3_SS0_SU0_SUS256_SRVW2_SVW4_SNLL0_TT1_16_TLDS1_USFGROn1_VW1_WSGRA1_WSGRB1_WG32_8_1_WGM1
    SolutionIndex: 50
    SolutionNameMin: Cijk_Alik_Bljk_SB_MT64x64x32_MI32x32x2x1_SE_1LDSB0_AMAS0_DTL0_EPS0_GRVW2_GSU1_IU1_LBSPP128_LPA2_LPB2_LRVW2_NEPBS0_NLCA1_NLCB1_ONLL1_PGR2_PLR17_SIA3_SS0_SU32_SUS256_SRVW2_SVW4_SNLL0_TT1_32_TLDS1_USFGROn1_VW1_WSGRA1_WSGRB1_WG64_4_1_WGM1
    SolutionIndex: 51
    SolutionNameMin: Cijk_Alik_Bljk_SB_MT32x32x32_MI16x16x4x1_SE_1LDSB1_AMAS0_DTL0_EPS0_GRVW4_GSU1_IU1_LBSPP128_LPA4_LPB4_LRVW2_NEPBS0_NLCA1_NLCB1_ONLL1_PGR2_PLR9_SIA3_SS0_SU32_SUS128_SRVW2_SVW4_SNLL0_TT1_16_TLDS1_USFGROn1_VW1_WSGRA1_WSGRB1_WG32_8_1_WGM1
    SolutionIndex: 52
    SolutionNameMin: Cijk_Alik_Bljk_SB_MT16x64x32_MI16x16x4x1_SE_1LDSB0_AMAS3_DTL0_EPS0_GRVW4_GSU1_IU1_LBSPP128_LPA4_LPB4_LRVW2_NEPBS0_NLCA1_NLCB1_ONLL1_PGR2_PLR9_SIA3_SS0_SU0_SUS256_SRVW0_SVW4_SNLL0_TT1_16_TLDS1_USFGROn1_VW2_WSGRA1_WSGRB1_WG16_16_1_WGM2
    SolutionIndex: 53
    SolutionNameMin: Cijk_Alik_Bljk_SB_MT144x64x32_MI16x16x4x1_SE_1LDSB1_AMAS0_DTL0_EPS0_GRVW1_GSU1_IU1_LBSPP128_LPA2_LPB2_LRVW2_NEPBS0_NLCA1_NLCB1_ONLL1_PGR2_PLR9_SIA3_SS0_SU32_SUS256_SRVW0_SVW4_SNLL0_TT9_16_TLDS1_USFGROn1_VW1_WSGRA1_WSGRB1_WG16_16_1_WGM15
    SolutionIndex: 54
    SolutionNameMin: Cijk_Alik_Bljk_SB_MT64x32x32_MI16x16x4x1_SE_1LDSB0_AMAS0_DTL0_EPS0_GRVW2_GSU1_IU1_LBSPP128_LPA2_LPB2_LRVW2_NEPBS0_NLCA1_NLCB1_ONLL1_PGR2_PLR9_SIA3_SS0_SU32_SUS256_SRVW2_SVW4_SNLL0_TT2_16_TLDS1_USFGROn1_VW1_WSGRA1_WSGRB1_WG32_8_1_WGM15
    SolutionIndex: 55
    SolutionNameMin: Cijk_Alik_Bljk_SB_MT64x144x32_MI16x16x4x1_SE_1LDSB0_AMAS0_DTL0_EPS0_GRVW2_GSU1_IU1_LBSPP128_LPA2_LPB2_LRVW2_NEPBS0_NLCA1_NLCB1_ONLL1_PGR2_PLR9_SIA3_SS0_SU32_SUS256_SRVW2_SVW4_SNLL0_TT1_144_TLDS1_USFGROn1_VW1_WSGRA1_WSGRB1_WG64_4_1_WGM15
    SolutionIndex: 56
    SolutionNameMin: Cijk_Alik_Bljk_SB_MT128x64x32_MI32x32x2x1_SE_1LDSB0_AMAS0_DTL0_EPS0_GRVW1_GSU1_IU1_LBSPP128_LPA2_LPB2_LRVW2_NEPBS0_NLCA1_NLCB1_ONLL1_PGR2_PLR17_SIA3_SS0_SU0_SUS256_SRVW2_SVW4_SNLL0_TT2_32_TLDS1_USFGROn1_VW1_WSGRA1_WSGRB1_WG64_4_1_WGM1
    SolutionIndex: 57
    SolutionNameMin: Cijk_Alik_Bljk_SB_MT32x32x32_MI16x16x4x1_SE_1LDSB0_AMAS0_DTL0_EPS0_GRVW1_GSU1_IU1_LBSPP128_LPA2_LPB2_LRVW2_NEPBS0_NLCA1_NLCB1_ONLL1_PGR2_PLR9_SIA3_SS0_SU0_SUS256_SRVW2_SVW4_SNLL0_TT1_16_TLDS1_USFGROn1_VW1_WSGRA1_WSGRB1_WG32_8_1_WGM1
    SolutionIndex: 58
    SolutionNameMin: Cijk_Alik_Bljk_SB_MT32x64x32_MI16x16x4x1_SE_1LDSB1_AMAS0_DTL0_EPS1_GRVW4_GSU1_IU1_LBSPP128_LPA4_LPB4_LRVW2_NEPBS0_NLCA1_NLCB1_ONLL1_PGR1_PLR9_SIA3_SS0_SU0_SUS256_SRVW2_SVW4_SNLL0_TT1_32_TLDS1_USFGROn1_VW1_WSGRA1_WSGRB1_WG32_8_1_WGM15
    SolutionIndex: 59
    SolutionNameMin: Cijk_Alik_Bljk_SB_MT32x32x32_MI16x16x4x1_SE_1LDSB1_AMAS0_DTL0_EPS1_GRVW2_GSU1_IU1_LBSPP128_LPA2_LPB2_LRVW2_NEPBS0_NLCA1_NLCB1_ONLL1_PGR1_PLR9_SIA3_SS0_SU32_SUS128_SRVW2_SVW4_SNLL0_TT1_16_TLDS1_USFGROn1_VW1_WSGRA1_WSGRB1_WG32_8_1_WGM15
    SolutionIndex: 60
    SolutionNameMin: Cijk_Alik_Bljk_SB_MT32x32x32_MI16x16x4x1_SN_1LDSB1_AMAS0_DTL0_EPS0_GRVW2_GSU1_IU1_LBSPP128_LPA2_LPB2_LRVW2_NEPBS2_NLCA1_NLCB1_ONLL1_PGR2_PLR9_SIA3_SS1_SU0_SUS256_SRVW0_SVW1_SNLL0_TT1_16_TLDS1_USFGROn1_VW1_WSGRA1_WSGRB1_WG32_8_1_WGM8
    SolutionIndex: 61
    SolutionNameMin: Cijk_Alik_Bljk_SB_MT64x128x16_MI32x32x2x1_SE_1LDSB1_AMAS0_DTL0_EPS0_GRVW4_GSU1_IU1_LBSPP128_LPA4_LPB4_LRVW2_NEPBS0_NLCA1_NLCB1_ONLL1_PGR2_PLR9_SIA3_SS0_SU0_SUS256_SRVW2_SVW4_SNLL0_TT1_64_TLDS1_USFGROn1_VW1_WSGRA1_WSGRB1_WG64_4_1_WGM1
    SolutionIndex: 62
    SolutionNameMin: Cijk_Alik_Bljk_SB_MT32x32x32_MI16x16x4x1_SE_1LDSB0_AMAS0_DTL0_EPS0_GRVW2_GSU1_IU1_LBSPP128_LPA2_LPB2_LRVW2_NEPBS0_NLCA1_NLCB1_ONLL1_PGR2_PLR9_SIA3_SS0_SU0_SUS256_SRVW2_SVW4_SNLL0_TT1_16_TLDS1_USFGROn1_VW1_WSGRA1_WSGRB1_WG32_8_1_WGM15
    SolutionIndex: 63
    SolutionNameMin: Cijk_Alik_Bljk_SB_MT16x64x32_MI16x16x4x1_SN_1LDSB1_AMAS0_DTL0_EPS0_GRVW2_GSU1_IU1_LBSPP128_LPA2_LPB2_LRVW2_NEPBS2_NLCA1_NLCB1_ONLL1_PGR2_PLR9_SIA3_SS1_SU32_SUS256_SRVW0_SVW1_SNLL0_TT1_16_TLDS1_USFGROn1_VW1_WSGRA1_WSGRB1_WG16_16_1_WGM5
    SolutionIndex: 64
    SolutionNameMin: Cijk_Alik_Bljk_SB_MT64x32x32_MI16x16x4x1_SE_1LDSB0_AMAS0_DTL0_EPS0_GRVW4_GSU1_IU1_LBSPP128_LPA4_LPB4_LRVW2_NEPBS0_NLCA1_NLCB1_ONLL1_PGR2_PLR9_SIA3_SS0_SU32_SUS128_SRVW2_SVW4_SNLL0_TT2_16_TLDS1_USFGROn1_VW1_WSGRA1_WSGRB1_WG32_8_1_WGM15
    SolutionIndex: 65
    SolutionNameMin: Cijk_Alik_Bljk_SB_MT64x64x32_MI32x32x2x1_SE_1LDSB1_AMAS0_DTL0_EPS0_GRVW4_GSU1_IU1_LBSPP128_LPA4_LPB4_LRVW2_NEPBS0_NLCA1_NLCB1_ONLL1_PGR2_PLR17_SIA3_SS0_SU0_SUS256_SRVW2_SVW4_SNLL0_TT1_32_TLDS1_USFGROn1_VW1_WSGRA1_WSGRB1_WG64_4_1_WGM2
    SolutionIndex: 66
    SolutionNameMin: Cijk_Alik_Bljk_SB_MT16x16x32_MI16x16x4x1_SE_1LDSB1_AMAS3_DTL0_EPS1_GRVW4_GSU1_IU1_LBSPP128_LPA4_LPB4_LRVW2_NEPBS0_NLCA1_NLCB1_ONLL1_PGR1_PLR9_SIA3_SS0_SU0_SUS256_SRVW0_SVW4_SNLL0_TT1_16_TLDS1_USFGROn1_VW2_WSGRA1_WSGRB1_WG16_4_1_WGM1
    SolutionIndex: 67
    SolutionNameMin: Cijk_Alik_Bljk_SB_MT128x64x16_MI32x32x2x1_SE_1LDSB1_AMAS0_DTL0_EPS0_GRVW2_GSU1_IU1_LBSPP128_LPA2_LPB2_LRVW2_NEPBS0_NLCA1_NLCB1_ONLL1_PGR2_PLR9_SIA3_SS0_SU0_SUS256_SRVW2_SVW4_SNLL0_TT2_32_TLDS1_USFGROn1_VW1_WSGRA1_WSGRB1_WG64_4_1_WGM1
    SolutionIndex: 68
    SolutionNameMin: Cijk_Alik_Bljk_SB_MT32x32x32_MI16x16x4x1_SN_1LDSB1_AMAS0_DTL0_EPS0_GRVW2_GSU1_IU1_LBSPP128_LPA2_LPB2_LRVW2_NEPBS1_NLCA1_NLCB1_ONLL1_PGR2_PLR9_SIA3_SS1_SU0_SUS256_SRVW0_SVW1_SNLL0_TT1_16_TLDS1_USFGROn1_VW1_WSGRA1_WSGRB1_WG32_8_1_WGM5
    SolutionIndex: 69
    SolutionNameMin: Cijk_Alik_Bljk_SB_MT144x64x32_MI16x16x4x1_SE_1LDSB0_AMAS0_DTL0_EPS0_GRVW2_GSU1_IU1_LBSPP128_LPA2_LPB2_LRVW2_NEPBS0_NLCA1_NLCB1_ONLL1_PGR2_PLR9_SIA3_SS0_SU32_SUS256_SRVW0_SVW4_SNLL0_TT9_16_TLDS1_USFGROn1_VW1_WSGRA1_WSGRB1_WG16_16_1_WGM15
    SolutionIndex: 70
    SolutionNameMin: Cijk_Alik_Bljk_SB_MT64x64x32_MI32x32x2x1_SE_1LDSB1_AMAS0_DTL0_EPS1_GRVW4_GSU1_IU1_LBSPP128_LPA4_LPB4_LRVW2_NEPBS0_NLCA1_NLCB1_ONLL1_PGR1_PLR17_SIA3_SS0_SU0_SUS256_SRVW2_SVW4_SNLL0_TT1_32_TLDS1_USFGROn1_VW1_WSGRA1_WSGRB1_WG64_4_1_WGM2
    SolutionIndex: 71
    SolutionNameMin: Cijk_Alik_Bljk_SB_MT64x64x32_MI32x32x2x1_SE_1LDSB0_AMAS0_DTL0_EPS0_GRVW2_GSU1_IU1_LBSPP128_LPA2_LPB2_LRVW2_NEPBS0_NLCA1_NLCB1_ONLL1_PGR2_PLR17_SIA3_SS0_SU0_SUS256_SRVW2_SVW4_SNLL0_TT1_32_TLDS1_USFGROn1_VW1_WSGRA1_WSGRB1_WG64_4_1_WGM1
    SolutionIndex: 72
    SolutionNameMin: Cijk_Alik_Bljk_SB_MT16x16x32_MI16x16x4x1_SE_1LDSB0_AMAS3_DTL0_EPS0_GRVW2_GSU1_IU1_LBSPP128_LPA2_LPB2_LRVW2_NEPBS0_NLCA1_NLCB1_ONLL1_PGR2_PLR9_SIA3_SS0_SU0_SUS256_SRVW0_SVW4_SNLL0_TT1_16_TLDS1_USFGROn1_VW2_WSGRA1_WSGRB1_WG16_4_1_WGM15
    SolutionIndex: 73
    SolutionNameMin: Cijk_Alik_Bljk_SB_MT128x160x16_MI32x32x2x1_SE_1LDSB1_AMAS0_DTL0_EPS1_GRVW1_GSU1_IU1_LBSPP128_LPA2_LPB2_LRVW2_NEPBS0_NLCA1_NLCB1_ONLL1_PGR1_PLR9_SIA3_SS0_SU0_SUS256_SRVW2_SVW4_SNLL0_TT1_160_TLDS1_USFGROn1_VW1_WSGRA1_WSGRB1_WG128_2_1_WGM1
    SolutionIndex: 74
    SolutionNameMin: Cijk_Alik_Bljk_SB_MT16x64x32_MI16x16x4x1_SN_1LDSB1_AMAS0_DTL0_EPS0_GRVW4_GSU1_IU1_LBSPP128_LPA4_LPB4_LRVW2_NEPBS4_NLCA1_NLCB1_ONLL1_PGR2_PLR9_SIA3_SS1_SU0_SUS256_SRVW0_SVW1_SNLL0_TT1_16_TLDS1_USFGROn1_VW1_WSGRA1_WSGRB1_WG16_16_1_WGM8
    SolutionIndex: 75
    SolutionNameMin: Cijk_Alik_Bljk_SB_MT64x64x32_MI32x32x2x1_SE_1LDSB1_AMAS0_DTL0_EPS1_GRVW4_GSU1_IU1_LBSPP128_LPA4_LPB4_LRVW2_NEPBS0_NLCA1_NLCB1_ONLL1_PGR1_PLR17_SIA3_SS0_SU32_SUS256_SRVW2_SVW4_SNLL0_TT1_32_TLDS1_USFGROn1_VW1_WSGRA1_WSGRB1_WG64_4_1_WGM1
    SolutionIndex: 76
    SolutionNameMin: Cijk_Alik_Bljk_SB_MT64x128x16_MI32x32x2x1_SE_1LDSB0_AMAS0_DTL0_EPS0_GRVW4_GSU1_IU1_LBSPP128_LPA4_LPB4_LRVW2_NEPBS0_NLCA1_NLCB1_ONLL1_PGR2_PLR9_SIA3_SS0_SU0_SUS256_SRVW2_SVW4_SNLL0_TT1_64_TLDS1_USFGROn1_VW1_WSGRA1_WSGRB1_WG64_4_1_WGM1
    SolutionIndex: 77
    SolutionNameMin: Cijk_Alik_Bljk_SB_MT64x144x32_MI16x16x4x1_SE_1LDSB1_AMAS0_DTL0_EPS0_GRVW1_GSU1_IU1_LBSPP128_LPA2_LPB2_LRVW2_NEPBS0_NLCA1_NLCB1_ONLL1_PGR2_PLR9_SIA3_SS0_SU32_SUS128_SRVW2_SVW4_SNLL0_TT1_144_TLDS1_USFGROn1_VW1_WSGRA1_WSGRB1_WG64_4_1_WGM15
    SolutionIndex: 78
    SolutionNameMin: Cijk_Alik_Bljk_SB_MT64x128x16_MI32x32x2x1_SE_1LDSB1_AMAS0_DTL0_EPS0_GRVW2_GSU1_IU1_LBSPP128_LPA2_LPB2_LRVW2_NEPBS0_NLCA1_NLCB1_ONLL1_PGR2_PLR9_SIA3_SS0_SU32_SUS128_SRVW2_SVW4_SNLL0_TT1_64_TLDS1_USFGROn1_VW1_WSGRA1_WSGRB1_WG64_4_1_WGM1
    SolutionIndex: 79
    SolutionNameMin: Cijk_Alik_Bljk_SB_MT32x32x32_MI16x16x4x1_SE_1LDSB0_AMAS0_DTL0_EPS0_GRVW4_GSU1_IU1_LBSPP128_LPA4_LPB4_LRVW2_NEPBS0_NLCA1_NLCB1_ONLL1_PGR2_PLR9_SIA3_SS0_SU32_SUS128_SRVW2_SVW4_SNLL0_TT1_16_TLDS1_USFGROn1_VW1_WSGRA1_WSGRB1_WG32_8_1_WGM1
    SolutionIndex: 80
    SolutionNameMin: Cijk_Alik_Bljk_SB_MT64x64x32_MI32x32x2x1_SE_1LDSB1_AMAS0_DTL0_EPS0_GRVW4_GSU1_IU1_LBSPP128_LPA4_LPB4_LRVW2_NEPBS0_NLCA1_NLCB1_ONLL1_PGR2_PLR17_SIA3_SS0_SU32_SUS256_SRVW2_SVW4_SNLL0_TT1_32_TLDS1_USFGROn1_VW1_WSGRA1_WSGRB1_WG64_4_1_WGM1
    SolutionIndex: 81
    SolutionNameMin: Cijk_Alik_Bljk_SB_MT64x128x16_MI32x32x2x1_SE_1LDSB0_AMAS0_DTL0_EPS0_GRVW1_GSU1_IU1_LBSPP128_LPA2_LPB2_LRVW2_NEPBS0_NLCA1_NLCB1_ONLL1_PGR2_PLR9_SIA3_SS0_SU0_SUS256_SRVW2_SVW4_SNLL0_TT1_64_TLDS1_USFGROn1_VW1_WSGRA1_WSGRB1_WG64_4_1_WGM2
    SolutionIndex: 82
    SolutionNameMin: Cijk_Alik_Bljk_SB_MT16x16x32_MI16x16x4x1_SN_1LDSB0_AMAS0_DTL0_EPS0_GRVW4_GSU1_IU1_LBSPP128_LPA4_LPB4_LRVW2_NEPBS8_NLCA1_NLCB1_ONLL1_PGR2_PLR9_SIA3_SS1_SU0_SUS256_SRVW0_SVW1_SNLL0_TT1_16_TLDS1_USFGROn1_VW1_WSGRA1_WSGRB1_WG16_4_1_WGM8
    SolutionIndex: 83
    SolutionNameMin: Cijk_Alik_Bljk_SB_MT144x64x16_MI16x16x4x1_SE_1LDSB0_AMAS0_DTL0_EPS0_GRVW1_GSU1_IU1_LBSPP128_LPA2_LPB2_LRVW2_NEPBS0_NLCA1_NLCB1_ONLL1_PGR2_PLR5_SIA3_SS0_SU0_SUS256_SRVW0_SVW4_SNLL0_TT9_16_TLDS1_USFGROn1_VW1_WSGRA1_WSGRB1_WG16_16_1_WGM1
    SolutionIndex: 84
    SolutionNameMin: Cijk_Alik_Bljk_SB_MT64x64x32_MI32x32x2x1_SE_1LDSB0_AMAS0_DTL0_EPS0_GRVW2_GSU1_IU1_LBSPP128_LPA2_LPB2_LRVW2_NEPBS0_NLCA1_NLCB1_ONLL1_PGR2_PLR17_SIA3_SS0_SU0_SUS256_SRVW2_SVW4_SNLL0_TT1_32_TLDS1_USFGROn1_VW1_WSGRA1_WSGRB1_WG64_4_1_WGM15
    SolutionIndex: 85
    SolutionNameMin: Cijk_Alik_Bljk_SB_MT16x16x32_MI16x16x4x1_SN_1LDSB0_AMAS0_DTL0_EPS0_GRVW4_GSU1_IU1_LBSPP128_LPA4_LPB4_LRVW2_NEPBS2_NLCA1_NLCB1_ONLL1_PGR2_PLR9_SIA3_SS1_SU0_SUS256_SRVW0_SVW1_SNLL0_TT1_16_TLDS1_USFGROn1_VW1_WSGRA1_WSGRB1_WG16_4_1_WGM10
    SolutionIndex: 86
    SolutionNameMin: Cijk_Alik_Bljk_SB_MT64x16x32_MI16x16x4x1_SN_1LDSB1_AMAS0_DTL0_EPS0_GRVW4_GSU1_IU1_LBSPP128_LPA4_LPB4_LRVW2_NEPBS2_NLCA1_NLCB1_ONLL1_PGR2_PLR9_SIA3_SS1_SU32_SUS256_SRVW0_SVW1_SNLL0_TT1_16_TLDS1_USFGROn1_VW1_WSGRA1_WSGRB1_WG64_4_1_WGM8
    SolutionIndex: 87
    SolutionNameMin: Cijk_Alik_Bljk_SB_MT64x32x32_MI16x16x4x1_SE_1LDSB1_AMAS0_DTL0_EPS0_GRVW2_GSU1_IU1_LBSPP128_LPA2_LPB2_LRVW2_NEPBS0_NLCA1_NLCB1_ONLL1_PGR2_PLR9_SIA3_SS0_SU32_SUS256_SRVW2_SVW4_SNLL0_TT2_16_TLDS1_USFGROn1_VW1_WSGRA1_WSGRB1_WG32_8_1_WGM2
    SolutionIndex: 88
    SolutionNameMin: Cijk_Alik_Bljk_SB_MT16x16x32_MI16x16x4x1_SE_1LDSB0_AMAS3_DTL0_EPS0_GRVW1_GSU1_IU1_LBSPP128_LPA2_LPB2_LRVW2_NEPBS0_NLCA1_NLCB1_ONLL1_PGR2_PLR9_SIA3_SS0_SU0_SUS256_SRVW0_SVW4_SNLL0_TT1_16_TLDS1_USFGROn1_VW2_WSGRA1_WSGRB1_WG16_4_1_WGM1
    SolutionIndex: 89
    SolutionNameMin: Cijk_Alik_Bljk_SB_MT32x64x32_MI16x16x4x1_SE_1LDSB1_AMAS0_DTL0_EPS0_GRVW4_GSU1_IU1_LBSPP128_LPA4_LPB4_LRVW2_NEPBS0_NLCA1_NLCB1_ONLL1_PGR2_PLR9_SIA3_SS0_SU0_SUS256_SRVW2_SVW4_SNLL0_TT1_32_TLDS1_USFGROn1_VW1_WSGRA1_WSGRB1_WG32_8_1_WGM2
    SolutionIndex: 90
    SolutionNameMin: Cijk_Alik_Bljk_SB_MT128x160x16_MI32x32x2x1_SE_1LDSB1_AMAS0_DTL0_EPS1_GRVW1_GSU1_IU1_LBSPP128_LPA2_LPB2_LRVW2_NEPBS0_NLCA1_NLCB1_ONLL1_PGR1_PLR9_SIA3_SS0_SU0_SUS256_SRVW2_SVW4_SNLL0_TT1_160_TLDS1_USFGROn1_VW1_WSGRA1_WSGRB1_WG128_2_1_WGM2
    SolutionIndex: 91
    SolutionNameMin: Cijk_Alik_Bljk_SB_MT64x32x32_MI16x16x4x1_SE_1LDSB0_AMAS0_DTL0_EPS0_GRVW2_GSU1_IU1_LBSPP128_LPA2_LPB2_LRVW2_NEPBS0_NLCA1_NLCB1_ONLL1_PGR2_PLR9_SIA3_SS0_SU32_SUS128_SRVW2_SVW4_SNLL0_TT2_16_TLDS1_USFGROn1_VW1_WSGRA1_WSGRB1_WG32_8_1_WGM15
    SolutionIndex: 92
    SolutionNameMin: Cijk_Alik_Bljk_SB_MT32x64x32_MI16x16x4x1_SE_1LDSB0_AMAS0_DTL0_EPS0_GRVW1_GSU1_IU1_LBSPP128_LPA2_LPB2_LRVW2_NEPBS0_NLCA1_NLCB1_ONLL1_PGR2_PLR9_SIA3_SS0_SU0_SUS256_SRVW2_SVW4_SNLL0_TT1_32_TLDS1_USFGROn1_VW1_WSGRA1_WSGRB1_WG32_8_1_WGM1
    SolutionIndex: 93
    SolutionNameMin: Cijk_Alik_Bljk_SB_MT32x32x32_MI16x16x4x1_SE_1LDSB0_AMAS0_DTL0_EPS0_GRVW2_GSU1_IU1_LBSPP128_LPA2_LPB2_LRVW2_NEPBS0_NLCA1_NLCB1_ONLL1_PGR2_PLR9_SIA3_SS0_SU32_SUS256_SRVW2_SVW4_SNLL0_TT1_16_TLDS1_USFGROn1_VW1_WSGRA1_WSGRB1_WG32_8_1_WGM1
    SolutionIndex: 94
    SolutionNameMin: Cijk_Alik_Bljk_SB_MT64x128x16_MI32x32x2x1_SE_1LDSB0_AMAS0_DTL0_EPS0_GRVW2_GSU1_IU1_LBSPP128_LPA2_LPB2_LRVW2_NEPBS0_NLCA1_NLCB1_ONLL1_PGR2_PLR9_SIA3_SS0_SU0_SUS256_SRVW2_SVW4_SNLL0_TT1_64_TLDS1_USFGROn1_VW1_WSGRA1_WSGRB1_WG64_4_1_WGM15
    SolutionIndex: 95
    SolutionNameMin: Cijk_Alik_Bljk_SB_MT64x128x16_MI32x32x2x1_SE_1LDSB0_AMAS0_DTL0_EPS0_GRVW1_GSU1_IU1_LBSPP128_LPA2_LPB2_LRVW2_NEPBS0_NLCA1_NLCB1_ONLL1_PGR2_PLR9_SIA3_SS0_SU0_SUS256_SRVW2_SVW4_SNLL0_TT1_64_TLDS1_USFGROn1_VW1_WSGRA1_WSGRB1_WG64_4_1_WGM15
    SolutionIndex: 96
    SolutionNameMin: Cijk_Alik_Bljk_SB_MT64x64x32_MI32x32x2x1_SE_1LDSB1_AMAS0_DTL0_EPS1_GRVW2_GSU1_IU1_LBSPP128_LPA2_LPB2_LRVW2_NEPBS0_NLCA1_NLCB1_ONLL1_PGR1_PLR17_SIA3_SS0_SU32_SUS256_SRVW2_SVW4_SNLL0_TT1_32_TLDS1_USFGROn1_VW1_WSGRA1_WSGRB1_WG64_4_1_WGM2
    SolutionIndex: 97
    SolutionNameMin: Cijk_Alik_Bljk_SB_MT64x64x32_MI32x32x2x1_SE_1LDSB0_AMAS0_DTL0_EPS0_GRVW1_GSU1_IU1_LBSPP128_LPA2_LPB2_LRVW2_NEPBS0_NLCA1_NLCB1_ONLL1_PGR2_PLR17_SIA3_SS0_SU0_SUS256_SRVW2_SVW4_SNLL0_TT1_32_TLDS1_USFGROn1_VW1_WSGRA1_WSGRB1_WG64_4_1_WGM2
    SolutionIndex: 98
    SolutionNameMin: Cijk_Alik_Bljk_SB_MT64x64x32_MI32x32x2x1_SE_1LDSB1_AMAS0_DTL0_EPS0_GRVW4_GSU1_IU1_LBSPP128_LPA4_LPB4_LRVW2_NEPBS0_NLCA1_NLCB1_ONLL1_PGR2_PLR17_SIA3_SS0_SU32_SUS128_SRVW2_SVW4_SNLL0_TT1_32_TLDS1_USFGROn1_VW1_WSGRA1_WSGRB1_WG64_4_1_WGM1
    SolutionIndex: 99
    SolutionNameMin: Cijk_Alik_Bljk_SB_MT64x128x16_MI32x32x2x1_SE_1LDSB0_AMAS0_DTL0_EPS0_GRVW2_GSU1_IU1_LBSPP128_LPA2_LPB2_LRVW2_NEPBS0_NLCA1_NLCB1_ONLL1_PGR2_PLR9_SIA3_SS0_SU32_SUS256_SRVW2_SVW4_SNLL0_TT1_64_TLDS1_USFGROn1_VW1_WSGRA1_WSGRB1_WG64_4_1_WGM15
    SolutionIndex: 100
    SolutionNameMin: Cijk_Alik_Bljk_SB_MT16x16x32_MI16x16x4x1_SE_1LDSB1_AMAS3_DTL0_EPS1_GRVW4_GSU1_IU1_LBSPP128_LPA4_LPB4_LRVW2_NEPBS0_NLCA1_NLCB1_ONLL1_PGR1_PLR9_SIA3_SS0_SU0_SUS256_SRVW2_SVW4_SNLL0_TT1_16_TLDS1_USFGROn1_VW2_WSGRA1_WSGRB1_WG16_4_1_WGM1
    SolutionIndex: 101
    SolutionNameMin: Cijk_Alik_Bljk_SB_MT64x128x32_MI32x32x2x1_SE_1LDSB0_AMAS0_DTL0_EPS0_GRVW1_GSU1_IU1_LBSPP128_LPA2_LPB2_LRVW2_NEPBS0_NLCA1_NLCB1_ONLL1_PGR2_PLR17_SIA3_SS0_SU0_SUS256_SRVW2_SVW4_SNLL0_TT1_64_TLDS1_USFGROn1_VW1_WSGRA1_WSGRB1_WG64_4_1_WGM15
    SolutionIndex: 102
    SolutionNameMin: Cijk_Alik_Bljk_SB_MT64x128x16_MI32x32x2x1_SE_1LDSB1_AMAS0_DTL0_EPS0_GRVW2_GSU1_IU1_LBSPP128_LPA2_LPB2_LRVW2_NEPBS0_NLCA1_NLCB1_ONLL1_PGR2_PLR9_SIA3_SS0_SU32_SUS256_SRVW2_SVW4_SNLL0_TT1_64_TLDS1_USFGROn1_VW1_WSGRA1_WSGRB1_WG64_4_1_WGM2
    SolutionIndex: 103
    SolutionNameMin: Cijk_Alik_Bljk_SB_MT32x64x32_MI16x16x4x1_SE_1LDSB0_AMAS0_DTL0_EPS0_GRVW1_GSU1_IU1_LBSPP128_LPA2_LPB2_LRVW2_NEPBS0_NLCA1_NLCB1_ONLL1_PGR2_PLR9_SIA3_SS0_SU0_SUS256_SRVW2_SVW4_SNLL0_TT1_32_TLDS1_USFGROn1_VW1_WSGRA1_WSGRB1_WG32_8_1_WGM15
    SolutionIndex: 104
    SolutionNameMin: Cijk_Alik_Bljk_SB_MT64x64x32_MI32x32x2x1_SE_1LDSB1_AMAS0_DTL0_EPS1_GRVW2_GSU1_IU1_LBSPP128_LPA2_LPB2_LRVW2_NEPBS0_NLCA1_NLCB1_ONLL1_PGR1_PLR17_SIA3_SS0_SU32_SUS256_SRVW2_SVW4_SNLL0_TT1_32_TLDS1_USFGROn1_VW1_WSGRA1_WSGRB1_WG64_4_1_WGM1
    SolutionIndex: 105
    SolutionNameMin: Cijk_Alik_Bljk_SB_MT64x32x32_MI16x16x4x1_SE_1LDSB0_AMAS0_DTL0_EPS0_GRVW1_GSU1_IU1_LBSPP128_LPA2_LPB2_LRVW2_NEPBS0_NLCA1_NLCB1_ONLL1_PGR2_PLR9_SIA3_SS0_SU0_SUS256_SRVW2_SVW4_SNLL0_TT2_16_TLDS1_USFGROn1_VW1_WSGRA1_WSGRB1_WG32_8_1_WGM15
    SolutionIndex: 106
    SolutionNameMin: Cijk_Alik_Bljk_SB_MT64x128x32_MI32x32x2x1_SE_1LDSB1_AMAS0_DTL0_EPS0_GRVW1_GSU1_IU1_LBSPP128_LPA2_LPB2_LRVW2_NEPBS0_NLCA1_NLCB1_ONLL1_PGR2_PLR17_SIA3_SS0_SU0_SUS256_SRVW2_SVW4_SNLL0_TT1_64_TLDS1_USFGROn1_VW1_WSGRA1_WSGRB1_WG64_4_1_WGM15
    SolutionIndex: 107
    SolutionNameMin: Cijk_Alik_Bljk_SB_MT64x64x32_MI32x32x2x1_SE_1LDSB1_AMAS0_DTL0_EPS0_GRVW4_GSU1_IU1_LBSPP128_LPA4_LPB4_LRVW2_NEPBS0_NLCA1_NLCB1_ONLL1_PGR2_PLR17_SIA3_SS0_SU32_SUS256_SRVW2_SVW4_SNLL0_TT1_32_TLDS1_USFGROn1_VW1_WSGRA1_WSGRB1_WG64_4_1_WGM15
    SolutionIndex: 108
    SolutionNameMin: Cijk_Alik_Bljk_SB_MT128x96x16_MI32x32x2x1_SE_1LDSB0_AMAS0_DTL0_EPS0_GRVW1_GSU1_IU1_LBSPP128_LPA2_LPB2_LRVW2_NEPBS0_NLCA1_NLCB1_ONLL1_PGR2_PLR9_SIA3_SS0_SU0_SUS256_SRVW2_SVW4_SNLL0_TT1_96_TLDS1_USFGROn1_VW1_WSGRA1_WSGRB1_WG128_2_1_WGM2
    SolutionIndex: 109
    SolutionNameMin: Cijk_Alik_Bljk_SB_MT32x32x32_MI16x16x4x1_SE_1LDSB0_AMAS0_DTL0_EPS0_GRVW1_GSU1_IU1_LBSPP128_LPA2_LPB2_LRVW2_NEPBS0_NLCA1_NLCB1_ONLL1_PGR2_PLR9_SIA3_SS0_SU0_SUS256_SRVW2_SVW4_SNLL0_TT1_16_TLDS1_USFGROn1_VW1_WSGRA1_WSGRB1_WG32_8_1_WGM15
    SolutionIndex: 110
    SolutionNameMin: Cijk_Alik_Bljk_SB_MT64x128x16_MI32x32x2x1_SE_1LDSB0_AMAS0_DTL0_EPS0_GRVW4_GSU1_IU1_LBSPP128_LPA4_LPB4_LRVW2_NEPBS0_NLCA1_NLCB1_ONLL1_PGR2_PLR9_SIA3_SS0_SU0_SUS256_SRVW2_SVW4_SNLL0_TT1_64_TLDS1_USFGROn1_VW1_WSGRA1_WSGRB1_WG64_4_1_WGM15
    SolutionIndex: 111
    SolutionNameMin: Cijk_Alik_Bljk_SB_MT32x32x32_MI16x16x4x1_SE_1LDSB1_AMAS0_DTL0_EPS1_GRVW4_GSU1_IU1_LBSPP128_LPA4_LPB4_LRVW2_NEPBS0_NLCA1_NLCB1_ONLL1_PGR1_PLR9_SIA3_SS0_SU0_SUS256_SRVW2_SVW4_SNLL0_TT1_16_TLDS1_USFGROn1_VW1_WSGRA1_WSGRB1_WG32_8_1_WGM1
    SolutionIndex: 112
    SolutionNameMin: Cijk_Alik_Bljk_SB_MT32x32x32_MI16x16x4x1_SE_1LDSB1_AMAS0_DTL0_EPS1_GRVW1_GSU1_IU1_LBSPP128_LPA2_LPB2_LRVW2_NEPBS0_NLCA1_NLCB1_ONLL1_PGR1_PLR9_SIA3_SS0_SU0_SUS256_SRVW2_SVW4_SNLL0_TT1_16_TLDS1_USFGROn1_VW1_WSGRA1_WSGRB1_WG32_8_1_WGM15
    SolutionIndex: 113
    SolutionNameMin: Cijk_Alik_Bljk_SB_MT128x144x16_MI16x16x4x1_SE_1LDSB1_AMAS0_DTL0_EPS0_GRVW1_GSU1_IU1_LBSPP128_LPA2_LPB2_LRVW2_NEPBS0_NLCA1_NLCB1_ONLL1_PGR2_PLR5_SIA3_SS0_SU0_SUS256_SRVW2_SVW4_SNLL0_TT2_144_TLDS1_USFGROn1_VW1_WSGRA1_WSGRB1_WG64_4_1_WGM1
    SolutionIndex: 114
    SolutionNameMin: Cijk_Alik_Bljk_SB_MT64x128x32_MI32x32x2x1_SE_1LDSB1_AMAS0_DTL0_EPS1_GRVW2_GSU1_IU1_LBSPP128_LPA2_LPB2_LRVW2_NEPBS0_NLCA1_NLCB1_ONLL1_PGR1_PLR17_SIA3_SS0_SU0_SUS256_SRVW2_SVW4_SNLL0_TT1_64_TLDS1_USFGROn1_VW1_WSGRA1_WSGRB1_WG64_4_1_WGM15
    SolutionIndex: 115
    SolutionNameMin: Cijk_Alik_Bljk_SB_MT64x64x32_MI32x32x2x1_SE_1LDSB1_AMAS0_DTL0_EPS1_GRVW1_GSU1_IU1_LBSPP128_LPA2_LPB2_LRVW2_NEPBS0_NLCA1_NLCB1_ONLL1_PGR1_PLR17_SIA3_SS0_SU0_SUS256_SRVW2_SVW4_SNLL0_TT1_32_TLDS1_USFGROn1_VW1_WSGRA1_WSGRB1_WG64_4_1_WGM15
    SolutionIndex: 116
    SolutionNameMin: Cijk_Alik_Bljk_SB_MT16x16x32_MI16x16x4x1_SE_1LDSB1_AMAS3_DTL0_EPS1_GRVW4_GSU1_IU1_LBSPP128_LPA4_LPB4_LRVW2_NEPBS0_NLCA1_NLCB1_ONLL1_PGR1_PLR9_SIA3_SS0_SU0_SUS256_SRVW0_SVW4_SNLL0_TT1_16_TLDS1_USFGROn1_VW2_WSGRA1_WSGRB1_WG16_4_1_WGM15
    SolutionIndex: 117
    SolutionNameMin: Cijk_Alik_Bljk_SB_MT128x96x16_MI32x32x2x1_SE_1LDSB1_AMAS0_DTL0_EPS0_GRVW1_GSU1_IU1_LBSPP128_LPA2_LPB2_LRVW2_NEPBS0_NLCA1_NLCB1_ONLL1_PGR2_PLR9_SIA3_SS0_SU0_SUS256_SRVW2_SVW4_SNLL0_TT1_96_TLDS1_USFGROn1_VW1_WSGRA1_WSGRB1_WG128_2_1_WGM15
    SolutionIndex: 118
    SolutionNameMin: Cijk_Alik_Bljk_SB_MT32x64x16_MI16x16x4x1_SE_1LDSB1_AMAS0_DTL0_EPS1_GRVW1_GSU1_IU1_LBSPP128_LPA2_LPB2_LRVW2_NEPBS0_NLCA1_NLCB1_ONLL1_PGR1_PLR5_SIA3_SS0_SU0_SUS256_SRVW2_SVW4_SNLL0_TT1_32_TLDS1_USFGROn1_VW1_WSGRA1_WSGRB1_WG32_8_1_WGM15
    SolutionIndex: 119
    SolutionNameMin: Cijk_Alik_Bljk_SB_MT96x96x16_MI16x16x4x1_SE_1LDSB1_AMAS0_DTL0_EPS0_GRVW1_GSU1_IU1_LBSPP128_LPA2_LPB2_LRVW2_NEPBS0_NLCA1_NLCB1_ONLL1_PGR2_PLR5_SIA3_SS0_SU0_SUS256_SRVW0_SVW4_SNLL0_TT3_48_TLDS1_USFGROn1_VW1_WSGRA1_WSGRB1_WG32_8_1_WGM1
    SolutionIndex: 120
    SolutionNameMin: Cijk_Alik_Bljk_SB_MT64x32x16_MI16x16x4x1_SE_1LDSB0_AMAS0_DTL0_EPS0_GRVW4_GSU1_IU1_LBSPP128_LPA4_LPB4_LRVW2_NEPBS0_NLCA1_NLCB1_ONLL1_PGR2_PLR5_SIA3_SS0_SU32_SUS128_SRVW2_SVW4_SNLL0_TT2_16_TLDS1_USFGROn1_VW1_WSGRA1_WSGRB1_WG32_8_1_WGM1
    SolutionIndex: 121
    SolutionNameMin: Cijk_Alik_Bljk_SB_MT16x16x16_MI16x16x4x1_SN_1LDSB0_AMAS0_DTL0_EPS0_GRVW2_GSU1_IU1_LBSPP128_LPA2_LPB2_LRVW2_NEPBS4_NLCA1_NLCB1_ONLL1_PGR2_PLR5_SIA3_SS1_SU0_SUS256_SRVW0_SVW1_SNLL0_TT1_16_TLDS1_USFGROn1_VW1_WSGRA1_WSGRB1_WG16_4_1_WGM10
    SolutionIndex: 122
    SolutionNameMin: Cijk_Alik_Bljk_SB_MT64x32x32_MI16x16x4x1_SE_1LDSB0_AMAS0_DTL0_EPS0_GRVW1_GSU1_IU1_LBSPP128_LPA2_LPB2_LRVW2_NEPBS0_NLCA1_NLCB1_ONLL1_PGR2_PLR9_SIA3_SS0_SU0_SUS256_SRVW2_SVW4_SNLL0_TT2_16_TLDS1_USFGROn1_VW1_WSGRA1_WSGRB1_WG32_8_1_WGM1
    SolutionIndex: 123
    SolutionNameMin: Cijk_Alik_Bljk_SB_MT64x64x32_MI32x32x2x1_SE_1LDSB0_AMAS0_DTL0_EPS0_GRVW4_GSU1_IU1_LBSPP128_LPA4_LPB4_LRVW2_NEPBS0_NLCA1_NLCB1_ONLL1_PGR2_PLR17_SIA3_SS0_SU0_SUS256_SRVW2_SVW4_SNLL0_TT1_32_TLDS1_USFGROn1_VW1_WSGRA1_WSGRB1_WG64_4_1_WGM15
    SolutionIndex: 124
    SolutionNameMin: Cijk_Alik_Bljk_SB_MT64x64x32_MI32x32x2x1_SE_1LDSB0_AMAS0_DTL0_EPS0_GRVW1_GSU1_IU1_LBSPP128_LPA2_LPB2_LRVW2_NEPBS0_NLCA1_NLCB1_ONLL1_PGR2_PLR17_SIA3_SS0_SU0_SUS256_SRVW2_SVW4_SNLL0_TT1_32_TLDS1_USFGROn1_VW1_WSGRA1_WSGRB1_WG64_4_1_WGM1
    SolutionIndex: 125
    SolutionNameMin: Cijk_Alik_Bljk_SB_MT16x16x16_MI16x16x4x1_SN_1LDSB0_AMAS0_DTL0_EPS0_GRVW4_GSU1_IU1_LBSPP128_LPA4_LPB4_LRVW2_NEPBS4_NLCA1_NLCB1_ONLL1_PGR2_PLR5_SIA3_SS1_SU0_SUS256_SRVW0_SVW1_SNLL0_TT1_16_TLDS1_USFGROn1_VW1_WSGRA1_WSGRB1_WG16_4_1_WGM5
    SolutionIndex: 126
    SolutionNameMin: Cijk_Alik_Bljk_SB_MT64x64x32_MI32x32x2x1_SE_1LDSB1_AMAS0_DTL0_EPS1_GRVW1_GSU1_IU1_LBSPP128_LPA2_LPB2_LRVW2_NEPBS0_NLCA1_NLCB1_ONLL1_PGR1_PLR17_SIA3_SS0_SU0_SUS256_SRVW2_SVW4_SNLL0_TT1_32_TLDS1_USFGROn1_VW1_WSGRA1_WSGRB1_WG64_4_1_WGM2
    SolutionIndex: 127
    SolutionNameMin: Cijk_Alik_Bljk_SB_MT32x32x32_MI16x16x4x1_SE_1LDSB0_AMAS0_DTL0_EPS0_GRVW1_GSU1_IU1_LBSPP128_LPA2_LPB2_LRVW2_NEPBS0_NLCA1_NLCB1_ONLL1_PGR2_PLR9_SIA3_SS0_SU32_SUS256_SRVW2_SVW4_SNLL0_TT1_16_TLDS1_USFGROn1_VW1_WSGRA1_WSGRB1_WG32_8_1_WGM15
    SolutionIndex: 128
    SolutionNameMin: Cijk_Alik_Bljk_SB_MT64x64x16_MI32x32x2x1_SE_1LDSB0_AMAS0_DTL0_EPS0_GRVW2_GSU1_IU1_LBSPP128_LPA2_LPB2_LRVW2_NEPBS0_NLCA1_NLCB1_ONLL1_PGR2_PLR9_SIA3_SS0_SU0_SUS256_SRVW2_SVW4_SNLL0_TT1_32_TLDS1_USFGROn1_VW1_WSGRA1_WSGRB1_WG64_4_1_WGM1
    SolutionIndex: 129
    SolutionNameMin: Cijk_Alik_Bljk_SB_MT32x32x32_MI16x16x4x1_SE_1LDSB0_AMAS0_DTL0_EPS0_GRVW1_GSU1_IU1_LBSPP128_LPA2_LPB2_LRVW2_NEPBS0_NLCA1_NLCB1_ONLL1_PGR2_PLR9_SIA3_SS0_SU32_SUS128_SRVW2_SVW4_SNLL0_TT1_16_TLDS1_USFGROn1_VW1_WSGRA1_WSGRB1_WG32_8_1_WGM15
    SolutionIndex: 130
    SolutionNameMin: Cijk_Alik_Bljk_SB_MT96x96x32_MI16x16x4x1_SE_1LDSB1_AMAS0_DTL0_EPS0_GRVW1_GSU1_IU1_LBSPP128_LPA2_LPB2_LRVW2_NEPBS0_NLCA1_NLCB1_ONLL1_PGR2_PLR9_SIA3_SS0_SU0_SUS256_SRVW0_SVW4_SNLL0_TT3_48_TLDS1_USFGROn1_VW1_WSGRA1_WSGRB1_WG32_8_1_WGM2
    SolutionIndex: 131
    SolutionNameMin: Cijk_Alik_Bljk_SB_MT32x64x32_MI16x16x4x1_SE_1LDSB0_AMAS0_DTL0_EPS0_GRVW1_GSU1_IU1_LBSPP128_LPA2_LPB2_LRVW2_NEPBS0_NLCA1_NLCB1_ONLL1_PGR2_PLR9_SIA3_SS0_SU0_SUS256_SRVW2_SVW4_SNLL0_TT1_32_TLDS1_USFGROn1_VW1_WSGRA1_WSGRB1_WG32_8_1_WGM2
    SolutionIndex: 132
    SolutionNameMin: Cijk_Alik_Bljk_SB_MT128x64x16_MI32x32x2x1_SE_1LDSB0_AMAS0_DTL0_EPS0_GRVW1_GSU1_IU1_LBSPP128_LPA2_LPB2_LRVW2_NEPBS0_NLCA1_NLCB1_ONLL1_PGR2_PLR9_SIA3_SS0_SU0_SUS256_SRVW2_SVW4_SNLL0_TT2_32_TLDS1_USFGROn1_VW1_WSGRA1_WSGRB1_WG64_4_1_WGM15
    SolutionIndex: 133
    SolutionNameMin: Cijk_Alik_Bljk_SB_MT64x64x32_MI32x32x2x1_SE_1LDSB0_AMAS0_DTL0_EPS0_GRVW2_GSU1_IU1_LBSPP128_LPA2_LPB2_LRVW2_NEPBS0_NLCA1_NLCB1_ONLL1_PGR2_PLR17_SIA3_SS0_SU32_SUS128_SRVW2_SVW4_SNLL0_TT1_32_TLDS1_USFGROn1_VW1_WSGRA1_WSGRB1_WG64_4_1_WGM1
    SolutionIndex: 134
    SolutionNameMin: Cijk_Alik_Bljk_SB_MT128x64x16_MI32x32x2x1_SE_1LDSB0_AMAS0_DTL0_EPS0_GRVW1_GSU1_IU1_LBSPP128_LPA2_LPB2_LRVW2_NEPBS0_NLCA1_NLCB1_ONLL1_PGR2_PLR9_SIA3_SS0_SU0_SUS256_SRVW2_SVW4_SNLL0_TT2_32_TLDS1_USFGROn1_VW1_WSGRA1_WSGRB1_WG64_4_1_WGM1
    SolutionIndex: 135
    SolutionNameMin: Cijk_Alik_Bljk_SB_MT64x64x32_MI32x32x2x1_SE_1LDSB0_AMAS0_DTL0_EPS0_GRVW1_GSU1_IU1_LBSPP128_LPA2_LPB2_LRVW2_NEPBS0_NLCA1_NLCB1_ONLL1_PGR2_PLR17_SIA3_SS0_SU32_SUS128_SRVW2_SVW4_SNLL0_TT1_32_TLDS1_USFGROn1_VW1_WSGRA1_WSGRB1_WG64_4_1_WGM2
    SolutionIndex: 136
    SolutionNameMin: Cijk_Alik_Bljk_SB_MT16x16x32_MI16x16x4x1_SE_1LDSB1_AMAS3_DTL0_EPS1_GRVW2_GSU1_IU1_LBSPP128_LPA2_LPB2_LRVW2_NEPBS0_NLCA1_NLCB1_ONLL1_PGR1_PLR9_SIA3_SS0_SU0_SUS256_SRVW0_SVW4_SNLL0_TT1_16_TLDS1_USFGROn1_VW2_WSGRA1_WSGRB1_WG16_4_1_WGM1
    SolutionIndex: 137
    SolutionNameMin: Cijk_Alik_Bljk_SB_MT64x128x16_MI32x32x2x1_SE_1LDSB0_AMAS0_DTL0_EPS0_GRVW1_GSU1_IU1_LBSPP128_LPA2_LPB2_LRVW2_NEPBS0_NLCA1_NLCB1_ONLL1_PGR2_PLR9_SIA3_SS0_SU32_SUS128_SRVW2_SVW4_SNLL0_TT1_64_TLDS1_USFGROn1_VW1_WSGRA1_WSGRB1_WG64_4_1_WGM15
    SolutionIndex: 138
    SolutionNameMin: Cijk_Alik_Bljk_SB_MT64x144x16_MI16x16x4x1_SE_1LDSB0_AMAS0_DTL0_EPS0_GRVW1_GSU1_IU1_LBSPP128_LPA2_LPB2_LRVW2_NEPBS0_NLCA1_NLCB1_ONLL1_PGR2_PLR5_SIA3_SS0_SU0_SUS256_SRVW2_SVW4_SNLL0_TT1_144_TLDS1_USFGROn1_VW1_WSGRA1_WSGRB1_WG64_4_1_WGM1
    SolutionIndex: 139
    SolutionNameMin: Cijk_Alik_Bljk_SB_MT64x144x32_MI16x16x4x1_SE_1LDSB1_AMAS0_DTL0_EPS1_GRVW1_GSU1_IU1_LBSPP128_LPA2_LPB2_LRVW2_NEPBS0_NLCA1_NLCB1_ONLL1_PGR1_PLR9_SIA3_SS0_SU0_SUS256_SRVW2_SVW4_SNLL0_TT1_144_TLDS1_USFGROn1_VW1_WSGRA1_WSGRB1_WG64_4_1_WGM2
    SolutionIndex: 140
    SolutionNameMin: Cijk_Alik_Bljk_SB_MT128x64x16_MI32x32x2x1_SE_1LDSB0_AMAS0_DTL0_EPS0_GRVW2_GSU1_IU1_LBSPP128_LPA2_LPB2_LRVW2_NEPBS0_NLCA1_NLCB1_ONLL1_PGR2_PLR9_SIA3_SS0_SU0_SUS256_SRVW2_SVW4_SNLL0_TT2_32_TLDS1_USFGROn1_VW1_WSGRA1_WSGRB1_WG64_4_1_WGM15
    SolutionIndex: 141
    SolutionNameMin: Cijk_Alik_Bljk_SB_MT64x144x32_MI16x16x4x1_SE_1LDSB1_AMAS0_DTL0_EPS0_GRVW1_GSU1_IU1_LBSPP128_LPA2_LPB2_LRVW2_NEPBS0_NLCA1_NLCB1_ONLL1_PGR2_PLR9_SIA3_SS0_SU32_SUS256_SRVW2_SVW4_SNLL0_TT1_144_TLDS1_USFGROn1_VW1_WSGRA1_WSGRB1_WG64_4_1_WGM2
    SolutionIndex: 142
    SolutionNameMin: Cijk_Alik_Bljk_SB_MT128x128x16_MI32x32x2x1_SE_1LDSB0_AMAS0_DTL0_EPS0_GRVW1_GSU1_IU1_LBSPP128_LPA2_LPB2_LRVW2_NEPBS0_NLCA1_NLCB1_ONLL1_PGR2_PLR9_SIA3_SS0_SU0_SUS256_SRVW2_SVW4_SNLL0_TT2_64_TLDS1_USFGROn1_VW1_WSGRA1_WSGRB1_WG64_4_1_WGM15
    SolutionIndex: 143
    SolutionNameMin: Cijk_Alik_Bljk_SB_MT64x128x32_MI32x32x2x1_SE_1LDSB1_AMAS0_DTL0_EPS0_GRVW1_GSU1_IU1_LBSPP128_LPA2_LPB2_LRVW2_NEPBS0_NLCA1_NLCB1_ONLL1_PGR2_PLR17_SIA3_SS0_SU0_SUS256_SRVW2_SVW4_SNLL0_TT1_64_TLDS1_USFGROn1_VW1_WSGRA1_WSGRB1_WG64_4_1_WGM1
    SolutionIndex: 144
    SolutionNameMin: Cijk_Alik_Bljk_SB_MT64x64x32_MI32x32x2x1_SE_1LDSB1_AMAS0_DTL0_EPS1_GRVW1_GSU1_IU1_LBSPP128_LPA2_LPB2_LRVW2_NEPBS0_NLCA1_NLCB1_ONLL1_PGR1_PLR17_SIA3_SS0_SU32_SUS256_SRVW2_SVW4_SNLL0_TT1_32_TLDS1_USFGROn1_VW1_WSGRA1_WSGRB1_WG64_4_1_WGM2
    SolutionIndex: 145
    SolutionNameMin: Cijk_Alik_Bljk_SB_MT96x96x32_MI16x16x4x1_SE_1LDSB1_AMAS0_DTL0_EPS1_GRVW1_GSU1_IU1_LBSPP128_LPA2_LPB2_LRVW2_NEPBS0_NLCA1_NLCB1_ONLL1_PGR1_PLR9_SIA3_SS0_SU0_SUS256_SRVW0_SVW4_SNLL0_TT3_48_TLDS1_USFGROn1_VW1_WSGRA1_WSGRB1_WG32_8_1_WGM1
    SolutionIndex: 146
    SolutionNameMin: Cijk_Alik_Bljk_SB_MT32x64x32_MI16x16x4x1_SE_1LDSB0_AMAS0_DTL0_EPS0_GRVW1_GSU1_IU1_LBSPP128_LPA2_LPB2_LRVW2_NEPBS0_NLCA1_NLCB1_ONLL1_PGR2_PLR9_SIA3_SS0_SU32_SUS128_SRVW2_SVW4_SNLL0_TT1_32_TLDS1_USFGROn1_VW1_WSGRA1_WSGRB1_WG32_8_1_WGM1
    SolutionIndex: 147
    SolutionNameMin: Cijk_Alik_Bljk_SB_MT32x64x32_MI16x16x4x1_SE_1LDSB1_AMAS0_DTL0_EPS1_GRVW1_GSU1_IU1_LBSPP128_LPA2_LPB2_LRVW2_NEPBS0_NLCA1_NLCB1_ONLL1_PGR1_PLR9_SIA3_SS0_SU32_SUS256_SRVW2_SVW4_SNLL0_TT1_32_TLDS1_USFGROn1_VW1_WSGRA1_WSGRB1_WG32_8_1_WGM15
    SolutionIndex: 148
    SolutionNameMin: Cijk_Alik_Bljk_SB_MT64x128x32_MI32x32x2x1_SE_1LDSB1_AMAS0_DTL0_EPS0_GRVW1_GSU1_IU1_LBSPP128_LPA2_LPB2_LRVW2_NEPBS0_NLCA1_NLCB1_ONLL1_PGR2_PLR17_SIA3_SS0_SU32_SUS128_SRVW2_SVW4_SNLL0_TT1_64_TLDS1_USFGROn1_VW1_WSGRA1_WSGRB1_WG64_4_1_WGM1
    SolutionIndex: 149
    SolutionNameMin: Cijk_Alik_Bljk_SB_MT64x144x32_MI16x16x4x1_SE_1LDSB1_AMAS0_DTL0_EPS1_GRVW1_GSU1_IU1_LBSPP128_LPA2_LPB2_LRVW2_NEPBS0_NLCA1_NLCB1_ONLL1_PGR1_PLR9_SIA3_SS0_SU0_SUS256_SRVW2_SVW4_SNLL0_TT1_144_TLDS1_USFGROn1_VW1_WSGRA1_WSGRB1_WG64_4_1_WGM1
    SolutionIndex: 150
    SolutionNameMin: Cijk_Alik_Bljk_SB_MT128x144x16_MI16x16x4x1_SE_1LDSB1_AMAS0_DTL0_EPS1_GRVW1_GSU1_IU1_LBSPP128_LPA2_LPB2_LRVW2_NEPBS0_NLCA1_NLCB1_ONLL1_PGR1_PLR5_SIA3_SS0_SU32_SUS128_SRVW2_SVW4_SNLL0_TT2_144_TLDS1_USFGROn1_VW1_WSGRA1_WSGRB1_WG64_4_1_WGM15
    SolutionIndex: 151
    SolutionNameMin: Cijk_Alik_Bljk_SB_MT128x160x16_MI32x32x2x1_SE_1LDSB1_AMAS0_DTL0_EPS1_GRVW1_GSU1_IU1_LBSPP128_LPA2_LPB2_LRVW2_NEPBS0_NLCA1_NLCB1_ONLL1_PGR1_PLR9_SIA3_SS0_SU32_SUS128_SRVW2_SVW4_SNLL0_TT1_160_TLDS1_USFGROn1_VW1_WSGRA1_WSGRB1_WG128_2_1_WGM1
    SolutionIndex: 152
    SolutionNameMin: Cijk_Alik_Bljk_SB_MT64x144x16_MI16x16x4x1_SE_1LDSB0_AMAS0_DTL0_EPS0_GRVW1_GSU1_IU1_LBSPP128_LPA2_LPB2_LRVW2_NEPBS0_NLCA1_NLCB1_ONLL1_PGR2_PLR5_SIA3_SS0_SU0_SUS256_SRVW2_SVW4_SNLL0_TT1_144_TLDS1_USFGROn1_VW1_WSGRA1_WSGRB1_WG64_4_1_WGM15
    SolutionIndex: 153
    SolutionNameMin: Cijk_Alik_Bljk_SB_MT128x128x16_MI32x32x2x1_SE_1LDSB1_AMAS0_DTL0_EPS1_GRVW1_GSU1_IU1_LBSPP128_LPA2_LPB2_LRVW2_NEPBS0_NLCA1_NLCB1_ONLL1_PGR1_PLR9_SIA3_SS0_SU32_SUS256_SRVW2_SVW4_SNLL0_TT2_64_TLDS1_USFGROn1_VW1_WSGRA1_WSGRB1_WG64_4_1_WGM2
    SolutionIndex: 154
    SolutionNameMin: Cijk_Alik_Bljk_SB_MT64x32x32_MI16x16x4x1_SE_1LDSB1_AMAS0_DTL0_EPS1_GRVW2_GSU1_IU1_LBSPP128_LPA2_LPB2_LRVW2_NEPBS0_NLCA1_NLCB1_ONLL1_PGR1_PLR9_SIA3_SS0_SU32_SUS256_SRVW2_SVW4_SNLL0_TT2_16_TLDS1_USFGROn1_VW1_WSGRA1_WSGRB1_WG32_8_1_WGM15
    SolutionIndex: 155
    SolutionNameMin: Cijk_Alik_Bljk_SB_MT128x144x16_MI16x16x4x1_SE_1LDSB1_AMAS0_DTL0_EPS0_GRVW1_GSU1_IU1_LBSPP128_LPA2_LPB2_LRVW2_NEPBS0_NLCA1_NLCB1_ONLL1_PGR2_PLR5_SIA3_SS0_SU0_SUS256_SRVW2_SVW4_SNLL0_TT2_144_TLDS1_USFGROn1_VW1_WSGRA1_WSGRB1_WG64_4_1_WGM15
    SolutionIndex: 156
    SolutionNameMin: Cijk_Alik_Bljk_SB_MT128x160x16_MI32x32x2x1_SE_1LDSB1_AMAS0_DTL0_EPS1_GRVW1_GSU1_IU1_LBSPP128_LPA2_LPB2_LRVW2_NEPBS0_NLCA1_NLCB1_ONLL1_PGR1_PLR9_SIA3_SS0_SU0_SUS256_SRVW2_SVW4_SNLL0_TT1_160_TLDS1_USFGROn1_VW1_WSGRA1_WSGRB1_WG128_2_1_WGM15
    SolutionIndex: 157
    SolutionNameMin: Cijk_Alik_Bljk_SB_MT128x96x16_MI32x32x2x1_SE_1LDSB1_AMAS0_DTL0_EPS0_GRVW1_GSU1_IU1_LBSPP128_LPA2_LPB2_LRVW2_NEPBS0_NLCA1_NLCB1_ONLL1_PGR2_PLR9_SIA3_SS0_SU32_SUS128_SRVW2_SVW4_SNLL0_TT1_96_TLDS1_USFGROn1_VW1_WSGRA1_WSGRB1_WG128_2_1_WGM15
    SolutionIndex: 158
    SolutionNameMin: Cijk_Alik_Bljk_SB_MT96x128x16_MI32x32x2x1_SE_1LDSB0_AMAS0_DTL0_EPS0_GRVW1_GSU1_IU1_LBSPP128_LPA2_LPB2_LRVW2_NEPBS0_NLCA1_NLCB1_ONLL1_PGR2_PLR9_SIA3_SS0_SU0_SUS256_SRVW0_SVW4_SNLL0_TT3_32_TLDS1_USFGROn1_VW1_WSGRA1_WSGRB1_WG32_8_1_WGM15
    SolutionIndex: 159
    SolutionNameMin: Cijk_Alik_Bljk_SB_MT128x128x16_MI32x32x2x1_SE_1LDSB1_AMAS0_DTL0_EPS0_GRVW2_GSU1_IU1_LBSPP128_LPA2_LPB2_LRVW2_NEPBS0_NLCA1_NLCB1_ONLL1_PGR2_PLR9_SIA3_SS0_SU32_SUS256_SRVW2_SVW4_SNLL0_TT2_64_TLDS1_USFGROn1_VW1_WSGRA1_WSGRB1_WG64_4_1_WGM15
    SolutionIndex: 160
    SolutionNameMin: Cijk_Alik_Bljk_SB_MT64x32x16_MI16x16x4x1_SE_1LDSB1_AMAS0_DTL0_EPS1_GRVW1_GSU1_IU1_LBSPP128_LPA2_LPB2_LRVW2_NEPBS0_NLCA1_NLCB1_ONLL1_PGR1_PLR5_SIA3_SS0_SU0_SUS256_SRVW2_SVW4_SNLL0_TT2_16_TLDS1_USFGROn1_VW1_WSGRA1_WSGRB1_WG32_8_1_WGM1
    SolutionIndex: 161
    SolutionNameMin: Cijk_Alik_Bljk_SB_MT64x128x16_MI32x32x2x1_SE_1LDSB1_AMAS0_DTL0_EPS0_GRVW2_GSU1_IU1_LBSPP128_LPA2_LPB2_LRVW2_NEPBS0_NLCA1_NLCB1_ONLL1_PGR2_PLR9_SIA3_SS0_SU0_SUS256_SRVW2_SVW4_SNLL0_TT1_64_TLDS1_USFGROn1_VW1_WSGRA1_WSGRB1_WG64_4_1_WGM15
    SolutionIndex: 162
    SolutionNameMin: Cijk_Alik_Bljk_SB_MT64x64x32_MI32x32x2x1_SE_1LDSB1_AMAS0_DTL0_EPS1_GRVW1_GSU1_IU1_LBSPP128_LPA2_LPB2_LRVW2_NEPBS0_NLCA1_NLCB1_ONLL1_PGR1_PLR17_SIA3_SS0_SU32_SUS128_SRVW2_SVW4_SNLL0_TT1_32_TLDS1_USFGROn1_VW1_WSGRA1_WSGRB1_WG64_4_1_WGM15
    SolutionIndex: 163
    SolutionNameMin: Cijk_Alik_Bljk_SB_MT64x128x32_MI32x32x2x1_SE_1LDSB1_AMAS0_DTL0_EPS1_GRVW1_GSU1_IU1_LBSPP128_LPA2_LPB2_LRVW2_NEPBS0_NLCA1_NLCB1_ONLL1_PGR1_PLR17_SIA3_SS0_SU0_SUS256_SRVW2_SVW4_SNLL0_TT1_64_TLDS1_USFGROn1_VW1_WSGRA1_WSGRB1_WG64_4_1_WGM2
    SolutionIndex: 164
    SolutionNameMin: Cijk_Alik_Bljk_SB_MT64x64x32_MI32x32x2x1_SE_1LDSB0_AMAS0_DTL0_EPS0_GRVW1_GSU1_IU1_LBSPP128_LPA2_LPB2_LRVW2_NEPBS0_NLCA1_NLCB1_ONLL1_PGR2_PLR17_SIA3_SS0_SU32_SUS128_SRVW2_SVW4_SNLL0_TT1_32_TLDS1_USFGROn1_VW1_WSGRA1_WSGRB1_WG64_4_1_WGM15
    SolutionIndex: 165
    SolutionNameMin: Cijk_Alik_Bljk_SB_MT32x32x16_MI16x16x4x1_SE_1LDSB0_AMAS0_DTL0_EPS0_GRVW2_GSU1_IU1_LBSPP128_LPA2_LPB2_LRVW2_NEPBS0_NLCA1_NLCB1_ONLL1_PGR2_PLR5_SIA3_SS0_SU0_SUS256_SRVW2_SVW4_SNLL0_TT1_16_TLDS1_USFGROn1_VW1_WSGRA1_WSGRB1_WG32_8_1_WGM15
    SolutionIndex: 166
    SolutionNameMin: Cijk_Alik_Bljk_SB_MT32x64x16_MI16x16x4x1_SE_1LDSB1_AMAS0_DTL0_EPS1_GRVW4_GSU1_IU1_LBSPP128_LPA4_LPB4_LRVW2_NEPBS0_NLCA1_NLCB1_ONLL1_PGR1_PLR5_SIA3_SS0_SU0_SUS256_SRVW2_SVW4_SNLL0_TT1_32_TLDS1_USFGROn1_VW1_WSGRA1_WSGRB1_WG32_8_1_WGM15
    SolutionIndex: 167
    SolutionNameMin: Cijk_Alik_Bljk_SB_MT32x64x16_MI16x16x4x1_SN_1LDSB0_AMAS3_DTL0_EPS0_GRVW4_GSU1_IU1_LBSPP128_LPA4_LPB4_LRVW2_NEPBS1_NLCA1_NLCB1_ONLL1_PGR2_PLR5_SIA3_SS1_SU0_SUS256_SRVW0_SVW2_SNLL0_TT2_16_TLDS1_USFGROn1_VW2_WSGRA1_WSGRB1_WG16_16_1_WGM8
    SolutionIndex: 168
    SolutionNameMin: Cijk_Alik_Bljk_SB_MT16x16x32_MI16x16x4x1_SN_1LDSB0_AMAS0_DTL0_EPS0_GRVW4_GSU1_IU1_LBSPP128_LPA4_LPB4_LRVW2_NEPBS2_NLCA1_NLCB1_ONLL1_PGR2_PLR9_SIA3_SS1_SU32_SUS256_SRVW0_SVW1_SNLL0_TT1_16_TLDS1_USFGROn1_VW1_WSGRA1_WSGRB1_WG16_4_1_WGM5
    SolutionIndex: 169
    SolutionNameMin: Cijk_Alik_Bljk_SB_MT64x128x16_MI32x32x2x1_SE_1LDSB0_AMAS0_DTL0_EPS1_GRVW4_GSU1_IU1_LBSPP128_LPA4_LPB4_LRVW2_NEPBS0_NLCA1_NLCB1_ONLL1_PGR1_PLR9_SIA3_SS0_SU0_SUS256_SRVW2_SVW4_SNLL0_TT1_64_TLDS1_USFGROn1_VW1_WSGRA1_WSGRB1_WG64_4_1_WGM1
    SolutionIndex: 170
    SolutionNameMin: Cijk_Alik_Bljk_SB_MT64x128x32_MI32x32x2x1_SE_1LDSB1_AMAS0_DTL0_EPS1_GRVW4_GSU1_IU1_LBSPP128_LPA4_LPB4_LRVW2_NEPBS0_NLCA1_NLCB1_ONLL1_PGR1_PLR17_SIA3_SS0_SU32_SUS128_SRVW2_SVW4_SNLL0_TT1_64_TLDS1_USFGROn1_VW1_WSGRA1_WSGRB1_WG64_4_1_WGM15
    SolutionIndex: 171
    SolutionNameMin: Cijk_Alik_Bljk_SB_MT96x128x16_MI32x32x2x1_SE_1LDSB0_AMAS0_DTL0_EPS0_GRVW2_GSU1_IU1_LBSPP128_LPA2_LPB2_LRVW2_NEPBS0_NLCA1_NLCB1_ONLL1_PGR2_PLR9_SIA3_SS0_SU32_SUS128_SRVW0_SVW4_SNLL0_TT3_32_TLDS1_USFGROn1_VW1_WSGRA1_WSGRB1_WG32_8_1_WGM15
    SolutionIndex: 172
    SolutionNameMin: Cijk_Alik_Bljk_SB_MT32x32x16_MI16x16x4x1_SE_1LDSB0_AMAS0_DTL0_EPS0_GRVW1_GSU1_IU1_LBSPP128_LPA2_LPB2_LRVW2_NEPBS0_NLCA1_NLCB1_ONLL1_PGR2_PLR5_SIA3_SS0_SU0_SUS256_SRVW2_SVW4_SNLL0_TT1_16_TLDS1_USFGROn1_VW1_WSGRA1_WSGRB1_WG32_8_1_WGM1
    SolutionIndex: 173
    SolutionNameMin: Cijk_Alik_Bljk_SB_MT64x128x32_MI32x32x2x1_SE_1LDSB1_AMAS0_DTL0_EPS1_GRVW4_GSU1_IU1_LBSPP128_LPA4_LPB4_LRVW2_NEPBS0_NLCA1_NLCB1_ONLL1_PGR1_PLR17_SIA3_SS0_SU0_SUS256_SRVW2_SVW4_SNLL0_TT1_64_TLDS1_USFGROn1_VW1_WSGRA1_WSGRB1_WG64_4_1_WGM1
- - - [1024, 512, 1, 1600]
    - [4, 59.441]
  - - [2048, 512, 1, 100]
    - [5, 28.297]
  - - [1024, 4096, 1, 1024]
    - [6, 81.705]
  - - [4096, 4096, 1, 1024]
    - [7, 88.778]
  - - [1024, 4096, 1, 4096]
    - [8, 86.381]
  - - [30528, 4096, 1, 1024]
    - [9, 93.172]
  - - [1024, 2048, 1, 1024]
    - [10, 76.445]
  - - [4096, 2048, 1, 1024]
    - [11, 85.024]
  - - [1024, 2048, 1, 4096]
    - [12, 81.895]
  - - [30528, 2048, 1, 1024]
    - [6, 90.256]
  - - [30522, 320, 1, 768]
    - [6, 83.675]
  - - [3072, 4096, 1, 768]
    - [6, 87.839]
  - - [768, 4096, 1, 3072]
    - [12, 88.644]
  - - [768, 4096, 1, 768]
    - [13, 80.709]
  - - [30522, 160, 1, 768]
    - [14, 76.446]
  - - [30522, 640, 1, 768]
    - [15, 86.712]
  - - [768, 640, 1, 768]
    - [4, 49.742]
  - - [30522, 1280, 1, 768]
    - [15, 88.199]
  - - [768, 1280, 1, 768]
    - [2, 73.512]
  - - [1024, 3072, 1, 1024]
    - [10, 83.671]
  - - [1024, 512, 1, 1024]
    - [4, 55.366]
  - - [1024, 2048, 1, 3072]
    - [10, 81.327]
  - - [1024, 3072, 1, 3072]
    - [10, 88.535]
  - - [1024, 512, 1, 3072]
    - [4, 62.844]
  - - [3072, 2048, 1, 1024]
    - [6, 87.848]
  - - [3072, 3072, 1, 1024]
    - [16, 87.469]
  - - [3072, 512, 1, 1024]
    - [2, 64.109]
  - - [30522, 120, 1, 1024]
    - [17, 72.109]
  - - [30522, 20, 1, 1024]
    - [18, 26.677]
  - - [30522, 80, 1, 1024]
    - [19, 64.537]
  - - [30522, 160, 1, 1024]
    - [14, 80.979]
  - - [1024, 200, 1, 560]
    - [4, 25.09]
  - - [768, 320, 1, 768]
    - [20, 37.144]
  - - [768, 32, 1, 768]
    - [21, 6.076]
  - - [768, 64, 1, 768]
    - [21, 11.733]
  - - [1024, 80, 1, 1024]
    - [4, 20.108]
  - - [1024, 120, 1, 1024]
    - [4, 26.375]
  - - [1024, 20, 1, 1024]
    - [22, 5.56]
  - - [768, 16, 1, 768]
    - [23, 2.995]
  - - [1024, 4, 1, 1024]
    - [24, 1.125]
  - - [1024, 6, 1, 1024]
    - [25, 1.708]
  - - [128, 128, 512, 64]
    - [26, 30.821]
  - - [64, 128, 512, 128]
    - [27, 34.713]
  - - [64, 512, 64, 512]
    - [15, 56.071]
  - - [512, 512, 64, 64]
    - [6, 40.766]
  - - [256, 256, 192, 64]
    - [6, 36.076]
  - - [256, 256, 96, 64]
    - [5, 33.981]
  - - [128, 128, 384, 64]
    - [26, 30.966]
  - - [128, 128, 96, 64]
    - [14, 25.63]
  - - [64, 64, 768, 64]
    - [26, 22.683]
  - - [64, 64, 96, 64]
    - [20, 11.939]
  - - [512, 512, 16, 64]
    - [6, 34.368]
  - - [512, 512, 96, 64]
    - [6, 41.382]
  - - [512, 512, 128, 64]
    - [6, 42.151]
  - - [1024, 128, 1, 128]
    - [28, 9.221]
  - - [4, 704, 1, 1280]
    - [28, 0.833]
  - - [4, 1856, 1, 3328]
    - [29, 2.62]
  - - [1856, 448, 1, 3328]
    - [6, 78.978]
  - - [2944, 4288, 1, 1280]
    - [7, 88.321]
  - - [2368, 64, 1, 3328]
    - [30, 41.028]
  - - [1760, 32, 1, 1760]
    - [22, 17.45]
  - - [2368, 5888, 1, 256]
    - [13, 76.782]
  - - [5888, 1856, 1, 256]
    - [17, 72.086]
  - - [128, 64, 1, 256]
    - [22, 1.05]
  - - [512, 24000, 1, 1536]
    - [6, 89.405]
  - - [128, 6784, 1, 3328]
    - [31, 82.428]
  - - [5888, 1408, 1, 256]
    - [17, 69.308]
  - - [5888, 1856, 1, 3328]
    - [32, 92.115]
  - - [5056, 704, 1, 256]
    - [13, 64.265]
  - - [2048, 400, 1, 512]
    - [14, 56.09]
  - - [5888, 2944, 1, 3328]
    - [33, 92.24]
  - - [1856, 4288, 1, 256]
    - [34, 73.336]
  - - [1024, 5056, 1, 128]
    - [6, 55.306]
  - - [5056, 5056, 1, 3328]
    - [7, 92.425]
  - - [1408, 5888, 1, 1280]
    - [14, 85.565]
  - - [2368, 448, 1, 128]
    - [14, 35.787]
  - - [2368, 6784, 1, 128]
    - [35, 61.046]
  - - [1024, 3584, 1, 3328]
    - [7, 84.904]
  - - [512, 48000, 1, 2048]
    - [10, 91.64]
  - - [128, 448, 1, 1280]
    - [25, 16.215]
  - - [256, 4288, 1, 3328]
    - [36, 81.868]
  - - [5888, 1408, 1, 1280]
    - [14, 85.413]
  - - [704, 1856, 1, 3328]
    - [37, 83.32]
  - - [4, 1408, 1, 128]
    - [25, 0.411]
  - - [1024, 2368, 1, 256]
    - [14, 62.03]
  - - [64, 4, 1, 256]
    - [28, 0.033]
  - - [1408, 1856, 1, 1280]
    - [6, 83.055]
  - - [1408, 64, 1, 1280]
    - [38, 24.636]
  - - [448, 1024, 1, 1280]
    - [4, 52.195]
  - - [6144, 24000, 1, 2048]
    - [9, 95.339]
  - - [4096, 32, 1, 4096]
    - [39, 33.053]
  - - [256, 1408, 1, 3328]
    - [40, 64.128]
  - - [5056, 5056, 1, 1280]
    - [7, 90.35]
  - - [448, 5056, 1, 256]
    - [14, 61.343]
  - - [704, 1856, 1, 1280]
    - [41, 77.068]
  - - [128, 5056, 1, 128]
    - [14, 30.35]
  - - [2368, 128, 1, 256]
    - [4, 27.535]
  - - [1760, 6400, 1, 1760]
    - [6, 90.281]
  - - [1856, 1408, 1, 128]
    - [14, 48.161]
  - - [64, 5056, 1, 256]
    - [14, 28.939]
  - - [6784, 256, 1, 3328]
    - [42, 87.173]
  - - [6784, 4288, 1, 3328]
    - [32, 93.41]
  - - [4288, 448, 1, 256]
    - [14, 57.715]
  - - [64, 704, 1, 128]
    - [4, 3.094]
  - - [1856, 2368, 1, 3328]
    - [12, 87.901]
  - - [4288, 2944, 1, 1280]
    - [7, 88.16]
  - - [704, 5056, 1, 1280]
    - [10, 84.427]
  - - [2368, 704, 1, 3328]
    - [43, 80.009]
  - - [256, 5888, 1, 256]
    - [14, 54.858]
  - - [1856, 4288, 1, 3328]
    - [32, 91.796]
  - - [256, 2944, 1, 256]
    - [5, 44.137]
  - - [5888, 1024, 1, 256]
    - [6, 68.33]
  - - [448, 64, 1, 1280]
    - [28, 8.57]
  - - [3072, 64, 1, 1024]
    - [44, 40.325]
  - - [3584, 4, 1, 1280]
    - [29, 3.611]
  - - [16384, 3200, 1, 4096]
    - [8, 93.057]
  - - [2944, 64, 1, 256]
    - [45, 19.942]
  - - [128, 4, 1, 1280]
    - [25, 0.151]
  - - [1408, 2944, 1, 256]
    - [26, 68.026]
  - - [256, 1856, 1, 1280]
    - [4, 54.166]
  - - [6784, 5056, 1, 3328]
    - [9, 92.517]
  - - [5056, 5056, 1, 256]
    - [46, 77.652]
  - - [1408, 6784, 1, 128]
    - [6, 61.154]
  - - [64, 1024, 1, 1280]
    - [38, 18.002]
  - - [2944, 4, 1, 256]
    - [21, 1.319]
  - - [704, 5056, 1, 128]
    - [14, 51.331]
  - - [4, 2368, 1, 1280]
    - [25, 2.64]
  - - [2368, 2944, 1, 1280]
    - [6, 86.483]
  - - [128, 3584, 1, 1280]
    - [4, 51.787]
  - - [6784, 6784, 1, 1280]
    - [7, 91.97]
  - - [1408, 4288, 1, 1280]
    - [32, 86.938]
  - - [3584, 4288, 1, 1280]
    - [7, 88.237]
  - - [2368, 704, 1, 1280]
    - [14, 75.305]
  - - [5056, 4288, 1, 3328]
    - [7, 92.223]
  - - [3584, 2368, 1, 3328]
    - [11, 89.431]
  - - [64, 704, 1, 1280]
    - [24, 12.995]
  - - [4288, 256, 1, 256]
    - [14, 50.861]
  - - [2944, 128, 1, 128]
    - [47, 19.943]
  - - [6144, 32, 1, 2560]
    - [48, 41.927]
  - - [6784, 448, 1, 1280]
    - [15, 81.316]
  - - [1408, 2944, 1, 128]
    - [14, 52.9]
  - - [4288, 2944, 1, 256]
    - [13, 73.445]
  - - [5888, 704, 1, 1280]
    - [14, 81.72]
  - - [5056, 4, 1, 3328]
    - [29, 5.141]
  - - [1856, 64, 1, 1280]
    - [49, 27.741]
  - - [1760, 16, 1, 1760]
    - [24, 8.759]
  - - [448, 5888, 1, 128]
    - [14, 48.152]
  - - [5888, 64, 1, 3328]
    - [50, 66.102]
  - - [2944, 256, 1, 3328]
    - [31, 72.227]
  - - [1024, 64, 1, 128]
    - [51, 4.61]
  - - [5056, 2368, 1, 1280]
    - [15, 87.125]
  - - [448, 3584, 1, 1280]
    - [8, 75.24]
  - - [6784, 5888, 1, 256]
    - [46, 80.243]
  - - [704, 1024, 1, 128]
    - [5, 31.033]
  - - [704, 128, 1, 1280]
    - [38, 24.636]
  - - [4, 3584, 1, 128]
    - [52, 0.962]
  - - [1408, 448, 1, 1280]
    - [14, 67.258]
  - - [1024, 1408, 1, 256]
    - [14, 54.182]
  - - [2368, 2368, 1, 3328]
    - [41, 87.943]
  - - [1856, 6784, 1, 128]
    - [35, 60.882]
  - - [5056, 704, 1, 3328]
    - [12, 88.312]
  - - [1408, 1856, 1, 256]
    - [34, 63.338]
  - - [1408, 704, 1, 3328]
    - [53, 80.578]
  - - [2368, 5056, 1, 256]
    - [13, 75.977]
  - - [1408, 256, 1, 1280]
    - [50, 54.862]
  - - [3072, 128, 1, 1024]
    - [54, 54.658]
  - - [3584, 2368, 1, 1280]
    - [17, 86.756]
  - - [4288, 64, 1, 3328]
    - [50, 49.352]
  - - [2368, 4, 1, 1280]
    - [28, 2.553]
  - - [704, 5888, 1, 256]
    - [14, 67.072]
  - - [6784, 2944, 1, 128]
    - [6, 60.036]
  - - [2560, 1600, 1, 2560]
    - [14, 83.446]
  - - [4288, 6784, 1, 3328]
    - [6, 92.456]
  - - [2944, 256, 1, 256]
    - [5, 44.137]
  - - [2944, 6784, 1, 3328]
    - [16, 92.609]
  - - [704, 1408, 1, 3328]
    - [55, 80.447]
  - - [6144, 5984, 1, 2048]
    - [9, 92.627]
  - - [3584, 704, 1, 3328]
    - [56, 82.266]
  - - [2944, 256, 1, 128]
    - [5, 31.733]
  - - [6784, 4, 1, 1280]
    - [57, 5.066]
  - - [1024, 64, 1, 1280]
    - [57, 18.002]
  - - [2048, 1600, 1, 512]
    - [58, 74.345]
  - - [448, 4288, 1, 256]
    - [14, 59.101]
  - - [64, 3584, 1, 3328]
    - [59, 41.801]
  - - [1856, 4288, 1, 128]
    - [35, 57.892]
  - - [704, 2368, 1, 1280]
    - [10, 75.84]
  - - [1856, 2368, 1, 1280]
    - [12, 84.116]
  - - [2368, 128, 1, 3328]
    - [4, 54.969]
  - - [2944, 128, 1, 256]
    - [14, 32.936]
  - - [448, 1408, 1, 256]
    - [14, 43.84]
  - - [1856, 4288, 1, 1280]
    - [32, 86.8]
  - - [64, 5056, 1, 3328]
    - [20, 56.629]
  - - [4, 704, 1, 256]
    - [24, 0.365]
  - - [1024, 448, 1, 128]
    - [4, 22.812]
  - - [704, 4, 1, 1280]
    - [24, 0.829]
  - - [704, 256, 1, 128]
    - [4, 11.551]
  - - [704, 2944, 1, 128]
    - [14, 44.946]
  - - [1408, 1024, 1, 1280]
    - [41, 72.955]
  - - [704, 6784, 1, 256]
    - [14, 68.875]
  - - [6784, 704, 1, 256]
    - [58, 64.444]
  - - [5056, 1408, 1, 128]
    - [35, 55.568]
  - - [2048, 7000, 1, 2048]
    - [6, 92.065]
  - - [256, 3584, 1, 3328]
    - [55, 74.382]
  - - [4, 5888, 1, 3328]
    - [21, 5.409]
  - - [128, 1408, 1, 128]
    - [4, 11.551]
  - - [3584, 4288, 1, 3328]
    - [7, 90.315]
  - - [5888, 1856, 1, 1280]
    - [32, 87.749]
  - - [256, 1408, 1, 256]
    - [14, 32.489]
  - - [5056, 64, 1, 1280]
    - [60, 49.12]
  - - [1024, 704, 1, 256]
    - [5, 42.434]
  - - [448, 128, 1, 128]
    - [4, 4.187]
  - - [2368, 3584, 1, 1280]
    - [12, 86.926]
  - - [2368, 6784, 1, 1280]
    - [61, 88.779]
  - - [1856, 4, 1, 1280]
    - [29, 2.059]
  - - [448, 448, 1, 256]
    - [4, 21.244]
  - - [2944, 3584, 1, 3328]
    - [16, 91.267]
  - - [7680, 32, 1, 2560]
    - [18, 41.032]
  - - [128, 4288, 1, 128]
    - [14, 26.607]
  - - [256, 256, 1, 3328]
    - [38, 22.911]
  - - [128, 1024, 1, 3328]
    - [62, 36.07]
  - - [4, 1408, 1, 3328]
    - [22, 1.992]
  - - [6784, 2944, 1, 256]
    - [46, 75.349]
  - - [64, 1856, 1, 1280]
    - [62, 27.191]
  - - [6784, 64, 1, 128]
    - [14, 22.563]
  - - [4288, 2368, 1, 3328]
    - [12, 90.001]
  - - [1856, 2368, 1, 256]
    - [13, 68.335]
  - - [3584, 256, 1, 128]
    - [14, 32.272]
  - - [3584, 6784, 1, 3328]
    - [6, 93.946]
  - - [256, 1024, 1, 256]
    - [20, 25.629]
  - - [4, 6784, 1, 3328]
    - [63, 5.614]
  - - [1024, 5888, 1, 3328]
    - [32, 92.095]
  - - [1024, 128, 1, 1280]
    - [49, 30.123]
  - - [3072, 32, 1, 1024]
    - [45, 23.505]
  - - [6144, 24000, 1, 2560]
    - [9, 95.458]
  - - [5056, 4288, 1, 1280]
    - [7, 90.69]
  - - [5888, 64, 1, 256]
    - [14, 31.966]
  - - [6784, 1856, 1, 3328]
    - [6, 93.232]
  - - [1408, 5056, 1, 1280]
    - [6, 89.233]
  - - [1856, 256, 1, 1280]
    - [4, 52.708]
  - - [64, 5888, 1, 3328]
    - [64, 61.633]
  - - [2368, 2368, 1, 1280]
    - [14, 84.809]
  - - [2944, 5888, 1, 128]
    - [35, 61.8]
  - - [704, 5888, 1, 1280]
    - [36, 82.367]
  - - [2368, 3584, 1, 128]
    - [13, 57.937]
  - - [1856, 5056, 1, 128]
    - [65, 58.838]
  - - [704, 1024, 1, 1280]
    - [5, 61.515]
  - - [448, 256, 1, 3328]
    - [49, 32.394]
  - - [448, 1856, 1, 128]
    - [14, 33.777]
  - - [8192, 3200, 1, 2048]
    - [8, 90.027]
  - - [128, 1024, 1, 128]
    - [66, 8.69]
  - - [2944, 4, 1, 128]
    - [21, 0.755]
  - - [1024, 704, 1, 1280]
    - [67, 61.607]
  - - [128, 5888, 1, 256]
    - [14, 42.833]
  - - [1024, 5056, 1, 1280]
    - [6, 85.452]
  - - [4288, 1024, 1, 256]
    - [13, 66.743]
  - - [2944, 2368, 1, 128]
    - [6, 58.366]
  - - [704, 704, 1, 3328]
    - [68, 59.041]
  - - [704, 1408, 1, 1280]
    - [36, 69.476]
  - - [5888, 448, 1, 1280]
    - [6, 83.836]
  - - [3584, 256, 1, 3328]
    - [69, 74.382]
  - - [704, 5888, 1, 3328]
    - [8, 85.362]
  - - [704, 1856, 1, 128]
    - [13, 40.091]
  - - [448, 448, 1, 3328]
    - [62, 54.83]
  - - [4, 4288, 1, 128]
    - [52, 1.137]
  - - [128, 704, 1, 1280]
    - [38, 24.404]
  - - [3584, 2944, 1, 256]
    - [70, 73.553]
  - - [3584, 4, 1, 128]
    - [25, 0.951]
  - - [1856, 128, 1, 3328]
    - [20, 45.102]
  - - [4, 64, 1, 1280]
    - [28, 0.075]
  - - [2944, 448, 1, 128]
    - [13, 40.254]
  - - [128, 2944, 1, 1280]
    - [71, 56.756]
  - - [64, 64, 1, 3328]
    - [72, 1.498]
  - - [448, 2944, 1, 1280]
    - [36, 77.634]
  - - [512, 24000, 1, 2048]
    - [8, 89.803]
  - - [128, 256, 1, 3328]
    - [22, 12.016]
  - - [1408, 5056, 1, 3328]
    - [6, 91.947]
  - - [1856, 1856, 1, 3328]
    - [6, 87.745]
  - - [3584, 128, 1, 256]
    - [4, 32.67]
  - - [2560, 800, 1, 2560]
    - [12, 78.68]
  - - [448, 1408, 1, 3328]
    - [36, 74.905]
  - - [2368, 2368, 1, 256]
    - [13, 69.637]
  - - [4288, 4288, 1, 1280]
    - [6, 88.951]
  - - [64, 448, 1, 1280]
    - [24, 8.439]
  - - [5888, 1024, 1, 1280]
    - [6, 85.497]
  - - [1408, 4288, 1, 256]
    - [34, 71.148]
  - - [448, 4, 1, 256]
    - [28, 0.225]
  - - [5888, 448, 1, 128]
    - [6, 47.256]
  - - [512, 48000, 1, 2560]
    - [73, 92.002]
  - - [35, 8457, 1, 1760]
    - [74, 34.73]
  - - [704, 6784, 1, 3328]
    - [32, 87.803]
  - - [2560, 6400, 1, 2560]
    - [7, 90.126]
  - - [5056, 1024, 1, 1280]
    - [6, 85.427]
  - - [448, 5888, 1, 3328]
    - [8, 89.305]
  - - [128, 4, 1, 128]
    - [28, 0.037]
  - - [1024, 2944, 1, 1280]
    - [10, 81.186]
  - - [5056, 5888, 1, 1280]
    - [7, 91.353]
  - - [4288, 5888, 1, 128]
    - [35, 62.749]
  - - [256, 3584, 1, 256]
    - [14, 45.824]
  - - [1408, 3584, 1, 128]
    - [6, 55.658]
  - - [256, 2944, 1, 3328]
    - [31, 72.043]
  - - [448, 3584, 1, 128]
    - [14, 41.72]
  - - [5888, 2944, 1, 1280]
    - [7, 88.021]
  - - [4, 6784, 1, 1280]
    - [21, 5.183]
  - - [2368, 5888, 1, 128]
    - [13, 61.396]
  - - [8448, 16, 1, 2816]
    - [18, 22.541]
  - - [64, 2944, 1, 128]
    - [74, 11.944]
  - - [2368, 4, 1, 256]
    - [28, 1.071]
  - - [3584, 5888, 1, 256]
    - [75, 76.512]
  - - [2368, 1024, 1, 128]
    - [14, 46.47]
  - - [2368, 704, 1, 128]
    - [5, 42.178]
  - - [3584, 2944, 1, 1280]
    - [6, 88.402]
  - - [3584, 2368, 1, 128]
    - [35, 57.8]
  - - [5056, 704, 1, 128]
    - [5, 50.08]
  - - [448, 2368, 1, 128]
    - [14, 34.574]
  - - [5056, 1408, 1, 3328]
    - [6, 91.372]
  - - [1408, 704, 1, 256]
    - [14, 47.451]
  - - [6784, 1024, 1, 3328]
    - [53, 90.183]
  - - [6784, 2944, 1, 3328]
    - [16, 92.626]
  - - [2944, 5056, 1, 3328]
    - [7, 93.053]
  - - [1856, 1856, 1, 256]
    - [14, 66.126]
  - - [1024, 5888, 1, 128]
    - [6, 56.737]
  - - [6784, 2368, 1, 1280]
    - [6, 90.522]
  - - [256, 4, 1, 128]
    - [28, 0.074]
  - - [4288, 5888, 1, 1280]
    - [32, 89.819]
  - - [4288, 4288, 1, 256]
    - [46, 75.117]
  - - [8448, 32, 1, 2816]
    - [18, 45.561]
  - - [448, 2944, 1, 3328]
    - [36, 82.663]
  - - [5888, 4, 1, 128]
    - [28, 1.617]
  - - [4288, 1856, 1, 1280]
    - [6, 88.541]
  - - [1856, 2944, 1, 3328]
    - [14, 85.472]
  - - [256, 6784, 1, 3328]
    - [8, 87.085]
  - - [64, 5888, 1, 256]
    - [14, 31.276]
  - - [256, 5056, 1, 128]
    - [13, 40.142]
  - - [5056, 1024, 1, 256]
    - [13, 66.294]
  - - [704, 64, 1, 3328]
    - [25, 16.522]
  - - [5056, 1856, 1, 3328]
    - [12, 91.112]
  - - [4, 2944, 1, 3328]
    - [28, 3.942]
  - - [4, 5056, 1, 256]
    - [21, 2.181]
  - - [1856, 1408, 1, 256]
    - [13, 62.68]
  - - [8448, 12000, 1, 2816]
    - [7, 95.497]
  - - [6784, 128, 1, 3328]
    - [31, 82.742]
  - - [4288, 1408, 1, 128]
    - [13, 55.019]
  - - [1856, 5888, 1, 3328]
    - [32, 92.001]
  - - [4288, 5056, 1, 256]
    - [46, 77.823]
  - - [1408, 128, 1, 1280]
    - [49, 40.93]
  - - [4096, 800, 1, 1024]
    - [14, 80.221]
  - - [5056, 256, 1, 3328]
    - [41, 80.516]
  - - [704, 704, 1, 256]
    - [20, 35.514]
  - - [1024, 5888, 1, 1280]
    - [32, 86.26]
  - - [6784, 2368, 1, 128]
    - [6, 60.057]
  - - [4, 5056, 1, 1280]
    - [74, 4.487]
  - - [256, 64, 1, 1280]
    - [28, 4.922]
  - - [128, 1856, 1, 1280]
    - [4, 41.153]
  - - [1856, 1024, 1, 1280]
    - [9, 79.965]
  - - [6784, 4288, 1, 1280]
    - [9, 90.111]
  - - [2560, 64, 1, 2560]
    - [49, 42.382]
  - - [1856, 1856, 1, 1280]
    - [6, 83.808]
  - - [4096, 400, 1, 1024]
    - [14, 71.803]
  - - [3072, 24000, 1, 1024]
    - [9, 93.275]
  - - [128, 4288, 1, 3328]
    - [36, 64.513]
  - - [4, 2368, 1, 3328]
    - [22, 3.258]
  - - [5888, 1856, 1, 128]
    - [35, 57.887]
  - - [448, 704, 1, 1280]
    - [4, 53.51]
  - - [128, 5056, 1, 1280]
    - [14, 68.374]
  - - [1024, 448, 1, 3328]
    - [4, 55.984]
  - - [1856, 704, 1, 1280]
    - [13, 76.52]
  - - [5056, 3584, 1, 128]
    - [35, 60.143]
  - - [5888, 5888, 1, 3328]
    - [7, 93.261]
  - - [6784, 1024, 1, 256]
    - [6, 70.179]
  - - [2944, 2368, 1, 256]
    - [13, 71.747]
  - - [256, 448, 1, 256]
    - [49, 12.972]
  - - [5056, 5888, 1, 3328]
    - [7, 93.361]
  - - [1856, 1024, 1, 256]
    - [14, 58.627]
  - - [512, 48000, 1, 1536]
    - [10, 90.528]
  - - [3584, 448, 1, 1280]
    - [6, 74.156]
  - - [8448, 5984, 1, 2816]
    - [9, 93.534]
  - - [448, 5888, 1, 256]
    - [17, 63.269]
  - - [704, 64, 1, 128]
    - [4, 3.209]
  - - [1408, 6784, 1, 3328]
    - [8, 90.293]
  - - [448, 1024, 1, 128]
    - [4, 23.627]
  - - [4288, 704, 1, 128]
    - [35, 47.839]
  - - [128, 1856, 1, 128]
    - [47, 13.842]
  - - [448, 2368, 1, 3328]
    - [36, 79.317]
  - - [5056, 64, 1, 128]
    - [20, 17.948]
  - - [5056, 2944, 1, 256]
    - [6, 73.702]
  - - [6784, 5888, 1, 128]
    - [6, 62.461]
  - - [1024, 700, 1, 512]
    - [5, 51.047]
  - - [704, 1024, 1, 256]
    - [14, 42.434]
  - - [1024, 4, 1, 256]
    - [52, 0.503]
  - - [2944, 704, 1, 128]
    - [14, 43.793]
  - - [128, 6784, 1, 1280]
    - [76, 72.595]
  - - [1408, 3584, 1, 3328]
    - [32, 92.32]
  - - [2368, 6784, 1, 256]
    - [70, 76.364]
  - - [5056, 1408, 1, 1280]
    - [6, 88.464]
  - - [256, 256, 1, 128]
    - [52, 4.725]
  - - [5056, 4288, 1, 128]
    - [35, 60.416]
  - - [1408, 1856, 1, 128]
    - [6, 47.855]
  - - [1408, 5888, 1, 3328]
    - [12, 88.529]
  - - [1856, 256, 1, 256]
    - [14, 34.915]
  - - [6784, 6784, 1, 256]
    - [46, 81.611]
  - - [64, 256, 1, 128]
    - [28, 1.212]
  - - [4288, 2368, 1, 128]
    - [35, 58.927]
  - - [256, 4288, 1, 1280]
    - [36, 75.744]
  - - [2368, 2944, 1, 256]
    - [34, 71.492]
  - - [4, 1856, 1, 256]
    - [22, 0.874]
  - - [3584, 1856, 1, 1280]
    - [7, 85.765]
  - - [6784, 6784, 1, 128]
    - [6, 62.51]
  - - [256, 1856, 1, 128]
    - [14, 24.042]
  - - [704, 64, 1, 1280]
    - [25, 13.127]
  - - [5888, 5056, 1, 256]
    - [46, 78.36]
  - - [8448, 48000, 1, 2816]
    - [9, 96.441]
  - - [3584, 448, 1, 256]
    - [14, 54.482]
  - - [448, 4288, 1, 128]
    - [14, 44.326]
  - - [7680, 64, 1, 2560]
    - [14, 53.903]
  - - [256, 6784, 1, 256]
    - [14, 57.41]
  - - [1408, 4288, 1, 128]
    - [6, 58.045]
  - - [2944, 704, 1, 3328]
    - [12, 80.572]
  - - [128, 448, 1, 256]
    - [4, 7.114]
  - - [5056, 256, 1, 1280]
    - [15, 75.57]
  - - [2560, 32, 1, 2560]
    - [57, 26.108]
  - - [3584, 3584, 1, 256]
    - [13, 74.769]
  - - [448, 1408, 1, 128]
    - [58, 29.343]
  - - [128, 256, 1, 1280]
    - [25, 9.794]
  - - [3584, 5056, 1, 256]
    - [13, 76.41]
  - - [6784, 128, 1, 256]
    - [14, 46.814]
  - - [4288, 4, 1, 256]
    - [22, 1.849]
  - - [704, 448, 1, 256]
    - [14, 29.582]
  - - [2944, 2368, 1, 1280]
    - [6, 87.12]
  - - [448, 64, 1, 3328]
    - [21, 10.751]
  - - [1408, 3584, 1, 256]
    - [26, 69.226]
  - - [3584, 4, 1, 3328]
    - [29, 4.344]
  - - [6784, 3584, 1, 256]
    - [6, 77.126]
  - - [256, 128, 1, 128]
    - [51, 2.363]
  - - [704, 1408, 1, 128]
    - [14, 35.514]
  - - [4, 2368, 1, 256]
    - [21, 1.093]
  - - [4288, 128, 1, 1280]
    - [4, 58.632]
  - - [128, 1408, 1, 256]
    - [49, 19.992]
  - - [4, 2944, 1, 256]
    - [22, 1.372]
  - - [64, 128, 1, 3328]
    - [72, 3.026]
  - - [5056, 2368, 1, 128]
    - [35, 59.333]
  - - [2944, 2944, 1, 3328]
    - [6, 89.94]
  - - [5056, 6784, 1, 256]
    - [46, 80.283]
  - - [1856, 3584, 1, 128]
    - [14, 57.015]
  - - [128, 2944, 1, 128]
    - [14, 21.104]
  - - [35, 8457, 1, 2560]
    - [14, 33.512]
  - - [1024, 704, 1, 3328]
    - [31, 69.086]
  - - [6784, 448, 1, 256]
    - [14, 60.875]
  - - [3584, 6784, 1, 128]
    - [35, 63.092]
  - - [128, 4288, 1, 256]
    - [14, 39.088]
  - - [704, 448, 1, 3328]
    - [4, 59.128]
  - - [128, 128, 1, 3328]
    - [22, 6.113]
  - - [5056, 1856, 1, 256]
    - [13, 70.852]
  - - [4608, 5984, 1, 1536]
    - [6, 91.375]
  - - [256, 128, 1, 256]
    - [22, 4.109]
  - - [1760, 3200, 1, 1760]
    - [36, 88.475]
  - - [1024, 1856, 1, 256]
    - [14, 58.315]
  - - [4096, 1600, 1, 1024]
    - [15, 83.499]
  - - [4288, 64, 1, 128]
    - [4, 15.222]
  - - [256, 448, 1, 3328]
    - [49, 32.393]
  - - [1408, 6784, 1, 1280]
    - [6, 87.752]
  - - [3584, 3584, 1, 1280]
    - [77, 87.512]
  - - [7680, 24000, 1, 2560]
    - [9, 95.635]
  - - [64, 2368, 1, 1280]
    - [49, 34.418]
  - - [448, 2368, 1, 1280]
    - [36, 73.73]
  - - [4608, 48000, 1, 1536]
    - [9, 94.951]
  - - [5888, 5888, 1, 128]
    - [35, 61.953]
  - - [64, 6784, 1, 3328]
    - [64, 68.835]
  - - [2944, 256, 1, 1280]
    - [78, 65.18]
  - - [2048, 16, 1, 2048]
    - [21, 10.429]
  - - [256, 2368, 1, 128]
    - [14, 28.202]
  - - [5056, 2368, 1, 3328]
    - [12, 90.685]
  - - [2944, 4288, 1, 256]
    - [13, 76.412]
  - - [1408, 3584, 1, 1280]
    - [32, 86.301]
  - - [2368, 64, 1, 256]
    - [60, 15.896]
  - - [64, 448, 1, 3328]
    - [72, 10.67]
  - - [704, 128, 1, 3328]
    - [79, 31.651]
  - - [8192, 1600, 1, 2048]
    - [6, 89.102]
  - - [1856, 704, 1, 256]
    - [14, 54.42]
  - - [4, 4288, 1, 1280]
    - [22, 4.175]
  - - [1408, 448, 1, 3328]
    - [41, 74.142]
  - - [1024, 4, 1, 3328]
    - [29, 1.498]
  - - [512, 24000, 1, 2560]
    - [6, 90.812]
  - - [2368, 6784, 1, 3328]
    - [8, 92.7]
  - - [1856, 1408, 1, 1280]
    - [76, 82.827]
  - - [1856, 448, 1, 1280]
    - [41, 69.919]
  - - [6784, 704, 1, 128]
    - [80, 50.0]
  - - [4, 4, 1, 256]
    - [25, 0.002]
  - - [128, 5888, 1, 128]
    - [14, 31.276]
  - - [1408, 5888, 1, 256]
    - [34, 73.291]
  - - [704, 2944, 1, 1280]
    - [36, 76.541]
  - - [4288, 64, 1, 1280]
    - [20, 44.846]
  - - [256, 64, 1, 256]
    - [28, 2.1]
  - - [704, 1856, 1, 256]
    - [58, 53.267]
  - - [704, 6784, 1, 128]
    - [14, 53.704]
  - - [3584, 704, 1, 1280]
    - [6, 78.377]
  - - [256, 128, 1, 1280]
    - [21, 9.794]
  - - [5888, 2368, 1, 256]
    - [6, 73.484]
  - - [256, 2368, 1, 1280]
    - [14, 64.638]
  - - [2944, 6784, 1, 128]
    - [13, 62.478]
  - - [3584, 448, 1, 3328]
    - [6, 79.059]
  - - [1408, 4, 1, 256]
    - [24, 0.643]
  - - [704, 2368, 1, 3328]
    - [81, 82.654]
  - - [2944, 448, 1, 256]
    - [13, 53.578]
  - - [1856, 448, 1, 128]
    - [14, 33.079]
  - - [4288, 4, 1, 3328]
    - [25, 4.738]
  - - [2368, 128, 1, 1280]
    - [20, 49.672]
  - - [256, 5888, 1, 128]
    - [14, 40.069]
  - - [64, 6784, 1, 256]
    - [58, 34.309]
  - - [64, 5056, 1, 1280]
    - [20, 50.177]
  - - [4, 6784, 1, 128]
    - [21, 1.701]
  - - [2048, 3200, 1, 512]
    - [35, 80.051]
  - - [2944, 2944, 1, 1280]
    - [7, 86.784]
  - - [5056, 448, 1, 3328]
    - [41, 79.262]
  - - [4, 3584, 1, 1280]
    - [21, 3.759]
  - - [1408, 128, 1, 128]
    - [4, 11.949]
  - - [6784, 704, 1, 3328]
    - [32, 87.279]
  - - [128, 64, 1, 1280]
    - [22, 2.514]
  - - [2368, 256, 1, 1280]
    - [14, 64.638]
  - - [4, 448, 1, 3328]
    - [21, 0.659]
  - - [5888, 4288, 1, 128]
    - [6, 61.219]
  - - [4, 5888, 1, 256]
    - [82, 2.493]
  - - [1408, 2944, 1, 3328]
    - [41, 85.386]
  - - [3584, 704, 1, 128]
    - [6, 45.626]
  - - [4608, 12000, 1, 1536]
    - [9, 93.71]
  - - [64, 1024, 1, 256]
    - [4, 8.043]
  - - [5056, 5056, 1, 128]
    - [35, 61.035]
  - - [2368, 448, 1, 1280]
    - [41, 73.288]
  - - [128, 3584, 1, 256]
    - [14, 33.498]
  - - [704, 448, 1, 1280]
    - [4, 53.352]
  - - [8192, 800, 1, 2048]
    - [73, 87.069]
  - - [448, 5056, 1, 128]
    - [14, 47.0]
  - - [256, 4, 1, 1280]
    - [28, 0.303]
  - - [5056, 3584, 1, 256]
    - [17, 74.424]
  - - [2368, 4, 1, 3328]
    - [57, 3.243]
  - - [1408, 5056, 1, 128]
    - [6, 60.747]
  - - [2944, 3584, 1, 128]
    - [6, 60.744]
  - - [3584, 2368, 1, 256]
    - [13, 72.852]
  - - [128, 3584, 1, 3328]
    - [4, 53.795]
  - - [128, 1024, 1, 1280]
    - [62, 30.365]
  - - [8448, 24000, 1, 2816]
    - [9, 95.963]
  - - [64, 704, 1, 256]
    - [4, 5.65]
  - - [4288, 256, 1, 1280]
    - [14, 74.849]
  - - [3584, 3584, 1, 3328]
    - [32, 91.721]
  - - [4, 704, 1, 128]
    - [25, 0.206]
  - - [5888, 6784, 1, 256]
    - [46, 80.397]
  - - [4288, 2944, 1, 3328]
    - [7, 90.734]
  - - [2944, 64, 1, 128]
    - [4, 12.351]
  - - [1024, 128, 1, 3328]
    - [49, 36.07]
  - - [1024, 16, 1, 500000]
    - [72, 6.664]
  - - [4288, 128, 1, 3328]
    - [4, 64.061]
  - - [7680, 128, 1, 2560]
    - [83, 79.981]
  - - [256, 5056, 1, 1280]
    - [36, 76.188]
  - - [1408, 256, 1, 128]
    - [20, 19.615]
  - - [2944, 5888, 1, 3328]
    - [16, 92.87]
  - - [6784, 5888, 1, 1280]
    - [9, 90.719]
  - - [2048, 800, 1, 512]
    - [14, 65.747]
  - - [704, 128, 1, 256]
    - [4, 10.609]
  - - [5888, 4288, 1, 1280]
    - [7, 89.543]
  - - [1024, 24000, 1, 2048]
    - [7, 92.176]
  - - [448, 256, 1, 1280]
    - [49, 27.451]
  - - [5888, 3584, 1, 128]
    - [35, 60.442]
  - - [1024, 2944, 1, 128]
    - [26, 49.124]
  - - [5056, 4, 1, 1280]
    - [22, 4.305]
  - - [256, 1408, 1, 1280]
    - [84, 54.289]
  - - [3072, 16, 1, 1024]
    - [72, 11.514]
  - - [704, 3584, 1, 128]
    - [14, 46.951]
  - - [5888, 448, 1, 3328]
    - [6, 87.877]
  - - [2368, 4288, 1, 1280]
    - [12, 86.506]
  - - [4288, 2944, 1, 128]
    - [35, 60.282]
  - - [1024, 6784, 1, 3328]
    - [32, 91.409]
  - - [128, 2368, 1, 256]
    - [20, 28.664]
  - - [6784, 64, 1, 3328]
    - [18, 75.107]
  - - [5056, 2944, 1, 3328]
    - [7, 93.123]
  - - [448, 128, 1, 256]
    - [22, 7.27]
  - - [2944, 3584, 1, 256]
    - [13, 74.452]
  - - [1408, 1408, 1, 3328]
    - [32, 87.656]
  - - [1856, 128, 1, 1280]
    - [4, 39.953]
  - - [3584, 3584, 1, 128]
    - [35, 61.186]
  - - [64, 3584, 1, 256]
    - [20, 21.69]
  - - [1408, 4, 1, 3328]
    - [72, 2.006]
  - - [128, 2944, 1, 3328]
    - [40, 66.884]
  - - [3584, 704, 1, 256]
    - [34, 60.393]
  - - [2944, 448, 1, 3328]
    - [41, 82.456]
  - - [3584, 1408, 1, 3328]
    - [53, 90.369]
  - - [704, 3584, 1, 1280]
    - [8, 80.546]
  - - [2944, 6784, 1, 1280]
    - [6, 88.445]
  - - [1856, 6784, 1, 256]
    - [34, 76.575]
  - - [4288, 448, 1, 3328]
    - [53, 83.73]
  - - [6784, 4288, 1, 128]
    - [6, 60.975]
  - - [6784, 704, 1, 1280]
    - [15, 83.057]
  - - [256, 4288, 1, 256]
    - [14, 50.861]
  - - [3584, 6784, 1, 256]
    - [46, 77.94]
  - - [6144, 12000, 1, 2048]
    - [9, 94.683]
  - - [6144, 16, 1, 2560]
    - [85, 21.159]
  - - [3584, 64, 1, 128]
    - [4, 13.641]
  - - [5888, 1024, 1, 3328]
    - [53, 90.7]
  - - [448, 64, 1, 128]
    - [22, 2.094]
  - - [704, 6784, 1, 1280]
    - [10, 83.866]
  - - [4, 1024, 1, 1280]
    - [85, 1.199]
  - - [5888, 128, 1, 256]
    - [14, 43.045]
  - - [4096, 16, 1, 4096]
    - [86, 16.967]
  - - [1856, 5056, 1, 3328]
    - [12, 90.953]
  - - [4, 6784, 1, 256]
    - [22, 2.77]
  - - [1024, 3584, 1, 128]
    - [14, 51.137]
  - - [1024, 1408, 1, 128]
    - [4, 39.047]
  - - [2368, 2944, 1, 128]
    - [35, 56.64]
  - - [5056, 64, 1, 256]
    - [14, 28.498]
  - - [4, 448, 1, 1280]
    - [25, 0.538]
  - - [5056, 2944, 1, 128]
    - [35, 60.044]
  - - [5888, 5056, 1, 3328]
    - [7, 93.382]
  - - [1024, 704, 1, 128]
    - [58, 29.703]
  - - [5888, 2368, 1, 128]
    - [35, 59.798]
  - - [128, 5056, 1, 3328]
    - [87, 75.242]
  - - [3584, 6784, 1, 1280]
    - [6, 91.783]
  - - [448, 4, 1, 1280]
    - [28, 0.533]
  - - [1856, 5888, 1, 256]
    - [70, 75.315]
  - - [256, 256, 1, 256]
    - [22, 8.043]
  - - [256, 64, 1, 128]
    - [28, 1.196]
  - - [4288, 4288, 1, 3328]
    - [12, 92.122]
  - - [4288, 1408, 1, 1280]
    - [6, 85.528]
  - - [3584, 5056, 1, 128]
    - [13, 61.925]
  - - [4, 1024, 1, 3328]
    - [29, 1.495]
  - - [4288, 2368, 1, 256]
    - [13, 72.046]
  - - [2944, 5056, 1, 1280]
    - [7, 90.688]
  - - [448, 6784, 1, 256]
    - [14, 64.812]
  - - [64, 128, 1, 128]
    - [22, 0.598]
  - - [1856, 2368, 1, 128]
    - [14, 52.927]
  - - [6784, 2368, 1, 3328]
    - [6, 93.072]
  - - [256, 1024, 1, 1280]
    - [4, 44.871]
  - - [704, 4, 1, 128]
    - [25, 0.198]
  - - [256, 4, 1, 256]
    - [28, 0.127]
  - - [4288, 128, 1, 256]
    - [14, 38.61]
  - - [4288, 1856, 1, 3328]
    - [6, 91.733]
  - - [3584, 448, 1, 128]
    - [26, 41.349]
  - - [2048, 1600, 1, 2048]
    - [41, 83.132]
  - - [256, 4, 1, 3328]
    - [72, 0.378]
  - - [4, 1408, 1, 1280]
    - [28, 1.577]
  - - [3584, 64, 1, 1280]
    - [47, 38.688]
  - - [1408, 448, 1, 128]
    - [14, 28.207]
  - - [3584, 1024, 1, 1280]
    - [7, 80.618]
  - - [1856, 5056, 1, 256]
    - [13, 75.286]
  - - [4, 3584, 1, 256]
    - [74, 1.638]
  - - [4, 2944, 1, 1280]
    - [24, 3.13]
  - - [1024, 4288, 1, 256]
    - [34, 68.829]
  - - [5888, 3584, 1, 3328]
    - [32, 93.404]
  - - [1856, 4, 1, 256]
    - [4, 0.874]
  - - [4, 256, 1, 256]
    - [25, 0.128]
  - - [5056, 3584, 1, 3328]
    - [77, 93.378]
  - - [704, 448, 1, 128]
    - [47, 18.014]
  - - [2368, 1408, 1, 1280]
    - [41, 82.758]
  - - [5056, 2944, 1, 1280]
    - [7, 90.325]
  - - [4, 4, 1, 128]
    - [82, 0.001]
  - - [3584, 256, 1, 256]
    - [14, 45.236]
  - - [1024, 6784, 1, 256]
    - [6, 72.529]
  - - [4, 128, 1, 256]
    - [25, 0.064]
  - - [64, 64, 1, 1280]
    - [24, 1.231]
  - - [5124, 9124, 1, 2048]
    - [9, 91.56]
  - - [6784, 4, 1, 128]
    - [88, 1.631]
  - - [2944, 1408, 1, 128]
    - [26, 52.437]
  - - [448, 128, 1, 3328]
    - [24, 20.575]
  - - [3584, 1408, 1, 1280]
    - [53, 83.075]
  - - [64, 4288, 1, 3328]
    - [20, 49.293]
  - - [5056, 6784, 1, 3328]
    - [9, 92.477]
  - - [128, 2944, 1, 256]
    - [58, 31.734]
  - - [128, 6784, 1, 128]
    - [14, 33.173]
  - - [3584, 4288, 1, 256]
    - [13, 75.706]
  - - [448, 1856, 1, 256]
    - [14, 47.963]
  - - [1856, 6784, 1, 3328]
    - [8, 93.357]
  - - [3584, 128, 1, 3328]
    - [60, 53.627]
  - - [64, 1856, 1, 256]
    - [25, 13.569]
  - - [64, 448, 1, 256]
    - [25, 3.557]
  - - [5888, 4288, 1, 256]
    - [46, 77.468]
  - - [4, 448, 1, 128]
    - [25, 0.129]
  - - [5056, 1408, 1, 256]
    - [6, 69.898]
  - - [35, 8457, 1, 2048]
    - [89, 31.99]
  - - [64, 256, 1, 1280]
    - [22, 4.922]
  - - [3584, 1024, 1, 256]
    - [34, 63.863]
  - - [256, 704, 1, 256]
    - [45, 19.253]
  - - [5888, 5888, 1, 256]
    - [46, 79.108]
  - - [4288, 1024, 1, 1280]
    - [6, 86.065]
  - - [5888, 128, 1, 3328]
    - [56, 71.814]
  - - [448, 6784, 1, 3328]
    - [10, 85.972]
  - - [2944, 1408, 1, 1280]
    - [14, 82.085]
  - - [64, 128, 1, 1280]
    - [24, 2.461]
  - - [2944, 1856, 1, 3328]
    - [41, 85.651]
  - - [2368, 64, 1, 128]
    - [66, 9.607]
  - - [256, 1024, 1, 128]
    - [20, 15.274]
  - - [3584, 5888, 1, 1280]
    - [77, 89.698]
  - - [64, 4, 1, 128]
    - [28, 0.019]
  - - [6784, 1856, 1, 1280]
    - [6, 90.36]
  - - [2944, 5056, 1, 256]
    - [13, 76.459]
  - - [4288, 4, 1, 128]
    - [22, 1.112]
  - - [5888, 256, 1, 3328]
    - [41, 80.999]
  - - [2944, 4288, 1, 128]
    - [35, 60.836]
  - - [3584, 1408, 1, 256]
    - [13, 67.617]
  - - [704, 3584, 1, 3328]
    - [8, 85.403]
  - - [4096, 3200, 1, 1024]
    - [6, 87.65]
  - - [5056, 448, 1, 1280]
    - [41, 76.143]
  - - [3584, 1856, 1, 3328]
    - [12, 89.516]
  - - [4288, 6784, 1, 1280]
    - [9, 90.193]
  - - [2560, 7000, 1, 2560]
    - [6, 93.035]
  - - [1408, 704, 1, 1280]
    - [41, 68.56]
  - - [2944, 1024, 1, 256]
    - [13, 64.17]
  - - [6784, 64, 1, 256]
    - [48, 33.173]
  - - [2368, 4288, 1, 3328]
    - [12, 89.91]
  - - [4, 1408, 1, 256]
    - [25, 0.663]
  - - [1024, 1408, 1, 1280]
    - [41, 73.536]
  - - [64, 64, 1, 256]
    - [28, 0.525]
  - - [704, 256, 1, 3328]
    - [49, 49.057]
  - - [6784, 5056, 1, 256]
    - [46, 79.798]
  - - [1856, 1856, 1, 128]
    - [14, 49.927]
  - - [3584, 5056, 1, 3328]
    - [53, 91.442]
  - - [448, 6784, 1, 128]
    - [14, 48.835]
  - - [4, 704, 1, 3328]
    - [23, 1.03]
  - - [35, 8457, 1, 4096]
    - [14, 31.619]
  - - [448, 2944, 1, 256]
    - [14, 53.767]
  - - [4, 4288, 1, 3328]
    - [21, 4.863]
  - - [2944, 6784, 1, 256]
    - [34, 77.451]
  - - [2944, 2944, 1, 128]
    - [35, 58.75]
  - - [4, 4, 1, 1280]
    - [21, 0.005]
  - - [1856, 3584, 1, 1280]
    - [12, 85.9]
  - - [64, 2944, 1, 256]
    - [57, 20.316]
  - - [448, 256, 1, 128]
    - [74, 7.783]
  - - [4288, 448, 1, 128]
    - [87, 41.975]
  - - [4608, 24000, 1, 1536]
    - [9, 94.54]
  - - [1856, 1408, 1, 3328]
    - [8, 88.613]
  - - [128, 128, 1, 128]
    - [22, 1.212]
  - - [1024, 4288, 1, 3328]
    - [6, 89.782]
  - - [448, 2368, 1, 256]
    - [14, 51.425]
  - - [1024, 4, 1, 128]
    - [28, 0.285]
  - - [64, 1408, 1, 1280]
    - [38, 24.871]
  - - [64, 6784, 1, 1280]
    - [71, 60.496]
  - - [5056, 448, 1, 256]
    - [14, 59.257]
  - - [2944, 2368, 1, 3328]
    - [6, 89.772]
  - - [704, 4288, 1, 3328]
    - [32, 90.424]
  - - [1408, 128, 1, 256]
    - [60, 19.802]
  - - [1024, 1856, 1, 1280]
    - [7, 80.435]
  - - [2048, 6400, 1, 2048]
    - [6, 89.963]
  - - [512, 48000, 1, 2816]
    - [90, 92.293]
  - - [5124, 9124, 1, 2560]
    - [9, 91.864]
  - - [128, 2368, 1, 3328]
    - [20, 57.471]
  - - [1024, 5888, 1, 256]
    - [34, 71.416]
  - - [64, 2944, 1, 1280]
    - [62, 43.129]
  - - [5056, 64, 1, 3328]
    - [50, 57.163]
  - - [128, 704, 1, 128]
    - [4, 6.58]
  - - [1408, 2368, 1, 256]
    - [14, 66.093]
  - - [1408, 1408, 1, 256]
    - [14, 59.874]
  - - [4, 64, 1, 128]
    - [25, 0.018]
  - - [64, 1024, 1, 128]
    - [4, 4.786]
  - - [1024, 8, 1, 500000]
    - [82, 3.34]
  - - [2368, 2368, 1, 128]
    - [14, 54.732]
  - - [64, 5888, 1, 128]
    - [14, 19.761]
  - - [5888, 4, 1, 3328]
    - [22, 5.304]
  - - [6784, 1408, 1, 128]
    - [6, 56.455]
  - - [4288, 5888, 1, 256]
    - [46, 76.292]
  - - [1408, 5056, 1, 256]
    - [6, 73.527]
  - - [5056, 128, 1, 3328]
    - [14, 74.434]
  - - [128, 128, 1, 1280]
    - [28, 5.001]
  - - [448, 704, 1, 256]
    - [14, 28.428]
  - - [4288, 3584, 1, 128]
    - [35, 60.348]
  - - [2944, 128, 1, 3328]
    - [40, 66.806]
  - - [64, 1408, 1, 3328]
    - [38, 30.998]
  - - [3584, 5056, 1, 1280]
    - [15, 87.795]
  - - [256, 448, 1, 1280]
    - [62, 27.565]
  - - [704, 704, 1, 128]
    - [14, 24.646]
  - - [5056, 4, 1, 128]
    - [21, 1.215]
  - - [704, 256, 1, 1280]
    - [91, 41.255]
  - - [64, 2368, 1, 3328]
    - [62, 40.735]
  - - [1856, 1024, 1, 128]
    - [14, 44.748]
  - - [1856, 64, 1, 128]
    - [4, 7.699]
  - - [4096, 64, 1, 4096]
    - [50, 47.581]
  - - [1024, 24000, 1, 1536]
    - [7, 91.763]
  - - [704, 4288, 1, 256]
    - [14, 64.495]
  - - [5888, 2368, 1, 1280]
    - [6, 88.209]
  - - [128, 256, 1, 256]
    - [60, 4.109]
  - - [64, 128, 1, 256]
    - [22, 1.062]
  - - [2368, 5888, 1, 1280]
    - [6, 88.597]
  - - [5888, 256, 1, 1280]
    - [14, 76.005]
  - - [1760, 128, 1, 1760]
    - [62, 54.147]
  - - [4, 5888, 1, 1280]
    - [22, 4.887]
  - - [704, 128, 1, 128]
    - [4, 6.418]
  - - [1024, 4, 1, 1280]
    - [24, 1.199]
  - - [2368, 1856, 1, 3328]
    - [12, 88.171]
  - - [2368, 128, 1, 128]
    - [20, 16.813]
  - - [2944, 704, 1, 256]
    - [13, 58.178]
  - - [5056, 128, 1, 128]
    - [14, 28.716]
  - - [2368, 1024, 1, 3328]
    - [41, 84.224]
  - - [256, 704, 1, 3328]
    - [62, 49.146]
  - - [704, 3584, 1, 256]
    - [14, 62.067]
  - - [704, 2944, 1, 3328]
    - [12, 80.739]
  - - [6784, 1024, 1, 128]
    - [6, 55.733]
  - - [256, 448, 1, 128]
    - [4, 7.971]
  - - [448, 1024, 1, 3328]
    - [68, 56.629]
  - - [2944, 1024, 1, 3328]
    - [12, 84.496]
  - - [2944, 5056, 1, 128]
    - [13, 62.085]
  - - [2368, 256, 1, 256]
    - [14, 41.88]
  - - [1408, 6784, 1, 256]
    - [13, 74.711]
  - - [6784, 1408, 1, 3328]
    - [8, 89.381]
  - - [4288, 6784, 1, 128]
    - [35, 62.311]
  - - [704, 64, 1, 256]
    - [22, 5.53]
  - - [5888, 4, 1, 1280]
    - [25, 4.717]
  - - [256, 2368, 1, 3328]
    - [36, 71.929]
  - - [6784, 2944, 1, 1280]
    - [6, 88.289]
  - - [4288, 1856, 1, 128]
    - [35, 56.817]
  - - [1856, 2944, 1, 128]
    - [14, 55.492]
  - - [6784, 448, 1, 128]
    - [13, 47.256]
  - - [64, 3584, 1, 128]
    - [4, 13.231]
  - - [448, 5056, 1, 1280]
    - [41, 76.995]
  - - [2368, 1856, 1, 128]
    - [35, 52.49]
  - - [64, 2944, 1, 3328]
    - [92, 49.317]
  - - [4288, 704, 1, 256]
    - [13, 62.303]
  - - [256, 3584, 1, 128]
    - [14, 32.874]
  - - [5888, 704, 1, 256]
    - [58, 64.105]
  - - [3584, 1024, 1, 128]
    - [75, 49.463]
  - - [256, 5888, 1, 3328]
    - [41, 81.732]
  - - [1408, 4288, 1, 3328]
    - [32, 92.418]
  - - [6784, 4288, 1, 256]
    - [46, 78.303]
  - - [4288, 256, 1, 128]
    - [5, 34.793]
  - - [5888, 256, 1, 256]
    - [14, 52.698]
  - - [6784, 1024, 1, 1280]
    - [6, 86.775]
  - - [5888, 1024, 1, 128]
    - [6, 54.429]
  - - [1024, 128, 1, 256]
    - [4, 14.972]
  - - [512, 16, 1, 500000]
    - [72, 3.391]
  - - [128, 64, 1, 3328]
    - [22, 3.026]
  - - [448, 64, 1, 256]
    - [22, 3.519]
  - - [2368, 256, 1, 128]
    - [14, 29.14]
  - - [6784, 3584, 1, 1280]
    - [6, 91.645]
  - - [1024, 6784, 1, 1280]
    - [32, 86.382]
  - - [2944, 64, 1, 1280]
    - [49, 42.623]
  - - [1408, 2944, 1, 1280]
    - [14, 81.916]
  - - [256, 1856, 1, 256]
    - [14, 34.476]
  - - [2048, 800, 1, 2048]
    - [6, 77.073]
  - - [1408, 2368, 1, 3328]
    - [41, 86.232]
  - - [2944, 4, 1, 3328]
    - [57, 3.916]
  - - [128, 1408, 1, 3328]
    - [49, 48.879]
  - - [2944, 1856, 1, 128]
    - [35, 55.2]
  - - [256, 2944, 1, 128]
    - [5, 31.966]
  - - [256, 6784, 1, 128]
    - [5, 43.557]
  - - [2368, 4, 1, 128]
    - [21, 0.607]
  - - [1408, 256, 1, 3328]
    - [50, 63.75]
  - - [1856, 4, 1, 128]
    - [21, 0.487]
  - - [5056, 6784, 1, 128]
    - [35, 61.715]
  - - [4288, 5056, 1, 128]
    - [35, 61.305]
  - - [1856, 5888, 1, 128]
    - [13, 59.98]
  - - [2944, 5888, 1, 256]
    - [13, 77.274]
  - - [3584, 1856, 1, 256]
    - [13, 71.19]
  - - [4288, 3584, 1, 1280]
    - [7, 88.017]
  - - [2368, 448, 1, 256]
    - [14, 49.153]
  - - [4288, 256, 1, 3328]
    - [14, 80.311]
  - - [1856, 704, 1, 128]
    - [13, 39.67]
  - - [1408, 64, 1, 256]
    - [25, 10.397]
  - - [64, 1856, 1, 128]
    - [22, 7.876]
  - - [4, 256, 1, 128]
    - [24, 0.074]
  - - [2560, 16, 1, 2560]
    - [21, 13.127]
  - - [704, 5888, 1, 128]
    - [14, 52.901]
  - - [6784, 3584, 1, 128]
    - [6, 61.461]
  - - [1024, 64, 1, 256]
    - [25, 7.715]
  - - [64, 2368, 1, 256]
    - [57, 15.752]
  - - [4288, 5056, 1, 3328]
    - [7, 92.585]
  - - [4, 1856, 1, 1280]
    - [25, 2.089]
  - - [4288, 128, 1, 128]
    - [58, 25.951]
  - - [1408, 1408, 1, 128]
    - [14, 45.023]
  - - [7680, 16, 1, 2560]
    - [72, 20.696]
  - - [1856, 128, 1, 128]
    - [4, 13.842]
  - - [5056, 2368, 1, 256]
    - [17, 72.092]
  - - [4288, 704, 1, 3328]
    - [53, 89.477]
  - - [448, 3584, 1, 256]
    - [14, 56.134]
  - - [2368, 64, 1, 1280]
    - [93, 34.149]
  - - [2368, 1024, 1, 1280]
    - [14, 80.204]
  - - [2944, 1408, 1, 3328]
    - [41, 85.058]
  - - [1408, 448, 1, 256]
    - [14, 44.106]
  - - [1024, 1408, 1, 3328]
    - [41, 77.728]
  - - [2944, 5888, 1, 1280]
    - [7, 88.504]
  - - [1408, 4, 1, 1280]
    - [21, 1.6]
  - - [5888, 3584, 1, 256]
    - [6, 75.375]
  - - [2368, 5056, 1, 128]
    - [13, 60.108]
  - - [1408, 1856, 1, 3328]
    - [94, 87.408]
  - - [4, 4, 1, 3328]
    - [24, 0.006]
  - - [6784, 1408, 1, 1280]
    - [6, 87.059]
  - - [4096, 7000, 1, 4096]
    - [8, 93.694]
  - - [704, 2944, 1, 256]
    - [14, 58.749]
  - - [4288, 64, 1, 256]
    - [20, 24.735]
  - - [6784, 5888, 1, 3328]
    - [77, 93.427]
  - - [2368, 4288, 1, 128]
    - [35, 59.586]
  - - [64, 4288, 1, 1280]
    - [20, 43.974]
  - - [6784, 64, 1, 1280]
    - [50, 63.568]
  - - [3584, 128, 1, 128]
    - [14, 23.012]
  - - [1024, 6784, 1, 128]
    - [6, 57.824]
  - - [4, 1856, 1, 128]
    - [60, 0.504]
  - - [1408, 64, 1, 3328]
    - [38, 31.213]
  - - [6784, 4, 1, 256]
    - [25, 2.722]
  - - [1408, 1408, 1, 1280]
    - [41, 79.915]
  - - [16384, 400, 1, 4096]
    - [32, 85.633]
  - - [256, 2368, 1, 256]
    - [14, 41.63]
  - - [448, 4288, 1, 3328]
    - [46, 84.467]
  - - [2368, 1408, 1, 256]
    - [14, 64.866]
  - - [5888, 5056, 1, 128]
    - [6, 61.617]
  - - [704, 2368, 1, 256]
    - [14, 56.734]
  - - [1024, 24000, 1, 2560]
    - [7, 92.73]
  - - [2944, 448, 1, 1280]
    - [41, 77.396]
  - - [5888, 2368, 1, 3328]
    - [12, 91.999]
  - - [5124, 9124, 1, 1760]
    - [19, 92.064]
  - - [448, 1408, 1, 1280]
    - [41, 67.633]
  - - [448, 1856, 1, 1280]
    - [41, 70.535]
  - - [4288, 448, 1, 1280]
    - [14, 77.492]
  - - [5888, 704, 1, 3328]
    - [41, 84.989]
  - - [5056, 256, 1, 128]
    - [34, 39.297]
  - - [1856, 256, 1, 128]
    - [58, 23.031]
  - - [64, 1408, 1, 128]
    - [74, 5.907]
  - - [704, 4, 1, 256]
    - [28, 0.346]
  - - [1408, 5888, 1, 128]
    - [6, 58.895]
  - - [7680, 12000, 1, 2560]
    - [9, 95.429]
  - - [1408, 1024, 1, 256]
    - [14, 54.182]
  - - [8192, 400, 1, 2048]
    - [41, 77.827]
  - - [1024, 1856, 1, 128]
    - [14, 44.386]
  - - [256, 704, 1, 128]
    - [4, 11.552]
  - - [2560, 128, 1, 2560]
    - [20, 59.255]
  - - [448, 1024, 1, 256]
    - [14, 33.71]
  - - [128, 4, 1, 3328]
    - [72, 0.185]
  - - [5056, 6784, 1, 1280]
    - [9, 91.095]
  - - [1408, 64, 1, 128]
    - [22, 6.188]
  - - [1024, 448, 1, 1280]
    - [4, 51.285]
  - - [704, 5056, 1, 3328]
    - [8, 89.979]
  - - [128, 5056, 1, 256]
    - [14, 43.159]
  - - [64, 1024, 1, 3328]
    - [29, 23.073]
  - - [1856, 4, 1, 3328]
    - [25, 2.566]
  - - [4, 2944, 1, 128]
    - [52, 0.849]
  - - [2368, 2944, 1, 3328]
    - [6, 90.034]
  - - [448, 448, 1, 1280]
    - [49, 45.761]
  - - [2368, 3584, 1, 256]
    - [13, 74.12]
  - - [5056, 3584, 1, 1280]
    - [32, 89.617]
  - - [5124, 9124, 1, 4096]
    - [53, 92.48]
  - - [7680, 48000, 1, 2560]
    - [9, 95.888]
  - - [448, 4, 1, 3328]
    - [72, 0.651]
  - - [1856, 2944, 1, 1280]
    - [14, 83.164]
  - - [1024, 48000, 1, 2816]
    - [77, 93.738]
  - - [128, 1024, 1, 256]
    - [4, 14.266]
  - - [2944, 1408, 1, 256]
    - [13, 65.781]
  - - [4288, 1408, 1, 3328]
    - [53, 89.619]
  - - [3584, 64, 1, 3328]
    - [47, 45.206]
  - - [5888, 2944, 1, 128]
    - [35, 59.983]
  - - [2944, 1024, 1, 128]
    - [26, 48.441]
  - - [4288, 5056, 1, 1280]
    - [7, 90.33]
  - - [5888, 6784, 1, 1280]
    - [9, 90.973]
  - - [6784, 5056, 1, 128]
    - [6, 62.122]
  - - [256, 1024, 1, 3328]
    - [20, 50.149]
  - - [3584, 4, 1, 256]
    - [21, 1.56]
  - - [1760, 1600, 1, 1760]
    - [41, 85.023]
  - - [1856, 64, 1, 3328]
    - [44, 32.569]
  - - [4, 128, 1, 3328]
    - [72, 0.185]
  - - [5888, 1408, 1, 3328]
    - [12, 88.541]
  - - [448, 2944, 1, 128]
    - [13, 40.043]
  - - [2368, 1856, 1, 256]
    - [13, 68.52]
  - - [256, 5056, 1, 256]
    - [5, 54.499]
  - - [128, 3584, 1, 128]
    - [14, 22.619]
  - - [448, 3584, 1, 3328]
    - [95, 80.058]
  - - [4, 5056, 1, 3328]
    - [22, 5.203]
  - - [704, 2368, 1, 128]
    - [14, 43.123]
  - - [5888, 256, 1, 128]
    - [14, 40.069]
  - - [4, 5056, 1, 128]
    - [74, 1.311]
  - - [448, 256, 1, 256]
    - [4, 13.1]
  - - [704, 4, 1, 3328]
    - [29, 1.03]
  - - [1408, 256, 1, 256]
    - [14, 31.988]
  - - [3584, 1856, 1, 128]
    - [35, 55.692]
  - - [4288, 4288, 1, 128]
    - [35, 61.523]
  - - [1856, 1024, 1, 3328]
    - [7, 85.676]
  - - [128, 5888, 1, 3328]
    - [31, 71.905]
  - - [1024, 5056, 1, 256]
    - [34, 70.024]
  - - [5888, 5888, 1, 1280]
    - [7, 91.33]
  - - [5056, 5888, 1, 128]
    - [35, 62.04]
  - - [2368, 1408, 1, 3328]
    - [41, 86.291]
  - - [1024, 48000, 1, 1536]
    - [7, 92.318]
  - - [5888, 448, 1, 256]
    - [6, 61.109]
  - - [2560, 3200, 1, 2560]
    - [12, 87.075]
  - - [5888, 6784, 1, 128]
    - [35, 62.174]
  - - [6144, 48000, 1, 2048]
    - [19, 95.453]
  - - [6784, 5056, 1, 1280]
    - [9, 90.915]
  - - [5056, 704, 1, 1280]
    - [12, 83.977]
  - - [1024, 48000, 1, 2560]
    - [77, 93.655]
  - - [4608, 32, 1, 1536]
    - [91, 31.602]
  - - [1024, 2368, 1, 128]
    - [26, 46.164]
  - - [128, 704, 1, 256]
    - [52, 10.829]
  - - [2368, 448, 1, 3328]
    - [41, 78.962]
  - - [128, 5888, 1, 1280]
    - [94, 63.56]
  - - [16384, 800, 1, 4096]
    - [73, 89.095]
  - - [448, 128, 1, 1280]
    - [25, 16.376]
  - - [6784, 4, 1, 3328]
    - [22, 5.59]
  - - [5888, 5056, 1, 1280]
    - [7, 91.314]
  - - [1024, 64, 1, 3328]
    - [38, 23.127]
  - - [3072, 48000, 1, 1024]
    - [9, 94.042]
  - - [64, 3584, 1, 1280]
    - [4, 38.242]
  - - [6784, 1408, 1, 256]
    - [6, 70.868]
  - - [3584, 5888, 1, 128]
    - [35, 62.49]
  - - [5056, 5888, 1, 256]
    - [46, 79.063]
  - - [2368, 1024, 1, 256]
    - [14, 61.892]
  - - [2944, 1856, 1, 256]
    - [70, 69.197]
  - - [1856, 6784, 1, 1280]
    - [8, 89.47]
  - - [64, 5056, 1, 128]
    - [60, 17.777]
  - - [64, 6784, 1, 128]
    - [14, 21.59]
  - - [448, 704, 1, 128]
    - [47, 18.564]
  - - [4, 1024, 1, 128]
    - [28, 0.299]
  - - [4288, 3584, 1, 256]
    - [13, 73.356]
  - - [1408, 704, 1, 128]
    - [14, 34.239]
  - - [64, 256, 1, 3328]
    - [22, 6.023]
  - - [6784, 448, 1, 3328]
    - [12, 85.313]
  - - [5056, 1856, 1, 1280]
    - [12, 86.971]
  - - [1408, 1024, 1, 3328]
    - [41, 77.784]
  - - [2368, 256, 1, 3328]
    - [41, 71.142]
  - - [5888, 3584, 1, 1280]
    - [6, 89.481]
  - - [1856, 3584, 1, 3328]
    - [12, 89.879]
  - - [5888, 128, 1, 1280]
    - [43, 64.985]
  - - [1024, 2944, 1, 256]
    - [34, 65.009]
  - - [448, 6784, 1, 1280]
    - [10, 82.001]
  - - [256, 3584, 1, 1280]
    - [36, 63.689]
  - - [704, 5056, 1, 256]
    - [34, 67.209]
  - - [3584, 1024, 1, 3328]
    - [7, 84.061]
  - - [2944, 1856, 1, 1280]
    - [14, 82.815]
  - - [128, 256, 1, 128]
    - [4, 2.393]
  - - [5056, 256, 1, 256]
    - [14, 52.766]
  - - [2944, 4288, 1, 3328]
    - [77, 90.266]
  - - [2368, 3584, 1, 3328]
    - [12, 90.9]
  - - [2944, 704, 1, 1280]
    - [17, 75.909]
  - - [128, 4, 1, 256]
    - [28, 0.062]
  - - [2944, 3584, 1, 1280]
    - [6, 88.828]
  - - [1856, 5888, 1, 1280]
    - [77, 87.895]
  - - [256, 256, 1, 1280]
    - [29, 18.441]
  - - [2048, 3200, 1, 2048]
    - [16, 87.943]
  - - [4288, 1408, 1, 256]
    - [13, 67.955]
  - - [3584, 64, 1, 256]
    - [51, 20.837]
  - - [64, 1856, 1, 3328]
    - [62, 32.809]
  - - [256, 1408, 1, 128]
    - [4, 20.385]
  - - [5888, 1408, 1, 128]
    - [35, 56.461]
  - - [4288, 2368, 1, 1280]
    - [11, 85.998]
  - - [4, 4288, 1, 256]
    - [21, 1.921]
  - - [256, 4288, 1, 128]
    - [5, 35.179]
  - - [2048, 128, 1, 2048]
    - [47, 44.805]
  - - [256, 128, 1, 3328]
    - [22, 12.135]
  - - [512, 8, 1, 500000]
    - [29, 1.696]
  - - [6784, 2368, 1, 256]
    - [6, 75.802]
  - - [5888, 128, 1, 128]
    - [96, 31.054]
  - - [1024, 24000, 1, 2816]
    - [7, 92.748]
  - - [7680, 5984, 1, 2560]
    - [7, 93.785]
  - - [4288, 1856, 1, 256]
    - [13, 71.121]
  - - [1856, 256, 1, 3328]
    - [4, 57.284]
  - - [1856, 2944, 1, 256]
    - [13, 69.426]
  - - [5056, 1024, 1, 128]
    - [35, 52.58]
  - - [64, 5888, 1, 1280]
    - [97, 54.616]
  - - [1760, 800, 1, 1760]
    - [4, 76.282]
  - - [6784, 256, 1, 128]
    - [70, 41.568]
  - - [5888, 704, 1, 128]
    - [98, 50.128]
  - - [1408, 2368, 1, 128]
    - [14, 51.151]
  - - [1024, 4288, 1, 1280]
    - [6, 85.861]
  - - [2368, 5056, 1, 3328]
    - [12, 90.621]
  - - [448, 4, 1, 128]
    - [28, 0.129]
  - - [4, 256, 1, 3328]
    - [85, 0.374]
  - - [4288, 1024, 1, 3328]
    - [8, 89.648]
  - - [6144, 48000, 1, 2560]
    - [9, 95.906]
  - - [1024, 5056, 1, 3328]
    - [16, 88.591]
  - - [1024, 1856, 1, 3328]
    - [9, 85.65]
  - - [704, 704, 1, 1280]
    - [4, 54.98]
  - - [128, 2368, 1, 1280]
    - [4, 50.098]
  - - [1408, 128, 1, 3328]
    - [49, 48.528]
  - - [3584, 256, 1, 1280]
    - [41, 63.158]
  - - [4, 128, 1, 128]
    - [25, 0.036]
  - - [5888, 64, 1, 1280]
    - [40, 56.17]
  - - [3584, 128, 1, 1280]
    - [4, 50.215]
  - - [4, 256, 1, 1280]
    - [24, 0.309]
  - - [128, 704, 1, 3328]
    - [38, 32.026]
  - - [4288, 6784, 1, 256]
    - [46, 79.265]
  - - [3584, 2944, 1, 3328]
    - [16, 91.247]
  - - [128, 1856, 1, 256]
    - [20, 23.227]
  - - [64, 4288, 1, 256]
    - [20, 25.74]
  - - [4, 3584, 1, 3328]
    - [25, 4.498]
  - - [64, 4, 1, 3328]
    - [85, 0.09]
  - - [4, 64, 1, 3328]
    - [29, 0.09]
  - - [5888, 2944, 1, 256]
    - [46, 73.578]
  - - [1856, 64, 1, 256]
    - [4, 13.177]
  - - [5056, 128, 1, 1280]
    - [14, 68.123]
  - - [448, 4288, 1, 1280]
    - [36, 78.48]
  - - [448, 1856, 1, 3328]
    - [99, 77.893]
  - - [1024, 4288, 1, 128]
    - [6, 54.824]
  - - [4, 1024, 1, 256]
    - [25, 0.519]
  - - [5056, 4288, 1, 256]
    - [46, 76.748]
  - - [1024, 448, 1, 256]
    - [14, 33.079]
  - - [1024, 3584, 1, 256]
    - [14, 66.261]
  - - [2944, 128, 1, 1280]
    - [40, 56.756]
  - - [2048, 32, 1, 2048]
    - [45, 20.095]
  - - [64, 256, 1, 256]
    - [28, 2.148]
  - - [1408, 4, 1, 128]
    - [25, 0.387]
  - - [128, 2368, 1, 128]
    - [20, 17.484]
  - - [256, 704, 1, 1280]
    - [62, 40.61]
  - - [64, 2368, 1, 128]
    - [100, 9.607]
  - - [6784, 6784, 1, 3328]
    - [7, 94.063]
  - - [448, 5888, 1, 1280]
    - [8, 83.149]
  - - [5056, 448, 1, 128]
    - [14, 44.142]
  - - [4288, 704, 1, 1280]
    - [53, 81.031]
  - - [3584, 2944, 1, 128]
    - [13, 59.906]
  - - [6784, 256, 1, 1280]
    - [8, 80.402]
  - - [256, 2944, 1, 1280]
    - [94, 63.84]
  - - [64, 4288, 1, 128]
    - [20, 16.153]
  - - [2368, 5888, 1, 3328]
    - [32, 92.308]
  - - [4, 64, 1, 256]
    - [82, 0.029]
  - - [704, 1024, 1, 3328]
    - [101, 68.866]
  - - [2368, 1856, 1, 1280]
    - [12, 83.921]
  - - [448, 5056, 1, 3328]
    - [36, 79.597]
  - - [128, 448, 1, 128]
    - [4, 4.135]
  - - [128, 6784, 1, 256]
    - [14, 47.48]
  - - [3584, 4288, 1, 128]
    - [35, 60.845]
  - - [64, 448, 1, 128]
    - [52, 1.993]
  - - [5888, 4288, 1, 3328]
    - [16, 92.665]
  - - [2368, 704, 1, 256]
    - [14, 56.401]
  - - [256, 1856, 1, 3328]
    - [68, 57.655]
  - - [1856, 128, 1, 256]
    - [47, 22.465]
  - - [6784, 128, 1, 128]
    - [58, 33.617]
  - - [3584, 1408, 1, 128]
    - [13, 53.707]
  - - [1856, 5056, 1, 1280]
    - [12, 87.294]
  - - [2944, 1024, 1, 1280]
    - [11, 79.661]
  - - [5056, 4, 1, 256]
    - [21, 2.16]
  - - [3584, 5888, 1, 3328]
    - [77, 93.55]
  - - [2368, 4288, 1, 256]
    - [13, 74.902]
  - - [1024, 2368, 1, 3328]
    - [41, 84.458]
  - - [64, 704, 1, 3328]
    - [72, 16.482]
  - - [704, 1408, 1, 256]
    - [14, 48.05]
  - - [4096, 128, 1, 4096]
    - [14, 61.8]
  - - [1024, 3584, 1, 1280]
    - [7, 81.55]
  - - [4288, 5888, 1, 3328]
    - [32, 93.929]
  - - [4288, 4, 1, 1280]
    - [22, 4.055]
  - - [4608, 16, 1, 1536]
    - [29, 17.418]
  - - [5888, 64, 1, 128]
    - [14, 20.127]
  - - [4, 5888, 1, 128]
    - [21, 1.544]
  - - [1024, 2944, 1, 3328]
    - [10, 85.117]
  - - [6784, 1856, 1, 256]
    - [6, 75.305]
  - - [2048, 64, 1, 2048]
    - [44, 32.784]
  - - [256, 6784, 1, 1280]
    - [8, 80.662]
  - - [1856, 3584, 1, 256]
    - [13, 72.194]
  - - [128, 448, 1, 3328]
    - [79, 20.284]
  - - [6784, 1856, 1, 128]
    - [6, 59.583]
  - - [4, 448, 1, 256]
    - [28, 0.227]
  - - [5056, 128, 1, 256]
    - [14, 43.408]
  - - [512, 24000, 1, 2816]
    - [6, 90.759]
  - - [256, 5888, 1, 1280]
    - [36, 77.083]
  - - [4, 128, 1, 1280]
    - [22, 0.153]
  - - [16384, 1600, 1, 4096]
    - [9, 90.473]
  - - [6784, 128, 1, 1280]
    - [102, 74.651]
  - - [64, 1408, 1, 256]
    - [4, 10.829]
  - - [2368, 1408, 1, 128]
    - [14, 50.613]
  - - [1856, 448, 1, 256]
    - [14, 47.256]
  - - [1408, 1024, 1, 128]
    - [14, 39.793]
  - - [128, 64, 1, 128]
    - [22, 0.622]
  - - [6784, 3584, 1, 3328]
    - [6, 93.982]
  - - [1760, 7000, 1, 1760]
    - [6, 91.488]
  - - [2944, 64, 1, 3328]
    - [30, 50.104]
  - - [64, 64, 1, 128]
    - [28, 0.311]
  - - [2368, 5056, 1, 1280]
    - [12, 87.147]
  - - [64, 4, 1, 1280]
    - [25, 0.075]
  - - [1408, 2368, 1, 1280]
    - [41, 82.972]
  - - [128, 1408, 1, 1280]
    - [62, 39.985]
  - - [256, 64, 1, 3328]
    - [22, 6.174]
  - - [704, 4288, 1, 128]
    - [14, 50.475]
  - - [128, 1856, 1, 3328]
    - [20, 44.818]
  - - [2944, 2944, 1, 256]
    - [13, 73.254]
  - - [2944, 4, 1, 1280]
    - [82, 3.16]
  - - [5888, 4, 1, 256]
    - [22, 2.448]
  - - [6784, 256, 1, 256]
    - [6, 56.282]
  - - [256, 5056, 1, 3328]
    - [37, 82.536]
  - - [128, 4288, 1, 1280]
    - [4, 58.415]
  - - [5056, 1856, 1, 128]
    - [35, 57.771]
  - - [5056, 1024, 1, 3328]
    - [6, 88.763]
  - - [128, 128, 1, 256]
    - [28, 2.148]
  - - [1760, 64, 1, 1760]
    - [38, 33.97]
  - - [4288, 3584, 1, 3328]
    - [7, 90.244]
  - - [448, 704, 1, 3328]
    - [60, 59.801]
  - - [448, 448, 1, 128]
    - [4, 12.864]
  - - [1024, 2368, 1, 1280]
    - [36, 81.087]
  - - [1856, 704, 1, 3328]
    - [41, 81.653]
  - - [4, 2368, 1, 128]
    - [4, 0.666]
  - - [5888, 6784, 1, 3328]
    - [6, 92.927]
  - - [704, 4288, 1, 1280]
    - [32, 82.373]
  - - [704, 256, 1, 256]
    - [4, 19.253]
  - - [1024, 48000, 1, 2048]
    - [77, 93.342]
  - - [4288, 1024, 1, 128]
    - [6, 51.482]
  - - [256, 64, 1, 3136]
    - [25, 5.999]
  - - [256, 1024, 1, 196]
    - [20, 17.95]
  - - [1024, 1024, 1, 3328]
    - [41, 77.129]
  - - [2048, 200, 1, 3200]
    - [4, 50.357]
  - - [1024, 200, 1, 13312]
    - [86, 47.11]
  - - [1024, 256, 1, 1536]
    - [4, 45.479]
  - - [4096, 256, 1, 12288]
    - [14, 78.427]
  - - [64, 200, 1, 1024]
    - [24, 3.516]
  - - [32, 512, 1, 1024]
    - [23, 4.448]
  - - [2048, 256, 1, 3328]
    - [60, 62.656]
  - - [4096, 512, 1, 32]
    - [5, 19.512]
  - - [2048, 256, 1, 13312]
    - [41, 64.335]
  - - [4096, 200, 1, 11264]
    - [89, 61.937]
  - - [2048, 512, 1, 1024]
    - [14, 68.735]
  - - [2048, 1024, 1, 1664]
    - [65, 78.281]
  - - [1024, 1024, 1, 64]
    - [4, 22.238]
  - - [512, 1024, 1, 1536]
    - [4, 59.496]
  - - [1024, 256, 1, 15360]
    - [18, 51.875]
  - - [1, 512, 1, 1024]
    - [25, 0.146]
  - - [4096, 512, 1, 1408]
    - [11, 77.009]
  - - [1024, 200, 1, 1408]
    - [86, 38.908]
  - - [1024, 512, 1, 512]
    - [4, 47.071]
  - - [4096, 256, 1, 15360]
    - [89, 78.904]
  - - [2048, 512, 1, 640]
    - [58, 63.537]
  - - [4096, 1024, 1, 1280]
    - [6, 82.689]
  - - [1024, 200, 1, 6144]
    - [86, 46.481]
  - - [1024, 1024, 1, 512]
    - [14, 61.098]
  - - [128, 512, 1, 2048]
    - [57, 21.002]
  - - [2048, 1024, 1, 640]
    - [35, 71.752]
  - - [1024, 256, 1, 3328]
    - [20, 49.455]
  - - [4096, 1024, 1, 13312]
    - [8, 88.538]
  - - [2048, 256, 1, 2048]
    - [41, 59.374]
  - - [2048, 1024, 1, 13312]
    - [12, 83.53]
  - - [2048, 512, 1, 16640]
    - [103, 77.099]
  - - [1024, 512, 1, 128]
    - [14, 25.848]
  - - [2048, 1024, 1, 3584]
    - [12, 81.346]
  - - [2048, 512, 1, 256]
    - [14, 48.977]
  - - [512, 256, 1, 3200]
    - [62, 36.073]
  - - [4096, 1024, 1, 1920]
    - [6, 84.243]
  - - [4096, 200, 1, 2560]
    - [41, 59.969]
  - - [1024, 256, 1, 16384]
    - [18, 51.383]
  - - [1024, 1024, 1, 1152]
    - [36, 71.441]
  - - [2048, 200, 1, 32]
    - [4, 6.712]
  - - [512, 1024, 1, 2816]
    - [4, 63.307]
  - - [4096, 256, 1, 14336]
    - [89, 78.627]
  - - [1024, 200, 1, 4608]
    - [86, 45.245]
  - - [1024, 200, 1, 16384]
    - [86, 45.356]
  - - [64, 256, 1, 1024]
    - [25, 4.638]
  - - [1, 200, 1, 1024]
    - [25, 0.057]
  - - [2048, 200, 1, 2080]
    - [4, 53.032]
  - - [512, 256, 1, 1792]
    - [4, 31.883]
  - - [2048, 200, 1, 1024]
    - [60, 44.792]
  - - [4096, 1024, 1, 12288]
    - [8, 88.427]
  - - [4096, 200, 1, 4096]
    - [41, 60.975]
  - - [1024, 512, 1, 11264]
    - [41, 63.685]
  - - [128, 512, 1, 1024]
    - [4, 17.481]
  - - [32, 256, 1, 2048]
    - [72, 2.739]
  - - [1024, 200, 1, 1792]
    - [86, 41.766]
  - - [1024, 1024, 1, 1792]
    - [36, 73.893]
  - - [32, 256, 1, 512]
    - [25, 1.688]
  - - [512, 200, 1, 2816]
    - [86, 28.878]
  - - [512, 200, 1, 3072]
    - [86, 28.582]
  - - [1024, 1024, 1, 8192]
    - [41, 78.221]
  - - [1024, 256, 1, 12288]
    - [60, 51.497]
  - - [4096, 200, 1, 768]
    - [14, 52.898]
  - - [1024, 512, 1, 16384]
    - [103, 61.545]
  - - [4096, 256, 1, 1024]
    - [41, 69.725]
  - - [1024, 512, 1, 256]
    - [14, 38.043]
  - - [4096, 1024, 1, 8320]
    - [8, 88.124]
  - - [4096, 256, 1, 9216]
    - [41, 80.145]
  - - [1024, 512, 1, 1408]
    - [4, 59.09]
  - - [1024, 512, 1, 5632]
    - [41, 62.592]
  - - [4096, 200, 1, 256]
    - [14, 39.877]
  - - [1024, 200, 1, 128]
    - [100, 11.814]
  - - [256, 200, 1, 1024]
    - [29, 13.899]
  - - [1024, 200, 1, 5120]
    - [86, 45.351]
  - - [512, 1024, 1, 3072]
    - [4, 62.681]
  - - [4096, 1024, 1, 15360]
    - [8, 88.604]
  - - [1, 256, 1, 2048]
    - [25, 0.087]
  - - [1024, 1024, 1, 4160]
    - [41, 78.32]
  - - [1024, 256, 1, 256]
    - [20, 24.194]
  - - [2048, 256, 1, 384]
    - [14, 42.597]
  - - [512, 256, 1, 2560]
    - [49, 34.762]
  - - [4096, 512, 1, 3072]
    - [12, 81.077]
  - - [1024, 256, 1, 4160]
    - [4, 50.928]
  - - [4096, 512, 1, 13312]
    - [12, 83.342]
  - - [4096, 1024, 1, 3840]
    - [8, 86.461]
  - - [4096, 200, 1, 640]
    - [14, 50.922]
  - - [32, 200, 1, 2048]
    - [82, 2.073]
  - - [1024, 200, 1, 512]
    - [60, 27.798]
  - - [1024, 1024, 1, 7168]
    - [41, 78.792]
  - - [2048, 1024, 1, 3200]
    - [10, 80.52]
  - - [512, 512, 1, 1536]
    - [4, 46.173]
  - - [4096, 256, 1, 768]
    - [14, 66.469]
  - - [2048, 256, 1, 6656]
    - [41, 64.348]
  - - [1024, 256, 1, 896]
    - [60, 40.248]
  - - [2048, 200, 1, 3072]
    - [4, 50.451]
  - - [128, 200, 1, 1024]
    - [25, 7.16]
  - - [4096, 512, 1, 3840]
    - [12, 81.482]
  - - [1024, 200, 1, 3200]
    - [86, 44.817]
  - - [4096, 512, 1, 5632]
    - [11, 81.551]
  - - [4096, 512, 1, 64]
    - [5, 29.944]
  - - [1024, 512, 1, 2816]
    - [4, 63.247]
  - - [4096, 256, 1, 7680]
    - [41, 79.903]
  - - [4096, 200, 1, 1024]
    - [14, 55.108]
  - - [1024, 512, 1, 12288]
    - [41, 63.021]
  - - [2048, 1024, 1, 512]
    - [104, 69.426]
  - - [128, 256, 1, 2048]
    - [22, 10.879]
  - - [2048, 200, 1, 1792]
    - [4, 48.149]
  - - [1024, 1024, 1, 2816]
    - [41, 76.521]
  - - [2048, 512, 1, 1536]
    - [26, 72.44]
  - - [4096, 256, 1, 3072]
    - [41, 77.713]
  - - [1024, 200, 1, 1536]
    - [86, 39.162]
  - - [1024, 256, 1, 1024]
    - [20, 41.429]
  - - [4096, 512, 1, 8192]
    - [12, 82.594]
  - - [128, 1024, 1, 512]
    - [62, 21.915]
  - - [4096, 512, 1, 2304]
    - [12, 79.968]
  - - [2048, 256, 1, 5632]
    - [60, 63.762]
  - - [1024, 256, 1, 5120]
    - [60, 51.303]
  - - [1024, 512, 1, 6656]
    - [41, 63.083]
  - - [4096, 512, 1, 2816]
    - [12, 80.382]
  - - [4096, 200, 1, 2080]
    - [60, 64.045]
  - - [1024, 200, 1, 2304]
    - [86, 42.786]
  - - [2048, 200, 1, 13312]
    - [54, 49.712]
  - - [64, 1024, 1, 1024]
    - [57, 16.617]
  - - [4096, 256, 1, 3584]
    - [41, 78.12]
  - - [2048, 1024, 1, 7680]
    - [12, 83.21]
  - - [1024, 256, 1, 1664]
    - [20, 46.146]
  - - [1, 512, 1, 2048]
    - [72, 0.174]
  - - [512, 512, 1, 1024]
    - [4, 42.151]
  - - [2048, 256, 1, 8192]
    - [41, 63.089]
  - - [2048, 512, 1, 512]
    - [14, 60.944]
  - - [4096, 512, 1, 1920]
    - [12, 79.206]
  - - [4096, 200, 1, 12288]
    - [41, 62.017]
  - - [2048, 512, 1, 1152]
    - [89, 69.972]
  - - [1024, 256, 1, 2080]
    - [60, 50.561]
  - - [4096, 1024, 1, 32]
    - [5, 22.57]
  - - [4096, 512, 1, 16640]
    - [18, 83.32]
  - - [2048, 200, 1, 9216]
    - [36, 49.699]
  - - [2048, 200, 1, 2560]
    - [60, 50.165]
  - - [2048, 1024, 1, 1024]
    - [10, 76.687]
  - - [2048, 256, 1, 4608]
    - [60, 64.5]
  - - [512, 200, 1, 768]
    - [4, 20.369]
  - - [128, 256, 1, 512]
    - [25, 6.691]
  - - [4096, 512, 1, 1792]
    - [12, 78.92]
  - - [4096, 1024, 1, 8192]
    - [8, 87.642]
  - - [1024, 256, 1, 2816]
    - [4, 49.286]
  - - [1024, 1024, 1, 13312]
    - [91, 78.31]
  - - [2048, 1024, 1, 4160]
    - [12, 81.654]
  - - [2048, 256, 1, 3584]
    - [4, 63.384]
  - - [128, 200, 1, 2048]
    - [72, 8.592]
  - - [4096, 512, 1, 10240]
    - [12, 82.506]
  - - [4096, 512, 1, 512]
    - [70, 68.541]
  - - [2048, 1024, 1, 6656]
    - [12, 82.652]
  - - [1024, 512, 1, 640]
    - [4, 49.907]
  - - [2048, 512, 1, 768]
    - [26, 65.986]
  - - [2048, 200, 1, 1408]
    - [60, 47.428]
  - - [4096, 200, 1, 2048]
    - [41, 59.628]
  - - [1024, 1024, 1, 5632]
    - [41, 79.186]
  - - [2048, 512, 1, 3584]
    - [26, 76.462]
  - - [64, 200, 1, 512]
    - [25, 2.546]
  - - [1024, 200, 1, 64]
    - [100, 6.869]
  - - [512, 512, 1, 2304]
    - [4, 48.867]
  - - [2048, 1024, 1, 14336]
    - [12, 83.662]
  - - [4096, 512, 1, 11264]
    - [18, 82.442]
  - - [4096, 512, 1, 128]
    - [96, 43.516]
  - - [1024, 512, 1, 64]
    - [4, 16.436]
  - - [4096, 512, 1, 768]
    - [12, 72.152]
  - - [4096, 1024, 1, 11264]
    - [8, 88.178]
  - - [1, 256, 1, 1024]
    - [25, 0.074]
  - - [4096, 200, 1, 7680]
    - [41, 62.479]
  - - [1024, 200, 1, 12288]
    - [86, 46.749]
  - - [1024, 1024, 1, 1280]
    - [36, 72.876]
  - - [4096, 1024, 1, 16640]
    - [8, 88.615]
  - - [2048, 1024, 1, 5632]
    - [96, 81.639]
  - - [1024, 200, 1, 15360]
    - [86, 46.865]
  - - [1, 1024, 1, 1024]
    - [23, 0.283]
  - - [2048, 256, 1, 16384]
    - [41, 60.781]
  - - [4096, 512, 1, 12288]
    - [11, 82.594]
  - - [2048, 200, 1, 896]
    - [60, 43.184]
  - - [4096, 1024, 1, 5632]
    - [8, 87.138]
  - - [2048, 256, 1, 32]
    - [20, 8.13]
  - - [2048, 256, 1, 1280]
    - [4, 57.606]
  - - [4096, 256, 1, 4096]
    - [41, 78.047]
  - - [2048, 256, 1, 11264]
    - [41, 63.777]
  - - [4096, 200, 1, 9216]
    - [41, 62.223]
  - - [1024, 512, 1, 4096]
    - [4, 62.158]
  - - [2048, 1024, 1, 10240]
    - [12, 83.236]
  - - [4096, 1024, 1, 640]
    - [14, 77.399]
  - - [128, 1024, 1, 2048]
    - [49, 33.234]
  - - [4096, 200, 1, 3840]
    - [41, 61.664]
  - - [1024, 1024, 1, 1920]
    - [87, 75.108]
  - - [2048, 200, 1, 7168]
    - [89, 49.334]
  - - [2048, 512, 1, 16384]
    - [103, 75.008]
  - - [2048, 1024, 1, 12288]
    - [96, 82.77]
  - - [4096, 1024, 1, 10240]
    - [8, 88.202]
  - - [1024, 1024, 1, 8320]
    - [36, 79.028]
  - - [1024, 256, 1, 9216]
    - [4, 51.6]
  - - [4096, 256, 1, 1152]
    - [14, 70.334]
  - - [512, 200, 1, 2560]
    - [49, 28.062]
  - - [2048, 256, 1, 1920]
    - [4, 60.326]
  - - [2048, 1024, 1, 4608]
    - [12, 81.77]
  - - [512, 256, 1, 1024]
    - [49, 28.397]
  - - [1024, 256, 1, 1920]
    - [4, 47.255]
  - - [4096, 512, 1, 3584]
    - [12, 81.327]
  - - [2048, 512, 1, 4160]
    - [41, 77.7]
  - - [2048, 512, 1, 5632]
    - [89, 77.389]
  - - [4096, 1024, 1, 4608]
    - [8, 86.979]
  - - [4096, 1024, 1, 3328]
    - [6, 85.785]
  - - [4096, 256, 1, 7168]
    - [41, 79.719]
  - - [4096, 200, 1, 128]
    - [4, 28.815]
  - - [2048, 200, 1, 5120]
    - [4, 50.812]
  - - [1024, 1024, 1, 6656]
    - [41, 79.147]
  - - [512, 1024, 1, 3200]
    - [4, 62.902]
  - - [512, 200, 1, 2304]
    - [86, 27.545]
  - - [2048, 1024, 1, 9216]
    - [12, 83.374]
  - - [2048, 256, 1, 1536]
    - [4, 60.286]
  - - [4096, 256, 1, 256]
    - [14, 49.177]
  - - [2048, 512, 1, 1408]
    - [26, 71.621]
  - - [1024, 256, 1, 384]
    - [20, 31.071]
  - - [2048, 1024, 1, 2304]
    - [12, 79.821]
  - - [4096, 512, 1, 6144]
    - [12, 82.588]
  - - [1024, 200, 1, 14336]
    - [86, 46.459]
  - - [1024, 512, 1, 2080]
    - [4, 66.593]
  - - [2048, 512, 1, 2304]
    - [26, 74.778]
  - - [4096, 512, 1, 15360]
    - [12, 83.373]
  - - [1024, 256, 1, 32]
    - [100, 4.555]
  - - [1024, 200, 1, 2816]
    - [86, 44.201]
  - - [4096, 200, 1, 512]
    - [4, 48.592]
  - - [4096, 1024, 1, 7168]
    - [8, 87.77]
  - - [2048, 256, 1, 14336]
    - [91, 63.539]
  - - [1024, 200, 1, 3072]
    - [86, 44.722]
  - - [2048, 200, 1, 1280]
    - [60, 46.88]
  - - [1024, 1024, 1, 2304]
    - [41, 75.978]
  - - [4096, 1024, 1, 9216]
    - [8, 88.119]
  - - [2048, 512, 1, 4608]
    - [89, 76.917]
  - - [4096, 1024, 1, 7680]
    - [8, 87.832]
  - - [4096, 256, 1, 6144]
    - [41, 78.512]
  - - [4096, 256, 1, 896]
    - [14, 68.513]
  - - [512, 256, 1, 1536]
    - [62, 32.06]
  - - [1024, 256, 1, 512]
    - [60, 33.604]
  - - [2048, 256, 1, 640]
    - [4, 50.072]
  - - [256, 256, 1, 2048]
    - [60, 20.644]
  - - [2048, 1024, 1, 8192]
    - [65, 82.234]
  - - [4096, 200, 1, 16640]
    - [89, 61.834]
  - - [256, 512, 1, 512]
    - [44, 21.602]
  - - [2048, 512, 1, 384]
    - [14, 55.835]
  - - [2048, 200, 1, 16384]
    - [103, 47.255]
  - - [4096, 200, 1, 10240]
    - [41, 62.414]
  - - [1024, 512, 1, 9216]
    - [41, 63.19]
  - - [4096, 1024, 1, 64]
    - [26, 36.111]
  - - [4096, 200, 1, 1920]
    - [41, 58.922]
  - - [2048, 1024, 1, 1280]
    - [11, 77.004]
  - - [1024, 200, 1, 3840]
    - [86, 45.496]
  - - [256, 1024, 1, 512]
    - [20, 34.368]
  - - [2048, 1024, 1, 3328]
    - [35, 80.69]
  - - [1024, 256, 1, 16640]
    - [18, 52.02]
  - - [4096, 512, 1, 14336]
    - [12, 83.011]
  - - [1024, 1024, 1, 16640]
    - [105, 77.77]
  - - [1024, 256, 1, 1152]
    - [4, 43.205]
  - - [4096, 512, 1, 8320]
    - [12, 82.554]
  - - [2048, 512, 1, 7680]
    - [41, 78.656]
  - - [4096, 1024, 1, 6656]
    - [8, 87.686]
  - - [1024, 512, 1, 3584]
    - [4, 63.432]
  - - [1024, 1024, 1, 32]
    - [5, 12.815]
  - - [512, 512, 1, 2816]
    - [4, 50.254]
  - - [2048, 512, 1, 1664]
    - [89, 72.539]
  - - [1024, 1024, 1, 14336]
    - [54, 77.743]
  - - [2048, 200, 1, 2048]
    - [4, 48.592]
  - - [1024, 1024, 1, 3584]
    - [41, 77.654]
  - - [512, 200, 1, 1280]
    - [86, 24.819]
  - - [4096, 256, 1, 6656]
    - [41, 78.949]
  - - [4096, 256, 1, 4160]
    - [41, 78.382]
  - - [128, 256, 1, 1024]
    - [23, 9.334]
  - - [512, 200, 1, 3200]
    - [49, 28.842]
  - - [2048, 512, 1, 9216]
    - [41, 79.068]
  - - [2048, 1024, 1, 256]
    - [14, 59.446]
  - - [1024, 256, 1, 2304]
    - [4, 47.586]
  - - [1024, 200, 1, 8192]
    - [86, 46.187]
  - - [2048, 256, 1, 3072]
    - [60, 62.358]
  - - [2048, 256, 1, 8320]
    - [41, 64.096]
  - - [4096, 512, 1, 1024]
    - [11, 75.198]
  - - [1024, 512, 1, 3200]
    - [60, 63.007]
  - - [1024, 512, 1, 896]
    - [4, 54.988]
  - - [2048, 512, 1, 1280]
    - [89, 70.662]
  - - [4096, 200, 1, 64]
    - [4, 19.054]
  - - [1024, 256, 1, 6144]
    - [20, 51.08]
  - - [1024, 200, 1, 2560]
    - [86, 43.513]
  - - [1024, 1024, 1, 5120]
    - [41, 78.733]
  - - [2048, 512, 1, 6656]
    - [41, 78.028]
  - - [4096, 1024, 1, 1536]
    - [6, 83.55]
  - - [1024, 1024, 1, 128]
    - [4, 33.982]
  - - [512, 1024, 1, 1792]
    - [4, 61.01]
  - - [2048, 1024, 1, 32]
    - [5, 18.554]
  - - [4096, 256, 1, 2816]
    - [41, 77.008]
  - - [1024, 1024, 1, 15360]
    - [48, 77.374]
  - - [1024, 256, 1, 5632]
    - [60, 51.658]
  - - [1024, 1024, 1, 4096]
    - [41, 77.859]
  - - [2048, 200, 1, 4160]
    - [60, 51.159]
  - - [512, 256, 1, 768]
    - [62, 24.926]
  - - [4096, 512, 1, 640]
    - [65, 70.497]
  - - [2048, 512, 1, 8192]
    - [103, 76.024]
  - - [1024, 512, 1, 768]
    - [4, 52.904]
  - - [4096, 200, 1, 8320]
    - [41, 62.495]
  - - [2048, 512, 1, 896]
    - [26, 67.102]
  - - [4096, 200, 1, 7168]
    - [14, 61.513]
  - - [2048, 512, 1, 13312]
    - [54, 77.319]
  - - [2048, 200, 1, 3840]
    - [4, 51.216]
  - - [1024, 1024, 1, 768]
    - [26, 66.347]
  - - [4096, 512, 1, 16384]
    - [12, 82.444]
  - - [4096, 256, 1, 2304]
    - [41, 76.458]
  - - [1, 256, 1, 4096]
    - [72, 0.098]
  - - [1024, 1024, 1, 11264]
    - [54, 77.221]
  - - [2048, 200, 1, 16640]
    - [89, 50.01]
  - - [1024, 256, 1, 3072]
    - [20, 49.715]
  - - [4096, 1024, 1, 512]
    - [6, 75.373]
  - - [2048, 256, 1, 2816]
    - [4, 62.769]
  - - [32, 512, 1, 512]
    - [28, 3.259]
  - - [256, 512, 1, 2048]
    - [49, 33.982]
  - - [1024, 512, 1, 384]
    - [14, 42.798]
  - - [2048, 200, 1, 7680]
    - [41, 49.988]
  - - [1024, 512, 1, 4608]
    - [87, 61.862]
  - - [4096, 200, 1, 32]
    - [4, 10.363]
  - - [4096, 200, 1, 3328]
    - [41, 60.914]
  - - [1024, 200, 1, 1152]
    - [86, 37.438]
  - - [1024, 1024, 1, 1408]
    - [36, 72.956]
  - - [2048, 200, 1, 15360]
    - [91, 49.874]
  - - [512, 1024, 1, 2048]
    - [4, 59.74]
  - - [1024, 200, 1, 10240]
    - [86, 46.216]
  - - [4096, 256, 1, 5632]
    - [41, 79.044]
  - - [512, 512, 1, 3072]
    - [4, 50.688]
  - - [2048, 256, 1, 1408]
    - [4, 58.262]
  - - [2048, 256, 1, 6144]
    - [41, 63.282]
  - - [4096, 256, 1, 3328]
    - [41, 77.701]
  - - [1024, 200, 1, 1664]
    - [86, 40.629]
  - - [2048, 1024, 1, 1152]
    - [13, 76.084]
  - - [2048, 512, 1, 6144]
    - [41, 77.901]
  - - [2048, 512, 1, 3200]
    - [41, 75.646]
  - - [4096, 1024, 1, 2080]
    - [41, 87.623]
  - - [4096, 1024, 1, 768]
    - [6, 79.111]
  - - [4096, 1024, 1, 2560]
    - [6, 85.358]
  - - [64, 200, 1, 2048]
    - [72, 4.189]
  - - [2048, 200, 1, 4608]
    - [60, 50.691]
  - - [1024, 1024, 1, 6144]
    - [41, 78.639]
  - - [4096, 256, 1, 1664]
    - [41, 74.252]
  - - [2048, 200, 1, 384]
    - [20, 34.243]
  - - [1, 200, 1, 2048]
    - [22, 0.069]
  - - [4096, 256, 1, 1792]
    - [41, 74.478]
  - - [2048, 1024, 1, 64]
    - [5, 30.549]
  - - [4096, 1024, 1, 16384]
    - [106, 87.677]
  - - [1024, 512, 1, 16640]
    - [103, 62.676]
  - - [2048, 512, 1, 10240]
    - [41, 78.644]
  - - [4096, 512, 1, 6656]
    - [11, 81.888]
  - - [2048, 256, 1, 16640]
    - [54, 63.149]
  - - [2048, 512, 1, 2816]
    - [26, 75.48]
  - - [1024, 200, 1, 32]
    - [4, 3.836]
  - - [1, 512, 1, 4096]
    - [29, 0.196]
  - - [256, 256, 1, 1024]
    - [38, 17.184]
  - - [2048, 1024, 1, 128]
    - [26, 44.805]
  - - [2048, 1024, 1, 2080]
    - [41, 81.773]
  - - [2048, 1024, 1, 16640]
    - [18, 83.28]
  - - [1024, 200, 1, 384]
    - [86, 25.136]
  - - [4096, 256, 1, 384]
    - [14, 56.529]
  - - [4096, 256, 1, 13312]
    - [89, 78.86]
  - - [2048, 256, 1, 128]
    - [58, 24.79]
  - - [512, 256, 1, 2304]
    - [49, 34.024]
  - - [2048, 1024, 1, 3072]
    - [10, 80.919]
  - - [1024, 1024, 1, 640]
    - [14, 64.347]
  - - [256, 512, 1, 1024]
    - [44, 28.398]
  - - [4096, 1024, 1, 1408]
    - [14, 82.678]
  - - [4096, 200, 1, 5632]
    - [41, 61.37]
  - - [4096, 1024, 1, 2048]
    - [6, 84.782]
  - - [2048, 1024, 1, 2560]
    - [65, 79.983]
  - - [4096, 1024, 1, 128]
    - [6, 52.144]
  - - [1024, 200, 1, 3328]
    - [86, 45.573]
  - - [2048, 200, 1, 1152]
    - [4, 46.634]
  - - [1024, 200, 1, 9216]
    - [86, 46.608]
  - - [4096, 256, 1, 512]
    - [14, 61.721]
  - - [4096, 1024, 1, 14336]
    - [8, 88.591]
  - - [1024, 1024, 1, 384]
    - [14, 57.424]
  - - [2048, 200, 1, 512]
    - [60, 38.419]
  - - [2048, 256, 1, 9216]
    - [91, 63.745]
  - - [2048, 256, 1, 1792]
    - [4, 60.143]
  - - [4096, 512, 1, 9216]
    - [12, 82.898]
  - - [4096, 200, 1, 15360]
    - [89, 62.103]
  - - [64, 256, 1, 2048]
    - [29, 5.459]
  - - [4096, 200, 1, 1792]
    - [41, 58.443]
  - - [1, 200, 1, 4096]
    - [24, 0.076]
  - - [2048, 1024, 1, 2048]
    - [10, 80.381]
  - - [1024, 200, 1, 2080]
    - [86, 43.044]
  - - [2048, 200, 1, 1536]
    - [4, 47.255]
  - - [1024, 1024, 1, 3072]
    - [41, 77.589]
  - - [512, 200, 1, 1792]
    - [62, 26.591]
  - - [1024, 256, 1, 11264]
    - [4, 51.981]
  - - [2048, 512, 1, 12288]
    - [41, 78.226]
  - - [1024, 256, 1, 1792]
    - [60, 46.325]
  - - [1024, 200, 1, 7168]
    - [86, 47.836]
  - - [32, 256, 1, 1024]
    - [25, 2.319]
  - - [512, 256, 1, 3072]
    - [49, 36.292]
  - - [1024, 1024, 1, 2080]
    - [36, 77.885]
  - - [2048, 200, 1, 2304]
    - [4, 49.801]
  - - [4096, 512, 1, 1536]
    - [12, 78.682]
  - - [2048, 256, 1, 7168]
    - [41, 63.887]
  - - [2048, 512, 1, 1792]
    - [26, 72.876]
  - - [1024, 200, 1, 2048]
    - [86, 41.362]
  - - [1024, 1024, 1, 4608]
    - [36, 78.216]
  - - [4096, 256, 1, 8192]
    - [41, 78.939]
  - - [512, 1024, 1, 1280]
    - [4, 58.954]
  - - [2048, 1024, 1, 16384]
    - [18, 81.148]
  - - [512, 512, 1, 1280]
    - [4, 44.872]
  - - [1024, 200, 1, 1280]
    - [86, 37.865]
  - - [2048, 256, 1, 3200]
    - [4, 63.218]
  - - [2048, 512, 1, 15360]
    - [103, 77.209]
  - - [1024, 512, 1, 3328]
    - [4, 63.26]
  - - [1024, 512, 1, 4160]
    - [87, 62.328]
  - - [4096, 200, 1, 6656]
    - [41, 62.021]
  - - [4096, 1024, 1, 1024]
    - [6, 81.532]
  - - [2048, 200, 1, 3328]
    - [60, 51.066]
  - - [1024, 1024, 1, 256]
    - [89, 48.197]
  - - [512, 200, 1, 512]
    - [4, 18.317]
  - - [2048, 256, 1, 64]
    - [74, 15.274]
  - - [1024, 256, 1, 2560]
    - [4, 48.858]
  - - [2048, 512, 1, 11264]
    - [41, 76.511]
  - - [32, 200, 1, 1024]
    - [25, 1.79]
  - - [32, 512, 1, 2048]
    - [57, 5.251]
  - - [2048, 256, 1, 2304]
    - [60, 61.721]
  - - [2048, 256, 1, 12288]
    - [54, 63.434]
  - - [4096, 200, 1, 8192]
    - [41, 62.435]
  - - [1024, 512, 1, 7168]
    - [87, 62.473]
  - - [1024, 512, 1, 1792]
    - [4, 60.228]
  - - [4096, 1024, 1, 1664]
    - [14, 83.452]
  - - [4096, 200, 1, 2816]
    - [41, 60.094]
  - - [1024, 1024, 1, 896]
    - [36, 69.297]
  - - [1024, 200, 1, 8320]
    - [86, 46.567]
  - - [1024, 1024, 1, 12288]
    - [41, 78.565]
  - - [1024, 256, 1, 8320]
    - [60, 51.896]
  - - [1024, 200, 1, 1024]
    - [86, 35.397]
  - - [1024, 200, 1, 16640]
    - [86, 46.838]
  - - [4096, 256, 1, 5120]
    - [41, 79.171]
  - - [1024, 256, 1, 3200]
    - [4, 49.94]
  - - [512, 512, 1, 2560]
    - [4, 49.337]
  - - [4096, 256, 1, 2048]
    - [41, 74.964]
  - - [1024, 256, 1, 640]
    - [20, 37.43]
  - - [2048, 256, 1, 5120]
    - [60, 63.637]
  - - [2048, 256, 1, 7680]
    - [41, 64.234]
  - - [4096, 512, 1, 384]
    - [34, 65.156]
  - - [2048, 200, 1, 3584]
    - [60, 51.087]
  - - [1024, 512, 1, 1536]
    - [4, 59.496]
  - - [4096, 512, 1, 3328]
    - [12, 80.773]
  - - [4096, 1024, 1, 256]
    - [70, 66.287]
  - - [2048, 200, 1, 64]
    - [4, 12.703]
  - - [2048, 200, 1, 4096]
    - [4, 49.841]
  - - [1024, 1024, 1, 1536]
    - [36, 73.839]
  - - [2048, 1024, 1, 7168]
    - [12, 82.737]
  - - [1024, 256, 1, 3584]
    - [4, 50.346]
  - - [4096, 256, 1, 32]
    - [5, 13.502]
  - - [4096, 256, 1, 1280]
    - [41, 72.353]
  - - [512, 512, 1, 3200]
    - [4, 50.812]
  - - [2048, 1024, 1, 1536]
    - [35, 77.755]
  - - [2048, 256, 1, 1024]
    - [41, 54.616]
  - - [128, 200, 1, 512]
    - [22, 5.006]
  - - [4096, 512, 1, 7168]
    - [12, 82.697]
  - - [1024, 512, 1, 1152]
    - [4, 57.303]
  - - [64, 1024, 1, 2048]
    - [62, 20.029]
  - - [2048, 512, 1, 3328]
    - [26, 76.343]
  - - [4096, 1024, 1, 896]
    - [14, 80.842]
  - - [1, 1024, 1, 2048]
    - [25, 0.35]
  - - [4096, 200, 1, 3584]
    - [41, 61.059]
  - - [4096, 1024, 1, 4096]
    - [8, 86.807]
  - - [1024, 256, 1, 14336]
    - [18, 51.152]
  - - [2048, 200, 1, 256]
    - [14, 28.467]
  - - [4096, 256, 1, 16384]
    - [30, 73.213]
  - - [4096, 256, 1, 1920]
    - [41, 75.609]
  - - [32, 1024, 1, 512]
    - [21, 6.198]
  - - [1024, 256, 1, 7680]
    - [60, 51.994]
  - - [2048, 256, 1, 1664]
    - [60, 59.39]
  - - [512, 200, 1, 1536]
    - [85, 29.658]
  - - [2048, 1024, 1, 6144]
    - [12, 82.599]
  - - [512, 256, 1, 2816]
    - [49, 35.543]
  - - [4096, 512, 1, 4160]
    - [12, 81.417]
  - - [4096, 512, 1, 2080]
    - [12, 80.998]
  - - [2048, 256, 1, 15360]
    - [91, 63.849]
  - - [4096, 200, 1, 5120]
    - [41, 61.631]
  - - [1024, 512, 1, 8192]
    - [89, 62.458]
  - - [4096, 200, 1, 896]
    - [14, 54.05]
  - - [2048, 512, 1, 8320]
    - [41, 78.117]
  - - [1024, 1024, 1, 10240]
    - [36, 78.351]
  - - [1024, 200, 1, 768]
    - [86, 33.278]
  - - [2048, 200, 1, 640]
    - [4, 39.644]
  - - [512, 200, 1, 2048]
    - [49, 27.081]
  - - [1024, 1024, 1, 9216]
    - [41, 79.821]
  - - [4096, 200, 1, 1408]
    - [4, 57.692]
  - - [1024, 256, 1, 13312]
    - [18, 51.647]
  - - [1024, 256, 1, 128]
    - [4, 14.972]
  - - [2048, 200, 1, 5632]
    - [4, 50.393]
  - - [64, 1024, 1, 512]
    - [38, 12.098]
  - - [1024, 512, 1, 2560]
    - [4, 63.007]
  - - [4096, 200, 1, 1280]
    - [4, 57.21]
  - - [1024, 200, 1, 4096]
    - [86, 45.438]
  - - [1024, 1024, 1, 2560]
    - [41, 75.751]
  - - [2048, 512, 1, 64]
    - [5, 23.086]
  - - [2048, 200, 1, 8192]
    - [14, 49.144]
  - - [2048, 512, 1, 3072]
    - [41, 76.004]
  - - [4096, 1024, 1, 5120]
    - [8, 87.133]
  - - [4096, 256, 1, 640]
    - [41, 63.671]
  - - [1024, 256, 1, 1280]
    - [4, 44.607]
  - - [2048, 1024, 1, 1920]
    - [96, 79.414]
  - - [2048, 256, 1, 4096]
    - [14, 62.278]
  - - [2048, 1024, 1, 15360]
    - [12, 83.579]
  - - [4096, 200, 1, 16384]
    - [30, 58.845]
  - - [1, 1024, 1, 4096]
    - [28, 0.385]
  - - [4096, 1024, 1, 2816]
    - [6, 85.618]
  - - [4096, 200, 1, 1664]
    - [41, 58.395]
  - - [4096, 512, 1, 256]
    - [34, 59.012]
  - - [1024, 200, 1, 896]
    - [86, 35.8]
  - - [2048, 200, 1, 6656]
    - [60, 50.333]
  - - [2048, 1024, 1, 5120]
    - [12, 81.601]
  - - [512, 1024, 1, 768]
    - [4, 53.371]
  - - [2048, 512, 1, 14336]
    - [54, 77.036]
  - - [2048, 200, 1, 8320]
    - [14, 49.399]
  - - [4096, 256, 1, 3840]
    - [41, 78.827]
  - - [2048, 1024, 1, 4096]
    - [96, 81.412]
  - - [1024, 1024, 1, 3200]
    - [87, 77.428]
  - - [1024, 256, 1, 4608]
    - [4, 51.02]
  - - [4096, 512, 1, 4608]
    - [12, 81.939]
  - - [4096, 512, 1, 1664]
    - [107, 78.359]
  - - [4096, 256, 1, 4608]
    - [41, 79.097]
  - - [1024, 512, 1, 32]
    - [4, 8.218]
  - - [1024, 512, 1, 3840]
    - [4, 63.849]
  - - [2048, 512, 1, 1920]
    - [26, 74.065]
  - - [2048, 1024, 1, 896]
    - [35, 74.741]
  - - [4096, 200, 1, 6144]
    - [41, 61.805]
  - - [1024, 512, 1, 13312]
    - [41, 63.362]
  - - [4096, 1024, 1, 4160]
    - [8, 86.772]
  - - [2048, 200, 1, 2816]
    - [4, 50.812]
  - - [1024, 1024, 1, 3840]
    - [41, 78.418]
  - - [128, 1024, 1, 1024]
    - [62, 28.803]
  - - [2048, 1024, 1, 11264]
    - [18, 82.801]
  - - [2048, 1024, 1, 384]
    - [13, 65.746]
  - - [1024, 256, 1, 2048]
    - [20, 47.071]
  - - [2048, 1024, 1, 3840]
    - [12, 82.034]
  - - [4096, 256, 1, 8320]
    - [41, 79.977]
  - - [2048, 256, 1, 3840]
    - [4, 63.537]
  - - [64, 256, 1, 512]
    - [22, 3.375]
  - - [4096, 512, 1, 1280]
    - [11, 76.76]
  - - [512, 256, 1, 1280]
    - [44, 29.885]
  - - [1024, 512, 1, 7680]
    - [41, 63.16]
  - - [4096, 1024, 1, 1152]
    - [14, 82.171]
  - - [256, 200, 1, 512]
    - [25, 9.927]
  - - [256, 1024, 1, 2048]
    - [4, 47.722]
  - - [2048, 200, 1, 10240]
    - [89, 49.979]
  - - [2048, 512, 1, 5120]
    - [41, 77.746]
  - - [2048, 1024, 1, 1408]
    - [96, 77.638]
  - - [512, 1024, 1, 512]
    - [58, 46.529]
  - - [1024, 200, 1, 11264]
    - [86, 47.493]
  - - [2048, 512, 1, 32]
    - [5, 13.624]
  - - [4096, 256, 1, 2560]
    - [41, 76.711]
  - - [4096, 256, 1, 64]
    - [5, 22.57]
  - - [32, 1024, 1, 1024]
    - [4, 8.543]
  - - [2048, 200, 1, 768]
    - [4, 42.701]
  - - [512, 512, 1, 2048]
    - [4, 47.441]
  - - [2048, 512, 1, 2560]
    - [89, 74.999]
  - - [512, 256, 1, 512]
    - [62, 21.916]
  - - [1024, 200, 1, 7680]
    - [86, 46.542]
  - - [4096, 512, 1, 896]
    - [15, 73.572]
  - - [4096, 1024, 1, 3072]
    - [8, 85.911]
  - - [4096, 200, 1, 13312]
    - [41, 62.47]
  - - [2048, 512, 1, 7168]
    - [41, 77.94]
  - - [2048, 1024, 1, 2816]
    - [35, 80.406]
  - - [2048, 512, 1, 128]
    - [26, 35.166]
  - - [1024, 256, 1, 8192]
    - [20, 51.233]
  - - [4096, 1024, 1, 1792]
    - [6, 84.093]
  - - [1024, 200, 1, 6656]
    - [86, 47.548]
  - - [4096, 200, 1, 2304]
    - [41, 59.649]
  - - [4096, 512, 1, 1152]
    - [12, 75.766]
  - - [512, 200, 1, 1024]
    - [86, 22.94]
  - - [1024, 256, 1, 3840]
    - [4, 50.801]
  - - [512, 512, 1, 768]
    - [20, 38.774]
  - - [2048, 512, 1, 4096]
    - [41, 76.687]
  - - [2048, 256, 1, 2560]
    - [4, 62.681]
  - - [2048, 256, 1, 4160]
    - [60, 63.578]
  - - [1024, 256, 1, 64]
    - [4, 9.109]
  - - [4096, 512, 1, 7680]
    - [12, 82.774]
  - - [1024, 512, 1, 1664]
    - [4, 60.301]
  - - [2048, 512, 1, 2080]
    - [41, 76.971]
  - - [2048, 512, 1, 3840]
    - [41, 76.695]
  - - [4096, 1024, 1, 384]
    - [14, 71.865]
  - - [4096, 200, 1, 3072]
    - [41, 60.811]
  - - [1024, 512, 1, 14336]
    - [91, 62.588]
  - - [1024, 200, 1, 1920]
    - [86, 42.092]
  - - [1024, 1024, 1, 1664]
    - [36, 74.112]
  - - [512, 1024, 1, 2304]
    - [4, 63.08]
  - - [2048, 1024, 1, 1792]
    - [96, 78.957]
  - - [32, 200, 1, 512]
    - [85, 1.262]
  - - [4096, 256, 1, 11264]
    - [89, 78.289]
  - - [4096, 256, 1, 1408]
    - [41, 72.716]
  - - [1024, 256, 1, 7168]
    - [60, 51.635]
  - - [2048, 256, 1, 1152]
    - [4, 56.471]
  - - [256, 256, 1, 512]
    - [25, 12.707]
  - - [1024, 512, 1, 1280]
    - [4, 57.497]
  - - [512, 512, 1, 1792]
    - [20, 47.15]
  - - [2048, 200, 1, 12288]
    - [91, 49.364]
  - - [2048, 200, 1, 1664]
    - [60, 47.769]
  - - [4096, 200, 1, 4608]
    - [41, 62.064]
  - - [512, 1024, 1, 2560]
    - [4, 62.681]
  - - [4096, 200, 1, 384]
    - [14, 45.584]
  - - [128, 512, 1, 512]
    - [4, 12.498]
  - - [1024, 200, 1, 256]
    - [4, 19.527]
  - - [256, 1024, 1, 1024]
    - [20, 43.051]
  - - [2048, 200, 1, 128]
    - [60, 20.545]
  - - [2048, 200, 1, 11264]
    - [54, 49.695]
  - - [1024, 512, 1, 1920]
    - [4, 60.893]
  - - [4096, 256, 1, 1536]
    - [41, 73.243]
  - - [4096, 1024, 1, 3584]
    - [8, 86.388]
  - - [2048, 256, 1, 256]
    - [14, 36.22]
  - - [2048, 1024, 1, 768]
    - [70, 73.243]
  - - [4096, 256, 1, 10240]
    - [14, 78.939]
  - - [2048, 256, 1, 10240]
    - [41, 64.041]
  - - [4096, 200, 1, 14336]
    - [89, 61.815]
  - - [1024, 512, 1, 5120]
    - [4, 63.337]
  - - [1024, 512, 1, 8320]
    - [41, 63.393]
  - - [256, 200, 1, 2048]
    - [21, 16.351]
  - - [1024, 200, 1, 640]
    - [86, 30.606]
  - - [1024, 512, 1, 10240]
    - [41, 63.254]
  - - [1024, 200, 1, 4160]
    - [86, 46.203]
  - - [1024, 200, 1, 5632]
    - [86, 45.319]
  - - [1024, 1024, 1, 2048]
    - [41, 74.906]
  - - [1024, 256, 1, 6656]
    - [60, 51.36]
  - - [2048, 1024, 1, 8320]
    - [12, 82.981]
  - - [1024, 256, 1, 10240]
    - [4, 51.478]
  - - [2048, 256, 1, 2080]
    - [4, 64.411]
  - - [4096, 256, 1, 128]
    - [14, 34.367]
  - - [1024, 256, 1, 768]
    - [20, 38.94]
  - - [2048, 256, 1, 896]
    - [4, 54.284]
  - - [64, 512, 1, 2048]
    - [82, 10.465]
  - - [4096, 512, 1, 2048]
    - [12, 79.95]
  - - [512, 256, 1, 2048]
    - [64, 33.697]
  - - [4096, 256, 1, 16640]
    - [89, 78.609]
  - - [4096, 512, 1, 2560]
    - [12, 79.983]
  - - [1024, 512, 1, 15360]
    - [105, 62.572]
  - - [4096, 1024, 1, 2304]
    - [6, 84.795]
  - - [4096, 200, 1, 1152]
    - [4, 56.481]
  - - [2048, 200, 1, 6144]
    - [4, 50.294]
  - - [1024, 1024, 1, 7680]
    - [41, 79.258]
  - - [2048, 200, 1, 1920]
    - [4, 49.708]
  - - [32, 1024, 1, 2048]
    - [57, 9.982]
  - - [1024, 200, 1, 3584]
    - [86, 45.5]
  - - [4096, 256, 1, 2080]
    - [41, 77.824]
  - - [1024, 1024, 1, 16384]
    - [108, 72.698]
  - - [1024, 256, 1, 1408]
    - [4, 44.715]
  - - [1024, 256, 1, 4096]
    - [20, 49.027]
  - - [2048, 200, 1, 14336]
    - [89, 49.659]
  - - [4096, 512, 1, 5120]
    - [12, 81.905]
  - - [1024, 512, 1, 6144]
    - [41, 62.304]
  - - [1024, 512, 1, 2304]
    - [4, 61.932]
  - - [4096, 200, 1, 4160]
    - [41, 61.334]
  - - [4096, 200, 1, 1536]
    - [41, 58.161]
  - - [4096, 1024, 1, 6144]
    - [8, 87.636]
  - - [256, 64, 1, 1225]
    - [72, 4.434]
  - - [2048, 320, 1, 64]
    - [60, 17.665]
  - - [1024, 128, 1, 289]
    - [45, 13.656]
  - - [384, 64, 1, 1225]
    - [28, 6.651]
  - - [2048, 384, 1, 64]
    - [5, 20.074]
  - - [64, 80, 1, 5329]
    - [72, 1.909]
  - - [1024, 384, 1, 289]
    - [5, 30.125]
  - - [2048, 448, 1, 64]
    - [4, 20.514]
  - - [768, 192, 1, 289]
    - [109, 15.004]
  - - [288, 64, 1, 1225]
    - [22, 4.988]
  - - [384, 96, 1, 1225]
    - [21, 9.784]
  - - [1024, 3392, 1, 4096]
    - [8, 88.607]
  - - [1024, 3301, 1, 4096]
    - [110, 85.768]
  - - [1024, 3443, 1, 4096]
    - [8, 90.264]
  - - [132, 134, 480, 64]
    - [111, 23.015]
  - - [162, 162, 400, 64]
    - [5, 26.079]
  - - [4096, 3548, 1, 1024]
    - [7, 87.552]
  - - [4096, 2977, 1, 1024]
    - [6, 86.692]
  - - [132, 135, 480, 64]
    - [111, 23.165]
  - - [1024, 2985, 1, 4096]
    - [12, 86.751]
  - - [33708, 3681, 1, 1024]
    - [9, 91.92]
  - - [4096, 3443, 1, 1024]
    - [6, 87.898]
  - - [11, 11, 5456, 64]
    - [66, 6.455]
  - - [1024, 3400, 1, 4096]
    - [8, 89.161]
  - - [4096, 3995, 1, 1024]
    - [7, 87.431]
  - - [4096, 3190, 1, 1024]
    - [6, 86.685]
  - - [4096, 3594, 1, 1024]
    - [7, 88.653]
  - - [159, 162, 400, 64]
    - [5, 25.662]
  - - [1024, 3565, 1, 4096]
    - [7, 85.148]
  - - [4096, 3422, 1, 1024]
    - [6, 87.504]
  - - [1024, 3214, 1, 4096]
    - [41, 85.313]
  - - [33708, 3584, 1, 1024]
    - [9, 92.001]
  - - [33708, 3640, 1, 1024]
    - [9, 93.222]
  - - [4096, 3263, 1, 1024]
    - [6, 87.623]
  - - [4096, 3296, 1, 1024]
    - [7, 87.184]
  - - [1024, 3557, 1, 4096]
    - [7, 85.097]
  - - [4096, 3463, 1, 1024]
    - [6, 88.721]
  - - [4096, 3528, 1, 1024]
    - [7, 87.024]
  - - [14, 14, 4368, 64]
    - [100, 8.096]
  - - [4096, 3226, 1, 1024]
    - [6, 87.374]
  - - [4096, 3439, 1, 1024]
    - [6, 87.784]
  - - [1024, 3523, 1, 4096]
    - [7, 84.113]
  - - [1024, 3098, 1, 4096]
    - [41, 82.153]
  - - [4096, 3121, 1, 1024]
    - [7, 88.606]
  - - [33708, 3894, 1, 1024]
    - [9, 92.636]
  - - [1024, 3548, 1, 4096]
    - [7, 84.774]
  - - [1024, 3451, 1, 4096]
    - [8, 90.223]
  - - [4096, 3353, 1, 1024]
    - [7, 88.592]
  - - [4096, 3402, 1, 1024]
    - [77, 87.241]
  - - [4096, 3939, 1, 1024]
    - [7, 86.205]
  - - [133, 133, 480, 64]
    - [112, 22.654]
  - - [1024, 3559, 1, 4096]
    - [7, 85.123]
  - - [1024, 2977, 1, 4096]
    - [12, 86.519]
  - - [1024, 3478, 1, 4096]
    - [6, 89.774]
  - - [134, 134, 480, 64]
    - [111, 23.254]
  - - [1024, 3368, 1, 4096]
    - [8, 88.445]
  - - [4096, 4012, 1, 1024]
    - [7, 87.691]
  - - [4096, 3486, 1, 1024]
    - [6, 88.804]
  - - [1024, 3479, 1, 4096]
    - [6, 89.861]
  - - [1024, 3505, 1, 4096]
    - [6, 89.7]
  - - [4096, 3381, 1, 1024]
    - [77, 86.632]
  - - [4096, 3430, 1, 1024]
    - [77, 87.685]
  - - [1024, 3554, 1, 4096]
    - [7, 84.832]
  - - [4096, 3271, 1, 1024]
    - [7, 86.668]
  - - [1024, 3063, 1, 4096]
    - [12, 88.487]
  - - [1024, 3209, 1, 4096]
    - [14, 85.144]
  - - [4096, 3503, 1, 1024]
    - [6, 89.225]
  - - [4096, 3344, 1, 1024]
    - [7, 88.466]
  - - [1024, 3147, 1, 4096]
    - [14, 83.547]
  - - [1024, 3322, 1, 4096]
    - [8, 86.887]
  - - [1024, 3341, 1, 4096]
    - [8, 87.589]
  - - [1024, 3516, 1, 4096]
    - [6, 89.569]
  - - [102, 101, 624, 64]
    - [70, 20.763]
  - - [1024, 3454, 1, 4096]
    - [8, 90.615]
  - - [4096, 3969, 1, 1024]
    - [7, 86.243]
  - - [4096, 3466, 1, 1024]
    - [6, 88.701]
  - - [1024, 3999, 1, 1024]
    - [14, 79.201]
  - - [1024, 4032, 1, 1024]
    - [14, 80.564]
  - - [1024, 3403, 1, 4096]
    - [8, 89.264]
  - - [4096, 3361, 1, 1024]
    - [15, 86.295]
  - - [1024, 3527, 1, 4096]
    - [7, 84.017]
  - - [1024, 3822, 1, 4096]
    - [7, 91.137]
  - - [4096, 3315, 1, 1024]
    - [7, 87.748]
  - - [232, 232, 272, 64]
    - [26, 29.222]
  - - [1024, 3336, 1, 4096]
    - [8, 87.349]
  - - [228, 232, 272, 64]
    - [14, 28.56]
  - - [4096, 3547, 1, 1024]
    - [7, 87.55]
  - - [4096, 3340, 1, 1024]
    - [7, 88.298]
  - - [1024, 3906, 1, 1024]
    - [41, 81.42]
  - - [1024, 3295, 1, 4096]
    - [14, 86.926]
  - - [4096, 3294, 1, 1024]
    - [7, 87.29]
  - - [33708, 3968, 1, 1024]
    - [9, 91.947]
  - - [1024, 3473, 1, 4096]
    - [6, 90.162]
  - - [1024, 3072, 1, 4096]
    - [12, 89.006]
  - - [4096, 3189, 1, 1024]
    - [6, 86.62]
  - - [4096, 3494, 1, 1024]
    - [6, 89.008]
  - - [1024, 3522, 1, 4096]
    - [7, 84.377]
  - - [33708, 3944, 1, 1024]
    - [9, 91.478]
  - - [135, 135, 480, 64]
    - [111, 23.084]
  - - [4096, 3421, 1, 1024]
    - [6, 87.455]
  - - [32, 32, 1984, 64]
    - [51, 15.626]
  - - [4096, 3311, 1, 1024]
    - [7, 87.397]
  - - [1024, 3990, 1, 1024]
    - [14, 79.523]
  - - [1024, 3290, 1, 4096]
    - [14, 86.952]
  - - [4096, 3565, 1, 1024]
    - [7, 87.88]
  - - [1024, 3484, 1, 4096]
    - [6, 89.66]
  - - [4096, 3384, 1, 1024]
    - [77, 86.897]
  - - [1024, 3422, 1, 4096]
    - [8, 89.342]
  - - [4096, 3681, 1, 1024]
    - [6, 88.647]
  - - [1024, 3584, 1, 1024]
    - [14, 79.813]
  - - [4096, 4050, 1, 1024]
    - [7, 88.399]
  - - [1024, 3996, 1, 4096]
    - [8, 84.451]
  - - [4096, 3169, 1, 1024]
    - [6, 86.263]
  - - [4096, 3538, 1, 1024]
    - [7, 87.26]
  - - [1024, 3495, 1, 4096]
    - [6, 89.894]
  - - [4096, 3401, 1, 1024]
    - [6, 87.262]
  - - [1024, 3560, 1, 4096]
    - [7, 84.964]
  - - [133, 135, 480, 64]
    - [111, 22.701]
  - - [1024, 3263, 1, 4096]
    - [14, 86.311]
  - - [1024, 3870, 1, 4096]
    - [16, 90.792]
  - - [4096, 3555, 1, 1024]
    - [7, 87.645]
  - - [4096, 3412, 1, 1024]
    - [77, 87.237]
  - - [101, 101, 624, 64]
    - [17, 20.628]
  - - [1024, 3296, 1, 4096]
    - [14, 87.306]
  - - [1024, 3379, 1, 4096]
    - [8, 88.574]
  - - [4096, 3302, 1, 1024]
    - [7, 87.282]
  - - [1024, 3490, 1, 4096]
    - [6, 89.656]
  - - [1024, 3428, 1, 4096]
    - [8, 89.51]
  - - [1024, 3976, 1, 4096]
    - [8, 84.16]
  - - [4096, 3485, 1, 1024]
    - [6, 88.935]
  - - [4096, 3534, 1, 1024]
    - [7, 86.283]
  - - [1024, 3064, 1, 4096]
    - [12, 88.57]
  - - [4096, 3216, 1, 1024]
    - [6, 87.278]
  - - [1024, 3450, 1, 4096]
    - [8, 90.235]
  - - [1024, 3533, 1, 4096]
    - [7, 84.416]
  - - [1024, 4030, 1, 1024]
    - [14, 80.016]
  - - [1024, 3311, 1, 4096]
    - [8, 86.707]
  - - [1024, 3468, 1, 4096]
    - [6, 89.86]
  - - [23, 23, 2720, 64]
    - [60, 11.464]
  - - [4096, 3359, 1, 1024]
    - [7, 88.825]
  - - [4096, 3392, 1, 1024]
    - [11, 87.162]
  - - [1024, 3925, 1, 1024]
    - [14, 81.35]
  - - [4096, 3233, 1, 1024]
    - [6, 87.363]
  - - [4096, 3956, 1, 1024]
    - [7, 86.467]
  - - [1024, 3463, 1, 4096]
    - [6, 89.866]
  - - [1024, 3126, 1, 4096]
    - [14, 82.919]
  - - [1024, 3363, 1, 4096]
    - [8, 88.35]
  - - [4096, 3465, 1, 1024]
    - [6, 88.736]
  - - [33708, 3996, 1, 1024]
    - [9, 92.607]
  - - [1024, 3231, 1, 4096]
    - [14, 85.5]
  - - [33708, 3978, 1, 1024]
    - [9, 92.241]
  - - [4096, 3476, 1, 1024]
    - [6, 88.765]
  - - [85, 85, 752, 64]
    - [4, 21.917]
  - - [4096, 3339, 1, 1024]
    - [7, 88.296]
  - - [4096, 3452, 1, 1024]
    - [6, 87.926]
  - - [1024, 3396, 1, 4096]
    - [8, 88.97]
  - - [4096, 3293, 1, 1024]
    - [7, 87.055]
  - - [54, 54, 1184, 64]
    - [4, 17.878]
  - - [1024, 3432, 1, 4096]
    - [8, 89.863]
  - - [4096, 3493, 1, 1024]
    - [6, 89.007]
  - - [4096, 3350, 1, 1024]
    - [7, 88.538]
  - - [1024, 3079, 1, 4096]
    - [14, 81.776]
  - - [1024, 3101, 1, 4096]
    - [14, 82.049]
  - - [33708, 3939, 1, 1024]
    - [9, 91.394]
  - - [4096, 3256, 1, 1024]
    - [6, 87.672]
  - - [1024, 3439, 1, 4096]
    - [8, 90.009]
  - - [1024, 3510, 1, 4096]
    - [12, 89.694]
  - - [4096, 3900, 1, 1024]
    - [6, 87.791]
  - - [1024, 3470, 1, 4096]
    - [6, 89.813]
  - - [4096, 3456, 1, 1024]
    - [113, 89.696]
  - - [4096, 3014, 1, 1024]
    - [6, 88.04]
  - - [4096, 3367, 1, 1024]
    - [11, 86.461]
  - - [4096, 3432, 1, 1024]
    - [77, 87.641]
  - - [33708, 4026, 1, 1024]
    - [19, 92.563]
  - - [4096, 3273, 1, 1024]
    - [7, 86.515]
  - - [4096, 3130, 1, 1024]
    - [7, 88.834]
  - - [1024, 3496, 1, 4096]
    - [6, 89.712]
  - - [1024, 3995, 1, 4096]
    - [8, 84.524]
  - - [1024, 3939, 1, 4096]
    - [8, 83.107]
  - - [1024, 3121, 1, 4096]
    - [41, 82.636]
  - - [1024, 3232, 1, 4096]
    - [14, 85.622]
  - - [4096, 3147, 1, 1024]
    - [7, 88.903]
  - - [4096, 3516, 1, 1024]
    - [6, 89.34]
  - - [1024, 3969, 1, 1024]
    - [14, 79.305]
  - - [1024, 3364, 1, 4096]
    - [8, 88.389]
  - - [4096, 3411, 1, 1024]
    - [6, 87.223]
  - - [147, 147, 432, 64]
    - [4, 25.116]
  - - [4096, 3301, 1, 1024]
    - [7, 87.414]
  - - [112, 111, 576, 64]
    - [4, 24.413]
  - - [1024, 3513, 1, 4096]
    - [6, 89.771]
  - - [1024, 3469, 1, 4096]
    - [6, 89.984]
  - - [1024, 3095, 1, 4096]
    - [41, 81.924]
  - - [4096, 3533, 1, 1024]
    - [7, 86.955]
  - - [4096, 3390, 1, 1024]
    - [77, 86.933]
  - - [4096, 3582, 1, 1024]
    - [7, 88.727]
  - - [1024, 3956, 1, 1024]
    - [14, 79.045]
  - - [4096, 3585, 1, 1024]
    - [7, 88.627]
  - - [4096, 3231, 1, 1024]
    - [6, 86.999]
  - - [1024, 3205, 1, 4096]
    - [14, 85.038]
  - - [4096, 3496, 1, 1024]
    - [6, 88.963]
  - - [1024, 3143, 1, 4096]
    - [14, 83.581]
  - - [1024, 3318, 1, 4096]
    - [8, 87.047]
  - - [1024, 3353, 1, 4096]
    - [8, 87.831]
  - - [1024, 3464, 1, 4096]
    - [6, 89.978]
  - - [4096, 2736, 1, 1024]
    - [6, 85.425]
  - - [1024, 3402, 1, 4096]
    - [8, 89.152]
  - - [4096, 3138, 1, 1024]
    - [7, 89.075]
  - - [1024, 3860, 1, 4096]
    - [16, 90.704]
  - - [148, 148, 432, 64]
    - [4, 25.894]
  - - [1024, 3539, 1, 4096]
    - [7, 84.474]
  - - [4096, 3211, 1, 1024]
    - [6, 87.08]
  - - [1024, 3332, 1, 4096]
    - [6, 87.208]
  - - [1024, 3466, 1, 4096]
    - [6, 89.956]
  - - [4096, 3475, 1, 1024]
    - [6, 88.812]
  - - [4096, 3524, 1, 1024]
    - [7, 86.926]
  - - [4096, 2985, 1, 1024]
    - [6, 86.911]
  - - [4096, 3222, 1, 1024]
    - [6, 87.416]
  - - [4096, 3451, 1, 1024]
    - [6, 87.948]
  - - [1024, 3181, 1, 4096]
    - [14, 84.449]
  - - [1024, 3640, 1, 4096]
    - [7, 86.742]
  - - [1024, 3375, 1, 4096]
    - [8, 88.641]
  - - [1024, 3550, 1, 4096]
    - [7, 84.736]
  - - [1024, 4020, 1, 1024]
    - [14, 80.155]
  - - [4096, 3349, 1, 1024]
    - [7, 88.388]
  - - [4096, 3398, 1, 1024]
    - [6, 87.197]
  - - [33708, 3976, 1, 1024]
    - [9, 92.3]
  - - [1024, 2917, 1, 4096]
    - [12, 84.984]
  - - [33708, 3910, 1, 1024]
    - [9, 92.86]
  - - [4096, 3860, 1, 1024]
    - [6, 87.422]
  - - [4096, 3304, 1, 1024]
    - [7, 87.359]
  - - [1024, 3286, 1, 4096]
    - [14, 86.931]
  - - [1024, 3460, 1, 4096]
    - [6, 89.923]
  - - [1024, 4026, 1, 4096]
    - [8, 85.038]
  - - [4096, 3471, 1, 1024]
    - [6, 88.793]
  - - [193, 193, 320, 64]
    - [14, 25.466]
  - - [1024, 3894, 1, 1024]
    - [10, 82.002]
  - - [65, 65, 992, 64]
    - [19, 16.674]
  - - [1024, 3506, 1, 4096]
    - [6, 89.568]
  - - [35, 35, 1808, 64]
    - [74, 12.452]
  - - [1024, 4000, 1, 1024]
    - [14, 79.992]
  - - [1024, 3900, 1, 4096]
    - [16, 91.247]
  - - [1024, 3445, 1, 4096]
    - [8, 90.228]
  - - [4096, 3442, 1, 1024]
    - [32, 87.802]
  - - [1024, 3358, 1, 4096]
    - [8, 88.084]
  - - [13, 13, 4672, 64]
    - [100, 7.799]
  - - [1024, 3211, 1, 4096]
    - [14, 85.186]
  - - [4096, 3515, 1, 1024]
    - [6, 89.087]
  - - [1024, 3564, 1, 4096]
    - [7, 85.167]
  - - [4096, 3057, 1, 1024]
    - [6, 88.694]
  - - [1024, 3343, 1, 4096]
    - [8, 87.886]
  - - [4096, 3262, 1, 1024]
    - [6, 87.584]
  - - [1024, 3518, 1, 4096]
    - [12, 89.668]
  - - [77, 77, 816, 64]
    - [19, 19.681]
  - - [33708, 3876, 1, 1024]
    - [46, 92.014]
  - - [4096, 3462, 1, 1024]
    - [6, 88.695]
  - - [1024, 3265, 1, 4096]
    - [14, 86.594]
  - - [4096, 3389, 1, 1024]
    - [77, 86.895]
  - - [4096, 3438, 1, 1024]
    - [6, 87.759]
  - - [1024, 3955, 1, 1024]
    - [14, 79.26]
  - - [1024, 3545, 1, 4096]
    - [7, 84.542]
  - - [1024, 3144, 1, 4096]
    - [14, 83.49]
  - - [1024, 3417, 1, 4096]
    - [8, 89.396]
  - - [4096, 3543, 1, 1024]
    - [7, 87.337]
  - - [4096, 3352, 1, 1024]
    - [7, 88.479]
  - - [33708, 3975, 1, 1024]
    - [9, 92.258]
  - - [148, 147, 432, 64]
    - [4, 25.287]
  - - [4096, 3137, 1, 1024]
    - [7, 88.767]
  - - [4096, 3506, 1, 1024]
    - [6, 89.146]
  - - [1024, 3975, 1, 1024]
    - [14, 79.224]
  - - [1024, 3859, 1, 4096]
    - [32, 90.613]
  - - [4096, 3369, 1, 1024]
    - [77, 86.748]
  - - [1024, 3434, 1, 4096]
    - [8, 89.903]
  - - [1024, 3292, 1, 4096]
    - [14, 86.932]
  - - [4096, 3523, 1, 1024]
    - [7, 86.912]
  - - [4096, 3380, 1, 1024]
    - [77, 86.783]
  - - [1024, 3408, 1, 4096]
    - [8, 89.42]
  - - [4096, 3221, 1, 1024]
    - [6, 87.389]
  - - [4096, 3270, 1, 1024]
    - [7, 86.666]
  - - [143, 143, 432, 64]
    - [4, 24.336]
  - - [111, 111, 576, 64]
    - [51, 21.799]
  - - [1024, 3303, 1, 4096]
    - [8, 86.425]
  - - [4096, 3502, 1, 1024]
    - [6, 89.056]
  - - [1024, 3222, 1, 4096]
    - [14, 85.334]
  - - [4096, 2505, 1, 1024]
    - [6, 85.515]
  - - [4096, 3397, 1, 1024]
    - [6, 87.243]
  - - [4096, 3562, 1, 1024]
    - [7, 87.909]
  - - [4096, 3095, 1, 1024]
    - [7, 87.867]
  - - [1024, 3226, 1, 4096]
    - [14, 85.524]
  - - [177, 177, 352, 64]
    - [14, 26.774]
  - - [4096, 3360, 1, 1024]
    - [7, 88.678]
  - - [1024, 3942, 1, 1024]
    - [14, 79.1]
  - - [1024, 3298, 1, 4096]
    - [8, 86.51]
  - - [1024, 3381, 1, 4096]
    - [8, 88.798]
  - - [4096, 3314, 1, 1024]
    - [7, 87.819]
  - - [1024, 3492, 1, 4096]
    - [6, 89.658]
  - - [1024, 3430, 1, 4096]
    - [8, 89.798]
  - - [4096, 3977, 1, 1024]
    - [7, 87.097]
  - - [4096, 3546, 1, 1024]
    - [7, 87.594]
  - - [4096, 3640, 1, 1024]
    - [7, 89.6]
  - - [4096, 3441, 1, 1024]
    - [6, 87.682]
  - - [33708, 4059, 1, 1024]
    - [9, 92.042]
  - - [1024, 3978, 1, 1024]
    - [14, 79.183]
  - - [1024, 3376, 1, 4096]
    - [8, 88.581]
  - - [1024, 3482, 1, 4096]
    - [6, 89.791]
  - - [1024, 3563, 1, 4096]
    - [7, 85.187]
  - - [4096, 4020, 1, 1024]
    - [7, 87.724]
  - - [1024, 3271, 1, 4096]
    - [14, 86.741]
  - - [1024, 3291, 1, 4096]
    - [41, 86.603]
  - - [1024, 3431, 1, 4096]
    - [8, 89.762]
  - - [1024, 3481, 1, 4096]
    - [6, 90.049]
  - - [84, 85, 752, 64]
    - [4, 21.997]
  - - [4096, 3461, 1, 1024]
    - [6, 88.67]
  - - [1024, 3574, 1, 4096]
    - [7, 85.439]
  - - [1024, 4059, 1, 1024]
    - [14, 80.66]
  - - [84, 84, 752, 64]
    - [4, 22.244]
  - - [1024, 3421, 1, 4096]
    - [114, 88.922]
  - - [4096, 3224, 1, 1024]
    - [6, 86.588]
  - - [4096, 3437, 1, 1024]
    - [32, 87.521]
  - - [45, 45, 1424, 64]
    - [74, 16.372]
  - - [4096, 3168, 1, 1024]
    - [7, 89.336]
  - - [33708, 3990, 1, 1024]
    - [9, 92.511]
  - - [1024, 3349, 1, 4096]
    - [8, 87.909]
  - - [4096, 3335, 1, 1024]
    - [7, 88.178]
  - - [4096, 3400, 1, 1024]
    - [6, 87.225]
  - - [160, 159, 400, 64]
    - [4, 28.746]
  - - [1024, 3398, 1, 4096]
    - [8, 88.948]
  - - [1024, 3780, 1, 4096]
    - [7, 90.112]
  - - [29, 29, 2176, 64]
    - [4, 13.362]
  - - [4096, 3098, 1, 1024]
    - [7, 87.847]
  - - [1024, 4012, 1, 4096]
    - [8, 84.903]
  - - [4096, 3505, 1, 1024]
    - [6, 88.905]
  - - [4096, 3554, 1, 1024]
    - [7, 87.586]
  - - [4096, 3063, 1, 1024]
    - [6, 88.936]
  - - [1024, 3503, 1, 4096]
    - [6, 89.733]
  - - [1024, 3166, 1, 4096]
    - [14, 83.98]
  - - [1024, 3425, 1, 4096]
    - [8, 89.655]
  - - [1024, 3344, 1, 4096]
    - [8, 87.802]
  - - [4096, 3484, 1, 1024]
    - [6, 88.873]
  - - [1024, 3681, 1, 1024]
    - [7, 81.512]
  - - [1024, 4050, 1, 1024]
    - [14, 80.549]
  - - [4096, 3379, 1, 1024]
    - [77, 86.722]
  - - [4096, 3428, 1, 1024]
    - [77, 87.374]
  - - [12, 12, 5040, 64]
    - [100, 6.796]
  - - [27, 27, 2336, 64]
    - [60, 13.028]
  - - [1024, 3304, 1, 4096]
    - [8, 86.728]
  - - [1024, 3387, 1, 4096]
    - [8, 88.944]
  - - [4096, 3126, 1, 1024]
    - [7, 88.774]
  - - [1024, 3498, 1, 4096]
    - [6, 89.739]
  - - [1024, 3436, 1, 4096]
    - [8, 89.794]
  - - [4096, 3501, 1, 1024]
    - [6, 88.995]
  - - [4096, 3358, 1, 1024]
    - [7, 88.6]
  - - [4096, 3232, 1, 1024]
    - [6, 87.187]
  - - [1024, 3585, 1, 4096]
    - [7, 85.658]
  - - [4096, 3143, 1, 1024]
    - [7, 88.976]
  - - [4096, 3464, 1, 1024]
    - [6, 88.77]
  - - [1024, 3366, 1, 4096]
    - [8, 88.331]
  - - [4096, 3375, 1, 1024]
    - [77, 86.867]
  - - [4096, 2917, 1, 1024]
    - [15, 85.352]
  - - [4096, 4026, 1, 1024]
    - [7, 86.882]
  - - [49, 49, 1296, 64]
    - [5, 16.62]
  - - [1024, 3277, 1, 4096]
    - [14, 86.815]
  - - [1024, 3103, 1, 4096]
    - [14, 82.217]
  - - [33708, 3995, 1, 1024]
    - [9, 92.786]
  - - [1024, 3297, 1, 4096]
    - [8, 86.388]
  - - [4096, 3545, 1, 1024]
    - [7, 87.387]
  - - [1024, 3399, 1, 4096]
    - [8, 88.925]
  - - [33708, 3796, 1, 1024]
    - [9, 92.482]
  - - [4096, 3292, 1, 1024]
    - [7, 86.908]
  - - [71, 71, 896, 64]
    - [111, 18.069]
  - - [33708, 3859, 1, 1024]
    - [46, 91.657]
  - - [4096, 3566, 1, 1024]
    - [7, 88.065]
  - - [4096, 3894, 1, 1024]
    - [6, 87.625]
  - - [4096, 3492, 1, 1024]
    - [6, 88.173]
  - - [1024, 3977, 1, 1024]
    - [14, 79.432]
  - - [1024, 3272, 1, 4096]
    - [14, 86.488]
  - - [135, 134, 480, 64]
    - [112, 22.955]
  - - [1024, 3355, 1, 4096]
    - [8, 88.189]
  - - [4096, 3419, 1, 1024]
    - [32, 87.428]
  - - [1024, 3404, 1, 4096]
    - [8, 89.266]
  - - [4096, 3999, 1, 1024]
    - [7, 87.478]
  - - [4096, 3166, 1, 1024]
    - [7, 89.587]
  - - [33708, 3840, 1, 1024]
    - [9, 93.435]
  - - [4096, 4032, 1, 1024]
    - [7, 88.108]
  - - [1024, 3573, 1, 4096]
    - [7, 85.167]
  - - [4096, 3366, 1, 1024]
    - [77, 86.353]
  - - [1024, 3541, 1, 4096]
    - [7, 84.404]
  - - [4096, 3207, 1, 1024]
    - [6, 87.134]
  - - [4096, 3272, 1, 1024]
    - [7, 85.769]
  - - [1024, 3334, 1, 4096]
    - [8, 87.527]
  - - [228, 228, 272, 64]
    - [26, 28.439]
  - - [4096, 3183, 1, 1024]
    - [6, 86.544]
  - - [4096, 3536, 1, 1024]
    - [7, 87.176]
  - - [1024, 4005, 1, 1024]
    - [14, 79.654]
  - - [1024, 3245, 1, 4096]
    - [14, 86.027]
  - - [4096, 3447, 1, 1024]
    - [32, 87.775]
  - - [1024, 3183, 1, 4096]
    - [14, 84.526]
  - - [1024, 3361, 1, 4096]
    - [8, 88.408]
  - - [33708, 3870, 1, 1024]
    - [9, 91.904]
  - - [1024, 3321, 1, 4096]
    - [8, 86.885]
  - - [1024, 3486, 1, 4096]
    - [6, 89.809]
  - - [4096, 4005, 1, 1024]
    - [7, 87.589]
  - - [4096, 3410, 1, 1024]
    - [6, 87.351]
  - - [1024, 3944, 1, 1024]
    - [14, 79.208]
  - - [4096, 3300, 1, 1024]
    - [7, 87.253]
  - - [4096, 3579, 1, 1024]
    - [7, 88.352]
  - - [4096, 3483, 1, 1024]
    - [6, 88.98]
  - - [4096, 3532, 1, 1024]
    - [7, 87.112]
  - - [1024, 3140, 1, 4096]
    - [14, 83.49]
  - - [1024, 3372, 1, 4096]
    - [8, 88.427]
  - - [1024, 3224, 1, 4096]
    - [41, 85.399]
  - - [4096, 3230, 1, 1024]
    - [6, 86.638]
  - - [4096, 3427, 1, 1024]
    - [6, 87.325]
  - - [1024, 3796, 1, 1024]
    - [7, 84.216]
  - - [143, 148, 432, 64]
    - [4, 24.508]
  - - [1024, 3616, 1, 4096]
    - [7, 86.541]
  - - [1024, 3315, 1, 4096]
    - [76, 85.989]
  - - [1024, 3476, 1, 4096]
    - [6, 89.919]
  - - [1024, 3509, 1, 4096]
    - [12, 89.777]
  - - [4096, 3357, 1, 1024]
    - [7, 88.365]
  - - [4096, 3406, 1, 1024]
    - [6, 87.331]
  - - [1024, 3558, 1, 4096]
    - [7, 85.056]
  - - [4096, 3593, 1, 1024]
    - [7, 88.674]
  - - [4096, 3247, 1, 1024]
    - [6, 87.554]
  - - [4096, 3088, 1, 1024]
    - [7, 87.656]
  - - [1024, 3213, 1, 4096]
    - [14, 85.107]
  - - [4096, 3511, 1, 1024]
    - [6, 88.135]
  - - [122, 122, 528, 64]
    - [4, 24.827]
  - - [1024, 3365, 1, 4096]
    - [8, 88.329]
  - - [1024, 3504, 1, 4096]
    - [6, 89.917]
  - - [1024, 3442, 1, 4096]
    - [8, 90.0]
  - - [4096, 3474, 1, 1024]
    - [6, 88.75]
  - - [4096, 2984, 1, 1024]
    - [6, 86.949]
  - - [1024, 3876, 1, 4096]
    - [16, 90.911]
  - - [4096, 3337, 1, 1024]
    - [7, 88.207]
  - - [4096, 3450, 1, 1024]
    - [32, 87.935]
  - - [1024, 3547, 1, 4096]
    - [7, 84.611]
  - - [4096, 3291, 1, 1024]
    - [7, 86.942]
  - - [1024, 3340, 1, 4096]
    - [8, 87.673]
  - - [4096, 3491, 1, 1024]
    - [6, 89.04]
  - - [4096, 3348, 1, 1024]
    - [7, 88.51]
  - - [78, 78, 816, 64]
    - [4, 20.083]
  - - [4096, 3906, 1, 1024]
    - [108, 85.791]
  - - [1024, 3477, 1, 4096]
    - [6, 89.982]
  - - [1024, 3397, 1, 4096]
    - [8, 88.959]
  - - [4096, 3165, 1, 1024]
    - [7, 89.465]
  - - [4096, 3470, 1, 1024]
    - [6, 88.756]
  - - [1024, 3526, 1, 4096]
    - [7, 84.068]
  - - [112, 112, 576, 64]
    - [4, 24.988]
  - - [4096, 3365, 1, 1024]
    - [77, 86.81]
  - - [4096, 3319, 1, 1024]
    - [7, 87.89]
  - - [1024, 3401, 1, 4096]
    - [8, 89.064]
  - - [1024, 3294, 1, 4096]
    - [14, 87.131]
  - - [159, 159, 400, 64]
    - [4, 26.588]
  - - [1024, 3472, 1, 4096]
    - [6, 89.877]
  - - [4096, 3328, 1, 1024]
    - [7, 87.993]
  - - [1024, 3861, 1, 1024]
    - [35, 81.635]
  - - [1024, 3910, 1, 1024]
    - [14, 81.648]
  - - [1024, 3410, 1, 4096]
    - [8, 89.386]
  - - [1024, 3395, 1, 4096]
    - [8, 88.734]
  - - [4096, 3282, 1, 1024]
    - [7, 87.032]
  - - [1024, 3751, 1, 1024]
    - [7, 83.729]
  - - [4096, 3145, 1, 1024]
    - [7, 88.873]
  - - [4096, 3514, 1, 1024]
    - [6, 89.301]
  - - [4096, 3944, 1, 1024]
    - [7, 86.245]
  - - [1024, 3515, 1, 4096]
    - [6, 89.858]
  - - [4096, 3409, 1, 1024]
    - [6, 87.29]
  - - [4096, 3564, 1, 1024]
    - [7, 87.844]
  - - [4096, 3299, 1, 1024]
    - [7, 87.312]
  - - [1024, 3057, 1, 4096]
    - [12, 88.463]
  - - [4096, 3531, 1, 1024]
    - [7, 87.178]
  - - [4096, 3388, 1, 1024]
    - [15, 86.846]
  - - [1024, 3189, 1, 4096]
    - [14, 84.614]
  - - [1024, 3300, 1, 4096]
    - [8, 86.252]
  - - [1024, 3720, 1, 4096]
    - [7, 88.794]
  - - [1024, 3383, 1, 4096]
    - [8, 88.764]
  - - [1024, 3494, 1, 4096]
    - [6, 89.588]
  - - [77, 78, 816, 64]
    - [4, 19.825]
  - - [1024, 3448, 1, 4096]
    - [8, 90.282]
  - - [4096, 3542, 1, 1024]
    - [7, 87.369]
  - - [1024, 3488, 1, 4096]
    - [6, 89.726]
  - - [4096, 3405, 1, 1024]
    - [6, 87.329]
  - - [1024, 3262, 1, 4096]
    - [14, 86.188]
  - - [33708, 4005, 1, 1024]
    - [9, 92.866]
  - - [1024, 3594, 1, 4096]
    - [7, 85.852]
  - - [4096, 3103, 1, 1024]
    - [7, 87.804]
  - - [4096, 3136, 1, 1024]
    - [7, 88.951]
  - - [1024, 3378, 1, 4096]
    - [8, 88.609]
  - - [10, 10, 5952, 64]
    - [66, 5.92]
  - - [7, 7, 8192, 64]
    - [66, 4.006]
  - - [4096, 3559, 1, 1024]
    - [7, 87.938]
  - - [4096, 3368, 1, 1024]
    - [77, 86.616]
  - - [4096, 3209, 1, 1024]
    - [6, 87.201]
  - - [4096, 3322, 1, 1024]
    - [7, 87.921]
  - - [1024, 3483, 1, 4096]
    - [6, 89.952]
  - - [4096, 3473, 1, 1024]
    - [6, 88.701]
  - - [4096, 3522, 1, 1024]
    - [7, 86.842]
  - - [1024, 3532, 1, 4096]
    - [7, 84.19]
  - - [4096, 3449, 1, 1024]
    - [6, 87.945]
  - - [1024, 3351, 1, 4096]
    - [8, 88.047]
  - - [1024, 3462, 1, 4096]
    - [6, 89.692]
  - - [4096, 3396, 1, 1024]
    - [6, 87.182]
  - - [132, 132, 480, 64]
    - [111, 23.128]
  - - [111, 112, 576, 64]
    - [115, 22.089]
  - - [1024, 3416, 1, 4096]
    - [8, 89.432]
  - - [4096, 3469, 1, 1024]
    - [6, 88.826]
  - - [1024, 3582, 1, 4096]
    - [7, 85.619]
  - - [1024, 3230, 1, 4096]
    - [14, 85.582]
  - - [1024, 3489, 1, 4096]
    - [6, 89.52]
  - - [1024, 3427, 1, 4096]
    - [8, 89.794]
  - - [1024, 3346, 1, 4096]
    - [8, 87.769]
  - - [33708, 3977, 1, 1024]
    - [9, 92.196]
  - - [4096, 3796, 1, 1024]
    - [7, 88.213]
  - - [4096, 3176, 1, 1024]
    - [6, 86.59]
  - - [4096, 3990, 1, 1024]
    - [7, 87.19]
  - - [1024, 3257, 1, 4096]
    - [41, 85.996]
  - - [4096, 3343, 1, 1024]
    - [7, 88.143]
  - - [4096, 3440, 1, 1024]
    - [6, 87.739]
  - - [33708, 4030, 1, 1024]
    - [9, 92.867]
  - - [1024, 3190, 1, 4096]
    - [14, 84.581]
  - - [1024, 3389, 1, 4096]
    - [8, 88.947]
  - - [1024, 3500, 1, 4096]
    - [12, 89.608]
  - - [1024, 3471, 1, 4096]
    - [6, 90.247]
  - - [1024, 3438, 1, 4096]
    - [8, 89.933]
  - - [4096, 3513, 1, 1024]
    - [6, 89.168]
  - - [1024, 3562, 1, 4096]
    - [7, 84.99]
  - - [4096, 3616, 1, 1024]
    - [7, 89.172]
  - - [4096, 3955, 1, 1024]
    - [7, 86.595]
  - - [1024, 3441, 1, 4096]
    - [8, 90.024]
  - - [1024, 3236, 1, 4096]
    - [41, 85.596]
  - - [1024, 3524, 1, 4096]
    - [7, 83.925]
  - - [4096, 3460, 1, 1024]
    - [6, 88.644]
  - - [16, 16, 3840, 64]
    - [66, 9.547]
  - - [92, 93, 688, 64]
    - [60, 23.679]
  - - [1024, 3384, 1, 4096]
    - [8, 88.778]
  - - [4096, 3387, 1, 1024]
    - [77, 87.021]
  - - [4096, 3436, 1, 1024]
    - [6, 87.672]
  - - [4096, 3277, 1, 1024]
    - [7, 86.863]
  - - [1024, 3457, 1, 4096]
    - [6, 90.093]
  - - [1024, 3999, 1, 4096]
    - [8, 84.571]
  - - [1024, 4032, 1, 4096]
    - [8, 85.107]
  - - [4096, 3541, 1, 1024]
    - [7, 87.334]
  - - [4096, 3334, 1, 1024]
    - [7, 87.943]
  - - [1024, 3393, 1, 4096]
    - [8, 88.694]
  - - [17, 17, 3632, 64]
    - [60, 8.204]
  - - [1024, 3411, 1, 4096]
    - [8, 89.276]
  - - [1024, 3822, 1, 1024]
    - [7, 84.279]
  - - [1024, 3593, 1, 4096]
    - [19, 85.417]
  - - [33708, 3822, 1, 1024]
    - [9, 93.021]
  - - [4096, 3504, 1, 1024]
    - [6, 89.119]
  - - [1024, 3163, 1, 4096]
    - [14, 83.901]
  - - [1024, 3357, 1, 4096]
    - [8, 88.07]
  - - [1024, 3906, 1, 4096]
    - [16, 91.41]
  - - [4096, 3415, 1, 1024]
    - [6, 87.373]
  - - [1024, 3406, 1, 4096]
    - [8, 89.244]
  - - [4096, 3321, 1, 1024]
    - [7, 87.943]
  - - [4096, 3584, 1, 1024]
    - [7, 88.509]
  - - [1024, 2736, 1, 4096]
    - [7, 86.395]
  - - [1024, 3110, 1, 4096]
    - [14, 82.634]
  - - [33708, 3999, 1, 1024]
    - [9, 92.742]
  - - [1024, 3093, 1, 4096]
    - [14, 81.998]
  - - [4096, 3378, 1, 1024]
    - [77, 86.778]
  - - [1024, 3543, 1, 4096]
    - [7, 84.537]
  - - [33708, 3925, 1, 1024]
    - [9, 93.149]
  - - [1024, 3352, 1, 4096]
    - [8, 87.926]
  - - [4096, 3780, 1, 1024]
    - [7, 87.863]
  - - [1024, 3990, 1, 4096]
    - [8, 84.371]
  - - [4096, 3500, 1, 1024]
    - [6, 89.089]
  - - [4096, 3996, 1, 1024]
    - [7, 87.544]
  - - [1024, 3247, 1, 4096]
    - [14, 85.984]
  - - [4096, 3395, 1, 1024]
    - [6, 86.967]
  - - [1024, 3169, 1, 4096]
    - [41, 84.237]
  - - [1024, 3088, 1, 4096]
    - [14, 81.969]
  - - [1024, 3584, 1, 4096]
    - [7, 85.418]
  - - [4096, 3093, 1, 1024]
    - [7, 87.811]
  - - [1024, 3538, 1, 4096]
    - [7, 84.589]
  - - [1024, 3996, 1, 1024]
    - [14, 79.375]
  - - [1024, 3581, 1, 4096]
    - [7, 85.606]
  - - [4096, 3374, 1, 1024]
    - [77, 86.699]
  - - [33708, 3751, 1, 1024]
    - [9, 91.398]
  - - [59, 59, 1088, 64]
    - [4, 19.753]
  - - [4096, 3215, 1, 1024]
    - [6, 87.201]
  - - [4096, 3312, 1, 1024]
    - [7, 86.709]
  - - [4096, 3581, 1, 1024]
    - [7, 88.586]
  - - [4096, 3479, 1, 1024]
    - [6, 88.746]
  - - [4096, 3544, 1, 1024]
    - [7, 87.476]
  - - [1024, 3870, 1, 1024]
    - [35, 81.642]
  - - [1024, 3374, 1, 4096]
    - [8, 88.652]
  - - [1024, 2967, 1, 4096]
    - [12, 86.654]
  - - [41, 41, 1552, 64]
    - [74, 14.697]
  - - [4096, 3455, 1, 1024]
    - [32, 88.062]
  - - [4096, 3942, 1, 1024]
    - [7, 86.311]
  - - [1024, 3528, 1, 4096]
    - [7, 84.168]
  - - [4096, 3186, 1, 1024]
    - [6, 86.651]
  - - [1024, 3976, 1, 1024]
    - [41, 79.144]
  - - [1024, 3511, 1, 4096]
    - [12, 89.562]
  - - [4096, 3573, 1, 1024]
    - [7, 88.157]
  - - [4096, 3561, 1, 1024]
    - [7, 87.212]
  - - [4096, 3418, 1, 1024]
    - [6, 87.485]
  - - [33708, 3906, 1, 1024]
    - [9, 92.743]
  - - [4096, 3259, 1, 1024]
    - [6, 87.553]
  - - [4096, 3308, 1, 1024]
    - [7, 87.452]
  - - [1024, 3419, 1, 4096]
    - [114, 88.821]
  - - [1024, 3215, 1, 4096]
    - [14, 85.184]
  - - [1024, 4030, 1, 4096]
    - [8, 85.141]
  - - [4096, 3459, 1, 1024]
    - [6, 88.69]
  - - [1024, 3572, 1, 4096]
    - [7, 85.218]
  - - [1024, 3137, 1, 4096]
    - [14, 83.34]
  - - [1024, 3312, 1, 4096]
    - [8, 86.865]
  - - [1024, 3925, 1, 4096]
    - [16, 91.718]
  - - [1024, 3453, 1, 4096]
    - [8, 90.301]
  - - [4096, 3435, 1, 1024]
    - [6, 87.718]
  - - [1024, 3176, 1, 4096]
    - [14, 84.518]
  - - [1024, 3444, 1, 4096]
    - [8, 89.854]
  - - [4096, 3975, 1, 1024]
    - [7, 86.722]
  - - [4096, 3182, 1, 1024]
    - [6, 86.704]
  - - [1024, 3475, 1, 4096]
    - [6, 89.869]
  - - [9, 9, 6544, 64]
    - [116, 5.346]
  - - [33708, 3955, 1, 1024]
    - [9, 91.798]
  - - [4096, 3446, 1, 1024]
    - [6, 87.928]
  - - [1024, 3138, 1, 4096]
    - [14, 83.401]
  - - [1024, 3549, 1, 4096]
    - [7, 84.712]
  - - [4096, 3287, 1, 1024]
    - [7, 87.129]
  - - [1024, 3342, 1, 4096]
    - [8, 87.725]
  - - [102, 102, 624, 64]
    - [35, 20.736]
  - - [4096, 3519, 1, 1024]
    - [6, 89.308]
  - - [4096, 3552, 1, 1024]
    - [7, 87.639]
  - - [4096, 3859, 1, 1024]
    - [6, 87.546]
  - - [33708, 3969, 1, 1024]
    - [9, 92.062]
  - - [1024, 3369, 1, 4096]
    - [8, 88.336]
  - - [4096, 3482, 1, 1024]
    - [6, 88.822]
  - - [1024, 3306, 1, 4096]
    - [8, 86.684]
  - - [1024, 3474, 1, 4096]
    - [6, 89.904]
  - - [99, 99, 624, 64]
    - [13, 20.091]
  - - [4096, 3377, 1, 1024]
    - [77, 86.424]
  - - [4096, 3426, 1, 1024]
    - [6, 87.524]
  - - [4096, 2935, 1, 1024]
    - [11, 85.932]
  - - [4096, 3267, 1, 1024]
    - [7, 86.38]
  - - [1024, 3299, 1, 4096]
    - [8, 86.453]
  - - [1024, 3456, 1, 4096]
    - [8, 91.339]
  - - [1024, 3280, 1, 4096]
    - [14, 86.724]
  - - [1024, 3555, 1, 4096]
    - [7, 84.663]
  - - [4096, 3499, 1, 1024]
    - [6, 88.824]
  - - [4096, 3356, 1, 1024]
    - [7, 88.783]
  - - [100, 102, 624, 64]
    - [111, 20.443]
  - - [1024, 3412, 1, 4096]
    - [8, 89.043]
  - - [1024, 2984, 1, 4096]
    - [12, 86.616]
  - - [4096, 3141, 1, 1024]
    - [7, 88.787]
  - - [4096, 3510, 1, 1024]
    - [6, 89.356]
  - - [1024, 3995, 1, 1024]
    - [14, 79.488]
  - - [1024, 3517, 1, 4096]
    - [6, 89.546]
  - - [1024, 3455, 1, 4096]
    - [8, 90.328]
  - - [1024, 3939, 1, 1024]
    - [14, 78.872]
  - - [38, 38, 1680, 64]
    - [74, 13.746]
  - - [1024, 3447, 1, 4096]
    - [8, 90.044]
  - - [1024, 3969, 1, 4096]
    - [8, 84.04]
  - - [4096, 3527, 1, 1024]
    - [7, 86.773]
  - - [4096, 3336, 1, 1024]
    - [7, 88.008]
  - - [1024, 3191, 1, 4096]
    - [41, 84.572]
  - - [1024, 3302, 1, 4096]
    - [8, 86.567]
  - - [1024, 3337, 1, 4096]
    - [8, 87.643]
  - - [4096, 3290, 1, 1024]
    - [7, 86.927]
  - - [1024, 3512, 1, 4096]
    - [6, 89.6]
  - - [1024, 3433, 1, 4096]
    - [8, 89.914]
  - - [4096, 3876, 1, 1024]
    - [6, 87.742]
  - - [4096, 3490, 1, 1024]
    - [6, 88.93]
  - - [4096, 3064, 1, 1024]
    - [6, 88.815]
  - - [1024, 3508, 1, 4096]
    - [10, 89.209]
  - - [1024, 3956, 1, 4096]
    - [8, 83.624]
  - - [4096, 3417, 1, 1024]
    - [6, 87.614]
  - - [1024, 3248, 1, 4096]
    - [14, 86.095]
  - - [1024, 2499, 1, 4096]
    - [108, 86.896]
  - - [1024, 3186, 1, 4096]
    - [14, 84.416]
  - - [1024, 3180, 1, 4096]
    - [14, 84.375]
  - - [4096, 3364, 1, 1024]
    - [32, 86.301]
  - - [4096, 3976, 1, 1024]
    - [7, 87.035]
  - - [4096, 3205, 1, 1024]
    - [6, 86.93]
  - - [4096, 3318, 1, 1024]
    - [7, 87.852]
  - - [1024, 3377, 1, 4096]
    - [8, 88.619]
  - - [1024, 3485, 1, 4096]
    - [6, 89.992]
  - - [4096, 3181, 1, 1024]
    - [6, 86.752]
  - - [4096, 3550, 1, 1024]
    - [7, 87.773]
  - - [1024, 3534, 1, 4096]
    - [7, 84.493]
  - - [1024, 3860, 1, 1024]
    - [12, 81.759]
  - - [160, 160, 400, 64]
    - [111, 28.956]
  - - [4096, 3445, 1, 1024]
    - [6, 87.89]
  - - [1024, 3391, 1, 4096]
    - [8, 89.048]
  - - [1024, 3221, 1, 4096]
    - [14, 85.271]
  - - [4096, 3079, 1, 1024]
    - [7, 87.269]
  - - [4096, 3144, 1, 1024]
    - [7, 88.924]
  - - [1024, 3270, 1, 4096]
    - [14, 86.569]
  - - [1024, 3561, 1, 4096]
    - [7, 84.827]
  - - [1024, 3480, 1, 4096]
    - [6, 90.084]
  - - [4096, 3408, 1, 1024]
    - [6, 87.217]
  - - [1024, 3418, 1, 4096]
    - [8, 89.571]
  - - [4096, 3298, 1, 1024]
    - [7, 87.127]
  - - [1024, 3640, 1, 1024]
    - [7, 80.756]
  - - [1024, 3449, 1, 4096]
    - [8, 90.258]
  - - [1024, 4020, 1, 4096]
    - [8, 84.873]
  - - [4096, 3481, 1, 1024]
    - [6, 88.749]
  - - [4096, 3530, 1, 1024]
    - [7, 87.017]
  - - [1024, 3216, 1, 4096]
    - [41, 85.139]
  - - [1024, 3491, 1, 4096]
    - [6, 89.803]
  - - [1024, 3154, 1, 4096]
    - [14, 83.673]
  - - [4096, 3425, 1, 1024]
    - [32, 87.51]
  - - [1024, 3348, 1, 4096]
    - [8, 87.956]
  - - [1024, 3415, 1, 4096]
    - [8, 89.443]
  - - [1024, 4026, 1, 1024]
    - [14, 79.971]
  - - [1024, 3367, 1, 4096]
    - [8, 88.615]
  - - [1024, 3259, 1, 4096]
    - [14, 86.314]
  - - [1024, 3894, 1, 4096]
    - [117, 91.31]
  - - [4096, 3355, 1, 1024]
    - [7, 88.67]
  - - [4096, 3404, 1, 1024]
    - [77, 87.482]
  - - [1024, 3308, 1, 4096]
    - [8, 86.821]
  - - [4096, 3245, 1, 1024]
    - [6, 87.425]
  - - [1024, 3502, 1, 4096]
    - [6, 89.453]
  - - [33708, 4032, 1, 1024]
    - [9, 93.475]
  - - [8, 8, 7280, 64]
    - [66, 4.765]
  - - [1024, 3424, 1, 4096]
    - [8, 89.716]
  - - [4096, 3509, 1, 1024]
    - [6, 89.198]
  - - [4096, 3558, 1, 1024]
    - [7, 87.89]
  - - [1024, 3900, 1, 1024]
    - [10, 81.909]
  - - [1024, 2505, 1, 4096]
    - [16, 87.12]
  - - [4096, 3472, 1, 1024]
    - [6, 88.699]
  - - [1024, 3386, 1, 4096]
    - [8, 88.769]
  - - [4096, 3383, 1, 1024]
    - [77, 86.918]
  - - [4096, 3448, 1, 1024]
    - [77, 87.636]
  - - [4096, 4030, 1, 1024]
    - [7, 87.963]
  - - [4096, 3289, 1, 1024]
    - [7, 86.841]
  - - [1024, 3459, 1, 4096]
    - [6, 89.848]
  - - [1024, 2918, 1, 4096]
    - [12, 84.908]
  - - [4096, 3489, 1, 1024]
    - [6, 88.833]
  - - [4096, 3346, 1, 1024]
    - [7, 88.395]
  - - [4096, 3572, 1, 1024]
    - [7, 87.892]
  - - [1024, 3955, 1, 4096]
    - [6, 83.055]
  - - [4096, 3236, 1, 1024]
    - [6, 87.444]
  - - [4096, 3163, 1, 1024]
    - [7, 89.369]
  - - [4096, 3468, 1, 1024]
    - [6, 88.716]
  - - [1024, 3165, 1, 4096]
    - [14, 83.906]
  - - [1024, 3276, 1, 4096]
    - [14, 86.764]
  - - [1024, 3359, 1, 4096]
    - [8, 88.025]
  - - [4096, 3363, 1, 1024]
    - [77, 86.628]
  - - [1024, 3385, 1, 4096]
    - [8, 88.522]
  - - [1024, 3207, 1, 4096]
    - [14, 85.116]
  - - [1024, 3458, 1, 4096]
    - [6, 89.872]
  - - [21, 21, 2976, 64]
    - [60, 10.486]
  - - [4096, 3110, 1, 1024]
    - [7, 88.108]
  - - [4096, 3925, 1, 1024]
    - [9, 86.188]
  - - [1024, 3975, 1, 4096]
    - [8, 83.989]
  - - [4096, 3549, 1, 1024]
    - [7, 87.519]
  - - [4096, 3342, 1, 1024]
    - [7, 88.351]
  - - [1024, 3859, 1, 1024]
    - [65, 81.665]
  - - [1024, 3497, 1, 4096]
    - [6, 89.884]
  - - [4096, 3280, 1, 1024]
    - [7, 86.87]
  - - [1024, 3435, 1, 4096]
    - [8, 89.73]
  - - [1024, 3354, 1, 4096]
    - [8, 88.053]
  - - [4096, 3191, 1, 1024]
    - [6, 86.849]
  - - [4096, 3512, 1, 1024]
    - [6, 89.298]
  - - [1024, 3055, 1, 4096]
    - [12, 88.5]
  - - [4096, 2499, 1, 1024]
    - [6, 85.388]
  - - [1024, 3233, 1, 4096]
    - [14, 85.829]
  - - [4096, 3423, 1, 1024]
    - [6, 87.353]
  - - [1024, 3319, 1, 4096]
    - [8, 86.904]
  - - [4096, 3297, 1, 1024]
    - [7, 87.21]
  - - [4096, 3154, 1, 1024]
    - [7, 89.194]
  - - [1024, 3540, 1, 4096]
    - [7, 84.519]
  - - [1024, 3289, 1, 4096]
    - [14, 86.938]
  - - [4096, 3529, 1, 1024]
    - [7, 87.015]
  - - [4096, 3386, 1, 1024]
    - [77, 86.725]
  - - [4096, 3276, 1, 1024]
    - [7, 86.873]
  - - [1024, 3244, 1, 4096]
    - [14, 85.953]
  - - [1024, 3182, 1, 4096]
    - [14, 84.428]
  - - [4096, 3540, 1, 1024]
    - [7, 87.161]
  - - [1024, 3360, 1, 4096]
    - [8, 88.272]
  - - [1024, 3942, 1, 4096]
    - [8, 83.282]
  - - [4096, 3403, 1, 1024]
    - [77, 87.219]
  - - [4096, 3101, 1, 1024]
    - [7, 88.038]
  - - [4096, 2918, 1, 1024]
    - [11, 85.488]
  - - [1024, 3465, 1, 4096]
    - [6, 89.967]
  - - [33708, 3780, 1, 1024]
    - [9, 92.052]
  - - [4096, 3557, 1, 1024]
    - [7, 87.946]
  - - [4096, 3414, 1, 1024]
    - [77, 87.347]
  - - [1024, 3948, 1, 1024]
    - [14, 79.221]
  - - [4096, 3320, 1, 1024]
    - [7, 87.929]
  - - [4096, 2765, 1, 1024]
    - [6, 87.064]
  - - [1024, 3978, 1, 4096]
    - [8, 84.099]
  - - [4096, 3487, 1, 1024]
    - [6, 88.794]
  - - [4096, 3520, 1, 1024]
    - [6, 90.023]
  - - [1024, 3139, 1, 4096]
    - [14, 83.299]
  - - [1024, 3314, 1, 4096]
    - [8, 86.713]
  - - [4096, 3431, 1, 1024]
    - [77, 87.699]
  - - [123, 122, 528, 64]
    - [4, 24.813]
  - - [1024, 3446, 1, 4096]
    - [8, 90.23]
  - - [1024, 4059, 1, 4096]
    - [8, 85.629]
  - - [99, 102, 624, 64]
    - [17, 20.397]
  - - [4096, 3345, 1, 1024]
    - [7, 88.147]
  - - [4096, 3394, 1, 1024]
    - [6, 87.272]
  - - [1024, 3927, 1, 1024]
    - [41, 81.391]
  - - [4096, 3235, 1, 1024]
    - [6, 87.417]
  - - [1024, 3328, 1, 4096]
    - [8, 87.919]
  - - [33708, 3956, 1, 1024]
    - [9, 91.716]
  - - [4096, 3467, 1, 1024]
    - [6, 88.835]
  - - [1024, 3287, 1, 4096]
    - [14, 86.982]
  - - [4096, 3214, 1, 1024]
    - [6, 87.249]
  - - [4096, 3910, 1, 1024]
    - [9, 85.769]
  - - [1024, 3780, 1, 1024]
    - [7, 84.178]
  - - [1024, 3371, 1, 4096]
    - [8, 88.474]
  - - [4096, 3478, 1, 1024]
    - [6, 88.661]
  - - [1024, 3546, 1, 4096]
    - [7, 84.619]
  - - [1024, 4012, 1, 1024]
    - [14, 79.692]
  - - [4096, 3341, 1, 1024]
    - [7, 88.287]
  - - [4096, 3454, 1, 1024]
    - [77, 87.965]
  - - [4096, 3295, 1, 1024]
    - [7, 87.035]
  - - [4096, 3072, 1, 1024]
    - [6, 89.514]
  - - [1024, 3282, 1, 4096]
    - [14, 86.801]
  - - [33708, 3720, 1, 1024]
    - [9, 92.84]
  - - [1024, 3681, 1, 4096]
    - [7, 87.819]
  - - [1024, 4050, 1, 4096]
    - [8, 85.631]
  - - [4096, 3495, 1, 1024]
    - [6, 88.854]
  - - [4096, 3560, 1, 1024]
    - [7, 87.859]
  - - [4096, 3751, 1, 1024]
    - [7, 87.189]
  - - [1024, 3414, 1, 4096]
    - [8, 89.404]
  - - [33708, 3860, 1, 1024]
    - [46, 91.699]
  - - [1024, 3325, 1, 4096]
    - [8, 87.062]
  - - [4096, 3458, 1, 1024]
    - [6, 88.713]
  - - [4096, 2967, 1, 1024]
    - [6, 86.654]
  - - [1024, 3519, 1, 4096]
    - [6, 89.887]
  - - [4096, 3385, 1, 1024]
    - [77, 86.923]
  - - [4096, 3434, 1, 1024]
    - [6, 87.681]
  - - [1024, 3552, 1, 4096]
    - [7, 84.602]
  - - [4096, 3822, 1, 1024]
    - [7, 88.686]
  - - [1024, 3544, 1, 4096]
    - [7, 84.604]
  - - [4096, 3539, 1, 1024]
    - [7, 87.137]
  - - [4096, 3332, 1, 1024]
    - [7, 88.148]
  - - [1024, 3145, 1, 4096]
    - [14, 83.517]
  - - [1024, 3535, 1, 4096]
    - [7, 84.41]
  - - [1024, 3320, 1, 4096]
    - [8, 87.003]
  - - [33708, 4012, 1, 1024]
    - [9, 93.026]
  - - [4096, 3286, 1, 1024]
    - [7, 86.992]
  - - [1024, 3514, 1, 4096]
    - [6, 89.747]
  - - [93, 93, 688, 64]
    - [4, 23.511]
  - - [1024, 2765, 1, 4096]
    - [7, 87.18]
  - - [1024, 3452, 1, 4096]
    - [8, 90.312]
  - - [4096, 3518, 1, 1024]
    - [6, 89.343]
  - - [1024, 3529, 1, 4096]
    - [7, 84.309]
  - - [4096, 3413, 1, 1024]
    - [6, 87.239]
  - - [33708, 4050, 1, 1024]
    - [9, 91.84]
  - - [1024, 3525, 1, 4096]
    - [7, 84.193]
  - - [4096, 3303, 1, 1024]
    - [7, 87.589]
  - - [1024, 3382, 1, 4096]
    - [8, 88.493]
  - - [1024, 3390, 1, 4096]
    - [114, 88.359]
  - - [1024, 3977, 1, 4096]
    - [8, 84.21]
  - - [1024, 3184, 1, 4096]
    - [14, 84.434]
  - - [4096, 3535, 1, 1024]
    - [7, 87.277]
  - - [4096, 3376, 1, 1024]
    - [77, 86.845]
  - - [4096, 3978, 1, 1024]
    - [7, 87.089]
  - - [1024, 3136, 1, 4096]
    - [14, 83.184]
  - - [1024, 3293, 1, 4096]
    - [14, 87.019]
  - - [4096, 3266, 1, 1024]
    - [7, 86.511]
  - - [1024, 3487, 1, 4096]
    - [6, 90.241]
  - - [1024, 3409, 1, 4096]
    - [8, 89.286]
  - - [4096, 3498, 1, 1024]
    - [6, 89.086]
  - - [1024, 3520, 1, 4096]
    - [6, 90.316]
  - - [1024, 3530, 1, 4096]
    - [7, 84.387]
  - - [4096, 3393, 1, 1024]
    - [6, 87.413]
  - - [4096, 3140, 1, 1024]
    - [7, 88.998]
  - - [1024, 3536, 1, 4096]
    - [7, 84.466]
  - - [1024, 3288, 1, 4096]
    - [14, 86.984]
  - - [1024, 4005, 1, 4096]
    - [8, 84.707]
  - - [1024, 3579, 1, 4096]
    - [7, 85.666]
  - - [4096, 3372, 1, 1024]
    - [77, 86.73]
  - - [1024, 3440, 1, 4096]
    - [8, 90.185]
  - - [4096, 3213, 1, 1024]
    - [6, 86.526]
  - - [123, 123, 528, 64]
    - [4, 24.774]
  - - [100, 100, 624, 64]
    - [51, 20.359]
  - - [4096, 3477, 1, 1024]
    - [6, 88.899]
  - - [4096, 3526, 1, 1024]
    - [7, 85.899]
  - - [1024, 3493, 1, 4096]
    - [6, 89.806]
  - - [1024, 3944, 1, 4096]
    - [8, 83.185]
  - - [4096, 3453, 1, 1024]
    - [6, 88.106]
  - - [1024, 3350, 1, 4096]
    - [8, 88.033]
  - - [4096, 3184, 1, 1024]
    - [6, 86.934]
  - - [1024, 3423, 1, 4096]
    - [8, 89.603]
  - - [4096, 3351, 1, 1024]
    - [7, 88.502]
  - - [4096, 3416, 1, 1024]
    - [77, 87.375]
  - - [1024, 3796, 1, 4096]
    - [7, 90.62]
  - - [4096, 3257, 1, 1024]
    - [6, 87.549]
  - - [4096, 3306, 1, 1024]
    - [7, 87.399]
  - - [33708, 4020, 1, 1024]
    - [9, 93.428]
  - - [19, 19, 3264, 64]
    - [4, 9.362]
  - - [1024, 3426, 1, 4096]
    - [8, 89.644]
  - - [4096, 3457, 1, 1024]
    - [6, 88.591]
  - - [1024, 2935, 1, 4096]
    - [12, 85.063]
  - - [1024, 3046, 1, 4096]
    - [12, 88.374]
  - - [4096, 3433, 1, 1024]
    - [77, 87.655]
  - - [1024, 3256, 1, 4096]
    - [14, 86.234]
  - - [1024, 3531, 1, 4096]
    - [7, 84.325]
  - - [4096, 3180, 1, 1024]
    - [6, 86.7]
  - - [1024, 3388, 1, 4096]
    - [8, 88.809]
  - - [4096, 3444, 1, 1024]
    - [77, 87.77]
  - - [1024, 3501, 1, 4096]
    - [6, 89.706]
  - - [1024, 3266, 1, 4096]
    - [14, 86.511]
  - - [1024, 3267, 1, 4096]
    - [14, 86.659]
  - - [1024, 3461, 1, 4096]
    - [6, 90.148]
  - - [4096, 3870, 1, 1024]
    - [6, 87.669]
  - - [4096, 3517, 1, 1024]
    - [6, 89.21]
  - - [1024, 3566, 1, 4096]
    - [7, 85.226]
  - - [4096, 3574, 1, 1024]
    - [7, 88.355]
  - - [1024, 3876, 1, 1024]
    - [35, 81.805]
  - - [25, 25, 2512, 64]
    - [60, 12.239]
  - - [4096, 3720, 1, 1024]
    - [7, 86.436]
  - - [4096, 3248, 1, 1024]
    - [6, 87.369]
  - - [4096, 4059, 1, 1024]
    - [7, 88.606]
  - - [1024, 3380, 1, 4096]
    - [8, 88.821]
  - - [4096, 3480, 1, 1024]
    - [6, 88.843]
  - - [1024, 3335, 1, 4096]
    - [8, 87.42]
  - - [1024, 3345, 1, 4096]
    - [8, 87.816]
  - - [4096, 3391, 1, 1024]
    - [77, 87.124]
  - - [4096, 3424, 1, 1024]
    - [6, 87.378]
  - - [1024, 3394, 1, 4096]
    - [8, 88.549]
  - - [4096, 3265, 1, 1024]
    - [7, 86.376]
  - - [1024, 3014, 1, 4096]
    - [12, 88.082]
  - - [4096, 3497, 1, 1024]
    - [6, 89.037]
  - - [4096, 3354, 1, 1024]
    - [7, 88.458]
  - - [4096, 3055, 1, 1024]
    - [6, 88.813]
  - - [1024, 3499, 1, 4096]
    - [6, 89.936]
  - - [1024, 3162, 1, 4096]
    - [14, 83.686]
  - - [4096, 3244, 1, 1024]
    - [6, 86.547]
  - - [1024, 3437, 1, 4096]
    - [8, 90.069]
  - - [1024, 3356, 1, 4096]
    - [8, 88.142]
  - - [4096, 3139, 1, 1024]
    - [7, 89.023]
  - - [4096, 3508, 1, 1024]
    - [6, 89.089]
  - - [1024, 3235, 1, 4096]
    - [14, 85.967]
  - - [1024, 3910, 1, 4096]
    - [16, 91.492]
  - - [4096, 3371, 1, 1024]
    - [15, 86.364]
  - - [1024, 3751, 1, 4096]
    - [7, 89.511]
  - - [4096, 3325, 1, 1024]
    - [7, 88.111]
  - - [1024, 3413, 1, 4096]
    - [8, 89.242]
  - - [1024, 3542, 1, 4096]
    - [7, 84.609]
  - - [18, 18, 3440, 64]
    - [4, 8.807]
  - - [101, 102, 624, 64]
    - [70, 20.88]
  - - [33708, 3900, 1, 1024]
    - [9, 92.076]
  - - [4096, 3525, 1, 1024]
    - [7, 87.064]
  - - [4096, 3382, 1, 1024]
    - [77, 86.669]
  - - [102, 100, 624, 64]
    - [51, 20.58]
  - - [15, 15, 4096, 64]
    - [100, 8.255]
  - - [1024, 3339, 1, 4096]
    - [8, 87.646]
  - - [4096, 3288, 1, 1024]
    - [7, 86.093]
  - - [92, 92, 688, 64]
    - [60, 23.722]
  - - [1024, 3141, 1, 4096]
    - [14, 83.411]
  - - [1024, 3168, 1, 4096]
    - [41, 83.611]
  - - [4096, 3488, 1, 1024]
    - [6, 88.951]
  - - [4096, 3046, 1, 1024]
    - [6, 88.415]
  - - [1024, 3362, 1, 4096]
    - [8, 88.091]
  - - [33708, 3942, 1, 1024]
    - [9, 91.436]
  - - [4096, 3399, 1, 1024]
    - [6, 87.318]
  - - [1024, 3720, 1, 1024]
    - [7, 82.492]
  - - [4096, 3563, 1, 1024]
    - [7, 87.659]
  - - [1024, 3273, 1, 4096]
    - [14, 86.733]
  - - [4096, 3162, 1, 1024]
    - [7, 89.313]
  - - [1024, 3467, 1, 4096]
    - [6, 90.093]
  - - [1024, 3130, 1, 4096]
    - [41, 83.06]
  - - [1024, 3405, 1, 4096]
    - [8, 89.095]
  - - [4096, 3362, 1, 1024]
    - [77, 86.473]
  - - [1024, 3960, 1, 1024]
    - [14, 79.226]
  - - [2048, 128, 1, 4096]
    - [20, 48.633]
  - - [1024, 3712, 1, 36548]
    - [32, 90.16]
  - - [1024, 128, 1, 1024]
    - [60, 27.619]
  - - [3072, 128, 1, 4096]
    - [71, 71.091]
  - - [1024, 3712, 1, 1024]
    - [7, 82.586]
  - - [2, 16, 1, 768]
    - [25, 0.007]
  - - [2, 8, 1, 768]
    - [25, 0.004]
  - - [2, 64, 1, 768]
    - [28, 0.031]
  - - [1728, 320, 1, 64]
    - [60, 16.275]
  - - [1152, 128, 1, 784]
    - [62, 26.05]
  - - [576, 96, 1, 5329]
    - [72, 19.88]
  - - [864, 96, 1, 1225]
    - [60, 20.261]
  - - [256, 128, 1, 784]
    - [29, 7.017]
  - - [1440, 320, 1, 196]
    - [118, 24.819]
  - - [192, 48, 1, 1225]
    - [21, 2.57]
  - - [2592, 384, 1, 289]
    - [119, 46.631]
  - - [192, 80, 36, 10368]
    - [105, 61.915]
  - - [896, 192, 1, 289]
    - [57, 17.643]
  - - [768, 128, 1, 289]
    - [57, 11.038]
  - - [64, 256, 1, 3136]
    - [29, 6.014]
  - - [1280, 384, 1, 64]
    - [4, 14.615]
  - - [512, 144, 1, 196]
    - [25, 6.144]
  - - [1344, 192, 1, 289]
    - [120, 20.619]
  - - [288, 64, 1, 21609]
    - [29, 7.635]
  - - [400, 32, 1, 784]
    - [25, 2.758]
  - - [288, 32, 1, 21609]
    - [72, 3.819]
  - - [1280, 448, 1, 64]
    - [4, 16.706]
  - - [3456, 256, 1, 169]
    - [43, 33.358]
  - - [2304, 256, 1, 196]
    - [5, 28.162]
  - - [384, 192, 1, 1225]
    - [38, 18.417]
  - - [832, 48, 1, 49]
    - [121, 1.037]
  - - [832, 192, 1, 49]
    - [121, 3.919]
  - - [1280, 192, 1, 64]
    - [4, 8.438]
  - - [192, 32, 1, 784]
    - [21, 1.324]
  - - [288, 48, 1, 1225]
    - [22, 3.894]
  - - [512, 112, 1, 196]
    - [25, 4.87]
  - - [224, 192, 36, 2592]
    - [36, 82.924]
  - - [528, 32, 1, 196]
    - [28, 1.478]
  - - [192, 128, 36, 1568]
    - [94, 79.439]
  - - [4032, 384, 1, 64]
    - [5, 25.962]
  - - [576, 64, 1, 3136]
    - [25, 13.393]
  - - [2048, 32, 1, 1001]
    - [38, 14.782]
  - - [480, 64, 1, 196]
    - [25, 2.634]
  - - [512, 256, 1, 196]
    - [60, 9.981]
  - - [864, 96, 1, 289]
    - [57, 9.233]
  - - [896, 128, 1, 289]
    - [4, 12.447]
  - - [192, 64, 1, 784]
    - [85, 2.647]
  - - [1200, 64, 1, 1225]
    - [57, 18.434]
  - - [1296, 288, 1, 196]
    - [122, 22.428]
  - - [576, 96, 1, 5041]
    - [25, 19.971]
  - - [1024, 256, 1, 289]
    - [20, 21.075]
  - - [1024, 2048, 1, 49]
    - [6, 20.767]
  - - [192, 64, 36, 6272]
    - [123, 70.404]
  - - [192, 32, 1, 1225]
    - [28, 1.671]
  - - [1024, 256, 1, 196]
    - [20, 17.812]
  - - [1120, 192, 1, 289]
    - [57, 20.149]
  - - [400, 48, 1, 196]
    - [28, 1.647]
  - - [1728, 224, 1, 1225]
    - [40, 50.044]
  - - [800, 96, 1, 784]
    - [57, 15.685]
  - - [1152, 384, 1, 64]
    - [20, 13.574]
  - - [4608, 512, 1, 49]
    - [6, 22.652]
  - - [1792, 256, 1, 289]
    - [5, 26.674]
  - - [864, 128, 1, 784]
    - [57, 22.587]
  - - [1728, 384, 1, 169]
    - [5, 28.879]
  - - [480, 16, 1, 196]
    - [25, 0.665]
  - - [1568, 256, 1, 289]
    - [14, 28.726]
  - - [1152, 448, 1, 64]
    - [20, 15.345]
  - - [512, 64, 1, 196]
    - [21, 2.838]
  - - [1344, 224, 1, 289]
    - [120, 23.479]
  - - [9216, 512, 1, 4096]
    - [53, 86.754]
  - - [27, 32, 1, 22201]
    - [85, 0.313]
  - - [1152, 192, 1, 784]
    - [122, 36.69]
  - - [1536, 256, 1, 64]
    - [4, 12.601]
  - - [800, 128, 1, 196]
    - [60, 8.076]
  - - [800, 64, 1, 196]
    - [57, 4.348]
  - - [864, 208, 1, 196]
    - [4, 13.453]
  - - [1440, 320, 1, 49]
    - [112, 9.599]
  - - [512, 128, 1, 784]
    - [57, 13.385]
  - - [720, 192, 1, 5041]
    - [49, 38.159]
  - - [256, 64, 1, 784]
    - [29, 3.551]
  - - [256, 48, 1, 1225]
    - [21, 3.375]
  - - [576, 192, 1, 3136]
    - [79, 37.936]
  - - [160, 64, 1, 5329]
    - [21, 3.904]
  - - [3456, 384, 1, 289]
    - [16, 48.28]
  - - [32, 32, 36, 43808]
    - [72, 14.769]
  - - [1344, 512, 1, 64]
    - [20, 19.269]
  - - [192, 16, 1, 784]
    - [28, 0.654]
  - - [3456, 384, 1, 169]
    - [5, 40.269]
  - - [1152, 256, 1, 196]
    - [14, 19.735]
  - - [1728, 192, 1, 1225]
    - [124, 46.844]
  - - [2048, 512, 1, 49]
    - [5, 17.152]
  - - [576, 96, 1, 1225]
    - [22, 14.468]
  - - [512, 2048, 1, 49]
    - [5, 16.193]
  - - [1728, 192, 1, 64]
    - [4, 10.752]
  - - [832, 256, 1, 49]
    - [45, 5.003]
  - - [512, 128, 1, 196]
    - [25, 5.566]
  - - [1200, 128, 1, 49]
    - [125, 3.769]
  - - [528, 256, 1, 196]
    - [4, 10.204]
  - - [256, 512, 1, 784]
    - [49, 23.272]
  - - [480, 192, 1, 196]
    - [57, 7.608]
  - - [96, 64, 36, 2592]
    - [49, 48.657]
  - - [96, 96, 36, 2592]
    - [60, 57.245]
  - - [1024, 192, 1, 289]
    - [45, 18.829]
  - - [1536, 384, 1, 64]
    - [20, 17.012]
  - - [192, 96, 1, 784]
    - [72, 3.971]
  - - [2048, 192, 1, 64]
    - [4, 12.195]
  - - [192, 64, 1, 1225]
    - [22, 3.325]
  - - [512, 32, 1, 196]
    - [25, 1.462]
  - - [128, 96, 36, 1568]
    - [41, 64.586]
  - - [528, 128, 1, 196]
    - [25, 5.685]
  - - [128, 512, 1, 784]
    - [4, 13.462]
  - - [128, 128, 36, 3136]
    - [14, 64.37]
  - - [528, 160, 1, 196]
    - [72, 6.784]
  - - [448, 64, 1, 5329]
    - [28, 10.844]
  - - [1280, 320, 1, 64]
    - [4, 13.274]
  - - [1792, 320, 1, 289]
    - [118, 34.417]
  - - [2880, 320, 1, 64]
    - [4, 20.29]
  - - [147, 64, 1, 12544]
    - [72, 3.885]
  - - [4096, 512, 1, 1001]
    - [126, 68.804]
  - - [1536, 32, 1, 1001]
    - [21, 11.794]
  - - [512, 160, 1, 196]
    - [25, 6.762]
  - - [768, 160, 1, 289]
    - [60, 13.336]
  - - [1728, 384, 1, 49]
    - [5, 12.11]
  - - [64, 32, 36, 43808]
    - [127, 26.269]
  - - [64, 64, 1, 3136]
    - [21, 1.48]
  - - [256, 32, 1, 784]
    - [21, 1.765]
  - - [480, 96, 1, 196]
    - [25, 4.07]
  - - [1024, 32, 1, 1001]
    - [21, 8.078]
  - - [832, 160, 1, 49]
    - [125, 3.303]
  - - [512, 1024, 1, 196]
    - [5, 25.872]
  - - [2048, 64, 1, 1001]
    - [4, 24.843]
  - - [2048, 128, 1, 1001]
    - [128, 34.08]
  - - [1536, 64, 1, 1001]
    - [57, 22.742]
  - - [32, 32, 64, 40000]
    - [57, 21.021]
  - - [224, 192, 36, 5184]
    - [103, 79.185]
  - - [32, 32, 49, 115200]
    - [57, 18.546]
  - - [384, 448, 49, 512]
    - [11, 80.841]
  - - [192, 80, 36, 20736]
    - [95, 57.898]
  - - [384, 448, 64, 256]
    - [13, 69.109]
  - - [96, 64, 64, 18432]
    - [92, 51.796]
  - - [224, 192, 64, 4608]
    - [12, 78.152]
  - - [96, 96, 49, 3136]
    - [92, 48.459]
  - - [224, 192, 64, 2304]
    - [89, 77.056]
  - - [64, 32, 49, 57600]
    - [129, 29.754]
  - - [384, 448, 36, 256]
    - [6, 68.113]
  - - [96, 64, 36, 10368]
    - [103, 51.366]
  - - [96, 64, 36, 20736]
    - [38, 52.85]
  - - [192, 80, 49, 14400]
    - [9, 69.359]
  - - [96, 64, 49, 6272]
    - [18, 55.114]
  - - [64, 32, 49, 115200]
    - [57, 29.443]
  - - [384, 448, 49, 256]
    - [70, 68.343]
  - - [96, 96, 64, 2304]
    - [130, 49.549]
  - - [96, 96, 49, 6272]
    - [43, 45.522]
  - - [224, 192, 49, 6272]
    - [131, 76.583]
  - - [96, 96, 36, 10368]
    - [18, 62.762]
  - - [96, 64, 36, 5184]
    - [38, 50.169]
  - - [384, 448, 64, 512]
    - [65, 81.713]
  - - [224, 192, 49, 3136]
    - [89, 77.845]
  - - [384, 448, 36, 512]
    - [6, 79.433]
  - - [32, 32, 36, 175232]
    - [57, 12.758]
  - - [224, 192, 36, 10368]
    - [92, 80.794]
  - - [64, 32, 64, 40000]
    - [39, 29.935]
  - - [96, 64, 64, 4608]
    - [58, 52.11]
  - - [32, 32, 49, 57600]
    - [72, 18.887]
  - - [192, 80, 36, 41472]
    - [81, 58.521]
  - - [32, 32, 36, 87616]
    - [129, 14.412]
  - - [192, 80, 49, 28800]
    - [130, 70.414]
  - - [96, 64, 49, 28800]
    - [18, 60.17]
  - - [96, 64, 36, 41472]
    - [131, 52.742]
  - - [192, 80, 64, 9216]
    - [48, 57.766]
  - - [96, 96, 36, 5184]
    - [18, 59.486]
  - - [32, 32, 64, 80000]
    - [57, 21.174]
  - - [96, 64, 64, 2304]
    - [58, 49.132]
  - - [96, 64, 49, 3136]
    - [18, 50.174]
  - - [64, 32, 36, 87616]
    - [57, 26.605]
  - - [64, 32, 64, 80000]
    - [105, 29.814]
  - - [96, 96, 64, 4608]
    - [18, 53.769]
  - - [64, 32, 36, 175232]
    - [103, 23.655]
  - - [64, 64, 11, 233600]
    - [57, 7.614]
  - - [320, 256, 9, 19584]
    - [132, 76.115]
  - - [256, 224, 9, 9792]
    - [89, 62.023]
  - - [128, 128, 11, 3264]
    - [48, 47.766]
  - - [256, 256, 9, 4896]
    - [41, 73.237]
  - - [320, 256, 9, 4896]
    - [81, 74.966]
  - - [224, 192, 9, 19584]
    - [18, 76.579]
  - - [192, 192, 11, 3264]
    - [133, 71.606]
  - - [64, 64, 11, 116800]
    - [109, 17.281]
  - - [64, 64, 9, 172864]
    - [57, 13.071]
  - - [192, 128, 11, 6528]
    - [20, 52.6]
  - - [64, 64, 11, 58400]
    - [29, 17.934]
  - - [192, 160, 9, 19584]
    - [18, 54.773]
  - - [128, 128, 9, 9792]
    - [103, 43.996]
  - - [128, 128, 11, 6528]
    - [48, 52.083]
  - - [192, 192, 11, 6528]
    - [133, 75.408]
  - - [160, 160, 9, 4896]
    - [4, 47.071]
  - - [192, 192, 9, 4896]
    - [4, 67.532]
  - - [256, 256, 11, 13056]
    - [56, 74.025]
  - - [224, 192, 11, 6528]
    - [41, 57.441]
  - - [192, 192, 9, 19584]
    - [18, 65.566]
  - - [256, 224, 11, 13056]
    - [48, 74.797]
  - - [224, 192, 11, 13056]
    - [91, 57.823]
  - - [256, 256, 11, 3264]
    - [134, 69.037]
  - - [192, 160, 11, 13056]
    - [18, 66.077]
  - - [320, 256, 11, 6528]
    - [101, 89.622]
  - - [192, 192, 9, 9792]
    - [18, 63.962]
  - - [192, 160, 11, 6528]
    - [20, 65.275]
  - - [224, 224, 9, 9792]
    - [91, 55.278]
  - - [64, 64, 9, 86432]
    - [29, 14.522]
  - - [224, 192, 11, 3264]
    - [41, 55.361]
  - - [128, 128, 9, 19584]
    - [103, 45.298]
  - - [224, 224, 11, 6528]
    - [36, 66.849]
  - - [160, 160, 11, 13056]
    - [18, 55.433]
  - - [160, 160, 9, 19584]
    - [18, 45.933]
  - - [192, 128, 9, 19584]
    - [103, 67.454]
  - - [192, 160, 9, 9792]
    - [20, 54.443]
  - - [224, 224, 9, 19584]
    - [105, 54.336]
  - - [192, 192, 11, 13056]
    - [71, 77.515]
  - - [192, 128, 9, 4896]
    - [91, 65.158]
  - - [320, 256, 9, 9792]
    - [101, 75.035]
  - - [320, 256, 11, 13056]
    - [101, 91.954]
  - - [64, 64, 9, 345728]
    - [79, 6.381]
  - - [128, 128, 9, 4896]
    - [91, 43.613]
  - - [256, 256, 9, 9792]
    - [41, 70.729]
  - - [224, 224, 9, 4896]
    - [68, 62.391]
  - - [320, 256, 11, 3264]
    - [95, 85.683]
  - - [256, 256, 11, 6528]
    - [56, 72.186]
  - - [224, 192, 9, 4896]
    - [135, 69.098]
  - - [256, 224, 9, 19584]
    - [92, 62.183]
  - - [192, 128, 11, 3264]
    - [20, 50.592]
  - - [224, 224, 11, 13056]
    - [105, 66.1]
  - - [224, 224, 11, 3264]
    - [36, 64.847]
  - - [160, 160, 11, 3264]
    - [20, 51.843]
  - - [256, 224, 11, 6528]
    - [14, 73.845]
  - - [128, 128, 11, 13056]
    - [131, 54.858]
  - - [192, 160, 9, 4896]
    - [4, 57.388]
  - - [256, 224, 11, 3264]
    - [14, 71.649]
  - - [160, 160, 9, 9792]
    - [18, 44.829]
  - - [192, 160, 11, 3264]
    - [20, 60.251]
  - - [256, 256, 9, 19584]
    - [131, 70.394]
  - - [192, 128, 11, 13056]
    - [18, 53.073]
  - - [224, 192, 9, 9792]
    - [18, 73.498]
  - - [160, 160, 11, 6528]
    - [18, 53.552]
  - - [256, 224, 9, 4896]
    - [68, 68.392]
  - - [192, 128, 9, 9792]
    - [105, 65.551]
  - - [1024, 6400, 1, 65]
    - [6, 33.271]
  - - [4096, 6400, 1, 256]
    - [13, 78.007]
  - - [4096, 64, 1, 1024]
    - [47, 39.795]
  - - [18, 18, 648, 64]
    - [4, 5.822]
  - - [49, 49, 160, 64]
    - [60, 9.72]
  - - [54, 54, 592, 64]
    - [5, 18.04]
  - - [59, 59, 512, 64]
    - [5, 19.847]
  - - [64, 64, 496, 64]
    - [107, 22.624]
  - - [104, 104, 16, 64]
    - [74, 5.672]
  - - [135, 135, 32, 64]
    - [4, 13.788]
  - - [512, 3194, 1, 2048]
    - [8, 76.928]
  - - [512, 3222, 1, 2048]
    - [114, 78.889]
  - - [512, 3234, 1, 2048]
    - [114, 79.389]
  - - [512, 3242, 1, 2048]
    - [76, 79.092]
  - - [512, 3257, 1, 2048]
    - [114, 79.335]
  - - [512, 3332, 1, 2048]
    - [114, 81.541]
  - - [512, 3336, 1, 2048]
    - [6, 81.554]
  - - [512, 3378, 1, 2048]
    - [114, 82.41]
  - - [512, 3396, 1, 2048]
    - [95, 81.794]
  - - [512, 3399, 1, 2048]
    - [10, 81.866]
  - - [512, 3451, 1, 2048]
    - [8, 82.655]
  - - [512, 3456, 1, 2048]
    - [114, 86.046]
  - - [512, 3458, 1, 2048]
    - [6, 84.015]
  - - [512, 3467, 1, 2048]
    - [12, 82.954]
  - - [512, 3468, 1, 2048]
    - [10, 83.485]
  - - [512, 3470, 1, 2048]
    - [96, 83.279]
  - - [512, 3477, 1, 2048]
    - [10, 83.532]
  - - [512, 3478, 1, 2048]
    - [96, 82.924]
  - - [512, 3495, 1, 2048]
    - [12, 83.035]
  - - [512, 3507, 1, 2048]
    - [10, 83.446]
  - - [512, 3515, 1, 2048]
    - [10, 83.259]
  - - [512, 3517, 1, 2048]
    - [12, 83.433]
  - - [2048, 2864, 1, 512]
    - [7, 80.32]
  - - [2048, 3287, 1, 512]
    - [7, 81.324]
  - - [2048, 3412, 1, 512]
    - [6, 79.623]
  - - [2048, 3456, 1, 512]
    - [6, 82.15]
  - - [2048, 3466, 1, 512]
    - [6, 81.445]
  - - [2048, 3476, 1, 512]
    - [6, 81.156]
  - - [2048, 3999, 1, 512]
    - [107, 79.501]
  - - [33708, 189, 1, 512]
    - [37, 72.916]
  - - [33708, 2496, 1, 512]
    - [9, 87.89]
  - - [33708, 3864, 1, 512]
    - [9, 87.803]
  - - [33708, 3969, 1, 512]
    - [9, 88.149]
  - - [33708, 3995, 1, 512]
    - [9, 88.555]
  - - [7, 7, 736, 64]
    - [100, 1.107]
  - - [8, 8, 264, 64]
    - [22, 0.587]
  - - [9, 9, 416, 64]
    - [22, 1.104]
  - - [10, 10, 448, 64]
    - [21, 1.538]
  - - [11, 11, 568, 64]
    - [66, 2.131]
  - - [12, 12, 480, 64]
    - [22, 2.265]
  - - [12, 12, 2520, 64]
    - [116, 5.597]
  - - [13, 13, 576, 64]
    - [100, 3.019]
  - - [13, 13, 2336, 64]
    - [66, 6.122]
  - - [14, 14, 704, 64]
    - [100, 4.103]
  - - [14, 14, 2184, 64]
    - [100, 6.332]
  - - [15, 15, 688, 64]
    - [66, 4.335]
  - - [15, 15, 2048, 64]
    - [100, 6.886]
  - - [16, 16, 712, 64]
    - [100, 5.365]
  - - [16, 16, 1920, 64]
    - [100, 7.663]
  - - [17, 17, 688, 64]
    - [20, 4.819]
  - - [17, 17, 1816, 64]
    - [4, 7.42]
  - - [18, 18, 1720, 64]
    - [4, 7.918]
  - - [19, 19, 680, 64]
    - [47, 5.9]
  - - [19, 19, 1632, 64]
    - [4, 8.496]
  - - [21, 21, 1472, 64]
    - [60, 9.362]
  - - [21, 21, 1488, 64]
    - [4, 9.278]
  - - [23, 23, 64, 64]
    - [4, 1.285]
  - - [23, 23, 1360, 64]
    - [60, 10.122]
  - - [25, 25, 176, 64]
    - [66, 3.375]
  - - [25, 25, 1256, 64]
    - [4, 10.991]
  - - [26, 26, 56, 64]
    - [25, 1.382]
  - - [26, 27, 56, 64]
    - [25, 1.4]
  - - [27, 27, 56, 64]
    - [66, 1.436]
  - - [27, 27, 1168, 64]
    - [4, 11.98]
  - - [29, 29, 136, 64]
    - [22, 3.927]
  - - [29, 29, 1088, 64]
    - [4, 12.936]
  - - [32, 32, 624, 64]
    - [20, 13.551]
  - - [32, 32, 992, 64]
    - [4, 14.872]
  - - [35, 35, 384, 64]
    - [66, 8.697]
  - - [35, 35, 904, 64]
    - [74, 11.286]
  - - [38, 38, 320, 64]
    - [100, 9.32]
  - - [38, 38, 840, 64]
    - [74, 12.768]
  - - [41, 41, 312, 64]
    - [74, 10.221]
  - - [41, 41, 776, 64]
    - [5, 13.782]
  - - [45, 45, 392, 64]
    - [5, 12.649]
  - - [45, 45, 712, 64]
    - [74, 14.905]
  - - [49, 49, 648, 64]
    - [5, 17.127]
  - - [54, 54, 200, 64]
    - [4, 12.553]
  - - [59, 59, 544, 64]
    - [5, 20.08]
  - - [64, 65, 496, 64]
    - [26, 19.074]
  - - [65, 65, 472, 64]
    - [4, 15.018]
  - - [65, 65, 496, 64]
    - [4, 15.225]
  - - [70, 70, 216, 64]
    - [4, 14.819]
  - - [70, 71, 216, 64]
    - [60, 14.958]
  - - [71, 71, 216, 64]
    - [4, 15.703]
  - - [71, 71, 448, 64]
    - [4, 16.831]
  - - [77, 77, 248, 64]
    - [4, 17.31]
  - - [77, 77, 408, 64]
    - [19, 18.857]
  - - [77, 78, 248, 64]
    - [60, 17.323]
  - - [77, 78, 408, 64]
    - [19, 19.153]
  - - [78, 78, 248, 64]
    - [4, 18.133]
  - - [78, 78, 408, 64]
    - [19, 19.561]
  - - [80, 80, 152, 64]
    - [4, 17.758]
  - - [80, 84, 152, 64]
    - [4, 17.748]
  - - [84, 84, 152, 64]
    - [60, 17.778]
  - - [85, 85, 376, 64]
    - [19, 20.352]
  - - [91, 91, 40, 64]
    - [4, 10.273]
  - - [91, 93, 40, 64]
    - [60, 10.17]
  - - [93, 93, 40, 64]
    - [60, 10.615]
  - - [93, 93, 344, 64]
    - [4, 22.289]
  - - [102, 102, 56, 64]
    - [20, 13.027]
  - - [102, 102, 312, 64]
    - [5, 19.836]
  - - [103, 103, 16, 64]
    - [4, 5.693]
  - - [103, 104, 16, 64]
    - [100, 5.748]
  - - [112, 112, 16, 64]
    - [100, 6.81]
  - - [112, 112, 288, 64]
    - [5, 23.627]
  - - [112, 123, 16, 64]
    - [63, 7.392]
  - - [119, 119, 32, 64]
    - [60, 12.567]
  - - [119, 135, 32, 64]
    - [4, 13.358]
  - - [122, 122, 264, 64]
    - [5, 24.268]
  - - [123, 122, 264, 64]
    - [5, 23.854]
  - - [123, 123, 16, 64]
    - [4, 8.025]
  - - [123, 123, 264, 64]
    - [5, 24.355]
  - - [134, 134, 240, 64]
    - [111, 22.517]
  - - [135, 134, 240, 64]
    - [51, 21.969]
  - - [135, 135, 240, 64]
    - [51, 22.289]
  - - [256, 1, 1, 4]
    - [136, 0.001]
  - - [2, 1, 1, 1024]
    - [21, 0.0]
  - - [1024, 1, 1, 1024]
    - [25, 0.286]
  - - [512, 2790, 1, 2048]
    - [41, 75.685]
  - - [512, 2864, 1, 2048]
    - [41, 77.381]
  - - [512, 3092, 1, 2048]
    - [8, 75.667]
  - - [512, 3113, 1, 2048]
    - [114, 76.3]
  - - [512, 3137, 1, 2048]
    - [95, 76.61]
  - - [512, 3165, 1, 2048]
    - [8, 76.975]
  - - [512, 3166, 1, 2048]
    - [95, 76.527]
  - - [512, 3219, 1, 2048]
    - [95, 78.898]
  - - [512, 3237, 1, 2048]
    - [114, 79.011]
  - - [512, 3246, 1, 2048]
    - [76, 78.905]
  - - [512, 3249, 1, 2048]
    - [114, 79.263]
  - - [512, 3251, 1, 2048]
    - [114, 79.641]
  - - [512, 3262, 1, 2048]
    - [114, 79.457]
  - - [512, 3268, 1, 2048]
    - [6, 79.114]
  - - [512, 3282, 1, 2048]
    - [95, 79.29]
  - - [512, 3286, 1, 2048]
    - [78, 79.631]
  - - [512, 3287, 1, 2048]
    - [114, 79.289]
  - - [512, 3293, 1, 2048]
    - [95, 79.842]
  - - [512, 3297, 1, 2048]
    - [8, 79.612]
  - - [512, 3307, 1, 2048]
    - [8, 79.691]
  - - [512, 3314, 1, 2048]
    - [8, 80.186]
  - - [512, 3315, 1, 2048]
    - [114, 79.68]
  - - [512, 3319, 1, 2048]
    - [12, 79.695]
  - - [512, 3322, 1, 2048]
    - [8, 80.504]
  - - [512, 3323, 1, 2048]
    - [8, 79.792]
  - - [512, 3324, 1, 2048]
    - [8, 79.654]
  - - [512, 3325, 1, 2048]
    - [8, 80.043]
  - - [512, 3327, 1, 2048]
    - [95, 79.847]
  - - [512, 3329, 1, 2048]
    - [6, 81.299]
  - - [512, 3339, 1, 2048]
    - [78, 81.501]
  - - [512, 3342, 1, 2048]
    - [78, 82.083]
  - - [512, 3344, 1, 2048]
    - [78, 81.581]
  - - [512, 3358, 1, 2048]
    - [114, 81.88]
  - - [512, 3360, 1, 2048]
    - [8, 81.76]
  - - [512, 3364, 1, 2048]
    - [110, 81.9]
  - - [512, 3365, 1, 2048]
    - [114, 82.093]
  - - [512, 3369, 1, 2048]
    - [78, 82.191]
  - - [512, 3371, 1, 2048]
    - [114, 82.155]
  - - [512, 3374, 1, 2048]
    - [114, 82.016]
  - - [512, 3376, 1, 2048]
    - [137, 82.107]
  - - [512, 3377, 1, 2048]
    - [114, 82.471]
  - - [512, 3381, 1, 2048]
    - [114, 82.569]
  - - [512, 3382, 1, 2048]
    - [78, 82.168]
  - - [512, 3383, 1, 2048]
    - [114, 82.362]
  - - [512, 3384, 1, 2048]
    - [78, 82.006]
  - - [512, 3385, 1, 2048]
    - [78, 82.115]
  - - [512, 3386, 1, 2048]
    - [137, 82.055]
  - - [512, 3388, 1, 2048]
    - [8, 82.399]
  - - [512, 3390, 1, 2048]
    - [114, 82.788]
  - - [512, 3391, 1, 2048]
    - [114, 82.387]
  - - [512, 3402, 1, 2048]
    - [95, 82.274]
  - - [512, 3410, 1, 2048]
    - [76, 82.047]
  - - [512, 3412, 1, 2048]
    - [8, 82.431]
  - - [512, 3414, 1, 2048]
    - [8, 82.606]
  - - [512, 3415, 1, 2048]
    - [8, 82.168]
  - - [512, 3418, 1, 2048]
    - [8, 82.83]
  - - [512, 3420, 1, 2048]
    - [8, 82.414]
  - - [512, 3422, 1, 2048]
    - [114, 82.715]
  - - [512, 3425, 1, 2048]
    - [8, 82.661]
  - - [512, 3426, 1, 2048]
    - [114, 82.432]
  - - [512, 3427, 1, 2048]
    - [114, 82.624]
  - - [512, 3428, 1, 2048]
    - [8, 82.606]
  - - [512, 3430, 1, 2048]
    - [114, 82.739]
  - - [512, 3431, 1, 2048]
    - [8, 82.637]
  - - [512, 3432, 1, 2048]
    - [114, 82.451]
  - - [512, 3438, 1, 2048]
    - [8, 82.847]
  - - [512, 3439, 1, 2048]
    - [8, 82.284]
  - - [512, 3440, 1, 2048]
    - [8, 82.896]
  - - [512, 3443, 1, 2048]
    - [8, 82.841]
  - - [512, 3445, 1, 2048]
    - [8, 82.847]
  - - [512, 3447, 1, 2048]
    - [8, 83.276]
  - - [512, 3448, 1, 2048]
    - [114, 82.793]
  - - [512, 3450, 1, 2048]
    - [114, 82.841]
  - - [512, 3452, 1, 2048]
    - [114, 82.889]
  - - [512, 3453, 1, 2048]
    - [8, 82.703]
  - - [512, 3455, 1, 2048]
    - [8, 82.667]
  - - [512, 3457, 1, 2048]
    - [12, 83.093]
  - - [512, 3459, 1, 2048]
    - [6, 83.738]
  - - [512, 3460, 1, 2048]
    - [12, 83.123]
  - - [512, 3461, 1, 2048]
    - [12, 83.53]
  - - [512, 3462, 1, 2048]
    - [12, 83.468]
  - - [512, 3466, 1, 2048]
    - [6, 83.225]
  - - [512, 3471, 1, 2048]
    - [12, 83.176]
  - - [512, 3472, 1, 2048]
    - [10, 83.709]
  - - [512, 3475, 1, 2048]
    - [12, 83.187]
  - - [512, 3476, 1, 2048]
    - [10, 82.834]
  - - [512, 3479, 1, 2048]
    - [96, 83.41]
  - - [512, 3480, 1, 2048]
    - [10, 83.434]
  - - [512, 3481, 1, 2048]
    - [10, 82.87]
  - - [512, 3483, 1, 2048]
    - [10, 83.379]
  - - [512, 3484, 1, 2048]
    - [12, 82.774]
  - - [512, 3487, 1, 2048]
    - [96, 83.264]
  - - [512, 3489, 1, 2048]
    - [10, 83.312]
  - - [512, 3490, 1, 2048]
    - [10, 82.917]
  - - [512, 3491, 1, 2048]
    - [12, 83.402]
  - - [512, 3493, 1, 2048]
    - [10, 83.071]
  - - [512, 3494, 1, 2048]
    - [12, 82.845]
  - - [512, 3497, 1, 2048]
    - [12, 83.083]
  - - [512, 3498, 1, 2048]
    - [12, 83.023]
  - - [512, 3499, 1, 2048]
    - [10, 83.13]
  - - [512, 3501, 1, 2048]
    - [12, 83.011]
  - - [512, 3503, 1, 2048]
    - [10, 83.309]
  - - [512, 3508, 1, 2048]
    - [10, 83.344]
  - - [512, 3509, 1, 2048]
    - [96, 82.951]
  - - [512, 3511, 1, 2048]
    - [12, 83.584]
  - - [512, 3514, 1, 2048]
    - [12, 83.361]
  - - [512, 3518, 1, 2048]
    - [12, 83.331]
  - - [512, 3519, 1, 2048]
    - [10, 83.774]
  - - [512, 3520, 1, 2048]
    - [12, 84.997]
  - - [512, 3523, 1, 2048]
    - [138, 76.79]
  - - [512, 3528, 1, 2048]
    - [138, 77.363]
  - - [512, 3529, 1, 2048]
    - [46, 77.134]
  - - [512, 3530, 1, 2048]
    - [32, 76.978]
  - - [512, 3532, 1, 2048]
    - [138, 77.307]
  - - [512, 3533, 1, 2048]
    - [46, 76.831]
  - - [512, 3534, 1, 2048]
    - [138, 77.136]
  - - [512, 3538, 1, 2048]
    - [32, 77.474]
  - - [512, 3539, 1, 2048]
    - [32, 77.103]
  - - [512, 3541, 1, 2048]
    - [138, 77.111]
  - - [512, 3547, 1, 2048]
    - [138, 77.135]
  - - [512, 3548, 1, 2048]
    - [139, 76.804]
  - - [512, 3552, 1, 2048]
    - [138, 77.138]
  - - [512, 3564, 1, 2048]
    - [32, 77.291]
  - - [512, 3575, 1, 2048]
    - [32, 77.637]
  - - [512, 3598, 1, 2048]
    - [32, 77.144]
  - - [512, 3599, 1, 2048]
    - [139, 76.99]
  - - [512, 3608, 1, 2048]
    - [32, 79.486]
  - - [512, 3780, 1, 512]
    - [14, 69.128]
  - - [512, 3780, 1, 2048]
    - [46, 82.889]
  - - [512, 3796, 1, 512]
    - [58, 69.744]
  - - [512, 3796, 1, 2048]
    - [32, 82.702]
  - - [512, 3822, 1, 512]
    - [14, 69.252]
  - - [512, 3822, 1, 2048]
    - [138, 82.963]
  - - [512, 3840, 1, 512]
    - [14, 70.553]
  - - [512, 3840, 1, 2048]
    - [32, 83.124]
  - - [512, 3859, 1, 512]
    - [14, 69.709]
  - - [512, 3859, 1, 2048]
    - [32, 83.193]
  - - [512, 3870, 1, 512]
    - [58, 69.694]
  - - [512, 3870, 1, 2048]
    - [32, 83.582]
  - - [512, 3876, 1, 512]
    - [58, 69.909]
  - - [512, 3876, 1, 2048]
    - [32, 83.674]
  - - [512, 3906, 1, 512]
    - [14, 70.992]
  - - [512, 3906, 1, 2048]
    - [14, 81.962]
  - - [512, 3910, 1, 512]
    - [14, 70.2]
  - - [512, 3910, 1, 2048]
    - [14, 82.046]
  - - [512, 3925, 1, 512]
    - [14, 70.257]
  - - [512, 3925, 1, 2048]
    - [41, 82.434]
  - - [512, 3927, 1, 512]
    - [14, 69.764]
  - - [512, 3942, 1, 512]
    - [58, 67.591]
  - - [512, 3942, 1, 2048]
    - [12, 76.754]
  - - [512, 3944, 1, 512]
    - [14, 67.235]
  - - [512, 3944, 1, 2048]
    - [12, 77.174]
  - - [512, 3955, 1, 512]
    - [14, 67.52]
  - - [512, 3955, 1, 2048]
    - [96, 76.785]
  - - [512, 3968, 1, 512]
    - [14, 68.135]
  - - [512, 3968, 1, 2048]
    - [12, 77.934]
  - - [512, 3969, 1, 512]
    - [58, 67.37]
  - - [512, 3969, 1, 2048]
    - [10, 78.312]
  - - [512, 3976, 1, 512]
    - [14, 68.174]
  - - [512, 3976, 1, 2048]
    - [12, 78.091]
  - - [512, 3977, 1, 512]
    - [14, 67.408]
  - - [512, 3977, 1, 2048]
    - [96, 77.884]
  - - [512, 3978, 1, 512]
    - [14, 68.208]
  - - [512, 3978, 1, 2048]
    - [12, 78.195]
  - - [512, 3990, 1, 512]
    - [14, 67.823]
  - - [512, 3990, 1, 2048]
    - [96, 77.945]
  - - [512, 3995, 1, 512]
    - [14, 67.713]
  - - [512, 3995, 1, 2048]
    - [10, 77.85]
  - - [512, 3996, 1, 512]
    - [58, 67.44]
  - - [512, 3996, 1, 2048]
    - [12, 78.062]
  - - [512, 3999, 1, 512]
    - [58, 67.107]
  - - [512, 3999, 1, 2048]
    - [10, 78.315]
  - - [512, 4005, 1, 512]
    - [14, 68.079]
  - - [512, 4005, 1, 2048]
    - [12, 78.433]
  - - [512, 4012, 1, 512]
    - [14, 67.517]
  - - [512, 4012, 1, 2048]
    - [12, 78.148]
  - - [512, 4020, 1, 512]
    - [14, 67.942]
  - - [512, 4020, 1, 2048]
    - [10, 78.111]
  - - [512, 4026, 1, 512]
    - [14, 67.752]
  - - [512, 4026, 1, 2048]
    - [10, 78.357]
  - - [512, 4030, 1, 512]
    - [14, 67.245]
  - - [512, 4030, 1, 2048]
    - [12, 77.985]
  - - [512, 4032, 1, 512]
    - [14, 69.335]
  - - [512, 4032, 1, 2048]
    - [10, 79.555]
  - - [512, 4050, 1, 512]
    - [58, 68.646]
  - - [512, 4059, 1, 512]
    - [58, 68.601]
  - - [2048, 2790, 1, 512]
    - [7, 79.423]
  - - [2048, 3092, 1, 512]
    - [58, 78.094]
  - - [2048, 3113, 1, 512]
    - [58, 77.834]
  - - [2048, 3137, 1, 512]
    - [96, 77.816]
  - - [2048, 3165, 1, 512]
    - [65, 78.429]
  - - [2048, 3166, 1, 512]
    - [35, 78.207]
  - - [2048, 3194, 1, 512]
    - [7, 79.397]
  - - [2048, 3219, 1, 512]
    - [35, 79.725]
  - - [2048, 3222, 1, 512]
    - [7, 79.925]
  - - [2048, 3234, 1, 512]
    - [7, 80.18]
  - - [2048, 3237, 1, 512]
    - [7, 79.877]
  - - [2048, 3242, 1, 512]
    - [7, 79.918]
  - - [2048, 3246, 1, 512]
    - [35, 79.891]
  - - [2048, 3249, 1, 512]
    - [7, 79.923]
  - - [2048, 3251, 1, 512]
    - [65, 80.181]
  - - [2048, 3257, 1, 512]
    - [35, 80.037]
  - - [2048, 3262, 1, 512]
    - [7, 80.369]
  - - [2048, 3268, 1, 512]
    - [7, 81.108]
  - - [2048, 3282, 1, 512]
    - [7, 81.2]
  - - [2048, 3286, 1, 512]
    - [7, 81.171]
  - - [2048, 3293, 1, 512]
    - [7, 81.729]
  - - [2048, 3297, 1, 512]
    - [7, 81.401]
  - - [2048, 3307, 1, 512]
    - [7, 81.733]
  - - [2048, 3314, 1, 512]
    - [7, 81.735]
  - - [2048, 3315, 1, 512]
    - [7, 81.717]
  - - [2048, 3319, 1, 512]
    - [7, 82.116]
  - - [2048, 3322, 1, 512]
    - [7, 82.276]
  - - [2048, 3323, 1, 512]
    - [7, 82.085]
  - - [2048, 3324, 1, 512]
    - [7, 82.11]
  - - [2048, 3325, 1, 512]
    - [7, 82.092]
  - - [2048, 3327, 1, 512]
    - [7, 81.97]
  - - [2048, 3329, 1, 512]
    - [7, 81.891]
  - - [2048, 3332, 1, 512]
    - [7, 81.753]
  - - [2048, 3336, 1, 512]
    - [7, 81.596]
  - - [2048, 3339, 1, 512]
    - [7, 82.052]
  - - [2048, 3342, 1, 512]
    - [7, 82.211]
  - - [2048, 3344, 1, 512]
    - [7, 82.047]
  - - [2048, 3358, 1, 512]
    - [7, 82.39]
  - - [2048, 3360, 1, 512]
    - [7, 82.783]
  - - [2048, 3364, 1, 512]
    - [32, 78.464]
  - - [2048, 3365, 1, 512]
    - [65, 78.487]
  - - [2048, 3369, 1, 512]
    - [65, 78.387]
  - - [2048, 3371, 1, 512]
    - [58, 78.705]
  - - [2048, 3374, 1, 512]
    - [15, 78.697]
  - - [2048, 3376, 1, 512]
    - [58, 78.782]
  - - [2048, 3377, 1, 512]
    - [6, 78.884]
  - - [2048, 3378, 1, 512]
    - [15, 78.519]
  - - [2048, 3381, 1, 512]
    - [15, 78.666]
  - - [2048, 3382, 1, 512]
    - [65, 78.65]
  - - [2048, 3383, 1, 512]
    - [15, 78.713]
  - - [2048, 3384, 1, 512]
    - [15, 78.465]
  - - [2048, 3385, 1, 512]
    - [35, 78.643]
  - - [2048, 3386, 1, 512]
    - [65, 78.705]
  - - [2048, 3388, 1, 512]
    - [6, 78.597]
  - - [2048, 3390, 1, 512]
    - [65, 78.72]
  - - [2048, 3391, 1, 512]
    - [35, 78.55]
  - - [2048, 3396, 1, 512]
    - [6, 79.642]
  - - [2048, 3399, 1, 512]
    - [6, 79.991]
  - - [2048, 3402, 1, 512]
    - [6, 80.061]
  - - [2048, 3410, 1, 512]
    - [6, 80.09]
  - - [2048, 3414, 1, 512]
    - [35, 79.473]
  - - [2048, 3415, 1, 512]
    - [6, 79.929]
  - - [2048, 3418, 1, 512]
    - [65, 79.644]
  - - [2048, 3420, 1, 512]
    - [35, 79.888]
  - - [2048, 3422, 1, 512]
    - [35, 79.541]
  - - [2048, 3425, 1, 512]
    - [6, 79.887]
  - - [2048, 3426, 1, 512]
    - [65, 79.596]
  - - [2048, 3427, 1, 512]
    - [35, 79.815]
  - - [2048, 3428, 1, 512]
    - [6, 79.956]
  - - [2048, 3430, 1, 512]
    - [6, 79.964]
  - - [2048, 3431, 1, 512]
    - [35, 79.868]
  - - [2048, 3432, 1, 512]
    - [65, 79.656]
  - - [2048, 3438, 1, 512]
    - [6, 79.835]
  - - [2048, 3439, 1, 512]
    - [6, 79.937]
  - - [2048, 3440, 1, 512]
    - [6, 79.764]
  - - [2048, 3443, 1, 512]
    - [15, 79.872]
  - - [2048, 3445, 1, 512]
    - [35, 79.84]
  - - [2048, 3447, 1, 512]
    - [6, 80.083]
  - - [2048, 3448, 1, 512]
    - [6, 79.91]
  - - [2048, 3450, 1, 512]
    - [65, 80.035]
  - - [2048, 3451, 1, 512]
    - [6, 80.137]
  - - [2048, 3452, 1, 512]
    - [6, 80.003]
  - - [2048, 3453, 1, 512]
    - [6, 79.947]
  - - [2048, 3455, 1, 512]
    - [35, 80.151]
  - - [2048, 3457, 1, 512]
    - [6, 81.477]
  - - [2048, 3458, 1, 512]
    - [6, 81.217]
  - - [2048, 3459, 1, 512]
    - [6, 81.443]
  - - [2048, 3460, 1, 512]
    - [6, 81.426]
  - - [2048, 3461, 1, 512]
    - [6, 81.247]
  - - [2048, 3462, 1, 512]
    - [6, 81.109]
  - - [2048, 3467, 1, 512]
    - [6, 81.267]
  - - [2048, 3468, 1, 512]
    - [6, 81.452]
  - - [2048, 3470, 1, 512]
    - [6, 81.418]
  - - [2048, 3471, 1, 512]
    - [6, 81.119]
  - - [2048, 3472, 1, 512]
    - [6, 81.587]
  - - [2048, 3475, 1, 512]
    - [35, 80.853]
  - - [2048, 3477, 1, 512]
    - [6, 81.501]
  - - [2048, 3478, 1, 512]
    - [6, 81.404]
  - - [2048, 3479, 1, 512]
    - [6, 81.549]
  - - [2048, 3480, 1, 512]
    - [6, 81.089]
  - - [2048, 3481, 1, 512]
    - [6, 81.353]
  - - [2048, 3483, 1, 512]
    - [35, 80.999]
  - - [2048, 3484, 1, 512]
    - [6, 81.182]
  - - [2048, 3487, 1, 512]
    - [6, 80.853]
  - - [2048, 3489, 1, 512]
    - [6, 80.979]
  - - [2048, 3490, 1, 512]
    - [6, 81.082]
  - - [2048, 3491, 1, 512]
    - [6, 80.986]
  - - [2048, 3493, 1, 512]
    - [6, 81.272]
  - - [2048, 3494, 1, 512]
    - [6, 80.857]
  - - [2048, 3495, 1, 512]
    - [6, 81.398]
  - - [2048, 3497, 1, 512]
    - [6, 81.046]
  - - [2048, 3498, 1, 512]
    - [6, 81.148]
  - - [2048, 3499, 1, 512]
    - [6, 81.052]
  - - [2048, 3501, 1, 512]
    - [35, 80.9]
  - - [2048, 3503, 1, 512]
    - [6, 81.105]
  - - [2048, 3507, 1, 512]
    - [35, 81.397]
  - - [2048, 3508, 1, 512]
    - [35, 81.26]
  - - [2048, 3509, 1, 512]
    - [35, 81.085]
  - - [2048, 3511, 1, 512]
    - [6, 81.171]
  - - [2048, 3514, 1, 512]
    - [6, 81.28]
  - - [2048, 3515, 1, 512]
    - [6, 81.343]
  - - [2048, 3517, 1, 512]
    - [65, 81.072]
  - - [2048, 3518, 1, 512]
    - [6, 81.333]
  - - [2048, 3519, 1, 512]
    - [35, 81.118]
  - - [2048, 3520, 1, 512]
    - [6, 83.211]
  - - [2048, 3523, 1, 512]
    - [107, 78.714]
  - - [2048, 3528, 1, 512]
    - [58, 78.64]
  - - [2048, 3529, 1, 512]
    - [58, 78.736]
  - - [2048, 3530, 1, 512]
    - [58, 78.647]
  - - [2048, 3532, 1, 512]
    - [14, 78.544]
  - - [2048, 3533, 1, 512]
    - [107, 78.308]
  - - [2048, 3534, 1, 512]
    - [14, 78.441]
  - - [2048, 3538, 1, 512]
    - [58, 78.567]
  - - [2048, 3539, 1, 512]
    - [58, 78.848]
  - - [2048, 3541, 1, 512]
    - [58, 78.744]
  - - [2048, 3547, 1, 512]
    - [58, 78.915]
  - - [2048, 3548, 1, 512]
    - [15, 78.825]
  - - [2048, 3552, 1, 512]
    - [14, 79.175]
  - - [2048, 3564, 1, 512]
    - [58, 79.032]
  - - [2048, 3575, 1, 512]
    - [35, 78.869]
  - - [2048, 3598, 1, 512]
    - [107, 79.266]
  - - [2048, 3599, 1, 512]
    - [35, 79.51]
  - - [2048, 3608, 1, 512]
    - [35, 79.338]
  - - [2048, 3780, 1, 512]
    - [7, 82.278]
  - - [2048, 3796, 1, 512]
    - [7, 82.664]
  - - [2048, 3822, 1, 512]
    - [7, 82.773]
  - - [2048, 3840, 1, 512]
    - [7, 83.622]
  - - [2048, 3859, 1, 512]
    - [6, 80.904]
  - - [2048, 3870, 1, 512]
    - [35, 80.812]
  - - [2048, 3876, 1, 512]
    - [35, 80.546]
  - - [2048, 3906, 1, 512]
    - [58, 78.846]
  - - [2048, 3910, 1, 512]
    - [15, 79.3]
  - - [2048, 3925, 1, 512]
    - [65, 79.331]
  - - [2048, 3942, 1, 512]
    - [107, 79.167]
  - - [2048, 3944, 1, 512]
    - [15, 79.309]
  - - [2048, 3955, 1, 512]
    - [15, 79.768]
  - - [2048, 3968, 1, 512]
    - [35, 80.098]
  - - [2048, 3969, 1, 512]
    - [58, 79.54]
  - - [2048, 3976, 1, 512]
    - [15, 79.177]
  - - [2048, 3977, 1, 512]
    - [58, 79.364]
  - - [2048, 3978, 1, 512]
    - [65, 79.251]
  - - [2048, 3990, 1, 512]
    - [58, 79.289]
  - - [2048, 3995, 1, 512]
    - [15, 79.188]
  - - [2048, 3996, 1, 512]
    - [58, 79.308]
  - - [2048, 4005, 1, 512]
    - [107, 79.487]
  - - [2048, 4012, 1, 512]
    - [35, 79.459]
  - - [2048, 4020, 1, 512]
    - [15, 79.584]
  - - [2048, 4026, 1, 512]
    - [107, 79.636]
  - - [2048, 4030, 1, 512]
    - [15, 79.648]
  - - [2048, 4032, 1, 512]
    - [15, 80.632]
  - - [33708, 184, 1, 512]
    - [37, 71.663]
  - - [33708, 208, 1, 512]
    - [14, 70.553]
  - - [33708, 246, 1, 512]
    - [6, 73.76]
  - - [33708, 264, 1, 512]
    - [7, 74.585]
  - - [33708, 465, 1, 512]
    - [7, 83.046]
  - - [33708, 468, 1, 512]
    - [7, 83.524]
  - - [33708, 493, 1, 512]
    - [15, 77.793]
  - - [33708, 540, 1, 512]
    - [6, 78.168]
  - - [33708, 550, 1, 512]
    - [6, 79.233]
  - - [33708, 560, 1, 512]
    - [6, 80.435]
  - - [33708, 644, 1, 512]
    - [7, 80.052]
  - - [33708, 714, 1, 512]
    - [46, 81.968]
  - - [33708, 720, 1, 512]
    - [46, 84.274]
  - - [33708, 781, 1, 512]
    - [15, 80.254]
  - - [33708, 936, 1, 512]
    - [7, 85.026]
  - - [33708, 980, 1, 512]
    - [46, 82.233]
  - - [33708, 1232, 1, 512]
    - [9, 84.626]
  - - [33708, 1290, 1, 512]
    - [46, 85.252]
  - - [33708, 1350, 1, 512]
    - [7, 83.017]
  - - [33708, 1424, 1, 512]
    - [7, 86.541]
  - - [33708, 1458, 1, 512]
    - [15, 84.112]
  - - [33708, 1462, 1, 512]
    - [15, 84.387]
  - - [33708, 1520, 1, 512]
    - [9, 84.997]
  - - [33708, 1596, 1, 512]
    - [9, 85.35]
  - - [33708, 1599, 1, 512]
    - [9, 85.865]
  - - [33708, 1615, 1, 512]
    - [9, 85.595]
  - - [33708, 1680, 1, 512]
    - [9, 85.136]
  - - [33708, 1917, 1, 512]
    - [9, 87.933]
  - - [33708, 2205, 1, 512]
    - [9, 88.052]
  - - [33708, 2418, 1, 512]
    - [9, 86.012]
  - - [33708, 3776, 1, 512]
    - [9, 87.925]
  - - [33708, 3780, 1, 512]
    - [9, 87.897]
  - - [33708, 3796, 1, 512]
    - [9, 88.611]
  - - [33708, 3822, 1, 512]
    - [9, 89.146]
  - - [33708, 3835, 1, 512]
    - [19, 89.396]
  - - [33708, 3840, 1, 512]
    - [9, 89.466]
  - - [33708, 3859, 1, 512]
    - [9, 87.612]
  - - [33708, 3870, 1, 512]
    - [9, 87.827]
  - - [33708, 3876, 1, 512]
    - [19, 87.755]
  - - [33708, 3906, 1, 512]
    - [9, 88.522]
  - - [33708, 3910, 1, 512]
    - [19, 88.584]
  - - [33708, 3925, 1, 512]
    - [9, 88.834]
  - - [33708, 3942, 1, 512]
    - [9, 87.547]
  - - [33708, 3944, 1, 512]
    - [9, 87.581]
  - - [33708, 3955, 1, 512]
    - [9, 87.723]
  - - [33708, 3968, 1, 512]
    - [9, 88.007]
  - - [33708, 3976, 1, 512]
    - [9, 87.998]
  - - [33708, 3977, 1, 512]
    - [19, 88.56]
  - - [33708, 3978, 1, 512]
    - [9, 88.223]
  - - [33708, 3990, 1, 512]
    - [9, 88.298]
  - - [33708, 3996, 1, 512]
    - [9, 88.615]
  - - [33708, 3999, 1, 512]
    - [9, 88.686]
  - - [33708, 4005, 1, 512]
    - [9, 88.683]
  - - [33708, 4012, 1, 512]
    - [9, 89.018]
  - - [33708, 4020, 1, 512]
    - [9, 89.208]
  - - [33708, 4026, 1, 512]
    - [9, 89.087]
  - - [33708, 4030, 1, 512]
    - [9, 89.051]
  - - [33708, 4032, 1, 512]
    - [9, 89.37]
  - - [2, 6, 1, 1024]
    - [28, 0.003]
  - - [2, 8, 1, 1024]
    - [28, 0.004]
  - - [3072, 512, 1, 3072]
    - [89, 82.639]
  - - [511, 8192, 1, 8192]
    - [8, 87.655]
  - - [512, 512, 1, 512]
    - [20, 33.791]
  - - [511, 2048, 1, 2048]
    - [36, 74.876]
  - - [4096, 4096, 1, 4096]
    - [7, 92.917]
  - - [1024, 512, 1, 1025]
    - [140, 43.48]
  - - [8192, 8193, 1, 8192]
    - [141, 94.414]
  - - [3072, 3072, 1, 3071]
    - [117, 92.349]
  - - [8192, 8192, 1, 8193]
    - [141, 94.161]
  - - [7681, 8192, 1, 8192]
    - [32, 94.213]
  - - [512, 1023, 1, 1024]
    - [4, 55.439]
  - - [7680, 8192, 1, 8193]
    - [117, 94.612]
  - - [513, 4096, 1, 4096]
    - [36, 80.975]
  - - [3073, 512, 1, 3072]
    - [95, 77.905]
  - - [7680, 8192, 1, 8192]
    - [9, 94.956]
  - - [4096, 4096, 1, 4097]
    - [77, 91.574]
  - - [1025, 1024, 1, 1024]
    - [36, 69.394]
  - - [8192, 8191, 1, 8192]
    - [8, 94.517]
  - - [8192, 512, 1, 8193]
    - [8, 87.165]
  - - [2880, 3071, 1, 3072]
    - [7, 91.535]
  - - [2048, 513, 1, 2048]
    - [41, 74.476]
  - - [1024, 1024, 1, 1025]
    - [37, 55.867]
  - - [960, 1024, 1, 1023]
    - [9, 64.929]
  - - [1024, 1024, 1, 1024]
    - [36, 69.625]
  - - [960, 1025, 1, 1024]
    - [19, 70.402]
  - - [2880, 3072, 1, 3072]
    - [7, 91.798]
  - - [4096, 511, 1, 4096]
    - [12, 81.117]
  - - [512, 3072, 1, 3072]
    - [41, 84.107]
  - - [2049, 512, 1, 2048]
    - [41, 73.409]
  - - [512, 8191, 1, 8192]
    - [8, 87.92]
  - - [513, 1024, 1, 1024]
    - [20, 54.6]
  - - [512, 2048, 1, 2048]
    - [41, 75.727]
  - - [4096, 4095, 1, 4096]
    - [7, 92.998]
  - - [8192, 511, 1, 8192]
    - [6, 86.949]
  - - [513, 512, 1, 512]
    - [20, 34.239]
  - - [1024, 511, 1, 1024]
    - [60, 53.424]
  - - [1024, 512, 1, 1023]
    - [134, 43.163]
  - - [960, 1024, 1, 1025]
    - [119, 65.906]
  - - [8192, 512, 1, 8192]
    - [8, 87.459]
  - - [959, 1024, 1, 1024]
    - [19, 69.399]
  - - [511, 3072, 1, 3072]
    - [41, 83.62]
  - - [7680, 8193, 1, 8192]
    - [9, 94.945]
  - - [2048, 2048, 1, 2048]
    - [8, 84.634]
  - - [2048, 512, 1, 2049]
    - [37, 63.203]
  - - [511, 1024, 1, 1024]
    - [4, 53.661]
  - - [3072, 512, 1, 3073]
    - [42, 78.185]
  - - [512, 2049, 1, 2048]
    - [36, 75.764]
  - - [513, 8192, 1, 8192]
    - [36, 83.404]
  - - [7679, 8192, 1, 8192]
    - [117, 94.894]
  - - [1024, 513, 1, 1024]
    - [4, 54.846]
  - - [3840, 4096, 1, 4097]
    - [113, 91.516]
  - - [2048, 512, 1, 2047]
    - [37, 62.731]
  - - [512, 3072, 1, 3071]
    - [42, 78.19]
  - - [7680, 8192, 1, 8191]
    - [117, 94.597]
  - - [3072, 511, 1, 3072]
    - [89, 81.61]
  - - [8193, 8192, 1, 8192]
    - [32, 94.234]
  - - [512, 4096, 1, 4095]
    - [73, 80.428]
  - - [512, 3071, 1, 3072]
    - [36, 83.95]
  - - [3073, 3072, 1, 3072]
    - [6, 88.883]
  - - [512, 3073, 1, 3072]
    - [6, 78.523]
  - - [4096, 4096, 1, 4095]
    - [77, 91.451]
  - - [1920, 2048, 1, 2047]
    - [9, 86.76]
  - - [1920, 2049, 1, 2048]
    - [7, 89.016]
  - - [512, 8192, 1, 8191]
    - [8, 87.439]
  - - [3840, 4096, 1, 4096]
    - [7, 92.676]
  - - [8191, 512, 1, 8192]
    - [8, 87.202]
  - - [1025, 512, 1, 1024]
    - [47, 54.301]
  - - [2881, 3072, 1, 3072]
    - [16, 87.433]
  - - [512, 4096, 1, 4096]
    - [12, 82.225]
  - - [1024, 1024, 1, 1023]
    - [126, 55.185]
  - - [513, 2048, 1, 2048]
    - [36, 75.579]
  - - [3841, 4096, 1, 4096]
    - [8, 90.93]
  - - [2880, 3072, 1, 3073]
    - [77, 89.842]
  - - [512, 512, 1, 513]
    - [124, 26.698]
  - - [4095, 512, 1, 4096]
    - [12, 81.052]
  - - [1919, 2048, 1, 2048]
    - [7, 87.85]
  - - [1024, 1025, 1, 1024]
    - [41, 69.793]
  - - [1920, 2048, 1, 2048]
    - [7, 88.669]
  - - [8192, 8192, 1, 8192]
    - [8, 94.602]
  - - [512, 2048, 1, 2049]
    - [37, 63.327]
  - - [511, 4096, 1, 4096]
    - [12, 81.51]
  - - [8192, 513, 1, 8192]
    - [32, 78.94]
  - - [513, 3072, 1, 3072]
    - [95, 77.893]
  - - [7680, 8191, 1, 8192]
    - [8, 94.897]
  - - [512, 4097, 1, 4096]
    - [12, 82.826]
  - - [512, 512, 1, 511]
    - [14, 26.247]
  - - [2047, 2048, 1, 2048]
    - [14, 83.769]
  - - [1024, 1023, 1, 1024]
    - [41, 68.571]
  - - [2049, 2048, 1, 2048]
    - [6, 84.069]
  - - [3840, 4095, 1, 4096]
    - [7, 92.734]
  - - [960, 1023, 1, 1024]
    - [19, 69.51]
  - - [2880, 3072, 1, 3071]
    - [130, 89.599]
  - - [3072, 3072, 1, 3073]
    - [117, 92.279]
  - - [2880, 3073, 1, 3072]
    - [7, 91.451]
  - - [2048, 511, 1, 2048]
    - [26, 72.733]
  - - [4096, 513, 1, 4096]
    - [14, 79.858]
  - - [4097, 512, 1, 4096]
    - [12, 81.863]
  - - [8192, 512, 1, 8191]
    - [8, 87.129]
  - - [1921, 2048, 1, 2048]
    - [58, 81.488]
  - - [512, 3072, 1, 3073]
    - [42, 77.905]
  - - [2048, 2049, 1, 2048]
    - [6, 84.991]
  - - [3072, 512, 1, 3071]
    - [142, 77.966]
  - - [3071, 3072, 1, 3072]
    - [16, 93.026]
  - - [3840, 4097, 1, 4096]
    - [7, 92.714]
  - - [1023, 512, 1, 1024]
    - [14, 53.476]
  - - [2048, 2047, 1, 2048]
    - [41, 84.133]
  - - [2047, 512, 1, 2048]
    - [41, 73.393]
  - - [2879, 3072, 1, 3072]
    - [7, 90.968]
  - - [3072, 513, 1, 3072]
    - [6, 78.651]
  - - [512, 1024, 1, 1024]
    - [4, 55.114]
  - - [512, 4095, 1, 4096]
    - [12, 81.736]
  - - [512, 1024, 1, 1025]
    - [95, 43.402]
  - - [3071, 512, 1, 3072]
    - [89, 82.144]
  - - [512, 513, 1, 512]
    - [20, 33.858]
  - - [512, 511, 1, 512]
    - [4, 33.17]
  - - [4096, 512, 1, 4096]
    - [12, 81.705]
  - - [4097, 4096, 1, 4096]
    - [7, 92.737]
  - - [2048, 2048, 1, 2047]
    - [106, 81.338]
  - - [3839, 4096, 1, 4096]
    - [7, 92.284]
  - - [512, 4096, 1, 4097]
    - [73, 80.301]
  - - [3072, 3073, 1, 3072]
    - [6, 89.242]
  - - [512, 2047, 1, 2048]
    - [36, 74.986]
  - - [2048, 2048, 1, 2049]
    - [143, 81.555]
  - - [8191, 8192, 1, 8192]
    - [8, 94.352]
  - - [3072, 3071, 1, 3072]
    - [16, 92.677]
  - - [4096, 512, 1, 4097]
    - [144, 75.73]
  - - [3840, 4096, 1, 4095]
    - [113, 91.59]
  - - [1920, 2047, 1, 2048]
    - [7, 88.756]
  - - [512, 1025, 1, 1024]
    - [36, 54.669]
  - - [8192, 8192, 1, 8191]
    - [46, 94.207]
  - - [512, 2048, 1, 2047]
    - [37, 63.514]
  - - [3072, 3072, 1, 3072]
    - [16, 93.282]
  - - [512, 8193, 1, 8192]
    - [8, 87.902]
  - - [511, 512, 1, 512]
    - [20, 34.497]
  - - [4096, 512, 1, 4095]
    - [144, 76.321]
  - - [960, 1024, 1, 1024]
    - [19, 69.365]
  - - [8193, 512, 1, 8192]
    - [8, 87.312]
  - - [961, 1024, 1, 1024]
    - [36, 65.625]
  - - [512, 1024, 1, 1023]
    - [95, 43.009]
  - - [4095, 4096, 1, 4096]
    - [7, 92.936]
  - - [4096, 4097, 1, 4096]
    - [7, 93.057]
  - - [512, 8192, 1, 8192]
    - [8, 88.171]
  - - [512, 8192, 1, 8193]
    - [8, 87.445]
  - - [1023, 1024, 1, 1024]
    - [36, 68.863]
  - - [1920, 2048, 1, 2049]
    - [145, 85.737]
  - - [479, 512, 1, 512]
    - [20, 32.153]
  - - [479, 1024, 1, 1024]
    - [20, 51.327]
  - - [479, 2048, 1, 2048]
    - [19, 80.054]
  - - [479, 3072, 1, 3072]
    - [41, 79.608]
  - - [479, 4096, 1, 4096]
    - [9, 88.527]
  - - [479, 8192, 1, 8192]
    - [7, 92.095]
  - - [480, 511, 1, 512]
    - [4, 31.796]
  - - [480, 512, 1, 511]
    - [20, 24.823]
  - - [480, 512, 1, 513]
    - [58, 24.811]
  - - [480, 513, 1, 512]
    - [20, 32.843]
  - - [480, 1023, 1, 1024]
    - [68, 51.618]
  - - [480, 1024, 1, 1023]
    - [146, 39.205]
  - - [480, 1024, 1, 1025]
    - [131, 39.555]
  - - [480, 1025, 1, 1024]
    - [4, 51.719]
  - - [480, 2047, 1, 2048]
    - [19, 79.759]
  - - [480, 2048, 1, 2047]
    - [9, 75.888]
  - - [480, 2048, 1, 2049]
    - [9, 76.281]
  - - [480, 2049, 1, 2048]
    - [19, 79.487]
  - - [480, 3071, 1, 3072]
    - [36, 79.315]
  - - [480, 3072, 1, 3071]
    - [8, 71.206]
  - - [480, 3072, 1, 3073]
    - [8, 71.252]
  - - [480, 3073, 1, 3072]
    - [36, 80.429]
  - - [480, 4095, 1, 4096]
    - [19, 89.236]
  - - [480, 4096, 1, 4095]
    - [130, 88.259]
  - - [480, 4096, 1, 4097]
    - [130, 88.582]
  - - [480, 4097, 1, 4096]
    - [9, 89.455]
  - - [480, 8191, 1, 8192]
    - [7, 92.27]
  - - [480, 8192, 1, 8191]
    - [130, 91.78]
  - - [480, 8192, 1, 8193]
    - [130, 91.618]
  - - [480, 8193, 1, 8192]
    - [130, 92.007]
  - - [481, 512, 1, 512]
    - [20, 32.472]
  - - [481, 1024, 1, 1024]
    - [4, 51.894]
  - - [481, 2048, 1, 2048]
    - [41, 71.309]
  - - [481, 3072, 1, 3072]
    - [36, 79.723]
  - - [481, 4096, 1, 4096]
    - [12, 77.247]
  - - [481, 8192, 1, 8192]
    - [8, 82.612]
  - - [511, 480, 1, 512]
    - [20, 31.975]
  - - [512, 479, 1, 512]
    - [20, 31.971]
  - - [512, 480, 1, 511]
    - [14, 24.932]
  - - [512, 480, 1, 513]
    - [122, 24.703]
  - - [512, 481, 1, 512]
    - [20, 32.286]
  - - [513, 480, 1, 512]
    - [20, 32.467]
  - - [1023, 480, 1, 1024]
    - [4, 50.808]
  - - [1024, 479, 1, 1024]
    - [4, 50.752]
  - - [1024, 480, 1, 1023]
    - [105, 39.205]
  - - [1024, 480, 1, 1025]
    - [147, 38.548]
  - - [1024, 481, 1, 1024]
    - [4, 51.659]
  - - [1025, 480, 1, 1024]
    - [47, 51.137]
  - - [2047, 480, 1, 2048]
    - [119, 79.48]
  - - [2048, 479, 1, 2048]
    - [7, 79.214]
  - - [2048, 480, 1, 2047]
    - [9, 75.825]
  - - [2048, 480, 1, 2049]
    - [9, 75.962]
  - - [2048, 481, 1, 2048]
    - [41, 69.617]
  - - [2049, 480, 1, 2048]
    - [7, 79.21]
  - - [3071, 480, 1, 3072]
    - [41, 78.977]
  - - [3072, 479, 1, 3072]
    - [41, 79.083]
  - - [3072, 480, 1, 3071]
    - [8, 70.835]
  - - [3072, 480, 1, 3073]
    - [8, 70.881]
  - - [3072, 481, 1, 3072]
    - [89, 77.783]
  - - [3073, 480, 1, 3072]
    - [41, 79.925]
  - - [480, 512, 1, 512]
    - [20, 32.59]
  - - [480, 1024, 1, 1024]
    - [20, 52.143]
  - - [480, 2048, 1, 2048]
    - [7, 79.728]
  - - [480, 3072, 1, 3072]
    - [0, 0.0]
  - - [480, 4096, 1, 4096]
    - [0, 0.0]
  - - [480, 8192, 1, 8192]
    - [0, 0.0]
  - - [512, 480, 1, 512]
    - [4, 31.503]
  - - [1024, 480, 1, 1024]
    - [4, 51.669]
  - - [2048, 480, 1, 2048]
    - [7, 79.588]
  - - [3072, 480, 1, 3072]
    - [1, 0.0]
  - - [4096, 480, 1, 4096]
    - [9, 88.929]
  - - [8192, 480, 1, 8192]
    - [7, 91.914]
  - - [1024, 3840, 1, 1024]
    - [7, 85.153]
  - - [1024, 3840, 1, 4096]
    - [7, 91.543]
  - - [1024, 3968, 1, 1024]
    - [14, 79.453]
  - - [1024, 3968, 1, 4096]
    - [8, 84.511]
  - - [1024, 7200, 1, 1024]
    - [14, 83.741]
  - - [1024, 7200, 1, 4096]
    - [12, 88.975]
  - - [1024, 8160, 1, 1024]
    - [12, 85.047]
  - - [1024, 8160, 1, 4096]
    - [12, 90.417]
  - - [1024, 9520, 1, 1024]
    - [7, 88.02]
  - - [1024, 9520, 1, 4096]
    - [8, 92.618]
  - - [1024, 10200, 1, 1024]
    - [6, 86.723]
  - - [1024, 10200, 1, 4096]
    - [16, 90.987]
  - - [4096, 3840, 1, 1024]
    - [7, 88.919]
  - - [4096, 3968, 1, 1024]
    - [15, 86.86]
  - - [4096, 7200, 1, 1024]
    - [7, 90.076]
  - - [4096, 8160, 1, 1024]
    - [9, 90.395]
  - - [4096, 9520, 1, 1024]
    - [9, 90.177]
  - - [4096, 10200, 1, 1024]
    - [7, 91.185]
  - - [42720, 3968, 1, 1024]
    - [9, 92.901]
  - - [42720, 7200, 1, 1024]
    - [9, 94.619]
  - - [42720, 9520, 1, 1024]
    - [9, 93.997]
  - - [14, 14, 1, 64]
    - [23, 0.007]
  - - [15, 14, 1, 64]
    - [66, 0.008]
  - - [15, 15, 1, 64]
    - [25, 0.009]
  - - [17, 15, 1, 64]
    - [66, 0.01]
  - - [17, 17, 1, 64]
    - [66, 0.013]
  - - [30, 30, 1, 64]
    - [24, 0.035]
  - - [30, 31, 1, 64]
    - [25, 0.038]
  - - [31, 31, 1, 64]
    - [66, 0.037]
  - - [1024, 32, 1, 1024]
    - [22, 8.641]
  - - [2, 32, 1, 1024]
    - [25, 0.016]
  - - [2, 4, 1, 1024]
    - [22, 0.002]
  - - [512, 512, 1, 64]
    - [20, 8.592]
  - - [64, 512, 1, 512]
    - [22, 6.575]
  - - [1024, 512, 1, 2048]
    - [14, 59.084]
  - - [1024, 960, 1, 1024]
    - [19, 70.225]
  - - [1024, 960, 1, 1600]
    - [19, 75.892]
  - - [64, 960, 1, 1024]
    - [57, 15.928]
  - - [2048, 960, 1, 2048]
    - [9, 85.273]
  - - [2048, 960, 1, 74]
    - [5, 26.227]
  - - [1024, 1024, 1, 960]
    - [14, 69.259]
  - - [1600, 1024, 1, 960]
    - [8, 73.302]
  - - [2048, 2048, 1, 960]
    - [14, 81.776]
  - - [4096, 1024, 1, 257]
    - [148, 53.737]
  - - [10240, 8976, 1, 256]
    - [46, 83.927]
  - - [1024, 1600, 1, 1024]
    - [6, 75.233]
  - - [1024, 1600, 1, 560]
    - [6, 70.082]
  - - [10496, 8976, 1, 256]
    - [46, 84.029]
  - - [11264, 8976, 1, 256]
    - [46, 83.761]
  - - [11776, 8976, 1, 256]
    - [46, 83.218]
  - - [12544, 8976, 1, 256]
    - [46, 83.645]
  - - [1280, 8976, 1, 256]
    - [6, 75.7]
  - - [13312, 8976, 1, 256]
    - [46, 83.725]
  - - [13568, 8976, 1, 256]
    - [46, 83.728]
  - - [13824, 8976, 1, 256]
    - [46, 83.502]
  - - [15104, 8976, 1, 256]
    - [46, 83.857]
  - - [15360, 8976, 1, 256]
    - [46, 83.69]
  - - [15872, 8976, 1, 256]
    - [46, 83.671]
  - - [1600, 1, 1, 1024]
    - [72, 0.408]
  - - [16128, 8976, 1, 256]
    - [46, 83.763]
  - - [17152, 8976, 1, 256]
    - [46, 83.715]
  - - [1792, 8976, 1, 256]
    - [6, 77.001]
  - - [18176, 8976, 1, 256]
    - [46, 83.329]
  - - [18688, 8976, 1, 256]
    - [46, 83.886]
  - - [18944, 8976, 1, 256]
    - [46, 83.85]
  - - [19712, 8976, 1, 256]
    - [46, 83.804]
  - - [19968, 8976, 1, 256]
    - [46, 83.839]
  - - [200, 1, 1, 1024]
    - [25, 0.058]
  - - [20480, 8976, 1, 256]
    - [46, 80.137]
  - - [2048, 114, 1, 512]
    - [4, 28.962]
  - - [2048, 114, 1, 768]
    - [4, 35.287]
  - - [2048, 1536, 1, 512]
    - [96, 76.566]
  - - [2048, 1536, 1, 768]
    - [10, 80.47]
  - - [2048, 215, 1, 512]
    - [4, 40.967]
  - - [2048, 215, 1, 768]
    - [4, 45.492]
  - - [2048, 256, 1, 512]
    - [14, 46.173]
  - - [2048, 256, 1, 768]
    - [4, 51.995]
  - - [2048, 512, 1, 2048]
    - [14, 73.373]
  - - [2048, 512, 1, 67]
    - [5, 19.306]
  - - [2048, 512, 1, 74]
    - [5, 22.56]
  - - [2048, 684, 1, 512]
    - [14, 62.762]
  - - [2048, 684, 1, 768]
    - [14, 66.326]
  - - [2048, 8976, 1, 256]
    - [9, 79.076]
  - - [20992, 8976, 1, 256]
    - [46, 83.845]
  - - [21248, 8976, 1, 256]
    - [46, 83.721]
  - - [2304, 8976, 1, 256]
    - [7, 77.065]
  - - [23552, 8976, 1, 256]
    - [46, 83.764]
  - - [2560, 8976, 1, 256]
    - [46, 78.109]
  - - [256, 10496, 1, 1024]
    - [8, 82.776]
  - - [256, 11264, 1, 1024]
    - [14, 80.212]
  - - [256, 11520, 1, 1024]
    - [149, 80.721]
  - - [256, 11776, 1, 1024]
    - [10, 80.416]
  - - [256, 12544, 1, 1024]
    - [14, 78.202]
  - - [256, 1280, 1, 1024]
    - [4, 51.087]
  - - [256, 13312, 1, 1024]
    - [10, 80.197]
  - - [256, 14336, 1, 1024]
    - [14, 79.364]
  - - [256, 14592, 1, 1024]
    - [89, 80.442]
  - - [256, 14848, 1, 1024]
    - [14, 81.739]
  - - [256, 15104, 1, 1024]
    - [10, 81.144]
  - - [256, 1536, 1, 1024]
    - [41, 56.18]
  - - [256, 16128, 1, 1024]
    - [14, 80.428]
  - - [256, 18176, 1, 1024]
    - [14, 81.677]
  - - [256, 18944, 1, 1024]
    - [10, 84.009]
  - - [256, 19200, 1, 1024]
    - [10, 85.241]
  - - [256, 20480, 1, 1024]
    - [6, 84.009]
  - - [256, 20992, 1, 1024]
    - [10, 85.604]
  - - [256, 21248, 1, 1024]
    - [14, 81.474]
  - - [256, 21504, 1, 1024]
    - [89, 82.082]
  - - [256, 22016, 1, 1024]
    - [10, 83.097]
  - - [256, 22344, 1, 1024]
    - [12, 83.508]
  - - [256, 2304, 1, 1024]
    - [14, 61.443]
  - - [256, 23296, 1, 1024]
    - [14, 82.548]
  - - [256, 23552, 1, 1024]
    - [149, 83.48]
  - - [256, 2560, 1, 1024]
    - [36, 67.358]
  - - [256, 2816, 1, 1024]
    - [95, 59.62]
  - - [256, 31488, 1, 1024]
    - [10, 86.672]
  - - [256, 3328, 1, 1024]
    - [41, 69.341]
  - - [256, 33536, 1, 1024]
    - [6, 84.385]
  - - [256, 3584, 1, 1024]
    - [41, 61.542]
  - - [256, 44505, 1, 1024]
    - [10, 85.478]
  - - [256, 4608, 1, 1024]
    - [10, 68.648]
  - - [256, 4864, 1, 1024]
    - [10, 72.008]
  - - [256, 5376, 1, 1024]
    - [14, 68.661]
  - - [256, 5888, 1, 1024]
    - [14, 74.555]
  - - [256, 6144, 1, 1024]
    - [89, 76.809]
  - - [256, 6400, 1, 1024]
    - [8, 74.638]
  - - [256, 6656, 1, 1024]
    - [8, 77.395]
  - - [256, 684, 1, 1024]
    - [49, 36.564]
  - - [256, 7168, 1, 1024]
    - [14, 72.626]
  - - [256, 7424, 1, 1024]
    - [14, 75.026]
  - - [256, 7936, 1, 1024]
    - [10, 74.232]
  - - [256, 8192, 1, 1024]
    - [10, 76.566]
  - - [256, 8448, 1, 1024]
    - [10, 78.771]
  - - [256, 8960, 1, 1024]
    - [14, 74.86]
  - - [256, 9984, 1, 1024]
    - [8, 79.32]
  - - [2816, 8976, 1, 256]
    - [46, 78.454]
  - - [28672, 8976, 1, 256]
    - [46, 80.332]
  - - [3072, 8976, 1, 256]
    - [46, 79.037]
  - - [31488, 8976, 1, 256]
    - [46, 83.346]
  - - [32, 1600, 1, 512]
    - [25, 9.528]
  - - [3328, 8976, 1, 256]
    - [46, 79.299]
  - - [33536, 8976, 1, 256]
    - [46, 83.007]
  - - [3840, 8976, 1, 256]
    - [46, 80.334]
  - - [4096, 8976, 1, 256]
    - [46, 78.607]
  - - [4352, 8976, 1, 256]
    - [46, 80.955]
  - - [44505, 8976, 1, 256]
    - [46, 82.05]
  - - [4608, 8976, 1, 256]
    - [46, 80.933]
  - - [4864, 8976, 1, 256]
    - [46, 81.465]
  - - [5120, 8976, 1, 256]
    - [46, 81.923]
  - - [512, 1, 1, 2048]
    - [28, 0.176]
  - - [512, 1600, 1, 512]
    - [5, 58.34]
  - - [5376, 8976, 1, 256]
    - [46, 81.654]
  - - [5632, 8976, 1, 256]
    - [46, 82.284]
  - - [5888, 8976, 1, 256]
    - [46, 81.954]
  - - [6144, 8976, 1, 256]
    - [46, 82.866]
  - - [6400, 8976, 1, 256]
    - [46, 82.371]
  - - [64, 512, 1, 1024]
    - [29, 9.001]
  - - [684, 8976, 1, 256]
    - [70, 68.371]
  - - [7168, 8976, 1, 256]
    - [46, 82.678]
  - - [7936, 8976, 1, 256]
    - [46, 83.231]
  - - [8192, 8976, 1, 256]
    - [113, 72.643]
  - - [8448, 8976, 1, 256]
    - [46, 83.373]
  - - [8960, 8976, 1, 256]
    - [46, 83.523]
  - - [9472, 8976, 1, 256]
    - [46, 83.836]
  - - [9728, 8976, 1, 256]
    - [46, 82.804]
  - - [9984, 8976, 1, 256]
    - [46, 84.023]
  - - [33, 33, 1600, 32]
    - [5, 8.266]
  - - [3, 3, 512, 64]
    - [22, 0.168]
  - - [5, 5, 512, 64]
    - [22, 0.429]
  - - [9, 9, 512, 64]
    - [21, 1.391]
  - - [512, 32768, 1, 13]
    - [5, 11.376]
  - - [256, 32768, 1, 512]
    - [11, 80.784]
  - - [128, 32768, 1, 512]
    - [58, 72.657]
  - - [1024, 32768, 1, 479]
    - [150, 81.486]
  - - [1024, 32768, 1, 1024]
    - [46, 89.584]
  - - [512, 32768, 1, 1024]
    - [6, 87.632]
  - - [1023, 2048, 1, 4096]
    - [12, 81.196]
  - - [1025, 2048, 1, 4096]
    - [10, 82.94]
  - - [1024, 2047, 1, 4096]
    - [12, 81.321]
  - - [1024, 2049, 1, 4096]
    - [12, 82.687]
  - - [1024, 2048, 1, 4095]
    - [151, 80.145]
  - - [1024, 2048, 1, 4097]
    - [73, 79.986]
  - - [767, 1280, 1, 768]
    - [41, 61.781]
  - - [769, 1280, 1, 768]
    - [14, 62.857]
  - - [768, 1279, 1, 768]
    - [4, 62.38]
  - - [768, 1281, 1, 768]
    - [41, 62.708]
  - - [768, 1280, 1, 767]
    - [138, 53.511]
  - - [768, 1280, 1, 769]
    - [152, 53.991]
  - - [1023, 3072, 1, 1024]
    - [10, 82.402]
  - - [1025, 3072, 1, 1024]
    - [41, 76.803]
  - - [1024, 3071, 1, 1024]
    - [10, 82.315]
  - - [1024, 3073, 1, 1024]
    - [14, 77.407]
  - - [1024, 3072, 1, 1023]
    - [115, 74.373]
  - - [1024, 3072, 1, 1025]
    - [115, 73.949]
  - - [3071, 512, 1, 1024]
    - [14, 74.959]
  - - [3073, 512, 1, 1024]
    - [6, 71.254]
  - - [3072, 511, 1, 1024]
    - [26, 75.461]
  - - [3072, 513, 1, 1024]
    - [6, 71.44]
  - - [3072, 512, 1, 1023]
    - [153, 68.603]
  - - [3072, 512, 1, 1025]
    - [153, 68.478]
  - - [128, 32768, 1, 256]
    - [11, 60.261]
  - - [1024, 4096, 1, 480]
    - [87, 78.081]
  - - [512, 4096, 1, 1024]
    - [10, 76.869]
  - - [256, 4096, 1, 512]
    - [14, 61.565]
  - - [512, 55296, 1, 13]
    - [6, 12.214]
  - - [256, 55296, 1, 512]
    - [11, 83.494]
  - - [128, 55296, 1, 256]
    - [35, 64.146]
  - - [1024, 6912, 1, 480]
    - [6, 84.824]
  - - [1024, 6912, 1, 1024]
    - [6, 87.875]
  - - [512, 6912, 1, 1024]
    - [8, 83.708]
  - - [256, 6912, 1, 512]
    - [17, 70.516]
  - - [383, 384, 1, 384]
    - [49, 19.883]
  - - [385, 384, 1, 384]
    - [49, 19.988]
  - - [384, 383, 1, 384]
    - [4, 20.362]
  - - [384, 385, 1, 384]
    - [49, 19.987]
  - - [384, 384, 1, 383]
    - [57, 17.799]
  - - [384, 384, 1, 385]
    - [57, 18.952]
  - - [767, 768, 1, 768]
    - [36, 55.402]
  - - [769, 768, 1, 768]
    - [41, 57.258]
  - - [768, 767, 1, 768]
    - [14, 55.102]
  - - [768, 769, 1, 768]
    - [14, 57.097]
  - - [768, 768, 1, 767]
    - [67, 45.106]
  - - [768, 768, 1, 769]
    - [67, 45.024]
  - - [1151, 1152, 1, 1152]
    - [41, 75.814]
  - - [1153, 1152, 1, 1152]
    - [41, 67.539]
  - - [1152, 1151, 1, 1152]
    - [36, 75.233]
  - - [1152, 1153, 1, 1152]
    - [36, 67.672]
  - - [1152, 1152, 1, 1151]
    - [33, 74.987]
  - - [1152, 1152, 1, 1153]
    - [33, 75.945]
  - - [1535, 1536, 1, 1536]
    - [14, 79.189]
  - - [1537, 1536, 1, 1536]
    - [41, 79.523]
  - - [1536, 1535, 1, 1536]
    - [41, 79.112]
  - - [1536, 1537, 1, 1536]
    - [41, 79.64]
  - - [1536, 1536, 1, 1535]
    - [108, 75.77]
  - - [1536, 1536, 1, 1537]
    - [108, 76.258]
  - - [1919, 1920, 1, 1920]
    - [14, 82.614]
  - - [1921, 1920, 1, 1920]
    - [41, 83.305]
  - - [1920, 1919, 1, 1920]
    - [14, 82.7]
  - - [1920, 1921, 1, 1920]
    - [7, 83.326]
  - - [1920, 1920, 1, 1919]
    - [108, 81.225]
  - - [1920, 1920, 1, 1921]
    - [108, 81.455]
  - - [2303, 2304, 1, 2304]
    - [8, 89.136]
  - - [2305, 2304, 1, 2304]
    - [58, 84.2]
  - - [2304, 2303, 1, 2304]
    - [6, 88.977]
  - - [2304, 2305, 1, 2304]
    - [14, 85.585]
  - - [2304, 2304, 1, 2303]
    - [108, 88.877]
  - - [2304, 2304, 1, 2305]
    - [108, 89.141]
  - - [2687, 2688, 1, 2688]
    - [154, 85.518]
  - - [2689, 2688, 1, 2688]
    - [14, 85.724]
  - - [2688, 2687, 1, 2688]
    - [154, 85.736]
  - - [2688, 2689, 1, 2688]
    - [12, 86.011]
  - - [2688, 2688, 1, 2687]
    - [117, 82.44]
  - - [2688, 2688, 1, 2689]
    - [16, 82.362]
  - - [3455, 3456, 1, 3456]
    - [7, 92.477]
  - - [3457, 3456, 1, 3456]
    - [32, 92.375]
  - - [3456, 3455, 1, 3456]
    - [7, 92.902]
  - - [3456, 3457, 1, 3456]
    - [53, 91.108]
  - - [3456, 3456, 1, 3455]
    - [113, 92.763]
  - - [3456, 3456, 1, 3457]
    - [155, 92.591]
  - - [3839, 3840, 1, 3840]
    - [16, 93.544]
  - - [3841, 3840, 1, 3840]
    - [7, 92.293]
  - - [3840, 3839, 1, 3840]
    - [16, 93.114]
  - - [3840, 3841, 1, 3840]
    - [7, 92.42]
  - - [3840, 3840, 1, 3839]
    - [16, 92.978]
  - - [3840, 3840, 1, 3841]
    - [117, 93.009]
  - - [4223, 4224, 1, 4224]
    - [7, 93.021]
  - - [4225, 4224, 1, 4224]
    - [7, 93.182]
  - - [4224, 4223, 1, 4224]
    - [7, 93.24]
  - - [4224, 4225, 1, 4224]
    - [7, 93.402]
  - - [4224, 4224, 1, 4223]
    - [113, 92.526]
  - - [4224, 4224, 1, 4225]
    - [113, 92.48]
  - - [4607, 4608, 1, 4608]
    - [7, 94.991]
  - - [4609, 4608, 1, 4608]
    - [8, 92.379]
  - - [4608, 4607, 1, 4608]
    - [7, 95.172]
  - - [4608, 4609, 1, 4608]
    - [6, 92.725]
  - - [4608, 4608, 1, 4607]
    - [32, 94.189]
  - - [4608, 4608, 1, 4609]
    - [77, 94.277]
  - - [4991, 4992, 1, 4992]
    - [9, 93.665]
  - - [4993, 4992, 1, 4992]
    - [53, 92.471]
  - - [4992, 4991, 1, 4992]
    - [9, 93.864]
  - - [4992, 4993, 1, 4992]
    - [77, 93.672]
  - - [4992, 4992, 1, 4991]
    - [77, 93.073]
  - - [4992, 4992, 1, 4993]
    - [77, 93.157]
  - - [5375, 5376, 1, 5376]
    - [9, 94.021]
  - - [5377, 5376, 1, 5376]
    - [12, 92.733]
  - - [5376, 5375, 1, 5376]
    - [7, 94.067]
  - - [5376, 5377, 1, 5376]
    - [90, 93.106]
  - - [5376, 5376, 1, 5375]
    - [156, 93.465]
  - - [5376, 5376, 1, 5377]
    - [156, 93.505]
  - - [5759, 5760, 1, 5760]
    - [7, 94.771]
  - - [5761, 5760, 1, 5760]
    - [9, 92.437]
  - - [5760, 5759, 1, 5760]
    - [7, 95.129]
  - - [5760, 5761, 1, 5760]
    - [16, 93.666]
  - - [5760, 5760, 1, 5759]
    - [77, 94.366]
  - - [5760, 5760, 1, 5761]
    - [77, 94.436]
  - - [6143, 6144, 1, 6144]
    - [16, 95.274]
  - - [6145, 6144, 1, 6144]
    - [7, 94.072]
  - - [6144, 6143, 1, 6144]
    - [16, 95.262]
  - - [6144, 6145, 1, 6144]
    - [77, 94.084]
  - - [6144, 6144, 1, 6143]
    - [117, 94.853]
  - - [6144, 6144, 1, 6145]
    - [117, 94.781]
  - - [6527, 6528, 1, 6528]
    - [117, 94.213]
  - - [6529, 6528, 1, 6528]
    - [7, 93.764]
  - - [6528, 6527, 1, 6528]
    - [16, 94.174]
  - - [6528, 6529, 1, 6528]
    - [16, 94.267]
  - - [6528, 6528, 1, 6527]
    - [117, 93.8]
  - - [6528, 6528, 1, 6529]
    - [157, 93.73]
  - - [6911, 6912, 1, 6912]
    - [9, 94.454]
  - - [6913, 6912, 1, 6912]
    - [9, 94.327]
  - - [6912, 6911, 1, 6912]
    - [9, 94.671]
  - - [6912, 6913, 1, 6912]
    - [9, 94.329]
  - - [6912, 6912, 1, 6911]
    - [155, 94.107]
  - - [6912, 6912, 1, 6913]
    - [155, 94.06]
  - - [7295, 7296, 1, 7296]
    - [9, 95.194]
  - - [7297, 7296, 1, 7296]
    - [53, 94.33]
  - - [7296, 7295, 1, 7296]
    - [9, 95.501]
  - - [7296, 7297, 1, 7296]
    - [77, 95.174]
  - - [7296, 7296, 1, 7295]
    - [9, 94.69]
  - - [7296, 7296, 1, 7297]
    - [77, 94.696]
  - - [7679, 7680, 1, 7680]
    - [9, 94.865]
  - - [7681, 7680, 1, 7680]
    - [9, 94.767]
  - - [7680, 7679, 1, 7680]
    - [9, 95.158]
  - - [7680, 7681, 1, 7680]
    - [9, 94.905]
  - - [7680, 7680, 1, 7679]
    - [16, 94.661]
  - - [7680, 7680, 1, 7681]
    - [9, 94.844]
  - - [384, 384, 1, 384]
    - [3, 8.346]
  - - [768, 768, 1, 768]
    - [3, 44.624]
  - - [1152, 1152, 1, 1152]
    - [3, 58.457]
  - - [1536, 1536, 1, 1536]
    - [3, 72.044]
  - - [1920, 1920, 1, 1920]
    - [3, 84.922]
  - - [2304, 2304, 1, 2304]
    - [3, 83.778]
  - - [2688, 2688, 1, 2688]
    - [3, 81.9]
  - - [3456, 3456, 1, 3456]
    - [3, 88.725]
  - - [3840, 3840, 1, 3840]
    - [3, 93.978]
  - - [4224, 4224, 1, 4224]
    - [3, 91.034]
  - - [4608, 4608, 1, 4608]
    - [3, 93.259]
  - - [4992, 4992, 1, 4992]
    - [3, 93.013]
  - - [5376, 5376, 1, 5376]
    - [3, 93.594]
  - - [5760, 5760, 1, 5760]
    - [3, 94.702]
  - - [6144, 6144, 1, 6144]
    - [3, 91.744]
  - - [6528, 6528, 1, 6528]
    - [3, 94.385]
  - - [6912, 6912, 1, 6912]
    - [3, 94.918]
  - - [7296, 7296, 1, 7296]
    - [3, 94.244]
  - - [7680, 7680, 1, 7680]
    - [3, 94.289]
  - - [128, 128, 49, 1152]
    - [56, 64.82]
  - - [128, 128, 36, 12000]
    - [91, 69.721]
  - - [128, 128, 49, 1216]
    - [31, 66.158]
  - - [128, 128, 36, 1800]
    - [122, 54.619]
  - - [128, 128, 36, 1900]
    - [43, 54.481]
  - - [128, 128, 64, 5880]
    - [12, 65.657]
  - - [128, 128, 49, 7680]
    - [31, 80.446]
  - - [128, 128, 64, 882]
    - [126, 52.759]
  - - [128, 128, 64, 931]
    - [115, 53.718]
  - - [128, 64, 121, 1152]
    - [18, 51.564]
  - - [128, 64, 81, 12000]
    - [56, 64.949]
  - - [128, 64, 121, 1216]
    - [18, 52.281]
  - - [128, 64, 81, 1800]
    - [31, 56.78]
  - - [128, 64, 81, 1900]
    - [31, 56.76]
  - - [128, 64, 49, 20280]
    - [18, 70.796]
  - - [128, 64, 49, 3042]
    - [124, 61.97]
  - - [128, 64, 49, 3211]
    - [124, 63.275]
  - - [128, 64, 25, 43320]
    - [48, 60.949]
  - - [128, 64, 169, 5880]
    - [56, 60.132]
  - - [128, 64, 25, 6498]
    - [105, 53.31]
  - - [128, 64, 25, 6859]
    - [105, 52.492]
  - - [128, 64, 121, 7680]
    - [18, 64.102]
  - - [128, 64, 169, 882]
    - [31, 48.357]
  - - [128, 64, 169, 931]
    - [56, 49.689]
  - - [256, 128, 25, 1080]
    - [6, 67.694]
  - - [256, 128, 49, 1152]
    - [110, 71.308]
  - - [256, 128, 121, 120]
    - [6, 39.057]
  - - [256, 128, 169, 120]
    - [126, 39.457]
  - - [256, 128, 36, 120]
    - [5, 31.738]
  - - [256, 128, 49, 120]
    - [5, 34.594]
  - - [256, 128, 64, 120]
    - [5, 35.441]
  - - [256, 128, 36, 12000]
    - [158, 78.027]
  - - [256, 128, 49, 1216]
    - [159, 71.711]
  - - [256, 128, 25, 162]
    - [5, 32.329]
  - - [256, 128, 25, 171]
    - [126, 31.565]
  - - [256, 128, 121, 18]
    - [5, 12.323]
  - - [256, 128, 169, 18]
    - [5, 12.619]
  - - [256, 128, 36, 18]
    - [118, 7.717]
  - - [256, 128, 49, 18]
    - [160, 8.741]
  - - [256, 128, 64, 18]
    - [5, 10.31]
  - - [256, 128, 36, 1800]
    - [12, 68.893]
  - - [256, 128, 121, 19]
    - [5, 12.168]
  - - [256, 128, 169, 19]
    - [5, 12.92]
  - - [256, 128, 36, 19]
    - [118, 7.891]
  - - [256, 128, 49, 19]
    - [118, 9.166]
  - - [256, 128, 64, 19]
    - [5, 10.203]
  - - [256, 128, 36, 1900]
    - [10, 68.573]
  - - [256, 128, 49, 480]
    - [110, 62.808]
  - - [256, 128, 81, 480]
    - [17, 68.843]
  - - [256, 128, 64, 5880]
    - [10, 81.628]
  - - [256, 128, 49, 72]
    - [5, 27.277]
  - - [256, 128, 81, 72]
    - [6, 31.432]
  - - [256, 128, 49, 76]
    - [5, 26.439]
  - - [256, 128, 81, 76]
    - [6, 32.123]
  - - [256, 128, 49, 7680]
    - [42, 83.492]
  - - [256, 128, 64, 882]
    - [126, 66.315]
  - - [256, 128, 64, 931]
    - [115, 67.788]
  - - [256, 256, 49, 1152]
    - [14, 76.546]
  - - [256, 256, 36, 12000]
    - [36, 87.726]
  - - [256, 256, 49, 1216]
    - [14, 77.116]
  - - [256, 256, 36, 1800]
    - [6, 76.37]
  - - [256, 256, 36, 1900]
    - [114, 75.295]
  - - [256, 256, 64, 5880]
    - [132, 86.46]
  - - [256, 256, 49, 7680]
    - [8, 83.536]
  - - [256, 256, 64, 882]
    - [106, 72.993]
  - - [256, 256, 64, 931]
    - [114, 74.034]
  - - [340, 256, 49, 1152]
    - [89, 78.075]
  - - [340, 256, 36, 120]
    - [6, 37.573]
  - - [340, 256, 49, 120]
    - [144, 37.443]
  - - [340, 256, 64, 120]
    - [115, 40.167]
  - - [340, 256, 36, 12000]
    - [36, 86.158]
  - - [340, 256, 49, 1216]
    - [89, 78.325]
  - - [340, 256, 36, 18]
    - [5, 10.547]
  - - [340, 256, 49, 18]
    - [5, 10.914]
  - - [340, 256, 64, 18]
    - [5, 11.269]
  - - [340, 256, 36, 1800]
    - [6, 76.515]
  - - [340, 256, 36, 19]
    - [5, 10.732]
  - - [340, 256, 49, 19]
    - [5, 11.63]
  - - [340, 256, 64, 19]
    - [5, 11.72]
  - - [340, 256, 36, 1900]
    - [6, 76.614]
  - - [340, 256, 64, 5880]
    - [161, 82.697]
  - - [340, 256, 49, 7680]
    - [131, 79.899]
  - - [340, 256, 64, 882]
    - [106, 71.128]
  - - [340, 256, 64, 931]
    - [114, 71.65]
  - - [510, 256, 49, 120]
    - [115, 42.191]
  - - [510, 256, 64, 120]
    - [162, 43.787]
  - - [510, 256, 49, 18]
    - [5, 11.356]
  - - [510, 256, 64, 18]
    - [5, 11.567]
  - - [510, 256, 49, 19]
    - [5, 11.655]
  - - [510, 256, 64, 19]
    - [5, 12.045]
  - - [510, 256, 36, 480]
    - [89, 76.273]
  - - [510, 256, 36, 72]
    - [5, 29.787]
  - - [510, 256, 36, 76]
    - [5, 29.756]
  - - [510, 512, 36, 1080]
    - [12, 81.701]
  - - [510, 512, 36, 162]
    - [106, 49.912]
  - - [510, 512, 36, 171]
    - [106, 50.801]
  - - [510, 512, 49, 1920]
    - [12, 88.689]
  - - [510, 512, 64, 1920]
    - [8, 89.277]
  - - [510, 512, 49, 288]
    - [70, 75.76]
  - - [510, 512, 64, 288]
    - [70, 77.107]
  - - [510, 512, 36, 3000]
    - [12, 89.281]
  - - [510, 512, 49, 304]
    - [6, 77.085]
  - - [510, 512, 64, 304]
    - [6, 79.498]
  - - [510, 512, 36, 450]
    - [106, 68.599]
  - - [510, 512, 36, 475]
    - [126, 69.509]
  - - [510, 512, 49, 480]
    - [70, 82.521]
  - - [510, 512, 64, 480]
    - [6, 83.739]
  - - [510, 512, 49, 72]
    - [115, 33.24]
  - - [510, 512, 64, 72]
    - [126, 34.125]
  - - [510, 512, 49, 76]
    - [115, 33.998]
  - - [510, 512, 64, 76]
    - [37, 34.859]
  - - [512, 256, 81, 1080]
    - [6, 85.808]
  - - [512, 256, 25, 12000]
    - [41, 89.648]
  - - [512, 256, 81, 162]
    - [6, 53.603]
  - - [512, 256, 81, 171]
    - [6, 54.984]
  - - [512, 256, 25, 1800]
    - [95, 80.184]
  - - [512, 256, 25, 1900]
    - [114, 79.282]
  - - [512, 256, 121, 1920]
    - [8, 88.713]
  - - [512, 256, 169, 1920]
    - [6, 89.673]
  - - [512, 256, 49, 1920]
    - [14, 85.155]
  - - [512, 256, 121, 288]
    - [6, 79.323]
  - - [512, 256, 169, 288]
    - [6, 80.039]
  - - [512, 256, 49, 288]
    - [14, 71.064]
  - - [512, 256, 25, 3000]
    - [6, 83.683]
  - - [512, 256, 81, 3000]
    - [6, 90.715]
  - - [512, 256, 121, 304]
    - [6, 84.743]
  - - [512, 256, 169, 304]
    - [6, 86.534]
  - - [512, 256, 49, 304]
    - [6, 73.386]
  - - [512, 256, 25, 450]
    - [143, 62.338]
  - - [512, 256, 81, 450]
    - [163, 70.454]
  - - [512, 256, 25, 475]
    - [6, 62.854]
  - - [512, 256, 81, 475]
    - [143, 71.088]
  - - [512, 256, 121, 480]
    - [6, 83.717]
  - - [512, 256, 169, 480]
    - [6, 85.857]
  - - [512, 256, 49, 5880]
    - [10, 87.009]
  - - [512, 256, 121, 72]
    - [6, 41.839]
  - - [512, 256, 169, 72]
    - [6, 42.707]
  - - [512, 256, 121, 76]
    - [6, 42.174]
  - - [512, 256, 169, 76]
    - [6, 43.753]
  - - [512, 256, 49, 882]
    - [126, 75.417]
  - - [512, 256, 49, 931]
    - [115, 75.971]
  - - [64, 64, 64, 20280]
    - [164, 48.915]
  - - [64, 64, 49, 27000]
    - [146, 51.016]
  - - [64, 64, 64, 3042]
    - [124, 43.508]
  - - [64, 64, 64, 3211]
    - [97, 43.804]
  - - [64, 64, 49, 4050]
    - [103, 40.433]
  - - [64, 64, 49, 4275]
    - [105, 44.91]
  - - [64, 64, 36, 43320]
    - [103, 44.812]
  - - [64, 64, 36, 6498]
    - [48, 41.086]
  - - [64, 64, 36, 6859]
    - [48, 40.989]
  - - [1152, 128, 1, 1444]
    - [44, 31.88]
  - - [1152, 256, 1, 1]
    - [160, 0.162]
  - - [1152, 256, 1, 1444]
    - [128, 43.322]
  - - [1152, 256, 1, 25]
    - [4, 3.733]
  - - [1152, 256, 1, 9]
    - [165, 1.477]
  - - [128, 256, 1, 1444]
    - [29, 9.312]
  - - [147, 64, 1, 22500]
    - [28, 3.844]
  - - [2304, 256, 1, 1444]
    - [43, 52.293]
  - - [2304, 340, 1, 1]
    - [166, 0.336]
  - - [2304, 340, 1, 1444]
    - [43, 63.405]
  - - [2304, 340, 1, 9]
    - [167, 2.716]
  - - [2304, 510, 1, 25]
    - [5, 9.88]
  - - [2304, 512, 1, 100]
    - [5, 29.535]
  - - [2304, 512, 1, 361]
    - [144, 47.979]
  - - [256, 128, 1, 25]
    - [125, 0.513]
  - - [256, 128, 1, 9]
    - [121, 0.201]
  - - [256, 256, 1, 1444]
    - [57, 17.479]
  - - [4608, 510, 1, 100]
    - [5, 33.622]
  - - [4608, 510, 1, 361]
    - [37, 56.558]
  - - [512, 128, 1, 100]
    - [25, 3.282]
  - - [512, 256, 1, 361]
    - [57, 16.403]
  - - [576, 128, 1, 1444]
    - [57, 19.744]
  - - [576, 64, 1, 5625]
    - [72, 13.763]
  - - [64, 128, 1, 1444]
    - [72, 2.308]
  - - [8192, 7680, 1, 8192]
    - [8, 94.864]
  - - [4096, 3840, 1, 4096]
    - [90, 93.542]
  - - [2048, 1920, 1, 2048]
    - [7, 88.886]
  - - [1024, 77, 1, 1024]
    - [60, 19.458]
  - - [30522, 77, 1, 1024]
    - [19, 62.403]
  - - [30522, 616, 1, 1024]
    - [6, 85.483]
  - - [2, 10, 1, 1024]
    - [28, 0.005]
  - - [128, 128, 128, 64]
    - [5, 28.265]
  - - [128, 128, 160, 64]
    - [6, 30.123]
  - - [1024, 10, 1, 1024]
    - [22, 2.78]
  - - [1024, 1280, 1, 1024]
    - [96, 75.989]
  - - [1024, 1280, 1, 4096]
    - [41, 82.492]
  - - [4096, 1280, 1, 1024]
    - [6, 85.193]
  - - [30522, 200, 1, 1024]
    - [14, 73.803]
  - - [2, 39, 1, 1024]
    - [85, 0.02]
  - - [128, 128, 624, 64]
    - [26, 31.775]
  - - [1024, 39, 1, 1024]
    - [22, 10.715]
  - - [1024, 780, 1, 1024]
    - [14, 65.007]
  - - [1024, 4992, 1, 1024]
    - [6, 83.121]
  - - [1024, 4992, 1, 4096]
    - [117, 88.926]
  - - [4096, 4992, 1, 1024]
    - [6, 89.542]
  - - [30522, 780, 1, 1024]
    - [156, 84.181]
  - - [1024, 308, 1, 1024]
    - [4, 49.338]
  - - [30522, 308, 1, 1024]
    - [6, 83.172]
  - - [2, 40, 1, 1024]
    - [28, 0.02]
  - - [128, 128, 640, 64]
    - [26, 30.58]
  - - [1024, 40, 1, 1024]
    - [22, 11.119]
  - - [1024, 800, 1, 1024]
    - [41, 67.268]
  - - [1024, 5120, 1, 1024]
    - [6, 85.736]
  - - [1024, 5120, 1, 4096]
    - [8, 90.83]
  - - [4096, 5120, 1, 1024]
    - [77, 88.342]
  - - [30522, 800, 1, 1024]
    - [14, 85.618]
  - - [2, 41, 1, 1024]
    - [25, 0.021]
  - - [128, 128, 656, 64]
    - [26, 31.893]
  - - [1024, 41, 1, 1024]
    - [22, 11.199]
  - - [1024, 820, 1, 1024]
    - [41, 66.925]
  - - [1024, 5248, 1, 1024]
    - [6, 87.23]
  - - [1024, 5248, 1, 4096]
    - [8, 93.109]
  - - [4096, 5248, 1, 1024]
    - [6, 89.748]
  - - [30522, 820, 1, 1024]
    - [15, 86.835]
  - - [2, 5, 1, 1024]
    - [22, 0.002]
  - - [512, 512, 80, 64]
    - [6, 41.148]
  - - [1024, 5, 1, 1024]
    - [24, 1.398]
  - - [1024, 385, 1, 1024]
    - [41, 55.808]
  - - [1024, 2560, 1, 1024]
    - [6, 82.576]
  - - [1024, 2560, 1, 4096]
    - [8, 89.76]
  - - [4096, 2560, 1, 1024]
    - [6, 87.251]
  - - [30522, 385, 1, 1024]
    - [14, 78.466]
  - - [1024, 462, 1, 1024]
    - [4, 50.189]
  - - [30522, 462, 1, 1024]
    - [7, 84.347]
  - - [1024, 8, 1, 1024]
    - [24, 2.277]
  - - [1024, 160, 1, 1024]
    - [64, 34.842]
  - - [2, 9, 1, 1024]
    - [60, 0.004]
  - - [128, 128, 144, 64]
    - [6, 27.662]
  - - [1024, 9, 1, 1024]
    - [24, 2.547]
  - - [1024, 180, 1, 1024]
    - [60, 38.315]
  - - [1024, 1152, 1, 1024]
    - [10, 68.734]
  - - [1024, 1152, 1, 4096]
    - [33, 78.982]
  - - [4096, 1152, 1, 1024]
    - [14, 82.859]
  - - [30522, 180, 1, 1024]
    - [7, 77.867]
  - - [32768, 1, 1, 256]
    - [86, 1.416]
  - - [4, 4, 32768, 64]
    - [66, 1.959]
  - - [4, 4, 38400, 64]
    - [66, 1.973]
  - - [1024, 8192, 1, 1024]
    - [10, 85.532]
  - - [1024, 8192, 1, 4096]
    - [12, 90.638]
  - - [1024, 9600, 1, 1024]
    - [7, 89.144]
  - - [1024, 9600, 1, 4096]
    - [8, 93.406]
  - - [4096, 8192, 1, 1024]
    - [7, 90.358]
  - - [4096, 9600, 1, 1024]
    - [9, 90.672]
  - - [33712, 8192, 1, 1024]
    - [9, 93.802]
  - - [33712, 9600, 1, 1024]
    - [9, 94.611]
  - - [1024, 10064, 1, 1024]
    - [12, 86.816]
  - - [1024, 10064, 1, 4096]
    - [12, 92.278]
  - - [1024, 10080, 1, 1024]
    - [10, 86.717]
  - - [1024, 10080, 1, 4096]
    - [12, 92.411]
  - - [1024, 6528, 1, 1024]
    - [108, 86.313]
  - - [1024, 6528, 1, 4096]
    - [16, 93.183]
  - - [1024, 7104, 1, 1024]
    - [107, 82.992]
  - - [1024, 7104, 1, 4096]
    - [12, 87.972]
  - - [1024, 8064, 1, 1024]
    - [15, 84.456]
  - - [1024, 8064, 1, 4096]
    - [10, 88.884]
  - - [1024, 9216, 1, 1024]
    - [108, 87.662]
  - - [1024, 9216, 1, 4096]
    - [16, 94.133]
  - - [4096, 10064, 1, 1024]
    - [9, 90.668]
  - - [4096, 10080, 1, 1024]
    - [9, 91.151]
  - - [4096, 6528, 1, 1024]
    - [7, 90.664]
  - - [4096, 7104, 1, 1024]
    - [7, 91.641]
  - - [4096, 8064, 1, 1024]
    - [7, 91.575]
  - - [4096, 9216, 1, 1024]
    - [7, 91.119]
  - - [42720, 10080, 1, 1024]
    - [9, 94.726]
  - - [42720, 6528, 1, 1024]
    - [9, 94.589]
  - - [42720, 7104, 1, 1024]
    - [9, 94.546]
  - - [14, 14, 10880, 64]
    - [100, 8.638]
  - - [15, 14, 10880, 64]
    - [100, 8.942]
  - - [15, 15, 7680, 64]
    - [100, 8.9]
  - - [15, 15, 10880, 64]
    - [100, 9.158]
  - - [17, 15, 7680, 64]
    - [51, 8.282]
  - - [17, 17, 6144, 64]
    - [51, 8.74]
  - - [17, 17, 7680, 64]
    - [51, 8.916]
  - - [21, 17, 6144, 64]
    - [51, 10.058]
  - - [21, 21, 6144, 64]
    - [60, 11.069]
  - - [24, 24, 4736, 64]
    - [60, 12.589]
  - - [30, 30, 2048, 64]
    - [60, 13.99]
  - - [30, 31, 2048, 64]
    - [60, 13.978]
  - - [31, 31, 2048, 64]
    - [60, 14.191]
  - - [32, 32, 4608, 64]
    - [60, 15.607]
  - - [32, 35, 4608, 64]
    - [74, 15.021]
  - - [34, 24, 4736, 64]
    - [14, 12.05]
  - - [34, 34, 4736, 64]
    - [74, 12.786]
  - - [35, 35, 4608, 64]
    - [74, 13.301]
  - - [2, 2048, 1, 1024]
    - [21, 1.068]
  - - [128, 128, 1, 64]
    - [66, 0.695]
  - - [2, 1024, 1, 1024]
    - [28, 0.566]
  - - [5, 5, 1, 64]
    - [116, 0.001]
  - - [33, 33, 1, 32]
    - [66, 0.027]
  - - [5, 5, 960, 64]
    - [66, 0.787]
  - - [27, 27, 32768, 128]
    - [89, 16.219]
  - - [960, 1, 1, 2048]
    - [28, 0.328]
  - - [1024, 32768, 1, 480]
    - [6, 92.171]
  - - [2, 2, 1, 2048]
    - [82, 0.001]
  - - [2048, 2, 1, 2048]
    - [28, 1.322]
  - - [30592, 1024, 1, 2048]
    - [6, 92.361]
  - - [6144, 1024, 1, 2048]
    - [114, 90.674]
  - - [8192, 1024, 1, 2048]
    - [65, 86.535]
  - - [1024, 16, 1, 1024]
    - [22, 4.474]
  - - [2, 16, 1, 1024]
    - [168, 0.007]
  - - [30592, 8192, 1, 1024]
    - [9, 93.744]
  - - [3072, 8192, 1, 1024]
    - [6, 90.894]
  - - [512, 512, 256, 64]
    - [6, 42.587]
  - - [64, 512, 256, 512]
    - [169, 59.084]
  - - [30592, 2048, 1, 1024]
    - [6, 90.412]
  - - [30592, 4096, 1, 1024]
    - [9, 93.243]
  - - [3072, 4096, 1, 1024]
    - [6, 89.763]
  - - [64, 512, 128, 512]
    - [170, 58.265]
  - - [1920, 2048, 1, 2560]
    - [7, 89.886]
  - - [2, 4, 1, 2560]
    - [23, 0.002]
  - - [2560, 2048, 1, 2560]
    - [8, 88.847]
  - - [2560, 2048, 1, 640]
    - [6, 80.995]
  - - [2560, 4, 1, 2560]
    - [22, 3.264]
  - - [7680, 2048, 1, 2560]
    - [7, 91.596]
  - - [512, 512, 40, 64]
    - [6, 38.774]
  - - [64, 512, 40, 512]
    - [107, 57.171]
  - - [1536, 4096, 1, 1536]
    - [6, 89.869]
  - - [1536, 4096, 1, 6144]
    - [8, 94.112]
  - - [4608, 4096, 1, 1536]
    - [6, 91.808]
  - - [50304, 4096, 1, 1536]
    - [9, 94.288]
  - - [6144, 4096, 1, 1536]
    - [6, 92.122]
  - - [1024, 1024, 64, 96]
    - [6, 64.952]
  - - [96, 1024, 64, 1024]
    - [171, 77.217]
  - - [1536, 8192, 1, 1536]
    - [6, 91.445]
  - - [1536, 8192, 1, 6144]
    - [8, 94.562]
  - - [4608, 8192, 1, 1536]
    - [6, 92.454]
  - - [50304, 8192, 1, 1536]
    - [9, 94.516]
  - - [6144, 8192, 1, 1536]
    - [6, 92.57]
  - - [1024, 1024, 128, 96]
    - [6, 65.799]
  - - [96, 1024, 128, 1024]
    - [19, 78.8]
  - - [1024, 16384, 1, 1024]
    - [6, 88.86]
  - - [1024, 16384, 1, 4096]
    - [8, 92.695]
  - - [3072, 16384, 1, 1024]
    - [7, 92.42]
  - - [4096, 16384, 1, 1024]
    - [7, 92.14]
  - - [50304, 16384, 1, 1024]
    - [9, 94.631]
  - - [1024, 1024, 256, 64]
    - [6, 46.847]
  - - [64, 1024, 256, 1024]
    - [8, 72.773]
  - - [50304, 2048, 1, 1024]
    - [9, 91.017]
  - - [1024, 1024, 32, 64]
    - [6, 44.743]
  - - [64, 1024, 32, 1024]
    - [15, 66.151]
  - - [50304, 4096, 1, 1024]
    - [9, 93.526]
  - - [1024, 1024, 64, 64]
    - [6, 46.063]
  - - [64, 1024, 64, 1024]
    - [8, 69.426]
  - - [50304, 8192, 1, 1024]
    - [9, 93.837]
  - - [1024, 1024, 128, 64]
    - [6, 46.635]
  - - [64, 1024, 128, 1024]
    - [8, 69.776]
  - - [1024, 64, 1, 1024]
    - [79, 16.896]
  - - [30528, 8192, 1, 1024]
    - [9, 93.63]
  - - [2, 64, 1, 1024]
    - [24, 0.033]
  - - [128, 128, 1024, 64]
    - [26, 31.586]
  - - [64, 128, 1024, 128]
    - [27, 35.244]
  - - [1024, 3456, 1, 1024]
    - [6, 85.06]
  - - [1024, 3456, 1, 480]
    - [6, 79.085]
  - - [1024, 864, 1, 1024]
    - [41, 71.755]
  - - [1024, 864, 1, 480]
    - [26, 60.758]
  - - [128, 3456, 1, 256]
    - [14, 36.453]
  - - [128, 4096, 1, 256]
    - [14, 36.437]
  - - [128, 6912, 1, 256]
    - [58, 47.475]
  - - [128, 864, 1, 256]
    - [38, 12.633]
  - - [256, 3456, 1, 512]
    - [58, 61.304]
  - - [256, 864, 1, 512]
    - [4, 35.196]
  - - [3456, 1, 1, 256]
    - [21, 0.387]
  - - [4096, 1, 1, 256]
    - [22, 0.45]
  - - [512, 3456, 1, 1024]
    - [8, 80.214]
  - - [512, 3456, 1, 13]
    - [5, 6.36]
  - - [512, 4096, 1, 13]
    - [5, 7.185]
  - - [512, 6912, 1, 13]
    - [5, 8.675]
  - - [512, 864, 1, 1024]
    - [54, 61.305]
  - - [512, 864, 1, 13]
    - [172, 2.7]
  - - [6912, 1, 1, 256]
    - [22, 0.7]
  - - [864, 1, 1, 256]
    - [24, 0.11]
  - - [30528, 640, 1, 1024]
    - [6, 89.386]
  - - [30528, 1280, 1, 1024]
    - [6, 89.997]
  - - [30528, 1600, 1, 1024]
    - [9, 90.777]
  - - [1024, 10240, 1, 1024]
    - [6, 87.33]
  - - [2, 80, 1, 1024]
    - [28, 0.042]
  - - [4096, 10240, 1, 1024]
    - [7, 91.552]
  - - [1024, 10240, 1, 4096]
    - [8, 91.513]
  - - [64, 128, 1280, 128]
    - [170, 35.919]
  - - [128, 128, 1280, 64]
    - [26, 31.357]
  - - [1024, 10496, 1, 4096]
    - [8, 93.703]
  - - [30528, 1640, 1, 1024]
    - [6, 89.055]
  - - [1024, 82, 1, 1024]
    - [4, 21.409]
  - - [4096, 10496, 1, 1024]
    - [7, 91.71]
  - - [1024, 10496, 1, 1024]
    - [6, 89.031]
  - - [2, 82, 1, 1024]
    - [25, 0.045]
  - - [64, 128, 1312, 128]
    - [173, 35.489]
  - - [128, 128, 1312, 64]
    - [26, 31.876]
  - - [30528, 160, 1, 1024]
    - [14, 80.995]
  - - [1024, 12, 1, 1024]
    - [22, 3.297]
  - - [30528, 240, 1, 1024]
    - [6, 79.781]
  - - [2, 12, 1, 1024]
    - [28, 0.006]
  - - [1024, 6144, 1, 1024]
    - [6, 87.583]
  - - [4096, 6144, 1, 1024]
    - [6, 90.441]
  - - [1024, 6144, 1, 4096]
    - [8, 93.409]
  - - [64, 512, 192, 512]
    - [27, 60.689]
  - - [512, 512, 192, 64]
    - [6, 42.559]
  - - [1, 4096, 1, 256]
    - [52, 0.468]
  - - [1, 6912, 1, 256]
    - [25, 0.718]
  - - [1024, 10224, 1, 1024]
    - [7, 86.708]
  - - [1024, 10192, 1, 1024]
    - [6, 86.78]
  - - [1024, 10208, 1, 1024]
    - [6, 86.713]
  - - [1024, 10224, 1, 4096]
    - [16, 91.339]
  - - [4096, 10224, 1, 1024]
    - [7, 91.322]
  - - [3072, 10224, 1, 1024]
    - [77, 91.17]
  - - [3072, 10240, 1, 1024]
    - [6, 90.912]
  - - [1024, 10192, 1, 4096]
    - [16, 90.86]
  - - [4096, 10192, 1, 1024]
    - [7, 91.114]
  - - [3072, 10192, 1, 1024]
    - [6, 90.656]
  - - [3072, 10200, 1, 1024]
    - [9, 90.517]
  - - [1024, 10184, 1, 1024]
    - [6, 86.915]
  - - [3072, 10208, 1, 1024]
    - [9, 90.679]
  - - [1024, 10208, 1, 4096]
    - [16, 91.14]
  - - [4096, 10208, 1, 1024]
    - [7, 91.175]
  - - [2048, 10224, 1, 1024]
    - [77, 89.42]
  - - [2048, 10240, 1, 1024]
    - [77, 89.329]
  - - [1024, 10120, 1, 1024]
    - [6, 86.338]
  - - [2048, 10192, 1, 1024]
    - [77, 88.388]
  - - [24, 24, 6816, 64]
    - [60, 12.824]
  - - [1024, 10152, 1, 1024]
    - [7, 86.129]
  - - [3072, 10080, 1, 1024]
    - [7, 91.456]
  - - [26, 26, 6272, 64]
    - [68, 13.192]
  - - [1024, 512, 1, 196]
    - [5, 26.164]
  - - [256, 128, 1, 3136]
    - [24, 12.06]
  - - [512, 256, 1, 784]
    - [62, 23.389]
  - - [128, 128, 49, 12800]
    - [31, 81.676]
  - - [128, 128, 25, 25088]
    - [18, 81.232]
  - - [128, 128, 49, 25600]
    - [101, 82.83]
  - - [128, 128, 25, 50176]
    - [84, 80.504]
  - - [256, 256, 25, 12544]
    - [42, 86.4]
  - - [256, 256, 49, 3200]
    - [14, 81.733]
  - - [256, 256, 25, 6272]
    - [42, 84.109]
  - - [256, 256, 49, 6400]
    - [8, 83.142]
  - - [512, 512, 49, 1152]
    - [65, 86.865]
  - - [512, 512, 25, 2048]
    - [12, 87.955]
  - - [512, 512, 49, 2304]
    - [12, 90.135]
  - - [512, 512, 25, 4096]
    - [12, 89.451]
