library/src/blas3/Tensile/Logic/asm_full/aldebaran/aldebaran_Cijk_Ailk_Bjlk_SB.yaml
- {MinimumRequiredVersion: 4.31.0}
- aldebaran
- gfx90a
- [Device 0050, Device 0051, Device 0052, Device 0054, Device 0062, Device 7400, Device
    SolutionIndex: 0
    SolutionNameMin: Cijk_Ailk_Bjlk_SB_MT64x192x16_MI32x32x2x1_SE_GRVW4_NLCA1_NLCB3_SU0_SUS128_SRVW4_TT1_96_WG64_4_1_WGM15
    SolutionIndex: 1
    SolutionNameMin: Cijk_Ailk_Bjlk_SB_MT64x192x16_MI32x32x2x1_SE_GRVW4_NLCA1_NLCB3_SU0_SUS256_SRVW4_TT1_96_WG64_4_1_WGM2
    SolutionIndex: 2
    SolutionNameMin: Cijk_Ailk_Bjlk_SB_MT128x96x16_MI32x32x2x1_SE_GRVW2_NLCA1_NLCB3_SU0_SUS128_SRVW4_TT1_96_WG128_2_1_WGM1
    SolutionIndex: 3
    SolutionNameMin: Cijk_Ailk_Bjlk_SB_MT32x32x32_MI16x16x4x1_SE_1LDSB0_AF0EM1_AF1EM1_AMAS0_DVO0_EPS0_FL0_GRVW1_GSU1_IU1_MDA2_NEPBS0_NLCA1_NLCB1_ONLL1_PGR2_PLR1_SIA3_SS0_SU32_SUS128_SRVW2_SVW4_SNLL0_TT1_16_TLDS0_USFGROn1_VW1_WSGRA1_WSGRB1_WG32_8_1_WGM1
    SolutionIndex: 4
    SolutionNameMin: Cijk_Ailk_Bjlk_SB_MT32x32x16_MI16x16x4x1_SE_1LDSB0_AF0EM1_AF1EM1_AMAS0_DVO0_EPS0_FL0_GRVW1_GSU1_IU1_MDA2_NEPBS0_NLCA1_NLCB1_ONLL1_PGR2_PLR1_SIA3_SS0_SU0_SUS256_SRVW2_SVW4_SNLL0_TT1_16_TLDS0_USFGROn1_VW1_WSGRA1_WSGRB1_WG32_8_1_WGM1
    SolutionIndex: 5
    SolutionNameMin: Cijk_Ailk_Bjlk_SB_MT32x32x32_MI16x16x4x1_SE_1LDSB0_AF0EM1_AF1EM1_AMAS0_DVO0_EPS0_FL0_GRVW1_GSU1_IU1_MDA2_NEPBS0_NLCA1_NLCB1_ONLL1_PGR2_PLR1_SIA3_SS0_SU0_SUS256_SRVW2_SVW4_SNLL0_TT1_16_TLDS0_USFGROn1_VW1_WSGRA1_WSGRB1_WG32_8_1_WGM1
    SolutionIndex: 6
    SolutionNameMin: Cijk_Ailk_Bjlk_SB_MT64x64x16_MI32x32x2x1_SN_1LDSB0_AF0EM1_AF1EM1_AMAS0_DVO0_EPS0_FL0_GRVW4_GSU1_IU1_MDA2_NEPBS4_NLCA1_NLCB1_ONLL1_PGR2_PLR9_SIA3_SS1_SU0_SUS256_SRVW0_SVW1_SNLL0_TT1_32_TLDS0_USFGROn1_VW1_WSGRA1_WSGRB1_WG64_4_1_WGM8
    SolutionIndex: 7
    SolutionNameMin: Cijk_Ailk_Bjlk_SB_MT64x64x16_MI32x32x2x1_SN_1LDSB0_AF0EM1_AF1EM1_AMAS0_DVO0_EPS0_FL0_GRVW4_GSU1_IU1_MDA2_NEPBS8_NLCA1_NLCB1_ONLL1_PGR2_PLR9_SIA3_SS1_SU0_SUS256_SRVW0_SVW1_SNLL0_TT1_32_TLDS0_USFGROn1_VW1_WSGRA1_WSGRB1_WG64_4_1_WGM8
    SolutionIndex: 8
    SolutionNameMin: Cijk_Ailk_Bjlk_SB_MT64x32x16_MI16x16x4x1_SE_1LDSB0_AF0EM1_AF1EM1_AMAS0_DVO0_EPS0_FL0_GRVW4_GSU1_IU1_MDA2_NEPBS0_NLCA1_NLCB1_ONLL1_PGR2_PLR1_SIA3_SS0_SU0_SUS256_SRVW2_SVW4_SNLL0_TT2_16_TLDS0_USFGROn1_VW1_WSGRA1_WSGRB1_WG32_8_1_WGM1
    SolutionIndex: 9
    SolutionNameMin: Cijk_Ailk_Bjlk_SB_MT64x32x8_MI16x16x4x1_SE_1LDSB0_AF0EM1_AF1EM1_AMAS0_DVO0_EPS0_FL0_GRVW1_GSU1_IU1_MDA2_NEPBS0_NLCA1_NLCB1_ONLL1_PGR2_PLR1_SIA3_SS0_SU0_SUS256_SRVW2_SVW4_SNLL0_TT2_16_TLDS0_USFGROn1_VW1_WSGRA1_WSGRB1_WG32_8_1_WGM1
    SolutionIndex: 10
    SolutionNameMin: Cijk_Ailk_Bjlk_SB_MT64x32x32_MI16x16x4x1_SE_1LDSB0_AF0EM1_AF1EM1_AMAS0_DVO0_EPS0_FL0_GRVW4_GSU1_IU1_MDA2_NEPBS0_NLCA1_NLCB1_ONLL1_PGR2_PLR1_SIA3_SS0_SU0_SUS256_SRVW2_SVW4_SNLL0_TT2_16_TLDS0_USFGROn1_VW1_WSGRA1_WSGRB1_WG32_8_1_WGM1
    SolutionIndex: 11
    SolutionNameMin: Cijk_Ailk_Bjlk_SB_MT128x64x16_MI32x32x2x1_SN_1LDSB1_AF0EM1_AF1EM1_AMAS3_DVO0_EPS0_FL0_GRVW4_GSU1_IU1_MDA2_NEPBS4_NLCA1_NLCB1_ONLL1_PGR2_PLR9_SIA3_SS1_SU0_SUS256_SRVW0_SVW2_SNLL0_TT2_32_TLDS0_USFGROn1_VW2_WSGRA1_WSGRB1_WG64_4_1_WGM8
    SolutionIndex: 12
    SolutionNameMin: Cijk_Ailk_Bjlk_SB_MT32x64x32_MI16x16x4x1_SE_1LDSB0_AF0EM1_AF1EM1_AMAS0_DVO0_EPS0_FL0_GRVW4_GSU1_IU1_MDA2_NEPBS0_NLCA1_NLCB1_ONLL1_PGR2_PLR1_SIA3_SS0_SU0_SUS256_SRVW2_SVW4_SNLL0_TT1_32_TLDS0_USFGROn1_VW1_WSGRA1_WSGRB1_WG32_8_1_WGM1
    SolutionIndex: 13
    SolutionNameMin: Cijk_Ailk_Bjlk_SB_MT64x32x8_MI16x16x4x1_SE_1LDSB0_AF0EM1_AF1EM1_AMAS0_DVO0_EPS0_FL0_GRVW1_GSU1_IU1_MDA2_NEPBS0_NLCA1_NLCB1_ONLL1_PGR2_PLR1_SIA3_SS0_SU0_SUS256_SRVW2_SVW4_SNLL0_TT2_16_TLDS0_USFGROn1_VW1_WSGRA1_WSGRB1_WG32_8_1_WGM2
    SolutionIndex: 14
    SolutionNameMin: Cijk_Ailk_Bjlk_SB_MT64x32x32_MI16x16x4x1_SE_1LDSB0_AF0EM1_AF1EM1_AMAS0_DVO0_EPS0_FL0_GRVW2_GSU1_IU1_MDA2_NEPBS0_NLCA1_NLCB1_ONLL1_PGR2_PLR1_SIA3_SS0_SU0_SUS256_SRVW2_SVW4_SNLL0_TT2_16_TLDS0_USFGROn1_VW1_WSGRA1_WSGRB1_WG32_8_1_WGM1
    SolutionIndex: 15
    SolutionNameMin: Cijk_Ailk_Bjlk_SB_MT64x64x32_MI32x32x2x1_SN_1LDSB1_AF0EM1_AF1EM1_AMAS0_DVO0_EPS0_FL0_GRVW4_GSU1_IU1_MDA2_NEPBS8_NLCA1_NLCB1_ONLL1_PGR2_PLR17_SIA3_SS1_SU0_SUS256_SRVW0_SVW1_SNLL0_TT1_32_TLDS0_USFGROn1_VW1_WSGRA1_WSGRB1_WG64_4_1_WGM8
    SolutionIndex: 16
    SolutionNameMin: Cijk_Ailk_Bjlk_SB_MT64x64x8_MI32x32x2x1_SE_1LDSB0_AF0EM1_AF1EM1_AMAS0_DVO0_EPS0_FL0_GRVW1_GSU1_IU1_MDA2_NEPBS0_NLCA1_NLCB1_ONLL1_PGR2_PLR1_SIA3_SS0_SU0_SUS256_SRVW2_SVW4_SNLL0_TT1_32_TLDS0_USFGROn1_VW1_WSGRA1_WSGRB1_WG64_4_1_WGM15
    SolutionIndex: 17
    SolutionNameMin: Cijk_Ailk_Bjlk_SB_MT32x32x8_MI16x16x4x1_SE_1LDSB0_AF0EM1_AF1EM1_AMAS0_DVO0_EPS0_FL0_GRVW1_GSU1_IU1_MDA2_NEPBS0_NLCA1_NLCB1_ONLL1_PGR2_PLR1_SIA3_SS0_SU0_SUS256_SRVW2_SVW4_SNLL0_TT1_16_TLDS0_USFGROn1_VW1_WSGRA1_WSGRB1_WG32_8_1_WGM2
    SolutionIndex: 18
    SolutionNameMin: Cijk_Ailk_Bjlk_SB_MT32x32x8_MI16x16x4x1_SE_1LDSB0_AF0EM1_AF1EM1_AMAS0_DVO0_EPS0_FL0_GRVW4_GSU1_IU1_MDA2_NEPBS0_NLCA1_NLCB1_ONLL1_PGR2_PLR1_SIA3_SS0_SU0_SUS256_SRVW2_SVW4_SNLL0_TT1_16_TLDS0_USFGROn1_VW1_WSGRA1_WSGRB1_WG32_8_1_WGM1
    SolutionIndex: 19
    SolutionNameMin: Cijk_Ailk_Bjlk_SB_MT32x32x32_MI16x16x4x1_SE_1LDSB0_AF0EM1_AF1EM1_AMAS0_DVO0_EPS0_FL0_GRVW4_GSU1_IU1_MDA2_NEPBS0_NLCA1_NLCB1_ONLL1_PGR2_PLR1_SIA3_SS0_SU0_SUS256_SRVW2_SVW4_SNLL0_TT1_16_TLDS0_USFGROn1_VW1_WSGRA1_WSGRB1_WG32_8_1_WGM15
    SolutionIndex: 20
    SolutionNameMin: Cijk_Ailk_Bjlk_SB_MT32x32x32_MI16x16x4x1_SN_1LDSB0_AF0EM1_AF1EM1_AMAS0_DVO0_EPS0_FL0_GRVW4_GSU1_IU1_MDA2_NEPBS8_NLCA1_NLCB1_ONLL1_PGR2_PLR9_SIA3_SS1_SU0_SUS256_SRVW0_SVW1_SNLL0_TT1_16_TLDS0_USFGROn1_VW1_WSGRA1_WSGRB1_WG32_8_1_WGM8
    SolutionIndex: 21
    SolutionNameMin: Cijk_Ailk_Bjlk_SB_MT64x64x32_MI32x32x2x1_SE_1LDSB0_AF0EM1_AF1EM1_AMAS0_DVO0_EPS0_FL0_GRVW1_GSU1_IU1_MDA2_NEPBS0_NLCA1_NLCB1_ONLL1_PGR2_PLR1_SIA3_SS0_SU0_SUS256_SRVW2_SVW4_SNLL0_TT1_32_TLDS0_USFGROn1_VW1_WSGRA1_WSGRB1_WG64_4_1_WGM1
    SolutionIndex: 22
    SolutionNameMin: Cijk_Ailk_Bjlk_SB_MT64x64x32_MI32x32x2x1_SE_1LDSB0_AF0EM1_AF1EM1_AMAS0_DVO0_EPS0_FL0_GRVW4_GSU1_IU1_MDA2_NEPBS0_NLCA1_NLCB1_ONLL1_PGR2_PLR1_SIA3_SS0_SU0_SUS256_SRVW2_SVW4_SNLL0_TT1_32_TLDS0_USFGROn1_VW1_WSGRA1_WSGRB1_WG64_4_1_WGM1
    SolutionIndex: 23
    SolutionNameMin: Cijk_Ailk_Bjlk_SB_MT32x32x32_MI16x16x4x1_SN_1LDSB0_AF0EM1_AF1EM1_AMAS0_DVO0_EPS0_FL0_GRVW4_GSU1_IU1_MDA2_NEPBS4_NLCA1_NLCB1_ONLL1_PGR2_PLR9_SIA3_SS1_SU0_SUS256_SRVW0_SVW1_SNLL0_TT1_16_TLDS0_USFGROn1_VW1_WSGRA1_WSGRB1_WG32_8_1_WGM8
    SolutionIndex: 24
    SolutionNameMin: Cijk_Ailk_Bjlk_SB_MT16x64x32_MI16x16x4x1_SE_1LDSB0_AF0EM1_AF1EM1_AMAS0_DVO0_EPS0_FL0_GRVW1_GSU1_IU1_MDA2_NEPBS0_NLCA1_NLCB1_ONLL1_PGR2_PLR1_SIA3_SS0_SU0_SUS256_SRVW0_SVW4_SNLL0_TT1_16_TLDS0_USFGROn1_VW1_WSGRA1_WSGRB1_WG16_16_1_WGM15
    SolutionIndex: 25
    SolutionNameMin: Cijk_Ailk_Bjlk_SB_MT16x64x16_MI16x16x4x1_SE_1LDSB0_AF0EM1_AF1EM1_AMAS0_DVO0_EPS0_FL0_GRVW2_GSU1_IU1_MDA2_NEPBS0_NLCA1_NLCB1_ONLL1_PGR2_PLR1_SIA3_SS0_SU0_SUS256_SRVW0_SVW4_SNLL0_TT1_16_TLDS0_USFGROn1_VW1_WSGRA1_WSGRB1_WG16_16_1_WGM1
    SolutionIndex: 26
    SolutionNameMin: Cijk_Ailk_Bjlk_SB_MT64x64x32_MI32x32x2x1_SE_1LDSB0_AF0EM1_AF1EM1_AMAS0_DVO0_EPS0_FL0_GRVW4_GSU1_IU1_MDA2_NEPBS0_NLCA1_NLCB1_ONLL1_PGR2_PLR1_SIA3_SS0_SU0_SUS256_SRVW2_SVW4_SNLL0_TT1_32_TLDS0_USFGROn1_VW1_WSGRA1_WSGRB1_WG64_4_1_WGM15
    SolutionIndex: 27
    SolutionNameMin: Cijk_Ailk_Bjlk_SB_MT64x64x16_MI32x32x2x1_SE_1LDSB0_AF0EM1_AF1EM1_AMAS0_DVO0_EPS0_FL0_GRVW1_GSU1_IU1_MDA2_NEPBS0_NLCA1_NLCB1_ONLL1_PGR2_PLR1_SIA3_SS0_SU0_SUS256_SRVW2_SVW4_SNLL0_TT1_32_TLDS0_USFGROn1_VW1_WSGRA1_WSGRB1_WG64_4_1_WGM15
    SolutionIndex: 28
    SolutionNameMin: Cijk_Ailk_Bjlk_SB_MT64x16x32_MI16x16x4x1_SE_1LDSB0_AF0EM1_AF1EM1_AMAS0_DVO0_EPS0_FL0_GRVW1_GSU1_IU1_MDA2_NEPBS0_NLCA1_NLCB1_ONLL1_PGR2_PLR1_SIA3_SS0_SU0_SUS256_SRVW0_SVW4_SNLL0_TT1_16_TLDS0_USFGROn1_VW1_WSGRA1_WSGRB1_WG64_4_1_WGM2
    SolutionIndex: 29
    SolutionNameMin: Cijk_Ailk_Bjlk_SB_MT32x32x32_MI16x16x4x1_SE_1LDSB0_AF0EM1_AF1EM1_AMAS0_DVO0_EPS0_FL0_GRVW1_GSU1_IU1_MDA2_NEPBS0_NLCA1_NLCB1_ONLL1_PGR2_PLR1_SIA3_SS0_SU0_SUS256_SRVW2_SVW4_SNLL0_TT1_16_TLDS0_USFGROn1_VW1_WSGRA1_WSGRB1_WG32_8_1_WGM2
    SolutionIndex: 30
    SolutionNameMin: Cijk_Ailk_Bjlk_SB_MT64x64x32_MI32x32x2x1_SE_1LDSB0_AF0EM1_AF1EM1_AMAS0_DVO0_EPS0_FL0_GRVW4_GSU1_IU1_MDA2_NEPBS0_NLCA1_NLCB1_ONLL1_PGR2_PLR1_SIA3_SS0_SU32_SUS256_SRVW2_SVW4_SNLL0_TT1_32_TLDS0_USFGROn1_VW1_WSGRA1_WSGRB1_WG64_4_1_WGM1
    SolutionIndex: 31
    SolutionNameMin: Cijk_Ailk_Bjlk_SB_MT64x64x16_MI32x32x2x1_SE_1LDSB0_AF0EM1_AF1EM1_AMAS0_DVO0_EPS0_FL0_GRVW4_GSU1_IU1_MDA2_NEPBS0_NLCA1_NLCB1_ONLL1_PGR2_PLR1_SIA3_SS0_SU0_SUS256_SRVW2_SVW4_SNLL0_TT1_32_TLDS0_USFGROn1_VW1_WSGRA1_WSGRB1_WG64_4_1_WGM15
    SolutionIndex: 32
    SolutionNameMin: Cijk_Ailk_Bjlk_SB_MT144x64x16_MI16x16x4x1_SE_1LDSB0_AF0EM1_AF1EM1_AMAS0_DVO0_EPS0_FL0_GRVW1_GSU1_IU1_MDA2_NEPBS0_NLCA9_NLCB1_ONLL1_PGR2_PLR1_SIA3_SS0_SU0_SUS256_SRVW0_SVW4_SNLL0_TT9_16_TLDS0_USFGROn1_VW1_WSGRA1_WSGRB1_WG16_16_1_WGM2
    SolutionIndex: 33
    SolutionNameMin: Cijk_Ailk_Bjlk_SB_MT64x144x16_MI16x16x4x1_SE_1LDSB0_AF0EM1_AF1EM1_AMAS0_DVO0_EPS0_FL0_GRVW1_GSU1_IU1_MDA2_NEPBS0_NLCA1_NLCB9_ONLL1_PGR2_PLR1_SIA3_SS0_SU0_SUS256_SRVW2_SVW4_SNLL0_TT1_144_TLDS0_USFGROn1_VW1_WSGRA1_WSGRB1_WG64_4_1_WGM15
    SolutionIndex: 34
    SolutionNameMin: Cijk_Ailk_Bjlk_SB_MT32x32x32_MI16x16x4x1_SE_1LDSB0_AF0EM1_AF1EM1_AMAS0_DVO0_EPS0_FL0_GRVW4_GSU1_IU1_MDA2_NEPBS0_NLCA1_NLCB1_ONLL1_PGR2_PLR1_SIA3_SS0_SU32_SUS128_SRVW2_SVW4_SNLL0_TT1_16_TLDS0_USFGROn1_VW1_WSGRA1_WSGRB1_WG32_8_1_WGM1
    SolutionIndex: 35
    SolutionNameMin: Cijk_Ailk_Bjlk_SB_MT64x64x32_MI32x32x2x1_SE_1LDSB0_AF0EM1_AF1EM1_AMAS0_DVO0_EPS0_FL0_GRVW4_GSU1_IU1_MDA2_NEPBS0_NLCA1_NLCB1_ONLL1_PGR2_PLR1_SIA3_SS0_SU32_SUS128_SRVW2_SVW4_SNLL0_TT1_32_TLDS0_USFGROn1_VW1_WSGRA1_WSGRB1_WG64_4_1_WGM1
    SolutionIndex: 36
    SolutionNameMin: Cijk_Ailk_Bjlk_SB_MT64x144x16_MI16x16x4x1_SE_1LDSB0_AF0EM1_AF1EM1_AMAS0_DVO0_EPS0_FL0_GRVW1_GSU1_IU1_MDA2_NEPBS0_NLCA1_NLCB9_ONLL1_PGR2_PLR1_SIA3_SS0_SU0_SUS256_SRVW2_SVW4_SNLL0_TT1_144_TLDS0_USFGROn1_VW1_WSGRA1_WSGRB1_WG64_4_1_WGM1
    SolutionIndex: 37
    SolutionNameMin: Cijk_Ailk_Bjlk_SB_MT64x32x32_MI16x16x4x1_SE_1LDSB0_AF0EM1_AF1EM1_AMAS0_DVO0_EPS0_FL0_GRVW1_GSU1_IU1_MDA2_NEPBS0_NLCA1_NLCB1_ONLL1_PGR2_PLR1_SIA3_SS0_SU0_SUS256_SRVW2_SVW4_SNLL0_TT2_16_TLDS0_USFGROn1_VW1_WSGRA1_WSGRB1_WG32_8_1_WGM1
    SolutionIndex: 38
    SolutionNameMin: Cijk_Ailk_Bjlk_SB_MT16x64x16_MI16x16x4x1_SN_1LDSB0_AF0EM1_AF1EM1_AMAS0_DVO0_EPS0_FL0_GRVW4_GSU1_IU1_MDA2_NEPBS8_NLCA1_NLCB1_ONLL1_PGR2_PLR5_SIA3_SS1_SU0_SUS256_SRVW0_SVW1_SNLL0_TT1_16_TLDS0_USFGROn1_VW1_WSGRA1_WSGRB1_WG16_16_1_WGM8
    SolutionIndex: 39
    SolutionNameMin: Cijk_Ailk_Bjlk_SB_MT64x64x32_MI32x32x2x1_SE_1LDSB0_AF0EM1_AF1EM1_AMAS0_DVO0_EPS0_FL0_GRVW4_GSU1_IU1_MDA2_NEPBS0_NLCA1_NLCB1_ONLL1_PGR2_PLR1_SIA3_SS0_SU32_SUS256_SRVW2_SVW4_SNLL0_TT1_32_TLDS0_USFGROn1_VW1_WSGRA1_WSGRB1_WG64_4_1_WGM15
    SolutionIndex: 40
    SolutionNameMin: Cijk_Ailk_Bjlk_SB_MT64x64x32_MI32x32x2x1_SE_1LDSB0_AF0EM1_AF1EM1_AMAS0_DVO0_EPS0_FL0_GRVW4_GSU1_IU1_MDA2_NEPBS0_NLCA1_NLCB1_ONLL1_PGR2_PLR1_SIA3_SS0_SU32_SUS128_SRVW2_SVW4_SNLL0_TT1_32_TLDS0_USFGROn1_VW1_WSGRA1_WSGRB1_WG64_4_1_WGM2
    SolutionIndex: 41
    SolutionNameMin: Cijk_Ailk_Bjlk_SB_MT96x96x16_MI16x16x4x1_SE_1LDSB1_AF0EM1_AF1EM1_AMAS0_DVO0_EPS0_FL0_GRVW2_GSU1_IU1_MDA2_NEPBS0_NLCA3_NLCB3_ONLL1_PGR2_PLR1_SIA3_SS0_SU0_SUS256_SRVW0_SVW4_SNLL0_TT3_48_TLDS0_USFGROn1_VW1_WSGRA1_WSGRB1_WG32_8_1_WGM2
    SolutionIndex: 42
    SolutionNameMin: Cijk_Ailk_Bjlk_SB_MT32x32x16_MI16x16x4x1_SE_1LDSB0_AF0EM1_AF1EM1_AMAS0_DVO0_EPS0_FL0_GRVW4_GSU1_IU1_MDA2_NEPBS0_NLCA1_NLCB1_ONLL1_PGR2_PLR1_SIA3_SS0_SU0_SUS256_SRVW2_SVW4_SNLL0_TT1_16_TLDS0_USFGROn1_VW1_WSGRA1_WSGRB1_WG32_8_1_WGM15
    SolutionIndex: 43
    SolutionNameMin: Cijk_Ailk_Bjlk_SB_MT32x32x16_MI16x16x4x1_SE_1LDSB0_AF0EM1_AF1EM1_AMAS0_DVO0_EPS0_FL0_GRVW1_GSU1_IU1_MDA2_NEPBS0_NLCA1_NLCB1_ONLL1_PGR2_PLR1_SIA3_SS0_SU0_SUS256_SRVW2_SVW4_SNLL0_TT1_16_TLDS0_USFGROn1_VW1_WSGRA1_WSGRB1_WG32_8_1_WGM15
    SolutionIndex: 44
    SolutionNameMin: Cijk_Ailk_Bjlk_SB_MT32x32x32_MI16x16x4x1_SE_1LDSB0_AF0EM1_AF1EM1_AMAS0_DVO0_EPS0_FL0_GRVW1_GSU1_IU1_MDA2_NEPBS0_NLCA1_NLCB1_ONLL1_PGR2_PLR1_SIA3_SS0_SU0_SUS256_SRVW2_SVW4_SNLL0_TT1_16_TLDS0_USFGROn1_VW1_WSGRA1_WSGRB1_WG32_8_1_WGM15
    SolutionIndex: 45
    SolutionNameMin: Cijk_Ailk_Bjlk_SB_MT32x32x32_MI16x16x4x1_SN_1LDSB0_AF0EM1_AF1EM1_AMAS0_DVO0_EPS0_FL0_GRVW2_GSU1_IU1_MDA2_NEPBS4_NLCA1_NLCB1_ONLL1_PGR2_PLR9_SIA3_SS1_SU0_SUS256_SRVW0_SVW1_SNLL0_TT1_16_TLDS0_USFGROn1_VW1_WSGRA1_WSGRB1_WG32_8_1_WGM8
    SolutionIndex: 46
    SolutionNameMin: Cijk_Ailk_Bjlk_SB_MT64x64x32_MI32x32x2x1_SE_1LDSB0_AF0EM1_AF1EM1_AMAS0_DVO0_EPS0_FL0_GRVW4_GSU1_IU1_MDA2_NEPBS0_NLCA1_NLCB1_ONLL1_PGR2_PLR1_SIA3_SS0_SU32_SUS128_SRVW2_SVW4_SNLL0_TT1_32_TLDS0_USFGROn1_VW1_WSGRA1_WSGRB1_WG64_4_1_WGM15
    SolutionIndex: 47
    SolutionNameMin: Cijk_Ailk_Bjlk_SB_MT16x64x16_MI16x16x4x1_SN_1LDSB0_AF0EM1_AF1EM1_AMAS0_DVO0_EPS0_FL0_GRVW2_GSU1_IU1_MDA2_NEPBS8_NLCA1_NLCB1_ONLL1_PGR2_PLR5_SIA3_SS1_SU0_SUS256_SRVW0_SVW1_SNLL0_TT1_16_TLDS0_USFGROn1_VW1_WSGRA1_WSGRB1_WG16_16_1_WGM8
    SolutionIndex: 48
    SolutionNameMin: Cijk_Ailk_Bjlk_SB_MT32x64x16_MI16x16x4x1_SE_1LDSB0_AF0EM1_AF1EM1_AMAS0_DVO0_EPS0_FL0_GRVW2_GSU1_IU1_MDA2_NEPBS0_NLCA1_NLCB1_ONLL1_PGR2_PLR1_SIA3_SS0_SU0_SUS256_SRVW2_SVW4_SNLL0_TT1_32_TLDS0_USFGROn1_VW1_WSGRA1_WSGRB1_WG32_8_1_WGM15
    SolutionIndex: 49
    SolutionNameMin: Cijk_Ailk_Bjlk_SB_MT32x64x32_MI16x16x4x1_SE_1LDSB0_AF0EM1_AF1EM1_AMAS0_DVO0_EPS0_FL0_GRVW2_GSU1_IU1_MDA2_NEPBS0_NLCA1_NLCB1_ONLL1_PGR2_PLR1_SIA3_SS0_SU0_SUS256_SRVW2_SVW4_SNLL0_TT1_32_TLDS0_USFGROn1_VW1_WSGRA1_WSGRB1_WG32_8_1_WGM15
    SolutionIndex: 50
    SolutionNameMin: Cijk_Ailk_Bjlk_SB_MT32x32x32_MI16x16x4x1_SE_1LDSB0_AF0EM1_AF1EM1_AMAS0_DVO0_EPS0_FL0_GRVW4_GSU1_IU1_MDA2_NEPBS0_NLCA1_NLCB1_ONLL1_PGR2_PLR1_SIA3_SS0_SU32_SUS256_SRVW2_SVW4_SNLL0_TT1_16_TLDS0_USFGROn1_VW1_WSGRA1_WSGRB1_WG32_8_1_WGM2
    SolutionIndex: 51
    SolutionNameMin: Cijk_Ailk_Bjlk_SB_MT64x64x16_MI32x32x2x1_SE_1LDSB0_AF0EM1_AF1EM1_AMAS0_DVO0_EPS0_FL0_GRVW4_GSU1_IU1_MDA2_NEPBS0_NLCA1_NLCB1_ONLL1_PGR2_PLR1_SIA3_SS0_SU0_SUS256_SRVW2_SVW4_SNLL0_TT1_32_TLDS0_USFGROn1_VW1_WSGRA1_WSGRB1_WG64_4_1_WGM1
    SolutionIndex: 52
    SolutionNameMin: Cijk_Ailk_Bjlk_SB_MT32x64x16_MI16x16x4x1_SE_1LDSB0_AF0EM1_AF1EM1_AMAS0_DVO0_EPS0_FL0_GRVW2_GSU1_IU1_MDA2_NEPBS0_NLCA1_NLCB1_ONLL1_PGR2_PLR1_SIA3_SS0_SU32_SUS128_SRVW2_SVW4_SNLL0_TT1_32_TLDS0_USFGROn1_VW1_WSGRA1_WSGRB1_WG32_8_1_WGM15
    SolutionIndex: 53
    SolutionNameMin: Cijk_Ailk_Bjlk_SB_MT16x16x32_MI16x16x4x1_SE_1LDSB0_AF0EM1_AF1EM1_AMAS0_DVO0_EPS0_FL0_GRVW1_GSU1_IU1_MDA2_NEPBS0_NLCA1_NLCB1_ONLL1_PGR2_PLR1_SIA3_SS0_SU0_SUS256_SRVW0_SVW4_SNLL0_TT1_16_TLDS0_USFGROn1_VW1_WSGRA1_WSGRB1_WG16_4_1_WGM2
    SolutionIndex: 54
    SolutionNameMin: Cijk_Ailk_Bjlk_SB_MT64x64x32_MI32x32x2x1_SE_1LDSB0_AF0EM1_AF1EM1_AMAS0_DVO0_EPS0_FL0_GRVW2_GSU1_IU1_MDA2_NEPBS0_NLCA1_NLCB1_ONLL1_PGR2_PLR1_SIA3_SS0_SU0_SUS256_SRVW2_SVW4_SNLL0_TT1_32_TLDS0_USFGROn1_VW1_WSGRA1_WSGRB1_WG64_4_1_WGM1
    SolutionIndex: 55
    SolutionNameMin: Cijk_Ailk_Bjlk_SB_MT64x64x32_MI32x32x2x1_SE_1LDSB0_AF0EM1_AF1EM1_AMAS0_DVO0_EPS1_FL0_GRVW4_GSU1_IU1_MDA2_NEPBS0_NLCA1_NLCB1_ONLL1_PGR1_PLR1_SIA3_SS0_SU0_SUS256_SRVW2_SVW4_SNLL0_TT1_32_TLDS0_USFGROn1_VW1_WSGRA1_WSGRB1_WG64_4_1_WGM2
    SolutionIndex: 56
    SolutionNameMin: Cijk_Ailk_Bjlk_SB_MT32x64x8_MI16x16x4x1_SE_1LDSB0_AF0EM1_AF1EM1_AMAS0_DVO0_EPS0_FL0_GRVW1_GSU1_IU1_MDA2_NEPBS0_NLCA1_NLCB1_ONLL1_PGR2_PLR1_SIA3_SS0_SU0_SUS256_SRVW2_SVW4_SNLL0_TT1_32_TLDS0_USFGROn1_VW1_WSGRA1_WSGRB1_WG32_8_1_WGM2
    SolutionIndex: 57
    SolutionNameMin: Cijk_Ailk_Bjlk_SB_MT128x64x16_MI32x32x2x1_SN_1LDSB1_AF0EM1_AF1EM1_AMAS3_DVO0_EPS0_FL0_GRVW2_GSU1_IU1_MDA2_NEPBS8_NLCA1_NLCB1_ONLL1_PGR2_PLR9_SIA3_SS1_SU0_SUS256_SRVW0_SVW2_SNLL0_TT2_32_TLDS0_USFGROn1_VW2_WSGRA1_WSGRB1_WG64_4_1_WGM8
    SolutionIndex: 58
    SolutionNameMin: Cijk_Ailk_Bjlk_SB_MT32x64x8_MI16x16x4x1_SE_1LDSB0_AF0EM1_AF1EM1_AMAS0_DVO0_EPS0_FL0_GRVW1_GSU1_IU1_MDA2_NEPBS0_NLCA1_NLCB1_ONLL1_PGR2_PLR1_SIA3_SS0_SU0_SUS256_SRVW2_SVW4_SNLL0_TT1_32_TLDS0_USFGROn1_VW1_WSGRA1_WSGRB1_WG32_8_1_WGM1
    SolutionIndex: 59
    SolutionNameMin: Cijk_Ailk_Bjlk_SB_MT64x32x8_MI16x16x4x1_SE_1LDSB0_AF0EM1_AF1EM1_AMAS0_DVO0_EPS0_FL0_GRVW1_GSU1_IU1_MDA2_NEPBS0_NLCA1_NLCB1_ONLL1_PGR2_PLR1_SIA3_SS0_SU32_SUS256_SRVW2_SVW4_SNLL0_TT2_16_TLDS0_USFGROn1_VW1_WSGRA1_WSGRB1_WG32_8_1_WGM1
    SolutionIndex: 60
    SolutionNameMin: Cijk_Ailk_Bjlk_SB_MT64x32x8_MI16x16x4x1_SE_1LDSB0_AF0EM1_AF1EM1_AMAS0_DVO0_EPS0_FL0_GRVW4_GSU1_IU1_MDA2_NEPBS0_NLCA1_NLCB1_ONLL1_PGR2_PLR1_SIA3_SS0_SU32_SUS128_SRVW2_SVW4_SNLL0_TT2_16_TLDS0_USFGROn1_VW1_WSGRA1_WSGRB1_WG32_8_1_WGM1
    SolutionIndex: 61
    SolutionNameMin: Cijk_Ailk_Bjlk_SB_MT64x16x16_MI16x16x4x1_SN_1LDSB0_AF0EM1_AF1EM1_AMAS0_DVO0_EPS0_FL0_GRVW2_GSU1_IU1_MDA2_NEPBS4_NLCA1_NLCB1_ONLL1_PGR2_PLR5_SIA3_SS1_SU0_SUS256_SRVW0_SVW1_SNLL0_TT1_16_TLDS0_USFGROn1_VW1_WSGRA1_WSGRB1_WG64_4_1_WGM8
    SolutionIndex: 62
    SolutionNameMin: Cijk_Ailk_Bjlk_SB_MT16x16x8_MI16x16x4x1_SE_1LDSB0_AF0EM1_AF1EM1_AMAS0_DVO0_EPS1_FL0_GRVW1_GSU1_IU1_MDA2_NEPBS0_NLCA1_NLCB1_ONLL1_PGR1_PLR1_SIA3_SS0_SU0_SUS256_SRVW0_SVW4_SNLL0_TT1_16_TLDS0_USFGROn1_VW1_WSGRA1_WSGRB1_WG16_4_1_WGM15
    SolutionIndex: 63
    SolutionNameMin: Cijk_Ailk_Bjlk_SB_MT16x16x8_MI16x16x4x1_SE_1LDSB0_AF0EM1_AF1EM1_AMAS0_DVO0_EPS1_FL0_GRVW1_GSU1_IU1_MDA2_NEPBS0_NLCA1_NLCB1_ONLL1_PGR1_PLR1_SIA3_SS0_SU0_SUS256_SRVW2_SVW4_SNLL0_TT1_16_TLDS0_USFGROn1_VW1_WSGRA1_WSGRB1_WG16_4_1_WGM1
    SolutionIndex: 64
    SolutionNameMin: Cijk_Ailk_Bjlk_SB_MT64x64x16_MI16x16x1x4_SE_1LDSB0_AF0EM4_AF1EM4_AMAS0_DVO0_EPS1_FL0_GRVW4_GSU1_IU2_MDA2_NEPBS0_NLCA1_NLCB1_ONLL0_PGR1_PLR1_SIA1_SS0_SU32_SUS256_SRVW0_SVW4_SNLL0_TT1_16_TLDS0_USFGROn1_VW1_WSGRA0_WSGRB0_WG64_4_1_WGM8
    SolutionIndex: 65
    SolutionNameMin: Cijk_Ailk_Bjlk_SB_MT64x32x8_MI16x16x4x1_SE_1LDSB0_AF0EM1_AF1EM1_AMAS0_DVO0_EPS0_FL0_GRVW1_GSU1_IU1_MDA2_NEPBS0_NLCA1_NLCB1_ONLL1_PGR2_PLR1_SIA3_SS0_SU0_SUS256_SRVW2_SVW4_SNLL0_TT2_16_TLDS0_USFGROn1_VW1_WSGRA1_WSGRB1_WG32_8_1_WGM15
    SolutionIndex: 66
    SolutionNameMin: Cijk_Ailk_Bjlk_SB_MT64x128x16_MI16x16x4x1_SE_1LDSB0_AF0EM4_AF1EM1_AMAS3_DVO0_EPS1_FL1_GRVW4_GSU1_IU1_MDA2_NEPBS0_NLCA1_NLCB1_ONLL0_PGR1_PLR1_SIA3_SS0_SU32_SUS256_SRVW4_SVW4_SNLL0_TT4_32_TLDS1_USFGROn1_VW4_WSGRA0_WSGRB0_WG16_16_1_WGM8
    SolutionIndex: 67
    SolutionNameMin: Cijk_Ailk_Bjlk_SB_MT16x16x8_MI16x16x4x1_SE_1LDSB0_AF0EM1_AF1EM1_AMAS0_DVO0_EPS1_FL0_GRVW1_GSU1_IU1_MDA2_NEPBS0_NLCA1_NLCB1_ONLL1_PGR1_PLR1_SIA3_SS0_SU0_SUS256_SRVW0_SVW4_SNLL0_TT1_16_TLDS0_USFGROn1_VW1_WSGRA1_WSGRB1_WG16_4_1_WGM1
    SolutionIndex: 68
    SolutionNameMin: Cijk_Ailk_Bjlk_SB_MT64x32x8_MI16x16x4x1_SE_1LDSB0_AF0EM1_AF1EM1_AMAS0_DVO0_EPS1_FL0_GRVW1_GSU1_IU1_MDA2_NEPBS0_NLCA1_NLCB1_ONLL1_PGR1_PLR1_SIA3_SS0_SU0_SUS256_SRVW2_SVW4_SNLL0_TT2_16_TLDS0_USFGROn1_VW1_WSGRA1_WSGRB1_WG32_8_1_WGM2
    SolutionIndex: 69
    SolutionNameMin: Cijk_Ailk_Bjlk_SB_MT32x64x16_MI16x16x4x1_SE_1LDSB0_AF0EM1_AF1EM1_AMAS0_DVO0_EPS0_FL0_GRVW1_GSU1_IU1_MDA2_NEPBS0_NLCA1_NLCB1_ONLL1_PGR2_PLR1_SIA3_SS0_SU0_SUS256_SRVW2_SVW4_SNLL0_TT1_32_TLDS0_USFGROn1_VW1_WSGRA1_WSGRB1_WG32_8_1_WGM1
    SolutionIndex: 70
    SolutionNameMin: Cijk_Ailk_Bjlk_SB_MT64x32x8_MI16x16x4x1_SE_1LDSB0_AF0EM1_AF1EM1_AMAS0_DVO0_EPS0_FL0_GRVW2_GSU1_IU1_MDA2_NEPBS0_NLCA1_NLCB1_ONLL1_PGR2_PLR1_SIA3_SS0_SU0_SUS256_SRVW2_SVW4_SNLL0_TT2_16_TLDS0_USFGROn1_VW1_WSGRA1_WSGRB1_WG32_8_1_WGM15
    SolutionIndex: 71
    SolutionNameMin: Cijk_Ailk_Bjlk_SB_MT32x32x16_MI16x16x4x1_SE_1LDSB0_AF0EM1_AF1EM1_AMAS0_DVO0_EPS0_FL0_GRVW2_GSU1_IU1_MDA2_NEPBS0_NLCA1_NLCB1_ONLL1_PGR2_PLR1_SIA3_SS0_SU0_SUS256_SRVW2_SVW4_SNLL0_TT1_16_TLDS0_USFGROn1_VW1_WSGRA1_WSGRB1_WG32_8_1_WGM2
    SolutionIndex: 72
    SolutionNameMin: Cijk_Ailk_Bjlk_SB_MT16x16x32_MI16x16x4x1_SE_1LDSB0_AF0EM1_AF1EM1_AMAS0_DVO0_EPS0_FL0_GRVW1_GSU1_IU1_MDA2_NEPBS0_NLCA1_NLCB1_ONLL1_PGR2_PLR1_SIA3_SS0_SU32_SUS256_SRVW0_SVW4_SNLL0_TT1_16_TLDS0_USFGROn1_VW1_WSGRA1_WSGRB1_WG16_4_1_WGM1
    SolutionIndex: 73
    SolutionNameMin: Cijk_Ailk_Bjlk_SB_MT64x64x16_MI16x16x4x1_SE_1LDSB0_AF0EM1_AF1EM1_AMAS3_DVO0_EPS1_FL0_GRVW2_GSU1_IU1_MDA2_NEPBS0_NLCA1_NLCB1_ONLL1_PGR1_PLR1_SIA3_SS0_SU32_SUS256_SRVW0_SVW4_SNLL0_TT2_32_TLDS1_USFGROn1_VW2_WSGRA1_WSGRB1_WG32_8_1_WGM8
    SolutionIndex: 74
    SolutionNameMin: Cijk_Ailk_Bjlk_SB_MT32x64x8_MI16x16x4x1_SE_1LDSB0_AF0EM1_AF1EM1_AMAS0_DVO0_EPS0_FL0_GRVW1_GSU1_IU1_MDA2_NEPBS0_NLCA1_NLCB1_ONLL1_PGR2_PLR1_SIA3_SS0_SU0_SUS256_SRVW2_SVW4_SNLL0_TT1_32_TLDS0_USFGROn1_VW1_WSGRA1_WSGRB1_WG32_8_1_WGM15
    SolutionIndex: 75
    SolutionNameMin: Cijk_Ailk_Bjlk_SB_MT64x16x16_MI16x16x4x1_SN_1LDSB0_AF0EM1_AF1EM1_AMAS0_DVO0_EPS0_FL0_GRVW4_GSU1_IU1_MDA2_NEPBS4_NLCA1_NLCB1_ONLL1_PGR2_PLR5_SIA3_SS1_SU0_SUS256_SRVW0_SVW1_SNLL0_TT1_16_TLDS0_USFGROn1_VW1_WSGRA1_WSGRB1_WG64_4_1_WGM8
    SolutionIndex: 76
    SolutionNameMin: Cijk_Ailk_Bjlk_SB_MT32x64x16_MI16x16x4x1_SE_1LDSB0_AF0EM1_AF1EM1_AMAS0_DVO0_EPS0_FL0_GRVW1_GSU1_IU1_MDA2_NEPBS0_NLCA1_NLCB1_ONLL1_PGR2_PLR1_SIA3_SS0_SU32_SUS256_SRVW2_SVW4_SNLL0_TT1_32_TLDS0_USFGROn1_VW1_WSGRA1_WSGRB1_WG32_8_1_WGM1
    SolutionIndex: 77
    SolutionNameMin: Cijk_Ailk_Bjlk_SB_MT64x64x16_MI16x16x4x1_SE_1LDSB0_AF0EM1_AF1EM1_AMAS3_DVO1_EPS1_FL1_GRVW4_GSU1_IU1_MDA2_NEPBS0_NLCA1_NLCB1_ONLL0_PGR1_PLR1_SIA3_SS0_SU32_SUS256_SRVW4_SVW4_SNLL0_TT4_16_TLDS1_USFGROn1_VW4_WSGRA0_WSGRB0_WG16_16_1_WGM1
    SolutionIndex: 78
    SolutionNameMin: Cijk_Ailk_Bjlk_SB_MT64x64x16_MI32x32x2x1_SE_1LDSB0_AF0EM1_AF1EM1_AMAS0_DVO0_EPS1_FL0_GRVW1_GSU1_IU1_MDA2_NEPBS0_NLCA1_NLCB1_ONLL1_PGR1_PLR1_SIA3_SS0_SU0_SUS256_SRVW2_SVW4_SNLL0_TT1_32_TLDS0_USFGROn1_VW1_WSGRA1_WSGRB1_WG64_4_1_WGM2
    SolutionIndex: 79
    SolutionNameMin: Cijk_Ailk_Bjlk_SB_MT64x64x16_MI16x16x4x1_SE_1LDSB0_AF0EM1_AF1EM1_AMAS3_DVO0_EPS1_FL1_GRVW4_GSU1_IU1_MDA2_NEPBS0_NLCA1_NLCB1_ONLL1_PGR1_PLR1_SIA3_SS0_SU32_SUS256_SRVW4_SVW4_SNLL0_TT4_16_TLDS1_USFGROn1_VW4_WSGRA0_WSGRB0_WG16_16_1_WGM1
    SolutionIndex: 80
    SolutionNameMin: Cijk_Ailk_Bjlk_SB_MT64x64x16_MI16x16x4x1_SE_1LDSB0_AF0EM4_AF1EM1_AMAS3_DVO1_EPS1_FL1_GRVW4_GSU1_IU1_MDA2_NEPBS0_NLCA1_NLCB1_ONLL0_PGR1_PLR1_SIA3_SS0_SU32_SUS256_SRVW4_SVW4_SNLL0_TT4_16_TLDS1_USFGROn1_VW4_WSGRA0_WSGRB0_WG16_16_1_WGM1
    SolutionIndex: 81
    SolutionNameMin: Cijk_Ailk_Bjlk_SB_MT4x64x16_MI4x4x1x16_SE_1LDSB0_AF0EM1_AF1EM1_AMAS0_DVO0_EPS0_FL0_GRVW1_GSU1_IU1_MDA2_NEPBS0_NLCA1_NLCB1_ONLL1_PGR2_PLR1_SIA3_SS0_SU0_SUS256_SRVW0_SVW4_SNLL0_TT1_4_TLDS0_USFGROn1_VW1_WSGRA1_WSGRB1_WG4_16_1_WGM1
    SolutionIndex: 82
    SolutionNameMin: Cijk_Ailk_Bjlk_SB_MT64x64x32_MI32x32x2x1_SE_1LDSB0_AF0EM1_AF1EM1_AMAS0_DVO0_EPS0_FL0_GRVW1_GSU1_IU1_MDA2_NEPBS0_NLCA1_NLCB1_ONLL1_PGR2_PLR1_SIA3_SS0_SU0_SUS256_SRVW2_SVW4_SNLL0_TT1_32_TLDS0_USFGROn1_VW1_WSGRA1_WSGRB1_WG64_4_1_WGM15
    SolutionIndex: 83
    SolutionNameMin: Cijk_Ailk_Bjlk_SB_MT64x64x32_MI32x32x2x1_SE_1LDSB0_AF0EM1_AF1EM1_AMAS0_DVO0_EPS0_FL0_GRVW1_GSU1_IU1_MDA2_NEPBS0_NLCA1_NLCB1_ONLL1_PGR2_PLR1_SIA3_SS0_SU0_SUS256_SRVW2_SVW4_SNLL0_TT1_32_TLDS0_USFGROn1_VW1_WSGRA1_WSGRB1_WG64_4_1_WGM2
    SolutionIndex: 84
    SolutionNameMin: Cijk_Ailk_Bjlk_SB_MT16x64x16_MI16x16x4x1_SE_1LDSB0_AF0EM1_AF1EM1_AMAS0_DVO0_EPS1_FL0_GRVW1_GSU1_IU1_MDA2_NEPBS0_NLCA1_NLCB1_ONLL1_PGR1_PLR1_SIA3_SS0_SU0_SUS256_SRVW0_SVW4_SNLL0_TT1_16_TLDS0_USFGROn1_VW1_WSGRA1_WSGRB1_WG16_16_1_WGM1
    SolutionIndex: 85
    SolutionNameMin: Cijk_Ailk_Bjlk_SB_MT64x192x16_MI32x32x2x1_SE_1LDSB0_AF0EM1_AF1EM1_AMAS0_DVO0_EPS0_FL0_GRVW4_GSU1_IU1_MDA2_NEPBS0_NLCA1_NLCB3_ONLL1_PGR2_PLR1_SIA3_SS0_SU32_SUS128_SRVW2_SVW4_SNLL0_TT1_96_TLDS0_USFGROn1_VW1_WSGRA1_WSGRB1_WG64_4_1_WGM2
    SolutionIndex: 86
    SolutionNameMin: Cijk_Ailk_Bjlk_SB_MT64x192x16_MI32x32x2x1_SE_1LDSB0_AF0EM1_AF1EM1_AMAS0_DVO0_EPS1_FL0_GRVW4_GSU1_IU1_MDA2_NEPBS0_NLCA1_NLCB3_ONLL1_PGR1_PLR1_SIA3_SS0_SU0_SUS256_SRVW4_SVW4_SNLL0_TT1_96_TLDS0_USFGROn1_VW1_WSGRA1_WSGRB1_WG64_4_1_WGM2
    SolutionIndex: 87
    SolutionNameMin: Cijk_Ailk_Bjlk_SB_MT128x64x16_MI32x32x2x1_SE_1LDSB0_AF0EM1_AF1EM1_AMAS0_DVO0_EPS0_FL0_GRVW2_GSU1_IU1_MDA2_NEPBS0_NLCA1_NLCB1_ONLL1_PGR2_PLR1_SIA3_SS0_SU0_SUS256_SRVW2_SVW4_SNLL0_TT2_32_TLDS0_USFGROn1_VW1_WSGRA1_WSGRB1_WG64_4_1_WGM1
    SolutionIndex: 88
    SolutionNameMin: Cijk_Ailk_Bjlk_SB_MT128x64x16_MI32x32x2x1_SE_1LDSB0_AF0EM1_AF1EM1_AMAS0_DVO0_EPS0_FL0_GRVW4_GSU1_IU1_MDA2_NEPBS0_NLCA1_NLCB1_ONLL1_PGR2_PLR1_SIA3_SS0_SU0_SUS256_SRVW2_SVW4_SNLL0_TT2_32_TLDS0_USFGROn1_VW1_WSGRA1_WSGRB1_WG64_4_1_WGM1
    SolutionIndex: 89
    SolutionNameMin: Cijk_Ailk_Bjlk_SB_MT64x128x16_MI32x32x2x1_SE_1LDSB0_AF0EM1_AF1EM1_AMAS0_DVO0_EPS0_FL0_GRVW4_GSU1_IU1_MDA2_NEPBS0_NLCA1_NLCB1_ONLL1_PGR2_PLR1_SIA3_SS0_SU0_SUS256_SRVW2_SVW4_SNLL0_TT1_64_TLDS0_USFGROn1_VW1_WSGRA1_WSGRB1_WG64_4_1_WGM1
    SolutionIndex: 90
    SolutionNameMin: Cijk_Ailk_Bjlk_SB_MT96x96x8_MI16x16x4x1_SE_1LDSB0_AF0EM1_AF1EM1_AMAS0_DVO0_EPS0_FL0_GRVW1_GSU1_IU1_MDA2_NEPBS0_NLCA3_NLCB3_ONLL1_PGR2_PLR1_SIA3_SS0_SU0_SUS256_SRVW0_SVW4_SNLL0_TT3_48_TLDS0_USFGROn1_VW1_WSGRA1_WSGRB1_WG32_8_1_WGM15
    SolutionIndex: 91
    SolutionNameMin: Cijk_Ailk_Bjlk_SB_MT64x64x16_MI16x16x4x1_SE_1LDSB0_AF0EM1_AF1EM1_AMAS3_DVO1_EPS1_FL1_GRVW4_GSU1_IU1_MDA2_NEPBS0_NLCA1_NLCB1_ONLL2_PGR1_PLR1_SIA3_SS0_SU32_SUS256_SRVW4_SVW4_SNLL0_TT4_16_TLDS1_USFGROn1_VW4_WSGRA0_WSGRB0_WG16_16_1_WGM1
    SolutionIndex: 92
    SolutionNameMin: Cijk_Ailk_Bjlk_SB_MT4x64x16_MI4x4x1x16_SE_1LDSB0_AF0EM1_AF1EM1_AMAS0_DVO0_EPS1_FL0_GRVW1_GSU1_IU1_MDA2_NEPBS0_NLCA1_NLCB1_ONLL1_PGR1_PLR1_SIA3_SS0_SU0_SUS256_SRVW0_SVW4_SNLL0_TT1_4_TLDS0_USFGROn1_VW1_WSGRA1_WSGRB1_WG4_16_1_WGM1
    SolutionIndex: 93
    SolutionNameMin: Cijk_Ailk_Bjlk_SB_MT64x4x16_MI4x4x1x16_SE_1LDSB0_AF0EM1_AF1EM1_AMAS0_DVO0_EPS1_FL0_GRVW1_GSU1_IU1_MDA2_NEPBS0_NLCA1_NLCB1_ONLL1_PGR1_PLR1_SIA3_SS0_SU0_SUS256_SRVW0_SVW4_SNLL0_TT1_4_TLDS0_USFGROn1_VW1_WSGRA1_WSGRB1_WG64_1_1_WGM1
    SolutionIndex: 94
    SolutionNameMin: Cijk_Ailk_Bjlk_SB_MT32x64x8_MI16x16x4x1_SE_1LDSB0_AF0EM1_AF1EM1_AMAS0_DVO0_EPS0_FL0_GRVW1_GSU1_IU1_MDA2_NEPBS0_NLCA1_NLCB1_ONLL1_PGR2_PLR1_SIA3_SS0_SU32_SUS256_SRVW2_SVW4_SNLL0_TT1_32_TLDS0_USFGROn1_VW1_WSGRA1_WSGRB1_WG32_8_1_WGM1
    SolutionIndex: 95
    SolutionNameMin: Cijk_Ailk_Bjlk_SB_MT32x64x8_MI16x16x4x1_SE_1LDSB0_AF0EM1_AF1EM1_AMAS0_DVO0_EPS1_FL0_GRVW1_GSU1_IU1_MDA2_NEPBS0_NLCA1_NLCB1_ONLL1_PGR1_PLR1_SIA3_SS0_SU32_SUS256_SRVW2_SVW4_SNLL0_TT1_32_TLDS0_USFGROn1_VW1_WSGRA1_WSGRB1_WG32_8_1_WGM1
    SolutionIndex: 96
    SolutionNameMin: Cijk_Ailk_Bjlk_SB_MT32x64x8_MI16x16x4x1_SE_1LDSB0_AF0EM1_AF1EM1_AMAS0_DVO0_EPS1_FL0_GRVW1_GSU1_IU1_MDA2_NEPBS0_NLCA1_NLCB1_ONLL1_PGR1_PLR1_SIA3_SS0_SU0_SUS256_SRVW2_SVW4_SNLL0_TT1_32_TLDS0_USFGROn1_VW1_WSGRA1_WSGRB1_WG32_8_1_WGM1
    SolutionIndex: 97
    SolutionNameMin: Cijk_Ailk_Bjlk_SB_MT64x32x8_MI16x16x4x1_SE_1LDSB0_AF0EM1_AF1EM1_AMAS0_DVO0_EPS1_FL0_GRVW1_GSU1_IU1_MDA2_NEPBS0_NLCA1_NLCB1_ONLL1_PGR1_PLR1_SIA3_SS0_SU0_SUS256_SRVW2_SVW4_SNLL0_TT2_16_TLDS0_USFGROn1_VW1_WSGRA1_WSGRB1_WG32_8_1_WGM1
    SolutionIndex: 98
    SolutionNameMin: Cijk_Ailk_Bjlk_SB_MT64x64x16_MI16x16x4x1_SE_1LDSB0_AF0EM1_AF1EM1_AMAS3_DVO1_EPS1_FL1_GRVW4_GSU1_IU1_MDA2_NEPBS0_NLCA1_NLCB1_ONLL0_PGR1_PLR1_SIA3_SS0_SU32_SUS256_SRVW4_SVW4_SNLL0_TT4_16_TLDS1_USFGROn1_VW4_WSGRA0_WSGRB0_WG16_16_1_WGM8
    SolutionIndex: 99
    SolutionNameMin: Cijk_Ailk_Bjlk_SB_MT64x128x16_MI32x32x2x1_SE_1LDSB0_AF0EM1_AF1EM1_AMAS0_DVO0_EPS0_FL0_GRVW4_GSU1_IU1_MDA2_NEPBS0_NLCA1_NLCB1_ONLL1_PGR2_PLR1_SIA3_SS0_SU0_SUS256_SRVW2_SVW4_SNLL0_TT1_64_TLDS0_USFGROn1_VW1_WSGRA1_WSGRB1_WG64_4_1_WGM15
    SolutionIndex: 100
    SolutionNameMin: Cijk_Ailk_Bjlk_SB_MT64x64x32_MI32x32x2x1_SE_1LDSB0_AF0EM1_AF1EM1_AMAS0_DVO0_EPS0_FL0_GRVW1_GSU1_IU1_MDA2_NEPBS0_NLCA1_NLCB1_ONLL1_PGR2_PLR1_SIA3_SS0_SU32_SUS128_SRVW2_SVW4_SNLL0_TT1_32_TLDS0_USFGROn1_VW1_WSGRA1_WSGRB1_WG64_4_1_WGM1
    SolutionIndex: 101
    SolutionNameMin: Cijk_Ailk_Bjlk_SB_MT128x128x16_MI32x32x2x1_SN_1LDSB1_AF0EM1_AF1EM1_AMAS3_DVO0_EPS0_FL0_GRVW2_GSU1_IU1_MDA2_NEPBS8_NLCA1_NLCB1_ONLL1_PGR2_PLR9_SIA3_SS1_SU0_SUS256_SRVW0_SVW2_SNLL0_TT2_64_TLDS0_USFGROn1_VW2_WSGRA1_WSGRB1_WG64_4_1_WGM8
    SolutionIndex: 102
    SolutionNameMin: Cijk_Ailk_Bjlk_SB_MT32x32x8_MI16x16x4x1_SE_1LDSB0_AF0EM1_AF1EM1_AMAS0_DVO0_EPS0_FL0_GRVW1_GSU1_IU1_MDA2_NEPBS0_NLCA1_NLCB1_ONLL1_PGR2_PLR1_SIA3_SS0_SU0_SUS256_SRVW2_SVW4_SNLL0_TT1_16_TLDS0_USFGROn1_VW1_WSGRA1_WSGRB1_WG32_8_1_WGM1
    SolutionIndex: 103
    SolutionNameMin: Cijk_Ailk_Bjlk_SB_MT144x64x16_MI16x16x4x1_SE_1LDSB0_AF0EM1_AF1EM1_AMAS0_DVO0_EPS0_FL0_GRVW1_GSU1_IU1_MDA2_NEPBS0_NLCA9_NLCB1_ONLL1_PGR2_PLR1_SIA3_SS0_SU32_SUS128_SRVW0_SVW4_SNLL0_TT9_16_TLDS0_USFGROn1_VW1_WSGRA1_WSGRB1_WG16_16_1_WGM2
    SolutionIndex: 104
    SolutionNameMin: Cijk_Ailk_Bjlk_SB_MT64x16x16_MI16x16x4x1_SN_1LDSB0_AF0EM1_AF1EM1_AMAS0_DVO0_EPS0_FL0_GRVW4_GSU1_IU1_MDA2_NEPBS8_NLCA1_NLCB1_ONLL1_PGR2_PLR5_SIA3_SS1_SU0_SUS256_SRVW0_SVW1_SNLL0_TT1_16_TLDS0_USFGROn1_VW1_WSGRA1_WSGRB1_WG64_4_1_WGM8
    SolutionIndex: 105
    SolutionNameMin: Cijk_Ailk_Bjlk_SB_MT64x32x32_MI16x16x4x1_SN_1LDSB0_GRVW4_GSU1_NEPBS8_NLCA1_NLCB1_PLR9_TT2_16_WG32_8_1
    SolutionIndex: 106
    SolutionNameMin: Cijk_Ailk_Bjlk_SB_MT32x64x16_MI16x16x4x1_SN_1LDSB0_GRVW4_GSU1_NEPBS4_NLCA1_NLCB1_PLR5_TT2_16_WG16_16_1
    SolutionIndex: 107
    SolutionNameMin: Cijk_Ailk_Bjlk_SB_MT64x64x32_MI32x32x2x1_SN_1LDSB0_GRVW4_GSU1_NEPBS8_NLCA1_NLCB1_PLR17_TT1_32_WG64_4_1
    SolutionIndex: 108
    SolutionNameMin: Cijk_Ailk_Bjlk_SB_MT64x64x16_MI32x32x2x1_SN_1LDSB0_GRVW4_GSU1_NEPBS8_NLCA1_NLCB1_PLR9_TT1_32_WG64_4_1
    SolutionIndex: 109
    SolutionNameMin: Cijk_Ailk_Bjlk_SB_MT64x64x16_MI32x32x2x1_SN_1LDSB0_GRVW4_GSU1_NEPBS4_NLCA1_NLCB1_PLR9_TT1_32_WG64_4_1
    SolutionIndex: 110
    SolutionNameMin: Cijk_Ailk_Bjlk_SB_MT128x96x16_MI32x32x2x1_SN_1LDSB0_GRVW2_GSU1_NEPBS4_NLCA1_NLCB3_PLR9_TT1_96_WG128_2_1
    SolutionIndex: 111
    SolutionNameMin: Cijk_Ailk_Bjlk_SB_MT128x128x16_MI32x32x2x1_SN_1LDSB0_GRVW4_GSU1_NEPBS4_NLCA1_NLCB1_PLR9_TT2_64_WG64_4_1
    SolutionIndex: 112
    SolutionNameMin: Cijk_Ailk_Bjlk_SB_MT64x32x32_MI16x16x4x1_SN_1LDSB0_GRVW4_GSU1_NEPBS4_NLCA1_NLCB1_PLR9_TT2_16_WG32_8_1
    SolutionIndex: 113
    SolutionNameMin: Cijk_Ailk_Bjlk_SB_MT64x64x32_MI32x32x2x1_SN_1LDSB0_GRVW4_GSU1_NEPBS4_NLCA1_NLCB1_PLR17_TT1_32_WG64_4_1
    SolutionIndex: 114
    SolutionNameMin: Cijk_Ailk_Bjlk_SB_MT128x64x16_MI32x32x2x1_SN_1LDSB0_GRVW4_GSU1_NEPBS4_NLCA1_NLCB1_PLR9_TT2_32_WG64_4_1
    SolutionIndex: 115
    SolutionNameMin: Cijk_Ailk_Bjlk_SB_MT64x192x16_MI32x32x2x1_SN_1LDSB0_GRVW4_GSU1_NEPBS8_NLCA1_NLCB3_PLR9_TT1_96_WG64_4_1
    SolutionIndex: 116
    SolutionNameMin: Cijk_Ailk_Bjlk_SB_MT64x192x16_MI32x32x2x1_SN_1LDSB0_GRVW4_GSU1_NEPBS4_NLCA1_NLCB3_PLR9_TT1_96_WG64_4_1
    SolutionIndex: 117
    SolutionNameMin: Cijk_Ailk_Bjlk_SB_MT32x32x32_MI16x16x4x1_SE_1LDSB0_AMAS0_DVO0_EPS0_GRVW2_GSU5_GSUAMB_NEPBS0_NLCA1_NLCB1_ONLL1_PGR2_PLR1_SIA3_SS0_SU32_SUS256_SVW4_TT1_16_VW1_WSGRA1_WSGRB1_WG32_8_1_WGM1
    SolutionIndex: 118
    SolutionNameMin: Cijk_Ailk_Bjlk_SB_MT32x32x16_MI16x16x4x1_SN_1LDSB0_AMAS0_DVO0_EPS0_GRVW2_GSU16_GSUAMB_NEPBS8_NLCA1_NLCB1_ONLL1_PGR2_PLR5_SIA3_SS1_SU0_SUS0_SVW1_TT1_16_VW1_WSGRA1_WSGRB1_WG32_8_1_WGM8
    SolutionIndex: 119
    SolutionNameMin: Cijk_Ailk_Bjlk_SB_MT64x16x32_MI16x16x4x1_SE_1LDSB0_AMAS0_DVO0_EPS0_GRVW1_GSU5_GSUAMB_NEPBS0_NLCA1_NLCB1_ONLL1_PGR2_PLR1_SIA3_SS0_SU32_SUS256_SVW4_TT1_16_VW1_WSGRA1_WSGRB1_WG64_4_1_WGM2
    SolutionIndex: 120
    SolutionNameMin: Cijk_Ailk_Bjlk_SB_MT16x64x16_MI16x16x4x1_SN_1LDSB0_AMAS0_DVO0_EPS0_GRVW4_GSU16_GSUAMB_NEPBS8_NLCA1_NLCB1_ONLL1_PGR2_PLR5_SIA3_SS1_SU0_SUS0_SVW1_TT1_16_VW1_WSGRA1_WSGRB1_WG16_16_1_WGM8
    SolutionIndex: 121
    SolutionNameMin: Cijk_Ailk_Bjlk_SB_MT64x64x16_MI32x32x2x1_SN_1LDSB0_AMAS0_DVO0_EPS0_GRVW2_GSU16_GSUAMB_NEPBS4_NLCA1_NLCB1_ONLL1_PGR2_PLR9_SIA3_SS1_SU0_SUS0_SVW1_TT1_32_VW1_WSGRA1_WSGRB1_WG64_4_1_WGM8
    SolutionIndex: 122
    SolutionNameMin: Cijk_Ailk_Bjlk_SB_MT16x64x16_MI16x16x4x1_SE_1LDSB0_AMAS0_DVO0_EPS0_GRVW1_GSU5_GSUAMB_NEPBS0_NLCA1_NLCB1_ONLL1_PGR2_PLR1_SIA3_SS0_SU0_SUS0_SVW4_TT1_16_VW1_WSGRA1_WSGRB1_WG16_16_1_WGM2
    SolutionIndex: 123
    SolutionNameMin: Cijk_Ailk_Bjlk_SB_MT32x32x32_MI16x16x4x1_SN_1LDSB0_AMAS0_DVO0_EPS0_GRVW4_GSU3_GSUAMB_NEPBS4_NLCA1_NLCB1_ONLL1_PGR2_PLR9_SIA3_SS1_SU0_SUS0_SVW1_TT1_16_VW1_WSGRA1_WSGRB1_WG32_8_1_WGM8
    SolutionIndex: 124
    SolutionNameMin: Cijk_Ailk_Bjlk_SB_MT16x16x32_MI16x16x4x1_SE_1LDSB0_AMAS0_DVO0_EPS0_GRVW1_GSU5_GSUAMB_NEPBS0_NLCA1_NLCB1_ONLL1_PGR2_PLR1_SIA3_SS0_SU0_SUS0_SVW4_TT1_16_VW1_WSGRA1_WSGRB1_WG16_4_1_WGM2
    SolutionIndex: 125
    SolutionNameMin: Cijk_Ailk_Bjlk_SB_MT64x128x16_MI32x32x2x1_SE_1LDSB0_AMAS0_DVO0_EPS0_GRVW4_GSU3_GSUAMB_NEPBS0_NLCA1_NLCB1_ONLL1_PGR2_PLR1_SIA3_SS0_SU0_SUS0_SVW4_TT1_64_VW1_WSGRA1_WSGRB1_WG64_4_1_WGM2
    SolutionIndex: 126
    SolutionNameMin: Cijk_Ailk_Bjlk_SB_MT32x64x32_MI16x16x4x1_SE_1LDSB0_AMAS0_DVO0_EPS0_GRVW4_GSU5_GSUAMB_NEPBS0_NLCA1_NLCB1_ONLL1_PGR2_PLR1_SIA3_SS0_SU0_SUS0_SVW4_TT1_32_VW1_WSGRA1_WSGRB1_WG32_8_1_WGM1
    SolutionIndex: 127
    SolutionNameMin: Cijk_Ailk_Bjlk_SB_MT16x16x32_MI16x16x4x1_SE_1LDSB0_AMAS0_DVO0_EPS0_GRVW1_GSU5_GSUAMB_NEPBS0_NLCA1_NLCB1_ONLL1_PGR2_PLR1_SIA3_SS0_SU32_SUS256_SVW4_TT1_16_VW1_WSGRA1_WSGRB1_WG16_4_1_WGM2
    SolutionIndex: 128
    SolutionNameMin: Cijk_Ailk_Bjlk_SB_MT64x64x32_MI32x32x2x1_SE_1LDSB0_AMAS0_DVO0_EPS0_GRVW4_GSU3_GSUAMB_NEPBS0_NLCA1_NLCB1_ONLL1_PGR2_PLR1_SIA3_SS0_SU0_SUS0_SVW4_TT1_32_VW1_WSGRA1_WSGRB1_WG64_4_1_WGM1
    SolutionIndex: 129
    SolutionNameMin: Cijk_Ailk_Bjlk_SB_MT32x32x32_MI16x16x4x1_SE_1LDSB0_AMAS0_DVO0_EPS0_GRVW1_GSU5_GSUAMB_NEPBS0_NLCA1_NLCB1_ONLL1_PGR2_PLR1_SIA3_SS0_SU32_SUS256_SVW4_TT1_16_VW1_WSGRA1_WSGRB1_WG32_8_1_WGM2
    SolutionIndex: 130
    SolutionNameMin: Cijk_Ailk_Bjlk_SB_MT128x64x16_MI32x32x2x1_SN_1LDSB1_AF0EM1_AF1EM1_AMAS3_DVO0_EPS0_FL0_GRVW2_GSU1_IU1_NEPBS8_NLCA1_NLCB1_ONLL1_PGR2_PLR9_SIA3_SS1_SU0_SUS0_SRVW0_SVW2_TT2_32_TLDS0_VW2_WSGRA1_WSGRB1_WG64_4_1_WGM8
    SolutionIndex: 131
    SolutionNameMin: Cijk_Ailk_Bjlk_SB_MT64x16x32_MI16x16x4x1_SE_1LDSB0_AF0EM1_AF1EM1_AMAS0_DVO0_EPS0_FL0_GRVW1_GSU1_IU1_NEPBS0_NLCA1_NLCB1_ONLL1_PGR2_PLR1_SIA3_SS0_SU0_SUS0_SRVW0_SVW4_TT1_16_TLDS0_VW1_WSGRA1_WSGRB1_WG64_4_1_WGM2
    SolutionIndex: 132
    SolutionNameMin: Cijk_Ailk_Bjlk_SB_MT16x16x8_MI16x16x4x1_SE_1LDSB0_AF0EM1_AF1EM1_AMAS0_DVO0_EPS1_FL0_GRVW1_GSU1_IU1_NEPBS0_NLCA1_NLCB1_ONLL1_PGR1_PLR1_SIA3_SS0_SU0_SUS0_SRVW0_SVW4_TT1_16_TLDS0_VW1_WSGRA1_WSGRB1_WG16_4_1_WGM1
    SolutionIndex: 133
    SolutionNameMin: Cijk_Ailk_Bjlk_SB_MT16x16x8_MI16x16x4x1_SE_1LDSB0_AF0EM1_AF1EM1_AMAS0_DVO0_EPS1_FL0_GRVW1_GSU1_IU1_NEPBS0_NLCA1_NLCB1_ONLL1_PGR1_PLR1_SIA3_SS0_SU0_SUS0_SRVW0_SVW4_TT1_16_TLDS0_VW1_WSGRA1_WSGRB1_WG16_4_1_WGM15
    SolutionIndex: 134
    SolutionNameMin: Cijk_Ailk_Bjlk_SB_MT64x32x8_MI16x16x4x1_SE_1LDSB0_AF0EM1_AF1EM1_AMAS0_DVO0_EPS0_FL0_GRVW1_GSU1_IU1_NEPBS0_NLCA1_NLCB1_ONLL1_PGR2_PLR1_SIA3_SS0_SU0_SUS0_SRVW2_SVW4_TT2_16_TLDS0_VW1_WSGRA1_WSGRB1_WG32_8_1_WGM1
    SolutionIndex: 135
    SolutionNameMin: Cijk_Ailk_Bjlk_SB_MT64x32x8_MI16x16x4x1_SE_1LDSB0_AF0EM1_AF1EM1_AMAS0_DVO0_EPS0_FL0_GRVW1_GSU1_IU1_NEPBS0_NLCA1_NLCB1_ONLL1_PGR2_PLR1_SIA3_SS0_SU0_SUS0_SRVW2_SVW4_TT2_16_TLDS0_VW1_WSGRA1_WSGRB1_WG32_8_1_WGM2
    SolutionIndex: 136
    SolutionNameMin: Cijk_Ailk_Bjlk_SB_MT64x64x32_MI32x32x2x1_SN_1LDSB1_AF0EM1_AF1EM1_AMAS0_DVO0_EPS0_FL0_GRVW4_GSU1_IU1_NEPBS8_NLCA1_NLCB1_ONLL1_PGR2_PLR17_SIA3_SS1_SU0_SUS0_SRVW0_SVW1_TT1_32_TLDS0_VW1_WSGRA1_WSGRB1_WG64_4_1_WGM8
    SolutionIndex: 137
    SolutionNameMin: Cijk_Ailk_Bjlk_SB_MT64x64x16_MI32x32x2x1_SN_1LDSB0_AF0EM1_AF1EM1_AMAS0_DVO0_EPS0_FL0_GRVW4_GSU1_IU1_NEPBS8_NLCA1_NLCB1_ONLL1_PGR2_PLR9_SIA3_SS1_SU0_SUS0_SRVW0_SVW1_TT1_32_TLDS0_VW1_WSGRA1_WSGRB1_WG64_4_1_WGM8
    SolutionIndex: 138
    SolutionNameMin: Cijk_Ailk_Bjlk_SB_MT32x64x32_MI16x16x4x1_SE_1LDSB0_AF0EM1_AF1EM1_AMAS0_DVO0_EPS0_FL0_GRVW4_GSU1_IU1_NEPBS0_NLCA1_NLCB1_ONLL1_PGR2_PLR1_SIA3_SS0_SU0_SUS0_SRVW2_SVW4_TT1_32_TLDS0_VW1_WSGRA1_WSGRB1_WG32_8_1_WGM1
    SolutionIndex: 139
    SolutionNameMin: Cijk_Ailk_Bjlk_SB_MT64x64x32_MI16x16x4x1_SN_1LDSB1_EPS0_IU1_PLR9_SIA3_SU2_SUS256_TT2_32_WG32_8_1_WGM15
    SolutionIndex: 140
    SolutionNameMin: Cijk_Ailk_Bjlk_SB_MT128x64x16_MI16x16x4x1_SN_1LDSB1_EPS0_IU1_SIA3_SS1_SU4_TT8_16_WG16_16_1_WGM7
    SolutionIndex: 141
    SolutionNameMin: Cijk_Ailk_Bjlk_SB_MT64x64x32_MI16x16x4x1_SN_1LDSB1_GRVW4_MIAV0_NLCB1_PLR9_SS1_TT2_32_WG32_8_1_WGM15
    SolutionIndex: 142
    SolutionNameMin: Cijk_Ailk_Bjlk_SB_MT64x64x32_MI16x16x4x1_SN_1LDSB1_MIAV0_PLR9_SU2_SUS128_TT2_32_WG32_8_1_WGM5
    SolutionIndex: 143
    SolutionNameMin: Cijk_Ailk_Bjlk_SB_MT64x64x16_MI16x16x4x1_SN_1LDSB1_MIAV1_PLR5_SU0_SUS0_TT2_32_WG32_8_1_WGM16
    SolutionIndex: 144
    SolutionNameMin: Cijk_Ailk_Bjlk_SB_MT16x16x64_MI16x16x4x1_SN_1LDSB0_EPS0_GRVW4_IU1_SIA3_TT1_16_WSGRA1_WSGRB1_WG16_4_1_WGM4
    SolutionIndex: 145
    SolutionNameMin: Cijk_Ailk_Bjlk_SB_MT64x64x16_MI16x16x4x1_SN_1LDSB1_GRVW4_NLCB1_PLR5_SS1_SVW2_TT2_32_VW2_WG32_8_1_WGM7
    SolutionIndex: 146
    SolutionNameMin: Cijk_Ailk_Bjlk_SB_MT256x64x4_MI32x32x2x1_SN_1LDSB1_AMAS3_DTVA0_MIAV1_NEPBS4_NLCB1_PLR1_SU0_SUS0_SVW2_TT2_64_VW2_WG128_2_1_WGM14
    SolutionIndex: 147
    SolutionNameMin: Cijk_Ailk_Bjlk_SB_MT256x64x16_MI32x32x2x1_SN_1LDSB1_AMAS3_DTVA0_MIAV1_NEPBS4_NLCB1_PLR1_SU0_SUS0_SVW2_TT2_64_VW2_WG128_2_1_WGM14
    SolutionIndex: 148
    SolutionNameMin: Cijk_Ailk_Bjlk_SB_MT256x64x16_MI32x32x2x1_SN_1LDSB1_AMAS3_DTVA0_MIAV1_NEPBS4_NLCB1_PLR1_SU0_SUS0_SVW2_TT2_64_VW2_WG128_2_1_WGM2
    SolutionIndex: 149
    SolutionNameMin: Cijk_Ailk_Bjlk_SB_MT256x128x8_MI32x32x2x1_SN_1LDSB1_AMAS3_DTVA0_MIAV1_NEPBS4_NLCB1_PLR5_SU0_SUS0_SVW2_TT2_128_VW2_WG128_2_1_WGM2
    SolutionIndex: 150
    SolutionNameMin: Cijk_Ailk_Bjlk_SB_MT256x128x16_MI32x32x2x1_SN_1LDSB1_AMAS3_DTVA0_MIAV1_NEPBS4_NLCB1_PLR1_SU32_SUS256_SVW2_TT2_128_VW2_WG128_2_1_WGM2
    SolutionIndex: 151
    SolutionNameMin: Cijk_Ailk_Bjlk_SB_MT256x128x16_MI32x32x2x1_SN_1LDSB1_AMAS3_DTVA0_MIAV1_NEPBS4_NLCB2_PLR1_SU32_SUS256_SVW2_TT2_128_VW2_WG128_2_1_WGM2
    SolutionIndex: 152
    SolutionNameMin: Cijk_Ailk_Bjlk_SB_MT256x128x16_MI32x32x2x1_SN_1LDSB1_AMAS3_DTVA0_MIAV1_NEPBS4_NLCB1_PLR1_SU0_SUS0_SVW2_TT2_128_VW2_WG128_2_1_WGM2
    SolutionIndex: 153
    SolutionNameMin: Cijk_Ailk_Bjlk_SB_MT256x64x8_MI32x32x2x1_SN_1LDSB1_AMAS3_DTVA0_MIAV1_NEPBS1_NLCB1_PLR5_SU32_SUS256_SVW2_TT2_64_VW2_WG128_2_1_WGM2
    SolutionIndex: 154
    SolutionNameMin: Cijk_Ailk_Bjlk_SB_MT256x64x8_MI32x32x2x1_SN_1LDSB1_AMAS3_DTVA0_MIAV1_NEPBS1_NLCB1_PLR5_SU32_SUS256_SVW2_TT2_64_VW2_WG128_2_1_WGM6
    SolutionIndex: 155
    SolutionNameMin: Cijk_Ailk_Bjlk_SB_MT256x64x8_MI32x32x2x1_SN_1LDSB1_AMAS3_DTVA0_MIAV1_NEPBS1_NLCB1_PLR5_SU32_SUS256_SVW2_TT2_64_VW2_WG128_2_1_WGM8
    SolutionIndex: 156
    SolutionNameMin: Cijk_Ailk_Bjlk_SB_MT256x128x8_MI32x32x2x1_SN_1LDSB1_AMAS3_DTVA0_MIAV1_NEPBS4_NLCB1_PLR5_SU0_SUS0_SVW2_TT2_128_VW2_WG128_2_1_WGM8
    SolutionIndex: 157
    SolutionNameMin: Cijk_Ailk_Bjlk_SB_MT256x128x16_MI16x16x4x1_SN_1LDSB1_AMAS3_DTVA1_MIAV0_NEPBS4_NLCB1_PLR5_SU0_SUS0_SVW4_TT4_128_VW4_WG64_4_1_WGM14
    SolutionIndex: 158
    SolutionNameMin: Cijk_Ailk_Bjlk_SB_MT256x64x8_MI32x32x2x1_SN_1LDSB1_AMAS3_DTVA0_MIAV1_NEPBS1_NLCB1_PLR5_SU0_SUS0_SVW2_TT2_64_VW2_WG128_2_1_WGM6
    SolutionIndex: 159
    SolutionNameMin: Cijk_Ailk_Bjlk_SB_MT256x128x16_MI16x16x4x1_SN_1LDSB1_AMAS3_DTVA1_MIAV0_NEPBS4_NLCB1_PLR5_SU0_SUS0_SVW4_TT4_128_VW4_WG64_4_1_WGM8
    SolutionIndex: 160
    SolutionNameMin: Cijk_Ailk_Bjlk_SB_MT256x128x4_MI32x32x2x1_SN_1LDSB1_AMAS3_DTVA0_MIAV1_NEPBS1_NLCB1_PLR1_SU0_SUS0_SVW2_TT2_128_VW2_WG128_2_1_WGM4
    SolutionIndex: 161
    SolutionNameMin: Cijk_Ailk_Bjlk_SB_MT256x64x4_MI32x32x2x1_SN_1LDSB1_AMAS3_DTVA0_MIAV1_NEPBS4_NLCB1_PLR1_SU0_SUS0_SVW2_TT2_64_VW2_WG128_2_1_WGM4
    SolutionIndex: 162
    SolutionNameMin: Cijk_Ailk_Bjlk_SB_MT256x64x16_MI32x32x2x1_SN_1LDSB1_AMAS3_DTVA0_MIAV1_NEPBS4_NLCB1_PLR1_SU0_SUS0_SVW2_TT2_64_VW2_WG128_2_1_WGM6
    SolutionIndex: 163
    SolutionNameMin: Cijk_Ailk_Bjlk_SB_MT256x64x16_MI32x32x2x1_SN_1LDSB1_AMAS3_DTVA0_MIAV1_NEPBS4_NLCB1_PLR1_SU32_SUS256_SVW2_TT2_64_VW2_WG128_2_1_WGM2
    SolutionIndex: 164
    SolutionNameMin: Cijk_Ailk_Bjlk_SB_MT256x128x8_MI32x32x2x1_SN_1LDSB1_AMAS3_DTVA0_MIAV1_NEPBS4_NLCB1_PLR5_SU32_SUS256_SVW2_TT2_128_VW2_WG128_2_1_WGM2
    SolutionIndex: 165
    SolutionNameMin: Cijk_Ailk_Bjlk_SB_MT256x128x4_MI32x32x2x1_SN_1LDSB1_AMAS3_DTVA0_MIAV1_NEPBS4_NLCB1_PLR1_SU0_SUS0_SVW2_TT2_128_VW2_WG128_2_1_WGM14
    SolutionIndex: 166
    SolutionNameMin: Cijk_Ailk_Bjlk_SB_MT256x128x8_MI32x32x2x1_SN_1LDSB1_AMAS3_DTVA0_MIAV1_NEPBS4_NLCB1_PLR5_SU0_SUS0_SVW2_TT2_128_VW2_WG128_2_1_WGM4
    SolutionIndex: 167
    SolutionNameMin: Cijk_Ailk_Bjlk_SB_MT256x128x8_MI32x32x2x1_SN_1LDSB1_AMAS3_DTVA0_MIAV1_NEPBS4_NLCB1_PLR5_SU0_SUS0_SVW2_TT2_128_VW2_WG128_2_1_WGM6
    SolutionIndex: 168
    SolutionNameMin: Cijk_Ailk_Bjlk_SB_MT256x128x8_MI32x32x2x1_SN_1LDSB1_AMAS3_DTVA0_MIAV1_NEPBS4_NLCB1_PLR5_SU32_SUS256_SVW2_TT2_128_VW2_WG128_2_1_WGM8
    SolutionIndex: 169
    SolutionNameMin: Cijk_Ailk_Bjlk_SB_MT256x128x16_MI32x32x2x1_SN_1LDSB1_AMAS3_DTVA0_MIAV1_NEPBS4_NLCB1_PLR1_SU0_SUS0_SVW2_TT2_128_VW2_WG128_2_1_WGM12
    SolutionIndex: 170
    SolutionNameMin: Cijk_Ailk_Bjlk_SB_MT256x128x8_MI32x32x2x1_SN_1LDSB1_AMAS3_DTVA0_MIAV1_NEPBS4_NLCB1_PLR5_SU32_SUS256_SVW2_TT2_128_VW2_WG128_2_1_WGM6
    SolutionIndex: 171
    SolutionNameMin: Cijk_Ailk_Bjlk_SB_MT256x128x8_MI32x32x2x1_SN_1LDSB1_AMAS3_DTVA0_MIAV1_NEPBS4_NLCB1_PLR5_SU32_SUS256_SVW2_TT2_128_VW2_WG128_2_1_WGM12
    SolutionIndex: 172
    SolutionNameMin: Cijk_Ailk_Bjlk_SB_MT256x128x4_MI32x32x2x1_SN_1LDSB1_AMAS3_DTVA0_MIAV1_NEPBS4_NLCB1_PLR1_SU0_SUS0_SVW2_TT2_128_VW2_WG128_2_1_WGM8
    SolutionIndex: 173
    SolutionNameMin: Cijk_Ailk_Bjlk_SB_MT256x128x4_MI32x32x2x1_SN_1LDSB1_AMAS3_DTVA0_MIAV1_NEPBS1_NLCB1_PLR1_SU0_SUS0_SVW2_TT2_128_VW2_WG128_2_1_WGM6
    SolutionIndex: 174
    SolutionNameMin: Cijk_Ailk_Bjlk_SB_MT128x64x16_MI16x16x4x1_SN_1LDSB1_AMAS3_DTVA0_MIAV1_NEPBS4_NLCB1_PLR5_SU32_SUS256_SVW2_TT2_64_VW2_WG64_4_1_WGM2
    SolutionIndex: 175
    SolutionNameMin: Cijk_Ailk_Bjlk_SB_MT128x64x16_MI16x16x4x1_SN_1LDSB1_AMAS3_DTVA0_MIAV1_NEPBS4_NLCB1_PLR5_SU0_SUS0_SVW2_TT2_64_VW2_WG64_4_1_WGM4
    SolutionIndex: 176
    SolutionNameMin: Cijk_Ailk_Bjlk_SB_MT128x128x16_MI32x32x2x1_SN_1LDSB1_AMAS0_DTVA0_MIAV1_NEPBS4_NLCB1_PLR1_SU0_SUS0_SVW1_TT1_128_VW1_WG128_2_1_WGM8
    SolutionIndex: 177
    SolutionNameMin: Cijk_Ailk_Bjlk_SB_MT256x64x8_MI32x32x2x1_SN_1LDSB1_AMAS3_DTVA0_MIAV1_NEPBS4_NLCB1_PLR5_SU0_SUS0_SVW2_TT2_64_VW2_WG128_2_1_WGM14
    SolutionIndex: 178
    SolutionNameMin: Cijk_Ailk_Bjlk_SB_MT128x128x16_MI32x32x2x1_SN_1LDSB1_AMAS0_DTVA0_MIAV1_NEPBS4_NLCB2_PLR1_SU0_SUS0_SVW1_TT1_128_VW1_WG128_2_1_WGM8
    SolutionIndex: 179
    SolutionNameMin: Cijk_Ailk_Bjlk_SB_MT256x64x8_MI32x32x2x1_SN_1LDSB1_AMAS3_DTVA0_MIAV1_NEPBS4_NLCB1_PLR5_SU0_SUS0_SVW2_TT2_64_VW2_WG128_2_1_WGM12
    SolutionIndex: 180
    SolutionNameMin: Cijk_Ailk_Bjlk_SB_MT256x128x4_MI32x32x2x1_SN_1LDSB1_AMAS3_DTVA0_MIAV1_NEPBS4_NLCB1_PLR1_SU32_SUS256_SVW2_TT2_128_VW2_WG128_2_1_WGM2
    SolutionIndex: 181
    SolutionNameMin: Cijk_Ailk_Bjlk_SB_MT256x128x4_MI32x32x2x1_SN_1LDSB1_AMAS3_DTVA0_MIAV1_NEPBS1_NLCB1_PLR1_SU0_SUS0_SVW2_TT2_128_VW2_WG128_2_1_WGM2
    SolutionIndex: 182
    SolutionNameMin: Cijk_Ailk_Bjlk_SB_MT256x128x4_MI32x32x2x1_SN_1LDSB1_AMAS3_DTVA0_MIAV1_NEPBS4_NLCB1_PLR1_SU0_SUS0_SVW2_TT2_128_VW2_WG128_2_1_WGM2
    SolutionIndex: 183
    SolutionNameMin: Cijk_Ailk_Bjlk_SB_MT256x128x4_MI32x32x2x1_SN_1LDSB1_AMAS3_DTVA0_MIAV1_NEPBS1_NLCB1_PLR1_SU32_SUS256_SVW2_TT2_128_VW2_WG128_2_1_WGM2
    SolutionIndex: 184
    SolutionNameMin: Cijk_Ailk_Bjlk_SB_MT128x64x16_MI16x16x4x1_SN_1LDSB1_AMAS3_DTVA0_MIAV1_NEPBS4_NLCB1_PLR5_SU0_SUS0_SVW2_TT2_64_VW2_WG64_4_1_WGM14
    SolutionIndex: 185
    SolutionNameMin: Cijk_Ailk_Bjlk_SB_MT128x64x16_MI16x16x4x1_SN_1LDSB1_AMAS3_DTVA0_MIAV1_NEPBS4_NLCB1_PLR5_SU0_SUS0_SVW2_TT2_64_VW2_WG64_4_1_WGM12
    SolutionIndex: 186
    SolutionNameMin: Cijk_Ailk_Bjlk_SB_MT128x128x16_MI32x32x2x1_SN_1LDSB1_AMAS0_DTVA0_MIAV1_NEPBS4_NLCB1_PLR1_SU0_SUS0_SVW1_TT1_128_VW1_WG128_2_1_WGM4
    SolutionIndex: 187
    SolutionNameMin: Cijk_Ailk_Bjlk_SB_MT128x64x16_MI16x16x4x1_SN_1LDSB1_AMAS3_DTVA0_MIAV1_NEPBS1_NLCB1_PLR5_SU0_SUS0_SVW2_TT2_64_VW2_WG64_4_1_WGM12
    SolutionIndex: 188
    SolutionNameMin: Cijk_Ailk_Bjlk_SB_MT128x64x16_MI16x16x4x1_SN_1LDSB1_AMAS3_DTVA0_MIAV1_NEPBS4_NLCB1_PLR5_SU0_SUS0_SVW2_TT2_64_VW2_WG64_4_1_WGM2
    SolutionIndex: 189
    SolutionNameMin: Cijk_Ailk_Bjlk_SB_MT64x64x32_MI32x32x2x1_SN_1LDSB0_AMAS0_DTVA0_MIAV1_NEPBS4_NLCB2_PLR17_SU32_SUS256_SVW1_TT1_32_VW1_WG64_4_1_WGM8
    SolutionIndex: 190
    SolutionNameMin: Cijk_Ailk_Bjlk_SB_MT128x64x16_MI16x16x4x1_SN_1LDSB1_AMAS3_DTVA0_MIAV1_NEPBS4_NLCB1_PLR5_SU0_SUS0_SVW2_TT2_64_VW2_WG64_4_1_WGM6
    SolutionIndex: 191
    SolutionNameMin: Cijk_Ailk_Bjlk_SB_MT128x64x16_MI16x16x4x1_SN_1LDSB1_AMAS3_DTVA0_MIAV1_NEPBS4_NLCB1_PLR5_SU0_SUS0_SVW2_TT2_64_VW2_WG64_4_1_WGM8
    SolutionIndex: 192
    SolutionNameMin: Cijk_Ailk_Bjlk_SB_MT128x128x16_MI32x32x2x1_SN_1LDSB1_AMAS0_DTVA0_MIAV1_NEPBS4_NLCB1_PLR1_SU0_SUS0_SVW1_TT1_128_VW1_WG128_2_1_WGM2
    SolutionIndex: 193
    SolutionNameMin: Cijk_Ailk_Bjlk_SB_MT128x64x16_MI16x16x4x1_SN_1LDSB1_AMAS3_DTVA0_MIAV1_NEPBS1_NLCB1_PLR5_SU0_SUS0_SVW2_TT2_64_VW2_WG64_4_1_WGM6
    SolutionIndex: 194
    SolutionNameMin: Cijk_Ailk_Bjlk_SB_MT128x64x16_MI16x16x4x1_SN_1LDSB1_AMAS3_DTVA0_MIAV1_NEPBS1_NLCB1_PLR5_SU0_SUS0_SVW2_TT2_64_VW2_WG64_4_1_WGM14
    SolutionIndex: 195
    SolutionNameMin: Cijk_Ailk_Bjlk_SB_MT128x128x16_MI32x32x2x1_SN_1LDSB1_AMAS0_DTVA0_MIAV1_NEPBS4_NLCB1_PLR1_SU0_SUS0_SVW1_TT1_128_VW1_WG128_2_1_WGM14
    SolutionIndex: 196
    SolutionNameMin: Cijk_Ailk_Bjlk_SB_MT128x64x16_MI16x16x4x1_SN_1LDSB1_AMAS3_DTVA0_MIAV1_NEPBS1_NLCB1_PLR5_SU0_SUS0_SVW2_TT2_64_VW2_WG64_4_1_WGM4
    SolutionIndex: 197
    SolutionNameMin: Cijk_Ailk_Bjlk_SB_MT128x64x16_MI16x16x4x1_SN_1LDSB1_AMAS3_DTVA0_MIAV1_NEPBS1_NLCB1_PLR5_SU0_SUS0_SVW2_TT2_64_VW2_WG64_4_1_WGM8
    SolutionIndex: 198
    SolutionNameMin: Cijk_Ailk_Bjlk_SB_MT64x64x32_MI32x32x2x1_SN_1LDSB0_AMAS0_DTVA0_MIAV1_NEPBS4_NLCB1_PLR17_SU0_SUS0_SVW1_TT1_32_VW1_WG64_4_1_WGM8
    SolutionIndex: 199
    SolutionNameMin: Cijk_Ailk_Bjlk_SB_MT256x64x8_MI32x32x2x1_SN_AMAS3_DTVA0_MIAV1_PLR5_SVW2_TT2_64_VW2_WG128_2_1_WGM14
    SolutionIndex: 200
    SolutionNameMin: Cijk_Ailk_Bjlk_SB_MT128x128x16_MI32x32x2x1_SN_AMAS3_DTVA0_MIAV1_PLR1_SVW2_TT2_64_VW2_WG64_4_1_WGM12
- - - [1024, 64, 1, 512]
    - [3, 11.285]
  - - [512, 512, 1, 200]
    - [4, 19.527]
  - - [512, 32, 1, 200]
    - [5, 1.355]
  - - [2048, 2048, 1, 512]
    - [6, 83.287]
  - - [1600, 1024, 1, 512]
    - [7, 72.283]
  - - [1024, 1024, 1, 512]
    - [8, 59.012]
  - - [1024, 1024, 1, 200]
    - [9, 41.092]
  - - [1024, 1024, 1, 4096]
    - [10, 78.554]
  - - [4096, 1024, 1, 4096]
    - [11, 89.538]
  - - [1024, 1024, 1, 2048]
    - [10, 75.023]
  - - [4096, 1024, 1, 2048]
    - [11, 88.524]
  - - [768, 768, 1, 16]
    - [9, 4.623]
  - - [768, 768, 1, 320]
    - [8, 42.744]
  - - [3072, 768, 1, 4096]
    - [11, 83.239]
  - - [768, 768, 1, 4096]
    - [12, 71.441]
  - - [768, 768, 1, 32]
    - [13, 8.861]
  - - [768, 768, 1, 640]
    - [12, 52.832]
  - - [768, 768, 1, 64]
    - [4, 16.679]
  - - [768, 768, 1, 1280]
    - [12, 62.315]
  - - [1024, 1024, 1, 3072]
    - [14, 77.341]
  - - [3072, 1024, 1, 2048]
    - [15, 93.206]
  - - [3072, 1024, 1, 3072]
    - [15, 94.204]
  - - [3072, 1024, 1, 512]
    - [7, 85.193]
  - - [1024, 1024, 1, 120]
    - [16, 32.038]
  - - [1024, 1024, 1, 1]
    - [17, 0.411]
  - - [1024, 1024, 1, 20]
    - [17, 7.622]
  - - [1024, 1024, 1, 4]
    - [16, 1.63]
  - - [1024, 1024, 1, 6]
    - [18, 2.403]
  - - [1024, 1024, 1, 80]
    - [7, 24.872]
  - - [128, 64, 512, 128]
    - [15, 45.65]
  - - [512, 64, 64, 512]
    - [7, 71.689]
  - - [64, 64, 768, 64]
    - [15, 27.246]
  - - [1024, 128, 1, 128]
    - [19, 7.638]
  - - [4, 704, 1, 1280]
    - [19, 0.742]
  - - [4, 1856, 1, 3328]
    - [20, 2.608]
  - - [1856, 448, 1, 3328]
    - [21, 83.472]
  - - [2944, 4288, 1, 1280]
    - [15, 93.05]
  - - [2368, 64, 1, 3328]
    - [14, 41.554]
  - - [2368, 5888, 1, 256]
    - [7, 91.448]
  - - [128, 64, 1, 256]
    - [5, 0.875]
  - - [5888, 1024, 1, 1280]
    - [15, 90.762]
  - - [128, 6784, 1, 3328]
    - [22, 87.173]
  - - [64, 4, 1, 256]
    - [23, 0.026]
  - - [5888, 1856, 1, 3328]
    - [15, 93.883]
  - - [5056, 704, 1, 256]
    - [7, 77.627]
  - - [5888, 2944, 1, 3328]
    - [15, 95.733]
  - - [1856, 4288, 1, 256]
    - [7, 87.279]
  - - [1024, 5056, 1, 128]
    - [11, 69.132]
  - - [5056, 5056, 1, 3328]
    - [15, 96.686]
  - - [1408, 5888, 1, 1280]
    - [15, 92.482]
  - - [2368, 448, 1, 128]
    - [15, 36.425]
  - - [1024, 3584, 1, 3328]
    - [15, 86.737]
  - - [4, 2944, 1, 1280]
    - [20, 3.102]
  - - [1408, 64, 1, 128]
    - [24, 5.53]
  - - [256, 4288, 1, 3328]
    - [10, 81.343]
  - - [5888, 1408, 1, 1280]
    - [7, 92.536]
  - - [704, 1856, 1, 3328]
    - [22, 89.77]
  - - [4, 1408, 1, 128]
    - [25, 0.349]
  - - [1024, 2368, 1, 256]
    - [6, 69.074]
  - - [1408, 1856, 1, 1280]
    - [15, 88.935]
  - - [1408, 64, 1, 1280]
    - [19, 23.736]
  - - [448, 1024, 1, 1280]
    - [20, 49.836]
  - - [256, 1408, 1, 3328]
    - [26, 68.086]
  - - [5056, 5056, 1, 1280]
    - [15, 96.291]
  - - [448, 5056, 1, 256]
    - [7, 65.99]
  - - [704, 1856, 1, 1280]
    - [15, 83.933]
  - - [128, 5056, 1, 128]
    - [27, 28.497]
  - - [2368, 128, 1, 256]
    - [19, 29.142]
  - - [1856, 1408, 1, 128]
    - [7, 57.1]
  - - [64, 5056, 1, 256]
    - [23, 29.396]
  - - [6784, 256, 1, 3328]
    - [15, 90.066]
  - - [6784, 4288, 1, 3328]
    - [15, 96.486]
  - - [4288, 448, 1, 256]
    - [7, 62.607]
  - - [64, 704, 1, 128]
    - [19, 2.856]
  - - [1856, 2368, 1, 3328]
    - [15, 93.353]
  - - [4288, 2944, 1, 1280]
    - [15, 93.109]
  - - [704, 5056, 1, 1280]
    - [7, 92.033]
  - - [2368, 704, 1, 3328]
    - [26, 86.605]
  - - [256, 5888, 1, 256]
    - [7, 58.75]
  - - [1856, 4288, 1, 3328]
    - [15, 94.732]
  - - [256, 2944, 1, 256]
    - [15, 47.512]
  - - [5888, 1024, 1, 256]
    - [7, 83.205]
  - - [448, 64, 1, 1280]
    - [19, 7.952]
  - - [448, 5056, 1, 3328]
    - [15, 79.953]
  - - [3584, 4, 1, 1280]
    - [28, 3.475]
  - - [2944, 64, 1, 256]
    - [29, 19.583]
  - - [128, 4, 1, 1280]
    - [23, 0.138]
  - - [1408, 2944, 1, 256]
    - [6, 77.382]
  - - [256, 1856, 1, 1280]
    - [19, 51.519]
  - - [6784, 5056, 1, 3328]
    - [15, 96.154]
  - - [5056, 5056, 1, 256]
    - [15, 93.596]
  - - [1408, 6784, 1, 128]
    - [11, 78.714]
  - - [64, 1024, 1, 1280]
    - [19, 17.421]
  - - [2944, 4, 1, 256]
    - [24, 1.151]
  - - [704, 5056, 1, 128]
    - [15, 62.219]
  - - [4, 2368, 1, 1280]
    - [23, 2.472]
  - - [2368, 2944, 1, 1280]
    - [15, 92.298]
  - - [128, 3584, 1, 1280]
    - [19, 50.598]
  - - [6784, 6784, 1, 1280]
    - [15, 96.29]
  - - [1408, 4288, 1, 1280]
    - [15, 90.957]
  - - [3584, 4288, 1, 1280]
    - [15, 94.06]
  - - [2368, 704, 1, 1280]
    - [6, 82.403]
  - - [5056, 4288, 1, 3328]
    - [15, 95.478]
  - - [3584, 2368, 1, 3328]
    - [15, 95.676]
  - - [64, 704, 1, 1280]
    - [19, 11.977]
  - - [4288, 256, 1, 256]
    - [7, 52.333]
  - - [2944, 128, 1, 128]
    - [19, 21.105]
  - - [6784, 448, 1, 1280]
    - [15, 89.402]
  - - [1408, 2944, 1, 128]
    - [15, 65.51]
  - - [4288, 2944, 1, 256]
    - [7, 89.625]
  - - [5888, 704, 1, 1280]
    - [15, 86.792]
  - - [1856, 64, 1, 1280]
    - [19, 27.518]
  - - [448, 5888, 1, 128]
    - [7, 56.777]
  - - [5888, 64, 1, 3328]
    - [21, 70.735]
  - - [2944, 256, 1, 3328]
    - [30, 76.323]
  - - [1024, 64, 1, 128]
    - [24, 4.155]
  - - [5056, 2368, 1, 1280]
    - [15, 94.543]
  - - [448, 3584, 1, 1280]
    - [15, 79.776]
  - - [6784, 5888, 1, 256]
    - [15, 94.705]
  - - [704, 1024, 1, 128]
    - [31, 30.355]
  - - [704, 128, 1, 1280]
    - [19, 24.177]
  - - [5888, 2944, 1, 128]
    - [11, 83.466]
  - - [4, 3584, 1, 128]
    - [24, 0.861]
  - - [1408, 448, 1, 1280]
    - [10, 66.52]
  - - [1024, 1408, 1, 256]
    - [15, 56.007]
  - - [2368, 2368, 1, 3328]
    - [15, 92.064]
  - - [1856, 6784, 1, 128]
    - [15, 80.433]
  - - [5056, 704, 1, 3328]
    - [15, 94.119]
  - - [1408, 1856, 1, 256]
    - [15, 73.0]
  - - [1408, 704, 1, 3328]
    - [32, 81.105]
  - - [2368, 5056, 1, 256]
    - [15, 89.694]
  - - [5888, 1856, 1, 256]
    - [7, 88.725]
  - - [4288, 64, 1, 3328]
    - [26, 52.233]
  - - [2368, 4, 1, 1280]
    - [19, 2.495]
  - - [704, 5888, 1, 256]
    - [7, 77.634]
  - - [4288, 64, 1, 256]
    - [19, 27.062]
  - - [6784, 64, 1, 256]
    - [10, 36.298]
  - - [2944, 256, 1, 256]
    - [15, 47.775]
  - - [2944, 6784, 1, 3328]
    - [6, 95.551]
  - - [704, 1408, 1, 3328]
    - [33, 81.194]
  - - [3584, 704, 1, 3328]
    - [11, 88.623]
  - - [2944, 256, 1, 128]
    - [31, 32.204]
  - - [6784, 4, 1, 1280]
    - [28, 6.286]
  - - [1024, 64, 1, 1280]
    - [34, 17.502]
  - - [448, 4288, 1, 256]
    - [15, 62.606]
  - - [64, 3584, 1, 3328]
    - [35, 43.768]
  - - [704, 2368, 1, 1280]
    - [15, 83.044]
  - - [448, 2944, 1, 128]
    - [15, 44.491]
  - - [1856, 2368, 1, 1280]
    - [15, 91.558]
  - - [2368, 128, 1, 3328]
    - [22, 57.254]
  - - [2944, 128, 1, 256]
    - [14, 32.689]
  - - [448, 1408, 1, 256]
    - [8, 40.656]
  - - [1856, 4288, 1, 1280]
    - [15, 93.672]
  - - [64, 5056, 1, 3328]
    - [22, 61.588]
  - - [4, 704, 1, 256]
    - [28, 0.293]
  - - [1024, 448, 1, 128]
    - [4, 21.514]
  - - [704, 4, 1, 1280]
    - [20, 0.752]
  - - [704, 256, 1, 128]
    - [24, 10.717]
  - - [704, 2944, 1, 128]
    - [15, 48.208]
  - - [1408, 1024, 1, 1280]
    - [8, 72.447]
  - - [704, 6784, 1, 256]
    - [7, 81.509]
  - - [6784, 704, 1, 256]
    - [6, 80.91]
  - - [5056, 1408, 1, 128]
    - [15, 73.069]
  - - [256, 3584, 1, 3328]
    - [33, 74.95]
  - - [4, 5888, 1, 3328]
    - [24, 6.967]
  - - [128, 1408, 1, 128]
    - [24, 10.502]
  - - [3584, 4288, 1, 3328]
    - [15, 94.6]
  - - [5888, 1856, 1, 1280]
    - [15, 93.239]
  - - [5056, 1024, 1, 3328]
    - [15, 91.85]
  - - [5056, 64, 1, 1280]
    - [19, 51.422]
  - - [1024, 704, 1, 256]
    - [15, 43.774]
  - - [1024, 4288, 1, 128]
    - [15, 66.133]
  - - [4288, 64, 1, 1280]
    - [19, 44.343]
  - - [2368, 3584, 1, 1280]
    - [15, 94.675]
  - - [2368, 6784, 1, 1280]
    - [15, 95.396]
  - - [1024, 256, 1, 256]
    - [4, 24.79]
  - - [1856, 4, 1, 1280]
    - [23, 1.947]
  - - [448, 448, 1, 256]
    - [24, 20.491]
  - - [2944, 3584, 1, 3328]
    - [11, 94.647]
  - - [128, 4288, 1, 128]
    - [27, 25.534]
  - - [64, 448, 1, 256]
    - [24, 3.063]
  - - [128, 1024, 1, 3328]
    - [12, 37.092]
  - - [4, 1408, 1, 3328]
    - [117, 2.166]
  - - [6784, 2944, 1, 256]
    - [15, 91.946]
  - - [64, 1856, 1, 1280]
    - [19, 27.518]
  - - [64, 1024, 1, 128]
    - [24, 4.2]
  - - [4288, 2368, 1, 3328]
    - [15, 94.743]
  - - [1856, 2368, 1, 256]
    - [7, 80.999]
  - - [3584, 256, 1, 128]
    - [15, 30.951]
  - - [3584, 6784, 1, 3328]
    - [11, 97.23]
  - - [256, 1024, 1, 256]
    - [4, 24.391]
  - - [4, 6784, 1, 3328]
    - [24, 7.933]
  - - [1024, 5888, 1, 3328]
    - [36, 93.786]
  - - [1024, 128, 1, 1280]
    - [20, 29.65]
  - - [4288, 128, 1, 1280]
    - [19, 58.094]
  - - [5056, 4288, 1, 1280]
    - [15, 94.96]
  - - [5888, 64, 1, 256]
    - [37, 32.936]
  - - [1856, 256, 1, 1280]
    - [10, 51.326]
  - - [64, 5888, 1, 3328]
    - [21, 70.735]
  - - [2944, 5888, 1, 128]
    - [11, 84.027]
  - - [704, 5888, 1, 1280]
    - [15, 86.698]
  - - [2368, 3584, 1, 128]
    - [15, 77.219]
  - - [6784, 5888, 1, 3328]
    - [15, 96.869]
  - - [704, 1024, 1, 1280]
    - [15, 67.508]
  - - [448, 256, 1, 3328]
    - [10, 32.151]
  - - [448, 1856, 1, 128]
    - [27, 35.267]
  - - [128, 1024, 1, 128]
    - [38, 8.219]
  - - [2944, 4, 1, 128]
    - [24, 0.7]
  - - [1024, 704, 1, 1280]
    - [15, 66.965]
  - - [128, 5888, 1, 256]
    - [15, 45.764]
  - - [1024, 5056, 1, 1280]
    - [11, 90.639]
  - - [4288, 1024, 1, 256]
    - [7, 80.537]
  - - [2944, 2368, 1, 128]
    - [11, 72.984]
  - - [704, 704, 1, 3328]
    - [10, 59.466]
  - - [704, 1408, 1, 1280]
    - [10, 68.56]
  - - [5888, 448, 1, 1280]
    - [15, 89.878]
  - - [3584, 256, 1, 3328]
    - [32, 74.625]
  - - [704, 5888, 1, 3328]
    - [15, 88.321]
  - - [704, 1856, 1, 128]
    - [15, 44.335]
  - - [128, 3584, 1, 3328]
    - [10, 54.693]
  - - [6784, 2368, 1, 1280]
    - [11, 95.544]
  - - [4, 4288, 1, 128]
    - [24, 1.064]
  - - [128, 704, 1, 1280]
    - [19, 24.065]
  - - [3584, 2944, 1, 256]
    - [15, 88.531]
  - - [1856, 128, 1, 3328]
    - [39, 44.875]
  - - [4, 64, 1, 1280]
    - [23, 0.068]
  - - [4, 5056, 1, 3328]
    - [24, 6.19]
  - - [128, 2944, 1, 1280]
    - [40, 59.231]
  - - [2368, 1024, 1, 3328]
    - [15, 84.872]
  - - [128, 256, 1, 3328]
    - [118, 11.842]
  - - [1408, 5056, 1, 3328]
    - [11, 95.329]
  - - [1856, 1856, 1, 3328]
    - [15, 91.312]
  - - [3584, 128, 1, 256]
    - [4, 31.882]
  - - [448, 1408, 1, 3328]
    - [12, 75.143]
  - - [2368, 2368, 1, 256]
    - [6, 82.516]
  - - [4288, 4288, 1, 1280]
    - [15, 96.091]
  - - [64, 448, 1, 1280]
    - [19, 7.839]
  - - [1408, 4288, 1, 256]
    - [7, 82.922]
  - - [448, 4, 1, 256]
    - [24, 0.191]
  - - [5888, 448, 1, 128]
    - [15, 55.737]
  - - [448, 4, 1, 1280]
    - [23, 0.476]
  - - [704, 6784, 1, 3328]
    - [15, 92.533]
  - - [5888, 5888, 1, 1280]
    - [15, 96.906]
  - - [5056, 1024, 1, 1280]
    - [15, 90.447]
  - - [448, 5888, 1, 3328]
    - [15, 92.263]
  - - [128, 4, 1, 128]
    - [24, 0.031]
  - - [1024, 2944, 1, 1280]
    - [15, 88.951]
  - - [5056, 5888, 1, 1280]
    - [15, 95.611]
  - - [4288, 5888, 1, 128]
    - [11, 84.773]
  - - [256, 3584, 1, 256]
    - [15, 44.105]
  - - [1408, 3584, 1, 128]
    - [15, 68.332]
  - - [256, 2944, 1, 3328]
    - [21, 76.53]
  - - [448, 3584, 1, 128]
    - [15, 47.99]
  - - [5888, 2944, 1, 1280]
    - [15, 95.222]
  - - [4, 6784, 1, 1280]
    - [24, 6.689]
  - - [2368, 5888, 1, 128]
    - [15, 81.737]
  - - [64, 2944, 1, 128]
    - [24, 11.563]
  - - [3584, 5888, 1, 256]
    - [6, 93.101]
  - - [2368, 704, 1, 128]
    - [15, 47.14]
  - - [3584, 2944, 1, 1280]
    - [15, 93.682]
  - - [3584, 2368, 1, 128]
    - [15, 75.784]
  - - [5056, 704, 1, 128]
    - [15, 63.177]
  - - [448, 2368, 1, 128]
    - [15, 36.644]
  - - [5056, 1408, 1, 3328]
    - [15, 95.27]
  - - [1408, 704, 1, 256]
    - [7, 48.871]
  - - [6784, 1024, 1, 3328]
    - [11, 93.159]
  - - [6784, 2944, 1, 3328]
    - [15, 95.673]
  - - [2944, 5056, 1, 3328]
    - [11, 94.443]
  - - [1856, 1856, 1, 256]
    - [6, 76.574]
  - - [1024, 5888, 1, 128]
    - [11, 71.27]
  - - [2048, 7133, 1, 2048]
    - [15, 94.557]
  - - [256, 4, 1, 128]
    - [23, 0.062]
  - - [4288, 5888, 1, 1280]
    - [15, 95.234]
  - - [4288, 4288, 1, 256]
    - [6, 92.391]
  - - [448, 2944, 1, 3328]
    - [26, 90.697]
  - - [4288, 1856, 1, 1280]
    - [15, 93.768]
  - - [1856, 2944, 1, 3328]
    - [15, 89.927]
  - - [256, 6784, 1, 3328]
    - [11, 90.473]
  - - [64, 5888, 1, 256]
    - [10, 33.188]
  - - [256, 5056, 1, 128]
    - [15, 42.666]
  - - [5056, 1024, 1, 256]
    - [7, 81.046]
  - - [704, 64, 1, 3328]
    - [19, 15.825]
  - - [5056, 1856, 1, 3328]
    - [15, 95.872]
  - - [4, 2944, 1, 3328]
    - [19, 4.005]
  - - [4, 5056, 1, 256]
    - [24, 2.16]
  - - [1856, 1408, 1, 256]
    - [6, 73.533]
  - - [3584, 4, 1, 128]
    - [25, 0.87]
  - - [448, 448, 1, 3328]
    - [12, 56.16]
  - - [6784, 128, 1, 3328]
    - [22, 87.289]
  - - [4288, 1408, 1, 128]
    - [15, 69.655]
  - - [4288, 5056, 1, 256]
    - [15, 92.296]
  - - [1408, 128, 1, 1280]
    - [19, 40.61]
  - - [5056, 256, 1, 3328]
    - [26, 88.601]
  - - [704, 704, 1, 256]
    - [4, 34.866]
  - - [1024, 5888, 1, 1280]
    - [6, 90.809]
  - - [6784, 2368, 1, 128]
    - [11, 83.939]
  - - [4, 5056, 1, 1280]
    - [24, 5.05]
  - - [64, 128, 1, 256]
    - [28, 0.883]
  - - [128, 1856, 1, 1280]
    - [19, 39.607]
  - - [5056, 3584, 1, 256]
    - [15, 91.612]
  - - [1856, 1024, 1, 1280]
    - [41, 76.827]
  - - [6784, 4288, 1, 1280]
    - [15, 96.229]
  - - [1856, 1856, 1, 1280]
    - [15, 89.187]
  - - [6784, 2944, 1, 128]
    - [11, 85.593]
  - - [1408, 5056, 1, 1280]
    - [15, 94.25]
  - - [4, 2368, 1, 3328]
    - [23, 3.266]
  - - [5888, 1856, 1, 128]
    - [11, 78.018]
  - - [448, 704, 1, 1280]
    - [19, 51.981]
  - - [2368, 1024, 1, 128]
    - [6, 51.998]
  - - [1024, 448, 1, 3328]
    - [10, 54.65]
  - - [1856, 704, 1, 1280]
    - [15, 84.027]
  - - [5056, 3584, 1, 128]
    - [15, 82.697]
  - - [5888, 5888, 1, 3328]
    - [15, 97.124]
  - - [6784, 1024, 1, 256]
    - [6, 84.186]
  - - [2944, 2368, 1, 256]
    - [6, 84.929]
  - - [256, 448, 1, 256]
    - [29, 11.921]
  - - [5056, 5888, 1, 3328]
    - [15, 95.895]
  - - [1856, 1024, 1, 256]
    - [7, 61.939]
  - - [448, 1408, 1, 1280]
    - [12, 66.765]
  - - [3584, 448, 1, 1280]
    - [15, 79.915]
  - - [1024, 1024, 1, 1280]
    - [10, 70.745]
  - - [448, 5888, 1, 256]
    - [15, 73.687]
  - - [704, 64, 1, 128]
    - [19, 2.825]
  - - [1408, 6784, 1, 3328]
    - [11, 93.396]
  - - [448, 1024, 1, 128]
    - [42, 21.171]
  - - [4288, 704, 1, 128]
    - [15, 57.281]
  - - [128, 1856, 1, 128]
    - [25, 13.983]
  - - [448, 2368, 1, 3328]
    - [10, 79.08]
  - - [5056, 64, 1, 128]
    - [43, 17.778]
  - - [5056, 2944, 1, 256]
    - [7, 90.525]
  - - [6784, 5888, 1, 128]
    - [11, 90.36]
  - - [704, 1024, 1, 256]
    - [15, 45.696]
  - - [1024, 4, 1, 256]
    - [24, 0.422]
  - - [2368, 1856, 1, 256]
    - [7, 80.999]
  - - [128, 6784, 1, 1280]
    - [15, 80.274]
  - - [1408, 3584, 1, 3328]
    - [36, 93.936]
  - - [2368, 6784, 1, 256]
    - [15, 91.614]
  - - [5056, 1408, 1, 1280]
    - [15, 93.97]
  - - [256, 256, 1, 128]
    - [24, 4.345]
  - - [5056, 4288, 1, 128]
    - [11, 83.541]
  - - [1408, 1856, 1, 128]
    - [15, 56.671]
  - - [1408, 5888, 1, 3328]
    - [15, 93.635]
  - - [1856, 256, 1, 256]
    - [4, 32.825]
  - - [6784, 6784, 1, 256]
    - [7, 94.815]
  - - [64, 256, 1, 128]
    - [25, 1.099]
  - - [4288, 2368, 1, 128]
    - [15, 77.993]
  - - [1856, 4288, 1, 128]
    - [15, 75.508]
  - - [256, 4288, 1, 1280]
    - [12, 74.761]
  - - [2368, 2944, 1, 256]
    - [7, 85.11]
  - - [4, 1856, 1, 256]
    - [24, 0.786]
  - - [3584, 1856, 1, 1280]
    - [15, 93.68]
  - - [6784, 6784, 1, 128]
    - [11, 90.763]
  - - [256, 1856, 1, 128]
    - [8, 22.652]
  - - [704, 64, 1, 1280]
    - [23, 12.318]
  - - [5888, 5056, 1, 256]
    - [7, 93.737]
  - - [3584, 448, 1, 256]
    - [7, 60.34]
  - - [448, 4288, 1, 128]
    - [7, 48.391]
  - - [2944, 4288, 1, 3328]
    - [15, 93.729]
  - - [256, 6784, 1, 256]
    - [7, 66.126]
  - - [1408, 4288, 1, 128]
    - [15, 72.557]
  - - [2944, 704, 1, 3328]
    - [15, 86.902]
  - - [128, 448, 1, 256]
    - [24, 6.241]
  - - [512, 32, 1, 512]
    - [5, 2.886]
  - - [3584, 3584, 1, 256]
    - [7, 90.197]
  - - [448, 1408, 1, 128]
    - [27, 28.426]
  - - [128, 256, 1, 1280]
    - [19, 9.088]
  - - [3584, 5056, 1, 256]
    - [15, 91.572]
  - - [6784, 128, 1, 256]
    - [15, 53.006]
  - - [4288, 4, 1, 256]
    - [44, 1.691]
  - - [64, 1408, 1, 3328]
    - [20, 30.786]
  - - [704, 448, 1, 256]
    - [45, 28.652]
  - - [2944, 2368, 1, 1280]
    - [11, 92.15]
  - - [448, 64, 1, 3328]
    - [118, 10.54]
  - - [1408, 3584, 1, 256]
    - [7, 80.081]
  - - [3584, 4, 1, 3328]
    - [28, 4.37]
  - - [6784, 3584, 1, 256]
    - [15, 93.565]
  - - [256, 128, 1, 128]
    - [43, 2.055]
  - - [704, 1408, 1, 128]
    - [15, 34.866]
  - - [4, 2368, 1, 256]
    - [24, 0.993]
  - - [2944, 448, 1, 128]
    - [7, 42.504]
  - - [128, 1408, 1, 256]
    - [5, 18.564]
  - - [4, 2944, 1, 256]
    - [24, 1.224]
  - - [64, 128, 1, 3328]
    - [118, 3.78]
  - - [5056, 2368, 1, 128]
    - [15, 78.84]
  - - [2944, 2944, 1, 3328]
    - [11, 93.183]
  - - [5056, 6784, 1, 256]
    - [7, 94.084]
  - - [1856, 3584, 1, 128]
    - [15, 72.811]
  - - [128, 2944, 1, 128]
    - [4, 20.901]
  - - [1024, 704, 1, 3328]
    - [46, 73.153]
  - - [6784, 448, 1, 256]
    - [15, 74.762]
  - - [3584, 6784, 1, 128]
    - [11, 88.656]
  - - [128, 4288, 1, 256]
    - [8, 36.392]
  - - [704, 448, 1, 3328]
    - [40, 59.725]
  - - [1024, 1024, 1, 3328]
    - [10, 77.624]
  - - [128, 128, 1, 3328]
    - [118, 7.061]
  - - [5056, 1856, 1, 256]
    - [15, 88.812]
  - - [256, 128, 1, 256]
    - [29, 3.566]
  - - [1024, 1856, 1, 256]
    - [7, 63.007]
  - - [4288, 64, 1, 128]
    - [47, 15.673]
  - - [256, 448, 1, 3328]
    - [10, 32.455]
  - - [1408, 6784, 1, 1280]
    - [15, 92.465]
  - - [3584, 3584, 1, 1280]
    - [15, 94.644]
  - - [64, 2368, 1, 1280]
    - [19, 34.554]
  - - [448, 2368, 1, 1280]
    - [10, 72.679]
  - - [5888, 5888, 1, 128]
    - [11, 89.599]
  - - [64, 6784, 1, 3328]
    - [35, 81.194]
  - - [2944, 256, 1, 1280]
    - [7, 70.009]
  - - [5056, 5888, 1, 128]
    - [11, 86.295]
  - - [256, 2368, 1, 128]
    - [48, 26.899]
  - - [5056, 2368, 1, 3328]
    - [15, 95.362]
  - - [2944, 4288, 1, 256]
    - [7, 89.46]
  - - [1408, 3584, 1, 1280]
    - [36, 89.047]
  - - [2368, 64, 1, 256]
    - [19, 15.612]
  - - [64, 448, 1, 3328]
    - [118, 10.592]
  - - [256, 256, 1, 3328]
    - [19, 23.515]
  - - [5888, 4, 1, 128]
    - [28, 1.332]
  - - [1856, 704, 1, 256]
    - [15, 60.298]
  - - [4, 4288, 1, 1280]
    - [24, 4.21]
  - - [1408, 448, 1, 3328]
    - [10, 75.084]
  - - [1024, 4, 1, 3328]
    - [119, 1.702]
  - - [2368, 256, 1, 256]
    - [8, 38.853]
  - - [2368, 6784, 1, 3328]
    - [15, 96.025]
  - - [1856, 1408, 1, 1280]
    - [15, 88.935]
  - - [1856, 448, 1, 1280]
    - [21, 76.742]
  - - [6784, 704, 1, 128]
    - [15, 64.52]
  - - [4, 4, 1, 256]
    - [28, 0.002]
  - - [128, 5888, 1, 128]
    - [31, 32.443]
  - - [1408, 5888, 1, 256]
    - [6, 86.635]
  - - [704, 2944, 1, 1280]
    - [15, 83.899]
  - - [1856, 2368, 1, 128]
    - [15, 65.679]
  - - [4096, 7133, 1, 4096]
    - [11, 95.641]
  - - [256, 64, 1, 256]
    - [24, 1.734]
  - - [1024, 1024, 1, 256]
    - [15, 50.406]
  - - [704, 1856, 1, 256]
    - [7, 62.035]
  - - [128, 4288, 1, 3328]
    - [10, 65.75]
  - - [3584, 704, 1, 1280]
    - [15, 85.717]
  - - [256, 128, 1, 1280]
    - [34, 9.001]
  - - [2368, 4, 1, 256]
    - [44, 0.934]
  - - [256, 2368, 1, 1280]
    - [12, 64.4]
  - - [2944, 6784, 1, 128]
    - [11, 86.041]
  - - [3584, 448, 1, 3328]
    - [11, 83.761]
  - - [1408, 4, 1, 256]
    - [24, 0.613]
  - - [704, 2368, 1, 3328]
    - [15, 86.815]
  - - [2944, 448, 1, 256]
    - [15, 61.356]
  - - [1856, 448, 1, 128]
    - [31, 33.542]
  - - [2368, 128, 1, 1280]
    - [20, 49.813]
  - - [256, 5888, 1, 128]
    - [6, 44.136]
  - - [64, 6784, 1, 256]
    - [10, 36.831]
  - - [64, 5056, 1, 1280]
    - [21, 51.563]
  - - [4, 6784, 1, 128]
    - [24, 1.565]
  - - [2944, 2944, 1, 1280]
    - [15, 92.125]
  - - [5888, 2368, 1, 256]
    - [6, 91.293]
  - - [4, 3584, 1, 1280]
    - [24, 3.519]
  - - [1408, 128, 1, 128]
    - [24, 10.608]
  - - [6784, 704, 1, 3328]
    - [15, 92.414]
  - - [128, 64, 1, 1280]
    - [34, 2.283]
  - - [2368, 256, 1, 1280]
    - [10, 64.163]
  - - [4, 448, 1, 3328]
    - [120, 0.835]
  - - [5888, 4288, 1, 128]
    - [11, 87.841]
  - - [4, 5888, 1, 256]
    - [24, 2.448]
  - - [1408, 2944, 1, 3328]
    - [15, 88.485]
  - - [3584, 704, 1, 128]
    - [15, 54.923]
  - - [64, 1024, 1, 256]
    - [24, 7.133]
  - - [5056, 5056, 1, 128]
    - [11, 85.237]
  - - [2368, 448, 1, 1280]
    - [10, 72.507]
  - - [128, 3584, 1, 256]
    - [19, 32.47]
  - - [704, 448, 1, 1280]
    - [20, 51.394]
  - - [448, 5056, 1, 128]
    - [15, 52.056]
  - - [256, 4, 1, 1280]
    - [23, 0.283]
  - - [128, 5056, 1, 256]
    - [48, 40.578]
  - - [1408, 5056, 1, 128]
    - [15, 74.936]
  - - [2944, 3584, 1, 128]
    - [15, 79.355]
  - - [3584, 2368, 1, 256]
    - [6, 87.736]
  - - [5888, 5056, 1, 1280]
    - [15, 95.643]
  - - [2368, 5056, 1, 128]
    - [15, 80.12]
  - - [64, 704, 1, 256]
    - [5, 4.769]
  - - [4288, 256, 1, 1280]
    - [49, 73.716]
  - - [3584, 3584, 1, 3328]
    - [15, 95.254]
  - - [1024, 256, 1, 128]
    - [20, 14.972]
  - - [4, 704, 1, 128]
    - [24, 0.175]
  - - [5888, 6784, 1, 256]
    - [15, 94.589]
  - - [4288, 2944, 1, 3328]
    - [15, 93.781]
  - - [2944, 64, 1, 128]
    - [19, 11.09]
  - - [1856, 64, 1, 256]
    - [19, 12.573]
  - - [4288, 128, 1, 3328]
    - [49, 65.281]
  - - [4288, 704, 1, 1280]
    - [15, 88.981]
  - - [256, 5056, 1, 1280]
    - [15, 83.237]
  - - [1408, 256, 1, 128]
    - [19, 19.075]
  - - [2944, 5888, 1, 3328]
    - [15, 95.75]
  - - [6784, 5888, 1, 1280]
    - [15, 96.607]
  - - [704, 128, 1, 256]
    - [19, 9.283]
  - - [5888, 4288, 1, 1280]
    - [15, 95.271]
  - - [448, 256, 1, 1280]
    - [19, 26.358]
  - - [5888, 3584, 1, 128]
    - [11, 85.786]
  - - [1856, 1856, 1, 128]
    - [15, 61.903]
  - - [5056, 4, 1, 1280]
    - [28, 4.593]
  - - [256, 1408, 1, 1280]
    - [35, 56.502]
  - - [512, 16, 1, 512]
    - [28, 1.443]
  - - [704, 3584, 1, 128]
    - [15, 55.765]
  - - [5888, 448, 1, 3328]
    - [11, 92.673]
  - - [2368, 4288, 1, 1280]
    - [15, 93.927]
  - - [4288, 2944, 1, 128]
    - [15, 80.287]
  - - [1024, 6784, 1, 3328]
    - [36, 93.201]
  - - [128, 2368, 1, 256]
    - [19, 29.634]
  - - [6784, 64, 1, 3328]
    - [35, 81.297]
  - - [5056, 2944, 1, 3328]
    - [15, 94.395]
  - - [448, 128, 1, 256]
    - [28, 6.069]
  - - [2944, 3584, 1, 256]
    - [6, 88.402]
  - - [1408, 1408, 1, 3328]
    - [36, 88.65]
  - - [1856, 128, 1, 1280]
    - [19, 39.267]
  - - [3584, 3584, 1, 128]
    - [11, 80.98]
  - - [64, 3584, 1, 256]
    - [20, 22.814]
  - - [1408, 4, 1, 3328]
    - [119, 2.252]
  - - [128, 2944, 1, 3328]
    - [22, 71.27]
  - - [3584, 704, 1, 256]
    - [15, 70.999]
  - - [2944, 448, 1, 3328]
    - [26, 90.781]
  - - [3584, 1408, 1, 3328]
    - [32, 91.197]
  - - [704, 3584, 1, 1280]
    - [15, 86.378]
  - - [2944, 6784, 1, 1280]
    - [15, 95.214]
  - - [1856, 6784, 1, 256]
    - [15, 90.96]
  - - [4288, 448, 1, 3328]
    - [32, 84.89]
  - - [6784, 4288, 1, 128]
    - [11, 88.692]
  - - [6784, 704, 1, 1280]
    - [15, 91.104]
  - - [256, 4288, 1, 256]
    - [7, 53.891]
  - - [3584, 64, 1, 128]
    - [29, 13.366]
  - - [5888, 1024, 1, 3328]
    - [11, 92.17]
  - - [448, 64, 1, 128]
    - [19, 1.798]
  - - [704, 6784, 1, 1280]
    - [15, 91.074]
  - - [5888, 128, 1, 256]
    - [15, 45.522]
  - - [2368, 448, 1, 3328]
    - [10, 78.884]
  - - [1856, 5056, 1, 3328]
    - [15, 95.886]
  - - [4, 6784, 1, 256]
    - [24, 2.722]
  - - [1024, 3584, 1, 128]
    - [15, 61.721]
  - - [1024, 1408, 1, 128]
    - [15, 43.318]
  - - [2368, 2944, 1, 128]
    - [15, 74.609]
  - - [5056, 64, 1, 256]
    - [23, 29.166]
  - - [4, 448, 1, 1280]
    - [20, 0.474]
  - - [5056, 2944, 1, 128]
    - [15, 81.08]
  - - [5888, 5056, 1, 3328]
    - [15, 95.938]
  - - [1024, 704, 1, 128]
    - [27, 30.353]
  - - [1408, 2368, 1, 128]
    - [15, 60.671]
  - - [5888, 2368, 1, 128]
    - [11, 81.241]
  - - [128, 5056, 1, 3328]
    - [12, 76.488]
  - - [3584, 6784, 1, 1280]
    - [11, 96.767]
  - - [3072, 7435, 1, 1024]
    - [15, 94.077]
  - - [1856, 5888, 1, 256]
    - [7, 88.724]
  - - [256, 256, 1, 256]
    - [24, 7.27]
  - - [256, 64, 1, 128]
    - [24, 1.062]
  - - [4288, 4288, 1, 3328]
    - [15, 96.591]
  - - [4288, 1408, 1, 1280]
    - [7, 91.004]
  - - [3584, 5056, 1, 128]
    - [11, 84.707]
  - - [4, 1024, 1, 3328]
    - [120, 1.75]
  - - [4288, 2368, 1, 256]
    - [15, 88.546]
  - - [2944, 5056, 1, 1280]
    - [15, 93.87]
  - - [448, 6784, 1, 256]
    - [6, 75.406]
  - - [64, 1024, 1, 3328]
    - [19, 22.492]
  - - [6784, 2368, 1, 3328]
    - [11, 96.271]
  - - [256, 1024, 1, 1280]
    - [19, 43.329]
  - - [704, 4, 1, 128]
    - [24, 0.169]
  - - [256, 4, 1, 256]
    - [24, 0.108]
  - - [4288, 128, 1, 256]
    - [4, 37.249]
  - - [4288, 1856, 1, 3328]
    - [15, 94.898]
  - - [3584, 448, 1, 128]
    - [15, 46.311]
  - - [256, 4, 1, 3328]
    - [118, 0.492]
  - - [4, 1408, 1, 1280]
    - [23, 1.497]
  - - [3584, 64, 1, 1280]
    - [19, 37.804]
  - - [1408, 448, 1, 128]
    - [27, 29.11]
  - - [3584, 1024, 1, 1280]
    - [15, 85.056]
  - - [1856, 5056, 1, 256]
    - [6, 89.105]
  - - [4, 3584, 1, 256]
    - [24, 1.49]
  - - [1024, 4288, 1, 256]
    - [6, 80.794]
  - - [5888, 3584, 1, 3328]
    - [15, 96.729]
  - - [4, 256, 1, 256]
    - [20, 0.109]
  - - [5056, 3584, 1, 3328]
    - [36, 95.34]
  - - [128, 5888, 1, 1280]
    - [15, 69.783]
  - - [704, 448, 1, 128]
    - [4, 17.493]
  - - [2368, 1408, 1, 1280]
    - [15, 86.44]
  - - [5056, 2944, 1, 1280]
    - [15, 93.819]
  - - [4, 4, 1, 128]
    - [24, 0.001]
  - - [3584, 256, 1, 256]
    - [7, 44.29]
  - - [128, 1856, 1, 3328]
    - [35, 45.102]
  - - [1024, 6784, 1, 256]
    - [7, 84.81]
  - - [4, 128, 1, 256]
    - [20, 0.054]
  - - [64, 64, 1, 1280]
    - [19, 1.094]
  - - [6784, 4, 1, 128]
    - [29, 1.491]
  - - [2944, 1408, 1, 128]
    - [15, 63.258]
  - - [448, 128, 1, 3328]
    - [23, 20.001]
  - - [64, 2944, 1, 3328]
    - [12, 51.946]
  - - [64, 4288, 1, 3328]
    - [35, 52.299]
  - - [5056, 6784, 1, 3328]
    - [15, 96.172]
  - - [128, 2944, 1, 256]
    - [10, 32.935]
  - - [128, 6784, 1, 128]
    - [27, 36.832]
  - - [3584, 4288, 1, 256]
    - [7, 90.692]
  - - [448, 1856, 1, 256]
    - [15, 50.756]
  - - [1856, 6784, 1, 3328]
    - [15, 96.669]
  - - [3584, 128, 1, 3328]
    - [10, 54.955]
  - - [64, 1856, 1, 256]
    - [29, 12.459]
  - - [1024, 448, 1, 1280]
    - [19, 50.025]
  - - [5888, 4288, 1, 256]
    - [7, 93.062]
  - - [4, 448, 1, 128]
    - [24, 0.109]
  - - [5056, 1408, 1, 256]
    - [15, 86.362]
  - - [64, 256, 1, 1280]
    - [19, 4.458]
  - - [3584, 1024, 1, 256]
    - [15, 74.544]
  - - [256, 704, 1, 256]
    - [28, 18.401]
  - - [5888, 5888, 1, 256]
    - [15, 94.466]
  - - [4288, 1024, 1, 1280]
    - [6, 91.374]
  - - [5888, 128, 1, 3328]
    - [26, 76.427]
  - - [448, 6784, 1, 3328]
    - [15, 91.845]
  - - [2944, 1408, 1, 1280]
    - [15, 86.761]
  - - [1024, 32, 1, 512]
    - [3, 5.601]
  - - [2944, 1856, 1, 3328]
    - [15, 89.907]
  - - [2368, 64, 1, 128]
    - [29, 8.921]
  - - [2944, 2944, 1, 128]
    - [15, 77.273]
  - - [4, 128, 1, 3328]
    - [120, 0.269]
  - - [3584, 5888, 1, 1280]
    - [15, 96.397]
  - - [64, 4, 1, 128]
    - [47, 0.015]
  - - [6784, 1856, 1, 1280]
    - [11, 95.972]
  - - [2944, 5056, 1, 256]
    - [7, 90.86]
  - - [2944, 5888, 1, 1280]
    - [15, 95.294]
  - - [5888, 256, 1, 3328]
    - [49, 79.267]
  - - [1856, 5888, 1, 3328]
    - [15, 93.996]
  - - [3584, 1408, 1, 256]
    - [6, 79.642]
  - - [704, 3584, 1, 3328]
    - [15, 88.623]
  - - [5056, 448, 1, 1280]
    - [7, 77.867]
  - - [3584, 1856, 1, 3328]
    - [15, 94.834]
  - - [64, 1408, 1, 128]
    - [29, 5.65]
  - - [1408, 704, 1, 1280]
    - [10, 67.747]
  - - [2944, 1024, 1, 256]
    - [7, 74.0]
  - - [1024, 2368, 1, 128]
    - [11, 53.592]
  - - [2368, 4288, 1, 3328]
    - [15, 94.826]
  - - [4, 1408, 1, 256]
    - [28, 0.596]
  - - [1024, 1408, 1, 1280]
    - [8, 72.892]
  - - [64, 64, 1, 256]
    - [23, 0.43]
  - - [704, 256, 1, 3328]
    - [10, 51.0]
  - - [6784, 5056, 1, 256]
    - [15, 94.039]
  - - [4, 4288, 1, 3328]
    - [24, 5.207]
  - - [448, 6784, 1, 128]
    - [7, 57.86]
  - - [4, 704, 1, 3328]
    - [120, 1.284]
  - - [448, 2944, 1, 256]
    - [7, 61.604]
  - - [2944, 6784, 1, 256]
    - [6, 92.278]
  - - [2368, 2368, 1, 1280]
    - [7, 90.835]
  - - [4, 4, 1, 1280]
    - [23, 0.004]
  - - [1856, 3584, 1, 1280]
    - [15, 93.726]
  - - [64, 2944, 1, 256]
    - [24, 19.583]
  - - [3584, 1408, 1, 1280]
    - [15, 88.478]
  - - [448, 256, 1, 128]
    - [24, 7.191]
  - - [4288, 448, 1, 128]
    - [7, 47.56]
  - - [5056, 256, 1, 1280]
    - [15, 83.423]
  - - [1856, 1408, 1, 3328]
    - [15, 91.767]
  - - [128, 128, 1, 128]
    - [24, 1.112]
  - - [1024, 4288, 1, 3328]
    - [11, 93.624]
  - - [448, 2368, 1, 256]
    - [7, 52.082]
  - - [1024, 4, 1, 128]
    - [25, 0.269]
  - - [5056, 448, 1, 256]
    - [7, 65.005]
  - - [2944, 2368, 1, 3328]
    - [11, 93.422]
  - - [704, 128, 1, 3328]
    - [19, 30.927]
  - - [64, 64, 1, 3328]
    - [120, 1.982]
  - - [1024, 1856, 1, 1280]
    - [7, 77.043]
  - - [6784, 1856, 1, 256]
    - [15, 90.79]
  - - [128, 2368, 1, 3328]
    - [35, 57.326]
  - - [1024, 5888, 1, 256]
    - [6, 83.706]
  - - [5056, 128, 1, 1280]
    - [49, 66.664]
  - - [5056, 64, 1, 3328]
    - [35, 61.277]
  - - [128, 704, 1, 128]
    - [24, 5.776]
  - - [1408, 2368, 1, 256]
    - [7, 74.982]
  - - [1408, 1408, 1, 256]
    - [6, 64.61]
  - - [4, 64, 1, 128]
    - [28, 0.015]
  - - [64, 128, 1, 1280]
    - [34, 2.229]
  - - [2368, 2368, 1, 128]
    - [15, 70.78]
  - - [64, 5888, 1, 128]
    - [4, 20.508]
  - - [5888, 4, 1, 3328]
    - [28, 7.023]
  - - [6784, 1408, 1, 128]
    - [11, 77.17]
  - - [4288, 5888, 1, 256]
    - [7, 93.061]
  - - [1408, 5056, 1, 256]
    - [7, 86.635]
  - - [5056, 128, 1, 3328]
    - [10, 74.492]
  - - [128, 128, 1, 1280]
    - [19, 4.588]
  - - [448, 704, 1, 256]
    - [19, 28.206]
  - - [4288, 3584, 1, 128]
    - [15, 81.257]
  - - [2944, 128, 1, 3328]
    - [22, 70.913]
  - - [128, 5056, 1, 1280]
    - [10, 69.133]
  - - [3584, 5056, 1, 1280]
    - [15, 94.802]
  - - [256, 448, 1, 1280]
    - [19, 26.784]
  - - [704, 704, 1, 128]
    - [4, 24.025]
  - - [5056, 4, 1, 128]
    - [28, 1.19]
  - - [704, 256, 1, 1280]
    - [20, 41.255]
  - - [64, 2368, 1, 3328]
    - [12, 41.86]
  - - [1856, 1024, 1, 128]
    - [6, 45.68]
  - - [1856, 64, 1, 128]
    - [24, 7.289]
  - - [64, 6784, 1, 1280]
    - [21, 68.429]
  - - [704, 4288, 1, 256]
    - [7, 75.059]
  - - [5888, 2368, 1, 1280]
    - [15, 96.069]
  - - [128, 256, 1, 256]
    - [23, 3.601]
  - - [256, 64, 1, 1280]
    - [50, 4.544]
  - - [2368, 5888, 1, 1280]
    - [15, 95.988]
  - - [5888, 256, 1, 1280]
    - [7, 75.022]
  - - [4, 5888, 1, 1280]
    - [24, 5.637]
  - - [704, 128, 1, 128]
    - [24, 5.65]
  - - [1024, 4, 1, 1280]
    - [19, 1.109]
  - - [2368, 1856, 1, 3328]
    - [15, 93.538]
  - - [2368, 128, 1, 128]
    - [47, 17.484]
  - - [2944, 704, 1, 256]
    - [15, 67.547]
  - - [5056, 128, 1, 128]
    - [48, 28.94]
  - - [256, 704, 1, 3328]
    - [12, 50.429]
  - - [704, 3584, 1, 256]
    - [6, 71.521]
  - - [1024, 1024, 1, 1024]
    - [10, 68.637]
  - - [704, 2944, 1, 3328]
    - [35, 86.829]
  - - [6784, 1024, 1, 128]
    - [11, 72.727]
  - - [256, 448, 1, 128]
    - [19, 7.114]
  - - [448, 1024, 1, 3328]
    - [10, 54.563]
  - - [2944, 1024, 1, 3328]
    - [15, 90.81]
  - - [2944, 5056, 1, 128]
    - [11, 83.201]
  - - [1408, 6784, 1, 256]
    - [6, 87.809]
  - - [6784, 1408, 1, 3328]
    - [11, 93.371]
  - - [4288, 6784, 1, 128]
    - [11, 86.275]
  - - [704, 64, 1, 256]
    - [5, 4.858]
  - - [5888, 4, 1, 1280]
    - [28, 5.5]
  - - [256, 2368, 1, 3328]
    - [12, 71.987]
  - - [6784, 2944, 1, 1280]
    - [15, 95.19]
  - - [4288, 1856, 1, 128]
    - [15, 74.77]
  - - [1856, 2944, 1, 128]
    - [15, 69.58]
  - - [6784, 448, 1, 128]
    - [15, 58.245]
  - - [64, 3584, 1, 128]
    - [47, 13.783]
  - - [448, 5056, 1, 1280]
    - [15, 77.774]
  - - [2368, 1856, 1, 128]
    - [15, 67.608]
  - - [128, 448, 1, 1280]
    - [19, 15.314]
  - - [4288, 704, 1, 256]
    - [7, 74.737]
  - - [256, 3584, 1, 128]
    - [4, 31.133]
  - - [5888, 704, 1, 256]
    - [15, 76.516]
  - - [3584, 1024, 1, 128]
    - [15, 60.314]
  - - [256, 5888, 1, 3328]
    - [12, 81.232]
  - - [1408, 4288, 1, 3328]
    - [33, 94.02]
  - - [6784, 4288, 1, 256]
    - [6, 93.719]
  - - [4288, 256, 1, 128]
    - [15, 37.692]
  - - [5888, 256, 1, 256]
    - [7, 57.204]
  - - [6784, 1024, 1, 1280]
    - [11, 91.742]
  - - [5888, 1024, 1, 128]
    - [11, 70.263]
  - - [1024, 128, 1, 256]
    - [20, 13.502]
  - - [128, 64, 1, 3328]
    - [118, 3.551]
  - - [448, 64, 1, 256]
    - [24, 3.063]
  - - [2368, 256, 1, 128]
    - [8, 27.319]
  - - [6784, 3584, 1, 1280]
    - [11, 96.767]
  - - [1024, 6784, 1, 1280]
    - [11, 91.952]
  - - [2944, 64, 1, 1280]
    - [19, 42.291]
  - - [1408, 2944, 1, 1280]
    - [15, 86.729]
  - - [256, 1856, 1, 256]
    - [4, 32.823]
  - - [1408, 2368, 1, 3328]
    - [11, 88.49]
  - - [2944, 4, 1, 3328]
    - [23, 3.987]
  - - [128, 1408, 1, 3328]
    - [12, 50.149]
  - - [2944, 1856, 1, 128]
    - [15, 70.513]
  - - [256, 2944, 1, 128]
    - [51, 32.687]
  - - [256, 6784, 1, 128]
    - [15, 49.351]
  - - [2368, 4, 1, 128]
    - [24, 0.563]
  - - [1408, 256, 1, 3328]
    - [22, 67.915]
  - - [1856, 4, 1, 128]
    - [24, 0.456]
  - - [1024, 16, 1, 512]
    - [28, 2.8]
  - - [5056, 6784, 1, 128]
    - [11, 87.239]
  - - [4288, 5056, 1, 128]
    - [15, 83.486]
  - - [1856, 5888, 1, 128]
    - [15, 79.494]
  - - [2944, 5888, 1, 256]
    - [15, 91.694]
  - - [3584, 1856, 1, 256]
    - [6, 85.365]
  - - [4288, 3584, 1, 1280]
    - [15, 93.96]
  - - [2368, 448, 1, 256]
    - [7, 50.996]
  - - [4288, 256, 1, 3328]
    - [49, 79.344]
  - - [1856, 704, 1, 128]
    - [15, 42.584]
  - - [1408, 64, 1, 256]
    - [24, 9.807]
  - - [64, 1856, 1, 128]
    - [24, 7.368]
  - - [4, 256, 1, 128]
    - [28, 0.063]
  - - [704, 4288, 1, 3328]
    - [36, 91.986]
  - - [704, 5888, 1, 128]
    - [15, 64.976]
  - - [6784, 3584, 1, 128]
    - [11, 87.115]
  - - [1024, 64, 1, 256]
    - [5, 6.936]
  - - [64, 2368, 1, 256]
    - [24, 16.341]
  - - [4288, 5056, 1, 3328]
    - [15, 95.391]
  - - [4, 1856, 1, 1280]
    - [23, 1.955]
  - - [4288, 128, 1, 128]
    - [31, 25.129]
  - - [1408, 1408, 1, 128]
    - [6, 48.663]
  - - [1024, 128, 1, 3328]
    - [10, 37.302]
  - - [1856, 128, 1, 128]
    - [20, 13.568]
  - - [5056, 2368, 1, 256]
    - [6, 89.751]
  - - [4288, 704, 1, 3328]
    - [15, 91.024]
  - - [448, 3584, 1, 256]
    - [7, 61.955]
  - - [64, 128, 1, 128]
    - [24, 0.525]
  - - [2368, 64, 1, 1280]
    - [19, 34.418]
  - - [2368, 1024, 1, 1280]
    - [15, 82.232]
  - - [2944, 1408, 1, 3328]
    - [11, 88.359]
  - - [1408, 448, 1, 256]
    - [8, 39.337]
  - - [1024, 1408, 1, 3328]
    - [10, 77.953]
  - - [2560, 7133, 1, 2560]
    - [15, 95.581]
  - - [1408, 4, 1, 1280]
    - [23, 1.504]
  - - [5888, 3584, 1, 256]
    - [6, 92.995]
  - - [128, 1024, 1, 1280]
    - [12, 29.42]
  - - [1408, 1856, 1, 3328]
    - [11, 91.617]
  - - [4, 4, 1, 3328]
    - [118, 0.009]
  - - [6784, 1408, 1, 1280]
    - [15, 92.496]
  - - [4, 1024, 1, 1280]
    - [20, 1.104]
  - - [704, 2944, 1, 256]
    - [7, 67.356]
  - - [704, 4288, 1, 128]
    - [15, 59.029]
  - - [2368, 4288, 1, 128]
    - [15, 79.046]
  - - [64, 4288, 1, 1280]
    - [19, 44.097]
  - - [6784, 64, 1, 1280]
    - [35, 67.508]
  - - [3584, 128, 1, 128]
    - [4, 22.238]
  - - [1024, 6784, 1, 128]
    - [11, 74.071]
  - - [4, 1856, 1, 128]
    - [24, 0.46]
  - - [1408, 64, 1, 3328]
    - [20, 30.303]
  - - [6784, 4, 1, 256]
    - [28, 2.699]
  - - [1408, 1408, 1, 1280]
    - [36, 80.308]
  - - [256, 2368, 1, 256]
    - [15, 39.072]
  - - [448, 4288, 1, 3328]
    - [36, 85.902]
  - - [2368, 1408, 1, 256]
    - [15, 74.115]
  - - [5888, 5056, 1, 128]
    - [11, 88.61]
  - - [704, 2368, 1, 256]
    - [7, 64.324]
  - - [2944, 448, 1, 1280]
    - [15, 84.723]
  - - [5888, 2368, 1, 3328]
    - [15, 96.696]
  - - [64, 2944, 1, 1280]
    - [20, 41.964]
  - - [448, 1856, 1, 1280]
    - [7, 76.498]
  - - [4288, 448, 1, 1280]
    - [15, 77.873]
  - - [5888, 704, 1, 3328]
    - [15, 88.472]
  - - [5056, 256, 1, 128]
    - [15, 43.41]
  - - [1856, 256, 1, 128]
    - [4, 22.284]
  - - [5056, 128, 1, 256]
    - [52, 40.578]
  - - [704, 4, 1, 256]
    - [24, 0.301]
  - - [1408, 5888, 1, 128]
    - [15, 75.075]
  - - [4288, 4, 1, 128]
    - [53, 0.989]
  - - [1408, 1024, 1, 256]
    - [6, 54.182]
  - - [1024, 1856, 1, 128]
    - [7, 48.083]
  - - [256, 704, 1, 128]
    - [25, 10.717]
  - - [256, 1024, 1, 128]
    - [19, 15.751]
  - - [448, 1024, 1, 256]
    - [4, 32.47]
  - - [128, 4, 1, 3328]
    - [118, 0.254]
  - - [5056, 6784, 1, 1280]
    - [15, 95.866]
  - - [704, 5056, 1, 3328]
    - [15, 94.152]
  - - [64, 1408, 1, 1280]
    - [20, 23.736]
  - - [3584, 5056, 1, 3328]
    - [15, 95.16]
  - - [1856, 4, 1, 3328]
    - [20, 2.589]
  - - [4, 2944, 1, 128]
    - [24, 0.73]
  - - [2368, 2944, 1, 3328]
    - [15, 93.313]
  - - [448, 448, 1, 1280]
    - [19, 45.049]
  - - [2368, 3584, 1, 256]
    - [7, 88.051]
  - - [5056, 3584, 1, 1280]
    - [15, 94.785]
  - - [448, 4, 1, 3328]
    - [118, 0.8]
  - - [1856, 2944, 1, 1280]
    - [15, 88.612]
  - - [3584, 2368, 1, 1280]
    - [15, 94.914]
  - - [128, 1024, 1, 256]
    - [19, 13.502]
  - - [2944, 1408, 1, 256]
    - [7, 77.009]
  - - [4288, 1408, 1, 3328]
    - [15, 92.154]
  - - [3584, 64, 1, 3328]
    - [35, 43.547]
  - - [1408, 128, 1, 256]
    - [28, 18.902]
  - - [2944, 1024, 1, 128]
    - [15, 56.278]
  - - [4288, 5056, 1, 1280]
    - [15, 94.938]
  - - [5888, 6784, 1, 1280]
    - [15, 96.603]
  - - [6784, 5056, 1, 128]
    - [11, 89.936]
  - - [256, 1024, 1, 3328]
    - [46, 49.517]
  - - [3584, 4, 1, 256]
    - [29, 1.438]
  - - [1856, 64, 1, 3328]
    - [10, 33.614]
  - - [64, 6784, 1, 128]
    - [4, 23.408]
  - - [5888, 1408, 1, 3328]
    - [15, 93.558]
  - - [5888, 64, 1, 1280]
    - [35, 59.883]
  - - [256, 5056, 1, 256]
    - [7, 60.702]
  - - [128, 3584, 1, 128]
    - [4, 22.426]
  - - [448, 3584, 1, 3328]
    - [22, 83.616]
  - - [704, 2368, 1, 128]
    - [15, 46.91]
  - - [5888, 256, 1, 128]
    - [15, 45.287]
  - - [4, 5056, 1, 128]
    - [24, 1.215]
  - - [448, 256, 1, 256]
    - [29, 11.814]
  - - [704, 4, 1, 3328]
    - [117, 1.167]
  - - [1408, 256, 1, 256]
    - [14, 30.576]
  - - [3584, 1856, 1, 128]
    - [15, 72.673]
  - - [4288, 4288, 1, 128]
    - [15, 82.412]
  - - [1856, 1024, 1, 3328]
    - [41, 84.633]
  - - [128, 5888, 1, 3328]
    - [54, 76.067]
  - - [1024, 5056, 1, 256]
    - [15, 81.711]
  - - [2368, 1408, 1, 3328]
    - [15, 88.334]
  - - [5888, 448, 1, 256]
    - [7, 72.115]
  - - [5888, 6784, 1, 128]
    - [11, 90.324]
  - - [2368, 4, 1, 3328]
    - [20, 3.273]
  - - [6784, 5056, 1, 1280]
    - [15, 95.839]
  - - [5056, 704, 1, 1280]
    - [15, 92.033]
  - - [1408, 256, 1, 1280]
    - [21, 55.743]
  - - [4288, 6784, 1, 1280]
    - [15, 96.234]
  - - [128, 704, 1, 256]
    - [24, 9.716]
  - - [448, 128, 1, 1280]
    - [19, 15.386]
  - - [6784, 4, 1, 3328]
    - [28, 7.723]
  - - [4288, 4, 1, 1280]
    - [28, 4.175]
  - - [1024, 64, 1, 3328]
    - [19, 21.989]
  - - [1856, 4, 1, 256]
    - [24, 0.786]
  - - [64, 3584, 1, 1280]
    - [20, 38.353]
  - - [6784, 1408, 1, 256]
    - [15, 87.114]
  - - [3584, 5888, 1, 128]
    - [11, 86.028]
  - - [5056, 5888, 1, 256]
    - [7, 93.763]
  - - [2368, 1024, 1, 256]
    - [7, 68.233]
  - - [2944, 1856, 1, 256]
    - [7, 81.445]
  - - [1856, 6784, 1, 1280]
    - [15, 95.883]
  - - [64, 5056, 1, 128]
    - [19, 18.481]
  - - [5888, 64, 1, 128]
    - [25, 20.507]
  - - [448, 704, 1, 128]
    - [4, 18.014]
  - - [4, 1024, 1, 128]
    - [24, 0.257]
  - - [4288, 3584, 1, 256]
    - [7, 90.878]
  - - [1408, 704, 1, 128]
    - [6, 34.653]
  - - [64, 256, 1, 3328]
    - [120, 6.732]
  - - [5056, 1856, 1, 1280]
    - [15, 95.033]
  - - [1408, 1024, 1, 3328]
    - [10, 77.728]
  - - [2368, 256, 1, 3328]
    - [10, 71.703]
  - - [5888, 3584, 1, 1280]
    - [15, 96.283]
  - - [1856, 3584, 1, 3328]
    - [15, 94.852]
  - - [5888, 128, 1, 1280]
    - [15, 69.896]
  - - [1024, 2944, 1, 256]
    - [7, 75.609]
  - - [448, 6784, 1, 1280]
    - [15, 89.311]
  - - [256, 3584, 1, 1280]
    - [12, 62.858]
  - - [448, 128, 1, 128]
    - [19, 3.635]
  - - [704, 5056, 1, 256]
    - [6, 78.07]
  - - [3584, 1024, 1, 3328]
    - [15, 86.723]
  - - [2944, 1856, 1, 1280]
    - [15, 88.812]
  - - [128, 256, 1, 128]
    - [24, 2.124]
  - - [5056, 256, 1, 256]
    - [7, 60.702]
  - - [2368, 3584, 1, 3328]
    - [15, 95.719]
  - - [2944, 704, 1, 1280]
    - [15, 83.782]
  - - [128, 4, 1, 256]
    - [24, 0.054]
  - - [2944, 3584, 1, 1280]
    - [11, 93.71]
  - - [1856, 5888, 1, 1280]
    - [15, 93.239]
  - - [256, 256, 1, 1280]
    - [19, 18.532]
  - - [5056, 448, 1, 3328]
    - [15, 79.953]
  - - [4288, 1408, 1, 256]
    - [7, 82.922]
  - - [3584, 64, 1, 256]
    - [19, 22.619]
  - - [64, 1856, 1, 3328]
    - [12, 33.052]
  - - [256, 1408, 1, 128]
    - [4, 19.993]
  - - [5888, 1408, 1, 128]
    - [15, 73.914]
  - - [4288, 2368, 1, 1280]
    - [15, 93.988]
  - - [4, 4288, 1, 256]
    - [24, 1.799]
  - - [256, 4288, 1, 128]
    - [15, 37.692]
  - - [256, 128, 1, 3328]
    - [118, 11.958]
  - - [6784, 2368, 1, 256]
    - [15, 91.434]
  - - [5888, 128, 1, 128]
    - [31, 33.443]
  - - [4288, 1856, 1, 256]
    - [7, 86.784]
  - - [1856, 256, 1, 3328]
    - [10, 56.737]
  - - [1856, 2944, 1, 256]
    - [7, 81.551]
  - - [5056, 1024, 1, 128]
    - [15, 66.074]
  - - [64, 5888, 1, 1280]
    - [22, 59.719]
  - - [1760, 7133, 1, 1760]
    - [15, 92.456]
  - - [6784, 256, 1, 128]
    - [15, 48.868]
  - - [5888, 704, 1, 128]
    - [15, 63.593]
  - - [6784, 64, 1, 128]
    - [19, 22.563]
  - - [1024, 4288, 1, 1280]
    - [15, 91.473]
  - - [2368, 5056, 1, 3328]
    - [15, 95.286]
  - - [448, 4, 1, 128]
    - [24, 0.109]
  - - [4, 256, 1, 3328]
    - [120, 0.504]
  - - [4288, 1024, 1, 3328]
    - [15, 93.227]
  - - [1024, 5056, 1, 3328]
    - [11, 92.145]
  - - [1024, 1856, 1, 3328]
    - [36, 84.885]
  - - [704, 704, 1, 1280]
    - [20, 54.044]
  - - [128, 2368, 1, 1280]
    - [19, 49.955]
  - - [1408, 128, 1, 3328]
    - [10, 50.242]
  - - [3584, 256, 1, 1280]
    - [10, 62.486]
  - - [4, 128, 1, 128]
    - [47, 0.032]
  - - [704, 6784, 1, 128]
    - [15, 66.226]
  - - [3584, 128, 1, 1280]
    - [10, 49.279]
  - - [4, 256, 1, 1280]
    - [20, 0.28]
  - - [128, 704, 1, 3328]
    - [50, 31.285]
  - - [4288, 6784, 1, 256]
    - [15, 93.772]
  - - [3584, 2944, 1, 3328]
    - [11, 94.59]
  - - [128, 1856, 1, 256]
    - [19, 23.426]
  - - [64, 4288, 1, 256]
    - [19, 26.831]
  - - [4, 3584, 1, 3328]
    - [24, 4.388]
  - - [64, 4, 1, 3328]
    - [118, 0.139]
  - - [4, 64, 1, 3328]
    - [118, 0.138]
  - - [5888, 2944, 1, 256]
    - [7, 91.736]
  - - [2368, 6784, 1, 128]
    - [15, 83.485]
  - - [448, 4288, 1, 1280]
    - [8, 77.71]
  - - [448, 1856, 1, 3328]
    - [35, 83.865]
  - - [4, 1024, 1, 256]
    - [24, 0.438]
  - - [5056, 4288, 1, 256]
    - [15, 92.467]
  - - [1024, 448, 1, 256]
    - [19, 31.693]
  - - [1024, 3584, 1, 256]
    - [7, 75.88]
  - - [2944, 128, 1, 1280]
    - [35, 59.069]
  - - [1856, 5056, 1, 128]
    - [15, 78.679]
  - - [64, 256, 1, 256]
    - [5, 1.734]
  - - [1408, 4, 1, 128]
    - [24, 0.349]
  - - [128, 2368, 1, 128]
    - [4, 17.484]
  - - [256, 704, 1, 1280]
    - [19, 40.769]
  - - [64, 2368, 1, 128]
    - [24, 9.203]
  - - [6784, 6784, 1, 3328]
    - [15, 96.45]
  - - [448, 5888, 1, 1280]
    - [15, 89.666]
  - - [5056, 448, 1, 128]
    - [15, 51.441]
  - - [3584, 2944, 1, 128]
    - [11, 79.251]
  - - [6784, 256, 1, 1280]
    - [7, 85.919]
  - - [256, 2944, 1, 1280]
    - [55, 69.449]
  - - [64, 4288, 1, 128]
    - [19, 15.369]
  - - [2368, 5888, 1, 3328]
    - [15, 96.71]
  - - [4, 64, 1, 256]
    - [28, 0.026]
  - - [704, 1024, 1, 3328]
    - [22, 73.352]
  - - [2368, 1856, 1, 1280]
    - [15, 91.558]
  - - [128, 448, 1, 128]
    - [24, 3.635]
  - - [128, 6784, 1, 256]
    - [15, 52.452]
  - - [3584, 4288, 1, 128]
    - [11, 83.084]
  - - [64, 448, 1, 128]
    - [24, 1.817]
  - - [5888, 4288, 1, 3328]
    - [15, 95.558]
  - - [2368, 704, 1, 256]
    - [7, 63.266]
  - - [256, 1856, 1, 3328]
    - [10, 56.827]
  - - [1856, 128, 1, 256]
    - [19, 23.228]
  - - [6784, 128, 1, 128]
    - [55, 36.298]
  - - [3584, 1408, 1, 128]
    - [15, 68.013]
  - - [1856, 5056, 1, 1280]
    - [15, 94.834]
  - - [2944, 1024, 1, 1280]
    - [6, 88.319]
  - - [5056, 4, 1, 256]
    - [5, 1.977]
  - - [3584, 5888, 1, 3328]
    - [15, 96.759]
  - - [2368, 4288, 1, 256]
    - [6, 88.613]
  - - [1024, 2368, 1, 3328]
    - [15, 85.31]
  - - [64, 704, 1, 3328]
    - [20, 15.606]
  - - [704, 1408, 1, 256]
    - [7, 48.253]
  - - [6784, 1856, 1, 3328]
    - [11, 96.768]
  - - [1024, 2944, 1, 128]
    - [15, 58.552]
  - - [1024, 3584, 1, 1280]
    - [15, 85.193]
  - - [4288, 5888, 1, 3328]
    - [36, 95.979]
  - - [4288, 4, 1, 3328]
    - [28, 5.166]
  - - [256, 1408, 1, 256]
    - [14, 30.804]
  - - [448, 2944, 1, 1280]
    - [15, 84.817]
  - - [4, 5888, 1, 128]
    - [24, 1.359]
  - - [1024, 2944, 1, 3328]
    - [15, 91.047]
  - - [3584, 6784, 1, 256]
    - [6, 93.596]
  - - [256, 6784, 1, 1280]
    - [15, 86.364]
  - - [1856, 3584, 1, 256]
    - [15, 85.939]
  - - [128, 448, 1, 3328]
    - [23, 19.955]
  - - [6784, 1856, 1, 128]
    - [11, 81.793]
  - - [4, 448, 1, 256]
    - [24, 0.188]
  - - [2944, 704, 1, 128]
    - [15, 49.608]
  - - [256, 5888, 1, 1280]
    - [10, 75.873]
  - - [4, 128, 1, 1280]
    - [20, 0.139]
  - - [4288, 6784, 1, 3328]
    - [15, 96.492]
  - - [6784, 128, 1, 1280]
    - [15, 80.145]
  - - [64, 1408, 1, 256]
    - [24, 9.451]
  - - [7680, 5481, 1, 2560]
    - [11, 96.69]
  - - [2368, 1408, 1, 128]
    - [15, 61.058]
  - - [1856, 448, 1, 256]
    - [15, 49.448]
  - - [1408, 1024, 1, 128]
    - [15, 42.005]
  - - [128, 64, 1, 128]
    - [24, 0.525]
  - - [6784, 3584, 1, 3328]
    - [11, 97.266]
  - - [2944, 64, 1, 3328]
    - [10, 51.661]
  - - [64, 64, 1, 128]
    - [5, 0.257]
  - - [2368, 5056, 1, 1280]
    - [15, 94.543]
  - - [64, 4, 1, 1280]
    - [23, 0.069]
  - - [1408, 2368, 1, 1280]
    - [6, 86.324]
  - - [128, 1408, 1, 1280]
    - [19, 40.452]
  - - [256, 64, 1, 3328]
    - [118, 7.041]
  - - [2944, 4288, 1, 128]
    - [15, 81.273]
  - - [2944, 2944, 1, 256]
    - [15, 86.649]
  - - [2944, 4, 1, 1280]
    - [19, 3.074]
  - - [5888, 4, 1, 256]
    - [28, 2.303]
  - - [6784, 256, 1, 256]
    - [15, 65.692]
  - - [256, 5056, 1, 3328]
    - [26, 88.682]
  - - [128, 4288, 1, 1280]
    - [19, 58.741]
  - - [5056, 1856, 1, 128]
    - [15, 77.0]
  - - [5888, 1408, 1, 256]
    - [7, 86.792]
  - - [128, 128, 1, 256]
    - [24, 1.8]
  - - [5056, 4, 1, 3328]
    - [28, 6.054]
  - - [4288, 3584, 1, 3328]
    - [15, 94.596]
  - - [448, 704, 1, 3328]
    - [21, 60.105]
  - - [448, 448, 1, 128]
    - [24, 11.814]
  - - [1024, 2368, 1, 1280]
    - [7, 82.669]
  - - [1856, 704, 1, 3328]
    - [22, 89.647]
  - - [4, 2368, 1, 128]
    - [24, 0.594]
  - - [5888, 6784, 1, 3328]
    - [15, 96.842]
  - - [704, 4288, 1, 1280]
    - [7, 88.754]
  - - [704, 256, 1, 256]
    - [24, 18.081]
  - - [6784, 448, 1, 3328]
    - [15, 91.605]
  - - [4288, 1024, 1, 128]
    - [15, 65.449]
  - - [49, 512, 128, 2048]
    - [7, 66.919]
  - - [196, 256, 256, 1024]
    - [56, 74.76]
  - - [784, 512, 256, 128]
    - [15, 77.426]
  - - [49, 2048, 128, 512]
    - [6, 68.911]
  - - [784, 128, 128, 512]
    - [7, 86.789]
  - - [3136, 256, 256, 64]
    - [57, 55.853]
  - - [3136, 64, 128, 64]
    - [57, 43.612]
  - - [49, 2048, 256, 512]
    - [15, 70.484]
  - - [784, 128, 256, 512]
    - [6, 88.951]
  - - [196, 256, 128, 1024]
    - [58, 72.876]
  - - [3136, 64, 128, 256]
    - [57, 76.685]
  - - [3136, 256, 128, 64]
    - [57, 56.038]
  - - [784, 512, 128, 128]
    - [15, 76.665]
  - - [3136, 64, 256, 256]
    - [57, 77.802]
  - - [3136, 64, 256, 64]
    - [57, 44.131]
  - - [196, 1024, 128, 256]
    - [15, 71.47]
  - - [49, 512, 256, 2048]
    - [7, 70.88]
  - - [196, 1024, 256, 256]
    - [15, 72.733]
  - - [5329, 160, 64, 64]
    - [59, 38.285]
  - - [1225, 384, 64, 192]
    - [11, 83.626]
  - - [289, 1024, 64, 256]
    - [15, 78.799]
  - - [64, 1536, 64, 384]
    - [15, 81.373]
  - - [1225, 384, 64, 64]
    - [7, 41.847]
  - - [1225, 384, 64, 96]
    - [11, 56.827]
  - - [64, 1536, 64, 256]
    - [15, 72.512]
  - - [289, 1024, 64, 384]
    - [6, 83.337]
  - - [289, 1024, 64, 192]
    - [6, 70.639]
  - - [289, 1024, 64, 128]
    - [15, 60.395]
  - - [4096, 1024, 1, 2984]
    - [11, 88.867]
  - - [1024, 4096, 1, 3437]
    - [11, 88.923]
  - - [1024, 4096, 1, 3235]
    - [11, 89.099]
  - - [4096, 1024, 1, 4032]
    - [11, 89.642]
  - - [1024, 4096, 1, 3334]
    - [11, 89.238]
  - - [4096, 1024, 1, 3288]
    - [11, 89.028]
  - - [1024, 4096, 1, 3515]
    - [11, 89.135]
  - - [4096, 1024, 1, 3437]
    - [11, 88.862]
  - - [1024, 4096, 1, 3259]
    - [11, 88.815]
  - - [1024, 4096, 1, 3384]
    - [11, 89.088]
  - - [64, 92, 688, 92]
    - [7, 28.371]
  - - [4096, 1024, 1, 3458]
    - [11, 89.27]
  - - [1024, 4096, 1, 3412]
    - [11, 89.142]
  - - [1024, 4096, 1, 3529]
    - [11, 89.095]
  - - [1024, 4096, 1, 4032]
    - [11, 89.705]
  - - [4096, 1024, 1, 3999]
    - [11, 89.044]
  - - [1024, 4096, 1, 3079]
    - [11, 88.787]
  - - [1024, 4096, 1, 3876]
    - [11, 89.424]
  - - [1024, 4096, 1, 3450]
    - [11, 89.015]
  - - [1024, 4096, 1, 3256]
    - [11, 89.067]
  - - [4096, 1024, 1, 3403]
    - [11, 88.993]
  - - [1024, 1024, 1, 3975]
    - [10, 77.237]
  - - [1024, 4096, 1, 3359]
    - [11, 88.776]
  - - [4096, 1024, 1, 3549]
    - [11, 89.03]
  - - [4096, 1024, 1, 3176]
    - [11, 88.991]
  - - [1024, 4096, 1, 3504]
    - [11, 89.492]
  - - [4096, 1024, 1, 3314]
    - [11, 89.322]
  - - [4096, 1024, 1, 3183]
    - [11, 88.675]
  - - [1024, 4096, 1, 3209]
    - [11, 88.966]
  - - [1024, 4096, 1, 3720]
    - [11, 89.29]
  - - [1024, 4096, 1, 3859]
    - [11, 89.468]
  - - [1024, 33708, 1, 4059]
    - [6, 96.269]
  - - [64, 123, 528, 123]
    - [6, 37.463]
  - - [4096, 1024, 1, 3477]
    - [11, 89.164]
  - - [4096, 1024, 1, 3233]
    - [11, 89.018]
  - - [4096, 1024, 1, 3409]
    - [11, 89.137]
  - - [4096, 1024, 1, 3564]
    - [11, 89.087]
  - - [64, 102, 624, 100]
    - [7, 33.196]
  - - [4096, 1024, 1, 3190]
    - [11, 88.935]
  - - [64, 112, 576, 111]
    - [7, 33.914]
  - - [1024, 4096, 1, 3288]
    - [11, 89.028]
  - - [4096, 1024, 1, 3451]
    - [11, 88.992]
  - - [1024, 4096, 1, 3348]
    - [11, 89.234]
  - - [64, 102, 624, 102]
    - [7, 33.618]
  - - [1024, 4096, 1, 3465]
    - [11, 89.05]
  - - [1024, 33708, 1, 4032]
    - [15, 96.644]
  - - [1024, 33708, 1, 3840]
    - [15, 96.64]
  - - [4096, 1024, 1, 3391]
    - [11, 88.863]
  - - [1024, 4096, 1, 3530]
    - [11, 88.966]
  - - [4096, 1024, 1, 3209]
    - [11, 88.888]
  - - [1024, 4096, 1, 3457]
    - [11, 89.391]
  - - [1024, 4096, 1, 3386]
    - [11, 89.041]
  - - [4096, 1024, 1, 3350]
    - [11, 89.149]
  - - [1024, 4096, 1, 3184]
    - [11, 89.242]
  - - [1024, 4096, 1, 3093]
    - [11, 88.987]
  - - [64, 133, 480, 135]
    - [13, 36.555]
  - - [1024, 4096, 1, 3400]
    - [11, 89.211]
  - - [1024, 1024, 1, 4026]
    - [14, 76.714]
  - - [1024, 4096, 1, 3214]
    - [11, 88.883]
  - - [4096, 1024, 1, 3406]
    - [11, 88.911]
  - - [1024, 4096, 1, 3565]
    - [11, 88.971]
  - - [4096, 1024, 1, 3536]
    - [11, 89.535]
  - - [1024, 4096, 1, 3183]
    - [11, 88.57]
  - - [1024, 4096, 1, 3462]
    - [11, 89.191]
  - - [4096, 1024, 1, 3130]
    - [11, 88.848]
  - - [4096, 1024, 1, 3381]
    - [11, 89.195]
  - - [4096, 1024, 1, 3298]
    - [11, 89.107]
  - - [1024, 4096, 1, 3292]
    - [11, 88.907]
  - - [4096, 1024, 1, 3289]
    - [11, 88.864]
  - - [64, 160, 400, 159]
    - [60, 41.75]
  - - [1024, 4096, 1, 3379]
    - [11, 89.13]
  - - [1024, 4096, 1, 3990]
    - [11, 89.37]
  - - [1024, 4096, 1, 3540]
    - [11, 89.254]
  - - [4096, 1024, 1, 3412]
    - [11, 89.203]
  - - [1024, 1024, 1, 3780]
    - [14, 77.127]
  - - [1024, 4096, 1, 3555]
    - [11, 89.204]
  - - [1024, 4096, 1, 3518]
    - [11, 88.937]
  - - [4096, 1024, 1, 3189]
    - [11, 89.091]
  - - [1024, 4096, 1, 3298]
    - [11, 89.196]
  - - [4096, 1024, 1, 3072]
    - [11, 89.321]
  - - [1024, 4096, 1, 3393]
    - [11, 89.225]
  - - [1024, 4096, 1, 3207]
    - [11, 88.963]
  - - [64, 228, 272, 232]
    - [7, 49.11]
  - - [64, 23, 2720, 23]
    - [61, 7.92]
  - - [4096, 1024, 1, 3487]
    - [11, 88.734]
  - - [1024, 1024, 1, 3822]
    - [14, 76.986]
  - - [64, 77, 816, 77]
    - [13, 25.746]
  - - [4096, 1024, 1, 3431]
    - [11, 89.06]
  - - [4096, 1024, 1, 3378]
    - [11, 89.166]
  - - [4096, 1024, 1, 3529]
    - [11, 89.131]
  - - [4096, 1024, 1, 3460]
    - [11, 89.212]
  - - [1024, 4096, 1, 3336]
    - [11, 89.153]
  - - [1024, 4096, 1, 3501]
    - [11, 88.959]
  - - [64, 159, 400, 159]
    - [7, 40.064]
  - - [1024, 4096, 1, 3584]
    - [11, 89.599]
  - - [64, 135, 480, 134]
    - [7, 37.774]
  - - [64, 99, 624, 99]
    - [7, 32.545]
  - - [4096, 1024, 1, 2499]
    - [11, 88.491]
  - - [1024, 1024, 1, 3942]
    - [10, 77.167]
  - - [4096, 1024, 1, 3352]
    - [11, 89.101]
  - - [1024, 4096, 1, 3543]
    - [11, 89.27]
  - - [1024, 4096, 1, 3476]
    - [11, 89.272]
  - - [1024, 33708, 1, 3822]
    - [15, 96.186]
  - - [1024, 4096, 1, 3436]
    - [11, 88.969]
  - - [1024, 1024, 1, 3861]
    - [14, 76.372]
  - - [1024, 1024, 1, 4000]
    - [10, 78.335]
  - - [1024, 4096, 1, 3594]
    - [11, 89.071]
  - - [4096, 1024, 1, 3514]
    - [11, 89.086]
  - - [1024, 4096, 1, 3064]
    - [11, 88.924]
  - - [4096, 1024, 1, 3371]
    - [11, 88.956]
  - - [4096, 1024, 1, 3558]
    - [11, 89.232]
  - - [4096, 1024, 1, 3517]
    - [11, 88.911]
  - - [4096, 1024, 1, 3144]
    - [11, 88.911]
  - - [1024, 4096, 1, 3312]
    - [11, 89.383]
  - - [4096, 1024, 1, 3079]
    - [11, 88.746]
  - - [1024, 4096, 1, 3415]
    - [11, 89.024]
  - - [1024, 4096, 1, 3221]
    - [11, 89.012]
  - - [1024, 4096, 1, 3978]
    - [11, 89.228]
  - - [4096, 1024, 1, 3876]
    - [11, 89.413]
  - - [1024, 4096, 1, 3528]
    - [11, 89.213]
  - - [1024, 4096, 1, 3181]
    - [11, 88.802]
  - - [4096, 1024, 1, 3445]
    - [11, 89.081]
  - - [4096, 1024, 1, 3450]
    - [11, 89.088]
  - - [4096, 1024, 1, 3377]
    - [11, 89.289]
  - - [1024, 4096, 1, 3532]
    - [11, 89.088]
  - - [1024, 33708, 1, 3944]
    - [15, 96.385]
  - - [4096, 1024, 1, 3483]
    - [11, 88.956]
  - - [1024, 4096, 1, 3358]
    - [11, 88.824]
  - - [4096, 1024, 1, 3464]
    - [11, 89.06]
  - - [4096, 1024, 1, 3282]
    - [11, 89.21]
  - - [4096, 1024, 1, 3256]
    - [11, 89.054]
  - - [1024, 4096, 1, 3057]
    - [11, 89.145]
  - - [4096, 1024, 1, 3481]
    - [11, 89.073]
  - - [4096, 1024, 1, 3340]
    - [11, 88.995]
  - - [1024, 1024, 1, 3870]
    - [14, 76.711]
  - - [1024, 4096, 1, 3273]
    - [11, 88.966]
  - - [64, 65, 992, 65]
    - [13, 23.703]
  - - [4096, 1024, 1, 3392]
    - [11, 89.435]
  - - [4096, 1024, 1, 3337]
    - [11, 88.915]
  - - [4096, 1024, 1, 3359]
    - [11, 88.8]
  - - [4096, 1024, 1, 3498]
    - [11, 89.098]
  - - [4096, 1024, 1, 3169]
    - [11, 89.165]
  - - [1024, 33708, 1, 3859]
    - [6, 96.435]
  - - [64, 19, 3264, 19]
    - [62, 6.511]
  - - [1024, 4096, 1, 3103]
    - [57, 88.547]
  - - [4096, 1024, 1, 3900]
    - [11, 89.183]
  - - [1024, 4096, 1, 3442]
    - [11, 89.284]
  - - [1024, 4096, 1, 3248]
    - [11, 89.405]
  - - [1024, 4096, 1, 3351]
    - [11, 89.175]
  - - [4096, 1024, 1, 3593]
    - [11, 89.14]
  - - [1024, 4096, 1, 3780]
    - [11, 89.38]
  - - [64, 133, 480, 133]
    - [7, 36.551]
  - - [1024, 33708, 1, 3681]
    - [15, 96.404]
  - - [4096, 1024, 1, 3374]
    - [11, 88.948]
  - - [1024, 4096, 1, 3557]
    - [15, 89.183]
  - - [4096, 1024, 1, 3906]
    - [11, 89.537]
  - - [4096, 1024, 1, 3504]
    - [11, 89.48]
  - - [1024, 4096, 1, 3270]
    - [11, 89.166]
  - - [4096, 1024, 1, 3098]
    - [11, 88.807]
  - - [64, 232, 272, 232]
    - [7, 49.677]
  - - [4096, 1024, 1, 3216]
    - [11, 89.488]
  - - [64, 148, 432, 148]
    - [7, 41.041]
  - - [1024, 4096, 1, 3550]
    - [11, 88.972]
  - - [4096, 1024, 1, 3449]
    - [11, 89.123]
  - - [1024, 4096, 1, 3403]
    - [11, 89.079]
  - - [1024, 4096, 1, 3523]
    - [11, 89.338]
  - - [1024, 4096, 1, 3486]
    - [11, 89.033]
  - - [1024, 4096, 1, 3564]
    - [11, 89.169]
  - - [1024, 33708, 1, 4005]
    - [15, 96.381]
  - - [4096, 1024, 1, 3296]
    - [11, 89.308]
  - - [1024, 4096, 1, 3263]
    - [11, 88.77]
  - - [64, 25, 2512, 25]
    - [61, 8.949]
  - - [1024, 4096, 1, 3130]
    - [11, 88.848]
  - - [1024, 4096, 1, 3295]
    - [11, 88.76]
  - - [1024, 33708, 1, 3925]
    - [6, 96.357]
  - - [1024, 4096, 1, 3378]
    - [11, 89.228]
  - - [4096, 1024, 1, 3720]
    - [11, 89.199]
  - - [4096, 1024, 1, 3399]
    - [11, 89.11]
  - - [4096, 1024, 1, 3543]
    - [11, 89.175]
  - - [64, 9, 6544, 9]
    - [61, 2.745]
  - - [4096, 1024, 1, 3497]
    - [11, 89.133]
  - - [4096, 1024, 1, 3594]
    - [11, 89.176]
  - - [1024, 4096, 1, 3144]
    - [11, 88.991]
  - - [1024, 4096, 1, 3975]
    - [11, 89.331]
  - - [4096, 1024, 1, 3205]
    - [11, 88.881]
  - - [1024, 33708, 1, 3995]
    - [6, 96.266]
  - - [1024, 4096, 1, 3392]
    - [11, 89.435]
  - - [1024, 4096, 1, 3055]
    - [11, 88.649]
  - - [1024, 4096, 1, 4026]
    - [11, 89.288]
  - - [4096, 1024, 1, 3557]
    - [11, 89.148]
  - - [4096, 1024, 1, 3515]
    - [11, 89.028]
  - - [4096, 1024, 1, 3486]
    - [11, 88.888]
  - - [4096, 1024, 1, 3457]
    - [11, 89.208]
  - - [1024, 4096, 1, 3511]
    - [11, 89.105]
  - - [4096, 1024, 1, 3138]
    - [11, 89.128]
  - - [1024, 4096, 1, 3339]
    - [11, 88.944]
  - - [1024, 4096, 1, 3939]
    - [11, 89.436]
  - - [4096, 1024, 1, 3500]
    - [11, 88.993]
  - - [4096, 1024, 1, 3395]
    - [11, 89.079]
  - - [4096, 1024, 1, 4020]
    - [11, 89.449]
  - - [4096, 1024, 1, 3942]
    - [11, 89.258]
  - - [1024, 1024, 1, 4032]
    - [14, 78.345]
  - - [4096, 1024, 1, 3349]
    - [11, 89.185]
  - - [1024, 4096, 1, 3322]
    - [11, 89.068]
  - - [4096, 1024, 1, 3452]
    - [11, 89.042]
  - - [1024, 4096, 1, 3417]
    - [11, 89.051]
  - - [1024, 1024, 1, 4012]
    - [14, 77.163]
  - - [1024, 4096, 1, 3526]
    - [11, 89.198]
  - - [4096, 1024, 1, 3485]
    - [11, 88.899]
  - - [1024, 1024, 1, 3681]
    - [10, 77.036]
  - - [4096, 1024, 1, 3303]
    - [11, 89.09]
  - - [4096, 1024, 1, 3344]
    - [11, 89.506]
  - - [1024, 4096, 1, 3479]
    - [11, 89.179]
  - - [4096, 1024, 1, 3300]
    - [11, 89.059]
  - - [1024, 4096, 1, 3439]
    - [11, 88.828]
  - - [4096, 1024, 1, 3280]
    - [11, 89.439]
  - - [1024, 4096, 1, 3245]
    - [11, 88.754]
  - - [1024, 4096, 1, 3328]
    - [11, 89.47]
  - - [4096, 1024, 1, 3418]
    - [11, 89.003]
  - - [1024, 4096, 1, 3493]
    - [11, 89.223]
  - - [1024, 4096, 1, 3500]
    - [11, 89.041]
  - - [1024, 4096, 1, 3166]
    - [11, 88.711]
  - - [4096, 1024, 1, 3126]
    - [11, 88.988]
  - - [1024, 4096, 1, 3277]
    - [11, 88.768]
  - - [1024, 4096, 1, 3315]
    - [11, 89.298]
  - - [1024, 1024, 1, 3927]
    - [14, 76.873]
  - - [1024, 4096, 1, 3414]
    - [11, 89.108]
  - - [4096, 1024, 1, 3531]
    - [11, 89.015]
  - - [4096, 1024, 1, 3484]
    - [11, 88.945]
  - - [1024, 4096, 1, 3180]
    - [11, 88.826]
  - - [4096, 1024, 1, 3360]
    - [11, 89.415]
  - - [1024, 33708, 1, 3990]
    - [7, 96.405]
  - - [4096, 1024, 1, 3466]
    - [11, 89.039]
  - - [1024, 4096, 1, 3428]
    - [11, 89.325]
  - - [1024, 4096, 1, 3137]
    - [11, 89.221]
  - - [4096, 1024, 1, 4059]
    - [11, 89.328]
  - - [1024, 4096, 1, 3353]
    - [11, 88.966]
  - - [1024, 4096, 1, 3942]
    - [11, 89.397]
  - - [4096, 1024, 1, 3506]
    - [11, 89.302]
  - - [1024, 1024, 1, 3894]
    - [14, 76.576]
  - - [4096, 1024, 1, 3508]
    - [11, 89.185]
  - - [64, 132, 480, 135]
    - [6, 35.963]
  - - [4096, 1024, 1, 3956]
    - [11, 89.586]
  - - [64, 7, 8192, 7]
    - [63, 1.952]
  - - [1024, 4096, 1, 3272]
    - [11, 89.157]
  - - [1024, 4096, 1, 3443]
    - [11, 89.31]
  - - [1024, 4096, 1, 3375]
    - [11, 88.875]
  - - [1024, 4096, 1, 3525]
    - [11, 89.329]
  - - [4096, 1024, 1, 3472]
    - [11, 89.485]
  - - [1024, 4096, 1, 3520]
    - [11, 89.562]
  - - [4096, 1024, 1, 3322]
    - [11, 88.892]
  - - [4096, 1024, 1, 3387]
    - [11, 89.043]
  - - [64, 8, 7280, 8]
    - [63, 2.285]
  - - [1024, 33708, 1, 3939]
    - [15, 96.487]
  - - [4096, 1024, 1, 3345]
    - [11, 89.254]
  - - [4096, 1024, 1, 2967]
    - [11, 88.767]
  - - [1024, 4096, 1, 3453]
    - [11, 88.91]
  - - [1024, 4096, 1, 3640]
    - [11, 89.24]
  - - [4096, 1024, 1, 3291]
    - [11, 88.893]
  - - [1024, 4096, 1, 3350]
    - [11, 89.136]
  - - [4096, 1024, 1, 3417]
    - [11, 89.002]
  - - [64, 135, 480, 135]
    - [7, 36.78]
  - - [1024, 4096, 1, 3467]
    - [11, 88.956]
  - - [1024, 4096, 1, 3491]
    - [11, 89.209]
  - - [1024, 4096, 1, 3822]
    - [11, 89.08]
  - - [4096, 1024, 1, 3292]
    - [11, 88.78]
  - - [1024, 4096, 1, 3231]
    - [11, 88.743]
  - - [1024, 4096, 1, 3364]
    - [11, 89.22]
  - - [1024, 4096, 1, 3995]
    - [11, 89.25]
  - - [1024, 4096, 1, 3545]
    - [11, 89.095]
  - - [1024, 1024, 1, 3876]
    - [14, 76.894]
  - - [1024, 4096, 1, 3186]
    - [11, 89.086]
  - - [4096, 1024, 1, 3432]
    - [11, 89.098]
  - - [64, 84, 752, 85]
    - [7, 28.106]
  - - [4096, 1024, 1, 3367]
    - [11, 89.062]
  - - [4096, 1024, 1, 3503]
    - [11, 88.831]
  - - [1024, 4096, 1, 3095]
    - [11, 88.936]
  - - [4096, 1024, 1, 3465]
    - [11, 89.171]
  - - [1024, 4096, 1, 3402]
    - [11, 89.016]
  - - [4096, 1024, 1, 3140]
    - [11, 89.118]
  - - [1024, 1024, 1, 4050]
    - [14, 76.462]
  - - [4096, 1024, 1, 3424]
    - [11, 89.542]
  - - [4096, 1024, 1, 3257]
    - [11, 89.043]
  - - [4096, 1024, 1, 2917]
    - [11, 88.903]
  - - [1024, 33708, 1, 3640]
    - [6, 96.335]
  - - [1024, 4096, 1, 3456]
    - [11, 89.463]
  - - [1024, 4096, 1, 3014]
    - [11, 88.962]
  - - [4096, 1024, 1, 3372]
    - [11, 88.995]
  - - [64, 132, 480, 132]
    - [7, 37.169]
  - - [1024, 4096, 1, 3294]
    - [11, 88.745]
  - - [4096, 1024, 1, 3446]
    - [11, 89.167]
  - - [1024, 4096, 1, 3389]
    - [11, 88.897]
  - - [4096, 1024, 1, 3259]
    - [11, 88.905]
  - - [4096, 1024, 1, 3544]
    - [11, 89.165]
  - - [4096, 1024, 1, 3479]
    - [11, 89.034]
  - - [4096, 1024, 1, 3542]
    - [11, 89.209]
  - - [4096, 1024, 1, 3321]
    - [11, 89.041]
  - - [1024, 4096, 1, 3147]
    - [11, 88.916]
  - - [1024, 4096, 1, 3944]
    - [11, 89.335]
  - - [4096, 1024, 1, 3870]
    - [11, 89.111]
  - - [1024, 4096, 1, 3308]
    - [11, 89.059]
  - - [4096, 1024, 1, 3401]
    - [11, 89.088]
  - - [1024, 4096, 1, 3395]
    - [11, 89.278]
  - - [64, 99, 624, 102]
    - [7, 32.864]
  - - [1024, 4096, 1, 3563]
    - [11, 89.085]
  - - [1024, 33708, 1, 3870]
    - [6, 96.069]
  - - [4096, 1024, 1, 3494]
    - [11, 89.189]
  - - [1024, 4096, 1, 3271]
    - [11, 88.937]
  - - [1024, 33708, 1, 3910]
    - [15, 96.411]
  - - [1024, 4096, 1, 3287]
    - [11, 89.077]
  - - [1024, 33708, 1, 3860]
    - [6, 96.421]
  - - [64, 143, 432, 148]
    - [7, 40.57]
  - - [1024, 1024, 1, 3584]
    - [10, 77.904]
  - - [64, 162, 400, 162]
    - [7, 43.008]
  - - [4096, 1024, 1, 3341]
    - [11, 88.859]
  - - [1024, 4096, 1, 3136]
    - [11, 89.327]
  - - [4096, 1024, 1, 3439]
    - [11, 88.865]
  - - [64, 148, 432, 147]
    - [6, 40.948]
  - - [1024, 4096, 1, 3751]
    - [11, 89.342]
  - - [1024, 4096, 1, 3301]
    - [11, 89.188]
  - - [4096, 1024, 1, 3468]
    - [11, 89.018]
  - - [1024, 4096, 1, 3416]
    - [11, 89.148]
  - - [4096, 1024, 1, 3163]
    - [11, 88.851]
  - - [1024, 4096, 1, 3230]
    - [11, 88.935]
  - - [1024, 4096, 1, 3581]
    - [11, 89.087]
  - - [1024, 1024, 1, 3960]
    - [14, 76.693]
  - - [4096, 1024, 1, 3463]
    - [11, 89.095]
  - - [1024, 4096, 1, 3478]
    - [11, 89.226]
  - - [4096, 1024, 1, 3262]
    - [11, 88.743]
  - - [1024, 4096, 1, 3438]
    - [11, 88.79]
  - - [1024, 4096, 1, 3244]
    - [11, 88.842]
  - - [1024, 4096, 1, 3445]
    - [11, 89.203]
  - - [4096, 1024, 1, 3328]
    - [11, 89.508]
  - - [1024, 4096, 1, 3492]
    - [11, 89.367]
  - - [4096, 1024, 1, 3211]
    - [11, 88.839]
  - - [1024, 4096, 1, 3910]
    - [11, 89.325]
  - - [1024, 4096, 1, 3314]
    - [11, 89.246]
  - - [4096, 1024, 1, 3859]
    - [11, 89.424]
  - - [4096, 1024, 1, 3383]
    - [11, 88.999]
  - - [1024, 4096, 1, 3409]
    - [11, 89.211]
  - - [1024, 4096, 1, 4020]
    - [11, 89.565]
  - - [4096, 1024, 1, 3530]
    - [11, 89.109]
  - - [4096, 1024, 1, 3411]
    - [11, 89.239]
  - - [1024, 4096, 1, 3566]
    - [11, 88.972]
  - - [4096, 1024, 1, 3493]
    - [11, 89.175]
  - - [4096, 1024, 1, 3184]
    - [11, 89.308]
  - - [1024, 4096, 1, 3072]
    - [11, 89.389]
  - - [1024, 4096, 1, 3431]
    - [11, 89.17]
  - - [4096, 1024, 1, 3306]
    - [11, 88.879]
  - - [1024, 4096, 1, 3352]
    - [11, 89.101]
  - - [4096, 1024, 1, 3295]
    - [11, 88.633]
  - - [64, 123, 528, 122]
    - [7, 37.219]
  - - [1024, 4096, 1, 3517]
    - [11, 89.019]
  - - [64, 102, 624, 101]
    - [7, 33.896]
  - - [4096, 1024, 1, 3426]
    - [11, 89.236]
  - - [4096, 1024, 1, 3385]
    - [11, 89.101]
  - - [1024, 1024, 1, 3978]
    - [14, 77.2]
  - - [4096, 1024, 1, 3572]
    - [11, 89.322]
  - - [4096, 1024, 1, 3459]
    - [11, 89.247]
  - - [1024, 4096, 1, 3374]
    - [11, 88.886]
  - - [4096, 1024, 1, 3166]
    - [11, 88.724]
  - - [4096, 1024, 1, 3093]
    - [11, 89.109]
  - - [4096, 1024, 1, 3523]
    - [11, 89.242]
  - - [4096, 1024, 1, 3413]
    - [11, 89.291]
  - - [1024, 4096, 1, 3996]
    - [11, 89.177]
  - - [1024, 4096, 1, 3452]
    - [11, 88.994]
  - - [4096, 1024, 1, 3232]
    - [11, 89.303]
  - - [4096, 1024, 1, 3400]
    - [11, 89.161]
  - - [4096, 1024, 1, 3334]
    - [11, 89.188]
  - - [1024, 4096, 1, 3345]
    - [11, 89.154]
  - - [1024, 4096, 1, 3538]
    - [11, 89.406]
  - - [1024, 4096, 1, 3466]
    - [11, 89.16]
  - - [4096, 1024, 1, 3315]
    - [11, 89.171]
  - - [4096, 1024, 1, 3214]
    - [11, 88.766]
  - - [1024, 33708, 1, 3900]
    - [6, 96.237]
  - - [64, 160, 400, 160]
    - [6, 45.79]
  - - [1024, 4096, 1, 3367]
    - [11, 89.124]
  - - [1024, 4096, 1, 2917]
    - [11, 88.831]
  - - [1024, 1024, 1, 3995]
    - [14, 76.524]
  - - [64, 132, 480, 134]
    - [7, 36.824]
  - - [1024, 4096, 1, 3544]
    - [11, 89.212]
  - - [4096, 1024, 1, 3414]
    - [11, 89.132]
  - - [4096, 1024, 1, 3565]
    - [11, 88.982]
  - - [1024, 4096, 1, 3512]
    - [11, 89.262]
  - - [1024, 4096, 1, 3191]
    - [11, 89.042]
  - - [64, 27, 2336, 27]
    - [61, 10.34]
  - - [1024, 4096, 1, 3289]
    - [11, 89.093]
  - - [4096, 1024, 1, 3290]
    - [11, 88.866]
  - - [1024, 4096, 1, 3211]
    - [11, 88.813]
  - - [1024, 33708, 1, 3969]
    - [15, 96.432]
  - - [4096, 1024, 1, 3566]
    - [11, 88.89]
  - - [64, 111, 576, 111]
    - [7, 33.945]
  - - [1024, 4096, 1, 3459]
    - [11, 89.333]
  - - [1024, 4096, 1, 3372]
    - [11, 88.834]
  - - [4096, 1024, 1, 3339]
    - [11, 88.869]
  - - [4096, 1024, 1, 3425]
    - [11, 89.284]
  - - [4096, 1024, 1, 3388]
    - [11, 88.97]
  - - [1024, 4096, 1, 3531]
    - [11, 89.003]
  - - [4096, 1024, 1, 3286]
    - [11, 89.101]
  - - [4096, 1024, 1, 3462]
    - [11, 89.227]
  - - [1024, 4096, 1, 3388]
    - [11, 88.92]
  - - [4096, 1024, 1, 3165]
    - [11, 88.617]
  - - [4096, 1024, 1, 3304]
    - [11, 89.116]
  - - [1024, 4096, 1, 2736]
    - [11, 89.181]
  - - [4096, 1024, 1, 3397]
    - [11, 89.181]
  - - [64, 38, 1680, 38]
    - [7, 15.047]
  - - [1024, 4096, 1, 3311]
    - [11, 88.798]
  - - [1024, 4096, 1, 3394]
    - [11, 89.202]
  - - [4096, 1024, 1, 2736]
    - [11, 89.105]
  - - [1024, 4096, 1, 3559]
    - [11, 89.233]
  - - [4096, 1024, 1, 3180]
    - [11, 88.8]
  - - [1024, 4096, 1, 3480]
    - [11, 89.156]
  - - [4096, 1024, 1, 3318]
    - [11, 89.062]
  - - [4096, 1024, 1, 3213]
    - [11, 88.674]
  - - [1024, 4096, 1, 3286]
    - [11, 89.063]
  - - [4096, 1024, 1, 3471]
    - [11, 88.842]
  - - [1024, 4096, 1, 3381]
    - [11, 89.145]
  - - [64, 100, 624, 100]
    - [7, 32.723]
  - - [4096, 1024, 1, 3502]
    - [11, 88.972]
  - - [64, 16, 3840, 16]
    - [61, 8.195]
  - - [1024, 4096, 1, 3552]
    - [11, 89.604]
  - - [4096, 1024, 1, 3519]
    - [11, 88.843]
  - - [1024, 4096, 1, 3300]
    - [11, 89.25]
  - - [1024, 4096, 1, 3419]
    - [11, 88.944]
  - - [4096, 1024, 1, 4030]
    - [11, 89.251]
  - - [4096, 1024, 1, 3976]
    - [11, 89.311]
  - - [1024, 4096, 1, 3473]
    - [11, 89.292]
  - - [1024, 1024, 1, 3977]
    - [14, 77.086]
  - - [4096, 1024, 1, 3428]
    - [11, 89.202]
  - - [1024, 4096, 1, 3433]
    - [11, 89.124]
  - - [4096, 1024, 1, 3534]
    - [11, 89.055]
  - - [4096, 1024, 1, 3461]
    - [11, 89.177]
  - - [4096, 1024, 1, 3681]
    - [11, 89.353]
  - - [4096, 1024, 1, 3495]
    - [11, 89.166]
  - - [4096, 1024, 1, 3351]
    - [11, 89.125]
  - - [1024, 4096, 1, 4059]
    - [11, 89.276]
  - - [4096, 1024, 1, 3990]
    - [11, 89.402]
  - - [1024, 4096, 1, 3325]
    - [11, 88.821]
  - - [1024, 4096, 1, 3408]
    - [11, 89.483]
  - - [64, 59, 1088, 59]
    - [7, 23.542]
  - - [4096, 1024, 1, 3394]
    - [11, 89.251]
  - - [1024, 4096, 1, 3573]
    - [11, 89.217]
  - - [4096, 1024, 1, 3386]
    - [11, 89.029]
  - - [4096, 1024, 1, 3540]
    - [11, 89.325]
  - - [1024, 4096, 1, 3182]
    - [11, 88.751]
  - - [1024, 4096, 1, 3430]
    - [11, 89.193]
  - - [1024, 4096, 1, 3236]
    - [11, 89.243]
  - - [4096, 1024, 1, 2977]
    - [11, 89.052]
  - - [1024, 4096, 1, 3355]
    - [11, 89.006]
  - - [4096, 1024, 1, 3139]
    - [11, 89.211]
  - - [4096, 1024, 1, 3516]
    - [11, 89.053]
  - - [4096, 1024, 1, 3368]
    - [11, 89.138]
  - - [4096, 1024, 1, 3559]
    - [11, 89.21]
  - - [64, 11, 5456, 11]
    - [61, 3.91]
  - - [1024, 4096, 1, 3506]
    - [11, 89.29]
  - - [1024, 4096, 1, 3145]
    - [11, 88.873]
  - - [1024, 4096, 1, 3369]
    - [11, 89.052]
  - - [64, 112, 576, 112]
    - [7, 38.521]
  - - [4096, 1024, 1, 3522]
    - [11, 89.324]
  - - [1024, 33708, 1, 3894]
    - [6, 96.362]
  - - [64, 159, 400, 162]
    - [7, 43.319]
  - - [4096, 1024, 1, 3336]
    - [11, 89.077]
  - - [1024, 4096, 1, 3382]
    - [11, 89.234]
  - - [4096, 1024, 1, 3533]
    - [11, 88.971]
  - - [4096, 1024, 1, 4050]
    - [11, 89.61]
  - - [4096, 1024, 1, 3480]
    - [11, 89.205]
  - - [1024, 4096, 1, 3344]
    - [11, 89.468]
  - - [64, 122, 528, 122]
    - [7, 36.736]
  - - [1024, 4096, 1, 3509]
    - [11, 89.222]
  - - [1024, 4096, 1, 3956]
    - [11, 89.457]
  - - [4096, 1024, 1, 3616]
    - [11, 89.604]
  - - [1024, 4096, 1, 3366]
    - [11, 89.21]
  - - [4096, 1024, 1, 2935]
    - [11, 88.935]
  - - [4096, 1024, 1, 3393]
    - [11, 89.25]
  - - [4096, 1024, 1, 3547]
    - [11, 89.074]
  - - [1024, 4096, 1, 3499]
    - [11, 88.932]
  - - [4096, 1024, 1, 3357]
    - [11, 88.872]
  - - [4096, 1024, 1, 3272]
    - [11, 89.028]
  - - [4096, 1024, 1, 3207]
    - [11, 88.989]
  - - [4096, 1024, 1, 3894]
    - [11, 89.424]
  - - [1024, 4096, 1, 3444]
    - [11, 89.299]
  - - [4096, 1024, 1, 3561]
    - [11, 89.2]
  - - [4096, 1024, 1, 3376]
    - [11, 89.475]
  - - [1024, 4096, 1, 3458]
    - [11, 89.234]
  - - [4096, 1024, 1, 3231]
    - [11, 88.704]
  - - [64, 228, 272, 228]
    - [64, 49.613]
  - - [1024, 4096, 1, 3505]
    - [11, 89.385]
  - - [4096, 1024, 1, 3277]
    - [11, 88.806]
  - - [64, 21, 2976, 21]
    - [62, 7.115]
  - - [1024, 4096, 1, 3391]
    - [11, 88.741]
  - - [64, 32, 1984, 32]
    - [60, 16.414]
  - - [1024, 4096, 1, 3536]
    - [11, 89.499]
  - - [1024, 4096, 1, 3063]
    - [11, 88.827]
  - - [1024, 1024, 1, 3925]
    - [14, 76.771]
  - - [1024, 4096, 1, 3189]
    - [11, 89.012]
  - - [1024, 4096, 1, 2505]
    - [11, 88.438]
  - - [4096, 1024, 1, 3454]
    - [11, 88.924]
  - - [1024, 4096, 1, 3405]
    - [11, 88.947]
  - - [1024, 33708, 1, 4050]
    - [7, 96.429]
  - - [4096, 1024, 1, 3520]
    - [11, 89.538]
  - - [64, 93, 688, 93]
    - [9, 28.652]
  - - [1024, 4096, 1, 3487]
    - [11, 88.902]
  - - [1024, 4096, 1, 3558]
    - [11, 89.149]
  - - [4096, 1024, 1, 3297]
    - [11, 89.195]
  - - [1024, 4096, 1, 3483]
    - [11, 88.992]
  - - [1024, 1024, 1, 3956]
    - [14, 76.963]
  - - [1024, 33708, 1, 3751]
    - [15, 96.29]
  - - [4096, 1024, 1, 3380]
    - [11, 89.119]
  - - [1024, 4096, 1, 3380]
    - [11, 89.206]
  - - [1024, 4096, 1, 3396]
    - [11, 89.18]
  - - [1024, 4096, 1, 3497]
    - [11, 89.073]
  - - [1024, 4096, 1, 3502]
    - [11, 88.948]
  - - [1024, 1024, 1, 3976]
    - [10, 77.066]
  - - [1024, 4096, 1, 3138]
    - [11, 89.263]
  - - [4096, 1024, 1, 3939]
    - [11, 89.383]
  - - [1024, 4096, 1, 3303]
    - [11, 89.064]
  - - [64, 111, 576, 112]
    - [7, 38.036]
  - - [1024, 4096, 1, 3418]
    - [11, 89.04]
  - - [1024, 4096, 1, 3224]
    - [11, 88.938]
  - - [4096, 1024, 1, 3978]
    - [11, 89.271]
  - - [1024, 4096, 1, 3472]
    - [11, 89.461]
  - - [4096, 1024, 1, 3353]
    - [11, 89.015]
  - - [4096, 1024, 1, 3362]
    - [11, 89.092]
  - - [1024, 33708, 1, 3978]
    - [15, 96.376]
  - - [64, 100, 624, 102]
    - [7, 32.665]
  - - [1024, 4096, 1, 3432]
    - [11, 89.196]
  - - [1024, 4096, 1, 3139]
    - [11, 89.117]
  - - [1024, 4096, 1, 3341]
    - [11, 88.959]
  - - [1024, 4096, 1, 3494]
    - [11, 89.249]
  - - [1024, 4096, 1, 3969]
    - [11, 89.462]
  - - [1024, 4096, 1, 3163]
    - [11, 88.851]
  - - [1024, 1024, 1, 3955]
    - [14, 76.817]
  - - [4096, 1024, 1, 3405]
    - [11, 88.861]
  - - [1024, 1024, 1, 4030]
    - [49, 76.176]
  - - [4096, 1024, 1, 3453]
    - [11, 88.898]
  - - [1024, 4096, 1, 3411]
    - [11, 89.239]
  - - [1024, 4096, 1, 3527]
    - [11, 89.128]
  - - [4096, 1024, 1, 3474]
    - [11, 89.317]
  - - [1024, 4096, 1, 3572]
    - [11, 89.275]
  - - [4096, 1024, 1, 3293]
    - [11, 88.794]
  - - [4096, 1024, 1, 3247]
    - [11, 88.68]
  - - [64, 15, 4096, 15]
    - [61, 6.467]
  - - [1024, 4096, 1, 3425]
    - [11, 89.235]
  - - [1024, 4096, 1, 3354]
    - [11, 89.029]
  - - [4096, 1024, 1, 3382]
    - [11, 89.06]
  - - [4096, 1024, 1, 3236]
    - [11, 89.074]
  - - [1024, 4096, 1, 3519]
    - [11, 88.855]
  - - [4096, 1024, 1, 3354]
    - [11, 89.079]
  - - [4096, 1024, 1, 3501]
    - [11, 88.899]
  - - [1024, 1024, 1, 3906]
    - [14, 77.069]
  - - [4096, 1024, 1, 3266]
    - [11, 89.225]
  - - [64, 101, 624, 102]
    - [7, 33.408]
  - - [1024, 4096, 1, 3368]
    - [11, 89.138]
  - - [1024, 4096, 1, 4030]
    - [11, 89.22]
  - - [1024, 4096, 1, 3533]
    - [11, 88.935]
  - - [4096, 1024, 1, 3332]
    - [11, 89.159]
  - - [4096, 1024, 1, 3584]
    - [11, 89.468]
  - - [1024, 4096, 1, 3616]
    - [11, 89.593]
  - - [4096, 1024, 1, 3265]
    - [11, 89.159]
  - - [4096, 1024, 1, 3361]
    - [11, 89.165]
  - - [4096, 1024, 1, 3467]
    - [11, 89.004]
  - - [1024, 4096, 1, 3454]
    - [11, 88.973]
  - - [1024, 4096, 1, 3101]
    - [11, 88.691]
  - - [1024, 4096, 1, 3508]
    - [11, 89.269]
  - - [4096, 1024, 1, 3267]
    - [11, 89.175]
  - - [64, 54, 1184, 54]
    - [7, 22.031]
  - - [4096, 1024, 1, 3419]
    - [11, 88.968]
  - - [4096, 1024, 1, 3822]
    - [11, 89.146]
  - - [1024, 4096, 1, 3266]
    - [11, 89.237]
  - - [4096, 1024, 1, 3440]
    - [11, 89.416]
  - - [1024, 4096, 1, 3361]
    - [11, 89.29]
  - - [1024, 4096, 1, 3546]
    - [11, 89.156]
  - - [4096, 1024, 1, 3473]
    - [11, 89.207]
  - - [4096, 1024, 1, 3546]
    - [11, 89.096]
  - - [1024, 4096, 1, 3088]
    - [11, 89.155]
  - - [1024, 4096, 1, 3535]
    - [11, 88.902]
  - - [1024, 4096, 1, 3447]
    - [11, 89.193]
  - - [1024, 4096, 1, 3560]
    - [11, 89.187]
  - - [1024, 4096, 1, 3422]
    - [11, 88.924]
  - - [1024, 4096, 1, 3469]
    - [11, 89.019]
  - - [4096, 1024, 1, 3488]
    - [11, 89.446]
  - - [1024, 4096, 1, 3110]
    - [11, 89.096]
  - - [1024, 4096, 1, 3265]
    - [11, 89.223]
  - - [1024, 4096, 1, 3291]
    - [11, 88.944]
  - - [1024, 4096, 1, 3390]
    - [11, 88.887]
  - - [4096, 1024, 1, 3046]
    - [11, 88.989]
  - - [1024, 4096, 1, 3539]
    - [11, 89.312]
  - - [4096, 1024, 1, 3221]
    - [11, 89.194]
  - - [4096, 1024, 1, 3433]
    - [11, 89.124]
  - - [4096, 1024, 1, 3364]
    - [11, 89.12]
  - - [4096, 1024, 1, 3470]
    - [11, 88.816]
  - - [1024, 4096, 1, 3404]
    - [11, 89.019]
  - - [1024, 33708, 1, 3968]
    - [15, 96.539]
  - - [4096, 1024, 1, 3088]
    - [11, 89.333]
  - - [1024, 4096, 1, 3247]
    - [11, 88.641]
  - - [1024, 33708, 1, 3996]
    - [6, 96.33]
  - - [4096, 1024, 1, 3482]
    - [11, 89.015]
  - - [1024, 1024, 1, 3796]
    - [14, 76.757]
  - - [4096, 1024, 1, 3995]
    - [11, 89.271]
  - - [1024, 1024, 1, 3859]
    - [14, 76.815]
  - - [1024, 4096, 1, 3280]
    - [11, 89.503]
  - - [4096, 1024, 1, 3271]
    - [11, 89.078]
  - - [64, 10, 5952, 10]
    - [61, 3.321]
  - - [4096, 1024, 1, 3545]
    - [11, 89.13]
  - - [4096, 1024, 1, 3476]
    - [11, 89.333]
  - - [4096, 1024, 1, 3496]
    - [11, 89.143]
  - - [4096, 1024, 1, 3191]
    - [11, 89.029]
  - - [4096, 1024, 1, 3311]
    - [11, 88.736]
  - - [1024, 4096, 1, 3302]
    - [11, 89.101]
  - - [1024, 4096, 1, 3681]
    - [11, 89.341]
  - - [4096, 1024, 1, 3582]
    - [11, 88.937]
  - - [4096, 1024, 1, 3421]
    - [11, 88.898]
  - - [4096, 1024, 1, 3560]
    - [11, 89.199]
  - - [1024, 4096, 1, 3495]
    - [11, 89.13]
  - - [4096, 1024, 1, 3186]
    - [11, 89.179]
  - - [4096, 1024, 1, 3925]
    - [11, 89.376]
  - - [64, 71, 896, 71]
    - [13, 25.394]
  - - [1024, 4096, 1, 3435]
    - [11, 89.066]
  - - [4096, 1024, 1, 3434]
    - [11, 89.174]
  - - [1024, 33708, 1, 4012]
    - [6, 96.31]
  - - [1024, 4096, 1, 3340]
    - [11, 88.883]
  - - [1024, 1024, 1, 3860]
    - [14, 76.964]
  - - [4096, 1024, 1, 3489]
    - [11, 89.23]
  - - [1024, 4096, 1, 3162]
    - [11, 88.968]
  - - [4096, 1024, 1, 3436]
    - [11, 88.994]
  - - [1024, 1024, 1, 4005]
    - [10, 77.438]
  - - [64, 84, 752, 84]
    - [7, 28.289]
  - - [4096, 1024, 1, 3574]
    - [11, 89.325]
  - - [4096, 1024, 1, 3469]
    - [11, 88.923]
  - - [1024, 4096, 1, 3410]
    - [11, 89.139]
  - - [1024, 4096, 1, 3216]
    - [11, 89.396]
  - - [4096, 1024, 1, 3095]
    - [11, 88.774]
  - - [1024, 1024, 1, 3990]
    - [14, 76.708]
  - - [4096, 1024, 1, 3448]
    - [11, 89.158]
  - - [1024, 4096, 1, 3176]
    - [11, 89.03]
  - - [64, 49, 1296, 49]
    - [7, 20.444]
  - - [4096, 1024, 1, 2918]
    - [11, 88.876]
  - - [64, 14, 4368, 14]
    - [61, 5.824]
  - - [1024, 4096, 1, 3424]
    - [11, 89.517]
  - - [4096, 1024, 1, 3402]
    - [11, 89.127]
  - - [4096, 1024, 1, 3145]
    - [11, 88.9]
  - - [64, 134, 480, 134]
    - [7, 36.665]
  - - [1024, 33708, 1, 3976]
    - [15, 96.371]
  - - [4096, 1024, 1, 3518]
    - [11, 88.877]
  - - [4096, 1024, 1, 3110]
    - [11, 89.042]
  - - [4096, 1024, 1, 3325]
    - [11, 88.871]
  - - [1024, 33708, 1, 3999]
    - [6, 96.133]
  - - [4096, 1024, 1, 2985]
    - [11, 88.869]
  - - [1024, 4096, 1, 3371]
    - [11, 88.956]
  - - [4096, 1024, 1, 3342]
    - [11, 88.823]
  - - [4096, 1024, 1, 3141]
    - [11, 88.986]
  - - [4096, 1024, 1, 3532]
    - [11, 89.112]
  - - [64, 78, 816, 78]
    - [65, 25.987]
  - - [1024, 4096, 1, 3169]
    - [11, 89.205]
  - - [1024, 4096, 1, 3514]
    - [11, 89.109]
  - - [4096, 1024, 1, 3780]
    - [11, 89.447]
  - - [1024, 4096, 1, 3098]
    - [11, 89.063]
  - - [1024, 4096, 1, 3449]
    - [11, 89.099]
  - - [1024, 4096, 1, 3222]
    - [11, 89.104]
  - - [1024, 4096, 1, 3346]
    - [11, 89.193]
  - - [4096, 1024, 1, 3064]
    - [11, 88.993]
  - - [4096, 1024, 1, 3511]
    - [11, 89.081]
  - - [4096, 1024, 1, 3384]
    - [11, 89.113]
  - - [4096, 1024, 1, 3356]
    - [11, 88.87]
  - - [1024, 4096, 1, 3796]
    - [11, 89.423]
  - - [4096, 1024, 1, 3427]
    - [11, 89.238]
  - - [4096, 1024, 1, 3390]
    - [11, 88.96]
  - - [4096, 1024, 1, 3573]
    - [11, 89.276]
  - - [4096, 1024, 1, 3456]
    - [11, 89.451]
  - - [1024, 4096, 1, 3360]
    - [11, 89.415]
  - - [1024, 33708, 1, 3977]
    - [15, 96.366]
  - - [1024, 4096, 1, 2918]
    - [11, 89.02]
  - - [4096, 1024, 1, 3975]
    - [11, 89.288]
  - - [4096, 1024, 1, 3525]
    - [11, 89.233]
  - - [4096, 1024, 1, 3398]
    - [11, 89.183]
  - - [4096, 1024, 1, 3640]
    - [11, 89.136]
  - - [1024, 1024, 1, 3999]
    - [14, 76.477]
  - - [4096, 1024, 1, 3014]
    - [11, 88.962]
  - - [1024, 4096, 1, 3446]
    - [11, 89.253]
  - - [1024, 33708, 1, 3796]
    - [6, 96.428]
  - - [4096, 1024, 1, 3101]
    - [11, 88.637]
  - - [4096, 1024, 1, 3563]
    - [11, 89.109]
  - - [4096, 1024, 1, 3539]
    - [11, 89.252]
  - - [4096, 1024, 1, 3182]
    - [11, 88.83]
  - - [1024, 4096, 1, 3468]
    - [11, 88.982]
  - - [4096, 1024, 1, 3312]
    - [11, 89.383]
  - - [4096, 1024, 1, 3215]
    - [11, 88.535]
  - - [4096, 1024, 1, 3910]
    - [11, 89.39]
  - - [1024, 33708, 1, 3780]
    - [7, 96.37]
  - - [1024, 4096, 1, 3290]
    - [11, 89.018]
  - - [1024, 4096, 1, 4012]
    - [11, 89.187]
  - - [1024, 4096, 1, 3385]
    - [11, 89.002]
  - - [1024, 33708, 1, 3975]
    - [15, 96.328]
  - - [4096, 1024, 1, 3996]
    - [11, 89.114]
  - - [4096, 1024, 1, 2765]
    - [11, 88.374]
  - - [4096, 1024, 1, 3538]
    - [11, 89.275]
  - - [4096, 1024, 1, 3415]
    - [11, 89.085]
  - - [1024, 4096, 1, 3554]
    - [11, 89.333]
  - - [4096, 1024, 1, 3513]
    - [11, 88.965]
  - - [1024, 4096, 1, 3304]
    - [11, 89.028]
  - - [4096, 1024, 1, 3294]
    - [57, 88.682]
  - - [4096, 1024, 1, 3396]
    - [11, 89.279]
  - - [1024, 4096, 1, 3213]
    - [11, 88.79]
  - - [4096, 1024, 1, 3137]
    - [11, 89.047]
  - - [4096, 1024, 1, 3552]
    - [11, 89.461]
  - - [1024, 1024, 1, 4020]
    - [14, 76.414]
  - - [64, 13, 4672, 13]
    - [61, 5.118]
  - - [1024, 4096, 1, 3461]
    - [11, 89.092]
  - - [4096, 1024, 1, 3263]
    - [11, 88.694]
  - - [4096, 1024, 1, 3430]
    - [11, 89.205]
  - - [4096, 1024, 1, 3389]
    - [11, 88.91]
  - - [4096, 1024, 1, 3528]
    - [11, 89.094]
  - - [1024, 4096, 1, 3463]
    - [11, 89.144]
  - - [4096, 1024, 1, 3526]
    - [11, 89.163]
  - - [4096, 1024, 1, 3154]
    - [11, 89.074]
  - - [4096, 1024, 1, 3499]
    - [11, 89.004]
  - - [1024, 1024, 1, 3939]
    - [10, 77.14]
  - - [4096, 1024, 1, 3955]
    - [11, 89.445]
  - - [1024, 4096, 1, 3297]
    - [11, 89.131]
  - - [1024, 4096, 1, 3233]
    - [11, 89.174]
  - - [1024, 4096, 1, 3226]
    - [11, 88.981]
  - - [4096, 1024, 1, 3404]
    - [11, 88.982]
  - - [4096, 1024, 1, 3355]
    - [11, 88.968]
  - - [1024, 4096, 1, 3542]
    - [11, 89.15]
  - - [4096, 1024, 1, 3181]
    - [11, 88.815]
  - - [1024, 4096, 1, 3474]
    - [11, 89.305]
  - - [4096, 1024, 1, 3319]
    - [11, 89.101]
  - - [1024, 4096, 1, 3434]
    - [11, 89.064]
  - - [1024, 4096, 1, 3860]
    - [11, 89.294]
  - - [1024, 4096, 1, 3343]
    - [11, 88.775]
  - - [64, 77, 816, 78]
    - [59, 25.842]
  - - [1024, 4096, 1, 3488]
    - [11, 89.434]
  - - [1024, 4096, 1, 3046]
    - [11, 88.948]
  - - [1024, 4096, 1, 3141]
    - [11, 89.147]
  - - [1024, 4096, 1, 3516]
    - [11, 88.993]
  - - [4096, 1024, 1, 3147]
    - [11, 88.797]
  - - [1024, 1024, 1, 4059]
    - [14, 76.693]
  - - [1024, 1024, 1, 3944]
    - [14, 77.238]
  - - [1024, 4096, 1, 3421]
    - [11, 88.959]
  - - [4096, 1024, 1, 3944]
    - [11, 89.378]
  - - [64, 45, 1424, 45]
    - [7, 16.904]
  - - [1024, 4096, 1, 3574]
    - [11, 89.266]
  - - [1024, 4096, 1, 3977]
    - [11, 89.355]
  - - [1024, 4096, 1, 2985]
    - [11, 88.799]
  - - [64, 193, 320, 193]
    - [66, 42.235]
  - - [1024, 4096, 1, 3427]
    - [11, 89.189]
  - - [64, 12, 5040, 12]
    - [61, 4.57]
  - - [1024, 4096, 1, 3482]
    - [11, 89.123]
  - - [1024, 4096, 1, 3332]
    - [11, 89.235]
  - - [1024, 1024, 1, 3720]
    - [14, 76.731]
  - - [4096, 1024, 1, 3308]
    - [11, 88.932]
  - - [1024, 4096, 1, 3513]
    - [11, 89.084]
  - - [1024, 4096, 1, 3154]
    - [11, 89.114]
  - - [1024, 4096, 1, 3955]
    - [11, 89.498]
  - - [1024, 4096, 1, 2967]
    - [11, 88.879]
  - - [1024, 33708, 1, 3942]
    - [15, 96.52]
  - - [1024, 4096, 1, 3319]
    - [11, 89.165]
  - - [4096, 1024, 1, 3860]
    - [11, 89.316]
  - - [1024, 4096, 1, 3548]
    - [11, 89.016]
  - - [4096, 1024, 1, 3977]
    - [11, 89.111]
  - - [4096, 1024, 1, 3535]
    - [11, 88.973]
  - - [1024, 4096, 1, 3541]
    - [11, 89.267]
  - - [1024, 1024, 1, 3910]
    - [10, 77.051]
  - - [1024, 33708, 1, 3584]
    - [15, 96.62]
  - - [1024, 4096, 1, 3168]
    - [11, 89.283]
  - - [1024, 4096, 1, 3448]
    - [11, 89.134]
  - - [4096, 1024, 1, 3343]
    - [11, 88.75]
  - - [64, 35, 1808, 35]
    - [13, 13.887]
  - - [1024, 4096, 1, 3357]
    - [11, 88.835]
  - - [64, 143, 432, 143]
    - [7, 37.691]
  - - [4096, 1024, 1, 3510]
    - [11, 89.14]
  - - [4096, 1024, 1, 3369]
    - [11, 88.99]
  - - [64, 92, 688, 93]
    - [7, 28.344]
  - - [4096, 1024, 1, 3379]
    - [11, 89.267]
  - - [1024, 4096, 1, 3276]
    - [11, 88.881]
  - - [1024, 4096, 1, 3363]
    - [11, 89.181]
  - - [4096, 1024, 1, 3055]
    - [11, 88.568]
  - - [1024, 4096, 1, 3524]
    - [11, 89.255]
  - - [4096, 1024, 1, 3057]
    - [11, 89.035]
  - - [1024, 33708, 1, 3720]
    - [15, 96.372]
  - - [1024, 4096, 1, 3383]
    - [11, 89.049]
  - - [1024, 4096, 1, 3522]
    - [11, 89.324]
  - - [1024, 33708, 1, 3956]
    - [6, 96.399]
  - - [1024, 4096, 1, 3481]
    - [11, 89.073]
  - - [4096, 1024, 1, 3562]
    - [11, 89.108]
  - - [4096, 1024, 1, 3299]
    - [11, 89.198]
  - - [1024, 4096, 1, 3262]
    - [11, 88.769]
  - - [1024, 33708, 1, 4026]
    - [6, 96.298]
  - - [4096, 1024, 1, 3168]
    - [11, 89.309]
  - - [64, 101, 624, 101]
    - [7, 32.668]
  - - [1024, 4096, 1, 3999]
    - [11, 89.244]
  - - [1024, 4096, 1, 3549]
    - [11, 88.971]
  - - [4096, 1024, 1, 3375]
    - [11, 88.863]
  - - [1024, 4096, 1, 3496]
    - [11, 89.216]
  - - [64, 29, 2176, 29]
    - [61, 11.135]
  - - [1024, 4096, 1, 3190]
    - [11, 89.159]
  - - [4096, 1024, 1, 3273]
    - [11, 88.876]
  - - [1024, 4096, 1, 3406]
    - [11, 88.838]
  - - [4096, 1024, 1, 4005]
    - [11, 89.463]
  - - [4096, 1024, 1, 3555]
    - [11, 89.275]
  - - [4096, 1024, 1, 2505]
    - [11, 88.504]
  - - [1024, 4096, 1, 3460]
    - [11, 89.249]
  - - [64, 17, 3632, 17]
    - [62, 5.494]
  - - [1024, 4096, 1, 3579]
    - [11, 89.038]
  - - [1024, 33708, 1, 4030]
    - [6, 96.126]
  - - [1024, 4096, 1, 3510]
    - [11, 89.32]
  - - [1024, 1024, 1, 3969]
    - [10, 77.567]
  - - [1024, 4096, 1, 3282]
    - [11, 89.3]
  - - [1024, 4096, 1, 3377]
    - [11, 89.202]
  - - [1024, 4096, 1, 2935]
    - [11, 88.85]
  - - [64, 41, 1552, 41]
    - [7, 16.044]
  - - [1024, 4096, 1, 3498]
    - [11, 89.074]
  - - [1024, 4096, 1, 3593]
    - [11, 89.151]
  - - [1024, 1024, 1, 3948]
    - [14, 77.606]
  - - [4096, 1024, 1, 3226]
    - [11, 89.033]
  - - [1024, 4096, 1, 2499]
    - [11, 88.641]
  - - [1024, 4096, 1, 3296]
    - [11, 89.475]
  - - [1024, 4096, 1, 3455]
    - [11, 88.841]
  - - [1024, 4096, 1, 3399]
    - [11, 89.036]
  - - [1024, 4096, 1, 3205]
    - [11, 89.195]
  - - [4096, 1024, 1, 4026]
    - [11, 89.277]
  - - [1024, 4096, 1, 3484]
    - [11, 89.03]
  - - [4096, 1024, 1, 3302]
    - [11, 89.024]
  - - [1024, 4096, 1, 3485]
    - [11, 88.947]
  - - [1024, 1024, 1, 3996]
    - [14, 76.668]
  - - [1024, 4096, 1, 3126]
    - [11, 89.082]
  - - [1024, 4096, 1, 4050]
    - [11, 89.557]
  - - [4096, 1024, 1, 3235]
    - [11, 89.099]
  - - [1024, 33708, 1, 3955]
    - [6, 96.342]
  - - [1024, 4096, 1, 3342]
    - [11, 88.823]
  - - [1024, 1024, 1, 3900]
    - [14, 76.376]
  - - [1024, 4096, 1, 3397]
    - [11, 89.169]
  - - [4096, 1024, 1, 3491]
    - [11, 89.341]
  - - [1024, 4096, 1, 3503]
    - [57, 88.795]
  - - [1024, 4096, 1, 3140]
    - [11, 89.078]
  - - [4096, 1024, 1, 3121]
    - [11, 88.993]
  - - [4096, 1024, 1, 3276]
    - [11, 88.792]
  - - [1024, 4096, 1, 3321]
    - [11, 89.016]
  - - [1024, 4096, 1, 3870]
    - [11, 89.111]
  - - [4096, 1024, 1, 3475]
    - [11, 89.222]
  - - [1024, 4096, 1, 2984]
    - [11, 88.825]
  - - [4096, 1024, 1, 3363]
    - [11, 89.006]
  - - [1024, 4096, 1, 3582]
    - [11, 88.949]
  - - [4096, 1024, 1, 3509]
    - [11, 89.282]
  - - [1024, 4096, 1, 3426]
    - [11, 89.273]
  - - [4096, 1024, 1, 3136]
    - [11, 89.259]
  - - [1024, 4096, 1, 3232]
    - [11, 89.355]
  - - [4096, 1024, 1, 3103]
    - [11, 88.547]
  - - [1024, 4096, 1, 3335]
    - [11, 89.038]
  - - [1024, 4096, 1, 3900]
    - [11, 89.129]
  - - [4096, 1024, 1, 3512]
    - [11, 89.19]
  - - [4096, 1024, 1, 3222]
    - [11, 89.052]
  - - [1024, 4096, 1, 3165]
    - [11, 88.709]
  - - [4096, 1024, 1, 3408]
    - [11, 89.42]
  - - [4096, 1024, 1, 3751]
    - [11, 89.196]
  - - [1024, 4096, 1, 3318]
    - [11, 89.024]
  - - [4096, 1024, 1, 3442]
    - [11, 89.284]
  - - [1024, 4096, 1, 3413]
    - [11, 89.193]
  - - [4096, 1024, 1, 3524]
    - [11, 89.22]
  - - [1024, 4096, 1, 3976]
    - [11, 89.215]
  - - [1024, 4096, 1, 3475]
    - [11, 89.161]
  - - [1024, 4096, 1, 3534]
    - [11, 89.02]
  - - [4096, 1024, 1, 3301]
    - [11, 89.048]
  - - [4096, 1024, 1, 3248]
    - [11, 89.275]
  - - [1024, 4096, 1, 2977]
    - [11, 89.024]
  - - [4096, 1024, 1, 3346]
    - [11, 89.13]
  - - [1024, 4096, 1, 3451]
    - [11, 88.968]
  - - [1024, 4096, 1, 3257]
    - [11, 89.017]
  - - [1024, 1024, 1, 3640]
    - [14, 76.11]
  - - [1024, 4096, 1, 3356]
    - [11, 88.933]
  - - [4096, 1024, 1, 3348]
    - [11, 89.121]
  - - [4096, 1024, 1, 3335]
    - [11, 88.962]
  - - [4096, 1024, 1, 3505]
    - [11, 89.277]
  - - [1024, 4096, 1, 3490]
    - [11, 89.219]
  - - [4096, 1024, 1, 3447]
    - [11, 89.096]
  - - [1024, 4096, 1, 3267]
    - [11, 89.149]
  - - [4096, 1024, 1, 3230]
    - [11, 88.767]
  - - [4096, 1024, 1, 3455]
    - [11, 88.817]
  - - [1024, 4096, 1, 3925]
    - [11, 89.397]
  - - [1024, 4096, 1, 3362]
    - [11, 89.217]
  - - [4096, 1024, 1, 3969]
    - [11, 89.387]
  - - [4096, 1024, 1, 3527]
    - [11, 89.104]
  - - [1024, 4096, 1, 3585]
    - [11, 89.258]
  - - [4096, 1024, 1, 3063]
    - [11, 88.882]
  - - [4096, 1024, 1, 3435]
    - [11, 89.078]
  - - [4096, 1024, 1, 3366]
    - [11, 89.135]
  - - [4096, 1024, 1, 3581]
    - [11, 89.017]
  - - [1024, 33708, 1, 3906]
    - [15, 96.397]
  - - [1024, 4096, 1, 3464]
    - [11, 88.988]
  - - [1024, 4096, 1, 3440]
    - [11, 89.552]
  - - [4096, 1024, 1, 3143]
    - [11, 88.963]
  - - [1024, 4096, 1, 3349]
    - [11, 89.122]
  - - [4096, 1024, 1, 3416]
    - [11, 89.062]
  - - [4096, 1024, 1, 3365]
    - [11, 89.084]
  - - [1024, 4096, 1, 3470]
    - [11, 89.009]
  - - [4096, 1024, 1, 3287]
    - [11, 89.077]
  - - [1024, 4096, 1, 3441]
    - [11, 89.221]
  - - [4096, 1024, 1, 3224]
    - [11, 88.977]
  - - [1024, 4096, 1, 3387]
    - [11, 89.08]
  - - [1024, 4096, 1, 3547]
    - [11, 89.015]
  - - [4096, 1024, 1, 3478]
    - [11, 89.153]
  - - [4096, 1024, 1, 3548]
    - [11, 89.04]
  - - [1024, 33708, 1, 4020]
    - [7, 96.39]
  - - [4096, 1024, 1, 3320]
    - [11, 89.052]
  - - [1024, 4096, 1, 3906]
    - [11, 89.45]
  - - [4096, 1024, 1, 3796]
    - [11, 89.356]
  - - [1024, 4096, 1, 3306]
    - [11, 88.993]
  - - [1024, 4096, 1, 3401]
    - [11, 89.126]
  - - [64, 147, 432, 147]
    - [7, 41.487]
  - - [1024, 4096, 1, 3215]
    - [11, 88.716]
  - - [4096, 1024, 1, 4012]
    - [11, 89.218]
  - - [1024, 4096, 1, 2765]
    - [11, 88.404]
  - - [4096, 1024, 1, 3554]
    - [11, 89.416]
  - - [4096, 1024, 1, 3423]
    - [11, 88.901]
  - - [1024, 1024, 1, 3751]
    - [14, 76.967]
  - - [1024, 4096, 1, 3562]
    - [11, 89.154]
  - - [1024, 4096, 1, 3489]
    - [11, 89.23]
  - - [4096, 1024, 1, 3358]
    - [11, 88.861]
  - - [4096, 1024, 1, 3270]
    - [11, 89.128]
  - - [1024, 4096, 1, 3293]
    - [11, 88.883]
  - - [1024, 4096, 1, 3376]
    - [11, 89.425]
  - - [4096, 1024, 1, 3245]
    - [11, 88.908]
  - - [4096, 1024, 1, 3541]
    - [11, 89.232]
  - - [4096, 1024, 1, 3443]
    - [11, 89.261]
  - - [4096, 1024, 1, 3438]
    - [11, 88.973]
  - - [4096, 1024, 1, 3244]
    - [11, 88.816]
  - - [1024, 4096, 1, 3365]
    - [11, 89.134]
  - - [1024, 4096, 1, 3299]
    - [11, 89.159]
  - - [1024, 4096, 1, 3471]
    - [11, 88.902]
  - - [1024, 4096, 1, 3398]
    - [11, 89.208]
  - - [4096, 1024, 1, 3162]
    - [11, 88.836]
  - - [1024, 4096, 1, 4005]
    - [11, 89.441]
  - - [4096, 1024, 1, 3579]
    - [11, 89.026]
  - - [64, 18, 3440, 18]
    - [62, 5.834]
  - - [64, 177, 352, 177]
    - [7, 47.052]
  - - [1024, 4096, 1, 3121]
    - [11, 89.128]
  - - [4096, 1024, 1, 3441]
    - [11, 89.221]
  - - [4096, 1024, 1, 3422]
    - [11, 88.887]
  - - [4096, 1024, 1, 3444]
    - [11, 89.262]
  - - [1024, 4096, 1, 3337]
    - [11, 89.028]
  - - [4096, 1024, 1, 3550]
    - [11, 88.889]
  - - [1024, 4096, 1, 3477]
    - [11, 89.212]
  - - [4096, 1024, 1, 3490]
    - [11, 89.219]
  - - [4096, 1024, 1, 3585]
    - [11, 89.281]
  - - [1024, 4096, 1, 3143]
    - [11, 88.976]
  - - [1024, 33708, 1, 3876]
    - [6, 96.386]
  - - [1024, 4096, 1, 3320]
    - [11, 89.04]
  - - [1024, 4096, 1, 3423]
    - [11, 88.84]
  - - [1024, 4096, 1, 3894]
    - [11, 89.37]
  - - [4096, 1024, 1, 3410]
    - [11, 89.275]
  - - [1024, 4096, 1, 3561]
    - [11, 89.094]
  - - [4096, 1024, 1, 3492]
    - [11, 89.318]
  - - [64, 85, 752, 85]
    - [7, 28.236]
  - - [36548, 1024, 1, 3712]
    - [11, 96.149]
  - - [4096, 2048, 1, 128]
    - [11, 72.766]
  - - [1024, 1024, 1, 3712]
    - [14, 77.961]
  - - [1024, 1024, 1, 128]
    - [6, 35.167]
  - - [4096, 3072, 1, 128]
    - [11, 80.382]
  - - [768, 3072, 1, 4096]
    - [11, 83.414]
  - - [64, 256, 192, 256]
    - [15, 59.593]
  - - [768, 2, 1, 16]
    - [67, 0.017]
  - - [768, 30522, 1, 1280]
    - [15, 94.784]
  - - [64, 128, 384, 128]
    - [15, 41.429]
  - - [768, 30522, 1, 320]
    - [15, 92.972]
  - - [768, 30522, 1, 640]
    - [15, 94.163]
  - - [768, 2, 1, 32]
    - [24, 0.033]
  - - [256, 512, 36, 98]
    - [11, 52.361]
  - - [64, 192, 36, 25088]
    - [22, 93.207]
  - - [128, 128, 64, 25]
    - [9, 10.012]
  - - [256, 256, 64, 56]
    - [9, 31.692]
  - - [512, 486, 36, 800]
    - [15, 89.216]
  - - [512, 512, 36, 1568]
    - [15, 95.663]
  - - [64, 192, 64, 3200]
    - [21, 79.033]
  - - [256, 384, 36, 4096]
    - [15, 93.913]
  - - [128, 256, 64, 32]
    - [59, 17.282]
  - - [64, 128, 64, 23104]
    - [121, 77.06]
  - - [128, 256, 64, 9]
    - [9, 5.35]
  - - [256, 512, 36, 784]
    - [7, 88.117]
  - - [256, 324, 36, 32]
    - [11, 19.753]
  - - [512, 512, 36, 33]
    - [57, 26.632]
  - - [16, 32, 36, 5760]
    - [117, 9.327]
  - - [192, 384, 64, 128]
    - [15, 62.861]
  - - [512, 512, 64, 72]
    - [11, 54.822]
  - - [128, 128, 64, 1600]
    - [10, 70.994]
  - - [512, 512, 36, 128]
    - [15, 75.504]
  - - [192, 384, 64, 2304]
    - [15, 90.882]
  - - [384, 256, 64, 450]
    - [6, 89.037]
  - - [3, 64, 36, 6272]
    - [122, 3.334]
  - - [3, 64, 64, 2888]
    - [24, 3.66]
  - - [384, 256, 64, 2304]
    - [15, 95.618]
  - - [512, 512, 64, 144]
    - [11, 84.927]
  - - [256, 256, 36, 6272]
    - [14, 84.222]
  - - [80, 192, 64, 4608]
    - [12, 62.125]
  - - [64, 64, 36, 3136]
    - [12, 40.782]
  - - [256, 384, 64, 2304]
    - [15, 95.632]
  - - [512, 512, 36, 66]
    - [11, 48.817]
  - - [128, 256, 64, 800]
    - [15, 81.213]
  - - [64, 128, 36, 30]
    - [4, 4.804]
  - - [192, 256, 36, 512]
    - [15, 77.327]
  - - [256, 512, 64, 200]
    - [7, 77.706]
  - - [256, 512, 64, 25]
    - [11, 19.367]
  - - [3, 64, 64, 46208]
    - [122, 6.483]
  - - [128, 256, 36, 1568]
    - [15, 77.615]
  - - [64, 128, 64, 11552]
    - [121, 72.825]
  - - [128, 192, 64, 946]
    - [7, 74.922]
  - - [64, 192, 64, 12800]
    - [21, 82.798]
  - - [224, 224, 64, 128]
    - [15, 45.852]
  - - [128, 256, 64, 288]
    - [6, 68.736]
  - - [64, 64, 64, 826]
    - [21, 34.361]
  - - [256, 384, 64, 1152]
    - [15, 94.238]
  - - [3, 64, 64, 92416]
    - [122, 6.694]
  - - [32, 32, 36, 43808]
    - [123, 33.096]
  - - [160, 320, 64, 288]
    - [7, 65.532]
  - - [1, 16, 36, 23040]
    - [124, 0.702]
  - - [128, 256, 36, 128]
    - [15, 39.107]
  - - [128, 128, 64, 3360]
    - [14, 76.742]
  - - [128, 128, 64, 420]
    - [7, 53.353]
  - - [64, 128, 64, 361]
    - [48, 37.742]
  - - [512, 512, 36, 16]
    - [57, 14.03]
  - - [384, 256, 36, 800]
    - [15, 89.223]
  - - [192, 384, 36, 4096]
    - [15, 93.216]
  - - [64, 64, 64, 1600]
    - [35, 43.554]
  - - [256, 384, 64, 576]
    - [15, 91.801]
  - - [512, 512, 64, 14]
    - [57, 12.8]
  - - [512, 512, 36, 8]
    - [57, 7.133]
  - - [512, 486, 64, 128]
    - [11, 72.851]
  - - [1, 16, 64, 640]
    - [28, 0.194]
  - - [64, 96, 64, 288]
    - [37, 34.483]
  - - [96, 96, 36, 1568]
    - [20, 54.145]
  - - [256, 256, 36, 128]
    - [11, 50.22]
  - - [64, 128, 36, 53824]
    - [125, 78.827]
  - - [256, 256, 36, 32]
    - [9, 18.195]
  - - [192, 256, 64, 288]
    - [15, 78.216]
  - - [256, 256, 36, 16]
    - [59, 9.891]
  - - [128, 256, 36, 3200]
    - [15, 80.473]
  - - [160, 320, 64, 512]
    - [48, 72.981]
  - - [128, 160, 36, 512]
    - [15, 53.665]
  - - [96, 96, 36, 2592]
    - [20, 57.5]
  - - [64, 96, 64, 800]
    - [10, 50.094]
  - - [147, 64, 36, 18816]
    - [22, 70.357]
  - - [160, 320, 36, 512]
    - [15, 67.188]
  - - [256, 512, 36, 4]
    - [68, 3.21]
  - - [96, 128, 64, 946]
    - [48, 59.028]
  - - [256, 324, 64, 1568]
    - [15, 79.964]
  - - [128, 128, 64, 50]
    - [65, 17.502]
  - - [35, 96, 36, 8960]
    - [10, 36.477]
  - - [32, 64, 36, 43808]
    - [126, 44.856]
  - - [160, 224, 36, 128]
    - [4, 36.844]
  - - [64, 64, 64, 81]
    - [47, 9.764]
  - - [256, 256, 36, 3200]
    - [15, 82.663]
  - - [256, 256, 36, 210]
    - [6, 61.006]
  - - [192, 384, 64, 576]
    - [15, 86.747]
  - - [512, 512, 64, 800]
    - [15, 94.041]
  - - [512, 24, 36, 800]
    - [8, 36.413]
  - - [64, 64, 64, 13216]
    - [121, 60.894]
  - - [192, 224, 64, 1152]
    - [15, 79.922]
  - - [256, 256, 64, 1152]
    - [15, 87.241]
  - - [512, 486, 64, 512]
    - [15, 88.459]
  - - [128, 128, 36, 784]
    - [8, 54.411]
  - - [256, 512, 64, 1600]
    - [15, 93.939]
  - - [512, 512, 64, 9]
    - [57, 8.592]
  - - [96, 128, 64, 288]
    - [48, 44.379]
  - - [64, 96, 36, 512]
    - [5, 31.898]
  - - [256, 512, 36, 1568]
    - [15, 90.117]
  - - [128, 128, 64, 400]
    - [7, 56.089]
  - - [128, 128, 64, 800]
    - [10, 63.967]
  - - [96, 128, 36, 512]
    - [12, 49.55]
  - - [16, 32, 36, 360]
    - [28, 2.3]
  - - [128, 256, 64, 3200]
    - [15, 87.358]
  - - [96, 128, 64, 800]
    - [12, 58.22]
  - - [256, 512, 64, 4]
    - [9, 3.517]
  - - [256, 256, 64, 450]
    - [6, 81.788]
  - - [64, 64, 64, 3200]
    - [22, 49.225]
  - - [192, 224, 64, 128]
    - [15, 50.247]
  - - [128, 128, 64, 288]
    - [7, 51.945]
  - - [256, 256, 64, 72]
    - [11, 40.869]
  - - [96, 208, 36, 512]
    - [20, 48.078]
  - - [128, 256, 36, 3136]
    - [26, 80.54]
  - - [64, 64, 36, 3520]
    - [10, 41.474]
  - - [64, 128, 36, 1568]
    - [39, 49.266]
  - - [160, 320, 64, 242]
    - [7, 60.777]
  - - [192, 192, 36, 512]
    - [15, 71.713]
  - - [512, 512, 36, 512]
    - [15, 92.977]
  - - [1, 16, 64, 10240]
    - [127, 0.717]
  - - [128, 128, 36, 512]
    - [8, 47.586]
  - - [512, 512, 36, 256]
    - [6, 89.024]
  - - [512, 512, 36, 1024]
    - [15, 95.006]
  - - [96, 208, 64, 1152]
    - [12, 61.319]
  - - [128, 192, 64, 3200]
    - [10, 83.823]
  - - [256, 256, 36, 4096]
    - [15, 83.207]
  - - [160, 160, 64, 288]
    - [43, 48.885]
  - - [256, 256, 64, 896]
    - [15, 86.454]
  - - [128, 256, 64, 242]
    - [6, 63.182]
  - - [128, 128, 36, 440]
    - [48, 45.157]
  - - [96, 128, 36, 1568]
    - [12, 69.158]
  - - [192, 384, 36, 1024]
    - [15, 88.951]
  - - [64, 96, 36, 10368]
    - [10, 66.333]
  - - [128, 256, 64, 100]
    - [7, 37.209]
  - - [112, 224, 36, 2048]
    - [10, 61.429]
  - - [384, 256, 64, 1152]
    - [15, 94.293]
  - - [192, 384, 36, 128]
    - [7, 54.487]
  - - [128, 128, 36, 7040]
    - [14, 72.224]
  - - [128, 256, 64, 1568]
    - [15, 85.071]
  - - [128, 128, 36, 1568]
    - [10, 64.419]
  - - [128, 256, 64, 72]
    - [9, 31.072]
  - - [256, 256, 36, 12544]
    - [14, 85.299]
  - - [256, 256, 36, 105]
    - [11, 40.745]
  - - [128, 256, 36, 392]
    - [7, 59.035]
  - - [64, 64, 64, 5408]
    - [22, 52.069]
  - - [3, 64, 36, 25088]
    - [120, 5.446]
  - - [384, 256, 36, 1024]
    - [15, 90.279]
  - - [35, 96, 36, 13440]
    - [10, 37.304]
  - - [128, 256, 64, 1152]
    - [15, 83.239]
  - - [256, 324, 64, 32]
    - [11, 23.198]
  - - [160, 224, 64, 128]
    - [15, 41.092]
  - - [192, 224, 36, 2592]
    - [14, 82.358]
  - - [96, 96, 64, 1152]
    - [23, 51.551]
  - - [32, 64, 36, 90]
    - [25, 3.437]
  - - [64, 128, 64, 2888]
    - [12, 57.779]
  - - [256, 384, 36, 800]
    - [15, 89.223]
  - - [512, 512, 64, 4]
    - [57, 3.938]
  - - [192, 320, 36, 128]
    - [7, 49.073]
  - - [64, 128, 36, 480]
    - [47, 35.839]
  - - [192, 384, 64, 242]
    - [6, 76.693]
  - - [256, 486, 64, 32]
    - [15, 23.973]
  - - [147, 64, 64, 9702]
    - [69, 65.586]
  - - [512, 512, 64, 64]
    - [11, 53.826]
  - - [64, 192, 64, 3698]
    - [21, 78.906]
  - - [73, 192, 64, 10439]
    - [12, 57.588]
  - - [1, 16, 36, 1440]
    - [24, 0.153]
  - - [128, 256, 36, 512]
    - [7, 65.905]
  - - [512, 512, 64, 576]
    - [7, 93.557]
  - - [64, 64, 36, 12544]
    - [128, 55.388]
  - - [128, 128, 36, 880]
    - [48, 55.429]
  - - [192, 224, 36, 128]
    - [15, 44.88]
  - - [64, 64, 64, 800]
    - [35, 35.53]
  - - [64, 128, 36, 12544]
    - [121, 67.881]
  - - [64, 64, 36, 1568]
    - [12, 33.941]
  - - [160, 160, 36, 512]
    - [20, 52.506]
  - - [512, 24, 64, 512]
    - [60, 34.964]
  - - [3, 64, 36, 3136]
    - [122, 2.246]
  - - [256, 256, 64, 9]
    - [59, 6.724]
  - - [3, 64, 64, 11552]
    - [122, 5.358]
  - - [128, 256, 36, 12544]
    - [40, 83.83]
  - - [128, 128, 36, 3136]
    - [10, 69.698]
  - - [256, 512, 36, 3136]
    - [15, 91.302]
  - - [64, 64, 36, 196]
    - [4, 11.526]
  - - [144, 288, 36, 512]
    - [15, 54.769]
  - - [256, 24, 64, 32]
    - [64, 5.203]
  - - [384, 384, 36, 800]
    - [15, 91.44]
  - - [512, 512, 64, 1600]
    - [11, 94.837]
  - - [112, 224, 36, 512]
    - [15, 49.5]
  - - [128, 128, 36, 49]
    - [70, 11.949]
  - - [512, 512, 36, 4]
    - [57, 3.612]
  - - [35, 96, 64, 4235]
    - [10, 36.908]
  - - [192, 384, 64, 450]
    - [6, 84.162]
  - - [256, 256, 36, 1024]
    - [15, 79.356]
  - - [112, 224, 64, 1152]
    - [15, 63.925]
  - - [256, 512, 64, 400]
    - [6, 89.957]
  - - [149, 32, 36, 19072]
    - [14, 48.245]
  - - [128, 256, 36, 6272]
    - [22, 82.717]
  - - [128, 192, 36, 1568]
    - [15, 83.47]
  - - [256, 256, 36, 512]
    - [15, 75.087]
  - - [256, 256, 64, 112]
    - [11, 58.32]
  - - [512, 512, 64, 18]
    - [57, 16.557]
  - - [256, 256, 64, 18]
    - [9, 12.648]
  - - [256, 256, 64, 1568]
    - [15, 88.184]
  - - [64, 96, 36, 1568]
    - [10, 50.095]
  - - [384, 256, 36, 4096]
    - [15, 94.008]
  - - [256, 512, 64, 800]
    - [15, 92.743]
  - - [256, 384, 36, 2048]
    - [15, 92.582]
  - - [3, 64, 36, 200704]
    - [120, 6.689]
  - - [384, 384, 64, 2304]
    - [15, 96.133]
  - - [160, 320, 64, 128]
    - [15, 48.467]
  - - [512, 512, 36, 528]
    - [6, 93.139]
  - - [160, 320, 36, 128]
    - [69, 40.737]
  - - [96, 96, 64, 800]
    - [71, 48.44]
  - - [256, 512, 36, 49]
    - [11, 30.203]
  - - [384, 384, 64, 450]
    - [6, 91.747]
  - - [3, 64, 64, 23104]
    - [122, 6.01]
  - - [256, 256, 64, 3200]
    - [15, 89.135]
  - - [128, 192, 36, 512]
    - [15, 65.014]
  - - [192, 192, 64, 288]
    - [6, 67.449]
  - - [96, 208, 64, 242]
    - [58, 41.235]
  - - [256, 16, 36, 3200]
    - [28, 29.867]
  - - [512, 512, 64, 8]
    - [57, 7.725]
  - - [64, 128, 64, 5776]
    - [121, 63.713]
  - - [512, 512, 64, 288]
    - [15, 91.879]
  - - [256, 16, 36, 32]
    - [72, 2.835]
  - - [128, 192, 64, 288]
    - [15, 61.304]
  - - [32, 64, 64, 640]
    - [19, 21.48]
  - - [64, 64, 36, 392]
    - [5, 19.44]
  - - [384, 384, 36, 1024]
    - [15, 92.06]
  - - [64, 64, 36, 11552]
    - [128, 54.175]
  - - [96, 128, 36, 6272]
    - [12, 80.358]
  - - [128, 256, 36, 16]
    - [73, 7.333]
  - - [256, 256, 64, 288]
    - [6, 79.355]
  - - [64, 64, 64, 1652]
    - [21, 42.613]
  - - [256, 384, 36, 1024]
    - [15, 90.03]
  - - [96, 128, 64, 3200]
    - [12, 71.599]
  - - [256, 324, 36, 3200]
    - [11, 78.752]
  - - [128, 192, 64, 800]
    - [15, 74.223]
  - - [64, 128, 64, 10]
    - [17, 2.625]
  - - [96, 208, 64, 288]
    - [74, 44.469]
  - - [64, 96, 36, 2592]
    - [10, 56.659]
  - - [64, 128, 64, 160]
    - [48, 28.004]
  - - [192, 384, 64, 512]
    - [15, 86.137]
  - - [64, 64, 36, 6272]
    - [10, 44.482]
  - - [512, 24, 36, 288]
    - [8, 24.226]
  - - [128, 128, 64, 1568]
    - [10, 71.453]
  - - [112, 224, 64, 242]
    - [7, 47.073]
  - - [128, 256, 64, 1600]
    - [15, 84.906]
  - - [32, 32, 64, 20000]
    - [123, 32.331]
  - - [160, 192, 64, 288]
    - [69, 57.087]
  - - [512, 24, 64, 128]
    - [64, 19.47]
  - - [512, 512, 36, 32]
    - [57, 26.426]
  - - [3, 64, 36, 100352]
    - [120, 6.521]
  - - [3, 64, 64, 1444]
    - [24, 3.111]
  - - [512, 512, 36, 3136]
    - [15, 96.257]
  - - [128, 256, 64, 6400]
    - [26, 88.626]
  - - [256, 256, 36, 2048]
    - [15, 81.678]
  - - [128, 160, 64, 288]
    - [8, 53.163]
  - - [256, 256, 64, 6400]
    - [15, 89.73]
  - - [32, 64, 64, 20000]
    - [12, 42.975]
  - - [256, 256, 36, 1680]
    - [11, 81.193]
  - - [128, 128, 64, 210]
    - [7, 44.302]
  - - [192, 384, 36, 2048]
    - [15, 91.75]
  - - [256, 256, 64, 144]
    - [11, 65.117]
  - - [384, 384, 36, 4096]
    - [11, 94.684]
  - - [160, 320, 64, 1152]
    - [48, 80.473]
  - - [384, 256, 36, 2048]
    - [15, 92.766]
  - - [256, 512, 36, 392]
    - [7, 82.046]
  - - [256, 512, 64, 50]
    - [57, 36.281]
  - - [73, 192, 36, 23360]
    - [49, 61.085]
  - - [3, 64, 36, 50176]
    - [120, 6.105]
  - - [384, 384, 36, 2048]
    - [11, 93.769]
  - - [256, 384, 64, 450]
    - [6, 89.224]
  - - [192, 320, 64, 128]
    - [15, 59.379]
  - - [128, 256, 36, 32]
    - [9, 13.61]
  - - [160, 192, 36, 512]
    - [12, 60.902]
  - - [512, 512, 64, 256]
    - [7, 91.344]
  - - [256, 512, 64, 32]
    - [15, 25.098]
  - - [384, 384, 64, 576]
    - [15, 93.394]
  - - [64, 64, 64, 648]
    - [47, 32.997]
  - - [512, 486, 36, 288]
    - [6, 84.19]
  - - [32, 64, 36, 1440]
    - [19, 20.623]
  - - [144, 288, 64, 242]
    - [7, 50.342]
  - - [384, 256, 64, 576]
    - [15, 91.596]
  - - [512, 512, 36, 64]
    - [11, 49.4]
  - - [448, 384, 64, 128]
    - [15, 77.929]
  - - [64, 128, 64, 722]
    - [48, 45.735]
  - - [144, 288, 64, 288]
    - [15, 53.827]
  - - [512, 512, 64, 224]
    - [15, 90.423]
  - - [112, 224, 64, 288]
    - [7, 51.203]
  - - [384, 384, 64, 1152]
    - [15, 95.301]
  - - [448, 384, 36, 128]
    - [15, 70.187]
  - - [64, 64, 64, 100]
    - [4, 11.814]
  - - [256, 486, 36, 128]
    - [15, 58.322]
  - - [64, 96, 64, 4608]
    - [10, 59.387]
  - - [16, 32, 64, 160]
    - [24, 2.436]
  - - [64, 192, 36, 6272]
    - [26, 87.931]
  - - [64, 64, 64, 200]
    - [47, 19.055]
  - - [256, 256, 36, 800]
    - [7, 78.108]
  - - [64, 128, 36, 6272]
    - [39, 59.203]
  - - [32, 64, 64, 40]
    - [62, 2.917]
  - - [256, 16, 64, 32]
    - [75, 4.667]
  - - [192, 384, 36, 800]
    - [15, 87.311]
  - - [128, 128, 36, 3200]
    - [10, 68.597]
  - - [256, 256, 36, 256]
    - [6, 65.588]
  - - [192, 384, 64, 1152]
    - [15, 89.865]
  - - [128, 256, 64, 200]
    - [6, 55.269]
  - - [64, 96, 64, 1152]
    - [10, 54.006]
  - - [128, 128, 36, 392]
    - [8, 43.781]
  - - [80, 192, 36, 10368]
    - [12, 68.661]
  - - [224, 224, 36, 128]
    - [4, 38.736]
  - - [512, 512, 64, 28]
    - [57, 24.645]
  - - [256, 16, 64, 1568]
    - [61, 32.328]
  - - [144, 288, 64, 1152]
    - [32, 72.334]
  - - [256, 256, 64, 576]
    - [6, 84.14]
  - - [64, 128, 36, 784]
    - [25, 41.023]
  - - [256, 24, 36, 128]
    - [75, 11.814]
  - - [256, 256, 64, 2304]
    - [15, 88.824]
  - - [192, 384, 36, 512]
    - [15, 83.437]
  - - [16, 32, 64, 2560]
    - [20, 10.028]
  - - [256, 512, 36, 32]
    - [15, 23.145]
  - - [512, 512, 64, 128]
    - [11, 82.086]
  - - [128, 128, 64, 200]
    - [9, 41.452]
  - - [512, 512, 64, 32]
    - [57, 28.667]
  - - [128, 256, 36, 196]
    - [7, 46.517]
  - - [8, 384, 64, 6600]
    - [47, 18.677]
  - - [149, 32, 64, 8195]
    - [37, 44.971]
  - - [35, 96, 64, 6160]
    - [14, 37.125]
  - - [64, 64, 36, 1760]
    - [12, 35.442]
  - - [196, 528, 32, 32]
    - [64, 16.583]
  - - [5329, 64, 32, 80]
    - [57, 37.798]
  - - [64, 2880, 1, 320]
    - [19, 21.967]
  - - [49, 832, 32, 256]
    - [7, 45.062]
  - - [196, 512, 32, 24]
    - [13, 13.057]
  - - [289, 1120, 1, 160]
    - [19, 19.779]
  - - [1225, 192, 32, 32]
    - [9, 21.117]
  - - [64, 2048, 32, 384]
    - [15, 75.53]
  - - [1001, 1536, 1, 32]
    - [9, 14.782]
  - - [289, 1792, 1, 320]
    - [76, 34.738]
  - - [1001, 1024, 1, 32]
    - [4, 11.459]
  - - [196, 480, 32, 64]
    - [7, 28.469]
  - - [64, 1728, 1, 320]
    - [24, 13.516]
  - - [49, 832, 32, 160]
    - [7, 37.627]
  - - [49, 832, 32, 384]
    - [7, 51.544]
  - - [289, 896, 1, 192]
    - [5, 19.15]
  - - [289, 1024, 32, 384]
    - [15, 79.67]
  - - [784, 192, 32, 96]
    - [15, 49.035]
  - - [50176, 256, 1, 128]
    - [11, 77.344]
  - - [289, 1024, 32, 256]
    - [15, 75.089]
  - - [289, 1024, 32, 192]
    - [15, 67.165]
  - - [12544, 512, 1, 256]
    - [7, 83.254]
  - - [1225, 1728, 1, 192]
    - [15, 57.059]
  - - [196, 480, 32, 96]
    - [7, 36.897]
  - - [196, 512, 32, 144]
    - [6, 47.908]
  - - [784, 400, 1, 32]
    - [25, 5.515]
  - - [289, 768, 32, 128]
    - [15, 57.301]
  - - [5329, 576, 1, 96]
    - [15, 40.987]
  - - [49, 1200, 1, 128]
    - [24, 3.461]
  - - [64, 1536, 32, 256]
    - [15, 68.476]
  - - [289, 2592, 1, 384]
    - [15, 49.478]
  - - [196, 528, 32, 128]
    - [15, 44.426]
  - - [64, 2048, 32, 448]
    - [6, 78.627]
  - - [5329, 448, 1, 64]
    - [9, 28.454]
  - - [784, 256, 32, 64]
    - [15, 39.666]
  - - [784, 192, 32, 32]
    - [64, 20.987]
  - - [21609, 288, 1, 32]
    - [59, 20.078]
  - - [784, 256, 32, 32]
    - [64, 23.04]
  - - [5041, 720, 1, 192]
    - [15, 59.367]
  - - [289, 2016, 1, 256]
    - [8, 35.193]
  - - [196, 512, 32, 128]
    - [7, 45.514]
  - - [289, 768, 32, 160]
    - [15, 61.48]
  - - [64, 1536, 32, 384]
    - [15, 76.566]
  - - [64, 1280, 32, 320]
    - [15, 70.53]
  - - [289, 896, 1, 128]
    - [25, 14.362]
  - - [289, 3456, 1, 384]
    - [15, 50.393]
  - - [196, 800, 1, 64]
    - [25, 5.025]
  - - [64, 1280, 32, 384]
    - [7, 74.126]
  - - [64, 1344, 1, 512]
    - [24, 14.487]
  - - [1001, 4096, 1, 512]
    - [15, 79.5]
  - - [1225, 192, 32, 64]
    - [57, 36.918]
  - - [64, 1152, 1, 384]
    - [24, 10.812]
  - - [729, 1600, 1, 192]
    - [15, 44.856]
  - - [289, 1344, 1, 192]
    - [19, 24.355]
  - - [784, 192, 32, 16]
    - [64, 11.895]
  - - [3136, 1024, 1, 2048]
    - [15, 84.416]
  - - [64, 1152, 1, 448]
    - [24, 11.629]
  - - [49, 832, 32, 128]
    - [6, 33.006]
  - - [784, 256, 32, 128]
    - [15, 63.114]
  - - [49, 800, 1, 128]
    - [47, 2.38]
  - - [196, 512, 32, 32]
    - [64, 16.902]
  - - [1225, 384, 32, 96]
    - [15, 53.866]
  - - [5041, 576, 1, 96]
    - [15, 39.628]
  - - [49, 832, 32, 48]
    - [6, 17.208]
  - - [5329, 160, 32, 64]
    - [9, 37.689]
  - - [1225, 288, 32, 48]
    - [13, 30.3]
  - - [4096, 9216, 1, 512]
    - [15, 95.884]
  - - [196, 480, 32, 192]
    - [6, 50.68]
  - - [64, 1152, 1, 256]
    - [24, 7.949]
  - - [3136, 1024, 1, 512]
    - [7, 78.909]
  - - [49, 832, 32, 32]
    - [6, 12.06]
  - - [784, 192, 32, 64]
    - [64, 36.852]
  - - [289, 1024, 32, 128]
    - [15, 57.142]
  - - [289, 768, 32, 192]
    - [6, 66.945]
  - - [289, 1120, 1, 192]
    - [19, 22.587]
  - - [196, 512, 32, 112]
    - [7, 42.655]
  - - [1001, 2048, 1, 32]
    - [59, 15.895]
  - - [1225, 288, 32, 64]
    - [7, 38.308]
  - - [196, 600, 1, 64]
    - [38, 4.038]
  - - [1225, 384, 32, 192]
    - [11, 77.621]
  - - [50176, 256, 1, 512]
    - [6, 91.704]
  - - [196, 512, 32, 160]
    - [6, 50.557]
  - - [4096, 4096, 1, 512]
    - [6, 93.146]
  - - [49, 832, 32, 192]
    - [15, 40.459]
  - - [1225, 256, 32, 64]
    - [7, 38.851]
  - - [64, 2048, 32, 320]
    - [15, 71.838]
  - - [196, 480, 32, 16]
    - [13, 9.317]
  - - [1225, 256, 32, 48]
    - [7, 30.879]
  - - [64, 1280, 32, 448]
    - [7, 76.705]
  - - [1225, 1200, 1, 64]
    - [15, 24.367]
  - - [1225, 384, 32, 64]
    - [7, 40.051]
  - - [12544, 512, 1, 1024]
    - [15, 89.978]
  - - [64, 1280, 32, 192]
    - [7, 59.849]
  - - [196, 512, 32, 64]
    - [6, 29.218]
  - - [289, 1792, 1, 256]
    - [69, 31.282]
  - - [196, 528, 32, 256]
    - [6, 55.694]
  - - [64, 2048, 32, 192]
    - [15, 61.721]
  - - [196, 528, 32, 160]
    - [7, 47.853]
  - - [1225, 192, 32, 48]
    - [57, 29.125]
  - - [64, 1728, 1, 192]
    - [24, 9.57]
  - - [1001, 2048, 1, 64]
    - [65, 26.163]
  - - [5329, 64, 128, 80]
    - [57, 38.295]
  - - [64, 1280, 128, 448]
    - [15, 84.445]
  - - [289, 768, 128, 128]
    - [15, 62.911]
  - - [1225, 192, 128, 64]
    - [15, 40.613]
  - - [1225, 288, 128, 48]
    - [7, 32.432]
  - - [289, 768, 128, 192]
    - [6, 73.38]
  - - [289, 768, 128, 160]
    - [6, 68.216]
  - - [64, 2048, 128, 192]
    - [15, 66.226]
  - - [64, 1280, 128, 384]
    - [15, 80.973]
  - - [1225, 256, 128, 48]
    - [77, 33.371]
  - - [1225, 192, 128, 48]
    - [78, 32.578]
  - - [1225, 288, 128, 64]
    - [7, 41.165]
  - - [64, 1280, 128, 320]
    - [15, 78.068]
  - - [1225, 256, 128, 64]
    - [7, 41.526]
  - - [1001, 2048, 1, 128]
    - [15, 43.159]
  - - [1225, 192, 128, 32]
    - [79, 23.329]
  - - [64, 1280, 128, 192]
    - [15, 64.715]
  - - [1001, 1536, 1, 64]
    - [6, 25.934]
  - - [65, 1024, 1, 6400]
    - [20, 23.383]
  - - [256, 4096, 1, 6400]
    - [10, 79.883]
  - - [1024, 4096, 1, 64]
    - [11, 42.299]
  - - [1024, 4096, 1, 6336]
    - [11, 90.048]
  - - [64, 38, 840, 38]
    - [7, 13.353]
  - - [64, 49, 648, 49]
    - [80, 17.259]
  - - [512, 2048, 1, 3427]
    - [10, 76.606]
  - - [512, 2048, 1, 3552]
    - [10, 78.216]
  - - [512, 2048, 1, 3840]
    - [10, 78.25]
  - - [512, 33708, 1, 3780]
    - [15, 95.01]
  - - [512, 33708, 1, 3968]
    - [15, 95.271]
  - - [512, 33708, 1, 4030]
    - [7, 94.539]
  - - [2048, 512, 1, 3427]
    - [10, 76.425]
  - - [2048, 512, 1, 3452]
    - [14, 74.691]
  - - [2048, 512, 1, 3472]
    - [10, 75.435]
  - - [2048, 512, 1, 3475]
    - [14, 75.396]
  - - [64, 12, 2520, 12]
    - [61, 3.995]
  - - [64, 13, 2336, 13]
    - [61, 4.431]
  - - [64, 14, 2184, 14]
    - [61, 4.978]
  - - [64, 15, 2048, 15]
    - [61, 5.561]
  - - [64, 16, 1920, 16]
    - [75, 7.124]
  - - [64, 17, 1816, 17]
    - [67, 5.202]
  - - [64, 18, 1720, 18]
    - [62, 5.601]
  - - [64, 19, 1632, 19]
    - [62, 5.819]
  - - [64, 21, 1488, 21]
    - [63, 6.246]
  - - [64, 23, 1360, 23]
    - [61, 6.781]
  - - [64, 25, 1256, 25]
    - [61, 7.807]
  - - [64, 27, 1168, 27]
    - [61, 8.527]
  - - [64, 29, 1088, 29]
    - [61, 10.309]
  - - [64, 32, 992, 32]
    - [60, 14.872]
  - - [64, 35, 904, 35]
    - [65, 11.918]
  - - [64, 41, 776, 41]
    - [7, 13.782]
  - - [64, 45, 712, 45]
    - [6, 15.013]
  - - [64, 54, 592, 54]
    - [80, 18.86]
  - - [64, 59, 544, 59]
    - [80, 19.031]
  - - [64, 64, 496, 64]
    - [80, 24.621]
  - - [64, 64, 496, 65]
    - [16, 23.901]
  - - [64, 65, 496, 65]
    - [13, 21.82]
  - - [64, 71, 448, 71]
    - [13, 23.346]
  - - [64, 77, 408, 77]
    - [13, 23.731]
  - - [64, 77, 408, 78]
    - [13, 23.958]
  - - [64, 78, 408, 78]
    - [13, 23.629]
  - - [64, 85, 376, 85]
    - [7, 25.522]
  - - [64, 93, 344, 93]
    - [9, 25.77]
  - - [64, 112, 288, 112]
    - [64, 33.29]
  - - [64, 122, 264, 122]
    - [80, 30.965]
  - - [64, 123, 264, 122]
    - [7, 31.564]
  - - [64, 123, 264, 123]
    - [80, 32.914]
  - - [64, 134, 240, 134]
    - [7, 34.527]
  - - [64, 135, 240, 134]
    - [9, 34.784]
  - - [64, 135, 240, 135]
    - [9, 35.043]
  - - [49, 512, 64, 2048]
    - [15, 65.082]
  - - [49, 2048, 64, 512]
    - [15, 66.395]
  - - [64, 1280, 64, 192]
    - [7, 63.007]
  - - [64, 1280, 64, 320]
    - [15, 75.989]
  - - [64, 1280, 64, 384]
    - [15, 79.172]
  - - [64, 1280, 64, 448]
    - [15, 82.056]
  - - [64, 2048, 64, 192]
    - [15, 64.177]
  - - [64, 2048, 64, 320]
    - [15, 77.004]
  - - [64, 2048, 64, 384]
    - [15, 79.763]
  - - [64, 2048, 64, 448]
    - [7, 82.94]
  - - [196, 256, 64, 1024]
    - [48, 68.418]
  - - [196, 1024, 64, 256]
    - [15, 69.281]
  - - [289, 768, 64, 128]
    - [15, 60.428]
  - - [289, 768, 64, 160]
    - [6, 65.658]
  - - [289, 768, 64, 192]
    - [6, 70.598]
  - - [784, 128, 64, 512]
    - [6, 81.92]
  - - [784, 512, 64, 128]
    - [15, 74.319]
  - - [1225, 192, 64, 32]
    - [9, 22.242]
  - - [1225, 192, 64, 48]
    - [7, 31.4]
  - - [1225, 192, 64, 64]
    - [7, 39.255]
  - - [1225, 256, 64, 48]
    - [7, 32.376]
  - - [1225, 256, 64, 64]
    - [7, 40.852]
  - - [1225, 288, 64, 48]
    - [7, 31.903]
  - - [1225, 288, 64, 64]
    - [7, 40.101]
  - - [3136, 64, 64, 64]
    - [57, 41.441]
  - - [3136, 64, 64, 256]
    - [11, 75.802]
  - - [3136, 256, 64, 64]
    - [57, 54.846]
  - - [5329, 64, 64, 80]
    - [57, 39.328]
  - - [1024, 2, 1, 512]
    - [24, 0.358]
  - - [1024, 2, 1, 3072]
    - [119, 0.75]
  - - [1024, 2, 1, 6]
    - [67, 0.009]
  - - [33, 32, 1600, 33]
    - [4, 9.739]
  - - [33, 32, 200, 33]
    - [67, 3.49]
  - - [3, 64, 512, 3]
    - [81, 0.18]
  - - [256, 44505, 1, 8976]
    - [11, 94.641]
  - - [9, 64, 512, 9]
    - [67, 1.233]
  - - [1024, 1, 1, 200]
    - [24, 0.088]
  - - [257, 4096, 1, 1024]
    - [15, 64.428]
  - - [2048, 1, 1, 512]
    - [28, 0.342]
  - - [67, 2048, 1, 512]
    - [5, 20.296]
  - - [1024, 256, 1, 33536]
    - [121, 72.363]
  - - [5, 64, 512, 5]
    - [63, 0.393]
  - - [512, 2048, 1, 2790]
    - [10, 74.868]
  - - [512, 2048, 1, 2864]
    - [14, 74.199]
  - - [512, 2048, 1, 3092]
    - [14, 74.472]
  - - [512, 2048, 1, 3113]
    - [10, 75.284]
  - - [512, 2048, 1, 3137]
    - [10, 75.865]
  - - [512, 2048, 1, 3165]
    - [14, 73.786]
  - - [512, 2048, 1, 3166]
    - [14, 73.483]
  - - [512, 2048, 1, 3194]
    - [14, 74.133]
  - - [512, 2048, 1, 3219]
    - [14, 75.081]
  - - [512, 2048, 1, 3222]
    - [10, 74.308]
  - - [512, 2048, 1, 3234]
    - [10, 76.336]
  - - [512, 2048, 1, 3237]
    - [10, 76.14]
  - - [512, 2048, 1, 3242]
    - [10, 75.469]
  - - [512, 2048, 1, 3246]
    - [10, 75.008]
  - - [512, 2048, 1, 3249]
    - [10, 74.712]
  - - [512, 2048, 1, 3251]
    - [14, 74.867]
  - - [512, 2048, 1, 3257]
    - [49, 73.748]
  - - [512, 2048, 1, 3262]
    - [14, 74.073]
  - - [512, 2048, 1, 3268]
    - [10, 76.262]
  - - [512, 2048, 1, 3282]
    - [14, 74.779]
  - - [512, 2048, 1, 3286]
    - [14, 74.297]
  - - [512, 2048, 1, 3287]
    - [14, 74.606]
  - - [512, 2048, 1, 3293]
    - [14, 74.349]
  - - [512, 2048, 1, 3297]
    - [10, 76.523]
  - - [512, 2048, 1, 3307]
    - [10, 75.567]
  - - [512, 2048, 1, 3314]
    - [10, 74.823]
  - - [512, 2048, 1, 3315]
    - [14, 75.277]
  - - [512, 2048, 1, 3319]
    - [14, 74.332]
  - - [512, 2048, 1, 3322]
    - [10, 74.223]
  - - [512, 2048, 1, 3323]
    - [49, 74.316]
  - - [512, 2048, 1, 3324]
    - [49, 74.163]
  - - [512, 2048, 1, 3325]
    - [14, 74.466]
  - - [512, 2048, 1, 3327]
    - [14, 74.055]
  - - [512, 2048, 1, 3329]
    - [10, 76.551]
  - - [512, 2048, 1, 3332]
    - [10, 76.139]
  - - [512, 2048, 1, 3336]
    - [10, 75.681]
  - - [512, 2048, 1, 3339]
    - [14, 75.532]
  - - [512, 2048, 1, 3342]
    - [10, 75.204]
  - - [512, 2048, 1, 3344]
    - [10, 74.999]
  - - [512, 2048, 1, 3358]
    - [14, 74.395]
  - - [512, 2048, 1, 3360]
    - [10, 77.453]
  - - [512, 2048, 1, 3364]
    - [10, 76.39]
  - - [512, 2048, 1, 3365]
    - [10, 76.266]
  - - [512, 2048, 1, 3369]
    - [10, 76.065]
  - - [512, 2048, 1, 3371]
    - [10, 75.604]
  - - [512, 2048, 1, 3374]
    - [10, 75.528]
  - - [512, 2048, 1, 3376]
    - [10, 75.04]
  - - [512, 2048, 1, 3377]
    - [14, 75.168]
  - - [512, 2048, 1, 3378]
    - [10, 74.873]
  - - [512, 2048, 1, 3381]
    - [49, 74.485]
  - - [512, 2048, 1, 3382]
    - [10, 74.681]
  - - [512, 2048, 1, 3383]
    - [10, 74.599]
  - - [512, 2048, 1, 3384]
    - [14, 74.795]
  - - [512, 2048, 1, 3385]
    - [14, 74.4]
  - - [512, 2048, 1, 3386]
    - [49, 74.214]
  - - [512, 2048, 1, 3388]
    - [14, 74.397]
  - - [512, 2048, 1, 3390]
    - [14, 74.337]
  - - [512, 2048, 1, 3391]
    - [14, 74.359]
  - - [512, 2048, 1, 3396]
    - [10, 76.31]
  - - [512, 2048, 1, 3399]
    - [10, 76.196]
  - - [512, 2048, 1, 3402]
    - [10, 75.653]
  - - [512, 2048, 1, 3410]
    - [10, 75.124]
  - - [512, 2048, 1, 3412]
    - [10, 74.819]
  - - [512, 2048, 1, 3414]
    - [14, 74.69]
  - - [512, 2048, 1, 3415]
    - [10, 74.85]
  - - [512, 2048, 1, 3418]
    - [14, 74.639]
  - - [512, 2048, 1, 3420]
    - [14, 74.821]
  - - [512, 2048, 1, 3422]
    - [49, 74.451]
  - - [512, 2048, 1, 3425]
    - [10, 76.308]
  - - [512, 2048, 1, 3426]
    - [10, 76.511]
  - - [512, 2048, 1, 3428]
    - [10, 76.665]
  - - [512, 2048, 1, 3430]
    - [10, 76.348]
  - - [512, 2048, 1, 3431]
    - [10, 76.334]
  - - [512, 2048, 1, 3432]
    - [10, 75.785]
  - - [512, 2048, 1, 3438]
    - [10, 75.494]
  - - [512, 2048, 1, 3439]
    - [10, 75.376]
  - - [512, 2048, 1, 3440]
    - [10, 75.259]
  - - [512, 2048, 1, 3443]
    - [14, 74.839]
  - - [512, 2048, 1, 3445]
    - [14, 74.848]
  - - [512, 2048, 1, 3447]
    - [10, 74.926]
  - - [512, 2048, 1, 3448]
    - [10, 74.707]
  - - [512, 2048, 1, 3450]
    - [14, 74.545]
  - - [512, 2048, 1, 3451]
    - [14, 74.772]
  - - [512, 2048, 1, 3452]
    - [49, 74.249]
  - - [512, 2048, 1, 3453]
    - [14, 74.576]
  - - [512, 2048, 1, 3455]
    - [14, 75.065]
  - - [512, 2048, 1, 3456]
    - [10, 77.584]
  - - [512, 2048, 1, 3457]
    - [10, 76.588]
  - - [512, 2048, 1, 3458]
    - [10, 76.646]
  - - [512, 2048, 1, 3459]
    - [10, 76.525]
  - - [512, 2048, 1, 3460]
    - [10, 76.475]
  - - [512, 2048, 1, 3461]
    - [10, 76.39]
  - - [512, 2048, 1, 3462]
    - [10, 76.163]
  - - [512, 2048, 1, 3466]
    - [10, 75.757]
  - - [512, 2048, 1, 3467]
    - [10, 76.167]
  - - [512, 2048, 1, 3468]
    - [10, 75.906]
  - - [512, 2048, 1, 3470]
    - [10, 75.288]
  - - [512, 2048, 1, 3471]
    - [10, 75.726]
  - - [512, 2048, 1, 3472]
    - [14, 75.504]
  - - [512, 2048, 1, 3475]
    - [10, 75.155]
  - - [512, 2048, 1, 3476]
    - [10, 75.211]
  - - [512, 2048, 1, 3477]
    - [14, 74.889]
  - - [512, 2048, 1, 3478]
    - [10, 74.911]
  - - [512, 2048, 1, 3479]
    - [10, 74.796]
  - - [512, 2048, 1, 3480]
    - [10, 75.022]
  - - [512, 2048, 1, 3481]
    - [14, 75.112]
  - - [512, 2048, 1, 3483]
    - [10, 74.678]
  - - [512, 2048, 1, 3484]
    - [14, 75.006]
  - - [512, 2048, 1, 3487]
    - [14, 74.866]
  - - [512, 2048, 1, 3489]
    - [10, 76.543]
  - - [512, 2048, 1, 3490]
    - [10, 76.565]
  - - [512, 2048, 1, 3491]
    - [10, 76.587]
  - - [512, 2048, 1, 3493]
    - [10, 76.631]
  - - [512, 2048, 1, 3494]
    - [10, 76.228]
  - - [512, 2048, 1, 3495]
    - [10, 76.25]
  - - [512, 2048, 1, 3497]
    - [14, 75.596]
  - - [512, 2048, 1, 3498]
    - [10, 75.756]
  - - [512, 2048, 1, 3499]
    - [10, 75.952]
  - - [512, 2048, 1, 3501]
    - [10, 75.544]
  - - [512, 2048, 1, 3503]
    - [14, 75.518]
  - - [512, 2048, 1, 3507]
    - [14, 75.227]
  - - [512, 2048, 1, 3508]
    - [10, 75.01]
  - - [512, 2048, 1, 3509]
    - [10, 74.963]
  - - [512, 2048, 1, 3511]
    - [10, 74.871]
  - - [512, 2048, 1, 3514]
    - [14, 74.833]
  - - [512, 2048, 1, 3515]
    - [49, 74.686]
  - - [512, 2048, 1, 3517]
    - [14, 74.83]
  - - [512, 2048, 1, 3518]
    - [14, 74.851]
  - - [512, 2048, 1, 3519]
    - [14, 75.143]
  - - [512, 2048, 1, 3520]
    - [10, 77.874]
  - - [512, 2048, 1, 3523]
    - [10, 76.613]
  - - [512, 2048, 1, 3528]
    - [10, 76.301]
  - - [512, 2048, 1, 3529]
    - [10, 76.183]
  - - [512, 2048, 1, 3530]
    - [10, 76.17]
  - - [512, 2048, 1, 3532]
    - [10, 75.867]
  - - [512, 2048, 1, 3533]
    - [10, 75.716]
  - - [512, 2048, 1, 3534]
    - [10, 75.806]
  - - [512, 2048, 1, 3538]
    - [10, 75.583]
  - - [512, 2048, 1, 3539]
    - [10, 75.332]
  - - [512, 2048, 1, 3541]
    - [10, 75.239]
  - - [512, 2048, 1, 3547]
    - [14, 75.062]
  - - [512, 2048, 1, 3548]
    - [14, 74.682]
  - - [512, 2048, 1, 3564]
    - [10, 76.207]
  - - [512, 2048, 1, 3575]
    - [14, 75.15]
  - - [512, 2048, 1, 3598]
    - [10, 75.938]
  - - [512, 2048, 1, 3599]
    - [10, 75.824]
  - - [512, 2048, 1, 3608]
    - [49, 75.01]
  - - [512, 2048, 1, 3780]
    - [10, 76.994]
  - - [512, 2048, 1, 3796]
    - [10, 75.72]
  - - [512, 2048, 1, 3822]
    - [10, 76.271]
  - - [512, 2048, 1, 3859]
    - [10, 75.856]
  - - [512, 2048, 1, 3870]
    - [49, 75.414]
  - - [512, 2048, 1, 3876]
    - [10, 76.959]
  - - [512, 2048, 1, 3906]
    - [10, 77.392]
  - - [512, 2048, 1, 3910]
    - [10, 76.891]
  - - [512, 2048, 1, 3925]
    - [10, 75.674]
  - - [512, 2048, 1, 3942]
    - [10, 77.071]
  - - [512, 2048, 1, 3944]
    - [10, 76.888]
  - - [512, 2048, 1, 3955]
    - [10, 75.912]
  - - [512, 2048, 1, 3968]
    - [10, 78.39]
  - - [512, 2048, 1, 3969]
    - [10, 77.471]
  - - [512, 2048, 1, 3976]
    - [10, 76.783]
  - - [512, 2048, 1, 3977]
    - [10, 76.614]
  - - [512, 2048, 1, 3978]
    - [10, 76.853]
  - - [512, 2048, 1, 3990]
    - [14, 76.028]
  - - [512, 2048, 1, 3995]
    - [14, 75.605]
  - - [512, 2048, 1, 3996]
    - [14, 75.503]
  - - [512, 2048, 1, 3999]
    - [14, 75.802]
  - - [512, 2048, 1, 4005]
    - [10, 77.185]
  - - [512, 2048, 1, 4012]
    - [10, 76.478]
  - - [512, 2048, 1, 4020]
    - [14, 75.926]
  - - [512, 2048, 1, 4026]
    - [10, 75.827]
  - - [512, 2048, 1, 4030]
    - [14, 75.481]
  - - [512, 2048, 1, 4032]
    - [10, 78.216]
  - - [512, 33708, 1, 3796]
    - [6, 94.946]
  - - [512, 33708, 1, 3822]
    - [15, 94.828]
  - - [512, 33708, 1, 3840]
    - [15, 95.311]
  - - [512, 33708, 1, 3859]
    - [7, 94.847]
  - - [512, 33708, 1, 3870]
    - [6, 94.562]
  - - [512, 33708, 1, 3876]
    - [15, 95.022]
  - - [512, 33708, 1, 3906]
    - [15, 94.976]
  - - [512, 33708, 1, 3910]
    - [15, 95.04]
  - - [512, 33708, 1, 3925]
    - [6, 94.815]
  - - [512, 33708, 1, 3942]
    - [15, 95.076]
  - - [512, 33708, 1, 3944]
    - [15, 95.038]
  - - [512, 33708, 1, 3955]
    - [6, 94.874]
  - - [512, 33708, 1, 3969]
    - [15, 95.099]
  - - [512, 33708, 1, 3976]
    - [15, 95.029]
  - - [512, 33708, 1, 3977]
    - [15, 94.91]
  - - [512, 33708, 1, 3978]
    - [15, 95.004]
  - - [512, 33708, 1, 3990]
    - [7, 94.845]
  - - [512, 33708, 1, 3995]
    - [6, 94.726]
  - - [512, 33708, 1, 3996]
    - [7, 94.744]
  - - [512, 33708, 1, 3999]
    - [7, 94.539]
  - - [512, 33708, 1, 4005]
    - [15, 95.056]
  - - [512, 33708, 1, 4012]
    - [15, 94.921]
  - - [512, 33708, 1, 4020]
    - [7, 94.888]
  - - [512, 33708, 1, 4026]
    - [7, 94.759]
  - - [512, 33708, 1, 4032]
    - [15, 95.31]
  - - [2048, 512, 1, 2790]
    - [10, 74.572]
  - - [2048, 512, 1, 2864]
    - [14, 74.444]
  - - [2048, 512, 1, 3092]
    - [14, 74.586]
  - - [2048, 512, 1, 3113]
    - [10, 75.131]
  - - [2048, 512, 1, 3137]
    - [10, 75.517]
  - - [2048, 512, 1, 3165]
    - [14, 74.521]
  - - [2048, 512, 1, 3166]
    - [14, 74.768]
  - - [2048, 512, 1, 3194]
    - [14, 74.757]
  - - [2048, 512, 1, 3219]
    - [14, 74.639]
  - - [2048, 512, 1, 3222]
    - [14, 74.819]
  - - [2048, 512, 1, 3234]
    - [10, 75.994]
  - - [2048, 512, 1, 3237]
    - [14, 75.353]
  - - [2048, 512, 1, 3242]
    - [10, 75.469]
  - - [2048, 512, 1, 3246]
    - [14, 74.825]
  - - [2048, 512, 1, 3249]
    - [14, 75.187]
  - - [2048, 512, 1, 3251]
    - [14, 75.05]
  - - [2048, 512, 1, 3257]
    - [14, 74.75]
  - - [2048, 512, 1, 3262]
    - [14, 74.792]
  - - [2048, 512, 1, 3268]
    - [10, 75.701]
  - - [2048, 512, 1, 3282]
    - [14, 75.032]
  - - [2048, 512, 1, 3286]
    - [14, 74.979]
  - - [2048, 512, 1, 3287]
    - [14, 74.785]
  - - [2048, 512, 1, 3293]
    - [14, 74.67]
  - - [2048, 512, 1, 3297]
    - [10, 75.668]
  - - [2048, 512, 1, 3307]
    - [14, 75.313]
  - - [2048, 512, 1, 3314]
    - [14, 74.716]
  - - [2048, 512, 1, 3315]
    - [14, 74.989]
  - - [2048, 512, 1, 3319]
    - [14, 74.9]
  - - [2048, 512, 1, 3322]
    - [14, 74.47]
  - - [2048, 512, 1, 3323]
    - [14, 74.847]
  - - [2048, 512, 1, 3324]
    - [14, 74.692]
  - - [2048, 512, 1, 3325]
    - [14, 75.143]
  - - [2048, 512, 1, 3327]
    - [14, 74.902]
  - - [2048, 512, 1, 3329]
    - [10, 75.96]
  - - [2048, 512, 1, 3332]
    - [10, 76.323]
  - - [2048, 512, 1, 3336]
    - [10, 75.754]
  - - [2048, 512, 1, 3339]
    - [14, 75.244]
  - - [2048, 512, 1, 3342]
    - [14, 75.419]
  - - [2048, 512, 1, 3344]
    - [14, 75.141]
  - - [2048, 512, 1, 3358]
    - [14, 75.241]
  - - [2048, 512, 1, 3360]
    - [10, 77.189]
  - - [2048, 512, 1, 3364]
    - [10, 75.952]
  - - [2048, 512, 1, 3365]
    - [10, 76.011]
  - - [2048, 512, 1, 3369]
    - [14, 75.847]
  - - [2048, 512, 1, 3371]
    - [14, 75.64]
  - - [2048, 512, 1, 3374]
    - [14, 75.6]
  - - [2048, 512, 1, 3376]
    - [14, 75.359]
  - - [2048, 512, 1, 3377]
    - [14, 75.595]
  - - [2048, 512, 1, 3378]
    - [14, 75.582]
  - - [2048, 512, 1, 3381]
    - [14, 74.974]
  - - [2048, 512, 1, 3382]
    - [14, 75.067]
  - - [2048, 512, 1, 3383]
    - [14, 75.337]
  - - [2048, 512, 1, 3384]
    - [14, 75.182]
  - - [2048, 512, 1, 3385]
    - [14, 74.922]
  - - [2048, 512, 1, 3386]
    - [14, 75.015]
  - - [2048, 512, 1, 3388]
    - [14, 75.13]
  - - [2048, 512, 1, 3390]
    - [14, 74.858]
  - - [2048, 512, 1, 3391]
    - [14, 75.196]
  - - [2048, 512, 1, 3396]
    - [10, 76.31]
  - - [2048, 512, 1, 3399]
    - [14, 75.622]
  - - [2048, 512, 1, 3402]
    - [14, 75.582]
  - - [2048, 512, 1, 3410]
    - [14, 75.547]
  - - [2048, 512, 1, 3412]
    - [14, 75.308]
  - - [2048, 512, 1, 3414]
    - [14, 75.212]
  - - [2048, 512, 1, 3415]
    - [14, 75.516]
  - - [2048, 512, 1, 3418]
    - [14, 75.16]
  - - [2048, 512, 1, 3420]
    - [14, 75.03]
  - - [2048, 512, 1, 3422]
    - [14, 75.178]
  - - [2048, 512, 1, 3425]
    - [10, 76.129]
  - - [2048, 512, 1, 3426]
    - [10, 76.223]
  - - [2048, 512, 1, 3428]
    - [14, 76.231]
  - - [2048, 512, 1, 3430]
    - [10, 76.24]
  - - [2048, 512, 1, 3431]
    - [10, 76.047]
  - - [2048, 512, 1, 3432]
    - [10, 75.963]
  - - [2048, 512, 1, 3438]
    - [14, 75.494]
  - - [2048, 512, 1, 3439]
    - [14, 75.622]
  - - [2048, 512, 1, 3440]
    - [14, 75.398]
  - - [2048, 512, 1, 3443]
    - [14, 75.464]
  - - [2048, 512, 1, 3445]
    - [14, 75.229]
  - - [2048, 512, 1, 3447]
    - [14, 75.099]
  - - [2048, 512, 1, 3448]
    - [14, 74.81]
  - - [2048, 512, 1, 3450]
    - [14, 75.303]
  - - [2048, 512, 1, 3451]
    - [14, 74.979]
  - - [2048, 512, 1, 3453]
    - [14, 75.195]
  - - [2048, 512, 1, 3455]
    - [14, 75.1]
  - - [2048, 512, 1, 3456]
    - [10, 77.072]
  - - [2048, 512, 1, 3457]
    - [14, 76.124]
  - - [2048, 512, 1, 3458]
    - [14, 76.288]
  - - [2048, 512, 1, 3459]
    - [10, 76.418]
  - - [2048, 512, 1, 3460]
    - [10, 76.155]
  - - [2048, 512, 1, 3461]
    - [10, 76.035]
  - - [2048, 512, 1, 3462]
    - [10, 75.775]
  - - [2048, 512, 1, 3466]
    - [14, 75.862]
  - - [2048, 512, 1, 3467]
    - [10, 75.955]
  - - [2048, 512, 1, 3468]
    - [10, 75.626]
  - - [2048, 512, 1, 3470]
    - [14, 76.021]
  - - [2048, 512, 1, 3471]
    - [14, 75.587]
  - - [2048, 512, 1, 3476]
    - [14, 75.487]
  - - [2048, 512, 1, 3477]
    - [14, 75.752]
  - - [2048, 512, 1, 3478]
    - [14, 75.288]
  - - [2048, 512, 1, 3479]
    - [14, 74.966]
  - - [2048, 512, 1, 3480]
    - [14, 75.297]
  - - [2048, 512, 1, 3481]
    - [14, 75.457]
  - - [2048, 512, 1, 3483]
    - [14, 74.712]
  - - [2048, 512, 1, 3484]
    - [14, 75.109]
  - - [2048, 512, 1, 3487]
    - [14, 75.07]
  - - [2048, 512, 1, 3489]
    - [10, 76.154]
  - - [2048, 512, 1, 3490]
    - [10, 76.353]
  - - [2048, 512, 1, 3491]
    - [10, 76.304]
  - - [2048, 512, 1, 3493]
    - [14, 76.277]
  - - [2048, 512, 1, 3494]
    - [10, 76.158]
  - - [2048, 512, 1, 3495]
    - [10, 75.865]
  - - [2048, 512, 1, 3497]
    - [14, 75.734]
  - - [2048, 512, 1, 3498]
    - [10, 75.791]
  - - [2048, 512, 1, 3499]
    - [14, 76.162]
  - - [2048, 512, 1, 3501]
    - [14, 76.1]
  - - [2048, 512, 1, 3503]
    - [14, 75.381]
  - - [2048, 512, 1, 3507]
    - [14, 75.398]
  - - [2048, 512, 1, 3508]
    - [14, 75.282]
  - - [2048, 512, 1, 3509]
    - [14, 75.338]
  - - [2048, 512, 1, 3511]
    - [14, 75.381]
  - - [2048, 512, 1, 3514]
    - [14, 74.901]
  - - [2048, 512, 1, 3515]
    - [14, 75.092]
  - - [2048, 512, 1, 3517]
    - [14, 75.033]
  - - [2048, 512, 1, 3518]
    - [14, 74.784]
  - - [2048, 512, 1, 3519]
    - [14, 75.177]
  - - [2048, 512, 1, 3520]
    - [10, 77.511]
  - - [2048, 512, 1, 3523]
    - [10, 76.578]
  - - [2048, 512, 1, 3528]
    - [10, 76.231]
  - - [2048, 512, 1, 3529]
    - [10, 76.113]
  - - [2048, 512, 1, 3530]
    - [10, 76.135]
  - - [2048, 512, 1, 3532]
    - [14, 75.251]
  - - [2048, 512, 1, 3533]
    - [14, 75.579]
  - - [2048, 512, 1, 3534]
    - [10, 75.429]
  - - [2048, 512, 1, 3538]
    - [14, 75.413]
  - - [2048, 512, 1, 3539]
    - [14, 75.57]
  - - [2048, 512, 1, 3541]
    - [14, 75.408]
  - - [2048, 512, 1, 3547]
    - [14, 74.962]
  - - [2048, 512, 1, 3548]
    - [14, 75.388]
  - - [2048, 512, 1, 3552]
    - [10, 77.494]
  - - [2048, 512, 1, 3564]
    - [10, 75.796]
  - - [2048, 512, 1, 3575]
    - [14, 75.15]
  - - [2048, 512, 1, 3598]
    - [14, 76.074]
  - - [2048, 512, 1, 3599]
    - [14, 75.655]
  - - [2048, 512, 1, 3608]
    - [14, 75.308]
  - - [2048, 512, 1, 3780]
    - [14, 76.729]
  - - [2048, 512, 1, 3796]
    - [14, 75.88]
  - - [2048, 512, 1, 3822]
    - [14, 76.303]
  - - [2048, 512, 1, 3840]
    - [10, 77.647]
  - - [2048, 512, 1, 3859]
    - [14, 76.269]
  - - [2048, 512, 1, 3870]
    - [14, 75.978]
  - - [2048, 512, 1, 3876]
    - [10, 76.83]
  - - [2048, 512, 1, 3906]
    - [10, 77.295]
  - - [2048, 512, 1, 3910]
    - [14, 76.923]
  - - [2048, 512, 1, 3925]
    - [14, 76.047]
  - - [2048, 512, 1, 3942]
    - [10, 76.596]
  - - [2048, 512, 1, 3944]
    - [10, 76.919]
  - - [2048, 512, 1, 3955]
    - [14, 75.819]
  - - [2048, 512, 1, 3968]
    - [10, 77.934]
  - - [2048, 512, 1, 3969]
    - [10, 77.184]
  - - [2048, 512, 1, 3976]
    - [10, 76.783]
  - - [2048, 512, 1, 3977]
    - [14, 76.396]
  - - [2048, 512, 1, 3978]
    - [14, 76.603]
  - - [2048, 512, 1, 3990]
    - [14, 76.151]
  - - [2048, 512, 1, 3995]
    - [14, 76.123]
  - - [2048, 512, 1, 3996]
    - [14, 75.928]
  - - [2048, 512, 1, 3999]
    - [14, 75.954]
  - - [2048, 512, 1, 4005]
    - [10, 77.091]
  - - [2048, 512, 1, 4012]
    - [14, 76.912]
  - - [2048, 512, 1, 4020]
    - [14, 76.507]
  - - [2048, 512, 1, 4026]
    - [14, 75.948]
  - - [2048, 512, 1, 4030]
    - [14, 76.054]
  - - [2048, 512, 1, 4032]
    - [10, 78.152]
  - - [512, 512, 1, 3780]
    - [21, 50.007]
  - - [512, 512, 1, 3796]
    - [21, 49.884]
  - - [512, 512, 1, 3822]
    - [21, 50.114]
  - - [512, 512, 1, 3840]
    - [35, 50.688]
  - - [512, 512, 1, 3859]
    - [21, 49.934]
  - - [512, 512, 1, 3870]
    - [21, 49.804]
  - - [512, 512, 1, 3876]
    - [21, 49.826]
  - - [512, 512, 1, 3906]
    - [22, 50.103]
  - - [512, 512, 1, 3910]
    - [21, 50.046]
  - - [512, 512, 1, 3925]
    - [21, 49.913]
  - - [512, 512, 1, 3927]
    - [21, 49.832]
  - - [512, 512, 1, 3942]
    - [21, 50.129]
  - - [512, 512, 1, 3944]
    - [21, 50.155]
  - - [512, 512, 1, 3955]
    - [21, 50.079]
  - - [512, 512, 1, 3968]
    - [22, 50.843]
  - - [512, 512, 1, 3969]
    - [22, 50.149]
  - - [512, 512, 1, 3976]
    - [21, 50.077]
  - - [512, 512, 1, 3977]
    - [21, 50.036]
  - - [512, 512, 1, 3978]
    - [21, 50.155]
  - - [512, 512, 1, 3990]
    - [21, 50.199]
  - - [512, 512, 1, 3995]
    - [21, 49.838]
  - - [512, 512, 1, 3996]
    - [21, 50.061]
  - - [512, 512, 1, 3999]
    - [21, 49.835]
  - - [512, 512, 1, 4005]
    - [21, 50.281]
  - - [512, 512, 1, 4012]
    - [21, 49.997]
  - - [512, 512, 1, 4020]
    - [83, 49.73]
  - - [512, 512, 1, 4026]
    - [21, 50.119]
  - - [512, 512, 1, 4030]
    - [21, 49.853]
  - - [512, 512, 1, 4032]
    - [21, 50.836]
  - - [512, 512, 1, 4050]
    - [82, 50.153]
  - - [512, 512, 1, 4059]
    - [21, 49.899]
  - - [64, 102, 312, 102]
    - [9, 29.076]
  - - [64, 512, 16, 512]
    - [12, 44.313]
  - - [64, 512, 96, 512]
    - [7, 77.054]
  - - [1024, 3072, 1, 2048]
    - [15, 93.718]
  - - [1024, 3072, 1, 3072]
    - [15, 94.49]
  - - [1024, 30522, 1, 20]
    - [57, 19.229]
  - - [1024, 30522, 1, 80]
    - [11, 68.834]
  - - [1024, 30522, 1, 120]
    - [11, 77.18]
  - - [1024, 2, 1, 1]
    - [62, 0.001]
  - - [1024, 2, 1, 2048]
    - [45, 0.6]
  - - [1024, 1024, 1, 3840]
    - [10, 78.047]
  - - [1024, 1024, 1, 3968]
    - [14, 78.227]
  - - [1024, 1024, 1, 7200]
    - [10, 80.264]
  - - [1024, 1024, 1, 8160]
    - [10, 80.017]
  - - [1024, 1024, 1, 9520]
    - [10, 79.68]
  - - [1024, 1024, 1, 10200]
    - [10, 79.591]
  - - [1024, 4096, 1, 3840]
    - [11, 89.621]
  - - [1024, 4096, 1, 3968]
    - [11, 89.61]
  - - [1024, 4096, 1, 7200]
    - [11, 90.207]
  - - [1024, 4096, 1, 8160]
    - [11, 90.215]
  - - [1024, 4096, 1, 9520]
    - [11, 90.277]
  - - [1024, 4096, 1, 10200]
    - [11, 90.25]
  - - [1024, 42720, 1, 3968]
    - [11, 96.565]
  - - [1024, 42720, 1, 7200]
    - [11, 96.655]
  - - [1024, 42720, 1, 9520]
    - [11, 96.674]
  - - [4096, 1024, 1, 3840]
    - [11, 89.566]
  - - [4096, 1024, 1, 3968]
    - [11, 89.664]
  - - [4096, 1024, 1, 7200]
    - [11, 90.177]
  - - [4096, 1024, 1, 8160]
    - [11, 90.311]
  - - [4096, 1024, 1, 9520]
    - [11, 90.295]
  - - [4096, 1024, 1, 10200]
    - [11, 90.233]
  - - [17, 64, 1, 15]
    - [67, 0.011]
  - - [17, 64, 1, 17]
    - [24, 0.012]
  - - [30, 64, 1, 30]
    - [67, 0.033]
  - - [30, 64, 1, 31]
    - [84, 0.035]
  - - [31, 64, 1, 31]
    - [24, 0.035]
  - - [64, 17, 1, 15]
    - [62, 0.011]
  - - [64, 17, 1, 17]
    - [24, 0.012]
  - - [64, 30, 1, 30]
    - [67, 0.033]
  - - [64, 30, 1, 31]
    - [62, 0.034]
  - - [64, 31, 1, 31]
    - [24, 0.036]
  - - [14, 64, 1, 14]
    - [67, 0.009]
  - - [15, 64, 1, 14]
    - [67, 0.009]
  - - [15, 64, 1, 15]
    - [84, 0.009]
  - - [64, 14, 1, 14]
    - [24, 0.008]
  - - [64, 15, 1, 14]
    - [84, 0.009]
  - - [64, 15, 1, 15]
    - [62, 0.01]
  - - [5760, 5760, 1, 5760]
    - [114, 99.331]
  - - [7744, 7744, 1, 7744]
    - [6, 96.788]
  - - [384, 384, 1, 384]
    - [105, 43.995]
  - - [768, 768, 1, 384]
    - [106, 69.199]
  - - [1152, 1152, 1, 384]
    - [107, 87.99]
  - - [1536, 1536, 1, 384]
    - [108, 83.543]
  - - [1920, 1920, 1, 384]
    - [109, 88.27]
  - - [2304, 2304, 1, 384]
    - [109, 95.56]
  - - [2688, 2688, 1, 384]
    - [109, 92.721]
  - - [3072, 3072, 1, 384]
    - [108, 97.006]
  - - [3456, 3456, 1, 384]
    - [108, 96.964]
  - - [3840, 3840, 1, 384]
    - [109, 98.079]
  - - [4224, 4224, 1, 384]
    - [109, 97.95]
  - - [4608, 4608, 1, 384]
    - [109, 97.51]
  - - [4992, 4992, 1, 384]
    - [109, 98.011]
  - - [5376, 5376, 1, 384]
    - [108, 98.108]
  - - [5760, 5760, 1, 384]
    - [109, 98.849]
  - - [6144, 6144, 1, 384]
    - [110, 95.626]
  - - [6528, 6528, 1, 384]
    - [109, 99.072]
  - - [6912, 6912, 1, 384]
    - [109, 98.721]
  - - [7296, 7296, 1, 384]
    - [109, 98.861]
  - - [7680, 7680, 1, 384]
    - [108, 99.486]
  - - [384, 192, 1, 384]
    - [3, 10.458]
  - - [768, 384, 1, 384]
    - [19, 34.251]
  - - [1152, 576, 1, 384]
    - [8, 50.364]
  - - [1536, 768, 1, 384]
    - [7, 62.62]
  - - [1920, 960, 1, 384]
    - [7, 66.315]
  - - [2304, 1152, 1, 384]
    - [15, 80.302]
  - - [2688, 1344, 1, 384]
    - [15, 78.938]
  - - [3072, 1536, 1, 384]
    - [15, 83.923]
  - - [3456, 1728, 1, 384]
    - [15, 86.123]
  - - [3840, 1920, 1, 384]
    - [6, 87.872]
  - - [4224, 2112, 1, 384]
    - [15, 91.19]
  - - [4608, 2304, 1, 384]
    - [15, 91.09]
  - - [4992, 2496, 1, 384]
    - [15, 92.109]
  - - [5376, 2688, 1, 384]
    - [7, 91.906]
  - - [5760, 2880, 1, 384]
    - [15, 93.571]
  - - [6144, 3072, 1, 384]
    - [15, 94.211]
  - - [6528, 3264, 1, 384]
    - [6, 93.683]
  - - [6912, 3456, 1, 384]
    - [7, 93.952]
  - - [7296, 3648, 1, 384]
    - [7, 94.288]
  - - [7680, 3840, 1, 384]
    - [15, 94.739]
  - - [384, 768, 1, 384]
    - [19, 34.484]
  - - [768, 1536, 1, 384]
    - [7, 62.049]
  - - [1152, 2304, 1, 384]
    - [7, 80.442]
  - - [1536, 3072, 1, 384]
    - [7, 84.096]
  - - [1920, 3840, 1, 384]
    - [15, 88.359]
  - - [2304, 4608, 1, 384]
    - [15, 91.045]
  - - [2688, 5376, 1, 384]
    - [15, 91.939]
  - - [3072, 6144, 1, 384]
    - [15, 94.157]
  - - [3456, 6912, 1, 384]
    - [7, 93.91]
  - - [3840, 7680, 1, 384]
    - [15, 94.774]
  - - [4224, 8448, 1, 384]
    - [7, 95.035]
  - - [4608, 9216, 1, 384]
    - [15, 95.481]
  - - [4992, 9984, 1, 384]
    - [15, 95.877]
  - - [5376, 10752, 1, 384]
    - [15, 95.916]
  - - [5760, 11520, 1, 384]
    - [11, 96.173]
  - - [6144, 12288, 1, 384]
    - [15, 96.393]
  - - [6528, 13056, 1, 384]
    - [11, 96.414]
  - - [6912, 13824, 1, 384]
    - [7, 96.434]
  - - [7296, 14592, 1, 384]
    - [7, 96.582]
  - - [7680, 15360, 1, 384]
    - [11, 96.847]
  - - [1024, 2, 1, 32]
    - [24, 0.045]
  - - [1024, 1024, 1, 32]
    - [9, 12.395]
  - - [1024, 2, 1, 4]
    - [24, 0.006]
  - - [64, 128, 512, 128]
    - [15, 42.521]
  - - [64, 512, 64, 512]
    - [15, 73.652]
  - - [1024, 1024, 1, 1600]
    - [10, 73.621]
  - - [1024, 256, 1, 1024]
    - [19, 42.151]
  - - [1024, 256, 1, 10496]
    - [121, 64.082]
  - - [1024, 256, 1, 11520]
    - [121, 64.838]
  - - [1024, 256, 1, 12032]
    - [121, 65.807]
  - - [1024, 256, 1, 1280]
    - [19, 42.838]
  - - [1024, 256, 1, 13568]
    - [121, 66.455]
  - - [1024, 256, 1, 14336]
    - [121, 67.074]
  - - [1024, 256, 1, 14848]
    - [121, 67.414]
  - - [1024, 256, 1, 15104]
    - [121, 67.538]
  - - [1024, 256, 1, 15872]
    - [121, 67.449]
  - - [1024, 256, 1, 16128]
    - [121, 67.184]
  - - [1024, 256, 1, 17152]
    - [121, 67.702]
  - - [1024, 256, 1, 17408]
    - [121, 68.804]
  - - [1024, 256, 1, 18944]
    - [121, 69.117]
  - - [1024, 256, 1, 19712]
    - [121, 69.577]
  - - [1024, 256, 1, 19968]
    - [121, 69.628]
  - - [1024, 256, 1, 21248]
    - [121, 69.133]
  - - [1024, 256, 1, 21504]
    - [121, 68.809]
  - - [1024, 256, 1, 22016]
    - [121, 69.488]
  - - [1024, 256, 1, 2304]
    - [20, 46.849]
  - - [1024, 256, 1, 2816]
    - [22, 48.709]
  - - [1024, 256, 1, 28672]
    - [121, 72.408]
  - - [1024, 256, 1, 3072]
    - [35, 49.11]
  - - [1024, 256, 1, 3328]
    - [40, 49.455]
  - - [1024, 256, 1, 3584]
    - [35, 50.406]
  - - [1024, 256, 1, 4096]
    - [22, 50.883]
  - - [1024, 256, 1, 4352]
    - [30, 51.311]
  - - [1024, 256, 1, 4608]
    - [22, 51.698]
  - - [1024, 256, 1, 5120]
    - [22, 51.92]
  - - [1024, 256, 1, 5376]
    - [121, 53.371]
  - - [1024, 256, 1, 5632]
    - [121, 54.315]
  - - [1024, 256, 1, 6144]
    - [121, 55.62]
  - - [1024, 256, 1, 6400]
    - [121, 55.882]
  - - [1024, 256, 1, 7680]
    - [121, 58.347]
  - - [1024, 256, 1, 7936]
    - [121, 59.754]
  - - [1024, 256, 1, 8192]
    - [121, 60.563]
  - - [1024, 256, 1, 8448]
    - [121, 61.079]
  - - [1024, 256, 1, 9728]
    - [121, 63.25]
  - - [1024, 256, 1, 9984]
    - [121, 63.345]
  - - [2048, 2048, 1, 1024]
    - [11, 86.797]
  - - [2048, 256, 1, 1024]
    - [10, 53.41]
  - - [256, 10240, 1, 8976]
    - [11, 93.478]
  - - [256, 10496, 1, 8976]
    - [11, 95.764]
  - - [256, 11008, 1, 8976]
    - [33, 88.553]
  - - [256, 11264, 1, 8976]
    - [36, 90.775]
  - - [256, 11520, 1, 8976]
    - [36, 92.96]
  - - [256, 11776, 1, 8976]
    - [36, 94.503]
  - - [256, 12544, 1, 8976]
    - [11, 86.312]
  - - [256, 12800, 1, 8976]
    - [11, 88.062]
  - - [256, 1280, 1, 8976]
    - [21, 66.979]
  - - [256, 13312, 1, 8976]
    - [11, 91.518]
  - - [256, 13568, 1, 8976]
    - [11, 93.197]
  - - [256, 14336, 1, 8976]
    - [15, 87.23]
  - - [256, 14848, 1, 8976]
    - [85, 90.171]
  - - [256, 15104, 1, 8976]
    - [15, 91.656]
  - - [256, 15872, 1, 8976]
    - [11, 87.521]
  - - [256, 16128, 1, 8976]
    - [11, 88.89]
  - - [256, 17152, 1, 8976]
    - [11, 94.393]
  - - [256, 17408, 1, 8976]
    - [11, 95.786]
  - - [256, 18688, 1, 8976]
    - [15, 92.965]
  - - [256, 19968, 1, 8976]
    - [11, 91.809]
  - - [256, 20480, 1, 8976]
    - [11, 94.033]
  - - [256, 20992, 1, 8976]
    - [11, 96.363]
  - - [256, 21248, 1, 8976]
    - [15, 89.693]
  - - [256, 22016, 1, 8976]
    - [15, 92.807]
  - - [256, 2560, 1, 8976]
    - [12, 80.432]
  - - [256, 26112, 1, 8976]
    - [86, 95.712]
  - - [256, 2816, 1, 8976]
    - [87, 76.02]
  - - [256, 32512, 1, 8976]
    - [15, 93.971]
  - - [256, 3328, 1, 8976]
    - [88, 89.492]
  - - [256, 33536, 1, 8976]
    - [11, 92.775]
  - - [256, 3584, 1, 8976]
    - [33, 82.221]
  - - [256, 3840, 1, 8976]
    - [36, 88.446]
  - - [256, 4096, 1, 8976]
    - [10, 79.775]
  - - [256, 4352, 1, 8976]
    - [10, 84.555]
  - - [256, 4864, 1, 8976]
    - [21, 87.737]
  - - [256, 5120, 1, 8976]
    - [21, 92.274]
  - - [256, 5632, 1, 8976]
    - [14, 79.437]
  - - [256, 5888, 1, 8976]
    - [14, 83.036]
  - - [256, 6144, 1, 8976]
    - [10, 86.119]
  - - [256, 7168, 1, 8976]
    - [36, 85.586]
  - - [256, 8192, 1, 8976]
    - [21, 89.045]
  - - [256, 8960, 1, 8976]
    - [89, 81.981]
  - - [256, 9728, 1, 8976]
    - [89, 88.82]
  - - [256, 9984, 1, 8976]
    - [89, 91.093]
  - - [3200, 2048, 1, 1024]
    - [6, 91.287]
  - - [4096, 4096, 1, 1024]
    - [15, 94.361]
  - - [512, 2048, 1, 256]
    - [7, 49.782]
  - - [512, 3280, 1, 1600]
    - [15, 84.092]
  - - [512, 3280, 1, 200]
    - [7, 53.111]
  - - [512, 512, 1, 1600]
    - [20, 45.112]
  - - [560, 1024, 1, 1600]
    - [10, 60.986]
  - - [768, 2048, 1, 256]
    - [7, 58.725]
  - - [512, 32, 1, 1600]
    - [20, 4.783]
  - - [100, 2048, 1, 512]
    - [19, 26.4]
  - - [560, 1024, 1, 200]
    - [13, 29.534]
  - - [74, 2048, 1, 512]
    - [29, 22.855]
  - - [1024, 1024, 1, 960]
    - [10, 68.013]
  - - [1024, 64, 1, 960]
    - [34, 15.579]
  - - [1600, 1024, 1, 960]
    - [7, 79.376]
  - - [2048, 2048, 1, 960]
    - [11, 86.328]
  - - [74, 2048, 1, 960]
    - [19, 29.535]
  - - [1024, 3072, 1, 1024]
    - [15, 91.072]
  - - [1024, 3072, 1, 512]
    - [6, 86.41]
  - - [1024, 4096, 1, 2048]
    - [15, 90.808]
  - - [1024, 30528, 1, 2048]
    - [11, 96.447]
  - - [1024, 4096, 1, 4096]
    - [11, 89.569]
  - - [1024, 30528, 1, 4096]
    - [11, 96.538]
  - - [512, 64, 1, 512]
    - [34, 5.643]
  - - [384, 128, 1, 128]
    - [24, 3.186]
  - - [768, 128, 1, 128]
    - [24, 6.164]
  - - [1152, 128, 1, 128]
    - [29, 8.861]
  - - [1536, 128, 1, 128]
    - [24, 11.814]
  - - [1920, 128, 1, 128]
    - [47, 14.319]
  - - [2304, 128, 1, 128]
    - [47, 16.679]
  - - [2688, 128, 1, 128]
    - [29, 19.269]
  - - [3072, 128, 1, 128]
    - [47, 20.809]
  - - [3456, 128, 1, 128]
    - [44, 23.41]
  - - [3840, 128, 1, 128]
    - [4, 22.682]
  - - [4224, 128, 1, 128]
    - [4, 24.559]
  - - [4608, 128, 1, 128]
    - [27, 26.79]
  - - [4992, 128, 1, 128]
    - [31, 28.796]
  - - [5376, 128, 1, 128]
    - [31, 30.534]
  - - [5760, 128, 1, 128]
    - [27, 32.716]
  - - [6144, 128, 1, 128]
    - [31, 32.873]
  - - [6528, 128, 1, 128]
    - [55, 34.676]
  - - [6912, 128, 1, 128]
    - [55, 35.69]
  - - [7296, 128, 1, 128]
    - [4, 32.452]
  - - [7680, 128, 1, 128]
    - [6, 34.161]
  - - [8064, 128, 1, 128]
    - [27, 34.024]
  - - [8448, 128, 1, 128]
    - [15, 36.693]
  - - [8832, 128, 1, 128]
    - [15, 37.915]
  - - [9216, 128, 1, 128]
    - [15, 41.241]
  - - [9600, 128, 1, 128]
    - [15, 40.736]
  - - [9984, 128, 1, 128]
    - [15, 42.86]
  - - [10368, 128, 1, 128]
    - [15, 43.997]
  - - [10752, 128, 1, 128]
    - [15, 42.454]
  - - [11136, 128, 1, 128]
    - [15, 41.737]
  - - [11520, 128, 1, 128]
    - [15, 43.621]
  - - [11904, 128, 1, 128]
    - [15, 45.54]
  - - [12288, 128, 1, 128]
    - [15, 45.365]
  - - [12672, 128, 1, 128]
    - [15, 46.551]
  - - [13056, 128, 1, 128]
    - [15, 47.489]
  - - [13440, 128, 1, 128]
    - [15, 48.646]
  - - [13824, 128, 1, 128]
    - [15, 50.282]
  - - [14208, 128, 1, 128]
    - [15, 47.044]
  - - [14592, 128, 1, 128]
    - [15, 48.315]
  - - [14976, 128, 1, 128]
    - [6, 44.588]
  - - [15360, 128, 1, 128]
    - [15, 44.476]
  - - [15744, 128, 1, 128]
    - [15, 46.13]
  - - [16128, 128, 1, 128]
    - [15, 48.212]
  - - [16512, 128, 1, 128]
    - [15, 47.255]
  - - [16896, 128, 1, 128]
    - [7, 46.9]
  - - [17280, 128, 1, 128]
    - [7, 48.885]
  - - [17664, 128, 1, 128]
    - [11, 49.032]
  - - [18048, 128, 1, 128]
    - [11, 49.911]
  - - [18432, 128, 1, 128]
    - [11, 50.782]
  - - [18816, 128, 1, 128]
    - [7, 50.337]
  - - [19200, 128, 1, 128]
    - [11, 51.551]
  - - [19584, 128, 1, 128]
    - [11, 53.162]
  - - [19968, 128, 1, 128]
    - [11, 52.098]
  - - [20352, 128, 1, 128]
    - [11, 53.478]
  - - [20736, 128, 1, 128]
    - [11, 54.102]
  - - [21120, 128, 1, 128]
    - [11, 53.589]
  - - [21504, 128, 1, 128]
    - [15, 50.089]
  - - [21888, 128, 1, 128]
    - [15, 50.983]
  - - [22272, 128, 1, 128]
    - [15, 52.54]
  - - [22656, 128, 1, 128]
    - [15, 52.113]
  - - [23040, 128, 1, 128]
    - [15, 52.832]
  - - [384, 128, 1, 256]
    - [24, 5.35]
  - - [768, 128, 1, 256]
    - [24, 10.7]
  - - [1152, 128, 1, 256]
    - [24, 15.751]
  - - [1536, 128, 1, 256]
    - [24, 20.621]
  - - [1920, 128, 1, 256]
    - [19, 23.827]
  - - [2304, 128, 1, 256]
    - [19, 29.33]
  - - [2688, 128, 1, 256]
    - [10, 30.071]
  - - [3072, 128, 1, 256]
    - [14, 33.855]
  - - [3456, 128, 1, 256]
    - [12, 38.664]
  - - [3840, 128, 1, 256]
    - [4, 34.161]
  - - [4224, 128, 1, 256]
    - [7, 35.441]
  - - [4608, 128, 1, 256]
    - [48, 37.596]
  - - [4992, 128, 1, 256]
    - [8, 41.649]
  - - [5376, 128, 1, 256]
    - [15, 42.454]
  - - [5760, 128, 1, 256]
    - [15, 45.004]
  - - [6144, 128, 1, 256]
    - [15, 47.753]
  - - [6528, 128, 1, 256]
    - [7, 50.472]
  - - [6912, 128, 1, 256]
    - [15, 53.163]
  - - [7296, 128, 1, 256]
    - [7, 45.654]
  - - [7680, 128, 1, 256]
    - [15, 47.653]
  - - [8064, 128, 1, 256]
    - [15, 49.618]
  - - [8448, 128, 1, 256]
    - [7, 51.981]
  - - [8832, 128, 1, 256]
    - [15, 53.673]
  - - [9216, 128, 1, 256]
    - [15, 55.323]
  - - [9600, 128, 1, 256]
    - [15, 57.629]
  - - [9984, 128, 1, 256]
    - [15, 59.212]
  - - [10368, 128, 1, 256]
    - [7, 61.489]
  - - [10752, 128, 1, 256]
    - [7, 53.281]
  - - [11136, 128, 1, 256]
    - [15, 54.634]
  - - [11520, 128, 1, 256]
    - [15, 57.087]
  - - [11904, 128, 1, 256]
    - [15, 58.402]
  - - [12288, 128, 1, 256]
    - [7, 59.495]
  - - [12672, 128, 1, 256]
    - [15, 60.757]
  - - [13056, 128, 1, 256]
    - [15, 64.053]
  - - [13440, 128, 1, 256]
    - [15, 64.649]
  - - [13824, 128, 1, 256]
    - [6, 65.223]
  - - [14208, 128, 1, 256]
    - [6, 59.777]
  - - [14592, 128, 1, 256]
    - [7, 60.529]
  - - [14976, 128, 1, 256]
    - [6, 62.122]
  - - [15360, 128, 1, 256]
    - [6, 63.537]
  - - [15744, 128, 1, 256]
    - [15, 64.225]
  - - [16128, 128, 1, 256]
    - [6, 65.61]
  - - [16512, 128, 1, 256]
    - [6, 66.989]
  - - [16896, 128, 1, 256]
    - [6, 67.617]
  - - [17280, 128, 1, 256]
    - [15, 68.412]
  - - [17664, 128, 1, 256]
    - [6, 63.313]
  - - [18048, 128, 1, 256]
    - [6, 64.846]
  - - [18432, 128, 1, 256]
    - [15, 65.588]
  - - [18816, 128, 1, 256]
    - [6, 67.279]
  - - [19200, 128, 1, 256]
    - [15, 67.831]
  - - [19584, 128, 1, 256]
    - [6, 68.857]
  - - [19968, 128, 1, 256]
    - [6, 69.874]
  - - [20352, 128, 1, 256]
    - [6, 70.716]
  - - [20736, 128, 1, 256]
    - [15, 71.882]
  - - [21120, 128, 1, 256]
    - [7, 72.87]
  - - [21504, 128, 1, 256]
    - [15, 69.034]
  - - [21888, 128, 1, 256]
    - [15, 68.192]
  - - [22272, 128, 1, 256]
    - [15, 70.128]
  - - [22656, 128, 1, 256]
    - [6, 71.337]
  - - [23040, 128, 1, 256]
    - [6, 71.629]
  - - [8064, 8064, 1, 384]
    - [109, 99.124]
  - - [8448, 8448, 1, 384]
    - [109, 99.258]
  - - [8832, 8832, 1, 384]
    - [109, 99.137]
  - - [9216, 9216, 1, 384]
    - [108, 99.251]
  - - [9600, 9600, 1, 384]
    - [109, 99.403]
  - - [9984, 9984, 1, 384]
    - [109, 99.349]
  - - [10368, 10368, 1, 384]
    - [108, 99.442]
  - - [10752, 10752, 1, 384]
    - [109, 99.593]
  - - [11136, 11136, 1, 384]
    - [109, 99.403]
  - - [11520, 11520, 1, 384]
    - [109, 99.59]
  - - [11904, 11904, 1, 384]
    - [109, 99.51]
  - - [12288, 12288, 1, 384]
    - [111, 97.042]
  - - [12672, 12672, 1, 384]
    - [109, 99.457]
  - - [13056, 13056, 1, 384]
    - [109, 99.543]
  - - [13440, 13440, 1, 384]
    - [109, 99.552]
  - - [13824, 13824, 1, 384]
    - [109, 99.577]
  - - [14208, 14208, 1, 384]
    - [109, 99.538]
  - - [14592, 14592, 1, 384]
    - [109, 99.691]
  - - [14976, 14976, 1, 384]
    - [109, 99.608]
  - - [15360, 15360, 1, 384]
    - [109, 99.406]
  - - [15744, 15744, 1, 384]
    - [108, 99.566]
  - - [16128, 16128, 1, 384]
    - [109, 99.661]
  - - [16512, 16512, 1, 384]
    - [109, 99.548]
  - - [16896, 16896, 1, 384]
    - [109, 99.714]
  - - [17280, 17280, 1, 384]
    - [109, 99.553]
  - - [17664, 17664, 1, 384]
    - [109, 99.577]
  - - [18048, 18048, 1, 384]
    - [109, 99.548]
  - - [18432, 18432, 1, 384]
    - [111, 98.021]
  - - [18816, 18816, 1, 384]
    - [109, 99.665]
  - - [19200, 19200, 1, 384]
    - [109, 99.676]
  - - [19584, 19584, 1, 384]
    - [109, 99.661]
  - - [19968, 19968, 1, 384]
    - [109, 99.695]
  - - [20352, 20352, 1, 384]
    - [109, 99.679]
  - - [20736, 20736, 1, 384]
    - [109, 99.695]
  - - [21120, 21120, 1, 384]
    - [109, 99.545]
  - - [21504, 21504, 1, 384]
    - [109, 99.369]
  - - [21888, 21888, 1, 384]
    - [109, 99.708]
  - - [22272, 22272, 1, 384]
    - [109, 99.658]
  - - [22656, 22656, 1, 384]
    - [109, 99.619]
  - - [23040, 23040, 1, 384]
    - [109, 99.617]
  - - [768, 768, 1, 768]
    - [112, 73.115]
  - - [1152, 1152, 1, 1152]
    - [113, 93.992]
  - - [1536, 1536, 1, 1536]
    - [106, 86.913]
  - - [1920, 1920, 1, 1920]
    - [113, 89.829]
  - - [2304, 2304, 1, 2304]
    - [114, 97.279]
  - - [2688, 2688, 1, 2688]
    - [113, 93.59]
  - - [3072, 3072, 1, 3072]
    - [115, 99.121]
  - - [3456, 3456, 1, 3456]
    - [116, 97.811]
  - - [3840, 3840, 1, 3840]
    - [116, 98.87]
  - - [4224, 4224, 1, 4224]
    - [114, 98.709]
  - - [4608, 4608, 1, 4608]
    - [116, 97.968]
  - - [4992, 4992, 1, 4992]
    - [111, 98.551]
  - - [5376, 5376, 1, 5376]
    - [109, 98.41]
  - - [6144, 6144, 1, 6144]
    - [111, 99.519]
  - - [6528, 6528, 1, 6528]
    - [109, 99.335]
  - - [6912, 6912, 1, 6912]
    - [109, 98.876]
  - - [7296, 7296, 1, 7296]
    - [108, 99.097]
  - - [7680, 7680, 1, 7680]
    - [109, 99.785]
  - - [8064, 4032, 1, 384]
    - [7, 94.885]
  - - [8448, 4224, 1, 384]
    - [15, 94.961]
  - - [8832, 4416, 1, 384]
    - [6, 95.292]
  - - [9216, 4608, 1, 384]
    - [7, 95.382]
  - - [9600, 4800, 1, 384]
    - [7, 95.65]
  - - [9984, 4992, 1, 384]
    - [15, 95.93]
  - - [10368, 5184, 1, 384]
    - [15, 95.791]
  - - [10752, 5376, 1, 384]
    - [15, 96.026]
  - - [11136, 5568, 1, 384]
    - [11, 96.244]
  - - [11520, 5760, 1, 384]
    - [15, 96.076]
  - - [11904, 5952, 1, 384]
    - [11, 96.153]
  - - [12288, 6144, 1, 384]
    - [11, 96.401]
  - - [12672, 6336, 1, 384]
    - [15, 96.262]
  - - [13056, 6528, 1, 384]
    - [11, 96.326]
  - - [13440, 6720, 1, 384]
    - [15, 96.432]
  - - [13824, 6912, 1, 384]
    - [15, 96.339]
  - - [14208, 7104, 1, 384]
    - [15, 96.322]
  - - [14592, 7296, 1, 384]
    - [15, 96.506]
  - - [14976, 7488, 1, 384]
    - [6, 96.689]
  - - [15360, 7680, 1, 384]
    - [11, 96.805]
  - - [15744, 7872, 1, 384]
    - [11, 96.673]
  - - [16128, 8064, 1, 384]
    - [11, 96.596]
  - - [16512, 8256, 1, 384]
    - [15, 96.678]
  - - [16896, 8448, 1, 384]
    - [11, 96.675]
  - - [17280, 8640, 1, 384]
    - [11, 96.818]
  - - [17664, 8832, 1, 384]
    - [15, 96.711]
  - - [18048, 9024, 1, 384]
    - [11, 96.861]
  - - [18432, 9216, 1, 384]
    - [11, 96.862]
  - - [18816, 9408, 1, 384]
    - [11, 96.938]
  - - [19200, 9600, 1, 384]
    - [11, 96.849]
  - - [19584, 9792, 1, 384]
    - [11, 96.928]
  - - [19968, 9984, 1, 384]
    - [11, 96.862]
  - - [20352, 10176, 1, 384]
    - [11, 97.038]
  - - [20736, 10368, 1, 384]
    - [11, 97.02]
  - - [21120, 10560, 1, 384]
    - [11, 96.967]
  - - [21504, 10752, 1, 384]
    - [11, 97.034]
  - - [21888, 10944, 1, 384]
    - [11, 96.984]
  - - [22272, 11136, 1, 384]
    - [11, 96.968]
  - - [22656, 11328, 1, 384]
    - [11, 97.08]
  - - [23040, 11520, 1, 384]
    - [11, 97.059]
  - - [8064, 16128, 1, 384]
    - [7, 96.683]
  - - [8448, 16896, 1, 384]
    - [11, 96.762]
  - - [8832, 17664, 1, 384]
    - [15, 96.677]
  - - [9216, 18432, 1, 384]
    - [11, 96.843]
  - - [9600, 19200, 1, 384]
    - [11, 96.97]
  - - [9984, 19968, 1, 384]
    - [6, 96.881]
  - - [10368, 20736, 1, 384]
    - [11, 97.007]
  - - [10752, 21504, 1, 384]
    - [11, 97.044]
  - - [11136, 22272, 1, 384]
    - [11, 96.995]
  - - [11520, 23040, 1, 384]
    - [11, 97.059]
  - - [11904, 23808, 1, 384]
    - [11, 97.118]
  - - [12288, 24576, 1, 384]
    - [11, 97.016]
  - - [12672, 25344, 1, 384]
    - [11, 97.139]
  - - [13056, 26112, 1, 384]
    - [11, 97.152]
  - - [13440, 26880, 1, 384]
    - [11, 97.277]
  - - [13824, 27648, 1, 384]
    - [11, 97.137]
  - - [14208, 28416, 1, 384]
    - [11, 97.141]
  - - [14592, 29184, 1, 384]
    - [11, 97.21]
  - - [14976, 29952, 1, 384]
    - [11, 97.267]
  - - [15360, 30720, 1, 384]
    - [11, 97.28]
  - - [15744, 31488, 1, 384]
    - [11, 97.288]
  - - [16128, 32256, 1, 384]
    - [11, 97.258]
  - - [16512, 33024, 1, 384]
    - [11, 97.308]
  - - [16896, 33792, 1, 384]
    - [11, 97.307]
  - - [17280, 34560, 1, 384]
    - [11, 97.401]
  - - [17664, 35328, 1, 384]
    - [11, 97.269]
  - - [18048, 36096, 1, 384]
    - [11, 97.339]
  - - [18432, 36864, 1, 384]
    - [11, 97.262]
  - - [18816, 37632, 1, 384]
    - [11, 97.255]
  - - [19200, 38400, 1, 384]
    - [11, 97.341]
  - - [19584, 39168, 1, 384]
    - [11, 97.348]
  - - [19968, 39936, 1, 384]
    - [11, 97.292]
  - - [20352, 40704, 1, 384]
    - [11, 97.239]
  - - [20736, 41472, 1, 384]
    - [11, 97.292]
  - - [21120, 42240, 1, 384]
    - [11, 97.289]
  - - [21504, 43008, 1, 384]
    - [11, 97.209]
  - - [21888, 43776, 1, 384]
    - [11, 97.225]
  - - [22272, 44544, 1, 384]
    - [11, 97.296]
  - - [22656, 45312, 1, 384]
    - [11, 97.241]
  - - [23040, 46080, 1, 384]
    - [11, 97.246]
  - - [384, 1536, 1, 384]
    - [8, 45.772]
  - - [1152, 1536, 1, 384]
    - [7, 74.87]
  - - [1920, 1536, 1, 384]
    - [7, 78.638]
  - - [2304, 1536, 1, 384]
    - [7, 83.324]
  - - [2688, 1536, 1, 384]
    - [15, 80.462]
  - - [3456, 1536, 1, 384]
    - [15, 86.993]
  - - [3840, 1536, 1, 384]
    - [7, 85.06]
  - - [4224, 1536, 1, 384]
    - [7, 87.173]
  - - [4608, 1536, 1, 384]
    - [15, 88.822]
  - - [4992, 1536, 1, 384]
    - [7, 87.471]
  - - [5376, 1536, 1, 384]
    - [6, 88.483]
  - - [5760, 1536, 1, 384]
    - [15, 90.276]
  - - [6144, 1536, 1, 384]
    - [15, 91.596]
  - - [6528, 1536, 1, 384]
    - [7, 90.141]
  - - [6912, 1536, 1, 384]
    - [15, 91.271]
  - - [7296, 1536, 1, 384]
    - [15, 92.438]
  - - [7680, 1536, 1, 384]
    - [15, 90.609]
  - - [8064, 1536, 1, 384]
    - [15, 91.799]
  - - [8448, 1536, 1, 384]
    - [15, 92.64]
  - - [8832, 1536, 1, 384]
    - [15, 91.491]
  - - [9216, 1536, 1, 384]
    - [7, 92.129]
  - - [9600, 1536, 1, 384]
    - [15, 93.063]
  - - [9984, 1536, 1, 384]
    - [7, 92.148]
  - - [10368, 1536, 1, 384]
    - [15, 92.761]
  - - [10752, 1536, 1, 384]
    - [6, 93.247]
  - - [11136, 1536, 1, 384]
    - [15, 94.001]
  - - [11520, 1536, 1, 384]
    - [15, 92.933]
  - - [11904, 1536, 1, 384]
    - [15, 93.588]
  - - [12288, 1536, 1, 384]
    - [15, 93.913]
  - - [12672, 1536, 1, 384]
    - [15, 93.152]
  - - [13056, 1536, 1, 384]
    - [15, 93.745]
  - - [13440, 1536, 1, 384]
    - [15, 94.361]
  - - [13824, 1536, 1, 384]
    - [15, 93.453]
  - - [14208, 1536, 1, 384]
    - [15, 93.807]
  - - [14592, 1536, 1, 384]
    - [7, 94.235]
  - - [14976, 1536, 1, 384]
    - [7, 93.732]
  - - [15360, 1536, 1, 384]
    - [7, 93.989]
  - - [15744, 1536, 1, 384]
    - [15, 94.532]
  - - [16128, 1536, 1, 384]
    - [15, 94.908]
  - - [16512, 1536, 1, 384]
    - [7, 94.126]
  - - [16896, 1536, 1, 384]
    - [15, 94.551]
  - - [17280, 1536, 1, 384]
    - [15, 94.823]
  - - [17664, 1536, 1, 384]
    - [15, 94.245]
  - - [18048, 1536, 1, 384]
    - [15, 94.585]
  - - [18432, 1536, 1, 384]
    - [15, 94.877]
  - - [18816, 1536, 1, 384]
    - [7, 94.35]
  - - [19200, 1536, 1, 384]
    - [15, 94.669]
  - - [19584, 1536, 1, 384]
    - [15, 94.994]
  - - [19968, 1536, 1, 384]
    - [15, 94.444]
  - - [20352, 1536, 1, 384]
    - [6, 94.61]
  - - [20736, 1536, 1, 384]
    - [15, 95.032]
  - - [21120, 1536, 1, 384]
    - [11, 95.459]
  - - [21504, 1536, 1, 384]
    - [11, 94.699]
  - - [21888, 1536, 1, 384]
    - [15, 94.958]
  - - [22272, 1536, 1, 384]
    - [11, 95.379]
  - - [22656, 1536, 1, 384]
    - [15, 94.793]
  - - [23040, 1536, 1, 384]
    - [15, 94.906]
  - - [384, 1920, 1, 384]
    - [7, 52.506]
  - - [768, 1920, 1, 384]
    - [7, 62.544]
  - - [1152, 1920, 1, 384]
    - [15, 77.484]
  - - [1536, 1920, 1, 384]
    - [6, 78.396]
  - - [2304, 1920, 1, 384]
    - [15, 85.535]
  - - [2688, 1920, 1, 384]
    - [15, 85.222]
  - - [3072, 1920, 1, 384]
    - [15, 85.131]
  - - [3456, 1920, 1, 384]
    - [15, 88.331]
  - - [4224, 1920, 1, 384]
    - [15, 91.135]
  - - [4608, 1920, 1, 384]
    - [15, 90.329]
  - - [4992, 1920, 1, 384]
    - [15, 89.9]
  - - [5376, 1920, 1, 384]
    - [7, 91.791]
  - - [5760, 1920, 1, 384]
    - [15, 91.222]
  - - [6144, 1920, 1, 384]
    - [15, 91.014]
  - - [6528, 1920, 1, 384]
    - [7, 92.575]
  - - [6912, 1920, 1, 384]
    - [15, 92.012]
  - - [7296, 1920, 1, 384]
    - [15, 91.687]
  - - [7680, 1920, 1, 384]
    - [15, 93.199]
  - - [8064, 1920, 1, 384]
    - [7, 92.456]
  - - [8448, 1920, 1, 384]
    - [15, 93.91]
  - - [8832, 1920, 1, 384]
    - [15, 93.487]
  - - [9216, 1920, 1, 384]
    - [15, 92.962]
  - - [9600, 1920, 1, 384]
    - [15, 94.037]
  - - [9984, 1920, 1, 384]
    - [15, 93.71]
  - - [10368, 1920, 1, 384]
    - [15, 93.409]
  - - [10752, 1920, 1, 384]
    - [6, 94.236]
  - - [11136, 1920, 1, 384]
    - [15, 93.983]
  - - [11520, 1920, 1, 384]
    - [7, 93.701]
  - - [11904, 1920, 1, 384]
    - [15, 94.421]
  - - [12288, 1920, 1, 384]
    - [15, 93.967]
  - - [12672, 1920, 1, 384]
    - [15, 94.894]
  - - [13056, 1920, 1, 384]
    - [15, 94.676]
  - - [13440, 1920, 1, 384]
    - [7, 94.311]
  - - [13824, 1920, 1, 384]
    - [15, 95.0]
  - - [14208, 1920, 1, 384]
    - [15, 94.643]
  - - [14592, 1920, 1, 384]
    - [7, 94.456]
  - - [14976, 1920, 1, 384]
    - [15, 95.053]
  - - [15360, 1920, 1, 384]
    - [15, 94.792]
  - - [15744, 1920, 1, 384]
    - [15, 94.613]
  - - [16128, 1920, 1, 384]
    - [15, 95.132]
  - - [16512, 1920, 1, 384]
    - [15, 94.936]
  - - [16896, 1920, 1, 384]
    - [15, 95.394]
  - - [17280, 1920, 1, 384]
    - [15, 95.121]
  - - [17664, 1920, 1, 384]
    - [15, 95.016]
  - - [18048, 1920, 1, 384]
    - [15, 95.398]
  - - [18432, 1920, 1, 384]
    - [15, 95.113]
  - - [18816, 1920, 1, 384]
    - [15, 95.028]
  - - [19200, 1920, 1, 384]
    - [11, 95.487]
  - - [19584, 1920, 1, 384]
    - [11, 95.202]
  - - [19968, 1920, 1, 384]
    - [15, 95.039]
  - - [20352, 1920, 1, 384]
    - [15, 95.297]
  - - [20736, 1920, 1, 384]
    - [15, 95.098]
  - - [21120, 1920, 1, 384]
    - [11, 95.919]
  - - [21504, 1920, 1, 384]
    - [11, 95.598]
  - - [21888, 1920, 1, 384]
    - [11, 95.316]
  - - [22272, 1920, 1, 384]
    - [15, 95.622]
  - - [22656, 1920, 1, 384]
    - [15, 95.409]
  - - [23040, 1920, 1, 384]
    - [15, 95.228]
  - - [384, 2304, 1, 384]
    - [15, 60.999]
  - - [768, 2304, 1, 384]
    - [7, 74.505]
  - - [1536, 2304, 1, 384]
    - [15, 83.098]
  - - [1920, 2304, 1, 384]
    - [7, 85.344]
  - - [2688, 2304, 1, 384]
    - [15, 88.648]
  - - [3072, 2304, 1, 384]
    - [6, 88.822]
  - - [3456, 2304, 1, 384]
    - [15, 89.653]
  - - [3840, 2304, 1, 384]
    - [15, 90.382]
  - - [4224, 2304, 1, 384]
    - [15, 90.743]
  - - [4992, 2304, 1, 384]
    - [15, 91.554]
  - - [5376, 2304, 1, 384]
    - [15, 91.956]
  - - [5760, 2304, 1, 384]
    - [7, 91.975]
  - - [6144, 2304, 1, 384]
    - [15, 92.303]
  - - [6528, 2304, 1, 384]
    - [15, 92.693]
  - - [6912, 2304, 1, 384]
    - [15, 92.605]
  - - [7296, 2304, 1, 384]
    - [15, 92.822]
  - - [7680, 2304, 1, 384]
    - [15, 92.99]
  - - [8064, 2304, 1, 384]
    - [15, 93.142]
  - - [8448, 2304, 1, 384]
    - [15, 93.333]
  - - [8832, 2304, 1, 384]
    - [7, 93.457]
  - - [9216, 2304, 1, 384]
    - [15, 93.453]
  - - [9600, 2304, 1, 384]
    - [15, 93.564]
  - - [9984, 2304, 1, 384]
    - [15, 93.71]
  - - [10368, 2304, 1, 384]
    - [7, 93.888]
  - - [10752, 2304, 1, 384]
    - [15, 94.971]
  - - [11136, 2304, 1, 384]
    - [15, 94.976]
  - - [11520, 2304, 1, 384]
    - [15, 95.019]
  - - [11904, 2304, 1, 384]
    - [15, 94.984]
  - - [12288, 2304, 1, 384]
    - [15, 95.079]
  - - [12672, 2304, 1, 384]
    - [15, 95.169]
  - - [13056, 2304, 1, 384]
    - [15, 95.133]
  - - [13440, 2304, 1, 384]
    - [15, 95.098]
  - - [13824, 2304, 1, 384]
    - [6, 95.049]
  - - [14208, 2304, 1, 384]
    - [15, 95.242]
  - - [14592, 2304, 1, 384]
    - [6, 95.16]
  - - [14976, 2304, 1, 384]
    - [15, 95.204]
  - - [15360, 2304, 1, 384]
    - [15, 95.187]
  - - [15744, 2304, 1, 384]
    - [15, 95.3]
  - - [16128, 2304, 1, 384]
    - [15, 95.225]
  - - [16512, 2304, 1, 384]
    - [7, 95.263]
  - - [16896, 2304, 1, 384]
    - [15, 95.219]
  - - [17280, 2304, 1, 384]
    - [7, 95.322]
  - - [17664, 2304, 1, 384]
    - [15, 95.291]
  - - [18048, 2304, 1, 384]
    - [7, 95.312]
  - - [18432, 2304, 1, 384]
    - [7, 95.283]
  - - [18816, 2304, 1, 384]
    - [7, 95.34]
  - - [19200, 2304, 1, 384]
    - [15, 95.275]
  - - [19584, 2304, 1, 384]
    - [15, 95.365]
  - - [19968, 2304, 1, 384]
    - [7, 95.349]
  - - [20352, 2304, 1, 384]
    - [6, 95.4]
  - - [20736, 2304, 1, 384]
    - [15, 95.46]
  - - [21120, 2304, 1, 384]
    - [11, 96.195]
  - - [21504, 2304, 1, 384]
    - [11, 96.175]
  - - [21888, 2304, 1, 384]
    - [11, 96.188]
  - - [22272, 2304, 1, 384]
    - [11, 96.065]
  - - [22656, 2304, 1, 384]
    - [11, 96.079]
  - - [23040, 2304, 1, 384]
    - [11, 96.052]
  - - [1024, 1024, 1, 32768]
    - [12, 81.618]
  - - [256, 32768, 1, 1]
    - [13, 0.887]
  - - [256, 128, 1, 32768]
    - [118, 40.46]
  - - [512, 256, 1, 32768]
    - [121, 68.347]
  - - [1024, 512, 1, 32768]
    - [121, 78.324]
  - - [479, 1024, 1, 32768]
    - [121, 73.135]
  - - [64, 64, 1, 64]
    - [43, 0.148]
  - - [448, 448, 1, 448]
    - [19, 29.577]
  - - [13, 512, 1, 32768]
    - [120, 13.211]
  - - [256, 1, 1, 32768]
    - [129, 0.359]
  - - [64, 192, 64, 1280]
    - [21, 70.883]
  - - [64, 320, 64, 1280]
    - [7, 81.038]
  - - [64, 384, 64, 1280]
    - [15, 74.984]
  - - [64, 448, 64, 1280]
    - [7, 72.254]
  - - [64, 192, 64, 2048]
    - [21, 73.317]
  - - [64, 320, 64, 2048]
    - [15, 84.01]
  - - [64, 384, 64, 2048]
    - [12, 79.025]
  - - [64, 448, 64, 2048]
    - [7, 74.478]
  - - [1225, 32, 64, 192]
    - [70, 37.951]
  - - [1225, 48, 64, 192]
    - [7, 42.07]
  - - [1225, 64, 64, 192]
    - [11, 52.689]
  - - [1225, 48, 64, 256]
    - [7, 44.99]
  - - [1225, 64, 64, 256]
    - [57, 57.657]
  - - [1225, 48, 64, 288]
    - [7, 46.651]
  - - [1225, 64, 64, 288]
    - [57, 61.612]
  - - [5329, 80, 64, 64]
    - [57, 31.541]
  - - [289, 128, 64, 768]
    - [6, 73.423]
  - - [289, 160, 64, 768]
    - [8, 67.564]
  - - [289, 192, 64, 768]
    - [6, 78.237]
  - - [64, 192, 32, 1280]
    - [55, 60.166]
  - - [64, 320, 32, 1280]
    - [12, 67.029]
  - - [64, 384, 32, 1280]
    - [15, 71.894]
  - - [64, 448, 32, 1280]
    - [12, 61.187]
  - - [64, 192, 32, 2048]
    - [40, 66.713]
  - - [64, 320, 32, 2048]
    - [12, 72.094]
  - - [64, 384, 32, 2048]
    - [21, 75.688]
  - - [64, 448, 32, 2048]
    - [12, 65.19]
  - - [1225, 32, 32, 192]
    - [9, 38.085]
  - - [1225, 48, 32, 192]
    - [7, 40.101]
  - - [1225, 64, 32, 192]
    - [11, 50.249]
  - - [1225, 48, 32, 256]
    - [7, 44.302]
  - - [1225, 64, 32, 256]
    - [11, 55.876]
  - - [1225, 48, 32, 288]
    - [7, 45.647]
  - - [1225, 64, 32, 288]
    - [11, 58.459]
  - - [5329, 80, 32, 64]
    - [57, 30.408]
  - - [289, 128, 32, 768]
    - [15, 68.858]
  - - [289, 160, 32, 768]
    - [8, 60.679]
  - - [289, 192, 32, 768]
    - [6, 67.832]
  - - [49, 2048, 32, 512]
    - [15, 62.057]
  - - [49, 512, 32, 2048]
    - [138, 56.953]
  - - [3136, 256, 32, 64]
    - [57, 53.615]
  - - [3136, 64, 32, 64]
    - [57, 38.592]
  - - [3136, 64, 32, 256]
    - [137, 76.074]
  - - [784, 512, 32, 128]
    - [15, 70.974]
  - - [784, 128, 32, 512]
    - [7, 77.507]
  - - [196, 1024, 32, 256]
    - [6, 65.341]
  - - [196, 256, 32, 1024]
    - [136, 63.222]
  - - [256, 4, 1, 4096]
    - [118, 0.561]
  - - [256, 4, 1, 6912]
    - [118, 0.869]
  - - [1024, 1024, 1, 6912]
    - [10, 80.056]
  - - [512, 256, 1, 4096]
    - [12, 38.65]
  - - [1024, 512, 1, 4096]
    - [10, 63.172]
  - - [480, 1024, 1, 4096]
    - [12, 59.34]
  - - [512, 256, 1, 6912]
    - [121, 47.255]
  - - [1024, 512, 1, 6912]
    - [121, 67.485]
  - - [480, 1024, 1, 6912]
    - [121, 63.346]
  - - [256, 128, 1, 55296]
    - [126, 41.366]
  - - [512, 256, 1, 55296]
    - [121, 71.068]
  - - [13, 512, 1, 55296]
    - [120, 14.929]
  - - [100, 512, 120, 128]
    - [7, 50.129]
  - - [100, 512, 18, 128]
    - [7, 30.73]
  - - [100, 512, 19, 128]
    - [15, 32.251]
  - - [1444, 128, 120, 256]
    - [11, 79.051]
  - - [1444, 128, 18, 256]
    - [6, 67.221]
  - - [1444, 128, 19, 256]
    - [15, 69.021]
  - - [1444, 256, 120, 256]
    - [15, 87.889]
  - - [1444, 256, 18, 256]
    - [15, 78.253]
  - - [1444, 256, 19, 256]
    - [6, 78.748]
  - - [25, 256, 120, 128]
    - [47, 18.614]
  - - [25, 256, 18, 128]
    - [47, 6.579]
  - - [25, 256, 19, 128]
    - [47, 6.745]
  - - [361, 512, 120, 256]
    - [15, 81.832]
  - - [361, 512, 18, 256]
    - [15, 67.815]
  - - [361, 512, 19, 256]
    - [6, 67.526]
  - - [9, 256, 120, 128]
    - [47, 7.974]
  - - [9, 256, 18, 128]
    - [25, 2.545]
  - - [9, 256, 19, 128]
    - [24, 2.687]
  - - [1, 1152, 1, 256]
    - [24, 0.124]
  - - [100, 2304, 1, 512]
    - [19, 29.05]
  - - [1444, 576, 1, 128]
    - [80, 30.955]
  - - [173280, 64, 1, 128]
    - [11, 43.877]
  - - [25, 1152, 1, 256]
    - [24, 2.864]
  - - [25992, 64, 1, 128]
    - [7, 40.833]
  - - [27436, 64, 1, 128]
    - [6, 41.174]
  - - [361, 2304, 1, 512]
    - [7, 60.162]
  - - [9, 1152, 1, 256]
    - [24, 1.068]
  - - [7680, 8192, 1, 8192]
    - [11, 97.417]
  - - [3840, 4096, 1, 4096]
    - [15, 96.756]
  - - [1920, 2048, 1, 2048]
    - [15, 91.624]
  - - [960, 1024, 1, 1024]
    - [90, 66.13]
  - - [480, 512, 1, 512]
    - [19, 32.969]
  - - [8192, 7680, 1, 8192]
    - [11, 97.334]
  - - [4096, 3840, 1, 4096]
    - [15, 96.769]
  - - [2048, 1920, 1, 2048]
    - [15, 91.809]
  - - [1024, 960, 1, 1024]
    - [90, 66.324]
  - - [512, 480, 1, 512]
    - [19, 32.589]
  - - [8192, 8192, 1, 8192]
    - [7, 97.356]
  - - [4096, 4096, 1, 4096]
    - [11, 95.346]
  - - [2048, 2048, 1, 2048]
    - [11, 88.585]
  - - [512, 512, 1, 512]
    - [19, 34.762]
  - - [1024, 1024, 1, 77]
    - [58, 23.325]
  - - [1024, 4096, 1, 512]
    - [15, 83.792]
  - - [1024, 30522, 1, 77]
    - [57, 58.154]
  - - [4096, 1024, 1, 512]
    - [15, 82.859]
  - - [64, 128, 160, 128]
    - [7, 36.704]
  - - [1024, 2, 1, 10]
    - [67, 0.015]
  - - [1024, 2, 1, 1280]
    - [24, 0.523]
  - - [1024, 1024, 1, 10]
    - [62, 4.074]
  - - [1024, 4096, 1, 1280]
    - [11, 87.567]
  - - [1024, 30522, 1, 200]
    - [11, 89.801]
  - - [4096, 1024, 1, 1280]
    - [15, 87.631]
  - - [64, 128, 624, 128]
    - [91, 43.75]
  - - [1024, 2, 1, 39]
    - [25, 0.049]
  - - [1024, 2, 1, 4992]
    - [119, 1.113]
  - - [1024, 1024, 1, 39]
    - [9, 14.862]
  - - [1024, 1024, 1, 780]
    - [8, 62.052]
  - - [1024, 1024, 1, 4992]
    - [10, 79.347]
  - - [1024, 4096, 1, 4992]
    - [11, 89.926]
  - - [1024, 30522, 1, 780]
    - [11, 94.989]
  - - [4096, 1024, 1, 4992]
    - [11, 89.849]
  - - [1024, 1024, 1, 308]
    - [7, 49.845]
  - - [1024, 30522, 1, 308]
    - [11, 93.056]
  - - [64, 128, 640, 128]
    - [15, 44.151]
  - - [1024, 2, 1, 40]
    - [24, 0.05]
  - - [1024, 2, 1, 5120]
    - [119, 1.131]
  - - [1024, 1024, 1, 40]
    - [65, 15.002]
  - - [1024, 1024, 1, 800]
    - [10, 65.519]
  - - [1024, 1024, 1, 5120]
    - [49, 79.016]
  - - [1024, 4096, 1, 5120]
    - [11, 89.885]
  - - [1024, 30522, 1, 800]
    - [15, 95.396]
  - - [4096, 1024, 1, 5120]
    - [11, 89.91]
  - - [64, 128, 656, 128]
    - [91, 43.785]
  - - [1024, 2, 1, 41]
    - [24, 0.051]
  - - [1024, 2, 1, 5248]
    - [118, 1.113]
  - - [1024, 1024, 1, 41]
    - [65, 14.789]
  - - [1024, 1024, 1, 820]
    - [7, 63.316]
  - - [1024, 1024, 1, 5248]
    - [10, 79.359]
  - - [1024, 4096, 1, 5248]
    - [11, 89.952]
  - - [1024, 30522, 1, 820]
    - [11, 95.304]
  - - [4096, 1024, 1, 5248]
    - [11, 89.919]
  - - [64, 512, 80, 512]
    - [15, 76.084]
  - - [1024, 2, 1, 5]
    - [67, 0.008]
  - - [1024, 2, 1, 2560]
    - [119, 0.675]
  - - [1024, 1024, 1, 5]
    - [67, 2.129]
  - - [1024, 1024, 1, 385]
    - [7, 53.986]
  - - [1024, 1024, 1, 2560]
    - [10, 75.751]
  - - [1024, 4096, 1, 2560]
    - [15, 89.0]
  - - [1024, 30522, 1, 385]
    - [6, 93.886]
  - - [4096, 1024, 1, 2560]
    - [11, 89.132]
  - - [1024, 1024, 1, 462]
    - [9, 55.553]
  - - [1024, 30522, 1, 462]
    - [11, 93.604]
  - - [64, 128, 128, 128]
    - [6, 32.519]
  - - [1024, 2, 1, 8]
    - [62, 0.013]
  - - [1024, 2, 1, 1024]
    - [24, 0.477]
  - - [1024, 1024, 1, 8]
    - [17, 3.406]
  - - [1024, 1024, 1, 160]
    - [15, 40.433]
  - - [1024, 4096, 1, 1024]
    - [15, 86.992]
  - - [1024, 30522, 1, 160]
    - [11, 89.858]
  - - [4096, 1024, 1, 1024]
    - [15, 86.797]
  - - [64, 128, 144, 128]
    - [6, 34.895]
  - - [1024, 2, 1, 9]
    - [67, 0.014]
  - - [1024, 2, 1, 1152]
    - [44, 0.504]
  - - [1024, 1024, 1, 9]
    - [9, 3.635]
  - - [1024, 1024, 1, 180]
    - [6, 40.313]
  - - [1024, 1024, 1, 1152]
    - [10, 69.793]
  - - [1024, 4096, 1, 1152]
    - [15, 87.486]
  - - [1024, 30522, 1, 180]
    - [11, 90.002]
  - - [4096, 1024, 1, 1152]
    - [15, 87.486]
  - - [4, 64, 32768, 4]
    - [92, 1.067]
  - - [4, 64, 38400, 4]
    - [92, 1.077]
  - - [64, 4, 32768, 4]
    - [93, 1.035]
  - - [64, 4, 38400, 4]
    - [93, 1.04]
  - - [1024, 1024, 1, 8192]
    - [12, 80.215]
  - - [1024, 1024, 1, 9600]
    - [10, 80.578]
  - - [1024, 4096, 1, 8192]
    - [11, 90.284]
  - - [1024, 4096, 1, 9600]
    - [11, 90.293]
  - - [1024, 33712, 1, 8192]
    - [6, 96.713]
  - - [1024, 33712, 1, 9600]
    - [6, 96.733]
  - - [4096, 1024, 1, 8192]
    - [11, 90.2]
  - - [4096, 1024, 1, 9600]
    - [11, 90.302]
  - - [1024, 1024, 1, 10064]
    - [14, 80.037]
  - - [1024, 1024, 1, 10080]
    - [10, 80.707]
  - - [1024, 1024, 1, 6528]
    - [10, 79.67]
  - - [1024, 1024, 1, 7104]
    - [10, 80.024]
  - - [1024, 1024, 1, 8064]
    - [10, 80.225]
  - - [1024, 1024, 1, 9216]
    - [10, 80.664]
  - - [1024, 4096, 1, 10064]
    - [11, 90.341]
  - - [1024, 4096, 1, 10080]
    - [11, 90.369]
  - - [1024, 4096, 1, 6528]
    - [11, 90.094]
  - - [1024, 4096, 1, 7104]
    - [11, 90.158]
  - - [1024, 4096, 1, 8064]
    - [11, 90.258]
  - - [1024, 4096, 1, 9216]
    - [11, 90.349]
  - - [1024, 42720, 1, 10080]
    - [11, 96.673]
  - - [1024, 42720, 1, 6528]
    - [11, 96.667]
  - - [1024, 42720, 1, 7104]
    - [11, 96.686]
  - - [4096, 1024, 1, 10064]
    - [11, 90.303]
  - - [4096, 1024, 1, 10080]
    - [11, 90.326]
  - - [4096, 1024, 1, 6528]
    - [11, 90.121]
  - - [4096, 1024, 1, 7104]
    - [11, 90.146]
  - - [4096, 1024, 1, 8064]
    - [11, 90.231]
  - - [4096, 1024, 1, 9216]
    - [11, 90.255]
  - - [14, 64, 10880, 14]
    - [47, 6.188]
  - - [15, 64, 10880, 14]
    - [47, 6.531]
  - - [15, 64, 7680, 15]
    - [47, 6.717]
  - - [15, 64, 10880, 15]
    - [47, 6.882]
  - - [17, 64, 7680, 15]
    - [67, 6.022]
  - - [17, 64, 6144, 17]
    - [94, 6.45]
  - - [17, 64, 7680, 17]
    - [74, 6.434]
  - - [21, 64, 6144, 17]
    - [74, 7.558]
  - - [21, 64, 6144, 21]
    - [94, 9.045]
  - - [24, 64, 4736, 24]
    - [64, 9.378]
  - - [30, 64, 2048, 30]
    - [94, 12.193]
  - - [30, 64, 2048, 31]
    - [95, 12.345]
  - - [31, 64, 2048, 31]
    - [47, 11.656]
  - - [32, 64, 4608, 32]
    - [74, 18.122]
  - - [32, 64, 4608, 35]
    - [56, 19.059]
  - - [34, 64, 4736, 24]
    - [96, 11.758]
  - - [34, 64, 4736, 34]
    - [74, 14.785]
  - - [35, 64, 4608, 35]
    - [56, 15.047]
  - - [64, 14, 10880, 14]
    - [61, 6.447]
  - - [64, 15, 10880, 14]
    - [61, 6.815]
  - - [64, 15, 7680, 15]
    - [61, 7.1]
  - - [64, 15, 10880, 15]
    - [61, 7.302]
  - - [64, 17, 7680, 15]
    - [63, 5.359]
  - - [64, 17, 6144, 17]
    - [62, 5.678]
  - - [64, 17, 7680, 17]
    - [62, 5.65]
  - - [64, 21, 6144, 17]
    - [62, 6.489]
  - - [64, 21, 6144, 21]
    - [62, 7.331]
  - - [64, 24, 4736, 24]
    - [61, 8.972]
  - - [64, 30, 2048, 30]
    - [61, 11.814]
  - - [64, 30, 2048, 31]
    - [61, 12.181]
  - - [64, 31, 2048, 31]
    - [61, 12.559]
  - - [64, 32, 4608, 32]
    - [68, 17.606]
  - - [64, 32, 4608, 35]
    - [68, 18.445]
  - - [64, 34, 4736, 24]
    - [9, 11.87]
  - - [64, 34, 4736, 34]
    - [7, 15.082]
  - - [64, 35, 4608, 35]
    - [7, 15.432]
  - - [64, 512, 1, 512]
    - [24, 5.772]
  - - [5, 64, 1, 5]
    - [67, 0.001]
  - - [2048, 512, 1, 1]
    - [9, 0.422]
  - - [33, 32, 1, 33]
    - [67, 0.02]
  - - [1024, 1600, 1, 1]
    - [13, 0.543]
  - - [1024, 1, 1, 1600]
    - [29, 0.282]
  - - [5, 64, 960, 5]
    - [62, 0.647]
  - - [27, 128, 32768, 27]
    - [76, 13.802]
  - - [480, 1024, 1, 32768]
    - [121, 74.225]
  - - [2048, 1, 1, 960]
    - [44, 0.461]
  - - [2048, 960, 1, 1]
    - [13, 0.575]
  - - [2048, 2, 1, 2]
    - [93, 0.006]
  - - [2048, 2048, 1, 2]
    - [9, 1.488]
  - - [2048, 30592, 1, 1024]
    - [11, 96.588]
  - - [2048, 6144, 1, 1024]
    - [11, 95.333]
  - - [2048, 8192, 1, 1024]
    - [15, 94.326]
  - - [8192, 2048, 1, 1024]
    - [7, 94.292]
  - - [1024, 1024, 1, 16]
    - [60, 6.462]
  - - [1024, 2, 1, 16]
    - [47, 0.022]
  - - [1024, 30592, 1, 8192]
    - [36, 96.94]
  - - [1024, 3072, 1, 8192]
    - [40, 95.963]
  - - [512, 64, 256, 512]
    - [15, 81.191]
  - - [64, 512, 256, 512]
    - [15, 82.086]
  - - [1024, 30592, 1, 2048]
    - [11, 96.585]
  - - [1024, 30592, 1, 4096]
    - [11, 96.805]
  - - [1024, 3072, 1, 4096]
    - [15, 95.052]
  - - [512, 64, 128, 512]
    - [6, 76.025]
  - - [64, 512, 128, 512]
    - [15, 78.364]
  - - [2560, 1920, 1, 2048]
    - [15, 94.452]
  - - [2560, 2, 1, 4]
    - [93, 0.014]
  - - [2560, 2560, 1, 2048]
    - [15, 93.128]
  - - [2560, 2560, 1, 4]
    - [57, 3.347]
  - - [2560, 7680, 1, 2048]
    - [11, 96.245]
  - - [640, 2560, 1, 2048]
    - [15, 83.684]
  - - [512, 64, 40, 512]
    - [15, 69.524]
  - - [64, 512, 40, 512]
    - [15, 70.008]
  - - [1536, 1536, 1, 4096]
    - [11, 83.335]
  - - [1536, 4608, 1, 4096]
    - [36, 95.667]
  - - [1536, 50304, 1, 4096]
    - [11, 97.269]
  - - [1536, 6144, 1, 4096]
    - [15, 96.431]
  - - [6144, 1536, 1, 4096]
    - [15, 96.442]
  - - [1024, 96, 64, 1024]
    - [65, 84.548]
  - - [96, 1024, 64, 1024]
    - [58, 85.519]
  - - [1536, 1536, 1, 8192]
    - [10, 84.27]
  - - [1536, 4608, 1, 8192]
    - [33, 96.425]
  - - [1536, 50304, 1, 8192]
    - [11, 97.311]
  - - [1536, 6144, 1, 8192]
    - [15, 96.76]
  - - [6144, 1536, 1, 8192]
    - [15, 96.707]
  - - [1024, 96, 128, 1024]
    - [70, 87.57]
  - - [96, 1024, 128, 1024]
    - [58, 88.248]
  - - [1024, 1024, 1, 16384]
    - [10, 81.37]
  - - [1024, 3072, 1, 16384]
    - [35, 96.622]
  - - [1024, 4096, 1, 16384]
    - [89, 90.535]
  - - [1024, 50304, 1, 16384]
    - [36, 97.165]
  - - [4096, 1024, 1, 16384]
    - [11, 90.519]
  - - [1024, 64, 256, 1024]
    - [15, 93.27]
  - - [64, 1024, 256, 1024]
    - [15, 93.45]
  - - [1024, 50304, 1, 2048]
    - [15, 96.59]
  - - [1024, 64, 32, 1024]
    - [6, 81.123]
  - - [64, 1024, 32, 1024]
    - [15, 81.67]
  - - [1024, 50304, 1, 4096]
    - [15, 96.653]
  - - [1024, 64, 64, 1024]
    - [6, 85.043]
  - - [64, 1024, 64, 1024]
    - [6, 85.532]
  - - [1024, 50304, 1, 8192]
    - [36, 96.987]
  - - [1024, 64, 128, 1024]
    - [7, 91.001]
  - - [64, 1024, 128, 1024]
    - [15, 91.387]
  - - [1024, 2, 1, 64]
    - [24, 0.078]
  - - [1024, 30528, 1, 8192]
    - [36, 96.768]
  - - [1024, 1024, 1, 64]
    - [9, 21.915]
  - - [64, 128, 1024, 128]
    - [80, 45.65]
  - - [128, 64, 1024, 128]
    - [57, 47.674]
  - - [1024, 1024, 1, 3456]
    - [10, 77.843]
  - - [1024, 1024, 1, 864]
    - [8, 66.605]
  - - [1024, 512, 1, 3456]
    - [10, 62.669]
  - - [1024, 512, 1, 864]
    - [20, 52.479]
  - - [13, 512, 1, 3456]
    - [120, 3.19]
  - - [13, 512, 1, 4096]
    - [120, 3.657]
  - - [13, 512, 1, 6912]
    - [120, 5.619]
  - - [13, 512, 1, 864]
    - [23, 1.498]
  - - [256, 1, 1, 3456]
    - [124, 0.117]
  - - [256, 1, 1, 4096]
    - [124, 0.137]
  - - [256, 1, 1, 6912]
    - [124, 0.194]
  - - [256, 1, 1, 864]
    - [28, 0.056]
  - - [256, 128, 1, 3456]
    - [118, 12.327]
  - - [256, 128, 1, 4096]
    - [118, 13.873]
  - - [256, 128, 1, 6912]
    - [118, 20.014]
  - - [256, 128, 1, 864]
    - [20, 7.55]
  - - [256, 3456, 1, 1]
    - [97, 0.399]
  - - [256, 4096, 1, 1]
    - [62, 0.438]
  - - [256, 6912, 1, 1]
    - [97, 0.562]
  - - [256, 864, 1, 1]
    - [67, 0.133]
  - - [480, 1024, 1, 3456]
    - [12, 58.662]
  - - [480, 1024, 1, 864]
    - [19, 49.711]
  - - [512, 256, 1, 3456]
    - [10, 37.458]
  - - [512, 256, 1, 864]
    - [19, 27.292]
  - - [30528, 1024, 1, 640]
    - [15, 95.23]
  - - [30528, 1024, 1, 1280]
    - [15, 95.939]
  - - [4096, 1024, 1, 10240]
    - [11, 90.338]
  - - [1024, 4096, 1, 10240]
    - [11, 90.3]
  - - [30528, 1024, 1, 1600]
    - [11, 96.127]
  - - [1024, 2, 1, 80]
    - [47, 0.091]
  - - [1024, 1024, 1, 10240]
    - [14, 80.596]
  - - [64, 128, 1280, 128]
    - [91, 45.997]
  - - [128, 64, 1280, 128]
    - [57, 48.235]
  - - [1024, 4096, 1, 10496]
    - [11, 90.287]
  - - [30528, 1024, 1, 1640]
    - [11, 95.948]
  - - [4096, 1024, 1, 10496]
    - [11, 90.267]
  - - [1024, 1024, 1, 10496]
    - [12, 80.531]
  - - [1024, 1024, 1, 82]
    - [59, 24.999]
  - - [1024, 2, 1, 82]
    - [47, 0.089]
  - - [128, 64, 1312, 128]
    - [57, 47.728]
  - - [64, 128, 1312, 128]
    - [98, 46.337]
  - - [30528, 1024, 1, 160]
    - [11, 89.983]
  - - [1024, 4096, 1, 6144]
    - [11, 90.013]
  - - [30528, 1024, 1, 240]
    - [6, 92.812]
  - - [4096, 1024, 1, 6144]
    - [11, 89.971]
  - - [1024, 1024, 1, 12]
    - [9, 4.974]
  - - [1024, 2, 1, 12]
    - [62, 0.019]
  - - [1024, 1024, 1, 6144]
    - [10, 79.785]
  - - [64, 512, 192, 512]
    - [15, 80.919]
  - - [512, 64, 192, 512]
    - [15, 80.426]
  - - [3136, 64, 64, 128]
    - [57, 60.241]
  - - [3136, 128, 64, 256]
    - [15, 92.419]
  - - [784, 256, 64, 512]
    - [15, 87.07]
  - - [3136, 256, 64, 128]
    - [11, 87.172]
  - - [3136, 256, 64, 256]
    - [15, 95.148]
  - - [196, 512, 64, 1024]
    - [58, 72.254]
  - - [784, 512, 64, 256]
    - [15, 87.455]
  - - [784, 512, 64, 512]
    - [15, 89.502]
  - - [196, 1024, 64, 512]
    - [6, 71.264]
  - - [196, 1024, 64, 1024]
    - [74, 72.617]
  - - [49, 1024, 64, 2048]
    - [6, 67.162]
  - - [49, 2048, 64, 1024]
    - [6, 70.117]
  - - [3136, 64, 32, 128]
    - [11, 54.887]
  - - [3136, 128, 32, 256]
    - [15, 89.005]
  - - [784, 256, 32, 512]
    - [15, 82.284]
  - - [3136, 256, 32, 128]
    - [15, 83.819]
  - - [3136, 256, 32, 256]
    - [7, 93.086]
  - - [196, 512, 32, 1024]
    - [52, 68.26]
  - - [784, 512, 32, 256]
    - [15, 83.772]
  - - [784, 512, 32, 512]
    - [6, 86.993]
  - - [196, 1024, 32, 512]
    - [15, 69.379]
  - - [196, 1024, 32, 1024]
    - [15, 71.229]
  - - [49, 1024, 32, 2048]
    - [15, 65.283]
  - - [49, 2048, 32, 1024]
    - [7, 65.456]
  - - [1024, 1024, 1, 10224]
    - [14, 80.043]
  - - [1024, 1024, 1, 10192]
    - [10, 79.872]
  - - [1024, 1024, 1, 10208]
    - [12, 80.653]
  - - [1024, 4096, 1, 10224]
    - [11, 90.323]
  - - [4096, 1024, 1, 10224]
    - [11, 90.256]
  - - [1024, 3072, 1, 10224]
    - [21, 95.741]
  - - [1024, 3072, 1, 10240]
    - [26, 96.221]
  - - [4096, 1024, 1, 10192]
    - [11, 90.336]
  - - [1024, 3072, 1, 10192]
    - [83, 95.7]
  - - [1024, 4096, 1, 10192]
    - [11, 90.315]
  - - [1024, 3072, 1, 10200]
    - [21, 95.737]
  - - [1024, 1024, 1, 10184]
    - [10, 80.115]
  - - [4096, 1024, 1, 10208]
    - [11, 90.317]
  - - [1024, 3072, 1, 10208]
    - [35, 96.214]
  - - [1024, 4096, 1, 10208]
    - [11, 90.304]
  - - [1024, 2048, 1, 10224]
    - [21, 89.338]
  - - [1024, 2048, 1, 10240]
    - [22, 89.643]
  - - [1024, 1024, 1, 10120]
    - [12, 79.77]
  - - [1024, 2048, 1, 10192]
    - [21, 89.19]
  - - [64, 24, 6816, 24]
    - [61, 9.274]
  - - [1024, 1024, 1, 10152]
    - [10, 80.157]
  - - [1024, 3072, 1, 10080]
    - [40, 96.151]
  - - [64, 26, 6272, 26]
    - [61, 10.497]
  - - [100352, 256, 1, 512]
    - [11, 90.652]
  - - [12544, 1024, 1, 2048]
    - [15, 94.935]
  - - [12544, 147, 1, 64]
    - [6, 25.693]
  - - [196, 2304, 1, 256]
    - [4, 29.942]
  - - [200704, 256, 1, 512]
    - [11, 82.946]
  - - [25088, 512, 1, 1024]
    - [15, 94.21]
  - - [3136, 576, 1, 64]
    - [65, 27.277]
  - - [49, 4608, 1, 512]
    - [19, 28.47]
  - - [50176, 512, 1, 1024]
    - [6, 94.935]
  - - [6272, 1024, 1, 2048]
    - [15, 91.182]
  - - [784, 1152, 1, 128]
    - [15, 31.767]
  - - [196, 1024, 128, 512]
    - [15, 72.984]
  - - [196, 1024, 256, 512]
    - [6, 73.884]
  - - [3136, 256, 128, 128]
    - [11, 89.125]
  - - [3136, 256, 256, 128]
    - [11, 90.382]
  - - [784, 512, 128, 256]
    - [6, 89.462]
  - - [784, 512, 256, 256]
    - [15, 90.382]
  - - [64, 128, 2048, 128]
    - [80, 47.769]
  - - [128, 64, 2048, 128]
    - [57, 49.758]
  - - [30528, 1024, 1, 2560]
    - [11, 96.45]
  - - [1024, 2, 1, 128]
    - [24, 0.133]
  - - [128, 64, 1536, 128]
    - [57, 48.519]
  - - [64, 128, 1536, 128]
    - [80, 47.317]
  - - [1024, 4096, 1, 12288]
    - [11, 90.437]
  - - [30528, 1024, 1, 1920]
    - [11, 96.322]
  - - [1024, 1024, 1, 96]
    - [13, 29.458]
  - - [1024, 1024, 1, 12288]
    - [10, 80.953]
  - - [4096, 1024, 1, 12288]
    - [99, 90.391]
  - - [1024, 2, 1, 96]
    - [47, 0.107]
  - - [25600, 128, 25, 128]
    - [11, 77.736]
  - - [12544, 128, 36, 128]
    - [11, 78.919]
  - - [9216, 128, 49, 128]
    - [11, 80.075]
  - - [6400, 128, 64, 128]
    - [11, 80.908]
  - - [6400, 256, 25, 256]
    - [15, 94.814]
  - - [4096, 256, 36, 256]
    - [11, 94.429]
  - - [2304, 256, 49, 256]
    - [15, 93.582]
  - - [2304, 256, 64, 256]
    - [11, 94.634]
  - - [2304, 512, 25, 512]
    - [15, 95.332]
  - - [1024, 512, 36, 512]
    - [6, 94.923]
  - - [1024, 512, 49, 512]
    - [7, 94.586]
  - - [1024, 512, 64, 512]
    - [15, 95.537]
  - - [92416, 64, 25, 64]
    - [57, 42.542]
  - - [50176, 64, 36, 64]
    - [57, 42.617]
  - - [36864, 64, 49, 64]
    - [57, 43.292]
  - - [25600, 64, 64, 64]
    - [57, 43.946]
  - - [64, 128, 192, 128]
    - [15, 37.492]
  - - [128, 64, 192, 128]
    - [6, 37.492]
  - - [768, 2, 1, 2048]
    - [5, 0.447]
  - - [3072, 768, 1, 2048]
    - [15, 82.14]
  - - [768, 3072, 1, 2048]
    - [15, 82.047]
  - - [768, 768, 1, 2048]
    - [12, 67.541]
  - - [64, 384, 144, 384]
    - [15, 73.787]
  - - [384, 64, 144, 384]
    - [15, 71.545]
  - - [768, 2, 1, 4608]
    - [118, 0.848]
  - - [3072, 768, 1, 4608]
    - [11, 83.58]
  - - [768, 3072, 1, 4608]
    - [11, 83.651]
  - - [768, 768, 1, 4608]
    - [12, 71.629]
  - - [64, 512, 48, 512]
    - [6, 67.836]
  - - [512, 64, 48, 512]
    - [7, 68.347]
  - - [64, 128, 256, 128]
    - [91, 39.406]
  - - [128, 64, 256, 128]
    - [80, 38.404]
  - - [64, 384, 192, 384]
    - [15, 74.301]
  - - [384, 64, 192, 384]
    - [15, 72.135]
  - - [1024, 2, 1, 4608]
    - [119, 1.074]
  - - [4096, 1024, 1, 4608]
    - [11, 89.813]
  - - [1024, 4096, 1, 4608]
    - [11, 89.86]
  - - [1024, 1024, 1, 4608]
    - [14, 78.982]
  - - [4880, 256, 49, 256]
    - [15, 92.512]
  - - [3128, 256, 64, 256]
    - [11, 90.796]
  - - [4680, 256, 49, 256]
    - [11, 91.973]
  - - [5280, 256, 36, 256]
    - [11, 90.944]
  - - [2640, 256, 64, 256]
    - [15, 91.934]
  - - [5304, 256, 49, 256]
    - [11, 91.972]
  - - [4524, 256, 49, 256]
    - [11, 90.907]
  - - [2760, 256, 64, 256]
    - [11, 90.573]
  - - [6440, 256, 36, 256]
    - [11, 91.775]
  - - [5704, 256, 36, 256]
    - [11, 91.668]
  - - [2666, 256, 64, 256]
    - [11, 90.181]
  - - [2128, 256, 64, 256]
    - [15, 90.819]
  - - [1160, 256, 49, 256]
    - [15, 83.77]
  - - [4056, 256, 49, 256]
    - [11, 91.587]
  - - [6144, 256, 36, 256]
    - [11, 95.353]
  - - [950, 2048, 2, 512]
    - [6, 81.846]
  - - [6336, 256, 36, 256]
    - [15, 95.178]
  - - [13600, 512, 2, 128]
    - [11, 67.907]
  - - [15200, 512, 2, 128]
    - [11, 67.457]
  - - [15200, 128, 2, 512]
    - [15, 81.996]
  - - [13600, 128, 2, 512]
    - [6, 81.392]
  - - [5632, 256, 36, 256]
    - [15, 94.991]
  - - [12288, 128, 2, 512]
    - [15, 86.513]
  - - [12880, 128, 2, 512]
    - [15, 78.759]
  - - [3220, 1024, 2, 256]
    - [6, 78.192]
  - - [768, 512, 2, 2048]
    - [22, 76.405]
  - - [11408, 128, 2, 512]
    - [6, 78.265]
  - - [782, 128, 64, 128]
    - [7, 53.171]
  - - [13824, 512, 2, 128]
    - [11, 81.903]
  - - [13824, 128, 2, 512]
    - [15, 86.046]
  - - [10560, 128, 2, 512]
    - [15, 84.637]
  - - [10752, 128, 2, 512]
    - [15, 77.547]
  - - [13600, 512, 2, 256]
    - [15, 85.417]
  - - [15200, 512, 2, 256]
    - [15, 85.307]
  - - [850, 2048, 2, 512]
    - [6, 74.591]
  - - [768, 2048, 2, 512]
    - [7, 85.696]
  - - [12880, 512, 2, 128]
    - [11, 67.808]
  - - [713, 512, 2, 2048]
    - [21, 70.341]
  - - [11616, 128, 2, 512]
    - [15, 79.877]
  - - [14208, 512, 2, 128]
    - [11, 81.402]
  - - [11408, 512, 2, 128]
    - [11, 66.653]
  - - [805, 2048, 2, 512]
    - [6, 77.162]
  - - [6912, 256, 36, 256]
    - [11, 95.469]
  - - [713, 2048, 2, 512]
    - [15, 76.488]
  - - [672, 512, 2, 2048]
    - [35, 66.784]
  - - [13824, 512, 2, 256]
    - [15, 90.429]
  - - [11616, 512, 2, 128]
    - [11, 65.849]
  - - [660, 512, 2, 2048]
    - [22, 65.799]
  - - [12288, 512, 2, 128]
    - [11, 79.939]
  - - [14208, 128, 2, 512]
    - [15, 80.62]
  - - [11968, 128, 2, 512]
    - [7, 84.26]
  - - [864, 2048, 2, 512]
    - [15, 77.4]
  - - [726, 512, 2, 2048]
    - [15, 71.698]
  - - [1008, 512, 2, 2048]
    - [10, 72.008]
  - - [10560, 512, 2, 128]
    - [15, 77.009]
  - - [672, 2048, 2, 512]
    - [15, 75.162]
  - - [660, 2048, 2, 512]
    - [6, 72.616]
  - - [9408, 128, 2, 512]
    - [7, 76.546]
  - - [10752, 512, 2, 128]
    - [11, 78.409]
  - - [726, 2048, 2, 512]
    - [6, 77.618]
  - - [11968, 512, 2, 128]
    - [15, 76.841]
  - - [1240, 256, 49, 256]
    - [15, 85.008]
  - - [4032, 256, 2, 1024]
    - [15, 82.056]
  - - [888, 2048, 2, 512]
    - [6, 78.877]
  - - [748, 512, 2, 2048]
    - [21, 73.793]
  - - [12880, 512, 2, 256]
    - [15, 88.21]
  - - [12288, 512, 2, 256]
    - [15, 90.111]
  - - [13440, 128, 2, 512]
    - [15, 83.92]
  - - [864, 2048, 2, 256]
    - [15, 69.084]
  - - [12672, 128, 2, 512]
    - [7, 79.715]
  - - [11264, 128, 2, 512]
    - [15, 80.163]
  - - [11776, 128, 2, 512]
    - [15, 83.706]
  - - [16128, 128, 2, 512]
    - [7, 82.625]
  - - [4032, 1024, 2, 256]
    - [6, 86.059]
  - - [14000, 128, 2, 512]
    - [15, 83.617]
  - - [13440, 512, 2, 128]
    - [11, 79.788]
  - - [864, 512, 2, 2048]
    - [49, 77.769]
  - - [805, 2048, 2, 256]
    - [7, 65.027]
  - - [768, 2048, 2, 256]
    - [6, 75.295]
  - - [3264, 1024, 2, 256]
    - [7, 85.499]
  - - [1251, 256, 49, 256]
    - [11, 84.089]
  - - [888, 512, 2, 2048]
    - [10, 63.725]
  - - [4200, 256, 2, 1024]
    - [15, 84.313]
  - - [2352, 1024, 2, 256]
    - [6, 77.941]
  - - [805, 512, 2, 2048]
    - [100, 78.434]
  - - [850, 512, 2, 2048]
    - [49, 72.048]
  - - [56, 512, 64, 512]
    - [15, 63.101]
  - - [2400, 1024, 2, 256]
    - [7, 76.942]
  - - [15200, 256, 2, 12]
    - [59, 9.522]
  - - [840, 512, 2, 2048]
    - [48, 72.304]
  - - [12880, 256, 2, 12]
    - [59, 9.41]
  - - [2520, 1024, 2, 256]
    - [6, 76.532]
  - - [13600, 256, 2, 12]
    - [59, 9.14]
  - - [15200, 256, 2, 3]
    - [97, 2.47]
  - - [850, 256, 2, 3]
    - [17, 0.718]
  - - [805, 256, 2, 12]
    - [84, 2.685]
  - - [228, 256, 2, 12]
    - [84, 0.853]
  - - [12880, 256, 2, 3]
    - [13, 2.456]
  - - [228, 256, 2, 3]
    - [24, 0.222]
  - - [805, 256, 2, 3]
    - [84, 0.714]
  - - [4200, 1024, 2, 256]
    - [15, 82.286]
  - - [12288, 256, 2, 12]
    - [59, 9.666]
  - - [850, 256, 2, 12]
    - [67, 2.769]
  - - [187, 256, 2, 12]
    - [67, 0.7]
  - - [768, 256, 2, 12]
    - [17, 2.953]
  - - [247, 256, 2, 12]
    - [24, 0.924]
  - - [13824, 256, 2, 12]
    - [101, 9.815]
  - - [864, 256, 2, 3]
    - [47, 0.842]
  - - [950, 256, 2, 12]
    - [63, 2.859]
  - - [176, 256, 2, 3]
    - [24, 0.193]
  - - [864, 256, 2, 12]
    - [4, 2.953]
  - - [13600, 256, 2, 3]
    - [96, 2.389]
  - - [950, 256, 2, 3]
    - [62, 0.765]
  - - [768, 256, 2, 3]
    - [67, 0.718]
  - - [1900, 1024, 1, 2048]
    - [41, 82.637]
  - - [7600, 512, 1, 256]
    - [15, 73.836]
  - - [1610, 1024, 1, 2048]
    - [15, 82.922]
  - - [6144, 512, 1, 256]
    - [7, 76.244]
  - - [1900, 1024, 1, 512]
    - [6, 69.601]
  - - [12544, 1024, 1, 1024]
    - [15, 94.106]
  - - [1024, 81, 1, 1024]
    - [34, 18.672]
  - - [3220, 256, 2, 12]
    - [13, 6.149]
  - - [187, 256, 2, 3]
    - [84, 0.182]
  - - [221, 256, 2, 3]
    - [67, 0.212]
  - - [221, 256, 2, 12]
    - [67, 0.838]
  - - [176, 256, 2, 12]
    - [84, 0.738]
  - - [247, 256, 2, 3]
    - [67, 0.244]
  - - [3220, 256, 2, 3]
    - [102, 1.604]
  - - [216, 256, 2, 3]
    - [84, 0.211]
  - - [192, 256, 2, 12]
    - [24, 0.749]
  - - [3800, 256, 2, 3]
    - [9, 1.708]
  - - [13824, 256, 2, 3]
    - [11, 2.559]
  - - [12288, 256, 2, 3]
    - [57, 2.578]
  - - [192, 256, 2, 3]
    - [47, 0.198]
  - - [216, 256, 2, 12]
    - [67, 0.831]
  - - [2688, 256, 2, 1024]
    - [8, 68.884]
  - - [3072, 256, 2, 12]
    - [65, 6.164]
  - - [3800, 256, 2, 12]
    - [97, 6.788]
  - - [3072, 256, 2, 3]
    - [65, 1.599]
  - - [2520, 256, 2, 1024]
    - [15, 80.571]
  - - [16128, 512, 2, 128]
    - [11, 81.564]
  - - [2400, 256, 2, 1024]
    - [15, 77.047]
  - - [2352, 256, 2, 1024]
    - [15, 74.996]
  - - [3036, 1024, 2, 256]
    - [15, 76.639]
  - - [2944, 256, 2, 1024]
    - [15, 73.922]
  - - [2992, 1024, 2, 256]
    - [6, 81.822]
  - - [2816, 256, 2, 1024]
    - [7, 70.933]
  - - [3036, 256, 2, 1024]
    - [15, 74.413]
  - - [2904, 1024, 2, 256]
    - [6, 77.795]
  - - [3456, 256, 2, 3]
    - [97, 1.709]
  - - [3400, 256, 2, 3]
    - [9, 1.681]
  - - [2816, 1024, 2, 256]
    - [7, 83.798]
  - - [3456, 256, 2, 12]
    - [13, 6.466]
  - - [2944, 1024, 2, 256]
    - [15, 83.106]
  - - [3168, 256, 2, 1024]
    - [7, 77.729]
  - - [850, 2048, 2, 256]
    - [7, 63.858]
  - - [2992, 256, 2, 1024]
    - [15, 74.026]
  - - [2852, 1024, 2, 256]
    - [7, 76.402]
  - - [51520, 256, 2, 12]
    - [57, 11.033]
  - - [3072, 256, 2, 1024]
    - [7, 76.89]
  - - [2640, 1024, 2, 256]
    - [6, 77.487]
  - - [2688, 1024, 2, 256]
    - [15, 81.217]
  - - [2904, 256, 2, 1024]
    - [6, 71.623]
  - - [3264, 256, 2, 1024]
    - [7, 81.266]
  - - [54400, 256, 2, 12]
    - [57, 11.455]
  - - [950, 2048, 2, 256]
    - [6, 68.748]
  - - [55296, 256, 2, 3]
    - [101, 2.993]
  - - [60800, 256, 2, 12]
    - [101, 11.546]
  - - [51520, 256, 2, 3]
    - [57, 2.923]
  - - [3700, 1024, 2, 256]
    - [15, 79.475]
  - - [55296, 256, 2, 12]
    - [101, 11.417]
  - - [2852, 256, 2, 1024]
    - [15, 70.121]
  - - [3600, 1024, 2, 256]
    - [6, 82.025]
  - - [3700, 256, 2, 1024]
    - [103, 74.529]
  - - [60800, 256, 2, 3]
    - [57, 2.998]
  - - [1269, 256, 49, 256]
    - [11, 84.166]
  - - [1467, 256, 49, 256]
    - [6, 83.093]
  - - [3500, 256, 2, 1024]
    - [15, 85.343]
  - - [952, 256, 64, 256]
    - [15, 86.431]
  - - [49152, 256, 2, 12]
    - [101, 9.819]
  - - [1449, 256, 49, 256]
    - [15, 83.712]
  - - [1278, 256, 49, 256]
    - [11, 82.531]
  - - [3360, 256, 2, 1024]
    - [15, 82.439]
  - - [736, 256, 64, 256]
    - [15, 84.009]
  - - [1413, 256, 49, 256]
    - [15, 82.124]
  - - [600, 256, 64, 256]
    - [15, 79.756]
  - - [1341, 256, 49, 256]
    - [15, 83.399]
  - - [1287, 256, 49, 256]
    - [6, 81.726]
  - - [1332, 256, 49, 256]
    - [15, 85.069]
  - - [1359, 256, 49, 256]
    - [11, 83.62]
  - - [1440, 256, 49, 256]
    - [15, 85.795]
  - - [1395, 256, 49, 256]
    - [11, 84.329]
  - - [1323, 256, 49, 256]
    - [15, 82.741]
  - - [1404, 256, 49, 256]
    - [11, 85.733]
  - - [1386, 256, 49, 256]
    - [11, 84.207]
  - - [3168, 1024, 2, 256]
    - [15, 79.631]
  - - [1350, 256, 49, 256]
    - [11, 83.279]
  - - [1368, 256, 49, 256]
    - [15, 85.408]
  - - [49152, 256, 2, 3]
    - [101, 2.631]
  - - [3600, 256, 2, 1024]
    - [32, 78.036]
  - - [3500, 1024, 2, 256]
    - [6, 79.06]
  - - [3360, 1024, 2, 256]
    - [15, 79.628]
  - - [3220, 256, 2, 1024]
    - [15, 78.354]
  - - [690, 256, 64, 256]
    - [6, 80.41]
  - - [54400, 256, 2, 3]
    - [57, 2.998]
  - - [3072, 1024, 2, 256]
    - [6, 84.894]
  - - [2640, 256, 2, 1024]
    - [8, 66.288]
  - - [616, 256, 64, 256]
    - [15, 81.085]
  - - [3008, 256, 64, 256]
    - [15, 95.064]
  - - [896, 256, 64, 256]
    - [15, 90.909]
  - - [768, 256, 64, 256]
    - [6, 90.504]
  - - [660, 256, 64, 256]
    - [15, 79.563]
  - - [3552, 256, 2, 1024]
    - [32, 72.412]
  - - [3552, 1024, 2, 256]
    - [15, 81.087]
  - - [800, 256, 64, 256]
    - [15, 83.73]
  - - [1120, 256, 49, 256]
    - [15, 85.219]
  - - [2408, 256, 64, 256]
    - [11, 91.142]
  - - [3456, 256, 2, 1024]
    - [15, 85.685]
  - - [672, 256, 64, 256]
    - [15, 82.215]
  - - [782, 256, 64, 256]
    - [6, 79.642]
  - - [884, 256, 64, 256]
    - [15, 84.307]
  - - [3456, 1024, 2, 256]
    - [7, 85.326]
  - - [1064, 256, 49, 256]
    - [15, 84.979]
  - - [3400, 256, 2, 1024]
    - [15, 83.076]
  - - [704, 256, 64, 256]
    - [6, 89.25]
  - - [3400, 1024, 2, 256]
    - [6, 79.225]
  - - [3264, 256, 64, 256]
    - [6, 95.373]
  - - [3800, 1024, 2, 256]
    - [15, 80.742]
  - - [3800, 256, 2, 1024]
    - [32, 78.074]
  - - [6440, 512, 1, 256]
    - [6, 68.666]
  - - [6912, 512, 1, 256]
    - [15, 77.621]
  - - [6800, 512, 1, 256]
    - [15, 73.032]
  - - [6800, 512, 1, 1024]
    - [15, 88.134]
  - - [6440, 512, 1, 1024]
    - [15, 83.744]
  - - [6912, 512, 1, 1024]
    - [15, 90.429]
  - - [1728, 1024, 1, 512]
    - [7, 77.769]
  - - [1536, 1024, 1, 512]
    - [7, 70.062]
  - - [1610, 1024, 1, 512]
    - [7, 69.8]
  - - [7600, 512, 1, 1024]
    - [15, 88.415]
  - - [6144, 512, 1, 1024]
    - [15, 91.129]
  - - [1700, 1024, 1, 512]
    - [7, 73.973]
  - - [1728, 1024, 1, 2048]
    - [15, 89.931]
  - - [1536, 1024, 1, 2048]
    - [10, 82.109]
  - - [1700, 1024, 1, 2048]
    - [15, 87.749]
  - - [1024, 320, 1, 1024]
    - [19, 50.072]
  - - [2, 1024, 1, 6]
    - [67, 0.009]
  - - [3840, 4224, 1, 4096]
    - [0, 99.439]
  - - [3840, 4224, 1, 4224]
    - [1, 99.46]
  - - [3840, 4224, 1, 4320]
    - [0, 99.474]
  - - [7680, 8448, 1, 8192]
    - [1, 99.787]
  - - [7680, 8448, 1, 8448]
    - [2, 99.787]
  - - [7680, 8448, 1, 8640]
    - [1, 99.794]
  - - [512, 256, 1, 128]
    - [20, 8.13]
  - - [13, 512, 1, 128]
    - [47, 0.413]
  - - [27, 16, 128, 27]
    - [84, 0.792]
  - - [367, 512, 1, 128]
    - [24, 10.524]
  - - [64, 16, 1, 128]
    - [104, 0.063]
  - - [27, 16, 1, 27]
    - [24, 0.007]
  - - [2000, 60483, 1, 100]
    - [130, 69.694]
  - - [2, 600, 1, 100]
    - [131, 0.042]
  - - [1200, 1200, 1, 10]
    - [132, 3.8625]
  - - [13, 1200, 1, 10]
    - [133, 0.0675]
  - - [3600, 2400, 1, 10]
    - [134, 8.045]
  - - [2400, 2400, 1, 10]
    - [135, 7.1315]
  - - [4, 1200, 1, 10]
    - [133, 0.0215]
  - - [2, 1200, 1, 10]
    - [133, 0.011]
  - - [1568, 1024, 1, 2048]
    - [136, 82.8815]
  - - [1568, 1024, 1, 512]
    - [137, 67.3595]
  - - [1280, 100, 1, 1792]
    - [112, 26.37]
  - - [4096, 4096, 1, 32]
    - [57, 27.778]
  - - [768, 768, 1, 7168]
    - [121, 76.642]
  - - [3136, 96, 32, 128]
    - [15, 54.217]
  - - [49, 1024, 32, 128]
    - [6, 26.164]
  - - [49, 1216, 32, 128]
    - [7, 30.133]
  - - [49, 1376, 32, 128]
    - [7, 30.58]
  - - [49, 992, 32, 128]
    - [6, 25.063]
  - - [224, 64, 160, 224]
    - [15, 43.854]
  - - [224, 64, 384, 224]
    - [11, 52.18]
  - - [224, 64, 512, 224]
    - [107, 54.643]
  - - [512, 512, 8, 8192]
    - [46, 84.119]
  - - [2048, 2048, 2, 8192]
    - [15, 89.3]
  - - [1000, 16, 1, 1664]
    - [23, 3.846]
  - - [1000, 16, 1, 1920]
    - [119, 4.273]
  - - [1000, 256, 1, 1664]
    - [23, 39.019]
  - - [1000, 256, 1, 1920]
    - [20, 39.626]
  - - [1000, 256, 1, 2048]
    - [20, 39.979]
  - - [1000, 32, 1, 4096]
    - [123, 12.925]
  - - [1000, 64, 1, 1664]
    - [23, 15.333]
  - - [1000, 96, 1, 2048]
    - [50, 24.342]
  - - [1000, 96, 1, 4096]
    - [123, 29.584]
  - - [100, 1024, 1, 1000]
    - [20, 16.481]
  - - [100, 16, 1, 1024]
    - [120, 0.294]
  - - [100, 16, 1, 768]
    - [44, 0.253]
  - - [100, 224, 1, 768]
    - [23, 3.623]
  - - [100, 256, 1, 1000]
    - [23, 4.596]
  - - [100, 48, 1, 1024]
    - [34, 0.865]
  - - [100, 48, 1, 768]
    - [20, 0.759]
  - - [100, 4, 1, 1024]
    - [118, 0.08]
  - - [100, 4, 1, 768]
    - [5, 0.063]
  - - [100, 5376, 1, 1280]
    - [15, 44.62]
  - - [100, 5376, 1, 768]
    - [15, 39.421]
  - - [100, 896, 1, 1280]
    - [24, 17.171]
  - - [100, 896, 1, 768]
    - [23, 13.969]
  - - [1024, 48, 1, 1024]
    - [23, 8.159]
  - - [1024, 896, 1, 4096]
    - [90, 72.47]
  - - [1280, 224, 1, 1280]
    - [23, 40.537]
  - - [1280, 896, 1, 1280]
    - [107, 67.097]
  - - [1280, 896, 1, 3840]
    - [22, 74.418]
  - - [1280, 896, 1, 5120]
    - [15, 75.458]
  - - [4096, 256, 1, 25088]
    - [128, 82.541]
  - - [4096, 256, 1, 4096]
    - [105, 73.179]
  - - [4096, 32, 1, 25088]
    - [112, 37.488]
  - - [4096, 32, 1, 4096]
    - [10, 34.173]
  - - [4096, 3584, 1, 1024]
    - [15, 88.776]
  - - [4096, 896, 1, 1024]
    - [15, 78.119]
  - - [4096, 96, 1, 25088]
    - [112, 59.451]
  - - [4096, 96, 1, 4096]
    - [112, 64.576]
  - - [768, 10752, 1, 768]
    - [15, 85.059]
  - - [768, 16, 1, 768]
    - [28, 1.841]
  - - [768, 224, 1, 2304]
    - [105, 40.141]
  - - [768, 224, 1, 3072]
    - [105, 42.228]
  - - [768, 224, 1, 768]
    - [23, 25.337]
  - - [768, 3584, 1, 3072]
    - [90, 79.972]
  - - [768, 48, 1, 768]
    - [28, 5.596]
  - - [768, 4, 1, 768]
    - [28, 0.451]
  - - [768, 5376, 1, 3072]
    - [11, 83.384]
  - - [768, 896, 1, 2304]
    - [22, 63.118]
  - - [768, 896, 1, 3072]
    - [22, 65.251]
  - - [224, 224, 12, 64]
    - [71, 10.589]
  - - [224, 224, 20, 64]
    - [80, 14.329]
  - - [224, 224, 192, 64]
    - [15, 35.946]
  - - [224, 224, 256, 64]
    - [7, 38.512]
  - - [224, 224, 288, 64]
    - [15, 39.062]
  - - [224, 224, 48, 64]
    - [43, 22.775]
  - - [224, 224, 480, 64]
    - [15, 41.179]
  - - [224, 224, 576, 64]
    - [15, 41.472]
  - - [224, 224, 64, 64]
    - [7, 25.657]
  - - [224, 224, 768, 64]
    - [15, 42.26]
  - - [224, 224, 80, 64]
    - [7, 28.586]
  - - [64, 224, 48, 224]
    - [80, 27.676]
  - - [64, 224, 576, 224]
    - [107, 52.36]
  - - [64, 224, 768, 224]
    - [107, 54.482]
  - - [3200, 4096, 1, 512]
    - [139, 86.832]
  - - [39488, 512, 1, 512]
    - [140, 87.442]
  - - [512, 5120, 1, 512]
    - [141, 79.455]
  - - [512, 12128, 1, 512]
    - [142, 84.279]
  - - [512, 27232, 1, 512]
    - [143, 88.212]
  - - [64, 160, 1, 512]
    - [144, 2.977]
  - - [512, 39488, 1, 512]
    - [145, 89.728]
  - - [2400, 256, 1, 1024]
    - [112, 55.812]
  - - [2400, 256, 1, 512]
    - [12, 44.163]
  - - [256, 12840, 1, 1024]
    - [141, 82.304]
  - - [256, 12840, 1, 512]
    - [142, 75.691]
  - - [256, 2400, 1, 1024]
    - [8, 54.735]
  - - [256, 2400, 1, 512]
    - [105, 42.065]
  - - [256, 256, 1, 1024]
    - [20, 13.501]
  - - [256, 256, 1, 512]
    - [20, 8.543]
  - - [256, 3200, 1, 1024]
    - [15, 67.027]
  - - [256, 3200, 1, 512]
    - [141, 53.546]
  - - [256, 9630, 1, 1024]
    - [141, 79.835]
  - - [256, 9630, 1, 512]
    - [141, 71.371]
  - - [4800, 256, 1, 1024]
    - [141, 72.886]
  - - [4800, 256, 1, 512]
    - [7, 61.105]
  - - [642, 10, 1, 163840]
    - [118, 13.289]
  - - [642, 10, 1, 81920]
    - [118, 12.909]
  - - [642, 30, 1, 163840]
    - [118, 35.578]
  - - [642, 30, 1, 81920]
    - [118, 34.786]
  - - [15, 160, 1024, 642]
    - [38, 24.493]
  - - [15, 160, 512, 642]
    - [38, 23.78]
  - - [20, 160, 1024, 642]
    - [69, 31.319]
  - - [20, 160, 512, 642]
    - [94, 29.944]
  - - [2001, 2001, 1, 51]
    - [146, 18.058]
  - - [3001, 3001, 1, 51]
    - [147, 21.849]
  - - [4454, 4454, 1, 51]
    - [148, 27.463]
  - - [6454, 6454, 1, 51]
    - [149, 30.928]
  - - [7985, 7985, 1, 51]
    - [150, 30.243]
  - - [9603, 9603, 1, 51]
    - [151, 30.175]
  - - [11505, 11505, 1, 51]
    - [152, 30.583]
  - - [13179, 13179, 1, 51]
    - [150, 31.589]
  - - [15420, 15420, 1, 51]
    - [149, 38.02]
  - - [17445, 17445, 1, 51]
    - [153, 32.665]
  - - [19343, 19343, 1, 51]
    - [153, 31.577]
  - - [21581, 21581, 1, 51]
    - [150, 31.226]
  - - [25854, 25854, 1, 51]
    - [153, 31.891]
  - - [30421, 30421, 1, 51]
    - [154, 30.567]
  - - [35882, 35882, 1, 51]
    - [155, 32.383]
  - - [40401, 40401, 1, 51]
    - [156, 30.068]
  - - [45312, 45312, 1, 51]
    - [157, 56.143]
  - - [51821, 51821, 1, 51]
    - [155, 30.502]
  - - [60766, 60766, 1, 51]
    - [155, 31.374]
  - - [67143, 67143, 1, 51]
    - [155, 30.861]
  - - [74567, 74567, 1, 51]
    - [155, 30.718]
  - - [79001, 79001, 1, 51]
    - [158, 30.348]
  - - [83456, 83456, 1, 51]
    - [159, 53.743]
  - - [88001, 88001, 1, 51]
    - [155, 30.494]
  - - [92345, 92345, 1, 51]
    - [160, 30.194]
  - - [2001, 2001, 1, 103]
    - [161, 32.385]
  - - [3001, 3001, 1, 103]
    - [162, 41.91]
  - - [4454, 4454, 1, 103]
    - [163, 52.476]
  - - [6454, 6454, 1, 103]
    - [149, 59.83]
  - - [7985, 7985, 1, 103]
    - [164, 59.353]
  - - [9603, 9603, 1, 103]
    - [152, 58.866]
  - - [11505, 11505, 1, 103]
    - [149, 59.795]
  - - [13179, 13179, 1, 103]
    - [149, 61.518]
  - - [15420, 15420, 1, 103]
    - [165, 69.689]
  - - [17445, 17445, 1, 103]
    - [166, 58.876]
  - - [19343, 19343, 1, 103]
    - [167, 59.144]
  - - [21581, 21581, 1, 103]
    - [168, 59.224]
  - - [25854, 25854, 1, 103]
    - [169, 60.787]
  - - [30421, 30421, 1, 103]
    - [168, 58.883]
  - - [35882, 35882, 1, 103]
    - [170, 63.074]
  - - [40401, 40401, 1, 103]
    - [156, 59.421]
  - - [45312, 45312, 1, 103]
    - [146, 95.637]
  - - [51821, 51821, 1, 103]
    - [171, 58.819]
  - - [60766, 60766, 1, 103]
    - [168, 60.137]
  - - [67143, 67143, 1, 103]
    - [168, 60.333]
  - - [74567, 74567, 1, 103]
    - [170, 60.073]
  - - [79001, 79001, 1, 103]
    - [170, 59.939]
  - - [83456, 83456, 1, 103]
    - [172, 93.408]
  - - [88001, 88001, 1, 103]
    - [173, 58.264]
  - - [92345, 92345, 1, 103]
    - [168, 58.825]
  - - [2001, 2001, 1, 223]
    - [174, 57.204]
  - - [3001, 3001, 1, 223]
    - [175, 69.117]
  - - [4454, 4454, 1, 223]
    - [176, 82.789]
  - - [6454, 6454, 1, 223]
    - [177, 87.173]
  - - [7985, 7985, 1, 223]
    - [178, 90.147]
  - - [9603, 9603, 1, 223]
    - [179, 91.216]
  - - [11505, 11505, 1, 223]
    - [177, 93.922]
  - - [13179, 13179, 1, 223]
    - [176, 94.748]
  - - [15420, 15420, 1, 223]
    - [179, 94.698]
  - - [17445, 17445, 1, 223]
    - [177, 94.859]
  - - [19343, 19343, 1, 223]
    - [177, 95.561]
  - - [32768, 32768, 1, 51]
    - [180, 55.934]
  - - [32769, 32769, 1, 51]
    - [181, 34.052]
  - - [32768, 32768, 1, 103]
    - [182, 90.089]
  - - [32769, 32769, 1, 103]
    - [183, 60.225]
  - - [2001, 2001, 1, 511]
    - [184, 73.548]
  - - [3001, 3001, 1, 511]
    - [185, 79.911]
  - - [4454, 4454, 1, 511]
    - [184, 91.134]
  - - [6454, 6454, 1, 511]
    - [184, 92.985]
  - - [7985, 7985, 1, 511]
    - [185, 94.092]
  - - [9603, 9603, 1, 511]
    - [184, 94.197]
  - - [11505, 11505, 1, 511]
    - [184, 96.299]
  - - [13179, 13179, 1, 511]
    - [186, 96.994]
  - - [15420, 15420, 1, 511]
    - [184, 96.677]
  - - [17445, 17445, 1, 511]
    - [184, 96.589]
  - - [19343, 19343, 1, 511]
    - [187, 96.63]
  - - [2001, 2001, 1, 2201]
    - [188, 88.119]
  - - [3001, 3001, 1, 2201]
    - [189, 90.721]
  - - [4454, 4454, 1, 2201]
    - [190, 95.417]
  - - [6454, 6454, 1, 2201]
    - [191, 95.042]
  - - [7985, 7985, 1, 2201]
    - [192, 95.435]
  - - [9603, 9603, 1, 2201]
    - [193, 95.34]
  - - [11505, 11505, 1, 2201]
    - [194, 97.29]
  - - [13179, 13179, 1, 2201]
    - [195, 97.775]
  - - [15420, 15420, 1, 2201]
    - [196, 97.26]
  - - [17445, 17445, 1, 2201]
    - [197, 97.051]
  - - [19343, 19343, 1, 2201]
    - [193, 97.119]
  - - [2001, 2001, 1, 4101]
    - [188, 90.766]
  - - [3001, 3001, 1, 4101]
    - [198, 94.181]
  - - [4454, 4454, 1, 4101]
    - [191, 96.224]
  - - [6454, 6454, 1, 4101]
    - [198, 96.584]
  - - [7985, 7985, 1, 4101]
    - [198, 96.598]
  - - [9603, 9603, 1, 4101]
    - [191, 95.553]
  - - [11505, 11505, 1, 4101]
    - [191, 97.496]
  - - [13179, 13179, 1, 4101]
    - [186, 97.882]
  - - [15420, 15420, 1, 4101]
    - [184, 97.426]
  - - [17445, 17445, 1, 4101]
    - [197, 97.178]
  - - [19343, 19343, 1, 4101]
    - [196, 97.233]
  - - [21581, 21581, 1, 223]
    - [199, 94.699]
  - - [21581, 21581, 1, 511]
    - [200, 96.98]
