library/src/blas3/Tensile/Logic/asm_full/aldebaran/aldebaran_Cijk_Alik_Bljk_BBS_BH.yaml
- {MinimumRequiredVersion: 4.31.0}
- aldebaran
- gfx90a
- [Device 0050, Device 0051, Device 0052, Device 0054, Device 0062, Device 7400, Device
    SolutionIndex: 0
    SolutionIndex: 1
    SolutionIndex: 2
    SolutionIndex: 3
    SolutionNameMin: Cijk_Alik_Bljk_BBS_BH_MT32x32x64_MI16x16x8x1_SE_1LDSB0_AF0EM8_GRVW8_LBSPP128_LPA8_LPB8_PLR9_SU0_SUS256_SRVW0_TT1_16_WG32_8_1_WGM2
    SolutionIndex: 4
    SolutionNameMin: Cijk_Alik_Bljk_BBS_BH_MT128x64x64_MI32x32x8x1_SE_1LDSB1_AF0EM8_EPS0_GRVW8_GSU1_GSUAMB_LBSPP128_LPA8_LPB8_LRVW8_PGR2_PLR9_SU0_SUS0_SRVW4_TT2_32_VAW2_WSGRA1_WSGRB1_WG64_4_1_WGM15
    SolutionIndex: 5
    SolutionNameMin: Cijk_Alik_Bljk_BBS_BH_MT128x96x64_MI32x32x8x1_SE_1LDSB1_AF0EM8_EPS0_GRVW8_GSU1_GSUAMB_LBSPP128_LPA8_LPB8_LRVW8_PGR2_PLR9_SU32_SUS128_SRVW4_TT1_96_VAW2_WSGRA1_WSGRB1_WG128_2_1_WGM15
    SolutionIndex: 6
    SolutionNameMin: Cijk_Alik_Bljk_BBS_BH_MT256x128x64_MI32x32x8x1_SE_1LDSB1_AF0EM8_EPS0_GRVW2_GSU1_GSUAMB_LBSPP128_LPA8_LPB8_LRVW8_PGR2_PLR9_SU0_SUS0_SRVW4_TT4_64_VAW2_WSGRA1_WSGRB1_WG64_4_1_WGM1
    SolutionIndex: 7
    SolutionNameMin: Cijk_Alik_Bljk_BBS_BH_MT64x64x64_MI32x32x8x1_SE_1LDSB1_AF0EM1_EPS1_GRVW8_GSU1_GSUAMB_LBSPP128_LPA8_LPB8_LRVW8_PGR1_PLR9_SU32_SUS128_SRVW4_TT1_32_VAW2_WSGRA1_WSGRB1_WG64_4_1_WGM1
    SolutionIndex: 8
    SolutionNameMin: Cijk_Alik_Bljk_BBS_BH_MT128x256x32_MI32x32x8x1_SE_1LDSB1_AF0EM8_EPS0_GRVW8_GSU1_GSUAMB_LBSPP128_LPA8_LPB8_LRVW8_PGR2_PLR5_SU32_SUS128_SRVW4_TT2_128_VAW2_WSGRA1_WSGRB1_WG64_4_1_WGM15
    SolutionIndex: 9
    SolutionNameMin: Cijk_Alik_Bljk_BBS_BH_MT128x96x64_MI32x32x8x1_SE_1LDSB1_AF0EM8_EPS0_GRVW8_GSU1_GSUAMB_LBSPP128_LPA8_LPB8_LRVW8_PGR2_PLR9_SU0_SUS0_SRVW4_TT1_96_VAW2_WSGRA1_WSGRB1_WG128_2_1_WGM1
    SolutionIndex: 10
    SolutionNameMin: Cijk_Alik_Bljk_BBS_BH_MT128x96x64_MI32x32x8x1_SE_1LDSB1_AF0EM8_EPS0_GRVW8_GSU1_GSUAMB_LBSPP128_LPA8_LPB8_LRVW8_PGR2_PLR9_SU32_SUS128_SRVW4_TT1_96_VAW2_WSGRA1_WSGRB1_WG128_2_1_WGM2
    SolutionIndex: 11
    SolutionNameMin: Cijk_Alik_Bljk_BBS_BH_MT32x64x64_MI16x16x16x1_SE_1LDSB1_AF0EM1_EPS1_GRVW8_GSU1_GSUAMB_LBSPP128_LPA16_LPB16_LRVW8_PGR1_PLR5_SU32_SUS128_SRVW4_TT1_32_VAW2_WSGRA1_WSGRB1_WG32_8_1_WGM1
    SolutionIndex: 12
    SolutionNameMin: Cijk_Alik_Bljk_BBS_BH_MT64x32x64_MI16x16x16x1_SE_1LDSB1_AF0EM8_EPS1_GRVW8_GSU1_GSUAMB_LBSPP128_LPA16_LPB16_LRVW8_PGR1_PLR5_SU0_SUS0_SRVW4_TT2_16_VAW2_WSGRA1_WSGRB1_WG32_8_1_WGM1
    SolutionIndex: 13
    SolutionNameMin: Cijk_Alik_Bljk_BBS_BH_MT64x32x64_MI16x16x16x1_SE_1LDSB1_AF0EM1_EPS1_GRVW8_GSU1_GSUAMB_LBSPP128_LPA16_LPB16_LRVW8_PGR1_PLR5_SU0_SUS0_SRVW4_TT2_16_VAW2_WSGRA1_WSGRB1_WG32_8_1_WGM1
    SolutionIndex: 14
    SolutionNameMin: Cijk_Alik_Bljk_BBS_BH_MT128x64x64_MI32x32x8x1_SE_1LDSB1_AF0EM8_EPS0_GRVW8_GSU1_GSUAMB_LBSPP128_LPA8_LPB8_LRVW8_PGR2_PLR9_SU32_SUS128_SRVW4_TT2_32_VAW2_WSGRA1_WSGRB1_WG64_4_1_WGM15
    SolutionIndex: 15
    SolutionNameMin: Cijk_Alik_Bljk_BBS_BH_MT128x96x64_MI32x32x8x1_SE_1LDSB1_AF0EM1_EPS0_GRVW8_GSU1_GSUAMB_LBSPP128_LPA8_LPB8_LRVW8_PGR2_PLR9_SU0_SUS0_SRVW4_TT1_96_VAW2_WSGRA1_WSGRB1_WG128_2_1_WGM15
    SolutionIndex: 16
    SolutionNameMin: Cijk_Alik_Bljk_BBS_BH_MT64x64x64_MI32x32x8x1_SE_1LDSB1_AF0EM8_EPS1_GRVW8_GSU1_GSUAMB_LBSPP128_LPA8_LPB8_LRVW8_PGR1_PLR9_SU0_SUS0_SRVW4_TT1_32_VAW2_WSGRA1_WSGRB1_WG64_4_1_WGM1
    SolutionIndex: 17
    SolutionNameMin: Cijk_Alik_Bljk_BBS_BH_MT128x64x32_MI32x32x8x1_SE_1LDSB0_AF0EM8_EPS0_GRVW4_GSU1_GSUAMB_LBSPP128_LPA8_LPB8_LRVW8_PGR2_PLR5_SU0_SUS0_SRVW4_TT2_32_VAW2_WSGRA1_WSGRB1_WG64_4_1_WGM15
    SolutionIndex: 18
    SolutionNameMin: Cijk_Alik_Bljk_BBS_BH_MT64x64x32_MI32x32x8x1_SE_1LDSB1_AF0EM8_EPS0_GRVW2_GSU1_GSUAMB_LBSPP128_LPA8_LPB8_LRVW8_PGR2_PLR5_SU0_SUS0_SRVW4_TT1_32_VAW2_WSGRA1_WSGRB1_WG64_4_1_WGM1
    SolutionIndex: 19
    SolutionNameMin: Cijk_Alik_Bljk_BBS_BH_MT128x64x64_MI32x32x8x1_SE_1LDSB1_AF0EM1_EPS1_GRVW8_GSU1_GSUAMB_LBSPP128_LPA8_LPB8_LRVW8_PGR1_PLR9_SU0_SUS0_SRVW4_TT2_32_VAW2_WSGRA1_WSGRB1_WG64_4_1_WGM15
    SolutionIndex: 20
    SolutionNameMin: Cijk_Alik_Bljk_BBS_BH_MT128x96x64_MI32x32x8x1_SE_1LDSB1_AF0EM8_EPS0_GRVW8_GSU1_GSUAMB_LBSPP128_LPA8_LPB8_LRVW8_PGR2_PLR9_SU0_SUS0_SRVW4_TT1_96_VAW2_WSGRA1_WSGRB1_WG128_2_1_WGM2
    SolutionIndex: 21
    SolutionNameMin: Cijk_Alik_Bljk_BBS_BH_MT64x32x64_MI16x16x16x1_SE_1LDSB0_AF0EM8_EPS0_GRVW8_GSU1_GSUAMB_LBSPP128_LPA16_LPB16_LRVW8_PGR2_PLR5_SU0_SUS0_SRVW4_TT2_16_VAW2_WSGRA1_WSGRB1_WG32_8_1_WGM15
    SolutionIndex: 22
    SolutionNameMin: Cijk_Alik_Bljk_BBS_BH_MT128x160x64_MI32x32x8x1_SE_1LDSB1_AF0EM8_EPS0_GRVW8_GSU1_GSUAMB_LBSPP128_LPA8_LPB8_LRVW8_PGR2_PLR9_SU32_SUS128_SRVW4_TT1_160_VAW2_WSGRA1_WSGRB1_WG128_2_1_WGM15
    SolutionIndex: 23
    SolutionNameMin: Cijk_Alik_Bljk_BBS_BH_MT256x160x64_MI32x32x8x1_SE_1LDSB1_AF0EM8_EPS0_GRVW2_GSU1_GSUAMB_LBSPP128_LPA8_LPB8_LRVW8_PGR2_PLR9_SU32_SUS256_SRVW4_TT2_160_VAW2_WSGRA1_WSGRB1_WG128_2_1_WGM2
    SolutionIndex: 24
    SolutionNameMin: Cijk_Alik_Bljk_BBS_BH_MT256x256x32_MI32x32x8x1_SE_1LDSB1_AF0EM1_EPS1_GRVW2_GSU1_GSUAMB_LBSPP128_LPA8_LPB8_LRVW8_PGR1_PLR5_SU0_SUS0_SRVW4_TT4_128_VAW2_WSGRA1_WSGRB1_WG64_4_1_WGM2
    SolutionIndex: 25
    SolutionNameMin: Cijk_Alik_Bljk_BBS_BH_MT128x96x64_MI32x32x8x1_SE_1LDSB0_AF0EM8_EPS0_GRVW8_GSU1_GSUAMB_LBSPP128_LPA8_LPB8_LRVW8_PGR2_PLR9_SU0_SUS0_SRVW4_TT1_96_VAW2_WSGRA1_WSGRB1_WG128_2_1_WGM2
    SolutionIndex: 26
    SolutionNameMin: Cijk_Alik_Bljk_BBS_BH_MT32x32x32_MI16x16x16x1_SE_1LDSB0_AF0EM1_EPS0_GRVW2_GSU1_GSUAMB_LBSPP128_LPA16_LPB16_LRVW8_PGR2_PLR2_SU0_SUS0_SRVW4_TT1_16_VAW2_WSGRA1_WSGRB1_WG32_8_1_WGM1
    SolutionIndex: 27
    SolutionNameMin: Cijk_Alik_Bljk_BBS_BH_MT128x96x64_MI32x32x8x1_SE_1LDSB0_AF0EM8_EPS0_GRVW2_GSU1_GSUAMB_LBSPP128_LPA8_LPB8_LRVW8_PGR2_PLR9_SU32_SUS128_SRVW4_TT1_96_VAW2_WSGRA1_WSGRB1_WG128_2_1_WGM15
    SolutionIndex: 28
    SolutionNameMin: Cijk_Alik_Bljk_BBS_BH_MT128x64x64_MI32x32x8x1_SE_1LDSB1_AF0EM8_EPS0_GRVW8_GSU1_GSUAMB_LBSPP128_LPA8_LPB8_LRVW8_PGR2_PLR9_SU0_SUS0_SRVW4_TT2_32_VAW2_WSGRA1_WSGRB1_WG64_4_1_WGM2
    SolutionIndex: 29
    SolutionNameMin: Cijk_Alik_Bljk_BBS_BH_MT128x256x32_MI32x32x8x1_SE_1LDSB1_AF0EM8_EPS0_GRVW8_GSU1_GSUAMB_LBSPP128_LPA8_LPB8_LRVW8_PGR2_PLR5_SU0_SUS0_SRVW4_TT2_128_VAW2_WSGRA1_WSGRB1_WG64_4_1_WGM15
    SolutionIndex: 30
    SolutionNameMin: Cijk_Alik_Bljk_BBS_BH_MT64x64x64_MI32x32x8x1_SE_1LDSB1_AF0EM8_EPS1_GRVW8_GSU1_GSUAMB_LBSPP128_LPA8_LPB8_LRVW8_PGR1_PLR9_SU32_SUS128_SRVW4_TT1_32_VAW2_WSGRA1_WSGRB1_WG64_4_1_WGM15
    SolutionIndex: 31
    SolutionNameMin: Cijk_Alik_Bljk_BBS_BH_MT64x128x64_MI32x32x8x1_SE_1LDSB1_AF0EM8_EPS0_GRVW8_GSU1_GSUAMB_LBSPP128_LPA8_LPB8_LRVW8_PGR2_PLR9_SU32_SUS256_SRVW4_TT1_64_VAW2_WSGRA1_WSGRB1_WG64_4_1_WGM15
    SolutionIndex: 32
    SolutionNameMin: Cijk_Alik_Bljk_BBS_BH_MT96x96x64_MI16x16x16x1_SE_1LDSB1_AF0EM8_EPS1_GRVW8_GSU1_GSUAMB_LBSPP128_LPA16_LPB16_LRVW8_PGR1_PLR5_SU32_SUS256_SRVW0_TT3_48_VAW2_WSGRA1_WSGRB1_WG32_8_1_WGM1
    SolutionIndex: 33
    SolutionNameMin: Cijk_Alik_Bljk_BBS_BH_MT96x128x64_MI32x32x8x1_SE_1LDSB1_AF0EM8_EPS0_GRVW8_GSU1_GSUAMB_LBSPP128_LPA8_LPB8_LRVW8_PGR2_PLR9_SU0_SUS0_SRVW0_TT3_32_VAW2_WSGRA1_WSGRB1_WG32_8_1_WGM2
    SolutionIndex: 34
    SolutionNameMin: Cijk_Alik_Bljk_BBS_BH_MT32x32x32_MI16x16x16x1_SE_1LDSB1_AF0EM1_EPS0_GRVW4_GSU1_GSUAMB_LBSPP128_LPA16_LPB16_LRVW8_PGR2_PLR2_SU0_SUS0_SRVW4_TT1_16_VAW2_WSGRA1_WSGRB1_WG32_8_1_WGM1
    SolutionIndex: 35
    SolutionNameMin: Cijk_Alik_Bljk_BBS_BH_MT32x64x32_MI16x16x16x1_SE_1LDSB1_AF0EM8_EPS0_GRVW2_GSU1_GSUAMB_LBSPP128_LPA16_LPB16_LRVW8_PGR2_PLR2_SU0_SUS0_SRVW4_TT1_32_VAW2_WSGRA1_WSGRB1_WG32_8_1_WGM15
    SolutionIndex: 36
    SolutionNameMin: Cijk_Alik_Bljk_BBS_BH_MT32x32x32_MI16x16x16x1_SE_1LDSB1_AF0EM8_EPS0_GRVW2_GSU1_GSUAMB_LBSPP128_LPA16_LPB16_LRVW8_PGR2_PLR2_SU0_SUS0_SRVW4_TT1_16_VAW2_WSGRA1_WSGRB1_WG32_8_1_WGM1
    SolutionIndex: 37
    SolutionNameMin: Cijk_Alik_Bljk_BBS_BH_MT32x32x32_MI16x16x16x1_SE_1LDSB0_AF0EM1_EPS1_GRVW2_GSU1_GSUAMB_LBSPP128_LPA16_LPB16_LRVW8_PGR1_PLR2_SU0_SUS0_SRVW4_TT1_16_VAW2_WSGRA1_WSGRB1_WG32_8_1_WGM1
    SolutionIndex: 38
    SolutionNameMin: Cijk_Alik_Bljk_BBS_BH_MT64x32x64_MI16x16x16x1_SE_1LDSB1_AF0EM8_EPS1_GRVW8_GSU1_GSUAMB_LBSPP128_LPA16_LPB16_LRVW8_PGR1_PLR5_SU32_SUS128_SRVW4_TT2_16_VAW2_WSGRA1_WSGRB1_WG32_8_1_WGM15
    SolutionIndex: 39
    SolutionNameMin: Cijk_Alik_Bljk_BBS_BH_MT96x96x64_MI16x16x16x1_SE_1LDSB1_AF0EM8_EPS1_GRVW8_GSU1_GSUAMB_LBSPP128_LPA16_LPB16_LRVW8_PGR1_PLR5_SU32_SUS128_SRVW0_TT3_48_VAW2_WSGRA1_WSGRB1_WG32_8_1_WGM2
    SolutionIndex: 40
    SolutionNameMin: Cijk_Alik_Bljk_BBS_BH_MT32x64x64_MI16x16x16x1_SE_1LDSB1_AF0EM8_EPS1_GRVW8_GSU1_GSUAMB_LBSPP128_LPA16_LPB16_LRVW8_PGR1_PLR5_SU0_SUS0_SRVW4_TT1_32_VAW2_WSGRA1_WSGRB1_WG32_8_1_WGM15
    SolutionIndex: 41
    SolutionNameMin: Cijk_Alik_Bljk_BBS_BH_MT128x96x64_MI32x32x8x1_SE_1LDSB1_AF0EM8_EPS0_GRVW8_GSU1_GSUAMB_LBSPP128_LPA8_LPB8_LRVW8_PGR2_PLR9_SU0_SUS0_SRVW4_TT1_96_VAW2_WSGRA1_WSGRB1_WG128_2_1_WGM15
    SolutionIndex: 42
    SolutionNameMin: Cijk_Alik_Bljk_BBS_BH_MT16x16x32_MI16x16x16x1_SE_1LDSB1_AF0EM1_EPS0_GRVW8_GSU1_GSUAMB_LBSPP128_LPA16_LPB16_LRVW8_PGR2_PLR2_SU0_SUS0_SRVW0_TT1_16_VAW2_WSGRA1_WSGRB1_WG16_4_1_WGM1
    SolutionIndex: 43
    SolutionNameMin: Cijk_Alik_Bljk_BBS_BH_MT16x64x32_MI16x16x16x1_SE_1LDSB1_AF0EM8_EPS0_GRVW8_GSU1_GSUAMB_LBSPP128_LPA16_LPB16_LRVW8_PGR2_PLR2_SU0_SUS0_SRVW0_TT1_16_VAW2_WSGRA1_WSGRB1_WG16_16_1_WGM1
    SolutionIndex: 44
    SolutionNameMin: Cijk_Alik_Bljk_BBS_BH_MT16x16x64_MI16x16x16x1_SE_1LDSB0_AF0EM1_EPS0_GRVW8_GSU1_GSUAMB_LBSPP128_LPA16_LPB16_LRVW8_PGR2_PLR5_SU0_SUS0_SRVW0_TT1_16_VAW2_WSGRA1_WSGRB1_WG16_4_1_WGM1
    SolutionIndex: 45
    SolutionNameMin: Cijk_Alik_Bljk_BBS_BH_MT16x16x32_MI16x16x16x1_SE_1LDSB0_AF0EM1_EPS0_GRVW8_GSU1_GSUAMB_LBSPP128_LPA16_LPB16_LRVW8_PGR2_PLR2_SU0_SUS0_SRVW0_TT1_16_VAW2_WSGRA1_WSGRB1_WG16_4_1_WGM15
    SolutionIndex: 46
    SolutionNameMin: Cijk_Alik_Bljk_BBS_BH_MT16x16x128_MI16x16x16x1_SE_1LDSB0_AF0EM1_EPS0_GRVW8_GSU1_GSUAMB_LBSPP256_LPA16_LPB16_LRVW8_PGR2_PLR9_SU0_SUS0_SRVW0_TT1_16_VAW2_WSGRA1_WSGRB1_WG16_4_1_WGM15
    SolutionIndex: 47
    SolutionNameMin: Cijk_Alik_Bljk_BBS_BH_MT64x16x128_MI16x16x16x1_SE_1LDSB0_AF0EM1_EPS0_GRVW8_GSU1_GSUAMB_LBSPP256_LPA16_LPB16_LRVW8_PGR2_PLR9_SU0_SUS0_SRVW0_TT1_16_VAW2_WSGRA1_WSGRB1_WG64_4_1_WGM2
    SolutionIndex: 48
    SolutionNameMin: Cijk_Alik_Bljk_BBS_BH_MT16x16x128_MI16x16x16x1_SE_1LDSB0_AF0EM1_EPS0_GRVW8_GSU1_GSUAMB_LBSPP256_LPA16_LPB16_LRVW8_PGR2_PLR9_SU0_SUS0_SRVW0_TT1_16_VAW2_WSGRA1_WSGRB1_WG16_4_1_WGM1
    SolutionIndex: 49
    SolutionNameMin: Cijk_Alik_Bljk_BBS_BH_MT64x16x128_MI16x16x16x1_SE_1LDSB0_AF0EM1_EPS0_GRVW8_GSU1_GSUAMB_LBSPP256_LPA16_LPB16_LRVW8_PGR2_PLR9_SU0_SUS0_SRVW0_TT1_16_VAW2_WSGRA1_WSGRB1_WG64_4_1_WGM1
    SolutionIndex: 50
    SolutionNameMin: Cijk_Alik_Bljk_BBS_BH_MT64x64x64_MI32x32x8x1_SE_1LDSB1_AF0EM8_EPS1_GRVW8_GSU1_GSUAMB_LBSPP128_LPA8_LPB8_LRVW8_PGR1_PLR9_SU32_SUS256_SRVW4_TT1_32_VAW2_WSGRA1_WSGRB1_WG64_4_1_WGM15
    SolutionIndex: 51
    SolutionNameMin: Cijk_Alik_Bljk_BBS_BH_MT128x64x32_MI32x32x8x1_SE_1LDSB1_AF0EM8_EPS0_GRVW8_GSU1_GSUAMB_LBSPP128_LPA8_LPB8_LRVW8_PGR2_PLR5_SU0_SUS0_SRVW4_TT2_32_VAW2_WSGRA1_WSGRB1_WG64_4_1_WGM15
    SolutionIndex: 52
    SolutionNameMin: Cijk_Alik_Bljk_BBS_BH_MT16x16x128_MI16x16x16x1_SE_1LDSB0_AF0EM8_EPS0_GRVW8_GSU1_GSUAMB_LBSPP256_LPA16_LPB16_LRVW8_PGR2_PLR9_SU32_SUS256_SRVW0_TT1_16_VAW2_WSGRA1_WSGRB1_WG16_4_1_WGM1
    SolutionIndex: 53
    SolutionNameMin: Cijk_Alik_Bljk_BBS_BH_MT128x160x64_MI32x32x8x1_SE_1LDSB1_AF0EM8_EPS0_GRVW4_GSU1_GSUAMB_LBSPP128_LPA8_LPB8_LRVW8_PGR2_PLR9_SU0_SUS0_SRVW4_TT1_160_VAW2_WSGRA1_WSGRB1_WG128_2_1_WGM2
    SolutionIndex: 54
    SolutionNameMin: Cijk_Alik_Bljk_BBS_BH_MT128x64x64_MI32x32x8x1_SE_1LDSB1_AF0EM8_EPS0_GRVW8_GSU1_GSUAMB_LBSPP128_LPA8_LPB8_LRVW8_PGR2_PLR9_SU0_SUS0_SRVW4_TT2_32_VAW2_WSGRA1_WSGRB1_WG64_4_1_WGM1
    SolutionIndex: 55
    SolutionNameMin: Cijk_Alik_Bljk_BBS_BH_MT16x16x128_MI16x16x16x1_SE_1LDSB1_AF0EM1_EPS1_GRVW8_GSU1_GSUAMB_LBSPP256_LPA16_LPB16_LRVW8_PGR1_PLR9_SU0_SUS0_SRVW0_TT1_16_VAW2_WSGRA1_WSGRB1_WG16_4_1_WGM1
    SolutionIndex: 56
    SolutionNameMin: Cijk_Alik_Bljk_BBS_BH_MT16x64x128_MI16x16x16x1_SE_1LDSB0_AF0EM8_EPS0_GRVW8_GSU1_GSUAMB_LBSPP256_LPA16_LPB16_LRVW8_PGR2_PLR9_SU0_SUS0_SRVW4_TT1_16_VAW2_WSGRA1_WSGRB1_WG16_16_1_WGM1
    SolutionIndex: 57
    SolutionNameMin: Cijk_Alik_Bljk_BBS_BH_MT16x16x32_MI16x16x16x1_SE_1LDSB1_AF0EM1_EPS1_GRVW8_GSU1_GSUAMB_LBSPP128_LPA16_LPB16_LRVW8_PGR1_PLR2_SU0_SUS0_SRVW0_TT1_16_VAW2_WSGRA1_WSGRB1_WG16_4_1_WGM1
    SolutionIndex: 58
    SolutionNameMin: Cijk_Alik_Bljk_BBS_BH_MT64x16x128_MI16x16x16x1_SE_1LDSB0_AF0EM8_EPS0_GRVW8_GSU1_GSUAMB_LBSPP256_LPA16_LPB16_LRVW8_PGR2_PLR9_SU0_SUS0_SRVW0_TT1_16_VAW2_WSGRA1_WSGRB1_WG64_4_1_WGM2
    SolutionIndex: 59
    SolutionNameMin: Cijk_Alik_Bljk_BBS_BH_MT64x128x64_MI32x32x8x1_SE_1LDSB0_AF0EM8_EPS0_GRVW8_GSU1_GSUAMB_LBSPP128_LPA8_LPB8_LRVW8_PGR2_PLR9_SU32_SUS128_SRVW4_TT1_64_VAW2_WSGRA1_WSGRB1_WG64_4_1_WGM1
    SolutionIndex: 60
    SolutionNameMin: Cijk_Alik_Bljk_BBS_BH_MT64x64x64_MI32x32x8x1_SE_1LDSB1_AF0EM8_EPS1_GRVW8_GSU1_GSUAMB_LBSPP128_LPA8_LPB8_LRVW8_PGR1_PLR9_SU0_SUS0_SRVW4_TT1_32_VAW2_WSGRA1_WSGRB1_WG64_4_1_WGM2
    SolutionIndex: 61
    SolutionNameMin: Cijk_Alik_Bljk_BBS_BH_MT64x64x64_MI32x32x8x1_SE_1LDSB1_AF0EM8_EPS1_GRVW8_GSU1_GSUAMB_LBSPP128_LPA8_LPB8_LRVW8_PGR1_PLR9_SU0_SUS0_SRVW4_TT1_32_VAW2_WSGRA1_WSGRB1_WG64_4_1_WGM15
    SolutionIndex: 62
    SolutionNameMin: Cijk_Alik_Bljk_BBS_BH_MT128x96x32_MI32x32x8x1_SE_1LDSB1_AF0EM8_EPS1_GRVW4_GSU1_GSUAMB_LBSPP128_LPA8_LPB8_LRVW8_PGR1_PLR5_SU32_SUS128_SRVW4_TT1_96_VAW2_WSGRA1_WSGRB1_WG128_2_1_WGM1
    SolutionIndex: 63
    SolutionNameMin: Cijk_Alik_Bljk_BBS_BH_MT96x96x64_MI16x16x16x1_SE_1LDSB0_AF0EM8_EPS1_GRVW8_GSU1_GSUAMB_LBSPP128_LPA16_LPB16_LRVW8_PGR1_PLR5_SU32_SUS256_SRVW0_TT3_48_VAW2_WSGRA1_WSGRB1_WG32_8_1_WGM1
    SolutionIndex: 64
    SolutionNameMin: Cijk_Alik_Bljk_BBS_BH_MT128x64x64_MI32x32x8x1_SE_1LDSB1_AF0EM8_EPS1_GRVW8_GSU1_GSUAMB_LBSPP128_LPA8_LPB8_LRVW8_PGR1_PLR9_SU32_SUS128_SRVW4_TT2_32_VAW2_WSGRA1_WSGRB1_WG64_4_1_WGM1
    SolutionIndex: 65
    SolutionNameMin: Cijk_Alik_Bljk_BBS_BH_MT128x256x32_MI32x32x8x1_SE_1LDSB1_AF0EM8_EPS0_GRVW8_GSU1_GSUAMB_LBSPP128_LPA8_LPB8_LRVW8_PGR2_PLR5_SU0_SUS0_SRVW4_TT2_128_VAW2_WSGRA1_WSGRB1_WG64_4_1_WGM2
    SolutionIndex: 66
    SolutionNameMin: Cijk_Alik_Bljk_BBS_BH_MT128x96x64_MI32x32x8x1_SE_1LDSB1_AF0EM8_EPS1_GRVW8_GSU1_GSUAMB_LBSPP128_LPA8_LPB8_LRVW8_PGR1_PLR9_SU32_SUS128_SRVW4_TT1_96_VAW2_WSGRA1_WSGRB1_WG128_2_1_WGM2
    SolutionIndex: 67
    SolutionNameMin: Cijk_Alik_Bljk_BBS_BH_MT64x64x32_MI32x32x8x1_SE_1LDSB1_AF0EM1_EPS0_GRVW2_GSU1_GSUAMB_LBSPP128_LPA8_LPB8_LRVW8_PGR2_PLR5_SU32_SUS256_SRVW4_TT1_32_VAW2_WSGRA1_WSGRB1_WG64_4_1_WGM15
    SolutionIndex: 68
    SolutionNameMin: Cijk_Alik_Bljk_BBS_BH_MT128x64x32_MI32x32x8x1_SE_1LDSB1_AF0EM8_EPS1_GRVW2_GSU1_GSUAMB_LBSPP128_LPA8_LPB8_LRVW8_PGR1_PLR5_SU0_SUS0_SRVW4_TT2_32_VAW2_WSGRA1_WSGRB1_WG64_4_1_WGM15
    SolutionIndex: 69
    SolutionNameMin: Cijk_Alik_Bljk_BBS_BH_MT128x96x64_MI32x32x8x1_SE_1LDSB1_AF0EM8_EPS1_GRVW8_GSU1_GSUAMB_LBSPP128_LPA8_LPB8_LRVW8_PGR1_PLR9_SU32_SUS128_SRVW4_TT1_96_VAW2_WSGRA1_WSGRB1_WG128_2_1_WGM1
    SolutionIndex: 70
    SolutionNameMin: Cijk_Alik_Bljk_BBS_BH_MT128x96x64_MI32x32x8x1_SE_1LDSB1_AF0EM8_EPS1_GRVW8_GSU1_GSUAMB_LBSPP128_LPA8_LPB8_LRVW8_PGR1_PLR9_SU32_SUS256_SRVW4_TT1_96_VAW2_WSGRA1_WSGRB1_WG128_2_1_WGM1
    SolutionIndex: 71
    SolutionNameMin: Cijk_Alik_Bljk_BBS_BH_MT128x96x64_MI32x32x8x1_SE_1LDSB1_AF0EM8_EPS0_GRVW8_GSU1_GSUAMB_LBSPP128_LPA8_LPB8_LRVW8_PGR2_PLR9_SU32_SUS128_SRVW4_TT1_96_VAW2_WSGRA1_WSGRB1_WG128_2_1_WGM1
    SolutionIndex: 72
    SolutionNameMin: Cijk_Alik_Bljk_BBS_BH_MT16x16x32_MI16x16x16x1_SE_1LDSB1_AF0EM1_EPS0_GRVW2_GSU1_GSUAMB_LBSPP128_LPA16_LPB16_LRVW8_PGR2_PLR2_SU0_SUS0_SRVW0_TT1_16_VAW2_WSGRA1_WSGRB1_WG16_4_1_WGM2
    SolutionIndex: 73
    SolutionNameMin: Cijk_Alik_Bljk_BBS_BH_MT64x128x64_MI32x32x8x1_SE_1LDSB1_AF0EM8_EPS0_GRVW8_GSU1_GSUAMB_LBSPP128_LPA8_LPB8_LRVW8_PGR2_PLR9_SU32_SUS128_SRVW4_TT1_64_VAW2_WSGRA1_WSGRB1_WG64_4_1_WGM1
    SolutionIndex: 74
    SolutionNameMin: Cijk_Alik_Bljk_BBS_BH_MT128x96x64_MI32x32x8x1_SE_1LDSB1_AF0EM8_EPS0_GRVW8_GSU1_GSUAMB_LBSPP128_LPA8_LPB8_LRVW8_PGR2_PLR9_SU32_SUS256_SRVW4_TT1_96_VAW2_WSGRA1_WSGRB1_WG128_2_1_WGM15
    SolutionIndex: 75
    SolutionNameMin: Cijk_Alik_Bljk_BBS_BH_MT32x64x32_MI16x16x16x1_SE_1LDSB1_AF0EM1_EPS1_GRVW4_GSU1_GSUAMB_LBSPP128_LPA16_LPB16_LRVW8_PGR1_PLR2_SU0_SUS0_SRVW4_TT1_32_VAW2_WSGRA1_WSGRB1_WG32_8_1_WGM1
    SolutionIndex: 76
    SolutionNameMin: Cijk_Alik_Bljk_BBS_BH_MT64x128x64_MI32x32x8x1_SE_1LDSB1_AF0EM8_EPS0_GRVW8_GSU1_GSUAMB_LBSPP128_LPA8_LPB8_LRVW8_PGR2_PLR9_SU0_SUS0_SRVW4_TT1_64_VAW2_WSGRA1_WSGRB1_WG64_4_1_WGM1
    SolutionIndex: 77
    SolutionNameMin: Cijk_Alik_Bljk_BBS_BH_MT16x64x128_MI16x16x16x1_SE_1LDSB0_AF0EM8_EPS0_GRVW8_GSU1_GSUAMB_LBSPP256_LPA16_LPB16_LRVW8_PGR2_PLR9_SU0_SUS0_SRVW0_TT1_16_VAW2_WSGRA1_WSGRB1_WG16_16_1_WGM2
    SolutionIndex: 78
    SolutionNameMin: Cijk_Alik_Bljk_BBS_BH_MT128x256x32_MI32x32x8x1_SE_1LDSB1_AF0EM8_EPS0_GRVW2_GSU1_GSUAMB_LBSPP128_LPA8_LPB8_LRVW8_PGR2_PLR5_SU0_SUS0_SRVW4_TT2_128_VAW2_WSGRA1_WSGRB1_WG64_4_1_WGM1
    SolutionIndex: 79
    SolutionNameMin: Cijk_Alik_Bljk_BBS_BH_MT16x16x128_MI16x16x16x1_SE_1LDSB0_AF0EM1_EPS0_GRVW8_GSU1_GSUAMB_LBSPP256_LPA16_LPB16_LRVW8_PGR2_PLR9_SU0_SUS0_SRVW0_TT1_16_VAW2_WSGRA1_WSGRB1_WG16_4_1_WGM2
    SolutionIndex: 80
    SolutionNameMin: Cijk_Alik_Bljk_BBS_BH_MT128x64x32_MI32x32x8x1_SE_1LDSB1_AF0EM8_EPS1_GRVW8_GSU1_GSUAMB_LBSPP128_LPA8_LPB8_LRVW8_PGR1_PLR5_SU32_SUS128_SRVW4_TT2_32_VAW2_WSGRA1_WSGRB1_WG64_4_1_WGM1
    SolutionIndex: 81
    SolutionNameMin: Cijk_Alik_Bljk_BBS_BH_MT16x16x128_MI16x16x16x1_SE_1LDSB0_AF0EM1_EPS1_GRVW8_GSU1_GSUAMB_LBSPP256_LPA16_LPB16_LRVW8_PGR1_PLR9_SU32_SUS256_SRVW0_TT1_16_VAW2_WSGRA1_WSGRB1_WG16_4_1_WGM1
    SolutionIndex: 82
    SolutionNameMin: Cijk_Alik_Bljk_BBS_BH_MT128x64x64_MI32x32x8x1_SE_1LDSB0_AF0EM8_EPS0_GRVW8_GSU1_GSUAMB_LBSPP128_LPA8_LPB8_LRVW8_PGR2_PLR9_SU0_SUS0_SRVW4_TT2_32_VAW2_WSGRA1_WSGRB1_WG64_4_1_WGM15
    SolutionIndex: 83
    SolutionNameMin: Cijk_Alik_Bljk_BBS_BH_MT128x64x32_MI32x32x8x1_SE_1LDSB1_AF0EM8_EPS1_GRVW8_GSU1_GSUAMB_LBSPP128_LPA8_LPB8_LRVW8_PGR1_PLR5_SU0_SUS0_SRVW4_TT2_32_VAW2_WSGRA1_WSGRB1_WG64_4_1_WGM2
    SolutionIndex: 84
    SolutionNameMin: Cijk_Alik_Bljk_BBS_BH_MT64x16x32_MI16x16x16x1_SE_1LDSB1_AF0EM1_EPS1_GRVW8_GSU1_GSUAMB_LBSPP128_LPA16_LPB16_LRVW8_PGR1_PLR2_SU0_SUS0_SRVW0_TT1_16_VAW2_WSGRA1_WSGRB1_WG64_4_1_WGM1
    SolutionIndex: 85
    SolutionNameMin: Cijk_Alik_Bljk_BBS_BH_MT128x128x32_MI32x32x8x1_SE_1LDSB1_AF0EM8_EPS0_GRVW8_GSU1_GSUAMB_LBSPP128_LPA8_LPB8_LRVW8_PGR2_PLR5_SU32_SUS128_SRVW4_TT2_64_VAW2_WSGRA1_WSGRB1_WG64_4_1_WGM1
    SolutionIndex: 86
    SolutionNameMin: Cijk_Alik_Bljk_BBS_BH_MT128x128x32_MI32x32x8x1_SE_1LDSB1_AF0EM8_EPS0_GRVW8_GSU1_GSUAMB_LBSPP128_LPA8_LPB8_LRVW8_PGR2_PLR5_SU32_SUS256_SRVW4_TT2_64_VAW2_WSGRA1_WSGRB1_WG64_4_1_WGM1
    SolutionIndex: 87
    SolutionNameMin: Cijk_Alik_Bljk_BBS_BH_MT128x128x32_MI32x32x8x1_SE_1LDSB1_AF0EM8_EPS0_GRVW4_GSU1_GSUAMB_LBSPP128_LPA8_LPB8_LRVW8_PGR2_PLR5_SU0_SUS0_SRVW4_TT2_64_VAW2_WSGRA1_WSGRB1_WG64_4_1_WGM15
    SolutionIndex: 88
    SolutionNameMin: Cijk_Alik_Bljk_BBS_BH_MT16x64x128_MI16x16x16x1_SE_1LDSB0_AF0EM1_EPS0_GRVW8_GSU1_GSUAMB_LBSPP256_LPA16_LPB16_LRVW8_PGR2_PLR9_SU0_SUS0_SRVW0_TT1_16_VAW2_WSGRA1_WSGRB1_WG16_16_1_WGM1
    SolutionIndex: 89
    SolutionNameMin: Cijk_Alik_Bljk_BBS_BH_MT16x16x128_MI16x16x16x1_SE_1LDSB0_AF0EM8_EPS0_GRVW8_GSU1_GSUAMB_LBSPP256_LPA16_LPB16_LRVW8_PGR2_PLR9_SU0_SUS0_SRVW0_TT1_16_VAW2_WSGRA1_WSGRB1_WG16_4_1_WGM2
    SolutionIndex: 90
    SolutionNameMin: Cijk_Alik_Bljk_BBS_BH_MT64x16x128_MI16x16x16x1_SE_1LDSB0_AF0EM1_EPS0_GRVW8_GSU1_GSUAMB_LBSPP256_LPA16_LPB16_LRVW8_PGR2_PLR9_SU32_SUS256_SRVW0_TT1_16_VAW2_WSGRA1_WSGRB1_WG64_4_1_WGM1
    SolutionIndex: 91
    SolutionNameMin: Cijk_Alik_Bljk_BBS_BH_MT64x128x64_MI32x32x8x1_SE_1LDSB0_AF0EM8_EPS0_GRVW8_GSU1_GSUAMB_LBSPP128_LPA8_LPB8_LRVW8_PGR2_PLR9_SU32_SUS256_SRVW4_TT1_64_VAW2_WSGRA1_WSGRB1_WG64_4_1_WGM1
    SolutionIndex: 92
    SolutionNameMin: Cijk_Alik_Bljk_BBS_BH_MT16x64x128_MI16x16x16x1_SE_1LDSB0_AF0EM8_EPS0_GRVW8_GSU1_GSUAMB_LBSPP256_LPA16_LPB16_LRVW8_PGR2_PLR9_SU0_SUS0_SRVW0_TT1_16_VAW2_WSGRA1_WSGRB1_WG16_16_1_WGM1
    SolutionIndex: 93
    SolutionNameMin: Cijk_Alik_Bljk_BBS_BH_MT128x128x64_MI32x32x8x1_SE_1LDSB1_AF0EM8_EPS0_GRVW8_GSU1_GSUAMB_LBSPP128_LPA8_LPB8_LRVW8_PGR2_PLR9_SU0_SUS0_SRVW4_TT2_64_VAW2_WSGRA1_WSGRB1_WG64_4_1_WGM2
    SolutionIndex: 94
    SolutionNameMin: Cijk_Alik_Bljk_BBS_BH_MT128x128x32_MI32x32x8x1_SE_1LDSB1_AF0EM8_EPS0_GRVW8_GSU1_GSUAMB_LBSPP128_LPA8_LPB8_LRVW8_PGR2_PLR5_SU0_SUS0_SRVW4_TT2_64_VAW2_WSGRA1_WSGRB1_WG64_4_1_WGM1
    SolutionIndex: 95
    SolutionNameMin: Cijk_Alik_Bljk_BBS_BH_MT64x128x64_MI32x32x8x1_SE_1LDSB1_AF0EM8_EPS1_GRVW8_GSU1_GSUAMB_LBSPP128_LPA8_LPB8_LRVW8_PGR1_PLR9_SU32_SUS128_SRVW4_TT1_64_VAW2_WSGRA1_WSGRB1_WG64_4_1_WGM2
    SolutionIndex: 96
    SolutionNameMin: Cijk_Alik_Bljk_BBS_BH_MT160x128x64_MI32x32x8x1_SE_1LDSB1_AF0EM8_EPS1_GRVW8_GSU1_GSUAMB_LBSPP128_LPA8_LPB8_LRVW8_PGR1_PLR9_SU32_SUS128_SRVW0_TT5_32_VAW2_WSGRA1_WSGRB1_WG32_8_1_WGM2
    SolutionIndex: 97
    SolutionNameMin: Cijk_Alik_Bljk_BBS_BH_MT128x128x64_MI32x32x8x1_SE_1LDSB1_AF0EM8_EPS0_GRVW8_GSU1_GSUAMB_LBSPP128_LPA8_LPB8_LRVW8_PGR2_PLR9_SU0_SUS0_SRVW4_TT2_64_VAW2_WSGRA1_WSGRB1_WG64_4_1_WGM1
    SolutionIndex: 98
    SolutionNameMin: Cijk_Alik_Bljk_BBS_BH_MT128x128x32_MI32x32x8x1_SE_1LDSB1_AF0EM8_EPS0_GRVW8_GSU1_GSUAMB_LBSPP128_LPA8_LPB8_LRVW8_PGR2_PLR5_SU0_SUS0_SRVW4_TT2_64_VAW2_WSGRA1_WSGRB1_WG64_4_1_WGM2
    SolutionIndex: 99
    SolutionNameMin: Cijk_Alik_Bljk_BBS_BH_MT64x128x64_MI32x32x8x1_SE_1LDSB1_AF0EM8_EPS1_GRVW8_GSU1_GSUAMB_LBSPP128_LPA8_LPB8_LRVW8_PGR1_PLR9_SU32_SUS256_SRVW4_TT1_64_VAW2_WSGRA1_WSGRB1_WG64_4_1_WGM15
    SolutionIndex: 100
    SolutionNameMin: Cijk_Alik_Bljk_BBS_BH_MT128x128x32_MI32x32x8x1_SE_1LDSB1_AF0EM8_EPS0_GRVW8_GSU1_GSUAMB_LBSPP128_LPA8_LPB8_LRVW8_PGR2_PLR5_SU32_SUS256_SRVW4_TT2_64_VAW2_WSGRA1_WSGRB1_WG64_4_1_WGM2
    SolutionIndex: 101
    SolutionNameMin: Cijk_Alik_Bljk_BBS_BH_MT128x64x64_MI32x32x8x1_SE_1LDSB1_AF0EM8_EPS0_GRVW8_GSU1_GSUAMB_LBSPP128_LPA8_LPB8_LRVW8_PGR2_PLR9_SU32_SUS128_SRVW4_TT2_32_VAW2_WSGRA1_WSGRB1_WG64_4_1_WGM2
    SolutionIndex: 102
    SolutionNameMin: Cijk_Alik_Bljk_BBS_BH_MT64x128x64_MI32x32x8x1_SE_1LDSB1_AF0EM8_EPS1_GRVW8_GSU1_GSUAMB_LBSPP128_LPA8_LPB8_LRVW8_PGR1_PLR9_SU0_SUS0_SRVW4_TT1_64_VAW2_WSGRA1_WSGRB1_WG64_4_1_WGM1
    SolutionIndex: 103
    SolutionNameMin: Cijk_Alik_Bljk_BBS_BH_MT128x128x32_MI32x32x8x1_SE_1LDSB1_AF0EM8_EPS1_GRVW4_GSU1_GSUAMB_LBSPP128_LPA8_LPB8_LRVW8_PGR1_PLR5_SU0_SUS0_SRVW4_TT2_64_VAW2_WSGRA1_WSGRB1_WG64_4_1_WGM2
    SolutionIndex: 104
    SolutionNameMin: Cijk_Alik_Bljk_BBS_BH_MT16x16x128_MI16x16x16x1_SE_1LDSB1_AF0EM8_EPS1_GRVW8_GSU1_GSUAMB_LBSPP256_LPA16_LPB16_LRVW8_PGR1_PLR9_SU0_SUS0_SRVW0_TT1_16_VAW2_WSGRA1_WSGRB1_WG16_4_1_WGM2
    SolutionIndex: 105
    SolutionNameMin: Cijk_Alik_Bljk_BBS_BH_MT128x128x32_MI32x32x8x1_SE_1LDSB1_AF0EM8_EPS0_GRVW8_GSU1_GSUAMB_LBSPP128_LPA8_LPB8_LRVW8_PGR2_PLR5_SU0_SUS0_SRVW4_TT2_64_VAW2_WSGRA1_WSGRB1_WG64_4_1_WGM15
    SolutionIndex: 106
    SolutionNameMin: Cijk_Alik_Bljk_BBS_BH_MT128x256x32_MI32x32x8x1_SE_1LDSB1_AF0EM8_EPS1_GRVW8_GSU1_GSUAMB_LBSPP128_LPA8_LPB8_LRVW8_PGR1_PLR5_SU0_SUS0_SRVW4_TT2_128_VAW2_WSGRA1_WSGRB1_WG64_4_1_WGM1
    SolutionIndex: 107
    SolutionNameMin: Cijk_Alik_Bljk_BBS_BH_MT64x64x32_MI32x32x8x1_SE_1LDSB1_AF0EM8_EPS0_GRVW8_GSU1_GSUAMB_LBSPP128_LPA8_LPB8_LRVW8_PGR2_PLR5_SU0_SUS0_SRVW4_TT1_32_VAW2_WSGRA1_WSGRB1_WG64_4_1_WGM1
    SolutionIndex: 108
    SolutionNameMin: Cijk_Alik_Bljk_BBS_BH_MT32x64x64_MI16x16x16x1_SE_1LDSB1_AF0EM8_EPS1_GRVW8_GSU1_GSUAMB_LBSPP128_LPA16_LPB16_LRVW8_PGR1_PLR5_SU0_SUS0_SRVW4_TT1_32_VAW2_WSGRA1_WSGRB1_WG32_8_1_WGM2
    SolutionIndex: 109
    SolutionNameMin: Cijk_Alik_Bljk_BBS_BH_MT64x16x128_MI16x16x16x1_SE_1LDSB1_AF0EM8_EPS1_GRVW8_GSU1_GSUAMB_LBSPP256_LPA16_LPB16_LRVW8_PGR1_PLR9_SU0_SUS0_SRVW0_TT1_16_VAW2_WSGRA1_WSGRB1_WG64_4_1_WGM1
    SolutionIndex: 110
    SolutionNameMin: Cijk_Alik_Bljk_BBS_BH_MT64x32x32_MI16x16x16x1_SE_1LDSB1_AF0EM8_EPS1_GRVW8_GSU1_GSUAMB_LBSPP128_LPA16_LPB16_LRVW8_PGR1_PLR2_SU0_SUS0_SRVW4_TT2_16_VAW2_WSGRA1_WSGRB1_WG32_8_1_WGM15
    SolutionIndex: 111
    SolutionNameMin: Cijk_Alik_Bljk_BBS_BH_MT64x64x32_MI32x32x8x1_SE_1LDSB1_AF0EM8_EPS1_GRVW4_GSU1_GSUAMB_LBSPP128_LPA8_LPB8_LRVW8_PGR1_PLR5_SU0_SUS0_SRVW4_TT1_32_VAW2_WSGRA1_WSGRB1_WG64_4_1_WGM1
    SolutionIndex: 112
    SolutionNameMin: Cijk_Alik_Bljk_BBS_BH_MT128x96x32_MI32x32x8x1_SE_1LDSB1_AF0EM8_EPS1_GRVW4_GSU1_GSUAMB_LBSPP128_LPA8_LPB8_LRVW8_PGR1_PLR5_SU32_SUS256_SRVW4_TT1_96_VAW2_WSGRA1_WSGRB1_WG128_2_1_WGM2
    SolutionIndex: 113
    SolutionNameMin: Cijk_Alik_Bljk_BBS_BH_MT64x128x32_MI32x32x8x1_SE_1LDSB1_AF0EM1_EPS1_GRVW8_GSU1_GSUAMB_LBSPP128_LPA8_LPB8_LRVW8_PGR1_PLR5_SU0_SUS0_SRVW4_TT1_64_VAW2_WSGRA1_WSGRB1_WG64_4_1_WGM2
    SolutionIndex: 114
    SolutionNameMin: Cijk_Alik_Bljk_BBS_BH_MT64x64x64_MI32x32x8x1_SE_1LDSB1_AF0EM8_EPS1_GRVW8_GSU1_GSUAMB_LBSPP128_LPA8_LPB8_LRVW8_PGR1_PLR9_SU32_SUS128_SRVW4_TT1_32_VAW2_WSGRA1_WSGRB1_WG64_4_1_WGM1
    SolutionIndex: 115
    SolutionNameMin: Cijk_Alik_Bljk_BBS_BH_MT16x16x128_MI16x16x16x1_SE_1LDSB1_AF0EM1_EPS1_GRVW8_GSU1_GSUAMB_LBSPP256_LPA16_LPB16_LRVW8_PGR1_PLR9_SU0_SUS0_SRVW4_TT1_16_VAW2_WSGRA1_WSGRB1_WG16_4_1_WGM1
    SolutionIndex: 116
    SolutionNameMin: Cijk_Alik_Bljk_BBS_BH_MT64x64x32_MI32x32x8x1_SE_1LDSB0_AF0EM8_EPS0_GRVW2_GSU1_GSUAMB_LBSPP128_LPA8_LPB8_LRVW8_PGR2_PLR5_SU0_SUS0_SRVW4_TT1_32_VAW2_WSGRA1_WSGRB1_WG64_4_1_WGM15
    SolutionIndex: 117
    SolutionNameMin: Cijk_Alik_Bljk_BBS_BH_MT32x32x64_MI16x16x16x1_SE_1LDSB0_AF0EM8_EPS0_GRVW4_GSU1_GSUAMB_LBSPP128_LPA16_LPB16_LRVW8_PGR2_PLR5_SU0_SUS0_SRVW4_TT1_16_VAW2_WSGRA1_WSGRB1_WG32_8_1_WGM1
    SolutionIndex: 118
    SolutionNameMin: Cijk_Alik_Bljk_BBS_BH_MT64x32x32_MI16x16x16x1_SE_1LDSB1_AF0EM8_EPS1_GRVW2_GSU1_GSUAMB_LBSPP128_LPA16_LPB16_LRVW8_PGR1_PLR2_SU0_SUS0_SRVW4_TT2_16_VAW2_WSGRA1_WSGRB1_WG32_8_1_WGM2
    SolutionIndex: 119
    SolutionNameMin: Cijk_Alik_Bljk_BBS_BH_MT128x64x32_MI32x32x8x1_SE_1LDSB1_AF0EM8_EPS1_GRVW2_GSU1_GSUAMB_LBSPP128_LPA8_LPB8_LRVW8_PGR1_PLR5_SU32_SUS128_SRVW4_TT2_32_VAW2_WSGRA1_WSGRB1_WG64_4_1_WGM2
    SolutionIndex: 120
    SolutionNameMin: Cijk_Alik_Bljk_BBS_BH_MT32x32x64_MI16x16x16x1_SE_1LDSB0_AF0EM8_EPS0_GRVW2_GSU1_GSUAMB_LBSPP128_LPA16_LPB16_LRVW8_PGR2_PLR5_SU32_SUS128_SRVW4_TT1_16_VAW2_WSGRA1_WSGRB1_WG32_8_1_WGM1
    SolutionIndex: 121
    SolutionNameMin: Cijk_Alik_Bljk_BBS_BH_MT64x128x64_MI32x32x8x1_SE_1LDSB1_AF0EM8_EPS0_GRVW8_GSU1_GSUAMB_LBSPP128_LPA8_LPB8_LRVW8_PGR2_PLR9_SU0_SUS0_SRVW4_TT1_64_VAW2_WSGRA1_WSGRB1_WG64_4_1_WGM15
    SolutionIndex: 122
    SolutionNameMin: Cijk_Alik_Bljk_BBS_BH_MT64x64x64_MI32x32x8x1_SE_1LDSB0_AF0EM8_EPS0_GRVW8_GSU1_GSUAMB_LBSPP128_LPA8_LPB8_LRVW8_PGR2_PLR9_SU0_SUS0_SRVW4_TT1_32_VAW2_WSGRA1_WSGRB1_WG64_4_1_WGM1
    SolutionIndex: 123
    SolutionNameMin: Cijk_Alik_Bljk_BBS_BH_MT64x64x64_MI32x32x8x1_SE_1LDSB0_AF0EM8_EPS0_GRVW8_GSU1_GSUAMB_LBSPP128_LPA8_LPB8_LRVW8_PGR2_PLR9_SU0_SUS0_SRVW4_TT1_32_VAW2_WSGRA1_WSGRB1_WG64_4_1_WGM2
    SolutionIndex: 124
    SolutionNameMin: Cijk_Alik_Bljk_BBS_BH_MT128x128x64_MI32x32x8x1_SE_1LDSB1_AF0EM8_EPS0_GRVW8_GSU1_GSUAMB_LBSPP128_LPA8_LPB8_LRVW8_PGR2_PLR9_SU0_SUS0_SRVW4_TT2_64_VAW2_WSGRA1_WSGRB1_WG64_4_1_WGM15
    SolutionIndex: 125
    SolutionNameMin: Cijk_Alik_Bljk_BBS_BH_MT128x64x64_MI32x32x8x1_SE_1LDSB0_AF0EM8_EPS0_GRVW8_GSU1_GSUAMB_LBSPP128_LPA8_LPB8_LRVW8_PGR2_PLR9_SU0_SUS0_SRVW4_TT2_32_VAW2_WSGRA1_WSGRB1_WG64_4_1_WGM1
    SolutionIndex: 126
    SolutionNameMin: Cijk_Alik_Bljk_BBS_BH_MT128x128x64_MI32x32x8x1_SE_1LDSB1_AF0EM8_EPS0_GRVW8_GSU1_GSUAMB_LBSPP128_LPA8_LPB8_LRVW8_PGR2_PLR9_SU32_SUS128_SRVW4_TT2_64_VAW2_WSGRA1_WSGRB1_WG64_4_1_WGM15
    SolutionIndex: 127
    SolutionNameMin: Cijk_Alik_Bljk_BBS_BH_MT128x128x64_MI32x32x8x1_SE_1LDSB1_AF0EM1_EPS0_GRVW8_GSU1_GSUAMB_LBSPP128_LPA8_LPB8_LRVW8_PGR2_PLR9_SU0_SUS0_SRVW4_TT2_64_VAW2_WSGRA1_WSGRB1_WG64_4_1_WGM15
    SolutionIndex: 128
    SolutionNameMin: Cijk_Alik_Bljk_BBS_BH_MT64x128x64_MI32x32x8x1_SE_1LDSB1_AF0EM8_EPS1_GRVW8_GSU1_GSUAMB_LBSPP128_LPA8_LPB8_LRVW8_PGR1_PLR9_SU0_SUS0_SRVW4_TT1_64_VAW2_WSGRA1_WSGRB1_WG64_4_1_WGM2
    SolutionIndex: 129
    SolutionNameMin: Cijk_Alik_Bljk_BBS_BH_MT64x32x64_MI16x16x16x1_SE_1LDSB0_AF0EM1_EPS0_GRVW8_GSU15_GSUAMB_LBSPP128_LPA16_LPB16_LRVW8_PGR2_PLR5_SU32_SUS128_SRVW4_TT2_16_VAW1_WSGRA1_WSGRB1_WG32_8_1_WGM15
    SolutionIndex: 130
    SolutionNameMin: Cijk_Alik_Bljk_BBS_BH_MT16x16x128_MI16x16x16x1_SE_1LDSB0_AF0EM1_EPS0_GRVW8_GSU1_GSUAMB_LBSPP256_LPA16_LPB16_LRVW8_PGR2_PLR9_SU32_SUS256_SRVW0_TT1_16_VAW2_WSGRA1_WSGRB1_WG16_4_1_WGM2
    SolutionIndex: 131
    SolutionNameMin: Cijk_Alik_Bljk_BBS_BH_MT32x32x32_MI16x16x16x1_SE_1LDSB1_AF0EM1_EPS0_GRVW8_GSU1_GSUAMB_LBSPP128_LPA16_LPB16_LRVW8_PGR2_PLR2_SU0_SUS0_SRVW4_TT1_16_VAW2_WSGRA1_WSGRB1_WG32_8_1_WGM1
    SolutionIndex: 132
    SolutionNameMin: Cijk_Alik_Bljk_BBS_BH_MT16x16x32_MI16x16x16x1_SE_1LDSB1_AF0EM1_EPS0_GRVW2_GSU1_GSUAMB_LBSPP128_LPA16_LPB16_LRVW8_PGR2_PLR2_SU32_SUS256_SRVW0_TT1_16_VAW2_WSGRA1_WSGRB1_WG16_4_1_WGM2
    SolutionIndex: 133
    SolutionNameMin: Cijk_Alik_Bljk_BBS_BH_MT64x64x64_MI32x32x8x1_SE_1LDSB0_AF0EM8_EPS0_GRVW8_GSU1_GSUAMB_LBSPP128_LPA8_LPB8_LRVW8_PGR2_PLR9_SU32_SUS128_SRVW4_TT1_32_VAW2_WSGRA1_WSGRB1_WG64_4_1_WGM15
    SolutionIndex: 134
    SolutionNameMin: Cijk_Alik_Bljk_BBS_BH_MT16x16x32_MI16x16x16x1_SE_1LDSB0_AF0EM8_EPS1_GRVW4_GSU1_GSUAMB_LBSPP128_LPA16_LPB16_LRVW8_PGR1_PLR2_SU0_SUS0_SRVW0_TT1_16_VAW2_WSGRA1_WSGRB1_WG16_4_1_WGM1
    SolutionIndex: 135
    SolutionNameMin: Cijk_Alik_Bljk_BBS_BH_MT16x16x32_MI16x16x16x1_SE_1LDSB1_AF0EM1_EPS0_GRVW2_GSU1_GSUAMB_LBSPP128_LPA16_LPB16_LRVW8_PGR2_PLR2_SU0_SUS0_SRVW0_TT1_16_VAW2_WSGRA1_WSGRB1_WG16_4_1_WGM15
    SolutionIndex: 136
    SolutionNameMin: Cijk_Alik_Bljk_BBS_BH_MT64x64x32_MI32x32x8x1_SE_1LDSB1_AF0EM8_EPS1_GRVW8_GSU1_GSUAMB_LBSPP128_LPA8_LPB8_LRVW8_PGR1_PLR5_SU0_SUS0_SRVW4_TT1_32_VAW2_WSGRA1_WSGRB1_WG64_4_1_WGM1
    SolutionIndex: 137
    SolutionNameMin: Cijk_Alik_Bljk_BBS_BH_MT64x32x32_MI16x16x16x1_SE_1LDSB0_AF0EM8_EPS1_GRVW4_GSU1_GSUAMB_LBSPP128_LPA16_LPB16_LRVW8_PGR1_PLR2_SU0_SUS0_SRVW4_TT2_16_VAW2_WSGRA1_WSGRB1_WG32_8_1_WGM1
    SolutionIndex: 138
    SolutionNameMin: Cijk_Alik_Bljk_BBS_BH_MT16x64x32_MI16x16x16x1_SE_1LDSB0_AF0EM8_EPS0_GRVW4_GSU1_GSUAMB_LBSPP128_LPA16_LPB16_LRVW8_PGR2_PLR2_SU0_SUS0_SRVW0_TT1_16_VAW2_WSGRA1_WSGRB1_WG16_16_1_WGM2
    SolutionIndex: 139
    SolutionNameMin: Cijk_Alik_Bljk_BBS_BH_MT64x64x64_MI32x32x8x1_SE_1LDSB0_AF0EM8_EPS0_GRVW8_GSU1_GSUAMB_LBSPP128_LPA8_LPB8_LRVW8_PGR2_PLR9_SU0_SUS0_SRVW4_TT1_32_VAW2_WSGRA1_WSGRB1_WG64_4_1_WGM15
    SolutionIndex: 140
    SolutionNameMin: Cijk_Alik_Bljk_BBS_BH_MT64x32x32_MI16x16x16x1_SE_1LDSB1_AF0EM8_EPS1_GRVW8_GSU1_GSUAMB_LBSPP128_LPA16_LPB16_LRVW8_PGR1_PLR2_SU32_SUS128_SRVW4_TT2_16_VAW2_WSGRA1_WSGRB1_WG32_8_1_WGM2
    SolutionIndex: 141
    SolutionNameMin: Cijk_Alik_Bljk_BBS_BH_MT128x128x32_MI32x32x8x1_SE_1LDSB1_AF0EM8_EPS1_GRVW8_GSU1_GSUAMB_LBSPP128_LPA8_LPB8_LRVW8_PGR1_PLR5_SU32_SUS256_SRVW4_TT2_64_VAW2_WSGRA1_WSGRB1_WG64_4_1_WGM1
    SolutionIndex: 142
    SolutionNameMin: Cijk_Alik_Bljk_BBS_BH_MT64x128x32_MI32x32x8x1_SE_1LDSB1_AF0EM8_EPS1_GRVW8_GSU1_GSUAMB_LBSPP128_LPA8_LPB8_LRVW8_PGR1_PLR5_SU0_SUS0_SRVW4_TT1_64_VAW2_WSGRA1_WSGRB1_WG64_4_1_WGM2
    SolutionIndex: 143
    SolutionNameMin: Cijk_Alik_Bljk_BBS_BH_MT64x32x32_MI16x16x16x1_SE_1LDSB0_AF0EM8_EPS1_GRVW8_GSU1_GSUAMB_LBSPP128_LPA16_LPB16_LRVW8_PGR1_PLR2_SU0_SUS0_SRVW4_TT2_16_VAW2_WSGRA1_WSGRB1_WG32_8_1_WGM1
    SolutionIndex: 144
    SolutionNameMin: Cijk_Alik_Bljk_BBS_BH_MT16x64x32_MI16x16x16x1_SE_1LDSB0_AF0EM8_EPS0_GRVW4_GSU1_GSUAMB_LBSPP128_LPA16_LPB16_LRVW8_PGR2_PLR2_SU0_SUS0_SRVW0_TT1_16_VAW2_WSGRA1_WSGRB1_WG16_16_1_WGM1
    SolutionIndex: 145
    SolutionNameMin: Cijk_Alik_Bljk_BBS_BH_MT64x64x64_MI32x32x8x1_SE_1LDSB0_AF0EM8_EPS0_GRVW4_GSU1_GSUAMB_LBSPP128_LPA8_LPB8_LRVW8_PGR2_PLR9_SU0_SUS0_SRVW4_TT1_32_VAW2_WSGRA1_WSGRB1_WG64_4_1_WGM1
    SolutionIndex: 146
    SolutionNameMin: Cijk_Alik_Bljk_BBS_BH_MT64x64x32_MI32x32x8x1_SE_1LDSB1_AF0EM8_EPS1_GRVW2_GSU1_GSUAMB_LBSPP128_LPA8_LPB8_LRVW8_PGR1_PLR5_SU32_SUS128_SRVW4_TT1_32_VAW2_WSGRA1_WSGRB1_WG64_4_1_WGM1
    SolutionIndex: 147
    SolutionNameMin: Cijk_Alik_Bljk_BBS_BH_MT64x64x32_MI32x32x8x1_SE_1LDSB1_AF0EM8_EPS0_GRVW8_GSU1_GSUAMB_LBSPP128_LPA8_LPB8_LRVW8_PGR2_PLR5_SU32_SUS128_SRVW4_TT1_32_VAW2_WSGRA1_WSGRB1_WG64_4_1_WGM1
    SolutionIndex: 148
    SolutionNameMin: Cijk_Alik_Bljk_BBS_BH_MT128x64x32_MI32x32x8x1_SE_1LDSB1_AF0EM8_EPS1_GRVW8_GSU1_GSUAMB_LBSPP128_LPA8_LPB8_LRVW8_PGR1_PLR5_SU0_SUS0_SRVW4_TT2_32_VAW2_WSGRA1_WSGRB1_WG64_4_1_WGM1
    SolutionIndex: 149
    SolutionNameMin: Cijk_Alik_Bljk_BBS_BH_MT16x16x128_MI16x16x16x1_SE_1LDSB1_AF0EM1_EPS1_GRVW8_GSU1_GSUAMB_LBSPP256_LPA16_LPB16_LRVW8_PGR1_PLR9_SU0_SUS0_SRVW0_TT1_16_VAW2_WSGRA1_WSGRB1_WG16_4_1_WGM2
    SolutionIndex: 150
    SolutionNameMin: Cijk_Alik_Bljk_BBS_BH_MT64x32x64_MI16x16x16x1_SE_1LDSB0_AF0EM8_EPS0_GRVW8_GSU1_GSUAMB_LBSPP128_LPA16_LPB16_LRVW8_PGR2_PLR5_SU32_SUS128_SRVW4_TT2_16_VAW2_WSGRA1_WSGRB1_WG32_8_1_WGM1
    SolutionIndex: 151
    SolutionNameMin: Cijk_Alik_Bljk_BBS_BH_MT64x64x64_MI32x32x8x1_SE_1LDSB1_AF0EM8_EPS1_GRVW8_GSU1_GSUAMB_LBSPP128_LPA8_LPB8_LRVW8_PGR1_PLR9_SU32_SUS256_SRVW4_TT1_32_VAW2_WSGRA1_WSGRB1_WG64_4_1_WGM2
    SolutionIndex: 152
    SolutionNameMin: Cijk_Alik_Bljk_BBS_BH_MT16x16x128_MI16x16x16x1_SE_1LDSB0_AF0EM8_EPS0_GRVW8_GSU1_GSUAMB_LBSPP256_LPA16_LPB16_LRVW8_PGR2_PLR9_SU0_SUS0_SRVW0_TT1_16_VAW2_WSGRA1_WSGRB1_WG16_4_1_WGM15
    SolutionIndex: 153
    SolutionNameMin: Cijk_Alik_Bljk_BBS_BH_MT128x64x32_MI32x32x8x1_SE_1LDSB1_AF0EM8_EPS1_GRVW4_GSU1_GSUAMB_LBSPP128_LPA8_LPB8_LRVW8_PGR1_PLR5_SU32_SUS256_SRVW4_TT2_32_VAW2_WSGRA1_WSGRB1_WG64_4_1_WGM1
    SolutionIndex: 154
    SolutionNameMin: Cijk_Alik_Bljk_BBS_BH_MT16x16x128_MI16x16x16x1_SE_1LDSB1_AF0EM8_EPS1_GRVW8_GSU1_GSUAMB_LBSPP256_LPA16_LPB16_LRVW8_PGR1_PLR9_SU32_SUS256_SRVW0_TT1_16_VAW2_WSGRA1_WSGRB1_WG16_4_1_WGM1
    SolutionIndex: 155
    SolutionNameMin: Cijk_Alik_Bljk_BBS_BH_MT64x128x64_MI32x32x8x1_SE_1LDSB1_AF0EM8_EPS0_GRVW8_GSU1_GSUAMB_LBSPP128_LPA8_LPB8_LRVW8_PGR2_PLR9_SU32_SUS128_SRVW4_TT1_64_VAW2_WSGRA1_WSGRB1_WG64_4_1_WGM2
    SolutionIndex: 156
    SolutionNameMin: Cijk_Alik_Bljk_BBS_BH_MT64x128x64_MI32x32x8x1_SE_1LDSB0_AF0EM8_EPS0_GRVW8_GSU1_GSUAMB_LBSPP128_LPA8_LPB8_LRVW8_PGR2_PLR9_SU32_SUS128_SRVW4_TT1_64_VAW2_WSGRA1_WSGRB1_WG64_4_1_WGM2
    SolutionIndex: 157
    SolutionNameMin: Cijk_Alik_Bljk_BBS_BH_MT64x32x32_MI16x16x16x1_SE_1LDSB1_AF0EM8_EPS1_GRVW4_GSU1_GSUAMB_LBSPP128_LPA16_LPB16_LRVW8_PGR1_PLR2_SU0_SUS0_SRVW4_TT2_16_VAW2_WSGRA1_WSGRB1_WG32_8_1_WGM1
    SolutionIndex: 158
    SolutionNameMin: Cijk_Alik_Bljk_BBS_BH_MT16x64x128_MI16x16x16x1_SE_1LDSB0_AF0EM1_EPS1_GRVW8_GSU1_GSUAMB_LBSPP256_LPA16_LPB16_LRVW8_PGR1_PLR9_SU0_SUS0_SRVW0_TT1_16_VAW2_WSGRA1_WSGRB1_WG16_16_1_WGM1
    SolutionIndex: 159
    SolutionNameMin: Cijk_Alik_Bljk_BBS_BH_MT128x64x32_MI32x32x8x1_SE_1LDSB1_AF0EM8_EPS1_GRVW2_GSU1_GSUAMB_LBSPP128_LPA8_LPB8_LRVW8_PGR1_PLR5_SU0_SUS0_SRVW4_TT2_32_VAW2_WSGRA1_WSGRB1_WG64_4_1_WGM2
    SolutionIndex: 160
    SolutionNameMin: Cijk_Alik_Bljk_BBS_BH_MT128x160x32_MI32x32x8x1_SE_1LDSB1_AF0EM8_EPS1_GRVW4_GSU1_GSUAMB_LBSPP128_LPA8_LPB8_LRVW8_PGR1_PLR5_SU0_SUS0_SRVW4_TT1_160_VAW2_WSGRA1_WSGRB1_WG128_2_1_WGM1
    SolutionIndex: 161
    SolutionNameMin: Cijk_Alik_Bljk_BBS_BH_MT64x32x32_MI16x16x16x1_SE_1LDSB1_AF0EM8_EPS1_GRVW8_GSU1_GSUAMB_LBSPP128_LPA16_LPB16_LRVW8_PGR1_PLR2_SU0_SUS0_SRVW4_TT2_16_VAW2_WSGRA1_WSGRB1_WG32_8_1_WGM1
    SolutionIndex: 162
    SolutionNameMin: Cijk_Alik_Bljk_BBS_BH_MT128x96x64_MI32x32x8x1_SE_1LDSB1_AF0EM8_EPS1_GRVW8_GSU1_GSUAMB_LBSPP128_LPA8_LPB8_LRVW8_PGR1_PLR9_SU0_SUS0_SRVW4_TT1_96_VAW2_WSGRA1_WSGRB1_WG128_2_1_WGM2
    SolutionIndex: 163
    SolutionNameMin: Cijk_Alik_Bljk_BBS_BH_MT64x32x32_MI16x16x16x1_SE_1LDSB0_AF0EM8_EPS1_GRVW2_GSU1_GSUAMB_LBSPP128_LPA16_LPB16_LRVW8_PGR1_PLR2_SU0_SUS0_SRVW4_TT2_16_VAW2_WSGRA1_WSGRB1_WG32_8_1_WGM1
    SolutionIndex: 164
    SolutionNameMin: Cijk_Alik_Bljk_BBS_BH_MT128x96x32_MI32x32x8x1_SE_1LDSB1_AF0EM8_EPS1_GRVW4_GSU1_GSUAMB_LBSPP128_LPA8_LPB8_LRVW8_PGR1_PLR5_SU0_SUS0_SRVW4_TT1_96_VAW2_WSGRA1_WSGRB1_WG128_2_1_WGM2
    SolutionIndex: 165
    SolutionNameMin: Cijk_Alik_Bljk_BBS_BH_MT16x64x64_MI16x16x16x1_SE_1LDSB0_AF0EM8_EPS0_GRVW8_GSU1_GSUAMB_LBSPP128_LPA16_LPB16_LRVW8_PGR2_PLR5_SU0_SUS0_SRVW0_TT1_16_VAW2_WSGRA1_WSGRB1_WG16_16_1_WGM2
    SolutionIndex: 166
    SolutionNameMin: Cijk_Alik_Bljk_BBS_BH_MT16x16x128_MI16x16x16x1_SE_1LDSB0_AF0EM8_EPS1_GRVW8_GSU1_GSUAMB_LBSPP256_LPA16_LPB16_LRVW8_PGR1_PLR9_SU0_SUS0_SRVW0_TT1_16_VAW2_WSGRA1_WSGRB1_WG16_4_1_WGM1
    SolutionIndex: 167
    SolutionNameMin: Cijk_Alik_Bljk_BBS_BH_MT128x128x32_MI32x32x8x1_SE_1LDSB1_AF0EM8_EPS1_GRVW4_GSU1_GSUAMB_LBSPP128_LPA8_LPB8_LRVW8_PGR1_PLR5_SU0_SUS0_SRVW4_TT2_64_VAW2_WSGRA1_WSGRB1_WG64_4_1_WGM15
    SolutionIndex: 168
    SolutionNameMin: Cijk_Alik_Bljk_BBS_BH_MT64x192x64_MI32x32x8x1_SE_1LDSB1_AF0EM8_EPS0_GRVW8_GSU1_GSUAMB_LBSPP128_LPA8_LPB8_LRVW8_PGR2_PLR9_SU0_SUS0_SRVW4_TT1_96_VAW2_WSGRA1_WSGRB1_WG64_4_1_WGM15
    SolutionIndex: 169
    SolutionNameMin: Cijk_Alik_Bljk_BBS_BH_MT64x32x32_MI16x16x16x1_SE_1LDSB1_AF0EM8_EPS1_GRVW2_GSU1_GSUAMB_LBSPP128_LPA16_LPB16_LRVW8_PGR1_PLR2_SU0_SUS0_SRVW4_TT2_16_VAW2_WSGRA1_WSGRB1_WG32_8_1_WGM1
    SolutionIndex: 170
    SolutionNameMin: Cijk_Alik_Bljk_BBS_BH_MT64x64x64_MI32x32x8x1_SE_1LDSB0_AF0EM8_EPS0_GRVW8_GSU1_GSUAMB_LBSPP128_LPA8_LPB8_LRVW8_PGR2_PLR9_SU32_SUS256_SRVW4_TT1_32_VAW2_WSGRA1_WSGRB1_WG64_4_1_WGM2
    SolutionIndex: 171
    SolutionNameMin: Cijk_Alik_Bljk_BBS_BH_MT16x16x32_MI16x16x16x1_SE_1LDSB0_AF0EM1_EPS0_GRVW4_GSU1_GSUAMB_LBSPP128_LPA16_LPB16_LRVW8_PGR2_PLR2_SU0_SUS0_SRVW0_TT1_16_VAW2_WSGRA1_WSGRB1_WG16_4_1_WGM1
    SolutionIndex: 172
    SolutionNameMin: Cijk_Alik_Bljk_BBS_BH_MT128x64x64_MI32x32x8x1_SE_1LDSB0_AF0EM8_EPS0_GRVW8_GSU1_GSUAMB_LBSPP128_LPA8_LPB8_LRVW8_PGR2_PLR9_SU32_SUS128_SRVW4_TT2_32_VAW2_WSGRA1_WSGRB1_WG64_4_1_WGM2
    SolutionIndex: 173
    SolutionNameMin: Cijk_Alik_Bljk_BBS_BH_MT16x64x32_MI16x16x16x1_SE_1LDSB0_AF0EM1_EPS1_GRVW2_GSU1_GSUAMB_LBSPP128_LPA16_LPB16_LRVW8_PGR1_PLR2_SU0_SUS0_SRVW0_TT1_16_VAW2_WSGRA1_WSGRB1_WG16_16_1_WGM1
    SolutionIndex: 174
    SolutionNameMin: Cijk_Alik_Bljk_BBS_BH_MT16x64x32_MI16x16x16x1_SE_1LDSB0_AF0EM8_EPS0_GRVW8_GSU1_GSUAMB_LBSPP128_LPA16_LPB16_LRVW8_PGR2_PLR2_SU0_SUS0_SRVW0_TT1_16_VAW2_WSGRA1_WSGRB1_WG16_16_1_WGM1
    SolutionIndex: 175
    SolutionNameMin: Cijk_Alik_Bljk_BBS_BH_MT64x128x32_MI32x32x8x1_SE_1LDSB1_AF0EM8_EPS0_GRVW8_GSU1_GSUAMB_LBSPP128_LPA8_LPB8_LRVW8_PGR2_PLR5_SU32_SUS256_SRVW4_TT1_64_VAW2_WSGRA1_WSGRB1_WG64_4_1_WGM1
    SolutionIndex: 176
    SolutionNameMin: Cijk_Alik_Bljk_BBS_BH_MT64x64x32_MI32x32x8x1_SE_1LDSB1_AF0EM1_EPS1_GRVW2_GSU1_GSUAMB_LBSPP128_LPA8_LPB8_LRVW8_PGR1_PLR5_SU0_SUS0_SRVW4_TT1_32_VAW2_WSGRA1_WSGRB1_WG64_4_1_WGM2
    SolutionIndex: 177
    SolutionNameMin: Cijk_Alik_Bljk_BBS_BH_MT128x96x64_MI32x32x8x1_SE_1LDSB1_AF0EM8_EPS1_GRVW8_GSU1_GSUAMB_LBSPP128_LPA8_LPB8_LRVW8_PGR1_PLR9_SU0_SUS0_SRVW4_TT1_96_VAW2_WSGRA1_WSGRB1_WG128_2_1_WGM1
    SolutionIndex: 178
    SolutionNameMin: Cijk_Alik_Bljk_BBS_BH_MT64x64x64_MI32x32x8x1_SE_1LDSB0_AF0EM8_EPS0_GRVW8_GSU1_GSUAMB_LBSPP128_LPA8_LPB8_LRVW8_PGR2_PLR9_SU32_SUS256_SRVW4_TT1_32_VAW2_WSGRA1_WSGRB1_WG64_4_1_WGM15
    SolutionIndex: 179
    SolutionNameMin: Cijk_Alik_Bljk_BBS_BH_MT128x256x32_MI32x32x8x1_SE_1LDSB1_AF0EM1_EPS1_GRVW8_GSU1_GSUAMB_LBSPP128_LPA8_LPB8_LRVW8_PGR1_PLR5_SU0_SUS0_SRVW4_TT2_128_VAW2_WSGRA1_WSGRB1_WG64_4_1_WGM2
    SolutionIndex: 180
    SolutionNameMin: Cijk_Alik_Bljk_BBS_BH_MT64x32x32_MI16x16x16x1_SE_1LDSB1_AF0EM8_EPS0_GRVW2_GSU1_GSUAMB_LBSPP128_LPA16_LPB16_LRVW8_PGR2_PLR2_SU0_SUS0_SRVW4_TT2_16_VAW2_WSGRA1_WSGRB1_WG32_8_1_WGM2
    SolutionIndex: 181
    SolutionNameMin: Cijk_Alik_Bljk_BBS_BH_MT128x96x32_MI32x32x8x1_SE_1LDSB1_AF0EM8_EPS1_GRVW2_GSU1_GSUAMB_LBSPP128_LPA8_LPB8_LRVW8_PGR1_PLR5_SU32_SUS128_SRVW4_TT1_96_VAW2_WSGRA1_WSGRB1_WG128_2_1_WGM1
    SolutionIndex: 182
    SolutionNameMin: Cijk_Alik_Bljk_BBS_BH_MT128x144x64_MI16x16x16x1_SE_1LDSB1_AF0EM8_EPS0_GRVW4_GSU1_GSUAMB_LBSPP128_LPA16_LPB16_LRVW8_PGR2_PLR5_SU32_SUS128_SRVW4_TT2_144_VAW2_WSGRA1_WSGRB1_WG64_4_1_WGM15
    SolutionIndex: 183
    SolutionNameMin: Cijk_Alik_Bljk_BBS_BH_MT64x64x64_MI32x32x8x1_SE_1LDSB1_AF0EM8_EPS1_GRVW4_GSU1_GSUAMB_LBSPP128_LPA8_LPB8_LRVW8_PGR1_PLR9_SU0_SUS0_SRVW4_TT1_32_VAW2_WSGRA1_WSGRB1_WG64_4_1_WGM1
    SolutionIndex: 184
    SolutionNameMin: Cijk_Alik_Bljk_BBS_BH_MT128x96x64_MI32x32x8x1_SE_1LDSB1_AF0EM8_EPS1_GRVW8_GSU1_GSUAMB_LBSPP128_LPA8_LPB8_LRVW8_PGR1_PLR9_SU32_SUS256_SRVW4_TT1_96_VAW2_WSGRA1_WSGRB1_WG128_2_1_WGM2
    SolutionIndex: 185
    SolutionNameMin: Cijk_Alik_Bljk_BBS_BH_MT144x64x64_MI16x16x16x1_SE_1LDSB1_AF0EM8_EPS0_GRVW4_GSU1_GSUAMB_LBSPP128_LPA16_LPB16_LRVW8_PGR2_PLR5_SU32_SUS256_SRVW0_TT9_16_VAW2_WSGRA1_WSGRB1_WG16_16_1_WGM1
    SolutionIndex: 186
    SolutionNameMin: Cijk_Alik_Bljk_BBS_BH_MT16x16x128_MI16x16x16x1_SE_1LDSB0_AF0EM1_EPS1_GRVW8_GSU1_GSUAMB_LBSPP256_LPA16_LPB16_LRVW8_PGR1_PLR9_SU0_SUS0_SRVW0_TT1_16_VAW2_WSGRA1_WSGRB1_WG16_4_1_WGM1
    SolutionIndex: 187
    SolutionNameMin: Cijk_Alik_Bljk_BBS_BH_MT64x64x32_MI32x32x8x1_SE_1LDSB1_AF0EM1_EPS1_GRVW4_GSU1_GSUAMB_LBSPP128_LPA8_LPB8_LRVW8_PGR1_PLR5_SU0_SUS0_SRVW4_TT1_32_VAW2_WSGRA1_WSGRB1_WG64_4_1_WGM2
    SolutionIndex: 188
    SolutionNameMin: Cijk_Alik_Bljk_BBS_BH_MT128x128x32_MI32x32x8x1_SE_1LDSB1_AF0EM1_EPS1_GRVW4_GSU1_GSUAMB_LBSPP128_LPA8_LPB8_LRVW8_PGR1_PLR5_SU0_SUS0_SRVW4_TT2_64_VAW2_WSGRA1_WSGRB1_WG64_4_1_WGM15
    SolutionIndex: 189
    SolutionNameMin: Cijk_Alik_Bljk_BBS_BH_MT128x64x32_MI32x32x8x1_SE_1LDSB0_AF0EM8_EPS0_GRVW8_GSU1_GSUAMB_LBSPP128_LPA8_LPB8_LRVW8_PGR2_PLR5_SU0_SUS0_SRVW4_TT2_32_VAW2_WSGRA1_WSGRB1_WG64_4_1_WGM1
    SolutionIndex: 190
    SolutionNameMin: Cijk_Alik_Bljk_BBS_BH_MT128x64x64_MI32x32x8x1_SE_1LDSB0_AF0EM8_EPS0_GRVW8_GSU1_GSUAMB_LBSPP128_LPA8_LPB8_LRVW8_PGR2_PLR9_SU32_SUS256_SRVW4_TT2_32_VAW2_WSGRA1_WSGRB1_WG64_4_1_WGM15
    SolutionIndex: 191
    SolutionNameMin: Cijk_Alik_Bljk_BBS_BH_MT16x64x128_MI16x16x16x1_SE_1LDSB1_AF0EM8_EPS1_GRVW8_GSU1_GSUAMB_LBSPP256_LPA16_LPB16_LRVW8_PGR1_PLR9_SU0_SUS0_SRVW0_TT1_16_VAW2_WSGRA1_WSGRB1_WG16_16_1_WGM2
    SolutionIndex: 192
    SolutionNameMin: Cijk_Alik_Bljk_BBS_BH_MT128x128x32_MI32x32x8x1_SE_1LDSB1_AF0EM8_EPS1_GRVW8_GSU1_GSUAMB_LBSPP128_LPA8_LPB8_LRVW8_PGR1_PLR5_SU0_SUS0_SRVW4_TT2_64_VAW2_WSGRA1_WSGRB1_WG64_4_1_WGM1
    SolutionIndex: 193
    SolutionNameMin: Cijk_Alik_Bljk_BBS_BH_MT128x256x32_MI32x32x8x1_SE_1LDSB1_AF0EM8_EPS0_GRVW8_GSU1_GSUAMB_LBSPP128_LPA8_LPB8_LRVW8_PGR2_PLR5_SU32_SUS256_SRVW4_TT2_128_VAW2_WSGRA1_WSGRB1_WG64_4_1_WGM2
    SolutionIndex: 194
    SolutionNameMin: Cijk_Alik_Bljk_BBS_BH_MT128x64x64_MI32x32x8x1_SE_1LDSB1_AF0EM8_EPS0_GRVW8_GSU1_GSUAMB_LBSPP128_LPA8_LPB8_LRVW8_PGR2_PLR9_SU32_SUS256_SRVW4_TT2_32_VAW2_WSGRA1_WSGRB1_WG64_4_1_WGM15
    SolutionIndex: 195
    SolutionNameMin: Cijk_Alik_Bljk_BBS_BH_MT128x192x32_MI32x32x8x1_SE_1LDSB1_AF0EM1_EPS0_GRVW8_GSU1_GSUAMB_LBSPP128_LPA8_LPB8_LRVW8_PGR2_PLR5_SU32_SUS128_SRVW4_TT2_96_VAW2_WSGRA1_WSGRB1_WG64_4_1_WGM15
    SolutionIndex: 196
    SolutionNameMin: Cijk_Alik_Bljk_BBS_BH_MT32x32x64_MI16x16x16x1_SE_1LDSB0_AF0EM8_EPS0_GRVW4_GSU1_GSUAMB_LBSPP128_LPA16_LPB16_LRVW8_PGR2_PLR5_SU0_SUS0_SRVW4_TT1_16_VAW2_WSGRA1_WSGRB1_WG32_8_1_WGM2
    SolutionIndex: 197
    SolutionNameMin: Cijk_Alik_Bljk_BBS_BH_MT128x64x64_MI32x32x8x1_SE_1LDSB1_AF0EM8_EPS1_GRVW8_GSU1_GSUAMB_LBSPP128_LPA8_LPB8_LRVW8_PGR1_PLR9_SU0_SUS0_SRVW4_TT2_32_VAW2_WSGRA1_WSGRB1_WG64_4_1_WGM15
    SolutionIndex: 198
    SolutionNameMin: Cijk_Alik_Bljk_BBS_BH_MT16x16x128_MI16x16x16x1_SE_1LDSB1_AF0EM8_EPS1_GRVW8_GSU15_GSUAMB_LBSPP256_LPA16_LPB16_LRVW8_PGR1_PLR9_SU32_SUS256_SRVW4_TT1_16_VAW1_WSGRA1_WSGRB1_WG16_4_1_WGM15
    SolutionIndex: 199
    SolutionNameMin: Cijk_Alik_Bljk_BBS_BH_MT32x64x64_MI16x16x16x1_SE_1LDSB0_AF0EM8_EPS0_GRVW8_GSU1_GSUAMB_LBSPP128_LPA16_LPB16_LRVW8_PGR2_PLR5_SU32_SUS256_SRVW4_TT1_32_VAW2_WSGRA1_WSGRB1_WG32_8_1_WGM1
    SolutionIndex: 200
    SolutionNameMin: Cijk_Alik_Bljk_BBS_BH_MT128x160x32_MI32x32x8x1_SE_1LDSB1_AF0EM8_EPS0_GRVW2_GSU1_GSUAMB_LBSPP128_LPA8_LPB8_LRVW8_PGR2_PLR5_SU0_SUS0_SRVW4_TT1_160_VAW2_WSGRA1_WSGRB1_WG128_2_1_WGM15
    SolutionIndex: 201
    SolutionNameMin: Cijk_Alik_Bljk_BBS_BH_MT16x16x128_MI16x16x16x1_SE_1LDSB0_AF0EM8_EPS1_GRVW8_GSU5_GSUAMB_LBSPP256_LPA16_LPB16_LRVW8_PGR1_PLR9_SU32_SUS256_SRVW0_TT1_16_VAW1_WSGRA1_WSGRB1_WG16_4_1_WGM1
    SolutionIndex: 202
    SolutionNameMin: Cijk_Alik_Bljk_BBS_BH_MT32x32x64_MI16x16x16x1_SE_1LDSB0_AF0EM1_EPS1_GRVW8_GSU1_GSUAMB_LBSPP128_LPA16_LPB16_LRVW8_PGR1_PLR5_SU0_SUS0_SRVW4_TT1_16_VAW2_WSGRA1_WSGRB1_WG32_8_1_WGM1
    SolutionIndex: 203
    SolutionNameMin: Cijk_Alik_Bljk_BBS_BH_MT64x4x64_MI4x4x4x16_SE_1LDSB0_AF0EM1_EPS1_GRVW8_GSU1_GSUAMB_LBSPP128_LPA8_LPB8_LRVW8_PGR1_PLR17_SU0_SUS0_SRVW0_TT1_4_VAW2_WSGRA1_WSGRB1_WG64_1_1_WGM15
    SolutionIndex: 204
    SolutionNameMin: Cijk_Alik_Bljk_BBS_BH_MT32x32x32_MI16x16x16x1_SE_1LDSB1_AF0EM8_EPS1_GRVW4_GSU1_GSUAMB_LBSPP128_LPA16_LPB16_LRVW8_PGR1_PLR2_SU0_SUS0_SRVW4_TT1_16_VAW2_WSGRA1_WSGRB1_WG32_8_1_WGM2
    SolutionIndex: 205
    SolutionNameMin: Cijk_Alik_Bljk_BBS_BH_MT128x96x64_MI32x32x8x1_SE_1LDSB0_AF0EM8_EPS0_GRVW4_GSU15_GSUAMB_LBSPP128_LPA8_LPB8_LRVW8_PGR2_PLR9_SU0_SUS0_SRVW4_TT1_96_VAW1_WSGRA1_WSGRB1_WG128_2_1_WGM2
    SolutionIndex: 206
    SolutionNameMin: Cijk_Alik_Bljk_BBS_BH_MT128x96x64_MI32x32x8x1_SE_1LDSB0_AF0EM8_EPS0_GRVW4_GSU15_GSUAMB_LBSPP128_LPA8_LPB8_LRVW8_PGR2_PLR9_SU0_SUS0_SRVW4_TT1_96_VAW1_WSGRA1_WSGRB1_WG128_2_1_WGM1
    SolutionIndex: 207
    SolutionNameMin: Cijk_Alik_Bljk_BBS_BH_MT128x96x64_MI32x32x8x1_SE_1LDSB0_AF0EM8_EPS0_GRVW8_GSU15_GSUAMB_LBSPP128_LPA8_LPB8_LRVW8_PGR2_PLR9_SU32_SUS128_SRVW4_TT1_96_VAW1_WSGRA1_WSGRB1_WG128_2_1_WGM1
    SolutionIndex: 208
    SolutionNameMin: Cijk_Alik_Bljk_BBS_BH_MT128x96x64_MI32x32x8x1_SE_1LDSB0_AF0EM8_EPS0_GRVW8_GSU15_GSUAMB_LBSPP128_LPA8_LPB8_LRVW8_PGR2_PLR9_SU0_SUS0_SRVW4_TT1_96_VAW1_WSGRA1_WSGRB1_WG128_2_1_WGM2
    SolutionIndex: 209
    SolutionNameMin: Cijk_Alik_Bljk_BBS_BH_MT128x96x64_MI32x32x8x1_SE_1LDSB1_AF0EM8_EPS0_GRVW8_GSU15_GSUAMB_LBSPP128_LPA8_LPB8_LRVW8_PGR2_PLR9_SU32_SUS128_SRVW4_TT1_96_VAW1_WSGRA1_WSGRB1_WG128_2_1_WGM1
    SolutionIndex: 210
    SolutionNameMin: Cijk_Alik_Bljk_BBS_BH_MT32x32x64_MI16x16x16x1_SE_1LDSB0_AF0EM8_EPS0_GRVW8_GSU7_GSUAMB_LBSPP128_LPA16_LPB16_LRVW8_PGR2_PLR5_SU32_SUS256_SRVW4_TT1_16_VAW1_WSGRA1_WSGRB1_WG32_8_1_WGM1
    SolutionIndex: 211
    SolutionNameMin: Cijk_Alik_Bljk_BBS_BH_MT16x16x128_MI16x16x16x1_SE_1LDSB1_AF0EM1_EPS1_GRVW8_GSU7_GSUAMB_LBSPP256_LPA16_LPB16_LRVW8_PGR1_PLR9_SU32_SUS256_SRVW0_TT1_16_VAW1_WSGRA1_WSGRB1_WG16_4_1_WGM2
    SolutionIndex: 212
    SolutionNameMin: Cijk_Alik_Bljk_BBS_BH_MT16x64x64_MI16x16x16x1_SE_1LDSB0_AF0EM8_EPS0_GRVW8_GSU1_GSUAMB_LBSPP128_LPA16_LPB16_LRVW8_PGR2_PLR5_SU0_SUS0_SRVW0_TT1_16_VAW2_WSGRA1_WSGRB1_WG16_16_1_WGM1
    SolutionIndex: 213
    SolutionNameMin: Cijk_Alik_Bljk_BBS_BH_MT64x64x64_MI32x32x8x1_SE_1LDSB0_AF0EM8_EPS0_GRVW8_GSU1_GSUAMB_LBSPP128_LPA8_LPB8_LRVW8_PGR2_PLR9_SU32_SUS128_SRVW4_TT1_32_VAW2_WSGRA1_WSGRB1_WG64_4_1_WGM2
    SolutionIndex: 214
    SolutionNameMin: Cijk_Alik_Bljk_BBS_BH_MT64x32x64_MI16x16x16x1_SE_1LDSB0_AF0EM8_EPS0_GRVW4_GSU1_GSUAMB_LBSPP128_LPA16_LPB16_LRVW8_PGR2_PLR5_SU0_SUS0_SRVW4_TT2_16_VAW2_WSGRA1_WSGRB1_WG32_8_1_WGM15
    SolutionIndex: 215
    SolutionNameMin: Cijk_Alik_Bljk_BBS_BH_MT64x64x32_MI32x32x8x1_SE_1LDSB1_AF0EM1_EPS1_GRVW2_GSU1_GSUAMB_LBSPP128_LPA8_LPB8_LRVW8_PGR1_PLR5_SU32_SUS256_SRVW4_TT1_32_VAW2_WSGRA1_WSGRB1_WG64_4_1_WGM15
    SolutionIndex: 216
    SolutionNameMin: Cijk_Alik_Bljk_BBS_BH_MT128x64x32_MI32x32x8x1_SE_1LDSB0_AF0EM8_EPS0_GRVW2_GSU1_GSUAMB_LBSPP128_LPA8_LPB8_LRVW8_PGR2_PLR5_SU0_SUS0_SRVW4_TT2_32_VAW2_WSGRA1_WSGRB1_WG64_4_1_WGM1
    SolutionIndex: 217
    SolutionNameMin: Cijk_Alik_Bljk_BBS_BH_MT64x64x32_MI32x32x8x1_SE_1LDSB1_AF0EM8_EPS0_GRVW8_GSU1_GSUAMB_LBSPP128_LPA8_LPB8_LRVW8_PGR2_PLR5_SU0_SUS0_SRVW4_TT1_32_VAW2_WSGRA1_WSGRB1_WG64_4_1_WGM15
    SolutionIndex: 218
    SolutionNameMin: Cijk_Alik_Bljk_BBS_BH_MT64x64x32_MI32x32x8x1_SE_1LDSB1_AF0EM8_EPS1_GRVW8_GSU1_GSUAMB_LBSPP128_LPA8_LPB8_LRVW8_PGR1_PLR5_SU32_SUS128_SRVW4_TT1_32_VAW2_WSGRA1_WSGRB1_WG64_4_1_WGM1
    SolutionIndex: 219
    SolutionNameMin: Cijk_Alik_Bljk_BBS_BH_MT128x128x32_MI32x32x8x1_SE_1LDSB1_AF0EM8_EPS1_GRVW8_GSU1_GSUAMB_LBSPP128_LPA8_LPB8_LRVW8_PGR1_PLR5_SU0_SUS0_SRVW4_TT2_64_VAW2_WSGRA1_WSGRB1_WG64_4_1_WGM2
    SolutionIndex: 220
    SolutionNameMin: Cijk_Alik_Bljk_BBS_BH_MT128x128x32_MI32x32x8x1_SE_1LDSB1_AF0EM1_EPS1_GRVW8_GSU1_GSUAMB_LBSPP128_LPA8_LPB8_LRVW8_PGR1_PLR5_SU0_SUS0_SRVW4_TT2_64_VAW2_WSGRA1_WSGRB1_WG64_4_1_WGM15
    SolutionIndex: 221
    SolutionNameMin: Cijk_Alik_Bljk_BBS_BH_MT128x256x32_MI32x32x8x1_SE_1LDSB1_AF0EM8_EPS1_GRVW4_GSU1_GSUAMB_LBSPP128_LPA8_LPB8_LRVW8_PGR1_PLR5_SU0_SUS0_SRVW4_TT2_128_VAW2_WSGRA1_WSGRB1_WG64_4_1_WGM1
    SolutionIndex: 222
    SolutionNameMin: Cijk_Alik_Bljk_BBS_BH_MT128x128x32_MI32x32x8x1_SE_1LDSB1_AF0EM8_EPS0_GRVW2_GSU1_GSUAMB_LBSPP128_LPA8_LPB8_LRVW8_PGR2_PLR5_SU0_SUS0_SRVW4_TT2_64_VAW2_WSGRA1_WSGRB1_WG64_4_1_WGM15
    SolutionIndex: 223
    SolutionNameMin: Cijk_Alik_Bljk_BBS_BH_MT128x128x32_MI32x32x8x1_SE_1LDSB1_AF0EM8_EPS0_GRVW2_GSU1_GSUAMB_LBSPP128_LPA8_LPB8_LRVW8_PGR2_PLR5_SU32_SUS256_SRVW4_TT2_64_VAW2_WSGRA1_WSGRB1_WG64_4_1_WGM1
    SolutionIndex: 224
    SolutionNameMin: Cijk_Alik_Bljk_BBS_BH_MT256x128x32_MI32x32x8x1_SE_1LDSB1_AF0EM8_EPS0_GRVW8_GSU1_GSUAMB_LBSPP128_LPA8_LPB8_LRVW8_PGR2_PLR5_SU0_SUS0_SRVW4_TT4_64_VAW2_WSGRA1_WSGRB1_WG64_4_1_WGM15
    SolutionIndex: 225
    SolutionNameMin: Cijk_Alik_Bljk_BBS_BH_MT128x256x32_MI32x32x8x1_SE_1LDSB1_AF0EM8_EPS0_GRVW4_GSU1_GSUAMB_LBSPP128_LPA8_LPB8_LRVW8_PGR2_PLR5_SU0_SUS0_SRVW4_TT2_128_VAW2_WSGRA1_WSGRB1_WG64_4_1_WGM2
    SolutionIndex: 226
    SolutionNameMin: Cijk_Alik_Bljk_BBS_BH_MT256x128x32_MI32x32x8x1_SE_1LDSB0_AF0EM8_EPS0_GRVW8_GSU1_GSUAMB_LBSPP128_LPA8_LPB8_LRVW8_PGR2_PLR5_SU32_SUS128_SRVW4_TT4_64_VAW2_WSGRA1_WSGRB1_WG64_4_1_WGM15
    SolutionIndex: 227
    SolutionNameMin: Cijk_Alik_Bljk_BBS_BH_MT128x128x32_MI32x32x8x1_SE_1LDSB1_AF0EM8_EPS0_GRVW2_GSU1_GSUAMB_LBSPP128_LPA8_LPB8_LRVW8_PGR2_PLR5_SU0_SUS0_SRVW4_TT2_64_VAW2_WSGRA1_WSGRB1_WG64_4_1_WGM2
    SolutionIndex: 228
    SolutionNameMin: Cijk_Alik_Bljk_BBS_BH_MT128x128x32_MI32x32x8x1_SE_1LDSB1_AF0EM1_EPS1_GRVW2_GSU1_GSUAMB_LBSPP128_LPA8_LPB8_LRVW8_PGR1_PLR5_SU0_SUS0_SRVW4_TT2_64_VAW2_WSGRA1_WSGRB1_WG64_4_1_WGM15
    SolutionIndex: 229
    SolutionNameMin: Cijk_Alik_Bljk_BBS_BH_MT128x128x32_MI32x32x8x1_SE_1LDSB1_AF0EM8_EPS0_GRVW4_GSU1_GSUAMB_LBSPP128_LPA8_LPB8_LRVW8_PGR2_PLR5_SU32_SUS256_SRVW4_TT2_64_VAW2_WSGRA1_WSGRB1_WG64_4_1_WGM1
    SolutionIndex: 230
    SolutionNameMin: Cijk_Alik_Bljk_BBS_BH_MT128x64x32_MI32x32x8x1_SE_1LDSB1_AF0EM8_EPS1_GRVW2_GSU1_GSUAMB_LBSPP128_LPA8_LPB8_LRVW8_PGR1_PLR5_SU32_SUS256_SRVW4_TT2_32_VAW2_WSGRA1_WSGRB1_WG64_4_1_WGM1
    SolutionIndex: 231
    SolutionNameMin: Cijk_Alik_Bljk_BBS_BH_MT128x96x32_MI32x32x8x1_SE_1LDSB0_AF0EM8_EPS0_GRVW4_GSU1_GSUAMB_LBSPP128_LPA8_LPB8_LRVW8_PGR2_PLR5_SU0_SUS0_SRVW4_TT1_96_VAW2_WSGRA1_WSGRB1_WG128_2_1_WGM1
    SolutionIndex: 232
    SolutionNameMin: Cijk_Alik_Bljk_BBS_BH_MT128x128x32_MI32x32x8x1_SE_1LDSB1_AF0EM1_EPS0_GRVW8_GSU1_GSUAMB_LBSPP128_LPA8_LPB8_LRVW8_PGR2_PLR5_SU0_SUS0_SRVW4_TT2_64_VAW2_WSGRA1_WSGRB1_WG64_4_1_WGM15
    SolutionIndex: 233
    SolutionNameMin: Cijk_Alik_Bljk_BBS_BH_MT64x128x32_MI32x32x8x1_SE_1LDSB1_AF0EM1_EPS1_GRVW2_GSU1_GSUAMB_LBSPP128_LPA8_LPB8_LRVW8_PGR1_PLR5_SU32_SUS128_SRVW4_TT1_64_VAW2_WSGRA1_WSGRB1_WG64_4_1_WGM15
    SolutionIndex: 234
    SolutionNameMin: Cijk_Alik_Bljk_BBS_BH_MT128x256x32_MI32x32x8x1_SE_1LDSB1_AF0EM1_EPS1_GRVW8_GSU1_GSUAMB_LBSPP128_LPA8_LPB8_LRVW8_PGR1_PLR5_SU0_SUS0_SRVW4_TT2_128_VAW2_WSGRA1_WSGRB1_WG64_4_1_WGM1
    SolutionIndex: 235
    SolutionNameMin: Cijk_Alik_Bljk_BBS_BH_MT64x64x32_MI32x32x8x1_SE_1LDSB1_AF0EM1_EPS0_GRVW4_GSU1_GSUAMB_LBSPP128_LPA8_LPB8_LRVW8_PGR2_PLR5_SU32_SUS128_SRVW4_TT1_32_VAW2_WSGRA1_WSGRB1_WG64_4_1_WGM15
    SolutionIndex: 236
    SolutionNameMin: Cijk_Alik_Bljk_BBS_BH_MT64x64x32_MI32x32x8x1_SE_1LDSB1_AF0EM1_EPS0_GRVW2_GSU1_GSUAMB_LBSPP128_LPA8_LPB8_LRVW8_PGR2_PLR5_SU32_SUS128_SRVW4_TT1_32_VAW2_WSGRA1_WSGRB1_WG64_4_1_WGM15
    SolutionIndex: 237
    SolutionNameMin: Cijk_Alik_Bljk_BBS_BH_MT128x192x32_MI32x32x8x1_SE_1LDSB1_AF0EM1_EPS0_GRVW2_GSU1_GSUAMB_LBSPP128_LPA8_LPB8_LRVW8_PGR2_PLR5_SU0_SUS0_SRVW4_TT2_96_VAW2_WSGRA1_WSGRB1_WG64_4_1_WGM15
    SolutionIndex: 238
    SolutionNameMin: Cijk_Alik_Bljk_BBS_BH_MT64x128x32_MI32x32x8x1_SE_1LDSB1_AF0EM1_EPS1_GRVW2_GSU1_GSUAMB_LBSPP128_LPA8_LPB8_LRVW8_PGR1_PLR5_SU32_SUS256_SRVW4_TT1_64_VAW2_WSGRA1_WSGRB1_WG64_4_1_WGM2
    SolutionIndex: 239
    SolutionNameMin: Cijk_Alik_Bljk_BBS_BH_MT64x128x32_MI32x32x8x1_SE_1LDSB1_AF0EM1_EPS0_GRVW8_GSU1_GSUAMB_LBSPP128_LPA8_LPB8_LRVW8_PGR2_PLR5_SU0_SUS0_SRVW4_TT1_64_VAW2_WSGRA1_WSGRB1_WG64_4_1_WGM2
    SolutionIndex: 240
    SolutionNameMin: Cijk_Alik_Bljk_BBS_BH_MT128x256x32_MI32x32x8x1_SE_1LDSB1_AF0EM1_EPS1_GRVW2_GSU1_GSUAMB_LBSPP128_LPA8_LPB8_LRVW8_PGR1_PLR5_SU0_SUS0_SRVW4_TT2_128_VAW2_WSGRA1_WSGRB1_WG64_4_1_WGM15
    SolutionIndex: 241
    SolutionNameMin: Cijk_Alik_Bljk_BBS_BH_MT128x96x64_MI32x32x8x1_SN_AMAS0_LPA8_LPB8_MIAV0_NTC3_NTD0_NEPBS0_PLR9_SU0_SUS0_SPO1_SSO0_SVW1_TT1_96_VW1_WG128_2_1_WGM8
    SolutionIndex: 242
    SolutionNameMin: Cijk_Alik_Bljk_BBS_BH_MT160x256x64_MI32x32x8x1_SN_AMAS0_LPA8_LPB8_MIAV0_NTC0_NTD3_NEPBS0_PLR9_SU0_SUS0_SPO0_SSO0_SVW1_TT5_64_VW1_WG32_8_1_WGM8
    SolutionIndex: 243
    SolutionNameMin: Cijk_Alik_Bljk_BBS_BH_MT128x64x64_MI16x16x16x1_SN_AMAS3_LPA16_LPB16_MIAV1_NTC3_NTD0_NEPBS0_PLR5_SU32_SUS256_SPO1_SSO4_SVW2_TT2_64_VW2_WG64_4_1_WGM8
    SolutionIndex: 244
    SolutionNameMin: Cijk_Alik_Bljk_BBS_BH_MT128x256x64_MI32x32x8x1_SN_AMAS0_GRVW8_LPA8_LPB8_LRVW8_MIAV0_NTC0_NTD0_NEPBS0_PLR9_SU0_SUS0_SVW1_TT2_128_VW1_WG64_4_1_WGM8
    SolutionIndex: 245
    SolutionNameMin: Cijk_Alik_Bljk_BBS_BH_MT256x256x32_MI32x32x8x1_SN_AMAS3_GRVW8_LPA8_LPB8_LRVW8_MIAV0_NTC3_NTD3_NEPBS0_PLR5_SU32_SUS256_SVW2_TT4_128_VW2_WG64_4_1_WGM1
    SolutionIndex: 246
    SolutionNameMin: Cijk_Alik_Bljk_BBS_BH_MT128x128x64_MI16x16x16x1_SN_AMAS0_GRVW8_LPA16_LPB16_LRVW8_MIAV1_NTC3_NTD3_NEPBS8_PLR5_SU0_SUS0_SVW1_TT4_64_VW1_WG32_8_1_WGM15
    SolutionIndex: 247
    SolutionNameMin: Cijk_Alik_Bljk_BBS_BH_MT128x64x64_MI32x32x8x1_SN_AMAS0_GRVW8_LPA8_LPB8_LRVW8_MIAV0_NTC3_NTD3_NEPBS0_PLR9_SU32_SUS256_SVW1_TT1_64_VW1_WG128_2_1_WGM3
    SolutionIndex: 248
    SolutionNameMin: Cijk_Alik_Bljk_BBS_BH_MT128x256x64_MI32x32x8x1_SN_AMAS0_NTC0_NEPBS0_SU0_SUS0_SPO1_SSO0_SVW1_TT2_128_VW1_WGM8
    SolutionIndex: 249
    SolutionNameMin: Cijk_Alik_Bljk_BBS_BH_MT128x128x64_MI32x32x8x1_SN_AMAS0_NTC3_NEPBS16_SU0_SUS0_SPO0_SSO4_SVW1_TT2_64_VW1_WGM8
    SolutionIndex: 250
    SolutionNameMin: Cijk_Alik_Bljk_BBS_BH_MT128x256x64_MI32x32x8x1_SN_AMAS0_NTC0_NEPBS0_SU0_SUS0_SPO0_SSO0_SVW1_TT2_128_VW1_WGM8
    SolutionIndex: 251
    SolutionNameMin: Cijk_Alik_Bljk_BBS_BH_MT128x128x64_MI32x32x8x1_SN_AMAS0_NTC3_NEPBS0_SU32_SUS128_SPO1_SSO4_SVW1_TT2_64_VW1_WGM12
    SolutionIndex: 252
    SolutionNameMin: Cijk_Alik_Bljk_BBS_BH_MT128x64x64_MI16x16x16x1_SN_1LDSB0_AMAS0_GSU1_GSUASB_LPA16_LPB16_LRVW8_PGR2_PLR5_SPO0_SSO4_TT2_64_VW1_WG64_4_1_WGM15
    SolutionIndex: 253
    SolutionNameMin: Cijk_Alik_Bljk_BBS_BH_MT128x64x64_MI16x16x16x1_SN_1LDSB0_AMAS3_GSU1_GSUASB_LPA16_LPB16_LRVW8_PGR2_PLR5_SPO0_SSO4_TT2_64_VW2_WG64_4_1_WGM2
    SolutionIndex: 254
    SolutionNameMin: Cijk_Alik_Bljk_BBS_BH_MT64x64x64_MI32x32x8x1_SN_1LDSB1_AMAS0_GSU1_GSUASB_LPA8_LPB8_LRVW8_PGR2_PLR9_SPO0_SSO0_TT1_32_VW1_WG64_4_1_WGM2
    SolutionIndex: 255
    SolutionNameMin: Cijk_Alik_Bljk_BBS_BH_MT128x64x64_MI16x16x16x1_SN_1LDSB0_AMAS0_GSU16_GSUAMB_LPA16_LPB16_LRVW8_PGR2_PLR5_SPO0_SSO4_TT2_64_VW1_WG64_4_1_WGM15
    SolutionIndex: 256
    SolutionNameMin: Cijk_Alik_Bljk_BBS_BH_MT64x64x64_MI32x32x8x1_SN_1LDSB1_AMAS0_GSU1_GSUASB_LPA8_LPB8_LRVW4_PGR2_PLR9_SPO0_SSO0_TT1_32_VW1_WG64_4_1_WGM8
    SolutionIndex: 257
    SolutionNameMin: Cijk_Alik_Bljk_BBS_BH_MT128x4x128_MI4x4x4x16_SN_1LDSB1_AMAS3_LBSPP256_LPA8_LPB8_LRVW8_MIAV0_NEPBS0_PGR1_PLR33_TT1_4_VW2_WSGRA0_WG128_1_1
    SolutionIndex: 258
    SolutionNameMin: Cijk_Alik_Bljk_BBS_BH_MT32x16x128_MI16x16x16x1_SN_1LDSB0_AMAS0_LBSPP256_LPA16_LPB16_LRVW8_MIAV1_NEPBS0_PGR2_PLR9_TT1_16_VW1_WSGRA0_WG32_4_1
    SolutionIndex: 259
    SolutionNameMin: Cijk_Alik_Bljk_BBS_BH_MT128x4x128_MI4x4x4x16_SN_1LDSB1_AMAS3_LBSPP256_LPA8_LPB8_LRVW8_MIAV0_NEPBS0_PGR1_PLR33_TT1_4_VW2_WSGRA1_WG128_1_1
    SolutionIndex: 260
    SolutionNameMin: Cijk_Alik_Bljk_BBS_BH_MT128x4x128_MI4x4x4x16_SN_1LDSB1_AMAS0_LBSPP256_LPA8_LPB8_LRVW8_MIAV0_NEPBS16_PGR2_PLR33_TT1_4_VW1_WSGRA1_WG128_1_1
    SolutionIndex: 261
    SolutionNameMin: Cijk_Alik_Bljk_BBS_BH_MT128x4x128_MI4x4x4x16_SN_1LDSB1_AMAS0_LBSPP256_LPA8_LPB8_LRVW8_MIAV0_NEPBS16_PGR2_PLR33_TT1_4_VW1_WSGRA0_WG128_1_1
    SolutionIndex: 262
    SolutionNameMin: Cijk_Alik_Bljk_BBS_BH_MT96x128x128_MI32x32x8x1_SN_1LDSB1_AMAS3_GRVW8_LBSPP256_LPA8_LPB8_LRVW8_MIAV1_NEPBS8_PGR2_PLR17_TT3_32_VW2_WG32_8_1
    SolutionIndex: 263
    SolutionNameMin: Cijk_Alik_Bljk_BBS_BH_MT96x128x128_MI32x32x8x1_SN_1LDSB1_AMAS3_GRVW8_LBSPP256_LPA8_LPB8_LRVW8_MIAV1_NEPBS0_PGR2_PLR17_TT3_32_VW2_WG32_8_1
    SolutionIndex: 264
    SolutionNameMin: Cijk_Alik_Bljk_BBS_BH_MT256x128x64_MI32x32x8x1_SN_1LDSB1_AMAS3_GRVW8_LBSPP128_LPA8_LPB8_LRVW8_MIAV0_NEPBS0_PGR2_PLR9_TT4_64_VW2_WG64_4_1
    SolutionIndex: 265
    SolutionNameMin: Cijk_Alik_Bljk_BBS_BH_MT96x128x64_MI32x32x8x1_SN_1LDSB0_AMAS3_GRVW8_LBSPP128_LPA8_LPB8_LRVW4_MIAV0_NEPBS16_PGR2_PLR1_TT3_32_VW2_WG32_8_1
    SolutionIndex: 266
    SolutionNameMin: Cijk_Alik_Bljk_BBS_BH_MT96x128x64_MI32x32x8x1_SN_1LDSB0_AMAS3_GRVW8_LBSPP128_LPA8_LPB8_LRVW4_MIAV1_NEPBS0_PGR2_PLR1_TT3_32_VW2_WG32_8_1
    SolutionIndex: 267
    SolutionNameMin: Cijk_Alik_Bljk_BBS_BH_MT128x128x64_MI16x16x16x1_SN_1LDSB1_AMAS3_GRVW8_LPA16_LPB16_LRVW8_NTC0_NTD3_PLR5_SPO0_SSO0_SVW2_TT4_64_VW2_WSGRA1_WSGRB0_WG32_8_1_WGM8
    SolutionIndex: 268
    SolutionNameMin: Cijk_Alik_Bljk_BBS_BH_MT144x256x64_MI16x16x16x1_SN_1LDSB1_AMAS0_GRVW4_LPA16_LPB16_LRVW8_NTC0_NTD3_PLR5_SPO1_SSO4_SVW1_TT9_64_VW1_WSGRA0_WSGRB1_WG16_16_1_WGM12
    SolutionIndex: 269
    SolutionNameMin: Cijk_Alik_Bljk_BBS_BH_MT96x128x64_MI32x32x8x1_SN_1LDSB1_AMAS0_GRVW8_LPA8_LPB8_LRVW8_NTC3_NTD0_PLR9_SPO1_SSO0_SVW1_TT3_32_VW1_WSGRA1_WSGRB0_WG32_8_1_WGM8
    SolutionIndex: 270
    SolutionNameMin: Cijk_Alik_Bljk_BBS_BH_MT96x128x64_MI32x32x8x1_SN_1LDSB1_AMAS0_GRVW8_LPA8_LPB8_LRVW8_NTC0_NTD0_PLR9_SPO0_SSO4_SVW1_TT3_32_VW1_WSGRA1_WSGRB0_WG32_8_1_WGM8
    SolutionIndex: 271
    SolutionNameMin: Cijk_Alik_Bljk_BBS_BH_MT128x256x64_MI16x16x16x1_SN_1LDSB1_AMAS0_GRVW8_LBSPP128_LPA16_LPB16_LRVW8_MIAV0_NTC3_NTD0_NEPBS8_PLR5_SS1_SU0_SUS0_SVW1_TT4_128_VW1_WG32_8_1
    SolutionIndex: 272
    SolutionNameMin: Cijk_Alik_Bljk_BBS_BH_MT128x256x64_MI16x16x16x1_SN_1LDSB1_AMAS3_GRVW8_LBSPP128_LPA16_LPB16_LRVW8_MIAV0_NTC3_NTD0_NEPBS0_PLR5_SS1_SU0_SUS0_SVW2_TT4_128_VW2_WG32_8_1
    SolutionIndex: 273
    SolutionNameMin: Cijk_Alik_Bljk_BBS_BH_MT128x96x128_MI32x32x8x1_SN_1LDSB1_AMAS0_GRVW8_LBSPP256_LPA8_LPB8_LRVW8_MIAV0_NTC0_NTD0_NEPBS8_PLR17_SS1_SU32_SUS256_SVW1_TT1_96_VW1_WG128_2_1
    SolutionIndex: 274
    SolutionNameMin: Cijk_Alik_Bljk_BBS_BH_MT128x96x64_MI16x16x16x1_SN_LBSPPA512_LBSPPB128_NTC3_NTD3_NEPBS0_PLR5_SU32_SUS128_SPO1_SSO4_SVW4_VW4_WGM15
    SolutionIndex: 275
    SolutionNameMin: Cijk_Alik_Bljk_BBS_BH_MT128x96x64_MI16x16x16x1_SN_LBSPPA512_LBSPPB128_NTC3_NTD0_NEPBS0_PLR5_SU32_SUS128_SPO1_SSO4_SVW4_VW4_WGM8
- - - [1024, 512, 1, 1025]
    - [4, 16.364]
  - - [8192, 8193, 1, 8192]
    - [5, 80.06]
  - - [8192, 8192, 1, 8193]
    - [6, 74.403]
  - - [4096, 4096, 1, 4097]
    - [6, 64.925]
  - - [1025, 1024, 1, 1024]
    - [7, 31.867]
  - - [8192, 8191, 1, 8192]
    - [8, 80.452]
  - - [2048, 513, 1, 2048]
    - [9, 42.087]
  - - [1024, 1024, 1, 1025]
    - [10, 25.019]
  - - [3072, 511, 1, 3072]
    - [4, 58.109]
  - - [2049, 512, 1, 2048]
    - [7, 38.181]
  - - [4096, 4095, 1, 4096]
    - [5, 76.066]
  - - [513, 512, 1, 512]
    - [11, 8.512]
  - - [1024, 511, 1, 1024]
    - [12, 23.219]
  - - [1023, 512, 1, 1024]
    - [13, 22.054]
  - - [1024, 513, 1, 1024]
    - [12, 23.4]
  - - [4096, 4097, 1, 4096]
    - [5, 76.095]
  - - [2048, 2047, 1, 2048]
    - [14, 62.854]
  - - [8193, 8192, 1, 8192]
    - [15, 78.647]
  - - [1024, 1023, 1, 1024]
    - [16, 33.758]
  - - [4096, 4096, 1, 4095]
    - [6, 64.514]
  - - [1025, 512, 1, 1024]
    - [13, 22.342]
  - - [1024, 512, 1, 1023]
    - [17, 15.696]
  - - [512, 512, 1, 513]
    - [18, 7.147]
  - - [1024, 1025, 1, 1024]
    - [16, 34.111]
  - - [512, 512, 1, 511]
    - [18, 7.086]
  - - [2047, 2048, 1, 2048]
    - [19, 54.681]
  - - [2049, 2048, 1, 2048]
    - [19, 57.091]
  - - [2048, 511, 1, 2048]
    - [20, 41.996]
  - - [2048, 2049, 1, 2048]
    - [4, 63.161]
  - - [2048, 512, 1, 2047]
    - [5, 33.448]
  - - [2047, 512, 1, 2048]
    - [7, 37.845]
  - - [3072, 513, 1, 3072]
    - [4, 58.212]
  - - [512, 511, 1, 512]
    - [21, 9.864]
  - - [4097, 4096, 1, 4096]
    - [15, 73.489]
  - - [2048, 2048, 1, 2047]
    - [22, 47.911]
  - - [2048, 2048, 1, 2049]
    - [23, 49.808]
  - - [8191, 8192, 1, 8192]
    - [15, 78.953]
  - - [512, 513, 1, 512]
    - [21, 9.968]
  - - [8192, 8192, 1, 8191]
    - [24, 74.384]
  - - [1024, 1024, 1, 1023]
    - [25, 24.514]
  - - [511, 512, 1, 512]
    - [26, 8.114]
  - - [4095, 4096, 1, 4096]
    - [15, 73.578]
  - - [2048, 512, 1, 2049]
    - [27, 34.531]
  - - [1023, 1024, 1, 1024]
    - [7, 29.841]
  - - [512, 512, 1, 512]
    - [21, 10.287]
  - - [1024, 1024, 1, 1024]
    - [60, 32.962]
  - - [2048, 2048, 1, 2048]
    - [28, 63.839]
  - - [4096, 4096, 1, 4096]
    - [5, 76.144]
  - - [8192, 8192, 1, 8192]
    - [29, 80.508]
  - - [479, 1024, 1, 1024]
    - [13, 20.959]
  - - [479, 2048, 1, 2048]
    - [7, 36.627]
  - - [480, 1023, 1, 1024]
    - [12, 21.958]
  - - [480, 1024, 1, 1023]
    - [30, 14.563]
  - - [480, 1024, 1, 1025]
    - [31, 15.137]
  - - [480, 1025, 1, 1024]
    - [12, 21.665]
  - - [480, 2047, 1, 2048]
    - [32, 42.536]
  - - [480, 2048, 1, 2047]
    - [33, 34.195]
  - - [480, 2048, 1, 2049]
    - [33, 34.647]
  - - [480, 2049, 1, 2048]
    - [32, 42.657]
  - - [481, 1024, 1, 1024]
    - [13, 21.203]
  - - [481, 2048, 1, 2048]
    - [7, 36.661]
  - - [511, 480, 1, 512]
    - [34, 7.648]
  - - [512, 479, 1, 512]
    - [21, 9.431]
  - - [512, 480, 1, 511]
    - [35, 6.835]
  - - [512, 480, 1, 513]
    - [36, 6.796]
  - - [512, 481, 1, 512]
    - [21, 9.225]
  - - [513, 480, 1, 512]
    - [37, 7.891]
  - - [1023, 480, 1, 1024]
    - [13, 21.06]
  - - [1024, 479, 1, 1024]
    - [38, 21.599]
  - - [1024, 480, 1, 1023]
    - [17, 14.676]
  - - [1024, 480, 1, 1025]
    - [4, 15.467]
  - - [1024, 481, 1, 1024]
    - [12, 22.197]
  - - [1025, 480, 1, 1024]
    - [13, 21.101]
  - - [2047, 480, 1, 2048]
    - [7, 34.772]
  - - [2048, 479, 1, 2048]
    - [39, 43.363]
  - - [2048, 480, 1, 2047]
    - [5, 33.788]
  - - [2048, 480, 1, 2049]
    - [10, 34.074]
  - - [2048, 481, 1, 2048]
    - [20, 39.947]
  - - [2049, 480, 1, 2048]
    - [7, 35.908]
  - - [480, 1024, 1, 1024]
    - [12, 21.81]
  - - [480, 2048, 1, 2048]
    - [33, 42.717]
  - - [512, 480, 1, 512]
    - [21, 9.515]
  - - [1024, 480, 1, 1024]
    - [40, 21.561]
  - - [2048, 480, 1, 2048]
    - [39, 44.301]
  - - [480, 3072, 1, 3072]
    - [4, 55.96]
  - - [480, 4096, 1, 4096]
    - [22, 58.877]
  - - [480, 8192, 1, 8192]
    - [33, 76.711]
  - - [3072, 480, 1, 3072]
    - [4, 55.534]
  - - [4096, 480, 1, 4096]
    - [22, 59.379]
  - - [8192, 480, 1, 8192]
    - [41, 77.3]
  - - [17, 17, 1, 64]
    - [42, 0.002]
  - - [24, 24, 1, 64]
    - [203, 0.005]
  - - [30, 31, 1, 64]
    - [42, 0.007]
  - - [32, 32, 1, 64]
    - [57, 0.009]
  - - [32, 35, 1, 64]
    - [43, 0.008]
  - - [31, 31, 1, 64]
    - [132, 0.007]
  - - [34, 34, 1, 64]
    - [45, 0.009]
  - - [30, 30, 1, 64]
    - [42, 0.007]
  - - [17, 15, 1, 64]
    - [42, 0.002]
  - - [35, 35, 1, 64]
    - [42, 0.01]
  - - [21, 17, 1, 64]
    - [44, 0.003]
  - - [21, 21, 1, 64]
    - [202, 0.003]
  - - [15, 14, 1, 64]
    - [45, 0.002]
  - - [14, 14, 1, 64]
    - [42, 0.001]
  - - [15, 15, 1, 64]
    - [42, 0.002]
  - - [34, 24, 1, 64]
    - [203, 0.007]
  - - [2, 4, 1, 1024]
    - [46, 0.001]
  - - [2, 32, 1, 1024]
    - [47, 0.005]
  - - [2, 2048, 1, 1024]
    - [48, 0.353]
  - - [64, 128, 512, 128]
    - [16, 14.54]
  - - [64, 512, 1, 512]
    - [49, 1.673]
  - - [64, 512, 64, 512]
    - [151, 26.764]
  - - [128, 128, 512, 64]
    - [4, 12.269]
  - - [512, 512, 1, 64]
    - [34, 1.703]
  - - [512, 512, 64, 64]
    - [51, 15.569]
  - - [1024, 4, 1, 1024]
    - [3, 0.734]
  - - [1024, 4, 1, 1024]
    - [52, 0.361]
  - - [1024, 32, 1, 1024]
    - [49, 2.821]
  - - [1024, 2048, 1, 1024]
    - [16, 44.395]
  - - [1024, 2048, 1, 4096]
    - [53, 61.84]
  - - [1024, 4096, 1, 1024]
    - [54, 55.877]
  - - [1024, 4096, 1, 4096]
    - [4, 69.276]
  - - [4096, 2048, 1, 1024]
    - [5, 59.851]
  - - [4096, 4096, 1, 1024]
    - [5, 66.538]
  - - [30528, 2048, 1, 1024]
    - [5, 69.685]
  - - [30528, 4096, 1, 1024]
    - [5, 72.08]
  - - [3, 3, 512, 64]
    - [57, 0.03]
  - - [5, 5, 512, 64]
    - [42, 0.08]
  - - [5, 5, 960, 64]
    - [171, 0.145]
  - - [9, 9, 512, 64]
    - [42, 0.251]
  - - [27, 27, 32768, 128]
    - [55, 7.049]
  - - [32, 1600, 1, 512]
    - [56, 2.482]
  - - [33, 33, 1600, 32]
    - [57, 2.094]
  - - [64, 512, 1, 1024]
    - [47, 2.864]
  - - [64, 960, 1, 1024]
    - [58, 5.212]
  - - [128, 32768, 1, 256]
    - [54, 27.185]
  - - [256, 684, 1, 1024]
    - [21, 11.223]
  - - [256, 1280, 1, 1024]
    - [21, 19.793]
  - - [256, 1536, 1, 1024]
    - [21, 22.683]
  - - [256, 2304, 1, 1024]
    - [12, 25.297]
  - - [256, 2560, 1, 1024]
    - [31, 27.594]
  - - [256, 2816, 1, 1024]
    - [4, 30.577]
  - - [256, 3328, 1, 1024]
    - [59, 35.23]
  - - [256, 3584, 1, 1024]
    - [60, 31.133]
  - - [256, 4608, 1, 1024]
    - [16, 36.982]
  - - [256, 4864, 1, 1024]
    - [61, 38.826]
  - - [256, 5376, 1, 1024]
    - [4, 40.299]
  - - [256, 5888, 1, 1024]
    - [4, 43.475]
  - - [256, 6144, 1, 1024]
    - [4, 45.028]
  - - [256, 6400, 1, 1024]
    - [4, 46.102]
  - - [256, 6656, 1, 1024]
    - [4, 47.142]
  - - [256, 7168, 1, 1024]
    - [16, 39.204]
  - - [256, 7424, 1, 1024]
    - [16, 40.455]
  - - [256, 7936, 1, 1024]
    - [16, 42.156]
  - - [256, 8192, 1, 1024]
    - [4, 43.128]
  - - [256, 8448, 1, 1024]
    - [20, 45.614]
  - - [256, 8960, 1, 1024]
    - [54, 46.755]
  - - [256, 9984, 1, 1024]
    - [41, 52.19]
  - - [256, 10496, 1, 1024]
    - [4, 52.631]
  - - [256, 11264, 1, 1024]
    - [4, 46.529]
  - - [256, 11520, 1, 1024]
    - [54, 47.989]
  - - [256, 11776, 1, 1024]
    - [54, 48.575]
  - - [256, 12544, 1, 1024]
    - [54, 50.82]
  - - [256, 13312, 1, 1024]
    - [54, 53.346]
  - - [256, 14336, 1, 1024]
    - [9, 52.08]
  - - [256, 14592, 1, 1024]
    - [20, 54.971]
  - - [256, 14848, 1, 1024]
    - [20, 53.027]
  - - [256, 15104, 1, 1024]
    - [9, 54.401]
  - - [256, 16128, 1, 1024]
    - [28, 52.867]
  - - [256, 18176, 1, 1024]
    - [20, 51.568]
  - - [256, 18944, 1, 1024]
    - [9, 53.286]
  - - [256, 19200, 1, 1024]
    - [20, 55.979]
  - - [256, 20480, 1, 1024]
    - [20, 57.009]
  - - [256, 20992, 1, 1024]
    - [20, 58.052]
  - - [256, 21248, 1, 1024]
    - [28, 51.565]
  - - [256, 21504, 1, 1024]
    - [20, 52.272]
  - - [256, 22016, 1, 1024]
    - [54, 52.822]
  - - [256, 22344, 1, 1024]
    - [4, 53.048]
  - - [256, 23296, 1, 1024]
    - [28, 55.532]
  - - [256, 23552, 1, 1024]
    - [28, 56.415]
  - - [256, 31488, 1, 1024]
    - [20, 62.499]
  - - [256, 32768, 1, 512]
    - [4, 46.844]
  - - [256, 33536, 1, 1024]
    - [20, 57.72]
  - - [256, 44505, 1, 1024]
    - [20, 60.24]
  - - [512, 1600, 1, 512]
    - [16, 23.278]
  - - [512, 32768, 1, 13]
    - [62, 2.821]
  - - [512, 32768, 1, 1024]
    - [5, 64.434]
  - - [684, 8976, 1, 256]
    - [7, 29.862]
  - - [1024, 200, 1, 560]
    - [36, 7.219]
  - - [1024, 512, 1, 1024]
    - [38, 20.857]
  - - [1024, 512, 1, 1600]
    - [4, 28.213]
  - - [1024, 960, 1, 1024]
    - [63, 34.264]
  - - [1024, 960, 1, 1600]
    - [63, 41.992]
  - - [1024, 1600, 1, 560]
    - [64, 26.506]
  - - [1024, 1600, 1, 1024]
    - [4, 46.788]
  - - [1024, 32768, 1, 480]
    - [65, 57.334]
  - - [1024, 32768, 1, 1024]
    - [5, 70.104]
  - - [1280, 8976, 1, 256]
    - [66, 37.36]
  - - [1792, 8976, 1, 256]
    - [20, 41.422]
  - - [2048, 114, 1, 512]
    - [21, 9.1]
  - - [2048, 114, 1, 768]
    - [21, 11.61]
  - - [2048, 215, 1, 512]
    - [12, 14.35]
  - - [2048, 215, 1, 768]
    - [12, 17.804]
  - - [2048, 256, 1, 512]
    - [12, 16.436]
  - - [2048, 256, 1, 768]
    - [12, 20.434]
  - - [2048, 512, 1, 67]
    - [35, 4.373]
  - - [2048, 512, 1, 74]
    - [35, 4.83]
  - - [2048, 512, 1, 100]
    - [67, 5.997]
  - - [2048, 512, 1, 2048]
    - [9, 42.225]
  - - [2048, 684, 1, 512]
    - [4, 29.491]
  - - [2048, 684, 1, 768]
    - [4, 35.545]
  - - [2048, 960, 1, 74]
    - [68, 7.005]
  - - [2048, 960, 1, 2048]
    - [20, 51.087]
  - - [2048, 1536, 1, 512]
    - [4, 39.707]
  - - [2048, 1536, 1, 768]
    - [4, 46.849]
  - - [2048, 8976, 1, 256]
    - [69, 41.914]
  - - [2304, 8976, 1, 256]
    - [66, 43.192]
  - - [2560, 8976, 1, 256]
    - [69, 43.574]
  - - [2816, 8976, 1, 256]
    - [69, 43.918]
  - - [3072, 8976, 1, 256]
    - [66, 44.406]
  - - [3328, 8976, 1, 256]
    - [66, 45.015]
  - - [3840, 8976, 1, 256]
    - [69, 45.54]
  - - [4096, 8976, 1, 256]
    - [66, 45.124]
  - - [4352, 8976, 1, 256]
    - [69, 45.912]
  - - [4608, 8976, 1, 256]
    - [69, 45.972]
  - - [4864, 8976, 1, 256]
    - [66, 45.526]
  - - [5120, 8976, 1, 256]
    - [66, 45.881]
  - - [5376, 8976, 1, 256]
    - [70, 45.439]
  - - [5632, 8976, 1, 256]
    - [69, 45.38]
  - - [5888, 8976, 1, 256]
    - [10, 45.462]
  - - [6144, 8976, 1, 256]
    - [69, 45.826]
  - - [6400, 8976, 1, 256]
    - [20, 45.159]
  - - [7168, 8976, 1, 256]
    - [9, 45.118]
  - - [7936, 8976, 1, 256]
    - [9, 44.781]
  - - [8192, 8976, 1, 256]
    - [71, 45.249]
  - - [8448, 8976, 1, 256]
    - [41, 44.698]
  - - [8960, 8976, 1, 256]
    - [41, 44.54]
  - - [9472, 8976, 1, 256]
    - [41, 45.11]
  - - [9728, 8976, 1, 256]
    - [41, 44.853]
  - - [9984, 8976, 1, 256]
    - [8, 45.062]
  - - [10240, 8976, 1, 256]
    - [41, 45.527]
  - - [10496, 8976, 1, 256]
    - [8, 45.198]
  - - [11264, 8976, 1, 256]
    - [8, 45.557]
  - - [11776, 8976, 1, 256]
    - [8, 45.817]
  - - [12544, 8976, 1, 256]
    - [8, 45.675]
  - - [13312, 8976, 1, 256]
    - [8, 46.167]
  - - [13568, 8976, 1, 256]
    - [8, 45.26]
  - - [13824, 8976, 1, 256]
    - [8, 46.191]
  - - [15104, 8976, 1, 256]
    - [8, 46.144]
  - - [15360, 8976, 1, 256]
    - [8, 47.171]
  - - [15872, 8976, 1, 256]
    - [41, 45.723]
  - - [16128, 8976, 1, 256]
    - [8, 46.352]
  - - [17152, 8976, 1, 256]
    - [8, 46.707]
  - - [18176, 8976, 1, 256]
    - [8, 46.42]
  - - [18688, 8976, 1, 256]
    - [8, 46.156]
  - - [18944, 8976, 1, 256]
    - [8, 46.923]
  - - [19712, 8976, 1, 256]
    - [8, 46.643]
  - - [19968, 8976, 1, 256]
    - [8, 46.397]
  - - [20480, 8976, 1, 256]
    - [8, 47.586]
  - - [20992, 8976, 1, 256]
    - [8, 46.927]
  - - [21248, 8976, 1, 256]
    - [8, 46.972]
  - - [23552, 8976, 1, 256]
    - [8, 47.358]
  - - [28672, 8976, 1, 256]
    - [8, 47.806]
  - - [31488, 8976, 1, 256]
    - [8, 47.34]
  - - [33536, 8976, 1, 256]
    - [8, 47.34]
  - - [44505, 8976, 1, 256]
    - [15, 43.068]
  - - [14, 14, 10880, 64]
    - [72, 3.679]
  - - [15, 14, 10880, 64]
    - [72, 3.736]
  - - [15, 15, 7680, 64]
    - [72, 3.5]
  - - [15, 15, 10880, 64]
    - [132, 3.804]
  - - [17, 15, 7680, 64]
    - [72, 2.68]
  - - [17, 17, 7680, 64]
    - [34, 2.699]
  - - [21, 17, 6144, 64]
    - [34, 3.157]
  - - [21, 21, 6144, 64]
    - [131, 3.869]
  - - [24, 24, 4736, 64]
    - [36, 5.464]
  - - [30, 30, 2048, 64]
    - [34, 4.343]
  - - [30, 31, 2048, 64]
    - [34, 4.518]
  - - [31, 31, 2048, 64]
    - [131, 4.327]
  - - [32, 32, 4608, 64]
    - [131, 8.006]
  - - [32, 35, 4608, 64]
    - [35, 7.075]
  - - [34, 24, 4736, 64]
    - [13, 3.844]
  - - [34, 34, 4736, 64]
    - [135, 4.209]
  - - [35, 35, 4608, 64]
    - [57, 4.066]
  - - [1024, 3840, 1, 1024]
    - [20, 58.536]
  - - [1024, 3840, 1, 4096]
    - [41, 74.005]
  - - [1024, 3968, 1, 1024]
    - [14, 53.697]
  - - [1024, 3968, 1, 4096]
    - [4, 67.328]
  - - [1024, 6528, 1, 1024]
    - [9, 64.321]
  - - [1024, 6528, 1, 4096]
    - [20, 77.275]
  - - [1024, 7104, 1, 1024]
    - [20, 60.075]
  - - [1024, 7104, 1, 4096]
    - [20, 71.456]
  - - [1024, 7200, 1, 1024]
    - [20, 60.627]
  - - [1024, 7200, 1, 4096]
    - [20, 72.207]
  - - [1024, 8064, 1, 1024]
    - [5, 59.542]
  - - [1024, 8064, 1, 4096]
    - [20, 69.998]
  - - [1024, 8160, 1, 1024]
    - [20, 59.988]
  - - [1024, 8160, 1, 4096]
    - [20, 70.74]
  - - [1024, 9216, 1, 1024]
    - [20, 66.106]
  - - [1024, 9216, 1, 4096]
    - [20, 78.342]
  - - [1024, 9520, 1, 1024]
    - [4, 61.525]
  - - [1024, 9520, 1, 4096]
    - [73, 73.4]
  - - [1024, 10064, 1, 1024]
    - [9, 63.107]
  - - [1024, 10064, 1, 4096]
    - [20, 75.693]
  - - [1024, 10080, 1, 1024]
    - [20, 64.544]
  - - [1024, 10080, 1, 4096]
    - [20, 75.777]
  - - [1024, 10200, 1, 1024]
    - [20, 63.791]
  - - [1024, 10200, 1, 4096]
    - [20, 76.026]
  - - [4096, 3840, 1, 1024]
    - [5, 66.665]
  - - [4096, 3968, 1, 1024]
    - [5, 64.905]
  - - [4096, 6528, 1, 1024]
    - [5, 69.306]
  - - [4096, 7104, 1, 1024]
    - [5, 69.403]
  - - [4096, 7200, 1, 1024]
    - [5, 69.778]
  - - [4096, 8064, 1, 1024]
    - [5, 69.908]
  - - [4096, 8160, 1, 1024]
    - [74, 69.616]
  - - [4096, 9216, 1, 1024]
    - [5, 70.676]
  - - [4096, 9520, 1, 1024]
    - [5, 69.791]
  - - [4096, 10064, 1, 1024]
    - [5, 70.771]
  - - [4096, 10080, 1, 1024]
    - [5, 70.799]
  - - [4096, 10200, 1, 1024]
    - [74, 69.775]
  - - [42720, 3968, 1, 1024]
    - [5, 71.733]
  - - [42720, 6528, 1, 1024]
    - [5, 73.074]
  - - [42720, 7104, 1, 1024]
    - [5, 73.065]
  - - [42720, 7200, 1, 1024]
    - [5, 73.418]
  - - [42720, 9520, 1, 1024]
    - [5, 72.697]
  - - [42720, 10080, 1, 1024]
    - [5, 73.166]
  - - [27, 27, 1920, 64]
    - [1, 4.213]
  - - [27, 33, 1920, 64]
    - [0, 4.595]
  - - [33, 33, 1920, 64]
    - [2, 3.385]
  - - [27, 27, 1920, 64]
    - [131, 4.103]
  - - [27, 33, 1920, 64]
    - [75, 3.671]
  - - [33, 33, 1920, 64]
    - [57, 3.75]
  - - [1024, 3240, 1, 1024]
    - [28, 51.447]
  - - [1024, 3240, 1, 4096]
    - [76, 67.508]
  - - [1024, 3960, 1, 1024]
    - [14, 52.389]
  - - [1024, 3960, 1, 4096]
    - [14, 66.619]
  - - [4096, 3240, 1, 1024]
    - [5, 66.109]
  - - [4096, 3960, 1, 1024]
    - [5, 64.707]
  - - [42720, 3960, 1, 1024]
    - [5, 70.861]
  - - [1024, 10, 1, 1024]
    - [77, 0.869]
  - - [1024, 32768, 1, 479]
    - [78, 45.441]
  - - [1024, 4992, 1, 4096]
    - [20, 73.718]
  - - [1024, 5, 1, 1024]
    - [58, 0.434]
  - - [2, 5, 1, 1024]
    - [79, 0.001]
  - - [8192, 7680, 1, 8192]
    - [15, 81.134]
  - - [2, 40, 1, 1024]
    - [47, 0.007]
  - - [128, 128, 128, 64]
    - [80, 7.876]
  - - [64, 128, 1, 128]
    - [81, 0.121]
  - - [1024, 2560, 1, 4096]
    - [41, 71.371]
  - - [30522, 462, 1, 1024]
    - [15, 60.276]
  - - [1024, 820, 1, 1024]
    - [82, 33.637]
  - - [4096, 5248, 1, 1024]
    - [5, 68.545]
  - - [4096, 3840, 1, 4096]
    - [5, 77.201]
  - - [1024, 39, 1, 1024]
    - [58, 3.413]
  - - [128, 128, 160, 64]
    - [83, 9.088]
  - - [4096, 1280, 1, 1024]
    - [4, 57.497]
  - - [1024, 2560, 1, 1024]
    - [4, 53.339]
  - - [1024, 800, 1, 1024]
    - [16, 33.634]
  - - [1024, 8, 1, 1024]
    - [77, 0.711]
  - - [30522, 160, 1, 1024]
    - [19, 41.641]
  - - [2, 1024, 1, 1024]
    - [48, 0.175]
  - - [30522, 308, 1, 1024]
    - [19, 53.585]
  - - [17, 17, 6144, 64]
    - [131, 2.587]
  - - [4096, 2560, 1, 1024]
    - [74, 64.348]
  - - [4096, 8192, 1, 1024]
    - [274, 77.97]
  - - [33, 33, 1, 32]
    - [84, 0.004]
  - - [1024, 5120, 1, 1024]
    - [28, 58.668]
  - - [1024, 9, 1, 1024]
    - [52, 0.788]
  - - [1024, 780, 1, 1024]
    - [4, 32.22]
  - - [512, 512, 80, 64]
    - [85, 16.33]
  - - [4096, 3072, 1, 1024]
    - [5, 64.149]
  - - [480, 512, 1, 512]
    - [21, 9.389]
  - - [1024, 3072, 1, 4096]
    - [4, 65.127]
  - - [4096, 1024, 1, 1024]
    - [31, 53.528]
  - - [1024, 1152, 1, 1024]
    - [16, 37.7]
  - - [128, 128, 656, 64]
    - [86, 12.981]
  - - [1024, 1024, 1, 4096]
    - [20, 52.426]
  - - [30522, 820, 1, 1024]
    - [15, 65.239]
  - - [2, 10, 1, 1024]
    - [46, 0.002]
  - - [1024, 180, 1, 1024]
    - [21, 12.083]
  - - [128, 128, 624, 64]
    - [87, 12.865]
  - - [1024, 160, 1, 1024]
    - [21, 11.119]
  - - [4096, 5120, 1, 1024]
    - [74, 67.245]
  - - [4, 4, 38400, 64]
    - [57, 0.66]
  - - [2048, 1920, 1, 2048]
    - [20, 68.527]
  - - [2, 39, 1, 1024]
    - [79, 0.006]
  - - [1024, 462, 1, 1024]
    - [12, 20.992]
  - - [2, 9, 1, 1024]
    - [88, 0.001]
  - - [30522, 180, 1, 1024]
    - [19, 45.21]
  - - [33712, 8192, 1, 1024]
    - [5, 73.918]
  - - [1024, 77, 1, 1024]
    - [47, 5.907]
  - - [5, 5, 1, 64]
    - [42, 0.0]
  - - [1024, 40, 1, 1024]
    - [58, 3.527]
  - - [2, 8, 1, 1024]
    - [46, 0.001]
  - - [512, 512, 96, 64]
    - [86, 16.818]
  - - [1024, 1152, 1, 4096]
    - [20, 60.02]
  - - [30522, 385, 1, 1024]
    - [15, 53.04]
  - - [1024, 200, 1, 1024]
    - [21, 13.126]
  - - [1024, 5120, 1, 4096]
    - [20, 74.445]
  - - [30522, 616, 1, 1024]
    - [15, 61.327]
  - - [1024, 41, 1, 1024]
    - [89, 3.588]
  - - [128, 128, 1, 64]
    - [42, 0.127]
  - - [1024, 5248, 1, 4096]
    - [20, 76.26]
  - - [4, 4, 32768, 64]
    - [57, 0.645]
  - - [128, 128, 640, 64]
    - [87, 13.149]
  - - [7680, 8192, 1, 8192]
    - [5, 81.141]
  - - [1024, 1280, 1, 4096]
    - [33, 62.551]
  - - [1024, 5248, 1, 1024]
    - [4, 59.5]
  - - [512, 512, 128, 64]
    - [87, 17.369]
  - - [512, 512, 16, 64]
    - [87, 10.687]
  - - [1024, 9600, 1, 1024]
    - [5, 62.076]
  - - [2, 6, 1, 1024]
    - [90, 0.001]
  - - [1024, 385, 1, 1024]
    - [21, 21.866]
  - - [1024, 4992, 1, 1024]
    - [9, 60.178]
  - - [33712, 9600, 1, 1024]
    - [5, 74.885]
  - - [1024, 512, 1, 4096]
    - [91, 38.711]
  - - [1024, 9600, 1, 4096]
    - [4, 74.162]
  - - [1024, 6, 1, 1024]
    - [92, 0.514]
  - - [1024, 308, 1, 1024]
    - [21, 18.756]
  - - [3840, 4096, 1, 4096]
    - [5, 77.013]
  - - [2, 41, 1, 1024]
    - [47, 0.007]
  - - [4096, 1152, 1, 1024]
    - [15, 55.606]
  - - [4096, 9600, 1, 1024]
    - [5, 70.225]
  - - [30522, 200, 1, 1024]
    - [15, 42.4]
  - - [4096, 4992, 1, 1024]
    - [5, 67.055]
  - - [1024, 8192, 1, 1024]
    - [14, 59.483]
  - - [30522, 780, 1, 1024]
    - [15, 61.639]
  - - [4096, 512, 1, 1024]
    - [41, 44.071]
  - - [1024, 1280, 1, 1024]
    - [16, 41.092]
  - - [1920, 2048, 1, 2048]
    - [20, 66.911]
  - - [1024, 3072, 1, 1024]
    - [4, 51.625]
  - - [1024, 8192, 1, 4096]
    - [93, 70.719]
  - - [128, 128, 144, 64]
    - [80, 8.814]
  - - [30522, 800, 1, 1024]
    - [15, 64.537]
  - - [30522, 77, 1, 1024]
    - [15, 26.713]
  - - [1024, 1024, 128, 96]
    - [94, 26.868]
  - - [30592, 4096, 1, 1024]
    - [5, 71.175]
  - - [64, 1024, 256, 1024]
    - [95, 38.17]
  - - [1536, 8192, 1, 1536]
    - [28, 68.176]
  - - [2048, 2, 1, 2048]
    - [89, 0.556]
  - - [3072, 8192, 1, 1024]
    - [5, 68.833]
  - - [3072, 2048, 1, 1024]
    - [5, 59.74]
  - - [50304, 8192, 1, 1024]
    - [5, 72.294]
  - - [64, 512, 40, 512]
    - [16, 25.203]
  - - [2048, 1024, 1, 8192]
    - [96, 64.071]
  - - [96, 1024, 64, 1024]
    - [33, 44.367]
  - - [1024, 16, 1, 1024]
    - [47, 1.37]
  - - [50304, 2048, 1, 1024]
    - [5, 69.531]
  - - [1536, 8192, 1, 6144]
    - [97, 78.286]
  - - [50304, 4096, 1, 1536]
    - [5, 74.61]
  - - [8192, 1024, 1, 2048]
    - [41, 66.583]
  - - [2, 4, 1, 2560]
    - [90, 0.001]
  - - [2560, 2048, 1, 640]
    - [41, 52.072]
  - - [1024, 1024, 128, 64]
    - [86, 18.935]
  - - [2048, 1024, 1, 2048]
    - [41, 53.41]
  - - [1536, 4096, 1, 1536]
    - [28, 66.632]
  - - [1024, 1024, 64, 64]
    - [98, 18.364]
  - - [30592, 8192, 1, 1024]
    - [5, 72.235]
  - - [50304, 16384, 1, 1024]
    - [5, 72.425]
  - - [4608, 4096, 1, 1536]
    - [5, 69.378]
  - - [2560, 2048, 1, 2560]
    - [41, 70.366]
  - - [7680, 2048, 1, 2560]
    - [5, 73.585]
  - - [2, 16, 1, 1024]
    - [49, 0.003]
  - - [50304, 4096, 1, 1024]
    - [5, 71.876]
  - - [64, 1024, 128, 1024]
    - [99, 38.012]
  - - [1920, 2048, 1, 2560]
    - [20, 69.028]
  - - [1024, 1024, 64, 96]
    - [100, 26.016]
  - - [64, 1024, 32, 1024]
    - [16, 32.784]
  - - [6144, 4096, 1, 1536]
    - [5, 72.127]
  - - [64, 512, 128, 512]
    - [76, 29.221]
  - - [1536, 4096, 1, 6144]
    - [101, 76.405]
  - - [512, 512, 256, 64]
    - [85, 18.476]
  - - [96, 1024, 128, 1024]
    - [33, 45.351]
  - - [50304, 8192, 1, 1536]
    - [5, 75.363]
  - - [6144, 8192, 1, 1536]
    - [5, 73.852]
  - - [4096, 16384, 1, 1024]
    - [5, 71.701]
  - - [30592, 1024, 1, 2048]
    - [5, 73.825]
  - - [2, 2, 1, 2048]
    - [79, 0.001]
  - - [1024, 16384, 1, 4096]
    - [41, 76.354]
  - - [64, 512, 256, 512]
    - [102, 31.565]
  - - [512, 512, 40, 64]
    - [85, 14.568]
  - - [6144, 1024, 1, 2048]
    - [41, 68.091]
  - - [4608, 8192, 1, 1536]
    - [5, 72.576]
  - - [30592, 2048, 1, 1024]
    - [5, 68.663]
  - - [3072, 16384, 1, 1024]
    - [5, 71.257]
  - - [1024, 1024, 256, 64]
    - [103, 19.107]
  - - [64, 1024, 64, 1024]
    - [73, 35.424]
  - - [1024, 16384, 1, 1024]
    - [5, 66.038]
  - - [1024, 1024, 32, 64]
    - [85, 17.469]
  - - [3072, 4096, 1, 1024]
    - [5, 64.262]
  - - [2560, 4, 1, 2560]
    - [58, 1.53]
  - - [960, 1024, 1, 1024]
    - [16, 33.654]
  - - [1024, 1, 1, 1024]
    - [58, 0.088]
  - - [32768, 1, 1, 256]
    - [104, 0.446]
  - - [512, 1, 1, 2048]
    - [89, 0.074]
  - - [1600, 1, 1, 1024]
    - [58, 0.133]
  - - [200, 1, 1, 1024]
    - [92, 0.017]
  - - [960, 1, 1, 2048]
    - [89, 0.138]
  - - [1024, 64, 1, 1024]
    - [49, 5.559]
  - - [30528, 8192, 1, 1024]
    - [5, 72.835]
  - - [128, 128, 1024, 64]
    - [80, 13.654]
  - - [64, 128, 1024, 128]
    - [61, 16.282]
  - - [1024, 3456, 1, 1024]
    - [4, 56.161]
  - - [1024, 3456, 1, 480]
    - [105, 42.342]
  - - [1024, 4096, 1, 480]
    - [94, 38.84]
  - - [1024, 6912, 1, 1024]
    - [28, 60.442]
  - - [1024, 6912, 1, 480]
    - [106, 47.846]
  - - [1024, 864, 1, 1024]
    - [63, 30.652]
  - - [1024, 864, 1, 480]
    - [107, 19.45]
  - - [128, 3456, 1, 256]
    - [21, 9.815]
  - - [128, 4096, 1, 256]
    - [108, 10.149]
  - - [128, 55296, 1, 256]
    - [4, 30.378]
  - - [128, 6912, 1, 256]
    - [60, 15.85]
  - - [128, 864, 1, 256]
    - [49, 2.798]
  - - [256, 3456, 1, 512]
    - [16, 24.537]
  - - [256, 4096, 1, 512]
    - [16, 25.308]
  - - [256, 55296, 1, 512]
    - [20, 51.389]
  - - [256, 6912, 1, 512]
    - [4, 35.689]
  - - [256, 864, 1, 512]
    - [21, 8.985]
  - - [3456, 1, 1, 256]
    - [109, 0.089]
  - - [4096, 1, 1, 256]
    - [58, 0.106]
  - - [512, 3456, 1, 1024]
    - [4, 49.913]
  - - [512, 3456, 1, 13]
    - [110, 1.322]
  - - [512, 4096, 1, 1024]
    - [28, 44.313]
  - - [512, 4096, 1, 13]
    - [111, 1.442]
  - - [512, 55296, 1, 13]
    - [112, 3.156]
  - - [512, 6912, 1, 1024]
    - [4, 56.006]
  - - [512, 6912, 1, 13]
    - [113, 1.92]
  - - [512, 864, 1, 1024]
    - [21, 24.896]
  - - [512, 864, 1, 13]
    - [34, 0.506]
  - - [6912, 1, 1, 256]
    - [49, 0.166]
  - - [864, 1, 1, 256]
    - [109, 0.024]
  - - [30528, 640, 1, 1024]
    - [41, 64.384]
  - - [30528, 1280, 1, 1024]
    - [5, 67.874]
  - - [30528, 1600, 1, 1024]
    - [5, 68.848]
  - - [1024, 10240, 1, 1024]
    - [20, 63.771]
  - - [1024, 80, 1, 1024]
    - [47, 6.848]
  - - [4096, 10240, 1, 1024]
    - [5, 70.457]
  - - [1024, 10240, 1, 4096]
    - [20, 76.566]
  - - [64, 128, 1280, 128]
    - [114, 16.765]
  - - [128, 128, 1280, 64]
    - [4, 14.132]
  - - [1024, 10496, 1, 4096]
    - [20, 78.011]
  - - [30528, 1640, 1, 1024]
    - [5, 68.567]
  - - [1024, 82, 1, 1024]
    - [49, 6.635]
  - - [4096, 10496, 1, 1024]
    - [5, 70.947]
  - - [1024, 10496, 1, 1024]
    - [10, 65.125]
  - - [64, 128, 1312, 128]
    - [114, 16.793]
  - - [128, 128, 1312, 64]
    - [28, 13.976]
  - - [30528, 160, 1, 1024]
    - [4, 44.795]
  - - [1024, 12, 1, 1024]
    - [52, 1.058]
  - - [30528, 240, 1, 1024]
    - [31, 54.711]
  - - [1024, 6144, 1, 1024]
    - [20, 60.995]
  - - [4096, 6144, 1, 1024]
    - [5, 69.013]
  - - [1024, 6144, 1, 4096]
    - [14, 73.429]
  - - [64, 512, 192, 512]
    - [73, 30.678]
  - - [512, 512, 192, 64]
    - [105, 18.029]
  - - [2, 64, 1, 1024]
    - [46, 0.011]
  - - [2, 80, 1, 1024]
    - [79, 0.013]
  - - [2, 82, 1, 1024]
    - [79, 0.016]
  - - [2, 12, 1, 1024]
    - [49, 0.002]
  - - [2, 1, 1, 1024]
    - [115, 0.0]
  - - [1, 4096, 1, 256]
    - [88, 0.107]
  - - [1, 6912, 1, 256]
    - [55, 0.163]
  - - [1024, 10224, 1, 1024]
    - [10, 63.571]
  - - [1024, 10192, 1, 1024]
    - [10, 63.573]
  - - [1024, 10208, 1, 1024]
    - [10, 63.706]
  - - [1024, 10224, 1, 4096]
    - [20, 76.362]
  - - [4096, 10224, 1, 1024]
    - [5, 70.387]
  - - [3072, 10224, 1, 1024]
    - [5, 69.43]
  - - [3072, 10240, 1, 1024]
    - [5, 68.787]
  - - [1024, 10192, 1, 4096]
    - [20, 76.183]
  - - [4096, 10192, 1, 1024]
    - [5, 69.449]
  - - [3072, 10192, 1, 1024]
    - [5, 69.345]
  - - [3072, 10200, 1, 1024]
    - [5, 69.227]
  - - [1024, 10184, 1, 1024]
    - [20, 63.725]
  - - [3072, 10208, 1, 1024]
    - [5, 69.361]
  - - [1024, 10208, 1, 4096]
    - [20, 76.302]
  - - [4096, 10208, 1, 1024]
    - [5, 70.308]
  - - [2048, 10224, 1, 1024]
    - [5, 67.346]
  - - [2048, 10240, 1, 1024]
    - [5, 67.791]
  - - [1024, 10120, 1, 1024]
    - [10, 63.057]
  - - [2048, 10192, 1, 1024]
    - [5, 67.36]
  - - [24, 24, 6816, 64]
    - [204, 5.606]
  - - [1024, 10152, 1, 1024]
    - [9, 63.424]
  - - [3072, 10080, 1, 1024]
    - [5, 70.145]
  - - [1024, 2048, 1, 49]
    - [68, 5.1]
  - - [1024, 256, 1, 196]
    - [34, 4.048]
  - - [1024, 512, 1, 196]
    - [116, 6.397]
  - - [1152, 128, 1, 784]
    - [21, 6.784]
  - - [128, 512, 1, 784]
    - [117, 3.405]
  - - [2048, 512, 1, 49]
    - [118, 3.327]
  - - [2304, 256, 1, 196]
    - [116, 7.079]
  - - [256, 1024, 1, 196]
    - [36, 4.105]
  - - [256, 128, 1, 3136]
    - [44, 4.47]
  - - [256, 512, 1, 784]
    - [21, 6.03]
  - - [256, 64, 1, 3136]
    - [44, 2.244]
  - - [4608, 512, 1, 49]
    - [119, 5.713]
  - - [512, 1024, 1, 196]
    - [35, 6.432]
  - - [512, 128, 1, 784]
    - [120, 3.346]
  - - [512, 2048, 1, 49]
    - [110, 3.366]
  - - [512, 256, 1, 784]
    - [21, 6.093]
  - - [576, 64, 1, 3136]
    - [44, 4.971]
  - - [64, 256, 1, 3136]
    - [44, 2.235]
  - - [64, 64, 1, 3136]
    - [44, 0.557]
  - - [128, 128, 49, 12800]
    - [121, 44.393]
  - - [128, 128, 25, 25088]
    - [122, 43.888]
  - - [128, 128, 49, 25600]
    - [54, 44.927]
  - - [128, 128, 25, 50176]
    - [123, 44.581]
  - - [256, 256, 25, 12544]
    - [93, 72.315]
  - - [256, 256, 49, 3200]
    - [97, 61.714]
  - - [256, 256, 25, 6272]
    - [124, 67.705]
  - - [256, 256, 49, 6400]
    - [97, 68.224]
  - - [512, 512, 49, 1152]
    - [20, 58.745]
  - - [512, 512, 25, 2048]
    - [28, 62.798]
  - - [512, 512, 49, 2304]
    - [54, 66.62]
  - - [512, 512, 25, 4096]
    - [124, 68.517]
  - - [64, 128, 2048, 128]
    - [7, 17.051]
  - - [128, 128, 2048, 64]
    - [4, 14.816]
  - - [30528, 2560, 1, 1024]
    - [5, 71.039]
  - - [1024, 128, 1, 1024]
    - [21, 8.948]
  - - [64, 128, 1536, 128]
    - [7, 16.88]
  - - [128, 128, 1536, 64]
    - [4, 14.192]
  - - [1024, 12288, 1, 1024]
    - [5, 63.867]
  - - [1024, 12288, 1, 4096]
    - [97, 75.53]
  - - [30528, 1920, 1, 1024]
    - [5, 71.144]
  - - [1024, 96, 1, 1024]
    - [90, 7.931]
  - - [4096, 12288, 1, 1024]
    - [5, 71.135]
  - - [128, 128, 36, 12544]
    - [125, 40.962]
  - - [128, 128, 49, 9216]
    - [125, 44.292]
  - - [128, 128, 64, 6400]
    - [97, 42.122]
  - - [128, 128, 81, 12544]
    - [126, 46.425]
  - - [128, 128, 121, 9216]
    - [122, 40.584]
  - - [128, 128, 169, 6400]
    - [124, 44.947]
  - - [256, 256, 36, 4096]
    - [10, 62.645]
  - - [256, 256, 49, 2304]
    - [127, 57.928]
  - - [256, 256, 64, 2304]
    - [54, 58.852]
  - - [256, 256, 81, 4096]
    - [127, 70.945]
  - - [256, 256, 121, 2304]
    - [4, 61.797]
  - - [256, 256, 169, 2304]
    - [4, 60.654]
  - - [512, 512, 81, 1024]
    - [29, 61.784]
  - - [512, 512, 121, 1024]
    - [29, 62.769]
  - - [512, 512, 169, 1024]
    - [41, 62.899]
  - - [512, 512, 36, 1024]
    - [20, 57.485]
  - - [512, 512, 49, 1024]
    - [9, 58.344]
  - - [512, 512, 64, 1024]
    - [9, 59.814]
  - - [64, 64, 36, 50176]
    - [49, 21.308]
  - - [64, 64, 49, 36864]
    - [49, 27.25]
  - - [64, 64, 64, 25600]
    - [49, 24.041]
  - - [128, 128, 192, 64]
    - [87, 9.221]
  - - [64, 128, 192, 128]
    - [102, 11.119]
  - - [768, 2048, 1, 768]
    - [4, 39.679]
  - - [3072, 2048, 1, 768]
    - [28, 55.379]
  - - [768, 2048, 1, 3072]
    - [28, 60.286]
  - - [768, 16, 1, 768]
    - [48, 0.831]
  - - [384, 384, 144, 64]
    - [62, 16.015]
  - - [64, 384, 144, 384]
    - [73, 25.732]
  - - [768, 4608, 1, 768]
    - [28, 51.378]
  - - [3072, 4608, 1, 768]
    - [5, 61.799]
  - - [768, 4608, 1, 3072]
    - [54, 70.204]
  - - [768, 12, 1, 768]
    - [89, 0.613]
  - - [512, 512, 48, 64]
    - [85, 14.729]
  - - [64, 512, 48, 512]
    - [128, 27.003]
  - - [768, 4, 1, 768]
    - [89, 0.206]
  - - [128, 128, 256, 64]
    - [87, 10.357]
  - - [64, 128, 256, 128]
    - [16, 12.195]
  - - [384, 384, 192, 64]
    - [62, 16.41]
  - - [64, 384, 192, 384]
    - [114, 24.896]
  - - [1024, 4608, 1, 1024]
    - [20, 56.18]
  - - [4096, 4608, 1, 1024]
    - [5, 68.757]
  - - [1024, 4608, 1, 4096]
    - [20, 68.714]
  - - [2880, 3072, 1, 3072]
    - [20, 72.068]
  - - [3072, 3072, 1, 3072]
    - [9, 76.102]
  - - [3072, 512, 1, 3072]
    - [4, 60.153]
  - - [4096, 512, 1, 4096]
    - [4, 58.406]
  - - [512, 1024, 1, 1024]
    - [12, 23.814]
  - - [512, 2048, 1, 2048]
    - [20, 42.447]
  - - [512, 3072, 1, 3072]
    - [101, 60.286]
  - - [512, 4096, 1, 4096]
    - [53, 62.357]
  - - [512, 8192, 1, 8192]
    - [54, 71.675]
  - - [64, 1024, 1, 1024]
    - [92, 5.56]
  - - [8192, 512, 1, 8192]
    - [14, 72.169]
  - - [26, 26, 6272, 64]
    - [34, 5.549]
  - - [147, 64, 1, 12544]
    - [129, 3.613]
  - - [2, 128, 1, 1024]
    - [130, 0.023]
  - - [2, 96, 1, 1024]
    - [48, 0.018]
  - - [2, 2048, 1, 768]
    - [46, 0.275]
  - - [2, 4608, 1, 768]
    - [88, 0.562]
  - - [2, 4608, 1, 1024]
    - [88, 0.695]
  - - [4224, 3840, 1, 4096]
    - [41, 79.402]
  - - [5376, 4096, 1, 4096]
    - [5, 76.6]
  - - [7040, 4096, 1, 384]
    - [41, 52.155]
  - - [7040, 4096, 1, 512]
    - [5, 57.181]
  - - [7040, 4096, 1, 768]
    - [5, 64.858]
  - - [7040, 4096, 1, 1536]
    - [5, 72.196]
  - - [31, 31, 8192, 64]
    - [131, 5.62]
  - - [34, 34, 5248, 64]
    - [57, 4.231]
  - - [15, 15, 8192, 64]
    - [132, 3.563]
  - - [5, 5, 8192, 64]
    - [57, 0.642]
  - - [32, 32, 5248, 64]
    - [36, 8.554]
  - - [17, 17, 8192, 64]
    - [131, 2.749]
  - - [24, 24, 5440, 64]
    - [36, 5.565]
  - - [9, 9, 8192, 64]
    - [42, 1.929]
  - - [26, 26, 5248, 64]
    - [131, 5.296]
  - - [30, 30, 5248, 64]
    - [34, 5.657]
  - - [33, 33, 8192, 64]
    - [57, 4.495]
  - - [35, 35, 8192, 64]
    - [57, 4.232]
  - - [4, 4, 3456, 64]
    - [42, 0.256]
  - - [3, 3, 8192, 64]
    - [57, 0.236]
  - - [14, 14, 5440, 64]
    - [72, 3.1]
  - - [21, 21, 8192, 64]
    - [34, 4.064]
  - - [34, 24, 320, 64]
    - [42, 1.29]
  - - [27, 27, 8192, 64]
    - [131, 5.811]
  - - [1024, 10032, 1, 1024]
    - [5, 63.175]
  - - [1024, 10032, 1, 4096]
    - [20, 75.058]
  - - [1024, 11304, 1, 1024]
    - [5, 63.562]
  - - [1024, 13104, 1, 1024]
    - [10, 66.186]
  - - [1024, 1640, 1, 1024]
    - [121, 45.695]
  - - [1024, 256, 1, 1024]
    - [150, 13.562]
  - - [1024, 288, 1, 1024]
    - [21, 17.012]
  - - [1024, 304, 1, 1024]
    - [21, 18.512]
  - - [1024, 312, 1, 1024]
    - [21, 18.616]
  - - [1024, 3304, 1, 1024]
    - [4, 52.89]
  - - [1024, 3304, 1, 4096]
    - [14, 68.21]
  - - [1024, 3400, 1, 1024]
    - [14, 53.628]
  - - [1024, 352, 1, 1024]
    - [21, 20.897]
  - - [1024, 3520, 1, 1024]
    - [4, 57.122]
  - - [1024, 3584, 1, 4096]
    - [20, 69.44]
  - - [1024, 3696, 1, 1024]
    - [9, 54.107]
  - - [1024, 384, 1, 1024]
    - [133, 22.458]
  - - [1024, 3872, 1, 1024]
    - [20, 56.265]
  - - [1024, 3872, 1, 4096]
    - [20, 78.059]
  - - [1024, 392, 1, 1024]
    - [21, 21.948]
  - - [1024, 432, 1, 1024]
    - [38, 20.252]
  - - [1024, 448, 1, 1024]
    - [12, 21.87]
  - - [1024, 456, 1, 1024]
    - [40, 20.562]
  - - [1024, 4896, 1, 1024]
    - [20, 59.385]
  - - [1024, 4896, 1, 4096]
    - [20, 72.369]
  - - [1024, 4968, 1, 1024]
    - [20, 57.204]
  - - [1024, 4968, 1, 4096]
    - [41, 72.593]
  - - [1024, 504, 1, 1024]
    - [108, 22.639]
  - - [1024, 520, 1, 1024]
    - [12, 23.358]
  - - [1024, 5280, 1, 1024]
    - [20, 63.327]
  - - [1024, 5280, 1, 4096]
    - [20, 77.223]
  - - [1024, 672, 1, 1024]
    - [16, 28.053]
  - - [1024, 6880, 1, 4096]
    - [8, 73.291]
  - - [1024, 7040, 1, 1024]
    - [4, 61.064]
  - - [1024, 7040, 1, 4096]
    - [127, 74.642]
  - - [1024, 7144, 1, 1024]
    - [5, 59.31]
  - - [1024, 7144, 1, 4096]
    - [20, 71.147]
  - - [1024, 728, 1, 1024]
    - [54, 28.861]
  - - [1024, 760, 1, 1024]
    - [16, 31.726]
  - - [2048, 1280, 1, 1024]
    - [28, 53.059]
  - - [2048, 144, 1, 1024]
    - [21, 17.183]
  - - [2048, 1640, 1, 1024]
    - [4, 53.374]
  - - [2048, 2832, 1, 1024]
    - [4, 56.515]
  - - [2048, 3696, 1, 1024]
    - [5, 60.729]
  - - [2048, 4704, 1, 1024]
    - [74, 60.901]
  - - [2048, 480, 1, 1024]
    - [39, 34.683]
  - - [2048, 744, 1, 1024]
    - [4, 42.668]
  - - [2048, 7448, 1, 1024]
    - [5, 65.226]
  - - [2048, 8192, 1, 1024]
    - [5, 66.469]
  - - [2048, 8968, 1, 1024]
    - [5, 67.225]
  - - [3072, 144, 1, 1024]
    - [12, 19.629]
  - - [3072, 4480, 1, 1024]
    - [5, 63.69]
  - - [3072, 4896, 1, 1024]
    - [5, 65.16]
  - - [3072, 6880, 1, 1024]
    - [5, 67.846]
  - - [3072, 8968, 1, 1024]
    - [5, 68.856]
  - - [33712, 160, 1, 1024]
    - [20, 48.655]
  - - [33712, 3408, 1, 1024]
    - [5, 72.981]
  - - [4096, 10032, 1, 1024]
    - [5, 70.43]
  - - [4096, 3304, 1, 1024]
    - [5, 63.186]
  - - [4096, 3584, 1, 1024]
    - [5, 63.646]
  - - [4096, 3872, 1, 1024]
    - [5, 66.852]
  - - [4096, 4896, 1, 1024]
    - [5, 68.349]
  - - [4096, 4968, 1, 1024]
    - [5, 66.411]
  - - [4096, 5280, 1, 1024]
    - [5, 68.982]
  - - [4096, 6880, 1, 1024]
    - [5, 69.366]
  - - [4096, 7040, 1, 1024]
    - [5, 68.863]
  - - [4096, 7144, 1, 1024]
    - [5, 69.335]
  - - [1024, 14336, 1, 1024]
    - [20, 66.054]
  - - [1024, 1536, 1, 1024]
    - [4, 45.365]
  - - [1024, 15360, 1, 1024]
    - [20, 66.812]
  - - [1024, 17920, 1, 1024]
    - [5, 66.889]
  - - [1024, 18944, 1, 1024]
    - [5, 66.528]
  - - [1024, 19968, 1, 1024]
    - [5, 67.15]
  - - [1024, 20992, 1, 1024]
    - [5, 68.056]
  - - [1024, 22016, 1, 1024]
    - [5, 68.034]
  - - [1024, 23040, 1, 1024]
    - [5, 68.476]
  - - [1024, 24064, 1, 1024]
    - [5, 67.575]
  - - [1024, 28160, 1, 1024]
    - [5, 69.02]
  - - [1024, 30208, 1, 1024]
    - [5, 68.894]
  - - [1024, 31232, 1, 1024]
    - [5, 69.749]
  - - [10, 44, 3712, 64]
    - [42, 3.515]
  - - [16, 12, 10240, 64]
    - [134, 3.207]
  - - [16, 14, 10240, 64]
    - [134, 3.651]
  - - [16, 32, 5120, 64]
    - [72, 5.728]
  - - [18, 14, 9088, 64]
    - [42, 2.789]
  - - [20, 16, 11008, 64]
    - [57, 4.097]
  - - [20, 18, 8192, 64]
    - [131, 3.392]
  - - [22, 16, 10048, 64]
    - [57, 4.12]
  - - [22, 18, 10048, 64]
    - [34, 3.82]
  - - [22, 32, 5120, 64]
    - [131, 5.437]
  - - [24, 36, 320, 64]
    - [43, 1.557]
  - - [26, 32, 384, 64]
    - [135, 1.8]
  - - [26, 34, 320, 64]
    - [72, 1.569]
  - - [28, 32, 384, 64]
    - [72, 1.851]
  - - [28, 34, 320, 64]
    - [72, 1.592]
  - - [30, 32, 384, 64]
    - [135, 1.926]
  - - [30, 36, 320, 64]
    - [135, 1.793]
  - - [32, 34, 320, 64]
    - [57, 1.946]
  - - [32, 36, 320, 64]
    - [43, 2.077]
  - - [2368, 1024, 1, 1]
    - [111, 0.137]
  - - [448, 1, 1, 256]
    - [58, 0.012]
  - - [5056, 1408, 1, 3328]
    - [121, 73.089]
  - - [5056, 1856, 1, 3328]
    - [14, 71.529]
  - - [5888, 128, 1, 1]
    - [110, 0.062]
  - - [448, 3584, 1, 3328]
    - [121, 61.621]
  - - [704, 64, 1, 3328]
    - [47, 7.931]
  - - [5056, 4288, 1, 32]
    - [136, 10.664]
  - - [3584, 1024, 1, 256]
    - [7, 27.565]
  - - [32, 5056, 1, 1280]
    - [55, 11.784]
  - - [1856, 256, 1, 1]
    - [137, 0.041]
  - - [256, 1856, 1, 32]
    - [110, 1.416]
  - - [1408, 3584, 1, 3328]
    - [20, 70.865]
  - - [128, 3584, 1, 1280]
    - [108, 23.544]
  - - [1024, 2368, 1, 3328]
    - [9, 65.128]
  - - [4288, 64, 1, 3328]
    - [122, 25.854]
  - - [1, 4288, 1, 1280]
    - [88, 0.379]
  - - [2368, 64, 1, 1]
    - [138, 0.015]
  - - [448, 64, 1, 1]
    - [43, 0.003]
  - - [32, 1408, 1, 32]
    - [43, 0.177]
  - - [448, 3584, 1, 32]
    - [111, 4.106]
  - - [1, 1408, 1, 3328]
    - [48, 0.264]
  - - [1408, 128, 1, 32]
    - [84, 0.619]
  - - [4288, 6784, 1, 3328]
    - [5, 77.351]
  - - [2944, 128, 1, 32]
    - [57, 1.27]
  - - [64, 6784, 1, 1]
    - [34, 0.04]
  - - [448, 128, 1, 256]
    - [90, 1.517]
  - - [64, 5056, 1, 3328]
    - [139, 26.783]
  - - [5888, 4288, 1, 3328]
    - [5, 77.21]
  - - [1, 2368, 1, 1280]
    - [48, 0.225]
  - - [704, 1024, 1, 1]
    - [107, 0.056]
  - - [2368, 1408, 1, 32]
    - [111, 6.164]
  - - [256, 1856, 1, 1280]
    - [108, 23.792]
  - - [1024, 2944, 1, 1]
    - [111, 0.139]
  - - [2944, 3584, 1, 3328]
    - [41, 74.914]
  - - [2368, 2944, 1, 1280]
    - [54, 63.111]
  - - [256, 1408, 1, 1]
    - [84, 0.033]
  - - [1, 1024, 1, 3328]
    - [48, 0.19]
  - - [6784, 5888, 1, 3328]
    - [5, 77.735]
  - - [3584, 1408, 1, 32]
    - [118, 6.664]
  - - [5056, 256, 1, 256]
    - [16, 20.18]
  - - [1856, 2368, 1, 256]
    - [16, 30.767]
  - - [2368, 1024, 1, 3328]
    - [41, 65.504]
  - - [3584, 4288, 1, 32]
    - [140, 8.644]
  - - [3584, 3584, 1, 1]
    - [141, 0.213]
  - - [32, 2944, 1, 3328]
    - [56, 15.358]
  - - [704, 1408, 1, 3328]
    - [33, 48.838]
  - - [1408, 704, 1, 256]
    - [16, 15.207]
  - - [704, 64, 1, 32]
    - [84, 0.18]
  - - [5888, 1, 1, 3328]
    - [49, 0.78]
  - - [2368, 32, 1, 256]
    - [109, 1.917]
  - - [6784, 128, 1, 3328]
    - [91, 56.33]
  - - [2944, 256, 1, 1]
    - [111, 0.059]
  - - [1408, 2368, 1, 1]
    - [142, 0.137]
  - - [32, 448, 1, 3328]
    - [89, 2.729]
  - - [5056, 1, 1, 3328]
    - [49, 0.749]
  - - [2944, 256, 1, 32]
    - [143, 2.322]
  - - [5056, 6784, 1, 1280]
    - [5, 72.116]
  - - [4288, 5056, 1, 1]
    - [111, 0.251]
  - - [5056, 4288, 1, 1]
    - [111, 0.253]
  - - [128, 4288, 1, 3328]
    - [91, 36.947]
  - - [5056, 128, 1, 256]
    - [12, 11.889]
  - - [1408, 4288, 1, 1280]
    - [54, 61.794]
  - - [1856, 704, 1, 1280]
    - [16, 45.405]
  - - [4288, 1024, 1, 3328]
    - [121, 70.63]
  - - [1, 5888, 1, 3328]
    - [88, 0.788]
  - - [32, 4288, 1, 1280]
    - [115, 10.696]
  - - [1024, 5056, 1, 1]
    - [62, 0.176]
  - - [704, 3584, 1, 1280]
    - [76, 55.215]
  - - [1856, 5056, 1, 256]
    - [54, 36.724]
  - - [1408, 1024, 1, 1280]
    - [54, 45.498]
  - - [5056, 5888, 1, 3328]
    - [5, 76.135]
  - - [448, 1, 1, 1]
    - [144, 0.0]
  - - [3584, 3584, 1, 1280]
    - [5, 67.044]
  - - [2368, 3584, 1, 32]
    - [111, 8.717]
  - - [2944, 2368, 1, 1]
    - [80, 0.181]
  - - [704, 4288, 1, 1]
    - [111, 0.157]
  - - [2368, 256, 1, 32]
    - [110, 1.917]
  - - [1024, 6784, 1, 1280]
    - [54, 62.928]
  - - [32, 5056, 1, 32]
    - [138, 0.556]
  - - [5888, 32, 1, 32]
    - [84, 0.635]
  - - [256, 5056, 1, 32]
    - [110, 3.31]
  - - [5056, 64, 1, 32]
    - [138, 1.061]
  - - [2368, 5056, 1, 32]
    - [136, 9.487]
  - - [6784, 1856, 1, 32]
    - [140, 8.391]
  - - [64, 2368, 1, 1280]
    - [21, 11.324]
  - - [128, 704, 1, 32]
    - [137, 0.322]
  - - [64, 6784, 1, 3328]
    - [145, 33.705]
  - - [2944, 256, 1, 1280]
    - [91, 35.635]
  - - [5056, 704, 1, 1]
    - [146, 0.15]
  - - [2944, 4288, 1, 256]
    - [54, 39.067]
  - - [5056, 704, 1, 32]
    - [147, 6.082]
  - - [1856, 4288, 1, 3328]
    - [76, 72.061]
  - - [1, 1856, 1, 256]
    - [88, 0.047]
  - - [6784, 4288, 1, 32]
    - [148, 9.306]
  - - [5888, 64, 1, 256]
    - [21, 8.051]
  - - [5888, 5056, 1, 256]
    - [20, 43.497]
  - - [2944, 448, 1, 256]
    - [16, 19.608]
  - - [3584, 2368, 1, 3328]
    - [14, 70.841]
  - - [4288, 1856, 1, 1]
    - [111, 0.212]
  - - [1856, 2944, 1, 1]
    - [111, 0.188]
  - - [32, 4288, 1, 3328]
    - [55, 15.978]
  - - [1, 3584, 1, 3328]
    - [88, 0.592]
  - - [256, 32, 1, 3328]
    - [48, 1.544]
  - - [1856, 2368, 1, 32]
    - [107, 6.83]
  - - [4288, 1856, 1, 32]
    - [136, 8.721]
  - - [5056, 64, 1, 3328]
    - [133, 29.307]
  - - [6784, 1, 1, 1280]
    - [49, 0.523]
  - - [1408, 64, 1, 1]
    - [138, 0.009]
  - - [1, 1, 1, 3328]
    - [46, 0.0]
  - - [5056, 2368, 1, 256]
    - [54, 38.931]
  - - [1408, 5888, 1, 256]
    - [54, 35.477]
  - - [5056, 6784, 1, 1]
    - [62, 0.268]
  - - [32, 448, 1, 1280]
    - [89, 1.456]
  - - [32, 448, 1, 32]
    - [134, 0.057]
  - - [1856, 64, 1, 256]
    - [55, 2.808]
  - - [1024, 1408, 1, 3328]
    - [54, 56.371]
  - - [256, 5056, 1, 1280]
    - [16, 43.208]
  - - [704, 2368, 1, 1]
    - [111, 0.115]
  - - [128, 1, 1, 1]
    - [144, 0.0]
  - - [3584, 4288, 1, 1280]
    - [5, 68.256]
  - - [1856, 128, 1, 32]
    - [84, 0.8]
  - - [1856, 128, 1, 1280]
    - [21, 15.788]
  - - [128, 2944, 1, 3328]
    - [139, 34.802]
  - - [1, 6784, 1, 3328]
    - [149, 0.821]
  - - [3584, 2368, 1, 1]
    - [62, 0.193]
  - - [4288, 448, 1, 3328]
    - [22, 55.026]
  - - [4288, 32, 1, 3328]
    - [104, 15.928]
  - - [256, 1856, 1, 1]
    - [84, 0.041]
  - - [704, 6784, 1, 1280]
    - [20, 60.311]
  - - [2368, 4288, 1, 32]
    - [111, 9.106]
  - - [704, 5056, 1, 1280]
    - [76, 59.342]
  - - [3584, 6784, 1, 32]
    - [118, 9.179]
  - - [3584, 6784, 1, 1280]
    - [5, 69.447]
  - - [4288, 4288, 1, 3328]
    - [41, 76.297]
  - - [3584, 64, 1, 1280]
    - [150, 15.104]
  - - [64, 1856, 1, 256]
    - [55, 2.903]
  - - [3584, 64, 1, 32]
    - [134, 0.78]
  - - [448, 1, 1, 1280]
    - [89, 0.045]
  - - [256, 4288, 1, 1280]
    - [16, 37.872]
  - - [1408, 3584, 1, 1]
    - [94, 0.184]
  - - [4288, 1856, 1, 3328]
    - [14, 72.942]
  - - [1856, 2944, 1, 1280]
    - [54, 58.283]
  - - [4288, 256, 1, 256]
    - [16, 17.688]
  - - [128, 5888, 1, 32]
    - [110, 2.283]
  - - [128, 5888, 1, 1280]
    - [31, 34.836]
  - - [1408, 128, 1, 3328]
    - [21, 21.118]
  - - [3584, 256, 1, 256]
    - [151, 14.461]
  - - [32, 6784, 1, 3328]
    - [88, 20.35]
  - - [32, 3584, 1, 256]
    - [55, 2.902]
  - - [704, 256, 1, 32]
    - [84, 0.625]
  - - [448, 128, 1, 3328]
    - [47, 10.047]
  - - [64, 2944, 1, 3328]
    - [21, 19.901]
  - - [64, 4288, 1, 3328]
    - [123, 23.333]
  - - [5056, 1024, 1, 3328]
    - [5, 72.381]
  - - [128, 256, 1, 1280]
    - [152, 3.282]
  - - [1856, 256, 1, 256]
    - [12, 9.323]
  - - [3584, 704, 1, 1]
    - [153, 0.132]
  - - [256, 704, 1, 256]
    - [154, 4.126]
  - - [448, 5056, 1, 1]
    - [136, 0.127]
  - - [5888, 5888, 1, 256]
    - [20, 44.52]
  - - [3584, 704, 1, 32]
    - [80, 5.168]
  - - [448, 6784, 1, 3328]
    - [54, 62.442]
  - - [6784, 4288, 1, 1]
    - [62, 0.248]
  - - [3584, 6784, 1, 1]
    - [98, 0.243]
  - - [1408, 2368, 1, 32]
    - [110, 5.835]
  - - [448, 5056, 1, 32]
    - [111, 4.89]
  - - [4288, 4288, 1, 1280]
    - [5, 69.871]
  - - [6784, 1408, 1, 1]
    - [94, 0.2]
  - - [1856, 5888, 1, 3328]
    - [28, 71.448]
  - - [1024, 704, 1, 1]
    - [34, 0.055]
  - - [3584, 1856, 1, 3328]
    - [14, 69.166]
  - - [5056, 5888, 1, 1]
    - [141, 0.262]
  - - [2944, 1024, 1, 256]
    - [98, 25.878]
  - - [448, 1408, 1, 3328]
    - [155, 42.924]
  - - [5056, 32, 1, 3328]
    - [104, 17.04]
  - - [2368, 4288, 1, 3328]
    - [20, 73.104]
  - - [1024, 704, 1, 32]
    - [110, 2.096]
  - - [448, 2944, 1, 256]
    - [16, 20.452]
  - - [2944, 6784, 1, 256]
    - [69, 42.512]
  - - [2368, 2368, 1, 1280]
    - [54, 58.429]
  - - [5888, 128, 1, 3328]
    - [156, 50.734]
  - - [256, 256, 1, 32]
    - [138, 0.249]
  - - [3584, 3584, 1, 32]
    - [118, 8.56]
  - - [2944, 448, 1, 1]
    - [157, 0.083]
  - - [128, 32, 1, 32]
    - [84, 0.016]
  - - [5056, 64, 1, 1280]
    - [122, 20.289]
  - - [2944, 2944, 1, 1280]
    - [5, 62.339]
  - - [1, 2368, 1, 256]
    - [158, 0.062]
  - - [1408, 5056, 1, 1]
    - [159, 0.181]
  - - [2944, 32, 1, 1280]
    - [49, 9.118]
  - - [64, 1408, 1, 3328]
    - [56, 14.884]
  - - [256, 448, 1, 1280]
    - [154, 8.892]
  - - [2368, 6784, 1, 1]
    - [111, 0.244]
  - - [6784, 4288, 1, 1280]
    - [5, 71.127]
  - - [2944, 704, 1, 256]
    - [41, 22.222]
  - - [2368, 6784, 1, 1280]
    - [5, 67.151]
  - - [704, 2944, 1, 3328]
    - [28, 56.931]
  - - [5888, 256, 1, 1]
    - [110, 0.095]
  - - [704, 704, 1, 32]
    - [110, 1.567]
  - - [256, 4288, 1, 256]
    - [16, 16.841]
  - - [5056, 6784, 1, 32]
    - [136, 11.222]
  - - [5056, 128, 1, 1]
    - [110, 0.053]
  - - [448, 5056, 1, 1280]
    - [9, 51.361]
  - - [448, 448, 1, 256]
    - [21, 4.631]
  - - [704, 448, 1, 1280]
    - [21, 20.864]
  - - [448, 64, 1, 256]
    - [92, 0.78]
  - - [1024, 704, 1, 1280]
    - [4, 33.754]
  - - [5888, 1024, 1, 1]
    - [160, 0.172]
  - - [5888, 448, 1, 32]
    - [161, 5.113]
  - - [6784, 2944, 1, 256]
    - [70, 40.567]
  - - [2368, 448, 1, 256]
    - [16, 17.485]
  - - [4288, 256, 1, 3328]
    - [33, 53.109]
  - - [4288, 2944, 1, 256]
    - [162, 39.749]
  - - [448, 5888, 1, 3328]
    - [76, 68.924]
  - - [128, 256, 1, 3328]
    - [79, 5.851]
  - - [128, 6784, 1, 32]
    - [110, 2.446]
  - - [1856, 64, 1, 32]
    - [163, 0.428]
  - - [1408, 4288, 1, 1]
    - [51, 0.17]
  - - [1408, 1856, 1, 3328]
    - [9, 69.051]
  - - [4288, 64, 1, 256]
    - [21, 5.907]
  - - [3584, 1024, 1, 3328]
    - [41, 67.554]
  - - [2944, 5888, 1, 3328]
    - [5, 76.456]
  - - [128, 6784, 1, 3328]
    - [76, 54.814]
  - - [448, 4288, 1, 3328]
    - [96, 55.026]
  - - [704, 2368, 1, 256]
    - [73, 21.856]
  - - [1, 64, 1, 3328]
    - [46, 0.012]
  - - [4288, 128, 1, 1]
    - [110, 0.045]
  - - [256, 2368, 1, 32]
    - [110, 1.806]
  - - [4288, 3584, 1, 3328]
    - [41, 74.651]
  - - [1408, 64, 1, 256]
    - [49, 2.342]
  - - [1408, 1024, 1, 1]
    - [110, 0.091]
  - - [1408, 1024, 1, 256]
    - [64, 19.897]
  - - [5056, 3584, 1, 1]
    - [111, 0.248]
  - - [448, 1024, 1, 256]
    - [108, 9.001]
  - - [6784, 6784, 1, 3328]
    - [5, 77.109]
  - - [6784, 32, 1, 32]
    - [45, 0.712]
  - - [2368, 2944, 1, 3328]
    - [28, 71.127]
  - - [448, 448, 1, 1280]
    - [21, 14.997]
  - - [5056, 3584, 1, 32]
    - [136, 10.321]
  - - [5056, 3584, 1, 1280]
    - [5, 69.464]
  - - [1856, 1856, 1, 256]
    - [121, 28.469]
  - - [32, 5888, 1, 256]
    - [55, 4.418]
  - - [256, 1408, 1, 32]
    - [84, 1.15]
  - - [2944, 1, 1, 3328]
    - [152, 0.516]
  - - [32, 704, 1, 3328]
    - [130, 4.161]
  - - [5888, 4288, 1, 1]
    - [164, 0.24]
  - - [32, 1856, 1, 3328]
    - [56, 10.215]
  - - [5056, 704, 1, 256]
    - [54, 29.586]
  - - [2368, 5056, 1, 256]
    - [162, 38.931]
  - - [1024, 5056, 1, 256]
    - [4, 31.771]
  - - [32, 1024, 1, 3328]
    - [152, 5.964]
  - - [5888, 448, 1, 256]
    - [60, 25.192]
  - - [6784, 5056, 1, 1280]
    - [5, 71.405]
  - - [4288, 6784, 1, 1280]
    - [5, 70.613]
  - - [64, 1, 1, 256]
    - [165, 0.002]
  - - [1856, 64, 1, 1280]
    - [21, 9.063]
  - - [128, 1408, 1, 1]
    - [84, 0.017]
  - - [704, 6784, 1, 3328]
    - [20, 67.652]
  - - [2944, 1856, 1, 1]
    - [157, 0.16]
  - - [5888, 4288, 1, 1280]
    - [5, 70.851]
  - - [5888, 3584, 1, 1280]
    - [5, 69.212]
  - - [32, 2368, 1, 1280]
    - [56, 7.189]
  - - [3584, 1408, 1, 1280]
    - [41, 62.199]
  - - [1024, 2944, 1, 256]
    - [105, 25.802]
  - - [1, 2944, 1, 1280]
    - [79, 0.283]
  - - [32, 1024, 1, 256]
    - [58, 0.9]
  - - [2944, 1856, 1, 1280]
    - [121, 56.487]
  - - [3584, 1, 1, 1280]
    - [49, 0.345]
  - - [1024, 2368, 1, 1]
    - [80, 0.126]
  - - [2944, 3584, 1, 1280]
    - [41, 66.884]
  - - [64, 1, 1, 1]
    - [43, 0.0]
  - - [1856, 4288, 1, 256]
    - [54, 35.922]
  - - [256, 1, 1, 256]
    - [166, 0.007]
  - - [1, 1856, 1, 3328]
    - [79, 0.335]
  - - [448, 3584, 1, 1]
    - [111, 0.109]
  - - [2368, 2944, 1, 32]
    - [136, 8.268]
  - - [128, 4288, 1, 32]
    - [110, 1.609]
  - - [448, 256, 1, 256]
    - [149, 2.711]
  - - [1, 1408, 1, 1]
    - [84, 0.0]
  - - [2944, 32, 1, 32]
    - [137, 0.33]
  - - [448, 1856, 1, 1]
    - [163, 0.064]
  - - [4288, 704, 1, 256]
    - [114, 26.069]
  - - [1856, 1024, 1, 256]
    - [16, 22.103]
  - - [448, 1856, 1, 32]
    - [110, 2.437]
  - - [448, 1856, 1, 3328]
    - [73, 54.22]
  - - [448, 448, 1, 32]
    - [84, 0.664]
  - - [6784, 1, 1, 256]
    - [49, 0.16]
  - - [704, 6784, 1, 32]
    - [136, 7.145]
  - - [1024, 4288, 1, 1]
    - [62, 0.156]
  - - [704, 256, 1, 3328]
    - [21, 20.921]
  - - [704, 1856, 1, 32]
    - [111, 3.439]
  - - [1408, 5888, 1, 1280]
    - [20, 61.123]
  - - [32, 704, 1, 1280]
    - [48, 2.272]
  - - [5056, 1856, 1, 256]
    - [54, 37.076]
  - - [6784, 704, 1, 1280]
    - [41, 59.222]
  - - [704, 1408, 1, 32]
    - [110, 2.728]
  - - [5888, 1024, 1, 256]
    - [54, 32.026]
  - - [64, 2944, 1, 1]
    - [84, 0.018]
  - - [64, 2944, 1, 32]
    - [84, 0.623]
  - - [64, 2944, 1, 1280]
    - [21, 13.793]
  - - [6784, 1856, 1, 3328]
    - [14, 74.476]
  - - [2368, 5888, 1, 1280]
    - [5, 67.429]
  - - [5888, 6784, 1, 32]
    - [94, 9.777]
  - - [1, 6784, 1, 256]
    - [88, 0.157]
  - - [6784, 6784, 1, 32]
    - [94, 9.948]
  - - [256, 1, 1, 1280]
    - [77, 0.026]
  - - [5888, 128, 1, 32]
    - [110, 2.156]
  - - [6784, 256, 1, 256]
    - [73, 22.564]
  - - [2368, 3584, 1, 3328]
    - [14, 70.558]
  - - [128, 4288, 1, 1280]
    - [40, 26.037]
  - - [32, 3584, 1, 1280]
    - [115, 9.344]
  - - [5888, 1024, 1, 1280]
    - [31, 61.492]
  - - [1856, 704, 1, 3328]
    - [60, 54.375]
  - - [5888, 6784, 1, 3328]
    - [5, 77.844]
  - - [6784, 448, 1, 1]
    - [111, 0.133]
  - - [6784, 1856, 1, 1]
    - [112, 0.213]
  - - [128, 32, 1, 1280]
    - [48, 0.41]
  - - [2944, 2368, 1, 1280]
    - [14, 61.754]
  - - [128, 256, 1, 1]
    - [144, 0.003]
  - - [6784, 448, 1, 32]
    - [110, 5.371]
  - - [6784, 448, 1, 3328]
    - [4, 61.598]
  - - [1, 6784, 1, 1]
    - [57, 0.001]
  - - [448, 3584, 1, 1280]
    - [76, 49.477]
  - - [1408, 6784, 1, 1280]
    - [28, 63.951]
  - - [5056, 5888, 1, 1280]
    - [5, 70.751]
  - - [32, 2944, 1, 32]
    - [43, 0.327]
  - - [5888, 704, 1, 1]
    - [167, 0.151]
  - - [3584, 1856, 1, 1]
    - [51, 0.173]
  - - [1, 256, 1, 256]
    - [44, 0.007]
  - - [5056, 2944, 1, 32]
    - [107, 10.031]
  - - [32, 6784, 1, 256]
    - [21, 4.537]
  - - [4288, 6784, 1, 1]
    - [111, 0.262]
  - - [1, 4288, 1, 3328]
    - [88, 0.673]
  - - [1024, 6784, 1, 1]
    - [51, 0.18]
  - - [2368, 5888, 1, 32]
    - [136, 9.895]
  - - [448, 448, 1, 3328]
    - [21, 23.227]
  - - [1, 256, 1, 1]
    - [84, 0.0]
  - - [3584, 4288, 1, 1]
    - [62, 0.219]
  - - [5888, 1024, 1, 3328]
    - [121, 70.012]
  - - [6784, 5888, 1, 256]
    - [70, 43.689]
  - - [704, 128, 1, 1280]
    - [49, 8.78]
  - - [4288, 128, 1, 256]
    - [12, 10.484]
  - - [5056, 1024, 1, 1]
    - [62, 0.182]
  - - [32, 3584, 1, 3328]
    - [55, 14.053]
  - - [4288, 2368, 1, 32]
    - [111, 9.129]
  - - [704, 3584, 1, 1]
    - [111, 0.14]
  - - [704, 1856, 1, 3328]
    - [168, 58.885]
  - - [2944, 128, 1, 1280]
    - [139, 24.369]
  - - [1, 2368, 1, 3328]
    - [79, 0.421]
  - - [6784, 704, 1, 32]
    - [169, 6.522]
  - - [4288, 1, 1, 1280]
    - [49, 0.404]
  - - [704, 5888, 1, 256]
    - [7, 29.232]
  - - [2368, 3584, 1, 1280]
    - [9, 62.958]
  - - [64, 448, 1, 256]
    - [49, 0.795]
  - - [1408, 448, 1, 1280]
    - [13, 30.022]
  - - [3584, 5056, 1, 32]
    - [140, 8.925]
  - - [128, 2368, 1, 1]
    - [84, 0.028]
  - - [6784, 1856, 1, 1280]
    - [14, 65.718]
  - - [5056, 5056, 1, 3328]
    - [5, 75.806]
  - - [128, 704, 1, 1280]
    - [47, 8.55]
  - - [128, 2944, 1, 1280]
    - [170, 24.26]
  - - [2368, 5056, 1, 1]
    - [111, 0.231]
  - - [5888, 1408, 1, 256]
    - [85, 34.062]
  - - [2368, 1024, 1, 32]
    - [111, 5.204]
  - - [256, 256, 1, 3328]
    - [49, 11.272]
  - - [64, 4288, 1, 1]
    - [84, 0.027]
  - - [4288, 1024, 1, 256]
    - [114, 30.889]
  - - [3584, 32, 1, 32]
    - [137, 0.394]
  - - [3584, 64, 1, 1]
    - [84, 0.022]
  - - [704, 32, 1, 1280]
    - [79, 2.241]
  - - [32, 4288, 1, 32]
    - [138, 0.48]
  - - [64, 1408, 1, 1]
    - [138, 0.009]
  - - [4288, 5888, 1, 1280]
    - [5, 69.459]
  - - [1856, 2944, 1, 3328]
    - [54, 65.247]
  - - [5056, 5888, 1, 256]
    - [162, 44.697]
  - - [1408, 128, 1, 1280]
    - [21, 13.825]
  - - [5056, 256, 1, 3328]
    - [33, 61.123]
  - - [1024, 5888, 1, 1280]
    - [54, 62.374]
  - - [32, 32, 1, 32]
    - [42, 0.004]
  - - [5056, 1, 1, 1280]
    - [49, 0.447]
  - - [5888, 5056, 1, 1280]
    - [5, 70.565]
  - - [5888, 2944, 1, 1]
    - [85, 0.229]
  - - [64, 4288, 1, 1280]
    - [139, 17.207]
  - - [1408, 4288, 1, 3328]
    - [28, 71.345]
  - - [704, 2944, 1, 32]
    - [111, 5.015]
  - - [1, 5888, 1, 1280]
    - [88, 0.482]
  - - [2944, 4288, 1, 3328]
    - [5, 72.698]
  - - [256, 2944, 1, 256]
    - [61, 13.846]
  - - [704, 448, 1, 32]
    - [84, 1.172]
  - - [5056, 2944, 1, 256]
    - [54, 40.311]
  - - [704, 1024, 1, 256]
    - [7, 13.244]
  - - [2368, 1856, 1, 256]
    - [16, 30.993]
  - - [64, 3584, 1, 1]
    - [138, 0.023]
  - - [2368, 4288, 1, 1280]
    - [9, 65.99]
  - - [3584, 448, 1, 256]
    - [64, 21.948]
  - - [256, 6784, 1, 256]
    - [4, 22.977]
  - - [1024, 1408, 1, 1]
    - [110, 0.094]
  - - [128, 64, 1, 32]
    - [171, 0.033]
  - - [64, 1, 1, 1280]
    - [152, 0.007]
  - - [2368, 32, 1, 32]
    - [84, 0.288]
  - - [2944, 2944, 1, 1]
    - [62, 0.196]
  - - [6784, 3584, 1, 256]
    - [70, 41.227]
  - - [1408, 1856, 1, 256]
    - [16, 25.724]
  - - [128, 1408, 1, 256]
    - [21, 4.296]
  - - [2944, 2944, 1, 32]
    - [118, 7.792]
  - - [2944, 2944, 1, 3328]
    - [97, 70.785]
  - - [1, 2944, 1, 256]
    - [158, 0.074]
  - - [448, 32, 1, 1280]
    - [90, 1.426]
  - - [3584, 1, 1, 256]
    - [47, 0.095]
  - - [704, 32, 1, 3328]
    - [89, 4.223]
  - - [256, 448, 1, 3328]
    - [21, 13.48]
  - - [2368, 64, 1, 256]
    - [149, 3.583]
  - - [64, 448, 1, 1280]
    - [89, 2.871]
  - - [6784, 1408, 1, 32]
    - [140, 7.972]
  - - [1408, 448, 1, 3328]
    - [172, 42.538]
  - - [2368, 6784, 1, 3328]
    - [121, 72.958]
  - - [256, 2368, 1, 1]
    - [137, 0.049]
  - - [4288, 3584, 1, 32]
    - [136, 10.092]
  - - [5888, 64, 1, 3328]
    - [122, 31.468]
  - - [3584, 704, 1, 1280]
    - [4, 54.635]
  - - [448, 5056, 1, 3328]
    - [54, 61.057]
  - - [4288, 448, 1, 256]
    - [61, 21.987]
  - - [5056, 256, 1, 1280]
    - [33, 44.763]
  - - [704, 448, 1, 3328]
    - [170, 31.619]
  - - [2944, 5888, 1, 32]
    - [80, 8.777]
  - - [3584, 5056, 1, 256]
    - [69, 41.513]
  - - [6784, 1, 1, 3328]
    - [49, 0.815]
  - - [32, 2368, 1, 3328]
    - [56, 12.516]
  - - [4288, 256, 1, 1]
    - [111, 0.08]
  - - [1856, 448, 1, 3328]
    - [4, 53.112]
  - - [3584, 2368, 1, 256]
    - [54, 35.019]
  - - [4288, 4288, 1, 256]
    - [20, 42.528]
  - - [4288, 256, 1, 1280]
    - [33, 39.088]
  - - [448, 5056, 1, 256]
    - [16, 24.56]
  - - [128, 1856, 1, 1]
    - [84, 0.022]
  - - [4288, 704, 1, 1280]
    - [121, 52.897]
  - - [128, 1856, 1, 32]
    - [84, 0.758]
  - - [2368, 704, 1, 1]
    - [111, 0.113]
  - - [3584, 32, 1, 256]
    - [149, 2.668]
  - - [448, 2368, 1, 1280]
    - [16, 38.152]
  - - [3584, 256, 1, 1]
    - [110, 0.068]
  - - [1408, 1856, 1, 1280]
    - [28, 57.361]
  - - [3584, 4288, 1, 3328]
    - [5, 74.661]
  - - [448, 4288, 1, 32]
    - [111, 4.617]
  - - [448, 4288, 1, 1280]
    - [16, 44.755]
  - - [64, 3584, 1, 256]
    - [21, 4.974]
  - - [1, 6784, 1, 1280]
    - [88, 0.52]
  - - [5056, 1024, 1, 256]
    - [69, 32.463]
  - - [2368, 448, 1, 32]
    - [111, 2.92]
  - - [4288, 3584, 1, 1280]
    - [5, 68.34]
  - - [32, 2944, 1, 1280]
    - [56, 8.88]
  - - [1408, 704, 1, 1]
    - [110, 0.071]
  - - [2368, 256, 1, 256]
    - [13, 11.657]
  - - [1, 5056, 1, 1]
    - [173, 0.0]
  - - [4288, 32, 1, 32]
    - [110, 0.462]
  - - [1856, 3584, 1, 32]
    - [111, 8.102]
  - - [5056, 3584, 1, 3328]
    - [41, 75.443]
  - - [4288, 5056, 1, 256]
    - [54, 43.184]
  - - [1856, 5888, 1, 256]
    - [54, 38.159]
  - - [256, 256, 1, 256]
    - [49, 1.75]
  - - [2368, 3584, 1, 1]
    - [111, 0.214]
  - - [4288, 2368, 1, 256]
    - [69, 38.084]
  - - [448, 1, 1, 3328]
    - [89, 0.087]
  - - [1856, 256, 1, 1280]
    - [11, 23.875]
  - - [256, 2944, 1, 1]
    - [110, 0.059]
  - - [1408, 2944, 1, 3328]
    - [54, 68.288]
  - - [32, 1856, 1, 32]
    - [138, 0.23]
  - - [5888, 3584, 1, 1]
    - [62, 0.236]
  - - [256, 1, 1, 1]
    - [43, 0.0]
  - - [6784, 5056, 1, 3328]
    - [5, 77.493]
  - - [6784, 5056, 1, 1]
    - [94, 0.253]
  - - [5888, 3584, 1, 32]
    - [118, 8.993]
  - - [5888, 3584, 1, 3328]
    - [41, 76.198]
  - - [32, 1024, 1, 1280]
    - [79, 3.237]
  - - [1, 256, 1, 3328]
    - [79, 0.048]
  - - [1024, 6784, 1, 256]
    - [14, 34.017]
  - - [6784, 5888, 1, 32]
    - [94, 9.83]
  - - [1408, 1, 1, 1280]
    - [48, 0.139]
  - - [2368, 6784, 1, 32]
    - [136, 10.073]
  - - [6784, 64, 1, 1]
    - [34, 0.039]
  - - [5056, 1408, 1, 1280]
    - [121, 64.976]
  - - [3584, 1408, 1, 3328]
    - [5, 70.786]
  - - [2944, 3584, 1, 1]
    - [94, 0.21]
  - - [2944, 1408, 1, 1280]
    - [121, 57.314]
  - - [1856, 64, 1, 1]
    - [174, 0.012]
  - - [3584, 1024, 1, 1]
    - [110, 0.144]
  - - [256, 32, 1, 256]
    - [166, 0.219]
  - - [2944, 1856, 1, 3328]
    - [14, 64.204]
  - - [128, 1024, 1, 3328]
    - [21, 14.803]
  - - [1408, 128, 1, 1]
    - [84, 0.018]
  - - [2944, 3584, 1, 32]
    - [118, 8.128]
  - - [5888, 256, 1, 32]
    - [110, 3.8]
  - - [6784, 64, 1, 256]
    - [21, 8.882]
  - - [6784, 5056, 1, 256]
    - [69, 43.39]
  - - [1408, 32, 1, 3328]
    - [89, 8.007]
  - - [1856, 3584, 1, 1280]
    - [28, 61.69]
  - - [5056, 32, 1, 256]
    - [104, 3.825]
  - - [1024, 4288, 1, 3328]
    - [54, 71.334]
  - - [448, 2368, 1, 256]
    - [16, 17.385]
  - - [64, 1408, 1, 1280]
    - [49, 8.781]
  - - [3584, 32, 1, 1280]
    - [21, 8.482]
  - - [128, 2368, 1, 3328]
    - [139, 28.699]
  - - [64, 5056, 1, 256]
    - [21, 7.235]
  - - [32, 1408, 1, 256]
    - [56, 1.226]
  - - [2368, 448, 1, 3328]
    - [33, 51.659]
  - - [2368, 1408, 1, 1]
    - [113, 0.157]
  - - [1, 1, 1, 1]
    - [173, 0.0]
  - - [1024, 1856, 1, 32]
    - [161, 4.256]
  - - [32, 1024, 1, 32]
    - [43, 0.133]
  - - [4288, 1, 1, 256]
    - [109, 0.109]
  - - [1856, 128, 1, 3328]
    - [122, 23.627]
  - - [5888, 2368, 1, 1]
    - [62, 0.213]
  - - [2368, 2368, 1, 1]
    - [111, 0.186]
  - - [704, 256, 1, 1280]
    - [21, 13.537]
  - - [704, 4288, 1, 256]
    - [61, 27.124]
  - - [5888, 2368, 1, 32]
    - [118, 8.593]
  - - [5888, 2368, 1, 1280]
    - [5, 66.558]
  - - [128, 256, 1, 256]
    - [56, 0.892]
  - - [2944, 5056, 1, 3328]
    - [14, 72.746]
  - - [6784, 704, 1, 3328]
    - [41, 67.22]
  - - [1856, 1856, 1, 32]
    - [111, 6.118]
  - - [4288, 2944, 1, 32]
    - [107, 9.602]
  - - [256, 5056, 1, 1]
    - [110, 0.086]
  - - [704, 64, 1, 256]
    - [49, 1.203]
  - - [256, 2368, 1, 3328]
    - [14, 40.589]
  - - [704, 1, 1, 1]
    - [138, 0.0]
  - - [128, 448, 1, 1280]
    - [49, 5.703]
  - - [5056, 5056, 1, 256]
    - [54, 43.627]
  - - [5888, 256, 1, 256]
    - [64, 21.104]
  - - [5888, 64, 1, 1]
    - [110, 0.034]
  - - [6784, 6784, 1, 256]
    - [9, 44.41]
  - - [2368, 1, 1, 256]
    - [49, 0.061]
  - - [448, 32, 1, 32]
    - [134, 0.057]
  - - [704, 64, 1, 1]
    - [84, 0.005]
  - - [3584, 704, 1, 3328]
    - [4, 66.812]
  - - [4288, 704, 1, 3328]
    - [121, 62.639]
  - - [4288, 2944, 1, 1280]
    - [5, 65.723]
  - - [448, 3584, 1, 256]
    - [76, 21.742]
  - - [704, 32, 1, 256]
    - [49, 0.596]
  - - [6784, 256, 1, 32]
    - [110, 3.963]
  - - [1856, 128, 1, 1]
    - [84, 0.022]
  - - [1856, 32, 1, 32]
    - [84, 0.228]
  - - [6784, 1408, 1, 1280]
    - [5, 63.743]
  - - [2368, 5056, 1, 1280]
    - [5, 64.401]
  - - [704, 1856, 1, 1280]
    - [16, 45.079]
  - - [1408, 1408, 1, 1280]
    - [114, 45.308]
  - - [448, 1024, 1, 3328]
    - [91, 32.032]
  - - [32, 704, 1, 32]
    - [144, 0.086]
  - - [256, 704, 1, 1]
    - [84, 0.017]
  - - [5888, 1856, 1, 32]
    - [118, 8.174]
  - - [5888, 704, 1, 3328]
    - [4, 67.592]
  - - [5056, 1, 1, 256]
    - [47, 0.127]
  - - [448, 6784, 1, 256]
    - [16, 26.644]
  - - [128, 64, 1, 256]
    - [166, 0.223]
  - - [1856, 128, 1, 256]
    - [21, 5.191]
  - - [2944, 5888, 1, 256]
    - [66, 41.525]
  - - [128, 5056, 1, 32]
    - [163, 1.882]
  - - [128, 5056, 1, 1280]
    - [108, 29.257]
  - - [448, 32, 1, 3328]
    - [48, 2.674]
  - - [1856, 1408, 1, 32]
    - [175, 5.234]
  - - [64, 704, 1, 32]
    - [138, 0.179]
  - - [64, 704, 1, 3328]
    - [58, 7.931]
  - - [64, 2368, 1, 32]
    - [163, 0.525]
  - - [5888, 64, 1, 32]
    - [84, 1.213]
  - - [2368, 256, 1, 1]
    - [143, 0.049]
  - - [5888, 64, 1, 1280]
    - [122, 22.643]
  - - [5056, 1, 1, 1]
    - [84, 0.001]
  - - [5888, 2944, 1, 1280]
    - [5, 68.17]
  - - [32, 2368, 1, 256]
    - [56, 2.062]
  - - [256, 1408, 1, 256]
    - [21, 7.534]
  - - [448, 5888, 1, 1]
    - [111, 0.143]
  - - [3584, 1408, 1, 1]
    - [94, 0.182]
  - - [32, 6784, 1, 1280]
    - [88, 13.436]
  - - [32, 6784, 1, 32]
    - [42, 0.725]
  - - [448, 5888, 1, 32]
    - [111, 5.343]
  - - [5056, 704, 1, 1280]
    - [4, 58.664]
  - - [1856, 6784, 1, 1]
    - [176, 0.231]
  - - [5056, 64, 1, 1]
    - [84, 0.03]
  - - [1, 5888, 1, 1]
    - [173, 0.001]
  - - [2368, 1024, 1, 256]
    - [177, 25.712]
  - - [1856, 6784, 1, 32]
    - [136, 9.597]
  - - [1856, 6784, 1, 1280]
    - [9, 67.251]
  - - [64, 3584, 1, 3328]
    - [178, 20.477]
  - - [5888, 5056, 1, 3328]
    - [5, 75.982]
  - - [1, 2944, 1, 3328]
    - [79, 0.518]
  - - [1408, 6784, 1, 32]
    - [110, 8.046]
  - - [32, 5888, 1, 1280]
    - [55, 12.817]
  - - [448, 256, 1, 1]
    - [84, 0.011]
  - - [3584, 5888, 1, 3328]
    - [5, 76.612]
  - - [4288, 1408, 1, 256]
    - [54, 33.747]
  - - [448, 64, 1, 1280]
    - [89, 2.891]
  - - [128, 448, 1, 32]
    - [84, 0.225]
  - - [6784, 2368, 1, 256]
    - [20, 39.467]
  - - [1408, 448, 1, 32]
    - [110, 1.864]
  - - [1856, 1408, 1, 1280]
    - [54, 57.624]
  - - [448, 256, 1, 3328]
    - [21, 13.917]
  - - [1856, 2368, 1, 1]
    - [111, 0.172]
  - - [1408, 5056, 1, 3328]
    - [28, 73.532]
  - - [128, 704, 1, 3328]
    - [49, 14.819]
  - - [5056, 128, 1, 1280]
    - [156, 30.302]
  - - [5056, 4288, 1, 256]
    - [54, 42.654]
  - - [5056, 5056, 1, 32]
    - [136, 10.855]
  - - [1856, 704, 1, 256]
    - [16, 20.153]
  - - [448, 5888, 1, 1280]
    - [76, 56.608]
  - - [128, 6784, 1, 256]
    - [16, 14.997]
  - - [5056, 448, 1, 256]
    - [162, 24.196]
  - - [4288, 5888, 1, 1]
    - [111, 0.257]
  - - [1856, 5056, 1, 1280]
    - [54, 64.167]
  - - [2368, 4288, 1, 1]
    - [111, 0.222]
  - - [2368, 32, 1, 3328]
    - [49, 12.684]
  - - [3584, 1856, 1, 256]
    - [54, 32.74]
  - - [64, 704, 1, 1]
    - [138, 0.005]
  - - [4288, 5888, 1, 32]
    - [136, 10.811]
  - - [4288, 5888, 1, 3328]
    - [5, 74.429]
  - - [1, 1024, 1, 1]
    - [84, 0.0]
  - - [1024, 2944, 1, 3328]
    - [54, 61.667]
  - - [2944, 2368, 1, 256]
    - [54, 34.138]
  - - [1024, 1856, 1, 256]
    - [61, 21.667]
  - - [2944, 64, 1, 3328]
    - [150, 20.185]
  - - [1024, 5888, 1, 32]
    - [140, 7.127]
  - - [1024, 5888, 1, 3328]
    - [54, 70.913]
  - - [5056, 2368, 1, 32]
    - [111, 9.635]
  - - [1408, 2368, 1, 1280]
    - [54, 57.377]
  - - [256, 1, 1, 3328]
    - [89, 0.049]
  - - [128, 1024, 1, 32]
    - [163, 0.463]
  - - [5056, 6784, 1, 3328]
    - [5, 77.517]
  - - [448, 704, 1, 1]
    - [84, 0.029]
  - - [32, 64, 1, 32]
    - [134, 0.008]
  - - [448, 704, 1, 32]
    - [84, 1.043]
  - - [448, 704, 1, 3328]
    - [133, 31.368]
  - - [1408, 2944, 1, 256]
    - [54, 29.089]
  - - [64, 5888, 1, 1]
    - [84, 0.035]
  - - [2368, 128, 1, 32]
    - [138, 0.993]
  - - [2368, 256, 1, 1280]
    - [12, 29.238]
  - - [2368, 128, 1, 3328]
    - [133, 29.751]
  - - [704, 5056, 1, 32]
    - [111, 6.291]
  - - [32, 2368, 1, 32]
    - [138, 0.285]
  - - [1408, 1, 1, 256]
    - [109, 0.037]
  - - [4288, 256, 1, 32]
    - [111, 3.092]
  - - [448, 1408, 1, 1]
    - [163, 0.051]
  - - [5056, 4288, 1, 1280]
    - [5, 69.556]
  - - [1408, 256, 1, 256]
    - [21, 8.059]
  - - [4288, 448, 1, 1]
    - [111, 0.116]
  - - [256, 4288, 1, 32]
    - [110, 2.868]
  - - [1408, 256, 1, 1280]
    - [170, 23.415]
  - - [256, 256, 1, 1]
    - [84, 0.007]
  - - [1408, 1, 1, 1]
    - [138, 0.0]
  - - [448, 1408, 1, 256]
    - [16, 11.814]
  - - [5888, 5888, 1, 1]
    - [94, 0.255]
  - - [128, 2944, 1, 32]
    - [110, 1.161]
  - - [32, 256, 1, 32]
    - [42, 0.032]
  - - [2944, 704, 1, 1280]
    - [4, 46.775]
  - - [1856, 448, 1, 1]
    - [163, 0.065]
  - - [2368, 2944, 1, 1]
    - [111, 0.202]
  - - [5056, 256, 1, 32]
    - [110, 3.333]
  - - [4288, 1, 1, 3328]
    - [49, 0.676]
  - - [5056, 1024, 1, 1280]
    - [41, 63.49]
  - - [704, 704, 1, 1]
    - [36, 0.041]
  - - [1856, 448, 1, 1280]
    - [54, 36.558]
  - - [3584, 6784, 1, 256]
    - [69, 43.857]
  - - [64, 1856, 1, 1280]
    - [55, 9.161]
  - - [1856, 1408, 1, 256]
    - [16, 26.633]
  - - [4288, 4288, 1, 32]
    - [107, 10.294]
  - - [128, 1, 1, 256]
    - [92, 0.004]
  - - [32, 64, 1, 3328]
    - [48, 0.388]
  - - [5888, 448, 1, 1]
    - [80, 0.135]
  - - [128, 5888, 1, 256]
    - [60, 12.939]
  - - [3584, 256, 1, 3328]
    - [33, 43.327]
  - - [5056, 5056, 1, 1280]
    - [5, 70.233]
  - - [6784, 1408, 1, 3328]
    - [14, 71.487]
  - - [448, 2368, 1, 1]
    - [111, 0.081]
  - - [2368, 1, 1, 1280]
    - [58, 0.237]
  - - [32, 3584, 1, 32]
    - [174, 0.394]
  - - [128, 6784, 1, 1]
    - [143, 0.07]
  - - [1, 3584, 1, 1]
    - [173, 0.0]
  - - [5888, 5888, 1, 3328]
    - [5, 77.343]
  - - [256, 2944, 1, 3328]
    - [59, 50.372]
  - - [1, 128, 1, 3328]
    - [46, 0.024]
  - - [32, 256, 1, 256]
    - [48, 0.26]
  - - [5888, 1408, 1, 32]
    - [118, 7.763]
  - - [704, 256, 1, 1]
    - [174, 0.018]
  - - [1, 448, 1, 1]
    - [84, 0.0]
  - - [256, 6784, 1, 3328]
    - [93, 64.601]
  - - [64, 5888, 1, 256]
    - [21, 8.172]
  - - [1856, 1, 1, 1]
    - [84, 0.0]
  - - [704, 704, 1, 256]
    - [38, 9.791]
  - - [448, 1024, 1, 32]
    - [110, 1.464]
  - - [6784, 2368, 1, 1280]
    - [5, 66.305]
  - - [128, 1856, 1, 1280]
    - [21, 15.935]
  - - [256, 2368, 1, 256]
    - [12, 11.814]
  - - [2944, 1408, 1, 1]
    - [94, 0.156]
  - - [6784, 1024, 1, 256]
    - [179, 33.845]
  - - [5056, 1408, 1, 32]
    - [111, 8.415]
  - - [1408, 6784, 1, 3328]
    - [54, 72.033]
  - - [2944, 1408, 1, 3328]
    - [4, 67.312]
  - - [1856, 32, 1, 256]
    - [90, 1.572]
  - - [704, 2368, 1, 32]
    - [111, 4.355]
  - - [448, 256, 1, 32]
    - [137, 0.398]
  - - [704, 6784, 1, 1]
    - [111, 0.183]
  - - [2368, 6784, 1, 256]
    - [177, 41.149]
  - - [1856, 3584, 1, 3328]
    - [54, 69.552]
  - - [1, 704, 1, 3328]
    - [48, 0.133]
  - - [64, 1, 1, 3328]
    - [92, 0.012]
  - - [448, 704, 1, 1280]
    - [21, 21.057]
  - - [704, 1856, 1, 1]
    - [111, 0.094]
  - - [704, 448, 1, 256]
    - [21, 6.944]
  - - [448, 64, 1, 3328]
    - [79, 5.349]
  - - [704, 6784, 1, 256]
    - [16, 31.378]
  - - [256, 32, 1, 1280]
    - [152, 0.826]
  - - [2368, 448, 1, 1280]
    - [16, 37.59]
  - - [6784, 2944, 1, 32]
    - [118, 8.868]
  - - [64, 4288, 1, 32]
    - [84, 0.899]
  - - [128, 704, 1, 1]
    - [36, 0.009]
  - - [128, 448, 1, 3328]
    - [58, 9.863]
  - - [5888, 2368, 1, 3328]
    - [41, 73.466]
  - - [2368, 704, 1, 1280]
    - [101, 51.042]
  - - [1024, 1408, 1, 1280]
    - [4, 45.698]
  - - [4288, 64, 1, 1280]
    - [150, 17.512]
  - - [128, 5056, 1, 1]
    - [110, 0.053]
  - - [2944, 5056, 1, 32]
    - [180, 8.698]
  - - [448, 448, 1, 1]
    - [138, 0.02]
  - - [256, 2368, 1, 1280]
    - [40, 28.948]
  - - [704, 2368, 1, 3328]
    - [76, 63.588]
  - - [3584, 2944, 1, 256]
    - [54, 37.525]
  - - [64, 6784, 1, 256]
    - [21, 9.009]
  - - [3584, 1024, 1, 1280]
    - [41, 57.094]
  - - [1408, 32, 1, 32]
    - [84, 0.177]
  - - [128, 3584, 1, 256]
    - [38, 9.001]
  - - [704, 1408, 1, 1]
    - [110, 0.073]
  - - [5056, 3584, 1, 256]
    - [69, 42.183]
  - - [2368, 704, 1, 256]
    - [28, 22.364]
  - - [1856, 1856, 1, 1280]
    - [28, 59.494]
  - - [32, 5888, 1, 32]
    - [138, 0.641]
  - - [64, 32, 1, 32]
    - [42, 0.008]
  - - [4288, 704, 1, 1]
    - [111, 0.153]
  - - [1856, 1024, 1, 1]
    - [111, 0.113]
  - - [4288, 2944, 1, 3328]
    - [5, 72.765]
  - - [4288, 128, 1, 3328]
    - [91, 38.181]
  - - [4288, 704, 1, 32]
    - [111, 5.883]
  - - [1856, 1024, 1, 32]
    - [111, 4.792]
  - - [1, 448, 1, 3328]
    - [46, 0.083]
  - - [2944, 6784, 1, 1]
    - [98, 0.236]
  - - [6784, 2368, 1, 32]
    - [118, 8.789]
  - - [5888, 5056, 1, 1]
    - [181, 0.247]
  - - [128, 6784, 1, 1280]
    - [156, 39.133]
  - - [704, 5888, 1, 1]
    - [111, 0.168]
  - - [6784, 6784, 1, 1]
    - [98, 0.263]
  - - [1856, 32, 1, 1280]
    - [49, 5.748]
  - - [5888, 448, 1, 3328]
    - [4, 68.4]
  - - [704, 5888, 1, 32]
    - [136, 6.672]
  - - [704, 5888, 1, 1280]
    - [76, 58.491]
  - - [1024, 6784, 1, 3328]
    - [28, 71.934]
  - - [704, 2944, 1, 1280]
    - [16, 47.823]
  - - [4288, 6784, 1, 256]
    - [177, 45.157]
  - - [3584, 256, 1, 32]
    - [110, 2.506]
  - - [1408, 1408, 1, 32]
    - [110, 4.229]
  - - [1408, 1408, 1, 3328]
    - [182, 60.384]
  - - [4288, 64, 1, 32]
    - [138, 0.899]
  - - [1408, 256, 1, 32]
    - [84, 1.15]
  - - [5888, 128, 1, 256]
    - [183, 13.174]
  - - [64, 704, 1, 1280]
    - [47, 4.512]
  - - [2944, 1856, 1, 256]
    - [54, 31.456]
  - - [128, 5056, 1, 3328]
    - [73, 43.177]
  - - [4288, 2944, 1, 1]
    - [111, 0.234]
  - - [6784, 5056, 1, 32]
    - [148, 9.461]
  - - [3584, 128, 1, 1]
    - [84, 0.039]
  - - [2944, 4288, 1, 1280]
    - [5, 65.841]
  - - [64, 32, 1, 3328]
    - [52, 0.382]
  - - [1024, 4288, 1, 256]
    - [54, 30.444]
  - - [128, 2368, 1, 256]
    - [21, 6.335]
  - - [2368, 64, 1, 32]
    - [110, 0.515]
  - - [1408, 1, 1, 3328]
    - [89, 0.264]
  - - [64, 1408, 1, 32]
    - [138, 0.315]
  - - [2368, 5888, 1, 1]
    - [111, 0.237]
  - - [1408, 1856, 1, 32]
    - [161, 5.012]
  - - [448, 1856, 1, 256]
    - [16, 15.178]
  - - [1856, 6784, 1, 3328]
    - [76, 74.044]
  - - [3584, 128, 1, 256]
    - [108, 8.88]
  - - [1024, 2368, 1, 32]
    - [80, 5.024]
  - - [32, 2944, 1, 256]
    - [92, 2.426]
  - - [128, 5888, 1, 1]
    - [110, 0.061]
  - - [64, 5056, 1, 1]
    - [138, 0.03]
  - - [1856, 256, 1, 32]
    - [110, 1.49]
  - - [2368, 2368, 1, 3328]
    - [14, 66.138]
  - - [64, 448, 1, 1]
    - [138, 0.003]
  - - [3584, 5888, 1, 32]
    - [140, 9.025]
  - - [3584, 5888, 1, 1280]
    - [5, 69.592]
  - - [64, 5056, 1, 32]
    - [84, 1.09]
  - - [2944, 64, 1, 1]
    - [138, 0.019]
  - - [6784, 704, 1, 256]
    - [184, 30.476]
  - - [3584, 1024, 1, 32]
    - [110, 6.126]
  - - [1408, 704, 1, 32]
    - [110, 2.836]
  - - [1408, 704, 1, 1280]
    - [185, 34.95]
  - - [2368, 5888, 1, 256]
    - [162, 40.621]
  - - [2944, 64, 1, 32]
    - [84, 0.653]
  - - [1, 1408, 1, 256]
    - [186, 0.037]
  - - [64, 2944, 1, 256]
    - [154, 4.348]
  - - [5888, 5888, 1, 32]
    - [141, 9.615]
  - - [1856, 1408, 1, 3328]
    - [28, 68.809]
  - - [4288, 1024, 1, 1]
    - [107, 0.168]
  - - [704, 4288, 1, 3328]
    - [28, 62.157]
  - - [2944, 5056, 1, 1280]
    - [5, 65.967]
  - - [6784, 2944, 1, 1280]
    - [5, 68.822]
  - - [6784, 256, 1, 3328]
    - [97, 64.219]
  - - [5056, 128, 1, 3328]
    - [73, 44.361]
  - - [128, 4288, 1, 1]
    - [110, 0.046]
  - - [1408, 5056, 1, 32]
    - [110, 7.461]
  - - [2944, 128, 1, 3328]
    - [170, 35.861]
  - - [5888, 1856, 1, 1280]
    - [5, 63.445]
  - - [5888, 256, 1, 1280]
    - [4, 45.571]
  - - [1856, 5056, 1, 1]
    - [111, 0.223]
  - - [3584, 1856, 1, 1280]
    - [14, 60.068]
  - - [6784, 448, 1, 256]
    - [54, 25.262]
  - - [704, 3584, 1, 256]
    - [60, 25.624]
  - - [1856, 5056, 1, 32]
    - [107, 8.927]
  - - [1856, 5056, 1, 3328]
    - [54, 71.719]
  - - [1024, 2944, 1, 32]
    - [157, 5.302]
  - - [1408, 6784, 1, 256]
    - [4, 36.49]
  - - [1024, 2368, 1, 1280]
    - [28, 53.634]
  - - [1856, 3584, 1, 1]
    - [187, 0.2]
  - - [5888, 128, 1, 1280]
    - [4, 35.519]
  - - [2944, 5888, 1, 1280]
    - [5, 69.056]
  - - [1, 1856, 1, 1]
    - [173, 0.0]
  - - [3584, 3584, 1, 256]
    - [66, 39.204]
  - - [1856, 2368, 1, 3328]
    - [9, 62.994]
  - - [5888, 704, 1, 256]
    - [101, 28.533]
  - - [64, 448, 1, 32]
    - [84, 0.115]
  - - [6784, 4288, 1, 256]
    - [69, 42.742]
  - - [128, 64, 1, 3328]
    - [48, 1.528]
  - - [1, 5056, 1, 1280]
    - [88, 0.434]
  - - [32, 64, 1, 1280]
    - [89, 0.208]
  - - [1408, 2368, 1, 3328]
    - [54, 67.832]
  - - [2944, 128, 1, 256]
    - [21, 8.051]
  - - [6784, 128, 1, 1]
    - [163, 0.066]
  - - [1408, 256, 1, 3328]
    - [122, 34.654]
  - - [448, 32, 1, 256]
    - [81, 0.39]
  - - [1, 5888, 1, 256]
    - [158, 0.142]
  - - [64, 2368, 1, 256]
    - [21, 3.525]
  - - [2944, 256, 1, 256]
    - [16, 13.418]
  - - [1, 128, 1, 256]
    - [48, 0.003]
  - - [32, 256, 1, 1280]
    - [48, 0.923]
  - - [5888, 1, 1, 256]
    - [58, 0.143]
  - - [32, 128, 1, 3328]
    - [89, 0.78]
  - - [6784, 128, 1, 256]
    - [7, 14.819]
  - - [6784, 64, 1, 1280]
    - [123, 24.363]
  - - [4288, 1024, 1, 32]
    - [136, 6.68]
  - - [1408, 64, 1, 3328]
    - [47, 14.884]
  - - [2944, 448, 1, 1280]
    - [16, 44.233]
  - - [6784, 32, 1, 1280]
    - [58, 13.21]
  - - [2944, 64, 1, 1280]
    - [21, 14.006]
  - - [704, 448, 1, 1]
    - [84, 0.028]
  - - [32, 128, 1, 32]
    - [134, 0.016]
  - - [1, 128, 1, 1]
    - [135, 0.0]
  - - [5888, 1, 1, 1]
    - [84, 0.001]
  - - [5888, 1856, 1, 3328]
    - [41, 70.38]
  - - [2368, 3584, 1, 256]
    - [54, 36.318]
  - - [4288, 1408, 1, 3328]
    - [121, 70.787]
  - - [1856, 32, 1, 3328]
    - [47, 10.215]
  - - [2944, 32, 1, 256]
    - [90, 2.303]
  - - [128, 64, 1, 1]
    - [84, 0.001]
  - - [32, 448, 1, 256]
    - [186, 0.405]
  - - [1856, 64, 1, 3328]
    - [21, 13.918]
  - - [256, 5056, 1, 256]
    - [61, 18.76]
  - - [5888, 2944, 1, 3328]
    - [5, 76.214]
  - - [2368, 1408, 1, 3328]
    - [121, 67.248]
  - - [5888, 704, 1, 32]
    - [110, 6.253]
  - - [2944, 704, 1, 1]
    - [80, 0.111]
  - - [6784, 1856, 1, 256]
    - [20, 38.227]
  - - [1, 704, 1, 256]
    - [47, 0.018]
  - - [1856, 1856, 1, 1]
    - [142, 0.155]
  - - [5888, 32, 1, 256]
    - [149, 4.313]
  - - [128, 704, 1, 256]
    - [56, 2.363]
  - - [256, 1408, 1, 3328]
    - [133, 34.565]
  - - [2944, 128, 1, 1]
    - [84, 0.034]
  - - [32, 256, 1, 3328]
    - [89, 1.583]
  - - [2944, 704, 1, 3328]
    - [4, 56.109]
  - - [704, 1024, 1, 32]
    - [110, 2.113]
  - - [2368, 1856, 1, 32]
    - [111, 6.772]
  - - [5056, 4288, 1, 3328]
    - [41, 74.77]
  - - [3584, 448, 1, 3328]
    - [14, 60.811]
  - - [256, 32, 1, 32]
    - [42, 0.034]
  - - [256, 6784, 1, 1]
    - [110, 0.105]
  - - [256, 6784, 1, 32]
    - [110, 4.119]
  - - [2944, 1408, 1, 32]
    - [110, 6.387]
  - - [4288, 3584, 1, 1]
    - [111, 0.239]
  - - [1, 704, 1, 1]
    - [84, 0.0]
  - - [5056, 448, 1, 3328]
    - [121, 61.233]
  - - [3584, 64, 1, 256]
    - [21, 5.089]
  - - [64, 1856, 1, 32]
    - [143, 0.416]
  - - [64, 1856, 1, 3328]
    - [21, 13.497]
  - - [6784, 3584, 1, 32]
    - [85, 9.122]
  - - [4288, 1856, 1, 256]
    - [54, 36.435]
  - - [1856, 2944, 1, 256]
    - [60, 32.697]
  - - [128, 448, 1, 1]
    - [138, 0.006]
  - - [704, 1, 1, 1280]
    - [52, 0.071]
  - - [2944, 5888, 1, 1]
    - [94, 0.228]
  - - [1024, 1856, 1, 3328]
    - [182, 57.376]
  - - [5888, 1024, 1, 32]
    - [180, 7.104]
  - - [3584, 256, 1, 1280]
    - [16, 32.59]
  - - [1408, 5056, 1, 1280]
    - [28, 64.204]
  - - [3584, 128, 1, 1280]
    - [12, 23.295]
  - - [5056, 6784, 1, 256]
    - [177, 45.569]
  - - [256, 1856, 1, 256]
    - [12, 9.387]
  - - [5888, 32, 1, 1280]
    - [104, 12.878]
  - - [32, 1856, 1, 1280]
    - [56, 5.826]
  - - [2944, 5056, 1, 1]
    - [181, 0.215]
  - - [448, 128, 1, 1]
    - [84, 0.006]
  - - [256, 704, 1, 32]
    - [163, 0.613]
  - - [256, 704, 1, 1280]
    - [21, 13.608]
  - - [1, 2368, 1, 1]
    - [173, 0.0]
  - - [5888, 5888, 1, 1280]
    - [5, 71.444]
  - - [256, 2944, 1, 1280]
    - [59, 35.288]
  - - [2944, 256, 1, 3328]
    - [91, 50.734]
  - - [5056, 2944, 1, 1280]
    - [31, 66.375]
  - - [704, 1024, 1, 3328]
    - [91, 48.182]
  - - [2368, 1856, 1, 1280]
    - [20, 55.793]
  - - [448, 2944, 1, 1]
    - [111, 0.096]
  - - [6784, 2944, 1, 1]
    - [94, 0.235]
  - - [2944, 1024, 1, 32]
    - [110, 5.434]
  - - [2944, 1024, 1, 1280]
    - [31, 51.756]
  - - [1408, 64, 1, 32]
    - [84, 0.319]
  - - [5056, 5056, 1, 1]
    - [111, 0.259]
  - - [2368, 4288, 1, 256]
    - [177, 38.283]
  - - [448, 1856, 1, 1280]
    - [16, 37.708]
  - - [2368, 448, 1, 1]
    - [111, 0.08]
  - - [448, 2944, 1, 32]
    - [111, 3.496]
  - - [448, 2944, 1, 1280]
    - [60, 44.965]
  - - [2944, 6784, 1, 1280]
    - [5, 69.621]
  - - [256, 6784, 1, 1280]
    - [54, 52.396]
  - - [128, 2368, 1, 1280]
    - [21, 19.341]
  - - [3584, 2368, 1, 32]
    - [118, 7.806]
  - - [704, 32, 1, 32]
    - [84, 0.088]
  - - [6784, 3584, 1, 3328]
    - [14, 74.854]
  - - [128, 32, 1, 256]
    - [49, 0.11]
  - - [128, 1408, 1, 1280]
    - [21, 13.329]
  - - [64, 32, 1, 1280]
    - [46, 0.205]
  - - [128, 1856, 1, 3328]
    - [170, 23.017]
  - - [2944, 2944, 1, 256]
    - [101, 35.61]
  - - [1408, 1024, 1, 3328]
    - [54, 56.667]
  - - [5056, 2368, 1, 1280]
    - [74, 64.067]
  - - [448, 128, 1, 32]
    - [84, 0.225]
  - - [2368, 64, 1, 3328]
    - [21, 17.378]
  - - [32, 5056, 1, 3328]
    - [55, 17.185]
  - - [448, 2944, 1, 3328]
    - [61, 55.942]
  - - [2944, 1024, 1, 1]
    - [188, 0.134]
  - - [2368, 128, 1, 1280]
    - [170, 19.602]
  - - [3584, 704, 1, 256]
    - [7, 25.008]
  - - [2368, 5888, 1, 3328]
    - [65, 74.302]
  - - [4288, 2368, 1, 1]
    - [111, 0.221]
  - - [1408, 3584, 1, 32]
    - [110, 6.84]
  - - [2944, 4288, 1, 32]
    - [118, 8.555]
  - - [5888, 1408, 1, 1280]
    - [41, 62.236]
  - - [3584, 5056, 1, 1280]
    - [5, 68.769]
  - - [5888, 6784, 1, 1280]
    - [5, 72.041]
  - - [64, 1856, 1, 1]
    - [138, 0.012]
  - - [704, 128, 1, 32]
    - [163, 0.319]
  - - [3584, 2944, 1, 1]
    - [98, 0.212]
  - - [128, 3584, 1, 3328]
    - [91, 31.274]
  - - [256, 4288, 1, 3328]
    - [9, 51.003]
  - - [4288, 64, 1, 1]
    - [84, 0.026]
  - - [1, 1408, 1, 1280]
    - [46, 0.143]
  - - [5056, 32, 1, 1280]
    - [149, 11.844]
  - - [1856, 704, 1, 32]
    - [111, 3.438]
  - - [1024, 1856, 1, 1]
    - [111, 0.104]
  - - [704, 5056, 1, 3328]
    - [76, 71.332]
  - - [5888, 256, 1, 3328]
    - [4, 56.744]
  - - [1856, 1408, 1, 1]
    - [111, 0.138]
  - - [2944, 448, 1, 32]
    - [110, 3.257]
  - - [128, 448, 1, 256]
    - [56, 1.606]
  - - [128, 1024, 1, 1]
    - [84, 0.013]
  - - [32, 32, 1, 256]
    - [89, 0.027]
  - - [4288, 5056, 1, 1280]
    - [5, 69.217]
  - - [1856, 1856, 1, 3328]
    - [28, 69.441]
  - - [1024, 2368, 1, 256]
    - [61, 24.2]
  - - [4288, 2368, 1, 3328]
    - [41, 73.343]
  - - [1, 1024, 1, 1280]
    - [48, 0.105]
  - - [5056, 128, 1, 32]
    - [110, 1.944]
  - - [5888, 3584, 1, 256]
    - [69, 41.575]
  - - [1024, 5056, 1, 32]
    - [110, 6.837]
  - - [5888, 448, 1, 1280]
    - [4, 56.19]
  - - [704, 5888, 1, 3328]
    - [76, 68.168]
  - - [1024, 1408, 1, 256]
    - [64, 20.187]
  - - [3584, 2944, 1, 1280]
    - [5, 66.592]
  - - [1, 5056, 1, 256]
    - [88, 0.125]
  - - [32, 32, 1, 3328]
    - [48, 0.195]
  - - [2368, 1, 1, 3328]
    - [152, 0.421]
  - - [4288, 1856, 1, 1280]
    - [14, 63.34]
  - - [3584, 5888, 1, 1]
    - [98, 0.238]
  - - [5888, 4288, 1, 256]
    - [69, 42.61]
  - - [1024, 2944, 1, 1280]
    - [54, 52.697]
  - - [6784, 1, 1, 1]
    - [134, 0.001]
  - - [1408, 64, 1, 1280]
    - [49, 8.663]
  - - [1, 256, 1, 1280]
    - [90, 0.025]
  - - [2944, 3584, 1, 256]
    - [54, 37.851]
  - - [1, 128, 1, 1280]
    - [79, 0.013]
  - - [5888, 1, 1, 1280]
    - [49, 0.491]
  - - [2368, 32, 1, 1280]
    - [47, 7.434]
  - - [5888, 1856, 1, 1]
    - [80, 0.198]
  - - [6784, 128, 1, 1280]
    - [82, 39.882]
  - - [6784, 2368, 1, 3328]
    - [14, 74.36]
  - - [1, 64, 1, 256]
    - [44, 0.002]
  - - [704, 128, 1, 1]
    - [84, 0.009]
  - - [1408, 4288, 1, 32]
    - [110, 7.208]
  - - [256, 448, 1, 256]
    - [55, 2.757]
  - - [1856, 1024, 1, 1280]
    - [16, 44.712]
  - - [5888, 1856, 1, 256]
    - [101, 36.565]
  - - [5056, 1856, 1, 1]
    - [111, 0.22]
  - - [5888, 2368, 1, 256]
    - [41, 38.01]
  - - [1408, 1024, 1, 32]
    - [110, 3.536]
  - - [32, 704, 1, 256]
    - [166, 0.619]
  - - [2944, 1, 1, 256]
    - [89, 0.074]
  - - [32, 4288, 1, 256]
    - [154, 3.298]
  - - [5056, 1856, 1, 32]
    - [136, 8.998]
  - - [5056, 1856, 1, 1280]
    - [121, 64.596]
  - - [1, 64, 1, 1]
    - [171, 0.0]
  - - [1408, 5888, 1, 3328]
    - [9, 69.016]
  - - [1408, 704, 1, 3328]
    - [20, 46.342]
  - - [5056, 704, 1, 3328]
    - [4, 70.727]
  - - [704, 64, 1, 1280]
    - [48, 4.42]
  - - [1, 704, 1, 1280]
    - [90, 0.07]
  - - [5888, 6784, 1, 1]
    - [94, 0.262]
  - - [5888, 4288, 1, 32]
    - [118, 9.148]
  - - [1408, 3584, 1, 256]
    - [98, 31.099]
  - - [1856, 704, 1, 1]
    - [136, 0.094]
  - - [6784, 256, 1, 1]
    - [189, 0.106]
  - - [2944, 1, 1, 1]
    - [36, 0.0]
  - - [256, 1856, 1, 3328]
    - [190, 32.689]
  - - [4288, 128, 1, 1280]
    - [12, 26.561]
  - - [6784, 256, 1, 1280]
    - [121, 50.905]
  - - [128, 4288, 1, 256]
    - [108, 10.484]
  - - [128, 1408, 1, 32]
    - [84, 0.607]
  - - [6784, 128, 1, 32]
    - [110, 2.505]
  - - [1408, 448, 1, 1]
    - [137, 0.05]
  - - [2368, 704, 1, 3328]
    - [4, 63.266]
  - - [704, 128, 1, 3328]
    - [47, 15.084]
  - - [2944, 1856, 1, 32]
    - [110, 6.912]
  - - [1408, 32, 1, 1280]
    - [79, 4.42]
  - - [704, 1, 1, 256]
    - [191, 0.019]
  - - [2368, 1408, 1, 256]
    - [73, 28.62]
  - - [2368, 1856, 1, 1]
    - [111, 0.173]
  - - [4288, 1408, 1, 1]
    - [111, 0.195]
  - - [3584, 2368, 1, 1280]
    - [5, 63.251]
  - - [64, 5056, 1, 1280]
    - [122, 20.028]
  - - [1408, 2944, 1, 1]
    - [192, 0.153]
  - - [4288, 1408, 1, 32]
    - [111, 7.887]
  - - [5888, 2944, 1, 256]
    - [69, 40.352]
  - - [128, 64, 1, 1280]
    - [89, 0.85]
  - - [1408, 2944, 1, 32]
    - [110, 6.332]
  - - [1, 3584, 1, 1280]
    - [88, 0.338]
  - - [448, 1408, 1, 32]
    - [110, 1.977]
  - - [128, 5056, 1, 256]
    - [40, 12.2]
  - - [1, 1, 1, 1280]
    - [88, 0.0]
  - - [64, 704, 1, 256]
    - [47, 1.313]
  - - [5888, 6784, 1, 256]
    - [69, 44.534]
  - - [6784, 5888, 1, 1]
    - [94, 0.261]
  - - [64, 4288, 1, 256]
    - [21, 5.863]
  - - [1, 448, 1, 1280]
    - [79, 0.045]
  - - [6784, 5888, 1, 1280]
    - [5, 71.425]
  - - [1024, 4288, 1, 32]
    - [110, 6.409]
  - - [1856, 1, 1, 1280]
    - [89, 0.183]
  - - [3584, 5888, 1, 256]
    - [66, 41.976]
  - - [5056, 2368, 1, 1]
    - [111, 0.232]
  - - [256, 1408, 1, 1280]
    - [21, 23.414]
  - - [64, 5888, 1, 3328]
    - [122, 31.329]
  - - [6784, 64, 1, 3328]
    - [139, 34.058]
  - - [5056, 448, 1, 1]
    - [111, 0.128]
  - - [2944, 448, 1, 3328]
    - [50, 54.403]
  - - [2368, 1024, 1, 1280]
    - [41, 54.469]
  - - [1856, 6784, 1, 256]
    - [177, 40.486]
  - - [4288, 32, 1, 1280]
    - [55, 10.253]
  - - [448, 1408, 1, 1280]
    - [156, 29.923]
  - - [5056, 448, 1, 32]
    - [111, 4.89]
  - - [3584, 2944, 1, 32]
    - [140, 8.128]
  - - [2368, 128, 1, 1]
    - [174, 0.028]
  - - [32, 128, 1, 1280]
    - [89, 0.431]
  - - [3584, 1856, 1, 32]
    - [118, 7.245]
  - - [5056, 64, 1, 256]
    - [21, 7.07]
  - - [64, 448, 1, 3328]
    - [89, 5.349]
  - - [4288, 1408, 1, 1280]
    - [121, 62.684]
  - - [6784, 2368, 1, 1]
    - [62, 0.222]
  - - [32, 5056, 1, 256]
    - [55, 3.857]
  - - [704, 128, 1, 256]
    - [49, 2.363]
  - - [704, 5056, 1, 1]
    - [142, 0.156]
  - - [2368, 128, 1, 256]
    - [21, 6.524]
  - - [32, 64, 1, 256]
    - [166, 0.056]
  - - [2368, 1408, 1, 1280]
    - [121, 57.377]
  - - [128, 256, 1, 32]
    - [36, 0.131]
  - - [64, 6784, 1, 32]
    - [84, 1.449]
  - - [6784, 32, 1, 256]
    - [21, 4.604]
  - - [256, 4288, 1, 1]
    - [161, 0.076]
  - - [5888, 1408, 1, 1]
    - [62, 0.19]
  - - [1024, 4288, 1, 1280]
    - [54, 61.359]
  - - [1856, 4288, 1, 1]
    - [18, 0.209]
  - - [128, 2944, 1, 256]
    - [21, 8.297]
  - - [3584, 4288, 1, 256]
    - [54, 40.48]
  - - [2368, 2944, 1, 256]
    - [94, 35.276]
  - - [3584, 128, 1, 32]
    - [84, 1.464]
  - - [3584, 128, 1, 3328]
    - [156, 32.333]
  - - [704, 5056, 1, 256]
    - [31, 28.677]
  - - [1856, 4288, 1, 32]
    - [111, 8.642]
  - - [4288, 1024, 1, 1280]
    - [121, 61.418]
  - - [1, 4288, 1, 256]
    - [158, 0.107]
  - - [64, 2368, 1, 1]
    - [84, 0.016]
  - - [4288, 6784, 1, 32]
    - [136, 10.993]
  - - [704, 704, 1, 3328]
    - [76, 33.483]
  - - [128, 2944, 1, 1]
    - [84, 0.035]
  - - [3584, 1408, 1, 256]
    - [41, 31.988]
  - - [704, 3584, 1, 3328]
    - [76, 67.048]
  - - [5056, 448, 1, 1280]
    - [5, 50.96]
  - - [1408, 2944, 1, 1280]
    - [54, 58.377]
  - - [5888, 704, 1, 1280]
    - [4, 57.095]
  - - [704, 1408, 1, 1280]
    - [16, 35.648]
  - - [4288, 5888, 1, 256]
    - [69, 43.841]
  - - [6784, 64, 1, 32]
    - [84, 1.41]
  - - [3584, 3584, 1, 3328]
    - [5, 74.153]
  - - [2944, 6784, 1, 32]
    - [140, 8.978]
  - - [448, 64, 1, 32]
    - [84, 0.111]
  - - [5056, 256, 1, 1]
    - [187, 0.093]
  - - [64, 6784, 1, 1280]
    - [139, 25.453]
  - - [2944, 2368, 1, 3328]
    - [14, 71.253]
  - - [1, 4288, 1, 1]
    - [173, 0.0]
  - - [1408, 128, 1, 256]
    - [55, 4.192]
  - - [1024, 1856, 1, 1280]
    - [16, 44.566]
  - - [448, 5888, 1, 256]
    - [16, 26.789]
  - - [1024, 5888, 1, 256]
    - [54, 33.187]
  - - [704, 1408, 1, 256]
    - [16, 16.244]
  - - [6784, 2944, 1, 3328]
    - [5, 76.367]
  - - [1408, 2368, 1, 256]
    - [4, 27.398]
  - - [5888, 32, 1, 3328]
    - [47, 18.255]
  - - [1408, 5056, 1, 256]
    - [54, 34.683]
  - - [1024, 1408, 1, 32]
    - [110, 3.61]
  - - [4288, 128, 1, 32]
    - [110, 1.721]
  - - [6784, 704, 1, 1]
    - [167, 0.168]
  - - [448, 704, 1, 256]
    - [21, 6.944]
  - - [704, 3584, 1, 32]
    - [111, 5.289]
  - - [1856, 256, 1, 3328]
    - [156, 33.238]
  - - [448, 1024, 1, 1280]
    - [12, 23.628]
  - - [4288, 4288, 1, 1]
    - [111, 0.246]
  - - [5056, 2944, 1, 1]
    - [111, 0.239]
  - - [64, 2368, 1, 3328]
    - [21, 16.519]
  - - [256, 704, 1, 3328]
    - [21, 20.415]
  - - [1, 2944, 1, 1]
    - [173, 0.0]
  - - [3584, 1, 1, 1]
    - [84, 0.0]
  - - [256, 2944, 1, 32]
    - [110, 2.246]
  - - [6784, 4288, 1, 3328]
    - [5, 77.056]
  - - [5056, 2944, 1, 3328]
    - [5, 72.51]
  - - [704, 1024, 1, 1280]
    - [91, 34.086]
  - - [2368, 1856, 1, 3328]
    - [9, 62.54]
  - - [1856, 4288, 1, 1280]
    - [76, 63.691]
  - - [1, 1024, 1, 256]
    - [158, 0.026]
  - - [3584, 448, 1, 1]
    - [189, 0.103]
  - - [2944, 1024, 1, 3328]
    - [121, 60.902]
  - - [32, 1408, 1, 3328]
    - [56, 7.894]
  - - [128, 1, 1, 3328]
    - [89, 0.024]
  - - [5888, 5056, 1, 32]
    - [148, 9.309]
  - - [704, 2944, 1, 1]
    - [111, 0.126]
  - - [3584, 448, 1, 32]
    - [110, 3.859]
  - - [3584, 448, 1, 1280]
    - [4, 48.954]
  - - [2944, 6784, 1, 3328]
    - [5, 76.861]
  - - [1856, 2368, 1, 1280]
    - [20, 55.842]
  - - [6784, 1024, 1, 1280]
    - [8, 62.849]
  - - [6784, 3584, 1, 1280]
    - [5, 69.091]
  - - [1, 5056, 1, 3328]
    - [88, 0.724]
  - - [128, 2368, 1, 32]
    - [84, 1.021]
  - - [128, 1408, 1, 3328]
    - [21, 19.993]
  - - [2944, 32, 1, 3328]
    - [49, 15.292]
  - - [704, 1856, 1, 256]
    - [16, 20.706]
  - - [1408, 1408, 1, 1]
    - [111, 0.106]
  - - [1408, 4288, 1, 256]
    - [54, 33.106]
  - - [256, 5056, 1, 3328]
    - [168, 58.613]
  - - [2368, 64, 1, 1280]
    - [21, 11.324]
  - - [1856, 448, 1, 32]
    - [137, 2.417]
  - - [1408, 448, 1, 256]
    - [13, 11.969]
  - - [32, 128, 1, 256]
    - [48, 0.109]
  - - [448, 1024, 1, 1]
    - [84, 0.04]
  - - [128, 1024, 1, 1280]
    - [21, 9.896]
  - - [448, 6784, 1, 1]
    - [111, 0.155]
  - - [704, 2944, 1, 256]
    - [60, 24.007]
  - - [1408, 1408, 1, 256]
    - [7, 21.659]
  - - [448, 6784, 1, 32]
    - [111, 6.054]
  - - [1, 64, 1, 1280]
    - [79, 0.006]
  - - [1408, 1856, 1, 1]
    - [80, 0.14]
  - - [4288, 448, 1, 32]
    - [111, 4.587]
  - - [4288, 448, 1, 1280]
    - [50, 44.325]
  - - [2944, 704, 1, 32]
    - [161, 4.396]
  - - [1024, 704, 1, 256]
    - [183, 12.995]
  - - [448, 4288, 1, 1]
    - [111, 0.122]
  - - [3584, 5056, 1, 1]
    - [62, 0.23]
  - - [1408, 3584, 1, 1280]
    - [9, 60.949]
  - - [6784, 448, 1, 1280]
    - [121, 51.808]
  - - [3584, 5056, 1, 3328]
    - [5, 75.409]
  - - [2368, 2368, 1, 32]
    - [107, 7.6]
  - - [64, 5888, 1, 32]
    - [84, 1.171]
  - - [1856, 448, 1, 256]
    - [16, 14.988]
  - - [128, 1024, 1, 256]
    - [55, 3.0]
  - - [3584, 64, 1, 3328]
    - [122, 22.223]
  - - [5888, 2944, 1, 32]
    - [180, 8.765]
  - - [2944, 1, 1, 1280]
    - [49, 0.283]
  - - [1856, 2944, 1, 32]
    - [111, 7.636]
  - - [5056, 1408, 1, 1]
    - [111, 0.203]
  - - [5888, 1408, 1, 3328]
    - [41, 68.604]
  - - [448, 4288, 1, 256]
    - [16, 22.163]
  - - [6784, 1024, 1, 1]
    - [106, 0.182]
  - - [256, 448, 1, 1]
    - [138, 0.011]
  - - [128, 5888, 1, 3328]
    - [59, 49.403]
  - - [6784, 1024, 1, 32]
    - [140, 7.388]
  - - [256, 448, 1, 32]
    - [163, 0.405]
  - - [6784, 3584, 1, 1]
    - [94, 0.243]
  - - [2944, 2368, 1, 32]
    - [118, 7.243]
  - - [3584, 6784, 1, 3328]
    - [29, 75.052]
  - - [448, 128, 1, 1280]
    - [47, 5.664]
  - - [64, 3584, 1, 32]
    - [84, 0.759]
  - - [64, 3584, 1, 1280]
    - [21, 14.572]
  - - [6784, 1408, 1, 256]
    - [20, 35.548]
  - - [5056, 1024, 1, 32]
    - [111, 7.588]
  - - [1024, 5056, 1, 1280]
    - [20, 61.91]
  - - [4288, 3584, 1, 256]
    - [69, 41.464]
  - - [2368, 256, 1, 3328]
    - [91, 41.478]
  - - [448, 6784, 1, 1280]
    - [54, 53.126]
  - - [1856, 5888, 1, 1]
    - [111, 0.226]
  - - [3584, 1, 1, 3328]
    - [49, 0.603]
  - - [4288, 32, 1, 256]
    - [149, 3.244]
  - - [4288, 5056, 1, 32]
    - [107, 10.62]
  - - [4288, 5056, 1, 3328]
    - [41, 74.756]
  - - [1856, 5888, 1, 32]
    - [136, 9.249]
  - - [1856, 5888, 1, 1280]
    - [9, 64.801]
  - - [256, 256, 1, 1280]
    - [49, 6.386]
  - - [704, 2368, 1, 1280]
    - [73, 49.265]
  - - [4288, 2368, 1, 1280]
    - [5, 65.694]
  - - [2944, 5056, 1, 256]
    - [9, 40.123]
  - - [32, 1856, 1, 256]
    - [56, 1.616]
  - - [64, 5888, 1, 1280]
    - [122, 22.643]
  - - [1, 1856, 1, 1280]
    - [48, 0.185]
  - - [2944, 4288, 1, 1]
    - [181, 0.21]
  - - [5056, 5888, 1, 32]
    - [107, 11.053]
  - - [704, 1, 1, 3328]
    - [89, 0.133]
  - - [448, 256, 1, 1280]
    - [55, 8.844]
  - - [1408, 256, 1, 1]
    - [84, 0.032]
  - - [2368, 5056, 1, 3328]
    - [14, 71.999]
  - - [1024, 5056, 1, 3328]
    - [20, 72.327]
  - - [704, 704, 1, 1280]
    - [108, 24.229]
  - - [128, 32, 1, 3328]
    - [48, 0.768]
  - - [1024, 6784, 1, 32]
    - [110, 7.476]
  - - [3584, 2944, 1, 3328]
    - [9, 74.337]
  - - [128, 1856, 1, 256]
    - [21, 5.271]
  - - [32, 32, 1, 1280]
    - [152, 0.103]
  - - [1408, 5888, 1, 1]
    - [62, 0.19]
  - - [1, 3584, 1, 256]
    - [158, 0.091]
  - - [704, 4288, 1, 32]
    - [111, 5.915]
  - - [1408, 5888, 1, 32]
    - [110, 7.804]
  - - [6784, 1024, 1, 3328]
    - [193, 72.494]
  - - [1856, 1, 1, 3328]
    - [89, 0.341]
  - - [5056, 1408, 1, 256]
    - [76, 35.647]
  - - [1, 1, 1, 256]
    - [88, 0.0]
  - - [2944, 1408, 1, 256]
    - [54, 29.303]
  - - [4288, 1, 1, 1]
    - [84, 0.0]
  - - [2368, 2368, 1, 256]
    - [16, 33.074]
  - - [1, 448, 1, 256]
    - [88, 0.012]
  - - [1408, 6784, 1, 1]
    - [98, 0.199]
  - - [3584, 32, 1, 3328]
    - [149, 13.695]
  - - [128, 3584, 1, 1]
    - [34, 0.039]
  - - [1856, 1, 1, 256]
    - [58, 0.05]
  - - [6784, 6784, 1, 1280]
    - [5, 72.457]
  - - [1024, 5888, 1, 1]
    - [68, 0.171]
  - - [6784, 32, 1, 3328]
    - [47, 19.999]
  - - [1408, 32, 1, 256]
    - [47, 1.215]
  - - [128, 3584, 1, 32]
    - [57, 1.402]
  - - [1856, 3584, 1, 256]
    - [73, 34.138]
  - - [2944, 64, 1, 256]
    - [55, 4.313]
  - - [2368, 704, 1, 32]
    - [111, 4.263]
  - - [448, 2368, 1, 32]
    - [111, 2.942]
  - - [448, 2368, 1, 3328]
    - [33, 51.592]
  - - [64, 1408, 1, 256]
    - [58, 2.407]
  - - [5056, 32, 1, 32]
    - [84, 0.621]
  - - [1024, 704, 1, 3328]
    - [190, 47.841]
  - - [32, 5888, 1, 3328]
    - [55, 18.35]
  - - [32, 1408, 1, 1280]
    - [89, 4.481]
  - - [64, 32, 1, 256]
    - [49, 0.056]
  - - [1856, 1024, 1, 3328]
    - [96, 54.648]
  - - [2368, 1, 1, 1]
    - [174, 0.0]
  - - [5056, 2368, 1, 3328]
    - [194, 71.563]
  - - [128, 1, 1, 1280]
    - [92, 0.013]
  - - [704, 4288, 1, 1280]
    - [54, 53.351]
  - - [704, 256, 1, 256]
    - [115, 4.158]
  - - [2560, 7000, 1, 2560]
    - [5, 73.679]
  - - [7680, 12000, 1, 2560]
    - [5, 77.814]
  - - [5124, 9124, 1, 1760]
    - [195, 72.042]
  - - [1760, 32, 1, 1760]
    - [196, 4.898]
  - - [512, 24000, 1, 1536]
    - [28, 66.599]
  - - [3072, 24000, 1, 1024]
    - [5, 72.195]
  - - [2048, 400, 1, 512]
    - [16, 20.546]
  - - [2560, 128, 1, 2560]
    - [133, 30.003]
  - - [3072, 16, 1, 1024]
    - [90, 4.051]
  - - [512, 48000, 1, 2816]
    - [20, 74.571]
  - - [512, 48000, 1, 2048]
    - [20, 73.321]
  - - [1760, 64, 1, 1760]
    - [196, 9.464]
  - - [2048, 1600, 1, 2048]
    - [14, 61.772]
  - - [512, 48000, 1, 1536]
    - [20, 69.63]
  - - [2560, 32, 1, 2560]
    - [47, 12.055]
  - - [8448, 5984, 1, 2816]
    - [5, 76.762]
  - - [4096, 3200, 1, 1024]
    - [5, 65.547]
  - - [1024, 24000, 1, 2560]
    - [20, 74.842]
  - - [1760, 6400, 1, 1760]
    - [86, 64.891]
  - - [5124, 9124, 1, 2048]
    - [15, 73.998]
  - - [1024, 700, 1, 512]
    - [61, 21.313]
  - - [4608, 32, 1, 1536]
    - [21, 11.291]
  - - [3072, 64, 1, 1024]
    - [21, 13.036]
  - - [16384, 3200, 1, 4096]
    - [5, 77.394]
  - - [2560, 16, 1, 2560]
    - [49, 6.386]
  - - [1024, 48000, 1, 2560]
    - [20, 76.909]
  - - [8448, 48000, 1, 2816]
    - [5, 79.133]
  - - [2048, 32, 1, 2048]
    - [49, 8.495]
  - - [2560, 3200, 1, 2560]
    - [14, 66.764]
  - - [16384, 800, 1, 4096]
    - [23, 70.745]
  - - [4608, 24000, 1, 1536]
    - [5, 75.236]
  - - [7680, 48000, 1, 2560]
    - [74, 78.42]
  - - [3072, 48000, 1, 1024]
    - [5, 72.944]
  - - [1760, 16, 1, 1760]
    - [117, 2.482]
  - - [8192, 3200, 1, 2048]
    - [5, 73.603]
  - - [512, 24000, 1, 2816]
    - [28, 71.718]
  - - [4096, 400, 1, 1024]
    - [61, 36.142]
  - - [6144, 48000, 1, 2560]
    - [5, 78.369]
  - - [4608, 48000, 1, 1536]
    - [5, 75.778]
  - - [4096, 128, 1, 4096]
    - [91, 38.404]
  - - [2048, 800, 1, 512]
    - [197, 32.59]
  - - [4608, 5984, 1, 1536]
    - [5, 71.66]
  - - [4096, 1600, 1, 1024]
    - [5, 60.102]
  - - [6144, 5984, 1, 2048]
    - [5, 74.552]
  - - [7680, 24000, 1, 2560]
    - [5, 78.319]
  - - [6144, 48000, 1, 2048]
    - [74, 77.805]
  - - [2048, 3200, 1, 2048]
    - [20, 69.525]
  - - [5124, 9124, 1, 2560]
    - [15, 74.804]
  - - [1024, 24000, 1, 1536]
    - [9, 70.824]
  - - [7680, 16, 1, 2560]
    - [104, 11.933]
  - - [2560, 6400, 1, 2560]
    - [5, 72.356]
  - - [2048, 128, 1, 2048]
    - [133, 21.995]
  - - [512, 16, 1, 500000]
    - [198, 6.589]
  - - [512, 24000, 1, 2560]
    - [54, 70.756]
  - - [1024, 24000, 1, 2816]
    - [9, 75.168]
  - - [7680, 5984, 1, 2560]
    - [5, 76.039]
  - - [2048, 1600, 1, 512]
    - [54, 40.563]
  - - [2048, 7000, 1, 2048]
    - [5, 72.509]
  - - [1760, 800, 1, 1760]
    - [105, 42.887]
  - - [4096, 64, 1, 4096]
    - [133, 25.905]
  - - [7680, 32, 1, 2560]
    - [47, 16.295]
  - - [2560, 64, 1, 2560]
    - [21, 17.184]
  - - [3072, 128, 1, 1024]
    - [139, 22.238]
  - - [7680, 64, 1, 2560]
    - [125, 29.72]
  - - [1760, 128, 1, 1760]
    - [199, 15.143]
  - - [2560, 1600, 1, 2560]
    - [14, 64.486]
  - - [2048, 3200, 1, 512]
    - [20, 48.036]
  - - [2560, 800, 1, 2560]
    - [22, 55.673]
  - - [3072, 32, 1, 1024]
    - [90, 7.821]
  - - [6144, 32, 1, 2560]
    - [58, 17.029]
  - - [4608, 12000, 1, 1536]
    - [5, 74.405]
  - - [4096, 32, 1, 4096]
    - [21, 14.471]
  - - [6144, 24000, 1, 2048]
    - [74, 77.313]
  - - [8192, 800, 1, 2048]
    - [14, 64.293]
  - - [5124, 9124, 1, 4096]
    - [15, 76.921]
  - - [8448, 24000, 1, 2816]
    - [5, 79.053]
  - - [1024, 48000, 1, 1536]
    - [9, 73.334]
  - - [7680, 128, 1, 2560]
    - [33, 42.255]
  - - [8192, 1600, 1, 2048]
    - [5, 71.803]
  - - [4096, 800, 1, 1024]
    - [4, 52.579]
  - - [2048, 800, 1, 2048]
    - [4, 56.34]
  - - [1760, 3200, 1, 1760]
    - [200, 59.183]
  - - [512, 48000, 1, 2560]
    - [9, 74.145]
  - - [8448, 16, 1, 2816]
    - [55, 12.763]
  - - [2048, 64, 1, 2048]
    - [21, 12.601]
  - - [512, 24000, 1, 2048]
    - [14, 69.579]
  - - [16384, 1600, 1, 4096]
    - [5, 76.108]
  - - [4608, 16, 1, 1536]
    - [49, 7.595]
  - - [1024, 24000, 1, 2048]
    - [20, 73.702]
  - - [8192, 400, 1, 2048]
    - [41, 56.636]
  - - [2048, 6400, 1, 2048]
    - [5, 72.318]
  - - [6144, 12000, 1, 2048]
    - [5, 76.852]
  - - [512, 8, 1, 500000]
    - [201, 3.444]
  - - [1760, 7000, 1, 1760]
    - [105, 67.578]
  - - [1024, 48000, 1, 2816]
    - [9, 77.476]
  - - [6144, 16, 1, 2560]
    - [49, 11.387]
  - - [8448, 32, 1, 2816]
    - [58, 18.057]
  - - [4096, 7000, 1, 4096]
    - [41, 77.359]
  - - [4096, 16, 1, 4096]
    - [90, 11.16]
  - - [6144, 24000, 1, 2560]
    - [5, 78.084]
  - - [2048, 16, 1, 2048]
    - [47, 4.396]
  - - [8448, 12000, 1, 2816]
    - [5, 78.698]
  - - [16384, 400, 1, 4096]
    - [41, 63.59]
  - - [1760, 1600, 1, 1760]
    - [105, 52.678]
  - - [1024, 48000, 1, 2048]
    - [20, 75.629]
  - - [27, 27, 1, 64]
    - [44, 0.006]
  - - [27, 33, 1, 64]
    - [135, 0.007]
  - - [256, 80, 1, 784]
    - [165, 1.07]
  - - [256, 256, 1, 60800]
    - [205, 38.403]
  - - [256, 256, 1, 54400]
    - [206, 36.416]
  - - [256, 256, 1, 51520]
    - [205, 36.298]
  - - [256, 256, 1, 55296]
    - [205, 37.151]
  - - [256, 256, 1, 56832]
    - [206, 37.467]
  - - [256, 256, 1, 45632]
    - [207, 35.466]
  - - [256, 256, 1, 49152]
    - [208, 32.174]
  - - [256, 256, 1, 43008]
    - [209, 34.555]
  - - [256, 12, 1, 11408]
    - [210, 1.005]
  - - [256, 12, 1, 3800]
    - [56, 0.468]
  - - [256, 3, 1, 3800]
    - [88, 0.12]
  - - [256, 12, 1, 11616]
    - [210, 1.01]
  - - [256, 12, 1, 12288]
    - [211, 1.134]
  - - [256, 12, 1, 950]
    - [165, 0.18]
  - - [256, 3, 1, 950]
    - [165, 0.047]
  - - [256, 12, 1, 3220]
    - [56, 0.434]
  - - [256, 3, 1, 3220]
    - [56, 0.113]
  - - [256, 12, 1, 3072]
    - [52, 0.56]
  - - [256, 3, 1, 3072]
    - [89, 0.138]
  - - [256, 12, 1, 850]
    - [165, 0.171]
  - - [256, 3, 1, 850]
    - [212, 0.043]
  - - [256, 12, 1, 2852]
    - [77, 0.395]
  - - [256, 3, 1, 2852]
    - [92, 0.104]
  - - [256, 12, 1, 805]
    - [165, 0.157]
  - - [256, 3, 1, 805]
    - [165, 0.042]
  - - [256, 3, 1, 864]
    - [165, 0.043]
  - - [256, 3, 1, 768]
    - [77, 0.052]
  - - [256, 12, 1, 864]
    - [165, 0.169]
  - - [256, 12, 1, 768]
    - [92, 0.206]
  - - [256, 12, 1, 2904]
    - [56, 0.396]
  - - [256, 3, 1, 2904]
    - [92, 0.103]
  - - [256, 3, 1, 713]
    - [165, 0.039]
  - - [256, 12, 1, 888]
    - [165, 0.176]
  - - [256, 3, 1, 888]
    - [165, 0.044]
  - - [256, 12, 1, 713]
    - [165, 0.148]
  - - [256, 3, 1, 660]
    - [165, 0.036]
  - - [256, 3, 1, 672]
    - [165, 0.037]
  - - [256, 12, 1, 660]
    - [165, 0.142]
  - - [256, 3, 1, 726]
    - [165, 0.038]
  - - [256, 12, 1, 672]
    - [43, 0.139]
  - - [256, 3, 1, 247]
    - [43, 0.016]
  - - [256, 12, 1, 726]
    - [117, 0.149]
  - - [256, 3, 1, 216]
    - [165, 0.015]
  - - [256, 3, 1, 3400]
    - [56, 0.114]
  - - [256, 3, 1, 221]
    - [165, 0.015]
  - - [256, 12, 1, 3552]
    - [56, 0.447]
  - - [256, 3, 1, 3456]
    - [89, 0.148]
  - - [256, 3, 1, 204]
    - [165, 0.014]
  - - [256, 12, 1, 3400]
    - [77, 0.431]
  - - [256, 12, 1, 3456]
    - [52, 0.589]
  - - [256, 12, 1, 221]
    - [165, 0.058]
  - - [256, 3, 1, 3552]
    - [88, 0.116]
  - - [256, 3, 1, 228]
    - [138, 0.015]
  - - [256, 3, 1, 234]
    - [138, 0.015]
  - - [256, 12, 1, 234]
    - [165, 0.06]
  - - [1024, 1000, 1, 12544]
    - [9, 59.9]
  - - [320, 1024, 1, 1024]
    - [21, 19.386]
  - - [1024, 1000, 1, 1024]
    - [16, 32.999]
  - - [320, 1000, 1, 1024]
    - [21, 18.836]
  - - [256, 12, 1, 228]
    - [174, 0.058]
  - - [256, 3, 1, 252]
    - [138, 0.016]
  - - [256, 12, 1, 252]
    - [138, 0.063]
  - - [256, 12, 1, 247]
    - [43, 0.063]
  - - [128, 64, 121, 1152]
    - [16, 21.622]
  - - [128, 64, 81, 12000]
    - [125, 32.201]
  - - [128, 64, 121, 1216]
    - [16, 23.993]
  - - [128, 64, 81, 1800]
    - [125, 23.122]
  - - [128, 64, 81, 1900]
    - [16, 23.248]
  - - [128, 64, 49, 20280]
    - [139, 32.477]
  - - [128, 64, 49, 3042]
    - [213, 24.436]
  - - [128, 64, 49, 3211]
    - [170, 24.284]
  - - [128, 64, 25, 43320]
    - [214, 28.872]
  - - [128, 64, 169, 5880]
    - [82, 30.47]
  - - [128, 64, 25, 6498]
    - [21, 21.45]
  - - [128, 64, 25, 6859]
    - [122, 20.059]
  - - [128, 64, 121, 7680]
    - [123, 30.021]
  - - [128, 64, 169, 882]
    - [4, 20.172]
  - - [128, 64, 169, 931]
    - [4, 20.985]
  - - [256, 128, 25, 1080]
    - [125, 25.559]
  - - [256, 128, 49, 1152]
    - [197, 40.623]
  - - [256, 128, 121, 120]
    - [68, 12.824]
  - - [256, 128, 169, 120]
    - [18, 13.563]
  - - [256, 128, 36, 120]
    - [215, 7.895]
  - - [256, 128, 49, 120]
    - [216, 9.691]
  - - [256, 128, 64, 120]
    - [68, 10.348]
  - - [256, 128, 36, 12000]
    - [33, 60.366]
  - - [256, 128, 49, 1216]
    - [64, 43.995]
  - - [256, 128, 25, 162]
    - [111, 7.911]
  - - [256, 128, 25, 171]
    - [116, 8.177]
  - - [256, 128, 121, 18]
    - [217, 2.553]
  - - [256, 128, 169, 18]
    - [110, 2.773]
  - - [256, 128, 36, 18]
    - [110, 1.45]
  - - [256, 128, 49, 18]
    - [110, 1.687]
  - - [256, 128, 64, 18]
    - [111, 1.969]
  - - [256, 128, 36, 1800]
    - [33, 35.441]
  - - [256, 128, 121, 19]
    - [111, 2.677]
  - - [256, 128, 169, 19]
    - [187, 2.964]
  - - [256, 128, 36, 19]
    - [110, 1.512]
  - - [256, 128, 49, 19]
    - [111, 1.763]
  - - [256, 128, 64, 19]
    - [218, 2.041]
  - - [256, 128, 36, 1900]
    - [33, 35.768]
  - - [256, 128, 49, 480]
    - [189, 29.335]
  - - [256, 128, 81, 480]
    - [80, 32.922]
  - - [256, 128, 64, 5880]
    - [33, 47.0]
  - - [256, 128, 49, 72]
    - [189, 6.323]
  - - [256, 128, 81, 72]
    - [68, 8.647]
  - - [256, 128, 49, 76]
    - [189, 6.707]
  - - [256, 128, 81, 76]
    - [159, 8.983]
  - - [256, 128, 49, 7680]
    - [127, 63.818]
  - - [256, 128, 64, 882]
    - [219, 28.469]
  - - [256, 128, 64, 931]
    - [220, 28.906]
  - - [512, 256, 81, 1080]
    - [78, 54.234]
  - - [512, 256, 25, 12000]
    - [221, 73.579]
  - - [512, 256, 81, 162]
    - [222, 20.926]
  - - [512, 256, 81, 171]
    - [223, 21.876]
  - - [512, 256, 25, 1800]
    - [224, 51.039]
  - - [512, 256, 25, 1900]
    - [225, 52.78]
  - - [512, 256, 121, 1920]
    - [127, 64.682]
  - - [512, 256, 169, 1920]
    - [14, 64.77]
  - - [512, 256, 49, 1920]
    - [29, 60.961]
  - - [512, 256, 121, 288]
    - [105, 40.489]
  - - [512, 256, 169, 288]
    - [87, 41.571]
  - - [512, 256, 49, 288]
    - [94, 33.776]
  - - [512, 256, 25, 3000]
    - [226, 59.706]
  - - [512, 256, 81, 3000]
    - [78, 66.961]
  - - [512, 256, 121, 304]
    - [227, 34.776]
  - - [512, 256, 169, 304]
    - [227, 35.519]
  - - [512, 256, 49, 304]
    - [106, 30.939]
  - - [512, 256, 25, 450]
    - [167, 30.427]
  - - [512, 256, 81, 450]
    - [225, 36.617]
  - - [512, 256, 25, 475]
    - [103, 30.711]
  - - [512, 256, 81, 475]
    - [78, 37.014]
  - - [512, 256, 121, 480]
    - [94, 49.779]
  - - [512, 256, 169, 480]
    - [94, 50.976]
  - - [512, 256, 49, 5880]
    - [24, 66.304]
  - - [512, 256, 121, 72]
    - [87, 13.76]
  - - [512, 256, 169, 72]
    - [228, 14.104]
  - - [512, 256, 121, 76]
    - [222, 14.161]
  - - [512, 256, 169, 76]
    - [229, 14.557]
  - - [512, 256, 49, 882]
    - [179, 46.382]
  - - [512, 256, 49, 931]
    - [179, 46.88]
  - - [1152, 256, 1, 1]
    - [36, 0.027]
  - - [1152, 256, 1, 1444]
    - [170, 16.209]
  - - [1152, 256, 1, 25]
    - [84, 0.67]
  - - [1152, 256, 1, 9]
    - [84, 0.249]
  - - [128, 256, 1, 1444]
    - [196, 2.491]
  - - [2304, 340, 1, 1]
    - [110, 0.061]
  - - [2304, 340, 1, 1444]
    - [91, 29.031]
  - - [2304, 340, 1, 9]
    - [110, 0.552]
  - - [2304, 510, 1, 25]
    - [110, 1.947]
  - - [2304, 512, 1, 100]
    - [111, 6.712]
  - - [2304, 512, 1, 361]
    - [230, 14.901]
  - - [256, 256, 1, 1444]
    - [117, 4.936]
  - - [4608, 510, 1, 100]
    - [231, 9.49]
  - - [4608, 510, 1, 361]
    - [62, 22.126]
  - - [576, 128, 1, 1444]
    - [212, 5.579]
  - - [81, 1024, 1, 1024]
    - [88, 6.554]
  - - [81, 1000, 1, 1024]
    - [88, 6.272]
  - - [340, 256, 49, 1152]
    - [232, 43.179]
  - - [340, 256, 36, 120]
    - [233, 11.297]
  - - [340, 256, 49, 120]
    - [215, 12.088]
  - - [340, 256, 64, 120]
    - [67, 13.121]
  - - [340, 256, 36, 12000]
    - [234, 65.915]
  - - [340, 256, 49, 1216]
    - [19, 46.895]
  - - [340, 256, 36, 18]
    - [176, 2.161]
  - - [340, 256, 49, 18]
    - [235, 2.529]
  - - [340, 256, 64, 18]
    - [187, 2.789]
  - - [340, 256, 36, 1800]
    - [220, 42.792]
  - - [340, 256, 36, 19]
    - [67, 2.274]
  - - [340, 256, 49, 19]
    - [67, 2.608]
  - - [340, 256, 64, 19]
    - [187, 2.937]
  - - [340, 256, 36, 1900]
    - [220, 42.133]
  - - [340, 256, 64, 5880]
    - [127, 55.328]
  - - [340, 256, 49, 7680]
    - [127, 60.498]
  - - [340, 256, 64, 882]
    - [179, 36.683]
  - - [340, 256, 64, 931]
    - [234, 36.911]
  - - [510, 256, 49, 120]
    - [215, 12.89]
  - - [510, 256, 64, 120]
    - [236, 13.743]
  - - [510, 256, 49, 18]
    - [235, 2.621]
  - - [510, 256, 64, 18]
    - [215, 2.853]
  - - [510, 256, 49, 19]
    - [215, 2.795]
  - - [510, 256, 64, 19]
    - [235, 3.079]
  - - [510, 256, 36, 480]
    - [232, 34.82]
  - - [510, 256, 36, 72]
    - [67, 8.549]
  - - [510, 256, 36, 76]
    - [215, 8.581]
  - - [510, 512, 36, 1080]
    - [237, 42.792]
  - - [510, 512, 36, 162]
    - [233, 16.232]
  - - [510, 512, 36, 171]
    - [238, 16.738]
  - - [510, 512, 49, 1920]
    - [19, 62.127]
  - - [510, 512, 64, 1920]
    - [19, 62.991]
  - - [510, 512, 49, 288]
    - [239, 31.006]
  - - [510, 512, 64, 288]
    - [113, 31.618]
  - - [510, 512, 36, 3000]
    - [240, 56.136]
  - - [510, 512, 49, 304]
    - [228, 27.389]
  - - [510, 512, 64, 304]
    - [188, 27.217]
  - - [510, 512, 36, 450]
    - [228, 28.051]
  - - [510, 512, 36, 475]
    - [228, 29.927]
  - - [510, 512, 49, 480]
    - [232, 39.181]
  - - [510, 512, 64, 480]
    - [232, 40.527]
  - - [510, 512, 49, 72]
    - [67, 10.711]
  - - [510, 512, 64, 72]
    - [233, 11.269]
  - - [510, 512, 49, 76]
    - [67, 11.089]
  - - [510, 512, 64, 76]
    - [233, 11.72]
  - - [48, 48, 16, 64]
    - [174, 0.28]
  - - [64, 64, 16, 64]
    - [174, 0.497]
  - - [80, 80, 16, 64]
    - [42, 0.753]
  - - [96, 96, 16, 64]
    - [174, 1.022]
  - - [144, 144, 16, 64]
    - [43, 2.027]
  - - [160, 160, 16, 64]
    - [43, 2.503]
  - - [176, 176, 16, 64]
    - [43, 2.929]
  - - [192, 192, 16, 64]
    - [13, 3.515]
  - - [208, 208, 16, 64]
    - [118, 3.643]
  - - [224, 224, 16, 64]
    - [180, 4.225]
  - - [240, 240, 16, 64]
    - [16, 4.713]
  - - [256, 256, 16, 64]
    - [13, 5.214]
  - - [288, 288, 16, 64]
    - [136, 5.063]
  - - [304, 304, 16, 64]
    - [18, 6.462]
  - - [352, 352, 16, 64]
    - [16, 7.563]
  - - [368, 368, 16, 64]
    - [16, 8.31]
  - - [416, 416, 16, 64]
    - [136, 8.913]
  - - [432, 432, 16, 64]
    - [136, 9.877]
  - - [448, 448, 16, 64]
    - [18, 10.024]
  - - [464, 464, 16, 64]
    - [181, 10.221]
  - - [480, 480, 16, 64]
    - [112, 10.894]
  - - [1024, 6688, 1, 1024]
    - [28, 66.395]
  - - [1024, 7872, 1, 1024]
    - [9, 75.669]
  - - [1024, 5136, 1, 4096]
    - [20, 87.649]
  - - [1024, 6544, 1, 4096]
    - [53, 81.357]
  - - [1024, 5632, 1, 1024]
    - [28, 65.23]
  - - [1024, 6176, 1, 4096]
    - [20, 85.335]
  - - [1024, 6640, 1, 1024]
    - [14, 66.029]
  - - [1024, 6288, 1, 4096]
    - [9, 86.807]
  - - [1024, 6256, 1, 4096]
    - [9, 86.441]
  - - [1024, 6672, 1, 1024]
    - [4, 66.181]
  - - [1024, 6304, 1, 4096]
    - [20, 87.078]
  - - [1024, 6208, 1, 4096]
    - [20, 85.802]
  - - [1024, 6224, 1, 4096]
    - [20, 86.099]
  - - [1024, 6320, 1, 4096]
    - [20, 87.146]
  - - [1024, 6560, 1, 4096]
    - [53, 82.819]
  - - [1024, 7776, 1, 1024]
    - [9, 74.93]
  - - [1024, 6928, 1, 4096]
    - [93, 84.573]
  - - [1024, 6704, 1, 1024]
    - [76, 66.288]
  - - [1024, 27, 1, 1024]
    - [49, 2.328]
  - - [1024, 14320, 1, 4096]
    - [20, 83.645]
  - - [1024, 14112, 1, 4096]
    - [20, 83.015]
  - - [1024, 14128, 1, 4096]
    - [20, 82.626]
  - - [1024, 14144, 1, 4096]
    - [20, 82.72]
  - - [1024, 14160, 1, 4096]
    - [20, 82.895]
  - - [1024, 14176, 1, 4096]
    - [20, 82.917]
  - - [1024, 14192, 1, 4096]
    - [20, 82.918]
  - - [1024, 14208, 1, 4096]
    - [20, 83.279]
  - - [1024, 14224, 1, 4096]
    - [20, 83.136]
  - - [1024, 14240, 1, 4096]
    - [20, 83.117]
  - - [1024, 14256, 1, 4096]
    - [20, 83.272]
  - - [1024, 14272, 1, 4096]
    - [20, 83.375]
  - - [1024, 14288, 1, 4096]
    - [20, 83.355]
  - - [1024, 14304, 1, 4096]
    - [20, 83.915]
  - - [1024, 14480, 1, 4096]
    - [20, 84.392]
  - - [1024, 14528, 1, 4096]
    - [20, 78.775]
  - - [1024, 14784, 1, 4096]
    - [20, 80.172]
  - - [1024, 15072, 1, 4096]
    - [20, 81.528]
  - - [1024, 15232, 1, 4096]
    - [20, 81.98]
  - - [1024, 15328, 1, 4096]
    - [20, 82.385]
  - - [1024, 15392, 1, 4096]
    - [20, 82.766]
  - - [1024, 15504, 1, 4096]
    - [20, 83.141]
  - - [1024, 16064, 1, 4096]
    - [20, 80.083]
  - - [1024, 16256, 1, 4096]
    - [20, 80.997]
  - - [1024, 17024, 1, 4096]
    - [20, 84.317]
  - - [1024, 3568, 1, 4096]
    - [41, 72.926]
  - - [1024, 3584, 1, 1024]
    - [71, 54.352]
  - - [1024, 3600, 1, 4096]
    - [41, 73.39]
  - - [1024, 368, 1, 4096]
    - [133, 37.886]
  - - [1024, 3760, 1, 1024]
    - [10, 56.586]
  - - [1024, 3920, 1, 4096]
    - [20, 78.825]
  - - [1024, 4032, 1, 4096]
    - [4, 71.926]
  - - [30528, 468, 1, 1024]
    - [74, 68.966]
  - - [3072, 4304, 1, 1024]
    - [5, 69.78]
  - - [1024, 109, 1, 1024]
    - [21, 6.923]
  - - [1024, 128, 1, 4096]
    - [199, 16.348]
  - - [1024, 14096, 1, 4096]
    - [20, 82.388]
  - - [1024, 16432, 1, 4096]
    - [20, 81.797]
  - - [1024, 2201, 1, 1024]
    - [28, 45.458]
  - - [1024, 2240, 1, 1024]
    - [28, 48.027]
  - - [1024, 2241, 1, 1024]
    - [28, 47.025]
  - - [1024, 2243, 1, 1024]
    - [28, 47.066]
  - - [1024, 2244, 1, 1024]
    - [28, 47.087]
  - - [1024, 2246, 1, 1024]
    - [28, 46.55]
  - - [1024, 2249, 1, 1024]
    - [28, 46.859]
  - - [1024, 2251, 1, 1024]
    - [28, 46.818]
  - - [1024, 2254, 1, 1024]
    - [28, 46.88]
  - - [1024, 2259, 1, 1024]
    - [28, 46.82]
  - - [1024, 2265, 1, 1024]
    - [28, 46.374]
  - - [1024, 2268, 1, 1024]
    - [28, 46.924]
  - - [1024, 2269, 1, 1024]
    - [28, 46.781]
  - - [1024, 2270, 1, 1024]
    - [28, 47.717]
  - - [1024, 2278, 1, 1024]
    - [28, 46.803]
  - - [1024, 2280, 1, 1024]
    - [28, 46.441]
  - - [1024, 2281, 1, 1024]
    - [28, 47.193]
  - - [1024, 2282, 1, 1024]
    - [4, 46.401]
  - - [1024, 2285, 1, 1024]
    - [28, 47.193]
  - - [1024, 2286, 1, 1024]
    - [4, 47.296]
  - - [1024, 2287, 1, 1024]
    - [28, 46.825]
  - - [1024, 2289, 1, 1024]
    - [28, 47.029]
  - - [1024, 2296, 1, 1024]
    - [28, 47.337]
  - - [1024, 2298, 1, 1024]
    - [28, 47.544]
  - - [1024, 2300, 1, 1024]
    - [54, 47.753]
  - - [1024, 2301, 1, 1024]
    - [28, 47.193]
  - - [1024, 2303, 1, 1024]
    - [28, 47.316]
  - - [1024, 3552, 1, 1024]
    - [20, 56.86]
  - - [1024, 3936, 1, 1024]
    - [15, 61.264]
  - - [1024, 3936, 1, 4096]
    - [15, 80.274]
  - - [1024, 4352, 1, 1024]
    - [28, 60.629]
  - - [1024, 47, 1, 1024]
    - [58, 3.47]
  - - [1024, 5952, 1, 4096]
    - [4, 76.078]
  - - [1024, 646, 1, 1024]
    - [54, 25.958]
  - - [1024, 696, 1, 1024]
    - [54, 27.685]
  - - [1024, 705, 1, 1024]
    - [28, 27.762]
  - - [1024, 715, 1, 1024]
    - [54, 28.536]
  - - [1024, 716, 1, 1024]
    - [54, 28.385]
  - - [1024, 718, 1, 1024]
    - [54, 28.464]
  - - [1024, 722, 1, 1024]
    - [54, 28.526]
  - - [1024, 726, 1, 1024]
    - [54, 28.781]
  - - [1024, 727, 1, 1024]
    - [54, 28.918]
  - - [1024, 730, 1, 1024]
    - [54, 28.843]
  - - [1024, 731, 1, 1024]
    - [28, 28.691]
  - - [1024, 732, 1, 1024]
    - [54, 28.54]
  - - [1024, 733, 1, 1024]
    - [28, 28.579]
  - - [1024, 739, 1, 1024]
    - [54, 29.101]
  - - [1024, 740, 1, 1024]
    - [54, 29.14]
  - - [1024, 742, 1, 1024]
    - [54, 29.122]
  - - [1024, 751, 1, 1024]
    - [54, 29.185]
  - - [1024, 756, 1, 1024]
    - [54, 29.475]
  - - [1024, 759, 1, 1024]
    - [54, 29.79]
  - - [1024, 761, 1, 1024]
    - [54, 29.868]
  - - [1024, 762, 1, 1024]
    - [54, 30.007]
  - - [1024, 768, 1, 1024]
    - [54, 31.394]
  - - [1024, 769, 1, 1024]
    - [54, 30.283]
  - - [1024, 792, 1, 1024]
    - [54, 31.188]
  - - [1024, 793, 1, 1024]
    - [54, 31.124]
  - - [1024, 794, 1, 1024]
    - [54, 31.06]
  - - [1024, 800, 1, 4096]
    - [190, 56.593]
  - - [1024, 802, 1, 1024]
    - [54, 31.27]
  - - [1024, 808, 1, 1024]
    - [54, 31.818]
  - - [1024, 816, 1, 4096]
    - [194, 56.79]
  - - [1024, 834, 1, 1024]
    - [63, 29.323]
  - - [1024, 835, 1, 1024]
    - [63, 28.76]
  - - [1024, 836, 1, 1024]
    - [63, 28.878]
  - - [1024, 837, 1, 1024]
    - [63, 28.997]
  - - [1024, 838, 1, 1024]
    - [63, 28.779]
  - - [1024, 839, 1, 1024]
    - [60, 28.482]
  - - [1024, 840, 1, 1024]
    - [63, 28.848]
  - - [1024, 962, 1, 1024]
    - [61, 31.052]
  - - [1024, 966, 1, 1024]
    - [16, 31.011]
  - - [1024, 976, 1, 1024]
    - [151, 31.163]
  - - [30528, 109, 1, 1024]
    - [33, 42.279]
  - - [30528, 17, 1, 1024]
    - [61, 9.58]
  - - [30528, 447, 1, 1024]
    - [41, 66.037]
  - - [30528, 448, 1, 1024]
    - [74, 66.576]
  - - [30528, 461, 1, 1024]
    - [74, 67.906]
  - - [30528, 462, 1, 1024]
    - [5, 68.11]
  - - [30528, 471, 1, 1024]
    - [74, 68.86]
  - - [30528, 473, 1, 1024]
    - [74, 69.182]
  - - [30528, 474, 1, 1024]
    - [74, 68.672]
  - - [30528, 475, 1, 1024]
    - [5, 69.073]
  - - [30528, 477, 1, 1024]
    - [74, 69.68]
  - - [30528, 478, 1, 1024]
    - [74, 69.971]
  - - [30528, 54, 1, 1024]
    - [28, 27.015]
  - - [30528, 548, 1, 1024]
    - [74, 66.12]
  - - [30528, 549, 1, 1024]
    - [74, 66.286]
  - - [30528, 550, 1, 1024]
    - [74, 66.384]
  - - [30528, 553, 1, 1024]
    - [74, 66.45]
  - - [30528, 555, 1, 1024]
    - [74, 67.034]
  - - [30528, 557, 1, 1024]
    - [74, 67.391]
  - - [30528, 558, 1, 1024]
    - [74, 67.097]
  - - [30528, 559, 1, 1024]
    - [74, 67.103]
  - - [30528, 560, 1, 1024]
    - [74, 67.245]
  - - [30528, 561, 1, 1024]
    - [74, 67.274]
  - - [30528, 562, 1, 1024]
    - [74, 67.417]
  - - [30528, 563, 1, 1024]
    - [5, 67.721]
  - - [30528, 565, 1, 1024]
    - [74, 67.592]
  - - [30528, 566, 1, 1024]
    - [74, 67.873]
  - - [30528, 567, 1, 1024]
    - [74, 67.878]
  - - [30528, 568, 1, 1024]
    - [74, 68.113]
  - - [30528, 569, 1, 1024]
    - [5, 68.326]
  - - [30528, 570, 1, 1024]
    - [74, 68.516]
  - - [30528, 571, 1, 1024]
    - [74, 68.38]
  - - [30528, 572, 1, 1024]
    - [5, 67.603]
  - - [30528, 573, 1, 1024]
    - [74, 68.479]
  - - [30528, 749, 1, 1024]
    - [74, 70.028]
  - - [30528, 753, 1, 1024]
    - [74, 70.272]
  - - [30528, 755, 1, 1024]
    - [74, 70.627]
  - - [30528, 756, 1, 1024]
    - [74, 70.402]
  - - [30528, 757, 1, 1024]
    - [74, 70.291]
  - - [30528, 758, 1, 1024]
    - [5, 70.682]
  - - [30528, 759, 1, 1024]
    - [5, 70.514]
  - - [30528, 760, 1, 1024]
    - [5, 70.7]
  - - [30528, 761, 1, 1024]
    - [5, 70.83]
  - - [30528, 762, 1, 1024]
    - [74, 71.074]
  - - [30528, 763, 1, 1024]
    - [5, 71.092]
  - - [30528, 764, 1, 1024]
    - [74, 71.053]
  - - [30528, 765, 1, 1024]
    - [74, 71.448]
  - - [30528, 766, 1, 1024]
    - [5, 71.145]
  - - [30528, 82, 1, 1024]
    - [74, 33.699]
  - - [3072, 3248, 1, 1024]
    - [5, 66.119]
  - - [3072, 368, 1, 1024]
    - [61, 34.873]
  - - [3072, 560, 1, 1024]
    - [54, 45.836]
  - - [4096, 16256, 1, 1024]
    - [5, 76.864]
  - - [4096, 368, 1, 1024]
    - [4, 41.602]
  - - [16, 16, 16, 64]
    - [43, 0.026]
  - - [272, 272, 16, 64]
    - [107, 4.742]
  - - [10, 163840, 1, 642]
    - [2, 5.646]
  - - [10, 81920, 1, 642]
    - [2, 5.343]
  - - [12840, 1024, 1, 256]
    - [5, 47.521]
  - - [12840, 512, 1, 256]
    - [50, 36.393]
  - - [2400, 1024, 1, 256]
    - [16, 26.059]
  - - [2400, 512, 1, 256]
    - [16, 17.72]
  - - [256, 1024, 1, 2400]
    - [122, 19.003]
  - - [256, 1024, 1, 256]
    - [21, 4.638]
  - - [256, 1024, 1, 4800]
    - [139, 32.001]
  - - [256, 512, 1, 2400]
    - [214, 10.805]
  - - [256, 512, 1, 256]
    - [21, 2.52]
  - - [256, 512, 1, 4800]
    - [21, 17.545]
  - - [30, 163840, 1, 642]
    - [11, 14.988]
  - - [30, 81920, 1, 642]
    - [11, 14.209]
  - - [3200, 1024, 1, 256]
    - [94, 31.088]
  - - [3200, 512, 1, 256]
    - [64, 21.676]
  - - [9630, 1024, 1, 256]
    - [15, 41.641]
  - - [9630, 512, 1, 256]
    - [7, 32.691]
  - - [160, 642, 1024, 20]
    - [218, 6.25]
  - - [160, 642, 512, 20]
    - [147, 5.964]
  - - [642, 160, 1024, 15]
    - [215, 3.994]
  - - [642, 160, 512, 15]
    - [236, 3.826]
  - - [642, 160, 1024, 20]
    - [235, 5.209]
  - - [642, 160, 512, 20]
    - [67, 5.002]
  - - [2200, 1024, 1, 2200]
    - [66, 52.877]
  - - [2200, 1024, 1, 22374]
    - [25, 68.6]
  - - [2200, 256, 1, 2200]
    - [54, 29.022]
  - - [2200, 256, 1, 22374]
    - [101, 49.672]
  - - [2200, 512, 1, 2200]
    - [9, 42.624]
  - - [2200, 512, 1, 22374]
    - [33, 70.055]
  - - [4000, 1024, 1, 11190]
    - [96, 72.791]
  - - [4000, 1024, 1, 4000]
    - [96, 64.473]
  - - [4000, 256, 1, 11190]
    - [25, 60.072]
  - - [4000, 256, 1, 4000]
    - [20, 48.524]
  - - [4000, 512, 1, 11190]
    - [96, 71.264]
  - - [4000, 512, 1, 4000]
    - [96, 61.284]
  - - [256, 1024, 1, 7616]
    - [123, 35.76]
  - - [256, 512, 1, 7616]
    - [150, 19.593]
  - - [7616, 1024, 1, 256]
    - [177, 35.534]
  - - [7616, 512, 1, 256]
    - [16, 27.907]
  - - [1024, 1024, 1, 2048]
    - [9, 42.446]
  - - [1024, 512, 1, 2048]
    - [54, 29.65]
  - - [2048, 1024, 1, 1024]
    - [16, 44.971]
  - - [2048, 1024, 1, 7616]
    - [96, 75.259]
  - - [2048, 512, 1, 1024]
    - [60, 32.432]
  - - [2048, 512, 1, 7616]
    - [20, 62.962]
  - - [128, 1024, 1, 1677]
    - [214, 8.227]
  - - [128, 512, 1, 1677]
    - [117, 4.708]
  - - [2048, 1024, 1, 3465]
    - [96, 54.688]
  - - [2048, 1024, 1, 9375]
    - [96, 66.339]
  - - [2048, 512, 1, 3465]
    - [74, 43.593]
  - - [2048, 512, 1, 9375]
    - [27, 55.571]
  - - [3465, 1024, 1, 128]
    - [7, 15.049]
  - - [3465, 512, 1, 128]
    - [11, 9.955]
  - - [9375, 1024, 1, 128]
    - [7, 20.479]
  - - [9375, 512, 1, 128]
    - [7, 16.842]
  - - [12288, 2048, 1, 8192]
    - [248, 92.503]
  - - [16384, 2048, 1, 8192]
    - [249, 87.854]
  - - [64000, 2048, 1, 8192]
    - [250, 91.601]
  - - [8192, 2048, 1, 16384]
    - [244, 87.95]
  - - [8192, 2048, 1, 4096]
    - [241, 77.639]
  - - [12288, 512, 1, 8192]
    - [245, 77.12]
  - - [16384, 512, 1, 8192]
    - [246, 82.83]
  - - [64000, 512, 1, 8192]
    - [251, 88.811]
  - - [8192, 512, 1, 16384]
    - [242, 76.42]
  - - [8192, 512, 1, 4096]
    - [243, 70.873]
  - - [512, 512, 128, 128]
    - [247, 21.01]
  - - [9216, 64, 1, 8192]
    - [252, 34.519]
  - - [8192, 64, 1, 8192]
    - [253, 32.984]
  - - [32768, 64, 1, 8192]
    - [254, 39.573]
  - - [8192, 64, 1, 32768]
    - [255, 35.599]
  - - [65024, 64, 1, 8192]
    - [256, 41.197]
  - - [50368, 1, 1, 7168]
    - [257, 1.16]
  - - [28672, 1, 1, 7168]
    - [258, 1.06]
  - - [21504, 1, 1, 7168]
    - [259, 1.08]
  - - [7168, 1, 1, 7168]
    - [260, 0.97]
  - - [7168, 1, 1, 28672]
    - [261, 1.11]
  - - [50368, 128, 1, 7168]
    - [262, 73.75]
  - - [28672, 128, 1, 7168]
    - [263, 64.75]
  - - [21504, 128, 1, 7168]
    - [264, 63.94]
  - - [7168, 128, 1, 7168]
    - [265, 44.23]
  - - [7168, 128, 1, 28672]
    - [266, 57.61]
  - - [50368, 2048, 1, 7168]
    - [267, 87.57]
  - - [28672, 2048, 1, 7168]
    - [267, 87.83]
  - - [21504, 2048, 1, 7168]
    - [268, 86.46]
  - - [7168, 2048, 1, 7168]
    - [269, 86.76]
  - - [7168, 2048, 1, 28672]
    - [270, 88.4]
  - - [32768, 8192, 1, 6400]
    - [271, 84.6]
  - - [4096, 8192, 1, 4096]
    - [275, 83.42]
  - - [8192, 3072, 1, 4096]
    - [272, 86.13]
  - - [131072, 8192, 1, 6400]
    - [273, 79.91]
- null
