library/src/blas3/Tensile/Logic/asm_full/aldebaran/aldebaran_Cijk_Ailk_Bljk_I8II_BH.yaml
- {MinimumRequiredVersion: 4.25.0}
- aldebaran
- gfx90a
- [Device 7400, Device 7408, Device 740c]
    SolutionIndex: 0
    SolutionNameMin: Cijk_Ailk_Bljk_I8II_BH_MT64x64x64_MI32x32x8x1_SE_1LDSB0_AF0EM1_EPS1_GRVW4_LPB4_LRVW4_OPLV0_PK0_PAP0_PGR1_PLR1_SU32_SUS256_SRVW0_TT1_32_WG64_4_1_WGM8
    SolutionIndex: 1
    SolutionNameMin: Cijk_Ailk_Bljk_I8II_BH_MT64x64x32_MI32x32x8x1_SE_1LDSB0_AF0EM4_EPS1_GRVW4_LPB4_LRVW4_OPLV0_PK0_PAP0_PGR1_PLR1_SU32_SUS256_SRVW0_TT1_32_WG64_4_1_WGM8
    SolutionIndex: 2
    SolutionNameMin: Cijk_Ailk_Bljk_I8II_BH_MT32x64x128_MI16x16x16x1_SE_1LDSB0_AF0EM8_EPS0_GRVW8_LPB32_LRVW16_OPLV0_PK0_PAP0_PGR2_PLR9_SU0_SUS0_SRVW0_TT1_32_WG32_8_1_WGM15
    SolutionIndex: 3
    SolutionNameMin: Cijk_Ailk_Bljk_I8II_BH_MT64x64x64_MI32x32x8x1_SE_1LDSB0_AF0EM8_EPS0_GRVW16_LPB16_LRVW16_OPLV0_PK0_PAP0_PGR2_PLR9_SU0_SUS0_SRVW4_TT1_32_WG64_4_1_WGM2
    SolutionIndex: 4
    SolutionNameMin: Cijk_Ailk_Bljk_I8II_BH_MT128x96x64_MI32x32x8x1_SE_1LDSB0_AF0EM8_EPS0_GRVW8_LPB16_LRVW16_OPLV0_PK0_PAP0_PGR2_PLR9_SU0_SUS0_SRVW4_TT1_96_WG128_2_1_WGM1
    SolutionIndex: 5
    SolutionNameMin: Cijk_Ailk_Bljk_I8II_BH_MT128x256x64_MI32x32x8x1_SE_1LDSB1_AF0EM8_EPS1_GRVW16_LPB16_LRVW16_OPLV0_PK0_PAP0_PGR1_PLR9_SU0_SUS0_SRVW4_TT1_256_WG128_2_1_WGM1
    SolutionIndex: 6
    SolutionNameMin: Cijk_Ailk_Bljk_I8II_BH_MT64x64x64_MI32x32x8x1_SE_1LDSB0_AF0EM8_EPS0_GRVW8_LPB16_LRVW16_OPLV0_PK0_PAP0_PGR2_PLR9_SU0_SUS0_SRVW4_TT1_32_WG64_4_1_WGM2
    SolutionIndex: 7
    SolutionNameMin: Cijk_Ailk_Bljk_I8II_BH_MT128x96x64_MI32x32x8x1_SE_1LDSB0_AF0EM8_EPS0_GRVW8_LPB16_LRVW16_OPLV0_PK0_PAP0_PGR2_PLR9_SU0_SUS0_SRVW4_TT1_96_WG128_2_1_WGM2
    SolutionIndex: 8
    SolutionNameMin: Cijk_Ailk_Bljk_I8II_BH_MT128x64x64_MI32x32x8x1_SE_1LDSB0_AF0EM8_EPS0_GRVW16_LPB16_LRVW16_OPLV0_PK0_PAP0_PGR2_PLR9_SU0_SUS0_SRVW4_TT1_64_WG128_2_1_WGM1
    SolutionIndex: 9
    SolutionNameMin: Cijk_Ailk_Bljk_I8II_BH_MT32x64x128_MI16x16x16x1_SE_1LDSB0_AF0EM8_EPS0_GRVW8_LPB32_LRVW16_OPLV0_PK0_PAP0_PGR2_PLR9_SU0_SUS0_SRVW0_TT1_32_WG32_8_1_WGM1
    SolutionIndex: 10
    SolutionNameMin: Cijk_Ailk_Bljk_I8II_BH_MT32x32x128_MI16x16x16x1_SE_1LDSB0_AF0EM8_EPS0_GRVW8_LPB32_LRVW16_OPLV0_PK0_PAP0_PGR2_PLR9_SU0_SUS0_SRVW0_TT1_16_WG32_8_1_WGM1
    SolutionIndex: 11
    SolutionNameMin: Cijk_Ailk_Bljk_I8II_BH_MT128x64x64_MI32x32x8x1_SE_1LDSB0_AF0EM8_EPS1_GRVW16_LPB16_LRVW16_OPLV0_PK0_PAP0_PGR1_PLR9_SU0_SUS0_SRVW4_TT1_64_WG128_2_1_WGM1
    SolutionIndex: 12
    SolutionNameMin: Cijk_Ailk_Bljk_I8II_BH_MT128x64x64_MI32x32x8x1_SE_1LDSB0_AF0EM8_EPS0_GRVW8_LPB16_LRVW16_OPLV0_PK0_PAP0_PGR2_PLR9_SU0_SUS0_SRVW4_TT1_64_WG128_2_1_WGM2
    SolutionIndex: 13
    SolutionNameMin: Cijk_Ailk_Bljk_I8II_BH_MT64x64x64_MI32x32x8x1_SE_1LDSB0_AF0EM8_EPS0_GRVW8_LPB16_LRVW16_OPLV0_PK0_PAP0_PGR2_PLR9_SU0_SUS0_SRVW4_TT1_32_WG64_4_1_WGM1
    SolutionIndex: 14
    SolutionNameMin: Cijk_Ailk_Bljk_I8II_BH_MT128x64x64_MI32x32x8x1_SE_1LDSB0_AF0EM8_EPS0_GRVW16_LPB16_LRVW16_OPLV0_PK0_PAP0_PGR2_PLR9_SU0_SUS0_SRVW4_TT1_64_WG128_2_1_WGM15
    SolutionIndex: 15
    SolutionNameMin: Cijk_Ailk_Bljk_I8II_BH_MT32x32x128_MI16x16x16x1_SE_1LDSB0_AF0EM8_EPS0_GRVW8_LPB32_LRVW16_OPLV0_PK0_PAP0_PGR2_PLR9_SU32_SUS128_SRVW0_TT1_16_WG32_8_1_WGM15
    SolutionIndex: 16
    SolutionNameMin: Cijk_Ailk_Bljk_I8II_BH_MT64x128x64_MI32x32x8x1_SE_1LDSB0_AF0EM8_EPS1_GRVW16_LPB16_LRVW16_OPLV0_PK0_PAP0_PGR1_PLR9_SU0_SUS0_SRVW4_TT1_64_WG64_4_1_WGM15
    SolutionIndex: 17
    SolutionNameMin: Cijk_Ailk_Bljk_I8II_BH_MT128x96x64_MI32x32x8x1_SE_1LDSB0_AF0EM8_EPS0_GRVW4_LPB16_LRVW16_OPLV0_PK0_PAP0_PGR2_PLR9_SU0_SUS0_SRVW4_TT1_96_WG128_2_1_WGM15
    SolutionIndex: 18
    SolutionNameMin: Cijk_Ailk_Bljk_I8II_BH_MT128x64x64_MI32x32x8x1_SE_1LDSB0_AF0EM8_EPS0_GRVW16_LPB16_LRVW16_OPLV0_PK0_PAP0_PGR2_PLR9_SU0_SUS0_SRVW4_TT1_64_WG128_2_1_WGM2
    SolutionIndex: 19
    SolutionNameMin: Cijk_Ailk_Bljk_I8II_BH_MT64x192x64_MI32x32x8x1_SE_1LDSB0_AF0EM8_EPS0_GRVW4_LPB16_LRVW16_OPLV0_PK0_PAP0_PGR2_PLR9_SU0_SUS0_SRVW4_TT1_96_WG64_4_1_WGM15
    SolutionIndex: 20
    SolutionNameMin: Cijk_Ailk_Bljk_I8II_BH_MT128x96x64_MI32x32x8x1_SE_1LDSB0_AF0EM8_EPS0_GRVW4_LPB16_LRVW16_OPLV0_PK0_PAP0_PGR2_PLR9_SU0_SUS0_SRVW4_TT1_96_WG128_2_1_WGM1
    SolutionIndex: 21
    SolutionNameMin: Cijk_Ailk_Bljk_I8II_BH_MT32x32x128_MI16x16x16x1_SE_1LDSB0_AF0EM8_EPS0_GRVW8_LPB32_LRVW16_OPLV0_PK0_PAP0_PGR2_PLR9_SU0_SUS0_SRVW0_TT1_16_WG32_8_1_WGM2
    SolutionIndex: 22
    SolutionNameMin: Cijk_Ailk_Bljk_I8II_BH_MT64x32x128_MI16x16x16x1_SE_1LDSB0_AF0EM8_EPS0_GRVW8_LPB32_LRVW16_OPLV0_PK0_PAP0_PGR2_PLR9_SU32_SUS256_SRVW0_TT2_16_WG32_8_1_WGM1
    SolutionIndex: 23
    SolutionNameMin: Cijk_Ailk_Bljk_I8II_BH_MT64x64x64_MI32x32x8x1_SE_1LDSB0_AF0EM8_EPS1_GRVW8_LPB16_LRVW16_OPLV0_PK0_PAP0_PGR1_PLR9_SU0_SUS0_SRVW4_TT1_32_WG64_4_1_WGM1
    SolutionIndex: 24
    SolutionNameMin: Cijk_Ailk_Bljk_I8II_BH_MT32x64x128_MI16x16x16x1_SE_1LDSB0_AF0EM8_EPS1_GRVW8_LPB32_LRVW16_OPLV0_PK0_PAP0_PGR1_PLR9_SU0_SUS0_SRVW0_TT1_32_WG32_8_1_WGM2
    SolutionIndex: 25
    SolutionNameMin: Cijk_Ailk_Bljk_I8II_BH_MT128x96x64_MI32x32x8x1_SE_1LDSB0_AF0EM8_EPS1_GRVW8_LPB16_LRVW16_OPLV0_PK0_PAP0_PGR1_PLR9_SU0_SUS0_SRVW4_TT1_96_WG128_2_1_WGM15
    SolutionIndex: 26
    SolutionNameMin: Cijk_Ailk_Bljk_I8II_BH_MT32x32x128_MI16x16x16x1_SE_1LDSB0_AF0EM8_EPS0_GRVW4_LPB32_LRVW16_OPLV0_PK0_PAP0_PGR2_PLR9_SU32_SUS256_SRVW4_TT1_16_WG32_8_1_WGM1
    SolutionIndex: 27
    SolutionNameMin: Cijk_Ailk_Bljk_I8II_BH_MT128x96x64_MI32x32x8x1_SE_1LDSB0_AF0EM8_EPS0_GRVW8_LPB16_LRVW16_OPLV0_PK0_PAP0_PGR2_PLR9_SU32_SUS128_SRVW4_TT1_96_WG128_2_1_WGM1
    SolutionIndex: 28
    SolutionNameMin: Cijk_Ailk_Bljk_I8II_BH_MT64x128x64_MI32x32x8x1_SE_1LDSB0_AF0EM8_EPS0_GRVW16_LPB16_LRVW16_OPLV0_PK0_PAP0_PGR2_PLR9_SU0_SUS0_SRVW4_TT1_64_WG64_4_1_WGM1
    SolutionIndex: 29
    SolutionNameMin: Cijk_Ailk_Bljk_I8II_BH_MT64x128x64_MI32x32x8x1_SE_1LDSB0_AF0EM8_EPS0_GRVW8_LPB16_LRVW16_OPLV0_PK0_PAP0_PGR2_PLR9_SU0_SUS0_SRVW4_TT1_64_WG64_4_1_WGM1
    SolutionIndex: 30
    SolutionNameMin: Cijk_Ailk_Bljk_I8II_BH_MT32x64x128_MI16x16x16x1_SE_1LDSB0_AF0EM8_EPS0_GRVW16_LPB32_LRVW16_OPLV0_PK0_PAP0_PGR2_PLR9_SU0_SUS0_SRVW0_TT1_32_WG32_8_1_WGM1
    SolutionIndex: 31
    SolutionNameMin: Cijk_Ailk_Bljk_I8II_BH_MT32x64x128_MI16x16x16x1_SE_1LDSB0_AF0EM8_EPS1_GRVW8_LPB32_LRVW16_OPLV0_PK0_PAP0_PGR1_PLR9_SU0_SUS0_SRVW0_TT1_32_WG32_8_1_WGM1
    SolutionIndex: 32
    SolutionNameMin: Cijk_Ailk_Bljk_I8II_BH_MT128x96x64_MI32x32x8x1_SE_1LDSB0_AF0EM8_EPS0_GRVW4_LPB16_LRVW16_OPLV0_PK0_PAP0_PGR2_PLR9_SU0_SUS0_SRVW4_TT1_96_WG128_2_1_WGM2
    SolutionIndex: 33
    SolutionNameMin: Cijk_Ailk_Bljk_I8II_BH_MT32x64x128_MI16x16x16x1_SE_1LDSB0_AF0EM8_EPS0_GRVW8_LPB32_LRVW16_OPLV0_PK0_PAP0_PGR2_PLR9_SU32_SUS128_SRVW0_TT1_32_WG32_8_1_WGM1
    SolutionIndex: 34
    SolutionNameMin: Cijk_Ailk_Bljk_I8II_BH_MT64x64x128_MI32x32x8x1_SE_1LDSB0_AF0EM8_EPS0_GRVW8_LPB16_LRVW16_OPLV0_PK0_PAP0_PGR2_PLR17_SU0_SUS0_SRVW4_TT1_32_WG64_4_1_WGM2
    SolutionIndex: 35
    SolutionNameMin: Cijk_Ailk_Bljk_I8II_BH_MT64x64x64_MI32x32x8x1_SE_GRVW8_LBSPP128_LPA8_NTD0_NEPBS4_TT1_32_VW4_WG64_4_1_WGM1
    SolutionIndex: 36
    SolutionNameMin: Cijk_Ailk_Bljk_I8II_BH_MT128x64x64_MI32x32x8x1_SE_GRVW16_LBSPP128_LPA0_NTD3_NEPBS1_TT1_64_VW8_WG128_2_1_WGM1
    SolutionIndex: 37
    SolutionNameMin: Cijk_Ailk_Bljk_I8II_BH_MT64x64x64_MI32x32x8x1_SE_GRVW16_LBSPP64_LPA0_NTD3_NEPBS4_TT1_32_VW8_WG64_4_1_WGM1
    SolutionIndex: 38
    SolutionNameMin: Cijk_Ailk_Bljk_I8II_BH_MT128x64x64_MI32x32x8x1_SN_GRVW16_LBSPP128_LPA0_NTD3_NEPBS1_TT1_64_VW2_WG128_2_1_WGM1
    SolutionIndex: 39
    SolutionNameMin: Cijk_Ailk_Bljk_I8II_BH_MT128x256x64_MI32x32x8x1_SE_LBSPP128_LPA0_NTD0_SU32_SUM0_SUS128_VW4_WGM1
    SolutionIndex: 40
    SolutionNameMin: Cijk_Ailk_Bljk_I8II_BH_MT128x256x64_MI32x32x8x1_SE_LBSPP128_LPA0_NTD0_SU0_SUM0_SUS0_VW4_WGM1
    SolutionIndex: 41
    SolutionNameMin: Cijk_Ailk_Bljk_I8II_BH_MT128x256x64_MI32x32x8x1_SE_LBSPP128_LPA0_NTD0_SU32_SUM0_SUS128_VW4_WGM8
    SolutionIndex: 42
    SolutionNameMin: Cijk_Ailk_Bljk_I8II_BH_MT128x256x64_MI32x32x8x1_SE_LBSPP128_LPA16_NTD0_SU32_SUM1_SUS256_VW4_WGM1
    SolutionIndex: 43
    SolutionNameMin: Cijk_Ailk_Bljk_I8II_BH_MT128x256x64_MI32x32x8x1_SE_LBSPP128_LPA0_NTD3_SU32_SUM0_SUS128_VW4_WGM8
    SolutionIndex: 44
    SolutionNameMin: Cijk_Ailk_Bljk_I8II_BH_MT128x256x64_MI32x32x8x1_SE_LBSPP128_LPA16_NTD0_SU32_SUM0_SUS256_VW8_WGM1
    SolutionIndex: 45
    SolutionNameMin: Cijk_Ailk_Bljk_I8II_BH_MT128x256x64_MI32x32x8x1_SE_LBSPP128_LPA0_NTD3_SU32_SUM0_SUS256_VW4_WGM1
    SolutionIndex: 46
    SolutionNameMin: Cijk_Ailk_Bljk_I8II_BH_MT128x256x64_MI32x32x8x1_SE_LBSPP128_LPA8_NTD3_SU32_SUM0_SUS128_VW4_WGM8
    SolutionIndex: 47
    SolutionNameMin: Cijk_Ailk_Bljk_I8II_BH_MT128x256x64_MI32x32x8x1_SE_LBSPP128_LPA16_NTD0_SU32_SUM0_SUS256_VW4_WGM1
    SolutionIndex: 48
    SolutionNameMin: Cijk_Ailk_Bljk_I8II_BH_MT128x256x64_MI32x32x8x1_SE_LBSPP128_LPA0_NTD3_SU32_SUM0_SUS128_VW8_WGM8
    SolutionIndex: 49
    SolutionNameMin: Cijk_Ailk_Bljk_I8II_BH_MT128x256x64_MI32x32x8x1_SE_LBSPP128_LPA8_NTD3_SU32_SUM0_SUS256_VW8_WGM1
    SolutionIndex: 50
    SolutionNameMin: Cijk_Ailk_Bljk_I8II_BH_MT128x256x64_MI32x32x8x1_SE_LBSPP128_LPA0_NTD0_SU32_SUM0_SUS256_VW8_WGM1
    SolutionIndex: 51
    SolutionNameMin: Cijk_Ailk_Bljk_I8II_BH_MT128x256x64_MI32x32x8x1_SE_LBSPP128_LPA8_NTD0_SU32_SUM0_SUS128_VW4_WGM1
    SolutionIndex: 52
    SolutionNameMin: Cijk_Ailk_Bljk_I8II_BH_MT128x256x64_MI32x32x8x1_SE_LBSPP128_LPA16_NTD0_NEPBS1_SU0_SUM0_SUS0_VW8_WGM1
    SolutionIndex: 53
    SolutionNameMin: Cijk_Ailk_Bljk_I8II_BH_MT128x256x64_MI32x32x8x1_SE_LBSPP128_LPA0_NTD0_NEPBS4_SU32_SUM2_SUS256_VW4_WGM1
    SolutionIndex: 54
    SolutionNameMin: Cijk_Ailk_Bljk_I8II_BH_MT128x256x64_MI32x32x8x1_SE_LBSPP128_LPA16_NTD0_NEPBS4_SU32_SUM2_SUS128_VW4_WGM1
    SolutionIndex: 55
    SolutionNameMin: Cijk_Ailk_Bljk_I8II_BH_MT128x256x64_MI32x32x8x1_SE_LBSPP128_LPA8_NTD0_NEPBS4_SU32_SUM4_SUS256_VW8_WGM1
    SolutionIndex: 56
    SolutionNameMin: Cijk_Ailk_Bljk_I8II_BH_MT128x256x64_MI32x32x8x1_SE_LBSPP128_LPA0_NTD0_NEPBS1_SU32_SUM0_SUS128_VW4_WGM8
    SolutionIndex: 57
    SolutionNameMin: Cijk_Ailk_Bljk_I8II_BH_MT128x256x64_MI32x32x8x1_SE_LBSPP0_LPA0_NTD0_NEPBS1_SU32_SUM0_SUS128_VW4_WGM8
    SolutionIndex: 58
    SolutionNameMin: Cijk_Ailk_Bljk_I8II_BH_MT128x256x64_MI32x32x8x1_SE_LBSPP128_LPA0_NTD3_NEPBS4_SU32_SUM0_SUS256_VW8_WGM1
    SolutionIndex: 59
    SolutionNameMin: Cijk_Ailk_Bljk_I8II_BH_MT128x256x64_MI32x32x8x1_SE_LBSPP128_LPA16_NTD3_NEPBS4_SU32_SUM0_SUS256_VW8_WGM1
    SolutionIndex: 60
    SolutionNameMin: Cijk_Ailk_Bljk_I8II_BH_MT128x256x64_MI32x32x8x1_SE_LBSPP0_LPA0_NTD3_NEPBS1_SU32_SUM0_SUS128_VW4_WGM8
    SolutionIndex: 61
    SolutionNameMin: Cijk_Ailk_Bljk_I8II_BH_MT128x256x64_MI32x32x8x1_SE_LBSPP128_LPA16_NTD3_NEPBS4_SU32_SUM0_SUS256_VW4_WGM1
    SolutionIndex: 62
    SolutionNameMin: Cijk_Ailk_Bljk_I8II_BH_MT128x256x64_MI32x32x8x1_SE_LBSPP64_LPA0_NTD0_NEPBS4_SU32_SUM0_SUS256_VW4_WGM1
    SolutionIndex: 63
    SolutionNameMin: Cijk_Ailk_Bljk_I8II_BH_MT128x256x64_MI32x32x8x1_SE_LBSPP128_LPA16_NTD0_NEPBS4_SU32_SUM0_SUS128_VW4_WGM1
    SolutionIndex: 64
    SolutionNameMin: Cijk_Ailk_Bljk_I8II_BH_MT128x256x64_MI32x32x8x1_SE_LBSPP0_LPA0_NTD0_NEPBS1_SU32_SUM0_SUS128_VW8_WGM8
    SolutionIndex: 65
    SolutionNameMin: Cijk_Ailk_Bljk_I8II_BH_MT128x256x64_MI32x32x8x1_SE_LBSPP64_LPA8_NTD3_NEPBS1_SU32_SUM0_SUS128_VW8_WGM8
    SolutionIndex: 66
    SolutionNameMin: Cijk_Ailk_Bljk_I8II_BH_MT128x256x64_MI32x32x8x1_SE_LBSPP128_LPA16_NTD0_NEPBS4_SU32_SUM0_SUS128_VW8_WGM1
- - - [35, 35, 1, 512]
    - [0, 0.027]
  - - [4, 64, 1, 128]
    - [1, 0.003]
  - - [480, 512, 1, 512]
    - [2, 8.489]
  - - [960, 1024, 1, 1024]
    - [3, 30.651]
  - - [1920, 2048, 1, 2048]
    - [4, 64.484]
  - - [3840, 4096, 1, 4096]
    - [4, 75.294]
  - - [7680, 8192, 1, 8192]
    - [5, 79.773]
  - - [704, 1024, 1, 128]
    - [6, 6.339]
  - - [1024, 1024, 1, 3328]
    - [7, 48.901]
  - - [1856, 448, 1, 3328]
    - [3, 52.931]
  - - [2944, 4288, 1, 1280]
    - [8, 63.19]
  - - [2368, 64, 1, 3328]
    - [9, 18.155]
  - - [1760, 32, 1, 1760]
    - [10, 4.793]
  - - [2368, 5888, 1, 256]
    - [11, 31.689]
  - - [5888, 1856, 1, 256]
    - [12, 30.104]
  - - [64, 3584, 1, 1280]
    - [9, 15.603]
  - - [512, 24000, 1, 1536]
    - [12, 66.535]
  - - [128, 6784, 1, 3328]
    - [13, 55.091]
  - - [5888, 1408, 1, 256]
    - [8, 29.303]
  - - [5888, 1856, 1, 3328]
    - [14, 70.379]
  - - [512, 4, 1, 512]
    - [15, 0.078]
  - - [1856, 4288, 1, 256]
    - [11, 28.693]
  - - [1024, 5056, 1, 128]
    - [11, 16.057]
  - - [5056, 5056, 1, 3328]
    - [14, 73.419]
  - - [1408, 5888, 1, 1280]
    - [8, 60.811]
  - - [2368, 448, 1, 128]
    - [16, 7.845]
  - - [6144, 6000, 1, 2560]
    - [17, 73.317]
  - - [2368, 6784, 1, 128]
    - [11, 18.001]
  - - [1024, 3584, 1, 3328]
    - [4, 67.027]
  - - [512, 48000, 1, 2048]
    - [5, 72.237]
  - - [1408, 64, 1, 128]
    - [10, 1.181]
  - - [256, 4288, 1, 3328]
    - [7, 50.689]
  - - [5888, 1408, 1, 1280]
    - [18, 59.897]
  - - [704, 1856, 1, 3328]
    - [19, 58.254]
  - - [1408, 4288, 1, 256]
    - [12, 27.728]
  - - [1024, 2368, 1, 256]
    - [20, 22.561]
  - - [64, 4, 1, 256]
    - [21, 0.009]
  - - [1408, 1856, 1, 1280]
    - [12, 55.257]
  - - [1408, 64, 1, 1280]
    - [10, 7.426]
  - - [448, 1024, 1, 1280]
    - [3, 23.377]
  - - [4096, 32, 1, 4096]
    - [22, 14.034]
  - - [256, 1408, 1, 3328]
    - [6, 33.125]
  - - [5056, 5056, 1, 1280]
    - [7, 66.173]
  - - [448, 5056, 1, 256]
    - [17, 21.211]
  - - [704, 1856, 1, 1280]
    - [12, 40.435]
  - - [128, 5056, 1, 128]
    - [23, 5.797]
  - - [2368, 128, 1, 256]
    - [24, 5.988]
  - - [1856, 1408, 1, 128]
    - [3, 12.52]
  - - [64, 5056, 1, 256]
    - [24, 6.437]
  - - [6784, 256, 1, 3328]
    - [12, 64.536]
  - - [1408, 3584, 1, 256]
    - [12, 27.103]
  - - [4288, 448, 1, 256]
    - [25, 18.975]
  - - [64, 704, 1, 128]
    - [26, 0.613]
  - - [1024, 1856, 1, 128]
    - [27, 10.382]
  - - [4288, 2944, 1, 1280]
    - [18, 62.863]
  - - [704, 5056, 1, 1280]
    - [28, 56.594]
  - - [2368, 704, 1, 3328]
    - [12, 63.138]
  - - [256, 5888, 1, 256]
    - [29, 19.409]
  - - [1856, 4288, 1, 3328]
    - [28, 71.286]
  - - [256, 2944, 1, 256]
    - [6, 12.076]
  - - [5888, 1024, 1, 256]
    - [28, 27.129]
  - - [448, 64, 1, 1280]
    - [21, 2.521]
  - - [3072, 64, 1, 1024]
    - [9, 12.327]
  - - [3584, 4, 1, 1280]
    - [30, 0.966]
  - - [2560, 16, 1, 2560]
    - [21, 5.159]
  - - [2944, 64, 1, 256]
    - [31, 3.882]
  - - [128, 4, 1, 1280]
    - [21, 0.054]
  - - [1408, 2944, 1, 256]
    - [29, 24.701]
  - - [256, 1856, 1, 1280]
    - [3, 24.127]
  - - [6784, 5056, 1, 3328]
    - [5, 75.754]
  - - [5056, 5056, 1, 256]
    - [32, 34.325]
  - - [128, 256, 1, 256]
    - [26, 0.829]
  - - [64, 1024, 1, 1280]
    - [10, 5.559]
  - - [2944, 4, 1, 256]
    - [10, 0.288]
  - - [704, 5056, 1, 128]
    - [29, 14.459]
  - - [2368, 2944, 1, 1280]
    - [8, 61.153]
  - - [448, 448, 1, 3328]
    - [33, 23.815]
  - - [6784, 6784, 1, 1280]
    - [5, 69.027]
  - - [1024, 256, 1, 3328]
    - [3, 24.947]
  - - [1408, 4288, 1, 1280]
    - [12, 60.632]
  - - [3584, 4288, 1, 1280]
    - [18, 64.128]
  - - [512, 6000, 1, 2560]
    - [12, 59.908]
  - - [2368, 704, 1, 1280]
    - [12, 49.671]
  - - [5056, 4288, 1, 3328]
    - [14, 72.827]
  - - [3584, 2368, 1, 3328]
    - [14, 70.153]
  - - [5888, 6784, 1, 1280]
    - [5, 68.041]
  - - [64, 704, 1, 1280]
    - [21, 3.734]
  - - [4288, 256, 1, 256]
    - [28, 14.658]
  - - [2944, 128, 1, 128]
    - [33, 4.213]
  - - [6144, 32, 1, 2560]
    - [22, 17.183]
  - - [6784, 448, 1, 1280]
    - [8, 51.382]
  - - [2944, 5888, 1, 256]
    - [8, 32.849]
  - - [64, 64, 1, 1280]
    - [21, 0.419]
  - - [4288, 2944, 1, 256]
    - [12, 30.987]
  - - [5888, 704, 1, 1280]
    - [12, 56.447]
  - - [5056, 4, 1, 3328]
    - [22, 1.975]
  - - [1856, 64, 1, 1280]
    - [2, 8.565]
  - - [1760, 16, 1, 1760]
    - [10, 2.438]
  - - [448, 5888, 1, 128]
    - [6, 12.68]
  - - [5888, 64, 1, 3328]
    - [34, 35.147]
  - - [2944, 256, 1, 3328]
    - [13, 48.805]
  - - [1024, 64, 1, 128]
    - [21, 0.867]
  - - [5056, 2368, 1, 1280]
    - [18, 62.603]
  - - [448, 3584, 1, 1280]
    - [28, 47.352]
  - - [6784, 5888, 1, 256]
    - [20, 36.412]
  - - [64, 1024, 1, 3328]
    - [21, 9.829]
  - - [704, 128, 1, 1280]
    - [10, 7.599]
  - - [1024, 1024, 1, 1024]
    - [35, 30.395]
  - - [2048, 2048, 1, 1024]
    - [36, 54.247]
  - - [1024, 1024, 1, 2048]
    - [37, 41.217]
  - - [2048, 2048, 1, 2048]
    - [38, 65.478]
  - - [4096, 4096, 1, 1024]
    - [39, 65.213]
  - - [8192, 8192, 1, 1024]
    - [40, 73.177]
  - - [12288, 12288, 1, 1024]
    - [41, 74.275]
  - - [16384, 16384, 1, 1024]
    - [42, 74.774]
  - - [20480, 20480, 1, 1024]
    - [43, 76.451]
  - - [24576, 24576, 1, 1024]
    - [44, 74.636]
  - - [28672, 28672, 1, 1024]
    - [43, 77.166]
  - - [32768, 32768, 1, 1024]
    - [45, 72.842]
  - - [36864, 36864, 1, 1024]
    - [46, 77.226]
  - - [40960, 40960, 1, 1024]
    - [44, 75.922]
  - - [45056, 45056, 1, 1024]
    - [43, 77.36]
  - - [49152, 49152, 1, 1024]
    - [47, 76.0]
  - - [53248, 53248, 1, 1024]
    - [48, 77.384]
  - - [57344, 57344, 1, 1024]
    - [49, 76.657]
  - - [61440, 61440, 1, 1024]
    - [43, 77.132]
  - - [65536, 65536, 1, 1024]
    - [50, 70.23]
  - - [69632, 69632, 1, 1024]
    - [48, 77.141]
  - - [73728, 73728, 1, 1024]
    - [51, 75.777]
  - - [77824, 77824, 1, 1024]
    - [48, 76.649]
  - - [81920, 81920, 1, 1024]
    - [39, 75.223]
  - - [86016, 86016, 1, 1024]
    - [48, 75.57]
  - - [90112, 90112, 1, 1024]
    - [39, 73.683]
  - - [4096, 4096, 1, 2048]
    - [52, 71.913]
  - - [8192, 8192, 1, 2048]
    - [53, 78.302]
  - - [12288, 12288, 1, 2048]
    - [54, 79.715]
  - - [16384, 16384, 1, 2048]
    - [55, 79.759]
  - - [20480, 20480, 1, 2048]
    - [56, 80.874]
  - - [24576, 24576, 1, 2048]
    - [50, 80.14]
  - - [28672, 28672, 1, 2048]
    - [57, 81.478]
  - - [32768, 32768, 1, 2048]
    - [58, 79.444]
  - - [36864, 36864, 1, 2048]
    - [57, 81.743]
  - - [40960, 40960, 1, 2048]
    - [50, 80.582]
  - - [45056, 45056, 1, 2048]
    - [57, 81.651]
  - - [49152, 49152, 1, 2048]
    - [59, 80.182]
  - - [53248, 53248, 1, 2048]
    - [60, 81.663]
  - - [57344, 57344, 1, 2048]
    - [61, 80.837]
  - - [61440, 61440, 1, 2048]
    - [57, 81.505]
  - - [65536, 65536, 1, 2048]
    - [62, 77.523]
  - - [69632, 69632, 1, 2048]
    - [57, 81.316]
  - - [73728, 73728, 1, 2048]
    - [63, 80.411]
  - - [77824, 77824, 1, 2048]
    - [64, 81.155]
  - - [81920, 81920, 1, 2048]
    - [51, 80.039]
  - - [86016, 86016, 1, 2048]
    - [65, 80.631]
  - - [90112, 90112, 1, 2048]
    - [66, 79.07]
- null
