library/src/blas3/Tensile/Logic/asm_full/aldebaran/aldebaran_Cijk_AlikC_Bljk_CB.yaml
- {MinimumRequiredVersion: 4.21.0}
- aldebaran
- gfx90a
- [Device 0050, Device 0051, Device 0052, Device 0054, Device 0062, Device 7400, Device
    SolutionIndex: 0
    SolutionNameMin: Cijk_AlikC_Bljk_CB_MT32x32x16_MI16x16x4x1_SE_1LDSB0_IU4_SIA2_SRVW0
    SolutionIndex: 1
    SolutionNameMin: Cijk_AlikC_Bljk_CB_MT128x64x16_MI32x32x2x1_SE_1LDSB0_IU1_SIA3_SRVW2
    SolutionIndex: 2
    SolutionNameMin: Cijk_AlikC_Bljk_CB_MT64x64x8_MI16x16x4x1_SE_1LDSB1_IU2_SIA2_SRVW2
    SolutionIndex: 3
    SolutionNameMin: Cijk_AlikC_Bljk_CB_MT128x64x16_MI16x16x4x1_SE_1LDSB1_IU4_SIA2_SRVW2
    SolutionIndex: 4
    SolutionNameMin: Cijk_AlikC_Bljk_CB_MT128x64x16_MI16x16x4x1_SE_1LDSB1_IU4_SIA2_SRVW2
    SolutionIndex: 5
    SolutionNameMin: Cijk_AlikC_Bljk_CB_MT64x64x8_MI16x16x4x1_SE_1LDSB0_IU2_SIA2_SRVW0
    SolutionIndex: 6
    SolutionNameMin: Cijk_AlikC_Bljk_CB_MT64x64x16_MI16x16x4x1_SE_1LDSB0_IU1_SIA3_SRVW0
    SolutionIndex: 7
    SolutionNameMin: Cijk_AlikC_Bljk_CB_MT64x64x16_MI16x16x4x1_SE_1LDSB1_IU4_SIA2_SRVW0
    SolutionIndex: 8
    SolutionNameMin: Cijk_AlikC_Bljk_CB_MT64x64x16_MI16x16x4x1_SN_LRVW2_NEPBS0_PLR5_SU32_SUS256_TT2_32_WG32_8_1_WGM4
    SolutionIndex: 9
    SolutionNameMin: Cijk_AlikC_Bljk_CB_MT256x64x8_MI32x32x2x1_SN_LRVW2_NEPBS0_PLR5_SU0_SUS0_TT2_64_WG128_2_1_WGM8
    SolutionIndex: 10
    SolutionNameMin: Cijk_AlikC_Bljk_CB_MT256x64x8_MI32x32x2x1_SN_LRVW2_NEPBS0_PLR5_SU32_SUS256_TT2_64_WG128_2_1_WGM2
    SolutionIndex: 11
    SolutionNameMin: Cijk_AlikC_Bljk_CB_MT256x64x8_MI32x32x2x1_SN_LRVW2_NEPBS0_PLR5_SU0_SUS0_TT2_64_WG128_2_1_WGM2
    SolutionIndex: 12
    SolutionNameMin: Cijk_AlikC_Bljk_CB_MT256x64x8_MI32x32x2x1_SN_LRVW2_NEPBS0_PLR5_SU32_SUS256_TT2_64_WG128_2_1_WGM12
    SolutionIndex: 13
    SolutionNameMin: Cijk_AlikC_Bljk_CB_MT256x64x8_MI32x32x2x1_SN_LRVW2_NEPBS0_PLR5_SU0_SUS0_TT2_64_WG128_2_1_WGM10
    SolutionIndex: 14
    SolutionNameMin: Cijk_AlikC_Bljk_CB_MT256x64x8_MI32x32x2x1_SN_LRVW2_NEPBS0_PLR5_SU0_SUS0_TT2_64_WG128_2_1_WGM12
    SolutionIndex: 15
    SolutionNameMin: Cijk_AlikC_Bljk_CB_MT64x64x16_MI16x16x4x1_SN_LRVW2_NEPBS0_PLR5_SU32_SUS256_TT2_32_WG32_8_1_WGM2
    SolutionIndex: 16
    SolutionNameMin: Cijk_AlikC_Bljk_CB_MT64x64x16_MI16x16x4x1_SN_LRVW2_NEPBS0_PLR5_SU0_SUS0_TT2_32_WG32_8_1_WGM5
    SolutionIndex: 17
    SolutionNameMin: Cijk_AlikC_Bljk_CB_MT128x64x8_MI16x16x4x1_SN_LRVW1_NEPBS0_PLR1_SU0_SUS0_TT2_64_WG64_4_1_WGM2
    SolutionIndex: 18
    SolutionNameMin: Cijk_AlikC_Bljk_CB_MT128x64x8_MI16x16x4x1_SN_LRVW1_NEPBS0_PLR1_SU0_SUS0_TT2_64_WG64_4_1_WGM7
    SolutionIndex: 19
    SolutionNameMin: Cijk_AlikC_Bljk_CB_MT128x64x8_MI16x16x4x1_SN_LRVW1_NEPBS0_PLR1_SU0_SUS0_TT2_64_WG64_4_1_WGM8
    SolutionIndex: 20
    SolutionNameMin: Cijk_AlikC_Bljk_CB_MT128x64x8_MI16x16x4x1_SN_LRVW1_NEPBS1_PLR1_SU0_SUS0_TT2_64_WG64_4_1_WGM10
    SolutionIndex: 21
    SolutionNameMin: Cijk_AlikC_Bljk_CB_MT128x64x8_MI16x16x4x1_SN_LRVW1_NEPBS1_PLR1_SU32_SUS256_TT2_64_WG64_4_1_WGM12
    SolutionIndex: 22
    SolutionNameMin: Cijk_AlikC_Bljk_CB_MT128x64x8_MI16x16x4x1_SN_LRVW1_NEPBS0_PLR1_SU0_SUS0_TT2_64_WG64_4_1_WGM12
    SolutionIndex: 23
    SolutionNameMin: Cijk_AlikC_Bljk_CB_MT128x64x8_MI16x16x4x1_SN_LRVW1_NEPBS1_PLR1_SU0_SUS0_TT2_64_WG64_4_1_WGM12
    SolutionIndex: 24
    SolutionNameMin: Cijk_AlikC_Bljk_CB_MT128x64x8_MI16x16x4x1_SN_LRVW1_NEPBS1_PLR1_SU32_SUS256_TT2_64_WG64_4_1_WGM10
    SolutionIndex: 25
    SolutionNameMin: Cijk_AlikC_Bljk_CB_MT128x64x8_MI16x16x4x1_SN_LRVW1_NEPBS0_PLR1_SU0_SUS0_TT2_64_WG64_4_1_WGM4
    SolutionIndex: 26
    SolutionNameMin: Cijk_AlikC_Bljk_CB_MT64x64x16_MI16x16x4x1_SN_LRVW2_NEPBS1_PLR5_SU0_SUS0_TT2_32_WG32_8_1_WGM8
    SolutionIndex: 27
    SolutionNameMin: Cijk_AlikC_Bljk_CB_MT64x64x16_MI16x16x4x1_SN_LRVW2_NEPBS1_PLR5_SU0_SUS0_TT2_32_WG32_8_1_WGM5
    SolutionIndex: 28
    SolutionNameMin: Cijk_AlikC_Bljk_CB_MT64x64x16_MI16x16x4x1_SN_LRVW2_NEPBS1_PLR5_SU0_SUS0_TT2_32_WG32_8_1_WGM12
    SolutionIndex: 29
    SolutionNameMin: Cijk_AlikC_Bljk_CB_MT128x64x8_MI16x16x4x1_SN_LRVW1_NEPBS1_PLR1_SU0_SUS0_TT2_64_WG64_4_1_WGM7
    SolutionIndex: 30
    SolutionNameMin: Cijk_AlikC_Bljk_CB_MT64x64x16_MI16x16x4x1_SN_LRVW2_NEPBS1_PLR5_SU0_SUS0_TT2_32_WG32_8_1_WGM7
    SolutionIndex: 31
    SolutionNameMin: Cijk_AlikC_Bljk_CB_MT128x64x8_MI16x16x4x1_SN_LRVW1_NEPBS0_PLR1_SU32_SUS256_TT2_64_WG64_4_1_WGM2
    SolutionIndex: 32
    SolutionNameMin: Cijk_AlikC_Bljk_CB_MT64x64x16_MI16x16x4x1_SN_LRVW2_NEPBS1_PLR5_SU0_SUS0_TT2_32_WG32_8_1_WGM6
    SolutionIndex: 33
    SolutionNameMin: Cijk_AlikC_Bljk_CB_MT64x64x16_MI16x16x4x1_SN_LRVW2_NEPBS1_PLR5_SU0_SUS0_TT2_32_WG32_8_1_WGM10
    SolutionIndex: 34
    SolutionNameMin: Cijk_AlikC_Bljk_CB_MT128x64x8_MI16x16x4x1_SN_LRVW1_NEPBS1_PLR1_SU0_SUS0_TT2_64_WG64_4_1_WGM6
    SolutionIndex: 35
    SolutionNameMin: Cijk_AlikC_Bljk_CB_MT64x64x16_MI16x16x4x1_SN_LRVW2_NEPBS1_PLR5_SU32_SUS256_TT2_32_WG32_8_1_WGM7
    SolutionIndex: 36
    SolutionNameMin: Cijk_AlikC_Bljk_CB_MT64x64x16_MI16x16x4x1_SN_LRVW2_NEPBS1_PLR5_SU32_SUS256_TT2_32_WG32_8_1_WGM8
    SolutionIndex: 37
    SolutionNameMin: Cijk_AlikC_Bljk_CB_MT128x64x8_MI16x16x4x1_SN_LRVW1_NEPBS1_PLR1_SU32_SUS256_TT2_64_WG64_4_1_WGM6
    SolutionIndex: 38
    SolutionNameMin: Cijk_AlikC_Bljk_CB_MT128x64x16_MI16x16x4x1_SN_LRVW2_NEPBS0_PLR5_SU32_SUS256_TT2_64_WG64_4_1_WGM7
    SolutionIndex: 39
    SolutionNameMin: Cijk_AlikC_Bljk_CB_MT64x64x16_MI16x16x4x1_SN_LRVW2_NEPBS1_PLR5_SU0_SUS0_TT2_32_WG32_8_1_WGM4
    SolutionIndex: 40
    SolutionNameMin: Cijk_AlikC_Bljk_CB_MT128x64x8_MI16x16x4x1_SN_LRVW1_PLR1_WG64_4_1_WGM8
    SolutionIndex: 41
    SolutionNameMin: Cijk_AlikC_Bljk_CB_MT128x64x8_MI16x16x4x1_SN_LRVW1_PLR1_WG64_4_1_WGM7
    SolutionIndex: 42
    SolutionNameMin: Cijk_AlikC_Bljk_CB_MT128x64x16_MI16x16x4x1_SN_LRVW2_PLR5_WG64_4_1_WGM7
    SolutionIndex: 43
    SolutionNameMin: Cijk_AlikC_Bljk_CB_MT128x64x8_MI16x16x4x1_SN_LRVW1_PLR1_WG64_4_1_WGM5
    SolutionIndex: 44
    SolutionNameMin: Cijk_AlikC_Bljk_CB_MT256x64x8_MI32x32x2x1_SN_LRVW2_PLR5_WG128_2_1_WGM6
    SolutionIndex: 45
    SolutionNameMin: Cijk_AlikC_Bljk_CB_MT256x64x8_MI32x32x2x1_SN_LRVW2_PLR5_WG128_2_1_WGM8
    SolutionIndex: 46
    SolutionNameMin: Cijk_AlikC_Bljk_CB_MT256x64x8_MI32x32x2x1_SN_LRVW2_PLR5_WG128_2_1_WGM7
    SolutionIndex: 47
    SolutionNameMin: Cijk_AlikC_Bljk_CB_MT128x64x16_MI16x16x4x1_SN_LRVW2_PLR5_WG64_4_1_WGM6
    SolutionIndex: 48
    SolutionNameMin: Cijk_AlikC_Bljk_CB_MT128x64x8_MI16x16x4x1_SN_LRVW1_PLR1_WG64_4_1_WGM4
    SolutionIndex: 49
    SolutionNameMin: Cijk_AlikC_Bljk_CB_MT128x64x16_MI16x16x4x1_SN_LRVW2_PLR5_WG64_4_1_WGM5
- - - [7680, 8192, 1, 8192]
    - [1, 98.561]
  - - [64, 1, 1, 256]
    - [5, 0.012]
  - - [960, 1024, 1, 1024]
    - [2, 93.853]
  - - [1920, 2048, 1, 2048]
    - [4, 97.423]
  - - [3840, 4096, 1, 4096]
    - [3, 98.345]
  - - [480, 512, 1, 512]
    - [0, 66.578]
  - - [1, 1, 1, 256]
    - [5, 0.0]
  - - [64, 64, 2, 64]
    - [7, 0.551]
  - - [1, 64, 1, 256]
    - [5, 0.012]
  - - [64, 64, 1, 256]
    - [6, 0.503]
  - - [2001, 2001, 1, 51]
    - [8, 43.211]
  - - [3001, 3001, 1, 51]
    - [9, 53.528]
  - - [4454, 4454, 1, 51]
    - [9, 66.77]
  - - [6454, 6454, 1, 51]
    - [10, 74.509]
  - - [7985, 7985, 1, 51]
    - [11, 73.763]
  - - [9603, 9603, 1, 51]
    - [11, 73.188]
  - - [11505, 11505, 1, 51]
    - [11, 69.881]
  - - [13179, 13179, 1, 51]
    - [12, 72.149]
  - - [15420, 15420, 1, 51]
    - [13, 80.742]
  - - [17445, 17445, 1, 51]
    - [13, 71.174]
  - - [19343, 19343, 1, 51]
    - [14, 70.426]
  - - [21581, 21581, 1, 51]
    - [12, 71.039]
  - - [25854, 25854, 1, 51]
    - [14, 72.954]
  - - [30421, 30421, 1, 51]
    - [14, 69.728]
  - - [35882, 35882, 1, 51]
    - [14, 74.181]
  - - [40401, 40401, 1, 51]
    - [12, 70.711]
  - - [45312, 45312, 1, 51]
    - [14, 86.397]
  - - [51821, 51821, 1, 51]
    - [14, 70.532]
  - - [60766, 60766, 1, 51]
    - [14, 74.608]
  - - [67143, 67143, 1, 51]
    - [14, 71.463]
  - - [2001, 2001, 1, 103]
    - [15, 70.08]
  - - [3001, 3001, 1, 103]
    - [16, 80.684]
  - - [4454, 4454, 1, 103]
    - [17, 89.312]
  - - [6454, 6454, 1, 103]
    - [18, 91.797]
  - - [7985, 7985, 1, 103]
    - [19, 92.867]
  - - [9603, 9603, 1, 103]
    - [20, 93.31]
  - - [11505, 11505, 1, 103]
    - [40, 94.868]
  - - [13179, 13179, 1, 103]
    - [21, 95.182]
  - - [15420, 15420, 1, 103]
    - [22, 95.848]
  - - [17445, 17445, 1, 103]
    - [23, 95.625]
  - - [19343, 19343, 1, 103]
    - [23, 95.748]
  - - [21581, 21581, 1, 103]
    - [24, 96.075]
  - - [25854, 25854, 1, 103]
    - [22, 96.604]
  - - [30421, 30421, 1, 103]
    - [21, 96.529]
  - - [35882, 35882, 1, 103]
    - [23, 96.564]
  - - [40401, 40401, 1, 103]
    - [21, 96.668]
  - - [45312, 45312, 1, 103]
    - [23, 97.128]
  - - [51821, 51821, 1, 103]
    - [24, 96.761]
  - - [60766, 60766, 1, 103]
    - [20, 96.843]
  - - [67143, 67143, 1, 103]
    - [23, 96.847]
  - - [2001, 2001, 1, 223]
    - [25, 79.439]
  - - [3001, 3001, 1, 223]
    - [26, 89.927]
  - - [4454, 4454, 1, 223]
    - [27, 93.583]
  - - [6454, 6454, 1, 223]
    - [28, 95.71]
  - - [7985, 7985, 1, 223]
    - [26, 96.193]
  - - [9603, 9603, 1, 223]
    - [26, 95.42]
  - - [11505, 11505, 1, 223]
    - [29, 96.682]
  - - [13179, 13179, 1, 223]
    - [29, 97.084]
  - - [15420, 15420, 1, 223]
    - [30, 97.127]
  - - [17445, 17445, 1, 223]
    - [28, 96.978]
  - - [19343, 19343, 1, 223]
    - [30, 96.839]
  - - [2001, 2001, 1, 511]
    - [31, 86.959]
  - - [3001, 3001, 1, 511]
    - [30, 93.205]
  - - [4454, 4454, 1, 511]
    - [30, 95.46]
  - - [6454, 6454, 1, 511]
    - [32, 96.844]
  - - [7985, 7985, 1, 511]
    - [33, 97.097]
  - - [9603, 9603, 1, 511]
    - [33, 96.094]
  - - [11505, 11505, 1, 511]
    - [34, 97.246]
  - - [13179, 13179, 1, 511]
    - [34, 97.595]
  - - [15420, 15420, 1, 511]
    - [30, 97.668]
  - - [17445, 17445, 1, 511]
    - [28, 97.453]
  - - [19343, 19343, 1, 511]
    - [28, 97.314]
  - - [2001, 2001, 1, 2201]
    - [25, 91.822]
  - - [3001, 3001, 1, 2201]
    - [35, 95.273]
  - - [4454, 4454, 1, 2201]
    - [32, 96.551]
  - - [6454, 6454, 1, 2201]
    - [36, 97.461]
  - - [7985, 7985, 1, 2201]
    - [28, 97.562]
  - - [9603, 9603, 1, 2201]
    - [32, 96.425]
  - - [11505, 11505, 1, 2201]
    - [32, 97.503]
  - - [13179, 13179, 1, 2201]
    - [37, 97.812]
  - - [15420, 15420, 1, 2201]
    - [30, 97.906]
  - - [17445, 17445, 1, 2201]
    - [28, 97.68]
  - - [19343, 19343, 1, 2201]
    - [32, 97.52]
  - - [2001, 2001, 1, 4101]
    - [38, 92.836]
  - - [3001, 3001, 1, 4101]
    - [39, 95.636]
  - - [4454, 4454, 1, 4101]
    - [32, 96.758]
  - - [6454, 6454, 1, 4101]
    - [32, 97.607]
  - - [7985, 7985, 1, 4101]
    - [33, 97.684]
  - - [9603, 9603, 1, 4101]
    - [28, 96.524]
  - - [11505, 11505, 1, 4101]
    - [30, 97.601]
  - - [13179, 13179, 1, 4101]
    - [33, 97.903]
  - - [15420, 15420, 1, 4101]
    - [30, 97.994]
  - - [17445, 17445, 1, 4101]
    - [32, 97.763]
  - - [19343, 19343, 1, 4101]
    - [26, 97.601]
  - - [21581, 21581, 1, 223]
    - [41, 97.003]
  - - [21581, 21581, 1, 511]
    - [40, 97.339]
  - - [21581, 21581, 1, 2201]
    - [40, 97.458]
  - - [21581, 21581, 1, 4101]
    - [41, 97.49]
  - - [25854, 25854, 1, 223]
    - [41, 97.588]
  - - [25854, 25854, 1, 511]
    - [37, 97.924]
  - - [25854, 25854, 1, 2201]
    - [41, 98.034]
  - - [25854, 25854, 1, 4101]
    - [42, 97.975]
  - - [30421, 30421, 1, 223]
    - [37, 97.305]
  - - [30421, 30421, 1, 511]
    - [43, 97.611]
  - - [30421, 30421, 1, 2201]
    - [44, 97.715]
  - - [30421, 30421, 1, 4101]
    - [45, 97.756]
  - - [35882, 35882, 1, 223]
    - [40, 97.344]
  - - [35882, 35882, 1, 511]
    - [40, 97.638]
  - - [35882, 35882, 1, 2201]
    - [37, 97.726]
  - - [35882, 35882, 1, 4101]
    - [42, 97.679]
  - - [40401, 40401, 1, 223]
    - [40, 97.422]
  - - [40401, 40401, 1, 511]
    - [37, 97.713]
  - - [40401, 40401, 1, 2201]
    - [46, 97.81]
  - - [40401, 40401, 1, 4101]
    - [45, 97.843]
  - - [45312, 45312, 1, 223]
    - [41, 97.696]
  - - [45312, 45312, 1, 511]
    - [43, 97.976]
  - - [45312, 45312, 1, 2201]
    - [41, 98.058]
  - - [45312, 45312, 1, 4101]
    - [44, 98.095]
  - - [51821, 51821, 1, 223]
    - [41, 97.619]
  - - [51821, 51821, 1, 511]
    - [43, 97.902]
  - - [51821, 51821, 1, 2201]
    - [37, 97.987]
  - - [51821, 51821, 1, 4101]
    - [47, 97.934]
  - - [60766, 60766, 1, 223]
    - [40, 97.601]
  - - [60766, 60766, 1, 511]
    - [48, 97.876]
  - - [60766, 60766, 1, 2201]
    - [41, 97.957]
  - - [60766, 60766, 1, 4101]
    - [42, 97.897]
  - - [67143, 67143, 1, 223]
    - [40, 97.545]
  - - [67143, 67143, 1, 511]
    - [43, 97.822]
  - - [67143, 67143, 1, 2201]
    - [37, 97.902]
  - - [67143, 67143, 1, 4101]
    - [49, 97.839]
- null
