library/src/blas3/Tensile/Logic/asm_full/aldebaran/aldebaran_Cijk_Alik_Bljk_DB_GB.yaml
- {MinimumRequiredVersion: 4.7.2}
- aldebaran
- gfx90a
- [Device 0050, Device 0051, Device 0052, Device 0054, Device 0062, Device 7400, Device
    SolutionIndex: 0
    SolutionNameMin: Cijk_Alik_Bljk_DB_MT64x64x32_MI16x16x4x1_SN_EPS0_GSU55_IU2_PGR2_TT2_32_TLDS0_WG32_8_1_WGM8
    SolutionIndex: 1
    SolutionNameMin: Cijk_Alik_Bljk_DB_MT64x16x32_MI16x16x4x1_SN_EPS0_GSU55_IU1_PGR2_TT2_16_TLDS0_WG32_4_1_WGM8
    SolutionIndex: 2
    SolutionNameMin: Cijk_Alik_Bljk_DB_MT32x32x32_MI16x16x4x1_SN_EPS0_GSU55_IU1_PGR2_TT1_16_TLDS0_WG32_8_1_WGM1
    SolutionIndex: 3
    SolutionNameMin: Cijk_Alik_Bljk_DB_MT32x32x32_MI16x16x4x1_SN_EPS0_GSU110_IU1_PGR2_TT1_16_TLDS1_WG32_8_1_WGM8
    SolutionIndex: 4
    SolutionNameMin: Cijk_Alik_Bljk_DB_MT32x16x32_MI16x16x4x1_SN_EPS0_GSU55_IU1_PGR2_TT2_16_TLDS0_WG16_4_1_WGM8
    SolutionIndex: 5
    SolutionNameMin: Cijk_Alik_Bljk_DB_MT32x16x32_MI16x16x4x1_SN_EPS0_GSU110_IU1_PGR2_TT2_16_TLDS1_WG16_4_1_WGM8
    SolutionIndex: 6
    SolutionNameMin: Cijk_Alik_Bljk_DB_MT128x128x32_MI16x16x4x1_SN_IU2_NEPBS1_PLR5_SU0_SUS0_TLDS0_WGM5
    SolutionIndex: 7
    SolutionNameMin: Cijk_Alik_Bljk_DB_MT64x16x16_MI16x16x4x1_SN_IU2_NEPBS0_PLR3_SU32_SUS128_TLDS0_WGM5
    SolutionIndex: 8
    SolutionNameMin: Cijk_Alik_Bljk_DB_MT128x16x32_MI16x16x4x1_SN_IU2_NEPBS1_PLR5_SU0_SUS0_TLDS0_WGM11
    SolutionIndex: 9
    SolutionNameMin: Cijk_Alik_Bljk_DB_MT64x16x16_MI16x16x4x1_SN_IU1_NEPBS0_PLR5_SU32_SUS128_TLDS0_WGM5
    SolutionIndex: 10
    SolutionNameMin: Cijk_Alik_Bljk_DB_MT64x16x16_MI16x16x4x1_SN_IU1_NEPBS0_PLR5_SU0_SUS0_TLDS0_WGM11
    SolutionIndex: 11
    SolutionNameMin: Cijk_Alik_Bljk_DB_MT64x16x16_MI16x16x4x1_SN_IU2_NEPBS0_PLR3_SU32_SUS128_TLDS0_WGM11
    SolutionIndex: 12
    SolutionNameMin: Cijk_Alik_Bljk_DB_MT64x16x16_MI16x16x4x1_SN_IU1_NEPBS0_PLR5_SU32_SUS128_TLDS0_WGM11
    SolutionIndex: 13
    SolutionNameMin: Cijk_Alik_Bljk_DB_MT128x128x32_MI16x16x4x1_SN_1LDSB1_EPS0_GSU55_IU2_PGR2_TT4_64_TLDS0_WGM1
- - - [1, 64, 1, 64]
    - [10, 0.002]
  - - [64, 1, 1, 64]
    - [11, 0.002]
  - - [1, 1, 1, 64]
    - [12, 0.0]
  - - [64, 64, 1, 64]
    - [7, 0.147]
  - - [128, 1, 1, 128]
    - [9, 0.006]
  - - [250, 9, 1, 500000]
    - [8, 4.802]
  - - [250, 250, 1, 500000]
    - [6, 37.421]
  - - [250, 250, 1, 8000000]
    - [0, 19.292]
  - - [250, 9, 1, 8000000]
    - [1, 4.763]
  - - [250, 250, 1, 12000000]
    - [2, 6.011]
  - - [250, 250, 1, 16000000]
    - [3, 5.751]
  - - [250, 9, 1, 12000000]
    - [4, 4.162]
  - - [250, 9, 1, 16000000]
    - [5, 4.172]
  - - [250, 250, 1, 4000000]
    - [13, 34.982]
- null
