library/src/blas3/Tensile/Logic/asm_full/aldebaran/aldebaran_Cijk_Ailk_Bjlk_CB.yaml
- {MinimumRequiredVersion: 4.21.0}
- aldebaran
- gfx90a
- [Device 0050, Device 0051, Device 0052, Device 0054, Device 0062, Device 7400, Device
    SolutionIndex: 0
    SolutionNameMin: Cijk_Ailk_Bjlk_CB_MT128x128x8_MI16x16x4x1_SE_1LDSB0_IU2_SIA2_SRVW0
    SolutionIndex: 1
    SolutionNameMin: Cijk_Ailk_Bjlk_CB_MT32x32x32_MI16x16x4x1_SE_1LDSB1_IU8_SIA2_SRVW0
    SolutionIndex: 2
    SolutionNameMin: Cijk_Ailk_Bjlk_CB_MT128x64x8_MI16x16x4x1_SE_1LDSB0_IU2_SIA2_SRVW2
    SolutionIndex: 3
    SolutionNameMin: Cijk_Ailk_Bjlk_CB_MT64x64x8_MI16x16x4x1_SE_1LDSB1_IU2_SIA2_SRVW2
    SolutionIndex: 4
    SolutionNameMin: Cijk_Ailk_Bjlk_CB_MT128x128x16_MI16x16x4x1_SE_1LDSB1_IU4_SIA2_SRVW2
    SolutionIndex: 5
    SolutionNameMin: Cijk_Ailk_Bjlk_CB_MT64x64x8_MI16x16x4x1_SE_1LDSB0_IU2_SIA2_SRVW0
    SolutionIndex: 6
    SolutionNameMin: Cijk_Ailk_Bjlk_CB_MT64x64x16_MI16x16x4x1_SE_1LDSB0_IU1_SIA3_SRVW0
    SolutionIndex: 7
    SolutionNameMin: Cijk_Ailk_Bjlk_CB_MT128x64x8_MI16x16x4x1_SN_DTVA0_NEPBS0_PLR1_SU0_SUS0_TT2_64_WG64_4_1_WGM8
    SolutionIndex: 8
    SolutionNameMin: Cijk_Ailk_Bjlk_CB_MT256x64x8_MI32x32x2x1_SN_DTVA1_NEPBS0_PLR5_SU0_SUS0_TT2_64_WG128_2_1_WGM2
    SolutionIndex: 9
    SolutionNameMin: Cijk_Ailk_Bjlk_CB_MT256x64x8_MI32x32x2x1_SN_DTVA1_NEPBS0_PLR5_SU32_SUS256_TT2_64_WG128_2_1_WGM2
    SolutionIndex: 10
    SolutionNameMin: Cijk_Ailk_Bjlk_CB_MT128x64x16_MI16x16x4x1_SN_DTVA0_NEPBS0_PLR5_SU32_SUS256_TT2_64_WG64_4_1_WGM2
    SolutionIndex: 11
    SolutionNameMin: Cijk_Ailk_Bjlk_CB_MT128x64x8_MI16x16x4x1_SN_DTVA0_NEPBS0_PLR1_SU32_SUS256_TT2_64_WG64_4_1_WGM12
    SolutionIndex: 12
    SolutionNameMin: Cijk_Ailk_Bjlk_CB_MT256x64x8_MI32x32x2x1_SN_DTVA1_NEPBS0_PLR5_SU0_SUS0_TT2_64_WG128_2_1_WGM8
    SolutionIndex: 13
    SolutionNameMin: Cijk_Ailk_Bjlk_CB_MT256x64x8_MI32x32x2x1_SN_DTVA1_NEPBS0_PLR5_SU32_SUS256_TT2_64_WG128_2_1_WGM8
    SolutionIndex: 14
    SolutionNameMin: Cijk_Ailk_Bjlk_CB_MT128x64x8_MI16x16x4x1_SN_DTVA0_NEPBS0_PLR1_SU0_SUS0_TT2_64_WG64_4_1_WGM10
    SolutionIndex: 15
    SolutionNameMin: Cijk_Ailk_Bjlk_CB_MT64x64x16_MI16x16x4x1_SN_DTVA0_NEPBS0_PLR5_SU32_SUS256_TT2_32_WG32_8_1_WGM2
    SolutionIndex: 16
    SolutionNameMin: Cijk_Ailk_Bjlk_CB_MT64x64x16_MI16x16x4x1_SN_DTVA0_NEPBS0_PLR5_SU0_SUS0_TT2_32_WG32_8_1_WGM2
    SolutionIndex: 17
    SolutionNameMin: Cijk_Ailk_Bjlk_CB_MT64x64x16_MI16x16x4x1_SN_DTVA0_NEPBS1_PLR5_SU0_SUS0_TT2_32_WG32_8_1_WGM5
    SolutionIndex: 18
    SolutionNameMin: Cijk_Ailk_Bjlk_CB_MT128x64x8_MI16x16x4x1_SN_DTVA0_NEPBS0_PLR1_SU0_SUS0_TT2_64_WG64_4_1_WGM12
    SolutionIndex: 19
    SolutionNameMin: Cijk_Ailk_Bjlk_CB_MT128x64x8_MI16x16x4x1_SN_DTVA0_NEPBS0_PLR1_SU0_SUS0_TT2_64_WG64_4_1_WGM7
    SolutionIndex: 20
    SolutionNameMin: Cijk_Ailk_Bjlk_CB_MT128x64x8_MI16x16x4x1_SN_DTVA0_NEPBS0_PLR1_SU0_SUS0_TT2_64_WG64_4_1_WGM4
    SolutionIndex: 21
    SolutionNameMin: Cijk_Ailk_Bjlk_CB_MT64x64x16_MI16x16x4x1_SN_DTVA0_NEPBS0_PLR5_SU0_SUS0_TT2_32_WG32_8_1_WGM8
    SolutionIndex: 22
    SolutionNameMin: Cijk_Ailk_Bjlk_CB_MT64x64x16_MI16x16x4x1_SN_DTVA0_NEPBS0_PLR5_SU0_SUS0_TT2_32_WG32_8_1_WGM7
    SolutionIndex: 23
    SolutionNameMin: Cijk_Ailk_Bjlk_CB_MT64x64x16_MI16x16x4x1_SN_DTVA0_NEPBS0_PLR5_SU0_SUS0_TT2_32_WG32_8_1_WGM12
    SolutionIndex: 24
    SolutionNameMin: Cijk_Ailk_Bjlk_CB_MT64x64x16_MI16x16x4x1_SN_DTVA0_NEPBS0_PLR5_SU0_SUS0_TT2_32_WG32_8_1_WGM10
    SolutionIndex: 25
    SolutionNameMin: Cijk_Ailk_Bjlk_CB_MT64x64x16_MI16x16x4x1_SN_DTVA0_NEPBS1_PLR5_SU0_SUS0_TT2_32_WG32_8_1_WGM10
    SolutionIndex: 26
    SolutionNameMin: Cijk_Ailk_Bjlk_CB_MT64x64x16_MI16x16x4x1_SN_DTVA0_NEPBS1_PLR5_SU0_SUS0_TT2_32_WG32_8_1_WGM12
    SolutionIndex: 27
    SolutionNameMin: Cijk_Ailk_Bjlk_CB_MT64x64x16_MI16x16x4x1_SN_DTVA0_NEPBS1_PLR5_SU0_SUS0_TT2_32_WG32_8_1_WGM8
    SolutionIndex: 28
    SolutionNameMin: Cijk_Ailk_Bjlk_CB_MT128x64x8_MI16x16x4x1_SN_DTVA0_NEPBS0_PLR1_SU32_SUS256_TT2_64_WG64_4_1_WGM8
    SolutionIndex: 29
    SolutionNameMin: Cijk_Ailk_Bjlk_CB_MT64x64x16_MI16x16x4x1_SN_DTVA0_NEPBS0_PLR5_SU0_SUS0_TT2_32_WG32_8_1_WGM5
    SolutionIndex: 30
    SolutionNameMin: Cijk_Ailk_Bjlk_CB_MT128x64x8_MI16x16x4x1_SN_DTVA0_NEPBS0_PLR1_SU0_SUS0_TT2_64_WG64_4_1_WGM2
    SolutionIndex: 31
    SolutionNameMin: Cijk_Ailk_Bjlk_CB_MT128x64x8_MI16x16x4x1_SN_DTVA0_NEPBS0_PLR1_SU0_SUS0_TT2_64_WG64_4_1_WGM5
    SolutionIndex: 32
    SolutionNameMin: Cijk_Ailk_Bjlk_CB_MT64x64x16_MI16x16x4x1_SN_DTVA0_NEPBS1_PLR5_SU0_SUS0_TT2_32_WG32_8_1_WGM4
    SolutionIndex: 33
    SolutionNameMin: Cijk_Ailk_Bjlk_CB_MT64x64x16_MI16x16x4x1_SN_DTVA0_NEPBS1_PLR5_SU0_SUS0_TT2_32_WG32_8_1_WGM7
    SolutionIndex: 34
    SolutionNameMin: Cijk_Ailk_Bjlk_CB_MT64x64x16_MI16x16x4x1_SN_DTVA0_NEPBS1_PLR5_SU0_SUS0_TT2_32_WG32_8_1_WGM6
    SolutionIndex: 35
    SolutionNameMin: Cijk_Ailk_Bjlk_CB_MT128x64x8_MI16x16x4x1_SN_DTVA0_NEPBS0_PLR1_SU0_SUS0_TT2_64_WG64_4_1_WGM6
    SolutionIndex: 36
    SolutionNameMin: Cijk_Ailk_Bjlk_CB_MT128x64x8_MI16x16x4x1_SN_NLCB1_PLR1_TT2_64_WG64_4_1_WGM6
    SolutionIndex: 37
    SolutionNameMin: Cijk_Ailk_Bjlk_CB_MT128x64x8_MI16x16x4x1_SN_NLCB1_PLR1_TT2_64_WG64_4_1_WGM7
    SolutionIndex: 38
    SolutionNameMin: Cijk_Ailk_Bjlk_CB_MT128x64x8_MI16x16x4x1_SN_NLCB1_PLR1_TT2_64_WG64_4_1_WGM8
    SolutionIndex: 39
    SolutionNameMin: Cijk_Ailk_Bjlk_CB_MT128x96x16_MI16x16x4x1_SN_NLCB3_PLR5_TT2_96_WG64_4_1_WGM8
    SolutionIndex: 40
    SolutionNameMin: Cijk_Ailk_Bjlk_CB_MT128x64x16_MI16x16x4x1_SN_NLCB1_PLR5_TT2_64_WG64_4_1_WGM7
    SolutionIndex: 41
    SolutionNameMin: Cijk_Ailk_Bjlk_CB_MT128x64x16_MI16x16x4x1_SN_NLCB1_PLR5_TT2_64_WG64_4_1_WGM8
    SolutionIndex: 42
    SolutionNameMin: Cijk_Ailk_Bjlk_CB_MT128x64x8_MI16x16x4x1_SN_NLCB1_PLR1_TT2_64_WG64_4_1_WGM5
    SolutionIndex: 43
    SolutionNameMin: Cijk_Ailk_Bjlk_CB_MT128x64x16_MI16x16x4x1_SN_NLCB1_PLR5_TT2_64_WG64_4_1_WGM6
    SolutionIndex: 44
    SolutionNameMin: Cijk_Ailk_Bjlk_CB_MT128x96x16_MI16x16x4x1_SN_NLCB3_PLR5_TT2_96_WG64_4_1_WGM7
    SolutionIndex: 45
    SolutionNameMin: Cijk_Ailk_Bjlk_CB_MT128x64x16_MI16x16x4x1_SN_NLCB1_PLR5_TT2_64_WG64_4_1_WGM4
    SolutionIndex: 46
    SolutionNameMin: Cijk_Ailk_Bjlk_CB_MT128x32x8_MI16x16x4x1_SN_1LDSB1_AMAS3_GRVW2_MIAV1_NEPBS2_NLCB1_PLR3_SU0_SUS0_SVW2_TT2_32_VW2_WG64_4_1
    SolutionIndex: 47
    SolutionNameMin: Cijk_Ailk_Bjlk_CB_MT128x64x8_MI16x16x4x1_SN_1LDSB1_AMAS3_GRVW2_MIAV1_NEPBS2_NLCB1_PLR3_SU0_SUS0_SVW2_TT2_64_VW2_WG64_4_1
- - - [3840, 4096, 1, 4096]
    - [4, 98.656]
  - - [960, 1024, 1, 1024]
    - [3, 93.733]
  - - [480, 512, 1, 512]
    - [1, 62.804]
  - - [1920, 2048, 1, 2048]
    - [2, 97.507]
  - - [1, 64, 1, 256]
    - [5, 0.012]
  - - [7680, 8192, 1, 8192]
    - [0, 99.279]
  - - [64, 64, 1, 256]
    - [6, 0.527]
  - - [1, 1, 1, 256]
    - [5, 0.0]
  - - [64, 1, 1, 256]
    - [5, 0.012]
  - - [64, 64, 2, 64]
    - [5, 0.587]
  - - [2001, 2001, 1, 51]
    - [7, 42.504]
  - - [3001, 3001, 1, 51]
    - [8, 55.671]
  - - [4454, 4454, 1, 51]
    - [9, 67.636]
  - - [6454, 6454, 1, 51]
    - [10, 74.756]
  - - [7985, 7985, 1, 51]
    - [8, 74.499]
  - - [9603, 9603, 1, 51]
    - [8, 74.266]
  - - [11505, 11505, 1, 51]
    - [8, 74.012]
  - - [13179, 13179, 1, 51]
    - [8, 75.436]
  - - [15420, 15420, 1, 51]
    - [11, 85.322]
  - - [17445, 17445, 1, 51]
    - [12, 75.952]
  - - [19343, 19343, 1, 51]
    - [12, 75.945]
  - - [21581, 21581, 1, 51]
    - [12, 75.929]
  - - [25854, 25854, 1, 51]
    - [13, 76.71]
  - - [30421, 30421, 1, 51]
    - [12, 76.507]
  - - [35882, 35882, 1, 51]
    - [12, 77.595]
  - - [40401, 40401, 1, 51]
    - [12, 76.762]
  - - [45312, 45312, 1, 51]
    - [14, 96.081]
  - - [51821, 51821, 1, 51]
    - [12, 77.19]
  - - [60766, 60766, 1, 51]
    - [12, 77.825]
  - - [67143, 67143, 1, 51]
    - [12, 77.806]
  - - [2001, 2001, 1, 103]
    - [15, 69.585]
  - - [3001, 3001, 1, 103]
    - [16, 82.375]
  - - [4454, 4454, 1, 103]
    - [15, 89.62]
  - - [6454, 6454, 1, 103]
    - [17, 93.039]
  - - [7985, 7985, 1, 103]
    - [18, 93.442]
  - - [9603, 9603, 1, 103]
    - [36, 93.667]
  - - [11505, 11505, 1, 103]
    - [37, 95.572]
  - - [13179, 13179, 1, 103]
    - [7, 95.985]
  - - [15420, 15420, 1, 103]
    - [19, 96.055]
  - - [17445, 17445, 1, 103]
    - [18, 95.971]
  - - [19343, 19343, 1, 103]
    - [37, 96.05]
  - - [21581, 21581, 1, 103]
    - [38, 96.365]
  - - [25854, 25854, 1, 103]
    - [18, 96.929]
  - - [30421, 30421, 1, 103]
    - [38, 96.747]
  - - [35882, 35882, 1, 103]
    - [18, 96.801]
  - - [40401, 40401, 1, 103]
    - [36, 96.899]
  - - [45312, 45312, 1, 103]
    - [37, 97.195]
  - - [51821, 51821, 1, 103]
    - [38, 97.028]
  - - [60766, 60766, 1, 103]
    - [38, 97.082]
  - - [67143, 67143, 1, 103]
    - [38, 97.046]
  - - [2001, 2001, 1, 223]
    - [20, 80.453]
  - - [3001, 3001, 1, 223]
    - [21, 89.737]
  - - [4454, 4454, 1, 223]
    - [22, 93.603]
  - - [6454, 6454, 1, 223]
    - [23, 95.741]
  - - [7985, 7985, 1, 223]
    - [24, 96.251]
  - - [9603, 9603, 1, 223]
    - [25, 95.658]
  - - [11505, 11505, 1, 223]
    - [25, 96.751]
  - - [13179, 13179, 1, 223]
    - [26, 97.156]
  - - [15420, 15420, 1, 223]
    - [26, 97.346]
  - - [17445, 17445, 1, 223]
    - [27, 97.16]
  - - [19343, 19343, 1, 223]
    - [25, 97.028]
  - - [2001, 2001, 1, 511]
    - [28, 87.309]
  - - [3001, 3001, 1, 511]
    - [29, 93.106]
  - - [4454, 4454, 1, 511]
    - [24, 95.427]
  - - [6454, 6454, 1, 511]
    - [21, 96.846]
  - - [7985, 7985, 1, 511]
    - [17, 97.117]
  - - [9603, 9603, 1, 511]
    - [17, 96.17]
  - - [11505, 11505, 1, 511]
    - [21, 97.317]
  - - [13179, 13179, 1, 511]
    - [17, 97.636]
  - - [15420, 15420, 1, 511]
    - [26, 97.759]
  - - [17445, 17445, 1, 511]
    - [26, 97.55]
  - - [19343, 19343, 1, 511]
    - [26, 97.404]
  - - [2001, 2001, 1, 2201]
    - [30, 92.195]
  - - [3001, 3001, 1, 2201]
    - [23, 95.206]
  - - [4454, 4454, 1, 2201]
    - [31, 96.517]
  - - [6454, 6454, 1, 2201]
    - [21, 97.454]
  - - [7985, 7985, 1, 2201]
    - [17, 97.559]
  - - [9603, 9603, 1, 2201]
    - [32, 96.433]
  - - [11505, 11505, 1, 2201]
    - [7, 97.522]
  - - [13179, 13179, 1, 2201]
    - [7, 97.832]
  - - [15420, 15420, 1, 2201]
    - [17, 97.917]
  - - [17445, 17445, 1, 2201]
    - [33, 97.692]
  - - [19343, 19343, 1, 2201]
    - [33, 97.531]
  - - [2001, 2001, 1, 4101]
    - [31, 92.916]
  - - [3001, 3001, 1, 4101]
    - [22, 95.588]
  - - [4454, 4454, 1, 4101]
    - [23, 96.734]
  - - [6454, 6454, 1, 4101]
    - [21, 97.596]
  - - [7985, 7985, 1, 4101]
    - [33, 97.672]
  - - [9603, 9603, 1, 4101]
    - [34, 96.519]
  - - [11505, 11505, 1, 4101]
    - [35, 97.607]
  - - [13179, 13179, 1, 4101]
    - [7, 97.913]
  - - [15420, 15420, 1, 4101]
    - [32, 97.997]
  - - [17445, 17445, 1, 4101]
    - [17, 97.764]
  - - [19343, 19343, 1, 4101]
    - [32, 97.602]
  - - [21581, 21581, 1, 223]
    - [36, 97.044]
  - - [21581, 21581, 1, 511]
    - [36, 97.37]
  - - [21581, 21581, 1, 2201]
    - [39, 97.334]
  - - [21581, 21581, 1, 4101]
    - [36, 97.534]
  - - [25854, 25854, 1, 223]
    - [40, 97.632]
  - - [25854, 25854, 1, 511]
    - [41, 97.949]
  - - [25854, 25854, 1, 2201]
    - [41, 97.868]
  - - [25854, 25854, 1, 4101]
    - [42, 98.111]
  - - [30421, 30421, 1, 223]
    - [42, 97.354]
  - - [30421, 30421, 1, 511]
    - [42, 97.636]
  - - [30421, 30421, 1, 2201]
    - [39, 97.628]
  - - [30421, 30421, 1, 4101]
    - [42, 97.781]
  - - [35882, 35882, 1, 223]
    - [41, 97.388]
  - - [35882, 35882, 1, 511]
    - [43, 97.661]
  - - [35882, 35882, 1, 2201]
    - [40, 97.559]
  - - [35882, 35882, 1, 4101]
    - [37, 97.8]
  - - [40401, 40401, 1, 223]
    - [36, 97.468]
  - - [40401, 40401, 1, 511]
    - [40, 97.738]
  - - [40401, 40401, 1, 2201]
    - [44, 97.665]
  - - [40401, 40401, 1, 4101]
    - [42, 97.871]
  - - [45312, 45312, 1, 223]
    - [43, 97.737]
  - - [45312, 45312, 1, 511]
    - [43, 97.999]
  - - [45312, 45312, 1, 2201]
    - [45, 97.888]
  - - [45312, 45312, 1, 4101]
    - [36, 98.128]
  - - [51821, 51821, 1, 223]
    - [45, 97.666]
  - - [51821, 51821, 1, 511]
    - [45, 97.927]
  - - [51821, 51821, 1, 2201]
    - [41, 97.817]
  - - [51821, 51821, 1, 4101]
    - [38, 98.057]
  - - [60766, 60766, 1, 223]
    - [45, 97.641]
  - - [60766, 60766, 1, 511]
    - [40, 97.897]
  - - [60766, 60766, 1, 2201]
    - [44, 97.793]
  - - [60766, 60766, 1, 4101]
    - [38, 98.026]
  - - [67143, 67143, 1, 223]
    - [45, 97.589]
  - - [67143, 67143, 1, 511]
    - [45, 97.845]
  - - [67143, 67143, 1, 2201]
    - [41, 97.731]
  - - [67143, 67143, 1, 4101]
    - [42, 97.971]
  - - [1031, 1031, 1, 1031]
    - [46, 67.515]
  - - [4095, 4095, 1, 1031]
    - [47, 88.602]
- null
