library/src/blas3/Tensile/Logic/asm_full/aldebaran/aldebaran_Cijk_Alik_BjlkC_CB.yaml
- {MinimumRequiredVersion: 4.21.0}
- aldebaran
- gfx90a
- [Device 0050, Device 0051, Device 0052, Device 0054, Device 0062, Device 7400, Device
    SolutionIndex: 0
    SolutionNameMin: Cijk_Alik_BjlkC_CB_MT32x64x32_MI16x16x4x1_SE_1LDSB0_IU1_SIA3_SRVW0
    SolutionIndex: 1
    SolutionNameMin: Cijk_Alik_BjlkC_CB_MT128x128x8_MI16x16x4x1_SE_1LDSB1_IU2_SIA2_SRVW0
    SolutionIndex: 2
    SolutionNameMin: Cijk_Alik_BjlkC_CB_MT64x64x8_MI16x16x4x1_SE_1LDSB1_IU2_SIA2_SRVW2
    SolutionIndex: 3
    SolutionNameMin: Cijk_Alik_BjlkC_CB_MT128x128x8_MI16x16x4x1_SE_1LDSB1_IU2_SIA2_SRVW2
    SolutionIndex: 4
    SolutionNameMin: Cijk_Alik_BjlkC_CB_MT128x64x16_MI16x16x4x1_SE_1LDSB1_IU4_SIA2_SRVW2
    SolutionIndex: 5
    SolutionNameMin: Cijk_Alik_BjlkC_CB_MT64x64x8_MI16x16x4x1_SE_1LDSB0_IU2_SIA2_SRVW0
    SolutionIndex: 6
    SolutionNameMin: Cijk_Alik_BjlkC_CB_MT64x64x16_MI16x16x4x1_SE_1LDSB0_IU1_SIA3_SRVW2
    SolutionIndex: 7
    SolutionNameMin: Cijk_Alik_BjlkC_CB_MT64x64x16_MI16x16x4x1_SN_LRVW2_NEPBS0_PLR5_SU0_SUS0_TT2_32_WG32_8_1_WGM7
    SolutionIndex: 8
    SolutionNameMin: Cijk_Alik_BjlkC_CB_MT256x64x8_MI32x32x2x1_SN_LRVW2_NEPBS0_PLR5_SU0_SUS0_TT2_64_WG128_2_1_WGM8
    SolutionIndex: 9
    SolutionNameMin: Cijk_Alik_BjlkC_CB_MT256x64x8_MI32x32x2x1_SN_LRVW2_NEPBS0_PLR5_SU0_SUS0_TT2_64_WG128_2_1_WGM4
    SolutionIndex: 10
    SolutionNameMin: Cijk_Alik_BjlkC_CB_MT256x64x8_MI32x32x2x1_SN_LRVW2_NEPBS0_PLR5_SU32_SUS256_TT2_64_WG128_2_1_WGM4
    SolutionIndex: 11
    SolutionNameMin: Cijk_Alik_BjlkC_CB_MT256x64x8_MI32x32x2x1_SN_LRVW2_NEPBS0_PLR5_SU0_SUS0_TT2_64_WG128_2_1_WGM7
    SolutionIndex: 12
    SolutionNameMin: Cijk_Alik_BjlkC_CB_MT256x64x8_MI32x32x2x1_SN_LRVW2_NEPBS0_PLR5_SU0_SUS0_TT2_64_WG128_2_1_WGM6
    SolutionIndex: 13
    SolutionNameMin: Cijk_Alik_BjlkC_CB_MT256x64x8_MI32x32x2x1_SN_LRVW2_NEPBS0_PLR5_SU32_SUS256_TT2_64_WG128_2_1_WGM8
    SolutionIndex: 14
    SolutionNameMin: Cijk_Alik_BjlkC_CB_MT128x64x8_MI16x16x4x1_SN_LRVW1_NEPBS0_PLR1_SU0_SUS0_TT2_64_WG64_4_1_WGM8
    SolutionIndex: 15
    SolutionNameMin: Cijk_Alik_BjlkC_CB_MT128x64x8_MI16x16x4x1_SN_LRVW1_NEPBS0_PLR1_SU0_SUS0_TT2_64_WG64_4_1_WGM6
    SolutionIndex: 16
    SolutionNameMin: Cijk_Alik_BjlkC_CB_MT64x64x16_MI16x16x4x1_SN_LRVW2_NEPBS1_PLR5_SU0_SUS0_TT2_32_WG32_8_1_WGM4
    SolutionIndex: 17
    SolutionNameMin: Cijk_Alik_BjlkC_CB_MT128x64x8_MI16x16x4x1_SN_LRVW1_NEPBS0_PLR1_SU0_SUS0_TT2_64_WG64_4_1_WGM7
    SolutionIndex: 18
    SolutionNameMin: Cijk_Alik_BjlkC_CB_MT128x64x8_MI16x16x4x1_SN_LRVW1_NEPBS1_PLR1_SU0_SUS0_TT2_64_WG64_4_1_WGM4
    SolutionIndex: 19
    SolutionNameMin: Cijk_Alik_BjlkC_CB_MT128x64x8_MI16x16x4x1_SN_LRVW1_NEPBS1_PLR1_SU0_SUS0_TT2_64_WG64_4_1_WGM8
    SolutionIndex: 20
    SolutionNameMin: Cijk_Alik_BjlkC_CB_MT128x64x8_MI16x16x4x1_SN_LRVW1_NEPBS1_PLR1_SU0_SUS0_TT2_64_WG64_4_1_WGM7
    SolutionIndex: 21
    SolutionNameMin: Cijk_Alik_BjlkC_CB_MT64x64x16_MI16x16x4x1_SN_LRVW2_NEPBS0_PLR5_SU0_SUS0_TT2_32_WG32_8_1_WGM4
    SolutionIndex: 22
    SolutionNameMin: Cijk_Alik_BjlkC_CB_MT64x64x16_MI16x16x4x1_SN_LRVW2_NEPBS1_PLR5_SU32_SUS256_TT2_32_WG32_8_1_WGM7
    SolutionIndex: 23
    SolutionNameMin: Cijk_Alik_BjlkC_CB_MT64x64x16_MI16x16x4x1_SN_LRVW2_NEPBS1_PLR5_SU32_SUS256_TT2_32_WG32_8_1_WGM6
    SolutionIndex: 24
    SolutionNameMin: Cijk_Alik_BjlkC_CB_MT64x64x16_MI16x16x4x1_SN_LRVW2_NEPBS1_PLR5_SU32_SUS256_TT2_32_WG32_8_1_WGM8
    SolutionIndex: 25
    SolutionNameMin: Cijk_Alik_BjlkC_CB_MT128x64x8_MI16x16x4x1_SN_LRVW1_NEPBS0_PLR1_SU0_SUS0_TT2_64_WG64_4_1_WGM5
    SolutionIndex: 26
    SolutionNameMin: Cijk_Alik_BjlkC_CB_MT64x64x16_MI16x16x4x1_SN_LRVW2_NEPBS1_PLR5_SU0_SUS0_TT2_32_WG32_8_1_WGM7
    SolutionIndex: 27
    SolutionNameMin: Cijk_Alik_BjlkC_CB_MT64x64x16_MI16x16x4x1_SN_LRVW2_NEPBS1_PLR5_SU0_SUS0_TT2_32_WG32_8_1_WGM8
    SolutionIndex: 28
    SolutionNameMin: Cijk_Alik_BjlkC_CB_MT64x64x16_MI16x16x4x1_SN_LRVW2_NEPBS1_PLR5_SU0_SUS0_TT2_32_WG32_8_1_WGM6
    SolutionIndex: 29
    SolutionNameMin: Cijk_Alik_BjlkC_CB_MT128x64x8_MI16x16x4x1_SN_LRVW1_NEPBS0_PLR1_SU32_SUS256_TT2_64_WG64_4_1_WGM6
    SolutionIndex: 30
    SolutionNameMin: Cijk_Alik_BjlkC_CB_MT64x64x16_MI16x16x4x1_SN_LRVW2_NEPBS0_PLR5_SU0_SUS0_TT2_32_WG32_8_1_WGM5
    SolutionIndex: 31
    SolutionNameMin: Cijk_Alik_BjlkC_CB_MT128x64x8_MI16x16x4x1_SN_LRVW1_NLCB1_PLR1_TT2_64_WG64_4_1_WGM8
    SolutionIndex: 32
    SolutionNameMin: Cijk_Alik_BjlkC_CB_MT128x64x8_MI16x16x4x1_SN_LRVW1_NLCB1_PLR1_TT2_64_WG64_4_1_WGM7
    SolutionIndex: 33
    SolutionNameMin: Cijk_Alik_BjlkC_CB_MT128x64x8_MI16x16x4x1_SN_LRVW1_NLCB1_PLR1_TT2_64_WG64_4_1_WGM5
    SolutionIndex: 34
    SolutionNameMin: Cijk_Alik_BjlkC_CB_MT128x64x8_MI16x16x4x1_SN_LRVW1_NLCB1_PLR1_TT2_64_WG64_4_1_WGM6
    SolutionIndex: 35
    SolutionNameMin: Cijk_Alik_BjlkC_CB_MT128x96x16_MI16x16x4x1_SN_LRVW2_NLCB3_PLR5_TT2_96_WG64_4_1_WGM8
    SolutionIndex: 36
    SolutionNameMin: Cijk_Alik_BjlkC_CB_MT128x64x8_MI16x16x4x1_SN_LRVW1_NLCB1_PLR1_TT2_64_WG64_4_1_WGM4
    SolutionIndex: 37
    SolutionNameMin: Cijk_Alik_BjlkC_CB_MT256x64x8_MI32x32x2x1_SN_LRVW2_NLCB1_PLR5_TT2_64_WG128_2_1_WGM7
- - - [7680, 8192, 1, 8192]
    - [1, 99.219]
  - - [960, 1024, 1, 1024]
    - [2, 93.973]
  - - [1920, 2048, 1, 2048]
    - [4, 97.435]
  - - [3840, 4096, 1, 4096]
    - [3, 98.728]
  - - [1, 1, 1, 256]
    - [5, 0.0]
  - - [480, 512, 1, 512]
    - [0, 61.175]
  - - [64, 64, 1, 256]
    - [6, 0.515]
  - - [64, 64, 2, 64]
    - [5, 0.563]
  - - [1, 64, 1, 256]
    - [5, 0.012]
  - - [64, 1, 1, 256]
    - [5, 0.012]
  - - [2001, 2001, 1, 51]
    - [7, 43.068]
  - - [3001, 3001, 1, 51]
    - [8, 54.426]
  - - [4454, 4454, 1, 51]
    - [9, 68.991]
  - - [6454, 6454, 1, 51]
    - [9, 74.964]
  - - [7985, 7985, 1, 51]
    - [10, 74.419]
  - - [9603, 9603, 1, 51]
    - [10, 72.789]
  - - [11505, 11505, 1, 51]
    - [9, 70.571]
  - - [13179, 13179, 1, 51]
    - [11, 72.839]
  - - [15420, 15420, 1, 51]
    - [8, 82.321]
  - - [17445, 17445, 1, 51]
    - [12, 71.755]
  - - [19343, 19343, 1, 51]
    - [8, 70.401]
  - - [21581, 21581, 1, 51]
    - [8, 71.054]
  - - [25854, 25854, 1, 51]
    - [8, 72.65]
  - - [30421, 30421, 1, 51]
    - [13, 69.099]
  - - [35882, 35882, 1, 51]
    - [8, 74.8]
  - - [40401, 40401, 1, 51]
    - [8, 70.399]
  - - [45312, 45312, 1, 51]
    - [14, 91.014]
  - - [51821, 51821, 1, 51]
    - [8, 69.863]
  - - [60766, 60766, 1, 51]
    - [8, 74.983]
  - - [67143, 67143, 1, 51]
    - [8, 70.733]
  - - [2001, 2001, 1, 103]
    - [15, 69.584]
  - - [3001, 3001, 1, 103]
    - [16, 79.774]
  - - [4454, 4454, 1, 103]
    - [15, 89.497]
  - - [6454, 6454, 1, 103]
    - [15, 92.315]
  - - [7985, 7985, 1, 103]
    - [17, 93.407]
  - - [9603, 9603, 1, 103]
    - [18, 93.32]
  - - [11505, 11505, 1, 103]
    - [31, 95.076]
  - - [13179, 13179, 1, 103]
    - [20, 95.344]
  - - [15420, 15420, 1, 103]
    - [17, 96.018]
  - - [17445, 17445, 1, 103]
    - [20, 95.691]
  - - [19343, 19343, 1, 103]
    - [19, 95.846]
  - - [21581, 21581, 1, 103]
    - [19, 96.161]
  - - [25854, 25854, 1, 103]
    - [17, 96.766]
  - - [30421, 30421, 1, 103]
    - [19, 96.563]
  - - [35882, 35882, 1, 103]
    - [14, 96.673]
  - - [40401, 40401, 1, 103]
    - [19, 96.744]
  - - [45312, 45312, 1, 103]
    - [15, 97.163]
  - - [51821, 51821, 1, 103]
    - [19, 96.828]
  - - [60766, 60766, 1, 103]
    - [19, 96.955]
  - - [67143, 67143, 1, 103]
    - [19, 96.909]
  - - [2001, 2001, 1, 223]
    - [15, 80.415]
  - - [3001, 3001, 1, 223]
    - [21, 88.966]
  - - [4454, 4454, 1, 223]
    - [14, 93.355]
  - - [6454, 6454, 1, 223]
    - [22, 95.455]
  - - [7985, 7985, 1, 223]
    - [23, 95.988]
  - - [9603, 9603, 1, 223]
    - [23, 95.395]
  - - [11505, 11505, 1, 223]
    - [32, 96.687]
  - - [13179, 13179, 1, 223]
    - [31, 97.083]
  - - [15420, 15420, 1, 223]
    - [22, 97.124]
  - - [17445, 17445, 1, 223]
    - [22, 96.954]
  - - [19343, 19343, 1, 223]
    - [24, 96.875]
  - - [2001, 2001, 1, 511]
    - [25, 87.153]
  - - [3001, 3001, 1, 511]
    - [26, 92.801]
  - - [4454, 4454, 1, 511]
    - [14, 95.3]
  - - [6454, 6454, 1, 511]
    - [26, 96.722]
  - - [7985, 7985, 1, 511]
    - [27, 97.006]
  - - [9603, 9603, 1, 511]
    - [28, 96.034]
  - - [11505, 11505, 1, 511]
    - [31, 97.258]
  - - [13179, 13179, 1, 511]
    - [32, 97.603]
  - - [15420, 15420, 1, 511]
    - [26, 97.65]
  - - [17445, 17445, 1, 511]
    - [28, 97.441]
  - - [19343, 19343, 1, 511]
    - [26, 97.302]
  - - [2001, 2001, 1, 2201]
    - [25, 92.185]
  - - [3001, 3001, 1, 2201]
    - [28, 95.175]
  - - [4454, 4454, 1, 2201]
    - [15, 96.526]
  - - [6454, 6454, 1, 2201]
    - [28, 97.447]
  - - [7985, 7985, 1, 2201]
    - [26, 97.551]
  - - [9603, 9603, 1, 2201]
    - [28, 96.403]
  - - [11505, 11505, 1, 2201]
    - [14, 97.524]
  - - [13179, 13179, 1, 2201]
    - [33, 97.831]
  - - [15420, 15420, 1, 2201]
    - [26, 97.904]
  - - [17445, 17445, 1, 2201]
    - [26, 97.679]
  - - [19343, 19343, 1, 2201]
    - [26, 97.519]
  - - [2001, 2001, 1, 4101]
    - [29, 92.908]
  - - [3001, 3001, 1, 4101]
    - [30, 95.606]
  - - [4454, 4454, 1, 4101]
    - [27, 96.734]
  - - [6454, 6454, 1, 4101]
    - [26, 97.593]
  - - [7985, 7985, 1, 4101]
    - [26, 97.674]
  - - [9603, 9603, 1, 4101]
    - [28, 96.515]
  - - [11505, 11505, 1, 4101]
    - [17, 97.605]
  - - [13179, 13179, 1, 4101]
    - [14, 97.909]
  - - [15420, 15420, 1, 4101]
    - [26, 97.996]
  - - [17445, 17445, 1, 4101]
    - [26, 97.761]
  - - [19343, 19343, 1, 4101]
    - [27, 97.597]
  - - [21581, 21581, 1, 223]
    - [31, 97.003]
  - - [21581, 21581, 1, 511]
    - [34, 97.349]
  - - [21581, 21581, 1, 2201]
    - [32, 97.466]
  - - [21581, 21581, 1, 4101]
    - [35, 97.562]
  - - [25854, 25854, 1, 223]
    - [32, 97.598]
  - - [25854, 25854, 1, 511]
    - [33, 97.93]
  - - [25854, 25854, 1, 2201]
    - [31, 98.042]
  - - [25854, 25854, 1, 4101]
    - [36, 98.11]
  - - [30421, 30421, 1, 223]
    - [33, 97.318]
  - - [30421, 30421, 1, 511]
    - [33, 97.621]
  - - [30421, 30421, 1, 2201]
    - [37, 97.754]
  - - [30421, 30421, 1, 4101]
    - [35, 97.854]
  - - [35882, 35882, 1, 223]
    - [32, 97.352]
  - - [35882, 35882, 1, 511]
    - [31, 97.647]
  - - [35882, 35882, 1, 2201]
    - [36, 97.733]
  - - [35882, 35882, 1, 4101]
    - [32, 97.799]
  - - [40401, 40401, 1, 223]
    - [32, 97.438]
  - - [40401, 40401, 1, 511]
    - [31, 97.72]
  - - [40401, 40401, 1, 2201]
    - [37, 97.848]
  - - [40401, 40401, 1, 4101]
    - [35, 97.888]
  - - [45312, 45312, 1, 223]
    - [32, 97.705]
  - - [45312, 45312, 1, 511]
    - [34, 97.981]
  - - [45312, 45312, 1, 2201]
    - [37, 98.109]
  - - [45312, 45312, 1, 4101]
    - [37, 98.131]
  - - [51821, 51821, 1, 223]
    - [33, 97.63]
  - - [51821, 51821, 1, 511]
    - [32, 97.911]
  - - [51821, 51821, 1, 2201]
    - [34, 97.991]
  - - [51821, 51821, 1, 4101]
    - [31, 98.055]
  - - [60766, 60766, 1, 223]
    - [31, 97.606]
  - - [60766, 60766, 1, 511]
    - [34, 97.881]
  - - [60766, 60766, 1, 2201]
    - [32, 97.961]
  - - [60766, 60766, 1, 4101]
    - [36, 98.025]
  - - [67143, 67143, 1, 223]
    - [33, 97.555]
  - - [67143, 67143, 1, 511]
    - [33, 97.829]
  - - [67143, 67143, 1, 2201]
    - [33, 97.906]
  - - [67143, 67143, 1, 4101]
    - [33, 97.968]
- null
