library/src/blas3/Tensile/Logic/asm_full/aldebaran/aldebaran_Cijk_Alik_Bljk_CB.yaml
- {MinimumRequiredVersion: 4.21.0}
- aldebaran
- gfx90a
- [Device 0050, Device 0051, Device 0052, Device 0054, Device 0062, Device 7400, Device
    SolutionIndex: 0
    SolutionNameMin: Cijk_Alik_Bljk_CB_MT32x32x16_MI16x16x4x1_SE_1LDSB0_IU4_SIA2_SRVW0
    SolutionIndex: 1
    SolutionNameMin: Cijk_Alik_Bljk_CB_MT128x64x16_MI32x32x2x1_SE_1LDSB0_IU1_SIA3_SRVW2
    SolutionIndex: 2
    SolutionNameMin: Cijk_Alik_Bljk_CB_MT64x64x8_MI16x16x4x1_SE_1LDSB1_IU2_SIA2_SRVW2
    SolutionIndex: 3
    SolutionNameMin: Cijk_Alik_Bljk_CB_MT128x64x16_MI16x16x4x1_SE_1LDSB1_IU4_SIA2_SRVW2
    SolutionIndex: 4
    SolutionNameMin: Cijk_Alik_Bljk_CB_MT64x64x8_MI16x16x4x1_SE_1LDSB0_IU2_SIA2_SRVW0
    SolutionIndex: 5
    SolutionNameMin: Cijk_Alik_Bljk_CB_MT64x64x16_MI16x16x4x1_SE_1LDSB0_IU1_SIA3_SRVW0
    SolutionIndex: 6
    SolutionNameMin: Cijk_Alik_Bljk_CB_MT64x64x16_MI16x16x4x1_SN_LRVW2_NEPBS0_PLR5_SU0_SUS0_TT2_32_WG32_8_1_WGM4
    SolutionIndex: 7
    SolutionNameMin: Cijk_Alik_Bljk_CB_MT256x64x8_MI32x32x2x1_SN_LRVW2_NEPBS0_PLR5_SU0_SUS0_TT2_64_WG128_2_1_WGM2
    SolutionIndex: 8
    SolutionNameMin: Cijk_Alik_Bljk_CB_MT256x64x8_MI32x32x2x1_SN_LRVW2_NEPBS0_PLR5_SU0_SUS0_TT2_64_WG128_2_1_WGM6
    SolutionIndex: 9
    SolutionNameMin: Cijk_Alik_Bljk_CB_MT256x64x8_MI32x32x2x1_SN_LRVW2_NEPBS0_PLR5_SU0_SUS0_TT2_64_WG128_2_1_WGM12
    SolutionIndex: 10
    SolutionNameMin: Cijk_Alik_Bljk_CB_MT256x64x8_MI32x32x2x1_SN_LRVW2_NEPBS0_PLR5_SU32_SUS256_TT2_64_WG128_2_1_WGM12
    SolutionIndex: 11
    SolutionNameMin: Cijk_Alik_Bljk_CB_MT64x64x16_MI16x16x4x1_SN_LRVW2_NEPBS0_PLR5_SU0_SUS0_TT2_32_WG32_8_1_WGM5
    SolutionIndex: 12
    SolutionNameMin: Cijk_Alik_Bljk_CB_MT64x64x16_MI16x16x4x1_SN_LRVW2_NEPBS0_PLR5_SU0_SUS0_TT2_32_WG32_8_1_WGM2
    SolutionIndex: 13
    SolutionNameMin: Cijk_Alik_Bljk_CB_MT128x64x8_MI16x16x4x1_SN_LRVW1_NEPBS0_PLR1_SU0_SUS0_TT2_64_WG64_4_1_WGM2
    SolutionIndex: 14
    SolutionNameMin: Cijk_Alik_Bljk_CB_MT128x64x8_MI16x16x4x1_SN_LRVW1_NEPBS0_PLR1_SU0_SUS0_TT2_64_WG64_4_1_WGM8
    SolutionIndex: 15
    SolutionNameMin: Cijk_Alik_Bljk_CB_MT128x64x8_MI16x16x4x1_SN_LRVW1_NEPBS1_PLR1_SU32_SUS256_TT2_64_WG64_4_1_WGM10
    SolutionIndex: 16
    SolutionNameMin: Cijk_Alik_Bljk_CB_MT128x64x8_MI16x16x4x1_SN_LRVW1_NEPBS1_PLR1_SU32_SUS256_TT2_64_WG64_4_1_WGM8
    SolutionIndex: 17
    SolutionNameMin: Cijk_Alik_Bljk_CB_MT128x64x8_MI16x16x4x1_SN_LRVW1_NEPBS1_PLR1_SU32_SUS256_TT2_64_WG64_4_1_WGM12
    SolutionIndex: 18
    SolutionNameMin: Cijk_Alik_Bljk_CB_MT128x64x8_MI16x16x4x1_SN_LRVW1_NEPBS0_PLR1_SU0_SUS0_TT2_64_WG64_4_1_WGM12
    SolutionIndex: 19
    SolutionNameMin: Cijk_Alik_Bljk_CB_MT128x64x8_MI16x16x4x1_SN_LRVW1_NEPBS1_PLR1_SU0_SUS0_TT2_64_WG64_4_1_WGM12
    SolutionIndex: 20
    SolutionNameMin: Cijk_Alik_Bljk_CB_MT128x64x8_MI16x16x4x1_SN_LRVW1_NEPBS1_PLR1_SU0_SUS0_TT2_64_WG64_4_1_WGM10
    SolutionIndex: 21
    SolutionNameMin: Cijk_Alik_Bljk_CB_MT64x64x16_MI16x16x4x1_SN_LRVW2_NEPBS1_PLR5_SU32_SUS256_TT2_32_WG32_8_1_WGM7
    SolutionIndex: 22
    SolutionNameMin: Cijk_Alik_Bljk_CB_MT64x64x16_MI16x16x4x1_SN_LRVW2_NEPBS1_PLR5_SU0_SUS0_TT2_32_WG32_8_1_WGM6
    SolutionIndex: 23
    SolutionNameMin: Cijk_Alik_Bljk_CB_MT64x64x16_MI16x16x4x1_SN_LRVW2_NEPBS1_PLR5_SU32_SUS256_TT2_32_WG32_8_1_WGM6
    SolutionIndex: 24
    SolutionNameMin: Cijk_Alik_Bljk_CB_MT64x64x16_MI16x16x4x1_SN_LRVW2_NEPBS1_PLR5_SU0_SUS0_TT2_32_WG32_8_1_WGM12
    SolutionIndex: 25
    SolutionNameMin: Cijk_Alik_Bljk_CB_MT64x64x16_MI16x16x4x1_SN_LRVW2_NEPBS1_PLR5_SU32_SUS256_TT2_32_WG32_8_1_WGM10
    SolutionIndex: 26
    SolutionNameMin: Cijk_Alik_Bljk_CB_MT64x64x16_MI16x16x4x1_SN_LRVW2_NEPBS1_PLR5_SU0_SUS0_TT2_32_WG32_8_1_WGM7
    SolutionIndex: 27
    SolutionNameMin: Cijk_Alik_Bljk_CB_MT128x64x8_MI16x16x4x1_SN_LRVW1_NEPBS0_PLR1_SU32_SUS256_TT2_64_WG64_4_1_WGM6
    SolutionIndex: 28
    SolutionNameMin: Cijk_Alik_Bljk_CB_MT64x64x16_MI16x16x4x1_SN_LRVW2_NEPBS1_PLR5_SU32_SUS256_TT2_32_WG32_8_1_WGM4
    SolutionIndex: 29
    SolutionNameMin: Cijk_Alik_Bljk_CB_MT64x64x16_MI16x16x4x1_SN_LRVW2_NEPBS1_PLR5_SU0_SUS0_TT2_32_WG32_8_1_WGM5
    SolutionIndex: 30
    SolutionNameMin: Cijk_Alik_Bljk_CB_MT64x64x16_MI16x16x4x1_SN_LRVW2_NEPBS1_PLR5_SU32_SUS256_TT2_32_WG32_8_1_WGM12
    SolutionIndex: 31
    SolutionNameMin: Cijk_Alik_Bljk_CB_MT64x64x16_MI16x16x4x1_SN_LRVW2_NEPBS1_PLR5_SU0_SUS0_TT2_32_WG32_8_1_WGM10
    SolutionIndex: 32
    SolutionNameMin: Cijk_Alik_Bljk_CB_MT64x64x16_MI16x16x4x1_SN_LRVW2_NEPBS1_PLR5_SU32_SUS256_TT2_32_WG32_8_1_WGM5
    SolutionIndex: 33
    SolutionNameMin: Cijk_Alik_Bljk_CB_MT64x64x16_MI16x16x4x1_SN_LRVW2_NEPBS1_PLR5_SU0_SUS0_TT2_32_WG32_8_1_WGM8
    SolutionIndex: 34
    SolutionNameMin: Cijk_Alik_Bljk_CB_MT128x64x16_MI16x16x4x1_SN_LRVW2_NEPBS0_PLR5_SU32_SUS256_TT2_64_WG64_4_1_WGM8
    SolutionIndex: 35
    SolutionNameMin: Cijk_Alik_Bljk_CB_MT64x64x16_MI16x16x4x1_SN_LRVW2_NEPBS0_PLR5_SU0_SUS0_TT2_32_WG32_8_1_WGM7
    SolutionIndex: 36
    SolutionNameMin: Cijk_Alik_Bljk_CB_MT128x64x8_MI16x16x4x1_SN_LRVW1_PLR1_TT2_64_WG64_4_1_WGM5
    SolutionIndex: 37
    SolutionNameMin: Cijk_Alik_Bljk_CB_MT128x64x8_MI16x16x4x1_SN_LRVW1_PLR1_TT2_64_WG64_4_1_WGM6
    SolutionIndex: 38
    SolutionNameMin: Cijk_Alik_Bljk_CB_MT128x64x8_MI16x16x4x1_SN_LRVW1_PLR1_TT2_64_WG64_4_1_WGM7
    SolutionIndex: 39
    SolutionNameMin: Cijk_Alik_Bljk_CB_MT128x64x16_MI16x16x4x1_SN_LRVW2_PLR5_TT2_64_WG64_4_1_WGM8
    SolutionIndex: 40
    SolutionNameMin: Cijk_Alik_Bljk_CB_MT256x64x8_MI32x32x2x1_SN_LRVW2_PLR5_TT2_64_WG128_2_1_WGM8
    SolutionIndex: 41
    SolutionNameMin: Cijk_Alik_Bljk_CB_MT256x64x8_MI32x32x2x1_SN_LRVW2_PLR5_TT2_64_WG128_2_1_WGM7
    SolutionIndex: 42
    SolutionNameMin: Cijk_Alik_Bljk_CB_MT128x96x16_MI16x16x4x1_SN_LRVW2_PLR5_TT2_96_WG64_4_1_WGM8
    SolutionIndex: 43
    SolutionNameMin: Cijk_Alik_Bljk_CB_MT128x64x16_MI16x16x4x1_SN_LRVW2_PLR5_TT2_64_WG64_4_1_WGM6
    SolutionIndex: 44
    SolutionNameMin: Cijk_Alik_Bljk_CB_MT64x64x8_MI32x32x2x1_SN_1LDSB1_AMAS0_GRVW1_LBSPP0_LPA1_LPB1_MIAV1_NEPBS4_PLR5_SU0_SUS0_SVW1_TT1_32_TLDS0_VW1_WG64_4_1
    SolutionIndex: 45
    SolutionNameMin: Cijk_Alik_Bljk_CB_MT128x64x8_MI16x16x4x1_SN_1LDSB1_AMAS3_GRVW2_LBSPP0_LPA2_LPB2_MIAV1_NEPBS2_PLR3_SU32_SUS256_SVW2_TT2_64_TLDS0_VW2_WG64_4_1
- - - [7680, 8192, 1, 8192]
    - [1, 98.537]
  - - [64, 1, 1, 256]
    - [4, 0.012]
  - - [960, 1024, 1, 1024]
    - [2, 93.853]
  - - [1920, 2048, 1, 2048]
    - [3, 97.447]
  - - [3840, 4096, 1, 4096]
    - [3, 98.561]
  - - [480, 512, 1, 512]
    - [0, 66.11]
  - - [1, 1, 1, 256]
    - [4, 0.0]
  - - [64, 64, 2, 64]
    - [5, 0.575]
  - - [1, 64, 1, 256]
    - [4, 0.012]
  - - [64, 64, 1, 256]
    - [5, 0.527]
  - - [2001, 2001, 1, 51]
    - [6, 43.697]
  - - [3001, 3001, 1, 51]
    - [7, 54.123]
  - - [4454, 4454, 1, 51]
    - [8, 67.994]
  - - [6454, 6454, 1, 51]
    - [7, 74.687]
  - - [7985, 7985, 1, 51]
    - [7, 73.895]
  - - [9603, 9603, 1, 51]
    - [7, 73.164]
  - - [11505, 11505, 1, 51]
    - [7, 69.794]
  - - [13179, 13179, 1, 51]
    - [9, 71.922]
  - - [15420, 15420, 1, 51]
    - [10, 81.165]
  - - [17445, 17445, 1, 51]
    - [9, 71.337]
  - - [19343, 19343, 1, 51]
    - [9, 70.409]
  - - [21581, 21581, 1, 51]
    - [9, 71.173]
  - - [25854, 25854, 1, 51]
    - [10, 72.949]
  - - [30421, 30421, 1, 51]
    - [9, 69.623]
  - - [35882, 35882, 1, 51]
    - [9, 74.213]
  - - [40401, 40401, 1, 51]
    - [10, 70.745]
  - - [45312, 45312, 1, 51]
    - [9, 86.34]
  - - [51821, 51821, 1, 51]
    - [9, 70.529]
  - - [60766, 60766, 1, 51]
    - [9, 74.569]
  - - [67143, 67143, 1, 51]
    - [9, 71.507]
  - - [2001, 2001, 1, 103]
    - [11, 69.462]
  - - [3001, 3001, 1, 103]
    - [12, 81.128]
  - - [4454, 4454, 1, 103]
    - [13, 89.006]
  - - [6454, 6454, 1, 103]
    - [13, 91.993]
  - - [7985, 7985, 1, 103]
    - [14, 92.86]
  - - [9603, 9603, 1, 103]
    - [15, 93.281]
  - - [11505, 11505, 1, 103]
    - [16, 94.875]
  - - [13179, 13179, 1, 103]
    - [17, 95.179]
  - - [15420, 15420, 1, 103]
    - [14, 95.774]
  - - [17445, 17445, 1, 103]
    - [17, 95.633]
  - - [19343, 19343, 1, 103]
    - [15, 95.736]
  - - [21581, 21581, 1, 103]
    - [15, 96.091]
  - - [25854, 25854, 1, 103]
    - [18, 96.578]
  - - [30421, 30421, 1, 103]
    - [19, 96.53]
  - - [35882, 35882, 1, 103]
    - [18, 96.577]
  - - [40401, 40401, 1, 103]
    - [17, 96.663]
  - - [45312, 45312, 1, 103]
    - [18, 97.116]
  - - [51821, 51821, 1, 103]
    - [15, 96.758]
  - - [60766, 60766, 1, 103]
    - [20, 96.84]
  - - [67143, 67143, 1, 103]
    - [19, 96.845]
  - - [2001, 2001, 1, 223]
    - [14, 79.737]
  - - [3001, 3001, 1, 223]
    - [21, 89.235]
  - - [4454, 4454, 1, 223]
    - [22, 93.159]
  - - [6454, 6454, 1, 223]
    - [23, 95.442]
  - - [7985, 7985, 1, 223]
    - [24, 96.08]
  - - [9603, 9603, 1, 223]
    - [25, 95.365]
  - - [11505, 11505, 1, 223]
    - [16, 96.651]
  - - [13179, 13179, 1, 223]
    - [37, 97.068]
  - - [15420, 15420, 1, 223]
    - [26, 97.072]
  - - [17445, 17445, 1, 223]
    - [26, 96.946]
  - - [19343, 19343, 1, 223]
    - [26, 96.823]
  - - [2001, 2001, 1, 511]
    - [27, 86.535]
  - - [3001, 3001, 1, 511]
    - [28, 92.938]
  - - [4454, 4454, 1, 511]
    - [29, 95.276]
  - - [6454, 6454, 1, 511]
    - [22, 96.765]
  - - [7985, 7985, 1, 511]
    - [24, 97.059]
  - - [9603, 9603, 1, 511]
    - [30, 96.071]
  - - [11505, 11505, 1, 511]
    - [36, 97.24]
  - - [13179, 13179, 1, 511]
    - [38, 97.592]
  - - [15420, 15420, 1, 511]
    - [26, 97.66]
  - - [17445, 17445, 1, 511]
    - [31, 97.449]
  - - [19343, 19343, 1, 511]
    - [24, 97.307]
  - - [2001, 2001, 1, 2201]
    - [13, 91.712]
  - - [3001, 3001, 1, 2201]
    - [23, 95.208]
  - - [4454, 4454, 1, 2201]
    - [32, 96.503]
  - - [6454, 6454, 1, 2201]
    - [33, 97.443]
  - - [7985, 7985, 1, 2201]
    - [24, 97.549]
  - - [9603, 9603, 1, 2201]
    - [26, 96.42]
  - - [11505, 11505, 1, 2201]
    - [33, 97.5]
  - - [13179, 13179, 1, 2201]
    - [24, 97.81]
  - - [15420, 15420, 1, 2201]
    - [22, 97.905]
  - - [17445, 17445, 1, 2201]
    - [24, 97.679]
  - - [19343, 19343, 1, 2201]
    - [26, 97.52]
  - - [2001, 2001, 1, 4101]
    - [34, 92.803]
  - - [3001, 3001, 1, 4101]
    - [35, 95.598]
  - - [4454, 4454, 1, 4101]
    - [22, 96.735]
  - - [6454, 6454, 1, 4101]
    - [22, 97.599]
  - - [7985, 7985, 1, 4101]
    - [22, 97.678]
  - - [9603, 9603, 1, 4101]
    - [22, 96.521]
  - - [11505, 11505, 1, 4101]
    - [26, 97.599]
  - - [13179, 13179, 1, 4101]
    - [31, 97.903]
  - - [15420, 15420, 1, 4101]
    - [22, 97.994]
  - - [17445, 17445, 1, 4101]
    - [24, 97.764]
  - - [19343, 19343, 1, 4101]
    - [26, 97.601]
  - - [21581, 21581, 1, 223]
    - [16, 96.986]
  - - [21581, 21581, 1, 511]
    - [37, 97.344]
  - - [21581, 21581, 1, 2201]
    - [37, 97.455]
  - - [21581, 21581, 1, 4101]
    - [38, 97.509]
  - - [25854, 25854, 1, 223]
    - [16, 97.59]
  - - [25854, 25854, 1, 511]
    - [36, 97.923]
  - - [25854, 25854, 1, 2201]
    - [37, 98.033]
  - - [25854, 25854, 1, 4101]
    - [39, 97.976]
  - - [30421, 30421, 1, 223]
    - [16, 97.304]
  - - [30421, 30421, 1, 511]
    - [36, 97.612]
  - - [30421, 30421, 1, 2201]
    - [40, 97.717]
  - - [30421, 30421, 1, 4101]
    - [40, 97.752]
  - - [35882, 35882, 1, 223]
    - [16, 97.341]
  - - [35882, 35882, 1, 511]
    - [36, 97.638]
  - - [35882, 35882, 1, 2201]
    - [38, 97.728]
  - - [35882, 35882, 1, 4101]
    - [39, 97.68]
  - - [40401, 40401, 1, 223]
    - [16, 97.423]
  - - [40401, 40401, 1, 511]
    - [36, 97.713]
  - - [40401, 40401, 1, 2201]
    - [41, 97.811]
  - - [40401, 40401, 1, 4101]
    - [40, 97.843]
  - - [45312, 45312, 1, 223]
    - [16, 97.698]
  - - [45312, 45312, 1, 511]
    - [37, 97.975]
  - - [45312, 45312, 1, 2201]
    - [38, 98.058]
  - - [45312, 45312, 1, 4101]
    - [41, 98.094]
  - - [51821, 51821, 1, 223]
    - [38, 97.618]
  - - [51821, 51821, 1, 511]
    - [37, 97.903]
  - - [51821, 51821, 1, 2201]
    - [37, 97.987]
  - - [51821, 51821, 1, 4101]
    - [39, 97.934]
  - - [60766, 60766, 1, 223]
    - [16, 97.601]
  - - [60766, 60766, 1, 511]
    - [36, 97.876]
  - - [60766, 60766, 1, 2201]
    - [38, 97.957]
  - - [60766, 60766, 1, 4101]
    - [42, 97.905]
  - - [67143, 67143, 1, 223]
    - [16, 97.551]
  - - [67143, 67143, 1, 511]
    - [36, 97.823]
  - - [67143, 67143, 1, 2201]
    - [38, 97.902]
  - - [67143, 67143, 1, 4101]
    - [43, 97.843]
  - - [1031, 1031, 1, 1031]
    - [44, 66.808]
  - - [4095, 4095, 1, 1031]
    - [45, 87.855]
- null
