library/src/blas3/Tensile/Logic/asm_full/aldebaran/aldebaran_Cijk_Ailk_Bjlk_DB.yaml
- {MinimumRequiredVersion: 4.8.1}
- aldebaran
- gfx90a
- [Device 0050, Device 0051, Device 0052, Device 0054, Device 0062, Device 7400, Device
    SolutionIndex: 0
    SolutionNameMin: Cijk_Ailk_Bjlk_DB_MT064x064x04_PLR1_TT04_04_WG16_16_01
    SolutionIndex: 14
    SolutionNameMin: Cijk_Ailk_Bjlk_DB_MT128x128x8_MI16x16x4x1_SN_EPS0_GRVW2_IU1_PGR2_PLR3_SU32_SUS256_TT2_128_WG64_4_1_WGM5
    SolutionIndex: 15
    SolutionNameMin: Cijk_Ailk_Bjlk_DB_MT128x128x8_MI16x16x4x1_SN_EPS0_GRVW1_IU1_PGR2_PLR1_SU0_SUS256_TT2_128_WG64_4_1_WGM11
    SolutionIndex: 16
    SolutionNameMin: Cijk_Ailk_Bjlk_DB_MT128x128x8_MI16x16x4x1_SN_EPS0_GRVW2_IU1_PGR2_PLR1_SU0_SUS256_TT4_64_WG32_8_1_WGM5
    SolutionIndex: 17
    SolutionNameMin: Cijk_Ailk_Bjlk_DB_MT128x128x8_MI16x16x4x1_SN_EPS0_GRVW2_IU1_PGR2_PLR3_SU0_SUS256_TT2_128_WG64_4_1_WGM5
    SolutionIndex: 18
    SolutionNameMin: Cijk_Ailk_Bjlk_DB_MT128x128x8_MI16x16x4x1_SN_EPS0_GRVW2_IU1_PGR2_PLR3_SU0_SUS128_TT4_64_WG32_8_1_WGM11
    SolutionIndex: 19
    SolutionNameMin: Cijk_Ailk_Bjlk_DB_MT128x128x8_MI16x16x4x1_SN_EPS0_GRVW2_IU1_PGR2_PLR1_SU0_SUS256_TT2_128_WG64_4_1_WGM5
    SolutionIndex: 20
    SolutionNameMin: Cijk_Ailk_Bjlk_DB_MT128x128x8_MI16x16x4x1_SN_EPS0_GRVW2_IU1_PGR2_PLR3_SU32_SUS256_TT2_128_WG64_4_1_WGM11
    SolutionIndex: 21
    SolutionNameMin: Cijk_Ailk_Bjlk_DB_MT128x128x8_MI16x16x4x1_SN_EPS0_GRVW2_IU1_PGR2_PLR3_SU0_SUS256_TT4_64_WG32_8_1_WGM5
    SolutionIndex: 22
    SolutionNameMin: Cijk_Ailk_Bjlk_DB_MT128x128x8_MI16x16x4x1_SN_EPS0_GRVW1_IU1_PGR2_PLR1_SU0_SUS256_TT4_64_WG32_8_1_WGM5
    SolutionIndex: 23
    SolutionNameMin: Cijk_Ailk_Bjlk_DB_MT128x128x8_MI16x16x4x1_SN_EPS0_GRVW2_IU1_PGR2_PLR3_SU32_SUS128_TT2_128_WG64_4_1_WGM5
    SolutionIndex: 24
    SolutionNameMin: Cijk_Ailk_Bjlk_DB_MT128x128x8_MI16x16x4x1_SN_EPS0_GRVW1_IU1_PGR2_PLR3_SU0_SUS128_TT4_64_WG32_8_1_WGM11
    SolutionIndex: 25
    SolutionNameMin: Cijk_Ailk_Bjlk_DB_MT128x128x8_MI16x16x4x1_SN_EPS0_GRVW1_IU1_PGR2_PLR3_SU0_SUS256_TT2_128_WG64_4_1_WGM5
    SolutionIndex: 26
    SolutionNameMin: Cijk_Ailk_Bjlk_DB_MT128x128x8_MI16x16x4x1_SN_EPS0_GRVW1_IU1_PGR2_PLR1_SU0_SUS256_TT2_128_WG64_4_1_WGM5
    SolutionIndex: 27
    SolutionNameMin: Cijk_Ailk_Bjlk_DB_MT128x128x8_MI16x16x4x1_SN_EPS0_GRVW2_IU1_PGR2_PLR3_SU0_SUS128_TT2_128_WG64_4_1_WGM11
    SolutionIndex: 28
    SolutionNameMin: Cijk_Ailk_Bjlk_DB_MT128x128x8_MI16x16x4x1_SN_EPS0_GRVW2_IU1_PGR2_PLR1_SU32_SUS256_TT2_128_WG64_4_1_WGM5
    SolutionIndex: 29
    SolutionNameMin: Cijk_Ailk_Bjlk_DB_MT128x128x8_MI16x16x4x1_SN_EPS0_GRVW1_IU1_PGR2_PLR1_SU0_SUS128_TT4_64_WG32_8_1_WGM11
    SolutionIndex: 30
    SolutionNameMin: Cijk_Ailk_Bjlk_DB_MT128x128x8_MI16x16x4x1_SN_EPS0_GRVW1_IU1_PGR2_PLR3_SU0_SUS256_TT2_128_WG64_4_1_WGM11
    SolutionIndex: 31
    SolutionNameMin: Cijk_Ailk_Bjlk_DB_MT128x128x8_MI16x16x4x1_SN_EPS0_GRVW2_IU1_PGR2_PLR1_SU32_SUS256_TT2_128_WG64_4_1_WGM11
    SolutionIndex: 32
    SolutionNameMin: Cijk_Ailk_Bjlk_DB_MT128x128x8_MI16x16x4x1_SN_EPS0_GRVW2_IU1_PGR2_PLR3_SU32_SUS256_TT4_64_WG32_8_1_WGM11
    SolutionIndex: 33
    SolutionNameMin: Cijk_Ailk_Bjlk_DB_MT128x128x8_MI16x16x4x1_SN_EPS0_GRVW2_IU1_PGR2_PLR1_SU32_SUS256_TT4_64_WG32_8_1_WGM11
    SolutionIndex: 34
    SolutionNameMin: Cijk_Ailk_Bjlk_DB_MT128x128x8_MI16x16x4x1_SN_EPS0_GRVW2_IU1_PGR2_PLR1_SU0_SUS256_TT2_128_WG64_4_1_WGM11
    SolutionIndex: 35
    SolutionNameMin: Cijk_Ailk_Bjlk_DB_MT128x128x16_MI16x16x4x1_SN_EPS0_GRVW2_IU1_PGR2_PLR1_SU0_SUS256_TT4_64_WG32_8_1_WGM5
    SolutionIndex: 36
    SolutionNameMin: Cijk_Ailk_Bjlk_DB_MT128x128x16_MI16x16x4x1_SN_EPS0_GRVW2_IU2_PGR2_PLR1_SU0_SUS128_TT2_128_WG64_4_1_WGM5
    SolutionIndex: 37
    SolutionNameMin: Cijk_Ailk_Bjlk_DB_MT128x128x8_MI16x16x4x1_SN_EPS0_GRVW2_IU1_PGR2_PLR3_SU32_SUS128_TT4_64_WG32_8_1_WGM11
    SolutionIndex: 38
    SolutionNameMin: Cijk_Ailk_Bjlk_DB_MT128x128x8_MI16x16x4x1_SN_EPS0_GRVW2_IU1_PGR2_PLR3_SU32_SUS256_TT4_64_WG32_8_1_WGM5
    SolutionIndex: 39
    SolutionNameMin: Cijk_Ailk_Bjlk_DB_MT128x128x16_MI16x16x4x1_SN_EPS0_GRVW2_IU2_PGR2_PLR3_SU0_SUS128_TT2_128_WG64_4_1_WGM5
    SolutionIndex: 40
    SolutionNameMin: Cijk_Ailk_Bjlk_DB_MT128x128x8_MI16x16x4x1_SN_EPS0_GRVW2_IU1_PGR2_PLR1_SU32_SUS128_TT2_128_WG64_4_1_WGM5
    SolutionIndex: 41
    SolutionNameMin: Cijk_Ailk_Bjlk_DB_MT128x128x8_MI16x16x4x1_SN_EPS0_GRVW2_IU1_PGR2_PLR1_SU0_SUS128_TT4_64_WG32_8_1_WGM11
    SolutionIndex: 42
    SolutionNameMin: Cijk_Ailk_Bjlk_DB_MT128x128x8_MI16x16x4x1_SN_EPS0_GRVW1_IU1_PGR2_PLR3_SU0_SUS128_TT4_64_WG32_8_1_WGM5
    SolutionIndex: 43
    SolutionNameMin: Cijk_Ailk_Bjlk_DB_MT128x128x8_MI16x16x4x1_SN_EPS0_GRVW2_IU1_PGR2_PLR1_SU32_SUS128_TT2_128_WG64_4_1_WGM11
    SolutionIndex: 44
    SolutionNameMin: Cijk_Ailk_Bjlk_DB_MT128x128x8_MI16x16x4x1_SN_EPS0_GRVW2_IU1_PGR2_PLR1_SU32_SUS256_TT4_64_WG32_8_1_WGM5
    SolutionIndex: 45
    SolutionNameMin: Cijk_Ailk_Bjlk_DB_MT128x128x8_MI16x16x4x1_SN_EPS0_GRVW2_IU1_PGR2_PLR1_SU32_SUS128_TT4_64_WG32_8_1_WGM11
    SolutionIndex: 46
    SolutionNameMin: Cijk_Ailk_Bjlk_DB_MT128x128x16_MI16x16x4x1_SN_EPS0_GRVW2_IU2_PGR2_PLR3_SU32_SUS256_TT2_128_WG64_4_1_WGM5
    SolutionIndex: 47
    SolutionNameMin: Cijk_Ailk_Bjlk_DB_MT128x128x8_MI16x16x4x1_SN_EPS0_GRVW1_IU1_PGR2_PLR1_SU0_SUS256_TT8_32_WG16_16_1_WGM5
    SolutionIndex: 48
    SolutionNameMin: Cijk_Ailk_Bjlk_DB_MT128x128x8_MI16x16x4x1_SN_EPS0_GRVW2_IU1_PGR2_PLR3_SU32_SUS128_TT4_64_WG32_8_1_WGM5
    SolutionIndex: 49
    SolutionNameMin: Cijk_Ailk_Bjlk_DB_MT128x128x8_MI16x16x4x1_SN_EPS0_GRVW1_IU1_PGR2_PLR3_SU0_SUS256_TT8_32_WG16_16_1_WGM5
    SolutionIndex: 50
    SolutionNameMin: Cijk_Ailk_Bjlk_DB_MT128x128x8_MI16x16x4x1_SN_EPS0_GRVW2_IU1_PGR2_PLR1_SU32_SUS128_TT4_64_WG32_8_1_WGM5
    SolutionIndex: 51
    SolutionNameMin: Cijk_Ailk_Bjlk_DB_MT128x128x8_MI16x16x4x1_SN_EPS0_GRVW2_IU1_PGR2_PLR3_SU32_SUS128_TT2_128_WG64_4_1_WGM11
    SolutionIndex: 52
    SolutionNameMin: Cijk_Ailk_Bjlk_DB_MT128x128x8_MI16x16x4x1_SN_EPS0_GRVW1_IU1_PGR2_PLR1_SU32_SUS128_TT2_128_WG64_4_1_WGM11
    SolutionIndex: 53
    SolutionNameMin: Cijk_Ailk_Bjlk_DB_MT128x128x16_MI16x16x4x1_SN_EPS0_GRVW2_IU2_PGR2_PLR1_SU32_SUS128_TT2_128_WG64_4_1_WGM5
    SolutionIndex: 54
    SolutionNameMin: Cijk_Ailk_Bjlk_DB_MT128x128x8_MI16x16x4x1_SN_EPS0_GRVW1_IU1_PGR2_PLR3_SU32_SUS128_TT2_128_WG64_4_1_WGM11
    SolutionIndex: 55
    SolutionNameMin: Cijk_Ailk_Bjlk_DB_MT128x128x8_MI16x16x4x1_SN_EPS0_GRVW1_IU1_PGR2_PLR1_SU32_SUS128_TT4_64_WG32_8_1_WGM5
    SolutionIndex: 56
    SolutionNameMin: Cijk_Ailk_Bjlk_DB_MT128x128x8_MI16x16x4x1_SN_EPS0_GRVW1_IU1_PGR2_PLR1_SU32_SUS128_TT2_128_WG64_4_1_WGM5
    SolutionIndex: 57
    SolutionNameMin: Cijk_Ailk_Bjlk_DB_MT128x128x8_MI16x16x4x1_SN_EPS0_GRVW1_IU1_PGR2_PLR1_SU32_SUS256_TT4_64_WG32_8_1_WGM11
    SolutionIndex: 58
    SolutionNameMin: Cijk_Ailk_Bjlk_DB_MT128x128x16_MI16x16x4x1_SN_EPS0_GRVW2_IU1_PGR2_PLR1_SU0_SUS128_TT2_128_WG64_4_1_WGM11
    SolutionIndex: 59
    SolutionNameMin: Cijk_Ailk_Bjlk_DB_MT128x128x8_MI16x16x4x1_SN_EPS0_GRVW1_IU1_PGR2_PLR3_SU32_SUS128_TT2_128_WG64_4_1_WGM5
    SolutionIndex: 60
    SolutionNameMin: Cijk_Ailk_Bjlk_DB_MT128x128x8_MI16x16x4x1_SN_EPS0_GRVW1_IU1_PGR2_PLR3_SU32_SUS256_TT2_128_WG64_4_1_WGM11
    SolutionIndex: 61
    SolutionNameMin: Cijk_Ailk_Bjlk_DB_MT128x128x8_MI16x16x4x1_SN_EPS0_GRVW1_IU1_PGR2_PLR1_SU32_SUS256_TT2_128_WG64_4_1_WGM11
    SolutionIndex: 62
    SolutionNameMin: Cijk_Ailk_Bjlk_DB_MT128x128x8_MI16x16x4x1_SN_EPS0_GRVW2_IU1_PGR2_PLR1_SU0_SUS128_TT8_32_WG16_16_1_WGM5
    SolutionIndex: 63
    SolutionNameMin: Cijk_Ailk_Bjlk_DB_MT128x128x16_MI16x16x4x1_SN_EPS0_GRVW2_IU2_PGR2_PLR1_SU32_SUS256_TT2_128_WG64_4_1_WGM5
    SolutionIndex: 64
    SolutionNameMin: Cijk_Ailk_Bjlk_DB_MT128x128x8_MI16x16x4x1_SN_EPS0_GRVW1_IU1_PGR2_PLR3_SU32_SUS128_TT4_64_WG32_8_1_WGM11
    SolutionIndex: 65
    SolutionNameMin: Cijk_Ailk_Bjlk_DB_MT128x128x8_MI16x16x4x1_SN_EPS0_GRVW1_IU1_PGR2_PLR3_SU32_SUS256_TT4_64_WG32_8_1_WGM11
    SolutionIndex: 66
    SolutionNameMin: Cijk_Ailk_Bjlk_DB_MT128x128x8_MI16x16x4x1_SN_EPS0_GRVW1_IU1_PGR2_PLR1_SU32_SUS128_TT4_64_WG32_8_1_WGM11
    SolutionIndex: 68
    SolutionNameMin: Cijk_Ailk_Bjlk_DB_MT128x128x8_MI16x16x4x1_SN_EPS0_GRVW1_IU1_PGR2_PLR3_SU32_SUS256_TT2_128_WG64_4_1_WGM5
    SolutionIndex: 69
    SolutionNameMin: Cijk_Ailk_Bjlk_DB_MT128x128x8_MI16x16x4x1_SN_EPS0_GRVW2_IU1_PGR2_PLR1_SU32_SUS256_TT8_32_WG16_16_1_WGM5
    SolutionIndex: 70
    SolutionNameMin: Cijk_Ailk_Bjlk_DB_MT128x128x16_MI16x16x4x1_SN_EPS0_GRVW2_IU1_PGR2_PLR1_SU32_SUS128_TT2_128_WG64_4_1_WGM11
    SolutionIndex: 71
    SolutionNameMin: Cijk_Ailk_Bjlk_DB_MT128x128x16_MI16x16x4x1_SN_EPS0_GRVW2_IU1_PGR2_PLR1_SU0_SUS128_TT8_32_WG16_16_1_WGM5
    SolutionIndex: 72
    SolutionNameMin: Cijk_Ailk_Bjlk_DB_MT128x128x8_MI16x16x4x1_SN_EPS0_GRVW2_IU1_PGR2_PLR3_SU0_SUS256_TT8_32_WG16_16_1_WGM5
    SolutionIndex: 73
    SolutionNameMin: Cijk_Ailk_Bjlk_DB_MT128x128x8_MI16x16x4x1_SN_EPS0_GRVW2_IU1_PGR2_PLR3_SU32_SUS256_TT8_32_WG16_16_1_WGM5
    SolutionIndex: 74
    SolutionNameMin: Cijk_Ailk_Bjlk_DB_MT128x128x16_MI16x16x4x1_SN_EPS0_GRVW2_IU2_PGR2_PLR1_SU0_SUS256_TT2_128_WG64_4_1_WGM11
    SolutionIndex: 78
    SolutionNameMin: Cijk_Ailk_Bjlk_DB_MT64x64x16_MI16x16x4x1_SN_AF0EM2_EPS0_GRVW2_IU2_PGR2_PLR3_SU0_SUS128_TT2_32_WG32_8_1_WGM5
    SolutionIndex: 79
    SolutionNameMin: Cijk_Ailk_Bjlk_DB_MT64x64x16_MI16x16x4x1_SN_AF0EM2_EPS0_GRVW2_IU2_PGR2_PLR1_SU0_SUS256_TT2_32_WG32_8_1_WGM5
    SolutionIndex: 80
    SolutionNameMin: Cijk_Ailk_Bjlk_DB_MT64x64x16_MI16x16x4x1_SN_AF0EM2_EPS0_GRVW2_IU2_PGR2_PLR1_SU0_SUS256_TT2_32_WG32_8_1_WGM11
    SolutionIndex: 81
    SolutionNameMin: Cijk_Ailk_Bjlk_DB_MT64x128x16_MI16x16x4x1_SN_AF0EM1_EPS0_GRVW2_IU2_PGR2_PLR1_SU0_SUS128_TT2_64_WG32_8_1_WGM11
    SolutionIndex: 82
    SolutionNameMin: Cijk_Ailk_Bjlk_DB_MT64x128x16_MI16x16x4x1_SN_AF0EM1_EPS0_GRVW2_IU2_PGR2_PLR1_SU0_SUS128_TT2_64_WG32_8_1_WGM5
    SolutionIndex: 83
    SolutionNameMin: Cijk_Ailk_Bjlk_DB_MT64x32x8_MI16x16x4x1_SN_AF0EM2_EPS0_GRVW2_IU2_PGR2_PLR1_SU0_SUS256_TT2_16_WG32_8_1_WGM5
    SolutionIndex: 84
    SolutionNameMin: Cijk_Ailk_Bjlk_DB_MT64x64x16_MI16x16x4x1_SN_AF0EM2_EPS0_GRVW2_IU2_PGR2_PLR3_SU0_SUS128_TT2_32_WG32_8_1_WGM11
    SolutionIndex: 85
    SolutionNameMin: Cijk_Ailk_Bjlk_DB_MT64x32x8_MI16x16x4x1_SN_AF0EM2_EPS0_GRVW2_IU2_PGR2_PLR1_SU0_SUS128_TT2_16_WG32_8_1_WGM11
    SolutionIndex: 86
    SolutionNameMin: Cijk_Ailk_Bjlk_DB_MT64x32x8_MI16x16x4x1_SN_AF0EM2_EPS0_GRVW1_IU2_PGR2_PLR1_SU0_SUS256_TT2_16_WG32_8_1_WGM5
    SolutionIndex: 87
    SolutionNameMin: Cijk_Ailk_Bjlk_DB_MT64x128x16_MI16x16x4x1_SN_AF0EM2_EPS0_GRVW2_IU2_PGR2_PLR3_SU0_SUS128_TT2_64_WG32_8_1_WGM5
    SolutionIndex: 88
    SolutionNameMin: Cijk_Ailk_Bjlk_DB_MT64x32x8_MI16x16x4x1_SN_AF0EM1_EPS0_GRVW1_IU2_PGR2_PLR1_SU0_SUS256_TT2_16_WG32_8_1_WGM11
    SolutionIndex: 89
    SolutionNameMin: Cijk_Ailk_Bjlk_DB_MT64x32x8_MI16x16x4x1_SN_AF0EM2_EPS0_GRVW2_IU2_PGR2_PLR1_SU32_SUS128_TT2_16_WG32_8_1_WGM5
    SolutionIndex: 90
    SolutionNameMin: Cijk_Ailk_Bjlk_DB_MT64x128x16_MI16x16x4x1_SN_AF0EM2_EPS0_GRVW2_IU2_PGR2_PLR3_SU0_SUS256_TT2_64_WG32_8_1_WGM11
    SolutionIndex: 91
    SolutionNameMin: Cijk_Ailk_Bjlk_DB_MT64x64x16_MI16x16x4x1_SN_AF0EM2_EPS1_GRVW2_IU2_PGR1_PLR3_SU0_SUS128_TT2_32_WG32_8_1_WGM5
    SolutionIndex: 92
    SolutionNameMin: Cijk_Ailk_Bjlk_DB_MT64x64x8_MI16x16x4x1_SN_AF0EM1_EPS1_GRVW2_IU2_PGR1_PLR1_SU0_SUS128_TT2_32_WG32_8_1_WGM5
    SolutionIndex: 93
    SolutionNameMin: Cijk_Ailk_Bjlk_DB_MT64x64x16_MI16x16x4x1_SN_AF0EM1_EPS0_GRVW2_IU2_PGR2_PLR1_SU0_SUS256_TT2_32_WG32_8_1_WGM5
    SolutionIndex: 94
    SolutionNameMin: Cijk_Ailk_Bjlk_DB_MT64x32x8_MI16x16x4x1_SN_AF0EM1_EPS0_GRVW1_IU2_PGR2_PLR1_SU32_SUS256_TT2_16_WG32_8_1_WGM5
    SolutionIndex: 95
    SolutionNameMin: Cijk_Ailk_Bjlk_DB_MT64x64x8_MI16x16x4x1_SN_AF0EM1_EPS0_GRVW1_IU2_PGR2_PLR1_SU0_SUS256_TT2_32_WG32_8_1_WGM11
    SolutionIndex: 96
    SolutionNameMin: Cijk_Ailk_Bjlk_DB_MT64x32x8_MI16x16x4x1_SN_AF0EM1_EPS0_GRVW1_IU2_PGR2_PLR1_SU32_SUS128_TT2_16_WG32_8_1_WGM11
    SolutionIndex: 97
    SolutionNameMin: Cijk_Ailk_Bjlk_DB_MT64x64x8_MI16x16x4x1_SN_AF0EM1_EPS0_GRVW1_IU2_PGR2_PLR1_SU0_SUS256_TT2_32_WG32_8_1_WGM5
    SolutionIndex: 98
    SolutionNameMin: Cijk_Ailk_Bjlk_DB_MT64x32x8_MI16x16x4x1_SN_AF0EM1_EPS0_GRVW2_IU2_PGR2_PLR1_SU32_SUS128_TT2_16_WG32_8_1_WGM5
    SolutionIndex: 99
    SolutionNameMin: Cijk_Ailk_Bjlk_DB_MT64x32x8_MI16x16x4x1_SN_AF0EM1_EPS0_GRVW2_IU2_PGR2_PLR1_SU32_SUS128_TT2_16_WG32_8_1_WGM11
    SolutionIndex: 100
    SolutionNameMin: Cijk_Ailk_Bjlk_DB_MT64x64x16_MI16x16x4x1_SN_AF0EM1_EPS1_GRVW2_IU2_PGR1_PLR3_SU0_SUS128_TT2_32_WG32_8_1_WGM5
    SolutionIndex: 101
    SolutionNameMin: Cijk_Ailk_Bjlk_DB_MT128x64x16_MI16x16x4x1_SN_AF0EM1_EPS0_GRVW2_IU2_PGR2_PLR3_SU32_SUS128_TT4_32_WG32_8_1_WGM5
    SolutionIndex: 102
    SolutionNameMin: Cijk_Ailk_Bjlk_DB_MT64x64x16_MI16x16x4x1_SN_AF0EM1_EPS0_GRVW1_IU2_PGR2_PLR1_SU0_SUS256_TT2_32_WG32_8_1_WGM5
    SolutionIndex: 103
    SolutionNameMin: Cijk_Ailk_Bjlk_DB_MT64x64x16_MI16x16x4x1_SN_AF0EM1_EPS0_GRVW2_IU2_PGR2_PLR3_SU0_SUS128_TT2_32_WG32_8_1_WGM5
    SolutionIndex: 104
    SolutionNameMin: Cijk_Ailk_Bjlk_DB_MT64x128x16_MI16x16x4x1_SN_AF0EM1_EPS0_GRVW2_IU2_PGR2_PLR3_SU0_SUS256_TT2_64_WG32_8_1_WGM11
    SolutionIndex: 105
    SolutionNameMin: Cijk_Ailk_Bjlk_DB_MT64x64x16_MI16x16x4x1_SN_AF0EM1_EPS1_GRVW2_IU2_PGR1_PLR1_SU0_SUS256_TT2_32_WG32_8_1_WGM11
    SolutionIndex: 106
    SolutionNameMin: Cijk_Ailk_Bjlk_DB_MT64x64x16_MI16x16x4x1_SN_AF0EM1_EPS1_GRVW2_IU2_PGR1_PLR1_SU0_SUS256_TT2_32_WG32_8_1_WGM5
    SolutionIndex: 107
    SolutionNameMin: Cijk_Ailk_Bjlk_DB_MT64x64x16_MI16x16x4x1_SN_AF0EM1_EPS0_GRVW2_IU2_PGR2_PLR1_SU0_SUS128_TT2_32_WG32_8_1_WGM11
    SolutionIndex: 108
    SolutionNameMin: Cijk_Ailk_Bjlk_DB_MT64x64x16_MI16x16x4x1_SN_AF0EM1_EPS1_GRVW2_IU2_PGR1_PLR3_SU0_SUS128_TT2_32_WG32_8_1_WGM11
    SolutionIndex: 109
    SolutionNameMin: Cijk_Ailk_Bjlk_DB_MT64x32x8_MI16x16x4x1_SN_AF0EM1_EPS0_GRVW1_IU2_PGR2_PLR1_SU32_SUS128_TT2_16_WG32_8_1_WGM5
    SolutionIndex: 110
    SolutionNameMin: Cijk_Ailk_Bjlk_DB_MT64x128x16_MI16x16x4x1_SN_AF0EM1_EPS0_GRVW2_IU2_PGR2_PLR3_SU0_SUS128_TT2_64_WG32_8_1_WGM5
    SolutionIndex: 111
    SolutionNameMin: Cijk_Ailk_Bjlk_DB_MT64x32x8_MI16x16x4x1_SN_AF0EM1_EPS0_GRVW2_IU2_PGR2_PLR1_SU0_SUS128_TT2_16_WG32_8_1_WGM5
    SolutionIndex: 112
    SolutionNameMin: Cijk_Ailk_Bjlk_DB_MT64x64x16_MI16x16x4x1_SN_AF0EM1_EPS0_GRVW2_IU2_PGR2_PLR3_SU0_SUS256_TT2_32_WG32_8_1_WGM11
    SolutionIndex: 113
    SolutionNameMin: Cijk_Ailk_Bjlk_DB_MT64x64x8_MI16x16x4x1_SN_AF0EM1_EPS0_GRVW2_IU2_PGR2_PLR1_SU0_SUS128_TT2_32_WG32_8_1_WGM5
    SolutionIndex: 114
    SolutionNameMin: Cijk_Ailk_Bjlk_DB_MT64x32x8_MI16x16x4x1_SN_AF0EM1_EPS0_GRVW1_IU2_PGR2_PLR1_SU0_SUS256_TT2_16_WG32_8_1_WGM5
    SolutionIndex: 115
    SolutionNameMin: Cijk_Ailk_Bjlk_DB_MT64x64x8_MI16x16x4x1_SN_AF0EM1_EPS0_GRVW2_IU2_PGR2_PLR1_SU0_SUS128_TT2_32_WG32_8_1_WGM11
    SolutionIndex: 116
    SolutionNameMin: Cijk_Ailk_Bjlk_DB_MT64x64x16_MI16x16x4x1_SN_AF0EM1_EPS0_GRVW1_IU2_PGR2_PLR3_SU0_SUS128_TT2_32_WG32_8_1_WGM5
    SolutionIndex: 117
    SolutionNameMin: Cijk_Ailk_Bjlk_DB_MT64x32x8_MI16x16x4x1_SN_AF0EM1_EPS0_GRVW2_IU2_PGR2_PLR1_SU0_SUS128_TT2_16_WG32_8_1_WGM11
    SolutionIndex: 118
    SolutionNameMin: Cijk_Ailk_Bjlk_DB_MT64x64x16_MI16x16x4x1_SN_AF0EM1_EPS1_GRVW2_IU2_PGR1_PLR1_SU32_SUS128_TT2_32_WG32_8_1_WGM11
    SolutionIndex: 119
    SolutionNameMin: Cijk_Ailk_Bjlk_DB_MT64x32x8_MI16x16x4x1_SN_AF0EM2_EPS0_GRVW2_IU2_PGR2_PLR1_SU32_SUS256_TT2_16_WG32_8_1_WGM11
    SolutionIndex: 120
    SolutionNameMin: Cijk_Ailk_Bjlk_DB_MT64x64x16_MI16x16x4x1_SN_AF0EM2_EPS0_GRVW1_IU2_PGR2_PLR1_SU0_SUS256_TT2_32_WG32_8_1_WGM5
    SolutionIndex: 121
    SolutionNameMin: Cijk_Ailk_Bjlk_DB_MT64x64x16_MI16x16x4x1_SN_AF0EM2_EPS1_GRVW2_IU2_PGR1_PLR1_SU0_SUS128_TT2_32_WG32_8_1_WGM5
    SolutionIndex: 122
    SolutionNameMin: Cijk_Ailk_Bjlk_DB_MT64x32x8_MI16x16x4x1_SN_AF0EM2_EPS0_GRVW1_IU2_PGR2_PLR1_SU0_SUS256_TT2_16_WG32_8_1_WGM11
    SolutionIndex: 123
    SolutionNameMin: Cijk_Ailk_Bjlk_DB_MT64x32x8_MI16x16x4x1_SN_AF0EM2_EPS0_GRVW1_IU2_PGR2_PLR1_SU32_SUS128_TT2_16_WG32_8_1_WGM5
    SolutionIndex: 124
    SolutionNameMin: Cijk_Ailk_Bjlk_DB_MT64x32x8_MI16x16x4x1_SN_AF0EM2_EPS0_GRVW2_IU2_PGR2_PLR1_SU32_SUS256_TT2_16_WG32_8_1_WGM5
    SolutionIndex: 125
    SolutionNameMin: Cijk_Ailk_Bjlk_DB_MT64x32x8_MI16x16x4x1_SN_AF0EM1_EPS0_GRVW1_IU2_PGR2_PLR1_SU32_SUS256_TT2_16_WG32_8_1_WGM11
    SolutionIndex: 126
    SolutionNameMin: Cijk_Ailk_Bjlk_DB_MT64x128x16_MI16x16x4x1_SN_AF0EM2_EPS0_GRVW2_IU2_PGR2_PLR1_SU0_SUS128_TT2_64_WG32_8_1_WGM11
    SolutionIndex: 127
    SolutionNameMin: Cijk_Ailk_Bjlk_DB_MT64x32x8_MI16x16x4x1_SN_AF0EM1_EPS0_GRVW2_IU2_PGR2_PLR1_SU32_SUS256_TT2_16_WG32_8_1_WGM5
    SolutionIndex: 128
    SolutionNameMin: Cijk_Ailk_Bjlk_DB_MT64x64x16_MI16x16x4x1_SN_AF0EM2_EPS1_GRVW2_IU2_PGR1_PLR1_SU0_SUS256_TT2_32_WG32_8_1_WGM11
    SolutionIndex: 129
    SolutionNameMin: Cijk_Ailk_Bjlk_DB_MT64x64x16_MI16x16x4x1_SN_AF0EM2_EPS1_GRVW2_IU2_PGR1_PLR3_SU0_SUS256_TT2_32_WG32_8_1_WGM11
    SolutionIndex: 144
    SolutionNameMin: Cijk_Ailk_Bjlk_DB_MT16x16x8_MI16x16x4x1_SN_TT1_16_WG16_4_1
    SolutionIndex: 145
    SolutionNameMin: Cijk_Ailk_Bjlk_DB_MT128x128x8_MI16x16x4x1_SN_EPS0_GRVW1_IU1_PGR2_PLR3_SU0_SUS256_TT2_128_WG64_4_1_WGM5
    SolutionIndex: 146
    SolutionNameMin: Cijk_Ailk_Bjlk_DB_MT128x128x8_MI16x16x4x1_SN_EPS0_GRVW1_IU1_PGR2_PLR3_SU0_SUS256_TT2_128_WG64_4_1_WGM11
    SolutionIndex: 147
    SolutionNameMin: Cijk_Ailk_Bjlk_DB_MT128x128x8_MI16x16x4x1_SN_EPS0_GRVW2_IU1_PGR2_PLR1_SU32_SUS128_TT2_128_WG64_4_1_WGM11
    SolutionIndex: 148
    SolutionNameMin: Cijk_Ailk_Bjlk_DB_MT128x128x16_MI16x16x4x1_SN_EPS0_GRVW2_IU2_PGR2_PLR1_SU0_SUS256_TT2_128_WG64_4_1_WGM5
    SolutionIndex: 149
    SolutionNameMin: Cijk_Ailk_Bjlk_DB_MT128x128x16_MI16x16x4x1_SN_EPS0_GRVW2_IU2_PGR2_PLR1_SU0_SUS256_TT2_128_WG64_4_1_WGM11
    SolutionIndex: 150
    SolutionNameMin: Cijk_Ailk_Bjlk_DB_MT128x128x8_MI16x16x4x1_SN_EPS0_GRVW1_IU1_PGR2_PLR1_SU0_SUS256_TT2_128_WG64_4_1_WGM5
    SolutionIndex: 151
    SolutionNameMin: Cijk_Ailk_Bjlk_DB_MT128x128x8_MI16x16x4x1_SN_EPS0_GRVW1_IU1_PGR2_PLR1_SU0_SUS256_TT2_128_WG64_4_1_WGM11
    SolutionIndex: 152
    SolutionNameMin: Cijk_Ailk_Bjlk_DB_MT128x128x8_MI16x16x4x1_SN_EPS0_GRVW2_IU1_PGR2_PLR1_SU32_SUS256_TT2_128_WG64_4_1_WGM5
    SolutionIndex: 153
    SolutionNameMin: Cijk_Ailk_Bjlk_DB_MT128x128x8_MI16x16x4x1_SN_EPS0_GRVW2_IU1_PGR2_PLR3_SU32_SUS128_TT2_128_WG64_4_1_WGM5
    SolutionIndex: 154
    SolutionNameMin: Cijk_Ailk_Bjlk_DB_MT128x128x8_MI16x16x4x1_SN_EPS0_GRVW2_IU1_PGR2_PLR1_SU32_SUS128_TT2_128_WG64_4_1_WGM5
    SolutionIndex: 155
    SolutionNameMin: Cijk_Ailk_Bjlk_DB_MT128x128x16_MI16x16x4x1_SN_EPS0_GRVW1_IU2_PGR2_PLR3_SU0_SUS256_TT2_128_WG64_4_1_WGM5
    SolutionIndex: 156
    SolutionNameMin: Cijk_Ailk_Bjlk_DB_MT128x128x16_MI16x16x4x1_SN_EPS0_GRVW2_IU1_PGR2_PLR1_SU32_SUS256_TT4_64_WG32_8_1_WGM11
    SolutionIndex: 157
    SolutionNameMin: Cijk_Ailk_Bjlk_DB_MT128x128x16_MI16x16x4x1_SN_EPS0_GRVW2_IU2_PGR2_PLR3_SU32_SUS256_TT2_128_WG64_4_1_WGM5
    SolutionIndex: 158
    SolutionNameMin: Cijk_Ailk_Bjlk_DB_MT128x128x16_MI16x16x4x1_SN_EPS0_GRVW2_IU1_PGR2_PLR1_SU32_SUS128_TT2_128_WG64_4_1_WGM5
    SolutionIndex: 168
    SolutionNameMin: Cijk_Ailk_Bjlk_DB_MT128x128x16_MI16x16x4x1_SN_PLR5_SU0_SUS0_SSO4_WGM4
    SolutionIndex: 347
    SolutionNameMin: Cijk_Ailk_Bjlk_DB_MT64x64x16_MI16x16x4x1_SN_AMAS3_GRVW1_NEPBS2_NLCA1_NLCB1_PLR5_SU0_SUS0_SVW2_TT2_32_VW2_WG32_8_1_WGM5
    SolutionIndex: 349
    SolutionNameMin: Cijk_Ailk_Bjlk_DB_MT64x96x16_MI16x16x4x1_SN_AMAS3_GRVW2_NEPBS2_NLCA1_NLCB3_PLR5_SU0_SUS0_SVW2_TT2_48_VW2_WG32_8_1_WGM5
    SolutionIndex: 393
    SolutionNameMin: Cijk_Ailk_Bjlk_DB_MT128x96x8_MI16x16x4x1_SN_AMAS3_GRVW1_NEPBS1_NLCA1_NLCB3_PLR3_SU0_SUS0_SVW2_TT2_96_VW2_WG64_4_1_WGM8
    SolutionIndex: 397
    SolutionNameMin: Cijk_Ailk_Bjlk_DB_MT128x96x8_MI16x16x4x1_SN_AMAS3_GRVW1_NEPBS1_NLCA1_NLCB3_PLR3_SU32_SUS128_SVW2_TT2_96_VW2_WG64_4_1_WGM8
    SolutionIndex: 461
    SolutionNameMin: Cijk_Ailk_Bjlk_DB_MT128x128x16_MI16x16x4x1_SN_1LDSB1_DTVA1_NEPBS0_WGM11
    SolutionIndex: 462
    SolutionNameMin: Cijk_Ailk_Bjlk_DB_MT128x128x16_MI16x16x4x1_SN_1LDSB1_DTVA1_NEPBS1_WGM11
- - - [38144, 38144, 1, 256]
    - [14, 74.893]
  - - [29568, 128, 1, 384]
    - [25, 47.913]
  - - [30848, 128, 1, 256]
    - [15, 41.422]
  - - [25728, 128, 1, 384]
    - [30, 57.278]
  - - [32256, 32256, 1, 256]
    - [16, 75.584]
  - - [7680, 7680, 1, 256]
    - [22, 73.456]
  - - [41984, 41984, 1, 256]
    - [17, 75.197]
  - - [40448, 40448, 1, 256]
    - [16, 74.937]
  - - [25728, 128, 1, 256]
    - [18, 49.099]
  - - [64, 64, 1, 64]
    - [144, 0.117]
  - - [15104, 15104, 1, 256]
    - [19, 75.487]
  - - [17280, 17280, 1, 384]
    - [19, 90.896]
  - - [34688, 128, 1, 384]
    - [15, 54.573]
  - - [27392, 27392, 1, 256]
    - [20, 74.926]
  - - [6528, 128, 1, 256]
    - [78, 37.791]
  - - [35328, 35328, 1, 256]
    - [21, 75.386]
  - - [18432, 18432, 1, 384]
    - [19, 89.766]
  - - [31232, 31232, 1, 256]
    - [37, 75.543]
  - - [7808, 128, 1, 256]
    - [79, 35.357]
  - - [38400, 38400, 1, 384]
    - [17, 90.583]
  - - [16128, 16128, 1, 256]
    - [17, 75.578]
  - - [9472, 9472, 1, 256]
    - [19, 74.227]
  - - [21888, 21888, 1, 384]
    - [20, 89.215]
  - - [38656, 38656, 1, 256]
    - [21, 74.685]
  - - [20224, 20224, 1, 256]
    - [17, 75.749]
  - - [8960, 8960, 1, 256]
    - [22, 73.31]
  - - [29952, 29952, 1, 384]
    - [19, 90.917]
  - - [36864, 36864, 1, 384]
    - [23, 87.926]
  - - [33408, 33408, 1, 384]
    - [19, 90.847]
  - - [20608, 128, 1, 384]
    - [24, 48.729]
  - - [23424, 23424, 1, 384]
    - [19, 91.11]
  - - [4864, 4864, 1, 256]
    - [25, 68.048]
  - - [21504, 21504, 1, 384]
    - [31, 89.214]
  - - [25600, 25600, 1, 256]
    - [19, 75.967]
  - - [40960, 40960, 1, 256]
    - [40, 66.623]
  - - [19200, 19200, 1, 384]
    - [19, 90.96]
  - - [64, 1, 1, 64]
    - [144, 0.002]
  - - [25088, 25088, 1, 256]
    - [32, 75.905]
  - - [41728, 41728, 1, 256]
    - [20, 73.787]
  - - [35840, 35840, 1, 256]
    - [17, 75.487]
  - - [34560, 34560, 1, 256]
    - [19, 75.1]
  - - [26368, 26368, 1, 256]
    - [17, 75.32]
  - - [5888, 5888, 1, 256]
    - [26, 70.595]
  - - [28032, 28032, 1, 384]
    - [19, 91.053]
  - - [42496, 42496, 1, 256]
    - [20, 75.137]
  - - [27008, 128, 1, 256]
    - [24, 50.615]
  - - [38400, 38400, 1, 256]
    - [17, 75.384]
  - - [11008, 11008, 1, 256]
    - [49, 73.892]
  - - [32000, 32000, 1, 256]
    - [19, 75.005]
  - - [37248, 37248, 1, 384]
    - [17, 90.692]
  - - [10496, 10496, 1, 256]
    - [17, 74.439]
  - - [16640, 16640, 1, 256]
    - [17, 75.73]
  - - [24960, 24960, 1, 384]
    - [17, 91.209]
  - - [18688, 18688, 1, 256]
    - [19, 75.593]
  - - [22272, 22272, 1, 384]
    - [27, 91.067]
  - - [15488, 128, 1, 256]
    - [42, 32.909]
  - - [28416, 28416, 1, 384]
    - [17, 90.867]
  - - [3840, 3840, 1, 256]
    - [25, 64.173]
  - - [19968, 19968, 1, 384]
    - [17, 90.738]
  - - [43776, 43776, 1, 256]
    - [20, 74.28]
  - - [35072, 35072, 1, 256]
    - [17, 75.071]
  - - [20736, 20736, 1, 256]
    - [19, 75.611]
  - - [7168, 7168, 1, 256]
    - [17, 72.544]
  - - [18432, 18432, 1, 256]
    - [19, 76.049]
  - - [38016, 38016, 1, 384]
    - [17, 91.017]
  - - [35328, 35328, 1, 384]
    - [17, 90.526]
  - - [38784, 38784, 1, 384]
    - [17, 90.979]
  - - [26112, 26112, 1, 384]
    - [19, 91.076]
  - - [27264, 27264, 1, 384]
    - [19, 90.776]
  - - [44928, 44928, 1, 384]
    - [19, 90.696]
  - - [41088, 128, 1, 384]
    - [27, 60.328]
  - - [42368, 128, 1, 256]
    - [15, 44.691]
  - - [10752, 10752, 1, 256]
    - [19, 75.284]
  - - [9088, 128, 1, 384]
    - [79, 46.368]
  - - [17152, 17152, 1, 256]
    - [16, 75.562]
  - - [44928, 128, 1, 384]
    - [27, 54.276]
  - - [7808, 128, 1, 384]
    - [80, 40.491]
  - - [29184, 29184, 1, 256]
    - [17, 75.558]
  - - [11776, 11776, 1, 256]
    - [17, 75.132]
  - - [1, 64, 1, 64]
    - [144, 0.002]
  - - [27136, 27136, 1, 256]
    - [32, 75.911]
  - - [33408, 128, 1, 256]
    - [26, 44.177]
  - - [33792, 33792, 1, 384]
    - [31, 89.232]
  - - [43520, 43520, 1, 256]
    - [28, 75.193]
  - - [14592, 14592, 1, 384]
    - [17, 90.309]
  - - [41472, 41472, 1, 256]
    - [17, 74.99]
  - - [14080, 14080, 1, 256]
    - [22, 74.446]
  - - [34688, 128, 1, 256]
    - [29, 45.463]
  - - [16896, 16896, 1, 256]
    - [17, 76.106]
  - - [15744, 15744, 1, 384]
    - [17, 90.68]
  - - [28416, 28416, 1, 256]
    - [17, 74.869]
  - - [23808, 23808, 1, 256]
    - [19, 75.555]
  - - [27648, 27648, 1, 256]
    - [17, 75.552]
  - - [1152, 3072, 1, 384]
    - [30, 63.809]
  - - [21888, 128, 1, 256]
    - [26, 43.504]
  - - [34816, 34816, 1, 256]
    - [19, 75.387]
  - - [43776, 43776, 1, 384]
    - [31, 89.916]
  - - [36096, 36096, 1, 256]
    - [31, 74.203]
  - - [24320, 24320, 1, 256]
    - [16, 75.666]
  - - [12544, 12544, 1, 256]
    - [19, 74.955]
  - - [29184, 29184, 1, 384]
    - [19, 90.781]
  - - [29568, 29568, 1, 384]
    - [16, 90.297]
  - - [12928, 128, 1, 384]
    - [81, 54.014]
  - - [36480, 36480, 1, 384]
    - [17, 90.923]
  - - [30720, 30720, 1, 256]
    - [19, 75.552]
  - - [25728, 25728, 1, 384]
    - [27, 90.933]
  - - [34048, 34048, 1, 256]
    - [32, 74.525]
  - - [12928, 128, 1, 256]
    - [82, 45.988]
  - - [9728, 9728, 1, 256]
    - [19, 74.669]
  - - [128, 128, 1, 256]
    - [83, 1.074]
  - - [33024, 33024, 1, 256]
    - [33, 75.213]
  - - [15488, 128, 1, 384]
    - [22, 37.868]
  - - [39808, 128, 1, 384]
    - [34, 59.233]
  - - [18176, 18176, 1, 256]
    - [19, 75.705]
  - - [21504, 21504, 1, 256]
    - [19, 76.075]
  - - [16384, 16384, 1, 256]
    - [40, 62.756]
  - - [27008, 128, 1, 384]
    - [35, 59.129]
  - - [27904, 27904, 1, 256]
    - [28, 75.163]
  - - [24448, 128, 1, 384]
    - [36, 55.216]
  - - [35968, 128, 1, 384]
    - [34, 55.639]
  - - [37632, 37632, 1, 256]
    - [19, 74.955]
  - - [14848, 14848, 1, 256]
    - [20, 75.624]
  - - [23552, 23552, 1, 256]
    - [19, 76.111]
  - - [4608, 4608, 1, 50000]
    - [461, 95.048]
  - - [13056, 13056, 1, 256]
    - [19, 75.313]
  - - [38528, 128, 1, 256]
    - [27, 48.177]
  - - [19584, 19584, 1, 384]
    - [17, 91.095]
  - - [16768, 128, 1, 384]
    - [22, 40.639]
  - - [22784, 22784, 1, 256]
    - [16, 75.492]
  - - [44160, 44160, 1, 384]
    - [19, 90.838]
  - - [28160, 28160, 1, 256]
    - [37, 75.558]
  - - [14592, 14592, 1, 256]
    - [47, 74.291]
  - - [20992, 20992, 1, 256]
    - [17, 76.172]
  - - [41216, 41216, 1, 256]
    - [17, 74.854]
  - - [21760, 21760, 1, 256]
    - [19, 75.734]
  - - [25344, 25344, 1, 256]
    - [31, 74.966]
  - - [4608, 4608, 1, 256]
    - [26, 69.948]
  - - [2560, 2048, 1, 256]
    - [26, 56.06]
  - - [30464, 30464, 1, 256]
    - [38, 74.371]
  - - [19200, 19200, 1, 256]
    - [17, 75.675]
  - - [22272, 22272, 1, 256]
    - [21, 75.594]
  - - [29952, 29952, 1, 256]
    - [16, 75.275]
  - - [20480, 20480, 1, 256]
    - [19, 75.812]
  - - [17408, 17408, 1, 256]
    - [17, 75.599]
  - - [32768, 32768, 1, 256]
    - [39, 57.634]
  - - [18816, 18816, 1, 384]
    - [27, 90.869]
  - - [34944, 34944, 1, 384]
    - [17, 90.977]
  - - [18048, 18048, 1, 384]
    - [27, 90.958]
  - - [34560, 34560, 1, 384]
    - [17, 90.826]
  - - [9088, 128, 1, 256]
    - [84, 40.41]
  - - [24576, 24576, 1, 256]
    - [40, 70.192]
  - - [32128, 128, 1, 384]
    - [26, 51.321]
  - - [8448, 8448, 1, 256]
    - [22, 73.715]
  - - [42752, 42752, 1, 256]
    - [19, 74.735]
  - - [5376, 5376, 1, 256]
    - [26, 69.366]
  - - [18048, 128, 1, 256]
    - [29, 37.6]
  - - [3584, 3584, 1, 256]
    - [26, 62.742]
  - - [37120, 37120, 1, 256]
    - [19, 74.921]
  - - [39936, 39936, 1, 384]
    - [43, 89.019]
  - - [20736, 20736, 1, 384]
    - [34, 91.075]
  - - [35584, 35584, 1, 256]
    - [17, 74.893]
  - - [26112, 26112, 1, 256]
    - [37, 76.0]
  - - [16896, 16896, 1, 384]
    - [17, 90.639]
  - - [40704, 40704, 1, 384]
    - [17, 90.834]
  - - [33280, 33280, 1, 256]
    - [16, 75.635]
  - - [5632, 5632, 1, 256]
    - [25, 71.658]
  - - [19456, 19456, 1, 256]
    - [19, 75.886]
  - - [22016, 22016, 1, 256]
    - [21, 76.148]
  - - [14208, 128, 1, 256]
    - [24, 30.277]
  - - [13568, 13568, 1, 256]
    - [17, 75.309]
  - - [30848, 128, 1, 384]
    - [15, 49.625]
  - - [1408, 128, 1, 384]
    - [85, 13.439]
  - - [5760, 5760, 1, 5760]
    - [462, 94.835]
  - - [39936, 39936, 1, 256]
    - [17, 75.103]
  - - [1920, 3072, 1, 384]
    - [26, 62.558]
  - - [9984, 9984, 1, 256]
    - [26, 74.421]
  - - [2816, 2048, 1, 256]
    - [26, 51.272]
  - - [23168, 128, 1, 256]
    - [16, 45.196]
  - - [19968, 19968, 1, 256]
    - [20, 76.018]
  - - [44800, 44800, 1, 256]
    - [17, 74.449]
  - - [14976, 14976, 1, 384]
    - [34, 90.548]
  - - [35712, 35712, 1, 384]
    - [17, 90.953]
  - - [43008, 43008, 1, 384]
    - [40, 89.03]
  - - [41088, 41088, 1, 384]
    - [31, 90.052]
  - - [16128, 16128, 1, 384]
    - [17, 90.362]
  - - [5120, 5120, 1, 256]
    - [26, 70.401]
  - - [25856, 25856, 1, 256]
    - [19, 75.426]
  - - [12288, 12288, 1, 256]
    - [19, 75.012]
  - - [6400, 6400, 1, 256]
    - [25, 72.272]
  - - [2688, 128, 1, 256]
    - [86, 20.246]
  - - [11648, 128, 1, 256]
    - [87, 42.668]
  - - [43264, 43264, 1, 256]
    - [17, 74.81]
  - - [19712, 19712, 1, 256]
    - [23, 75.0]
  - - [34176, 34176, 1, 384]
    - [19, 90.755]
  - - [31104, 31104, 1, 384]
    - [19, 90.907]
  - - [36608, 36608, 1, 256]
    - [28, 74.827]
  - - [39808, 128, 1, 256]
    - [30, 49.04]
  - - [13824, 13824, 1, 384]
    - [19, 90.095]
  - - [42624, 42624, 1, 384]
    - [20, 87.986]
  - - [21120, 21120, 1, 384]
    - [17, 91.055]
  - - [23296, 23296, 1, 256]
    - [17, 75.634]
  - - [42240, 42240, 1, 256]
    - [19, 74.739]
  - - [33408, 128, 1, 384]
    - [26, 52.984]
  - - [43648, 128, 1, 256]
    - [30, 45.265]
  - - [19328, 128, 1, 384]
    - [41, 46.245]
  - - [33792, 33792, 1, 256]
    - [17, 75.516]
  - - [31488, 31488, 1, 256]
    - [17, 74.936]
  - - [768, 3072, 1, 384]
    - [22, 44.769]
  - - [6144, 6144, 1, 256]
    - [17, 71.929]
  - - [20352, 20352, 1, 384]
    - [19, 91.117]
  - - [23168, 128, 1, 384]
    - [29, 53.248]
  - - [33536, 33536, 1, 256]
    - [38, 75.178]
  - - [32640, 32640, 1, 384]
    - [19, 90.087]
  - - [1536, 3072, 1, 384]
    - [26, 63.449]
  - - [19328, 128, 1, 256]
    - [30, 40.04]
  - - [2688, 3072, 1, 384]
    - [26, 72.101]
  - - [24192, 24192, 1, 384]
    - [19, 91.241]
  - - [6912, 6912, 1, 256]
    - [25, 72.526]
  - - [15360, 15360, 1, 256]
    - [17, 76.063]
  - - [18944, 18944, 1, 256]
    - [16, 76.049]
  - - [37376, 37376, 1, 256]
    - [31, 75.399]
  - - [31488, 31488, 1, 384]
    - [19, 90.749]
  - - [26880, 26880, 1, 256]
    - [17, 75.31]
  - - [44928, 128, 1, 128]
    - [30, 31.959]
  - - [24448, 128, 1, 256]
    - [22, 46.959]
  - - [31872, 31872, 1, 384]
    - [19, 90.846]
  - - [1408, 128, 1, 256]
    - [88, 11.358]
  - - [38528, 128, 1, 384]
    - [27, 58.149]
  - - [15616, 15616, 1, 256]
    - [17, 75.505]
  - - [39552, 39552, 1, 384]
    - [17, 90.918]
  - - [4352, 4352, 1, 256]
    - [25, 67.359]
  - - [28288, 128, 1, 384]
    - [25, 46.221]
  - - [10368, 128, 1, 256]
    - [79, 43.982]
  - - [32128, 128, 1, 256]
    - [30, 42.898]
  - - [4608, 4608, 1, 4608]
    - [168, 97.048]
  - - [8704, 8704, 1, 256]
    - [19, 74.167]
  - - [17664, 17664, 1, 256]
    - [21, 74.999]
  - - [24576, 24576, 1, 384]
    - [23, 83.07]
  - - [37248, 128, 1, 384]
    - [25, 56.876]
  - - [34304, 34304, 1, 256]
    - [33, 75.525]
  - - [42368, 128, 1, 384]
    - [19, 52.092]
  - - [17664, 17664, 1, 384]
    - [19, 90.703]
  - - [12800, 12800, 1, 256]
    - [19, 75.345]
  - - [26624, 26624, 1, 256]
    - [17, 75.83]
  - - [36864, 36864, 1, 256]
    - [19, 74.612]
  - - [40704, 40704, 1, 256]
    - [19, 74.86]
  - - [12032, 12032, 1, 256]
    - [19, 74.709]
  - - [33024, 33024, 1, 384]
    - [17, 90.647]
  - - [28800, 28800, 1, 384]
    - [34, 91.023]
  - - [22656, 22656, 1, 384]
    - [17, 91.179]
  - - [41472, 41472, 1, 384]
    - [19, 90.471]
  - - [39680, 39680, 1, 256]
    - [19, 74.613]
  - - [44032, 44032, 1, 256]
    - [17, 75.129]
  - - [43392, 43392, 1, 384]
    - [17, 90.699]
  - - [42240, 42240, 1, 384]
    - [19, 90.742]
  - - [38912, 38912, 1, 256]
    - [19, 75.302]
  - - [23040, 23040, 1, 384]
    - [19, 91.024]
  - - [13312, 13312, 1, 256]
    - [17, 75.812]
  - - [128, 128, 1, 384]
    - [85, 1.211]
  - - [39168, 39168, 1, 256]
    - [31, 74.682]
  - - [25344, 25344, 1, 384]
    - [19, 91.121]
  - - [5248, 128, 1, 256]
    - [79, 31.75]
  - - [30208, 30208, 1, 256]
    - [32, 75.621]
  - - [40192, 40192, 1, 256]
    - [19, 74.915]
  - - [15872, 15872, 1, 256]
    - [17, 76.103]
  - - [44544, 44544, 1, 256]
    - [14, 74.966]
  - - [11520, 11520, 1, 256]
    - [19, 74.674]
  - - [15360, 15360, 1, 384]
    - [16, 89.355]
  - - [23040, 23040, 1, 256]
    - [19, 76.194]
  - - [26496, 26496, 1, 384]
    - [19, 91.077]
  - - [11264, 11264, 1, 256]
    - [17, 75.369]
  - - [18048, 128, 1, 384]
    - [42, 43.408]
  - - [30976, 30976, 1, 256]
    - [20, 74.406]
  - - [11648, 128, 1, 384]
    - [81, 50.278]
  - - [2304, 3072, 1, 384]
    - [26, 73.922]
  - - [28928, 28928, 1, 256]
    - [21, 74.911]
  - - [43008, 43008, 1, 256]
    - [17, 74.922]
  - - [29440, 29440, 1, 256]
    - [21, 75.408]
  - - [36352, 36352, 1, 256]
    - [31, 75.406]
  - - [32256, 32256, 1, 384]
    - [17, 90.64]
  - - [23808, 23808, 1, 384]
    - [34, 91.162]
  - - [37248, 128, 1, 256]
    - [24, 47.064]
  - - [1, 1, 1, 64]
    - [0, 0.0]
  - - [37888, 37888, 1, 256]
    - [19, 75.212]
  - - [35968, 128, 1, 256]
    - [42, 46.038]
  - - [13824, 13824, 1, 256]
    - [21, 75.675]
  - - [39168, 39168, 1, 384]
    - [17, 90.701]
  - - [37632, 37632, 1, 384]
    - [17, 90.859]
  - - [29568, 128, 1, 256]
    - [15, 39.885]
  - - [14336, 14336, 1, 256]
    - [19, 75.668]
  - - [28288, 128, 1, 256]
    - [15, 38.51]
  - - [16512, 16512, 1, 384]
    - [40, 89.482]
  - - [30720, 30720, 1, 384]
    - [23, 89.477]
  - - [21248, 21248, 1, 256]
    - [17, 75.578]
  - - [29696, 29696, 1, 256]
    - [17, 75.577]
  - - [384, 3072, 1, 384]
    - [79, 48.474]
  - - [28672, 28672, 1, 256]
    - [19, 75.173]
  - - [32512, 32512, 1, 256]
    - [16, 75.093]
  - - [9216, 9216, 1, 256]
    - [19, 74.101]
  - - [6656, 6656, 1, 256]
    - [25, 72.68]
  - - [30336, 30336, 1, 384]
    - [17, 90.946]
  - - [20608, 128, 1, 256]
    - [16, 41.527]
  - - [7936, 7936, 1, 256]
    - [26, 73.5]
  - - [41856, 41856, 1, 384]
    - [19, 90.931]
  - - [44288, 44288, 1, 256]
    - [17, 74.601]
  - - [7744, 7744, 1, 7744]
    - [17, 97.287]
  - - [7424, 7424, 1, 256]
    - [26, 73.14]
  - - [39424, 39424, 1, 256]
    - [17, 75.347]
  - - [43648, 128, 1, 384]
    - [27, 52.576]
  - - [14208, 14208, 1, 384]
    - [17, 89.943]
  - - [36096, 36096, 1, 384]
    - [20, 89.977]
  - - [44544, 44544, 1, 384]
    - [17, 90.389]
  - - [22528, 22528, 1, 256]
    - [19, 75.715]
  - - [4096, 4096, 1, 256]
    - [26, 66.031]
  - - [31744, 31744, 1, 256]
    - [17, 75.52]
  - - [3968, 128, 1, 384]
    - [78, 28.344]
  - - [17920, 17920, 1, 256]
    - [19, 76.073]
  - - [5248, 128, 1, 384]
    - [78, 36.66]
  - - [26880, 26880, 1, 384]
    - [17, 91.155]
  - - [8192, 8192, 1, 256]
    - [17, 72.824]
  - - [3968, 128, 1, 256]
    - [80, 24.407]
  - - [41088, 128, 1, 256]
    - [42, 49.94]
  - - [21888, 128, 1, 384]
    - [16, 50.833]
  - - [16768, 128, 1, 256]
    - [42, 35.074]
  - - [24064, 24064, 1, 256]
    - [16, 76.017]
  - - [44928, 128, 1, 256]
    - [19, 46.495]
  - - [27648, 27648, 1, 384]
    - [43, 89.139]
  - - [24832, 24832, 1, 256]
    - [16, 75.662]
  - - [10240, 10240, 1, 256]
    - [19, 75.096]
  - - [40320, 40320, 1, 384]
    - [19, 90.989]
  - - [18432, 2688, 1, 384]
    - [19, 85.949]
  - - [43008, 2304, 1, 384]
    - [19, 89.185]
  - - [3840, 3072, 1, 384]
    - [25, 76.792]
  - - [33408, 1920, 1, 384]
    - [19, 87.863]
  - - [33792, 2688, 1, 384]
    - [17, 87.542]
  - - [8064, 2688, 1, 384]
    - [17, 79.14]
  - - [33408, 2304, 1, 384]
    - [19, 88.628]
  - - [31872, 1536, 1, 384]
    - [17, 85.612]
  - - [41088, 1920, 1, 384]
    - [43, 86.524]
  - - [41088, 2304, 1, 384]
    - [51, 87.329]
  - - [5376, 1536, 1, 384]
    - [25, 71.681]
  - - [16128, 1536, 1, 384]
    - [19, 83.019]
  - - [36480, 2688, 1, 384]
    - [27, 88.977]
  - - [15360, 768, 1, 384]
    - [15, 75.527]
  - - [42624, 768, 1, 384]
    - [34, 82.371]
  - - [4992, 1536, 1, 384]
    - [26, 67.772]
  - - [29952, 1536, 1, 384]
    - [17, 86.156]
  - - [10752, 2688, 1, 384]
    - [27, 82.264]
  - - [42240, 2688, 1, 384]
    - [34, 89.835]
  - - [36096, 1536, 1, 384]
    - [16, 85.555]
  - - [26496, 1536, 1, 384]
    - [17, 85.909]
  - - [42624, 2688, 1, 384]
    - [19, 87.217]
  - - [17664, 2688, 1, 384]
    - [27, 86.621]
  - - [37248, 1536, 1, 384]
    - [17, 87.151]
  - - [16896, 2304, 1, 384]
    - [17, 86.299]
  - - [22272, 1920, 1, 384]
    - [17, 87.094]
  - - [26880, 2688, 1, 384]
    - [27, 87.772]
  - - [384, 768, 1, 384]
    - [80, 21.71]
  - - [16896, 1920, 1, 384]
    - [17, 86.53]
  - - [32640, 2304, 1, 384]
    - [17, 85.785]
  - - [5760, 2304, 1, 384]
    - [26, 76.76]
  - - [11904, 2304, 1, 384]
    - [19, 82.809]
  - - [24576, 2304, 1, 384]
    - [17, 85.039]
  - - [33024, 1536, 1, 384]
    - [17, 84.384]
  - - [36096, 2304, 1, 384]
    - [16, 86.916]
  - - [20352, 2688, 1, 384]
    - [34, 87.058]
  - - [14592, 2304, 1, 384]
    - [17, 85.738]
  - - [16128, 1920, 1, 384]
    - [19, 82.946]
  - - [16512, 1920, 1, 384]
    - [31, 79.688]
  - - [35712, 1920, 1, 384]
    - [17, 87.275]
  - - [9216, 2688, 1, 384]
    - [19, 83.651]
  - - [23808, 2688, 1, 384]
    - [34, 88.104]
  - - [18048, 768, 1, 384]
    - [34, 78.673]
  - - [14592, 2688, 1, 384]
    - [17, 86.006]
  - - [14208, 1920, 1, 384]
    - [19, 82.418]
  - - [14976, 2688, 1, 384]
    - [27, 85.749]
  - - [17280, 2304, 1, 384]
    - [19, 84.863]
  - - [11520, 2304, 1, 384]
    - [17, 84.796]
  - - [18432, 768, 1, 384]
    - [34, 79.512]
  - - [4608, 768, 1, 384]
    - [26, 65.306]
  - - [34944, 1920, 1, 384]
    - [17, 87.524]
  - - [13824, 2688, 1, 384]
    - [34, 86.081]
  - - [39936, 2304, 1, 384]
    - [17, 88.199]
  - - [7680, 2688, 1, 384]
    - [19, 81.415]
  - - [19968, 2304, 1, 384]
    - [19, 86.824]
  - - [27648, 2688, 1, 384]
    - [17, 86.702]
  - - [4224, 768, 1, 384]
    - [25, 59.788]
  - - [24192, 1920, 1, 384]
    - [19, 87.591]
  - - [32640, 1920, 1, 384]
    - [17, 84.928]
  - - [34176, 2688, 1, 384]
    - [41, 88.958]
  - - [35328, 1536, 1, 384]
    - [19, 85.698]
  - - [8832, 2688, 1, 384]
    - [34, 81.421]
  - - [18048, 1920, 1, 384]
    - [19, 84.439]
  - - [31488, 768, 1, 384]
    - [34, 82.286]
  - - [21504, 2304, 1, 384]
    - [17, 86.898]
  - - [11136, 2688, 1, 384]
    - [34, 84.703]
  - - [768, 1152, 1, 384]
    - [79, 46.95]
  - - [29184, 2688, 1, 384]
    - [34, 88.494]
  - - [4608, 2688, 1, 384]
    - [26, 79.851]
  - - [21504, 2688, 1, 384]
    - [19, 85.527]
  - - [34176, 768, 1, 384]
    - [34, 83.561]
  - - [23808, 1536, 1, 384]
    - [19, 84.573]
  - - [43392, 1536, 1, 384]
    - [17, 87.946]
  - - [13824, 768, 1, 384]
    - [27, 77.721]
  - - [38016, 1536, 1, 384]
    - [19, 86.692]
  - - [20736, 2688, 1, 384]
    - [27, 88.463]
  - - [15744, 1536, 1, 384]
    - [17, 82.237]
  - - [16512, 1536, 1, 384]
    - [28, 75.676]
  - - [3072, 2304, 1, 384]
    - [26, 73.318]
  - - [5760, 2688, 1, 384]
    - [393, 81.364]
  - - [38400, 2304, 1, 384]
    - [17, 88.2]
  - - [15360, 2688, 1, 384]
    - [19, 86.326]
  - - [29952, 2688, 1, 384]
    - [27, 88.86]
  - - [43008, 2688, 1, 384]
    - [19, 87.686]
  - - [13440, 1920, 1, 384]
    - [19, 82.655]
  - - [6528, 2688, 1, 384]
    - [17, 81.588]
  - - [2304, 1536, 1, 384]
    - [26, 64.822]
  - - [40320, 1536, 1, 384]
    - [19, 86.967]
  - - [13440, 1536, 1, 384]
    - [19, 81.341]
  - - [40320, 2688, 1, 384]
    - [34, 88.955]
  - - [30336, 2304, 1, 384]
    - [27, 88.619]
  - - [24192, 2688, 1, 384]
    - [34, 87.204]
  - - [35328, 768, 1, 384]
    - [34, 81.961]
  - - [23040, 768, 1, 384]
    - [27, 81.55]
  - - [29952, 2304, 1, 384]
    - [19, 87.87]
  - - [33024, 1920, 1, 384]
    - [17, 86.647]
  - - [14976, 768, 1, 384]
    - [27, 74.424]
  - - [42624, 1920, 1, 384]
    - [17, 87.484]
  - - [32640, 2688, 1, 384]
    - [20, 85.433]
  - - [11520, 1536, 1, 384]
    - [19, 82.185]
  - - [6912, 768, 1, 384]
    - [15, 69.191]
  - - [39552, 1920, 1, 384]
    - [19, 87.96]
  - - [32256, 1920, 1, 384]
    - [19, 87.539]
  - - [10752, 1536, 1, 384]
    - [17, 77.35]
  - - [24576, 2688, 1, 384]
    - [17, 84.613]
  - - [12672, 2688, 1, 384]
    - [34, 86.586]
  - - [10752, 1920, 1, 384]
    - [19, 81.453]
  - - [40704, 1536, 1, 384]
    - [17, 87.483]
  - - [32256, 768, 1, 384]
    - [34, 83.799]
  - - [18816, 2688, 1, 384]
    - [34, 85.896]
  - - [11520, 2688, 1, 384]
    - [27, 83.45]
  - - [35712, 2688, 1, 384]
    - [34, 88.852]
  - - [29952, 1920, 1, 384]
    - [17, 88.372]
  - - [26880, 1920, 1, 384]
    - [17, 87.563]
  - - [33408, 2688, 1, 384]
    - [27, 89.067]
  - - [35328, 2688, 1, 384]
    - [34, 88.976]
  - - [21120, 2688, 1, 384]
    - [41, 86.9]
  - - [19584, 1920, 1, 384]
    - [19, 86.96]
  - - [17664, 1536, 1, 384]
    - [19, 81.463]
  - - [36864, 768, 1, 384]
    - [34, 83.653]
  - - [14592, 1536, 1, 384]
    - [17, 81.728]
  - - [11136, 2304, 1, 384]
    - [17, 82.333]
  - - [9600, 2688, 1, 384]
    - [19, 82.609]
  - - [9216, 2304, 1, 384]
    - [19, 83.156]
  - - [21120, 768, 1, 384]
    - [27, 81.735]
  - - [4992, 2688, 1, 384]
    - [393, 82.226]
  - - [41472, 768, 1, 384]
    - [34, 85.184]
  - - [37632, 1536, 1, 384]
    - [19, 86.027]
  - - [38784, 2304, 1, 384]
    - [17, 88.806]
  - - [8448, 2688, 1, 384]
    - [34, 82.716]
  - - [36864, 2304, 1, 384]
    - [17, 87.729]
  - - [40704, 1920, 1, 384]
    - [19, 88.34]
  - - [39552, 2688, 1, 384]
    - [34, 89.664]
  - - [26112, 768, 1, 384]
    - [34, 79.562]
  - - [29184, 1536, 1, 384]
    - [17, 86.987]
  - - [32640, 1536, 1, 384]
    - [19, 83.298]
  - - [5376, 2688, 1, 384]
    - [393, 81.429]
  - - [13056, 768, 1, 384]
    - [34, 73.998]
  - - [13824, 2304, 1, 384]
    - [19, 85.541]
  - - [16896, 768, 1, 384]
    - [27, 74.655]
  - - [30336, 1920, 1, 384]
    - [19, 87.334]
  - - [27264, 2304, 1, 384]
    - [19, 88.195]
  - - [7680, 1536, 1, 384]
    - [17, 76.276]
  - - [30720, 2688, 1, 384]
    - [19, 87.806]
  - - [36096, 2688, 1, 384]
    - [20, 87.086]
  - - [5760, 1920, 1, 384]
    - [26, 72.496]
  - - [42240, 1536, 1, 384]
    - [19, 87.779]
  - - [8448, 1920, 1, 384]
    - [25, 82.584]
  - - [32256, 1536, 1, 384]
    - [17, 86.303]
  - - [44160, 2304, 1, 384]
    - [27, 89.108]
  - - [30336, 2688, 1, 384]
    - [34, 88.332]
  - - [6144, 2688, 1, 384]
    - [397, 81.03]
  - - [39168, 1536, 1, 384]
    - [17, 86.962]
  - - [11904, 1920, 1, 384]
    - [27, 83.359]
  - - [8064, 1536, 1, 384]
    - [25, 78.707]
  - - [21120, 1920, 1, 384]
    - [19, 86.0]
  - - [22656, 2304, 1, 384]
    - [34, 88.383]
  - - [19968, 2688, 1, 384]
    - [34, 87.953]
  - - [10752, 768, 1, 384]
    - [30, 71.538]
  - - [18432, 2304, 1, 384]
    - [19, 86.351]
  - - [14976, 1920, 1, 384]
    - [27, 86.02]
  - - [33024, 2688, 1, 384]
    - [27, 87.96]
  - - [1536, 768, 1, 384]
    - [349, 46.928]
  - - [33024, 2304, 1, 384]
    - [34, 87.324]
  - - [14208, 2688, 1, 384]
    - [34, 84.865]
  - - [38016, 2304, 1, 384]
    - [34, 88.859]
  - - [16896, 2688, 1, 384]
    - [27, 85.692]
  - - [31104, 768, 1, 384]
    - [34, 81.555]
  - - [41472, 2304, 1, 384]
    - [17, 88.447]
  - - [23424, 2688, 1, 384]
    - [19, 87.378]
  - - [26496, 2688, 1, 384]
    - [27, 88.317]
  - - [16512, 2304, 1, 384]
    - [20, 80.998]
  - - [11520, 1920, 1, 384]
    - [17, 81.321]
  - - [39552, 768, 1, 384]
    - [34, 85.633]
  - - [6144, 2304, 1, 384]
    - [25, 80.665]
  - - [14208, 2304, 1, 384]
    - [19, 83.895]
  - - [19584, 2304, 1, 384]
    - [19, 85.331]
  - - [36480, 768, 1, 384]
    - [27, 83.786]
  - - [15744, 2688, 1, 384]
    - [34, 86.233]
  - - [34560, 1536, 1, 384]
    - [19, 86.554]
  - - [8448, 2304, 1, 384]
    - [17, 82.987]
  - - [26112, 2688, 1, 384]
    - [34, 88.934]
  - - [39936, 768, 1, 384]
    - [27, 82.561]
  - - [19200, 1920, 1, 384]
    - [19, 85.398]
  - - [38400, 768, 1, 384]
    - [34, 83.34]
  - - [8448, 1536, 1, 384]
    - [25, 74.895]
  - - [13824, 1536, 1, 384]
    - [17, 82.987]
  - - [9600, 768, 1, 384]
    - [15, 64.683]
  - - [10368, 768, 1, 384]
    - [30, 69.246]
  - - [20736, 1536, 1, 384]
    - [17, 85.105]
  - - [28800, 768, 1, 384]
    - [27, 80.331]
  - - [10368, 1536, 1, 384]
    - [19, 81.171]
  - - [21888, 1536, 1, 384]
    - [19, 82.833]
  - - [38784, 2688, 1, 384]
    - [27, 89.453]
  - - [27648, 2304, 1, 384]
    - [19, 87.437]
  - - [11136, 1920, 1, 384]
    - [19, 83.769]
  - - [37248, 768, 1, 384]
    - [34, 85.091]
  - - [23040, 2688, 1, 384]
    - [27, 87.36]
  - - [37632, 1920, 1, 384]
    - [17, 87.723]
  - - [7680, 768, 1, 384]
    - [15, 62.177]
  - - [38016, 1920, 1, 384]
    - [17, 88.34]
  - - [35712, 2304, 1, 384]
    - [34, 88.776]
  - - [37248, 2688, 1, 384]
    - [34, 88.92]
  - - [29568, 1920, 1, 384]
    - [21, 86.846]
  - - [38400, 2688, 1, 384]
    - [34, 88.725]
  - - [25728, 768, 1, 384]
    - [27, 83.582]
  - - [8832, 1920, 1, 384]
    - [34, 79.336]
  - - [43776, 1920, 1, 384]
    - [21, 86.47]
  - - [15744, 768, 1, 384]
    - [34, 77.357]
  - - [27264, 1920, 1, 384]
    - [19, 85.812]
  - - [33792, 2304, 1, 384]
    - [19, 87.915]
  - - [8832, 2304, 1, 384]
    - [19, 80.583]
  - - [39168, 2688, 1, 384]
    - [27, 89.136]
  - - [35328, 1920, 1, 384]
    - [19, 88.337]
  - - [35328, 2304, 1, 384]
    - [19, 88.11]
  - - [29184, 768, 1, 384]
    - [34, 81.9]
  - - [18048, 2688, 1, 384]
    - [27, 87.839]
  - - [32256, 2688, 1, 384]
    - [27, 88.127]
  - - [18816, 1536, 1, 384]
    - [19, 81.82]
  - - [13056, 1536, 1, 384]
    - [17, 78.981]
  - - [34944, 1536, 1, 384]
    - [19, 87.087]
  - - [38400, 1920, 1, 384]
    - [17, 88.679]
  - - [15360, 2304, 1, 384]
    - [17, 85.764]
  - - [27264, 2688, 1, 384]
    - [19, 87.083]
  - - [11136, 1536, 1, 384]
    - [19, 79.702]
  - - [30720, 2304, 1, 384]
    - [17, 87.779]
  - - [24960, 2688, 1, 384]
    - [27, 87.696]
  - - [13824, 1920, 1, 384]
    - [17, 84.703]
  - - [17280, 2688, 1, 384]
    - [34, 87.383]
  - - [31872, 768, 1, 384]
    - [27, 83.012]
  - - [11904, 2688, 1, 384]
    - [27, 85.826]
  - - [7296, 768, 1, 384]
    - [30, 58.889]
  - - [19200, 1536, 1, 384]
    - [19, 83.176]
  - - [12288, 768, 1, 384]
    - [27, 69.334]
  - - [33792, 768, 1, 384]
    - [34, 82.575]
  - - [21888, 2688, 1, 384]
    - [44, 83.957]
  - - [2688, 1920, 1, 384]
    - [26, 67.714]
  - - [19968, 768, 1, 384]
    - [34, 78.744]
  - - [12288, 2688, 1, 384]
    - [19, 83.987]
  - - [12288, 2304, 1, 384]
    - [17, 84.682]
  - - [28416, 768, 1, 384]
    - [34, 80.118]
  - - [34560, 768, 1, 384]
    - [34, 84.329]
  - - [39936, 2688, 1, 384]
    - [19, 88.07]
  - - [8064, 1920, 1, 384]
    - [17, 79.126]
  - - [26880, 1536, 1, 384]
    - [17, 86.713]
  - - [28032, 2688, 1, 384]
    - [27, 89.022]
  - - [41472, 2688, 1, 384]
    - [27, 89.01]
  - - [29568, 2688, 1, 384]
    - [34, 87.448]
  - - [31104, 2688, 1, 384]
    - [34, 88.587]
  - - [5376, 1920, 1, 384]
    - [26, 76.125]
  - - [41856, 2688, 1, 384]
    - [27, 89.376]
  - - [9984, 768, 1, 384]
    - [15, 67.304]
  - - [3456, 2688, 1, 384]
    - [26, 70.02]
  - - [43392, 2688, 1, 384]
    - [34, 89.587]
  - - [36480, 1920, 1, 384]
    - [34, 88.451]
  - - [29568, 1536, 1, 384]
    - [16, 84.24]
  - - [36864, 2688, 1, 384]
    - [17, 87.725]
  - - [12672, 768, 1, 384]
    - [15, 72.052]
  - - [24064, 3072, 1, 256]
    - [22, 72.89]
  - - [256, 512, 1, 256]
    - [89, 8.398]
  - - [40960, 27648, 1, 256]
    - [14, 67.36]
  - - [31744, 3072, 1, 256]
    - [19, 73.477]
  - - [13056, 1792, 1, 256]
    - [25, 68.961]
  - - [35328, 22785, 1, 256]
    - [50, 73.723]
  - - [28160, 15872, 1, 256]
    - [45, 75.611]
  - - [39168, 1792, 1, 256]
    - [42, 71.707]
  - - [23808, 11265, 1, 256]
    - [23, 71.85]
  - - [16640, 4353, 1, 256]
    - [50, 69.432]
  - - [38912, 26624, 1, 256]
    - [17, 75.182]
  - - [6912, 3585, 1, 256]
    - [19, 65.964]
  - - [32768, 1792, 1, 256]
    - [14, 58.928]
  - - [30976, 18688, 1, 256]
    - [20, 74.426]
  - - [512, 2048, 1, 256]
    - [79, 37.096]
  - - [15872, 3584, 1, 256]
    - [22, 72.985]
  - - [6400, 1792, 1, 256]
    - [26, 62.034]
  - - [39680, 27393, 1, 256]
    - [40, 72.507]
  - - [36864, 24577, 1, 256]
    - [23, 71.805]
  - - [26112, 1536, 1, 256]
    - [26, 70.393]
  - - [26368, 1536, 1, 256]
    - [26, 69.857]
  - - [16896, 4353, 1, 256]
    - [21, 71.01]
  - - [14336, 1793, 1, 256]
    - [17, 64.85]
  - - [3840, 3072, 1, 256]
    - [25, 63.197]
  - - [2560, 3072, 1, 256]
    - [26, 56.708]
  - - [6656, 1536, 1, 256]
    - [26, 61.995]
  - - [27136, 1792, 1, 256]
    - [25, 71.697]
  - - [43776, 3072, 1, 256]
    - [20, 71.088]
  - - [23296, 1792, 1, 256]
    - [25, 70.456]
  - - [11264, 7937, 1, 256]
    - [23, 72.469]
  - - [768, 3072, 1, 256]
    - [22, 38.337]
  - - [6912, 3841, 1, 256]
    - [25, 66.587]
  - - [40960, 769, 1, 256]
    - [19, 55.161]
  - - [40448, 9216, 1, 256]
    - [32, 74.661]
  - - [7680, 4353, 1, 256]
    - [17, 67.882]
  - - [23296, 3072, 1, 256]
    - [17, 72.423]
  - - [7936, 4609, 1, 256]
    - [22, 69.169]
  - - [20736, 8448, 1, 256]
    - [19, 74.596]
  - - [768, 1024, 1, 256]
    - [78, 36.135]
  - - [38656, 3072, 1, 256]
    - [21, 72.725]
  - - [28160, 1792, 1, 256]
    - [22, 71.494]
  - - [13824, 3072, 1, 256]
    - [19, 71.6]
  - - [42752, 1792, 1, 256]
    - [19, 72.151]
  - - [35584, 23041, 1, 256]
    - [20, 73.114]
  - - [13056, 3072, 1, 256]
    - [19, 71.139]
  - - [37888, 768, 1, 256]
    - [34, 68.261]
  - - [19456, 3072, 1, 256]
    - [19, 72.97]
  - - [15872, 9216, 1, 256]
    - [17, 74.823]
  - - [30976, 1792, 1, 256]
    - [22, 71.133]
  - - [26368, 14081, 1, 256]
    - [40, 72.876]
  - - [35328, 23041, 1, 256]
    - [33, 73.686]
  - - [27648, 15105, 1, 256]
    - [17, 74.161]
  - - [25856, 13568, 1, 256]
    - [17, 75.047]
  - - [23296, 9216, 1, 256]
    - [19, 74.259]
  - - [2048, 1024, 1, 256]
    - [42, 34.871]
  - - [12032, 1792, 1, 256]
    - [26, 69.388]
  - - [11520, 1536, 1, 256]
    - [25, 67.434]
  - - [16128, 768, 1, 256]
    - [15, 62.842]
  - - [15360, 3072, 1, 256]
    - [19, 72.025]
  - - [38912, 26369, 1, 256]
    - [40, 73.922]
  - - [25344, 13056, 1, 256]
    - [31, 74.792]
  - - [39168, 26880, 1, 256]
    - [28, 74.625]
  - - [39424, 768, 1, 256]
    - [30, 68.846]
  - - [10496, 1792, 1, 256]
    - [26, 66.402]
  - - [28672, 3072, 1, 256]
    - [17, 73.07]
  - - [27392, 768, 1, 256]
    - [29, 63.787]
  - - [39680, 768, 1, 256]
    - [34, 68.165]
  - - [11520, 8193, 1, 256]
    - [40, 70.412]
  - - [17408, 4865, 1, 256]
    - [17, 71.47]
  - - [14080, 1537, 1, 256]
    - [19, 63.305]
  - - [29184, 768, 1, 256]
    - [29, 67.284]
  - - [19200, 6913, 1, 256]
    - [22, 71.548]
  - - [33536, 9216, 1, 256]
    - [31, 74.284]
  - - [5632, 3072, 1, 256]
    - [25, 66.804]
  - - [32768, 20480, 1, 256]
    - [46, 58.823]
  - - [29440, 9216, 1, 256]
    - [16, 74.429]
  - - [40960, 1792, 1, 256]
    - [28, 66.694]
  - - [10240, 3072, 1, 256]
    - [25, 70.816]
  - - [20992, 1792, 1, 256]
    - [19, 71.07]
  - - [42240, 9216, 1, 256]
    - [20, 74.271]
  - - [19200, 6912, 1, 256]
    - [19, 74.327]
  - - [27392, 1792, 1, 256]
    - [61, 68.339]
  - - [42496, 1536, 1, 256]
    - [17, 71.485]
  - - [29440, 16897, 1, 256]
    - [20, 73.235]
  - - [20480, 8192, 1, 256]
    - [17, 74.921]
  - - [11264, 8193, 1, 256]
    - [19, 70.854]
  - - [26880, 14337, 1, 256]
    - [40, 72.433]
  - - [28928, 16641, 1, 256]
    - [50, 73.123]
  - - [15360, 2817, 1, 256]
    - [19, 67.942]
  - - [44288, 1536, 1, 256]
    - [19, 70.471]
  - - [7936, 1536, 1, 256]
    - [25, 63.735]
  - - [18176, 5633, 1, 256]
    - [17, 71.129]
  - - [8448, 3072, 1, 256]
    - [26, 68.909]
  - - [17920, 5632, 1, 256]
    - [16, 74.331]
  - - [1792, 2048, 1, 256]
    - [26, 40.334]
  - - [39936, 3072, 1, 256]
    - [17, 73.824]
  - - [20480, 3072, 1, 256]
    - [19, 72.732]
  - - [24832, 1792, 1, 256]
    - [42, 71.196]
  - - [37376, 25088, 1, 256]
    - [17, 75.229]
  - - [7168, 4097, 1, 256]
    - [17, 67.186]
  - - [21504, 768, 1, 256]
    - [34, 64.581]
  - - [13312, 3072, 1, 256]
    - [19, 71.791]
  - - [40960, 1025, 1, 256]
    - [19, 57.587]
  - - [12032, 1536, 1, 256]
    - [25, 65.445]
  - - [9216, 768, 1, 256]
    - [15, 59.444]
  - - [44288, 27648, 1, 256]
    - [20, 74.594]
  - - [32512, 1792, 1, 256]
    - [25, 71.363]
  - - [23808, 11520, 1, 256]
    - [17, 75.256]
  - - [25600, 13057, 1, 256]
    - [40, 73.924]
  - - [40448, 1792, 1, 256]
    - [19, 72.271]
  - - [25088, 12800, 1, 256]
    - [16, 75.683]
  - - [22784, 10496, 1, 256]
    - [42, 74.874]
  - - [38400, 26113, 1, 256]
    - [20, 73.709]
  - - [9728, 3072, 1, 256]
    - [19, 70.812]
  - - [20736, 1792, 1, 256]
    - [25, 70.596]
  - - [7680, 3072, 1, 256]
    - [26, 67.931]
  - - [5376, 2305, 1, 256]
    - [26, 58.991]
  - - [12800, 3072, 1, 256]
    - [22, 71.387]
  - - [43520, 3584, 1, 256]
    - [17, 74.091]
  - - [12288, 3072, 1, 256]
    - [19, 71.431]
  - - [12800, 1536, 1, 256]
    - [42, 67.084]
  - - [21504, 8961, 1, 256]
    - [17, 73.17]
  - - [39680, 9216, 1, 256]
    - [19, 74.129]
  - - [3584, 513, 1, 256]
    - [24, 30.521]
  - - [1280, 3072, 1, 256]
    - [30, 43.215]
  - - [13056, 9216, 1, 256]
    - [17, 74.371]
  - - [22016, 768, 1, 256]
    - [27, 64.586]
  - - [33024, 1536, 1, 256]
    - [25, 69.126]
  - - [26880, 9216, 1, 256]
    - [19, 74.278]
  - - [44032, 27648, 1, 256]
    - [19, 74.877]
  - - [7680, 768, 1, 256]
    - [30, 51.917]
  - - [32000, 19712, 1, 256]
    - [17, 75.0]
  - - [26880, 14593, 1, 256]
    - [40, 72.979]
  - - [24064, 9216, 1, 256]
    - [33, 74.935]
  - - [39424, 26881, 1, 256]
    - [40, 73.642]
  - - [27392, 3072, 1, 256]
    - [33, 70.269]
  - - [10752, 1792, 1, 256]
    - [25, 67.663]
  - - [8960, 5633, 1, 256]
    - [19, 70.165]
  - - [34560, 3072, 1, 256]
    - [17, 72.869]
  - - [23808, 9216, 1, 256]
    - [17, 74.572]
  - - [29696, 17153, 1, 256]
    - [19, 74.326]
  - - [11776, 1536, 1, 256]
    - [25, 64.33]
  - - [13568, 1536, 1, 256]
    - [25, 67.459]
  - - [30208, 9216, 1, 256]
    - [32, 75.008]
  - - [36608, 1536, 1, 256]
    - [25, 70.529]
  - - [12800, 513, 1, 256]
    - [17, 48.009]
  - - [7680, 1792, 1, 256]
    - [26, 65.222]
  - - [42496, 2305, 1, 256]
    - [17, 68.926]
  - - [37376, 1536, 1, 256]
    - [19, 70.914]
  - - [20224, 1792, 1, 256]
    - [25, 70.026]
  - - [43520, 1536, 1, 256]
    - [17, 71.431]
  - - [26368, 768, 1, 256]
    - [30, 66.092]
  - - [18176, 3072, 1, 256]
    - [19, 72.178]
  - - [24320, 12033, 1, 256]
    - [50, 73.218]
  - - [17408, 9216, 1, 256]
    - [19, 74.837]
  - - [36352, 1792, 1, 256]
    - [19, 72.37]
  - - [20992, 8705, 1, 256]
    - [23, 72.643]
  - - [19712, 7424, 1, 256]
    - [42, 73.379]
  - - [38144, 768, 1, 256]
    - [15, 67.922]
  - - [10752, 1536, 1, 256]
    - [19, 64.306]
  - - [4096, 3072, 1, 256]
    - [21, 64.649]
  - - [29696, 17409, 1, 256]
    - [40, 72.74]
  - - [10240, 6913, 1, 256]
    - [23, 71.858]
  - - [18944, 1536, 1, 256]
    - [26, 68.276]
  - - [38656, 26113, 1, 256]
    - [31, 72.926]
  - - [37376, 25089, 1, 256]
    - [31, 73.77]
  - - [38400, 1536, 1, 256]
    - [17, 70.995]
  - - [8448, 1792, 1, 256]
    - [25, 64.45]
  - - [13056, 769, 1, 256]
    - [34, 54.241]
  - - [24320, 11777, 1, 256]
    - [50, 73.035]
  - - [17664, 9216, 1, 256]
    - [16, 73.709]
  - - [8192, 4865, 1, 256]
    - [17, 69.019]
  - - [17920, 1792, 1, 256]
    - [42, 70.638]
  - - [32000, 19713, 1, 256]
    - [40, 73.259]
  - - [8960, 768, 1, 256]
    - [15, 58.995]
  - - [31232, 3072, 1, 256]
    - [42, 73.089]
  - - [12544, 257, 1, 256]
    - [27, 35.771]
  - - [43776, 3585, 1, 256]
    - [20, 68.553]
  - - [11008, 1792, 1, 256]
    - [47, 65.563]
  - - [29696, 17408, 1, 256]
    - [19, 75.352]
  - - [34560, 22272, 1, 256]
    - [17, 74.996]
  - - [256, 2048, 1, 256]
    - [84, 25.406]
  - - [32768, 20481, 1, 256]
    - [46, 55.844]
  - - [14336, 3072, 1, 256]
    - [25, 71.953]
  - - [19456, 7168, 1, 256]
    - [19, 74.12]
  - - [13312, 9216, 1, 256]
    - [17, 74.894]
  - - [22272, 768, 1, 256]
    - [15, 65.541]
  - - [24064, 1792, 1, 256]
    - [22, 71.538]
  - - [16896, 1792, 1, 256]
    - [25, 70.328]
  - - [27904, 15616, 1, 256]
    - [19, 75.078]
  - - [37888, 3072, 1, 256]
    - [17, 73.795]
  - - [13056, 513, 1, 256]
    - [27, 48.579]
  - - [36608, 24065, 1, 256]
    - [20, 72.88]
  - - [40704, 3072, 1, 256]
    - [19, 73.142]
  - - [28928, 16640, 1, 256]
    - [16, 75.132]
  - - [24576, 12288, 1, 256]
    - [40, 69.898]
  - - [17152, 3072, 1, 256]
    - [26, 71.874]
  - - [17152, 4864, 1, 256]
    - [26, 73.546]
  - - [42496, 9216, 1, 256]
    - [20, 74.809]
  - - [32256, 768, 1, 256]
    - [29, 68.635]
  - - [4352, 1792, 1, 256]
    - [25, 55.99]
  - - [5632, 768, 1, 256]
    - [29, 46.604]
  - - [40704, 513, 1, 256]
    - [27, 56.078]
  - - [19712, 768, 1, 256]
    - [24, 61.993]
  - - [33536, 20993, 1, 256]
    - [50, 73.277]
  - - [2816, 3072, 1, 256]
    - [25, 61.168]
  - - [3584, 3072, 1, 256]
    - [17, 59.974]
  - - [4608, 1537, 1, 256]
    - [26, 51.08]
  - - [44032, 9216, 1, 256]
    - [17, 74.553]
  - - [33792, 21249, 1, 256]
    - [23, 74.025]
  - - [32512, 20225, 1, 256]
    - [50, 73.399]
  - - [38656, 9216, 1, 256]
    - [31, 74.324]
  - - [17664, 5377, 1, 256]
    - [21, 70.624]
  - - [19456, 7169, 1, 256]
    - [23, 71.093]
  - - [8448, 5121, 1, 256]
    - [19, 68.835]
  - - [29440, 17152, 1, 256]
    - [21, 75.486]
  - - [40448, 513, 1, 256]
    - [27, 56.249]
  - - [41472, 1792, 1, 256]
    - [19, 72.408]
  - - [17920, 3072, 1, 256]
    - [22, 72.264]
  - - [35072, 9216, 1, 256]
    - [17, 74.214]
  - - [34816, 22273, 1, 256]
    - [40, 74.005]
  - - [35072, 22785, 1, 256]
    - [23, 73.107]
  - - [39168, 9216, 1, 256]
    - [20, 74.256]
  - - [42752, 2817, 1, 256]
    - [40, 69.038]
  - - [11776, 3072, 1, 256]
    - [17, 70.075]
  - - [24832, 12289, 1, 256]
    - [33, 72.414]
  - - [24576, 12033, 1, 256]
    - [23, 68.22]
  - - [6400, 1536, 1, 256]
    - [25, 60.956]
  - - [32512, 3072, 1, 256]
    - [22, 72.723]
  - - [30976, 3072, 1, 256]
    - [22, 71.129]
  - - [22016, 9473, 1, 256]
    - [16, 73.241]
  - - [19968, 1792, 1, 256]
    - [25, 71.033]
  - - [29440, 3072, 1, 256]
    - [21, 73.013]
  - - [43776, 3840, 1, 256]
    - [20, 72.616]
  - - [41472, 768, 1, 256]
    - [34, 68.878]
  - - [8192, 1792, 1, 256]
    - [26, 63.092]
  - - [35840, 3072, 1, 256]
    - [19, 73.788]
  - - [8704, 3072, 1, 256]
    - [25, 70.142]
  - - [9728, 1792, 1, 256]
    - [26, 67.491]
  - - [22272, 9729, 1, 256]
    - [48, 72.315]
  - - [32768, 3072, 1, 256]
    - [14, 59.221]
  - - [3072, 2048, 1, 256]
    - [26, 54.959]
  - - [36864, 24576, 1, 256]
    - [17, 74.304]
  - - [9984, 1536, 1, 256]
    - [25, 64.234]
  - - [12032, 8961, 1, 256]
    - [16, 71.392]
  - - [38400, 25857, 1, 256]
    - [20, 73.786]
  - - [20224, 7937, 1, 256]
    - [40, 72.001]
  - - [34304, 21761, 1, 256]
    - [33, 73.859]
  - - [30720, 18432, 1, 256]
    - [19, 75.598]
  - - [31744, 9216, 1, 256]
    - [19, 74.725]
  - - [27136, 14848, 1, 256]
    - [16, 75.662]
  - - [34048, 9216, 1, 256]
    - [33, 73.879]
  - - [3584, 257, 1, 256]
    - [84, 33.197]
  - - [18688, 6145, 1, 256]
    - [23, 70.227]
  - - [36096, 768, 1, 256]
    - [29, 66.163]
  - - [36608, 9216, 1, 256]
    - [20, 74.237]
  - - [35584, 9216, 1, 256]
    - [20, 74.453]
  - - [29952, 17664, 1, 256]
    - [16, 75.301]
  - - [34816, 1792, 1, 256]
    - [19, 72.664]
  - - [24064, 11776, 1, 256]
    - [16, 75.569]
  - - [40448, 3072, 1, 256]
    - [21, 73.246]
  - - [18688, 6401, 1, 256]
    - [40, 70.993]
  - - [20480, 1536, 1, 256]
    - [19, 69.236]
  - - [18432, 3072, 1, 256]
    - [17, 72.829]
  - - [20224, 768, 1, 256]
    - [15, 64.775]
  - - [25344, 768, 1, 256]
    - [24, 66.478]
  - - [36608, 24320, 1, 256]
    - [28, 74.884]
  - - [34816, 9216, 1, 256]
    - [17, 74.783]
  - - [41216, 27648, 1, 256]
    - [20, 74.634]
  - - [30464, 9216, 1, 256]
    - [31, 73.654]
  - - [7424, 3072, 1, 256]
    - [26, 69.039]
  - - [20480, 1792, 1, 256]
    - [26, 70.652]
  - - [41984, 1793, 1, 256]
    - [19, 67.812]
  - - [18688, 1792, 1, 256]
    - [26, 70.3]
  - - [13824, 1792, 1, 256]
    - [26, 70.014]
  - - [38144, 3072, 1, 256]
    - [17, 73.144]
  - - [33280, 3072, 1, 256]
    - [21, 73.418]
  - - [35584, 23296, 1, 256]
    - [38, 74.79]
  - - [43520, 768, 1, 256]
    - [27, 69.457]
  - - [40704, 1536, 1, 256]
    - [19, 71.038]
  - - [29696, 3072, 1, 256]
    - [17, 73.642]
  - - [32256, 19969, 1, 256]
    - [50, 73.669]
  - - [40960, 9216, 1, 256]
    - [28, 67.099]
  - - [37632, 9216, 1, 256]
    - [19, 73.983]
  - - [42240, 2305, 1, 256]
    - [23, 68.068]
  - - [17920, 5377, 1, 256]
    - [16, 71.454]
  - - [27904, 9216, 1, 256]
    - [31, 74.405]
  - - [34304, 22016, 1, 256]
    - [32, 75.492]
  - - [11776, 8705, 1, 256]
    - [21, 72.055]
  - - [22272, 1536, 1, 256]
    - [22, 69.158]
  - - [25856, 9216, 1, 256]
    - [17, 74.358]
  - - [19712, 3072, 1, 256]
    - [21, 70.534]
  - - [41472, 9216, 1, 256]
    - [32, 74.605]
  - - [42496, 27648, 1, 256]
    - [20, 75.01]
  - - [44288, 4352, 1, 256]
    - [28, 73.828]
  - - [42496, 2561, 1, 256]
    - [17, 68.824]
  - - [9984, 6657, 1, 256]
    - [19, 71.101]
  - - [43008, 3073, 1, 256]
    - [40, 69.489]
  - - [36352, 24065, 1, 256]
    - [31, 73.734]
  - - [24832, 3072, 1, 256]
    - [22, 72.622]
  - - [29184, 16641, 1, 256]
    - [23, 73.633]
  - - [1024, 2048, 1, 256]
    - [29, 34.714]
  - - [42240, 27648, 1, 256]
    - [20, 74.587]
  - - [9984, 1792, 1, 256]
    - [25, 67.945]
  - - [44288, 3072, 1, 256]
    - [40, 72.705]
  - - [11008, 768, 1, 256]
    - [29, 56.84]
  - - [28672, 16129, 1, 256]
    - [40, 73.603]
  - - [17920, 9216, 1, 256]
    - [51, 74.862]
  - - [25088, 12801, 1, 256]
    - [33, 73.417]
  - - [19712, 9216, 1, 256]
    - [31, 74.04]
  - - [31744, 19457, 1, 256]
    - [17, 72.863]
  - - [36864, 1792, 1, 256]
    - [19, 72.242]
  - - [42496, 1792, 1, 256]
    - [17, 72.873]
  - - [39936, 9216, 1, 256]
    - [17, 74.655]
  - - [8960, 1792, 1, 256]
    - [25, 66.553]
  - - [17664, 5121, 1, 256]
    - [21, 69.096]
  - - [38144, 25601, 1, 256]
    - [20, 72.464]
  - - [27136, 14849, 1, 256]
    - [33, 73.926]
  - - [31744, 19456, 1, 256]
    - [19, 75.314]
  - - [33024, 3072, 1, 256]
    - [16, 72.339]
  - - [37888, 9216, 1, 256]
    - [19, 74.723]
  - - [6912, 1792, 1, 256]
    - [26, 64.897]
  - - [42240, 2049, 1, 256]
    - [27, 66.103]
  - - [34048, 3072, 1, 256]
    - [22, 72.477]
  - - [37120, 9216, 1, 256]
    - [31, 74.336]
  - - [14080, 9216, 1, 256]
    - [21, 73.043]
  - - [38400, 1792, 1, 256]
    - [17, 72.333]
  - - [43776, 9216, 1, 256]
    - [31, 74.086]
  - - [14336, 2049, 1, 256]
    - [19, 63.371]
  - - [37120, 24577, 1, 256]
    - [31, 72.438]
  - - [30976, 18433, 1, 256]
    - [20, 72.375]
  - - [37632, 3072, 1, 256]
    - [17, 72.923]
  - - [34560, 1792, 1, 256]
    - [25, 71.797]
  - - [5120, 3072, 1, 256]
    - [26, 66.228]
  - - [21760, 9217, 1, 256]
    - [23, 71.598]
  - - [24064, 11521, 1, 256]
    - [21, 73.393]
  - - [7936, 3072, 1, 256]
    - [26, 68.835]
  - - [21760, 9472, 1, 256]
    - [19, 75.121]
  - - [9216, 6145, 1, 256]
    - [19, 69.56]
  - - [8192, 1536, 1, 256]
    - [19, 63.981]
  - - [39936, 27648, 1, 256]
    - [17, 74.967]
  - - [21248, 9216, 1, 256]
    - [19, 74.493]
  - - [5376, 2049, 1, 256]
    - [19, 56.9]
  - - [35072, 22529, 1, 256]
    - [40, 72.351]
  - - [13312, 769, 1, 256]
    - [27, 55.124]
  - - [35840, 9216, 1, 256]
    - [17, 74.674]
  - - [39424, 27136, 1, 256]
    - [28, 75.313]
  - - [26368, 9216, 1, 256]
    - [19, 74.3]
  - - [34048, 21505, 1, 256]
    - [20, 72.296]
  - - [26112, 1792, 1, 256]
    - [42, 71.895]
  - - [23296, 768, 1, 256]
    - [30, 67.076]
  - - [43264, 27648, 1, 256]
    - [19, 74.283]
  - - [18432, 9216, 1, 256]
    - [17, 75.027]
  - - [38912, 3072, 1, 256]
    - [19, 73.845]
  - - [30464, 17921, 1, 256]
    - [31, 72.452]
  - - [37376, 9216, 1, 256]
    - [31, 74.853]
  - - [256, 3072, 1, 256]
    - [78, 36.28]
  - - [9472, 3072, 1, 256]
    - [19, 69.062]
  - - [35840, 23552, 1, 256]
    - [19, 75.421]
  - - [8960, 3072, 1, 256]
    - [25, 68.93]
  - - [34816, 3072, 1, 256]
    - [17, 73.722]
  - - [11008, 3072, 1, 256]
    - [47, 69.116]
  - - [36864, 1536, 1, 256]
    - [19, 70.739]
  - - [23552, 9216, 1, 256]
    - [17, 74.931]
  - - [31232, 18945, 1, 256]
    - [31, 73.789]
  - - [27136, 9216, 1, 256]
    - [33, 74.972]
  - - [19968, 7681, 1, 256]
    - [31, 72.249]
  - - [31488, 18945, 1, 256]
    - [23, 73.064]
  - - [33280, 1792, 1, 256]
    - [22, 72.275]
  - - [14592, 3072, 1, 256]
    - [42, 70.802]
  - - [30976, 18689, 1, 256]
    - [31, 72.645]
  - - [4096, 769, 1, 256]
    - [35, 35.775]
  - - [31488, 3072, 1, 256]
    - [17, 72.752]
  - - [33024, 1792, 1, 256]
    - [42, 70.613]
  - - [11520, 8449, 1, 256]
    - [21, 71.344]
  - - [44544, 4353, 1, 256]
    - [23, 71.136]
  - - [18176, 5889, 1, 256]
    - [17, 70.944]
  - - [5632, 2305, 1, 256]
    - [25, 60.921]
  - - [39936, 27393, 1, 256]
    - [40, 73.828]
  - - [10240, 7169, 1, 256]
    - [17, 70.424]
  - - [39168, 26625, 1, 256]
    - [20, 72.658]
  - - [10752, 7681, 1, 256]
    - [19, 71.73]
  - - [13824, 1536, 1, 256]
    - [19, 68.41]
  - - [14336, 9216, 1, 256]
    - [17, 74.678]
  - - [37632, 25345, 1, 256]
    - [40, 73.074]
  - - [35840, 23553, 1, 256]
    - [23, 73.019]
  - - [23552, 3072, 1, 256]
    - [17, 73.223]
  - - [19712, 7169, 1, 256]
    - [40, 69.862]
  - - [5888, 2561, 1, 256]
    - [25, 63.656]
  - - [27136, 768, 1, 256]
    - [29, 67.459]
  - - [22272, 1792, 1, 256]
    - [25, 70.322]
  - - [15616, 1536, 1, 256]
    - [19, 67.46]
  - - [3840, 769, 1, 256]
    - [25, 46.289]
  - - [42240, 2304, 1, 256]
    - [17, 72.628]
  - - [24576, 3072, 1, 256]
    - [14, 68.65]
  - - [27136, 1536, 1, 256]
    - [22, 70.093]
  - - [25344, 12801, 1, 256]
    - [20, 72.186]
  - - [32512, 20224, 1, 256]
    - [16, 75.143]
  - - [17664, 3072, 1, 256]
    - [22, 71.451]
  - - [28160, 15873, 1, 256]
    - [23, 73.603]
  - - [40960, 3072, 1, 256]
    - [28, 66.819]
  - - [14592, 9216, 1, 256]
    - [49, 72.836]
  - - [22784, 10497, 1, 256]
    - [31, 72.571]
  - - [22272, 3072, 1, 256]
    - [22, 72.388]
  - - [39680, 27137, 1, 256]
    - [23, 72.405]
  - - [20992, 8704, 1, 256]
    - [17, 75.323]
  - - [24320, 1536, 1, 256]
    - [22, 69.964]
  - - [7936, 4865, 1, 256]
    - [22, 69.997]
  - - [17664, 5376, 1, 256]
    - [22, 73.382]
  - - [37888, 25345, 1, 256]
    - [40, 73.968]
  - - [23296, 10753, 1, 256]
    - [23, 72.528]
  - - [28416, 15873, 1, 256]
    - [48, 73.027]
  - - [27648, 15361, 1, 256]
    - [23, 72.759]
  - - [39424, 1536, 1, 256]
    - [22, 70.892]
  - - [15104, 2817, 1, 256]
    - [19, 68.216]
  - - [19456, 9216, 1, 256]
    - [17, 74.881]
  - - [24064, 11777, 1, 256]
    - [33, 73.397]
  - - [40448, 1536, 1, 256]
    - [21, 71.11]
  - - [512, 3072, 1, 256]
    - [87, 44.68]
  - - [38912, 9216, 1, 256]
    - [19, 74.717]
  - - [19456, 6913, 1, 256]
    - [19, 72.86]
  - - [29440, 1792, 1, 256]
    - [25, 71.532]
  - - [41984, 9216, 1, 256]
    - [19, 74.61]
  - - [14080, 1793, 1, 256]
    - [19, 65.232]
  - - [20992, 8449, 1, 256]
    - [23, 72.683]
  - - [17920, 768, 1, 256]
    - [30, 64.388]
  - - [10496, 7169, 1, 256]
    - [40, 69.631]
  - - [40704, 27648, 1, 256]
    - [19, 74.406]
  - - [13568, 1025, 1, 256]
    - [30, 59.023]
  - - [38144, 9216, 1, 256]
    - [31, 74.19]
  - - [27392, 15104, 1, 256]
    - [33, 74.726]
  - - [2304, 3072, 1, 256]
    - [26, 60.894]
  - - [9472, 6401, 1, 256]
    - [17, 70.416]
  - - [39424, 1792, 1, 256]
    - [42, 72.285]
  - - [41728, 768, 1, 256]
    - [29, 67.967]
  - - [11264, 3072, 1, 256]
    - [19, 70.634]
  - - [25344, 3072, 1, 256]
    - [22, 72.1]
  - - [24576, 1792, 1, 256]
    - [17, 67.901]
  - - [27392, 14849, 1, 256]
    - [31, 72.861]
  - - [14848, 2561, 1, 256]
    - [19, 66.512]
  - - [28160, 3072, 1, 256]
    - [19, 73.026]
  - - [23552, 11009, 1, 256]
    - [40, 73.699]
  - - [11776, 8449, 1, 256]
    - [40, 72.092]
  - - [16640, 1792, 1, 256]
    - [25, 67.869]
  - - [24576, 12289, 1, 256]
    - [23, 67.331]
  - - [38656, 26369, 1, 256]
    - [20, 72.925]
  - - [13824, 9216, 1, 256]
    - [43, 74.326]
  - - [28928, 1792, 1, 256]
    - [19, 71.293]
  - - [27904, 15361, 1, 256]
    - [31, 72.692]
  - - [3840, 1792, 1, 256]
    - [25, 60.099]
  - - [14848, 3072, 1, 256]
    - [17, 71.769]
  - - [27904, 1536, 1, 256]
    - [42, 70.041]
  - - [34816, 1536, 1, 256]
    - [19, 71.375]
  - - [14592, 2305, 1, 256]
    - [22, 66.345]
  - - [22528, 9985, 1, 256]
    - [19, 73.686]
  - - [26368, 13825, 1, 256]
    - [50, 72.918]
  - - [4096, 1792, 1, 256]
    - [25, 53.676]
  - - [30720, 18177, 1, 256]
    - [40, 74.079]
  - - [37120, 24833, 1, 256]
    - [31, 73.124]
  - - [24320, 3072, 1, 256]
    - [17, 72.794]
  - - [2560, 1536, 1, 256]
    - [25, 43.756]
  - - [44032, 4097, 1, 256]
    - [40, 70.115]
  - - [44544, 27648, 1, 256]
    - [20, 74.734]
  - - [34048, 21761, 1, 256]
    - [20, 72.608]
  - - [24064, 1536, 1, 256]
    - [26, 69.843]
  - - [24832, 12545, 1, 256]
    - [50, 73.308]
  - - [44032, 3841, 1, 256]
    - [17, 70.954]
  - - [40448, 257, 1, 256]
    - [27, 45.308]
  - - [26624, 14337, 1, 256]
    - [23, 72.796]
  - - [8192, 5121, 1, 256]
    - [17, 68.016]
  - - [42240, 1536, 1, 256]
    - [19, 70.765]
  - - [5888, 2817, 1, 256]
    - [25, 63.618]
  - - [6144, 1792, 1, 256]
    - [17, 60.128]
  - - [16384, 1792, 1, 256]
    - [14, 60.792]
  - - [35584, 23297, 1, 256]
    - [23, 73.151]
  - - [36352, 24064, 1, 256]
    - [20, 75.214]
  - - [23040, 1536, 1, 256]
    - [42, 69.287]
  - - [8704, 1536, 1, 256]
    - [25, 63.632]
  - - [18432, 6145, 1, 256]
    - [17, 70.988]
  - - [12032, 3072, 1, 256]
    - [19, 70.991]
  - - [39168, 3072, 1, 256]
    - [21, 72.818]
  - - [28160, 1536, 1, 256]
    - [40, 70.098]
  - - [41728, 27648, 1, 256]
    - [31, 73.797]
  - - [28416, 1792, 1, 256]
    - [22, 70.953]
  - - [24320, 12032, 1, 256]
    - [16, 75.433]
  - - [28928, 16385, 1, 256]
    - [40, 72.397]
  - - [34816, 22528, 1, 256]
    - [17, 75.054]
  - - [26368, 1792, 1, 256]
    - [25, 71.252]
  - - [25856, 13569, 1, 256]
    - [20, 72.951]
  - - [25600, 13312, 1, 256]
    - [19, 75.771]
  - - [31232, 18689, 1, 256]
    - [20, 73.883]
  - - [20736, 9216, 1, 256]
    - [17, 74.492]
  - - [34304, 9216, 1, 256]
    - [32, 75.021]
  - - [43264, 3073, 1, 256]
    - [40, 69.053]
  - - [8704, 5633, 1, 256]
    - [17, 70.581]
  - - [4864, 1793, 1, 256]
    - [25, 53.98]
  - - [41984, 3072, 1, 256]
    - [19, 73.928]
  - - [20992, 3072, 1, 256]
    - [17, 72.977]
  - - [9728, 6401, 1, 256]
    - [19, 70.891]
  - - [16640, 4097, 1, 256]
    - [40, 67.999]
  - - [38400, 9216, 1, 256]
    - [20, 74.802]
  - - [38656, 1536, 1, 256]
    - [22, 70.607]
  - - [1536, 3072, 1, 256]
    - [26, 50.841]
  - - [12544, 1792, 1, 256]
    - [25, 68.266]
  - - [37632, 1792, 1, 256]
    - [42, 71.968]
  - - [17152, 4609, 1, 256]
    - [19, 70.191]
  - - [18944, 6656, 1, 256]
    - [21, 74.667]
  - - [34560, 22017, 1, 256]
    - [23, 73.029]
  - - [23296, 11008, 1, 256]
    - [19, 74.913]
  - - [14848, 768, 1, 256]
    - [30, 60.74]
  - - [38656, 1792, 1, 256]
    - [22, 71.937]
  - - [8448, 5377, 1, 256]
    - [22, 70.346]
  - - [29952, 17665, 1, 256]
    - [50, 73.321]
  - - [33792, 21504, 1, 256]
    - [19, 75.406]
  - - [24576, 1536, 1, 256]
    - [28, 66.688]
  - - [37376, 1792, 1, 256]
    - [17, 72.422]
  - - [42752, 768, 1, 256]
    - [27, 68.776]
  - - [4096, 1025, 1, 256]
    - [26, 45.482]
  - - [35840, 768, 1, 256]
    - [15, 68.381]
  - - [19200, 3072, 1, 256]
    - [26, 71.676]
  - - [33536, 1792, 1, 256]
    - [25, 71.782]
  - - [36864, 9216, 1, 256]
    - [14, 74.017]
  - - [38656, 26368, 1, 256]
    - [20, 74.56]
  - - [44288, 9216, 1, 256]
    - [31, 74.399]
  - - [44288, 4097, 1, 256]
    - [40, 69.82]
  - - [26112, 3072, 1, 256]
    - [19, 73.247]
  - - [512, 768, 1, 256]
    - [78, 22.789]
  - - [36096, 3072, 1, 256]
    - [16, 71.493]
  - - [4864, 1537, 1, 256]
    - [25, 53.44]
  - - [31232, 18944, 1, 256]
    - [21, 75.689]
  - - [20224, 7681, 1, 256]
    - [20, 71.553]
  - - [26112, 9216, 1, 256]
    - [31, 74.995]
  - - [21504, 3072, 1, 256]
    - [17, 73.129]
  - - [12544, 3072, 1, 256]
    - [26, 71.024]
  - - [32256, 19713, 1, 256]
    - [48, 73.799]
  - - [40704, 1792, 1, 256]
    - [22, 72.126]
  - - [18176, 5888, 1, 256]
    - [25, 73.909]
  - - [33792, 9216, 1, 256]
    - [19, 74.743]
  - - [26624, 14336, 1, 256]
    - [17, 75.385]
  - - [38912, 1792, 1, 256]
    - [19, 72.82]
  - - [7936, 1792, 1, 256]
    - [25, 66.373]
  - - [28672, 16385, 1, 256]
    - [40, 72.361]
  - - [18944, 3072, 1, 256]
    - [42, 72.445]
  - - [33280, 20993, 1, 256]
    - [33, 73.865]
  - - [37120, 24832, 1, 256]
    - [19, 74.866]
  - - [43520, 1792, 1, 256]
    - [19, 72.876]
  - - [16896, 4609, 1, 256]
    - [21, 70.699]
  - - [41472, 1536, 1, 256]
    - [17, 71.132]
  - - [39936, 768, 1, 256]
    - [30, 68.67]
  - - [23296, 11009, 1, 256]
    - [40, 72.525]
  - - [26624, 9216, 1, 256]
    - [17, 74.827]
  - - [29184, 9216, 1, 256]
    - [51, 74.75]
  - - [36352, 9216, 1, 256]
    - [20, 74.823]
  - - [37632, 25344, 1, 256]
    - [19, 74.856]
  - - [37888, 25600, 1, 256]
    - [19, 75.356]
  - - [16640, 9216, 1, 256]
    - [31, 74.324]
  - - [44544, 9216, 1, 256]
    - [20, 74.614]
  - - [14080, 1792, 1, 256]
    - [22, 68.979]
  - - [33536, 21249, 1, 256]
    - [48, 73.389]
  - - [34048, 21760, 1, 256]
    - [44, 74.55]
  - - [9984, 768, 1, 256]
    - [15, 54.574]
  - - [40192, 1536, 1, 256]
    - [17, 71.09]
  - - [41728, 3072, 1, 256]
    - [21, 71.64]
  - - [35328, 9216, 1, 256]
    - [33, 74.937]
  - - [32512, 768, 1, 256]
    - [29, 67.213]
  - - [14592, 2049, 1, 256]
    - [29, 63.564]
  - - [14848, 9216, 1, 256]
    - [31, 74.684]
  - - [23808, 3072, 1, 256]
    - [17, 72.789]
  - - [13568, 9216, 1, 256]
    - [19, 74.107]
  - - [42496, 2560, 1, 256]
    - [17, 73.708]
  - - [42752, 3072, 1, 256]
    - [17, 73.224]
  - - [39680, 27392, 1, 256]
    - [17, 74.582]
  - - [14592, 1792, 1, 256]
    - [22, 68.208]
  - - [25600, 13313, 1, 256]
    - [23, 72.762]
  - - [26624, 1792, 1, 256]
    - [19, 72.142]
  - - [20480, 8193, 1, 256]
    - [40, 71.705]
  - - [36096, 23808, 1, 256]
    - [31, 74.247]
  - - [15104, 2561, 1, 256]
    - [30, 67.093]
  - - [43520, 3072, 1, 256]
    - [19, 73.788]
  - - [1280, 2048, 1, 256]
    - [22, 42.367]
  - - [43008, 1792, 1, 256]
    - [17, 72.967]
  - - [18688, 3072, 1, 256]
    - [17, 72.245]
  - - [35328, 23040, 1, 256]
    - [21, 75.432]
  - - [18944, 6401, 1, 256]
    - [50, 71.873]
  - - [16128, 3585, 1, 256]
    - [17, 69.134]
  - - [29952, 1536, 1, 256]
    - [17, 70.233]
  - - [17408, 5121, 1, 256]
    - [40, 70.042]
  - - [36608, 1792, 1, 256]
    - [25, 71.769]
  - - [13056, 768, 1, 256]
    - [34, 61.047]
  - - [26112, 13824, 1, 256]
    - [45, 75.824]
  - - [43520, 3585, 1, 256]
    - [40, 70.545]
  - - [40704, 9216, 1, 256]
    - [17, 74.131]
  - - [27904, 15617, 1, 256]
    - [32, 73.165]
  - - [21248, 3072, 1, 256]
    - [26, 72.225]
  - - [38912, 1536, 1, 256]
    - [19, 71.532]
  - - [28672, 1792, 1, 256]
    - [19, 71.832]
  - - [18432, 1792, 1, 256]
    - [17, 70.635]
  - - [29952, 9216, 1, 256]
    - [16, 74.232]
  - - [4352, 1025, 1, 256]
    - [15, 47.919]
  - - [34304, 22017, 1, 256]
    - [33, 73.821]
  - - [28160, 15617, 1, 256]
    - [40, 73.595]
  - - [19968, 9216, 1, 256]
    - [20, 74.953]
  - - [7424, 4353, 1, 256]
    - [25, 68.112]
  - - [19200, 1792, 1, 256]
    - [42, 69.134]
  - - [27648, 15360, 1, 256]
    - [19, 75.75]
  - - [23040, 10497, 1, 256]
    - [48, 73.426]
  - - [21248, 8961, 1, 256]
    - [48, 72.223]
  - - [32256, 1792, 1, 256]
    - [22, 72.227]
  - - [26112, 13569, 1, 256]
    - [33, 73.707]
  - - [12288, 8961, 1, 256]
    - [17, 72.875]
  - - [6656, 3585, 1, 256]
    - [42, 66.739]
  - - [19968, 7425, 1, 256]
    - [40, 72.526]
  - - [9472, 768, 1, 256]
    - [34, 52.718]
  - - [33792, 3072, 1, 256]
    - [19, 73.595]
  - - [15616, 3072, 1, 256]
    - [17, 71.795]
  - - [8704, 5377, 1, 256]
    - [19, 70.194]
  - - [11520, 3072, 1, 256]
    - [42, 70.214]
  - - [25856, 1536, 1, 256]
    - [26, 69.702]
  - - [28416, 768, 1, 256]
    - [30, 66.259]
  - - [32256, 3072, 1, 256]
    - [17, 73.426]
  - - [20736, 1536, 1, 256]
    - [25, 69.294]
  - - [22784, 10241, 1, 256]
    - [31, 71.799]
  - - [36608, 24321, 1, 256]
    - [31, 72.971]
  - - [36096, 9216, 1, 256]
    - [20, 73.759]
  - - [10752, 768, 1, 256]
    - [30, 58.055]
  - - [38400, 26112, 1, 256]
    - [19, 75.376]
  - - [9216, 5889, 1, 256]
    - [25, 70.705]
  - - [41472, 27648, 1, 256]
    - [33, 74.643]
  - - [38144, 25856, 1, 256]
    - [17, 74.767]
  - - [15360, 3073, 1, 256]
    - [19, 67.924]
  - - [29184, 16896, 1, 256]
    - [17, 75.487]
  - - [16128, 1792, 1, 256]
    - [25, 68.836]
  - - [32768, 20225, 1, 256]
    - [39, 57.927]
  - - [23040, 10752, 1, 256]
    - [16, 75.65]
  - - [15872, 3585, 1, 256]
    - [17, 69.965]
  - - [11008, 7681, 1, 256]
    - [47, 70.59]
  - - [15360, 9216, 1, 256]
    - [17, 74.876]
  - - [28416, 16128, 1, 256]
    - [21, 74.891]
  - - [30208, 1792, 1, 256]
    - [19, 71.803]
  - - [41728, 1792, 1, 256]
    - [44, 71.002]
  - - [32256, 19968, 1, 256]
    - [21, 75.446]
  - - [18944, 1792, 1, 256]
    - [42, 70.622]
  - - [41728, 1793, 1, 256]
    - [17, 66.538]
  - - [31488, 19201, 1, 256]
    - [23, 73.037]
  - - [40192, 257, 1, 256]
    - [17, 44.954]
  - - [42752, 27648, 1, 256]
    - [19, 74.278]
  - - [40704, 768, 1, 256]
    - [24, 68.398]
  - - [25088, 12545, 1, 256]
    - [16, 73.619]
  - - [24576, 9216, 1, 256]
    - [28, 70.049]
  - - [33024, 20737, 1, 256]
    - [50, 73.586]
  - - [29696, 9216, 1, 256]
    - [19, 74.863]
  - - [31232, 1536, 1, 256]
    - [17, 70.863]
  - - [30208, 17920, 1, 256]
    - [16, 75.773]
  - - [44544, 4609, 1, 256]
    - [40, 71.087]
  - - [22016, 9728, 1, 256]
    - [17, 75.247]
  - - [30208, 17921, 1, 256]
    - [32, 73.75]
  - - [19200, 6657, 1, 256]
    - [48, 71.173]
  - - [22016, 9729, 1, 256]
    - [16, 73.212]
  - - [18176, 768, 1, 256]
    - [15, 64.992]
  - - [29184, 1792, 1, 256]
    - [42, 71.58]
  - - [12288, 1792, 1, 256]
    - [26, 67.603]
  - - [22528, 1536, 1, 256]
    - [25, 69.808]
  - - [14848, 2305, 1, 256]
    - [17, 66.318]
  - - [41216, 1025, 1, 256]
    - [24, 63.189]
  - - [8192, 3072, 1, 256]
    - [19, 69.015]
  - - [5888, 1792, 1, 256]
    - [25, 64.218]
  - - [21760, 3072, 1, 256]
    - [26, 72.375]
  - - [22272, 9985, 1, 256]
    - [50, 72.608]
  - - [29184, 1536, 1, 256]
    - [22, 70.393]
  - - [22016, 3072, 1, 256]
    - [16, 72.804]
  - - [30720, 9216, 1, 256]
    - [19, 74.894]
  - - [39680, 1792, 1, 256]
    - [19, 72.047]
  - - [9728, 1536, 1, 256]
    - [26, 63.991]
  - - [34560, 9216, 1, 256]
    - [17, 74.255]
  - - [12032, 8705, 1, 256]
    - [17, 71.355]
  - - [10752, 7425, 1, 256]
    - [21, 71.821]
  - - [18688, 1536, 1, 256]
    - [25, 69.385]
  - - [16128, 3840, 1, 256]
    - [25, 72.828]
  - - [38656, 768, 1, 256]
    - [24, 68.285]
  - - [21248, 1792, 1, 256]
    - [25, 70.279]
  - - [36352, 3072, 1, 256]
    - [19, 73.493]
  - - [19968, 7680, 1, 256]
    - [19, 75.125]
  - - [3840, 513, 1, 256]
    - [25, 32.748]
  - - [38400, 3072, 1, 256]
    - [17, 73.324]
  - - [5376, 768, 1, 256]
    - [26, 44.727]
  - - [20224, 9216, 1, 256]
    - [17, 74.585]
  - - [17408, 5120, 1, 256]
    - [19, 74.321]
  - - [28928, 9216, 1, 256]
    - [17, 74.117]
  - - [35072, 1792, 1, 256]
    - [19, 71.863]
  - - [31488, 19200, 1, 256]
    - [19, 75.016]
  - - [11008, 7937, 1, 256]
    - [49, 70.797]
  - - [21248, 8705, 1, 256]
    - [50, 72.196]
  - - [13568, 3072, 1, 256]
    - [25, 71.084]
  - - [34560, 22273, 1, 256]
    - [23, 73.128]
  - - [34048, 768, 1, 256]
    - [30, 67.567]
  - - [40448, 27648, 1, 256]
    - [32, 74.661]
  - - [28416, 16129, 1, 256]
    - [40, 73.072]
  - - [34816, 22529, 1, 256]
    - [23, 72.704]
  - - [22528, 3072, 1, 256]
    - [19, 73.326]
  - - [27136, 14593, 1, 256]
    - [48, 73.833]
  - - [35584, 3072, 1, 256]
    - [19, 72.72]
  - - [43008, 3072, 1, 256]
    - [19, 73.831]
  - - [30464, 1792, 1, 256]
    - [22, 70.013]
  - - [16384, 4097, 1, 256]
    - [19, 59.138]
  - - [20992, 9216, 1, 256]
    - [31, 75.069]
  - - [31488, 1792, 1, 256]
    - [25, 71.727]
  - - [31488, 9216, 1, 256]
    - [19, 74.117]
  - - [22272, 9984, 1, 256]
    - [22, 75.013]
  - - [41728, 1537, 1, 256]
    - [19, 65.171]
  - - [26880, 1792, 1, 256]
    - [19, 71.327]
  - - [30464, 768, 1, 256]
    - [24, 66.682]
  - - [2816, 1792, 1, 256]
    - [26, 54.473]
  - - [41472, 1537, 1, 256]
    - [17, 66.289]
  - - [43008, 27648, 1, 256]
    - [17, 74.892]
  - - [39424, 27137, 1, 256]
    - [31, 73.628]
  - - [24320, 1792, 1, 256]
    - [22, 70.912]
  - - [32000, 3072, 1, 256]
    - [17, 72.768]
  - - [12800, 1792, 1, 256]
    - [22, 68.573]
  - - [15872, 3072, 1, 256]
    - [17, 72.001]
  - - [15872, 1792, 1, 256]
    - [26, 70.342]
  - - [10496, 7425, 1, 256]
    - [40, 71.106]
  - - [16896, 4608, 1, 256]
    - [17, 73.401]
  - - [9984, 6913, 1, 256]
    - [17, 71.091]
  - - [21248, 8960, 1, 256]
    - [19, 74.939]
  - - [14336, 1792, 1, 256]
    - [26, 69.041]
  - - [24832, 12544, 1, 256]
    - [22, 75.359]
  - - [30464, 18176, 1, 256]
    - [20, 74.481]
  - - [31744, 19201, 1, 256]
    - [19, 74.065]
  - - [1792, 768, 1, 256]
    - [90, 40.595]
  - - [1536, 2048, 1, 256]
    - [22, 49.311]
  - - [40192, 3072, 1, 256]
    - [17, 73.329]
  - - [42240, 3072, 1, 256]
    - [19, 73.139]
  - - [32256, 9216, 1, 256]
    - [32, 74.881]
  - - [41984, 2049, 1, 256]
    - [51, 66.57]
  - - [6656, 1792, 1, 256]
    - [42, 63.224]
  - - [13824, 1537, 1, 256]
    - [19, 63.771]
  - - [20736, 3072, 1, 256]
    - [19, 72.45]
  - - [36096, 23809, 1, 256]
    - [31, 72.71]
  - - [41728, 9216, 1, 256]
    - [20, 73.108]
  - - [25600, 768, 1, 256]
    - [15, 67.051]
  - - [37632, 768, 1, 256]
    - [15, 68.035]
  - - [25600, 9216, 1, 256]
    - [19, 75.002]
  - - [19968, 3072, 1, 256]
    - [19, 72.482]
  - - [15616, 9216, 1, 256]
    - [19, 74.411]
  - - [29184, 16897, 1, 256]
    - [23, 73.625]
  - - [7168, 3841, 1, 256]
    - [19, 67.57]
  - - [40704, 769, 1, 256]
    - [24, 60.707]
  - - [6144, 3073, 1, 256]
    - [17, 64.657]
  - - [34304, 1792, 1, 256]
    - [42, 72.252]
  - - [18688, 6400, 1, 256]
    - [17, 74.512]
  - - [20992, 1536, 1, 256]
    - [19, 69.992]
  - - [21760, 768, 1, 256]
    - [15, 64.205]
  - - [43264, 3072, 1, 256]
    - [17, 73.263]
  - - [21760, 9216, 1, 256]
    - [17, 74.502]
  - - [11264, 768, 1, 256]
    - [34, 60.064]
  - - [42496, 3072, 1, 256]
    - [17, 73.716]
  - - [30208, 17665, 1, 256]
    - [50, 73.922]
  - - [27392, 15105, 1, 256]
    - [20, 72.88]
  - - [29952, 17409, 1, 256]
    - [50, 72.467]
  - - [44032, 3072, 1, 256]
    - [17, 73.868]
  - - [41216, 9216, 1, 256]
    - [31, 74.596]
  - - [8448, 1536, 1, 256]
    - [26, 61.889]
  - - [36352, 768, 1, 256]
    - [30, 68.459]
  - - [23552, 768, 1, 256]
    - [27, 64.869]
  - - [7168, 3072, 1, 256]
    - [26, 67.869]
  - - [44288, 4353, 1, 256]
    - [40, 70.362]
  - - [36608, 768, 1, 256]
    - [30, 68.316]
  - - [15616, 3073, 1, 256]
    - [19, 68.049]
  - - [37376, 24833, 1, 256]
    - [20, 73.814]
  - - [38144, 25857, 1, 256]
    - [20, 72.949]
  - - [26880, 14592, 1, 256]
    - [19, 75.253]
  - - [6144, 2817, 1, 256]
    - [17, 62.577]
  - - [23808, 768, 1, 256]
    - [30, 64.822]
  - - [39168, 26881, 1, 256]
    - [31, 72.928]
  - - [5120, 1793, 1, 256]
    - [26, 55.962]
  - - [32512, 19969, 1, 256]
    - [33, 73.225]
  - - [43008, 2817, 1, 256]
    - [17, 69.9]
  - - [26112, 13825, 1, 256]
    - [33, 73.821]
  - - [33536, 3072, 1, 256]
    - [21, 72.881]
  - - [9728, 6657, 1, 256]
    - [19, 71.388]
  - - [2048, 3072, 1, 256]
    - [26, 55.21]
  - - [24832, 9216, 1, 256]
    - [19, 74.486]
  - - [5632, 2561, 1, 256]
    - [19, 61.714]
  - - [33280, 20992, 1, 256]
    - [21, 75.582]
  - - [20224, 7936, 1, 256]
    - [19, 74.62]
  - - [28672, 16384, 1, 256]
    - [19, 74.944]
  - - [28416, 9216, 1, 256]
    - [23, 73.936]
  - - [7936, 768, 1, 256]
    - [19, 52.95]
  - - [23552, 11265, 1, 256]
    - [17, 72.46]
  - - [25088, 3072, 1, 256]
    - [19, 72.818]
  - - [32000, 19457, 1, 256]
    - [23, 72.725]
  - - [44800, 3072, 1, 256]
    - [17, 72.719]
  - - [37120, 1792, 1, 256]
    - [19, 71.806]
  - - [30464, 18177, 1, 256]
    - [20, 72.706]
  - - [44544, 4608, 1, 256]
    - [20, 73.899]
  - - [7168, 768, 1, 256]
    - [19, 49.311]
  - - [18944, 9216, 1, 256]
    - [32, 74.773]
  - - [33280, 20737, 1, 256]
    - [48, 73.951]
  - - [25856, 3072, 1, 256]
    - [26, 72.641]
  - - [27648, 9216, 1, 256]
    - [17, 74.837]
  - - [5120, 2049, 1, 256]
    - [52, 55.943]
  - - [28160, 9216, 1, 256]
    - [37, 74.804]
  - - [37632, 25089, 1, 256]
    - [23, 73.058]
  - - [22016, 1792, 1, 256]
    - [19, 71.088]
  - - [16384, 9216, 1, 256]
    - [14, 63.2]
  - - [21504, 9217, 1, 256]
    - [23, 72.143]
  - - [20480, 7937, 1, 256]
    - [23, 72.788]
  - - [33536, 21248, 1, 256]
    - [21, 75.086]
  - - [12800, 768, 1, 256]
    - [30, 60.244]
  - - [28672, 9216, 1, 256]
    - [17, 74.277]
  - - [32000, 9216, 1, 256]
    - [19, 74.163]
  - - [44544, 3072, 1, 256]
    - [17, 73.355]
  - - [5376, 3072, 1, 256]
    - [17, 64.581]
  - - [35840, 23297, 1, 256]
    - [23, 74.027]
  - - [23808, 11521, 1, 256]
    - [23, 72.524]
  - - [13312, 1025, 1, 256]
    - [27, 58.916]
  - - [18176, 9216, 1, 256]
    - [17, 74.483]
  - - [17920, 5633, 1, 256]
    - [42, 71.536]
  - - [27648, 3072, 1, 256]
    - [17, 73.527]
  - - [1024, 3072, 1, 256]
    - [29, 49.177]
  - - [22016, 9216, 1, 256]
    - [31, 75.131]
  - - [21760, 9473, 1, 256]
    - [23, 72.475]
  - - [6144, 1536, 1, 256]
    - [25, 58.455]
  - - [16896, 1536, 1, 256]
    - [25, 68.548]
  - - [19968, 768, 1, 256]
    - [30, 64.87]
  - - [23552, 11264, 1, 256]
    - [17, 75.562]
  - - [27904, 3072, 1, 256]
    - [42, 72.351]
  - - [19712, 7425, 1, 256]
    - [50, 71.126]
  - - [26624, 14081, 1, 256]
    - [17, 73.889]
  - - [3328, 257, 1, 256]
    - [80, 31.019]
  - - [24320, 9216, 1, 256]
    - [16, 74.48]
  - - [14080, 3072, 1, 256]
    - [42, 70.439]
  - - [17408, 3072, 1, 256]
    - [17, 72.646]
  - - [21504, 9216, 1, 256]
    - [19, 74.988]
  - - [14848, 2560, 1, 256]
    - [25, 71.053]
  - - [34304, 3072, 1, 256]
    - [16, 73.279]
  - - [15104, 9216, 1, 256]
    - [17, 74.312]
  - - [17152, 4865, 1, 256]
    - [17, 70.61]
  - - [38912, 26625, 1, 256]
    - [40, 72.727]
  - - [41216, 1792, 1, 256]
    - [17, 71.942]
  - - [39424, 3072, 1, 256]
    - [19, 73.417]
  - - [30720, 18433, 1, 256]
    - [23, 72.945]
  - - [18944, 6657, 1, 256]
    - [16, 72.217]
  - - [5632, 1792, 1, 256]
    - [25, 61.719]
  - - [18176, 1792, 1, 256]
    - [25, 69.577]
  - - [31232, 9216, 1, 256]
    - [20, 74.854]
  - - [42752, 2561, 1, 256]
    - [23, 68.13]
  - - [18688, 9216, 1, 256]
    - [17, 74.553]
  - - [43776, 1792, 1, 256]
    - [31, 69.792]
  - - [10240, 1792, 1, 256]
    - [26, 66.547]
  - - [33792, 21505, 1, 256]
    - [23, 72.863]
  - - [25856, 13313, 1, 256]
    - [20, 72.38]
  - - [29952, 3072, 1, 256]
    - [21, 72.875]
  - - [5888, 768, 1, 256]
    - [25, 48.723]
  - - [20480, 9216, 1, 256]
    - [17, 74.621]
  - - [17152, 1792, 1, 256]
    - [25, 69.112]
  - - [23040, 10753, 1, 256]
    - [50, 73.355]
  - - [8960, 5889, 1, 256]
    - [22, 70.343]
  - - [16640, 4352, 1, 256]
    - [25, 72.785]
  - - [30464, 3072, 1, 256]
    - [22, 71.363]
  - - [16128, 9216, 1, 256]
    - [17, 74.406]
  - - [25344, 13057, 1, 256]
    - [31, 72.612]
  - - [39424, 9216, 1, 256]
    - [31, 74.936]
  - - [25600, 3072, 1, 256]
    - [19, 73.346]
  - - [28416, 3072, 1, 256]
    - [16, 72.357]
  - - [12800, 257, 1, 256]
    - [15, 36.642]
  - - [43264, 1792, 1, 256]
    - [17, 72.181]
  - - [20736, 8193, 1, 256]
    - [40, 71.591]
  - - [30976, 9216, 1, 256]
    - [31, 73.289]
  - - [40192, 27648, 1, 256]
    - [17, 74.477]
  - - [31232, 1792, 1, 256]
    - [26, 71.89]
  - - [36352, 23809, 1, 256]
    - [20, 73.868]
  - - [9984, 3072, 1, 256]
    - [17, 69.262]
  - - [11776, 1792, 1, 256]
    - [22, 68.461]
  - - [37120, 1536, 1, 256]
    - [26, 70.444]
  - - [14592, 2304, 1, 256]
    - [42, 69.777]
  - - [7424, 768, 1, 256]
    - [15, 50.368]
  - - [10240, 1536, 1, 256]
    - [26, 65.762]
  - - [27392, 9216, 1, 256]
    - [31, 74.083]
  - - [15104, 3072, 1, 256]
    - [25, 71.582]
  - - [19200, 9216, 1, 256]
    - [20, 74.336]
  - - [36096, 23553, 1, 256]
    - [20, 72.256]
  - - [16128, 3841, 1, 256]
    - [19, 69.422]
  - - [18432, 5889, 1, 256]
    - [17, 72.062]
  - - [43776, 3841, 1, 256]
    - [20, 69.142]
  - - [22528, 10241, 1, 256]
    - [40, 72.313]
  - - [20224, 3072, 1, 256]
    - [19, 72.17]
  - - [39680, 3072, 1, 256]
    - [17, 72.868]
  - - [20736, 8449, 1, 256]
    - [23, 72.238]
  - - [30720, 1792, 1, 256]
    - [25, 72.468]
  - - [36864, 24321, 1, 256]
    - [23, 73.196]
  - - [22784, 1536, 1, 256]
    - [25, 69.341]
  - - [7424, 4097, 1, 256]
    - [17, 66.537]
  - - [7680, 4609, 1, 256]
    - [17, 68.021]
  - - [12032, 768, 1, 256]
    - [30, 57.752]
  - - [1792, 3072, 1, 256]
    - [25, 49.169]
  - - [6400, 3073, 1, 256]
    - [17, 63.363]
  - - [29440, 17153, 1, 256]
    - [50, 73.313]
  - - [8704, 1792, 1, 256]
    - [19, 65.844]
  - - [30720, 3072, 1, 256]
    - [19, 73.577]
  - - [16384, 3841, 1, 256]
    - [28, 58.468]
  - - [40192, 9216, 1, 256]
    - [19, 74.318]
  - - [23040, 1792, 1, 256]
    - [26, 71.001]
  - - [37888, 25601, 1, 256]
    - [40, 72.878]
  - - [26368, 14080, 1, 256]
    - [17, 75.251]
  - - [30208, 3072, 1, 256]
    - [19, 72.997]
  - - [33024, 20736, 1, 256]
    - [33, 75.079]
  - - [35072, 22784, 1, 256]
    - [17, 74.903]
  - - [9472, 6145, 1, 256]
    - [19, 69.301]
  - - [22784, 1792, 1, 256]
    - [25, 70.849]
  - - [768, 2048, 1, 256]
    - [82, 44.352]
  - - [1024, 1280, 1, 256]
    - [91, 43.314]
  - - [41984, 27648, 1, 256]
    - [17, 74.925]
  - - [33024, 20481, 1, 256]
    - [32, 72.827]
  - - [33280, 1536, 1, 256]
    - [26, 71.098]
  - - [9216, 3072, 1, 256]
    - [25, 70.425]
  - - [22528, 1792, 1, 256]
    - [25, 71.567]
  - - [25088, 768, 1, 256]
    - [15, 66.789]
  - - [13825, 128, 1, 128]
    - [92, 26.713]
  - - [20609, 128, 1, 256]
    - [145, 33.58]
  - - [6017, 128, 1, 256]
    - [93, 30.524]
  - - [2305, 128, 1, 128]
    - [94, 10.976]
  - - [15745, 128, 1, 256]
    - [145, 27.345]
  - - [8833, 128, 1, 128]
    - [95, 23.452]
  - - [641, 128, 1, 128]
    - [96, 3.197]
  - - [9217, 128, 1, 128]
    - [97, 23.704]
  - - [15361, 128, 1, 256]
    - [151, 26.647]
  - - [22913, 128, 1, 256]
    - [146, 36.177]
  - - [2177, 128, 1, 128]
    - [88, 10.367]
  - - [19073, 128, 1, 256]
    - [150, 31.601]
  - - [28289, 128, 1, 128]
    - [145, 20.694]
  - - [13057, 128, 1, 256]
    - [81, 37.574]
  - - [1793, 128, 1, 128]
    - [98, 8.538]
  - - [16769, 128, 1, 128]
    - [151, 18.474]
  - - [23681, 128, 1, 256]
    - [147, 36.993]
  - - [14593, 128, 1, 256]
    - [146, 25.525]
  - - [24449, 128, 1, 128]
    - [146, 24.486]
  - - [4609, 128, 1, 256]
    - [99, 24.923]
  - - [10625, 128, 1, 128]
    - [100, 23.134]
  - - [12545, 128, 1, 256]
    - [101, 36.242]
  - - [5633, 128, 1, 128]
    - [102, 18.479]
  - - [641, 128, 1, 256]
    - [99, 4.731]
  - - [18305, 128, 1, 256]
    - [146, 30.812]
  - - [23297, 128, 1, 256]
    - [154, 36.822]
  - - [21377, 128, 1, 256]
    - [147, 34.302]
  - - [9601, 128, 1, 128]
    - [103, 24.866]
  - - [13697, 128, 1, 256]
    - [104, 39.415]
  - - [23681, 128, 1, 128]
    - [145, 23.717]
  - - [24833, 128, 1, 256]
    - [148, 38.387]
  - - [25985, 128, 1, 128]
    - [151, 25.37]
  - - [9601, 128, 1, 256]
    - [105, 35.612]
  - - [17153, 128, 1, 128]
    - [145, 18.729]
  - - [9985, 128, 1, 128]
    - [106, 25.327]
  - - [23297, 128, 1, 128]
    - [151, 23.719]
  - - [19073, 128, 1, 128]
    - [146, 20.373]
  - - [2689, 128, 1, 256]
    - [88, 18.463]
  - - [4993, 128, 1, 128]
    - [88, 19.814]
  - - [6913, 128, 1, 256]
    - [107, 33.681]
  - - [6785, 128, 1, 128]
    - [98, 22.258]
  - - [27905, 128, 1, 128]
    - [145, 26.646]
  - - [7169, 128, 1, 256]
    - [108, 27.705]
  - - [11905, 128, 1, 256]
    - [103, 35.504]
  - - [1409, 128, 1, 128]
    - [109, 7.027]
  - - [12673, 128, 1, 128]
    - [105, 26.276]
  - - [27521, 128, 1, 256]
    - [149, 41.204]
  - - [1409, 128, 1, 256]
    - [98, 10.4]
  - - [25217, 128, 1, 128]
    - [151, 24.917]
  - - [7297, 128, 1, 128]
    - [103, 20.023]
  - - [14081, 128, 1, 128]
    - [145, 15.796]
  - - [22913, 128, 1, 128]
    - [146, 23.168]
  - - [10753, 128, 1, 256]
    - [110, 32.662]
  - - [7937, 128, 1, 128]
    - [102, 21.46]
  - - [11393, 128, 1, 128]
    - [105, 24.445]
  - - [26369, 128, 1, 128]
    - [145, 25.951]
  - - [12161, 128, 1, 256]
    - [103, 36.415]
  - - [8449, 128, 1, 128]
    - [95, 22.514]
  - - [22145, 128, 1, 256]
    - [150, 35.265]
  - - [20225, 128, 1, 256]
    - [150, 33.174]
  - - [10241, 128, 1, 256]
    - [97, 35.572]
  - - [6913, 128, 1, 128]
    - [98, 21.806]
  - - [4993, 128, 1, 256]
    - [111, 26.999]
  - - [6401, 128, 1, 256]
    - [112, 32.584]
  - - [13057, 128, 1, 128]
    - [113, 26.404]
  - - [2945, 128, 1, 128]
    - [114, 13.846]
  - - [3713, 128, 1, 256]
    - [88, 20.452]
  - - [10753, 128, 1, 128]
    - [107, 23.073]
  - - [14849, 128, 1, 256]
    - [146, 26.003]
  - - [3841, 128, 1, 128]
    - [88, 15.578]
  - - [28289, 128, 1, 256]
    - [150, 32.474]
  - - [12929, 128, 1, 128]
    - [108, 26.806]
  - - [14081, 128, 1, 256]
    - [145, 24.426]
  - - [14977, 128, 1, 256]
    - [146, 26.165]
  - - [12545, 128, 1, 128]
    - [113, 25.865]
  - - [16129, 128, 1, 256]
    - [146, 27.59]
  - - [11777, 128, 1, 256]
    - [110, 34.359]
  - - [11777, 128, 1, 128]
    - [115, 24.695]
  - - [17537, 128, 1, 256]
    - [145, 29.553]
  - - [5377, 128, 1, 128]
    - [116, 17.639]
  - - [8065, 128, 1, 256]
    - [105, 31.167]
  - - [6145, 128, 1, 128]
    - [112, 19.981]
  - - [20993, 128, 1, 128]
    - [150, 21.979]
  - - [15617, 128, 1, 128]
    - [145, 17.518]
  - - [5633, 128, 1, 256]
    - [93, 28.675]
  - - [4865, 128, 1, 128]
    - [99, 19.203]
  - - [385, 128, 1, 256]
    - [94, 2.856]
  - - [3841, 128, 1, 256]
    - [111, 21.236]
  - - [8833, 128, 1, 256]
    - [108, 33.694]
  - - [4225, 128, 1, 128]
    - [94, 17.135]
  - - [11009, 128, 1, 256]
    - [108, 33.235]
  - - [385, 128, 1, 128]
    - [94, 1.973]
  - - [9473, 128, 1, 256]
    - [108, 35.137]
  - - [5761, 128, 1, 128]
    - [98, 19.155]
  - - [11905, 128, 1, 128]
    - [113, 25.324]
  - - [4097, 128, 1, 256]
    - [117, 22.568]
  - - [25217, 128, 1, 256]
    - [147, 38.617]
  - - [9089, 128, 1, 256]
    - [118, 34.055]
  - - [10369, 128, 1, 256]
    - [108, 37.425]
  - - [14209, 128, 1, 256]
    - [150, 24.794]
  - - [6401, 128, 1, 128]
    - [117, 20.814]
  - - [27137, 128, 1, 256]
    - [147, 41.004]
  - - [16385, 128, 1, 256]
    - [145, 28.591]
  - - [24833, 128, 1, 128]
    - [146, 24.538]
  - - [18689, 128, 1, 128]
    - [151, 19.906]
  - - [7553, 128, 1, 256]
    - [93, 29.265]
  - - [8321, 128, 1, 128]
    - [107, 22.334]
  - - [15361, 128, 1, 128]
    - [145, 17.337]
  - - [1153, 128, 1, 128]
    - [98, 5.75]
  - - [1025, 128, 1, 128]
    - [94, 5.182]
  - - [19841, 128, 1, 256]
    - [152, 32.4]
  - - [15233, 128, 1, 128]
    - [145, 17.088]
  - - [21761, 128, 1, 256]
    - [146, 34.842]
  - - [17153, 128, 1, 256]
    - [146, 29.478]
  - - [15617, 128, 1, 256]
    - [150, 27.123]
  - - [4865, 128, 1, 256]
    - [98, 26.404]
  - - [14209, 128, 1, 128]
    - [151, 16.135]
  - - [19457, 128, 1, 256]
    - [145, 32.31]
  - - [9857, 128, 1, 256]
    - [106, 36.107]
  - - [11521, 128, 1, 128]
    - [112, 24.366]
  - - [8449, 128, 1, 256]
    - [106, 32.146]
  - - [4097, 128, 1, 128]
    - [88, 16.708]
  - - [28673, 128, 1, 256]
    - [146, 31.898]
  - - [12161, 128, 1, 128]
    - [107, 25.868]
  - - [1921, 128, 1, 256]
    - [94, 13.314]
  - - [9985, 128, 1, 256]
    - [106, 36.306]
  - - [7937, 128, 1, 256]
    - [107, 30.434]
  - - [9857, 128, 1, 128]
    - [97, 25.528]
  - - [13825, 128, 1, 256]
    - [104, 39.476]
  - - [9089, 128, 1, 128]
    - [97, 24.22]
  - - [6785, 128, 1, 256]
    - [107, 33.387]
  - - [5249, 128, 1, 256]
    - [107, 27.094]
  - - [7681, 128, 1, 256]
    - [105, 29.376]
  - - [3329, 128, 1, 128]
    - [94, 15.075]
  - - [14465, 128, 1, 128]
    - [151, 16.375]
  - - [11137, 128, 1, 256]
    - [107, 34.039]
  - - [1153, 128, 1, 256]
    - [98, 8.596]
  - - [16001, 128, 1, 128]
    - [145, 17.707]
  - - [26753, 128, 1, 128]
    - [145, 25.881]
  - - [13697, 128, 1, 128]
    - [113, 27.251]
  - - [3073, 128, 1, 128]
    - [114, 14.356]
  - - [22529, 128, 1, 256]
    - [146, 35.8]
  - - [18689, 128, 1, 256]
    - [155, 30.86]
  - - [257, 128, 1, 128]
    - [109, 1.282]
  - - [15233, 128, 1, 256]
    - [146, 26.581]
  - - [27521, 128, 1, 128]
    - [150, 26.45]
  - - [16385, 128, 1, 128]
    - [146, 18.492]
  - - [4481, 128, 1, 256]
    - [111, 24.683]
  - - [6017, 128, 1, 128]
    - [102, 19.916]
  - - [7297, 128, 1, 256]
    - [93, 28.273]
  - - [7553, 128, 1, 128]
    - [100, 20.572]
  - - [21761, 128, 1, 128]
    - [150, 22.216]
  - - [11393, 128, 1, 256]
    - [103, 34.324]
  - - [11521, 128, 1, 256]
    - [103, 34.428]
  - - [12929, 128, 1, 256]
    - [106, 37.424]
  - - [20225, 128, 1, 128]
    - [145, 21.175]
  - - [13313, 128, 1, 128]
    - [92, 25.928]
  - - [2561, 128, 1, 128]
    - [88, 12.04]
  - - [1537, 128, 1, 128]
    - [99, 7.718]
  - - [24449, 128, 1, 256]
    - [158, 37.636]
  - - [12289, 128, 1, 256]
    - [110, 35.432]
  - - [4225, 128, 1, 256]
    - [88, 23.101]
  - - [26369, 128, 1, 256]
    - [153, 40.172]
  - - [17921, 128, 1, 256]
    - [151, 30.409]
  - - [2945, 128, 1, 256]
    - [88, 20.127]
  - - [24065, 128, 1, 128]
    - [146, 24.069]
  - - [6529, 128, 1, 128]
    - [99, 21.514]
  - - [6145, 128, 1, 256]
    - [107, 30.96]
  - - [25985, 128, 1, 256]
    - [150, 39.546]
  - - [8705, 128, 1, 256]
    - [106, 32.533]
  - - [384, 128, 1, 256]
    - [83, 3.132]
  - - [25601, 128, 1, 256]
    - [154, 38.882]
  - - [28673, 128, 1, 128]
    - [146, 20.508]
  - - [20609, 128, 1, 128]
    - [145, 21.547]
  - - [19457, 128, 1, 128]
    - [151, 20.546]
  - - [16769, 128, 1, 256]
    - [150, 28.553]
  - - [12673, 128, 1, 256]
    - [81, 36.9]
  - - [8321, 128, 1, 256]
    - [103, 31.823]
  - - [5249, 128, 1, 128]
    - [98, 17.854]
  - - [16129, 128, 1, 128]
    - [145, 18.011]
  - - [13441, 128, 1, 256]
    - [82, 38.454]
  - - [5377, 128, 1, 256]
    - [103, 27.466]
  - - [21377, 128, 1, 128]
    - [146, 21.885]
  - - [14465, 128, 1, 256]
    - [150, 25.211]
  - - [11137, 128, 1, 128]
    - [92, 24.107]
  - - [7681, 128, 1, 128]
    - [97, 20.692]
  - - [7169, 128, 1, 128]
    - [93, 19.671]
  - - [22145, 128, 1, 128]
    - [145, 22.957]
  - - [11009, 128, 1, 128]
    - [113, 23.76]
  - - [20993, 128, 1, 256]
    - [150, 34.018]
  - - [13313, 128, 1, 256]
    - [104, 37.292]
  - - [25601, 128, 1, 128]
    - [151, 24.669]
  - - [4609, 128, 1, 128]
    - [98, 18.29]
  - - [5761, 128, 1, 256]
    - [112, 29.529]
  - - [17921, 128, 1, 128]
    - [145, 19.773]
  - - [2689, 128, 1, 128]
    - [109, 12.405]
  - - [8705, 128, 1, 128]
    - [97, 22.785]
  - - [10241, 128, 1, 128]
    - [115, 25.624]
  - - [14977, 128, 1, 128]
    - [146, 16.955]
  - - [18305, 128, 1, 128]
    - [151, 19.753]
  - - [3457, 128, 1, 128]
    - [94, 15.372]
  - - [24065, 128, 1, 256]
    - [146, 37.356]
  - - [12289, 128, 1, 128]
    - [113, 25.127]
  - - [14593, 128, 1, 128]
    - [145, 16.546]
  - - [2177, 128, 1, 256]
    - [114, 15.018]
  - - [4481, 128, 1, 128]
    - [99, 18.173]
  - - [8065, 128, 1, 128]
    - [93, 21.886]
  - - [3457, 128, 1, 256]
    - [94, 22.482]
  - - [6529, 128, 1, 256]
    - [103, 32.895]
  - - [26753, 128, 1, 256]
    - [156, 40.673]
  - - [17537, 128, 1, 128]
    - [150, 19.148]
  - - [22529, 128, 1, 128]
    - [146, 22.748]
  - - [10625, 128, 1, 256]
    - [103, 32.474]
  - - [14849, 128, 1, 128]
    - [145, 17.019]
  - - [9217, 128, 1, 256]
    - [115, 33.105]
  - - [19841, 128, 1, 128]
    - [145, 21.072]
  - - [15745, 128, 1, 128]
    - [150, 17.609]
  - - [13441, 128, 1, 128]
    - [108, 27.181]
  - - [3713, 128, 1, 128]
    - [88, 15.058]
  - - [27137, 128, 1, 128]
    - [155, 26.286]
  - - [16001, 128, 1, 256]
    - [151, 27.499]
  - - [10369, 128, 1, 128]
    - [97, 26.301]
  - - [1921, 128, 1, 128]
    - [88, 8.975]
  - - [9473, 128, 1, 128]
    - [106, 24.62]
  - - [27905, 128, 1, 256]
    - [157, 41.737]
  - - [30976, 1024, 1, 128]
    - [19, 42.513]
  - - [42240, 26369, 1, 128]
    - [14, 45.705]
  - - [33024, 17025, 1, 128]
    - [19, 46.355]
  - - [39168, 512, 1, 128]
    - [26, 41.06]
  - - [30848, 1024, 1, 128]
    - [15, 42.967]
  - - [41728, 8192, 1, 128]
    - [44, 45.865]
  - - [39552, 23553, 1, 128]
    - [14, 45.133]
  - - [35072, 512, 1, 128]
    - [27, 41.862]
  - - [29952, 14081, 1, 128]
    - [17, 45.934]
  - - [33280, 2048, 1, 128]
    - [29, 44.567]
  - - [40320, 128, 1, 128]
    - [25, 32.824]
  - - [35456, 1024, 1, 128]
    - [27, 42.971]
  - - [36096, 1024, 1, 128]
    - [42, 40.444]
  - - [36992, 20993, 1, 128]
    - [14, 45.407]
  - - [36096, 20097, 1, 128]
    - [44, 44.703]
  - - [31488, 15489, 1, 128]
    - [14, 45.828]
  - - [39552, 23681, 1, 128]
    - [14, 45.361]
  - - [36864, 128, 1, 128]
    - [34, 30.903]
  - - [40320, 4096, 1, 128]
    - [19, 45.636]
  - - [35200, 2048, 1, 128]
    - [34, 44.094]
  - - [29824, 2048, 1, 128]
    - [42, 43.127]
  - - [34688, 2048, 1, 128]
    - [30, 44.433]
  - - [42752, 26753, 1, 128]
    - [14, 45.655]
  - - [34304, 4096, 1, 128]
    - [42, 46.126]
  - - [36480, 20481, 1, 128]
    - [38, 45.313]
  - - [33408, 128, 1, 128]
    - [30, 28.689]
  - - [38784, 4096, 1, 128]
    - [25, 45.248]
  - - [43264, 27393, 1, 128]
    - [28, 45.698]
  - - [34560, 128, 1, 128]
    - [25, 29.604]
  - - [30336, 4096, 1, 128]
    - [42, 45.255]
  - - [29056, 2048, 1, 128]
    - [26, 43.507]
  - - [34816, 512, 1, 128]
    - [15, 42.118]
  - - [38272, 2048, 1, 128]
    - [69, 36.638]
  - - [39808, 23937, 1, 128]
    - [44, 43.271]
  - - [30848, 512, 1, 128]
    - [25, 40.458]
  - - [40448, 512, 1, 128]
    - [15, 41.853]
  - - [40448, 24577, 1, 128]
    - [44, 45.618]
  - - [44544, 28545, 1, 128]
    - [38, 45.737]
  - - [30208, 14209, 1, 128]
    - [21, 46.282]
  - - [34688, 18689, 1, 128]
    - [19, 45.523]
  - - [31360, 512, 1, 128]
    - [19, 40.429]
  - - [38912, 512, 1, 128]
    - [25, 41.394]
  - - [39680, 1024, 1, 128]
    - [25, 42.937]
  - - [34048, 1024, 1, 128]
    - [25, 43.28]
  - - [39552, 4096, 1, 128]
    - [28, 45.488]
  - - [40320, 24321, 1, 128]
    - [14, 45.408]
  - - [40832, 24833, 1, 128]
    - [28, 45.035]
  - - [36736, 1024, 1, 128]
    - [26, 42.751]
  - - [44672, 1024, 1, 128]
    - [15, 43.451]
  - - [32000, 128, 1, 128]
    - [30, 27.968]
  - - [40704, 4096, 1, 128]
    - [19, 45.772]
  - - [38144, 1024, 1, 128]
    - [19, 43.025]
  - - [30720, 14849, 1, 128]
    - [28, 46.757]
  - - [38144, 8192, 1, 128]
    - [17, 46.834]
  - - [30208, 1024, 1, 128]
    - [26, 42.874]
  - - [43136, 1024, 1, 128]
    - [25, 42.913]
  - - [38528, 1024, 1, 128]
    - [27, 42.892]
  - - [43264, 2048, 1, 128]
    - [27, 44.133]
  - - [38400, 22529, 1, 128]
    - [44, 45.897]
  - - [37120, 128, 1, 128]
    - [22, 31.012]
  - - [32256, 128, 1, 128]
    - [27, 28.12]
  - - [29952, 13953, 1, 128]
    - [17, 45.983]
  - - [34560, 8192, 1, 128]
    - [19, 46.641]
  - - [37504, 21505, 1, 128]
    - [21, 44.546]
  - - [33536, 128, 1, 128]
    - [26, 28.894]
  - - [41856, 2048, 1, 128]
    - [15, 44.478]
  - - [32896, 4096, 1, 128]
    - [51, 43.557]
  - - [41856, 8192, 1, 128]
    - [17, 46.566]
  - - [29440, 4096, 1, 128]
    - [28, 45.779]
  - - [33664, 8192, 1, 128]
    - [16, 46.232]
  - - [36992, 512, 1, 128]
    - [29, 39.86]
  - - [33280, 512, 1, 128]
    - [22, 40.592]
  - - [41728, 128, 1, 128]
    - [42, 33.563]
  - - [31744, 128, 1, 128]
    - [25, 27.614]
  - - [31360, 1024, 1, 128]
    - [15, 42.98]
  - - [29952, 8192, 1, 128]
    - [21, 46.599]
  - - [38016, 2048, 1, 128]
    - [30, 44.223]
  - - [34176, 8192, 1, 128]
    - [16, 46.412]
  - - [30464, 512, 1, 128]
    - [15, 39.585]
  - - [41984, 2048, 1, 128]
    - [43, 44.722]
  - - [40448, 4096, 1, 128]
    - [21, 46.116]
  - - [33920, 4096, 1, 128]
    - [19, 45.581]
  - - [41088, 8192, 1, 128]
    - [43, 45.778]
  - - [39808, 8192, 1, 128]
    - [14, 44.228]
  - - [40832, 4096, 1, 128]
    - [17, 45.606]
  - - [30592, 2048, 1, 128]
    - [15, 43.833]
  - - [36352, 1024, 1, 128]
    - [30, 43.102]
  - - [30336, 2048, 1, 128]
    - [30, 43.833]
  - - [30976, 512, 1, 128]
    - [30, 40.197]
  - - [42368, 1024, 1, 128]
    - [30, 43.084]
  - - [29056, 1024, 1, 128]
    - [30, 42.348]
  - - [38784, 22913, 1, 128]
    - [14, 45.544]
  - - [28928, 512, 1, 128]
    - [25, 39.211]
  - - [40576, 512, 1, 128]
    - [19, 41.519]
  - - [34816, 4096, 1, 128]
    - [19, 46.696]
  - - [41600, 2048, 1, 128]
    - [14, 43.878]
  - - [29696, 8192, 1, 128]
    - [17, 47.304]
  - - [41856, 4096, 1, 128]
    - [19, 45.762]
  - - [35584, 2048, 1, 128]
    - [30, 44.122]
  - - [30848, 14849, 1, 128]
    - [17, 45.765]
  - - [33280, 17281, 1, 128]
    - [16, 46.514]
  - - [43776, 2048, 1, 128]
    - [15, 43.542]
  - - [42112, 8192, 1, 128]
    - [17, 46.462]
  - - [37376, 128, 1, 128]
    - [30, 31.226]
  - - [41600, 4096, 1, 128]
    - [28, 45.603]
  - - [36224, 20353, 1, 128]
    - [28, 45.672]
  - - [29952, 1024, 1, 128]
    - [26, 42.84]
  - - [34176, 1024, 1, 128]
    - [25, 42.871]
  - - [31744, 512, 1, 128]
    - [15, 40.693]
  - - [42624, 8192, 1, 128]
    - [19, 41.712]
  - - [41216, 128, 1, 128]
    - [34, 33.152]
  - - [42624, 26753, 1, 128]
    - [53, 40.481]
  - - [32512, 2048, 1, 128]
    - [34, 44.312]
  - - [40064, 4096, 1, 128]
    - [14, 45.152]
  - - [32640, 4096, 1, 128]
    - [19, 45.254]
  - - [42112, 26241, 1, 128]
    - [14, 45.551]
  - - [32256, 512, 1, 128]
    - [22, 40.905]
  - - [40960, 1024, 1, 128]
    - [19, 40.673]
  - - [35968, 128, 1, 128]
    - [30, 30.387]
  - - [32384, 8192, 1, 128]
    - [19, 46.529]
  - - [42880, 512, 1, 128]
    - [25, 40.788]
  - - [33024, 8192, 1, 128]
    - [19, 47.007]
  - - [43904, 1024, 1, 128]
    - [30, 42.98]
  - - [33664, 17665, 1, 128]
    - [28, 45.702]
  - - [41856, 512, 1, 128]
    - [34, 42.279]
  - - [40704, 128, 1, 128]
    - [24, 33.254]
  - - [33408, 17537, 1, 128]
    - [28, 45.966]
  - - [37120, 512, 1, 128]
    - [15, 40.735]
  - - [41216, 25345, 1, 128]
    - [44, 45.806]
  - - [39680, 8192, 1, 128]
    - [17, 46.567]
  - - [40192, 24193, 1, 128]
    - [28, 45.525]
  - - [33024, 17153, 1, 128]
    - [14, 46.343]
  - - [38272, 1024, 1, 128]
    - [21, 38.221]
  - - [35328, 1024, 1, 128]
    - [26, 43.01]
  - - [31104, 8192, 1, 128]
    - [19, 46.434]
  - - [40320, 8192, 1, 128]
    - [17, 46.483]
  - - [29312, 2048, 1, 128]
    - [27, 43.896]
  - - [36608, 20737, 1, 128]
    - [14, 45.83]
  - - [42240, 4096, 1, 128]
    - [17, 45.827]
  - - [43520, 2048, 1, 128]
    - [24, 44.598]
  - - [29056, 512, 1, 128]
    - [15, 39.186]
  - - [35328, 19329, 1, 128]
    - [38, 46.24]
  - - [30464, 128, 1, 128]
    - [15, 26.971]
  - - [29696, 13697, 1, 128]
    - [19, 46.562]
  - - [43904, 28033, 1, 128]
    - [19, 45.375]
  - - [35584, 19713, 1, 128]
    - [14, 45.7]
  - - [41088, 4096, 1, 128]
    - [27, 45.105]
  - - [42368, 2048, 1, 128]
    - [27, 44.078]
  - - [36736, 128, 1, 128]
    - [26, 30.789]
  - - [30336, 8192, 1, 128]
    - [26, 46.227]
  - - [43008, 128, 1, 128]
    - [25, 31.442]
  - - [37120, 1024, 1, 128]
    - [30, 42.986]
  - - [31104, 2048, 1, 128]
    - [15, 44.22]
  - - [33152, 4096, 1, 128]
    - [25, 45.818]
  - - [43392, 27521, 1, 128]
    - [28, 45.358]
  - - [37248, 21249, 1, 128]
    - [28, 45.316]
  - - [33920, 17921, 1, 128]
    - [28, 45.594]
  - - [39680, 4096, 1, 128]
    - [17, 45.776]
  - - [43264, 512, 1, 128]
    - [25, 40.916]
  - - [35712, 8192, 1, 128]
    - [17, 46.366]
  - - [31616, 2048, 1, 128]
    - [28, 43.609]
  - - [35328, 512, 1, 128]
    - [25, 40.342]
  - - [43136, 27265, 1, 128]
    - [14, 45.393]
  - - [30208, 128, 1, 128]
    - [15, 26.654]
  - - [40320, 24449, 1, 128]
    - [28, 45.352]
  - - [44288, 2048, 1, 128]
    - [27, 44.467]
  - - [35072, 1024, 1, 128]
    - [19, 43.152]
  - - [30464, 14465, 1, 128]
    - [51, 43.511]
  - - [44160, 8192, 1, 128]
    - [17, 46.21]
  - - [33792, 17793, 1, 128]
    - [19, 46.448]
  - - [37632, 1024, 1, 128]
    - [25, 43.181]
  - - [35968, 2048, 1, 128]
    - [15, 44.208]
  - - [38400, 8192, 1, 128]
    - [21, 46.925]
  - - [32512, 4096, 1, 128]
    - [19, 45.842]
  - - [32512, 16641, 1, 128]
    - [21, 46.246]
  - - [39424, 128, 1, 128]
    - [22, 32.351]
  - - [30976, 8192, 1, 128]
    - [52, 45.168]
  - - [35968, 20097, 1, 128]
    - [17, 45.717]
  - - [38656, 512, 1, 128]
    - [27, 40.966]
  - - [34944, 18945, 1, 128]
    - [19, 45.624]
  - - [33664, 17793, 1, 128]
    - [14, 45.754]
  - - [38656, 22657, 1, 128]
    - [38, 45.798]
  - - [34944, 1024, 1, 128]
    - [25, 43.102]
  - - [31872, 16001, 1, 128]
    - [28, 45.704]
  - - [43392, 8192, 1, 128]
    - [17, 46.144]
  - - [38016, 512, 1, 128]
    - [30, 40.69]
  - - [29440, 8192, 1, 128]
    - [14, 46.686]
  - - [35200, 1024, 1, 128]
    - [30, 42.748]
  - - [34304, 18433, 1, 128]
    - [38, 46.162]
  - - [44672, 28801, 1, 128]
    - [28, 45.545]
  - - [29184, 4096, 1, 128]
    - [22, 45.73]
  - - [33408, 8192, 1, 128]
    - [19, 46.532]
  - - [39040, 128, 1, 128]
    - [29, 31.994]
  - - [39680, 23681, 1, 128]
    - [28, 45.518]
  - - [38144, 4096, 1, 128]
    - [17, 45.883]
  - - [42368, 26497, 1, 128]
    - [21, 45.346]
  - - [42368, 4096, 1, 128]
    - [42, 45.365]
  - - [31872, 128, 1, 128]
    - [30, 27.758]
  - - [41984, 512, 1, 128]
    - [34, 42.307]
  - - [39296, 2048, 1, 128]
    - [28, 43.934]
  - - [33920, 2048, 1, 128]
    - [27, 44.095]
  - - [36736, 20865, 1, 128]
    - [14, 45.681]
  - - [34432, 8192, 1, 128]
    - [21, 44.91]
  - - [30848, 14977, 1, 128]
    - [17, 45.811]
  - - [31744, 15873, 1, 128]
    - [19, 46.488]
  - - [42880, 27009, 1, 128]
    - [44, 44.895]
  - - [42240, 26241, 1, 128]
    - [28, 45.662]
  - - [38400, 4096, 1, 128]
    - [17, 45.966]
  - - [42624, 26625, 1, 128]
    - [19, 40.471]
  - - [35072, 4096, 1, 128]
    - [17, 45.875]
  - - [40576, 4096, 1, 128]
    - [17, 45.622]
  - - [39296, 8192, 1, 128]
    - [19, 46.525]
  - - [42624, 512, 1, 128]
    - [43, 40.003]
  - - [32768, 8192, 1, 128]
    - [17, 35.565]
  - - [36864, 1024, 1, 128]
    - [26, 42.756]
  - - [43392, 128, 1, 128]
    - [42, 31.053]
  - - [41344, 2048, 1, 128]
    - [30, 44.187]
  - - [35584, 4096, 1, 128]
    - [19, 45.526]
  - - [40064, 2048, 1, 128]
    - [14, 42.994]
  - - [40576, 24705, 1, 128]
    - [28, 45.497]
  - - [39808, 1024, 1, 128]
    - [19, 42.27]
  - - [36992, 1024, 1, 128]
    - [29, 42.438]
  - - [42496, 1024, 1, 128]
    - [30, 43.847]
  - - [43904, 128, 1, 128]
    - [16, 31.389]
  - - [31232, 512, 1, 128]
    - [26, 40.907]
  - - [42112, 128, 1, 128]
    - [30, 33.659]
  - - [37376, 2048, 1, 128]
    - [27, 44.486]
  - - [38016, 128, 1, 128]
    - [15, 31.37]
  - - [42368, 8192, 1, 128]
    - [21, 46.148]
  - - [43392, 512, 1, 128]
    - [15, 41.032]
  - - [41984, 1024, 1, 128]
    - [27, 43.616]
  - - [42240, 2048, 1, 128]
    - [34, 44.379]
  - - [29952, 128, 1, 128]
    - [15, 26.55]
  - - [36608, 8192, 1, 128]
    - [28, 46.612]
  - - [32512, 16513, 1, 128]
    - [44, 46.298]
  - - [29568, 512, 1, 128]
    - [22, 38.598]
  - - [34304, 1024, 1, 128]
    - [22, 43.493]
  - - [41984, 4096, 1, 128]
    - [17, 46.4]
  - - [30464, 4096, 1, 128]
    - [52, 43.433]
  - - [41216, 2048, 1, 128]
    - [27, 44.506]
  - - [36480, 20609, 1, 128]
    - [28, 45.594]
  - - [44800, 4096, 1, 128]
    - [19, 45.493]
  - - [36864, 512, 1, 128]
    - [15, 40.566]
  - - [39680, 2048, 1, 128]
    - [19, 43.919]
  - - [43648, 4096, 1, 128]
    - [17, 45.327]
  - - [33664, 128, 1, 128]
    - [15, 29.078]
  - - [41600, 512, 1, 128]
    - [51, 42.222]
  - - [43776, 1024, 1, 128]
    - [30, 41.689]
  - - [37632, 512, 1, 128]
    - [26, 40.728]
  - - [44160, 128, 1, 128]
    - [29, 31.541]
  - - [37248, 8192, 1, 128]
    - [17, 46.313]
  - - [34816, 18817, 1, 128]
    - [19, 46.801]
  - - [38528, 22529, 1, 128]
    - [28, 45.314]
  - - [40192, 24321, 1, 128]
    - [28, 45.492]
  - - [40832, 128, 1, 128]
    - [42, 32.914]
  - - [29312, 8192, 1, 128]
    - [19, 46.211]
  - - [43776, 27777, 1, 128]
    - [43, 43.983]
  - - [37632, 21633, 1, 128]
    - [28, 45.804]
  - - [33792, 4096, 1, 128]
    - [17, 46.375]
  - - [35968, 1024, 1, 128]
    - [15, 43.0]
  - - [37888, 512, 1, 128]
    - [25, 41.05]
  - - [35968, 512, 1, 128]
    - [25, 40.217]
  - - [30592, 1024, 1, 128]
    - [34, 42.842]
  - - [38400, 512, 1, 128]
    - [29, 40.674]
  - - [43264, 1024, 1, 128]
    - [17, 43.316]
  - - [38528, 4096, 1, 128]
    - [26, 45.377]
  - - [28928, 1024, 1, 128]
    - [26, 42.433]
  - - [33152, 1024, 1, 128]
    - [15, 42.341]
  - - [41344, 1024, 1, 128]
    - [30, 43.141]
  - - [30848, 8192, 1, 128]
    - [17, 46.564]
  - - [41344, 4096, 1, 128]
    - [19, 45.428]
  - - [38912, 2048, 1, 128]
    - [19, 44.728]
  - - [38272, 128, 1, 128]
    - [60, 31.539]
  - - [31488, 4096, 1, 128]
    - [17, 45.665]
  - - [44416, 4096, 1, 128]
    - [17, 45.725]
  - - [39552, 2048, 1, 128]
    - [30, 44.397]
  - - [37760, 1024, 1, 128]
    - [30, 43.235]
  - - [34304, 18305, 1, 128]
    - [38, 46.325]
  - - [44544, 28673, 1, 128]
    - [44, 45.502]
  - - [44416, 8192, 1, 128]
    - [17, 46.505]
  - - [38144, 512, 1, 128]
    - [19, 40.804]
  - - [30208, 14337, 1, 128]
    - [16, 46.144]
  - - [38144, 2048, 1, 128]
    - [17, 44.289]
  - - [40448, 128, 1, 128]
    - [54, 33.044]
  - - [42240, 8192, 1, 128]
    - [17, 46.544]
  - - [39424, 2048, 1, 128]
    - [27, 44.584]
  - - [41088, 512, 1, 128]
    - [22, 39.121]
  - - [36224, 2048, 1, 128]
    - [15, 43.974]
  - - [31744, 4096, 1, 128]
    - [19, 46.397]
  - - [44160, 512, 1, 128]
    - [26, 40.882]
  - - [32000, 1024, 1, 128]
    - [25, 42.737]
  - - [42752, 1024, 1, 128]
    - [30, 43.363]
  - - [42496, 2048, 1, 128]
    - [29, 44.786]
  - - [32640, 2048, 1, 128]
    - [17, 43.065]
  - - [42752, 26881, 1, 128]
    - [28, 45.625]
  - - [32256, 8192, 1, 128]
    - [21, 47.12]
  - - [44800, 512, 1, 128]
    - [17, 41.246]
  - - [34816, 128, 1, 128]
    - [30, 29.795]
  - - [38272, 8192, 1, 128]
    - [43, 42.399]
  - - [44800, 28929, 1, 128]
    - [14, 45.322]
  - - [37120, 8192, 1, 128]
    - [14, 46.547]
  - - [43776, 512, 1, 128]
    - [24, 37.791]
  - - [43008, 1024, 1, 128]
    - [26, 43.999]
  - - [34432, 18561, 1, 128]
    - [51, 44.536]
  - - [36736, 4096, 1, 128]
    - [19, 45.56]
  - - [36224, 512, 1, 128]
    - [30, 40.29]
  - - [32768, 512, 1, 128]
    - [27, 36.086]
  - - [30592, 128, 1, 128]
    - [30, 26.897]
  - - [43008, 27137, 1, 128]
    - [14, 46.575]
  - - [34048, 18177, 1, 128]
    - [44, 45.732]
  - - [43136, 2048, 1, 128]
    - [17, 43.944]
  - - [29184, 13313, 1, 128]
    - [14, 45.766]
  - - [40064, 24193, 1, 128]
    - [44, 44.519]
  - - [40960, 128, 1, 128]
    - [34, 32.703]
  - - [29184, 2048, 1, 128]
    - [29, 44.175]
  - - [37248, 128, 1, 128]
    - [25, 31.154]
  - - [35328, 128, 1, 128]
    - [25, 30.192]
  - - [43264, 128, 1, 128]
    - [22, 31.142]
  - - [29952, 4096, 1, 128]
    - [22, 45.58]
  - - [36736, 20737, 1, 128]
    - [28, 45.629]
  - - [34176, 4096, 1, 128]
    - [22, 45.382]
  - - [32768, 1024, 1, 128]
    - [17, 36.303]
  - - [44160, 4096, 1, 128]
    - [17, 45.544]
  - - [31104, 1024, 1, 128]
    - [26, 43.24]
  - - [33792, 512, 1, 128]
    - [15, 41.448]
  - - [41216, 25217, 1, 128]
    - [44, 45.833]
  - - [31872, 1024, 1, 128]
    - [17, 42.624]
  - - [38528, 8192, 1, 128]
    - [16, 46.201]
  - - [44672, 4096, 1, 128]
    - [19, 45.698]
  - - [32512, 1024, 1, 128]
    - [15, 42.329]
  - - [39168, 8192, 1, 128]
    - [44, 46.6]
  - - [31360, 15361, 1, 128]
    - [28, 45.526]
  - - [38016, 22145, 1, 128]
    - [28, 45.578]
  - - [35712, 128, 1, 128]
    - [25, 30.005]
  - - [30208, 4096, 1, 128]
    - [42, 45.872]
  - - [33920, 128, 1, 128]
    - [26, 29.163]
  - - [30336, 128, 1, 128]
    - [30, 26.666]
  - - [42368, 128, 1, 128]
    - [18, 30.858]
  - - [38912, 4096, 1, 128]
    - [17, 46.69]
  - - [34176, 512, 1, 128]
    - [17, 41.65]
  - - [42752, 8192, 1, 128]
    - [19, 46.612]
  - - [31488, 1024, 1, 128]
    - [25, 43.165]
  - - [36608, 1024, 1, 128]
    - [15, 42.897]
  - - [41856, 128, 1, 128]
    - [30, 33.455]
  - - [29312, 13441, 1, 128]
    - [17, 45.652]
  - - [43520, 128, 1, 128]
    - [27, 31.296]
  - - [31616, 8192, 1, 128]
    - [17, 45.923]
  - - [40448, 2048, 1, 128]
    - [24, 44.652]
  - - [35328, 2048, 1, 128]
    - [34, 44.595]
  - - [36864, 20865, 1, 128]
    - [28, 46.566]
  - - [32000, 2048, 1, 128]
    - [19, 44.031]
  - - [34176, 18177, 1, 128]
    - [44, 45.62]
  - - [37504, 128, 1, 128]
    - [30, 31.255]
  - - [33792, 1024, 1, 128]
    - [26, 43.346]
  - - [31872, 8192, 1, 128]
    - [17, 46.308]
  - - [40704, 512, 1, 128]
    - [25, 41.912]
  - - [37632, 128, 1, 128]
    - [25, 31.221]
  - - [32640, 1024, 1, 128]
    - [17, 41.437]
  - - [44544, 8192, 1, 128]
    - [14, 46.449]
  - - [39424, 8192, 1, 128]
    - [17, 46.96]
  - - [39296, 512, 1, 128]
    - [25, 41.084]
  - - [35840, 128, 1, 128]
    - [19, 30.25]
  - - [39168, 1024, 1, 128]
    - [26, 43.49]
  - - [35712, 19841, 1, 128]
    - [28, 45.634]
  - - [29568, 13569, 1, 128]
    - [14, 45.271]
  - - [34944, 4096, 1, 128]
    - [19, 45.826]
  - - [32768, 2048, 1, 128]
    - [19, 34.701]
  - - [39296, 128, 1, 128]
    - [19, 32.103]
  - - [29568, 4096, 1, 128]
    - [43, 44.664]
  - - [39040, 1024, 1, 128]
    - [27, 43.154]
  - - [37376, 1024, 1, 128]
    - [25, 43.367]
  - - [33536, 2048, 1, 128]
    - [17, 44.356]
  - - [31488, 8192, 1, 128]
    - [19, 46.506]
  - - [37888, 1024, 1, 128]
    - [30, 43.644]
  - - [41472, 4096, 1, 128]
    - [21, 45.992]
  - - [30592, 512, 1, 128]
    - [25, 40.13]
  - - [34560, 18561, 1, 128]
    - [19, 45.867]
  - - [29184, 512, 1, 128]
    - [25, 39.349]
  - - [32256, 16257, 1, 128]
    - [16, 46.612]
  - - [43392, 27393, 1, 128]
    - [28, 45.405]
  - - [29312, 4096, 1, 128]
    - [26, 45.362]
  - - [43648, 2048, 1, 128]
    - [19, 43.517]
  - - [44288, 1024, 1, 128]
    - [15, 43.32]
  - - [35456, 128, 1, 128]
    - [42, 30.098]
  - - [44160, 28289, 1, 128]
    - [17, 45.17]
  - - [40320, 1024, 1, 128]
    - [30, 43.195]
  - - [37888, 22017, 1, 128]
    - [28, 46.388]
  - - [29696, 512, 1, 128]
    - [25, 39.605]
  - - [35840, 2048, 1, 128]
    - [34, 44.646]
  - - [37504, 2048, 1, 128]
    - [30, 43.735]
  - - [41728, 4096, 1, 128]
    - [42, 45.048]
  - - [42752, 4096, 1, 128]
    - [17, 45.734]
  - - [29824, 4096, 1, 128]
    - [43, 44.859]
  - - [44800, 1024, 1, 128]
    - [26, 43.392]
  - - [30592, 4096, 1, 128]
    - [17, 45.582]
  - - [43904, 4096, 1, 128]
    - [19, 45.454]
  - - [39552, 8192, 1, 128]
    - [28, 46.1]
  - - [37632, 2048, 1, 128]
    - [15, 44.242]
  - - [29312, 128, 1, 128]
    - [15, 25.614]
  - - [30080, 512, 1, 128]
    - [29, 39.423]
  - - [33664, 2048, 1, 128]
    - [34, 44.161]
  - - [43520, 27521, 1, 128]
    - [44, 46.018]
  - - [36224, 128, 1, 128]
    - [25, 30.533]
  - - [28928, 12929, 1, 128]
    - [17, 45.873]
  - - [29440, 1024, 1, 128]
    - [26, 42.53]
  - - [35840, 19969, 1, 128]
    - [28, 46.357]
  - - [42880, 4096, 1, 128]
    - [22, 44.933]
  - - [42496, 8192, 1, 128]
    - [17, 46.936]
  - - [39936, 24065, 1, 128]
    - [28, 46.243]
  - - [33408, 1024, 1, 128]
    - [17, 42.705]
  - - [32256, 2048, 1, 128]
    - [27, 44.555]
  - - [35712, 19713, 1, 128]
    - [28, 45.682]
  - - [40192, 4096, 1, 128]
    - [17, 45.816]
  - - [32000, 16129, 1, 128]
    - [19, 46.012]
  - - [44032, 512, 1, 128]
    - [15, 41.391]
  - - [35584, 128, 1, 128]
    - [30, 30.103]
  - - [35584, 8192, 1, 128]
    - [19, 46.454]
  - - [37888, 21889, 1, 128]
    - [28, 46.38]
  - - [37504, 1024, 1, 128]
    - [42, 42.416]
  - - [33664, 512, 1, 128]
    - [15, 41.523]
  - - [32384, 1024, 1, 128]
    - [68, 42.482]
  - - [38400, 1024, 1, 128]
    - [29, 43.355]
  - - [35200, 128, 1, 128]
    - [30, 29.841]
  - - [43648, 1024, 1, 128]
    - [26, 42.242]
  - - [36608, 128, 1, 128]
    - [15, 30.717]
  - - [32768, 128, 1, 128]
    - [30, 28.982]
  - - [28928, 4096, 1, 128]
    - [19, 45.55]
  - - [35200, 19329, 1, 128]
    - [14, 45.615]
  - - [41216, 8192, 1, 128]
    - [17, 46.646]
  - - [36864, 8192, 1, 128]
    - [19, 47.323]
  - - [40064, 128, 1, 128]
    - [22, 32.473]
  - - [42624, 1024, 1, 128]
    - [17, 41.156]
  - - [34688, 128, 1, 128]
    - [25, 29.748]
  - - [43648, 27777, 1, 128]
    - [14, 44.988]
  - - [37888, 8192, 1, 128]
    - [17, 47.162]
  - - [41472, 25601, 1, 128]
    - [44, 45.782]
  - - [38272, 512, 1, 128]
    - [19, 37.579]
  - - [35456, 4096, 1, 128]
    - [26, 45.661]
  - - [42496, 26625, 1, 128]
    - [38, 45.874]
  - - [43136, 4096, 1, 128]
    - [17, 45.517]
  - - [44800, 8192, 1, 128]
    - [19, 46.255]
  - - [36480, 8192, 1, 128]
    - [19, 46.305]
  - - [37504, 4096, 1, 128]
    - [30, 44.983]
  - - [39040, 8192, 1, 128]
    - [19, 46.156]
  - - [31104, 512, 1, 128]
    - [15, 40.757]
  - - [34176, 2048, 1, 128]
    - [30, 44.049]
  - - [31616, 512, 1, 128]
    - [30, 40.723]
  - - [35456, 2048, 1, 128]
    - [15, 44.265]
  - - [43136, 8192, 1, 128]
    - [17, 46.264]
  - - [33024, 128, 1, 128]
    - [15, 28.36]
  - - [38656, 4096, 1, 128]
    - [21, 45.653]
  - - [33408, 17409, 1, 128]
    - [28, 45.715]
  - - [39424, 1024, 1, 128]
    - [29, 43.586]
  - - [29312, 13313, 1, 128]
    - [19, 45.515]
  - - [35840, 4096, 1, 128]
    - [19, 46.364]
  - - [42496, 512, 1, 128]
    - [26, 41.174]
  - - [37632, 8192, 1, 128]
    - [17, 46.625]
  - - [41088, 2048, 1, 128]
    - [27, 43.811]
  - - [38528, 512, 1, 128]
    - [17, 40.582]
  - - [35072, 2048, 1, 128]
    - [34, 44.333]
  - - [31104, 4096, 1, 128]
    - [28, 45.51]
  - - [33280, 4096, 1, 128]
    - [42, 46.23]
  - - [43904, 8192, 1, 128]
    - [17, 46.33]
  - - [34816, 8192, 1, 128]
    - [19, 47.493]
  - - [38016, 1024, 1, 128]
    - [25, 43.185]
  - - [33152, 128, 1, 128]
    - [42, 28.403]
  - - [42496, 128, 1, 128]
    - [32, 31.099]
  - - [40832, 24961, 1, 128]
    - [28, 45.111]
  - - [41728, 1024, 1, 128]
    - [42, 42.868]
  - - [41472, 25473, 1, 128]
    - [38, 46.035]
  - - [34560, 2048, 1, 128]
    - [30, 44.545]
  - - [31616, 15617, 1, 128]
    - [14, 45.318]
  - - [33664, 4096, 1, 128]
    - [28, 45.445]
  - - [35328, 8192, 1, 128]
    - [21, 47.021]
  - - [39808, 4096, 1, 128]
    - [17, 43.349]
  - - [37248, 512, 1, 128]
    - [30, 40.754]
  - - [31360, 4096, 1, 128]
    - [19, 45.616]
  - - [41344, 8192, 1, 128]
    - [17, 46.237]
  - - [32000, 512, 1, 128]
    - [26, 40.442]
  - - [35968, 19969, 1, 128]
    - [19, 45.615]
  - - [30080, 14081, 1, 128]
    - [16, 43.41]
  - - [35840, 8192, 1, 128]
    - [17, 47.132]
  - - [44672, 2048, 1, 128]
    - [30, 44.597]
  - - [31872, 2048, 1, 128]
    - [17, 43.727]
  - - [42496, 4096, 1, 128]
    - [14, 46.1]
  - - [43776, 128, 1, 128]
    - [27, 31.207]
  - - [40704, 2048, 1, 128]
    - [34, 44.366]
  - - [34432, 128, 1, 128]
    - [26, 29.398]
  - - [44544, 2048, 1, 128]
    - [24, 44.537]
  - - [32384, 16385, 1, 128]
    - [17, 45.9]
  - - [43776, 27905, 1, 128]
    - [43, 44.016]
  - - [44032, 4096, 1, 128]
    - [17, 46.373]
  - - [36480, 512, 1, 128]
    - [29, 40.173]
  - - [44160, 1024, 1, 128]
    - [30, 43.268]
  - - [41216, 4096, 1, 128]
    - [17, 45.814]
  - - [44032, 2048, 1, 128]
    - [27, 44.796]
  - - [33152, 2048, 1, 128]
    - [30, 44.512]
  - - [41984, 25985, 1, 128]
    - [28, 46.352]
  - - [39552, 512, 1, 128]
    - [26, 41.308]
  - - [41344, 25473, 1, 128]
    - [19, 45.432]
  - - [40960, 4096, 1, 128]
    - [14, 41.231]
  - - [32640, 128, 1, 128]
    - [15, 28.095]
  - - [35968, 4096, 1, 128]
    - [26, 45.611]
  - - [33536, 4096, 1, 128]
    - [19, 45.86]
  - - [30976, 15105, 1, 128]
    - [52, 44.642]
  - - [35072, 8192, 1, 128]
    - [19, 46.675]
  - - [39424, 23425, 1, 128]
    - [44, 45.929]
  - - [43520, 1024, 1, 128]
    - [24, 43.744]
  - - [44288, 28417, 1, 128]
    - [38, 45.373]
  - - [30848, 128, 1, 128]
    - [30, 27.219]
  - - [35712, 512, 1, 128]
    - [19, 40.09]
  - - [44160, 2048, 1, 128]
    - [34, 44.248]
  - - [34048, 8192, 1, 128]
    - [44, 46.442]
  - - [40448, 24449, 1, 128]
    - [38, 46.019]
  - - [39168, 23297, 1, 128]
    - [38, 45.842]
  - - [32128, 1024, 1, 128]
    - [15, 42.82]
  - - [36864, 20993, 1, 128]
    - [28, 46.547]
  - - [40064, 1024, 1, 128]
    - [17, 42.512]
  - - [38784, 8192, 1, 128]
    - [17, 46.238]
  - - [37248, 2048, 1, 128]
    - [17, 43.739]
  - - [34560, 4096, 1, 128]
    - [19, 45.799]
  - - [39040, 23041, 1, 128]
    - [14, 45.415]
  - - [36480, 1024, 1, 128]
    - [15, 42.697]
  - - [39040, 2048, 1, 128]
    - [34, 44.221]
  - - [39808, 23809, 1, 128]
    - [44, 43.154]
  - - [36992, 4096, 1, 128]
    - [17, 45.424]
  - - [32768, 16897, 1, 128]
    - [17, 34.596]
  - - [30976, 2048, 1, 128]
    - [22, 42.926]
  - - [32640, 16769, 1, 128]
    - [19, 45.395]
  - - [29824, 13953, 1, 128]
    - [44, 45.133]
  - - [29184, 128, 1, 128]
    - [30, 25.776]
  - - [30720, 8192, 1, 128]
    - [19, 47.523]
  - - [30848, 2048, 1, 128]
    - [30, 43.898]
  - - [38016, 4096, 1, 128]
    - [14, 45.516]
  - - [35456, 8192, 1, 128]
    - [19, 46.552]
  - - [36992, 21121, 1, 128]
    - [14, 45.411]
  - - [36736, 2048, 1, 128]
    - [34, 44.039]
  - - [37888, 128, 1, 128]
    - [15, 31.44]
  - - [39808, 2048, 1, 128]
    - [19, 42.312]
  - - [41856, 25985, 1, 128]
    - [14, 45.662]
  - - [34688, 4096, 1, 128]
    - [26, 45.486]
  - - [38784, 1024, 1, 128]
    - [30, 42.968]
  - - [40960, 25089, 1, 128]
    - [14, 40.357]
  - - [32000, 4096, 1, 128]
    - [17, 45.811]
  - - [41600, 25601, 1, 128]
    - [14, 45.352]
  - - [37504, 512, 1, 128]
    - [22, 40.171]
  - - [32128, 16129, 1, 128]
    - [19, 45.863]
  - - [37248, 21377, 1, 128]
    - [28, 45.342]
  - - [35840, 512, 1, 128]
    - [26, 40.542]
  - - [36096, 128, 1, 128]
    - [27, 30.362]
  - - [32512, 8192, 1, 128]
    - [17, 46.813]
  - - [36736, 8192, 1, 128]
    - [19, 46.469]
  - - [42880, 1024, 1, 128]
    - [29, 43.034]
  - - [44288, 8192, 1, 128]
    - [19, 46.275]
  - - [36224, 1024, 1, 128]
    - [30, 42.95]
  - - [41344, 25345, 1, 128]
    - [19, 45.426]
  - - [32384, 512, 1, 128]
    - [26, 39.622]
  - - [38272, 4096, 1, 128]
    - [43, 41.461]
  - - [37120, 2048, 1, 128]
    - [15, 44.324]
  - - [33152, 8192, 1, 128]
    - [19, 46.687]
  - - [36096, 4096, 1, 128]
    - [52, 44.072]
  - - [34560, 18689, 1, 128]
    - [28, 45.867]
  - - [36864, 4096, 1, 128]
    - [17, 46.428]
  - - [34944, 512, 1, 128]
    - [17, 41.997]
  - - [37760, 128, 1, 128]
    - [25, 31.327]
  - - [31616, 128, 1, 128]
    - [29, 27.502]
  - - [36224, 4096, 1, 128]
    - [17, 45.663]
  - - [40576, 24577, 1, 128]
    - [14, 45.04]
  - - [34688, 1024, 1, 128]
    - [30, 43.274]
  - - [40192, 1024, 1, 128]
    - [15, 43.302]
  - - [44672, 512, 1, 128]
    - [19, 41.103]
  - - [33664, 1024, 1, 128]
    - [25, 43.004]
  - - [39424, 512, 1, 128]
    - [22, 41.0]
  - - [44416, 1024, 1, 128]
    - [30, 43.311]
  - - [33408, 2048, 1, 128]
    - [30, 44.337]
  - - [43648, 8192, 1, 128]
    - [17, 46.058]
  - - [43520, 27649, 1, 128]
    - [44, 45.797]
  - - [40448, 1024, 1, 128]
    - [30, 43.246]
  - - [33152, 17153, 1, 128]
    - [17, 46.124]
  - - [33024, 512, 1, 128]
    - [30, 40.032]
  - - [39680, 128, 1, 128]
    - [22, 32.482]
  - - [29696, 4096, 1, 128]
    - [17, 46.382]
  - - [42112, 2048, 1, 128]
    - [19, 44.11]
  - - [38016, 8192, 1, 128]
    - [17, 46.349]
  - - [30464, 8192, 1, 128]
    - [54, 44.92]
  - - [43648, 128, 1, 128]
    - [34, 31.115]
  - - [32896, 16897, 1, 128]
    - [51, 44.774]
  - - [43008, 8192, 1, 128]
    - [19, 47.387]
  - - [34304, 512, 1, 128]
    - [24, 41.954]
  - - [38528, 128, 1, 128]
    - [30, 31.686]
  - - [41216, 1024, 1, 128]
    - [29, 43.046]
  - - [38272, 22401, 1, 128]
    - [51, 40.701]
  - - [34048, 4096, 1, 128]
    - [26, 45.503]
  - - [30720, 512, 1, 128]
    - [15, 40.496]
  - - [41728, 512, 1, 128]
    - [19, 42.02]
  - - [43136, 512, 1, 128]
    - [15, 40.856]
  - - [41088, 1024, 1, 128]
    - [60, 42.006]
  - - [33536, 1024, 1, 128]
    - [19, 43.074]
  - - [41088, 25089, 1, 128]
    - [51, 44.401]
  - - [36352, 20353, 1, 128]
    - [14, 46.128]
  - - [29184, 1024, 1, 128]
    - [42, 42.608]
  - - [44800, 128, 1, 128]
    - [42, 32.154]
  - - [41600, 8192, 1, 128]
    - [14, 46.389]
  - - [44416, 28545, 1, 128]
    - [14, 45.558]
  - - [34048, 512, 1, 128]
    - [25, 41.814]
  - - [32128, 16257, 1, 128]
    - [17, 45.982]
  - - [44288, 4096, 1, 128]
    - [19, 45.46]
  - - [34432, 18433, 1, 128]
    - [51, 44.145]
  - - [41856, 25857, 1, 128]
    - [14, 45.643]
  - - [32128, 2048, 1, 128]
    - [27, 44.016]
  - - [34688, 512, 1, 128]
    - [30, 41.886]
  - - [39936, 4096, 1, 128]
    - [17, 46.381]
  - - [38656, 1024, 1, 128]
    - [17, 42.922]
  - - [37760, 512, 1, 128]
    - [25, 40.533]
  - - [30336, 512, 1, 128]
    - [26, 40.215]
  - - [38016, 22017, 1, 128]
    - [28, 45.593]
  - - [44544, 4096, 1, 128]
    - [38, 45.793]
  - - [38912, 8192, 1, 128]
    - [19, 47.448]
  - - [39936, 128, 1, 128]
    - [15, 32.476]
  - - [36480, 2048, 1, 128]
    - [30, 44.212]
  - - [35200, 4096, 1, 128]
    - [17, 45.526]
  - - [30976, 14977, 1, 128]
    - [51, 44.608]
  - - [31104, 15105, 1, 128]
    - [19, 45.786]
  - - [40832, 1024, 1, 128]
    - [17, 42.57]
  - - [32384, 16513, 1, 128]
    - [17, 46.085]
  - - [43392, 4096, 1, 128]
    - [28, 45.466]
  - - [32768, 4096, 1, 128]
    - [17, 35.663]
  - - [38272, 22273, 1, 128]
    - [54, 40.665]
  - - [32128, 512, 1, 128]
    - [25, 40.604]
  - - [32896, 2048, 1, 128]
    - [20, 41.278]
  - - [37376, 21505, 1, 128]
    - [17, 45.849]
  - - [41856, 1024, 1, 128]
    - [30, 43.584]
  - - [33536, 8192, 1, 128]
    - [44, 46.748]
  - - [29568, 1024, 1, 128]
    - [27, 41.624]
  - - [44032, 28033, 1, 128]
    - [28, 46.336]
  - - [33280, 8192, 1, 128]
    - [21, 47.149]
  - - [39296, 4096, 1, 128]
    - [17, 45.716]
  - - [30592, 14593, 1, 128]
    - [19, 45.761]
  - - [37504, 8192, 1, 128]
    - [43, 45.639]
  - - [30336, 14465, 1, 128]
    - [19, 45.698]
  - - [29952, 2048, 1, 128]
    - [15, 44.232]
  - - [40832, 512, 1, 128]
    - [34, 40.792]
  - - [44672, 28673, 1, 128]
    - [14, 45.372]
  - - [30080, 4096, 1, 128]
    - [54, 43.362]
  - - [37888, 2048, 1, 128]
    - [43, 44.739]
  - - [37632, 21761, 1, 128]
    - [14, 45.775]
  - - [29824, 8192, 1, 128]
    - [51, 45.814]
  - - [35328, 19457, 1, 128]
    - [44, 46.076]
  - - [37376, 4096, 1, 128]
    - [26, 45.946]
  - - [33792, 17921, 1, 128]
    - [17, 46.337]
  - - [34304, 8192, 1, 128]
    - [16, 47.014]
  - - [42752, 512, 1, 128]
    - [30, 40.648]
  - - [36992, 2048, 1, 128]
    - [29, 43.993]
  - - [39168, 4096, 1, 128]
    - [44, 45.615]
  - - [31360, 15489, 1, 128]
    - [17, 45.835]
  - - [43520, 8192, 1, 128]
    - [17, 46.897]
  - - [30080, 2048, 1, 128]
    - [50, 41.788]
  - - [30720, 4096, 1, 128]
    - [17, 46.713]
  - - [34176, 128, 1, 128]
    - [30, 29.275]
  - - [32768, 16769, 1, 128]
    - [17, 34.684]
  - - [35072, 128, 1, 128]
    - [26, 29.938]
  - - [35712, 4096, 1, 128]
    - [28, 45.542]
  - - [36480, 4096, 1, 128]
    - [17, 45.435]
  - - [39424, 4096, 1, 128]
    - [19, 45.949]
  - - [38400, 128, 1, 128]
    - [17, 31.61]
  - - [34432, 2048, 1, 128]
    - [42, 42.941]
  - - [41344, 512, 1, 128]
    - [26, 41.676]
  - - [35200, 512, 1, 128]
    - [15, 41.728]
  - - [39936, 8192, 1, 128]
    - [19, 47.064]
  - - [31488, 128, 1, 128]
    - [26, 27.718]
  - - [43008, 512, 1, 128]
    - [15, 41.471]
  - - [33024, 4096, 1, 128]
    - [17, 46.064]
  - - [36608, 512, 1, 128]
    - [26, 40.617]
  - - [37376, 8192, 1, 128]
    - [17, 46.86]
  - - [29824, 13825, 1, 128]
    - [38, 45.018]
  - - [36352, 2048, 1, 128]
    - [30, 44.472]
  - - [30336, 1024, 1, 128]
    - [26, 42.605]
  - - [44416, 28417, 1, 128]
    - [28, 45.544]
  - - [38144, 22273, 1, 128]
    - [28, 45.787]
  - - [28928, 2048, 1, 128]
    - [15, 43.673]
  - - [29568, 13697, 1, 128]
    - [28, 45.321]
  - - [43136, 27137, 1, 128]
    - [14, 45.344]
  - - [42112, 4096, 1, 128]
    - [17, 45.686]
  - - [40960, 512, 1, 128]
    - [34, 40.455]
  - - [35584, 1024, 1, 128]
    - [30, 43.056]
  - - [31232, 15361, 1, 128]
    - [17, 45.928]
  - - [40960, 8192, 1, 128]
    - [17, 41.571]
  - - [31232, 1024, 1, 128]
    - [25, 43.531]
  - - [29312, 512, 1, 128]
    - [30, 39.334]
  - - [44416, 512, 1, 128]
    - [26, 41.196]
  - - [42240, 512, 1, 128]
    - [34, 41.921]
  - - [31232, 8192, 1, 128]
    - [19, 46.787]
  - - [35072, 19201, 1, 128]
    - [17, 45.897]
  - - [29568, 128, 1, 128]
    - [26, 26.027]
  - - [33792, 2048, 1, 128]
    - [34, 44.646]
  - - [35712, 2048, 1, 128]
    - [30, 44.276]
  - - [40576, 128, 1, 128]
    - [30, 32.708]
  - - [40704, 1024, 1, 128]
    - [25, 43.238]
  - - [29824, 1024, 1, 128]
    - [22, 42.016]
  - - [33536, 17665, 1, 128]
    - [44, 46.186]
  - - [43008, 27009, 1, 128]
    - [14, 46.557]
  - - [34304, 2048, 1, 128]
    - [29, 44.427]
  - - [37120, 21249, 1, 128]
    - [19, 45.742]
  - - [41600, 1024, 1, 128]
    - [17, 43.256]
  - - [33024, 1024, 1, 128]
    - [25, 42.574]
  - - [42368, 512, 1, 128]
    - [22, 40.466]
  - - [30592, 14721, 1, 128]
    - [28, 45.745]
  - - [29696, 2048, 1, 128]
    - [34, 44.525]
  - - [31232, 128, 1, 128]
    - [30, 27.421]
  - - [38784, 22785, 1, 128]
    - [14, 45.55]
  - - [32896, 1024, 1, 128]
    - [70, 37.593]
  - - [32128, 128, 1, 128]
    - [26, 27.849]
  - - [35968, 8192, 1, 128]
    - [17, 46.444]
  - - [38400, 2048, 1, 128]
    - [41, 44.604]
  - - [36864, 2048, 1, 128]
    - [19, 44.373]
  - - [31616, 4096, 1, 128]
    - [44, 45.071]
  - - [34688, 18817, 1, 128]
    - [14, 45.573]
  - - [42624, 4096, 1, 128]
    - [19, 41.862]
  - - [29312, 1024, 1, 128]
    - [25, 42.221]
  - - [37760, 2048, 1, 128]
    - [27, 44.239]
  - - [39808, 512, 1, 128]
    - [34, 40.895]
  - - [41472, 128, 1, 128]
    - [30, 33.401]
  - - [32128, 4096, 1, 128]
    - [17, 45.8]
  - - [43520, 4096, 1, 128]
    - [19, 46.119]
  - - [41472, 512, 1, 128]
    - [17, 42.267]
  - - [38912, 22913, 1, 128]
    - [28, 46.708]
  - - [30464, 1024, 1, 128]
    - [19, 42.124]
  - - [33280, 128, 1, 128]
    - [30, 28.747]
  - - [31872, 15873, 1, 128]
    - [28, 45.676]
  - - [36352, 4096, 1, 128]
    - [17, 45.942]
  - - [30720, 2048, 1, 128]
    - [17, 44.652]
  - - [33792, 128, 1, 128]
    - [30, 29.019]
  - - [36096, 8192, 1, 128]
    - [42, 45.087]
  - - [38784, 128, 1, 128]
    - [15, 32.111]
  - - [30208, 2048, 1, 128]
    - [29, 44.35]
  - - [34432, 4096, 1, 128]
    - [38, 44.362]
  - - [42880, 128, 1, 128]
    - [22, 30.95]
  - - [31616, 15745, 1, 128]
    - [14, 45.341]
  - - [40960, 2048, 1, 128]
    - [14, 39.906]
  - - [41344, 128, 1, 128]
    - [15, 33.298]
  - - [41728, 25857, 1, 128]
    - [44, 45.145]
  - - [32896, 512, 1, 128]
    - [49, 32.523]
  - - [41728, 2048, 1, 128]
    - [42, 43.251]
  - - [42368, 26369, 1, 128]
    - [16, 45.288]
  - - [30720, 14721, 1, 128]
    - [19, 46.809]
  - - [37376, 512, 1, 128]
    - [30, 41.061]
  - - [35456, 19457, 1, 128]
    - [19, 45.548]
  - - [29184, 13185, 1, 128]
    - [14, 45.997]
  - - [34944, 128, 1, 128]
    - [29, 29.692]
  - - [36608, 20609, 1, 128]
    - [19, 45.82]
  - - [35584, 19585, 1, 128]
    - [28, 45.685]
  - - [42880, 8192, 1, 128]
    - [16, 45.728]
  - - [39936, 1024, 1, 128]
    - [30, 43.517]
  - - [34944, 19073, 1, 128]
    - [19, 45.75]
  - - [32512, 128, 1, 128]
    - [30, 28.309]
  - - [40064, 512, 1, 128]
    - [19, 41.616]
  - - [30464, 2048, 1, 128]
    - [21, 42.134]
  - - [30592, 8192, 1, 128]
    - [19, 46.473]
  - - [39040, 512, 1, 128]
    - [25, 40.947]
  - - [41088, 128, 1, 128]
    - [55, 33.019]
  - - [29824, 128, 1, 128]
    - [15, 26.31]
  - - [32384, 128, 1, 128]
    - [29, 28.038]
  - - [41728, 25729, 1, 128]
    - [38, 45.1]
  - - [30976, 4096, 1, 128]
    - [21, 44.37]
  - - [42624, 128, 1, 128]
    - [55, 30.795]
  - - [42112, 512, 1, 128]
    - [19, 41.873]
  - - [38784, 2048, 1, 128]
    - [15, 44.143]
  - - [35200, 8192, 1, 128]
    - [19, 46.357]
  - - [30976, 128, 1, 128]
    - [26, 26.972]
  - - [32640, 16641, 1, 128]
    - [19, 45.367]
  - - [41984, 8192, 1, 128]
    - [19, 47.088]
  - - [30080, 128, 1, 128]
    - [30, 26.605]
  - - [35584, 512, 1, 128]
    - [24, 39.6]
  - - [44800, 2048, 1, 128]
    - [28, 44.034]
  - - [34048, 128, 1, 128]
    - [30, 29.335]
  - - [35712, 1024, 1, 128]
    - [26, 42.79]
  - - [43136, 128, 1, 128]
    - [24, 31.165]
  - - [33280, 1024, 1, 128]
    - [22, 42.848]
  - - [34816, 18945, 1, 128]
    - [14, 46.764]
  - - [40704, 8192, 1, 128]
    - [17, 46.688]
  - - [34304, 128, 1, 128]
    - [34, 29.487]
  - - [39936, 512, 1, 128]
    - [25, 41.614]
  - - [36096, 2048, 1, 128]
    - [54, 42.932]
  - - [40832, 8192, 1, 128]
    - [19, 46.421]
  - - [37760, 4096, 1, 128]
    - [17, 45.537]
  - - [36736, 512, 1, 128]
    - [25, 40.645]
  - - [31744, 8192, 1, 128]
    - [19, 47.209]
  - - [33920, 1024, 1, 128]
    - [30, 42.96]
  - - [39808, 128, 1, 128]
    - [24, 32.336]
  - - [36608, 2048, 1, 128]
    - [15, 44.236]
  - - [30464, 14593, 1, 128]
    - [54, 42.867]
  - - [35200, 19201, 1, 128]
    - [28, 45.538]
  - - [41472, 1024, 1, 128]
    - [19, 43.428]
  - - [30720, 128, 1, 128]
    - [30, 26.818]
  - - [41600, 128, 1, 128]
    - [42, 33.352]
  - - [38144, 22145, 1, 128]
    - [14, 45.754]
  - - [37120, 4096, 1, 128]
    - [28, 45.686]
  - - [40704, 24705, 1, 128]
    - [14, 45.747]
  - - [41088, 25217, 1, 128]
    - [28, 44.43]
  - - [43776, 8192, 1, 128]
    - [43, 45.549]
  - - [38912, 1024, 1, 128]
    - [25, 43.79]
  - - [43008, 2048, 1, 128]
    - [17, 44.887]
  - - [42496, 26497, 1, 128]
    - [44, 46.082]
  - - [33536, 512, 1, 128]
    - [25, 41.487]
  - - [43520, 512, 1, 128]
    - [26, 41.357]
  - - [39040, 23169, 1, 128]
    - [14, 45.446]
  - - [29568, 2048, 1, 128]
    - [30, 43.692]
  - - [44672, 8192, 1, 128]
    - [19, 46.483]
  - - [29824, 512, 1, 128]
    - [15, 39.696]
  - - [34944, 2048, 1, 128]
    - [30, 44.314]
  - - [33408, 4096, 1, 128]
    - [17, 45.857]
  - - [41600, 25729, 1, 128]
    - [28, 45.529]
  - - [40832, 2048, 1, 128]
    - [19, 44.139]
  - - [38912, 128, 1, 128]
    - [30, 32.145]
  - - [34048, 2048, 1, 128]
    - [14, 43.336]
  - - [43904, 2048, 1, 128]
    - [34, 44.341]
  - - [39296, 23297, 1, 128]
    - [14, 45.524]
  - - [31232, 4096, 1, 128]
    - [17, 45.845]
  - - [35840, 1024, 1, 128]
    - [15, 43.597]
  - - [28928, 128, 1, 128]
    - [30, 25.434]
  - - [42752, 2048, 1, 128]
    - [28, 44.089]
  - - [44032, 1024, 1, 128]
    - [15, 43.694]
  - - [29440, 13569, 1, 128]
    - [17, 45.99]
  - - [35456, 19585, 1, 128]
    - [19, 45.703]
  - - [35840, 19841, 1, 128]
    - [17, 46.395]
  - - [31360, 128, 1, 128]
    - [27, 27.409]
  - - [40192, 2048, 1, 128]
    - [15, 44.606]
  - - [33920, 8192, 1, 128]
    - [19, 46.43]
  - - [43648, 512, 1, 128]
    - [17, 40.198]
  - - [30080, 14209, 1, 128]
    - [35, 43.283]
  - - [39680, 23809, 1, 128]
    - [14, 45.422]
  - - [32512, 512, 1, 128]
    - [29, 39.476]
  - - [34816, 2048, 1, 128]
    - [17, 44.568]
  - - [43392, 1024, 1, 128]
    - [25, 42.75]
  - - [39040, 4096, 1, 128]
    - [19, 45.454]
  - - [43264, 4096, 1, 128]
    - [19, 45.807]
  - - [44416, 2048, 1, 128]
    - [27, 44.36]
  - - [31488, 512, 1, 128]
    - [17, 40.673]
  - - [31616, 1024, 1, 128]
    - [19, 43.131]
  - - [44032, 8192, 1, 128]
    - [19, 47.089]
  - - [39424, 23553, 1, 128]
    - [28, 45.76]
  - - [31360, 8192, 1, 128]
    - [19, 46.446]
  - - [42752, 128, 1, 128]
    - [15, 31.193]
  - - [40192, 512, 1, 128]
    - [19, 41.544]
  - - [36096, 20225, 1, 128]
    - [16, 44.722]
  - - [41984, 26113, 1, 128]
    - [14, 46.343]
  - - [39936, 2048, 1, 128]
    - [27, 44.806]
  - - [42880, 2048, 1, 128]
    - [24, 43.617]
  - - [29440, 128, 1, 128]
    - [25, 26.096]
  - - [40192, 128, 1, 128]
    - [26, 32.619]
  - - [36608, 4096, 1, 128]
    - [17, 45.643]
  - - [37760, 21761, 1, 128]
    - [14, 45.57]
  - - [44160, 28161, 1, 128]
    - [19, 45.034]
  - - [44288, 512, 1, 128]
    - [26, 40.758]
  - - [29056, 13185, 1, 128]
    - [19, 45.782]
  - - [43904, 512, 1, 128]
    - [25, 40.392]
  - - [29696, 128, 1, 128]
    - [26, 26.197]
  - - [36224, 8192, 1, 128]
    - [19, 46.49]
  - - [33024, 2048, 1, 128]
    - [30, 44.345]
  - - [44032, 28161, 1, 128]
    - [28, 46.258]
  - - [44032, 128, 1, 128]
    - [17, 31.413]
  - - [38784, 512, 1, 128]
    - [29, 40.788]
  - - [29056, 8192, 1, 128]
    - [17, 46.411]
  - - [33920, 18049, 1, 128]
    - [28, 45.703]
  - - [34816, 1024, 1, 128]
    - [26, 43.646]
  - - [29056, 128, 1, 128]
    - [30, 25.546]
  - - [39552, 1024, 1, 128]
    - [15, 43.178]
  - - [36992, 8192, 1, 128]
    - [17, 46.344]
  - - [44544, 1024, 1, 128]
    - [30, 43.492]
  - - [43904, 27905, 1, 128]
    - [17, 45.391]
  - - [29440, 512, 1, 128]
    - [26, 39.452]
  - - [29568, 8192, 1, 128]
    - [19, 46.022]
  - - [41472, 2048, 1, 128]
    - [29, 44.493]
  - - [29184, 8192, 1, 128]
    - [26, 46.616]
  - - [33408, 512, 1, 128]
    - [15, 40.96]
  - - [38656, 22785, 1, 128]
    - [44, 45.782]
  - - [31744, 15745, 1, 128]
    - [17, 46.536]
  - - [38656, 2048, 1, 128]
    - [30, 44.176]
  - - [30080, 8192, 1, 128]
    - [51, 44.644]
  - - [44672, 128, 1, 128]
    - [17, 31.601]
  - - [40704, 24833, 1, 128]
    - [38, 45.754]
  - - [33792, 8192, 1, 128]
    - [19, 47.181]
  - - [33920, 512, 1, 128]
    - [26, 41.639]
  - - [40576, 1024, 1, 128]
    - [34, 43.164]
  - - [36224, 20225, 1, 128]
    - [28, 45.701]
  - - [34432, 1024, 1, 128]
    - [19, 42.711]
  - - [31488, 15617, 1, 128]
    - [19, 45.941]
  - - [40576, 2048, 1, 128]
    - [34, 44.334]
  - - [30208, 512, 1, 128]
    - [17, 40.117]
  - - [36480, 128, 1, 128]
    - [15, 30.685]
  - - [37504, 21633, 1, 128]
    - [21, 44.759]
  - - [32896, 17025, 1, 128]
    - [51, 44.944]
  - - [39168, 2048, 1, 128]
    - [15, 44.037]
  - - [29440, 2048, 1, 128]
    - [25, 43.835]
  - - [29440, 13441, 1, 128]
    - [19, 45.952]
  - - [32640, 8192, 1, 128]
    - [17, 46.225]
  - - [35072, 19073, 1, 128]
    - [28, 45.943]
  - - [33152, 512, 1, 128]
    - [30, 40.22]
  - - [40576, 8192, 1, 128]
    - [19, 46.372]
  - - [34944, 8192, 1, 128]
    - [19, 46.479]
  - - [38656, 128, 1, 128]
    - [64, 31.82]
  - - [33536, 17537, 1, 128]
    - [38, 46.122]
  - - [29952, 512, 1, 128]
    - [25, 39.867]
  - - [31488, 2048, 1, 128]
    - [30, 44.242]
  - - [31872, 4096, 1, 128]
    - [28, 45.435]
  - - [31232, 15233, 1, 128]
    - [38, 46.235]
  - - [38912, 23041, 1, 128]
    - [14, 46.582]
  - - [31232, 2048, 1, 128]
    - [24, 44.357]
  - - [40448, 8192, 1, 128]
    - [16, 46.84]
  - - [36352, 128, 1, 128]
    - [27, 30.612]
  - - [43776, 4096, 1, 128]
    - [43, 44.709]
  - - [32000, 8192, 1, 128]
    - [19, 46.687]
  - - [37760, 8192, 1, 128]
    - [17, 46.459]
  - - [30080, 1024, 1, 128]
    - [22, 41.65]
  - - [44544, 128, 1, 128]
    - [22, 32.088]
  - - [29696, 1024, 1, 128]
    - [56, 42.71]
  - - [32640, 512, 1, 128]
    - [17, 39.477]
  - - [44416, 128, 1, 128]
    - [22, 31.571]
  - - [41216, 512, 1, 128]
    - [42, 41.238]
  - - [31872, 512, 1, 128]
    - [30, 40.288]
  - - [34432, 512, 1, 128]
    - [19, 41.713]
  - - [34560, 1024, 1, 128]
    - [30, 43.417]
  - - [42240, 128, 1, 128]
    - [29, 33.682]
  - - [44288, 28289, 1, 128]
    - [14, 45.366]
  - - [30336, 14337, 1, 128]
    - [16, 45.421]
  - - [32384, 2048, 1, 128]
    - [30, 44.101]
  - - [38400, 22401, 1, 128]
    - [44, 46.128]
  - - [39296, 1024, 1, 128]
    - [25, 43.051]
  - - [28928, 8192, 1, 128]
    - [19, 46.561]
  - - [40320, 2048, 1, 128]
    - [30, 44.54]
  - - [31104, 15233, 1, 128]
    - [17, 45.866]
  - - [39680, 512, 1, 128]
    - [34, 41.26]
  - - [34048, 18049, 1, 128]
    - [44, 45.789]
  - - [30720, 1024, 1, 128]
    - [26, 43.411]
  - - [42880, 26881, 1, 128]
    - [44, 44.892]
  - - [32896, 8192, 1, 128]
    - [51, 45.437]
  - - [43264, 8192, 1, 128]
    - [17, 46.531]
  - - [37632, 4096, 1, 128]
    - [14, 45.643]
  - - [32256, 4096, 1, 128]
    - [22, 46.088]
  - - [37248, 4096, 1, 128]
    - [19, 45.415]
  - - [33280, 17409, 1, 128]
    - [44, 46.304]
  - - [36096, 512, 1, 128]
    - [34, 39.045]
  - - [37120, 21121, 1, 128]
    - [19, 45.711]
  - - [32896, 128, 1, 128]
    - [15, 27.925]
  - - [36352, 20481, 1, 128]
    - [28, 45.734]
  - - [43392, 2048, 1, 128]
    - [17, 43.776]
  - - [36352, 512, 1, 128]
    - [15, 40.948]
  - - [29056, 13057, 1, 128]
    - [14, 45.668]
  - - [29056, 4096, 1, 128]
    - [25, 45.545]
  - - [37888, 4096, 1, 128]
    - [17, 46.418]
  - - [40320, 512, 1, 128]
    - [25, 41.566]
  - - [39168, 128, 1, 128]
    - [25, 32.284]
  - - [41472, 8192, 1, 128]
    - [21, 46.812]
  - - [34560, 512, 1, 128]
    - [15, 42.049]
  - - [34176, 18305, 1, 128]
    - [21, 45.623]
  - - [34688, 8192, 1, 128]
    - [19, 46.367]
  - - [29696, 13825, 1, 128]
    - [17, 46.514]
  - - [33152, 17281, 1, 128]
    - [17, 46.072]
  - - [30208, 8192, 1, 128]
    - [21, 46.932]
  - - [43648, 27649, 1, 128]
    - [28, 44.631]
  - - [31360, 2048, 1, 128]
    - [15, 43.773]
  - - [41984, 128, 1, 128]
    - [17, 33.557]
  - - [38528, 2048, 1, 128]
    - [15, 43.961]
  - - [32256, 16385, 1, 128]
    - [21, 46.375]
  - - [42240, 1024, 1, 128]
    - [15, 43.243]
  - - [32000, 16001, 1, 128]
    - [14, 46.01]
  - - [37248, 1024, 1, 128]
    - [19, 42.966]
  - - [32256, 1024, 1, 128]
    - [17, 43.039]
  - - [39296, 23425, 1, 128]
    - [14, 45.506]
  - - [43008, 4096, 1, 128]
    - [17, 46.736]
  - - [31104, 128, 1, 128]
    - [15, 27.18]
  - - [38656, 8192, 1, 128]
    - [44, 46.561]
  - - [44288, 128, 1, 128]
    - [21, 31.718]
  - - [38528, 22657, 1, 128]
    - [14, 45.514]
  - - [39552, 128, 1, 128]
    - [15, 32.199]
  - - [37376, 21377, 1, 128]
    - [28, 46.05]
  - - [28928, 13057, 1, 128]
    - [19, 45.96]
  - - [43264, 27265, 1, 128]
    - [14, 45.734]
  - - [35328, 4096, 1, 128]
    - [44, 46.012]
  - - [30848, 4096, 1, 128]
    - [26, 45.587]
  - - [44800, 28801, 1, 128]
    - [28, 45.329]
  - - [35456, 512, 1, 128]
    - [56, 39.962]
  - - [40960, 24961, 1, 128]
    - [14, 40.336]
  - - [39936, 23937, 1, 128]
    - [14, 46.264]
  - - [31744, 1024, 1, 128]
    - [34, 43.136]
  - - [32128, 8192, 1, 128]
    - [14, 46.465]
  - - [42112, 26113, 1, 128]
    - [14, 45.455]
  - - [31744, 2048, 1, 128]
    - [27, 44.56]
  - - [42112, 1024, 1, 128]
    - [15, 43.21]
  - - [40064, 8192, 1, 128]
    - [14, 45.948]
  - - [38144, 128, 1, 128]
    - [30, 31.54]
  - - [42624, 2048, 1, 128]
    - [19, 40.989]
  - - [36992, 128, 1, 128]
    - [26, 30.794]
  - - [40192, 8192, 1, 128]
    - [19, 46.619]
  - - [40064, 24065, 1, 128]
    - [38, 44.533]
  - - [37760, 21889, 1, 128]
    - [14, 45.545]
  - - [36352, 8192, 1, 128]
    - [17, 46.787]
  - - [44544, 512, 1, 128]
    - [22, 41.173]
  - - [32384, 4096, 1, 128]
    - [19, 45.721]
  - - [39168, 23169, 1, 128]
    - [38, 45.761]
  - - [1408, 897, 1, 128]
    - [78, 29.971]
  - - [16512, 512, 1, 128]
    - [71, 30.672]
  - - [20480, 12673, 1, 128]
    - [19, 47.23]
  - - [20992, 512, 1, 128]
    - [19, 41.196]
  - - [9344, 512, 1, 128]
    - [25, 32.285]
  - - [18048, 2048, 1, 128]
    - [17, 42.348]
  - - [20352, 12673, 1, 128]
    - [19, 45.916]
  - - [640, 128, 1, 128]
    - [94, 3.662]
  - - [28160, 512, 1, 128]
    - [42, 41.669]
  - - [20608, 4096, 1, 128]
    - [19, 44.987]
  - - [19328, 1024, 1, 128]
    - [25, 41.669]
  - - [26496, 4096, 1, 128]
    - [42, 44.965]
  - - [10624, 512, 1, 128]
    - [26, 32.382]
  - - [20352, 1024, 1, 128]
    - [19, 42.206]
  - - [10240, 6529, 1, 128]
    - [17, 45.357]
  - - [22144, 14465, 1, 128]
    - [19, 45.898]
  - - [13184, 2048, 1, 128]
    - [30, 41.458]
  - - [14720, 6913, 1, 128]
    - [17, 44.874]
  - - [21248, 512, 1, 128]
    - [25, 36.614]
  - - [10496, 128, 1, 128]
    - [84, 31.751]
  - - [13056, 5377, 1, 128]
    - [17, 44.678]
  - - [10880, 128, 1, 128]
    - [84, 29.524]
  - - [18688, 512, 1, 128]
    - [25, 37.935]
  - - [22656, 4096, 1, 128]
    - [25, 45.081]
  - - [15232, 1024, 1, 128]
    - [17, 40.493]
  - - [20224, 4096, 1, 128]
    - [26, 45.205]
  - - [6016, 2305, 1, 128]
    - [19, 37.786]
  - - [13184, 4096, 1, 128]
    - [27, 43.952]
  - - [256, 129, 1, 128]
    - [119, 1.465]
  - - [11264, 7553, 1, 128]
    - [17, 45.632]
  - - [18176, 128, 1, 128]
    - [24, 26.582]
  - - [15872, 8193, 1, 128]
    - [17, 45.629]
  - - [26112, 4096, 1, 128]
    - [22, 45.885]
  - - [22784, 2048, 1, 128]
    - [34, 43.471]
  - - [10880, 7297, 1, 128]
    - [17, 44.655]
  - - [14720, 2048, 1, 128]
    - [15, 42.96]
  - - [9216, 5633, 1, 128]
    - [19, 44.514]
  - - [23040, 15233, 1, 128]
    - [17, 46.577]
  - - [8832, 5121, 1, 128]
    - [19, 43.392]
  - - [18816, 1024, 1, 128]
    - [22, 40.938]
  - - [128, 129, 1, 128]
    - [85, 0.738]
  - - [15488, 512, 1, 128]
    - [26, 35.007]
  - - [18176, 1024, 1, 128]
    - [19, 40.995]
  - - [16128, 8449, 1, 128]
    - [19, 45.56]
  - - [16000, 2048, 1, 128]
    - [26, 42.288]
  - - [24960, 9089, 1, 128]
    - [17, 45.317]
  - - [14336, 1024, 1, 128]
    - [19, 39.739]
  - - [25472, 8192, 1, 128]
    - [17, 46.584]
  - - [23040, 128, 1, 128]
    - [15, 31.621]
  - - [9472, 512, 1, 128]
    - [19, 33.193]
  - - [19072, 128, 1, 128]
    - [22, 27.345]
  - - [10624, 6913, 1, 128]
    - [17, 44.484]
  - - [7808, 1024, 1, 128]
    - [19, 35.397]
  - - [27008, 11137, 1, 128]
    - [38, 45.459]
  - - [21504, 4096, 1, 128]
    - [19, 46.162]
  - - [7936, 1024, 1, 128]
    - [25, 36.263]
  - - [12928, 5121, 1, 128]
    - [34, 43.389]
  - - [26240, 8192, 1, 128]
    - [19, 42.362]
  - - [18304, 2048, 1, 128]
    - [30, 43.223]
  - - [24576, 1024, 1, 128]
    - [19, 41.641]
  - - [10624, 128, 1, 128]
    - [79, 28.619]
  - - [24576, 128, 1, 128]
    - [25, 33.175]
  - - [25600, 9601, 1, 128]
    - [28, 46.181]
  - - [5248, 128, 1, 128]
    - [88, 22.135]
  - - [24448, 4096, 1, 128]
    - [26, 45.432]
  - - [19328, 128, 1, 128]
    - [25, 27.717]
  - - [24064, 512, 1, 128]
    - [15, 39.773]
  - - [11136, 512, 1, 128]
    - [27, 33.263]
  - - [14592, 1024, 1, 128]
    - [19, 39.377]
  - - [12544, 4737, 1, 128]
    - [19, 44.272]
  - - [17280, 128, 1, 128]
    - [30, 25.266]
  - - [25344, 8192, 1, 128]
    - [44, 46.021]
  - - [4608, 512, 1, 128]
    - [29, 26.791]
  - - [4608, 128, 1, 128]
    - [86, 20.246]
  - - [21760, 512, 1, 128]
    - [25, 37.072]
  - - [7936, 128, 1, 128]
    - [78, 26.151]
  - - [11008, 7425, 1, 128]
    - [49, 44.734]
  - - [13824, 2048, 1, 128]
    - [30, 43.654]
  - - [18048, 512, 1, 128]
    - [19, 37.199]
  - - [19584, 11905, 1, 128]
    - [17, 45.771]
  - - [22656, 512, 1, 128]
    - [30, 38.172]
  - - [4608, 3073, 1, 128]
    - [26, 38.869]
  - - [5504, 128, 1, 128]
    - [78, 22.823]
  - - [4864, 1024, 1, 128]
    - [19, 33.684]
  - - [17664, 1024, 1, 128]
    - [19, 40.529]
  - - [18176, 2048, 1, 128]
    - [30, 43.601]
  - - [2048, 1537, 1, 128]
    - [42, 33.885]
  - - [22528, 128, 1, 128]
    - [15, 30.976]
  - - [21760, 13953, 1, 128]
    - [14, 46.306]
  - - [7040, 128, 1, 128]
    - [80, 27.349]
  - - [3328, 1665, 1, 128]
    - [19, 32.65]
  - - [768, 512, 1, 128]
    - [85, 16.196]
  - - [21504, 13697, 1, 128]
    - [14, 46.635]
  - - [18560, 10881, 1, 128]
    - [19, 45.473]
  - - [2560, 128, 1, 128]
    - [86, 13.997]
  - - [15616, 1024, 1, 128]
    - [26, 40.824]
  - - [19456, 4096, 1, 128]
    - [19, 45.916]
  - - [25600, 2048, 1, 128]
    - [20, 44.245]
  - - [2304, 128, 1, 128]
    - [114, 12.504]
  - - [1664, 1025, 1, 128]
    - [25, 19.797]
  - - [23168, 15361, 1, 128]
    - [17, 45.518]
  - - [9856, 128, 1, 128]
    - [78, 30.957]
  - - [13312, 2048, 1, 128]
    - [17, 42.713]
  - - [19200, 512, 1, 128]
    - [26, 38.611]
  - - [19200, 2048, 1, 128]
    - [15, 43.454]
  - - [23168, 2048, 1, 128]
    - [34, 43.985]
  - - [18688, 128, 1, 128]
    - [34, 27.163]
  - - [13568, 1024, 1, 128]
    - [19, 41.514]
  - - [17792, 9985, 1, 128]
    - [38, 45.306]
  - - [20608, 1024, 1, 128]
    - [16, 42.014]
  - - [11648, 8065, 1, 128]
    - [17, 44.991]
  - - [1280, 128, 1, 128]
    - [83, 7.324]
  - - [16256, 4096, 1, 128]
    - [19, 44.813]
  - - [17024, 1024, 1, 128]
    - [17, 41.744]
  - - [19456, 128, 1, 128]
    - [25, 28.119]
  - - [20736, 512, 1, 128]
    - [34, 40.399]
  - - [14464, 6785, 1, 128]
    - [17, 44.794]
  - - [20736, 13057, 1, 128]
    - [17, 46.071]
  - - [8704, 2048, 1, 128]
    - [19, 42.448]
  - - [640, 512, 1, 128]
    - [83, 13.792]
  - - [768, 129, 1, 128]
    - [119, 4.395]
  - - [27776, 1024, 1, 128]
    - [26, 42.75]
  - - [19200, 11521, 1, 128]
    - [19, 45.806]
  - - [6400, 2048, 1, 128]
    - [19, 40.695]
  - - [14976, 7297, 1, 128]
    - [19, 44.964]
  - - [7040, 2048, 1, 128]
    - [19, 42.133]
  - - [25984, 128, 1, 128]
    - [25, 34.207]
  - - [13696, 128, 1, 128]
    - [84, 33.364]
  - - [2688, 1153, 1, 128]
    - [56, 32.625]
  - - [15232, 2048, 1, 128]
    - [19, 42.804]
  - - [11776, 128, 1, 128]
    - [84, 29.869]
  - - [3328, 512, 1, 128]
    - [78, 32.644]
  - - [11648, 7937, 1, 128]
    - [17, 44.948]
  - - [19456, 2048, 1, 128]
    - [15, 43.9]
  - - [11008, 128, 1, 128]
    - [79, 29.228]
  - - [9984, 6401, 1, 128]
    - [19, 44.572]
  - - [25856, 9857, 1, 128]
    - [17, 45.618]
  - - [4224, 512, 1, 128]
    - [22, 24.753]
  - - [13568, 5761, 1, 128]
    - [17, 44.662]
  - - [5632, 2049, 1, 128]
    - [42, 37.024]
  - - [8832, 2048, 1, 128]
    - [17, 40.482]
  - - [5632, 3969, 1, 128]
    - [42, 41.798]
  - - [25856, 2048, 1, 128]
    - [30, 43.873]
  - - [25472, 2048, 1, 128]
    - [15, 43.855]
  - - [20736, 12929, 1, 128]
    - [19, 46.039]
  - - [14592, 128, 1, 128]
    - [24, 22.261]
  - - [1792, 512, 1, 128]
    - [79, 24.27]
  - - [14208, 2048, 1, 128]
    - [30, 42.396]
  - - [15360, 7681, 1, 128]
    - [17, 45.649]
  - - [5760, 2048, 1, 128]
    - [17, 38.982]
  - - [6400, 512, 1, 128]
    - [26, 34.368]
  - - [5248, 3713, 1, 128]
    - [25, 40.632]
  - - [16768, 1024, 1, 128]
    - [34, 40.445]
  - - [10752, 512, 1, 128]
    - [15, 32.745]
  - - [26624, 2048, 1, 128]
    - [28, 44.32]
  - - [384, 128, 1, 128]
    - [86, 2.232]
  - - [27392, 8192, 1, 128]
    - [51, 45.808]
  - - [24448, 512, 1, 128]
    - [26, 38.266]
  - - [11136, 7553, 1, 128]
    - [19, 44.898]
  - - [17024, 9345, 1, 128]
    - [19, 45.64]
  - - [16000, 8193, 1, 128]
    - [19, 45.091]
  - - [5888, 2048, 1, 128]
    - [27, 39.591]
  - - [18304, 10497, 1, 128]
    - [17, 45.496]
  - - [3968, 128, 1, 128]
    - [83, 17.751]
  - - [14336, 6529, 1, 128]
    - [19, 45.676]
  - - [19840, 128, 1, 128]
    - [22, 28.341]
  - - [25600, 8192, 1, 128]
    - [19, 47.314]
  - - [18688, 11009, 1, 128]
    - [17, 45.921]
  - - [7680, 1024, 1, 128]
    - [17, 35.722]
  - - [7168, 128, 1, 128]
    - [80, 24.049]
  - - [1664, 512, 1, 128]
    - [78, 26.701]
  - - [12544, 1024, 1, 128]
    - [19, 39.443]
  - - [6528, 2048, 1, 128]
    - [19, 40.762]
  - - [19072, 4096, 1, 128]
    - [25, 45.091]
  - - [2048, 512, 1, 128]
    - [120, 27.115]
  - - [13568, 5889, 1, 128]
    - [19, 44.448]
  - - [23680, 16001, 1, 128]
    - [44, 45.198]
  - - [26112, 10113, 1, 128]
    - [38, 46.101]
  - - [15872, 128, 1, 128]
    - [22, 23.922]
  - - [16384, 512, 1, 128]
    - [19, 33.327]
  - - [9856, 6273, 1, 128]
    - [17, 42.549]
  - - [26368, 1024, 1, 128]
    - [15, 42.303]
  - - [16256, 2048, 1, 128]
    - [19, 42.32]
  - - [3968, 2305, 1, 128]
    - [25, 36.793]
  - - [28672, 8192, 1, 128]
    - [17, 47.54]
  - - [10368, 1024, 1, 128]
    - [25, 40.775]
  - - [11008, 1024, 1, 128]
    - [47, 35.775]
  - - [11776, 4097, 1, 128]
    - [22, 43.237]
  - - [26496, 2048, 1, 128]
    - [29, 43.274]
  - - [17792, 4096, 1, 128]
    - [22, 45.005]
  - - [2304, 512, 1, 128]
    - [79, 29.196]
  - - [9216, 2048, 1, 128]
    - [19, 41.282]
  - - [12416, 512, 1, 128]
    - [56, 36.201]
  - - [18048, 128, 1, 128]
    - [42, 26.342]
  - - [21888, 14209, 1, 128]
    - [52, 41.982]
  - - [9344, 5761, 1, 128]
    - [17, 44.358]
  - - [19712, 2048, 1, 128]
    - [31, 41.116]
  - - [12288, 1024, 1, 128]
    - [17, 39.436]
  - - [3584, 1921, 1, 128]
    - [26, 33.069]
  - - [22784, 128, 1, 128]
    - [27, 31.335]
  - - [26880, 128, 1, 128]
    - [30, 35.57]
  - - [17408, 1024, 1, 128]
    - [19, 41.997]
  - - [15488, 4096, 1, 128]
    - [17, 44.919]
  - - [13312, 5633, 1, 128]
    - [19, 45.186]
  - - [22016, 14337, 1, 128]
    - [21, 46.472]
  - - [19328, 2048, 1, 128]
    - [30, 43.728]
  - - [25600, 128, 1, 128]
    - [15, 33.998]
  - - [22784, 15105, 1, 128]
    - [44, 46.187]
  - - [5376, 3713, 1, 128]
    - [25, 41.376]
  - - [14208, 512, 1, 128]
    - [34, 32.868]
  - - [12928, 4096, 1, 128]
    - [25, 44.633]
  - - [768, 257, 1, 128]
    - [85, 8.688]
  - - [27776, 11777, 1, 128]
    - [17, 45.416]
  - - [12032, 1024, 1, 128]
    - [25, 40.109]
  - - [14208, 4096, 1, 128]
    - [17, 44.998]
  - - [19840, 12161, 1, 128]
    - [17, 45.78]
  - - [17536, 512, 1, 128]
    - [34, 38.659]
  - - [19840, 4096, 1, 128]
    - [25, 45.206]
  - - [26624, 512, 1, 128]
    - [25, 40.688]
  - - [27136, 11137, 1, 128]
    - [21, 46.29]
  - - [11008, 512, 1, 128]
    - [25, 32.65]
  - - [1024, 513, 1, 128]
    - [83, 18.031]
  - - [15744, 512, 1, 128]
    - [34, 35.825]
  - - [22016, 128, 1, 128]
    - [57, 30.621]
  - - [9344, 1024, 1, 128]
    - [19, 38.357]
  - - [28544, 1024, 1, 128]
    - [19, 42.309]
  - - [13440, 5633, 1, 128]
    - [38, 43.699]
  - - [21632, 13825, 1, 128]
    - [28, 45.844]
  - - [24064, 4096, 1, 128]
    - [21, 45.78]
  - - [24192, 512, 1, 128]
    - [15, 39.572]
  - - [22912, 15233, 1, 128]
    - [19, 46.056]
  - - [20864, 13185, 1, 128]
    - [19, 45.554]
  - - [8064, 4353, 1, 128]
    - [19, 42.586]
  - - [8704, 5121, 1, 128]
    - [17, 43.442]
  - - [19840, 1024, 1, 128]
    - [17, 41.559]
  - - [15616, 128, 1, 128]
    - [30, 23.393]
  - - [21632, 512, 1, 128]
    - [26, 36.974]
  - - [13440, 512, 1, 128]
    - [25, 38.697]
  - - [23936, 128, 1, 128]
    - [25, 32.37]
  - - [8960, 5377, 1, 128]
    - [19, 43.666]
  - - [27008, 512, 1, 128]
    - [25, 40.97]
  - - [13440, 5761, 1, 128]
    - [22, 43.687]
  - - [3072, 512, 1, 128]
    - [121, 30.642]
  - - [4096, 1024, 1, 128]
    - [22, 29.651]
  - - [7296, 3585, 1, 128]
    - [26, 41.586]
  - - [12416, 4737, 1, 128]
    - [22, 43.615]
  - - [6912, 512, 1, 128]
    - [25, 36.398]
  - - [11136, 2048, 1, 128]
    - [30, 41.832]
  - - [18176, 10369, 1, 128]
    - [17, 45.848]
  - - [14976, 4096, 1, 128]
    - [17, 44.963]
  - - [19712, 4096, 1, 128]
    - [30, 43.38]
  - - [8064, 1024, 1, 128]
    - [17, 34.668]
  - - [9600, 128, 1, 128]
    - [78, 30.281]
  - - [26240, 1024, 1, 128]
    - [19, 41.079]
  - - [5248, 3585, 1, 128]
    - [19, 40.924]
  - - [16768, 2048, 1, 128]
    - [30, 42.748]
  - - [13184, 128, 1, 128]
    - [84, 32.655]
  - - [19328, 11521, 1, 128]
    - [17, 45.479]
  - - [4864, 512, 1, 128]
    - [29, 27.847]
  - - [3584, 2049, 1, 128]
    - [19, 33.674]
  - - [18560, 128, 1, 128]
    - [25, 26.93]
  - - [27392, 11393, 1, 128]
    - [17, 44.508]
  - - [27520, 512, 1, 128]
    - [29, 40.386]
  - - [18176, 4096, 1, 128]
    - [17, 45.274]
  - - [7808, 4225, 1, 128]
    - [26, 42.956]
  - - [15232, 128, 1, 128]
    - [29, 22.86]
  - - [25728, 1024, 1, 128]
    - [25, 42.049]
  - - [23936, 512, 1, 128]
    - [25, 39.341]
  - - [23424, 2048, 1, 128]
    - [23, 42.136]
  - - [28032, 12161, 1, 128]
    - [17, 45.603]
  - - [27136, 512, 1, 128]
    - [22, 41.025]
  - - [14336, 6657, 1, 128]
    - [14, 45.789]
  - - [15616, 4096, 1, 128]
    - [17, 45.338]
  - - [3328, 1793, 1, 128]
    - [17, 34.56]
  - - [28416, 512, 1, 128]
    - [52, 38.809]
  - - [16384, 8705, 1, 128]
    - [19, 37.424]
  - - [3200, 1537, 1, 128]
    - [17, 32.96]
  - - [26368, 128, 1, 128]
    - [30, 35.08]
  - - [16000, 512, 1, 128]
    - [24, 34.729]
  - - [25216, 9345, 1, 128]
    - [19, 45.479]
  - - [28288, 4096, 1, 128]
    - [14, 45.457]
  - - [24832, 512, 1, 128]
    - [24, 38.5]
  - - [18048, 10369, 1, 128]
    - [16, 44.334]
  - - [20480, 4096, 1, 128]
    - [25, 46.324]
  - - [17792, 10113, 1, 128]
    - [16, 45.432]
  - - [13312, 5505, 1, 128]
    - [19, 45.025]
  - - [17024, 2048, 1, 128]
    - [34, 43.476]
  - - [20608, 12929, 1, 128]
    - [19, 45.702]
  - - [16896, 4096, 1, 128]
    - [22, 45.64]
  - - [27776, 2048, 1, 128]
    - [30, 43.876]
  - - [6912, 3201, 1, 128]
    - [26, 41.76]
  - - [15744, 2048, 1, 128]
    - [15, 43.428]
  - - [24448, 128, 1, 128]
    - [30, 32.828]
  - - [2688, 128, 1, 128]
    - [86, 14.172]
  - - [7808, 2048, 1, 128]
    - [19, 40.69]
  - - [1408, 512, 1, 128]
    - [78, 23.224]
  - - [12032, 512, 1, 128]
    - [25, 35.58]
  - - [26752, 512, 1, 128]
    - [25, 40.792]
  - - [16128, 8321, 1, 128]
    - [19, 45.623]
  - - [25856, 128, 1, 128]
    - [42, 34.214]
  - - [24064, 8192, 1, 128]
    - [22, 47.018]
  - - [28160, 4096, 1, 128]
    - [22, 45.418]
  - - [13312, 128, 1, 128]
    - [84, 31.595]
  - - [10112, 6401, 1, 128]
    - [22, 43.844]
  - - [16384, 4096, 1, 128]
    - [17, 38.021]
  - - [16512, 2048, 1, 128]
    - [58, 39.086]
  - - [27520, 11521, 1, 128]
    - [19, 45.627]
  - - [8192, 4481, 1, 128]
    - [26, 42.962]
  - - [16768, 512, 1, 128]
    - [19, 35.966]
  - - [6144, 128, 1, 128]
    - [78, 25.055]
  - - [13568, 512, 1, 128]
    - [25, 38.952]
  - - [9344, 5633, 1, 128]
    - [25, 44.287]
  - - [13440, 4096, 1, 128]
    - [17, 44.134]
  - - [2176, 1665, 1, 128]
    - [17, 25.457]
  - - [28288, 128, 1, 128]
    - [30, 25.262]
  - - [11776, 4096, 1, 128]
    - [42, 44.562]
  - - [17280, 512, 1, 128]
    - [26, 38.266]
  - - [5504, 3841, 1, 128]
    - [72, 36.733]
  - - [14848, 7041, 1, 128]
    - [17, 45.163]
  - - [3584, 128, 1, 128]
    - [83, 16.958]
  - - [26880, 8192, 1, 128]
    - [17, 46.482]
  - - [2944, 1409, 1, 128]
    - [26, 28.732]
  - - [26368, 10369, 1, 128]
    - [17, 45.792]
  - - [21888, 512, 1, 128]
    - [27, 35.508]
  - - [15872, 2048, 1, 128]
    - [34, 43.266]
  - - [20224, 512, 1, 128]
    - [19, 40.45]
  - - [24320, 8449, 1, 128]
    - [17, 45.716]
  - - [5632, 1024, 1, 128]
    - [19, 34.129]
  - - [17152, 9473, 1, 128]
    - [19, 45.713]
  - - [4096, 128, 1, 128]
    - [83, 18.547]
  - - [8832, 128, 1, 128]
    - [84, 28.344]
  - - [2048, 1409, 1, 128]
    - [22, 31.533]
  - - [28160, 12289, 1, 128]
    - [21, 45.864]
  - - [9088, 5505, 1, 128]
    - [17, 43.99]
  - - [19200, 1024, 1, 128]
    - [19, 41.453]
  - - [18048, 4096, 1, 128]
    - [17, 44.168]
  - - [12928, 512, 1, 128]
    - [34, 37.398]
  - - [20864, 4096, 1, 128]
    - [25, 45.018]
  - - [27008, 2048, 1, 128]
    - [30, 43.353]
  - - [16640, 128, 1, 128]
    - [29, 24.927]
  - - [24960, 8192, 1, 128]
    - [19, 46.265]
  - - [24320, 1024, 1, 128]
    - [17, 42.944]
  - - [23552, 15873, 1, 128]
    - [17, 46.69]
  - - [26240, 4096, 1, 128]
    - [19, 42.717]
  - - [24320, 128, 1, 128]
    - [22, 32.949]
  - - [26240, 128, 1, 128]
    - [15, 34.73]
  - - [3200, 1665, 1, 128]
    - [19, 31.363]
  - - [11776, 2048, 1, 128]
    - [17, 42.593]
  - - [6144, 512, 1, 128]
    - [25, 33.481]
  - - [24960, 128, 1, 128]
    - [15, 33.334]
  - - [23424, 128, 1, 128]
    - [29, 31.852]
  - - [11776, 8065, 1, 128]
    - [42, 45.272]
  - - [19072, 11265, 1, 128]
    - [17, 45.403]
  - - [8192, 4609, 1, 128]
    - [25, 43.552]
  - - [21888, 4096, 1, 128]
    - [51, 40.382]
  - - [14976, 2048, 1, 128]
    - [34, 42.838]
  - - [23680, 4096, 1, 128]
    - [38, 44.576]
  - - [14080, 1024, 1, 128]
    - [19, 42.357]
  - - [19968, 4096, 1, 128]
    - [25, 45.484]
  - - [8704, 128, 1, 128]
    - [80, 28.178]
  - - [23424, 15745, 1, 128]
    - [19, 43.83]
  - - [8320, 2048, 1, 128]
    - [27, 40.584]
  - - [6144, 2433, 1, 128]
    - [19, 39.949]
  - - [19200, 11393, 1, 128]
    - [17, 45.778]
  - - [28416, 128, 1, 128]
    - [30, 25.438]
  - - [14080, 2048, 1, 128]
    - [19, 42.359]
  - - [12544, 4096, 1, 128]
    - [17, 45.013]
  - - [17024, 128, 1, 128]
    - [16, 24.991]
  - - [23936, 16257, 1, 128]
    - [19, 46.159]
  - - [12288, 128, 1, 128]
    - [78, 30.85]
  - - [28800, 1024, 1, 128]
    - [42, 41.985]
  - - [13824, 6017, 1, 128]
    - [17, 45.055]
  - - [23040, 2048, 1, 128]
    - [27, 43.938]
  - - [9984, 6273, 1, 128]
    - [19, 44.695]
  - - [23680, 512, 1, 128]
    - [25, 39.204]
  - - [7936, 4353, 1, 128]
    - [17, 43.529]
  - - [24192, 2048, 1, 128]
    - [27, 44.024]
  - - [8448, 512, 1, 128]
    - [22, 29.71]
  - - [5760, 2177, 1, 128]
    - [26, 38.6]
  - - [22656, 14977, 1, 128]
    - [14, 45.731]
  - - [17024, 4096, 1, 128]
    - [19, 45.364]
  - - [24960, 8961, 1, 128]
    - [17, 45.169]
  - - [5888, 1024, 1, 128]
    - [30, 34.886]
  - - [9344, 2048, 1, 128]
    - [19, 41.138]
  - - [11520, 1024, 1, 128]
    - [19, 38.952]
  - - [17024, 9217, 1, 128]
    - [19, 45.351]
  - - [10368, 6657, 1, 128]
    - [19, 44.392]
  - - [21632, 2048, 1, 128]
    - [34, 43.672]
  - - [26880, 2048, 1, 128]
    - [34, 43.869]
  - - [20736, 4096, 1, 128]
    - [19, 45.481]
  - - [26624, 8192, 1, 128]
    - [17, 47.587]
  - - [26752, 2048, 1, 128]
    - [30, 43.698]
  - - [24192, 8321, 1, 128]
    - [17, 45.195]
  - - [4736, 1024, 1, 128]
    - [19, 33.114]
  - - [27648, 8192, 1, 128]
    - [19, 47.306]
  - - [27392, 11521, 1, 128]
    - [51, 44.51]
  - - [27776, 4096, 1, 128]
    - [26, 45.284]
  - - [28672, 12801, 1, 128]
    - [17, 46.648]
  - - [13056, 512, 1, 128]
    - [30, 37.842]
  - - [25088, 2048, 1, 128]
    - [24, 43.926]
  - - [17408, 9601, 1, 128]
    - [17, 46.144]
  - - [5120, 3585, 1, 128]
    - [25, 40.938]
  - - [13824, 512, 1, 128]
    - [25, 39.335]
  - - [8576, 1024, 1, 128]
    - [59, 38.069]
  - - [16768, 4096, 1, 128]
    - [26, 45.208]
  - - [25728, 9729, 1, 128]
    - [19, 45.32]
  - - [27392, 512, 1, 128]
    - [24, 38.691]
  - - [13824, 128, 1, 128]
    - [84, 32.393]
  - - [27264, 1024, 1, 128]
    - [26, 41.537]
  - - [22272, 14465, 1, 128]
    - [21, 46.223]
  - - [19840, 2048, 1, 128]
    - [34, 43.568]
  - - [18176, 10497, 1, 128]
    - [17, 45.819]
  - - [4992, 3329, 1, 128]
    - [26, 41.312]
  - - [14976, 7169, 1, 128]
    - [19, 44.407]
  - - [10112, 512, 1, 128]
    - [27, 34.534]
  - - [24704, 128, 1, 128]
    - [19, 33.286]
  - - [16896, 128, 1, 128]
    - [24, 25.26]
  - - [10880, 7169, 1, 128]
    - [19, 44.091]
  - - [9600, 512, 1, 128]
    - [26, 33.131]
  - - [22528, 1024, 1, 128]
    - [19, 42.125]
  - - [27008, 128, 1, 128]
    - [25, 35.055]
  - - [4480, 2945, 1, 128]
    - [25, 40.291]
  - - [15872, 8065, 1, 128]
    - [17, 45.84]
  - - [28672, 128, 1, 128]
    - [30, 25.507]
  - - [9344, 128, 1, 128]
    - [80, 29.6]
  - - [15360, 2048, 1, 128]
    - [34, 43.411]
  - - [11392, 512, 1, 128]
    - [25, 33.918]
  - - [9216, 128, 1, 128]
    - [80, 28.702]
  - - [8192, 2048, 1, 128]
    - [17, 40.844]
  - - [14464, 1024, 1, 128]
    - [17, 39.175]
  - - [4096, 2433, 1, 128]
    - [42, 39.249]
  - - [6528, 2945, 1, 128]
    - [17, 40.713]
  - - [12672, 512, 1, 128]
    - [54, 36.955]
  - - [26624, 128, 1, 128]
    - [15, 35.168]
  - - [19712, 1024, 1, 128]
    - [26, 40.481]
  - - [4480, 2817, 1, 128]
    - [26, 39.015]
  - - [13440, 2048, 1, 128]
    - [25, 42.115]
  - - [256, 257, 1, 128]
    - [83, 2.987]
  - - [16000, 128, 1, 128]
    - [22, 23.867]
  - - [7552, 3969, 1, 128]
    - [26, 42.069]
  - - [12416, 2048, 1, 128]
    - [19, 41.554]
  - - [18432, 512, 1, 128]
    - [26, 37.578]
  - - [14464, 512, 1, 128]
    - [25, 33.638]
  - - [1280, 769, 1, 128]
    - [78, 25.116]
  - - [14976, 512, 1, 128]
    - [27, 34.617]
  - - [28032, 4096, 1, 128]
    - [26, 45.397]
  - - [27904, 128, 1, 128]
    - [25, 36.155]
  - - [20224, 12545, 1, 128]
    - [19, 45.854]
  - - [15872, 4096, 1, 128]
    - [17, 45.739]
  - - [3456, 1793, 1, 128]
    - [25, 35.322]
  - - [14336, 128, 1, 128]
    - [22, 21.74]
  - - [21248, 2048, 1, 128]
    - [15, 43.649]
  - - [23040, 1024, 1, 128]
    - [22, 41.885]
  - - [15232, 7425, 1, 128]
    - [14, 44.631]
  - - [14592, 512, 1, 128]
    - [25, 33.889]
  - - [22912, 15105, 1, 128]
    - [19, 45.856]
  - - [22528, 2048, 1, 128]
    - [19, 44.374]
  - - [3072, 1024, 1, 128]
    - [22, 32.874]
  - - [17536, 4096, 1, 128]
    - [17, 45.101]
  - - [384, 257, 1, 128]
    - [89, 4.378]
  - - [14464, 6657, 1, 128]
    - [19, 44.75]
  - - [20096, 1024, 1, 128]
    - [19, 41.66]
  - - [26880, 4096, 1, 128]
    - [17, 45.686]
  - - [18816, 2048, 1, 128]
    - [27, 43.333]
  - - [17152, 512, 1, 128]
    - [17, 38.061]
  - - [18432, 4096, 1, 128]
    - [19, 46.42]
  - - [10368, 2048, 1, 128]
    - [30, 42.664]
  - - [1408, 769, 1, 128]
    - [84, 27.266]
  - - [7168, 2048, 1, 128]
    - [25, 39.766]
  - - [17664, 128, 1, 128]
    - [42, 26.138]
  - - [1152, 513, 1, 128]
    - [85, 19.814]
  - - [7296, 3713, 1, 128]
    - [17, 42.233]
  - - [24064, 2048, 1, 128]
    - [29, 43.879]
  - - [8576, 2048, 1, 128]
    - [30, 42.014]
  - - [23168, 15489, 1, 128]
    - [19, 45.702]
  - - [14848, 7169, 1, 128]
    - [19, 44.814]
  - - [2432, 512, 1, 128]
    - [120, 30.686]
  - - [19712, 12033, 1, 128]
    - [38, 44.208]
  - - [25856, 4096, 1, 128]
    - [17, 45.649]
  - - [17152, 9345, 1, 128]
    - [21, 45.62]
  - - [3712, 128, 1, 128]
    - [88, 16.913]
  - - [22272, 128, 1, 128]
    - [42, 30.86]
  - - [25600, 9729, 1, 128]
    - [19, 46.199]
  - - [6016, 2433, 1, 128]
    - [25, 39.116]
  - - [12928, 128, 1, 128]
    - [84, 32.348]
  - - [25088, 8192, 1, 128]
    - [44, 46.92]
  - - [7040, 1024, 1, 128]
    - [26, 39.056]
  - - [4736, 3201, 1, 128]
    - [22, 39.823]
  - - [16000, 1024, 1, 128]
    - [17, 39.786]
  - - [1920, 512, 1, 128]
    - [78, 25.535]
  - - [8192, 1024, 1, 128]
    - [25, 36.996]
  - - [8448, 4865, 1, 128]
    - [19, 43.535]
  - - [11136, 7425, 1, 128]
    - [17, 45.079]
  - - [23296, 4096, 1, 128]
    - [19, 45.463]
  - - [27904, 2048, 1, 128]
    - [27, 43.926]
  - - [23552, 4096, 1, 128]
    - [17, 46.138]
  - - [24960, 2048, 1, 128]
    - [27, 44.025]
  - - [2816, 128, 1, 128]
    - [94, 14.953]
  - - [7424, 3841, 1, 128]
    - [17, 42.525]
  - - [20480, 128, 1, 128]
    - [15, 29.193]
  - - [18816, 11137, 1, 128]
    - [17, 45.576]
  - - [26496, 128, 1, 128]
    - [25, 34.688]
  - - [16896, 9217, 1, 128]
    - [17, 45.874]
  - - [23296, 512, 1, 128]
    - [26, 38.895]
  - - [8064, 2048, 1, 128]
    - [17, 40.104]
  - - [19968, 128, 1, 128]
    - [22, 28.741]
  - - [8320, 4737, 1, 128]
    - [47, 42.111]
  - - [27648, 1024, 1, 128]
    - [26, 43.172]
  - - [3712, 512, 1, 128]
    - [26, 22.02]
  - - [256, 128, 1, 128]
    - [83, 1.5]
  - - [3072, 1537, 1, 128]
    - [26, 31.708]
  - - [5504, 1024, 1, 128]
    - [19, 32.134]
  - - [20992, 2048, 1, 128]
    - [30, 44.058]
  - - [20480, 1024, 1, 128]
    - [25, 41.912]
  - - [20864, 128, 1, 128]
    - [29, 29.177]
  - - [28544, 12545, 1, 128]
    - [17, 45.641]
  - - [1152, 512, 1, 128]
    - [83, 20.49]
  - - [24320, 8321, 1, 128]
    - [19, 45.636]
  - - [2688, 512, 1, 128]
    - [91, 29.178]
  - - [27904, 8192, 1, 128]
    - [38, 46.305]
  - - [3840, 2177, 1, 128]
    - [17, 36.982]
  - - [25344, 128, 1, 128]
    - [24, 33.786]
  - - [13184, 512, 1, 128]
    - [30, 38.064]
  - - [7680, 512, 1, 128]
    - [19, 27.702]
  - - [11904, 2048, 1, 128]
    - [34, 42.903]
  - - [12544, 512, 1, 128]
    - [27, 36.617]
  - - [8448, 4737, 1, 128]
    - [19, 43.198]
  - - [28544, 128, 1, 128]
    - [30, 25.216]
  - - [21760, 14081, 1, 128]
    - [19, 46.293]
  - - [12800, 128, 1, 128]
    - [79, 31.388]
  - - [17664, 4096, 1, 128]
    - [25, 45.009]
  - - [2432, 1793, 1, 128]
    - [26, 29.769]
  - - [16384, 8577, 1, 128]
    - [19, 37.574]
  - - [28544, 512, 1, 128]
    - [42, 38.922]
  - - [28032, 12033, 1, 128]
    - [17, 45.692]
  - - [4864, 3329, 1, 128]
    - [19, 40.718]
  - - [12928, 5249, 1, 128]
    - [17, 44.052]
  - - [4736, 512, 1, 128]
    - [24, 27.214]
  - - [27264, 2048, 1, 128]
    - [17, 42.91]
  - - [19840, 12033, 1, 128]
    - [19, 45.797]
  - - [19584, 4096, 1, 128]
    - [19, 45.273]
  - - [21376, 4096, 1, 128]
    - [17, 45.323]
  - - [20352, 4096, 1, 128]
    - [25, 45.354]
  - - [6400, 2689, 1, 128]
    - [26, 41.995]
  - - [24704, 8192, 1, 128]
    - [43, 45.87]
  - - [22528, 14849, 1, 128]
    - [19, 46.927]
  - - [18304, 512, 1, 128]
    - [26, 37.603]
  - - [6656, 1024, 1, 128]
    - [25, 38.433]
  - - [13568, 4096, 1, 128]
    - [19, 45.258]
  - - [6016, 512, 1, 128]
    - [60, 32.844]
  - - [17664, 2048, 1, 128]
    - [19, 42.904]
  - - [17408, 512, 1, 128]
    - [15, 38.114]
  - - [24960, 4096, 1, 128]
    - [17, 45.456]
  - - [20608, 12801, 1, 128]
    - [17, 45.592]
  - - [27648, 11649, 1, 128]
    - [17, 46.394]
  - - [5760, 128, 1, 128]
    - [79, 23.233]
  - - [17792, 512, 1, 128]
    - [30, 36.774]
  - - [17664, 512, 1, 128]
    - [27, 37.061]
  - - [19968, 12161, 1, 128]
    - [17, 46.15]
  - - [19840, 512, 1, 128]
    - [17, 39.521]
  - - [12032, 4353, 1, 128]
    - [19, 43.908]
  - - [25984, 512, 1, 128]
    - [54, 40.063]
  - - [27648, 4096, 1, 128]
    - [17, 46.345]
  - - [10752, 7041, 1, 128]
    - [17, 45.241]
  - - [28544, 2048, 1, 128]
    - [34, 43.938]
  - - [7680, 2048, 1, 128]
    - [17, 41.027]
  - - [13184, 5377, 1, 128]
    - [22, 43.357]
  - - [6784, 3201, 1, 128]
    - [26, 40.973]
  - - [16384, 2048, 1, 128]
    - [17, 36.708]
  - - [22656, 1024, 1, 128]
    - [19, 41.7]
  - - [12800, 512, 1, 128]
    - [30, 37.247]
  - - [23936, 1024, 1, 128]
    - [19, 42.686]
  - - [15360, 1024, 1, 128]
    - [19, 40.76]
  - - [15488, 2048, 1, 128]
    - [15, 43.276]
  - - [11392, 1024, 1, 128]
    - [19, 38.453]
  - - [15744, 1024, 1, 128]
    - [25, 41.287]
  - - [9856, 2048, 1, 128]
    - [17, 41.072]
  - - [5888, 2305, 1, 128]
    - [25, 40.7]
  - - [10496, 512, 1, 128]
    - [60, 35.51]
  - - [1664, 1153, 1, 128]
    - [42, 22.184]
  - - [3456, 1024, 1, 128]
    - [26, 36.005]
  - - [20992, 13313, 1, 128]
    - [19, 46.058]
  - - [11904, 4096, 1, 128]
    - [19, 44.407]
  - - [13056, 1024, 1, 128]
    - [19, 40.26]
  - - [12800, 2048, 1, 128]
    - [24, 42.43]
  - - [12160, 512, 1, 128]
    - [34, 36.03]
  - - [5760, 2049, 1, 128]
    - [15, 38.035]
  - - [11392, 128, 1, 128]
    - [84, 30.138]
  - - [5632, 128, 1, 128]
    - [79, 22.716]
  - - [11520, 2048, 1, 128]
    - [17, 41.898]
  - - [11648, 2048, 1, 128]
    - [34, 42.355]
  - - [28544, 8192, 1, 128]
    - [17, 46.393]
  - - [22912, 1024, 1, 128]
    - [19, 42.084]
  - - [10752, 7169, 1, 128]
    - [17, 45.01]
  - - [8320, 128, 1, 128]
    - [79, 26.935]
  - - [23808, 1024, 1, 128]
    - [25, 42.655]
  - - [25984, 8192, 1, 128]
    - [16, 46.384]
  - - [22656, 2048, 1, 128]
    - [27, 43.771]
  - - [7296, 1024, 1, 128]
    - [17, 33.942]
  - - [28032, 512, 1, 128]
    - [19, 41.815]
  - - [22400, 2048, 1, 128]
    - [34, 43.599]
  - - [22144, 512, 1, 128]
    - [15, 37.331]
  - - [13312, 4096, 1, 128]
    - [17, 45.594]
  - - [10240, 2048, 1, 128]
    - [17, 42.314]
  - - [12672, 128, 1, 128]
    - [84, 32.477]
  - - [10752, 2048, 1, 128]
    - [15, 42.028]
  - - [1152, 128, 1, 128]
    - [85, 6.643]
  - - [13696, 5889, 1, 128]
    - [26, 42.592]
  - - [9216, 1024, 1, 128]
    - [26, 37.865]
  - - [17152, 128, 1, 128]
    - [30, 25.431]
  - - [24320, 2048, 1, 128]
    - [30, 44.178]
  - - [16512, 8705, 1, 128]
    - [19, 44.284]
  - - [3072, 1409, 1, 128]
    - [19, 29.52]
  - - [1024, 128, 1, 128]
    - [86, 5.905]
  - - [22400, 14593, 1, 128]
    - [14, 45.652]
  - - [4096, 512, 1, 128]
    - [24, 24.897]
  - - [4992, 128, 1, 128]
    - [83, 21.548]
  - - [9472, 5889, 1, 128]
    - [17, 44.292]
  - - [9472, 5761, 1, 128]
    - [17, 43.936]
  - - [27136, 1024, 1, 128]
    - [22, 43.113]
  - - [6528, 1024, 1, 128]
    - [26, 37.555]
  - - [25472, 1024, 1, 128]
    - [30, 42.1]
  - - [5120, 512, 1, 128]
    - [52, 29.255]
  - - [5504, 512, 1, 128]
    - [25, 29.719]
  - - [21120, 13441, 1, 128]
    - [38, 44.906]
  - - [4352, 128, 1, 128]
    - [83, 19.236]
  - - [8832, 5249, 1, 128]
    - [17, 43.648]
  - - [1536, 1025, 1, 128]
    - [80, 29.099]
  - - [11520, 512, 1, 128]
    - [60, 34.41]
  - - [5632, 2048, 1, 128]
    - [16, 38.174]
  - - [7424, 128, 1, 128]
    - [80, 24.684]
  - - [18432, 128, 1, 128]
    - [27, 27.171]
  - - [12672, 2048, 1, 128]
    - [19, 42.183]
  - - [14208, 128, 1, 128]
    - [30, 21.502]
  - - [15360, 7553, 1, 128]
    - [19, 45.889]
  - - [26496, 1024, 1, 128]
    - [26, 42.264]
  - - [27136, 128, 1, 128]
    - [52, 35.338]
  - - [12032, 2048, 1, 128]
    - [27, 42.76]
  - - [11648, 1024, 1, 128]
    - [17, 39.161]
  - - [11776, 512, 1, 128]
    - [25, 35.139]
  - - [1024, 512, 1, 128]
    - [98, 18.435]
  - - [11264, 7681, 1, 128]
    - [19, 45.447]
  - - [19456, 11777, 1, 128]
    - [17, 46.512]
  - - [14080, 4096, 1, 128]
    - [17, 43.534]
  - - [7040, 3329, 1, 128]
    - [26, 41.787]
  - - [27392, 4096, 1, 128]
    - [52, 44.661]
  - - [14720, 7041, 1, 128]
    - [19, 44.828]
  - - [19584, 1024, 1, 128]
    - [27, 41.301]
  - - [21376, 13569, 1, 128]
    - [19, 45.75]
  - - [20480, 12801, 1, 128]
    - [19, 47.065]
  - - [21248, 128, 1, 128]
    - [30, 29.72]
  - - [9728, 1024, 1, 128]
    - [25, 39.467]
  - - [18688, 10881, 1, 128]
    - [19, 45.714]
  - - [21120, 13313, 1, 128]
    - [21, 44.673]
  - - [20096, 2048, 1, 128]
    - [30, 43.167]
  - - [16640, 4096, 1, 128]
    - [17, 45.585]
  - - [28160, 12161, 1, 128]
    - [38, 45.981]
  - - [640, 129, 1, 128]
    - [83, 3.662]
  - - [28672, 512, 1, 128]
    - [17, 39.061]
  - - [12416, 4096, 1, 128]
    - [17, 44.607]
  - - [25344, 9473, 1, 128]
    - [22, 44.899]
  - - [18304, 1024, 1, 128]
    - [15, 40.763]
  - - [25600, 4096, 1, 128]
    - [17, 46.394]
  - - [22272, 512, 1, 128]
    - [15, 37.987]
  - - [21504, 13825, 1, 128]
    - [28, 46.611]
  - - [4736, 128, 1, 128]
    - [86, 20.684]
  - - [26496, 10625, 1, 128]
    - [44, 45.111]
  - - [7040, 512, 1, 128]
    - [26, 36.099]
  - - [14336, 4096, 1, 128]
    - [19, 46.045]
  - - [9216, 512, 1, 128]
    - [30, 32.251]
  - - [1280, 641, 1, 128]
    - [78, 24.901]
  - - [16768, 8961, 1, 128]
    - [19, 45.569]
  - - [18944, 11137, 1, 128]
    - [38, 46.171]
  - - [21504, 2048, 1, 128]
    - [43, 44.054]
  - - [21888, 1024, 1, 128]
    - [25, 37.4]
  - - [11264, 512, 1, 128]
    - [19, 34.059]
  - - [27776, 8192, 1, 128]
    - [17, 46.27]
  - - [10368, 6785, 1, 128]
    - [26, 44.491]
  - - [18432, 10753, 1, 128]
    - [17, 46.711]
  - - [19968, 2048, 1, 128]
    - [30, 43.687]
  - - [16640, 512, 1, 128]
    - [60, 35.332]
  - - [24576, 8577, 1, 128]
    - [28, 42.526]
  - - [28672, 2048, 1, 128]
    - [19, 43.883]
  - - [11136, 128, 1, 128]
    - [78, 29.674]
  - - [12288, 4609, 1, 128]
    - [17, 44.544]
  - - [14848, 1024, 1, 128]
    - [19, 40.215]
  - - [14848, 128, 1, 128]
    - [26, 22.334]
  - - [7424, 1024, 1, 128]
    - [17, 34.422]
  - - [2560, 1024, 1, 128]
    - [42, 29.199]
  - - [6400, 128, 1, 128]
    - [78, 25.674]
  - - [15488, 7809, 1, 128]
    - [19, 45.064]
  - - [17920, 2048, 1, 128]
    - [24, 43.624]
  - - [5760, 512, 1, 128]
    - [26, 31.739]
  - - [16640, 1024, 1, 128]
    - [19, 41.308]
  - - [28160, 2048, 1, 128]
    - [15, 44.07]
  - - [5504, 3969, 1, 128]
    - [47, 37.291]
  - - [11776, 1024, 1, 128]
    - [19, 39.659]
  - - [18816, 128, 1, 128]
    - [30, 27.194]
  - - [27904, 12033, 1, 128]
    - [38, 45.586]
  - - [11520, 7937, 1, 128]
    - [19, 44.746]
  - - [18944, 11265, 1, 128]
    - [44, 46.055]
  - - [5376, 1024, 1, 128]
    - [17, 32.116]
  - - [12032, 4225, 1, 128]
    - [17, 43.658]
  - - [5376, 128, 1, 128]
    - [78, 22.045]
  - - [9856, 1024, 1, 128]
    - [17, 39.055]
  - - [26752, 10881, 1, 128]
    - [19, 45.393]
  - - [20352, 128, 1, 128]
    - [42, 28.794]
  - - [14464, 128, 1, 128]
    - [22, 21.619]
  - - [1024, 385, 1, 128]
    - [89, 15.36]
  - - [3840, 128, 1, 128]
    - [85, 17.389]
  - - [24192, 128, 1, 128]
    - [15, 32.783]
  - - [28544, 12673, 1, 128]
    - [19, 45.789]
  - - [1664, 128, 1, 128]
    - [85, 9.305]
  - - [26752, 8192, 1, 128]
    - [14, 46.339]
  - - [16896, 1024, 1, 128]
    - [22, 41.586]
  - - [9728, 128, 1, 128]
    - [79, 30.297]
  - - [11264, 2048, 1, 128]
    - [19, 42.067]
  - - [11392, 2048, 1, 128]
    - [19, 41.914]
  - - [20224, 2048, 1, 128]
    - [30, 43.332]
  - - [26880, 1024, 1, 128]
    - [27, 42.478]
  - - [15104, 512, 1, 128]
    - [17, 34.75]
  - - [26368, 2048, 1, 128]
    - [17, 43.697]
  - - [6784, 3073, 1, 128]
    - [25, 40.31]
  - - [23168, 128, 1, 128]
    - [15, 31.797]
  - - [8448, 1024, 1, 128]
    - [42, 37.138]
  - - [16896, 9089, 1, 128]
    - [16, 46.11]
  - - [17536, 128, 1, 128]
    - [25, 25.85]
  - - [22912, 512, 1, 128]
    - [27, 38.232]
  - - [28032, 128, 1, 128]
    - [15, 36.13]
  - - [19584, 512, 1, 128]
    - [27, 39.162]
  - - [27136, 11265, 1, 128]
    - [16, 46.115]
  - - [4992, 512, 1, 128]
    - [24, 28.409]
  - - [8448, 128, 1, 128]
    - [84, 27.47]
  - - [27648, 128, 1, 128]
    - [15, 35.822]
  - - [16640, 2048, 1, 128]
    - [27, 42.998]
  - - [26752, 10753, 1, 128]
    - [28, 45.477]
  - - [2944, 1281, 1, 128]
    - [26, 26.563]
  - - [5376, 3841, 1, 128]
    - [19, 42.384]
  - - [10496, 6913, 1, 128]
    - [19, 44.723]
  - - [17024, 512, 1, 128]
    - [26, 37.559]
  - - [11008, 7297, 1, 128]
    - [73, 44.623]
  - - [14080, 128, 1, 128]
    - [15, 25.612]
  - - [5888, 512, 1, 128]
    - [25, 32.264]
  - - [19200, 128, 1, 128]
    - [25, 27.968]
  - - [14208, 6529, 1, 128]
    - [19, 44.534]
  - - [22912, 4096, 1, 128]
    - [25, 45.339]
  - - [14336, 2048, 1, 128]
    - [17, 43.096]
  - - [17792, 128, 1, 128]
    - [24, 26.123]
  - - [22656, 14849, 1, 128]
    - [14, 45.629]
  - - [19712, 512, 1, 128]
    - [19, 39.479]
  - - [5248, 1024, 1, 128]
    - [17, 35.108]
  - - [3712, 2049, 1, 128]
    - [19, 34.365]
  - - [24448, 8449, 1, 128]
    - [19, 45.255]
  - - [8192, 512, 1, 128]
    - [26, 28.879]
  - - [25472, 4096, 1, 128]
    - [17, 45.651]
  - - [25088, 512, 1, 128]
    - [19, 39.464]
  - - [23168, 1024, 1, 128]
    - [26, 42.044]
  - - [24320, 8192, 1, 128]
    - [22, 46.734]
  - - [24192, 8192, 1, 128]
    - [17, 46.474]
  - - [2176, 512, 1, 128]
    - [79, 28.055]
  - - [4992, 3457, 1, 128]
    - [26, 41.978]
  - - [896, 257, 1, 128]
    - [122, 9.692]
  - - [28288, 1024, 1, 128]
    - [17, 42.197]
  - - [20864, 1024, 1, 128]
    - [17, 42.728]
  - - [18432, 2048, 1, 128]
    - [17, 43.921]
  - - [17280, 9601, 1, 128]
    - [19, 45.382]
  - - [18944, 4096, 1, 128]
    - [22, 45.601]
  - - [13440, 128, 1, 128]
    - [80, 32.958]
  - - [7424, 2048, 1, 128]
    - [19, 40.427]
  - - [768, 128, 1, 128]
    - [86, 4.429]
  - - [16128, 512, 1, 128]
    - [22, 34.593]
  - - [28288, 12289, 1, 128]
    - [19, 45.397]
  - - [23552, 128, 1, 128]
    - [34, 31.909]
  - - [24832, 8192, 1, 128]
    - [42, 46.933]
  - - [10240, 1024, 1, 128]
    - [17, 40.434]
  - - [8960, 2048, 1, 128]
    - [26, 40.69]
  - - [17664, 9985, 1, 128]
    - [19, 45.395]
  - - [25088, 4096, 1, 128]
    - [42, 45.937]
  - - [7552, 2048, 1, 128]
    - [15, 40.591]
  - - [15104, 7297, 1, 128]
    - [17, 45.225]
  - - [7168, 1024, 1, 128]
    - [19, 33.982]
  - - [26112, 8192, 1, 128]
    - [22, 47.055]
  - - [24192, 1024, 1, 128]
    - [19, 42.824]
  - - [22912, 2048, 1, 128]
    - [26, 43.139]
  - - [10368, 512, 1, 128]
    - [27, 35.36]
  - - [22528, 4096, 1, 128]
    - [19, 46.425]
  - - [6528, 128, 1, 128]
    - [79, 26.046]
  - - [26752, 4096, 1, 128]
    - [28, 45.179]
  - - [2816, 512, 1, 128]
    - [78, 30.344]
  - - [22016, 14209, 1, 128]
    - [16, 46.54]
  - - [8832, 1024, 1, 128]
    - [56, 36.792]
  - - [16384, 128, 1, 128]
    - [15, 24.795]
  - - [5120, 1024, 1, 128]
    - [17, 34.644]
  - - [24832, 8833, 1, 128]
    - [38, 45.868]
  - - [11520, 128, 1, 128]
    - [79, 30.26]
  - - [24960, 512, 1, 128]
    - [17, 38.841]
  - - [27520, 2048, 1, 128]
    - [30, 43.992]
  - - [22272, 14593, 1, 128]
    - [38, 45.954]
  - - [2048, 128, 1, 128]
    - [86, 11.281]
  - - [2176, 1537, 1, 128]
    - [26, 25.126]
  - - [10496, 1024, 1, 128]
    - [17, 41.279]
  - - [12160, 4353, 1, 128]
    - [19, 43.944]
  - - [6144, 1024, 1, 128]
    - [17, 35.581]
  - - [26752, 1024, 1, 128]
    - [30, 42.239]
  - - [17280, 4096, 1, 128]
    - [25, 45.135]
  - - [16896, 512, 1, 128]
    - [29, 36.62]
  - - [4480, 128, 1, 128]
    - [86, 19.801]
  - - [18944, 128, 1, 128]
    - [41, 27.644]
  - - [9600, 2048, 1, 128]
    - [19, 41.598]
  - - [19456, 1024, 1, 128]
    - [17, 41.595]
  - - [9984, 2048, 1, 128]
    - [17, 42.255]
  - - [25216, 9217, 1, 128]
    - [14, 45.153]
  - - [19968, 1024, 1, 128]
    - [19, 42.029]
  - - [13952, 2048, 1, 128]
    - [30, 43.274]
  - - [10496, 2048, 1, 128]
    - [19, 42.812]
  - - [12672, 1024, 1, 128]
    - [19, 39.816]
  - - [19072, 11393, 1, 128]
    - [28, 45.652]
  - - [11008, 2048, 1, 128]
    - [47, 40.313]
  - - [27520, 11649, 1, 128]
    - [19, 45.664]
  - - [10880, 512, 1, 128]
    - [25, 32.199]
  - - [14592, 6785, 1, 128]
    - [42, 44.037]
  - - [7424, 512, 1, 128]
    - [19, 26.773]
  - - [13056, 5249, 1, 128]
    - [17, 44.423]
  - - [23296, 15489, 1, 128]
    - [17, 46.155]
  - - [28416, 8192, 1, 128]
    - [19, 46.394]
  - - [11392, 7681, 1, 128]
    - [19, 44.48]
  - - [18048, 1024, 1, 128]
    - [17, 40.637]
  - - [15616, 7809, 1, 128]
    - [19, 45.364]
  - - [128, 128, 1, 128]
    - [83, 0.75]
  - - [24704, 512, 1, 128]
    - [42, 36.765]
  - - [7680, 4097, 1, 128]
    - [19, 42.92]
  - - [16640, 8961, 1, 128]
    - [17, 45.941]
  - - [18944, 1024, 1, 128]
    - [26, 41.631]
  - - [12928, 2048, 1, 128]
    - [30, 42.458]
  - - [22272, 2048, 1, 128]
    - [34, 43.542]
  - - [27904, 11905, 1, 128]
    - [21, 45.645]
  - - [26240, 2048, 1, 128]
    - [19, 41.678]
  - - [9728, 6017, 1, 128]
    - [25, 44.661]
  - - [20736, 1024, 1, 128]
    - [17, 42.428]
  - - [3456, 1921, 1, 128]
    - [26, 37.335]
  - - [8064, 512, 1, 128]
    - [26, 27.566]
  - - [4224, 1024, 1, 128]
    - [19, 29.888]
  - - [25984, 10113, 1, 128]
    - [21, 45.563]
  - - [13696, 6017, 1, 128]
    - [49, 42.514]
  - - [27520, 8192, 1, 128]
    - [17, 46.441]
  - - [18944, 512, 1, 128]
    - [25, 38.516]
  - - [6272, 128, 1, 128]
    - [80, 25.437]
  - - [27264, 4096, 1, 128]
    - [26, 45.21]
  - - [1792, 1153, 1, 128]
    - [21, 23.607]
  - - [17536, 9729, 1, 128]
    - [17, 45.307]
  - - [13184, 5505, 1, 128]
    - [22, 43.612]
  - - [2944, 128, 1, 128]
    - [85, 15.411]
  - - [25344, 512, 1, 128]
    - [17, 39.459]
  - - [23040, 15361, 1, 128]
    - [17, 46.101]
  - - [8704, 512, 1, 128]
    - [30, 30.861]
  - - [20864, 13057, 1, 128]
    - [14, 45.465]
  - - [19328, 4096, 1, 128]
    - [17, 45.15]
  - - [28288, 8192, 1, 128]
    - [28, 46.469]
  - - [10112, 1024, 1, 128]
    - [19, 40.387]
  - - [17536, 2048, 1, 128]
    - [30, 43.799]
  - - [7552, 128, 1, 128]
    - [78, 24.997]
  - - [15616, 7937, 1, 128]
    - [19, 45.393]
  - - [23040, 512, 1, 128]
    - [24, 38.562]
  - - [25984, 2048, 1, 128]
    - [29, 43.611]
  - - [14720, 128, 1, 128]
    - [42, 22.186]
  - - [23424, 1024, 1, 128]
    - [17, 41.891]
  - - [1920, 1281, 1, 128]
    - [25, 27.133]
  - - [27136, 2048, 1, 128]
    - [34, 44.323]
  - - [28800, 8192, 1, 128]
    - [19, 46.396]
  - - [15488, 128, 1, 128]
    - [26, 23.15]
  - - [28800, 12929, 1, 128]
    - [17, 45.572]
  - - [21888, 14081, 1, 128]
    - [52, 41.962]
  - - [25600, 1024, 1, 128]
    - [25, 42.273]
  - - [21632, 1024, 1, 128]
    - [30, 41.233]
  - - [24448, 1024, 1, 128]
    - [26, 41.88]
  - - [4352, 2689, 1, 128]
    - [26, 38.62]
  - - [20480, 512, 1, 128]
    - [19, 39.934]
  - - [7296, 128, 1, 128]
    - [84, 24.703]
  - - [4992, 1024, 1, 128]
    - [17, 34.368]
  - - [27264, 11393, 1, 128]
    - [19, 45.662]
  - - [26752, 128, 1, 128]
    - [15, 35.086]
  - - [24960, 1024, 1, 128]
    - [30, 41.824]
  - - [21504, 512, 1, 128]
    - [15, 37.142]
  - - [6272, 2561, 1, 128]
    - [19, 40.26]
  - - [25088, 9089, 1, 128]
    - [16, 45.869]
  - - [20864, 512, 1, 128]
    - [26, 40.683]
  - - [4224, 2561, 1, 128]
    - [22, 36.881]
  - - [15744, 8065, 1, 128]
    - [17, 45.33]
  - - [21632, 128, 1, 128]
    - [22, 30.024]
  - - [15104, 4096, 1, 128]
    - [17, 45.379]
  - - [20352, 512, 1, 128]
    - [30, 40.397]
  - - [25472, 9601, 1, 128]
    - [19, 45.504]
  - - [27904, 512, 1, 128]
    - [19, 41.498]
  - - [19968, 512, 1, 128]
    - [25, 40.046]
  - - [5760, 1024, 1, 128]
    - [26, 34.613]
  - - [28416, 12545, 1, 128]
    - [17, 45.589]
  - - [16512, 8833, 1, 128]
    - [19, 44.373]
  - - [6016, 128, 1, 128]
    - [79, 24.399]
  - - [13056, 4096, 1, 128]
    - [26, 45.349]
  - - [19968, 12289, 1, 128]
    - [19, 45.801]
  - - [7424, 3713, 1, 128]
    - [25, 43.114]
  - - [28800, 128, 1, 128]
    - [30, 25.256]
  - - [512, 512, 1, 128]
    - [85, 10.955]
  - - [24832, 2048, 1, 128]
    - [29, 43.926]
  - - [20736, 128, 1, 128]
    - [27, 29.22]
  - - [26368, 512, 1, 128]
    - [52, 40.028]
  - - [26496, 8192, 1, 128]
    - [22, 45.86]
  - - [13824, 4096, 1, 128]
    - [25, 45.2]
  - - [27264, 128, 1, 128]
    - [30, 35.195]
  - - [21760, 1024, 1, 128]
    - [26, 41.232]
  - - [2432, 1921, 1, 128]
    - [26, 31.632]
  - - [27136, 8192, 1, 128]
    - [16, 47.092]
  - - [6784, 2048, 1, 128]
    - [17, 41.505]
  - - [11264, 128, 1, 128]
    - [121, 28.769]
  - - [7552, 512, 1, 128]
    - [27, 27.24]
  - - [19328, 11649, 1, 128]
    - [19, 45.711]
  - - [17152, 2048, 1, 128]
    - [15, 43.822]
  - - [23808, 16129, 1, 128]
    - [19, 46.207]
  - - [20224, 12417, 1, 128]
    - [14, 45.968]
  - - [27904, 1024, 1, 128]
    - [25, 42.724]
  - - [3456, 512, 1, 128]
    - [78, 33.676]
  - - [13312, 512, 1, 128]
    - [54, 37.959]
  - - [26368, 4096, 1, 128]
    - [17, 45.563]
  - - [23296, 15617, 1, 128]
    - [19, 46.156]
  - - [26112, 10241, 1, 128]
    - [16, 45.807]
  - - [26240, 512, 1, 128]
    - [25, 39.854]
  - - [4352, 1024, 1, 128]
    - [19, 30.751]
  - - [10624, 2048, 1, 128]
    - [26, 41.133]
  - - [23808, 16001, 1, 128]
    - [17, 46.117]
  - - [17536, 9857, 1, 128]
    - [17, 45.598]
  - - [23936, 4096, 1, 128]
    - [19, 45.442]
  - - [1408, 128, 1, 128]
    - [83, 7.933]
  - - [14848, 512, 1, 128]
    - [26, 34.702]
  - - [8704, 4993, 1, 128]
    - [19, 44.036]
  - - [15104, 2048, 1, 128]
    - [15, 43.131]
  - - [2560, 512, 1, 128]
    - [79, 30.724]
  - - [27264, 8192, 1, 128]
    - [19, 46.344]
  - - [23808, 4096, 1, 128]
    - [28, 45.544]
  - - [14080, 6273, 1, 128]
    - [26, 43.219]
  - - [10112, 6529, 1, 128]
    - [26, 43.982]
  - - [27648, 512, 1, 128]
    - [30, 41.305]
  - - [20992, 128, 1, 128]
    - [30, 29.53]
  - - [15104, 128, 1, 128]
    - [22, 22.807]
  - - [7808, 128, 1, 128]
    - [78, 25.729]
  - - [3584, 1024, 1, 128]
    - [25, 26.305]
  - - [15232, 512, 1, 128]
    - [17, 34.983]
  - - [21376, 13697, 1, 128]
    - [19, 45.838]
  - - [11392, 7809, 1, 128]
    - [40, 44.52]
  - - [11904, 1024, 1, 128]
    - [17, 39.736]
  - - [28800, 2048, 1, 128]
    - [27, 43.549]
  - - [8960, 512, 1, 128]
    - [25, 31.586]
  - - [19456, 11649, 1, 128]
    - [19, 46.451]
  - - [11904, 128, 1, 128]
    - [84, 31.381]
  - - [18560, 512, 1, 128]
    - [19, 37.97]
  - - [6656, 128, 1, 128]
    - [80, 26.414]
  - - [17792, 2048, 1, 128]
    - [34, 43.056]
  - - [21632, 4096, 1, 128]
    - [17, 45.217]
  - - [25728, 4096, 1, 128]
    - [26, 45.444]
  - - [18048, 10241, 1, 128]
    - [21, 44.043]
  - - [1792, 1281, 1, 128]
    - [22, 25.763]
  - - [512, 385, 1, 128]
    - [85, 8.547]
  - - [26112, 512, 1, 128]
    - [15, 40.26]
  - - [16128, 1024, 1, 128]
    - [15, 39.928]
  - - [4480, 1024, 1, 128]
    - [19, 31.324]
  - - [14720, 4096, 1, 128]
    - [19, 44.948]
  - - [23552, 2048, 1, 128]
    - [34, 44.203]
  - - [22528, 512, 1, 128]
    - [34, 38.262]
  - - [22912, 128, 1, 128]
    - [30, 31.394]
  - - [25344, 1024, 1, 128]
    - [25, 42.112]
  - - [24064, 16257, 1, 128]
    - [38, 46.571]
  - - [9088, 5377, 1, 128]
    - [19, 44.163]
  - - [27776, 128, 1, 128]
    - [15, 35.926]
  - - [15616, 512, 1, 128]
    - [52, 35.235]
  - - [13568, 128, 1, 128]
    - [80, 32.943]
  - - [15488, 7681, 1, 128]
    - [17, 44.725]
  - - [20096, 512, 1, 128]
    - [30, 39.969]
  - - [24832, 4096, 1, 128]
    - [19, 45.784]
  - - [28800, 4096, 1, 128]
    - [25, 45.168]
  - - [11904, 4225, 1, 128]
    - [17, 43.69]
  - - [3968, 1024, 1, 128]
    - [25, 28.48]
  - - [6400, 2817, 1, 128]
    - [19, 40.365]
  - - [24576, 4096, 1, 128]
    - [19, 42.846]
  - - [9088, 128, 1, 128]
    - [84, 29.292]
  - - [17152, 4096, 1, 128]
    - [26, 45.392]
  - - [22528, 14721, 1, 128]
    - [17, 46.947]
  - - [27392, 2048, 1, 128]
    - [61, 42.968]
  - - [8832, 512, 1, 128]
    - [27, 30.98]
  - - [8960, 5249, 1, 128]
    - [42, 43.23]
  - - [3200, 1024, 1, 128]
    - [56, 33.876]
  - - [4736, 3073, 1, 128]
    - [19, 39.057]
  - - [28032, 2048, 1, 128]
    - [30, 44.151]
  - - [14592, 2048, 1, 128]
    - [26, 41.79]
  - - [13440, 1024, 1, 128]
    - [19, 41.263]
  - - [14464, 2048, 1, 128]
    - [30, 42.686]
  - - [6912, 2048, 1, 128]
    - [19, 42.332]
  - - [19584, 2048, 1, 128]
    - [30, 43.263]
  - - [17920, 128, 1, 128]
    - [22, 26.677]
  - - [19584, 11777, 1, 128]
    - [17, 45.594]
  - - [23936, 16129, 1, 128]
    - [19, 46.1]
  - - [10496, 6785, 1, 128]
    - [19, 44.614]
  - - [27648, 2048, 1, 128]
    - [15, 44.374]
  - - [23808, 128, 1, 128]
    - [15, 32.621]
  - - [20864, 2048, 1, 128]
    - [19, 43.381]
  - - [9088, 512, 1, 128]
    - [56, 31.659]
  - - [3584, 512, 1, 128]
    - [29, 22.053]
  - - [8576, 4993, 1, 128]
    - [17, 43.512]
  - - [3328, 1024, 1, 128]
    - [55, 34.549]
  - - [20608, 2048, 1, 128]
    - [43, 43.039]
  - - [23552, 15745, 1, 128]
    - [17, 46.73]
  - - [23424, 15617, 1, 128]
    - [35, 43.609]
  - - [21120, 512, 1, 128]
    - [17, 41.201]
  - - [6656, 512, 1, 128]
    - [15, 35.556]
  - - [12544, 128, 1, 128]
    - [84, 31.709]
  - - [24448, 8577, 1, 128]
    - [17, 45.437]
  - - [9984, 512, 1, 128]
    - [27, 34.496]
  - - [18304, 4096, 1, 128]
    - [26, 45.075]
  - - [17920, 512, 1, 128]
    - [29, 37.359]
  - - [12160, 4096, 1, 128]
    - [26, 45.148]
  - - [3968, 2433, 1, 128]
    - [25, 38.283]
  - - [27008, 4096, 1, 128]
    - [44, 45.118]
  - - [22272, 1024, 1, 128]
    - [17, 41.907]
  - - [14336, 512, 1, 128]
    - [19, 33.551]
  - - [18560, 10753, 1, 128]
    - [17, 45.476]
  - - [6272, 2048, 1, 128]
    - [25, 39.859]
  - - [12800, 1024, 1, 128]
    - [19, 40.056]
  - - [9600, 5889, 1, 128]
    - [19, 43.887]
  - - [13056, 128, 1, 128]
    - [80, 32.667]
  - - [7296, 2048, 1, 128]
    - [26, 39.711]
  - - [21376, 512, 1, 128]
    - [30, 36.706]
  - - [11904, 512, 1, 128]
    - [25, 35.236]
  - - [6400, 1024, 1, 128]
    - [19, 37.431]
  - - [27008, 1024, 1, 128]
    - [26, 42.529]
  - - [22400, 14721, 1, 128]
    - [14, 45.543]
  - - [6272, 1024, 1, 128]
    - [56, 36.799]
  - - [17408, 128, 1, 128]
    - [30, 25.811]
  - - [26624, 10625, 1, 128]
    - [19, 46.721]
  - - [22400, 1024, 1, 128]
    - [26, 41.793]
  - - [18304, 10625, 1, 128]
    - [17, 45.509]
  - - [15872, 1024, 1, 128]
    - [22, 40.799]
  - - [21120, 128, 1, 128]
    - [43, 29.43]
  - - [22784, 4096, 1, 128]
    - [22, 45.163]
  - - [25728, 9857, 1, 128]
    - [19, 45.466]
  - - [16256, 1024, 1, 128]
    - [17, 39.961]
  - - [18560, 4096, 1, 128]
    - [17, 45.201]
  - - [7936, 4225, 1, 128]
    - [19, 43.039]
  - - [7680, 3969, 1, 128]
    - [26, 42.949]
  - - [9472, 2048, 1, 128]
    - [30, 41.446]
  - - [28160, 128, 1, 128]
    - [54, 35.981]
  - - [18816, 512, 1, 128]
    - [27, 38.09]
  - - [9856, 512, 1, 128]
    - [26, 33.895]
  - - [17664, 9857, 1, 128]
    - [28, 45.257]
  - - [27392, 128, 1, 128]
    - [27, 35.553]
  - - [24448, 2048, 1, 128]
    - [19, 43.225]
  - - [7808, 512, 1, 128]
    - [19, 27.757]
  - - [13952, 512, 1, 128]
    - [17, 39.585]
  - - [24576, 512, 1, 128]
    - [17, 39.435]
  - - [27520, 128, 1, 128]
    - [42, 35.463]
  - - [26496, 512, 1, 128]
    - [15, 40.326]
  - - [8576, 512, 1, 128]
    - [30, 30.226]
  - - [11648, 512, 1, 128]
    - [15, 34.583]
  - - [17408, 2048, 1, 128]
    - [15, 43.526]
  - - [17920, 10241, 1, 128]
    - [16, 45.751]
  - - [16384, 1024, 1, 128]
    - [19, 37.324]
  - - [6016, 2048, 1, 128]
    - [19, 40.14]
  - - [9728, 512, 1, 128]
    - [26, 33.763]
  - - [19712, 128, 1, 128]
    - [25, 28.104]
  - - [26112, 1024, 1, 128]
    - [15, 42.492]
  - - [16768, 128, 1, 128]
    - [29, 24.867]
  - - [8960, 1024, 1, 128]
    - [17, 37.168]
  - - [6784, 128, 1, 128]
    - [78, 26.778]
  - - [12800, 4993, 1, 128]
    - [42, 44.444]
  - - [6144, 2561, 1, 128]
    - [26, 39.951]
  - - [26880, 10881, 1, 128]
    - [28, 45.591]
  - - [12928, 1024, 1, 128]
    - [19, 40.278]
  - - [7040, 3457, 1, 128]
    - [26, 42.449]
  - - [15744, 4096, 1, 128]
    - [19, 45.477]
  - - [20096, 4096, 1, 128]
    - [25, 44.898]
  - - [21760, 128, 1, 128]
    - [22, 30.145]
  - - [7936, 2048, 1, 128]
    - [17, 40.79]
  - - [24448, 8192, 1, 128]
    - [19, 46.582]
  - - [21120, 2048, 1, 128]
    - [24, 42.844]
  - - [12160, 1024, 1, 128]
    - [19, 40.129]
  - - [7168, 3457, 1, 128]
    - [26, 41.781]
  - - [15232, 7553, 1, 128]
    - [28, 44.833]
  - - [26624, 1024, 1, 128]
    - [26, 42.803]
  - - [25344, 2048, 1, 128]
    - [19, 43.168]
  - - [12544, 4865, 1, 128]
    - [19, 44.396]
  - - [21120, 4096, 1, 128]
    - [42, 44.469]
  - - [20224, 128, 1, 128]
    - [27, 28.834]
  - - [14592, 4096, 1, 128]
    - [22, 43.855]
  - - [16256, 8577, 1, 128]
    - [19, 45.045]
  - - [24192, 4096, 1, 128]
    - [19, 45.486]
  - - [21248, 1024, 1, 128]
    - [19, 41.174]
  - - [25216, 1024, 1, 128]
    - [17, 42.089]
  - - [5888, 2177, 1, 128]
    - [19, 39.11]
  - - [21504, 1024, 1, 128]
    - [19, 41.566]
  - - [17536, 1024, 1, 128]
    - [19, 42.672]
  - - [9728, 2048, 1, 128]
    - [30, 41.96]
  - - [13952, 6273, 1, 128]
    - [19, 44.621]
  - - [28800, 512, 1, 128]
    - [29, 38.717]
  - - [2304, 1793, 1, 128]
    - [19, 28.752]
  - - [12416, 128, 1, 128]
    - [80, 31.601]
  - - [20224, 1024, 1, 128]
    - [26, 42.303]
  - - [22144, 128, 1, 128]
    - [25, 30.683]
  - - [22784, 1024, 1, 128]
    - [19, 42.032]
  - - [27136, 4096, 1, 128]
    - [26, 46.044]
  - - [27264, 512, 1, 128]
    - [19, 39.551]
  - - [26240, 10241, 1, 128]
    - [17, 41.87]
  - - [27904, 4096, 1, 128]
    - [44, 45.283]
  - - [21504, 128, 1, 128]
    - [25, 30.135]
  - - [3712, 2177, 1, 128]
    - [26, 35.942]
  - - [18432, 1024, 1, 128]
    - [17, 41.126]
  - - [28672, 4096, 1, 128]
    - [19, 46.523]
  - - [25344, 4096, 1, 128]
    - [42, 45.027]
  - - [26880, 512, 1, 128]
    - [30, 40.713]
  - - [21888, 2048, 1, 128]
    - [62, 36.567]
  - - [1792, 128, 1, 128]
    - [83, 10.02]
  - - [6016, 1024, 1, 128]
    - [26, 35.431]
  - - [15104, 7425, 1, 128]
    - [19, 45.481]
  - - [22016, 2048, 1, 128]
    - [29, 43.988]
  - - [13952, 4096, 1, 128]
    - [19, 44.891]
  - - [20992, 4096, 1, 128]
    - [26, 45.563]
  - - [8064, 4481, 1, 128]
    - [17, 42.758]
  - - [12672, 4096, 1, 128]
    - [19, 44.756]
  - - [20096, 12289, 1, 128]
    - [17, 45.138]
  - - [14848, 2048, 1, 128]
    - [17, 43.185]
  - - [23168, 512, 1, 128]
    - [30, 38.602]
  - - [7680, 128, 1, 128]
    - [78, 25.42]
  - - [13312, 1024, 1, 128]
    - [17, 40.722]
  - - [10624, 1024, 1, 128]
    - [17, 36.621]
  - - [3840, 512, 1, 128]
    - [19, 22.912]
  - - [22144, 14337, 1, 128]
    - [17, 45.549]
  - - [3200, 128, 1, 128]
    - [122, 16.517]
  - - [25472, 9473, 1, 128]
    - [17, 45.643]
  - - [16768, 9089, 1, 128]
    - [17, 45.453]
  - - [12288, 2048, 1, 128]
    - [19, 42.3]
  - - [20608, 512, 1, 128]
    - [52, 40.424]
  - - [2816, 1024, 1, 128]
    - [22, 31.092]
  - - [7552, 1024, 1, 128]
    - [19, 34.968]
  - - [5120, 3457, 1, 128]
    - [19, 40.119]
  - - [25216, 2048, 1, 128]
    - [15, 43.233]
  - - [12672, 4865, 1, 128]
    - [19, 43.916]
  - - [10880, 2048, 1, 128]
    - [26, 40.607]
  - - [18176, 512, 1, 128]
    - [19, 37.436]
  - - [8320, 4609, 1, 128]
    - [19, 42.483]
  - - [16000, 4096, 1, 128]
    - [26, 44.862]
  - - [22144, 2048, 1, 128]
    - [15, 43.669]
  - - [22784, 512, 1, 128]
    - [25, 38.3]
  - - [4096, 2561, 1, 128]
    - [42, 36.95]
  - - [24576, 2048, 1, 128]
    - [19, 41.044]
  - - [26624, 4096, 1, 128]
    - [17, 46.684]
  - - [18560, 2048, 1, 128]
    - [30, 43.454]
  - - [19584, 128, 1, 128]
    - [34, 28.304]
  - - [23936, 2048, 1, 128]
    - [30, 43.931]
  - - [23552, 512, 1, 128]
    - [25, 39.286]
  - - [12032, 4096, 1, 128]
    - [26, 44.644]
  - - [3840, 2305, 1, 128]
    - [25, 36.194]
  - - [25088, 128, 1, 128]
    - [15, 33.681]
  - - [16640, 8833, 1, 128]
    - [19, 46.213]
  - - [896, 128, 1, 128]
    - [83, 5.167]
  - - [17280, 2048, 1, 128]
    - [27, 43.519]
  - - [16896, 2048, 1, 128]
    - [15, 43.271]
  - - [22656, 128, 1, 128]
    - [15, 31.094]
  - - [25728, 8192, 1, 128]
    - [19, 46.455]
  - - [16128, 128, 1, 128]
    - [29, 24.353]
  - - [3840, 1024, 1, 128]
    - [19, 27.77]
  - - [2944, 512, 1, 128]
    - [78, 31.266]
  - - [24064, 1024, 1, 128]
    - [17, 42.816]
  - - [896, 385, 1, 128]
    - [123, 13.814]
  - - [8064, 128, 1, 128]
    - [84, 26.572]
  - - [12416, 1024, 1, 128]
    - [42, 39.02]
  - - [20608, 128, 1, 128]
    - [30, 28.874]
  - - [2944, 1024, 1, 128]
    - [42, 31.974]
  - - [6656, 2048, 1, 128]
    - [19, 40.68]
  - - [24064, 128, 1, 128]
    - [27, 32.609]
  - - [15744, 7937, 1, 128]
    - [17, 45.436]
  - - [2688, 1024, 1, 128]
    - [16, 30.021]
  - - [24192, 8193, 1, 128]
    - [19, 44.945]
  - - [24320, 4096, 1, 128]
    - [17, 45.703]
  - - [24576, 8705, 1, 128]
    - [14, 42.522]
  - - [13824, 1024, 1, 128]
    - [17, 41.992]
  - - [27776, 512, 1, 128]
    - [30, 41.391]
  - - [10240, 128, 1, 128]
    - [79, 30.977]
  - - [26240, 10369, 1, 128]
    - [17, 41.875]
  - - [16512, 4096, 1, 128]
    - [17, 42.737]
  - - [9856, 6145, 1, 128]
    - [17, 42.117]
  - - [27392, 1024, 1, 128]
    - [30, 40.737]
  - - [14976, 1024, 1, 128]
    - [19, 40.146]
  - - [1280, 512, 1, 128]
    - [83, 22.362]
  - - [6528, 2817, 1, 128]
    - [19, 40.738]
  - - [12288, 512, 1, 128]
    - [34, 35.624]
  - - [5248, 512, 1, 128]
    - [54, 29.412]
  - - [28544, 4096, 1, 128]
    - [25, 45.444]
  - - [21248, 13569, 1, 128]
    - [21, 45.898]
  - - [26112, 2048, 1, 128]
    - [15, 44.634]
  - - [14208, 6401, 1, 128]
    - [19, 44.543]
  - - [13952, 128, 1, 128]
    - [84, 33.545]
  - - [2304, 1665, 1, 128]
    - [25, 26.796]
  - - [6912, 1024, 1, 128]
    - [19, 39.297]
  - - [28672, 1024, 1, 128]
    - [26, 42.181]
  - - [14592, 6913, 1, 128]
    - [22, 43.881]
  - - [24704, 1024, 1, 128]
    - [30, 39.923]
  - - [22400, 512, 1, 128]
    - [19, 37.762]
  - - [23424, 4096, 1, 128]
    - [26, 43.442]
  - - [24832, 128, 1, 128]
    - [30, 33.52]
  - - [23680, 2048, 1, 128]
    - [17, 42.883]
  - - [25984, 9985, 1, 128]
    - [21, 45.49]
  - - [15360, 512, 1, 128]
    - [15, 35.422]
  - - [21376, 2048, 1, 128]
    - [27, 43.564]
  - - [16128, 2048, 1, 128]
    - [30, 43.058]
  - - [15872, 512, 1, 128]
    - [30, 36.255]
  - - [3072, 128, 1, 128]
    - [86, 16.313]
  - - [27520, 4096, 1, 128]
    - [19, 45.446]
  - - [25216, 4096, 1, 128]
    - [26, 45.281]
  - - [28672, 12673, 1, 128]
    - [17, 46.81]
  - - [28288, 512, 1, 128]
    - [25, 38.591]
  - - [22400, 4096, 1, 128]
    - [28, 45.103]
  - - [25344, 9345, 1, 128]
    - [16, 45.119]
  - - [9984, 128, 1, 128]
    - [84, 30.964]
  - - [28416, 1024, 1, 128]
    - [17, 42.268]
  - - [27008, 8192, 1, 128]
    - [38, 46.31]
  - - [13184, 1024, 1, 128]
    - [19, 40.381]
  - - [10240, 512, 1, 128]
    - [26, 34.804]
  - - [3456, 128, 1, 128]
    - [83, 17.354]
  - - [16000, 8321, 1, 128]
    - [19, 45.088]
  - - [27520, 1024, 1, 128]
    - [27, 42.634]
  - - [25088, 1024, 1, 128]
    - [17, 42.278]
  - - [6784, 512, 1, 128]
    - [15, 35.653]
  - - [18432, 10625, 1, 128]
    - [17, 46.727]
  - - [16128, 4096, 1, 128]
    - [19, 45.42]
  - - [26880, 11009, 1, 128]
    - [19, 45.732]
  - - [28800, 12801, 1, 128]
    - [19, 45.526]
  - - [12288, 4096, 1, 128]
    - [19, 45.625]
  - - [20096, 12417, 1, 128]
    - [19, 45.622]
  - - [1920, 128, 1, 128]
    - [86, 10.498]
  - - [13056, 2048, 1, 128]
    - [17, 42.641]
  - - [384, 385, 1, 128]
    - [124, 6.362]
  - - [9088, 1024, 1, 128]
    - [15, 37.203]
  - - [6784, 1024, 1, 128]
    - [19, 39.104]
  - - [21760, 4096, 1, 128]
    - [25, 45.548]
  - - [27008, 11009, 1, 128]
    - [38, 45.472]
  - - [14208, 1024, 1, 128]
    - [17, 39.018]
  - - [25600, 512, 1, 128]
    - [20, 39.615]
  - - [23680, 1024, 1, 128]
    - [17, 42.082]
  - - [28160, 8192, 1, 128]
    - [21, 46.763]
  - - [22016, 4096, 1, 128]
    - [21, 45.788]
  - - [18688, 4096, 1, 128]
    - [17, 45.475]
  - - [10752, 1024, 1, 128]
    - [19, 37.471]
  - - [2432, 128, 1, 128]
    - [125, 13.103]
  - - [7296, 512, 1, 128]
    - [27, 26.543]
  - - [19200, 4096, 1, 128]
    - [19, 45.06]
  - - [4608, 2945, 1, 128]
    - [25, 41.341]
  - - [18816, 11009, 1, 128]
    - [19, 45.335]
  - - [9600, 1024, 1, 128]
    - [56, 38.743]
  - - [7168, 512, 1, 128]
    - [15, 26.137]
  - - [11904, 4097, 1, 128]
    - [17, 43.378]
  - - [17920, 1024, 1, 128]
    - [17, 40.839]
  - - [11520, 7809, 1, 128]
    - [26, 44.699]
  - - [22784, 14977, 1, 128]
    - [16, 46.074]
  - - [13696, 1024, 1, 128]
    - [17, 41.476]
  - - [15104, 1024, 1, 128]
    - [17, 40.371]
  - - [25216, 512, 1, 128]
    - [26, 39.351]
  - - [5376, 512, 1, 128]
    - [22, 29.296]
  - - [17408, 4096, 1, 128]
    - [17, 45.895]
  - - [25728, 512, 1, 128]
    - [27, 39.372]
  - - [896, 512, 1, 128]
    - [88, 16.743]
  - - [6912, 3329, 1, 128]
    - [25, 41.631]
  - - [22016, 512, 1, 128]
    - [22, 37.306]
  - - [22144, 4096, 1, 128]
    - [25, 45.107]
  - - [10368, 128, 1, 128]
    - [78, 31.493]
  - - [23296, 2048, 1, 128]
    - [30, 43.486]
  - - [17920, 10113, 1, 128]
    - [44, 46.032]
  - - [14848, 4096, 1, 128]
    - [17, 45.374]
  - - [26112, 128, 1, 128]
    - [15, 34.81]
  - - [28032, 8192, 1, 128]
    - [17, 46.536]
  - - [20096, 128, 1, 128]
    - [24, 28.324]
  - - [15360, 4096, 1, 128]
    - [17, 45.83]
  - - [3328, 128, 1, 128]
    - [88, 17.059]
  - - [25472, 512, 1, 128]
    - [30, 39.729]
  - - [18304, 128, 1, 128]
    - [15, 26.658]
  - - [20352, 12545, 1, 128]
    - [19, 45.911]
  - - [26624, 10753, 1, 128]
    - [17, 46.719]
  - - [20480, 2048, 1, 128]
    - [17, 43.517]
  - - [26496, 10497, 1, 128]
    - [16, 45.036]
  - - [22400, 128, 1, 128]
    - [30, 30.98]
  - - [9216, 5505, 1, 128]
    - [14, 44.431]
  - - [24064, 8193, 1, 128]
    - [21, 45.758]
  - - [4224, 128, 1, 128]
    - [88, 18.782]
  - - [6656, 3073, 1, 128]
    - [17, 41.59]
  - - [10880, 1024, 1, 128]
    - [17, 36.012]
  - - [23808, 512, 1, 128]
    - [15, 39.24]
  - - [15488, 1024, 1, 128]
    - [26, 40.525]
  - - [24704, 8705, 1, 128]
    - [17, 44.615]
  - - [12416, 4609, 1, 128]
    - [22, 43.37]
  - - [3712, 1024, 1, 128]
    - [26, 26.643]
  - - [25856, 8192, 1, 128]
    - [28, 46.514]
  - - [8320, 1024, 1, 128]
    - [42, 35.307]
  - - [16256, 512, 1, 128]
    - [30, 34.925]
  - - [18944, 2048, 1, 128]
    - [27, 43.781]
  - - [23168, 4096, 1, 128]
    - [19, 45.243]
  - - [15616, 2048, 1, 128]
    - [17, 43.257]
  - - [24320, 512, 1, 128]
    - [22, 39.869]
  - - [2688, 1025, 1, 128]
    - [22, 29.542]
  - - [12800, 5121, 1, 128]
    - [16, 43.607]
  - - [5120, 128, 1, 128]
    - [86, 21.595]
  - - [4352, 512, 1, 128]
    - [25, 25.253]
  - - [24576, 8192, 1, 128]
    - [28, 43.71]
  - - [8320, 512, 1, 128]
    - [26, 27.956]
  - - [12160, 4481, 1, 128]
    - [19, 43.502]
  - - [2560, 1025, 1, 128]
    - [42, 28.887]
  - - [19072, 1024, 1, 128]
    - [26, 41.458]
  - - [2816, 1153, 1, 128]
    - [17, 33.809]
  - - [6912, 128, 1, 128]
    - [84, 27.43]
  - - [9088, 2048, 1, 128]
    - [17, 40.832]
  - - [26368, 8192, 1, 128]
    - [17, 46.613]
  - - [17408, 9729, 1, 128]
    - [17, 46.24]
  - - [18816, 4096, 1, 128]
    - [17, 45.154]
  - - [4480, 512, 1, 128]
    - [42, 25.95]
  - - [11648, 128, 1, 128]
    - [78, 30.816]
  - - [1536, 897, 1, 128]
    - [80, 27.683]
  - - [11136, 1024, 1, 128]
    - [15, 37.354]
  - - [8704, 1024, 1, 128]
    - [34, 38.492]
  - - [19072, 2048, 1, 128]
    - [15, 43.381]
  - - [25856, 1024, 1, 128]
    - [30, 42.188]
  - - [7552, 3841, 1, 128]
    - [19, 42.352]
  - - [23296, 128, 1, 128]
    - [15, 31.743]
  - - [23424, 512, 1, 128]
    - [34, 38.672]
  - - [26368, 10497, 1, 128]
    - [19, 45.865]
  - - [18560, 1024, 1, 128]
    - [19, 40.909]
  - - [8192, 128, 1, 128]
    - [79, 26.405]
  - - [27776, 11905, 1, 128]
    - [17, 45.554]
  - - [18688, 1024, 1, 128]
    - [15, 41.268]
  - - [21248, 4096, 1, 128]
    - [26, 45.353]
  - - [16256, 8449, 1, 128]
    - [19, 44.905]
  - - [1920, 1409, 1, 128]
    - [19, 28.905]
  - - [24704, 4096, 1, 128]
    - [43, 44.774]
  - - [13824, 6145, 1, 128]
    - [19, 44.647]
  - - [6528, 512, 1, 128]
    - [26, 34.74]
  - - [21376, 128, 1, 128]
    - [15, 29.786]
  - - [11264, 1024, 1, 128]
    - [17, 38.262]
  - - [4352, 2817, 1, 128]
    - [26, 38.359]
  - - [22272, 4096, 1, 128]
    - [14, 45.315]
  - - [27264, 11265, 1, 128]
    - [17, 45.335]
  - - [28160, 1024, 1, 128]
    - [22, 43.105]
  - - [16256, 128, 1, 128]
    - [29, 24.011]
  - - [18688, 2048, 1, 128]
    - [30, 43.547]
  - - [9600, 6017, 1, 128]
    - [25, 44.038]
  - - [23552, 1024, 1, 128]
    - [17, 42.519]
  - - [8576, 128, 1, 128]
    - [84, 27.764]
  - - [20992, 13185, 1, 128]
    - [19, 46.298]
  - - [20992, 1024, 1, 128]
    - [17, 42.981]
  - - [14720, 512, 1, 128]
    - [27, 34.106]
  - - [28032, 1024, 1, 128]
    - [17, 43.043]
  - - [20352, 2048, 1, 128]
    - [15, 43.425]
  - - [15360, 128, 1, 128]
    - [30, 23.052]
  - - [8448, 2048, 1, 128]
    - [19, 41.013]
  - - [6272, 2689, 1, 128]
    - [26, 41.19]
  - - [7808, 4097, 1, 128]
    - [17, 42.053]
  - - [25472, 128, 1, 128]
    - [15, 33.95]
  - - [12288, 4481, 1, 128]
    - [19, 44.377]
  - - [28416, 4096, 1, 128]
    - [25, 45.681]
  - - [2176, 128, 1, 128]
    - [86, 11.724]
  - - [21760, 2048, 1, 128]
    - [19, 43.441]
  - - [21376, 1024, 1, 128]
    - [19, 40.864]
  - - [13696, 2048, 1, 128]
    - [19, 41.689]
  - - [28288, 12417, 1, 128]
    - [17, 45.754]
  - - [5632, 512, 1, 128]
    - [42, 31.392]
  - - [22016, 1024, 1, 128]
    - [42, 41.391]
  - - [25216, 128, 1, 128]
    - [15, 33.676]
  - - [25216, 8192, 1, 128]
    - [14, 46.249]
  - - [12032, 128, 1, 128]
    - [80, 30.73]
  - - [6144, 2048, 1, 128]
    - [19, 39.869]
  - - [23680, 128, 1, 128]
    - [19, 32.26]
  - - [15744, 128, 1, 128]
    - [15, 23.537]
  - - [3968, 512, 1, 128]
    - [42, 23.346]
  - - [16512, 1024, 1, 128]
    - [47, 34.182]
  - - [1536, 128, 1, 128]
    - [85, 8.857]
  - - [25984, 4096, 1, 128]
    - [21, 45.164]
  - - [19456, 512, 1, 128]
    - [25, 39.313]
  - - [9984, 1024, 1, 128]
    - [19, 39.768]
  - - [14080, 6401, 1, 128]
    - [42, 43.172]
  - - [20736, 2048, 1, 128]
    - [30, 43.746]
  - - [4224, 2689, 1, 128]
    - [22, 37.664]
  - - [13696, 512, 1, 128]
    - [26, 38.896]
  - - [17280, 1024, 1, 128]
    - [26, 42.398]
  - - [10752, 128, 1, 128]
    - [84, 29.285]
  - - [1536, 512, 1, 128]
    - [78, 24.918]
  - - [25728, 2048, 1, 128]
    - [17, 43.634]
  - - [9472, 128, 1, 128]
    - [80, 29.878]
  - - [7168, 3585, 1, 128]
    - [19, 41.883]
  - - [14720, 1024, 1, 128]
    - [19, 39.831]
  - - [25728, 128, 1, 128]
    - [27, 34.113]
  - - [14976, 128, 1, 128]
    - [15, 22.567]
  - - [24832, 1024, 1, 128]
    - [30, 41.954]
  - - [14080, 512, 1, 128]
    - [25, 39.158]
  - - [17152, 1024, 1, 128]
    - [17, 42.312]
  - - [19072, 512, 1, 128]
    - [42, 38.216]
  - - [21120, 1024, 1, 128]
    - [19, 42.256]
  - - [4864, 128, 1, 128]
    - [83, 20.996]
  - - [7936, 512, 1, 128]
    - [19, 28.619]
  - - [21248, 13441, 1, 128]
    - [19, 45.979]
  - - [12160, 2048, 1, 128]
    - [30, 42.781]
  - - [19712, 11905, 1, 128]
    - [44, 44.366]
  - - [23296, 1024, 1, 128]
    - [26, 42.225]
  - - [24832, 8961, 1, 128]
    - [21, 45.757]
  - - [13568, 2048, 1, 128]
    - [30, 43.078]
  - - [13696, 4096, 1, 128]
    - [26, 43.197]
  - - [5888, 128, 1, 128]
    - [78, 24.145]
  - - [10112, 2048, 1, 128]
    - [17, 42.288]
  - - [21632, 13953, 1, 128]
    - [14, 45.908]
  - - [19328, 512, 1, 128]
    - [30, 38.887]
  - - [6272, 512, 1, 128]
    - [30, 33.934]
  - - [4864, 3201, 1, 128]
    - [26, 41.106]
  - - [15232, 4096, 1, 128]
    - [19, 44.986]
  - - [23040, 4096, 1, 128]
    - [26, 45.59]
  - - [2816, 1281, 1, 128]
    - [17, 26.313]
  - - [8960, 128, 1, 128]
    - [80, 28.755]
  - - [9472, 1024, 1, 128]
    - [26, 38.481]
  - - [27648, 11777, 1, 128]
    - [17, 46.371]
  - - [28416, 2048, 1, 128]
    - [19, 43.52]
  - - [13952, 6145, 1, 128]
    - [25, 44.191]
  - - [13952, 1024, 1, 128]
    - [19, 41.942]
  - - [12544, 2048, 1, 128]
    - [19, 42.423]
  - - [10624, 7041, 1, 128]
    - [19, 44.381]
  - - [24704, 2048, 1, 128]
    - [20, 43.324]
  - - [17280, 9473, 1, 128]
    - [28, 45.407]
  - - [25088, 9217, 1, 128]
    - [16, 45.765]
  - - [10240, 6657, 1, 128]
    - [19, 45.524]
  - - [12800, 4096, 1, 128]
    - [42, 44.802]
  - - [17792, 1024, 1, 128]
    - [19, 40.407]
  - - [12160, 128, 1, 128]
    - [80, 31.828]
  - - [16512, 128, 1, 128]
    - [30, 24.389]
  - - [25856, 512, 1, 128]
    - [26, 39.671]
  - - [8576, 4865, 1, 128]
    - [17, 43.84]
  - - [25984, 1024, 1, 128]
    - [24, 41.903]
  - - [512, 128, 1, 128]
    - [123, 2.93]
  - - [10112, 128, 1, 128]
    - [80, 31.099]
  - - [28288, 2048, 1, 128]
    - [15, 44.215]
  - - [1152, 641, 1, 128]
    - [79, 23.269]
  - - [17920, 4096, 1, 128]
    - [22, 45.539]
  - - [2560, 1921, 1, 128]
    - [26, 33.5]
  - - [24704, 8833, 1, 128]
    - [19, 44.724]
  - - [3200, 512, 1, 128]
    - [78, 32.245]
  - - [6656, 2945, 1, 128]
    - [22, 41.037]
  - - [12672, 4993, 1, 128]
    - [19, 43.969]
  - - [4608, 1024, 1, 128]
    - [19, 32.411]
  - - [25856, 9985, 1, 128]
    - [14, 45.586]
  - - [23808, 2048, 1, 128]
    - [15, 43.971]
  - - [9728, 6145, 1, 128]
    - [25, 44.553]
  - - [28416, 12417, 1, 128]
    - [19, 45.628]
  - - [14464, 4096, 1, 128]
    - [19, 44.862]
  - - [21888, 128, 1, 128]
    - [29, 30.215]
  - - [23680, 15873, 1, 128]
    - [38, 45.366]
  - - [22144, 1024, 1, 128]
    - [26, 41.574]
  - - [17664, 512, 1, 256]
    - [15, 56.371]
  - - [25600, 1024, 1, 256]
    - [34, 69.238]
  - - [28928, 512, 1, 256]
    - [30, 62.502]
  - - [15104, 512, 1, 256]
    - [15, 55.153]
  - - [38912, 1024, 1, 256]
    - [15, 70.324]
  - - [34304, 8192, 1, 256]
    - [32, 74.829]
  - - [23552, 1024, 1, 256]
    - [30, 68.047]
  - - [39424, 23552, 1, 256]
    - [31, 75.106]
  - - [9472, 1024, 1, 256]
    - [30, 59.523]
  - - [28928, 13056, 1, 256]
    - [21, 74.869]
  - - [42496, 1024, 1, 256]
    - [24, 70.355]
  - - [18432, 1024, 1, 256]
    - [30, 66.708]
  - - [40192, 24320, 1, 256]
    - [19, 74.909]
  - - [33280, 17152, 1, 256]
    - [16, 75.787]
  - - [27904, 512, 1, 256]
    - [19, 65.331]
  - - [39680, 8192, 1, 256]
    - [17, 74.356]
  - - [28160, 8192, 1, 256]
    - [19, 74.637]
  - - [25088, 8192, 1, 256]
    - [16, 74.701]
  - - [23040, 15360, 1, 256]
    - [17, 75.671]
  - - [19712, 11776, 1, 256]
    - [31, 74.182]
  - - [43520, 27648, 1, 256]
    - [31, 74.947]
  - - [44544, 4096, 1, 256]
    - [31, 73.451]
  - - [20224, 4096, 1, 256]
    - [19, 72.535]
  - - [31744, 4096, 1, 256]
    - [20, 73.158]
  - - [33024, 16896, 1, 256]
    - [32, 75.252]
  - - [32768, 8192, 1, 256]
    - [63, 58.919]
  - - [42752, 4096, 1, 256]
    - [19, 72.964]
  - - [19968, 512, 1, 256]
    - [27, 61.638]
  - - [10496, 512, 1, 256]
    - [26, 55.906]
  - - [36864, 4096, 1, 256]
    - [40, 72.634]
  - - [12288, 1024, 1, 256]
    - [17, 62.574]
  - - [22784, 14848, 1, 256]
    - [20, 75.154]
  - - [17152, 9472, 1, 256]
    - [22, 74.859]
  - - [31488, 1024, 1, 256]
    - [15, 69.495]
  - - [25344, 1024, 1, 256]
    - [24, 67.149]
  - - [33536, 512, 1, 256]
    - [30, 65.285]
  - - [28672, 8192, 1, 256]
    - [19, 74.718]
  - - [15104, 7168, 1, 256]
    - [19, 73.585]
  - - [38144, 22272, 1, 256]
    - [28, 74.833]
  - - [25344, 4096, 1, 256]
    - [33, 72.024]
  - - [6400, 2560, 1, 256]
    - [25, 64.98]
  - - [21248, 13568, 1, 256]
    - [17, 75.179]
  - - [2304, 1536, 1, 256]
    - [26, 53.512]
  - - [20992, 512, 1, 256]
    - [19, 63.931]
  - - [3072, 1024, 1, 256]
    - [26, 49.378]
  - - [36864, 20736, 1, 256]
    - [17, 75.147]
  - - [39936, 24064, 1, 256]
    - [17, 75.501]
  - - [2816, 512, 1, 256]
    - [87, 42.312]
  - - [37888, 512, 1, 256]
    - [15, 66.052]
  - - [39680, 1024, 1, 256]
    - [17, 69.234]
  - - [35584, 19712, 1, 256]
    - [14, 74.82]
  - - [25600, 9728, 1, 256]
    - [17, 75.44]
  - - [2816, 1024, 1, 256]
    - [42, 46.28]
  - - [13056, 1024, 1, 256]
    - [15, 62.574]
  - - [39680, 4096, 1, 256]
    - [17, 72.728]
  - - [4864, 3072, 1, 256]
    - [25, 64.205]
  - - [27648, 11776, 1, 256]
    - [19, 75.73]
  - - [13056, 4096, 1, 256]
    - [17, 72.06]
  - - [4096, 2304, 1, 256]
    - [25, 59.057]
  - - [34048, 1024, 1, 256]
    - [29, 68.468]
  - - [6400, 512, 1, 256]
    - [30, 51.306]
  - - [15872, 4096, 1, 256]
    - [17, 72.281]
  - - [29440, 1024, 1, 256]
    - [15, 68.859]
  - - [7424, 512, 1, 256]
    - [30, 41.766]
  - - [19200, 4096, 1, 256]
    - [17, 72.099]
  - - [37376, 21504, 1, 256]
    - [31, 75.215]
  - - [37888, 1024, 1, 256]
    - [27, 70.228]
  - - [40704, 24832, 1, 256]
    - [19, 74.84]
  - - [26112, 1024, 1, 256]
    - [24, 69.213]
  - - [25088, 8960, 1, 256]
    - [42, 75.437]
  - - [27136, 512, 1, 256]
    - [19, 64.388]
  - - [4608, 512, 1, 256]
    - [19, 38.941]
  - - [31232, 8192, 1, 256]
    - [31, 74.803]
  - - [33024, 512, 1, 256]
    - [26, 60.923]
  - - [27648, 512, 1, 256]
    - [60, 65.08]
  - - [28928, 4096, 1, 256]
    - [19, 72.464]
  - - [44544, 2048, 1, 256]
    - [31, 72.039]
  - - [43776, 27648, 1, 256]
    - [31, 74.437]
  - - [19456, 4096, 1, 256]
    - [17, 72.834]
  - - [33536, 17664, 1, 256]
    - [16, 75.192]
  - - [35328, 4096, 1, 256]
    - [33, 73.657]
  - - [13312, 5376, 1, 256]
    - [25, 74.004]
  - - [32768, 1024, 1, 256]
    - [28, 59.341]
  - - [39168, 4096, 1, 256]
    - [31, 73.18]
  - - [15616, 7936, 1, 256]
    - [17, 74.429]
  - - [41472, 25600, 1, 256]
    - [28, 74.75]
  - - [14592, 4096, 1, 256]
    - [22, 70.479]
  - - [37632, 21760, 1, 256]
    - [17, 74.813]
  - - [37376, 21248, 1, 256]
    - [17, 75.33]
  - - [14336, 6656, 1, 256]
    - [19, 74.692]
  - - [36608, 20480, 1, 256]
    - [31, 74.602]
  - - [32256, 16384, 1, 256]
    - [33, 75.223]
  - - [44544, 28416, 1, 256]
    - [28, 75.158]
  - - [26112, 512, 1, 256]
    - [26, 62.957]
  - - [41216, 25344, 1, 256]
    - [19, 74.919]
  - - [16640, 512, 1, 256]
    - [35, 56.008]
  - - [30464, 14336, 1, 256]
    - [31, 73.987]
  - - [13312, 4096, 1, 256]
    - [19, 72.101]
  - - [22528, 1024, 1, 256]
    - [30, 68.222]
  - - [5632, 1024, 1, 256]
    - [18, 50.714]
  - - [27392, 1024, 1, 256]
    - [21, 64.891]
  - - [27648, 8192, 1, 256]
    - [17, 75.078]
  - - [26368, 1024, 1, 256]
    - [15, 68.193]
  - - [43776, 4096, 1, 256]
    - [20, 73.189]
  - - [23552, 15872, 1, 256]
    - [17, 76.241]
  - - [26624, 10496, 1, 256]
    - [19, 75.778]
  - - [27392, 8192, 1, 256]
    - [20, 74.062]
  - - [17408, 9728, 1, 256]
    - [17, 75.456]
  - - [16896, 9216, 1, 256]
    - [19, 74.885]
  - - [26880, 11008, 1, 256]
    - [19, 74.818]
  - - [31488, 512, 1, 256]
    - [17, 64.98]
  - - [14336, 6400, 1, 256]
    - [26, 74.846]
  - - [17152, 512, 1, 256]
    - [30, 60.79]
  - - [7168, 512, 1, 256]
    - [26, 41.029]
  - - [41984, 26112, 1, 256]
    - [14, 75.545]
  - - [11776, 512, 1, 256]
    - [30, 52.738]
  - - [16128, 8448, 1, 256]
    - [25, 74.56]
  - - [11520, 1024, 1, 256]
    - [17, 61.695]
  - - [27904, 1024, 1, 256]
    - [29, 68.722]
  - - [37888, 8192, 1, 256]
    - [19, 74.991]
  - - [20480, 12544, 1, 256]
    - [14, 75.828]
  - - [23552, 15616, 1, 256]
    - [19, 76.268]
  - - [21504, 13824, 1, 256]
    - [19, 76.158]
  - - [27136, 11008, 1, 256]
    - [16, 75.587]
  - - [32000, 512, 1, 256]
    - [25, 63.572]
  - - [26624, 1024, 1, 256]
    - [30, 68.378]
  - - [34816, 8192, 1, 256]
    - [17, 75.041]
  - - [23040, 512, 1, 256]
    - [24, 61.25]
  - - [36608, 1024, 1, 256]
    - [30, 69.423]
  - - [43264, 8192, 1, 256]
    - [19, 74.358]
  - - [30208, 14336, 1, 256]
    - [32, 75.063]
  - - [43520, 512, 1, 256]
    - [42, 66.566]
  - - [32256, 4096, 1, 256]
    - [33, 73.355]
  - - [33792, 17664, 1, 256]
    - [19, 75.868]
  - - [10752, 6912, 1, 256]
    - [19, 74.308]
  - - [29696, 8192, 1, 256]
    - [19, 74.986]
  - - [41472, 512, 1, 256]
    - [17, 66.983]
  - - [44544, 8192, 1, 256]
    - [19, 74.517]
  - - [41472, 8192, 1, 256]
    - [33, 74.446]
  - - [38656, 4096, 1, 256]
    - [31, 73.31]
  - - [44800, 512, 1, 256]
    - [19, 66.471]
  - - [37376, 4096, 1, 256]
    - [31, 73.81]
  - - [19200, 1024, 1, 256]
    - [29, 66.532]
  - - [39680, 23552, 1, 256]
    - [17, 74.227]
  - - [30976, 8192, 1, 256]
    - [31, 73.668]
  - - [25856, 1024, 1, 256]
    - [30, 68.429]
  - - [22016, 14336, 1, 256]
    - [17, 75.309]
  - - [17152, 9216, 1, 256]
    - [17, 74.262]
  - - [18432, 10752, 1, 256]
    - [17, 75.858]
  - - [5376, 1024, 1, 256]
    - [30, 48.52]
  - - [21760, 13824, 1, 256]
    - [19, 75.487]
  - - [15360, 512, 1, 256]
    - [25, 55.596]
  - - [2560, 512, 1, 256]
    - [91, 43.314]
  - - [36096, 8192, 1, 256]
    - [20, 73.872]
  - - [42752, 26624, 1, 256]
    - [19, 74.446]
  - - [35584, 19456, 1, 256]
    - [31, 74.674]
  - - [6144, 2304, 1, 256]
    - [25, 66.961]
  - - [42240, 1024, 1, 256]
    - [34, 69.828]
  - - [26880, 4096, 1, 256]
    - [17, 72.673]
  - - [28160, 12032, 1, 256]
    - [19, 75.503]
  - - [18688, 10752, 1, 256]
    - [19, 75.22]
  - - [43520, 8192, 1, 256]
    - [19, 74.662]
  - - [8192, 4352, 1, 256]
    - [17, 70.832]
  - - [6912, 3072, 1, 256]
    - [25, 68.847]
  - - [31744, 15616, 1, 256]
    - [17, 75.832]
  - - [36352, 20224, 1, 256]
    - [31, 75.358]
  - - [41216, 25088, 1, 256]
    - [14, 74.747]
  - - [37632, 1024, 1, 256]
    - [15, 69.481]
  - - [18944, 512, 1, 256]
    - [17, 59.145]
  - - [15616, 1024, 1, 256]
    - [15, 65.832]
  - - [44288, 512, 1, 256]
    - [22, 66.064]
  - - [24832, 8704, 1, 256]
    - [21, 74.982]
  - - [21504, 13568, 1, 256]
    - [17, 76.086]
  - - [18176, 10496, 1, 256]
    - [19, 75.104]
  - - [21248, 1024, 1, 256]
    - [15, 66.339]
  - - [16384, 1024, 1, 256]
    - [40, 58.261]
  - - [25600, 8192, 1, 256]
    - [17, 75.08]
  - - [28672, 12544, 1, 256]
    - [14, 75.492]
  - - [16128, 1024, 1, 256]
    - [26, 62.905]
  - - [22272, 14592, 1, 256]
    - [16, 75.412]
  - - [1280, 512, 1, 256]
    - [79, 30.85]
  - - [36864, 20992, 1, 256]
    - [17, 75.008]
  - - [3584, 1792, 1, 256]
    - [25, 56.36]
  - - [35072, 19200, 1, 256]
    - [17, 74.991]
  - - [32000, 4096, 1, 256]
    - [40, 72.71]
  - - [28416, 1024, 1, 256]
    - [30, 67.534]
  - - [20480, 12800, 1, 256]
    - [17, 75.76]
  - - [21760, 4096, 1, 256]
    - [66, 72.584]
  - - [44288, 8192, 1, 256]
    - [31, 74.353]
  - - [33280, 4096, 1, 256]
    - [20, 73.587]
  - - [32512, 1024, 1, 256]
    - [24, 68.481]
  - - [38400, 22528, 1, 256]
    - [20, 75.187]
  - - [40448, 1024, 1, 256]
    - [15, 70.029]
  - - [5120, 512, 1, 256]
    - [26, 42.717]
  - - [29952, 8192, 1, 256]
    - [21, 74.456]
  - - [40448, 24576, 1, 256]
    - [33, 74.509]
  - - [29696, 4096, 1, 256]
    - [17, 73.234]
  - - [21504, 1024, 1, 256]
    - [27, 67.191]
  - - [19968, 1024, 1, 256]
    - [15, 66.898]
  - - [16896, 512, 1, 256]
    - [15, 59.514]
  - - [33536, 17408, 1, 256]
    - [20, 74.787]
  - - [19712, 512, 1, 256]
    - [19, 60.709]
  - - [16384, 8704, 1, 256]
    - [28, 63.818]
  - - [29952, 13824, 1, 256]
    - [21, 75.112]
  - - [14592, 6656, 1, 256]
    - [42, 72.415]
  - - [36864, 1024, 1, 256]
    - [17, 68.423]
  - - [31744, 15872, 1, 256]
    - [19, 75.897]
  - - [24832, 8960, 1, 256]
    - [22, 75.119]
  - - [23808, 1024, 1, 256]
    - [30, 68.233]
  - - [19200, 11264, 1, 256]
    - [20, 74.727]
  - - [23296, 15360, 1, 256]
    - [19, 75.187]
  - - [34304, 18432, 1, 256]
    - [32, 75.048]
  - - [22016, 1024, 1, 256]
    - [30, 67.571]
  - - [40704, 4096, 1, 256]
    - [20, 73.066]
  - - [25600, 4096, 1, 256]
    - [20, 73.152]
  - - [3328, 1024, 1, 256]
    - [26, 52.353]
  - - [30464, 8192, 1, 256]
    - [31, 73.421]
  - - [39424, 8192, 1, 256]
    - [17, 74.587]
  - - [23808, 15872, 1, 256]
    - [17, 75.524]
  - - [8960, 1024, 1, 256]
    - [34, 56.85]
  - - [44032, 4096, 1, 256]
    - [17, 73.194]
  - - [35584, 8192, 1, 256]
    - [32, 74.268]
  - - [29184, 8192, 1, 256]
    - [21, 74.597]
  - - [13824, 1024, 1, 256]
    - [34, 65.854]
  - - [36608, 8192, 1, 256]
    - [17, 74.225]
  - - [30976, 512, 1, 256]
    - [15, 64.406]
  - - [33024, 4096, 1, 256]
    - [32, 73.199]
  - - [11776, 7936, 1, 256]
    - [19, 74.374]
  - - [23808, 16128, 1, 256]
    - [19, 75.37]
  - - [22272, 14336, 1, 256]
    - [31, 74.944]
  - - [27392, 11520, 1, 256]
    - [32, 74.289]
  - - [30464, 4096, 1, 256]
    - [31, 71.791]
  - - [20992, 13312, 1, 256]
    - [20, 75.507]
  - - [44800, 1024, 1, 256]
    - [19, 69.404]
  - - [32512, 4096, 1, 256]
    - [64, 72.937]
  - - [23296, 15616, 1, 256]
    - [19, 75.408]
  - - [9216, 1024, 1, 256]
    - [27, 58.517]
  - - [20224, 12544, 1, 256]
    - [17, 75.301]
  - - [32256, 1024, 1, 256]
    - [15, 69.566]
  - - [38400, 512, 1, 256]
    - [29, 65.71]
  - - [29952, 1024, 1, 256]
    - [15, 68.339]
  - - [36352, 512, 1, 256]
    - [26, 65.269]
  - - [41728, 25600, 1, 256]
    - [31, 73.877]
  - - [32000, 1024, 1, 256]
    - [15, 68.824]
  - - [38144, 22016, 1, 256]
    - [14, 74.81]
  - - [27136, 11264, 1, 256]
    - [16, 75.389]
  - - [34048, 18176, 1, 256]
    - [45, 74.655]
  - - [22016, 14080, 1, 256]
    - [42, 76.113]
  - - [19712, 12032, 1, 256]
    - [31, 74.357]
  - - [23552, 4096, 1, 256]
    - [31, 72.963]
  - - [15872, 1024, 1, 256]
    - [30, 64.076]
  - - [37120, 512, 1, 256]
    - [26, 65.473]
  - - [9984, 1024, 1, 256]
    - [30, 61.703]
  - - [32512, 8192, 1, 256]
    - [16, 74.44]
  - - [15360, 4096, 1, 256]
    - [19, 72.39]
  - - [13056, 512, 1, 256]
    - [25, 57.597]
  - - [44032, 8192, 1, 256]
    - [17, 74.818]
  - - [24576, 8192, 1, 256]
    - [40, 70.1]
  - - [36352, 8192, 1, 256]
    - [20, 74.844]
  - - [26368, 8192, 1, 256]
    - [17, 74.449]
  - - [20480, 1024, 1, 256]
    - [19, 65.317]
  - - [35072, 8192, 1, 256]
    - [17, 74.34]
  - - [32000, 15872, 1, 256]
    - [19, 75.055]
  - - [40704, 24576, 1, 256]
    - [20, 74.2]
  - - [15104, 7424, 1, 256]
    - [19, 74.433]
  - - [25856, 4096, 1, 256]
    - [20, 72.553]
  - - [14848, 512, 1, 256]
    - [17, 54.42]
  - - [39424, 4096, 1, 256]
    - [45, 73.507]
  - - [24832, 512, 1, 256]
    - [15, 60.301]
  - - [44288, 28416, 1, 256]
    - [14, 74.674]
  - - [12544, 4608, 1, 256]
    - [26, 72.008]
  - - [12800, 4864, 1, 256]
    - [42, 73.386]
  - - [29440, 512, 1, 256]
    - [30, 63.112]
  - - [40192, 24064, 1, 256]
    - [17, 74.898]
  - - [18176, 4096, 1, 256]
    - [19, 72.486]
  - - [40960, 8192, 1, 256]
    - [40, 67.262]
  - - [42240, 512, 1, 256]
    - [27, 67.25]
  - - [9728, 512, 1, 256]
    - [26, 52.767]
  - - [14848, 7168, 1, 256]
    - [17, 73.661]
  - - [44800, 28672, 1, 256]
    - [40, 74.049]
  - - [15616, 7680, 1, 256]
    - [19, 74.594]
  - - [33280, 17408, 1, 256]
    - [32, 75.374]
  - - [42752, 1024, 1, 256]
    - [27, 69.863]
  - - [35328, 8192, 1, 256]
    - [16, 74.689]
  - - [36352, 1024, 1, 256]
    - [54, 69.823]
  - - [35840, 1024, 1, 256]
    - [51, 70.114]
  - - [41472, 4096, 1, 256]
    - [20, 73.656]
  - - [3584, 1024, 1, 256]
    - [15, 41.069]
  - - [22528, 14592, 1, 256]
    - [17, 76.245]
  - - [44032, 512, 1, 256]
    - [34, 66.675]
  - - [30720, 1024, 1, 256]
    - [27, 69.647]
  - - [39680, 512, 1, 256]
    - [27, 65.345]
  - - [22272, 1024, 1, 256]
    - [30, 67.222]
  - - [42240, 26368, 1, 256]
    - [19, 74.63]
  - - [10240, 6400, 1, 256]
    - [25, 74.368]
  - - [30976, 14848, 1, 256]
    - [20, 74.145]
  - - [41728, 25856, 1, 256]
    - [31, 74.256]
  - - [28928, 12800, 1, 256]
    - [16, 74.82]
  - - [21760, 14080, 1, 256]
    - [17, 75.486]
  - - [5888, 1024, 1, 256]
    - [15, 52.899]
  - - [24576, 8704, 1, 256]
    - [28, 70.872]
  - - [38912, 4096, 1, 256]
    - [17, 73.118]
  - - [15360, 1024, 1, 256]
    - [30, 65.031]
  - - [18688, 512, 1, 256]
    - [25, 58.254]
  - - [27392, 512, 1, 256]
    - [22, 62.874]
  - - [22784, 512, 1, 256]
    - [30, 61.037]
  - - [40448, 4096, 1, 256]
    - [43, 73.641]
  - - [19200, 512, 1, 256]
    - [26, 59.411]
  - - [26368, 10496, 1, 256]
    - [19, 74.947]
  - - [25088, 9216, 1, 256]
    - [32, 74.874]
  - - [33536, 1024, 1, 256]
    - [15, 68.643]
  - - [25600, 9472, 1, 256]
    - [19, 75.887]
  - - [13824, 4096, 1, 256]
    - [19, 71.984]
  - - [5632, 3840, 1, 256]
    - [25, 70.207]
  - - [9216, 5376, 1, 256]
    - [26, 72.915]
  - - [8960, 5120, 1, 256]
    - [22, 71.62]
  - - [19456, 512, 1, 256]
    - [19, 60.468]
  - - [24576, 4096, 1, 256]
    - [23, 68.369]
  - - [27392, 11264, 1, 256]
    - [31, 74.537]
  - - [35072, 4096, 1, 256]
    - [31, 72.993]
  - - [44288, 4096, 1, 256]
    - [31, 73.28]
  - - [40448, 8192, 1, 256]
    - [21, 74.465]
  - - [33280, 512, 1, 256]
    - [15, 64.893]
  - - [22272, 4096, 1, 256]
    - [31, 72.461]
  - - [35584, 512, 1, 256]
    - [15, 63.96]
  - - [10752, 512, 1, 256]
    - [26, 48.931]
  - - [19968, 4096, 1, 256]
    - [43, 72.937]
  - - [34304, 1024, 1, 256]
    - [29, 69.634]
  - - [41216, 8192, 1, 256]
    - [31, 74.477]
  - - [35840, 19712, 1, 256]
    - [19, 75.823]
  - - [43520, 27392, 1, 256]
    - [28, 75.44]
  - - [30720, 14848, 1, 256]
    - [19, 75.633]
  - - [38400, 22272, 1, 256]
    - [28, 75.441]
  - - [1536, 1024, 1, 256]
    - [126, 44.029]
  - - [40192, 1024, 1, 256]
    - [43, 69.757]
  - - [44800, 256, 1, 256]
    - [27, 58.147]
  - - [1536, 512, 1, 256]
    - [78, 35.992]
  - - [34560, 18432, 1, 256]
    - [17, 74.758]
  - - [1792, 1024, 1, 256]
    - [34, 30.733]
  - - [5376, 3584, 1, 256]
    - [26, 67.587]
  - - [30208, 1024, 1, 256]
    - [30, 68.896]
  - - [31232, 512, 1, 256]
    - [25, 65.399]
  - - [23040, 4096, 1, 256]
    - [64, 73.309]
  - - [35840, 4096, 1, 256]
    - [19, 73.139]
  - - [38144, 512, 1, 256]
    - [27, 65.417]
  - - [31744, 512, 1, 256]
    - [52, 63.607]
  - - [14592, 6912, 1, 256]
    - [47, 73.121]
  - - [19456, 11520, 1, 256]
    - [19, 76.138]
  - - [7168, 1024, 1, 256]
    - [30, 53.439]
  - - [18944, 11264, 1, 256]
    - [32, 75.342]
  - - [19712, 1024, 1, 256]
    - [19, 63.902]
  - - [26112, 9984, 1, 256]
    - [17, 75.563]
  - - [38656, 22784, 1, 256]
    - [16, 74.655]
  - - [24320, 8192, 1, 256]
    - [16, 74.704]
  - - [4864, 1024, 1, 256]
    - [26, 52.923]
  - - [20480, 4096, 1, 256]
    - [17, 72.506]
  - - [10240, 1024, 1, 256]
    - [15, 62.923]
  - - [31232, 15360, 1, 256]
    - [16, 75.415]
  - - [24320, 4096, 1, 256]
    - [16, 72.813]
  - - [33792, 1024, 1, 256]
    - [27, 69.904]
  - - [12032, 1024, 1, 256]
    - [15, 63.985]
  - - [39168, 512, 1, 256]
    - [26, 64.9]
  - - [16896, 4096, 1, 256]
    - [19, 72.514]
  - - [36096, 1024, 1, 256]
    - [52, 66.757]
  - - [28416, 12544, 1, 256]
    - [21, 74.959]
  - - [30720, 4096, 1, 256]
    - [17, 73.127]
  - - [19712, 4096, 1, 256]
    - [31, 71.466]
  - - [37120, 21248, 1, 256]
    - [17, 74.681]
  - - [16384, 4096, 1, 256]
    - [19, 61.887]
  - - [18688, 11008, 1, 256]
    - [19, 75.091]
  - - [38400, 8192, 1, 256]
    - [17, 74.678]
  - - [11264, 7424, 1, 256]
    - [19, 74.924]
  - - [23296, 512, 1, 256]
    - [26, 61.999]
  - - [25344, 512, 1, 256]
    - [26, 61.71]
  - - [44544, 256, 1, 256]
    - [27, 57.866]
  - - [43264, 4096, 1, 256]
    - [40, 72.828]
  - - [32512, 16640, 1, 256]
    - [21, 75.357]
  - - [39936, 8192, 1, 256]
    - [19, 74.974]
  - - [43264, 512, 1, 256]
    - [26, 65.863]
  - - [16640, 8704, 1, 256]
    - [17, 74.811]
  - - [26624, 8192, 1, 256]
    - [17, 75.099]
  - - [35328, 19456, 1, 256]
    - [32, 75.247]
  - - [42752, 26880, 1, 256]
    - [17, 74.838]
  - - [25344, 9216, 1, 256]
    - [33, 73.445]
  - - [34048, 8192, 1, 256]
    - [33, 73.799]
  - - [18688, 4096, 1, 256]
    - [19, 72.394]
  - - [37632, 8192, 1, 256]
    - [40, 74.221]
  - - [19968, 12032, 1, 256]
    - [19, 75.67]
  - - [8448, 4608, 1, 256]
    - [26, 71.474]
  - - [2048, 1536, 1, 256]
    - [22, 49.785]
  - - [31488, 15616, 1, 256]
    - [17, 74.939]
  - - [35328, 512, 1, 256]
    - [59, 64.709]
  - - [37376, 8192, 1, 256]
    - [31, 74.732]
  - - [33792, 8192, 1, 256]
    - [17, 74.959]
  - - [36608, 4096, 1, 256]
    - [31, 72.898]
  - - [28416, 8192, 1, 256]
    - [16, 74.104]
  - - [5632, 512, 1, 256]
    - [24, 46.409]
  - - [13568, 4096, 1, 256]
    - [19, 71.849]
  - - [17664, 9728, 1, 256]
    - [22, 74.224]
  - - [13568, 1024, 1, 256]
    - [15, 64.791]
  - - [8448, 512, 1, 256]
    - [26, 46.517]
  - - [22528, 4096, 1, 256]
    - [19, 72.967]
  - - [33536, 8192, 1, 256]
    - [16, 74.444]
  - - [23296, 1024, 1, 256]
    - [15, 67.242]
  - - [43520, 4096, 1, 256]
    - [31, 73.78]
  - - [39936, 23808, 1, 256]
    - [17, 75.482]
  - - [12544, 4096, 1, 256]
    - [25, 71.348]
  - - [22016, 4096, 1, 256]
    - [51, 73.077]
  - - [14592, 512, 1, 256]
    - [15, 53.515]
  - - [39936, 4096, 1, 256]
    - [19, 73.242]
  - - [18176, 1024, 1, 256]
    - [30, 65.761]
  - - [44800, 2048, 1, 256]
    - [33, 70.237]
  - - [14848, 4096, 1, 256]
    - [19, 72.5]
  - - [20224, 12288, 1, 256]
    - [31, 74.421]
  - - [16896, 8960, 1, 256]
    - [17, 75.55]
  - - [43264, 27392, 1, 256]
    - [17, 74.802]
  - - [24064, 16128, 1, 256]
    - [16, 75.907]
  - - [1024, 512, 1, 256]
    - [79, 24.986]
  - - [24576, 8448, 1, 256]
    - [14, 70.765]
  - - [25344, 9472, 1, 256]
    - [20, 74.117]
  - - [3328, 1536, 1, 256]
    - [26, 54.557]
  - - [31488, 4096, 1, 256]
    - [19, 72.728]
  - - [43008, 8192, 1, 256]
    - [17, 74.904]
  - - [28672, 12800, 1, 256]
    - [17, 75.357]
  - - [20736, 13056, 1, 256]
    - [19, 75.359]
  - - [17664, 9984, 1, 256]
    - [22, 74.504]
  - - [17920, 1024, 1, 256]
    - [29, 65.342]
  - - [11008, 1024, 1, 256]
    - [42, 57.863]
  - - [44800, 4096, 1, 256]
    - [23, 72.511]
  - - [29952, 14080, 1, 256]
    - [16, 75.218]
  - - [39168, 23296, 1, 256]
    - [31, 74.594]
  - - [9472, 512, 1, 256]
    - [15, 51.769]
  - - [27904, 8192, 1, 256]
    - [20, 74.273]
  - - [5120, 1024, 1, 256]
    - [30, 54.163]
  - - [15872, 7936, 1, 256]
    - [17, 75.157]
  - - [13568, 5632, 1, 256]
    - [25, 73.703]
  - - [17920, 9984, 1, 256]
    - [17, 75.469]
  - - [16640, 8960, 1, 256]
    - [21, 74.67]
  - - [41984, 4096, 1, 256]
    - [19, 73.1]
  - - [6912, 512, 1, 256]
    - [34, 54.305]
  - - [28416, 4096, 1, 256]
    - [23, 72.453]
  - - [27648, 11520, 1, 256]
    - [19, 75.978]
  - - [7680, 3840, 1, 256]
    - [26, 70.372]
  - - [34048, 4096, 1, 256]
    - [32, 72.436]
  - - [11264, 512, 1, 256]
    - [25, 50.753]
  - - [26368, 4096, 1, 256]
    - [17, 72.565]
  - - [21248, 13312, 1, 256]
    - [19, 75.106]
  - - [15104, 1024, 1, 256]
    - [30, 64.971]
  - - [35072, 18944, 1, 256]
    - [19, 74.936]
  - - [6144, 1024, 1, 256]
    - [19, 54.464]
  - - [44800, 8192, 1, 256]
    - [17, 74.033]
  - - [25088, 512, 1, 256]
    - [15, 61.479]
  - - [27904, 12032, 1, 256]
    - [33, 74.855]
  - - [27648, 1024, 1, 256]
    - [30, 68.968]
  - - [28928, 8192, 1, 256]
    - [16, 74.128]
  - - [29440, 13312, 1, 256]
    - [21, 75.126]
  - - [43264, 27136, 1, 256]
    - [28, 74.753]
  - - [23552, 512, 1, 256]
    - [30, 62.539]
  - - [26880, 10752, 1, 256]
    - [19, 75.05]
  - - [44032, 28160, 1, 256]
    - [17, 75.553]
  - - [36096, 512, 1, 256]
    - [42, 63.214]
  - - [4352, 2560, 1, 256]
    - [25, 60.33]
  - - [38912, 8192, 1, 256]
    - [17, 74.954]
  - - [12032, 4096, 1, 256]
    - [17, 71.167]
  - - [37632, 512, 1, 256]
    - [30, 65.67]
  - - [30208, 512, 1, 256]
    - [26, 64.176]
  - - [2304, 512, 1, 256]
    - [79, 41.352]
  - - [24320, 8448, 1, 256]
    - [22, 74.743]
  - - [39424, 512, 1, 256]
    - [22, 65.209]
  - - [37632, 21504, 1, 256]
    - [28, 74.577]
  - - [17152, 1024, 1, 256]
    - [30, 66.735]
  - - [22784, 15104, 1, 256]
    - [21, 75.335]
  - - [27904, 11776, 1, 256]
    - [32, 74.855]
  - - [43008, 26880, 1, 256]
    - [28, 75.604]
  - - [41728, 4096, 1, 256]
    - [31, 72.671]
  - - [25344, 8192, 1, 256]
    - [31, 73.596]
  - - [44800, 28928, 1, 256]
    - [17, 74.343]
  - - [38912, 22784, 1, 256]
    - [28, 75.639]
  - - [44032, 1024, 1, 256]
    - [34, 70.885]
  - - [30976, 4096, 1, 256]
    - [20, 71.622]
  - - [15872, 8192, 1, 256]
    - [17, 75.001]
  - - [40960, 4096, 1, 256]
    - [23, 66.076]
  - - [35584, 1024, 1, 256]
    - [30, 69.271]
  - - [18944, 4096, 1, 256]
    - [52, 72.836]
  - - [36096, 20224, 1, 256]
    - [20, 74.266]
  - - [11008, 7168, 1, 256]
    - [49, 71.456]
  - - [7936, 1024, 1, 256]
    - [19, 56.833]
  - - [44288, 1024, 1, 256]
    - [29, 69.726]
  - - [38656, 8192, 1, 256]
    - [31, 74.287]
  - - [38144, 1024, 1, 256]
    - [19, 69.01]
  - - [41984, 1024, 1, 256]
    - [27, 70.499]
  - - [20736, 512, 1, 256]
    - [15, 63.106]
  - - [32768, 16640, 1, 256]
    - [63, 59.277]
  - - [40960, 1024, 1, 256]
    - [17, 64.607]
  - - [25856, 9984, 1, 256]
    - [17, 74.885]
  - - [29696, 13824, 1, 256]
    - [19, 75.882]
  - - [37120, 4096, 1, 256]
    - [31, 73.15]
  - - [37120, 20992, 1, 256]
    - [17, 74.854]
  - - [35072, 512, 1, 256]
    - [27, 66.521]
  - - [38656, 1024, 1, 256]
    - [27, 69.426]
  - - [37376, 512, 1, 256]
    - [15, 65.878]
  - - [32000, 16128, 1, 256]
    - [19, 74.91]
  - - [41984, 25856, 1, 256]
    - [28, 75.626]
  - - [23040, 15104, 1, 256]
    - [21, 76.021]
  - - [31232, 15104, 1, 256]
    - [21, 75.761]
  - - [25088, 4096, 1, 256]
    - [43, 73.174]
  - - [15360, 7424, 1, 256]
    - [17, 75.274]
  - - [16384, 8448, 1, 256]
    - [14, 63.356]
  - - [26624, 4096, 1, 256]
    - [19, 73.175]
  - - [14080, 6400, 1, 256]
    - [49, 73.029]
  - - [16128, 4096, 1, 256]
    - [19, 72.085]
  - - [43776, 27904, 1, 256]
    - [31, 74.364]
  - - [15872, 512, 1, 256]
    - [15, 57.075]
  - - [43776, 8192, 1, 256]
    - [31, 74.087]
  - - [10496, 6656, 1, 256]
    - [26, 73.241]
  - - [13312, 512, 1, 256]
    - [19, 58.378]
  - - [29184, 512, 1, 256]
    - [27, 62.86]
  - - [15360, 7680, 1, 256]
    - [17, 75.288]
  - - [40192, 8192, 1, 256]
    - [17, 74.473]
  - - [34560, 8192, 1, 256]
    - [19, 74.307]
  - - [25856, 8192, 1, 256]
    - [17, 74.455]
  - - [32512, 16384, 1, 256]
    - [32, 75.174]
  - - [12288, 4352, 1, 256]
    - [17, 73.324]
  - - [29440, 13568, 1, 256]
    - [21, 75.133]
  - - [28160, 1024, 1, 256]
    - [15, 68.878]
  - - [32768, 4096, 1, 256]
    - [46, 58.306]
  - - [24832, 4096, 1, 256]
    - [31, 72.684]
  - - [39680, 23808, 1, 256]
    - [17, 74.405]
  - - [22784, 4096, 1, 256]
    - [43, 72.548]
  - - [7936, 4096, 1, 256]
    - [30, 69.283]
  - - [8704, 4864, 1, 256]
    - [25, 72.098]
  - - [29696, 512, 1, 256]
    - [30, 63.904]
  - - [39424, 23296, 1, 256]
    - [14, 75.413]
  - - [17408, 9472, 1, 256]
    - [17, 75.849]
  - - [33792, 4096, 1, 256]
    - [40, 72.911]
  - - [17920, 512, 1, 256]
    - [34, 56.82]
  - - [25856, 512, 1, 256]
    - [26, 62.098]
  - - [44288, 28160, 1, 256]
    - [14, 74.632]
  - - [40192, 4096, 1, 256]
    - [51, 73.012]
  - - [21248, 512, 1, 256]
    - [15, 58.27]
  - - [3072, 512, 1, 256]
    - [90, 44.68]
  - - [29184, 13312, 1, 256]
    - [17, 75.113]
  - - [44544, 1024, 1, 256]
    - [15, 70.345]
  - - [37888, 21760, 1, 256]
    - [19, 75.792]
  - - [33792, 17920, 1, 256]
    - [19, 75.738]
  - - [6912, 1024, 1, 256]
    - [15, 60.997]
  - - [41216, 512, 1, 256]
    - [29, 66.051]
  - - [42240, 26112, 1, 256]
    - [19, 74.753]
  - - [30720, 8192, 1, 256]
    - [17, 75.059]
  - - [11776, 1024, 1, 256]
    - [26, 62.652]
  - - [43008, 4096, 1, 256]
    - [28, 73.053]
  - - [34560, 18688, 1, 256]
    - [19, 74.923]
  - - [41984, 512, 1, 256]
    - [34, 67.355]
  - - [41728, 512, 1, 256]
    - [19, 67.03]
  - - [2560, 1792, 1, 256]
    - [26, 49.744]
  - - [36864, 8192, 1, 256]
    - [19, 74.544]
  - - [40704, 8192, 1, 256]
    - [19, 74.341]
  - - [30720, 14592, 1, 256]
    - [17, 75.998]
  - - [32256, 512, 1, 256]
    - [26, 64.09]
  - - [40192, 512, 1, 256]
    - [19, 65.943]
  - - [8960, 512, 1, 256]
    - [26, 49.372]
  - - [16640, 4096, 1, 256]
    - [37, 71.565]
  - - [30976, 15104, 1, 256]
    - [31, 74.383]
  - - [27136, 8192, 1, 256]
    - [21, 74.986]
  - - [30208, 8192, 1, 256]
    - [16, 74.616]
  - - [21504, 512, 1, 256]
    - [19, 58.901]
  - - [9728, 5888, 1, 256]
    - [25, 73.206]
  - - [38912, 23040, 1, 256]
    - [28, 75.609]
  - - [7424, 1024, 1, 256]
    - [25, 54.579]
  - - [38656, 22528, 1, 256]
    - [20, 74.572]
  - - [26880, 512, 1, 256]
    - [26, 63.666]
  - - [29184, 13056, 1, 256]
    - [16, 75.458]
  - - [44032, 27904, 1, 256]
    - [17, 75.577]
  - - [38144, 8192, 1, 256]
    - [31, 74.149]
  - - [29952, 512, 1, 256]
    - [26, 63.804]
  - - [18432, 4096, 1, 256]
    - [19, 72.431]
  - - [28160, 12288, 1, 256]
    - [20, 74.924]
  - - [29696, 1024, 1, 256]
    - [34, 69.307]
  - - [39936, 1024, 1, 256]
    - [27, 70.178]
  - - [25600, 512, 1, 256]
    - [17, 61.911]
  - - [40448, 24320, 1, 256]
    - [16, 75.043]
  - - [40448, 512, 1, 256]
    - [34, 66.253]
  - - [7424, 3584, 1, 256]
    - [25, 69.863]
  - - [5376, 512, 1, 256]
    - [24, 43.993]
  - - [27136, 4096, 1, 256]
    - [33, 73.399]
  - - [35840, 19968, 1, 256]
    - [19, 75.549]
  - - [18944, 11008, 1, 256]
    - [42, 75.428]
  - - [34816, 18688, 1, 256]
    - [19, 75.739]
  - - [38400, 1024, 1, 256]
    - [27, 70.053]
  - - [36352, 20480, 1, 256]
    - [20, 75.176]
  - - [36608, 20736, 1, 256]
    - [14, 74.849]
  - - [28672, 1024, 1, 256]
    - [19, 67.129]
  - - [42496, 26624, 1, 256]
    - [31, 75.087]
  - - [31488, 15360, 1, 256]
    - [19, 74.816]
  - - [20992, 4096, 1, 256]
    - [20, 73.044]
  - - [12544, 512, 1, 256]
    - [15, 55.681]
  - - [24064, 8192, 1, 256]
    - [16, 74.93]
  - - [26880, 8192, 1, 256]
    - [19, 74.524]
  - - [4352, 512, 1, 256]
    - [29, 36.778]
  - - [7680, 1024, 1, 256]
    - [15, 55.641]
  - - [16128, 8192, 1, 256]
    - [17, 74.553]
  - - [39168, 8192, 1, 256]
    - [20, 74.205]
  - - [29440, 4096, 1, 256]
    - [16, 72.927]
  - - [33536, 4096, 1, 256]
    - [31, 73.191]
  - - [33024, 17152, 1, 256]
    - [16, 75.207]
  - - [34816, 18944, 1, 256]
    - [17, 75.801]
  - - [22016, 512, 1, 256]
    - [25, 59.438]
  - - [14848, 6912, 1, 256]
    - [17, 74.685]
  - - [20736, 12800, 1, 256]
    - [17, 75.324]
  - - [32256, 16128, 1, 256]
    - [21, 75.679]
  - - [7680, 512, 1, 256]
    - [30, 43.371]
  - - [19968, 12288, 1, 256]
    - [31, 75.413]
  - - [29184, 4096, 1, 256]
    - [51, 73.343]
  - - [15616, 4096, 1, 256]
    - [19, 72.242]
  - - [44544, 28672, 1, 256]
    - [14, 74.533]
  - - [26112, 4096, 1, 256]
    - [45, 73.758]
  - - [26624, 10752, 1, 256]
    - [19, 75.829]
  - - [15104, 4096, 1, 256]
    - [19, 71.987]
  - - [23296, 4096, 1, 256]
    - [19, 72.489]
  - - [37888, 22016, 1, 256]
    - [19, 75.62]
  - - [11520, 7680, 1, 256]
    - [42, 73.86]
  - - [41728, 1024, 1, 256]
    - [19, 69.281]
  - - [2304, 1792, 1, 256]
    - [26, 45.323]
  - - [34048, 17920, 1, 256]
    - [16, 74.538]
  - - [1536, 768, 1, 256]
    - [79, 40.855]
  - - [33280, 8192, 1, 256]
    - [16, 74.883]
  - - [11264, 1024, 1, 256]
    - [30, 61.449]
  - - [21760, 1024, 1, 256]
    - [34, 66.154]
  - - [18432, 10496, 1, 256]
    - [19, 75.833]
  - - [41216, 4096, 1, 256]
    - [33, 73.138]
  - - [41472, 25344, 1, 256]
    - [17, 75.153]
  - - [17408, 1024, 1, 256]
    - [34, 66.969]
  - - [19456, 1024, 1, 256]
    - [30, 65.93]
  - - [36096, 19968, 1, 256]
    - [31, 74.202]
  - - [8704, 512, 1, 256]
    - [15, 48.105]
  - - [30464, 1024, 1, 256]
    - [42, 66.822]
  - - [8192, 1024, 1, 256]
    - [19, 57.825]
  - - [11520, 512, 1, 256]
    - [17, 51.67]
  - - [44544, 512, 1, 256]
    - [22, 66.525]
  - - [20736, 4096, 1, 256]
    - [17, 72.521]
  - - [42752, 8192, 1, 256]
    - [19, 74.408]
  - - [39936, 512, 1, 256]
    - [30, 65.84]
  - - [42496, 26368, 1, 256]
    - [19, 75.25]
  - - [28672, 4096, 1, 256]
    - [17, 72.526]
  - - [35840, 8192, 1, 256]
    - [19, 74.949]
  - - [17664, 1024, 1, 256]
    - [27, 63.994]
  - - [21248, 4096, 1, 256]
    - [17, 72.544]
  - - [1280, 768, 1, 256]
    - [79, 35.43]
  - - [28160, 512, 1, 256]
    - [27, 65.774]
  - - [34304, 18176, 1, 256]
    - [32, 75.541]
  - - [19200, 11520, 1, 256]
    - [19, 75.066]
  - - [25856, 9728, 1, 256]
    - [19, 74.614]
  - - [35328, 19200, 1, 256]
    - [21, 75.548]
  - - [29440, 8192, 1, 256]
    - [16, 74.577]
  - - [20992, 13056, 1, 256]
    - [17, 75.803]
  - - [21760, 512, 1, 256]
    - [26, 59.218]
  - - [12800, 512, 1, 256]
    - [30, 56.426]
  - - [28416, 12288, 1, 256]
    - [21, 74.006]
  - - [29696, 13568, 1, 256]
    - [19, 75.794]
  - - [21504, 4096, 1, 256]
    - [20, 72.907]
  - - [30464, 14592, 1, 256]
    - [16, 74.281]
  - - [13056, 5120, 1, 256]
    - [26, 73.164]
  - - [34560, 4096, 1, 256]
    - [19, 72.865]
  - - [32768, 16896, 1, 256]
    - [63, 59.383]
  - - [13824, 5888, 1, 256]
    - [14, 73.544]
  - - [33024, 8192, 1, 256]
    - [33, 74.541]
  - - [14080, 4096, 1, 256]
    - [16, 70.417]
  - - [43008, 1024, 1, 256]
    - [27, 70.968]
  - - [31744, 1024, 1, 256]
    - [30, 69.565]
  - - [11008, 512, 1, 256]
    - [25, 49.571]
  - - [24832, 8192, 1, 256]
    - [22, 74.582]
  - - [43776, 512, 1, 256]
    - [24, 63.657]
  - - [24064, 1024, 1, 256]
    - [29, 68.455]
  - - [12800, 4096, 1, 256]
    - [51, 71.929]
  - - [19456, 11776, 1, 256]
    - [17, 75.91]
  - - [22528, 14848, 1, 256]
    - [19, 75.994]
  - - [30208, 14080, 1, 256]
    - [16, 75.797]
  - - [40704, 1024, 1, 256]
    - [29, 69.656]
  - - [35584, 4096, 1, 256]
    - [33, 73.157]
  - - [26112, 8192, 1, 256]
    - [19, 74.852]
  - - [9472, 5632, 1, 256]
    - [25, 72.733]
  - - [15616, 512, 1, 256]
    - [25, 56.189]
  - - [34816, 4096, 1, 256]
    - [19, 73.248]
  - - [31232, 4096, 1, 256]
    - [31, 73.472]
  - - [9728, 1024, 1, 256]
    - [26, 60.648]
  - - [13312, 1024, 1, 256]
    - [30, 64.256]
  - - [20224, 1024, 1, 256]
    - [15, 66.946]
  - - [4864, 512, 1, 256]
    - [25, 40.82]
  - - [34304, 4096, 1, 256]
    - [32, 73.894]
  - - [43776, 1024, 1, 256]
    - [52, 67.204]
  - - [37120, 8192, 1, 256]
    - [17, 74.285]
  - - [33792, 512, 1, 256]
    - [25, 65.761]
  - - [42496, 512, 1, 256]
    - [17, 66.06]
  - - [9216, 512, 1, 256]
    - [17, 50.463]
  - - [14336, 4096, 1, 256]
    - [19, 72.202]
  - - [43008, 27136, 1, 256]
    - [14, 75.512]
  - - [35840, 512, 1, 256]
    - [26, 64.842]
  - - [40960, 25088, 1, 256]
    - [28, 67.979]
  - - [17408, 512, 1, 256]
    - [26, 60.954]
  - - [12288, 4096, 1, 256]
    - [19, 71.721]
  - - [6656, 512, 1, 256]
    - [17, 52.846]
  - - [40960, 24832, 1, 256]
    - [28, 68.288]
  - - [39168, 23040, 1, 256]
    - [20, 74.625]
  - - [512, 1, 1, 128]
    - [144, 0.025]
  - - [384, 1, 1, 384]
    - [347, 0.028]
  - - [256, 1, 1, 256]
    - [144, 0.017]
  - - [128, 1, 1, 128]
    - [144, 0.006]
  - - [640, 1, 1, 128]
    - [144, 0.032]
  - - [1, 128, 1, 256]
    - [144, 0.009]
  - - [512, 128, 1, 256]
    - [83, 4.27]
  - - [2049, 128, 1, 256]
    - [125, 14.336]
  - - [49, 128, 1, 256]
    - [117, 0.348]
  - - [1537, 128, 1, 256]
    - [127, 11.345]
  - - [257, 128, 1, 256]
    - [117, 1.888]
  - - [9728, 128, 1, 256]
    - [79, 42.487]
  - - [3840, 128, 1, 256]
    - [84, 23.522]
  - - [1280, 128, 1, 256]
    - [83, 10.616]
  - - [7168, 128, 1, 256]
    - [78, 32.965]
  - - [6656, 128, 1, 256]
    - [79, 37.792]
  - - [2561, 128, 1, 256]
    - [88, 17.834]
  - - [6912, 128, 1, 256]
    - [78, 38.946]
  - - [2048, 128, 1, 256]
    - [86, 15.996]
  - - [2304, 128, 1, 256]
    - [86, 17.807]
  - - [1536, 128, 1, 256]
    - [83, 12.739]
  - - [4864, 128, 1, 256]
    - [78, 29.428]
  - - [8448, 128, 1, 256]
    - [78, 38.138]
  - - [3072, 128, 1, 256]
    - [86, 23.02]
  - - [3329, 128, 1, 256]
    - [88, 22.543]
  - - [3328, 128, 1, 256]
    - [80, 24.565]
  - - [8960, 128, 1, 256]
    - [79, 39.721]
  - - [9216, 128, 1, 256]
    - [128, 38.761]
  - - [2817, 128, 1, 256]
    - [114, 19.524]
  - - [6400, 128, 1, 256]
    - [84, 37.641]
  - - [561, 128, 1, 256]
    - [88, 3.87]
  - - [2816, 128, 1, 256]
    - [84, 21.21]
  - - [3073, 128, 1, 256]
    - [111, 20.073]
  - - [2097, 128, 1, 256]
    - [88, 14.071]
  - - [768, 128, 1, 256]
    - [83, 6.405]
  - - [9984, 128, 1, 256]
    - [84, 42.97]
  - - [3584, 128, 1, 256]
    - [79, 22.61]
  - - [817, 128, 1, 256]
    - [94, 5.636]
  - - [5632, 128, 1, 256]
    - [79, 33.525]
  - - [9472, 128, 1, 256]
    - [84, 41.248]
  - - [2305, 128, 1, 256]
    - [94, 15.9]
  - - [1329, 128, 1, 256]
    - [88, 9.168]
  - - [5888, 128, 1, 256]
    - [80, 34.907]
  - - [7680, 128, 1, 256]
    - [121, 33.944]
  - - [4608, 128, 1, 256]
    - [84, 28.462]
  - - [2353, 128, 1, 256]
    - [88, 15.789]
  - - [5120, 128, 1, 256]
    - [78, 30.601]
  - - [769, 128, 1, 256]
    - [127, 5.733]
  - - [1792, 128, 1, 256]
    - [88, 14.072]
  - - [1073, 128, 1, 256]
    - [88, 7.437]
  - - [513, 128, 1, 256]
    - [98, 3.806]
  - - [4096, 128, 1, 256]
    - [80, 25.3]
  - - [7424, 128, 1, 256]
    - [78, 34.356]
  - - [4352, 128, 1, 256]
    - [80, 26.77]
  - - [1793, 128, 1, 256]
    - [88, 12.725]
  - - [8192, 128, 1, 256]
    - [91, 35.992]
  - - [1281, 128, 1, 256]
    - [96, 9.551]
  - - [305, 128, 1, 256]
    - [114, 2.104]
  - - [2560, 128, 1, 256]
    - [86, 19.481]
  - - [2609, 128, 1, 256]
    - [88, 17.831]
  - - [1585, 128, 1, 256]
    - [114, 10.783]
  - - [8704, 128, 1, 256]
    - [79, 37.244]
  - - [10240, 128, 1, 256]
    - [129, 41.644]
  - - [256, 128, 1, 256]
    - [85, 2.135]
  - - [1025, 128, 1, 256]
    - [127, 7.604]
  - - [2865, 128, 1, 256]
    - [109, 19.051]
  - - [5376, 128, 1, 256]
    - [80, 32.001]
  - - [1841, 128, 1, 256]
    - [88, 12.41]
  - - [7936, 128, 1, 256]
    - [78, 36.158]
  - - [6144, 128, 1, 256]
    - [80, 35.292]
  - - [1024, 128, 1, 256]
    - [85, 8.54]
  - - [36096, 1281, 1, 256]
    - [65, 63.047]
  - - [38656, 2816, 1, 256]
    - [51, 72.503]
  - - [35072, 2048, 1, 256]
    - [51, 71.133]
  - - [39424, 2865, 1, 256]
    - [40, 70.508]
  - - [39168, 3328, 1, 256]
    - [20, 72.947]
  - - [36096, 2865, 1, 256]
    - [21, 68.618]
  - - [39216, 5632, 1, 256]
    - [27, 62.951]
  - - [38144, 6144, 1, 256]
    - [19, 74.027]
  - - [35328, 3072, 1, 256]
    - [16, 73.434]
  - - [39936, 256, 1, 256]
    - [31, 59.512]
  - - [36864, 3328, 1, 256]
    - [19, 72.842]
  - - [39168, 6144, 1, 256]
    - [31, 73.921]
  - - [36352, 4352, 1, 256]
    - [19, 74.346]
  - - [37680, 10240, 1, 256]
    - [31, 62.962]
  - - [38144, 256, 1, 256]
    - [27, 57.666]
  - - [37632, 1281, 1, 256]
    - [51, 63.847]
  - - [35632, 1792, 1, 256]
    - [27, 62.655]
  - - [36096, 4096, 1, 256]
    - [31, 72.242]
  - - [36144, 2816, 1, 256]
    - [27, 62.834]
  - - [36352, 256, 1, 256]
    - [17, 55.862]
  - - [35888, 2865, 1, 256]
    - [34, 61.552]
  - - [38912, 1280, 1, 256]
    - [19, 71.695]
  - - [37120, 3072, 1, 256]
    - [17, 73.092]
  - - [38448, 10240, 1, 256]
    - [43, 62.59]
  - - [39936, 3328, 1, 256]
    - [19, 73.571]
  - - [39168, 10240, 1, 256]
    - [20, 74.409]
  - - [39680, 3329, 1, 256]
    - [40, 69.552]
  - - [37168, 2865, 1, 256]
    - [34, 61.603]
  - - [38144, 5888, 1, 256]
    - [17, 73.803]
  - - [37120, 1281, 1, 256]
    - [51, 64.097]
  - - [37376, 10240, 1, 256]
    - [17, 74.986]
  - - [38704, 5120, 1, 256]
    - [34, 62.977]
  - - [39168, 5376, 1, 256]
    - [20, 73.875]
  - - [38656, 2865, 1, 256]
    - [40, 69.906]
  - - [37376, 3584, 1, 256]
    - [17, 74.017]
  - - [35072, 6144, 1, 256]
    - [17, 74.189]
  - - [39936, 6144, 1, 256]
    - [17, 74.671]
  - - [37632, 5376, 1, 256]
    - [17, 73.89]
  - - [36352, 2304, 1, 256]
    - [17, 73.025]
  - - [35840, 2048, 1, 256]
    - [61, 71.487]
  - - [36608, 1280, 1, 256]
    - [17, 70.589]
  - - [39936, 1792, 1, 256]
    - [19, 73.01]
  - - [36608, 3329, 1, 256]
    - [40, 69.48]
  - - [35072, 3329, 1, 256]
    - [40, 69.553]
  - - [37168, 3584, 1, 256]
    - [34, 62.89]
  - - [36096, 1792, 1, 256]
    - [22, 70.106]
  - - [39424, 3329, 1, 256]
    - [31, 70.143]
  - - [39424, 2048, 1, 256]
    - [31, 71.915]
  - - [39984, 2865, 1, 256]
    - [27, 61.483]
  - - [38448, 256, 1, 256]
    - [74, 51.782]
  - - [35584, 256, 1, 256]
    - [34, 55.093]
  - - [36608, 10240, 1, 256]
    - [19, 74.583]
  - - [38960, 5376, 1, 256]
    - [20, 62.631]
  - - [36352, 2048, 1, 256]
    - [31, 71.757]
  - - [39680, 1281, 1, 256]
    - [19, 64.293]
  - - [36608, 2304, 1, 256]
    - [19, 72.296]
  - - [39936, 1280, 1, 256]
    - [19, 71.595]
  - - [39680, 5376, 1, 256]
    - [17, 74.025]
  - - [35584, 10240, 1, 256]
    - [16, 74.399]
  - - [36864, 512, 1, 256]
    - [26, 65.314]
  - - [39424, 2816, 1, 256]
    - [21, 73.142]
  - - [35840, 2816, 1, 256]
    - [17, 73.659]
  - - [38192, 2816, 1, 256]
    - [27, 62.921]
  - - [35584, 2048, 1, 256]
    - [31, 70.786]
  - - [37936, 2865, 1, 256]
    - [19, 61.41]
  - - [39936, 2865, 1, 256]
    - [19, 70.99]
  - - [38656, 10240, 1, 256]
    - [31, 74.41]
  - - [36608, 2048, 1, 256]
    - [43, 70.999]
  - - [35120, 2816, 1, 256]
    - [34, 63.338]
  - - [39424, 5888, 1, 256]
    - [17, 74.33]
  - - [37680, 2816, 1, 256]
    - [27, 63.798]
  - - [36096, 6144, 1, 256]
    - [31, 73.136]
  - - [38144, 1281, 1, 256]
    - [66, 64.27]
  - - [37632, 2048, 1, 256]
    - [43, 70.581]
  - - [39680, 256, 1, 256]
    - [27, 59.321]
  - - [37680, 3840, 1, 256]
    - [34, 63.791]
  - - [39168, 2816, 1, 256]
    - [31, 72.679]
  - - [38192, 2865, 1, 256]
    - [34, 60.856]
  - - [38912, 4608, 1, 256]
    - [19, 74.158]
  - - [37120, 2048, 1, 256]
    - [31, 71.342]
  - - [35376, 1536, 1, 256]
    - [27, 61.119]
  - - [38448, 4864, 1, 256]
    - [27, 63.358]
  - - [38192, 10240, 1, 256]
    - [51, 62.37]
  - - [37632, 2816, 1, 256]
    - [19, 72.628]
  - - [39424, 1024, 1, 256]
    - [52, 70.073]
  - - [39168, 256, 1, 256]
    - [27, 58.604]
  - - [39984, 6144, 1, 256]
    - [31, 63.37]
  - - [38144, 4608, 1, 256]
    - [17, 73.45]
  - - [35840, 2865, 1, 256]
    - [19, 71.032]
  - - [36352, 6144, 1, 256]
    - [31, 74.483]
  - - [36864, 768, 1, 256]
    - [27, 67.906]
  - - [37888, 3328, 1, 256]
    - [17, 73.568]
  - - [36912, 3328, 1, 256]
    - [31, 61.472]
  - - [37120, 3584, 1, 256]
    - [17, 73.471]
  - - [38912, 1281, 1, 256]
    - [19, 64.419]
