library/src/blas3/Tensile/Logic/asm_full/aldebaran/aldebaran_Cijk_Ailk_BjlkC_ZB.yaml
- {MinimumRequiredVersion: 4.28.0}
- aldebaran
- gfx90a
- [Device 7400, Device 7408, Device 740c]
    SolutionIndex: 0
    SolutionNameMin: Cijk_Ailk_BjlkC_ZB_MT16x16x16_MI16x16x4x1_SN_1LDSB1_IU4_NLCA1_NLCB1_SIA2_TT1_16_WG16_4_1
    SolutionIndex: 1
    SolutionNameMin: Cijk_Ailk_BjlkC_ZB_MT16x16x16_MI16x16x4x1_SN_1LDSB0_IU1_NLCA1_NLCB1_SIA3_TT1_16_WG16_4_1
    SolutionIndex: 2
    SolutionNameMin: Cijk_Ailk_BjlkC_ZB_MT32x32x16_MI16x16x4x1_SN_1LDSB0_IU1_NLCA1_NLCB1_SIA3_TT1_16_WG32_8_1
    SolutionIndex: 3
    SolutionNameMin: Cijk_Ailk_BjlkC_ZB_MT64x64x16_MI16x16x4x1_SN_ASGT332_LWPM0p50_NEPBS1_NLCB2_SU0_SUS0_TT1_64_WGM5
    SolutionIndex: 4
    SolutionNameMin: Cijk_Ailk_BjlkC_ZB_MT64x64x16_MI16x16x4x1_SN_ASGT332_LWPM0p50_NEPBS1_NLCB2_SU0_SUS0_TT1_64_WGM7
    SolutionIndex: 5
    SolutionNameMin: Cijk_Ailk_BjlkC_ZB_MT64x96x16_MI16x16x4x1_SN_ASGT332_LWPMn1_NEPBS1_NLCB3_SU32_SUS256_TT1_96_WGM10
    SolutionIndex: 6
    SolutionNameMin: Cijk_Ailk_BjlkC_ZB_MT64x64x16_MI16x16x4x1_SN_ASGT332_LWPM0p50_NEPBS1_NLCB1_SU16_SUS256_TT1_64_WGM7
    SolutionIndex: 7
    SolutionNameMin: Cijk_Ailk_BjlkC_ZB_MT64x96x16_MI16x16x4x1_SN_ASGT332_LWPMn1_NEPBS1_NLCB3_SU32_SUS256_TT1_96_WGM5
    SolutionIndex: 8
    SolutionNameMin: Cijk_Ailk_BjlkC_ZB_MT64x96x16_MI16x16x4x1_SN_ASGT332_LWPMn1_NEPBS1_NLCB3_SU32_SUS256_TT1_96_WGM7
    SolutionIndex: 9
    SolutionNameMin: Cijk_Ailk_BjlkC_ZB_MT64x96x16_MI16x16x4x1_SN_ASGT332_LWPM0p50_NEPBS1_NLCB3_SU32_SUS256_TT1_96_WGM5
    SolutionIndex: 10
    SolutionNameMin: Cijk_Ailk_BjlkC_ZB_MT64x96x16_MI16x16x4x1_SN_ASGT332_LWPMn1_NEPBS1_NLCB3_SU16_SUS256_TT1_96_WGM10
    SolutionIndex: 11
    SolutionNameMin: Cijk_Ailk_BjlkC_ZB_MT64x96x16_MI16x16x4x1_SN_ASGT332_LWPM0p50_NEPBS1_NLCB3_SU0_SUS0_TT1_96_WGM11
    SolutionIndex: 12
    SolutionNameMin: Cijk_Ailk_BjlkC_ZB_MT64x96x16_MI16x16x4x1_SN_ASGT332_LWPMn1_NEPBS1_NLCB3_SU0_SUS0_TT1_96_WGM5
    SolutionIndex: 13
    SolutionNameMin: Cijk_Ailk_BjlkC_ZB_MT64x96x16_MI16x16x4x1_SN_ASGT332_LWPMn1_NEPBS1_NLCB3_SU4_SUS256_TT1_96_WGM3
    SolutionIndex: 14
    SolutionNameMin: Cijk_Ailk_BjlkC_ZB_MT64x96x16_MI16x16x4x1_SN_ASGT332_LWPMn1_NEPBS1_NLCB3_SU0_SUS0_TT1_96_WGM10
    SolutionIndex: 15
    SolutionNameMin: Cijk_Ailk_BjlkC_ZB_MT64x96x16_MI16x16x4x1_SN_ASGT332_LWPMn1_NEPBS1_NLCB3_SU0_SUS0_TT1_96_WGM7
    SolutionIndex: 16
    SolutionNameMin: Cijk_Ailk_BjlkC_ZB_MT64x96x16_MI16x16x4x1_SN_ASGT332_LWPMn1_NEPBS1_NLCB3_SU0_SUS0_TT1_96_WGM11
    SolutionIndex: 17
    SolutionNameMin: Cijk_Ailk_BjlkC_ZB_MT64x96x16_MI16x16x4x1_SN_ASGT332_LWPMn1_NEPBS1_NLCB3_SU0_SUS0_TT1_96_WGM3
    SolutionIndex: 18
    SolutionNameMin: Cijk_Ailk_BjlkC_ZB_MT64x96x16_MI16x16x4x1_SN_ASGT_LWPMn1_NEPBS1_NLCB3_SU16_SUS256_TT1_96_WGM10
    SolutionIndex: 19
    SolutionNameMin: Cijk_Ailk_BjlkC_ZB_MT64x96x8_MI16x16x4x1_SN_1LDSB1_DTVA0_EPS0_MIAV1_NEPBS1_NLCA1_NLCB3_PLR3_SU0_SUS0_TT1_96_WG64_4_1_WGM7
    SolutionIndex: 20
    SolutionNameMin: Cijk_Ailk_BjlkC_ZB_MT128x64x8_MI16x16x4x1_SN_1LDSB0_DTVA1_EPS1_MIAV1_NEPBS1_NLCA2_NLCB1_PLR3_SU0_SUS0_TT2_64_WG64_4_1_WGM7
- - - [64, 1, 1, 256]
    - [1, 0.017]
  - - [64, 64, 1, 256]
    - [0, 1.093]
  - - [1, 1, 1, 256]
    - [2, 0.0]
  - - [1, 64, 1, 256]
    - [2, 0.016]
  - - [3913, 3913, 1, 2195]
    - [3, 89.395]
  - - [6454, 6454, 1, 689]
    - [4, 88.627]
  - - [7561, 7561, 1, 411]
    - [5, 87.396]
  - - [7985, 7985, 1, 701]
    - [6, 89.984]
  - - [7985, 7985, 1, 1948]
    - [5, 91.898]
  - - [8709, 8709, 1, 875]
    - [7, 90.586]
  - - [9603, 9603, 1, 1371]
    - [7, 91.252]
  - - [9603, 9603, 1, 701]
    - [5, 90.012]
  - - [10606, 10606, 1, 1239]
    - [8, 91.77]
  - - [11505, 11505, 1, 1278]
    - [9, 92.562]
  - - [12301, 12301, 1, 837]
    - [7, 90.162]
  - - [13179, 13179, 1, 1392]
    - [10, 92.567]
  - - [14487, 14487, 1, 1169]
    - [5, 91.484]
  - - [15420, 15420, 1, 2986]
    - [11, 93.545]
  - - [15420, 15420, 1, 701]
    - [12, 91.758]
  - - [17445, 17445, 1, 1266]
    - [7, 91.706]
  - - [18395, 18395, 1, 1008]
    - [5, 92.245]
  - - [19343, 19343, 1, 501]
    - [10, 88.562]
  - - [19343, 19343, 1, 1266]
    - [13, 91.445]
  - - [20342, 20342, 1, 1636]
    - [14, 92.587]
  - - [21581, 21581, 1, 701]
    - [13, 90.749]
  - - [21581, 21581, 1, 2921]
    - [15, 93.076]
  - - [24261, 24261, 1, 659]
    - [12, 89.249]
  - - [25109, 25109, 1, 1087]
    - [15, 91.706]
  - - [25854, 25854, 1, 701]
    - [16, 90.501]
  - - [25854, 25854, 1, 1820]
    - [17, 92.51]
  - - [27412, 27412, 1, 501]
    - [10, 88.059]
  - - [27412, 27412, 1, 1416]
    - [17, 91.777]
  - - [28005, 28005, 1, 701]
    - [15, 90.308]
  - - [28005, 28005, 1, 2572]
    - [17, 92.733]
  - - [29829, 29829, 1, 1582]
    - [15, 91.93]
  - - [30421, 30421, 1, 1186]
    - [12, 90.549]
  - - [31256, 31256, 1, 415]
    - [18, 88.566]
  - - [31256, 31256, 1, 1186]
    - [17, 90.822]
  - - [1031, 1031, 1, 1031]
    - [19, 66.225]
  - - [4095, 4095, 1, 1031]
    - [20, 88.064]
- null
- null
- DeviceEfficiency
