library/src/blas3/Tensile/Logic/asm_full/aldebaran/aldebaran_Cijk_Alik_Bjlk_SB.yaml
- {MinimumRequiredVersion: 4.6.0}
- aldebaran
- gfx90a
- [Device 0050, Device 0051, Device 0052, Device 0054, Device 0062, Device 7400, Device
    SolutionIndex: 0
    SolutionNameMin: Cijk_Alik_Bjlk_SB_MT32x128x16_MI32x32x2x1_SE_DTL0_TT1_32_TLDS0_WG16_16_1_WGM16
    SolutionIndex: 1
    SolutionNameMin: Cijk_Alik_Bjlk_SB_MT32x128x16_MI32x32x2x1_SE_DTL0_TT1_32_TLDS0_WG16_16_1_WGM8
    SolutionIndex: 2
    SolutionNameMin: Cijk_Alik_Bjlk_SB_MT32x128x8_MI32x32x2x1_SE_DTL0_TT1_32_TLDS0_WG16_16_1_WGM4
    SolutionIndex: 3
    SolutionNameMin: Cijk_Alik_Bjlk_SB_MT64x128x8_MI32x32x1x2_SE_DTL0_TT1_32_TLDS0_WG64_4_1_WGM4
    SolutionIndex: 4
    SolutionNameMin: Cijk_Alik_Bjlk_SB_MT64x128x8_MI32x32x1x2_SE_DTL1_TT1_32_TLDS1_WG64_4_1_WGM4
    SolutionIndex: 5
    SolutionNameMin: Cijk_Alik_Bjlk_SB_MT64x128x8_MI32x32x1x2_SE_DTL0_TT1_32_TLDS0_WG64_4_1_WGM8
    SolutionIndex: 6
    SolutionNameMin: Cijk_Alik_Bjlk_SB_MT64x128x8_MI32x32x1x2_SE_DTL0_TT1_32_TLDS1_WG64_4_1_WGM4
    SolutionIndex: 7
    SolutionNameMin: Cijk_Alik_Bjlk_SB_MT64x256x8_MI32x32x1x2_SE_DTL1_TT2_32_TLDS0_WG16_16_1_WGM16
    SolutionIndex: 8
    SolutionNameMin: Cijk_Alik_Bjlk_SB_MT16x160x16_MI16x16x4x1_SN_1LDSB0_GRVW2_LPA2_NLCB5_PGR1_PLR5_SU0_SUM0_SUS0_TT1_80_WG16_8_1_WGM1
    SolutionIndex: 9
    SolutionNameMin: Cijk_Alik_Bjlk_SB_MT16x160x32_MI16x16x4x1_SN_1LDSB1_GRVW1_LPA2_NLCB5_PGR2_PLR9_SU0_SUM0_SUS0_TT1_80_WG16_8_1_WGM1
    SolutionIndex: 10
    SolutionNameMin: Cijk_Alik_Bjlk_SB_MT128x128x16_MI32x32x2x1_SN_AMAS0_LRVW1_NEPBS4_PLR1_SU0_SUS0_SVW1_TT1_128_VW1_WG128_2_1_WGM12
    SolutionIndex: 11
    SolutionNameMin: Cijk_Alik_Bjlk_SB_MT128x128x16_MI32x32x2x1_SN_AMAS0_LRVW1_NEPBS4_PLR1_SU0_SUS0_SVW1_TT1_128_VW1_WG128_2_1_WGM8
    SolutionIndex: 12
    SolutionNameMin: Cijk_Alik_Bjlk_SB_MT256x64x16_MI32x32x2x1_SN_AMAS3_LRVW1_NEPBS4_PLR1_SU0_SUS0_SVW2_TT2_64_VW2_WG128_2_1_WGM2
    SolutionIndex: 13
    SolutionNameMin: Cijk_Alik_Bjlk_SB_MT256x128x16_MI32x32x2x1_SN_AMAS3_LRVW1_NEPBS4_PLR1_SU32_SUS256_SVW2_TT2_128_VW2_WG128_2_1_WGM2
    SolutionIndex: 14
    SolutionNameMin: Cijk_Alik_Bjlk_SB_MT256x128x16_MI32x32x2x1_SN_AMAS3_LRVW1_NEPBS4_PLR1_SU0_SUS0_SVW2_TT2_128_VW2_WG128_2_1_WGM2
    SolutionIndex: 15
    SolutionNameMin: Cijk_Alik_Bjlk_SB_MT256x128x16_MI32x32x2x1_SN_AMAS3_LRVW1_NEPBS4_PLR1_SU0_SUS0_SVW2_TT2_128_VW2_WG128_2_1_WGM4
    SolutionIndex: 16
    SolutionNameMin: Cijk_Alik_Bjlk_SB_MT256x128x16_MI32x32x2x1_SN_AMAS3_LRVW1_NEPBS4_PLR1_SU32_SUS256_SVW2_TT2_128_VW2_WG128_2_1_WGM6
    SolutionIndex: 17
    SolutionNameMin: Cijk_Alik_Bjlk_SB_MT256x128x16_MI32x32x2x1_SN_AMAS3_LRVW1_NEPBS4_PLR1_SU0_SUS0_SVW2_TT2_128_VW2_WG128_2_1_WGM6
    SolutionIndex: 18
    SolutionNameMin: Cijk_Alik_Bjlk_SB_MT128x128x16_MI32x32x2x1_SN_AMAS3_LRVW1_NEPBS4_PLR1_SU32_SUS256_SVW2_TT2_64_VW2_WG64_4_1_WGM14
    SolutionIndex: 19
    SolutionNameMin: Cijk_Alik_Bjlk_SB_MT256x128x16_MI32x32x2x1_SN_AMAS3_LRVW1_NEPBS4_PLR1_SU0_SUS0_SVW2_TT2_128_VW2_WG128_2_1_WGM8
    SolutionIndex: 20
    SolutionNameMin: Cijk_Alik_Bjlk_SB_MT128x128x16_MI32x32x2x1_SN_AMAS3_LRVW1_NEPBS4_PLR1_SU0_SUS0_SVW2_TT2_64_VW2_WG64_4_1_WGM6
    SolutionIndex: 21
    SolutionNameMin: Cijk_Alik_Bjlk_SB_MT128x128x16_MI32x32x2x1_SN_AMAS0_LRVW1_NEPBS4_PLR1_SU32_SUS256_SVW1_TT1_128_VW1_WG128_2_1_WGM8
    SolutionIndex: 22
    SolutionNameMin: Cijk_Alik_Bjlk_SB_MT256x64x16_MI32x32x2x1_SN_AMAS3_LRVW1_NEPBS4_PLR1_SU32_SUS256_SVW2_TT2_64_VW2_WG128_2_1_WGM12
    SolutionIndex: 23
    SolutionNameMin: Cijk_Alik_Bjlk_SB_MT256x64x16_MI32x32x2x1_SN_AMAS3_LRVW1_NEPBS4_PLR1_SU32_SUS256_SVW2_TT2_64_VW2_WG128_2_1_WGM4
    SolutionIndex: 24
    SolutionNameMin: Cijk_Alik_Bjlk_SB_MT256x128x16_MI32x32x2x1_SN_AMAS3_LRVW1_NEPBS4_PLR1_SU0_SUS0_SVW2_TT2_128_VW2_WG128_2_1_WGM12
    SolutionIndex: 25
    SolutionNameMin: Cijk_Alik_Bjlk_SB_MT256x128x16_MI32x32x2x1_SN_AMAS3_LRVW1_NEPBS4_PLR1_SU32_SUS256_SVW2_TT2_128_VW2_WG128_2_1_WGM12
    SolutionIndex: 26
    SolutionNameMin: Cijk_Alik_Bjlk_SB_MT128x128x16_MI32x32x2x1_SN_AMAS3_LRVW1_NEPBS4_PLR1_SU0_SUS0_SVW2_TT2_64_VW2_WG64_4_1_WGM14
    SolutionIndex: 27
    SolutionNameMin: Cijk_Alik_Bjlk_SB_MT256x128x16_MI32x32x2x1_SN_AMAS3_LRVW1_NEPBS4_PLR1_SU32_SUS256_SVW2_TT2_128_VW2_WG128_2_1_WGM8
    SolutionIndex: 28
    SolutionNameMin: Cijk_Alik_Bjlk_SB_MT128x64x16_MI16x16x4x1_SN_AMAS3_LRVW2_NEPBS4_PLR5_SU0_SUS0_SVW2_TT2_64_VW2_WG64_4_1_WGM6
    SolutionIndex: 29
    SolutionNameMin: Cijk_Alik_Bjlk_SB_MT128x128x16_MI32x32x2x1_SN_AMAS0_LRVW1_NEPBS4_PLR1_SU0_SUS0_SVW1_TT1_128_VW1_WG128_2_1_WGM2
    SolutionIndex: 30
    SolutionNameMin: Cijk_Alik_Bjlk_SB_MT128x128x16_MI32x32x2x1_SN_AMAS0_LRVW1_NEPBS4_PLR1_SU32_SUS256_SVW1_TT1_128_VW1_WG128_2_1_WGM4
    SolutionIndex: 31
    SolutionNameMin: Cijk_Alik_Bjlk_SB_MT128x128x16_MI32x32x2x1_SN_AMAS3_LRVW1_NEPBS4_PLR1_SU32_SUS256_SVW2_TT2_64_VW2_WG64_4_1_WGM8
    SolutionIndex: 32
    SolutionNameMin: Cijk_Alik_Bjlk_SB_MT128x128x16_MI32x32x2x1_SN_AMAS3_LRVW1_NEPBS4_PLR1_SU0_SUS0_SVW2_TT2_64_VW2_WG64_4_1_WGM12
    SolutionIndex: 33
    SolutionNameMin: Cijk_Alik_Bjlk_SB_MT256x128x8_MI32x32x2x1_SN_AMAS3_LRVW2_NEPBS4_PLR5_SU0_SUS0_SVW2_TT2_128_VW2_WG128_2_1_WGM2
    SolutionIndex: 34
    SolutionNameMin: Cijk_Alik_Bjlk_SB_MT256x128x4_MI32x32x2x1_SN_AMAS3_LRVW1_NEPBS1_PLR1_SU0_SUS0_SVW2_TT2_128_VW2_WG128_2_1_WGM2
    SolutionIndex: 35
    SolutionNameMin: Cijk_Alik_Bjlk_SB_MT128x64x16_MI16x16x4x1_SN_AMAS3_LRVW2_NEPBS4_PLR5_SU0_SUS0_SVW2_TT2_64_VW2_WG64_4_1_WGM14
    SolutionIndex: 36
    SolutionNameMin: Cijk_Alik_Bjlk_SB_MT64x64x32_MI32x32x2x1_SN_AMAS0_LRVW2_NEPBS4_PLR17_SU0_SUS0_SVW1_TT1_32_VW1_WG64_4_1_WGM4
    SolutionIndex: 37
    SolutionNameMin: Cijk_Alik_Bjlk_SB_MT128x128x16_MI32x32x2x1_SN_AMAS0_LRVW1_NEPBS4_PLR1_SU0_SUS0_SVW1_TT1_128_VW1_WG128_2_1_WGM6
    SolutionIndex: 38
    SolutionNameMin: Cijk_Alik_Bjlk_SB_MT128x64x16_MI16x16x4x1_SN_AMAS3_LRVW2_NEPBS4_PLR5_SU0_SUS0_SVW2_TT2_64_VW2_WG64_4_1_WGM8
    SolutionIndex: 39
    SolutionNameMin: Cijk_Alik_Bjlk_SB_MT64x64x32_MI32x32x2x1_SN_AMAS0_LRVW2_NEPBS4_PLR17_SU32_SUS256_SVW1_TT1_32_VW1_WG64_4_1_WGM12
    SolutionIndex: 40
    SolutionNameMin: Cijk_Alik_Bjlk_SB_MT64x64x32_MI32x32x2x1_SN_AMAS0_LRVW2_NEPBS1_PLR17_SU32_SUS256_SVW1_TT1_32_VW1_WG64_4_1_WGM12
    SolutionIndex: 41
    SolutionNameMin: Cijk_Alik_Bjlk_SB_MT128x64x16_MI16x16x4x1_SN_AMAS3_LRVW2_NEPBS1_PLR5_SU0_SUS0_SVW2_TT2_64_VW2_WG64_4_1_WGM12
    SolutionIndex: 42
    SolutionNameMin: Cijk_Alik_Bjlk_SB_MT128x64x16_MI16x16x4x1_SN_AMAS3_LRVW2_NEPBS1_PLR5_SU0_SUS0_SVW2_TT2_64_VW2_WG64_4_1_WGM14
    SolutionIndex: 43
    SolutionNameMin: Cijk_Alik_Bjlk_SB_MT64x64x32_MI32x32x2x1_SN_AMAS0_LRVW2_NEPBS4_PLR17_SU0_SUS0_SVW1_TT1_32_VW1_WG64_4_1_WGM6
    SolutionIndex: 44
    SolutionNameMin: Cijk_Alik_Bjlk_SB_MT64x64x32_MI32x32x2x1_SN_AMAS0_LRVW2_NEPBS4_PLR17_SU0_SUS0_SVW1_TT1_32_VW1_WG64_4_1_WGM12
    SolutionIndex: 45
    SolutionNameMin: Cijk_Alik_Bjlk_SB_MT64x64x32_MI32x32x2x1_SN_AMAS0_LRVW2_NEPBS4_PLR17_SU0_SUS0_SVW1_TT1_32_VW1_WG64_4_1_WGM8
    SolutionIndex: 46
    SolutionNameMin: Cijk_Alik_Bjlk_SB_MT64x64x32_MI32x32x2x1_SN_AMAS0_LRVW2_NEPBS1_PLR17_SU0_SUS0_SVW1_TT1_32_VW1_WG64_4_1_WGM8
    SolutionIndex: 47
    SolutionNameMin: Cijk_Alik_Bjlk_SB_MT64x64x32_MI32x32x2x1_SN_AMAS0_LRVW2_NEPBS1_PLR17_SU32_SUS256_SVW1_TT1_32_VW1_WG64_4_1_WGM8
    SolutionIndex: 48
    SolutionNameMin: Cijk_Alik_Bjlk_SB_MT128x128x16_MI32x32x2x1_SN_1LDSB1_AMAS0_LRVW1_PLR1_SVW1_TT1_128_VW1_WG128_2_1_WGM2
    SolutionIndex: 49
    SolutionNameMin: Cijk_Alik_Bjlk_SB_MT128x128x16_MI32x32x2x1_SN_1LDSB1_AMAS3_LRVW1_PLR1_SVW2_TT2_64_VW2_WG64_4_1_WGM4
    SolutionIndex: 50
    SolutionNameMin: Cijk_Alik_Bjlk_SB_MT128x128x16_MI32x32x2x1_SN_1LDSB1_AMAS3_LRVW1_PLR1_SVW2_TT2_64_VW2_WG64_4_1_WGM6
    SolutionIndex: 51
    SolutionNameMin: Cijk_Alik_Bjlk_SB_MT128x128x16_MI32x32x2x1_SN_1LDSB1_AMAS3_LRVW1_PLR1_SVW2_TT2_64_VW2_WG64_4_1_WGM12
    SolutionIndex: 52
    SolutionNameMin: Cijk_Alik_Bjlk_SB_MT128x128x16_MI32x32x2x1_SN_1LDSB1_AMAS0_LRVW1_PLR1_SVW1_TT1_128_VW1_WG128_2_1_WGM14
    SolutionIndex: 53
    SolutionNameMin: Cijk_Alik_Bjlk_SB_MT128x128x16_MI32x32x2x1_SN_1LDSB1_AMAS0_LRVW1_PLR1_SVW1_TT1_128_VW1_WG128_2_1_WGM8
    SolutionIndex: 54
    SolutionNameMin: Cijk_Alik_Bjlk_SB_MT128x128x16_MI32x32x2x1_SN_1LDSB1_AMAS3_LRVW1_PLR1_SVW2_TT2_64_VW2_WG64_4_1_WGM8
    SolutionIndex: 55
    SolutionNameMin: Cijk_Alik_Bjlk_SB_MT128x128x16_MI32x32x2x1_SN_1LDSB1_AMAS0_LRVW1_PLR1_SVW1_TT1_128_VW1_WG128_2_1_WGM6
    SolutionIndex: 56
    SolutionNameMin: Cijk_Alik_Bjlk_SB_MT128x128x16_MI32x32x2x1_SN_1LDSB1_AMAS3_LRVW1_PLR1_SVW2_TT2_64_VW2_WG64_4_1_WGM14
    SolutionIndex: 57
    SolutionNameMin: Cijk_Alik_Bjlk_SB_MT128x128x16_MI32x32x2x1_SN_1LDSB1_AMAS0_LRVW1_PLR1_SVW1_TT1_128_VW1_WG128_2_1_WGM12
    SolutionIndex: 58
    SolutionNameMin: Cijk_Alik_Bjlk_SB_MT128x128x16_MI32x32x2x1_SN_1LDSB1_AMAS0_LRVW1_PLR1_SVW1_TT1_128_VW1_WG128_2_1_WGM4
    SolutionIndex: 59
    SolutionNameMin: Cijk_Alik_Bjlk_SB_MT128x128x16_MI32x32x2x1_SN_1LDSB1_AMAS3_LRVW1_PLR1_SVW2_TT2_64_VW2_WG64_4_1_WGM2
    SolutionIndex: 60
    SolutionNameMin: Cijk_Alik_Bjlk_SB_MT256x128x8_MI32x32x2x1_SN_1LDSB1_AMAS3_LRVW2_PLR5_SVW2_TT2_128_VW2_WG128_2_1_WGM2
    SolutionIndex: 61
    SolutionNameMin: Cijk_Alik_Bjlk_SB_MT64x64x32_MI32x32x2x1_SN_AMAS0_LRVW2_NEPBS4_PLR17_SU0_SUS0_SVW1_TT1_32_VW1_WG64_4_1_WGM14
    SolutionIndex: 62
    SolutionNameMin: Cijk_Alik_Bjlk_SB_MT64x64x32_MI32x32x2x1_SN_AMAS0_LRVW2_NEPBS4_PLR17_SU0_SUS0_SVW1_TT1_32_VW1_WG64_4_1_WGM2
    SolutionIndex: 63
    SolutionNameMin: Cijk_Alik_Bjlk_SB_MT128x64x16_MI16x16x4x1_SN_AMAS3_LRVW2_NEPBS1_PLR5_SU32_SUS256_SVW2_TT2_64_VW2_WG64_4_1_WGM14
    SolutionIndex: 64
    SolutionNameMin: Cijk_Alik_Bjlk_SB_MT128x64x16_MI16x16x4x1_SN_AMAS3_LRVW2_NEPBS1_PLR5_SU0_SUS0_SVW2_TT2_64_VW2_WG64_4_1_WGM6
    SolutionIndex: 65
    SolutionNameMin: Cijk_Alik_Bjlk_SB_MT128x128x16_MI32x32x2x1_SN_AMAS3_LRVW1_NEPBS4_PLR1_SU0_SUS0_SVW2_TT2_64_VW2_WG64_4_1_WGM2
    SolutionIndex: 66
    SolutionNameMin: Cijk_Alik_Bjlk_SB_MT128x64x16_MI16x16x4x1_SN_AMAS3_LRVW2_NEPBS1_PLR5_SU32_SUS256_SVW2_TT2_64_VW2_WG64_4_1_WGM12
    SolutionIndex: 67
    SolutionNameMin: Cijk_Alik_Bjlk_SB_MT64x64x32_MI32x32x2x1_SN_AMAS0_LRVW2_NEPBS4_PLR17_SU32_SUS256_SVW1_TT1_32_VW1_WG64_4_1_WGM8
    SolutionIndex: 68
    SolutionNameMin: Cijk_Alik_Bjlk_SB_MT128x64x16_MI16x16x4x1_SN_AMAS3_LRVW2_NEPBS4_PLR5_SU0_SUS0_SVW2_TT2_64_VW2_WG64_4_1_WGM12
    SolutionIndex: 69
    SolutionNameMin: Cijk_Alik_Bjlk_SB_MT128x128x16_MI32x32x2x1_SN_AMAS3_LRVW1_NEPBS4_PLR1_SU0_SUS0_SVW2_TT2_64_VW2_WG64_4_1_WGM4
    SolutionIndex: 70
    SolutionNameMin: Cijk_Alik_Bjlk_SB_MT128x64x16_MI16x16x4x1_SN_AMAS3_LRVW2_NEPBS4_PLR5_SU0_SUS0_SVW2_TT2_64_VW2_WG64_4_1_WGM2
    SolutionIndex: 71
    SolutionNameMin: Cijk_Alik_Bjlk_SB_MT128x128x16_MI32x32x2x1_SN_AMAS3_LRVW1_NEPBS4_PLR1_SU32_SUS256_SVW2_TT2_64_VW2_WG64_4_1_WGM4
    SolutionIndex: 72
    SolutionNameMin: Cijk_Alik_Bjlk_SB_MT128x128x16_MI32x32x2x1_SN_AMAS3_LRVW1_NEPBS4_PLR1_SU32_SUS256_SVW2_TT2_64_VW2_WG64_4_1_WGM2
    SolutionIndex: 73
    SolutionNameMin: Cijk_Alik_Bjlk_SB_MT128x64x16_MI16x16x4x1_SN_AMAS3_LRVW2_NEPBS1_PLR5_SU0_SUS0_SVW2_TT2_64_VW2_WG64_4_1_WGM8
    SolutionIndex: 74
    SolutionNameMin: Cijk_Alik_Bjlk_SB_MT64x64x32_MI32x32x2x1_SN_AMAS0_LRVW2_NEPBS4_PLR17_SU32_SUS256_SVW1_TT1_32_VW1_WG64_4_1_WGM14
    SolutionIndex: 75
    SolutionNameMin: Cijk_Alik_Bjlk_SB_MT64x64x32_MI32x32x2x1_SN_AMAS0_LRVW2_NEPBS4_PLR17_SU32_SUS256_SVW1_TT1_32_VW1_WG64_4_1_WGM6
    SolutionIndex: 76
    SolutionNameMin: Cijk_Alik_Bjlk_SB_MT64x64x32_MI32x32x2x1_SN_AMAS0_LRVW2_NEPBS4_PLR17_SU32_SUS256_SVW1_TT1_32_VW1_WG64_4_1_WGM2
    SolutionIndex: 77
    SolutionNameMin: Cijk_Alik_Bjlk_SB_MT256x128x8_MI32x32x2x1_SN_AMAS3_LRVW2_NEPBS4_PLR5_SU0_SUS0_SVW2_TT2_128_VW2_WG128_2_1_WGM14
- - - [1024, 128, 1, 128]
    - [0, 4.696]
  - - [4, 704, 1, 1280]
    - [0, 0.239]
  - - [4, 1856, 1, 3328]
    - [1, 0.721]
  - - [1856, 448, 1, 3328]
    - [2, 40.608]
  - - [2944, 4288, 1, 1280]
    - [61, 93.165]
  - - [2368, 64, 1, 3328]
    - [0, 14.066]
  - - [2368, 5888, 1, 256]
    - [45, 87.114]
  - - [128, 64, 1, 256]
    - [1, 0.377]
  - - [5888, 1024, 1, 1280]
    - [39, 89.743]
  - - [128, 6784, 1, 3328]
    - [0, 60.072]
  - - [64, 4, 1, 256]
    - [0, 0.015]
  - - [5888, 1856, 1, 3328]
    - [44, 93.826]
  - - [5056, 704, 1, 256]
    - [5, 35.493]
  - - [5888, 2944, 1, 3328]
    - [44, 95.976]
  - - [1856, 4288, 1, 256]
    - [62, 83.144]
  - - [1024, 5056, 1, 128]
    - [62, 58.604]
  - - [5056, 5056, 1, 3328]
    - [44, 96.075]
  - - [1408, 5888, 1, 1280]
    - [62, 93.632]
  - - [2368, 448, 1, 128]
    - [2, 16.232]
  - - [1024, 3584, 1, 3328]
    - [3, 67.306]
  - - [4, 2944, 1, 1280]
    - [1, 1.056]
  - - [1408, 64, 1, 128]
    - [1, 2.795]
  - - [256, 4288, 1, 3328]
    - [2, 51.757]
  - - [5888, 1408, 1, 1280]
    - [45, 93.58]
  - - [704, 1856, 1, 3328]
    - [2, 60.522]
  - - [4, 1408, 1, 128]
    - [1, 0.21]
  - - [1024, 2368, 1, 256]
    - [2, 40.485]
  - - [1408, 1856, 1, 1280]
    - [5, 67.965]
  - - [1408, 64, 1, 1280]
    - [1, 7.447]
  - - [448, 1024, 1, 1280]
    - [1, 29.535]
  - - [256, 1408, 1, 3328]
    - [0, 34.281]
  - - [5056, 5056, 1, 1280]
    - [61, 95.251]
  - - [448, 5056, 1, 256]
    - [2, 38.657]
  - - [704, 1856, 1, 1280]
    - [2, 54.618]
  - - [128, 5056, 1, 128]
    - [0, 16.446]
  - - [2368, 128, 1, 256]
    - [1, 17.142]
  - - [1856, 1408, 1, 128]
    - [4, 33.499]
  - - [64, 5056, 1, 256]
    - [1, 14.47]
  - - [6784, 256, 1, 3328]
    - [4, 77.776]
  - - [6784, 4288, 1, 3328]
    - [61, 96.901]
  - - [4288, 448, 1, 256]
    - [2, 30.868]
  - - [64, 704, 1, 128]
    - [1, 1.3]
  - - [1856, 2368, 1, 3328]
    - [62, 91.375]
  - - [4288, 2944, 1, 1280]
    - [45, 93.087]
  - - [704, 5056, 1, 1280]
    - [3, 70.656]
  - - [2368, 704, 1, 3328]
    - [2, 48.064]
  - - [256, 5888, 1, 256]
    - [2, 37.478]
  - - [1856, 4288, 1, 3328]
    - [43, 96.532]
  - - [256, 2944, 1, 256]
    - [0, 31.39]
  - - [5888, 1024, 1, 256]
    - [61, 77.935]
  - - [448, 64, 1, 1280]
    - [1, 2.32]
  - - [448, 5056, 1, 3328]
    - [5, 64.783]
  - - [3584, 4, 1, 1280]
    - [0, 0.988]
  - - [2944, 64, 1, 256]
    - [1, 8.491]
  - - [128, 4, 1, 1280]
    - [1, 0.044]
  - - [1408, 2944, 1, 256]
    - [2, 46.977]
  - - [256, 1856, 1, 1280]
    - [1, 29.003]
  - - [6784, 5056, 1, 3328]
    - [63, 97.557]
  - - [5056, 5056, 1, 256]
    - [45, 90.941]
  - - [1408, 6784, 1, 128]
    - [45, 68.401]
  - - [64, 1024, 1, 1280]
    - [1, 5.668]
  - - [2944, 4, 1, 256]
    - [1, 0.708]
  - - [704, 5056, 1, 128]
    - [2, 31.11]
  - - [4, 2368, 1, 1280]
    - [1, 0.843]
  - - [2368, 2944, 1, 1280]
    - [45, 92.34]
  - - [128, 3584, 1, 1280]
    - [1, 29.08]
  - - [6784, 6784, 1, 1280]
    - [64, 97.156]
  - - [1024, 256, 1, 3328]
    - [0, 24.852]
  - - [1408, 4288, 1, 1280]
    - [62, 90.349]
  - - [3584, 4288, 1, 1280]
    - [45, 95.21]
  - - [2368, 704, 1, 1280]
    - [2, 47.279]
  - - [5056, 4288, 1, 3328]
    - [45, 97.01]
  - - [3584, 2368, 1, 3328]
    - [45, 93.381]
  - - [64, 704, 1, 1280]
    - [0, 3.546]
  - - [4288, 256, 1, 256]
    - [2, 34.229]
  - - [2944, 128, 1, 128]
    - [1, 14.788]
  - - [6784, 448, 1, 1280]
    - [5, 62.17]
  - - [1408, 2944, 1, 128]
    - [4, 34.355]
  - - [4288, 2944, 1, 256]
    - [36, 85.96]
  - - [5888, 704, 1, 1280]
    - [2, 59.733]
  - - [1856, 64, 1, 1280]
    - [0, 9.733]
  - - [448, 5888, 1, 128]
    - [4, 34.504]
  - - [5888, 64, 1, 3328]
    - [1, 26.202]
  - - [2944, 256, 1, 3328]
    - [0, 53.801]
  - - [1024, 64, 1, 128]
    - [1, 2.033]
  - - [5056, 2368, 1, 1280]
    - [61, 94.266]
  - - [448, 3584, 1, 1280]
    - [4, 65.043]
  - - [6784, 5888, 1, 256]
    - [38, 93.588]
  - - [64, 1024, 1, 3328]
    - [1, 6.071]
  - - [704, 128, 1, 1280]
    - [1, 7.852]
  - - [5888, 2944, 1, 128]
    - [65, 76.748]
  - - [4, 3584, 1, 128]
    - [1, 0.54]
  - - [1408, 448, 1, 1280]
    - [1, 39.126]
  - - [1024, 1408, 1, 256]
    - [2, 36.882]
  - - [2368, 2368, 1, 3328]
    - [45, 91.957]
  - - [1856, 6784, 1, 128]
    - [61, 72.609]
  - - [5056, 704, 1, 3328]
    - [5, 64.764]
  - - [1408, 1856, 1, 256]
    - [2, 39.462]
  - - [1408, 704, 1, 3328]
    - [2, 46.898]
  - - [2368, 5056, 1, 256]
    - [45, 86.445]
  - - [5888, 1856, 1, 256]
    - [36, 84.344]
  - - [4288, 64, 1, 3328]
    - [1, 18.933]
  - - [2368, 4, 1, 1280]
    - [0, 0.851]
  - - [704, 5888, 1, 256]
    - [2, 46.748]
  - - [4288, 64, 1, 256]
    - [0, 8.819]
  - - [6784, 64, 1, 256]
    - [1, 13.761]
  - - [2944, 256, 1, 256]
    - [1, 30.296]
  - - [2944, 6784, 1, 3328]
    - [61, 96.794]
  - - [704, 1408, 1, 3328]
    - [2, 48.034]
  - - [3584, 704, 1, 3328]
    - [2, 58.588]
  - - [2944, 256, 1, 128]
    - [0, 21.207]
  - - [6784, 4, 1, 1280]
    - [0, 1.884]
  - - [1024, 64, 1, 1280]
    - [1, 5.355]
  - - [448, 4288, 1, 256]
    - [2, 36.633]
  - - [64, 3584, 1, 3328]
    - [1, 21.596]
  - - [704, 2368, 1, 1280]
    - [4, 65.732]
  - - [448, 2944, 1, 128]
    - [2, 27.172]
  - - [1856, 2368, 1, 1280]
    - [62, 88.264]
  - - [2368, 128, 1, 3328]
    - [0, 28.573]
  - - [2944, 128, 1, 256]
    - [0, 20.604]
  - - [448, 1408, 1, 256]
    - [1, 25.715]
  - - [1856, 4288, 1, 1280]
    - [43, 94.54]
  - - [64, 5056, 1, 3328]
    - [1, 29.395]
  - - [4, 704, 1, 256]
    - [0, 0.171]
  - - [1024, 448, 1, 128]
    - [1, 11.658]
  - - [704, 4, 1, 1280]
    - [1, 0.255]
  - - [704, 256, 1, 128]
    - [1, 7.701]
  - - [704, 2944, 1, 128]
    - [2, 29.447]
  - - [1408, 1024, 1, 1280]
    - [4, 58.819]
  - - [704, 6784, 1, 256]
    - [62, 73.956]
  - - [6784, 704, 1, 256]
    - [61, 73.121]
  - - [5056, 1408, 1, 128]
    - [62, 64.729]
  - - [256, 3584, 1, 3328]
    - [2, 44.736]
  - - [4, 5888, 1, 3328]
    - [1, 2.24]
  - - [128, 1408, 1, 128]
    - [2, 6.707]
  - - [3584, 4288, 1, 3328]
    - [61, 96.46]
  - - [5888, 1856, 1, 1280]
    - [43, 92.231]
  - - [5056, 1024, 1, 3328]
    - [44, 91.253]
  - - [5056, 64, 1, 1280]
    - [1, 19.323]
  - - [1024, 704, 1, 256]
    - [0, 25.434]
  - - [1024, 4288, 1, 128]
    - [62, 55.349]
  - - [4288, 64, 1, 1280]
    - [1, 16.253]
  - - [2368, 3584, 1, 1280]
    - [43, 91.5]
  - - [2368, 6784, 1, 1280]
    - [61, 94.524]
  - - [1024, 256, 1, 256]
    - [1, 14.825]
  - - [1856, 4, 1, 1280]
    - [1, 0.686]
  - - [448, 448, 1, 256]
    - [1, 9.262]
  - - [2944, 3584, 1, 3328]
    - [61, 94.015]
  - - [128, 4288, 1, 128]
    - [1, 13.826]
  - - [64, 448, 1, 256]
    - [1, 1.378]
  - - [128, 1024, 1, 3328]
    - [1, 12.248]
  - - [4, 1408, 1, 3328]
    - [1, 0.547]
  - - [6784, 2944, 1, 256]
    - [43, 90.684]
  - - [64, 1856, 1, 1280]
    - [0, 9.651]
  - - [64, 1024, 1, 128]
    - [1, 2.8]
  - - [4288, 2368, 1, 3328]
    - [44, 94.04]
  - - [1856, 2368, 1, 256]
    - [62, 73.164]
  - - [3584, 256, 1, 128]
    - [2, 20.674]
  - - [3584, 6784, 1, 3328]
    - [44, 95.995]
  - - [256, 1024, 1, 256]
    - [1, 15.51]
  - - [4, 6784, 1, 3328]
    - [1, 2.596]
  - - [1024, 5888, 1, 3328]
    - [62, 92.524]
  - - [1024, 128, 1, 1280]
    - [1, 11.473]
  - - [4288, 128, 1, 1280]
    - [1, 35.775]
  - - [5056, 4288, 1, 1280]
    - [61, 96.038]
  - - [5888, 64, 1, 256]
    - [1, 11.911]
  - - [1408, 5056, 1, 1280]
    - [44, 94.194]
  - - [1856, 256, 1, 1280]
    - [1, 31.146]
  - - [64, 5888, 1, 3328]
    - [0, 35.126]
  - - [2944, 5888, 1, 128]
    - [20, 76.915]
  - - [704, 5888, 1, 1280]
    - [3, 69.489]
  - - [2368, 3584, 1, 128]
    - [62, 67.421]
  - - [6784, 5888, 1, 3328]
    - [66, 97.116]
  - - [704, 1024, 1, 1280]
    - [1, 46.001]
  - - [448, 256, 1, 3328]
    - [1, 10.97]
  - - [448, 1856, 1, 128]
    - [2, 20.153]
  - - [128, 1024, 1, 128]
    - [1, 5.214]
  - - [2944, 4, 1, 128]
    - [1, 0.499]
  - - [1024, 704, 1, 1280]
    - [0, 44.381]
  - - [128, 5888, 1, 256]
    - [0, 29.983]
  - - [1024, 5056, 1, 1280]
    - [62, 88.904]
  - - [4288, 1024, 1, 256]
    - [61, 73.195]
  - - [2944, 2368, 1, 128]
    - [36, 63.387]
  - - [704, 704, 1, 3328]
    - [0, 33.788]
  - - [704, 1408, 1, 1280]
    - [2, 45.707]
  - - [5888, 448, 1, 1280]
    - [2, 56.883]
  - - [3584, 256, 1, 3328]
    - [2, 44.077]
  - - [704, 5888, 1, 3328]
    - [5, 75.567]
  - - [704, 1856, 1, 128]
    - [2, 23.852]
  - - [128, 3584, 1, 3328]
    - [1, 30.648]
  - - [4, 4288, 1, 128]
    - [1, 0.767]
  - - [128, 704, 1, 1280]
    - [0, 7.588]
  - - [3584, 2944, 1, 256]
    - [62, 84.537]
  - - [1856, 128, 1, 3328]
    - [1, 22.537]
  - - [4, 64, 1, 1280]
    - [1, 0.022]
  - - [4, 5056, 1, 3328]
    - [1, 1.932]
  - - [128, 2944, 1, 1280]
    - [0, 32.639]
  - - [2368, 1024, 1, 3328]
    - [3, 70.549]
  - - [128, 256, 1, 3328]
    - [0, 2.874]
  - - [1408, 5056, 1, 3328]
    - [62, 96.526]
  - - [1856, 1856, 1, 3328]
    - [5, 76.224]
  - - [3584, 128, 1, 256]
    - [1, 20.279]
  - - [448, 1408, 1, 3328]
    - [1, 44.604]
  - - [2368, 2368, 1, 256]
    - [62, 76.967]
  - - [4288, 4288, 1, 1280]
    - [44, 96.037]
  - - [64, 448, 1, 1280]
    - [1, 2.176]
  - - [1408, 4288, 1, 256]
    - [62, 78.29]
  - - [448, 4, 1, 256]
    - [1, 0.107]
  - - [5888, 448, 1, 128]
    - [2, 21.492]
  - - [448, 4, 1, 1280]
    - [1, 0.159]
  - - [704, 6784, 1, 3328]
    - [43, 91.135]
  - - [5888, 5888, 1, 1280]
    - [61, 96.68]
  - - [5056, 1024, 1, 1280]
    - [61, 88.481]
  - - [448, 5888, 1, 3328]
    - [5, 75.979]
  - - [128, 4, 1, 128]
    - [0, 0.019]
  - - [1024, 2944, 1, 1280]
    - [2, 64.005]
  - - [5056, 5888, 1, 1280]
    - [61, 95.665]
  - - [4288, 5888, 1, 128]
    - [43, 80.104]
  - - [256, 3584, 1, 256]
    - [2, 28.686]
  - - [1408, 3584, 1, 128]
    - [62, 57.981]
  - - [256, 2944, 1, 3328]
    - [0, 53.068]
  - - [448, 3584, 1, 128]
    - [6, 28.412]
  - - [5888, 2944, 1, 1280]
    - [44, 94.834]
  - - [4, 6784, 1, 1280]
    - [1, 2.412]
  - - [2368, 5888, 1, 128]
    - [36, 73.971]
  - - [64, 2944, 1, 128]
    - [1, 7.057]
  - - [3584, 5888, 1, 256]
    - [62, 90.446]
  - - [2368, 704, 1, 128]
    - [0, 20.815]
  - - [3584, 2944, 1, 1280]
    - [61, 92.439]
  - - [3584, 2368, 1, 128]
    - [43, 66.899]
  - - [5056, 704, 1, 128]
    - [2, 24.59]
  - - [448, 2368, 1, 128]
    - [2, 18.946]
  - - [5056, 1408, 1, 3328]
    - [43, 96.419]
  - - [1408, 704, 1, 256]
    - [2, 27.359]
  - - [6784, 1024, 1, 3328]
    - [45, 94.041]
  - - [6784, 2944, 1, 3328]
    - [44, 96.797]
  - - [2944, 5056, 1, 3328]
    - [44, 96.03]
  - - [1856, 1856, 1, 256]
    - [2, 41.013]
  - - [1024, 5888, 1, 128]
    - [61, 62.033]
  - - [6784, 2368, 1, 1280]
    - [61, 94.532]
  - - [256, 4, 1, 128]
    - [0, 0.039]
  - - [4288, 5888, 1, 1280]
    - [44, 95.54]
  - - [4288, 4288, 1, 256]
    - [62, 90.069]
  - - [448, 2944, 1, 3328]
    - [2, 61.509]
  - - [4288, 1856, 1, 1280]
    - [67, 94.407]
  - - [1856, 2944, 1, 3328]
    - [62, 89.736]
  - - [256, 6784, 1, 3328]
    - [4, 77.661]
  - - [64, 5888, 1, 256]
    - [1, 20.802]
  - - [256, 5056, 1, 128]
    - [2, 24.007]
  - - [5056, 1024, 1, 256]
    - [44, 74.675]
  - - [704, 64, 1, 3328]
    - [1, 4.136]
  - - [5056, 1856, 1, 3328]
    - [45, 94.356]
  - - [4, 2944, 1, 3328]
    - [1, 1.131]
  - - [4, 5056, 1, 256]
    - [0, 1.127]
  - - [1856, 1408, 1, 256]
    - [2, 44.402]
  - - [3584, 4, 1, 128]
    - [1, 0.54]
  - - [448, 448, 1, 3328]
    - [1, 18.31]
  - - [6784, 128, 1, 3328]
    - [0, 62.434]
  - - [4288, 1408, 1, 128]
    - [62, 61.701]
  - - [4288, 5056, 1, 256]
    - [62, 90.878]
  - - [1408, 128, 1, 1280]
    - [0, 15.752]
  - - [5056, 256, 1, 3328]
    - [2, 62.12]
  - - [704, 704, 1, 256]
    - [1, 18.385]
  - - [1024, 5888, 1, 1280]
    - [62, 90.315]
  - - [6784, 2368, 1, 128]
    - [62, 75.162]
  - - [4, 5056, 1, 1280]
    - [1, 1.784]
  - - [64, 128, 1, 256]
    - [0, 0.516]
  - - [128, 1856, 1, 1280]
    - [1, 20.153]
  - - [5056, 3584, 1, 256]
    - [62, 88.872]
  - - [1856, 1024, 1, 1280]
    - [2, 53.927]
  - - [6784, 4288, 1, 1280]
    - [68, 96.091]
  - - [1856, 1856, 1, 1280]
    - [5, 70.54]
  - - [6784, 2944, 1, 128]
    - [69, 80.697]
  - - [128, 4288, 1, 3328]
    - [1, 37.181]
  - - [4, 2368, 1, 3328]
    - [1, 0.926]
  - - [5888, 1856, 1, 128]
    - [62, 71.005]
  - - [448, 704, 1, 1280]
    - [1, 26.065]
  - - [2368, 1024, 1, 128]
    - [4, 31.646]
  - - [1024, 448, 1, 3328]
    - [1, 31.898]
  - - [1856, 704, 1, 1280]
    - [4, 51.414]
  - - [5056, 3584, 1, 128]
    - [43, 76.298]
  - - [5888, 5888, 1, 3328]
    - [44, 97.408]
  - - [6784, 1024, 1, 256]
    - [61, 80.044]
  - - [2944, 2368, 1, 256]
    - [62, 80.862]
  - - [256, 448, 1, 256]
    - [1, 5.379]
  - - [5056, 5888, 1, 3328]
    - [44, 96.408]
  - - [1856, 1024, 1, 256]
    - [2, 37.482]
  - - [448, 1408, 1, 1280]
    - [0, 40.43]
  - - [3584, 448, 1, 1280]
    - [2, 45.402]
  - - [1024, 1024, 1, 1280]
    - [2, 48.545]
  - - [448, 5888, 1, 256]
    - [2, 45.901]
  - - [704, 64, 1, 128]
    - [1, 1.333]
  - - [1408, 6784, 1, 3328]
    - [62, 96.075]
  - - [448, 1024, 1, 128]
    - [0, 14.151]
  - - [4288, 704, 1, 128]
    - [5, 24.735]
  - - [128, 1856, 1, 128]
    - [0, 6.588]
  - - [448, 2368, 1, 3328]
    - [2, 50.319]
  - - [5056, 64, 1, 128]
    - [1, 6.393]
  - - [5056, 2944, 1, 256]
    - [61, 88.041]
  - - [6784, 5888, 1, 128]
    - [65, 87.006]
  - - [704, 1024, 1, 256]
    - [0, 30.243]
  - - [1024, 4, 1, 256]
    - [0, 0.255]
  - - [2368, 1856, 1, 256]
    - [62, 73.264]
  - - [128, 6784, 1, 1280]
    - [0, 54.744]
  - - [1408, 3584, 1, 3328]
    - [65, 92.617]
  - - [2368, 6784, 1, 256]
    - [61, 88.498]
  - - [5056, 1408, 1, 1280]
    - [43, 94.051]
  - - [256, 256, 1, 128]
    - [1, 2.554]
  - - [5056, 4288, 1, 128]
    - [62, 77.945]
  - - [1408, 1856, 1, 128]
    - [4, 27.309]
  - - [1408, 5888, 1, 3328]
    - [61, 95.74]
  - - [1856, 256, 1, 256]
    - [1, 20.454]
  - - [6784, 6784, 1, 256]
    - [38, 94.3]
  - - [64, 256, 1, 128]
    - [1, 0.566]
  - - [4288, 2368, 1, 128]
    - [62, 70.318]
  - - [1856, 4288, 1, 128]
    - [43, 65.883]
  - - [256, 4288, 1, 1280]
    - [2, 46.94]
  - - [2368, 2944, 1, 256]
    - [62, 81.171]
  - - [4, 1856, 1, 256]
    - [1, 0.424]
  - - [3584, 1856, 1, 1280]
    - [67, 93.125]
  - - [6784, 6784, 1, 128]
    - [65, 87.283]
  - - [256, 1856, 1, 128]
    - [0, 12.573]
  - - [704, 64, 1, 1280]
    - [1, 3.756]
  - - [5888, 5056, 1, 256]
    - [35, 92.057]
  - - [3584, 448, 1, 256]
    - [2, 27.162]
  - - [448, 4288, 1, 128]
    - [2, 24.302]
  - - [2944, 4288, 1, 3328]
    - [45, 94.476]
  - - [256, 6784, 1, 256]
    - [2, 41.483]
  - - [1408, 4288, 1, 128]
    - [36, 60.885]
  - - [2944, 704, 1, 3328]
    - [3, 58.773]
  - - [128, 448, 1, 256]
    - [0, 2.594]
  - - [3584, 3584, 1, 256]
    - [62, 87.222]
  - - [448, 1408, 1, 128]
    - [0, 17.75]
  - - [128, 256, 1, 1280]
    - [0, 2.813]
  - - [3584, 5056, 1, 256]
    - [28, 89.231]
  - - [6784, 128, 1, 256]
    - [1, 34.786]
  - - [4288, 4, 1, 256]
    - [0, 0.86]
  - - [64, 1408, 1, 3328]
    - [0, 8.216]
  - - [704, 448, 1, 256]
    - [1, 15.161]
  - - [2944, 2368, 1, 1280]
    - [44, 92.143]
  - - [448, 64, 1, 3328]
    - [1, 2.613]
  - - [1408, 3584, 1, 256]
    - [70, 75.461]
  - - [3584, 4, 1, 3328]
    - [1, 1.07]
  - - [6784, 3584, 1, 256]
    - [61, 90.535]
  - - [256, 128, 1, 128]
    - [0, 1.286]
  - - [704, 1408, 1, 128]
    - [2, 21.577]
  - - [4, 2368, 1, 256]
    - [1, 0.558]
  - - [2944, 448, 1, 128]
    - [3, 19.213]
  - - [128, 1408, 1, 256]
    - [1, 10.293]
  - - [4, 2944, 1, 256]
    - [1, 0.776]
  - - [64, 128, 1, 3328]
    - [1, 0.688]
  - - [5056, 2368, 1, 128]
    - [44, 70.988]
  - - [2944, 2944, 1, 3328]
    - [61, 95.384]
  - - [5056, 6784, 1, 256]
    - [61, 92.802]
  - - [1856, 3584, 1, 128]
    - [62, 63.811]
  - - [128, 2944, 1, 128]
    - [1, 13.846]
  - - [1024, 704, 1, 3328]
    - [1, 49.802]
  - - [6784, 448, 1, 256]
    - [5, 35.926]
  - - [3584, 6784, 1, 128]
    - [65, 82.002]
  - - [128, 4288, 1, 256]
    - [1, 19.726]
  - - [704, 448, 1, 3328]
    - [0, 29.217]
  - - [1024, 1024, 1, 3328]
    - [2, 50.245]
  - - [128, 128, 1, 3328]
    - [1, 1.415]
  - - [5056, 1856, 1, 256]
    - [62, 83.641]
  - - [256, 128, 1, 256]
    - [1, 1.826]
  - - [1024, 1856, 1, 256]
    - [2, 35.366]
  - - [4288, 64, 1, 128]
    - [1, 5.535]
  - - [256, 448, 1, 3328]
    - [0, 10.387]
  - - [1408, 6784, 1, 1280]
    - [62, 94.376]
  - - [3584, 3584, 1, 1280]
    - [44, 94.695]
  - - [64, 2368, 1, 1280]
    - [1, 12.348]
  - - [448, 2368, 1, 1280]
    - [2, 45.063]
  - - [5888, 5888, 1, 128]
    - [69, 85.843]
  - - [64, 6784, 1, 3328]
    - [1, 40.522]
  - - [2944, 256, 1, 1280]
    - [1, 48.848]
  - - [5056, 5888, 1, 128]
    - [62, 80.94]
  - - [256, 2368, 1, 128]
    - [2, 14.158]
  - - [5056, 2368, 1, 3328]
    - [61, 95.712]
  - - [2944, 4288, 1, 256]
    - [43, 86.152]
  - - [1408, 3584, 1, 1280]
    - [71, 89.215]
  - - [2368, 64, 1, 256]
    - [1, 7.05]
  - - [64, 448, 1, 3328]
    - [1, 2.417]
  - - [256, 256, 1, 3328]
    - [0, 6.101]
  - - [5888, 4, 1, 128]
    - [0, 0.833]
  - - [1856, 704, 1, 256]
    - [5, 28.124]
  - - [4, 4288, 1, 1280]
    - [1, 1.513]
  - - [1408, 448, 1, 3328]
    - [1, 43.357]
  - - [1024, 4, 1, 3328]
    - [1, 0.391]
  - - [2368, 256, 1, 256]
    - [2, 25.248]
  - - [2368, 6784, 1, 3328]
    - [61, 95.739]
  - - [1856, 1408, 1, 1280]
    - [3, 69.661]
  - - [1856, 448, 1, 1280]
    - [2, 37.153]
  - - [6784, 704, 1, 128]
    - [70, 57.023]
  - - [4, 4, 1, 256]
    - [0, 0.001]
  - - [128, 5888, 1, 128]
    - [1, 21.416]
  - - [1408, 5888, 1, 256]
    - [43, 83.328]
  - - [704, 2944, 1, 1280]
    - [5, 55.894]
  - - [1856, 2368, 1, 128]
    - [62, 54.835]
  - - [256, 64, 1, 256]
    - [1, 0.735]
  - - [1024, 1024, 1, 256]
    - [2, 33.234]
  - - [704, 1856, 1, 256]
    - [2, 35.637]
  - - [64, 6784, 1, 256]
    - [1, 23.298]
  - - [3584, 704, 1, 1280]
    - [2, 54.329]
  - - [256, 128, 1, 1280]
    - [1, 2.78]
  - - [2368, 4, 1, 256]
    - [0, 0.584]
  - - [256, 2368, 1, 1280]
    - [0, 37.083]
  - - [2944, 6784, 1, 128]
    - [72, 80.804]
  - - [3584, 448, 1, 3328]
    - [5, 45.791]
  - - [1408, 4, 1, 256]
    - [1, 0.337]
  - - [704, 2368, 1, 3328]
    - [4, 72.662]
  - - [2944, 448, 1, 256]
    - [3, 28.764]
  - - [1856, 448, 1, 128]
    - [2, 13.213]
  - - [2368, 128, 1, 1280]
    - [1, 26.532]
  - - [256, 5888, 1, 128]
    - [6, 27.257]
  - - [2368, 256, 1, 128]
    - [0, 17.661]
  - - [64, 5056, 1, 1280]
    - [1, 27.86]
  - - [4, 6784, 1, 128]
    - [1, 1.223]
  - - [2944, 2944, 1, 1280]
    - [45, 93.443]
  - - [5888, 2368, 1, 256]
    - [43, 87.025]
  - - [4, 3584, 1, 1280]
    - [1, 1.294]
  - - [1408, 128, 1, 128]
    - [0, 6.84]
  - - [6784, 704, 1, 3328]
    - [44, 91.124]
  - - [128, 64, 1, 1280]
    - [0, 0.631]
  - - [2368, 256, 1, 1280]
    - [0, 39.203]
  - - [4, 448, 1, 3328]
    - [0, 0.162]
  - - [5888, 4288, 1, 128]
    - [62, 79.076]
  - - [4, 5888, 1, 256]
    - [1, 1.27]
  - - [1408, 2944, 1, 3328]
    - [5, 76.197]
  - - [3584, 704, 1, 128]
    - [2, 21.404]
  - - [64, 1024, 1, 256]
    - [1, 3.635]
  - - [5056, 5056, 1, 128]
    - [36, 79.736]
  - - [2368, 448, 1, 1280]
    - [2, 45.943]
  - - [128, 3584, 1, 256]
    - [1, 19.897]
  - - [704, 448, 1, 1280]
    - [1, 26.755]
  - - [448, 5056, 1, 128]
    - [2, 26.996]
  - - [256, 4, 1, 1280]
    - [0, 0.089]
  - - [128, 5056, 1, 256]
    - [0, 23.406]
  - - [1408, 5056, 1, 128]
    - [44, 64.536]
  - - [2944, 3584, 1, 128]
    - [43, 70.508]
  - - [3584, 2368, 1, 256]
    - [61, 81.93]
  - - [5888, 5056, 1, 1280]
    - [41, 95.705]
  - - [2368, 5056, 1, 128]
    - [61, 71.896]
  - - [64, 704, 1, 256]
    - [1, 2.104]
  - - [4288, 256, 1, 1280]
    - [2, 50.057]
  - - [3584, 3584, 1, 3328]
    - [45, 96.077]
  - - [1024, 256, 1, 128]
    - [1, 10.081]
  - - [4, 704, 1, 128]
    - [0, 0.124]
  - - [5888, 6784, 1, 256]
    - [68, 93.625]
  - - [4288, 2944, 1, 3328]
    - [61, 94.454]
  - - [2944, 64, 1, 128]
    - [0, 5.328]
  - - [1856, 64, 1, 256]
    - [0, 5.312]
  - - [4288, 128, 1, 3328]
    - [0, 39.444]
  - - [4288, 704, 1, 1280]
    - [3, 61.402]
  - - [256, 5056, 1, 1280]
    - [2, 55.471]
  - - [1408, 256, 1, 128]
    - [1, 14.242]
  - - [2944, 5888, 1, 3328]
    - [44, 95.98]
  - - [6784, 5888, 1, 1280]
    - [73, 96.558]
  - - [704, 128, 1, 256]
    - [1, 5.147]
  - - [5888, 4288, 1, 1280]
    - [61, 95.594]
  - - [448, 256, 1, 1280]
    - [0, 9.994]
  - - [5888, 3584, 1, 128]
    - [72, 80.368]
  - - [1856, 1856, 1, 128]
    - [4, 29.747]
  - - [5056, 4, 1, 1280]
    - [1, 1.414]
  - - [256, 1408, 1, 1280]
    - [1, 31.173]
  - - [3584, 1024, 1, 3328]
    - [5, 67.779]
  - - [704, 3584, 1, 128]
    - [4, 32.707]
  - - [5888, 448, 1, 3328]
    - [2, 60.217]
  - - [2368, 4288, 1, 1280]
    - [44, 92.422]
  - - [4288, 2944, 1, 128]
    - [62, 72.319]
  - - [1024, 6784, 1, 3328]
    - [62, 94.185]
  - - [128, 2368, 1, 256]
    - [1, 14.215]
  - - [6784, 64, 1, 3328]
    - [0, 30.203]
  - - [5056, 2944, 1, 3328]
    - [44, 96.033]
  - - [448, 128, 1, 256]
    - [1, 3.275]
  - - [2944, 3584, 1, 256]
    - [62, 84.371]
  - - [1408, 1408, 1, 3328]
    - [3, 56.884]
  - - [1856, 128, 1, 1280]
    - [1, 20.764]
  - - [3584, 3584, 1, 128]
    - [65, 73.724]
  - - [64, 3584, 1, 256]
    - [1, 12.723]
  - - [1408, 4, 1, 3328]
    - [1, 0.546]
  - - [128, 2944, 1, 3328]
    - [1, 35.17]
  - - [3584, 704, 1, 256]
    - [2, 33.306]
  - - [2944, 448, 1, 3328]
    - [4, 57.52]
  - - [3584, 1408, 1, 3328]
    - [69, 92.649]
  - - [704, 3584, 1, 1280]
    - [5, 67.321]
  - - [2944, 6784, 1, 1280]
    - [68, 95.856]
  - - [1856, 6784, 1, 256]
    - [62, 85.88]
  - - [4288, 448, 1, 3328]
    - [2, 55.375]
  - - [6784, 4288, 1, 128]
    - [62, 80.893]
  - - [6784, 704, 1, 1280]
    - [61, 88.272]
  - - [256, 4288, 1, 256]
    - [2, 29.94]
  - - [3584, 64, 1, 128]
    - [0, 4.742]
  - - [5888, 1024, 1, 3328]
    - [44, 92.328]
  - - [448, 64, 1, 128]
    - [1, 0.857]
  - - [704, 6784, 1, 1280]
    - [62, 88.379]
  - - [5888, 128, 1, 256]
    - [1, 30.402]
  - - [2368, 448, 1, 3328]
    - [2, 49.474]
  - - [1856, 5056, 1, 3328]
    - [44, 94.446]
  - - [4, 6784, 1, 256]
    - [1, 1.498]
  - - [1024, 3584, 1, 128]
    - [2, 33.551]
  - - [1024, 1408, 1, 128]
    - [6, 25.991]
  - - [2368, 2944, 1, 128]
    - [62, 64.444]
  - - [5056, 64, 1, 256]
    - [0, 10.172]
  - - [4, 448, 1, 1280]
    - [0, 0.155]
  - - [5056, 2944, 1, 128]
    - [43, 74.745]
  - - [5888, 5056, 1, 3328]
    - [61, 96.402]
  - - [1024, 704, 1, 128]
    - [1, 17.696]
  - - [1408, 2368, 1, 128]
    - [4, 28.965]
  - - [5888, 2368, 1, 128]
    - [62, 73.333]
  - - [128, 5056, 1, 3328]
    - [1, 43.999]
  - - [3584, 6784, 1, 1280]
    - [74, 95.168]
  - - [1856, 5888, 1, 256]
    - [62, 84.504]
  - - [256, 256, 1, 256]
    - [1, 3.838]
  - - [256, 64, 1, 128]
    - [1, 0.546]
  - - [4288, 4288, 1, 3328]
    - [61, 97.136]
  - - [4288, 1408, 1, 1280]
    - [36, 90.051]
  - - [3584, 5056, 1, 128]
    - [62, 76.989]
  - - [4, 1024, 1, 3328]
    - [1, 0.404]
  - - [4288, 2368, 1, 256]
    - [62, 84.058]
  - - [2944, 5056, 1, 1280]
    - [38, 94.776]
  - - [448, 6784, 1, 256]
    - [2, 46.015]
  - - [704, 1024, 1, 128]
    - [1, 20.587]
  - - [6784, 2368, 1, 3328]
    - [61, 95.721]
  - - [256, 1024, 1, 1280]
    - [0, 23.087]
  - - [704, 4, 1, 128]
    - [0, 0.122]
  - - [256, 4, 1, 256]
    - [1, 0.063]
  - - [4288, 128, 1, 256]
    - [0, 23.11]
  - - [4288, 1856, 1, 3328]
    - [43, 96.562]
  - - [3584, 448, 1, 128]
    - [2, 17.846]
  - - [256, 4, 1, 3328]
    - [1, 0.095]
  - - [4, 1408, 1, 1280]
    - [0, 0.508]
  - - [3584, 64, 1, 1280]
    - [1, 13.899]
  - - [1408, 448, 1, 128]
    - [1, 14.792]
  - - [3584, 1024, 1, 1280]
    - [2, 64.095]
  - - [1856, 5056, 1, 256]
    - [61, 83.886]
  - - [4, 3584, 1, 256]
    - [1, 0.78]
  - - [1024, 4288, 1, 256]
    - [62, 73.396]
  - - [5888, 3584, 1, 3328]
    - [61, 96.322]
  - - [4, 256, 1, 256]
    - [0, 0.057]
  - - [5056, 3584, 1, 3328]
    - [61, 95.803]
  - - [128, 5888, 1, 1280]
    - [0, 47.102]
  - - [704, 448, 1, 128]
    - [1, 9.677]
  - - [2368, 1408, 1, 1280]
    - [5, 70.425]
  - - [5056, 2944, 1, 1280]
    - [45, 94.756]
  - - [4, 4, 1, 128]
    - [1, 0.001]
  - - [3584, 256, 1, 256]
    - [2, 27.856]
  - - [128, 1856, 1, 3328]
    - [0, 22.269]
  - - [1024, 6784, 1, 256]
    - [62, 80.962]
  - - [4, 128, 1, 256]
    - [0, 0.026]
  - - [64, 64, 1, 1280]
    - [0, 0.303]
  - - [6784, 4, 1, 128]
    - [1, 1.016]
  - - [2944, 1408, 1, 128]
    - [4, 33.678]
  - - [448, 128, 1, 3328]
    - [1, 5.339]
  - - [64, 2944, 1, 3328]
    - [1, 17.988]
  - - [64, 4288, 1, 3328]
    - [1, 25.854]
  - - [5056, 6784, 1, 3328]
    - [44, 97.552]
  - - [128, 2944, 1, 256]
    - [0, 20.802]
  - - [128, 6784, 1, 128]
    - [1, 25.427]
  - - [3584, 4288, 1, 256]
    - [62, 88.791]
  - - [448, 1856, 1, 256]
    - [1, 29.884]
  - - [1856, 6784, 1, 3328]
    - [44, 94.226]
  - - [3584, 128, 1, 3328]
    - [0, 33.095]
  - - [64, 1856, 1, 256]
    - [1, 5.71]
  - - [1024, 448, 1, 1280]
    - [2, 28.242]
  - - [5888, 4288, 1, 256]
    - [44, 90.799]
  - - [4, 448, 1, 128]
    - [1, 0.062]
  - - [5056, 1408, 1, 256]
    - [62, 82.808]
  - - [64, 256, 1, 1280]
    - [1, 1.318]
  - - [3584, 1024, 1, 256]
    - [2, 45.479]
  - - [256, 704, 1, 256]
    - [0, 8.452]
  - - [5888, 5888, 1, 256]
    - [44, 92.649]
  - - [4288, 1024, 1, 1280]
    - [61, 88.123]
  - - [5888, 128, 1, 3328]
    - [1, 53.929]
  - - [448, 6784, 1, 3328]
    - [5, 67.983]
  - - [2944, 1408, 1, 1280]
    - [3, 71.165]
  - - [2944, 1856, 1, 3328]
    - [43, 89.708]
  - - [2368, 64, 1, 128]
    - [0, 4.328]
  - - [2944, 2944, 1, 128]
    - [62, 68.674]
  - - [4, 128, 1, 3328]
    - [0, 0.048]
  - - [3584, 5888, 1, 1280]
    - [61, 95.278]
  - - [64, 4, 1, 128]
    - [1, 0.01]
  - - [6784, 1856, 1, 1280]
    - [44, 92.879]
  - - [2944, 5056, 1, 256]
    - [62, 88.212]
  - - [5888, 256, 1, 3328]
    - [4, 67.464]
  - - [1856, 5888, 1, 3328]
    - [44, 93.805]
  - - [3584, 1408, 1, 256]
    - [70, 75.0]
  - - [704, 3584, 1, 3328]
    - [3, 72.984]
  - - [5056, 448, 1, 1280]
    - [3, 58.046]
  - - [3584, 1856, 1, 3328]
    - [44, 95.639]
  - - [64, 1408, 1, 128]
    - [0, 3.269]
  - - [1408, 704, 1, 1280]
    - [2, 44.602]
  - - [2944, 1024, 1, 256]
    - [2, 43.97]
  - - [1024, 2368, 1, 128]
    - [4, 27.753]
  - - [2368, 4288, 1, 3328]
    - [43, 94.062]
  - - [4, 1408, 1, 256]
    - [1, 0.306]
  - - [1024, 1408, 1, 1280]
    - [4, 59.28]
  - - [64, 64, 1, 256]
    - [1, 0.18]
  - - [704, 256, 1, 3328]
    - [1, 17.195]
  - - [6784, 5056, 1, 256]
    - [68, 93.257]
  - - [4, 4288, 1, 3328]
    - [1, 1.65]
  - - [448, 6784, 1, 128]
    - [2, 32.77]
  - - [4, 704, 1, 3328]
    - [1, 0.26]
  - - [448, 2944, 1, 256]
    - [2, 40.148]
  - - [2944, 6784, 1, 256]
    - [28, 90.596]
  - - [2368, 2368, 1, 1280]
    - [75, 89.465]
  - - [4, 4, 1, 1280]
    - [1, 0.001]
  - - [1856, 3584, 1, 1280]
    - [62, 93.34]
  - - [64, 2944, 1, 256]
    - [1, 10.552]
  - - [3584, 1408, 1, 1280]
    - [28, 91.877]
  - - [448, 256, 1, 128]
    - [1, 4.41]
  - - [4288, 448, 1, 128]
    - [2, 20.598]
  - - [5056, 256, 1, 1280]
    - [2, 57.611]
  - - [1856, 1408, 1, 3328]
    - [3, 75.373]
  - - [128, 128, 1, 128]
    - [0, 0.591]
  - - [1024, 4288, 1, 3328]
    - [43, 91.3]
  - - [448, 2368, 1, 256]
    - [2, 29.21]
  - - [1024, 4, 1, 128]
    - [0, 0.179]
  - - [5056, 448, 1, 256]
    - [5, 33.503]
  - - [2944, 2368, 1, 3328]
    - [61, 94.478]
  - - [704, 128, 1, 3328]
    - [0, 8.317]
  - - [64, 64, 1, 3328]
    - [0, 0.334]
  - - [1024, 1856, 1, 1280]
    - [2, 52.963]
  - - [6784, 1856, 1, 256]
    - [44, 85.736]
  - - [128, 2368, 1, 3328]
    - [1, 27.189]
  - - [1024, 5888, 1, 256]
    - [62, 78.101]
  - - [5056, 128, 1, 1280]
    - [1, 42.375]
  - - [5056, 64, 1, 3328]
    - [0, 22.531]
  - - [128, 704, 1, 128]
    - [0, 2.599]
  - - [1408, 2368, 1, 256]
    - [7, 42.931]
  - - [1408, 1408, 1, 256]
    - [2, 38.765]
  - - [4, 64, 1, 128]
    - [1, 0.01]
  - - [64, 128, 1, 1280]
    - [0, 0.638]
  - - [2368, 2368, 1, 128]
    - [45, 59.706]
  - - [64, 5888, 1, 128]
    - [0, 13.174]
  - - [5888, 4, 1, 3328]
    - [1, 1.745]
  - - [6784, 1408, 1, 128]
    - [62, 69.627]
  - - [4288, 5888, 1, 256]
    - [62, 91.067]
  - - [1408, 5056, 1, 256]
    - [61, 82.181]
  - - [5056, 128, 1, 3328]
    - [0, 46.665]
  - - [128, 128, 1, 1280]
    - [1, 1.324]
  - - [448, 704, 1, 256]
    - [0, 14.497]
  - - [4288, 3584, 1, 128]
    - [62, 74.771]
  - - [2944, 128, 1, 3328]
    - [0, 35.457]
  - - [128, 5056, 1, 1280]
    - [1, 39.504]
  - - [3584, 5056, 1, 1280]
    - [61, 94.703]
  - - [256, 448, 1, 1280]
    - [0, 9.438]
  - - [704, 704, 1, 128]
    - [1, 12.376]
  - - [5056, 4, 1, 128]
    - [1, 0.758]
  - - [704, 256, 1, 1280]
    - [0, 15.728]
  - - [64, 2368, 1, 3328]
    - [0, 14.215]
  - - [1856, 1024, 1, 128]
    - [2, 26.418]
  - - [1856, 64, 1, 128]
    - [1, 3.478]
  - - [64, 6784, 1, 1280]
    - [1, 37.606]
  - - [704, 4288, 1, 256]
    - [2, 42.838]
  - - [5888, 2368, 1, 1280]
    - [61, 93.965]
  - - [128, 256, 1, 256]
    - [1, 1.75]
  - - [256, 64, 1, 1280]
    - [0, 1.272]
  - - [2368, 5888, 1, 1280]
    - [44, 93.934]
  - - [5888, 256, 1, 1280]
    - [4, 61.58]
  - - [4, 5888, 1, 1280]
    - [1, 2.1]
  - - [704, 128, 1, 128]
    - [1, 3.269]
  - - [1024, 4, 1, 1280]
    - [1, 0.377]
  - - [2368, 1856, 1, 3328]
    - [43, 91.265]
  - - [2368, 128, 1, 128]
    - [1, 11.208]
  - - [2944, 704, 1, 256]
    - [5, 33.917]
  - - [5056, 128, 1, 128]
    - [0, 18.666]
  - - [256, 704, 1, 3328]
    - [0, 16.186]
  - - [704, 3584, 1, 256]
    - [2, 44.307]
  - - [1024, 1024, 1, 1024]
    - [2, 46.042]
  - - [704, 2944, 1, 3328]
    - [5, 59.492]
  - - [6784, 1024, 1, 128]
    - [36, 61.336]
  - - [256, 448, 1, 128]
    - [1, 3.325]
  - - [448, 1024, 1, 3328]
    - [1, 31.78]
  - - [2944, 1024, 1, 3328]
    - [2, 68.621]
  - - [2944, 5056, 1, 128]
    - [61, 74.56]
  - - [1408, 6784, 1, 256]
    - [62, 84.644]
  - - [6784, 1408, 1, 3328]
    - [45, 96.009]
  - - [4288, 6784, 1, 128]
    - [45, 80.893]
  - - [704, 64, 1, 256]
    - [1, 2.007]
  - - [5888, 4, 1, 1280]
    - [0, 1.643]
  - - [256, 2368, 1, 3328]
    - [0, 41.478]
  - - [6784, 2944, 1, 1280]
    - [61, 95.811]
  - - [4288, 1856, 1, 128]
    - [36, 65.439]
  - - [1856, 2944, 1, 128]
    - [62, 59.004]
  - - [6784, 448, 1, 128]
    - [3, 23.692]
  - - [64, 3584, 1, 128]
    - [1, 9.189]
  - - [448, 5056, 1, 1280]
    - [5, 59.745]
  - - [2368, 1856, 1, 128]
    - [36, 54.835]
  - - [128, 448, 1, 1280]
    - [1, 4.55]
  - - [4288, 704, 1, 256]
    - [3, 36.354]
  - - [256, 3584, 1, 128]
    - [2, 20.124]
  - - [5888, 704, 1, 256]
    - [5, 37.715]
  - - [3584, 1024, 1, 128]
    - [2, 31.225]
  - - [256, 5888, 1, 3328]
    - [4, 66.826]
  - - [1408, 4288, 1, 3328]
    - [62, 92.605]
  - - [6784, 4288, 1, 256]
    - [35, 92.102]
  - - [4288, 256, 1, 128]
    - [2, 23.11]
  - - [5888, 256, 1, 256]
    - [5, 37.97]
  - - [6784, 1024, 1, 1280]
    - [75, 91.699]
  - - [5888, 1024, 1, 128]
    - [43, 58.951]
  - - [1024, 128, 1, 256]
    - [1, 7.523]
  - - [128, 64, 1, 3328]
    - [1, 0.692]
  - - [448, 64, 1, 256]
    - [1, 1.361]
  - - [2944, 704, 1, 1280]
    - [5, 53.903]
  - - [6784, 3584, 1, 1280]
    - [61, 95.146]
  - - [1024, 6784, 1, 1280]
    - [62, 91.998]
  - - [2944, 64, 1, 1280]
    - [1, 15.395]
  - - [1408, 2944, 1, 1280]
    - [5, 69.57]
  - - [256, 1856, 1, 256]
    - [1, 17.74]
  - - [1408, 2368, 1, 3328]
    - [5, 73.603]
  - - [2944, 4, 1, 3328]
    - [1, 1.143]
  - - [128, 1408, 1, 3328]
    - [1, 16.675]
  - - [2944, 1856, 1, 128]
    - [62, 59.003]
  - - [256, 2944, 1, 128]
    - [0, 21.738]
  - - [256, 6784, 1, 128]
    - [2, 30.358]
  - - [2368, 4, 1, 128]
    - [1, 0.408]
  - - [1408, 256, 1, 3328]
    - [0, 33.936]
  - - [1856, 4, 1, 128]
    - [0, 0.343]
  - - [5056, 6784, 1, 128]
    - [69, 82.78]
  - - [4288, 5056, 1, 128]
    - [45, 78.268]
  - - [1856, 5888, 1, 128]
    - [36, 70.704]
  - - [2944, 5888, 1, 256]
    - [68, 89.06]
  - - [3584, 1856, 1, 256]
    - [62, 81.087]
  - - [4288, 3584, 1, 1280]
    - [45, 95.181]
  - - [2368, 448, 1, 256]
    - [2, 26.84]
  - - [4288, 256, 1, 3328]
    - [2, 51.757]
  - - [1856, 704, 1, 128]
    - [5, 19.179]
  - - [1408, 64, 1, 256]
    - [1, 4.077]
  - - [64, 1856, 1, 128]
    - [0, 4.103]
  - - [4, 256, 1, 128]
    - [0, 0.048]
  - - [704, 4288, 1, 3328]
    - [5, 67.505]
  - - [704, 5888, 1, 128]
    - [4, 34.257]
  - - [6784, 3584, 1, 128]
    - [69, 81.462]
  - - [1024, 64, 1, 256]
    - [1, 3.099]
  - - [64, 2368, 1, 256]
    - [1, 7.635]
  - - [4288, 5056, 1, 3328]
    - [61, 97.035]
  - - [4, 1856, 1, 1280]
    - [1, 0.655]
  - - [4288, 128, 1, 128]
    - [1, 15.831]
  - - [1408, 1408, 1, 128]
    - [2, 28.377]
  - - [1024, 128, 1, 3328]
    - [1, 12.348]
  - - [1856, 128, 1, 128]
    - [1, 9.583]
  - - [5056, 2368, 1, 256]
    - [45, 86.343]
  - - [4288, 704, 1, 3328]
    - [3, 66.788]
  - - [448, 3584, 1, 256]
    - [5, 39.923]
  - - [64, 128, 1, 128]
    - [1, 0.29]
  - - [2368, 64, 1, 1280]
    - [1, 12.615]
  - - [2368, 1024, 1, 1280]
    - [4, 66.073]
  - - [2944, 1408, 1, 3328]
    - [5, 75.513]
  - - [1408, 448, 1, 256]
    - [1, 22.957]
  - - [1024, 1408, 1, 3328]
    - [4, 63.619]
  - - [2944, 5888, 1, 1280]
    - [68, 94.876]
  - - [1408, 4, 1, 1280]
    - [1, 0.508]
  - - [5888, 3584, 1, 256]
    - [61, 90.161]
  - - [128, 1024, 1, 1280]
    - [1, 11.302]
  - - [1408, 1856, 1, 3328]
    - [3, 73.881]
  - - [4, 4, 1, 3328]
    - [1, 0.002]
  - - [6784, 1408, 1, 1280]
    - [61, 94.34]
  - - [4, 1024, 1, 1280]
    - [0, 0.366]
  - - [704, 2944, 1, 256]
    - [2, 40.735]
  - - [704, 4288, 1, 128]
    - [2, 29.169]
  - - [2368, 4288, 1, 128]
    - [45, 69.529]
  - - [64, 4288, 1, 1280]
    - [0, 22.745]
  - - [6784, 64, 1, 1280]
    - [1, 26.008]
  - - [3584, 128, 1, 128]
    - [1, 14.54]
  - - [1024, 6784, 1, 128]
    - [36, 64.707]
  - - [4, 1856, 1, 128]
    - [1, 0.28]
  - - [1408, 64, 1, 3328]
    - [0, 8.327]
  - - [6784, 4, 1, 256]
    - [0, 1.327]
  - - [1408, 1408, 1, 1280]
    - [2, 56.418]
  - - [256, 2368, 1, 256]
    - [0, 21.586]
  - - [448, 4288, 1, 3328]
    - [5, 54.516]
  - - [2368, 1408, 1, 256]
    - [4, 44.316]
  - - [5888, 5056, 1, 128]
    - [72, 81.925]
  - - [704, 2368, 1, 256]
    - [2, 37.274]
  - - [2944, 448, 1, 1280]
    - [4, 50.687]
  - - [5888, 2368, 1, 3328]
    - [44, 95.194]
  - - [64, 2944, 1, 1280]
    - [1, 16.15]
  - - [448, 1856, 1, 1280]
    - [0, 50.649]
  - - [4288, 448, 1, 1280]
    - [2, 53.097]
  - - [5888, 704, 1, 3328]
    - [3, 64.478]
  - - [5056, 256, 1, 128]
    - [2, 26.477]
  - - [1856, 256, 1, 128]
    - [1, 14.128]
  - - [5056, 128, 1, 256]
    - [0, 26.857]
  - - [704, 4, 1, 256]
    - [1, 0.17]
  - - [1408, 5888, 1, 128]
    - [45, 67.083]
  - - [4288, 4, 1, 128]
    - [1, 0.634]
  - - [1408, 1024, 1, 256]
    - [2, 36.398]
  - - [1024, 1856, 1, 128]
    - [0, 23.833]
  - - [256, 704, 1, 128]
    - [1, 5.277]
  - - [256, 1024, 1, 128]
    - [1, 11.285]
  - - [448, 1024, 1, 256]
    - [0, 21.342]
  - - [128, 4, 1, 3328]
    - [0, 0.046]
  - - [5056, 6784, 1, 1280]
    - [44, 96.74]
  - - [704, 5056, 1, 3328]
    - [3, 78.484]
  - - [64, 1408, 1, 1280]
    - [0, 7.852]
  - - [3584, 5056, 1, 3328]
    - [45, 95.803]
  - - [1856, 4, 1, 3328]
    - [0, 0.711]
  - - [4, 2944, 1, 128]
    - [1, 0.462]
  - - [2368, 2944, 1, 3328]
    - [44, 94.438]
  - - [448, 448, 1, 1280]
    - [1, 16.755]
  - - [2368, 3584, 1, 256]
    - [61, 82.125]
  - - [1024, 256, 1, 1280]
    - [1, 23.591]
  - - [5056, 3584, 1, 1280]
    - [61, 94.768]
  - - [448, 4, 1, 3328]
    - [1, 0.169]
  - - [1856, 2944, 1, 1280]
    - [43, 87.407]
  - - [3584, 2368, 1, 1280]
    - [61, 91.548]
  - - [128, 1024, 1, 256]
    - [1, 7.201]
  - - [2944, 1408, 1, 256]
    - [2, 46.702]
  - - [4288, 1408, 1, 3328]
    - [61, 92.534]
  - - [3584, 64, 1, 3328]
    - [0, 15.897]
  - - [1408, 128, 1, 256]
    - [1, 10.192]
  - - [2944, 1024, 1, 128]
    - [2, 31.221]
  - - [4288, 5056, 1, 1280]
    - [45, 96.003]
  - - [5888, 6784, 1, 1280]
    - [73, 96.57]
  - - [6784, 5056, 1, 128]
    - [65, 82.486]
  - - [256, 1024, 1, 3328]
    - [1, 24.696]
  - - [3584, 4, 1, 256]
    - [1, 0.725]
  - - [1856, 64, 1, 3328]
    - [0, 10.95]
  - - [64, 6784, 1, 128]
    - [1, 15.654]
  - - [5888, 1408, 1, 3328]
    - [61, 95.677]
  - - [5888, 64, 1, 1280]
    - [1, 22.479]
  - - [256, 5056, 1, 256]
    - [2, 34.89]
  - - [128, 3584, 1, 128]
    - [1, 14.951]
  - - [448, 3584, 1, 3328]
    - [4, 71.586]
  - - [704, 2368, 1, 128]
    - [2, 25.24]
  - - [5888, 256, 1, 128]
    - [6, 26.19]
  - - [4, 5056, 1, 128]
    - [1, 0.738]
  - - [448, 256, 1, 256]
    - [0, 6.785]
  - - [704, 4, 1, 3328]
    - [1, 0.269]
  - - [1408, 256, 1, 256]
    - [0, 21.003]
  - - [3584, 1856, 1, 128]
    - [36, 63.314]
  - - [4288, 4288, 1, 128]
    - [36, 76.679]
  - - [1856, 1024, 1, 3328]
    - [3, 55.135]
  - - [128, 5888, 1, 3328]
    - [1, 52.114]
  - - [1024, 5056, 1, 256]
    - [62, 75.659]
  - - [2368, 1408, 1, 3328]
    - [3, 74.402]
  - - [5888, 448, 1, 256]
    - [2, 32.653]
  - - [5888, 6784, 1, 128]
    - [65, 87.224]
  - - [2368, 4, 1, 3328]
    - [0, 0.9]
  - - [6784, 5056, 1, 1280]
    - [38, 96.865]
  - - [5056, 704, 1, 1280]
    - [2, 60.479]
  - - [1408, 256, 1, 1280]
    - [0, 31.841]
  - - [4288, 6784, 1, 1280]
    - [61, 96.008]
  - - [128, 704, 1, 256]
    - [0, 4.243]
  - - [1024, 1024, 1, 128]
    - [2, 23.814]
  - - [448, 128, 1, 1280]
    - [0, 5.004]
  - - [6784, 4, 1, 3328]
    - [1, 2.01]
  - - [4288, 4, 1, 1280]
    - [0, 1.196]
  - - [1024, 64, 1, 3328]
    - [0, 6.045]
  - - [1856, 4, 1, 256]
    - [1, 0.451]
  - - [64, 3584, 1, 1280]
    - [1, 19.808]
  - - [6784, 1408, 1, 256]
    - [45, 84.521]
  - - [3584, 5888, 1, 128]
    - [65, 80.519]
  - - [5056, 5888, 1, 256]
    - [43, 91.523]
  - - [2368, 1024, 1, 256]
    - [2, 41.384]
  - - [2944, 1856, 1, 256]
    - [36, 74.915]
  - - [1856, 6784, 1, 1280]
    - [43, 92.957]
  - - [64, 5056, 1, 128]
    - [1, 9.15]
  - - [5888, 64, 1, 128]
    - [0, 7.574]
  - - [448, 704, 1, 128]
    - [1, 8.918]
  - - [4, 1024, 1, 128]
    - [1, 0.178]
  - - [4288, 3584, 1, 256]
    - [61, 88.623]
  - - [1408, 704, 1, 128]
    - [2, 17.757]
  - - [64, 256, 1, 3328]
    - [1, 1.435]
  - - [5056, 1856, 1, 1280]
    - [45, 92.686]
  - - [1408, 1024, 1, 3328]
    - [4, 64.608]
  - - [2368, 256, 1, 3328]
    - [1, 43.419]
  - - [5888, 3584, 1, 1280]
    - [61, 95.377]
  - - [1856, 3584, 1, 3328]
    - [43, 95.674]
  - - [5888, 128, 1, 1280]
    - [1, 49.124]
  - - [1024, 2944, 1, 256]
    - [2, 45.763]
  - - [448, 6784, 1, 1280]
    - [5, 62.861]
  - - [256, 3584, 1, 1280]
    - [2, 42.821]
  - - [448, 128, 1, 128]
    - [0, 2.266]
  - - [704, 5056, 1, 256]
    - [2, 45.628]
  - - [2944, 1856, 1, 1280]
    - [44, 87.43]
  - - [128, 256, 1, 128]
    - [2, 1.174]
  - - [5056, 256, 1, 256]
    - [2, 38.388]
  - - [2368, 3584, 1, 3328]
    - [44, 93.387]
  - - [3584, 5888, 1, 3328]
    - [44, 96.33]
  - - [128, 4, 1, 256]
    - [1, 0.03]
  - - [2944, 3584, 1, 1280]
    - [45, 92.399]
  - - [1856, 5888, 1, 1280]
    - [45, 92.333]
  - - [256, 256, 1, 1280]
    - [1, 5.702]
  - - [5056, 448, 1, 3328]
    - [5, 63.666]
  - - [4288, 1408, 1, 256]
    - [62, 78.041]
  - - [3584, 64, 1, 256]
    - [1, 7.671]
  - - [64, 1856, 1, 3328]
    - [0, 10.517]
  - - [256, 1408, 1, 128]
    - [1, 14.241]
  - - [5888, 1408, 1, 128]
    - [62, 66.994]
  - - [4288, 2368, 1, 1280]
    - [44, 92.395]
  - - [4, 4288, 1, 256]
    - [1, 0.938]
  - - [256, 4288, 1, 128]
    - [2, 21.393]
  - - [256, 128, 1, 3328]
    - [0, 2.982]
  - - [6784, 2368, 1, 256]
    - [61, 88.418]
  - - [5888, 128, 1, 128]
    - [0, 21.416]
  - - [4288, 1856, 1, 256]
    - [45, 82.228]
  - - [1856, 256, 1, 3328]
    - [0, 33.566]
  - - [1856, 2944, 1, 256]
    - [62, 74.999]
  - - [5056, 1024, 1, 128]
    - [76, 56.006]
  - - [64, 5888, 1, 1280]
    - [1, 32.252]
  - - [6784, 256, 1, 128]
    - [6, 29.552]
  - - [5888, 704, 1, 128]
    - [2, 24.986]
  - - [6784, 64, 1, 128]
    - [0, 8.577]
  - - [1024, 4288, 1, 1280]
    - [62, 88.297]
  - - [2368, 5056, 1, 3328]
    - [45, 95.729]
  - - [448, 4, 1, 128]
    - [1, 0.071]
  - - [4, 256, 1, 3328]
    - [1, 0.099]
  - - [4288, 1024, 1, 3328]
    - [45, 91.228]
  - - [1024, 5056, 1, 3328]
    - [62, 91.375]
  - - [1024, 1856, 1, 3328]
    - [5, 54.367]
  - - [704, 704, 1, 1280]
    - [1, 30.318]
  - - [128, 2368, 1, 1280]
    - [1, 25.34]
  - - [1408, 128, 1, 3328]
    - [1, 17.195]
  - - [3584, 256, 1, 1280]
    - [2, 42.341]
  - - [4, 128, 1, 128]
    - [0, 0.021]
  - - [704, 6784, 1, 128]
    - [44, 56.579]
  - - [3584, 128, 1, 1280]
    - [0, 30.175]
  - - [4, 256, 1, 1280]
    - [1, 0.09]
  - - [128, 704, 1, 3328]
    - [1, 8.156]
  - - [4288, 6784, 1, 256]
    - [62, 91.84]
  - - [3584, 2944, 1, 3328]
    - [43, 94.009]
  - - [128, 1856, 1, 256]
    - [1, 11.052]
  - - [64, 4288, 1, 256]
    - [0, 13.826]
  - - [4, 3584, 1, 3328]
    - [0, 1.357]
  - - [64, 4, 1, 3328]
    - [0, 0.023]
  - - [4, 64, 1, 3328]
    - [0, 0.023]
  - - [5888, 2944, 1, 256]
    - [61, 88.873]
  - - [2368, 6784, 1, 128]
    - [45, 75.685]
  - - [448, 4288, 1, 1280]
    - [0, 50.393]
  - - [448, 1856, 1, 3328]
    - [1, 57.842]
  - - [4, 1024, 1, 256]
    - [0, 0.257]
  - - [5056, 4288, 1, 256]
    - [61, 90.784]
  - - [1024, 448, 1, 256]
    - [0, 17.073]
  - - [1024, 3584, 1, 256]
    - [2, 46.275]
  - - [2944, 128, 1, 1280]
    - [1, 33.238]
  - - [1856, 5056, 1, 128]
    - [44, 68.566]
  - - [64, 256, 1, 256]
    - [1, 0.936]
  - - [1408, 4, 1, 128]
    - [1, 0.26]
  - - [128, 2368, 1, 128]
    - [0, 9.934]
  - - [256, 704, 1, 1280]
    - [0, 15.334]
  - - [64, 2368, 1, 128]
    - [1, 5.024]
  - - [6784, 6784, 1, 3328]
    - [63, 97.713]
  - - [448, 5888, 1, 1280]
    - [5, 69.896]
  - - [5056, 448, 1, 128]
    - [5, 21.886]
  - - [3584, 2944, 1, 128]
    - [43, 69.295]
  - - [6784, 256, 1, 1280]
    - [4, 70.7]
  - - [256, 2944, 1, 1280]
    - [0, 48.198]
  - - [64, 4288, 1, 128]
    - [0, 8.746]
  - - [2368, 5888, 1, 3328]
    - [45, 95.218]
  - - [4, 64, 1, 256]
    - [1, 0.013]
  - - [704, 1024, 1, 3328]
    - [0, 50.618]
  - - [2368, 1856, 1, 1280]
    - [61, 88.235]
  - - [128, 448, 1, 128]
    - [1, 1.583]
  - - [128, 6784, 1, 256]
    - [1, 35.151]
  - - [3584, 4288, 1, 128]
    - [36, 74.831]
  - - [64, 448, 1, 128]
    - [0, 0.807]
  - - [5888, 4288, 1, 3328]
    - [44, 96.4]
  - - [2368, 704, 1, 256]
    - [1, 29.865]
  - - [256, 1856, 1, 3328]
    - [0, 31.941]
  - - [1856, 128, 1, 256]
    - [1, 13.773]
  - - [6784, 128, 1, 128]
    - [1, 24.199]
  - - [3584, 1408, 1, 128]
    - [65, 57.872]
  - - [1856, 5056, 1, 1280]
    - [62, 92.731]
  - - [2944, 1024, 1, 1280]
    - [2, 66.298]
  - - [5056, 4, 1, 256]
    - [0, 1.01]
  - - [2368, 4288, 1, 256]
    - [62, 84.115]
  - - [1024, 2368, 1, 3328]
    - [5, 69.737]
  - - [64, 704, 1, 3328]
    - [0, 3.917]
  - - [704, 1408, 1, 256]
    - [2, 31.766]
  - - [6784, 1856, 1, 3328]
    - [44, 94.244]
  - - [1024, 2944, 1, 128]
    - [2, 32.264]
  - - [1024, 3584, 1, 1280]
    - [5, 63.385]
  - - [4288, 5888, 1, 3328]
    - [44, 96.425]
  - - [4288, 4, 1, 3328]
    - [1, 1.277]
  - - [256, 1408, 1, 256]
    - [1, 20.285]
  - - [448, 2944, 1, 1280]
    - [2, 55.737]
  - - [4, 5888, 1, 128]
    - [1, 0.854]
  - - [1024, 2944, 1, 3328]
    - [5, 68.053]
  - - [3584, 6784, 1, 256]
    - [62, 90.674]
  - - [256, 6784, 1, 1280]
    - [4, 70.75]
  - - [1856, 3584, 1, 256]
    - [62, 81.168]
  - - [128, 448, 1, 3328]
    - [1, 5.068]
  - - [6784, 1856, 1, 128]
    - [62, 72.815]
  - - [4, 448, 1, 256]
    - [0, 0.094]
  - - [2944, 704, 1, 128]
    - [2, 23.305]
  - - [256, 5888, 1, 1280]
    - [4, 61.493]
  - - [4, 128, 1, 1280]
    - [0, 0.043]
  - - [4288, 6784, 1, 3328]
    - [61, 96.872]
  - - [6784, 128, 1, 1280]
    - [1, 56.219]
  - - [64, 1408, 1, 256]
    - [0, 4.835]
  - - [2368, 1408, 1, 128]
    - [4, 33.333]
  - - [1856, 448, 1, 256]
    - [2, 21.365]
  - - [1408, 1024, 1, 128]
    - [6, 25.434]
  - - [128, 64, 1, 128]
    - [1, 0.241]
  - - [6784, 3584, 1, 3328]
    - [61, 96.002]
  - - [2944, 64, 1, 3328]
    - [0, 17.316]
  - - [64, 64, 1, 128]
    - [0, 0.127]
  - - [2368, 5056, 1, 1280]
    - [61, 94.241]
  - - [64, 4, 1, 1280]
    - [0, 0.021]
  - - [1408, 2368, 1, 1280]
    - [7, 67.817]
  - - [128, 1408, 1, 1280]
    - [1, 15.8]
  - - [256, 64, 1, 3328]
    - [0, 1.474]
  - - [2944, 4288, 1, 128]
    - [62, 72.936]
  - - [2944, 2944, 1, 256]
    - [43, 83.736]
  - - [2944, 4, 1, 1280]
    - [1, 1.06]
  - - [5888, 4, 1, 256]
    - [1, 1.161]
  - - [6784, 256, 1, 256]
    - [5, 42.813]
  - - [256, 5056, 1, 3328]
    - [2, 60.551]
  - - [128, 4288, 1, 1280]
    - [0, 33.469]
  - - [5056, 1856, 1, 128]
    - [36, 69.145]
  - - [5888, 1408, 1, 256]
    - [43, 82.782]
  - - [128, 128, 1, 256]
    - [1, 0.879]
  - - [5056, 4, 1, 3328]
    - [0, 1.506]
  - - [4288, 3584, 1, 3328]
    - [44, 96.449]
  - - [448, 704, 1, 3328]
    - [0, 29.074]
  - - [448, 448, 1, 128]
    - [1, 6.541]
  - - [1024, 2368, 1, 1280]
    - [5, 64.519]
  - - [1856, 704, 1, 3328]
    - [4, 57.217]
  - - [4, 2368, 1, 128]
    - [1, 0.355]
  - - [5888, 6784, 1, 3328]
    - [63, 97.129]
  - - [704, 4288, 1, 1280]
    - [3, 61.445]
  - - [704, 256, 1, 256]
    - [1, 10.143]
  - - [6784, 448, 1, 3328]
    - [5, 67.231]
  - - [4288, 1024, 1, 128]
    - [43, 53.687]
  - - [960, 1024, 1, 1024]
    - [2, 43.831]
  - - [1920, 2048, 1, 2048]
    - [5, 70.897]
  - - [2880, 3072, 1, 3072]
    - [44, 92.92]
  - - [3840, 4096, 1, 4096]
    - [35, 96.405]
  - - [7680, 8192, 1, 8192]
    - [45, 97.544]
  - - [512, 512, 1, 512]
    - [0, 18.274]
  - - [2048, 2048, 1, 2048]
    - [35, 93.394]
  - - [3072, 3072, 1, 3072]
    - [45, 94.791]
  - - [4096, 4096, 1, 4096]
    - [77, 96.748]
  - - [8192, 8192, 1, 8192]
    - [45, 97.585]
  - - [384, 384, 1, 384]
    - [0, 9.557]
  - - [768, 768, 1, 768]
    - [0, 35.941]
  - - [1152, 1152, 1, 1152]
    - [2, 58.339]
  - - [1536, 1536, 1, 1536]
    - [3, 64.628]
  - - [1920, 1920, 1, 1920]
    - [2, 66.095]
  - - [2304, 2304, 1, 2304]
    - [43, 92.786]
  - - [2688, 2688, 1, 2688]
    - [45, 92.196]
  - - [3456, 3456, 1, 3456]
    - [61, 95.511]
  - - [3840, 3840, 1, 3840]
    - [44, 95.265]
  - - [4224, 4224, 1, 4224]
    - [61, 96.634]
  - - [4608, 4608, 1, 4608]
    - [44, 97.089]
  - - [4992, 4992, 1, 4992]
    - [61, 96.953]
  - - [5376, 5376, 1, 5376]
    - [45, 96.455]
  - - [5760, 5760, 1, 5760]
    - [44, 96.93]
  - - [6144, 6144, 1, 6144]
    - [45, 97.003]
  - - [6528, 6528, 1, 6528]
    - [44, 97.731]
  - - [6912, 6912, 1, 6912]
    - [44, 97.199]
  - - [7296, 7296, 1, 7296]
    - [44, 97.329]
  - - [7680, 7680, 1, 7680]
    - [45, 97.914]
  - - [15, 160, 1024, 642]
    - [8, 26.65]
  - - [40, 160, 1024, 642]
    - [9, 43.181]
  - - [2001, 2001, 1, 51]
    - [10, 17.633]
  - - [3001, 3001, 1, 51]
    - [11, 20.99]
  - - [4454, 4454, 1, 51]
    - [12, 26.599]
  - - [6454, 6454, 1, 51]
    - [13, 30.712]
  - - [7985, 7985, 1, 51]
    - [13, 30.108]
  - - [9603, 9603, 1, 51]
    - [13, 30.318]
  - - [11505, 11505, 1, 51]
    - [13, 30.499]
  - - [13179, 13179, 1, 51]
    - [14, 32.005]
  - - [15420, 15420, 1, 51]
    - [14, 36.842]
  - - [17445, 17445, 1, 51]
    - [13, 31.545]
  - - [19343, 19343, 1, 51]
    - [13, 31.219]
  - - [21581, 21581, 1, 51]
    - [14, 31.156]
  - - [25854, 25854, 1, 51]
    - [13, 31.556]
  - - [30421, 30421, 1, 51]
    - [15, 30.02]
  - - [35882, 35882, 1, 51]
    - [16, 31.857]
  - - [40401, 40401, 1, 51]
    - [17, 29.892]
  - - [45312, 45312, 1, 51]
    - [18, 50.359]
  - - [51821, 51821, 1, 51]
    - [16, 29.789]
  - - [60766, 60766, 1, 51]
    - [19, 30.426]
  - - [67143, 67143, 1, 51]
    - [16, 30.182]
  - - [74567, 74567, 1, 51]
    - [17, 29.963]
  - - [83456, 83456, 1, 51]
    - [20, 47.555]
  - - [92345, 92345, 1, 51]
    - [16, 29.42]
  - - [2001, 2001, 1, 103]
    - [21, 30.43]
  - - [3001, 3001, 1, 103]
    - [22, 39.477]
  - - [4454, 4454, 1, 103]
    - [23, 49.389]
  - - [6454, 6454, 1, 103]
    - [14, 57.315]
  - - [7985, 7985, 1, 103]
    - [13, 57.904]
  - - [9603, 9603, 1, 103]
    - [14, 57.309]
  - - [11505, 11505, 1, 103]
    - [13, 57.2]
  - - [13179, 13179, 1, 103]
    - [13, 58.198]
  - - [15420, 15420, 1, 103]
    - [24, 64.421]
  - - [17445, 17445, 1, 103]
    - [25, 55.869]
  - - [19343, 19343, 1, 103]
    - [25, 56.234]
  - - [21581, 21581, 1, 103]
    - [25, 56.391]
  - - [25854, 25854, 1, 103]
    - [25, 58.528]
  - - [30421, 30421, 1, 103]
    - [25, 56.308]
  - - [35882, 35882, 1, 103]
    - [25, 59.931]
  - - [40401, 40401, 1, 103]
    - [24, 56.721]
  - - [45312, 45312, 1, 103]
    - [26, 83.51]
  - - [51821, 51821, 1, 103]
    - [24, 56.223]
  - - [60766, 60766, 1, 103]
    - [27, 57.85]
  - - [67143, 67143, 1, 103]
    - [27, 57.264]
  - - [74567, 74567, 1, 103]
    - [25, 57.219]
  - - [83456, 83456, 1, 103]
    - [26, 80.106]
  - - [92345, 92345, 1, 103]
    - [27, 55.942]
  - - [2001, 2001, 1, 223]
    - [28, 51.525]
  - - [3001, 3001, 1, 223]
    - [29, 66.293]
  - - [4454, 4454, 1, 223]
    - [30, 79.482]
  - - [6454, 6454, 1, 223]
    - [31, 84.03]
  - - [7985, 7985, 1, 223]
    - [32, 86.4]
  - - [9603, 9603, 1, 223]
    - [26, 87.068]
  - - [11505, 11505, 1, 223]
    - [26, 89.878]
  - - [13179, 13179, 1, 223]
    - [32, 90.281]
  - - [15420, 15420, 1, 223]
    - [32, 92.613]
  - - [17445, 17445, 1, 223]
    - [32, 91.477]
  - - [19343, 19343, 1, 223]
    - [26, 91.523]
  - - [32768, 32768, 1, 51]
    - [33, 46.131]
  - - [32769, 32769, 1, 51]
    - [34, 30.745]
  - - [32768, 32768, 1, 103]
    - [33, 70.72]
  - - [32769, 32769, 1, 103]
    - [14, 49.871]
  - - [2001, 2001, 1, 511]
    - [35, 68.582]
  - - [3001, 3001, 1, 511]
    - [36, 77.897]
  - - [4454, 4454, 1, 511]
    - [37, 88.627]
  - - [6454, 6454, 1, 511]
    - [49, 89.737]
  - - [7985, 7985, 1, 511]
    - [50, 92.589]
  - - [9603, 9603, 1, 511]
    - [51, 92.639]
  - - [11505, 11505, 1, 511]
    - [51, 95.008]
  - - [13179, 13179, 1, 511]
    - [51, 96.188]
  - - [15420, 15420, 1, 511]
    - [50, 95.589]
  - - [17445, 17445, 1, 511]
    - [54, 95.925]
  - - [19343, 19343, 1, 511]
    - [50, 95.768]
  - - [2001, 2001, 1, 2201]
    - [38, 87.258]
  - - [3001, 3001, 1, 2201]
    - [39, 91.838]
  - - [4454, 4454, 1, 2201]
    - [48, 94.683]
  - - [6454, 6454, 1, 2201]
    - [40, 95.424]
  - - [7985, 7985, 1, 2201]
    - [39, 95.623]
  - - [9603, 9603, 1, 2201]
    - [41, 95.132]
  - - [11505, 11505, 1, 2201]
    - [42, 96.904]
  - - [13179, 13179, 1, 2201]
    - [53, 97.648]
  - - [15420, 15420, 1, 2201]
    - [53, 96.65]
  - - [17445, 17445, 1, 2201]
    - [53, 96.844]
  - - [19343, 19343, 1, 2201]
    - [53, 96.516]
  - - [2001, 2001, 1, 4101]
    - [43, 89.245]
  - - [3001, 3001, 1, 4101]
    - [44, 93.215]
  - - [4454, 4454, 1, 4101]
    - [48, 95.667]
  - - [6454, 6454, 1, 4101]
    - [45, 96.056]
  - - [7985, 7985, 1, 4101]
    - [46, 96.0]
  - - [9603, 9603, 1, 4101]
    - [47, 95.452]
  - - [11505, 11505, 1, 4101]
    - [52, 96.841]
  - - [13179, 13179, 1, 4101]
    - [52, 97.776]
  - - [15420, 15420, 1, 4101]
    - [53, 96.741]
  - - [17445, 17445, 1, 4101]
    - [53, 96.919]
  - - [19343, 19343, 1, 4101]
    - [55, 96.597]
  - - [21581, 21581, 1, 223]
    - [56, 90.415]
  - - [21581, 21581, 1, 511]
    - [56, 96.597]
  - - [21581, 21581, 1, 2201]
    - [52, 97.436]
  - - [21581, 21581, 1, 4101]
    - [53, 97.492]
  - - [25854, 25854, 1, 223]
    - [56, 91.239]
  - - [25854, 25854, 1, 511]
    - [51, 97.112]
  - - [25854, 25854, 1, 2201]
    - [52, 97.91]
  - - [25854, 25854, 1, 4101]
    - [52, 97.956]
  - - [30421, 30421, 1, 223]
    - [56, 90.75]
  - - [30421, 30421, 1, 511]
    - [51, 97.038]
  - - [30421, 30421, 1, 2201]
    - [53, 97.716]
  - - [30421, 30421, 1, 4101]
    - [52, 97.757]
  - - [35882, 35882, 1, 223]
    - [56, 92.352]
  - - [35882, 35882, 1, 511]
    - [56, 96.947]
  - - [35882, 35882, 1, 2201]
    - [53, 97.505]
  - - [35882, 35882, 1, 4101]
    - [53, 97.538]
  - - [40401, 40401, 1, 223]
    - [51, 90.78]
  - - [40401, 40401, 1, 511]
    - [56, 97.211]
  - - [40401, 40401, 1, 2201]
    - [57, 97.823]
  - - [40401, 40401, 1, 4101]
    - [53, 97.855]
  - - [45312, 45312, 1, 223]
    - [54, 94.57]
  - - [45312, 45312, 1, 511]
    - [56, 97.548]
  - - [45312, 45312, 1, 2201]
    - [58, 98.078]
  - - [45312, 45312, 1, 4101]
    - [53, 98.107]
  - - [51821, 51821, 1, 223]
    - [51, 90.528]
  - - [51821, 51821, 1, 511]
    - [56, 97.432]
  - - [51821, 51821, 1, 2201]
    - [53, 98.016]
  - - [51821, 51821, 1, 4101]
    - [52, 98.039]
  - - [60766, 60766, 1, 223]
    - [56, 90.884]
  - - [60766, 60766, 1, 511]
    - [56, 97.428]
  - - [60766, 60766, 1, 2201]
    - [53, 97.982]
  - - [60766, 60766, 1, 4101]
    - [57, 98.007]
  - - [67143, 67143, 1, 223]
    - [56, 91.293]
  - - [67143, 67143, 1, 511]
    - [56, 97.386]
  - - [67143, 67143, 1, 2201]
    - [57, 97.92]
  - - [67143, 67143, 1, 4101]
    - [53, 97.941]
  - - [74567, 74567, 1, 223]
    - [56, 91.26]
  - - [74567, 74567, 1, 511]
    - [56, 97.418]
  - - [74567, 74567, 1, 2201]
    - [57, 97.945]
  - - [74567, 74567, 1, 4101]
    - [57, 97.964]
  - - [83456, 83456, 1, 223]
    - [56, 94.662]
  - - [83456, 83456, 1, 511]
    - [56, 97.587]
  - - [83456, 83456, 1, 2201]
    - [58, 98.095]
  - - [83456, 83456, 1, 4101]
    - [52, 98.121]
  - - [92345, 92345, 1, 223]
    - [51, 90.124]
  - - [92345, 92345, 1, 511]
    - [56, 97.419]
  - - [92345, 92345, 1, 2201]
    - [52, 97.95]
  - - [92345, 92345, 1, 4101]
    - [53, 97.966]
  - - [32768, 32768, 1, 223]
    - [59, 89.48]
  - - [32768, 32768, 1, 511]
    - [59, 97.332]
  - - [32768, 32768, 1, 2201]
    - [53, 98.009]
  - - [32768, 32768, 1, 4101]
    - [53, 98.046]
  - - [32769, 32769, 1, 223]
    - [60, 76.233]
  - - [32769, 32769, 1, 511]
    - [60, 95.107]
  - - [32769, 32769, 1, 2201]
    - [48, 97.258]
  - - [32769, 32769, 1, 4101]
    - [58, 97.297]
- null
