library/src/blas3/Tensile/Logic/asm_full/aldebaran/aldebaran_Cijk_Ailk_BjlkC_CB.yaml
- {MinimumRequiredVersion: 4.21.0}
- aldebaran
- gfx90a
- [Device 0050, Device 0051, Device 0052, Device 0054, Device 0062, Device 7400, Device
    SolutionIndex: 0
    SolutionNameMin: Cijk_Ailk_BjlkC_CB_MT64x64x8_MI16x16x4x1_SE_1LDSB0_IU2_SIA2_SRVW2
    SolutionIndex: 1
    SolutionNameMin: Cijk_Ailk_BjlkC_CB_MT128x64x8_MI16x16x4x1_SE_1LDSB0_IU2_SIA2_SRVW2
    SolutionIndex: 2
    SolutionNameMin: Cijk_Ailk_BjlkC_CB_MT64x64x8_MI16x16x4x1_SE_1LDSB1_IU2_SIA2_SRVW2
    SolutionIndex: 3
    SolutionNameMin: Cijk_Ailk_BjlkC_CB_MT128x64x8_MI16x16x4x1_SE_1LDSB1_IU2_SIA2_SRVW2
    SolutionIndex: 4
    SolutionNameMin: Cijk_Ailk_BjlkC_CB_MT32x32x32_MI16x16x4x1_SE_1LDSB1_IU8_SIA2_SRVW2
    SolutionIndex: 5
    SolutionNameMin: Cijk_Ailk_BjlkC_CB_MT64x64x8_MI16x16x4x1_SE_1LDSB0_IU2_SIA2_SRVW0
    SolutionIndex: 6
    SolutionNameMin: Cijk_Ailk_BjlkC_CB_MT64x64x16_MI16x16x4x1_SE_1LDSB0_IU1_SIA3_SRVW0
    SolutionIndex: 7
    SolutionNameMin: Cijk_Ailk_BjlkC_CB_MT64x64x8_MI16x16x4x1_SE_1LDSB0_IU2_SIA2_SRVW2
    SolutionIndex: 8
    SolutionNameMin: Cijk_Ailk_BjlkC_CB_MT128x64x8_MI16x16x4x1_SN_DTVA0_NEPBS0_PLR1_SU0_SUS0_TT2_64_WG64_4_1_WGM7
    SolutionIndex: 9
    SolutionNameMin: Cijk_Ailk_BjlkC_CB_MT256x64x8_MI32x32x2x1_SN_DTVA1_NEPBS0_PLR5_SU0_SUS0_TT2_64_WG128_2_1_WGM8
    SolutionIndex: 10
    SolutionNameMin: Cijk_Ailk_BjlkC_CB_MT256x64x8_MI32x32x2x1_SN_DTVA1_NEPBS0_PLR5_SU0_SUS0_TT2_64_WG128_2_1_WGM2
    SolutionIndex: 11
    SolutionNameMin: Cijk_Ailk_BjlkC_CB_MT128x64x16_MI16x16x4x1_SN_DTVA0_NEPBS0_PLR5_SU0_SUS0_TT2_64_WG64_4_1_WGM2
    SolutionIndex: 12
    SolutionNameMin: Cijk_Ailk_BjlkC_CB_MT256x64x8_MI32x32x2x1_SN_DTVA1_NEPBS0_PLR5_SU32_SUS256_TT2_64_WG128_2_1_WGM2
    SolutionIndex: 13
    SolutionNameMin: Cijk_Ailk_BjlkC_CB_MT128x64x8_MI16x16x4x1_SN_DTVA0_NEPBS0_PLR1_SU32_SUS256_TT2_64_WG64_4_1_WGM8
    SolutionIndex: 14
    SolutionNameMin: Cijk_Ailk_BjlkC_CB_MT256x64x8_MI32x32x2x1_SN_DTVA1_NEPBS0_PLR5_SU32_SUS256_TT2_64_WG128_2_1_WGM8
    SolutionIndex: 15
    SolutionNameMin: Cijk_Ailk_BjlkC_CB_MT256x64x8_MI32x32x2x1_SN_DTVA1_NEPBS0_PLR5_SU0_SUS0_TT2_64_WG128_2_1_WGM6
    SolutionIndex: 16
    SolutionNameMin: Cijk_Ailk_BjlkC_CB_MT256x64x8_MI32x32x2x1_SN_DTVA1_NEPBS0_PLR5_SU0_SUS0_TT2_64_WG128_2_1_WGM12
    SolutionIndex: 17
    SolutionNameMin: Cijk_Ailk_BjlkC_CB_MT128x64x8_MI16x16x4x1_SN_DTVA0_NEPBS0_PLR1_SU0_SUS0_TT2_64_WG64_4_1_WGM10
    SolutionIndex: 18
    SolutionNameMin: Cijk_Ailk_BjlkC_CB_MT64x64x16_MI16x16x4x1_SN_DTVA0_NEPBS0_PLR5_SU0_SUS0_TT2_32_WG32_8_1_WGM5
    SolutionIndex: 19
    SolutionNameMin: Cijk_Ailk_BjlkC_CB_MT64x64x16_MI16x16x4x1_SN_DTVA0_NEPBS1_PLR5_SU0_SUS0_TT2_32_WG32_8_1_WGM2
    SolutionIndex: 20
    SolutionNameMin: Cijk_Ailk_BjlkC_CB_MT128x64x8_MI16x16x4x1_SN_DTVA0_NEPBS0_PLR1_SU0_SUS0_TT2_64_WG64_4_1_WGM2
    SolutionIndex: 21
    SolutionNameMin: Cijk_Ailk_BjlkC_CB_MT64x64x16_MI16x16x4x1_SN_DTVA0_NEPBS1_PLR5_SU0_SUS0_TT2_32_WG32_8_1_WGM4
    SolutionIndex: 22
    SolutionNameMin: Cijk_Ailk_BjlkC_CB_MT64x64x16_MI16x16x4x1_SN_DTVA0_NEPBS1_PLR5_SU0_SUS0_TT2_32_WG32_8_1_WGM8
    SolutionIndex: 23
    SolutionNameMin: Cijk_Ailk_BjlkC_CB_MT128x64x8_MI16x16x4x1_SN_DTVA0_NEPBS0_PLR1_SU0_SUS0_TT2_64_WG64_4_1_WGM8
    SolutionIndex: 24
    SolutionNameMin: Cijk_Ailk_BjlkC_CB_MT128x64x8_MI16x16x4x1_SN_DTVA0_NEPBS0_PLR1_SU0_SUS0_TT2_64_WG64_4_1_WGM12
    SolutionIndex: 25
    SolutionNameMin: Cijk_Ailk_BjlkC_CB_MT128x64x8_MI16x16x4x1_SN_DTVA0_NEPBS1_PLR1_SU0_SUS0_TT2_64_WG64_4_1_WGM10
    SolutionIndex: 26
    SolutionNameMin: Cijk_Ailk_BjlkC_CB_MT64x64x16_MI16x16x4x1_SN_DTVA0_NEPBS0_PLR5_SU32_SUS256_TT2_32_WG32_8_1_WGM4
    SolutionIndex: 27
    SolutionNameMin: Cijk_Ailk_BjlkC_CB_MT64x64x16_MI16x16x4x1_SN_DTVA0_NEPBS0_PLR5_SU0_SUS0_TT2_32_WG32_8_1_WGM8
    SolutionIndex: 28
    SolutionNameMin: Cijk_Ailk_BjlkC_CB_MT64x64x16_MI16x16x4x1_SN_DTVA0_NEPBS0_PLR5_SU0_SUS0_TT2_32_WG32_8_1_WGM7
    SolutionIndex: 29
    SolutionNameMin: Cijk_Ailk_BjlkC_CB_MT64x64x16_MI16x16x4x1_SN_DTVA0_NEPBS1_PLR5_SU0_SUS0_TT2_32_WG32_8_1_WGM10
    SolutionIndex: 30
    SolutionNameMin: Cijk_Ailk_BjlkC_CB_MT64x64x16_MI16x16x4x1_SN_DTVA0_NEPBS1_PLR5_SU0_SUS0_TT2_32_WG32_8_1_WGM6
    SolutionIndex: 31
    SolutionNameMin: Cijk_Ailk_BjlkC_CB_MT64x64x16_MI16x16x4x1_SN_DTVA0_NEPBS1_PLR5_SU0_SUS0_TT2_32_WG32_8_1_WGM5
    SolutionIndex: 32
    SolutionNameMin: Cijk_Ailk_BjlkC_CB_MT64x64x16_MI16x16x4x1_SN_DTVA0_NEPBS1_PLR5_SU0_SUS0_TT2_32_WG32_8_1_WGM12
    SolutionIndex: 33
    SolutionNameMin: Cijk_Ailk_BjlkC_CB_MT64x64x16_MI16x16x4x1_SN_DTVA0_NEPBS1_PLR5_SU0_SUS0_TT2_32_WG32_8_1_WGM7
    SolutionIndex: 34
    SolutionNameMin: Cijk_Ailk_BjlkC_CB_MT128x64x8_MI16x16x4x1_SN_DTVA0_NEPBS0_PLR1_SU0_SUS0_TT2_64_WG64_4_1_WGM4
    SolutionIndex: 35
    SolutionNameMin: Cijk_Ailk_BjlkC_CB_MT64x64x16_MI16x16x4x1_SN_DTVA0_NEPBS0_PLR5_SU0_SUS0_TT2_32_WG32_8_1_WGM6
    SolutionIndex: 36
    SolutionNameMin: Cijk_Ailk_BjlkC_CB_MT64x64x16_MI16x16x4x1_SN_DTVA0_NEPBS0_PLR5_SU0_SUS0_TT2_32_WG32_8_1_WGM12
    SolutionIndex: 37
    SolutionNameMin: Cijk_Ailk_BjlkC_CB_MT128x64x8_MI16x16x4x1_SN_DTVA0_NEPBS0_PLR1_SU0_SUS0_TT2_64_WG64_4_1_WGM6
    SolutionIndex: 38
    SolutionNameMin: Cijk_Ailk_BjlkC_CB_MT128x64x8_MI16x16x4x1_SN_PLR1_WG64_4_1_WGM5
    SolutionIndex: 39
    SolutionNameMin: Cijk_Ailk_BjlkC_CB_MT128x64x8_MI16x16x4x1_SN_PLR1_WG64_4_1_WGM6
    SolutionIndex: 40
    SolutionNameMin: Cijk_Ailk_BjlkC_CB_MT128x64x8_MI16x16x4x1_SN_PLR1_WG64_4_1_WGM8
    SolutionIndex: 41
    SolutionNameMin: Cijk_Ailk_BjlkC_CB_MT128x64x16_MI16x16x4x1_SN_PLR5_WG64_4_1_WGM7
    SolutionIndex: 42
    SolutionNameMin: Cijk_Ailk_BjlkC_CB_MT128x64x8_MI16x16x4x1_SN_PLR1_WG64_4_1_WGM7
    SolutionIndex: 43
    SolutionNameMin: Cijk_Ailk_BjlkC_CB_MT128x64x16_MI16x16x4x1_SN_PLR5_WG64_4_1_WGM5
    SolutionIndex: 44
    SolutionNameMin: Cijk_Ailk_BjlkC_CB_MT128x64x16_MI16x16x4x1_SN_PLR5_WG64_4_1_WGM4
    SolutionIndex: 45
    SolutionNameMin: Cijk_Ailk_BjlkC_CB_MT128x64x16_MI16x16x4x1_SN_PLR5_WG64_4_1_WGM8
    SolutionIndex: 46
    SolutionNameMin: Cijk_Ailk_BjlkC_CB_MT128x64x16_MI16x16x4x1_SN_PLR5_WG64_4_1_WGM6
    SolutionIndex: 47
    SolutionNameMin: Cijk_Ailk_BjlkC_CB_MT128x32x8_MI16x16x4x1_SN_1LDSB1_AMAS3_GRVW2_MIAV1_NEPBS4_NLCB1_PLR3_SU32_SUS256_SVW2_TT2_32_VW2_WG64_4_1
    SolutionIndex: 48
    SolutionNameMin: Cijk_Ailk_BjlkC_CB_MT128x64x8_MI16x16x4x1_SN_1LDSB1_AMAS3_GRVW2_MIAV1_NEPBS2_NLCB1_PLR3_SU32_SUS256_SVW2_TT2_64_VW2_WG64_4_1
- - - [3840, 4096, 1, 4096]
    - [0, 98.704]
  - - [960, 1024, 1, 1024]
    - [2, 93.853]
  - - [480, 512, 1, 512]
    - [4, 63.655]
  - - [1920, 2048, 1, 2048]
    - [1, 97.483]
  - - [1, 64, 1, 256]
    - [5, 0.012]
  - - [7680, 8192, 1, 8192]
    - [3, 99.339]
  - - [64, 64, 1, 256]
    - [6, 0.527]
  - - [1, 1, 1, 256]
    - [5, 0.0]
  - - [64, 1, 1, 256]
    - [5, 0.012]
  - - [64, 64, 2, 64]
    - [7, 0.587]
  - - [2001, 2001, 1, 51]
    - [8, 43.746]
  - - [3001, 3001, 1, 51]
    - [9, 53.235]
  - - [4454, 4454, 1, 51]
    - [10, 66.563]
  - - [6454, 6454, 1, 51]
    - [11, 74.249]
  - - [7985, 7985, 1, 51]
    - [12, 73.258]
  - - [9603, 9603, 1, 51]
    - [12, 74.675]
  - - [11505, 11505, 1, 51]
    - [10, 74.277]
  - - [13179, 13179, 1, 51]
    - [10, 75.649]
  - - [15420, 15420, 1, 51]
    - [13, 85.344]
  - - [17445, 17445, 1, 51]
    - [14, 75.861]
  - - [19343, 19343, 1, 51]
    - [15, 75.948]
  - - [21581, 21581, 1, 51]
    - [14, 75.912]
  - - [25854, 25854, 1, 51]
    - [16, 76.591]
  - - [30421, 30421, 1, 51]
    - [14, 76.577]
  - - [35882, 35882, 1, 51]
    - [9, 77.711]
  - - [40401, 40401, 1, 51]
    - [9, 76.91]
  - - [45312, 45312, 1, 51]
    - [17, 96.095]
  - - [51821, 51821, 1, 51]
    - [9, 77.109]
  - - [60766, 60766, 1, 51]
    - [9, 77.843]
  - - [67143, 67143, 1, 51]
    - [9, 77.722]
  - - [2001, 2001, 1, 103]
    - [18, 72.337]
  - - [3001, 3001, 1, 103]
    - [19, 83.307]
  - - [4454, 4454, 1, 103]
    - [20, 90.181]
  - - [6454, 6454, 1, 103]
    - [21, 93.54]
  - - [7985, 7985, 1, 103]
    - [22, 93.764]
  - - [9603, 9603, 1, 103]
    - [38, 93.576]
  - - [11505, 11505, 1, 103]
    - [13, 95.548]
  - - [13179, 13179, 1, 103]
    - [23, 95.98]
  - - [15420, 15420, 1, 103]
    - [22, 96.083]
  - - [17445, 17445, 1, 103]
    - [24, 95.962]
  - - [19343, 19343, 1, 103]
    - [39, 95.994]
  - - [21581, 21581, 1, 103]
    - [40, 96.357]
  - - [25854, 25854, 1, 103]
    - [24, 96.945]
  - - [30421, 30421, 1, 103]
    - [42, 96.739]
  - - [35882, 35882, 1, 103]
    - [24, 96.807]
  - - [40401, 40401, 1, 103]
    - [40, 96.893]
  - - [45312, 45312, 1, 103]
    - [17, 97.191]
  - - [51821, 51821, 1, 103]
    - [25, 97.022]
  - - [60766, 60766, 1, 103]
    - [24, 97.086]
  - - [67143, 67143, 1, 103]
    - [40, 97.044]
  - - [2001, 2001, 1, 223]
    - [26, 83.206]
  - - [3001, 3001, 1, 223]
    - [27, 90.203]
  - - [4454, 4454, 1, 223]
    - [28, 93.833]
  - - [6454, 6454, 1, 223]
    - [29, 95.915]
  - - [7985, 7985, 1, 223]
    - [30, 96.371]
  - - [9603, 9603, 1, 223]
    - [29, 95.663]
  - - [11505, 11505, 1, 223]
    - [31, 96.776]
  - - [13179, 13179, 1, 223]
    - [32, 97.2]
  - - [15420, 15420, 1, 223]
    - [32, 97.356]
  - - [17445, 17445, 1, 223]
    - [21, 97.187]
  - - [19343, 19343, 1, 223]
    - [21, 97.054]
  - - [2001, 2001, 1, 511]
    - [20, 87.801]
  - - [3001, 3001, 1, 511]
    - [33, 93.413]
  - - [4454, 4454, 1, 511]
    - [30, 95.597]
  - - [6454, 6454, 1, 511]
    - [30, 96.941]
  - - [7985, 7985, 1, 511]
    - [33, 97.179]
  - - [9603, 9603, 1, 511]
    - [30, 96.178]
  - - [11505, 11505, 1, 511]
    - [22, 97.321]
  - - [13179, 13179, 1, 511]
    - [29, 97.652]
  - - [15420, 15420, 1, 511]
    - [33, 97.771]
  - - [17445, 17445, 1, 511]
    - [33, 97.56]
  - - [19343, 19343, 1, 511]
    - [32, 97.415]
  - - [2001, 2001, 1, 2201]
    - [17, 92.296]
  - - [3001, 3001, 1, 2201]
    - [18, 95.297]
  - - [4454, 4454, 1, 2201]
    - [34, 96.558]
  - - [6454, 6454, 1, 2201]
    - [30, 97.479]
  - - [7985, 7985, 1, 2201]
    - [33, 97.577]
  - - [9603, 9603, 1, 2201]
    - [21, 96.434]
  - - [11505, 11505, 1, 2201]
    - [24, 97.527]
  - - [13179, 13179, 1, 2201]
    - [17, 97.834]
  - - [15420, 15420, 1, 2201]
    - [32, 97.924]
  - - [17445, 17445, 1, 2201]
    - [33, 97.695]
  - - [19343, 19343, 1, 2201]
    - [33, 97.533]
  - - [2001, 2001, 1, 4101]
    - [20, 92.996]
  - - [3001, 3001, 1, 4101]
    - [27, 95.649]
  - - [4454, 4454, 1, 4101]
    - [35, 96.76]
  - - [6454, 6454, 1, 4101]
    - [36, 97.61]
  - - [7985, 7985, 1, 4101]
    - [30, 97.683]
  - - [9603, 9603, 1, 4101]
    - [19, 96.524]
  - - [11505, 11505, 1, 4101]
    - [37, 97.611]
  - - [13179, 13179, 1, 4101]
    - [23, 97.913]
  - - [15420, 15420, 1, 4101]
    - [30, 97.997]
  - - [17445, 17445, 1, 4101]
    - [19, 97.765]
  - - [19343, 19343, 1, 4101]
    - [21, 97.603]
  - - [21581, 21581, 1, 223]
    - [39, 97.056]
  - - [21581, 21581, 1, 511]
    - [40, 97.363]
  - - [21581, 21581, 1, 2201]
    - [41, 97.293]
  - - [21581, 21581, 1, 4101]
    - [42, 97.534]
  - - [25854, 25854, 1, 223]
    - [42, 97.622]
  - - [25854, 25854, 1, 511]
    - [40, 97.941]
  - - [25854, 25854, 1, 2201]
    - [43, 97.868]
  - - [25854, 25854, 1, 4101]
    - [39, 98.111]
  - - [30421, 30421, 1, 223]
    - [39, 97.355]
  - - [30421, 30421, 1, 511]
    - [38, 97.636]
  - - [30421, 30421, 1, 2201]
    - [44, 97.54]
  - - [30421, 30421, 1, 4101]
    - [38, 97.781]
  - - [35882, 35882, 1, 223]
    - [42, 97.385]
  - - [35882, 35882, 1, 511]
    - [45, 97.661]
  - - [35882, 35882, 1, 2201]
    - [45, 97.56]
  - - [35882, 35882, 1, 4101]
    - [39, 97.8]
  - - [40401, 40401, 1, 223]
    - [39, 97.469]
  - - [40401, 40401, 1, 511]
    - [41, 97.737]
  - - [40401, 40401, 1, 2201]
    - [41, 97.631]
  - - [40401, 40401, 1, 4101]
    - [38, 97.871]
  - - [45312, 45312, 1, 223]
    - [40, 97.733]
  - - [45312, 45312, 1, 511]
    - [46, 97.996]
  - - [45312, 45312, 1, 2201]
    - [41, 97.888]
  - - [45312, 45312, 1, 4101]
    - [42, 98.128]
  - - [51821, 51821, 1, 223]
    - [44, 97.659]
  - - [51821, 51821, 1, 511]
    - [44, 97.925]
  - - [51821, 51821, 1, 2201]
    - [46, 97.817]
  - - [51821, 51821, 1, 4101]
    - [40, 98.057]
  - - [60766, 60766, 1, 223]
    - [43, 97.639]
  - - [60766, 60766, 1, 511]
    - [44, 97.898]
  - - [60766, 60766, 1, 2201]
    - [46, 97.787]
  - - [60766, 60766, 1, 4101]
    - [38, 98.026]
  - - [67143, 67143, 1, 223]
    - [46, 97.587]
  - - [67143, 67143, 1, 511]
    - [44, 97.844]
  - - [67143, 67143, 1, 2201]
    - [43, 97.731]
  - - [67143, 67143, 1, 4101]
    - [39, 97.971]
  - - [1031, 1031, 1, 1031]
    - [47, 66.989]
  - - [4095, 4095, 1, 1031]
    - [48, 88.885]
- null
