library/src/blas3/Tensile/Logic/asm_full/aldebaran/aldebaran_Cijk_Ailk_Bljk_DB_GB.yaml
- {MinimumRequiredVersion: 4.7.2}
- aldebaran
- gfx90a
- [Device 0050, Device 0051, Device 0052, Device 0054, Device 0062, Device 7400, Device
    SolutionIndex: 1
    SolutionNameMin: Cijk_Ailk_Bljk_DB_MT128x128x16_MI16x16x4x1_SN_IU1_NEPBS4_NLCA1_PLR5_SU32_SUS256_TT4_64_TLDS0_WG32_8_1_WGM5
    SolutionIndex: 2
    SolutionNameMin: Cijk_Ailk_Bljk_DB_MT128x128x16_MI16x16x4x1_SN_IU2_NEPBS4_NLCA1_PLR3_SU32_SUS128_TT4_64_TLDS0_WG32_8_1_WGM11
    SolutionIndex: 3
    SolutionNameMin: Cijk_Ailk_Bljk_DB_MT128x128x8_MI16x16x4x1_SN_IU1_NEPBS4_NLCA1_PLR3_SU32_SUS128_TT4_64_TLDS0_WG32_8_1_WGM5
    SolutionIndex: 4
    SolutionNameMin: Cijk_Ailk_Bljk_DB_MT128x128x16_MI16x16x4x1_SN_IU1_NEPBS4_NLCA1_PLR5_SU32_SUS128_TT4_64_TLDS0_WG32_8_1_WGM11
    SolutionIndex: 5
    SolutionNameMin: Cijk_Ailk_Bljk_DB_MT128x128x16_MI16x16x4x1_SN_IU1_NEPBS1_NLCA1_PLR5_SU0_SUS128_TT4_64_TLDS0_WG32_8_1_WGM5
    SolutionIndex: 6
    SolutionNameMin: Cijk_Ailk_Bljk_DB_MT128x128x16_MI16x16x4x1_SN_IU1_NEPBS4_NLCA1_PLR5_SU32_SUS128_TT4_64_TLDS0_WG32_8_1_WGM5
    SolutionIndex: 7
    SolutionNameMin: Cijk_Ailk_Bljk_DB_MT128x128x8_MI16x16x4x1_SN_IU1_NEPBS4_NLCA1_PLR3_SU32_SUS128_TT4_64_TLDS0_WG32_8_1_WGM11
    SolutionIndex: 8
    SolutionNameMin: Cijk_Ailk_Bljk_DB_MT128x128x8_MI16x16x4x1_SN_IU1_NEPBS1_NLCA1_PLR3_SU32_SUS256_TT4_64_TLDS0_WG32_8_1_WGM5
    SolutionIndex: 9
    SolutionNameMin: Cijk_Ailk_Bljk_DB_MT128x96x16_MI16x16x4x1_SN_IU1_NEPBS4_NLCA1_PLR5_SU0_SUS128_TT2_96_TLDS0_WG64_4_1_WGM5
    SolutionIndex: 10
    SolutionNameMin: Cijk_Ailk_Bljk_DB_MT128x128x16_MI16x16x4x1_SN_IU2_NEPBS1_NLCA1_PLR3_SU0_SUS128_TT4_64_TLDS0_WG32_8_1_WGM5
    SolutionIndex: 11
    SolutionNameMin: Cijk_Ailk_Bljk_DB_MT128x96x16_MI16x16x4x1_SN_IU1_NEPBS1_NLCA1_PLR5_SU32_SUS256_TT2_96_TLDS0_WG64_4_1_WGM5
    SolutionIndex: 12
    SolutionNameMin: Cijk_Ailk_Bljk_DB_MT128x96x16_MI16x16x4x1_SN_IU2_NEPBS4_NLCA1_PLR3_SU0_SUS128_TT2_96_TLDS0_WG64_4_1_WGM5
    SolutionIndex: 13
    SolutionNameMin: Cijk_Ailk_Bljk_DB_MT128x128x16_MI16x16x4x1_SN_IU2_NEPBS4_NLCA1_PLR3_SU32_SUS128_TT4_64_TLDS0_WG32_8_1_WGM5
    SolutionIndex: 14
    SolutionNameMin: Cijk_Ailk_Bljk_DB_MT128x128x8_MI16x16x4x1_SN_IU1_NEPBS4_NLCA1_PLR3_SU0_SUS128_TT4_64_TLDS0_WG32_8_1_WGM5
    SolutionIndex: 15
    SolutionNameMin: Cijk_Ailk_Bljk_DB_MT128x128x8_MI16x16x4x1_SN_IU1_NEPBS4_NLCA1_PLR3_SU0_SUS256_TT4_64_TLDS0_WG32_8_1_WGM5
    SolutionIndex: 16
    SolutionNameMin: Cijk_Ailk_Bljk_DB_MT128x128x16_MI16x16x4x1_SN_IU2_NEPBS4_NLCA1_PLR3_SU32_SUS256_TT4_64_TLDS0_WG32_8_1_WGM5
    SolutionIndex: 17
    SolutionNameMin: Cijk_Ailk_Bljk_DB_MT128x96x16_MI16x16x4x1_SN_IU2_NEPBS1_NLCA1_PLR3_SU32_SUS256_TT2_96_TLDS0_WG64_4_1_WGM5
    SolutionIndex: 18
    SolutionNameMin: Cijk_Ailk_Bljk_DB_MT128x128x16_MI16x16x4x1_SN_IU2_NEPBS1_NLCA1_PLR3_SU0_SUS256_TT4_64_TLDS0_WG32_8_1_WGM5
    SolutionIndex: 19
    SolutionNameMin: Cijk_Ailk_Bljk_DB_MT128x96x16_MI16x16x4x1_SN_IU1_NEPBS4_NLCA1_PLR5_SU32_SUS128_TT2_96_TLDS0_WG64_4_1_WGM11
    SolutionIndex: 20
    SolutionNameMin: Cijk_Ailk_Bljk_DB_MT128x96x16_MI16x16x4x1_SN_IU1_NEPBS4_NLCA1_PLR5_SU32_SUS128_TT2_96_TLDS0_WG64_4_1_WGM5
    SolutionIndex: 21
    SolutionNameMin: Cijk_Ailk_Bljk_DB_MT128x128x16_MI16x16x4x1_SN_IU1_NEPBS1_NLCA1_PLR5_SU0_SUS256_TT4_64_TLDS0_WG32_8_1_WGM5
    SolutionIndex: 22
    SolutionNameMin: Cijk_Ailk_Bljk_DB_MT128x96x16_MI16x16x4x1_SN_IU2_NEPBS4_NLCA1_PLR3_SU0_SUS128_TT2_96_TLDS0_WG64_4_1_WGM11
    SolutionIndex: 23
    SolutionNameMin: Cijk_Ailk_Bljk_DB_MT128x96x16_MI16x16x4x1_SN_IU2_NEPBS4_NLCA1_PLR3_SU32_SUS256_TT2_96_TLDS0_WG64_4_1_WGM5
    SolutionIndex: 24
    SolutionNameMin: Cijk_Ailk_Bljk_DB_MT128x96x16_MI16x16x4x1_SN_IU1_NEPBS4_NLCA1_PLR5_SU0_SUS256_TT2_96_TLDS0_WG64_4_1_WGM11
    SolutionIndex: 25
    SolutionNameMin: Cijk_Ailk_Bljk_DB_MT128x96x16_MI16x16x4x1_SN_IU2_NEPBS4_NLCA1_PLR3_SU32_SUS128_TT2_96_TLDS0_WG64_4_1_WGM11
    SolutionIndex: 26
    SolutionNameMin: Cijk_Ailk_Bljk_DB_MT128x128x8_MI16x16x4x1_SN_IU1_NEPBS4_NLCA1_PLR3_SU0_SUS256_TT4_64_TLDS0_WG32_8_1_WGM11
    SolutionIndex: 27
    SolutionNameMin: Cijk_Ailk_Bljk_DB_MT128x96x16_MI16x16x4x1_SN_IU2_NEPBS4_NLCA1_PLR3_SU32_SUS128_TT2_96_TLDS0_WG64_4_1_WGM5
    SolutionIndex: 28
    SolutionNameMin: Cijk_Ailk_Bljk_DB_MT128x96x16_MI16x16x4x1_SN_IU2_NEPBS4_NLCA1_PLR3_SU0_SUS256_TT2_96_TLDS0_WG64_4_1_WGM5
    SolutionIndex: 29
    SolutionNameMin: Cijk_Ailk_Bljk_DB_MT128x96x16_MI16x16x4x1_SN_IU1_NEPBS4_NLCA1_PLR5_SU0_SUS128_TT2_96_TLDS0_WG64_4_1_WGM11
    SolutionIndex: 30
    SolutionNameMin: Cijk_Ailk_Bljk_DB_MT128x128x8_MI16x16x4x1_SN_IU1_NEPBS4_NLCA1_PLR3_SU32_SUS256_TT4_64_TLDS0_WG32_8_1_WGM11
    SolutionIndex: 31
    SolutionNameMin: Cijk_Ailk_Bljk_DB_MT128x128x8_MI16x16x4x1_SN_IU1_NEPBS1_NLCA1_PLR3_SU0_SUS128_TT4_64_TLDS0_WG32_8_1_WGM11
    SolutionIndex: 32
    SolutionNameMin: Cijk_Ailk_Bljk_DB_MT128x128x8_MI16x16x4x1_SN_IU1_NEPBS4_NLCA1_PLR3_SU0_SUS128_TT4_64_TLDS0_WG32_8_1_WGM11
    SolutionIndex: 33
    SolutionNameMin: Cijk_Ailk_Bljk_DB_MT128x96x16_MI16x16x4x1_SN_IU2_NEPBS4_NLCA1_PLR3_SU0_SUS256_TT2_96_TLDS0_WG64_4_1_WGM11
    SolutionIndex: 34
    SolutionNameMin: Cijk_Ailk_Bljk_DB_MT128x128x8_MI16x16x4x1_SN_IU1_NEPBS4_NLCA1_PLR3_SU32_SUS256_TT4_64_TLDS0_WG32_8_1_WGM5
    SolutionIndex: 35
    SolutionNameMin: Cijk_Ailk_Bljk_DB_MT128x128x8_MI16x16x4x1_SN_IU1_NEPBS1_NLCA1_PLR3_SU32_SUS128_TT4_64_TLDS0_WG32_8_1_WGM11
    SolutionIndex: 36
    SolutionNameMin: Cijk_Ailk_Bljk_DB_MT128x128x16_MI16x16x4x1_SN_IU1_NEPBS4_NLCA1_PLR5_SU0_SUS256_TT4_64_TLDS0_WG32_8_1_WGM11
    SolutionIndex: 37
    SolutionNameMin: Cijk_Ailk_Bljk_DB_MT128x96x16_MI16x16x4x1_SN_IU1_NEPBS4_NLCA1_PLR5_SU0_SUS256_TT2_96_TLDS0_WG64_4_1_WGM5
    SolutionIndex: 38
    SolutionNameMin: Cijk_Ailk_Bljk_DB_MT128x128x16_MI16x16x4x1_SN_IU2_NEPBS4_NLCA1_PLR3_SU32_SUS256_TT4_64_TLDS0_WG32_8_1_WGM11
    SolutionIndex: 39
    SolutionNameMin: Cijk_Ailk_Bljk_DB_MT128x96x16_MI16x16x4x1_SN_IU1_NEPBS4_NLCA1_PLR5_SU32_SUS256_TT2_96_TLDS0_WG64_4_1_WGM11
    SolutionIndex: 40
    SolutionNameMin: Cijk_Ailk_Bljk_DB_MT128x96x16_MI16x16x4x1_SN_IU2_NEPBS4_NLCA1_PLR3_SU32_SUS256_TT2_96_TLDS0_WG64_4_1_WGM11
    SolutionIndex: 41
    SolutionNameMin: Cijk_Ailk_Bljk_DB_MT96x128x16_MI16x16x4x1_SN_IU1_NEPBS4_NLCA3_PLR5_SU32_SUS256_TT6_32_TLDS0_WG16_16_1_WGM11
    SolutionIndex: 42
    SolutionNameMin: Cijk_Ailk_Bljk_DB_MT96x128x16_MI16x16x4x1_SN_IU1_NEPBS4_NLCA3_PLR5_SU0_SUS256_TT6_32_TLDS0_WG16_16_1_WGM5
    SolutionIndex: 43
    SolutionNameMin: Cijk_Ailk_Bljk_DB_MT96x128x16_MI16x16x4x1_SN_IU1_NEPBS4_NLCA3_PLR5_SU32_SUS128_TT6_32_TLDS0_WG16_16_1_WGM5
    SolutionIndex: 44
    SolutionNameMin: Cijk_Ailk_Bljk_DB_MT96x128x16_MI16x16x4x1_SN_IU2_NEPBS4_NLCA3_PLR3_SU0_SUS128_TT6_32_TLDS0_WG16_16_1_WGM11
    SolutionIndex: 45
    SolutionNameMin: Cijk_Ailk_Bljk_DB_MT96x128x16_MI16x16x4x1_SN_IU1_NEPBS4_NLCA3_PLR5_SU0_SUS128_TT6_32_TLDS0_WG16_16_1_WGM11
    SolutionIndex: 46
    SolutionNameMin: Cijk_Ailk_Bljk_DB_MT96x128x16_MI16x16x4x1_SN_IU1_NEPBS4_NLCA3_PLR5_SU0_SUS256_TT6_32_TLDS0_WG16_16_1_WGM11
    SolutionIndex: 47
    SolutionNameMin: Cijk_Ailk_Bljk_DB_MT128x128x16_MI16x16x4x1_SN_IU2_NEPBS4_NLCA1_PLR3_SU0_SUS128_TT4_64_TLDS0_WG32_8_1_WGM5
    SolutionIndex: 48
    SolutionNameMin: Cijk_Ailk_Bljk_DB_MT96x128x16_MI16x16x4x1_SN_IU2_NEPBS4_NLCA3_PLR3_SU0_SUS256_TT6_32_TLDS0_WG16_16_1_WGM5
    SolutionIndex: 49
    SolutionNameMin: Cijk_Ailk_Bljk_DB_MT96x128x16_MI16x16x4x1_SN_IU1_NEPBS4_NLCA3_PLR5_SU32_SUS128_TT6_32_TLDS0_WG16_16_1_WGM11
    SolutionIndex: 59
    SolutionNameMin: Cijk_Ailk_Bljk_DB_MT128x64x8_MI16x16x4x1_SN_1LDSB0_AMAS3_GRVW2_IU1_NEPBS4_NLCA1_PLR3_SU0_SUS256_SVW2_TT4_32_TLDS0_VW2_WG32_8_1_WGM5
    SolutionIndex: 60
    SolutionNameMin: Cijk_Ailk_Bljk_DB_MT32x16x16_MI16x16x4x1_SN_1LDSB0_AMAS0_GRVW1_IU2_NEPBS4_NLCA1_PLR3_SU0_SUS128_SVW1_TT1_16_TLDS0_VW1_WG32_4_1_WGM5
    SolutionIndex: 61
    SolutionNameMin: Cijk_Ailk_Bljk_DB_MT128x64x8_MI16x16x4x1_SN_1LDSB1_AMAS3_GRVW2_IU1_NEPBS4_NLCA1_PLR3_SU0_SUS256_SVW2_TT4_32_TLDS0_VW2_WG32_8_1_WGM11
    SolutionIndex: 62
    SolutionNameMin: Cijk_Ailk_Bljk_DB_MT16x32x16_MI16x16x4x1_SN_1LDSB0_AMAS0_GRVW1_IU1_NEPBS4_NLCA1_PLR5_SU0_SUS128_SVW1_TT1_16_TLDS1_VW1_WG16_8_1_WGM5
    SolutionIndex: 63
    SolutionNameMin: Cijk_Ailk_Bljk_DB_MT64x64x8_MI16x16x4x1_SN_1LDSB0_AMAS3_GRVW2_IU1_NEPBS4_NLCA1_PLR3_SU0_SUS128_SVW2_TT2_32_TLDS0_VW2_WG32_8_1_WGM5
    SolutionIndex: 64
    SolutionNameMin: Cijk_Ailk_Bljk_DB_MT64x16x16_MI16x16x4x1_SN_1LDSB0_AMAS3_GRVW2_IU2_NEPBS4_NLCA1_PLR3_SU0_SUS256_SVW2_TT2_16_TLDS0_VW2_WG32_4_1_WGM11
    SolutionIndex: 65
    SolutionNameMin: Cijk_Ailk_Bljk_DB_MT64x64x8_MI16x16x4x1_SN_1LDSB0_AMAS3_GRVW2_IU1_NEPBS4_NLCA1_PLR3_SU0_SUS256_SVW2_TT2_32_TLDS0_VW2_WG32_8_1_WGM11
    SolutionIndex: 66
    SolutionNameMin: Cijk_Ailk_Bljk_DB_MT32x16x16_MI16x16x4x1_SN_1LDSB0_AMAS0_GRVW1_IU1_NEPBS4_NLCA1_PLR5_SU0_SUS256_SVW1_TT1_16_TLDS0_VW1_WG32_4_1_WGM11
    SolutionIndex: 67
    SolutionNameMin: Cijk_Ailk_Bljk_DB_MT64x16x8_MI16x16x4x1_SN_1LDSB0_AMAS0_GRVW1_IU1_NEPBS4_NLCA1_PLR3_SU0_SUS128_SVW1_TT2_16_TLDS0_VW1_WG32_4_1_WGM11
    SolutionIndex: 68
    SolutionNameMin: Cijk_Ailk_Bljk_DB_MT64x32x16_MI16x16x4x1_SN_1LDSB0_AMAS3_GRVW2_IU1_NEPBS4_NLCA1_PLR5_SU0_SUS128_SVW2_TT2_16_TLDS0_VW2_WG32_8_1_WGM5
    SolutionIndex: 69
    SolutionNameMin: Cijk_Ailk_Bljk_DB_MT128x64x8_MI16x16x4x1_SN_1LDSB1_AMAS3_GRVW2_IU1_NEPBS4_NLCA1_PLR3_SU0_SUS128_SVW2_TT4_32_TLDS0_VW2_WG32_8_1_WGM11
    SolutionIndex: 70
    SolutionNameMin: Cijk_Ailk_Bljk_DB_MT64x32x8_MI16x16x4x1_SN_1LDSB0_AMAS3_GRVW2_IU1_NEPBS4_NLCA1_PLR3_SU0_SUS128_SVW2_TT2_16_TLDS0_VW2_WG32_8_1_WGM5
    SolutionIndex: 71
    SolutionNameMin: Cijk_Ailk_Bljk_DB_MT64x32x16_MI16x16x4x1_SN_1LDSB0_AMAS3_GRVW2_IU1_NEPBS4_NLCA1_PLR5_SU0_SUS256_SVW2_TT2_16_TLDS0_VW2_WG32_8_1_WGM11
    SolutionIndex: 72
    SolutionNameMin: Cijk_Ailk_Bljk_DB_MT64x64x16_MI16x16x4x1_SN_1LDSB1_AMAS3_GRVW2_IU2_NEPBS4_NLCA1_PLR3_SU0_SUS256_SVW2_TT2_32_TLDS0_VW2_WG32_8_1_WGM11
    SolutionIndex: 73
    SolutionNameMin: Cijk_Ailk_Bljk_DB_MT64x64x8_MI16x16x4x1_SN_1LDSB0_AMAS3_GRVW2_IU1_NEPBS4_NLCA1_PLR3_SU0_SUS256_SVW2_TT2_32_TLDS0_VW2_WG32_8_1_WGM5
    SolutionIndex: 74
    SolutionNameMin: Cijk_Ailk_Bljk_DB_MT64x64x8_MI16x16x4x1_SN_1LDSB0_AMAS3_GRVW2_IU1_NEPBS1_NLCA1_PLR3_SU0_SUS128_SVW2_TT2_32_TLDS0_VW2_WG32_8_1_WGM11
    SolutionIndex: 75
    SolutionNameMin: Cijk_Ailk_Bljk_DB_MT128x64x8_MI16x16x4x1_SN_1LDSB0_AMAS3_GRVW2_IU1_NEPBS4_NLCA1_PLR3_SU0_SUS256_SVW2_TT4_32_TLDS0_VW2_WG32_8_1_WGM11
    SolutionIndex: 76
    SolutionNameMin: Cijk_Ailk_Bljk_DB_MT64x64x8_MI16x16x4x1_SN_1LDSB0_AMAS3_GRVW2_IU1_NEPBS1_NLCA1_PLR3_SU32_SUS128_SVW2_TT2_32_TLDS0_VW2_WG32_8_1_WGM5
    SolutionIndex: 77
    SolutionNameMin: Cijk_Ailk_Bljk_DB_MT64x32x8_MI16x16x4x1_SN_1LDSB0_AMAS0_GRVW1_IU1_NEPBS4_NLCA1_PLR3_SU0_SUS256_SVW1_TT2_16_TLDS0_VW1_WG32_8_1_WGM5
    SolutionIndex: 78
    SolutionNameMin: Cijk_Ailk_Bljk_DB_MT64x32x16_MI16x16x4x1_SN_1LDSB0_AMAS3_GRVW2_IU1_NEPBS4_NLCA1_PLR5_SU0_SUS128_SVW2_TT2_16_TLDS0_VW2_WG32_8_1_WGM11
    SolutionIndex: 79
    SolutionNameMin: Cijk_Ailk_Bljk_DB_MT128x96x16_MI16x16x4x1_SN_1LDSB1_AMAS3_GRVW2_IU2_NEPBS4_NLCA1_PLR3_SU0_SUS128_SVW2_TT2_96_TLDS0_VW2_WG64_4_1_WGM5
    SolutionIndex: 80
    SolutionNameMin: Cijk_Ailk_Bljk_DB_MT32x16x16_MI16x16x4x1_SN_1LDSB0_AMAS0_GRVW1_IU2_NEPBS4_NLCA1_PLR3_SU0_SUS128_SVW1_TT1_16_TLDS0_VW1_WG32_4_1_WGM11
    SolutionIndex: 81
    SolutionNameMin: Cijk_Ailk_Bljk_DB_MT128x64x8_MI16x16x4x1_SN_1LDSB1_AMAS3_GRVW2_IU1_NEPBS4_NLCA1_PLR3_SU0_SUS128_SVW2_TT4_32_TLDS0_VW2_WG32_8_1_WGM5
    SolutionIndex: 82
    SolutionNameMin: Cijk_Ailk_Bljk_DB_MT128x64x8_MI16x16x4x1_SN_1LDSB0_AMAS3_GRVW2_IU1_NEPBS4_NLCA1_PLR3_SU0_SUS128_SVW2_TT4_32_TLDS0_VW2_WG32_8_1_WGM5
    SolutionIndex: 83
    SolutionNameMin: Cijk_Ailk_Bljk_DB_MT64x64x8_MI16x16x4x1_SN_1LDSB0_AMAS3_GRVW2_IU1_NEPBS4_NLCA1_PLR3_SU32_SUS128_SVW2_TT2_32_TLDS0_VW2_WG32_8_1_WGM11
    SolutionIndex: 84
    SolutionNameMin: Cijk_Ailk_Bljk_DB_MT64x64x16_MI16x16x4x1_SN_1LDSB1_AMAS3_GRVW2_IU1_NEPBS4_NLCA1_PLR5_SU0_SUS256_SVW2_TT2_32_TLDS0_VW2_WG32_8_1_WGM11
    SolutionIndex: 85
    SolutionNameMin: Cijk_Ailk_Bljk_DB_MT32x16x16_MI16x16x4x1_SN_1LDSB0_AMAS0_GRVW1_IU1_NEPBS4_NLCA1_PLR5_SU0_SUS128_SVW1_TT1_16_TLDS0_VW1_WG32_4_1_WGM5
    SolutionIndex: 86
    SolutionNameMin: Cijk_Ailk_Bljk_DB_MT32x16x16_MI16x16x4x1_SN_1LDSB0_AMAS0_GRVW1_IU2_NEPBS4_NLCA1_PLR3_SU0_SUS256_SVW1_TT1_16_TLDS0_VW1_WG32_4_1_WGM11
    SolutionIndex: 87
    SolutionNameMin: Cijk_Ailk_Bljk_DB_MT64x64x16_MI16x16x4x1_SN_1LDSB0_AMAS3_GRVW2_IU2_NEPBS4_NLCA1_PLR3_SU0_SUS128_SVW2_TT2_32_TLDS0_VW2_WG32_8_1_WGM11
    SolutionIndex: 88
    SolutionNameMin: Cijk_Ailk_Bljk_DB_MT64x32x8_MI16x16x4x1_SN_1LDSB0_AMAS0_GRVW1_IU1_NEPBS4_NLCA1_PLR3_SU0_SUS256_SVW1_TT2_16_TLDS1_VW1_WG32_8_1_WGM5
    SolutionIndex: 89
    SolutionNameMin: Cijk_Ailk_Bljk_DB_MT64x32x8_MI16x16x4x1_SN_1LDSB0_AMAS3_GRVW2_IU1_NEPBS4_NLCA1_PLR3_SU0_SUS256_SVW2_TT2_16_TLDS0_VW2_WG32_8_1_WGM5
    SolutionIndex: 90
    SolutionNameMin: Cijk_Ailk_Bljk_DB_MT128x64x8_MI16x16x4x1_SN_1LDSB1_AMAS0_GRVW1_IU1_NEPBS4_NLCA1_PLR3_SU0_SUS128_SVW1_TT4_32_TLDS0_VW1_WG32_8_1_WGM5
    SolutionIndex: 91
    SolutionNameMin: Cijk_Ailk_Bljk_DB_MT64x32x8_MI16x16x4x1_SN_1LDSB0_AMAS0_GRVW1_IU1_NEPBS4_NLCA1_PLR3_SU0_SUS128_SVW1_TT2_16_TLDS1_VW1_WG32_8_1_WGM11
    SolutionIndex: 92
    SolutionNameMin: Cijk_Ailk_Bljk_DB_MT64x32x8_MI16x16x4x1_SN_1LDSB0_AMAS0_GRVW1_IU1_NEPBS4_NLCA1_PLR3_SU0_SUS256_SVW1_TT2_16_TLDS1_VW1_WG32_8_1_WGM11
    SolutionIndex: 93
    SolutionNameMin: Cijk_Ailk_Bljk_DB_MT64x32x8_MI16x16x4x1_SN_1LDSB0_AMAS0_GRVW1_IU1_NEPBS4_NLCA1_PLR3_SU0_SUS128_SVW1_TT2_16_TLDS1_VW1_WG32_8_1_WGM5
    SolutionIndex: 94
    SolutionNameMin: Cijk_Ailk_Bljk_DB_MT64x64x8_MI16x16x4x1_SN_1LDSB0_AMAS3_GRVW2_IU1_NEPBS4_NLCA1_PLR3_SU32_SUS256_SVW2_TT2_32_TLDS0_VW2_WG32_8_1_WGM5
    SolutionIndex: 95
    SolutionNameMin: Cijk_Ailk_Bljk_DB_MT128x96x16_MI16x16x4x1_SN_1LDSB1_AMAS3_GRVW2_IU2_NEPBS4_NLCA1_PLR3_SU0_SUS256_SVW2_TT2_96_TLDS0_VW2_WG64_4_1_WGM11
    SolutionIndex: 96
    SolutionNameMin: Cijk_Ailk_Bljk_DB_MT128x64x8_MI16x16x4x1_SN_1LDSB0_AMAS3_GRVW2_IU1_NEPBS4_NLCA1_PLR3_SU0_SUS128_SVW2_TT4_32_TLDS0_VW2_WG32_8_1_WGM11
    SolutionIndex: 97
    SolutionNameMin: Cijk_Ailk_Bljk_DB_MT128x96x8_MI16x16x4x1_SN_1LDSB0_AMAS0_GRVW1_IU1_NEPBS4_NLCA1_PLR3_SU0_SUS256_SVW1_TT2_96_TLDS0_VW1_WG64_4_1_WGM11
    SolutionIndex: 98
    SolutionNameMin: Cijk_Ailk_Bljk_DB_MT32x16x8_MI16x16x4x1_SN_1LDSB0_AMAS0_GRVW1_IU1_NEPBS4_NLCA1_PLR3_SU0_SUS256_SVW1_TT1_16_TLDS0_VW1_WG32_4_1_WGM5
    SolutionIndex: 99
    SolutionNameMin: Cijk_Ailk_Bljk_DB_MT64x32x8_MI16x16x4x1_SN_1LDSB0_AMAS3_GRVW2_IU1_NEPBS4_NLCA1_PLR3_SU0_SUS128_SVW2_TT2_16_TLDS0_VW2_WG32_8_1_WGM11
    SolutionIndex: 100
    SolutionNameMin: Cijk_Ailk_Bljk_DB_MT32x32x16_MI16x16x4x1_SN_1LDSB1_AMAS3_GRVW2_IU1_NEPBS4_NLCA1_PLR5_SU0_SUS256_SVW2_TT2_32_TLDS0_VW2_WG16_4_1_WGM5
    SolutionIndex: 101
    SolutionNameMin: Cijk_Ailk_Bljk_DB_MT64x32x8_MI16x16x4x1_SN_1LDSB0_AMAS3_GRVW2_IU1_NEPBS4_NLCA1_PLR3_SU0_SUS256_SVW2_TT2_16_TLDS0_VW2_WG32_8_1_WGM11
    SolutionIndex: 102
    SolutionNameMin: Cijk_Ailk_Bljk_DB_MT64x64x8_MI16x16x4x1_SN_1LDSB0_AMAS0_GRVW1_IU1_NEPBS4_NLCA1_PLR3_SU0_SUS256_SVW1_TT2_32_TLDS0_VW1_WG32_8_1_WGM11
    SolutionIndex: 103
    SolutionNameMin: Cijk_Ailk_Bljk_DB_MT32x32x8_MI16x16x4x1_SN_1LDSB0_AMAS0_GRVW1_IU1_NEPBS4_NLCA1_PLR3_SU32_SUS256_SVW1_TT1_16_TLDS1_VW1_WG32_8_1_WGM5
    SolutionIndex: 104
    SolutionNameMin: Cijk_Ailk_Bljk_DB_MT64x64x16_MI16x16x4x1_SN_1LDSB1_AMAS3_GRVW2_IU2_NEPBS4_NLCA1_PLR3_SU0_SUS128_SVW2_TT2_32_TLDS0_VW2_WG32_8_1_WGM5
    SolutionIndex: 105
    SolutionNameMin: Cijk_Ailk_Bljk_DB_MT64x64x16_MI16x16x4x1_SN_1LDSB1_AMAS3_GRVW2_IU1_NEPBS4_NLCA1_PLR5_SU0_SUS256_SVW2_TT2_32_TLDS0_VW2_WG32_8_1_WGM5
    SolutionIndex: 106
    SolutionNameMin: Cijk_Ailk_Bljk_DB_MT32x32x8_MI16x16x4x1_SN_1LDSB0_AMAS0_GRVW1_IU1_NEPBS4_NLCA1_PLR3_SU0_SUS256_SVW1_TT1_16_TLDS0_VW1_WG32_8_1_WGM5
    SolutionIndex: 107
    SolutionNameMin: Cijk_Ailk_Bljk_DB_MT32x16x16_MI16x16x4x1_SN_1LDSB0_AMAS0_GRVW1_IU2_NEPBS4_NLCA1_PLR3_SU32_SUS256_SVW1_TT1_16_TLDS0_VW1_WG32_4_1_WGM11
    SolutionIndex: 108
    SolutionNameMin: Cijk_Ailk_Bljk_DB_MT64x16x8_MI16x16x4x1_SN_1LDSB0_AMAS0_GRVW1_IU1_NEPBS4_NLCA1_PLR3_SU0_SUS256_SVW1_TT2_16_TLDS0_VW1_WG32_4_1_WGM11
    SolutionIndex: 109
    SolutionNameMin: Cijk_Ailk_Bljk_DB_MT64x64x16_MI16x16x4x1_SN_1LDSB1_AMAS3_GRVW2_IU2_NEPBS4_NLCA1_PLR3_SU0_SUS128_SVW2_TT2_32_TLDS0_VW2_WG32_8_1_WGM11
    SolutionIndex: 110
    SolutionNameMin: Cijk_Ailk_Bljk_DB_MT128x128x8_MI16x16x4x1_SN_1LDSB1_AMAS3_GRVW2_IU1_NEPBS4_NLCA1_PLR3_SU0_SUS128_SVW2_TT4_64_TLDS0_VW2_WG32_8_1_WGM11
    SolutionIndex: 111
    SolutionNameMin: Cijk_Ailk_Bljk_DB_MT32x32x8_MI16x16x4x1_SN_1LDSB0_AMAS0_GRVW1_IU1_NEPBS4_NLCA1_PLR3_SU0_SUS128_SVW1_TT2_32_TLDS1_VW1_WG16_4_1_WGM5
    SolutionIndex: 112
    SolutionNameMin: Cijk_Ailk_Bljk_DB_MT32x16x8_MI16x16x4x1_SN_1LDSB0_AMAS0_GRVW1_IU1_NEPBS4_NLCA1_PLR3_SU0_SUS128_SVW1_TT1_16_TLDS0_VW1_WG32_4_1_WGM5
    SolutionIndex: 113
    SolutionNameMin: Cijk_Ailk_Bljk_DB_MT64x16x8_MI16x16x4x1_SN_1LDSB0_AMAS0_GRVW1_IU1_NEPBS4_NLCA1_PLR3_SU0_SUS128_SVW1_TT2_16_TLDS0_VW1_WG32_4_1_WGM5
    SolutionIndex: 114
    SolutionNameMin: Cijk_Ailk_Bljk_DB_MT32x32x8_MI16x16x4x1_SN_1LDSB0_AMAS0_GRVW1_IU1_NEPBS1_NLCA1_PLR3_SU0_SUS256_SVW1_TT1_16_TLDS0_VW1_WG32_8_1_WGM5
    SolutionIndex: 115
    SolutionNameMin: Cijk_Ailk_Bljk_DB_MT32x32x8_MI16x16x4x1_SN_1LDSB0_AMAS0_GRVW1_IU1_NEPBS4_NLCA1_PLR3_SU0_SUS128_SVW1_TT1_16_TLDS0_VW1_WG32_8_1_WGM11
    SolutionIndex: 116
    SolutionNameMin: Cijk_Ailk_Bljk_DB_MT64x32x8_MI16x16x4x1_SN_1LDSB0_AMAS0_GRVW1_IU1_NEPBS4_NLCA1_PLR3_SU0_SUS128_SVW1_TT2_16_TLDS0_VW1_WG32_8_1_WGM5
    SolutionIndex: 117
    SolutionNameMin: Cijk_Ailk_Bljk_DB_MT128x64x8_MI16x16x4x1_SN_1LDSB1_AMAS3_GRVW2_IU1_NEPBS4_NLCA1_PLR3_SU0_SUS256_SVW2_TT4_32_TLDS0_VW2_WG32_8_1_WGM5
    SolutionIndex: 118
    SolutionNameMin: Cijk_Ailk_Bljk_DB_MT32x32x8_MI16x16x4x1_SN_1LDSB0_AMAS0_GRVW1_IU1_NEPBS1_NLCA1_PLR3_SU0_SUS128_SVW1_TT1_16_TLDS0_VW1_WG32_8_1_WGM11
    SolutionIndex: 119
    SolutionNameMin: Cijk_Ailk_Bljk_DB_MT128x64x8_MI16x16x4x1_SN_1LDSB1_AMAS0_GRVW1_IU1_NEPBS4_NLCA1_PLR3_SU0_SUS256_SVW1_TT4_32_TLDS0_VW1_WG32_8_1_WGM5
    SolutionIndex: 120
    SolutionNameMin: Cijk_Ailk_Bljk_DB_MT96x128x8_MI16x16x4x1_SN_1LDSB0_AMAS0_GRVW1_IU1_NEPBS4_NLCA3_PLR3_SU32_SUS128_SVW1_TT6_32_TLDS1_VW1_WG16_16_1_WGM5
    SolutionIndex: 121
    SolutionNameMin: Cijk_Ailk_Bljk_DB_MT64x64x16_MI16x16x4x1_SN_1LDSB1_AMAS3_GRVW2_IU1_NEPBS1_NLCA1_PLR5_SU0_SUS128_SVW2_TT2_32_TLDS0_VW2_WG32_8_1_WGM5
    SolutionIndex: 122
    SolutionNameMin: Cijk_Ailk_Bljk_DB_MT128x96x16_MI16x16x4x1_SN_1LDSB1_AMAS3_GRVW2_IU2_NEPBS4_NLCA1_PLR3_SU0_SUS128_SVW2_TT2_96_TLDS0_VW2_WG64_4_1_WGM11
    SolutionIndex: 123
    SolutionNameMin: Cijk_Ailk_Bljk_DB_MT128x64x8_MI16x16x4x1_SN_1LDSB1_AMAS3_GRVW2_IU1_NEPBS4_NLCA1_PLR3_SU32_SUS128_SVW2_TT4_32_TLDS0_VW2_WG32_8_1_WGM5
    SolutionIndex: 124
    SolutionNameMin: Cijk_Ailk_Bljk_DB_MT128x64x8_MI16x16x4x1_SN_1LDSB1_AMAS0_GRVW1_IU1_NEPBS4_NLCA1_PLR3_SU0_SUS256_SVW1_TT4_32_TLDS1_VW1_WG32_8_1_WGM11
    SolutionIndex: 125
    SolutionNameMin: Cijk_Ailk_Bljk_DB_MT128x96x8_MI16x16x4x1_SN_1LDSB0_AMAS0_GRVW1_IU1_NEPBS4_NLCA1_PLR3_SU0_SUS128_SVW1_TT2_96_TLDS0_VW1_WG64_4_1_WGM5
    SolutionIndex: 126
    SolutionNameMin: Cijk_Ailk_Bljk_DB_MT32x32x8_MI16x16x4x1_SN_1LDSB0_AMAS0_GRVW1_IU1_NEPBS4_NLCA1_PLR3_SU0_SUS128_SVW1_TT1_16_TLDS0_VW1_WG32_8_1_WGM5
    SolutionIndex: 127
    SolutionNameMin: Cijk_Ailk_Bljk_DB_MT32x32x8_MI16x16x4x1_SN_1LDSB0_AMAS0_GRVW1_IU1_NEPBS4_NLCA1_PLR3_SU32_SUS256_SVW1_TT1_16_TLDS0_VW1_WG32_8_1_WGM11
    SolutionIndex: 128
    SolutionNameMin: Cijk_Ailk_Bljk_DB_MT64x32x8_MI16x16x4x1_SN_1LDSB0_AMAS0_GRVW1_IU1_NEPBS4_NLCA1_PLR3_SU0_SUS256_SVW1_TT2_16_TLDS0_VW1_WG32_8_1_WGM11
    SolutionIndex: 129
    SolutionNameMin: Cijk_Ailk_Bljk_DB_MT32x32x8_MI16x16x4x1_SN_1LDSB0_AMAS0_GRVW1_IU1_NEPBS1_NLCA1_PLR3_SU0_SUS128_SVW1_TT1_16_TLDS0_VW1_WG32_8_1_WGM5
    SolutionIndex: 130
    SolutionNameMin: Cijk_Ailk_Bljk_DB_MT128x64x8_MI16x16x4x1_SN_1LDSB1_AMAS0_GRVW1_IU1_NEPBS4_NLCA1_PLR3_SU0_SUS128_SVW1_TT4_32_TLDS0_VW1_WG32_8_1_WGM11
    SolutionIndex: 131
    SolutionNameMin: Cijk_Ailk_Bljk_DB_MT128x64x8_MI16x16x4x1_SN_1LDSB0_AMAS0_GRVW1_IU1_NEPBS4_NLCA1_PLR3_SU0_SUS256_SVW1_TT4_32_TLDS1_VW1_WG32_8_1_WGM11
    SolutionIndex: 132
    SolutionNameMin: Cijk_Ailk_Bljk_DB_MT64x64x16_MI16x16x4x1_SN_1LDSB1_AMAS3_GRVW2_IU1_NEPBS4_NLCA1_PLR5_SU0_SUS128_SVW2_TT2_32_TLDS0_VW2_WG32_8_1_WGM11
    SolutionIndex: 133
    SolutionNameMin: Cijk_Ailk_Bljk_DB_MT32x32x8_MI16x16x4x1_SN_1LDSB0_AMAS0_GRVW1_IU1_NEPBS4_NLCA1_PLR3_SU32_SUS128_SVW1_TT1_16_TLDS1_VW1_WG32_8_1_WGM11
    SolutionIndex: 134
    SolutionNameMin: Cijk_Ailk_Bljk_DB_MT64x64x8_MI16x16x4x1_SN_1LDSB0_AMAS3_GRVW2_IU1_NEPBS4_NLCA1_PLR3_SU0_SUS128_SVW2_TT2_32_TLDS0_VW2_WG32_8_1_WGM11
    SolutionIndex: 135
    SolutionNameMin: Cijk_Ailk_Bljk_DB_MT128x64x8_MI16x16x4x1_SN_1LDSB1_AMAS0_GRVW1_IU1_NEPBS4_NLCA1_PLR3_SU0_SUS256_SVW1_TT4_32_TLDS0_VW1_WG32_8_1_WGM11
    SolutionIndex: 136
    SolutionNameMin: Cijk_Ailk_Bljk_DB_MT32x32x8_MI16x16x4x1_SN_1LDSB0_AMAS0_GRVW1_IU1_NEPBS4_NLCA1_PLR3_SU0_SUS256_SVW1_TT1_16_TLDS1_VW1_WG32_8_1_WGM11
    SolutionIndex: 137
    SolutionNameMin: Cijk_Ailk_Bljk_DB_MT32x16x8_MI16x16x4x1_SN_1LDSB0_AMAS0_GRVW1_IU1_NEPBS4_NLCA1_PLR3_SU0_SUS256_SVW1_TT1_16_TLDS0_VW1_WG32_4_1_WGM11
    SolutionIndex: 138
    SolutionNameMin: Cijk_Ailk_Bljk_DB_MT96x128x8_MI16x16x4x1_SN_1LDSB0_AMAS0_GRVW1_IU1_NEPBS4_NLCA3_PLR3_SU0_SUS256_SVW1_TT6_32_TLDS1_VW1_WG16_16_1_WGM11
    SolutionIndex: 139
    SolutionNameMin: Cijk_Ailk_Bljk_DB_MT32x16x8_MI16x16x4x1_SN_1LDSB0_AMAS0_GRVW1_IU1_NEPBS4_NLCA1_PLR3_SU0_SUS128_SVW1_TT1_16_TLDS1_VW1_WG32_4_1_WGM5
    SolutionIndex: 140
    SolutionNameMin: Cijk_Ailk_Bljk_DB_MT32x16x16_MI16x16x4x1_SN_1LDSB0_AMAS0_GRVW1_IU2_NEPBS4_NLCA1_PLR3_SU0_SUS256_SVW1_TT1_16_TLDS0_VW1_WG32_4_1_WGM5
    SolutionIndex: 141
    SolutionNameMin: Cijk_Ailk_Bljk_DB_MT128x96x16_MI16x16x4x1_SN_1LDSB1_AMAS3_GRVW2_IU2_NEPBS4_NLCA1_PLR3_SU0_SUS256_SVW2_TT2_96_TLDS0_VW2_WG64_4_1_WGM5
    SolutionIndex: 142
    SolutionNameMin: Cijk_Ailk_Bljk_DB_MT32x32x16_MI16x16x4x1_SN_1LDSB1_AMAS3_GRVW2_IU2_NEPBS4_NLCA1_PLR3_SU0_SUS256_SVW2_TT2_32_TLDS0_VW2_WG16_4_1_WGM11
    SolutionIndex: 143
    SolutionNameMin: Cijk_Ailk_Bljk_DB_MT64x32x8_MI16x16x4x1_SN_1LDSB0_AMAS3_GRVW2_IU1_NEPBS4_NLCA1_PLR3_SU0_SUS256_SVW2_TT2_16_TLDS1_VW2_WG32_8_1_WGM11
    SolutionIndex: 144
    SolutionNameMin: Cijk_Ailk_Bljk_DB_MT32x32x8_MI16x16x4x1_SN_1LDSB0_AMAS0_GRVW1_IU1_NEPBS4_NLCA1_PLR3_SU32_SUS128_SVW1_TT1_16_TLDS0_VW1_WG32_8_1_WGM5
    SolutionIndex: 145
    SolutionNameMin: Cijk_Ailk_Bljk_DB_MT32x32x8_MI16x16x4x1_SN_1LDSB0_AMAS0_GRVW1_IU1_NEPBS1_NLCA1_PLR3_SU0_SUS256_SVW1_TT1_16_TLDS0_VW1_WG32_8_1_WGM11
    SolutionIndex: 146
    SolutionNameMin: Cijk_Ailk_Bljk_DB_MT32x32x8_MI16x16x4x1_SN_1LDSB0_AMAS0_GRVW1_IU1_NEPBS4_NLCA1_PLR3_SU32_SUS128_SVW1_TT2_32_TLDS0_VW1_WG16_4_1_WGM11
    SolutionIndex: 147
    SolutionNameMin: Cijk_Ailk_Bljk_DB_MT64x64x16_MI16x16x4x1_SN_1LDSB1_AMAS3_GRVW2_IU2_NEPBS4_NLCA1_PLR3_SU32_SUS128_SVW2_TT2_32_TLDS0_VW2_WG32_8_1_WGM11
    SolutionIndex: 148
    SolutionNameMin: Cijk_Ailk_Bljk_DB_MT64x64x8_MI16x16x4x1_SN_1LDSB0_AMAS0_GRVW1_IU1_NEPBS4_NLCA1_PLR3_SU32_SUS128_SVW1_TT2_32_TLDS0_VW1_WG32_8_1_WGM5
    SolutionIndex: 149
    SolutionNameMin: Cijk_Ailk_Bljk_DB_MT128x96x8_MI16x16x4x1_SN_1LDSB0_AMAS0_GRVW1_IU1_NEPBS4_NLCA1_PLR3_SU0_SUS128_SVW1_TT2_96_TLDS0_VW1_WG64_4_1_WGM11
    SolutionIndex: 150
    SolutionNameMin: Cijk_Ailk_Bljk_DB_MT32x16x16_MI16x16x4x1_SN_1LDSB0_AMAS0_GRVW1_IU2_NEPBS4_NLCA1_PLR3_SU0_SUS128_SVW1_TT1_16_TLDS1_VW1_WG32_4_1_WGM11
    SolutionIndex: 151
    SolutionNameMin: Cijk_Ailk_Bljk_DB_MT96x128x8_MI16x16x4x1_SN_1LDSB1_AMAS0_GRVW1_IU1_NEPBS4_NLCA3_PLR3_SU0_SUS256_SVW1_TT6_32_TLDS0_VW1_WG16_16_1_WGM5
    SolutionIndex: 152
    SolutionNameMin: Cijk_Ailk_Bljk_DB_MT32x16x16_MI16x16x4x1_SN_1LDSB0_AMAS0_GRVW1_IU1_NEPBS4_NLCA1_PLR5_SU0_SUS128_SVW1_TT1_16_TLDS0_VW1_WG32_4_1_WGM11
    SolutionIndex: 153
    SolutionNameMin: Cijk_Ailk_Bljk_DB_MT128x96x8_MI16x16x4x1_SN_1LDSB0_AMAS0_GRVW1_IU1_NEPBS4_NLCA1_PLR3_SU0_SUS256_SVW1_TT2_96_TLDS0_VW1_WG64_4_1_WGM5
    SolutionIndex: 154
    SolutionNameMin: Cijk_Ailk_Bljk_DB_MT128x64x8_MI16x16x4x1_SN_1LDSB1_AMAS0_GRVW1_IU1_NEPBS4_NLCA1_PLR3_SU32_SUS128_SVW1_TT4_32_TLDS0_VW1_WG32_8_1_WGM11
    SolutionIndex: 155
    SolutionNameMin: Cijk_Ailk_Bljk_DB_MT64x64x8_MI16x16x4x1_SN_1LDSB0_AMAS0_GRVW1_IU1_NEPBS4_NLCA1_PLR3_SU0_SUS256_SVW1_TT2_32_TLDS0_VW1_WG32_8_1_WGM5
    SolutionIndex: 156
    SolutionNameMin: Cijk_Ailk_Bljk_DB_MT32x32x8_MI16x16x4x1_SN_1LDSB0_AMAS0_GRVW1_IU1_NEPBS4_NLCA1_PLR3_SU0_SUS128_SVW1_TT2_32_TLDS0_VW1_WG16_4_1_WGM11
    SolutionIndex: 157
    SolutionNameMin: Cijk_Ailk_Bljk_DB_MT32x16x16_MI16x16x4x1_SN_1LDSB0_AMAS0_GRVW1_IU1_NEPBS4_NLCA1_PLR5_SU0_SUS256_SVW1_TT1_16_TLDS0_VW1_WG32_4_1_WGM5
    SolutionIndex: 158
    SolutionNameMin: Cijk_Ailk_Bljk_DB_MT64x64x16_MI16x16x4x1_SN_1LDSB1_AMAS3_GRVW2_IU2_NEPBS4_NLCA1_PLR3_SU32_SUS256_SVW2_TT2_32_TLDS0_VW2_WG32_8_1_WGM11
    SolutionIndex: 159
    SolutionNameMin: Cijk_Ailk_Bljk_DB_MT64x32x8_MI16x16x4x1_SN_1LDSB0_AMAS0_GRVW1_IU1_NEPBS4_NLCA1_PLR3_SU32_SUS256_SVW1_TT2_16_TLDS0_VW1_WG32_8_1_WGM5
    SolutionIndex: 160
    SolutionNameMin: Cijk_Ailk_Bljk_DB_MT128x64x8_MI16x16x4x1_SN_1LDSB1_AMAS0_GRVW1_IU1_NEPBS4_NLCA1_PLR3_SU0_SUS256_SVW1_TT4_32_TLDS1_VW1_WG32_8_1_WGM5
    SolutionIndex: 161
    SolutionNameMin: Cijk_Ailk_Bljk_DB_MT64x32x8_MI16x16x4x1_SN_1LDSB0_AMAS0_GRVW1_IU1_NEPBS4_NLCA1_PLR3_SU0_SUS128_SVW1_TT2_16_TLDS0_VW1_WG32_8_1_WGM11
    SolutionIndex: 162
    SolutionNameMin: Cijk_Ailk_Bljk_DB_MT64x64x16_MI16x16x4x1_SN_1LDSB1_AMAS3_GRVW2_IU1_NEPBS1_NLCA1_PLR5_SU0_SUS256_SVW2_TT2_32_TLDS0_VW2_WG32_8_1_WGM5
    SolutionIndex: 163
    SolutionNameMin: Cijk_Ailk_Bljk_DB_MT32x32x8_MI16x16x4x1_SN_1LDSB0_AMAS3_GRVW2_IU1_NEPBS4_NLCA1_PLR3_SU0_SUS128_SVW2_TT2_32_TLDS0_VW2_WG16_4_1_WGM11
    SolutionIndex: 164
    SolutionNameMin: Cijk_Ailk_Bljk_DB_MT32x32x16_MI16x16x4x1_SN_1LDSB1_AMAS3_GRVW2_IU1_NEPBS4_NLCA1_PLR5_SU0_SUS256_SVW2_TT2_32_TLDS1_VW2_WG16_4_1_WGM5
    SolutionIndex: 165
    SolutionNameMin: Cijk_Ailk_Bljk_DB_MT32x32x8_MI16x16x4x1_SN_1LDSB0_AMAS0_GRVW1_IU1_NEPBS4_NLCA1_PLR3_SU0_SUS128_SVW1_TT1_16_TLDS1_VW1_WG32_8_1_WGM11
    SolutionIndex: 166
    SolutionNameMin: Cijk_Ailk_Bljk_DB_MT32x32x8_MI16x16x4x1_SN_1LDSB0_AMAS0_GRVW1_IU1_NEPBS4_NLCA1_PLR3_SU0_SUS256_SVW1_TT1_16_TLDS1_VW1_WG32_8_1_WGM5
    SolutionIndex: 167
    SolutionNameMin: Cijk_Ailk_Bljk_DB_MT32x16x8_MI16x16x4x1_SN_1LDSB0_AMAS0_GRVW1_IU1_NEPBS4_NLCA1_PLR3_SU0_SUS128_SVW1_TT1_16_TLDS0_VW1_WG32_4_1_WGM11
    SolutionIndex: 168
    SolutionNameMin: Cijk_Ailk_Bljk_DB_MT64x16x8_MI16x16x4x1_SN_1LDSB0_AMAS0_GRVW1_IU1_NEPBS4_NLCA1_PLR3_SU32_SUS128_SVW1_TT2_16_TLDS0_VW1_WG32_4_1_WGM5
    SolutionIndex: 169
    SolutionNameMin: Cijk_Ailk_Bljk_DB_MT64x64x8_MI16x16x4x1_SN_1LDSB0_AMAS0_GRVW1_IU1_NEPBS4_NLCA1_PLR3_SU32_SUS256_SVW1_TT2_32_TLDS0_VW1_WG32_8_1_WGM5
    SolutionIndex: 170
    SolutionNameMin: Cijk_Ailk_Bljk_DB_MT32x32x16_MI16x16x4x1_SN_1LDSB0_AMAS0_GRVW1_IU2_NEPBS4_NLCA1_PLR3_SU0_SUS256_SVW1_TT1_16_TLDS1_VW1_WG32_8_1_WGM5
    SolutionIndex: 171
    SolutionNameMin: Cijk_Ailk_Bljk_DB_MT128x64x8_MI16x16x4x1_SN_1LDSB0_AMAS0_GRVW1_IU1_NEPBS4_NLCA1_PLR3_SU0_SUS128_SVW1_TT4_32_TLDS0_VW1_WG32_8_1_WGM11
    SolutionIndex: 172
    SolutionNameMin: Cijk_Ailk_Bljk_DB_MT64x32x8_MI16x16x4x1_SN_1LDSB0_AMAS3_GRVW2_IU1_NEPBS4_NLCA1_PLR3_SU0_SUS256_SVW2_TT2_16_TLDS1_VW2_WG32_8_1_WGM5
    SolutionIndex: 173
    SolutionNameMin: Cijk_Ailk_Bljk_DB_MT16x32x16_MI16x16x4x1_SN_1LDSB0_AMAS0_GRVW1_IU1_NEPBS4_NLCA1_PLR5_SU0_SUS128_SVW1_TT1_16_TLDS0_VW1_WG16_8_1_WGM5
    SolutionIndex: 174
    SolutionNameMin: Cijk_Ailk_Bljk_DB_MT32x16x16_MI16x16x4x1_SN_1LDSB0_AMAS0_GRVW1_IU2_NEPBS4_NLCA1_PLR3_SU0_SUS256_SVW1_TT1_16_TLDS1_VW1_WG32_4_1_WGM5
    SolutionIndex: 175
    SolutionNameMin: Cijk_Ailk_Bljk_DB_MT64x64x16_MI16x16x4x1_SN_1LDSB1_AMAS0_GRVW1_IU2_NEPBS4_NLCA1_PLR3_SU0_SUS128_SVW1_TT2_32_TLDS0_VW1_WG32_8_1_WGM5
    SolutionIndex: 176
    SolutionNameMin: Cijk_Ailk_Bljk_DB_MT32x32x16_MI16x16x4x1_SN_1LDSB1_AMAS3_GRVW2_IU2_NEPBS4_NLCA1_PLR3_SU0_SUS256_SVW2_TT2_32_TLDS1_VW2_WG16_4_1_WGM5
    SolutionIndex: 177
    SolutionNameMin: Cijk_Ailk_Bljk_DB_MT32x32x8_MI16x16x4x1_SN_1LDSB0_AMAS0_GRVW1_IU1_NEPBS4_NLCA1_PLR3_SU0_SUS256_SVW1_TT2_32_TLDS1_VW1_WG16_4_1_WGM5
    SolutionIndex: 178
    SolutionNameMin: Cijk_Ailk_Bljk_DB_MT128x64x8_MI16x16x4x1_SN_1LDSB1_AMAS3_GRVW2_IU1_NEPBS4_NLCA1_PLR3_SU32_SUS256_SVW2_TT4_32_TLDS0_VW2_WG32_8_1_WGM5
    SolutionIndex: 179
    SolutionNameMin: Cijk_Ailk_Bljk_DB_MT32x32x8_MI16x16x4x1_SN_1LDSB0_AMAS0_GRVW1_IU1_NEPBS4_NLCA1_PLR3_SU0_SUS256_SVW1_TT2_32_TLDS0_VW1_WG16_4_1_WGM5
    SolutionIndex: 180
    SolutionNameMin: Cijk_Ailk_Bljk_DB_MT64x64x16_MI16x16x4x1_SN_1LDSB1_AMAS3_GRVW2_IU1_NEPBS4_NLCA1_PLR5_SU32_SUS128_SVW2_TT2_32_TLDS0_VW2_WG32_8_1_WGM5
    SolutionIndex: 181
    SolutionNameMin: Cijk_Ailk_Bljk_DB_MT64x32x8_MI16x16x4x1_SN_1LDSB0_AMAS3_GRVW2_IU1_NEPBS4_NLCA1_PLR3_SU32_SUS128_SVW2_TT2_16_TLDS1_VW2_WG32_8_1_WGM11
    SolutionIndex: 182
    SolutionNameMin: Cijk_Ailk_Bljk_DB_MT32x32x16_MI16x16x4x1_SN_1LDSB1_AMAS3_GRVW2_IU2_NEPBS4_NLCA1_PLR3_SU0_SUS128_SVW2_TT2_32_TLDS0_VW2_WG16_4_1_WGM11
    SolutionIndex: 183
    SolutionNameMin: Cijk_Ailk_Bljk_DB_MT64x32x8_MI16x16x4x1_SN_1LDSB0_AMAS3_GRVW2_IU1_NEPBS4_NLCA1_PLR3_SU32_SUS256_SVW2_TT2_16_TLDS0_VW2_WG32_8_1_WGM11
    SolutionIndex: 184
    SolutionNameMin: Cijk_Ailk_Bljk_DB_MT64x64x16_MI16x16x4x1_SN_1LDSB1_AMAS3_GRVW2_IU1_NEPBS4_NLCA1_PLR5_SU0_SUS128_SVW2_TT2_32_TLDS0_VW2_WG32_8_1_WGM5
    SolutionIndex: 185
    SolutionNameMin: Cijk_Ailk_Bljk_DB_MT128x128x8_MI16x16x4x1_SN_1LDSB0_AMAS3_GRVW2_IU1_NEPBS4_NLCA1_PLR3_SU32_SUS128_SVW2_TT4_64_TLDS0_VW2_WG32_8_1_WGM11
    SolutionIndex: 186
    SolutionNameMin: Cijk_Ailk_Bljk_DB_MT64x64x16_MI16x16x4x1_SN_1LDSB1_AMAS0_GRVW1_IU2_NEPBS4_NLCA1_PLR3_SU0_SUS128_SVW1_TT2_32_TLDS0_VW1_WG32_8_1_WGM11
    SolutionIndex: 187
    SolutionNameMin: Cijk_Ailk_Bljk_DB_MT32x16x16_MI16x16x4x1_SN_1LDSB0_AMAS0_GRVW1_IU2_NEPBS4_NLCA1_PLR3_SU0_SUS256_SVW1_TT1_16_TLDS1_VW1_WG32_4_1_WGM11
    SolutionIndex: 188
    SolutionNameMin: Cijk_Ailk_Bljk_DB_MT64x32x8_MI16x16x4x1_SN_1LDSB0_AMAS3_GRVW2_IU1_NEPBS4_NLCA1_PLR3_SU0_SUS128_SVW2_TT2_16_TLDS1_VW2_WG32_8_1_WGM5
    SolutionIndex: 189
    SolutionNameMin: Cijk_Ailk_Bljk_DB_MT64x64x8_MI16x16x4x1_SN_1LDSB0_AMAS0_GRVW1_IU1_NEPBS4_NLCA1_PLR3_SU0_SUS128_SVW1_TT2_32_TLDS0_VW1_WG32_8_1_WGM11
    SolutionIndex: 190
    SolutionNameMin: Cijk_Ailk_Bljk_DB_MT64x64x16_MI16x16x4x1_SN_1LDSB1_AMAS3_GRVW2_IU1_NEPBS1_NLCA1_PLR5_SU0_SUS256_SVW2_TT2_32_TLDS0_VW2_WG32_8_1_WGM11
    SolutionIndex: 191
    SolutionNameMin: Cijk_Ailk_Bljk_DB_MT32x16x8_MI16x16x4x1_SN_1LDSB0_AMAS0_GRVW1_IU1_NEPBS4_NLCA1_PLR3_SU0_SUS256_SVW1_TT1_16_TLDS1_VW1_WG32_4_1_WGM5
    SolutionIndex: 192
    SolutionNameMin: Cijk_Ailk_Bljk_DB_MT32x32x16_MI16x16x4x1_SN_1LDSB1_AMAS3_GRVW2_IU1_NEPBS4_NLCA1_PLR5_SU0_SUS128_SVW2_TT2_32_TLDS1_VW2_WG16_4_1_WGM11
    SolutionIndex: 193
    SolutionNameMin: Cijk_Ailk_Bljk_DB_MT64x32x8_MI16x16x4x1_SN_1LDSB0_AMAS0_GRVW1_IU1_NEPBS4_NLCA1_PLR3_SU32_SUS128_SVW1_TT2_16_TLDS0_VW1_WG32_8_1_WGM5
    SolutionIndex: 194
    SolutionNameMin: Cijk_Ailk_Bljk_DB_MT32x32x16_MI16x16x4x1_SN_1LDSB0_AMAS0_GRVW1_IU1_NEPBS4_NLCA1_PLR5_SU0_SUS128_SVW1_TT1_16_TLDS0_VW1_WG32_8_1_WGM5
    SolutionIndex: 195
    SolutionNameMin: Cijk_Ailk_Bljk_DB_MT64x32x8_MI16x16x4x1_SN_1LDSB0_AMAS3_GRVW2_IU1_NEPBS1_NLCA1_PLR3_SU0_SUS256_SVW2_TT2_16_TLDS0_VW2_WG32_8_1_WGM11
    SolutionIndex: 196
    SolutionNameMin: Cijk_Ailk_Bljk_DB_MT64x64x16_MI16x16x4x1_SN_1LDSB0_AMAS3_GRVW2_IU1_NEPBS4_NLCA1_PLR5_SU0_SUS256_SVW2_TT2_32_TLDS0_VW2_WG32_8_1_WGM11
    SolutionIndex: 197
    SolutionNameMin: Cijk_Ailk_Bljk_DB_MT64x64x8_MI16x16x4x1_SN_1LDSB0_AMAS3_GRVW2_IU1_NEPBS4_NLCA1_PLR3_SU32_SUS256_SVW2_TT2_32_TLDS0_VW2_WG32_8_1_WGM11
    SolutionIndex: 198
    SolutionNameMin: Cijk_Ailk_Bljk_DB_MT64x64x16_MI16x16x4x1_SN_1LDSB1_AMAS3_GRVW2_IU2_NEPBS4_NLCA1_PLR3_SU0_SUS256_SVW2_TT2_32_TLDS0_VW2_WG32_8_1_WGM5
    SolutionIndex: 199
    SolutionNameMin: Cijk_Ailk_Bljk_DB_MT128x128x8_MI16x16x4x1_SN_1LDSB1_AMAS3_GRVW2_IU1_NEPBS4_NLCA1_PLR3_SU32_SUS256_SVW2_TT4_64_TLDS0_VW2_WG32_8_1_WGM11
    SolutionIndex: 200
    SolutionNameMin: Cijk_Ailk_Bljk_DB_MT32x32x8_MI16x16x4x1_SN_1LDSB0_AMAS0_GRVW1_IU1_NEPBS4_NLCA1_PLR3_SU32_SUS128_SVW1_TT1_16_TLDS0_VW1_WG32_8_1_WGM11
    SolutionIndex: 201
    SolutionNameMin: Cijk_Ailk_Bljk_DB_MT64x64x16_MI16x16x4x1_SN_1LDSB1_AMAS0_GRVW1_IU2_NEPBS4_NLCA1_PLR3_SU0_SUS256_SVW1_TT2_32_TLDS0_VW1_WG32_8_1_WGM5
    SolutionIndex: 202
    SolutionNameMin: Cijk_Ailk_Bljk_DB_MT96x128x8_MI16x16x4x1_SN_1LDSB0_AMAS0_GRVW1_IU1_NEPBS4_NLCA3_PLR3_SU0_SUS128_SVW1_TT6_32_TLDS1_VW1_WG16_16_1_WGM5
    SolutionIndex: 203
    SolutionNameMin: Cijk_Ailk_Bljk_DB_MT64x64x16_MI16x16x4x1_SN_1LDSB1_AMAS0_GRVW1_IU2_NEPBS4_NLCA1_PLR3_SU0_SUS256_SVW1_TT2_32_TLDS0_VW1_WG32_8_1_WGM11
    SolutionIndex: 204
    SolutionNameMin: Cijk_Ailk_Bljk_DB_MT32x32x8_MI16x16x4x1_SN_1LDSB0_AMAS0_GRVW1_IU1_NEPBS4_NLCA1_PLR3_SU0_SUS128_SVW1_TT1_16_TLDS1_VW1_WG32_8_1_WGM5
    SolutionIndex: 205
    SolutionNameMin: Cijk_Ailk_Bljk_DB_MT64x64x16_MI16x16x4x1_SN_1LDSB1_AMAS3_GRVW2_IU1_NEPBS1_NLCA1_PLR5_SU0_SUS128_SVW2_TT2_32_TLDS0_VW2_WG32_8_1_WGM11
    SolutionIndex: 206
    SolutionNameMin: Cijk_Ailk_Bljk_DB_MT128x96x8_MI16x16x4x1_SN_1LDSB1_AMAS0_GRVW1_IU1_NEPBS4_NLCA1_PLR3_SU0_SUS256_SVW1_TT2_96_TLDS0_VW1_WG64_4_1_WGM5
    SolutionIndex: 207
    SolutionNameMin: Cijk_Ailk_Bljk_DB_MT128x96x16_MI16x16x4x1_SN_1LDSB1_AMAS3_GRVW2_IU1_NEPBS4_NLCA1_PLR5_SU0_SUS256_SVW2_TT2_96_TLDS0_VW2_WG64_4_1_WGM5
    SolutionIndex: 208
    SolutionNameMin: Cijk_Ailk_Bljk_DB_MT128x128x8_MI16x16x4x1_SN_1LDSB1_AMAS3_GRVW2_IU1_NEPBS4_NLCA1_PLR3_SU0_SUS128_SVW2_TT4_64_TLDS0_VW2_WG32_8_1_WGM5
    SolutionIndex: 209
    SolutionNameMin: Cijk_Ailk_Bljk_DB_MT64x64x8_MI16x16x4x1_SN_1LDSB0_AMAS0_GRVW1_IU1_NEPBS4_NLCA1_PLR3_SU0_SUS128_SVW1_TT2_32_TLDS0_VW1_WG32_8_1_WGM5
    SolutionIndex: 210
    SolutionNameMin: Cijk_Ailk_Bljk_DB_MT128x64x8_MI16x16x4x1_SN_1LDSB1_AMAS3_GRVW2_IU1_NEPBS4_NLCA1_PLR3_SU32_SUS128_SVW2_TT4_32_TLDS0_VW2_WG32_8_1_WGM11
    SolutionIndex: 211
    SolutionNameMin: Cijk_Ailk_Bljk_DB_MT64x64x16_MI16x16x4x1_SN_1LDSB0_AMAS3_GRVW2_IU2_NEPBS4_NLCA1_PLR3_SU0_SUS256_SVW2_TT2_32_TLDS0_VW2_WG32_8_1_WGM11
    SolutionIndex: 212
    SolutionNameMin: Cijk_Ailk_Bljk_DB_MT128x128x8_MI16x16x4x1_SN_1LDSB1_AMAS3_GRVW2_IU1_NEPBS4_NLCA1_PLR3_SU32_SUS128_SVW2_TT4_64_TLDS0_VW2_WG32_8_1_WGM5
    SolutionIndex: 213
    SolutionNameMin: Cijk_Ailk_Bljk_DB_MT128x64x8_MI16x16x4x1_SN_1LDSB0_AMAS0_GRVW1_IU1_NEPBS4_NLCA1_PLR3_SU0_SUS256_SVW1_TT4_32_TLDS1_VW1_WG32_8_1_WGM5
    SolutionIndex: 214
    SolutionNameMin: Cijk_Ailk_Bljk_DB_MT32x32x16_MI16x16x4x1_SN_1LDSB0_AMAS0_GRVW1_IU2_NEPBS4_NLCA1_PLR3_SU0_SUS128_SVW1_TT1_16_TLDS0_VW1_WG32_8_1_WGM5
    SolutionIndex: 215
    SolutionNameMin: Cijk_Ailk_Bljk_DB_MT32x32x8_MI16x16x4x1_SN_1LDSB0_AMAS0_GRVW1_IU1_NEPBS4_NLCA1_PLR3_SU32_SUS256_SVW1_TT2_32_TLDS1_VW1_WG16_4_1_WGM5
    SolutionIndex: 216
    SolutionNameMin: Cijk_Ailk_Bljk_DB_MT32x32x8_MI16x16x4x1_SN_1LDSB0_AMAS0_GRVW1_IU1_NEPBS4_NLCA1_PLR3_SU32_SUS256_SVW1_TT1_16_TLDS0_VW1_WG32_8_1_WGM5
    SolutionIndex: 217
    SolutionNameMin: Cijk_Ailk_Bljk_DB_MT32x32x16_MI16x16x4x1_SN_1LDSB1_AMAS3_GRVW2_IU1_NEPBS4_NLCA1_PLR5_SU0_SUS128_SVW2_TT2_32_TLDS1_VW2_WG16_4_1_WGM5
    SolutionIndex: 218
    SolutionNameMin: Cijk_Ailk_Bljk_DB_MT32x32x16_MI16x16x4x1_SN_1LDSB0_AMAS0_GRVW1_IU1_NEPBS4_NLCA1_PLR5_SU0_SUS256_SVW1_TT1_16_TLDS0_VW1_WG32_8_1_WGM5
    SolutionIndex: 219
    SolutionNameMin: Cijk_Ailk_Bljk_DB_MT128x64x8_MI16x16x4x1_SN_1LDSB0_AMAS0_GRVW1_IU1_NEPBS4_NLCA1_PLR3_SU0_SUS128_SVW1_TT4_32_TLDS1_VW1_WG32_8_1_WGM5
    SolutionIndex: 220
    SolutionNameMin: Cijk_Ailk_Bljk_DB_MT64x16x8_MI16x16x4x1_SN_1LDSB0_AMAS3_GRVW2_IU1_NEPBS4_NLCA1_PLR3_SU0_SUS128_SVW2_TT2_16_TLDS0_VW2_WG32_4_1_WGM5
    SolutionIndex: 221
    SolutionNameMin: Cijk_Ailk_Bljk_DB_MT64x64x16_MI16x16x4x1_SN_1LDSB1_AMAS3_GRVW2_IU1_NEPBS4_NLCA1_PLR5_SU32_SUS256_SVW2_TT2_32_TLDS0_VW2_WG32_8_1_WGM11
    SolutionIndex: 222
    SolutionNameMin: Cijk_Ailk_Bljk_DB_MT32x32x8_MI16x16x4x1_SN_1LDSB0_AMAS0_GRVW1_IU1_NEPBS4_NLCA1_PLR3_SU32_SUS128_SVW1_TT2_32_TLDS0_VW1_WG16_4_1_WGM5
    SolutionIndex: 223
    SolutionNameMin: Cijk_Ailk_Bljk_DB_MT64x64x16_MI16x16x4x1_SN_1LDSB0_AMAS3_GRVW2_IU1_NEPBS4_NLCA1_PLR5_SU0_SUS128_SVW2_TT2_32_TLDS0_VW2_WG32_8_1_WGM11
    SolutionIndex: 224
    SolutionNameMin: Cijk_Ailk_Bljk_DB_MT32x32x16_MI16x16x4x1_SN_1LDSB1_AMAS3_GRVW2_IU1_NEPBS4_NLCA1_PLR5_SU0_SUS128_SVW2_TT2_32_TLDS0_VW2_WG16_4_1_WGM11
    SolutionIndex: 225
    SolutionNameMin: Cijk_Ailk_Bljk_DB_MT64x64x16_MI16x16x4x1_SN_1LDSB0_AMAS3_GRVW2_IU1_NEPBS4_NLCA1_PLR5_SU0_SUS128_SVW2_TT2_32_TLDS0_VW2_WG32_8_1_WGM5
    SolutionIndex: 226
    SolutionNameMin: Cijk_Ailk_Bljk_DB_MT128x128x8_MI16x16x4x1_SN_1LDSB1_AMAS3_GRVW2_IU1_NEPBS4_NLCA1_PLR3_SU32_SUS256_SVW2_TT4_64_TLDS0_VW2_WG32_8_1_WGM5
    SolutionIndex: 227
    SolutionNameMin: Cijk_Ailk_Bljk_DB_MT96x128x8_MI16x16x4x1_SN_1LDSB0_AMAS0_GRVW1_IU1_NEPBS4_NLCA3_PLR3_SU0_SUS256_SVW1_TT6_32_TLDS0_VW1_WG16_16_1_WGM5
    SolutionIndex: 228
    SolutionNameMin: Cijk_Ailk_Bljk_DB_MT64x16x16_MI16x16x4x1_SN_1LDSB0_AMAS0_GRVW1_IU2_NEPBS4_NLCA1_PLR3_SU0_SUS256_SVW1_TT2_16_TLDS0_VW1_WG32_4_1_WGM5
    SolutionIndex: 229
    SolutionNameMin: Cijk_Ailk_Bljk_DB_MT96x128x8_MI16x16x4x1_SN_1LDSB0_AMAS0_GRVW1_IU1_NEPBS4_NLCA3_PLR3_SU0_SUS256_SVW1_TT6_32_TLDS0_VW1_WG16_16_1_WGM11
    SolutionIndex: 230
    SolutionNameMin: Cijk_Ailk_Bljk_DB_MT32x32x8_MI16x16x4x1_SN_1LDSB0_AMAS0_GRVW1_IU1_NEPBS4_NLCA1_PLR3_SU32_SUS256_SVW1_TT2_32_TLDS1_VW1_WG16_4_1_WGM11
    SolutionIndex: 231
    SolutionNameMin: Cijk_Ailk_Bljk_DB_MT64x64x8_MI16x16x4x1_SN_1LDSB0_AMAS0_GRVW1_IU1_NEPBS4_NLCA1_PLR3_SU32_SUS128_SVW1_TT2_32_TLDS0_VW1_WG32_8_1_WGM11
    SolutionIndex: 232
    SolutionNameMin: Cijk_Ailk_Bljk_DB_MT64x64x16_MI16x16x4x1_SN_1LDSB1_AMAS3_GRVW2_IU1_NEPBS4_NLCA1_PLR5_SU32_SUS128_SVW2_TT2_32_TLDS0_VW2_WG32_8_1_WGM11
    SolutionIndex: 233
    SolutionNameMin: Cijk_Ailk_Bljk_DB_MT64x32x16_MI16x16x4x1_SN_1LDSB0_AMAS3_GRVW2_IU1_NEPBS4_NLCA1_PLR5_SU0_SUS256_SVW2_TT2_16_TLDS0_VW2_WG32_8_1_WGM5
    SolutionIndex: 234
    SolutionNameMin: Cijk_Ailk_Bljk_DB_MT64x16x8_MI16x16x4x1_SN_1LDSB0_AMAS0_GRVW1_IU1_NEPBS4_NLCA1_PLR3_SU32_SUS256_SVW1_TT2_16_TLDS0_VW1_WG32_4_1_WGM11
    SolutionIndex: 235
    SolutionNameMin: Cijk_Ailk_Bljk_DB_MT128x96x16_MI16x16x4x1_SN_1LDSB1_AMAS3_GRVW2_IU1_NEPBS4_NLCA1_PLR5_SU0_SUS256_SVW2_TT2_96_TLDS0_VW2_WG64_4_1_WGM11
    SolutionIndex: 236
    SolutionNameMin: Cijk_Ailk_Bljk_DB_MT64x32x8_MI16x16x4x1_SN_1LDSB0_AMAS3_GRVW2_IU1_NEPBS4_NLCA1_PLR3_SU32_SUS128_SVW2_TT2_16_TLDS0_VW2_WG32_8_1_WGM11
    SolutionIndex: 237
    SolutionNameMin: Cijk_Ailk_Bljk_DB_MT96x128x8_MI16x16x4x1_SN_1LDSB0_AMAS0_GRVW1_IU1_NEPBS4_NLCA3_PLR3_SU0_SUS128_SVW1_TT6_32_TLDS0_VW1_WG16_16_1_WGM5
    SolutionIndex: 238
    SolutionNameMin: Cijk_Ailk_Bljk_DB_MT128x64x8_MI16x16x4x1_SN_1LDSB1_AMAS3_GRVW2_IU1_NEPBS4_NLCA1_PLR3_SU32_SUS256_SVW2_TT4_32_TLDS0_VW2_WG32_8_1_WGM11
    SolutionIndex: 239
    SolutionNameMin: Cijk_Ailk_Bljk_DB_MT16x32x8_MI16x16x4x1_SN_1LDSB0_AMAS0_GRVW1_IU1_NEPBS4_NLCA1_PLR3_SU0_SUS256_SVW1_TT1_16_TLDS1_VW1_WG16_8_1_WGM11
    SolutionIndex: 240
    SolutionNameMin: Cijk_Ailk_Bljk_DB_MT32x32x16_MI16x16x4x1_SN_1LDSB0_AMAS0_GRVW1_IU2_NEPBS4_NLCA1_PLR3_SU32_SUS256_SVW1_TT1_16_TLDS0_VW1_WG32_8_1_WGM5
    SolutionIndex: 241
    SolutionNameMin: Cijk_Ailk_Bljk_DB_MT128x96x16_MI16x16x4x1_SN_1LDSB1_AMAS3_GRVW2_IU1_NEPBS4_NLCA1_PLR5_SU0_SUS128_SVW2_TT2_96_TLDS0_VW2_WG64_4_1_WGM5
    SolutionIndex: 242
    SolutionNameMin: Cijk_Ailk_Bljk_DB_MT64x16x8_MI16x16x4x1_SN_1LDSB0_AMAS3_GRVW2_IU1_NEPBS4_NLCA1_PLR3_SU0_SUS128_SVW2_TT2_16_TLDS0_VW2_WG32_4_1_WGM11
    SolutionIndex: 243
    SolutionNameMin: Cijk_Ailk_Bljk_DB_MT32x32x8_MI16x16x4x1_SN_1LDSB0_AMAS0_GRVW1_IU1_NEPBS4_NLCA1_PLR3_SU32_SUS256_SVW1_TT1_16_TLDS1_VW1_WG32_8_1_WGM11
    SolutionIndex: 244
    SolutionNameMin: Cijk_Ailk_Bljk_DB_MT64x16x8_MI16x16x4x1_SN_1LDSB0_AMAS0_GRVW1_IU1_NEPBS4_NLCA1_PLR3_SU0_SUS256_SVW1_TT2_16_TLDS1_VW1_WG32_4_1_WGM5
    SolutionIndex: 245
    SolutionNameMin: Cijk_Ailk_Bljk_DB_MT128x64x8_MI16x16x4x1_SN_1LDSB0_AMAS0_GRVW1_IU1_NEPBS4_NLCA1_PLR3_SU0_SUS128_SVW1_TT4_32_TLDS1_VW1_WG32_8_1_WGM11
    SolutionIndex: 246
    SolutionNameMin: Cijk_Ailk_Bljk_DB_MT32x32x16_MI16x16x4x1_SN_1LDSB1_AMAS3_GRVW2_IU2_NEPBS4_NLCA1_PLR3_SU0_SUS256_SVW2_TT2_32_TLDS1_VW2_WG16_4_1_WGM11
    SolutionIndex: 247
    SolutionNameMin: Cijk_Ailk_Bljk_DB_MT32x32x16_MI16x16x4x1_SN_1LDSB1_AMAS3_GRVW2_IU1_NEPBS4_NLCA1_PLR5_SU0_SUS256_SVW2_TT2_32_TLDS1_VW2_WG16_4_1_WGM11
    SolutionIndex: 248
    SolutionNameMin: Cijk_Ailk_Bljk_DB_MT16x32x8_MI16x16x4x1_SN_1LDSB0_AMAS0_GRVW1_IU1_NEPBS4_NLCA1_PLR3_SU0_SUS128_SVW1_TT1_16_TLDS1_VW1_WG16_8_1_WGM5
    SolutionIndex: 249
    SolutionNameMin: Cijk_Ailk_Bljk_DB_MT128x64x8_MI16x16x4x1_SN_1LDSB0_AMAS0_GRVW1_IU1_NEPBS4_NLCA1_PLR3_SU0_SUS128_SVW1_TT4_32_TLDS0_VW1_WG32_8_1_WGM5
    SolutionIndex: 250
    SolutionNameMin: Cijk_Ailk_Bljk_DB_MT32x16x16_MI16x16x4x1_SN_1LDSB0_AMAS0_GRVW1_IU1_NEPBS4_NLCA1_PLR5_SU32_SUS128_SVW1_TT1_16_TLDS0_VW1_WG32_4_1_WGM5
    SolutionIndex: 251
    SolutionNameMin: Cijk_Ailk_Bljk_DB_MT16x32x8_MI16x16x4x1_SN_1LDSB0_AMAS0_GRVW1_IU1_NEPBS4_NLCA1_PLR3_SU0_SUS128_SVW1_TT1_16_TLDS0_VW1_WG16_8_1_WGM11
    SolutionIndex: 252
    SolutionNameMin: Cijk_Ailk_Bljk_DB_MT64x32x8_MI16x16x4x1_SN_1LDSB0_AMAS3_GRVW2_IU1_NEPBS4_NLCA1_PLR3_SU0_SUS128_SVW2_TT2_16_TLDS1_VW2_WG32_8_1_WGM11
    SolutionIndex: 253
    SolutionNameMin: Cijk_Ailk_Bljk_DB_MT32x32x8_MI16x16x4x1_SN_1LDSB0_AMAS0_GRVW1_IU1_NEPBS4_NLCA1_PLR3_SU0_SUS128_SVW1_TT2_32_TLDS0_VW1_WG16_4_1_WGM5
    SolutionIndex: 254
    SolutionNameMin: Cijk_Ailk_Bljk_DB_MT128x64x8_MI16x16x4x1_SN_1LDSB1_AMAS0_GRVW1_IU1_NEPBS4_NLCA1_PLR3_SU32_SUS256_SVW1_TT4_32_TLDS0_VW1_WG32_8_1_WGM5
    SolutionIndex: 255
    SolutionNameMin: Cijk_Ailk_Bljk_DB_MT16x32x8_MI16x16x4x1_SN_1LDSB0_AMAS0_GRVW1_IU1_NEPBS4_NLCA1_PLR3_SU0_SUS256_SVW1_TT1_16_TLDS0_VW1_WG16_8_1_WGM5
    SolutionIndex: 256
    SolutionNameMin: Cijk_Ailk_Bljk_DB_MT64x64x16_MI16x16x4x1_SN_1LDSB1_AMAS3_GRVW2_IU1_NEPBS1_NLCA1_PLR5_SU32_SUS128_SVW2_TT2_32_TLDS0_VW2_WG32_8_1_WGM5
    SolutionIndex: 257
    SolutionNameMin: Cijk_Ailk_Bljk_DB_MT32x16x8_MI16x16x4x1_SN_1LDSB0_AMAS0_GRVW1_IU1_NEPBS4_NLCA1_PLR3_SU32_SUS256_SVW1_TT1_16_TLDS1_VW1_WG32_4_1_WGM5
    SolutionIndex: 258
    SolutionNameMin: Cijk_Ailk_Bljk_DB_MT64x64x8_MI16x16x4x1_SN_1LDSB0_AMAS3_GRVW2_IU1_NEPBS1_NLCA1_PLR3_SU0_SUS256_SVW2_TT2_32_TLDS0_VW2_WG32_8_1_WGM5
    SolutionIndex: 259
    SolutionNameMin: Cijk_Ailk_Bljk_DB_MT16x32x16_MI16x16x4x1_SN_1LDSB0_AMAS0_GRVW1_IU2_NEPBS4_NLCA1_PLR3_SU0_SUS128_SVW1_TT1_16_TLDS0_VW1_WG16_8_1_WGM5
    SolutionIndex: 260
    SolutionNameMin: Cijk_Ailk_Bljk_DB_MT32x16x16_MI16x16x4x1_SN_1LDSB0_AMAS0_GRVW1_IU2_NEPBS4_NLCA1_PLR3_SU0_SUS128_SVW1_TT1_16_TLDS1_VW1_WG32_4_1_WGM5
    SolutionIndex: 261
    SolutionNameMin: Cijk_Ailk_Bljk_DB_MT16x32x16_MI16x16x4x1_SN_1LDSB0_AMAS0_GRVW1_IU1_NEPBS4_NLCA1_PLR5_SU0_SUS256_SVW1_TT1_16_TLDS0_VW1_WG16_8_1_WGM5
    SolutionIndex: 262
    SolutionNameMin: Cijk_Ailk_Bljk_DB_MT64x32x8_MI16x16x4x1_SN_1LDSB0_AMAS3_GRVW2_IU1_NEPBS4_NLCA1_PLR3_SU32_SUS256_SVW2_TT2_16_TLDS1_VW2_WG32_8_1_WGM5
    SolutionIndex: 263
    SolutionNameMin: Cijk_Ailk_Bljk_DB_MT32x32x8_MI16x16x4x1_SN_1LDSB0_AMAS3_GRVW2_IU1_NEPBS4_NLCA1_PLR3_SU0_SUS256_SVW2_TT2_32_TLDS0_VW2_WG16_4_1_WGM11
    SolutionIndex: 264
    SolutionNameMin: Cijk_Ailk_Bljk_DB_MT32x32x16_MI16x16x4x1_SN_1LDSB1_AMAS3_GRVW2_IU2_NEPBS4_NLCA1_PLR3_SU0_SUS128_SVW2_TT2_32_TLDS1_VW2_WG16_4_1_WGM11
    SolutionIndex: 265
    SolutionNameMin: Cijk_Ailk_Bljk_DB_MT128x128x8_MI16x16x4x1_SN_1LDSB1_AMAS3_GRVW2_IU1_NEPBS4_NLCA1_PLR3_SU0_SUS256_SVW2_TT4_64_TLDS0_VW2_WG32_8_1_WGM5
    SolutionIndex: 266
    SolutionNameMin: Cijk_Ailk_Bljk_DB_MT128x96x16_MI16x16x4x1_SN_1LDSB1_AMAS3_GRVW2_IU1_NEPBS4_NLCA1_PLR5_SU32_SUS128_SVW2_TT2_96_TLDS0_VW2_WG64_4_1_WGM11
    SolutionIndex: 267
    SolutionNameMin: Cijk_Ailk_Bljk_DB_MT32x32x16_MI16x16x4x1_SN_1LDSB0_AMAS0_GRVW1_IU2_NEPBS4_NLCA1_PLR3_SU0_SUS128_SVW1_TT1_16_TLDS1_VW1_WG32_8_1_WGM11
    SolutionIndex: 268
    SolutionNameMin: Cijk_Ailk_Bljk_DB_MT128x64x8_MI16x16x4x1_SN_1LDSB1_AMAS0_GRVW1_IU1_NEPBS4_NLCA1_PLR3_SU0_SUS128_SVW1_TT4_32_TLDS1_VW1_WG32_8_1_WGM5
    SolutionIndex: 269
    SolutionNameMin: Cijk_Ailk_Bljk_DB_MT64x32x8_MI16x16x4x1_SN_1LDSB0_AMAS0_GRVW1_IU1_NEPBS4_NLCA1_PLR3_SU32_SUS256_SVW1_TT2_16_TLDS0_VW1_WG32_8_1_WGM11
    SolutionIndex: 270
    SolutionNameMin: Cijk_Ailk_Bljk_DB_MT16x32x8_MI16x16x4x1_SN_1LDSB0_AMAS0_GRVW1_IU1_NEPBS4_NLCA1_PLR3_SU0_SUS256_SVW1_TT1_16_TLDS1_VW1_WG16_8_1_WGM5
    SolutionIndex: 271
    SolutionNameMin: Cijk_Ailk_Bljk_DB_MT128x128x8_MI16x16x4x1_SN_1LDSB1_AMAS3_GRVW2_IU1_NEPBS4_NLCA1_PLR3_SU0_SUS256_SVW2_TT4_64_TLDS0_VW2_WG32_8_1_WGM11
    SolutionIndex: 272
    SolutionNameMin: Cijk_Ailk_Bljk_DB_MT64x128x8_MI16x16x4x1_SN_1LDSB1_AMAS3_GRVW2_IU1_NEPBS4_NLCA1_PLR3_SU0_SUS128_SVW2_TT2_64_TLDS0_VW2_WG32_8_1_WGM11
    SolutionIndex: 273
    SolutionNameMin: Cijk_Ailk_Bljk_DB_MT128x64x8_MI16x16x4x1_SN_1LDSB0_AMAS0_GRVW1_IU1_NEPBS4_NLCA1_PLR3_SU0_SUS256_SVW1_TT4_32_TLDS0_VW1_WG32_8_1_WGM5
    SolutionIndex: 274
    SolutionNameMin: Cijk_Ailk_Bljk_DB_MT96x128x8_MI16x16x4x1_SN_1LDSB1_AMAS0_GRVW1_IU1_NEPBS4_NLCA3_PLR3_SU0_SUS128_SVW1_TT6_32_TLDS1_VW1_WG16_16_1_WGM5
    SolutionIndex: 275
    SolutionNameMin: Cijk_Ailk_Bljk_DB_MT64x32x8_MI16x16x4x1_SN_1LDSB0_AMAS3_GRVW2_IU1_NEPBS4_NLCA1_PLR3_SU32_SUS128_SVW2_TT2_16_TLDS0_VW2_WG32_8_1_WGM5
    SolutionIndex: 276
    SolutionNameMin: Cijk_Ailk_Bljk_DB_MT64x64x16_MI16x16x4x1_SN_1LDSB1_AMAS3_GRVW2_IU2_NEPBS4_NLCA1_PLR3_SU32_SUS256_SVW2_TT2_32_TLDS0_VW2_WG32_8_1_WGM5
    SolutionIndex: 277
    SolutionNameMin: Cijk_Ailk_Bljk_DB_MT32x32x8_MI16x16x4x1_SN_1LDSB0_AMAS0_GRVW1_IU1_NEPBS4_NLCA1_PLR3_SU0_SUS256_SVW1_TT2_32_TLDS1_VW1_WG16_4_1_WGM11
    SolutionIndex: 278
    SolutionNameMin: Cijk_Ailk_Bljk_DB_MT32x32x16_MI16x16x4x1_SN_1LDSB1_AMAS0_GRVW1_IU2_NEPBS4_NLCA1_PLR3_SU0_SUS128_SVW1_TT2_32_TLDS1_VW1_WG16_4_1_WGM5
    SolutionIndex: 279
    SolutionNameMin: Cijk_Ailk_Bljk_DB_MT64x128x8_MI16x16x4x1_SN_1LDSB1_AMAS3_GRVW2_IU1_NEPBS4_NLCA1_PLR3_SU0_SUS256_SVW2_TT2_64_TLDS0_VW2_WG32_8_1_WGM5
    SolutionIndex: 280
    SolutionNameMin: Cijk_Ailk_Bljk_DB_MT32x32x8_MI16x16x4x1_SN_1LDSB0_AMAS0_GRVW1_IU1_NEPBS4_NLCA1_PLR3_SU0_SUS256_SVW1_TT2_32_TLDS0_VW1_WG16_4_1_WGM11
    SolutionIndex: 281
    SolutionNameMin: Cijk_Ailk_Bljk_DB_MT64x64x8_MI16x16x4x1_SN_1LDSB0_AMAS0_GRVW1_IU1_NEPBS4_NLCA1_PLR3_SU32_SUS256_SVW1_TT2_32_TLDS0_VW1_WG32_8_1_WGM11
    SolutionIndex: 282
    SolutionNameMin: Cijk_Ailk_Bljk_DB_MT128x128x8_MI16x16x4x1_SN_1LDSB0_AMAS3_GRVW2_IU1_NEPBS4_NLCA1_PLR3_SU32_SUS256_SVW2_TT4_64_TLDS0_VW2_WG32_8_1_WGM11
    SolutionIndex: 283
    SolutionNameMin: Cijk_Ailk_Bljk_DB_MT32x32x16_MI16x16x4x1_SN_1LDSB1_AMAS3_GRVW2_IU1_NEPBS4_NLCA1_PLR5_SU0_SUS128_SVW2_TT2_32_TLDS0_VW2_WG16_4_1_WGM5
    SolutionIndex: 284
    SolutionNameMin: Cijk_Ailk_Bljk_DB_MT128x64x8_MI16x16x4x1_SN_1LDSB0_AMAS0_GRVW1_IU1_NEPBS4_NLCA1_PLR3_SU0_SUS256_SVW1_TT4_32_TLDS0_VW1_WG32_8_1_WGM11
    SolutionIndex: 285
    SolutionNameMin: Cijk_Ailk_Bljk_DB_MT64x32x8_MI16x16x4x1_SN_1LDSB0_AMAS0_GRVW1_IU1_NEPBS1_NLCA1_PLR3_SU0_SUS128_SVW1_TT2_16_TLDS0_VW1_WG32_8_1_WGM5
    SolutionIndex: 286
    SolutionNameMin: Cijk_Ailk_Bljk_DB_MT64x64x16_MI16x16x4x1_SN_1LDSB1_AMAS3_GRVW2_IU2_NEPBS4_NLCA1_PLR3_SU32_SUS128_SVW2_TT2_32_TLDS0_VW2_WG32_8_1_WGM5
    SolutionIndex: 287
    SolutionNameMin: Cijk_Ailk_Bljk_DB_MT128x64x8_MI16x16x4x1_SN_1LDSB1_AMAS0_GRVW1_IU1_NEPBS4_NLCA1_PLR3_SU32_SUS256_SVW1_TT4_32_TLDS0_VW1_WG32_8_1_WGM11
    SolutionIndex: 288
    SolutionNameMin: Cijk_Ailk_Bljk_DB_MT32x32x8_MI16x16x4x1_SN_1LDSB0_AMAS3_GRVW2_IU1_NEPBS4_NLCA1_PLR3_SU0_SUS128_SVW2_TT2_32_TLDS0_VW2_WG16_4_1_WGM5
    SolutionIndex: 289
    SolutionNameMin: Cijk_Ailk_Bljk_DB_MT64x32x8_MI16x16x4x1_SN_1LDSB0_AMAS0_GRVW1_IU1_NEPBS4_NLCA1_PLR3_SU32_SUS128_SVW1_TT2_16_TLDS0_VW1_WG32_8_1_WGM11
    SolutionIndex: 290
    SolutionNameMin: Cijk_Ailk_Bljk_DB_MT32x16x16_MI16x16x4x1_SN_1LDSB0_AMAS0_GRVW1_IU2_NEPBS4_NLCA1_PLR3_SU32_SUS128_SVW1_TT1_16_TLDS0_VW1_WG32_4_1_WGM5
    SolutionIndex: 291
    SolutionNameMin: Cijk_Ailk_Bljk_DB_MT64x64x8_MI16x16x4x1_SN_1LDSB0_AMAS3_GRVW2_IU1_NEPBS1_NLCA1_PLR3_SU0_SUS256_SVW2_TT2_32_TLDS0_VW2_WG32_8_1_WGM11
    SolutionIndex: 292
    SolutionNameMin: Cijk_Ailk_Bljk_DB_MT128x64x8_MI16x16x4x1_SN_1LDSB1_AMAS0_GRVW1_IU1_NEPBS4_NLCA1_PLR3_SU32_SUS128_SVW1_TT4_32_TLDS0_VW1_WG32_8_1_WGM5
    SolutionIndex: 293
    SolutionNameMin: Cijk_Ailk_Bljk_DB_MT64x64x16_MI16x16x4x1_SN_1LDSB0_AMAS3_GRVW2_IU1_NEPBS4_NLCA1_PLR5_SU32_SUS256_SVW2_TT2_32_TLDS0_VW2_WG32_8_1_WGM11
    SolutionIndex: 294
    SolutionNameMin: Cijk_Ailk_Bljk_DB_MT128x96x16_MI16x16x4x1_SN_1LDSB1_AMAS3_GRVW2_IU2_NEPBS4_NLCA1_PLR3_SU32_SUS256_SVW2_TT2_96_TLDS0_VW2_WG64_4_1_WGM5
    SolutionIndex: 295
    SolutionNameMin: Cijk_Ailk_Bljk_DB_MT32x32x16_MI16x16x4x1_SN_1LDSB0_AMAS0_GRVW1_IU2_NEPBS4_NLCA1_PLR3_SU0_SUS256_SVW1_TT1_16_TLDS0_VW1_WG32_8_1_WGM5
    SolutionIndex: 296
    SolutionNameMin: Cijk_Ailk_Bljk_DB_MT16x32x16_MI16x16x4x1_SN_1LDSB0_AMAS0_GRVW1_IU2_NEPBS4_NLCA1_PLR3_SU0_SUS256_SVW1_TT1_16_TLDS1_VW1_WG16_8_1_WGM11
    SolutionIndex: 297
    SolutionNameMin: Cijk_Ailk_Bljk_DB_MT16x32x16_MI16x16x4x1_SN_1LDSB0_AMAS0_GRVW1_IU1_NEPBS4_NLCA1_PLR5_SU0_SUS256_SVW1_TT1_16_TLDS0_VW1_WG16_8_1_WGM11
    SolutionIndex: 298
    SolutionNameMin: Cijk_Ailk_Bljk_DB_MT64x32x8_MI16x16x4x1_SN_1LDSB0_AMAS3_GRVW2_IU1_NEPBS4_NLCA1_PLR3_SU32_SUS256_SVW2_TT2_16_TLDS1_VW2_WG32_8_1_WGM11
    SolutionIndex: 299
    SolutionNameMin: Cijk_Ailk_Bljk_DB_MT32x32x16_MI16x16x4x1_SN_1LDSB0_AMAS0_GRVW1_IU1_NEPBS4_NLCA1_PLR5_SU32_SUS128_SVW1_TT1_16_TLDS0_VW1_WG32_8_1_WGM11
    SolutionIndex: 300
    SolutionNameMin: Cijk_Ailk_Bljk_DB_MT128x128x8_MI16x16x4x1_SN_1LDSB1_AMAS3_GRVW2_IU1_NEPBS4_NLCA1_PLR3_SU32_SUS128_SVW2_TT4_64_TLDS0_VW2_WG32_8_1_WGM11
    SolutionIndex: 301
    SolutionNameMin: Cijk_Ailk_Bljk_DB_MT96x128x8_MI16x16x4x1_SN_1LDSB0_AMAS0_GRVW1_IU1_NEPBS4_NLCA3_PLR3_SU0_SUS256_SVW1_TT6_32_TLDS1_VW1_WG16_16_1_WGM5
    SolutionIndex: 302
    SolutionNameMin: Cijk_Ailk_Bljk_DB_MT64x16x8_MI16x16x4x1_SN_1LDSB0_AMAS0_GRVW1_IU1_NEPBS4_NLCA1_PLR3_SU32_SUS256_SVW1_TT2_16_TLDS0_VW1_WG32_4_1_WGM5
    SolutionIndex: 303
    SolutionNameMin: Cijk_Ailk_Bljk_DB_MT16x32x16_MI16x16x4x1_SN_1LDSB0_AMAS0_GRVW1_IU1_NEPBS4_NLCA1_PLR5_SU0_SUS256_SVW1_TT1_16_TLDS1_VW1_WG16_8_1_WGM5
    SolutionIndex: 304
    SolutionNameMin: Cijk_Ailk_Bljk_DB_MT128x96x8_MI16x16x4x1_SN_1LDSB1_AMAS0_GRVW1_IU1_NEPBS4_NLCA1_PLR3_SU0_SUS128_SVW1_TT2_96_TLDS0_VW1_WG64_4_1_WGM11
    SolutionIndex: 305
    SolutionNameMin: Cijk_Ailk_Bljk_DB_MT64x64x8_MI16x16x4x1_SN_1LDSB0_AMAS3_GRVW2_IU1_NEPBS4_NLCA1_PLR3_SU32_SUS128_SVW2_TT2_32_TLDS0_VW2_WG32_8_1_WGM5
    SolutionIndex: 306
    SolutionNameMin: Cijk_Ailk_Bljk_DB_MT128x96x16_MI16x16x4x1_SN_1LDSB1_AMAS3_GRVW2_IU1_NEPBS4_NLCA1_PLR5_SU0_SUS128_SVW2_TT2_96_TLDS0_VW2_WG64_4_1_WGM11
    SolutionIndex: 307
    SolutionNameMin: Cijk_Ailk_Bljk_DB_MT64x32x8_MI16x16x4x1_SN_1LDSB0_AMAS0_GRVW1_IU1_NEPBS4_NLCA1_PLR3_SU32_SUS256_SVW1_TT2_16_TLDS1_VW1_WG32_8_1_WGM5
    SolutionIndex: 308
    SolutionNameMin: Cijk_Ailk_Bljk_DB_MT128x128x8_MI16x16x4x1_SN_1LDSB0_AMAS3_GRVW2_IU1_NEPBS4_NLCA1_PLR3_SU32_SUS128_SVW2_TT4_64_TLDS0_VW2_WG32_8_1_WGM5
    SolutionIndex: 309
    SolutionNameMin: Cijk_Ailk_Bljk_DB_MT64x64x16_MI16x16x4x1_SN_1LDSB1_AMAS3_GRVW2_IU1_NEPBS4_NLCA1_PLR5_SU32_SUS256_SVW2_TT2_32_TLDS0_VW2_WG32_8_1_WGM5
    SolutionIndex: 310
    SolutionNameMin: Cijk_Ailk_Bljk_DB_MT96x128x8_MI16x16x4x1_SN_1LDSB0_AMAS0_GRVW1_IU1_NEPBS4_NLCA3_PLR3_SU0_SUS128_SVW1_TT6_32_TLDS1_VW1_WG16_16_1_WGM11
    SolutionIndex: 311
    SolutionNameMin: Cijk_Ailk_Bljk_DB_MT64x16x8_MI16x16x4x1_SN_1LDSB0_AMAS0_GRVW1_IU1_NEPBS4_NLCA1_PLR3_SU0_SUS128_SVW1_TT2_16_TLDS1_VW1_WG32_4_1_WGM11
    SolutionIndex: 312
    SolutionNameMin: Cijk_Ailk_Bljk_DB_MT16x32x16_MI16x16x4x1_SN_1LDSB0_AMAS0_GRVW1_IU2_NEPBS4_NLCA1_PLR3_SU0_SUS128_SVW1_TT1_16_TLDS1_VW1_WG16_8_1_WGM11
    SolutionIndex: 313
    SolutionNameMin: Cijk_Ailk_Bljk_DB_MT16x32x16_MI16x16x4x1_SN_1LDSB0_AMAS0_GRVW1_IU1_NEPBS4_NLCA1_PLR5_SU32_SUS128_SVW1_TT1_16_TLDS1_VW1_WG16_8_1_WGM5
    SolutionIndex: 314
    SolutionNameMin: Cijk_Ailk_Bljk_DB_MT32x32x16_MI16x16x4x1_SN_1LDSB0_AMAS0_GRVW1_IU2_NEPBS4_NLCA1_PLR3_SU0_SUS256_SVW1_TT1_16_TLDS1_VW1_WG32_8_1_WGM11
    SolutionIndex: 315
    SolutionNameMin: Cijk_Ailk_Bljk_DB_MT32x32x8_MI16x16x4x1_SN_1LDSB0_AMAS3_GRVW2_IU1_NEPBS4_NLCA1_PLR3_SU0_SUS256_SVW2_TT2_32_TLDS0_VW2_WG16_4_1_WGM5
    SolutionIndex: 316
    SolutionNameMin: Cijk_Ailk_Bljk_DB_MT128x96x16_MI16x16x4x1_SN_1LDSB1_AMAS3_GRVW2_IU2_NEPBS4_NLCA1_PLR3_SU32_SUS128_SVW2_TT2_96_TLDS0_VW2_WG64_4_1_WGM5
    SolutionIndex: 317
    SolutionNameMin: Cijk_Ailk_Bljk_DB_MT32x16x16_MI16x16x4x1_SN_1LDSB0_AMAS0_GRVW1_IU1_NEPBS4_NLCA1_PLR5_SU0_SUS128_SVW1_TT1_16_TLDS1_VW1_WG32_4_1_WGM11
    SolutionIndex: 318
    SolutionNameMin: Cijk_Ailk_Bljk_DB_MT64x16x8_MI16x16x4x1_SN_1LDSB0_AMAS0_GRVW1_IU1_NEPBS4_NLCA1_PLR3_SU0_SUS256_SVW1_TT2_16_TLDS0_VW1_WG32_4_1_WGM5
    SolutionIndex: 319
    SolutionNameMin: Cijk_Ailk_Bljk_DB_MT32x32x16_MI16x16x4x1_SN_1LDSB1_AMAS0_GRVW1_IU1_NEPBS4_NLCA1_PLR5_SU0_SUS128_SVW1_TT2_32_TLDS1_VW1_WG16_4_1_WGM5
    SolutionIndex: 320
    SolutionNameMin: Cijk_Ailk_Bljk_DB_MT16x32x8_MI16x16x4x1_SN_1LDSB0_AMAS0_GRVW1_IU1_NEPBS4_NLCA1_PLR3_SU32_SUS128_SVW1_TT1_16_TLDS0_VW1_WG16_8_1_WGM5
    SolutionIndex: 321
    SolutionNameMin: Cijk_Ailk_Bljk_DB_MT32x32x16_MI16x16x4x1_SN_1LDSB0_AMAS0_GRVW1_IU2_NEPBS4_NLCA1_PLR3_SU0_SUS128_SVW1_TT1_16_TLDS0_VW1_WG32_8_1_WGM11
    SolutionIndex: 322
    SolutionNameMin: Cijk_Ailk_Bljk_DB_MT64x16x8_MI16x16x4x1_SN_1LDSB0_AMAS0_GRVW1_IU1_NEPBS4_NLCA1_PLR3_SU0_SUS256_SVW1_TT2_16_TLDS1_VW1_WG32_4_1_WGM11
    SolutionIndex: 323
    SolutionNameMin: Cijk_Ailk_Bljk_DB_MT32x32x16_MI16x16x4x1_SN_1LDSB1_AMAS3_GRVW2_IU1_NEPBS4_NLCA1_PLR5_SU32_SUS256_SVW2_TT2_32_TLDS1_VW2_WG16_4_1_WGM11
    SolutionIndex: 324
    SolutionNameMin: Cijk_Ailk_Bljk_DB_MT96x128x8_MI16x16x4x1_SN_1LDSB0_AMAS0_GRVW1_IU1_NEPBS4_NLCA3_PLR3_SU0_SUS128_SVW1_TT6_32_TLDS0_VW1_WG16_16_1_WGM11
    SolutionIndex: 325
    SolutionNameMin: Cijk_Ailk_Bljk_DB_MT32x32x16_MI16x16x4x1_SN_1LDSB0_AMAS0_GRVW1_IU1_NEPBS4_NLCA1_PLR5_SU0_SUS128_SVW1_TT1_16_TLDS0_VW1_WG32_8_1_WGM11
    SolutionIndex: 326
    SolutionNameMin: Cijk_Ailk_Bljk_DB_MT32x16x8_MI16x16x4x1_SN_1LDSB0_AMAS0_GRVW1_IU1_NEPBS4_NLCA1_PLR3_SU0_SUS128_SVW1_TT1_16_TLDS1_VW1_WG32_4_1_WGM11
    SolutionIndex: 327
    SolutionNameMin: Cijk_Ailk_Bljk_DB_MT64x16x16_MI16x16x4x1_SN_1LDSB0_AMAS0_GRVW1_IU2_NEPBS4_NLCA1_PLR3_SU32_SUS256_SVW1_TT2_16_TLDS0_VW1_WG32_4_1_WGM11
    SolutionIndex: 328
    SolutionNameMin: Cijk_Ailk_Bljk_DB_MT32x16x16_MI16x16x4x1_SN_1LDSB0_AMAS0_GRVW1_IU1_NEPBS4_NLCA1_PLR5_SU0_SUS256_SVW1_TT1_16_TLDS1_VW1_WG32_4_1_WGM5
    SolutionIndex: 329
    SolutionNameMin: Cijk_Ailk_Bljk_DB_MT32x16x8_MI16x16x4x1_SN_1LDSB0_AMAS0_GRVW1_IU1_NEPBS4_NLCA1_PLR3_SU32_SUS128_SVW1_TT1_16_TLDS0_VW1_WG32_4_1_WGM11
    SolutionIndex: 330
    SolutionNameMin: Cijk_Ailk_Bljk_DB_MT32x16x8_MI16x16x4x1_SN_1LDSB0_AMAS0_GRVW1_IU1_NEPBS4_NLCA1_PLR3_SU32_SUS128_SVW1_TT1_16_TLDS1_VW1_WG32_4_1_WGM11
    SolutionIndex: 331
    SolutionNameMin: Cijk_Ailk_Bljk_DB_MT32x16x16_MI16x16x4x1_SN_1LDSB0_AMAS0_GRVW1_IU2_NEPBS4_NLCA1_PLR3_SU32_SUS256_SVW1_TT1_16_TLDS0_VW1_WG32_4_1_WGM5
    SolutionIndex: 332
    SolutionNameMin: Cijk_Ailk_Bljk_DB_MT64x32x8_MI16x16x4x1_SN_1LDSB0_AMAS3_GRVW2_IU1_NEPBS1_NLCA1_PLR3_SU0_SUS128_SVW2_TT2_16_TLDS0_VW2_WG32_8_1_WGM5
    SolutionIndex: 333
    SolutionNameMin: Cijk_Ailk_Bljk_DB_MT64x16x8_MI16x16x4x1_SN_1LDSB0_AMAS0_GRVW1_IU1_NEPBS4_NLCA1_PLR3_SU0_SUS128_SVW1_TT2_16_TLDS1_VW1_WG32_4_1_WGM5
    SolutionIndex: 334
    SolutionNameMin: Cijk_Ailk_Bljk_DB_MT64x64x16_MI16x16x4x1_SN_1LDSB0_AMAS3_GRVW2_IU1_NEPBS4_NLCA1_PLR5_SU0_SUS256_SVW2_TT2_32_TLDS0_VW2_WG32_8_1_WGM5
    SolutionIndex: 335
    SolutionNameMin: Cijk_Ailk_Bljk_DB_MT32x16x8_MI16x16x4x1_SN_1LDSB0_AMAS0_GRVW1_IU1_NEPBS4_NLCA1_PLR3_SU32_SUS256_SVW1_TT1_16_TLDS1_VW1_WG32_4_1_WGM11
    SolutionIndex: 336
    SolutionNameMin: Cijk_Ailk_Bljk_DB_MT64x64x16_MI16x16x4x1_SN_1LDSB0_AMAS3_GRVW2_IU2_NEPBS4_NLCA1_PLR3_SU0_SUS128_SVW2_TT2_32_TLDS0_VW2_WG32_8_1_WGM5
    SolutionIndex: 337
    SolutionNameMin: Cijk_Ailk_Bljk_DB_MT32x16x8_MI16x16x4x1_SN_1LDSB0_AMAS0_GRVW1_IU1_NEPBS4_NLCA1_PLR3_SU32_SUS256_SVW1_TT1_16_TLDS0_VW1_WG32_4_1_WGM11
    SolutionIndex: 338
    SolutionNameMin: Cijk_Ailk_Bljk_DB_MT128x64x8_MI16x16x4x1_SN_1LDSB1_AMAS3_GRVW2_IU1_NEPBS1_NLCA1_PLR3_SU0_SUS128_SVW2_TT4_32_TLDS0_VW2_WG32_8_1_WGM11
    SolutionIndex: 339
    SolutionNameMin: Cijk_Ailk_Bljk_DB_MT128x64x8_MI16x16x4x1_SN_1LDSB1_AMAS3_GRVW2_IU1_NEPBS1_NLCA1_PLR3_SU32_SUS256_SVW2_TT4_32_TLDS0_VW2_WG32_8_1_WGM5
    SolutionIndex: 340
    SolutionNameMin: Cijk_Ailk_Bljk_DB_MT64x16x16_MI16x16x4x1_SN_1LDSB0_AMAS0_GRVW1_IU2_NEPBS4_NLCA1_PLR3_SU0_SUS128_SVW1_TT2_16_TLDS1_VW1_WG32_4_1_WGM11
    SolutionIndex: 341
    SolutionNameMin: Cijk_Ailk_Bljk_DB_MT32x16x8_MI16x16x4x1_SN_1LDSB0_AMAS0_GRVW1_IU1_NEPBS4_NLCA1_PLR3_SU32_SUS256_SVW1_TT1_16_TLDS0_VW1_WG32_4_1_WGM5
    SolutionIndex: 342
    SolutionNameMin: Cijk_Ailk_Bljk_DB_MT64x16x16_MI16x16x4x1_SN_1LDSB0_AMAS0_GRVW1_IU1_NEPBS4_NLCA1_PLR5_SU0_SUS256_SVW1_TT2_16_TLDS0_VW1_WG32_4_1_WGM11
    SolutionIndex: 343
    SolutionNameMin: Cijk_Ailk_Bljk_DB_MT64x32x8_MI16x16x4x1_SN_1LDSB0_AMAS3_GRVW2_IU1_NEPBS1_NLCA1_PLR3_SU0_SUS256_SVW2_TT2_16_TLDS0_VW2_WG32_8_1_WGM5
    SolutionIndex: 344
    SolutionNameMin: Cijk_Ailk_Bljk_DB_MT32x16x8_MI16x16x4x1_SN_1LDSB0_AMAS0_GRVW1_IU1_NEPBS1_NLCA1_PLR3_SU0_SUS256_SVW1_TT1_16_TLDS1_VW1_WG32_4_1_WGM5
    SolutionIndex: 345
    SolutionNameMin: Cijk_Ailk_Bljk_DB_MT64x16x16_MI16x16x4x1_SN_1LDSB0_AMAS0_GRVW1_IU2_NEPBS4_NLCA1_PLR3_SU0_SUS128_SVW1_TT2_16_TLDS0_VW1_WG32_4_1_WGM11
- - - [41728, 41728, 1, 256]
    - [1, 70.721]
  - - [12032, 12032, 1, 256]
    - [2, 69.282]
  - - [15360, 15360, 1, 256]
    - [2, 70.053]
  - - [7680, 7680, 1, 384]
    - [3, 73.311]
  - - [35328, 35328, 1, 384]
    - [3, 75.783]
  - - [41088, 41088, 1, 384]
    - [3, 75.787]
  - - [21504, 21504, 1, 384]
    - [3, 76.174]
  - - [44544, 44544, 1, 384]
    - [1, 75.434]
  - - [33280, 33280, 1, 256]
    - [1, 71.859]
  - - [1152, 1152, 1, 384]
    - [59, 44.855]
  - - [13312, 13312, 1, 256]
    - [4, 70.195]
  - - [29952, 29952, 1, 256]
    - [1, 71.172]
  - - [13824, 13824, 1, 256]
    - [2, 69.823]
  - - [24576, 24576, 1, 384]
    - [5, 68.116]
  - - [44544, 44544, 1, 256]
    - [1, 70.972]
  - - [20736, 20736, 1, 384]
    - [3, 75.607]
  - - [31488, 31488, 1, 256]
    - [1, 71.168]
  - - [17664, 17664, 1, 384]
    - [3, 75.551]
  - - [26880, 26880, 1, 384]
    - [3, 75.841]
  - - [31872, 31872, 1, 384]
    - [6, 75.235]
  - - [4864, 4864, 1, 256]
    - [7, 61.836]
  - - [10240, 10240, 1, 256]
    - [6, 68.478]
  - - [16896, 16896, 1, 384]
    - [3, 75.564]
  - - [1, 1, 1, 64]
    - [60, 0.0]
  - - [9984, 9984, 1, 384]
    - [3, 74.379]
  - - [26496, 26496, 1, 384]
    - [8, 75.384]
  - - [2816, 2816, 1, 256]
    - [9, 56.057]
  - - [24832, 24832, 1, 256]
    - [1, 70.979]
  - - [8832, 8832, 1, 384]
    - [3, 73.793]
  - - [29184, 29184, 1, 384]
    - [3, 76.143]
  - - [42624, 42624, 1, 384]
    - [10, 74.108]
  - - [22272, 22272, 1, 384]
    - [3, 76.111]
  - - [39552, 39552, 1, 384]
    - [3, 75.783]
  - - [40448, 40448, 1, 256]
    - [2, 70.442]
  - - [44800, 44800, 1, 256]
    - [1, 70.96]
  - - [39680, 39680, 1, 256]
    - [1, 70.611]
  - - [30464, 30464, 1, 256]
    - [1, 70.719]
  - - [32768, 32768, 1, 256]
    - [11, 42.253]
  - - [12672, 12672, 1, 384]
    - [3, 73.734]
  - - [41984, 41984, 1, 256]
    - [1, 71.3]
  - - [11008, 11008, 1, 256]
    - [4, 69.39]
  - - [26112, 26112, 1, 384]
    - [3, 75.82]
  - - [3072, 3072, 1, 384]
    - [12, 64.246]
  - - [9984, 9984, 1, 256]
    - [6, 67.607]
  - - [38016, 38016, 1, 384]
    - [1, 75.135]
  - - [17408, 17408, 1, 256]
    - [4, 69.916]
  - - [43008, 43008, 1, 384]
    - [3, 75.085]
  - - [36096, 36096, 1, 384]
    - [3, 75.478]
  - - [33024, 33024, 1, 256]
    - [1, 71.743]
  - - [8448, 8448, 1, 256]
    - [6, 67.225]
  - - [23552, 23552, 1, 256]
    - [1, 70.814]
  - - [24064, 24064, 1, 256]
    - [1, 70.676]
  - - [41472, 41472, 1, 384]
    - [3, 75.483]
  - - [5120, 5120, 1, 256]
    - [4, 63.046]
  - - [7680, 7680, 1, 256]
    - [4, 66.219]
  - - [6400, 6400, 1, 256]
    - [13, 64.583]
  - - [8704, 8704, 1, 256]
    - [4, 67.042]
  - - [19968, 19968, 1, 256]
    - [2, 70.492]
  - - [40320, 40320, 1, 384]
    - [3, 75.65]
  - - [18432, 18432, 1, 256]
    - [6, 69.808]
  - - [19712, 19712, 1, 256]
    - [4, 70.261]
  - - [43776, 43776, 1, 384]
    - [3, 75.5]
  - - [25344, 25344, 1, 256]
    - [1, 70.478]
  - - [12800, 12800, 1, 256]
    - [6, 69.529]
  - - [10368, 10368, 1, 384]
    - [3, 73.857]
  - - [1280, 1280, 1, 256]
    - [61, 45.438]
  - - [10496, 10496, 1, 256]
    - [6, 66.985]
  - - [24960, 24960, 1, 384]
    - [3, 75.857]
  - - [6144, 6144, 1, 256]
    - [6, 64.423]
  - - [15616, 15616, 1, 256]
    - [6, 69.948]
  - - [9600, 9600, 1, 384]
    - [3, 74.325]
  - - [30720, 30720, 1, 256]
    - [1, 70.594]
  - - [1792, 1792, 1, 256]
    - [14, 52.254]
  - - [20480, 20480, 1, 256]
    - [8, 65.16]
  - - [17920, 17920, 1, 256]
    - [1, 69.719]
  - - [10752, 10752, 1, 384]
    - [3, 75.145]
  - - [39424, 39424, 1, 256]
    - [1, 71.031]
  - - [4224, 4224, 1, 384]
    - [15, 70.094]
  - - [29568, 29568, 1, 384]
    - [1, 75.112]
  - - [33792, 33792, 1, 256]
    - [16, 69.941]
  - - [25344, 25344, 1, 384]
    - [3, 75.725]
  - - [35072, 35072, 1, 256]
    - [1, 71.068]
  - - [1536, 1536, 1, 384]
    - [12, 52.886]
  - - [15744, 15744, 1, 384]
    - [3, 75.804]
  - - [29184, 29184, 1, 256]
    - [1, 71.337]
  - - [40192, 40192, 1, 256]
    - [1, 70.648]
  - - [9728, 9728, 1, 256]
    - [4, 69.153]
  - - [17152, 17152, 1, 256]
    - [4, 70.369]
  - - [30720, 30720, 1, 384]
    - [3, 75.298]
  - - [8192, 8192, 1, 256]
    - [11, 59.369]
  - - [31744, 31744, 1, 256]
    - [1, 70.044]
  - - [16128, 16128, 1, 384]
    - [3, 76.49]
  - - [34816, 34816, 1, 256]
    - [1, 70.365]
  - - [36352, 36352, 1, 256]
    - [1, 71.267]
  - - [38656, 38656, 1, 256]
    - [1, 70.993]
  - - [44032, 44032, 1, 256]
    - [1, 71.146]
  - - [9472, 9472, 1, 256]
    - [4, 68.653]
  - - [23296, 23296, 1, 256]
    - [16, 70.343]
  - - [34304, 34304, 1, 256]
    - [1, 71.192]
  - - [43520, 43520, 1, 256]
    - [2, 69.481]
  - - [19456, 19456, 1, 256]
    - [1, 70.42]
  - - [21120, 21120, 1, 384]
    - [3, 75.824]
  - - [6528, 6528, 1, 384]
    - [3, 72.018]
  - - [9216, 9216, 1, 256]
    - [4, 68.203]
  - - [25856, 25856, 1, 256]
    - [16, 70.319]
  - - [34176, 34176, 1, 384]
    - [3, 76.156]
  - - [32256, 32256, 1, 384]
    - [3, 76.428]
  - - [39936, 39936, 1, 384]
    - [3, 75.856]
  - - [9216, 9216, 1, 384]
    - [3, 74.425]
  - - [14848, 14848, 1, 256]
    - [6, 68.722]
  - - [23040, 23040, 1, 256]
    - [4, 70.6]
  - - [19200, 19200, 1, 256]
    - [4, 70.306]
  - - [1, 64, 1, 64]
    - [62, 0.002]
  - - [14592, 14592, 1, 384]
    - [3, 75.141]
  - - [21888, 21888, 1, 384]
    - [3, 74.801]
  - - [768, 768, 1, 256]
    - [63, 26.375]
  - - [26112, 26112, 1, 256]
    - [1, 70.564]
  - - [27648, 27648, 1, 384]
    - [3, 75.925]
  - - [20992, 20992, 1, 256]
    - [1, 70.718]
  - - [15104, 15104, 1, 256]
    - [4, 69.97]
  - - [13056, 13056, 1, 384]
    - [3, 75.152]
  - - [19968, 19968, 1, 384]
    - [3, 75.942]
  - - [25728, 25728, 1, 384]
    - [3, 75.4]
  - - [44160, 44160, 1, 384]
    - [3, 75.727]
  - - [27136, 27136, 1, 256]
    - [1, 71.294]
  - - [6912, 6912, 1, 384]
    - [3, 72.696]
  - - [37632, 37632, 1, 256]
    - [1, 70.723]
  - - [10752, 10752, 1, 256]
    - [4, 69.375]
  - - [5376, 5376, 1, 384]
    - [3, 71.871]
  - - [35584, 35584, 1, 256]
    - [16, 71.061]
  - - [28800, 28800, 1, 384]
    - [3, 75.405]
  - - [24320, 24320, 1, 256]
    - [1, 71.14]
  - - [38400, 38400, 1, 384]
    - [3, 75.277]
  - - [13440, 13440, 1, 384]
    - [3, 75.681]
  - - [32640, 32640, 1, 384]
    - [3, 77.196]
  - - [11904, 11904, 1, 384]
    - [3, 75.174]
  - - [256, 256, 1, 256]
    - [64, 5.325]
  - - [36096, 36096, 1, 256]
    - [16, 70.266]
  - - [31488, 31488, 1, 384]
    - [3, 75.886]
  - - [32512, 32512, 1, 256]
    - [1, 71.743]
  - - [34560, 34560, 1, 384]
    - [3, 75.974]
  - - [18944, 18944, 1, 256]
    - [4, 69.976]
  - - [35840, 35840, 1, 256]
    - [1, 70.328]
  - - [35328, 35328, 1, 256]
    - [1, 71.105]
  - - [21504, 21504, 1, 256]
    - [4, 70.61]
  - - [21760, 21760, 1, 256]
    - [1, 70.513]
  - - [7936, 7936, 1, 256]
    - [6, 66.605]
  - - [30976, 30976, 1, 256]
    - [16, 71.014]
  - - [13824, 13824, 1, 384]
    - [3, 75.348]
  - - [43776, 43776, 1, 256]
    - [1, 70.081]
  - - [42240, 42240, 1, 384]
    - [3, 75.421]
  - - [24576, 24576, 1, 256]
    - [17, 57.257]
  - - [15360, 15360, 1, 384]
    - [3, 75.392]
  - - [22656, 22656, 1, 384]
    - [3, 75.754]
  - - [20736, 20736, 1, 256]
    - [2, 70.351]
  - - [17664, 17664, 1, 256]
    - [4, 70.216]
  - - [5632, 5632, 1, 256]
    - [2, 63.742]
  - - [26880, 26880, 1, 256]
    - [1, 70.592]
  - - [27264, 27264, 1, 384]
    - [13, 74.706]
  - - [41216, 41216, 1, 256]
    - [1, 71.054]
  - - [22528, 22528, 1, 256]
    - [16, 70.151]
  - - [7424, 7424, 1, 256]
    - [4, 66.884]
  - - [15872, 15872, 1, 256]
    - [6, 70.09]
  - - [37248, 37248, 1, 384]
    - [3, 74.876]
  - - [28672, 28672, 1, 256]
    - [8, 65.117]
  - - [42240, 42240, 1, 256]
    - [1, 70.505]
  - - [37888, 37888, 1, 256]
    - [1, 70.776]
  - - [31104, 31104, 1, 384]
    - [3, 75.908]
  - - [1024, 1024, 1, 256]
    - [65, 32.346]
  - - [36480, 36480, 1, 384]
    - [3, 75.793]
  - - [14976, 14976, 1, 384]
    - [3, 75.31]
  - - [2304, 2304, 1, 384]
    - [14, 64.466]
  - - [2048, 2048, 1, 256]
    - [14, 42.747]
  - - [11520, 11520, 1, 256]
    - [4, 68.865]
  - - [22272, 22272, 1, 256]
    - [1, 70.423]
  - - [11264, 11264, 1, 256]
    - [4, 69.062]
  - - [2688, 2688, 1, 384]
    - [9, 59.428]
  - - [12544, 12544, 1, 256]
    - [2, 69.389]
  - - [33024, 33024, 1, 384]
    - [3, 76.628]
  - - [29440, 29440, 1, 256]
    - [1, 70.636]
  - - [18816, 18816, 1, 384]
    - [3, 75.036]
  - - [25088, 25088, 1, 256]
    - [1, 70.669]
  - - [23040, 23040, 1, 384]
    - [3, 75.781]
  - - [38912, 38912, 1, 256]
    - [1, 70.89]
  - - [1536, 1536, 1, 256]
    - [12, 46.608]
  - - [18176, 18176, 1, 256]
    - [1, 70.237]
  - - [17280, 17280, 1, 384]
    - [3, 75.517]
  - - [38144, 38144, 1, 256]
    - [1, 70.57]
  - - [8960, 8960, 1, 256]
    - [4, 67.277]
  - - [12288, 12288, 1, 256]
    - [8, 63.948]
  - - [12288, 12288, 1, 384]
    - [18, 73.284]
  - - [16640, 16640, 1, 256]
    - [1, 71.01]
  - - [43008, 43008, 1, 256]
    - [1, 70.0]
  - - [28160, 28160, 1, 256]
    - [1, 71.41]
  - - [14208, 14208, 1, 384]
    - [3, 75.266]
  - - [29952, 29952, 1, 384]
    - [3, 76.18]
  - - [37120, 37120, 1, 256]
    - [1, 70.792]
  - - [29696, 29696, 1, 256]
    - [16, 70.205]
  - - [43392, 43392, 1, 384]
    - [3, 75.596]
  - - [23808, 23808, 1, 256]
    - [1, 70.342]
  - - [64, 1, 1, 64]
    - [66, 0.002]
  - - [41472, 41472, 1, 256]
    - [1, 70.744]
  - - [42496, 42496, 1, 256]
    - [1, 70.942]
  - - [34560, 34560, 1, 256]
    - [1, 71.074]
  - - [2560, 2560, 1, 256]
    - [15, 54.987]
  - - [8448, 8448, 1, 384]
    - [3, 73.489]
  - - [21248, 21248, 1, 256]
    - [4, 70.266]
  - - [3584, 3584, 1, 256]
    - [7, 58.023]
  - - [39936, 39936, 1, 256]
    - [1, 71.037]
  - - [36864, 36864, 1, 256]
    - [8, 65.069]
  - - [5760, 5760, 1, 384]
    - [3, 71.023]
  - - [6144, 6144, 1, 384]
    - [5, 71.621]
  - - [13568, 13568, 1, 256]
    - [4, 69.969]
  - - [20352, 20352, 1, 384]
    - [3, 76.243]
  - - [23808, 23808, 1, 384]
    - [3, 75.63]
  - - [35712, 35712, 1, 384]
    - [1, 75.359]
  - - [6912, 6912, 1, 256]
    - [4, 66.256]
  - - [30336, 30336, 1, 384]
    - [3, 76.052]
  - - [3072, 3072, 1, 256]
    - [19, 57.033]
  - - [11136, 11136, 1, 384]
    - [3, 74.95]
  - - [41856, 41856, 1, 384]
    - [1, 75.255]
  - - [27392, 27392, 1, 256]
    - [16, 70.774]
  - - [2304, 2304, 1, 256]
    - [14, 55.074]
  - - [28032, 28032, 1, 384]
    - [3, 75.825]
  - - [4608, 4608, 1, 384]
    - [15, 69.436]
  - - [25600, 25600, 1, 256]
    - [1, 70.924]
  - - [26368, 26368, 1, 256]
    - [1, 70.445]
  - - [28928, 28928, 1, 256]
    - [1, 70.87]
  - - [33408, 33408, 1, 384]
    - [3, 75.943]
  - - [6656, 6656, 1, 256]
    - [4, 65.89]
  - - [16128, 16128, 1, 256]
    - [6, 70.611]
  - - [33536, 33536, 1, 256]
    - [1, 71.346]
  - - [3840, 3840, 1, 256]
    - [19, 60.176]
  - - [3456, 3456, 1, 384]
    - [14, 66.269]
  - - [38784, 38784, 1, 384]
    - [3, 75.587]
  - - [33792, 33792, 1, 384]
    - [10, 74.568]
  - - [14080, 14080, 1, 256]
    - [2, 69.707]
  - - [7168, 7168, 1, 256]
    - [4, 66.261]
  - - [22784, 22784, 1, 256]
    - [1, 70.27]
  - - [3840, 3840, 1, 384]
    - [3, 66.626]
  - - [20224, 20224, 1, 256]
    - [2, 70.264]
  - - [27904, 27904, 1, 256]
    - [1, 70.897]
  - - [31232, 31232, 1, 256]
    - [1, 71.197]
  - - [36864, 36864, 1, 384]
    - [5, 73.834]
  - - [18688, 18688, 1, 256]
    - [4, 70.117]
  - - [44928, 44928, 1, 384]
    - [3, 75.552]
  - - [37376, 37376, 1, 256]
    - [1, 70.964]
  - - [32000, 32000, 1, 256]
    - [1, 71.26]
  - - [32256, 32256, 1, 256]
    - [1, 71.779]
  - - [43264, 43264, 1, 256]
    - [1, 70.553]
  - - [38400, 38400, 1, 256]
    - [1, 70.606]
  - - [1920, 1920, 1, 384]
    - [9, 56.058]
  - - [28416, 28416, 1, 256]
    - [16, 70.751]
  - - [16512, 16512, 1, 384]
    - [3, 77.37]
  - - [5376, 5376, 1, 256]
    - [6, 63.863]
  - - [14592, 14592, 1, 256]
    - [2, 69.878]
  - - [18432, 18432, 1, 384]
    - [3, 75.523]
  - - [36608, 36608, 1, 256]
    - [1, 70.918]
  - - [26624, 26624, 1, 256]
    - [1, 70.642]
  - - [3328, 3328, 1, 256]
    - [20, 55.029]
  - - [30208, 30208, 1, 256]
    - [16, 70.87]
  - - [42752, 42752, 1, 256]
    - [1, 70.691]
  - - [27648, 27648, 1, 256]
    - [1, 70.887]
  - - [39168, 39168, 1, 256]
    - [1, 70.67]
  - - [4352, 4352, 1, 256]
    - [7, 60.063]
  - - [7296, 7296, 1, 384]
    - [3, 71.85]
  - - [13056, 13056, 1, 256]
    - [4, 69.473]
  - - [19200, 19200, 1, 384]
    - [3, 75.812]
  - - [34944, 34944, 1, 384]
    - [6, 75.393]
  - - [512, 512, 1, 256]
    - [67, 15.509]
  - - [18048, 18048, 1, 384]
    - [3, 75.687]
  - - [14336, 14336, 1, 256]
    - [13, 69.077]
  - - [768, 768, 1, 384]
    - [63, 29.845]
  - - [11776, 11776, 1, 256]
    - [4, 69.635]
  - - [4608, 4608, 1, 256]
    - [7, 61.736]
  - - [28416, 28416, 1, 384]
    - [3, 75.987]
  - - [4096, 4096, 1, 256]
    - [20, 57.778]
  - - [11520, 11520, 1, 384]
    - [3, 75.003]
  - - [23424, 23424, 1, 384]
    - [21, 74.269]
  - - [19584, 19584, 1, 384]
    - [3, 75.801]
  - - [44288, 44288, 1, 256]
    - [1, 70.717]
  - - [37632, 37632, 1, 384]
    - [3, 75.065]
  - - [5888, 5888, 1, 256]
    - [6, 63.136]
  - - [40960, 40960, 1, 256]
    - [11, 56.403]
  - - [24192, 24192, 1, 384]
    - [3, 76.034]
  - - [4992, 4992, 1, 384]
    - [15, 70.111]
  - - [34048, 34048, 1, 256]
    - [1, 71.128]
  - - [39168, 39168, 1, 384]
    - [3, 75.485]
  - - [22016, 22016, 1, 256]
    - [2, 70.901]
  - - [40704, 40704, 1, 384]
    - [3, 75.841]
  - - [40704, 40704, 1, 256]
    - [1, 71.049]
  - - [16384, 16384, 1, 256]
    - [17, 48.527]
  - - [8064, 8064, 1, 384]
    - [3, 74.823]
  - - [16896, 16896, 1, 256]
    - [6, 70.275]
  - - [128, 35968, 1, 256]
    - [22, 37.939]
  - - [128, 20608, 1, 384]
    - [12, 45.832]
  - - [128, 2688, 1, 128]
    - [68, 14.812]
  - - [128, 11648, 1, 384]
    - [69, 44.639]
  - - [128, 38528, 1, 256]
    - [23, 39.926]
  - - [128, 3968, 1, 128]
    - [70, 17.336]
  - - [128, 14208, 1, 384]
    - [12, 40.82]
  - - [128, 30848, 1, 256]
    - [24, 40.456]
  - - [128, 37248, 1, 128]
    - [25, 29.894]
  - - [128, 6528, 1, 384]
    - [65, 36.888]
  - - [128, 33408, 1, 256]
    - [12, 38.185]
  - - [128, 24448, 1, 256]
    - [26, 39.849]
  - - [128, 28288, 1, 128]
    - [22, 26.744]
  - - [128, 25728, 1, 256]
    - [7, 40.985]
  - - [128, 1408, 1, 384]
    - [71, 16.077]
  - - [128, 19328, 1, 256]
    - [27, 39.045]
  - - [128, 44928, 1, 384]
    - [12, 42.822]
  - - [128, 20608, 1, 256]
    - [28, 40.361]
  - - [128, 11648, 1, 128]
    - [69, 28.478]
  - - [128, 11648, 1, 256]
    - [69, 39.004]
  - - [128, 9088, 1, 128]
    - [72, 24.761]
  - - [128, 15488, 1, 128]
    - [24, 23.974]
  - - [128, 7808, 1, 384]
    - [73, 32.818]
  - - [128, 14208, 1, 256]
    - [22, 37.069]
  - - [128, 9088, 1, 384]
    - [65, 37.142]
  - - [128, 18048, 1, 128]
    - [12, 30.149]
  - - [128, 41088, 1, 384]
    - [29, 46.2]
  - - [128, 19328, 1, 384]
    - [12, 46.284]
  - - [128, 24448, 1, 128]
    - [30, 28.074]
  - - [128, 9088, 1, 256]
    - [74, 32.338]
  - - [128, 12928, 1, 128]
    - [75, 29.923]
  - - [128, 1408, 1, 256]
    - [71, 13.328]
  - - [128, 27008, 1, 384]
    - [31, 47.518]
  - - [128, 35968, 1, 384]
    - [32, 43.277]
  - - [128, 19328, 1, 128]
    - [12, 28.657]
  - - [128, 44928, 1, 256]
    - [22, 38.844]
  - - [128, 29568, 1, 384]
    - [33, 46.352]
  - - [128, 21888, 1, 384]
    - [32, 43.097]
  - - [128, 32128, 1, 384]
    - [32, 40.995]
  - - [128, 7808, 1, 256]
    - [76, 28.682]
  - - [128, 14208, 1, 128]
    - [12, 26.292]
  - - [128, 39808, 1, 256]
    - [12, 40.017]
  - - [128, 43648, 1, 128]
    - [28, 26.416]
  - - [128, 41088, 1, 256]
    - [28, 41.817]
  - - [128, 6528, 1, 128]
    - [65, 23.744]
  - - [128, 6528, 1, 256]
    - [63, 32.241]
  - - [128, 32128, 1, 256]
    - [34, 35.014]
  - - [128, 35968, 1, 128]
    - [27, 27.578]
  - - [128, 27008, 1, 128]
    - [35, 26.553]
  - - [128, 2688, 1, 256]
    - [77, 19.458]
  - - [128, 32128, 1, 128]
    - [22, 27.908]
  - - [128, 28288, 1, 384]
    - [27, 43.484]
  - - [128, 34688, 1, 256]
    - [12, 37.2]
  - - [128, 38528, 1, 128]
    - [33, 29.358]
  - - [128, 1408, 1, 128]
    - [78, 8.663]
  - - [128, 27008, 1, 256]
    - [30, 41.588]
  - - [128, 30848, 1, 128]
    - [12, 27.642]
  - - [128, 23168, 1, 384]
    - [14, 44.394]
  - - [128, 29568, 1, 256]
    - [33, 40.807]
  - - [128, 33408, 1, 128]
    - [22, 28.418]
  - - [128, 21888, 1, 128]
    - [36, 27.579]
  - - [128, 42368, 1, 128]
    - [28, 26.156]
  - - [128, 15488, 1, 384]
    - [37, 39.939]
  - - [128, 21888, 1, 256]
    - [38, 37.848]
  - - [128, 25728, 1, 128]
    - [24, 27.936]
  - - [128, 18048, 1, 384]
    - [33, 47.088]
  - - [128, 44928, 1, 128]
    - [29, 28.524]
  - - [128, 10368, 1, 384]
    - [79, 44.421]
  - - [128, 16768, 1, 256]
    - [22, 36.414]
  - - [128, 20608, 1, 128]
    - [20, 28.178]
  - - [128, 42368, 1, 384]
    - [28, 40.261]
  - - [128, 28288, 1, 256]
    - [27, 37.804]
  - - [128, 34688, 1, 128]
    - [39, 26.875]
  - - [128, 3968, 1, 384]
    - [77, 24.62]
  - - [128, 16768, 1, 384]
    - [40, 41.922]
  - - [128, 5248, 1, 384]
    - [77, 32.291]
  - - [128, 23168, 1, 128]
    - [32, 27.952]
  - - [128, 39808, 1, 128]
    - [12, 28.958]
  - - [128, 37248, 1, 384]
    - [22, 44.335]
  - - [128, 23168, 1, 256]
    - [2, 39.1]
  - - [128, 29568, 1, 128]
    - [39, 30.28]
  - - [128, 39808, 1, 384]
    - [34, 45.173]
  - - [128, 128, 1, 384]
    - [80, 1.865]
  - - [128, 3968, 1, 256]
    - [77, 21.783]
  - - [128, 10368, 1, 128]
    - [65, 27.243]
  - - [128, 18048, 1, 256]
    - [22, 41.84]
  - - [128, 43648, 1, 384]
    - [33, 40.522]
  - - [128, 10368, 1, 256]
    - [79, 36.11]
  - - [128, 16768, 1, 128]
    - [28, 24.961]
  - - [128, 42368, 1, 256]
    - [12, 35.834]
  - - [128, 34688, 1, 384]
    - [30, 41.942]
  - - [128, 12928, 1, 256]
    - [81, 40.968]
  - - [128, 38528, 1, 384]
    - [26, 44.612]
  - - [128, 43648, 1, 256]
    - [22, 36.519]
  - - [128, 12928, 1, 384]
    - [82, 46.868]
  - - [128, 5248, 1, 128]
    - [83, 20.182]
  - - [128, 5248, 1, 256]
    - [65, 27.385]
  - - [128, 30848, 1, 384]
    - [9, 46.515]
  - - [128, 37248, 1, 256]
    - [40, 40.714]
  - - [128, 41088, 1, 128]
    - [12, 30.399]
  - - [128, 33408, 1, 384]
    - [37, 41.55]
  - - [128, 7808, 1, 128]
    - [84, 22.52]
  - - [128, 24448, 1, 384]
    - [34, 45.894]
  - - [128, 128, 1, 256]
    - [85, 1.562]
  - - [128, 25728, 1, 384]
    - [7, 47.138]
  - - [128, 15488, 1, 256]
    - [33, 34.342]
  - - [128, 128, 1, 128]
    - [86, 1.027]
  - - [128, 2688, 1, 384]
    - [87, 22.468]
  - - [256, 66, 1, 66]
    - [66, 0.546]
  - - [12544, 66, 1, 66]
    - [61, 10.944]
  - - [3872, 32, 1, 32]
    - [88, 1.901]
  - - [24832, 66, 1, 66]
    - [89, 14.089]
  - - [37200, 48, 1, 48]
    - [90, 12.38]
  - - [21472, 32, 1, 32]
    - [91, 7.622]
  - - [15068, 30, 1, 36]
    - [92, 6.061]
  - - [19200, 30, 1, 36]
    - [93, 7.244]
  - - [23040, 58, 1, 66]
    - [94, 14.667]
  - - [38784, 96, 1, 96]
    - [95, 27.164]
  - - [2160, 48, 1, 48]
    - [85, 2.336]
  - - [24064, 58, 1, 66]
    - [81, 15.262]
  - - [13824, 58, 1, 66]
    - [77, 12.552]
  - - [10656, 96, 1, 96]
    - [96, 17.493]
  - - [26522, 30, 1, 36]
    - [77, 7.684]
  - - [37120, 58, 1, 66]
    - [61, 17.168]
  - - [23998, 66, 1, 66]
    - [97, 13.383]
  - - [3672, 30, 1, 36]
    - [98, 1.787]
  - - [20448, 32, 1, 32]
    - [99, 7.43]
  - - [15520, 32, 1, 32]
    - [88, 6.395]
  - - [28768, 32, 1, 32]
    - [100, 7.764]
  - - [9664, 64, 1, 64]
    - [89, 12.927]
  - - [40672, 32, 1, 32]
    - [101, 8.61]
  - - [18000, 48, 1, 48]
    - [102, 10.157]
  - - [31232, 58, 1, 66]
    - [61, 15.483]
  - - [2528, 32, 1, 32]
    - [103, 1.44]
  - - [18240, 64, 1, 64]
    - [104, 16.424]
  - - [29184, 66, 1, 66]
    - [89, 14.181]
  - - [31104, 96, 1, 96]
    - [105, 24.147]
  - - [1248, 32, 1, 32]
    - [106, 0.789]
  - - [28416, 128, 1, 128]
    - [41, 30.855]
  - - [5340, 30, 1, 36]
    - [107, 2.548]
  - - [43264, 66, 1, 66]
    - [101, 15.47]
  - - [43008, 66, 1, 66]
    - [70, 15.407]
  - - [32768, 66, 1, 66]
    - [69, 14.138]
  - - [20544, 64, 1, 64]
    - [63, 17.396]
  - - [9264, 48, 1, 48]
    - [108, 8.016]
  - - [34944, 48, 1, 48]
    - [61, 11.742]
  - - [16800, 96, 1, 96]
    - [109, 21.08]
  - - [22880, 32, 1, 32]
    - [101, 7.999]
  - - [25088, 124, 1, 132]
    - [110, 32.466]
  - - [39168, 58, 1, 66]
    - [61, 17.37]
  - - [22752, 32, 1, 32]
    - [111, 7.836]
  - - [43488, 32, 1, 32]
    - [101, 9.04]
  - - [17664, 192, 1, 192]
    - [29, 40.31]
  - - [25600, 58, 1, 66]
    - [59, 15.716]
  - - [39936, 192, 1, 192]
    - [9, 46.756]
  - - [7680, 30, 1, 36]
    - [112, 3.701]
  - - [39008, 32, 1, 32]
    - [99, 8.451]
  - - [42752, 58, 1, 66]
    - [69, 16.611]
  - - [8208, 48, 1, 48]
    - [113, 7.347]
  - - [40448, 30, 1, 36]
    - [114, 8.135]
  - - [28320, 96, 1, 96]
    - [89, 22.193]
  - - [19648, 64, 1, 64]
    - [63, 16.791]
  - - [33470, 66, 1, 66]
    - [70, 12.563]
  - - [26736, 48, 1, 48]
    - [90, 11.331]
  - - [30464, 30, 1, 36]
    - [115, 7.451]
  - - [256, 30, 1, 36]
    - [86, 0.145]
  - - [14304, 96, 1, 96]
    - [101, 19.478]
  - - [2106, 58, 1, 66]
    - [98, 3.333]
  - - [416, 32, 1, 32]
    - [80, 0.27]
  - - [20956, 30, 1, 36]
    - [116, 7.285]
  - - [39936, 48, 1, 48]
    - [117, 12.918]
  - - [38656, 30, 1, 36]
    - [118, 8.11]
  - - [36864, 66, 1, 66]
    - [101, 14.769]
  - - [38202, 58, 1, 66]
    - [119, 16.353]
  - - [5632, 58, 1, 66]
    - [88, 8.234]
  - - [29696, 124, 1, 132]
    - [120, 29.363]
  - - [13296, 48, 1, 48]
    - [111, 9.083]
  - - [30464, 66, 1, 66]
    - [101, 14.445]
  - - [28032, 48, 1, 48]
    - [65, 11.929]
  - - [9056, 32, 1, 32]
    - [103, 4.265]
  - - [23360, 64, 1, 64]
    - [121, 17.6]
  - - [41560, 30, 1, 36]
    - [93, 8.091]
  - - [28928, 30, 1, 36]
    - [114, 7.489]
  - - [43008, 96, 1, 96]
    - [122, 25.738]
  - - [27224, 30, 1, 36]
    - [88, 8.23]
  - - [6720, 64, 1, 64]
    - [78, 10.693]
  - - [44288, 66, 1, 66]
    - [70, 15.415]
  - - [40272, 48, 1, 48]
    - [90, 12.557]
  - - [43840, 64, 1, 64]
    - [72, 18.689]
  - - [43872, 32, 1, 32]
    - [70, 9.038]
  - - [35840, 66, 1, 66]
    - [89, 14.906]
  - - [38336, 64, 1, 64]
    - [123, 18.82]
  - - [27600, 48, 1, 48]
    - [124, 11.649]
  - - [1488, 48, 1, 48]
    - [86, 1.698]
  - - [27326, 66, 1, 66]
    - [125, 14.267]
  - - [30480, 48, 1, 48]
    - [119, 11.765]
  - - [1632, 32, 1, 32]
    - [126, 1.046]
  - - [14112, 32, 1, 32]
    - [88, 5.92]
  - - [27200, 64, 1, 64]
    - [109, 18.459]
  - - [8832, 48, 1, 48]
    - [113, 7.707]
  - - [24320, 128, 1, 128]
    - [34, 34.8]
  - - [14746, 30, 1, 36]
    - [88, 5.788]
  - - [11864, 30, 1, 36]
    - [88, 5.065]
  - - [3006, 66, 1, 66]
    - [127, 5.044]
  - - [11184, 48, 1, 48]
    - [91, 8.415]
  - - [8638, 66, 1, 66]
    - [128, 9.745]
  - - [12186, 30, 1, 36]
    - [106, 5.296]
  - - [22784, 30, 1, 36]
    - [88, 7.701]
  - - [26784, 96, 1, 96]
    - [61, 24.665]
  - - [42400, 32, 1, 32]
    - [101, 8.976]
  - - [36384, 32, 1, 32]
    - [89, 8.191]
  - - [40960, 30, 1, 36]
    - [129, 8.204]
  - - [21504, 58, 1, 66]
    - [61, 13.894]
  - - [38640, 48, 1, 48]
    - [90, 12.538]
  - - [40560, 48, 1, 48]
    - [130, 12.423]
  - - [18520, 30, 1, 36]
    - [88, 7.042]
  - - [22416, 48, 1, 48]
    - [89, 10.208]
  - - [29696, 58, 1, 66]
    - [117, 14.554]
  - - [25008, 48, 1, 48]
    - [131, 11.003]
  - - [34048, 58, 1, 66]
    - [61, 16.005]
  - - [8192, 66, 1, 66]
    - [89, 10.309]
  - - [29248, 64, 1, 64]
    - [132, 17.529]
  - - [7712, 32, 1, 32]
    - [133, 3.707]
  - - [20000, 32, 1, 32]
    - [111, 7.267]
  - - [17664, 58, 1, 66]
    - [134, 13.192]
  - - [41712, 48, 1, 48]
    - [135, 12.627]
  - - [15072, 96, 1, 96]
    - [99, 20.128]
  - - [10042, 58, 1, 66]
    - [77, 11.177]
  - - [11674, 30, 1, 36]
    - [136, 4.898]
  - - [15002, 30, 1, 36]
    - [88, 5.889]
  - - [34874, 58, 1, 66]
    - [90, 15.626]
  - - [2304, 58, 1, 66]
    - [137, 3.581]
  - - [3232, 32, 1, 32]
    - [60, 1.639]
  - - [24960, 96, 1, 96]
    - [95, 27.209]
  - - [14848, 124, 1, 132]
    - [138, 25.471]
  - - [35712, 192, 1, 192]
    - [28, 42.257]
  - - [40704, 58, 1, 66]
    - [61, 18.051]
  - - [33850, 58, 1, 66]
    - [119, 15.49]
  - - [5464, 30, 1, 36]
    - [139, 2.633]
  - - [20032, 64, 1, 64]
    - [65, 16.962]
  - - [6848, 64, 1, 64]
    - [71, 10.804]
  - - [18432, 30, 1, 36]
    - [91, 7.009]
  - - [23808, 66, 1, 66]
    - [89, 13.787]
  - - [25856, 58, 1, 66]
    - [117, 15.817]
  - - [42048, 64, 1, 64]
    - [69, 19.902]
  - - [3408, 48, 1, 48]
    - [140, 3.503]
  - - [16640, 128, 1, 128]
    - [32, 26.479]
  - - [33024, 96, 1, 96]
    - [141, 24.848]
  - - [23230, 66, 1, 66]
    - [97, 13.029]
  - - [30288, 48, 1, 48]
    - [119, 11.478]
  - - [41440, 32, 1, 32]
    - [99, 8.895]
  - - [30304, 32, 1, 32]
    - [142, 7.6]
  - - [36064, 32, 1, 32]
    - [143, 8.405]
  - - [2400, 96, 1, 96]
    - [144, 8.52]
  - - [33792, 30, 1, 36]
    - [145, 7.544]
  - - [6108, 30, 1, 36]
    - [112, 2.973]
  - - [27744, 32, 1, 32]
    - [101, 8.77]
  - - [27232, 32, 1, 32]
    - [146, 8.549]
  - - [42304, 64, 1, 64]
    - [147, 18.549]
  - - [31008, 96, 1, 96]
    - [132, 23.544]
  - - [16176, 48, 1, 48]
    - [148, 9.28]
  - - [20832, 32, 1, 32]
    - [89, 7.57]
  - - [34362, 58, 1, 66]
    - [90, 15.978]
  - - [9472, 128, 1, 128]
    - [63, 26.392]
  - - [41180, 30, 1, 36]
    - [128, 7.86]
  - - [29568, 192, 1, 192]
    - [9, 41.348]
  - - [31034, 58, 1, 66]
    - [119, 14.872]
  - - [38848, 64, 1, 64]
    - [117, 18.772]
  - - [22080, 64, 1, 64]
    - [63, 17.197]
  - - [12288, 192, 1, 192]
    - [24, 40.992]
  - - [36030, 66, 1, 66]
    - [149, 12.409]
  - - [1280, 30, 1, 36]
    - [150, 0.724]
  - - [38400, 128, 1, 128]
    - [32, 34.451]
  - - [17760, 32, 1, 32]
    - [92, 7.065]
  - - [31488, 124, 1, 132]
    - [151, 30.126]
  - - [2832, 48, 1, 48]
    - [152, 3.231]
  - - [15872, 30, 1, 36]
    - [88, 6.547]
  - - [29040, 48, 1, 48]
    - [90, 11.168]
  - - [33338, 58, 1, 66]
    - [90, 15.671]
  - - [41662, 66, 1, 66]
    - [153, 13.586]
  - - [29424, 48, 1, 48]
    - [154, 11.315]
  - - [24160, 32, 1, 32]
    - [93, 8.021]
  - - [29696, 128, 1, 128]
    - [7, 29.119]
  - - [2874, 58, 1, 66]
    - [136, 4.388]
  - - [19104, 96, 1, 96]
    - [81, 22.477]
  - - [12448, 32, 1, 32]
    - [115, 5.687]
  - - [33888, 96, 1, 96]
    - [105, 23.937]
  - - [20538, 58, 1, 66]
    - [155, 14.116]
  - - [17728, 64, 1, 64]
    - [65, 16.041]
  - - [25056, 96, 1, 96]
    - [61, 23.333]
  - - [26528, 32, 1, 32]
    - [156, 8.328]
  - - [14080, 124, 1, 132]
    - [59, 29.092]
  - - [1776, 48, 1, 48]
    - [157, 2.004]
  - - [16224, 96, 1, 96]
    - [99, 20.481]
  - - [9440, 32, 1, 32]
    - [144, 4.684]
  - - [27904, 128, 1, 128]
    - [34, 36.209]
  - - [17240, 30, 1, 36]
    - [93, 6.878]
  - - [18652, 30, 1, 36]
    - [92, 6.983]
  - - [22016, 66, 1, 66]
    - [101, 13.257]
  - - [24512, 64, 1, 64]
    - [121, 17.743]
  - - [10368, 96, 1, 96]
    - [83, 19.223]
  - - [13532, 30, 1, 36]
    - [113, 5.581]
  - - [40640, 64, 1, 64]
    - [69, 19.285]
  - - [39680, 30, 1, 36]
    - [114, 8.218]
  - - [37208, 30, 1, 36]
    - [116, 7.772]
  - - [33696, 96, 1, 96]
    - [158, 23.841]
  - - [36608, 124, 1, 132]
    - [117, 31.399]
  - - [40602, 30, 1, 36]
    - [159, 7.689]
  - - [2256, 48, 1, 48]
    - [80, 2.415]
  - - [28928, 128, 1, 128]
    - [26, 28.403]
  - - [36240, 48, 1, 48]
    - [160, 12.217]
  - - [28736, 64, 1, 64]
    - [72, 17.278]
  - - [34012, 30, 1, 36]
    - [88, 7.423]
  - - [26200, 30, 1, 36]
    - [88, 8.071]
  - - [12672, 48, 1, 48]
    - [70, 9.137]
  - - [32512, 128, 1, 128]
    - [7, 30.737]
  - - [22938, 30, 1, 36]
    - [91, 7.203]
  - - [33536, 30, 1, 36]
    - [118, 7.663]
  - - [6846, 66, 1, 66]
    - [77, 9.02]
  - - [23008, 32, 1, 32]
    - [91, 8.044]
  - - [41024, 64, 1, 64]
    - [69, 19.123]
  - - [15024, 48, 1, 48]
    - [161, 8.667]
  - - [24768, 64, 1, 64]
    - [162, 18.071]
  - - [5786, 30, 1, 36]
    - [112, 2.734]
  - - [10560, 64, 1, 64]
    - [163, 13.171]
  - - [29280, 32, 1, 32]
    - [164, 7.811]
  - - [38042, 30, 1, 36]
    - [91, 7.496]
  - - [40448, 128, 1, 128]
    - [32, 34.93]
  - - [14976, 192, 1, 192]
    - [9, 34.223]
  - - [43008, 58, 1, 66]
    - [61, 16.598]
  - - [10336, 32, 1, 32]
    - [165, 4.77]
  - - [38400, 96, 1, 96]
    - [79, 27.403]
  - - [31648, 32, 1, 32]
    - [101, 7.728]
  - - [33536, 124, 1, 132]
    - [117, 31.195]
  - - [4752, 48, 1, 48]
    - [112, 4.837]
  - - [29850, 30, 1, 36]
    - [93, 7.087]
  - - [16896, 58, 1, 66]
    - [63, 12.784]
  - - [40896, 64, 1, 64]
    - [81, 19.71]
  - - [26778, 30, 1, 36]
    - [93, 7.947]
  - - [28944, 48, 1, 48]
    - [90, 11.515]
  - - [3680, 32, 1, 32]
    - [165, 1.93]
  - - [9472, 58, 1, 66]
    - [77, 11.041]
  - - [1792, 66, 1, 66]
    - [166, 3.382]
  - - [11776, 66, 1, 66]
    - [89, 11.114]
  - - [26558, 66, 1, 66]
    - [125, 14.053]
  - - [33024, 124, 1, 132]
    - [81, 30.796]
  - - [1312, 32, 1, 32]
    - [115, 0.829]
  - - [17952, 96, 1, 96]
    - [117, 21.549]
  - - [39552, 192, 1, 192]
    - [9, 46.635]
  - - [43456, 64, 1, 64]
    - [132, 18.742]
  - - [13056, 48, 1, 48]
    - [89, 9.16]
  - - [3696, 48, 1, 48]
    - [167, 3.838]
  - - [18048, 48, 1, 48]
    - [168, 10.021]
  - - [5376, 96, 1, 96]
    - [99, 15.087]
  - - [13312, 58, 1, 66]
    - [169, 12.347]
  - - [1056, 32, 1, 32]
    - [80, 0.686]
  - - [11136, 192, 1, 192]
    - [24, 39.362]
  - - [1112, 30, 1, 36]
    - [170, 0.622]
  - - [31320, 30, 1, 36]
    - [77, 7.436]
  - - [32000, 66, 1, 66]
    - [70, 14.541]
  - - [23552, 66, 1, 66]
    - [117, 13.638]
  - - [35760, 48, 1, 48]
    - [119, 12.336]
  - - [13392, 48, 1, 48]
    - [77, 9.089]
  - - [30096, 48, 1, 48]
    - [119, 11.121]
  - - [27194, 58, 1, 66]
    - [171, 15.638]
  - - [31422, 66, 1, 66]
    - [89, 12.386]
  - - [11264, 124, 1, 132]
    - [59, 26.211]
  - - [34528, 32, 1, 32]
    - [89, 8.088]
  - - [12800, 66, 1, 66]
    - [61, 11.268]
  - - [44256, 32, 1, 32]
    - [172, 9.158]
  - - [38488, 30, 1, 36]
    - [88, 7.904]
  - - [736, 32, 1, 32]
    - [173, 0.485]
  - - [732, 30, 1, 36]
    - [174, 0.41]
  - - [38400, 192, 1, 192]
    - [22, 44.926]
  - - [31104, 48, 1, 48]
    - [101, 11.098]
  - - [42480, 48, 1, 48]
    - [90, 11.889]
  - - [28416, 124, 1, 132]
    - [132, 28.441]
  - - [16944, 48, 1, 48]
    - [175, 9.211]
  - - [35328, 96, 1, 96]
    - [141, 26.485]
  - - [29952, 192, 1, 192]
    - [24, 41.92]
  - - [43578, 58, 1, 66]
    - [119, 15.662]
  - - [15192, 30, 1, 36]
    - [93, 6.162]
  - - [38912, 66, 1, 66]
    - [99, 14.978]
  - - [29472, 32, 1, 32]
    - [176, 7.684]
  - - [14272, 64, 1, 64]
    - [121, 14.088]
  - - [29280, 96, 1, 96]
    - [109, 23.12]
  - - [768, 192, 1, 192]
    - [64, 9.739]
  - - [27264, 192, 1, 192]
    - [24, 46.171]
  - - [17664, 66, 1, 66]
    - [89, 13.135]
  - - [42972, 30, 1, 36]
    - [161, 8.075]
  - - [11264, 30, 1, 36]
    - [115, 4.939]
  - - [22624, 32, 1, 32]
    - [177, 7.791]
  - - [25344, 30, 1, 36]
    - [88, 8.169]
  - - [22272, 48, 1, 48]
    - [101, 10.706]
  - - [37852, 30, 1, 36]
    - [92, 7.581]
  - - [42328, 30, 1, 36]
    - [77, 7.893]
  - - [15888, 48, 1, 48]
    - [155, 9.647]
  - - [18688, 128, 1, 128]
    - [14, 29.296]
  - - [32992, 32, 1, 32]
    - [172, 7.848]
  - - [35184, 48, 1, 48]
    - [135, 12.259]
  - - [40448, 124, 1, 132]
    - [178, 32.047]
  - - [21760, 128, 1, 128]
    - [26, 32.524]
  - - [11776, 30, 1, 36]
    - [67, 5.117]
  - - [9786, 58, 1, 66]
    - [77, 10.891]
  - - [576, 64, 1, 64]
    - [60, 1.313]
  - - [1952, 32, 1, 32]
    - [103, 1.201]
  - - [40480, 32, 1, 32]
    - [70, 8.853]
  - - [28350, 66, 1, 66]
    - [99, 11.892]
  - - [20926, 66, 1, 66]
    - [153, 12.19]
  - - [5216, 32, 1, 32]
    - [127, 2.616]
  - - [20480, 66, 1, 66]
    - [117, 13.628]
  - - [39360, 64, 1, 64]
    - [61, 19.375]
  - - [43996, 30, 1, 36]
    - [128, 8.05]
  - - [12032, 58, 1, 66]
    - [89, 12.068]
  - - [19932, 30, 1, 36]
    - [92, 7.081]
  - - [35328, 30, 1, 36]
    - [118, 7.745]
  - - [32976, 48, 1, 48]
    - [90, 11.972]
  - - [22720, 64, 1, 64]
    - [162, 17.547]
  - - [12384, 32, 1, 32]
    - [115, 5.659]
  - - [35328, 124, 1, 132]
    - [123, 31.435]
  - - [42298, 58, 1, 66]
    - [119, 15.625]
  - - [23328, 32, 1, 32]
    - [179, 8.034]
  - - [32704, 64, 1, 64]
    - [109, 17.549]
  - - [8064, 96, 1, 96]
    - [70, 17.815]
  - - [16352, 32, 1, 32]
    - [91, 6.923]
  - - [34112, 64, 1, 64]
    - [180, 18.251]
  - - [37946, 58, 1, 66]
    - [135, 16.244]
  - - [20282, 58, 1, 66]
    - [102, 14.052]
  - - [42144, 32, 1, 32]
    - [181, 8.761]
  - - [4864, 124, 1, 132]
    - [77, 18.687]
  - - [30752, 32, 1, 32]
    - [93, 7.713]
  - - [20736, 96, 1, 96]
    - [122, 24.748]
  - - [32784, 48, 1, 48]
    - [135, 12.333]
  - - [30528, 64, 1, 64]
    - [158, 17.665]
  - - [3552, 96, 1, 96]
    - [77, 11.436]
  - - [7936, 128, 1, 128]
    - [65, 23.917]
  - - [11232, 32, 1, 32]
    - [93, 5.082]
  - - [11096, 30, 1, 36]
    - [108, 4.779]
  - - [2494, 66, 1, 66]
    - [98, 4.411]
  - - [44160, 192, 1, 192]
    - [37, 44.926]
  - - [20352, 96, 1, 96]
    - [122, 24.22]
  - - [6576, 48, 1, 48]
    - [67, 6.207]
  - - [1434, 30, 1, 36]
    - [136, 0.775]
  - - [37104, 48, 1, 48]
    - [90, 12.269]
  - - [28892, 30, 1, 36]
    - [93, 7.102]
  - - [36864, 96, 1, 96]
    - [95, 26.627]
  - - [18656, 32, 1, 32]
    - [88, 7.174]
  - - [18074, 30, 1, 36]
    - [93, 6.664]
  - - [34176, 96, 1, 96]
    - [141, 25.167]
  - - [21024, 32, 1, 32]
    - [77, 7.463]
  - - [43360, 32, 1, 32]
    - [182, 8.893]
  - - [18432, 124, 1, 132]
    - [117, 29.947]
  - - [32832, 64, 1, 64]
    - [72, 17.168]
  - - [38714, 58, 1, 66]
    - [90, 16.329]
  - - [38624, 32, 1, 32]
    - [101, 8.29]
  - - [8032, 32, 1, 32]
    - [165, 4.029]
  - - [40992, 96, 1, 96]
    - [81, 24.356]
  - - [31936, 64, 1, 64]
    - [72, 18.028]
  - - [36704, 32, 1, 32]
    - [183, 8.303]
  - - [30384, 48, 1, 48]
    - [90, 11.267]
  - - [32576, 64, 1, 64]
    - [184, 17.686]
  - - [23424, 48, 1, 48]
    - [89, 10.81]
  - - [9728, 66, 1, 66]
    - [73, 9.946]
  - - [28248, 30, 1, 36]
    - [92, 7.236]
  - - [3104, 32, 1, 32]
    - [166, 1.628]
  - - [5760, 192, 1, 192]
    - [134, 30.475]
  - - [3616, 32, 1, 32]
    - [106, 1.814]
  - - [13280, 32, 1, 32]
    - [115, 5.836]
  - - [41984, 124, 1, 132]
    - [185, 32.876]
  - - [10298, 58, 1, 66]
    - [128, 11.173]
  - - [42554, 58, 1, 66]
    - [90, 15.487]
  - - [8858, 30, 1, 36]
    - [106, 3.815]
  - - [4464, 48, 1, 48]
    - [137, 4.414]
  - - [14080, 58, 1, 66]
    - [161, 12.586]
  - - [12704, 32, 1, 32]
    - [136, 5.479]
  - - [36912, 48, 1, 48]
    - [154, 12.167]
  - - [37720, 30, 1, 36]
    - [92, 7.779]
  - - [33280, 66, 1, 66]
    - [70, 14.848]
  - - [28928, 58, 1, 66]
    - [178, 14.382]
  - - [27696, 48, 1, 48]
    - [154, 11.412]
  - - [13144, 30, 1, 36]
    - [115, 5.331]
  - - [8832, 192, 1, 192]
    - [12, 32.248]
  - - [15418, 58, 1, 66]
    - [169, 11.464]
  - - [31552, 64, 1, 64]
    - [72, 17.757]
  - - [32256, 96, 1, 96]
    - [141, 24.269]
  - - [41856, 96, 1, 96]
    - [79, 27.814]
  - - [17232, 48, 1, 48]
    - [186, 9.467]
  - - [18944, 58, 1, 66]
    - [63, 13.907]
  - - [35664, 48, 1, 48]
    - [119, 12.181]
  - - [40320, 48, 1, 48]
    - [61, 13.042]
  - - [44032, 58, 1, 66]
    - [61, 16.993]
  - - [20992, 66, 1, 66]
    - [117, 13.969]
  - - [35072, 124, 1, 132]
    - [69, 31.86]
  - - [3936, 96, 1, 96]
    - [78, 12.292]
  - - [1500, 30, 1, 36]
    - [187, 0.82]
  - - [34976, 32, 1, 32]
    - [188, 8.152]
  - - [41882, 30, 1, 36]
    - [161, 7.84]
  - - [32672, 32, 1, 32]
    - [188, 7.977]
  - - [11568, 48, 1, 48]
    - [70, 8.58]
  - - [19584, 192, 1, 192]
    - [24, 42.979]
  - - [17978, 58, 1, 66]
    - [189, 13.142]
  - - [12672, 192, 1, 192]
    - [9, 41.854]
  - - [26272, 32, 1, 32]
    - [111, 8.304]
  - - [23384, 30, 1, 36]
    - [93, 8.015]
  - - [36096, 66, 1, 66]
    - [89, 14.824]
  - - [22464, 64, 1, 64]
    - [190, 17.497]
  - - [14112, 96, 1, 96]
    - [101, 19.343]
  - - [19968, 192, 1, 192]
    - [12, 43.364]
  - - [17408, 58, 1, 66]
    - [65, 13.288]
  - - [19646, 66, 1, 66]
    - [178, 11.478]
  - - [42496, 58, 1, 66]
    - [61, 16.549]
  - - [6912, 30, 1, 36]
    - [98, 3.331]
  - - [1792, 58, 1, 66]
    - [191, 2.973]
  - - [35744, 32, 1, 32]
    - [192, 8.046]
  - - [36828, 30, 1, 36]
    - [77, 7.563]
  - - [10512, 48, 1, 48]
    - [193, 8.461]
  - - [25278, 66, 1, 66]
    - [125, 13.708]
  - - [5376, 48, 1, 48]
    - [137, 5.419]
  - - [17568, 32, 1, 32]
    - [92, 7.175]
  - - [15872, 124, 1, 132]
    - [81, 26.791]
  - - [30010, 58, 1, 66]
    - [119, 14.542]
  - - [20064, 96, 1, 96]
    - [123, 22.831]
  - - [41136, 48, 1, 48]
    - [154, 12.38]
  - - [6458, 58, 1, 66]
    - [77, 8.44]
  - - [11936, 32, 1, 32]
    - [106, 5.246]
  - - [39834, 30, 1, 36]
    - [116, 7.633]
  - - [37888, 124, 1, 132]
    - [117, 31.508]
  - - [512, 128, 1, 128]
    - [194, 3.437]
  - - [23616, 64, 1, 64]
    - [162, 17.866]
  - - [15600, 48, 1, 48]
    - [113, 8.803]
  - - [17664, 128, 1, 128]
    - [42, 30.402]
  - - [27680, 32, 1, 32]
    - [195, 8.46]
  - - [30912, 64, 1, 64]
    - [109, 17.776]
  - - [10080, 96, 1, 96]
    - [63, 18.442]
  - - [36512, 32, 1, 32]
    - [101, 8.341]
  - - [41312, 32, 1, 32]
    - [99, 9.035]
  - - [28128, 96, 1, 96]
    - [95, 24.338]
  - - [41184, 32, 1, 32]
    - [89, 8.84]
  - - [13120, 64, 1, 64]
    - [196, 14.949]
  - - [3548, 30, 1, 36]
    - [167, 1.744]
  - - [31072, 32, 1, 32]
    - [101, 7.835]
  - - [11232, 96, 1, 96]
    - [59, 18.439]
  - - [20824, 30, 1, 36]
    - [88, 7.398]
  - - [26112, 192, 1, 192]
    - [22, 45.0]
  - - [43264, 30, 1, 36]
    - [145, 8.423]
  - - [768, 124, 1, 132]
    - [66, 4.644]
  - - [5632, 124, 1, 132]
    - [83, 19.323]
  - - [12544, 128, 1, 128]
    - [75, 30.873]
  - - [38944, 32, 1, 32]
    - [182, 8.517]
  - - [32400, 48, 1, 48]
    - [119, 11.763]
  - - [40192, 58, 1, 66]
    - [117, 18.009]
  - - [19008, 64, 1, 64]
    - [197, 16.788]
  - - [4320, 96, 1, 96]
    - [116, 13.291]
  - - [27992, 30, 1, 36]
    - [193, 8.257]
  - - [35328, 128, 1, 128]
    - [7, 32.729]
  - - [4286, 66, 1, 66]
    - [77, 6.785]
  - - [41408, 64, 1, 64]
    - [178, 19.751]
  - - [38364, 30, 1, 36]
    - [128, 7.652]
  - - [4272, 48, 1, 48]
    - [112, 4.349]
  - - [13466, 30, 1, 36]
    - [88, 5.508]
  - - [6528, 96, 1, 96]
    - [89, 16.532]
  - - [38144, 58, 1, 66]
    - [117, 17.408]
  - - [16992, 96, 1, 96]
    - [198, 20.696]
  - - [21760, 124, 1, 132]
    - [199, 29.29]
  - - [2048, 128, 1, 128]
    - [200, 11.544]
  - - [42394, 30, 1, 36]
    - [77, 7.816]
  - - [29754, 58, 1, 66]
    - [119, 14.258]
  - - [18912, 32, 1, 32]
    - [93, 7.154]
  - - [14048, 32, 1, 32]
    - [89, 5.947]
  - - [18576, 48, 1, 48]
    - [201, 9.693]
  - - [15840, 32, 1, 32]
    - [93, 6.469]
  - - [30000, 48, 1, 48]
    - [135, 11.327]
  - - [43930, 30, 1, 36]
    - [77, 7.775]
  - - [29632, 64, 1, 64]
    - [72, 17.644]
  - - [7424, 66, 1, 66]
    - [99, 9.588]
  - - [768, 66, 1, 66]
    - [136, 1.523]
  - - [16640, 124, 1, 132]
    - [202, 28.023]
  - - [6944, 32, 1, 32]
    - [165, 3.446]
  - - [34560, 128, 1, 128]
    - [3, 32.548]
  - - [33880, 30, 1, 36]
    - [116, 7.462]
  - - [28826, 30, 1, 36]
    - [93, 6.98]
  - - [24510, 66, 1, 66]
    - [149, 13.554]
  - - [25688, 30, 1, 36]
    - [88, 8.226]
  - - [17520, 48, 1, 48]
    - [203, 9.524]
  - - [1152, 192, 1, 192]
    - [68, 13.477]
  - - [10080, 32, 1, 32]
    - [106, 4.699]
  - - [512, 58, 1, 66]
    - [86, 0.95]
  - - [4384, 32, 1, 32]
    - [106, 2.248]
  - - [39424, 124, 1, 132]
    - [69, 31.782]
  - - [6752, 32, 1, 32]
    - [204, 3.424]
  - - [1536, 66, 1, 66]
    - [139, 2.927]
  - - [4032, 64, 1, 64]
    - [68, 7.157]
  - - [6744, 30, 1, 36]
    - [112, 3.218]
  - - [7424, 124, 1, 132]
    - [63, 20.282]
  - - [15616, 66, 1, 66]
    - [70, 11.975]
  - - [40704, 124, 1, 132]
    - [117, 32.495]
  - - [37274, 30, 1, 36]
    - [116, 7.435]
  - - [27582, 66, 1, 66]
    - [153, 14.286]
  - - [34080, 96, 1, 96]
    - [109, 23.95]
  - - [21072, 48, 1, 48]
    - [148, 10.673]
  - - [8448, 128, 1, 128]
    - [75, 24.366]
  - - [3328, 124, 1, 132]
    - [116, 15.737]
  - - [16960, 64, 1, 64]
    - [205, 15.576]
  - - [24416, 32, 1, 32]
    - [88, 8.224]
  - - [23808, 30, 1, 36]
    - [92, 7.937]
  - - [26208, 96, 1, 96]
    - [206, 23.258]
  - - [37340, 30, 1, 36]
    - [161, 7.573]
  - - [12512, 32, 1, 32]
    - [106, 5.833]
  - - [220, 30, 1, 36]
    - [60, 0.125]
  - - [37680, 48, 1, 48]
    - [90, 12.5]
  - - [36384, 96, 1, 96]
    - [207, 23.428]
  - - [23896, 30, 1, 36]
    - [88, 8.021]
  - - [33408, 48, 1, 48]
    - [135, 11.448]
  - - [19544, 30, 1, 36]
    - [88, 6.994]
  - - [12336, 48, 1, 48]
    - [99, 9.02]
  - - [20672, 64, 1, 64]
    - [184, 17.504]
  - - [18912, 96, 1, 96]
    - [69, 22.378]
  - - [34464, 32, 1, 32]
    - [101, 7.992]
  - - [43776, 48, 1, 48]
    - [104, 12.419]
  - - [21888, 96, 1, 96]
    - [95, 25.753]
  - - [20736, 192, 1, 192]
    - [29, 43.996]
  - - [30688, 32, 1, 32]
    - [177, 7.573]
  - - [2560, 30, 1, 36]
    - [204, 1.354]
  - - [39900, 30, 1, 36]
    - [161, 7.862]
  - - [39000, 30, 1, 36]
    - [77, 8.009]
  - - [23568, 48, 1, 48]
    - [155, 10.78]
  - - [22656, 192, 1, 192]
    - [22, 40.867]
  - - [26112, 48, 1, 48]
    - [89, 11.636]
  - - [31344, 48, 1, 48]
    - [90, 11.749]
  - - [28474, 58, 1, 66]
    - [119, 14.115]
  - - [24064, 124, 1, 132]
    - [208, 31.585]
  - - [38112, 96, 1, 96]
    - [109, 23.875]
  - - [8960, 30, 1, 36]
    - [136, 4.153]
  - - [16604, 30, 1, 36]
    - [91, 6.57]
  - - [1082, 58, 1, 66]
    - [194, 1.848]
  - - [36416, 64, 1, 64]
    - [72, 18.316]
  - - [7584, 32, 1, 32]
    - [136, 3.535]
  - - [24096, 32, 1, 32]
    - [156, 7.943]
  - - [28800, 96, 1, 96]
    - [184, 22.915]
  - - [15104, 30, 1, 36]
    - [93, 5.881]
  - - [29440, 58, 1, 66]
    - [65, 14.552]
  - - [4608, 96, 1, 96]
    - [78, 15.07]
  - - [13024, 32, 1, 32]
    - [200, 5.893]
  - - [12288, 58, 1, 66]
    - [209, 12.113]
  - - [38656, 124, 1, 132]
    - [178, 31.718]
  - - [4080, 48, 1, 48]
    - [112, 4.195]
  - - [18944, 30, 1, 36]
    - [91, 7.092]
  - - [17664, 96, 1, 96]
    - [141, 21.965]
  - - [7520, 32, 1, 32]
    - [204, 3.653]
  - - [41472, 48, 1, 48]
    - [210, 12.893]
  - - [27872, 32, 1, 32]
    - [179, 8.575]
  - - [13888, 64, 1, 64]
    - [211, 15.537]
  - - [41406, 66, 1, 66]
    - [153, 13.547]
  - - [20768, 32, 1, 32]
    - [89, 7.487]
  - - [4560, 48, 1, 48]
    - [107, 4.832]
  - - [16512, 192, 1, 192]
    - [24, 37.475]
  - - [16656, 48, 1, 48]
    - [148, 9.882]
  - - [33690, 30, 1, 36]
    - [77, 7.386]
  - - [15616, 58, 1, 66]
    - [65, 12.358]
  - - [33792, 96, 1, 96]
    - [95, 25.472]
  - - [40160, 32, 1, 32]
    - [70, 8.66]
  - - [22784, 124, 1, 132]
    - [212, 30.173]
  - - [10592, 32, 1, 32]
    - [106, 4.988]
  - - [38912, 58, 1, 66]
    - [81, 17.712]
  - - [12376, 30, 1, 36]
    - [115, 5.33]
  - - [10174, 66, 1, 66]
    - [65, 9.648]
  - - [1968, 48, 1, 48]
    - [85, 2.27]
  - - [7296, 192, 1, 192]
    - [12, 26.698]
  - - [7066, 30, 1, 36]
    - [112, 3.372]
  - - [37632, 128, 1, 128]
    - [14, 34.177]
  - - [18908, 30, 1, 36]
    - [91, 7.025]
  - - [34816, 128, 1, 128]
    - [32, 32.335]
  - - [7360, 64, 1, 64]
    - [70, 10.957]
  - - [29952, 124, 1, 132]
    - [138, 29.498]
  - - [2816, 128, 1, 128]
    - [68, 15.177]
  - - [34268, 30, 1, 36]
    - [91, 7.616]
  - - [22872, 30, 1, 36]
    - [88, 7.785]
  - - [22240, 32, 1, 32]
    - [111, 7.834]
  - - [35584, 124, 1, 132]
    - [61, 30.808]
  - - [912, 48, 1, 48]
    - [85, 1.127]
  - - [27392, 66, 1, 66]
    - [69, 14.652]
  - - [15552, 64, 1, 64]
    - [190, 14.798]
  - - [24032, 32, 1, 32]
    - [92, 8.215]
  - - [23472, 48, 1, 48]
    - [213, 10.415]
  - - [16416, 96, 1, 96]
    - [117, 20.172]
  - - [16192, 64, 1, 64]
    - [162, 15.172]
  - - [7168, 66, 1, 66]
    - [99, 9.258]
  - - [43104, 32, 1, 32]
    - [89, 9.209]
  - - [10784, 32, 1, 32]
    - [92, 4.976]
  - - [42752, 128, 1, 128]
    - [14, 31.161]
  - - [10430, 66, 1, 66]
    - [63, 9.704]
  - - [32928, 32, 1, 32]
    - [101, 7.793]
  - - [38208, 64, 1, 64]
    - [69, 18.708]
  - - [17504, 32, 1, 32]
    - [93, 7.024]
  - - [12602, 58, 1, 66]
    - [102, 11.752]
  - - [25402, 58, 1, 66]
    - [90, 15.163]
  - - [35264, 64, 1, 64]
    - [123, 18.032]
  - - [3994, 30, 1, 36]
    - [60, 1.869]
  - - [14208, 96, 1, 96]
    - [101, 19.54]
  - - [6000, 48, 1, 48]
    - [68, 5.768]
  - - [32256, 58, 1, 66]
    - [61, 15.587]
  - - [1280, 58, 1, 66]
    - [214, 2.186]
  - - [13344, 96, 1, 96]
    - [59, 20.527]
  - - [21336, 30, 1, 36]
    - [92, 7.471]
  - - [34714, 30, 1, 36]
    - [116, 7.543]
  - - [8536, 30, 1, 36]
    - [167, 3.883]
  - - [13056, 96, 1, 96]
    - [59, 20.776]
  - - [33248, 32, 1, 32]
    - [181, 8.033]
  - - [20480, 124, 1, 132]
    - [202, 31.472]
  - - [14688, 32, 1, 32]
    - [93, 6.106]
  - - [33632, 32, 1, 32]
    - [89, 7.878]
  - - [6480, 48, 1, 48]
    - [92, 6.062]
  - - [28800, 192, 1, 192]
    - [24, 40.105]
  - - [26656, 32, 1, 32]
    - [215, 8.368]
  - - [1504, 32, 1, 32]
    - [165, 0.951]
  - - [28752, 48, 1, 48]
    - [119, 11.265]
  - - [5472, 32, 1, 32]
    - [216, 2.658]
  - - [32000, 30, 1, 36]
    - [106, 7.452]
  - - [27904, 58, 1, 66]
    - [63, 16.046]
  - - [31680, 64, 1, 64]
    - [132, 17.938]
  - - [18688, 124, 1, 132]
    - [69, 30.164]
  - - [4064, 32, 1, 32]
    - [115, 2.017]
  - - [9180, 30, 1, 36]
    - [136, 4.025]
  - - [23872, 64, 1, 64]
    - [121, 17.768]
  - - [36768, 96, 1, 96]
    - [122, 23.639]
  - - [10752, 96, 1, 96]
    - [59, 18.377]
  - - [18366, 66, 1, 66]
    - [89, 11.482]
  - - [30672, 48, 1, 48]
    - [119, 11.752]
  - - [19248, 48, 1, 48]
    - [155, 10.043]
  - - [9888, 32, 1, 32]
    - [144, 4.803]
  - - [33280, 124, 1, 132]
    - [117, 31.635]
  - - [30944, 32, 1, 32]
    - [217, 7.636]
  - - [32864, 32, 1, 32]
    - [89, 7.94]
  - - [29856, 96, 1, 96]
    - [132, 23.177]
  - - [3072, 192, 1, 192]
    - [65, 23.093]
  - - [1024, 58, 1, 66]
    - [218, 1.766]
  - - [12544, 30, 1, 36]
    - [113, 5.309]
  - - [37248, 192, 1, 192]
    - [24, 43.887]
  - - [19360, 32, 1, 32]
    - [91, 7.09]
  - - [18192, 48, 1, 48]
    - [203, 9.588]
  - - [10496, 128, 1, 128]
    - [198, 27.877]
  - - [20992, 58, 1, 66]
    - [197, 14.842]
  - - [21744, 48, 1, 48]
    - [219, 10.17]
  - - [13536, 96, 1, 96]
    - [75, 21.295]
  - - [39424, 66, 1, 66]
    - [101, 14.999]
  - - [17664, 48, 1, 48]
    - [220, 9.704]
  - - [25248, 96, 1, 96]
    - [81, 23.832]
  - - [1850, 58, 1, 66]
    - [112, 2.928]
  - - [8736, 96, 1, 96]
    - [70, 17.277]
  - - [38656, 128, 1, 128]
    - [32, 34.513]
  - - [23296, 30, 1, 36]
    - [91, 7.713]
  - - [29504, 64, 1, 64]
    - [221, 17.344]
  - - [4848, 48, 1, 48]
    - [167, 4.935]
  - - [11296, 32, 1, 32]
    - [200, 5.061]
  - - [12000, 32, 1, 32]
    - [200, 5.429]
  - - [20128, 32, 1, 32]
    - [222, 7.2]
  - - [27136, 124, 1, 132]
    - [110, 34.042]
  - - [4352, 30, 1, 36]
    - [139, 2.118]
  - - [28094, 66, 1, 66]
    - [97, 14.362]
  - - [42208, 32, 1, 32]
    - [99, 8.935]
  - - [35416, 30, 1, 36]
    - [92, 7.593]
  - - [1152, 96, 1, 96]
    - [71, 4.6]
  - - [3804, 30, 1, 36]
    - [85, 1.833]
  - - [27706, 58, 1, 66]
    - [219, 15.569]
  - - [24064, 30, 1, 36]
    - [88, 7.808]
  - - [28960, 32, 1, 32]
    - [176, 7.637]
  - - [24664, 30, 1, 36]
    - [91, 8.111]
  - - [3072, 124, 1, 132]
    - [128, 15.311]
  - - [30176, 32, 1, 32]
    - [91, 7.651]
  - - [34704, 48, 1, 48]
    - [119, 11.971]
  - - [42496, 124, 1, 132]
    - [178, 30.823]
  - - [7392, 96, 1, 96]
    - [99, 16.244]
  - - [23808, 58, 1, 66]
    - [81, 14.935]
  - - [43616, 32, 1, 32]
    - [70, 9.191]
  - - [2624, 64, 1, 64]
    - [71, 4.749]
  - - [4192, 32, 1, 32]
    - [140, 2.058]
  - - [39168, 66, 1, 66]
    - [89, 14.901]
  - - [24766, 66, 1, 66]
    - [125, 13.542]
  - - [26588, 30, 1, 36]
    - [93, 7.843]
  - - [14014, 66, 1, 66]
    - [59, 11.415]
  - - [3036, 30, 1, 36]
    - [112, 1.478]
  - - [5808, 48, 1, 48]
    - [112, 5.482]
  - - [666, 30, 1, 36]
    - [60, 0.368]
  - - [11072, 64, 1, 64]
    - [101, 13.998]
  - - [17824, 32, 1, 32]
    - [93, 7.215]
  - - [7296, 48, 1, 48]
    - [113, 6.645]
  - - [37120, 30, 1, 36]
    - [99, 7.855]
  - - [5280, 32, 1, 32]
    - [166, 2.565]
  - - [13440, 96, 1, 96]
    - [59, 21.469]
  - - [40416, 96, 1, 96]
    - [84, 24.257]
  - - [11008, 124, 1, 132]
    - [59, 26.193]
  - - [20112, 48, 1, 48]
    - [102, 10.441]
  - - [23744, 64, 1, 64]
    - [205, 17.744]
  - - [13824, 48, 1, 48]
    - [101, 9.32]
  - - [32304, 48, 1, 48]
    - [124, 11.647]
  - - [39256, 30, 1, 36]
    - [91, 7.895]
  - - [1880, 30, 1, 36]
    - [170, 1.028]
  - - [27546, 30, 1, 36]
    - [177, 7.75]
  - - [13248, 64, 1, 64]
    - [223, 15.003]
  - - [4864, 66, 1, 66]
    - [108, 7.518]
  - - [4096, 66, 1, 66]
    - [115, 6.591]
  - - [37280, 32, 1, 32]
    - [183, 8.392]
  - - [4672, 64, 1, 64]
    - [71, 8.373]
  - - [9120, 96, 1, 96]
    - [224, 17.375]
  - - [18176, 128, 1, 128]
    - [34, 28.676]
  - - [32768, 58, 1, 66]
    - [61, 15.53]
  - - [41626, 30, 1, 36]
    - [88, 7.822]
  - - [18622, 66, 1, 66]
    - [99, 11.46]
  - - [26880, 66, 1, 66]
    - [69, 14.658]
  - - [19296, 32, 1, 32]
    - [88, 7.124]
  - - [13632, 64, 1, 64]
    - [225, 15.159]
  - - [16794, 30, 1, 36]
    - [88, 6.487]
  - - [26682, 58, 1, 66]
    - [119, 15.498]
  - - [18720, 96, 1, 96]
    - [69, 22.214]
  - - [6768, 48, 1, 48]
    - [168, 6.331]
  - - [25248, 32, 1, 32]
    - [88, 8.205]
  - - [8192, 58, 1, 66]
    - [88, 10.094]
  - - [11808, 32, 1, 32]
    - [88, 5.239]
  - - [5984, 32, 1, 32]
    - [136, 2.969]
  - - [23040, 124, 1, 132]
    - [226, 30.622]
  - - [29664, 96, 1, 96]
    - [109, 22.815]
  - - [11040, 32, 1, 32]
    - [200, 4.899]
  - - [40382, 66, 1, 66]
    - [97, 13.256]
  - - [36192, 32, 1, 32]
    - [89, 8.268]
  - - [4184, 30, 1, 36]
    - [137, 1.958]
  - - [24928, 32, 1, 32]
    - [88, 8.276]
  - - [11712, 64, 1, 64]
    - [89, 14.707]
  - - [33408, 192, 1, 192]
    - [24, 46.757]
  - - [32928, 96, 1, 96]
    - [72, 23.458]
  - - [36832, 32, 1, 32]
    - [101, 8.332]
  - - [28672, 124, 1, 132]
    - [227, 28.619]
  - - [32154, 30, 1, 36]
    - [93, 7.347]
  - - [9918, 66, 1, 66]
    - [134, 9.687]
  - - [36952, 30, 1, 36]
    - [88, 7.719]
  - - [16464, 48, 1, 48]
    - [102, 9.393]
  - - [34848, 32, 1, 32]
    - [101, 8.041]
  - - [42176, 64, 1, 64]
    - [69, 19.66]
  - - [32256, 48, 1, 48]
    - [70, 11.315]
  - - [3584, 124, 1, 132]
    - [161, 15.461]
  - - [7104, 64, 1, 64]
    - [89, 10.748]
  - - [18878, 66, 1, 66]
    - [81, 11.403]
  - - [17184, 96, 1, 96]
    - [81, 21.053]
  - - [26880, 124, 1, 132]
    - [110, 33.778]
  - - [3840, 48, 1, 48]
    - [228, 3.987]
  - - [7900, 30, 1, 36]
    - [67, 3.628]
  - - [25440, 32, 1, 32]
    - [93, 8.153]
  - - [35936, 32, 1, 32]
    - [89, 8.09]
  - - [27840, 64, 1, 64]
    - [104, 18.486]
  - - [37312, 64, 1, 64]
    - [69, 18.767]
  - - [18586, 30, 1, 36]
    - [93, 6.701]
  - - [37952, 64, 1, 64]
    - [117, 18.582]
  - - [7728, 48, 1, 48]
    - [67, 6.918]
  - - [3840, 192, 1, 192]
    - [65, 27.858]
  - - [41472, 124, 1, 132]
    - [229, 32.303]
  - - [7968, 96, 1, 96]
    - [70, 17.058]
  - - [17664, 124, 1, 132]
    - [61, 29.214]
  - - [16128, 192, 1, 192]
    - [37, 37.162]
  - - [6144, 30, 1, 36]
    - [167, 2.932]
  - - [20688, 48, 1, 48]
    - [148, 10.53]
  - - [20224, 30, 1, 36]
    - [93, 7.133]
  - - [1536, 96, 1, 96]
    - [71, 5.853]
  - - [36480, 96, 1, 96]
    - [79, 26.488]
  - - [28416, 192, 1, 192]
    - [20, 40.143]
  - - [18960, 48, 1, 48]
    - [155, 9.843]
  - - [15216, 48, 1, 48]
    - [116, 8.586]
  - - [41232, 48, 1, 48]
    - [135, 12.666]
  - - [33056, 32, 1, 32]
    - [70, 7.744]
  - - [2048, 30, 1, 36]
    - [126, 1.095]
  - - [14848, 66, 1, 66]
    - [89, 12.195]
  - - [4666, 58, 1, 66]
    - [115, 6.653]
  - - [12544, 124, 1, 132]
    - [59, 28.647]
  - - [5024, 32, 1, 32]
    - [200, 2.467]
  - - [32256, 124, 1, 132]
    - [69, 30.583]
  - - [29082, 30, 1, 36]
    - [92, 7.077]
  - - [22170, 30, 1, 36]
    - [93, 7.193]
  - - [20414, 66, 1, 66]
    - [97, 11.683]
  - - [14592, 58, 1, 66]
    - [77, 11.654]
  - - [28314, 30, 1, 36]
    - [115, 6.96]
  - - [11760, 48, 1, 48]
    - [70, 8.722]
  - - [42240, 128, 1, 128]
    - [7, 36.056]
  - - [34656, 96, 1, 96]
    - [198, 24.11]
  - - [14816, 32, 1, 32]
    - [88, 5.997]
  - - [10464, 96, 1, 96]
    - [197, 18.415]
  - - [39744, 64, 1, 64]
    - [69, 19.006]
  - - [16640, 58, 1, 66]
    - [94, 12.591]
  - - [11136, 96, 1, 96]
    - [59, 18.574]
  - - [35840, 58, 1, 66]
    - [61, 16.576]
  - - [11424, 32, 1, 32]
    - [115, 5.168]
  - - [37440, 64, 1, 64]
    - [69, 18.729]
  - - [41304, 30, 1, 36]
    - [91, 8.041]
  - - [21408, 32, 1, 32]
    - [230, 7.542]
  - - [12032, 124, 1, 132]
    - [59, 27.478]
  - - [4352, 128, 1, 128]
    - [99, 18.575]
  - - [23098, 58, 1, 66]
    - [119, 14.704]
  - - [43710, 66, 1, 66]
    - [125, 12.788]
  - - [31248, 48, 1, 48]
    - [90, 11.841]
  - - [22560, 96, 1, 96]
    - [63, 21.892]
  - - [17306, 30, 1, 36]
    - [88, 6.58]
  - - [23552, 128, 1, 128]
    - [7, 33.767]
  - - [6400, 124, 1, 132]
    - [83, 21.076]
  - - [1888, 32, 1, 32]
    - [144, 1.146]
  - - [40704, 128, 1, 128]
    - [30, 35.441]
  - - [22528, 58, 1, 66]
    - [63, 14.501]
  - - [44000, 32, 1, 32]
    - [89, 9.065]
  - - [6304, 32, 1, 32]
    - [165, 3.232]
  - - [21216, 96, 1, 96]
    - [63, 21.336]
  - - [9560, 30, 1, 36]
    - [204, 4.269]
  - - [1470, 66, 1, 66]
    - [98, 2.722]
  - - [25344, 192, 1, 192]
    - [33, 44.744]
  - - [21936, 48, 1, 48]
    - [175, 10.214]
  - - [14526, 66, 1, 66]
    - [99, 10.522]
  - - [38458, 58, 1, 66]
    - [135, 16.301]
  - - [192, 64, 1, 64]
    - [140, 0.46]
  - - [12698, 30, 1, 36]
    - [106, 5.282]
  - - [9984, 96, 1, 96]
    - [83, 18.594]
  - - [30368, 32, 1, 32]
    - [100, 7.873]
  - - [23194, 30, 1, 36]
    - [88, 7.577]
  - - [17280, 192, 1, 192]
    - [29, 39.651]
  - - [35130, 58, 1, 66]
    - [119, 15.948]
  - - [21080, 30, 1, 36]
    - [77, 7.489]
  - - [10368, 192, 1, 192]
    - [12, 37.042]
  - - [21562, 58, 1, 66]
    - [90, 14.362]
  - - [27612, 30, 1, 36]
    - [116, 7.906]
  - - [14656, 64, 1, 64]
    - [162, 14.164]
  - - [29696, 66, 1, 66]
    - [101, 14.323]
  - - [34560, 48, 1, 48]
    - [90, 11.804]
  - - [18396, 30, 1, 36]
    - [93, 6.888]
  - - [39840, 32, 1, 32]
    - [89, 8.591]
  - - [19200, 124, 1, 132]
    - [61, 30.99]
  - - [20880, 48, 1, 48]
    - [231, 10.628]
  - - [39424, 128, 1, 128]
    - [14, 34.903]
  - - [34992, 48, 1, 48]
    - [90, 12.111]
  - - [17056, 32, 1, 32]
    - [91, 6.965]
  - - [4608, 66, 1, 66]
    - [108, 7.354]
  - - [17248, 32, 1, 32]
    - [88, 7.044]
  - - [14368, 32, 1, 32]
    - [92, 5.973]
  - - [24634, 58, 1, 66]
    - [154, 15.177]
  - - [29568, 96, 1, 96]
    - [105, 23.04]
  - - [17376, 96, 1, 96]
    - [232, 20.858]
  - - [16544, 32, 1, 32]
    - [93, 6.878]
  - - [12858, 58, 1, 66]
    - [169, 11.613]
  - - [16318, 66, 1, 66]
    - [89, 10.933]
  - - [11418, 30, 1, 36]
    - [200, 5.052]
  - - [43072, 64, 1, 64]
    - [132, 18.752]
  - - [19824, 48, 1, 48]
    - [231, 10.241]
  - - [38144, 128, 1, 128]
    - [7, 34.388]
  - - [31776, 32, 1, 32]
    - [101, 7.8]
  - - [2240, 64, 1, 64]
    - [233, 4.352]
  - - [8960, 58, 1, 66]
    - [92, 10.587]
  - - [9504, 96, 1, 96]
    - [63, 17.543]
  - - [40608, 32, 1, 32]
    - [89, 8.757]
  - - [18330, 30, 1, 36]
    - [88, 6.708]
  - - [8448, 48, 1, 48]
    - [234, 7.562]
  - - [12120, 30, 1, 36]
    - [92, 5.175]
  - - [39512, 30, 1, 36]
    - [128, 7.914]
  - - [8352, 96, 1, 96]
    - [99, 17.344]
  - - [11968, 64, 1, 64]
    - [99, 14.728]
  - - [42336, 96, 1, 96]
    - [235, 24.153]
  - - [35584, 128, 1, 128]
    - [34, 33.008]
  - - [4096, 124, 1, 132]
    - [70, 16.332]
  - - [43392, 192, 1, 192]
    - [9, 44.28]
  - - [21408, 96, 1, 96]
    - [236, 21.12]
  - - [8668, 30, 1, 36]
    - [112, 3.98]
  - - [8016, 48, 1, 48]
    - [67, 7.237]
  - - [33024, 128, 1, 128]
    - [32, 31.102]
  - - [10272, 32, 1, 32]
    - [200, 4.788]
  - - [39614, 66, 1, 66]
    - [149, 13.203]
  - - [27984, 48, 1, 48]
    - [219, 11.669]
  - - [15296, 64, 1, 64]
    - [65, 14.629]
  - - [7680, 48, 1, 48]
    - [168, 7.057]
  - - [4572, 30, 1, 36]
    - [112, 2.271]
  - - [7488, 64, 1, 64]
    - [89, 11.33]
  - - [37344, 96, 1, 96]
    - [221, 23.972]
  - - [32032, 32, 1, 32]
    - [77, 7.863]
  - - [12736, 64, 1, 64]
    - [225, 14.786]
  - - [12576, 96, 1, 96]
    - [75, 20.403]
  - - [13152, 32, 1, 32]
    - [115, 5.893]
  - - [33824, 32, 1, 32]
    - [116, 7.883]
  - - [10752, 48, 1, 48]
    - [161, 8.394]
  - - [12288, 128, 1, 128]
    - [59, 30.651]
  - - [4896, 32, 1, 32]
    - [200, 2.567]
  - - [35168, 32, 1, 32]
    - [101, 8.074]
  - - [38464, 64, 1, 64]
    - [61, 18.783]
  - - [23040, 192, 1, 192]
    - [24, 41.07]
  - - [544, 32, 1, 32]
    - [173, 0.354]
  - - [33552, 48, 1, 48]
    - [135, 11.972]
  - - [5888, 30, 1, 36]
    - [139, 2.866]
  - - [43322, 58, 1, 66]
    - [119, 15.315]
  - - [28864, 64, 1, 64]
    - [198, 17.412]
  - - [2336, 32, 1, 32]
    - [126, 1.365]
  - - [19098, 30, 1, 36]
    - [93, 6.785]
  - - [1296, 48, 1, 48]
    - [60, 1.463]
  - - [13856, 32, 1, 32]
    - [68, 5.813]
  - - [4608, 58, 1, 66]
    - [200, 6.737]
  - - [29536, 32, 1, 32]
    - [89, 7.531]
  - - [36336, 48, 1, 48]
    - [119, 12.452]
  - - [40544, 32, 1, 32]
    - [70, 8.784]
  - - [9472, 30, 1, 36]
    - [204, 4.308]
  - - [23040, 66, 1, 66]
    - [61, 13.748]
  - - [39936, 96, 1, 96]
    - [207, 27.876]
  - - [7008, 32, 1, 32]
    - [136, 3.369]
  - - [5434, 58, 1, 66]
    - [93, 7.621]
  - - [20736, 124, 1, 132]
    - [237, 31.603]
  - - [6816, 32, 1, 32]
    - [204, 3.243]
  - - [35840, 30, 1, 36]
    - [129, 7.822]
  - - [20992, 128, 1, 128]
    - [34, 32.157]
  - - [28672, 30, 1, 36]
    - [129, 7.423]
  - - [25944, 30, 1, 36]
    - [93, 8.094]
  - - [34304, 30, 1, 36]
    - [118, 7.659]
  - - [33280, 128, 1, 128]
    - [7, 31.789]
  - - [39322, 30, 1, 36]
    - [77, 7.625]
  - - [6432, 96, 1, 96]
    - [116, 15.622]
  - - [38976, 64, 1, 64]
    - [238, 18.591]
  - - [18672, 48, 1, 48]
    - [203, 9.892]
  - - [11680, 32, 1, 32]
    - [115, 5.337]
  - - [5088, 32, 1, 32]
    - [144, 2.638]
  - - [26464, 32, 1, 32]
    - [111, 8.308]
  - - [43248, 48, 1, 48]
    - [90, 11.786]
  - - [40960, 128, 1, 128]
    - [14, 34.603]
  - - [31520, 32, 1, 32]
    - [183, 7.656]
  - - [36250, 30, 1, 36]
    - [77, 7.605]
  - - [40352, 32, 1, 32]
    - [70, 8.621]
  - - [19032, 30, 1, 36]
    - [92, 7.352]
  - - [3904, 64, 1, 64]
    - [106, 6.929]
  - - [2012, 30, 1, 36]
    - [170, 1.076]
  - - [43056, 48, 1, 48]
    - [119, 11.858]
  - - [39680, 128, 1, 128]
    - [7, 35.256]
  - - [16480, 32, 1, 32]
    - [91, 6.977]
  - - [37920, 96, 1, 96]
    - [72, 24.192]
  - - [18432, 58, 1, 66]
    - [63, 13.825]
  - - [8280, 30, 1, 36]
    - [239, 3.766]
  - - [512, 124, 1, 132]
    - [157, 3.228]
  - - [39168, 30, 1, 36]
    - [145, 8.078]
  - - [25344, 66, 1, 66]
    - [69, 14.256]
  - - [13792, 32, 1, 32]
    - [68, 6.12]
  - - [24720, 48, 1, 48]
    - [219, 10.83]
  - - [26208, 32, 1, 32]
    - [222, 8.341]
  - - [43968, 64, 1, 64]
    - [132, 18.831]
  - - [43424, 32, 1, 32]
    - [101, 9.067]
  - - [38256, 48, 1, 48]
    - [119, 12.413]
  - - [5728, 32, 1, 32]
    - [165, 2.937]
  - - [11454, 66, 1, 66]
    - [101, 9.776]
  - - [30654, 66, 1, 66]
    - [99, 12.083]
  - - [40024, 30, 1, 36]
    - [93, 8.151]
  - - [19632, 48, 1, 48]
    - [209, 10.243]
  - - [13882, 58, 1, 66]
    - [155, 12.473]
  - - [8346, 30, 1, 36]
    - [166, 3.832]
  - - [11328, 64, 1, 64]
    - [70, 14.521]
  - - [28928, 66, 1, 66]
    - [70, 14.056]
  - - [26624, 128, 1, 128]
    - [7, 35.807]
  - - [33568, 32, 1, 32]
    - [188, 8.068]
  - - [1984, 64, 1, 64]
    - [165, 3.938]
  - - [26848, 32, 1, 32]
    - [179, 8.787]
  - - [36672, 64, 1, 64]
    - [81, 18.546]
  - - [18432, 128, 1, 128]
    - [43, 30.791]
  - - [19200, 128, 1, 128]
    - [44, 31.574]
  - - [29216, 32, 1, 32]
    - [106, 7.617]
  - - [768, 96, 1, 96]
    - [240, 3.222]
  - - [14680, 30, 1, 36]
    - [92, 6.004]
  - - [30106, 30, 1, 36]
    - [161, 7.045]
  - - [6144, 66, 1, 66]
    - [116, 8.934]
  - - [30464, 58, 1, 66]
    - [61, 14.973]
  - - [9360, 48, 1, 48]
    - [77, 8.236]
  - - [39168, 128, 1, 128]
    - [14, 34.718]
  - - [16954, 58, 1, 66]
    - [155, 12.885]
  - - [21182, 66, 1, 66]
    - [97, 12.018]
  - - [28464, 48, 1, 48]
    - [135, 11.281]
  - - [40768, 64, 1, 64]
    - [117, 19.1]
  - - [36060, 30, 1, 36]
    - [116, 7.5]
  - - [18944, 66, 1, 66]
    - [89, 13.187]
  - - [2304, 66, 1, 66]
    - [112, 4.149]
  - - [9472, 66, 1, 66]
    - [65, 9.89]
  - - [20896, 32, 1, 32]
    - [88, 7.418]
  - - [5920, 32, 1, 32]
    - [136, 3.035]
  - - [43834, 58, 1, 66]
    - [135, 15.185]
  - - [43632, 48, 1, 48]
    - [119, 11.954]
  - - [20352, 192, 1, 192]
    - [12, 43.571]
  - - [15456, 96, 1, 96]
    - [89, 20.123]
  - - [36816, 48, 1, 48]
    - [135, 12.213]
  - - [20592, 48, 1, 48]
    - [102, 10.532]
  - - [13568, 128, 1, 128]
    - [178, 31.703]
  - - [7680, 58, 1, 66]
    - [88, 9.531]
  - - [8992, 32, 1, 32]
    - [106, 4.323]
  - - [16032, 32, 1, 32]
    - [91, 6.665]
  - - [39520, 32, 1, 32]
    - [101, 8.483]
  - - [34304, 66, 1, 66]
    - [101, 14.833]
  - - [20158, 66, 1, 66]
    - [81, 11.955]
  - - [13912, 30, 1, 36]
    - [77, 5.596]
  - - [31264, 32, 1, 32]
    - [115, 7.674]
  - - [1214, 66, 1, 66]
    - [165, 2.248]
  - - [41530, 58, 1, 66]
    - [90, 16.897]
  - - [28160, 128, 1, 128]
    - [3, 36.35]
  - - [8480, 32, 1, 32]
    - [136, 4.254]
  - - [43104, 96, 1, 96]
    - [241, 24.16]
  - - [20568, 30, 1, 36]
    - [93, 7.527]
  - - [11856, 48, 1, 48]
    - [92, 8.856]
  - - [33024, 58, 1, 66]
    - [117, 15.825]
  - - [21248, 66, 1, 66]
    - [101, 13.242]
  - - [25792, 64, 1, 64]
    - [190, 18.744]
  - - [6096, 48, 1, 48]
    - [106, 6.205]
  - - [17280, 48, 1, 48]
    - [242, 9.493]
  - - [1632, 96, 1, 96]
    - [243, 6.107]
  - - [7388, 30, 1, 36]
    - [167, 3.491]
  - - [16896, 124, 1, 132]
    - [81, 28.325]
  - - [19456, 124, 1, 132]
    - [61, 30.732]
  - - [20928, 64, 1, 64]
    - [147, 17.324]
  - - [29952, 48, 1, 48]
    - [198, 10.912]
  - - [3120, 48, 1, 48]
    - [200, 3.483]
  - - [30398, 66, 1, 66]
    - [99, 11.935]
  - - [25754, 30, 1, 36]
    - [88, 7.737]
  - - [23962, 30, 1, 36]
    - [92, 7.673]
  - - [38912, 128, 1, 128]
    - [3, 34.826]
  - - [30112, 32, 1, 32]
    - [91, 7.594]
  - - [25176, 30, 1, 36]
    - [93, 8.224]
  - - [11520, 192, 1, 192]
    - [9, 40.122]
  - - [1536, 30, 1, 36]
    - [85, 0.84]
  - - [38912, 30, 1, 36]
    - [118, 8.199]
  - - [24192, 48, 1, 48]
    - [89, 10.921]
  - - [35280, 48, 1, 48]
    - [154, 12.211]
  - - [43936, 32, 1, 32]
    - [70, 9.011]
  - - [35712, 96, 1, 96]
    - [95, 25.75]
  - - [2064, 48, 1, 48]
    - [60, 2.521]
  - - [35072, 128, 1, 128]
    - [14, 32.532]
  - - [26880, 96, 1, 96]
    - [141, 28.121]
  - - [35952, 48, 1, 48]
    - [119, 12.239]
  - - [4768, 32, 1, 32]
    - [106, 2.341]
  - - [13568, 30, 1, 36]
    - [244, 5.549]
  - - [21760, 58, 1, 66]
    - [59, 14.112]
  - - [15360, 96, 1, 96]
    - [89, 20.645]
  - - [4154, 58, 1, 66]
    - [106, 6.022]
  - - [2464, 32, 1, 32]
    - [136, 1.421]
  - - [12346, 58, 1, 66]
    - [155, 11.512]
  - - [21504, 30, 1, 36]
    - [91, 7.319]
  - - [10752, 58, 1, 66]
    - [99, 11.107]
  - - [18336, 32, 1, 32]
    - [91, 7.232]
  - - [30048, 32, 1, 32]
    - [77, 7.577]
  - - [7152, 48, 1, 48]
    - [234, 6.63]
  - - [25856, 128, 1, 128]
    - [34, 35.223]
  - - [20026, 58, 1, 66]
    - [155, 14.159]
  - - [6624, 96, 1, 96]
    - [101, 16.775]
  - - [25296, 48, 1, 48]
    - [245, 11.177]
  - - [39712, 32, 1, 32]
    - [89, 8.563]
  - - [37728, 32, 1, 32]
    - [217, 8.291]
  - - [40416, 32, 1, 32]
    - [89, 8.675]
  - - [15776, 32, 1, 32]
    - [92, 6.443]
  - - [384, 96, 1, 96]
    - [140, 1.753]
  - - [33536, 128, 1, 128]
    - [3, 31.584]
  - - [19456, 58, 1, 66]
    - [63, 14.162]
  - - [18144, 96, 1, 96]
    - [117, 21.592]
  - - [37376, 66, 1, 66]
    - [70, 15.097]
  - - [16472, 30, 1, 36]
    - [115, 6.414]
  - - [9472, 124, 1, 132]
    - [73, 24.602]
  - - [35672, 30, 1, 36]
    - [92, 7.648]
  - - [21696, 64, 1, 64]
    - [84, 17.115]
  - - [21984, 32, 1, 32]
    - [88, 7.804]
  - - [27408, 48, 1, 48]
    - [155, 11.522]
  - - [18008, 30, 1, 36]
    - [92, 6.848]
  - - [9568, 32, 1, 32]
    - [204, 4.416]
  - - [30976, 66, 1, 66]
    - [99, 14.513]
  - - [35520, 64, 1, 64]
    - [61, 18.213]
  - - [27616, 32, 1, 32]
    - [111, 8.611]
  - - [43264, 124, 1, 132]
    - [110, 30.627]
  - - [12888, 30, 1, 36]
    - [106, 5.502]
  - - [5054, 66, 1, 66]
    - [88, 7.349]
  - - [36768, 32, 1, 32]
    - [89, 8.441]
  - - [15448, 30, 1, 36]
    - [93, 6.163]
  - - [5040, 48, 1, 48]
    - [112, 4.937]
  - - [13758, 66, 1, 66]
    - [59, 11.253]
  - - [22074, 58, 1, 66]
    - [90, 14.37]
  - - [6042, 30, 1, 36]
    - [98, 2.883]
  - - [18746, 58, 1, 66]
    - [189, 13.531]
  - - [35424, 32, 1, 32]
    - [89, 8.256]
  - - [32208, 48, 1, 48]
    - [90, 11.817]
  - - [9984, 128, 1, 128]
    - [59, 27.61]
  - - [24864, 32, 1, 32]
    - [88, 8.138]
  - - [34816, 124, 1, 132]
    - [81, 31.667]
  - - [20378, 30, 1, 36]
    - [93, 6.888]
  - - [33726, 66, 1, 66]
    - [99, 12.492]
  - - [33264, 48, 1, 48]
    - [90, 11.993]
  - - [16272, 48, 1, 48]
    - [102, 9.386]
  - - [14592, 128, 1, 128]
    - [45, 26.735]
  - - [38400, 48, 1, 48]
    - [117, 12.268]
  - - [34224, 48, 1, 48]
    - [119, 12.254]
  - - [41948, 30, 1, 36]
    - [93, 7.975]
  - - [27648, 96, 1, 96]
    - [122, 28.353]
  - - [2048, 66, 1, 66]
    - [106, 3.689]
  - - [29088, 32, 1, 32]
    - [246, 7.627]
  - - [37120, 66, 1, 66]
    - [99, 14.902]
  - - [1568, 32, 1, 32]
    - [200, 0.978]
  - - [33024, 66, 1, 66]
    - [89, 14.937]
  - - [40704, 96, 1, 96]
    - [79, 28.082]
  - - [43198, 66, 1, 66]
    - [153, 12.791]
  - - [39200, 32, 1, 32]
    - [99, 8.573]
  - - [13656, 30, 1, 36]
    - [67, 5.78]
  - - [11066, 58, 1, 66]
    - [91, 10.847]
  - - [16384, 66, 1, 66]
    - [117, 11.611]
  - - [25312, 32, 1, 32]
    - [111, 8.284]
  - - [8602, 30, 1, 36]
    - [137, 3.806]
  - - [26688, 64, 1, 64]
    - [198, 18.45]
  - - [9072, 48, 1, 48]
    - [113, 7.85]
  - - [14848, 30, 1, 36]
    - [88, 5.875]
  - - [12544, 58, 1, 66]
    - [70, 12.157]
  - - [8352, 32, 1, 32]
    - [115, 4.057]
  - - [24224, 32, 1, 32]
    - [88, 8.16]
  - - [41216, 30, 1, 36]
    - [118, 8.122]
  - - [28986, 58, 1, 66]
    - [90, 14.007]
  - - [28896, 32, 1, 32]
    - [247, 7.62]
  - - [7512, 30, 1, 36]
    - [248, 3.482]
  - - [31802, 58, 1, 66]
    - [135, 15.114]
  - - [11040, 96, 1, 96]
    - [61, 17.981]
  - - [38620, 30, 1, 36]
    - [93, 7.672]
  - - [18176, 30, 1, 36]
    - [93, 6.911]
  - - [24320, 58, 1, 66]
    - [81, 15.201]
  - - [16096, 32, 1, 32]
    - [93, 6.573]
  - - [17312, 32, 1, 32]
    - [92, 7.008]
  - - [21840, 48, 1, 48]
    - [175, 10.261]
  - - [43552, 32, 1, 32]
    - [101, 9.094]
  - - [19002, 58, 1, 66]
    - [209, 13.49]
  - - [38688, 96, 1, 96]
    - [184, 24.346]
  - - [27216, 48, 1, 48]
    - [249, 11.534]
  - - [34848, 96, 1, 96]
    - [69, 23.923]
  - - [28368, 48, 1, 48]
    - [119, 11.157]
  - - [19456, 128, 1, 128]
    - [7, 30.5]
  - - [26400, 32, 1, 32]
    - [89, 8.402]
  - - [23808, 48, 1, 48]
    - [70, 10.842]
  - - [2688, 48, 1, 48]
    - [250, 2.938]
  - - [7136, 32, 1, 32]
    - [133, 3.659]
  - - [8156, 30, 1, 36]
    - [251, 3.854]
  - - [28862, 66, 1, 66]
    - [101, 11.755]
  - - [32088, 30, 1, 36]
    - [91, 7.581]
  - - [41692, 30, 1, 36]
    - [88, 8.021]
  - - [23040, 128, 1, 128]
    - [30, 33.62]
  - - [10032, 48, 1, 48]
    - [77, 8.075]
  - - [28416, 58, 1, 66]
    - [61, 14.25]
  - - [17440, 32, 1, 32]
    - [88, 7.251]
  - - [27290, 30, 1, 36]
    - [88, 7.859]
  - - [35872, 32, 1, 32]
    - [252, 8.155]
  - - [600, 30, 1, 36]
    - [86, 0.336]
  - - [6144, 192, 1, 192]
    - [83, 31.699]
  - - [20480, 30, 1, 36]
    - [92, 7.12]
  - - [33792, 58, 1, 66]
    - [117, 16.059]
  - - [3328, 30, 1, 36]
    - [137, 1.62]
  - - [26944, 64, 1, 64]
    - [105, 18.489]
  - - [21888, 48, 1, 48]
    - [99, 10.822]
  - - [16830, 66, 1, 66]
    - [99, 11.758]
  - - [21264, 48, 1, 48]
    - [102, 10.269]
  - - [43264, 128, 1, 128]
    - [32, 31.691]
  - - [26352, 48, 1, 48]
    - [59, 11.214]
  - - [43328, 64, 1, 64]
    - [105, 18.687]
  - - [17920, 128, 1, 128]
    - [32, 28.455]
  - - [42096, 48, 1, 48]
    - [130, 12.488]
  - - [4922, 58, 1, 66]
    - [106, 6.903]
  - - [14496, 32, 1, 32]
    - [92, 5.973]
  - - [19456, 30, 1, 36]
    - [93, 6.912]
  - - [17088, 64, 1, 64]
    - [162, 15.615]
  - - [15360, 48, 1, 48]
    - [99, 8.96]
  - - [16736, 32, 1, 32]
    - [91, 6.958]
  - - [11104, 32, 1, 32]
    - [136, 5.124]
  - - [20208, 48, 1, 48]
    - [209, 10.76]
  - - [2272, 32, 1, 32]
    - [204, 1.362]
  - - [33184, 32, 1, 32]
    - [101, 7.935]
  - - [24576, 128, 1, 128]
    - [34, 34.173]
  - - [15136, 32, 1, 32]
    - [88, 6.467]
  - - [39232, 64, 1, 64]
    - [69, 19.26]
  - - [37632, 124, 1, 132]
    - [69, 31.473]
  - - [23968, 32, 1, 32]
    - [93, 8.073]
  - - [32320, 64, 1, 64]
    - [109, 17.916]
  - - [9536, 64, 1, 64]
    - [89, 13.039]
  - - [6364, 30, 1, 36]
    - [112, 2.922]
  - - [8160, 32, 1, 32]
    - [165, 3.922]
  - - [19584, 48, 1, 48]
    - [231, 10.017]
  - - [28384, 32, 1, 32]
    - [182, 7.844]
  - - [17562, 30, 1, 36]
    - [88, 6.575]
  - - [30560, 32, 1, 32]
    - [88, 7.582]
  - - [6144, 124, 1, 132]
    - [63, 20.6]
  - - [42496, 30, 1, 36]
    - [118, 8.547]
  - - [14848, 58, 1, 66]
    - [209, 11.859]
  - - [19296, 96, 1, 96]
    - [117, 22.449]
  - - [33168, 48, 1, 48]
    - [154, 11.999]
  - - [22304, 32, 1, 32]
    - [92, 7.739]
  - - [27040, 32, 1, 32]
    - [253, 8.606]
  - - [35392, 64, 1, 64]
    - [105, 18.351]
  - - [3168, 32, 1, 32]
    - [166, 1.7]
  - - [11424, 96, 1, 96]
    - [75, 18.462]
  - - [8544, 96, 1, 96]
    - [99, 18.387]
  - - [37296, 48, 1, 48]
    - [254, 12.294]
  - - [37596, 30, 1, 36]
    - [93, 7.624]
  - - [702, 66, 1, 66]
    - [174, 1.436]
  - - [14270, 66, 1, 66]
    - [70, 10.571]
  - - [23640, 30, 1, 36]
    - [88, 7.99]
  - - [8880, 48, 1, 48]
    - [108, 7.88]
  - - [7834, 30, 1, 36]
    - [255, 3.775]
  - - [11584, 64, 1, 64]
    - [101, 14.646]
  - - [20700, 30, 1, 36]
    - [93, 7.145]
  - - [41856, 192, 1, 192]
    - [37, 47.923]
  - - [17184, 32, 1, 32]
    - [92, 6.956]
  - - [38144, 124, 1, 132]
    - [123, 31.579]
  - - [12800, 128, 1, 128]
    - [59, 30.886]
  - - [23392, 32, 1, 32]
    - [91, 8.056]
  - - [10240, 124, 1, 132]
    - [63, 25.347]
  - - [38240, 32, 1, 32]
    - [101, 8.525]
  - - [43776, 124, 1, 132]
    - [123, 31.35]
  - - [23184, 48, 1, 48]
    - [124, 10.512]
  - - [22784, 128, 1, 128]
    - [15, 33.378]
  - - [570, 58, 1, 66]
    - [86, 1.035]
  - - [41216, 58, 1, 66]
    - [61, 18.231]
  - - [30768, 48, 1, 48]
    - [90, 11.41]
  - - [24384, 64, 1, 64]
    - [256, 17.861]
  - - [19676, 30, 1, 36]
    - [91, 7.147]
  - - [3840, 66, 1, 66]
    - [216, 6.498]
  - - [8704, 66, 1, 66]
    - [70, 10.232]
  - - [20056, 30, 1, 36]
    - [92, 7.125]
  - - [3360, 32, 1, 32]
    - [152, 1.723]
  - - [8448, 66, 1, 66]
    - [89, 10.174]
  - - [33792, 124, 1, 132]
    - [117, 31.314]
  - - [25696, 32, 1, 32]
    - [156, 8.41]
  - - [29984, 32, 1, 32]
    - [161, 7.52]
  - - [40894, 66, 1, 66]
    - [153, 13.38]
  - - [42072, 30, 1, 36]
    - [91, 8.191]
  - - [22128, 48, 1, 48]
    - [148, 10.54]
  - - [18176, 66, 1, 66]
    - [70, 13.314]
  - - [7168, 58, 1, 66]
    - [116, 9.512]
  - - [2080, 32, 1, 32]
    - [194, 1.263]
  - - [37530, 30, 1, 36]
    - [77, 7.517]
  - - [17920, 66, 1, 66]
    - [89, 13.126]
  - - [33024, 48, 1, 48]
    - [154, 11.663]
  - - [3160, 30, 1, 36]
    - [140, 1.586]
  - - [17632, 32, 1, 32]
    - [92, 7.075]
  - - [14044, 30, 1, 36]
    - [113, 5.603]
  - - [24288, 32, 1, 32]
    - [91, 8.122]
  - - [7248, 48, 1, 48]
    - [113, 6.544]
  - - [38400, 30, 1, 36]
    - [118, 8.021]
  - - [12288, 124, 1, 132]
    - [81, 27.804]
  - - [36696, 30, 1, 36]
    - [88, 7.732]
  - - [40192, 30, 1, 36]
    - [114, 8.185]
  - - [39872, 64, 1, 64]
    - [109, 18.969]
  - - [41520, 48, 1, 48]
    - [254, 12.869]
  - - [15712, 32, 1, 32]
    - [115, 6.776]
  - - [22656, 48, 1, 48]
    - [101, 10.942]
  - - [9312, 96, 1, 96]
    - [70, 19.146]
  - - [2780, 30, 1, 36]
    - [80, 1.503]
  - - [33120, 32, 1, 32]
    - [77, 7.838]
  - - [20832, 96, 1, 96]
    - [81, 23.64]
  - - [8928, 96, 1, 96]
    - [183, 18.088]
  - - [24480, 32, 1, 32]
    - [179, 8.186]
  - - [4160, 64, 1, 64]
    - [106, 7.603]
  - - [10800, 48, 1, 48]
    - [77, 8.693]
  - - [33280, 30, 1, 36]
    - [114, 7.677]
  - - [25632, 32, 1, 32]
    - [179, 8.449]
  - - [36864, 48, 1, 48]
    - [81, 12.268]
  - - [26880, 192, 1, 192]
    - [24, 46.468]
  - - [22528, 128, 1, 128]
    - [7, 33.74]
  - - [22784, 58, 1, 66]
    - [75, 14.721]
  - - [37696, 64, 1, 64]
    - [81, 18.605]
  - - [18688, 66, 1, 66]
    - [101, 13.488]
  - - [19200, 192, 1, 192]
    - [9, 42.416]
  - - [5120, 30, 1, 36]
    - [191, 2.651]
  - - [13824, 128, 1, 128]
    - [59, 31.998]
  - - [26368, 58, 1, 66]
    - [134, 16.131]
  - - [19904, 64, 1, 64]
    - [73, 17.331]
  - - [39680, 124, 1, 132]
    - [117, 31.989]
  - - [9744, 48, 1, 48]
    - [89, 8.361]
  - - [31488, 66, 1, 66]
    - [101, 14.579]
  - - [31488, 128, 1, 128]
    - [42, 32.517]
  - - [17086, 66, 1, 66]
    - [89, 11.936]
  - - [32112, 48, 1, 48]
    - [254, 11.618]
  - - [512, 30, 1, 36]
    - [60, 0.297]
  - - [3642, 58, 1, 66]
    - [112, 5.511]
  - - [24028, 30, 1, 36]
    - [88, 7.797]
  - - [12192, 32, 1, 32]
    - [115, 5.741]
  - - [43740, 30, 1, 36]
    - [116, 8.157]
  - - [768, 58, 1, 66]
    - [85, 1.44]
  - - [14832, 48, 1, 48]
    - [155, 9.112]
  - - [19488, 32, 1, 32]
    - [91, 7.495]
  - - [384, 48, 1, 48]
    - [174, 0.532]
  - - [38810, 30, 1, 36]
    - [116, 7.648]
  - - [41088, 48, 1, 48]
    - [117, 13.208]
  - - [29024, 32, 1, 32]
    - [217, 7.525]
  - - [26400, 96, 1, 96]
    - [81, 24.312]
  - - [38298, 30, 1, 36]
    - [161, 7.639]
  - - [6208, 64, 1, 64]
    - [71, 10.61]
  - - [35898, 58, 1, 66]
    - [135, 16.085]
  - - [16348, 30, 1, 36]
    - [91, 6.576]
  - - [33312, 96, 1, 96]
    - [147, 23.813]
  - - [26332, 30, 1, 36]
    - [92, 8.268]
  - - [9692, 30, 1, 36]
    - [106, 4.58]
  - - [19456, 66, 1, 66]
    - [117, 13.592]
  - - [9168, 48, 1, 48]
    - [113, 8.278]
  - - [37120, 128, 1, 128]
    - [3, 34.005]
  - - [29712, 48, 1, 48]
    - [119, 11.259]
  - - [17920, 124, 1, 132]
    - [69, 29.704]
  - - [29568, 48, 1, 48]
    - [135, 10.887]
  - - [19712, 30, 1, 36]
    - [93, 7.324]
  - - [43520, 128, 1, 128]
    - [15, 31.534]
  - - [39168, 124, 1, 132]
    - [81, 32.031]
  - - [4960, 32, 1, 32]
    - [165, 2.725]
  - - [19136, 64, 1, 64]
    - [132, 17.316]
  - - [27968, 64, 1, 64]
    - [198, 19.192]
  - - [3928, 30, 1, 36]
    - [257, 2.012]
  - - [12734, 66, 1, 66]
    - [89, 10.592]
  - - [16448, 64, 1, 64]
    - [258, 15.491]
  - - [432, 48, 1, 48]
    - [259, 0.534]
  - - [10942, 66, 1, 66]
    - [89, 9.945]
  - - [37920, 32, 1, 32]
    - [89, 8.293]
  - - [32960, 64, 1, 64]
    - [180, 17.534]
  - - [3482, 30, 1, 36]
    - [139, 1.842]
  - - [37376, 124, 1, 132]
    - [117, 31.473]
  - - [37472, 32, 1, 32]
    - [217, 8.274]
  - - [12764, 30, 1, 36]
    - [106, 5.449]
  - - [30142, 66, 1, 66]
    - [89, 11.954]
  - - [26176, 64, 1, 64]
    - [109, 18.584]
  - - [24576, 30, 1, 36]
    - [92, 7.974]
  - - [42688, 64, 1, 64]
    - [184, 18.541]
  - - [20188, 30, 1, 36]
    - [91, 7.225]
  - - [42496, 128, 1, 128]
    - [32, 31.284]
  - - [11664, 48, 1, 48]
    - [93, 8.84]
  - - [31386, 30, 1, 36]
    - [92, 7.24]
  - - [27312, 48, 1, 48]
    - [254, 11.528]
  - - [42840, 30, 1, 36]
    - [93, 8.274]
  - - [24320, 30, 1, 36]
    - [93, 7.944]
  - - [21440, 64, 1, 64]
    - [180, 17.133]
  - - [3584, 66, 1, 66]
    - [92, 6.226]
  - - [25728, 96, 1, 96]
    - [79, 27.973]
  - - [672, 96, 1, 96]
    - [60, 2.877]
  - - [16640, 66, 1, 66]
    - [101, 12.81]
  - - [4800, 64, 1, 64]
    - [233, 8.687]
  - - [26814, 66, 1, 66]
    - [97, 14.343]
  - - [40346, 30, 1, 36]
    - [159, 7.762]
  - - [39644, 30, 1, 36]
    - [91, 7.812]
  - - [11322, 58, 1, 66]
    - [189, 11.098]
  - - [9882, 30, 1, 36]
    - [112, 4.538]
  - - [30624, 32, 1, 32]
    - [99, 7.895]
  - - [42686, 66, 1, 66]
    - [97, 12.872]
  - - [22896, 48, 1, 48]
    - [209, 10.566]
  - - [25728, 192, 1, 192]
    - [29, 45.182]
  - - [26368, 66, 1, 66]
    - [81, 14.789]
  - - [7936, 58, 1, 66]
    - [77, 10.066]
  - - [5536, 32, 1, 32]
    - [126, 2.971]
  - - [17760, 96, 1, 96]
    - [81, 22.085]
  - - [19232, 32, 1, 32]
    - [91, 7.396]
  - - [36096, 96, 1, 96]
    - [95, 26.581]
  - - [43066, 58, 1, 66]
    - [135, 15.608]
  - - [7000, 30, 1, 36]
    - [137, 3.549]
  - - [3648, 64, 1, 64]
    - [115, 6.802]
  - - [30240, 32, 1, 32]
    - [115, 7.753]
  - - [30720, 48, 1, 48]
    - [70, 10.999]
  - - [41274, 58, 1, 66]
    - [130, 16.444]
  - - [29184, 96, 1, 96]
    - [158, 23.132]
  - - [24896, 64, 1, 64]
    - [132, 18.834]
  - - [22236, 30, 1, 36]
    - [93, 7.464]
  - - [1792, 30, 1, 36]
    - [260, 1.003]
  - - [928, 32, 1, 32]
    - [261, 0.603]
  - - [11088, 48, 1, 48]
    - [93, 8.657]
  - - [43040, 32, 1, 32]
    - [262, 8.867]
  - - [41808, 48, 1, 48]
    - [90, 12.997]
  - - [32592, 48, 1, 48]
    - [135, 12.173]
  - - [36506, 30, 1, 36]
    - [77, 7.692]
  - - [3072, 128, 1, 128]
    - [71, 16.319]
  - - [41114, 30, 1, 36]
    - [77, 7.909]
  - - [19680, 32, 1, 32]
    - [106, 7.444]
  - - [4576, 32, 1, 32]
    - [200, 2.707]
  - - [11740, 30, 1, 36]
    - [115, 5.242]
  - - [39904, 32, 1, 32]
    - [89, 8.565]
  - - [40256, 64, 1, 64]
    - [117, 19.607]
  - - [6528, 48, 1, 48]
    - [115, 6.517]
  - - [32000, 124, 1, 132]
    - [117, 30.536]
  - - [32640, 96, 1, 96]
    - [69, 24.036]
  - - [5424, 48, 1, 48]
    - [112, 5.522]
  - - [20224, 66, 1, 66]
    - [117, 13.979]
  - - [24796, 30, 1, 36]
    - [92, 7.94]
  - - [23712, 96, 1, 96]
    - [81, 22.85]
  - - [14650, 58, 1, 66]
    - [155, 11.81]
  - - [21920, 32, 1, 32]
    - [263, 7.841]
  - - [13824, 192, 1, 192]
    - [24, 43.912]
  - - [2688, 192, 1, 192]
    - [99, 20.868]
  - - [768, 30, 1, 36]
    - [60, 0.445]
  - - [22016, 128, 1, 128]
    - [32, 32.774]
  - - [15104, 124, 1, 132]
    - [237, 25.672]
  - - [4368, 48, 1, 48]
    - [112, 4.535]
  - - [34800, 48, 1, 48]
    - [119, 12.166]
  - - [31642, 30, 1, 36]
    - [77, 7.265]
  - - [16128, 30, 1, 36]
    - [115, 6.542]
  - - [8506, 58, 1, 66]
    - [93, 10.12]
  - - [13984, 32, 1, 32]
    - [115, 6.327]
  - - [27360, 96, 1, 96]
    - [61, 24.975]
  - - [28032, 192, 1, 192]
    - [22, 46.71]
  - - [14784, 64, 1, 64]
    - [198, 14.214]
  - - [4832, 32, 1, 32]
    - [204, 2.655]
  - - [9456, 48, 1, 48]
    - [193, 8.182]
  - - [38016, 192, 1, 192]
    - [9, 45.015]
  - - [7008, 96, 1, 96]
    - [161, 17.429]
  - - [28800, 48, 1, 48]
    - [99, 10.796]
  - - [15168, 64, 1, 64]
    - [84, 14.433]
  - - [24832, 58, 1, 66]
    - [59, 15.749]
  - - [6976, 64, 1, 64]
    - [233, 11.101]
  - - [476, 30, 1, 36]
    - [140, 0.263]
  - - [18976, 32, 1, 32]
    - [91, 7.421]
  - - [38078, 66, 1, 66]
    - [97, 12.844]
  - - [28256, 32, 1, 32]
    - [264, 7.951]
  - - [32256, 128, 1, 128]
    - [7, 30.731]
  - - [22016, 124, 1, 132]
    - [265, 29.635]
  - - [29600, 32, 1, 32]
    - [106, 7.589]
  - - [7680, 124, 1, 132]
    - [63, 21.378]
  - - [19968, 48, 1, 48]
    - [209, 10.471]
  - - [29328, 48, 1, 48]
    - [119, 11.033]
  - - [31744, 128, 1, 128]
    - [32, 29.973]
  - - [19420, 30, 1, 36]
    - [92, 7.107]
  - - [608, 32, 1, 32]
    - [136, 0.395]
  - - [16896, 128, 1, 128]
    - [46, 29.285]
  - - [24096, 96, 1, 96]
    - [61, 22.954]
  - - [29904, 48, 1, 48]
    - [135, 11.209]
  - - [35036, 30, 1, 36]
    - [88, 7.613]
  - - [17152, 30, 1, 36]
    - [93, 7.135]
  - - [6334, 66, 1, 66]
    - [70, 8.819]
  - - [31200, 96, 1, 96]
    - [105, 23.647]
  - - [22704, 48, 1, 48]
    - [219, 10.34]
  - - [13344, 32, 1, 32]
    - [126, 5.921]
  - - [7322, 30, 1, 36]
    - [165, 3.564]
  - - [3456, 96, 1, 96]
    - [233, 12.481]
  - - [19968, 30, 1, 36]
    - [93, 7.199]
  - - [31968, 32, 1, 32]
    - [128, 7.724]
  - - [4096, 128, 1, 128]
    - [70, 17.584]
  - - [40848, 48, 1, 48]
    - [90, 12.853]
  - - [39066, 30, 1, 36]
    - [116, 7.667]
  - - [34176, 48, 1, 48]
    - [254, 11.597]
  - - [384, 192, 1, 192]
    - [194, 5.063]
  - - [31008, 32, 1, 32]
    - [93, 7.777]
  - - [36256, 32, 1, 32]
    - [188, 8.202]
  - - [15264, 32, 1, 32]
    - [200, 6.708]
  - - [12432, 48, 1, 48]
    - [92, 9.22]
  - - [40448, 66, 1, 66]
    - [89, 15.153]
  - - [23706, 30, 1, 36]
    - [92, 7.591]
  - - [14640, 48, 1, 48]
    - [102, 8.736]
  - - [1280, 66, 1, 66]
    - [66, 2.617]
  - - [14080, 66, 1, 66]
    - [75, 12.07]
  - - [800, 32, 1, 32]
    - [173, 0.52]
  - - [43824, 48, 1, 48]
    - [119, 11.758]
  - - [17408, 124, 1, 132]
    - [117, 28.472]
  - - [39648, 96, 1, 96]
    - [81, 24.288]
  - - [11376, 48, 1, 48]
    - [88, 8.815]
  - - [39424, 30, 1, 36]
    - [145, 8.343]
  - - [43200, 64, 1, 64]
    - [158, 18.808]
  - - [2560, 58, 1, 66]
    - [98, 4.127]
  - - [6048, 96, 1, 96]
    - [89, 15.999]
  - - [31776, 96, 1, 96]
    - [105, 23.525]
  - - [42624, 96, 1, 96]
    - [266, 25.472]
  - - [8792, 30, 1, 36]
    - [98, 4.237]
  - - [8128, 64, 1, 64]
    - [89, 12.003]
  - - [39936, 58, 1, 66]
    - [81, 17.895]
  - - [20160, 64, 1, 64]
    - [84, 17.554]
  - - [21468, 30, 1, 36]
    - [88, 7.157]
  - - [28416, 48, 1, 48]
    - [90, 10.928]
  - - [33856, 64, 1, 64]
    - [158, 18.545]
  - - [14928, 48, 1, 48]
    - [209, 8.708]
  - - [256, 124, 1, 132]
    - [86, 1.733]
  - - [44032, 128, 1, 128]
    - [32, 32.286]
  - - [37248, 96, 1, 96]
    - [141, 26.858]
  - - [21504, 96, 1, 96]
    - [79, 25.158]
  - - [6368, 32, 1, 32]
    - [85, 3.417]
  - - [2268, 30, 1, 36]
    - [267, 1.2]
  - - [21504, 48, 1, 48]
    - [99, 10.633]
  - - [15680, 64, 1, 64]
    - [84, 15.075]
  - - [14848, 128, 1, 128]
    - [26, 23.376]
  - - [6192, 48, 1, 48]
    - [200, 6.182]
  - - [16896, 30, 1, 36]
    - [88, 7.029]
  - - [28416, 66, 1, 66]
    - [101, 14.23]
  - - [35328, 192, 1, 192]
    - [22, 42.56]
  - - [8064, 48, 1, 48]
    - [168, 7.612]
  - - [24576, 96, 1, 96]
    - [122, 27.365]
  - - [17854, 66, 1, 66]
    - [89, 11.761]
  - - [34048, 124, 1, 132]
    - [81, 31.473]
  - - [14592, 192, 1, 192]
    - [29, 33.345]
  - - [15104, 128, 1, 128]
    - [32, 24.139]
  - - [14016, 64, 1, 64]
    - [225, 15.586]
  - - [24576, 48, 1, 48]
    - [117, 11.047]
  - - [4608, 30, 1, 36]
    - [191, 2.386]
  - - [6240, 32, 1, 32]
    - [200, 3.555]
  - - [17408, 66, 1, 66]
    - [70, 13.144]
  - - [23104, 64, 1, 64]
    - [134, 17.995]
  - - [23296, 124, 1, 132]
    - [265, 30.907]
  - - [17424, 48, 1, 48]
    - [189, 9.886]
  - - [28272, 48, 1, 48]
    - [268, 11.378]
  - - [37536, 32, 1, 32]
    - [176, 8.249]
  - - [15968, 32, 1, 32]
    - [126, 6.952]
  - - [14080, 30, 1, 36]
    - [67, 6.064]
  - - [25242, 30, 1, 36]
    - [93, 7.727]
  - - [3130, 58, 1, 66]
    - [248, 4.909]
  - - [28928, 124, 1, 132]
    - [81, 28.875]
  - - [9632, 32, 1, 32]
    - [126, 4.939]
  - - [44032, 30, 1, 36]
    - [145, 8.607]
  - - [17372, 30, 1, 36]
    - [92, 6.874]
  - - [8896, 64, 1, 64]
    - [101, 12.93]
  - - [44016, 48, 1, 48]
    - [119, 11.933]
  - - [20640, 32, 1, 32]
    - [93, 7.681]
  - - [40858, 30, 1, 36]
    - [269, 7.768]
  - - [27356, 30, 1, 36]
    - [92, 8.119]
  - - [41472, 128, 1, 128]
    - [30, 35.731]
  - - [25888, 32, 1, 32]
    - [111, 8.534]
  - - [22976, 64, 1, 64]
    - [109, 17.526]
  - - [36798, 66, 1, 66]
    - [101, 12.585]
  - - [5120, 58, 1, 66]
    - [106, 7.681]
  - - [21592, 30, 1, 36]
    - [91, 7.453]
  - - [22512, 48, 1, 48]
    - [189, 10.529]
  - - [22944, 96, 1, 96]
    - [81, 22.11]
  - - [31200, 32, 1, 32]
    - [116, 7.783]
  - - [8544, 32, 1, 32]
    - [106, 4.381]
  - - [9048, 30, 1, 36]
    - [204, 4.318]
  - - [10460, 30, 1, 36]
    - [216, 4.714]
  - - [16320, 64, 1, 64]
    - [109, 15.215]
  - - [16608, 32, 1, 32]
    - [88, 7.23]
  - - [36096, 124, 1, 132]
    - [81, 31.214]
  - - [7744, 64, 1, 64]
    - [89, 11.436]
  - - [31104, 192, 1, 192]
    - [9, 43.866]
  - - [20192, 32, 1, 32]
    - [156, 7.638]
  - - [27936, 32, 1, 32]
    - [253, 8.711]
  - - [4352, 124, 1, 132]
    - [77, 17.736]
  - - [41040, 48, 1, 48]
    - [135, 13.358]
  - - [25872, 48, 1, 48]
    - [219, 11.193]
  - - [39936, 128, 1, 128]
    - [34, 35.021]
  - - [4448, 32, 1, 32]
    - [115, 2.566]
  - - [37888, 30, 1, 36]
    - [145, 8.232]
  - - [17952, 32, 1, 32]
    - [93, 7.332]
  - - [43344, 48, 1, 48]
    - [119, 11.812]
  - - [36184, 30, 1, 36]
    - [92, 7.724]
  - - [31840, 32, 1, 32]
    - [126, 7.858]
  - - [9304, 30, 1, 36]
    - [270, 4.354]
  - - [4030, 66, 1, 66]
    - [93, 6.648]
  - - [38846, 66, 1, 66]
    - [149, 13.036]
  - - [20400, 48, 1, 48]
    - [102, 11.207]
  - - [12222, 66, 1, 66]
    - [101, 10.387]
  - - [16576, 64, 1, 64]
    - [105, 15.772]
  - - [9114, 30, 1, 36]
    - [248, 4.107]
  - - [448, 64, 1, 64]
    - [85, 1.06]
  - - [20992, 124, 1, 132]
    - [202, 31.993]
  - - [21088, 32, 1, 32]
    - [92, 7.603]
  - - [18688, 58, 1, 66]
    - [73, 14.017]
  - - [25052, 30, 1, 36]
    - [88, 8.022]
  - - [27392, 128, 1, 128]
    - [34, 35.797]
  - - [27504, 48, 1, 48]
    - [268, 11.85]
  - - [26304, 64, 1, 64]
    - [105, 18.747]
  - - [39388, 30, 1, 36]
    - [269, 7.793]
  - - [21856, 32, 1, 32]
    - [92, 7.759]
  - - [9600, 48, 1, 48]
    - [91, 8.306]
  - - [26112, 128, 1, 128]
    - [3, 34.928]
  - - [38656, 58, 1, 66]
    - [81, 17.689]
  - - [40000, 64, 1, 64]
    - [178, 19.129]
  - - [19344, 48, 1, 48]
    - [231, 10.353]
  - - [34944, 192, 1, 192]
    - [24, 46.855]
  - - [32688, 48, 1, 48]
    - [254, 12.122]
  - - [26456, 30, 1, 36]
    - [92, 8.416]
  - - [44252, 30, 1, 36]
    - [92, 8.221]
  - - [17408, 128, 1, 128]
    - [34, 27.702]
  - - [35232, 96, 1, 96]
    - [105, 23.45]
  - - [9216, 66, 1, 66]
    - [116, 11.032]
  - - [14496, 96, 1, 96]
    - [101, 19.676]
  - - [28064, 32, 1, 32]
    - [89, 8.81]
  - - [25600, 124, 1, 132]
    - [271, 32.898]
  - - [23260, 30, 1, 36]
    - [91, 7.649]
  - - [13626, 58, 1, 66]
    - [209, 12.987]
  - - [32702, 66, 1, 66]
    - [272, 11.823]
  - - [5018, 30, 1, 36]
    - [191, 2.598]
  - - [18176, 124, 1, 132]
    - [81, 30.197]
  - - [24432, 48, 1, 48]
    - [131, 10.935]
  - - [24218, 30, 1, 36]
    - [88, 7.654]
  - - [3328, 58, 1, 66]
    - [239, 5.366]
  - - [10272, 96, 1, 96]
    - [134, 19.392]
  - - [18272, 32, 1, 32]
    - [91, 7.462]
  - - [16864, 32, 1, 32]
    - [106, 6.949]
  - - [39168, 192, 1, 192]
    - [37, 46.084]
  - - [2392, 30, 1, 36]
    - [60, 1.308]
  - - [6912, 96, 1, 96]
    - [99, 17.505]
  - - [15360, 58, 1, 66]
    - [134, 12.155]
  - - [25344, 58, 1, 66]
    - [73, 15.841]
  - - [39936, 124, 1, 132]
    - [210, 32.372]
  - - [15360, 66, 1, 66]
    - [89, 12.257]
  - - [35774, 66, 1, 66]
    - [89, 12.541]
  - - [336, 48, 1, 48]
    - [86, 0.42]
  - - [34464, 96, 1, 96]
    - [198, 23.976]
  - - [25680, 48, 1, 48]
    - [273, 11.156]
  - - [30208, 124, 1, 132]
    - [237, 29.397]
  - - [38108, 30, 1, 36]
    - [88, 7.728]
  - - [29088, 96, 1, 96]
    - [132, 22.752]
  - - [6112, 32, 1, 32]
    - [126, 3.28]
  - - [11228, 30, 1, 36]
    - [200, 5.013]
  - - [39264, 32, 1, 32]
    - [89, 8.587]
  - - [43520, 124, 1, 132]
    - [61, 30.691]
  - - [33504, 96, 1, 96]
    - [105, 23.868]
  - - [20224, 124, 1, 132]
    - [274, 31.407]
  - - [13104, 48, 1, 48]
    - [128, 9.383]
  - - [1594, 58, 1, 66]
    - [194, 2.75]
  - - [34896, 48, 1, 48]
    - [130, 12.159]
  - - [5822, 66, 1, 66]
    - [77, 8.404]
  - - [4864, 128, 1, 128]
    - [89, 19.625]
  - - [21280, 32, 1, 32]
    - [253, 7.672]
  - - [26046, 66, 1, 66]
    - [153, 14.085]
  - - [38928, 48, 1, 48]
    - [119, 12.711]
  - - [33368, 30, 1, 36]
    - [115, 7.661]
  - - [21504, 192, 1, 192]
    - [22, 38.958]
  - - [23296, 128, 1, 128]
    - [30, 33.661]
  - - [22208, 64, 1, 64]
    - [121, 17.519]
  - - [38880, 32, 1, 32]
    - [217, 8.384]
  - - [6400, 30, 1, 36]
    - [66, 3.279]
  - - [5632, 128, 1, 128]
    - [73, 22.12]
  - - [24576, 58, 1, 66]
    - [61, 15.879]
  - - [18592, 32, 1, 32]
    - [91, 7.526]
  - - [12048, 48, 1, 48]
    - [89, 9.0]
  - - [30960, 48, 1, 48]
    - [90, 11.647]
  - - [43008, 30, 1, 36]
    - [129, 8.475]
  - - [14976, 96, 1, 96]
    - [89, 20.596]
  - - [29952, 58, 1, 66]
    - [81, 14.848]
  - - [12090, 58, 1, 66]
    - [189, 11.652]
  - - [2592, 96, 1, 96]
    - [200, 9.527]
  - - [28704, 32, 1, 32]
    - [246, 7.657]
  - - [19744, 32, 1, 32]
    - [77, 7.656]
  - - [24960, 48, 1, 48]
    - [117, 11.367]
  - - [30624, 96, 1, 96]
    - [104, 23.168]
  - - [3168, 96, 1, 96]
    - [127, 11.057]
  - - [23280, 48, 1, 48]
    - [209, 10.602]
  - - [1280, 128, 1, 128]
    - [233, 8.148]
  - - [38656, 66, 1, 66]
    - [99, 14.909]
  - - [41120, 32, 1, 32]
    - [183, 8.434]
  - - [8928, 32, 1, 32]
    - [166, 4.629]
  - - [1920, 48, 1, 48]
    - [140, 2.265]
  - - [39168, 48, 1, 48]
    - [61, 12.591]
  - - [31440, 48, 1, 48]
    - [254, 11.659]
  - - [44090, 58, 1, 66]
    - [119, 15.491]
  - - [4416, 64, 1, 64]
    - [233, 8.071]
  - - [8924, 30, 1, 36]
    - [136, 4.137]
  - - [19712, 66, 1, 66]
    - [61, 13.674]
  - - [40928, 32, 1, 32]
    - [89, 8.624]
  - - [4440, 30, 1, 36]
    - [191, 2.349]
  - - [15744, 48, 1, 48]
    - [209, 9.288]
  - - [21792, 96, 1, 96]
    - [275, 21.55]
  - - [11472, 48, 1, 48]
    - [92, 8.824]
  - - [22560, 32, 1, 32]
    - [146, 8.071]
  - - [29888, 64, 1, 64]
    - [198, 17.295]
  - - [31632, 48, 1, 48]
    - [254, 11.524]
  - - [42592, 32, 1, 32]
    - [99, 8.697]
  - - [15360, 128, 1, 128]
    - [46, 27.132]
  - - [9216, 96, 1, 96]
    - [70, 18.763]
  - - [15584, 32, 1, 32]
    - [106, 6.721]
  - - [32352, 96, 1, 96]
    - [99, 23.615]
  - - [14432, 32, 1, 32]
    - [106, 6.343]
  - - [10944, 64, 1, 64]
    - [89, 13.65]
  - - [35808, 32, 1, 32]
    - [143, 8.304]
  - - [30880, 32, 1, 32]
    - [128, 7.745]
  - - [7870, 66, 1, 66]
    - [101, 9.716]
  - - [25498, 30, 1, 36]
    - [91, 7.66]
  - - [41728, 128, 1, 128]
    - [3, 35.784]
  - - [32220, 30, 1, 36]
    - [88, 7.468]
  - - [32512, 124, 1, 132]
    - [81, 30.473]
  - - [24240, 48, 1, 48]
    - [131, 10.802]
  - - [37376, 30, 1, 36]
    - [114, 8.085]
  - - [10906, 30, 1, 36]
    - [92, 4.825]
  - - [12096, 64, 1, 64]
    - [70, 14.886]
  - - [19152, 48, 1, 48]
    - [189, 10.466]
  - - [7584, 96, 1, 96]
    - [99, 16.666]
  - - [43232, 32, 1, 32]
    - [172, 8.828]
  - - [43418, 30, 1, 36]
    - [93, 7.944]
  - - [11776, 128, 1, 128]
    - [82, 30.296]
  - - [21760, 66, 1, 66]
    - [99, 13.561]
  - - [7776, 96, 1, 96]
    - [99, 16.821]
  - - [43008, 124, 1, 132]
    - [61, 30.921]
  - - [30522, 58, 1, 66]
    - [124, 14.586]
  - - [7616, 64, 1, 64]
    - [92, 11.157]
  - - [36576, 96, 1, 96]
    - [276, 23.552]
  - - [13968, 48, 1, 48]
    - [128, 9.934]
  - - [32800, 32, 1, 32]
    - [116, 7.723]
  - - [15806, 66, 1, 66]
    - [70, 11.283]
  - - [29232, 48, 1, 48]
    - [90, 11.118]
  - - [8064, 192, 1, 192]
    - [28, 29.705]
  - - [6912, 66, 1, 66]
    - [128, 9.833]
  - - [1024, 66, 1, 66]
    - [166, 2.094]
  - - [27802, 30, 1, 36]
    - [92, 8.103]
  - - [2976, 96, 1, 96]
    - [200, 10.475]
  - - [30336, 192, 1, 192]
    - [29, 42.387]
  - - [16442, 58, 1, 66]
    - [189, 12.72]
  - - [16128, 96, 1, 96]
    - [101, 21.131]
  - - [37856, 32, 1, 32]
    - [192, 8.399]
  - - [24480, 96, 1, 96]
    - [210, 22.746]
  - - [22368, 32, 1, 32]
    - [111, 7.94]
  - - [16512, 96, 1, 96]
    - [61, 20.908]
  - - [22682, 30, 1, 36]
    - [230, 7.311]
  - - [41904, 48, 1, 48]
    - [90, 12.988]
  - - [29148, 30, 1, 36]
    - [106, 7.238]
  - - [33504, 32, 1, 32]
    - [93, 7.97]
  - - [37392, 48, 1, 48]
    - [154, 12.484]
  - - [26368, 124, 1, 132]
    - [265, 33.42]
  - - [624, 48, 1, 48]
    - [187, 0.762]
  - - [2048, 58, 1, 66]
    - [191, 3.43]
  - - [12832, 32, 1, 32]
    - [216, 5.982]
  - - [36288, 64, 1, 64]
    - [198, 18.352]
  - - [31488, 58, 1, 66]
    - [61, 15.302]
  - - [4320, 32, 1, 32]
    - [133, 2.431]
  - - [6232, 30, 1, 36]
    - [112, 3.127]
  - - [5568, 64, 1, 64]
    - [88, 9.516]
  - - [23552, 58, 1, 66]
    - [117, 15.332]
  - - [3776, 64, 1, 64]
    - [126, 6.901]
  - - [7296, 96, 1, 96]
    - [89, 17.12]
  - - [32512, 58, 1, 66]
    - [61, 15.623]
  - - [25504, 32, 1, 32]
    - [277, 8.528]
  - - [13056, 124, 1, 132]
    - [59, 29.272]
  - - [10320, 48, 1, 48]
    - [77, 8.712]
  - - [18110, 66, 1, 66]
    - [89, 12.092]
  - - [35006, 66, 1, 66]
    - [89, 12.427]
  - - [42464, 32, 1, 32]
    - [188, 8.671]
  - - [8704, 124, 1, 132]
    - [63, 23.692]
  - - [19680, 96, 1, 96]
    - [61, 23.155]
  - - [26496, 192, 1, 192]
    - [24, 45.333]
  - - [36096, 58, 1, 66]
    - [61, 16.921]
  - - [10720, 32, 1, 32]
    - [113, 5.048]
  - - [1760, 32, 1, 32]
    - [106, 1.098]
  - - [9948, 30, 1, 36]
    - [106, 4.525]
  - - [31712, 32, 1, 32]
    - [126, 7.784]
  - - [44288, 128, 1, 128]
    - [3, 32.57]
  - - [31708, 30, 1, 36]
    - [128, 7.212]
  - - [19258, 58, 1, 66]
    - [209, 14.018]
  - - [42460, 30, 1, 36]
    - [91, 8.073]
  - - [36928, 64, 1, 64]
    - [132, 18.374]
  - - [1584, 48, 1, 48]
    - [85, 1.935]
  - - [13056, 192, 1, 192]
    - [29, 42.697]
  - - [28570, 30, 1, 36]
    - [126, 7.023]
  - - [23520, 96, 1, 96]
    - [117, 22.201]
  - - [23040, 96, 1, 96]
    - [141, 26.507]
  - - [21050, 58, 1, 66]
    - [209, 14.883]
  - - [43808, 32, 1, 32]
    - [172, 9.065]
  - - [9984, 192, 1, 192]
    - [12, 36.058]
  - - [14304, 32, 1, 32]
    - [126, 6.287]
  - - [8192, 30, 1, 36]
    - [106, 3.948]
  - - [35136, 64, 1, 64]
    - [117, 18.425]
  - - [40668, 30, 1, 36]
    - [92, 7.824]
  - - [26912, 32, 1, 32]
    - [253, 8.746]
  - - [9952, 32, 1, 32]
    - [216, 4.992]
  - - [12816, 48, 1, 48]
    - [89, 9.177]
  - - [42336, 32, 1, 32]
    - [275, 8.801]
  - - [36720, 48, 1, 48]
    - [119, 12.501]
  - - [3072, 30, 1, 36]
    - [66, 1.643]
  - - [6714, 58, 1, 66]
    - [116, 8.979]
  - - [7072, 32, 1, 32]
    - [200, 3.626]
  - - [25088, 128, 1, 128]
    - [7, 34.754]
  - - [13056, 58, 1, 66]
    - [77, 13.407]
  - - [6592, 64, 1, 64]
    - [233, 10.864]
  - - [11520, 58, 1, 66]
    - [179, 11.69]
  - - [1920, 96, 1, 96]
    - [233, 7.249]
  - - [5616, 48, 1, 48]
    - [137, 5.717]
  - - [36410, 58, 1, 66]
    - [119, 16.23]
  - - [13920, 32, 1, 32]
    - [126, 6.237]
  - - [28192, 32, 1, 32]
    - [278, 7.564]
  - - [30720, 66, 1, 66]
    - [101, 14.359]
  - - [13376, 64, 1, 64]
    - [225, 15.627]
  - - [19584, 96, 1, 96]
    - [81, 23.306]
  - - [8288, 32, 1, 32]
    - [136, 4.448]
  - - [3808, 32, 1, 32]
    - [204, 2.117]
  - - [32856, 30, 1, 36]
    - [116, 7.508]
  - - [5888, 124, 1, 132]
    - [73, 20.391]
  - - [33280, 58, 1, 66]
    - [61, 16.127]
  - - [28176, 48, 1, 48]
    - [135, 11.209]
  - - [37728, 96, 1, 96]
    - [198, 24.033]
  - - [8832, 96, 1, 96]
    - [70, 18.62]
  - - [42204, 30, 1, 36]
    - [77, 8.087]
  - - [38784, 192, 1, 192]
    - [24, 45.567]
  - - [39132, 30, 1, 36]
    - [92, 7.806]
  - - [37632, 48, 1, 48]
    - [81, 12.326]
  - - [23776, 32, 1, 32]
    - [177, 8.25]
  - - [34392, 30, 1, 36]
    - [77, 7.714]
  - - [12128, 32, 1, 32]
    - [126, 5.892]
  - - [30778, 58, 1, 66]
    - [90, 14.667]
  - - [32958, 66, 1, 66]
    - [236, 12.139]
  - - [42768, 48, 1, 48]
    - [130, 11.748]
  - - [19800, 30, 1, 36]
    - [93, 7.529]
  - - [15456, 32, 1, 32]
    - [92, 6.859]
  - - [10584, 30, 1, 36]
    - [106, 4.86]
  - - [3518, 66, 1, 66]
    - [106, 6.005]
  - - [25088, 58, 1, 66]
    - [61, 15.625]
  - - [35904, 64, 1, 64]
    - [198, 18.158]
  - - [288, 96, 1, 96]
    - [80, 1.359]
  - - [15792, 48, 1, 48]
    - [189, 9.533]
  - - [3262, 66, 1, 66]
    - [200, 5.717]
  - - [40704, 66, 1, 66]
    - [70, 15.249]
  - - [40960, 66, 1, 66]
    - [279, 14.754]
  - - [6554, 30, 1, 36]
    - [98, 3.222]
  - - [25584, 48, 1, 48]
    - [209, 11.209]
  - - [13568, 124, 1, 132]
    - [59, 29.523]
  - - [26592, 32, 1, 32]
    - [280, 8.642]
  - - [21914, 30, 1, 36]
    - [179, 7.206]
  - - [35226, 30, 1, 36]
    - [91, 7.487]
  - - [15808, 64, 1, 64]
    - [132, 14.964]
  - - [5856, 32, 1, 32]
    - [165, 3.217]
  - - [32640, 192, 1, 192]
    - [28, 44.229]
  - - [14736, 48, 1, 48]
    - [281, 8.793]
  - - [40992, 32, 1, 32]
    - [89, 8.758]
  - - [25952, 32, 1, 32]
    - [253, 8.434]
  - - [7648, 32, 1, 32]
    - [126, 3.966]
  - - [31920, 48, 1, 48]
    - [130, 11.389]
  - - [38736, 48, 1, 48]
    - [135, 12.728]
  - - [35738, 30, 1, 36]
    - [88, 7.498]
  - - [17722, 58, 1, 66]
    - [209, 13.351]
  - - [6656, 66, 1, 66]
    - [77, 9.679]
  - - [32, 32, 1, 32]
    - [187, 0.021]
  - - [3072, 48, 1, 48]
    - [140, 3.544]
  - - [41728, 124, 1, 132]
    - [282, 33.026]
  - - [9216, 124, 1, 132]
    - [65, 25.272]
  - - [1120, 32, 1, 32]
    - [85, 0.749]
  - - [9018, 58, 1, 66]
    - [161, 10.803]
  - - [16896, 96, 1, 96]
    - [117, 21.329]
  - - [41696, 32, 1, 32]
    - [264, 8.629]
  - - [4250, 30, 1, 36]
    - [85, 2.201]
  - - [13680, 48, 1, 48]
    - [77, 10.003]
  - - [11008, 58, 1, 66]
    - [116, 11.509]
  - - [14240, 32, 1, 32]
    - [216, 6.259]
  - - [37584, 48, 1, 48]
    - [135, 12.548]
  - - [36320, 32, 1, 32]
    - [101, 8.058]
  - - [6144, 96, 1, 96]
    - [70, 16.678]
  - - [28218, 58, 1, 66]
    - [130, 14.887]
  - - [5976, 30, 1, 36]
    - [257, 2.909]
  - - [26064, 48, 1, 48]
    - [219, 11.276]
  - - [13056, 128, 1, 128]
    - [75, 31.921]
  - - [23072, 32, 1, 32]
    - [222, 8.127]
  - - [11616, 32, 1, 32]
    - [126, 5.643]
  - - [34560, 30, 1, 36]
    - [114, 7.787]
  - - [2400, 32, 1, 32]
    - [103, 1.477]
  - - [1472, 64, 1, 64]
    - [194, 2.954]
  - - [21248, 124, 1, 132]
    - [199, 28.497]
  - - [1872, 48, 1, 48]
    - [85, 2.287]
  - - [35386, 58, 1, 66]
    - [130, 15.981]
  - - [24912, 48, 1, 48]
    - [155, 11.007]
  - - [42816, 64, 1, 64]
    - [184, 18.64]
  - - [21724, 30, 1, 36]
    - [88, 7.394]
  - - [1920, 192, 1, 192]
    - [77, 19.1]
  - - [42784, 32, 1, 32]
    - [283, 8.698]
  - - [2304, 124, 1, 132]
    - [106, 12.14]
  - - [11744, 32, 1, 32]
    - [126, 5.705]
  - - [6620, 30, 1, 36]
    - [167, 3.322]
  - - [36864, 128, 1, 128]
    - [26, 33.48]
  - - [27450, 58, 1, 66]
    - [284, 15.944]
  - - [14976, 48, 1, 48]
    - [126, 8.785]
  - - [8496, 48, 1, 48]
    - [113, 7.671]
  - - [29152, 32, 1, 32]
    - [161, 7.558]
  - - [5120, 128, 1, 128]
    - [99, 20.325]
  - - [1056, 96, 1, 96]
    - [86, 4.386]
  - - [40762, 58, 1, 66]
    - [135, 16.664]
  - - [9662, 66, 1, 66]
    - [63, 9.828]
  - - [16984, 30, 1, 36]
    - [93, 7.006]
  - - [16896, 192, 1, 192]
    - [24, 38.663]
  - - [36864, 30, 1, 36]
    - [145, 8.046]
  - - [22496, 32, 1, 32]
    - [179, 7.986]
  - - [7936, 30, 1, 36]
    - [112, 3.941]
  - - [16092, 30, 1, 36]
    - [106, 6.473]
  - - [41984, 66, 1, 66]
    - [101, 15.377]
  - - [18144, 32, 1, 32]
    - [93, 7.345]
  - - [34048, 30, 1, 36]
    - [145, 7.78]
  - - [30808, 30, 1, 36]
    - [106, 7.315]
  - - [19728, 48, 1, 48]
    - [155, 10.838]
  - - [20512, 32, 1, 32]
    - [177, 7.759]
  - - [20976, 48, 1, 48]
    - [148, 11.112]
  - - [27488, 32, 1, 32]
    - [179, 8.629]
  - - [7482, 58, 1, 66]
    - [88, 9.154]
  - - [8864, 32, 1, 32]
    - [165, 4.596]
  - - [25568, 32, 1, 32]
    - [111, 8.428]
  - - [5664, 96, 1, 96]
    - [89, 15.376]
  - - [22336, 64, 1, 64]
    - [65, 17.324]
  - - [21248, 58, 1, 66]
    - [65, 13.991]
  - - [12528, 48, 1, 48]
    - [101, 9.226]
  - - [16062, 66, 1, 66]
    - [70, 11.383]
  - - [11616, 96, 1, 96]
    - [75, 18.7]
  - - [3744, 32, 1, 32]
    - [200, 2.215]
  - - [20736, 30, 1, 36]
    - [93, 7.261]
  - - [8416, 32, 1, 32]
    - [126, 4.176]
  - - [5952, 64, 1, 64]
    - [71, 9.898]
  - - [24544, 32, 1, 32]
    - [177, 8.267]
  - - [36608, 58, 1, 66]
    - [61, 16.886]
  - - [28672, 66, 1, 66]
    - [89, 13.932]
  - - [720, 48, 1, 48]
    - [261, 0.89]
  - - [21648, 48, 1, 48]
    - [102, 10.406]
  - - [26112, 124, 1, 132]
    - [199, 32.869]
  - - [14208, 192, 1, 192]
    - [12, 32.647]
  - - [35072, 58, 1, 66]
    - [81, 16.9]
  - - [7776, 32, 1, 32]
    - [126, 4.032]
  - - [36864, 192, 1, 192]
    - [22, 43.342]
  - - [10240, 58, 1, 66]
    - [77, 12.1]
  - - [23648, 32, 1, 32]
    - [177, 8.205]
  - - [13502, 66, 1, 66]
    - [75, 11.231]
  - - [42960, 48, 1, 48]
    - [90, 11.801]
  - - [13488, 48, 1, 48]
    - [77, 9.337]
  - - [31872, 192, 1, 192]
    - [12, 44.383]
  - - [38400, 58, 1, 66]
    - [81, 17.525]
  - - [10394, 30, 1, 36]
    - [126, 4.684]
  - - [12352, 64, 1, 64]
    - [89, 15.099]
  - - [41792, 64, 1, 64]
    - [238, 18.954]
  - - [37084, 30, 1, 36]
    - [93, 7.648]
  - - [22528, 66, 1, 66]
    - [89, 13.241]
  - - [10496, 58, 1, 66]
    - [128, 12.318]
  - - [38334, 66, 1, 66]
    - [97, 12.864]
  - - [40736, 32, 1, 32]
    - [263, 8.584]
  - - [11264, 128, 1, 128]
    - [59, 29.598]
  - - [27424, 32, 1, 32]
    - [195, 8.728]
  - - [31934, 66, 1, 66]
    - [101, 12.588]
  - - [27168, 96, 1, 96]
    - [238, 24.854]
  - - [28380, 30, 1, 36]
    - [126, 7.309]
  - - [37888, 66, 1, 66]
    - [70, 15.179]
  - - [23424, 96, 1, 96]
    - [141, 26.294]
  - - [9370, 30, 1, 36]
    - [166, 4.344]
  - - [25392, 48, 1, 48]
    - [189, 11.219]
  - - [21760, 30, 1, 36]
    - [88, 7.458]
  - - [4352, 66, 1, 66]
    - [106, 7.24]
  - - [14592, 66, 1, 66]
    - [89, 12.401]
  - - [36440, 30, 1, 36]
    - [161, 7.779]
  - - [7968, 32, 1, 32]
    - [216, 4.086]
  - - [35994, 30, 1, 36]
    - [159, 7.487]
  - - [40752, 48, 1, 48]
    - [119, 12.861]
  - - [17210, 58, 1, 66]
    - [209, 13.434]
  - - [21504, 128, 1, 128]
    - [15, 32.47]
  - - [17120, 32, 1, 32]
    - [92, 7.183]
  - - [38816, 32, 1, 32]
    - [89, 8.449]
  - - [14448, 48, 1, 48]
    - [102, 9.037]
  - - [34560, 66, 1, 66]
    - [70, 14.977]
  - - [1536, 58, 1, 66]
    - [66, 2.76]
  - - [4512, 96, 1, 96]
    - [71, 14.09]
  - - [41760, 32, 1, 32]
    - [101, 8.8]
  - - [28896, 96, 1, 96]
    - [198, 22.349]
  - - [20794, 58, 1, 66]
    - [189, 14.702]
  - - [34144, 32, 1, 32]
    - [93, 7.998]
  - - [7768, 30, 1, 36]
    - [167, 3.858]
  - - [21248, 128, 1, 128]
    - [32, 32.018]
  - - [40704, 192, 1, 192]
    - [29, 47.189]
  - - [33088, 64, 1, 64]
    - [132, 18.452]
  - - [15770, 30, 1, 36]
    - [88, 6.24]
  - - [39936, 66, 1, 66]
    - [70, 15.193]
  - - [15312, 48, 1, 48]
    - [189, 9.244]
  - - [5712, 48, 1, 48]
    - [126, 5.758]
  - - [18464, 32, 1, 32]
    - [88, 7.475]
  - - [3024, 48, 1, 48]
    - [60, 3.413]
  - - [19104, 32, 1, 32]
    - [88, 7.471]
  - - [37786, 30, 1, 36]
    - [93, 7.6]
  - - [19712, 58, 1, 66]
    - [73, 14.85]
  - - [31296, 64, 1, 64]
    - [198, 17.997]
  - - [5344, 32, 1, 32]
    - [204, 2.936]
  - - [37776, 48, 1, 48]
    - [130, 12.452]
  - - [1244, 30, 1, 36]
    - [66, 0.696]
  - - [33244, 30, 1, 36]
    - [92, 7.456]
  - - [19552, 32, 1, 32]
    - [115, 7.582]
  - - [40224, 32, 1, 32]
    - [100, 8.634]
  - - [2784, 32, 1, 32]
    - [165, 1.669]
  - - [21552, 48, 1, 48]
    - [231, 10.408]
  - - [42016, 32, 1, 32]
    - [99, 8.734]
  - - [32732, 30, 1, 36]
    - [91, 7.081]
  - - [37344, 32, 1, 32]
    - [70, 8.206]
  - - [33792, 192, 1, 192]
    - [24, 46.627]
  - - [31576, 30, 1, 36]
    - [92, 7.353]
  - - [22752, 96, 1, 96]
    - [89, 21.723]
  - - [22842, 58, 1, 66]
    - [219, 14.814]
  - - [5376, 192, 1, 192]
    - [63, 29.379]
  - - [41504, 32, 1, 32]
    - [70, 8.826]
  - - [3584, 30, 1, 36]
    - [60, 1.876]
  - - [26010, 30, 1, 36]
    - [93, 7.912]
  - - [42810, 58, 1, 66]
    - [90, 15.227]
  - - [27712, 64, 1, 64]
    - [198, 19.016]
  - - [20496, 48, 1, 48]
    - [189, 11.201]
  - - [32880, 48, 1, 48]
    - [254, 12.237]
  - - [23354, 58, 1, 66]
    - [130, 15.203]
  - - [10496, 30, 1, 36]
    - [115, 4.865]
  - - [39504, 48, 1, 48]
    - [90, 12.699]
  - - [38112, 32, 1, 32]
    - [101, 8.415]
  - - [37008, 48, 1, 48]
    - [135, 12.436]
  - - [14394, 58, 1, 66]
    - [209, 11.713]
  - - [4512, 32, 1, 32]
    - [133, 2.479]
  - - [30464, 128, 1, 128]
    - [32, 29.365]
  - - [41664, 64, 1, 64]
    - [178, 19.67]
  - - [992, 32, 1, 32]
    - [136, 0.636]
  - - [42672, 48, 1, 48]
    - [135, 11.722]
  - - [11776, 58, 1, 66]
    - [163, 11.811]
  - - [8448, 96, 1, 96]
    - [89, 18.763]
  - - [1008, 48, 1, 48]
    - [80, 1.276]
  - - [24254, 66, 1, 66]
    - [153, 13.337]
  - - [2912, 32, 1, 32]
    - [173, 1.68]
  - - [41816, 30, 1, 36]
    - [161, 8.273]
  - - [43228, 30, 1, 36]
    - [159, 8.155]
  - - [24128, 64, 1, 64]
    - [184, 18.253]
  - - [10816, 64, 1, 64]
    - [163, 13.4]
  - - [27168, 32, 1, 32]
    - [230, 8.707]
  - - [32736, 32, 1, 32]
    - [77, 7.708]
  - - [40960, 124, 1, 132]
    - [274, 31.771]
  - - [28058, 30, 1, 36]
    - [88, 7.94]
  - - [29184, 30, 1, 36]
    - [126, 7.36]
  - - [40704, 48, 1, 48]
    - [61, 13.166]
  - - [33624, 30, 1, 36]
    - [88, 7.647]
  - - [39408, 48, 1, 48]
    - [254, 12.708]
  - - [35160, 30, 1, 36]
    - [77, 7.674]
  - - [11520, 124, 1, 132]
    - [59, 27.149]
  - - [27392, 30, 1, 36]
    - [285, 8.23]
  - - [36624, 48, 1, 48]
    - [154, 12.468]
  - - [31392, 32, 1, 32]
    - [93, 7.831]
  - - [34304, 124, 1, 132]
    - [81, 31.909]
  - - [922, 30, 1, 36]
    - [267, 0.516]
  - - [31166, 66, 1, 66]
    - [89, 12.236]
  - - [18848, 32, 1, 32]
    - [88, 7.189]
  - - [3424, 32, 1, 32]
    - [85, 1.904]
  - - [43776, 66, 1, 66]
    - [101, 15.13]
  - - [9816, 30, 1, 36]
    - [270, 4.684]
  - - [7102, 66, 1, 66]
    - [101, 8.88]
  - - [35584, 58, 1, 66]
    - [81, 16.865]
  - - [864, 32, 1, 32]
    - [173, 0.57]
  - - [10686, 66, 1, 66]
    - [101, 9.667]
  - - [8090, 30, 1, 36]
    - [166, 3.898]
  - - [960, 64, 1, 64]
    - [80, 2.135]
  - - [20352, 48, 1, 48]
    - [209, 10.837]
  - - [42944, 64, 1, 64]
    - [134, 18.919]
  - - [14880, 96, 1, 96]
    - [89, 20.0]
  - - [3840, 128, 1, 128]
    - [70, 16.581]
  - - [43162, 30, 1, 36]
    - [88, 7.898]
  - - [36572, 30, 1, 36]
    - [159, 7.607]
  - - [13312, 66, 1, 66]
    - [75, 11.719]
  - - [96, 96, 1, 96]
    - [85, 0.469]
  - - [23456, 32, 1, 32]
    - [111, 8.139]
  - - [10128, 48, 1, 48]
    - [77, 9.065]
  - - [24608, 32, 1, 32]
    - [179, 8.35]
  - - [31152, 48, 1, 48]
    - [135, 11.552]
  - - [2688, 96, 1, 96]
    - [200, 9.793]
  - - [19354, 30, 1, 36]
    - [88, 6.978]
  - - [12288, 66, 1, 66]
    - [75, 11.378]
  - - [5280, 96, 1, 96]
    - [89, 14.62]
  - - [38448, 48, 1, 48]
    - [90, 12.674]
  - - [28032, 96, 1, 96]
    - [122, 28.747]
  - - [28416, 30, 1, 36]
    - [115, 7.517]
  - - [3898, 58, 1, 66]
    - [106, 5.899]
  - - [18336, 96, 1, 96]
    - [81, 22.333]
  - - [5530, 30, 1, 36]
    - [112, 2.719]
  - - [2928, 48, 1, 48]
    - [137, 3.134]
  - - [15392, 32, 1, 32]
    - [126, 6.458]
  - - [37566, 66, 1, 66]
    - [97, 12.737]
  - - [6400, 58, 1, 66]
    - [88, 8.833]
  - - [1184, 32, 1, 32]
    - [166, 0.749]
  - - [42576, 48, 1, 48]
    - [90, 11.789]
  - - [19264, 64, 1, 64]
    - [63, 16.933]
  - - [14944, 32, 1, 32]
    - [115, 6.445]
  - - [1368, 30, 1, 36]
    - [66, 0.774]
  - - [23128, 30, 1, 36]
    - [93, 7.872]
  - - [42174, 66, 1, 66]
    - [97, 13.707]
  - - [33344, 64, 1, 64]
    - [286, 18.595]
  - - [28636, 30, 1, 36]
    - [115, 7.111]
  - - [36352, 128, 1, 128]
    - [3, 33.384]
  - - [16672, 32, 1, 32]
    - [126, 6.994]
  - - [42496, 66, 1, 66]
    - [89, 15.058]
  - - [15696, 48, 1, 48]
    - [209, 9.366]
  - - [33984, 64, 1, 64]
    - [184, 18.726]
  - - [36432, 48, 1, 48]
    - [135, 12.652]
  - - [26432, 64, 1, 64]
    - [63, 18.623]
  - - [38876, 30, 1, 36]
    - [91, 7.787]
  - - [31968, 96, 1, 96]
    - [99, 23.334]
  - - [25760, 32, 1, 32]
    - [179, 8.431]
  - - [9184, 32, 1, 32]
    - [115, 4.709]
  - - [10204, 30, 1, 36]
    - [167, 4.598]
  - - [42000, 48, 1, 48]
    - [287, 12.902]
  - - [27034, 30, 1, 36]
    - [92, 7.974]
  - - [15648, 32, 1, 32]
    - [91, 6.749]
  - - [37216, 32, 1, 32]
    - [288, 8.217]
  - - [37632, 192, 1, 192]
    - [9, 44.72]
  - - [3888, 48, 1, 48]
    - [85, 4.205]
  - - [36608, 66, 1, 66]
    - [70, 15.003]
  - - [12768, 32, 1, 32]
    - [200, 5.952]
  - - [11520, 128, 1, 128]
    - [61, 30.163]
  - - [41952, 96, 1, 96]
    - [238, 24.75]
  - - [38304, 32, 1, 32]
    - [89, 8.299]
  - - [24576, 192, 1, 192]
    - [12, 42.887]
  - - [15840, 96, 1, 96]
    - [101, 21.291]
  - - [5376, 30, 1, 36]
    - [191, 2.784]
  - - [25600, 66, 1, 66]
    - [117, 14.652]
  - - [26112, 96, 1, 96]
    - [79, 27.88]
  - - [13246, 66, 1, 66]
    - [59, 11.112]
  - - [15120, 48, 1, 48]
    - [155, 9.401]
  - - [1536, 48, 1, 48]
    - [85, 1.876]
  - - [35568, 48, 1, 48]
    - [135, 12.27]
  - - [22360, 30, 1, 36]
    - [91, 7.773]
  - - [39424, 58, 1, 66]
    - [117, 17.711]
  - - [32736, 96, 1, 96]
    - [81, 22.623]
  - - [6970, 58, 1, 66]
    - [93, 9.249]
  - - [25152, 64, 1, 64]
    - [121, 18.497]
  - - [160, 32, 1, 32]
    - [86, 0.105]
  - - [20480, 58, 1, 66]
    - [197, 15.295]
  - - [34494, 66, 1, 66]
    - [89, 12.402]
  - - [28832, 32, 1, 32]
    - [77, 7.647]
  - - [22272, 124, 1, 132]
    - [110, 29.762]
  - - [35548, 30, 1, 36]
    - [93, 7.656]
  - - [37690, 58, 1, 66]
    - [119, 16.545]
  - - [32192, 64, 1, 64]
    - [132, 18.512]
  - - [29784, 30, 1, 36]
    - [106, 7.321]
  - - [14064, 48, 1, 48]
    - [289, 10.002]
  - - [34048, 128, 1, 128]
    - [7, 32.189]
  - - [11520, 48, 1, 48]
    - [92, 8.86]
  - - [19488, 96, 1, 96]
    - [81, 23.597]
  - - [16608, 96, 1, 96]
    - [198, 20.776]
  - - [40126, 66, 1, 66]
    - [97, 13.172]
  - - [3392, 64, 1, 64]
    - [166, 6.455]
  - - [3292, 30, 1, 36]
    - [187, 1.705]
  - - [35360, 32, 1, 32]
    - [101, 8.241]
  - - [36000, 32, 1, 32]
    - [188, 7.987]
  - - [44160, 96, 1, 96]
    - [95, 26.277]
  - - [20224, 58, 1, 66]
    - [134, 15.038]
  - - [28512, 32, 1, 32]
    - [264, 7.74]
  - - [27104, 32, 1, 32]
    - [179, 8.626]
  - - [17152, 124, 1, 132]
    - [61, 28.886]
  - - [8192, 124, 1, 132]
    - [65, 22.054]
  - - [14906, 58, 1, 66]
    - [155, 11.689]
  - - [23040, 48, 1, 48]
    - [101, 11.024]
  - - [17808, 48, 1, 48]
    - [175, 9.783]
  - - [9728, 124, 1, 132]
    - [73, 25.628]
  - - [27584, 64, 1, 64]
    - [65, 18.789]
  - - [36096, 48, 1, 48]
    - [81, 12.051]
  - - [16848, 48, 1, 48]
    - [169, 9.996]
  - - [2784, 96, 1, 96]
    - [106, 9.968]
  - - [43712, 64, 1, 64]
    - [184, 18.678]
  - - [43674, 30, 1, 36]
    - [116, 7.902]
  - - [19776, 64, 1, 64]
    - [63, 17.467]
  - - [21888, 192, 1, 192]
    - [12, 39.439]
  - - [2750, 66, 1, 66]
    - [137, 4.864]
  - - [23264, 32, 1, 32]
    - [179, 8.195]
  - - [34458, 30, 1, 36]
    - [77, 7.589]
  - - [2736, 48, 1, 48]
    - [60, 3.122]
  - - [36096, 128, 1, 128]
    - [7, 33.19]
  - - [32512, 66, 1, 66]
    - [99, 14.808]
  - - [1690, 30, 1, 36]
    - [267, 0.924]
  - - [12608, 64, 1, 64]
    - [89, 15.312]
  - - [25408, 64, 1, 64]
    - [65, 18.686]
  - - [32666, 30, 1, 36]
    - [93, 7.098]
  - - [39024, 48, 1, 48]
    - [287, 12.823]
  - - [21950, 66, 1, 66]
    - [125, 12.599]
  - - [17984, 64, 1, 64]
    - [132, 16.434]
  - - [26266, 30, 1, 36]
    - [88, 7.99]
  - - [34304, 128, 1, 128]
    - [26, 32.225]
  - - [17050, 30, 1, 36]
    - [92, 6.586]
  - - [40384, 64, 1, 64]
    - [178, 19.773]
  - - [17040, 48, 1, 48]
    - [231, 10.053]
  - - [42042, 58, 1, 66]
    - [130, 16.986]
  - - [26976, 96, 1, 96]
    - [123, 24.251]
  - - [30240, 96, 1, 96]
    - [84, 23.173]
  - - [25600, 128, 1, 128]
    - [30, 35.134]
  - - [5888, 66, 1, 66]
    - [77, 8.757]
  - - [5632, 66, 1, 66]
    - [70, 8.57]
  - - [20444, 30, 1, 36]
    - [88, 7.263]
  - - [13600, 32, 1, 32]
    - [115, 6.214]
  - - [37248, 48, 1, 48]
    - [81, 12.239]
  - - [24576, 66, 1, 66]
    - [117, 14.19]
  - - [41472, 96, 1, 96]
    - [141, 28.099]
  - - [43776, 192, 1, 192]
    - [29, 44.562]
  - - [22432, 32, 1, 32]
    - [156, 8.025]
  - - [15984, 48, 1, 48]
    - [231, 9.43]
  - - [23584, 32, 1, 32]
    - [277, 8.183]
  - - [9216, 58, 1, 66]
    - [77, 11.041]
  - - [6816, 96, 1, 96]
    - [161, 17.054]
  - - [21984, 96, 1, 96]
    - [236, 21.586]
  - - [23136, 32, 1, 32]
    - [253, 8.15]
  - - [20416, 64, 1, 64]
    - [65, 17.529]
  - - [37088, 32, 1, 32]
    - [99, 8.268]
  - - [13400, 30, 1, 36]
    - [115, 5.671]
  - - [14880, 32, 1, 32]
    - [115, 6.478]
  - - [36544, 64, 1, 64]
    - [81, 18.331]
  - - [16704, 64, 1, 64]
    - [132, 15.732]
  - - [1104, 48, 1, 48]
    - [86, 1.381]
  - - [4224, 192, 1, 192]
    - [65, 30.643]
  - - [15104, 58, 1, 66]
    - [155, 12.008]
  - - [13312, 124, 1, 132]
    - [59, 29.138]
  - - [2720, 32, 1, 32]
    - [216, 1.63]
  - - [1856, 64, 1, 64]
    - [166, 3.684]
  - - [34592, 32, 1, 32]
    - [283, 8.022]
  - - [14912, 64, 1, 64]
    - [198, 14.412]
  - - [768, 48, 1, 48]
    - [66, 1.063]
  - - [12032, 128, 1, 128]
    - [96, 30.218]
  - - [4828, 30, 1, 36]
    - [86, 2.398]
  - - [40280, 30, 1, 36]
    - [77, 8.035]
  - - [23840, 32, 1, 32]
    - [93, 8.21]
  - - [4544, 64, 1, 64]
    - [71, 8.388]
  - - [26302, 66, 1, 66]
    - [153, 13.917]
  - - [39984, 48, 1, 48]
    - [90, 12.657]
  - - [4656, 48, 1, 48]
    - [126, 4.786]
  - - [34304, 58, 1, 66]
    - [81, 16.484]
  - - [36096, 192, 1, 192]
    - [24, 42.681]
  - - [22784, 66, 1, 66]
    - [70, 13.391]
  - - [19872, 96, 1, 96]
    - [61, 23.249]
  - - [988, 30, 1, 36]
    - [66, 0.546]
  - - [25120, 32, 1, 32]
    - [143, 8.34]
  - - [30400, 64, 1, 64]
    - [232, 17.536]
  - - [7168, 30, 1, 36]
    - [112, 3.489]
  - - [42720, 32, 1, 32]
    - [101, 9.085]
  - - [3600, 48, 1, 48]
    - [290, 3.776]
  - - [29184, 58, 1, 66]
    - [61, 14.593]
  - - [3264, 64, 1, 64]
    - [106, 6.025]
  - - [16752, 48, 1, 48]
    - [189, 9.663]
  - - [40176, 48, 1, 48]
    - [119, 12.641]
  - - [30552, 30, 1, 36]
    - [161, 7.289]
  - - [30428, 30, 1, 36]
    - [115, 7.224]
  - - [9728, 30, 1, 36]
    - [106, 4.597]
  - - [43484, 30, 1, 36]
    - [93, 8.267]
  - - [21728, 32, 1, 32]
    - [179, 7.713]
  - - [5690, 58, 1, 66]
    - [126, 8.046]
  - - [6048, 32, 1, 32]
    - [165, 3.284]
  - - [28672, 58, 1, 66]
    - [90, 14.296]
  - - [30910, 66, 1, 66]
    - [70, 12.258]
  - - [40080, 48, 1, 48]
    - [130, 12.766]
  - - [17752, 30, 1, 36]
    - [88, 7.082]
  - - [25344, 48, 1, 48]
    - [70, 11.343]
  - - [5888, 58, 1, 66]
    - [93, 8.395]
  - - [37976, 30, 1, 36]
    - [93, 7.865]
  - - [8688, 48, 1, 48]
    - [92, 7.845]
  - - [36352, 58, 1, 66]
    - [81, 16.768]
  - - [12000, 96, 1, 96]
    - [96, 19.393]
  - - [33434, 30, 1, 36]
    - [161, 7.499]
  - - [26076, 30, 1, 36]
    - [92, 8.084]
  - - [30208, 66, 1, 66]
    - [99, 14.187]
  - - [36286, 66, 1, 66]
    - [70, 12.475]
  - - [35296, 32, 1, 32]
    - [91, 7.985]
  - - [64, 64, 1, 64]
    - [187, 0.151]
  - - [17152, 128, 1, 128]
    - [32, 27.294]
  - - [27904, 66, 1, 66]
    - [117, 15.216]
  - - [24576, 124, 1, 132]
    - [199, 32.257]
  - - [41056, 32, 1, 32]
    - [224, 8.812]
  - - [36576, 32, 1, 32]
    - [89, 8.076]
  - - [24064, 128, 1, 128]
    - [30, 34.235]
  - - [8960, 124, 1, 132]
    - [63, 24.389]
  - - [5312, 64, 1, 64]
    - [106, 9.251]
  - - [26640, 48, 1, 48]
    - [249, 11.671]
  - - [41824, 32, 1, 32]
    - [99, 8.733]
  - - [25088, 66, 1, 66]
    - [117, 14.528]
  - - [26880, 30, 1, 36]
    - [77, 8.177]
  - - [4224, 48, 1, 48]
    - [127, 4.569]
  - - [40192, 124, 1, 132]
    - [69, 32.331]
  - - [21504, 124, 1, 132]
    - [110, 28.684]
  - - [44112, 48, 1, 48]
    - [90, 11.774]
  - - [4952, 30, 1, 36]
    - [85, 2.592]
  - - [6590, 66, 1, 66]
    - [116, 9.24]
  - - [19200, 48, 1, 48]
    - [102, 10.894]
  - - [20384, 32, 1, 32]
    - [116, 7.774]
  - - [18864, 48, 1, 48]
    - [169, 10.762]
  - - [11966, 66, 1, 66]
    - [99, 10.125]
  - - [13722, 30, 1, 36]
    - [106, 5.808]
  - - [11520, 96, 1, 96]
    - [75, 19.371]
  - - [27480, 30, 1, 36]
    - [93, 8.519]
  - - [32608, 32, 1, 32]
    - [161, 7.757]
  - - [15872, 66, 1, 66]
    - [101, 12.364]
  - - [26560, 64, 1, 64]
    - [84, 19.077]
  - - [20256, 96, 1, 96]
    - [81, 23.632]
  - - [7424, 128, 1, 128]
    - [291, 22.283]
  - - [35680, 32, 1, 32]
    - [92, 8.151]
  - - [29952, 66, 1, 66]
    - [70, 14.272]
  - - [25344, 96, 1, 96]
    - [79, 27.412]
  - - [20448, 96, 1, 96]
    - [178, 23.141]
  - - [22816, 32, 1, 32]
    - [91, 8.038]
  - - [14336, 30, 1, 36]
    - [106, 6.121]
  - - [5520, 48, 1, 48]
    - [92, 5.619]
  - - [36528, 48, 1, 48]
    - [292, 12.435]
  - - [13824, 66, 1, 66]
    - [65, 12.169]
  - - [41216, 124, 1, 132]
    - [81, 32.586]
  - - [7200, 32, 1, 32]
    - [200, 3.863]
  - - [33888, 32, 1, 32]
    - [77, 7.979]
  - - [8250, 58, 1, 66]
    - [116, 10.023]
  - - [38176, 32, 1, 32]
    - [247, 8.31]
  - - [2714, 30, 1, 36]
    - [174, 1.452]
  - - [16512, 48, 1, 48]
    - [209, 9.741]
  - - [5376, 128, 1, 128]
    - [63, 21.457]
  - - [9984, 58, 1, 66]
    - [116, 11.638]
  - - [10656, 32, 1, 32]
    - [216, 5.177]
  - - [39968, 32, 1, 32]
    - [236, 8.461]
  - - [24832, 30, 1, 36]
    - [91, 8.004]
  - - [29472, 96, 1, 96]
    - [198, 22.501]
  - - [41280, 64, 1, 64]
    - [117, 20.105]
  - - [856, 30, 1, 36]
    - [170, 0.484]
  - - [8384, 64, 1, 64]
    - [99, 12.282]
  - - [31744, 58, 1, 66]
    - [61, 15.254]
  - - [19968, 128, 1, 128]
    - [45, 32.332]
  - - [42584, 30, 1, 36]
    - [77, 8.291]
  - - [34240, 64, 1, 64]
    - [221, 18.427]
  - - [39888, 48, 1, 48]
    - [90, 12.783]
  - - [4944, 48, 1, 48]
    - [126, 5.292]
  - - [256, 128, 1, 128]
    - [60, 2.077]
  - - [17600, 64, 1, 64]
    - [105, 16.244]
  - - [17888, 32, 1, 32]
    - [88, 7.241]
  - - [29520, 48, 1, 48]
    - [119, 11.146]
  - - [41856, 48, 1, 48]
    - [61, 13.17]
  - - [38016, 48, 1, 48]
    - [81, 12.335]
  - - [14752, 32, 1, 32]
    - [127, 6.363]
  - - [6624, 32, 1, 32]
    - [165, 3.596]
  - - [5596, 30, 1, 36]
    - [248, 2.837]
  - - [31424, 64, 1, 64]
    - [232, 18.07]
  - - [15704, 30, 1, 36]
    - [200, 6.477]
  - - [32922, 30, 1, 36]
    - [92, 7.284]
  - - [6656, 128, 1, 128]
    - [293, 25.074]
  - - [27360, 32, 1, 32]
    - [277, 8.768]
  - - [23856, 48, 1, 48]
    - [131, 10.817]
  - - [30362, 30, 1, 36]
    - [77, 7.071]
  - - [9728, 58, 1, 66]
    - [77, 11.736]
  - - [22206, 66, 1, 66]
    - [125, 12.455]
  - - [32640, 48, 1, 48]
    - [287, 11.488]
  - - [28160, 66, 1, 66]
    - [117, 15.104]
  - - [4704, 96, 1, 96]
    - [116, 12.939]
  - - [37872, 48, 1, 48]
    - [130, 12.563]
  - - [7680, 192, 1, 192]
    - [12, 28.543]
  - - [17466, 58, 1, 66]
    - [102, 13.158]
  - - [2816, 30, 1, 36]
    - [260, 1.523]
  - - [42976, 32, 1, 32]
    - [143, 9.015]
  - - [34618, 58, 1, 66]
    - [119, 15.593]
  - - [20320, 32, 1, 32]
    - [77, 7.562]
  - - [39680, 66, 1, 66]
    - [89, 15.155]
  - - [31064, 30, 1, 36]
    - [115, 7.34]
  - - [31728, 48, 1, 48]
    - [135, 11.36]
  - - [38554, 30, 1, 36]
    - [92, 7.722]
  - - [10554, 58, 1, 66]
    - [116, 11.823]
  - - [7200, 96, 1, 96]
    - [89, 15.906]
  - - [18048, 192, 1, 192]
    - [24, 40.683]
  - - [26976, 32, 1, 32]
    - [277, 8.586]
  - - [704, 64, 1, 64]
    - [86, 1.585]
  - - [33536, 66, 1, 66]
    - [99, 14.928]
  - - [22848, 64, 1, 64]
    - [65, 17.721]
  - - [3312, 48, 1, 48]
    - [85, 3.821]
  - - [42240, 96, 1, 96]
    - [95, 28.115]
  - - [4608, 48, 1, 48]
    - [136, 4.984]
  - - [41376, 32, 1, 32]
    - [99, 8.679]
  - - [8192, 128, 1, 128]
    - [73, 24.489]
  - - [38304, 96, 1, 96]
    - [294, 23.887]
  - - [15936, 64, 1, 64]
    - [184, 15.242]
  - - [832, 64, 1, 64]
    - [295, 1.828]
  - - [13788, 30, 1, 36]
    - [93, 5.736]
  - - [20640, 96, 1, 96]
    - [117, 23.615]
  - - [40320, 192, 1, 192]
    - [9, 46.842]
  - - [26624, 66, 1, 66]
    - [117, 14.848]
  - - [29660, 30, 1, 36]
    - [106, 7.291]
  - - [34524, 30, 1, 36]
    - [93, 7.535]
  - - [24540, 30, 1, 36]
    - [91, 7.91]
  - - [26832, 48, 1, 48]
    - [131, 11.657]
  - - [36480, 48, 1, 48]
    - [81, 12.298]
  - - [1536, 124, 1, 132]
    - [200, 8.519]
  - - [17884, 30, 1, 36]
    - [88, 6.854]
  - - [26256, 48, 1, 48]
    - [124, 11.455]
  - - [40656, 48, 1, 48]
    - [130, 12.87]
  - - [26368, 128, 1, 128]
    - [3, 35.08]
  - - [27904, 30, 1, 36]
    - [177, 8.281]
  - - [15674, 58, 1, 66]
    - [155, 12.695]
  - - [11200, 64, 1, 64]
    - [101, 13.782]
  - - [13920, 96, 1, 96]
    - [59, 21.178]
  - - [10848, 32, 1, 32]
    - [126, 5.326]
  - - [38970, 58, 1, 66]
    - [130, 16.477]
  - - [23552, 124, 1, 132]
    - [265, 31.359]
  - - [190, 66, 1, 66]
    - [296, 0.389]
  - - [16560, 48, 1, 48]
    - [102, 9.826]
  - - [19712, 128, 1, 128]
    - [26, 30.577]
  - - [37968, 48, 1, 48]
    - [119, 12.515]
  - - [1178, 30, 1, 36]
    - [66, 0.667]
  - - [8768, 64, 1, 64]
    - [89, 12.547]
  - - [38560, 32, 1, 32]
    - [188, 8.555]
  - - [43264, 58, 1, 66]
    - [61, 16.772]
  - - [41728, 58, 1, 66]
    - [61, 18.458]
  - - [9600, 96, 1, 96]
    - [83, 18.374]
  - - [14336, 128, 1, 128]
    - [47, 22.521]
  - - [38144, 66, 1, 66]
    - [99, 15.066]
  - - [2016, 32, 1, 32]
    - [166, 1.292]
  - - [30976, 30, 1, 36]
    - [126, 7.614]
  - - [6288, 48, 1, 48]
    - [126, 6.339]
  - - [6400, 128, 1, 128]
    - [293, 24.484]
  - - [36144, 48, 1, 48]
    - [119, 12.51]
  - - [19920, 48, 1, 48]
    - [155, 10.886]
  - - [18264, 30, 1, 36]
    - [92, 7.227]
  - - [11520, 66, 1, 66]
    - [89, 10.925]
  - - [11008, 66, 1, 66]
    - [70, 10.645]
  - - [42384, 48, 1, 48]
    - [292, 11.83]
  - - [31130, 30, 1, 36]
    - [88, 7.147]
  - - [1440, 96, 1, 96]
    - [127, 5.589]
  - - [31744, 30, 1, 36]
    - [129, 7.464]
  - - [29760, 64, 1, 64]
    - [232, 17.384]
  - - [9312, 32, 1, 32]
    - [166, 4.829]
  - - [29184, 128, 1, 128]
    - [48, 31.275]
  - - [42912, 96, 1, 96]
    - [104, 23.955]
  - - [15514, 30, 1, 36]
    - [106, 6.189]
  - - [42752, 124, 1, 132]
    - [61, 30.797]
  - - [5232, 48, 1, 48]
    - [112, 5.275]
  - - [12800, 58, 1, 66]
    - [209, 12.133]
  - - [6432, 32, 1, 32]
    - [106, 3.373]
  - - [40096, 32, 1, 32]
    - [89, 8.527]
  - - [20704, 32, 1, 32]
    - [91, 7.523]
  - - [10840, 30, 1, 36]
    - [112, 4.931]
  - - [12288, 96, 1, 96]
    - [59, 20.414]
  - - [21438, 66, 1, 66]
    - [97, 12.305]
  - - [21024, 96, 1, 96]
    - [123, 23.536]
  - - [42752, 30, 1, 36]
    - [118, 8.493]
  - - [42432, 64, 1, 64]
    - [132, 18.605]
  - - [22528, 124, 1, 132]
    - [265, 30.104]
  - - [22272, 30, 1, 36]
    - [126, 7.476]
  - - [8784, 48, 1, 48]
    - [168, 7.862]
  - - [22016, 30, 1, 36]
    - [93, 7.493]
  - - [31584, 96, 1, 96]
    - [104, 23.636]
  - - [1280, 124, 1, 132]
    - [200, 7.046]
  - - [20312, 30, 1, 36]
    - [91, 7.378]
  - - [27962, 58, 1, 66]
    - [213, 15.973]
  - - [22944, 32, 1, 32]
    - [277, 8.145]
  - - [22104, 30, 1, 36]
    - [92, 7.576]
  - - [224, 32, 1, 32]
    - [297, 0.15]
  - - [4316, 30, 1, 36]
    - [137, 2.188]
  - - [35642, 58, 1, 66]
    - [119, 16.012]
  - - [35552, 32, 1, 32]
    - [116, 8.082]
  - - [48, 48, 1, 48]
    - [60, 0.061]
  - - [32000, 128, 1, 128]
    - [30, 30.409]
  - - [17920, 58, 1, 66]
    - [63, 13.863]
  - - [32256, 192, 1, 192]
    - [9, 45.183]
  - - [28730, 58, 1, 66]
    - [130, 14.04]
  - - [6144, 128, 1, 128]
    - [63, 23.264]
  - - [20736, 58, 1, 66]
    - [155, 14.541]
  - - [8448, 192, 1, 192]
    - [12, 30.914]
  - - [25658, 58, 1, 66]
    - [119, 15.641]
  - - [6656, 30, 1, 36]
    - [137, 3.34]
  - - [36608, 30, 1, 36]
    - [129, 7.99]
  - - [43296, 32, 1, 32]
    - [99, 9.041]
  - - [3520, 64, 1, 64]
    - [71, 6.433]
  - - [26336, 32, 1, 32]
    - [230, 8.559]
  - - [24992, 32, 1, 32]
    - [93, 8.238]
  - - [11280, 48, 1, 48]
    - [91, 8.612]
  - - [2304, 128, 1, 128]
    - [68, 12.791]
  - - [15104, 66, 1, 66]
    - [101, 12.354]
  - - [25200, 48, 1, 48]
    - [119, 11.134]
  - - [27552, 96, 1, 96]
    - [79, 24.609]
  - - [22224, 48, 1, 48]
    - [175, 10.302]
  - - [31964, 30, 1, 36]
    - [92, 7.444]
  - - [11008, 30, 1, 36]
    - [126, 4.915]
  - - [20256, 32, 1, 32]
    - [277, 7.478]
  - - [24730, 30, 1, 36]
    - [111, 7.618]
  - - [13370, 58, 1, 66]
    - [169, 12.673]
  - - [22992, 48, 1, 48]
    - [219, 10.517]
  - - [3488, 32, 1, 32]
    - [136, 2.064]
  - - [27792, 48, 1, 48]
    - [245, 11.731]
  - - [17568, 96, 1, 96]
    - [81, 21.651]
  - - [33760, 32, 1, 32]
    - [298, 7.868]
  - - [31392, 96, 1, 96]
    - [109, 23.62]
  - - [37632, 58, 1, 66]
    - [81, 17.499]
  - - [14336, 58, 1, 66]
    - [155, 11.777]
  - - [16368, 48, 1, 48]
    - [189, 9.548]
  - - [13440, 192, 1, 192]
    - [33, 43.188]
  - - [19968, 58, 1, 66]
    - [197, 14.721]
  - - [2016, 96, 1, 96]
    - [200, 7.543]
  - - [44064, 96, 1, 96]
    - [81, 24.176]
  - - [19040, 32, 1, 32]
    - [92, 7.51]
  - - [18784, 32, 1, 32]
    - [93, 7.346]
  - - [19902, 66, 1, 66]
    - [81, 11.948]
  - - [21980, 30, 1, 36]
    - [88, 7.429]
  - - [1600, 64, 1, 64]
    - [107, 3.176]
  - - [768, 128, 1, 128]
    - [71, 5.251]
  - - [19514, 58, 1, 66]
    - [209, 14.204]
  - - [30048, 96, 1, 96]
    - [84, 23.068]
  - - [33952, 32, 1, 32]
    - [264, 7.953]
  - - [41436, 30, 1, 36]
    - [161, 8.003]
  - - [23486, 66, 1, 66]
    - [149, 13.135]
  - - [14592, 124, 1, 132]
    - [81, 25.149]
  - - [22176, 96, 1, 96]
    - [89, 21.519]
  - - [22800, 48, 1, 48]
    - [89, 10.429]
  - - [34400, 32, 1, 32]
    - [264, 7.977]
  - - [19392, 64, 1, 64]
    - [134, 17.377]
  - - [42240, 192, 1, 192]
    - [22, 48.196]
  - - [34048, 66, 1, 66]
    - [70, 14.853]
  - - [6496, 32, 1, 32]
    - [299, 3.406]
  - - [2752, 64, 1, 64]
    - [166, 5.347]
  - - [33120, 96, 1, 96]
    - [101, 23.635]
  - - [30172, 30, 1, 36]
    - [115, 7.163]
  - - [31744, 124, 1, 132]
    - [123, 29.905]
  - - [10752, 128, 1, 128]
    - [59, 29.08]
  - - [10328, 30, 1, 36]
    - [106, 4.788]
  - - [6078, 66, 1, 66]
    - [89, 8.709]
  - - [16832, 64, 1, 64]
    - [198, 15.692]
  - - [36542, 66, 1, 66]
    - [89, 12.432]
  - - [24320, 124, 1, 132]
    - [300, 31.751]
  - - [14256, 48, 1, 48]
    - [169, 8.971]
  - - [9150, 66, 1, 66]
    - [128, 9.924]
  - - [21536, 32, 1, 32]
    - [230, 7.704]
  - - [2970, 30, 1, 36]
    - [112, 1.49]
  - - [25856, 66, 1, 66]
    - [81, 14.502]
  - - [32160, 96, 1, 96]
    - [109, 23.557]
  - - [9792, 64, 1, 64]
    - [70, 13.098]
  - - [41952, 32, 1, 32]
    - [89, 8.84]
  - - [13568, 66, 1, 66]
    - [63, 11.733]
  - - [26496, 48, 1, 48]
    - [101, 11.657]
  - - [29856, 32, 1, 32]
    - [115, 7.74]
  - - [22330, 58, 1, 66]
    - [90, 14.482]
  - - [26144, 32, 1, 32]
    - [230, 8.618]
  - - [19808, 32, 1, 32]
    - [88, 7.493]
  - - [13200, 48, 1, 48]
    - [128, 9.137]
  - - [36352, 30, 1, 36]
    - [129, 8.006]
  - - [40608, 96, 1, 96]
    - [266, 24.949]
  - - [29616, 48, 1, 48]
    - [90, 11.347]
  - - [19968, 124, 1, 132]
    - [301, 31.406]
  - - [29952, 30, 1, 36]
    - [115, 7.515]
  - - [32544, 32, 1, 32]
    - [269, 7.863]
  - - [5056, 64, 1, 64]
    - [88, 8.888]
  - - [11264, 66, 1, 66]
    - [101, 10.734]
  - - [6688, 32, 1, 32]
    - [200, 3.589]
  - - [34648, 30, 1, 36]
    - [88, 7.771]
  - - [42528, 96, 1, 96]
    - [232, 24.031]
  - - [2362, 58, 1, 66]
    - [136, 3.773]
  - - [10138, 30, 1, 36]
    - [106, 4.655]
  - - [15162, 58, 1, 66]
    - [209, 11.889]
  - - [15836, 30, 1, 36]
    - [92, 6.37]
  - - [39312, 48, 1, 48]
    - [90, 12.756]
  - - [9984, 66, 1, 66]
    - [134, 10.829]
  - - [34560, 96, 1, 96]
    - [95, 25.956]
  - - [13568, 58, 1, 66]
    - [209, 12.652]
  - - [7840, 32, 1, 32]
    - [136, 4.02]
  - - [2848, 32, 1, 32]
    - [103, 1.603]
  - - [32190, 66, 1, 66]
    - [70, 12.588]
  - - [12632, 30, 1, 36]
    - [106, 5.693]
  - - [1728, 64, 1, 64]
    - [233, 3.323]
  - - [39456, 32, 1, 32]
    - [99, 8.589]
  - - [35040, 96, 1, 96]
    - [105, 23.741]
  - - [3456, 48, 1, 48]
    - [66, 3.699]
  - - [21658, 30, 1, 36]
    - [93, 7.027]
  - - [16026, 30, 1, 36]
    - [93, 6.191]
  - - [18768, 48, 1, 48]
    - [148, 10.533]
  - - [22608, 48, 1, 48]
    - [131, 10.387]
  - - [26624, 58, 1, 66]
    - [69, 16.462]
  - - [30432, 96, 1, 96]
    - [104, 23.493]
  - - [34970, 30, 1, 36]
    - [93, 7.598]
  - - [39488, 64, 1, 64]
    - [117, 18.982]
  - - [5472, 96, 1, 96]
    - [89, 14.854]
  - - [36608, 128, 1, 128]
    - [7, 33.915]
  - - [5084, 30, 1, 36]
    - [167, 2.578]
  - - [23520, 32, 1, 32]
    - [277, 8.1]
  - - [27648, 124, 1, 132]
    - [208, 34.567]
  - - [10976, 32, 1, 32]
    - [204, 5.015]
  - - [16288, 32, 1, 32]
    - [92, 6.896]
  - - [6960, 48, 1, 48]
    - [302, 6.511]
  - - [25088, 30, 1, 36]
    - [92, 8.195]
  - - [23808, 96, 1, 96]
    - [95, 26.798]
  - - [1792, 128, 1, 128]
    - [233, 10.585]
  - - [33376, 32, 1, 32]
    - [99, 7.939]
  - - [36666, 58, 1, 66]
    - [135, 15.853]
  - - [26880, 48, 1, 48]
    - [101, 11.777]
  - - [32544, 96, 1, 96]
    - [105, 23.304]
  - - [15360, 192, 1, 192]
    - [33, 35.54]
  - - [8448, 30, 1, 36]
    - [98, 4.031]
  - - [15264, 96, 1, 96]
    - [236, 19.936]
  - - [3136, 64, 1, 64]
    - [126, 5.731]
  - - [5904, 48, 1, 48]
    - [92, 5.729]
  - - [23296, 66, 1, 66]
    - [61, 13.816]
  - - [21120, 96, 1, 96]
    - [141, 24.709]
  - - [27888, 48, 1, 48]
    - [148, 11.819]
  - - [12960, 32, 1, 32]
    - [126, 6.041]
  - - [15258, 30, 1, 36]
    - [88, 6.038]
  - - [13978, 30, 1, 36]
    - [244, 5.717]
  - - [33728, 64, 1, 64]
    - [286, 18.585]
  - - [13536, 32, 1, 32]
    - [115, 5.893]
  - - [5946, 58, 1, 66]
    - [126, 8.339]
  - - [37120, 124, 1, 132]
    - [117, 31.509]
  - - [7328, 32, 1, 32]
    - [204, 3.636]
  - - [39104, 64, 1, 64]
    - [69, 19.352]
  - - [28512, 96, 1, 96]
    - [275, 22.343]
  - - [37568, 64, 1, 64]
    - [61, 18.896]
  - - [20890, 30, 1, 36]
    - [92, 7.16]
  - - [34080, 32, 1, 32]
    - [89, 8.149]
  - - [26496, 96, 1, 96]
    - [207, 27.93]
  - - [24528, 48, 1, 48]
    - [268, 10.884]
  - - [17136, 48, 1, 48]
    - [203, 9.464]
  - - [27136, 30, 1, 36]
    - [111, 8.053]
  - - [28160, 58, 1, 66]
    - [117, 16.247]
  - - [14528, 64, 1, 64]
    - [72, 13.967]
  - - [39392, 32, 1, 32]
    - [70, 8.575]
  - - [12384, 96, 1, 96]
    - [82, 19.556]
  - - [35584, 66, 1, 66]
    - [70, 15.022]
  - - [15744, 96, 1, 96]
    - [89, 20.563]
  - - [6464, 64, 1, 64]
    - [71, 10.654]
  - - [1756, 30, 1, 36]
    - [267, 0.982]
  - - [21694, 66, 1, 66]
    - [153, 12.489]
  - - [37184, 64, 1, 64]
    - [117, 18.805]
  - - [18140, 30, 1, 36]
    - [93, 7.007]
  - - [15872, 128, 1, 128]
    - [26, 25.095]
  - - [27136, 66, 1, 66]
    - [69, 14.797]
  - - [13760, 64, 1, 64]
    - [73, 15.301]
  - - [16128, 48, 1, 48]
    - [189, 9.461]
  - - [43440, 48, 1, 48]
    - [130, 11.807]
  - - [39680, 58, 1, 66]
    - [61, 17.827]
  - - [5328, 48, 1, 48]
    - [216, 5.424]
  - - [25022, 66, 1, 66]
    - [97, 13.682]
  - - [35518, 66, 1, 66]
    - [101, 12.495]
  - - [28560, 48, 1, 48]
    - [119, 11.362]
  - - [40792, 30, 1, 36]
    - [93, 8.071]
  - - [23516, 30, 1, 36]
    - [88, 7.63]
  - - [4896, 96, 1, 96]
    - [101, 13.378]
  - - [96, 32, 1, 32]
    - [303, 0.063]
  - - [22586, 58, 1, 66]
    - [119, 14.539]
  - - [18816, 48, 1, 48]
    - [63, 9.769]
  - - [1726, 66, 1, 66]
    - [112, 3.108]
  - - [25024, 64, 1, 64]
    - [121, 18.33]
  - - [18096, 48, 1, 48]
    - [203, 9.636]
  - - [12954, 30, 1, 36]
    - [126, 5.298]
  - - [11904, 96, 1, 96]
    - [59, 19.465]
  - - [19288, 30, 1, 36]
    - [88, 7.112]
  - - [40288, 32, 1, 32]
    - [99, 8.607]
  - - [26880, 58, 1, 66]
    - [73, 16.214]
  - - [36922, 58, 1, 66]
    - [135, 16.125]
  - - [5376, 124, 1, 132]
    - [83, 18.884]
  - - [16384, 30, 1, 36]
    - [92, 6.701]
  - - [34496, 64, 1, 64]
    - [132, 17.937]
  - - [43454, 66, 1, 66]
    - [304, 12.847]
  - - [25914, 58, 1, 66]
    - [119, 15.523]
  - - [14812, 30, 1, 36]
    - [93, 6.109]
  - - [31808, 64, 1, 64]
    - [184, 17.956]
  - - [7824, 48, 1, 48]
    - [77, 7.189]
  - - [26160, 48, 1, 48]
    - [90, 11.365]
  - - [41632, 32, 1, 32]
    - [172, 8.773]
  - - [28160, 124, 1, 132]
    - [110, 34.277]
  - - [25824, 96, 1, 96]
    - [210, 23.625]
  - - [42240, 58, 1, 66]
    - [61, 18.448]
  - - [10368, 48, 1, 48]
    - [128, 8.476]
  - - [8960, 66, 1, 66]
    - [163, 10.408]
  - - [10240, 66, 1, 66]
    - [63, 10.749]
  - - [44160, 48, 1, 48]
    - [305, 12.562]
  - - [288, 32, 1, 32]
    - [60, 0.187]
  - - [19056, 48, 1, 48]
    - [155, 10.414]
  - - [23040, 30, 1, 36]
    - [91, 7.628]
  - - [24122, 58, 1, 66]
    - [90, 14.915]
  - - [26816, 64, 1, 64]
    - [134, 18.609]
  - - [4096, 58, 1, 66]
    - [115, 6.366]
  - - [9760, 32, 1, 32]
    - [216, 4.741]
  - - [42430, 66, 1, 66]
    - [125, 12.756]
  - - [27456, 64, 1, 64]
    - [162, 18.565]
  - - [16640, 30, 1, 36]
    - [92, 6.749]
  - - [37178, 58, 1, 66]
    - [135, 16.237]
  - - [30720, 96, 1, 96]
    - [105, 23.938]
  - - [88, 30, 1, 36]
    - [150, 0.05]
  - - [30720, 30, 1, 36]
    - [118, 7.514]
  - - [36128, 32, 1, 32]
    - [188, 8.254]
  - - [17598, 66, 1, 66]
    - [99, 11.791]
  - - [41616, 48, 1, 48]
    - [254, 12.784]
  - - [24378, 58, 1, 66]
    - [130, 14.913]
  - - [26048, 64, 1, 64]
    - [162, 18.493]
  - - [11198, 66, 1, 66]
    - [101, 9.947]
  - - [17472, 64, 1, 64]
    - [121, 15.888]
  - - [4176, 48, 1, 48]
    - [167, 4.21]
  - - [5632, 30, 1, 36]
    - [167, 2.688]
  - - [8672, 32, 1, 32]
    - [115, 4.169]
  - - [3792, 48, 1, 48]
    - [66, 3.977]
  - - [35488, 32, 1, 32]
    - [99, 8.188]
  - - [34624, 64, 1, 64]
    - [117, 17.953]
  - - [27648, 128, 1, 128]
    - [7, 35.941]
  - - [26624, 124, 1, 132]
    - [265, 33.86]
  - - [20634, 30, 1, 36]
    - [93, 6.974]
  - - [6240, 96, 1, 96]
    - [101, 16.403]
  - - [11996, 30, 1, 36]
    - [93, 5.077]
  - - [37054, 66, 1, 66]
    - [153, 12.628]
  - - [32256, 66, 1, 66]
    - [89, 14.624]
  - - [37152, 96, 1, 96]
    - [84, 24.11]
  - - [20016, 48, 1, 48]
    - [155, 10.444]
  - - [15616, 128, 1, 128]
    - [3, 24.796]
  - - [28000, 32, 1, 32]
    - [156, 8.614]
  - - [4288, 64, 1, 64]
    - [127, 7.468]
  - - [34560, 192, 1, 192]
    - [9, 47.061]
  - - [25632, 96, 1, 96]
    - [69, 24.031]
  - - [8800, 32, 1, 32]
    - [204, 4.367]
  - - [4992, 192, 1, 192]
    - [83, 27.552]
  - - [39226, 58, 1, 66]
    - [90, 16.505]
  - - [39136, 32, 1, 32]
    - [89, 8.6]
  - - [26968, 30, 1, 36]
    - [93, 8.307]
  - - [12640, 32, 1, 32]
    - [115, 5.833]
  - - [41984, 58, 1, 66]
    - [117, 18.29]
  - - [44222, 66, 1, 66]
    - [153, 13.015]
  - - [10240, 30, 1, 36]
    - [126, 4.702]
  - - [6912, 124, 1, 132]
    - [63, 23.176]
  - - [6672, 48, 1, 48]
    - [93, 6.356]
  - - [29242, 58, 1, 66]
    - [90, 14.291]
  - - [36032, 64, 1, 64]
    - [69, 18.323]
  - - [28128, 32, 1, 32]
    - [156, 8.596]
  - - [33648, 48, 1, 48]
    - [130, 11.843]
  - - [21152, 32, 1, 32]
    - [146, 7.626]
  - - [20288, 64, 1, 64]
    - [184, 17.833]
  - - [23450, 30, 1, 36]
    - [106, 7.46]
  - - [12288, 30, 1, 36]
    - [112, 5.642]
  - - [9152, 64, 1, 64]
    - [89, 13.096]
  - - [8762, 58, 1, 66]
    - [161, 10.645]
  - - [32344, 30, 1, 36]
    - [115, 7.679]
  - - [9120, 32, 1, 32]
    - [204, 4.782]
  - - [20736, 66, 1, 66]
    - [117, 13.893]
  - - [39264, 96, 1, 96]
    - [306, 23.982]
  - - [4256, 32, 1, 32]
    - [106, 2.182]
  - - [25920, 64, 1, 64]
    - [162, 18.332]
  - - [37984, 32, 1, 32]
    - [70, 8.635]
  - - [8448, 58, 1, 66]
    - [93, 10.264]
  - - [24048, 48, 1, 48]
    - [219, 10.856]
  - - [37632, 30, 1, 36]
    - [145, 7.964]
  - - [14208, 48, 1, 48]
    - [102, 9.457]
  - - [28320, 32, 1, 32]
    - [182, 7.733]
  - - [2656, 32, 1, 32]
    - [200, 1.592]
  - - [35482, 30, 1, 36]
    - [307, 7.349]
  - - [35808, 96, 1, 96]
    - [105, 23.644]
  - - [19712, 124, 1, 132]
    - [81, 31.337]
  - - [7232, 64, 1, 64]
    - [89, 11.314]
  - - [30720, 58, 1, 66]
    - [61, 15.142]
  - - [42240, 124, 1, 132]
    - [308, 32.902]
  - - [19164, 30, 1, 36]
    - [92, 6.961]
  - - [22492, 30, 1, 36]
    - [91, 7.397]
  - - [7936, 124, 1, 132]
    - [134, 21.681]
  - - [42848, 32, 1, 32]
    - [101, 9.029]
  - - [38080, 64, 1, 64]
    - [69, 18.795]
  - - [25104, 48, 1, 48]
    - [245, 11.187]
  - - [16216, 30, 1, 36]
    - [91, 6.804]
  - - [18016, 32, 1, 32]
    - [88, 7.293]
  - - [3008, 64, 1, 64]
    - [136, 5.845]
  - - [35232, 32, 1, 32]
    - [88, 7.97]
  - - [43584, 64, 1, 64]
    - [105, 18.754]
  - - [14176, 32, 1, 32]
    - [126, 6.114]
  - - [36480, 192, 1, 192]
    - [37, 43.135]
  - - [33792, 48, 1, 48]
    - [101, 11.657]
  - - [32480, 32, 1, 32]
    - [70, 8.236]
  - - [15360, 124, 1, 132]
    - [81, 26.349]
  - - [3416, 30, 1, 36]
    - [98, 1.714]
  - - [5566, 66, 1, 66]
    - [101, 8.278]
  - - [43536, 48, 1, 48]
    - [135, 11.741]
  - - [38832, 48, 1, 48]
    - [130, 12.76]
  - - [9648, 48, 1, 48]
    - [89, 8.079]
  - - [12478, 66, 1, 66]
    - [70, 10.292]
  - - [5152, 32, 1, 32]
    - [106, 2.672]
  - - [38496, 96, 1, 96]
    - [72, 24.007]
  - - [410, 30, 1, 36]
    - [60, 0.24]
  - - [4704, 32, 1, 32]
    - [106, 2.439]
  - - [30816, 96, 1, 96]
    - [184, 23.313]
  - - [11008, 128, 1, 128]
    - [59, 28.721]
  - - [37888, 58, 1, 66]
    - [69, 17.291]
  - - [9920, 64, 1, 64]
    - [70, 12.987]
  - - [23742, 66, 1, 66]
    - [97, 13.166]
  - - [15744, 192, 1, 192]
    - [22, 36.227]
  - - [13472, 32, 1, 32]
    - [88, 5.978]
  - - [9728, 128, 1, 128]
    - [65, 27.31]
  - - [13824, 96, 1, 96]
    - [59, 21.424]
  - - [25824, 32, 1, 32]
    - [111, 8.334]
  - - [34904, 30, 1, 36]
    - [77, 7.652]
  - - [8592, 48, 1, 48]
    - [93, 7.691]
  - - [39168, 96, 1, 96]
    - [306, 27.572]
  - - [28848, 48, 1, 48]
    - [90, 11.565]
  - - [12768, 96, 1, 96]
    - [75, 20.24]
  - - [1024, 128, 1, 128]
    - [233, 6.691]
  - - [43520, 66, 1, 66]
    - [70, 15.311]
  - - [512, 66, 1, 66]
    - [80, 1.117]
  - - [9888, 96, 1, 96]
    - [94, 18.753]
  - - [21504, 66, 1, 66]
    - [89, 13.487]
  - - [38232, 30, 1, 36]
    - [77, 7.885]
  - - [43168, 32, 1, 32]
    - [101, 9.096]
  - - [21824, 64, 1, 64]
    - [132, 17.07]
  - - [33214, 66, 1, 66]
    - [99, 12.661]
  - - [2618, 58, 1, 66]
    - [98, 4.069]
  - - [5274, 30, 1, 36]
    - [98, 2.541]
  - - [1792, 124, 1, 132]
    - [115, 9.648]
  - - [7536, 48, 1, 48]
    - [113, 6.924]
  - - [15872, 58, 1, 66]
    - [169, 12.503]
  - - [4864, 58, 1, 66]
    - [216, 7.051]
  - - [3360, 96, 1, 96]
    - [233, 10.902]
  - - [35648, 64, 1, 64]
    - [81, 18.536]
  - - [38784, 48, 1, 48]
    - [117, 12.624]
  - - [28608, 64, 1, 64]
    - [309, 17.314]
  - - [8024, 30, 1, 36]
    - [167, 3.792]
  - - [20576, 32, 1, 32]
    - [89, 7.536]
  - - [32570, 58, 1, 66]
    - [135, 15.145]
  - - [19390, 66, 1, 66]
    - [61, 11.396]
  - - [20304, 48, 1, 48]
    - [231, 10.924]
  - - [23296, 58, 1, 66]
    - [90, 14.667]
  - - [34128, 48, 1, 48]
    - [130, 12.094]
  - - [43680, 32, 1, 32]
    - [188, 8.88]
  - - [16896, 48, 1, 48]
    - [89, 9.693]
  - - [2560, 124, 1, 132]
    - [233, 12.846]
  - - [5600, 32, 1, 32]
    - [144, 3.005]
  - - [20224, 128, 1, 128]
    - [32, 31.045]
  - - [10496, 66, 1, 66]
    - [134, 11.198]
  - - [42138, 30, 1, 36]
    - [77, 7.888]
  - - [39994, 58, 1, 66]
    - [90, 16.585]
  - - [3840, 124, 1, 132]
    - [89, 15.65]
  - - [2352, 48, 1, 48]
    - [60, 2.598]
  - - [29440, 124, 1, 132]
    - [301, 29.228]
  - - [10240, 128, 1, 128]
    - [72, 28.003]
  - - [31136, 32, 1, 32]
    - [88, 7.684]
  - - [6864, 48, 1, 48]
    - [67, 6.661]
  - - [16992, 32, 1, 32]
    - [115, 7.002]
  - - [14560, 32, 1, 32]
    - [106, 6.339]
  - - [10752, 192, 1, 192]
    - [12, 38.249]
  - - [6912, 128, 1, 128]
    - [73, 24.896]
  - - [5824, 64, 1, 64]
    - [126, 9.774]
  - - [36192, 96, 1, 96]
    - [276, 23.672]
  - - [9984, 30, 1, 36]
    - [106, 4.628]
  - - [30720, 124, 1, 132]
    - [69, 29.777]
  - - [30816, 32, 1, 32]
    - [283, 7.645]
  - - [34560, 58, 1, 66]
    - [81, 16.245]
  - - [40412, 30, 1, 36]
    - [269, 7.931]
  - - [13584, 48, 1, 48]
    - [193, 9.219]
  - - [32256, 30, 1, 36]
    - [126, 7.658]
  - - [11456, 64, 1, 64]
    - [101, 14.098]
  - - [864, 96, 1, 96]
    - [144, 3.518]
  - - [30192, 48, 1, 48]
    - [119, 11.317]
  - - [38744, 30, 1, 36]
    - [92, 8.024]
  - - [12064, 32, 1, 32]
    - [126, 5.512]
  - - [17344, 64, 1, 64]
    - [162, 15.693]
  - - [4542, 66, 1, 66]
    - [128, 6.912]
  - - [40128, 64, 1, 64]
    - [178, 18.752]
  - - [9530, 58, 1, 66]
    - [77, 10.888]
  - - [10912, 32, 1, 32]
    - [144, 4.889]
  - - [36864, 58, 1, 66]
    - [61, 16.914]
  - - [33472, 64, 1, 64]
    - [147, 18.389]
  - - [39102, 66, 1, 66]
    - [149, 13.099]
  - - [4506, 30, 1, 36]
    - [140, 2.261]
  - - [28606, 66, 1, 66]
    - [99, 11.897]
  - - [30464, 124, 1, 132]
    - [310, 29.843]
  - - [6384, 48, 1, 48]
    - [113, 6.081]
  - - [22272, 66, 1, 66]
    - [99, 13.249]
  - - [9216, 48, 1, 48]
    - [113, 8.109]
  - - [36762, 30, 1, 36]
    - [93, 7.486]
  - - [24800, 32, 1, 32]
    - [91, 8.354]
  - - [20736, 48, 1, 48]
    - [189, 10.452]
  - - [34016, 32, 1, 32]
    - [101, 7.888]
  - - [27904, 124, 1, 132]
    - [208, 34.42]
  - - [8000, 64, 1, 64]
    - [89, 12.006]
  - - [4060, 30, 1, 36]
    - [187, 2.037]
  - - [5310, 66, 1, 66]
    - [108, 7.897]
  - - [29728, 32, 1, 32]
    - [217, 7.707]
  - - [20800, 64, 1, 64]
    - [63, 17.858]
  - - [19866, 30, 1, 36]
    - [93, 7.007]
  - - [27648, 66, 1, 66]
    - [117, 15.203]
  - - [4608, 124, 1, 132]
    - [77, 17.796]
  - - [31290, 58, 1, 66]
    - [130, 15.12]
  - - [13504, 64, 1, 64]
    - [225, 15.108]
  - - [19134, 66, 1, 66]
    - [69, 11.522]
  - - [30864, 48, 1, 48]
    - [90, 11.445]
  - - [24408, 30, 1, 36]
    - [91, 8.308]
  - - [9824, 32, 1, 32]
    - [136, 4.982]
  - - [11904, 192, 1, 192]
    - [12, 40.944]
  - - [8382, 66, 1, 66]
    - [89, 10.095]
  - - [37376, 128, 1, 128]
    - [30, 34.07]
  - - [7358, 66, 1, 66]
    - [89, 9.319]
  - - [39648, 32, 1, 32]
    - [99, 8.671]
  - - [7344, 48, 1, 48]
    - [168, 6.689]
  - - [40090, 30, 1, 36]
    - [91, 7.743]
  - - [34880, 64, 1, 64]
    - [81, 18.239]
  - - [12442, 30, 1, 36]
    - [93, 5.266]
  - - [5184, 64, 1, 64]
    - [71, 9.201]
  - - [41370, 30, 1, 36]
    - [116, 7.896]
  - - [25564, 30, 1, 36]
    - [93, 7.976]
  - - [1440, 32, 1, 32]
    - [200, 0.923]
  - - [34368, 64, 1, 64]
    - [84, 18.074]
  - - [13312, 128, 1, 128]
    - [81, 32.017]
  - - [18112, 64, 1, 64]
    - [134, 16.551]
  - - [34784, 32, 1, 32]
    - [89, 8.026]
  - - [26112, 30, 1, 36]
    - [91, 8.147]
  - - [8400, 48, 1, 48]
    - [67, 7.585]
  - - [24672, 96, 1, 96]
    - [69, 22.771]
  - - [43096, 30, 1, 36]
    - [92, 8.258]
  - - [16224, 32, 1, 32]
    - [92, 6.997]
  - - [16416, 32, 1, 32]
    - [92, 6.95]
  - - [14592, 96, 1, 96]
    - [70, 20.068]
  - - [34608, 48, 1, 48]
    - [135, 12.14]
  - - [4762, 30, 1, 36]
    - [137, 2.365]
  - - [20064, 32, 1, 32]
    - [222, 7.349]
  - - [6400, 66, 1, 66]
    - [128, 8.974]
  - - [3328, 66, 1, 66]
    - [106, 5.833]
  - - [1824, 32, 1, 32]
    - [200, 1.169]
  - - [16384, 58, 1, 66]
    - [134, 12.848]
  - - [40512, 64, 1, 64]
    - [61, 19.323]
  - - [39578, 30, 1, 36]
    - [93, 7.767]
  - - [41424, 48, 1, 48]
    - [292, 12.614]
  - - [33536, 58, 1, 66]
    - [117, 15.982]
  - - [18496, 64, 1, 64]
    - [84, 16.494]
  - - [8304, 48, 1, 48]
    - [92, 7.563]
  - - [3584, 58, 1, 66]
    - [106, 5.621]
  - - [13728, 96, 1, 96]
    - [81, 21.355]
  - - [36448, 32, 1, 32]
    - [99, 8.205]
  - - [15324, 30, 1, 36]
    - [92, 6.113]
  - - [1624, 30, 1, 36]
    - [267, 0.909]
  - - [16800, 32, 1, 32]
    - [88, 6.984]
  - - [3072, 96, 1, 96]
    - [78, 10.905]
  - - [22112, 32, 1, 32]
    - [163, 7.849]
  - - [42272, 32, 1, 32]
    - [262, 8.787]
  - - [39696, 48, 1, 48]
    - [119, 12.452]
  - - [18816, 192, 1, 192]
    - [22, 41.513]
  - - [1088, 64, 1, 64]
    - [194, 2.308]
  - - [24144, 48, 1, 48]
    - [268, 10.853]
  - - [41216, 128, 1, 128]
    - [7, 35.635]
  - - [26080, 32, 1, 32]
    - [177, 8.476]
  - - [12240, 48, 1, 48]
    - [93, 9.014]
  - - [40638, 66, 1, 66]
    - [153, 13.34]
  - - [38368, 32, 1, 32]
    - [143, 8.472]
  - - [7392, 32, 1, 32]
    - [126, 3.708]
  - - [25600, 30, 1, 36]
    - [93, 8.039]
  - - [11484, 30, 1, 36]
    - [93, 4.947]
  - - [15328, 32, 1, 32]
    - [92, 6.549]
  - - [34176, 192, 1, 192]
    - [24, 46.884]
  - - [19200, 58, 1, 66]
    - [134, 14.592]
  - - [40864, 32, 1, 32]
    - [70, 8.69]
  - - [15408, 48, 1, 48]
    - [155, 9.467]
  - - [26170, 58, 1, 66]
    - [90, 15.622]
  - - [30720, 192, 1, 192]
    - [24, 43.214]
  - - [36352, 66, 1, 66]
    - [101, 15.055]
  - - [30656, 64, 1, 64]
    - [84, 17.964]
  - - [34780, 30, 1, 36]
    - [116, 7.591]
  - - [23808, 192, 1, 192]
    - [12, 42.76]
  - - [35088, 48, 1, 48]
    - [135, 12.104]
  - - [27838, 66, 1, 66]
    - [149, 14.612]
  - - [13824, 30, 1, 36]
    - [311, 5.902]
  - - [18752, 64, 1, 64]
    - [72, 16.803]
  - - [24284, 30, 1, 36]
    - [93, 7.933]
  - - [30208, 128, 1, 128]
    - [32, 29.387]
  - - [35804, 30, 1, 36]
    - [269, 7.511]
  - - [27936, 96, 1, 96]
    - [141, 25.169]
  - - [14352, 48, 1, 48]
    - [102, 8.87]
  - - [29808, 48, 1, 48]
    - [130, 11.214]
  - - [32058, 58, 1, 66]
    - [119, 15.236]
  - - [39552, 96, 1, 96]
    - [141, 27.702]
  - - [11520, 30, 1, 36]
    - [244, 5.006]
  - - [44288, 124, 1, 132]
    - [123, 31.534]
  - - [58, 58, 1, 66]
    - [80, 0.104]
  - - [15960, 30, 1, 36]
    - [88, 6.367]
  - - [6560, 32, 1, 32]
    - [243, 3.221]
  - - [34136, 30, 1, 36]
    - [91, 7.657]
  - - [21600, 32, 1, 32]
    - [277, 7.552]
  - - [3456, 192, 1, 192]
    - [65, 25.747]
  - - [27744, 96, 1, 96]
    - [69, 24.622]
  - - [8704, 58, 1, 66]
    - [88, 10.574]
  - - [19440, 48, 1, 48]
    - [155, 10.093]
  - - [3936, 32, 1, 32]
    - [204, 1.996]
  - - [41184, 96, 1, 96]
    - [210, 24.576]
  - - [16384, 128, 1, 128]
    - [30, 26.072]
  - - [314, 58, 1, 66]
    - [312, 0.558]
  - - [28504, 30, 1, 36]
    - [88, 7.379]
  - - [40320, 96, 1, 96]
    - [95, 27.725]
  - - [12672, 96, 1, 96]
    - [59, 20.321]
  - - [22528, 30, 1, 36]
    - [91, 7.459]
  - - [43008, 48, 1, 48]
    - [63, 12.404]
  - - [32448, 64, 1, 64]
    - [184, 17.987]
  - - [28992, 64, 1, 64]
    - [104, 17.376]
  - - [42716, 30, 1, 36]
    - [77, 8.09]
  - - [43872, 96, 1, 96]
    - [221, 23.726]
  - - [19968, 96, 1, 96]
    - [95, 23.628]
  - - [37152, 32, 1, 32]
    - [89, 8.363]
  - - [41048, 30, 1, 36]
    - [92, 8.024]
  - - [7632, 48, 1, 48]
    - [113, 7.406]
  - - [37536, 96, 1, 96]
    - [180, 23.874]
  - - [38880, 96, 1, 96]
    - [184, 23.782]
  - - [20736, 128, 1, 128]
    - [45, 32.785]
  - - [16080, 48, 1, 48]
    - [102, 9.328]
  - - [25820, 30, 1, 36]
    - [91, 7.855]
  - - [36096, 30, 1, 36]
    - [129, 7.774]
  - - [41472, 66, 1, 66]
    - [70, 15.332]
  - - [29952, 96, 1, 96]
    - [72, 23.786]
  - - [13664, 32, 1, 32]
    - [106, 6.063]
  - - [32512, 30, 1, 36]
    - [126, 7.645]
  - - [16574, 66, 1, 66]
    - [89, 11.538]
  - - [44096, 64, 1, 64]
    - [104, 18.669]
  - - [43392, 48, 1, 48]
    - [63, 12.515]
  - - [2648, 30, 1, 36]
    - [170, 1.329]
  - - [958, 66, 1, 66]
    - [313, 1.808]
  - - [40944, 48, 1, 48]
    - [154, 12.578]
  - - [29338, 30, 1, 36]
    - [115, 6.966]
  - - [17328, 48, 1, 48]
    - [203, 9.52]
  - - [11710, 66, 1, 66]
    - [89, 10.038]
  - - [24320, 66, 1, 66]
    - [70, 14.083]
  - - [1946, 30, 1, 36]
    - [314, 1.041]
  - - [44120, 30, 1, 36]
    - [269, 8.103]
  - - [43864, 30, 1, 36]
    - [77, 7.849]
  - - [35040, 32, 1, 32]
    - [70, 7.966]
  - - [30874, 30, 1, 36]
    - [91, 7.259]
  - - [5888, 128, 1, 128]
    - [63, 21.957]
  - - [18720, 32, 1, 32]
    - [91, 7.081]
  - - [40224, 96, 1, 96]
    - [117, 24.713]
  - - [3984, 48, 1, 48]
    - [98, 4.178]
  - - [41472, 58, 1, 66]
    - [117, 17.886]
  - - [27100, 30, 1, 36]
    - [93, 7.851]
  - - [29374, 66, 1, 66]
    - [99, 11.939]
  - - [28080, 48, 1, 48]
    - [90, 11.709]
  - - [1338, 58, 1, 66]
    - [214, 2.198]
  - - [14336, 66, 1, 66]
    - [70, 11.976]
  - - [5664, 32, 1, 32]
    - [204, 2.811]
  - - [21184, 64, 1, 64]
    - [84, 17.535]
  - - [41984, 30, 1, 36]
    - [118, 8.375]
  - - [13114, 58, 1, 66]
    - [189, 12.163]
  - - [38400, 124, 1, 132]
    - [178, 31.791]
  - - [2458, 30, 1, 36]
    - [166, 1.246]
  - - [21360, 48, 1, 48]
    - [245, 10.174]
  - - [42752, 66, 1, 66]
    - [70, 15.542]
  - - [256, 58, 1, 66]
    - [174, 0.47]
  - - [10400, 32, 1, 32]
    - [200, 4.705]
  - - [22748, 30, 1, 36]
    - [88, 7.431]
  - - [43920, 48, 1, 48]
    - [135, 11.845]
  - - [29696, 30, 1, 36]
    - [167, 7.489]
  - - [11608, 30, 1, 36]
    - [136, 4.871]
  - - [15616, 124, 1, 132]
    - [301, 26.541]
  - - [12992, 64, 1, 64]
    - [211, 14.989]
  - - [25056, 32, 1, 32]
    - [89, 8.318]
  - - [31872, 96, 1, 96]
    - [235, 24.156]
  - - [26016, 96, 1, 96]
    - [69, 24.065]
  - - [16186, 58, 1, 66]
    - [189, 12.692]
  - - [35928, 30, 1, 36]
    - [93, 7.703]
  - - [28760, 30, 1, 36]
    - [126, 7.253]
  - - [9552, 48, 1, 48]
    - [92, 7.999]
  - - [30208, 30, 1, 36]
    - [106, 7.579]
  - - [35328, 58, 1, 66]
    - [61, 16.652]
  - - [34272, 32, 1, 32]
    - [275, 8.153]
  - - [33360, 48, 1, 48]
    - [90, 12.154]
  - - [27296, 32, 1, 32]
    - [111, 8.687]
  - - [25146, 58, 1, 66]
    - [219, 15.438]
  - - [41760, 96, 1, 96]
    - [141, 24.884]
  - - [30296, 30, 1, 36]
    - [91, 7.336]
  - - [3040, 32, 1, 32]
    - [313, 1.631]
  - - [12252, 30, 1, 36]
    - [216, 5.231]
  - - [18490, 58, 1, 66]
    - [209, 13.402]
  - - [34944, 96, 1, 96]
    - [141, 25.329]
  - - [9600, 192, 1, 192]
    - [33, 34.822]
  - - [27392, 58, 1, 66]
    - [82, 16.073]
  - - [43744, 32, 1, 32]
    - [89, 8.777]
  - - [39216, 48, 1, 48]
    - [119, 12.646]
  - - [27736, 30, 1, 36]
    - [92, 8.132]
  - - [22320, 48, 1, 48]
    - [131, 10.487]
  - - [22368, 96, 1, 96]
    - [99, 21.808]
  - - [42656, 32, 1, 32]
    - [99, 9.03]
  - - [39768, 30, 1, 36]
    - [93, 8.031]
  - - [35072, 30, 1, 36]
    - [114, 7.724]
  - - [18432, 192, 1, 192]
    - [12, 40.938]
  - - [42240, 66, 1, 66]
    - [99, 15.243]
  - - [7424, 30, 1, 36]
    - [112, 3.542]
  - - [34202, 30, 1, 36]
    - [88, 7.465]
  - - [18176, 58, 1, 66]
    - [73, 13.813]
  - - [14424, 30, 1, 36]
    - [88, 6.0]
  - - [8976, 48, 1, 48]
    - [113, 8.035]
  - - [39738, 58, 1, 66]
    - [135, 16.322]
  - - [32496, 48, 1, 48]
    - [135, 11.798]
  - - [44192, 32, 1, 32]
    - [70, 9.064]
  - - [826, 58, 1, 66]
    - [303, 1.439]
  - - [24152, 30, 1, 36]
    - [92, 8.221]
  - - [2208, 32, 1, 32]
    - [106, 1.341]
  - - [22718, 66, 1, 66]
    - [149, 12.706]
  - - [29792, 32, 1, 32]
    - [164, 7.638]
  - - [31168, 64, 1, 64]
    - [109, 17.757]
  - - [21216, 32, 1, 32]
    - [315, 7.77]
  - - [35072, 66, 1, 66]
    - [70, 14.935]
  - - [22592, 64, 1, 64]
    - [162, 17.448]
  - - [7920, 48, 1, 48]
    - [93, 7.151]
  - - [44064, 32, 1, 32]
    - [70, 9.16]
  - - [29184, 48, 1, 48]
    - [63, 10.94]
  - - [10848, 96, 1, 96]
    - [59, 17.95]
  - - [30336, 96, 1, 96]
    - [84, 23.818]
  - - [37018, 30, 1, 36]
    - [128, 7.539]
  - - [18816, 96, 1, 96]
    - [141, 23.258]
  - - [43520, 30, 1, 36]
    - [118, 8.339]
  - - [5440, 64, 1, 64]
    - [71, 9.298]
  - - [12508, 30, 1, 36]
    - [126, 5.585]
  - - [31678, 66, 1, 66]
    - [101, 12.314]
  - - [21120, 192, 1, 192]
    - [12, 44.47]
  - - [2048, 124, 1, 132]
    - [216, 10.868]
  - - [154, 30, 1, 36]
    - [62, 0.086]
  - - [40368, 48, 1, 48]
    - [90, 12.663]
  - - [27024, 48, 1, 48]
    - [268, 11.453]
  - - [39584, 32, 1, 32]
    - [188, 8.457]
  - - [33408, 96, 1, 96]
    - [241, 24.645]
  - - [35616, 96, 1, 96]
    - [61, 23.897]
  - - [44288, 30, 1, 36]
    - [114, 8.588]
  - - [31898, 30, 1, 36]
    - [91, 7.255]
  - - [39358, 66, 1, 66]
    - [149, 13.14]
  - - [30976, 124, 1, 132]
    - [301, 30.425]
  - - [7264, 32, 1, 32]
    - [165, 3.605]
  - - [39600, 48, 1, 48]
    - [119, 12.769]
  - - [4798, 66, 1, 66]
    - [234, 7.301]
  - - [21168, 48, 1, 48]
    - [148, 10.827]
  - - [22016, 58, 1, 66]
    - [81, 14.496]
  - - [11930, 30, 1, 36]
    - [126, 5.184]
  - - [1344, 64, 1, 64]
    - [157, 2.757]
  - - [23610, 58, 1, 66]
    - [90, 14.865]
  - - [10464, 32, 1, 32]
    - [106, 5.03]
  - - [8704, 128, 1, 128]
    - [134, 25.707]
  - - [27264, 48, 1, 48]
    - [305, 11.894]
  - - [15550, 66, 1, 66]
    - [70, 10.981]
  - - [38048, 32, 1, 32]
    - [99, 8.322]
  - - [21344, 32, 1, 32]
    - [93, 7.636]
  - - [30432, 32, 1, 32]
    - [89, 7.633]
  - - [36048, 48, 1, 48]
    - [135, 12.394]
  - - [15648, 96, 1, 96]
    - [99, 20.764]
  - - [26712, 30, 1, 36]
    - [92, 8.281]
  - - [10896, 48, 1, 48]
    - [88, 8.443]
  - - [41328, 48, 1, 48]
    - [90, 12.658]
  - - [32224, 32, 1, 32]
    - [252, 7.91]
  - - [24624, 48, 1, 48]
    - [135, 10.834]
  - - [39456, 96, 1, 96]
    - [141, 24.829]
  - - [36800, 64, 1, 64]
    - [117, 18.765]
  - - [30940, 30, 1, 36]
    - [126, 7.171]
  - - [7936, 66, 1, 66]
    - [89, 10.25]
  - - [2560, 66, 1, 66]
    - [112, 4.61]
  - - [7456, 32, 1, 32]
    - [126, 3.74]
  - - [28224, 64, 1, 64]
    - [84, 17.309]
  - - [27648, 48, 1, 48]
    - [65, 12.216]
  - - [34512, 48, 1, 48]
    - [130, 12.066]
  - - [17152, 58, 1, 66]
    - [134, 13.209]
  - - [9840, 48, 1, 48]
    - [89, 7.86]
  - - [11264, 58, 1, 66]
    - [89, 11.567]
  - - [3744, 96, 1, 96]
    - [71, 11.691]
  - - [29528, 30, 1, 36]
    - [88, 7.259]
  - - [35616, 32, 1, 32]
    - [99, 8.218]
  - - [39776, 32, 1, 32]
    - [89, 8.658]
  - - [7256, 30, 1, 36]
    - [167, 3.429]
  - - [23808, 124, 1, 132]
    - [110, 31.586]
  - - [26624, 30, 1, 36]
    - [92, 8.307]
  - - [19200, 96, 1, 96]
    - [81, 23.181]
  - - [29916, 30, 1, 36]
    - [91, 7.103]
  - - [43966, 66, 1, 66]
    - [125, 12.92]
  - - [19536, 48, 1, 48]
    - [189, 10.51]
  - - [24832, 128, 1, 128]
    - [7, 34.791]
  - - [43520, 58, 1, 66]
    - [81, 16.574]
  - - [38544, 48, 1, 48]
    - [119, 12.546]
  - - [9696, 32, 1, 32]
    - [204, 4.811]
  - - [14336, 124, 1, 132]
    - [81, 24.882]
  - - [21402, 30, 1, 36]
    - [92, 7.086]
  - - [29498, 58, 1, 66]
    - [130, 14.457]
  - - [39328, 32, 1, 32]
    - [89, 8.601]
  - - [6880, 32, 1, 32]
    - [106, 3.414]
  - - [14300, 30, 1, 36]
    - [92, 5.705]
  - - [6876, 30, 1, 36]
    - [137, 3.314]
  - - [26784, 32, 1, 32]
    - [177, 8.644]
  - - [32064, 64, 1, 64]
    - [184, 18.1]
  - - [17116, 30, 1, 36]
    - [91, 6.829]
  - - [31232, 128, 1, 128]
    - [34, 29.679]
  - - [26426, 58, 1, 66]
    - [119, 15.559]
  - - [23088, 48, 1, 48]
    - [245, 10.561]
  - - [37056, 64, 1, 64]
    - [81, 19.054]
  - - [20960, 32, 1, 32]
    - [101, 7.498]
  - - [33024, 192, 1, 192]
    - [20, 46.376]
  - - [41568, 32, 1, 32]
    - [172, 8.719]
  - - [29920, 32, 1, 32]
    - [188, 7.628]
  - - [19968, 66, 1, 66]
    - [117, 13.95]
  - - [34238, 66, 1, 66]
    - [70, 12.493]
  - - [6912, 192, 1, 192]
    - [117, 34.483]
  - - [9216, 30, 1, 36]
    - [126, 4.192]
  - - [2368, 64, 1, 64]
    - [78, 4.553]
  - - [9626, 30, 1, 36]
    - [204, 4.298]
  - - [33792, 66, 1, 66]
    - [101, 14.941]
  - - [27552, 32, 1, 32]
    - [100, 8.533]
  - - [26592, 96, 1, 96]
    - [69, 24.435]
  - - [22032, 48, 1, 48]
    - [219, 10.259]
  - - [25440, 96, 1, 96]
    - [69, 23.959]
  - - [25968, 48, 1, 48]
    - [131, 11.142]
  - - [40032, 32, 1, 32]
    - [99, 8.673]
  - - [10752, 30, 1, 36]
    - [311, 4.758]
  - - [36640, 32, 1, 32]
    - [172, 8.168]
  - - [41920, 64, 1, 64]
    - [69, 19.79]
  - - [7738, 58, 1, 66]
    - [93, 9.468]
  - - [8096, 32, 1, 32]
    - [126, 4.106]
  - - [14080, 128, 1, 128]
    - [34, 28.639]
  - - [25280, 64, 1, 64]
    - [134, 18.518]
  - - [37024, 32, 1, 32]
    - [101, 8.254]
  - - [31872, 48, 1, 48]
    - [89, 11.451]
  - - [31488, 30, 1, 36]
    - [114, 7.476]
  - - [29408, 32, 1, 32]
    - [77, 7.667]
  - - [2816, 58, 1, 66]
    - [98, 4.498]
  - - [352, 32, 1, 32]
    - [86, 0.235]
  - - [30784, 64, 1, 64]
    - [105, 17.813]
  - - [2544, 48, 1, 48]
    - [85, 2.752]
  - - [26928, 48, 1, 48]
    - [245, 11.553]
  - - [11360, 32, 1, 32]
    - [126, 5.19]
  - - [25432, 30, 1, 36]
    - [92, 8.252]
  - - [26844, 30, 1, 36]
    - [93, 8.016]
  - - [23424, 192, 1, 192]
    - [24, 42.253]
  - - [40192, 128, 1, 128]
    - [32, 35.161]
  - - [33946, 30, 1, 36]
    - [93, 7.442]
  - - [2112, 64, 1, 64]
    - [71, 3.978]
  - - [16064, 64, 1, 64]
    - [121, 15.052]
  - - [39120, 48, 1, 48]
    - [90, 12.498]
  - - [21952, 64, 1, 64]
    - [84, 17.243]
  - - [39870, 66, 1, 66]
    - [149, 13.288]
  - - [2816, 124, 1, 132]
    - [77, 13.756]
  - - [17152, 66, 1, 66]
    - [101, 13.0]
  - - [35856, 48, 1, 48]
    - [292, 12.328]
  - - [15008, 32, 1, 32]
    - [88, 6.184]
  - - [9436, 30, 1, 36]
    - [136, 4.175]
  - - [32000, 58, 1, 66]
    - [61, 15.463]
  - - [35776, 64, 1, 64]
    - [132, 18.193]
  - - [14782, 66, 1, 66]
    - [101, 10.629]
  - - [9696, 96, 1, 96]
    - [134, 18.222]
  - - [34336, 32, 1, 32]
    - [101, 7.963]
  - - [37408, 32, 1, 32]
    - [89, 8.3]
  - - [39072, 32, 1, 32]
    - [70, 8.545]
  - - [14168, 30, 1, 36]
    - [92, 5.699]
  - - [446, 66, 1, 66]
    - [174, 0.912]
  - - [33216, 64, 1, 64]
    - [105, 18.194]
  - - [12720, 48, 1, 48]
    - [89, 9.046]
  - - [12990, 66, 1, 66]
    - [75, 10.715]
  - - [7578, 30, 1, 36]
    - [248, 3.513]
  - - [9408, 64, 1, 64]
    - [70, 13.057]
  - - [33600, 64, 1, 64]
    - [232, 18.188]
  - - [17920, 30, 1, 36]
    - [88, 7.149]
  - - [25376, 32, 1, 32]
    - [93, 8.425]
  - - [41568, 96, 1, 96]
    - [81, 24.628]
  - - [26016, 32, 1, 32]
    - [181, 8.338]
  - - [43776, 128, 1, 128]
    - [30, 32.13]
  - - [28160, 30, 1, 36]
    - [277, 8.257]
  - - [24960, 192, 1, 192]
    - [24, 44.349]
  - - [17342, 66, 1, 66]
    - [70, 11.739]
  - - [23952, 48, 1, 48]
    - [268, 10.86]
  - - [8224, 32, 1, 32]
    - [136, 4.125]
  - - [42624, 192, 1, 192]
    - [24, 43.765]
  - - [33456, 48, 1, 48]
    - [90, 12.062]
  - - [36352, 124, 1, 132]
    - [117, 31.289]
  - - [33792, 128, 1, 128]
    - [32, 31.825]
  - - [15616, 30, 1, 36]
    - [93, 6.334]
  - - [7680, 66, 1, 66]
    - [70, 9.919]
  - - [12864, 64, 1, 64]
    - [225, 14.935]
  - - [12960, 96, 1, 96]
    - [82, 20.944]
  - - [24986, 30, 1, 36]
    - [93, 7.746]
  - - [5178, 58, 1, 66]
    - [93, 7.444]
  - - [3738, 30, 1, 36]
    - [140, 1.876]
  - - [34560, 124, 1, 132]
    - [178, 31.747]
  - - [10608, 48, 1, 48]
    - [77, 8.538]
  - - [32314, 58, 1, 66]
    - [90, 15.107]
  - - [35008, 64, 1, 64]
    - [69, 18.255]
  - - [3840, 58, 1, 66]
    - [126, 5.76]
  - - [1824, 96, 1, 96]
    - [200, 7.014]
  - - [32410, 30, 1, 36]
    - [93, 7.371]
  - - [2904, 30, 1, 36]
    - [150, 1.442]
  - - [10432, 64, 1, 64]
    - [70, 13.561]
  - - [25790, 66, 1, 66]
    - [149, 13.757]
  - - [38432, 32, 1, 32]
    - [188, 8.327]
  - - [23904, 32, 1, 32]
    - [91, 8.171]
  - - [36864, 124, 1, 132]
    - [117, 31.436]
  - - [31744, 66, 1, 66]
    - [89, 14.56]
  - - [25664, 64, 1, 64]
    - [162, 18.505]
  - - [23376, 48, 1, 48]
    - [131, 10.646]
  - - [33756, 30, 1, 36]
    - [269, 7.434]
  - - [43680, 96, 1, 96]
    - [61, 23.591]
  - - [26448, 48, 1, 48]
    - [119, 11.395]
  - - [10016, 32, 1, 32]
    - [115, 4.97]
  - - [27070, 66, 1, 66]
    - [125, 14.362]
  - - [34032, 48, 1, 48]
    - [119, 12.355]
  - - [480, 32, 1, 32]
    - [85, 0.321]
  - - [17408, 30, 1, 36]
    - [93, 6.725]
  - - [7644, 30, 1, 36]
    - [239, 3.445]
  - - [44032, 124, 1, 132]
    - [69, 31.781]
  - - [21248, 30, 1, 36]
    - [116, 7.387]
  - - [34816, 66, 1, 66]
    - [117, 14.89]
  - - [42560, 64, 1, 64]
    - [84, 18.705]
  - - [17712, 48, 1, 48]
    - [201, 9.679]
  - - [41472, 30, 1, 36]
    - [118, 8.307]
  - - [4608, 128, 1, 128]
    - [89, 19.442]
  - - [41728, 66, 1, 66]
    - [101, 15.254]
  - - [18688, 30, 1, 36]
    - [91, 7.106]
  - - [30976, 58, 1, 66]
    - [81, 15.138]
  - - [1536, 192, 1, 192]
    - [71, 15.466]
  - - [33312, 32, 1, 32]
    - [99, 8.049]
  - - [37632, 96, 1, 96]
    - [316, 26.809]
  - - [4864, 30, 1, 36]
    - [112, 2.344]
  - - [17818, 30, 1, 36]
    - [92, 6.775]
  - - [35104, 32, 1, 32]
    - [101, 8.182]
  - - [28096, 64, 1, 64]
    - [221, 18.656]
  - - [21312, 64, 1, 64]
    - [84, 17.485]
  - - [41472, 192, 1, 192]
    - [28, 47.647]
  - - [19520, 64, 1, 64]
    - [63, 16.837]
  - - [1152, 48, 1, 48]
    - [194, 1.375]
  - - [26880, 128, 1, 128]
    - [7, 35.696]
  - - [37376, 58, 1, 66]
    - [61, 17.24]
  - - [44224, 64, 1, 64]
    - [184, 18.638]
  - - [28656, 48, 1, 48]
    - [130, 11.4]
  - - [28480, 64, 1, 64]
    - [104, 17.293]
  - - [43392, 96, 1, 96]
    - [141, 26.006]
  - - [42240, 30, 1, 36]
    - [145, 8.46]
  - - [37310, 66, 1, 66]
    - [153, 12.456]
  - - [4410, 58, 1, 66]
    - [126, 6.502]
  - - [1696, 32, 1, 32]
    - [200, 1.072]
  - - [13408, 32, 1, 32]
    - [126, 6.066]
  - - [21306, 58, 1, 66]
    - [249, 13.87]
  - - [10144, 32, 1, 32]
    - [144, 4.98]
  - - [15200, 32, 1, 32]
    - [106, 6.556]
  - - [35712, 48, 1, 48]
    - [90, 12.0]
  - - [3552, 32, 1, 32]
    - [85, 1.906]
  - - [41152, 64, 1, 64]
    - [81, 19.478]
  - - [25728, 48, 1, 48]
    - [81, 11.368]
  - - [38352, 48, 1, 48]
    - [90, 12.682]
  - - [2880, 64, 1, 64]
    - [103, 5.425]
  - - [2524, 30, 1, 36]
    - [317, 1.335]
  - - [32988, 30, 1, 36]
    - [77, 7.298]
  - - [24256, 64, 1, 64]
    - [132, 18.275]
  - - [19616, 32, 1, 32]
    - [177, 7.36]
  - - [32768, 124, 1, 132]
    - [61, 30.064]
  - - [30144, 64, 1, 64]
    - [276, 17.553]
  - - [15294, 66, 1, 66]
    - [99, 10.723]
  - - [35328, 48, 1, 48]
    - [101, 11.949]
  - - [21568, 64, 1, 64]
    - [84, 17.539]
  - - [9936, 48, 1, 48]
    - [116, 8.123]
  - - [41088, 192, 1, 192]
    - [29, 47.141]
  - - [41150, 66, 1, 66]
    - [125, 13.463]
  - - [35472, 48, 1, 48]
    - [90, 12.443]
  - - [23200, 32, 1, 32]
    - [88, 8.05]
  - - [17628, 30, 1, 36]
    - [93, 6.919]
  - - [31232, 30, 1, 36]
    - [106, 7.488]
  - - [22974, 66, 1, 66]
    - [153, 12.704]
  - - [35262, 66, 1, 66]
    - [89, 12.472]
  - - [12896, 32, 1, 32]
    - [127, 5.723]
  - - [16128, 128, 1, 128]
    - [49, 28.904]
  - - [42528, 32, 1, 32]
    - [101, 9.044]
  - - [27328, 64, 1, 64]
    - [184, 18.478]
  - - [21212, 30, 1, 36]
    - [92, 7.22]
  - - [2238, 66, 1, 66]
    - [98, 3.888]
  - - [21600, 96, 1, 96]
    - [70, 21.158]
  - - [41376, 96, 1, 96]
    - [316, 24.869]
  - - [24640, 64, 1, 64]
    - [121, 18.193]
  - - [10416, 48, 1, 48]
    - [161, 8.516]
  - - [16128, 66, 1, 66]
    - [89, 12.319]
  - - [3226, 30, 1, 36]
    - [150, 1.619]
  - - [5696, 64, 1, 64]
    - [233, 9.647]
  - - [9024, 64, 1, 64]
    - [89, 12.813]
  - - [16282, 30, 1, 36]
    - [91, 6.443]
  - - [33936, 48, 1, 48]
    - [135, 12.151]
  - - [34752, 64, 1, 64]
    - [81, 18.381]
  - - [34208, 32, 1, 32]
    - [101, 8.222]
  - - [29272, 30, 1, 36]
    - [106, 7.306]
  - - [32768, 30, 1, 36]
    - [114, 7.488]
  - - [21664, 32, 1, 32]
    - [93, 7.691]
  - - [24000, 64, 1, 64]
    - [190, 18.082]
  - - [27392, 124, 1, 132]
    - [199, 33.902]
  - - [144, 48, 1, 48]
    - [86, 0.18]
  - - [33072, 48, 1, 48]
    - [130, 12.091]
  - - [27264, 96, 1, 96]
    - [207, 27.754]
  - - [9216, 128, 1, 128]
    - [83, 26.581]
  - - [5376, 66, 1, 66]
    - [108, 8.31]
  - - [12032, 66, 1, 66]
    - [89, 11.194]
  - - [23328, 96, 1, 96]
    - [69, 22.324]
  - - [21056, 64, 1, 64]
    - [65, 17.748]
  - - [13088, 32, 1, 32]
    - [126, 5.98]
  - - [43608, 30, 1, 36]
    - [77, 8.259]
  - - [32826, 58, 1, 66]
    - [119, 15.774]
  - - [24736, 32, 1, 32]
    - [91, 8.154]
  - - [30016, 64, 1, 64]
    - [72, 17.645]
  - - [33178, 30, 1, 36]
    - [93, 7.407]
  - - [38592, 64, 1, 64]
    - [286, 18.747]
  - - [27072, 64, 1, 64]
    - [63, 18.577]
  - - [27136, 128, 1, 128]
    - [7, 36.101]
  - - [23664, 48, 1, 48]
    - [219, 10.591]
  - - [40506, 58, 1, 66]
    - [135, 16.365]
  - - [6656, 58, 1, 66]
    - [116, 9.26]
  - - [11552, 32, 1, 32]
    - [126, 5.496]
  - - [33024, 30, 1, 36]
    - [114, 7.582]
  - - [4352, 58, 1, 66]
    - [127, 6.528]
  - - [4696, 30, 1, 36]
    - [140, 2.309]
  - - [14936, 30, 1, 36]
    - [88, 6.008]
  - - [12224, 64, 1, 64]
    - [99, 15.247]
  - - [33982, 66, 1, 66]
    - [89, 12.587]
  - - [33112, 30, 1, 36]
    - [88, 7.496]
  - - [40704, 30, 1, 36]
    - [118, 8.503]
  - - [41248, 32, 1, 32]
    - [188, 8.772]
  - - [7904, 32, 1, 32]
    - [165, 4.008]
  - - [17280, 96, 1, 96]
    - [72, 21.682]
  - - [2640, 48, 1, 48]
    - [85, 2.979]
  - - [27136, 58, 1, 66]
    - [75, 16.368]
  - - [15038, 66, 1, 66]
    - [101, 10.974]
  - - [10496, 124, 1, 132]
    - [63, 25.468]
  - - [18208, 32, 1, 32]
    - [88, 7.182]
  - - [23488, 64, 1, 64]
    - [132, 17.697]
  - - [29136, 48, 1, 48]
    - [119, 11.288]
  - - [14592, 48, 1, 48]
    - [189, 8.913]
  - - [14556, 30, 1, 36]
    - [91, 5.855]
  - - [39616, 64, 1, 64]
    - [238, 18.799]
  - - [18842, 30, 1, 36]
    - [93, 6.844]
  - - [29440, 30, 1, 36]
    - [145, 7.386]
  - - [37488, 48, 1, 48]
    - [130, 12.476]
  - - [42942, 66, 1, 66]
    - [89, 12.811]
  - - [37822, 66, 1, 66]
    - [125, 12.714]
  - - [18480, 48, 1, 48]
    - [169, 9.994]
  - - [9248, 32, 1, 32]
    - [106, 4.4]
  - - [21848, 30, 1, 36]
    - [92, 7.596]
  - - [29184, 192, 1, 192]
    - [29, 41.192]
  - - [4928, 64, 1, 64]
    - [233, 8.663]
  - - [25184, 32, 1, 32]
    - [91, 8.242]
  - - [2304, 192, 1, 192]
    - [161, 21.264]
  - - [34816, 58, 1, 66]
    - [61, 16.321]
  - - [8704, 30, 1, 36]
    - [98, 3.997]
  - - [38912, 124, 1, 132]
    - [69, 32.106]
  - - [39840, 96, 1, 96]
    - [316, 24.66]
  - - [42906, 30, 1, 36]
    - [128, 7.94]
  - - [5136, 48, 1, 48]
    - [137, 5.079]
  - - [34416, 48, 1, 48]
    - [119, 12.073]
  - - [11136, 48, 1, 48]
    - [93, 8.502]
  - - [3840, 30, 1, 36]
    - [91, 1.888]
  - - [31232, 66, 1, 66]
    - [70, 14.494]
  - - [25536, 64, 1, 64]
    - [180, 18.27]
  - - [42240, 48, 1, 48]
    - [81, 13.372]
  - - [7226, 58, 1, 66]
    - [92, 9.099]
  - - [13728, 32, 1, 32]
    - [78, 5.812]
  - - [30576, 48, 1, 48]
    - [135, 11.672]
  - - [43008, 192, 1, 192]
    - [28, 43.969]
  - - [20122, 30, 1, 36]
    - [88, 6.849]
  - - [3072, 58, 1, 66]
    - [167, 4.818]
  - - [14400, 64, 1, 64]
    - [63, 14.215]
  - - [10224, 48, 1, 48]
    - [77, 8.294]
  - - [6336, 64, 1, 64]
    - [89, 10.17]
  - - [40800, 96, 1, 96]
    - [117, 24.452]
  - - [11904, 48, 1, 48]
    - [89, 8.892]
  - - [18944, 124, 1, 132]
    - [120, 30.378]
  - - [22426, 30, 1, 36]
    - [92, 7.326]
  - - [33082, 58, 1, 66]
    - [119, 15.853]
  - - [40960, 58, 1, 66]
    - [117, 18.026]
  - - [35424, 96, 1, 96]
    - [84, 23.768]
  - - [13776, 48, 1, 48]
    - [102, 9.053]
  - - [11840, 64, 1, 64]
    - [89, 14.868]
  - - [31488, 96, 1, 96]
    - [180, 24.354]
  - - [27808, 32, 1, 32]
    - [70, 8.974]
  - - [29016, 30, 1, 36]
    - [93, 7.242]
  - - [24672, 32, 1, 32]
    - [91, 8.075]
  - - [7680, 128, 1, 128]
    - [73, 23.336]
  - - [37792, 32, 1, 32]
    - [252, 8.305]
  - - [10704, 48, 1, 48]
    - [92, 8.356]
  - - [25308, 30, 1, 36]
    - [88, 7.846]
  - - [39482, 58, 1, 66]
    - [119, 16.373]
  - - [32352, 32, 1, 32]
    - [93, 7.941]
  - - [32016, 48, 1, 48]
    - [254, 11.915]
  - - [32600, 30, 1, 36]
    - [93, 7.346]
  - - [41888, 32, 1, 32]
    - [70, 9.118]
  - - [31546, 58, 1, 66]
    - [119, 15.117]
  - - [5760, 48, 1, 48]
    - [216, 5.59]
  - - [31196, 30, 1, 36]
    - [93, 7.335]
  - - [22688, 32, 1, 32]
    - [93, 7.813]
  - - [22656, 96, 1, 96]
    - [95, 25.922]
  - - [29404, 30, 1, 36]
    - [106, 7.156]
  - - [11352, 30, 1, 36]
    - [106, 4.889]
  - - [8126, 66, 1, 66]
    - [70, 10.096]
  - - [15072, 32, 1, 32]
    - [91, 6.381]
  - - [18384, 48, 1, 48]
    - [209, 9.84]
  - - [8112, 48, 1, 48]
    - [67, 7.388]
  - - [1982, 66, 1, 66]
    - [112, 3.636]
  - - [13210, 30, 1, 36]
    - [318, 5.358]
  - - [2496, 64, 1, 64]
    - [233, 4.799]
  - - [17216, 64, 1, 64]
    - [105, 15.89]
  - - [24474, 30, 1, 36]
    - [92, 7.587]
  - - [33500, 30, 1, 36]
    - [92, 7.548]
  - - [10176, 64, 1, 64]
    - [77, 13.417]
  - - [37464, 30, 1, 36]
    - [88, 7.792]
  - - [8960, 128, 1, 128]
    - [73, 26.253]
  - - [4640, 32, 1, 32]
    - [103, 2.406]
  - - [23904, 96, 1, 96]
    - [81, 22.615]
  - - [38016, 96, 1, 96]
    - [207, 26.761]
  - - [34912, 32, 1, 32]
    - [275, 8.055]
  - - [37664, 32, 1, 32]
    - [143, 8.438]
  - - [41918, 66, 1, 66]
    - [125, 13.534]
  - - [29118, 66, 1, 66]
    - [101, 11.835]
  - - [7056, 48, 1, 48]
    - [67, 6.542]
  - - [41786, 58, 1, 66]
    - [130, 16.496]
  - - [26544, 48, 1, 48]
    - [131, 11.296]
  - - [33440, 32, 1, 32]
    - [128, 7.914]
  - - [8608, 32, 1, 32]
    - [166, 4.318]
  - - [34106, 58, 1, 66]
    - [119, 15.732]
  - - [37888, 128, 1, 128]
    - [34, 34.033]
  - - [5120, 66, 1, 66]
    - [318, 7.853]
  - - [24832, 124, 1, 132]
    - [271, 32.651]
  - - [8736, 32, 1, 32]
    - [133, 4.244]
  - - [39936, 30, 1, 36]
    - [114, 8.271]
  - - [41018, 58, 1, 66]
    - [119, 16.456]
  - - [21120, 48, 1, 48]
    - [102, 10.697]
  - - [41088, 96, 1, 96]
    - [141, 27.48]
  - - [11578, 58, 1, 66]
    - [93, 11.413]
  - - [21792, 32, 1, 32]
    - [163, 7.736]
  - - [37434, 58, 1, 66]
    - [135, 16.267]
  - - [11162, 30, 1, 36]
    - [165, 4.851]
  - - [43296, 96, 1, 96]
    - [84, 24.17]
  - - [12144, 48, 1, 48]
    - [99, 9.137]
  - - [15930, 58, 1, 66]
    - [102, 12.324]
  - - [18624, 64, 1, 64]
    - [63, 16.689]
  - - [7424, 58, 1, 66]
    - [91, 9.487]
  - - [672, 32, 1, 32]
    - [140, 0.443]
  - - [18048, 96, 1, 96]
    - [95, 22.309]
  - - [22048, 32, 1, 32]
    - [177, 7.708]
  - - [6488, 30, 1, 36]
    - [137, 3.222]
  - - [29440, 128, 1, 128]
    - [30, 28.415]
  - - [16538, 30, 1, 36]
    - [88, 6.492]
  - - [28640, 32, 1, 32]
    - [182, 7.596]
  - - [23712, 32, 1, 32]
    - [277, 8.166]
  - - [8512, 64, 1, 64]
    - [89, 12.672]
  - - [36960, 32, 1, 32]
    - [70, 8.161]
  - - [3584, 128, 1, 128]
    - [77, 16.136]
  - - [17856, 64, 1, 64]
    - [72, 16.157]
  - - [18528, 96, 1, 96]
    - [69, 22.113]
  - - [12624, 48, 1, 48]
    - [70, 9.04]
  - - [29440, 66, 1, 66]
    - [101, 14.341]
  - - [1216, 64, 1, 64]
    - [295, 2.494]
  - - [31824, 48, 1, 48]
    - [135, 11.473]
  - - [38752, 32, 1, 32]
    - [188, 8.396]
  - - [36154, 58, 1, 66]
    - [90, 16.158]
  - - [3296, 32, 1, 32]
    - [204, 1.789]
  - - [10208, 32, 1, 32]
    - [126, 5.012]
  - - [1024, 30, 1, 36]
    - [251, 0.586]
  - - [7132, 30, 1, 36]
    - [98, 3.403]
  - - [15040, 64, 1, 64]
    - [121, 14.311]
  - - [11808, 96, 1, 96]
    - [59, 19.009]
  - - [18432, 66, 1, 66]
    - [81, 13.206]
  - - [29120, 64, 1, 64]
    - [104, 17.34]
  - - [31488, 48, 1, 48]
    - [89, 11.313]
  - - [23866, 58, 1, 66]
    - [119, 14.917]
  - - [816, 48, 1, 48]
    - [174, 1.021]
  - - [8412, 30, 1, 36]
    - [270, 3.827]
  - - [6080, 64, 1, 64]
    - [71, 10.021]
  - - [42080, 32, 1, 32]
    - [89, 8.908]
  - - [9216, 192, 1, 192]
    - [33, 33.576]
  - - [16928, 32, 1, 32]
    - [93, 7.038]
  - - [2304, 30, 1, 36]
    - [165, 1.26]
  - - [29630, 66, 1, 66]
    - [89, 11.993]
  - - [32476, 30, 1, 36]
    - [91, 7.421]
  - - [18234, 58, 1, 66]
    - [189, 13.386]
  - - [33744, 48, 1, 48]
    - [90, 11.958]
  - - [24336, 48, 1, 48]
    - [209, 10.891]
  - - [36896, 32, 1, 32]
    - [172, 8.147]
  - - [2304, 96, 1, 96]
    - [233, 8.394]
  - - [8894, 66, 1, 66]
    - [77, 9.864]
  - - [24816, 48, 1, 48]
    - [119, 10.872]
  - - [40156, 30, 1, 36]
    - [93, 7.945]
  - - [25856, 30, 1, 36]
    - [88, 8.016]
  - - [28448, 32, 1, 32]
    - [319, 7.633]
  - - [32096, 32, 1, 32]
    - [192, 7.921]
  - - [7994, 58, 1, 66]
    - [92, 9.85]
  - - [9376, 32, 1, 32]
    - [204, 4.507]
  - - [32288, 32, 1, 32]
    - [93, 7.926]
  - - [40448, 58, 1, 66]
    - [117, 17.984]
  - - [4224, 96, 1, 96]
    - [233, 13.706]
  - - [10992, 48, 1, 48]
    - [89, 8.392]
  - - [32446, 66, 1, 66]
    - [101, 12.663]
  - - [6912, 48, 1, 48]
    - [168, 6.707]
  - - [43776, 58, 1, 66]
    - [65, 16.525]
  - - [30618, 30, 1, 36]
    - [91, 7.029]
  - - [18432, 96, 1, 96]
    - [141, 22.582]
  - - [23136, 96, 1, 96]
    - [81, 22.09]
  - - [320, 64, 1, 64]
    - [60, 0.757]
  - - [10972, 30, 1, 36]
    - [67, 4.726]
  - - [27648, 58, 1, 66]
    - [81, 16.334]
  - - [7872, 64, 1, 64]
    - [99, 11.625]
  - - [19936, 32, 1, 32]
    - [146, 7.302]
  - - [21146, 30, 1, 36]
    - [91, 7.197]
  - - [16384, 124, 1, 132]
    - [61, 27.53]
  - - [36960, 96, 1, 96]
    - [309, 23.874]
  - - [44032, 66, 1, 66]
    - [101, 15.408]
  - - [28124, 30, 1, 36]
    - [91, 7.958]
  - - [40464, 48, 1, 48]
    - [287, 12.655]
  - - [13216, 32, 1, 32]
    - [106, 5.921]
  - - [4992, 96, 1, 96]
    - [101, 14.299]
  - - [1024, 124, 1, 132]
    - [320, 5.766]
  - - [42288, 48, 1, 48]
    - [119, 12.439]
  - - [25488, 48, 1, 48]
    - [213, 11.027]
  - - [16896, 66, 1, 66]
    - [70, 12.757]
  - - [2144, 32, 1, 32]
    - [166, 1.302]
  - - [22272, 96, 1, 96]
    - [141, 25.553]
  - - [7168, 124, 1, 132]
    - [63, 19.656]
  - - [18944, 128, 1, 128]
    - [34, 29.51]
  - - [3774, 66, 1, 66]
    - [92, 6.174]
  - - [24864, 96, 1, 96]
    - [69, 23.74]
  - - [8256, 64, 1, 64]
    - [70, 12.095]
  - - [11952, 48, 1, 48]
    - [88, 9.059]
  - - [3328, 128, 1, 128]
    - [71, 16.947]
  - - [30266, 58, 1, 66]
    - [90, 14.625]
  - - [36316, 30, 1, 36]
    - [159, 7.685]
  - - [6810, 30, 1, 36]
    - [98, 3.187]
  - - [14144, 64, 1, 64]
    - [84, 14.505]
  - - [22176, 32, 1, 32]
    - [91, 7.753]
  - - [29184, 124, 1, 132]
    - [138, 29.052]
  - - [42144, 96, 1, 96]
    - [207, 24.828]
  - - [43008, 128, 1, 128]
    - [14, 31.629]
  - - [26938, 58, 1, 66]
    - [130, 15.807]
  - - [18368, 64, 1, 64]
    - [184, 16.621]
  - - [6528, 192, 1, 192]
    - [81, 32.864]
  - - [38160, 48, 1, 48]
    - [119, 12.619]
  - - [39792, 48, 1, 48]
    - [287, 12.559]
  - - [12288, 48, 1, 48]
    - [77, 9.113]
  - - [27648, 192, 1, 192]
    - [28, 46.679]
  - - [1536, 128, 1, 128]
    - [233, 9.693]
  - - [14624, 32, 1, 32]
    - [106, 6.489]
  - - [1680, 48, 1, 48]
    - [85, 2.052]
  - - [16032, 96, 1, 96]
    - [70, 20.873]
  - - [23004, 30, 1, 36]
    - [88, 7.616]
  - - [35376, 48, 1, 48]
    - [135, 12.285]
  - - [38144, 30, 1, 36]
    - [114, 8.107]
  - - [35328, 66, 1, 66]
    - [70, 14.851]
  - - [1376, 32, 1, 32]
    - [136, 0.882]
  - - [2816, 66, 1, 66]
    - [98, 5.215]
  - - [3072, 66, 1, 66]
    - [216, 5.533]
  - - [38400, 66, 1, 66]
    - [89, 14.927]
  - - [10528, 32, 1, 32]
    - [106, 4.907]
  - - [15360, 30, 1, 36]
    - [88, 6.282]
  - - [41216, 66, 1, 66]
    - [101, 15.382]
  - - [29376, 64, 1, 64]
    - [105, 17.549]
  - - [23760, 48, 1, 48]
    - [119, 10.634]
  - - [31452, 30, 1, 36]
    - [116, 7.325]
  - - [35584, 30, 1, 36]
    - [106, 7.767]
  - - [10688, 64, 1, 64]
    - [89, 13.513]
  - - [42192, 48, 1, 48]
    - [90, 12.885]
  - - [12912, 48, 1, 48]
    - [101, 9.058]
  - - [29952, 128, 1, 128]
    - [48, 32.005]
  - - [6144, 58, 1, 66]
    - [106, 8.688]
  - - [2592, 32, 1, 32]
    - [133, 1.477]
  - - [32416, 32, 1, 32]
    - [93, 7.832]
  - - [20480, 128, 1, 128]
    - [15, 31.504]
  - - [35292, 30, 1, 36]
    - [115, 7.404]
  - - [2136, 30, 1, 36]
    - [174, 1.209]
  - - [7680, 96, 1, 96]
    - [70, 17.623]
  - - [29886, 66, 1, 66]
    - [89, 11.876]
  - - [31904, 32, 1, 32]
    - [89, 7.915]
  - - [16728, 30, 1, 36]
    - [88, 6.411]
  - - [5856, 96, 1, 96]
    - [70, 15.691]
  - - [26368, 30, 1, 36]
    - [111, 8.021]
  - - [43488, 96, 1, 96]
    - [221, 23.86]
  - - [19610, 30, 1, 36]
    - [93, 6.769]
  - - [37632, 66, 1, 66]
    - [101, 15.138]
  - - [480, 96, 1, 96]
    - [140, 2.121]
  - - [13008, 48, 1, 48]
    - [70, 9.188]
  - - [40250, 58, 1, 66]
    - [119, 16.691]
  - - [38496, 32, 1, 32]
    - [172, 8.38]
  - - [42624, 48, 1, 48]
    - [221, 12.362]
  - - [31040, 64, 1, 64]
    - [309, 18.018]
  - - [11488, 32, 1, 32]
    - [126, 5.147]
  - - [17664, 30, 1, 36]
    - [93, 6.933]
  - - [5720, 30, 1, 36]
    - [107, 2.784]
  - - [9984, 48, 1, 48]
    - [116, 8.036]
  - - [24192, 192, 1, 192]
    - [33, 43.685]
  - - [5852, 30, 1, 36]
    - [139, 2.739]
  - - [23232, 64, 1, 64]
    - [162, 17.721]
  - - [35840, 124, 1, 132]
    - [69, 31.103]
  - - [13056, 30, 1, 36]
    - [126, 5.574]
  - - [12192, 96, 1, 96]
    - [117, 19.476]
  - - [19168, 32, 1, 32]
    - [93, 7.25]
  - - [34656, 32, 1, 32]
    - [70, 8.118]
  - - [13872, 48, 1, 48]
    - [128, 9.002]
  - - [31488, 192, 1, 192]
    - [37, 44.749]
  - - [18080, 32, 1, 32]
    - [91, 7.383]
  - - [38064, 48, 1, 48]
    - [135, 12.547]
  - - [43728, 48, 1, 48]
    - [119, 11.886]
  - - [2304, 48, 1, 48]
    - [85, 2.545]
  - - [39072, 96, 1, 96]
    - [117, 24.55]
  - - [30272, 64, 1, 64]
    - [158, 17.796]
  - - [22272, 192, 1, 192]
    - [24, 40.131]
  - - [9274, 58, 1, 66]
    - [116, 10.596]
  - - [4096, 30, 1, 36]
    - [139, 1.974]
  - - [43352, 30, 1, 36]
    - [128, 7.932]
  - - [30336, 48, 1, 48]
    - [90, 10.975]
  - - [22616, 30, 1, 36]
    - [88, 7.697]
  - - [528, 48, 1, 48]
    - [174, 0.661]
  - - [5088, 96, 1, 96]
    - [99, 13.546]
  - - [12320, 32, 1, 32]
    - [127, 5.685]
  - - [18288, 48, 1, 48]
    - [231, 9.994]
  - - [38720, 64, 1, 64]
    - [61, 18.958]
  - - [15580, 30, 1, 36]
    - [92, 6.216]
  - - [13312, 30, 1, 36]
    - [67, 5.89]
  - - [21818, 58, 1, 66]
    - [154, 14.366]
  - - [10810, 58, 1, 66]
    - [77, 10.97]
  - - [11168, 32, 1, 32]
    - [106, 5.313]
  - - [27648, 30, 1, 36]
    - [111, 8.205]
  - - [28416, 96, 1, 96]
    - [84, 23.051]
  - - [17376, 32, 1, 32]
    - [93, 7.096]
  - - [9504, 32, 1, 32]
    - [106, 4.666]
  - - [43776, 96, 1, 96]
    - [95, 26.085]
  - - [5376, 58, 1, 66]
    - [88, 7.665]
  - - [34720, 32, 1, 32]
    - [89, 8.011]
  - - [5208, 30, 1, 36]
    - [98, 2.586]
  - - [17904, 48, 1, 48]
    - [189, 9.632]
  - - [11872, 32, 1, 32]
    - [165, 5.268]
  - - [5760, 96, 1, 96]
    - [89, 16.274]
  - - [29664, 32, 1, 32]
    - [192, 7.605]
  - - [32768, 128, 1, 128]
    - [14, 29.76]
  - - [16698, 58, 1, 66]
    - [189, 12.746]
  - - [2202, 30, 1, 36]
    - [321, 1.152]
  - - [32160, 32, 1, 32]
    - [116, 7.852]
  - - [9280, 64, 1, 64]
    - [99, 12.88]
  - - [18432, 48, 1, 48]
    - [244, 10.02]
  - - [40924, 30, 1, 36]
    - [77, 7.781]
  - - [36000, 96, 1, 96]
    - [104, 23.658]
  - - [25344, 124, 1, 132]
    - [110, 33.088]
  - - [9984, 124, 1, 132]
    - [134, 25.572]
  - - [34320, 48, 1, 48]
    - [130, 12.204]
  - - [24192, 96, 1, 96]
    - [95, 27.083]
  - - [43152, 48, 1, 48]
    - [119, 11.822]
  - - [30496, 32, 1, 32]
    - [92, 7.648]
  - - [16128, 58, 1, 66]
    - [65, 12.589]
  - - [13440, 48, 1, 48]
    - [101, 9.181]
  - - [13020, 30, 1, 36]
    - [106, 5.463]
  - - [344, 30, 1, 36]
    - [86, 0.199]
  - - [7614, 66, 1, 66]
    - [99, 9.401]
  - - [22462, 66, 1, 66]
    - [153, 12.856]
  - - [38590, 66, 1, 66]
    - [125, 12.972]
  - - [31832, 30, 1, 36]
    - [77, 7.343]
  - - [3504, 48, 1, 48]
    - [98, 3.638]
  - - [12800, 30, 1, 36]
    - [67, 5.465]
  - - [30208, 58, 1, 66]
    - [61, 14.763]
  - - [10650, 30, 1, 36]
    - [322, 4.628]
  - - [28352, 64, 1, 64]
    - [105, 17.562]
  - - [33840, 48, 1, 48]
    - [90, 12.158]
  - - [26112, 58, 1, 66]
    - [73, 15.862]
  - - [33594, 58, 1, 66]
    - [119, 15.496]
  - - [18528, 32, 1, 32]
    - [91, 7.125]
  - - [22272, 58, 1, 66]
    - [119, 14.39]
  - - [29344, 32, 1, 32]
    - [264, 7.694]
  - - [21456, 48, 1, 48]
    - [148, 10.659]
  - - [2448, 48, 1, 48]
    - [250, 2.594]
  - - [30976, 128, 1, 128]
    - [3, 29.436]
  - - [25776, 48, 1, 48]
    - [90, 11.198]
  - - [44288, 58, 1, 66]
    - [61, 17.131]
  - - [27868, 30, 1, 36]
    - [77, 7.979]
  - - [16160, 32, 1, 32]
    - [93, 6.842]
  - - [10752, 66, 1, 66]
    - [70, 10.553]
  - - [8448, 124, 1, 132]
    - [83, 22.416]
  - - [4128, 32, 1, 32]
    - [106, 2.093]
  - - [23552, 30, 1, 36]
    - [93, 7.745]
  - - [42864, 48, 1, 48]
    - [119, 11.805]
  - - [31456, 32, 1, 32]
    - [323, 7.805]
  - - [30040, 30, 1, 36]
    - [77, 7.459]
  - - [11834, 58, 1, 66]
    - [88, 11.405]
  - - [5408, 32, 1, 32]
    - [66, 2.713]
  - - [18880, 64, 1, 64]
    - [305, 16.517]
  - - [40032, 96, 1, 96]
    - [117, 24.487]
  - - [6298, 30, 1, 36]
    - [191, 3.005]
  - - [17496, 30, 1, 36]
    - [91, 6.812]
  - - [1392, 48, 1, 48]
    - [85, 1.554]
  - - [6912, 58, 1, 66]
    - [113, 9.102]
  - - [4000, 32, 1, 32]
    - [106, 2.028]
  - - [16860, 30, 1, 36]
    - [92, 6.565]
  - - [31232, 124, 1, 132]
    - [324, 30.8]
  - - [31328, 32, 1, 32]
    - [99, 7.857]
  - - [28672, 128, 1, 128]
    - [32, 28.115]
  - - [26112, 66, 1, 66]
    - [69, 14.772]
  - - [25344, 128, 1, 128]
    - [15, 34.913]
  - - [10072, 30, 1, 36]
    - [126, 4.581]
  - - [34272, 96, 1, 96]
    - [84, 23.803]
  - - [34816, 30, 1, 36]
    - [114, 7.738]
  - - [40192, 66, 1, 66]
    - [99, 15.202]
  - - [12256, 32, 1, 32]
    - [106, 5.545]
  - - [24920, 30, 1, 36]
    - [93, 8.195]
  - - [33696, 32, 1, 32]
    - [77, 7.934]
  - - [44186, 30, 1, 36]
    - [91, 7.906]
  - - [14160, 48, 1, 48]
    - [102, 9.247]
  - - [13056, 66, 1, 66]
    - [63, 11.442]
  - - [31056, 48, 1, 48]
    - [90, 11.855]
  - - [13824, 124, 1, 132]
    - [75, 29.302]
  - - [29594, 30, 1, 36]
    - [106, 7.026]
  - - [35840, 128, 1, 128]
    - [26, 33.079]
  - - [19770, 58, 1, 66]
    - [155, 13.808]
  - - [20670, 66, 1, 66]
    - [61, 12.222]
  - - [13152, 96, 1, 96]
    - [59, 20.613]
  - - [10716, 30, 1, 36]
    - [106, 4.575]
  - - [42650, 30, 1, 36]
    - [77, 7.923]
  - - [8160, 96, 1, 96]
    - [89, 17.38]
  - - [17616, 48, 1, 48]
    - [203, 9.577]
  - - [44128, 32, 1, 32]
    - [89, 9.091]
  - - [20784, 48, 1, 48]
    - [189, 10.578]
  - - [23808, 128, 1, 128]
    - [15, 33.805]
  - - [12480, 64, 1, 64]
    - [211, 14.673]
  - - [7168, 128, 1, 128]
    - [305, 21.691]
  - - [30720, 128, 1, 128]
    - [45, 32.357]
  - - [25856, 124, 1, 132]
    - [208, 33.285]
  - - [4608, 192, 1, 192]
    - [63, 32.166]
  - - [2208, 96, 1, 96]
    - [200, 8.045]
  - - [12032, 30, 1, 36]
    - [106, 5.324]
  - - [18776, 30, 1, 36]
    - [92, 7.253]
  - - [24288, 96, 1, 96]
    - [81, 23.031]
  - - [2976, 32, 1, 32]
    - [204, 1.597]
  - - [7440, 48, 1, 48]
    - [113, 6.837]
  - - [27120, 48, 1, 48]
    - [268, 11.494]
  - - [28704, 96, 1, 96]
    - [105, 22.494]
  - - [23772, 30, 1, 36]
    - [93, 7.714]
  - - [19872, 32, 1, 32]
    - [92, 7.278]
  - - [3386, 58, 1, 66]
    - [98, 5.169]
  - - [40536, 30, 1, 36]
    - [77, 8.053]
  - - [4128, 96, 1, 96]
    - [128, 12.795]
  - - [22272, 128, 1, 128]
    - [15, 32.628]
  - - [15904, 32, 1, 32]
    - [115, 6.733]
  - - [3840, 96, 1, 96]
    - [71, 13.291]
  - - [14688, 96, 1, 96]
    - [70, 20.2]
  - - [5120, 124, 1, 132]
    - [116, 19.368]
  - - [17696, 32, 1, 32]
    - [88, 7.04]
  - - [37600, 32, 1, 32]
    - [89, 8.302]
  - - [42912, 32, 1, 32]
    - [99, 8.92]
  - - [240, 48, 1, 48]
    - [174, 0.304]
  - - [6144, 48, 1, 48]
    - [126, 5.962]
  - - [10752, 124, 1, 132]
    - [59, 25.834]
  - - [14234, 30, 1, 36]
    - [106, 5.678]
  - - [24890, 58, 1, 66]
    - [268, 14.909]
  - - [37824, 64, 1, 64]
    - [117, 18.669]
  - - [10048, 64, 1, 64]
    - [89, 13.638]
  - - [13276, 30, 1, 36]
    - [244, 5.619]
  - - [43776, 30, 1, 36]
    - [118, 8.488]
  - - [14544, 48, 1, 48]
    - [148, 8.78]
  - - [42720, 96, 1, 96]
    - [84, 24.173]
  - - [12576, 32, 1, 32]
    - [126, 5.803]
  - - [41728, 30, 1, 36]
    - [114, 8.29]
  - - [41536, 64, 1, 64]
    - [61, 19.812]
  - - [6656, 124, 1, 132]
    - [63, 22.317]
  - - [30684, 30, 1, 36]
    - [91, 7.146]
  - - [6176, 32, 1, 32]
    - [144, 3.202]
  - - [34750, 66, 1, 66]
    - [70, 12.54]
  - - [3216, 48, 1, 48]
    - [112, 3.408]
  - - [4992, 48, 1, 48]
    - [144, 4.89]
  - - [38688, 32, 1, 32]
    - [99, 8.542]
  - - [31584, 32, 1, 32]
    - [99, 8.052]
  - - [1248, 96, 1, 96]
    - [136, 4.799]
  - - [6202, 58, 1, 66]
    - [115, 8.359]
  - - [40800, 32, 1, 32]
    - [101, 8.717]
  - - [36160, 64, 1, 64]
    - [81, 18.593]
  - - [39552, 48, 1, 48]
    - [81, 13.079]
  - - [2560, 128, 1, 128]
    - [78, 14.212]
  - - [9406, 66, 1, 66]
    - [89, 9.668]
  - - [8640, 64, 1, 64]
    - [89, 12.759]
  - - [28576, 32, 1, 32]
    - [192, 7.757]
  - - [16128, 124, 1, 132]
    - [301, 27.286]
  - - [1200, 48, 1, 48]
    - [214, 1.4]
  - - [20992, 30, 1, 36]
    - [128, 7.298]
  - - [14490, 30, 1, 36]
    - [93, 5.734]
  - - [10304, 64, 1, 64]
    - [70, 13.783]
  - - [5792, 32, 1, 32]
    - [106, 2.905]
  - - [12800, 124, 1, 132]
    - [75, 28.612]
  - - [14592, 30, 1, 36]
    - [93, 5.968]
  - - [24064, 66, 1, 66]
    - [117, 13.935]
  - - [18400, 32, 1, 32]
    - [91, 7.135]
  - - [26720, 32, 1, 32]
    - [253, 8.446]
  - - [14138, 58, 1, 66]
    - [189, 11.84]
  - - [25534, 66, 1, 66]
    - [125, 13.658]
  - - [15424, 64, 1, 64]
    - [105, 14.676]
  - - [15504, 48, 1, 48]
    - [231, 9.044]
  - - [19200, 66, 1, 66]
    - [69, 13.706]
  - - [19424, 32, 1, 32]
    - [93, 7.229]
  - - [31536, 48, 1, 48]
    - [90, 11.864]
  - - [11776, 124, 1, 132]
    - [61, 26.893]
  - - [41984, 128, 1, 128]
    - [7, 35.92]
  - - [24352, 32, 1, 32]
    - [92, 8.144]
  - - [128, 1, 1, 128]
    - [66, 0.007]
  - - [1408, 64, 1, 64]
    - [144, 2.795]
  - - [26240, 16, 1, 16]
    - [244, 3.027]
  - - [29952, 16, 1, 16]
    - [98, 3.26]
  - - [14208, 32, 1, 32]
    - [91, 5.961]
  - - [1152, 64, 1, 64]
    - [325, 2.417]
  - - [14720, 16, 1, 16]
    - [67, 1.826]
  - - [44544, 32, 1, 32]
    - [99, 9.177]
  - - [35072, 64, 1, 64]
    - [81, 19.097]
  - - [41472, 32, 1, 32]
    - [99, 8.985]
  - - [36992, 32, 1, 32]
    - [70, 8.578]
  - - [33792, 32, 1, 32]
    - [89, 8.295]
  - - [39296, 64, 1, 64]
    - [61, 19.819]
  - - [39552, 16, 1, 16]
    - [220, 3.283]
  - - [27136, 64, 1, 64]
    - [59, 19.799]
  - - [2944, 32, 1, 32]
    - [91, 1.637]
  - - [42752, 32, 1, 32]
    - [101, 9.05]
  - - [30848, 64, 1, 64]
    - [61, 18.135]
  - - [23936, 16, 1, 16]
    - [137, 2.789]
  - - [38272, 32, 1, 32]
    - [89, 8.532]
  - - [34816, 16, 1, 16]
    - [112, 3.114]
  - - [17920, 32, 1, 32]
    - [93, 7.254]
  - - [23424, 64, 1, 64]
    - [61, 18.399]
  - - [15488, 16, 1, 16]
    - [326, 1.921]
  - - [19456, 64, 1, 64]
    - [73, 16.941]
  - - [27392, 16, 1, 16]
    - [242, 3.01]
  - - [30976, 32, 1, 32]
    - [89, 8.168]
  - - [23168, 64, 1, 64]
    - [117, 18.198]
  - - [30592, 32, 1, 32]
    - [89, 8.114]
  - - [36608, 64, 1, 64]
    - [69, 19.474]
  - - [18944, 16, 1, 16]
    - [137, 2.35]
  - - [30720, 32, 1, 32]
    - [89, 8.055]
  - - [32384, 16, 1, 16]
    - [257, 3.14]
  - - [13952, 32, 1, 32]
    - [233, 6.132]
  - - [44544, 64, 1, 64]
    - [81, 19.393]
  - - [44288, 16, 1, 16]
    - [244, 3.548]
  - - [3840, 64, 1, 64]
    - [78, 6.751]
  - - [40064, 64, 1, 64]
    - [117, 20.042]
  - - [10624, 32, 1, 32]
    - [71, 4.952]
  - - [39424, 32, 1, 32]
    - [101, 8.789]
  - - [16256, 64, 1, 64]
    - [221, 15.155]
  - - [26752, 32, 1, 32]
    - [230, 8.573]
  - - [36608, 16, 1, 16]
    - [220, 3.224]
  - - [21376, 16, 1, 16]
    - [113, 2.466]
  - - [23552, 32, 1, 32]
    - [88, 8.051]
  - - [29056, 64, 1, 64]
    - [309, 17.414]
  - - [29312, 16, 1, 16]
    - [98, 3.131]
  - - [43648, 32, 1, 32]
    - [70, 9.114]
  - - [33280, 64, 1, 64]
    - [81, 19.078]
  - - [11520, 16, 1, 16]
    - [327, 1.461]
  - - [2560, 16, 1, 16]
    - [228, 0.399]
  - - [19840, 32, 1, 32]
    - [91, 7.266]
  - - [17664, 64, 1, 64]
    - [84, 16.142]
  - - [8192, 16, 1, 16]
    - [86, 1.086]
  - - [40448, 32, 1, 32]
    - [99, 8.889]
  - - [44800, 32, 1, 32]
    - [143, 9.189]
  - - [35968, 32, 1, 32]
    - [101, 8.341]
  - - [9216, 64, 1, 64]
    - [99, 12.695]
  - - [768, 16, 1, 16]
    - [328, 0.132]
  - - [1792, 64, 1, 64]
    - [71, 3.635]
  - - [33280, 16, 1, 16]
    - [329, 3.147]
  - - [26112, 64, 1, 64]
    - [75, 19.594]
  - - [42240, 16, 1, 16]
    - [139, 3.361]
  - - [14336, 32, 1, 32]
    - [106, 6.241]
  - - [29824, 64, 1, 64]
    - [132, 17.589]
  - - [10624, 16, 1, 16]
    - [290, 1.513]
  - - [41344, 32, 1, 32]
    - [101, 8.792]
  - - [14592, 64, 1, 64]
    - [84, 14.176]
  - - [17408, 16, 1, 16]
    - [112, 2.231]
  - - [4608, 32, 1, 32]
    - [86, 2.531]
  - - [4864, 32, 1, 32]
    - [126, 2.61]
  - - [128, 32, 1, 32]
    - [174, 0.087]
  - - [26368, 16, 1, 16]
    - [318, 3.104]
  - - [38144, 32, 1, 32]
    - [275, 8.463]
  - - [22144, 64, 1, 64]
    - [81, 18.413]
  - - [896, 32, 1, 32]
    - [66, 0.591]
  - - [31488, 64, 1, 64]
    - [61, 18.75]
  - - [1536, 16, 1, 16]
    - [187, 0.277]
  - - [2432, 64, 1, 64]
    - [144, 4.776]
  - - [35456, 16, 1, 16]
    - [167, 3.123]
  - - [8832, 32, 1, 32]
    - [216, 4.529]
  - - [6656, 64, 1, 64]
    - [233, 11.17]
  - - [4992, 64, 1, 64]
    - [233, 8.946]
  - - [22272, 32, 1, 32]
    - [156, 7.968]
  - - [26752, 64, 1, 64]
    - [81, 19.832]
  - - [3456, 16, 1, 16]
    - [260, 0.525]
  - - [14336, 16, 1, 16]
    - [330, 2.017]
  - - [30208, 32, 1, 32]
    - [101, 7.921]
  - - [19328, 64, 1, 64]
    - [104, 17.319]
  - - [27776, 16, 1, 16]
    - [168, 3.237]
  - - [15360, 64, 1, 64]
    - [72, 14.767]
  - - [6912, 16, 1, 16]
    - [331, 0.997]
  - - [26880, 32, 1, 32]
    - [70, 8.924]
  - - [2688, 64, 1, 64]
    - [204, 5.168]
  - - [20352, 16, 1, 16]
    - [112, 2.552]
  - - [26496, 32, 1, 32]
    - [332, 8.491]
  - - [31232, 16, 1, 16]
    - [191, 3.367]
  - - [43008, 32, 1, 32]
    - [89, 8.94]
  - - [11648, 64, 1, 64]
    - [101, 14.829]
  - - [11904, 16, 1, 16]
    - [86, 1.655]
  - - [38528, 16, 1, 16]
    - [333, 3.175]
  - - [13696, 64, 1, 64]
    - [334, 15.51]
  - - [19584, 64, 1, 64]
    - [63, 17.297]
  - - [33152, 16, 1, 16]
    - [335, 3.135]
  - - [39296, 32, 1, 32]
    - [89, 8.677]
  - - [2560, 32, 1, 32]
    - [126, 1.554]
  - - [28544, 64, 1, 64]
    - [276, 17.447]
  - - [24704, 16, 1, 16]
    - [108, 3.0]
  - - [6272, 32, 1, 32]
    - [166, 3.365]
  - - [4096, 64, 1, 64]
    - [126, 7.561]
  - - [32512, 16, 1, 16]
    - [137, 3.206]
  - - [36480, 64, 1, 64]
    - [61, 19.747]
  - - [896, 16, 1, 16]
    - [80, 0.154]
  - - [2304, 16, 1, 16]
    - [140, 0.403]
  - - [13056, 64, 1, 64]
    - [336, 15.062]
  - - [7680, 16, 1, 16]
    - [157, 1.108]
  - - [19456, 32, 1, 32]
    - [88, 7.74]
  - - [41344, 64, 1, 64]
    - [81, 20.571]
  - - [28416, 32, 1, 32]
    - [70, 7.852]
  - - [23168, 32, 1, 32]
    - [253, 8.099]
  - - [20736, 16, 1, 16]
    - [139, 2.518]
  - - [9856, 16, 1, 16]
    - [152, 1.421]
  - - [20224, 32, 1, 32]
    - [88, 7.588]
  - - [29952, 64, 1, 64]
    - [117, 17.721]
  - - [4096, 16, 1, 16]
    - [228, 0.63]
  - - [36352, 32, 1, 32]
    - [99, 8.305]
  - - [17280, 64, 1, 64]
    - [134, 16.192]
  - - [21504, 64, 1, 64]
    - [117, 17.961]
  - - [8832, 64, 1, 64]
    - [89, 12.939]
  - - [34688, 16, 1, 16]
    - [98, 3.055]
  - - [16384, 32, 1, 32]
    - [93, 7.001]
  - - [18048, 16, 1, 16]
    - [113, 2.288]
  - - [5632, 64, 1, 64]
    - [233, 9.901]
  - - [21760, 16, 1, 16]
    - [191, 2.643]
  - - [7808, 32, 1, 32]
    - [106, 4.095]
  - - [25728, 64, 1, 64]
    - [96, 19.706]
  - - [6528, 16, 1, 16]
    - [60, 1.032]
  - - [4480, 32, 1, 32]
    - [85, 2.521]
  - - [29696, 16, 1, 16]
    - [337, 3.294]
  - - [512, 32, 1, 32]
    - [328, 0.338]
  - - [42880, 64, 1, 64]
    - [81, 18.936]
  - - [14464, 16, 1, 16]
    - [98, 1.896]
  - - [28800, 32, 1, 32]
    - [92, 7.864]
  - - [43264, 16, 1, 16]
    - [168, 3.419]
  - - [2048, 64, 1, 64]
    - [165, 4.109]
  - - [5888, 16, 1, 16]
    - [174, 0.906]
  - - [43776, 32, 1, 32]
    - [89, 9.1]
  - - [1664, 64, 1, 64]
    - [86, 3.531]
  - - [13184, 32, 1, 32]
    - [93, 6.146]
  - - [11008, 64, 1, 64]
    - [163, 13.917]
  - - [13824, 16, 1, 16]
    - [66, 1.945]
  - - [31104, 64, 1, 64]
    - [117, 18.521]
  - - [18944, 64, 1, 64]
    - [105, 17.226]
  - - [7936, 32, 1, 32]
    - [165, 4.258]
  - - [34560, 32, 1, 32]
    - [101, 8.264]
  - - [22656, 64, 1, 64]
    - [61, 18.423]
  - - [15744, 16, 1, 16]
    - [139, 2.018]
  - - [27904, 64, 1, 64]
    - [75, 20.279]
  - - [26624, 16, 1, 16]
    - [137, 3.134]
  - - [42496, 32, 1, 32]
    - [143, 8.794]
  - - [15232, 64, 1, 64]
    - [190, 14.419]
  - - [7296, 16, 1, 16]
    - [85, 0.979]
  - - [38016, 32, 1, 32]
    - [275, 8.434]
  - - [44032, 64, 1, 64]
    - [61, 19.306]
  - - [19200, 16, 1, 16]
    - [167, 2.434]
  - - [22784, 32, 1, 32]
    - [253, 8.15]
  - - [14976, 64, 1, 64]
    - [198, 14.627]
  - - [22400, 32, 1, 32]
    - [146, 7.952]
  - - [28416, 64, 1, 64]
    - [338, 17.602]
  - - [10752, 16, 1, 16]
    - [107, 1.654]
  - - [22528, 32, 1, 32]
    - [88, 7.936]
  - - [23936, 64, 1, 64]
    - [59, 18.963]
  - - [24192, 16, 1, 16]
    - [168, 2.907]
  - - [38528, 32, 1, 32]
    - [252, 8.427]
  - - [3584, 64, 1, 64]
    - [200, 6.891]
  - - [36096, 16, 1, 16]
    - [167, 3.131]
  - - [13824, 64, 1, 64]
    - [63, 15.655]
  - - [31872, 64, 1, 64]
    - [81, 18.102]
  - - [35200, 32, 1, 32]
    - [89, 8.505]
  - - [41216, 64, 1, 64]
    - [339, 20.342]
  - - [40832, 64, 1, 64]
    - [69, 20.261]
  - - [4224, 16, 1, 16]
    - [340, 0.65]
  - - [18560, 32, 1, 32]
    - [93, 7.383]
  - - [16384, 64, 1, 64]
    - [258, 15.352]
  - - [28416, 16, 1, 16]
    - [341, 3.278]
  - - [23808, 32, 1, 32]
    - [93, 8.02]
  - - [13184, 16, 1, 16]
    - [86, 1.878]
  - - [27520, 32, 1, 32]
    - [70, 8.82]
  - - [36352, 16, 1, 16]
    - [220, 3.061]
  - - [35456, 32, 1, 32]
    - [70, 8.434]
  - - [25088, 64, 1, 64]
    - [61, 19.458]
  - - [12416, 16, 1, 16]
    - [85, 1.813]
  - - [13568, 16, 1, 16]
    - [342, 1.886]
  - - [20608, 64, 1, 64]
    - [109, 17.86]
  - - [44416, 32, 1, 32]
    - [183, 9.069]
  - - [42240, 64, 1, 64]
    - [81, 20.627]
  - - [13184, 64, 1, 64]
    - [223, 15.306]
  - - [38016, 16, 1, 16]
    - [167, 3.178]
  - - [27776, 32, 1, 32]
    - [343, 8.84]
  - - [33792, 64, 1, 64]
    - [117, 19.075]
  - - [20736, 32, 1, 32]
    - [179, 7.656]
  - - [4736, 64, 1, 64]
    - [126, 8.571]
  - - [41728, 32, 1, 32]
    - [101, 8.793]
  - - [26368, 64, 1, 64]
    - [75, 19.948]
  - - [25088, 16, 1, 16]
    - [311, 2.954]
  - - [12288, 32, 1, 32]
    - [200, 5.786]
  - - [5504, 64, 1, 64]
    - [106, 9.495]
  - - [44672, 32, 1, 32]
    - [89, 9.203]
  - - [1280, 16, 1, 16]
    - [80, 0.227]
  - - [6912, 32, 1, 32]
    - [157, 3.753]
  - - [2432, 16, 1, 16]
    - [157, 0.419]
  - - [33152, 32, 1, 32]
    - [188, 8.01]
  - - [6400, 64, 1, 64]
    - [233, 10.643]
  - - [9216, 16, 1, 16]
    - [60, 1.281]
  - - [29184, 32, 1, 32]
    - [101, 8.016]
  - - [22400, 64, 1, 64]
    - [59, 18.459]
  - - [10368, 16, 1, 16]
    - [331, 1.441]
  - - [14336, 64, 1, 64]
    - [84, 14.076]
  - - [23296, 64, 1, 64]
    - [82, 18.616]
  - - [37888, 32, 1, 32]
    - [70, 8.366]
  - - [33408, 32, 1, 32]
    - [88, 8.03]
  - - [31232, 64, 1, 64]
    - [81, 18.244]
  - - [768, 64, 1, 64]
    - [60, 1.729]
  - - [18560, 64, 1, 64]
    - [63, 16.96]
  - - [28032, 16, 1, 16]
    - [167, 3.267]
  - - [42368, 32, 1, 32]
    - [101, 8.928]
  - - [40192, 64, 1, 64]
    - [69, 20.271]
  - - [38912, 16, 1, 16]
    - [318, 3.207]
  - - [22016, 32, 1, 32]
    - [230, 7.876]
  - - [11136, 64, 1, 64]
    - [288, 13.984]
  - - [17536, 32, 1, 32]
    - [88, 7.493]
  - - [39936, 64, 1, 64]
    - [61, 20.477]
  - - [31488, 16, 1, 16]
    - [344, 3.527]
  - - [18688, 32, 1, 32]
    - [88, 7.632]
  - - [27264, 64, 1, 64]
    - [81, 20.375]
  - - [18304, 32, 1, 32]
    - [115, 7.345]
  - - [7936, 64, 1, 64]
    - [89, 11.719]
  - - [2048, 32, 1, 32]
    - [165, 1.295]
  - - [3456, 64, 1, 64]
    - [66, 6.444]
  - - [36480, 16, 1, 16]
    - [167, 3.164]
  - - [15616, 16, 1, 16]
    - [139, 2.002]
  - - [7296, 64, 1, 64]
    - [89, 10.861]
  - - [44160, 64, 1, 64]
    - [81, 19.18]
  - - [20736, 64, 1, 64]
    - [63, 17.721]
  - - [7168, 16, 1, 16]
    - [66, 1.133]
  - - [27136, 32, 1, 32]
    - [332, 8.696]
  - - [20352, 64, 1, 64]
    - [198, 17.804]
  - - [16512, 16, 1, 16]
    - [98, 2.215]
  - - [30848, 32, 1, 32]
    - [88, 7.822]
  - - [24320, 16, 1, 16]
    - [112, 2.863]
  - - [19712, 32, 1, 32]
    - [93, 7.518]
  - - [6400, 16, 1, 16]
    - [60, 0.869]
  - - [25472, 16, 1, 16]
    - [167, 2.999]
  - - [39808, 32, 1, 32]
    - [101, 8.748]
  - - [37632, 64, 1, 64]
    - [81, 19.961]
  - - [32256, 16, 1, 16]
    - [112, 3.127]
  - - [44032, 32, 1, 32]
    - [99, 8.991]
  - - [33152, 64, 1, 64]
    - [117, 18.888]
  - - [640, 16, 1, 16]
    - [260, 0.109]
  - - [4480, 16, 1, 16]
    - [85, 0.718]
  - - [16512, 64, 1, 64]
    - [309, 15.711]
  - - [9600, 16, 1, 16]
    - [152, 1.457]
  - - [21760, 64, 1, 64]
    - [81, 18.093]
  - - [44800, 128, 1, 128]
    - [26, 32.784]
  - - [41856, 64, 1, 64]
    - [61, 20.44]
  - - [13312, 64, 1, 64]
    - [72, 15.358]
  - - [16640, 32, 1, 32]
    - [93, 7.176]
  - - [33408, 64, 1, 64]
    - [81, 19.033]
  - - [38656, 64, 1, 64]
    - [61, 20.214]
  - - [4608, 16, 1, 16]
    - [345, 0.718]
  - - [40960, 32, 1, 32]
    - [89, 8.874]
  - - [44544, 128, 1, 128]
    - [26, 32.532]
  - - [40576, 32, 1, 32]
    - [101, 8.833]
  - - [384, 32, 1, 32]
    - [140, 0.257]
  - - [18688, 64, 1, 64]
    - [105, 16.665]
  - - [25088, 32, 1, 32]
    - [101, 8.576]
  - - [34688, 64, 1, 64]
    - [81, 19.171]
  - - [39040, 16, 1, 16]
    - [113, 3.217]
  - - [20608, 32, 1, 32]
    - [101, 7.67]
  - - [42240, 32, 1, 32]
    - [70, 9.025]
  - - [37760, 32, 1, 32]
    - [101, 8.5]
  - - [35584, 64, 1, 64]
    - [61, 19.666]
  - - [38400, 16, 1, 16]
    - [112, 3.21]
