library/src/blas3/Tensile/Logic/asm_full/aldebaran/aldebaran_Cijk_Ailk_Bljk_BBS_BH.yaml
- {MinimumRequiredVersion: 4.31.0}
- aldebaran
- gfx90a
- [Device 0050, Device 0051, Device 0052, Device 0054, Device 0062, Device 7400, Device
    SolutionIndex: 0
    SolutionIndex: 1
    SolutionIndex: 2
    SolutionIndex: 3
    SolutionIndex: 4
    SolutionIndex: 5
    SolutionIndex: 6
    SolutionNameMin: Cijk_Ailk_Bljk_BBS_BH_MT64x32x32_MI16x16x8x1_SE_AF0EM4_GRVW2_LBSPP128_LPB2_NLCA1_SU0_SUS256_SRVW0_TT2_16_WG32_8_1_WGM1
    SolutionIndex: 7
    SolutionNameMin: Cijk_Ailk_Bljk_BBS_BH_MT64x64x32_MI32x32x4x1_SE_AF0EM4_GRVW8_LBSPP128_LPB8_NLCA1_SU32_SUS128_SRVW0_TT1_32_WG64_4_1_WGM1
    SolutionIndex: 8
    SolutionNameMin: Cijk_Ailk_Bljk_BBS_BH_MT64x16x32_MI16x16x8x1_SE_GRVW2_LPB4_PLR5_SU0_SUS256_SRVW0_WGM1
    SolutionIndex: 9
    SolutionNameMin: Cijk_Ailk_Bljk_BBS_BH_MT64x16x32_MI16x16x16x1_SE_1LDSB0_AF0EM8_EPS1_GRVW2_GSU1_LPB16_NLCA1_PGR1_PLR2_SU0_SUS0_SRVW0_TT1_16_VAW2_WG64_4_1_WGM1
    SolutionIndex: 10
    SolutionNameMin: Cijk_Ailk_Bljk_BBS_BH_MT16x16x64_MI16x16x16x1_SE_1LDSB0_AF0EM8_EPS0_GRVW8_GSU1_LPB16_NLCA1_PGR2_PLR5_SU0_SUS0_SRVW0_TT1_16_VAW2_WG16_4_1_WGM1
    SolutionIndex: 11
    SolutionNameMin: Cijk_Ailk_Bljk_BBS_BH_MT32x32x32_MI16x16x16x1_SE_1LDSB0_AF0EM8_EPS0_GRVW8_GSU1_LPB16_NLCA1_PGR2_PLR2_SU0_SUS0_SRVW4_TT1_16_VAW2_WG32_8_1_WGM1
    SolutionIndex: 12
    SolutionNameMin: Cijk_Ailk_Bljk_BBS_BH_MT64x16x32_MI16x16x16x1_SE_1LDSB0_AF0EM8_EPS0_GRVW4_GSU1_LPB16_NLCA1_PGR2_PLR2_SU0_SUS0_SRVW0_TT1_16_VAW2_WG64_4_1_WGM1
    SolutionIndex: 13
    SolutionNameMin: Cijk_Ailk_Bljk_BBS_BH_MT16x64x64_MI16x16x16x1_SE_1LDSB0_AF0EM8_EPS0_GRVW8_GSU1_LPB16_NLCA1_PGR2_PLR5_SU0_SUS0_SRVW0_TT1_16_VAW2_WG16_16_1_WGM15
    SolutionIndex: 14
    SolutionNameMin: Cijk_Ailk_Bljk_BBS_BH_MT64x32x32_MI16x16x16x1_SE_1LDSB1_AF0EM8_EPS1_GRVW2_GSU1_LPB16_NLCA1_PGR1_PLR2_SU0_SUS0_SRVW4_TT2_16_VAW2_WG32_8_1_WGM1
    SolutionIndex: 15
    SolutionNameMin: Cijk_Ailk_Bljk_BBS_BH_MT16x64x64_MI16x16x16x1_SE_1LDSB0_AF0EM8_EPS0_GRVW8_GSU1_LPB16_NLCA1_PGR2_PLR5_SU32_SUS256_SRVW0_TT1_16_VAW2_WG16_16_1_WGM1
    SolutionIndex: 16
    SolutionNameMin: Cijk_Ailk_Bljk_BBS_BH_MT64x192x32_MI32x32x8x1_SE_1LDSB1_AF0EM8_EPS1_GRVW4_GSU1_LPB8_NLCA1_PGR1_PLR5_SU0_SUS0_SRVW4_TT1_96_VAW2_WG64_4_1_WGM15
    SolutionIndex: 17
    SolutionNameMin: Cijk_Ailk_Bljk_BBS_BH_MT64x32x32_MI16x16x16x1_SE_1LDSB1_AF0EM8_EPS1_GRVW2_GSU1_LPB16_NLCA1_PGR1_PLR2_SU0_SUS0_SRVW4_TT2_16_VAW2_WG32_8_1_WGM15
    SolutionIndex: 18
    SolutionNameMin: Cijk_Ailk_Bljk_BBS_BH_MT64x16x32_MI16x16x16x1_SE_1LDSB0_AF0EM8_EPS0_GRVW8_GSU1_LPB16_NLCA1_PGR2_PLR2_SU0_SUS0_SRVW0_TT1_16_VAW2_WG64_4_1_WGM15
    SolutionIndex: 19
    SolutionNameMin: Cijk_Ailk_Bljk_BBS_BH_MT128x96x32_MI32x32x8x1_SE_1LDSB1_AF0EM8_EPS1_GRVW2_GSU1_LPB8_NLCA1_PGR1_PLR5_SU32_SUS256_SRVW4_TT1_96_VAW2_WG128_2_1_WGM1
    SolutionIndex: 20
    SolutionNameMin: Cijk_Ailk_Bljk_BBS_BH_MT64x16x64_MI16x16x16x1_SE_1LDSB0_AF0EM8_EPS0_GRVW8_GSU1_LPB16_NLCA1_PGR2_PLR5_SU0_SUS0_SRVW0_TT1_16_VAW2_WG64_4_1_WGM1
    SolutionIndex: 21
    SolutionNameMin: Cijk_Ailk_Bljk_BBS_BH_MT128x96x32_MI32x32x8x1_SE_1LDSB0_AF0EM8_EPS0_GRVW4_GSU1_LPB8_NLCA1_PGR2_PLR5_SU32_SUS128_SRVW4_TT1_96_VAW2_WG128_2_1_WGM1
    SolutionIndex: 22
    SolutionNameMin: Cijk_Ailk_Bljk_BBS_BH_MT128x160x32_MI32x32x8x1_SE_1LDSB0_AF0EM8_EPS0_GRVW4_GSU1_LPB8_NLCA1_PGR2_PLR5_SU32_SUS256_SRVW4_TT1_160_VAW2_WG128_2_1_WGM1
    SolutionIndex: 23
    SolutionNameMin: Cijk_Ailk_Bljk_BBS_BH_MT128x64x32_MI32x32x8x1_SE_1LDSB0_AF0EM8_EPS0_GRVW8_GSU1_LPB8_NLCA1_PGR2_PLR5_SU0_SUS0_SRVW4_TT2_32_VAW2_WG64_4_1_WGM15
    SolutionIndex: 24
    SolutionNameMin: Cijk_Ailk_Bljk_BBS_BH_MT128x160x32_MI32x32x8x1_SE_1LDSB0_AF0EM8_EPS0_GRVW4_GSU1_LPB8_NLCA1_PGR2_PLR5_SU32_SUS128_SRVW4_TT1_160_VAW2_WG128_2_1_WGM2
    SolutionIndex: 25
    SolutionNameMin: Cijk_Ailk_Bljk_BBS_BH_MT256x160x32_MI32x32x8x1_SE_1LDSB0_AF0EM8_EPS0_GRVW4_GSU1_LPB8_NLCA1_PGR2_PLR5_SU0_SUS0_SRVW4_TT2_160_VAW2_WG128_2_1_WGM15
    SolutionIndex: 26
    SolutionNameMin: Cijk_Ailk_Bljk_BBS_BH_MT128x160x32_MI32x32x8x1_SE_1LDSB1_AF0EM8_EPS1_GRVW2_GSU1_LPB8_NLCA1_PGR1_PLR5_SU32_SUS128_SRVW4_TT1_160_VAW2_WG128_2_1_WGM1
    SolutionIndex: 27
    SolutionNameMin: Cijk_Ailk_Bljk_BBS_BH_MT128x256x32_MI32x32x8x1_SE_1LDSB1_AF0EM8_EPS0_GRVW8_GSU1_LPB8_NLCA1_PGR2_PLR5_SU0_SUS0_SRVW4_TT2_128_VAW2_WG64_4_1_WGM2
    SolutionIndex: 28
    SolutionNameMin: Cijk_Ailk_Bljk_BBS_BH_MT32x64x32_MI16x16x16x1_SE_1LDSB1_AF0EM8_EPS1_GRVW2_GSU1_LPB16_NLCA1_PGR1_PLR2_SU0_SUS0_SRVW4_TT1_32_VAW2_WG32_8_1_WGM1
    SolutionIndex: 29
    SolutionNameMin: Cijk_Ailk_Bljk_BBS_BH_MT16x64x32_MI16x16x16x1_SE_1LDSB0_AF0EM8_EPS1_GRVW2_GSU1_LPB16_NLCA1_PGR1_PLR2_SU0_SUS0_SRVW0_TT1_16_VAW2_WG16_16_1_WGM1
    SolutionIndex: 30
    SolutionNameMin: Cijk_Ailk_Bljk_BBS_BH_MT32x32x64_MI16x16x16x1_SE_1LDSB0_AF0EM1_EPS0_GRVW4_GSU1_LPB16_NLCA1_PGR2_PLR5_SU0_SUS0_SRVW4_TT1_16_VAW2_WG32_8_1_WGM2
    SolutionIndex: 31
    SolutionNameMin: Cijk_Ailk_Bljk_BBS_BH_MT32x32x64_MI16x16x16x1_SE_1LDSB0_AF0EM1_EPS0_GRVW8_GSU1_LPB16_NLCA1_PGR2_PLR5_SU0_SUS0_SRVW4_TT1_16_VAW2_WG32_8_1_WGM15
    SolutionIndex: 32
    SolutionNameMin: Cijk_Ailk_Bljk_BBS_BH_MT32x32x64_MI16x16x16x1_SE_1LDSB0_AF0EM1_EPS0_GRVW8_GSU1_LPB16_NLCA1_PGR2_PLR5_SU0_SUS0_SRVW4_TT1_16_VAW2_WG32_8_1_WGM1
    SolutionIndex: 33
    SolutionNameMin: Cijk_Ailk_Bljk_BBS_BH_MT64x32x32_MI16x16x16x1_SE_1LDSB1_AF0EM8_EPS1_GRVW2_GSU1_LPB16_NLCA1_PGR1_PLR2_SU0_SUS0_SRVW4_TT2_16_VAW2_WG32_8_1_WGM2
    SolutionIndex: 34
    SolutionNameMin: Cijk_Ailk_Bljk_BBS_BH_MT128x192x32_MI32x32x8x1_SE_1LDSB0_AF0EM8_EPS0_GRVW8_GSU1_LPB8_NLCA1_PGR2_PLR5_SU0_SUS0_SRVW4_TT2_96_VAW2_WG64_4_1_WGM15
    SolutionIndex: 35
    SolutionNameMin: Cijk_Ailk_Bljk_BBS_BH_MT128x192x32_MI32x32x8x1_SE_1LDSB0_AF0EM8_EPS0_GRVW8_GSU1_LPB8_NLCA1_PGR2_PLR5_SU0_SUS0_SRVW4_TT2_96_VAW2_WG64_4_1_WGM2
    SolutionIndex: 36
    SolutionNameMin: Cijk_Ailk_Bljk_BBS_BH_MT128x192x32_MI32x32x8x1_SE_1LDSB0_AF0EM8_EPS0_GRVW8_GSU1_LPB8_NLCA1_PGR2_PLR5_SU32_SUS128_SRVW4_TT2_96_VAW2_WG64_4_1_WGM15
    SolutionIndex: 37
    SolutionNameMin: Cijk_Ailk_Bljk_BBS_BH_MT256x128x32_MI32x32x8x1_SE_1LDSB0_AF0EM8_EPS0_GRVW4_GSU3_LPB8_NLCA1_PGR2_PLR5_SU0_SUS0_SRVW0_TT4_64_VAW1_WG64_4_1_WGM15
    SolutionIndex: 38
    SolutionNameMin: Cijk_Ailk_Bljk_BBS_BH_MT128x128x32_MI32x32x8x1_SE_1LDSB1_AF0EM8_EPS1_GRVW2_GSU1_LPB8_NLCA1_PGR1_PLR5_SU0_SUS0_SRVW4_TT2_64_VAW2_WG64_4_1_WGM1
    SolutionIndex: 39
    SolutionNameMin: Cijk_Ailk_Bljk_BBS_BH_MT64x64x64_MI32x32x8x1_SE_1LDSB0_AF0EM1_EPS0_GRVW8_GSU1_LPB8_NLCA1_PGR2_PLR9_SU0_SUS0_SRVW4_TT1_32_VAW2_WG64_4_1_WGM1
    SolutionIndex: 40
    SolutionNameMin: Cijk_Ailk_Bljk_BBS_BH_MT32x64x64_MI16x16x16x1_SE_1LDSB0_AF0EM8_EPS0_GRVW8_GSU1_LPB16_NLCA1_PGR2_PLR5_SU32_SUS128_SRVW4_TT1_32_VAW2_WG32_8_1_WGM1
    SolutionIndex: 41
    SolutionNameMin: Cijk_Ailk_Bljk_BBS_BH_MT32x64x64_MI16x16x16x1_SE_1LDSB0_AF0EM8_EPS0_GRVW8_GSU1_LPB16_NLCA1_PGR2_PLR5_SU32_SUS256_SRVW4_TT1_32_VAW2_WG32_8_1_WGM1
    SolutionIndex: 42
    SolutionNameMin: Cijk_Ailk_Bljk_BBS_BH_MT64x64x32_MI32x32x8x1_SE_1LDSB0_AF0EM8_EPS0_GRVW8_GSU1_LPB8_NLCA1_PGR2_PLR5_SU0_SUS0_SRVW4_TT1_32_VAW2_WG64_4_1_WGM1
    SolutionIndex: 43
    SolutionNameMin: Cijk_Ailk_Bljk_BBS_BH_MT128x96x32_MI32x32x8x1_SE_1LDSB1_AF0EM8_EPS1_GRVW2_GSU1_LPB8_NLCA1_PGR1_PLR5_SU0_SUS0_SRVW4_TT1_96_VAW2_WG128_2_1_WGM15
    SolutionIndex: 44
    SolutionNameMin: Cijk_Ailk_Bljk_BBS_BH_MT32x64x64_MI16x16x16x1_SE_1LDSB0_AF0EM8_EPS0_GRVW8_GSU1_LPB16_NLCA1_PGR2_PLR5_SU32_SUS256_SRVW4_TT1_32_VAW2_WG32_8_1_WGM15
    SolutionIndex: 45
    SolutionNameMin: Cijk_Ailk_Bljk_BBS_BH_MT96x96x64_MI16x16x16x1_SE_1LDSB0_AF0EM8_EPS0_GRVW8_GSU1_LPB16_NLCA3_PGR2_PLR5_SU0_SUS0_SRVW0_TT3_48_VAW2_WG32_8_1_WGM1
    SolutionIndex: 46
    SolutionNameMin: Cijk_Ailk_Bljk_BBS_BH_MT32x64x32_MI16x16x16x1_SE_1LDSB1_AF0EM8_EPS1_GRVW2_GSU1_LPB16_NLCA1_PGR1_PLR2_SU0_SUS0_SRVW4_TT1_32_VAW2_WG32_8_1_WGM15
    SolutionIndex: 47
    SolutionNameMin: Cijk_Ailk_Bljk_BBS_BH_MT64x128x64_MI32x32x8x1_SE_1LDSB0_AF0EM8_EPS0_GRVW8_GSU1_LPB8_NLCA1_PGR2_PLR9_SU0_SUS0_SRVW4_TT1_64_VAW2_WG64_4_1_WGM1
    SolutionIndex: 48
    SolutionNameMin: Cijk_Ailk_Bljk_BBS_BH_MT64x32x32_MI16x16x16x1_SE_1LDSB1_AF0EM8_EPS1_GRVW2_GSU1_LPB16_NLCA1_PGR1_PLR2_SU32_SUS256_SRVW4_TT2_16_VAW2_WG32_8_1_WGM1
    SolutionIndex: 49
    SolutionNameMin: Cijk_Ailk_Bljk_BBS_BH_MT128x64x32_MI32x32x8x1_SE_1LDSB0_AF0EM8_EPS0_GRVW8_GSU1_LPB8_NLCA1_PGR2_PLR5_SU0_SUS0_SRVW4_TT2_32_VAW2_WG64_4_1_WGM1
    SolutionIndex: 50
    SolutionNameMin: Cijk_Ailk_Bljk_BBS_BH_MT128x128x32_MI32x32x8x1_SE_1LDSB1_AF0EM8_EPS1_GRVW2_GSU1_LPB8_NLCA1_PGR1_PLR5_SU0_SUS0_SRVW4_TT2_64_VAW2_WG64_4_1_WGM2
    SolutionIndex: 51
    SolutionNameMin: Cijk_Ailk_Bljk_BBS_BH_MT128x96x32_MI32x32x8x1_SE_1LDSB1_AF0EM8_EPS1_GRVW2_GSU1_LPB8_NLCA1_PGR1_PLR5_SU32_SUS256_SRVW4_TT1_96_VAW2_WG128_2_1_WGM2
    SolutionIndex: 52
    SolutionNameMin: Cijk_Ailk_Bljk_BBS_BH_MT128x96x32_MI32x32x8x1_SE_1LDSB1_AF0EM8_EPS1_GRVW2_GSU1_LPB8_NLCA1_PGR1_PLR5_SU0_SUS0_SRVW4_TT1_96_VAW2_WG128_2_1_WGM2
    SolutionIndex: 53
    SolutionNameMin: Cijk_Ailk_Bljk_BBS_BH_MT128x96x32_MI32x32x8x1_SE_1LDSB1_AF0EM8_EPS1_GRVW2_GSU1_LPB8_NLCA1_PGR1_PLR5_SU32_SUS128_SRVW4_TT1_96_VAW2_WG128_2_1_WGM15
    SolutionIndex: 54
    SolutionNameMin: Cijk_Ailk_Bljk_BBS_BH_MT128x160x32_MI32x32x8x1_SE_1LDSB1_AF0EM8_EPS1_GRVW2_GSU1_LPB8_NLCA1_PGR1_PLR5_SU32_SUS128_SRVW4_TT1_160_VAW2_WG128_2_1_WGM2
    SolutionIndex: 55
    SolutionNameMin: Cijk_Ailk_Bljk_BBS_BH_MT128x96x32_MI32x32x8x1_SE_1LDSB1_AF0EM8_EPS1_GRVW2_GSU1_LPB8_NLCA1_PGR1_PLR5_SU0_SUS0_SRVW4_TT1_96_VAW2_WG128_2_1_WGM1
    SolutionIndex: 56
    SolutionNameMin: Cijk_Ailk_Bljk_BBS_BH_MT128x96x32_MI32x32x8x1_SE_1LDSB1_AF0EM8_EPS1_GRVW2_GSU1_LPB8_NLCA1_PGR1_PLR5_SU32_SUS256_SRVW4_TT1_96_VAW2_WG128_2_1_WGM15
    SolutionIndex: 57
    SolutionNameMin: Cijk_Ailk_Bljk_BBS_BH_MT128x128x32_MI32x32x8x1_SE_1LDSB1_AF0EM8_EPS1_GRVW2_GSU1_LPB8_NLCA1_PGR1_PLR5_SU32_SUS128_SRVW4_TT2_64_VAW2_WG64_4_1_WGM2
    SolutionIndex: 58
    SolutionNameMin: Cijk_Ailk_Bljk_BBS_BH_MT128x96x32_MI32x32x8x1_SE_1LDSB1_AF0EM8_EPS1_GRVW2_GSU1_LPB8_NLCA1_PGR1_PLR5_SU32_SUS128_SRVW4_TT1_96_VAW2_WG128_2_1_WGM2
    SolutionIndex: 59
    SolutionNameMin: Cijk_Ailk_Bljk_BBS_BH_MT128x96x32_MI32x32x8x1_SE_1LDSB1_AF0EM8_EPS1_GRVW2_GSU1_LPB8_NLCA1_PGR1_PLR5_SU32_SUS128_SRVW4_TT1_96_VAW2_WG128_2_1_WGM1
    SolutionIndex: 60
    SolutionNameMin: Cijk_Ailk_Bljk_BBS_BH_MT128x144x32_MI16x16x16x1_SE_1LDSB1_AF0EM8_EPS1_GRVW2_GSU1_LPB16_NLCA1_PGR1_PLR2_SU32_SUS128_SRVW4_TT2_144_VAW2_WG64_4_1_WGM2
    SolutionIndex: 61
    SolutionNameMin: Cijk_Ailk_Bljk_BBS_BH_MT128x160x32_MI32x32x8x1_SE_1LDSB1_AF0EM8_EPS1_GRVW2_GSU1_LPB8_NLCA1_PGR1_PLR5_SU0_SUS0_SRVW4_TT1_160_VAW2_WG128_2_1_WGM1
    SolutionIndex: 62
    SolutionNameMin: Cijk_Ailk_Bljk_BBS_BH_MT64x128x64_MI32x32x8x1_SE_1LDSB0_AF0EM8_EPS0_GRVW8_GSU1_LPB8_NLCA1_PGR2_PLR9_SU0_SUS0_SRVW4_TT1_64_VAW2_WG64_4_1_WGM2
    SolutionIndex: 63
    SolutionNameMin: Cijk_Ailk_Bljk_BBS_BH_MT128x96x64_MI32x32x8x1_SE_1LDSB0_AF0EM8_EPS0_GRVW8_GSU1_LPB8_NLCA1_PGR2_PLR9_SU0_SUS0_SRVW4_TT1_96_VAW2_WG128_2_1_WGM1
    SolutionIndex: 64
    SolutionNameMin: Cijk_Ailk_Bljk_BBS_BH_MT128x160x32_MI32x32x8x1_SE_1LDSB0_AF0EM8_EPS0_GRVW4_GSU1_LPB8_NLCA1_PGR2_PLR5_SU0_SUS0_SRVW4_TT1_160_VAW2_WG128_2_1_WGM2
    SolutionIndex: 65
    SolutionNameMin: Cijk_Ailk_Bljk_BBS_BH_MT128x128x32_MI32x32x8x1_SE_1LDSB0_AF0EM8_EPS0_GRVW8_GSU1_LPB8_NLCA1_PGR2_PLR5_SU0_SUS0_SRVW4_TT2_64_VAW2_WG64_4_1_WGM1
    SolutionIndex: 66
    SolutionNameMin: Cijk_Ailk_Bljk_BBS_BH_MT128x96x32_MI32x32x8x1_SE_1LDSB0_AF0EM1_EPS0_GRVW4_GSU1_LPB8_NLCA1_PGR2_PLR5_SU0_SUS0_SRVW4_TT1_96_VAW2_WG128_2_1_WGM15
    SolutionIndex: 67
    SolutionNameMin: Cijk_Ailk_Bljk_BBS_BH_MT128x160x32_MI32x32x8x1_SE_1LDSB0_AF0EM8_EPS0_GRVW4_GSU1_LPB8_NLCA1_PGR2_PLR5_SU0_SUS0_SRVW4_TT1_160_VAW2_WG128_2_1_WGM15
    SolutionIndex: 68
    SolutionNameMin: Cijk_Ailk_Bljk_BBS_BH_MT128x192x32_MI32x32x8x1_SE_1LDSB0_AF0EM1_EPS0_GRVW8_GSU1_LPB8_NLCA1_PGR2_PLR5_SU0_SUS0_SRVW4_TT2_96_VAW2_WG64_4_1_WGM1
    SolutionIndex: 69
    SolutionNameMin: Cijk_Ailk_Bljk_BBS_BH_MT256x160x32_MI32x32x8x1_SE_1LDSB0_AF0EM8_EPS0_GRVW4_GSU3_LPB8_NLCA1_PGR2_PLR5_SU0_SUS0_SRVW4_TT2_160_VAW1_WG128_2_1_WGM15
    SolutionIndex: 70
    SolutionNameMin: Cijk_Ailk_Bljk_BBS_BH_MT128x96x32_MI32x32x8x1_SE_1LDSB1_AF0EM1_EPS1_GRVW2_GSU1_LPB8_NLCA1_PGR1_PLR5_SU0_SUS0_SRVW4_TT1_96_VAW2_WG128_2_1_WGM2
    SolutionIndex: 71
    SolutionNameMin: Cijk_Ailk_Bljk_BBS_BH_MT128x128x32_MI32x32x8x1_SE_1LDSB0_AF0EM8_EPS0_GRVW8_GSU1_LPB8_NLCA1_PGR2_PLR5_SU32_SUS128_SRVW4_TT2_64_VAW2_WG64_4_1_WGM15
    SolutionIndex: 72
    SolutionNameMin: Cijk_Ailk_Bljk_BBS_BH_MT256x160x32_MI32x32x8x1_SE_1LDSB0_AF0EM8_EPS0_GRVW4_GSU1_LPB8_NLCA1_PGR2_PLR5_SU0_SUS0_SRVW4_TT2_160_VAW2_WG128_2_1_WGM2
    SolutionIndex: 73
    SolutionNameMin: Cijk_Ailk_Bljk_BBS_BH_MT128x256x32_MI32x32x8x1_SE_1LDSB1_AF0EM8_EPS0_GRVW8_GSU1_LPB8_NLCA1_PGR2_PLR5_SU0_SUS0_SRVW4_TT2_128_VAW2_WG64_4_1_WGM15
    SolutionIndex: 74
    SolutionNameMin: Cijk_Ailk_Bljk_BBS_BH_MT256x160x32_MI32x32x8x1_SE_1LDSB0_AF0EM8_EPS0_GRVW4_GSU5_LPB8_NLCA1_PGR2_PLR5_SU0_SUS0_SRVW4_TT2_160_VAW1_WG128_2_1_WGM1
    SolutionIndex: 75
    SolutionNameMin: Cijk_Ailk_Bljk_BBS_BH_MT128x256x32_MI32x32x8x1_SE_1LDSB1_AF0EM8_EPS0_GRVW8_GSU1_LPB8_NLCA1_PGR2_PLR5_SU0_SUS0_SRVW4_TT2_128_VAW2_WG64_4_1_WGM1
    SolutionIndex: 76
    SolutionNameMin: Cijk_Ailk_Bljk_BBS_BH_MT256x192x32_MI32x32x8x1_SE_1LDSB1_AF0EM8_EPS0_GRVW8_GSU1_LPB8_NLCA1_PGR2_PLR5_SU0_SUS0_SRVW4_TT4_96_VAW2_WG64_4_1_WGM1
    SolutionIndex: 77
    SolutionNameMin: Cijk_Ailk_Bljk_BBS_BH_MT64x64x64_MI32x32x8x1_SE_1LDSB0_AF0EM8_EPS0_GRVW8_GSU1_LPB8_NLCA1_PGR2_PLR9_SU32_SUS256_SRVW4_TT1_32_VAW2_WG64_4_1_WGM1
    SolutionIndex: 78
    SolutionNameMin: Cijk_Ailk_Bljk_BBS_BH_MT64x128x32_MI32x32x8x1_SE_1LDSB0_AF0EM8_EPS1_GRVW8_GSU1_LPB8_NLCA1_PGR1_PLR5_SU0_SUS0_SRVW4_TT1_64_VAW2_WG64_4_1_WGM15
    SolutionIndex: 79
    SolutionNameMin: Cijk_Ailk_Bljk_BBS_BH_MT64x64x32_MI32x32x8x1_SE_1LDSB0_AF0EM8_EPS0_GRVW2_GSU1_LPB8_NLCA1_PGR2_PLR5_SU0_SUS0_SRVW4_TT1_32_VAW2_WG64_4_1_WGM15
    SolutionIndex: 80
    SolutionNameMin: Cijk_Ailk_Bljk_BBS_BH_MT64x128x64_MI32x32x8x1_SE_1LDSB0_AF0EM8_EPS0_GRVW8_GSU1_LPB8_NLCA1_PGR2_PLR9_SU0_SUS0_SRVW4_TT1_64_VAW2_WG64_4_1_WGM15
    SolutionIndex: 81
    SolutionNameMin: Cijk_Ailk_Bljk_BBS_BH_MT64x32x32_MI16x16x16x1_SE_1LDSB0_AF0EM1_EPS0_GRVW2_GSU1_LPB16_NLCA1_PGR2_PLR2_SU0_SUS0_SRVW4_TT2_16_VAW2_WG32_8_1_WGM1
    SolutionIndex: 82
    SolutionNameMin: Cijk_Ailk_Bljk_BBS_BH_MT128x64x32_MI32x32x8x1_SE_1LDSB0_AF0EM1_EPS0_GRVW8_GSU1_LPB8_NLCA1_PGR2_PLR5_SU0_SUS0_SRVW4_TT2_32_VAW2_WG64_4_1_WGM1
    SolutionIndex: 83
    SolutionNameMin: Cijk_Ailk_Bljk_BBS_BH_MT64x128x32_MI32x32x8x1_SE_1LDSB0_AF0EM1_EPS0_GRVW2_GSU1_LPB8_NLCA1_PGR2_PLR5_SU0_SUS0_SRVW4_TT1_64_VAW2_WG64_4_1_WGM15
    SolutionIndex: 84
    SolutionNameMin: Cijk_Ailk_Bljk_BBS_BH_MT128x96x32_MI32x32x8x1_SE_1LDSB1_AF0EM1_EPS1_GRVW2_GSU1_LPB8_NLCA1_PGR1_PLR5_SU0_SUS0_SRVW4_TT1_96_VAW2_WG128_2_1_WGM15
    SolutionIndex: 85
    SolutionNameMin: Cijk_Ailk_Bljk_BBS_BH_MT64x64x64_MI32x32x8x1_SE_1LDSB0_AF0EM8_EPS0_GRVW8_GSU1_LPB8_NLCA1_PGR2_PLR9_SU0_SUS0_SRVW4_TT1_32_VAW2_WG64_4_1_WGM1
    SolutionIndex: 86
    SolutionNameMin: Cijk_Ailk_Bljk_BBS_BH_MT64x192x64_MI32x32x8x1_SE_1LDSB1_AF0EM8_EPS1_GRVW2_GSU1_LPB8_NLCA1_PGR1_PLR9_SU0_SUS0_SRVW4_TT1_96_VAW2_WG64_4_1_WGM2
    SolutionIndex: 87
    SolutionNameMin: Cijk_Ailk_Bljk_BBS_BH_MT64x32x32_MI16x16x16x1_SE_1LDSB1_AF0EM1_EPS1_GRVW2_GSU1_LPB16_NLCA1_PGR1_PLR2_SU0_SUS0_SRVW4_TT2_16_VAW2_WG32_8_1_WGM15
    SolutionIndex: 88
    SolutionNameMin: Cijk_Ailk_Bljk_BBS_BH_MT128x64x32_MI32x32x8x1_SE_1LDSB0_AF0EM8_EPS0_GRVW4_GSU1_LPB8_NLCA1_PGR2_PLR5_SU0_SUS0_SRVW4_TT2_32_VAW2_WG64_4_1_WGM15
    SolutionIndex: 89
    SolutionNameMin: Cijk_Ailk_Bljk_BBS_BH_MT64x64x32_MI32x32x8x1_SE_1LDSB0_AF0EM1_EPS0_GRVW2_GSU1_LPB8_NLCA1_PGR2_PLR5_SU32_SUS256_SRVW4_TT1_32_VAW2_WG64_4_1_WGM15
    SolutionIndex: 90
    SolutionNameMin: Cijk_Ailk_Bljk_BBS_BH_MT64x128x32_MI32x32x8x1_SE_1LDSB0_AF0EM8_EPS0_GRVW4_GSU1_LPB8_NLCA1_PGR2_PLR5_SU0_SUS0_SRVW4_TT1_64_VAW2_WG64_4_1_WGM1
    SolutionIndex: 91
    SolutionNameMin: Cijk_Ailk_Bljk_BBS_BH_MT64x128x32_MI32x32x8x1_SE_1LDSB0_AF0EM1_EPS0_GRVW4_GSU1_LPB8_NLCA1_PGR2_PLR5_SU0_SUS0_SRVW4_TT1_64_VAW2_WG64_4_1_WGM15
    SolutionIndex: 92
    SolutionNameMin: Cijk_Ailk_Bljk_BBS_BH_MT64x128x32_MI32x32x8x1_SE_1LDSB0_AF0EM1_EPS0_GRVW4_GSU1_LPB8_NLCA1_PGR2_PLR5_SU32_SUS128_SRVW4_TT1_64_VAW2_WG64_4_1_WGM1
    SolutionIndex: 93
    SolutionNameMin: Cijk_Ailk_Bljk_BBS_BH_MT32x64x64_MI16x16x16x1_SE_1LDSB0_AF0EM1_EPS0_GRVW4_GSU1_LPB16_NLCA1_PGR2_PLR5_SU0_SUS0_SRVW4_TT1_32_VAW2_WG32_8_1_WGM1
    SolutionIndex: 94
    SolutionNameMin: Cijk_Ailk_Bljk_BBS_BH_MT128x256x32_MI32x32x8x1_SE_1LDSB1_AF0EM8_EPS0_GRVW8_GSU1_LPB8_NLCA1_PGR2_PLR5_SU32_SUS128_SRVW4_TT2_128_VAW2_WG64_4_1_WGM1
    SolutionIndex: 95
    SolutionNameMin: Cijk_Ailk_Bljk_BBS_BH_MT64x128x64_MI32x32x8x1_SE_1LDSB0_AF0EM1_EPS0_GRVW8_GSU1_LPB8_NLCA1_PGR2_PLR9_SU0_SUS0_SRVW4_TT1_64_VAW2_WG64_4_1_WGM2
    SolutionIndex: 96
    SolutionNameMin: Cijk_Ailk_Bljk_BBS_BH_MT128x128x32_MI32x32x8x1_SE_1LDSB1_AF0EM8_EPS1_GRVW2_GSU1_LPB8_NLCA1_PGR1_PLR5_SU32_SUS256_SRVW4_TT2_64_VAW2_WG64_4_1_WGM1
    SolutionIndex: 97
    SolutionNameMin: Cijk_Ailk_Bljk_BBS_BH_MT128x128x32_MI32x32x8x1_SE_1LDSB1_AF0EM8_EPS1_GRVW2_GSU1_LPB8_NLCA1_PGR1_PLR5_SU0_SUS0_SRVW4_TT2_64_VAW2_WG64_4_1_WGM15
    SolutionIndex: 98
    SolutionNameMin: Cijk_Ailk_Bljk_BBS_BH_MT16x64x32_MI16x16x16x1_SE_1LDSB0_AF0EM8_EPS0_GRVW8_GSU1_LPB16_NLCA1_PGR2_PLR2_SU0_SUS0_SRVW0_TT1_16_VAW2_WG16_16_1_WGM1
    SolutionIndex: 99
    SolutionNameMin: Cijk_Ailk_Bljk_BBS_BH_MT16x16x64_MI16x16x16x1_SE_1LDSB0_AF0EM8_EPS0_GRVW8_GSU1_LPB16_NLCA1_PGR2_PLR5_SU32_SUS256_SRVW0_TT1_16_VAW2_WG16_4_1_WGM1
    SolutionIndex: 100
    SolutionNameMin: Cijk_Ailk_Bljk_BBS_BH_MT128x128x32_MI32x32x8x1_SE_1LDSB1_AF0EM1_EPS1_GRVW2_GSU1_LPB8_NLCA1_PGR1_PLR5_SU0_SUS0_SRVW4_TT2_64_VAW2_WG64_4_1_WGM1
    SolutionIndex: 101
    SolutionNameMin: Cijk_Ailk_Bljk_BBS_BH_MT96x128x64_MI32x32x8x1_SE_1LDSB0_AF0EM8_EPS0_GRVW2_GSU1_LPB8_NLCA3_PGR2_PLR9_SU0_SUS0_SRVW0_TT3_32_VAW2_WG32_8_1_WGM1
    SolutionIndex: 102
    SolutionNameMin: Cijk_Ailk_Bljk_BBS_BH_MT128x128x32_MI32x32x8x1_SE_1LDSB1_AF0EM1_EPS1_GRVW2_GSU1_LPB8_NLCA1_PGR1_PLR5_SU0_SUS0_SRVW4_TT2_64_VAW2_WG64_4_1_WGM2
    SolutionIndex: 103
    SolutionNameMin: Cijk_Ailk_Bljk_BBS_BH_MT64x64x64_MI32x32x8x1_SE_1LDSB0_AF0EM8_EPS0_GRVW8_GSU1_LPB8_NLCA1_PGR2_PLR9_SU0_SUS0_SRVW4_TT1_32_VAW2_WG64_4_1_WGM15
    SolutionIndex: 104
    SolutionNameMin: Cijk_Ailk_Bljk_BBS_BH_MT64x128x32_MI32x32x8x1_SE_1LDSB0_AF0EM8_EPS0_GRVW8_GSU1_LPB8_NLCA1_PGR2_PLR5_SU32_SUS128_SRVW4_TT1_64_VAW2_WG64_4_1_WGM1
    SolutionIndex: 105
    SolutionNameMin: Cijk_Ailk_Bljk_BBS_BH_MT16x16x64_MI16x16x16x1_SE_1LDSB0_AF0EM8_EPS0_GRVW4_GSU1_LPB16_NLCA1_PGR2_PLR5_SU0_SUS0_SRVW0_TT1_16_VAW2_WG16_4_1_WGM1
    SolutionIndex: 106
    SolutionNameMin: Cijk_Ailk_Bljk_BBS_BH_MT128x96x64_MI32x32x8x1_SE_1LDSB0_AF0EM8_EPS0_GRVW8_GSU15_LPB8_NLCA1_PGR2_PLR9_SU0_SUS0_SRVW4_TT1_96_VAW1_WG128_2_1_WGM15
    SolutionIndex: 107
    SolutionNameMin: Cijk_Ailk_Bljk_BBS_BH_MT64x64x32_MI32x32x8x1_SE_1LDSB0_AF0EM8_EPS0_GRVW8_GSU1_LPB8_NLCA1_PGR2_PLR5_SU0_SUS0_SRVW4_TT1_32_VAW2_WG64_4_1_WGM2
    SolutionIndex: 108
    SolutionNameMin: Cijk_Ailk_Bljk_BBS_BH_MT128x64x64_MI32x32x8x1_SE_1LDSB0_AF0EM8_EPS0_GRVW8_GSU1_LPB8_NLCA1_PGR2_PLR9_SU0_SUS0_SRVW4_TT2_32_VAW2_WG64_4_1_WGM15
    SolutionIndex: 109
    SolutionNameMin: Cijk_Ailk_Bljk_BBS_BH_MT128x256x32_MI32x32x8x1_SE_1LDSB1_AF0EM1_EPS0_GRVW8_GSU1_LPB8_NLCA1_PGR2_PLR5_SU0_SUS0_SRVW4_TT2_128_VAW2_WG64_4_1_WGM2
    SolutionIndex: 110
    SolutionNameMin: Cijk_Ailk_Bljk_BBS_BH_MT64x32x32_MI16x16x16x1_SE_1LDSB0_AF0EM8_EPS1_GRVW2_GSU1_LPB16_NLCA1_PGR1_PLR2_SU0_SUS0_SRVW4_TT2_16_VAW2_WG32_8_1_WGM1
    SolutionIndex: 111
    SolutionNameMin: Cijk_Ailk_Bljk_BBS_BH_MT128x96x64_MI32x32x8x1_SE_1LDSB0_AF0EM8_EPS1_GRVW8_GSU5_LPB8_NLCA1_PGR1_PLR9_SU0_SUS0_SRVW0_TT1_96_VAW1_WG128_2_1_WGM2
    SolutionIndex: 112
    SolutionNameMin: Cijk_Ailk_Bljk_BBS_BH_MT128x128x32_MI32x32x8x1_SE_1LDSB0_AF0EM1_EPS0_GRVW8_GSU5_LPB8_NLCA1_PGR2_PLR5_SU0_SUS0_SRVW4_TT2_64_VAW1_WG64_4_1_WGM2
    SolutionIndex: 113
    SolutionNameMin: Cijk_Ailk_Bljk_BBS_BH_MT64x16x32_MI16x16x16x1_SE_1LDSB0_AF0EM8_EPS0_GRVW2_GSU1_LPB16_NLCA1_PGR2_PLR2_SU0_SUS0_SRVW0_TT1_16_VAW2_WG64_4_1_WGM1
    SolutionIndex: 114
    SolutionNameMin: Cijk_Ailk_Bljk_BBS_BH_MT128x128x32_MI32x32x8x1_SE_1LDSB1_AF0EM1_EPS1_GRVW2_GSU1_LPB8_NLCA1_PGR1_PLR5_SU32_SUS256_SRVW4_TT2_64_VAW2_WG64_4_1_WGM2
    SolutionIndex: 115
    SolutionNameMin: Cijk_Ailk_Bljk_BBS_BH_MT256x192x32_MI32x32x8x1_SE_1LDSB1_AF0EM8_EPS1_GRVW8_GSU1_LPB8_NLCA1_PGR1_PLR5_SU0_SUS0_SRVW4_TT4_96_VAW2_WG64_4_1_WGM1
    SolutionIndex: 116
    SolutionNameMin: Cijk_Ailk_Bljk_BBS_BH_MT256x160x32_MI32x32x8x1_SE_1LDSB0_AF0EM8_EPS0_GRVW4_GSU1_LPB8_NLCA1_PGR2_PLR5_SU32_SUS256_SRVW4_TT2_160_VAW2_WG128_2_1_WGM15
    SolutionIndex: 117
    SolutionNameMin: Cijk_Ailk_Bljk_BBS_BH_MT64x128x64_MI32x32x8x1_SE_1LDSB0_AF0EM8_EPS0_GRVW8_GSU1_LPB8_NLCA1_PGR2_PLR9_SU32_SUS256_SRVW4_TT1_64_VAW2_WG64_4_1_WGM1
    SolutionIndex: 118
    SolutionNameMin: Cijk_Ailk_Bljk_BBS_BH_MT128x96x64_MI32x32x8x1_SE_1LDSB0_AF0EM8_EPS0_GRVW8_GSU1_LPB8_NLCA1_PGR2_PLR9_SU0_SUS0_SRVW4_TT1_96_VAW2_WG128_2_1_WGM15
    SolutionIndex: 119
    SolutionNameMin: Cijk_Ailk_Bljk_BBS_BH_MT160x128x32_MI32x32x8x1_SE_1LDSB0_AF0EM8_EPS0_GRVW4_GSU1_LPB8_NLCA5_PGR2_PLR5_SU0_SUS0_SRVW0_TT5_32_VAW2_WG32_8_1_WGM1
    SolutionIndex: 120
    SolutionNameMin: Cijk_Ailk_Bljk_BBS_BH_MT128x128x32_MI32x32x8x1_SE_1LDSB0_AF0EM8_EPS0_GRVW8_GSU1_LPB8_NLCA1_PGR2_PLR5_SU32_SUS256_SRVW4_TT2_64_VAW2_WG64_4_1_WGM1
    SolutionIndex: 121
    SolutionNameMin: Cijk_Ailk_Bljk_BBS_BH_MT128x160x32_MI32x32x8x1_SE_1LDSB0_AF0EM8_EPS0_GRVW4_GSU1_LPB8_NLCA1_PGR2_PLR5_SU32_SUS256_SRVW4_TT1_160_VAW2_WG128_2_1_WGM2
    SolutionIndex: 122
    SolutionNameMin: Cijk_Ailk_Bljk_BBS_BH_MT96x128x64_MI32x32x8x1_SE_1LDSB0_AF0EM1_EPS0_GRVW8_GSU1_LPB8_NLCA3_PGR2_PLR9_SU0_SUS0_SRVW0_TT3_32_VAW2_WG32_8_1_WGM1
    SolutionIndex: 123
    SolutionNameMin: Cijk_Ailk_Bljk_BBS_BH_MT64x128x64_MI32x32x8x1_SE_1LDSB0_AF0EM8_EPS0_GRVW8_GSU1_LPB8_NLCA1_PGR2_PLR9_SU32_SUS256_SRVW4_TT1_64_VAW2_WG64_4_1_WGM2
    SolutionIndex: 124
    SolutionNameMin: Cijk_Ailk_Bljk_BBS_BH_MT128x128x32_MI32x32x8x1_SE_1LDSB0_AF0EM8_EPS0_GRVW8_GSU1_LPB8_NLCA1_PGR2_PLR5_SU32_SUS128_SRVW4_TT2_64_VAW2_WG64_4_1_WGM2
    SolutionIndex: 125
    SolutionNameMin: Cijk_Ailk_Bljk_BBS_BH_MT128x144x32_MI16x16x16x1_SE_1LDSB1_AF0EM8_EPS1_GRVW2_GSU1_LPB16_NLCA1_PGR1_PLR2_SU32_SUS256_SRVW4_TT2_144_VAW2_WG64_4_1_WGM1
    SolutionIndex: 126
    SolutionNameMin: Cijk_Ailk_Bljk_BBS_BH_MT64x128x64_MI32x32x8x1_SE_1LDSB0_AF0EM8_EPS0_GRVW8_GSU1_LPB8_NLCA1_PGR2_PLR9_SU32_SUS128_SRVW4_TT1_64_VAW2_WG64_4_1_WGM2
    SolutionIndex: 127
    SolutionNameMin: Cijk_Ailk_Bljk_BBS_BH_MT32x32x64_MI16x16x16x1_SE_1LDSB0_AF0EM8_EPS0_GRVW8_GSU1_LPB16_NLCA1_PGR2_PLR5_SU0_SUS0_SRVW4_TT1_16_VAW2_WG32_8_1_WGM1
    SolutionIndex: 128
    SolutionNameMin: Cijk_Ailk_Bljk_BBS_BH_MT64x128x32_MI32x32x8x1_SE_1LDSB0_AF0EM8_EPS1_GRVW8_GSU1_LPB8_NLCA1_PGR1_PLR5_SU0_SUS0_SRVW4_TT1_64_VAW2_WG64_4_1_WGM1
    SolutionIndex: 129
    SolutionNameMin: Cijk_Ailk_Bljk_BBS_BH_MT128x256x32_MI32x32x8x1_SE_1LDSB1_AF0EM8_EPS0_GRVW8_GSU1_LPB8_NLCA1_PGR2_PLR5_SU32_SUS256_SRVW4_TT2_128_VAW2_WG64_4_1_WGM1
    SolutionIndex: 130
    SolutionNameMin: Cijk_Ailk_Bljk_BBS_BH_MT64x128x32_MI32x32x8x1_SE_1LDSB0_AF0EM8_EPS0_GRVW8_GSU1_LPB8_NLCA1_PGR2_PLR5_SU32_SUS256_SRVW4_TT1_64_VAW2_WG64_4_1_WGM2
    SolutionIndex: 131
    SolutionNameMin: Cijk_Ailk_Bljk_BBS_BH_MT160x128x32_MI32x32x8x1_SE_1LDSB0_AF0EM8_EPS0_GRVW4_GSU1_LPB8_NLCA5_PGR2_PLR5_SU32_SUS256_SRVW0_TT5_32_VAW2_WG32_8_1_WGM15
    SolutionIndex: 132
    SolutionNameMin: Cijk_Ailk_Bljk_BBS_BH_MT64x32x64_MI16x16x16x1_SE_1LDSB0_AF0EM8_EPS0_GRVW8_GSU1_LPB16_NLCA1_PGR2_PLR5_SU0_SUS0_SRVW4_TT2_16_VAW2_WG32_8_1_WGM1
    SolutionIndex: 133
    SolutionNameMin: Cijk_Ailk_Bljk_BBS_BH_MT128x128x32_MI32x32x8x1_SE_1LDSB1_AF0EM8_EPS1_GRVW2_GSU1_LPB8_NLCA1_PGR1_PLR5_SU32_SUS128_SRVW4_TT2_64_VAW2_WG64_4_1_WGM15
    SolutionIndex: 134
    SolutionNameMin: Cijk_Ailk_Bljk_BBS_BH_MT128x96x64_MI32x32x8x1_SE_1LDSB0_AF0EM8_EPS1_GRVW8_GSU5_LPB8_NLCA1_PGR1_PLR9_SU0_SUS0_SRVW0_TT1_96_VAW1_WG128_2_1_WGM1
    SolutionIndex: 135
    SolutionNameMin: Cijk_Ailk_Bljk_BBS_BH_MT96x128x64_MI32x32x8x1_SE_1LDSB0_AF0EM8_EPS1_GRVW8_GSU5_LPB8_NLCA3_PGR1_PLR9_SU32_SUS256_SRVW0_TT3_32_VAW1_WG32_8_1_WGM15
    SolutionIndex: 136
    SolutionNameMin: Cijk_Ailk_Bljk_BBS_BH_MT128x256x32_MI32x32x8x1_SE_1LDSB1_AF0EM8_EPS1_GRVW8_GSU1_LPB8_NLCA1_PGR1_PLR5_SU32_SUS128_SRVW4_TT2_128_VAW2_WG64_4_1_WGM2
    SolutionIndex: 137
    SolutionNameMin: Cijk_Ailk_Bljk_BBS_BH_MT128x256x32_MI32x32x8x1_SE_1LDSB1_AF0EM8_EPS1_GRVW8_GSU1_LPB8_NLCA1_PGR1_PLR5_SU32_SUS128_SRVW4_TT2_128_VAW2_WG64_4_1_WGM15
    SolutionIndex: 138
    SolutionNameMin: Cijk_Ailk_Bljk_BBS_BH_MT128x256x32_MI32x32x8x1_SE_1LDSB1_AF0EM8_EPS1_GRVW8_GSU1_LPB8_NLCA1_PGR1_PLR5_SU0_SUS0_SRVW4_TT2_128_VAW2_WG64_4_1_WGM1
    SolutionIndex: 139
    SolutionNameMin: Cijk_Ailk_Bljk_BBS_BH_MT128x64x32_MI32x32x8x1_SE_1LDSB0_AF0EM8_EPS0_GRVW8_GSU1_LPB8_NLCA1_PGR2_PLR5_SU32_SUS256_SRVW4_TT2_32_VAW2_WG64_4_1_WGM2
    SolutionIndex: 140
    SolutionNameMin: Cijk_Ailk_Bljk_BBS_BH_MT128x256x32_MI32x32x8x1_SE_1LDSB1_AF0EM8_EPS0_GRVW8_GSU1_LPB8_NLCA1_PGR2_PLR5_SU32_SUS128_SRVW4_TT2_128_VAW2_WG64_4_1_WGM15
    SolutionIndex: 141
    SolutionNameMin: Cijk_Ailk_Bljk_BBS_BH_MT128x128x32_MI32x32x8x1_SE_1LDSB1_AF0EM1_EPS1_GRVW2_GSU1_LPB8_NLCA1_PGR1_PLR5_SU0_SUS0_SRVW4_TT2_64_VAW2_WG64_4_1_WGM15
    SolutionIndex: 142
    SolutionNameMin: Cijk_Ailk_Bljk_BBS_BH_MT64x4x32_MI4x4x4x16_SE_1LDSB0_AF0EM8_EPS1_GRVW4_GSU1_LPB8_NLCA1_PGR1_PLR9_SU0_SUS0_SRVW0_TT1_4_VAW2_WG64_1_1_WGM1
    SolutionIndex: 143
    SolutionNameMin: Cijk_Ailk_Bljk_BBS_BH_MT64x64x64_MI32x32x8x1_SE_1LDSB0_AF0EM8_EPS0_GRVW8_GSU1_LPB8_NLCA1_PGR2_PLR9_SU0_SUS0_SRVW4_TT1_32_VAW2_WG64_4_1_WGM2
    SolutionIndex: 144
    SolutionNameMin: Cijk_Ailk_Bljk_BBS_BH_MT128x128x32_MI32x32x8x1_SE_1LDSB0_AF0EM8_EPS0_GRVW8_GSU1_LPB8_NLCA1_PGR2_PLR5_SU0_SUS0_SRVW4_TT2_64_VAW2_WG64_4_1_WGM15
    SolutionIndex: 145
    SolutionNameMin: Cijk_Ailk_Bljk_BBS_BH_MT256x128x32_MI32x32x8x1_SE_1LDSB0_AF0EM8_EPS1_GRVW8_GSU1_LPB8_NLCA1_PGR1_PLR5_SU32_SUS128_SRVW4_TT4_64_VAW2_WG64_4_1_WGM1
    SolutionIndex: 146
    SolutionNameMin: Cijk_Ailk_Bljk_BBS_BH_MT256x128x32_MI32x32x8x1_SE_1LDSB0_AF0EM8_EPS0_GRVW8_GSU1_LPB8_NLCA1_PGR2_PLR5_SU0_SUS0_SRVW4_TT4_64_VAW2_WG64_4_1_WGM1
    SolutionIndex: 147
    SolutionNameMin: Cijk_Ailk_Bljk_BBS_BH_MT96x128x32_MI32x32x8x1_SE_1LDSB0_AF0EM8_EPS0_GRVW4_GSU1_LPB8_NLCA3_PGR2_PLR5_SU32_SUS128_SRVW0_TT3_32_VAW2_WG32_8_1_WGM1
    SolutionIndex: 148
    SolutionNameMin: Cijk_Ailk_Bljk_BBS_BH_MT192x256x32_MI32x32x8x1_SE_1LDSB0_AF0EM8_EPS1_GRVW8_GSU1_LPB8_NLCA3_PGR1_PLR5_SU32_SUS256_SRVW0_TT3_128_VAW2_WG64_4_1_WGM1
    SolutionIndex: 149
    SolutionNameMin: Cijk_Ailk_Bljk_BBS_BH_MT32x32x64_MI16x16x16x1_SE_1LDSB0_AF0EM8_EPS0_GRVW8_GSU1_LPB16_NLCA1_PGR2_PLR5_SU32_SUS128_SRVW4_TT1_16_VAW2_WG32_8_1_WGM2
    SolutionIndex: 150
    SolutionNameMin: Cijk_Ailk_Bljk_BBS_BH_MT128x128x32_MI32x32x8x1_SE_1LDSB1_AF0EM8_EPS1_GRVW2_GSU1_LPB8_NLCA1_PGR1_PLR5_SU32_SUS256_SRVW4_TT2_64_VAW2_WG64_4_1_WGM2
    SolutionIndex: 151
    SolutionNameMin: Cijk_Ailk_Bljk_BBS_BH_MT64x128x64_MI32x32x8x1_SE_1LDSB0_AF0EM8_EPS0_GRVW8_GSU1_LPB8_NLCA1_PGR2_PLR9_SU32_SUS128_SRVW4_TT1_64_VAW2_WG64_4_1_WGM1
    SolutionIndex: 152
    SolutionNameMin: Cijk_Ailk_Bljk_BBS_BH_MT32x32x64_MI16x16x16x1_SE_1LDSB0_AF0EM8_EPS0_GRVW8_GSU1_LPB16_NLCA1_PGR2_PLR5_SU32_SUS256_SRVW4_TT1_16_VAW2_WG32_8_1_WGM2
    SolutionIndex: 153
    SolutionNameMin: Cijk_Ailk_Bljk_BBS_BH_MT128x64x32_MI32x32x8x1_SE_1LDSB0_AF0EM8_EPS0_GRVW8_GSU1_LPB8_NLCA1_PGR2_PLR5_SU32_SUS256_SRVW4_TT2_32_VAW2_WG64_4_1_WGM15
    SolutionIndex: 154
    SolutionNameMin: Cijk_Ailk_Bljk_BBS_BH_MT128x96x32_MI32x32x8x1_SE_1LDSB0_AF0EM8_EPS1_GRVW4_GSU1_LPB8_NLCA1_PGR1_PLR5_SU0_SUS0_SRVW4_TT1_96_VAW2_WG128_2_1_WGM1
    SolutionIndex: 155
    SolutionNameMin: Cijk_Ailk_Bljk_BBS_BH_MT16x16x64_MI16x16x16x1_SE_1LDSB0_AF0EM8_EPS0_GRVW8_GSU1_LPB16_NLCA1_PGR2_PLR5_SU32_SUS128_SRVW0_TT1_16_VAW2_WG16_4_1_WGM2
    SolutionIndex: 156
    SolutionNameMin: Cijk_Ailk_Bljk_BBS_BH_MT64x16x32_MI16x16x16x1_SE_1LDSB0_AF0EM8_EPS0_GRVW8_GSU1_LPB16_NLCA1_PGR2_PLR2_SU0_SUS0_SRVW0_TT1_16_VAW2_WG64_4_1_WGM1
    SolutionIndex: 157
    SolutionNameMin: Cijk_Ailk_Bljk_BBS_BH_MT128x256x32_MI32x32x8x1_SE_1LDSB1_AF0EM8_EPS0_GRVW8_GSU1_LPB8_NLCA1_PGR2_PLR5_SU32_SUS128_SRVW4_TT2_128_VAW2_WG64_4_1_WGM2
    SolutionIndex: 158
    SolutionNameMin: Cijk_Ailk_Bljk_BBS_BH_MT128x128x32_MI32x32x8x1_SE_1LDSB0_AF0EM8_EPS0_GRVW8_GSU1_LPB8_NLCA1_PGR2_PLR5_SU32_SUS256_SRVW4_TT2_64_VAW2_WG64_4_1_WGM15
    SolutionIndex: 159
    SolutionNameMin: Cijk_Ailk_Bljk_BBS_BH_MT64x144x64_MI16x16x16x1_SE_1LDSB0_AF0EM8_EPS0_GRVW4_GSU1_LPB16_NLCA1_PGR2_PLR5_SU0_SUS0_SRVW4_TT1_144_VAW2_WG64_4_1_WGM1
    SolutionIndex: 160
    SolutionNameMin: Cijk_Ailk_Bljk_BBS_BH_MT128x128x32_MI32x32x8x1_SE_1LDSB1_AF0EM8_EPS1_GRVW2_GSU1_LPB8_NLCA1_PGR1_PLR5_SU32_SUS128_SRVW4_TT2_64_VAW2_WG64_4_1_WGM1
    SolutionIndex: 161
    SolutionNameMin: Cijk_Ailk_Bljk_BBS_BH_MT16x64x64_MI16x16x16x1_SE_1LDSB0_AF0EM8_EPS0_GRVW8_GSU1_LPB16_NLCA1_PGR2_PLR5_SU0_SUS0_SRVW0_TT1_16_VAW2_WG16_16_1_WGM1
    SolutionIndex: 162
    SolutionNameMin: Cijk_Ailk_Bljk_BBS_BH_MT128x144x32_MI16x16x16x1_SE_1LDSB1_AF0EM8_EPS1_GRVW2_GSU1_LPB16_NLCA1_PGR1_PLR2_SU32_SUS256_SRVW4_TT2_144_VAW2_WG64_4_1_WGM15
    SolutionIndex: 163
    SolutionNameMin: Cijk_Ailk_Bljk_BBS_BH_MT192x192x32_MI32x32x8x1_SE_1LDSB0_AF0EM8_EPS0_GRVW8_GSU1_LPB8_NLCA3_PGR2_PLR5_SU0_SUS0_SRVW0_TT3_96_VAW2_WG64_4_1_WGM1
    SolutionIndex: 164
    SolutionNameMin: Cijk_Ailk_Bljk_BBS_BH_MT64x128x32_MI32x32x8x1_SE_1LDSB0_AF0EM8_EPS0_GRVW8_GSU1_LPB8_NLCA1_PGR2_PLR5_SU32_SUS256_SRVW4_TT1_64_VAW2_WG64_4_1_WGM15
    SolutionIndex: 165
    SolutionNameMin: Cijk_Ailk_Bljk_BBS_BH_MT192x128x32_MI32x32x8x1_SE_1LDSB0_AF0EM8_EPS0_GRVW4_GSU1_LPB8_NLCA3_PGR2_PLR5_SU32_SUS128_SRVW0_TT3_64_VAW2_WG64_4_1_WGM1
    SolutionIndex: 166
    SolutionNameMin: Cijk_Ailk_Bljk_BBS_BH_MT128x144x32_MI16x16x16x1_SE_1LDSB1_AF0EM8_EPS0_GRVW2_GSU1_LPB16_NLCA1_PGR2_PLR2_SU0_SUS0_SRVW4_TT2_144_VAW2_WG64_4_1_WGM15
    SolutionIndex: 167
    SolutionNameMin: Cijk_Ailk_Bljk_BBS_BH_MT32x64x32_MI16x16x16x1_SE_1LDSB0_AF0EM8_EPS1_GRVW8_GSU1_LPB16_NLCA1_PGR1_PLR2_SU32_SUS256_SRVW4_TT1_32_VAW2_WG32_8_1_WGM15
    SolutionIndex: 168
    SolutionNameMin: Cijk_Ailk_Bljk_BBS_BH_MT256x128x32_MI32x32x8x1_SE_1LDSB0_AF0EM8_EPS0_GRVW8_GSU1_LPB8_NLCA1_PGR2_PLR5_SU0_SUS0_SRVW4_TT4_64_VAW2_WG64_4_1_WGM2
    SolutionIndex: 169
    SolutionNameMin: Cijk_Ailk_Bljk_BBS_BH_MT128x160x32_MI32x32x8x1_SE_1LDSB1_AF0EM8_EPS1_GRVW2_GSU1_LPB8_NLCA1_PGR1_PLR5_SU32_SUS256_SRVW4_TT1_160_VAW2_WG128_2_1_WGM15
    SolutionIndex: 170
    SolutionNameMin: Cijk_Ailk_Bljk_BBS_BH_MT128x128x32_MI32x32x8x1_SE_1LDSB1_AF0EM8_EPS1_GRVW2_GSU1_LPB8_NLCA1_PGR1_PLR5_SU32_SUS256_SRVW4_TT2_64_VAW2_WG64_4_1_WGM15
    SolutionIndex: 171
    SolutionNameMin: Cijk_Ailk_Bljk_BBS_BH_MT256x128x32_MI32x32x8x1_SE_1LDSB1_AF0EM8_EPS0_GRVW8_GSU1_LPB8_NLCA1_PGR2_PLR5_SU0_SUS0_SRVW4_TT4_64_VAW2_WG64_4_1_WGM15
    SolutionIndex: 172
    SolutionNameMin: Cijk_Ailk_Bljk_BBS_BH_MT128x256x32_MI32x32x8x1_SE_1LDSB1_AF0EM1_EPS0_GRVW8_GSU1_LPB8_NLCA1_PGR2_PLR5_SU0_SUS0_SRVW4_TT2_128_VAW2_WG64_4_1_WGM1
    SolutionIndex: 173
    SolutionNameMin: Cijk_Ailk_Bljk_BBS_BH_MT32x32x64_MI16x16x16x1_SE_1LDSB0_AF0EM8_EPS0_GRVW8_GSU1_LPB16_NLCA1_PGR2_PLR5_SU0_SUS0_SRVW4_TT1_16_VAW2_WG32_8_1_WGM2
    SolutionIndex: 174
    SolutionNameMin: Cijk_Ailk_Bljk_BBS_BH_MT128x64x64_MI32x32x8x1_SE_1LDSB0_AF0EM8_EPS1_GRVW8_GSU15_LPB8_NLCA1_PGR1_PLR9_SU0_SUS0_SRVW0_TT2_32_VAW1_WG64_4_1_WGM1
    SolutionIndex: 175
    SolutionNameMin: Cijk_Ailk_Bljk_BBS_BH_MT128x64x64_MI32x32x8x1_SE_1LDSB0_AF0EM8_EPS1_GRVW8_GSU15_LPB8_NLCA1_PGR1_PLR9_SU32_SUS256_SRVW0_TT2_32_VAW1_WG64_4_1_WGM2
    SolutionIndex: 176
    SolutionNameMin: Cijk_Ailk_Bljk_BBS_BH_MT128x64x64_MI32x32x8x1_SE_1LDSB0_AF0EM1_EPS0_GRVW8_GSU1_LPB8_NLCA1_PGR2_PLR9_SU32_SUS256_SRVW4_TT2_32_VAW2_WG64_4_1_WGM15
    SolutionIndex: 177
    SolutionNameMin: Cijk_Ailk_Bljk_BBS_BH_MT64x16x64_MI16x16x16x1_SE_1LDSB0_AF0EM8_EPS0_GRVW2_GSU1_LPB16_NLCA1_PGR2_PLR5_SU0_SUS0_SRVW0_TT1_16_VAW2_WG64_4_1_WGM2
    SolutionIndex: 178
    SolutionNameMin: Cijk_Ailk_Bljk_BBS_BH_MT32x32x32_MI16x16x16x1_SE_1LDSB0_AF0EM1_EPS0_GRVW4_GSU1_LPB16_NLCA1_PGR2_PLR2_SU0_SUS0_SRVW4_TT1_16_VAW2_WG32_8_1_WGM15
    SolutionIndex: 179
    SolutionNameMin: Cijk_Ailk_Bljk_BBS_BH_MT64x16x32_MI16x16x16x1_SE_1LDSB0_AF0EM8_EPS1_GRVW4_GSU1_LPB16_NLCA1_PGR1_PLR2_SU0_SUS0_SRVW0_TT1_16_VAW2_WG64_4_1_WGM1
    SolutionIndex: 180
    SolutionNameMin: Cijk_Ailk_Bljk_BBS_BH_MT64x4x32_MI4x4x4x16_SE_1LDSB0_AF0EM8_EPS1_GRVW4_GSU1_LPB8_NLCA1_PGR1_PLR9_SU0_SUS0_SRVW0_TT1_4_VAW2_WG64_1_1_WGM15
    SolutionIndex: 181
    SolutionNameMin: Cijk_Ailk_Bljk_BBS_BH_MT128x256x32_MI32x32x8x1_SE_1LDSB1_AF0EM8_EPS1_GRVW8_GSU1_LPB8_NLCA1_PGR1_PLR5_SU32_SUS128_SRVW4_TT2_128_VAW2_WG64_4_1_WGM1
    SolutionIndex: 182
    SolutionNameMin: Cijk_Ailk_Bljk_BBS_BH_MT128x64x32_MI32x32x8x1_SE_1LDSB0_AF0EM8_EPS1_GRVW8_GSU1_LPB8_NLCA1_PGR1_PLR5_SU0_SUS0_SRVW4_TT2_32_VAW2_WG64_4_1_WGM2
    SolutionIndex: 183
    SolutionNameMin: Cijk_Ailk_Bljk_BBS_BH_MT64x4x32_MI4x4x4x16_SE_1LDSB0_AF0EM8_EPS0_GRVW8_GSU1_LPB8_NLCA1_PGR2_PLR9_SU0_SUS0_SRVW0_TT1_4_VAW2_WG64_1_1_WGM1
    SolutionIndex: 184
    SolutionNameMin: Cijk_Ailk_Bljk_BBS_BH_MT128x256x32_MI32x32x8x1_SE_1LDSB1_AF0EM8_EPS1_GRVW8_GSU1_LPB8_NLCA1_PGR1_PLR5_SU32_SUS256_SRVW4_TT2_128_VAW2_WG64_4_1_WGM2
    SolutionIndex: 185
    SolutionNameMin: Cijk_Ailk_Bljk_BBS_BH_MT96x96x64_MI16x16x16x1_SE_1LDSB0_AF0EM1_EPS0_GRVW8_GSU1_LPB16_NLCA3_PGR2_PLR5_SU0_SUS0_SRVW0_TT3_48_VAW2_WG32_8_1_WGM1
    SolutionIndex: 186
    SolutionNameMin: Cijk_Ailk_Bljk_BBS_BH_MT64x128x32_MI32x32x8x1_SE_1LDSB0_AF0EM1_EPS0_GRVW4_GSU1_LPB8_NLCA1_PGR2_PLR5_SU0_SUS0_SRVW4_TT1_64_VAW2_WG64_4_1_WGM2
    SolutionIndex: 187
    SolutionNameMin: Cijk_Ailk_Bljk_BBS_BH_MT32x32x64_MI16x16x16x1_SE_1LDSB0_AF0EM1_EPS0_GRVW4_GSU1_LPB16_NLCA1_PGR2_PLR5_SU0_SUS0_SRVW4_TT1_16_VAW2_WG32_8_1_WGM1
    SolutionIndex: 188
    SolutionNameMin: Cijk_Ailk_Bljk_BBS_BH_MT32x32x64_MI16x16x16x1_SE_1LDSB0_AF0EM1_EPS0_GRVW8_GSU1_LPB16_NLCA1_PGR2_PLR5_SU0_SUS0_SRVW4_TT1_16_VAW2_WG32_8_1_WGM2
    SolutionIndex: 189
    SolutionNameMin: Cijk_Ailk_Bljk_BBS_BH_MT32x32x32_MI16x16x16x1_SE_1LDSB0_AF0EM1_EPS0_GRVW8_GSU1_LPB16_NLCA1_PGR2_PLR2_SU0_SUS0_SRVW4_TT1_16_VAW2_WG32_8_1_WGM1
    SolutionIndex: 190
    SolutionNameMin: Cijk_Ailk_Bljk_BBS_BH_MT64x128x64_MI32x32x8x1_SE_1LDSB0_AF0EM1_EPS0_GRVW8_GSU1_LPB8_NLCA1_PGR2_PLR9_SU0_SUS0_SRVW4_TT1_64_VAW2_WG64_4_1_WGM15
    SolutionIndex: 191
    SolutionNameMin: Cijk_Ailk_Bljk_BBS_BH_MT32x64x64_MI16x16x16x1_SE_1LDSB0_AF0EM1_EPS0_GRVW8_GSU1_LPB16_NLCA1_PGR2_PLR5_SU32_SUS256_SRVW4_TT1_32_VAW2_WG32_8_1_WGM15
    SolutionIndex: 192
    SolutionNameMin: Cijk_Ailk_Bljk_BBS_BH_MT128x64x32_MI32x32x8x1_SE_1LDSB0_AF0EM1_EPS0_GRVW2_GSU1_LPB8_NLCA1_PGR2_PLR5_SU0_SUS0_SRVW4_TT2_32_VAW2_WG64_4_1_WGM15
    SolutionIndex: 193
    SolutionNameMin: Cijk_Ailk_Bljk_BBS_BH_MT128x64x32_MI32x32x8x1_SE_1LDSB0_AF0EM1_EPS0_GRVW4_GSU1_LPB8_NLCA1_PGR2_PLR5_SU0_SUS0_SRVW4_TT2_32_VAW2_WG64_4_1_WGM1
    SolutionIndex: 194
    SolutionNameMin: Cijk_Ailk_Bljk_BBS_BH_MT128x128x32_MI32x32x8x1_SE_1LDSB1_AF0EM1_EPS1_GRVW2_GSU1_LPB8_NLCA1_PGR1_PLR5_SU32_SUS128_SRVW4_TT2_64_VAW2_WG64_4_1_WGM1
    SolutionIndex: 195
    SolutionNameMin: Cijk_Ailk_Bljk_BBS_BH_MT32x64x32_MI16x16x16x1_SE_1LDSB1_AF0EM1_EPS1_GRVW2_GSU1_LPB16_NLCA1_PGR1_PLR2_SU32_SUS128_SRVW4_TT1_32_VAW2_WG32_8_1_WGM1
    SolutionIndex: 196
    SolutionNameMin: Cijk_Ailk_Bljk_BBS_BH_MT32x64x32_MI16x16x16x1_SE_1LDSB0_AF0EM1_EPS0_GRVW2_GSU1_LPB16_NLCA1_PGR2_PLR2_SU0_SUS0_SRVW4_TT1_32_VAW2_WG32_8_1_WGM1
    SolutionIndex: 197
    SolutionNameMin: Cijk_Ailk_Bljk_BBS_BH_MT128x128x32_MI32x32x8x1_SE_1LDSB1_AF0EM1_EPS1_GRVW2_GSU1_LPB8_NLCA1_PGR1_PLR5_SU32_SUS256_SRVW4_TT2_64_VAW2_WG64_4_1_WGM15
    SolutionIndex: 198
    SolutionNameMin: Cijk_Ailk_Bljk_BBS_BH_MT64x80x64_MI16x16x16x1_SN_1LDSB0_GSU1_LPB4_LRVW4_PLR5_SU0_SUS0_TT1_80_WGM8
    SolutionIndex: 199
    SolutionNameMin: Cijk_Ailk_Bljk_BBS_BH_MT16x16x32_SN_GSU4
    SolutionIndex: 200
    SolutionNameMin: Cijk_Ailk_Bljk_BBS_BH_MT16x16x32_SN_GSU8
    SolutionIndex: 201
    SolutionNameMin: Cijk_Ailk_Bljk_BBS_BH_MT16x32x64_MI16x16x16x1_SN_FL0_GSUWGMRR0_LBSPP128_LPA16_LPB8_NTA2_NTB0_NTC1_NTD3_WSGRA0_WGM1
    SolutionIndex: 202
    SolutionNameMin: Cijk_Ailk_Bljk_BBS_BH_MT16x32x64_MI16x16x16x1_SN_FL2_GSUWGMRR0_LBSPP0_LPA16_LPB4_NTA2_NTB0_NTC0_NTD3_WSGRA0_WGM1
    SolutionIndex: 203
    SolutionNameMin: Cijk_Ailk_Bljk_BBS_BH_MT4x32x64_SN_LDL8
    SolutionIndex: 204
    SolutionNameMin: Cijk_Ailk_Bljk_BBS_BH_MT16x16x32_MI16x16x16x1_SN_1LDSB0_EPS1_GRVW2_GSU1_PGR1_PLR2_SU32_SUS128_SRVW4_TT1_16_WG16_4_1_WGM1
    SolutionIndex: 205
    SolutionNameMin: Cijk_Ailk_Bljk_BBS_BH_MT16x32x32_MI16x16x16x1_SN_1LDSB0_EPS1_GRVW2_GSU1_PGR1_PLR2_SU0_SUS0_SRVW4_TT1_16_WG16_8_1_WGM1
    SolutionIndex: 206
    SolutionNameMin: Cijk_Ailk_Bljk_BBS_BH_MT16x16x32_MI16x16x16x1_SN_1LDSB0_EPS0_GRVW2_GSU1_PGR2_PLR2_SU0_SUS0_SRVW4_TT1_16_WG16_4_1_WGM1
    SolutionIndex: 207
    SolutionNameMin: Cijk_Ailk_Bljk_BBS_BH_MT16x32x64_MI16x16x16x1_SN_1LDSB0_EPS0_GRVW2_GSU1_PGR2_PLR5_SU0_SUS0_SRVW4_TT1_16_WG16_8_1_WGM1
    SolutionIndex: 208
    SolutionNameMin: Cijk_Ailk_Bljk_BBS_BH_MT16x32x64_MI16x16x16x1_SN_1LDSB0_EPS0_GRVW2_GSU1_PGR2_PLR5_SU32_SUS128_SRVW4_TT1_16_WG16_8_1_WGM2
    SolutionIndex: 209
    SolutionNameMin: Cijk_Ailk_Bljk_BBS_BH_MT16x32x64_MI16x16x16x1_SN_1LDSB0_EPS0_GRVW2_GSU11_PGR2_PLR5_SU0_SUS0_SRVW0_TT1_16_WG16_8_1_WGM1
    SolutionIndex: 210
    SolutionNameMin: Cijk_Ailk_Bljk_BBS_BH_MT16x32x32_MI16x16x16x1_SN_1LDSB0_EPS1_GRVW2_GSU1_PGR1_PLR2_SU0_SUS0_SRVW4_TT1_16_WG16_8_1_WGM2
    SolutionIndex: 211
    SolutionNameMin: Cijk_Ailk_Bljk_BBS_BH_MT16x16x32_MI16x16x16x1_SN_1LDSB0_EPS0_GRVW2_GSU1_PGR2_PLR2_SU32_SUS256_SRVW4_TT1_16_WG16_4_1_WGM1
    SolutionIndex: 212
    SolutionNameMin: Cijk_Ailk_Bljk_BBS_BH_MT16x32x64_MI16x16x16x1_SN_1LDSB0_EPS0_GRVW2_GSU1_PGR2_PLR5_SU32_SUS128_SRVW4_TT1_16_WG16_8_1_WGM15
    SolutionIndex: 213
    SolutionNameMin: Cijk_Ailk_Bljk_BBS_BH_MT16x32x64_MI16x16x16x1_SN_1LDSB0_EPS0_GRVW2_GSU1_PGR2_PLR5_SU0_SUS0_SRVW4_TT1_16_WG16_8_1_WGM15
    SolutionIndex: 214
    SolutionNameMin: Cijk_Ailk_Bljk_BBS_BH_MT16x32x64_MI16x16x16x1_SN_1LDSB0_EPS0_GRVW2_GSU11_PGR2_PLR5_SU0_SUS0_SRVW0_TT1_16_WG16_8_1_WGM15
    SolutionIndex: 215
    SolutionNameMin: Cijk_Ailk_Bljk_BBS_BH_MT16x32x64_MI16x16x16x1_SN_1LDSB0_EPS0_GRVW2_GSU11_PGR2_PLR5_SU32_SUS128_SRVW0_TT1_16_WG16_8_1_WGM1
    SolutionIndex: 216
    SolutionNameMin: Cijk_Ailk_Bljk_BBS_BH_MT16x16x32_MI16x16x16x1_SN_1LDSB0_EPS0_GRVW2_GSU1_PGR2_PLR2_SU0_SUS0_SRVW4_TT1_16_WG16_4_1_WGM15
    SolutionIndex: 217
    SolutionNameMin: Cijk_Ailk_Bljk_BBS_BH_MT16x32x32_MI16x16x16x1_SN_1LDSB0_EPS1_GRVW2_GSU1_PGR1_PLR2_SU0_SUS0_SRVW4_TT1_16_WG16_8_1_WGM15
    SolutionIndex: 218
    SolutionNameMin: Cijk_Ailk_Bljk_BBS_BH_MT16x32x64_MI16x16x16x1_SN_1LDSB0_EPS0_GRVW2_GSU1_PGR2_PLR5_SU32_SUS256_SRVW4_TT1_16_WG16_8_1_WGM1
    SolutionIndex: 219
    SolutionNameMin: Cijk_Ailk_Bljk_BBS_BH_MT16x32x64_MI16x16x16x1_SN_1LDSB0_EPS1_GRVW2_GSU10_PGR1_PLR5_SU32_SUS128_SRVW0_TT1_16_WG16_8_1_WGM1
    SolutionIndex: 220
    SolutionNameMin: Cijk_Ailk_Bljk_BBS_BH_MT16x32x32_MI16x16x16x1_SN_1LDSB0_EPS0_GRVW2_GSU1_PGR2_PLR2_SU32_SUS128_SRVW4_TT1_16_WG16_8_1_WGM1
    SolutionIndex: 221
    SolutionNameMin: Cijk_Ailk_Bljk_BBS_BH_MT16x32x64_MI16x16x16x1_SN_1LDSB0_EPS1_GRVW2_GSU1_PGR1_PLR5_SU32_SUS256_SRVW4_TT1_16_WG16_8_1_WGM1
    SolutionIndex: 222
    SolutionNameMin: Cijk_Ailk_Bljk_BBS_BH_MT16x32x32_MI16x16x16x1_SN_1LDSB0_EPS0_GRVW2_GSU1_PGR2_PLR2_SU0_SUS0_SRVW4_TT1_16_WG16_8_1_WGM1
    SolutionIndex: 223
    SolutionNameMin: Cijk_Ailk_Bljk_BBS_BH_MT16x32x64_MI16x16x16x1_SN_1LDSB0_EPS0_GRVW2_GSU1_PGR2_PLR5_SU32_SUS256_SRVW4_TT1_16_WG16_8_1_WGM2
    SolutionIndex: 224
    SolutionNameMin: Cijk_Ailk_Bljk_BBS_BH_MT16x32x32_MI16x16x16x1_SN_1LDSB0_EPS0_GRVW2_GSU1_PGR2_PLR2_SU32_SUS128_SRVW4_TT1_16_WG16_8_1_WGM15
    SolutionIndex: 225
    SolutionNameMin: Cijk_Ailk_Bljk_BBS_BH_MT16x16x64_MI16x16x16x1_SN_1LDSB0_EPS0_GRVW2_GSU1_PGR2_PLR5_SU32_SUS128_SRVW4_TT1_16_WG16_4_1_WGM1
    SolutionIndex: 226
    SolutionNameMin: Cijk_Ailk_Bljk_BBS_BH_MT16x32x64_MI16x16x16x1_SN_1LDSB0_EPS0_GRVW4_GSU1_PGR2_PLR5_SU32_SUS256_SRVW4_TT1_16_WG16_8_1_WGM1
    SolutionIndex: 227
    SolutionNameMin: Cijk_Ailk_Bljk_BBS_BH_MT16x16x64_MI16x16x16x1_SN_1LDSB0_EPS0_GRVW4_GSU1_PGR2_PLR5_SU0_SUS0_SRVW4_TT1_16_WG16_4_1_WGM2
    SolutionIndex: 228
    SolutionNameMin: Cijk_Ailk_Bljk_BBS_BH_MT16x16x64_MI16x16x16x1_SN_1LDSB0_EPS0_GRVW4_GSU1_PGR2_PLR5_SU32_SUS256_SRVW4_TT1_16_WG16_4_1_WGM1
    SolutionIndex: 229
    SolutionNameMin: Cijk_Ailk_Bljk_BBS_BH_MT16x32x64_MI16x16x16x1_SN_1LDSB0_EPS0_GRVW4_GSU1_PGR2_PLR5_SU0_SUS0_SRVW4_TT1_16_WG16_8_1_WGM1
    SolutionIndex: 230
    SolutionNameMin: Cijk_Ailk_Bljk_BBS_BH_MT16x32x64_MI16x16x16x1_SN_1LDSB0_EPS0_GRVW4_GSU11_PGR2_PLR5_SU0_SUS0_SRVW0_TT1_16_WG16_8_1_WGM15
    SolutionIndex: 231
    SolutionNameMin: Cijk_Ailk_Bljk_BBS_BH_MT16x32x64_MI16x16x16x1_SN_1LDSB0_EPS1_GRVW4_GSU1_PGR1_PLR5_SU0_SUS0_SRVW4_TT1_16_WG16_8_1_WGM1
    SolutionIndex: 232
    SolutionNameMin: Cijk_Ailk_Bljk_BBS_BH_MT16x32x32_MI16x16x16x1_SN_1LDSB0_EPS0_GRVW4_GSU1_PGR2_PLR2_SU0_SUS0_SRVW4_TT1_16_WG16_8_1_WGM1
    SolutionIndex: 233
    SolutionNameMin: Cijk_Ailk_Bljk_BBS_BH_MT16x16x64_MI16x16x16x1_SN_1LDSB0_EPS0_GRVW4_GSU1_PGR2_PLR5_SU0_SUS0_SRVW4_TT1_16_WG16_4_1_WGM15
    SolutionIndex: 234
    SolutionNameMin: Cijk_Ailk_Bljk_BBS_BH_MT16x32x32_MI16x16x16x1_SN_1LDSB0_EPS0_GRVW4_GSU1_PGR2_PLR2_SU0_SUS0_SRVW4_TT1_16_WG16_8_1_WGM15
    SolutionIndex: 235
    SolutionNameMin: Cijk_Ailk_Bljk_BBS_BH_MT16x16x64_MI16x16x16x1_SN_1LDSB0_EPS0_GRVW4_GSU1_PGR2_PLR5_SU0_SUS0_SRVW4_TT1_16_WG16_4_1_WGM1
    SolutionIndex: 236
    SolutionNameMin: Cijk_Ailk_Bljk_BBS_BH_MT16x32x64_MI16x16x16x1_SN_1LDSB0_EPS0_GRVW4_GSU10_PGR2_PLR5_SU32_SUS256_SRVW0_TT1_16_WG16_8_1_WGM15
    SolutionIndex: 237
    SolutionNameMin: Cijk_Ailk_Bljk_BBS_BH_MT16x32x32_MI16x16x16x1_SN_1LDSB0_EPS0_GRVW4_GSU1_PGR2_PLR2_SU0_SUS0_SRVW4_TT1_16_WG16_8_1_WGM2
    SolutionIndex: 238
    SolutionNameMin: Cijk_Ailk_Bljk_BBS_BH_MT16x16x64_MI16x16x16x1_SN_1LDSB0_EPS0_GRVW4_GSU1_PGR2_PLR5_SU32_SUS128_SRVW4_TT1_16_WG16_4_1_WGM1
    SolutionIndex: 239
    SolutionNameMin: Cijk_Ailk_Bljk_BBS_BH_MT16x32x32_MI16x16x16x1_SN_1LDSB0_EPS0_GRVW2_GSU1_PGR2_PLR2_SU32_SUS256_SRVW4_TT1_16_WG16_8_1_WGM1
    SolutionIndex: 240
    SolutionNameMin: Cijk_Ailk_Bljk_BBS_BH_MT16x16x64_MI16x16x16x1_SN_1LDSB0_EPS0_GRVW4_GSU1_PGR2_PLR5_SU32_SUS256_SRVW4_TT1_16_WG16_4_1_WGM2
    SolutionIndex: 241
    SolutionNameMin: Cijk_Ailk_Bljk_BBS_BH_MT16x32x64_MI16x16x16x1_SN_1LDSB0_EPS0_GRVW2_GSU11_PGR2_PLR5_SU32_SUS128_SRVW0_TT1_16_WG16_8_1_WGM15
    SolutionIndex: 242
    SolutionNameMin: Cijk_Ailk_Bljk_BBS_BH_MT16x16x64_MI16x16x16x1_SN_1LDSB0_EPS0_GRVW8_GSU11_PGR2_PLR5_SU0_SUS0_SRVW0_TT1_16_WG16_4_1_WGM1
    SolutionIndex: 243
    SolutionNameMin: Cijk_Ailk_Bljk_BBS_BH_MT16x32x64_MI16x16x16x1_SN_1LDSB0_EPS0_GRVW8_GSU11_PGR2_PLR5_SU32_SUS128_SRVW0_TT1_16_WG16_8_1_WGM15
    SolutionIndex: 244
    SolutionNameMin: Cijk_Ailk_Bljk_BBS_BH_MT16x32x64_MI16x16x16x1_SN_1LDSB0_EPS0_GRVW4_GSU10_PGR2_PLR5_SU32_SUS128_SRVW0_TT1_16_WG16_8_1_WGM15
    SolutionIndex: 245
    SolutionNameMin: Cijk_Ailk_Bljk_BBS_BH_MT16x16x64_MI16x16x16x1_SN_1LDSB0_EPS0_GRVW8_GSU1_PGR2_PLR5_SU0_SUS0_SRVW4_TT1_16_WG16_4_1_WGM2
    SolutionIndex: 246
    SolutionNameMin: Cijk_Ailk_Bljk_BBS_BH_MT16x32x64_MI16x16x16x1_SN_1LDSB0_EPS0_GRVW8_GSU1_PGR2_PLR5_SU32_SUS128_SRVW4_TT1_16_WG16_8_1_WGM1
    SolutionIndex: 247
    SolutionNameMin: Cijk_Ailk_Bljk_BBS_BH_MT16x16x64_MI16x16x16x1_SN_1LDSB0_EPS0_GRVW8_GSU1_PGR2_PLR5_SU0_SUS0_SRVW4_TT1_16_WG16_4_1_WGM1
    SolutionIndex: 248
    SolutionNameMin: Cijk_Ailk_Bljk_BBS_BH_MT16x32x64_MI16x16x16x1_SN_1LDSB0_EPS0_GRVW8_GSU11_PGR2_PLR5_SU0_SUS0_SRVW0_TT1_16_WG16_8_1_WGM1
    SolutionIndex: 249
    SolutionNameMin: Cijk_Ailk_Bljk_BBS_BH_MT16x32x64_MI16x16x16x1_SN_1LDSB0_EPS0_GRVW8_GSU1_PGR2_PLR5_SU0_SUS0_SRVW4_TT1_16_WG16_8_1_WGM1
    SolutionIndex: 250
    SolutionNameMin: Cijk_Ailk_Bljk_BBS_BH_MT16x16x32_MI16x16x16x1_SN_1LDSB0_EPS1_GRVW8_GSU1_PGR1_PLR2_SU0_SUS0_SRVW4_TT1_16_WG16_4_1_WGM15
    SolutionIndex: 251
    SolutionNameMin: Cijk_Ailk_Bljk_BBS_BH_MT16x16x32_MI16x16x16x1_SN_1LDSB0_EPS1_GRVW8_GSU1_PGR1_PLR2_SU0_SUS0_SRVW4_TT1_16_WG16_4_1_WGM1
    SolutionIndex: 252
    SolutionNameMin: Cijk_Ailk_Bljk_BBS_BH_MT16x32x64_MI16x16x16x1_SN_1LDSB0_EPS0_GRVW8_GSU1_PGR2_PLR5_SU32_SUS128_SRVW4_TT1_16_WG16_8_1_WGM2
    SolutionIndex: 253
    SolutionNameMin: Cijk_Ailk_Bljk_BBS_BH_MT16x32x64_MI16x16x16x1_SN_1LDSB0_EPS0_GRVW8_GSU1_PGR2_PLR5_SU0_SUS0_SRVW4_TT1_16_WG16_8_1_WGM15
    SolutionIndex: 254
    SolutionNameMin: Cijk_Ailk_Bljk_BBS_BH_MT16x16x64_MI16x16x16x1_SN_1LDSB0_EPS0_GRVW8_GSU10_PGR2_PLR5_SU32_SUS128_SRVW0_TT1_16_WG16_4_1_WGM1
    SolutionIndex: 255
    SolutionNameMin: Cijk_Ailk_Bljk_BBS_BH_MT16x32x64_MI16x16x16x1_SN_1LDSB0_EPS0_GRVW8_GSU1_PGR2_PLR5_SU32_SUS128_SRVW4_TT1_16_WG16_8_1_WGM15
    SolutionIndex: 256
    SolutionNameMin: Cijk_Ailk_Bljk_BBS_BH_MT16x32x32_MI16x16x16x1_SN_1LDSB0_EPS1_GRVW8_GSU1_PGR1_PLR2_SU0_SUS0_SRVW4_TT1_16_WG16_8_1_WGM1
    SolutionIndex: 257
    SolutionNameMin: Cijk_Ailk_Bljk_BBS_BH_MT16x32x64_MI16x16x16x1_SN_1LDSB0_EPS0_GRVW8_GSU1_PGR2_PLR5_SU32_SUS256_SRVW4_TT1_16_WG16_8_1_WGM1
    SolutionIndex: 258
    SolutionNameMin: Cijk_Ailk_Bljk_BBS_BH_MT16x32x64_MI16x16x16x1_SN_1LDSB0_EPS0_GRVW8_GSU1_PGR2_PLR5_SU0_SUS0_SRVW4_TT1_16_WG16_8_1_WGM2
    SolutionIndex: 259
    SolutionNameMin: Cijk_Ailk_Bljk_BBS_BH_MT16x32x64_MI16x16x16x1_SN_1LDSB0_EPS0_GRVW8_GSU1_PGR2_PLR5_SU32_SUS256_SRVW4_TT1_16_WG16_8_1_WGM15
    SolutionIndex: 260
    SolutionNameMin: Cijk_Ailk_Bljk_BBS_BH_MT16x16x64_MI16x16x16x1_SN_1LDSB0_EPS0_GRVW8_GSU1_PGR2_PLR5_SU32_SUS256_SRVW4_TT1_16_WG16_4_1_WGM1
    SolutionIndex: 261
    SolutionNameMin: Cijk_Ailk_Bljk_BBS_BH_MT16x128x32_MI16x16x16x1_SN_1LDSB1_EPS0_GRVW8_GSU1_PGR2_PLR2_SU0_SUS0_SRVW4_TT1_32_WG16_16_1_WGM1
    SolutionIndex: 262
    SolutionNameMin: Cijk_Ailk_Bljk_BBS_BH_MT16x16x64_MI16x16x16x1_SN_1LDSB0_EPS1_GRVW8_GSU1_PGR1_PLR5_SU32_SUS256_SRVW4_TT1_16_WG16_4_1_WGM15
    SolutionIndex: 263
    SolutionNameMin: Cijk_Ailk_Bljk_BBS_BH_MT64x16x32_MI16x16x16x1_SE_1LDSB0_AF0EM8_AF1EM1_AMAS3_EPS0_GRVW8_GSU1_GSUAMB_ISA90a_IU1_KLA_LBSPP128_LPB16_LDL1_LRVW8_LDW0_MAC_NLCA1_PGR2_PLR2_SIA3_SU0_SUM0_SUS0_SRVW0_TT1_16_TLDS1_VAW2_VW2_WSGRA1_WSGRB1_WG64_4_1_WGM15
    SolutionIndex: 264
    SolutionNameMin: Cijk_Ailk_Bljk_BBS_BH_MT16x16x64_MI16x16x16x1_SE_1LDSB0_AF0EM8_AF1EM1_AMAS3_EPS0_GRVW8_GSU1_GSUAMB_ISA90a_IU1_KLA_LBSPP128_LPB16_LDL1_LRVW8_LDW0_MAC_NLCA1_PGR2_PLR5_SIA3_SU0_SUM0_SUS0_SRVW0_TT1_16_TLDS1_VAW2_VW2_WSGRA1_WSGRB1_WG16_4_1_WGM1
    SolutionIndex: 265
    SolutionNameMin: Cijk_Ailk_Bljk_BBS_BH_MT16x16x64_MI16x16x16x1_SE_1LDSB0_AF0EM8_AF1EM1_AMAS3_EPS0_GRVW8_GSU1_GSUAMB_ISA90a_IU1_KLA_LBSPP128_LPB16_LDL1_LRVW8_LDW0_MAC_NLCA1_PGR2_PLR5_SIA3_SU32_SUM0_SUS256_SRVW0_TT1_16_TLDS1_VAW2_VW2_WSGRA1_WSGRB1_WG16_4_1_WGM1
    SolutionIndex: 266
    SolutionNameMin: Cijk_Ailk_Bljk_BBS_BH_MT16x16x64_MI16x16x16x1_SE_1LDSB0_AF0EM8_AF1EM1_AMAS3_EPS0_GRVW8_GSU1_GSUAMB_ISA90a_IU1_KLA_LBSPP128_LPB16_LDL1_LRVW8_LDW0_MAC_NLCA1_PGR2_PLR5_SIA3_SU32_SUM0_SUS128_SRVW0_TT1_16_TLDS1_VAW2_VW2_WSGRA1_WSGRB1_WG16_4_1_WGM2
    SolutionIndex: 267
    SolutionNameMin: Cijk_Ailk_Bljk_BBS_BH_MT64x16x32_MI16x16x16x1_SE_1LDSB0_AF0EM8_AF1EM1_AMAS3_EPS1_GRVW2_GSU1_GSUAMB_ISA90a_IU1_KLA_LBSPP128_LPB16_LDL1_LRVW8_LDW0_MAC_NLCA1_PGR1_PLR2_SIA3_SU0_SUM0_SUS0_SRVW0_TT1_16_TLDS1_VAW2_VW2_WSGRA1_WSGRB1_WG64_4_1_WGM1
    SolutionIndex: 268
    SolutionNameMin: Cijk_Ailk_Bljk_BBS_BH_MT64x16x64_MI16x16x16x1_SE_1LDSB0_AF0EM8_AF1EM1_AMAS3_EPS0_GRVW8_GSU1_GSUAMB_ISA90a_IU1_KLA_LBSPP128_LPB16_LDL1_LRVW8_LDW0_MAC_NLCA1_PGR2_PLR5_SIA3_SU0_SUM0_SUS0_SRVW0_TT1_16_TLDS1_VAW2_VW2_WSGRA1_WSGRB1_WG64_4_1_WGM1
    SolutionIndex: 269
    SolutionNameMin: Cijk_Ailk_Bljk_BBS_BH_MT128x64x64_MI32x32x8x1_SE_1LDSB0_AF0EM8_AF1EM1_AMAS3_EPS1_GRVW8_GSU15_GSUAMB_ISA90a_IU1_KLA_LBSPP128_LPB8_LDL1_LRVW8_LDW0_MAC_NLCA1_PGR1_PLR9_SIA3_SU32_SUM0_SUS256_SRVW0_TT2_32_TLDS1_VAW1_VW2_WSGRA1_WSGRB1_WG64_4_1_WGM2
    SolutionIndex: 270
    SolutionNameMin: Cijk_Ailk_Bljk_BBS_BH_MT128x96x64_MI32x32x8x1_SE_1LDSB0_AF0EM8_AF1EM1_AMAS3_EPS0_GRVW8_GSU15_GSUAMB_ISA90a_IU1_KLA_LBSPP128_LPB8_LDL1_LRVW8_LDW0_MAC_NLCA1_PGR2_PLR9_SIA3_SU0_SUM0_SUS0_SRVW4_TT1_96_TLDS1_VAW1_VW2_WSGRA1_WSGRB1_WG128_2_1_WGM15
    SolutionIndex: 271
    SolutionNameMin: Cijk_Ailk_Bljk_BBS_BH_MT32x32x64_MI16x16x16x1_SE_1LDSB0_AF0EM8_AF1EM1_AMAS3_EPS0_GRVW8_GSU1_GSUAMB_ISA90a_IU1_KLA_LBSPP128_LPB16_LDL1_LRVW8_LDW0_MAC_NLCA1_PGR2_PLR5_SIA3_SU0_SUM0_SUS0_SRVW4_TT1_16_TLDS1_VAW2_VW2_WSGRA1_WSGRB1_WG32_8_1_WGM2
    SolutionIndex: 272
    SolutionNameMin: Cijk_Ailk_Bljk_BBS_BH_MT32x64x64_MI16x16x16x1_SE_1LDSB0_AF0EM8_AF1EM1_AMAS3_EPS0_GRVW8_GSU1_GSUAMB_ISA90a_IU1_KLA_LBSPP128_LPB16_LDL1_LRVW8_LDW0_MAC_NLCA1_PGR2_PLR5_SIA3_SU32_SUM0_SUS256_SRVW4_TT1_32_TLDS1_VAW2_VW2_WSGRA1_WSGRB1_WG32_8_1_WGM1
    SolutionIndex: 273
    SolutionNameMin: Cijk_Ailk_Bljk_BBS_BH_MT128x96x64_MI32x32x8x1_SE_1LDSB0_AF0EM8_AF1EM1_AMAS3_EPS1_GRVW8_GSU5_GSUAMB_ISA90a_IU1_KLA_LBSPP128_LPB8_LDL1_LRVW8_LDW0_MAC_NLCA1_PGR1_PLR9_SIA3_SU0_SUM0_SUS0_SRVW0_TT1_96_TLDS1_VAW1_VW2_WSGRA1_WSGRB1_WG128_2_1_WGM1
    SolutionIndex: 274
    SolutionNameMin: Cijk_Ailk_Bljk_BBS_BH_MT64x16x32_MI16x16x16x1_SE_1LDSB0_AF0EM8_AF1EM1_AMAS3_EPS0_GRVW4_GSU1_GSUAMB_ISA90a_IU1_KLA_LBSPP128_LPB16_LDL1_LRVW8_LDW0_MAC_NLCA1_PGR2_PLR2_SIA3_SU0_SUM0_SUS0_SRVW0_TT1_16_TLDS1_VAW2_VW2_WSGRA1_WSGRB1_WG64_4_1_WGM1
    SolutionIndex: 275
    SolutionNameMin: Cijk_Ailk_Bljk_BBS_BH_MT64x32x64_MI16x16x16x1_SE_1LDSB0_AF0EM8_AF1EM1_AMAS3_EPS0_GRVW8_GSU1_GSUAMB_ISA90a_IU1_KLA_LBSPP128_LPB16_LDL1_LRVW8_LDW0_MAC_NLCA1_PGR2_PLR5_SIA3_SU0_SUM0_SUS0_SRVW4_TT2_16_TLDS1_VAW2_VW2_WSGRA1_WSGRB1_WG32_8_1_WGM1
    SolutionIndex: 276
    SolutionNameMin: Cijk_Ailk_Bljk_BBS_BH_MT64x64x64_MI32x32x8x1_SE_1LDSB0_AF0EM8_AF1EM1_AMAS3_EPS0_GRVW8_GSU1_GSUAMB_ISA90a_IU1_KLA_LBSPP128_LPB8_LDL1_LRVW8_LDW0_MAC_NLCA1_PGR2_PLR9_SIA3_SU0_SUM0_SUS0_SRVW4_TT1_32_TLDS1_VAW2_VW2_WSGRA1_WSGRB1_WG64_4_1_WGM15
    SolutionIndex: 277
    SolutionNameMin: Cijk_Ailk_Bljk_BBS_BH_MT64x64x64_MI32x32x8x1_SE_1LDSB0_AF0EM1_AF1EM1_AMAS3_EPS0_GRVW8_GSU1_GSUAMB_ISA90a_IU1_KLA_LBSPP128_LPB8_LDL1_LRVW8_LDW0_MAC_NLCA1_PGR2_PLR9_SIA3_SU0_SUM0_SUS0_SRVW4_TT1_32_TLDS1_VAW2_VW2_WSGRA1_WSGRB1_WG64_4_1_WGM1
    SolutionIndex: 278
    SolutionNameMin: Cijk_Ailk_Bljk_BBS_BH_MT64x64x64_MI32x32x8x1_SE_1LDSB0_AF0EM8_AF1EM1_AMAS3_EPS0_GRVW8_GSU1_GSUAMB_ISA90a_IU1_KLA_LBSPP128_LPB8_LDL1_LRVW8_LDW0_MAC_NLCA1_PGR2_PLR9_SIA3_SU0_SUM0_SUS0_SRVW4_TT1_32_TLDS1_VAW2_VW2_WSGRA1_WSGRB1_WG64_4_1_WGM2
    SolutionIndex: 279
    SolutionNameMin: Cijk_Ailk_Bljk_BBS_BH_MT64x64x64_MI32x32x8x1_SE_1LDSB0_AF0EM8_AF1EM1_AMAS3_EPS0_GRVW8_GSU1_GSUAMB_ISA90a_IU1_KLA_LBSPP128_LPB8_LDL1_LRVW8_LDW0_MAC_NLCA1_PGR2_PLR9_SIA3_SU0_SUM0_SUS0_SRVW4_TT1_32_TLDS1_VAW2_VW2_WSGRA1_WSGRB1_WG64_4_1_WGM1
    SolutionIndex: 280
    SolutionNameMin: Cijk_Ailk_Bljk_BBS_BH_MT32x64x32_MI16x16x16x1_SE_1LDSB1_AF0EM8_AF1EM1_AMAS3_EPS1_GRVW2_GSU1_GSUAMB_ISA90a_IU1_KLA_LBSPP128_LPB16_LDL1_LRVW8_LDW0_MAC_NLCA1_PGR1_PLR2_SIA3_SU0_SUM0_SUS0_SRVW4_TT1_32_TLDS1_VAW2_VW2_WSGRA1_WSGRB1_WG32_8_1_WGM15
    SolutionIndex: 281
    SolutionNameMin: Cijk_Ailk_Bljk_BBS_BH_MT64x32x32_MI16x16x16x1_SE_1LDSB1_AF0EM8_AF1EM1_AMAS3_EPS1_GRVW2_GSU1_GSUAMB_ISA90a_IU1_KLA_LBSPP128_LPB16_LDL1_LRVW8_LDW0_MAC_NLCA1_PGR1_PLR2_SIA3_SU0_SUM0_SUS0_SRVW4_TT2_16_TLDS1_VAW2_VW2_WSGRA1_WSGRB1_WG32_8_1_WGM1
    SolutionIndex: 282
    SolutionNameMin: Cijk_Ailk_Bljk_BBS_BH_MT64x80x64_MI16x16x16x1_SN_1LDSB0_AF0EM4_AF1EM4_AMAS3_EPS0_GRVW2_GSU1_GSUAMB_ISA90a_IU1_KLA_LBSPP128_LPB4_LDL1_LRVW4_LDW1_FMA_NLCA1_PGR2_PLR5_SIA3_SU0_SUM0_SUS0_SRVW0_TT1_80_TLDS1_VAW1_VW2_WSGRA0_WSGRB0_WG64_4_1_WGM8
    SolutionIndex: 283
    SolutionNameMin: Cijk_Ailk_Bljk_BBS_BH_MT64x64x32_MI32x32x8x1_SE_1LDSB0_AF0EM8_AF1EM1_AMAS3_EPS0_GRVW8_GSU1_GSUAMB_ISA90a_IU1_KLA_LBSPP128_LPB8_LDL1_LRVW8_LDW0_MAC_NLCA1_PGR2_PLR5_SIA3_SU0_SUM0_SUS0_SRVW4_TT1_32_TLDS1_VAW2_VW2_WSGRA1_WSGRB1_WG64_4_1_WGM1
    SolutionIndex: 284
    SolutionNameMin: Cijk_Ailk_Bljk_BBS_BH_MT16x64x32_MI16x16x16x1_SE_1LDSB0_AF0EM8_AF1EM1_AMAS3_EPS0_GRVW8_GSU1_GSUAMB_ISA90a_IU1_KLA_LBSPP128_LPB16_LDL1_LRVW8_LDW0_MAC_NLCA1_PGR2_PLR2_SIA3_SU0_SUM0_SUS0_SRVW0_TT1_16_TLDS1_VAW2_VW2_WSGRA1_WSGRB1_WG16_16_1_WGM1
    SolutionIndex: 285
    SolutionNameMin: Cijk_Ailk_Bljk_BBS_BH_MT64x4x32_MI4x4x4x16_SE_1LDSB0_AF0EM8_AF1EM1_AMAS3_EPS0_GRVW8_GSU1_GSUAMB_ISA90a_IU1_KLA_LBSPP128_LPB8_LDL1_LRVW8_LDW0_MAC_NLCA1_PGR2_PLR9_SIA3_SU0_SUM0_SUS0_SRVW0_TT1_4_TLDS1_VAW2_VW2_WSGRA1_WSGRB1_WG64_1_1_WGM1
    SolutionIndex: 286
    SolutionNameMin: Cijk_Ailk_Bljk_BBS_BH_MT16x16x64_MI16x16x16x1_SE_1LDSB0_AF0EM8_AF1EM1_AMAS3_EPS0_GRVW4_GSU1_GSUAMB_ISA90a_IU1_KLA_LBSPP128_LPB16_LDL1_LRVW8_LDW0_MAC_NLCA1_PGR2_PLR5_SIA3_SU0_SUM0_SUS0_SRVW0_TT1_16_TLDS1_VAW2_VW2_WSGRA1_WSGRB1_WG16_4_1_WGM1
    SolutionIndex: 287
    SolutionNameMin: Cijk_Ailk_Bljk_BBS_BH_MT128x64x64_MI32x32x8x1_SE_1LDSB0_AF0EM8_AF1EM1_AMAS3_EPS1_GRVW8_GSU15_GSUAMB_ISA90a_IU1_KLA_LBSPP128_LPB8_LDL1_LRVW8_LDW0_MAC_NLCA1_PGR1_PLR9_SIA3_SU0_SUM0_SUS0_SRVW0_TT2_32_TLDS1_VAW1_VW2_WSGRA1_WSGRB1_WG64_4_1_WGM1
    SolutionIndex: 288
    SolutionNameMin: Cijk_Ailk_Bljk_BBS_BH_MT32x64x64_MI16x16x16x1_SE_1LDSB0_AF0EM8_AF1EM1_AMAS3_EPS0_GRVW8_GSU1_GSUAMB_ISA90a_IU1_KLA_LBSPP128_LPB16_LDL1_LRVW8_LDW0_MAC_NLCA1_PGR2_PLR5_SIA3_SU32_SUM0_SUS256_SRVW4_TT1_32_TLDS1_VAW2_VW2_WSGRA1_WSGRB1_WG32_8_1_WGM15
    SolutionIndex: 289
    SolutionNameMin: Cijk_Ailk_Bljk_BBS_BH_MT32x32x32_MI16x16x16x1_SE_1LDSB0_AF0EM8_AF1EM1_AMAS3_EPS0_GRVW8_GSU1_GSUAMB_ISA90a_IU1_KLA_LBSPP128_LPB16_LDL1_LRVW8_LDW0_MAC_NLCA1_PGR2_PLR2_SIA3_SU0_SUM0_SUS0_SRVW4_TT1_16_TLDS1_VAW2_VW2_WSGRA1_WSGRB1_WG32_8_1_WGM1
    SolutionIndex: 290
    SolutionNameMin: Cijk_Ailk_Bljk_BBS_BH_MT128x96x64_MI32x32x8x1_SE_1LDSB0_AF0EM8_AF1EM1_AMAS3_EPS1_GRVW8_GSU5_GSUAMB_ISA90a_IU1_KLA_LBSPP128_LPB8_LDL1_LRVW8_LDW0_MAC_NLCA1_PGR1_PLR9_SIA3_SU0_SUM0_SUS0_SRVW0_TT1_96_TLDS1_VAW1_VW2_WSGRA1_WSGRB1_WG128_2_1_WGM2
    SolutionIndex: 291
    SolutionNameMin: Cijk_Ailk_Bljk_BBS_BH_MT64x32x32_MI16x16x16x1_SE_1LDSB0_AF0EM1_AF1EM1_AMAS3_EPS0_GRVW2_GSU1_GSUAMB_ISA90a_IU1_KLA_LBSPP128_LPB16_LDL1_LRVW8_LDW0_MAC_NLCA1_PGR2_PLR2_SIA3_SU0_SUM0_SUS0_SRVW4_TT2_16_TLDS1_VAW2_VW2_WSGRA1_WSGRB1_WG32_8_1_WGM1
    SolutionIndex: 292
    SolutionNameMin: Cijk_Ailk_Bljk_BBS_BH_MT64x32x32_MI16x16x16x1_SE_1LDSB1_AF0EM8_AF1EM1_AMAS3_EPS1_GRVW2_GSU1_GSUAMB_ISA90a_IU1_KLA_LBSPP128_LPB16_LDL1_LRVW8_LDW0_MAC_NLCA1_PGR1_PLR2_SIA3_SU0_SUM0_SUS0_SRVW4_TT2_16_TLDS1_VAW2_VW2_WSGRA1_WSGRB1_WG32_8_1_WGM15
    SolutionIndex: 293
    SolutionNameMin: Cijk_Ailk_Bljk_BBS_BH_MT128x64x32_MI32x32x8x1_SE_1LDSB0_AF0EM8_AF1EM1_AMAS3_EPS0_GRVW8_GSU1_GSUAMB_ISA90a_IU1_KLA_LBSPP128_LPB8_LDL1_LRVW8_LDW0_MAC_NLCA1_PGR2_PLR5_SIA3_SU0_SUM0_SUS0_SRVW4_TT2_32_TLDS1_VAW2_VW2_WSGRA1_WSGRB1_WG64_4_1_WGM1
    SolutionIndex: 294
    SolutionNameMin: Cijk_Ailk_Bljk_BBS_BH_MT128x96x32_MI32x32x8x1_SE_1LDSB0_AF0EM8_AF1EM1_AMAS3_EPS0_GRVW4_GSU1_GSUAMB_ISA90a_IU1_KLA_LBSPP128_LPB8_LDL1_LRVW8_LDW0_MAC_NLCA1_PGR2_PLR5_SIA3_SU32_SUM0_SUS128_SRVW4_TT1_96_TLDS1_VAW2_VW2_WSGRA1_WSGRB1_WG128_2_1_WGM1
    SolutionIndex: 295
    SolutionNameMin: Cijk_Ailk_Bljk_BBS_BH_MT128x96x64_MI32x32x8x1_SE_1LDSB0_AF0EM8_AF1EM1_AMAS3_EPS0_GRVW8_GSU1_GSUAMB_ISA90a_IU1_KLA_LBSPP128_LPB8_LDL1_LRVW8_LDW0_MAC_NLCA1_PGR2_PLR9_SIA3_SU0_SUM0_SUS0_SRVW4_TT1_96_TLDS1_VAW2_VW2_WSGRA1_WSGRB1_WG128_2_1_WGM1
    SolutionIndex: 296
    SolutionNameMin: Cijk_Ailk_Bljk_BBS_BH_MT128x96x64_MI32x32x8x1_SE_1LDSB0_AF0EM8_AF1EM1_AMAS3_EPS0_GRVW8_GSU1_GSUAMB_ISA90a_IU1_KLA_LBSPP128_LPB8_LDL1_LRVW8_LDW0_MAC_NLCA1_PGR2_PLR9_SIA3_SU0_SUM0_SUS0_SRVW4_TT1_96_TLDS1_VAW2_VW2_WSGRA1_WSGRB1_WG128_2_1_WGM15
    SolutionIndex: 297
    SolutionNameMin: Cijk_Ailk_Bljk_BBS_BH_MT128x160x32_MI32x32x8x1_SE_1LDSB0_AF0EM8_AF1EM1_AMAS3_EPS0_GRVW4_GSU1_GSUAMB_ISA90a_IU1_KLA_LBSPP128_LPB8_LDL1_LRVW8_LDW0_MAC_NLCA1_PGR2_PLR5_SIA3_SU0_SUM0_SUS0_SRVW4_TT1_160_TLDS1_VAW2_VW2_WSGRA1_WSGRB1_WG128_2_1_WGM2
    SolutionIndex: 298
    SolutionNameMin: Cijk_Ailk_Bljk_BBS_BH_MT128x160x32_MI32x32x8x1_SE_1LDSB0_AF0EM8_AF1EM1_AMAS3_EPS0_GRVW4_GSU1_GSUAMB_ISA90a_IU1_KLA_LBSPP128_LPB8_LDL1_LRVW8_LDW0_MAC_NLCA1_PGR2_PLR5_SIA3_SU32_SUM0_SUS128_SRVW4_TT1_160_TLDS1_VAW2_VW2_WSGRA1_WSGRB1_WG128_2_1_WGM2
    SolutionIndex: 299
    SolutionNameMin: Cijk_Ailk_Bljk_BBS_BH_MT128x160x32_MI32x32x8x1_SE_1LDSB0_AF0EM8_AF1EM1_AMAS3_EPS0_GRVW4_GSU1_GSUAMB_ISA90a_IU1_KLA_LBSPP128_LPB8_LDL1_LRVW8_LDW0_MAC_NLCA1_PGR2_PLR5_SIA3_SU0_SUM0_SUS0_SRVW4_TT1_160_TLDS1_VAW2_VW2_WSGRA1_WSGRB1_WG128_2_1_WGM15
- - - [64, 35, 1, 35]
    - [2, 0.005]
  - - [64, 35, 1, 32]
    - [9, 0.009]
  - - [64, 15, 1, 15]
    - [0, 0.001]
  - - [64, 15, 1, 17]
    - [10, 0.002]
  - - [64, 17, 1, 17]
    - [1, 0.001]
  - - [64, 30, 1, 30]
    - [98, 0.007]
  - - [64, 32, 1, 32]
    - [29, 0.009]
  - - [64, 31, 1, 31]
    - [4, 0.004]
  - - [64, 24, 1, 24]
    - [98, 0.004]
  - - [64, 15, 1, 15]
    - [3, 0.001]
  - - [64, 17, 1, 17]
    - [1, 0.001]
  - - [64, 34, 1, 34]
    - [173, 0.008]
  - - [64, 14, 1, 15]
    - [11, 0.001]
  - - [64, 17, 1, 21]
    - [12, 0.002]
  - - [64, 14, 1, 14]
    - [0, 0.001]
  - - [64, 24, 1, 34]
    - [179, 0.005]
  - - [64, 21, 1, 21]
    - [178, 0.003]
  - - [64, 31, 1, 30]
    - [13, 0.006]
  - - [64, 128, 512, 128]
    - [14, 14.333]
  - - [64, 512, 1, 512]
    - [15, 1.4]
  - - [64, 512, 64, 512]
    - [79, 25.046]
  - - [128, 128, 512, 64]
    - [17, 11.837]
  - - [512, 512, 1, 64]
    - [18, 1.644]
  - - [512, 512, 64, 64]
    - [19, 15.489]
  - - [1024, 4, 1, 2]
    - [12, 0.001]
  - - [1024, 4, 1, 1024]
    - [10, 0.295]
  - - [1024, 32, 1, 2]
    - [12, 0.007]
  - - [1024, 32, 1, 1024]
    - [20, 2.319]
  - - [1024, 2048, 1, 2]
    - [14, 0.214]
  - - [1024, 2048, 1, 1024]
    - [21, 40.595]
  - - [1024, 2048, 1, 4096]
    - [22, 63.295]
  - - [1024, 2048, 1, 30528]
    - [22, 75.999]
  - - [1024, 4096, 1, 1024]
    - [23, 49.681]
  - - [1024, 4096, 1, 4096]
    - [24, 66.151]
  - - [1024, 4096, 1, 30528]
    - [25, 77.924]
  - - [4096, 2048, 1, 1024]
    - [26, 56.862]
  - - [4096, 4096, 1, 1024]
    - [27, 64.8]
  - - [32, 33, 1600, 33]
    - [28, 2.115]
  - - [32, 200, 1, 1]
    - [29, 0.001]
  - - [64, 3, 512, 3]
    - [180, 0.027]
  - - [64, 5, 512, 5]
    - [17, 0.06]
  - - [64, 5, 960, 5]
    - [9, 0.085]
  - - [64, 9, 512, 9]
    - [17, 0.192]
  - - [64, 512, 1, 1]
    - [18, 0.003]
  - - [67, 512, 1, 2048]
    - [30, 3.368]
  - - [74, 512, 1, 2048]
    - [31, 3.658]
  - - [74, 960, 1, 2048]
    - [32, 6.61]
  - - [100, 512, 1, 2048]
    - [31, 4.802]
  - - [128, 27, 32768, 27]
    - [33, 4.241]
  - - [256, 1024, 1, 1]
    - [18, 0.024]
  - - [256, 8976, 1, 1536]
    - [21, 49.769]
  - - [256, 8976, 1, 2048]
    - [21, 52.392]
  - - [256, 8976, 1, 2304]
    - [21, 54.176]
  - - [256, 8976, 1, 2560]
    - [21, 55.461]
  - - [256, 8976, 1, 2816]
    - [21, 56.209]
  - - [256, 8976, 1, 3072]
    - [21, 56.485]
  - - [256, 8976, 1, 4352]
    - [34, 59.962]
  - - [256, 8976, 1, 4864]
    - [35, 61.486]
  - - [256, 8976, 1, 5376]
    - [34, 62.356]
  - - [256, 8976, 1, 5632]
    - [35, 62.578]
  - - [256, 8976, 1, 5888]
    - [34, 63.12]
  - - [256, 8976, 1, 6144]
    - [36, 63.447]
  - - [256, 8976, 1, 6656]
    - [34, 64.417]
  - - [256, 8976, 1, 7168]
    - [34, 64.592]
  - - [256, 8976, 1, 7424]
    - [35, 64.888]
  - - [256, 8976, 1, 8192]
    - [35, 65.782]
  - - [256, 8976, 1, 8448]
    - [35, 65.916]
  - - [256, 8976, 1, 8960]
    - [34, 66.219]
  - - [256, 8976, 1, 9472]
    - [35, 66.763]
  - - [256, 8976, 1, 9728]
    - [35, 66.892]
  - - [256, 8976, 1, 9984]
    - [35, 67.206]
  - - [256, 8976, 1, 10240]
    - [35, 67.165]
  - - [256, 8976, 1, 10496]
    - [36, 67.11]
  - - [256, 8976, 1, 11008]
    - [36, 67.5]
  - - [256, 8976, 1, 11520]
    - [34, 67.813]
  - - [256, 8976, 1, 12288]
    - [34, 68.267]
  - - [256, 8976, 1, 14336]
    - [35, 68.845]
  - - [256, 8976, 1, 14848]
    - [34, 68.963]
  - - [256, 8976, 1, 15104]
    - [35, 69.013]
  - - [256, 8976, 1, 15872]
    - [35, 69.13]
  - - [256, 8976, 1, 17152]
    - [35, 69.643]
  - - [256, 8976, 1, 19712]
    - [35, 70.051]
  - - [256, 8976, 1, 19968]
    - [35, 70.199]
  - - [256, 8976, 1, 20480]
    - [34, 70.3]
  - - [256, 8976, 1, 20992]
    - [35, 70.26]
  - - [256, 8976, 1, 22016]
    - [34, 70.428]
  - - [256, 8976, 1, 26112]
    - [34, 70.853]
  - - [256, 8976, 1, 33536]
    - [35, 71.552]
  - - [256, 8976, 1, 44505]
    - [37, 71.716]
  - - [256, 32768, 1, 128]
    - [38, 21.112]
  - - [257, 1024, 1, 4096]
    - [39, 21.084]
  - - [480, 32768, 1, 1024]
    - [27, 61.533]
  - - [512, 200, 1, 1]
    - [18, 0.01]
  - - [512, 200, 1, 32]
    - [18, 0.345]
  - - [512, 215, 1, 2048]
    - [40, 9.338]
  - - [512, 256, 1, 2048]
    - [41, 11.327]
  - - [512, 1600, 1, 32]
    - [14, 2.255]
  - - [512, 1600, 1, 512]
    - [42, 21.878]
  - - [512, 32768, 1, 256]
    - [43, 40.024]
  - - [560, 200, 1, 1024]
    - [44, 6.493]
  - - [560, 1600, 1, 1024]
    - [45, 28.321]
  - - [768, 215, 1, 2048]
    - [41, 13.905]
  - - [768, 256, 1, 2048]
    - [40, 16.318]
  - - [1024, 200, 1, 1]
    - [18, 0.02]
  - - [1024, 512, 1, 1]
    - [110, 0.033]
  - - [1024, 512, 1, 64]
    - [28, 2.908]
  - - [1024, 512, 1, 1024]
    - [42, 19.702]
  - - [1024, 960, 1, 64]
    - [48, 4.663]
  - - [1024, 960, 1, 1024]
    - [45, 31.947]
  - - [1024, 1600, 1, 1]
    - [49, 0.097]
  - - [1024, 1600, 1, 1024]
    - [49, 42.765]
  - - [1024, 1792, 1, 256]
    - [23, 18.313]
  - - [1024, 2048, 1, 256]
    - [23, 20.162]
  - - [1024, 2560, 1, 256]
    - [21, 24.233]
  - - [1024, 3072, 1, 256]
    - [50, 25.343]
  - - [1024, 3328, 1, 256]
    - [38, 27.153]
  - - [1024, 3840, 1, 256]
    - [51, 29.924]
  - - [1024, 4096, 1, 256]
    - [43, 27.124]
  - - [1024, 4608, 1, 256]
    - [52, 30.721]
  - - [1024, 4864, 1, 256]
    - [53, 30.371]
  - - [1024, 5120, 1, 256]
    - [19, 31.635]
  - - [1024, 5632, 1, 256]
    - [43, 31.267]
  - - [1024, 6144, 1, 256]
    - [52, 33.604]
  - - [1024, 6400, 1, 256]
    - [54, 34.243]
  - - [1024, 7168, 1, 256]
    - [53, 33.764]
  - - [1024, 7424, 1, 256]
    - [55, 33.837]
  - - [1024, 7680, 1, 256]
    - [55, 36.526]
  - - [1024, 7936, 1, 256]
    - [43, 34.317]
  - - [1024, 8192, 1, 256]
    - [56, 34.863]
  - - [1024, 8448, 1, 256]
    - [51, 35.952]
  - - [1024, 8704, 1, 256]
    - [57, 35.754]
  - - [1024, 8960, 1, 256]
    - [58, 35.955]
  - - [1024, 9728, 1, 256]
    - [53, 37.025]
  - - [1024, 9984, 1, 256]
    - [59, 37.804]
  - - [1024, 10240, 1, 256]
    - [54, 37.292]
  - - [1024, 10496, 1, 256]
    - [19, 37.804]
  - - [1024, 11008, 1, 256]
    - [53, 37.804]
  - - [1024, 11264, 1, 256]
    - [43, 38.327]
  - - [1024, 11520, 1, 256]
    - [19, 39.288]
  - - [1024, 12288, 1, 256]
    - [58, 39.108]
  - - [1024, 13312, 1, 256]
    - [53, 38.85]
  - - [1024, 13568, 1, 256]
    - [53, 39.48]
  - - [1024, 14336, 1, 256]
    - [43, 40.634]
  - - [1024, 14592, 1, 256]
    - [43, 40.696]
  - - [1024, 14848, 1, 256]
    - [56, 40.085]
  - - [1024, 15104, 1, 256]
    - [43, 40.517]
  - - [1024, 16128, 1, 256]
    - [58, 41.17]
  - - [1024, 17152, 1, 256]
    - [58, 41.252]
  - - [1024, 18944, 1, 256]
    - [59, 41.322]
  - - [1024, 19712, 1, 256]
    - [56, 42.065]
  - - [1024, 19968, 1, 256]
    - [58, 42.276]
  - - [1024, 20480, 1, 256]
    - [54, 42.239]
  - - [1024, 20992, 1, 256]
    - [43, 42.32]
  - - [1024, 21504, 1, 256]
    - [58, 42.653]
  - - [1024, 22016, 1, 256]
    - [51, 42.141]
  - - [1024, 23552, 1, 256]
    - [60, 42.859]
  - - [1024, 28672, 1, 256]
    - [53, 43.786]
  - - [1024, 32768, 1, 512]
    - [43, 57.029]
  - - [1024, 32768, 1, 1024]
    - [61, 67.01]
  - - [1024, 33536, 1, 256]
    - [60, 44.416]
  - - [1024, 40448, 1, 256]
    - [54, 45.114]
  - - [1600, 512, 1, 1024]
    - [62, 31.192]
  - - [2048, 512, 1, 1]
    - [14, 0.071]
  - - [2048, 512, 1, 2048]
    - [63, 40.732]
  - - [2048, 960, 1, 2048]
    - [64, 50.915]
  - - [2048, 1024, 1, 1]
    - [17, 0.104]
  - - [2048, 1024, 1, 256]
    - [16, 20.504]
  - - [3200, 1024, 1, 2048]
    - [65, 57.982]
  - - [4096, 1024, 1, 1]
    - [38, 0.15]
  - - [64, 14, 10880, 14]
    - [8, 2.825]
  - - [64, 14, 10880, 15]
    - [17, 1.436]
  - - [64, 15, 7680, 15]
    - [8, 3.113]
  - - [64, 15, 10880, 15]
    - [17, 1.535]
  - - [64, 15, 7680, 17]
    - [17, 1.542]
  - - [64, 17, 6144, 17]
    - [6, 3.203]
  - - [64, 17, 7680, 17]
    - [17, 1.747]
  - - [64, 17, 6144, 21]
    - [33, 2.051]
  - - [64, 21, 6144, 21]
    - [17, 2.495]
  - - [64, 24, 4736, 24]
    - [17, 3.152]
  - - [64, 24, 4736, 34]
    - [48, 4.098]
  - - [64, 30, 2048, 30]
    - [33, 3.765]
  - - [64, 31, 2048, 30]
    - [17, 3.825]
  - - [64, 31, 2048, 31]
    - [6, 7.344]
  - - [64, 32, 4608, 32]
    - [17, 7.733]
  - - [64, 34, 4736, 34]
    - [46, 3.528]
  - - [64, 35, 4608, 32]
    - [14, 5.271]
  - - [64, 35, 4608, 35]
    - [7, 6.714]
  - - [1024, 3840, 1, 1024]
    - [66, 54.265]
  - - [1024, 3840, 1, 4096]
    - [63, 69.392]
  - - [1024, 3968, 1, 1024]
    - [23, 48.427]
  - - [1024, 3968, 1, 4096]
    - [24, 64.703]
  - - [1024, 3968, 1, 42720]
    - [25, 76.369]
  - - [1024, 6528, 1, 1024]
    - [66, 59.83]
  - - [1024, 6528, 1, 4096]
    - [66, 72.193]
  - - [1024, 6528, 1, 42720]
    - [67, 81.461]
  - - [1024, 7104, 1, 1024]
    - [66, 56.439]
  - - [1024, 7104, 1, 4096]
    - [68, 68.749]
  - - [1024, 7104, 1, 42720]
    - [69, 78.057]
  - - [1024, 7200, 1, 1024]
    - [66, 56.896]
  - - [1024, 7200, 1, 4096]
    - [66, 68.804]
  - - [1024, 7200, 1, 42720]
    - [69, 78.863]
  - - [1024, 8064, 1, 1024]
    - [70, 55.227]
  - - [1024, 8064, 1, 4096]
    - [71, 68.414]
  - - [1024, 8160, 1, 1024]
    - [61, 57.245]
  - - [1024, 8160, 1, 4096]
    - [72, 69.894]
  - - [1024, 9216, 1, 1024]
    - [66, 61.721]
  - - [1024, 9216, 1, 4096]
    - [63, 73.133]
  - - [1024, 9520, 1, 1024]
    - [73, 57.061]
  - - [1024, 9520, 1, 4096]
    - [27, 71.442]
  - - [1024, 9520, 1, 42720]
    - [74, 78.776]
  - - [1024, 10064, 1, 1024]
    - [27, 59.358]
  - - [1024, 10064, 1, 4096]
    - [75, 75.012]
  - - [1024, 10080, 1, 1024]
    - [66, 60.326]
  - - [1024, 10080, 1, 4096]
    - [27, 75.013]
  - - [1024, 10080, 1, 42720]
    - [76, 80.753]
  - - [1024, 10200, 1, 1024]
    - [73, 59.185]
  - - [1024, 10200, 1, 4096]
    - [27, 75.514]
  - - [4096, 3840, 1, 1024]
    - [26, 64.508]
  - - [4096, 3968, 1, 1024]
    - [53, 60.663]
  - - [4096, 6528, 1, 1024]
    - [54, 66.141]
  - - [4096, 7104, 1, 1024]
    - [53, 64.87]
  - - [4096, 7200, 1, 1024]
    - [53, 65.068]
  - - [4096, 8064, 1, 1024]
    - [26, 66.088]
  - - [4096, 8160, 1, 1024]
    - [26, 67.19]
  - - [4096, 9216, 1, 1024]
    - [27, 67.857]
  - - [4096, 9520, 1, 1024]
    - [26, 65.809]
  - - [4096, 10064, 1, 1024]
    - [27, 66.983]
  - - [4096, 10080, 1, 1024]
    - [75, 66.901]
  - - [4096, 10200, 1, 1024]
    - [27, 67.64]
  - - [64, 27, 1920, 27]
    - [14, 2.96]
  - - [64, 33, 1920, 27]
    - [17, 2.377]
  - - [64, 33, 1920, 33]
    - [5, 2.734]
  - - [1024, 3240, 1, 1024]
    - [23, 47.081]
  - - [1024, 3240, 1, 4096]
    - [75, 65.319]
  - - [1024, 3960, 1, 1024]
    - [49, 47.543]
  - - [1024, 3960, 1, 4096]
    - [24, 64.306]
  - - [1024, 3960, 1, 42720]
    - [72, 76.299]
  - - [4096, 3240, 1, 1024]
    - [53, 61.243]
  - - [4096, 3960, 1, 1024]
    - [53, 60.482]
  - - [64, 192, 64, 1280]
    - [42, 25.893]
  - - [64, 320, 64, 1280]
    - [77, 29.035]
  - - [64, 384, 64, 1280]
    - [78, 31.635]
  - - [64, 448, 64, 1280]
    - [42, 28.152]
  - - [64, 192, 64, 2048]
    - [79, 27.043]
  - - [64, 320, 64, 2048]
    - [80, 31.902]
  - - [64, 384, 64, 2048]
    - [80, 33.357]
  - - [64, 448, 64, 2048]
    - [45, 30.659]
  - - [1225, 32, 64, 192]
    - [81, 12.168]
  - - [1225, 48, 64, 192]
    - [81, 11.613]
  - - [1225, 64, 64, 192]
    - [82, 16.495]
  - - [1225, 48, 64, 256]
    - [82, 13.077]
  - - [1225, 64, 64, 256]
    - [82, 19.092]
  - - [1225, 48, 64, 288]
    - [82, 14.315]
  - - [1225, 64, 64, 288]
    - [82, 21.451]
  - - [5329, 80, 64, 64]
    - [81, 8.509]
  - - [289, 128, 64, 768]
    - [83, 26.813]
  - - [289, 160, 64, 768]
    - [84, 24.504]
  - - [289, 192, 64, 768]
    - [84, 31.164]
  - - [64, 192, 32, 1280]
    - [85, 21.561]
  - - [64, 320, 32, 1280]
    - [47, 26.399]
  - - [64, 384, 32, 1280]
    - [47, 28.212]
  - - [64, 448, 32, 1280]
    - [85, 22.657]
  - - [64, 192, 32, 2048]
    - [85, 25.273]
  - - [64, 320, 32, 2048]
    - [80, 29.305]
  - - [64, 384, 32, 2048]
    - [47, 32.174]
  - - [64, 448, 32, 2048]
    - [86, 26.529]
  - - [1225, 32, 32, 192]
    - [87, 10.558]
  - - [1225, 48, 32, 192]
    - [87, 10.025]
  - - [1225, 64, 32, 192]
    - [81, 13.774]
  - - [1225, 48, 32, 256]
    - [81, 11.236]
  - - [1225, 64, 32, 256]
    - [87, 15.629]
  - - [1225, 48, 32, 288]
    - [87, 12.138]
  - - [1225, 64, 32, 288]
    - [82, 17.283]
  - - [5329, 80, 32, 64]
    - [87, 9.219]
  - - [289, 128, 32, 768]
    - [82, 23.655]
  - - [289, 160, 32, 768]
    - [66, 21.664]
  - - [289, 192, 32, 768]
    - [66, 26.627]
  - - [3136, 256, 64, 64]
    - [38, 18.386]
  - - [3136, 64, 64, 64]
    - [17, 13.783]
  - - [3136, 64, 64, 256]
    - [88, 27.042]
  - - [784, 512, 64, 128]
    - [19, 27.71]
  - - [784, 128, 64, 512]
    - [50, 36.358]
  - - [196, 1024, 64, 256]
    - [84, 23.933]
  - - [196, 256, 64, 1024]
    - [82, 31.828]
  - - [49, 2048, 64, 512]
    - [83, 19.55]
  - - [49, 512, 64, 2048]
    - [89, 22.771]
  - - [3136, 256, 32, 64]
    - [57, 16.718]
  - - [3136, 64, 32, 64]
    - [33, 12.219]
  - - [3136, 64, 32, 256]
    - [49, 24.932]
  - - [784, 512, 32, 128]
    - [55, 24.31]
  - - [784, 128, 32, 512]
    - [90, 31.238]
  - - [196, 1024, 32, 256]
    - [91, 21.074]
  - - [196, 256, 32, 1024]
    - [66, 27.898]
  - - [49, 2048, 32, 512]
    - [92, 18.617]
  - - [49, 512, 32, 2048]
    - [93, 18.921]
  - - [3136, 128, 64, 64]
    - [14, 15.942]
  - - [3136, 256, 64, 128]
    - [38, 29.299]
  - - [784, 512, 64, 256]
    - [38, 39.35]
  - - [3136, 128, 64, 256]
    - [50, 35.743]
  - - [3136, 256, 64, 256]
    - [94, 42.942]
  - - [196, 1024, 64, 512]
    - [84, 33.757]
  - - [784, 256, 64, 512]
    - [38, 44.105]
  - - [784, 512, 64, 512]
    - [75, 50.133]
  - - [196, 512, 64, 1024]
    - [70, 37.979]
  - - [196, 1024, 64, 1024]
    - [70, 42.584]
  - - [49, 2048, 64, 1024]
    - [91, 23.941]
  - - [49, 1024, 64, 2048]
    - [95, 26.827]
  - - [3136, 128, 32, 64]
    - [17, 14.337]
  - - [3136, 256, 32, 128]
    - [38, 27.342]
  - - [784, 512, 32, 256]
    - [50, 35.05]
  - - [3136, 128, 32, 256]
    - [96, 32.613]
  - - [3136, 256, 32, 256]
    - [50, 40.379]
  - - [196, 1024, 32, 512]
    - [84, 31.828]
  - - [784, 256, 32, 512]
    - [97, 38.037]
  - - [784, 512, 32, 512]
    - [38, 45.016]
  - - [196, 512, 32, 1024]
    - [70, 32.3]
  - - [196, 1024, 32, 1024]
    - [84, 39.163]
  - - [49, 2048, 32, 1024]
    - [92, 23.069]
  - - [49, 1024, 32, 2048]
    - [89, 23.213]
  - - [64, 128, 624, 128]
    - [14, 14.983]
  - - [1024, 10, 1, 1024]
    - [20, 0.725]
  - - [2048, 2048, 1, 2048]
    - [64, 56.828]
  - - [1024, 10, 1, 2]
    - [98, 0.002]
  - - [1024, 5, 1, 2]
    - [18, 0.001]
  - - [1024, 5, 1, 1024]
    - [99, 0.367]
  - - [64, 512, 16, 512]
    - [107, 12.549]
  - - [1024, 1024, 1, 1024]
    - [82, 27.873]
  - - [1024, 9600, 1, 4096]
    - [75, 71.735]
  - - [1024, 8192, 1, 1024]
    - [100, 55.78]
  - - [1024, 1280, 1, 4096]
    - [101, 51.478]
  - - [512, 512, 1, 512]
    - [44, 8.843]
  - - [1024, 1152, 1, 1024]
    - [63, 34.281]
  - - [1024, 5248, 1, 2]
    - [102, 0.37]
  - - [1024, 820, 1, 1024]
    - [42, 29.899]
  - - [4096, 1152, 1, 1024]
    - [21, 51.846]
  - - [1024, 308, 1, 30522]
    - [103, 37.245]
  - - [1024, 39, 1, 1024]
    - [15, 2.809]
  - - [1024, 616, 1, 1024]
    - [42, 24.837]
  - - [64, 512, 96, 512]
    - [104, 27.084]
  - - [1024, 39, 1, 2]
    - [18, 0.008]
  - - [128, 128, 1, 64]
    - [105, 0.118]
  - - [1024, 160, 1, 30522]
    - [106, 35.103]
  - - [1024, 2560, 1, 1024]
    - [21, 49.096]
  - - [4096, 9600, 1, 1024]
    - [26, 66.391]
  - - [1024, 8, 1, 2]
    - [18, 0.002]
  - - [1024, 800, 1, 1024]
    - [42, 29.814]
  - - [64, 128, 640, 128]
    - [48, 15.213]
  - - [4096, 1024, 1, 1024]
    - [49, 49.63]
  - - [1024, 8, 1, 1024]
    - [99, 0.591]
  - - [1024, 1024, 1, 2]
    - [87, 0.146]
  - - [4096, 5248, 1, 1024]
    - [53, 63.785]
  - - [4096, 4096, 1, 4096]
    - [27, 75.69]
  - - [1024, 77, 1, 30522]
    - [106, 23.334]
  - - [1024, 9, 1, 2]
    - [12, 0.002]
  - - [1024, 1024, 1, 4096]
    - [63, 50.564]
  - - [1024, 9, 1, 1024]
    - [15, 0.66]
  - - [1024, 780, 1, 1024]
    - [107, 28.977]
  - - [64, 4, 38400, 4]
    - [142, 0.133]
  - - [1024, 4096, 1, 2]
    - [43, 0.303]
  - - [4096, 2560, 1, 1024]
    - [27, 64.382]
  - - [64, 128, 144, 128]
    - [90, 9.296]
  - - [1024, 780, 1, 30522]
    - [108, 58.688]
  - - [8192, 7680, 1, 8192]
    - [72, 81.301]
  - - [1024, 3072, 1, 2]
    - [43, 0.272]
  - - [8192, 8192, 1, 8192]
    - [109, 81.936]
  - - [1024, 180, 1, 1024]
    - [41, 10.74]
  - - [1024, 180, 1, 30522]
    - [106, 38.909]
  - - [1024, 512, 1, 2]
    - [110, 0.086]
  - - [1024, 8192, 1, 4096]
    - [65, 69.826]
  - - [1024, 385, 1, 30522]
    - [111, 37.275]
  - - [4096, 512, 1, 1024]
    - [21, 39.534]
  - - [1024, 160, 1, 1024]
    - [40, 9.358]
  - - [1024, 5120, 1, 4096]
    - [65, 70.313]
  - - [2048, 1920, 1, 2048]
    - [66, 62.832]
  - - [1024, 462, 1, 1024]
    - [42, 19.151]
  - - [1024, 462, 1, 30522]
    - [111, 44.088]
  - - [1024, 77, 1, 1024]
    - [20, 5.32]
  - - [960, 1024, 1, 1024]
    - [45, 31.768]
  - - [1024, 40, 1, 2]
    - [18, 0.009]
  - - [64, 5, 1, 5]
    - [98, 0.0]
  - - [1024, 40, 1, 1024]
    - [20, 2.847]
  - - [4096, 5120, 1, 1024]
    - [27, 67.508]
  - - [1024, 200, 1, 30522]
    - [112, 36.547]
  - - [1024, 41, 1, 2]
    - [113, 0.009]
  - - [1024, 200, 1, 1024]
    - [18, 10.838]
  - - [4096, 8192, 1, 1024]
    - [27, 66.606]
  - - [1024, 41, 1, 1024]
    - [20, 2.883]
  - - [1024, 4992, 1, 4096]
    - [35, 70.481]
  - - [4096, 1280, 1, 1024]
    - [57, 55.851]
  - - [1024, 2560, 1, 4096]
    - [21, 66.214]
  - - [1024, 4992, 1, 2]
    - [19, 0.36]
  - - [32, 33, 1, 33]
    - [9, 0.003]
  - - [7680, 8192, 1, 8192]
    - [109, 81.151]
  - - [4096, 3072, 1, 1024]
    - [114, 61.932]
  - - [1024, 9600, 1, 1024]
    - [66, 57.893]
  - - [1024, 385, 1, 1024]
    - [42, 16.661]
  - - [64, 4, 32768, 4]
    - [142, 0.133]
  - - [64, 128, 656, 128]
    - [78, 15.226]
  - - [64, 512, 128, 512]
    - [83, 27.81]
  - - [1024, 4992, 1, 1024]
    - [66, 56.815]
  - - [1024, 1152, 1, 2]
    - [17, 0.158]
  - - [1024, 5248, 1, 4096]
    - [65, 71.654]
  - - [1024, 9600, 1, 33712]
    - [74, 77.727]
  - - [1024, 3072, 1, 4096]
    - [27, 63.894]
  - - [4096, 3840, 1, 4096]
    - [115, 74.629]
  - - [1024, 6, 1, 1024]
    - [15, 0.44]
  - - [1024, 5120, 1, 1024]
    - [21, 55.543]
  - - [1024, 8192, 1, 33712]
    - [116, 78.291]
  - - [1024, 308, 1, 1024]
    - [85, 15.959]
  - - [3840, 4096, 1, 4096]
    - [34, 73.57]
  - - [1024, 2560, 1, 2]
    - [14, 0.244]
  - - [1024, 6, 1, 2]
    - [29, 0.001]
  - - [64, 128, 160, 128]
    - [104, 10.163]
  - - [1024, 512, 1, 4096]
    - [117, 36.274]
  - - [64, 128, 128, 128]
    - [33, 8.309]
  - - [1024, 5248, 1, 1024]
    - [21, 55.704]
  - - [1024, 820, 1, 30522]
    - [108, 61.777]
  - - [1024, 1280, 1, 2]
    - [14, 0.169]
  - - [1024, 1280, 1, 1024]
    - [23, 35.249]
  - - [1920, 2048, 1, 2048]
    - [21, 62.187]
  - - [1024, 3072, 1, 1024]
    - [23, 46.528]
  - - [1024, 800, 1, 30522]
    - [108, 59.963]
  - - [64, 128, 1, 128]
    - [20, 0.108]
  - - [64, 512, 80, 512]
    - [83, 27.149]
  - - [480, 512, 1, 512]
    - [18, 8.101]
  - - [512, 480, 1, 512]
    - [18, 8.242]
  - - [4096, 4992, 1, 1024]
    - [27, 63.86]
  - - [479, 32768, 1, 1024]
    - [109, 50.092]
  - - [1024, 1152, 1, 4096]
    - [118, 57.79]
  - - [1024, 5120, 1, 2]
    - [57, 0.367]
  - - [1024, 1024, 64, 64]
    - [19, 18.441]
  - - [64, 1024, 32, 1024]
    - [47, 29.327]
  - - [1024, 16384, 1, 3072]
    - [75, 74.16]
  - - [1024, 2048, 1, 30592]
    - [67, 75.301]
  - - [640, 2048, 1, 2560]
    - [63, 54.473]
  - - [1024, 1024, 64, 96]
    - [52, 25.951]
  - - [2048, 2, 1, 2048]
    - [20, 0.416]
  - - [2048, 2, 1, 2]
    - [18, 0.001]
  - - [1536, 4096, 1, 4608]
    - [27, 70.017]
  - - [512, 512, 256, 64]
    - [38, 18.647]
  - - [2048, 1024, 1, 8192]
    - [119, 66.151]
  - - [4096, 16384, 1, 1024]
    - [27, 70.487]
  - - [1024, 8192, 1, 50304]
    - [72, 78.943]
  - - [1536, 8192, 1, 50304]
    - [120, 80.69]
  - - [6144, 8192, 1, 1536]
    - [27, 75.282]
  - - [1024, 4096, 1, 30592]
    - [72, 77.898]
  - - [1536, 4096, 1, 6144]
    - [73, 72.139]
  - - [1024, 16384, 1, 4096]
    - [27, 75.638]
  - - [1024, 16384, 1, 50304]
    - [74, 79.805]
  - - [1024, 4096, 1, 3072]
    - [24, 62.735]
  - - [1536, 8192, 1, 1536]
    - [102, 65.234]
  - - [1024, 2048, 1, 3072]
    - [121, 59.301]
  - - [2560, 2048, 1, 7680]
    - [34, 75.307]
  - - [96, 1024, 64, 1024]
    - [122, 42.373]
  - - [2048, 1024, 1, 2048]
    - [119, 49.027]
  - - [2048, 1024, 1, 30592]
    - [119, 71.319]
  - - [64, 1024, 256, 1024]
    - [123, 38.473]
  - - [8192, 1024, 1, 2048]
    - [124, 63.796]
  - - [2560, 2048, 1, 2560]
    - [21, 66.294]
  - - [1536, 8192, 1, 4608]
    - [65, 75.027]
  - - [64, 512, 256, 512]
    - [78, 30.453]
  - - [1024, 2048, 1, 50304]
    - [64, 75.743]
  - - [1024, 1024, 32, 64]
    - [52, 17.596]
  - - [1536, 8192, 1, 6144]
    - [65, 77.142]
  - - [1024, 1024, 256, 64]
    - [125, 19.441]
  - - [512, 512, 40, 64]
    - [97, 14.347]
  - - [1536, 4096, 1, 50304]
    - [47, 76.517]
  - - [1024, 1024, 128, 96]
    - [51, 26.539]
  - - [1024, 8192, 1, 3072]
    - [65, 67.021]
  - - [64, 1024, 64, 1024]
    - [47, 35.014]
  - - [1024, 1024, 128, 64]
    - [125, 19.122]
  - - [64, 1024, 128, 1024]
    - [126, 36.506]
  - - [1024, 4096, 1, 50304]
    - [72, 78.718]
  - - [96, 1024, 128, 1024]
    - [122, 45.337]
  - - [6144, 4096, 1, 1536]
    - [109, 74.015]
  - - [1024, 16, 1, 2]
    - [18, 0.003]
  - - [1024, 16, 1, 1024]
    - [99, 1.146]
  - - [2560, 4, 1, 2]
    - [18, 0.002]
  - - [1024, 16384, 1, 1024]
    - [75, 64.584]
  - - [2560, 2048, 1, 1920]
    - [21, 63.572]
  - - [2048, 1024, 1, 6144]
    - [119, 63.614]
  - - [2560, 4, 1, 2560]
    - [127, 1.123]
  - - [512, 512, 128, 64]
    - [50, 17.444]
  - - [1024, 8192, 1, 30592]
    - [116, 78.218]
  - - [1536, 4096, 1, 1536]
    - [27, 61.686]
  - - [64, 512, 40, 512]
    - [128, 23.122]
  - - [1024, 1, 1, 2]
    - [18, 0.0]
  - - [1024, 1, 1, 1024]
    - [99, 0.061]
  - - [1024, 1, 1, 200]
    - [18, 0.017]
  - - [1024, 1, 1, 1600]
    - [99, 0.096]
  - - [2048, 1, 1, 512]
    - [20, 0.09]
  - - [128, 128, 1024, 64]
    - [38, 13.427]
  - - [64, 128, 1024, 128]
    - [33, 16.066]
  - - [1024, 64, 1, 2]
    - [113, 0.014]
  - - [1024, 8192, 1, 30528]
    - [72, 78.32]
  - - [1024, 64, 1, 1024]
    - [15, 4.5]
  - - [1024, 3456, 1, 1024]
    - [23, 51.357]
  - - [1024, 3456, 1, 512]
    - [49, 39.64]
  - - [1024, 4096, 1, 512]
    - [49, 39.405]
  - - [1024, 6912, 1, 1024]
    - [75, 62.524]
  - - [1024, 6912, 1, 512]
    - [129, 49.014]
  - - [1024, 864, 1, 1024]
    - [45, 28.915]
  - - [1024, 864, 1, 512]
    - [45, 19.781]
  - - [256, 3456, 1, 128]
    - [42, 8.679]
  - - [256, 4096, 1, 128]
    - [14, 8.543]
  - - [256, 55296, 1, 128]
    - [55, 25.079]
  - - [256, 6912, 1, 128]
    - [130, 13.222]
  - - [256, 864, 1, 128]
    - [113, 2.774]
  - - [480, 3456, 1, 1024]
    - [23, 41.97]
  - - [480, 4096, 1, 1024]
    - [131, 38.38]
  - - [480, 6912, 1, 1024]
    - [23, 47.372]
  - - [480, 864, 1, 1024]
    - [40, 19.69]
  - - [512, 3456, 1, 256]
    - [49, 23.304]
  - - [512, 4096, 1, 256]
    - [23, 19.897]
  - - [512, 55296, 1, 256]
    - [52, 43.136]
  - - [512, 6912, 1, 256]
    - [102, 27.587]
  - - [512, 864, 1, 256]
    - [132, 8.506]
  - - [1024, 640, 1, 30528]
    - [80, 57.051]
  - - [1024, 1280, 1, 30528]
    - [122, 70.983]
  - - [1024, 1600, 1, 30528]
    - [124, 74.333]
  - - [1024, 10240, 1, 1024]
    - [75, 64.485]
  - - [1024, 10240, 1, 4096]
    - [75, 77.386]
  - - [4096, 10240, 1, 1024]
    - [27, 69.128]
  - - [1024, 80, 1, 1024]
    - [20, 5.728]
  - - [1024, 80, 1, 2]
    - [18, 0.017]
  - - [128, 128, 1280, 64]
    - [97, 13.911]
  - - [64, 128, 1280, 128]
    - [48, 16.33]
  - - [1024, 1640, 1, 30528]
    - [65, 76.171]
  - - [1024, 10496, 1, 1024]
    - [75, 65.296]
  - - [1024, 10496, 1, 4096]
    - [27, 79.346]
  - - [4096, 10496, 1, 1024]
    - [75, 70.443]
  - - [1024, 82, 1, 1024]
    - [20, 6.017]
  - - [1024, 82, 1, 2]
    - [18, 0.017]
  - - [128, 128, 1312, 64]
    - [133, 13.989]
  - - [64, 128, 1312, 128]
    - [48, 16.315]
  - - [1024, 160, 1, 30528]
    - [134, 37.025]
  - - [1024, 240, 1, 30528]
    - [135, 46.241]
  - - [1024, 6144, 1, 4096]
    - [75, 69.876]
  - - [1024, 12, 1, 1024]
    - [99, 0.881]
  - - [4096, 6144, 1, 1024]
    - [27, 69.425]
  - - [1024, 6144, 1, 1024]
    - [66, 57.243]
  - - [1024, 12, 1, 2]
    - [12, 0.002]
  - - [512, 512, 192, 64]
    - [97, 18.164]
  - - [64, 512, 192, 512]
    - [83, 29.315]
  - - [256, 4096, 1, 1]
    - [87, 0.073]
  - - [256, 6912, 1, 1]
    - [90, 0.107]
  - - [1024, 10224, 1, 1024]
    - [75, 59.121]
  - - [1024, 10192, 1, 1024]
    - [52, 59.284]
  - - [1024, 10208, 1, 1024]
    - [27, 59.377]
  - - [1024, 10224, 1, 4096]
    - [27, 75.679]
  - - [1024, 10224, 1, 3072]
    - [75, 73.292]
  - - [4096, 10224, 1, 1024]
    - [27, 67.695]
  - - [1024, 10240, 1, 3072]
    - [75, 75.671]
  - - [1024, 10192, 1, 3072]
    - [75, 73.181]
  - - [4096, 10192, 1, 1024]
    - [27, 67.379]
  - - [1024, 10192, 1, 4096]
    - [75, 75.443]
  - - [1024, 10200, 1, 3072]
    - [27, 73.327]
  - - [1024, 10184, 1, 1024]
    - [27, 59.619]
  - - [4096, 10208, 1, 1024]
    - [75, 67.693]
  - - [1024, 10208, 1, 3072]
    - [27, 73.684]
  - - [1024, 10208, 1, 4096]
    - [75, 75.467]
  - - [1024, 10224, 1, 2048]
    - [75, 69.416]
  - - [1024, 10240, 1, 2048]
    - [75, 72.483]
  - - [1024, 10120, 1, 1024]
    - [27, 59.958]
  - - [1024, 10192, 1, 2048]
    - [27, 69.439]
  - - [64, 24, 6816, 24]
    - [17, 3.35]
  - - [1024, 10152, 1, 1024]
    - [27, 59.403]
  - - [1024, 10080, 1, 3072]
    - [27, 73.042]
  - - [64, 26, 6272, 26]
    - [33, 3.836]
  - - [100352, 512, 1, 256]
    - [136, 42.292]
  - - [12544, 2048, 1, 1024]
    - [54, 63.876]
  - - [12544, 64, 1, 147]
    - [79, 6.998]
  - - [200704, 512, 1, 256]
    - [137, 40.774]
  - - [25088, 1024, 1, 512]
    - [53, 54.065]
  - - [3136, 64, 1, 576]
    - [41, 8.14]
  - - [50176, 1024, 1, 512]
    - [137, 58.069]
  - - [6272, 2048, 1, 1024]
    - [27, 61.136]
  - - [784, 128, 1, 1152]
    - [15, 7.196]
  - - [3136, 128, 128, 256]
    - [50, 36.6]
  - - [3136, 128, 256, 256]
    - [38, 37.622]
  - - [3136, 256, 128, 64]
    - [38, 18.868]
  - - [3136, 256, 256, 64]
    - [133, 19.208]
  - - [3136, 64, 128, 256]
    - [23, 28.477]
  - - [3136, 64, 256, 256]
    - [49, 29.247]
  - - [3136, 64, 128, 64]
    - [14, 15.437]
  - - [3136, 64, 256, 64]
    - [14, 16.157]
  - - [784, 128, 128, 512]
    - [38, 40.892]
  - - [784, 128, 256, 512]
    - [50, 43.689]
  - - [784, 256, 128, 512]
    - [50, 48.271]
  - - [784, 256, 256, 512]
    - [138, 50.517]
  - - [784, 512, 128, 128]
    - [38, 30.231]
  - - [784, 512, 256, 128]
    - [38, 31.537]
  - - [128, 128, 2048, 64]
    - [38, 14.445]
  - - [64, 128, 2048, 128]
    - [48, 16.86]
  - - [1024, 2560, 1, 30528]
    - [63, 77.653]
  - - [1024, 128, 1, 1024]
    - [41, 7.755]
  - - [1024, 128, 1, 2]
    - [18, 0.026]
  - - [128, 128, 1536, 64]
    - [97, 14.199]
  - - [64, 128, 1536, 128]
    - [48, 16.452]
  - - [1024, 12288, 1, 4096]
    - [65, 73.746]
  - - [1024, 12288, 1, 1024]
    - [102, 61.382]
  - - [4096, 12288, 1, 1024]
    - [75, 70.909]
  - - [1024, 1920, 1, 30528]
    - [22, 72.347]
  - - [1024, 96, 1, 1024]
    - [20, 6.751]
  - - [1024, 96, 1, 2]
    - [18, 0.021]
  - - [128, 128, 192, 64]
    - [17, 9.373]
  - - [64, 128, 192, 128]
    - [90, 11.752]
  - - [768, 2048, 1, 2]
    - [139, 0.196]
  - - [3072, 2048, 1, 768]
    - [27, 52.044]
  - - [768, 2048, 1, 3072]
    - [124, 56.943]
  - - [768, 2048, 1, 768]
    - [49, 37.699]
  - - [384, 384, 144, 64]
    - [43, 16.271]
  - - [64, 384, 144, 384]
    - [128, 24.735]
  - - [768, 4608, 1, 2]
    - [55, 0.303]
  - - [3072, 4608, 1, 768]
    - [27, 61.924]
  - - [768, 4608, 1, 3072]
    - [140, 67.411]
  - - [768, 4608, 1, 768]
    - [49, 46.822]
  - - [512, 512, 48, 64]
    - [55, 14.705]
  - - [64, 512, 48, 512]
    - [128, 26.452]
  - - [128, 128, 256, 64]
    - [33, 10.115]
  - - [64, 128, 256, 128]
    - [48, 11.86]
  - - [384, 384, 192, 64]
    - [19, 16.57]
  - - [64, 384, 192, 384]
    - [128, 23.573]
  - - [1024, 4608, 1, 2]
    - [133, 0.344]
  - - [4096, 4608, 1, 1024]
    - [53, 63.689]
  - - [1024, 4608, 1, 4096]
    - [35, 66.126]
  - - [1024, 4608, 1, 1024]
    - [66, 52.648]
  - - [8192, 1024, 1, 1024]
    - [57, 57.063]
  - - [8192, 4096, 1, 1024]
    - [27, 66.537]
  - - [16384, 16384, 1, 16384]
    - [72, 82.827]
  - - [196, 256, 1, 2304]
    - [30, 4.806]
  - - [49, 512, 1, 4608]
    - [32, 3.392]
  - - [196, 1024, 128, 256]
    - [84, 26.247]
  - - [196, 1024, 256, 256]
    - [84, 27.146]
  - - [196, 256, 128, 1024]
    - [141, 36.681]
  - - [196, 256, 256, 1024]
    - [102, 38.988]
  - - [196, 512, 128, 1024]
    - [102, 40.556]
  - - [196, 512, 256, 1024]
    - [102, 43.433]
  - - [49, 2048, 128, 512]
    - [91, 20.469]
  - - [49, 2048, 256, 512]
    - [83, 21.032]
  - - [49, 512, 128, 2048]
    - [95, 26.341]
  - - [49, 512, 256, 2048]
    - [95, 27.013]
  - - [64, 9, 8192, 9]
    - [33, 0.553]
  - - [64, 14, 5440, 14]
    - [33, 1.226]
  - - [64, 24, 5440, 24]
    - [33, 3.232]
  - - [64, 30, 5248, 30]
    - [14, 4.79]
  - - [64, 5, 8192, 5]
    - [14, 0.172]
  - - [64, 15, 8192, 15]
    - [14, 1.46]
  - - [64, 33, 8192, 33]
    - [14, 3.382]
  - - [64, 26, 5248, 26]
    - [17, 3.702]
  - - [64, 31, 8192, 31]
    - [14, 4.979]
  - - [64, 27, 8192, 27]
    - [33, 3.961]
  - - [64, 35, 8192, 35]
    - [14, 3.79]
  - - [64, 21, 8192, 21]
    - [33, 2.587]
  - - [64, 3, 8192, 3]
    - [142, 0.07]
  - - [64, 24, 320, 34]
    - [110, 1.264]
  - - [64, 34, 5248, 34]
    - [14, 3.545]
  - - [64, 17, 8192, 17]
    - [33, 1.749]
  - - [64, 32, 5248, 32]
    - [14, 7.957]
  - - [64, 4, 3456, 4]
    - [142, 0.101]
  - - [1024, 10032, 1, 1024]
    - [73, 59.526]
  - - [1024, 10032, 1, 4096]
    - [73, 74.892]
  - - [1024, 11304, 1, 1024]
    - [43, 59.458]
  - - [1024, 1280, 1, 2048]
    - [120, 43.767]
  - - [1024, 1280, 1, 3072]
    - [120, 48.728]
  - - [1024, 13104, 1, 1024]
    - [52, 61.828]
  - - [1024, 144, 1, 2048]
    - [41, 12.463]
  - - [1024, 160, 1, 33712]
    - [106, 36.222]
  - - [1024, 1640, 1, 1024]
    - [49, 42.119]
  - - [1024, 1960, 1, 1024]
    - [21, 38.4]
  - - [1024, 1960, 1, 2048]
    - [24, 50.392]
  - - [1024, 1960, 1, 3072]
    - [121, 56.706]
  - - [1024, 1960, 1, 4096]
    - [64, 60.934]
  - - [1024, 2320, 1, 1024]
    - [21, 45.079]
  - - [1024, 2320, 1, 3072]
    - [21, 59.111]
  - - [1024, 2320, 1, 4096]
    - [21, 61.626]
  - - [1024, 256, 1, 1024]
    - [143, 12.001]
  - - [1024, 2832, 1, 1024]
    - [23, 43.226]
  - - [1024, 2832, 1, 4096]
    - [71, 57.759]
  - - [1024, 288, 1, 1024]
    - [85, 15.121]
  - - [1024, 304, 1, 1024]
    - [143, 15.48]
  - - [1024, 312, 1, 1024]
    - [143, 15.819]
  - - [1024, 3304, 1, 1024]
    - [23, 47.776]
  - - [1024, 3304, 1, 4096]
    - [71, 66.354]
  - - [1024, 3400, 1, 1024]
    - [23, 49.285]
  - - [1024, 3400, 1, 2048]
    - [144, 58.171]
  - - [1024, 3408, 1, 33712]
    - [145, 79.69]
  - - [1024, 352, 1, 1024]
    - [85, 18.319]
  - - [1024, 3520, 1, 1024]
    - [49, 51.594]
  - - [1024, 3584, 1, 4096]
    - [21, 64.519]
  - - [1024, 3696, 1, 1024]
    - [21, 51.551]
  - - [1024, 384, 1, 1024]
    - [85, 20.62]
  - - [1024, 3872, 1, 1024]
    - [21, 53.128]
  - - [1024, 3872, 1, 4096]
    - [21, 68.503]
  - - [1024, 392, 1, 1024]
    - [107, 17.026]
  - - [1024, 4176, 1, 2048]
    - [64, 58.384]
  - - [1024, 432, 1, 1024]
    - [107, 19.043]
  - - [1024, 448, 1, 1024]
    - [42, 19.107]
  - - [1024, 4480, 1, 3072]
    - [21, 60.372]
  - - [1024, 456, 1, 1024]
    - [42, 19.24]
  - - [1024, 480, 1, 1024]
    - [42, 19.897]
  - - [1024, 4896, 1, 1024]
    - [66, 55.885]
  - - [1024, 4896, 1, 3072]
    - [66, 67.361]
  - - [1024, 4896, 1, 4096]
    - [66, 68.96]
  - - [1024, 4968, 1, 1024]
    - [21, 53.746]
  - - [1024, 4968, 1, 4096]
    - [71, 68.325]
  - - [1024, 504, 1, 2048]
    - [80, 26.942]
  - - [1024, 5280, 1, 1024]
    - [66, 59.237]
  - - [1024, 5280, 1, 4096]
    - [66, 72.342]
  - - [1024, 6880, 1, 3072]
    - [75, 71.78]
  - - [1024, 6880, 1, 4096]
    - [75, 74.688]
  - - [1024, 704, 1, 1024]
    - [42, 28.193]
  - - [1024, 7040, 1, 1024]
    - [38, 57.043]
  - - [1024, 7040, 1, 4096]
    - [146, 74.625]
  - - [1024, 7144, 1, 1024]
    - [43, 54.733]
  - - [1024, 7144, 1, 4096]
    - [34, 67.276]
  - - [1024, 744, 1, 1024]
    - [42, 28.63]
  - - [1024, 7448, 1, 2048]
    - [21, 64.179]
  - - [1024, 768, 1, 1024]
    - [47, 30.966]
  - - [1024, 8192, 1, 2048]
    - [65, 63.233]
  - - [1024, 864, 1, 4096]
    - [45, 47.475]
  - - [1024, 8968, 1, 2048]
    - [21, 66.32]
  - - [1024, 8968, 1, 3072]
    - [21, 69.64]
  - - [4096, 10032, 1, 1024]
    - [75, 66.788]
  - - [4096, 1960, 1, 1024]
    - [26, 54.547]
  - - [4096, 2320, 1, 1024]
    - [75, 56.279]
  - - [4096, 2832, 1, 1024]
    - [53, 59.294]
  - - [4096, 3304, 1, 1024]
    - [75, 61.037]
  - - [4096, 3584, 1, 1024]
    - [26, 60.186]
  - - [4096, 3872, 1, 1024]
    - [58, 61.794]
  - - [4096, 4896, 1, 1024]
    - [53, 63.947]
  - - [4096, 4968, 1, 1024]
    - [129, 63.57]
  - - [4096, 5280, 1, 1024]
    - [54, 64.29]
  - - [4096, 6880, 1, 1024]
    - [27, 66.924]
  - - [4096, 7040, 1, 1024]
    - [26, 66.535]
  - - [4096, 7144, 1, 1024]
    - [53, 64.722]
  - - [4096, 864, 1, 1024]
    - [21, 49.37]
  - - [64, 10, 384, 30]
    - [33, 0.529]
  - - [64, 12, 10240, 16]
    - [17, 1.327]
  - - [64, 12, 10048, 22]
    - [17, 1.673]
  - - [64, 14, 10240, 16]
    - [14, 1.54]
  - - [64, 14, 9088, 18]
    - [17, 1.574]
  - - [64, 16, 11008, 20]
    - [17, 2.032]
  - - [64, 16, 10048, 22]
    - [17, 2.218]
  - - [64, 18, 8192, 20]
    - [17, 2.215]
  - - [64, 18, 10048, 22]
    - [33, 2.465]
  - - [64, 32, 5120, 16]
    - [33, 3.015]
  - - [64, 32, 5120, 22]
    - [14, 3.932]
  - - [64, 32, 384, 26]
    - [17, 1.486]
  - - [64, 32, 384, 28]
    - [110, 1.56]
  - - [64, 32, 384, 30]
    - [17, 1.726]
  - - [64, 34, 320, 26]
    - [17, 1.152]
  - - [64, 34, 320, 28]
    - [17, 1.248]
  - - [64, 34, 320, 32]
    - [28, 1.888]
  - - [64, 36, 320, 30]
    - [17, 1.416]
  - - [64, 36, 320, 32]
    - [46, 1.912]
  - - [2944, 4288, 1, 1280]
    - [54, 62.07]
  - - [2368, 64, 1, 3328]
    - [40, 15.399]
  - - [2368, 5888, 1, 256]
    - [55, 40.134]
  - - [256, 704, 1, 1280]
    - [41, 11.76]
  - - [128, 6784, 1, 3328]
    - [47, 53.201]
  - - [5888, 1856, 1, 3328]
    - [66, 66.865]
  - - [5888, 2944, 1, 3328]
    - [146, 72.913]
  - - [1856, 4288, 1, 256]
    - [52, 34.312]
  - - [5056, 5056, 1, 3328]
    - [75, 71.997]
  - - [1408, 5888, 1, 1280]
    - [26, 57.149]
  - - [448, 3584, 1, 3328]
    - [80, 55.899]
  - - [256, 4288, 1, 3328]
    - [118, 49.53]
  - - [5888, 1408, 1, 1280]
    - [54, 58.663]
  - - [704, 1856, 1, 3328]
    - [120, 47.937]
  - - [1024, 2368, 1, 256]
    - [21, 22.93]
  - - [5056, 6784, 1, 1280]
    - [75, 70.603]
  - - [1408, 64, 1, 1280]
    - [20, 7.025]
  - - [448, 1024, 1, 1280]
    - [42, 21.55]
  - - [5056, 5056, 1, 1280]
    - [53, 66.078]
  - - [4288, 6784, 1, 256]
    - [52, 44.964]
  - - [6784, 448, 1, 256]
    - [49, 24.282]
  - - [5056, 256, 1, 1280]
    - [147, 37.785]
  - - [5888, 704, 1, 1280]
    - [49, 51.936]
  - - [3584, 1024, 1, 256]
    - [43, 27.71]
  - - [6784, 4288, 1, 3328]
    - [66, 72.87]
  - - [1856, 2368, 1, 3328]
    - [148, 58.791]
  - - [5888, 2944, 1, 1280]
    - [26, 64.863]
  - - [5888, 1024, 1, 256]
    - [94, 30.833]
  - - [448, 64, 1, 1280]
    - [20, 2.349]
  - - [1408, 2944, 1, 256]
    - [49, 26.746]
  - - [256, 1856, 1, 1280]
    - [42, 21.018]
  - - [6784, 5056, 1, 3328]
    - [27, 76.248]
  - - [5056, 5056, 1, 256]
    - [61, 44.176]
  - - [256, 2944, 1, 3328]
    - [117, 47.334]
  - - [64, 1024, 1, 1280]
    - [149, 5.137]
  - - [2368, 2944, 1, 1280]
    - [150, 58.417]
  - - [128, 3584, 1, 1280]
    - [151, 20.674]
  - - [6784, 6784, 1, 1280]
    - [53, 68.685]
  - - [1408, 4288, 1, 1280]
    - [49, 56.1]
  - - [3584, 4288, 1, 1280]
    - [26, 64.803]
  - - [2368, 704, 1, 1280]
    - [49, 45.793]
  - - [5056, 4288, 1, 3328]
    - [72, 71.728]
  - - [3584, 2368, 1, 3328]
    - [124, 68.199]
  - - [5888, 6784, 1, 1280]
    - [26, 69.169]
  - - [64, 704, 1, 1280]
    - [20, 3.61]
  - - [4288, 256, 1, 256]
    - [104, 15.222]
  - - [6784, 448, 1, 1280]
    - [23, 47.383]
  - - [2944, 5888, 1, 256]
    - [52, 41.422]
  - - [256, 128, 1, 256]
    - [20, 0.788]
  - - [4288, 2944, 1, 256]
    - [55, 39.277]
  - - [5888, 64, 1, 3328]
    - [85, 32.707]
  - - [2944, 256, 1, 3328]
    - [151, 47.335]
  - - [5056, 2368, 1, 1280]
    - [133, 61.554]
  - - [448, 3584, 1, 1280]
    - [91, 42.486]
  - - [6784, 5888, 1, 256]
    - [26, 45.918]
  - - [64, 1024, 1, 3328]
    - [152, 8.004]
  - - [704, 128, 1, 1280]
    - [20, 7.101]
  - - [1408, 448, 1, 1280]
    - [42, 27.155]
  - - [1024, 1408, 1, 256]
    - [153, 19.708]
  - - [2368, 2368, 1, 3328]
    - [21, 60.608]
  - - [5056, 704, 1, 3328]
    - [23, 62.22]
  - - [1408, 1856, 1, 256]
    - [154, 24.08]
  - - [1408, 256, 1, 1280]
    - [85, 21.131]
  - - [5888, 1856, 1, 256]
    - [58, 37.257]
  - - [704, 5888, 1, 256]
    - [55, 27.359]
  - - [6784, 64, 1, 256]
    - [132, 8.131]
  - - [3584, 704, 1, 3328]
    - [49, 58.398]
  - - [1408, 1408, 1, 256]
    - [16, 19.383]
  - - [448, 4288, 1, 256]
    - [21, 20.147]
  - - [64, 3584, 1, 3328]
    - [85, 20.526]
  - - [704, 2368, 1, 1280]
    - [128, 43.553]
  - - [1856, 2368, 1, 1280]
    - [21, 51.488]
  - - [2368, 128, 1, 3328]
    - [103, 27.124]
  - - [1408, 1408, 1, 3328]
    - [22, 57.846]
  - - [2944, 128, 1, 256]
    - [40, 7.444]
  - - [448, 1408, 1, 256]
    - [42, 11.515]
  - - [64, 5056, 1, 3328]
    - [85, 27.388]
  - - [1408, 1024, 1, 1280]
    - [49, 41.173]
  - - [704, 6784, 1, 256]
    - [55, 31.165]
  - - [6784, 704, 1, 256]
    - [43, 30.275]
  - - [256, 3584, 1, 3328]
    - [118, 41.598]
  - - [5056, 704, 1, 256]
    - [43, 27.232]
  - - [1408, 3584, 1, 256]
    - [50, 31.1]
  - - [3584, 4288, 1, 3328]
    - [24, 70.743]
  - - [5888, 1856, 1, 1280]
    - [53, 59.381]
  - - [256, 1408, 1, 256]
    - [40, 7.121]
  - - [5056, 64, 1, 1280]
    - [103, 18.741]
  - - [2368, 128, 1, 256]
    - [18, 6.335]
  - - [2368, 3584, 1, 1280]
    - [61, 59.241]
  - - [448, 448, 1, 256]
    - [18, 4.257]
  - - [2944, 3584, 1, 3328]
    - [27, 76.419]
  - - [256, 256, 1, 3328]
    - [20, 8.191]
  - - [128, 1024, 1, 3328]
    - [40, 13.283]
  - - [6784, 2944, 1, 256]
    - [55, 42.45]
  - - [64, 1856, 1, 1280]
    - [41, 7.931]
  - - [448, 256, 1, 256]
    - [155, 2.544]
  - - [1856, 2368, 1, 256]
    - [52, 28.55]
  - - [3584, 6784, 1, 3328]
    - [27, 76.481]
  - - [4288, 128, 1, 1280]
    - [42, 24.28]
  - - [5056, 4288, 1, 1280]
    - [26, 65.835]
  - - [5888, 64, 1, 256]
    - [132, 7.394]
  - - [6784, 1856, 1, 3328]
    - [34, 69.244]
  - - [1408, 5056, 1, 1280]
    - [73, 60.783]
  - - [1856, 256, 1, 1280]
    - [42, 22.319]
  - - [64, 5888, 1, 3328]
    - [143, 29.872]
  - - [6784, 5888, 1, 3328]
    - [27, 74.803]
  - - [448, 256, 1, 3328]
    - [41, 11.685]
  - - [2368, 5056, 1, 1280]
    - [96, 61.183]
  - - [256, 1408, 1, 3328]
    - [85, 32.178]
  - - [6784, 128, 1, 3328]
    - [117, 53.995]
  - - [1024, 5056, 1, 1280]
    - [21, 58.24]
  - - [4288, 1024, 1, 256]
    - [56, 28.018]
  - - [2368, 1408, 1, 256]
    - [104, 25.851]
  - - [704, 704, 1, 3328]
    - [47, 31.338]
  - - [5888, 448, 1, 1280]
    - [49, 50.318]
  - - [3584, 256, 1, 3328]
    - [118, 41.649]
  - - [704, 5888, 1, 3328]
    - [62, 60.998]
  - - [1024, 6784, 1, 1280]
    - [75, 60.241]
  - - [128, 3584, 1, 3328]
    - [123, 29.966]
  - - [128, 704, 1, 1280]
    - [15, 6.949]
  - - [3584, 2944, 1, 1280]
    - [21, 62.158]
  - - [1856, 128, 1, 3328]
    - [85, 21.886]
  - - [128, 2944, 1, 1280]
    - [85, 21.913]
  - - [448, 1856, 1, 1280]
    - [42, 34.358]
  - - [1408, 5056, 1, 3328]
    - [73, 73.492]
  - - [1856, 1856, 1, 3328]
    - [47, 61.417]
  - - [3584, 128, 1, 256]
    - [42, 8.167]
  - - [448, 1408, 1, 3328]
    - [151, 40.223]
  - - [2368, 2368, 1, 256]
    - [60, 30.286]
  - - [4288, 4288, 1, 1280]
    - [43, 64.863]
  - - [64, 448, 1, 1280]
    - [152, 2.31]
  - - [5888, 1024, 1, 1280]
    - [27, 57.544]
  - - [704, 1024, 1, 256]
    - [42, 12.756]
  - - [704, 6784, 1, 3328]
    - [21, 63.099]
  - - [5888, 5888, 1, 3328]
    - [109, 77.476]
  - - [5056, 1024, 1, 1280]
    - [21, 56.649]
  - - [448, 5888, 1, 3328]
    - [47, 61.356]
  - - [1024, 2944, 1, 1280]
    - [49, 47.102]
  - - [5056, 5888, 1, 1280]
    - [75, 68.8]
  - - [448, 6784, 1, 256]
    - [55, 23.885]
  - - [256, 3584, 1, 256]
    - [49, 13.101]
  - - [256, 448, 1, 256]
    - [156, 2.506]
  - - [3584, 5888, 1, 256]
    - [51, 42.297]
  - - [2944, 3584, 1, 256]
    - [53, 38.04]
  - - [1408, 704, 1, 256]
    - [153, 13.878]
  - - [6784, 1024, 1, 3328]
    - [27, 74.655]
  - - [6784, 2944, 1, 3328]
    - [27, 73.431]
  - - [64, 64, 1, 3328]
    - [99, 0.531]
  - - [6784, 2368, 1, 1280]
    - [157, 63.211]
  - - [4288, 3584, 1, 256]
    - [52, 40.928]
  - - [4288, 5888, 1, 1280]
    - [75, 65.996]
  - - [448, 2944, 1, 3328]
    - [124, 47.053]
  - - [4288, 1856, 1, 1280]
    - [49, 56.902]
  - - [1856, 2944, 1, 3328]
    - [21, 59.47]
  - - [256, 6784, 1, 3328]
    - [158, 62.977]
  - - [64, 5888, 1, 256]
    - [132, 7.394]
  - - [5056, 1024, 1, 256]
    - [52, 32.252]
  - - [704, 64, 1, 3328]
    - [20, 5.766]
  - - [5056, 1856, 1, 3328]
    - [27, 68.188]
  - - [448, 448, 1, 3328]
    - [41, 19.908]
  - - [448, 2368, 1, 1280]
    - [21, 32.551]
  - - [1408, 128, 1, 1280]
    - [40, 11.707]
  - - [5056, 256, 1, 3328]
    - [147, 50.239]
  - - [704, 704, 1, 256]
    - [42, 9.163]
  - - [1024, 5888, 1, 1280]
    - [75, 57.355]
  - - [128, 1856, 1, 1280]
    - [103, 13.984]
  - - [5056, 3584, 1, 256]
    - [52, 42.251]
  - - [1856, 1024, 1, 1280]
    - [21, 40.484]
  - - [1856, 1856, 1, 1280]
    - [49, 52.624]
  - - [128, 4288, 1, 3328]
    - [47, 34.646]
  - - [1856, 1024, 1, 3328]
    - [64, 55.198]
  - - [256, 2368, 1, 256]
    - [42, 10.793]
  - - [1856, 704, 1, 1280]
    - [49, 37.686]
  - - [6784, 1024, 1, 256]
    - [129, 34.017]
  - - [5056, 5888, 1, 3328]
    - [75, 74.818]
  - - [1856, 1024, 1, 256]
    - [21, 19.302]
  - - [5056, 1408, 1, 3328]
    - [120, 69.42]
  - - [448, 5888, 1, 256]
    - [16, 22.916]
  - - [1408, 6784, 1, 3328]
    - [27, 68.69]
  - - [2944, 1408, 1, 3328]
    - [24, 63.231]
  - - [2944, 4288, 1, 3328]
    - [66, 69.201]
  - - [256, 2944, 1, 256]
    - [42, 13.095]
  - - [5056, 2944, 1, 256]
    - [55, 40.085]
  - - [2368, 1856, 1, 256]
    - [52, 28.615]
  - - [128, 6784, 1, 1280]
    - [80, 37.719]
  - - [1408, 3584, 1, 3328]
    - [124, 66.647]
  - - [2368, 6784, 1, 256]
    - [59, 40.823]
  - - [4288, 2368, 1, 3328]
    - [66, 68.525]
  - - [704, 3584, 1, 1280]
    - [62, 46.412]
  - - [1408, 5888, 1, 3328]
    - [124, 67.56]
  - - [1856, 5056, 1, 256]
    - [55, 35.566]
  - - [6784, 6784, 1, 256]
    - [52, 46.219]
  - - [1408, 704, 1, 3328]
    - [159, 44.833]
  - - [128, 5888, 1, 1280]
    - [47, 32.252]
  - - [2368, 4288, 1, 1280]
    - [27, 63.833]
  - - [3584, 1856, 1, 1280]
    - [57, 56.263]
  - - [704, 1408, 1, 3328]
    - [159, 46.226]
  - - [704, 64, 1, 1280]
    - [20, 3.63]
  - - [3584, 448, 1, 256]
    - [153, 21.54]
  - - [3584, 3584, 1, 1280]
    - [109, 63.766]
  - - [256, 6784, 1, 256]
    - [49, 22.769]
  - - [1856, 3584, 1, 3328]
    - [27, 69.147]
  - - [128, 448, 1, 256]
    - [20, 1.367]
  - - [3584, 3584, 1, 256]
    - [51, 38.794]
  - - [6784, 4288, 1, 1280]
    - [53, 67.423]
  - - [448, 704, 1, 1280]
    - [85, 18.34]
  - - [3584, 5056, 1, 256]
    - [59, 41.348]
  - - [6784, 128, 1, 256]
    - [42, 14.312]
  - - [64, 1408, 1, 3328]
    - [20, 10.829]
  - - [704, 448, 1, 256]
    - [18, 6.592]
  - - [2944, 2368, 1, 1280]
    - [160, 58.621]
  - - [448, 64, 1, 3328]
    - [99, 3.657]
  - - [6784, 3584, 1, 256]
    - [51, 42.891]
  - - [256, 1856, 1, 3328]
    - [117, 30.298]
  - - [256, 704, 1, 256]
    - [156, 3.879]
  - - [128, 1408, 1, 256]
    - [113, 3.908]
  - - [1856, 1408, 1, 256]
    - [147, 21.535]
  - - [2944, 2944, 1, 3328]
    - [124, 70.038]
  - - [5056, 6784, 1, 256]
    - [61, 46.164]
  - - [1408, 4288, 1, 3328]
    - [21, 64.92]
  - - [6784, 256, 1, 1280]
    - [49, 48.072]
  - - [2368, 704, 1, 3328]
    - [49, 55.218]
  - - [128, 4288, 1, 256]
    - [42, 9.423]
  - - [3584, 6784, 1, 256]
    - [19, 43.422]
  - - [5056, 1856, 1, 256]
    - [51, 36.33]
  - - [704, 4288, 1, 256]
    - [90, 23.855]
  - - [256, 448, 1, 3328]
    - [44, 11.622]
  - - [1408, 6784, 1, 1280]
    - [27, 58.968]
  - - [64, 2368, 1, 1280]
    - [41, 10.213]
  - - [64, 6784, 1, 3328]
    - [85, 32.624]
  - - [2944, 256, 1, 1280]
    - [80, 32.836]
  - - [5056, 2368, 1, 3328]
    - [124, 68.989]
  - - [2944, 4288, 1, 256]
    - [55, 38.57]
  - - [1408, 3584, 1, 1280]
    - [21, 56.721]
  - - [2368, 64, 1, 256]
    - [18, 3.337]
  - - [256, 256, 1, 256]
    - [161, 1.616]
  - - [704, 128, 1, 3328]
    - [20, 11.042]
  - - [1856, 704, 1, 256]
    - [49, 17.13]
  - - [2368, 6784, 1, 3328]
    - [27, 71.427]
  - - [5056, 704, 1, 1280]
    - [49, 53.359]
  - - [1856, 4288, 1, 3328]
    - [62, 65.425]
  - - [1408, 5888, 1, 256]
    - [50, 33.583]
  - - [704, 2944, 1, 1280]
    - [21, 43.38]
  - - [4288, 64, 1, 1280]
    - [85, 16.287]
  - - [704, 1856, 1, 256]
    - [49, 16.976]
  - - [3584, 704, 1, 1280]
    - [49, 49.104]
  - - [5888, 5056, 1, 256]
    - [54, 44.305]
  - - [3584, 448, 1, 3328]
    - [23, 55.08]
  - - [704, 2368, 1, 3328]
    - [151, 56.211]
  - - [2944, 448, 1, 256]
    - [153, 18.029]
  - - [448, 5056, 1, 3328]
    - [21, 56.469]
  - - [2368, 128, 1, 1280]
    - [85, 17.841]
  - - [4288, 448, 1, 256]
    - [21, 19.718]
  - - [64, 6784, 1, 256]
    - [132, 8.461]
  - - [64, 5056, 1, 1280]
    - [85, 17.948]
  - - [5888, 2368, 1, 256]
    - [19, 39.043]
  - - [704, 448, 1, 3328]
    - [85, 28.157]
  - - [6784, 704, 1, 3328]
    - [124, 62.548]
  - - [128, 64, 1, 1280]
    - [10, 0.664]
  - - [2368, 256, 1, 1280]
    - [80, 26.735]
  - - [1408, 2944, 1, 3328]
    - [24, 63.257]
  - - [64, 1024, 1, 256]
    - [15, 1.588]
  - - [2368, 448, 1, 1280]
    - [21, 32.62]
  - - [128, 3584, 1, 256]
    - [42, 8.375]
  - - [1856, 448, 1, 3328]
    - [108, 46.394]
  - - [128, 5056, 1, 256]
    - [42, 11.313]
  - - [4288, 4288, 1, 256]
    - [52, 42.596]
  - - [2368, 704, 1, 256]
    - [49, 21.659]
  - - [3584, 2368, 1, 256]
    - [53, 34.623]
  - - [5888, 5056, 1, 1280]
    - [53, 66.892]
  - - [128, 1024, 1, 1280]
    - [40, 8.711]
  - - [64, 704, 1, 256]
    - [20, 1.074]
  - - [4288, 256, 1, 1280]
    - [147, 33.328]
  - - [3584, 3584, 1, 3328]
    - [75, 71.32]
  - - [128, 1024, 1, 256]
    - [18, 2.8]
  - - [5888, 6784, 1, 256]
    - [26, 45.955]
  - - [4288, 2944, 1, 3328]
    - [75, 69.844]
  - - [1856, 64, 1, 256]
    - [18, 2.635]
  - - [4288, 128, 1, 3328]
    - [47, 34.999]
  - - [256, 5056, 1, 1280]
    - [63, 39.379]
  - - [6784, 5888, 1, 1280]
    - [26, 68.814]
  - - [704, 128, 1, 256]
    - [15, 2.13]
  - - [5888, 4288, 1, 1280]
    - [53, 66.795]
  - - [448, 256, 1, 1280]
    - [41, 7.765]
  - - [448, 2368, 1, 3328]
    - [63, 46.742]
  - - [256, 1408, 1, 1280]
    - [85, 21.131]
  - - [1408, 1856, 1, 1280]
    - [21, 52.415]
  - - [5888, 448, 1, 3328]
    - [23, 60.53]
  - - [704, 5888, 1, 1280]
    - [47, 48.918]
  - - [256, 64, 1, 3328]
    - [20, 2.097]
  - - [128, 2368, 1, 256]
    - [18, 6.381]
  - - [6784, 64, 1, 3328]
    - [85, 35.779]
  - - [5056, 2944, 1, 3328]
    - [61, 68.716]
  - - [448, 128, 1, 256]
    - [20, 1.39]
  - - [1856, 128, 1, 1280]
    - [85, 14.041]
  - - [448, 4288, 1, 1280]
    - [131, 41.042]
  - - [64, 3584, 1, 256]
    - [18, 4.829]
  - - [128, 2944, 1, 3328]
    - [85, 33.482]
  - - [3584, 704, 1, 256]
    - [49, 20.674]
  - - [2944, 448, 1, 3328]
    - [65, 48.012]
  - - [3584, 1408, 1, 3328]
    - [124, 66.741]
  - - [2368, 1024, 1, 1280]
    - [21, 51.274]
  - - [2944, 6784, 1, 1280]
    - [61, 66.257]
  - - [1856, 6784, 1, 256]
    - [55, 39.603]
  - - [4288, 448, 1, 3328]
    - [24, 55.492]
  - - [6784, 704, 1, 1280]
    - [21, 53.557]
  - - [5888, 1024, 1, 3328]
    - [75, 66.025]
  - - [704, 6784, 1, 1280]
    - [21, 54.49]
  - - [5888, 128, 1, 256]
    - [42, 13.336]
  - - [5056, 1024, 1, 3328]
    - [148, 67.852]
  - - [704, 5056, 1, 1280]
    - [21, 52.06]
  - - [64, 704, 1, 3328]
    - [152, 5.746]
  - - [2944, 1856, 1, 256]
    - [162, 29.512]
  - - [5056, 64, 1, 256]
    - [18, 6.666]
  - - [5888, 5056, 1, 3328]
    - [27, 73.629]
  - - [128, 5056, 1, 3328]
    - [47, 40.376]
  - - [3584, 6784, 1, 1280]
    - [27, 68.336]
  - - [1856, 5888, 1, 256]
    - [52, 37.793]
  - - [64, 448, 1, 3328]
    - [149, 3.669]
  - - [4288, 4288, 1, 3328]
    - [66, 71.852]
  - - [4288, 1408, 1, 1280]
    - [26, 55.849]
  - - [64, 1856, 1, 256]
    - [10, 2.677]
  - - [4288, 2368, 1, 256]
    - [55, 37.595]
  - - [2944, 5056, 1, 1280]
    - [53, 62.894]
  - - [256, 4288, 1, 1280]
    - [63, 33.754]
  - - [6784, 2368, 1, 3328]
    - [27, 70.747]
  - - [4288, 128, 1, 256]
    - [42, 10.28]
  - - [4288, 1856, 1, 3328]
    - [23, 64.772]
  - - [1856, 2944, 1, 1280]
    - [21, 52.219]
  - - [3584, 64, 1, 1280]
    - [85, 13.502]
  - - [4288, 6784, 1, 3328]
    - [66, 73.124]
  - - [3584, 1024, 1, 1280]
    - [21, 52.61]
  - - [1024, 4288, 1, 256]
    - [43, 28.206]
  - - [5888, 3584, 1, 3328]
    - [75, 77.634]
  - - [5056, 3584, 1, 3328]
    - [66, 71.618]
  - - [1408, 128, 1, 3328]
    - [41, 17.552]
  - - [2368, 1408, 1, 1280]
    - [49, 51.981]
  - - [5056, 2944, 1, 1280]
    - [26, 63.414]
  - - [3584, 256, 1, 256]
    - [82, 12.542]
  - - [1024, 6784, 1, 256]
    - [57, 33.009]
  - - [2944, 5056, 1, 3328]
    - [24, 68.953]
  - - [3584, 2944, 1, 256]
    - [51, 37.711]
  - - [448, 128, 1, 3328]
    - [20, 7.239]
  - - [64, 2944, 1, 3328]
    - [40, 18.446]
  - - [64, 4288, 1, 3328]
    - [85, 23.386]
  - - [5056, 6784, 1, 3328]
    - [75, 76.983]
  - - [128, 2944, 1, 256]
    - [132, 7.444]
  - - [3584, 4288, 1, 256]
    - [55, 40.077]
  - - [1856, 6784, 1, 3328]
    - [27, 70.128]
  - - [3584, 128, 1, 3328]
    - [47, 30.019]
  - - [128, 256, 1, 1280]
    - [20, 2.596]
  - - [64, 448, 1, 256]
    - [161, 0.701]
  - - [64, 256, 1, 1280]
    - [99, 1.358]
  - - [5056, 1408, 1, 1280]
    - [57, 58.664]
  - - [5888, 5888, 1, 256]
    - [51, 45.184]
  - - [4288, 1024, 1, 1280]
    - [49, 53.708]
  - - [5888, 128, 1, 3328]
    - [117, 47.098]
  - - [448, 6784, 1, 3328]
    - [94, 56.95]
  - - [2944, 1408, 1, 1280]
    - [49, 52.117]
  - - [2944, 1856, 1, 3328]
    - [66, 59.696]
  - - [448, 5056, 1, 256]
    - [154, 21.997]
  - - [64, 64, 1, 256]
    - [10, 0.099]
  - - [3584, 5888, 1, 1280]
    - [27, 70.429]
  - - [6784, 1856, 1, 1280]
    - [54, 62.678]
  - - [5888, 256, 1, 3328]
    - [71, 56.292]
  - - [1856, 5888, 1, 3328]
    - [163, 67.062]
  - - [3584, 1408, 1, 256]
    - [53, 31.3]
  - - [704, 3584, 1, 3328]
    - [47, 59.763]
  - - [5056, 448, 1, 1280]
    - [21, 46.933]
  - - [3584, 1856, 1, 3328]
    - [124, 66.157]
  - - [1408, 704, 1, 1280]
    - [159, 31.008]
  - - [2944, 1024, 1, 256]
    - [150, 24.22]
  - - [448, 1408, 1, 1280]
    - [80, 27.99]
  - - [2368, 4288, 1, 3328]
    - [75, 73.216]
  - - [1024, 1408, 1, 1280]
    - [49, 41.173]
  - - [256, 128, 1, 1280]
    - [20, 2.64]
  - - [704, 1408, 1, 1280]
    - [159, 31.837]
  - - [6784, 5056, 1, 256]
    - [54, 45.214]
  - - [4288, 5888, 1, 256]
    - [55, 43.868]
  - - [448, 2944, 1, 256]
    - [164, 17.611]
  - - [2944, 6784, 1, 256]
    - [55, 42.356]
  - - [2368, 2368, 1, 1280]
    - [21, 53.589]
  - - [1856, 3584, 1, 1280]
    - [27, 57.928]
  - - [64, 2944, 1, 256]
    - [18, 3.996]
  - - [3584, 1408, 1, 1280]
    - [21, 56.765]
  - - [5056, 3584, 1, 1280]
    - [53, 64.428]
  - - [256, 5888, 1, 256]
    - [153, 19.942]
  - - [128, 256, 1, 3328]
    - [20, 4.151]
  - - [1856, 1408, 1, 3328]
    - [165, 64.378]
  - - [1024, 4288, 1, 3328]
    - [67, 66.44]
  - - [448, 2368, 1, 256]
    - [49, 14.232]
  - - [64, 1408, 1, 1280]
    - [20, 6.876]
  - - [64, 6784, 1, 1280]
    - [103, 23.451]
  - - [2944, 2368, 1, 3328]
    - [71, 68.751]
  - - [704, 4288, 1, 3328]
    - [71, 57.31]
  - - [1024, 1856, 1, 1280]
    - [24, 40.665]
  - - [6784, 1856, 1, 256]
    - [58, 38.924]
  - - [128, 2368, 1, 3328]
    - [85, 27.124]
  - - [1024, 5888, 1, 256]
    - [59, 30.616]
  - - [64, 2944, 1, 1280]
    - [44, 12.407]
  - - [5056, 64, 1, 3328]
    - [85, 28.819]
  - - [1408, 2368, 1, 256]
    - [49, 25.991]
  - - [2944, 704, 1, 3328]
    - [21, 53.263]
  - - [256, 64, 1, 256]
    - [15, 0.394]
  - - [2944, 2944, 1, 1280]
    - [114, 60.704]
  - - [6784, 256, 1, 3328]
    - [124, 63.344]
  - - [1408, 5056, 1, 256]
    - [53, 33.224]
  - - [5056, 128, 1, 3328]
    - [117, 40.714]
  - - [448, 704, 1, 256]
    - [18, 6.738]
  - - [1856, 256, 1, 3328]
    - [80, 30.929]
  - - [2944, 128, 1, 3328]
    - [85, 33.965]
  - - [704, 256, 1, 256]
    - [18, 3.879]
  - - [256, 448, 1, 1280]
    - [41, 7.802]
  - - [704, 256, 1, 1280]
    - [41, 11.814]
  - - [64, 2368, 1, 3328]
    - [41, 14.954]
  - - [256, 704, 1, 3328]
    - [44, 17.598]
  - - [1408, 4288, 1, 256]
    - [166, 32.367]
  - - [5888, 2368, 1, 1280]
    - [133, 62.659]
  - - [128, 256, 1, 256]
    - [20, 0.788]
  - - [256, 64, 1, 1280]
    - [20, 1.358]
  - - [2368, 5888, 1, 1280]
    - [75, 66.624]
  - - [5888, 256, 1, 1280]
    - [49, 42.706]
  - - [704, 1024, 1, 1280]
    - [47, 31.314]
  - - [2368, 1856, 1, 3328]
    - [66, 59.128]
  - - [2944, 704, 1, 256]
    - [56, 20.195]
  - - [2368, 6784, 1, 1280]
    - [75, 64.658]
  - - [2368, 1024, 1, 3328]
    - [21, 60.411]
  - - [1856, 4288, 1, 1280]
    - [61, 56.068]
  - - [704, 3584, 1, 256]
    - [16, 21.659]
  - - [704, 2944, 1, 3328]
    - [21, 52.901]
  - - [1856, 5056, 1, 3328]
    - [75, 68.507]
  - - [3584, 5056, 1, 1280]
    - [53, 64.54]
  - - [2944, 1024, 1, 3328]
    - [140, 59.997]
  - - [256, 4288, 1, 256]
    - [49, 15.222]
  - - [2368, 256, 1, 256]
    - [42, 10.997]
  - - [1408, 6784, 1, 256]
    - [43, 35.872]
  - - [6784, 1408, 1, 3328]
    - [73, 69.992]
  - - [1024, 2368, 1, 1280]
    - [21, 47.969]
  - - [704, 64, 1, 256]
    - [20, 1.065]
  - - [256, 2368, 1, 3328]
    - [151, 38.073]
  - - [6784, 2944, 1, 1280]
    - [27, 65.984]
  - - [3584, 448, 1, 1280]
    - [49, 45.313]
  - - [2944, 6784, 1, 3328]
    - [27, 73.36]
  - - [448, 5056, 1, 1280]
    - [21, 46.072]
  - - [4288, 5056, 1, 1280]
    - [61, 65.601]
  - - [128, 448, 1, 1280]
    - [20, 4.519]
  - - [4288, 704, 1, 256]
    - [49, 23.985]
  - - [64, 64, 1, 1280]
    - [99, 0.356]
  - - [5888, 704, 1, 256]
    - [53, 26.927]
  - - [256, 5888, 1, 3328]
    - [120, 55.409]
  - - [6784, 4288, 1, 256]
    - [19, 44.322]
  - - [5888, 256, 1, 256]
    - [153, 20.127]
  - - [6784, 1024, 1, 1280]
    - [27, 64.842]
  - - [704, 448, 1, 1280]
    - [85, 18.565]
  - - [128, 64, 1, 3328]
    - [99, 1.038]
  - - [448, 64, 1, 256]
    - [10, 0.701]
  - - [2944, 704, 1, 1280]
    - [21, 43.13]
  - - [6784, 3584, 1, 1280]
    - [27, 69.987]
  - - [2944, 64, 1, 1280]
    - [41, 12.295]
  - - [1408, 2944, 1, 1280]
    - [49, 52.621]
  - - [256, 1856, 1, 256]
    - [167, 8.459]
  - - [1408, 2368, 1, 3328]
    - [124, 63.075]
  - - [128, 1408, 1, 3328]
    - [40, 17.877]
  - - [2368, 2944, 1, 256]
    - [55, 32.908]
  - - [64, 5056, 1, 256]
    - [18, 6.863]
  - - [1408, 256, 1, 3328]
    - [85, 32.102]
  - - [3584, 1856, 1, 256]
    - [52, 31.504]
  - - [4288, 3584, 1, 1280]
    - [53, 62.944]
  - - [2368, 448, 1, 256]
    - [130, 14.298]
  - - [4288, 256, 1, 3328]
    - [118, 48.594]
  - - [1408, 64, 1, 256]
    - [20, 2.113]
  - - [4288, 2944, 1, 1280]
    - [26, 62.24]
  - - [5056, 448, 1, 3328]
    - [21, 56.507]
  - - [64, 2368, 1, 256]
    - [156, 3.238]
  - - [4288, 5056, 1, 3328]
    - [72, 71.887]
  - - [2944, 256, 1, 256]
    - [42, 13.586]
  - - [256, 5056, 1, 3328]
    - [118, 56.695]
  - - [5056, 2368, 1, 256]
    - [55, 38.157]
  - - [4288, 704, 1, 3328]
    - [75, 57.867]
  - - [448, 3584, 1, 256]
    - [164, 20.955]
  - - [2368, 64, 1, 1280]
    - [41, 10.261]
  - - [1024, 1408, 1, 3328]
    - [71, 54.06]
  - - [2944, 5888, 1, 1280]
    - [27, 68.979]
  - - [5888, 3584, 1, 256]
    - [52, 42.682]
  - - [1408, 1856, 1, 3328]
    - [21, 64.548]
  - - [6784, 1408, 1, 1280]
    - [157, 60.39]
  - - [704, 2944, 1, 256]
    - [21, 21.349]
  - - [4288, 64, 1, 256]
    - [18, 6.089]
  - - [2944, 5888, 1, 3328]
    - [27, 76.564]
  - - [64, 4288, 1, 1280]
    - [85, 16.088]
  - - [6784, 64, 1, 1280]
    - [85, 24.651]
  - - [704, 1856, 1, 1280]
    - [23, 37.387]
  - - [1408, 64, 1, 3328]
    - [20, 11.042]
  - - [1408, 1408, 1, 1280]
    - [67, 41.676]
  - - [448, 1024, 1, 3328]
    - [47, 29.708]
  - - [448, 4288, 1, 3328]
    - [64, 55.45]
  - - [704, 2368, 1, 256]
    - [104, 20.905]
  - - [2944, 448, 1, 1280]
    - [23, 38.193]
  - - [5888, 2368, 1, 3328]
    - [168, 71.011]
  - - [4288, 5056, 1, 256]
    - [61, 43.758]
  - - [4288, 448, 1, 1280]
    - [21, 40.443]
  - - [5888, 704, 1, 3328]
    - [23, 60.032]
  - - [4288, 3584, 1, 3328]
    - [163, 70.573]
  - - [2944, 64, 1, 256]
    - [18, 4.148]
  - - [1024, 6784, 1, 3328]
    - [75, 72.173]
  - - [1408, 1024, 1, 256]
    - [49, 19.615]
  - - [448, 1024, 1, 256]
    - [42, 8.218]
  - - [6784, 6784, 1, 3328]
    - [75, 74.198]
  - - [704, 5056, 1, 3328]
    - [47, 63.312]
  - - [256, 2368, 1, 1280]
    - [42, 25.413]
  - - [3584, 5056, 1, 3328]
    - [66, 71.482]
  - - [2368, 2944, 1, 3328]
    - [71, 68.249]
  - - [448, 448, 1, 1280]
    - [41, 13.277]
  - - [2368, 3584, 1, 256]
    - [55, 35.631]
  - - [128, 5056, 1, 1280]
    - [47, 26.666]
  - - [3584, 2368, 1, 1280]
    - [26, 59.183]
  - - [1856, 1856, 1, 256]
    - [52, 26.708]
  - - [4288, 1408, 1, 3328]
    - [157, 64.476]
  - - [3584, 64, 1, 3328]
    - [85, 20.926]
  - - [1856, 64, 1, 3328]
    - [41, 12.202]
  - - [5888, 1408, 1, 3328]
    - [120, 67.094]
  - - [256, 5056, 1, 256]
    - [82, 17.364]
  - - [1856, 64, 1, 1280]
    - [41, 7.968]
  - - [1408, 256, 1, 256]
    - [41, 7.072]
  - - [2368, 5056, 1, 256]
    - [51, 38.369]
  - - [128, 5888, 1, 3328]
    - [47, 47.255]
  - - [1024, 5056, 1, 256]
    - [51, 31.174]
  - - [2368, 1408, 1, 3328]
    - [120, 62.351]
  - - [5888, 448, 1, 256]
    - [49, 21.492]
  - - [6784, 5056, 1, 1280]
    - [157, 69.027]
  - - [4288, 6784, 1, 1280]
    - [75, 66.737]
  - - [2368, 448, 1, 3328]
    - [63, 47.185]
  - - [448, 128, 1, 1280]
    - [20, 4.569]
  - - [64, 3584, 1, 1280]
    - [85, 13.557]
  - - [6784, 1408, 1, 256]
    - [60, 35.872]
  - - [5888, 4288, 1, 256]
    - [59, 43.71]
  - - [5056, 5888, 1, 256]
    - [169, 45.143]
  - - [2368, 1024, 1, 256]
    - [21, 24.54]
  - - [1856, 6784, 1, 1280]
    - [75, 62.142]
  - - [3584, 128, 1, 1280]
    - [42, 20.674]
  - - [128, 64, 1, 256]
    - [10, 0.199]
  - - [1408, 448, 1, 256]
    - [42, 10.894]
  - - [64, 256, 1, 3328]
    - [127, 2.118]
  - - [6784, 448, 1, 3328]
    - [75, 58.409]
  - - [5056, 1856, 1, 1280]
    - [157, 60.712]
  - - [1408, 1024, 1, 3328]
    - [124, 54.223]
  - - [2368, 256, 1, 3328]
    - [47, 38.722]
  - - [5888, 3584, 1, 1280]
    - [27, 70.283]
  - - [5888, 128, 1, 1280]
    - [47, 32.347]
  - - [1024, 2944, 1, 256]
    - [170, 24.424]
  - - [448, 6784, 1, 1280]
    - [49, 47.23]
  - - [256, 3584, 1, 1280]
    - [63, 28.953]
  - - [704, 5056, 1, 256]
    - [19, 27.232]
  - - [3584, 1024, 1, 3328]
    - [21, 63.21]
  - - [2944, 1856, 1, 1280]
    - [21, 52.358]
  - - [5056, 256, 1, 256]
    - [104, 17.609]
  - - [128, 5888, 1, 256]
    - [42, 13.255]
  - - [2368, 3584, 1, 3328]
    - [124, 67.821]
  - - [3584, 5888, 1, 3328]
    - [27, 77.917]
  - - [2944, 3584, 1, 1280]
    - [27, 67.568]
  - - [1856, 5888, 1, 1280]
    - [21, 59.202]
  - - [256, 256, 1, 1280]
    - [127, 5.193]
  - - [4288, 1408, 1, 256]
    - [43, 31.893]
  - - [3584, 64, 1, 256]
    - [18, 4.759]
  - - [64, 1856, 1, 3328]
    - [41, 11.94]
  - - [1408, 128, 1, 256]
    - [18, 3.968]
  - - [4288, 2368, 1, 1280]
    - [43, 60.509]
  - - [2944, 5056, 1, 256]
    - [51, 39.973]
  - - [256, 128, 1, 3328]
    - [20, 4.193]
  - - [6784, 2368, 1, 256]
    - [55, 40.431]
  - - [1408, 448, 1, 3328]
    - [47, 39.353]
  - - [4288, 1856, 1, 256]
    - [55, 33.806]
  - - [1856, 2944, 1, 256]
    - [125, 29.735]
  - - [64, 5888, 1, 1280]
    - [103, 20.901]
  - - [1856, 1408, 1, 1280]
    - [49, 49.522]
  - - [128, 704, 1, 256]
    - [161, 2.184]
  - - [1024, 4288, 1, 1280]
    - [49, 54.029]
  - - [2368, 5056, 1, 3328]
    - [71, 69.021]
  - - [4288, 1024, 1, 3328]
    - [131, 63.813]
  - - [1024, 5056, 1, 3328]
    - [21, 67.9]
  - - [1024, 1856, 1, 3328]
    - [22, 55.803]
  - - [704, 704, 1, 1280]
    - [42, 21.791]
  - - [128, 2368, 1, 1280]
    - [85, 17.697]
  - - [3584, 256, 1, 1280]
    - [21, 28.333]
  - - [5888, 64, 1, 1280]
    - [85, 21.825]
  - - [128, 704, 1, 3328]
    - [149, 10.76]
  - - [3584, 2944, 1, 3328]
    - [171, 72.538]
  - - [128, 1856, 1, 256]
    - [18, 5.038]
  - - [64, 4288, 1, 256]
    - [18, 5.654]
  - - [5888, 2944, 1, 256]
    - [55, 41.594]
  - - [5056, 128, 1, 1280]
    - [151, 28.281]
  - - [448, 1856, 1, 3328]
    - [151, 50.529]
  - - [5056, 4288, 1, 256]
    - [61, 43.636]
  - - [2944, 128, 1, 1280]
    - [85, 22.272]
  - - [64, 256, 1, 256]
    - [20, 0.397]
  - - [704, 256, 1, 3328]
    - [40, 18.02]
  - - [5056, 1408, 1, 256]
    - [55, 33.278]
  - - [5888, 5888, 1, 1280]
    - [27, 70.546]
  - - [448, 5888, 1, 1280]
    - [47, 48.521]
  - - [4288, 704, 1, 1280]
    - [49, 47.115]
  - - [2944, 1408, 1, 256]
    - [49, 26.988]
  - - [256, 2944, 1, 1280]
    - [80, 32.737]
  - - [2368, 5888, 1, 3328]
    - [75, 75.711]
  - - [704, 1024, 1, 3328]
    - [117, 44.975]
  - - [2368, 1856, 1, 1280]
    - [21, 51.321]
  - - [1856, 448, 1, 1280]
    - [42, 34.757]
  - - [128, 6784, 1, 256]
    - [42, 14.997]
  - - [5888, 4288, 1, 3328]
    - [66, 73.113]
  - - [1856, 128, 1, 256]
    - [18, 5.038]
  - - [5056, 448, 1, 256]
    - [21, 22.606]
  - - [1856, 5056, 1, 1280]
    - [75, 59.986]
  - - [2944, 1024, 1, 1280]
    - [71, 47.358]
  - - [2368, 4288, 1, 256]
    - [55, 37.985]
  - - [1024, 2368, 1, 3328]
    - [21, 61.473]
  - - [4288, 64, 1, 3328]
    - [85, 24.855]
  - - [704, 1408, 1, 256]
    - [104, 13.946]
  - - [4288, 5888, 1, 3328]
    - [72, 70.954]
  - - [448, 2944, 1, 1280]
    - [23, 37.004]
  - - [1024, 2944, 1, 3328]
    - [168, 59.119]
  - - [256, 6784, 1, 1280]
    - [49, 48.072]
  - - [1856, 3584, 1, 256]
    - [51, 32.191]
  - - [128, 448, 1, 3328]
    - [127, 7.215]
  - - [1856, 256, 1, 256]
    - [107, 8.256]
  - - [5056, 128, 1, 256]
    - [42, 11.74]
  - - [256, 5888, 1, 1280]
    - [49, 42.373]
  - - [6784, 128, 1, 1280]
    - [80, 37.605]
  - - [64, 1408, 1, 256]
    - [15, 2.166]
  - - [2944, 2368, 1, 256]
    - [56, 32.379]
  - - [1856, 448, 1, 256]
    - [42, 14.803]
  - - [1024, 1856, 1, 256]
    - [16, 18.582]
  - - [6784, 3584, 1, 3328]
    - [75, 77.265]
  - - [2944, 64, 1, 3328]
    - [40, 17.706]
  - - [1024, 5888, 1, 3328]
    - [75, 65.546]
  - - [1408, 2368, 1, 1280]
    - [49, 51.535]
  - - [128, 1408, 1, 1280]
    - [40, 12.033]
  - - [128, 1856, 1, 3328]
    - [85, 21.726]
  - - [2944, 2944, 1, 256]
    - [150, 34.72]
  - - [6784, 256, 1, 256]
    - [49, 22.977]
  - - [128, 4288, 1, 1280]
    - [42, 22.811]
  - - [5888, 1408, 1, 256]
    - [43, 34.454]
  - - [448, 704, 1, 3328]
    - [85, 28.023]
  - - [448, 1856, 1, 256]
    - [42, 14.623]
  - - [1856, 704, 1, 3328]
    - [120, 47.381]
  - - [5888, 6784, 1, 3328]
    - [75, 74.454]
  - - [704, 4288, 1, 1280]
    - [49, 47.115]
  - - [4096, 7000, 1, 4096]
    - [146, 76.753]
  - - [5124, 9124, 1, 1760]
    - [172, 71.043]
  - - [1760, 32, 1, 1760]
    - [173, 4.558]
  - - [1024, 1500, 1, 1536]
    - [23, 44.008]
  - - [512, 24000, 1, 2048]
    - [38, 65.938]
  - - [3072, 24000, 1, 1024]
    - [27, 69.55]
  - - [1024, 3000, 1, 2560]
    - [71, 55.725]
  - - [512, 3136, 1, 2048]
    - [49, 50.681]
  - - [7680, 4, 1, 2560]
    - [18, 2.21]
  - - [64, 193600, 1, 64]
    - [33, 14.866]
  - - [8448, 1500, 1, 2816]
    - [73, 69.257]
  - - [2560, 7000, 1, 2560]
    - [61, 71.676]
  - - [3072, 16, 1, 1024]
    - [20, 3.278]
  - - [512, 48000, 1, 2048]
    - [27, 72.897]
  - - [1760, 64, 1, 1760]
    - [127, 8.691]
  - - [512, 48000, 1, 1536]
    - [138, 69.618]
  - - [2560, 32, 1, 2560]
    - [20, 8.751]
  - - [4608, 1500, 1, 1536]
    - [136, 62.658]
  - - [2048, 128, 1, 2048]
    - [85, 20.23]
  - - [1024, 24000, 1, 2560]
    - [27, 75.496]
  - - [4608, 3000, 1, 1536]
    - [27, 67.541]
  - - [5124, 9124, 1, 2048]
    - [172, 71.35]
  - - [2048, 16, 1, 2048]
    - [20, 3.204]
  - - [1024, 700, 1, 512]
    - [42, 19.784]
  - - [3072, 1, 1, 128]
    - [18, 0.041]
  - - [5124, 700, 1, 2560]
    - [66, 56.408]
  - - [8448, 16, 1, 2816]
    - [18, 9.242]
  - - [6144, 6000, 1, 2560]
    - [27, 73.459]
  - - [4608, 32, 1, 1536]
    - [132, 9.929]
  - - [3072, 64, 1, 1024]
    - [41, 11.064]
  - - [512, 16, 1, 512]
    - [15, 0.35]
  - - [7680, 2, 1, 2560]
    - [18, 1.102]
  - - [4224, 1, 1, 128]
    - [18, 0.055]
  - - [7680, 1, 1, 2560]
    - [18, 0.558]
  - - [128, 1500, 1, 1280]
    - [41, 12.759]
  - - [1024, 1500, 1, 2816]
    - [65, 53.143]
  - - [6144, 2, 1, 2560]
    - [20, 1.218]
  - - [8448, 48000, 1, 2816]
    - [27, 79.622]
  - - [512, 6000, 1, 2048]
    - [137, 52.005]
  - - [4224, 1500, 1, 176]
    - [169, 21.699]
  - - [1024, 6000, 1, 2816]
    - [21, 64.418]
  - - [1024, 48000, 1, 1536]
    - [27, 72.781]
  - - [1024, 48000, 1, 2560]
    - [27, 76.643]
  - - [4096, 32, 1, 4096]
    - [85, 12.472]
  - - [512, 16, 1, 500000]
    - [174, 7.588]
  - - [2560, 128, 1, 2560]
    - [85, 26.036]
  - - [4608, 24000, 1, 1536]
    - [27, 74.973]
  - - [512, 2, 1, 500000]
    - [175, 0.959]
  - - [7680, 48000, 1, 2560]
    - [109, 79.248]
  - - [3072, 48000, 1, 1024]
    - [27, 70.633]
  - - [1760, 16, 1, 1760]
    - [15, 2.307]
  - - [1024, 1500, 1, 2048]
    - [65, 48.023]
  - - [64, 193600, 1, 256]
    - [104, 24.938]
  - - [1024, 3000, 1, 2048]
    - [71, 52.662]
  - - [6144, 4, 1, 2560]
    - [20, 2.505]
  - - [1024, 6000, 1, 2048]
    - [21, 61.664]
  - - [512, 24000, 1, 2816]
    - [65, 68.989]
  - - [6144, 48000, 1, 2560]
    - [27, 78.711]
  - - [1760, 7000, 1, 1760]
    - [97, 66.222]
  - - [8448, 3000, 1, 2816]
    - [27, 70.601]
  - - [3072, 4, 1, 1024]
    - [10, 0.834]
  - - [4608, 48000, 1, 1536]
    - [27, 75.36]
  - - [2048, 32, 1, 2048]
    - [149, 6.275]
  - - [7680, 1500, 1, 2560]
    - [66, 66.908]
  - - [4096, 128, 1, 4096]
    - [151, 36.111]
  - - [4608, 16, 1, 1536]
    - [20, 6.224]
  - - [512, 3000, 1, 1536]
    - [49, 44.45]
  - - [3072, 2, 1, 1024]
    - [20, 0.41]
  - - [8448, 1, 1, 2816]
    - [18, 0.62]
  - - [1024, 3000, 1, 2816]
    - [71, 57.231]
  - - [128, 1, 1, 1408]
    - [15, 0.011]
  - - [64, 1, 1, 1216]
    - [13, 0.005]
  - - [1024, 2, 1, 512]
    - [15, 0.09]
  - - [6144, 1, 1, 2560]
    - [20, 0.626]
  - - [5124, 9124, 1, 2560]
    - [109, 72.891]
  - - [512, 48000, 1, 2816]
    - [27, 75.284]
  - - [512, 3000, 1, 2816]
    - [65, 53.788]
  - - [1024, 24000, 1, 1536]
    - [27, 70.8]
  - - [7680, 6000, 1, 2560]
    - [146, 73.178]
  - - [1760, 128, 1, 1760]
    - [44, 14.41]
  - - [512, 1500, 1, 2816]
    - [47, 44.626]
  - - [512, 1, 1, 512]
    - [15, 0.022]
  - - [512, 6000, 1, 2560]
    - [71, 55.205]
  - - [512, 8, 1, 500000]
    - [175, 3.988]
  - - [512, 24000, 1, 2560]
    - [65, 68.196]
  - - [6144, 3000, 1, 2560]
    - [35, 70.153]
  - - [1024, 24000, 1, 2816]
    - [27, 76.069]
  - - [2048, 7000, 1, 2048]
    - [65, 67.729]
  - - [7680, 3000, 1, 2560]
    - [73, 72.255]
  - - [5124, 700, 1, 2048]
    - [66, 52.051]
  - - [5124, 9124, 1, 4096]
    - [172, 75.089]
  - - [4096, 64, 1, 4096]
    - [85, 24.39]
  - - [256, 193600, 1, 64]
    - [125, 18.031]
  - - [7680, 32, 1, 2560]
    - [132, 13.817]
  - - [2560, 64, 1, 2560]
    - [44, 14.363]
  - - [3072, 128, 1, 1024]
    - [85, 20.162]
  - - [8448, 6000, 1, 2816]
    - [27, 74.666]
  - - [7680, 64, 1, 2560]
    - [176, 26.85]
  - - [5124, 1500, 1, 2560]
    - [66, 62.009]
  - - [1024, 1500, 1, 2560]
    - [71, 51.574]
  - - [512, 4, 1, 512]
    - [15, 0.09]
  - - [1024, 6000, 1, 2560]
    - [21, 63.401]
  - - [3072, 32, 1, 1024]
    - [20, 6.594]
  - - [6144, 32, 1, 2560]
    - [132, 15.665]
  - - [512, 50176, 1, 128]
    - [55, 28.024]
  - - [4608, 1, 1, 1536]
    - [20, 0.403]
  - - [7680, 24000, 1, 2560]
    - [27, 78.374]
  - - [8448, 4, 1, 2816]
    - [18, 2.442]
  - - [512, 1, 1, 500000]
    - [174, 0.493]
  - - [176, 1500, 1, 1408]
    - [143, 15.34]
  - - [512, 3000, 1, 2560]
    - [144, 51.754]
  - - [8448, 24000, 1, 2816]
    - [27, 78.865]
  - - [4608, 2, 1, 1536]
    - [20, 0.793]
  - - [512, 6000, 1, 1536]
    - [23, 48.505]
  - - [7680, 128, 1, 2560]
    - [122, 37.804]
  - - [3072, 6000, 1, 1024]
    - [53, 62.765]
  - - [3072, 1500, 1, 128]
    - [52, 18.306]
  - - [2048, 3136, 1, 512]
    - [19, 44.961]
  - - [1024, 3000, 1, 1536]
    - [49, 48.639]
  - - [512, 4, 1, 500000]
    - [174, 2.011]
  - - [512, 6000, 1, 2816]
    - [124, 56.864]
  - - [128, 50176, 1, 512]
    - [53, 40.446]
  - - [256, 12544, 1, 1024]
    - [49, 47.376]
  - - [1024, 12544, 1, 256]
    - [43, 39.246]
  - - [512, 48000, 1, 2560]
    - [27, 74.669]
  - - [2560, 16, 1, 2560]
    - [20, 4.441]
  - - [2048, 64, 1, 2048]
    - [44, 10.84]
  - - [512, 2, 1, 512]
    - [15, 0.045]
  - - [512, 1500, 1, 2560]
    - [47, 43.604]
  - - [512, 24000, 1, 1536]
    - [50, 63.044]
  - - [6144, 16, 1, 2560]
    - [177, 9.611]
  - - [1024, 24000, 1, 2048]
    - [75, 73.568]
  - - [4096, 16, 1, 4096]
    - [177, 7.431]
  - - [512, 32, 1, 512]
    - [99, 0.711]
  - - [5124, 1500, 1, 2048]
    - [66, 59.492]
  - - [3072, 1500, 1, 1024]
    - [21, 49.917]
  - - [1024, 2, 1, 500000]
    - [175, 1.038]
  - - [7680, 16, 1, 2560]
    - [18, 8.838]
  - - [6144, 1500, 1, 2560]
    - [21, 67.757]
  - - [3072, 1, 1, 1024]
    - [20, 0.21]
  - - [1024, 48000, 1, 2816]
    - [27, 77.138]
  - - [8448, 2, 1, 2816]
    - [18, 1.235]
  - - [4608, 4, 1, 1536]
    - [20, 1.595]
  - - [1024, 6000, 1, 1536]
    - [21, 58.581]
  - - [8448, 32, 1, 2816]
    - [178, 15.234]
  - - [512, 3000, 1, 2048]
    - [65, 48.351]
  - - [6144, 24000, 1, 2560]
    - [75, 77.724]
  - - [4608, 6000, 1, 1536]
    - [75, 70.538]
  - - [512, 1500, 1, 2048]
    - [62, 40.092]
  - - [512, 1500, 1, 1536]
    - [47, 34.611]
  - - [128, 1, 1, 1024]
    - [99, 0.009]
  - - [3072, 3000, 1, 1024]
    - [58, 59.267]
  - - [1024, 48000, 1, 2048]
    - [27, 75.182]
  - - [12544, 1024, 1, 256]
    - [43, 39.122]
  - - [3136, 512, 1, 2048]
    - [49, 49.53]
  - - [12544, 256, 1, 1024]
    - [23, 46.956]
  - - [3136, 2048, 1, 512]
    - [19, 46.602]
  - - [3072, 256, 2, 1024]
    - [49, 41.524]
  - - [768, 2048, 2, 512]
    - [49, 37.261]
  - - [2904, 256, 2, 1024]
    - [23, 39.434]
  - - [864, 2048, 2, 512]
    - [55, 37.595]
  - - [2992, 256, 2, 1024]
    - [49, 40.535]
  - - [3400, 256, 2, 1024]
    - [23, 43.377]
  - - [4032, 256, 2, 1024]
    - [21, 41.348]
  - - [3400, 256, 1, 1024]
    - [151, 30.522]
  - - [15200, 128, 2, 512]
    - [139, 34.639]
  - - [12288, 128, 2, 512]
    - [170, 36.148]
  - - [888, 2048, 2, 512]
    - [19, 38.498]
  - - [13600, 128, 2, 512]
    - [170, 37.822]
  - - [12880, 128, 2, 512]
    - [38, 36.932]
  - - [3456, 256, 2, 1024]
    - [49, 46.186]
  - - [2944, 256, 2, 1024]
    - [49, 40.441]
  - - [2688, 256, 2, 1024]
    - [49, 37.272]
  - - [13824, 128, 2, 512]
    - [170, 39.486]
  - - [3800, 256, 1, 1024]
    - [49, 27.109]
  - - [3168, 256, 2, 1024]
    - [49, 41.864]
  - - [3360, 256, 2, 1024]
    - [49, 44.007]
  - - [3552, 256, 2, 1024]
    - [21, 36.112]
  - - [11616, 128, 2, 512]
    - [50, 32.988]
  - - [4200, 256, 2, 1024]
    - [21, 42.554]
  - - [840, 2048, 2, 512]
    - [52, 36.89]
  - - [14208, 128, 2, 512]
    - [139, 34.452]
  - - [11968, 128, 2, 512]
    - [170, 34.654]
  - - [3264, 256, 2, 1024]
    - [49, 43.326]
  - - [13600, 256, 2, 512]
    - [181, 43.851]
  - - [12880, 256, 2, 512]
    - [43, 42.409]
  - - [12288, 256, 2, 512]
    - [138, 45.083]
  - - [2816, 256, 2, 1024]
    - [49, 38.774]
  - - [672, 2048, 2, 512]
    - [23, 32.207]
  - - [13440, 128, 2, 512]
    - [150, 39.224]
  - - [13824, 256, 2, 512]
    - [136, 49.791]
  - - [15200, 256, 2, 512]
    - [43, 42.918]
  - - [864, 512, 2, 2048]
    - [45, 38.884]
  - - [3600, 256, 2, 1024]
    - [21, 37.242]
  - - [888, 512, 2, 2048]
    - [63, 35.322]
  - - [4032, 1024, 2, 256]
    - [55, 34.268]
  - - [16128, 128, 2, 512]
    - [139, 37.684]
  - - [51520, 64, 2, 256]
    - [182, 24.511]
  - - [46464, 64, 2, 256]
    - [88, 26.39]
  - - [768, 3, 2, 256]
    - [20, 0.112]
  - - [768, 12, 2, 256]
    - [20, 0.436]
  - - [49152, 64, 2, 256]
    - [88, 27.084]
  - - [864, 12, 2, 256]
    - [20, 0.494]
  - - [864, 3, 2, 256]
    - [10, 0.126]
  - - [15200, 128, 1, 512]
    - [131, 25.335]
  - - [12288, 12, 2, 256]
    - [18, 4.43]
  - - [12288, 3, 2, 256]
    - [183, 1.229]
  - - [13600, 128, 1, 512]
    - [49, 32.185]
  - - [216, 3, 2, 256]
    - [20, 0.031]
  - - [51520, 12, 2, 256]
    - [33, 7.02]
  - - [2904, 1024, 2, 256]
    - [54, 31.766]
  - - [176, 12, 2, 256]
    - [20, 0.102]
  - - [51520, 3, 2, 256]
    - [183, 2.045]
  - - [176, 3, 2, 256]
    - [20, 0.026]
  - - [2992, 1024, 2, 256]
    - [19, 31.391]
  - - [192, 12, 2, 256]
    - [20, 0.112]
  - - [15200, 12, 2, 256]
    - [18, 5.01]
  - - [1536, 512, 1, 1024]
    - [47, 30.652]
  - - [1728, 512, 1, 1024]
    - [47, 34.484]
  - - [1536, 2048, 1, 1024]
    - [49, 46.648]
  - - [24576, 128, 1, 256]
    - [150, 24.994]
  - - [24576, 512, 1, 256]
    - [57, 37.923]
  - - [25760, 128, 1, 256]
    - [153, 24.261]
  - - [25760, 512, 1, 256]
    - [43, 35.585]
  - - [6144, 256, 1, 512]
    - [49, 32.404]
  - - [6440, 256, 1, 512]
    - [49, 33.605]
  - - [15200, 3, 2, 256]
    - [183, 1.437]
  - - [51520, 64, 2, 64]
    - [17, 10.856]
  - - [3456, 3, 2, 256]
    - [113, 0.471]
  - - [13600, 12, 2, 256]
    - [17, 4.755]
  - - [12880, 3, 2, 256]
    - [183, 1.259]
  - - [3400, 3, 2, 256]
    - [20, 0.486]
  - - [12880, 12, 2, 256]
    - [18, 4.572]
  - - [13824, 12, 2, 256]
    - [17, 4.761]
  - - [13824, 3, 2, 256]
    - [183, 1.375]
  - - [13600, 3, 2, 256]
    - [183, 1.315]
  - - [13600, 512, 1, 128]
    - [55, 21.185]
  - - [9408, 512, 2, 128]
    - [55, 24.036]
  - - [3456, 12, 2, 256]
    - [20, 1.929]
  - - [56000, 256, 2, 64]
    - [43, 15.058]
  - - [3800, 3, 2, 256]
    - [18, 0.526]
  - - [2816, 1024, 2, 256]
    - [54, 30.577]
  - - [60800, 256, 1, 64]
    - [97, 14.5]
  - - [3400, 12, 2, 256]
    - [18, 1.853]
  - - [3800, 12, 2, 256]
    - [10, 2.023]
  - - [192, 3, 2, 256]
    - [105, 0.028]
  - - [216, 12, 2, 256]
    - [10, 0.126]
  - - [2944, 1024, 2, 256]
    - [55, 31.675]
  - - [55296, 64, 2, 64]
    - [52, 10.744]
  - - [55296, 3, 2, 256]
    - [183, 1.933]
  - - [49152, 64, 2, 64]
    - [19, 10.172]
  - - [11776, 512, 2, 128]
    - [55, 23.855]
  - - [54400, 64, 2, 64]
    - [43, 10.637]
  - - [42240, 64, 2, 256]
    - [139, 27.748]
  - - [3072, 3, 2, 256]
    - [20, 0.429]
  - - [11616, 512, 2, 128]
    - [43, 23.693]
  - - [4200, 1024, 2, 256]
    - [55, 36.324]
  - - [3072, 12, 2, 256]
    - [20, 1.743]
  - - [672, 512, 2, 2048]
    - [47, 36.333]
  - - [54400, 256, 1, 64]
    - [150, 14.163]
  - - [54400, 64, 2, 256]
    - [49, 28.05]
  - - [15200, 512, 1, 128]
    - [55, 21.459]
  - - [56832, 64, 2, 256]
    - [49, 26.592]
  - - [2688, 1024, 2, 256]
    - [55, 29.403]
  - - [54400, 3, 2, 256]
    - [183, 1.941]
  - - [12672, 512, 2, 128]
    - [52, 24.655]
  - - [11968, 512, 2, 128]
    - [50, 24.21]
  - - [46464, 256, 2, 64]
    - [53, 14.994]
  - - [55296, 64, 2, 256]
    - [153, 28.393]
  - - [60800, 64, 2, 64]
    - [51, 10.689]
  - - [2400, 256, 2, 1024]
    - [49, 33.515]
  - - [2520, 256, 2, 1024]
    - [49, 35.357]
  - - [768, 512, 2, 2048]
    - [47, 43.0]
  - - [2400, 1024, 2, 256]
    - [19, 31.226]
  - - [10752, 128, 2, 512]
    - [23, 32.338]
  - - [45632, 256, 2, 64]
    - [53, 14.687]
  - - [2520, 1024, 2, 256]
    - [51, 33.375]
  - - [53760, 256, 2, 64]
    - [53, 15.174]
  - - [43008, 64, 2, 256]
    - [49, 25.486]
  - - [2352, 256, 2, 1024]
    - [49, 33.64]
  - - [47872, 256, 2, 64]
    - [150, 15.067]
  - - [47104, 256, 2, 64]
    - [170, 15.148]
  - - [50688, 256, 2, 64]
    - [166, 15.226]
  - - [45056, 256, 2, 64]
    - [43, 15.108]
  - - [13440, 512, 2, 128]
    - [55, 24.871]
  - - [2352, 1024, 2, 256]
    - [43, 31.719]
  - - [11264, 512, 2, 128]
    - [53, 23.628]
  - - [10560, 128, 2, 512]
    - [147, 32.353]
  - - [16128, 512, 2, 128]
    - [19, 25.418]
  - - [864, 256, 2, 2048]
    - [44, 27.003]
  - - [37632, 256, 2, 64]
    - [50, 14.859]
  - - [51520, 256, 2, 64]
    - [53, 14.871]
  - - [14000, 512, 2, 128]
    - [55, 25.94]
  - - [768, 256, 2, 2048]
    - [85, 28.622]
  - - [60800, 12, 2, 256]
    - [156, 6.515]
  - - [10560, 512, 2, 128]
    - [55, 23.699]
  - - [60800, 3, 2, 256]
    - [142, 1.985]
  - - [64512, 256, 2, 64]
    - [97, 17.11]
  - - [54400, 256, 2, 64]
    - [97, 15.319]
  - - [45632, 64, 2, 256]
    - [49, 23.077]
  - - [3264, 1024, 2, 256]
    - [19, 31.974]
  - - [60800, 64, 2, 256]
    - [153, 27.609]
  - - [10752, 512, 2, 128]
    - [55, 24.13]
  - - [3168, 1024, 2, 256]
    - [52, 31.398]
  - - [55296, 256, 2, 256]
    - [181, 40.605]
  - - [51520, 256, 2, 256]
    - [170, 37.131]
  - - [11408, 128, 2, 512]
    - [170, 34.171]
  - - [60800, 256, 2, 256]
    - [136, 40.535]
  - - [54400, 256, 2, 256]
    - [137, 40.288]
  - - [60800, 256, 2, 64]
    - [166, 15.807]
  - - [3800, 1024, 1, 256]
    - [55, 29.151]
  - - [3400, 1024, 1, 256]
    - [52, 26.922]
  - - [3072, 1024, 2, 256]
    - [55, 33.113]
  - - [3600, 1024, 2, 256]
    - [55, 35.033]
  - - [12288, 512, 2, 128]
    - [160, 24.588]
  - - [49152, 256, 2, 256]
    - [137, 40.28]
  - - [12880, 512, 2, 128]
    - [19, 24.416]
  - - [11408, 512, 2, 128]
    - [55, 24.17]
  - - [42240, 256, 2, 64]
    - [38, 15.199]
  - - [1008, 2048, 2, 512]
    - [61, 39.301]
  - - [3360, 1024, 2, 256]
    - [51, 32.483]
  - - [14208, 512, 2, 128]
    - [19, 24.919]
  - - [56832, 256, 2, 64]
    - [166, 15.326]
  - - [43008, 256, 2, 64]
    - [97, 15.18]
  - - [13600, 512, 2, 128]
    - [55, 24.825]
  - - [2640, 1024, 2, 256]
    - [55, 29.931]
  - - [13824, 512, 2, 128]
    - [160, 25.296]
  - - [3800, 256, 2, 1024]
    - [21, 38.634]
  - - [55296, 256, 2, 64]
    - [57, 15.235]
  - - [2640, 256, 2, 1024]
    - [49, 36.52]
  - - [15200, 512, 2, 128]
    - [160, 24.666]
  - - [3552, 1024, 2, 256]
    - [52, 33.896]
  - - [3456, 1024, 2, 256]
    - [94, 35.197]
  - - [49152, 256, 2, 64]
    - [162, 15.046]
  - - [3400, 1024, 2, 256]
    - [52, 33.754]
  - - [3800, 1024, 2, 256]
    - [43, 36.262]
  - - [6912, 256, 1, 512]
    - [49, 35.319]
  - - [6800, 256, 1, 512]
    - [49, 33.925]
  - - [27648, 128, 1, 256]
    - [57, 27.512]
  - - [27200, 128, 1, 256]
    - [139, 24.256]
  - - [30400, 128, 1, 256]
    - [23, 23.285]
  - - [7600, 256, 1, 512]
    - [21, 28.851]
  - - [6144, 1024, 1, 512]
    - [27, 45.195]
  - - [6912, 1024, 1, 512]
    - [75, 49.489]
  - - [6440, 1024, 1, 512]
    - [184, 47.97]
  - - [27648, 512, 1, 256]
    - [138, 38.7]
  - - [1728, 2048, 1, 1024]
    - [21, 49.609]
  - - [27200, 512, 1, 256]
    - [43, 35.546]
  - - [6800, 1024, 1, 512]
    - [160, 44.93]
  - - [7600, 1024, 1, 512]
    - [53, 47.809]
  - - [30400, 512, 1, 256]
    - [43, 35.771]
  - - [12544, 1024, 1, 1024]
    - [75, 60.985]
  - - [173280, 128, 1, 64]
    - [160, 12.815]
  - - [231040, 128, 1, 64]
    - [170, 13.002]
  - - [25992, 128, 1, 64]
    - [55, 9.482]
  - - [950, 512, 2, 2048]
    - [122, 31.749]
  - - [2852, 256, 2, 1024]
    - [82, 35.317]
  - - [3220, 256, 2, 1024]
    - [82, 39.791]
  - - [850, 2048, 2, 512]
    - [84, 33.641]
  - - [805, 2048, 2, 512]
    - [70, 31.283]
  - - [3036, 256, 2, 1024]
    - [82, 36.376]
  - - [713, 2048, 2, 512]
    - [70, 28.124]
  - - [850, 512, 2, 2048]
    - [185, 34.214]
  - - [850, 2048, 1, 512]
    - [66, 22.719]
  - - [660, 2048, 2, 512]
    - [82, 28.199]
  - - [726, 2048, 2, 512]
    - [66, 29.626]
  - - [805, 512, 2, 2048]
    - [185, 32.85]
  - - [3500, 256, 2, 1024]
    - [186, 34.864]
  - - [3700, 256, 2, 1024]
    - [66, 32.915]
  - - [748, 2048, 2, 512]
    - [84, 29.554]
  - - [950, 256, 2, 2048]
    - [95, 21.136]
  - - [850, 3, 2, 256]
    - [187, 0.102]
  - - [850, 12, 2, 256]
    - [30, 0.403]
  - - [805, 12, 2, 256]
    - [187, 0.384]
  - - [805, 3, 2, 256]
    - [187, 0.098]
  - - [247, 3, 2, 256]
    - [30, 0.032]
  - - [950, 3, 2, 256]
    - [188, 0.125]
  - - [187, 12, 2, 256]
    - [32, 0.089]
  - - [247, 12, 2, 256]
    - [31, 0.115]
  - - [187, 3, 2, 256]
    - [31, 0.025]
  - - [228, 12, 2, 256]
    - [93, 0.118]
  - - [221, 12, 2, 256]
    - [187, 0.103]
  - - [950, 12, 2, 256]
    - [187, 0.447]
  - - [228, 3, 2, 256]
    - [30, 0.029]
  - - [1900, 512, 1, 1024]
    - [82, 23.628]
  - - [1700, 512, 1, 1024]
    - [89, 24.979]
  - - [1610, 512, 1, 1024]
    - [89, 23.776]
  - - [3036, 1024, 2, 256]
    - [84, 27.675]
  - - [221, 3, 2, 256]
    - [178, 0.029]
  - - [2852, 1024, 2, 256]
    - [82, 26.572]
  - - [3220, 3, 2, 256]
    - [189, 0.379]
  - - [3220, 12, 2, 256]
    - [189, 1.486]
  - - [660, 512, 2, 2048]
    - [190, 29.148]
  - - [726, 512, 2, 2048]
    - [190, 30.741]
  - - [713, 512, 2, 2048]
    - [95, 29.555]
  - - [805, 256, 2, 2048]
    - [39, 22.971]
  - - [950, 2048, 1, 512]
    - [66, 24.83]
  - - [850, 256, 2, 2048]
    - [191, 23.085]
  - - [3700, 1024, 2, 256]
    - [70, 30.229]
  - - [3500, 1024, 2, 256]
    - [84, 30.225]
  - - [3220, 1024, 2, 256]
    - [84, 28.389]
  - - [950, 2048, 2, 512]
    - [192, 32.158]
  - - [1610, 2048, 1, 1024]
    - [82, 43.032]
  - - [1700, 2048, 1, 1024]
    - [66, 44.879]
  - - [1900, 2048, 1, 1024]
    - [70, 46.812]
  - - [100, 128, 120, 512]
    - [193, 15.682]
  - - [100, 128, 139, 512]
    - [193, 17.455]
  - - [100, 128, 160, 512]
    - [114, 18.842]
  - - [100, 128, 18, 512]
    - [93, 6.747]
  - - [100, 128, 19, 512]
    - [93, 7.121]
  - - [1444, 256, 120, 128]
    - [114, 26.588]
  - - [1444, 256, 139, 128]
    - [102, 26.809]
  - - [1444, 256, 160, 128]
    - [141, 27.104]
  - - [1444, 256, 18, 128]
    - [82, 16.864]
  - - [1444, 256, 19, 128]
    - [193, 17.494]
  - - [1444, 256, 120, 256]
    - [102, 39.404]
  - - [1444, 256, 139, 256]
    - [141, 39.426]
  - - [1444, 256, 160, 256]
    - [102, 40.262]
  - - [1444, 256, 18, 256]
    - [194, 27.107]
  - - [1444, 256, 19, 256]
    - [100, 27.865]
  - - [25, 128, 120, 256]
    - [195, 5.456]
  - - [25, 128, 139, 256]
    - [195, 6.08]
  - - [25, 128, 160, 256]
    - [195, 6.652]
  - - [25, 128, 18, 256]
    - [31, 1.138]
  - - [25, 128, 19, 256]
    - [188, 1.218]
  - - [361, 256, 120, 512]
    - [100, 34.673]
  - - [361, 256, 139, 512]
    - [102, 35.643]
  - - [361, 256, 160, 512]
    - [102, 36.296]
  - - [361, 256, 18, 512]
    - [82, 25.521]
  - - [361, 256, 19, 512]
    - [66, 21.551]
  - - [9, 128, 120, 256]
    - [196, 2.024]
  - - [9, 128, 139, 256]
    - [196, 2.275]
  - - [9, 128, 160, 256]
    - [196, 2.508]
  - - [9, 128, 18, 256]
    - [187, 0.427]
  - - [9, 128, 19, 256]
    - [187, 0.448]
  - - [1444, 128, 1, 576]
    - [189, 6.183]
  - - [200716, 128, 1, 64]
    - [197, 11.535]
  - - [22500, 64, 1, 147]
    - [87, 8.966]
  - - [25, 256, 1, 1152]
    - [32, 0.417]
  - - [27436, 128, 1, 64]
    - [87, 8.732]
  - - [361, 512, 1, 2304]
    - [191, 13.988]
  - - [9, 256, 1, 1152]
    - [187, 0.151]
  - - [64, 32, 16, 32]
    - [12, 0.13]
  - - [64, 48, 16, 48]
    - [12, 0.242]
  - - [64, 64, 16, 64]
    - [12, 0.473]
  - - [64, 80, 16, 80]
    - [12, 0.62]
  - - [64, 96, 16, 96]
    - [18, 0.967]
  - - [64, 112, 16, 112]
    - [18, 1.122]
  - - [64, 128, 16, 128]
    - [105, 1.616]
  - - [64, 144, 16, 144]
    - [98, 1.772]
  - - [64, 160, 16, 160]
    - [98, 2.441]
  - - [64, 176, 16, 176]
    - [98, 2.553]
  - - [64, 192, 16, 192]
    - [98, 3.375]
  - - [64, 208, 16, 208]
    - [12, 3.466]
  - - [64, 224, 16, 224]
    - [12, 4.32]
  - - [64, 240, 16, 240]
    - [9, 4.233]
  - - [64, 256, 16, 256]
    - [18, 5.601]
  - - [64, 272, 16, 272]
    - [12, 5.142]
  - - [64, 288, 16, 288]
    - [18, 6.884]
  - - [64, 304, 16, 304]
    - [12, 6.346]
  - - [64, 320, 16, 320]
    - [18, 7.622]
  - - [64, 336, 16, 336]
    - [196, 6.819]
  - - [64, 352, 16, 352]
    - [81, 8.263]
  - - [64, 368, 16, 368]
    - [107, 7.851]
  - - [64, 384, 16, 384]
    - [132, 8.954]
  - - [64, 400, 16, 400]
    - [79, 8.832]
  - - [64, 416, 16, 416]
    - [81, 10.851]
  - - [64, 432, 16, 432]
    - [79, 9.968]
  - - [64, 448, 16, 448]
    - [42, 12.123]
  - - [64, 464, 16, 464]
    - [42, 10.615]
  - - [64, 480, 16, 480]
    - [42, 13.291]
  - - [64, 496, 16, 496]
    - [42, 11.491]
  - - [1024, 6688, 1, 1024]
    - [138, 63.411]
  - - [1024, 6688, 1, 4096]
    - [27, 84.548]
  - - [4096, 6688, 1, 1024]
    - [75, 74.679]
  - - [1024, 5664, 1, 1024]
    - [66, 60.337]
  - - [1024, 5984, 1, 1024]
    - [21, 60.473]
  - - [1024, 7872, 1, 3072]
    - [66, 84.749]
  - - [1024, 7872, 1, 4096]
    - [68, 86.65]
  - - [1024, 5920, 1, 1024]
    - [61, 59.98]
  - - [1024, 7344, 1, 3072]
    - [21, 77.166]
  - - [1024, 7344, 1, 1024]
    - [21, 63.098]
  - - [1024, 7760, 1, 3072]
    - [21, 81.056]
  - - [1024, 7760, 1, 1024]
    - [21, 66.383]
  - - [1024, 7760, 1, 4096]
    - [34, 83.625]
  - - [4096, 5136, 1, 1024]
    - [53, 72.993]
  - - [1024, 5936, 1, 1024]
    - [21, 60.091]
  - - [1024, 6608, 1, 1024]
    - [73, 60.941]
  - - [1024, 6608, 1, 4096]
    - [27, 82.652]
  - - [1024, 6624, 1, 1024]
    - [75, 61.088]
  - - [1024, 6624, 1, 4096]
    - [75, 82.918]
  - - [1024, 6416, 1, 1024]
    - [21, 65.006]
  - - [1024, 7024, 1, 3072]
    - [71, 79.814]
  - - [1024, 7536, 1, 3072]
    - [21, 79.16]
  - - [1024, 7536, 1, 1024]
    - [21, 64.842]
  - - [1024, 7040, 1, 3072]
    - [171, 82.618]
  - - [1024, 6544, 1, 1024]
    - [26, 63.472]
  - - [1024, 6544, 1, 4096]
    - [75, 82.244]
  - - [4096, 5472, 1, 1024]
    - [53, 73.523]
  - - [1024, 7232, 1, 3072]
    - [21, 76.17]
  - - [1024, 7232, 1, 1024]
    - [21, 62.272]
  - - [1024, 6368, 1, 1024]
    - [21, 64.686]
  - - [1024, 7152, 1, 3072]
    - [66, 75.215]
  - - [1024, 5872, 1, 1024]
    - [21, 59.957]
  - - [1024, 6000, 1, 1024]
    - [21, 61.105]
  - - [1024, 6960, 1, 3072]
    - [65, 79.648]
  - - [1024, 6960, 1, 1024]
    - [50, 62.48]
  - - [1024, 6960, 1, 4096]
    - [144, 83.391]
  - - [4096, 6960, 1, 1024]
    - [26, 74.919]
  - - [1024, 8016, 1, 1024]
    - [61, 62.673]
  - - [1024, 6976, 1, 3072]
    - [71, 79.626]
  - - [1024, 6976, 1, 1024]
    - [49, 63.2]
  - - [1024, 5632, 1, 1024]
    - [49, 58.364]
  - - [1024, 6176, 1, 1024]
    - [21, 62.148]
  - - [4096, 6176, 1, 1024]
    - [53, 74.318]
  - - [4096, 5504, 1, 1024]
    - [53, 73.265]
  - - [4096, 5488, 1, 1024]
    - [53, 73.196]
  - - [1024, 5456, 1, 1024]
    - [23, 56.097]
  - - [4096, 5456, 1, 1024]
    - [53, 73.079]
  - - [1024, 6640, 1, 1024]
    - [73, 60.387]
  - - [1024, 6640, 1, 4096]
    - [75, 82.68]
  - - [1024, 7440, 1, 3072]
    - [21, 77.966]
  - - [1024, 7440, 1, 1024]
    - [21, 64.203]
  - - [1024, 6288, 1, 1024]
    - [21, 63.329]
  - - [1024, 6256, 1, 1024]
    - [21, 63.168]
  - - [1024, 7264, 1, 3072]
    - [21, 76.28]
  - - [1024, 7264, 1, 1024]
    - [21, 62.411]
  - - [1024, 6672, 1, 1024]
    - [129, 63.209]
  - - [1024, 6672, 1, 4096]
    - [75, 84.031]
  - - [1024, 6208, 1, 1024]
    - [21, 62.577]
  - - [4096, 6208, 1, 1024]
    - [53, 74.684]
  - - [1024, 7376, 1, 3072]
    - [21, 77.25]
  - - [1024, 7376, 1, 1024]
    - [21, 63.604]
  - - [1024, 6224, 1, 1024]
    - [21, 62.684]
  - - [4096, 6224, 1, 1024]
    - [53, 74.648]
  - - [1024, 6320, 1, 1024]
    - [21, 63.814]
  - - [1024, 8304, 1, 1024]
    - [43, 63.087]
  - - [1024, 6560, 1, 1024]
    - [61, 65.399]
  - - [1024, 6560, 1, 4096]
    - [24, 83.242]
  - - [1024, 5856, 1, 3072]
    - [66, 75.47]
  - - [1024, 5856, 1, 1024]
    - [66, 62.101]
  - - [1024, 5696, 1, 1024]
    - [49, 58.361]
  - - [1024, 7504, 1, 3072]
    - [21, 79.011]
  - - [1024, 4880, 1, 1024]
    - [21, 59.68]
  - - [1024, 7168, 1, 3072]
    - [21, 75.183]
  - - [1024, 7776, 1, 3072]
    - [66, 83.715]
  - - [1024, 7776, 1, 4096]
    - [66, 85.118]
  - - [1024, 6384, 1, 1024]
    - [21, 64.186]
  - - [1024, 4624, 1, 1024]
    - [21, 56.784]
  - - [1024, 7488, 1, 3072]
    - [66, 80.984]
  - - [1024, 7472, 1, 1024]
    - [21, 63.919]
  - - [1024, 6576, 1, 1024]
    - [75, 61.123]
  - - [1024, 6576, 1, 4096]
    - [73, 82.69]
  - - [1024, 6928, 1, 3072]
    - [144, 79.797]
  - - [1024, 6928, 1, 1024]
    - [38, 62.909]
  - - [1024, 6928, 1, 4096]
    - [65, 82.651]
  - - [1024, 5792, 1, 1024]
    - [21, 58.383]
  - - [1024, 6704, 1, 1024]
    - [75, 63.665]
  - - [1024, 6016, 1, 1024]
    - [49, 61.427]
  - - [1024, 11248, 1, 3072]
    - [66, 80.485]
  - - [1024, 11248, 1, 4096]
    - [66, 82.05]
  - - [1024, 27, 1, 2]
    - [12, 0.006]
  - - [1024, 14912, 1, 1024]
    - [61, 65.685]
  - - [1024, 2098, 1, 30528]
    - [37, 73.943]
  - - [1024, 2100, 1, 30528]
    - [37, 73.762]
  - - [1024, 2107, 1, 30528]
    - [37, 74.038]
  - - [1024, 2112, 1, 30528]
    - [37, 74.302]
  - - [1024, 2121, 1, 30528]
    - [37, 74.619]
  - - [1024, 2146, 1, 30528]
    - [37, 75.423]
  - - [1024, 2158, 1, 30528]
    - [37, 75.724]
  - - [1024, 2182, 1, 30528]
    - [37, 76.164]
  - - [1024, 2217, 1, 30528]
    - [37, 77.225]
  - - [1024, 2243, 1, 30528]
    - [37, 78.154]
  - - [1024, 2251, 1, 30528]
    - [37, 78.604]
  - - [1024, 12368, 1, 1024]
    - [61, 62.388]
  - - [1024, 13904, 1, 1024]
    - [75, 66.02]
  - - [1024, 14208, 1, 3072]
    - [66, 76.807]
  - - [1024, 14224, 1, 3072]
    - [66, 76.277]
  - - [1024, 14240, 1, 3072]
    - [66, 76.225]
  - - [1024, 14256, 1, 3072]
    - [66, 76.276]
  - - [1024, 14272, 1, 3072]
    - [66, 75.971]
  - - [1024, 14288, 1, 3072]
    - [66, 75.988]
  - - [1024, 14304, 1, 3072]
    - [66, 77.409]
  - - [1024, 14320, 1, 3072]
    - [66, 76.688]
  - - [1024, 14400, 1, 3072]
    - [66, 77.668]
  - - [1024, 14416, 1, 3072]
    - [66, 76.554]
  - - [1024, 14496, 1, 3072]
    - [66, 78.114]
  - - [1024, 14880, 1, 1024]
    - [61, 65.471]
  - - [1024, 14896, 1, 1024]
    - [61, 65.885]
  - - [1024, 14944, 1, 1024]
    - [61, 65.557]
  - - [1024, 14960, 1, 1024]
    - [61, 65.167]
  - - [1024, 15520, 1, 1024]
    - [52, 64.925]
  - - [1024, 16928, 1, 3072]
    - [75, 79.717]
  - - [1024, 1751, 1, 1024]
    - [45, 35.975]
  - - [1024, 1751, 1, 30528]
    - [24, 70.544]
  - - [1024, 1759, 1, 1024]
    - [45, 35.89]
  - - [1024, 1759, 1, 30528]
    - [64, 70.802]
  - - [1024, 1768, 1, 1024]
    - [45, 35.341]
  - - [1024, 1768, 1, 30528]
    - [64, 70.736]
  - - [1024, 1788, 1, 1024]
    - [45, 35.741]
  - - [1024, 1799, 1, 1024]
    - [45, 36.455]
  - - [1024, 1928, 1, 1024]
    - [21, 37.899]
  - - [1024, 1936, 1, 1024]
    - [21, 38.056]
  - - [1024, 1995, 1, 1024]
    - [24, 38.261]
  - - [1024, 2080, 1, 1024]
    - [67, 42.148]
  - - [1024, 2081, 1, 30528]
    - [37, 73.27]
  - - [1024, 2082, 1, 30528]
    - [37, 73.349]
  - - [1024, 2083, 1, 30528]
    - [37, 73.48]
  - - [1024, 2084, 1, 30528]
    - [37, 73.405]
  - - [1024, 2085, 1, 30528]
    - [37, 73.206]
  - - [1024, 2086, 1, 30528]
    - [37, 73.366]
  - - [1024, 2087, 1, 30528]
    - [37, 73.298]
  - - [1024, 2088, 1, 30528]
    - [37, 73.26]
  - - [1024, 2089, 1, 30528]
    - [37, 73.493]
  - - [1024, 2090, 1, 30528]
    - [37, 73.587]
  - - [1024, 2091, 1, 30528]
    - [37, 73.681]
  - - [1024, 2092, 1, 30528]
    - [37, 73.511]
  - - [1024, 2093, 1, 30528]
    - [37, 73.421]
  - - [1024, 2094, 1, 30528]
    - [37, 73.603]
  - - [1024, 2095, 1, 30528]
    - [37, 73.734]
  - - [1024, 2096, 1, 30528]
    - [37, 73.666]
  - - [1024, 2097, 1, 30528]
    - [37, 73.694]
  - - [1024, 2099, 1, 30528]
    - [37, 73.838]
  - - [1024, 2101, 1, 30528]
    - [37, 74.048]
  - - [1024, 2102, 1, 30528]
    - [37, 73.818]
  - - [1024, 2103, 1, 30528]
    - [37, 74.201]
  - - [1024, 2104, 1, 30528]
    - [37, 73.844]
  - - [1024, 2105, 1, 30528]
    - [37, 74.167]
  - - [1024, 2106, 1, 30528]
    - [37, 73.936]
  - - [1024, 2108, 1, 30528]
    - [37, 74.132]
  - - [1024, 2109, 1, 30528]
    - [37, 73.938]
  - - [1024, 2110, 1, 30528]
    - [37, 74.232]
  - - [1024, 2111, 1, 30528]
    - [37, 74.164]
  - - [1024, 2113, 1, 30528]
    - [37, 74.152]
  - - [1024, 2114, 1, 30528]
    - [37, 74.455]
  - - [1024, 2115, 1, 30528]
    - [37, 74.193]
  - - [1024, 2116, 1, 30528]
    - [37, 74.295]
  - - [1024, 2117, 1, 30528]
    - [37, 74.434]
  - - [1024, 2118, 1, 30528]
    - [37, 74.328]
  - - [1024, 2119, 1, 30528]
    - [37, 74.75]
  - - [1024, 2120, 1, 30528]
    - [37, 74.48]
  - - [1024, 2122, 1, 30528]
    - [37, 74.498]
  - - [1024, 2123, 1, 30528]
    - [37, 74.54]
  - - [1024, 2124, 1, 30528]
    - [37, 74.762]
  - - [1024, 2125, 1, 30528]
    - [37, 74.492]
  - - [1024, 2126, 1, 30528]
    - [37, 74.862]
  - - [1024, 2127, 1, 30528]
    - [37, 75.002]
  - - [1024, 2128, 1, 30528]
    - [37, 74.716]
  - - [1024, 2129, 1, 30528]
    - [37, 74.998]
  - - [1024, 2130, 1, 30528]
    - [37, 74.734]
  - - [1024, 2131, 1, 30528]
    - [37, 74.829]
  - - [1024, 2132, 1, 30528]
    - [37, 74.871]
  - - [1024, 2133, 1, 30528]
    - [37, 74.921]
  - - [1024, 2134, 1, 30528]
    - [37, 75.151]
  - - [1024, 2135, 1, 30528]
    - [37, 74.947]
  - - [1024, 2136, 1, 30528]
    - [37, 75.132]
  - - [1024, 2137, 1, 30528]
    - [37, 75.122]
  - - [1024, 2138, 1, 30528]
    - [37, 74.985]
  - - [1024, 2139, 1, 30528]
    - [37, 75.177]
  - - [1024, 2140, 1, 30528]
    - [37, 75.003]
  - - [1024, 2141, 1, 30528]
    - [37, 75.489]
  - - [1024, 2142, 1, 30528]
    - [37, 75.328]
  - - [1024, 2143, 1, 30528]
    - [37, 75.295]
  - - [1024, 2144, 1, 30528]
    - [37, 75.195]
  - - [1024, 2145, 1, 30528]
    - [37, 75.253]
  - - [1024, 2147, 1, 30528]
    - [37, 75.293]
  - - [1024, 2148, 1, 30528]
    - [37, 75.403]
  - - [1024, 2149, 1, 30528]
    - [37, 75.521]
  - - [1024, 2150, 1, 30528]
    - [37, 75.383]
  - - [1024, 2151, 1, 30528]
    - [37, 75.614]
  - - [1024, 2152, 1, 30528]
    - [37, 75.483]
  - - [1024, 2153, 1, 30528]
    - [37, 75.647]
  - - [1024, 2154, 1, 30528]
    - [37, 75.584]
  - - [1024, 2155, 1, 30528]
    - [37, 75.619]
  - - [1024, 2156, 1, 30528]
    - [37, 75.888]
  - - [1024, 2157, 1, 30528]
    - [37, 75.704]
  - - [1024, 2159, 1, 30528]
    - [37, 75.369]
  - - [1024, 2160, 1, 30528]
    - [37, 75.756]
  - - [1024, 2161, 1, 30528]
    - [37, 75.867]
  - - [1024, 2162, 1, 30528]
    - [37, 75.834]
  - - [1024, 2163, 1, 30528]
    - [37, 76.013]
  - - [1024, 2164, 1, 30528]
    - [37, 75.889]
  - - [1024, 2165, 1, 30528]
    - [37, 76.015]
  - - [1024, 2166, 1, 30528]
    - [37, 75.974]
  - - [1024, 2167, 1, 30528]
    - [37, 76.176]
  - - [1024, 2168, 1, 30528]
    - [37, 76.022]
  - - [1024, 2169, 1, 30528]
    - [37, 75.959]
  - - [1024, 2170, 1, 30528]
    - [37, 76.145]
  - - [1024, 2171, 1, 30528]
    - [37, 75.961]
  - - [1024, 2172, 1, 30528]
    - [37, 76.109]
  - - [1024, 2173, 1, 30528]
    - [37, 76.357]
  - - [1024, 2174, 1, 30528]
    - [37, 76.202]
  - - [1024, 2175, 1, 30528]
    - [37, 76.343]
  - - [1024, 2176, 1, 30528]
    - [37, 76.234]
  - - [1024, 2177, 1, 30528]
    - [37, 75.959]
  - - [1024, 2178, 1, 30528]
    - [37, 76.085]
  - - [1024, 2179, 1, 30528]
    - [37, 76.218]
  - - [1024, 2180, 1, 30528]
    - [37, 76.094]
  - - [1024, 2181, 1, 30528]
    - [37, 76.22]
  - - [1024, 2183, 1, 30528]
    - [37, 76.206]
  - - [1024, 2184, 1, 30528]
    - [37, 76.302]
  - - [1024, 2185, 1, 30528]
    - [37, 76.125]
  - - [1024, 2186, 1, 30528]
    - [37, 76.615]
  - - [1024, 2187, 1, 30528]
    - [37, 76.597]
  - - [1024, 2188, 1, 30528]
    - [37, 76.426]
  - - [1024, 2189, 1, 30528]
    - [37, 76.492]
  - - [1024, 2190, 1, 30528]
    - [37, 76.549]
  - - [1024, 2191, 1, 30528]
    - [37, 76.357]
  - - [1024, 2192, 1, 30528]
    - [37, 76.612]
  - - [1024, 2193, 1, 30528]
    - [37, 76.502]
  - - [1024, 2194, 1, 30528]
    - [37, 76.872]
  - - [1024, 2195, 1, 30528]
    - [37, 76.762]
  - - [1024, 2196, 1, 30528]
    - [37, 76.683]
  - - [1024, 2197, 1, 30528]
    - [37, 76.589]
  - - [1024, 2198, 1, 30528]
    - [37, 76.692]
  - - [1024, 2199, 1, 30528]
    - [37, 76.681]
  - - [1024, 2200, 1, 30528]
    - [37, 76.785]
  - - [1024, 2201, 1, 30528]
    - [37, 76.728]
  - - [1024, 2202, 1, 30528]
    - [37, 76.839]
  - - [1024, 2203, 1, 30528]
    - [37, 76.821]
  - - [1024, 2204, 1, 30528]
    - [37, 77.154]
  - - [1024, 2205, 1, 30528]
    - [37, 76.868]
  - - [1024, 2206, 1, 30528]
    - [37, 77.07]
  - - [1024, 2207, 1, 30528]
    - [37, 77.098]
  - - [1024, 2208, 1, 30528]
    - [37, 76.965]
  - - [1024, 2209, 1, 30528]
    - [37, 77.106]
  - - [1024, 2210, 1, 30528]
    - [37, 76.981]
  - - [1024, 2211, 1, 30528]
    - [37, 77.108]
  - - [1024, 2212, 1, 30528]
    - [37, 77.265]
  - - [1024, 2213, 1, 30528]
    - [37, 77.215]
  - - [1024, 2214, 1, 30528]
    - [37, 77.535]
  - - [1024, 2215, 1, 30528]
    - [37, 77.064]
  - - [1024, 2216, 1, 30528]
    - [37, 77.198]
  - - [1024, 2218, 1, 30528]
    - [37, 77.321]
  - - [1024, 2219, 1, 30528]
    - [37, 77.402]
  - - [1024, 2220, 1, 30528]
    - [37, 77.345]
  - - [1024, 2221, 1, 30528]
    - [37, 77.364]
  - - [1024, 2222, 1, 30528]
    - [37, 77.761]
  - - [1024, 2223, 1, 30528]
    - [37, 77.457]
  - - [1024, 2224, 1, 30528]
    - [37, 77.522]
  - - [1024, 2225, 1, 30528]
    - [37, 77.673]
  - - [1024, 2226, 1, 30528]
    - [37, 77.515]
  - - [1024, 2227, 1, 30528]
    - [37, 77.627]
  - - [1024, 2228, 1, 30528]
    - [37, 77.885]
  - - [1024, 2229, 1, 30528]
    - [37, 77.643]
  - - [1024, 2230, 1, 30528]
    - [37, 78.033]
  - - [1024, 2231, 1, 30528]
    - [37, 77.751]
  - - [1024, 2232, 1, 30528]
    - [37, 77.817]
  - - [1024, 2233, 1, 30528]
    - [37, 77.736]
  - - [1024, 2234, 1, 30528]
    - [37, 77.91]
  - - [1024, 2235, 1, 30528]
    - [37, 77.929]
  - - [1024, 2236, 1, 30528]
    - [37, 77.81]
  - - [1024, 2237, 1, 30528]
    - [37, 77.86]
  - - [1024, 2238, 1, 30528]
    - [37, 77.81]
  - - [1024, 2239, 1, 30528]
    - [37, 78.007]
  - - [1024, 2240, 1, 30528]
    - [37, 78.103]
  - - [1024, 2241, 1, 30528]
    - [37, 78.13]
  - - [1024, 2242, 1, 30528]
    - [37, 78.08]
  - - [1024, 2244, 1, 30528]
    - [37, 78.212]
  - - [1024, 2245, 1, 30528]
    - [37, 78.503]
  - - [1024, 2246, 1, 30528]
    - [37, 78.073]
  - - [1024, 2247, 1, 30528]
    - [37, 78.185]
  - - [1024, 2248, 1, 30528]
    - [37, 78.258]
  - - [1024, 2249, 1, 30528]
    - [37, 78.17]
  - - [1024, 2250, 1, 30528]
    - [37, 78.282]
  - - [1024, 2252, 1, 30528]
    - [37, 78.631]
  - - [1024, 2253, 1, 30528]
    - [37, 78.401]
  - - [1024, 2254, 1, 30528]
    - [37, 78.428]
  - - [1024, 2255, 1, 30528]
    - [37, 78.518]
  - - [1024, 2256, 1, 30528]
    - [34, 76.217]
  - - [1024, 2257, 1, 30528]
    - [37, 78.618]
  - - [1024, 2258, 1, 30528]
    - [37, 78.903]
  - - [1024, 2259, 1, 30528]
    - [37, 78.579]
  - - [1024, 2260, 1, 30528]
    - [37, 78.505]
  - - [1024, 2261, 1, 30528]
    - [37, 78.758]
  - - [1024, 2262, 1, 30528]
    - [37, 78.652]
  - - [1024, 2263, 1, 30528]
    - [37, 78.788]
  - - [1024, 2264, 1, 30528]
    - [37, 78.909]
  - - [1024, 2265, 1, 30528]
    - [37, 79.061]
  - - [1024, 2266, 1, 30528]
    - [37, 78.869]
  - - [1024, 2267, 1, 30528]
    - [37, 78.873]
  - - [1024, 2268, 1, 30528]
    - [37, 78.923]
  - - [1024, 2269, 1, 30528]
    - [37, 79.013]
  - - [1024, 2270, 1, 30528]
    - [37, 79.189]
  - - [1024, 2271, 1, 30528]
    - [37, 79.036]
  - - [1024, 2272, 1, 30528]
    - [37, 79.109]
  - - [1024, 2273, 1, 30528]
    - [37, 79.09]
  - - [1024, 2274, 1, 30528]
    - [37, 79.101]
  - - [1024, 2275, 1, 30528]
    - [37, 79.183]
  - - [1024, 2276, 1, 30528]
    - [37, 79.038]
  - - [1024, 2277, 1, 30528]
    - [37, 79.002]
  - - [1024, 2278, 1, 30528]
    - [37, 79.405]
  - - [1024, 2279, 1, 30528]
    - [37, 79.361]
  - - [1024, 2280, 1, 30528]
    - [37, 79.522]
  - - [1024, 2281, 1, 30528]
    - [37, 79.227]
  - - [1024, 2282, 1, 30528]
    - [37, 79.473]
  - - [1024, 2283, 1, 30528]
    - [37, 79.603]
  - - [1024, 2284, 1, 30528]
    - [37, 79.48]
  - - [1024, 2285, 1, 30528]
    - [37, 79.594]
  - - [1024, 2286, 1, 30528]
    - [37, 79.456]
  - - [1024, 2287, 1, 30528]
    - [37, 79.326]
  - - [1024, 2288, 1, 30528]
    - [37, 79.415]
  - - [1024, 2289, 1, 30528]
    - [37, 79.694]
  - - [1024, 2290, 1, 30528]
    - [37, 79.634]
  - - [1024, 2291, 1, 30528]
    - [37, 79.629]
  - - [1024, 2292, 1, 30528]
    - [37, 79.656]
  - - [1024, 2293, 1, 30528]
    - [37, 79.793]
  - - [1024, 2294, 1, 30528]
    - [37, 79.734]
  - - [1024, 2295, 1, 30528]
    - [37, 79.643]
  - - [1024, 2296, 1, 30528]
    - [37, 79.819]
  - - [1024, 2297, 1, 30528]
    - [37, 79.854]
  - - [1024, 2298, 1, 30528]
    - [37, 80.015]
  - - [1024, 2299, 1, 30528]
    - [37, 79.844]
  - - [1024, 2300, 1, 30528]
    - [37, 79.761]
  - - [1024, 2301, 1, 30528]
    - [37, 79.819]
  - - [1024, 2302, 1, 30528]
    - [37, 79.642]
  - - [1024, 2303, 1, 30528]
    - [37, 80.039]
  - - [1024, 2330, 1, 30528]
    - [34, 78.259]
  - - [1024, 2339, 1, 30528]
    - [35, 78.591]
  - - [1024, 2340, 1, 1024]
    - [21, 45.769]
  - - [1024, 2352, 1, 30528]
    - [34, 78.81]
  - - [1024, 2353, 1, 1024]
    - [21, 45.347]
  - - [1024, 2353, 1, 30528]
    - [34, 78.918]
  - - [1024, 2354, 1, 1024]
    - [21, 46.272]
  - - [1024, 2354, 1, 30528]
    - [35, 78.922]
  - - [1024, 2363, 1, 30528]
    - [34, 79.224]
  - - [1024, 2384, 1, 30528]
    - [35, 79.928]
  - - [1024, 2386, 1, 1024]
    - [21, 46.058]
  - - [1024, 2386, 1, 30528]
    - [34, 79.934]
  - - [1024, 2387, 1, 30528]
    - [34, 79.914]
  - - [1024, 2391, 1, 30528]
    - [34, 80.086]
  - - [1024, 2392, 1, 1024]
    - [21, 45.726]
  - - [1024, 2396, 1, 30528]
    - [34, 80.223]
  - - [1024, 2400, 1, 1024]
    - [66, 50.006]
  - - [1024, 2412, 1, 30528]
    - [34, 80.743]
  - - [1024, 2413, 1, 30528]
    - [34, 80.846]
  - - [1024, 2465, 1, 30528]
    - [34, 82.455]
  - - [4096, 13440, 1, 1024]
    - [75, 71.634]
  - - [64, 16, 16, 16]
    - [12, 0.023]
  - - [2400, 1024, 1, 256]
    - [21, 23.786]
  - - [2400, 512, 1, 256]
    - [130, 14.525]
  - - [256, 1024, 1, 12840]
    - [111, 40.299]
  - - [256, 1024, 1, 2400]
    - [42, 17.809]
  - - [256, 1024, 1, 256]
    - [191, 4.421]
  - - [256, 1024, 1, 3200]
    - [85, 23.278]
  - - [256, 1024, 1, 9630]
    - [111, 33.738]
  - - [256, 512, 1, 12840]
    - [106, 22.228]
  - - [256, 512, 1, 2400]
    - [41, 9.683]
  - - [256, 512, 1, 256]
    - [11, 2.378]
  - - [256, 512, 1, 3200]
    - [191, 12.771]
  - - [256, 512, 1, 9630]
    - [106, 18.255]
  - - [4800, 1024, 1, 256]
    - [52, 35.352]
  - - [4800, 512, 1, 256]
    - [49, 22.081]
  - - [642, 163840, 1, 10]
    - [70, 3.766]
  - - [642, 163840, 1, 30]
    - [84, 10.638]
  - - [642, 81920, 1, 10]
    - [84, 3.516]
  - - [642, 81920, 1, 30]
    - [70, 9.886]
  - - [15, 642, 1024, 160]
    - [196, 8.489]
  - - [15, 642, 512, 160]
    - [195, 8.007]
  - - [20, 642, 1024, 160]
    - [196, 11.693]
  - - [20, 642, 512, 160]
    - [196, 10.628]
  - - [40, 642, 1024, 160]
    - [16, 20.745]
  - - [40, 642, 512, 160]
    - [16, 19.022]
  - - [642, 160, 1024, 15]
    - [87, 3.824]
  - - [642, 160, 512, 15]
    - [87, 3.686]
  - - [642, 160, 1024, 40]
    - [87, 9.39]
  - - [642, 160, 512, 40]
    - [87, 9.081]
  - - [512, 1024, 1, 1024]
    - [198, 34.937]
  - - [1024, 1, 1, 256]
    - [161, 0.019]
  - - [1024, 1, 1, 512]
    - [99, 0.035]
  - - [2200, 1, 1, 1024]
    - [99, 0.124]
  - - [2200, 1, 1, 256]
    - [10, 0.038]
  - - [2200, 1, 1, 512]
    - [99, 0.072]
  - - [4000, 1, 1, 1024]
    - [10, 0.22]
  - - [4000, 1, 1, 256]
    - [10, 0.073]
  - - [4000, 1, 1, 512]
    - [99, 0.129]
  - - [1024, 1024, 1, 1]
    - [33, 0.057]
  - - [1024, 256, 1, 1]
    - [9, 0.019]
  - - [2200, 1024, 1, 1]
    - [33, 0.098]
  - - [2200, 1024, 1, 2200]
    - [21, 49.989]
  - - [2200, 256, 1, 1]
    - [110, 0.035]
  - - [2200, 256, 1, 2200]
    - [117, 26.897]
  - - [2200, 512, 1, 1]
    - [33, 0.062]
  - - [2200, 512, 1, 2200]
    - [63, 39.212]
  - - [4000, 1024, 1, 1]
    - [14, 0.135]
  - - [4000, 1024, 1, 4000]
    - [119, 69.787]
  - - [4000, 256, 1, 1]
    - [33, 0.057]
  - - [4000, 256, 1, 4000]
    - [147, 46.849]
  - - [4000, 512, 1, 1]
    - [46, 0.086]
  - - [4000, 512, 1, 4000]
    - [119, 64.767]
  - - [1, 1024, 1, 1024]
    - [199, 0.026]
  - - [1, 1024, 1, 2200]
    - [200, 0.046]
  - - [1, 1024, 1, 4000]
    - [200, 0.062]
  - - [1, 256, 1, 1024]
    - [199, 0.008]
  - - [1, 256, 1, 2200]
    - [200, 0.015]
  - - [1, 256, 1, 4000]
    - [200, 0.023]
  - - [1, 512, 1, 1024]
    - [199, 0.016]
  - - [1, 512, 1, 2200]
    - [200, 0.028]
  - - [1, 512, 1, 4000]
    - [200, 0.039]
  - - [256, 1024, 1, 7616]
    - [134, 31.815]
  - - [256, 512, 1, 7616]
    - [134, 16.836]
  - - [7616, 1024, 1, 256]
    - [55, 35.59]
  - - [7616, 512, 1, 256]
    - [49, 24.238]
  - - [1024, 1024, 1, 2048]
    - [63, 40.526]
  - - [1024, 512, 1, 2048]
    - [47, 28.067]
  - - [2048, 1024, 1, 1024]
    - [21, 40.19]
  - - [2048, 512, 1, 1024]
    - [82, 28.067]
  - - [128, 1024, 1, 3465]
    - [44, 11.345]
  - - [128, 1024, 1, 9375]
    - [106, 17.524]
  - - [128, 512, 1, 3465]
    - [127, 7.009]
  - - [128, 512, 1, 9375]
    - [106, 11.237]
  - - [3465, 1024, 1, 2048]
    - [122, 52.886]
  - - [3465, 512, 1, 2048]
    - [95, 44.062]
  - - [9375, 1024, 1, 2048]
    - [109, 61.994]
  - - [9375, 512, 1, 2048]
    - [114, 54.991]
  - - [8, 256, 1, 8192]
    - [201, 0.765]
  - - [8, 256, 1, 4096]
    - [202, 0.415]
  - - [1, 2048, 1, 2048]
    - [203, 0.312]
  - - [2, 64, 1, 64]
    - [204, 0.001]
  - - [2, 64, 1, 128]
    - [205, 0.001]
  - - [2, 64, 1, 256]
    - [206, 0.002]
  - - [2, 64, 1, 512]
    - [207, 0.004]
  - - [2, 64, 1, 1024]
    - [207, 0.006]
  - - [2, 64, 1, 2048]
    - [208, 0.01]
  - - [2, 64, 1, 4096]
    - [207, 0.015]
  - - [2, 64, 1, 8192]
    - [209, 0.027]
  - - [2, 128, 1, 64]
    - [210, 0.001]
  - - [2, 128, 1, 128]
    - [211, 0.003]
  - - [2, 128, 1, 256]
    - [211, 0.005]
  - - [2, 128, 1, 512]
    - [212, 0.007]
  - - [2, 128, 1, 1024]
    - [207, 0.013]
  - - [2, 128, 1, 2048]
    - [207, 0.021]
  - - [2, 128, 1, 4096]
    - [213, 0.03]
  - - [2, 128, 1, 8192]
    - [214, 0.054]
  - - [2, 256, 1, 64]
    - [206, 0.002]
  - - [2, 256, 1, 128]
    - [5, 0.005]
  - - [2, 256, 1, 256]
    - [81, 0.009]
  - - [2, 256, 1, 512]
    - [207, 0.015]
  - - [2, 256, 1, 1024]
    - [207, 0.027]
  - - [2, 256, 1, 2048]
    - [207, 0.044]
  - - [2, 256, 1, 4096]
    - [207, 0.062]
  - - [2, 256, 1, 8192]
    - [209, 0.106]
  - - [2, 512, 1, 64]
    - [5, 0.005]
  - - [2, 512, 1, 128]
    - [81, 0.009]
  - - [2, 512, 1, 256]
    - [81, 0.017]
  - - [2, 512, 1, 512]
    - [207, 0.03]
  - - [2, 512, 1, 1024]
    - [207, 0.054]
  - - [2, 512, 1, 2048]
    - [207, 0.087]
  - - [2, 512, 1, 4096]
    - [207, 0.125]
  - - [2, 512, 1, 8192]
    - [215, 0.2]
  - - [2, 1024, 1, 64]
    - [216, 0.009]
  - - [2, 1024, 1, 128]
    - [217, 0.018]
  - - [2, 1024, 1, 256]
    - [206, 0.033]
  - - [2, 1024, 1, 512]
    - [207, 0.06]
  - - [2, 1024, 1, 1024]
    - [218, 0.107]
  - - [2, 1024, 1, 2048]
    - [207, 0.172]
  - - [2, 1024, 1, 4096]
    - [207, 0.251]
  - - [2, 1024, 1, 8192]
    - [219, 0.35]
  - - [2, 2048, 1, 64]
    - [5, 0.019]
  - - [2, 2048, 1, 128]
    - [81, 0.036]
  - - [2, 2048, 1, 256]
    - [220, 0.066]
  - - [2, 2048, 1, 512]
    - [208, 0.119]
  - - [2, 2048, 1, 1024]
    - [208, 0.216]
  - - [2, 2048, 1, 2048]
    - [207, 0.34]
  - - [2, 2048, 1, 4096]
    - [207, 0.496]
  - - [2, 2048, 1, 8192]
    - [207, 0.621]
  - - [2, 4096, 1, 64]
    - [205, 0.037]
  - - [2, 4096, 1, 128]
    - [221, 0.07]
  - - [2, 4096, 1, 256]
    - [222, 0.131]
  - - [2, 4096, 1, 512]
    - [208, 0.242]
  - - [2, 4096, 1, 1024]
    - [208, 0.42]
  - - [2, 4096, 1, 2048]
    - [208, 0.654]
  - - [2, 4096, 1, 4096]
    - [208, 0.911]
  - - [2, 4096, 1, 8192]
    - [223, 0.893]
  - - [2, 8192, 1, 64]
    - [210, 0.074]
  - - [2, 8192, 1, 128]
    - [206, 0.137]
  - - [2, 8192, 1, 256]
    - [224, 0.258]
  - - [2, 8192, 1, 512]
    - [207, 0.463]
  - - [2, 8192, 1, 1024]
    - [218, 0.75]
  - - [2, 8192, 1, 2048]
    - [208, 0.982]
  - - [2, 8192, 1, 4096]
    - [225, 1.217]
  - - [2, 8192, 1, 8192]
    - [209, 1.161]
  - - [4, 64, 1, 64]
    - [196, 0.001]
  - - [4, 64, 1, 128]
    - [196, 0.003]
  - - [4, 64, 1, 256]
    - [196, 0.005]
  - - [4, 64, 1, 512]
    - [226, 0.008]
  - - [4, 64, 1, 1024]
    - [227, 0.013]
  - - [4, 64, 1, 2048]
    - [228, 0.021]
  - - [4, 64, 1, 4096]
    - [229, 0.031]
  - - [4, 64, 1, 8192]
    - [230, 0.054]
  - - [4, 128, 1, 64]
    - [231, 0.002]
  - - [4, 128, 1, 128]
    - [232, 0.005]
  - - [4, 128, 1, 256]
    - [189, 0.009]
  - - [4, 128, 1, 512]
    - [233, 0.015]
  - - [4, 128, 1, 1024]
    - [227, 0.027]
  - - [4, 128, 1, 2048]
    - [229, 0.044]
  - - [4, 128, 1, 4096]
    - [233, 0.065]
  - - [4, 128, 1, 8192]
    - [230, 0.108]
  - - [4, 256, 1, 64]
    - [187, 0.005]
  - - [4, 256, 1, 128]
    - [178, 0.01]
  - - [4, 256, 1, 256]
    - [30, 0.019]
  - - [4, 256, 1, 512]
    - [30, 0.034]
  - - [4, 256, 1, 1024]
    - [233, 0.057]
  - - [4, 256, 1, 2048]
    - [229, 0.093]
  - - [4, 256, 1, 4096]
    - [233, 0.135]
  - - [4, 256, 1, 8192]
    - [230, 0.212]
  - - [4, 512, 1, 64]
    - [178, 0.011]
  - - [4, 512, 1, 128]
    - [30, 0.02]
  - - [4, 512, 1, 256]
    - [30, 0.036]
  - - [4, 512, 1, 512]
    - [30, 0.066]
  - - [4, 512, 1, 1024]
    - [229, 0.114]
  - - [4, 512, 1, 2048]
    - [233, 0.185]
  - - [4, 512, 1, 4096]
    - [233, 0.268]
  - - [4, 512, 1, 8192]
    - [230, 0.4]
  - - [4, 1024, 1, 64]
    - [187, 0.021]
  - - [4, 1024, 1, 128]
    - [231, 0.037]
  - - [4, 1024, 1, 256]
    - [234, 0.069]
  - - [4, 1024, 1, 512]
    - [229, 0.126]
  - - [4, 1024, 1, 1024]
    - [235, 0.232]
  - - [4, 1024, 1, 2048]
    - [233, 0.365]
  - - [4, 1024, 1, 4096]
    - [233, 0.531]
  - - [4, 1024, 1, 8192]
    - [236, 0.707]
  - - [4, 2048, 1, 64]
    - [231, 0.04]
  - - [4, 2048, 1, 128]
    - [237, 0.073]
  - - [4, 2048, 1, 256]
    - [234, 0.137]
  - - [4, 2048, 1, 512]
    - [233, 0.257]
  - - [4, 2048, 1, 1024]
    - [229, 0.454]
  - - [4, 2048, 1, 2048]
    - [229, 0.724]
  - - [4, 2048, 1, 4096]
    - [227, 1.036]
  - - [4, 2048, 1, 8192]
    - [233, 1.26]
  - - [4, 4096, 1, 64]
    - [231, 0.076]
  - - [4, 4096, 1, 128]
    - [231, 0.145]
  - - [4, 4096, 1, 256]
    - [231, 0.273]
  - - [4, 4096, 1, 512]
    - [233, 0.503]
  - - [4, 4096, 1, 1024]
    - [235, 0.855]
  - - [4, 4096, 1, 2048]
    - [233, 1.35]
  - - [4, 4096, 1, 4096]
    - [228, 1.837]
  - - [4, 4096, 1, 8192]
    - [238, 1.79]
  - - [4, 8192, 1, 64]
    - [231, 0.154]
  - - [4, 8192, 1, 128]
    - [222, 0.286]
  - - [4, 8192, 1, 256]
    - [231, 0.54]
  - - [4, 8192, 1, 512]
    - [239, 0.927]
  - - [4, 8192, 1, 1024]
    - [229, 1.477]
  - - [4, 8192, 1, 2048]
    - [233, 2.0]
  - - [4, 8192, 1, 4096]
    - [240, 2.475]
  - - [4, 8192, 1, 8192]
    - [241, 2.24]
  - - [8, 64, 1, 64]
    - [10, 0.003]
  - - [8, 64, 1, 128]
    - [10, 0.005]
  - - [8, 64, 1, 256]
    - [13, 0.009]
  - - [8, 64, 1, 512]
    - [99, 0.017]
  - - [8, 64, 1, 1024]
    - [127, 0.029]
  - - [8, 64, 1, 2048]
    - [99, 0.048]
  - - [8, 64, 1, 4096]
    - [99, 0.065]
  - - [8, 64, 1, 8192]
    - [242, 0.109]
  - - [8, 128, 1, 64]
    - [113, 0.006]
  - - [8, 128, 1, 128]
    - [9, 0.01]
  - - [8, 128, 1, 256]
    - [13, 0.019]
  - - [8, 128, 1, 512]
    - [10, 0.035]
  - - [8, 128, 1, 1024]
    - [127, 0.058]
  - - [8, 128, 1, 2048]
    - [155, 0.101]
  - - [8, 128, 1, 4096]
    - [105, 0.141]
  - - [8, 128, 1, 8192]
    - [243, 0.212]
  - - [8, 256, 1, 64]
    - [9, 0.011]
  - - [8, 256, 1, 128]
    - [9, 0.02]
  - - [8, 256, 1, 256]
    - [20, 0.039]
  - - [8, 256, 1, 512]
    - [20, 0.071]
  - - [8, 256, 1, 1024]
    - [99, 0.122]
  - - [8, 256, 1, 2048]
    - [99, 0.196]
  - - [8, 512, 1, 64]
    - [99, 0.022]
  - - [8, 512, 1, 128]
    - [9, 0.04]
  - - [8, 512, 1, 256]
    - [161, 0.076]
  - - [8, 512, 1, 512]
    - [161, 0.139]
  - - [8, 512, 1, 1024]
    - [10, 0.239]
  - - [8, 512, 1, 2048]
    - [99, 0.389]
  - - [8, 512, 1, 4096]
    - [99, 0.551]
  - - [8, 512, 1, 8192]
    - [230, 0.788]
  - - [8, 1024, 1, 64]
    - [99, 0.043]
  - - [8, 1024, 1, 128]
    - [161, 0.081]
  - - [8, 1024, 1, 256]
    - [13, 0.15]
  - - [8, 1024, 1, 512]
    - [99, 0.281]
  - - [8, 1024, 1, 1024]
    - [161, 0.477]
  - - [8, 1024, 1, 2048]
    - [10, 0.771]
  - - [8, 1024, 1, 4096]
    - [99, 1.083]
  - - [8, 1024, 1, 8192]
    - [244, 1.39]
  - - [8, 2048, 1, 64]
    - [161, 0.086]
  - - [8, 2048, 1, 128]
    - [13, 0.16]
  - - [8, 2048, 1, 256]
    - [161, 0.311]
  - - [8, 2048, 1, 512]
    - [161, 0.537]
  - - [8, 2048, 1, 1024]
    - [99, 0.955]
  - - [8, 2048, 1, 2048]
    - [127, 1.477]
  - - [8, 2048, 1, 4096]
    - [245, 2.094]
  - - [8, 2048, 1, 8192]
    - [245, 2.567]
  - - [8, 4096, 1, 64]
    - [15, 0.166]
  - - [8, 4096, 1, 128]
    - [161, 0.319]
  - - [8, 4096, 1, 256]
    - [99, 0.602]
  - - [8, 4096, 1, 512]
    - [161, 1.105]
  - - [8, 4096, 1, 1024]
    - [161, 1.809]
  - - [8, 4096, 1, 2048]
    - [161, 2.749]
  - - [8, 4096, 1, 4096]
    - [227, 3.752]
  - - [8, 4096, 1, 8192]
    - [246, 3.648]
  - - [8, 8192, 1, 64]
    - [99, 0.321]
  - - [8, 8192, 1, 128]
    - [155, 0.622]
  - - [8, 8192, 1, 256]
    - [155, 1.125]
  - - [8, 8192, 1, 512]
    - [99, 2.022]
  - - [8, 8192, 1, 1024]
    - [99, 3.086]
  - - [8, 8192, 1, 2048]
    - [99, 4.109]
  - - [8, 8192, 1, 4096]
    - [247, 5.126]
  - - [8, 8192, 1, 8192]
    - [248, 4.487]
  - - [16, 64, 1, 64]
    - [247, 0.006]
  - - [16, 64, 1, 128]
    - [247, 0.01]
  - - [16, 64, 1, 256]
    - [249, 0.019]
  - - [16, 64, 1, 512]
    - [247, 0.035]
  - - [16, 64, 1, 1024]
    - [249, 0.061]
  - - [16, 64, 1, 2048]
    - [249, 0.095]
  - - [16, 64, 1, 4096]
    - [247, 0.139]
  - - [16, 64, 1, 8192]
    - [175, 0.219]
  - - [16, 128, 1, 64]
    - [113, 0.012]
  - - [16, 128, 1, 128]
    - [250, 0.021]
  - - [16, 128, 1, 256]
    - [249, 0.039]
  - - [16, 128, 1, 512]
    - [249, 0.071]
  - - [16, 128, 1, 1024]
    - [99, 0.122]
  - - [16, 128, 1, 2048]
    - [249, 0.194]
  - - [16, 128, 1, 4096]
    - [245, 0.279]
  - - [16, 128, 1, 8192]
    - [174, 0.425]
  - - [16, 256, 1, 64]
    - [179, 0.023]
  - - [16, 256, 1, 128]
    - [251, 0.041]
  - - [16, 256, 1, 256]
    - [99, 0.077]
  - - [16, 256, 1, 512]
    - [229, 0.142]
  - - [16, 256, 1, 1024]
    - [105, 0.253]
  - - [16, 256, 1, 2048]
    - [252, 0.4]
  - - [16, 256, 1, 4096]
    - [247, 0.563]
  - - [16, 256, 1, 8192]
    - [174, 0.836]
  - - [16, 512, 1, 64]
    - [247, 0.044]
  - - [16, 512, 1, 128]
    - [10, 0.083]
  - - [16, 512, 1, 256]
    - [249, 0.158]
  - - [16, 512, 1, 512]
    - [99, 0.283]
  - - [16, 512, 1, 1024]
    - [247, 0.495]
  - - [16, 512, 1, 2048]
    - [253, 0.794]
  - - [16, 512, 1, 4096]
    - [245, 1.112]
  - - [16, 512, 1, 8192]
    - [254, 1.569]
  - - [16, 1024, 1, 64]
    - [247, 0.091]
  - - [16, 1024, 1, 128]
    - [250, 0.163]
  - - [16, 1024, 1, 256]
    - [13, 0.305]
  - - [16, 1024, 1, 512]
    - [246, 0.563]
  - - [16, 1024, 1, 1024]
    - [255, 0.984]
  - - [16, 1024, 1, 2048]
    - [249, 1.575]
  - - [16, 1024, 1, 4096]
    - [249, 2.211]
  - - [16, 1024, 1, 8192]
    - [253, 2.691]
  - - [16, 2048, 1, 64]
    - [256, 0.174]
  - - [16, 2048, 1, 128]
    - [249, 0.324]
  - - [16, 2048, 1, 256]
    - [249, 0.618]
  - - [16, 2048, 1, 512]
    - [249, 1.112]
  - - [16, 2048, 1, 1024]
    - [246, 1.929]
  - - [16, 2048, 1, 2048]
    - [257, 2.988]
  - - [16, 2048, 1, 4096]
    - [249, 4.272]
  - - [16, 2048, 1, 8192]
    - [258, 5.143]
  - - [16, 4096, 1, 64]
    - [98, 0.338]
  - - [16, 4096, 1, 128]
    - [13, 0.639]
  - - [16, 4096, 1, 256]
    - [99, 1.174]
  - - [16, 4096, 1, 512]
    - [259, 2.16]
  - - [16, 4096, 1, 1024]
    - [99, 3.635]
  - - [16, 4096, 1, 2048]
    - [155, 5.439]
  - - [16, 4096, 1, 4096]
    - [246, 7.523]
  - - [16, 4096, 1, 8192]
    - [260, 7.279]
  - - [16, 8192, 1, 64]
    - [261, 0.639]
  - - [16, 8192, 1, 128]
    - [262, 1.235]
  - - [16, 8192, 1, 256]
    - [99, 2.305]
  - - [16, 8192, 1, 512]
    - [247, 4.022]
  - - [16, 8192, 1, 1024]
    - [99, 6.197]
  - - [16, 8192, 1, 2048]
    - [99, 8.196]
  - - [16, 8192, 1, 4096]
    - [247, 10.217]
  - - [16, 8192, 1, 8192]
    - [209, 8.616]
  - - [64, 64, 1, 64]
    - [263, 0.013]
  - - [64, 64, 1, 128]
    - [264, 0.024]
  - - [64, 64, 1, 512]
    - [265, 0.087]
  - - [64, 64, 1, 1024]
    - [249, 0.166]
  - - [64, 64, 1, 2048]
    - [264, 0.289]
  - - [64, 64, 1, 4096]
    - [254, 0.622]
  - - [64, 64, 1, 8192]
    - [244, 1.128]
  - - [64, 128, 1, 64]
    - [264, 0.026]
  - - [64, 128, 1, 256]
    - [264, 0.095]
  - - [64, 128, 1, 512]
    - [264, 0.181]
  - - [64, 128, 1, 1024]
    - [264, 0.342]
  - - [64, 128, 1, 2048]
    - [266, 0.565]
  - - [64, 128, 1, 4096]
    - [248, 1.194]
  - - [64, 128, 1, 8192]
    - [248, 2.222]
  - - [64, 256, 1, 64]
    - [264, 0.055]
  - - [64, 256, 1, 128]
    - [267, 0.099]
  - - [64, 256, 1, 512]
    - [265, 0.361]
  - - [64, 256, 1, 1024]
    - [259, 0.656]
  - - [64, 256, 1, 2048]
    - [268, 1.135]
  - - [64, 256, 1, 4096]
    - [236, 2.079]
  - - [64, 256, 1, 8192]
    - [248, 3.688]
  - - [64, 512, 1, 64]
    - [262, 0.109]
  - - [64, 512, 1, 128]
    - [260, 0.212]
  - - [64, 512, 1, 256]
    - [260, 0.417]
  - - [64, 512, 1, 1024]
    - [266, 1.368]
  - - [64, 512, 1, 2048]
    - [268, 2.22]
  - - [64, 512, 1, 4096]
    - [269, 3.473]
  - - [64, 512, 1, 8192]
    - [270, 6.264]
  - - [64, 1024, 1, 64]
    - [227, 0.227]
  - - [64, 1024, 1, 128]
    - [252, 0.42]
  - - [64, 1024, 1, 512]
    - [223, 1.482]
  - - [64, 1024, 1, 1024]
    - [252, 2.633]
  - - [64, 1024, 1, 2048]
    - [268, 4.356]
  - - [64, 1024, 1, 4096]
    - [271, 6.508]
  - - [64, 1024, 1, 8192]
    - [270, 10.42]
  - - [64, 2048, 1, 64]
    - [221, 0.42]
  - - [64, 2048, 1, 128]
    - [265, 0.833]
  - - [64, 2048, 1, 256]
    - [260, 1.545]
  - - [64, 2048, 1, 512]
    - [253, 2.822]
  - - [64, 2048, 1, 1024]
    - [272, 4.817]
  - - [64, 2048, 1, 2048]
    - [272, 7.836]
  - - [64, 2048, 1, 4096]
    - [273, 12.224]
  - - [64, 2048, 1, 8192]
    - [273, 17.871]
  - - [64, 4096, 1, 64]
    - [267, 0.852]
  - - [64, 4096, 1, 128]
    - [263, 1.567]
  - - [64, 4096, 1, 256]
    - [274, 2.914]
  - - [64, 4096, 1, 512]
    - [275, 5.141]
  - - [64, 4096, 1, 1024]
    - [276, 8.554]
  - - [64, 4096, 1, 2048]
    - [277, 13.807]
  - - [64, 4096, 1, 4096]
    - [278, 20.223]
  - - [64, 4096, 1, 8192]
    - [279, 24.795]
  - - [64, 8192, 1, 64]
    - [280, 1.599]
  - - [64, 8192, 1, 128]
    - [281, 2.992]
  - - [64, 8192, 1, 256]
    - [282, 5.406]
  - - [64, 8192, 1, 512]
    - [283, 9.385]
  - - [64, 8192, 1, 1024]
    - [282, 16.548]
  - - [64, 8192, 1, 2048]
    - [282, 24.56]
  - - [64, 8192, 1, 4096]
    - [282, 33.08]
  - - [64, 8192, 1, 8192]
    - [282, 30.081]
  - - [256, 64, 1, 64]
    - [284, 0.053]
  - - [256, 64, 1, 128]
    - [264, 0.103]
  - - [256, 64, 1, 512]
    - [264, 0.363]
  - - [256, 64, 1, 1024]
    - [266, 0.675]
  - - [256, 64, 1, 2048]
    - [264, 1.12]
  - - [256, 64, 1, 4096]
    - [244, 2.04]
  - - [256, 64, 1, 8192]
    - [244, 3.538]
  - - [256, 128, 1, 64]
    - [285, 0.106]
  - - [256, 128, 1, 128]
    - [228, 0.211]
  - - [256, 128, 1, 512]
    - [260, 0.779]
  - - [256, 128, 1, 1024]
    - [286, 1.345]
  - - [256, 128, 1, 2048]
    - [260, 2.233]
  - - [256, 128, 1, 4096]
    - [269, 3.488]
  - - [256, 128, 1, 8192]
    - [287, 6.71]
  - - [256, 256, 1, 64]
    - [235, 0.215]
  - - [256, 256, 1, 128]
    - [247, 0.417]
  - - [256, 256, 1, 512]
    - [226, 1.496]
  - - [256, 256, 1, 1024]
    - [268, 2.634]
  - - [256, 256, 1, 2048]
    - [268, 4.491]
  - - [256, 256, 1, 4096]
    - [270, 7.175]
  - - [256, 256, 1, 8192]
    - [270, 12.908]
  - - [256, 512, 1, 64]
    - [264, 0.424]
  - - [256, 512, 1, 128]
    - [274, 0.813]
  - - [256, 512, 1, 512]
    - [231, 2.731]
  - - [256, 512, 1, 1024]
    - [288, 4.591]
  - - [256, 512, 1, 2048]
    - [272, 7.754]
  - - [256, 512, 1, 4096]
    - [270, 11.833]
  - - [256, 512, 1, 8192]
    - [270, 19.961]
  - - [256, 1024, 1, 64]
    - [289, 0.842]
  - - [256, 1024, 1, 128]
    - [272, 1.551]
  - - [256, 1024, 1, 512]
    - [272, 5.168]
  - - [256, 1024, 1, 1024]
    - [278, 8.603]
  - - [256, 1024, 1, 2048]
    - [276, 13.919]
  - - [256, 1024, 1, 4096]
    - [273, 22.364]
  - - [256, 1024, 1, 8192]
    - [290, 34.657]
  - - [256, 2048, 1, 64]
    - [291, 1.531]
  - - [256, 2048, 1, 128]
    - [282, 2.897]
  - - [256, 2048, 1, 256]
    - [282, 5.307]
  - - [256, 2048, 1, 512]
    - [282, 9.781]
  - - [256, 2048, 1, 1024]
    - [282, 16.112]
  - - [256, 2048, 1, 2048]
    - [282, 24.15]
  - - [256, 2048, 1, 4096]
    - [282, 33.223]
  - - [256, 2048, 1, 8192]
    - [290, 42.071]
  - - [256, 4096, 1, 64]
    - [292, 2.939]
  - - [256, 4096, 1, 256]
    - [293, 9.054]
  - - [256, 4096, 1, 512]
    - [293, 15.114]
  - - [256, 4096, 1, 1024]
    - [294, 23.697]
  - - [256, 4096, 1, 2048]
    - [295, 35.739]
  - - [256, 4096, 1, 4096]
    - [296, 47.142]
  - - [256, 4096, 1, 8192]
    - [295, 55.464]
  - - [256, 8192, 1, 64]
    - [293, 4.694]
  - - [256, 8192, 1, 128]
    - [297, 8.55]
  - - [256, 8192, 1, 256]
    - [298, 15.665]
  - - [256, 8192, 1, 512]
    - [299, 25.928]
  - - [256, 8192, 1, 1024]
    - [297, 39.19]
  - - [256, 8192, 1, 2048]
    - [299, 53.064]
  - - [256, 8192, 1, 4096]
    - [297, 63.858]
  - - [256, 8192, 1, 8192]
    - [297, 71.811]
- null
