library/src/blas3/Tensile/Logic/asm_full/aldebaran/aldebaran_Cijk_Alik_Bjlk_CB.yaml
- {MinimumRequiredVersion: 4.21.0}
- aldebaran
- gfx90a
- [Device 0050, Device 0051, Device 0052, Device 0054, Device 0062, Device 7400, Device
    SolutionIndex: 0
    SolutionNameMin: Cijk_Alik_Bjlk_CB_MT32x64x32_MI16x16x4x1_SE_1LDSB0_IU1_SIA3_SRVW0
    SolutionIndex: 1
    SolutionNameMin: Cijk_Alik_Bjlk_CB_MT128x128x8_MI16x16x4x1_SE_1LDSB1_IU2_SIA2_SRVW0
    SolutionIndex: 2
    SolutionNameMin: Cijk_Alik_Bjlk_CB_MT64x64x8_MI16x16x4x1_SE_1LDSB1_IU2_SIA2_SRVW2
    SolutionIndex: 3
    SolutionNameMin: Cijk_Alik_Bjlk_CB_MT128x128x8_MI16x16x4x1_SE_1LDSB1_IU2_SIA2_SRVW2
    SolutionIndex: 4
    SolutionNameMin: Cijk_Alik_Bjlk_CB_MT128x64x16_MI16x16x4x1_SE_1LDSB1_IU4_SIA2_SRVW2
    SolutionIndex: 5
    SolutionNameMin: Cijk_Alik_Bjlk_CB_MT64x64x8_MI16x16x4x1_SE_1LDSB0_IU2_SIA2_SRVW0
    SolutionIndex: 6
    SolutionNameMin: Cijk_Alik_Bjlk_CB_MT64x64x16_MI16x16x4x1_SE_1LDSB0_IU1_SIA3_SRVW0
    SolutionIndex: 7
    SolutionNameMin: Cijk_Alik_Bjlk_CB_MT64x64x16_MI16x16x4x1_SN_LRVW2_NEPBS0_PLR5_SU0_SUS0_TT2_32_WG32_8_1_WGM5
    SolutionIndex: 8
    SolutionNameMin: Cijk_Alik_Bjlk_CB_MT256x64x8_MI32x32x2x1_SN_LRVW2_NEPBS0_PLR5_SU0_SUS0_TT2_64_WG128_2_1_WGM7
    SolutionIndex: 9
    SolutionNameMin: Cijk_Alik_Bjlk_CB_MT256x64x8_MI32x32x2x1_SN_LRVW2_NEPBS0_PLR5_SU0_SUS0_TT2_64_WG128_2_1_WGM4
    SolutionIndex: 10
    SolutionNameMin: Cijk_Alik_Bjlk_CB_MT256x64x8_MI32x32x2x1_SN_LRVW2_NEPBS0_PLR5_SU32_SUS256_TT2_64_WG128_2_1_WGM4
    SolutionIndex: 11
    SolutionNameMin: Cijk_Alik_Bjlk_CB_MT256x64x8_MI32x32x2x1_SN_LRVW2_NEPBS0_PLR5_SU0_SUS0_TT2_64_WG128_2_1_WGM6
    SolutionIndex: 12
    SolutionNameMin: Cijk_Alik_Bjlk_CB_MT256x64x8_MI32x32x2x1_SN_LRVW2_NEPBS0_PLR5_SU0_SUS0_TT2_64_WG128_2_1_WGM8
    SolutionIndex: 13
    SolutionNameMin: Cijk_Alik_Bjlk_CB_MT256x64x8_MI32x32x2x1_SN_LRVW2_NEPBS0_PLR5_SU32_SUS256_TT2_64_WG128_2_1_WGM8
    SolutionIndex: 14
    SolutionNameMin: Cijk_Alik_Bjlk_CB_MT128x64x8_MI16x16x4x1_SN_LRVW1_NEPBS0_PLR1_SU32_SUS256_TT2_64_WG64_4_1_WGM8
    SolutionIndex: 15
    SolutionNameMin: Cijk_Alik_Bjlk_CB_MT64x64x16_MI16x16x4x1_SN_LRVW2_NEPBS0_PLR5_SU0_SUS0_TT2_32_WG32_8_1_WGM8
    SolutionIndex: 16
    SolutionNameMin: Cijk_Alik_Bjlk_CB_MT64x64x16_MI16x16x4x1_SN_LRVW2_NEPBS1_PLR5_SU0_SUS0_TT2_32_WG32_8_1_WGM4
    SolutionIndex: 17
    SolutionNameMin: Cijk_Alik_Bjlk_CB_MT128x64x8_MI16x16x4x1_SN_LRVW1_NEPBS0_PLR1_SU0_SUS0_TT2_64_WG64_4_1_WGM6
    SolutionIndex: 18
    SolutionNameMin: Cijk_Alik_Bjlk_CB_MT128x64x8_MI16x16x4x1_SN_LRVW1_NEPBS0_PLR1_SU32_SUS256_TT2_64_WG64_4_1_WGM7
    SolutionIndex: 19
    SolutionNameMin: Cijk_Alik_Bjlk_CB_MT128x64x8_MI16x16x4x1_SN_LRVW1_NEPBS0_PLR1_SU0_SUS0_TT2_64_WG64_4_1_WGM8
    SolutionIndex: 20
    SolutionNameMin: Cijk_Alik_Bjlk_CB_MT128x64x8_MI16x16x4x1_SN_LRVW1_NEPBS1_PLR1_SU0_SUS0_TT2_64_WG64_4_1_WGM6
    SolutionIndex: 21
    SolutionNameMin: Cijk_Alik_Bjlk_CB_MT128x64x8_MI16x16x4x1_SN_LRVW1_NEPBS1_PLR1_SU32_SUS256_TT2_64_WG64_4_1_WGM8
    SolutionIndex: 22
    SolutionNameMin: Cijk_Alik_Bjlk_CB_MT128x64x8_MI16x16x4x1_SN_LRVW1_NEPBS1_PLR1_SU0_SUS0_TT2_64_WG64_4_1_WGM8
    SolutionIndex: 23
    SolutionNameMin: Cijk_Alik_Bjlk_CB_MT128x64x8_MI16x16x4x1_SN_LRVW1_NEPBS0_PLR1_SU0_SUS0_TT2_64_WG64_4_1_WGM7
    SolutionIndex: 24
    SolutionNameMin: Cijk_Alik_Bjlk_CB_MT128x64x8_MI16x16x4x1_SN_LRVW1_NEPBS1_PLR1_SU0_SUS0_TT2_64_WG64_4_1_WGM7
    SolutionIndex: 25
    SolutionNameMin: Cijk_Alik_Bjlk_CB_MT64x64x16_MI16x16x4x1_SN_LRVW2_NEPBS1_PLR5_SU32_SUS256_TT2_32_WG32_8_1_WGM5
    SolutionIndex: 26
    SolutionNameMin: Cijk_Alik_Bjlk_CB_MT64x64x16_MI16x16x4x1_SN_LRVW2_NEPBS1_PLR5_SU0_SUS0_TT2_32_WG32_8_1_WGM7
    SolutionIndex: 27
    SolutionNameMin: Cijk_Alik_Bjlk_CB_MT64x64x16_MI16x16x4x1_SN_LRVW2_NEPBS1_PLR5_SU32_SUS256_TT2_32_WG32_8_1_WGM7
    SolutionIndex: 28
    SolutionNameMin: Cijk_Alik_Bjlk_CB_MT64x64x16_MI16x16x4x1_SN_LRVW2_NEPBS1_PLR5_SU32_SUS256_TT2_32_WG32_8_1_WGM8
    SolutionIndex: 29
    SolutionNameMin: Cijk_Alik_Bjlk_CB_MT128x64x8_MI16x16x4x1_SN_LRVW1_NEPBS1_PLR1_SU0_SUS0_TT2_64_WG64_4_1_WGM4
    SolutionIndex: 30
    SolutionNameMin: Cijk_Alik_Bjlk_CB_MT64x64x16_MI16x16x4x1_SN_LRVW2_NEPBS1_PLR5_SU0_SUS0_TT2_32_WG32_8_1_WGM8
    SolutionIndex: 31
    SolutionNameMin: Cijk_Alik_Bjlk_CB_MT64x64x16_MI16x16x4x1_SN_LRVW2_NEPBS1_PLR5_SU0_SUS0_TT2_32_WG32_8_1_WGM5
    SolutionIndex: 32
    SolutionNameMin: Cijk_Alik_Bjlk_CB_MT64x64x16_MI16x16x4x1_SN_LRVW2_NEPBS1_PLR5_SU0_SUS0_TT2_32_WG32_8_1_WGM6
    SolutionIndex: 33
    SolutionNameMin: Cijk_Alik_Bjlk_CB_MT128x64x8_MI16x16x4x1_SN_LRVW1_NEPBS0_PLR1_SU0_SUS0_TT2_64_WG64_4_1_WGM5
    SolutionIndex: 34
    SolutionNameMin: Cijk_Alik_Bjlk_CB_MT128x64x8_MI16x16x4x1_SN_LRVW1_NLCB1_PLR1_TT2_64_WG64_4_1_WGM4
    SolutionIndex: 35
    SolutionNameMin: Cijk_Alik_Bjlk_CB_MT128x64x8_MI16x16x4x1_SN_LRVW1_NLCB1_PLR1_TT2_64_WG64_4_1_WGM6
    SolutionIndex: 36
    SolutionNameMin: Cijk_Alik_Bjlk_CB_MT128x64x8_MI16x16x4x1_SN_LRVW1_NLCB1_PLR1_TT2_64_WG64_4_1_WGM7
    SolutionIndex: 37
    SolutionNameMin: Cijk_Alik_Bjlk_CB_MT128x96x16_MI16x16x4x1_SN_LRVW2_NLCB3_PLR5_TT2_96_WG64_4_1_WGM8
    SolutionIndex: 38
    SolutionNameMin: Cijk_Alik_Bjlk_CB_MT128x64x8_MI16x16x4x1_SN_LRVW1_NLCB1_PLR1_TT2_64_WG64_4_1_WGM5
    SolutionIndex: 39
    SolutionNameMin: Cijk_Alik_Bjlk_CB_MT256x64x8_MI32x32x2x1_SN_LRVW2_NLCB1_PLR5_TT2_64_WG128_2_1_WGM7
- - - [7680, 8192, 1, 8192]
    - [1, 99.196]
  - - [960, 1024, 1, 1024]
    - [2, 93.733]
  - - [1920, 2048, 1, 2048]
    - [4, 97.423]
  - - [3840, 4096, 1, 4096]
    - [3, 98.8]
  - - [1, 1, 1, 256]
    - [5, 0.0]
  - - [480, 512, 1, 512]
    - [0, 61.175]
  - - [64, 64, 1, 256]
    - [6, 0.503]
  - - [64, 64, 2, 64]
    - [5, 0.563]
  - - [1, 64, 1, 256]
    - [5, 0.012]
  - - [64, 1, 1, 256]
    - [5, 0.012]
  - - [2001, 2001, 1, 51]
    - [7, 43.697]
  - - [3001, 3001, 1, 51]
    - [8, 53.923]
  - - [4454, 4454, 1, 51]
    - [9, 68.186]
  - - [6454, 6454, 1, 51]
    - [9, 74.881]
  - - [7985, 7985, 1, 51]
    - [9, 74.09]
  - - [9603, 9603, 1, 51]
    - [10, 72.985]
  - - [11505, 11505, 1, 51]
    - [9, 70.447]
  - - [13179, 13179, 1, 51]
    - [8, 73.026]
  - - [15420, 15420, 1, 51]
    - [8, 82.332]
  - - [17445, 17445, 1, 51]
    - [11, 71.865]
  - - [19343, 19343, 1, 51]
    - [12, 70.494]
  - - [21581, 21581, 1, 51]
    - [12, 71.098]
  - - [25854, 25854, 1, 51]
    - [12, 72.649]
  - - [30421, 30421, 1, 51]
    - [13, 69.171]
  - - [35882, 35882, 1, 51]
    - [12, 74.774]
  - - [40401, 40401, 1, 51]
    - [12, 70.405]
  - - [45312, 45312, 1, 51]
    - [14, 91.02]
  - - [51821, 51821, 1, 51]
    - [12, 69.928]
  - - [60766, 60766, 1, 51]
    - [12, 74.959]
  - - [67143, 67143, 1, 51]
    - [12, 70.676]
  - - [2001, 2001, 1, 103]
    - [15, 69.77]
  - - [3001, 3001, 1, 103]
    - [16, 80.98]
  - - [4454, 4454, 1, 103]
    - [17, 89.889]
  - - [6454, 6454, 1, 103]
    - [18, 92.149]
  - - [7985, 7985, 1, 103]
    - [19, 93.331]
  - - [9603, 9603, 1, 103]
    - [20, 93.378]
  - - [11505, 11505, 1, 103]
    - [21, 95.163]
  - - [13179, 13179, 1, 103]
    - [22, 95.414]
  - - [15420, 15420, 1, 103]
    - [23, 96.006]
  - - [17445, 17445, 1, 103]
    - [24, 95.742]
  - - [19343, 19343, 1, 103]
    - [22, 95.895]
  - - [21581, 21581, 1, 103]
    - [22, 96.156]
  - - [25854, 25854, 1, 103]
    - [23, 96.738]
  - - [30421, 30421, 1, 103]
    - [24, 96.566]
  - - [35882, 35882, 1, 103]
    - [19, 96.665]
  - - [40401, 40401, 1, 103]
    - [22, 96.753]
  - - [45312, 45312, 1, 103]
    - [19, 97.17]
  - - [51821, 51821, 1, 103]
    - [22, 96.832]
  - - [60766, 60766, 1, 103]
    - [19, 96.974]
  - - [67143, 67143, 1, 103]
    - [22, 96.908]
  - - [2001, 2001, 1, 223]
    - [17, 80.301]
  - - [3001, 3001, 1, 223]
    - [25, 89.737]
  - - [4454, 4454, 1, 223]
    - [26, 93.51]
  - - [6454, 6454, 1, 223]
    - [25, 95.679]
  - - [7985, 7985, 1, 223]
    - [27, 96.121]
  - - [9603, 9603, 1, 223]
    - [28, 95.439]
  - - [11505, 11505, 1, 223]
    - [29, 96.714]
  - - [13179, 13179, 1, 223]
    - [24, 97.105]
  - - [15420, 15420, 1, 223]
    - [27, 97.169]
  - - [17445, 17445, 1, 223]
    - [28, 96.982]
  - - [19343, 19343, 1, 223]
    - [28, 96.898]
  - - [2001, 2001, 1, 511]
    - [17, 87.153]
  - - [3001, 3001, 1, 511]
    - [30, 93.18]
  - - [4454, 4454, 1, 511]
    - [26, 95.469]
  - - [6454, 6454, 1, 511]
    - [30, 96.835]
  - - [7985, 7985, 1, 511]
    - [26, 97.055]
  - - [9603, 9603, 1, 511]
    - [26, 96.066]
  - - [11505, 11505, 1, 511]
    - [29, 97.271]
  - - [13179, 13179, 1, 511]
    - [22, 97.619]
  - - [15420, 15420, 1, 511]
    - [26, 97.661]
  - - [17445, 17445, 1, 511]
    - [30, 97.447]
  - - [19343, 19343, 1, 511]
    - [26, 97.301]
  - - [2001, 2001, 1, 2201]
    - [17, 92.291]
  - - [3001, 3001, 1, 2201]
    - [30, 95.29]
  - - [4454, 4454, 1, 2201]
    - [31, 96.548]
  - - [6454, 6454, 1, 2201]
    - [30, 97.475]
  - - [7985, 7985, 1, 2201]
    - [30, 97.566]
  - - [9603, 9603, 1, 2201]
    - [31, 96.416]
  - - [11505, 11505, 1, 2201]
    - [19, 97.521]
  - - [13179, 13179, 1, 2201]
    - [19, 97.832]
  - - [15420, 15420, 1, 2201]
    - [16, 97.907]
  - - [17445, 17445, 1, 2201]
    - [26, 97.681]
  - - [19343, 19343, 1, 2201]
    - [32, 97.52]
  - - [2001, 2001, 1, 4101]
    - [33, 92.933]
  - - [3001, 3001, 1, 4101]
    - [7, 95.646]
  - - [4454, 4454, 1, 4101]
    - [30, 96.76]
  - - [6454, 6454, 1, 4101]
    - [26, 97.607]
  - - [7985, 7985, 1, 4101]
    - [32, 97.681]
  - - [9603, 9603, 1, 4101]
    - [31, 96.519]
  - - [11505, 11505, 1, 4101]
    - [19, 97.606]
  - - [13179, 13179, 1, 4101]
    - [19, 97.911]
  - - [15420, 15420, 1, 4101]
    - [31, 97.993]
  - - [17445, 17445, 1, 4101]
    - [32, 97.76]
  - - [19343, 19343, 1, 4101]
    - [32, 97.597]
  - - [21581, 21581, 1, 223]
    - [34, 97.0]
  - - [21581, 21581, 1, 511]
    - [35, 97.35]
  - - [21581, 21581, 1, 2201]
    - [36, 97.466]
  - - [21581, 21581, 1, 4101]
    - [37, 97.562]
  - - [25854, 25854, 1, 223]
    - [36, 97.596]
  - - [25854, 25854, 1, 511]
    - [36, 97.93]
  - - [25854, 25854, 1, 2201]
    - [21, 98.041]
  - - [25854, 25854, 1, 4101]
    - [34, 98.11]
  - - [30421, 30421, 1, 223]
    - [36, 97.317]
  - - [30421, 30421, 1, 511]
    - [38, 97.62]
  - - [30421, 30421, 1, 2201]
    - [37, 97.752]
  - - [30421, 30421, 1, 4101]
    - [37, 97.854]
  - - [35882, 35882, 1, 223]
    - [21, 97.35]
  - - [35882, 35882, 1, 511]
    - [35, 97.645]
  - - [35882, 35882, 1, 2201]
    - [35, 97.733]
  - - [35882, 35882, 1, 4101]
    - [38, 97.799]
  - - [40401, 40401, 1, 223]
    - [36, 97.434]
  - - [40401, 40401, 1, 511]
    - [21, 97.721]
  - - [40401, 40401, 1, 2201]
    - [39, 97.851]
  - - [40401, 40401, 1, 4101]
    - [37, 97.888]
  - - [45312, 45312, 1, 223]
    - [36, 97.707]
  - - [45312, 45312, 1, 511]
    - [21, 97.979]
  - - [45312, 45312, 1, 2201]
    - [39, 98.108]
  - - [45312, 45312, 1, 4101]
    - [39, 98.129]
  - - [51821, 51821, 1, 223]
    - [35, 97.628]
  - - [51821, 51821, 1, 511]
    - [38, 97.911]
  - - [51821, 51821, 1, 2201]
    - [36, 97.991]
  - - [51821, 51821, 1, 4101]
    - [34, 98.055]
  - - [60766, 60766, 1, 223]
    - [36, 97.605]
  - - [60766, 60766, 1, 511]
    - [34, 97.881]
  - - [60766, 60766, 1, 2201]
    - [35, 97.961]
  - - [60766, 60766, 1, 4101]
    - [21, 98.025]
  - - [67143, 67143, 1, 223]
    - [21, 97.552]
  - - [67143, 67143, 1, 511]
    - [34, 97.829]
  - - [67143, 67143, 1, 2201]
    - [35, 97.906]
  - - [67143, 67143, 1, 4101]
    - [21, 97.969]
- null
