library/src/blas3/Tensile/Logic/asm_arcturus/arcturus_Cijk_Alik_Bljk_BBH.yaml
- {MinimumRequiredVersion: 4.12.0}
- arcturus
- gfx908
- [Device 7380, Device 7388, Device 738c]
    SolutionIndex: 0
    SolutionNameMin: Cijk_Alik_Bljk_BBH_MT128x32x16_SE_
    SolutionIndex: 1
    SolutionNameMin: Cijk_Alik_Bljk_BBH_MT128x64x16_SE_
    SolutionIndex: 2
    SolutionNameMin: Cijk_Alik_Bljk_BBH_MT32x128x16_SE_
    SolutionIndex: 3
    SolutionNameMin: Cijk_Alik_Bljk_BBH_MT64x128x16_SE_
    SolutionIndex: 4
    SolutionNameMin: Cijk_Alik_Bljk_BBH_MT256x128x16_SE_
    SolutionIndex: 5
    SolutionNameMin: Cijk_Alik_Bljk_BBH_MT128x256x16_SE_
    SolutionIndex: 6
    SolutionNameMin: Cijk_Alik_Bljk_BBH_MT64x16x16_SE_
    SolutionIndex: 7
    SolutionNameMin: Cijk_Alik_Bljk_BBH_MT16x64x16_SE_
    SolutionIndex: 8
    SolutionNameMin: Cijk_Alik_Bljk_BBH_MT64x128x32_SE_
    SolutionIndex: 9
    SolutionNameMin: Cijk_Alik_Bljk_BBH_MT32x32x32_SE_
- - - [512, 512, 1, 513]
    - [0, 381.611]
  - - [511, 512, 1, 512]
    - [0, 379.091]
  - - [2048, 2049, 1, 2048]
    - [1, 1383.87]
  - - [480, 511, 1, 512]
    - [0, 357.991]
  - - [64, 1023, 1, 1024]
    - [6, 111.903]
  - - [2879, 3072, 1, 3072]
    - [3, 1661.36]
  - - [480, 512, 1, 511]
    - [0, 358.482]
  - - [4096, 4096, 1, 4096]
    - [8, 16868.2]
  - - [480, 513, 1, 512]
    - [0, 359.311]
  - - [2880, 3072, 1, 3073]
    - [3, 1658.3]
  - - [2880, 3071, 1, 3072]
    - [3, 1661.59]
  - - [3840, 4097, 1, 4096]
    - [1, 1597.42]
  - - [1024, 1025, 1, 1024]
    - [2, 857.747]
  - - [512, 512, 1, 511]
    - [0, 380.902]
  - - [1025, 1024, 1, 1024]
    - [2, 859.448]
  - - [959, 1024, 1, 1024]
    - [3, 1067.68]
  - - [480, 512, 1, 513]
    - [0, 358.656]
  - - [2047, 2048, 1, 2048]
    - [1, 1384.19]
  - - [479, 512, 1, 512]
    - [0, 357.293]
  - - [3840, 4096, 1, 4096]
    - [8, 17340.1]
  - - [2049, 2048, 1, 2048]
    - [1, 1383.81]
  - - [960, 1023, 1, 1024]
    - [3, 1069.66]
  - - [480, 512, 1, 512]
    - [8, 2545.11]
  - - [1024, 1024, 1, 1025]
    - [2, 860.273]
  - - [64, 1024, 1, 1023]
    - [6, 113.741]
  - - [3072, 3072, 1, 3072]
    - [8, 15664.8]
  - - [960, 1025, 1, 1024]
    - [2, 815.013]
  - - [3072, 3071, 1, 3072]
    - [1, 1650.83]
  - - [1920, 2047, 1, 2048]
    - [5, 1758.25]
  - - [1921, 2048, 1, 2048]
    - [1, 1295.9]
  - - [4096, 4097, 1, 4096]
    - [1, 1604.45]
  - - [960, 1024, 1, 1025]
    - [3, 1078.27]
  - - [961, 1024, 1, 1024]
    - [0, 805.424]
  - - [4096, 4095, 1, 4096]
    - [1, 1607.6]
  - - [512, 512, 1, 512]
    - [8, 3445.01]
  - - [3072, 3072, 1, 3073]
    - [1, 1645.65]
  - - [3071, 3072, 1, 3072]
    - [1, 1650.57]
  - - [2880, 3073, 1, 3072]
    - [1, 1551.9]
  - - [2048, 2047, 1, 2048]
    - [1, 1383.25]
  - - [2880, 3072, 1, 3072]
    - [8, 17010.8]
  - - [63, 1024, 1, 1024]
    - [6, 109.939]
  - - [1920, 2049, 1, 2048]
    - [1, 1306.24]
  - - [960, 1024, 1, 1024]
    - [8, 13827.4]
  - - [1920, 2048, 1, 2048]
    - [8, 15206.0]
  - - [4096, 4096, 1, 4097]
    - [1, 1627.47]
  - - [2048, 2048, 1, 2048]
    - [8, 13584.8]
  - - [3072, 3072, 1, 3071]
    - [1, 1639.2]
  - - [3840, 4095, 1, 4096]
    - [4, 1782.78]
  - - [3840, 4096, 1, 4097]
    - [4, 1872.84]
  - - [3841, 4096, 1, 4096]
    - [1, 1592.57]
  - - [2048, 2048, 1, 2047]
    - [1, 1375.46]
  - - [481, 512, 1, 512]
    - [0, 359.439]
  - - [3839, 4096, 1, 4096]
    - [4, 1789.24]
  - - [64, 1025, 1, 1024]
    - [6, 112.921]
  - - [3072, 3073, 1, 3072]
    - [1, 1650.31]
  - - [1919, 2048, 1, 2048]
    - [5, 1758.38]
  - - [2881, 3072, 1, 3072]
    - [1, 1553.64]
  - - [4095, 4096, 1, 4096]
    - [1, 1605.24]
  - - [1024, 1023, 1, 1024]
    - [0, 859.2]
  - - [4097, 4096, 1, 4096]
    - [1, 1605.11]
  - - [3840, 4096, 1, 4095]
    - [4, 1872.71]
  - - [512, 511, 1, 512]
    - [0, 379.349]
  - - [3073, 3072, 1, 3072]
    - [1, 1652.19]
  - - [4096, 4096, 1, 4095]
    - [4, 1608.39]
  - - [1024, 1024, 1, 1023]
    - [0, 864.574]
  - - [1024, 1024, 1, 1024]
    - [8, 8505.59]
  - - [512, 513, 1, 512]
    - [0, 379.887]
  - - [960, 1024, 1, 1023]
    - [3, 1078.56]
  - - [513, 512, 1, 512]
    - [0, 379.458]
  - - [65, 1024, 1, 1024]
    - [7, 105.664]
  - - [64, 1024, 1, 1025]
    - [6, 113.532]
  - - [64, 1024, 1, 1024]
    - [9, 967.544]
  - - [1920, 2048, 1, 2047]
    - [5, 1773.88]
  - - [2880, 3072, 1, 3071]
    - [3, 1659.92]
  - - [1920, 2048, 1, 2049]
    - [5, 1786.73]
  - - [1023, 1024, 1, 1024]
    - [0, 862.294]
  - - [2048, 2048, 1, 2049]
    - [1, 1388.52]
- null
