library/src/blas3/Tensile/Logic/gfx803-rocm-1.6/Fiji_Cijk_Alik_Bljk_SB.yaml
- {MinimumRequiredVersion: 3.0.6}
- Fiji
- [R9 Nano]
- AssignedDerivedParameters: true
- - - [4096, 7000, 1, 4096]
    - [77, 2284.41]
  - - [7680, 64, 1, 2560]
    - [7, 1778.57]
  - - [7680, 128, 1, 2560]
    - [7, 2099.34]
  - - [2048, 7000, 1, 2048]
    - [77, 2562.57]
  - - [3072, 32, 1, 1024]
    - [43, 945.382]
  - - [5124, 9124, 1, 4096]
    - [22, 2483.81]
  - - [5124, 9124, 1, 1760]
    - [22, 3319.22]
  - - [4096, 32, 1, 4096]
    - [14, 1213.88]
  - - [1760, 64, 1, 1760]
    - [64, 1685.78]
  - - [4096, 128, 1, 4096]
    - [64, 1986.44]
  - - [2560, 16, 1, 2560]
    - [54, 852.785]
  - - [3072, 16, 1, 1024]
    - [58, 703.747]
  - - [2560, 64, 1, 2560]
    - [30, 1525.44]
  - - [2560, 7000, 1, 2560]
    - [80, 2208.81]
  - - [1760, 32, 1, 1760]
    - [43, 1097.96]
  - - [2048, 64, 1, 2048]
    - [43, 1373.51]
  - - [1760, 128, 1, 1760]
    - [42, 2394.3]
  - - [2560, 128, 1, 2560]
    - [7, 1868.14]
  - - [35, 8457, 1, 1760]
    - [86, 1308.14]
  - - [4096, 16, 1, 4096]
    - [54, 882.786]
  - - [35, 8457, 1, 2048]
    - [7, 1034.33]
  - - [3072, 128, 1, 1024]
    - [7, 1693.83]
  - - [1760, 7000, 1, 1760]
    - [22, 3391.19]
  - - [1760, 16, 1, 1760]
    - [36, 784.705]
  - - [2560, 32, 1, 2560]
    - [43, 1085.72]
  - - [2048, 32, 1, 2048]
    - [14, 977.987]
  - - [35, 8457, 1, 2560]
    - [7, 1081.15]
  - - [5124, 9124, 1, 2560]
    - [77, 2294.58]
  - - [3072, 64, 1, 1024]
    - [30, 1366.23]
  - - [5124, 9124, 1, 2048]
    - [77, 2524.03]
  - - [2048, 16, 1, 2048]
    - [54, 742.032]
  - - [7680, 16, 1, 2560]
    - [58, 952.22]
  - - [2048, 128, 1, 2048]
    - [64, 1729.4]
  - - [4096, 64, 1, 4096]
    - [43, 1577.84]
  - - [35, 8457, 1, 4096]
    - [64, 1047.82]
  - - [7680, 32, 1, 2560]
    - [43, 1259.31]
- - - -1
    - - - -1
        - - - 32
            - - [32, 10]
              - [64, 69]
              - [128, 74]
              - [1184, 33]
              - [-1, 22]
          - - 64
            - - [64, 5]
              - [128, 10]
              - [224, 47]
              - [352, 28]
              - [512, 66]
              - [704, 61]
              - [928, 74]
              - [1184, 16]
              - [1472, 39]
              - [1792, 35]
              - [2144, 33]
              - [2528, 2]
              - [2944, 51]
              - [3392, 33]
              - [-1, 38]
          - - 128
            - - [32, 5]
              - [128, 10]
              - [224, 66]
              - [352, 61]
              - [512, 25]
              - [704, 39]
              - [928, 8]
              - [1184, 6]
              - [1472, 55]
              - [1792, 42]
              - [2144, 9]
              - [2528, 6]
              - [2944, 27]
              - [3392, 33]
              - [-1, 46]
          - - 224
            - - [32, 10]
              - [64, 47]
              - [128, 73]
              - [224, 10]
              - [352, 39]
              - [512, 48]
              - [704, 55]
              - [1184, 33]
              - [1472, 27]
              - [-1, 33]
          - - 352
            - - [32, 4]
              - [64, 28]
              - [128, 61]
              - [224, 39]
              - [352, 8]
              - [512, 55]
              - [704, 9]
              - [928, 27]
              - [1184, 33]
              - [1472, 46]
              - [2528, 33]
              - [2944, 22]
              - [3392, 33]
              - [-1, 27]
          - - 512
            - - [32, 4]
              - [64, 69]
              - [128, 25]
              - [224, 8]
              - [352, 55]
              - [512, 9]
              - [704, 27]
              - [1184, 33]
              - [1472, 27]
              - [1792, 33]
              - [2144, 22]
              - [2528, 33]
              - [2944, 27]
              - [-1, 46]
          - - 704
            - - [32, 32]
              - [64, 61]
              - [128, 39]
              - [224, 55]
              - [352, 9]
              - [512, 27]
              - [704, 33]
              - [928, 27]
              - [1184, 33]
              - [1472, 22]
              - [1792, 27]
              - [2144, 33]
              - [2528, 46]
              - [2944, 22]
              - [-1, 46]
          - - 928
            - - [32, 4]
              - [64, 74]
              - [128, 8]
              - [224, 9]
              - [352, 27]
              - [1792, 33]
              - [2144, 22]
              - [2528, 46]
              - [2944, 33]
              - [-1, 22]
          - - 1184
            - - [32, 47]
              - [64, 74]
              - [224, 6]
              - [352, 55]
              - [1472, 33]
              - [-1, 22]
          - - 1472
            - - [32, 4]
              - [64, 61]
              - [128, 55]
              - [224, 27]
              - [352, 46]
              - [512, 27]
              - [704, 22]
              - [1184, 33]
              - [-1, 22]
          - - 1792
            - - [32, 43]
              - [64, 64]
              - [224, 42]
              - [928, 33]
              - [-1, 22]
          - - 2144
            - - [32, 1]
              - [64, 33]
              - [128, 9]
              - [224, 46]
              - [352, 34]
              - [512, 22]
              - [704, 33]
              - [-1, 22]
          - - 2528
            - - [32, 47]
              - [64, 12]
              - [128, 6]
              - [224, 33]
              - [352, 27]
              - [704, 33]
              - [928, 46]
              - [-1, 22]
          - - 2944
            - - [32, 32]
              - [64, 33]
              - [224, 27]
              - [352, 22]
              - [512, 33]
              - [704, 22]
              - [928, 33]
              - [-1, 22]
          - - 3392
            - - [32, 3]
              - [128, 33]
              - [224, 34]
              - [352, 27]
              - [512, 22]
              - [704, 33]
              - [-1, 22]
          - - -1
            - - [32, 43]
              - [224, 33]
              - [352, 27]
              - [512, 46]
              - [704, 33]
              - [-1, 22]
