library/src/blas3/Tensile/Logic/gfx803-rocm-1.6/Fiji_Cijk_Ailk_Bljk_SB.yaml
- {MinimumRequiredVersion: 3.0.6}
- Fiji
- [R9 Nano]
- AssignedDerivedParameters: true
- - - [4096, 7000, 1, 4096]
    - [81, 3356.14]
  - - [7680, 64, 1, 2560]
    - [2, 2903.87]
  - - [7680, 128, 1, 2560]
    - [64, 3123.58]
  - - [2048, 7000, 1, 2048]
    - [81, 3497.83]
  - - [3072, 32, 1, 1024]
    - [56, 1757.41]
  - - [5124, 9124, 1, 4096]
    - [81, 3259.72]
  - - [5124, 9124, 1, 1760]
    - [81, 3400.34]
  - - [4096, 32, 1, 4096]
    - [49, 2264.92]
  - - [1760, 64, 1, 1760]
    - [26, 2341.14]
  - - [4096, 128, 1, 4096]
    - [50, 3176.22]
  - - [2560, 16, 1, 2560]
    - [43, 1065.64]
  - - [3072, 16, 1, 1024]
    - [56, 984.588]
  - - [2560, 64, 1, 2560]
    - [50, 2630.01]
  - - [2560, 7000, 1, 2560]
    - [81, 3409.71]
  - - [1760, 32, 1, 1760]
    - [46, 1834.27]
  - - [2048, 64, 1, 2048]
    - [50, 2295.91]
  - - [1760, 128, 1, 1760]
    - [25, 2601.68]
  - - [2560, 128, 1, 2560]
    - [50, 2883.1]
  - - [35, 8457, 1, 1760]
    - [3, 1299.79]
  - - [4096, 16, 1, 4096]
    - [93, 1299.56]
  - - [35, 8457, 1, 2048]
    - [5, 1136.49]
  - - [3072, 128, 1, 1024]
    - [2, 2425.06]
  - - [1760, 7000, 1, 1760]
    - [81, 3634.23]
  - - [1760, 16, 1, 1760]
    - [46, 949.465]
  - - [2560, 32, 1, 2560]
    - [43, 1954.86]
  - - [2048, 32, 1, 2048]
    - [0, 1821.64]
  - - [35, 8457, 1, 2560]
    - [93, 1087.1]
  - - [5124, 9124, 1, 2560]
    - [81, 3286.19]
  - - [3072, 64, 1, 1024]
    - [2, 2230.05]
  - - [5124, 9124, 1, 2048]
    - [81, 3309.97]
  - - [2048, 16, 1, 2048]
    - [43, 980.558]
  - - [7680, 16, 1, 2560]
    - [43, 1169.95]
  - - [2048, 128, 1, 2048]
    - [50, 2632.78]
  - - [4096, 64, 1, 4096]
    - [50, 2980.99]
  - - [35, 8457, 1, 4096]
    - [5, 1245.9]
  - - [7680, 32, 1, 2560]
    - [60, 2194.92]
- - - -1
    - - - -1
        - - - 32
            - - [32, 43]
              - [224, 50]
              - [352, 26]
              - [512, 1]
              - [928, 26]
              - [2528, 7]
              - [-1, 81]
          - - 64
            - - [32, 18]
              - [64, 61]
              - [128, 5]
              - [224, 43]
              - [352, 17]
              - [512, 50]
              - [704, 49]
              - [928, 50]
              - [1184, 53]
              - [1472, 28]
              - [1792, 57]
              - [2144, 1]
              - [2528, 64]
              - [3392, 1]
              - [-1, 60]
          - - 128
            - - [32, 61]
              - [64, 5]
              - [128, 44]
              - [224, 46]
              - [352, 49]
              - [704, 50]
              - [928, 25]
              - [1184, 45]
              - [1472, 62]
              - [1792, 19]
              - [2144, 7]
              - [2528, 45]
              - [3392, 7]
              - [-1, 3]
          - - 224
            - - [32, 5]
              - [64, 43]
              - [128, 17]
              - [224, 46]
              - [352, 43]
              - [512, 65]
              - [704, 50]
              - [2144, 46]
              - [2528, 3]
              - [2944, 26]
              - [-1, 7]
          - - 352
            - - [32, 5]
              - [128, 49]
              - [224, 43]
              - [928, 50]
              - [1184, 26]
              - [1472, 21]
              - [1792, 50]
              - [-1, 7]
          - - 512
            - - [32, 43]
              - [64, 17]
              - [128, 50]
              - [224, 46]
              - [352, 50]
              - [512, 26]
              - [1184, 50]
              - [1792, 26]
              - [-1, 7]
          - - 704
            - - [32, 17]
              - [64, 49]
              - [512, 50]
              - [704, 64]
              - [928, 50]
              - [1184, 26]
              - [1472, 62]
              - [2144, 7]
              - [2944, 62]
              - [-1, 7]
          - - 928
            - - [32, 17]
              - [64, 25]
              - [128, 53]
              - [224, 43]
              - [352, 50]
              - [512, 62]
              - [704, 26]
              - [928, 10]
              - [1184, 26]
              - [1472, 7]
              - [1792, 62]
              - [3392, 7]
              - [-1, 81]
          - - 1184
            - - [32, 43]
              - [64, 25]
              - [352, 50]
              - [512, 64]
              - [928, 26]
              - [3392, 7]
              - [-1, 81]
          - - 1472
            - - [32, 49]
              - [64, 15]
              - [128, 25]
              - [224, 50]
              - [352, 21]
              - [512, 62]
              - [704, 50]
              - [1184, 26]
              - [1472, 62]
              - [1792, 7]
              - [2528, 81]
              - [3392, 7]
              - [-1, 81]
          - - 1792
            - - [32, 46]
              - [64, 26]
              - [224, 50]
              - [352, 62]
              - [512, 1]
              - [928, 26]
              - [2528, 7]
              - [-1, 81]
          - - 2144
            - - [32, 0]
              - [64, 50]
              - [128, 62]
              - [224, 21]
              - [512, 7]
              - [928, 26]
              - [2144, 7]
              - [-1, 81]
          - - 2528
            - - [32, 43]
              - [128, 50]
              - [224, 1]
              - [352, 62]
              - [512, 7]
              - [704, 26]
              - [1184, 7]
              - [1472, 12]
              - [1792, 7]
              - [-1, 81]
          - - 2944
            - - [32, 56]
              - [64, 25]
              - [128, 50]
              - [224, 62]
              - [352, 7]
              - [512, 1]
              - [928, 7]
              - [2528, 81]
              - [2944, 12]
              - [-1, 81]
          - - 3392
            - - [32, 46]
              - [64, 50]
              - [704, 7]
              - [928, 12]
              - [1184, 81]
              - [1472, 12]
              - [1792, 81]
              - [2144, 7]
              - [-1, 81]
          - - -1
            - - [32, 43]
              - [64, 50]
              - [128, 64]
              - [224, 7]
              - [352, 1]
              - [704, 7]
              - [928, 12]
              - [3392, 81]
              - [-1, 12]
