library/src/blas3/Tensile/Logic/mi25_deepbench/Tensile_Cijk_Alik_Bljk_SB.yaml
- {MinimumRequiredVersion: 3.3.0}
- Tensile
- default
- AssignedDerivedParameters: true
- - - [8448, 48000, 1, 2816]
    - [27, 9422.31]
  - - [2048, 7000, 1, 2048]
    - [18, 7302.34]
  - - [7680, 64, 1, 2560]
    - [6, 4453.64]
  - - [7680, 128, 1, 2560]
    - [9, 5612.79]
  - - [4096, 64, 1, 4096]
    - [13, 3560.28]
  - - [512, 24000, 1, 2048]
    - [23, 7526.45]
  - - [5124, 9124, 1, 2560]
    - [18, 8526.32]
  - - [1024, 48000, 1, 2560]
    - [18, 8542.9]
  - - [2048, 32, 1, 2048]
    - [15, 1780.57]
  - - [3072, 48000, 1, 1024]
    - [25, 7854.65]
  - - [5124, 9124, 1, 4096]
    - [18, 8278.71]
  - - [5124, 9124, 1, 1760]
    - [17, 9878.84]
  - - [4096, 32, 1, 4096]
    - [11, 2575.77]
  - - [512, 48000, 1, 2560]
    - [18, 8462.05]
  - - [1760, 64, 1, 1760]
    - [13, 4087.62]
  - - [512, 24000, 1, 1536]
    - [23, 8096.6]
  - - [4096, 128, 1, 4096]
    - [13, 4744.43]
  - - [4608, 24000, 1, 1536]
    - [18, 8394.33]
  - - [7680, 48000, 1, 2560]
    - [18, 8732.67]
  - - [8448, 16, 1, 2816]
    - [16, 2006.95]
  - - [4608, 16, 1, 1536]
    - [7, 1437.26]
  - - [6144, 24000, 1, 2560]
    - [18, 8605.1]
  - - [3072, 24000, 1, 1024]
    - [25, 7742.83]
  - - [2560, 64, 1, 2560]
    - [9, 3538.16]
  - - [1024, 16, 1, 500000]
    - [1, 2943.28]
  - - [3072, 16, 1, 1024]
    - [10, 756.172]
  - - [3072, 128, 1, 1024]
    - [6, 2665.81]
  - - [2560, 7000, 1, 2560]
    - [18, 8386.37]
  - - [8448, 24000, 1, 2816]
    - [27, 9353.4]
  - - [512, 48000, 1, 2048]
    - [23, 7857.68]
  - - [2048, 64, 1, 2048]
    - [10, 2494.89]
  - - [512, 24000, 1, 2816]
    - [27, 8964.84]
  - - [2560, 128, 1, 2560]
    - [13, 4572.17]
  - - [2560, 16, 1, 2560]
    - [7, 1372.93]
  - - [6144, 48000, 1, 2560]
    - [18, 8688.01]
  - - [1024, 24000, 1, 2048]
    - [18, 7673.99]
  - - [1760, 7000, 1, 1760]
    - [17, 9505.66]
  - - [4096, 16, 1, 4096]
    - [11, 1422.3]
  - - [512, 48000, 1, 1536]
    - [24, 8200.04]
  - - [35, 8457, 1, 2048]
    - [4, 3012.18]
  - - [6144, 32, 1, 2560]
    - [6, 3117.94]
  - - [8448, 32, 1, 2816]
    - [5, 3700.33]
  - - [1024, 8, 1, 500000]
    - [1, 1495.52]
  - - [7680, 16, 1, 2560]
    - [11, 1765.19]
  - - [1024, 24000, 1, 2560]
    - [18, 8540.47]
  - - [1760, 16, 1, 1760]
    - [14, 1663.36]
  - - [5124, 9124, 1, 2048]
    - [18, 7959.37]
  - - [35, 8457, 1, 1760]
    - [3, 3795.71]
  - - [1024, 700, 1, 512]
    - [21, 3756.06]
  - - [2560, 32, 1, 2560]
    - [9, 2453.46]
  - - [1760, 32, 1, 1760]
    - [5, 2827.35]
  - - [6144, 16, 1, 2560]
    - [11, 1712.91]
  - - [7680, 24000, 1, 2560]
    - [18, 8678.17]
  - - [4096, 7000, 1, 4096]
    - [18, 8183.45]
  - - [3072, 32, 1, 1024]
    - [15, 1590.5]
  - - [4608, 32, 1, 1536]
    - [15, 2433.13]
  - - [35, 8457, 1, 2560]
    - [4, 3450.64]
  - - [4608, 48000, 1, 1536]
    - [18, 8376.49]
  - - [1024, 48000, 1, 2816]
    - [26, 9219.1]
  - - [3072, 64, 1, 1024]
    - [15, 2222.21]
  - - [512, 48000, 1, 2816]
    - [26, 9219.98]
  - - [2048, 16, 1, 2048]
    - [8, 950.352]
  - - [1024, 24000, 1, 1536]
    - [18, 8144.8]
  - - [1024, 48000, 1, 1536]
    - [18, 8205.17]
  - - [1760, 128, 1, 1760]
    - [9, 5077.9]
  - - [2048, 128, 1, 2048]
    - [13, 3082.72]
  - - [35, 8457, 1, 4096]
    - [4, 3622.03]
  - - [512, 8, 1, 500000]
    - [2, 1539.99]
  - - [512, 24000, 1, 2560]
    - [24, 8432.29]
  - - [7680, 32, 1, 2560]
    - [5, 3270.67]
  - - [1024, 48000, 1, 2048]
    - [18, 7931.33]
  - - [512, 16, 1, 500000]
    - [0, 2861.62]
  - - [1024, 24000, 1, 2816]
    - [26, 9015.42]
- - - -1
    - - - -1
        - - - 64
            - - [128, 12]
              - [704, 20]
              - [1856, 22]
              - [-1, 27]
          - - 128
            - - [64, 14]
              - [128, 15]
              - [256, 11]
              - [448, 13]
              - [1024, 12]
              - [2368, 13]
              - [2944, 12]
              - [3584, 23]
              - [4288, 12]
              - [5888, 23]
              - [-1, 18]
          - - 256
            - - [64, 16]
              - [128, 10]
              - [256, 12]
              - [448, 13]
              - [2368, 23]
              - [2944, 20]
              - [3584, 18]
              - [5056, 23]
              - [5888, 19]
              - [-1, 23]
          - - 448
            - - [64, 11]
              - [256, 13]
              - [448, 12]
              - [704, 23]
              - [1024, 20]
              - [1408, 23]
              - [1856, 18]
              - [2368, 20]
              - [2944, 22]
              - [3584, 20]
              - [4288, 18]
              - [5056, 20]
              - [5888, 17]
              - [-1, 21]
          - - 704
            - - [64, 13]
              - [128, 12]
              - [256, 23]
              - [704, 20]
              - [1024, 23]
              - [1408, 18]
              - [2368, 20]
              - [3584, 21]
              - [5888, 18]
              - [-1, 27]
          - - 1024
            - - [64, 5]
              - [128, 9]
              - [256, 20]
              - [448, 23]
              - [704, 20]
              - [1024, 21]
              - [1408, 22]
              - [1856, 27]
              - [4288, 17]
              - [5056, 26]
              - [-1, 27]
          - - 1408
            - - [128, 12]
              - [256, 20]
              - [448, 23]
              - [704, 24]
              - [1024, 22]
              - [1408, 26]
              - [1856, 24]
              - [2368, 22]
              - [3584, 26]
              - [5056, 27]
              - [5888, 26]
              - [-1, 27]
          - - 1856
            - - [64, 12]
              - [128, 13]
              - [256, 20]
              - [448, 18]
              - [704, 20]
              - [1024, 26]
              - [1408, 22]
              - [2944, 17]
              - [4288, 26]
              - [5056, 17]
              - [5888, 26]
              - [-1, 17]
          - - 2368
            - - [64, 12]
              - [128, 13]
              - [256, 20]
              - [448, 23]
              - [704, 20]
              - [1408, 22]
              - [2368, 17]
              - [-1, 26]
          - - 2944
            - - [128, 12]
              - [256, 20]
              - [448, 22]
              - [704, 17]
              - [1024, 22]
              - [1408, 26]
              - [1856, 22]
              - [2944, 26]
              - [5056, 17]
              - [-1, 26]
          - - 3584
            - - [64, 12]
              - [128, 23]
              - [256, 24]
              - [448, 23]
              - [704, 17]
              - [1024, 22]
              - [1408, 26]
              - [1856, 17]
              - [2944, 26]
              - [3584, 27]
              - [4288, 26]
              - [5056, 27]
              - [5888, 26]
              - [-1, 27]
          - - 4288
            - - [128, 12]
              - [256, 20]
              - [448, 24]
              - [704, 17]
              - [1024, 22]
              - [1408, 26]
              - [1856, 27]
              - [2368, 17]
              - [3584, 27]
              - [4288, 17]
              - [-1, 27]
          - - 5056
            - - [64, 12]
              - [448, 20]
              - [704, 17]
              - [1408, 27]
              - [1856, 19]
              - [3584, 27]
              - [4288, 19]
              - [-1, 27]
          - - 5888
            - - [64, 12]
              - [128, 23]
              - [256, 19]
              - [448, 22]
              - [704, 17]
              - [1024, 26]
              - [1408, 27]
              - [1856, 17]
              - [5056, 27]
              - [-1, 26]
          - - -1
            - - [64, 23]
              - [128, 18]
              - [256, 20]
              - [448, 24]
              - [1024, 27]
              - [1856, 22]
              - [2368, 27]
              - [2944, 26]
              - [5056, 27]
              - [5888, 26]
              - [-1, 27]
