library/src/blas3/Tensile/Logic/mi25_deepbench/Tensile_Cijk_Ailk_Bjlk_SB.yaml
- {MinimumRequiredVersion: 3.3.0}
- Tensile
- default
- AssignedDerivedParameters: true
- - - [4096, 7133, 1, 4096]
    - [13, 11097.3]
  - - [512, 16, 1, 512]
    - [4, 325.867]
  - - [1760, 7133, 1, 1760]
    - [8, 10386.3]
  - - [2560, 7133, 1, 2560]
    - [8, 10934.3]
  - - [1024, 32, 1, 512]
    - [3, 1003.95]
  - - [3072, 7435, 1, 1024]
    - [8, 10098.3]
  - - [512, 32, 1, 512]
    - [5, 553.818]
  - - [2048, 7133, 1, 2048]
    - [12, 10658.5]
  - - [7680, 5481, 1, 2560]
    - [8, 11011.4]
  - - [1024, 16, 1, 512]
    - [6, 533.757]
- - - -1
    - - - -1
        - - - 64
            - - [128, 2]
              - [704, 9]
              - [1024, 10]
              - [1408, 8]
              - [1856, 9]
              - [2944, 8]
              - [3584, 10]
              - [-1, 8]
          - - 128
            - - [64, 4]
              - [128, 5]
              - [704, 1]
              - [1408, 7]
              - [1856, 1]
              - [3584, 7]
              - [4288, 1]
              - [5056, 7]
              - [5888, 11]
              - [-1, 7]
          - - 256
            - - [64, 4]
              - [256, 2]
              - [448, 0]
              - [2368, 11]
              - [2944, 9]
              - [-1, 11]
          - - 448
            - - [64, 1]
              - [128, 2]
              - [256, 0]
              - [448, 1]
              - [704, 11]
              - [1024, 9]
              - [1408, 11]
              - [1856, 9]
              - [3584, 11]
              - [4288, 8]
              - [5888, 11]
              - [-1, 8]
          - - 704
            - - [64, 1]
              - [128, 2]
              - [256, 11]
              - [448, 9]
              - [1856, 11]
              - [2368, 9]
              - [5888, 8]
              - [-1, 11]
          - - 1024
            - - [64, 1]
              - [128, 7]
              - [704, 9]
              - [1408, 12]
              - [1856, 10]
              - [3584, 12]
              - [4288, 9]
              - [-1, 12]
          - - 1408
            - - [128, 2]
              - [256, 9]
              - [704, 11]
              - [1408, 8]
              - [1856, 12]
              - [2368, 11]
              - [-1, 8]
          - - 1856
            - - [64, 0]
              - [128, 2]
              - [704, 11]
              - [1024, 12]
              - [1856, 8]
              - [2368, 11]
              - [-1, 8]
          - - 2368
            - - [64, 2]
              - [128, 7]
              - [256, 9]
              - [448, 11]
              - [704, 9]
              - [1024, 10]
              - [1856, 11]
              - [-1, 8]
          - - 2944
            - - [128, 7]
              - [704, 11]
              - [1024, 10]
              - [2944, 8]
              - [3584, 10]
              - [-1, 8]
          - - 3584
            - - [64, 0]
              - [448, 9]
              - [704, 12]
              - [1024, 10]
              - [1408, 8]
              - [1856, 12]
              - [2944, 8]
              - [3584, 10]
              - [-1, 8]
          - - 4288
            - - [128, 2]
              - [256, 9]
              - [704, 12]
              - [1024, 10]
              - [2944, 8]
              - [3584, 10]
              - [-1, 8]
          - - 5056
            - - [128, 7]
              - [448, 9]
              - [704, 12]
              - [1024, 10]
              - [2944, 8]
              - [3584, 10]
              - [-1, 8]
          - - 5888
            - - [64, 7]
              - [128, 9]
              - [256, 8]
              - [448, 9]
              - [704, 12]
              - [1024, 10]
              - [1408, 8]
              - [2368, 12]
              - [2944, 8]
              - [3584, 10]
              - [-1, 8]
          - - -1
            - - [128, 7]
              - [256, 9]
              - [448, 12]
              - [704, 9]
              - [1024, 10]
              - [1856, 8]
              - [2368, 12]
              - [2944, 8]
              - [3584, 10]
              - [-1, 8]
