library/src/blas3/Tensile/Logic/mi25_deepbench/Tensile_Cijk_Ailk_Bljk_SB.yaml
- {MinimumRequiredVersion: 3.3.0}
- Tensile
- default
- AssignedDerivedParameters: true
- - - [4096, 7000, 1, 4096]
    - [60, 9881.22]
  - - [5124, 9124, 1, 1760]
    - [57, 10432.7]
  - - [5124, 9124, 1, 2560]
    - [57, 10013.8]
  - - [1760, 32, 1, 1760]
    - [17, 3125.29]
  - - [1024, 1500, 1, 1536]
    - [59, 7874.87]
  - - [512, 24000, 1, 1536]
    - [57, 9361.41]
  - - [3072, 24000, 1, 1024]
    - [50, 9349.28]
  - - [1024, 3000, 1, 2560]
    - [50, 8783.21]
  - - [7680, 4, 1, 2560]
    - [23, 765.854]
  - - [35, 1500, 1, 2048]
    - [11, 1961.04]
  - - [8448, 1500, 1, 2816]
    - [57, 9921.29]
  - - [2560, 7000, 1, 2560]
    - [57, 10028.1]
  - - [3072, 16, 1, 1024]
    - [42, 1782.81]
  - - [512, 48000, 1, 2048]
    - [53, 9681.85]
  - - [1760, 64, 1, 1760]
    - [41, 4275.72]
  - - [1024, 16, 1, 512]
    - [22, 586.865]
  - - [512, 48000, 1, 1536]
    - [57, 9738.2]
  - - [2560, 32, 1, 2560]
    - [34, 3865.06]
  - - [4608, 1500, 1, 1536]
    - [57, 8979.11]
  - - [2048, 128, 1, 2048]
    - [14, 4609.02]
  - - [1024, 24000, 1, 2560]
    - [57, 9827.44]
  - - [4608, 3000, 1, 1536]
    - [57, 9565.02]
  - - [5124, 9124, 1, 2048]
    - [50, 9572.2]
  - - [1024, 700, 1, 512]
    - [52, 5176.37]
  - - [3072, 1, 1, 128]
    - [21, 36.1406]
  - - [5124, 700, 1, 2560]
    - [49, 8385.07]
  - - [8448, 16, 1, 2816]
    - [18, 2901.1]
  - - [6144, 6000, 1, 2560]
    - [60, 9833.66]
  - - [4608, 32, 1, 1536]
    - [39, 3787.11]
  - - [35, 8457, 1, 2560]
    - [13, 3626.81]
  - - [3072, 64, 1, 1024]
    - [39, 3592.74]
  - - [512, 16, 1, 512]
    - [16, 403.982]
  - - [7680, 2, 1, 2560]
    - [19, 384.794]
  - - [4224, 1, 1, 128]
    - [21, 43.6962]
  - - [7680, 1, 1, 2560]
    - [23, 193.609]
  - - [128, 1500, 1, 1280]
    - [40, 4682.81]
  - - [35, 8457, 1, 4096]
    - [12, 3699.05]
  - - [1024, 1500, 1, 2816]
    - [57, 8519.99]
  - - [6144, 2, 1, 2560]
    - [16, 373.297]
  - - [8448, 48000, 1, 2816]
    - [57, 10400.2]
  - - [512, 6000, 1, 1536]
    - [53, 8358.99]
  - - [4224, 1500, 1, 176]
    - [47, 5769.39]
  - - [1024, 6000, 1, 2816]
    - [57, 9713.22]
  - - [512, 6000, 1, 2560]
    - [57, 8888.4]
  - - [512, 32, 1, 512]
    - [22, 627.469]
  - - [2560, 128, 1, 2560]
    - [39, 6015.41]
  - - [4608, 24000, 1, 1536]
    - [57, 9987.16]
  - - [512, 2, 1, 500000]
    - [3, 440.142]
  - - [7680, 48000, 1, 2560]
    - [57, 10420.9]
  - - [3072, 48000, 1, 1024]
    - [50, 9395.12]
  - - [1760, 16, 1, 1760]
    - [46, 1819.7]
  - - [512, 3000, 1, 2816]
    - [59, 8500.93]
  - - [1760, 7000, 1, 1760]
    - [57, 10067.4]
  - - [1024, 3000, 1, 2048]
    - [50, 8318.12]
  - - [6144, 4, 1, 2560]
    - [15, 737.262]
  - - [1024, 6000, 1, 2048]
    - [50, 8948.72]
  - - [512, 24000, 1, 2816]
    - [57, 9966.07]
  - - [6144, 48000, 1, 2560]
    - [60, 10221.1]
  - - [8448, 3000, 1, 2816]
    - [57, 10126.5]
  - - [35, 1500, 1, 2560]
    - [7, 2416.81]
  - - [3072, 4, 1, 1024]
    - [21, 514.371]
  - - [4608, 48000, 1, 1536]
    - [57, 9976.5]
  - - [2048, 32, 1, 2048]
    - [32, 3015.0]
  - - [7680, 1500, 1, 2560]
    - [57, 9737.26]
  - - [4096, 128, 1, 4096]
    - [52, 6492.85]
  - - [4608, 16, 1, 1536]
    - [35, 2366.25]
  - - [1024, 1500, 1, 2048]
    - [50, 7854.37]
  - - [3072, 3000, 1, 1024]
    - [50, 8585.02]
  - - [3072, 2, 1, 1024]
    - [38, 245.072]
  - - [8448, 1, 1, 2816]
    - [0, 192.15]
  - - [1024, 48000, 1, 2560]
    - [60, 10068.2]
  - - [1024, 3000, 1, 2816]
    - [57, 9152.69]
  - - [128, 1, 1, 1408]
    - [37, 19.1996]
  - - [35, 8457, 1, 1760]
    - [8, 3919.58]
  - - [1024, 2, 1, 512]
    - [37, 95.1327]
  - - [1024, 4, 1, 500000]
    - [6, 883.741]
  - - [6144, 1, 1, 2560]
    - [16, 186.648]
  - - [1024, 48000, 1, 2816]
    - [57, 10151.8]
  - - [512, 48000, 1, 2816]
    - [57, 10239.0]
  - - [2048, 16, 1, 2048]
    - [20, 1918.1]
  - - [1024, 24000, 1, 1536]
    - [57, 9551.24]
  - - [7680, 6000, 1, 2560]
    - [57, 10231.0]
  - - [1760, 128, 1, 1760]
    - [25, 5305.01]
  - - [35, 8457, 1, 2048]
    - [7, 3214.36]
  - - [512, 1500, 1, 2816]
    - [52, 7934.28]
  - - [512, 1, 1, 512]
    - [29, 24.0938]
  - - [512, 16, 1, 500000]
    - [1, 3397.35]
  - - [512, 8, 1, 500000]
    - [4, 1733.65]
  - - [512, 24000, 1, 2560]
    - [57, 9766.36]
  - - [6144, 3000, 1, 2560]
    - [60, 9647.5]
  - - [1024, 24000, 1, 2816]
    - [57, 9905.51]
  - - [2048, 7000, 1, 2048]
    - [53, 9401.29]
  - - [7680, 3000, 1, 2560]
    - [57, 10039.5]
  - - [1024, 4, 1, 512]
    - [16, 184.318]
  - - [5124, 700, 1, 2048]
    - [54, 7853.52]
  - - [5124, 9124, 1, 4096]
    - [60, 9724.97]
  - - [4096, 64, 1, 4096]
    - [39, 5307.26]
  - - [512, 6000, 1, 2048]
    - [54, 8150.31]
  - - [7680, 32, 1, 2560]
    - [14, 4850.42]
  - - [2560, 64, 1, 2560]
    - [39, 4952.21]
  - - [3072, 128, 1, 1024]
    - [52, 3995.89]
  - - [8448, 6000, 1, 2816]
    - [57, 10319.2]
  - - [7680, 64, 1, 2560]
    - [39, 6314.9]
  - - [5124, 1500, 1, 2560]
    - [57, 9135.88]
  - - [1024, 1500, 1, 2560]
    - [59, 8371.65]
  - - [512, 4, 1, 512]
    - [37, 109.227]
  - - [1024, 6000, 1, 2560]
    - [57, 9267.53]
  - - [3072, 32, 1, 1024]
    - [36, 2449.03]
  - - [35, 700, 1, 2560]
    - [10, 1841.31]
  - - [4608, 1, 1, 1536]
    - [31, 159.505]
  - - [4096, 32, 1, 4096]
    - [19, 4851.93]
  - - [7680, 24000, 1, 2560]
    - [57, 10332.6]
  - - [8448, 4, 1, 2816]
    - [44, 756.862]
  - - [64, 1, 1, 1216]
    - [28, 7.29574]
  - - [512, 1, 1, 500000]
    - [3, 220.462]
  - - [176, 1500, 1, 1408]
    - [40, 4747.57]
  - - [512, 3000, 1, 1536]
    - [59, 7767.92]
  - - [8448, 24000, 1, 2816]
    - [57, 10319.1]
  - - [4608, 2, 1, 1536]
    - [35, 317.482]
  - - [1024, 48000, 1, 1536]
    - [50, 9680.13]
  - - [7680, 128, 1, 2560]
    - [56, 7752.15]
  - - [3072, 6000, 1, 1024]
    - [50, 9001.37]
  - - [3072, 1500, 1, 128]
    - [48, 4134.7]
  - - [1024, 3000, 1, 1536]
    - [59, 8404.52]
  - - [512, 4, 1, 500000]
    - [5, 876.693]
  - - [35, 700, 1, 2048]
    - [9, 1507.66]
  - - [1024, 16, 1, 500000]
    - [2, 3458.86]
  - - [512, 24000, 1, 2048]
    - [50, 9282.26]
  - - [1024, 32, 1, 512]
    - [21, 1030.23]
  - - [512, 48000, 1, 2560]
    - [57, 10160.2]
  - - [2560, 16, 1, 2560]
    - [33, 2329.42]
  - - [2048, 64, 1, 2048]
    - [26, 3855.77]
  - - [512, 2, 1, 512]
    - [29, 49.816]
  - - [1024, 1, 1, 512]
    - [37, 45.5092]
  - - [512, 1500, 1, 2560]
    - [52, 7595.42]
  - - [6144, 32, 1, 2560]
    - [25, 4560.37]
  - - [1024, 1, 1, 500000]
    - [2, 221.82]
  - - [6144, 16, 1, 2560]
    - [45, 2849.31]
  - - [1024, 24000, 1, 2048]
    - [53, 9737.26]
  - - [4096, 16, 1, 4096]
    - [27, 2939.87]
  - - [5124, 1500, 1, 2048]
    - [50, 8617.59]
  - - [3072, 1500, 1, 1024]
    - [53, 8008.89]
  - - [1024, 2, 1, 500000]
    - [2, 442.74]
  - - [1024, 8, 1, 500000]
    - [6, 1757.56]
  - - [7680, 16, 1, 2560]
    - [23, 2954.96]
  - - [6144, 1500, 1, 2560]
    - [60, 9351.9]
  - - [3072, 1, 1, 1024]
    - [30, 122.876]
  - - [512, 6000, 1, 2816]
    - [57, 9180.32]
  - - [8448, 2, 1, 2816]
    - [43, 382.542]
  - - [4608, 4, 1, 1536]
    - [35, 629.938]
  - - [1024, 6000, 1, 1536]
    - [50, 8964.28]
  - - [8448, 32, 1, 2816]
    - [40, 4930.94]
  - - [512, 3000, 1, 2048]
    - [58, 7206.87]
  - - [6144, 24000, 1, 2560]
    - [60, 10134.3]
  - - [512, 3000, 1, 2560]
    - [59, 8248.02]
  - - [4608, 6000, 1, 1536]
    - [57, 9810.62]
  - - [512, 1500, 1, 2048]
    - [56, 5915.46]
  - - [512, 1500, 1, 1536]
    - [52, 7008.22]
  - - [128, 1, 1, 1024]
    - [24, 12.7996]
  - - [1024, 48000, 1, 2048]
    - [53, 9834.61]
- - - -1
    - - - -1
        - - - 64
            - - [64, 34]
              - [128, 39]
              - [704, 52]
              - [-1, 57]
          - - 128
            - - [64, 29]
              - [128, 46]
              - [256, 43]
              - [448, 41]
              - [704, 34]
              - [1024, 14]
              - [1408, 39]
              - [5056, 40]
              - [5888, 52]
              - [-1, 56]
          - - 256
            - - [64, 46]
              - [128, 32]
              - [256, 34]
              - [448, 41]
              - [2944, 52]
              - [3584, 56]
              - [5056, 52]
              - [5888, 55]
              - [-1, 52]
          - - 448
            - - [64, 32]
              - [256, 41]
              - [448, 26]
              - [1408, 52]
              - [1856, 56]
              - [2368, 52]
              - [2944, 55]
              - [3584, 52]
              - [4288, 51]
              - [5056, 52]
              - [5888, 57]
              - [-1, 51]
          - - 704
            - - [64, 44]
              - [128, 34]
              - [2368, 52]
              - [5888, 51]
              - [-1, 57]
          - - 1024
            - - [64, 17]
              - [128, 39]
              - [704, 52]
              - [1024, 56]
              - [2944, 57]
              - [3584, 55]
              - [5056, 57]
              - [-1, 55]
          - - 1408
            - - [64, 34]
              - [128, 39]
              - [448, 52]
              - [704, 56]
              - [1408, 57]
              - [1856, 55]
              - [-1, 57]
          - - 1856
            - - [64, 39]
              - [128, 14]
              - [256, 52]
              - [448, 56]
              - [704, 52]
              - [1024, 57]
              - [1408, 51]
              - [2944, 57]
              - [3584, 51]
              - [5056, 57]
              - [5888, 51]
              - [-1, 57]
          - - 2368
            - - [64, 34]
              - [128, 39]
              - [704, 52]
              - [-1, 57]
          - - 2944
            - - [128, 39]
              - [256, 52]
              - [-1, 57]
          - - 3584
            - - [64, 39]
              - [128, 52]
              - [256, 56]
              - [448, 52]
              - [1408, 55]
              - [-1, 57]
          - - 4288
            - - [128, 34]
              - [256, 52]
              - [-1, 57]
          - - 5056
            - - [128, 39]
              - [448, 52]
              - [-1, 57]
          - - 5888
            - - [64, 39]
              - [128, 52]
              - [256, 55]
              - [-1, 57]
          - - -1
            - - [64, 39]
              - [128, 56]
              - [256, 52]
              - [-1, 57]
