library/src/blas3/Tensile/Logic/asm_full/vega20/vega20_Cijk_Ailk_Bjlk_HB_GB.yaml
- {MinimumRequiredVersion: 4.26.0}
- vega20
- gfx906
- [Device 66a0, Device 66a1, Device 66a7, Device 66af, Vega 20]
    SolutionIndex: 0
    SolutionNameMin: Cijk_Ailk_Bjlk_HB_GB_MT32x32x8_SN_GRVW4_LRVW4_TT4_4_VW4_WG8_8_1_WGM1
    SolutionIndex: 1
    SolutionNameMin: Cijk_Ailk_Bjlk_HB_GB_MT64x64x8_SN_GRVW4_LRVW4_TT4_4_VW4_WG16_16_1_WGM1
    SolutionIndex: 2
    SolutionNameMin: Cijk_Ailk_Bjlk_HB_GB_MT32x32x16_SN_GRVW4_LRVW4_TT4_4_VW4_WG8_8_1_WGM1
    SolutionIndex: 3
    SolutionNameMin: Cijk_Ailk_Bjlk_HB_GB_MT64x64x16_SN_GRVW4_LRVW4_TT4_4_VW4_WG16_16_1_WGM1
    SolutionIndex: 4
    SolutionNameMin: Cijk_Ailk_Bjlk_HB_GB_MT128x64x16_SN_GRVW4_LRVW4_TT8_4_VW4_WG16_16_1_WGM1
    SolutionIndex: 5
    SolutionNameMin: Cijk_Ailk_Bjlk_HB_GB_MT32x32x32_SN_GRVW4_LRVW4_TT4_4_VW4_WG8_8_1_WGM1
    SolutionIndex: 6
    SolutionNameMin: Cijk_Ailk_Bjlk_HB_GB_MT64x64x32_SN_GRVW4_LRVW4_TT4_4_VW4_WG16_16_1_WGM1
    SolutionIndex: 7
    SolutionNameMin: Cijk_Ailk_Bjlk_HB_GB_MT32x32x8_SN_GRVW2_LRVW2_TT4_4_VW2_WG8_8_1_WGM1
    SolutionIndex: 8
    SolutionNameMin: Cijk_Ailk_Bjlk_HB_GB_MT128x64x8_SN_GRVW2_LRVW2_TT8_4_VW2_WG16_16_1_WGM1
    SolutionIndex: 9
    SolutionNameMin: Cijk_Ailk_Bjlk_HB_GB_MT64x64x16_SN_GRVW2_LRVW2_TT4_4_VW2_WG16_16_1_WGM1
    SolutionIndex: 10
    SolutionNameMin: Cijk_Ailk_Bjlk_HB_GB_MT128x64x16_SN_GRVW2_LRVW2_TT8_4_VW2_WG16_16_1_WGM1
    SolutionIndex: 11
    SolutionNameMin: Cijk_Ailk_Bjlk_HB_GB_MT32x32x8_SN_GRVW4_LRVW4_TT4_4_VW4_WG8_8_1_WGM8
    SolutionIndex: 12
    SolutionNameMin: Cijk_Ailk_Bjlk_HB_GB_MT64x64x8_SN_GRVW4_LRVW4_TT4_4_VW4_WG16_16_1_WGM8
    SolutionIndex: 13
    SolutionNameMin: Cijk_Ailk_Bjlk_HB_GB_MT32x32x16_SN_GRVW4_LRVW4_TT4_4_VW4_WG8_8_1_WGM8
    SolutionIndex: 14
    SolutionNameMin: Cijk_Ailk_Bjlk_HB_GB_MT64x64x16_SN_GRVW4_LRVW4_TT4_4_VW4_WG16_16_1_WGM8
    SolutionIndex: 15
    SolutionNameMin: Cijk_Ailk_Bjlk_HB_GB_MT64x128x16_SN_GRVW4_LRVW4_TT4_8_VW4_WG16_16_1_WGM8
    SolutionIndex: 16
    SolutionNameMin: Cijk_Ailk_Bjlk_HB_GB_MT32x32x32_SN_GRVW4_LRVW4_TT4_4_VW4_WG8_8_1_WGM8
    SolutionIndex: 17
    SolutionNameMin: Cijk_Ailk_Bjlk_HB_GB_MT64x64x32_SN_GRVW4_LRVW4_TT4_4_VW4_WG16_16_1_WGM8
- - - [32, 32, 8, 32, 32, 32, 32, 32]
    - [7, 93.0]
  - - [32, 32, 8, 64, 32, 32, 32, 32]
    - [0, 148.0]
  - - [32, 32, 8, 128, 32, 32, 32, 32]
    - [0, 208.0]
  - - [32, 32, 8, 256, 32, 32, 32, 32]
    - [13, 269.0]
  - - [32, 32, 8, 512, 32, 32, 32, 32]
    - [13, 322.0]
  - - [32, 64, 8, 32, 32, 32, 32, 64]
    - [0, 197.0]
  - - [32, 64, 8, 64, 32, 32, 32, 64]
    - [0, 305.0]
  - - [32, 64, 8, 128, 32, 32, 32, 64]
    - [0, 428.0]
  - - [32, 64, 8, 256, 32, 32, 32, 64]
    - [2, 556.0]
  - - [32, 64, 8, 512, 32, 32, 32, 64]
    - [13, 655.0]
  - - [32, 128, 8, 32, 32, 32, 32, 128]
    - [0, 406.0]
  - - [32, 128, 8, 64, 32, 32, 32, 128]
    - [0, 632.0]
  - - [32, 128, 8, 128, 32, 32, 32, 128]
    - [2, 880.0]
  - - [32, 128, 8, 256, 32, 32, 32, 128]
    - [2, 1135.0]
  - - [32, 128, 8, 512, 32, 32, 32, 128]
    - [13, 1329.0]
  - - [32, 256, 8, 32, 32, 32, 32, 256]
    - [0, 814.0]
  - - [32, 256, 8, 64, 32, 32, 32, 256]
    - [11, 1237.0]
  - - [32, 256, 8, 128, 32, 32, 32, 256]
    - [2, 1771.0]
  - - [32, 256, 8, 256, 32, 32, 32, 256]
    - [2, 2265.0]
  - - [32, 256, 8, 512, 32, 32, 32, 256]
    - [16, 2617.0]
  - - [32, 512, 8, 32, 32, 32, 32, 512]
    - [0, 1589.0]
  - - [32, 512, 8, 64, 32, 32, 32, 512]
    - [11, 2383.0]
  - - [32, 512, 8, 128, 32, 32, 32, 512]
    - [2, 3421.0]
  - - [32, 512, 8, 256, 32, 32, 32, 512]
    - [2, 4365.0]
  - - [32, 512, 8, 512, 32, 32, 32, 512]
    - [13, 5124.0]
  - - [64, 32, 8, 32, 64, 64, 64, 32]
    - [7, 197.0]
  - - [64, 32, 8, 64, 64, 64, 64, 32]
    - [0, 310.0]
  - - [64, 32, 8, 128, 64, 64, 64, 32]
    - [2, 430.0]
  - - [64, 32, 8, 256, 64, 64, 64, 32]
    - [2, 555.0]
  - - [64, 32, 8, 512, 64, 64, 64, 32]
    - [13, 657.0]
  - - [64, 64, 8, 32, 64, 64, 64, 64]
    - [0, 400.0]
  - - [64, 64, 8, 64, 64, 64, 64, 64]
    - [11, 626.0]
  - - [64, 64, 8, 128, 64, 64, 64, 64]
    - [13, 878.0]
  - - [64, 64, 8, 256, 64, 64, 64, 64]
    - [2, 1132.0]
  - - [64, 64, 8, 512, 64, 64, 64, 64]
    - [5, 1326.0]
  - - [64, 128, 8, 32, 64, 64, 64, 128]
    - [0, 814.0]
  - - [64, 128, 8, 64, 64, 64, 64, 128]
    - [11, 1254.0]
  - - [64, 128, 8, 128, 64, 64, 64, 128]
    - [2, 1771.0]
  - - [64, 128, 8, 256, 64, 64, 64, 128]
    - [13, 2280.0]
  - - [64, 128, 8, 512, 64, 64, 64, 128]
    - [5, 2658.0]
  - - [64, 256, 8, 32, 64, 64, 64, 256]
    - [1, 1613.0]
  - - [64, 256, 8, 64, 64, 64, 64, 256]
    - [1, 2515.0]
  - - [64, 256, 8, 128, 64, 64, 64, 256]
    - [2, 3489.0]
  - - [64, 256, 8, 256, 64, 64, 64, 256]
    - [2, 4500.0]
  - - [64, 256, 8, 512, 64, 64, 64, 256]
    - [2, 5185.0]
  - - [64, 512, 8, 32, 64, 64, 64, 512]
    - [1, 3158.0]
  - - [64, 512, 8, 64, 64, 64, 64, 512]
    - [1, 4810.0]
  - - [64, 512, 8, 128, 64, 64, 64, 512]
    - [2, 6626.0]
  - - [64, 512, 8, 256, 64, 64, 64, 512]
    - [2, 8431.0]
  - - [64, 512, 8, 512, 64, 64, 64, 512]
    - [17, 9910.0]
  - - [128, 32, 8, 32, 128, 128, 128, 32]
    - [7, 403.0]
  - - [128, 32, 8, 64, 128, 128, 128, 32]
    - [0, 629.0]
  - - [128, 32, 8, 128, 128, 128, 128, 32]
    - [2, 880.0]
  - - [128, 32, 8, 256, 128, 128, 128, 32]
    - [2, 1132.0]
  - - [128, 32, 8, 512, 128, 128, 128, 32]
    - [13, 1330.0]
  - - [128, 64, 8, 32, 128, 128, 128, 64]
    - [5, 814.0]
  - - [128, 64, 8, 64, 128, 128, 128, 64]
    - [0, 1248.0]
  - - [128, 64, 8, 128, 128, 128, 128, 64]
    - [13, 1771.0]
  - - [128, 64, 8, 256, 128, 128, 128, 64]
    - [13, 2267.0]
  - - [128, 64, 8, 512, 128, 128, 128, 64]
    - [5, 2668.0]
  - - [128, 128, 8, 32, 128, 128, 128, 128]
    - [12, 1618.0]
  - - [128, 128, 8, 64, 128, 128, 128, 128]
    - [1, 2497.0]
  - - [128, 128, 8, 128, 128, 128, 128, 128]
    - [2, 3427.0]
  - - [128, 128, 8, 256, 128, 128, 128, 128]
    - [13, 4462.0]
  - - [128, 128, 8, 512, 128, 128, 128, 128]
    - [16, 5227.0]
  - - [128, 256, 8, 32, 128, 128, 128, 256]
    - [1, 3139.0]
  - - [128, 256, 8, 64, 128, 128, 128, 256]
    - [1, 4810.0]
  - - [128, 256, 8, 128, 128, 128, 128, 256]
    - [2, 6743.0]
  - - [128, 256, 8, 256, 128, 128, 128, 256]
    - [2, 8666.0]
  - - [128, 256, 8, 512, 128, 128, 128, 256]
    - [6, 9986.0]
  - - [128, 512, 8, 32, 128, 128, 128, 512]
    - [1, 5622.0]
  - - [128, 512, 8, 64, 128, 128, 128, 512]
    - [1, 8613.0]
  - - [128, 512, 8, 128, 128, 128, 128, 512]
    - [3, 11570.0]
  - - [128, 512, 8, 256, 128, 128, 128, 512]
    - [3, 14678.0]
  - - [128, 512, 8, 512, 128, 128, 128, 512]
    - [17, 17252.0]
  - - [256, 32, 8, 32, 256, 256, 256, 32]
    - [0, 809.0]
  - - [256, 32, 8, 64, 256, 256, 256, 32]
    - [0, 1260.0]
  - - [256, 32, 8, 128, 256, 256, 256, 32]
    - [2, 1768.0]
  - - [256, 32, 8, 256, 256, 256, 256, 32]
    - [13, 2262.0]
  - - [256, 32, 8, 512, 256, 256, 256, 32]
    - [13, 2635.0]
  - - [256, 64, 8, 32, 256, 256, 256, 64]
    - [12, 1603.0]
  - - [256, 64, 8, 64, 256, 256, 256, 64]
    - [1, 2491.0]
  - - [256, 64, 8, 128, 256, 256, 256, 64]
    - [2, 3416.0]
  - - [256, 64, 8, 256, 256, 256, 256, 64]
    - [13, 4467.0]
  - - [256, 64, 8, 512, 256, 256, 256, 64]
    - [2, 5162.0]
  - - [256, 128, 8, 32, 256, 256, 256, 128]
    - [9, 3066.0]
  - - [256, 128, 8, 64, 256, 256, 256, 128]
    - [1, 4702.0]
  - - [256, 128, 8, 128, 256, 256, 256, 128]
    - [13, 6658.0]
  - - [256, 128, 8, 256, 256, 256, 256, 128]
    - [13, 8684.0]
  - - [256, 128, 8, 512, 256, 256, 256, 128]
    - [13, 9992.0]
  - - [256, 256, 8, 32, 256, 256, 256, 256]
    - [1, 5447.0]
  - - [256, 256, 8, 64, 256, 256, 256, 256]
    - [1, 8490.0]
  - - [256, 256, 8, 128, 256, 256, 256, 256]
    - [3, 11603.0]
  - - [256, 256, 8, 256, 256, 256, 256, 256]
    - [3, 14743.0]
  - - [256, 256, 8, 512, 256, 256, 256, 256]
    - [6, 17261.0]
  - - [256, 512, 8, 32, 256, 256, 256, 512]
    - [1, 8738.0]
  - - [256, 512, 8, 64, 256, 256, 256, 512]
    - [1, 12446.0]
  - - [256, 512, 8, 128, 256, 256, 256, 512]
    - [3, 16009.0]
  - - [256, 512, 8, 256, 256, 256, 256, 512]
    - [3, 19011.0]
  - - [256, 512, 8, 512, 256, 256, 256, 512]
    - [3, 20900.0]
  - - [512, 32, 8, 32, 512, 512, 512, 32]
    - [0, 1560.0]
  - - [512, 32, 8, 64, 512, 512, 512, 32]
    - [0, 2383.0]
  - - [512, 32, 8, 128, 512, 512, 512, 32]
    - [2, 3410.0]
  - - [512, 32, 8, 256, 512, 512, 512, 32]
    - [13, 4346.0]
  - - [512, 32, 8, 512, 512, 512, 512, 32]
    - [13, 5140.0]
  - - [512, 64, 8, 32, 512, 512, 512, 64]
    - [1, 2857.0]
  - - [512, 64, 8, 64, 512, 512, 512, 64]
    - [11, 4629.0]
  - - [512, 64, 8, 128, 512, 512, 512, 64]
    - [13, 6513.0]
  - - [512, 64, 8, 256, 512, 512, 512, 64]
    - [13, 8431.0]
  - - [512, 64, 8, 512, 512, 512, 512, 64]
    - [13, 9945.0]
  - - [512, 128, 8, 32, 512, 512, 512, 128]
    - [11, 5230.0]
  - - [512, 128, 8, 64, 512, 512, 512, 128]
    - [11, 8128.0]
  - - [512, 128, 8, 128, 512, 512, 512, 128]
    - [13, 11429.0]
  - - [512, 128, 8, 256, 512, 512, 512, 128]
    - [13, 14653.0]
  - - [512, 128, 8, 512, 512, 512, 512, 128]
    - [17, 17155.0]
  - - [512, 256, 8, 32, 512, 512, 512, 256]
    - [12, 8595.0]
  - - [512, 256, 8, 64, 512, 512, 512, 256]
    - [12, 11865.0]
  - - [512, 256, 8, 128, 512, 512, 512, 256]
    - [3, 15709.0]
  - - [512, 256, 8, 256, 512, 512, 512, 256]
    - [14, 18893.0]
  - - [512, 256, 8, 512, 512, 512, 512, 256]
    - [14, 20945.0]
  - - [512, 512, 8, 32, 512, 512, 512, 512]
    - [10, 11603.0]
  - - [512, 512, 8, 64, 512, 512, 512, 512]
    - [8, 16147.0]
  - - [512, 512, 8, 128, 512, 512, 512, 512]
    - [10, 19925.0]
  - - [512, 512, 8, 256, 512, 512, 512, 512]
    - [15, 22207.0]
  - - [512, 512, 8, 512, 512, 512, 512, 512]
    - [4, 23980.0]
- null
