library/src/blas3/Tensile/Logic/asm_full/vega20/vega20_Cijk_Ailk_Bljk_SB_GB.yaml
- {MinimumRequiredVersion: 4.26.0}
- vega20
- gfx906
- [Device 66a0, Device 66a1, Device 66a7, Device 66af, Vega 20]
    SolutionIndex: 0
    SolutionNameMin: Cijk_Ailk_Bljk_SB_GB_MT32x32x8_SN_AMAS3_GRVW4_LRVW4_TT4_4_VW4_WG8_8_1_WGM1
    SolutionIndex: 1
    SolutionNameMin: Cijk_Ailk_Bljk_SB_GB_MT128x64x8_SN_AMAS3_GRVW4_LRVW4_TT8_4_VW4_WG16_16_1_WGM1
    SolutionIndex: 2
    SolutionNameMin: Cijk_Ailk_Bljk_SB_GB_MT128x128x8_SN_AMAS3_GRVW4_LRVW4_TT8_8_VW4_WG16_16_1_WGM1
    SolutionIndex: 3
    SolutionNameMin: Cijk_Ailk_Bljk_SB_GB_MT32x32x16_SN_AMAS3_GRVW4_LRVW4_TT4_4_VW4_WG8_8_1_WGM1
    SolutionIndex: 4
    SolutionNameMin: Cijk_Ailk_Bljk_SB_GB_MT64x64x16_SN_AMAS3_GRVW4_LRVW4_TT4_4_VW4_WG16_16_1_WGM1
    SolutionIndex: 5
    SolutionNameMin: Cijk_Ailk_Bljk_SB_GB_MT128x64x16_SN_AMAS3_GRVW4_LRVW4_TT8_4_VW4_WG16_16_1_WGM1
    SolutionIndex: 6
    SolutionNameMin: Cijk_Ailk_Bljk_SB_GB_MT64x128x16_SN_AMAS3_GRVW4_LRVW4_TT4_8_VW4_WG16_16_1_WGM1
    SolutionIndex: 7
    SolutionNameMin: Cijk_Ailk_Bljk_SB_GB_MT32x32x32_SN_AMAS3_GRVW4_LRVW4_TT4_4_VW4_WG8_8_1_WGM1
    SolutionIndex: 8
    SolutionNameMin: Cijk_Ailk_Bljk_SB_GB_MT64x64x32_SN_AMAS3_GRVW4_LRVW4_TT4_4_VW4_WG16_16_1_WGM1
    SolutionIndex: 9
    SolutionNameMin: Cijk_Ailk_Bljk_SB_GB_MT64x128x32_SN_AMAS3_GRVW4_LRVW4_TT4_8_VW4_WG16_16_1_WGM1
    SolutionIndex: 10
    SolutionNameMin: Cijk_Ailk_Bljk_SB_GB_MT64x64x8_SN_AMAS0_GRVW1_LRVW1_TT4_4_VW1_WG16_16_1_WGM1
    SolutionIndex: 11
    SolutionNameMin: Cijk_Ailk_Bljk_SB_GB_MT32x32x8_SN_AMAS3_GRVW4_LRVW4_TT4_4_VW4_WG8_8_1_WGM8
    SolutionIndex: 12
    SolutionNameMin: Cijk_Ailk_Bljk_SB_GB_MT32x32x16_SN_AMAS3_GRVW4_LRVW4_TT4_4_VW4_WG8_8_1_WGM8
    SolutionIndex: 13
    SolutionNameMin: Cijk_Ailk_Bljk_SB_GB_MT64x64x16_SN_AMAS3_GRVW4_LRVW4_TT4_4_VW4_WG16_16_1_WGM8
    SolutionIndex: 14
    SolutionNameMin: Cijk_Ailk_Bljk_SB_GB_MT64x64x32_SN_AMAS3_GRVW4_LRVW4_TT4_4_VW4_WG16_16_1_WGM8
- - - [32, 32, 8, 32, 32, 32, 32, 32]
    - [11, 87.0]
  - - [32, 32, 8, 64, 32, 32, 32, 64]
    - [0, 133.0]
  - - [32, 32, 8, 128, 32, 32, 32, 128]
    - [0, 178.0]
  - - [32, 32, 8, 256, 32, 32, 32, 256]
    - [3, 218.0]
  - - [32, 32, 8, 512, 32, 32, 32, 512]
    - [12, 248.0]
  - - [32, 64, 8, 32, 32, 32, 32, 32]
    - [3, 185.0]
  - - [32, 64, 8, 64, 32, 32, 32, 64]
    - [0, 275.0]
  - - [32, 64, 8, 128, 32, 32, 32, 128]
    - [3, 367.0]
  - - [32, 64, 8, 256, 32, 32, 32, 256]
    - [3, 447.0]
  - - [32, 64, 8, 512, 32, 32, 32, 512]
    - [3, 501.0]
  - - [32, 128, 8, 32, 32, 32, 32, 32]
    - [0, 374.0]
  - - [32, 128, 8, 64, 32, 32, 32, 64]
    - [3, 552.0]
  - - [32, 128, 8, 128, 32, 32, 32, 128]
    - [12, 742.0]
  - - [32, 128, 8, 256, 32, 32, 32, 256]
    - [12, 899.0]
  - - [32, 128, 8, 512, 32, 32, 32, 512]
    - [12, 995.0]
  - - [32, 256, 8, 32, 32, 32, 32, 32]
    - [0, 743.0]
  - - [32, 256, 8, 64, 32, 32, 32, 64]
    - [0, 1085.0]
  - - [32, 256, 8, 128, 32, 32, 32, 128]
    - [3, 1462.0]
  - - [32, 256, 8, 256, 32, 32, 32, 256]
    - [12, 1753.0]
  - - [32, 256, 8, 512, 32, 32, 32, 512]
    - [7, 1804.0]
  - - [32, 512, 8, 32, 32, 32, 32, 32]
    - [0, 1398.0]
  - - [32, 512, 8, 64, 32, 32, 32, 64]
    - [11, 2081.0]
  - - [32, 512, 8, 128, 32, 32, 32, 128]
    - [3, 2778.0]
  - - [32, 512, 8, 256, 32, 32, 32, 256]
    - [7, 2956.0]
  - - [32, 512, 8, 512, 32, 32, 32, 512]
    - [14, 2247.0]
  - - [64, 32, 8, 32, 64, 64, 64, 32]
    - [11, 185.0]
  - - [64, 32, 8, 64, 64, 64, 64, 64]
    - [0, 277.0]
  - - [64, 32, 8, 128, 64, 64, 64, 128]
    - [3, 367.0]
  - - [64, 32, 8, 256, 64, 64, 64, 256]
    - [12, 447.0]
  - - [64, 32, 8, 512, 64, 64, 64, 512]
    - [12, 502.0]
  - - [64, 64, 8, 32, 64, 64, 64, 32]
    - [0, 379.0]
  - - [64, 64, 8, 64, 64, 64, 64, 64]
    - [0, 561.0]
  - - [64, 64, 8, 128, 64, 64, 64, 128]
    - [3, 743.0]
  - - [64, 64, 8, 256, 64, 64, 64, 256]
    - [12, 902.0]
  - - [64, 64, 8, 512, 64, 64, 64, 512]
    - [12, 1003.0]
  - - [64, 128, 8, 32, 64, 64, 64, 32]
    - [0, 743.0]
  - - [64, 128, 8, 64, 64, 64, 64, 64]
    - [0, 1095.0]
  - - [64, 128, 8, 128, 64, 64, 64, 128]
    - [12, 1469.0]
  - - [64, 128, 8, 256, 64, 64, 64, 256]
    - [3, 1780.0]
  - - [64, 128, 8, 512, 64, 64, 64, 512]
    - [12, 1986.0]
  - - [64, 256, 8, 32, 64, 64, 64, 32]
    - [0, 1417.0]
  - - [64, 256, 8, 64, 64, 64, 64, 64]
    - [0, 2101.0]
  - - [64, 256, 8, 128, 64, 64, 64, 128]
    - [3, 2853.0]
  - - [64, 256, 8, 256, 64, 64, 64, 256]
    - [12, 3458.0]
  - - [64, 256, 8, 512, 64, 64, 64, 512]
    - [7, 3100.0]
  - - [64, 512, 8, 32, 64, 64, 64, 32]
    - [11, 2583.0]
  - - [64, 512, 8, 64, 64, 64, 64, 64]
    - [3, 3855.0]
  - - [64, 512, 8, 128, 64, 64, 64, 128]
    - [3, 5134.0]
  - - [64, 512, 8, 256, 64, 64, 64, 256]
    - [3, 4866.0]
  - - [64, 512, 8, 512, 64, 64, 64, 512]
    - [8, 4517.0]
  - - [128, 32, 8, 32, 128, 128, 128, 32]
    - [0, 378.0]
  - - [128, 32, 8, 64, 128, 128, 128, 64]
    - [0, 557.0]
  - - [128, 32, 8, 128, 128, 128, 128, 128]
    - [12, 743.0]
  - - [128, 32, 8, 256, 128, 128, 128, 256]
    - [12, 901.0]
  - - [128, 32, 8, 512, 128, 128, 128, 512]
    - [7, 998.0]
  - - [128, 64, 8, 32, 128, 128, 128, 32]
    - [0, 743.0]
  - - [128, 64, 8, 64, 128, 128, 128, 64]
    - [3, 1088.0]
  - - [128, 64, 8, 128, 128, 128, 128, 128]
    - [3, 1462.0]
  - - [128, 64, 8, 256, 128, 128, 128, 256]
    - [12, 1780.0]
  - - [128, 64, 8, 512, 128, 128, 128, 512]
    - [12, 1984.0]
  - - [128, 128, 8, 32, 128, 128, 128, 32]
    - [3, 1409.0]
  - - [128, 128, 8, 64, 128, 128, 128, 64]
    - [0, 2101.0]
  - - [128, 128, 8, 128, 128, 128, 128, 128]
    - [3, 2834.0]
  - - [128, 128, 8, 256, 128, 128, 128, 256]
    - [3, 3487.0]
  - - [128, 128, 8, 512, 128, 128, 128, 512]
    - [3, 3885.0]
  - - [128, 256, 8, 32, 128, 128, 128, 32]
    - [0, 2583.0]
  - - [128, 256, 8, 64, 128, 128, 128, 64]
    - [0, 3935.0]
  - - [128, 256, 8, 128, 128, 128, 128, 128]
    - [3, 5243.0]
  - - [128, 256, 8, 256, 128, 128, 128, 256]
    - [3, 6365.0]
  - - [128, 256, 8, 512, 128, 128, 128, 512]
    - [14, 5561.0]
  - - [128, 512, 8, 32, 128, 128, 128, 32]
    - [10, 3913.0]
  - - [128, 512, 8, 64, 128, 128, 128, 64]
    - [4, 5769.0]
  - - [128, 512, 8, 128, 128, 128, 128, 128]
    - [4, 7633.0]
  - - [128, 512, 8, 256, 128, 128, 128, 256]
    - [3, 7914.0]
  - - [128, 512, 8, 512, 128, 128, 128, 512]
    - [9, 6447.0]
  - - [256, 32, 8, 32, 256, 256, 256, 32]
    - [0, 722.0]
  - - [256, 32, 8, 64, 256, 256, 256, 64]
    - [11, 1072.0]
  - - [256, 32, 8, 128, 256, 256, 256, 128]
    - [3, 1450.0]
  - - [256, 32, 8, 256, 256, 256, 256, 256]
    - [3, 1749.0]
  - - [256, 32, 8, 512, 256, 256, 256, 512]
    - [3, 1981.0]
  - - [256, 64, 8, 32, 256, 256, 256, 32]
    - [0, 1351.0]
  - - [256, 64, 8, 64, 256, 256, 256, 64]
    - [0, 2020.0]
  - - [256, 64, 8, 128, 256, 256, 256, 128]
    - [3, 2752.0]
  - - [256, 64, 8, 256, 256, 256, 256, 256]
    - [3, 3435.0]
  - - [256, 64, 8, 512, 256, 256, 256, 512]
    - [3, 3880.0]
  - - [256, 128, 8, 32, 256, 256, 256, 32]
    - [11, 2491.0]
  - - [256, 128, 8, 64, 256, 256, 256, 64]
    - [11, 3792.0]
  - - [256, 128, 8, 128, 256, 256, 256, 128]
    - [3, 5059.0]
  - - [256, 128, 8, 256, 256, 256, 256, 256]
    - [3, 6341.0]
  - - [256, 128, 8, 512, 256, 256, 256, 512]
    - [8, 6655.0]
  - - [256, 256, 8, 32, 256, 256, 256, 32]
    - [10, 3927.0]
  - - [256, 256, 8, 64, 256, 256, 256, 64]
    - [4, 5714.0]
  - - [256, 256, 8, 128, 256, 256, 256, 128]
    - [4, 7696.0]
  - - [256, 256, 8, 256, 256, 256, 256, 256]
    - [4, 9193.0]
  - - [256, 256, 8, 512, 256, 256, 256, 512]
    - [4, 9064.0]
  - - [256, 512, 8, 32, 256, 256, 256, 32]
    - [4, 5738.0]
  - - [256, 512, 8, 64, 256, 256, 256, 64]
    - [4, 7703.0]
  - - [256, 512, 8, 128, 256, 256, 256, 128]
    - [6, 9347.0]
  - - [256, 512, 8, 256, 256, 256, 256, 256]
    - [5, 10779.0]
  - - [256, 512, 8, 512, 256, 256, 256, 512]
    - [5, 10542.0]
  - - [512, 32, 8, 32, 512, 512, 512, 32]
    - [0, 1266.0]
  - - [512, 32, 8, 64, 512, 512, 512, 64]
    - [0, 1931.0]
  - - [512, 32, 8, 128, 512, 512, 512, 128]
    - [3, 2661.0]
  - - [512, 32, 8, 256, 512, 512, 512, 256]
    - [3, 3316.0]
  - - [512, 32, 8, 512, 512, 512, 512, 512]
    - [12, 3820.0]
  - - [512, 64, 8, 32, 512, 512, 512, 32]
    - [13, 2389.0]
  - - [512, 64, 8, 64, 512, 512, 512, 64]
    - [4, 3628.0]
  - - [512, 64, 8, 128, 512, 512, 512, 128]
    - [4, 4981.0]
  - - [512, 64, 8, 256, 512, 512, 512, 256]
    - [13, 6191.0]
  - - [512, 64, 8, 512, 512, 512, 512, 512]
    - [4, 7097.0]
  - - [512, 128, 8, 32, 512, 512, 512, 32]
    - [12, 3927.0]
  - - [512, 128, 8, 64, 512, 512, 512, 64]
    - [4, 5468.0]
  - - [512, 128, 8, 128, 512, 512, 512, 128]
    - [4, 7530.0]
  - - [512, 128, 8, 256, 512, 512, 512, 256]
    - [13, 9254.0]
  - - [512, 128, 8, 512, 512, 512, 512, 512]
    - [13, 10180.0]
  - - [512, 256, 8, 32, 512, 512, 512, 32]
    - [11, 5243.0]
  - - [512, 256, 8, 64, 512, 512, 512, 64]
    - [13, 7371.0]
  - - [512, 256, 8, 128, 512, 512, 512, 128]
    - [1, 9533.0]
  - - [512, 256, 8, 256, 512, 512, 512, 256]
    - [1, 11144.0]
  - - [512, 256, 8, 512, 512, 512, 512, 512]
    - [1, 11988.0]
  - - [512, 512, 8, 32, 512, 512, 512, 32]
    - [13, 6453.0]
  - - [512, 512, 8, 64, 512, 512, 512, 64]
    - [13, 8766.0]
  - - [512, 512, 8, 128, 512, 512, 512, 128]
    - [1, 10356.0]
  - - [512, 512, 8, 256, 512, 512, 512, 256]
    - [2, 11718.0]
  - - [512, 512, 8, 512, 512, 512, 512, 512]
    - [2, 12194.0]
- null
