library/src/blas3/Tensile/Logic/asm_full/vega20/vega20_Cijk_Alik_Bljk_HB.yaml
- {MinimumRequiredVersion: 4.6.0}
- vega20
- gfx906
- [Device 66a0, Device 66a1, Device 66a7, Device 66af, Vega 20]
    SolutionIndex: 0
    SolutionNameMin: Cijk_Alik_Bljk_HB_MT032x032x08_GRVW04_NLCA01_NLCB01_TT04_04_USFGRO0_VW04_WG08_08_01
    SolutionIndex: 1
    SolutionNameMin: Cijk_Alik_Bljk_HB_MT032x016x08_GRVW02_NLCA01_NLCB01_TT02_02_USFGRO01_VW02_WG16_08_01
    SolutionIndex: 2
    SolutionNameMin: Cijk_Alik_Bljk_HB_MT016x016x16_GRVW02_NLCA01_NLCB01_TT02_02_USFGRO01_VW02_WG08_08_01
    SolutionIndex: 3
    SolutionNameMin: Cijk_Alik_Bljk_HB_MT032x032x16_GRVW04_NLCA01_NLCB01_TT04_04_USFGRO0_VW04_WG08_08_01
    SolutionIndex: 4
    SolutionNameMin: Cijk_Alik_Bljk_HB_MT064x032x16_GRVW04_NLCA01_NLCB01_TT04_04_USFGRO0_VW04_WG16_08_01
    SolutionIndex: 5
    SolutionNameMin: Cijk_Alik_Bljk_HB_MT064x064x16_GRVW04_NLCA01_NLCB01_TT04_04_USFGRO0_VW04_WG16_16_01
    SolutionIndex: 6
    SolutionNameMin: Cijk_Alik_Bljk_HB_MT016x016x32_GRVW02_NLCA01_NLCB01_TT02_02_USFGRO01_VW02_WG08_08_01
    SolutionIndex: 7
    SolutionNameMin: Cijk_Alik_Bljk_HB_MT032x032x32_GRVW04_NLCA01_NLCB01_TT04_04_USFGRO0_VW04_WG08_08_01
    SolutionIndex: 8
    SolutionNameMin: Cijk_Alik_Bljk_HB_MT128x064x32_GRVW08_NLCA01_NLCB01_TT08_08_USFGRO0_VW08_WG16_08_01
    SolutionIndex: 9
    SolutionNameMin: Cijk_Alik_Bljk_HB_MT064x016x32_GRVW02_NLCA01_NLCB01_TT02_02_USFGRO01_VW02_WG32_08_01
    SolutionIndex: 10
    SolutionNameMin: Cijk_Alik_Bljk_HB_MT128x032x32_GRVW04_NLCA01_NLCB01_TT04_04_USFGRO0_VW04_WG32_08_01
    SolutionIndex: 11
    SolutionNameMin: Cijk_Alik_Bljk_HB_MT256x064x32_GRVW08_NLCA01_NLCB01_TT08_08_USFGRO0_VW08_WG32_08_01
    SolutionIndex: 12
    SolutionNameMin: Cijk_Alik_Bljk_HB_MT016x016x16_GRVW02_NLCA01_NLCB01_TT02_02_USFGRO01_VW02_WG08_08_01
    SolutionIndex: 13
    SolutionNameMin: Cijk_Alik_Bljk_HB_MT032x032x16_GRVW04_NLCA01_NLCB01_TT04_04_USFGRO0_VW04_WG08_08_01
    SolutionIndex: 14
    SolutionNameMin: Cijk_Alik_Bljk_HB_MT032x016x16_GRVW02_NLCA01_NLCB01_TT02_02_USFGRO01_VW02_WG16_08_01
    SolutionIndex: 15
    SolutionNameMin: Cijk_Alik_Bljk_HB_MT064x032x16_GRVW04_NLCA01_NLCB01_TT04_04_USFGRO0_VW04_WG16_08_01
    SolutionIndex: 16
    SolutionNameMin: Cijk_Alik_Bljk_HB_MT016x016x24_GRVW02_NLCA03_NLCB03_TT02_02_USFGRO01_VW02_WG08_08_01
    SolutionIndex: 17
    SolutionNameMin: Cijk_Alik_Bljk_HB_MT032x016x24_GRVW02_NLCA03_NLCB03_TT04_02_USFGRO01_VW02_WG08_08_01
    SolutionIndex: 18
    SolutionNameMin: Cijk_Alik_Bljk_HB_MT032x032x24_GRVW04_NLCA03_NLCB03_TT04_04_USFGRO0_VW04_WG08_08_01
    SolutionIndex: 19
    SolutionNameMin: Cijk_Alik_Bljk_HB_MT016x016x24_GRVW02_NLCA03_NLCB03_TT02_02_USFGRO01_VW02_WG08_08_01
    SolutionIndex: 20
    SolutionNameMin: Cijk_Alik_Bljk_HB_MT032x016x24_GRVW02_NLCA03_NLCB03_TT04_02_USFGRO01_VW02_WG08_08_01
    SolutionIndex: 21
    SolutionNameMin: Cijk_Alik_Bljk_HB_MT032x032x24_GRVW04_NLCA03_NLCB03_TT04_04_USFGRO0_VW04_WG08_08_01
    SolutionIndex: 22
    SolutionNameMin: Cijk_Alik_Bljk_HB_MT032x032x32_GRVW04_NLCA01_NLCB01_TT04_04_USFGRO0_VW04_WG08_08_01
    SolutionIndex: 23
    SolutionNameMin: Cijk_Alik_Bljk_HB_MT064x032x32_GRVW04_NLCA01_NLCB01_TT04_04_USFGRO0_VW04_WG16_08_01
    SolutionIndex: 24
    SolutionNameMin: Cijk_Alik_Bljk_HB_MT128x032x32_GRVW04_NLCA01_NLCB01_TT04_04_USFGRO0_VW04_WG32_08_01
    SolutionIndex: 25
    SolutionNameMin: Cijk_Alik_Bljk_HB_MT128x064x08_GRVW04_NLCA01_NLCB01_TT08_04_USFGRO0_VW04_WG16_16_01
    SolutionIndex: 26
    SolutionNameMin: Cijk_Alik_Bljk_HB_MT064x064x16_GRVW04_NLCA01_NLCB01_TT04_04_USFGRO0_VW04_WG16_16_01
    SolutionIndex: 27
    SolutionNameMin: Cijk_Alik_Bljk_HB_MT064x128x16_GRVW04_NLCA01_NLCB01_TT04_08_USFGRO0_VW04_WG16_16_01
    SolutionIndex: 28
    SolutionNameMin: Cijk_Alik_Bljk_HB_MT128x064x16_GRVW04_NLCA01_NLCB01_TT08_04_USFGRO0_VW04_WG16_16_01
    SolutionIndex: 29
    SolutionNameMin: Cijk_Alik_Bljk_HB_MT128x128x16_GRVW08_NLCA01_NLCB01_TT08_08_USFGRO0_VW08_WG16_16_01
    SolutionIndex: 30
    SolutionNameMin: Cijk_Alik_Bljk_HB_MT128x128x32_GRVW08_NLCA01_NLCB01_TT08_08_USFGRO0_VW08_WG16_16_01
    SolutionIndex: 31
    SolutionNameMin: Cijk_Alik_Bljk_HB_MT064x016x16_GRVW08_GSU03_LPB00_PGR1_PLR1_TT04_04_USFGRO0_VW04_WG16_04_04_WGM01
    SolutionIndex: 32
    SolutionNameMin: Cijk_Alik_Bljk_HB_MT064x032x16_GRVW08_GSU01_LPB04_PGR1_PLR1_TT04_04_USFGRO0_VW04_WG16_08_02_WGM01
    SolutionIndex: 33
    SolutionNameMin: Cijk_Alik_Bljk_HB_MT064x016x16_GRVW08_GSU05_LPB04_PGR1_PLR1_TT04_04_USFGRO0_VW04_WG16_04_04_WGM01
    SolutionIndex: 34
    SolutionNameMin: Cijk_Alik_Bljk_HB_MT064x016x16_GRVW08_GSU05_LPB04_PGR1_PLR1_TT04_04_USFGRO0_VW04_WG16_04_04_WGM08
    SolutionIndex: 35
    SolutionNameMin: Cijk_Alik_Bljk_HB_MT064x032x16_GRVW08_GSU01_LPB04_PGR1_PLR1_TT04_04_USFGRO0_VW04_WG16_08_02_WGM64
    SolutionIndex: 36
    SolutionNameMin: Cijk_Alik_Bljk_HB_MT064x032x16_GRVW08_GSU03_LPB04_PGR1_PLR1_TT04_04_USFGRO0_VW04_WG16_08_02_WGM64
    SolutionIndex: 37
    SolutionNameMin: Cijk_Alik_Bljk_HB_MT64x64x32_SE_EPS0_FL1_GRVW2_LPA4_LPB4_PGR0_PLR1_TT4_4_VW4_WGM1
    SolutionIndex: 38
    SolutionNameMin: Cijk_Alik_Bljk_HB_MT256x64x32_SE_EPS0_GRVW8_LPA8_LPB8_NLCA1_NLCB1_PGR0_PLR1_TT8_8_USFGRO1_VW8_WG32_8_1_WGM1
    SolutionIndex: 39
    SolutionNameMin: Cijk_Alik_Bljk_HB_MT032x032x08_GRVW04_NLCA01_NLCB01_TT04_04_USFGRO0_VW04_WG08_08_01
    SolutionIndex: 40
    SolutionNameMin: Cijk_Alik_Bljk_HB_MT032x016x08_GRVW02_NLCA01_NLCB01_TT02_02_USFGRO01_VW02_WG16_08_01
    SolutionIndex: 41
    SolutionNameMin: Cijk_Alik_Bljk_HB_MT016x016x16_GRVW02_NLCA01_NLCB01_TT02_02_USFGRO01_VW02_WG08_08_01
    SolutionIndex: 42
    SolutionNameMin: Cijk_Alik_Bljk_HB_MT032x032x16_GRVW04_NLCA01_NLCB01_TT04_04_USFGRO0_VW04_WG08_08_01
    SolutionIndex: 43
    SolutionNameMin: Cijk_Alik_Bljk_HB_MT064x032x16_GRVW04_NLCA01_NLCB01_TT04_04_USFGRO0_VW04_WG16_08_01
    SolutionIndex: 44
    SolutionNameMin: Cijk_Alik_Bljk_HB_MT064x064x16_GRVW04_NLCA01_NLCB01_TT04_04_USFGRO0_VW04_WG16_16_01
    SolutionIndex: 45
    SolutionNameMin: Cijk_Alik_Bljk_HB_MT016x016x32_GRVW02_NLCA01_NLCB01_TT02_02_USFGRO01_VW02_WG08_08_01
    SolutionIndex: 46
    SolutionNameMin: Cijk_Alik_Bljk_HB_MT032x032x32_GRVW04_NLCA01_NLCB01_TT04_04_USFGRO0_VW04_WG08_08_01
    SolutionIndex: 47
    SolutionNameMin: Cijk_Alik_Bljk_HB_MT128x064x32_GRVW08_NLCA01_NLCB01_TT08_08_USFGRO0_VW08_WG16_08_01
    SolutionIndex: 48
    SolutionNameMin: Cijk_Alik_Bljk_HB_MT064x016x32_GRVW02_NLCA01_NLCB01_TT02_02_USFGRO01_VW02_WG32_08_01
    SolutionIndex: 49
    SolutionNameMin: Cijk_Alik_Bljk_HB_MT128x032x32_GRVW04_NLCA01_NLCB01_TT04_04_USFGRO0_VW04_WG32_08_01
    SolutionIndex: 50
    SolutionNameMin: Cijk_Alik_Bljk_HB_MT256x064x32_GRVW08_NLCA01_NLCB01_TT08_08_USFGRO0_VW08_WG32_08_01
    SolutionIndex: 51
    SolutionNameMin: Cijk_Alik_Bljk_HB_MT016x016x16_GRVW02_NLCA01_NLCB01_TT02_02_USFGRO01_VW02_WG08_08_01
    SolutionIndex: 52
    SolutionNameMin: Cijk_Alik_Bljk_HB_MT032x032x16_GRVW04_NLCA01_NLCB01_TT04_04_USFGRO0_VW04_WG08_08_01
    SolutionIndex: 53
    SolutionNameMin: Cijk_Alik_Bljk_HB_MT032x016x16_GRVW02_NLCA01_NLCB01_TT02_02_USFGRO01_VW02_WG16_08_01
    SolutionIndex: 54
    SolutionNameMin: Cijk_Alik_Bljk_HB_MT064x032x16_GRVW04_NLCA01_NLCB01_TT04_04_USFGRO0_VW04_WG16_08_01
    SolutionIndex: 55
    SolutionNameMin: Cijk_Alik_Bljk_HB_MT016x016x24_GRVW02_NLCA03_NLCB03_TT02_02_USFGRO01_VW02_WG08_08_01
    SolutionIndex: 56
    SolutionNameMin: Cijk_Alik_Bljk_HB_MT032x016x24_GRVW02_NLCA03_NLCB03_TT04_02_USFGRO01_VW02_WG08_08_01
    SolutionIndex: 57
    SolutionNameMin: Cijk_Alik_Bljk_HB_MT032x032x24_GRVW04_NLCA03_NLCB03_TT04_04_USFGRO0_VW04_WG08_08_01
    SolutionIndex: 58
    SolutionNameMin: Cijk_Alik_Bljk_HB_MT016x016x24_GRVW02_NLCA03_NLCB03_TT02_02_USFGRO01_VW02_WG08_08_01
    SolutionIndex: 59
    SolutionNameMin: Cijk_Alik_Bljk_HB_MT032x016x24_GRVW02_NLCA03_NLCB03_TT04_02_USFGRO01_VW02_WG08_08_01
    SolutionIndex: 60
    SolutionNameMin: Cijk_Alik_Bljk_HB_MT032x032x24_GRVW04_NLCA03_NLCB03_TT04_04_USFGRO0_VW04_WG08_08_01
    SolutionIndex: 61
    SolutionNameMin: Cijk_Alik_Bljk_HB_MT032x032x32_GRVW04_NLCA01_NLCB01_TT04_04_USFGRO0_VW04_WG08_08_01
    SolutionIndex: 62
    SolutionNameMin: Cijk_Alik_Bljk_HB_MT064x032x32_GRVW04_NLCA01_NLCB01_TT04_04_USFGRO0_VW04_WG16_08_01
    SolutionIndex: 63
    SolutionNameMin: Cijk_Alik_Bljk_HB_MT128x032x32_GRVW04_NLCA01_NLCB01_TT04_04_USFGRO0_VW04_WG32_08_01
    SolutionIndex: 64
    SolutionNameMin: Cijk_Alik_Bljk_HB_MT128x064x08_GRVW04_NLCA01_NLCB01_TT08_04_USFGRO0_VW04_WG16_16_01
    SolutionIndex: 65
    SolutionNameMin: Cijk_Alik_Bljk_HB_MT064x064x16_GRVW04_NLCA01_NLCB01_TT04_04_USFGRO0_VW04_WG16_16_01
    SolutionIndex: 66
    SolutionNameMin: Cijk_Alik_Bljk_HB_MT064x128x16_GRVW04_NLCA01_NLCB01_TT04_08_USFGRO0_VW04_WG16_16_01
    SolutionIndex: 67
    SolutionNameMin: Cijk_Alik_Bljk_HB_MT128x064x16_GRVW04_NLCA01_NLCB01_TT08_04_USFGRO0_VW04_WG16_16_01
    SolutionIndex: 68
    SolutionNameMin: Cijk_Alik_Bljk_HB_MT128x128x16_GRVW08_NLCA01_NLCB01_TT08_08_USFGRO0_VW08_WG16_16_01
    SolutionIndex: 69
    SolutionNameMin: Cijk_Alik_Bljk_HB_MT128x128x32_GRVW08_NLCA01_NLCB01_TT08_08_USFGRO0_VW08_WG16_16_01
    SolutionIndex: 70
    SolutionNameMin: Cijk_Alik_Bljk_HB_MT064x016x16_GRVW08_GSU03_LPB00_PGR1_PLR1_TT04_04_USFGRO0_VW04_WG16_04_04_WGM01
    SolutionIndex: 71
    SolutionNameMin: Cijk_Alik_Bljk_HB_MT064x032x16_GRVW08_GSU01_LPB04_PGR1_PLR1_TT04_04_USFGRO0_VW04_WG16_08_02_WGM01
    SolutionIndex: 72
    SolutionNameMin: Cijk_Alik_Bljk_HB_MT064x016x16_GRVW08_GSU05_LPB04_PGR1_PLR1_TT04_04_USFGRO0_VW04_WG16_04_04_WGM01
    SolutionIndex: 73
    SolutionNameMin: Cijk_Alik_Bljk_HB_MT064x016x16_GRVW08_GSU05_LPB04_PGR1_PLR1_TT04_04_USFGRO0_VW04_WG16_04_04_WGM08
    SolutionIndex: 74
    SolutionNameMin: Cijk_Alik_Bljk_HB_MT064x032x16_GRVW08_GSU01_LPB04_PGR1_PLR1_TT04_04_USFGRO0_VW04_WG16_08_02_WGM64
    SolutionIndex: 75
    SolutionNameMin: Cijk_Alik_Bljk_HB_MT064x032x16_GRVW08_GSU03_LPB04_PGR1_PLR1_TT04_04_USFGRO0_VW04_WG16_08_02_WGM64
    SolutionIndex: 76
    SolutionNameMin: Cijk_Alik_Bljk_HB_MT64x64x32_SE_EPS0_FL1_GRVW2_LPA4_LPB4_PGR0_PLR1_TT4_4_VW4_WGM1
    SolutionIndex: 77
    SolutionNameMin: Cijk_Alik_Bljk_HB_MT256x64x32_SE_EPS0_GRVW8_LPA8_LPB8_NLCA1_NLCB1_PGR0_PLR1_TT8_8_USFGRO1_VW8_WG32_8_1_WGM1
    SolutionIndex: 78
    SolutionIndex: 79
    SolutionIndex: 80
    SolutionIndex: 81
    SolutionIndex: 82
    SolutionIndex: 83
    SolutionIndex: 84
    SolutionIndex: 85
    SolutionIndex: 86
    SolutionIndex: 87
    SolutionIndex: 88
- - - [1024, 1024, 1, 3328]
    - [29, 14130.5]
  - - [64, 6784, 1, 256]
    - [5, 6093.7]
  - - [2944, 4288, 1, 1280]
    - [29, 18092.3]
  - - [128, 256, 1, 1280]
    - [16, 1424.7]
  - - [1760, 32, 1, 1760]
    - [16, 2364.58]
  - - [2368, 5888, 1, 256]
    - [29, 17510.6]
  - - [5888, 1856, 1, 256]
    - [29, 17108.6]
  - - [704, 6784, 1, 256]
    - [29, 14794.8]
  - - [512, 24000, 1, 1536]
    - [29, 17458.2]
  - - [128, 6784, 1, 3328]
    - [29, 11805.0]
  - - [5888, 1856, 1, 3328]
    - [29, 18560.8]
  - - [5056, 704, 1, 256]
    - [29, 13368.7]
  - - [2048, 400, 1, 512]
    - [29, 7489.83]
  - - [5888, 2944, 1, 3328]
    - [29, 19321.7]
  - - [1856, 4288, 1, 256]
    - [29, 16515.8]
  - - [5056, 5056, 1, 3328]
    - [29, 19533.2]
  - - [1408, 5888, 1, 1280]
    - [29, 18933.0]
  - - [1024, 3584, 1, 3328]
    - [29, 16142.2]
  - - [512, 48000, 1, 2048]
    - [30, 15609.2]
  - - [448, 3584, 1, 3328]
    - [29, 12684.1]
  - - [256, 4288, 1, 3328]
    - [26, 10459.3]
  - - [5888, 1408, 1, 1280]
    - [29, 18879.1]
  - - [704, 1856, 1, 3328]
    - [26, 12370.4]
  - - [1024, 2368, 1, 256]
    - [28, 11495.5]
  - - [5056, 6784, 1, 1280]
    - [29, 19302.1]
  - - [1408, 64, 1, 1280]
    - [19, 3247.28]
  - - [448, 1024, 1, 1280]
    - [26, 8854.08]
  - - [4096, 32, 1, 4096]
    - [23, 2419.21]
  - - [5056, 5056, 1, 1280]
    - [29, 19368.8]
  - - [448, 5056, 1, 256]
    - [28, 11100.0]
  - - [6784, 448, 1, 256]
    - [28, 12597.8]
  - - [2368, 128, 1, 256]
    - [4, 4490.43]
  - - [1760, 6400, 1, 1760]
    - [29, 19049.0]
  - - [5888, 704, 1, 1280]
    - [28, 15225.5]
  - - [64, 5056, 1, 256]
    - [5, 4861.36]
  - - [6784, 4288, 1, 3328]
    - [29, 19208.5]
  - - [1856, 2368, 1, 3328]
    - [29, 15719.4]
  - - [5888, 2944, 1, 1280]
    - [29, 19195.0]
  - - [5888, 1024, 1, 256]
    - [29, 16406.3]
  - - [448, 64, 1, 1280]
    - [16, 1256.85]
  - - [3072, 64, 1, 1024]
    - [22, 3589.99]
  - - [16384, 3200, 1, 4096]
    - [30, 16567.6]
  - - [2944, 64, 1, 256]
    - [3, 3406.39]
  - - [1408, 2944, 1, 256]
    - [29, 16019.9]
  - - [256, 1856, 1, 1280]
    - [26, 9192.47]
  - - [6784, 5056, 1, 3328]
    - [29, 19351.4]
  - - [5056, 5056, 1, 256]
    - [29, 18370.1]
  - - [448, 704, 1, 1280]
    - [21, 6206.98]
  - - [64, 1024, 1, 1280]
    - [16, 2752.17]
  - - [1024, 3584, 1, 1280]
    - [29, 15943.6]
  - - [2368, 2944, 1, 1280]
    - [29, 17958.8]
  - - [448, 448, 1, 3328]
    - [21, 5985.15]
  - - [6784, 6784, 1, 1280]
    - [29, 19919.5]
  - - [1024, 256, 1, 3328]
    - [21, 8030.33]
  - - [1408, 4288, 1, 1280]
    - [29, 17952.1]
  - - [3584, 4288, 1, 1280]
    - [29, 19214.7]
  - - [2368, 704, 1, 1280]
    - [29, 12629.3]
  - - [5056, 4288, 1, 3328]
    - [29, 18811.8]
  - - [3584, 2368, 1, 3328]
    - [29, 17502.3]
  - - [64, 704, 1, 1280]
    - [16, 1922.39]
  - - [4288, 256, 1, 256]
    - [26, 8226.53]
  - - [6144, 32, 1, 2560]
    - [21, 4934.48]
  - - [6784, 448, 1, 1280]
    - [28, 14541.8]
  - - [128, 3584, 1, 1280]
    - [26, 8801.0]
  - - [4288, 2944, 1, 256]
    - [29, 17066.5]
  - - [1856, 64, 1, 1280]
    - [19, 4009.59]
  - - [1760, 16, 1, 1760]
    - [16, 1249.03]
  - - [6144, 24000, 1, 2560]
    - [29, 19971.9]
  - - [5888, 64, 1, 3328]
    - [15, 7849.88]
  - - [2944, 256, 1, 3328]
    - [26, 11343.1]
  - - [5056, 2368, 1, 1280]
    - [29, 18495.9]
  - - [448, 3584, 1, 1280]
    - [29, 12078.1]
  - - [6784, 5888, 1, 256]
    - [29, 18984.3]
  - - [256, 4288, 1, 1280]
    - [26, 10111.5]
  - - [704, 128, 1, 1280]
    - [19, 3306.86]
  - - [1408, 448, 1, 1280]
    - [26, 9125.27]
  - - [1024, 1408, 1, 256]
    - [28, 10509.6]
  - - [2368, 2368, 1, 3328]
    - [29, 16840.1]
  - - [5056, 704, 1, 3328]
    - [29, 15614.5]
  - - [1408, 1856, 1, 256]
    - [29, 11778.0]
  - - [1408, 256, 1, 1280]
    - [21, 7318.74]
  - - [3072, 128, 1, 1024]
    - [10, 4953.9]
  - - [3584, 2368, 1, 1280]
    - [29, 17269.6]
  - - [704, 5888, 1, 256]
    - [27, 13703.0]
  - - [6784, 128, 1, 1280]
    - [29, 10829.0]
  - - [2560, 1600, 1, 2560]
    - [29, 13918.7]
  - - [6784, 64, 1, 256]
    - [5, 6286.71]
  - - [6144, 5984, 1, 2048]
    - [30, 16035.2]
  - - [3584, 704, 1, 3328]
    - [28, 14616.7]
  - - [1408, 1408, 1, 256]
    - [29, 11813.6]
  - - [1856, 128, 1, 256]
    - [26, 4200.1]
  - - [2944, 64, 1, 1280]
    - [21, 5224.71]
  - - [448, 4288, 1, 256]
    - [27, 11156.6]
  - - [64, 3584, 1, 3328]
    - [21, 7011.05]
  - - [704, 2368, 1, 1280]
    - [29, 12605.5]
  - - [7680, 16, 1, 2560]
    - [17, 3244.36]
  - - [1856, 2368, 1, 1280]
    - [29, 15387.3]
  - - [2368, 128, 1, 3328]
    - [21, 6699.85]
  - - [2944, 128, 1, 256]
    - [26, 5335.67]
  - - [448, 1408, 1, 256]
    - [26, 7132.54]
  - - [64, 5056, 1, 3328]
    - [18, 7299.94]
  - - [1408, 1024, 1, 1280]
    - [28, 12766.3]
  - - [2368, 256, 1, 1280]
    - [26, 8785.62]
  - - [6784, 704, 1, 256]
    - [29, 14582.9]
  - - [2048, 1600, 1, 512]
    - [30, 10962.6]
  - - [2048, 7000, 1, 2048]
    - [30, 14548.6]
  - - [256, 3584, 1, 3328]
    - [29, 12481.4]
  - - [1408, 3584, 1, 256]
    - [29, 15925.1]
  - - [3584, 4288, 1, 3328]
    - [29, 19380.3]
  - - [5888, 1856, 1, 1280]
    - [29, 18358.9]
  - - [5056, 1024, 1, 3328]
    - [29, 18501.6]
  - - [5056, 64, 1, 1280]
    - [21, 6545.31]
  - - [1024, 704, 1, 256]
    - [26, 8543.95]
  - - [128, 448, 1, 256]
    - [12, 1504.1]
  - - [2368, 3584, 1, 1280]
    - [29, 17309.2]
  - - [1024, 256, 1, 256]
    - [26, 4534.38]
  - - [448, 448, 1, 256]
    - [26, 3548.36]
  - - [2944, 3584, 1, 3328]
    - [29, 17929.6]
  - - [7680, 32, 1, 2560]
    - [3, 5468.93]
  - - [256, 256, 1, 3328]
    - [16, 2950.54]
  - - [128, 1024, 1, 3328]
    - [16, 4778.79]
  - - [6784, 2944, 1, 256]
    - [29, 18115.3]
  - - [64, 1856, 1, 1280]
    - [16, 4096.0]
  - - [448, 256, 1, 256]
    - [12, 2398.7]
  - - [4288, 2368, 1, 3328]
    - [29, 17277.0]
  - - [1856, 2368, 1, 256]
    - [29, 13667.7]
  - - [3584, 6784, 1, 3328]
    - [29, 19404.4]
  - - [256, 1024, 1, 256]
    - [13, 4415.06]
  - - [1024, 128, 1, 1280]
    - [16, 4462.03]
  - - [3072, 32, 1, 1024]
    - [6, 2338.83]
  - - [4288, 128, 1, 1280]
    - [26, 7954.55]
  - - [5056, 4288, 1, 1280]
    - [29, 18674.7]
  - - [5888, 64, 1, 256]
    - [26, 5506.22]
  - - [6784, 1856, 1, 3328]
    - [29, 18218.8]
  - - [1408, 5056, 1, 1280]
    - [29, 18291.6]
  - - [1856, 256, 1, 1280]
    - [26, 9115.32]
  - - [64, 5888, 1, 3328]
    - [15, 7973.66]
  - - [6784, 5888, 1, 3328]
    - [29, 19717.8]
  - - [8448, 12000, 1, 2816]
    - [29, 20148.5]
  - - [448, 256, 1, 3328]
    - [19, 4259.84]
  - - [4096, 800, 1, 1024]
    - [30, 10694.3]
  - - [8192, 3200, 1, 2048]
    - [30, 15615.1]
  - - [2368, 5056, 1, 1280]
    - [29, 18538.8]
  - - [256, 1408, 1, 3328]
    - [21, 7830.1]
  - - [6784, 128, 1, 3328]
    - [29, 11781.9]
  - - [1024, 5056, 1, 1280]
    - [29, 18150.2]
  - - [4288, 1024, 1, 256]
    - [29, 13748.5]
  - - [2368, 1408, 1, 256]
    - [29, 12885.6]
  - - [704, 704, 1, 3328]
    - [26, 10111.6]
  - - [5888, 448, 1, 1280]
    - [29, 14205.7]
  - - [3584, 256, 1, 3328]
    - [29, 12465.1]
  - - [704, 5888, 1, 3328]
    - [27, 15603.9]
  - - [1024, 6784, 1, 1280]
    - [29, 17930.2]
  - - [128, 3584, 1, 3328]
    - [26, 9350.36]
  - - [128, 704, 1, 1280]
    - [16, 3360.82]
  - - [3584, 2944, 1, 1280]
    - [29, 17826.9]
  - - [1856, 128, 1, 3328]
    - [21, 7320.61]
  - - [128, 2944, 1, 1280]
    - [21, 7443.59]
  - - [512, 24000, 1, 2048]
    - [30, 14234.7]
  - - [448, 1856, 1, 1280]
    - [29, 10281.2]
  - - [1408, 5056, 1, 3328]
    - [29, 18625.4]
  - - [1856, 1856, 1, 3328]
    - [29, 15162.5]
  - - [3584, 128, 1, 256]
    - [26, 6582.99]
  - - [2560, 800, 1, 2560]
    - [29, 11297.4]
  - - [448, 1408, 1, 3328]
    - [26, 9486.85]
  - - [2368, 2368, 1, 256]
    - [29, 14915.8]
  - - [4288, 4288, 1, 1280]
    - [29, 18286.4]
  - - [64, 448, 1, 1280]
    - [16, 1288.63]
  - - [5888, 1024, 1, 1280]
    - [29, 17941.0]
  - - [512, 48000, 1, 2560]
    - [29, 19194.9]
  - - [8448, 16, 1, 2816]
    - [20, 3803.29]
  - - [704, 6784, 1, 3328]
    - [29, 17121.6]
  - - [2560, 6400, 1, 2560]
    - [29, 18642.7]
  - - [5056, 1024, 1, 1280]
    - [29, 18178.1]
  - - [448, 5888, 1, 3328]
    - [29, 14792.9]
  - - [1024, 2944, 1, 1280]
    - [29, 16467.9]
  - - [5056, 5888, 1, 1280]
    - [29, 19558.8]
  - - [448, 6784, 1, 256]
    - [27, 12746.5]
  - - [256, 3584, 1, 256]
    - [27, 8764.22]
  - - [256, 2944, 1, 3328]
    - [26, 11322.7]
  - - [256, 448, 1, 256]
    - [2, 2584.52]
  - - [6144, 16, 1, 2560]
    - [20, 2888.64]
  - - [3584, 5888, 1, 256]
    - [29, 18236.1]
  - - [2944, 3584, 1, 256]
    - [29, 16806.4]
  - - [1408, 704, 1, 256]
    - [28, 9582.91]
  - - [6784, 1024, 1, 3328]
    - [29, 18165.0]
  - - [6784, 2944, 1, 3328]
    - [29, 19024.5]
  - - [2944, 5056, 1, 3328]
    - [29, 18775.3]
  - - [64, 64, 1, 3328]
    - [16, 200.463]
  - - [6784, 2368, 1, 1280]
    - [29, 18804.0]
  - - [4288, 5888, 1, 1280]
    - [29, 19210.8]
  - - [4288, 4288, 1, 256]
    - [29, 17351.3]
  - - [8448, 32, 1, 2816]
    - [4, 5770.67]
  - - [448, 2944, 1, 3328]
    - [27, 11990.1]
  - - [4288, 1856, 1, 1280]
    - [29, 18087.6]
  - - [1856, 2944, 1, 3328]
    - [29, 16527.7]
  - - [256, 6784, 1, 3328]
    - [29, 13803.4]
  - - [64, 5888, 1, 256]
    - [3, 5431.81]
  - - [5056, 1024, 1, 256]
    - [29, 16258.6]
  - - [704, 64, 1, 3328]
    - [16, 2048.45]
  - - [5056, 1856, 1, 3328]
    - [29, 17503.1]
  - - [1856, 1408, 1, 256]
    - [29, 12261.6]
  - - [448, 2368, 1, 1280]
    - [26, 9611.45]
  - - [1408, 128, 1, 1280]
    - [21, 5103.69]
  - - [4096, 7000, 1, 4096]
    - [30, 16079.8]
  - - [5056, 256, 1, 3328]
    - [26, 12304.5]
  - - [1024, 5888, 1, 1280]
    - [29, 17954.4]
  - - [6144, 24000, 1, 2048]
    - [30, 16997.9]
  - - [64, 128, 1, 256]
    - [2, 262.144]
  - - [128, 1856, 1, 1280]
    - [18, 6475.45]
  - - [5056, 3584, 1, 256]
    - [29, 18047.4]
  - - [1856, 1024, 1, 1280]
    - [29, 14459.7]
  - - [1856, 1856, 1, 1280]
    - [29, 14836.0]
  - - [4096, 400, 1, 1024]
    - [30, 10220.0]
  - - [3072, 24000, 1, 1024]
    - [29, 18112.9]
  - - [128, 4288, 1, 3328]
    - [26, 8269.74]
  - - [1856, 1024, 1, 3328]
    - [29, 15062.4]
  - - [256, 2368, 1, 256]
    - [26, 7079.8]
  - - [1024, 448, 1, 3328]
    - [26, 9354.94]
  - - [1856, 704, 1, 1280]
    - [26, 11919.0]
  - - [5888, 5888, 1, 3328]
    - [29, 19586.5]
  - - [6784, 1024, 1, 256]
    - [29, 16552.3]
  - - [5056, 5888, 1, 3328]
    - [29, 19653.1]
  - - [1856, 1024, 1, 256]
    - [27, 11304.4]
  - - [512, 48000, 1, 1536]
    - [29, 18694.9]
  - - [5056, 1408, 1, 3328]
    - [29, 18619.6]
  - - [8448, 5984, 1, 2816]
    - [29, 19829.5]
  - - [1024, 1024, 1, 1280]
    - [29, 12925.4]
  - - [4288, 1024, 1, 3328]
    - [29, 15692.6]
  - - [2048, 128, 1, 2048]
    - [7, 3337.09]
  - - [1024, 24000, 1, 2560]
    - [29, 19092.8]
  - - [2944, 1408, 1, 3328]
    - [29, 18182.0]
  - - [2944, 4288, 1, 3328]
    - [29, 18276.4]
  - - [256, 2944, 1, 256]
    - [26, 8644.17]
  - - [5056, 2944, 1, 256]
    - [29, 17569.7]
  - - [1024, 700, 1, 512]
    - [29, 7351.79]
  - - [2368, 1856, 1, 256]
    - [29, 13445.5]
  - - [128, 448, 1, 1280]
    - [19, 2364.7]
  - - [128, 6784, 1, 1280]
    - [29, 10803.8]
  - - [1408, 3584, 1, 3328]
    - [29, 18061.2]
  - - [2368, 6784, 1, 256]
    - [29, 17892.9]
  - - [5056, 1408, 1, 1280]
    - [29, 18356.4]
  - - [704, 3584, 1, 1280]
    - [27, 14214.9]
  - - [1408, 5888, 1, 3328]
    - [29, 19149.2]
  - - [1856, 5056, 1, 256]
    - [29, 16127.1]
  - - [6784, 6784, 1, 256]
    - [29, 19380.5]
  - - [1408, 704, 1, 3328]
    - [28, 12770.3]
  - - [128, 5888, 1, 1280]
    - [26, 10728.3]
  - - [2368, 4288, 1, 1280]
    - [29, 17085.3]
  - - [3584, 1856, 1, 1280]
    - [29, 17105.5]
  - - [704, 1408, 1, 3328]
    - [27, 12774.2]
  - - [704, 64, 1, 1280]
    - [16, 1834.34]
  - - [5888, 5056, 1, 256]
    - [29, 18682.7]
  - - [8448, 48000, 1, 2816]
    - [29, 20265.8]
  - - [3584, 448, 1, 256]
    - [28, 9657.94]
  - - [3584, 3584, 1, 1280]
    - [29, 18478.8]
  - - [7680, 64, 1, 2560]
    - [24, 6978.1]
  - - [256, 6784, 1, 256]
    - [29, 10329.8]
  - - [1856, 3584, 1, 3328]
    - [29, 17393.9]
  - - [5056, 256, 1, 1280]
    - [26, 11922.5]
  - - [2560, 32, 1, 2560]
    - [19, 2919.2]
  - - [3584, 3584, 1, 256]
    - [29, 17454.0]
  - - [6784, 4288, 1, 1280]
    - [29, 19112.9]
  - - [704, 5056, 1, 256]
    - [29, 13463.5]
  - - [6784, 128, 1, 256]
    - [27, 8077.55]
  - - [64, 1408, 1, 3328]
    - [16, 3621.89]
  - - [704, 448, 1, 256]
    - [26, 4331.56]
  - - [2944, 2368, 1, 1280]
    - [29, 17964.6]
  - - [448, 64, 1, 3328]
    - [16, 1377.32]
  - - [6784, 3584, 1, 256]
    - [29, 18511.6]
  - - [256, 1856, 1, 3328]
    - [26, 9693.8]
  - - [128, 64, 1, 1280]
    - [16, 367.148]
  - - [128, 1408, 1, 256]
    - [0, 3276.8]
  - - [64, 128, 1, 3328]
    - [16, 399.048]
  - - [2944, 2944, 1, 3328]
    - [29, 17892.6]
  - - [5056, 6784, 1, 256]
    - [29, 18590.7]
  - - [1408, 4288, 1, 3328]
    - [29, 18262.2]
  - - [6784, 256, 1, 1280]
    - [29, 13244.6]
  - - [2368, 704, 1, 3328]
    - [29, 13194.5]
  - - [128, 4288, 1, 256]
    - [26, 6457.22]
  - - [3584, 6784, 1, 256]
    - [29, 18533.7]
  - - [128, 128, 1, 3328]
    - [16, 782.519]
  - - [5056, 1856, 1, 256]
    - [29, 16058.1]
  - - [4608, 5984, 1, 1536]
    - [29, 18747.4]
  - - [256, 128, 1, 256]
    - [2, 896.219]
  - - [1760, 3200, 1, 1760]
    - [29, 16873.8]
  - - [4096, 1600, 1, 1024]
    - [30, 13216.7]
  - - [704, 4288, 1, 256]
    - [27, 12561.8]
  - - [256, 448, 1, 3328]
    - [16, 4313.76]
  - - [1408, 6784, 1, 1280]
    - [29, 17680.5]
  - - [7680, 24000, 1, 2560]
    - [29, 20105.8]
  - - [64, 2368, 1, 1280]
    - [16, 4345.58]
  - - [4608, 48000, 1, 1536]
    - [29, 20144.0]
  - - [6144, 48000, 1, 2048]
    - [29, 17572.6]
  - - [64, 6784, 1, 3328]
    - [5, 8810.6]
  - - [2944, 256, 1, 1280]
    - [26, 10824.6]
  - - [2048, 16, 1, 2048]
    - [19, 1043.36]
  - - [1024, 24000, 1, 1536]
    - [29, 18743.2]
  - - [5056, 2368, 1, 3328]
    - [29, 18695.3]
  - - [2944, 4288, 1, 256]
    - [29, 16916.4]
  - - [1408, 3584, 1, 1280]
    - [29, 17799.9]
  - - [2368, 64, 1, 256]
    - [5, 2819.57]
  - - [256, 256, 1, 256]
    - [2, 1705.0]
  - - [704, 128, 1, 3328]
    - [19, 3625.4]
  - - [8192, 1600, 1, 2048]
    - [30, 14058.3]
  - - [1856, 704, 1, 256]
    - [27, 9678.7]
  - - [1408, 448, 1, 3328]
    - [26, 9479.99]
  - - [512, 24000, 1, 2560]
    - [29, 18247.5]
  - - [2368, 6784, 1, 3328]
    - [29, 19028.0]
  - - [5056, 704, 1, 1280]
    - [29, 15284.7]
  - - [1856, 4288, 1, 3328]
    - [29, 18359.4]
  - - [1408, 5888, 1, 256]
    - [29, 17557.2]
  - - [4288, 64, 1, 1280]
    - [21, 5702.48]
  - - [256, 64, 1, 256]
    - [2, 451.972]
  - - [704, 1856, 1, 256]
    - [27, 9678.7]
  - - [2560, 64, 1, 2560]
    - [21, 4850.03]
  - - [3584, 704, 1, 1280]
    - [28, 14229.9]
  - - [256, 2368, 1, 1280]
    - [26, 8746.01]
  - - [3584, 448, 1, 3328]
    - [29, 12667.2]
  - - [704, 2368, 1, 3328]
    - [29, 13187.0]
  - - [2944, 448, 1, 256]
    - [28, 9724.7]
  - - [448, 5056, 1, 3328]
    - [28, 13176.9]
  - - [2368, 128, 1, 1280]
    - [21, 6306.46]
  - - [4288, 448, 1, 256]
    - [28, 11136.4]
  - - [448, 5888, 1, 256]
    - [29, 11905.6]
  - - [64, 5056, 1, 1280]
    - [18, 6715.1]
  - - [2048, 3200, 1, 512]
    - [30, 13443.3]
  - - [5888, 2368, 1, 256]
    - [29, 17394.5]
  - - [704, 448, 1, 3328]
    - [21, 6837.05]
  - - [6784, 704, 1, 3328]
    - [29, 17037.9]
  - - [1408, 2944, 1, 3328]
    - [29, 18218.5]
  - - [4608, 12000, 1, 1536]
    - [29, 19418.8]
  - - [64, 1024, 1, 256]
    - [2, 1777.25]
  - - [2368, 448, 1, 1280]
    - [26, 9704.87]
  - - [128, 3584, 1, 256]
    - [26, 6300.46]
  - - [1856, 448, 1, 3328]
    - [29, 11245.1]
  - - [128, 5056, 1, 256]
    - [26, 7503.4]
  - - [2368, 704, 1, 256]
    - [29, 9952.67]
  - - [3584, 2368, 1, 256]
    - [29, 15928.5]
  - - [5888, 5056, 1, 1280]
    - [29, 19285.6]
  - - [128, 1024, 1, 1280]
    - [19, 4481.09]
  - - [8448, 24000, 1, 2816]
    - [29, 20205.4]
  - - [64, 704, 1, 256]
    - [2, 1275.92]
  - - [4288, 256, 1, 1280]
    - [26, 10053.6]
  - - [3584, 3584, 1, 3328]
    - [29, 18625.1]
  - - [704, 704, 1, 256]
    - [26, 6956.01]
  - - [5888, 6784, 1, 256]
    - [29, 19004.1]
  - - [4288, 2944, 1, 3328]
    - [29, 18292.3]
  - - [1856, 64, 1, 256]
    - [12, 2551.07]
  - - [1024, 16, 1, 500000]
    - [2, 801.083]
  - - [4288, 128, 1, 3328]
    - [26, 8278.73]
  - - [7680, 128, 1, 2560]
    - [11, 11451.5]
  - - [256, 5056, 1, 1280]
    - [26, 11867.8]
  - - [6784, 5888, 1, 1280]
    - [29, 19376.9]
  - - [2048, 800, 1, 512]
    - [30, 9836.55]
  - - [704, 128, 1, 256]
    - [12, 2016.49]
  - - [5888, 4288, 1, 1280]
    - [29, 19172.5]
  - - [1024, 24000, 1, 2048]
    - [30, 15448.3]
  - - [448, 256, 1, 1280]
    - [19, 3887.73]
  - - [1024, 256, 1, 1280]
    - [21, 7182.03]
  - - [256, 1408, 1, 1280]
    - [21, 7102.42]
  - - [3072, 16, 1, 1024]
    - [16, 1469.97]
  - - [1408, 1856, 1, 1280]
    - [28, 14655.4]
  - - [5888, 448, 1, 3328]
    - [29, 14697.8]
  - - [704, 5888, 1, 1280]
    - [27, 15243.0]
  - - [1024, 6784, 1, 3328]
    - [29, 18212.0]
  - - [704, 2944, 1, 1280]
    - [27, 14411.7]
  - - [6784, 64, 1, 3328]
    - [5, 8819.17]
  - - [5056, 2944, 1, 3328]
    - [29, 18763.4]
  - - [448, 128, 1, 256]
    - [2, 1456.36]
  - - [1408, 1408, 1, 3328]
    - [29, 15729.6]
  - - [1856, 128, 1, 1280]
    - [21, 6420.76]
  - - [448, 4288, 1, 1280]
    - [27, 13346.2]
  - - [64, 3584, 1, 256]
    - [5, 4146.91]
  - - [128, 2944, 1, 3328]
    - [21, 8250.64]
  - - [3584, 704, 1, 256]
    - [28, 12068.8]
  - - [2944, 448, 1, 3328]
    - [28, 11992.7]
  - - [3584, 1408, 1, 3328]
    - [29, 18106.3]
  - - [2368, 1024, 1, 1280]
    - [28, 13694.8]
  - - [2944, 6784, 1, 1280]
    - [29, 18964.6]
  - - [1856, 6784, 1, 256]
    - [29, 17029.4]
  - - [4288, 448, 1, 3328]
    - [28, 13724.0]
  - - [4288, 3584, 1, 1280]
    - [29, 19201.2]
  - - [6144, 12000, 1, 2048]
    - [30, 16689.0]
  - - [8192, 800, 1, 2048]
    - [30, 11269.7]
  - - [5888, 1024, 1, 3328]
    - [29, 18232.1]
  - - [704, 6784, 1, 1280]
    - [29, 16772.4]
  - - [5888, 128, 1, 256]
    - [26, 8065.97]
  - - [4096, 16, 1, 4096]
    - [9, 1344.33]
  - - [704, 5056, 1, 1280]
    - [29, 15350.6]
  - - [64, 704, 1, 3328]
    - [16, 2037.31]
  - - [2944, 1856, 1, 256]
    - [29, 14558.7]
  - - [5056, 64, 1, 256]
    - [5, 4793.84]
  - - [3584, 5056, 1, 256]
    - [29, 18008.2]
  - - [5888, 5056, 1, 3328]
    - [29, 19647.5]
  - - [128, 5056, 1, 3328]
    - [26, 9726.22]
  - - [3584, 6784, 1, 1280]
    - [29, 19292.9]
  - - [1856, 5888, 1, 256]
    - [29, 17201.2]
  - - [64, 448, 1, 3328]
    - [16, 1388.54]
  - - [4288, 4288, 1, 3328]
    - [29, 18414.0]
  - - [4288, 1408, 1, 1280]
    - [29, 17945.4]
  - - [64, 1856, 1, 256]
    - [2, 2658.1]
  - - [4288, 2368, 1, 256]
    - [29, 15850.1]
  - - [2944, 5056, 1, 1280]
    - [29, 18627.9]
  - - [256, 4288, 1, 256]
    - [26, 8464.41]
  - - [6784, 2368, 1, 3328]
    - [29, 18974.0]
  - - [256, 1024, 1, 1280]
    - [21, 7025.64]
  - - [4288, 1856, 1, 3328]
    - [29, 18336.0]
  - - [1856, 2944, 1, 1280]
    - [29, 16250.0]
  - - [2048, 1600, 1, 2048]
    - [30, 9187.96]
  - - [3584, 64, 1, 1280]
    - [21, 6086.26]
  - - [4288, 6784, 1, 3328]
    - [29, 19246.7]
  - - [3584, 1024, 1, 1280]
    - [29, 15866.1]
  - - [1024, 4288, 1, 256]
    - [29, 13694.9]
  - - [5888, 3584, 1, 3328]
    - [29, 19139.0]
  - - [5056, 3584, 1, 3328]
    - [29, 19114.6]
  - - [1408, 128, 1, 3328]
    - [21, 5701.38]
  - - [2368, 1408, 1, 1280]
    - [29, 14367.4]
  - - [5056, 2944, 1, 1280]
    - [29, 18617.7]
  - - [3584, 256, 1, 256]
    - [28, 8660.8]
  - - [1024, 6784, 1, 256]
    - [29, 16515.5]
  - - [3584, 2944, 1, 256]
    - [29, 16806.4]
  - - [448, 128, 1, 3328]
    - [16, 2570.59]
  - - [3584, 1408, 1, 1280]
    - [29, 17792.1]
  - - [64, 4288, 1, 3328]
    - [18, 6161.02]
  - - [5056, 6784, 1, 3328]
    - [29, 19401.9]
  - - [128, 2944, 1, 256]
    - [26, 5431.81]
  - - [3584, 4288, 1, 256]
    - [29, 18120.2]
  - - [1856, 6784, 1, 3328]
    - [29, 18258.8]
  - - [3584, 128, 1, 3328]
    - [26, 9359.53]
  - - [2368, 64, 1, 3328]
    - [18, 4750.99]
  - - [1024, 448, 1, 1280]
    - [26, 8875.49]
  - - [5056, 1408, 1, 256]
    - [29, 16799.6]
  - - [64, 256, 1, 1280]
    - [16, 728.178]
  - - [3584, 1024, 1, 256]
    - [29, 14183.6]
  - - [256, 704, 1, 256]
    - [26, 3276.8]
  - - [5888, 5888, 1, 256]
    - [29, 18854.4]
  - - [4288, 1024, 1, 1280]
    - [29, 15433.8]
  - - [5888, 128, 1, 3328]
    - [26, 11265.7]
  - - [448, 6784, 1, 3328]
    - [27, 14971.2]
  - - [2944, 1408, 1, 1280]
    - [29, 17896.0]
  - - [2944, 1856, 1, 3328]
    - [29, 16500.1]
  - - [128, 1024, 1, 256]
    - [1, 2833.99]
  - - [64, 64, 1, 256]
    - [2, 110.145]
  - - [3584, 5888, 1, 1280]
    - [29, 19085.5]
  - - [6784, 1856, 1, 1280]
    - [29, 18029.1]
  - - [5888, 256, 1, 3328]
    - [27, 13700.0]
  - - [1856, 5888, 1, 3328]
    - [29, 18609.5]
  - - [3584, 1408, 1, 256]
    - [29, 15909.4]
  - - [64, 448, 1, 256]
    - [2, 857.48]
  - - [704, 3584, 1, 3328]
    - [27, 14624.9]
  - - [4096, 3200, 1, 1024]
    - [30, 15032.0]
  - - [5056, 448, 1, 1280]
    - [27, 12842.5]
  - - [3584, 1856, 1, 3328]
    - [29, 17390.6]
  - - [1408, 704, 1, 1280]
    - [28, 12209.2]
  - - [2944, 1024, 1, 256]
    - [29, 14145.0]
  - - [448, 1408, 1, 1280]
    - [26, 9108.79]
  - - [2368, 4288, 1, 3328]
    - [29, 17295.4]
  - - [1024, 1408, 1, 1280]
    - [28, 12759.2]
  - - [256, 128, 1, 1280]
    - [19, 1424.7]
  - - [704, 1408, 1, 1280]
    - [27, 12199.8]
  - - [6784, 5056, 1, 256]
    - [29, 18524.8]
  - - [3584, 5056, 1, 3328]
    - [29, 19119.9]
  - - [4288, 5888, 1, 256]
    - [29, 18433.2]
  - - [448, 2944, 1, 256]
    - [27, 9792.39]
  - - [2944, 6784, 1, 256]
    - [29, 18187.5]
  - - [2368, 2368, 1, 1280]
    - [29, 16626.9]
  - - [1856, 3584, 1, 1280]
    - [29, 17180.1]
  - - [64, 2944, 1, 256]
    - [5, 3505.41]
  - - [5056, 3584, 1, 1280]
    - [29, 18998.2]
  - - [256, 5888, 1, 256]
    - [28, 10962.4]
  - - [128, 256, 1, 3328]
    - [16, 1552.56]
  - - [1856, 1408, 1, 3328]
    - [27, 15145.0]
  - - [1024, 4288, 1, 3328]
    - [29, 15749.4]
  - - [448, 2368, 1, 256]
    - [27, 7913.2]
  - - [64, 1408, 1, 1280]
    - [16, 3376.56]
  - - [64, 6784, 1, 1280]
    - [5, 8309.59]
  - - [2944, 2368, 1, 3328]
    - [29, 18211.0]
  - - [704, 4288, 1, 3328]
    - [27, 14851.0]
  - - [1408, 128, 1, 256]
    - [26, 3186.28]
  - - [1024, 1856, 1, 1280]
    - [29, 14357.3]
  - - [2048, 6400, 1, 2048]
    - [30, 14436.4]
  - - [512, 48000, 1, 2816]
    - [29, 19614.5]
  - - [5124, 9124, 1, 2560]
    - [29, 19005.1]
  - - [128, 2368, 1, 3328]
    - [18, 6732.05]
  - - [1024, 5888, 1, 256]
    - [29, 16378.4]
  - - [64, 2944, 1, 1280]
    - [18, 5298.17]
  - - [5056, 64, 1, 3328]
    - [21, 7103.48]
  - - [1408, 2368, 1, 256]
    - [29, 12762.3]
  - - [2944, 704, 1, 3328]
    - [28, 14794.0]
  - - [64, 128, 1, 1280]
    - [16, 371.309]
  - - [1024, 8, 1, 500000]
    - [2, 400.651]
  - - [2944, 2944, 1, 1280]
    - [29, 17703.8]
  - - [6784, 256, 1, 3328]
    - [29, 13803.4]
  - - [1408, 5056, 1, 256]
    - [29, 16640.1]
  - - [5056, 128, 1, 3328]
    - [26, 9733.26]
  - - [128, 128, 1, 1280]
    - [16, 718.203]
  - - [448, 704, 1, 256]
    - [26, 4505.6]
  - - [1856, 256, 1, 3328]
    - [26, 9708.08]
  - - [2944, 128, 1, 3328]
    - [21, 7933.31]
  - - [448, 1024, 1, 3328]
    - [26, 9350.36]
  - - [256, 448, 1, 1280]
    - [16, 4015.33]
  - - [4608, 24000, 1, 1536]
    - [29, 19955.7]
  - - [704, 256, 1, 1280]
    - [21, 5290.98]
  - - [64, 2368, 1, 3328]
    - [18, 4797.99]
  - - [256, 704, 1, 3328]
    - [21, 5649.83]
  - - [4096, 64, 1, 4096]
    - [7, 3857.94]
  - - [1408, 4288, 1, 256]
    - [29, 16126.9]
  - - [5888, 2368, 1, 1280]
    - [29, 18581.1]
  - - [128, 256, 1, 256]
    - [2, 903.945]
  - - [256, 64, 1, 1280]
    - [16, 720.176]
  - - [2368, 5888, 1, 1280]
    - [29, 18668.2]
  - - [5888, 256, 1, 1280]
    - [28, 13280.4]
  - - [1760, 128, 1, 1760]
    - [18, 6370.39]
  - - [704, 1024, 1, 1280]
    - [26, 9909.22]
  - - [2368, 1856, 1, 3328]
    - [29, 15716.7]
  - - [2944, 704, 1, 256]
    - [28, 12014.9]
  - - [2368, 6784, 1, 1280]
    - [29, 18859.2]
  - - [2368, 1024, 1, 3328]
    - [28, 14060.9]
  - - [1856, 4288, 1, 1280]
    - [29, 18069.6]
  - - [704, 3584, 1, 256]
    - [29, 11786.9]
  - - [704, 2944, 1, 3328]
    - [27, 14819.4]
  - - [1856, 5056, 1, 3328]
    - [29, 17502.3]
  - - [3584, 5056, 1, 1280]
    - [29, 18973.3]
  - - [2944, 1024, 1, 3328]
    - [29, 16929.0]
  - - [2368, 256, 1, 256]
    - [26, 7105.73]
  - - [1408, 6784, 1, 256]
    - [29, 16504.3]
  - - [6784, 1408, 1, 3328]
    - [29, 17788.4]
  - - [1024, 2368, 1, 1280]
    - [28, 13704.5]
  - - [704, 64, 1, 256]
    - [2, 1211.59]
  - - [256, 2368, 1, 3328]
    - [26, 9133.74]
  - - [6784, 2944, 1, 1280]
    - [29, 18904.0]
  - - [3584, 448, 1, 1280]
    - [29, 12078.1]
  - - [2944, 6784, 1, 3328]
    - [29, 19068.6]
  - - [448, 5056, 1, 1280]
    - [28, 12833.4]
  - - [64, 2944, 1, 3328]
    - [18, 5951.48]
  - - [4288, 704, 1, 256]
    - [28, 12480.6]
  - - [64, 64, 1, 1280]
    - [16, 177.604]
  - - [5888, 704, 1, 256]
    - [28, 13590.7]
  - - [256, 5888, 1, 3328]
    - [28, 13733.0]
  - - [6784, 4288, 1, 256]
    - [29, 18317.0]
  - - [5888, 256, 1, 256]
    - [28, 10962.4]
  - - [6784, 1024, 1, 1280]
    - [29, 17927.2]
  - - [704, 448, 1, 1280]
    - [13, 6260.88]
  - - [512, 16, 1, 500000]
    - [2, 400.805]
  - - [128, 64, 1, 3328]
    - [16, 396.726]
  - - [448, 64, 1, 256]
    - [2, 790.952]
  - - [2944, 704, 1, 1280]
    - [28, 14411.7]
  - - [6784, 3584, 1, 1280]
    - [29, 19192.0]
  - - [1024, 704, 1, 1280]
    - [26, 10428.9]
  - - [1408, 2944, 1, 1280]
    - [29, 17843.0]
  - - [256, 1856, 1, 256]
    - [26, 6757.49]
  - - [2048, 800, 1, 2048]
    - [30, 7136.81]
  - - [1408, 2368, 1, 3328]
    - [29, 14641.7]
  - - [128, 1408, 1, 3328]
    - [18, 5688.41]
  - - [2368, 2944, 1, 256]
    - [29, 16463.8]
  - - [704, 1856, 1, 1280]
    - [26, 11932.6]
  - - [1408, 256, 1, 3328]
    - [21, 7842.38]
  - - [2944, 5888, 1, 256]
    - [29, 18312.9]
  - - [3584, 1856, 1, 256]
    - [29, 15548.6]
  - - [2368, 448, 1, 256]
    - [28, 7804.06]
  - - [4288, 256, 1, 3328]
    - [26, 10437.8]
  - - [1408, 64, 1, 256]
    - [12, 2059.7]
  - - [2560, 16, 1, 2560]
    - [19, 1768.85]
  - - [4288, 2944, 1, 1280]
    - [29, 18142.6]
  - - [5056, 448, 1, 3328]
    - [27, 13158.4]
  - - [1024, 64, 1, 256]
    - [2, 1651.3]
  - - [64, 2368, 1, 256]
    - [1, 3069.41]
  - - [4288, 5056, 1, 3328]
    - [29, 18801.2]
  - - [2944, 256, 1, 256]
    - [26, 8801.92]
  - - [1024, 128, 1, 3328]
    - [16, 4795.6]
  - - [256, 5056, 1, 3328]
    - [26, 12321.4]
  - - [5056, 2368, 1, 256]
    - [29, 17180.4]
  - - [4288, 704, 1, 3328]
    - [28, 14840.5]
  - - [448, 3584, 1, 256]
    - [28, 9497.27]
  - - [2368, 64, 1, 1280]
    - [19, 4261.57]
  - - [1408, 448, 1, 256]
    - [26, 7313.44]
  - - [1024, 1408, 1, 3328]
    - [28, 13115.8]
  - - [2944, 5888, 1, 1280]
    - [29, 19248.3]
  - - [5888, 3584, 1, 256]
    - [29, 18255.8]
  - - [1408, 1856, 1, 3328]
    - [28, 15155.6]
  - - [6784, 1408, 1, 1280]
    - [29, 17662.1]
  - - [704, 2944, 1, 256]
    - [27, 11971.6]
  - - [4288, 64, 1, 256]
    - [5, 4103.66]
  - - [2944, 5888, 1, 3328]
    - [29, 19366.9]
  - - [64, 4288, 1, 1280]
    - [21, 5717.33]
  - - [6784, 64, 1, 1280]
    - [26, 8289.76]
  - - [1408, 6784, 1, 3328]
    - [29, 17837.1]
  - - [1408, 64, 1, 3328]
    - [19, 3607.95]
  - - [1408, 1408, 1, 1280]
    - [29, 15162.2]
  - - [16384, 400, 1, 4096]
    - [30, 10920.2]
  - - [448, 4288, 1, 3328]
    - [27, 13738.1]
  - - [704, 2368, 1, 256]
    - [27, 9842.49]
  - - [2944, 448, 1, 1280]
    - [28, 11658.9]
  - - [5888, 2368, 1, 3328]
    - [29, 18770.3]
  - - [5124, 9124, 1, 1760]
    - [29, 19133.3]
  - - [4288, 5056, 1, 256]
    - [29, 17734.3]
  - - [4288, 448, 1, 1280]
    - [28, 13340.4]
  - - [5888, 704, 1, 3328]
    - [28, 15575.7]
  - - [4288, 3584, 1, 3328]
    - [29, 19364.4]
  - - [128, 2368, 1, 256]
    - [4, 4449.23]
  - - [1408, 1024, 1, 256]
    - [27, 10729.6]
  - - [8192, 400, 1, 2048]
    - [30, 9238.55]
  - - [128, 64, 1, 256]
    - [1, 225.986]
  - - [2560, 7000, 1, 2560]
    - [29, 18451.6]
  - - [448, 1024, 1, 256]
    - [26, 6582.99]
  - - [6784, 6784, 1, 3328]
    - [29, 20115.2]
  - - [704, 5056, 1, 3328]
    - [29, 15639.2]
  - - [1024, 64, 1, 1280]
    - [16, 2709.5]
  - - [64, 1024, 1, 3328]
    - [16, 2973.06]
  - - [2368, 2944, 1, 3328]
    - [29, 18246.5]
  - - [448, 448, 1, 1280]
    - [26, 5584.81]
  - - [2368, 3584, 1, 256]
    - [29, 16013.0]
  - - [1856, 448, 1, 256]
    - [27, 7734.77]
  - - [128, 5056, 1, 1280]
    - [26, 9303.4]
  - - [5124, 9124, 1, 4096]
    - [30, 16095.0]
  - - [7680, 48000, 1, 2560]
    - [29, 20251.3]
  - - [1024, 48000, 1, 2816]
    - [29, 20162.8]
  - - [1856, 1856, 1, 256]
    - [29, 13185.6]
  - - [4288, 1408, 1, 3328]
    - [29, 18260.9]
  - - [3584, 64, 1, 3328]
    - [21, 6929.59]
  - - [5124, 9124, 1, 2048]
    - [30, 15853.8]
  - - [4288, 5056, 1, 1280]
    - [29, 18698.8]
  - - [5888, 6784, 1, 1280]
    - [29, 19626.2]
  - - [256, 1024, 1, 3328]
    - [21, 8030.33]
  - - [1760, 1600, 1, 1760]
    - [29, 15407.1]
  - - [1856, 64, 1, 3328]
    - [19, 4451.72]
  - - [5888, 1408, 1, 3328]
    - [29, 19100.4]
  - - [256, 5056, 1, 256]
    - [27, 9413.35]
  - - [7680, 12000, 1, 2560]
    - [29, 19897.2]
  - - [1024, 128, 1, 256]
    - [1, 2853.27]
  - - [1408, 256, 1, 256]
    - [26, 5219.16]
  - - [2368, 5056, 1, 256]
    - [29, 17242.3]
  - - [256, 1408, 1, 256]
    - [26, 5172.35]
  - - [1024, 5056, 1, 256]
    - [29, 16131.9]
  - - [2368, 1408, 1, 3328]
    - [29, 14655.6]
  - - [1024, 48000, 1, 1536]
    - [29, 19525.4]
  - - [5888, 448, 1, 256]
    - [29, 11468.8]
  - - [2560, 3200, 1, 2560]
    - [29, 17407.8]
  - - [6784, 5056, 1, 1280]
    - [29, 19223.0]
  - - [1024, 48000, 1, 2560]
    - [29, 19844.6]
  - - [4608, 32, 1, 1536]
    - [18, 4004.46]
  - - [4288, 6784, 1, 1280]
    - [29, 19134.1]
  - - [128, 704, 1, 256]
    - [12, 2089.55]
  - - [2368, 448, 1, 3328]
    - [26, 10039.1]
  - - [128, 5888, 1, 3328]
    - [26, 11273.8]
  - - [16384, 800, 1, 4096]
    - [30, 13596.3]
  - - [448, 128, 1, 1280]
    - [16, 2364.7]
  - - [1024, 64, 1, 3328]
    - [16, 2950.54]
  - - [3072, 48000, 1, 1024]
    - [29, 19045.2]
  - - [64, 3584, 1, 1280]
    - [18, 6046.15]
  - - [6784, 1408, 1, 256]
    - [29, 16558.0]
  - - [5888, 4288, 1, 256]
    - [29, 18303.8]
  - - [5056, 5888, 1, 256]
    - [29, 18752.6]
  - - [2368, 1024, 1, 256]
    - [27, 11774.6]
  - - [1856, 6784, 1, 1280]
    - [29, 18079.3]
  - - [3584, 128, 1, 1280]
    - [26, 8832.77]
  - - [4288, 128, 1, 256]
    - [26, 6410.09]
  - - [6784, 1856, 1, 256]
    - [29, 16950.6]
  - - [4288, 3584, 1, 256]
    - [29, 18133.6]
  - - [64, 256, 1, 3328]
    - [16, 793.451]
  - - [6784, 448, 1, 3328]
    - [28, 14934.1]
  - - [5056, 1856, 1, 1280]
    - [29, 17301.6]
  - - [1408, 1024, 1, 3328]
    - [28, 13138.8]
  - - [2368, 256, 1, 3328]
    - [26, 9133.74]
  - - [5888, 3584, 1, 1280]
    - [29, 19037.1]
  - - [5888, 128, 1, 1280]
    - [26, 10690.3]
  - - [1024, 2944, 1, 256]
    - [29, 14001.3]
  - - [448, 6784, 1, 1280]
    - [27, 14620.5]
  - - [256, 3584, 1, 1280]
    - [29, 11459.8]
  - - [3584, 1024, 1, 3328]
    - [29, 16154.1]
  - - [2944, 1856, 1, 1280]
    - [29, 16247.0]
  - - [5056, 256, 1, 256]
    - [26, 9677.28]
  - - [128, 5888, 1, 256]
    - [26, 8259.33]
  - - [2368, 3584, 1, 3328]
    - [29, 17514.4]
  - - [3584, 5888, 1, 3328]
    - [29, 19182.5]
  - - [2944, 3584, 1, 1280]
    - [29, 17811.9]
  - - [1856, 5888, 1, 1280]
    - [29, 18438.3]
  - - [256, 256, 1, 1280]
    - [16, 2695.57]
  - - [2048, 3200, 1, 2048]
    - [30, 12345.3]
  - - [4288, 1408, 1, 256]
    - [29, 16290.1]
  - - [3584, 64, 1, 256]
    - [5, 4100.58]
  - - [64, 1856, 1, 3328]
    - [16, 4467.82]
  - - [1024, 1024, 1, 256]
    - [28, 9927.35]
  - - [4288, 2368, 1, 1280]
    - [29, 17108.7]
  - - [2944, 5056, 1, 256]
    - [29, 17396.5]
  - - [256, 128, 1, 3328]
    - [19, 1550.79]
  - - [512, 8, 1, 500000]
    - [2, 200.423]
  - - [6784, 2368, 1, 256]
    - [29, 17647.2]
  - - [1024, 1024, 1, 1024]
    - [30, 9250.02]
  - - [2944, 64, 1, 3328]
    - [21, 5920.02]
  - - [1024, 24000, 1, 2816]
    - [29, 19600.7]
  - - [7680, 5984, 1, 2560]
    - [29, 19459.4]
  - - [4288, 1856, 1, 256]
    - [29, 16515.8]
  - - [1856, 2944, 1, 256]
    - [29, 14718.0]
  - - [6144, 48000, 1, 2560]
    - [29, 20161.5]
  - - [64, 5888, 1, 1280]
    - [21, 7388.86]
  - - [1760, 800, 1, 1760]
    - [25, 12939.0]
  - - [1856, 1408, 1, 1280]
    - [27, 14712.2]
  - - [704, 1024, 1, 256]
    - [26, 8419.22]
  - - [1024, 4288, 1, 1280]
    - [29, 15457.6]
  - - [2368, 5056, 1, 3328]
    - [29, 18728.3]
  - - [1024, 5056, 1, 3328]
    - [29, 18538.3]
  - - [1024, 1856, 1, 3328]
    - [29, 15016.6]
  - - [704, 704, 1, 1280]
    - [26, 9577.12]
  - - [128, 2368, 1, 1280]
    - [18, 6290.1]
  - - [3584, 256, 1, 1280]
    - [29, 11415.3]
  - - [5888, 64, 1, 1280]
    - [5, 7255.49]
  - - [128, 704, 1, 3328]
    - [19, 3628.91]
  - - [4288, 6784, 1, 256]
    - [29, 18385.8]
  - - [3584, 2944, 1, 3328]
    - [29, 17979.5]
  - - [128, 1856, 1, 256]
    - [3, 4200.1]
  - - [64, 4288, 1, 256]
    - [4, 4181.82]
  - - [5888, 2944, 1, 256]
    - [29, 18312.9]
  - - [5056, 128, 1, 1280]
    - [26, 9286.72]
  - - [448, 1856, 1, 3328]
    - [29, 11245.1]
  - - [5056, 4288, 1, 256]
    - [29, 17766.0]
  - - [1024, 448, 1, 256]
    - [26, 6672.76]
  - - [1024, 3584, 1, 256]
    - [29, 14269.8]
  - - [2944, 128, 1, 1280]
    - [21, 7370.8]
  - - [2048, 32, 1, 2048]
    - [16, 1959.96]
  - - [64, 256, 1, 256]
    - [2, 489.989]
  - - [704, 256, 1, 3328]
    - [21, 5679.79]
  - - [256, 704, 1, 1280]
    - [21, 5121.82]
  - - [5888, 5888, 1, 1280]
    - [29, 19527.4]
  - - [448, 5888, 1, 1280]
    - [29, 14321.4]
  - - [4288, 704, 1, 1280]
    - [28, 14495.8]
  - - [2944, 1408, 1, 256]
    - [29, 15942.9]
  - - [256, 2944, 1, 1280]
    - [26, 10709.3]
  - - [2560, 128, 1, 2560]
    - [13, 5812.51]
  - - [2368, 5888, 1, 3328]
    - [29, 18800.1]
  - - [704, 1024, 1, 3328]
    - [26, 10826.5]
  - - [2368, 1856, 1, 1280]
    - [29, 15384.0]
  - - [1856, 448, 1, 1280]
    - [29, 10281.2]
  - - [128, 6784, 1, 256]
    - [28, 8077.69]
  - - [5888, 4288, 1, 3328]
    - [29, 19272.0]
  - - [6784, 704, 1, 1280]
    - [29, 16677.2]
  - - [5056, 448, 1, 256]
    - [27, 11100.0]
  - - [1856, 5056, 1, 1280]
    - [29, 17289.6]
  - - [2944, 1024, 1, 1280]
    - [29, 16569.7]
  - - [2368, 4288, 1, 256]
    - [29, 15990.5]
  - - [1024, 2368, 1, 3328]
    - [28, 14062.9]
  - - [4288, 64, 1, 3328]
    - [21, 6137.83]
  - - [704, 1408, 1, 256]
    - [27, 9274.69]
  - - [4096, 128, 1, 4096]
    - [8, 4351.36]
  - - [4288, 5888, 1, 3328]
    - [29, 19323.4]
  - - [4608, 16, 1, 1536]
    - [19, 2546.0]
  - - [448, 2944, 1, 1280]
    - [27, 11671.8]
  - - [1024, 2944, 1, 3328]
    - [29, 16967.9]
  - - [2048, 64, 1, 2048]
    - [6, 2410.52]
  - - [256, 6784, 1, 1280]
    - [29, 13206.9]
  - - [1856, 3584, 1, 256]
    - [29, 15755.8]
  - - [128, 448, 1, 3328]
    - [16, 2565.06]
  - - [1856, 256, 1, 256]
    - [26, 6697.95]
  - - [5056, 128, 1, 256]
    - [26, 7530.68]
  - - [512, 24000, 1, 2816]
    - [29, 19241.9]
  - - [256, 5888, 1, 1280]
    - [28, 13339.2]
  - - [16384, 1600, 1, 4096]
    - [30, 15289.9]
  - - [448, 2368, 1, 3328]
    - [26, 10000.4]
  - - [64, 1408, 1, 256]
    - [2, 2218.14]
  - - [2944, 2368, 1, 256]
    - [29, 16439.5]
  - - [1024, 1856, 1, 256]
    - [28, 11262.5]
  - - [6784, 3584, 1, 3328]
    - [29, 19346.9]
  - - [1760, 7000, 1, 1760]
    - [29, 17793.0]
  - - [1024, 704, 1, 3328]
    - [26, 10838.2]
  - - [1024, 5888, 1, 3328]
    - [29, 18237.4]
  - - [1408, 2368, 1, 1280]
    - [29, 14382.9]
  - - [128, 1408, 1, 1280]
    - [18, 5058.92]
  - - [256, 64, 1, 3328]
    - [16, 785.224]
  - - [128, 1856, 1, 3328]
    - [18, 7326.04]
  - - [2944, 2944, 1, 256]
    - [29, 16548.2]
  - - [6784, 256, 1, 256]
    - [29, 10272.4]
  - - [128, 4288, 1, 1280]
    - [26, 7968.99]
  - - [5888, 1408, 1, 256]
    - [29, 17476.3]
  - - [128, 128, 1, 256]
    - [14, 468.114]
  - - [1760, 64, 1, 1760]
    - [19, 4016.34]
  - - [448, 704, 1, 3328]
    - [21, 6687.21]
  - - [448, 1856, 1, 256]
    - [28, 7872.08]
  - - [1856, 704, 1, 3328]
    - [26, 12390.1]
  - - [5888, 6784, 1, 3328]
    - [29, 19691.9]
  - - [704, 4288, 1, 1280]
    - [27, 14474.1]
  - - [704, 256, 1, 256]
    - [26, 3258.29]
  - - [1024, 48000, 1, 2048]
    - [30, 16477.3]
  - - [512, 128, 1, 784]
    - [36, 4039.33]
  - - [1024, 256, 1, 196]
    - [32, 5536.66]
  - - [256, 64, 1, 3136]
    - [33, 2919.33]
  - - [256, 1024, 1, 196]
    - [35, 5489.34]
  - - [64, 256, 1, 3136]
    - [33, 2854.46]
  - - [128, 512, 1, 784]
    - [31, 4197.73]
  - - [64, 64, 1, 3136]
    - [34, 764.587]
  - - [128, 128, 1024, 64]
    - [37, 14762.3]
  - - [1024, 8192, 1, 4096]
    - [38, 16992.9]
  - - [1024, 1024, 1, 3328]
    - [68, 14130.5]
  - - [64, 6784, 1, 256]
    - [44, 6093.7]
  - - [2944, 4288, 1, 1280]
    - [68, 18092.3]
  - - [128, 256, 1, 1280]
    - [55, 1424.7]
  - - [1760, 32, 1, 1760]
    - [55, 2364.58]
  - - [2368, 5888, 1, 256]
    - [68, 17510.6]
  - - [5888, 1856, 1, 256]
    - [68, 17108.6]
  - - [704, 6784, 1, 256]
    - [68, 14794.8]
  - - [512, 24000, 1, 1536]
    - [68, 17458.2]
  - - [128, 6784, 1, 3328]
    - [68, 11805.0]
  - - [5888, 1856, 1, 3328]
    - [68, 18560.8]
  - - [5056, 704, 1, 256]
    - [68, 13368.7]
  - - [2048, 400, 1, 512]
    - [68, 7489.83]
  - - [5888, 2944, 1, 3328]
    - [68, 19321.7]
  - - [1856, 4288, 1, 256]
    - [68, 16515.8]
  - - [5056, 5056, 1, 3328]
    - [68, 19533.2]
  - - [1408, 5888, 1, 1280]
    - [68, 18933.0]
  - - [1024, 3584, 1, 3328]
    - [68, 16142.2]
  - - [512, 48000, 1, 2048]
    - [69, 15609.2]
  - - [448, 3584, 1, 3328]
    - [68, 12684.1]
  - - [256, 4288, 1, 3328]
    - [65, 10459.3]
  - - [5888, 1408, 1, 1280]
    - [68, 18879.1]
  - - [704, 1856, 1, 3328]
    - [65, 12370.4]
  - - [1024, 2368, 1, 256]
    - [67, 11495.5]
  - - [5056, 6784, 1, 1280]
    - [68, 19302.1]
  - - [1408, 64, 1, 1280]
    - [58, 3247.28]
  - - [448, 1024, 1, 1280]
    - [65, 8854.08]
  - - [4096, 32, 1, 4096]
    - [62, 2419.21]
  - - [5056, 5056, 1, 1280]
    - [68, 19368.8]
  - - [448, 5056, 1, 256]
    - [67, 11100.0]
  - - [6784, 448, 1, 256]
    - [67, 12597.8]
  - - [2368, 128, 1, 256]
    - [43, 4490.43]
  - - [1760, 6400, 1, 1760]
    - [68, 19049.0]
  - - [5888, 704, 1, 1280]
    - [67, 15225.5]
  - - [64, 5056, 1, 256]
    - [44, 4861.36]
  - - [6784, 4288, 1, 3328]
    - [68, 19208.5]
  - - [1856, 2368, 1, 3328]
    - [68, 15719.4]
  - - [5888, 2944, 1, 1280]
    - [68, 19195.0]
  - - [5888, 1024, 1, 256]
    - [68, 16406.3]
  - - [448, 64, 1, 1280]
    - [55, 1256.85]
  - - [3072, 64, 1, 1024]
    - [61, 3589.99]
  - - [16384, 3200, 1, 4096]
    - [69, 16567.6]
  - - [2944, 64, 1, 256]
    - [42, 3406.39]
  - - [1408, 2944, 1, 256]
    - [68, 16019.9]
  - - [256, 1856, 1, 1280]
    - [65, 9192.47]
  - - [6784, 5056, 1, 3328]
    - [68, 19351.4]
  - - [5056, 5056, 1, 256]
    - [68, 18370.1]
  - - [448, 704, 1, 1280]
    - [60, 6206.98]
  - - [64, 1024, 1, 1280]
    - [55, 2752.17]
  - - [1024, 3584, 1, 1280]
    - [68, 15943.6]
  - - [2368, 2944, 1, 1280]
    - [68, 17958.8]
  - - [448, 448, 1, 3328]
    - [60, 5985.15]
  - - [6784, 6784, 1, 1280]
    - [68, 19919.5]
  - - [1024, 256, 1, 3328]
    - [60, 8030.33]
  - - [1408, 4288, 1, 1280]
    - [68, 17952.1]
  - - [3584, 4288, 1, 1280]
    - [68, 19214.7]
  - - [2368, 704, 1, 1280]
    - [68, 12629.3]
  - - [5056, 4288, 1, 3328]
    - [68, 18811.8]
  - - [3584, 2368, 1, 3328]
    - [68, 17502.3]
  - - [64, 704, 1, 1280]
    - [55, 1922.39]
  - - [4288, 256, 1, 256]
    - [65, 8226.53]
  - - [6144, 32, 1, 2560]
    - [60, 4934.48]
  - - [6784, 448, 1, 1280]
    - [67, 14541.8]
  - - [128, 3584, 1, 1280]
    - [65, 8801.0]
  - - [4288, 2944, 1, 256]
    - [68, 17066.5]
  - - [1856, 64, 1, 1280]
    - [58, 4009.59]
  - - [1760, 16, 1, 1760]
    - [55, 1249.03]
  - - [6144, 24000, 1, 2560]
    - [68, 19971.9]
  - - [5888, 64, 1, 3328]
    - [54, 7849.88]
  - - [2944, 256, 1, 3328]
    - [65, 11343.1]
  - - [5056, 2368, 1, 1280]
    - [68, 18495.9]
  - - [448, 3584, 1, 1280]
    - [68, 12078.1]
  - - [6784, 5888, 1, 256]
    - [68, 18984.3]
  - - [256, 4288, 1, 1280]
    - [65, 10111.5]
  - - [704, 128, 1, 1280]
    - [58, 3306.86]
  - - [1408, 448, 1, 1280]
    - [65, 9125.27]
  - - [1024, 1408, 1, 256]
    - [67, 10509.6]
  - - [2368, 2368, 1, 3328]
    - [68, 16840.1]
  - - [5056, 704, 1, 3328]
    - [68, 15614.5]
  - - [1408, 1856, 1, 256]
    - [68, 11778.0]
  - - [1408, 256, 1, 1280]
    - [60, 7318.74]
  - - [3072, 128, 1, 1024]
    - [49, 4953.9]
  - - [3584, 2368, 1, 1280]
    - [68, 17269.6]
  - - [704, 5888, 1, 256]
    - [66, 13703.0]
  - - [6784, 128, 1, 1280]
    - [68, 10829.0]
  - - [2560, 1600, 1, 2560]
    - [68, 13918.7]
  - - [6784, 64, 1, 256]
    - [44, 6286.71]
  - - [6144, 5984, 1, 2048]
    - [69, 16035.2]
  - - [3584, 704, 1, 3328]
    - [67, 14616.7]
  - - [1408, 1408, 1, 256]
    - [68, 11813.6]
  - - [1856, 128, 1, 256]
    - [65, 4200.1]
  - - [2944, 64, 1, 1280]
    - [60, 5224.71]
  - - [448, 4288, 1, 256]
    - [66, 11156.6]
  - - [64, 3584, 1, 3328]
    - [60, 7011.05]
  - - [704, 2368, 1, 1280]
    - [68, 12605.5]
  - - [7680, 16, 1, 2560]
    - [56, 3244.36]
  - - [1856, 2368, 1, 1280]
    - [68, 15387.3]
  - - [2368, 128, 1, 3328]
    - [60, 6699.85]
  - - [2944, 128, 1, 256]
    - [65, 5335.67]
  - - [448, 1408, 1, 256]
    - [65, 7132.54]
  - - [64, 5056, 1, 3328]
    - [57, 7299.94]
  - - [1408, 1024, 1, 1280]
    - [67, 12766.3]
  - - [2368, 256, 1, 1280]
    - [65, 8785.62]
  - - [6784, 704, 1, 256]
    - [68, 14582.9]
  - - [2048, 1600, 1, 512]
    - [69, 10962.6]
  - - [2048, 7000, 1, 2048]
    - [69, 14548.6]
  - - [256, 3584, 1, 3328]
    - [68, 12481.4]
  - - [1408, 3584, 1, 256]
    - [68, 15925.1]
  - - [3584, 4288, 1, 3328]
    - [68, 19380.3]
  - - [5888, 1856, 1, 1280]
    - [68, 18358.9]
  - - [5056, 1024, 1, 3328]
    - [68, 18501.6]
  - - [5056, 64, 1, 1280]
    - [60, 6545.31]
  - - [1024, 704, 1, 256]
    - [65, 8543.95]
  - - [128, 448, 1, 256]
    - [51, 1504.1]
  - - [2368, 3584, 1, 1280]
    - [68, 17309.2]
  - - [1024, 256, 1, 256]
    - [65, 4534.38]
  - - [448, 448, 1, 256]
    - [65, 3548.36]
  - - [2944, 3584, 1, 3328]
    - [68, 17929.6]
  - - [7680, 32, 1, 2560]
    - [42, 5468.93]
  - - [256, 256, 1, 3328]
    - [55, 2950.54]
  - - [128, 1024, 1, 3328]
    - [55, 4778.79]
  - - [6784, 2944, 1, 256]
    - [68, 18115.3]
  - - [64, 1856, 1, 1280]
    - [55, 4096.0]
  - - [448, 256, 1, 256]
    - [51, 2398.7]
  - - [4288, 2368, 1, 3328]
    - [68, 17277.0]
  - - [1856, 2368, 1, 256]
    - [68, 13667.7]
  - - [3584, 6784, 1, 3328]
    - [68, 19404.4]
  - - [256, 1024, 1, 256]
    - [52, 4415.06]
  - - [1024, 128, 1, 1280]
    - [55, 4462.03]
  - - [3072, 32, 1, 1024]
    - [45, 2338.83]
  - - [4288, 128, 1, 1280]
    - [65, 7954.55]
  - - [5056, 4288, 1, 1280]
    - [68, 18674.7]
  - - [5888, 64, 1, 256]
    - [65, 5506.22]
  - - [6784, 1856, 1, 3328]
    - [68, 18218.8]
  - - [1408, 5056, 1, 1280]
    - [68, 18291.6]
  - - [1856, 256, 1, 1280]
    - [65, 9115.32]
  - - [64, 5888, 1, 3328]
    - [54, 7973.66]
  - - [6784, 5888, 1, 3328]
    - [68, 19717.8]
  - - [8448, 12000, 1, 2816]
    - [68, 20148.5]
  - - [448, 256, 1, 3328]
    - [58, 4259.84]
  - - [4096, 800, 1, 1024]
    - [69, 10694.3]
  - - [8192, 3200, 1, 2048]
    - [69, 15615.1]
  - - [2368, 5056, 1, 1280]
    - [68, 18538.8]
  - - [256, 1408, 1, 3328]
    - [60, 7830.1]
  - - [6784, 128, 1, 3328]
    - [68, 11781.9]
  - - [1024, 5056, 1, 1280]
    - [68, 18150.2]
  - - [4288, 1024, 1, 256]
    - [68, 13748.5]
  - - [2368, 1408, 1, 256]
    - [68, 12885.6]
  - - [704, 704, 1, 3328]
    - [65, 10111.6]
  - - [5888, 448, 1, 1280]
    - [68, 14205.7]
  - - [3584, 256, 1, 3328]
    - [68, 12465.1]
  - - [704, 5888, 1, 3328]
    - [66, 15603.9]
  - - [1024, 6784, 1, 1280]
    - [68, 17930.2]
  - - [128, 3584, 1, 3328]
    - [65, 9350.36]
  - - [128, 704, 1, 1280]
    - [55, 3360.82]
  - - [3584, 2944, 1, 1280]
    - [68, 17826.9]
  - - [1856, 128, 1, 3328]
    - [60, 7320.61]
  - - [128, 2944, 1, 1280]
    - [60, 7443.59]
  - - [512, 24000, 1, 2048]
    - [69, 14234.7]
  - - [448, 1856, 1, 1280]
    - [68, 10281.2]
  - - [1408, 5056, 1, 3328]
    - [68, 18625.4]
  - - [1856, 1856, 1, 3328]
    - [68, 15162.5]
  - - [3584, 128, 1, 256]
    - [65, 6582.99]
  - - [2560, 800, 1, 2560]
    - [68, 11297.4]
  - - [448, 1408, 1, 3328]
    - [65, 9486.85]
  - - [2368, 2368, 1, 256]
    - [68, 14915.8]
  - - [4288, 4288, 1, 1280]
    - [68, 18286.4]
  - - [64, 448, 1, 1280]
    - [55, 1288.63]
  - - [5888, 1024, 1, 1280]
    - [68, 17941.0]
  - - [512, 48000, 1, 2560]
    - [68, 19194.9]
  - - [8448, 16, 1, 2816]
    - [59, 3803.29]
  - - [704, 6784, 1, 3328]
    - [68, 17121.6]
  - - [2560, 6400, 1, 2560]
    - [68, 18642.7]
  - - [5056, 1024, 1, 1280]
    - [68, 18178.1]
  - - [448, 5888, 1, 3328]
    - [68, 14792.9]
  - - [1024, 2944, 1, 1280]
    - [68, 16467.9]
  - - [5056, 5888, 1, 1280]
    - [68, 19558.8]
  - - [448, 6784, 1, 256]
    - [66, 12746.5]
  - - [256, 3584, 1, 256]
    - [66, 8764.22]
  - - [256, 2944, 1, 3328]
    - [65, 11322.7]
  - - [256, 448, 1, 256]
    - [41, 2584.52]
  - - [6144, 16, 1, 2560]
    - [59, 2888.64]
  - - [3584, 5888, 1, 256]
    - [68, 18236.1]
  - - [2944, 3584, 1, 256]
    - [68, 16806.4]
  - - [1408, 704, 1, 256]
    - [67, 9582.91]
  - - [6784, 1024, 1, 3328]
    - [68, 18165.0]
  - - [6784, 2944, 1, 3328]
    - [68, 19024.5]
  - - [2944, 5056, 1, 3328]
    - [68, 18775.3]
  - - [64, 64, 1, 3328]
    - [55, 200.463]
  - - [6784, 2368, 1, 1280]
    - [68, 18804.0]
  - - [4288, 5888, 1, 1280]
    - [68, 19210.8]
  - - [4288, 4288, 1, 256]
    - [68, 17351.3]
  - - [8448, 32, 1, 2816]
    - [43, 5770.67]
  - - [448, 2944, 1, 3328]
    - [66, 11990.1]
  - - [4288, 1856, 1, 1280]
    - [68, 18087.6]
  - - [1856, 2944, 1, 3328]
    - [68, 16527.7]
  - - [256, 6784, 1, 3328]
    - [68, 13803.4]
  - - [64, 5888, 1, 256]
    - [42, 5431.81]
  - - [5056, 1024, 1, 256]
    - [68, 16258.6]
  - - [704, 64, 1, 3328]
    - [55, 2048.45]
  - - [5056, 1856, 1, 3328]
    - [68, 17503.1]
  - - [1856, 1408, 1, 256]
    - [68, 12261.6]
  - - [448, 2368, 1, 1280]
    - [65, 9611.45]
  - - [1408, 128, 1, 1280]
    - [60, 5103.69]
  - - [4096, 7000, 1, 4096]
    - [69, 16079.8]
  - - [5056, 256, 1, 3328]
    - [65, 12304.5]
  - - [1024, 5888, 1, 1280]
    - [68, 17954.4]
  - - [6144, 24000, 1, 2048]
    - [69, 16997.9]
  - - [64, 128, 1, 256]
    - [41, 262.144]
  - - [128, 1856, 1, 1280]
    - [57, 6475.45]
  - - [5056, 3584, 1, 256]
    - [68, 18047.4]
  - - [1856, 1024, 1, 1280]
    - [68, 14459.7]
  - - [1856, 1856, 1, 1280]
    - [68, 14836.0]
  - - [4096, 400, 1, 1024]
    - [69, 10220.0]
  - - [3072, 24000, 1, 1024]
    - [68, 18112.9]
  - - [128, 4288, 1, 3328]
    - [65, 8269.74]
  - - [1856, 1024, 1, 3328]
    - [68, 15062.4]
  - - [256, 2368, 1, 256]
    - [65, 7079.8]
  - - [1024, 448, 1, 3328]
    - [65, 9354.94]
  - - [1856, 704, 1, 1280]
    - [65, 11919.0]
  - - [5888, 5888, 1, 3328]
    - [68, 19586.5]
  - - [6784, 1024, 1, 256]
    - [68, 16552.3]
  - - [5056, 5888, 1, 3328]
    - [68, 19653.1]
  - - [1856, 1024, 1, 256]
    - [66, 11304.4]
  - - [512, 48000, 1, 1536]
    - [68, 18694.9]
  - - [5056, 1408, 1, 3328]
    - [68, 18619.6]
  - - [8448, 5984, 1, 2816]
    - [68, 19829.5]
  - - [1024, 1024, 1, 1280]
    - [68, 12925.4]
  - - [4288, 1024, 1, 3328]
    - [68, 15692.6]
  - - [2048, 128, 1, 2048]
    - [46, 3337.09]
  - - [1024, 24000, 1, 2560]
    - [68, 19092.8]
  - - [2944, 1408, 1, 3328]
    - [68, 18182.0]
  - - [2944, 4288, 1, 3328]
    - [68, 18276.4]
  - - [256, 2944, 1, 256]
    - [65, 8644.17]
  - - [5056, 2944, 1, 256]
    - [68, 17569.7]
  - - [1024, 700, 1, 512]
    - [68, 7351.79]
  - - [2368, 1856, 1, 256]
    - [68, 13445.5]
  - - [128, 448, 1, 1280]
    - [58, 2364.7]
  - - [128, 6784, 1, 1280]
    - [68, 10803.8]
  - - [1408, 3584, 1, 3328]
    - [68, 18061.2]
  - - [2368, 6784, 1, 256]
    - [68, 17892.9]
  - - [5056, 1408, 1, 1280]
    - [68, 18356.4]
  - - [704, 3584, 1, 1280]
    - [66, 14214.9]
  - - [1408, 5888, 1, 3328]
    - [68, 19149.2]
  - - [1856, 5056, 1, 256]
    - [68, 16127.1]
  - - [6784, 6784, 1, 256]
    - [68, 19380.5]
  - - [1408, 704, 1, 3328]
    - [67, 12770.3]
  - - [128, 5888, 1, 1280]
    - [65, 10728.3]
  - - [2368, 4288, 1, 1280]
    - [68, 17085.3]
  - - [3584, 1856, 1, 1280]
    - [68, 17105.5]
  - - [704, 1408, 1, 3328]
    - [66, 12774.2]
  - - [704, 64, 1, 1280]
    - [55, 1834.34]
  - - [5888, 5056, 1, 256]
    - [68, 18682.7]
  - - [8448, 48000, 1, 2816]
    - [68, 20265.8]
  - - [3584, 448, 1, 256]
    - [67, 9657.94]
  - - [3584, 3584, 1, 1280]
    - [68, 18478.8]
  - - [7680, 64, 1, 2560]
    - [63, 6978.1]
  - - [256, 6784, 1, 256]
    - [68, 10329.8]
  - - [1856, 3584, 1, 3328]
    - [68, 17393.9]
  - - [5056, 256, 1, 1280]
    - [65, 11922.5]
  - - [2560, 32, 1, 2560]
    - [58, 2919.2]
  - - [3584, 3584, 1, 256]
    - [68, 17454.0]
  - - [6784, 4288, 1, 1280]
    - [68, 19112.9]
  - - [704, 5056, 1, 256]
    - [68, 13463.5]
  - - [6784, 128, 1, 256]
    - [66, 8077.55]
  - - [64, 1408, 1, 3328]
    - [55, 3621.89]
  - - [704, 448, 1, 256]
    - [65, 4331.56]
  - - [2944, 2368, 1, 1280]
    - [68, 17964.6]
  - - [448, 64, 1, 3328]
    - [55, 1377.32]
  - - [6784, 3584, 1, 256]
    - [68, 18511.6]
  - - [256, 1856, 1, 3328]
    - [65, 9693.8]
  - - [128, 64, 1, 1280]
    - [55, 367.148]
  - - [128, 1408, 1, 256]
    - [39, 3276.8]
  - - [64, 128, 1, 3328]
    - [55, 399.048]
  - - [2944, 2944, 1, 3328]
    - [68, 17892.6]
  - - [5056, 6784, 1, 256]
    - [68, 18590.7]
  - - [1408, 4288, 1, 3328]
    - [68, 18262.2]
  - - [6784, 256, 1, 1280]
    - [68, 13244.6]
  - - [2368, 704, 1, 3328]
    - [68, 13194.5]
  - - [128, 4288, 1, 256]
    - [65, 6457.22]
  - - [3584, 6784, 1, 256]
    - [68, 18533.7]
  - - [128, 128, 1, 3328]
    - [55, 782.519]
  - - [5056, 1856, 1, 256]
    - [68, 16058.1]
  - - [4608, 5984, 1, 1536]
    - [68, 18747.4]
  - - [256, 128, 1, 256]
    - [41, 896.219]
  - - [1760, 3200, 1, 1760]
    - [68, 16873.8]
  - - [4096, 1600, 1, 1024]
    - [69, 13216.7]
  - - [704, 4288, 1, 256]
    - [66, 12561.8]
  - - [256, 448, 1, 3328]
    - [55, 4313.76]
  - - [1408, 6784, 1, 1280]
    - [68, 17680.5]
  - - [7680, 24000, 1, 2560]
    - [68, 20105.8]
  - - [64, 2368, 1, 1280]
    - [55, 4345.58]
  - - [4608, 48000, 1, 1536]
    - [68, 20144.0]
  - - [6144, 48000, 1, 2048]
    - [68, 17572.6]
  - - [64, 6784, 1, 3328]
    - [44, 8810.6]
  - - [2944, 256, 1, 1280]
    - [65, 10824.6]
  - - [2048, 16, 1, 2048]
    - [58, 1043.36]
  - - [1024, 24000, 1, 1536]
    - [68, 18743.2]
  - - [5056, 2368, 1, 3328]
    - [68, 18695.3]
  - - [2944, 4288, 1, 256]
    - [68, 16916.4]
  - - [1408, 3584, 1, 1280]
    - [68, 17799.9]
  - - [2368, 64, 1, 256]
    - [44, 2819.57]
  - - [256, 256, 1, 256]
    - [41, 1705.0]
  - - [704, 128, 1, 3328]
    - [58, 3625.4]
  - - [8192, 1600, 1, 2048]
    - [69, 14058.3]
  - - [1856, 704, 1, 256]
    - [66, 9678.7]
  - - [1408, 448, 1, 3328]
    - [65, 9479.99]
  - - [512, 24000, 1, 2560]
    - [68, 18247.5]
  - - [2368, 6784, 1, 3328]
    - [68, 19028.0]
  - - [5056, 704, 1, 1280]
    - [68, 15284.7]
  - - [1856, 4288, 1, 3328]
    - [68, 18359.4]
  - - [1408, 5888, 1, 256]
    - [68, 17557.2]
  - - [4288, 64, 1, 1280]
    - [60, 5702.48]
  - - [256, 64, 1, 256]
    - [41, 451.972]
  - - [704, 1856, 1, 256]
    - [66, 9678.7]
  - - [2560, 64, 1, 2560]
    - [60, 4850.03]
  - - [3584, 704, 1, 1280]
    - [67, 14229.9]
  - - [256, 2368, 1, 1280]
    - [65, 8746.01]
  - - [3584, 448, 1, 3328]
    - [68, 12667.2]
  - - [704, 2368, 1, 3328]
    - [68, 13187.0]
  - - [2944, 448, 1, 256]
    - [67, 9724.7]
  - - [448, 5056, 1, 3328]
    - [67, 13176.9]
  - - [2368, 128, 1, 1280]
    - [60, 6306.46]
  - - [4288, 448, 1, 256]
    - [67, 11136.4]
  - - [448, 5888, 1, 256]
    - [68, 11905.6]
  - - [64, 5056, 1, 1280]
    - [57, 6715.1]
  - - [2048, 3200, 1, 512]
    - [69, 13443.3]
  - - [5888, 2368, 1, 256]
    - [68, 17394.5]
  - - [704, 448, 1, 3328]
    - [60, 6837.05]
  - - [6784, 704, 1, 3328]
    - [68, 17037.9]
  - - [1408, 2944, 1, 3328]
    - [68, 18218.5]
  - - [4608, 12000, 1, 1536]
    - [68, 19418.8]
  - - [64, 1024, 1, 256]
    - [41, 1777.25]
  - - [2368, 448, 1, 1280]
    - [65, 9704.87]
  - - [128, 3584, 1, 256]
    - [65, 6300.46]
  - - [1856, 448, 1, 3328]
    - [68, 11245.1]
  - - [128, 5056, 1, 256]
    - [65, 7503.4]
  - - [2368, 704, 1, 256]
    - [68, 9952.67]
  - - [3584, 2368, 1, 256]
    - [68, 15928.5]
  - - [5888, 5056, 1, 1280]
    - [68, 19285.6]
  - - [128, 1024, 1, 1280]
    - [58, 4481.09]
  - - [8448, 24000, 1, 2816]
    - [68, 20205.4]
  - - [64, 704, 1, 256]
    - [41, 1275.92]
  - - [4288, 256, 1, 1280]
    - [65, 10053.6]
  - - [3584, 3584, 1, 3328]
    - [68, 18625.1]
  - - [704, 704, 1, 256]
    - [65, 6956.01]
  - - [5888, 6784, 1, 256]
    - [68, 19004.1]
  - - [4288, 2944, 1, 3328]
    - [68, 18292.3]
  - - [1856, 64, 1, 256]
    - [51, 2551.07]
  - - [1024, 16, 1, 500000]
    - [41, 801.083]
  - - [4288, 128, 1, 3328]
    - [65, 8278.73]
  - - [7680, 128, 1, 2560]
    - [50, 11451.5]
  - - [256, 5056, 1, 1280]
    - [65, 11867.8]
  - - [6784, 5888, 1, 1280]
    - [68, 19376.9]
  - - [2048, 800, 1, 512]
    - [69, 9836.55]
  - - [704, 128, 1, 256]
    - [51, 2016.49]
  - - [5888, 4288, 1, 1280]
    - [68, 19172.5]
  - - [1024, 24000, 1, 2048]
    - [69, 15448.3]
  - - [448, 256, 1, 1280]
    - [58, 3887.73]
  - - [1024, 256, 1, 1280]
    - [60, 7182.03]
  - - [256, 1408, 1, 1280]
    - [60, 7102.42]
  - - [3072, 16, 1, 1024]
    - [55, 1469.97]
  - - [1408, 1856, 1, 1280]
    - [67, 14655.4]
  - - [5888, 448, 1, 3328]
    - [68, 14697.8]
  - - [704, 5888, 1, 1280]
    - [66, 15243.0]
  - - [1024, 6784, 1, 3328]
    - [68, 18212.0]
  - - [704, 2944, 1, 1280]
    - [66, 14411.7]
  - - [6784, 64, 1, 3328]
    - [44, 8819.17]
  - - [5056, 2944, 1, 3328]
    - [68, 18763.4]
  - - [448, 128, 1, 256]
    - [41, 1456.36]
  - - [1408, 1408, 1, 3328]
    - [68, 15729.6]
  - - [1856, 128, 1, 1280]
    - [60, 6420.76]
  - - [448, 4288, 1, 1280]
    - [66, 13346.2]
  - - [64, 3584, 1, 256]
    - [44, 4146.91]
  - - [128, 2944, 1, 3328]
    - [60, 8250.64]
  - - [3584, 704, 1, 256]
    - [67, 12068.8]
  - - [2944, 448, 1, 3328]
    - [67, 11992.7]
  - - [3584, 1408, 1, 3328]
    - [68, 18106.3]
  - - [2368, 1024, 1, 1280]
    - [67, 13694.8]
  - - [2944, 6784, 1, 1280]
    - [68, 18964.6]
  - - [1856, 6784, 1, 256]
    - [68, 17029.4]
  - - [4288, 448, 1, 3328]
    - [67, 13724.0]
  - - [4288, 3584, 1, 1280]
    - [68, 19201.2]
  - - [6144, 12000, 1, 2048]
    - [69, 16689.0]
  - - [8192, 800, 1, 2048]
    - [69, 11269.7]
  - - [5888, 1024, 1, 3328]
    - [68, 18232.1]
  - - [704, 6784, 1, 1280]
    - [68, 16772.4]
  - - [5888, 128, 1, 256]
    - [65, 8065.97]
  - - [4096, 16, 1, 4096]
    - [48, 1344.33]
  - - [704, 5056, 1, 1280]
    - [68, 15350.6]
  - - [64, 704, 1, 3328]
    - [55, 2037.31]
  - - [2944, 1856, 1, 256]
    - [68, 14558.7]
  - - [5056, 64, 1, 256]
    - [44, 4793.84]
  - - [3584, 5056, 1, 256]
    - [68, 18008.2]
  - - [5888, 5056, 1, 3328]
    - [68, 19647.5]
  - - [128, 5056, 1, 3328]
    - [65, 9726.22]
  - - [3584, 6784, 1, 1280]
    - [68, 19292.9]
  - - [1856, 5888, 1, 256]
    - [68, 17201.2]
  - - [64, 448, 1, 3328]
    - [55, 1388.54]
  - - [4288, 4288, 1, 3328]
    - [68, 18414.0]
  - - [4288, 1408, 1, 1280]
    - [68, 17945.4]
  - - [64, 1856, 1, 256]
    - [41, 2658.1]
  - - [4288, 2368, 1, 256]
    - [68, 15850.1]
  - - [2944, 5056, 1, 1280]
    - [68, 18627.9]
  - - [256, 4288, 1, 256]
    - [65, 8464.41]
  - - [6784, 2368, 1, 3328]
    - [68, 18974.0]
  - - [256, 1024, 1, 1280]
    - [60, 7025.64]
  - - [4288, 1856, 1, 3328]
    - [68, 18336.0]
  - - [1856, 2944, 1, 1280]
    - [68, 16250.0]
  - - [2048, 1600, 1, 2048]
    - [69, 9187.96]
  - - [3584, 64, 1, 1280]
    - [60, 6086.26]
  - - [4288, 6784, 1, 3328]
    - [68, 19246.7]
  - - [3584, 1024, 1, 1280]
    - [68, 15866.1]
  - - [1024, 4288, 1, 256]
    - [68, 13694.9]
  - - [5888, 3584, 1, 3328]
    - [68, 19139.0]
  - - [5056, 3584, 1, 3328]
    - [68, 19114.6]
  - - [1408, 128, 1, 3328]
    - [60, 5701.38]
  - - [2368, 1408, 1, 1280]
    - [68, 14367.4]
  - - [5056, 2944, 1, 1280]
    - [68, 18617.7]
  - - [3584, 256, 1, 256]
    - [67, 8660.8]
  - - [1024, 6784, 1, 256]
    - [68, 16515.5]
  - - [3584, 2944, 1, 256]
    - [68, 16806.4]
  - - [448, 128, 1, 3328]
    - [55, 2570.59]
  - - [3584, 1408, 1, 1280]
    - [68, 17792.1]
  - - [64, 4288, 1, 3328]
    - [57, 6161.02]
  - - [5056, 6784, 1, 3328]
    - [68, 19401.9]
  - - [128, 2944, 1, 256]
    - [65, 5431.81]
  - - [3584, 4288, 1, 256]
    - [68, 18120.2]
  - - [1856, 6784, 1, 3328]
    - [68, 18258.8]
  - - [3584, 128, 1, 3328]
    - [65, 9359.53]
  - - [2368, 64, 1, 3328]
    - [57, 4750.99]
  - - [1024, 448, 1, 1280]
    - [65, 8875.49]
  - - [5056, 1408, 1, 256]
    - [68, 16799.6]
  - - [64, 256, 1, 1280]
    - [55, 728.178]
  - - [3584, 1024, 1, 256]
    - [68, 14183.6]
  - - [256, 704, 1, 256]
    - [65, 3276.8]
  - - [5888, 5888, 1, 256]
    - [68, 18854.4]
  - - [4288, 1024, 1, 1280]
    - [68, 15433.8]
  - - [5888, 128, 1, 3328]
    - [65, 11265.7]
  - - [448, 6784, 1, 3328]
    - [66, 14971.2]
  - - [2944, 1408, 1, 1280]
    - [68, 17896.0]
  - - [2944, 1856, 1, 3328]
    - [68, 16500.1]
  - - [128, 1024, 1, 256]
    - [40, 2833.99]
  - - [64, 64, 1, 256]
    - [41, 110.145]
  - - [3584, 5888, 1, 1280]
    - [68, 19085.5]
  - - [6784, 1856, 1, 1280]
    - [68, 18029.1]
  - - [5888, 256, 1, 3328]
    - [66, 13700.0]
  - - [1856, 5888, 1, 3328]
    - [68, 18609.5]
  - - [3584, 1408, 1, 256]
    - [68, 15909.4]
  - - [64, 448, 1, 256]
    - [41, 857.48]
  - - [704, 3584, 1, 3328]
    - [66, 14624.9]
  - - [4096, 3200, 1, 1024]
    - [69, 15032.0]
  - - [5056, 448, 1, 1280]
    - [66, 12842.5]
  - - [3584, 1856, 1, 3328]
    - [68, 17390.6]
  - - [1408, 704, 1, 1280]
    - [67, 12209.2]
  - - [2944, 1024, 1, 256]
    - [68, 14145.0]
  - - [448, 1408, 1, 1280]
    - [65, 9108.79]
  - - [2368, 4288, 1, 3328]
    - [68, 17295.4]
  - - [1024, 1408, 1, 1280]
    - [67, 12759.2]
  - - [256, 128, 1, 1280]
    - [58, 1424.7]
  - - [704, 1408, 1, 1280]
    - [66, 12199.8]
  - - [6784, 5056, 1, 256]
    - [68, 18524.8]
  - - [3584, 5056, 1, 3328]
    - [68, 19119.9]
  - - [4288, 5888, 1, 256]
    - [68, 18433.2]
  - - [448, 2944, 1, 256]
    - [66, 9792.39]
  - - [2944, 6784, 1, 256]
    - [68, 18187.5]
  - - [2368, 2368, 1, 1280]
    - [68, 16626.9]
  - - [1856, 3584, 1, 1280]
    - [68, 17180.1]
  - - [64, 2944, 1, 256]
    - [44, 3505.41]
  - - [5056, 3584, 1, 1280]
    - [68, 18998.2]
  - - [256, 5888, 1, 256]
    - [67, 10962.4]
  - - [128, 256, 1, 3328]
    - [55, 1552.56]
  - - [1856, 1408, 1, 3328]
    - [66, 15145.0]
  - - [1024, 4288, 1, 3328]
    - [68, 15749.4]
  - - [448, 2368, 1, 256]
    - [66, 7913.2]
  - - [64, 1408, 1, 1280]
    - [55, 3376.56]
  - - [64, 6784, 1, 1280]
    - [44, 8309.59]
  - - [2944, 2368, 1, 3328]
    - [68, 18211.0]
  - - [704, 4288, 1, 3328]
    - [66, 14851.0]
  - - [1408, 128, 1, 256]
    - [65, 3186.28]
  - - [1024, 1856, 1, 1280]
    - [68, 14357.3]
  - - [2048, 6400, 1, 2048]
    - [69, 14436.4]
  - - [512, 48000, 1, 2816]
    - [68, 19614.5]
  - - [5124, 9124, 1, 2560]
    - [68, 19005.1]
  - - [128, 2368, 1, 3328]
    - [57, 6732.05]
  - - [1024, 5888, 1, 256]
    - [68, 16378.4]
  - - [64, 2944, 1, 1280]
    - [57, 5298.17]
  - - [5056, 64, 1, 3328]
    - [60, 7103.48]
  - - [1408, 2368, 1, 256]
    - [68, 12762.3]
  - - [2944, 704, 1, 3328]
    - [67, 14794.0]
  - - [64, 128, 1, 1280]
    - [55, 371.309]
  - - [1024, 8, 1, 500000]
    - [41, 400.651]
  - - [2944, 2944, 1, 1280]
    - [68, 17703.8]
  - - [6784, 256, 1, 3328]
    - [68, 13803.4]
  - - [1408, 5056, 1, 256]
    - [68, 16640.1]
  - - [5056, 128, 1, 3328]
    - [65, 9733.26]
  - - [128, 128, 1, 1280]
    - [55, 718.203]
  - - [448, 704, 1, 256]
    - [65, 4505.6]
  - - [1856, 256, 1, 3328]
    - [65, 9708.08]
  - - [2944, 128, 1, 3328]
    - [60, 7933.31]
  - - [448, 1024, 1, 3328]
    - [65, 9350.36]
  - - [256, 448, 1, 1280]
    - [55, 4015.33]
  - - [4608, 24000, 1, 1536]
    - [68, 19955.7]
  - - [704, 256, 1, 1280]
    - [60, 5290.98]
  - - [64, 2368, 1, 3328]
    - [57, 4797.99]
  - - [256, 704, 1, 3328]
    - [60, 5649.83]
  - - [4096, 64, 1, 4096]
    - [46, 3857.94]
  - - [1408, 4288, 1, 256]
    - [68, 16126.9]
  - - [5888, 2368, 1, 1280]
    - [68, 18581.1]
  - - [128, 256, 1, 256]
    - [41, 903.945]
  - - [256, 64, 1, 1280]
    - [55, 720.176]
  - - [2368, 5888, 1, 1280]
    - [68, 18668.2]
  - - [5888, 256, 1, 1280]
    - [67, 13280.4]
  - - [1760, 128, 1, 1760]
    - [57, 6370.39]
  - - [704, 1024, 1, 1280]
    - [65, 9909.22]
  - - [2368, 1856, 1, 3328]
    - [68, 15716.7]
  - - [2944, 704, 1, 256]
    - [67, 12014.9]
  - - [2368, 6784, 1, 1280]
    - [68, 18859.2]
  - - [2368, 1024, 1, 3328]
    - [67, 14060.9]
  - - [1856, 4288, 1, 1280]
    - [68, 18069.6]
  - - [704, 3584, 1, 256]
    - [68, 11786.9]
  - - [704, 2944, 1, 3328]
    - [66, 14819.4]
  - - [1856, 5056, 1, 3328]
    - [68, 17502.3]
  - - [3584, 5056, 1, 1280]
    - [68, 18973.3]
  - - [2944, 1024, 1, 3328]
    - [68, 16929.0]
  - - [2368, 256, 1, 256]
    - [65, 7105.73]
  - - [1408, 6784, 1, 256]
    - [68, 16504.3]
  - - [6784, 1408, 1, 3328]
    - [68, 17788.4]
  - - [1024, 2368, 1, 1280]
    - [67, 13704.5]
  - - [704, 64, 1, 256]
    - [41, 1211.59]
  - - [256, 2368, 1, 3328]
    - [65, 9133.74]
  - - [6784, 2944, 1, 1280]
    - [68, 18904.0]
  - - [3584, 448, 1, 1280]
    - [68, 12078.1]
  - - [2944, 6784, 1, 3328]
    - [68, 19068.6]
  - - [448, 5056, 1, 1280]
    - [67, 12833.4]
  - - [64, 2944, 1, 3328]
    - [57, 5951.48]
  - - [4288, 704, 1, 256]
    - [67, 12480.6]
  - - [64, 64, 1, 1280]
    - [55, 177.604]
  - - [5888, 704, 1, 256]
    - [67, 13590.7]
  - - [256, 5888, 1, 3328]
    - [67, 13733.0]
  - - [6784, 4288, 1, 256]
    - [68, 18317.0]
  - - [5888, 256, 1, 256]
    - [67, 10962.4]
  - - [6784, 1024, 1, 1280]
    - [68, 17927.2]
  - - [704, 448, 1, 1280]
    - [52, 6260.88]
  - - [512, 16, 1, 500000]
    - [41, 400.805]
  - - [128, 64, 1, 3328]
    - [55, 396.726]
  - - [448, 64, 1, 256]
    - [41, 790.952]
  - - [2944, 704, 1, 1280]
    - [67, 14411.7]
  - - [6784, 3584, 1, 1280]
    - [68, 19192.0]
  - - [1024, 704, 1, 1280]
    - [65, 10428.9]
  - - [1408, 2944, 1, 1280]
    - [68, 17843.0]
  - - [256, 1856, 1, 256]
    - [65, 6757.49]
  - - [2048, 800, 1, 2048]
    - [69, 7136.81]
  - - [1408, 2368, 1, 3328]
    - [68, 14641.7]
  - - [128, 1408, 1, 3328]
    - [57, 5688.41]
  - - [2368, 2944, 1, 256]
    - [68, 16463.8]
  - - [704, 1856, 1, 1280]
    - [65, 11932.6]
  - - [1408, 256, 1, 3328]
    - [60, 7842.38]
  - - [2944, 5888, 1, 256]
    - [68, 18312.9]
  - - [3584, 1856, 1, 256]
    - [68, 15548.6]
  - - [2368, 448, 1, 256]
    - [67, 7804.06]
  - - [4288, 256, 1, 3328]
    - [65, 10437.8]
  - - [1408, 64, 1, 256]
    - [51, 2059.7]
  - - [2560, 16, 1, 2560]
    - [58, 1768.85]
  - - [4288, 2944, 1, 1280]
    - [68, 18142.6]
  - - [5056, 448, 1, 3328]
    - [66, 13158.4]
  - - [1024, 64, 1, 256]
    - [41, 1651.3]
  - - [64, 2368, 1, 256]
    - [40, 3069.41]
  - - [4288, 5056, 1, 3328]
    - [68, 18801.2]
  - - [2944, 256, 1, 256]
    - [65, 8801.92]
  - - [1024, 128, 1, 3328]
    - [55, 4795.6]
  - - [256, 5056, 1, 3328]
    - [65, 12321.4]
  - - [5056, 2368, 1, 256]
    - [68, 17180.4]
  - - [4288, 704, 1, 3328]
    - [67, 14840.5]
  - - [448, 3584, 1, 256]
    - [67, 9497.27]
  - - [2368, 64, 1, 1280]
    - [58, 4261.57]
  - - [1408, 448, 1, 256]
    - [65, 7313.44]
  - - [1024, 1408, 1, 3328]
    - [67, 13115.8]
  - - [2944, 5888, 1, 1280]
    - [68, 19248.3]
  - - [5888, 3584, 1, 256]
    - [68, 18255.8]
  - - [1408, 1856, 1, 3328]
    - [67, 15155.6]
  - - [6784, 1408, 1, 1280]
    - [68, 17662.1]
  - - [704, 2944, 1, 256]
    - [66, 11971.6]
  - - [4288, 64, 1, 256]
    - [44, 4103.66]
  - - [2944, 5888, 1, 3328]
    - [68, 19366.9]
  - - [64, 4288, 1, 1280]
    - [60, 5717.33]
  - - [6784, 64, 1, 1280]
    - [65, 8289.76]
  - - [1408, 6784, 1, 3328]
    - [68, 17837.1]
  - - [1408, 64, 1, 3328]
    - [58, 3607.95]
  - - [1408, 1408, 1, 1280]
    - [68, 15162.2]
  - - [16384, 400, 1, 4096]
    - [69, 10920.2]
  - - [448, 4288, 1, 3328]
    - [66, 13738.1]
  - - [704, 2368, 1, 256]
    - [66, 9842.49]
  - - [2944, 448, 1, 1280]
    - [67, 11658.9]
  - - [5888, 2368, 1, 3328]
    - [68, 18770.3]
  - - [5124, 9124, 1, 1760]
    - [68, 19133.3]
  - - [4288, 5056, 1, 256]
    - [68, 17734.3]
  - - [4288, 448, 1, 1280]
    - [67, 13340.4]
  - - [5888, 704, 1, 3328]
    - [67, 15575.7]
  - - [4288, 3584, 1, 3328]
    - [68, 19364.4]
  - - [128, 2368, 1, 256]
    - [43, 4449.23]
  - - [1408, 1024, 1, 256]
    - [66, 10729.6]
  - - [8192, 400, 1, 2048]
    - [69, 9238.55]
  - - [128, 64, 1, 256]
    - [40, 225.986]
  - - [2560, 7000, 1, 2560]
    - [68, 18451.6]
  - - [448, 1024, 1, 256]
    - [65, 6582.99]
  - - [6784, 6784, 1, 3328]
    - [68, 20115.2]
  - - [704, 5056, 1, 3328]
    - [68, 15639.2]
  - - [1024, 64, 1, 1280]
    - [55, 2709.5]
  - - [64, 1024, 1, 3328]
    - [55, 2973.06]
  - - [2368, 2944, 1, 3328]
    - [68, 18246.5]
  - - [448, 448, 1, 1280]
    - [65, 5584.81]
  - - [2368, 3584, 1, 256]
    - [68, 16013.0]
  - - [1856, 448, 1, 256]
    - [66, 7734.77]
  - - [128, 5056, 1, 1280]
    - [65, 9303.4]
  - - [5124, 9124, 1, 4096]
    - [69, 16095.0]
  - - [7680, 48000, 1, 2560]
    - [68, 20251.3]
  - - [1024, 48000, 1, 2816]
    - [68, 20162.8]
  - - [1856, 1856, 1, 256]
    - [68, 13185.6]
  - - [4288, 1408, 1, 3328]
    - [68, 18260.9]
  - - [3584, 64, 1, 3328]
    - [60, 6929.59]
  - - [5124, 9124, 1, 2048]
    - [69, 15853.8]
  - - [4288, 5056, 1, 1280]
    - [68, 18698.8]
  - - [5888, 6784, 1, 1280]
    - [68, 19626.2]
  - - [256, 1024, 1, 3328]
    - [60, 8030.33]
  - - [1760, 1600, 1, 1760]
    - [68, 15407.1]
  - - [1856, 64, 1, 3328]
    - [58, 4451.72]
  - - [5888, 1408, 1, 3328]
    - [68, 19100.4]
  - - [256, 5056, 1, 256]
    - [66, 9413.35]
  - - [7680, 12000, 1, 2560]
    - [68, 19897.2]
  - - [1024, 128, 1, 256]
    - [40, 2853.27]
  - - [1408, 256, 1, 256]
    - [65, 5219.16]
  - - [2368, 5056, 1, 256]
    - [68, 17242.3]
  - - [256, 1408, 1, 256]
    - [65, 5172.35]
  - - [1024, 5056, 1, 256]
    - [68, 16131.9]
  - - [2368, 1408, 1, 3328]
    - [68, 14655.6]
  - - [1024, 48000, 1, 1536]
    - [68, 19525.4]
  - - [5888, 448, 1, 256]
    - [68, 11468.8]
  - - [2560, 3200, 1, 2560]
    - [68, 17407.8]
  - - [6784, 5056, 1, 1280]
    - [68, 19223.0]
  - - [1024, 48000, 1, 2560]
    - [68, 19844.6]
  - - [4608, 32, 1, 1536]
    - [57, 4004.46]
  - - [4288, 6784, 1, 1280]
    - [68, 19134.1]
  - - [128, 704, 1, 256]
    - [51, 2089.55]
  - - [2368, 448, 1, 3328]
    - [65, 10039.1]
  - - [128, 5888, 1, 3328]
    - [65, 11273.8]
  - - [16384, 800, 1, 4096]
    - [69, 13596.3]
  - - [448, 128, 1, 1280]
    - [55, 2364.7]
  - - [1024, 64, 1, 3328]
    - [55, 2950.54]
  - - [3072, 48000, 1, 1024]
    - [68, 19045.2]
  - - [64, 3584, 1, 1280]
    - [57, 6046.15]
  - - [6784, 1408, 1, 256]
    - [68, 16558.0]
  - - [5888, 4288, 1, 256]
    - [68, 18303.8]
  - - [5056, 5888, 1, 256]
    - [68, 18752.6]
  - - [2368, 1024, 1, 256]
    - [66, 11774.6]
  - - [1856, 6784, 1, 1280]
    - [68, 18079.3]
  - - [3584, 128, 1, 1280]
    - [65, 8832.77]
  - - [4288, 128, 1, 256]
    - [65, 6410.09]
  - - [6784, 1856, 1, 256]
    - [68, 16950.6]
  - - [4288, 3584, 1, 256]
    - [68, 18133.6]
  - - [64, 256, 1, 3328]
    - [55, 793.451]
  - - [6784, 448, 1, 3328]
    - [67, 14934.1]
  - - [5056, 1856, 1, 1280]
    - [68, 17301.6]
  - - [1408, 1024, 1, 3328]
    - [67, 13138.8]
  - - [2368, 256, 1, 3328]
    - [65, 9133.74]
  - - [5888, 3584, 1, 1280]
    - [68, 19037.1]
  - - [5888, 128, 1, 1280]
    - [65, 10690.3]
  - - [1024, 2944, 1, 256]
    - [68, 14001.3]
  - - [448, 6784, 1, 1280]
    - [66, 14620.5]
  - - [256, 3584, 1, 1280]
    - [68, 11459.8]
  - - [3584, 1024, 1, 3328]
    - [68, 16154.1]
  - - [2944, 1856, 1, 1280]
    - [68, 16247.0]
  - - [5056, 256, 1, 256]
    - [65, 9677.28]
  - - [128, 5888, 1, 256]
    - [65, 8259.33]
  - - [2368, 3584, 1, 3328]
    - [68, 17514.4]
  - - [3584, 5888, 1, 3328]
    - [68, 19182.5]
  - - [2944, 3584, 1, 1280]
    - [68, 17811.9]
  - - [1856, 5888, 1, 1280]
    - [68, 18438.3]
  - - [256, 256, 1, 1280]
    - [55, 2695.57]
  - - [2048, 3200, 1, 2048]
    - [69, 12345.3]
  - - [4288, 1408, 1, 256]
    - [68, 16290.1]
  - - [3584, 64, 1, 256]
    - [44, 4100.58]
  - - [64, 1856, 1, 3328]
    - [55, 4467.82]
  - - [1024, 1024, 1, 256]
    - [67, 9927.35]
  - - [4288, 2368, 1, 1280]
    - [68, 17108.7]
  - - [2944, 5056, 1, 256]
    - [68, 17396.5]
  - - [256, 128, 1, 3328]
    - [58, 1550.79]
  - - [512, 8, 1, 500000]
    - [41, 200.423]
  - - [6784, 2368, 1, 256]
    - [68, 17647.2]
  - - [1024, 1024, 1, 1024]
    - [69, 9250.02]
  - - [2944, 64, 1, 3328]
    - [60, 5920.02]
  - - [1024, 24000, 1, 2816]
    - [68, 19600.7]
  - - [7680, 5984, 1, 2560]
    - [68, 19459.4]
  - - [4288, 1856, 1, 256]
    - [68, 16515.8]
  - - [1856, 2944, 1, 256]
    - [68, 14718.0]
  - - [6144, 48000, 1, 2560]
    - [68, 20161.5]
  - - [64, 5888, 1, 1280]
    - [60, 7388.86]
  - - [1760, 800, 1, 1760]
    - [64, 12939.0]
  - - [1856, 1408, 1, 1280]
    - [66, 14712.2]
  - - [704, 1024, 1, 256]
    - [65, 8419.22]
  - - [1024, 4288, 1, 1280]
    - [68, 15457.6]
  - - [2368, 5056, 1, 3328]
    - [68, 18728.3]
  - - [1024, 5056, 1, 3328]
    - [68, 18538.3]
  - - [1024, 1856, 1, 3328]
    - [68, 15016.6]
  - - [704, 704, 1, 1280]
    - [65, 9577.12]
  - - [128, 2368, 1, 1280]
    - [57, 6290.1]
  - - [3584, 256, 1, 1280]
    - [68, 11415.3]
  - - [5888, 64, 1, 1280]
    - [44, 7255.49]
  - - [128, 704, 1, 3328]
    - [58, 3628.91]
  - - [4288, 6784, 1, 256]
    - [68, 18385.8]
  - - [3584, 2944, 1, 3328]
    - [68, 17979.5]
  - - [128, 1856, 1, 256]
    - [42, 4200.1]
  - - [64, 4288, 1, 256]
    - [43, 4181.82]
  - - [5888, 2944, 1, 256]
    - [68, 18312.9]
  - - [5056, 128, 1, 1280]
    - [65, 9286.72]
  - - [448, 1856, 1, 3328]
    - [68, 11245.1]
  - - [5056, 4288, 1, 256]
    - [68, 17766.0]
  - - [1024, 448, 1, 256]
    - [65, 6672.76]
  - - [1024, 3584, 1, 256]
    - [68, 14269.8]
  - - [2944, 128, 1, 1280]
    - [60, 7370.8]
  - - [2048, 32, 1, 2048]
    - [55, 1959.96]
  - - [64, 256, 1, 256]
    - [41, 489.989]
  - - [704, 256, 1, 3328]
    - [60, 5679.79]
  - - [256, 704, 1, 1280]
    - [60, 5121.82]
  - - [5888, 5888, 1, 1280]
    - [68, 19527.4]
  - - [448, 5888, 1, 1280]
    - [68, 14321.4]
  - - [4288, 704, 1, 1280]
    - [67, 14495.8]
  - - [2944, 1408, 1, 256]
    - [68, 15942.9]
  - - [256, 2944, 1, 1280]
    - [65, 10709.3]
  - - [2560, 128, 1, 2560]
    - [52, 5812.51]
  - - [2368, 5888, 1, 3328]
    - [68, 18800.1]
  - - [704, 1024, 1, 3328]
    - [65, 10826.5]
  - - [2368, 1856, 1, 1280]
    - [68, 15384.0]
  - - [1856, 448, 1, 1280]
    - [68, 10281.2]
  - - [128, 6784, 1, 256]
    - [67, 8077.69]
  - - [5888, 4288, 1, 3328]
    - [68, 19272.0]
  - - [6784, 704, 1, 1280]
    - [68, 16677.2]
  - - [5056, 448, 1, 256]
    - [66, 11100.0]
  - - [1856, 5056, 1, 1280]
    - [68, 17289.6]
  - - [2944, 1024, 1, 1280]
    - [68, 16569.7]
  - - [2368, 4288, 1, 256]
    - [68, 15990.5]
  - - [1024, 2368, 1, 3328]
    - [67, 14062.9]
  - - [4288, 64, 1, 3328]
    - [60, 6137.83]
  - - [704, 1408, 1, 256]
    - [66, 9274.69]
  - - [4096, 128, 1, 4096]
    - [47, 4351.36]
  - - [4288, 5888, 1, 3328]
    - [68, 19323.4]
  - - [4608, 16, 1, 1536]
    - [58, 2546.0]
  - - [448, 2944, 1, 1280]
    - [66, 11671.8]
  - - [1024, 2944, 1, 3328]
    - [68, 16967.9]
  - - [2048, 64, 1, 2048]
    - [45, 2410.52]
  - - [256, 6784, 1, 1280]
    - [68, 13206.9]
  - - [1856, 3584, 1, 256]
    - [68, 15755.8]
  - - [128, 448, 1, 3328]
    - [55, 2565.06]
  - - [1856, 256, 1, 256]
    - [65, 6697.95]
  - - [5056, 128, 1, 256]
    - [65, 7530.68]
  - - [512, 24000, 1, 2816]
    - [68, 19241.9]
  - - [256, 5888, 1, 1280]
    - [67, 13339.2]
  - - [16384, 1600, 1, 4096]
    - [69, 15289.9]
  - - [448, 2368, 1, 3328]
    - [65, 10000.4]
  - - [64, 1408, 1, 256]
    - [41, 2218.14]
  - - [2944, 2368, 1, 256]
    - [68, 16439.5]
  - - [1024, 1856, 1, 256]
    - [67, 11262.5]
  - - [6784, 3584, 1, 3328]
    - [68, 19346.9]
  - - [1760, 7000, 1, 1760]
    - [68, 17793.0]
  - - [1024, 704, 1, 3328]
    - [65, 10838.2]
  - - [1024, 5888, 1, 3328]
    - [68, 18237.4]
  - - [1408, 2368, 1, 1280]
    - [68, 14382.9]
  - - [128, 1408, 1, 1280]
    - [57, 5058.92]
  - - [256, 64, 1, 3328]
    - [55, 785.224]
  - - [128, 1856, 1, 3328]
    - [57, 7326.04]
  - - [2944, 2944, 1, 256]
    - [68, 16548.2]
  - - [6784, 256, 1, 256]
    - [68, 10272.4]
  - - [128, 4288, 1, 1280]
    - [65, 7968.99]
  - - [5888, 1408, 1, 256]
    - [68, 17476.3]
  - - [128, 128, 1, 256]
    - [53, 468.114]
  - - [1760, 64, 1, 1760]
    - [58, 4016.34]
  - - [448, 704, 1, 3328]
    - [60, 6687.21]
  - - [448, 1856, 1, 256]
    - [67, 7872.08]
  - - [1856, 704, 1, 3328]
    - [65, 12390.1]
  - - [5888, 6784, 1, 3328]
    - [68, 19691.9]
  - - [704, 4288, 1, 1280]
    - [66, 14474.1]
  - - [704, 256, 1, 256]
    - [65, 3258.29]
  - - [1024, 48000, 1, 2048]
    - [69, 16477.3]
  - - [512, 128, 1, 784]
    - [75, 4039.33]
  - - [1024, 256, 1, 196]
    - [71, 5536.66]
  - - [256, 64, 1, 3136]
    - [72, 2919.33]
  - - [256, 1024, 1, 196]
    - [74, 5489.34]
  - - [64, 256, 1, 3136]
    - [72, 2854.46]
  - - [128, 512, 1, 784]
    - [70, 4197.73]
  - - [64, 64, 1, 3136]
    - [73, 764.587]
  - - [128, 128, 1024, 64]
    - [76, 14762.3]
  - - [1024, 8192, 1, 4096]
    - [77, 16992.9]
  - - [1024, 4096, 1, 1024]
    - [82, 25029.0]
  - - [4096, 4096, 1, 1024]
    - [81, 26854.0]
  - - [1024, 4096, 1, 4096]
    - [83, 21949.0]
  - - [30528, 4096, 1, 1024]
    - [81, 27171.0]
  - - [1024, 2048, 1, 1024]
    - [80, 20841.0]
  - - [4096, 2048, 1, 1024]
    - [81, 25855.0]
  - - [1024, 2048, 1, 4096]
    - [85, 21033.0]
  - - [30528, 2048, 1, 1024]
    - [81, 27333.0]
  - - [1024, 32, 1, 1024]
    - [86, 1808.0]
  - - [1024, 4, 1, 1024]
    - [87, 228.0]
  - - [128, 128, 512, 64]
    - [78, 15322.0]
  - - [64, 128, 512, 128]
    - [84, 14309.0]
  - - [64, 512, 64, 512]
    - [88, 13571.0]
  - - [512, 512, 64, 64]
    - [79, 18957.0]
- null
