library/src/blas3/Tensile/Logic/asm_full/vega20/vega20_Cijk_Alik_Bljk_HB_GB.yaml
- {MinimumRequiredVersion: 4.26.0}
- vega20
- gfx906
- [Device 66a0, Device 66a1, Device 66a7, Device 66af, Vega 20]
    SolutionIndex: 0
    SolutionNameMin: Cijk_Alik_Bljk_HB_GB_MT32x32x8_SN_GRVW4_LRVW4_TT4_4_VW4_WG8_8_1_WGM1
    SolutionIndex: 1
    SolutionNameMin: Cijk_Alik_Bljk_HB_GB_MT64x64x8_SN_GRVW4_LRVW4_TT4_4_VW4_WG16_16_1_WGM1
    SolutionIndex: 2
    SolutionNameMin: Cijk_Alik_Bljk_HB_GB_MT32x32x16_SN_GRVW4_LRVW4_TT4_4_VW4_WG8_8_1_WGM1
    SolutionIndex: 3
    SolutionNameMin: Cijk_Alik_Bljk_HB_GB_MT64x64x16_SN_GRVW4_LRVW4_TT4_4_VW4_WG16_16_1_WGM1
    SolutionIndex: 4
    SolutionNameMin: Cijk_Alik_Bljk_HB_GB_MT128x64x16_SN_GRVW4_LRVW4_TT8_4_VW4_WG16_16_1_WGM1
    SolutionIndex: 5
    SolutionNameMin: Cijk_Alik_Bljk_HB_GB_MT64x128x16_SN_GRVW4_LRVW4_TT4_8_VW4_WG16_16_1_WGM1
    SolutionIndex: 6
    SolutionNameMin: Cijk_Alik_Bljk_HB_GB_MT32x32x32_SN_GRVW4_LRVW4_TT4_4_VW4_WG8_8_1_WGM1
    SolutionIndex: 7
    SolutionNameMin: Cijk_Alik_Bljk_HB_GB_MT64x64x32_SN_GRVW4_LRVW4_TT4_4_VW4_WG16_16_1_WGM1
    SolutionIndex: 8
    SolutionNameMin: Cijk_Alik_Bljk_HB_GB_MT32x32x8_SN_GRVW4_LRVW4_TT4_4_VW4_WG8_8_1_WGM8
    SolutionIndex: 9
    SolutionNameMin: Cijk_Alik_Bljk_HB_GB_MT64x64x8_SN_GRVW4_LRVW4_TT4_4_VW4_WG16_16_1_WGM8
    SolutionIndex: 10
    SolutionNameMin: Cijk_Alik_Bljk_HB_GB_MT32x32x16_SN_GRVW4_LRVW4_TT4_4_VW4_WG8_8_1_WGM8
    SolutionIndex: 11
    SolutionNameMin: Cijk_Alik_Bljk_HB_GB_MT64x64x16_SN_GRVW4_LRVW4_TT4_4_VW4_WG16_16_1_WGM8
    SolutionIndex: 12
    SolutionNameMin: Cijk_Alik_Bljk_HB_GB_MT64x128x16_SN_GRVW4_LRVW4_TT4_8_VW4_WG16_16_1_WGM8
    SolutionIndex: 13
    SolutionNameMin: Cijk_Alik_Bljk_HB_GB_MT128x128x16_SN_GRVW8_LRVW8_TT8_8_VW8_WG16_16_1_WGM8
- - - [32, 32, 8, 32, 32, 32, 32, 32]
    - [8, 93.0]
  - - [32, 32, 8, 64, 32, 32, 64, 64]
    - [0, 151.0]
  - - [32, 32, 8, 128, 32, 32, 128, 128]
    - [0, 209.0]
  - - [32, 32, 8, 256, 32, 32, 256, 256]
    - [10, 262.0]
  - - [32, 32, 8, 512, 32, 32, 512, 512]
    - [2, 308.0]
  - - [32, 64, 8, 32, 32, 32, 32, 32]
    - [0, 202.0]
  - - [32, 64, 8, 64, 32, 32, 64, 64]
    - [0, 320.0]
  - - [32, 64, 8, 128, 32, 32, 128, 128]
    - [0, 435.0]
  - - [32, 64, 8, 256, 32, 32, 256, 256]
    - [10, 544.0]
  - - [32, 64, 8, 512, 32, 32, 512, 512]
    - [10, 627.0]
  - - [32, 128, 8, 32, 32, 32, 32, 32]
    - [0, 423.0]
  - - [32, 128, 8, 64, 32, 32, 64, 64]
    - [0, 649.0]
  - - [32, 128, 8, 128, 32, 32, 128, 128]
    - [10, 883.0]
  - - [32, 128, 8, 256, 32, 32, 256, 256]
    - [2, 1110.0]
  - - [32, 128, 8, 512, 32, 32, 512, 512]
    - [2, 1258.0]
  - - [32, 256, 8, 32, 32, 32, 32, 32]
    - [2, 851.0]
  - - [32, 256, 8, 64, 32, 32, 64, 64]
    - [2, 1285.0]
  - - [32, 256, 8, 128, 32, 32, 128, 128]
    - [2, 1780.0]
  - - [32, 256, 8, 256, 32, 32, 256, 256]
    - [2, 2205.0]
  - - [32, 256, 8, 512, 32, 32, 512, 512]
    - [10, 2441.0]
  - - [32, 512, 8, 32, 32, 32, 32, 32]
    - [0, 1644.0]
  - - [32, 512, 8, 64, 32, 32, 64, 64]
    - [0, 2497.0]
  - - [32, 512, 8, 128, 32, 32, 128, 128]
    - [2, 3444.0]
  - - [32, 512, 8, 256, 32, 32, 256, 256]
    - [10, 4153.0]
  - - [32, 512, 8, 512, 32, 32, 512, 512]
    - [6, 4609.0]
  - - [64, 32, 8, 32, 64, 64, 32, 32]
    - [0, 207.0]
  - - [64, 32, 8, 64, 64, 64, 64, 64]
    - [0, 317.0]
  - - [64, 32, 8, 128, 64, 64, 128, 128]
    - [2, 434.0]
  - - [64, 32, 8, 256, 64, 64, 256, 256]
    - [10, 546.0]
  - - [64, 32, 8, 512, 64, 64, 512, 512]
    - [10, 628.0]
  - - [64, 64, 8, 32, 64, 64, 32, 32]
    - [0, 423.0]
  - - [64, 64, 8, 64, 64, 64, 64, 64]
    - [0, 647.0]
  - - [64, 64, 8, 128, 64, 64, 128, 128]
    - [0, 886.0]
  - - [64, 64, 8, 256, 64, 64, 256, 256]
    - [2, 1110.0]
  - - [64, 64, 8, 512, 64, 64, 512, 512]
    - [10, 1266.0]
  - - [64, 128, 8, 32, 64, 64, 32, 32]
    - [2, 827.0]
  - - [64, 128, 8, 64, 64, 64, 64, 64]
    - [0, 1288.0]
  - - [64, 128, 8, 128, 64, 64, 128, 128]
    - [2, 1786.0]
  - - [64, 128, 8, 256, 64, 64, 256, 256]
    - [2, 2208.0]
  - - [64, 128, 8, 512, 64, 64, 512, 512]
    - [2, 2516.0]
  - - [64, 256, 8, 32, 64, 64, 32, 32]
    - [0, 1628.0]
  - - [64, 256, 8, 64, 64, 64, 64, 64]
    - [2, 2497.0]
  - - [64, 256, 8, 128, 64, 64, 128, 128]
    - [2, 3484.0]
  - - [64, 256, 8, 256, 64, 64, 256, 256]
    - [10, 4315.0]
  - - [64, 256, 8, 512, 64, 64, 512, 512]
    - [2, 4860.0]
  - - [64, 512, 8, 32, 64, 64, 32, 32]
    - [0, 3048.0]
  - - [64, 512, 8, 64, 64, 64, 64, 64]
    - [9, 4569.0]
  - - [64, 512, 8, 128, 64, 64, 128, 128]
    - [11, 6270.0]
  - - [64, 512, 8, 256, 64, 64, 256, 256]
    - [11, 7457.0]
  - - [64, 512, 8, 512, 64, 64, 512, 512]
    - [7, 7540.0]
  - - [128, 32, 8, 32, 128, 128, 32, 32]
    - [2, 417.0]
  - - [128, 32, 8, 64, 128, 128, 64, 64]
    - [0, 646.0]
  - - [128, 32, 8, 128, 128, 128, 128, 128]
    - [2, 889.0]
  - - [128, 32, 8, 256, 128, 128, 256, 256]
    - [10, 1112.0]
  - - [128, 32, 8, 512, 128, 128, 512, 512]
    - [10, 1272.0]
  - - [128, 64, 8, 32, 128, 128, 32, 32]
    - [0, 832.0]
  - - [128, 64, 8, 64, 128, 128, 64, 64]
    - [0, 1285.0]
  - - [128, 64, 8, 128, 128, 128, 128, 128]
    - [2, 1768.0]
  - - [128, 64, 8, 256, 128, 128, 256, 256]
    - [2, 2215.0]
  - - [128, 64, 8, 512, 128, 128, 512, 512]
    - [10, 2533.0]
  - - [128, 128, 8, 32, 128, 128, 32, 32]
    - [0, 1594.0]
  - - [128, 128, 8, 64, 128, 128, 64, 64]
    - [0, 2485.0]
  - - [128, 128, 8, 128, 128, 128, 128, 128]
    - [10, 3432.0]
  - - [128, 128, 8, 256, 128, 128, 256, 256]
    - [2, 4320.0]
  - - [128, 128, 8, 512, 128, 128, 512, 512]
    - [10, 4937.0]
  - - [128, 256, 8, 32, 128, 128, 32, 32]
    - [1, 2929.0]
  - - [128, 256, 8, 64, 128, 128, 64, 64]
    - [2, 4559.0]
  - - [128, 256, 8, 128, 128, 128, 128, 128]
    - [10, 6317.0]
  - - [128, 256, 8, 256, 128, 128, 256, 256]
    - [11, 7796.0]
  - - [128, 256, 8, 512, 128, 128, 512, 512]
    - [2, 8675.0]
  - - [128, 512, 8, 32, 128, 128, 32, 32]
    - [1, 5217.0]
  - - [128, 512, 8, 64, 128, 128, 64, 64]
    - [3, 7724.0]
  - - [128, 512, 8, 128, 128, 128, 128, 128]
    - [3, 10280.0]
  - - [128, 512, 8, 256, 128, 128, 256, 256]
    - [3, 12202.0]
  - - [128, 512, 8, 512, 128, 128, 512, 512]
    - [3, 11732.0]
  - - [256, 32, 8, 32, 256, 256, 32, 32]
    - [0, 840.0]
  - - [256, 32, 8, 64, 256, 256, 64, 64]
    - [0, 1279.0]
  - - [256, 32, 8, 128, 256, 256, 128, 128]
    - [2, 1783.0]
  - - [256, 32, 8, 256, 256, 256, 256, 256]
    - [2, 2224.0]
  - - [256, 32, 8, 512, 256, 256, 512, 512]
    - [10, 2525.0]
  - - [256, 64, 8, 32, 256, 256, 32, 32]
    - [0, 1598.0]
  - - [256, 64, 8, 64, 256, 256, 64, 64]
    - [8, 2450.0]
  - - [256, 64, 8, 128, 256, 256, 128, 128]
    - [2, 3416.0]
  - - [256, 64, 8, 256, 256, 256, 256, 256]
    - [10, 4342.0]
  - - [256, 64, 8, 512, 256, 256, 512, 512]
    - [10, 4906.0]
  - - [256, 128, 8, 32, 256, 256, 32, 32]
    - [0, 2897.0]
  - - [256, 128, 8, 64, 256, 256, 64, 64]
    - [2, 4539.0]
  - - [256, 128, 8, 128, 256, 256, 128, 128]
    - [10, 6298.0]
  - - [256, 128, 8, 256, 256, 256, 256, 256]
    - [2, 7774.0]
  - - [256, 128, 8, 512, 256, 256, 512, 512]
    - [3, 8688.0]
  - - [256, 256, 8, 32, 256, 256, 32, 32]
    - [3, 5204.0]
  - - [256, 256, 8, 64, 256, 256, 64, 64]
    - [3, 7640.0]
  - - [256, 256, 8, 128, 256, 256, 128, 128]
    - [3, 10395.0]
  - - [256, 256, 8, 256, 256, 256, 256, 256]
    - [3, 12300.0]
  - - [256, 256, 8, 512, 256, 256, 512, 512]
    - [3, 13729.0]
  - - [256, 512, 8, 32, 256, 256, 32, 32]
    - [3, 8020.0]
  - - [256, 512, 8, 64, 256, 256, 64, 64]
    - [3, 10824.0]
  - - [256, 512, 8, 128, 256, 256, 128, 128]
    - [11, 13016.0]
  - - [256, 512, 8, 256, 256, 256, 256, 256]
    - [5, 15420.0]
  - - [256, 512, 8, 512, 256, 256, 512, 512]
    - [5, 16896.0]
  - - [512, 32, 8, 32, 512, 512, 32, 32]
    - [0, 1618.0]
  - - [512, 32, 8, 64, 512, 512, 64, 64]
    - [8, 2439.0]
  - - [512, 32, 8, 128, 512, 512, 128, 128]
    - [2, 3416.0]
  - - [512, 32, 8, 256, 512, 512, 256, 256]
    - [2, 4203.0]
  - - [512, 32, 8, 512, 512, 512, 512, 512]
    - [10, 4866.0]
  - - [512, 64, 8, 32, 512, 512, 32, 32]
    - [8, 2970.0]
  - - [512, 64, 8, 64, 512, 512, 64, 64]
    - [10, 4434.0]
  - - [512, 64, 8, 128, 512, 512, 128, 128]
    - [10, 6260.0]
  - - [512, 64, 8, 256, 512, 512, 256, 256]
    - [11, 7557.0]
  - - [512, 64, 8, 512, 512, 512, 512, 512]
    - [11, 8648.0]
  - - [512, 128, 8, 32, 512, 512, 32, 32]
    - [11, 4888.0]
  - - [512, 128, 8, 64, 512, 512, 64, 64]
    - [3, 7424.0]
  - - [512, 128, 8, 128, 512, 512, 128, 128]
    - [3, 10143.0]
  - - [512, 128, 8, 256, 512, 512, 256, 256]
    - [3, 12122.0]
  - - [512, 128, 8, 512, 512, 512, 512, 512]
    - [3, 13596.0]
  - - [512, 256, 8, 32, 512, 512, 32, 32]
    - [11, 7884.0]
  - - [512, 256, 8, 64, 512, 512, 64, 64]
    - [11, 10632.0]
  - - [512, 256, 8, 128, 512, 512, 128, 128]
    - [11, 12915.0]
  - - [512, 256, 8, 256, 512, 512, 256, 256]
    - [4, 15183.0]
  - - [512, 256, 8, 512, 512, 512, 512, 512]
    - [4, 16857.0]
  - - [512, 512, 8, 32, 512, 512, 32, 32]
    - [12, 10512.0]
  - - [512, 512, 8, 64, 512, 512, 64, 64]
    - [12, 14099.0]
  - - [512, 512, 8, 128, 512, 512, 128, 128]
    - [4, 16870.0]
  - - [512, 512, 8, 256, 512, 512, 256, 256]
    - [13, 19022.0]
  - - [512, 512, 8, 512, 512, 512, 512, 512]
    - [4, 19952.0]
- null
