library/src/blas3/Tensile/Logic/asm_full/vega20/vega20_Cijk_Alik_Bjlk_ZB_GB.yaml
- {MinimumRequiredVersion: 4.26.0}
- vega20
- gfx906
- [Device 66a0, Device 66a1, Device 66a7, Device 66af, Vega 20]
    SolutionIndex: 0
    SolutionNameMin: Cijk_Alik_Bjlk_ZB_GB_MT32x32x8_SN_WG8_8_1_WGM1
    SolutionIndex: 1
    SolutionNameMin: Cijk_Alik_Bjlk_ZB_GB_MT64x64x8_SN_WG16_16_1_WGM1
    SolutionIndex: 2
    SolutionNameMin: Cijk_Alik_Bjlk_ZB_GB_MT32x32x8_SN_WG8_8_1_WGM8
    SolutionIndex: 3
    SolutionNameMin: Cijk_Alik_Bjlk_ZB_GB_MT64x64x8_SN_WG16_16_1_WGM8
- - - [32, 32, 8, 32, 32, 32, 32, 32]
    - [0, 29.0]
  - - [32, 32, 8, 64, 32, 32, 64, 32]
    - [0, 36.0]
  - - [32, 32, 8, 128, 32, 32, 128, 32]
    - [0, 41.0]
  - - [32, 32, 8, 256, 32, 32, 256, 32]
    - [0, 44.0]
  - - [32, 32, 8, 512, 32, 32, 512, 32]
    - [0, 44.0]
  - - [32, 64, 8, 32, 32, 32, 32, 64]
    - [0, 62.0]
  - - [32, 64, 8, 64, 32, 32, 64, 64]
    - [0, 75.0]
  - - [32, 64, 8, 128, 32, 32, 128, 64]
    - [0, 84.0]
  - - [32, 64, 8, 256, 32, 32, 256, 64]
    - [0, 88.0]
  - - [32, 64, 8, 512, 32, 32, 512, 64]
    - [0, 90.0]
  - - [32, 128, 8, 32, 32, 32, 32, 128]
    - [0, 126.0]
  - - [32, 128, 8, 64, 32, 32, 64, 128]
    - [0, 151.0]
  - - [32, 128, 8, 128, 32, 32, 128, 128]
    - [0, 167.0]
  - - [32, 128, 8, 256, 32, 32, 256, 128]
    - [0, 175.0]
  - - [32, 128, 8, 512, 32, 32, 512, 128]
    - [0, 182.0]
  - - [32, 256, 8, 32, 32, 32, 32, 256]
    - [0, 245.0]
  - - [32, 256, 8, 64, 32, 32, 64, 256]
    - [0, 296.0]
  - - [32, 256, 8, 128, 32, 32, 128, 256]
    - [0, 327.0]
  - - [32, 256, 8, 256, 32, 32, 256, 256]
    - [0, 344.0]
  - - [32, 256, 8, 512, 32, 32, 512, 256]
    - [0, 363.0]
  - - [32, 512, 8, 32, 32, 32, 32, 512]
    - [0, 457.0]
  - - [32, 512, 8, 64, 32, 32, 64, 512]
    - [0, 553.0]
  - - [32, 512, 8, 128, 32, 32, 128, 512]
    - [0, 619.0]
  - - [32, 512, 8, 256, 32, 32, 256, 512]
    - [1, 633.0]
  - - [32, 512, 8, 512, 32, 32, 512, 512]
    - [1, 671.0]
  - - [64, 32, 8, 32, 64, 64, 32, 32]
    - [0, 62.0]
  - - [64, 32, 8, 64, 64, 64, 64, 32]
    - [0, 76.0]
  - - [64, 32, 8, 128, 64, 64, 128, 32]
    - [0, 84.0]
  - - [64, 32, 8, 256, 64, 64, 256, 32]
    - [0, 88.0]
  - - [64, 32, 8, 512, 64, 64, 512, 32]
    - [0, 90.0]
  - - [64, 64, 8, 32, 64, 64, 32, 64]
    - [0, 126.0]
  - - [64, 64, 8, 64, 64, 64, 64, 64]
    - [0, 151.0]
  - - [64, 64, 8, 128, 64, 64, 128, 64]
    - [0, 168.0]
  - - [64, 64, 8, 256, 64, 64, 256, 64]
    - [0, 176.0]
  - - [64, 64, 8, 512, 64, 64, 512, 64]
    - [0, 182.0]
  - - [64, 128, 8, 32, 64, 64, 32, 128]
    - [0, 248.0]
  - - [64, 128, 8, 64, 64, 64, 64, 128]
    - [0, 299.0]
  - - [64, 128, 8, 128, 64, 64, 128, 128]
    - [0, 332.0]
  - - [64, 128, 8, 256, 64, 64, 256, 128]
    - [0, 353.0]
  - - [64, 128, 8, 512, 64, 64, 512, 128]
    - [0, 367.0]
  - - [64, 256, 8, 32, 64, 64, 32, 256]
    - [0, 459.0]
  - - [64, 256, 8, 64, 64, 64, 64, 256]
    - [0, 557.0]
  - - [64, 256, 8, 128, 64, 64, 128, 256]
    - [0, 632.0]
  - - [64, 256, 8, 256, 64, 64, 256, 256]
    - [0, 670.0]
  - - [64, 256, 8, 512, 64, 64, 512, 256]
    - [0, 707.0]
  - - [64, 512, 8, 32, 64, 64, 32, 512]
    - [2, 777.0]
  - - [64, 512, 8, 64, 64, 64, 64, 512]
    - [0, 1025.0]
  - - [64, 512, 8, 128, 64, 64, 128, 512]
    - [1, 1108.0]
  - - [64, 512, 8, 256, 64, 64, 256, 512]
    - [3, 1023.0]
  - - [64, 512, 8, 512, 64, 64, 512, 512]
    - [3, 1133.0]
  - - [128, 32, 8, 32, 128, 128, 32, 32]
    - [0, 127.0]
  - - [128, 32, 8, 64, 128, 128, 64, 32]
    - [0, 153.0]
  - - [128, 32, 8, 128, 128, 128, 128, 32]
    - [0, 167.0]
  - - [128, 32, 8, 256, 128, 128, 256, 32]
    - [0, 175.0]
  - - [128, 32, 8, 512, 128, 128, 512, 32]
    - [0, 182.0]
  - - [128, 64, 8, 32, 128, 128, 32, 64]
    - [0, 247.0]
  - - [128, 64, 8, 64, 128, 128, 64, 64]
    - [0, 298.0]
  - - [128, 64, 8, 128, 128, 128, 128, 64]
    - [0, 332.0]
  - - [128, 64, 8, 256, 128, 128, 256, 64]
    - [0, 354.0]
  - - [128, 64, 8, 512, 128, 128, 512, 64]
    - [0, 366.0]
  - - [128, 128, 8, 32, 128, 128, 32, 128]
    - [0, 451.0]
  - - [128, 128, 8, 64, 128, 128, 64, 128]
    - [0, 561.0]
  - - [128, 128, 8, 128, 128, 128, 128, 128]
    - [0, 639.0]
  - - [128, 128, 8, 256, 128, 128, 256, 128]
    - [0, 687.0]
  - - [128, 128, 8, 512, 128, 128, 512, 128]
    - [0, 717.0]
  - - [128, 256, 8, 32, 128, 128, 32, 256]
    - [1, 774.0]
  - - [128, 256, 8, 64, 128, 128, 64, 256]
    - [0, 1014.0]
  - - [128, 256, 8, 128, 128, 128, 128, 256]
    - [0, 1186.0]
  - - [128, 256, 8, 256, 128, 128, 256, 256]
    - [1, 1196.0]
  - - [128, 256, 8, 512, 128, 128, 512, 256]
    - [0, 1287.0]
  - - [128, 512, 8, 32, 128, 128, 32, 512]
    - [0, 903.0]
  - - [128, 512, 8, 64, 128, 128, 64, 512]
    - [0, 1077.0]
  - - [128, 512, 8, 128, 128, 128, 128, 512]
    - [2, 1229.0]
  - - [128, 512, 8, 256, 128, 128, 256, 512]
    - [1, 1280.0]
  - - [128, 512, 8, 512, 128, 128, 512, 512]
    - [1, 1344.0]
  - - [256, 32, 8, 32, 256, 256, 32, 32]
    - [0, 243.0]
  - - [256, 32, 8, 64, 256, 256, 64, 32]
    - [0, 295.0]
  - - [256, 32, 8, 128, 256, 256, 128, 32]
    - [0, 330.0]
  - - [256, 32, 8, 256, 256, 256, 256, 32]
    - [0, 352.0]
  - - [256, 32, 8, 512, 256, 256, 512, 32]
    - [0, 365.0]
  - - [256, 64, 8, 32, 256, 256, 32, 64]
    - [1, 438.0]
  - - [256, 64, 8, 64, 256, 256, 64, 64]
    - [0, 550.0]
  - - [256, 64, 8, 128, 256, 256, 128, 64]
    - [0, 635.0]
  - - [256, 64, 8, 256, 256, 256, 256, 64]
    - [0, 688.0]
  - - [256, 64, 8, 512, 256, 256, 512, 64]
    - [0, 723.0]
  - - [256, 128, 8, 32, 256, 256, 32, 128]
    - [1, 784.0]
  - - [256, 128, 8, 64, 256, 256, 64, 128]
    - [1, 990.0]
  - - [256, 128, 8, 128, 256, 256, 128, 128]
    - [1, 1155.0]
  - - [256, 128, 8, 256, 256, 256, 256, 128]
    - [2, 1281.0]
  - - [256, 128, 8, 512, 256, 256, 512, 128]
    - [2, 1365.0]
  - - [256, 256, 8, 32, 256, 256, 32, 256]
    - [0, 871.0]
  - - [256, 256, 8, 64, 256, 256, 64, 256]
    - [0, 1089.0]
  - - [256, 256, 8, 128, 256, 256, 128, 256]
    - [2, 1228.0]
  - - [256, 256, 8, 256, 256, 256, 256, 256]
    - [2, 1331.0]
  - - [256, 256, 8, 512, 256, 256, 512, 256]
    - [0, 1355.0]
  - - [256, 512, 8, 32, 256, 256, 32, 512]
    - [0, 957.0]
  - - [256, 512, 8, 64, 256, 256, 64, 512]
    - [0, 1155.0]
  - - [256, 512, 8, 128, 256, 256, 128, 512]
    - [2, 1276.0]
  - - [256, 512, 8, 256, 256, 256, 256, 512]
    - [0, 1358.0]
  - - [256, 512, 8, 512, 256, 256, 512, 512]
    - [0, 1364.0]
  - - [512, 32, 8, 32, 512, 512, 32, 32]
    - [0, 432.0]
  - - [512, 32, 8, 64, 512, 512, 64, 32]
    - [0, 546.0]
  - - [512, 32, 8, 128, 512, 512, 128, 32]
    - [0, 634.0]
  - - [512, 32, 8, 256, 512, 512, 256, 32]
    - [0, 687.0]
  - - [512, 32, 8, 512, 512, 512, 512, 32]
    - [0, 720.0]
  - - [512, 64, 8, 32, 512, 512, 32, 64]
    - [3, 765.0]
  - - [512, 64, 8, 64, 512, 512, 64, 64]
    - [0, 987.0]
  - - [512, 64, 8, 128, 512, 512, 128, 64]
    - [0, 1170.0]
  - - [512, 64, 8, 256, 512, 512, 256, 64]
    - [0, 1284.0]
  - - [512, 64, 8, 512, 512, 512, 512, 64]
    - [0, 1363.0]
  - - [512, 128, 8, 32, 512, 512, 32, 128]
    - [1, 873.0]
  - - [512, 128, 8, 64, 512, 512, 64, 128]
    - [0, 1091.0]
  - - [512, 128, 8, 128, 512, 512, 128, 128]
    - [0, 1246.0]
  - - [512, 128, 8, 256, 512, 512, 256, 128]
    - [2, 1321.0]
  - - [512, 128, 8, 512, 512, 512, 512, 128]
    - [0, 1364.0]
  - - [512, 256, 8, 32, 512, 512, 32, 256]
    - [0, 948.0]
  - - [512, 256, 8, 64, 512, 512, 64, 256]
    - [0, 1155.0]
  - - [512, 256, 8, 128, 512, 512, 128, 256]
    - [0, 1286.0]
  - - [512, 256, 8, 256, 512, 512, 256, 256]
    - [0, 1341.0]
  - - [512, 256, 8, 512, 512, 512, 512, 256]
    - [0, 1362.0]
  - - [512, 512, 8, 32, 512, 512, 32, 512]
    - [0, 1010.0]
  - - [512, 512, 8, 64, 512, 512, 64, 512]
    - [0, 1197.0]
  - - [512, 512, 8, 128, 512, 512, 128, 512]
    - [0, 1296.0]
  - - [512, 512, 8, 256, 512, 512, 256, 512]
    - [0, 1333.0]
  - - [512, 512, 8, 512, 512, 512, 512, 512]
    - [0, 1353.0]
- null
