library/src/blas3/Tensile/Logic/asm_full/vega20/vega20_Cijk_Ailk_Bljk_ZB_GB.yaml
- {MinimumRequiredVersion: 4.26.0}
- vega20
- gfx906
- [Device 66a0, Device 66a1, Device 66a7, Device 66af, Vega 20]
    SolutionIndex: 0
    SolutionNameMin: Cijk_Ailk_Bljk_ZB_GB_MT32x32x8_SN_WG8_8_1_WGM1
    SolutionIndex: 1
    SolutionNameMin: Cijk_Ailk_Bljk_ZB_GB_MT64x64x8_SN_WG16_16_1_WGM1
    SolutionIndex: 2
    SolutionNameMin: Cijk_Ailk_Bljk_ZB_GB_MT32x32x8_SN_WG8_8_1_WGM8
    SolutionIndex: 3
    SolutionNameMin: Cijk_Ailk_Bljk_ZB_GB_MT64x64x8_SN_WG16_16_1_WGM8
- - - [32, 32, 8, 32, 32, 32, 32, 32]
    - [0, 29.0]
  - - [32, 32, 8, 64, 32, 32, 32, 64]
    - [0, 36.0]
  - - [32, 32, 8, 128, 32, 32, 32, 128]
    - [0, 42.0]
  - - [32, 32, 8, 256, 32, 32, 32, 256]
    - [0, 44.0]
  - - [32, 32, 8, 512, 32, 32, 32, 512]
    - [0, 45.0]
  - - [32, 64, 8, 32, 32, 32, 32, 32]
    - [0, 62.0]
  - - [32, 64, 8, 64, 32, 32, 32, 64]
    - [0, 76.0]
  - - [32, 64, 8, 128, 32, 32, 32, 128]
    - [0, 84.0]
  - - [32, 64, 8, 256, 32, 32, 32, 256]
    - [0, 88.0]
  - - [32, 64, 8, 512, 32, 32, 32, 512]
    - [0, 90.0]
  - - [32, 128, 8, 32, 32, 32, 32, 32]
    - [0, 126.0]
  - - [32, 128, 8, 64, 32, 32, 32, 64]
    - [0, 152.0]
  - - [32, 128, 8, 128, 32, 32, 32, 128]
    - [0, 168.0]
  - - [32, 128, 8, 256, 32, 32, 32, 256]
    - [0, 171.0]
  - - [32, 128, 8, 512, 32, 32, 32, 512]
    - [0, 169.0]
  - - [32, 256, 8, 32, 32, 32, 32, 32]
    - [0, 248.0]
  - - [32, 256, 8, 64, 32, 32, 32, 64]
    - [0, 297.0]
  - - [32, 256, 8, 128, 32, 32, 32, 128]
    - [0, 309.0]
  - - [32, 256, 8, 256, 32, 32, 32, 256]
    - [0, 276.0]
  - - [32, 256, 8, 512, 32, 32, 32, 512]
    - [0, 288.0]
  - - [32, 512, 8, 32, 32, 32, 32, 32]
    - [0, 452.0]
  - - [32, 512, 8, 64, 32, 32, 32, 64]
    - [0, 481.0]
  - - [32, 512, 8, 128, 32, 32, 32, 128]
    - [1, 389.0]
  - - [32, 512, 8, 256, 32, 32, 32, 256]
    - [1, 428.0]
  - - [32, 512, 8, 512, 32, 32, 32, 512]
    - [1, 395.0]
  - - [64, 32, 8, 32, 64, 64, 64, 32]
    - [0, 63.0]
  - - [64, 32, 8, 64, 64, 64, 64, 64]
    - [0, 76.0]
  - - [64, 32, 8, 128, 64, 64, 64, 128]
    - [0, 85.0]
  - - [64, 32, 8, 256, 64, 64, 64, 256]
    - [0, 89.0]
  - - [64, 32, 8, 512, 64, 64, 64, 512]
    - [0, 91.0]
  - - [64, 64, 8, 32, 64, 64, 64, 32]
    - [0, 127.0]
  - - [64, 64, 8, 64, 64, 64, 64, 64]
    - [0, 153.0]
  - - [64, 64, 8, 128, 64, 64, 64, 128]
    - [0, 169.0]
  - - [64, 64, 8, 256, 64, 64, 64, 256]
    - [0, 177.0]
  - - [64, 64, 8, 512, 64, 64, 64, 512]
    - [0, 181.0]
  - - [64, 128, 8, 32, 64, 64, 64, 32]
    - [0, 248.0]
  - - [64, 128, 8, 64, 64, 64, 64, 64]
    - [0, 300.0]
  - - [64, 128, 8, 128, 64, 64, 64, 128]
    - [0, 331.0]
  - - [64, 128, 8, 256, 64, 64, 64, 256]
    - [0, 338.0]
  - - [64, 128, 8, 512, 64, 64, 64, 512]
    - [2, 332.0]
  - - [64, 256, 8, 32, 64, 64, 64, 32]
    - [0, 465.0]
  - - [64, 256, 8, 64, 64, 64, 64, 64]
    - [0, 559.0]
  - - [64, 256, 8, 128, 64, 64, 64, 128]
    - [0, 556.0]
  - - [64, 256, 8, 256, 64, 64, 64, 256]
    - [1, 516.0]
  - - [64, 256, 8, 512, 64, 64, 64, 512]
    - [1, 555.0]
  - - [64, 512, 8, 32, 64, 64, 64, 32]
    - [0, 784.0]
  - - [64, 512, 8, 64, 64, 64, 64, 64]
    - [0, 871.0]
  - - [64, 512, 8, 128, 64, 64, 64, 128]
    - [1, 756.0]
  - - [64, 512, 8, 256, 64, 64, 64, 256]
    - [1, 844.0]
  - - [64, 512, 8, 512, 64, 64, 64, 512]
    - [1, 794.0]
  - - [128, 32, 8, 32, 128, 128, 128, 32]
    - [0, 127.0]
  - - [128, 32, 8, 64, 128, 128, 128, 64]
    - [0, 152.0]
  - - [128, 32, 8, 128, 128, 128, 128, 128]
    - [0, 168.0]
  - - [128, 32, 8, 256, 128, 128, 128, 256]
    - [0, 177.0]
  - - [128, 32, 8, 512, 128, 128, 128, 512]
    - [0, 183.0]
  - - [128, 64, 8, 32, 128, 128, 128, 32]
    - [0, 247.0]
  - - [128, 64, 8, 64, 128, 128, 128, 64]
    - [0, 300.0]
  - - [128, 64, 8, 128, 128, 128, 128, 128]
    - [0, 335.0]
  - - [128, 64, 8, 256, 128, 128, 128, 256]
    - [0, 353.0]
  - - [128, 64, 8, 512, 128, 128, 128, 512]
    - [0, 361.0]
  - - [128, 128, 8, 32, 128, 128, 128, 32]
    - [0, 456.0]
  - - [128, 128, 8, 64, 128, 128, 128, 64]
    - [0, 569.0]
  - - [128, 128, 8, 128, 128, 128, 128, 128]
    - [0, 642.0]
  - - [128, 128, 8, 256, 128, 128, 128, 256]
    - [0, 660.0]
  - - [128, 128, 8, 512, 128, 128, 128, 512]
    - [1, 621.0]
  - - [128, 256, 8, 32, 128, 128, 128, 32]
    - [0, 805.0]
  - - [128, 256, 8, 64, 128, 128, 128, 64]
    - [0, 998.0]
  - - [128, 256, 8, 128, 128, 128, 128, 128]
    - [0, 1048.0]
  - - [128, 256, 8, 256, 128, 128, 128, 256]
    - [1, 1025.0]
  - - [128, 256, 8, 512, 128, 128, 128, 512]
    - [3, 1018.0]
  - - [128, 512, 8, 32, 128, 128, 128, 32]
    - [0, 906.0]
  - - [128, 512, 8, 64, 128, 128, 128, 64]
    - [0, 1065.0]
  - - [128, 512, 8, 128, 128, 128, 128, 128]
    - [0, 1134.0]
  - - [128, 512, 8, 256, 128, 128, 128, 256]
    - [3, 1097.0]
  - - [128, 512, 8, 512, 128, 128, 128, 512]
    - [3, 1157.0]
  - - [256, 32, 8, 32, 256, 256, 256, 32]
    - [0, 241.0]
  - - [256, 32, 8, 64, 256, 256, 256, 64]
    - [0, 295.0]
  - - [256, 32, 8, 128, 256, 256, 256, 128]
    - [0, 331.0]
  - - [256, 32, 8, 256, 256, 256, 256, 256]
    - [0, 354.0]
  - - [256, 32, 8, 512, 256, 256, 256, 512]
    - [0, 369.0]
  - - [256, 64, 8, 32, 256, 256, 256, 32]
    - [0, 439.0]
  - - [256, 64, 8, 64, 256, 256, 256, 64]
    - [0, 551.0]
  - - [256, 64, 8, 128, 256, 256, 256, 128]
    - [0, 637.0]
  - - [256, 64, 8, 256, 256, 256, 256, 256]
    - [0, 691.0]
  - - [256, 64, 8, 512, 256, 256, 256, 512]
    - [0, 717.0]
  - - [256, 128, 8, 32, 256, 256, 256, 32]
    - [1, 783.0]
  - - [256, 128, 8, 64, 256, 256, 256, 64]
    - [1, 992.0]
  - - [256, 128, 8, 128, 256, 256, 256, 128]
    - [0, 1159.0]
  - - [256, 128, 8, 256, 256, 256, 256, 256]
    - [1, 1210.0]
  - - [256, 128, 8, 512, 256, 256, 256, 512]
    - [1, 1214.0]
  - - [256, 256, 8, 32, 256, 256, 256, 32]
    - [0, 872.0]
  - - [256, 256, 8, 64, 256, 256, 256, 64]
    - [0, 1088.0]
  - - [256, 256, 8, 128, 256, 256, 256, 128]
    - [2, 1224.0]
  - - [256, 256, 8, 256, 256, 256, 256, 256]
    - [1, 1260.0]
  - - [256, 256, 8, 512, 256, 256, 256, 512]
    - [1, 1253.0]
  - - [256, 512, 8, 32, 256, 256, 256, 32]
    - [0, 956.0]
  - - [256, 512, 8, 64, 256, 256, 256, 64]
    - [0, 1151.0]
  - - [256, 512, 8, 128, 256, 256, 256, 128]
    - [0, 1267.0]
  - - [256, 512, 8, 256, 256, 256, 256, 256]
    - [0, 1285.0]
  - - [256, 512, 8, 512, 256, 256, 256, 512]
    - [1, 1267.0]
  - - [512, 32, 8, 32, 512, 512, 512, 32]
    - [0, 431.0]
  - - [512, 32, 8, 64, 512, 512, 512, 64]
    - [0, 551.0]
  - - [512, 32, 8, 128, 512, 512, 512, 128]
    - [0, 638.0]
  - - [512, 32, 8, 256, 512, 512, 512, 256]
    - [0, 693.0]
  - - [512, 32, 8, 512, 512, 512, 512, 512]
    - [0, 728.0]
  - - [512, 64, 8, 32, 512, 512, 512, 32]
    - [3, 768.0]
  - - [512, 64, 8, 64, 512, 512, 512, 64]
    - [1, 991.0]
  - - [512, 64, 8, 128, 512, 512, 512, 128]
    - [0, 1167.0]
  - - [512, 64, 8, 256, 512, 512, 512, 256]
    - [2, 1285.0]
  - - [512, 64, 8, 512, 512, 512, 512, 512]
    - [2, 1336.0]
  - - [512, 128, 8, 32, 512, 512, 512, 32]
    - [0, 871.0]
  - - [512, 128, 8, 64, 512, 512, 512, 64]
    - [0, 1093.0]
  - - [512, 128, 8, 128, 512, 512, 512, 128]
    - [0, 1241.0]
  - - [512, 128, 8, 256, 512, 512, 512, 256]
    - [2, 1297.0]
  - - [512, 128, 8, 512, 512, 512, 512, 512]
    - [1, 1323.0]
  - - [512, 256, 8, 32, 512, 512, 512, 32]
    - [0, 951.0]
  - - [512, 256, 8, 64, 512, 512, 512, 64]
    - [0, 1157.0]
  - - [512, 256, 8, 128, 512, 512, 512, 128]
    - [0, 1285.0]
  - - [512, 256, 8, 256, 512, 512, 512, 256]
    - [0, 1324.0]
  - - [512, 256, 8, 512, 512, 512, 512, 512]
    - [0, 1350.0]
  - - [512, 512, 8, 32, 512, 512, 512, 32]
    - [0, 1022.0]
  - - [512, 512, 8, 64, 512, 512, 512, 64]
    - [0, 1184.0]
  - - [512, 512, 8, 128, 512, 512, 512, 128]
    - [0, 1293.0]
  - - [512, 512, 8, 256, 512, 512, 512, 256]
    - [0, 1333.0]
  - - [512, 512, 8, 512, 512, 512, 512, 512]
    - [0, 1343.0]
- null
