library/src/blas3/Tensile/Logic/asm_full/vega20/vega20_Cijk_Alik_Bljk_SB_GB.yaml
- {MinimumRequiredVersion: 4.26.0}
- vega20
- gfx906
- [Device 66a0, Device 66a1, Device 66a7, Device 66af, Vega 20]
    SolutionIndex: 0
    SolutionNameMin: Cijk_Alik_Bljk_SB_GB_MT32x32x8_SN_AMAS3_GRVW4_LRVW4_TT4_4_VW4_WG8_8_1_WGM1
    SolutionIndex: 1
    SolutionNameMin: Cijk_Alik_Bljk_SB_GB_MT128x64x8_SN_AMAS3_GRVW4_LRVW4_TT8_4_VW4_WG16_16_1_WGM1
    SolutionIndex: 2
    SolutionNameMin: Cijk_Alik_Bljk_SB_GB_MT128x128x8_SN_AMAS3_GRVW4_LRVW4_TT8_8_VW4_WG16_16_1_WGM1
    SolutionIndex: 3
    SolutionNameMin: Cijk_Alik_Bljk_SB_GB_MT32x32x16_SN_AMAS3_GRVW4_LRVW4_TT4_4_VW4_WG8_8_1_WGM1
    SolutionIndex: 4
    SolutionNameMin: Cijk_Alik_Bljk_SB_GB_MT32x64x16_SN_AMAS3_GRVW4_LRVW4_TT4_8_VW4_WG8_8_1_WGM1
    SolutionIndex: 5
    SolutionNameMin: Cijk_Alik_Bljk_SB_GB_MT64x64x16_SN_AMAS3_GRVW4_LRVW4_TT4_4_VW4_WG16_16_1_WGM1
    SolutionIndex: 6
    SolutionNameMin: Cijk_Alik_Bljk_SB_GB_MT128x64x16_SN_AMAS3_GRVW4_LRVW4_TT8_4_VW4_WG16_16_1_WGM1
    SolutionIndex: 7
    SolutionNameMin: Cijk_Alik_Bljk_SB_GB_MT64x128x16_SN_AMAS3_GRVW4_LRVW4_TT4_8_VW4_WG16_16_1_WGM1
    SolutionIndex: 8
    SolutionNameMin: Cijk_Alik_Bljk_SB_GB_MT128x128x16_SN_AMAS3_GRVW4_LRVW4_TT8_8_VW4_WG16_16_1_WGM1
    SolutionIndex: 9
    SolutionNameMin: Cijk_Alik_Bljk_SB_GB_MT32x32x32_SN_AMAS3_GRVW4_LRVW4_TT4_4_VW4_WG8_8_1_WGM1
    SolutionIndex: 10
    SolutionNameMin: Cijk_Alik_Bljk_SB_GB_MT64x64x32_SN_AMAS3_GRVW4_LRVW4_TT4_4_VW4_WG16_16_1_WGM1
    SolutionIndex: 11
    SolutionNameMin: Cijk_Alik_Bljk_SB_GB_MT64x128x32_SN_AMAS3_GRVW4_LRVW4_TT4_8_VW4_WG16_16_1_WGM1
    SolutionIndex: 12
    SolutionNameMin: Cijk_Alik_Bljk_SB_GB_MT32x32x8_SN_AMAS3_GRVW4_LRVW4_TT4_4_VW4_WG8_8_1_WGM8
    SolutionIndex: 13
    SolutionNameMin: Cijk_Alik_Bljk_SB_GB_MT32x32x16_SN_AMAS3_GRVW4_LRVW4_TT4_4_VW4_WG8_8_1_WGM8
    SolutionIndex: 14
    SolutionNameMin: Cijk_Alik_Bljk_SB_GB_MT64x64x16_SN_AMAS3_GRVW4_LRVW4_TT4_4_VW4_WG16_16_1_WGM8
    SolutionIndex: 15
    SolutionNameMin: Cijk_Alik_Bljk_SB_GB_MT64x128x16_SN_AMAS3_GRVW4_LRVW4_TT4_8_VW4_WG16_16_1_WGM8
    SolutionIndex: 16
    SolutionNameMin: Cijk_Alik_Bljk_SB_GB_MT128x128x16_SN_AMAS3_GRVW4_LRVW4_TT8_8_VW4_WG16_16_1_WGM8
- - - [32, 32, 8, 32, 32, 32, 32, 32]
    - [12, 92.0]
  - - [32, 32, 8, 64, 32, 32, 64, 64]
    - [0, 137.0]
  - - [32, 32, 8, 128, 32, 32, 128, 128]
    - [13, 182.0]
  - - [32, 32, 8, 256, 32, 32, 256, 256]
    - [13, 219.0]
  - - [32, 32, 8, 512, 32, 32, 512, 512]
    - [13, 246.0]
  - - [32, 64, 8, 32, 32, 32, 32, 32]
    - [0, 192.0]
  - - [32, 64, 8, 64, 32, 32, 64, 64]
    - [12, 282.0]
  - - [32, 64, 8, 128, 32, 32, 128, 128]
    - [3, 370.0]
  - - [32, 64, 8, 256, 32, 32, 256, 256]
    - [13, 444.0]
  - - [32, 64, 8, 512, 32, 32, 512, 512]
    - [13, 493.0]
  - - [32, 128, 8, 32, 32, 32, 32, 32]
    - [0, 389.0]
  - - [32, 128, 8, 64, 32, 32, 64, 64]
    - [0, 563.0]
  - - [32, 128, 8, 128, 32, 32, 128, 128]
    - [13, 746.0]
  - - [32, 128, 8, 256, 32, 32, 256, 256]
    - [3, 886.0]
  - - [32, 128, 8, 512, 32, 32, 512, 512]
    - [13, 977.0]
  - - [32, 256, 8, 32, 32, 32, 32, 32]
    - [3, 762.0]
  - - [32, 256, 8, 64, 32, 32, 64, 64]
    - [0, 1106.0]
  - - [32, 256, 8, 128, 32, 32, 128, 128]
    - [13, 1454.0]
  - - [32, 256, 8, 256, 32, 32, 256, 256]
    - [3, 1722.0]
  - - [32, 256, 8, 512, 32, 32, 512, 512]
    - [9, 1565.0]
  - - [32, 512, 8, 32, 32, 32, 32, 32]
    - [0, 1436.0]
  - - [32, 512, 8, 64, 32, 32, 64, 64]
    - [0, 2158.0]
  - - [32, 512, 8, 128, 32, 32, 128, 128]
    - [13, 2781.0]
  - - [32, 512, 8, 256, 32, 32, 256, 256]
    - [3, 2630.0]
  - - [32, 512, 8, 512, 32, 32, 512, 512]
    - [10, 2114.0]
  - - [64, 32, 8, 32, 64, 64, 32, 32]
    - [0, 191.0]
  - - [64, 32, 8, 64, 64, 64, 64, 64]
    - [12, 281.0]
  - - [64, 32, 8, 128, 64, 64, 128, 128]
    - [13, 371.0]
  - - [64, 32, 8, 256, 64, 64, 256, 256]
    - [13, 445.0]
  - - [64, 32, 8, 512, 64, 64, 512, 512]
    - [13, 495.0]
  - - [64, 64, 8, 32, 64, 64, 32, 32]
    - [0, 390.0]
  - - [64, 64, 8, 64, 64, 64, 64, 64]
    - [3, 564.0]
  - - [64, 64, 8, 128, 64, 64, 128, 128]
    - [13, 753.0]
  - - [64, 64, 8, 256, 64, 64, 256, 256]
    - [13, 894.0]
  - - [64, 64, 8, 512, 64, 64, 512, 512]
    - [13, 991.0]
  - - [64, 128, 8, 32, 64, 64, 32, 32]
    - [3, 753.0]
  - - [64, 128, 8, 64, 64, 64, 64, 64]
    - [0, 1108.0]
  - - [64, 128, 8, 128, 64, 64, 128, 128]
    - [3, 1469.0]
  - - [64, 128, 8, 256, 64, 64, 256, 256]
    - [3, 1759.0]
  - - [64, 128, 8, 512, 64, 64, 512, 512]
    - [3, 1930.0]
  - - [64, 256, 8, 32, 64, 64, 32, 32]
    - [0, 1452.0]
  - - [64, 256, 8, 64, 64, 64, 64, 64]
    - [0, 2158.0]
  - - [64, 256, 8, 128, 64, 64, 128, 128]
    - [3, 2881.0]
  - - [64, 256, 8, 256, 64, 64, 256, 256]
    - [3, 3393.0]
  - - [64, 256, 8, 512, 64, 64, 512, 512]
    - [9, 2873.0]
  - - [64, 512, 8, 32, 64, 64, 32, 32]
    - [13, 2628.0]
  - - [64, 512, 8, 64, 64, 64, 64, 64]
    - [3, 3841.0]
  - - [64, 512, 8, 128, 64, 64, 128, 128]
    - [13, 4952.0]
  - - [64, 512, 8, 256, 64, 64, 256, 256]
    - [10, 4313.0]
  - - [64, 512, 8, 512, 64, 64, 512, 512]
    - [10, 3717.0]
  - - [128, 32, 8, 32, 128, 128, 32, 32]
    - [0, 390.0]
  - - [128, 32, 8, 64, 128, 128, 64, 64]
    - [0, 561.0]
  - - [128, 32, 8, 128, 128, 128, 128, 128]
    - [3, 746.0]
  - - [128, 32, 8, 256, 128, 128, 256, 256]
    - [13, 899.0]
  - - [128, 32, 8, 512, 128, 128, 512, 512]
    - [13, 985.0]
  - - [128, 64, 8, 32, 128, 128, 32, 32]
    - [0, 745.0]
  - - [128, 64, 8, 64, 128, 128, 64, 64]
    - [0, 1097.0]
  - - [128, 64, 8, 128, 128, 128, 128, 128]
    - [3, 1467.0]
  - - [128, 64, 8, 256, 128, 128, 256, 256]
    - [3, 1768.0]
  - - [128, 64, 8, 512, 128, 128, 512, 512]
    - [9, 1946.0]
  - - [128, 128, 8, 32, 128, 128, 32, 32]
    - [0, 1440.0]
  - - [128, 128, 8, 64, 128, 128, 64, 64]
    - [0, 2123.0]
  - - [128, 128, 8, 128, 128, 128, 128, 128]
    - [3, 2846.0]
  - - [128, 128, 8, 256, 128, 128, 256, 256]
    - [3, 3464.0]
  - - [128, 128, 8, 512, 128, 128, 512, 512]
    - [3, 3820.0]
  - - [128, 256, 8, 32, 128, 128, 32, 32]
    - [13, 2615.0]
  - - [128, 256, 8, 64, 128, 128, 64, 64]
    - [3, 3876.0]
  - - [128, 256, 8, 128, 128, 128, 128, 128]
    - [3, 5134.0]
  - - [128, 256, 8, 256, 128, 128, 256, 256]
    - [3, 6052.0]
  - - [128, 256, 8, 512, 128, 128, 512, 512]
    - [10, 4849.0]
  - - [128, 512, 8, 32, 128, 128, 32, 32]
    - [5, 3841.0]
  - - [128, 512, 8, 64, 128, 128, 64, 64]
    - [5, 5548.0]
  - - [128, 512, 8, 128, 128, 128, 128, 128]
    - [5, 7188.0]
  - - [128, 512, 8, 256, 128, 128, 256, 256]
    - [4, 7378.0]
  - - [128, 512, 8, 512, 128, 128, 512, 512]
    - [11, 5574.0]
  - - [256, 32, 8, 32, 256, 256, 32, 32]
    - [0, 734.0]
  - - [256, 32, 8, 64, 256, 256, 64, 64]
    - [0, 1090.0]
  - - [256, 32, 8, 128, 256, 256, 128, 128]
    - [3, 1458.0]
  - - [256, 32, 8, 256, 256, 256, 256, 256]
    - [13, 1758.0]
  - - [256, 32, 8, 512, 256, 256, 512, 512]
    - [13, 1954.0]
  - - [256, 64, 8, 32, 256, 256, 32, 32]
    - [13, 1372.0]
  - - [256, 64, 8, 64, 256, 256, 64, 64]
    - [12, 2081.0]
  - - [256, 64, 8, 128, 256, 256, 128, 128]
    - [13, 2815.0]
  - - [256, 64, 8, 256, 256, 256, 256, 256]
    - [3, 3393.0]
  - - [256, 64, 8, 512, 256, 256, 512, 512]
    - [3, 3825.0]
  - - [256, 128, 8, 32, 256, 256, 32, 32]
    - [13, 2539.0]
  - - [256, 128, 8, 64, 256, 256, 64, 64]
    - [13, 3848.0]
  - - [256, 128, 8, 128, 256, 256, 128, 128]
    - [13, 5121.0]
  - - [256, 128, 8, 256, 256, 256, 256, 256]
    - [3, 6066.0]
  - - [256, 128, 8, 512, 256, 256, 512, 512]
    - [10, 6155.0]
  - - [256, 256, 8, 32, 256, 256, 32, 32]
    - [5, 3920.0]
  - - [256, 256, 8, 64, 256, 256, 64, 64]
    - [5, 5638.0]
  - - [256, 256, 8, 128, 256, 256, 128, 128]
    - [5, 7257.0]
  - - [256, 256, 8, 256, 256, 256, 256, 256]
    - [5, 8604.0]
  - - [256, 256, 8, 512, 256, 256, 512, 512]
    - [4, 7717.0]
  - - [256, 512, 8, 32, 256, 256, 32, 32]
    - [5, 5653.0]
  - - [256, 512, 8, 64, 256, 256, 64, 64]
    - [7, 7450.0]
  - - [256, 512, 8, 128, 256, 256, 128, 128]
    - [7, 9357.0]
  - - [256, 512, 8, 256, 256, 256, 256, 256]
    - [7, 10496.0]
  - - [256, 512, 8, 512, 256, 256, 512, 512]
    - [15, 7850.0]
  - - [512, 32, 8, 32, 512, 512, 32, 32]
    - [0, 1402.0]
  - - [512, 32, 8, 64, 512, 512, 64, 64]
    - [0, 2093.0]
  - - [512, 32, 8, 128, 512, 512, 128, 128]
    - [3, 2792.0]
  - - [512, 32, 8, 256, 512, 512, 256, 256]
    - [13, 3383.0]
  - - [512, 32, 8, 512, 512, 512, 512, 512]
    - [13, 3848.0]
  - - [512, 64, 8, 32, 512, 512, 32, 32]
    - [3, 2485.0]
  - - [512, 64, 8, 64, 512, 512, 64, 64]
    - [3, 3758.0]
  - - [512, 64, 8, 128, 512, 512, 128, 128]
    - [13, 4987.0]
  - - [512, 64, 8, 256, 512, 512, 256, 256]
    - [14, 6009.0]
  - - [512, 64, 8, 512, 512, 512, 512, 512]
    - [5, 6834.0]
  - - [512, 128, 8, 32, 512, 512, 32, 32]
    - [13, 3792.0]
  - - [512, 128, 8, 64, 512, 512, 64, 64]
    - [5, 5476.0]
  - - [512, 128, 8, 128, 512, 512, 128, 128]
    - [5, 7307.0]
  - - [512, 128, 8, 256, 512, 512, 256, 256]
    - [5, 8613.0]
  - - [512, 128, 8, 512, 512, 512, 512, 512]
    - [5, 9326.0]
  - - [512, 256, 8, 32, 512, 512, 32, 32]
    - [5, 5269.0]
  - - [512, 256, 8, 64, 512, 512, 64, 64]
    - [6, 7314.0]
  - - [512, 256, 8, 128, 512, 512, 128, 128]
    - [6, 9290.0]
  - - [512, 256, 8, 256, 512, 512, 256, 256]
    - [1, 10817.0]
  - - [512, 256, 8, 512, 512, 512, 512, 512]
    - [7, 11296.0]
  - - [512, 512, 8, 32, 512, 512, 32, 32]
    - [14, 6483.0]
  - - [512, 512, 8, 64, 512, 512, 64, 64]
    - [14, 8635.0]
  - - [512, 512, 8, 128, 512, 512, 128, 128]
    - [16, 10137.0]
  - - [512, 512, 8, 256, 512, 512, 256, 256]
    - [2, 11619.0]
  - - [512, 512, 8, 512, 512, 512, 512, 512]
    - [8, 11920.0]
- null
