library/src/blas3/Tensile/Logic/asm_full/vega20/vega20_Cijk_Ailk_Bljk_CB_GB.yaml
- {MinimumRequiredVersion: 4.26.0}
- vega20
- gfx906
- [Device 66a0, Device 66a1, Device 66a7, Device 66af, Vega 20]
    SolutionIndex: 0
    SolutionNameMin: Cijk_Ailk_Bljk_CB_GB_MT32x32x8_SN_AMAS3_GRVW2_LRVW2_TT4_4_VW2_WG8_8_1_WGM1
    SolutionIndex: 1
    SolutionNameMin: Cijk_Ailk_Bljk_CB_GB_MT64x64x8_SN_AMAS3_GRVW2_LRVW2_TT4_4_VW2_WG16_16_1_WGM1
    SolutionIndex: 2
    SolutionNameMin: Cijk_Ailk_Bljk_CB_GB_MT32x32x16_SN_AMAS3_GRVW2_LRVW2_TT4_4_VW2_WG8_8_1_WGM1
    SolutionIndex: 3
    SolutionNameMin: Cijk_Ailk_Bljk_CB_GB_MT64x64x16_SN_AMAS3_GRVW2_LRVW2_TT4_4_VW2_WG16_16_1_WGM1
    SolutionIndex: 4
    SolutionNameMin: Cijk_Ailk_Bljk_CB_GB_MT64x64x8_SN_AMAS0_GRVW1_LRVW1_TT4_4_VW1_WG16_16_1_WGM1
    SolutionIndex: 5
    SolutionNameMin: Cijk_Ailk_Bljk_CB_GB_MT32x32x8_SN_AMAS3_GRVW2_LRVW2_TT4_4_VW2_WG8_8_1_WGM8
    SolutionIndex: 6
    SolutionNameMin: Cijk_Ailk_Bljk_CB_GB_MT64x64x16_SN_AMAS3_GRVW2_LRVW2_TT4_4_VW2_WG16_16_1_WGM8
    SolutionIndex: 7
    SolutionNameMin: Cijk_Ailk_Bljk_CB_GB_MT32x32x8_SN_AMAS0_GRVW1_LRVW1_TT4_4_VW1_WG8_8_1_WGM8
    SolutionIndex: 8
    SolutionNameMin: Cijk_Ailk_Bljk_CB_GB_MT64x64x8_SN_AMAS0_GRVW1_LRVW1_TT4_4_VW1_WG16_16_1_WGM8
- - - [32, 32, 8, 32, 32, 32, 32, 32]
    - [0, 44.0]
  - - [32, 32, 8, 64, 32, 32, 32, 64]
    - [0, 61.0]
  - - [32, 32, 8, 128, 32, 32, 32, 128]
    - [0, 73.0]
  - - [32, 32, 8, 256, 32, 32, 32, 256]
    - [0, 82.0]
  - - [32, 32, 8, 512, 32, 32, 32, 512]
    - [0, 87.0]
  - - [32, 64, 8, 32, 32, 32, 32, 32]
    - [0, 97.0]
  - - [32, 64, 8, 64, 32, 32, 32, 64]
    - [0, 127.0]
  - - [32, 64, 8, 128, 32, 32, 32, 128]
    - [0, 151.0]
  - - [32, 64, 8, 256, 32, 32, 32, 256]
    - [5, 167.0]
  - - [32, 64, 8, 512, 32, 32, 32, 512]
    - [5, 174.0]
  - - [32, 128, 8, 32, 32, 32, 32, 32]
    - [5, 200.0]
  - - [32, 128, 8, 64, 32, 32, 32, 64]
    - [0, 260.0]
  - - [32, 128, 8, 128, 32, 32, 32, 128]
    - [0, 305.0]
  - - [32, 128, 8, 256, 32, 32, 32, 256]
    - [5, 332.0]
  - - [32, 128, 8, 512, 32, 32, 32, 512]
    - [5, 343.0]
  - - [32, 256, 8, 32, 32, 32, 32, 32]
    - [0, 396.0]
  - - [32, 256, 8, 64, 32, 32, 32, 64]
    - [0, 514.0]
  - - [32, 256, 8, 128, 32, 32, 32, 128]
    - [0, 599.0]
  - - [32, 256, 8, 256, 32, 32, 32, 256]
    - [5, 641.0]
  - - [32, 256, 8, 512, 32, 32, 32, 512]
    - [2, 570.0]
  - - [32, 512, 8, 32, 32, 32, 32, 32]
    - [0, 757.0]
  - - [32, 512, 8, 64, 32, 32, 32, 64]
    - [0, 981.0]
  - - [32, 512, 8, 128, 32, 32, 32, 128]
    - [5, 1072.0]
  - - [32, 512, 8, 256, 32, 32, 32, 256]
    - [3, 901.0]
  - - [32, 512, 8, 512, 32, 32, 32, 512]
    - [6, 892.0]
  - - [64, 32, 8, 32, 64, 64, 64, 32]
    - [0, 96.0]
  - - [64, 32, 8, 64, 64, 64, 64, 64]
    - [0, 128.0]
  - - [64, 32, 8, 128, 64, 64, 64, 128]
    - [0, 151.0]
  - - [64, 32, 8, 256, 64, 64, 64, 256]
    - [0, 167.0]
  - - [64, 32, 8, 512, 64, 64, 64, 512]
    - [0, 174.0]
  - - [64, 64, 8, 32, 64, 64, 64, 32]
    - [0, 199.0]
  - - [64, 64, 8, 64, 64, 64, 64, 64]
    - [0, 260.0]
  - - [64, 64, 8, 128, 64, 64, 64, 128]
    - [0, 307.0]
  - - [64, 64, 8, 256, 64, 64, 64, 256]
    - [0, 334.0]
  - - [64, 64, 8, 512, 64, 64, 64, 512]
    - [5, 349.0]
  - - [64, 128, 8, 32, 64, 64, 64, 32]
    - [0, 392.0]
  - - [64, 128, 8, 64, 64, 64, 64, 64]
    - [0, 517.0]
  - - [64, 128, 8, 128, 64, 64, 64, 128]
    - [0, 609.0]
  - - [64, 128, 8, 256, 64, 64, 64, 256]
    - [0, 662.0]
  - - [64, 128, 8, 512, 64, 64, 64, 512]
    - [0, 672.0]
  - - [64, 256, 8, 32, 64, 64, 64, 32]
    - [0, 753.0]
  - - [64, 256, 8, 64, 64, 64, 64, 64]
    - [0, 1004.0]
  - - [64, 256, 8, 128, 64, 64, 64, 128]
    - [5, 1182.0]
  - - [64, 256, 8, 256, 64, 64, 64, 256]
    - [0, 1205.0]
  - - [64, 256, 8, 512, 64, 64, 64, 512]
    - [6, 1050.0]
  - - [64, 512, 8, 32, 64, 64, 64, 32]
    - [0, 1353.0]
  - - [64, 512, 8, 64, 64, 64, 64, 64]
    - [0, 1814.0]
  - - [64, 512, 8, 128, 64, 64, 64, 128]
    - [0, 1869.0]
  - - [64, 512, 8, 256, 64, 64, 64, 256]
    - [6, 1684.0]
  - - [64, 512, 8, 512, 64, 64, 64, 512]
    - [6, 1784.0]
  - - [128, 32, 8, 32, 128, 128, 128, 32]
    - [0, 200.0]
  - - [128, 32, 8, 64, 128, 128, 128, 64]
    - [0, 260.0]
  - - [128, 32, 8, 128, 128, 128, 128, 128]
    - [5, 306.0]
  - - [128, 32, 8, 256, 128, 128, 128, 256]
    - [0, 334.0]
  - - [128, 32, 8, 512, 128, 128, 128, 512]
    - [0, 348.0]
  - - [128, 64, 8, 32, 128, 128, 128, 32]
    - [0, 394.0]
  - - [128, 64, 8, 64, 128, 128, 128, 64]
    - [0, 517.0]
  - - [128, 64, 8, 128, 128, 128, 128, 128]
    - [0, 610.0]
  - - [128, 64, 8, 256, 128, 128, 128, 256]
    - [0, 666.0]
  - - [128, 64, 8, 512, 128, 128, 128, 512]
    - [0, 698.0]
  - - [128, 128, 8, 32, 128, 128, 128, 32]
    - [0, 755.0]
  - - [128, 128, 8, 64, 128, 128, 128, 64]
    - [0, 1001.0]
  - - [128, 128, 8, 128, 128, 128, 128, 128]
    - [0, 1182.0]
  - - [128, 128, 8, 256, 128, 128, 128, 256]
    - [0, 1312.0]
  - - [128, 128, 8, 512, 128, 128, 128, 512]
    - [2, 1324.0]
  - - [128, 256, 8, 32, 128, 128, 128, 32]
    - [0, 1378.0]
  - - [128, 256, 8, 64, 128, 128, 128, 64]
    - [5, 1843.0]
  - - [128, 256, 8, 128, 128, 128, 128, 128]
    - [0, 2224.0]
  - - [128, 256, 8, 256, 128, 128, 128, 256]
    - [2, 2194.0]
  - - [128, 256, 8, 512, 128, 128, 128, 512]
    - [3, 2139.0]
  - - [128, 512, 8, 32, 128, 128, 128, 32]
    - [4, 1907.0]
  - - [128, 512, 8, 64, 128, 128, 128, 64]
    - [4, 2453.0]
  - - [128, 512, 8, 128, 128, 128, 128, 128]
    - [4, 2797.0]
  - - [128, 512, 8, 256, 128, 128, 128, 256]
    - [3, 2619.0]
  - - [128, 512, 8, 512, 128, 128, 128, 512]
    - [3, 2238.0]
  - - [256, 32, 8, 32, 256, 256, 256, 32]
    - [0, 387.0]
  - - [256, 32, 8, 64, 256, 256, 256, 64]
    - [0, 508.0]
  - - [256, 32, 8, 128, 256, 256, 256, 128]
    - [0, 599.0]
  - - [256, 32, 8, 256, 256, 256, 256, 256]
    - [0, 659.0]
  - - [256, 32, 8, 512, 256, 256, 256, 512]
    - [2, 699.0]
  - - [256, 64, 8, 32, 256, 256, 256, 32]
    - [0, 720.0]
  - - [256, 64, 8, 64, 256, 256, 256, 64]
    - [0, 971.0]
  - - [256, 64, 8, 128, 256, 256, 256, 128]
    - [0, 1168.0]
  - - [256, 64, 8, 256, 256, 256, 256, 256]
    - [0, 1301.0]
  - - [256, 64, 8, 512, 256, 256, 256, 512]
    - [5, 1388.0]
  - - [256, 128, 8, 32, 256, 256, 256, 32]
    - [4, 1304.0]
  - - [256, 128, 8, 64, 256, 256, 256, 64]
    - [1, 1748.0]
  - - [256, 128, 8, 128, 256, 256, 256, 128]
    - [0, 2169.0]
  - - [256, 128, 8, 256, 256, 256, 256, 256]
    - [5, 2460.0]
  - - [256, 128, 8, 512, 256, 256, 256, 512]
    - [3, 2473.0]
  - - [256, 256, 8, 32, 256, 256, 256, 32]
    - [4, 1907.0]
  - - [256, 256, 8, 64, 256, 256, 256, 64]
    - [4, 2456.0]
  - - [256, 256, 8, 128, 256, 256, 256, 128]
    - [4, 2856.0]
  - - [256, 256, 8, 256, 256, 256, 256, 256]
    - [4, 3120.0]
  - - [256, 256, 8, 512, 256, 256, 256, 512]
    - [3, 3069.0]
  - - [256, 512, 8, 32, 256, 256, 256, 32]
    - [4, 2235.0]
  - - [256, 512, 8, 64, 256, 256, 256, 64]
    - [1, 2757.0]
  - - [256, 512, 8, 128, 256, 256, 256, 128]
    - [1, 3072.0]
  - - [256, 512, 8, 256, 256, 256, 256, 256]
    - [1, 3236.0]
  - - [256, 512, 8, 512, 256, 256, 256, 512]
    - [3, 3106.0]
  - - [512, 32, 8, 32, 512, 512, 512, 32]
    - [0, 655.0]
  - - [512, 32, 8, 64, 512, 512, 512, 64]
    - [5, 900.0]
  - - [512, 32, 8, 128, 512, 512, 512, 128]
    - [0, 1113.0]
  - - [512, 32, 8, 256, 512, 512, 512, 256]
    - [0, 1271.0]
  - - [512, 32, 8, 512, 512, 512, 512, 512]
    - [5, 1373.0]
  - - [512, 64, 8, 32, 512, 512, 512, 32]
    - [5, 1250.0]
  - - [512, 64, 8, 64, 512, 512, 512, 64]
    - [5, 1736.0]
  - - [512, 64, 8, 128, 512, 512, 512, 128]
    - [5, 2148.0]
  - - [512, 64, 8, 256, 512, 512, 512, 256]
    - [5, 2465.0]
  - - [512, 64, 8, 512, 512, 512, 512, 512]
    - [6, 2572.0]
  - - [512, 128, 8, 32, 512, 512, 512, 32]
    - [1, 1740.0]
  - - [512, 128, 8, 64, 512, 512, 512, 64]
    - [1, 2321.0]
  - - [512, 128, 8, 128, 512, 512, 512, 128]
    - [4, 2786.0]
  - - [512, 128, 8, 256, 512, 512, 512, 256]
    - [8, 3098.0]
  - - [512, 128, 8, 512, 512, 512, 512, 512]
    - [1, 3270.0]
  - - [512, 256, 8, 32, 512, 512, 512, 32]
    - [1, 2141.0]
  - - [512, 256, 8, 64, 512, 512, 512, 64]
    - [1, 2673.0]
  - - [512, 256, 8, 128, 512, 512, 512, 128]
    - [1, 3052.0]
  - - [512, 256, 8, 256, 512, 512, 512, 256]
    - [1, 3235.0]
  - - [512, 256, 8, 512, 512, 512, 512, 512]
    - [7, 3252.0]
  - - [512, 512, 8, 32, 512, 512, 512, 32]
    - [4, 2483.0]
  - - [512, 512, 8, 64, 512, 512, 512, 64]
    - [1, 2993.0]
  - - [512, 512, 8, 128, 512, 512, 512, 128]
    - [1, 3279.0]
  - - [512, 512, 8, 256, 512, 512, 512, 256]
    - [1, 3311.0]
  - - [512, 512, 8, 512, 512, 512, 512, 512]
    - [3, 3242.0]
- null
