library/src/blas3/Tensile/Logic/asm_full/vega10/vega10_Cijk_Ailk_Bljk_HB_GB.yaml
- {MinimumRequiredVersion: 4.26.0}
- vega10
- gfx900
- [Device 6863, Device 6862, Device 687f, Device 6860, Device 6861, 'Vega 10 XTX [Radeon
    SolutionIndex: 0
    SolutionNameMin: Cijk_Ailk_Bljk_HB_GB_MT32x32x8_SN_GRVW4_LRVW4_TT4_4_VW4_WG8_8_1_WGM1
    SolutionIndex: 1
    SolutionNameMin: Cijk_Ailk_Bljk_HB_GB_MT64x64x8_SN_GRVW4_LRVW4_TT4_4_VW4_WG16_16_1_WGM1
    SolutionIndex: 2
    SolutionNameMin: Cijk_Ailk_Bljk_HB_GB_MT128x64x8_SN_GRVW4_LRVW4_TT8_4_VW4_WG16_16_1_WGM1
    SolutionIndex: 3
    SolutionNameMin: Cijk_Ailk_Bljk_HB_GB_MT32x32x16_SN_GRVW4_LRVW4_TT4_4_VW4_WG8_8_1_WGM1
    SolutionIndex: 4
    SolutionNameMin: Cijk_Ailk_Bljk_HB_GB_MT64x64x16_SN_GRVW4_LRVW4_TT4_4_VW4_WG16_16_1_WGM1
    SolutionIndex: 5
    SolutionNameMin: Cijk_Ailk_Bljk_HB_GB_MT128x64x16_SN_GRVW4_LRVW4_TT8_4_VW4_WG16_16_1_WGM1
    SolutionIndex: 6
    SolutionNameMin: Cijk_Ailk_Bljk_HB_GB_MT64x64x32_SN_GRVW4_LRVW4_TT4_4_VW4_WG16_16_1_WGM1
    SolutionIndex: 7
    SolutionNameMin: Cijk_Ailk_Bljk_HB_GB_MT128x64x8_SN_GRVW2_LRVW2_TT8_4_VW2_WG16_16_1_WGM1
    SolutionIndex: 8
    SolutionNameMin: Cijk_Ailk_Bljk_HB_GB_MT32x32x8_SN_GRVW4_LRVW4_TT4_4_VW4_WG8_8_1_WGM8
    SolutionIndex: 9
    SolutionNameMin: Cijk_Ailk_Bljk_HB_GB_MT64x64x8_SN_GRVW4_LRVW4_TT4_4_VW4_WG16_16_1_WGM8
    SolutionIndex: 10
    SolutionNameMin: Cijk_Ailk_Bljk_HB_GB_MT32x32x16_SN_GRVW4_LRVW4_TT4_4_VW4_WG8_8_1_WGM8
    SolutionIndex: 11
    SolutionNameMin: Cijk_Ailk_Bljk_HB_GB_MT64x64x16_SN_GRVW4_LRVW4_TT4_4_VW4_WG16_16_1_WGM8
    SolutionIndex: 12
    SolutionNameMin: Cijk_Ailk_Bljk_HB_GB_MT128x64x16_SN_GRVW4_LRVW4_TT8_4_VW4_WG16_16_1_WGM8
    SolutionIndex: 13
    SolutionNameMin: Cijk_Ailk_Bljk_HB_GB_MT128x128x16_SN_GRVW8_LRVW8_TT8_8_VW8_WG16_16_1_WGM8
    SolutionIndex: 14
    SolutionNameMin: Cijk_Ailk_Bljk_HB_GB_MT32x32x32_SN_GRVW4_LRVW4_TT4_4_VW4_WG8_8_1_WGM8
    SolutionIndex: 15
    SolutionNameMin: Cijk_Ailk_Bljk_HB_GB_MT64x128x32_SN_GRVW4_LRVW4_TT4_8_VW4_WG16_16_1_WGM8
    SolutionIndex: 16
    SolutionNameMin: Cijk_Ailk_Bljk_HB_GB_MT64x64x8_SN_GRVW2_LRVW2_TT4_4_VW2_WG16_16_1_WGM8
- - - [32, 32, 8, 32, 32, 32, 32, 32]
    - [0, 73.0]
  - - [32, 32, 8, 64, 32, 32, 32, 64]
    - [0, 119.0]
  - - [32, 32, 8, 128, 32, 32, 32, 128]
    - [0, 165.0]
  - - [32, 32, 8, 256, 32, 32, 32, 256]
    - [3, 217.0]
  - - [32, 32, 8, 512, 32, 32, 32, 512]
    - [3, 260.0]
  - - [32, 64, 8, 32, 32, 32, 32, 32]
    - [0, 162.0]
  - - [32, 64, 8, 64, 32, 32, 32, 64]
    - [8, 248.0]
  - - [32, 64, 8, 128, 32, 32, 32, 128]
    - [3, 347.0]
  - - [32, 64, 8, 256, 32, 32, 32, 256]
    - [10, 452.0]
  - - [32, 64, 8, 512, 32, 32, 32, 512]
    - [10, 526.0]
  - - [32, 128, 8, 32, 32, 32, 32, 32]
    - [0, 322.0]
  - - [32, 128, 8, 64, 32, 32, 32, 64]
    - [0, 504.0]
  - - [32, 128, 8, 128, 32, 32, 32, 128]
    - [8, 696.0]
  - - [32, 128, 8, 256, 32, 32, 32, 256]
    - [10, 908.0]
  - - [32, 128, 8, 512, 32, 32, 32, 512]
    - [10, 1057.0]
  - - [32, 256, 8, 32, 32, 32, 32, 32]
    - [0, 639.0]
  - - [32, 256, 8, 64, 32, 32, 32, 64]
    - [0, 983.0]
  - - [32, 256, 8, 128, 32, 32, 32, 128]
    - [3, 1395.0]
  - - [32, 256, 8, 256, 32, 32, 32, 256]
    - [3, 1660.0]
  - - [32, 256, 8, 512, 32, 32, 32, 512]
    - [3, 1847.0]
  - - [32, 512, 8, 32, 32, 32, 32, 32]
    - [0, 1189.0]
  - - [32, 512, 8, 64, 32, 32, 32, 64]
    - [0, 1792.0]
  - - [32, 512, 8, 128, 32, 32, 32, 128]
    - [3, 2359.0]
  - - [32, 512, 8, 256, 32, 32, 32, 256]
    - [10, 2640.0]
  - - [32, 512, 8, 512, 32, 32, 32, 512]
    - [14, 2521.0]
  - - [64, 32, 8, 32, 64, 64, 64, 32]
    - [0, 158.0]
  - - [64, 32, 8, 64, 64, 64, 64, 64]
    - [8, 248.0]
  - - [64, 32, 8, 128, 64, 64, 64, 128]
    - [3, 351.0]
  - - [64, 32, 8, 256, 64, 64, 64, 256]
    - [10, 453.0]
  - - [64, 32, 8, 512, 64, 64, 64, 512]
    - [3, 527.0]
  - - [64, 64, 8, 32, 64, 64, 64, 32]
    - [0, 322.0]
  - - [64, 64, 8, 64, 64, 64, 64, 64]
    - [8, 505.0]
  - - [64, 64, 8, 128, 64, 64, 64, 128]
    - [10, 709.0]
  - - [64, 64, 8, 256, 64, 64, 64, 256]
    - [10, 916.0]
  - - [64, 64, 8, 512, 64, 64, 64, 512]
    - [10, 1063.0]
  - - [64, 128, 8, 32, 64, 64, 64, 32]
    - [0, 641.0]
  - - [64, 128, 8, 64, 64, 64, 64, 64]
    - [0, 1002.0]
  - - [64, 128, 8, 128, 64, 64, 64, 128]
    - [3, 1398.0]
  - - [64, 128, 8, 256, 64, 64, 64, 256]
    - [4, 1712.0]
  - - [64, 128, 8, 512, 64, 64, 64, 512]
    - [11, 1973.0]
  - - [64, 256, 8, 32, 64, 64, 64, 32]
    - [1, 1267.0]
  - - [64, 256, 8, 64, 64, 64, 64, 64]
    - [1, 1936.0]
  - - [64, 256, 8, 128, 64, 64, 64, 128]
    - [11, 2606.0]
  - - [64, 256, 8, 256, 64, 64, 64, 256]
    - [11, 3059.0]
  - - [64, 256, 8, 512, 64, 64, 64, 512]
    - [6, 3297.0]
  - - [64, 512, 8, 32, 64, 64, 64, 32]
    - [1, 2345.0]
  - - [64, 512, 8, 64, 64, 64, 64, 64]
    - [1, 3365.0]
  - - [64, 512, 8, 128, 64, 64, 64, 128]
    - [1, 4163.0]
  - - [64, 512, 8, 256, 64, 64, 64, 256]
    - [6, 4097.0]
  - - [64, 512, 8, 512, 64, 64, 64, 512]
    - [15, 4059.0]
  - - [128, 32, 8, 32, 128, 128, 128, 32]
    - [3, 321.0]
  - - [128, 32, 8, 64, 128, 128, 128, 64]
    - [8, 507.0]
  - - [128, 32, 8, 128, 128, 128, 128, 128]
    - [3, 710.0]
  - - [128, 32, 8, 256, 128, 128, 128, 256]
    - [10, 912.0]
  - - [128, 32, 8, 512, 128, 128, 128, 512]
    - [10, 1065.0]
  - - [128, 64, 8, 32, 128, 128, 128, 32]
    - [0, 636.0]
  - - [128, 64, 8, 64, 128, 128, 128, 64]
    - [8, 1002.0]
  - - [128, 64, 8, 128, 128, 128, 128, 128]
    - [10, 1395.0]
  - - [128, 64, 8, 256, 128, 128, 128, 256]
    - [11, 1715.0]
  - - [128, 64, 8, 512, 128, 128, 128, 512]
    - [11, 1984.0]
  - - [128, 128, 8, 32, 128, 128, 128, 32]
    - [1, 1242.0]
  - - [128, 128, 8, 64, 128, 128, 128, 64]
    - [1, 1942.0]
  - - [128, 128, 8, 128, 128, 128, 128, 128]
    - [4, 2603.0]
  - - [128, 128, 8, 256, 128, 128, 128, 256]
    - [11, 3137.0]
  - - [128, 128, 8, 512, 128, 128, 128, 512]
    - [11, 3392.0]
  - - [128, 256, 8, 32, 128, 128, 128, 32]
    - [1, 2335.0]
  - - [128, 256, 8, 64, 128, 128, 128, 64]
    - [1, 3380.0]
  - - [128, 256, 8, 128, 128, 128, 128, 128]
    - [4, 4202.0]
  - - [128, 256, 8, 256, 128, 128, 128, 256]
    - [4, 4257.0]
  - - [128, 256, 8, 512, 128, 128, 128, 512]
    - [12, 4321.0]
  - - [128, 512, 8, 32, 128, 128, 128, 32]
    - [1, 3826.0]
  - - [128, 512, 8, 64, 128, 128, 128, 64]
    - [1, 5497.0]
  - - [128, 512, 8, 128, 128, 128, 128, 128]
    - [4, 5992.0]
  - - [128, 512, 8, 256, 128, 128, 128, 256]
    - [11, 5359.0]
  - - [128, 512, 8, 512, 128, 128, 128, 512]
    - [4, 5728.0]
  - - [256, 32, 8, 32, 256, 256, 256, 32]
    - [8, 625.0]
  - - [256, 32, 8, 64, 256, 256, 256, 64]
    - [8, 1000.0]
  - - [256, 32, 8, 128, 256, 256, 256, 128]
    - [3, 1417.0]
  - - [256, 32, 8, 256, 256, 256, 256, 256]
    - [3, 1670.0]
  - - [256, 32, 8, 512, 256, 256, 256, 512]
    - [3, 1846.0]
  - - [256, 64, 8, 32, 256, 256, 256, 32]
    - [9, 1253.0]
  - - [256, 64, 8, 64, 256, 256, 256, 64]
    - [1, 1949.0]
  - - [256, 64, 8, 128, 256, 256, 256, 128]
    - [4, 2606.0]
  - - [256, 64, 8, 256, 256, 256, 256, 256]
    - [4, 3135.0]
  - - [256, 64, 8, 512, 256, 256, 256, 512]
    - [4, 3340.0]
  - - [256, 128, 8, 32, 256, 256, 256, 32]
    - [1, 2345.0]
  - - [256, 128, 8, 64, 256, 256, 256, 64]
    - [1, 3321.0]
  - - [256, 128, 8, 128, 256, 256, 256, 128]
    - [1, 4194.0]
  - - [256, 128, 8, 256, 256, 256, 256, 256]
    - [4, 4343.0]
  - - [256, 128, 8, 512, 256, 256, 256, 512]
    - [5, 4335.0]
  - - [256, 256, 8, 32, 256, 256, 256, 32]
    - [1, 3826.0]
  - - [256, 256, 8, 64, 256, 256, 256, 64]
    - [9, 5438.0]
  - - [256, 256, 8, 128, 256, 256, 256, 128]
    - [4, 6048.0]
  - - [256, 256, 8, 256, 256, 256, 256, 256]
    - [4, 5402.0]
  - - [256, 256, 8, 512, 256, 256, 256, 512]
    - [9, 5769.0]
  - - [256, 512, 8, 32, 256, 256, 256, 32]
    - [1, 5606.0]
  - - [256, 512, 8, 64, 256, 256, 256, 64]
    - [1, 7072.0]
  - - [256, 512, 8, 128, 256, 256, 256, 128]
    - [5, 6407.0]
  - - [256, 512, 8, 256, 256, 256, 256, 256]
    - [5, 6803.0]
  - - [256, 512, 8, 512, 256, 256, 256, 512]
    - [12, 7419.0]
  - - [512, 32, 8, 32, 512, 512, 512, 32]
    - [8, 1220.0]
  - - [512, 32, 8, 64, 512, 512, 512, 64]
    - [0, 1900.0]
  - - [512, 32, 8, 128, 512, 512, 512, 128]
    - [3, 2631.0]
  - - [512, 32, 8, 256, 512, 512, 512, 256]
    - [10, 2932.0]
  - - [512, 32, 8, 512, 512, 512, 512, 512]
    - [3, 2985.0]
  - - [512, 64, 8, 32, 512, 512, 512, 32]
    - [0, 2251.0]
  - - [512, 64, 8, 64, 512, 512, 512, 64]
    - [10, 3273.0]
  - - [512, 64, 8, 128, 512, 512, 512, 128]
    - [10, 4190.0]
  - - [512, 64, 8, 256, 512, 512, 512, 256]
    - [11, 4516.0]
  - - [512, 64, 8, 512, 512, 512, 512, 512]
    - [5, 4417.0]
  - - [512, 128, 8, 32, 512, 512, 512, 32]
    - [9, 3781.0]
  - - [512, 128, 8, 64, 512, 512, 512, 64]
    - [9, 5153.0]
  - - [512, 128, 8, 128, 512, 512, 512, 128]
    - [4, 6000.0]
  - - [512, 128, 8, 256, 512, 512, 512, 256]
    - [13, 5071.0]
  - - [512, 128, 8, 512, 512, 512, 512, 512]
    - [4, 5967.0]
  - - [512, 256, 8, 32, 512, 512, 512, 32]
    - [16, 5504.0]
  - - [512, 256, 8, 64, 512, 512, 512, 64]
    - [2, 6926.0]
  - - [512, 256, 8, 128, 512, 512, 512, 128]
    - [2, 6601.0]
  - - [512, 256, 8, 256, 512, 512, 512, 256]
    - [5, 6808.0]
  - - [512, 256, 8, 512, 512, 512, 512, 512]
    - [12, 7782.0]
  - - [512, 512, 8, 32, 512, 512, 512, 32]
    - [7, 6622.0]
  - - [512, 512, 8, 64, 512, 512, 512, 64]
    - [12, 6905.0]
  - - [512, 512, 8, 128, 512, 512, 512, 128]
    - [13, 7674.0]
  - - [512, 512, 8, 256, 512, 512, 512, 256]
    - [2, 8429.0]
  - - [512, 512, 8, 512, 512, 512, 512, 512]
    - [12, 9319.0]
- null
