library/src/blas3/Tensile/Logic/asm_full/vega10/vega10_Cijk_Alik_Bjlk_HB_GB.yaml
- {MinimumRequiredVersion: 4.26.0}
- vega10
- gfx900
- [Device 6863, Device 6862, Device 687f, Device 6860, Device 6861, 'Vega 10 XTX [Radeon
    SolutionIndex: 0
    SolutionNameMin: Cijk_Alik_Bjlk_HB_GB_MT32x32x8_SN_GRVW4_LRVW4_TT4_4_VW4_WG8_8_1_WGM1
    SolutionIndex: 1
    SolutionNameMin: Cijk_Alik_Bjlk_HB_GB_MT64x64x8_SN_GRVW4_LRVW4_TT4_4_VW4_WG16_16_1_WGM1
    SolutionIndex: 2
    SolutionNameMin: Cijk_Alik_Bjlk_HB_GB_MT128x64x8_SN_GRVW4_LRVW4_TT8_4_VW4_WG16_16_1_WGM1
    SolutionIndex: 3
    SolutionNameMin: Cijk_Alik_Bjlk_HB_GB_MT32x32x16_SN_GRVW4_LRVW4_TT4_4_VW4_WG8_8_1_WGM1
    SolutionIndex: 4
    SolutionNameMin: Cijk_Alik_Bjlk_HB_GB_MT64x64x16_SN_GRVW4_LRVW4_TT4_4_VW4_WG16_16_1_WGM1
    SolutionIndex: 5
    SolutionNameMin: Cijk_Alik_Bjlk_HB_GB_MT64x128x16_SN_GRVW4_LRVW4_TT4_8_VW4_WG16_16_1_WGM1
    SolutionIndex: 6
    SolutionNameMin: Cijk_Alik_Bjlk_HB_GB_MT64x64x32_SN_GRVW4_LRVW4_TT4_4_VW4_WG16_16_1_WGM1
    SolutionIndex: 7
    SolutionNameMin: Cijk_Alik_Bjlk_HB_GB_MT64x64x8_SN_GRVW2_LRVW2_TT4_4_VW2_WG16_16_1_WGM1
    SolutionIndex: 8
    SolutionNameMin: Cijk_Alik_Bjlk_HB_GB_MT64x128x8_SN_GRVW2_LRVW2_TT4_8_VW2_WG16_16_1_WGM1
    SolutionIndex: 9
    SolutionNameMin: Cijk_Alik_Bjlk_HB_GB_MT32x32x16_SN_GRVW2_LRVW2_TT4_4_VW2_WG8_8_1_WGM1
    SolutionIndex: 10
    SolutionNameMin: Cijk_Alik_Bjlk_HB_GB_MT64x128x16_SN_GRVW2_LRVW2_TT4_8_VW2_WG16_16_1_WGM1
    SolutionIndex: 11
    SolutionNameMin: Cijk_Alik_Bjlk_HB_GB_MT32x32x8_SN_GRVW4_LRVW4_TT4_4_VW4_WG8_8_1_WGM8
    SolutionIndex: 12
    SolutionNameMin: Cijk_Alik_Bjlk_HB_GB_MT64x64x8_SN_GRVW4_LRVW4_TT4_4_VW4_WG16_16_1_WGM8
    SolutionIndex: 13
    SolutionNameMin: Cijk_Alik_Bjlk_HB_GB_MT64x128x8_SN_GRVW4_LRVW4_TT4_8_VW4_WG16_16_1_WGM8
    SolutionIndex: 14
    SolutionNameMin: Cijk_Alik_Bjlk_HB_GB_MT32x32x16_SN_GRVW4_LRVW4_TT4_4_VW4_WG8_8_1_WGM8
    SolutionIndex: 15
    SolutionNameMin: Cijk_Alik_Bjlk_HB_GB_MT32x64x16_SN_GRVW4_LRVW4_TT4_8_VW4_WG8_8_1_WGM8
    SolutionIndex: 16
    SolutionNameMin: Cijk_Alik_Bjlk_HB_GB_MT64x64x16_SN_GRVW4_LRVW4_TT4_4_VW4_WG16_16_1_WGM8
    SolutionIndex: 17
    SolutionNameMin: Cijk_Alik_Bjlk_HB_GB_MT128x64x16_SN_GRVW4_LRVW4_TT8_4_VW4_WG16_16_1_WGM8
    SolutionIndex: 18
    SolutionNameMin: Cijk_Alik_Bjlk_HB_GB_MT64x128x16_SN_GRVW4_LRVW4_TT4_8_VW4_WG16_16_1_WGM8
    SolutionIndex: 19
    SolutionNameMin: Cijk_Alik_Bjlk_HB_GB_MT128x128x16_SN_GRVW8_LRVW8_TT8_8_VW8_WG16_16_1_WGM8
    SolutionIndex: 20
    SolutionNameMin: Cijk_Alik_Bjlk_HB_GB_MT32x32x8_SN_GRVW2_LRVW2_TT4_4_VW2_WG8_8_1_WGM8
    SolutionIndex: 21
    SolutionNameMin: Cijk_Alik_Bjlk_HB_GB_MT64x64x8_SN_GRVW2_LRVW2_TT4_4_VW2_WG16_16_1_WGM8
- - - [32, 32, 8, 32, 32, 32, 32, 32]
    - [11, 75.0]
  - - [32, 32, 8, 64, 32, 32, 64, 32]
    - [0, 118.0]
  - - [32, 32, 8, 128, 32, 32, 128, 32]
    - [0, 168.0]
  - - [32, 32, 8, 256, 32, 32, 256, 32]
    - [3, 218.0]
  - - [32, 32, 8, 512, 32, 32, 512, 32]
    - [3, 260.0]
  - - [32, 64, 8, 32, 32, 32, 32, 64]
    - [20, 158.0]
  - - [32, 64, 8, 64, 32, 32, 64, 64]
    - [0, 248.0]
  - - [32, 64, 8, 128, 32, 32, 128, 64]
    - [3, 350.0]
  - - [32, 64, 8, 256, 32, 32, 256, 64]
    - [14, 450.0]
  - - [32, 64, 8, 512, 32, 32, 512, 64]
    - [14, 528.0]
  - - [32, 128, 8, 32, 32, 32, 32, 128]
    - [0, 323.0]
  - - [32, 128, 8, 64, 32, 32, 64, 128]
    - [11, 508.0]
  - - [32, 128, 8, 128, 32, 32, 128, 128]
    - [14, 711.0]
  - - [32, 128, 8, 256, 32, 32, 256, 128]
    - [3, 914.0]
  - - [32, 128, 8, 512, 32, 32, 512, 128]
    - [14, 1065.0]
  - - [32, 256, 8, 32, 32, 32, 32, 256]
    - [3, 641.0]
  - - [32, 256, 8, 64, 32, 32, 64, 256]
    - [0, 1024.0]
  - - [32, 256, 8, 128, 32, 32, 128, 256]
    - [3, 1433.0]
  - - [32, 256, 8, 256, 32, 32, 256, 256]
    - [3, 1709.0]
  - - [32, 256, 8, 512, 32, 32, 512, 256]
    - [14, 1869.0]
  - - [32, 512, 8, 32, 32, 32, 32, 512]
    - [0, 1264.0]
  - - [32, 512, 8, 64, 32, 32, 64, 512]
    - [11, 1987.0]
  - - [32, 512, 8, 128, 32, 32, 128, 512]
    - [3, 2668.0]
  - - [32, 512, 8, 256, 32, 32, 256, 512]
    - [3, 2893.0]
  - - [32, 512, 8, 512, 32, 32, 512, 512]
    - [9, 2824.0]
  - - [64, 32, 8, 32, 64, 64, 32, 32]
    - [3, 157.0]
  - - [64, 32, 8, 64, 64, 64, 64, 32]
    - [11, 247.0]
  - - [64, 32, 8, 128, 64, 64, 128, 32]
    - [3, 347.0]
  - - [64, 32, 8, 256, 64, 64, 256, 32]
    - [14, 454.0]
  - - [64, 32, 8, 512, 64, 64, 512, 32]
    - [14, 528.0]
  - - [64, 64, 8, 32, 64, 64, 32, 64]
    - [0, 325.0]
  - - [64, 64, 8, 64, 64, 64, 64, 64]
    - [11, 506.0]
  - - [64, 64, 8, 128, 64, 64, 128, 64]
    - [3, 717.0]
  - - [64, 64, 8, 256, 64, 64, 256, 64]
    - [14, 914.0]
  - - [64, 64, 8, 512, 64, 64, 512, 64]
    - [14, 1068.0]
  - - [64, 128, 8, 32, 64, 64, 32, 128]
    - [0, 654.0]
  - - [64, 128, 8, 64, 64, 64, 64, 128]
    - [0, 1018.0]
  - - [64, 128, 8, 128, 64, 64, 128, 128]
    - [14, 1433.0]
  - - [64, 128, 8, 256, 64, 64, 256, 128]
    - [16, 1713.0]
  - - [64, 128, 8, 512, 64, 64, 512, 128]
    - [16, 1980.0]
  - - [64, 256, 8, 32, 64, 64, 32, 256]
    - [0, 1267.0]
  - - [64, 256, 8, 64, 64, 64, 64, 256]
    - [0, 1990.0]
  - - [64, 256, 8, 128, 64, 64, 128, 256]
    - [3, 2680.0]
  - - [64, 256, 8, 256, 64, 64, 256, 256]
    - [16, 3120.0]
  - - [64, 256, 8, 512, 64, 64, 512, 256]
    - [6, 3312.0]
  - - [64, 512, 8, 32, 64, 64, 32, 512]
    - [1, 2325.0]
  - - [64, 512, 8, 64, 64, 64, 64, 512]
    - [1, 3370.0]
  - - [64, 512, 8, 128, 64, 64, 128, 512]
    - [1, 4190.0]
  - - [64, 512, 8, 256, 64, 64, 256, 512]
    - [16, 4310.0]
  - - [64, 512, 8, 512, 64, 64, 512, 512]
    - [5, 4228.0]
  - - [128, 32, 8, 32, 128, 128, 32, 32]
    - [3, 318.0]
  - - [128, 32, 8, 64, 128, 128, 64, 32]
    - [0, 506.0]
  - - [128, 32, 8, 128, 128, 128, 128, 32]
    - [14, 711.0]
  - - [128, 32, 8, 256, 128, 128, 256, 32]
    - [14, 914.0]
  - - [128, 32, 8, 512, 128, 128, 512, 32]
    - [14, 1068.0]
  - - [128, 64, 8, 32, 128, 128, 32, 64]
    - [1, 632.0]
  - - [128, 64, 8, 64, 128, 128, 64, 64]
    - [0, 997.0]
  - - [128, 64, 8, 128, 128, 128, 128, 64]
    - [3, 1416.0]
  - - [128, 64, 8, 256, 128, 128, 256, 64]
    - [16, 1721.0]
  - - [128, 64, 8, 512, 128, 128, 512, 64]
    - [16, 1995.0]
  - - [128, 128, 8, 32, 128, 128, 32, 128]
    - [1, 1255.0]
  - - [128, 128, 8, 64, 128, 128, 64, 128]
    - [0, 1963.0]
  - - [128, 128, 8, 128, 128, 128, 128, 128]
    - [3, 2658.0]
  - - [128, 128, 8, 256, 128, 128, 256, 128]
    - [16, 3107.0]
  - - [128, 128, 8, 512, 128, 128, 512, 128]
    - [16, 3393.0]
  - - [128, 256, 8, 32, 128, 128, 32, 256]
    - [1, 2321.0]
  - - [128, 256, 8, 64, 128, 128, 64, 256]
    - [1, 3370.0]
  - - [128, 256, 8, 128, 128, 128, 128, 256]
    - [0, 4194.0]
  - - [128, 256, 8, 256, 128, 128, 256, 256]
    - [16, 4660.0]
  - - [128, 256, 8, 512, 128, 128, 512, 256]
    - [5, 4370.0]
  - - [128, 512, 8, 32, 128, 128, 32, 512]
    - [12, 3813.0]
  - - [128, 512, 8, 64, 128, 128, 64, 512]
    - [12, 5298.0]
  - - [128, 512, 8, 128, 128, 128, 128, 512]
    - [16, 5944.0]
  - - [128, 512, 8, 256, 128, 128, 256, 512]
    - [4, 5356.0]
  - - [128, 512, 8, 512, 128, 128, 512, 512]
    - [4, 6120.0]
  - - [256, 32, 8, 32, 256, 256, 32, 32]
    - [3, 626.0]
  - - [256, 32, 8, 64, 256, 256, 64, 32]
    - [11, 978.0]
  - - [256, 32, 8, 128, 256, 256, 128, 32]
    - [3, 1393.0]
  - - [256, 32, 8, 256, 256, 256, 256, 32]
    - [3, 1657.0]
  - - [256, 32, 8, 512, 256, 256, 512, 32]
    - [14, 1806.0]
  - - [256, 64, 8, 32, 256, 256, 32, 64]
    - [1, 1264.0]
  - - [256, 64, 8, 64, 256, 256, 64, 64]
    - [1, 1952.0]
  - - [256, 64, 8, 128, 256, 256, 128, 64]
    - [16, 2606.0]
  - - [256, 64, 8, 256, 256, 256, 256, 64]
    - [16, 3071.0]
  - - [256, 64, 8, 512, 256, 256, 512, 64]
    - [4, 3294.0]
  - - [256, 128, 8, 32, 256, 256, 32, 128]
    - [1, 2345.0]
  - - [256, 128, 8, 64, 256, 256, 64, 128]
    - [1, 3316.0]
  - - [256, 128, 8, 128, 256, 256, 128, 128]
    - [4, 4148.0]
  - - [256, 128, 8, 256, 256, 256, 256, 128]
    - [12, 4349.0]
  - - [256, 128, 8, 512, 256, 256, 512, 128]
    - [16, 4284.0]
  - - [256, 256, 8, 32, 256, 256, 32, 256]
    - [1, 3775.0]
  - - [256, 256, 8, 64, 256, 256, 64, 256]
    - [1, 5342.0]
  - - [256, 256, 8, 128, 256, 256, 128, 256]
    - [4, 6024.0]
  - - [256, 256, 8, 256, 256, 256, 256, 256]
    - [16, 5043.0]
  - - [256, 256, 8, 512, 256, 256, 512, 256]
    - [16, 5962.0]
  - - [256, 512, 8, 32, 256, 256, 32, 512]
    - [1, 5599.0]
  - - [256, 512, 8, 64, 256, 256, 64, 512]
    - [1, 6926.0]
  - - [256, 512, 8, 128, 256, 256, 128, 512]
    - [13, 6159.0]
  - - [256, 512, 8, 256, 256, 256, 256, 512]
    - [10, 6248.0]
  - - [256, 512, 8, 512, 256, 256, 512, 512]
    - [18, 7429.0]
  - - [512, 32, 8, 32, 512, 512, 32, 32]
    - [3, 1210.0]
  - - [512, 32, 8, 64, 512, 512, 64, 32]
    - [11, 1850.0]
  - - [512, 32, 8, 128, 512, 512, 128, 32]
    - [14, 2531.0]
  - - [512, 32, 8, 256, 512, 512, 256, 32]
    - [3, 2843.0]
  - - [512, 32, 8, 512, 512, 512, 512, 32]
    - [3, 2901.0]
  - - [512, 64, 8, 32, 512, 512, 32, 64]
    - [7, 2203.0]
  - - [512, 64, 8, 64, 512, 512, 64, 64]
    - [1, 3217.0]
  - - [512, 64, 8, 128, 512, 512, 128, 64]
    - [14, 4194.0]
  - - [512, 64, 8, 256, 512, 512, 256, 64]
    - [4, 4070.0]
  - - [512, 64, 8, 512, 512, 512, 512, 64]
    - [15, 4024.0]
  - - [512, 128, 8, 32, 512, 512, 32, 128]
    - [4, 3653.0]
  - - [512, 128, 8, 64, 512, 512, 64, 128]
    - [12, 5159.0]
  - - [512, 128, 8, 128, 512, 512, 128, 128]
    - [12, 5849.0]
  - - [512, 128, 8, 256, 512, 512, 256, 128]
    - [16, 4877.0]
  - - [512, 128, 8, 512, 512, 512, 512, 128]
    - [4, 5820.0]
  - - [512, 256, 8, 32, 512, 512, 32, 256]
    - [21, 5620.0]
  - - [512, 256, 8, 64, 512, 512, 64, 256]
    - [4, 6411.0]
  - - [512, 256, 8, 128, 512, 512, 128, 256]
    - [18, 5984.0]
  - - [512, 256, 8, 256, 512, 512, 256, 256]
    - [17, 6295.0]
  - - [512, 256, 8, 512, 512, 512, 512, 256]
    - [5, 7506.0]
  - - [512, 512, 8, 32, 512, 512, 32, 512]
    - [2, 6485.0]
  - - [512, 512, 8, 64, 512, 512, 64, 512]
    - [18, 6569.0]
  - - [512, 512, 8, 128, 512, 512, 128, 512]
    - [19, 7473.0]
  - - [512, 512, 8, 256, 512, 512, 256, 512]
    - [8, 8639.0]
  - - [512, 512, 8, 512, 512, 512, 512, 512]
    - [18, 8684.0]
- null
