library/src/blas3/Tensile/Logic/asm_full/vega10/vega10_Cijk_Alik_Bjlk_SB_GB.yaml
- {MinimumRequiredVersion: 4.26.0}
- vega10
- gfx900
- [Device 6863, Device 6862, Device 687f, Device 6860, Device 6861, 'Vega 10 XTX [Radeon
    SolutionIndex: 0
    SolutionNameMin: Cijk_Alik_Bjlk_SB_GB_MT32x32x8_SN_AMAS3_GRVW4_LRVW4_TT4_4_VW4_WG8_8_1_WGM1
    SolutionIndex: 1
    SolutionNameMin: Cijk_Alik_Bjlk_SB_GB_MT64x128x8_SN_AMAS3_GRVW4_LRVW4_TT4_8_VW4_WG16_16_1_WGM1
    SolutionIndex: 2
    SolutionNameMin: Cijk_Alik_Bjlk_SB_GB_MT128x128x8_SN_AMAS3_GRVW4_LRVW4_TT8_8_VW4_WG16_16_1_WGM1
    SolutionIndex: 3
    SolutionNameMin: Cijk_Alik_Bjlk_SB_GB_MT32x32x16_SN_AMAS3_GRVW4_LRVW4_TT4_4_VW4_WG8_8_1_WGM1
    SolutionIndex: 4
    SolutionNameMin: Cijk_Alik_Bjlk_SB_GB_MT64x64x16_SN_AMAS3_GRVW4_LRVW4_TT4_4_VW4_WG16_16_1_WGM1
    SolutionIndex: 5
    SolutionNameMin: Cijk_Alik_Bjlk_SB_GB_MT128x64x16_SN_AMAS3_GRVW4_LRVW4_TT8_4_VW4_WG16_16_1_WGM1
    SolutionIndex: 6
    SolutionNameMin: Cijk_Alik_Bjlk_SB_GB_MT64x128x16_SN_AMAS3_GRVW4_LRVW4_TT4_8_VW4_WG16_16_1_WGM1
    SolutionIndex: 7
    SolutionNameMin: Cijk_Alik_Bjlk_SB_GB_MT128x128x16_SN_AMAS3_GRVW4_LRVW4_TT8_8_VW4_WG16_16_1_WGM1
    SolutionIndex: 8
    SolutionNameMin: Cijk_Alik_Bjlk_SB_GB_MT32x32x8_SN_AMAS3_GRVW4_LRVW4_TT4_4_VW4_WG8_8_1_WGM8
    SolutionIndex: 9
    SolutionNameMin: Cijk_Alik_Bjlk_SB_GB_MT64x128x8_SN_AMAS3_GRVW4_LRVW4_TT4_8_VW4_WG16_16_1_WGM8
    SolutionIndex: 10
    SolutionNameMin: Cijk_Alik_Bjlk_SB_GB_MT32x32x16_SN_AMAS3_GRVW4_LRVW4_TT4_4_VW4_WG8_8_1_WGM8
    SolutionIndex: 11
    SolutionNameMin: Cijk_Alik_Bjlk_SB_GB_MT64x64x16_SN_AMAS3_GRVW4_LRVW4_TT4_4_VW4_WG16_16_1_WGM8
    SolutionIndex: 12
    SolutionNameMin: Cijk_Alik_Bjlk_SB_GB_MT64x128x16_SN_AMAS3_GRVW4_LRVW4_TT4_8_VW4_WG16_16_1_WGM8
    SolutionIndex: 13
    SolutionNameMin: Cijk_Alik_Bjlk_SB_GB_MT32x32x32_SN_AMAS3_GRVW4_LRVW4_TT4_4_VW4_WG8_8_1_WGM8
- - - [32, 32, 8, 32, 32, 32, 32, 32]
    - [8, 72.0]
  - - [32, 32, 8, 64, 32, 32, 64, 32]
    - [0, 107.0]
  - - [32, 32, 8, 128, 32, 32, 128, 32]
    - [0, 147.0]
  - - [32, 32, 8, 256, 32, 32, 256, 32]
    - [3, 181.0]
  - - [32, 32, 8, 512, 32, 32, 512, 32]
    - [10, 205.0]
  - - [32, 64, 8, 32, 32, 32, 32, 64]
    - [0, 146.0]
  - - [32, 64, 8, 64, 32, 32, 64, 64]
    - [0, 222.0]
  - - [32, 64, 8, 128, 32, 32, 128, 64]
    - [3, 298.0]
  - - [32, 64, 8, 256, 32, 32, 256, 64]
    - [10, 367.0]
  - - [32, 64, 8, 512, 32, 32, 512, 64]
    - [10, 413.0]
  - - [32, 128, 8, 32, 32, 32, 32, 128]
    - [0, 301.0]
  - - [32, 128, 8, 64, 32, 32, 64, 128]
    - [0, 442.0]
  - - [32, 128, 8, 128, 32, 32, 128, 128]
    - [3, 605.0]
  - - [32, 128, 8, 256, 32, 32, 256, 128]
    - [3, 733.0]
  - - [32, 128, 8, 512, 32, 32, 512, 128]
    - [10, 822.0]
  - - [32, 256, 8, 32, 32, 32, 32, 256]
    - [0, 587.0]
  - - [32, 256, 8, 64, 32, 32, 64, 256]
    - [8, 879.0]
  - - [32, 256, 8, 128, 32, 32, 128, 256]
    - [10, 1144.0]
  - - [32, 256, 8, 256, 32, 32, 256, 256]
    - [10, 1226.0]
  - - [32, 256, 8, 512, 32, 32, 512, 256]
    - [10, 1348.0]
  - - [32, 512, 8, 32, 32, 32, 32, 512]
    - [8, 1102.0]
  - - [32, 512, 8, 64, 32, 32, 64, 512]
    - [8, 1593.0]
  - - [32, 512, 8, 128, 32, 32, 128, 512]
    - [3, 1987.0]
  - - [32, 512, 8, 256, 32, 32, 256, 512]
    - [10, 1771.0]
  - - [32, 512, 8, 512, 32, 32, 512, 512]
    - [10, 2036.0]
  - - [64, 32, 8, 32, 64, 64, 32, 32]
    - [0, 145.0]
  - - [64, 32, 8, 64, 64, 64, 64, 32]
    - [0, 224.0]
  - - [64, 32, 8, 128, 64, 64, 128, 32]
    - [10, 300.0]
  - - [64, 32, 8, 256, 64, 64, 256, 32]
    - [10, 366.0]
  - - [64, 32, 8, 512, 64, 64, 512, 32]
    - [10, 415.0]
  - - [64, 64, 8, 32, 64, 64, 32, 64]
    - [0, 296.0]
  - - [64, 64, 8, 64, 64, 64, 64, 64]
    - [0, 448.0]
  - - [64, 64, 8, 128, 64, 64, 128, 64]
    - [10, 600.0]
  - - [64, 64, 8, 256, 64, 64, 256, 64]
    - [10, 738.0]
  - - [64, 64, 8, 512, 64, 64, 512, 64]
    - [10, 826.0]
  - - [64, 128, 8, 32, 64, 64, 32, 128]
    - [0, 581.0]
  - - [64, 128, 8, 64, 64, 64, 64, 128]
    - [0, 881.0]
  - - [64, 128, 8, 128, 64, 64, 128, 128]
    - [4, 1157.0]
  - - [64, 128, 8, 256, 64, 64, 256, 128]
    - [11, 1410.0]
  - - [64, 128, 8, 512, 64, 64, 512, 128]
    - [11, 1560.0]
  - - [64, 256, 8, 32, 64, 64, 32, 256]
    - [0, 1097.0]
  - - [64, 256, 8, 64, 64, 64, 64, 256]
    - [10, 1588.0]
  - - [64, 256, 8, 128, 64, 64, 128, 256]
    - [4, 2024.0]
  - - [64, 256, 8, 256, 64, 64, 256, 256]
    - [4, 2100.0]
  - - [64, 256, 8, 512, 64, 64, 512, 256]
    - [11, 2409.0]
  - - [64, 512, 8, 32, 64, 64, 32, 512]
    - [0, 1824.0]
  - - [64, 512, 8, 64, 64, 64, 64, 512]
    - [8, 2634.0]
  - - [64, 512, 8, 128, 64, 64, 128, 512]
    - [3, 2854.0]
  - - [64, 512, 8, 256, 64, 64, 256, 512]
    - [4, 2712.0]
  - - [64, 512, 8, 512, 64, 64, 512, 512]
    - [12, 3059.0]
  - - [128, 32, 8, 32, 128, 128, 32, 32]
    - [10, 292.0]
  - - [128, 32, 8, 64, 128, 128, 64, 32]
    - [0, 444.0]
  - - [128, 32, 8, 128, 128, 128, 128, 32]
    - [10, 597.0]
  - - [128, 32, 8, 256, 128, 128, 256, 32]
    - [10, 736.0]
  - - [128, 32, 8, 512, 128, 128, 512, 32]
    - [10, 827.0]
  - - [128, 64, 8, 32, 128, 128, 32, 64]
    - [0, 581.0]
  - - [128, 64, 8, 64, 128, 128, 64, 64]
    - [0, 871.0]
  - - [128, 64, 8, 128, 128, 128, 128, 64]
    - [10, 1145.0]
  - - [128, 64, 8, 256, 128, 128, 256, 64]
    - [4, 1408.0]
  - - [128, 64, 8, 512, 128, 128, 512, 64]
    - [11, 1541.0]
  - - [128, 128, 8, 32, 128, 128, 32, 128]
    - [0, 1097.0]
  - - [128, 128, 8, 64, 128, 128, 64, 128]
    - [3, 1579.0]
  - - [128, 128, 8, 128, 128, 128, 128, 128]
    - [3, 2050.0]
  - - [128, 128, 8, 256, 128, 128, 256, 128]
    - [11, 2222.0]
  - - [128, 128, 8, 512, 128, 128, 512, 128]
    - [4, 2380.0]
  - - [128, 256, 8, 32, 128, 128, 32, 256]
    - [0, 1863.0]
  - - [128, 256, 8, 64, 128, 128, 64, 256]
    - [4, 2470.0]
  - - [128, 256, 8, 128, 128, 128, 128, 256]
    - [4, 2909.0]
  - - [128, 256, 8, 256, 128, 128, 256, 256]
    - [6, 2755.0]
  - - [128, 256, 8, 512, 128, 128, 512, 256]
    - [9, 3144.0]
  - - [128, 512, 8, 32, 128, 128, 32, 512]
    - [4, 2680.0]
  - - [128, 512, 8, 64, 128, 128, 64, 512]
    - [4, 3514.0]
  - - [128, 512, 8, 128, 128, 128, 128, 512]
    - [4, 3336.0]
  - - [128, 512, 8, 256, 128, 128, 256, 512]
    - [11, 3294.0]
  - - [128, 512, 8, 512, 128, 128, 512, 512]
    - [7, 3585.0]
  - - [256, 32, 8, 32, 256, 256, 32, 32]
    - [10, 556.0]
  - - [256, 32, 8, 64, 256, 256, 64, 32]
    - [0, 844.0]
  - - [256, 32, 8, 128, 256, 256, 128, 32]
    - [3, 1122.0]
  - - [256, 32, 8, 256, 256, 256, 256, 32]
    - [3, 1254.0]
  - - [256, 32, 8, 512, 256, 256, 512, 32]
    - [10, 1433.0]
  - - [256, 64, 8, 32, 256, 256, 32, 64]
    - [10, 1068.0]
  - - [256, 64, 8, 64, 256, 256, 64, 64]
    - [10, 1555.0]
  - - [256, 64, 8, 128, 256, 256, 128, 64]
    - [10, 2040.0]
  - - [256, 64, 8, 256, 256, 256, 256, 64]
    - [4, 2134.0]
  - - [256, 64, 8, 512, 256, 256, 512, 64]
    - [4, 2305.0]
  - - [256, 128, 8, 32, 256, 256, 32, 128]
    - [3, 1732.0]
  - - [256, 128, 8, 64, 256, 256, 64, 128]
    - [4, 2382.0]
  - - [256, 128, 8, 128, 256, 256, 128, 128]
    - [4, 2891.0]
  - - [256, 128, 8, 256, 256, 256, 256, 128]
    - [11, 2951.0]
  - - [256, 128, 8, 512, 256, 256, 512, 128]
    - [6, 3053.0]
  - - [256, 256, 8, 32, 256, 256, 32, 256]
    - [4, 2719.0]
  - - [256, 256, 8, 64, 256, 256, 64, 256]
    - [4, 3525.0]
  - - [256, 256, 8, 128, 256, 256, 128, 256]
    - [11, 3643.0]
  - - [256, 256, 8, 256, 256, 256, 256, 256]
    - [11, 3265.0]
  - - [256, 256, 8, 512, 256, 256, 512, 256]
    - [2, 3722.0]
  - - [256, 512, 8, 32, 256, 256, 32, 512]
    - [1, 3154.0]
  - - [256, 512, 8, 64, 256, 256, 64, 512]
    - [1, 3531.0]
  - - [256, 512, 8, 128, 256, 256, 128, 512]
    - [9, 3928.0]
  - - [256, 512, 8, 256, 256, 256, 256, 512]
    - [4, 4058.0]
  - - [256, 512, 8, 512, 256, 256, 512, 512]
    - [1, 4576.0]
  - - [512, 32, 8, 32, 512, 512, 32, 32]
    - [10, 1068.0]
  - - [512, 32, 8, 64, 512, 512, 64, 32]
    - [0, 1573.0]
  - - [512, 32, 8, 128, 512, 512, 128, 32]
    - [10, 1990.0]
  - - [512, 32, 8, 256, 512, 512, 256, 32]
    - [13, 1748.0]
  - - [512, 32, 8, 512, 512, 512, 512, 32]
    - [3, 2227.0]
  - - [512, 64, 8, 32, 512, 512, 32, 64]
    - [10, 1756.0]
  - - [512, 64, 8, 64, 512, 512, 64, 64]
    - [8, 2516.0]
  - - [512, 64, 8, 128, 512, 512, 128, 64]
    - [10, 2849.0]
  - - [512, 64, 8, 256, 512, 512, 256, 64]
    - [11, 2780.0]
  - - [512, 64, 8, 512, 512, 512, 512, 64]
    - [4, 2999.0]
  - - [512, 128, 8, 32, 512, 512, 32, 128]
    - [8, 2525.0]
  - - [512, 128, 8, 64, 512, 512, 64, 128]
    - [4, 3314.0]
  - - [512, 128, 8, 128, 512, 512, 128, 128]
    - [4, 3568.0]
  - - [512, 128, 8, 256, 512, 512, 256, 128]
    - [7, 3343.0]
  - - [512, 128, 8, 512, 512, 512, 512, 128]
    - [11, 3709.0]
  - - [512, 256, 8, 32, 512, 512, 32, 256]
    - [11, 2871.0]
  - - [512, 256, 8, 64, 512, 512, 64, 256]
    - [9, 3641.0]
  - - [512, 256, 8, 128, 512, 512, 128, 256]
    - [9, 3948.0]
  - - [512, 256, 8, 256, 512, 512, 256, 256]
    - [4, 4017.0]
  - - [512, 256, 8, 512, 512, 512, 512, 256]
    - [1, 4490.0]
  - - [512, 512, 8, 32, 512, 512, 32, 512]
    - [9, 3104.0]
  - - [512, 512, 8, 64, 512, 512, 64, 512]
    - [12, 3483.0]
  - - [512, 512, 8, 128, 512, 512, 128, 512]
    - [5, 4160.0]
  - - [512, 512, 8, 256, 512, 512, 256, 512]
    - [9, 4737.0]
  - - [512, 512, 8, 512, 512, 512, 512, 512]
    - [5, 4945.0]
- null
