library/src/blas3/Tensile/Logic/asm_full/vega10/vega10_Cijk_Ailk_Bjlk_SB_GB.yaml
- {MinimumRequiredVersion: 4.26.0}
- vega10
- gfx900
- [Device 6863, Device 6862, Device 687f, Device 6860, Device 6861, 'Vega 10 XTX [Radeon
    SolutionIndex: 0
    SolutionNameMin: Cijk_Ailk_Bjlk_SB_GB_MT32x32x8_SN_AMAS3_GRVW4_LRVW4_TT4_4_VW4_WG8_8_1_WGM1
    SolutionIndex: 1
    SolutionNameMin: Cijk_Ailk_Bjlk_SB_GB_MT128x128x8_SN_AMAS3_GRVW4_LRVW4_TT8_8_VW4_WG16_16_1_WGM1
    SolutionIndex: 2
    SolutionNameMin: Cijk_Ailk_Bjlk_SB_GB_MT32x32x16_SN_AMAS3_GRVW4_LRVW4_TT4_4_VW4_WG8_8_1_WGM1
    SolutionIndex: 3
    SolutionNameMin: Cijk_Ailk_Bjlk_SB_GB_MT64x64x16_SN_AMAS3_GRVW4_LRVW4_TT4_4_VW4_WG16_16_1_WGM1
    SolutionIndex: 4
    SolutionNameMin: Cijk_Ailk_Bjlk_SB_GB_MT32x32x32_SN_AMAS3_GRVW4_LRVW4_TT4_4_VW4_WG8_8_1_WGM1
    SolutionIndex: 5
    SolutionNameMin: Cijk_Ailk_Bjlk_SB_GB_MT64x64x32_SN_AMAS3_GRVW4_LRVW4_TT4_4_VW4_WG16_16_1_WGM1
    SolutionIndex: 6
    SolutionNameMin: Cijk_Ailk_Bjlk_SB_GB_MT128x64x32_SN_AMAS3_GRVW4_LRVW4_TT8_4_VW4_WG16_16_1_WGM1
    SolutionIndex: 7
    SolutionNameMin: Cijk_Ailk_Bjlk_SB_GB_MT64x64x8_SN_AMAS0_GRVW1_LRVW1_TT4_4_VW1_WG16_16_1_WGM1
    SolutionIndex: 8
    SolutionNameMin: Cijk_Ailk_Bjlk_SB_GB_MT128x64x8_SN_AMAS0_GRVW1_LRVW1_TT8_4_VW1_WG16_16_1_WGM1
    SolutionIndex: 9
    SolutionNameMin: Cijk_Ailk_Bjlk_SB_GB_MT64x128x8_SN_AMAS0_GRVW1_LRVW1_TT4_8_VW1_WG16_16_1_WGM1
    SolutionIndex: 10
    SolutionNameMin: Cijk_Ailk_Bjlk_SB_GB_MT32x32x8_SN_AMAS3_GRVW4_LRVW4_TT4_4_VW4_WG8_8_1_WGM8
    SolutionIndex: 11
    SolutionNameMin: Cijk_Ailk_Bjlk_SB_GB_MT32x64x8_SN_AMAS3_GRVW4_LRVW4_TT4_8_VW4_WG8_8_1_WGM8
    SolutionIndex: 12
    SolutionNameMin: Cijk_Ailk_Bjlk_SB_GB_MT32x32x16_SN_AMAS3_GRVW4_LRVW4_TT4_4_VW4_WG8_8_1_WGM8
    SolutionIndex: 13
    SolutionNameMin: Cijk_Ailk_Bjlk_SB_GB_MT64x64x16_SN_AMAS3_GRVW4_LRVW4_TT4_4_VW4_WG16_16_1_WGM8
    SolutionIndex: 14
    SolutionNameMin: Cijk_Ailk_Bjlk_SB_GB_MT128x64x16_SN_AMAS3_GRVW4_LRVW4_TT8_4_VW4_WG16_16_1_WGM8
    SolutionIndex: 15
    SolutionNameMin: Cijk_Ailk_Bjlk_SB_GB_MT64x128x16_SN_AMAS3_GRVW4_LRVW4_TT4_8_VW4_WG16_16_1_WGM8
    SolutionIndex: 16
    SolutionNameMin: Cijk_Ailk_Bjlk_SB_GB_MT32x32x32_SN_AMAS3_GRVW4_LRVW4_TT4_4_VW4_WG8_8_1_WGM8
    SolutionIndex: 17
    SolutionNameMin: Cijk_Ailk_Bjlk_SB_GB_MT64x64x32_SN_AMAS3_GRVW4_LRVW4_TT4_4_VW4_WG16_16_1_WGM8
    SolutionIndex: 18
    SolutionNameMin: Cijk_Ailk_Bjlk_SB_GB_MT128x64x8_SN_AMAS0_GRVW1_LRVW1_TT8_4_VW1_WG16_16_1_WGM8
    SolutionIndex: 19
    SolutionNameMin: Cijk_Ailk_Bjlk_SB_GB_MT64x128x8_SN_AMAS0_GRVW1_LRVW1_TT4_8_VW1_WG16_16_1_WGM8
- - - [32, 32, 8, 32, 32, 32, 32, 32]
    - [0, 68.0]
  - - [32, 32, 8, 64, 32, 32, 32, 32]
    - [0, 105.0]
  - - [32, 32, 8, 128, 32, 32, 32, 32]
    - [0, 142.0]
  - - [32, 32, 8, 256, 32, 32, 32, 32]
    - [12, 179.0]
  - - [32, 32, 8, 512, 32, 32, 32, 32]
    - [2, 205.0]
  - - [32, 64, 8, 32, 32, 32, 32, 64]
    - [0, 137.0]
  - - [32, 64, 8, 64, 32, 32, 32, 64]
    - [0, 212.0]
  - - [32, 64, 8, 128, 32, 32, 32, 64]
    - [12, 293.0]
  - - [32, 64, 8, 256, 32, 32, 32, 64]
    - [2, 364.0]
  - - [32, 64, 8, 512, 32, 32, 32, 64]
    - [16, 416.0]
  - - [32, 128, 8, 32, 32, 32, 32, 128]
    - [0, 279.0]
  - - [32, 128, 8, 64, 32, 32, 32, 128]
    - [0, 430.0]
  - - [32, 128, 8, 128, 32, 32, 32, 128]
    - [12, 587.0]
  - - [32, 128, 8, 256, 32, 32, 32, 128]
    - [2, 730.0]
  - - [32, 128, 8, 512, 32, 32, 32, 128]
    - [16, 832.0]
  - - [32, 256, 8, 32, 32, 32, 32, 256]
    - [0, 550.0]
  - - [32, 256, 8, 64, 32, 32, 32, 256]
    - [0, 831.0]
  - - [32, 256, 8, 128, 32, 32, 32, 256]
    - [12, 1121.0]
  - - [32, 256, 8, 256, 32, 32, 32, 256]
    - [12, 1222.0]
  - - [32, 256, 8, 512, 32, 32, 32, 256]
    - [12, 1428.0]
  - - [32, 512, 8, 32, 32, 32, 32, 512]
    - [10, 1031.0]
  - - [32, 512, 8, 64, 32, 32, 32, 512]
    - [0, 1547.0]
  - - [32, 512, 8, 128, 32, 32, 32, 512]
    - [12, 1964.0]
  - - [32, 512, 8, 256, 32, 32, 32, 512]
    - [12, 1992.0]
  - - [32, 512, 8, 512, 32, 32, 32, 512]
    - [4, 2171.0]
  - - [64, 32, 8, 32, 64, 64, 64, 32]
    - [2, 137.0]
  - - [64, 32, 8, 64, 64, 64, 64, 32]
    - [0, 211.0]
  - - [64, 32, 8, 128, 64, 64, 64, 32]
    - [2, 292.0]
  - - [64, 32, 8, 256, 64, 64, 64, 32]
    - [12, 363.0]
  - - [64, 32, 8, 512, 64, 64, 64, 32]
    - [4, 417.0]
  - - [64, 64, 8, 32, 64, 64, 64, 64]
    - [0, 280.0]
  - - [64, 64, 8, 64, 64, 64, 64, 64]
    - [0, 425.0]
  - - [64, 64, 8, 128, 64, 64, 64, 64]
    - [2, 585.0]
  - - [64, 64, 8, 256, 64, 64, 64, 64]
    - [12, 732.0]
  - - [64, 64, 8, 512, 64, 64, 64, 64]
    - [4, 834.0]
  - - [64, 128, 8, 32, 64, 64, 64, 128]
    - [0, 551.0]
  - - [64, 128, 8, 64, 64, 64, 64, 128]
    - [0, 844.0]
  - - [64, 128, 8, 128, 64, 64, 64, 128]
    - [3, 1131.0]
  - - [64, 128, 8, 256, 64, 64, 64, 128]
    - [3, 1438.0]
  - - [64, 128, 8, 512, 64, 64, 64, 128]
    - [5, 1618.0]
  - - [64, 256, 8, 32, 64, 64, 64, 256]
    - [0, 1051.0]
  - - [64, 256, 8, 64, 64, 64, 64, 256]
    - [2, 1545.0]
  - - [64, 256, 8, 128, 64, 64, 64, 256]
    - [5, 2053.0]
  - - [64, 256, 8, 256, 64, 64, 64, 256]
    - [5, 2225.0]
  - - [64, 256, 8, 512, 64, 64, 64, 256]
    - [5, 2419.0]
  - - [64, 512, 8, 32, 64, 64, 64, 512]
    - [0, 1769.0]
  - - [64, 512, 8, 64, 64, 64, 64, 512]
    - [10, 2583.0]
  - - [64, 512, 8, 128, 64, 64, 64, 512]
    - [3, 2972.0]
  - - [64, 512, 8, 256, 64, 64, 64, 512]
    - [17, 2950.0]
  - - [64, 512, 8, 512, 64, 64, 64, 512]
    - [15, 3151.0]
  - - [128, 32, 8, 32, 128, 128, 128, 32]
    - [2, 278.0]
  - - [128, 32, 8, 64, 128, 128, 128, 32]
    - [0, 421.0]
  - - [128, 32, 8, 128, 128, 128, 128, 32]
    - [2, 587.0]
  - - [128, 32, 8, 256, 128, 128, 128, 32]
    - [2, 728.0]
  - - [128, 32, 8, 512, 128, 128, 128, 32]
    - [16, 833.0]
  - - [128, 64, 8, 32, 128, 128, 128, 64]
    - [2, 541.0]
  - - [128, 64, 8, 64, 128, 128, 128, 64]
    - [0, 839.0]
  - - [128, 64, 8, 128, 128, 128, 128, 64]
    - [3, 1145.0]
  - - [128, 64, 8, 256, 128, 128, 128, 64]
    - [3, 1430.0]
  - - [128, 64, 8, 512, 128, 128, 128, 64]
    - [5, 1612.0]
  - - [128, 128, 8, 32, 128, 128, 128, 128]
    - [2, 1033.0]
  - - [128, 128, 8, 64, 128, 128, 128, 128]
    - [0, 1551.0]
  - - [128, 128, 8, 128, 128, 128, 128, 128]
    - [2, 2006.0]
  - - [128, 128, 8, 256, 128, 128, 128, 128]
    - [17, 2213.0]
  - - [128, 128, 8, 512, 128, 128, 128, 128]
    - [13, 2535.0]
  - - [128, 256, 8, 32, 128, 128, 128, 256]
    - [0, 1783.0]
  - - [128, 256, 8, 64, 128, 128, 128, 256]
    - [3, 2494.0]
  - - [128, 256, 8, 128, 128, 128, 128, 256]
    - [5, 2915.0]
  - - [128, 256, 8, 256, 128, 128, 128, 256]
    - [5, 2961.0]
  - - [128, 256, 8, 512, 128, 128, 128, 256]
    - [6, 2933.0]
  - - [128, 512, 8, 32, 128, 128, 128, 512]
    - [7, 2640.0]
  - - [128, 512, 8, 64, 128, 128, 128, 512]
    - [13, 3466.0]
  - - [128, 512, 8, 128, 128, 128, 128, 512]
    - [13, 3675.0]
  - - [128, 512, 8, 256, 128, 128, 128, 512]
    - [3, 3753.0]
  - - [128, 512, 8, 512, 128, 128, 128, 512]
    - [3, 3836.0]
  - - [256, 32, 8, 32, 256, 256, 256, 32]
    - [2, 536.0]
  - - [256, 32, 8, 64, 256, 256, 256, 32]
    - [0, 833.0]
  - - [256, 32, 8, 128, 256, 256, 256, 32]
    - [12, 1095.0]
  - - [256, 32, 8, 256, 256, 256, 256, 32]
    - [12, 1220.0]
  - - [256, 32, 8, 512, 256, 256, 256, 32]
    - [4, 1404.0]
  - - [256, 64, 8, 32, 256, 256, 256, 64]
    - [0, 1029.0]
  - - [256, 64, 8, 64, 256, 256, 256, 64]
    - [0, 1510.0]
  - - [256, 64, 8, 128, 256, 256, 256, 64]
    - [3, 1985.0]
  - - [256, 64, 8, 256, 256, 256, 256, 64]
    - [13, 2131.0]
  - - [256, 64, 8, 512, 256, 256, 256, 64]
    - [17, 2468.0]
  - - [256, 128, 8, 32, 256, 256, 256, 128]
    - [0, 1688.0]
  - - [256, 128, 8, 64, 256, 256, 256, 128]
    - [3, 2425.0]
  - - [256, 128, 8, 128, 256, 256, 256, 128]
    - [13, 3063.0]
  - - [256, 128, 8, 256, 256, 256, 256, 128]
    - [17, 2903.0]
  - - [256, 128, 8, 512, 256, 256, 256, 128]
    - [14, 3306.0]
  - - [256, 256, 8, 32, 256, 256, 256, 256]
    - [3, 2606.0]
  - - [256, 256, 8, 64, 256, 256, 256, 256]
    - [3, 3458.0]
  - - [256, 256, 8, 128, 256, 256, 256, 256]
    - [3, 3776.0]
  - - [256, 256, 8, 256, 256, 256, 256, 256]
    - [13, 3705.0]
  - - [256, 256, 8, 512, 256, 256, 256, 256]
    - [1, 3879.0]
  - - [256, 512, 8, 32, 256, 256, 256, 512]
    - [7, 3311.0]
  - - [256, 512, 8, 64, 256, 256, 256, 512]
    - [18, 3462.0]
  - - [256, 512, 8, 128, 256, 256, 256, 512]
    - [18, 3558.0]
  - - [256, 512, 8, 256, 256, 256, 256, 512]
    - [3, 4034.0]
  - - [256, 512, 8, 512, 256, 256, 256, 512]
    - [13, 4538.0]
  - - [512, 32, 8, 32, 512, 512, 512, 32]
    - [2, 976.0]
  - - [512, 32, 8, 64, 512, 512, 512, 32]
    - [0, 1469.0]
  - - [512, 32, 8, 128, 512, 512, 512, 32]
    - [12, 1966.0]
  - - [512, 32, 8, 256, 512, 512, 512, 32]
    - [4, 1767.0]
  - - [512, 32, 8, 512, 512, 512, 512, 32]
    - [10, 2155.0]
  - - [512, 64, 8, 32, 512, 512, 512, 64]
    - [0, 1742.0]
  - - [512, 64, 8, 64, 512, 512, 512, 64]
    - [10, 2497.0]
  - - [512, 64, 8, 128, 512, 512, 512, 64]
    - [3, 2953.0]
  - - [512, 64, 8, 256, 512, 512, 512, 64]
    - [5, 2981.0]
  - - [512, 64, 8, 512, 512, 512, 512, 64]
    - [14, 3088.0]
  - - [512, 128, 8, 32, 512, 512, 512, 128]
    - [0, 2683.0]
  - - [512, 128, 8, 64, 512, 512, 512, 128]
    - [13, 3345.0]
  - - [512, 128, 8, 128, 512, 512, 512, 128]
    - [13, 3560.0]
  - - [512, 128, 8, 256, 512, 512, 512, 128]
    - [3, 3577.0]
  - - [512, 128, 8, 512, 512, 512, 512, 128]
    - [1, 3897.0]
  - - [512, 256, 8, 32, 512, 512, 512, 256]
    - [8, 3036.0]
  - - [512, 256, 8, 64, 512, 512, 512, 256]
    - [18, 3349.0]
  - - [512, 256, 8, 128, 512, 512, 512, 256]
    - [11, 3686.0]
  - - [512, 256, 8, 256, 512, 512, 512, 256]
    - [13, 4289.0]
  - - [512, 256, 8, 512, 512, 512, 512, 256]
    - [7, 4418.0]
  - - [512, 512, 8, 32, 512, 512, 512, 512]
    - [19, 2871.0]
  - - [512, 512, 8, 64, 512, 512, 512, 512]
    - [9, 3788.0]
  - - [512, 512, 8, 128, 512, 512, 512, 512]
    - [19, 4410.0]
  - - [512, 512, 8, 256, 512, 512, 512, 512]
    - [19, 5130.0]
  - - [512, 512, 8, 512, 512, 512, 512, 512]
    - [18, 5363.0]
- null
