library/src/blas3/Tensile/Logic/asm_full/vega10/vega10_Cijk_Ailk_Bjlk_HB_GB.yaml
- {MinimumRequiredVersion: 4.26.0}
- vega10
- gfx900
- [Device 6863, Device 6862, Device 687f, Device 6860, Device 6861, 'Vega 10 XTX [Radeon
    SolutionIndex: 0
    SolutionNameMin: Cijk_Ailk_Bjlk_HB_GB_MT32x32x8_SN_GRVW4_LRVW4_TT4_4_VW4_WG8_8_1_WGM1
    SolutionIndex: 1
    SolutionNameMin: Cijk_Ailk_Bjlk_HB_GB_MT64x64x8_SN_GRVW4_LRVW4_TT4_4_VW4_WG16_16_1_WGM1
    SolutionIndex: 2
    SolutionNameMin: Cijk_Ailk_Bjlk_HB_GB_MT32x32x16_SN_GRVW4_LRVW4_TT4_4_VW4_WG8_8_1_WGM1
    SolutionIndex: 3
    SolutionNameMin: Cijk_Ailk_Bjlk_HB_GB_MT64x64x16_SN_GRVW4_LRVW4_TT4_4_VW4_WG16_16_1_WGM1
    SolutionIndex: 4
    SolutionNameMin: Cijk_Ailk_Bjlk_HB_GB_MT128x64x16_SN_GRVW4_LRVW4_TT8_4_VW4_WG16_16_1_WGM1
    SolutionIndex: 5
    SolutionNameMin: Cijk_Ailk_Bjlk_HB_GB_MT64x128x16_SN_GRVW4_LRVW4_TT4_8_VW4_WG16_16_1_WGM1
    SolutionIndex: 6
    SolutionNameMin: Cijk_Ailk_Bjlk_HB_GB_MT32x32x32_SN_GRVW4_LRVW4_TT4_4_VW4_WG8_8_1_WGM1
    SolutionIndex: 7
    SolutionNameMin: Cijk_Ailk_Bjlk_HB_GB_MT64x64x32_SN_GRVW4_LRVW4_TT4_4_VW4_WG16_16_1_WGM1
    SolutionIndex: 8
    SolutionNameMin: Cijk_Ailk_Bjlk_HB_GB_MT32x32x8_SN_GRVW2_LRVW2_TT4_4_VW2_WG8_8_1_WGM1
    SolutionIndex: 9
    SolutionNameMin: Cijk_Ailk_Bjlk_HB_GB_MT64x64x8_SN_GRVW2_LRVW2_TT4_4_VW2_WG16_16_1_WGM1
    SolutionIndex: 10
    SolutionNameMin: Cijk_Ailk_Bjlk_HB_GB_MT128x64x8_SN_GRVW2_LRVW2_TT8_4_VW2_WG16_16_1_WGM1
    SolutionIndex: 11
    SolutionNameMin: Cijk_Ailk_Bjlk_HB_GB_MT64x64x16_SN_GRVW2_LRVW2_TT4_4_VW2_WG16_16_1_WGM1
    SolutionIndex: 12
    SolutionNameMin: Cijk_Ailk_Bjlk_HB_GB_MT64x64x8_SN_GRVW4_LRVW4_TT4_4_VW4_WG16_16_1_WGM8
    SolutionIndex: 13
    SolutionNameMin: Cijk_Ailk_Bjlk_HB_GB_MT128x64x8_SN_GRVW4_LRVW4_TT8_4_VW4_WG16_16_1_WGM8
    SolutionIndex: 14
    SolutionNameMin: Cijk_Ailk_Bjlk_HB_GB_MT64x128x8_SN_GRVW4_LRVW4_TT4_8_VW4_WG16_16_1_WGM8
    SolutionIndex: 15
    SolutionNameMin: Cijk_Ailk_Bjlk_HB_GB_MT32x32x16_SN_GRVW4_LRVW4_TT4_4_VW4_WG8_8_1_WGM8
    SolutionIndex: 16
    SolutionNameMin: Cijk_Ailk_Bjlk_HB_GB_MT64x64x16_SN_GRVW4_LRVW4_TT4_4_VW4_WG16_16_1_WGM8
    SolutionIndex: 17
    SolutionNameMin: Cijk_Ailk_Bjlk_HB_GB_MT128x64x16_SN_GRVW4_LRVW4_TT8_4_VW4_WG16_16_1_WGM8
    SolutionIndex: 18
    SolutionNameMin: Cijk_Ailk_Bjlk_HB_GB_MT128x128x16_SN_GRVW8_LRVW8_TT8_8_VW8_WG16_16_1_WGM8
    SolutionIndex: 19
    SolutionNameMin: Cijk_Ailk_Bjlk_HB_GB_MT64x64x32_SN_GRVW4_LRVW4_TT4_4_VW4_WG16_16_1_WGM8
    SolutionIndex: 20
    SolutionNameMin: Cijk_Ailk_Bjlk_HB_GB_MT32x32x8_SN_GRVW2_LRVW2_TT4_4_VW2_WG8_8_1_WGM8
- - - [32, 32, 8, 32, 32, 32, 32, 32]
    - [1, 74.0]
  - - [32, 32, 8, 64, 32, 32, 32, 32]
    - [0, 119.0]
  - - [32, 32, 8, 128, 32, 32, 32, 32]
    - [0, 170.0]
  - - [32, 32, 8, 256, 32, 32, 32, 32]
    - [2, 221.0]
  - - [32, 32, 8, 512, 32, 32, 32, 32]
    - [15, 267.0]
  - - [32, 64, 8, 32, 32, 32, 32, 64]
    - [8, 157.0]
  - - [32, 64, 8, 64, 32, 32, 32, 64]
    - [0, 246.0]
  - - [32, 64, 8, 128, 32, 32, 32, 64]
    - [15, 352.0]
  - - [32, 64, 8, 256, 32, 32, 32, 64]
    - [15, 461.0]
  - - [32, 64, 8, 512, 32, 32, 32, 64]
    - [15, 541.0]
  - - [32, 128, 8, 32, 32, 32, 32, 128]
    - [8, 321.0]
  - - [32, 128, 8, 64, 32, 32, 32, 128]
    - [0, 499.0]
  - - [32, 128, 8, 128, 32, 32, 32, 128]
    - [2, 713.0]
  - - [32, 128, 8, 256, 32, 32, 32, 128]
    - [2, 924.0]
  - - [32, 128, 8, 512, 32, 32, 32, 128]
    - [15, 1090.0]
  - - [32, 256, 8, 32, 32, 32, 32, 256]
    - [8, 633.0]
  - - [32, 256, 8, 64, 32, 32, 32, 256]
    - [0, 985.0]
  - - [32, 256, 8, 128, 32, 32, 32, 256]
    - [2, 1428.0]
  - - [32, 256, 8, 256, 32, 32, 32, 256]
    - [2, 1738.0]
  - - [32, 256, 8, 512, 32, 32, 32, 256]
    - [6, 1919.0]
  - - [32, 512, 8, 32, 32, 32, 32, 512]
    - [8, 1192.0]
  - - [32, 512, 8, 64, 32, 32, 32, 512]
    - [0, 1792.0]
  - - [32, 512, 8, 128, 32, 32, 32, 512]
    - [15, 2456.0]
  - - [32, 512, 8, 256, 32, 32, 32, 512]
    - [2, 2820.0]
  - - [32, 512, 8, 512, 32, 32, 32, 512]
    - [15, 2889.0]
  - - [64, 32, 8, 32, 64, 64, 64, 32]
    - [8, 160.0]
  - - [64, 32, 8, 64, 64, 64, 64, 32]
    - [0, 244.0]
  - - [64, 32, 8, 128, 64, 64, 64, 32]
    - [2, 352.0]
  - - [64, 32, 8, 256, 64, 64, 64, 32]
    - [15, 458.0]
  - - [64, 32, 8, 512, 64, 64, 64, 32]
    - [2, 539.0]
  - - [64, 64, 8, 32, 64, 64, 64, 64]
    - [8, 320.0]
  - - [64, 64, 8, 64, 64, 64, 64, 64]
    - [0, 499.0]
  - - [64, 64, 8, 128, 64, 64, 64, 64]
    - [2, 717.0]
  - - [64, 64, 8, 256, 64, 64, 64, 64]
    - [15, 924.0]
  - - [64, 64, 8, 512, 64, 64, 64, 64]
    - [2, 1088.0]
  - - [64, 128, 8, 32, 64, 64, 64, 128]
    - [12, 643.0]
  - - [64, 128, 8, 64, 64, 64, 64, 128]
    - [12, 997.0]
  - - [64, 128, 8, 128, 64, 64, 64, 128]
    - [2, 1444.0]
  - - [64, 128, 8, 256, 64, 64, 64, 128]
    - [16, 1768.0]
  - - [64, 128, 8, 512, 64, 64, 64, 128]
    - [7, 2107.0]
  - - [64, 256, 8, 32, 64, 64, 64, 256]
    - [1, 1284.0]
  - - [64, 256, 8, 64, 64, 64, 64, 256]
    - [1, 1980.0]
  - - [64, 256, 8, 128, 64, 64, 64, 256]
    - [1, 2696.0]
  - - [64, 256, 8, 256, 64, 64, 64, 256]
    - [16, 3247.0]
  - - [64, 256, 8, 512, 64, 64, 64, 256]
    - [7, 3479.0]
  - - [64, 512, 8, 32, 64, 64, 64, 512]
    - [1, 2379.0]
  - - [64, 512, 8, 64, 64, 64, 64, 512]
    - [1, 3484.0]
  - - [64, 512, 8, 128, 64, 64, 64, 512]
    - [19, 4298.0]
  - - [64, 512, 8, 256, 64, 64, 64, 512]
    - [19, 5317.0]
  - - [64, 512, 8, 512, 64, 64, 64, 512]
    - [7, 4806.0]
  - - [128, 32, 8, 32, 128, 128, 128, 32]
    - [8, 324.0]
  - - [128, 32, 8, 64, 128, 128, 128, 32]
    - [0, 496.0]
  - - [128, 32, 8, 128, 128, 128, 128, 32]
    - [2, 710.0]
  - - [128, 32, 8, 256, 128, 128, 128, 32]
    - [2, 927.0]
  - - [128, 32, 8, 512, 128, 128, 128, 32]
    - [15, 1091.0]
  - - [128, 64, 8, 32, 128, 128, 128, 64]
    - [12, 642.0]
  - - [128, 64, 8, 64, 128, 128, 128, 64]
    - [12, 1006.0]
  - - [128, 64, 8, 128, 128, 128, 128, 64]
    - [2, 1430.0]
  - - [128, 64, 8, 256, 128, 128, 128, 64]
    - [16, 1779.0]
  - - [128, 64, 8, 512, 128, 128, 128, 64]
    - [19, 2120.0]
  - - [128, 128, 8, 32, 128, 128, 128, 128]
    - [12, 1290.0]
  - - [128, 128, 8, 64, 128, 128, 128, 128]
    - [1, 2011.0]
  - - [128, 128, 8, 128, 128, 128, 128, 128]
    - [1, 2696.0]
  - - [128, 128, 8, 256, 128, 128, 128, 128]
    - [16, 3238.0]
  - - [128, 128, 8, 512, 128, 128, 128, 128]
    - [7, 3539.0]
  - - [128, 256, 8, 32, 128, 128, 128, 256]
    - [1, 2335.0]
  - - [128, 256, 8, 64, 128, 128, 128, 256]
    - [1, 3490.0]
  - - [128, 256, 8, 128, 128, 128, 128, 256]
    - [3, 4339.0]
  - - [128, 256, 8, 256, 128, 128, 128, 256]
    - [19, 5376.0]
  - - [128, 256, 8, 512, 128, 128, 128, 256]
    - [19, 4738.0]
  - - [128, 512, 8, 32, 128, 128, 128, 512]
    - [1, 3987.0]
  - - [128, 512, 8, 64, 128, 128, 128, 512]
    - [1, 5883.0]
  - - [128, 512, 8, 128, 128, 128, 128, 512]
    - [3, 6947.0]
  - - [128, 512, 8, 256, 128, 128, 128, 512]
    - [3, 6004.0]
  - - [128, 512, 8, 512, 128, 128, 128, 512]
    - [12, 6469.0]
  - - [256, 32, 8, 32, 256, 256, 256, 32]
    - [20, 622.0]
  - - [256, 32, 8, 64, 256, 256, 256, 32]
    - [0, 993.0]
  - - [256, 32, 8, 128, 256, 256, 256, 32]
    - [15, 1403.0]
  - - [256, 32, 8, 256, 256, 256, 256, 32]
    - [15, 1763.0]
  - - [256, 32, 8, 512, 256, 256, 256, 32]
    - [6, 1890.0]
  - - [256, 64, 8, 32, 256, 256, 256, 64]
    - [1, 1258.0]
  - - [256, 64, 8, 64, 256, 256, 256, 64]
    - [1, 2004.0]
  - - [256, 64, 8, 128, 256, 256, 256, 64]
    - [1, 2674.0]
  - - [256, 64, 8, 256, 256, 256, 256, 64]
    - [3, 3235.0]
  - - [256, 64, 8, 512, 256, 256, 256, 64]
    - [19, 3486.0]
  - - [256, 128, 8, 32, 256, 256, 256, 128]
    - [1, 2364.0]
  - - [256, 128, 8, 64, 256, 256, 256, 128]
    - [1, 3479.0]
  - - [256, 128, 8, 128, 256, 256, 256, 128]
    - [1, 4306.0]
  - - [256, 128, 8, 256, 256, 256, 256, 128]
    - [19, 5364.0]
  - - [256, 128, 8, 512, 256, 256, 256, 128]
    - [3, 4616.0]
  - - [256, 256, 8, 32, 256, 256, 256, 256]
    - [1, 3994.0]
  - - [256, 256, 8, 64, 256, 256, 256, 256]
    - [9, 5438.0]
  - - [256, 256, 8, 128, 256, 256, 256, 256]
    - [1, 7341.0]
  - - [256, 256, 8, 256, 256, 256, 256, 256]
    - [16, 6280.0]
  - - [256, 256, 8, 512, 256, 256, 256, 256]
    - [7, 6509.0]
  - - [256, 512, 8, 32, 256, 256, 256, 512]
    - [1, 5999.0]
  - - [256, 512, 8, 64, 256, 256, 256, 512]
    - [1, 8039.0]
  - - [256, 512, 8, 128, 256, 256, 256, 512]
    - [13, 7531.0]
  - - [256, 512, 8, 256, 256, 256, 256, 512]
    - [4, 7562.0]
  - - [256, 512, 8, 512, 256, 256, 256, 512]
    - [13, 8439.0]
  - - [512, 32, 8, 32, 512, 512, 512, 32]
    - [2, 1200.0]
  - - [512, 32, 8, 64, 512, 512, 512, 32]
    - [2, 1866.0]
  - - [512, 32, 8, 128, 512, 512, 512, 32]
    - [2, 2661.0]
  - - [512, 32, 8, 256, 512, 512, 512, 32]
    - [2, 3103.0]
  - - [512, 32, 8, 512, 512, 512, 512, 32]
    - [2, 3119.0]
  - - [512, 64, 8, 32, 512, 512, 512, 64]
    - [12, 2311.0]
  - - [512, 64, 8, 64, 512, 512, 512, 64]
    - [1, 3411.0]
  - - [512, 64, 8, 128, 512, 512, 512, 64]
    - [15, 4498.0]
  - - [512, 64, 8, 256, 512, 512, 512, 64]
    - [19, 5162.0]
  - - [512, 64, 8, 512, 512, 512, 512, 64]
    - [7, 4595.0]
  - - [512, 128, 8, 32, 512, 512, 512, 128]
    - [11, 3781.0]
  - - [512, 128, 8, 64, 512, 512, 512, 128]
    - [12, 5497.0]
  - - [512, 128, 8, 128, 512, 512, 512, 128]
    - [12, 7039.0]
  - - [512, 128, 8, 256, 512, 512, 512, 128]
    - [19, 5910.0]
  - - [512, 128, 8, 512, 512, 512, 512, 128]
    - [12, 6254.0]
  - - [512, 256, 8, 32, 512, 512, 512, 256]
    - [12, 5968.0]
  - - [512, 256, 8, 64, 512, 512, 512, 256]
    - [16, 7562.0]
  - - [512, 256, 8, 128, 512, 512, 512, 256]
    - [13, 6921.0]
  - - [512, 256, 8, 256, 512, 512, 512, 256]
    - [7, 6974.0]
  - - [512, 256, 8, 512, 512, 512, 512, 256]
    - [17, 8428.0]
  - - [512, 512, 8, 32, 512, 512, 512, 512]
    - [10, 6522.0]
  - - [512, 512, 8, 64, 512, 512, 512, 512]
    - [10, 7518.0]
  - - [512, 512, 8, 128, 512, 512, 512, 512]
    - [18, 7248.0]
  - - [512, 512, 8, 256, 512, 512, 512, 512]
    - [14, 9183.0]
  - - [512, 512, 8, 512, 512, 512, 512, 512]
    - [5, 9689.0]
- null
