library/src/blas3/Tensile/Logic/asm_full/vega10/vega10_Cijk_Alik_Bjlk_DB_GB.yaml
- {MinimumRequiredVersion: 4.26.0}
- vega10
- gfx900
- [Device 6863, Device 6862, Device 687f, Device 6860, Device 6861, 'Vega 10 XTX [Radeon
    SolutionIndex: 0
    SolutionNameMin: Cijk_Alik_Bjlk_DB_GB_MT32x32x8_SN_AMAS3_GRVW2_LRVW2_TT4_4_VW2_WG8_8_1_WGM1
    SolutionIndex: 1
    SolutionNameMin: Cijk_Alik_Bjlk_DB_GB_MT64x32x8_SN_AMAS3_GRVW2_LRVW2_TT8_4_VW2_WG8_8_1_WGM1
    SolutionIndex: 2
    SolutionNameMin: Cijk_Alik_Bjlk_DB_GB_MT64x64x8_SN_AMAS3_GRVW2_LRVW2_TT4_4_VW2_WG16_16_1_WGM1
    SolutionIndex: 3
    SolutionNameMin: Cijk_Alik_Bjlk_DB_GB_MT128x64x8_SN_AMAS3_GRVW2_LRVW2_TT8_4_VW2_WG16_16_1_WGM1
    SolutionIndex: 4
    SolutionNameMin: Cijk_Alik_Bjlk_DB_GB_MT64x128x8_SN_AMAS3_GRVW2_LRVW2_TT4_8_VW2_WG16_16_1_WGM1
    SolutionIndex: 5
    SolutionNameMin: Cijk_Alik_Bjlk_DB_GB_MT32x32x16_SN_AMAS3_GRVW2_LRVW2_TT4_4_VW2_WG8_8_1_WGM1
    SolutionIndex: 6
    SolutionNameMin: Cijk_Alik_Bjlk_DB_GB_MT64x64x16_SN_AMAS3_GRVW2_LRVW2_TT4_4_VW2_WG16_16_1_WGM1
    SolutionIndex: 7
    SolutionNameMin: Cijk_Alik_Bjlk_DB_GB_MT64x64x32_SN_AMAS3_GRVW2_LRVW2_TT4_4_VW2_WG16_16_1_WGM1
    SolutionIndex: 8
    SolutionNameMin: Cijk_Alik_Bjlk_DB_GB_MT32x32x8_SN_AMAS0_GRVW1_LRVW1_TT4_4_VW1_WG8_8_1_WGM1
    SolutionIndex: 9
    SolutionNameMin: Cijk_Alik_Bjlk_DB_GB_MT64x64x8_SN_AMAS0_GRVW1_LRVW1_TT4_4_VW1_WG16_16_1_WGM1
    SolutionIndex: 10
    SolutionNameMin: Cijk_Alik_Bjlk_DB_GB_MT64x128x8_SN_AMAS0_GRVW1_LRVW1_TT4_8_VW1_WG16_16_1_WGM1
    SolutionIndex: 11
    SolutionNameMin: Cijk_Alik_Bjlk_DB_GB_MT32x32x8_SN_AMAS3_GRVW2_LRVW2_TT4_4_VW2_WG8_8_1_WGM8
    SolutionIndex: 12
    SolutionNameMin: Cijk_Alik_Bjlk_DB_GB_MT64x64x8_SN_AMAS3_GRVW2_LRVW2_TT4_4_VW2_WG16_16_1_WGM8
    SolutionIndex: 13
    SolutionNameMin: Cijk_Alik_Bjlk_DB_GB_MT128x64x8_SN_AMAS3_GRVW2_LRVW2_TT8_4_VW2_WG16_16_1_WGM8
    SolutionIndex: 14
    SolutionNameMin: Cijk_Alik_Bjlk_DB_GB_MT64x128x8_SN_AMAS3_GRVW2_LRVW2_TT4_8_VW2_WG16_16_1_WGM8
    SolutionIndex: 15
    SolutionNameMin: Cijk_Alik_Bjlk_DB_GB_MT32x32x16_SN_AMAS3_GRVW2_LRVW2_TT4_4_VW2_WG8_8_1_WGM8
    SolutionIndex: 16
    SolutionNameMin: Cijk_Alik_Bjlk_DB_GB_MT64x64x16_SN_AMAS3_GRVW2_LRVW2_TT4_4_VW2_WG16_16_1_WGM8
    SolutionIndex: 17
    SolutionNameMin: Cijk_Alik_Bjlk_DB_GB_MT64x128x16_SN_AMAS3_GRVW2_LRVW2_TT4_8_VW2_WG16_16_1_WGM8
    SolutionIndex: 18
    SolutionNameMin: Cijk_Alik_Bjlk_DB_GB_MT32x32x8_SN_AMAS0_GRVW1_LRVW1_TT4_4_VW1_WG8_8_1_WGM8
    SolutionIndex: 19
    SolutionNameMin: Cijk_Alik_Bjlk_DB_GB_MT64x64x8_SN_AMAS0_GRVW1_LRVW1_TT4_4_VW1_WG16_16_1_WGM8
    SolutionIndex: 20
    SolutionNameMin: Cijk_Alik_Bjlk_DB_GB_MT64x128x8_SN_AMAS0_GRVW1_LRVW1_TT4_8_VW1_WG16_16_1_WGM8
- - - [32, 32, 8, 32, 32, 32, 32, 32]
    - [0, 18.0]
  - - [32, 32, 8, 64, 32, 32, 64, 32]
    - [0, 20.0]
  - - [32, 32, 8, 128, 32, 32, 128, 32]
    - [0, 21.0]
  - - [32, 32, 8, 256, 32, 32, 256, 32]
    - [0, 22.0]
  - - [32, 32, 8, 512, 32, 32, 512, 32]
    - [0, 22.0]
  - - [32, 64, 8, 32, 32, 32, 32, 64]
    - [0, 37.0]
  - - [32, 64, 8, 64, 32, 32, 64, 64]
    - [5, 41.0]
  - - [32, 64, 8, 128, 32, 32, 128, 64]
    - [0, 43.0]
  - - [32, 64, 8, 256, 32, 32, 256, 64]
    - [0, 44.0]
  - - [32, 64, 8, 512, 32, 32, 512, 64]
    - [5, 45.0]
  - - [32, 128, 8, 32, 32, 32, 32, 128]
    - [0, 73.0]
  - - [32, 128, 8, 64, 32, 32, 64, 128]
    - [0, 81.0]
  - - [32, 128, 8, 128, 32, 32, 128, 128]
    - [0, 85.0]
  - - [32, 128, 8, 256, 32, 32, 256, 128]
    - [5, 88.0]
  - - [32, 128, 8, 512, 32, 32, 512, 128]
    - [0, 89.0]
  - - [32, 256, 8, 32, 32, 32, 32, 256]
    - [0, 144.0]
  - - [32, 256, 8, 64, 32, 32, 64, 256]
    - [0, 160.0]
  - - [32, 256, 8, 128, 32, 32, 128, 256]
    - [0, 169.0]
  - - [32, 256, 8, 256, 32, 32, 256, 256]
    - [0, 170.0]
  - - [32, 256, 8, 512, 32, 32, 512, 256]
    - [0, 172.0]
  - - [32, 512, 8, 32, 32, 32, 32, 512]
    - [5, 265.0]
  - - [32, 512, 8, 64, 32, 32, 64, 512]
    - [11, 292.0]
  - - [32, 512, 8, 128, 32, 32, 128, 512]
    - [11, 317.0]
  - - [32, 512, 8, 256, 32, 32, 256, 512]
    - [0, 336.0]
  - - [32, 512, 8, 512, 32, 32, 512, 512]
    - [11, 333.0]
  - - [64, 32, 8, 32, 64, 64, 32, 32]
    - [11, 37.0]
  - - [64, 32, 8, 64, 64, 64, 64, 32]
    - [5, 41.0]
  - - [64, 32, 8, 128, 64, 64, 128, 32]
    - [0, 43.0]
  - - [64, 32, 8, 256, 64, 64, 256, 32]
    - [0, 44.0]
  - - [64, 32, 8, 512, 64, 64, 512, 32]
    - [5, 45.0]
  - - [64, 64, 8, 32, 64, 64, 32, 64]
    - [0, 73.0]
  - - [64, 64, 8, 64, 64, 64, 64, 64]
    - [0, 81.0]
  - - [64, 64, 8, 128, 64, 64, 128, 64]
    - [0, 85.0]
  - - [64, 64, 8, 256, 64, 64, 256, 64]
    - [0, 88.0]
  - - [64, 64, 8, 512, 64, 64, 512, 64]
    - [0, 89.0]
  - - [64, 128, 8, 32, 64, 64, 32, 128]
    - [0, 145.0]
  - - [64, 128, 8, 64, 64, 64, 64, 128]
    - [0, 161.0]
  - - [64, 128, 8, 128, 64, 64, 128, 128]
    - [0, 170.0]
  - - [64, 128, 8, 256, 64, 64, 256, 128]
    - [2, 174.0]
  - - [64, 128, 8, 512, 64, 64, 512, 128]
    - [6, 176.0]
  - - [64, 256, 8, 32, 64, 64, 32, 256]
    - [12, 282.0]
  - - [64, 256, 8, 64, 64, 64, 64, 256]
    - [2, 316.0]
  - - [64, 256, 8, 128, 64, 64, 128, 256]
    - [12, 335.0]
  - - [64, 256, 8, 256, 64, 64, 256, 256]
    - [2, 339.0]
  - - [64, 256, 8, 512, 64, 64, 512, 256]
    - [6, 340.0]
  - - [64, 512, 8, 32, 64, 64, 32, 512]
    - [10, 300.0]
  - - [64, 512, 8, 64, 64, 64, 64, 512]
    - [20, 324.0]
  - - [64, 512, 8, 128, 64, 64, 128, 512]
    - [4, 342.0]
  - - [64, 512, 8, 256, 64, 64, 256, 512]
    - [14, 340.0]
  - - [64, 512, 8, 512, 64, 64, 512, 512]
    - [17, 342.0]
  - - [128, 32, 8, 32, 128, 128, 32, 32]
    - [0, 73.0]
  - - [128, 32, 8, 64, 128, 128, 64, 32]
    - [0, 81.0]
  - - [128, 32, 8, 128, 128, 128, 128, 32]
    - [5, 86.0]
  - - [128, 32, 8, 256, 128, 128, 256, 32]
    - [0, 88.0]
  - - [128, 32, 8, 512, 128, 128, 512, 32]
    - [0, 88.0]
  - - [128, 64, 8, 32, 128, 128, 32, 64]
    - [0, 144.0]
  - - [128, 64, 8, 64, 128, 128, 64, 64]
    - [0, 161.0]
  - - [128, 64, 8, 128, 128, 128, 128, 64]
    - [0, 170.0]
  - - [128, 64, 8, 256, 128, 128, 256, 64]
    - [7, 174.0]
  - - [128, 64, 8, 512, 128, 128, 512, 64]
    - [16, 174.0]
  - - [128, 128, 8, 32, 128, 128, 32, 128]
    - [12, 280.0]
  - - [128, 128, 8, 64, 128, 128, 64, 128]
    - [2, 313.0]
  - - [128, 128, 8, 128, 128, 128, 128, 128]
    - [12, 334.0]
  - - [128, 128, 8, 256, 128, 128, 256, 128]
    - [6, 336.0]
  - - [128, 128, 8, 512, 128, 128, 512, 128]
    - [16, 335.0]
  - - [128, 256, 8, 32, 128, 128, 32, 256]
    - [14, 306.0]
  - - [128, 256, 8, 64, 128, 128, 64, 256]
    - [10, 327.0]
  - - [128, 256, 8, 128, 128, 128, 128, 256]
    - [4, 339.0]
  - - [128, 256, 8, 256, 128, 128, 256, 256]
    - [3, 342.0]
  - - [128, 256, 8, 512, 128, 128, 512, 256]
    - [19, 341.0]
  - - [128, 512, 8, 32, 128, 128, 32, 512]
    - [2, 379.0]
  - - [128, 512, 8, 64, 128, 128, 64, 512]
    - [2, 422.0]
  - - [128, 512, 8, 128, 128, 128, 128, 512]
    - [9, 440.0]
  - - [128, 512, 8, 256, 128, 128, 256, 512]
    - [2, 446.0]
  - - [128, 512, 8, 512, 128, 128, 512, 512]
    - [2, 446.0]
  - - [256, 32, 8, 32, 256, 256, 32, 32]
    - [5, 142.0]
  - - [256, 32, 8, 64, 256, 256, 64, 32]
    - [18, 156.0]
  - - [256, 32, 8, 128, 256, 256, 128, 32]
    - [5, 168.0]
  - - [256, 32, 8, 256, 256, 256, 256, 32]
    - [5, 172.0]
  - - [256, 32, 8, 512, 256, 256, 512, 32]
    - [15, 172.0]
  - - [256, 64, 8, 32, 256, 256, 32, 64]
    - [19, 276.0]
  - - [256, 64, 8, 64, 256, 256, 64, 64]
    - [2, 312.0]
  - - [256, 64, 8, 128, 256, 256, 128, 64]
    - [6, 333.0]
  - - [256, 64, 8, 256, 256, 256, 256, 64]
    - [12, 337.0]
  - - [256, 64, 8, 512, 256, 256, 512, 64]
    - [2, 336.0]
  - - [256, 128, 8, 32, 256, 256, 32, 128]
    - [14, 304.0]
  - - [256, 128, 8, 64, 256, 256, 64, 128]
    - [4, 330.0]
  - - [256, 128, 8, 128, 256, 256, 128, 128]
    - [1, 332.0]
  - - [256, 128, 8, 256, 256, 256, 256, 128]
    - [3, 340.0]
  - - [256, 128, 8, 512, 256, 256, 512, 128]
    - [2, 339.0]
  - - [256, 256, 8, 32, 256, 256, 32, 256]
    - [9, 371.0]
  - - [256, 256, 8, 64, 256, 256, 64, 256]
    - [2, 421.0]
  - - [256, 256, 8, 128, 256, 256, 128, 256]
    - [12, 436.0]
  - - [256, 256, 8, 256, 256, 256, 256, 256]
    - [12, 446.0]
  - - [256, 256, 8, 512, 256, 256, 512, 256]
    - [12, 442.0]
  - - [256, 512, 8, 32, 256, 256, 32, 512]
    - [2, 468.0]
  - - [256, 512, 8, 64, 256, 256, 64, 512]
    - [19, 495.0]
  - - [256, 512, 8, 128, 256, 256, 128, 512]
    - [19, 515.0]
  - - [256, 512, 8, 256, 256, 256, 256, 512]
    - [0, 524.0]
  - - [256, 512, 8, 512, 256, 256, 512, 512]
    - [9, 523.0]
  - - [512, 32, 8, 32, 512, 512, 32, 32]
    - [8, 261.0]
  - - [512, 32, 8, 64, 512, 512, 64, 32]
    - [0, 298.0]
  - - [512, 32, 8, 128, 512, 512, 128, 32]
    - [0, 314.0]
  - - [512, 32, 8, 256, 512, 512, 256, 32]
    - [5, 325.0]
  - - [512, 32, 8, 512, 512, 512, 512, 32]
    - [5, 327.0]
  - - [512, 64, 8, 32, 512, 512, 32, 64]
    - [13, 296.0]
  - - [512, 64, 8, 64, 512, 512, 64, 64]
    - [3, 322.0]
  - - [512, 64, 8, 128, 512, 512, 128, 64]
    - [3, 331.0]
  - - [512, 64, 8, 256, 512, 512, 256, 64]
    - [19, 335.0]
  - - [512, 64, 8, 512, 512, 512, 512, 64]
    - [19, 337.0]
  - - [512, 128, 8, 32, 512, 512, 32, 128]
    - [9, 382.0]
  - - [512, 128, 8, 64, 512, 512, 64, 128]
    - [12, 412.0]
  - - [512, 128, 8, 128, 512, 512, 128, 128]
    - [9, 433.0]
  - - [512, 128, 8, 256, 512, 512, 256, 128]
    - [12, 443.0]
  - - [512, 128, 8, 512, 512, 512, 512, 128]
    - [12, 437.0]
  - - [512, 256, 8, 32, 512, 512, 32, 256]
    - [12, 459.0]
  - - [512, 256, 8, 64, 512, 512, 64, 256]
    - [2, 501.0]
  - - [512, 256, 8, 128, 512, 512, 128, 256]
    - [12, 523.0]
  - - [512, 256, 8, 256, 512, 512, 256, 256]
    - [0, 527.0]
  - - [512, 256, 8, 512, 512, 512, 512, 256]
    - [12, 524.0]
  - - [512, 512, 8, 32, 512, 512, 32, 512]
    - [9, 474.0]
  - - [512, 512, 8, 64, 512, 512, 64, 512]
    - [2, 518.0]
  - - [512, 512, 8, 128, 512, 512, 128, 512]
    - [2, 534.0]
  - - [512, 512, 8, 256, 512, 512, 256, 512]
    - [2, 526.0]
  - - [512, 512, 8, 512, 512, 512, 512, 512]
    - [6, 521.0]
- null
