library/src/blas3/Tensile/Logic/asm_full/vega10/vega10_Cijk_Alik_Bljk_DB_GB.yaml
- {MinimumRequiredVersion: 4.26.0}
- vega10
- gfx900
- [Device 6863, Device 6862, Device 687f, Device 6860, Device 6861, 'Vega 10 XTX [Radeon
    SolutionIndex: 0
    SolutionNameMin: Cijk_Alik_Bljk_DB_GB_MT32x32x8_SN_AMAS3_GRVW2_LRVW2_TT4_4_VW2_WG8_8_1_WGM1
    SolutionIndex: 1
    SolutionNameMin: Cijk_Alik_Bljk_DB_GB_MT64x32x8_SN_AMAS3_GRVW2_LRVW2_TT8_4_VW2_WG8_8_1_WGM1
    SolutionIndex: 2
    SolutionNameMin: Cijk_Alik_Bljk_DB_GB_MT32x64x8_SN_AMAS3_GRVW2_LRVW2_TT4_8_VW2_WG8_8_1_WGM1
    SolutionIndex: 3
    SolutionNameMin: Cijk_Alik_Bljk_DB_GB_MT64x64x8_SN_AMAS3_GRVW2_LRVW2_TT4_4_VW2_WG16_16_1_WGM1
    SolutionIndex: 4
    SolutionNameMin: Cijk_Alik_Bljk_DB_GB_MT128x64x8_SN_AMAS3_GRVW2_LRVW2_TT8_4_VW2_WG16_16_1_WGM1
    SolutionIndex: 5
    SolutionNameMin: Cijk_Alik_Bljk_DB_GB_MT64x128x8_SN_AMAS3_GRVW2_LRVW2_TT4_8_VW2_WG16_16_1_WGM1
    SolutionIndex: 6
    SolutionNameMin: Cijk_Alik_Bljk_DB_GB_MT32x32x16_SN_AMAS3_GRVW2_LRVW2_TT4_4_VW2_WG8_8_1_WGM1
    SolutionIndex: 7
    SolutionNameMin: Cijk_Alik_Bljk_DB_GB_MT64x64x16_SN_AMAS3_GRVW2_LRVW2_TT4_4_VW2_WG16_16_1_WGM1
    SolutionIndex: 8
    SolutionNameMin: Cijk_Alik_Bljk_DB_GB_MT64x64x32_SN_AMAS3_GRVW2_LRVW2_TT4_4_VW2_WG16_16_1_WGM1
    SolutionIndex: 9
    SolutionNameMin: Cijk_Alik_Bljk_DB_GB_MT32x32x8_SN_AMAS0_GRVW1_LRVW1_TT4_4_VW1_WG8_8_1_WGM1
    SolutionIndex: 10
    SolutionNameMin: Cijk_Alik_Bljk_DB_GB_MT64x64x8_SN_AMAS0_GRVW1_LRVW1_TT4_4_VW1_WG16_16_1_WGM1
    SolutionIndex: 11
    SolutionNameMin: Cijk_Alik_Bljk_DB_GB_MT32x32x8_SN_AMAS3_GRVW2_LRVW2_TT4_4_VW2_WG8_8_1_WGM8
    SolutionIndex: 12
    SolutionNameMin: Cijk_Alik_Bljk_DB_GB_MT64x64x8_SN_AMAS3_GRVW2_LRVW2_TT4_4_VW2_WG16_16_1_WGM8
    SolutionIndex: 13
    SolutionNameMin: Cijk_Alik_Bljk_DB_GB_MT128x64x8_SN_AMAS3_GRVW2_LRVW2_TT8_4_VW2_WG16_16_1_WGM8
    SolutionIndex: 14
    SolutionNameMin: Cijk_Alik_Bljk_DB_GB_MT64x128x8_SN_AMAS3_GRVW2_LRVW2_TT4_8_VW2_WG16_16_1_WGM8
    SolutionIndex: 15
    SolutionNameMin: Cijk_Alik_Bljk_DB_GB_MT32x32x16_SN_AMAS3_GRVW2_LRVW2_TT4_4_VW2_WG8_8_1_WGM8
    SolutionIndex: 16
    SolutionNameMin: Cijk_Alik_Bljk_DB_GB_MT64x64x16_SN_AMAS3_GRVW2_LRVW2_TT4_4_VW2_WG16_16_1_WGM8
    SolutionIndex: 17
    SolutionNameMin: Cijk_Alik_Bljk_DB_GB_MT64x128x16_SN_AMAS3_GRVW2_LRVW2_TT4_8_VW2_WG16_16_1_WGM8
    SolutionIndex: 18
    SolutionNameMin: Cijk_Alik_Bljk_DB_GB_MT64x64x32_SN_AMAS3_GRVW2_LRVW2_TT4_4_VW2_WG16_16_1_WGM8
    SolutionIndex: 19
    SolutionNameMin: Cijk_Alik_Bljk_DB_GB_MT32x32x8_SN_AMAS0_GRVW1_LRVW1_TT4_4_VW1_WG8_8_1_WGM8
    SolutionIndex: 20
    SolutionNameMin: Cijk_Alik_Bljk_DB_GB_MT64x64x8_SN_AMAS0_GRVW1_LRVW1_TT4_4_VW1_WG16_16_1_WGM8
- - - [32, 32, 8, 32, 32, 32, 32, 32]
    - [0, 18.0]
  - - [32, 32, 8, 64, 32, 32, 64, 64]
    - [0, 20.0]
  - - [32, 32, 8, 128, 32, 32, 128, 128]
    - [0, 21.0]
  - - [32, 32, 8, 256, 32, 32, 256, 256]
    - [0, 22.0]
  - - [32, 32, 8, 512, 32, 32, 512, 512]
    - [0, 22.0]
  - - [32, 64, 8, 32, 32, 32, 32, 32]
    - [0, 37.0]
  - - [32, 64, 8, 64, 32, 32, 64, 64]
    - [0, 41.0]
  - - [32, 64, 8, 128, 32, 32, 128, 128]
    - [0, 43.0]
  - - [32, 64, 8, 256, 32, 32, 256, 256]
    - [0, 44.0]
  - - [32, 64, 8, 512, 32, 32, 512, 512]
    - [0, 44.0]
  - - [32, 128, 8, 32, 32, 32, 32, 32]
    - [0, 74.0]
  - - [32, 128, 8, 64, 32, 32, 64, 64]
    - [0, 81.0]
  - - [32, 128, 8, 128, 32, 32, 128, 128]
    - [0, 85.0]
  - - [32, 128, 8, 256, 32, 32, 256, 256]
    - [0, 87.0]
  - - [32, 128, 8, 512, 32, 32, 512, 512]
    - [0, 88.0]
  - - [32, 256, 8, 32, 32, 32, 32, 32]
    - [0, 146.0]
  - - [32, 256, 8, 64, 32, 32, 64, 64]
    - [0, 161.0]
  - - [32, 256, 8, 128, 32, 32, 128, 128]
    - [0, 169.0]
  - - [32, 256, 8, 256, 32, 32, 256, 256]
    - [0, 169.0]
  - - [32, 256, 8, 512, 32, 32, 512, 512]
    - [7, 163.0]
  - - [32, 512, 8, 32, 32, 32, 32, 32]
    - [6, 265.0]
  - - [32, 512, 8, 64, 32, 32, 64, 64]
    - [11, 303.0]
  - - [32, 512, 8, 128, 32, 32, 128, 128]
    - [11, 315.0]
  - - [32, 512, 8, 256, 32, 32, 256, 256]
    - [9, 305.0]
  - - [32, 512, 8, 512, 32, 32, 512, 512]
    - [6, 270.0]
  - - [64, 32, 8, 32, 64, 64, 32, 32]
    - [6, 37.0]
  - - [64, 32, 8, 64, 64, 64, 64, 64]
    - [0, 41.0]
  - - [64, 32, 8, 128, 64, 64, 128, 128]
    - [0, 43.0]
  - - [64, 32, 8, 256, 64, 64, 256, 256]
    - [0, 44.0]
  - - [64, 32, 8, 512, 64, 64, 512, 512]
    - [0, 44.0]
  - - [64, 64, 8, 32, 64, 64, 32, 32]
    - [0, 73.0]
  - - [64, 64, 8, 64, 64, 64, 64, 64]
    - [0, 81.0]
  - - [64, 64, 8, 128, 64, 64, 128, 128]
    - [0, 85.0]
  - - [64, 64, 8, 256, 64, 64, 256, 256]
    - [6, 88.0]
  - - [64, 64, 8, 512, 64, 64, 512, 512]
    - [0, 89.0]
  - - [64, 128, 8, 32, 64, 64, 32, 32]
    - [0, 146.0]
  - - [64, 128, 8, 64, 64, 64, 64, 64]
    - [0, 161.0]
  - - [64, 128, 8, 128, 64, 64, 128, 128]
    - [0, 170.0]
  - - [64, 128, 8, 256, 64, 64, 256, 256]
    - [7, 174.0]
  - - [64, 128, 8, 512, 64, 64, 512, 512]
    - [3, 174.0]
  - - [64, 256, 8, 32, 64, 64, 32, 32]
    - [12, 283.0]
  - - [64, 256, 8, 64, 64, 64, 64, 64]
    - [3, 316.0]
  - - [64, 256, 8, 128, 64, 64, 128, 128]
    - [12, 332.0]
  - - [64, 256, 8, 256, 64, 64, 256, 256]
    - [3, 333.0]
  - - [64, 256, 8, 512, 64, 64, 512, 512]
    - [18, 301.0]
  - - [64, 512, 8, 32, 64, 64, 32, 32]
    - [14, 304.0]
  - - [64, 512, 8, 64, 64, 64, 64, 64]
    - [1, 320.0]
  - - [64, 512, 8, 128, 64, 64, 128, 128]
    - [2, 330.0]
  - - [64, 512, 8, 256, 64, 64, 256, 256]
    - [20, 329.0]
  - - [64, 512, 8, 512, 64, 64, 512, 512]
    - [12, 315.0]
  - - [128, 32, 8, 32, 128, 128, 32, 32]
    - [0, 74.0]
  - - [128, 32, 8, 64, 128, 128, 64, 64]
    - [0, 81.0]
  - - [128, 32, 8, 128, 128, 128, 128, 128]
    - [0, 85.0]
  - - [128, 32, 8, 256, 128, 128, 256, 256]
    - [0, 88.0]
  - - [128, 32, 8, 512, 128, 128, 512, 512]
    - [0, 88.0]
  - - [128, 64, 8, 32, 128, 128, 32, 32]
    - [0, 145.0]
  - - [128, 64, 8, 64, 128, 128, 64, 64]
    - [0, 161.0]
  - - [128, 64, 8, 128, 128, 128, 128, 128]
    - [0, 170.0]
  - - [128, 64, 8, 256, 128, 128, 256, 256]
    - [16, 174.0]
  - - [128, 64, 8, 512, 128, 128, 512, 512]
    - [3, 172.0]
  - - [128, 128, 8, 32, 128, 128, 32, 32]
    - [3, 278.0]
  - - [128, 128, 8, 64, 128, 128, 64, 64]
    - [3, 313.0]
  - - [128, 128, 8, 128, 128, 128, 128, 128]
    - [7, 334.0]
  - - [128, 128, 8, 256, 128, 128, 256, 256]
    - [12, 333.0]
  - - [128, 128, 8, 512, 128, 128, 512, 512]
    - [3, 330.0]
  - - [128, 256, 8, 32, 128, 128, 32, 32]
    - [5, 305.0]
  - - [128, 256, 8, 64, 128, 128, 64, 64]
    - [17, 328.0]
  - - [128, 256, 8, 128, 128, 128, 128, 128]
    - [13, 336.0]
  - - [128, 256, 8, 256, 128, 128, 256, 256]
    - [4, 337.0]
  - - [128, 256, 8, 512, 128, 128, 512, 512]
    - [9, 336.0]
  - - [128, 512, 8, 32, 128, 128, 32, 32]
    - [3, 380.0]
  - - [128, 512, 8, 64, 128, 128, 64, 64]
    - [3, 416.0]
  - - [128, 512, 8, 128, 128, 128, 128, 128]
    - [12, 435.0]
  - - [128, 512, 8, 256, 128, 128, 256, 256]
    - [3, 432.0]
  - - [128, 512, 8, 512, 128, 128, 512, 512]
    - [10, 430.0]
  - - [256, 32, 8, 32, 256, 256, 32, 32]
    - [15, 143.0]
  - - [256, 32, 8, 64, 256, 256, 64, 64]
    - [6, 157.0]
  - - [256, 32, 8, 128, 256, 256, 128, 128]
    - [6, 168.0]
  - - [256, 32, 8, 256, 256, 256, 256, 256]
    - [15, 171.0]
  - - [256, 32, 8, 512, 256, 256, 512, 512]
    - [0, 171.0]
  - - [256, 64, 8, 32, 256, 256, 32, 32]
    - [3, 276.0]
  - - [256, 64, 8, 64, 256, 256, 64, 64]
    - [3, 312.0]
  - - [256, 64, 8, 128, 256, 256, 128, 128]
    - [3, 332.0]
  - - [256, 64, 8, 256, 256, 256, 256, 256]
    - [8, 333.0]
  - - [256, 64, 8, 512, 256, 256, 512, 512]
    - [3, 331.0]
  - - [256, 128, 8, 32, 256, 256, 32, 32]
    - [5, 303.0]
  - - [256, 128, 8, 64, 256, 256, 64, 64]
    - [5, 331.0]
  - - [256, 128, 8, 128, 256, 256, 128, 128]
    - [4, 338.0]
  - - [256, 128, 8, 256, 256, 256, 256, 256]
    - [13, 341.0]
  - - [256, 128, 8, 512, 256, 256, 512, 512]
    - [12, 338.0]
  - - [256, 256, 8, 32, 256, 256, 32, 32]
    - [3, 387.0]
  - - [256, 256, 8, 64, 256, 256, 64, 64]
    - [3, 422.0]
  - - [256, 256, 8, 128, 256, 256, 128, 128]
    - [3, 433.0]
  - - [256, 256, 8, 256, 256, 256, 256, 256]
    - [12, 442.0]
  - - [256, 256, 8, 512, 256, 256, 512, 512]
    - [3, 439.0]
  - - [256, 512, 8, 32, 256, 256, 32, 32]
    - [3, 475.0]
  - - [256, 512, 8, 64, 256, 256, 64, 64]
    - [3, 494.0]
  - - [256, 512, 8, 128, 256, 256, 128, 128]
    - [10, 516.0]
  - - [256, 512, 8, 256, 256, 256, 256, 256]
    - [3, 537.0]
  - - [256, 512, 8, 512, 256, 256, 512, 512]
    - [3, 523.0]
  - - [512, 32, 8, 32, 512, 512, 32, 32]
    - [11, 255.0]
  - - [512, 32, 8, 64, 512, 512, 64, 64]
    - [19, 292.0]
  - - [512, 32, 8, 128, 512, 512, 128, 128]
    - [11, 317.0]
  - - [512, 32, 8, 256, 512, 512, 256, 256]
    - [0, 327.0]
  - - [512, 32, 8, 512, 512, 512, 512, 512]
    - [0, 327.0]
  - - [512, 64, 8, 32, 512, 512, 32, 32]
    - [13, 303.0]
  - - [512, 64, 8, 64, 512, 512, 64, 64]
    - [4, 319.0]
  - - [512, 64, 8, 128, 512, 512, 128, 128]
    - [4, 339.0]
  - - [512, 64, 8, 256, 512, 512, 256, 256]
    - [10, 336.0]
  - - [512, 64, 8, 512, 512, 512, 512, 512]
    - [7, 338.0]
  - - [512, 128, 8, 32, 512, 512, 32, 32]
    - [10, 380.0]
  - - [512, 128, 8, 64, 512, 512, 64, 64]
    - [3, 405.0]
  - - [512, 128, 8, 128, 512, 512, 128, 128]
    - [12, 434.0]
  - - [512, 128, 8, 256, 512, 512, 256, 256]
    - [10, 437.0]
  - - [512, 128, 8, 512, 512, 512, 512, 512]
    - [3, 436.0]
  - - [512, 256, 8, 32, 512, 512, 32, 32]
    - [12, 469.0]
  - - [512, 256, 8, 64, 512, 512, 64, 64]
    - [3, 494.0]
  - - [512, 256, 8, 128, 512, 512, 128, 128]
    - [3, 516.0]
  - - [512, 256, 8, 256, 512, 512, 256, 256]
    - [10, 528.0]
  - - [512, 256, 8, 512, 512, 512, 512, 512]
    - [3, 524.0]
  - - [512, 512, 8, 32, 512, 512, 32, 32]
    - [3, 481.0]
  - - [512, 512, 8, 64, 512, 512, 64, 64]
    - [7, 511.0]
  - - [512, 512, 8, 128, 512, 512, 128, 128]
    - [12, 532.0]
  - - [512, 512, 8, 256, 512, 512, 256, 256]
    - [7, 533.0]
  - - [512, 512, 8, 512, 512, 512, 512, 512]
    - [7, 520.0]
- null
