library/src/blas3/Tensile/Logic/asm_full/vega10/vega10_Cijk_Alik_Bjlk_CB_GB.yaml
- {MinimumRequiredVersion: 4.26.0}
- vega10
- gfx900
- [Device 6863, Device 6862, Device 687f, Device 6860, Device 6861, 'Vega 10 XTX [Radeon
    SolutionIndex: 0
    SolutionNameMin: Cijk_Alik_Bjlk_CB_GB_MT32x32x8_SN_AMAS3_GRVW2_LRVW2_TT4_4_VW2_WG8_8_1_WGM1
    SolutionIndex: 1
    SolutionNameMin: Cijk_Alik_Bjlk_CB_GB_MT64x32x8_SN_AMAS3_GRVW2_LRVW2_TT8_4_VW2_WG8_8_1_WGM1
    SolutionIndex: 2
    SolutionNameMin: Cijk_Alik_Bjlk_CB_GB_MT64x64x8_SN_AMAS3_GRVW2_LRVW2_TT4_4_VW2_WG16_16_1_WGM1
    SolutionIndex: 3
    SolutionNameMin: Cijk_Alik_Bjlk_CB_GB_MT128x64x8_SN_AMAS3_GRVW2_LRVW2_TT8_4_VW2_WG16_16_1_WGM1
    SolutionIndex: 4
    SolutionNameMin: Cijk_Alik_Bjlk_CB_GB_MT64x128x8_SN_AMAS3_GRVW2_LRVW2_TT4_8_VW2_WG16_16_1_WGM1
    SolutionIndex: 5
    SolutionNameMin: Cijk_Alik_Bjlk_CB_GB_MT32x32x16_SN_AMAS3_GRVW2_LRVW2_TT4_4_VW2_WG8_8_1_WGM1
    SolutionIndex: 6
    SolutionNameMin: Cijk_Alik_Bjlk_CB_GB_MT64x64x16_SN_AMAS3_GRVW2_LRVW2_TT4_4_VW2_WG16_16_1_WGM1
    SolutionIndex: 7
    SolutionNameMin: Cijk_Alik_Bjlk_CB_GB_MT32x32x8_SN_AMAS0_GRVW1_LRVW1_TT4_4_VW1_WG8_8_1_WGM1
    SolutionIndex: 8
    SolutionNameMin: Cijk_Alik_Bjlk_CB_GB_MT64x64x8_SN_AMAS0_GRVW1_LRVW1_TT4_4_VW1_WG16_16_1_WGM1
    SolutionIndex: 9
    SolutionNameMin: Cijk_Alik_Bjlk_CB_GB_MT32x32x8_SN_AMAS3_GRVW2_LRVW2_TT4_4_VW2_WG8_8_1_WGM8
    SolutionIndex: 10
    SolutionNameMin: Cijk_Alik_Bjlk_CB_GB_MT64x64x8_SN_AMAS3_GRVW2_LRVW2_TT4_4_VW2_WG16_16_1_WGM8
    SolutionIndex: 11
    SolutionNameMin: Cijk_Alik_Bjlk_CB_GB_MT128x64x8_SN_AMAS3_GRVW2_LRVW2_TT8_4_VW2_WG16_16_1_WGM8
    SolutionIndex: 12
    SolutionNameMin: Cijk_Alik_Bjlk_CB_GB_MT64x128x8_SN_AMAS3_GRVW2_LRVW2_TT4_8_VW2_WG16_16_1_WGM8
    SolutionIndex: 13
    SolutionNameMin: Cijk_Alik_Bjlk_CB_GB_MT32x32x16_SN_AMAS3_GRVW2_LRVW2_TT4_4_VW2_WG8_8_1_WGM8
    SolutionIndex: 14
    SolutionNameMin: Cijk_Alik_Bjlk_CB_GB_MT64x64x16_SN_AMAS3_GRVW2_LRVW2_TT4_4_VW2_WG16_16_1_WGM8
    SolutionIndex: 15
    SolutionNameMin: Cijk_Alik_Bjlk_CB_GB_MT32x32x8_SN_AMAS0_GRVW1_LRVW1_TT4_4_VW1_WG8_8_1_WGM8
    SolutionIndex: 16
    SolutionNameMin: Cijk_Alik_Bjlk_CB_GB_MT64x64x8_SN_AMAS0_GRVW1_LRVW1_TT4_4_VW1_WG16_16_1_WGM8
- - - [32, 32, 8, 32, 32, 32, 32, 32]
    - [0, 38.0]
  - - [32, 32, 8, 64, 32, 32, 64, 32]
    - [0, 51.0]
  - - [32, 32, 8, 128, 32, 32, 128, 32]
    - [0, 62.0]
  - - [32, 32, 8, 256, 32, 32, 256, 32]
    - [0, 69.0]
  - - [32, 32, 8, 512, 32, 32, 512, 32]
    - [0, 72.0]
  - - [32, 64, 8, 32, 32, 32, 32, 64]
    - [9, 78.0]
  - - [32, 64, 8, 64, 32, 32, 64, 64]
    - [0, 104.0]
  - - [32, 64, 8, 128, 32, 32, 128, 64]
    - [0, 125.0]
  - - [32, 64, 8, 256, 32, 32, 256, 64]
    - [0, 138.0]
  - - [32, 64, 8, 512, 32, 32, 512, 64]
    - [0, 144.0]
  - - [32, 128, 8, 32, 32, 32, 32, 128]
    - [0, 161.0]
  - - [32, 128, 8, 64, 32, 32, 64, 128]
    - [0, 212.0]
  - - [32, 128, 8, 128, 32, 32, 128, 128]
    - [0, 251.0]
  - - [32, 128, 8, 256, 32, 32, 256, 128]
    - [0, 275.0]
  - - [32, 128, 8, 512, 32, 32, 512, 128]
    - [9, 287.0]
  - - [32, 256, 8, 32, 32, 32, 32, 256]
    - [0, 313.0]
  - - [32, 256, 8, 64, 32, 32, 64, 256]
    - [0, 387.0]
  - - [32, 256, 8, 128, 32, 32, 128, 256]
    - [7, 445.0]
  - - [32, 256, 8, 256, 32, 32, 256, 256]
    - [9, 514.0]
  - - [32, 256, 8, 512, 32, 32, 512, 256]
    - [10, 517.0]
  - - [32, 512, 8, 32, 32, 32, 32, 512]
    - [9, 537.0]
  - - [32, 512, 8, 64, 32, 32, 64, 512]
    - [0, 653.0]
  - - [32, 512, 8, 128, 32, 32, 128, 512]
    - [0, 685.0]
  - - [32, 512, 8, 256, 32, 32, 256, 512]
    - [9, 740.0]
  - - [32, 512, 8, 512, 32, 32, 512, 512]
    - [13, 787.0]
  - - [64, 32, 8, 32, 64, 64, 32, 32]
    - [0, 77.0]
  - - [64, 32, 8, 64, 64, 64, 64, 32]
    - [0, 104.0]
  - - [64, 32, 8, 128, 64, 64, 128, 32]
    - [0, 125.0]
  - - [64, 32, 8, 256, 64, 64, 256, 32]
    - [0, 138.0]
  - - [64, 32, 8, 512, 64, 64, 512, 32]
    - [0, 144.0]
  - - [64, 64, 8, 32, 64, 64, 32, 64]
    - [0, 162.0]
  - - [64, 64, 8, 64, 64, 64, 64, 64]
    - [0, 212.0]
  - - [64, 64, 8, 128, 64, 64, 128, 64]
    - [0, 251.0]
  - - [64, 64, 8, 256, 64, 64, 256, 64]
    - [0, 277.0]
  - - [64, 64, 8, 512, 64, 64, 512, 64]
    - [9, 289.0]
  - - [64, 128, 8, 32, 64, 64, 32, 128]
    - [0, 314.0]
  - - [64, 128, 8, 64, 64, 64, 64, 128]
    - [2, 403.0]
  - - [64, 128, 8, 128, 64, 64, 128, 128]
    - [2, 484.0]
  - - [64, 128, 8, 256, 64, 64, 256, 128]
    - [2, 523.0]
  - - [64, 128, 8, 512, 64, 64, 512, 128]
    - [5, 528.0]
  - - [64, 256, 8, 32, 64, 64, 32, 256]
    - [2, 577.0]
  - - [64, 256, 8, 64, 64, 64, 64, 256]
    - [2, 689.0]
  - - [64, 256, 8, 128, 64, 64, 128, 256]
    - [2, 731.0]
  - - [64, 256, 8, 256, 64, 64, 256, 256]
    - [2, 802.0]
  - - [64, 256, 8, 512, 64, 64, 512, 256]
    - [6, 923.0]
  - - [64, 512, 8, 32, 64, 64, 32, 512]
    - [2, 776.0]
  - - [64, 512, 8, 64, 64, 64, 64, 512]
    - [10, 861.0]
  - - [64, 512, 8, 128, 64, 64, 128, 512]
    - [10, 836.0]
  - - [64, 512, 8, 256, 64, 64, 256, 512]
    - [4, 1006.0]
  - - [64, 512, 8, 512, 64, 64, 512, 512]
    - [4, 1073.0]
  - - [128, 32, 8, 32, 128, 128, 32, 32]
    - [9, 158.0]
  - - [128, 32, 8, 64, 128, 128, 64, 32]
    - [0, 212.0]
  - - [128, 32, 8, 128, 128, 128, 128, 32]
    - [0, 251.0]
  - - [128, 32, 8, 256, 128, 128, 256, 32]
    - [0, 276.0]
  - - [128, 32, 8, 512, 128, 128, 512, 32]
    - [0, 285.0]
  - - [128, 64, 8, 32, 128, 128, 32, 64]
    - [0, 307.0]
  - - [128, 64, 8, 64, 128, 128, 64, 64]
    - [10, 405.0]
  - - [128, 64, 8, 128, 128, 128, 128, 64]
    - [10, 486.0]
  - - [128, 64, 8, 256, 128, 128, 256, 64]
    - [10, 528.0]
  - - [128, 64, 8, 512, 128, 128, 512, 64]
    - [5, 530.0]
  - - [128, 128, 8, 32, 128, 128, 32, 128]
    - [10, 562.0]
  - - [128, 128, 8, 64, 128, 128, 64, 128]
    - [10, 673.0]
  - - [128, 128, 8, 128, 128, 128, 128, 128]
    - [2, 724.0]
  - - [128, 128, 8, 256, 128, 128, 256, 128]
    - [2, 842.0]
  - - [128, 128, 8, 512, 128, 128, 512, 128]
    - [6, 908.0]
  - - [128, 256, 8, 32, 128, 128, 32, 256]
    - [2, 786.0]
  - - [128, 256, 8, 64, 128, 128, 64, 256]
    - [0, 890.0]
  - - [128, 256, 8, 128, 128, 128, 128, 256]
    - [12, 858.0]
  - - [128, 256, 8, 256, 128, 128, 256, 256]
    - [12, 1001.0]
  - - [128, 256, 8, 512, 128, 128, 512, 256]
    - [4, 1048.0]
  - - [128, 512, 8, 32, 128, 128, 32, 512]
    - [10, 890.0]
  - - [128, 512, 8, 64, 128, 128, 64, 512]
    - [10, 980.0]
  - - [128, 512, 8, 128, 128, 128, 128, 512]
    - [10, 1125.0]
  - - [128, 512, 8, 256, 128, 128, 256, 512]
    - [2, 1189.0]
  - - [128, 512, 8, 512, 128, 128, 512, 512]
    - [8, 1199.0]
  - - [256, 32, 8, 32, 256, 256, 32, 32]
    - [9, 299.0]
  - - [256, 32, 8, 64, 256, 256, 64, 32]
    - [0, 372.0]
  - - [256, 32, 8, 128, 256, 256, 128, 32]
    - [15, 432.0]
  - - [256, 32, 8, 256, 256, 256, 256, 32]
    - [15, 482.0]
  - - [256, 32, 8, 512, 256, 256, 512, 32]
    - [9, 546.0]
  - - [256, 64, 8, 32, 256, 256, 32, 64]
    - [10, 541.0]
  - - [256, 64, 8, 64, 256, 256, 64, 64]
    - [2, 661.0]
  - - [256, 64, 8, 128, 256, 256, 128, 64]
    - [6, 731.0]
  - - [256, 64, 8, 256, 256, 256, 256, 64]
    - [2, 806.0]
  - - [256, 64, 8, 512, 256, 256, 512, 64]
    - [14, 884.0]
  - - [256, 128, 8, 32, 256, 256, 32, 128]
    - [2, 763.0]
  - - [256, 128, 8, 64, 256, 256, 64, 128]
    - [10, 852.0]
  - - [256, 128, 8, 128, 256, 256, 128, 128]
    - [10, 864.0]
  - - [256, 128, 8, 256, 256, 256, 256, 128]
    - [4, 953.0]
  - - [256, 128, 8, 512, 256, 256, 512, 128]
    - [12, 1050.0]
  - - [256, 256, 8, 32, 256, 256, 32, 256]
    - [16, 833.0]
  - - [256, 256, 8, 64, 256, 256, 64, 256]
    - [10, 951.0]
  - - [256, 256, 8, 128, 256, 256, 128, 256]
    - [2, 1105.0]
  - - [256, 256, 8, 256, 256, 256, 256, 256]
    - [2, 1183.0]
  - - [256, 256, 8, 512, 256, 256, 512, 256]
    - [2, 1224.0]
  - - [256, 512, 8, 32, 256, 256, 32, 512]
    - [2, 1006.0]
  - - [256, 512, 8, 64, 256, 256, 64, 512]
    - [2, 1223.0]
  - - [256, 512, 8, 128, 256, 256, 128, 512]
    - [8, 1271.0]
  - - [256, 512, 8, 256, 256, 256, 256, 512]
    - [10, 1390.0]
  - - [256, 512, 8, 512, 256, 256, 512, 512]
    - [2, 1507.0]
  - - [512, 32, 8, 32, 512, 512, 32, 32]
    - [9, 491.0]
  - - [512, 32, 8, 64, 512, 512, 64, 32]
    - [7, 589.0]
  - - [512, 32, 8, 128, 512, 512, 128, 32]
    - [9, 679.0]
  - - [512, 32, 8, 256, 512, 512, 256, 32]
    - [9, 758.0]
  - - [512, 32, 8, 512, 512, 512, 512, 32]
    - [13, 947.0]
  - - [512, 64, 8, 32, 512, 512, 32, 64]
    - [2, 731.0]
  - - [512, 64, 8, 64, 512, 512, 64, 64]
    - [0, 814.0]
  - - [512, 64, 8, 128, 512, 512, 128, 64]
    - [3, 842.0]
  - - [512, 64, 8, 256, 512, 512, 256, 64]
    - [11, 999.0]
  - - [512, 64, 8, 512, 512, 512, 512, 64]
    - [1, 978.0]
  - - [512, 128, 8, 32, 512, 512, 32, 128]
    - [16, 814.0]
  - - [512, 128, 8, 64, 512, 512, 64, 128]
    - [2, 996.0]
  - - [512, 128, 8, 128, 512, 512, 128, 128]
    - [10, 1081.0]
  - - [512, 128, 8, 256, 512, 512, 256, 128]
    - [10, 1170.0]
  - - [512, 128, 8, 512, 512, 512, 512, 128]
    - [2, 1233.0]
  - - [512, 256, 8, 32, 512, 512, 32, 256]
    - [2, 1093.0]
  - - [512, 256, 8, 64, 512, 512, 64, 256]
    - [8, 1192.0]
  - - [512, 256, 8, 128, 512, 512, 128, 256]
    - [10, 1301.0]
  - - [512, 256, 8, 256, 512, 512, 256, 256]
    - [2, 1411.0]
  - - [512, 256, 8, 512, 512, 512, 512, 256]
    - [10, 1503.0]
  - - [512, 512, 8, 32, 512, 512, 32, 512]
    - [2, 1093.0]
  - - [512, 512, 8, 64, 512, 512, 64, 512]
    - [8, 1277.0]
  - - [512, 512, 8, 128, 512, 512, 128, 512]
    - [2, 1430.0]
  - - [512, 512, 8, 256, 512, 512, 256, 512]
    - [2, 1486.0]
  - - [512, 512, 8, 512, 512, 512, 512, 512]
    - [14, 1515.0]
- null
