library/src/blas3/Tensile/Logic/asm_full/vega10/vega10_Cijk_Alik_Bljk_HSS_BH.yaml
- {MinimumRequiredVersion: 4.24.0}
- vega10
- gfx900
- [Device 6863, Device 6862, Device 687f, Device 6860, Device 6861, 'Vega 10 XTX [Radeon
    SolutionIndex: 0
    SolutionNameMin: Cijk_Alik_Bljk_HSS_BH_MT16x16x8_SE_GSU1_PGR1_PLR1_TT2_2_VAW2
    SolutionIndex: 1
    SolutionNameMin: Cijk_Alik_Bljk_HSS_BH_MT32x16x8_SE_GSU1_PGR1_PLR1_TT4_2_VAW2
    SolutionIndex: 2
    SolutionNameMin: Cijk_Alik_Bljk_HSS_BH_MT32x16x8_SE_GSU1_PGR1_PLR1_TT2_2_VAW2
    SolutionIndex: 3
    SolutionNameMin: Cijk_Alik_Bljk_HSS_BH_MT32x32x8_SE_GSU1_PGR1_PLR1_TT2_2_VAW2
    SolutionIndex: 4
    SolutionNameMin: Cijk_Alik_Bljk_HSS_BH_MT16x16x16_SE_GSU1_PGR1_PLR1_TT2_2_VAW2
    SolutionIndex: 5
    SolutionNameMin: Cijk_Alik_Bljk_HSS_BH_MT32x32x16_SE_GSU1_PGR1_PLR1_TT4_4_VAW2
    SolutionIndex: 6
    SolutionNameMin: Cijk_Alik_Bljk_HSS_BH_MT64x16x16_SE_GSU1_PGR1_PLR1_TT4_4_VAW2
    SolutionIndex: 7
    SolutionNameMin: Cijk_Alik_Bljk_HSS_BH_MT64x32x16_SE_GSU1_PGR1_PLR1_TT4_4_VAW2
    SolutionIndex: 8
    SolutionNameMin: Cijk_Alik_Bljk_HSS_BH_MT64x64x16_SE_GSU1_PGR1_PLR1_TT4_4_VAW2
    SolutionIndex: 9
    SolutionNameMin: Cijk_Alik_Bljk_HSS_BH_MT128x32x16_SE_GSU1_PGR1_PLR1_TT4_4_VAW2
    SolutionIndex: 10
    SolutionNameMin: Cijk_Alik_Bljk_HSS_BH_MT16x16x32_SE_GSU1_PGR1_PLR1_TT2_2_VAW2
    SolutionIndex: 11
    SolutionNameMin: Cijk_Alik_Bljk_HSS_BH_MT32x32x32_SE_GSU1_PGR1_PLR1_TT4_4_VAW2
    SolutionIndex: 12
    SolutionNameMin: Cijk_Alik_Bljk_HSS_BH_MT64x16x32_SE_GSU1_PGR0_PLR1_TT4_2_VAW2
    SolutionIndex: 13
    SolutionNameMin: Cijk_Alik_Bljk_HSS_BH_MT64x32x32_SE_GSU1_PGR1_PLR1_TT4_4_VAW2
    SolutionIndex: 14
    SolutionNameMin: Cijk_Alik_Bljk_HSS_BH_MT64x64x32_SE_GSU1_PGR1_PLR1_TT4_4_VAW2
    SolutionIndex: 15
    SolutionNameMin: Cijk_Alik_Bljk_HSS_BH_MT64x16x32_SE_GSU1_PGR1_PLR1_TT2_2_VAW2
    SolutionIndex: 16
    SolutionNameMin: Cijk_Alik_Bljk_HSS_BH_MT128x16x32_SE_GSU1_PGR1_PLR1_TT4_2_VAW2
    SolutionIndex: 17
    SolutionNameMin: Cijk_Alik_Bljk_HSS_BH_MT64x64x8_SE_GSU1_PGR1_PLR1_TT8_8_VAW2
    SolutionIndex: 18
    SolutionNameMin: Cijk_Alik_Bljk_HSS_BH_MT16x16x16_SE_GSU1_PGR1_PLR1_TT2_2_VAW2
    SolutionIndex: 19
    SolutionNameMin: Cijk_Alik_Bljk_HSS_BH_MT32x16x16_SE_GSU1_PGR1_PLR1_TT4_2_VAW2
    SolutionIndex: 20
    SolutionNameMin: Cijk_Alik_Bljk_HSS_BH_MT32x32x16_SE_GSU1_PGR1_PLR1_TT4_4_VAW2
    SolutionIndex: 21
    SolutionNameMin: Cijk_Alik_Bljk_HSS_BH_MT64x32x16_SE_GSU1_PGR1_PLR1_TT8_4_VAW2
    SolutionIndex: 22
    SolutionNameMin: Cijk_Alik_Bljk_HSS_BH_MT64x64x16_SE_GSU1_PGR1_PLR1_TT8_8_VAW2
    SolutionIndex: 23
    SolutionNameMin: Cijk_Alik_Bljk_HSS_BH_MT64x16x16_SE_GSU1_PGR1_PLR1_TT4_2_VAW2
    SolutionIndex: 24
    SolutionNameMin: Cijk_Alik_Bljk_HSS_BH_MT64x32x16_SE_GSU1_PGR1_PLR1_TT4_4_VAW2
    SolutionIndex: 25
    SolutionNameMin: Cijk_Alik_Bljk_HSS_BH_MT128x32x16_SE_GSU1_PGR1_PLR1_TT4_4_VAW2
    SolutionIndex: 26
    SolutionNameMin: Cijk_Alik_Bljk_HSS_BH_MT16x16x24_SE_GSU1_PGR1_PLR1_TT2_2_VAW2
    SolutionIndex: 27
    SolutionNameMin: Cijk_Alik_Bljk_HSS_BH_MT32x16x24_SE_GSU1_PGR1_PLR1_TT4_2_VAW2
    SolutionIndex: 28
    SolutionNameMin: Cijk_Alik_Bljk_HSS_BH_MT32x32x24_SE_GSU1_PGR1_PLR1_TT4_4_VAW2
    SolutionIndex: 29
    SolutionNameMin: Cijk_Alik_Bljk_HSS_BH_MT16x16x24_SE_GSU1_PGR1_PLR1_TT2_2_VAW2
    SolutionIndex: 30
    SolutionNameMin: Cijk_Alik_Bljk_HSS_BH_MT32x16x24_SE_GSU1_PGR1_PLR1_TT4_2_VAW2
    SolutionIndex: 31
    SolutionNameMin: Cijk_Alik_Bljk_HSS_BH_MT32x32x24_SE_GSU1_PGR1_PLR1_TT4_4_VAW2
    SolutionIndex: 32
    SolutionNameMin: Cijk_Alik_Bljk_HSS_BH_MT16x16x32_SE_GSU1_PGR1_PLR1_TT2_2_VAW2
    SolutionIndex: 33
    SolutionNameMin: Cijk_Alik_Bljk_HSS_BH_MT32x32x32_SE_GSU1_PGR1_PLR1_TT4_4_VAW2
    SolutionIndex: 34
    SolutionNameMin: Cijk_Alik_Bljk_HSS_BH_MT32x16x32_SE_GSU1_PGR1_PLR1_TT2_2_VAW2
    SolutionIndex: 35
    SolutionNameMin: Cijk_Alik_Bljk_HSS_BH_MT64x32x32_SE_GSU1_PGR1_PLR1_TT4_4_VAW2
    SolutionIndex: 36
    SolutionNameMin: Cijk_Alik_Bljk_HSS_BH_MT64x64x8_SE_GSU1_PGR1_PLR1_TT4_4_VAW2
    SolutionIndex: 37
    SolutionNameMin: Cijk_Alik_Bljk_HSS_BH_MT64x128x8_SE_GSU1_PGR1_PLR1_TT4_8_VAW2
    SolutionIndex: 38
    SolutionNameMin: Cijk_Alik_Bljk_HSS_BH_MT128x64x8_SE_GSU1_PGR1_PLR1_TT8_4_VAW2
    SolutionIndex: 39
    SolutionNameMin: Cijk_Alik_Bljk_HSS_BH_MT64x64x16_SE_GSU1_PGR1_PLR1_TT4_4_VAW2
    SolutionIndex: 40
    SolutionNameMin: Cijk_Alik_Bljk_HSS_BH_MT64x128x16_SE_GSU1_PGR1_PLR1_TT4_8_VAW2
    SolutionIndex: 41
    SolutionNameMin: Cijk_Alik_Bljk_HSS_BH_MT128x64x16_SE_GSU1_PGR1_PLR1_TT8_4_VAW2
    SolutionIndex: 42
    SolutionNameMin: Cijk_Alik_Bljk_HSS_BH_MT128x96x16_SE_GSU1_PGR1_PLR1_TT8_6_VAW2
    SolutionIndex: 43
    SolutionNameMin: Cijk_Alik_Bljk_HSS_BH_MT64x64x32_SE_GSU1_PGR1_PLR1_TT4_4_VAW2
    SolutionIndex: 44
    SolutionNameMin: Cijk_Alik_Bljk_HSS_BH_MT64x64x4_SE_GSU1_PGR0_PLR0_TT4_4_VAW2
    SolutionIndex: 45
    SolutionNameMin: Cijk_Alik_Bljk_HSS_BH_MT64x128x4_SE_GSU1_PGR1_PLR0_TT4_8_VAW2
    SolutionIndex: 46
    SolutionNameMin: Cijk_Alik_Bljk_HSS_BH_MT64x64x4_SE_GSU1_PGR1_PLR0_TT4_4_VAW2
    SolutionIndex: 47
    SolutionNameMin: Cijk_Alik_Bljk_HSS_BH_MT64x64x4_SE_GSU1_PGR0_PLR1_TT4_4_VAW2
    SolutionIndex: 48
    SolutionNameMin: Cijk_Alik_Bljk_HSS_BH_MT64x128x4_SE_GSU1_PGR1_PLR1_TT4_8_VAW2
    SolutionIndex: 49
    SolutionNameMin: Cijk_Alik_Bljk_HSS_BH_MT64x64x4_SE_GSU1_PGR1_PLR1_TT4_4_VAW2
    SolutionIndex: 50
    SolutionNameMin: Cijk_Alik_Bljk_HSS_BH_MT128x128x8_SE_GSU1_PGR1_PLR0_TT8_8_VAW2
    SolutionIndex: 51
    SolutionNameMin: Cijk_Alik_Bljk_HSS_BH_MT64x64x8_SE_GSU1_PGR1_PLR0_TT4_4_VAW2
    SolutionIndex: 52
    SolutionNameMin: Cijk_Alik_Bljk_HSS_BH_MT64x64x8_SE_GSU1_PGR0_PLR1_TT4_4_VAW2
    SolutionIndex: 53
    SolutionNameMin: Cijk_Alik_Bljk_HSS_BH_MT64x64x8_SE_GSU1_PGR1_PLR1_TT4_4_VAW2
    SolutionIndex: 54
    SolutionNameMin: Cijk_Alik_Bljk_HSS_BH_MT64x64x16_SE_GSU1_PGR0_PLR0_TT4_4_VAW2
    SolutionIndex: 55
    SolutionNameMin: Cijk_Alik_Bljk_HSS_BH_MT64x64x16_SE_GSU1_PGR1_PLR0_TT4_4_VAW2
    SolutionIndex: 56
    SolutionNameMin: Cijk_Alik_Bljk_HSS_BH_MT64x64x16_SE_GSU1_PGR0_PLR1_TT4_4_VAW2
    SolutionIndex: 57
    SolutionNameMin: Cijk_Alik_Bljk_HSS_BH_MT64x128x16_SE_GSU1_PGR1_PLR1_TT4_8_VAW2
    SolutionIndex: 58
    SolutionNameMin: Cijk_Alik_Bljk_HSS_BH_MT64x64x16_SE_GSU1_PGR1_PLR1_TT4_4_VAW2
    SolutionIndex: 59
    SolutionNameMin: Cijk_Alik_Bljk_HSS_BH_MT64x64x8_SE_GSU2_PGR1_PLR0_TT4_4_VAW1
    SolutionIndex: 60
    SolutionNameMin: Cijk_Alik_Bljk_HSS_BH_MT64x64x16_SE_GSU2_PGR0_PLR0_TT4_4_VAW1
    SolutionIndex: 61
    SolutionNameMin: Cijk_Alik_Bljk_HSS_BH_MT64x64x16_SE_GSU2_PGR0_PLR1_TT4_4_VAW1
    SolutionIndex: 62
    SolutionNameMin: Cijk_Alik_Bljk_HSS_BH_MT64x64x16_SE_GSU2_PGR1_PLR1_TT4_4_VAW1
    SolutionIndex: 63
    SolutionNameMin: Cijk_Alik_Bljk_HSS_BH_MT64x64x8_SE_GSU3_PGR1_PLR0_TT4_4_VAW1
    SolutionIndex: 64
    SolutionNameMin: Cijk_Alik_Bljk_HSS_BH_MT64x64x16_SE_GSU3_PGR1_PLR0_TT4_4_VAW1
    SolutionIndex: 65
    SolutionNameMin: Cijk_Alik_Bljk_HSS_BH_MT64x64x16_SE_GSU3_PGR0_PLR1_TT4_4_VAW1
    SolutionIndex: 66
    SolutionNameMin: Cijk_Alik_Bljk_HSS_BH_MT64x64x16_SE_GSU3_PGR1_PLR1_TT4_4_VAW1
    SolutionIndex: 67
    SolutionNameMin: Cijk_Alik_Bljk_HSS_BH_MT64x64x4_SE_GSU5_PGR1_PLR0_TT4_4_VAW1
    SolutionIndex: 68
    SolutionNameMin: Cijk_Alik_Bljk_HSS_BH_MT64x64x8_SE_GSU5_PGR1_PLR0_TT4_4_VAW1
    SolutionIndex: 69
    SolutionNameMin: Cijk_Alik_Bljk_HSS_BH_MT64x64x8_SE_GSU5_PGR1_PLR1_TT4_4_VAW1
    SolutionIndex: 70
    SolutionNameMin: Cijk_Alik_Bljk_HSS_BH_MT64x64x16_SE_GSU5_PGR1_PLR0_TT4_4_VAW1
    SolutionIndex: 71
    SolutionNameMin: Cijk_Alik_Bljk_HSS_BH_MT64x64x16_SE_GSU5_PGR1_PLR1_TT4_4_VAW1
    SolutionIndex: 72
    SolutionNameMin: Cijk_Alik_Bljk_HSS_BH_MT64x64x4_SE_GSU7_PGR1_PLR0_TT4_4_VAW1
    SolutionIndex: 73
    SolutionNameMin: Cijk_Alik_Bljk_HSS_BH_MT64x64x8_SE_GSU7_PGR1_PLR0_TT4_4_VAW1
    SolutionIndex: 74
    SolutionNameMin: Cijk_Alik_Bljk_HSS_BH_MT64x64x8_SE_GSU7_PGR1_PLR1_TT4_4_VAW1
    SolutionIndex: 75
    SolutionNameMin: Cijk_Alik_Bljk_HSS_BH_MT64x64x16_SE_GSU7_PGR1_PLR0_TT4_4_VAW1
    SolutionIndex: 76
    SolutionNameMin: Cijk_Alik_Bljk_HSS_BH_MT64x64x16_SE_GSU7_PGR0_PLR1_TT4_4_VAW1
    SolutionIndex: 77
    SolutionNameMin: Cijk_Alik_Bljk_HSS_BH_MT64x64x16_SE_GSU7_PGR1_PLR1_TT4_4_VAW1
    SolutionIndex: 78
    SolutionNameMin: Cijk_Alik_Bljk_HSS_BH_MT128x128x4_SE_GSU1_PGR0_PLR0_TT8_8_VAW2
    SolutionIndex: 79
    SolutionNameMin: Cijk_Alik_Bljk_HSS_BH_MT64x128x4_SE_GSU1_PGR0_PLR0_TT4_8_VAW2
    SolutionIndex: 80
    SolutionNameMin: Cijk_Alik_Bljk_HSS_BH_MT64x64x4_SE_GSU1_PGR0_PLR0_TT4_4_VAW2
    SolutionIndex: 81
    SolutionNameMin: Cijk_Alik_Bljk_HSS_BH_MT128x128x4_SE_GSU1_PGR1_PLR0_TT8_8_VAW2
    SolutionIndex: 82
    SolutionNameMin: Cijk_Alik_Bljk_HSS_BH_MT64x128x4_SE_GSU1_PGR1_PLR0_TT4_8_VAW2
    SolutionIndex: 83
    SolutionNameMin: Cijk_Alik_Bljk_HSS_BH_MT64x64x4_SE_GSU1_PGR1_PLR0_TT4_4_VAW2
    SolutionIndex: 84
    SolutionNameMin: Cijk_Alik_Bljk_HSS_BH_MT64x128x4_SE_GSU1_PGR0_PLR1_TT4_8_VAW2
    SolutionIndex: 85
    SolutionNameMin: Cijk_Alik_Bljk_HSS_BH_MT64x64x4_SE_GSU1_PGR0_PLR1_TT4_4_VAW2
    SolutionIndex: 86
    SolutionNameMin: Cijk_Alik_Bljk_HSS_BH_MT128x128x4_SE_GSU1_PGR1_PLR1_TT8_8_VAW2
    SolutionIndex: 87
    SolutionNameMin: Cijk_Alik_Bljk_HSS_BH_MT64x128x4_SE_GSU1_PGR1_PLR1_TT4_8_VAW2
    SolutionIndex: 88
    SolutionNameMin: Cijk_Alik_Bljk_HSS_BH_MT64x64x4_SE_GSU1_PGR1_PLR1_TT4_4_VAW2
    SolutionIndex: 89
    SolutionNameMin: Cijk_Alik_Bljk_HSS_BH_MT64x64x8_SE_GSU1_PGR0_PLR0_TT4_4_VAW2
    SolutionIndex: 90
    SolutionNameMin: Cijk_Alik_Bljk_HSS_BH_MT128x128x8_SE_GSU1_PGR1_PLR0_TT8_8_VAW2
    SolutionIndex: 91
    SolutionNameMin: Cijk_Alik_Bljk_HSS_BH_MT64x64x8_SE_GSU1_PGR1_PLR0_TT4_4_VAW2
    SolutionIndex: 92
    SolutionNameMin: Cijk_Alik_Bljk_HSS_BH_MT64x128x8_SE_GSU1_PGR0_PLR1_TT4_8_VAW2
    SolutionIndex: 93
    SolutionNameMin: Cijk_Alik_Bljk_HSS_BH_MT64x64x8_SE_GSU1_PGR0_PLR1_TT4_4_VAW2
    SolutionIndex: 94
    SolutionNameMin: Cijk_Alik_Bljk_HSS_BH_MT128x128x8_SE_GSU1_PGR1_PLR1_TT8_8_VAW2
    SolutionIndex: 95
    SolutionNameMin: Cijk_Alik_Bljk_HSS_BH_MT64x128x8_SE_GSU1_PGR1_PLR1_TT4_8_VAW2
    SolutionIndex: 96
    SolutionNameMin: Cijk_Alik_Bljk_HSS_BH_MT128x128x16_SE_GSU1_PGR0_PLR0_TT8_8_VAW2
    SolutionIndex: 97
    SolutionNameMin: Cijk_Alik_Bljk_HSS_BH_MT64x64x16_SE_GSU1_PGR0_PLR0_TT4_4_VAW2
    SolutionIndex: 98
    SolutionNameMin: Cijk_Alik_Bljk_HSS_BH_MT64x64x16_SE_GSU1_PGR1_PLR0_TT4_4_VAW2
    SolutionIndex: 99
    SolutionNameMin: Cijk_Alik_Bljk_HSS_BH_MT128x128x16_SE_GSU1_PGR1_PLR1_TT8_8_VAW2
    SolutionIndex: 100
    SolutionNameMin: Cijk_Alik_Bljk_HSS_BH_MT64x64x16_SE_GSU1_PGR1_PLR1_TT4_4_VAW2
    SolutionIndex: 101
    SolutionNameMin: Cijk_Alik_Bljk_HSS_BH_MT64x64x4_SE_GSU2_PGR0_PLR0_TT4_4_VAW1
    SolutionIndex: 102
    SolutionNameMin: Cijk_Alik_Bljk_HSS_BH_MT64x64x8_SE_GSU2_PGR1_PLR0_TT4_4_VAW1
    SolutionIndex: 103
    SolutionNameMin: Cijk_Alik_Bljk_HSS_BH_MT64x64x4_SE_GSU3_PGR1_PLR0_TT4_4_VAW1
    SolutionIndex: 104
    SolutionNameMin: Cijk_Alik_Bljk_HSS_BH_MT64x64x8_SE_GSU3_PGR1_PLR0_TT4_4_VAW1
    SolutionIndex: 105
    SolutionNameMin: Cijk_Alik_Bljk_HSS_BH_MT64x64x8_SE_GSU3_PGR1_PLR1_TT4_4_VAW1
    SolutionIndex: 106
    SolutionNameMin: Cijk_Alik_Bljk_HSS_BH_MT64x64x4_SE_GSU5_PGR1_PLR0_TT4_4_VAW1
    SolutionIndex: 107
    SolutionNameMin: Cijk_Alik_Bljk_HSS_BH_MT64x64x8_SE_GSU5_PGR1_PLR0_TT4_4_VAW1
    SolutionIndex: 108
    SolutionNameMin: Cijk_Alik_Bljk_HSS_BH_MT64x64x8_SE_GSU5_PGR1_PLR1_TT4_4_VAW1
    SolutionIndex: 109
    SolutionNameMin: Cijk_Alik_Bljk_HSS_BH_MT64x64x16_SE_GSU5_PGR1_PLR0_TT4_4_VAW1
    SolutionIndex: 110
    SolutionNameMin: Cijk_Alik_Bljk_HSS_BH_MT64x64x4_SE_GSU7_PGR1_PLR0_TT4_4_VAW1
    SolutionIndex: 111
    SolutionNameMin: Cijk_Alik_Bljk_HSS_BH_MT64x64x8_SE_GSU7_PGR1_PLR0_TT4_4_VAW1
    SolutionIndex: 112
    SolutionNameMin: Cijk_Alik_Bljk_HSS_BH_MT64x64x16_SE_GSU7_PGR1_PLR0_TT4_4_VAW1
- - - [512, 8, 1, 500000, 512, 512, 500000, 500000]
    - [10, 176.0]
  - - [512, 16, 1, 500000, 512, 512, 500000, 500000]
    - [10, 352.0]
  - - [1024, 8, 1, 500000, 1024, 1024, 500000, 500000]
    - [10, 342.0]
  - - [1024, 16, 1, 500000, 1024, 1024, 500000, 500000]
    - [10, 683.0]
  - - [1760, 16, 1, 1760, 1760, 1760, 1760, 1760]
    - [10, 727.0]
  - - [3072, 16, 1, 1024, 3072, 3072, 1024, 1024]
    - [32, 844.0]
  - - [2048, 16, 1, 2048, 2048, 2048, 2048, 2048]
    - [32, 740.0]
  - - [2560, 16, 1, 2560, 2560, 2560, 2560, 2560]
    - [32, 808.0]
  - - [4608, 16, 1, 1536, 4608, 4608, 1536, 1536]
    - [10, 822.0]
  - - [6144, 16, 1, 2560, 6144, 6144, 2560, 2560]
    - [16, 826.0]
  - - [4096, 16, 1, 4096, 4096, 4096, 4096, 4096]
    - [34, 967.0]
  - - [7680, 16, 1, 2560, 7680, 7680, 2560, 2560]
    - [18, 801.0]
  - - [8448, 16, 1, 2816, 8448, 8448, 2816, 2816]
    - [12, 816.0]
  - - [64, 64, 1, 256, 64, 64, 256, 256]
    - [15, 66.0]
  - - [128, 64, 1, 256, 128, 128, 256, 256]
    - [0, 124.0]
  - - [64, 128, 1, 256, 64, 64, 256, 256]
    - [0, 124.0]
  - - [128, 128, 1, 256, 128, 128, 256, 256]
    - [10, 354.0]
  - - [64, 256, 1, 256, 64, 64, 256, 256]
    - [10, 354.0]
  - - [128, 256, 1, 256, 128, 128, 256, 256]
    - [18, 662.0]
  - - [64, 448, 1, 256, 64, 64, 256, 256]
    - [10, 615.0]
  - - [128, 448, 1, 256, 128, 128, 256, 256]
    - [4, 1120.0]
  - - [64, 704, 1, 256, 64, 64, 256, 256]
    - [18, 885.0]
  - - [128, 704, 1, 256, 128, 128, 256, 256]
    - [4, 1527.0]
  - - [64, 1024, 1, 256, 64, 64, 256, 256]
    - [4, 1161.0]
  - - [128, 1024, 1, 256, 128, 128, 256, 256]
    - [4, 1812.0]
  - - [64, 1408, 1, 256, 64, 64, 256, 256]
    - [4, 1455.0]
  - - [128, 1408, 1, 256, 128, 128, 256, 256]
    - [2, 2069.0]
  - - [64, 1856, 1, 256, 64, 64, 256, 256]
    - [4, 1585.0]
  - - [128, 1856, 1, 256, 128, 128, 256, 256]
    - [1, 2213.0]
  - - [64, 2368, 1, 256, 64, 64, 256, 256]
    - [3, 1752.0]
  - - [128, 2368, 1, 256, 128, 128, 256, 256]
    - [5, 2354.0]
  - - [64, 2944, 1, 256, 64, 64, 256, 256]
    - [2, 1839.0]
  - - [128, 2944, 1, 256, 128, 128, 256, 256]
    - [20, 2831.0]
  - - [64, 3584, 1, 256, 64, 64, 256, 256]
    - [20, 2092.0]
  - - [128, 3584, 1, 256, 128, 128, 256, 256]
    - [39, 3222.0]
  - - [64, 4288, 1, 256, 64, 64, 256, 256]
    - [3, 1924.0]
  - - [128, 4288, 1, 256, 128, 128, 256, 256]
    - [7, 3237.0]
  - - [64, 5056, 1, 256, 64, 64, 256, 256]
    - [5, 2044.0]
  - - [128, 5056, 1, 256, 128, 128, 256, 256]
    - [39, 3415.0]
  - - [64, 5888, 1, 256, 64, 64, 256, 256]
    - [20, 2145.0]
  - - [128, 5888, 1, 256, 128, 128, 256, 256]
    - [7, 3256.0]
  - - [64, 6784, 1, 256, 64, 64, 256, 256]
    - [5, 2210.0]
  - - [128, 6784, 1, 256, 128, 128, 256, 256]
    - [43, 3301.0]
  - - [64, 64, 1, 1280, 64, 64, 1280, 1280]
    - [4, 97.0]
  - - [128, 64, 1, 1280, 128, 128, 1280, 1280]
    - [4, 193.0]
  - - [64, 128, 1, 1280, 64, 64, 1280, 1280]
    - [4, 196.0]
  - - [128, 128, 1, 1280, 128, 128, 1280, 1280]
    - [26, 452.0]
  - - [64, 256, 1, 1280, 64, 64, 1280, 1280]
    - [26, 450.0]
  - - [128, 256, 1, 1280, 128, 128, 1280, 1280]
    - [26, 871.0]
  - - [64, 448, 1, 1280, 64, 64, 1280, 1280]
    - [26, 773.0]
  - - [128, 448, 1, 1280, 128, 128, 1280, 1280]
    - [26, 1515.0]
  - - [64, 704, 1, 1280, 64, 64, 1280, 1280]
    - [26, 1128.0]
  - - [128, 704, 1, 1280, 128, 128, 1280, 1280]
    - [29, 1966.0]
  - - [64, 1024, 1, 1280, 64, 64, 1280, 1280]
    - [29, 1416.0]
  - - [128, 1024, 1, 1280, 128, 128, 1280, 1280]
    - [29, 2304.0]
  - - [64, 1408, 1, 1280, 64, 64, 1280, 1280]
    - [18, 1622.0]
  - - [128, 1408, 1, 1280, 128, 128, 1280, 1280]
    - [30, 2507.0]
  - - [64, 1856, 1, 1280, 64, 64, 1280, 1280]
    - [27, 1723.0]
  - - [128, 1856, 1, 1280, 128, 128, 1280, 1280]
    - [27, 2408.0]
  - - [64, 2368, 1, 1280, 64, 64, 1280, 1280]
    - [30, 1978.0]
  - - [128, 2368, 1, 1280, 128, 128, 1280, 1280]
    - [7, 2875.0]
  - - [64, 2944, 1, 1280, 64, 64, 1280, 1280]
    - [27, 2050.0]
  - - [128, 2944, 1, 1280, 128, 128, 1280, 1280]
    - [7, 3256.0]
  - - [64, 3584, 1, 1280, 64, 64, 1280, 1280]
    - [3, 2141.0]
  - - [128, 3584, 1, 1280, 128, 128, 1280, 1280]
    - [24, 3605.0]
  - - [64, 4288, 1, 1280, 64, 64, 1280, 1280]
    - [13, 2144.0]
  - - [128, 4288, 1, 1280, 128, 128, 1280, 1280]
    - [39, 3652.0]
  - - [64, 5056, 1, 1280, 64, 64, 1280, 1280]
    - [35, 2278.0]
  - - [128, 5056, 1, 1280, 128, 128, 1280, 1280]
    - [9, 3958.0]
  - - [64, 5888, 1, 1280, 64, 64, 1280, 1280]
    - [39, 2317.0]
  - - [128, 5888, 1, 1280, 128, 128, 1280, 1280]
    - [9, 3737.0]
  - - [64, 6784, 1, 1280, 64, 64, 1280, 1280]
    - [14, 2465.0]
  - - [128, 6784, 1, 1280, 128, 128, 1280, 1280]
    - [9, 4129.0]
  - - [64, 64, 1, 3328, 64, 64, 3328, 3328]
    - [26, 110.0]
  - - [128, 64, 1, 3328, 128, 128, 3328, 3328]
    - [26, 223.0]
  - - [64, 128, 1, 3328, 64, 64, 3328, 3328]
    - [26, 220.0]
  - - [128, 128, 1, 3328, 128, 128, 3328, 3328]
    - [26, 473.0]
  - - [64, 256, 1, 3328, 64, 64, 3328, 3328]
    - [26, 473.0]
  - - [128, 256, 1, 3328, 128, 128, 3328, 3328]
    - [26, 909.0]
  - - [64, 448, 1, 3328, 64, 64, 3328, 3328]
    - [26, 817.0]
  - - [128, 448, 1, 3328, 128, 128, 3328, 3328]
    - [26, 1524.0]
  - - [64, 704, 1, 3328, 64, 64, 3328, 3328]
    - [26, 1219.0]
  - - [128, 704, 1, 3328, 128, 128, 3328, 3328]
    - [29, 1951.0]
  - - [64, 1024, 1, 3328, 64, 64, 3328, 3328]
    - [26, 1531.0]
  - - [128, 1024, 1, 3328, 128, 128, 3328, 3328]
    - [30, 2240.0]
  - - [64, 1408, 1, 3328, 64, 64, 3328, 3328]
    - [29, 1822.0]
  - - [128, 1408, 1, 3328, 128, 128, 3328, 3328]
    - [27, 2686.0]
  - - [64, 1856, 1, 3328, 64, 64, 3328, 3328]
    - [30, 1917.0]
  - - [128, 1856, 1, 3328, 128, 128, 3328, 3328]
    - [7, 2394.0]
  - - [64, 2368, 1, 3328, 64, 64, 3328, 3328]
    - [3, 2075.0]
  - - [128, 2368, 1, 3328, 128, 128, 3328, 3328]
    - [7, 2949.0]
  - - [64, 2944, 1, 3328, 64, 64, 3328, 3328]
    - [31, 2324.0]
  - - [128, 2944, 1, 3328, 128, 128, 3328, 3328]
    - [7, 3428.0]
  - - [64, 3584, 1, 3328, 64, 64, 3328, 3328]
    - [33, 2557.0]
  - - [128, 3584, 1, 3328, 128, 128, 3328, 3328]
    - [7, 3899.0]
  - - [64, 4288, 1, 3328, 64, 64, 3328, 3328]
    - [35, 2363.0]
  - - [128, 4288, 1, 3328, 128, 128, 3328, 3328]
    - [7, 3876.0]
  - - [64, 5056, 1, 3328, 64, 64, 3328, 3328]
    - [24, 2671.0]
  - - [128, 5056, 1, 3328, 128, 128, 3328, 3328]
    - [25, 4263.0]
  - - [64, 5888, 1, 3328, 64, 64, 3328, 3328]
    - [21, 2632.0]
  - - [128, 5888, 1, 3328, 128, 128, 3328, 3328]
    - [7, 4039.0]
  - - [64, 6784, 1, 3328, 64, 64, 3328, 3328]
    - [14, 2788.0]
  - - [128, 6784, 1, 3328, 128, 128, 3328, 3328]
    - [9, 4427.0]
  - - [256, 64, 1, 256, 256, 256, 256, 256]
    - [10, 352.0]
  - - [448, 64, 1, 256, 448, 448, 256, 256]
    - [10, 612.0]
  - - [704, 64, 1, 256, 704, 704, 256, 256]
    - [18, 880.0]
  - - [1024, 64, 1, 256, 1024, 1024, 256, 256]
    - [18, 1211.0]
  - - [1408, 64, 1, 256, 1408, 1408, 256, 256]
    - [18, 1519.0]
  - - [1856, 64, 1, 256, 1856, 1856, 256, 256]
    - [18, 1655.0]
  - - [2368, 64, 1, 256, 2368, 2368, 256, 256]
    - [18, 1857.0]
  - - [2944, 64, 1, 256, 2944, 2944, 256, 256]
    - [20, 2054.0]
  - - [3584, 64, 1, 256, 3584, 3584, 256, 256]
    - [5, 2432.0]
  - - [4288, 64, 1, 256, 4288, 4288, 256, 256]
    - [3, 2206.0]
  - - [5056, 64, 1, 256, 5056, 5056, 256, 256]
    - [5, 2513.0]
  - - [5888, 64, 1, 256, 5888, 5888, 256, 256]
    - [8, 2747.0]
  - - [6784, 64, 1, 256, 6784, 6784, 256, 256]
    - [39, 3025.0]
  - - [256, 128, 1, 256, 256, 256, 256, 256]
    - [4, 666.0]
  - - [448, 128, 1, 256, 448, 448, 256, 256]
    - [4, 1132.0]
  - - [704, 128, 1, 256, 704, 704, 256, 256]
    - [4, 1504.0]
  - - [1024, 128, 1, 256, 1024, 1024, 256, 256]
    - [18, 1805.0]
  - - [1408, 128, 1, 256, 1408, 1408, 256, 256]
    - [20, 2049.0]
  - - [1856, 128, 1, 256, 1856, 1856, 256, 256]
    - [7, 2094.0]
  - - [2368, 128, 1, 256, 2368, 2368, 256, 256]
    - [5, 2414.0]
  - - [2944, 128, 1, 256, 2944, 2944, 256, 256]
    - [20, 2881.0]
  - - [3584, 128, 1, 256, 3584, 3584, 256, 256]
    - [7, 3454.0]
  - - [4288, 128, 1, 256, 4288, 4288, 256, 256]
    - [24, 3455.0]
  - - [5056, 128, 1, 256, 5056, 5056, 256, 256]
    - [39, 3856.0]
  - - [5888, 128, 1, 256, 5888, 5888, 256, 256]
    - [39, 3617.0]
  - - [6784, 128, 1, 256, 6784, 6784, 256, 256]
    - [39, 4044.0]
  - - [256, 64, 1, 1280, 256, 256, 1280, 1280]
    - [26, 452.0]
  - - [448, 64, 1, 1280, 448, 448, 1280, 1280]
    - [26, 785.0]
  - - [704, 64, 1, 1280, 704, 704, 1280, 1280]
    - [26, 1183.0]
  - - [1024, 64, 1, 1280, 1024, 1024, 1280, 1280]
    - [29, 1551.0]
  - - [1408, 64, 1, 1280, 1408, 1408, 1280, 1280]
    - [26, 1915.0]
  - - [1856, 64, 1, 1280, 1856, 1856, 1280, 1280]
    - [29, 2040.0]
  - - [2368, 64, 1, 1280, 2368, 2368, 1280, 1280]
    - [27, 2324.0]
  - - [2944, 64, 1, 1280, 2944, 2944, 1280, 1280]
    - [20, 2485.0]
  - - [3584, 64, 1, 1280, 3584, 3584, 1280, 1280]
    - [5, 2893.0]
  - - [4288, 64, 1, 1280, 4288, 4288, 1280, 1280]
    - [5, 2534.0]
  - - [5056, 64, 1, 1280, 5056, 5056, 1280, 1280]
    - [24, 2805.0]
  - - [5888, 64, 1, 1280, 5888, 5888, 1280, 1280]
    - [9, 3009.0]
  - - [6784, 64, 1, 1280, 6784, 6784, 1280, 1280]
    - [9, 3092.0]
  - - [256, 128, 1, 1280, 256, 256, 1280, 1280]
    - [26, 872.0]
  - - [448, 128, 1, 1280, 448, 448, 1280, 1280]
    - [26, 1517.0]
  - - [704, 128, 1, 1280, 704, 704, 1280, 1280]
    - [29, 1996.0]
  - - [1024, 128, 1, 1280, 1024, 1024, 1280, 1280]
    - [29, 2443.0]
  - - [1408, 128, 1, 1280, 1408, 1408, 1280, 1280]
    - [30, 2780.0]
  - - [1856, 128, 1, 1280, 1856, 1856, 1280, 1280]
    - [30, 2666.0]
  - - [2368, 128, 1, 1280, 2368, 2368, 1280, 1280]
    - [7, 2905.0]
  - - [2944, 128, 1, 1280, 2944, 2944, 1280, 1280]
    - [5, 3508.0]
  - - [3584, 128, 1, 1280, 3584, 3584, 1280, 1280]
    - [39, 4152.0]
  - - [4288, 128, 1, 1280, 4288, 4288, 1280, 1280]
    - [24, 3916.0]
  - - [5056, 128, 1, 1280, 5056, 5056, 1280, 1280]
    - [39, 4549.0]
  - - [5888, 128, 1, 1280, 5888, 5888, 1280, 1280]
    - [24, 4197.0]
  - - [6784, 128, 1, 1280, 6784, 6784, 1280, 1280]
    - [39, 4679.0]
  - - [256, 64, 1, 3328, 256, 256, 3328, 3328]
    - [26, 472.0]
  - - [448, 64, 1, 3328, 448, 448, 3328, 3328]
    - [26, 824.0]
  - - [704, 64, 1, 3328, 704, 704, 3328, 3328]
    - [26, 1249.0]
  - - [1024, 64, 1, 3328, 1024, 1024, 3328, 3328]
    - [26, 1634.0]
  - - [1408, 64, 1, 3328, 1408, 1408, 3328, 3328]
    - [26, 2057.0]
  - - [1856, 64, 1, 3328, 1856, 1856, 3328, 3328]
    - [26, 2163.0]
  - - [2368, 64, 1, 3328, 2368, 2368, 3328, 3328]
    - [27, 2476.0]
  - - [2944, 64, 1, 3328, 2944, 2944, 3328, 3328]
    - [20, 2550.0]
  - - [3584, 64, 1, 3328, 3584, 3584, 3328, 3328]
    - [28, 2949.0]
  - - [4288, 64, 1, 3328, 4288, 4288, 3328, 3328]
    - [24, 2624.0]
  - - [5056, 64, 1, 3328, 5056, 5056, 3328, 3328]
    - [24, 2894.0]
  - - [5888, 64, 1, 3328, 5888, 5888, 3328, 3328]
    - [25, 3032.0]
  - - [6784, 64, 1, 3328, 6784, 6784, 3328, 3328]
    - [14, 3094.0]
  - - [256, 128, 1, 3328, 256, 256, 3328, 3328]
    - [26, 916.0]
  - - [448, 128, 1, 3328, 448, 448, 3328, 3328]
    - [26, 1585.0]
  - - [704, 128, 1, 3328, 704, 704, 3328, 3328]
    - [26, 2081.0]
  - - [1024, 128, 1, 3328, 1024, 1024, 3328, 3328]
    - [29, 2498.0]
  - - [1408, 128, 1, 3328, 1408, 1408, 3328, 3328]
    - [30, 2869.0]
  - - [1856, 128, 1, 3328, 1856, 1856, 3328, 3328]
    - [27, 2680.0]
  - - [2368, 128, 1, 3328, 2368, 2368, 3328, 3328]
    - [24, 2976.0]
  - - [2944, 128, 1, 3328, 2944, 2944, 3328, 3328]
    - [39, 3569.0]
  - - [3584, 128, 1, 3328, 3584, 3584, 3328, 3328]
    - [39, 4315.0]
  - - [4288, 128, 1, 3328, 4288, 4288, 3328, 3328]
    - [39, 4038.0]
  - - [5056, 128, 1, 3328, 5056, 5056, 3328, 3328]
    - [39, 4708.0]
  - - [5888, 128, 1, 3328, 5888, 5888, 3328, 3328]
    - [39, 4324.0]
  - - [6784, 128, 1, 3328, 6784, 6784, 3328, 3328]
    - [39, 4947.0]
  - - [256, 256, 1, 256, 256, 256, 256, 256]
    - [4, 1180.0]
  - - [448, 256, 1, 256, 448, 448, 256, 256]
    - [18, 1843.0]
  - - [256, 448, 1, 256, 256, 256, 256, 256]
    - [18, 1802.0]
  - - [448, 448, 1, 256, 448, 448, 256, 256]
    - [2, 2320.0]
  - - [256, 256, 1, 1280, 256, 256, 1280, 1280]
    - [29, 1573.0]
  - - [448, 256, 1, 1280, 448, 448, 1280, 1280]
    - [29, 2528.0]
  - - [256, 448, 1, 1280, 256, 256, 1280, 1280]
    - [29, 2505.0]
  - - [448, 448, 1, 1280, 448, 448, 1280, 1280]
    - [30, 3110.0]
  - - [256, 256, 1, 3328, 256, 256, 3328, 3328]
    - [26, 1586.0]
  - - [448, 256, 1, 3328, 448, 448, 3328, 3328]
    - [29, 2589.0]
  - - [256, 448, 1, 3328, 256, 256, 3328, 3328]
    - [29, 2308.0]
  - - [448, 448, 1, 3328, 448, 448, 3328, 3328]
    - [27, 3025.0]
  - - [1760, 32, 1, 1760, 1760, 1760, 1760, 1760]
    - [10, 1307.0]
  - - [3072, 32, 1, 1024, 3072, 3072, 1024, 1024]
    - [32, 1452.0]
  - - [2048, 32, 1, 2048, 2048, 2048, 2048, 2048]
    - [10, 1326.0]
  - - [1760, 64, 1, 1760, 1760, 1760, 1760, 1760]
    - [26, 2315.0]
  - - [3072, 64, 1, 1024, 3072, 3072, 1024, 1024]
    - [33, 2321.0]
  - - [2560, 32, 1, 2560, 2560, 2560, 2560, 2560]
    - [32, 1498.0]
  - - [4608, 32, 1, 1536, 4608, 4608, 1536, 1536]
    - [27, 1552.0]
  - - [2048, 64, 1, 2048, 2048, 2048, 2048, 2048]
    - [19, 1786.0]
  - - [1760, 128, 1, 1760, 1760, 1760, 1760, 1760]
    - [30, 3383.0]
  - - [3072, 128, 1, 1024, 3072, 3072, 1024, 1024]
    - [24, 3397.0]
  - - [2560, 64, 1, 2560, 2560, 2560, 2560, 2560]
    - [27, 2335.0]
  - - [6144, 32, 1, 2560, 6144, 6144, 2560, 2560]
    - [6, 1607.0]
  - - [2048, 128, 1, 2048, 2048, 2048, 2048, 2048]
    - [7, 2530.0]
  - - [4096, 32, 1, 4096, 4096, 4096, 4096, 4096]
    - [11, 1734.0]
  - - [7680, 32, 1, 2560, 7680, 7680, 2560, 2560]
    - [21, 1539.0]
  - - [8448, 32, 1, 2816, 8448, 8448, 2816, 2816]
    - [23, 1531.0]
  - - [2560, 128, 1, 2560, 2560, 2560, 2560, 2560]
    - [24, 3195.0]
  - - [4096, 64, 1, 4096, 4096, 4096, 4096, 4096]
    - [35, 2438.0]
  - - [7680, 64, 1, 2560, 7680, 7680, 2560, 2560]
    - [24, 2776.0]
  - - [4096, 128, 1, 4096, 4096, 4096, 4096, 4096]
    - [24, 3562.0]
  - - [7680, 128, 1, 2560, 7680, 7680, 2560, 2560]
    - [25, 3844.0]
  - - [704, 256, 1, 256, 704, 704, 256, 256]
    - [20, 1573.0]
  - - [1024, 256, 1, 256, 1024, 1024, 256, 256]
    - [39, 2152.0]
  - - [1408, 256, 1, 256, 1408, 1408, 256, 256]
    - [39, 2768.0]
  - - [1856, 256, 1, 256, 1856, 1856, 256, 256]
    - [36, 3046.0]
  - - [2368, 256, 1, 256, 2368, 2368, 256, 256]
    - [39, 3754.0]
  - - [2944, 256, 1, 256, 2944, 2944, 256, 256]
    - [39, 3753.0]
  - - [3584, 256, 1, 256, 3584, 3584, 256, 256]
    - [39, 4245.0]
  - - [4288, 256, 1, 256, 4288, 4288, 256, 256]
    - [39, 4196.0]
  - - [5056, 256, 1, 256, 5056, 5056, 256, 256]
    - [39, 4284.0]
  - - [5888, 256, 1, 256, 5888, 5888, 256, 256]
    - [39, 4218.0]
  - - [6784, 256, 1, 256, 6784, 6784, 256, 256]
    - [39, 4397.0]
  - - [704, 448, 1, 256, 704, 704, 256, 256]
    - [20, 2460.0]
  - - [1024, 448, 1, 256, 1024, 1024, 256, 256]
    - [39, 3171.0]
  - - [1408, 448, 1, 256, 1408, 1408, 256, 256]
    - [39, 3824.0]
  - - [1856, 448, 1, 256, 1856, 1856, 256, 256]
    - [39, 4093.0]
  - - [2368, 448, 1, 256, 2368, 2368, 256, 256]
    - [39, 4209.0]
  - - [2944, 448, 1, 256, 2944, 2944, 256, 256]
    - [39, 4473.0]
  - - [3584, 448, 1, 256, 3584, 3584, 256, 256]
    - [39, 4450.0]
  - - [4288, 448, 1, 256, 4288, 4288, 256, 256]
    - [39, 4582.0]
  - - [5056, 448, 1, 256, 5056, 5056, 256, 256]
    - [39, 4814.0]
  - - [5888, 448, 1, 256, 5888, 5888, 256, 256]
    - [39, 4694.0]
  - - [6784, 448, 1, 256, 6784, 6784, 256, 256]
    - [39, 4742.0]
  - - [256, 704, 1, 256, 256, 256, 256, 256]
    - [20, 2076.0]
  - - [448, 704, 1, 256, 448, 448, 256, 256]
    - [20, 2466.0]
  - - [704, 704, 1, 256, 704, 704, 256, 256]
    - [36, 3166.0]
  - - [1024, 704, 1, 256, 1024, 1024, 256, 256]
    - [20, 3385.0]
  - - [1408, 704, 1, 256, 1408, 1408, 256, 256]
    - [39, 3974.0]
  - - [1856, 704, 1, 256, 1856, 1856, 256, 256]
    - [39, 4453.0]
  - - [2368, 704, 1, 256, 2368, 2368, 256, 256]
    - [39, 4394.0]
  - - [2944, 704, 1, 256, 2944, 2944, 256, 256]
    - [39, 4440.0]
  - - [3584, 704, 1, 256, 3584, 3584, 256, 256]
    - [39, 4415.0]
  - - [4288, 704, 1, 256, 4288, 4288, 256, 256]
    - [39, 4481.0]
  - - [5056, 704, 1, 256, 5056, 5056, 256, 256]
    - [39, 4631.0]
  - - [5888, 704, 1, 256, 5888, 5888, 256, 256]
    - [39, 4439.0]
  - - [6784, 704, 1, 256, 6784, 6784, 256, 256]
    - [39, 4682.0]
  - - [256, 1024, 1, 256, 256, 256, 256, 256]
    - [39, 2183.0]
  - - [448, 1024, 1, 256, 448, 448, 256, 256]
    - [39, 3492.0]
  - - [704, 1024, 1, 256, 704, 704, 256, 256]
    - [39, 3674.0]
  - - [1024, 1024, 1, 256, 1024, 1024, 256, 256]
    - [39, 3549.0]
  - - [1408, 1024, 1, 256, 1408, 1408, 256, 256]
    - [39, 4413.0]
  - - [1856, 1024, 1, 256, 1856, 1856, 256, 256]
    - [39, 4675.0]
  - - [2368, 1024, 1, 256, 2368, 2368, 256, 256]
    - [39, 4864.0]
  - - [2944, 1024, 1, 256, 2944, 2944, 256, 256]
    - [39, 4817.0]
  - - [3584, 1024, 1, 256, 3584, 3584, 256, 256]
    - [39, 4602.0]
  - - [4288, 1024, 1, 256, 4288, 4288, 256, 256]
    - [39, 4892.0]
  - - [5056, 1024, 1, 256, 5056, 5056, 256, 256]
    - [39, 5041.0]
  - - [5888, 1024, 1, 256, 5888, 5888, 256, 256]
    - [39, 4917.0]
  - - [6784, 1024, 1, 256, 6784, 6784, 256, 256]
    - [39, 5048.0]
  - - [256, 1408, 1, 256, 256, 256, 256, 256]
    - [39, 2702.0]
  - - [448, 1408, 1, 256, 448, 448, 256, 256]
    - [39, 3851.0]
  - - [704, 1408, 1, 256, 704, 704, 256, 256]
    - [39, 4088.0]
  - - [1024, 1408, 1, 256, 1024, 1024, 256, 256]
    - [43, 3567.0]
  - - [1408, 1408, 1, 256, 1408, 1408, 256, 256]
    - [39, 4821.0]
  - - [1856, 1408, 1, 256, 1856, 1856, 256, 256]
    - [39, 4882.0]
  - - [2368, 1408, 1, 256, 2368, 2368, 256, 256]
    - [39, 4905.0]
  - - [2944, 1408, 1, 256, 2944, 2944, 256, 256]
    - [39, 4871.0]
  - - [3584, 1408, 1, 256, 3584, 3584, 256, 256]
    - [39, 4638.0]
  - - [4288, 1408, 1, 256, 4288, 4288, 256, 256]
    - [39, 5017.0]
  - - [5056, 1408, 1, 256, 5056, 5056, 256, 256]
    - [39, 5043.0]
  - - [5888, 1408, 1, 256, 5888, 5888, 256, 256]
    - [39, 4901.0]
  - - [6784, 1408, 1, 256, 6784, 6784, 256, 256]
    - [39, 5101.0]
  - - [256, 1856, 1, 256, 256, 256, 256, 256]
    - [39, 2964.0]
  - - [448, 1856, 1, 256, 448, 448, 256, 256]
    - [39, 4146.0]
  - - [704, 1856, 1, 256, 704, 704, 256, 256]
    - [39, 4580.0]
  - - [1024, 1856, 1, 256, 1024, 1024, 256, 256]
    - [39, 3971.0]
  - - [1408, 1856, 1, 256, 1408, 1408, 256, 256]
    - [39, 4855.0]
  - - [1856, 1856, 1, 256, 1856, 1856, 256, 256]
    - [39, 4962.0]
  - - [2368, 1856, 1, 256, 2368, 2368, 256, 256]
    - [39, 5011.0]
  - - [2944, 1856, 1, 256, 2944, 2944, 256, 256]
    - [39, 5061.0]
  - - [3584, 1856, 1, 256, 3584, 3584, 256, 256]
    - [39, 4605.0]
  - - [4288, 1856, 1, 256, 4288, 4288, 256, 256]
    - [39, 5069.0]
  - - [5056, 1856, 1, 256, 5056, 5056, 256, 256]
    - [39, 5120.0]
  - - [5888, 1856, 1, 256, 5888, 5888, 256, 256]
    - [39, 5001.0]
  - - [6784, 1856, 1, 256, 6784, 6784, 256, 256]
    - [39, 5142.0]
  - - [256, 2368, 1, 256, 256, 256, 256, 256]
    - [39, 3708.0]
  - - [448, 2368, 1, 256, 448, 448, 256, 256]
    - [39, 4224.0]
  - - [704, 2368, 1, 256, 704, 704, 256, 256]
    - [36, 4533.0]
  - - [1024, 2368, 1, 256, 1024, 1024, 256, 256]
    - [39, 4029.0]
  - - [1408, 2368, 1, 256, 1408, 1408, 256, 256]
    - [39, 5080.0]
  - - [1856, 2368, 1, 256, 1856, 1856, 256, 256]
    - [39, 5036.0]
  - - [2368, 2368, 1, 256, 2368, 2368, 256, 256]
    - [39, 5132.0]
  - - [2944, 2368, 1, 256, 2944, 2944, 256, 256]
    - [39, 5104.0]
  - - [3584, 2368, 1, 256, 3584, 3584, 256, 256]
    - [39, 4728.0]
  - - [4288, 2368, 1, 256, 4288, 4288, 256, 256]
    - [39, 5132.0]
  - - [5056, 2368, 1, 256, 5056, 5056, 256, 256]
    - [39, 5180.0]
  - - [5888, 2368, 1, 256, 5888, 5888, 256, 256]
    - [39, 5001.0]
  - - [6784, 2368, 1, 256, 6784, 6784, 256, 256]
    - [39, 5159.0]
  - - [256, 2944, 1, 256, 256, 256, 256, 256]
    - [39, 3684.0]
  - - [448, 2944, 1, 256, 448, 448, 256, 256]
    - [39, 4572.0]
  - - [704, 2944, 1, 256, 704, 704, 256, 256]
    - [39, 4681.0]
  - - [1024, 2944, 1, 256, 1024, 1024, 256, 256]
    - [39, 4265.0]
  - - [1408, 2944, 1, 256, 1408, 1408, 256, 256]
    - [39, 5060.0]
  - - [1856, 2944, 1, 256, 1856, 1856, 256, 256]
    - [39, 5171.0]
  - - [2368, 2944, 1, 256, 2368, 2368, 256, 256]
    - [39, 5202.0]
  - - [2944, 2944, 1, 256, 2944, 2944, 256, 256]
    - [39, 5136.0]
  - - [3584, 2944, 1, 256, 3584, 3584, 256, 256]
    - [39, 4795.0]
  - - [4288, 2944, 1, 256, 4288, 4288, 256, 256]
    - [39, 5202.0]
  - - [5056, 2944, 1, 256, 5056, 5056, 256, 256]
    - [40, 5246.0]
  - - [5888, 2944, 1, 256, 5888, 5888, 256, 256]
    - [39, 5090.0]
  - - [6784, 2944, 1, 256, 6784, 6784, 256, 256]
    - [39, 5223.0]
  - - [256, 3584, 1, 256, 256, 256, 256, 256]
    - [39, 4285.0]
  - - [448, 3584, 1, 256, 448, 448, 256, 256]
    - [39, 4813.0]
  - - [704, 3584, 1, 256, 704, 704, 256, 256]
    - [39, 5011.0]
  - - [1024, 3584, 1, 256, 1024, 1024, 256, 256]
    - [39, 4415.0]
  - - [1408, 3584, 1, 256, 1408, 1408, 256, 256]
    - [39, 5223.0]
  - - [1856, 3584, 1, 256, 1856, 1856, 256, 256]
    - [39, 5201.0]
  - - [2368, 3584, 1, 256, 2368, 2368, 256, 256]
    - [39, 5224.0]
  - - [2944, 3584, 1, 256, 2944, 2944, 256, 256]
    - [39, 5194.0]
  - - [3584, 3584, 1, 256, 3584, 3584, 256, 256]
    - [39, 4816.0]
  - - [4288, 3584, 1, 256, 4288, 4288, 256, 256]
    - [39, 5239.0]
  - - [5056, 3584, 1, 256, 5056, 5056, 256, 256]
    - [40, 5319.0]
  - - [5888, 3584, 1, 256, 5888, 5888, 256, 256]
    - [39, 5139.0]
  - - [6784, 3584, 1, 256, 6784, 6784, 256, 256]
    - [39, 5274.0]
  - - [256, 4288, 1, 256, 256, 256, 256, 256]
    - [39, 4044.0]
  - - [448, 4288, 1, 256, 448, 448, 256, 256]
    - [39, 4678.0]
  - - [704, 4288, 1, 256, 704, 704, 256, 256]
    - [39, 4999.0]
  - - [1024, 4288, 1, 256, 1024, 1024, 256, 256]
    - [20, 4362.0]
  - - [1408, 4288, 1, 256, 1408, 1408, 256, 256]
    - [39, 5313.0]
  - - [1856, 4288, 1, 256, 1856, 1856, 256, 256]
    - [39, 5320.0]
  - - [2368, 4288, 1, 256, 2368, 2368, 256, 256]
    - [39, 5274.0]
  - - [2944, 4288, 1, 256, 2944, 2944, 256, 256]
    - [39, 5190.0]
  - - [3584, 4288, 1, 256, 3584, 3584, 256, 256]
    - [39, 4813.0]
  - - [4288, 4288, 1, 256, 4288, 4288, 256, 256]
    - [39, 5212.0]
  - - [5056, 4288, 1, 256, 5056, 5056, 256, 256]
    - [39, 5235.0]
  - - [5888, 4288, 1, 256, 5888, 5888, 256, 256]
    - [39, 5103.0]
  - - [6784, 4288, 1, 256, 6784, 6784, 256, 256]
    - [39, 5239.0]
  - - [256, 5056, 1, 256, 256, 256, 256, 256]
    - [39, 4142.0]
  - - [448, 5056, 1, 256, 448, 448, 256, 256]
    - [39, 4646.0]
  - - [704, 5056, 1, 256, 704, 704, 256, 256]
    - [39, 5058.0]
  - - [1024, 5056, 1, 256, 1024, 1024, 256, 256]
    - [39, 4499.0]
  - - [1408, 5056, 1, 256, 1408, 1408, 256, 256]
    - [39, 5324.0]
  - - [1856, 5056, 1, 256, 1856, 1856, 256, 256]
    - [39, 5347.0]
  - - [2368, 5056, 1, 256, 2368, 2368, 256, 256]
    - [39, 5288.0]
  - - [2944, 5056, 1, 256, 2944, 2944, 256, 256]
    - [39, 5228.0]
  - - [3584, 5056, 1, 256, 3584, 3584, 256, 256]
    - [39, 4890.0]
  - - [4288, 5056, 1, 256, 4288, 4288, 256, 256]
    - [39, 5296.0]
  - - [5056, 5056, 1, 256, 5056, 5056, 256, 256]
    - [40, 5355.0]
  - - [5888, 5056, 1, 256, 5888, 5888, 256, 256]
    - [39, 5156.0]
  - - [6784, 5056, 1, 256, 6784, 6784, 256, 256]
    - [39, 5299.0]
  - - [256, 5888, 1, 256, 256, 256, 256, 256]
    - [39, 4228.0]
  - - [448, 5888, 1, 256, 448, 448, 256, 256]
    - [39, 4818.0]
  - - [704, 5888, 1, 256, 704, 704, 256, 256]
    - [39, 5155.0]
  - - [1024, 5888, 1, 256, 1024, 1024, 256, 256]
    - [39, 4577.0]
  - - [1408, 5888, 1, 256, 1408, 1408, 256, 256]
    - [39, 5412.0]
  - - [1856, 5888, 1, 256, 1856, 1856, 256, 256]
    - [39, 5342.0]
  - - [2368, 5888, 1, 256, 2368, 2368, 256, 256]
    - [39, 5334.0]
  - - [2944, 5888, 1, 256, 2944, 2944, 256, 256]
    - [39, 5228.0]
  - - [3584, 5888, 1, 256, 3584, 3584, 256, 256]
    - [39, 4844.0]
  - - [4288, 5888, 1, 256, 4288, 4288, 256, 256]
    - [40, 5362.0]
  - - [5056, 5888, 1, 256, 5056, 5056, 256, 256]
    - [39, 5296.0]
  - - [5888, 5888, 1, 256, 5888, 5888, 256, 256]
    - [39, 5141.0]
  - - [6784, 5888, 1, 256, 6784, 6784, 256, 256]
    - [39, 5297.0]
  - - [256, 6784, 1, 256, 256, 256, 256, 256]
    - [39, 4159.0]
  - - [448, 6784, 1, 256, 448, 448, 256, 256]
    - [39, 4818.0]
  - - [704, 6784, 1, 256, 704, 704, 256, 256]
    - [39, 5283.0]
  - - [1024, 6784, 1, 256, 1024, 1024, 256, 256]
    - [39, 4536.0]
  - - [1408, 6784, 1, 256, 1408, 1408, 256, 256]
    - [39, 5498.0]
  - - [1856, 6784, 1, 256, 1856, 1856, 256, 256]
    - [39, 5389.0]
  - - [2368, 6784, 1, 256, 2368, 2368, 256, 256]
    - [39, 5344.0]
  - - [2944, 6784, 1, 256, 2944, 2944, 256, 256]
    - [39, 5248.0]
  - - [3584, 6784, 1, 256, 3584, 3584, 256, 256]
    - [39, 4866.0]
  - - [4288, 6784, 1, 256, 4288, 4288, 256, 256]
    - [39, 5274.0]
  - - [5056, 6784, 1, 256, 5056, 5056, 256, 256]
    - [40, 5354.0]
  - - [5888, 6784, 1, 256, 5888, 5888, 256, 256]
    - [39, 5119.0]
  - - [6784, 6784, 1, 256, 6784, 6784, 256, 256]
    - [40, 5323.0]
  - - [704, 256, 1, 1280, 704, 704, 1280, 1280]
    - [36, 2086.0]
  - - [1024, 256, 1, 1280, 1024, 1024, 1280, 1280]
    - [39, 2450.0]
  - - [1408, 256, 1, 1280, 1408, 1408, 1280, 1280]
    - [39, 3295.0]
  - - [1856, 256, 1, 1280, 1856, 1856, 1280, 1280]
    - [39, 3417.0]
  - - [2368, 256, 1, 1280, 2368, 2368, 1280, 1280]
    - [39, 4355.0]
  - - [2944, 256, 1, 1280, 2944, 2944, 1280, 1280]
    - [39, 4238.0]
  - - [3584, 256, 1, 1280, 3584, 3584, 1280, 1280]
    - [39, 5096.0]
  - - [4288, 256, 1, 1280, 4288, 4288, 1280, 1280]
    - [39, 4880.0]
  - - [5056, 256, 1, 1280, 5056, 5056, 1280, 1280]
    - [39, 4959.0]
  - - [5888, 256, 1, 1280, 5888, 5888, 1280, 1280]
    - [39, 5049.0]
  - - [6784, 256, 1, 1280, 6784, 6784, 1280, 1280]
    - [39, 5168.0]
  - - [704, 448, 1, 1280, 704, 704, 1280, 1280]
    - [39, 2873.0]
  - - [1024, 448, 1, 1280, 1024, 1024, 1280, 1280]
    - [39, 4028.0]
  - - [1408, 448, 1, 1280, 1408, 1408, 1280, 1280]
    - [39, 4524.0]
  - - [1856, 448, 1, 1280, 1856, 1856, 1280, 1280]
    - [39, 4698.0]
  - - [2368, 448, 1, 1280, 2368, 2368, 1280, 1280]
    - [39, 4764.0]
  - - [2944, 448, 1, 1280, 2944, 2944, 1280, 1280]
    - [39, 5089.0]
  - - [3584, 448, 1, 1280, 3584, 3584, 1280, 1280]
    - [39, 5415.0]
  - - [4288, 448, 1, 1280, 4288, 4288, 1280, 1280]
    - [39, 5126.0]
  - - [5056, 448, 1, 1280, 5056, 5056, 1280, 1280]
    - [39, 5507.0]
  - - [5888, 448, 1, 1280, 5888, 5888, 1280, 1280]
    - [39, 5413.0]
  - - [6784, 448, 1, 1280, 6784, 6784, 1280, 1280]
    - [39, 5391.0]
  - - [256, 704, 1, 1280, 256, 256, 1280, 1280]
    - [31, 2394.0]
  - - [448, 704, 1, 1280, 448, 448, 1280, 1280]
    - [31, 2963.0]
  - - [704, 704, 1, 1280, 704, 704, 1280, 1280]
    - [39, 3524.0]
  - - [1024, 704, 1, 1280, 1024, 1024, 1280, 1280]
    - [20, 3931.0]
  - - [1408, 704, 1, 1280, 1408, 1408, 1280, 1280]
    - [39, 4446.0]
  - - [1856, 704, 1, 1280, 1856, 1856, 1280, 1280]
    - [39, 5013.0]
  - - [2368, 704, 1, 1280, 2368, 2368, 1280, 1280]
    - [39, 4933.0]
  - - [2944, 704, 1, 1280, 2944, 2944, 1280, 1280]
    - [39, 5010.0]
  - - [3584, 704, 1, 1280, 3584, 3584, 1280, 1280]
    - [39, 5421.0]
  - - [4288, 704, 1, 1280, 4288, 4288, 1280, 1280]
    - [39, 5314.0]
  - - [5056, 704, 1, 1280, 5056, 5056, 1280, 1280]
    - [39, 5502.0]
  - - [5888, 704, 1, 1280, 5888, 5888, 1280, 1280]
    - [39, 5373.0]
  - - [6784, 704, 1, 1280, 6784, 6784, 1280, 1280]
    - [39, 5655.0]
  - - [256, 1024, 1, 1280, 256, 256, 1280, 1280]
    - [39, 2441.0]
  - - [448, 1024, 1, 1280, 448, 448, 1280, 1280]
    - [39, 4065.0]
  - - [704, 1024, 1, 1280, 704, 704, 1280, 1280]
    - [39, 4060.0]
  - - [1024, 1024, 1, 1280, 1024, 1024, 1280, 1280]
    - [39, 4187.0]
  - - [1408, 1024, 1, 1280, 1408, 1408, 1280, 1280]
    - [39, 4826.0]
  - - [1856, 1024, 1, 1280, 1856, 1856, 1280, 1280]
    - [39, 4981.0]
  - - [2368, 1024, 1, 1280, 2368, 2368, 1280, 1280]
    - [39, 5270.0]
  - - [2944, 1024, 1, 1280, 2944, 2944, 1280, 1280]
    - [39, 5256.0]
  - - [3584, 1024, 1, 1280, 3584, 3584, 1280, 1280]
    - [39, 5537.0]
  - - [4288, 1024, 1, 1280, 4288, 4288, 1280, 1280]
    - [39, 5500.0]
  - - [5056, 1024, 1, 1280, 5056, 5056, 1280, 1280]
    - [39, 5676.0]
  - - [5888, 1024, 1, 1280, 5888, 5888, 1280, 1280]
    - [39, 5619.0]
  - - [6784, 1024, 1, 1280, 6784, 6784, 1280, 1280]
    - [39, 5694.0]
  - - [256, 1408, 1, 1280, 256, 256, 1280, 1280]
    - [39, 3249.0]
  - - [448, 1408, 1, 1280, 448, 448, 1280, 1280]
    - [39, 4312.0]
  - - [704, 1408, 1, 1280, 704, 704, 1280, 1280]
    - [39, 4305.0]
  - - [1024, 1408, 1, 1280, 1024, 1024, 1280, 1280]
    - [39, 4125.0]
  - - [1408, 1408, 1, 1280, 1408, 1408, 1280, 1280]
    - [39, 4975.0]
  - - [1856, 1408, 1, 1280, 1856, 1856, 1280, 1280]
    - [39, 5212.0]
  - - [2368, 1408, 1, 1280, 2368, 2368, 1280, 1280]
    - [39, 5414.0]
  - - [2944, 1408, 1, 1280, 2944, 2944, 1280, 1280]
    - [39, 5377.0]
  - - [3584, 1408, 1, 1280, 3584, 3584, 1280, 1280]
    - [39, 5573.0]
  - - [4288, 1408, 1, 1280, 4288, 4288, 1280, 1280]
    - [39, 5618.0]
  - - [5056, 1408, 1, 1280, 5056, 5056, 1280, 1280]
    - [39, 5653.0]
  - - [5888, 1408, 1, 1280, 5888, 5888, 1280, 1280]
    - [39, 5668.0]
  - - [6784, 1408, 1, 1280, 6784, 6784, 1280, 1280]
    - [39, 5789.0]
  - - [256, 1856, 1, 1280, 256, 256, 1280, 1280]
    - [36, 3319.0]
  - - [448, 1856, 1, 1280, 448, 448, 1280, 1280]
    - [39, 4290.0]
  - - [704, 1856, 1, 1280, 704, 704, 1280, 1280]
    - [39, 4664.0]
  - - [1024, 1856, 1, 1280, 1024, 1024, 1280, 1280]
    - [42, 4407.0]
  - - [1408, 1856, 1, 1280, 1408, 1408, 1280, 1280]
    - [39, 5018.0]
  - - [1856, 1856, 1, 1280, 1856, 1856, 1280, 1280]
    - [39, 5282.0]
  - - [2368, 1856, 1, 1280, 2368, 2368, 1280, 1280]
    - [39, 5425.0]
  - - [2944, 1856, 1, 1280, 2944, 2944, 1280, 1280]
    - [39, 5610.0]
  - - [3584, 1856, 1, 1280, 3584, 3584, 1280, 1280]
    - [39, 5617.0]
  - - [4288, 1856, 1, 1280, 4288, 4288, 1280, 1280]
    - [39, 5758.0]
  - - [5056, 1856, 1, 1280, 5056, 5056, 1280, 1280]
    - [39, 5827.0]
  - - [5888, 1856, 1, 1280, 5888, 5888, 1280, 1280]
    - [39, 5754.0]
  - - [6784, 1856, 1, 1280, 6784, 6784, 1280, 1280]
    - [39, 5846.0]
  - - [256, 2368, 1, 1280, 256, 256, 1280, 1280]
    - [39, 4155.0]
  - - [448, 2368, 1, 1280, 448, 448, 1280, 1280]
    - [41, 4012.0]
  - - [704, 2368, 1, 1280, 704, 704, 1280, 1280]
    - [41, 4797.0]
  - - [1024, 2368, 1, 1280, 1024, 1024, 1280, 1280]
    - [41, 4598.0]
  - - [1408, 2368, 1, 1280, 1408, 1408, 1280, 1280]
    - [39, 5015.0]
  - - [1856, 2368, 1, 1280, 1856, 1856, 1280, 1280]
    - [39, 5359.0]
  - - [2368, 2368, 1, 1280, 2368, 2368, 1280, 1280]
    - [39, 5557.0]
  - - [2944, 2368, 1, 1280, 2944, 2944, 1280, 1280]
    - [39, 5598.0]
  - - [3584, 2368, 1, 1280, 3584, 3584, 1280, 1280]
    - [39, 5631.0]
  - - [4288, 2368, 1, 1280, 4288, 4288, 1280, 1280]
    - [39, 5732.0]
  - - [5056, 2368, 1, 1280, 5056, 5056, 1280, 1280]
    - [39, 5774.0]
  - - [5888, 2368, 1, 1280, 5888, 5888, 1280, 1280]
    - [39, 5792.0]
  - - [6784, 2368, 1, 1280, 6784, 6784, 1280, 1280]
    - [39, 5821.0]
  - - [256, 2944, 1, 1280, 256, 256, 1280, 1280]
    - [39, 3962.0]
  - - [448, 2944, 1, 1280, 448, 448, 1280, 1280]
    - [43, 3864.0]
  - - [704, 2944, 1, 1280, 704, 704, 1280, 1280]
    - [41, 4728.0]
  - - [1024, 2944, 1, 1280, 1024, 1024, 1280, 1280]
    - [41, 4826.0]
  - - [1408, 2944, 1, 1280, 1408, 1408, 1280, 1280]
    - [39, 5148.0]
  - - [1856, 2944, 1, 1280, 1856, 1856, 1280, 1280]
    - [39, 5559.0]
  - - [2368, 2944, 1, 1280, 2368, 2368, 1280, 1280]
    - [39, 5588.0]
  - - [2944, 2944, 1, 1280, 2944, 2944, 1280, 1280]
    - [39, 5718.0]
  - - [3584, 2944, 1, 1280, 3584, 3584, 1280, 1280]
    - [39, 5648.0]
  - - [4288, 2944, 1, 1280, 4288, 4288, 1280, 1280]
    - [39, 5752.0]
  - - [5056, 2944, 1, 1280, 5056, 5056, 1280, 1280]
    - [39, 5862.0]
  - - [5888, 2944, 1, 1280, 5888, 5888, 1280, 1280]
    - [39, 5795.0]
  - - [6784, 2944, 1, 1280, 6784, 6784, 1280, 1280]
    - [39, 5851.0]
  - - [256, 3584, 1, 1280, 256, 256, 1280, 1280]
    - [41, 4421.0]
  - - [448, 3584, 1, 1280, 448, 448, 1280, 1280]
    - [41, 4620.0]
  - - [704, 3584, 1, 1280, 704, 704, 1280, 1280]
    - [41, 4800.0]
  - - [1024, 3584, 1, 1280, 1024, 1024, 1280, 1280]
    - [41, 5067.0]
  - - [1408, 3584, 1, 1280, 1408, 1408, 1280, 1280]
    - [41, 5277.0]
  - - [1856, 3584, 1, 1280, 1856, 1856, 1280, 1280]
    - [39, 5617.0]
  - - [2368, 3584, 1, 1280, 2368, 2368, 1280, 1280]
    - [39, 5723.0]
  - - [2944, 3584, 1, 1280, 2944, 2944, 1280, 1280]
    - [39, 5752.0]
  - - [3584, 3584, 1, 1280, 3584, 3584, 1280, 1280]
    - [39, 5679.0]
  - - [4288, 3584, 1, 1280, 4288, 4288, 1280, 1280]
    - [39, 5846.0]
  - - [5056, 3584, 1, 1280, 5056, 5056, 1280, 1280]
    - [39, 5887.0]
  - - [5888, 3584, 1, 1280, 5888, 5888, 1280, 1280]
    - [39, 5835.0]
  - - [6784, 3584, 1, 1280, 6784, 6784, 1280, 1280]
    - [39, 5893.0]
  - - [256, 4288, 1, 1280, 256, 256, 1280, 1280]
    - [41, 4164.0]
  - - [448, 4288, 1, 1280, 448, 448, 1280, 1280]
    - [41, 4373.0]
  - - [704, 4288, 1, 1280, 704, 704, 1280, 1280]
    - [42, 4491.0]
  - - [1024, 4288, 1, 1280, 1024, 1024, 1280, 1280]
    - [41, 4913.0]
  - - [1408, 4288, 1, 1280, 1408, 1408, 1280, 1280]
    - [39, 5156.0]
  - - [1856, 4288, 1, 1280, 1856, 1856, 1280, 1280]
    - [39, 5549.0]
  - - [2368, 4288, 1, 1280, 2368, 2368, 1280, 1280]
    - [39, 5665.0]
  - - [2944, 4288, 1, 1280, 2944, 2944, 1280, 1280]
    - [39, 5678.0]
  - - [3584, 4288, 1, 1280, 3584, 3584, 1280, 1280]
    - [39, 5686.0]
  - - [4288, 4288, 1, 1280, 4288, 4288, 1280, 1280]
    - [39, 5803.0]
  - - [5056, 4288, 1, 1280, 5056, 5056, 1280, 1280]
    - [39, 5857.0]
  - - [5888, 4288, 1, 1280, 5888, 5888, 1280, 1280]
    - [39, 5783.0]
  - - [6784, 4288, 1, 1280, 6784, 6784, 1280, 1280]
    - [39, 5879.0]
  - - [256, 5056, 1, 1280, 256, 256, 1280, 1280]
    - [41, 4775.0]
  - - [448, 5056, 1, 1280, 448, 448, 1280, 1280]
    - [41, 4392.0]
  - - [704, 5056, 1, 1280, 704, 704, 1280, 1280]
    - [41, 4621.0]
  - - [1024, 5056, 1, 1280, 1024, 1024, 1280, 1280]
    - [41, 4874.0]
  - - [1408, 5056, 1, 1280, 1408, 1408, 1280, 1280]
    - [39, 5178.0]
  - - [1856, 5056, 1, 1280, 1856, 1856, 1280, 1280]
    - [39, 5630.0]
  - - [2368, 5056, 1, 1280, 2368, 2368, 1280, 1280]
    - [39, 5683.0]
  - - [2944, 5056, 1, 1280, 2944, 2944, 1280, 1280]
    - [39, 5763.0]
  - - [3584, 5056, 1, 1280, 3584, 3584, 1280, 1280]
    - [39, 5693.0]
  - - [4288, 5056, 1, 1280, 4288, 4288, 1280, 1280]
    - [39, 5839.0]
  - - [5056, 5056, 1, 1280, 5056, 5056, 1280, 1280]
    - [39, 5879.0]
  - - [5888, 5056, 1, 1280, 5888, 5888, 1280, 1280]
    - [39, 5847.0]
  - - [6784, 5056, 1, 1280, 6784, 6784, 1280, 1280]
    - [39, 6025.0]
  - - [256, 5888, 1, 1280, 256, 256, 1280, 1280]
    - [41, 4305.0]
  - - [448, 5888, 1, 1280, 448, 448, 1280, 1280]
    - [41, 4383.0]
  - - [704, 5888, 1, 1280, 704, 704, 1280, 1280]
    - [41, 4863.0]
  - - [1024, 5888, 1, 1280, 1024, 1024, 1280, 1280]
    - [41, 4893.0]
  - - [1408, 5888, 1, 1280, 1408, 1408, 1280, 1280]
    - [39, 5278.0]
  - - [1856, 5888, 1, 1280, 1856, 1856, 1280, 1280]
    - [39, 5697.0]
  - - [2368, 5888, 1, 1280, 2368, 2368, 1280, 1280]
    - [39, 5753.0]
  - - [2944, 5888, 1, 1280, 2944, 2944, 1280, 1280]
    - [39, 5747.0]
  - - [3584, 5888, 1, 1280, 3584, 3584, 1280, 1280]
    - [39, 5703.0]
  - - [4288, 5888, 1, 1280, 4288, 4288, 1280, 1280]
    - [39, 5829.0]
  - - [5056, 5888, 1, 1280, 5056, 5056, 1280, 1280]
    - [39, 5905.0]
  - - [5888, 5888, 1, 1280, 5888, 5888, 1280, 1280]
    - [39, 5979.0]
  - - [6784, 5888, 1, 1280, 6784, 6784, 1280, 1280]
    - [39, 6114.0]
  - - [256, 6784, 1, 1280, 256, 256, 1280, 1280]
    - [41, 4890.0]
  - - [448, 6784, 1, 1280, 448, 448, 1280, 1280]
    - [41, 4440.0]
  - - [704, 6784, 1, 1280, 704, 704, 1280, 1280]
    - [41, 4710.0]
  - - [1024, 6784, 1, 1280, 1024, 1024, 1280, 1280]
    - [41, 4861.0]
  - - [1408, 6784, 1, 1280, 1408, 1408, 1280, 1280]
    - [39, 5302.0]
  - - [1856, 6784, 1, 1280, 1856, 1856, 1280, 1280]
    - [39, 5757.0]
  - - [2368, 6784, 1, 1280, 2368, 2368, 1280, 1280]
    - [39, 5706.0]
  - - [2944, 6784, 1, 1280, 2944, 2944, 1280, 1280]
    - [39, 5764.0]
  - - [3584, 6784, 1, 1280, 3584, 3584, 1280, 1280]
    - [39, 5699.0]
  - - [4288, 6784, 1, 1280, 4288, 4288, 1280, 1280]
    - [39, 5881.0]
  - - [5056, 6784, 1, 1280, 5056, 5056, 1280, 1280]
    - [39, 6009.0]
  - - [5888, 6784, 1, 1280, 5888, 5888, 1280, 1280]
    - [39, 6088.0]
  - - [6784, 6784, 1, 1280, 6784, 6784, 1280, 1280]
    - [39, 6252.0]
  - - [704, 256, 1, 3328, 704, 704, 3328, 3328]
    - [39, 2274.0]
  - - [1024, 256, 1, 3328, 1024, 1024, 3328, 3328]
    - [39, 2506.0]
  - - [1408, 256, 1, 3328, 1408, 1408, 3328, 3328]
    - [39, 3401.0]
  - - [1856, 256, 1, 3328, 1856, 1856, 3328, 3328]
    - [39, 3512.0]
  - - [2368, 256, 1, 3328, 2368, 2368, 3328, 3328]
    - [39, 4442.0]
  - - [2944, 256, 1, 3328, 2944, 2944, 3328, 3328]
    - [39, 4347.0]
  - - [3584, 256, 1, 3328, 3584, 3584, 3328, 3328]
    - [39, 5259.0]
  - - [4288, 256, 1, 3328, 4288, 4288, 3328, 3328]
    - [39, 5010.0]
  - - [5056, 256, 1, 3328, 5056, 5056, 3328, 3328]
    - [39, 5046.0]
  - - [5888, 256, 1, 3328, 5888, 5888, 3328, 3328]
    - [39, 5085.0]
  - - [6784, 256, 1, 3328, 6784, 6784, 3328, 3328]
    - [39, 5192.0]
  - - [704, 448, 1, 3328, 704, 704, 3328, 3328]
    - [39, 2965.0]
  - - [1024, 448, 1, 3328, 1024, 1024, 3328, 3328]
    - [39, 4180.0]
  - - [1408, 448, 1, 3328, 1408, 1408, 3328, 3328]
    - [39, 4600.0]
  - - [1856, 448, 1, 3328, 1856, 1856, 3328, 3328]
    - [39, 4787.0]
  - - [2368, 448, 1, 3328, 2368, 2368, 3328, 3328]
    - [39, 4818.0]
  - - [2944, 448, 1, 3328, 2944, 2944, 3328, 3328]
    - [39, 5115.0]
  - - [3584, 448, 1, 3328, 3584, 3584, 3328, 3328]
    - [39, 5312.0]
  - - [4288, 448, 1, 3328, 4288, 4288, 3328, 3328]
    - [39, 5109.0]
  - - [5056, 448, 1, 3328, 5056, 5056, 3328, 3328]
    - [39, 5453.0]
  - - [5888, 448, 1, 3328, 5888, 5888, 3328, 3328]
    - [39, 5331.0]
  - - [6784, 448, 1, 3328, 6784, 6784, 3328, 3328]
    - [39, 5329.0]
  - - [256, 704, 1, 3328, 256, 256, 3328, 3328]
    - [39, 2264.0]
  - - [448, 704, 1, 3328, 448, 448, 3328, 3328]
    - [39, 2954.0]
  - - [704, 704, 1, 3328, 704, 704, 3328, 3328]
    - [39, 3613.0]
  - - [1024, 704, 1, 3328, 1024, 1024, 3328, 3328]
    - [39, 3852.0]
  - - [1408, 704, 1, 3328, 1408, 1408, 3328, 3328]
    - [39, 4359.0]
  - - [1856, 704, 1, 3328, 1856, 1856, 3328, 3328]
    - [41, 4992.0]
  - - [2368, 704, 1, 3328, 2368, 2368, 3328, 3328]
    - [41, 4906.0]
  - - [2944, 704, 1, 3328, 2944, 2944, 3328, 3328]
    - [39, 4967.0]
  - - [3584, 704, 1, 3328, 3584, 3584, 3328, 3328]
    - [41, 4916.0]
  - - [4288, 704, 1, 3328, 4288, 4288, 3328, 3328]
    - [41, 5172.0]
  - - [5056, 704, 1, 3328, 5056, 5056, 3328, 3328]
    - [39, 5394.0]
  - - [5888, 704, 1, 3328, 5888, 5888, 3328, 3328]
    - [39, 5250.0]
  - - [6784, 704, 1, 3328, 6784, 6784, 3328, 3328]
    - [41, 5265.0]
  - - [256, 1024, 1, 3328, 256, 256, 3328, 3328]
    - [39, 2507.0]
  - - [448, 1024, 1, 3328, 448, 448, 3328, 3328]
    - [39, 4218.0]
  - - [704, 1024, 1, 3328, 704, 704, 3328, 3328]
    - [39, 4112.0]
  - - [1024, 1024, 1, 3328, 1024, 1024, 3328, 3328]
    - [39, 4280.0]
  - - [1408, 1024, 1, 3328, 1408, 1408, 3328, 3328]
    - [39, 4736.0]
  - - [1856, 1024, 1, 3328, 1856, 1856, 3328, 3328]
    - [39, 4846.0]
  - - [2368, 1024, 1, 3328, 2368, 2368, 3328, 3328]
    - [39, 5102.0]
  - - [2944, 1024, 1, 3328, 2944, 2944, 3328, 3328]
    - [41, 5210.0]
  - - [3584, 1024, 1, 3328, 3584, 3584, 3328, 3328]
    - [41, 5532.0]
  - - [4288, 1024, 1, 3328, 4288, 4288, 3328, 3328]
    - [39, 5400.0]
  - - [5056, 1024, 1, 3328, 5056, 5056, 3328, 3328]
    - [36, 5877.0]
  - - [5888, 1024, 1, 3328, 5888, 5888, 3328, 3328]
    - [39, 5504.0]
  - - [6784, 1024, 1, 3328, 6784, 6784, 3328, 3328]
    - [39, 5585.0]
  - - [256, 1408, 1, 3328, 256, 256, 3328, 3328]
    - [39, 3386.0]
  - - [448, 1408, 1, 3328, 448, 448, 3328, 3328]
    - [39, 4500.0]
  - - [704, 1408, 1, 3328, 704, 704, 3328, 3328]
    - [39, 4393.0]
  - - [1024, 1408, 1, 3328, 1024, 1024, 3328, 3328]
    - [41, 4201.0]
  - - [1408, 1408, 1, 3328, 1408, 1408, 3328, 3328]
    - [42, 5006.0]
  - - [1856, 1408, 1, 3328, 1856, 1856, 3328, 3328]
    - [41, 5223.0]
  - - [2368, 1408, 1, 3328, 2368, 2368, 3328, 3328]
    - [39, 5170.0]
  - - [2944, 1408, 1, 3328, 2944, 2944, 3328, 3328]
    - [41, 5068.0]
  - - [3584, 1408, 1, 3328, 3584, 3584, 3328, 3328]
    - [41, 5530.0]
  - - [4288, 1408, 1, 3328, 4288, 4288, 3328, 3328]
    - [22, 5662.0]
  - - [5056, 1408, 1, 3328, 5056, 5056, 3328, 3328]
    - [22, 6110.0]
  - - [5888, 1408, 1, 3328, 5888, 5888, 3328, 3328]
    - [22, 5775.0]
  - - [6784, 1408, 1, 3328, 6784, 6784, 3328, 3328]
    - [22, 6098.0]
  - - [256, 1856, 1, 3328, 256, 256, 3328, 3328]
    - [39, 3466.0]
  - - [448, 1856, 1, 3328, 448, 448, 3328, 3328]
    - [39, 4339.0]
  - - [704, 1856, 1, 3328, 704, 704, 3328, 3328]
    - [39, 4721.0]
  - - [1024, 1856, 1, 3328, 1024, 1024, 3328, 3328]
    - [42, 4696.0]
  - - [1408, 1856, 1, 3328, 1408, 1408, 3328, 3328]
    - [41, 5194.0]
  - - [1856, 1856, 1, 3328, 1856, 1856, 3328, 3328]
    - [41, 5249.0]
  - - [2368, 1856, 1, 3328, 2368, 2368, 3328, 3328]
    - [41, 5376.0]
  - - [2944, 1856, 1, 3328, 2944, 2944, 3328, 3328]
    - [22, 6042.0]
  - - [3584, 1856, 1, 3328, 3584, 3584, 3328, 3328]
    - [39, 6578.0]
  - - [4288, 1856, 1, 3328, 4288, 4288, 3328, 3328]
    - [22, 6162.0]
  - - [5056, 1856, 1, 3328, 5056, 5056, 3328, 3328]
    - [39, 5726.0]
  - - [5888, 1856, 1, 3328, 5888, 5888, 3328, 3328]
    - [22, 6253.0]
  - - [6784, 1856, 1, 3328, 6784, 6784, 3328, 3328]
    - [39, 5852.0]
  - - [256, 2368, 1, 3328, 256, 256, 3328, 3328]
    - [39, 4344.0]
  - - [448, 2368, 1, 3328, 448, 448, 3328, 3328]
    - [41, 4131.0]
  - - [704, 2368, 1, 3328, 704, 704, 3328, 3328]
    - [41, 4952.0]
  - - [1024, 2368, 1, 3328, 1024, 1024, 3328, 3328]
    - [41, 4736.0]
  - - [1408, 2368, 1, 3328, 1408, 1408, 3328, 3328]
    - [42, 5147.0]
  - - [1856, 2368, 1, 3328, 1856, 1856, 3328, 3328]
    - [41, 5404.0]
  - - [2368, 2368, 1, 3328, 2368, 2368, 3328, 3328]
    - [36, 5866.0]
  - - [2944, 2368, 1, 3328, 2944, 2944, 3328, 3328]
    - [22, 5922.0]
  - - [3584, 2368, 1, 3328, 3584, 3584, 3328, 3328]
    - [37, 6573.0]
  - - [4288, 2368, 1, 3328, 4288, 4288, 3328, 3328]
    - [22, 5983.0]
  - - [5056, 2368, 1, 3328, 5056, 5056, 3328, 3328]
    - [39, 5729.0]
  - - [5888, 2368, 1, 3328, 5888, 5888, 3328, 3328]
    - [17, 5916.0]
  - - [6784, 2368, 1, 3328, 6784, 6784, 3328, 3328]
    - [22, 6360.0]
  - - [256, 2944, 1, 3328, 256, 256, 3328, 3328]
    - [39, 4056.0]
  - - [448, 2944, 1, 3328, 448, 448, 3328, 3328]
    - [43, 4084.0]
  - - [704, 2944, 1, 3328, 704, 704, 3328, 3328]
    - [41, 4889.0]
  - - [1024, 2944, 1, 3328, 1024, 1024, 3328, 3328]
    - [41, 5069.0]
  - - [1408, 2944, 1, 3328, 1408, 1408, 3328, 3328]
    - [41, 5064.0]
  - - [1856, 2944, 1, 3328, 1856, 1856, 3328, 3328]
    - [36, 5806.0]
  - - [2368, 2944, 1, 3328, 2368, 2368, 3328, 3328]
    - [39, 6635.0]
  - - [2944, 2944, 1, 3328, 2944, 2944, 3328, 3328]
    - [22, 5928.0]
  - - [3584, 2944, 1, 3328, 3584, 3584, 3328, 3328]
    - [39, 6699.0]
  - - [4288, 2944, 1, 3328, 4288, 4288, 3328, 3328]
    - [22, 6296.0]
  - - [5056, 2944, 1, 3328, 5056, 5056, 3328, 3328]
    - [22, 6261.0]
  - - [5888, 2944, 1, 3328, 5888, 5888, 3328, 3328]
    - [22, 6449.0]
  - - [6784, 2944, 1, 3328, 6784, 6784, 3328, 3328]
    - [22, 6491.0]
  - - [256, 3584, 1, 3328, 256, 256, 3328, 3328]
    - [39, 4942.0]
  - - [448, 3584, 1, 3328, 448, 448, 3328, 3328]
    - [41, 4751.0]
  - - [704, 3584, 1, 3328, 704, 704, 3328, 3328]
    - [41, 5036.0]
  - - [1024, 3584, 1, 3328, 1024, 1024, 3328, 3328]
    - [41, 5485.0]
  - - [1408, 3584, 1, 3328, 1408, 1408, 3328, 3328]
    - [39, 6477.0]
  - - [1856, 3584, 1, 3328, 1856, 1856, 3328, 3328]
    - [39, 6610.0]
  - - [2368, 3584, 1, 3328, 2368, 2368, 3328, 3328]
    - [39, 6726.0]
  - - [2944, 3584, 1, 3328, 2944, 2944, 3328, 3328]
    - [41, 5706.0]
  - - [3584, 3584, 1, 3328, 3584, 3584, 3328, 3328]
    - [37, 6680.0]
  - - [4288, 3584, 1, 3328, 4288, 4288, 3328, 3328]
    - [22, 6411.0]
  - - [5056, 3584, 1, 3328, 5056, 5056, 3328, 3328]
    - [39, 6172.0]
  - - [5888, 3584, 1, 3328, 5888, 5888, 3328, 3328]
    - [41, 6250.0]
  - - [6784, 3584, 1, 3328, 6784, 6784, 3328, 3328]
    - [17, 6471.0]
  - - [256, 4288, 1, 3328, 256, 256, 3328, 3328]
    - [41, 4267.0]
  - - [448, 4288, 1, 3328, 448, 448, 3328, 3328]
    - [41, 4542.0]
  - - [704, 4288, 1, 3328, 704, 704, 3328, 3328]
    - [42, 4687.0]
  - - [1024, 4288, 1, 3328, 1024, 1024, 3328, 3328]
    - [36, 5482.0]
  - - [1408, 4288, 1, 3328, 1408, 1408, 3328, 3328]
    - [39, 6555.0]
  - - [1856, 4288, 1, 3328, 1856, 1856, 3328, 3328]
    - [39, 6693.0]
  - - [2368, 4288, 1, 3328, 2368, 2368, 3328, 3328]
    - [39, 6648.0]
  - - [2944, 4288, 1, 3328, 2944, 2944, 3328, 3328]
    - [36, 5773.0]
  - - [3584, 4288, 1, 3328, 3584, 3584, 3328, 3328]
    - [41, 5905.0]
  - - [4288, 4288, 1, 3328, 4288, 4288, 3328, 3328]
    - [22, 6275.0]
  - - [5056, 4288, 1, 3328, 5056, 5056, 3328, 3328]
    - [41, 6229.0]
  - - [5888, 4288, 1, 3328, 5888, 5888, 3328, 3328]
    - [17, 6363.0]
  - - [6784, 4288, 1, 3328, 6784, 6784, 3328, 3328]
    - [39, 6588.0]
  - - [256, 5056, 1, 3328, 256, 256, 3328, 3328]
    - [41, 4981.0]
  - - [448, 5056, 1, 3328, 448, 448, 3328, 3328]
    - [41, 4532.0]
  - - [704, 5056, 1, 3328, 704, 704, 3328, 3328]
    - [41, 4825.0]
  - - [1024, 5056, 1, 3328, 1024, 1024, 3328, 3328]
    - [39, 6470.0]
  - - [1408, 5056, 1, 3328, 1408, 1408, 3328, 3328]
    - [39, 6497.0]
  - - [1856, 5056, 1, 3328, 1856, 1856, 3328, 3328]
    - [36, 6238.0]
  - - [2368, 5056, 1, 3328, 2368, 2368, 3328, 3328]
    - [39, 6720.0]
  - - [2944, 5056, 1, 3328, 2944, 2944, 3328, 3328]
    - [22, 6224.0]
  - - [3584, 5056, 1, 3328, 3584, 3584, 3328, 3328]
    - [41, 6059.0]
  - - [4288, 5056, 1, 3328, 4288, 4288, 3328, 3328]
    - [17, 6307.0]
  - - [5056, 5056, 1, 3328, 5056, 5056, 3328, 3328]
    - [38, 6345.0]
  - - [5888, 5056, 1, 3328, 5888, 5888, 3328, 3328]
    - [41, 6643.0]
  - - [6784, 5056, 1, 3328, 6784, 6784, 3328, 3328]
    - [41, 6798.0]
  - - [256, 5888, 1, 3328, 256, 256, 3328, 3328]
    - [41, 4460.0]
  - - [448, 5888, 1, 3328, 448, 448, 3328, 3328]
    - [41, 4570.0]
  - - [704, 5888, 1, 3328, 704, 704, 3328, 3328]
    - [41, 5070.0]
  - - [1024, 5888, 1, 3328, 1024, 1024, 3328, 3328]
    - [39, 6216.0]
  - - [1408, 5888, 1, 3328, 1408, 1408, 3328, 3328]
    - [39, 6485.0]
  - - [1856, 5888, 1, 3328, 1856, 1856, 3328, 3328]
    - [39, 6748.0]
  - - [2368, 5888, 1, 3328, 2368, 2368, 3328, 3328]
    - [36, 6251.0]
  - - [2944, 5888, 1, 3328, 2944, 2944, 3328, 3328]
    - [41, 6107.0]
  - - [3584, 5888, 1, 3328, 3584, 3584, 3328, 3328]
    - [37, 6803.0]
  - - [4288, 5888, 1, 3328, 4288, 4288, 3328, 3328]
    - [22, 6529.0]
  - - [5056, 5888, 1, 3328, 5056, 5056, 3328, 3328]
    - [40, 6599.0]
  - - [5888, 5888, 1, 3328, 5888, 5888, 3328, 3328]
    - [41, 6763.0]
  - - [6784, 5888, 1, 3328, 6784, 6784, 3328, 3328]
    - [39, 6939.0]
  - - [256, 6784, 1, 3328, 256, 256, 3328, 3328]
    - [41, 5144.0]
  - - [448, 6784, 1, 3328, 448, 448, 3328, 3328]
    - [41, 4637.0]
  - - [704, 6784, 1, 3328, 704, 704, 3328, 3328]
    - [36, 5691.0]
  - - [1024, 6784, 1, 3328, 1024, 1024, 3328, 3328]
    - [39, 6415.0]
  - - [1408, 6784, 1, 3328, 1408, 1408, 3328, 3328]
    - [39, 6745.0]
  - - [1856, 6784, 1, 3328, 1856, 1856, 3328, 3328]
    - [22, 6373.0]
  - - [2368, 6784, 1, 3328, 2368, 2368, 3328, 3328]
    - [22, 6364.0]
  - - [2944, 6784, 1, 3328, 2944, 2944, 3328, 3328]
    - [22, 6447.0]
  - - [3584, 6784, 1, 3328, 3584, 3584, 3328, 3328]
    - [41, 6380.0]
  - - [4288, 6784, 1, 3328, 4288, 4288, 3328, 3328]
    - [40, 6558.0]
  - - [5056, 6784, 1, 3328, 5056, 5056, 3328, 3328]
    - [38, 6735.0]
  - - [5888, 6784, 1, 3328, 5888, 5888, 3328, 3328]
    - [39, 6896.0]
  - - [6784, 6784, 1, 3328, 6784, 6784, 3328, 3328]
    - [41, 7163.0]
  - - [1024, 1024, 1, 1024, 1024, 1024, 1024, 1024]
    - [39, 4205.0]
  - - [1760, 800, 1, 1760, 1760, 1760, 1760, 1760]
    - [39, 4791.0]
  - - [1760, 1600, 1, 1760, 1760, 1760, 1760, 1760]
    - [39, 5223.0]
  - - [1760, 3200, 1, 1760, 1760, 1760, 1760, 1760]
    - [39, 5470.0]
  - - [1760, 6400, 1, 1760, 1760, 1760, 1760, 1760]
    - [41, 5575.0]
  - - [2048, 800, 1, 2048, 2048, 2048, 2048, 2048]
    - [22, 4228.0]
  - - [2048, 1600, 1, 2048, 2048, 2048, 2048, 2048]
    - [43, 3696.0]
  - - [2048, 3200, 1, 2048, 2048, 2048, 2048, 2048]
    - [22, 5315.0]
  - - [2048, 6400, 1, 2048, 2048, 2048, 2048, 2048]
    - [43, 4096.0]
  - - [2560, 800, 1, 2560, 2560, 2560, 2560, 2560]
    - [41, 4767.0]
  - - [2560, 1600, 1, 2560, 2560, 2560, 2560, 2560]
    - [41, 5363.0]
  - - [2560, 3200, 1, 2560, 2560, 2560, 2560, 2560]
    - [39, 6482.0]
  - - [2560, 6400, 1, 2560, 2560, 2560, 2560, 2560]
    - [41, 5698.0]
  - - [2048, 400, 1, 512, 2048, 2048, 512, 512]
    - [39, 4182.0]
  - - [2048, 800, 1, 512, 2048, 2048, 512, 512]
    - [39, 4391.0]
  - - [2048, 1600, 1, 512, 2048, 2048, 512, 512]
    - [39, 4664.0]
  - - [2048, 3200, 1, 512, 2048, 2048, 512, 512]
    - [41, 4956.0]
  - - [4096, 400, 1, 1024, 4096, 4096, 1024, 1024]
    - [39, 4728.0]
  - - [4096, 800, 1, 1024, 4096, 4096, 1024, 1024]
    - [41, 4696.0]
  - - [4096, 1600, 1, 1024, 4096, 4096, 1024, 1024]
    - [41, 4897.0]
  - - [4096, 3200, 1, 1024, 4096, 4096, 1024, 1024]
    - [41, 5102.0]
  - - [8192, 400, 1, 2048, 8192, 8192, 2048, 2048]
    - [22, 4367.0]
  - - [8192, 800, 1, 2048, 8192, 8192, 2048, 2048]
    - [21, 4254.0]
  - - [8192, 1600, 1, 2048, 8192, 8192, 2048, 2048]
    - [21, 4372.0]
  - - [8192, 3200, 1, 2048, 8192, 8192, 2048, 2048]
    - [39, 4637.0]
  - - [16384, 400, 1, 4096, 16384, 16384, 4096, 4096]
    - [22, 5515.0]
  - - [16384, 800, 1, 4096, 16384, 16384, 4096, 4096]
    - [39, 6030.0]
  - - [16384, 1600, 1, 4096, 16384, 16384, 4096, 4096]
    - [39, 6599.0]
  - - [16384, 3200, 1, 4096, 16384, 16384, 4096, 4096]
    - [39, 7085.0]
  - - [8448, 48000, 1, 2816, 8448, 8448, 2816, 2816]
    - [42, 9382.0]
  - - [8448, 24000, 1, 2816, 8448, 8448, 2816, 2816]
    - [41, 9248.0]
  - - [8448, 12000, 1, 2816, 8448, 8448, 2816, 2816]
    - [41, 8054.0]
  - - [8448, 5984, 1, 2816, 8448, 8448, 2816, 2816]
    - [41, 7032.0]
  - - [6144, 48000, 1, 2048, 6144, 6144, 2048, 2048]
    - [39, 8707.0]
  - - [6144, 24000, 1, 2048, 6144, 6144, 2048, 2048]
    - [39, 7808.0]
  - - [6144, 12000, 1, 2048, 6144, 6144, 2048, 2048]
    - [39, 6574.0]
  - - [6144, 5984, 1, 2048, 6144, 6144, 2048, 2048]
    - [39, 5317.0]
  - - [4608, 48000, 1, 1536, 4608, 4608, 1536, 1536]
    - [41, 8370.0]
  - - [4608, 24000, 1, 1536, 4608, 4608, 1536, 1536]
    - [39, 7315.0]
  - - [4608, 12000, 1, 1536, 4608, 4608, 1536, 1536]
    - [39, 6356.0]
  - - [4608, 5984, 1, 1536, 4608, 4608, 1536, 1536]
    - [41, 5623.0]
  - - [7680, 48000, 1, 2560, 7680, 7680, 2560, 2560]
    - [41, 9353.0]
  - - [7680, 24000, 1, 2560, 7680, 7680, 2560, 2560]
    - [41, 8964.0]
  - - [7680, 12000, 1, 2560, 7680, 7680, 2560, 2560]
    - [41, 7747.0]
  - - [7680, 5984, 1, 2560, 7680, 7680, 2560, 2560]
    - [41, 6736.0]
  - - [1024, 700, 1, 512, 1024, 1024, 512, 512]
    - [39, 3689.0]
  - - [512, 24000, 1, 1536, 512, 512, 1536, 1536]
    - [41, 5284.0]
  - - [1760, 7000, 1, 1760, 1760, 1760, 1760, 1760]
    - [39, 5520.0]
  - - [512, 24000, 1, 2048, 512, 512, 2048, 2048]
    - [20, 4202.0]
  - - [2048, 7000, 1, 2048, 2048, 2048, 2048, 2048]
    - [43, 4172.0]
  - - [512, 24000, 1, 2560, 512, 512, 2560, 2560]
    - [41, 5256.0]
  - - [512, 24000, 1, 2816, 512, 512, 2816, 2816]
    - [41, 5520.0]
  - - [512, 48000, 1, 1536, 512, 512, 1536, 1536]
    - [41, 5375.0]
  - - [1024, 24000, 1, 1536, 1024, 1024, 1536, 1536]
    - [42, 5101.0]
  - - [2560, 7000, 1, 2560, 2560, 2560, 2560, 2560]
    - [41, 5731.0]
  - - [512, 48000, 1, 2048, 512, 512, 2048, 2048]
    - [41, 4832.0]
  - - [1024, 24000, 1, 2048, 1024, 1024, 2048, 2048]
    - [41, 4694.0]
  - - [512, 48000, 1, 2560, 512, 512, 2560, 2560]
    - [42, 5920.0]
  - - [1024, 24000, 1, 2560, 1024, 1024, 2560, 2560]
    - [42, 5820.0]
  - - [512, 48000, 1, 2816, 512, 512, 2816, 2816]
    - [41, 6136.0]
  - - [1024, 24000, 1, 2816, 1024, 1024, 2816, 2816]
    - [41, 6123.0]
  - - [1024, 48000, 1, 1536, 1024, 1024, 1536, 1536]
    - [42, 5947.0]
  - - [3072, 24000, 1, 1024, 3072, 3072, 1024, 1024]
    - [41, 6145.0]
  - - [5124, 9124, 1, 1760, 5124, 5124, 1760, 1760]
    - [39, 6358.0]
  - - [5124, 9124, 1, 2048, 5124, 5124, 2048, 2048]
    - [39, 5755.0]
  - - [1024, 48000, 1, 2048, 1024, 1024, 2048, 2048]
    - [41, 5829.0]
  - - [4096, 7000, 1, 4096, 4096, 4096, 4096, 4096]
    - [42, 7339.0]
  - - [5124, 9124, 1, 2560, 5124, 5124, 2560, 2560]
    - [41, 6666.0]
  - - [1024, 48000, 1, 2560, 1024, 1024, 2560, 2560]
    - [42, 6649.0]
  - - [1024, 48000, 1, 2816, 1024, 1024, 2816, 2816]
    - [41, 6940.0]
  - - [3072, 48000, 1, 1024, 3072, 3072, 1024, 1024]
    - [41, 7040.0]
  - - [5124, 9124, 1, 4096, 5124, 5124, 4096, 4096]
    - [39, 7392.0]
  - - [6144, 24000, 1, 2560, 6144, 6144, 2560, 2560]
    - [41, 8552.0]
  - - [6144, 48000, 1, 2560, 6144, 6144, 2560, 2560]
    - [42, 9302.0]
  - - [32, 32, 1, 32, 32, 32, 32, 32]
    - [44, 2.0]
  - - [32, 64, 1, 256, 32, 32, 256, 256]
    - [46, 10.0]
  - - [32, 128, 1, 256, 32, 32, 256, 256]
    - [46, 20.0]
  - - [32, 256, 1, 256, 32, 32, 256, 256]
    - [46, 42.0]
  - - [32, 448, 1, 256, 32, 32, 256, 256]
    - [46, 74.0]
  - - [32, 704, 1, 256, 32, 32, 256, 256]
    - [46, 116.0]
  - - [32, 1024, 1, 256, 32, 32, 256, 256]
    - [46, 169.0]
  - - [32, 1408, 1, 256, 32, 32, 256, 256]
    - [51, 230.0]
  - - [32, 1856, 1, 256, 32, 32, 256, 256]
    - [46, 301.0]
  - - [32, 2368, 1, 256, 32, 32, 256, 256]
    - [46, 380.0]
  - - [32, 2944, 1, 256, 32, 32, 256, 256]
    - [46, 464.0]
  - - [32, 3584, 1, 256, 32, 32, 256, 256]
    - [55, 705.0]
  - - [32, 4288, 1, 256, 32, 32, 256, 256]
    - [51, 605.0]
  - - [32, 5056, 1, 256, 32, 32, 256, 256]
    - [51, 684.0]
  - - [32, 5888, 1, 256, 32, 32, 256, 256]
    - [55, 770.0]
  - - [32, 6784, 1, 256, 32, 32, 256, 256]
    - [58, 846.0]
  - - [32, 64, 1, 1280, 32, 32, 1280, 1280]
    - [68, 47.0]
  - - [32, 128, 1, 1280, 32, 32, 1280, 1280]
    - [68, 95.0]
  - - [32, 256, 1, 1280, 32, 32, 1280, 1280]
    - [67, 193.0]
  - - [32, 448, 1, 1280, 32, 32, 1280, 1280]
    - [67, 335.0]
  - - [32, 704, 1, 1280, 32, 32, 1280, 1280]
    - [71, 589.0]
  - - [32, 1024, 1, 1280, 32, 32, 1280, 1280]
    - [68, 643.0]
  - - [32, 1408, 1, 1280, 32, 32, 1280, 1280]
    - [70, 826.0]
  - - [32, 1856, 1, 1280, 32, 32, 1280, 1280]
    - [70, 841.0]
  - - [32, 2368, 1, 1280, 32, 32, 1280, 1280]
    - [64, 896.0]
  - - [32, 2944, 1, 1280, 32, 32, 1280, 1280]
    - [66, 848.0]
  - - [32, 3584, 1, 1280, 32, 32, 1280, 1280]
    - [64, 977.0]
  - - [32, 4288, 1, 1280, 32, 32, 1280, 1280]
    - [70, 923.0]
  - - [32, 5056, 1, 1280, 32, 32, 1280, 1280]
    - [59, 963.0]
  - - [32, 5888, 1, 1280, 32, 32, 1280, 1280]
    - [63, 969.0]
  - - [32, 6784, 1, 1280, 32, 32, 1280, 1280]
    - [59, 978.0]
  - - [32, 64, 1, 3328, 32, 32, 3328, 3328]
    - [73, 81.0]
  - - [32, 128, 1, 3328, 32, 32, 3328, 3328]
    - [73, 163.0]
  - - [32, 256, 1, 3328, 32, 32, 3328, 3328]
    - [73, 331.0]
  - - [32, 448, 1, 3328, 32, 32, 3328, 3328]
    - [77, 602.0]
  - - [32, 704, 1, 3328, 32, 32, 3328, 3328]
    - [71, 715.0]
  - - [32, 1024, 1, 3328, 32, 32, 3328, 3328]
    - [73, 968.0]
  - - [32, 1408, 1, 3328, 32, 32, 3328, 3328]
    - [75, 1002.0]
  - - [32, 1856, 1, 3328, 32, 32, 3328, 3328]
    - [72, 1003.0]
  - - [32, 2368, 1, 3328, 32, 32, 3328, 3328]
    - [77, 1026.0]
  - - [32, 2944, 1, 3328, 32, 32, 3328, 3328]
    - [77, 1071.0]
  - - [32, 3584, 1, 3328, 32, 32, 3328, 3328]
    - [71, 1119.0]
  - - [32, 4288, 1, 3328, 32, 32, 3328, 3328]
    - [70, 1127.0]
  - - [32, 5056, 1, 3328, 32, 32, 3328, 3328]
    - [75, 1117.0]
  - - [32, 5888, 1, 3328, 32, 32, 3328, 3328]
    - [64, 1123.0]
  - - [32, 6784, 1, 3328, 32, 32, 3328, 3328]
    - [64, 1112.0]
  - - [64, 32, 1, 256, 64, 64, 256, 256]
    - [46, 10.0]
  - - [128, 32, 1, 256, 128, 128, 256, 256]
    - [46, 21.0]
  - - [256, 32, 1, 256, 256, 256, 256, 256]
    - [55, 55.0]
  - - [448, 32, 1, 256, 448, 448, 256, 256]
    - [51, 74.0]
  - - [704, 32, 1, 256, 704, 704, 256, 256]
    - [46, 117.0]
  - - [1024, 32, 1, 256, 1024, 1024, 256, 256]
    - [51, 170.0]
  - - [1408, 32, 1, 256, 1408, 1408, 256, 256]
    - [46, 234.0]
  - - [1856, 32, 1, 256, 1856, 1856, 256, 256]
    - [46, 311.0]
  - - [2368, 32, 1, 256, 2368, 2368, 256, 256]
    - [46, 391.0]
  - - [2944, 32, 1, 256, 2944, 2944, 256, 256]
    - [46, 486.0]
  - - [3584, 32, 1, 256, 3584, 3584, 256, 256]
    - [55, 745.0]
  - - [4288, 32, 1, 256, 4288, 4288, 256, 256]
    - [51, 607.0]
  - - [5056, 32, 1, 256, 5056, 5056, 256, 256]
    - [51, 728.0]
  - - [5888, 32, 1, 256, 5888, 5888, 256, 256]
    - [51, 834.0]
  - - [6784, 32, 1, 256, 6784, 6784, 256, 256]
    - [51, 944.0]
  - - [64, 32, 1, 1280, 64, 64, 1280, 1280]
    - [68, 47.0]
  - - [128, 32, 1, 1280, 128, 128, 1280, 1280]
    - [67, 95.0]
  - - [256, 32, 1, 1280, 256, 256, 1280, 1280]
    - [67, 196.0]
  - - [448, 32, 1, 1280, 448, 448, 1280, 1280]
    - [67, 340.0]
  - - [704, 32, 1, 1280, 704, 704, 1280, 1280]
    - [68, 615.0]
  - - [1024, 32, 1, 1280, 1024, 1024, 1280, 1280]
    - [69, 636.0]
  - - [1408, 32, 1, 1280, 1408, 1408, 1280, 1280]
    - [68, 863.0]
  - - [1856, 32, 1, 1280, 1856, 1856, 1280, 1280]
    - [71, 845.0]
  - - [2368, 32, 1, 1280, 2368, 2368, 1280, 1280]
    - [63, 952.0]
  - - [2944, 32, 1, 1280, 2944, 2944, 1280, 1280]
    - [66, 867.0]
  - - [3584, 32, 1, 1280, 3584, 3584, 1280, 1280]
    - [62, 925.0]
  - - [4288, 32, 1, 1280, 4288, 4288, 1280, 1280]
    - [65, 884.0]
  - - [5056, 32, 1, 1280, 5056, 5056, 1280, 1280]
    - [61, 847.0]
  - - [5888, 32, 1, 1280, 5888, 5888, 1280, 1280]
    - [51, 935.0]
  - - [6784, 32, 1, 1280, 6784, 6784, 1280, 1280]
    - [51, 1058.0]
  - - [64, 32, 1, 3328, 64, 64, 3328, 3328]
    - [73, 78.0]
  - - [128, 32, 1, 3328, 128, 128, 3328, 3328]
    - [73, 163.0]
  - - [256, 32, 1, 3328, 256, 256, 3328, 3328]
    - [73, 331.0]
  - - [448, 32, 1, 3328, 448, 448, 3328, 3328]
    - [73, 575.0]
  - - [704, 32, 1, 3328, 704, 704, 3328, 3328]
    - [68, 753.0]
  - - [1024, 32, 1, 3328, 1024, 1024, 3328, 3328]
    - [74, 976.0]
  - - [1408, 32, 1, 3328, 1408, 1408, 3328, 3328]
    - [68, 1006.0]
  - - [1856, 32, 1, 3328, 1856, 1856, 3328, 3328]
    - [76, 930.0]
  - - [2368, 32, 1, 3328, 2368, 2368, 3328, 3328]
    - [66, 1007.0]
  - - [2944, 32, 1, 3328, 2944, 2944, 3328, 3328]
    - [76, 884.0]
  - - [3584, 32, 1, 3328, 3584, 3584, 3328, 3328]
    - [62, 940.0]
  - - [4288, 32, 1, 3328, 4288, 4288, 3328, 3328]
    - [65, 860.0]
  - - [5056, 32, 1, 3328, 5056, 5056, 3328, 3328]
    - [60, 854.0]
  - - [5888, 32, 1, 3328, 5888, 5888, 3328, 3328]
    - [51, 958.0]
  - - [6784, 32, 1, 3328, 6784, 6784, 3328, 3328]
    - [51, 1093.0]
  - - [64, 64, 1, 32, 64, 64, 32, 32]
    - [44, 6.0]
  - - [128, 64, 1, 32, 128, 128, 32, 32]
    - [44, 13.0]
  - - [256, 64, 1, 32, 256, 256, 32, 32]
    - [54, 45.0]
  - - [448, 64, 1, 32, 448, 448, 32, 32]
    - [44, 45.0]
  - - [704, 64, 1, 32, 704, 704, 32, 32]
    - [47, 71.0]
  - - [1024, 64, 1, 32, 1024, 1024, 32, 32]
    - [44, 103.0]
  - - [1408, 64, 1, 32, 1408, 1408, 32, 32]
    - [47, 143.0]
  - - [1856, 64, 1, 32, 1856, 1856, 32, 32]
    - [47, 185.0]
  - - [2368, 64, 1, 32, 2368, 2368, 32, 32]
    - [47, 233.0]
  - - [2944, 64, 1, 32, 2944, 2944, 32, 32]
    - [44, 283.0]
  - - [3584, 64, 1, 32, 3584, 3584, 32, 32]
    - [46, 631.0]
  - - [4288, 64, 1, 32, 4288, 4288, 32, 32]
    - [46, 498.0]
  - - [5056, 64, 1, 32, 5056, 5056, 32, 32]
    - [46, 578.0]
  - - [5888, 64, 1, 32, 5888, 5888, 32, 32]
    - [47, 670.0]
  - - [6784, 64, 1, 32, 6784, 6784, 32, 32]
    - [44, 766.0]
  - - [64, 128, 1, 32, 64, 64, 32, 32]
    - [44, 13.0]
  - - [128, 128, 1, 32, 128, 128, 32, 32]
    - [44, 26.0]
  - - [256, 128, 1, 32, 256, 256, 32, 32]
    - [53, 55.0]
  - - [448, 128, 1, 32, 448, 448, 32, 32]
    - [44, 93.0]
  - - [704, 128, 1, 32, 704, 704, 32, 32]
    - [44, 147.0]
  - - [1024, 128, 1, 32, 1024, 1024, 32, 32]
    - [44, 213.0]
  - - [1408, 128, 1, 32, 1408, 1408, 32, 32]
    - [44, 292.0]
  - - [1856, 128, 1, 32, 1856, 1856, 32, 32]
    - [44, 555.0]
  - - [2368, 128, 1, 32, 2368, 2368, 32, 32]
    - [53, 572.0]
  - - [2944, 128, 1, 32, 2944, 2944, 32, 32]
    - [47, 702.0]
  - - [3584, 128, 1, 32, 3584, 3584, 32, 32]
    - [51, 796.0]
  - - [4288, 128, 1, 32, 4288, 4288, 32, 32]
    - [44, 847.0]
  - - [5056, 128, 1, 32, 5056, 5056, 32, 32]
    - [44, 984.0]
  - - [5888, 128, 1, 32, 5888, 5888, 32, 32]
    - [46, 966.0]
  - - [6784, 128, 1, 32, 6784, 6784, 32, 32]
    - [44, 1090.0]
  - - [64, 256, 1, 32, 64, 64, 32, 32]
    - [44, 26.0]
  - - [128, 256, 1, 32, 128, 128, 32, 32]
    - [44, 53.0]
  - - [256, 256, 1, 32, 256, 256, 32, 32]
    - [44, 106.0]
  - - [448, 256, 1, 32, 448, 448, 32, 32]
    - [47, 187.0]
  - - [704, 256, 1, 32, 704, 704, 32, 32]
    - [47, 288.0]
  - - [1024, 256, 1, 32, 1024, 1024, 32, 32]
    - [47, 612.0]
  - - [1408, 256, 1, 32, 1408, 1408, 32, 32]
    - [53, 689.0]
  - - [1856, 256, 1, 32, 1856, 1856, 32, 32]
    - [47, 766.0]
  - - [2368, 256, 1, 32, 2368, 2368, 32, 32]
    - [53, 945.0]
  - - [2944, 256, 1, 32, 2944, 2944, 32, 32]
    - [51, 990.0]
  - - [3584, 256, 1, 32, 3584, 3584, 32, 32]
    - [46, 1074.0]
  - - [4288, 256, 1, 32, 4288, 4288, 32, 32]
    - [44, 1073.0]
  - - [5056, 256, 1, 32, 5056, 5056, 32, 32]
    - [47, 1071.0]
  - - [5888, 256, 1, 32, 5888, 5888, 32, 32]
    - [44, 994.0]
  - - [6784, 256, 1, 32, 6784, 6784, 32, 32]
    - [46, 985.0]
  - - [64, 448, 1, 32, 64, 64, 32, 32]
    - [48, 59.0]
  - - [128, 448, 1, 32, 128, 128, 32, 32]
    - [44, 95.0]
  - - [256, 448, 1, 32, 256, 256, 32, 32]
    - [44, 186.0]
  - - [448, 448, 1, 32, 448, 448, 32, 32]
    - [44, 574.0]
  - - [704, 448, 1, 32, 704, 704, 32, 32]
    - [51, 600.0]
  - - [1024, 448, 1, 32, 1024, 1024, 32, 32]
    - [51, 799.0]
  - - [1408, 448, 1, 32, 1408, 1408, 32, 32]
    - [47, 977.0]
  - - [1856, 448, 1, 32, 1856, 1856, 32, 32]
    - [44, 1085.0]
  - - [2368, 448, 1, 32, 2368, 2368, 32, 32]
    - [46, 1071.0]
  - - [2944, 448, 1, 32, 2944, 2944, 32, 32]
    - [46, 1051.0]
  - - [3584, 448, 1, 32, 3584, 3584, 32, 32]
    - [44, 985.0]
  - - [4288, 448, 1, 32, 4288, 4288, 32, 32]
    - [46, 983.0]
  - - [5056, 448, 1, 32, 5056, 5056, 32, 32]
    - [44, 981.0]
  - - [5888, 448, 1, 32, 5888, 5888, 32, 32]
    - [47, 939.0]
  - - [6784, 448, 1, 32, 6784, 6784, 32, 32]
    - [46, 951.0]
  - - [64, 704, 1, 32, 64, 64, 32, 32]
    - [44, 73.0]
  - - [128, 704, 1, 32, 128, 128, 32, 32]
    - [44, 146.0]
  - - [256, 704, 1, 32, 256, 256, 32, 32]
    - [44, 285.0]
  - - [448, 704, 1, 32, 448, 448, 32, 32]
    - [51, 606.0]
  - - [704, 704, 1, 32, 704, 704, 32, 32]
    - [44, 790.0]
  - - [1024, 704, 1, 32, 1024, 1024, 32, 32]
    - [46, 919.0]
  - - [1408, 704, 1, 32, 1408, 1408, 32, 32]
    - [46, 1012.0]
  - - [1856, 704, 1, 32, 1856, 1856, 32, 32]
    - [47, 1085.0]
  - - [2368, 704, 1, 32, 2368, 2368, 32, 32]
    - [46, 1065.0]
  - - [2944, 704, 1, 32, 2944, 2944, 32, 32]
    - [46, 999.0]
  - - [3584, 704, 1, 32, 3584, 3584, 32, 32]
    - [46, 930.0]
  - - [4288, 704, 1, 32, 4288, 4288, 32, 32]
    - [47, 983.0]
  - - [5056, 704, 1, 32, 5056, 5056, 32, 32]
    - [47, 960.0]
  - - [5888, 704, 1, 32, 5888, 5888, 32, 32]
    - [44, 941.0]
  - - [6784, 704, 1, 32, 6784, 6784, 32, 32]
    - [44, 931.0]
  - - [64, 1024, 1, 32, 64, 64, 32, 32]
    - [47, 104.0]
  - - [128, 1024, 1, 32, 128, 128, 32, 32]
    - [44, 212.0]
  - - [256, 1024, 1, 32, 256, 256, 32, 32]
    - [47, 612.0]
  - - [448, 1024, 1, 32, 448, 448, 32, 32]
    - [51, 862.0]
  - - [704, 1024, 1, 32, 704, 704, 32, 32]
    - [44, 982.0]
  - - [1024, 1024, 1, 32, 1024, 1024, 32, 32]
    - [44, 827.0]
  - - [1408, 1024, 1, 32, 1408, 1408, 32, 32]
    - [44, 1057.0]
  - - [1856, 1024, 1, 32, 1856, 1856, 32, 32]
    - [44, 1090.0]
  - - [2368, 1024, 1, 32, 2368, 2368, 32, 32]
    - [44, 1059.0]
  - - [2944, 1024, 1, 32, 2944, 2944, 32, 32]
    - [47, 1010.0]
  - - [3584, 1024, 1, 32, 3584, 3584, 32, 32]
    - [47, 947.0]
  - - [4288, 1024, 1, 32, 4288, 4288, 32, 32]
    - [49, 965.0]
  - - [5056, 1024, 1, 32, 5056, 5056, 32, 32]
    - [44, 955.0]
  - - [5888, 1024, 1, 32, 5888, 5888, 32, 32]
    - [49, 911.0]
  - - [6784, 1024, 1, 32, 6784, 6784, 32, 32]
    - [55, 923.0]
  - - [64, 1408, 1, 32, 64, 64, 32, 32]
    - [47, 146.0]
  - - [128, 1408, 1, 32, 128, 128, 32, 32]
    - [44, 283.0]
  - - [256, 1408, 1, 32, 256, 256, 32, 32]
    - [53, 695.0]
  - - [448, 1408, 1, 32, 448, 448, 32, 32]
    - [51, 987.0]
  - - [704, 1408, 1, 32, 704, 704, 32, 32]
    - [46, 1037.0]
  - - [1024, 1408, 1, 32, 1024, 1024, 32, 32]
    - [56, 867.0]
  - - [1408, 1408, 1, 32, 1408, 1408, 32, 32]
    - [47, 1092.0]
  - - [1856, 1408, 1, 32, 1856, 1856, 32, 32]
    - [46, 1067.0]
  - - [2368, 1408, 1, 32, 2368, 2368, 32, 32]
    - [47, 1089.0]
  - - [2944, 1408, 1, 32, 2944, 2944, 32, 32]
    - [44, 1005.0]
  - - [3584, 1408, 1, 32, 3584, 3584, 32, 32]
    - [47, 967.0]
  - - [4288, 1408, 1, 32, 4288, 4288, 32, 32]
    - [47, 971.0]
  - - [5056, 1408, 1, 32, 5056, 5056, 32, 32]
    - [47, 957.0]
  - - [5888, 1408, 1, 32, 5888, 5888, 32, 32]
    - [49, 904.0]
  - - [6784, 1408, 1, 32, 6784, 6784, 32, 32]
    - [44, 911.0]
  - - [64, 1856, 1, 32, 64, 64, 32, 32]
    - [47, 192.0]
  - - [128, 1856, 1, 32, 128, 128, 32, 32]
    - [44, 558.0]
  - - [256, 1856, 1, 32, 256, 256, 32, 32]
    - [46, 755.0]
  - - [448, 1856, 1, 32, 448, 448, 32, 32]
    - [47, 1092.0]
  - - [704, 1856, 1, 32, 704, 704, 32, 32]
    - [46, 1115.0]
  - - [1024, 1856, 1, 32, 1024, 1024, 32, 32]
    - [58, 885.0]
  - - [1408, 1856, 1, 32, 1408, 1408, 32, 32]
    - [44, 1083.0]
  - - [1856, 1856, 1, 32, 1856, 1856, 32, 32]
    - [47, 1079.0]
  - - [2368, 1856, 1, 32, 2368, 2368, 32, 32]
    - [46, 1078.0]
  - - [2944, 1856, 1, 32, 2944, 2944, 32, 32]
    - [44, 996.0]
  - - [3584, 1856, 1, 32, 3584, 3584, 32, 32]
    - [47, 934.0]
  - - [4288, 1856, 1, 32, 4288, 4288, 32, 32]
    - [44, 966.0]
  - - [5056, 1856, 1, 32, 5056, 5056, 32, 32]
    - [47, 964.0]
  - - [5888, 1856, 1, 32, 5888, 5888, 32, 32]
    - [44, 903.0]
  - - [6784, 1856, 1, 32, 6784, 6784, 32, 32]
    - [47, 899.0]
  - - [64, 2368, 1, 32, 64, 64, 32, 32]
    - [47, 243.0]
  - - [128, 2368, 1, 32, 128, 128, 32, 32]
    - [46, 585.0]
  - - [256, 2368, 1, 32, 256, 256, 32, 32]
    - [44, 970.0]
  - - [448, 2368, 1, 32, 448, 448, 32, 32]
    - [46, 1086.0]
  - - [704, 2368, 1, 32, 704, 704, 32, 32]
    - [46, 1116.0]
  - - [1024, 2368, 1, 32, 1024, 1024, 32, 32]
    - [58, 938.0]
  - - [1408, 2368, 1, 32, 1408, 1408, 32, 32]
    - [46, 1081.0]
  - - [1856, 2368, 1, 32, 1856, 1856, 32, 32]
    - [44, 1086.0]
  - - [2368, 2368, 1, 32, 2368, 2368, 32, 32]
    - [47, 1078.0]
  - - [2944, 2368, 1, 32, 2944, 2944, 32, 32]
    - [44, 1009.0]
  - - [3584, 2368, 1, 32, 3584, 3584, 32, 32]
    - [44, 946.0]
  - - [4288, 2368, 1, 32, 4288, 4288, 32, 32]
    - [44, 968.0]
  - - [5056, 2368, 1, 32, 5056, 5056, 32, 32]
    - [47, 954.0]
  - - [5888, 2368, 1, 32, 5888, 5888, 32, 32]
    - [44, 892.0]
  - - [6784, 2368, 1, 32, 6784, 6784, 32, 32]
    - [44, 899.0]
  - - [64, 2944, 1, 32, 64, 64, 32, 32]
    - [47, 281.0]
  - - [128, 2944, 1, 32, 128, 128, 32, 32]
    - [47, 723.0]
  - - [256, 2944, 1, 32, 256, 256, 32, 32]
    - [47, 1005.0]
  - - [448, 2944, 1, 32, 448, 448, 32, 32]
    - [47, 1135.0]
  - - [704, 2944, 1, 32, 704, 704, 32, 32]
    - [49, 1111.0]
  - - [1024, 2944, 1, 32, 1024, 1024, 32, 32]
    - [54, 971.0]
  - - [1408, 2944, 1, 32, 1408, 1408, 32, 32]
    - [46, 1105.0]
  - - [1856, 2944, 1, 32, 1856, 1856, 32, 32]
    - [44, 1097.0]
  - - [2368, 2944, 1, 32, 2368, 2368, 32, 32]
    - [44, 1091.0]
  - - [2944, 2944, 1, 32, 2944, 2944, 32, 32]
    - [47, 1004.0]
  - - [3584, 2944, 1, 32, 3584, 3584, 32, 32]
    - [47, 957.0]
  - - [4288, 2944, 1, 32, 4288, 4288, 32, 32]
    - [47, 964.0]
  - - [5056, 2944, 1, 32, 5056, 5056, 32, 32]
    - [47, 954.0]
  - - [5888, 2944, 1, 32, 5888, 5888, 32, 32]
    - [47, 891.0]
  - - [6784, 2944, 1, 32, 6784, 6784, 32, 32]
    - [44, 900.0]
  - - [64, 3584, 1, 32, 64, 64, 32, 32]
    - [49, 635.0]
  - - [128, 3584, 1, 32, 128, 128, 32, 32]
    - [44, 862.0]
  - - [256, 3584, 1, 32, 256, 256, 32, 32]
    - [44, 1101.0]
  - - [448, 3584, 1, 32, 448, 448, 32, 32]
    - [44, 1145.0]
  - - [704, 3584, 1, 32, 704, 704, 32, 32]
    - [46, 1107.0]
  - - [1024, 3584, 1, 32, 1024, 1024, 32, 32]
    - [55, 962.0]
  - - [1408, 3584, 1, 32, 1408, 1408, 32, 32]
    - [58, 1089.0]
  - - [1856, 3584, 1, 32, 1856, 1856, 32, 32]
    - [47, 1095.0]
  - - [2368, 3584, 1, 32, 2368, 2368, 32, 32]
    - [44, 1091.0]
  - - [2944, 3584, 1, 32, 2944, 2944, 32, 32]
    - [47, 1007.0]
  - - [3584, 3584, 1, 32, 3584, 3584, 32, 32]
    - [47, 943.0]
  - - [4288, 3584, 1, 32, 4288, 4288, 32, 32]
    - [44, 961.0]
  - - [5056, 3584, 1, 32, 5056, 5056, 32, 32]
    - [47, 952.0]
  - - [5888, 3584, 1, 32, 5888, 5888, 32, 32]
    - [44, 890.0]
  - - [6784, 3584, 1, 32, 6784, 6784, 32, 32]
    - [44, 894.0]
  - - [64, 4288, 1, 32, 64, 64, 32, 32]
    - [44, 509.0]
  - - [128, 4288, 1, 32, 128, 128, 32, 32]
    - [44, 850.0]
  - - [256, 4288, 1, 32, 256, 256, 32, 32]
    - [47, 1066.0]
  - - [448, 4288, 1, 32, 448, 448, 32, 32]
    - [46, 1081.0]
  - - [704, 4288, 1, 32, 704, 704, 32, 32]
    - [49, 1122.0]
  - - [1024, 4288, 1, 32, 1024, 1024, 32, 32]
    - [56, 983.0]
  - - [1408, 4288, 1, 32, 1408, 1408, 32, 32]
    - [44, 1094.0]
  - - [1856, 4288, 1, 32, 1856, 1856, 32, 32]
    - [44, 1099.0]
  - - [2368, 4288, 1, 32, 2368, 2368, 32, 32]
    - [44, 1092.0]
  - - [2944, 4288, 1, 32, 2944, 2944, 32, 32]
    - [47, 991.0]
  - - [3584, 4288, 1, 32, 3584, 3584, 32, 32]
    - [47, 943.0]
  - - [4288, 4288, 1, 32, 4288, 4288, 32, 32]
    - [44, 961.0]
  - - [5056, 4288, 1, 32, 5056, 5056, 32, 32]
    - [44, 952.0]
  - - [5888, 4288, 1, 32, 5888, 5888, 32, 32]
    - [44, 883.0]
  - - [6784, 4288, 1, 32, 6784, 6784, 32, 32]
    - [47, 893.0]
  - - [64, 5056, 1, 32, 64, 64, 32, 32]
    - [44, 590.0]
  - - [128, 5056, 1, 32, 128, 128, 32, 32]
    - [44, 991.0]
  - - [256, 5056, 1, 32, 256, 256, 32, 32]
    - [44, 1081.0]
  - - [448, 5056, 1, 32, 448, 448, 32, 32]
    - [47, 1120.0]
  - - [704, 5056, 1, 32, 704, 704, 32, 32]
    - [44, 1111.0]
  - - [1024, 5056, 1, 32, 1024, 1024, 32, 32]
    - [56, 1009.0]
  - - [1408, 5056, 1, 32, 1408, 1408, 32, 32]
    - [47, 1099.0]
  - - [1856, 5056, 1, 32, 1856, 1856, 32, 32]
    - [47, 1095.0]
  - - [2368, 5056, 1, 32, 2368, 2368, 32, 32]
    - [47, 1090.0]
  - - [2944, 5056, 1, 32, 2944, 2944, 32, 32]
    - [47, 991.0]
  - - [3584, 5056, 1, 32, 3584, 3584, 32, 32]
    - [44, 935.0]
  - - [4288, 5056, 1, 32, 4288, 4288, 32, 32]
    - [44, 964.0]
  - - [5056, 5056, 1, 32, 5056, 5056, 32, 32]
    - [47, 955.0]
  - - [5888, 5056, 1, 32, 5888, 5888, 32, 32]
    - [47, 883.0]
  - - [6784, 5056, 1, 32, 6784, 6784, 32, 32]
    - [44, 895.0]
  - - [64, 5888, 1, 32, 64, 64, 32, 32]
    - [47, 681.0]
  - - [128, 5888, 1, 32, 128, 128, 32, 32]
    - [52, 975.0]
  - - [256, 5888, 1, 32, 256, 256, 32, 32]
    - [46, 1047.0]
  - - [448, 5888, 1, 32, 448, 448, 32, 32]
    - [47, 1096.0]
  - - [704, 5888, 1, 32, 704, 704, 32, 32]
    - [47, 1121.0]
  - - [1024, 5888, 1, 32, 1024, 1024, 32, 32]
    - [55, 1012.0]
  - - [1408, 5888, 1, 32, 1408, 1408, 32, 32]
    - [58, 1095.0]
  - - [1856, 5888, 1, 32, 1856, 1856, 32, 32]
    - [44, 1102.0]
  - - [2368, 5888, 1, 32, 2368, 2368, 32, 32]
    - [47, 1094.0]
  - - [2944, 5888, 1, 32, 2944, 2944, 32, 32]
    - [47, 1000.0]
  - - [3584, 5888, 1, 32, 3584, 3584, 32, 32]
    - [47, 939.0]
  - - [4288, 5888, 1, 32, 4288, 4288, 32, 32]
    - [44, 963.0]
  - - [5056, 5888, 1, 32, 5056, 5056, 32, 32]
    - [47, 956.0]
  - - [5888, 5888, 1, 32, 5888, 5888, 32, 32]
    - [44, 881.0]
  - - [6784, 5888, 1, 32, 6784, 6784, 32, 32]
    - [47, 893.0]
  - - [64, 6784, 1, 32, 64, 64, 32, 32]
    - [44, 762.0]
  - - [128, 6784, 1, 32, 128, 128, 32, 32]
    - [47, 1081.0]
  - - [256, 6784, 1, 32, 256, 256, 32, 32]
    - [44, 1045.0]
  - - [448, 6784, 1, 32, 448, 448, 32, 32]
    - [45, 1094.0]
  - - [704, 6784, 1, 32, 704, 704, 32, 32]
    - [46, 1116.0]
  - - [1024, 6784, 1, 32, 1024, 1024, 32, 32]
    - [56, 1029.0]
  - - [1408, 6784, 1, 32, 1408, 1408, 32, 32]
    - [44, 1095.0]
  - - [1856, 6784, 1, 32, 1856, 1856, 32, 32]
    - [44, 1100.0]
  - - [2368, 6784, 1, 32, 2368, 2368, 32, 32]
    - [47, 1095.0]
  - - [2944, 6784, 1, 32, 2944, 2944, 32, 32]
    - [47, 990.0]
  - - [3584, 6784, 1, 32, 3584, 3584, 32, 32]
    - [44, 944.0]
  - - [4288, 6784, 1, 32, 4288, 4288, 32, 32]
    - [47, 962.0]
  - - [5056, 6784, 1, 32, 5056, 5056, 32, 32]
    - [50, 952.0]
  - - [5888, 6784, 1, 32, 5888, 5888, 32, 32]
    - [44, 881.0]
  - - [6784, 6784, 1, 32, 6784, 6784, 32, 32]
    - [47, 893.0]
  - - [32, 32, 1, 256, 32, 32, 256, 256]
    - [44, 5.0]
  - - [32, 32, 1, 1280, 32, 32, 1280, 1280]
    - [67, 24.0]
  - - [32, 32, 1, 3328, 32, 32, 3328, 3328]
    - [73, 42.0]
  - - [32, 64, 1, 32, 32, 32, 32, 32]
    - [44, 4.0]
  - - [32, 128, 1, 32, 32, 32, 32, 32]
    - [44, 8.0]
  - - [32, 256, 1, 32, 32, 32, 32, 32]
    - [44, 16.0]
  - - [32, 448, 1, 32, 32, 32, 32, 32]
    - [57, 31.0]
  - - [32, 704, 1, 32, 32, 32, 32, 32]
    - [47, 44.0]
  - - [32, 1024, 1, 32, 32, 32, 32, 32]
    - [47, 64.0]
  - - [32, 1408, 1, 32, 32, 32, 32, 32]
    - [44, 88.0]
  - - [32, 1856, 1, 32, 32, 32, 32, 32]
    - [47, 116.0]
  - - [32, 2368, 1, 32, 32, 32, 32, 32]
    - [44, 143.0]
  - - [32, 2944, 1, 32, 32, 32, 32, 32]
    - [44, 172.0]
  - - [32, 3584, 1, 32, 32, 32, 32, 32]
    - [46, 349.0]
  - - [32, 4288, 1, 32, 32, 32, 32, 32]
    - [44, 331.0]
  - - [32, 5056, 1, 32, 32, 32, 32, 32]
    - [51, 388.0]
  - - [32, 5888, 1, 32, 32, 32, 32, 32]
    - [47, 442.0]
  - - [32, 6784, 1, 32, 32, 32, 32, 32]
    - [44, 499.0]
  - - [64, 32, 1, 32, 64, 64, 32, 32]
    - [44, 4.0]
  - - [128, 32, 1, 32, 128, 128, 32, 32]
    - [44, 8.0]
  - - [256, 32, 1, 32, 256, 256, 32, 32]
    - [47, 16.0]
  - - [448, 32, 1, 32, 448, 448, 32, 32]
    - [44, 28.0]
  - - [704, 32, 1, 32, 704, 704, 32, 32]
    - [47, 43.0]
  - - [1024, 32, 1, 32, 1024, 1024, 32, 32]
    - [44, 63.0]
  - - [1408, 32, 1, 32, 1408, 1408, 32, 32]
    - [47, 88.0]
  - - [1856, 32, 1, 32, 1856, 1856, 32, 32]
    - [44, 115.0]
  - - [2368, 32, 1, 32, 2368, 2368, 32, 32]
    - [44, 144.0]
  - - [2944, 32, 1, 32, 2944, 2944, 32, 32]
    - [44, 174.0]
  - - [3584, 32, 1, 32, 3584, 3584, 32, 32]
    - [46, 354.0]
  - - [4288, 32, 1, 32, 4288, 4288, 32, 32]
    - [44, 343.0]
  - - [5056, 32, 1, 32, 5056, 5056, 32, 32]
    - [44, 386.0]
  - - [5888, 32, 1, 32, 5888, 5888, 32, 32]
    - [47, 438.0]
  - - [6784, 32, 1, 32, 6784, 6784, 32, 32]
    - [47, 504.0]
  - - [1, 1, 1, 1, 1, 1, 1, 1]
    - [80, 0.0001163737988479692]
  - - [1, 64, 1, 256, 1, 1, 256, 256]
    - [83, 0.32]
  - - [1, 128, 1, 256, 1, 1, 256, 256]
    - [83, 1.0]
  - - [1, 256, 1, 256, 1, 1, 256, 256]
    - [79, 1.0]
  - - [1, 448, 1, 256, 1, 1, 256, 256]
    - [80, 2.0]
  - - [1, 704, 1, 256, 1, 1, 256, 256]
    - [83, 4.0]
  - - [1, 1024, 1, 256, 1, 1, 256, 256]
    - [83, 5.0]
  - - [1, 1408, 1, 256, 1, 1, 256, 256]
    - [83, 7.0]
  - - [1, 1856, 1, 256, 1, 1, 256, 256]
    - [83, 10.0]
  - - [1, 2368, 1, 256, 1, 1, 256, 256]
    - [83, 12.0]
  - - [1, 2944, 1, 256, 1, 1, 256, 256]
    - [83, 15.0]
  - - [1, 3584, 1, 256, 1, 1, 256, 256]
    - [83, 20.0]
  - - [1, 4288, 1, 256, 1, 1, 256, 256]
    - [91, 18.0]
  - - [1, 5056, 1, 256, 1, 1, 256, 256]
    - [91, 21.0]
  - - [1, 5888, 1, 256, 1, 1, 256, 256]
    - [91, 23.0]
  - - [1, 6784, 1, 256, 1, 1, 256, 256]
    - [88, 25.0]
  - - [1, 64, 1, 1280, 1, 1, 1280, 1280]
    - [101, 1.0]
  - - [1, 128, 1, 1280, 1, 1, 1280, 1280]
    - [106, 3.0]
  - - [1, 256, 1, 1280, 1, 1, 1280, 1280]
    - [106, 6.0]
  - - [1, 448, 1, 1280, 1, 1, 1280, 1280]
    - [106, 11.0]
  - - [1, 704, 1, 1280, 1, 1, 1280, 1280]
    - [107, 19.0]
  - - [1, 1024, 1, 1280, 1, 1, 1280, 1280]
    - [107, 21.0]
  - - [1, 1408, 1, 1280, 1, 1, 1280, 1280]
    - [107, 27.0]
  - - [1, 1856, 1, 1280, 1, 1, 1280, 1280]
    - [107, 28.0]
  - - [1, 2368, 1, 1280, 1, 1, 1280, 1280]
    - [104, 29.0]
  - - [1, 2944, 1, 1280, 1, 1, 1280, 1280]
    - [107, 30.0]
  - - [1, 3584, 1, 1280, 1, 1, 1280, 1280]
    - [108, 33.0]
  - - [1, 4288, 1, 1280, 1, 1, 1280, 1280]
    - [107, 36.0]
  - - [1, 5056, 1, 1280, 1, 1, 1280, 1280]
    - [107, 35.0]
  - - [1, 5888, 1, 1280, 1, 1, 1280, 1280]
    - [107, 36.0]
  - - [1, 6784, 1, 1280, 1, 1, 1280, 1280]
    - [107, 38.0]
  - - [1, 64, 1, 3328, 1, 1, 3328, 3328]
    - [110, 3.0]
  - - [1, 128, 1, 3328, 1, 1, 3328, 3328]
    - [110, 5.0]
  - - [1, 256, 1, 3328, 1, 1, 3328, 3328]
    - [110, 10.0]
  - - [1, 448, 1, 3328, 1, 1, 3328, 3328]
    - [111, 20.0]
  - - [1, 704, 1, 3328, 1, 1, 3328, 3328]
    - [107, 23.0]
  - - [1, 1024, 1, 3328, 1, 1, 3328, 3328]
    - [111, 31.0]
  - - [1, 1408, 1, 3328, 1, 1, 3328, 3328]
    - [111, 33.0]
  - - [1, 1856, 1, 3328, 1, 1, 3328, 3328]
    - [111, 34.0]
  - - [1, 2368, 1, 3328, 1, 1, 3328, 3328]
    - [111, 36.0]
  - - [1, 2944, 1, 3328, 1, 1, 3328, 3328]
    - [111, 38.0]
  - - [1, 3584, 1, 3328, 1, 1, 3328, 3328]
    - [111, 40.0]
  - - [1, 4288, 1, 3328, 1, 1, 3328, 3328]
    - [111, 39.0]
  - - [1, 5056, 1, 3328, 1, 1, 3328, 3328]
    - [111, 41.0]
  - - [1, 5888, 1, 3328, 1, 1, 3328, 3328]
    - [111, 41.0]
  - - [1, 6784, 1, 3328, 1, 1, 3328, 3328]
    - [111, 41.0]
  - - [64, 1, 1, 256, 64, 64, 256, 256]
    - [83, 0.33]
  - - [128, 1, 1, 256, 128, 128, 256, 256]
    - [80, 1.0]
  - - [256, 1, 1, 256, 256, 256, 256, 256]
    - [91, 2.0]
  - - [448, 1, 1, 256, 448, 448, 256, 256]
    - [80, 2.0]
  - - [704, 1, 1, 256, 704, 704, 256, 256]
    - [83, 4.0]
  - - [1024, 1, 1, 256, 1024, 1024, 256, 256]
    - [83, 6.0]
  - - [1408, 1, 1, 256, 1408, 1408, 256, 256]
    - [83, 8.0]
  - - [1856, 1, 1, 256, 1856, 1856, 256, 256]
    - [83, 10.0]
  - - [2368, 1, 1, 256, 2368, 2368, 256, 256]
    - [83, 13.0]
  - - [2944, 1, 1, 256, 2944, 2944, 256, 256]
    - [83, 16.0]
  - - [3584, 1, 1, 256, 3584, 3584, 256, 256]
    - [91, 22.0]
  - - [4288, 1, 1, 256, 4288, 4288, 256, 256]
    - [83, 18.0]
  - - [5056, 1, 1, 256, 5056, 5056, 256, 256]
    - [91, 22.0]
  - - [5888, 1, 1, 256, 5888, 5888, 256, 256]
    - [91, 25.0]
  - - [6784, 1, 1, 256, 6784, 6784, 256, 256]
    - [91, 29.0]
  - - [64, 1, 1, 1280, 64, 64, 1280, 1280]
    - [101, 1.0]
  - - [128, 1, 1, 1280, 128, 128, 1280, 1280]
    - [106, 3.0]
  - - [256, 1, 1, 1280, 256, 256, 1280, 1280]
    - [106, 6.0]
  - - [448, 1, 1, 1280, 448, 448, 1280, 1280]
    - [106, 11.0]
  - - [704, 1, 1, 1280, 704, 704, 1280, 1280]
    - [107, 20.0]
  - - [1024, 1, 1, 1280, 1024, 1024, 1280, 1280]
    - [107, 21.0]
  - - [1408, 1, 1, 1280, 1408, 1408, 1280, 1280]
    - [107, 28.0]
  - - [1856, 1, 1, 1280, 1856, 1856, 1280, 1280]
    - [107, 29.0]
  - - [2368, 1, 1, 1280, 2368, 2368, 1280, 1280]
    - [104, 31.0]
  - - [2944, 1, 1, 1280, 2944, 2944, 1280, 1280]
    - [104, 30.0]
  - - [3584, 1, 1, 1280, 3584, 3584, 1280, 1280]
    - [104, 34.0]
  - - [4288, 1, 1, 1280, 4288, 4288, 1280, 1280]
    - [104, 32.0]
  - - [5056, 1, 1, 1280, 5056, 5056, 1280, 1280]
    - [102, 30.0]
  - - [5888, 1, 1, 1280, 5888, 5888, 1280, 1280]
    - [102, 29.0]
  - - [6784, 1, 1, 1280, 6784, 6784, 1280, 1280]
    - [91, 32.0]
  - - [64, 1, 1, 3328, 64, 64, 3328, 3328]
    - [111, 3.0]
  - - [128, 1, 1, 3328, 128, 128, 3328, 3328]
    - [110, 5.0]
  - - [256, 1, 1, 3328, 256, 256, 3328, 3328]
    - [111, 10.0]
  - - [448, 1, 1, 3328, 448, 448, 3328, 3328]
    - [111, 20.0]
  - - [704, 1, 1, 3328, 704, 704, 3328, 3328]
    - [107, 23.0]
  - - [1024, 1, 1, 3328, 1024, 1024, 3328, 3328]
    - [111, 32.0]
  - - [1408, 1, 1, 3328, 1408, 1408, 3328, 3328]
    - [108, 32.0]
  - - [1856, 1, 1, 3328, 1856, 1856, 3328, 3328]
    - [111, 32.0]
  - - [2368, 1, 1, 3328, 2368, 2368, 3328, 3328]
    - [105, 31.0]
  - - [2944, 1, 1, 3328, 2944, 2944, 3328, 3328]
    - [112, 30.0]
  - - [3584, 1, 1, 3328, 3584, 3584, 3328, 3328]
    - [109, 29.0]
  - - [4288, 1, 1, 3328, 4288, 4288, 3328, 3328]
    - [109, 29.0]
  - - [5056, 1, 1, 3328, 5056, 5056, 3328, 3328]
    - [102, 30.0]
  - - [5888, 1, 1, 3328, 5888, 5888, 3328, 3328]
    - [83, 28.0]
  - - [6784, 1, 1, 3328, 6784, 6784, 3328, 3328]
    - [83, 32.0]
  - - [64, 64, 1, 1, 64, 64, 1, 1]
    - [80, 0.28]
  - - [128, 64, 1, 1, 128, 128, 1, 1]
    - [80, 1.0]
  - - [256, 64, 1, 1, 256, 256, 1, 1]
    - [89, 3.0]
  - - [448, 64, 1, 1, 448, 448, 1, 1]
    - [79, 2.0]
  - - [704, 64, 1, 1, 704, 704, 1, 1]
    - [79, 3.0]
  - - [1024, 64, 1, 1, 1024, 1024, 1, 1]
    - [80, 5.0]
  - - [1408, 64, 1, 1, 1408, 1408, 1, 1]
    - [80, 7.0]
  - - [1856, 64, 1, 1, 1856, 1856, 1, 1]
    - [80, 9.0]
  - - [2368, 64, 1, 1, 2368, 2368, 1, 1]
    - [80, 11.0]
  - - [2944, 64, 1, 1, 2944, 2944, 1, 1]
    - [84, 29.0]
  - - [3584, 64, 1, 1, 3584, 3584, 1, 1]
    - [80, 36.0]
  - - [4288, 64, 1, 1, 4288, 4288, 1, 1]
    - [88, 25.0]
  - - [5056, 64, 1, 1, 5056, 5056, 1, 1]
    - [83, 29.0]
  - - [5888, 64, 1, 1, 5888, 5888, 1, 1]
    - [83, 35.0]
  - - [6784, 64, 1, 1, 6784, 6784, 1, 1]
    - [83, 39.0]
  - - [64, 128, 1, 1, 64, 64, 1, 1]
    - [80, 1.0]
  - - [128, 128, 1, 1, 128, 128, 1, 1]
    - [79, 1.0]
  - - [256, 128, 1, 1, 256, 256, 1, 1]
    - [80, 2.0]
  - - [448, 128, 1, 1, 448, 448, 1, 1]
    - [89, 5.0]
  - - [704, 128, 1, 1, 704, 704, 1, 1]
    - [80, 7.0]
  - - [1024, 128, 1, 1, 1024, 1024, 1, 1]
    - [80, 10.0]
  - - [1408, 128, 1, 1, 1408, 1408, 1, 1]
    - [80, 13.0]
  - - [1856, 128, 1, 1, 1856, 1856, 1, 1]
    - [83, 33.0]
  - - [2368, 128, 1, 1, 2368, 2368, 1, 1]
    - [83, 27.0]
  - - [2944, 128, 1, 1, 2944, 2944, 1, 1]
    - [80, 33.0]
  - - [3584, 128, 1, 1, 3584, 3584, 1, 1]
    - [83, 40.0]
  - - [4288, 128, 1, 1, 4288, 4288, 1, 1]
    - [88, 44.0]
  - - [5056, 128, 1, 1, 5056, 5056, 1, 1]
    - [80, 52.0]
  - - [5888, 128, 1, 1, 5888, 5888, 1, 1]
    - [83, 50.0]
  - - [6784, 128, 1, 1, 6784, 6784, 1, 1]
    - [85, 55.0]
  - - [64, 256, 1, 1, 64, 64, 1, 1]
    - [89, 3.0]
  - - [128, 256, 1, 1, 128, 128, 1, 1]
    - [80, 2.0]
  - - [256, 256, 1, 1, 256, 256, 1, 1]
    - [88, 6.0]
  - - [448, 256, 1, 1, 448, 448, 1, 1]
    - [80, 9.0]
  - - [704, 256, 1, 1, 704, 704, 1, 1]
    - [80, 13.0]
  - - [1024, 256, 1, 1, 1024, 1024, 1, 1]
    - [85, 36.0]
  - - [1408, 256, 1, 1, 1408, 1408, 1, 1]
    - [80, 32.0]
  - - [1856, 256, 1, 1, 1856, 1856, 1, 1]
    - [83, 38.0]
  - - [2368, 256, 1, 1, 2368, 2368, 1, 1]
    - [88, 49.0]
  - - [2944, 256, 1, 1, 2944, 2944, 1, 1]
    - [83, 53.0]
  - - [3584, 256, 1, 1, 3584, 3584, 1, 1]
    - [83, 53.0]
  - - [4288, 256, 1, 1, 4288, 4288, 1, 1]
    - [88, 51.0]
  - - [5056, 256, 1, 1, 5056, 5056, 1, 1]
    - [84, 47.0]
  - - [5888, 256, 1, 1, 5888, 5888, 1, 1]
    - [78, 45.0]
  - - [6784, 256, 1, 1, 6784, 6784, 1, 1]
    - [82, 42.0]
  - - [64, 448, 1, 1, 64, 64, 1, 1]
    - [95, 3.0]
  - - [128, 448, 1, 1, 128, 128, 1, 1]
    - [80, 4.0]
  - - [256, 448, 1, 1, 256, 256, 1, 1]
    - [80, 9.0]
  - - [448, 448, 1, 1, 448, 448, 1, 1]
    - [85, 31.0]
  - - [704, 448, 1, 1, 704, 704, 1, 1]
    - [88, 29.0]
  - - [1024, 448, 1, 1, 1024, 1024, 1, 1]
    - [83, 41.0]
  - - [1408, 448, 1, 1, 1408, 1408, 1, 1]
    - [88, 49.0]
  - - [1856, 448, 1, 1, 1856, 1856, 1, 1]
    - [83, 55.0]
  - - [2368, 448, 1, 1, 2368, 2368, 1, 1]
    - [80, 50.0]
  - - [2944, 448, 1, 1, 2944, 2944, 1, 1]
    - [85, 46.0]
  - - [3584, 448, 1, 1, 3584, 3584, 1, 1]
    - [78, 40.0]
  - - [4288, 448, 1, 1, 4288, 4288, 1, 1]
    - [87, 41.0]
  - - [5056, 448, 1, 1, 5056, 5056, 1, 1]
    - [95, 40.0]
  - - [5888, 448, 1, 1, 5888, 5888, 1, 1]
    - [82, 36.0]
  - - [6784, 448, 1, 1, 6784, 6784, 1, 1]
    - [84, 37.0]
  - - [64, 704, 1, 1, 64, 64, 1, 1]
    - [80, 3.0]
  - - [128, 704, 1, 1, 128, 128, 1, 1]
    - [80, 7.0]
  - - [256, 704, 1, 1, 256, 256, 1, 1]
    - [80, 13.0]
  - - [448, 704, 1, 1, 448, 448, 1, 1]
    - [83, 29.0]
  - - [704, 704, 1, 1, 704, 704, 1, 1]
    - [83, 40.0]
  - - [1024, 704, 1, 1, 1024, 1024, 1, 1]
    - [85, 49.0]
  - - [1408, 704, 1, 1, 1408, 1408, 1, 1]
    - [83, 53.0]
  - - [1856, 704, 1, 1, 1856, 1856, 1, 1]
    - [80, 47.0]
  - - [2368, 704, 1, 1, 2368, 2368, 1, 1]
    - [88, 45.0]
  - - [2944, 704, 1, 1, 2944, 2944, 1, 1]
    - [83, 41.0]
  - - [3584, 704, 1, 1, 3584, 3584, 1, 1]
    - [91, 37.0]
  - - [4288, 704, 1, 1, 4288, 4288, 1, 1]
    - [86, 38.0]
  - - [5056, 704, 1, 1, 5056, 5056, 1, 1]
    - [90, 37.0]
  - - [5888, 704, 1, 1, 5888, 5888, 1, 1]
    - [80, 34.0]
  - - [6784, 704, 1, 1, 6784, 6784, 1, 1]
    - [84, 34.0]
  - - [64, 1024, 1, 1, 64, 64, 1, 1]
    - [80, 5.0]
  - - [128, 1024, 1, 1, 128, 128, 1, 1]
    - [80, 10.0]
  - - [256, 1024, 1, 1, 256, 256, 1, 1]
    - [88, 36.0]
  - - [448, 1024, 1, 1, 448, 448, 1, 1]
    - [88, 42.0]
  - - [704, 1024, 1, 1, 704, 704, 1, 1]
    - [83, 49.0]
  - - [1024, 1024, 1, 1, 1024, 1024, 1, 1]
    - [85, 40.0]
  - - [1408, 1024, 1, 1, 1408, 1408, 1, 1]
    - [80, 43.0]
  - - [1856, 1024, 1, 1, 1856, 1856, 1, 1]
    - [88, 44.0]
  - - [2368, 1024, 1, 1, 2368, 2368, 1, 1]
    - [85, 41.0]
  - - [2944, 1024, 1, 1, 2944, 2944, 1, 1]
    - [80, 37.0]
  - - [3584, 1024, 1, 1, 3584, 3584, 1, 1]
    - [83, 35.0]
  - - [4288, 1024, 1, 1, 4288, 4288, 1, 1]
    - [81, 36.0]
  - - [5056, 1024, 1, 1, 5056, 5056, 1, 1]
    - [81, 36.0]
  - - [5888, 1024, 1, 1, 5888, 5888, 1, 1]
    - [98, 33.0]
  - - [6784, 1024, 1, 1, 6784, 6784, 1, 1]
    - [80, 32.0]
  - - [64, 1408, 1, 1, 64, 64, 1, 1]
    - [80, 7.0]
  - - [128, 1408, 1, 1, 128, 128, 1, 1]
    - [80, 13.0]
  - - [256, 1408, 1, 1, 256, 256, 1, 1]
    - [80, 34.0]
  - - [448, 1408, 1, 1, 448, 448, 1, 1]
    - [83, 48.0]
  - - [704, 1408, 1, 1, 704, 704, 1, 1]
    - [79, 51.0]
  - - [1024, 1408, 1, 1, 1024, 1024, 1, 1]
    - [83, 39.0]
  - - [1408, 1408, 1, 1, 1408, 1408, 1, 1]
    - [85, 44.0]
  - - [1856, 1408, 1, 1, 1856, 1856, 1, 1]
    - [80, 41.0]
  - - [2368, 1408, 1, 1, 2368, 2368, 1, 1]
    - [88, 40.0]
  - - [2944, 1408, 1, 1, 2944, 2944, 1, 1]
    - [80, 36.0]
  - - [3584, 1408, 1, 1, 3584, 3584, 1, 1]
    - [80, 34.0]
  - - [4288, 1408, 1, 1, 4288, 4288, 1, 1]
    - [81, 35.0]
  - - [5056, 1408, 1, 1, 5056, 5056, 1, 1]
    - [81, 35.0]
  - - [5888, 1408, 1, 1, 5888, 5888, 1, 1]
    - [80, 32.0]
  - - [6784, 1408, 1, 1, 6784, 6784, 1, 1]
    - [80, 32.0]
  - - [64, 1856, 1, 1, 64, 64, 1, 1]
    - [80, 9.0]
  - - [128, 1856, 1, 1, 128, 128, 1, 1]
    - [80, 32.0]
  - - [256, 1856, 1, 1, 256, 256, 1, 1]
    - [83, 40.0]
  - - [448, 1856, 1, 1, 448, 448, 1, 1]
    - [83, 54.0]
  - - [704, 1856, 1, 1, 704, 704, 1, 1]
    - [80, 47.0]
  - - [1024, 1856, 1, 1, 1024, 1024, 1, 1]
    - [83, 38.0]
  - - [1408, 1856, 1, 1, 1408, 1408, 1, 1]
    - [83, 40.0]
  - - [1856, 1856, 1, 1, 1856, 1856, 1, 1]
    - [83, 40.0]
  - - [2368, 1856, 1, 1, 2368, 2368, 1, 1]
    - [80, 38.0]
  - - [2944, 1856, 1, 1, 2944, 2944, 1, 1]
    - [88, 36.0]
  - - [3584, 1856, 1, 1, 3584, 3584, 1, 1]
    - [91, 34.0]
  - - [4288, 1856, 1, 1, 4288, 4288, 1, 1]
    - [81, 35.0]
  - - [5056, 1856, 1, 1, 5056, 5056, 1, 1]
    - [81, 35.0]
  - - [5888, 1856, 1, 1, 5888, 5888, 1, 1]
    - [85, 32.0]
  - - [6784, 1856, 1, 1, 6784, 6784, 1, 1]
    - [97, 32.0]
  - - [64, 2368, 1, 1, 64, 64, 1, 1]
    - [80, 11.0]
  - - [128, 2368, 1, 1, 128, 128, 1, 1]
    - [80, 29.0]
  - - [256, 2368, 1, 1, 256, 256, 1, 1]
    - [88, 50.0]
  - - [448, 2368, 1, 1, 448, 448, 1, 1]
    - [80, 52.0]
  - - [704, 2368, 1, 1, 704, 704, 1, 1]
    - [85, 45.0]
  - - [1024, 2368, 1, 1, 1024, 1024, 1, 1]
    - [83, 38.0]
  - - [1408, 2368, 1, 1, 1408, 1408, 1, 1]
    - [88, 40.0]
  - - [1856, 2368, 1, 1, 1856, 1856, 1, 1]
    - [80, 39.0]
  - - [2368, 2368, 1, 1, 2368, 2368, 1, 1]
    - [80, 38.0]
  - - [2944, 2368, 1, 1, 2944, 2944, 1, 1]
    - [83, 35.0]
  - - [3584, 2368, 1, 1, 3584, 3584, 1, 1]
    - [80, 33.0]
  - - [4288, 2368, 1, 1, 4288, 4288, 1, 1]
    - [81, 35.0]
  - - [5056, 2368, 1, 1, 5056, 5056, 1, 1]
    - [81, 35.0]
  - - [5888, 2368, 1, 1, 5888, 5888, 1, 1]
    - [80, 31.0]
  - - [6784, 2368, 1, 1, 6784, 6784, 1, 1]
    - [98, 32.0]
  - - [64, 2944, 1, 1, 64, 64, 1, 1]
    - [88, 30.0]
  - - [128, 2944, 1, 1, 128, 128, 1, 1]
    - [83, 36.0]
  - - [256, 2944, 1, 1, 256, 256, 1, 1]
    - [85, 56.0]
  - - [448, 2944, 1, 1, 448, 448, 1, 1]
    - [80, 47.0]
  - - [704, 2944, 1, 1, 704, 704, 1, 1]
    - [80, 43.0]
  - - [1024, 2944, 1, 1, 1024, 1024, 1, 1]
    - [85, 38.0]
  - - [1408, 2944, 1, 1, 1408, 1408, 1, 1]
    - [88, 39.0]
  - - [1856, 2944, 1, 1, 1856, 1856, 1, 1]
    - [80, 38.0]
  - - [2368, 2944, 1, 1, 2368, 2368, 1, 1]
    - [80, 37.0]
  - - [2944, 2944, 1, 1, 2944, 2944, 1, 1]
    - [93, 35.0]
  - - [3584, 2944, 1, 1, 3584, 3584, 1, 1]
    - [89, 33.0]
  - - [4288, 2944, 1, 1, 4288, 4288, 1, 1]
    - [81, 35.0]
  - - [5056, 2944, 1, 1, 5056, 5056, 1, 1]
    - [81, 35.0]
  - - [5888, 2944, 1, 1, 5888, 5888, 1, 1]
    - [80, 31.0]
  - - [6784, 2944, 1, 1, 6784, 6784, 1, 1]
    - [98, 32.0]
  - - [64, 3584, 1, 1, 64, 64, 1, 1]
    - [83, 37.0]
  - - [128, 3584, 1, 1, 128, 128, 1, 1]
    - [83, 44.0]
  - - [256, 3584, 1, 1, 256, 256, 1, 1]
    - [88, 57.0]
  - - [448, 3584, 1, 1, 448, 448, 1, 1]
    - [80, 44.0]
  - - [704, 3584, 1, 1, 704, 704, 1, 1]
    - [83, 42.0]
  - - [1024, 3584, 1, 1, 1024, 1024, 1, 1]
    - [83, 37.0]
  - - [1408, 3584, 1, 1, 1408, 1408, 1, 1]
    - [83, 38.0]
  - - [1856, 3584, 1, 1, 1856, 1856, 1, 1]
    - [83, 38.0]
  - - [2368, 3584, 1, 1, 2368, 2368, 1, 1]
    - [80, 37.0]
  - - [2944, 3584, 1, 1, 2944, 2944, 1, 1]
    - [80, 34.0]
  - - [3584, 3584, 1, 1, 3584, 3584, 1, 1]
    - [80, 33.0]
  - - [4288, 3584, 1, 1, 4288, 4288, 1, 1]
    - [94, 35.0]
  - - [5056, 3584, 1, 1, 5056, 5056, 1, 1]
    - [81, 35.0]
  - - [5888, 3584, 1, 1, 5888, 5888, 1, 1]
    - [80, 31.0]
  - - [6784, 3584, 1, 1, 6784, 6784, 1, 1]
    - [80, 31.0]
  - - [64, 4288, 1, 1, 64, 64, 1, 1]
    - [83, 26.0]
  - - [128, 4288, 1, 1, 128, 128, 1, 1]
    - [88, 46.0]
  - - [256, 4288, 1, 1, 256, 256, 1, 1]
    - [85, 52.0]
  - - [448, 4288, 1, 1, 448, 448, 1, 1]
    - [80, 44.0]
  - - [704, 4288, 1, 1, 704, 704, 1, 1]
    - [83, 41.0]
  - - [1024, 4288, 1, 1, 1024, 1024, 1, 1]
    - [80, 37.0]
  - - [1408, 4288, 1, 1, 1408, 1408, 1, 1]
    - [83, 38.0]
  - - [1856, 4288, 1, 1, 1856, 1856, 1, 1]
    - [80, 37.0]
  - - [2368, 4288, 1, 1, 2368, 2368, 1, 1]
    - [80, 37.0]
  - - [2944, 4288, 1, 1, 2944, 2944, 1, 1]
    - [80, 34.0]
  - - [3584, 4288, 1, 1, 3584, 3584, 1, 1]
    - [85, 32.0]
  - - [4288, 4288, 1, 1, 4288, 4288, 1, 1]
    - [96, 35.0]
  - - [5056, 4288, 1, 1, 5056, 5056, 1, 1]
    - [81, 35.0]
  - - [5888, 4288, 1, 1, 5888, 5888, 1, 1]
    - [80, 31.0]
  - - [6784, 4288, 1, 1, 6784, 6784, 1, 1]
    - [80, 31.0]
  - - [64, 5056, 1, 1, 64, 64, 1, 1]
    - [88, 31.0]
  - - [128, 5056, 1, 1, 128, 128, 1, 1]
    - [80, 54.0]
  - - [256, 5056, 1, 1, 256, 256, 1, 1]
    - [83, 49.0]
  - - [448, 5056, 1, 1, 448, 448, 1, 1]
    - [85, 43.0]
  - - [704, 5056, 1, 1, 704, 704, 1, 1]
    - [80, 40.0]
  - - [1024, 5056, 1, 1, 1024, 1024, 1, 1]
    - [93, 37.0]
  - - [1408, 5056, 1, 1, 1408, 1408, 1, 1]
    - [83, 38.0]
  - - [1856, 5056, 1, 1, 1856, 1856, 1, 1]
    - [80, 37.0]
  - - [2368, 5056, 1, 1, 2368, 2368, 1, 1]
    - [80, 37.0]
  - - [2944, 5056, 1, 1, 2944, 2944, 1, 1]
    - [98, 35.0]
  - - [3584, 5056, 1, 1, 3584, 3584, 1, 1]
    - [80, 32.0]
  - - [4288, 5056, 1, 1, 4288, 4288, 1, 1]
    - [99, 35.0]
  - - [5056, 5056, 1, 1, 5056, 5056, 1, 1]
    - [81, 35.0]
  - - [5888, 5056, 1, 1, 5888, 5888, 1, 1]
    - [98, 31.0]
  - - [6784, 5056, 1, 1, 6784, 6784, 1, 1]
    - [80, 31.0]
  - - [64, 5888, 1, 1, 64, 64, 1, 1]
    - [83, 36.0]
  - - [128, 5888, 1, 1, 128, 128, 1, 1]
    - [88, 57.0]
  - - [256, 5888, 1, 1, 256, 256, 1, 1]
    - [83, 47.0]
  - - [448, 5888, 1, 1, 448, 448, 1, 1]
    - [88, 42.0]
  - - [704, 5888, 1, 1, 704, 704, 1, 1]
    - [80, 40.0]
  - - [1024, 5888, 1, 1, 1024, 1024, 1, 1]
    - [88, 36.0]
  - - [1408, 5888, 1, 1, 1408, 1408, 1, 1]
    - [85, 38.0]
  - - [1856, 5888, 1, 1, 1856, 1856, 1, 1]
    - [80, 37.0]
  - - [2368, 5888, 1, 1, 2368, 2368, 1, 1]
    - [80, 37.0]
  - - [2944, 5888, 1, 1, 2944, 2944, 1, 1]
    - [80, 34.0]
  - - [3584, 5888, 1, 1, 3584, 3584, 1, 1]
    - [80, 32.0]
  - - [4288, 5888, 1, 1, 4288, 4288, 1, 1]
    - [96, 35.0]
  - - [5056, 5888, 1, 1, 5056, 5056, 1, 1]
    - [81, 35.0]
  - - [5888, 5888, 1, 1, 5888, 5888, 1, 1]
    - [78, 30.0]
  - - [6784, 5888, 1, 1, 6784, 6784, 1, 1]
    - [80, 31.0]
  - - [64, 6784, 1, 1, 64, 64, 1, 1]
    - [80, 41.0]
  - - [128, 6784, 1, 1, 128, 128, 1, 1]
    - [83, 56.0]
  - - [256, 6784, 1, 1, 256, 256, 1, 1]
    - [80, 44.0]
  - - [448, 6784, 1, 1, 448, 448, 1, 1]
    - [80, 41.0]
  - - [704, 6784, 1, 1, 704, 704, 1, 1]
    - [80, 39.0]
  - - [1024, 6784, 1, 1, 1024, 1024, 1, 1]
    - [100, 37.0]
  - - [1408, 6784, 1, 1, 1408, 1408, 1, 1]
    - [97, 37.0]
  - - [1856, 6784, 1, 1, 1856, 1856, 1, 1]
    - [80, 37.0]
  - - [2368, 6784, 1, 1, 2368, 2368, 1, 1]
    - [81, 37.0]
  - - [2944, 6784, 1, 1, 2944, 2944, 1, 1]
    - [80, 34.0]
  - - [3584, 6784, 1, 1, 3584, 3584, 1, 1]
    - [83, 32.0]
  - - [4288, 6784, 1, 1, 4288, 4288, 1, 1]
    - [96, 35.0]
  - - [5056, 6784, 1, 1, 5056, 5056, 1, 1]
    - [81, 35.0]
  - - [5888, 6784, 1, 1, 5888, 5888, 1, 1]
    - [80, 30.0]
  - - [6784, 6784, 1, 1, 6784, 6784, 1, 1]
    - [80, 31.0]
  - - [1, 1, 1, 256, 1, 1, 256, 256]
    - [83, 0.005349605178382511]
  - - [1, 1, 1, 1280, 1, 1, 1280, 1280]
    - [103, 0.02]
  - - [1, 1, 1, 3328, 1, 1, 3328, 3328]
    - [110, 0.04]
  - - [1, 64, 1, 1, 1, 1, 1, 1]
    - [80, 0.006399680082101294]
  - - [1, 128, 1, 1, 1, 1, 1, 1]
    - [80, 0.01]
  - - [1, 256, 1, 1, 1, 1, 1, 1]
    - [83, 0.04]
  - - [1, 448, 1, 1, 1, 1, 1, 1]
    - [84, 0.08]
  - - [1, 704, 1, 1, 1, 1, 1, 1]
    - [92, 0.11]
  - - [1, 1024, 1, 1, 1, 1, 1, 1]
    - [91, 0.11]
  - - [1, 1408, 1, 1, 1, 1, 1, 1]
    - [85, 0.16]
  - - [1, 1856, 1, 1, 1, 1, 1, 1]
    - [80, 0.19]
  - - [1, 2368, 1, 1, 1, 1, 1, 1]
    - [85, 0.25]
  - - [1, 2944, 1, 1, 1, 1, 1, 1]
    - [80, 0.3]
  - - [1, 3584, 1, 1, 1, 1, 1, 1]
    - [80, 1.0]
  - - [1, 4288, 1, 1, 1, 1, 1, 1]
    - [80, 1.0]
  - - [1, 5056, 1, 1, 1, 1, 1, 1]
    - [80, 1.0]
  - - [1, 5888, 1, 1, 1, 1, 1, 1]
    - [80, 1.0]
  - - [1, 6784, 1, 1, 1, 1, 1, 1]
    - [79, 1.0]
  - - [64, 1, 1, 1, 64, 64, 1, 1]
    - [80, 0.007645442436734094]
  - - [128, 1, 1, 1, 128, 128, 1, 1]
    - [80, 0.02]
  - - [256, 1, 1, 1, 256, 256, 1, 1]
    - [85, 0.06]
  - - [448, 1, 1, 1, 448, 448, 1, 1]
    - [80, 0.1]
  - - [704, 1, 1, 1, 704, 704, 1, 1]
    - [85, 0.09]
  - - [1024, 1, 1, 1, 1024, 1024, 1, 1]
    - [80, 0.13]
  - - [1408, 1, 1, 1, 1408, 1408, 1, 1]
    - [80, 0.18]
  - - [1856, 1, 1, 1, 1856, 1856, 1, 1]
    - [80, 0.24]
  - - [2368, 1, 1, 1, 2368, 2368, 1, 1]
    - [80, 0.31]
  - - [2944, 1, 1, 1, 2944, 2944, 1, 1]
    - [83, 1.0]
  - - [3584, 1, 1, 1, 3584, 3584, 1, 1]
    - [79, 1.0]
  - - [4288, 1, 1, 1, 4288, 4288, 1, 1]
    - [79, 1.0]
  - - [5056, 1, 1, 1, 5056, 5056, 1, 1]
    - [79, 1.0]
  - - [5888, 1, 1, 1, 5888, 5888, 1, 1]
    - [78, 1.0]
  - - [6784, 1, 1, 1, 6784, 6784, 1, 1]
    - [78, 1.0]
- null
