library/src/blas3/Tensile/Logic/asm_full/vega10/vega10_Cijk_Ailk_Bjlk_CB_GB.yaml
- {MinimumRequiredVersion: 4.26.0}
- vega10
- gfx900
- [Device 6863, Device 6862, Device 687f, Device 6860, Device 6861, 'Vega 10 XTX [Radeon
    SolutionIndex: 0
    SolutionNameMin: Cijk_Ailk_Bjlk_CB_GB_MT32x32x8_SN_AMAS3_GRVW2_LRVW2_TT4_4_VW2_WG8_8_1_WGM1
    SolutionIndex: 1
    SolutionNameMin: Cijk_Ailk_Bjlk_CB_GB_MT64x64x8_SN_AMAS3_GRVW2_LRVW2_TT4_4_VW2_WG16_16_1_WGM1
    SolutionIndex: 2
    SolutionNameMin: Cijk_Ailk_Bjlk_CB_GB_MT128x64x8_SN_AMAS3_GRVW2_LRVW2_TT8_4_VW2_WG16_16_1_WGM1
    SolutionIndex: 3
    SolutionNameMin: Cijk_Ailk_Bjlk_CB_GB_MT64x128x8_SN_AMAS3_GRVW2_LRVW2_TT4_8_VW2_WG16_16_1_WGM1
    SolutionIndex: 4
    SolutionNameMin: Cijk_Ailk_Bjlk_CB_GB_MT32x32x16_SN_AMAS3_GRVW2_LRVW2_TT4_4_VW2_WG8_8_1_WGM1
    SolutionIndex: 5
    SolutionNameMin: Cijk_Ailk_Bjlk_CB_GB_MT64x64x16_SN_AMAS3_GRVW2_LRVW2_TT4_4_VW2_WG16_16_1_WGM1
    SolutionIndex: 6
    SolutionNameMin: Cijk_Ailk_Bjlk_CB_GB_MT32x32x8_SN_AMAS0_GRVW1_LRVW1_TT4_4_VW1_WG8_8_1_WGM1
    SolutionIndex: 7
    SolutionNameMin: Cijk_Ailk_Bjlk_CB_GB_MT64x64x8_SN_AMAS0_GRVW1_LRVW1_TT4_4_VW1_WG16_16_1_WGM1
    SolutionIndex: 8
    SolutionNameMin: Cijk_Ailk_Bjlk_CB_GB_MT64x64x16_SN_AMAS0_GRVW1_LRVW1_TT4_4_VW1_WG16_16_1_WGM1
    SolutionIndex: 9
    SolutionNameMin: Cijk_Ailk_Bjlk_CB_GB_MT32x32x8_SN_AMAS3_GRVW2_LRVW2_TT4_4_VW2_WG8_8_1_WGM8
    SolutionIndex: 10
    SolutionNameMin: Cijk_Ailk_Bjlk_CB_GB_MT64x64x8_SN_AMAS3_GRVW2_LRVW2_TT4_4_VW2_WG16_16_1_WGM8
    SolutionIndex: 11
    SolutionNameMin: Cijk_Ailk_Bjlk_CB_GB_MT128x64x8_SN_AMAS3_GRVW2_LRVW2_TT8_4_VW2_WG16_16_1_WGM8
    SolutionIndex: 12
    SolutionNameMin: Cijk_Ailk_Bjlk_CB_GB_MT64x128x8_SN_AMAS3_GRVW2_LRVW2_TT4_8_VW2_WG16_16_1_WGM8
    SolutionIndex: 13
    SolutionNameMin: Cijk_Ailk_Bjlk_CB_GB_MT64x64x16_SN_AMAS3_GRVW2_LRVW2_TT4_4_VW2_WG16_16_1_WGM8
    SolutionIndex: 14
    SolutionNameMin: Cijk_Ailk_Bjlk_CB_GB_MT32x32x8_SN_AMAS0_GRVW1_LRVW1_TT4_4_VW1_WG8_8_1_WGM8
    SolutionIndex: 15
    SolutionNameMin: Cijk_Ailk_Bjlk_CB_GB_MT64x64x8_SN_AMAS0_GRVW1_LRVW1_TT4_4_VW1_WG16_16_1_WGM8
    SolutionIndex: 16
    SolutionNameMin: Cijk_Ailk_Bjlk_CB_GB_MT64x128x8_SN_AMAS0_GRVW1_LRVW1_TT4_8_VW1_WG16_16_1_WGM8
- - - [32, 32, 8, 32, 32, 32, 32, 32]
    - [9, 37.0]
  - - [32, 32, 8, 64, 32, 32, 32, 32]
    - [0, 50.0]
  - - [32, 32, 8, 128, 32, 32, 32, 32]
    - [9, 61.0]
  - - [32, 32, 8, 256, 32, 32, 32, 32]
    - [0, 68.0]
  - - [32, 32, 8, 512, 32, 32, 32, 32]
    - [0, 73.0]
  - - [32, 64, 8, 32, 32, 32, 32, 64]
    - [0, 77.0]
  - - [32, 64, 8, 64, 32, 32, 32, 64]
    - [0, 103.0]
  - - [32, 64, 8, 128, 32, 32, 32, 64]
    - [0, 123.0]
  - - [32, 64, 8, 256, 32, 32, 32, 64]
    - [9, 138.0]
  - - [32, 64, 8, 512, 32, 32, 32, 64]
    - [4, 145.0]
  - - [32, 128, 8, 32, 32, 32, 32, 128]
    - [0, 156.0]
  - - [32, 128, 8, 64, 32, 32, 32, 128]
    - [0, 208.0]
  - - [32, 128, 8, 128, 32, 32, 32, 128]
    - [0, 249.0]
  - - [32, 128, 8, 256, 32, 32, 32, 128]
    - [0, 275.0]
  - - [32, 128, 8, 512, 32, 32, 32, 128]
    - [0, 288.0]
  - - [32, 256, 8, 32, 32, 32, 32, 256]
    - [0, 304.0]
  - - [32, 256, 8, 64, 32, 32, 32, 256]
    - [14, 383.0]
  - - [32, 256, 8, 128, 32, 32, 32, 256]
    - [14, 443.0]
  - - [32, 256, 8, 256, 32, 32, 32, 256]
    - [9, 492.0]
  - - [32, 256, 8, 512, 32, 32, 32, 256]
    - [9, 534.0]
  - - [32, 512, 8, 32, 32, 32, 32, 512]
    - [9, 520.0]
  - - [32, 512, 8, 64, 32, 32, 32, 512]
    - [9, 667.0]
  - - [32, 512, 8, 128, 32, 32, 32, 512]
    - [9, 689.0]
  - - [32, 512, 8, 256, 32, 32, 32, 512]
    - [4, 803.0]
  - - [32, 512, 8, 512, 32, 32, 32, 512]
    - [4, 936.0]
  - - [64, 32, 8, 32, 64, 64, 64, 32]
    - [9, 77.0]
  - - [64, 32, 8, 64, 64, 64, 64, 32]
    - [0, 103.0]
  - - [64, 32, 8, 128, 64, 64, 64, 32]
    - [0, 123.0]
  - - [64, 32, 8, 256, 64, 64, 64, 32]
    - [0, 137.0]
  - - [64, 32, 8, 512, 64, 64, 64, 32]
    - [0, 145.0]
  - - [64, 64, 8, 32, 64, 64, 64, 64]
    - [0, 155.0]
  - - [64, 64, 8, 64, 64, 64, 64, 64]
    - [0, 207.0]
  - - [64, 64, 8, 128, 64, 64, 64, 64]
    - [0, 249.0]
  - - [64, 64, 8, 256, 64, 64, 64, 64]
    - [0, 276.0]
  - - [64, 64, 8, 512, 64, 64, 64, 64]
    - [9, 290.0]
  - - [64, 128, 8, 32, 64, 64, 64, 128]
    - [0, 302.0]
  - - [64, 128, 8, 64, 64, 64, 64, 128]
    - [1, 399.0]
  - - [64, 128, 8, 128, 64, 64, 64, 128]
    - [1, 482.0]
  - - [64, 128, 8, 256, 64, 64, 64, 128]
    - [1, 527.0]
  - - [64, 128, 8, 512, 64, 64, 64, 128]
    - [1, 557.0]
  - - [64, 256, 8, 32, 64, 64, 64, 256]
    - [0, 562.0]
  - - [64, 256, 8, 64, 64, 64, 64, 256]
    - [1, 667.0]
  - - [64, 256, 8, 128, 64, 64, 64, 256]
    - [5, 743.0]
  - - [64, 256, 8, 256, 64, 64, 64, 256]
    - [5, 814.0]
  - - [64, 256, 8, 512, 64, 64, 64, 256]
    - [5, 965.0]
  - - [64, 512, 8, 32, 64, 64, 64, 512]
    - [10, 775.0]
  - - [64, 512, 8, 64, 64, 64, 64, 512]
    - [1, 861.0]
  - - [64, 512, 8, 128, 64, 64, 64, 512]
    - [10, 846.0]
  - - [64, 512, 8, 256, 64, 64, 64, 512]
    - [3, 1034.0]
  - - [64, 512, 8, 512, 64, 64, 64, 512]
    - [12, 1067.0]
  - - [128, 32, 8, 32, 128, 128, 128, 32]
    - [9, 156.0]
  - - [128, 32, 8, 64, 128, 128, 128, 32]
    - [0, 207.0]
  - - [128, 32, 8, 128, 128, 128, 128, 32]
    - [0, 249.0]
  - - [128, 32, 8, 256, 128, 128, 128, 32]
    - [0, 276.0]
  - - [128, 32, 8, 512, 128, 128, 128, 32]
    - [4, 288.0]
  - - [128, 64, 8, 32, 128, 128, 128, 64]
    - [0, 303.0]
  - - [128, 64, 8, 64, 128, 128, 128, 64]
    - [1, 396.0]
  - - [128, 64, 8, 128, 128, 128, 128, 64]
    - [1, 481.0]
  - - [128, 64, 8, 256, 128, 128, 128, 64]
    - [5, 525.0]
  - - [128, 64, 8, 512, 128, 128, 128, 64]
    - [5, 555.0]
  - - [128, 128, 8, 32, 128, 128, 128, 128]
    - [1, 547.0]
  - - [128, 128, 8, 64, 128, 128, 128, 128]
    - [1, 671.0]
  - - [128, 128, 8, 128, 128, 128, 128, 128]
    - [1, 720.0]
  - - [128, 128, 8, 256, 128, 128, 128, 128]
    - [10, 814.0]
  - - [128, 128, 8, 512, 128, 128, 128, 128]
    - [5, 957.0]
  - - [128, 256, 8, 32, 128, 128, 128, 256]
    - [1, 768.0]
  - - [128, 256, 8, 64, 128, 128, 128, 256]
    - [1, 850.0]
  - - [128, 256, 8, 128, 128, 128, 128, 256]
    - [3, 854.0]
  - - [128, 256, 8, 256, 128, 128, 128, 256]
    - [12, 956.0]
  - - [128, 256, 8, 512, 128, 128, 128, 256]
    - [3, 1066.0]
  - - [128, 512, 8, 32, 128, 128, 128, 512]
    - [7, 878.0]
  - - [128, 512, 8, 64, 128, 128, 128, 512]
    - [10, 998.0]
  - - [128, 512, 8, 128, 128, 128, 128, 512]
    - [10, 1089.0]
  - - [128, 512, 8, 256, 128, 128, 128, 512]
    - [1, 1208.0]
  - - [128, 512, 8, 512, 128, 128, 128, 512]
    - [10, 1267.0]
  - - [256, 32, 8, 32, 256, 256, 256, 32]
    - [9, 290.0]
  - - [256, 32, 8, 64, 256, 256, 256, 32]
    - [0, 363.0]
  - - [256, 32, 8, 128, 256, 256, 256, 32]
    - [0, 454.0]
  - - [256, 32, 8, 256, 256, 256, 256, 32]
    - [6, 478.0]
  - - [256, 32, 8, 512, 256, 256, 256, 32]
    - [9, 531.0]
  - - [256, 64, 8, 32, 256, 256, 256, 64]
    - [1, 530.0]
  - - [256, 64, 8, 64, 256, 256, 256, 64]
    - [10, 660.0]
  - - [256, 64, 8, 128, 256, 256, 256, 64]
    - [1, 701.0]
  - - [256, 64, 8, 256, 256, 256, 256, 64]
    - [10, 820.0]
  - - [256, 64, 8, 512, 256, 256, 256, 64]
    - [13, 941.0]
  - - [256, 128, 8, 32, 256, 256, 256, 128]
    - [9, 755.0]
  - - [256, 128, 8, 64, 256, 256, 256, 128]
    - [1, 827.0]
  - - [256, 128, 8, 128, 256, 256, 256, 128]
    - [16, 833.0]
  - - [256, 128, 8, 256, 256, 256, 256, 128]
    - [3, 984.0]
  - - [256, 128, 8, 512, 256, 256, 256, 128]
    - [2, 1063.0]
  - - [256, 256, 8, 32, 256, 256, 256, 256]
    - [7, 887.0]
  - - [256, 256, 8, 64, 256, 256, 256, 256]
    - [10, 979.0]
  - - [256, 256, 8, 128, 256, 256, 256, 256]
    - [1, 1075.0]
  - - [256, 256, 8, 256, 256, 256, 256, 256]
    - [10, 1183.0]
  - - [256, 256, 8, 512, 256, 256, 256, 256]
    - [7, 1231.0]
  - - [256, 512, 8, 32, 256, 256, 256, 512]
    - [15, 1001.0]
  - - [256, 512, 8, 64, 256, 256, 256, 512]
    - [7, 1200.0]
  - - [256, 512, 8, 128, 256, 256, 256, 512]
    - [10, 1288.0]
  - - [256, 512, 8, 256, 256, 256, 256, 512]
    - [1, 1427.0]
  - - [256, 512, 8, 512, 256, 256, 256, 512]
    - [10, 1481.0]
  - - [512, 32, 8, 32, 512, 512, 512, 32]
    - [6, 481.0]
  - - [512, 32, 8, 64, 512, 512, 512, 32]
    - [6, 586.0]
  - - [512, 32, 8, 128, 512, 512, 512, 32]
    - [9, 645.0]
  - - [512, 32, 8, 256, 512, 512, 512, 32]
    - [9, 793.0]
  - - [512, 32, 8, 512, 512, 512, 512, 32]
    - [4, 853.0]
  - - [512, 64, 8, 32, 512, 512, 512, 64]
    - [1, 738.0]
  - - [512, 64, 8, 64, 512, 512, 512, 64]
    - [10, 832.0]
  - - [512, 64, 8, 128, 512, 512, 512, 64]
    - [10, 834.0]
  - - [512, 64, 8, 256, 512, 512, 512, 64]
    - [2, 1006.0]
  - - [512, 64, 8, 512, 512, 512, 512, 64]
    - [2, 1048.0]
  - - [512, 128, 8, 32, 512, 512, 512, 128]
    - [9, 807.0]
  - - [512, 128, 8, 64, 512, 512, 512, 128]
    - [15, 970.0]
  - - [512, 128, 8, 128, 512, 512, 512, 128]
    - [10, 1105.0]
  - - [512, 128, 8, 256, 512, 512, 512, 128]
    - [10, 1155.0]
  - - [512, 128, 8, 512, 512, 512, 512, 128]
    - [1, 1248.0]
  - - [512, 256, 8, 32, 512, 512, 512, 256]
    - [7, 999.0]
  - - [512, 256, 8, 64, 512, 512, 512, 256]
    - [1, 1128.0]
  - - [512, 256, 8, 128, 512, 512, 512, 256]
    - [8, 1225.0]
  - - [512, 256, 8, 256, 512, 512, 512, 256]
    - [10, 1369.0]
  - - [512, 256, 8, 512, 512, 512, 512, 256]
    - [1, 1493.0]
  - - [512, 512, 8, 32, 512, 512, 512, 512]
    - [13, 1044.0]
  - - [512, 512, 8, 64, 512, 512, 512, 512]
    - [1, 1274.0]
  - - [512, 512, 8, 128, 512, 512, 512, 512]
    - [11, 1380.0]
  - - [512, 512, 8, 256, 512, 512, 512, 512]
    - [13, 1469.0]
  - - [512, 512, 8, 512, 512, 512, 512, 512]
    - [13, 1533.0]
- null
