library/src/blas3/Tensile/Logic/asm_full/vega10/vega10_Cijk_Alik_Bljk_ZB_GB.yaml
- {MinimumRequiredVersion: 4.26.0}
- vega10
- gfx900
- [Device 6863, Device 6862, Device 687f, Device 6860, Device 6861, 'Vega 10 XTX [Radeon
    SolutionIndex: 0
    SolutionNameMin: Cijk_Alik_Bljk_ZB_GB_MT32x32x8_SN_WG8_8_1_WGM1
    SolutionIndex: 1
    SolutionNameMin: Cijk_Alik_Bljk_ZB_GB_MT64x64x8_SN_WG16_16_1_WGM1
    SolutionIndex: 2
    SolutionNameMin: Cijk_Alik_Bljk_ZB_GB_MT64x64x16_SN_WG16_16_1_WGM1
    SolutionIndex: 3
    SolutionNameMin: Cijk_Alik_Bljk_ZB_GB_MT32x32x8_SN_WG8_8_1_WGM8
    SolutionIndex: 4
    SolutionNameMin: Cijk_Alik_Bljk_ZB_GB_MT64x64x8_SN_WG16_16_1_WGM8
    SolutionIndex: 5
    SolutionNameMin: Cijk_Alik_Bljk_ZB_GB_MT64x64x16_SN_WG16_16_1_WGM8
- - - [32, 32, 8, 32, 32, 32, 32, 32]
    - [0, 5.0]
  - - [32, 32, 8, 64, 32, 32, 64, 64]
    - [0, 6.0]
  - - [32, 32, 8, 128, 32, 32, 128, 128]
    - [0, 6.0]
  - - [32, 32, 8, 256, 32, 32, 256, 256]
    - [0, 6.0]
  - - [32, 32, 8, 512, 32, 32, 512, 512]
    - [0, 6.0]
  - - [32, 64, 8, 32, 32, 32, 32, 32]
    - [0, 11.0]
  - - [32, 64, 8, 64, 32, 32, 64, 64]
    - [0, 11.0]
  - - [32, 64, 8, 128, 32, 32, 128, 128]
    - [0, 11.0]
  - - [32, 64, 8, 256, 32, 32, 256, 256]
    - [0, 12.0]
  - - [32, 64, 8, 512, 32, 32, 512, 512]
    - [0, 12.0]
  - - [32, 128, 8, 32, 32, 32, 32, 32]
    - [0, 22.0]
  - - [32, 128, 8, 64, 32, 32, 64, 64]
    - [0, 22.0]
  - - [32, 128, 8, 128, 32, 32, 128, 128]
    - [0, 23.0]
  - - [32, 128, 8, 256, 32, 32, 256, 256]
    - [0, 23.0]
  - - [32, 128, 8, 512, 32, 32, 512, 512]
    - [0, 23.0]
  - - [32, 256, 8, 32, 32, 32, 32, 32]
    - [0, 43.0]
  - - [32, 256, 8, 64, 32, 32, 64, 64]
    - [0, 44.0]
  - - [32, 256, 8, 128, 32, 32, 128, 128]
    - [0, 44.0]
  - - [32, 256, 8, 256, 32, 32, 256, 256]
    - [0, 44.0]
  - - [32, 256, 8, 512, 32, 32, 512, 512]
    - [0, 44.0]
  - - [32, 512, 8, 32, 32, 32, 32, 32]
    - [0, 80.0]
  - - [32, 512, 8, 64, 32, 32, 64, 64]
    - [0, 82.0]
  - - [32, 512, 8, 128, 32, 32, 128, 128]
    - [0, 82.0]
  - - [32, 512, 8, 256, 32, 32, 256, 256]
    - [0, 81.0]
  - - [32, 512, 8, 512, 32, 32, 512, 512]
    - [3, 83.0]
  - - [64, 32, 8, 32, 64, 64, 32, 32]
    - [0, 11.0]
  - - [64, 32, 8, 64, 64, 64, 64, 64]
    - [0, 11.0]
  - - [64, 32, 8, 128, 64, 64, 128, 128]
    - [0, 11.0]
  - - [64, 32, 8, 256, 64, 64, 256, 256]
    - [0, 12.0]
  - - [64, 32, 8, 512, 64, 64, 512, 512]
    - [0, 12.0]
  - - [64, 64, 8, 32, 64, 64, 32, 32]
    - [0, 22.0]
  - - [64, 64, 8, 64, 64, 64, 64, 64]
    - [0, 22.0]
  - - [64, 64, 8, 128, 64, 64, 128, 128]
    - [0, 23.0]
  - - [64, 64, 8, 256, 64, 64, 256, 256]
    - [0, 23.0]
  - - [64, 64, 8, 512, 64, 64, 512, 512]
    - [0, 23.0]
  - - [64, 128, 8, 32, 64, 64, 32, 32]
    - [0, 43.0]
  - - [64, 128, 8, 64, 64, 64, 64, 64]
    - [0, 45.0]
  - - [64, 128, 8, 128, 64, 64, 128, 128]
    - [1, 45.0]
  - - [64, 128, 8, 256, 64, 64, 256, 256]
    - [1, 45.0]
  - - [64, 128, 8, 512, 64, 64, 512, 512]
    - [1, 46.0]
  - - [64, 256, 8, 32, 64, 64, 32, 32]
    - [0, 83.0]
  - - [64, 256, 8, 64, 64, 64, 64, 64]
    - [1, 85.0]
  - - [64, 256, 8, 128, 64, 64, 128, 128]
    - [1, 84.0]
  - - [64, 256, 8, 256, 64, 64, 256, 256]
    - [1, 85.0]
  - - [64, 256, 8, 512, 64, 64, 512, 512]
    - [1, 86.0]
  - - [64, 512, 8, 32, 64, 64, 32, 32]
    - [0, 79.0]
  - - [64, 512, 8, 64, 64, 64, 64, 64]
    - [0, 82.0]
  - - [64, 512, 8, 128, 64, 64, 128, 128]
    - [0, 84.0]
  - - [64, 512, 8, 256, 64, 64, 256, 256]
    - [0, 84.0]
  - - [64, 512, 8, 512, 64, 64, 512, 512]
    - [0, 84.0]
  - - [128, 32, 8, 32, 128, 128, 32, 32]
    - [0, 21.0]
  - - [128, 32, 8, 64, 128, 128, 64, 64]
    - [0, 22.0]
  - - [128, 32, 8, 128, 128, 128, 128, 128]
    - [0, 23.0]
  - - [128, 32, 8, 256, 128, 128, 256, 256]
    - [0, 23.0]
  - - [128, 32, 8, 512, 128, 128, 512, 512]
    - [0, 23.0]
  - - [128, 64, 8, 32, 128, 128, 32, 32]
    - [0, 42.0]
  - - [128, 64, 8, 64, 128, 128, 64, 64]
    - [0, 45.0]
  - - [128, 64, 8, 128, 128, 128, 128, 128]
    - [0, 45.0]
  - - [128, 64, 8, 256, 128, 128, 256, 256]
    - [1, 45.0]
  - - [128, 64, 8, 512, 128, 128, 512, 512]
    - [1, 46.0]
  - - [128, 128, 8, 32, 128, 128, 32, 32]
    - [1, 83.0]
  - - [128, 128, 8, 64, 128, 128, 64, 64]
    - [0, 85.0]
  - - [128, 128, 8, 128, 128, 128, 128, 128]
    - [0, 86.0]
  - - [128, 128, 8, 256, 128, 128, 256, 256]
    - [1, 86.0]
  - - [128, 128, 8, 512, 128, 128, 512, 512]
    - [4, 87.0]
  - - [128, 256, 8, 32, 128, 128, 32, 32]
    - [1, 78.0]
  - - [128, 256, 8, 64, 128, 128, 64, 64]
    - [3, 82.0]
  - - [128, 256, 8, 128, 128, 128, 128, 128]
    - [4, 84.0]
  - - [128, 256, 8, 256, 128, 128, 256, 256]
    - [0, 83.0]
  - - [128, 256, 8, 512, 128, 128, 512, 512]
    - [0, 84.0]
  - - [128, 512, 8, 32, 128, 128, 32, 32]
    - [3, 103.0]
  - - [128, 512, 8, 64, 128, 128, 64, 64]
    - [4, 109.0]
  - - [128, 512, 8, 128, 128, 128, 128, 128]
    - [0, 110.0]
  - - [128, 512, 8, 256, 128, 128, 256, 256]
    - [0, 111.0]
  - - [128, 512, 8, 512, 128, 128, 512, 512]
    - [1, 112.0]
  - - [256, 32, 8, 32, 256, 256, 32, 32]
    - [1, 42.0]
  - - [256, 32, 8, 64, 256, 256, 64, 64]
    - [0, 44.0]
  - - [256, 32, 8, 128, 256, 256, 128, 128]
    - [0, 44.0]
  - - [256, 32, 8, 256, 256, 256, 256, 256]
    - [0, 44.0]
  - - [256, 32, 8, 512, 256, 256, 512, 512]
    - [0, 45.0]
  - - [256, 64, 8, 32, 256, 256, 32, 32]
    - [2, 82.0]
  - - [256, 64, 8, 64, 256, 256, 64, 64]
    - [1, 84.0]
  - - [256, 64, 8, 128, 256, 256, 128, 128]
    - [0, 86.0]
  - - [256, 64, 8, 256, 256, 256, 256, 256]
    - [1, 86.0]
  - - [256, 64, 8, 512, 256, 256, 512, 512]
    - [1, 87.0]
  - - [256, 128, 8, 32, 256, 256, 32, 32]
    - [0, 78.0]
  - - [256, 128, 8, 64, 256, 256, 64, 64]
    - [0, 82.0]
  - - [256, 128, 8, 128, 256, 256, 128, 128]
    - [1, 83.0]
  - - [256, 128, 8, 256, 256, 256, 256, 256]
    - [0, 83.0]
  - - [256, 128, 8, 512, 256, 256, 512, 512]
    - [1, 84.0]
  - - [256, 256, 8, 32, 256, 256, 32, 32]
    - [2, 104.0]
  - - [256, 256, 8, 64, 256, 256, 64, 64]
    - [0, 108.0]
  - - [256, 256, 8, 128, 256, 256, 128, 128]
    - [0, 110.0]
  - - [256, 256, 8, 256, 256, 256, 256, 256]
    - [1, 111.0]
  - - [256, 256, 8, 512, 256, 256, 512, 512]
    - [1, 112.0]
  - - [256, 512, 8, 32, 256, 256, 32, 32]
    - [0, 122.0]
  - - [256, 512, 8, 64, 256, 256, 64, 64]
    - [1, 129.0]
  - - [256, 512, 8, 128, 256, 256, 128, 128]
    - [0, 130.0]
  - - [256, 512, 8, 256, 256, 256, 256, 256]
    - [1, 131.0]
  - - [256, 512, 8, 512, 256, 256, 512, 512]
    - [0, 131.0]
  - - [512, 32, 8, 32, 512, 512, 32, 32]
    - [3, 78.0]
  - - [512, 32, 8, 64, 512, 512, 64, 64]
    - [0, 83.0]
  - - [512, 32, 8, 128, 512, 512, 128, 128]
    - [0, 84.0]
  - - [512, 32, 8, 256, 512, 512, 256, 256]
    - [0, 85.0]
  - - [512, 32, 8, 512, 512, 512, 512, 512]
    - [0, 85.0]
  - - [512, 64, 8, 32, 512, 512, 32, 32]
    - [0, 77.0]
  - - [512, 64, 8, 64, 512, 512, 64, 64]
    - [0, 81.0]
  - - [512, 64, 8, 128, 512, 512, 128, 128]
    - [5, 83.0]
  - - [512, 64, 8, 256, 512, 512, 256, 256]
    - [2, 84.0]
  - - [512, 64, 8, 512, 512, 512, 512, 512]
    - [2, 84.0]
  - - [512, 128, 8, 32, 512, 512, 32, 32]
    - [3, 104.0]
  - - [512, 128, 8, 64, 512, 512, 64, 64]
    - [0, 108.0]
  - - [512, 128, 8, 128, 512, 512, 128, 128]
    - [0, 110.0]
  - - [512, 128, 8, 256, 512, 512, 256, 256]
    - [1, 111.0]
  - - [512, 128, 8, 512, 512, 512, 512, 512]
    - [0, 110.0]
  - - [512, 256, 8, 32, 512, 512, 32, 32]
    - [0, 123.0]
  - - [512, 256, 8, 64, 512, 512, 64, 64]
    - [0, 129.0]
  - - [512, 256, 8, 128, 512, 512, 128, 128]
    - [4, 132.0]
  - - [512, 256, 8, 256, 512, 512, 256, 256]
    - [1, 130.0]
  - - [512, 256, 8, 512, 512, 512, 512, 512]
    - [1, 131.0]
  - - [512, 512, 8, 32, 512, 512, 32, 32]
    - [0, 124.0]
  - - [512, 512, 8, 64, 512, 512, 64, 64]
    - [0, 128.0]
  - - [512, 512, 8, 128, 512, 512, 128, 128]
    - [1, 129.0]
  - - [512, 512, 8, 256, 512, 512, 256, 256]
    - [1, 130.0]
  - - [512, 512, 8, 512, 512, 512, 512, 512]
    - [1, 131.0]
- null
