library/src/blas3/Tensile/Logic/asm_full/vega10/vega10_Cijk_Alik_Bljk_CB_GB.yaml
- {MinimumRequiredVersion: 4.26.0}
- vega10
- gfx900
- [Device 6863, Device 6862, Device 687f, Device 6860, Device 6861, 'Vega 10 XTX [Radeon
    SolutionIndex: 0
    SolutionNameMin: Cijk_Alik_Bljk_CB_GB_MT32x32x8_SN_AMAS3_GRVW2_LRVW2_TT4_4_VW2_WG8_8_1_WGM1
    SolutionIndex: 1
    SolutionNameMin: Cijk_Alik_Bljk_CB_GB_MT32x64x8_SN_AMAS3_GRVW2_LRVW2_TT4_8_VW2_WG8_8_1_WGM1
    SolutionIndex: 2
    SolutionNameMin: Cijk_Alik_Bljk_CB_GB_MT64x64x8_SN_AMAS3_GRVW2_LRVW2_TT4_4_VW2_WG16_16_1_WGM1
    SolutionIndex: 3
    SolutionNameMin: Cijk_Alik_Bljk_CB_GB_MT32x32x16_SN_AMAS3_GRVW2_LRVW2_TT4_4_VW2_WG8_8_1_WGM1
    SolutionIndex: 4
    SolutionNameMin: Cijk_Alik_Bljk_CB_GB_MT64x64x16_SN_AMAS3_GRVW2_LRVW2_TT4_4_VW2_WG16_16_1_WGM1
    SolutionIndex: 5
    SolutionNameMin: Cijk_Alik_Bljk_CB_GB_MT32x32x8_SN_AMAS0_GRVW1_LRVW1_TT4_4_VW1_WG8_8_1_WGM1
    SolutionIndex: 6
    SolutionNameMin: Cijk_Alik_Bljk_CB_GB_MT64x64x8_SN_AMAS0_GRVW1_LRVW1_TT4_4_VW1_WG16_16_1_WGM1
    SolutionIndex: 7
    SolutionNameMin: Cijk_Alik_Bljk_CB_GB_MT32x32x8_SN_AMAS3_GRVW2_LRVW2_TT4_4_VW2_WG8_8_1_WGM8
    SolutionIndex: 8
    SolutionNameMin: Cijk_Alik_Bljk_CB_GB_MT64x32x8_SN_AMAS3_GRVW2_LRVW2_TT8_4_VW2_WG8_8_1_WGM8
    SolutionIndex: 9
    SolutionNameMin: Cijk_Alik_Bljk_CB_GB_MT32x64x8_SN_AMAS3_GRVW2_LRVW2_TT4_8_VW2_WG8_8_1_WGM8
    SolutionIndex: 10
    SolutionNameMin: Cijk_Alik_Bljk_CB_GB_MT64x64x8_SN_AMAS3_GRVW2_LRVW2_TT4_4_VW2_WG16_16_1_WGM8
    SolutionIndex: 11
    SolutionNameMin: Cijk_Alik_Bljk_CB_GB_MT32x32x16_SN_AMAS3_GRVW2_LRVW2_TT4_4_VW2_WG8_8_1_WGM8
    SolutionIndex: 12
    SolutionNameMin: Cijk_Alik_Bljk_CB_GB_MT64x64x16_SN_AMAS3_GRVW2_LRVW2_TT4_4_VW2_WG16_16_1_WGM8
    SolutionIndex: 13
    SolutionNameMin: Cijk_Alik_Bljk_CB_GB_MT32x32x8_SN_AMAS0_GRVW1_LRVW1_TT4_4_VW1_WG8_8_1_WGM8
    SolutionIndex: 14
    SolutionNameMin: Cijk_Alik_Bljk_CB_GB_MT64x64x8_SN_AMAS0_GRVW1_LRVW1_TT4_4_VW1_WG16_16_1_WGM8
- - - [32, 32, 8, 32, 32, 32, 32, 32]
    - [0, 37.0]
  - - [32, 32, 8, 64, 32, 32, 64, 64]
    - [0, 50.0]
  - - [32, 32, 8, 128, 32, 32, 128, 128]
    - [0, 60.0]
  - - [32, 32, 8, 256, 32, 32, 256, 256]
    - [7, 68.0]
  - - [32, 32, 8, 512, 32, 32, 512, 512]
    - [0, 72.0]
  - - [32, 64, 8, 32, 32, 32, 32, 32]
    - [0, 78.0]
  - - [32, 64, 8, 64, 32, 32, 64, 64]
    - [0, 105.0]
  - - [32, 64, 8, 128, 32, 32, 128, 128]
    - [0, 123.0]
  - - [32, 64, 8, 256, 32, 32, 256, 256]
    - [0, 137.0]
  - - [32, 64, 8, 512, 32, 32, 512, 512]
    - [3, 142.0]
  - - [32, 128, 8, 32, 32, 32, 32, 32]
    - [0, 159.0]
  - - [32, 128, 8, 64, 32, 32, 64, 64]
    - [0, 209.0]
  - - [32, 128, 8, 128, 32, 32, 128, 128]
    - [0, 248.0]
  - - [32, 128, 8, 256, 32, 32, 256, 256]
    - [0, 271.0]
  - - [32, 128, 8, 512, 32, 32, 512, 512]
    - [11, 249.0]
  - - [32, 256, 8, 32, 32, 32, 32, 32]
    - [0, 319.0]
  - - [32, 256, 8, 64, 32, 32, 64, 64]
    - [0, 382.0]
  - - [32, 256, 8, 128, 32, 32, 128, 128]
    - [0, 431.0]
  - - [32, 256, 8, 256, 32, 32, 256, 256]
    - [3, 401.0]
  - - [32, 256, 8, 512, 32, 32, 512, 512]
    - [3, 369.0]
  - - [32, 512, 8, 32, 32, 32, 32, 32]
    - [7, 570.0]
  - - [32, 512, 8, 64, 32, 32, 64, 64]
    - [0, 672.0]
  - - [32, 512, 8, 128, 32, 32, 128, 128]
    - [5, 527.0]
  - - [32, 512, 8, 256, 32, 32, 256, 256]
    - [3, 457.0]
  - - [32, 512, 8, 512, 32, 32, 512, 512]
    - [3, 433.0]
  - - [64, 32, 8, 32, 64, 64, 32, 32]
    - [0, 79.0]
  - - [64, 32, 8, 64, 64, 64, 64, 64]
    - [0, 103.0]
  - - [64, 32, 8, 128, 64, 64, 128, 128]
    - [0, 123.0]
  - - [64, 32, 8, 256, 64, 64, 256, 256]
    - [0, 137.0]
  - - [64, 32, 8, 512, 64, 64, 512, 512]
    - [0, 143.0]
  - - [64, 64, 8, 32, 64, 64, 32, 32]
    - [0, 159.0]
  - - [64, 64, 8, 64, 64, 64, 64, 64]
    - [0, 210.0]
  - - [64, 64, 8, 128, 64, 64, 128, 128]
    - [0, 249.0]
  - - [64, 64, 8, 256, 64, 64, 256, 256]
    - [7, 274.0]
  - - [64, 64, 8, 512, 64, 64, 512, 512]
    - [3, 282.0]
  - - [64, 128, 8, 32, 64, 64, 32, 32]
    - [0, 313.0]
  - - [64, 128, 8, 64, 64, 64, 64, 64]
    - [10, 398.0]
  - - [64, 128, 8, 128, 64, 64, 128, 128]
    - [2, 475.0]
  - - [64, 128, 8, 256, 64, 64, 256, 256]
    - [2, 506.0]
  - - [64, 128, 8, 512, 64, 64, 512, 512]
    - [4, 419.0]
  - - [64, 256, 8, 32, 64, 64, 32, 32]
    - [2, 571.0]
  - - [64, 256, 8, 64, 64, 64, 64, 64]
    - [2, 662.0]
  - - [64, 256, 8, 128, 64, 64, 128, 128]
    - [4, 709.0]
  - - [64, 256, 8, 256, 64, 64, 256, 256]
    - [12, 622.0]
  - - [64, 256, 8, 512, 64, 64, 512, 512]
    - [4, 648.0]
  - - [64, 512, 8, 32, 64, 64, 32, 32]
    - [7, 756.0]
  - - [64, 512, 8, 64, 64, 64, 64, 64]
    - [10, 802.0]
  - - [64, 512, 8, 128, 64, 64, 128, 128]
    - [6, 742.0]
  - - [64, 512, 8, 256, 64, 64, 256, 256]
    - [2, 723.0]
  - - [64, 512, 8, 512, 64, 64, 512, 512]
    - [4, 712.0]
  - - [128, 32, 8, 32, 128, 128, 32, 32]
    - [0, 159.0]
  - - [128, 32, 8, 64, 128, 128, 64, 64]
    - [0, 210.0]
  - - [128, 32, 8, 128, 128, 128, 128, 128]
    - [0, 249.0]
  - - [128, 32, 8, 256, 128, 128, 256, 256]
    - [0, 273.0]
  - - [128, 32, 8, 512, 128, 128, 512, 512]
    - [0, 282.0]
  - - [128, 64, 8, 32, 128, 128, 32, 32]
    - [0, 309.0]
  - - [128, 64, 8, 64, 128, 128, 64, 64]
    - [10, 401.0]
  - - [128, 64, 8, 128, 128, 128, 128, 128]
    - [2, 479.0]
  - - [128, 64, 8, 256, 128, 128, 256, 256]
    - [10, 520.0]
  - - [128, 64, 8, 512, 128, 128, 512, 512]
    - [7, 487.0]
  - - [128, 128, 8, 32, 128, 128, 32, 32]
    - [2, 562.0]
  - - [128, 128, 8, 64, 128, 128, 64, 64]
    - [2, 667.0]
  - - [128, 128, 8, 128, 128, 128, 128, 128]
    - [2, 714.0]
  - - [128, 128, 8, 256, 128, 128, 256, 256]
    - [10, 732.0]
  - - [128, 128, 8, 512, 128, 128, 512, 512]
    - [4, 717.0]
  - - [128, 256, 8, 32, 128, 128, 32, 32]
    - [2, 777.0]
  - - [128, 256, 8, 64, 128, 128, 64, 64]
    - [10, 843.0]
  - - [128, 256, 8, 128, 128, 128, 128, 128]
    - [7, 807.0]
  - - [128, 256, 8, 256, 128, 128, 256, 256]
    - [9, 826.0]
  - - [128, 256, 8, 512, 128, 128, 512, 512]
    - [2, 794.0]
  - - [128, 512, 8, 32, 128, 128, 32, 32]
    - [6, 936.0]
  - - [128, 512, 8, 64, 128, 128, 64, 64]
    - [14, 937.0]
  - - [128, 512, 8, 128, 128, 128, 128, 128]
    - [2, 1027.0]
  - - [128, 512, 8, 256, 128, 128, 256, 256]
    - [10, 1051.0]
  - - [128, 512, 8, 512, 128, 128, 512, 512]
    - [2, 943.0]
  - - [256, 32, 8, 32, 256, 256, 32, 32]
    - [7, 299.0]
  - - [256, 32, 8, 64, 256, 256, 64, 64]
    - [0, 371.0]
  - - [256, 32, 8, 128, 256, 256, 128, 128]
    - [7, 452.0]
  - - [256, 32, 8, 256, 256, 256, 256, 256]
    - [13, 474.0]
  - - [256, 32, 8, 512, 256, 256, 512, 512]
    - [0, 537.0]
  - - [256, 64, 8, 32, 256, 256, 32, 32]
    - [2, 544.0]
  - - [256, 64, 8, 64, 256, 256, 64, 64]
    - [10, 651.0]
  - - [256, 64, 8, 128, 256, 256, 128, 128]
    - [14, 696.0]
  - - [256, 64, 8, 256, 256, 256, 256, 256]
    - [2, 776.0]
  - - [256, 64, 8, 512, 256, 256, 512, 512]
    - [4, 748.0]
  - - [256, 128, 8, 32, 256, 256, 32, 32]
    - [2, 746.0]
  - - [256, 128, 8, 64, 256, 256, 64, 64]
    - [2, 844.0]
  - - [256, 128, 8, 128, 256, 256, 128, 128]
    - [10, 836.0]
  - - [256, 128, 8, 256, 256, 256, 256, 256]
    - [9, 922.0]
  - - [256, 128, 8, 512, 256, 256, 512, 512]
    - [6, 923.0]
  - - [256, 256, 8, 32, 256, 256, 32, 32]
    - [2, 892.0]
  - - [256, 256, 8, 64, 256, 256, 64, 64]
    - [10, 955.0]
  - - [256, 256, 8, 128, 256, 256, 128, 128]
    - [10, 1080.0]
  - - [256, 256, 8, 256, 256, 256, 256, 256]
    - [10, 1113.0]
  - - [256, 256, 8, 512, 256, 256, 512, 512]
    - [10, 1087.0]
  - - [256, 512, 8, 32, 256, 256, 32, 32]
    - [2, 953.0]
  - - [256, 512, 8, 64, 256, 256, 64, 64]
    - [2, 1134.0]
  - - [256, 512, 8, 128, 256, 256, 128, 128]
    - [2, 1222.0]
  - - [256, 512, 8, 256, 256, 256, 256, 256]
    - [10, 1391.0]
  - - [256, 512, 8, 512, 256, 256, 512, 512]
    - [12, 1171.0]
  - - [512, 32, 8, 32, 512, 512, 32, 32]
    - [5, 489.0]
  - - [512, 32, 8, 64, 512, 512, 64, 64]
    - [7, 584.0]
  - - [512, 32, 8, 128, 512, 512, 128, 128]
    - [11, 639.0]
  - - [512, 32, 8, 256, 512, 512, 256, 256]
    - [7, 748.0]
  - - [512, 32, 8, 512, 512, 512, 512, 512]
    - [3, 860.0]
  - - [512, 64, 8, 32, 512, 512, 32, 32]
    - [2, 739.0]
  - - [512, 64, 8, 64, 512, 512, 64, 64]
    - [10, 822.0]
  - - [512, 64, 8, 128, 512, 512, 128, 128]
    - [10, 820.0]
  - - [512, 64, 8, 256, 512, 512, 256, 256]
    - [8, 924.0]
  - - [512, 64, 8, 512, 512, 512, 512, 512]
    - [1, 973.0]
  - - [512, 128, 8, 32, 512, 512, 32, 32]
    - [14, 865.0]
  - - [512, 128, 8, 64, 512, 512, 64, 64]
    - [2, 948.0]
  - - [512, 128, 8, 128, 512, 512, 128, 128]
    - [6, 1060.0]
  - - [512, 128, 8, 256, 512, 512, 256, 256]
    - [10, 1157.0]
  - - [512, 128, 8, 512, 512, 512, 512, 512]
    - [10, 1137.0]
  - - [512, 256, 8, 32, 512, 512, 32, 32]
    - [6, 950.0]
  - - [512, 256, 8, 64, 512, 512, 64, 64]
    - [10, 1147.0]
  - - [512, 256, 8, 128, 512, 512, 128, 128]
    - [10, 1319.0]
  - - [512, 256, 8, 256, 512, 512, 256, 256]
    - [2, 1366.0]
  - - [512, 256, 8, 512, 512, 512, 512, 512]
    - [10, 1448.0]
  - - [512, 512, 8, 32, 512, 512, 32, 32]
    - [2, 1020.0]
  - - [512, 512, 8, 64, 512, 512, 64, 64]
    - [2, 1201.0]
  - - [512, 512, 8, 128, 512, 512, 128, 128]
    - [2, 1415.0]
  - - [512, 512, 8, 256, 512, 512, 256, 256]
    - [6, 1501.0]
  - - [512, 512, 8, 512, 512, 512, 512, 512]
    - [10, 1554.0]
- null
