library/src/blas3/Tensile/Logic/asm_full/vega10/vega10_Cijk_Ailk_Bjlk_DB_GB.yaml
- {MinimumRequiredVersion: 4.26.0}
- vega10
- gfx900
- [Device 6863, Device 6862, Device 687f, Device 6860, Device 6861, 'Vega 10 XTX [Radeon
    SolutionIndex: 0
    SolutionNameMin: Cijk_Ailk_Bjlk_DB_GB_MT32x32x8_SN_AMAS3_GRVW2_LRVW2_TT4_4_VW2_WG8_8_1_WGM1
    SolutionIndex: 1
    SolutionNameMin: Cijk_Ailk_Bjlk_DB_GB_MT64x32x8_SN_AMAS3_GRVW2_LRVW2_TT8_4_VW2_WG8_8_1_WGM1
    SolutionIndex: 2
    SolutionNameMin: Cijk_Ailk_Bjlk_DB_GB_MT64x64x8_SN_AMAS3_GRVW2_LRVW2_TT4_4_VW2_WG16_16_1_WGM1
    SolutionIndex: 3
    SolutionNameMin: Cijk_Ailk_Bjlk_DB_GB_MT128x64x8_SN_AMAS3_GRVW2_LRVW2_TT8_4_VW2_WG16_16_1_WGM1
    SolutionIndex: 4
    SolutionNameMin: Cijk_Ailk_Bjlk_DB_GB_MT64x128x8_SN_AMAS3_GRVW2_LRVW2_TT4_8_VW2_WG16_16_1_WGM1
    SolutionIndex: 5
    SolutionNameMin: Cijk_Ailk_Bjlk_DB_GB_MT32x32x16_SN_AMAS3_GRVW2_LRVW2_TT4_4_VW2_WG8_8_1_WGM1
    SolutionIndex: 6
    SolutionNameMin: Cijk_Ailk_Bjlk_DB_GB_MT64x64x16_SN_AMAS3_GRVW2_LRVW2_TT4_4_VW2_WG16_16_1_WGM1
    SolutionIndex: 7
    SolutionNameMin: Cijk_Ailk_Bjlk_DB_GB_MT128x64x16_SN_AMAS3_GRVW2_LRVW2_TT8_4_VW2_WG16_16_1_WGM1
    SolutionIndex: 8
    SolutionNameMin: Cijk_Ailk_Bjlk_DB_GB_MT32x32x32_SN_AMAS3_GRVW2_LRVW2_TT4_4_VW2_WG8_8_1_WGM1
    SolutionIndex: 9
    SolutionNameMin: Cijk_Ailk_Bjlk_DB_GB_MT64x64x32_SN_AMAS3_GRVW2_LRVW2_TT4_4_VW2_WG16_16_1_WGM1
    SolutionIndex: 10
    SolutionNameMin: Cijk_Ailk_Bjlk_DB_GB_MT64x64x8_SN_AMAS0_GRVW1_LRVW1_TT4_4_VW1_WG16_16_1_WGM1
    SolutionIndex: 11
    SolutionNameMin: Cijk_Ailk_Bjlk_DB_GB_MT128x64x8_SN_AMAS0_GRVW1_LRVW1_TT8_4_VW1_WG16_16_1_WGM1
    SolutionIndex: 12
    SolutionNameMin: Cijk_Ailk_Bjlk_DB_GB_MT32x32x16_SN_AMAS0_GRVW1_LRVW1_TT4_4_VW1_WG8_8_1_WGM1
    SolutionIndex: 13
    SolutionNameMin: Cijk_Ailk_Bjlk_DB_GB_MT32x32x8_SN_AMAS3_GRVW2_LRVW2_TT4_4_VW2_WG8_8_1_WGM8
    SolutionIndex: 14
    SolutionNameMin: Cijk_Ailk_Bjlk_DB_GB_MT64x64x8_SN_AMAS3_GRVW2_LRVW2_TT4_4_VW2_WG16_16_1_WGM8
    SolutionIndex: 15
    SolutionNameMin: Cijk_Ailk_Bjlk_DB_GB_MT128x64x8_SN_AMAS3_GRVW2_LRVW2_TT8_4_VW2_WG16_16_1_WGM8
    SolutionIndex: 16
    SolutionNameMin: Cijk_Ailk_Bjlk_DB_GB_MT64x128x8_SN_AMAS3_GRVW2_LRVW2_TT4_8_VW2_WG16_16_1_WGM8
    SolutionIndex: 17
    SolutionNameMin: Cijk_Ailk_Bjlk_DB_GB_MT32x32x16_SN_AMAS3_GRVW2_LRVW2_TT4_4_VW2_WG8_8_1_WGM8
    SolutionIndex: 18
    SolutionNameMin: Cijk_Ailk_Bjlk_DB_GB_MT64x64x16_SN_AMAS3_GRVW2_LRVW2_TT4_4_VW2_WG16_16_1_WGM8
    SolutionIndex: 19
    SolutionNameMin: Cijk_Ailk_Bjlk_DB_GB_MT128x64x16_SN_AMAS3_GRVW2_LRVW2_TT8_4_VW2_WG16_16_1_WGM8
    SolutionIndex: 20
    SolutionNameMin: Cijk_Ailk_Bjlk_DB_GB_MT64x128x16_SN_AMAS3_GRVW2_LRVW2_TT4_8_VW2_WG16_16_1_WGM8
    SolutionIndex: 21
    SolutionNameMin: Cijk_Ailk_Bjlk_DB_GB_MT32x32x32_SN_AMAS3_GRVW2_LRVW2_TT4_4_VW2_WG8_8_1_WGM8
    SolutionIndex: 22
    SolutionNameMin: Cijk_Ailk_Bjlk_DB_GB_MT64x64x32_SN_AMAS3_GRVW2_LRVW2_TT4_4_VW2_WG16_16_1_WGM8
    SolutionIndex: 23
    SolutionNameMin: Cijk_Ailk_Bjlk_DB_GB_MT32x32x8_SN_AMAS0_GRVW1_LRVW1_TT4_4_VW1_WG8_8_1_WGM8
    SolutionIndex: 24
    SolutionNameMin: Cijk_Ailk_Bjlk_DB_GB_MT64x64x8_SN_AMAS0_GRVW1_LRVW1_TT4_4_VW1_WG16_16_1_WGM8
    SolutionIndex: 25
    SolutionNameMin: Cijk_Ailk_Bjlk_DB_GB_MT128x64x8_SN_AMAS0_GRVW1_LRVW1_TT8_4_VW1_WG16_16_1_WGM8
- - - [32, 32, 8, 32, 32, 32, 32, 32]
    - [0, 18.0]
  - - [32, 32, 8, 64, 32, 32, 32, 32]
    - [0, 20.0]
  - - [32, 32, 8, 128, 32, 32, 32, 32]
    - [0, 21.0]
  - - [32, 32, 8, 256, 32, 32, 32, 32]
    - [0, 22.0]
  - - [32, 32, 8, 512, 32, 32, 32, 32]
    - [0, 22.0]
  - - [32, 64, 8, 32, 32, 32, 32, 64]
    - [0, 37.0]
  - - [32, 64, 8, 64, 32, 32, 32, 64]
    - [0, 41.0]
  - - [32, 64, 8, 128, 32, 32, 32, 64]
    - [0, 43.0]
  - - [32, 64, 8, 256, 32, 32, 32, 64]
    - [0, 44.0]
  - - [32, 64, 8, 512, 32, 32, 32, 64]
    - [0, 45.0]
  - - [32, 128, 8, 32, 32, 32, 32, 128]
    - [0, 74.0]
  - - [32, 128, 8, 64, 32, 32, 32, 128]
    - [0, 81.0]
  - - [32, 128, 8, 128, 32, 32, 32, 128]
    - [5, 86.0]
  - - [32, 128, 8, 256, 32, 32, 32, 128]
    - [0, 88.0]
  - - [32, 128, 8, 512, 32, 32, 32, 128]
    - [22, 90.0]
  - - [32, 256, 8, 32, 32, 32, 32, 256]
    - [0, 146.0]
  - - [32, 256, 8, 64, 32, 32, 32, 256]
    - [0, 161.0]
  - - [32, 256, 8, 128, 32, 32, 32, 256]
    - [0, 170.0]
  - - [32, 256, 8, 256, 32, 32, 32, 256]
    - [21, 172.0]
  - - [32, 256, 8, 512, 32, 32, 32, 256]
    - [5, 173.0]
  - - [32, 512, 8, 32, 32, 32, 32, 512]
    - [17, 268.0]
  - - [32, 512, 8, 64, 32, 32, 32, 512]
    - [23, 300.0]
  - - [32, 512, 8, 128, 32, 32, 32, 512]
    - [0, 330.0]
  - - [32, 512, 8, 256, 32, 32, 32, 512]
    - [0, 340.0]
  - - [32, 512, 8, 512, 32, 32, 32, 512]
    - [5, 331.0]
  - - [64, 32, 8, 32, 64, 64, 64, 32]
    - [5, 37.0]
  - - [64, 32, 8, 64, 64, 64, 64, 32]
    - [0, 41.0]
  - - [64, 32, 8, 128, 64, 64, 64, 32]
    - [0, 43.0]
  - - [64, 32, 8, 256, 64, 64, 64, 32]
    - [0, 44.0]
  - - [64, 32, 8, 512, 64, 64, 64, 32]
    - [0, 45.0]
  - - [64, 64, 8, 32, 64, 64, 64, 64]
    - [0, 73.0]
  - - [64, 64, 8, 64, 64, 64, 64, 64]
    - [0, 81.0]
  - - [64, 64, 8, 128, 64, 64, 64, 64]
    - [5, 86.0]
  - - [64, 64, 8, 256, 64, 64, 64, 64]
    - [0, 88.0]
  - - [64, 64, 8, 512, 64, 64, 64, 64]
    - [22, 90.0]
  - - [64, 128, 8, 32, 64, 64, 64, 128]
    - [0, 146.0]
  - - [64, 128, 8, 64, 64, 64, 64, 128]
    - [0, 161.0]
  - - [64, 128, 8, 128, 64, 64, 64, 128]
    - [6, 171.0]
  - - [64, 128, 8, 256, 64, 64, 64, 128]
    - [22, 177.0]
  - - [64, 128, 8, 512, 64, 64, 64, 128]
    - [2, 176.0]
  - - [64, 256, 8, 32, 64, 64, 64, 256]
    - [14, 283.0]
  - - [64, 256, 8, 64, 64, 64, 64, 256]
    - [2, 318.0]
  - - [64, 256, 8, 128, 64, 64, 64, 256]
    - [14, 336.0]
  - - [64, 256, 8, 256, 64, 64, 64, 256]
    - [2, 342.0]
  - - [64, 256, 8, 512, 64, 64, 64, 256]
    - [18, 344.0]
  - - [64, 512, 8, 32, 64, 64, 64, 512]
    - [16, 304.0]
  - - [64, 512, 8, 64, 64, 64, 64, 512]
    - [4, 326.0]
  - - [64, 512, 8, 128, 64, 64, 64, 512]
    - [20, 334.0]
  - - [64, 512, 8, 256, 64, 64, 64, 512]
    - [16, 343.0]
  - - [64, 512, 8, 512, 64, 64, 64, 512]
    - [10, 345.0]
  - - [128, 32, 8, 32, 128, 128, 128, 32]
    - [0, 73.0]
  - - [128, 32, 8, 64, 128, 128, 128, 32]
    - [0, 81.0]
  - - [128, 32, 8, 128, 128, 128, 128, 32]
    - [5, 86.0]
  - - [128, 32, 8, 256, 128, 128, 128, 32]
    - [0, 88.0]
  - - [128, 32, 8, 512, 128, 128, 128, 32]
    - [6, 88.0]
  - - [128, 64, 8, 32, 128, 128, 128, 64]
    - [0, 145.0]
  - - [128, 64, 8, 64, 128, 128, 128, 64]
    - [6, 161.0]
  - - [128, 64, 8, 128, 128, 128, 128, 64]
    - [6, 171.0]
  - - [128, 64, 8, 256, 128, 128, 128, 64]
    - [6, 176.0]
  - - [128, 64, 8, 512, 128, 128, 128, 64]
    - [6, 175.0]
  - - [128, 128, 8, 32, 128, 128, 128, 128]
    - [14, 281.0]
  - - [128, 128, 8, 64, 128, 128, 128, 128]
    - [14, 312.0]
  - - [128, 128, 8, 128, 128, 128, 128, 128]
    - [14, 336.0]
  - - [128, 128, 8, 256, 128, 128, 128, 128]
    - [6, 342.0]
  - - [128, 128, 8, 512, 128, 128, 128, 128]
    - [9, 337.0]
  - - [128, 256, 8, 32, 128, 128, 128, 256]
    - [11, 304.0]
  - - [128, 256, 8, 64, 128, 128, 128, 256]
    - [19, 329.0]
  - - [128, 256, 8, 128, 128, 128, 128, 256]
    - [1, 336.0]
  - - [128, 256, 8, 256, 128, 128, 128, 256]
    - [7, 341.0]
  - - [128, 256, 8, 512, 128, 128, 128, 256]
    - [14, 343.0]
  - - [128, 512, 8, 32, 128, 128, 128, 512]
    - [10, 377.0]
  - - [128, 512, 8, 64, 128, 128, 128, 512]
    - [2, 415.0]
  - - [128, 512, 8, 128, 128, 128, 128, 512]
    - [2, 438.0]
  - - [128, 512, 8, 256, 128, 128, 128, 512]
    - [10, 449.0]
  - - [128, 512, 8, 512, 128, 128, 128, 512]
    - [2, 444.0]
  - - [256, 32, 8, 32, 256, 256, 256, 32]
    - [13, 144.0]
  - - [256, 32, 8, 64, 256, 256, 256, 32]
    - [0, 160.0]
  - - [256, 32, 8, 128, 256, 256, 256, 32]
    - [5, 168.0]
  - - [256, 32, 8, 256, 256, 256, 256, 32]
    - [5, 170.0]
  - - [256, 32, 8, 512, 256, 256, 256, 32]
    - [8, 171.0]
  - - [256, 64, 8, 32, 256, 256, 256, 64]
    - [2, 276.0]
  - - [256, 64, 8, 64, 256, 256, 256, 64]
    - [2, 314.0]
  - - [256, 64, 8, 128, 256, 256, 256, 64]
    - [2, 332.0]
  - - [256, 64, 8, 256, 256, 256, 256, 64]
    - [9, 337.0]
  - - [256, 64, 8, 512, 256, 256, 256, 64]
    - [9, 339.0]
  - - [256, 128, 8, 32, 256, 256, 256, 128]
    - [4, 302.0]
  - - [256, 128, 8, 64, 256, 256, 256, 128]
    - [15, 329.0]
  - - [256, 128, 8, 128, 256, 256, 256, 128]
    - [3, 341.0]
  - - [256, 128, 8, 256, 256, 256, 256, 128]
    - [13, 340.0]
  - - [256, 128, 8, 512, 256, 256, 256, 128]
    - [2, 342.0]
  - - [256, 256, 8, 32, 256, 256, 256, 256]
    - [14, 386.0]
  - - [256, 256, 8, 64, 256, 256, 256, 256]
    - [2, 419.0]
  - - [256, 256, 8, 128, 256, 256, 256, 256]
    - [14, 437.0]
  - - [256, 256, 8, 256, 256, 256, 256, 256]
    - [24, 443.0]
  - - [256, 256, 8, 512, 256, 256, 256, 256]
    - [2, 446.0]
  - - [256, 512, 8, 32, 256, 256, 256, 512]
    - [2, 474.0]
  - - [256, 512, 8, 64, 256, 256, 256, 512]
    - [2, 503.0]
  - - [256, 512, 8, 128, 256, 256, 256, 512]
    - [24, 521.0]
  - - [256, 512, 8, 256, 256, 256, 256, 512]
    - [2, 535.0]
  - - [256, 512, 8, 512, 256, 256, 256, 512]
    - [14, 526.0]
  - - [512, 32, 8, 32, 512, 512, 512, 32]
    - [12, 254.0]
  - - [512, 32, 8, 64, 512, 512, 512, 32]
    - [13, 296.0]
  - - [512, 32, 8, 128, 512, 512, 512, 32]
    - [0, 315.0]
  - - [512, 32, 8, 256, 512, 512, 512, 32]
    - [17, 327.0]
  - - [512, 32, 8, 512, 512, 512, 512, 32]
    - [5, 327.0]
  - - [512, 64, 8, 32, 512, 512, 512, 64]
    - [25, 304.0]
  - - [512, 64, 8, 64, 512, 512, 512, 64]
    - [3, 332.0]
  - - [512, 64, 8, 128, 512, 512, 512, 64]
    - [7, 333.0]
  - - [512, 64, 8, 256, 512, 512, 512, 64]
    - [7, 339.0]
  - - [512, 64, 8, 512, 512, 512, 512, 64]
    - [2, 339.0]
  - - [512, 128, 8, 32, 512, 512, 512, 128]
    - [2, 393.0]
  - - [512, 128, 8, 64, 512, 512, 512, 128]
    - [24, 417.0]
  - - [512, 128, 8, 128, 512, 512, 512, 128]
    - [24, 438.0]
  - - [512, 128, 8, 256, 512, 512, 512, 128]
    - [24, 436.0]
  - - [512, 128, 8, 512, 512, 512, 512, 128]
    - [24, 441.0]
  - - [512, 256, 8, 32, 512, 512, 512, 256]
    - [14, 467.0]
  - - [512, 256, 8, 64, 512, 512, 512, 256]
    - [2, 511.0]
  - - [512, 256, 8, 128, 512, 512, 512, 256]
    - [18, 514.0]
  - - [512, 256, 8, 256, 512, 512, 512, 256]
    - [14, 533.0]
  - - [512, 256, 8, 512, 512, 512, 512, 256]
    - [24, 524.0]
  - - [512, 512, 8, 32, 512, 512, 512, 512]
    - [10, 480.0]
  - - [512, 512, 8, 64, 512, 512, 512, 512]
    - [10, 517.0]
  - - [512, 512, 8, 128, 512, 512, 512, 512]
    - [0, 527.0]
  - - [512, 512, 8, 256, 512, 512, 512, 512]
    - [24, 533.0]
  - - [512, 512, 8, 512, 512, 512, 512, 512]
    - [18, 521.0]
- null
