library/src/blas3/Tensile/Logic/asm_full/vega10/vega10_Cijk_Ailk_Bjlk_ZB_GB.yaml
- {MinimumRequiredVersion: 4.26.0}
- vega10
- gfx900
- [Device 6863, Device 6862, Device 687f, Device 6860, Device 6861, 'Vega 10 XTX [Radeon
    SolutionIndex: 0
    SolutionNameMin: Cijk_Ailk_Bjlk_ZB_GB_MT32x32x8_SN_WG8_8_1_WGM1
    SolutionIndex: 1
    SolutionNameMin: Cijk_Ailk_Bjlk_ZB_GB_MT64x64x8_SN_WG16_16_1_WGM1
    SolutionIndex: 2
    SolutionNameMin: Cijk_Ailk_Bjlk_ZB_GB_MT64x64x16_SN_WG16_16_1_WGM1
    SolutionIndex: 3
    SolutionNameMin: Cijk_Ailk_Bjlk_ZB_GB_MT32x32x8_SN_WG8_8_1_WGM8
    SolutionIndex: 4
    SolutionNameMin: Cijk_Ailk_Bjlk_ZB_GB_MT64x64x8_SN_WG16_16_1_WGM8
    SolutionIndex: 5
    SolutionNameMin: Cijk_Ailk_Bjlk_ZB_GB_MT64x64x16_SN_WG16_16_1_WGM8
- - - [32, 32, 8, 32, 32, 32, 32, 32]
    - [0, 5.0]
  - - [32, 32, 8, 64, 32, 32, 32, 32]
    - [0, 6.0]
  - - [32, 32, 8, 128, 32, 32, 32, 32]
    - [0, 6.0]
  - - [32, 32, 8, 256, 32, 32, 32, 32]
    - [0, 6.0]
  - - [32, 32, 8, 512, 32, 32, 32, 32]
    - [0, 6.0]
  - - [32, 64, 8, 32, 32, 32, 32, 64]
    - [0, 11.0]
  - - [32, 64, 8, 64, 32, 32, 32, 64]
    - [0, 11.0]
  - - [32, 64, 8, 128, 32, 32, 32, 64]
    - [0, 11.0]
  - - [32, 64, 8, 256, 32, 32, 32, 64]
    - [0, 12.0]
  - - [32, 64, 8, 512, 32, 32, 32, 64]
    - [0, 12.0]
  - - [32, 128, 8, 32, 32, 32, 32, 128]
    - [0, 22.0]
  - - [32, 128, 8, 64, 32, 32, 32, 128]
    - [0, 22.0]
  - - [32, 128, 8, 128, 32, 32, 32, 128]
    - [0, 23.0]
  - - [32, 128, 8, 256, 32, 32, 32, 128]
    - [0, 23.0]
  - - [32, 128, 8, 512, 32, 32, 32, 128]
    - [0, 23.0]
  - - [32, 256, 8, 32, 32, 32, 32, 256]
    - [0, 43.0]
  - - [32, 256, 8, 64, 32, 32, 32, 256]
    - [0, 45.0]
  - - [32, 256, 8, 128, 32, 32, 32, 256]
    - [0, 45.0]
  - - [32, 256, 8, 256, 32, 32, 32, 256]
    - [0, 45.0]
  - - [32, 256, 8, 512, 32, 32, 32, 256]
    - [0, 46.0]
  - - [32, 512, 8, 32, 32, 32, 32, 512]
    - [0, 81.0]
  - - [32, 512, 8, 64, 32, 32, 32, 512]
    - [0, 85.0]
  - - [32, 512, 8, 128, 32, 32, 32, 512]
    - [0, 87.0]
  - - [32, 512, 8, 256, 32, 32, 32, 512]
    - [0, 87.0]
  - - [32, 512, 8, 512, 32, 32, 32, 512]
    - [0, 88.0]
  - - [64, 32, 8, 32, 64, 64, 64, 32]
    - [0, 11.0]
  - - [64, 32, 8, 64, 64, 64, 64, 32]
    - [0, 11.0]
  - - [64, 32, 8, 128, 64, 64, 64, 32]
    - [0, 11.0]
  - - [64, 32, 8, 256, 64, 64, 64, 32]
    - [0, 12.0]
  - - [64, 32, 8, 512, 64, 64, 64, 32]
    - [0, 12.0]
  - - [64, 64, 8, 32, 64, 64, 64, 64]
    - [0, 22.0]
  - - [64, 64, 8, 64, 64, 64, 64, 64]
    - [0, 22.0]
  - - [64, 64, 8, 128, 64, 64, 64, 64]
    - [0, 23.0]
  - - [64, 64, 8, 256, 64, 64, 64, 64]
    - [0, 23.0]
  - - [64, 64, 8, 512, 64, 64, 64, 64]
    - [0, 23.0]
  - - [64, 128, 8, 32, 64, 64, 64, 128]
    - [0, 43.0]
  - - [64, 128, 8, 64, 64, 64, 64, 128]
    - [0, 45.0]
  - - [64, 128, 8, 128, 64, 64, 64, 128]
    - [0, 45.0]
  - - [64, 128, 8, 256, 64, 64, 64, 128]
    - [1, 46.0]
  - - [64, 128, 8, 512, 64, 64, 64, 128]
    - [1, 46.0]
  - - [64, 256, 8, 32, 64, 64, 64, 256]
    - [0, 83.0]
  - - [64, 256, 8, 64, 64, 64, 64, 256]
    - [2, 86.0]
  - - [64, 256, 8, 128, 64, 64, 64, 256]
    - [0, 87.0]
  - - [64, 256, 8, 256, 64, 64, 64, 256]
    - [2, 89.0]
  - - [64, 256, 8, 512, 64, 64, 64, 256]
    - [1, 88.0]
  - - [64, 512, 8, 32, 64, 64, 64, 512]
    - [1, 78.0]
  - - [64, 512, 8, 64, 64, 64, 64, 512]
    - [0, 82.0]
  - - [64, 512, 8, 128, 64, 64, 64, 512]
    - [0, 84.0]
  - - [64, 512, 8, 256, 64, 64, 64, 512]
    - [1, 85.0]
  - - [64, 512, 8, 512, 64, 64, 64, 512]
    - [1, 86.0]
  - - [128, 32, 8, 32, 128, 128, 128, 32]
    - [0, 22.0]
  - - [128, 32, 8, 64, 128, 128, 128, 32]
    - [0, 22.0]
  - - [128, 32, 8, 128, 128, 128, 128, 32]
    - [0, 23.0]
  - - [128, 32, 8, 256, 128, 128, 128, 32]
    - [0, 23.0]
  - - [128, 32, 8, 512, 128, 128, 128, 32]
    - [0, 23.0]
  - - [128, 64, 8, 32, 128, 128, 128, 64]
    - [0, 43.0]
  - - [128, 64, 8, 64, 128, 128, 128, 64]
    - [2, 45.0]
  - - [128, 64, 8, 128, 128, 128, 128, 64]
    - [0, 45.0]
  - - [128, 64, 8, 256, 128, 128, 128, 64]
    - [1, 46.0]
  - - [128, 64, 8, 512, 128, 128, 128, 64]
    - [1, 46.0]
  - - [128, 128, 8, 32, 128, 128, 128, 128]
    - [0, 83.0]
  - - [128, 128, 8, 64, 128, 128, 128, 128]
    - [0, 86.0]
  - - [128, 128, 8, 128, 128, 128, 128, 128]
    - [0, 87.0]
  - - [128, 128, 8, 256, 128, 128, 128, 128]
    - [2, 88.0]
  - - [128, 128, 8, 512, 128, 128, 128, 128]
    - [1, 88.0]
  - - [128, 256, 8, 32, 128, 128, 128, 256]
    - [0, 79.0]
  - - [128, 256, 8, 64, 128, 128, 128, 256]
    - [4, 82.0]
  - - [128, 256, 8, 128, 128, 128, 128, 256]
    - [1, 85.0]
  - - [128, 256, 8, 256, 128, 128, 128, 256]
    - [1, 85.0]
  - - [128, 256, 8, 512, 128, 128, 128, 256]
    - [5, 86.0]
  - - [128, 512, 8, 32, 128, 128, 128, 512]
    - [4, 105.0]
  - - [128, 512, 8, 64, 128, 128, 128, 512]
    - [3, 109.0]
  - - [128, 512, 8, 128, 128, 128, 128, 512]
    - [0, 111.0]
  - - [128, 512, 8, 256, 128, 128, 128, 512]
    - [0, 112.0]
  - - [128, 512, 8, 512, 128, 128, 128, 512]
    - [1, 113.0]
  - - [256, 32, 8, 32, 256, 256, 256, 32]
    - [1, 42.0]
  - - [256, 32, 8, 64, 256, 256, 256, 32]
    - [5, 44.0]
  - - [256, 32, 8, 128, 256, 256, 256, 32]
    - [0, 44.0]
  - - [256, 32, 8, 256, 256, 256, 256, 32]
    - [0, 44.0]
  - - [256, 32, 8, 512, 256, 256, 256, 32]
    - [0, 45.0]
  - - [256, 64, 8, 32, 256, 256, 256, 64]
    - [4, 83.0]
  - - [256, 64, 8, 64, 256, 256, 256, 64]
    - [0, 85.0]
  - - [256, 64, 8, 128, 256, 256, 256, 64]
    - [2, 87.0]
  - - [256, 64, 8, 256, 256, 256, 256, 64]
    - [2, 88.0]
  - - [256, 64, 8, 512, 256, 256, 256, 64]
    - [2, 88.0]
  - - [256, 128, 8, 32, 256, 256, 256, 128]
    - [0, 78.0]
  - - [256, 128, 8, 64, 256, 256, 256, 128]
    - [1, 82.0]
  - - [256, 128, 8, 128, 256, 256, 256, 128]
    - [5, 84.0]
  - - [256, 128, 8, 256, 256, 256, 256, 128]
    - [1, 85.0]
  - - [256, 128, 8, 512, 256, 256, 256, 128]
    - [2, 86.0]
  - - [256, 256, 8, 32, 256, 256, 256, 256]
    - [4, 106.0]
  - - [256, 256, 8, 64, 256, 256, 256, 256]
    - [0, 108.0]
  - - [256, 256, 8, 128, 256, 256, 256, 256]
    - [0, 111.0]
  - - [256, 256, 8, 256, 256, 256, 256, 256]
    - [1, 112.0]
  - - [256, 256, 8, 512, 256, 256, 256, 256]
    - [4, 113.0]
  - - [256, 512, 8, 32, 256, 256, 256, 512]
    - [0, 123.0]
  - - [256, 512, 8, 64, 256, 256, 256, 512]
    - [2, 129.0]
  - - [256, 512, 8, 128, 256, 256, 256, 512]
    - [1, 132.0]
  - - [256, 512, 8, 256, 256, 256, 256, 512]
    - [4, 132.0]
  - - [256, 512, 8, 512, 256, 256, 256, 512]
    - [1, 132.0]
  - - [512, 32, 8, 32, 512, 512, 512, 32]
    - [0, 78.0]
  - - [512, 32, 8, 64, 512, 512, 512, 32]
    - [3, 83.0]
  - - [512, 32, 8, 128, 512, 512, 512, 32]
    - [0, 85.0]
  - - [512, 32, 8, 256, 512, 512, 512, 32]
    - [0, 85.0]
  - - [512, 32, 8, 512, 512, 512, 512, 32]
    - [0, 86.0]
  - - [512, 64, 8, 32, 512, 512, 512, 64]
    - [1, 78.0]
  - - [512, 64, 8, 64, 512, 512, 512, 64]
    - [0, 81.0]
  - - [512, 64, 8, 128, 512, 512, 512, 64]
    - [5, 84.0]
  - - [512, 64, 8, 256, 512, 512, 512, 64]
    - [2, 85.0]
  - - [512, 64, 8, 512, 512, 512, 512, 64]
    - [5, 85.0]
  - - [512, 128, 8, 32, 512, 512, 512, 128]
    - [4, 104.0]
  - - [512, 128, 8, 64, 512, 512, 512, 128]
    - [0, 108.0]
  - - [512, 128, 8, 128, 512, 512, 512, 128]
    - [0, 110.0]
  - - [512, 128, 8, 256, 512, 512, 512, 128]
    - [1, 112.0]
  - - [512, 128, 8, 512, 512, 512, 512, 128]
    - [1, 111.0]
  - - [512, 256, 8, 32, 512, 512, 512, 256]
    - [0, 123.0]
  - - [512, 256, 8, 64, 512, 512, 512, 256]
    - [4, 130.0]
  - - [512, 256, 8, 128, 512, 512, 512, 256]
    - [2, 131.0]
  - - [512, 256, 8, 256, 512, 512, 512, 256]
    - [1, 131.0]
  - - [512, 256, 8, 512, 512, 512, 512, 256]
    - [4, 132.0]
  - - [512, 512, 8, 32, 512, 512, 512, 512]
    - [1, 124.0]
  - - [512, 512, 8, 64, 512, 512, 512, 512]
    - [0, 129.0]
  - - [512, 512, 8, 128, 512, 512, 512, 512]
    - [0, 129.0]
  - - [512, 512, 8, 256, 512, 512, 512, 512]
    - [0, 130.0]
  - - [512, 512, 8, 512, 512, 512, 512, 512]
    - [1, 131.0]
- null
