library/src/blas3/Tensile/Logic/aldebaran/aldebaran_Cijk_Alik_Bljk_BBH.yaml
- {MinimumRequiredVersion: 4.14.0}
- aldebaran
- gfx90a
- [Device 0050, Device 0051, Device 0052, Device 0054, Device 0062, Device 7400, Device
    SolutionIndex: 0
    SolutionNameMin: Cijk_Alik_Bljk_BBH_MT128x64x16_SE_
    SolutionIndex: 1
    SolutionNameMin: Cijk_Alik_Bljk_BBH_MT32x128x16_SE_
    SolutionIndex: 2
    SolutionNameMin: Cijk_Alik_Bljk_BBH_MT256x128x16_SE_
    SolutionIndex: 3
    SolutionNameMin: Cijk_Alik_Bljk_BBH_MT64x16x16_SE_
    SolutionIndex: 4
    SolutionNameMin: Cijk_Alik_Bljk_BBH_MT128x64x16_SE_AF0EM1_ASEM1_GRVW1_WGM8
    SolutionIndex: 5
    SolutionNameMin: Cijk_Alik_Bljk_BBH_MT32x128x16_SE_AF0EM1_ASEM1_GRVW1_WGM8
    SolutionIndex: 6
    SolutionNameMin: Cijk_Alik_Bljk_BBH_MT64x16x16_SE_AF0EM1_ASEM1_GRVW1_WGM8
    SolutionIndex: 7
    SolutionNameMin: Cijk_Alik_Bljk_BBH_MT64x32x16_SE_AF0EM1_ASEM1_GRVW1_WGM8
    SolutionIndex: 8
    SolutionNameMin: Cijk_Alik_Bljk_BBH_MT64x128x32_MI32x32x2x2_SE_AF0EM2_ASEM1_GRVW4_WGM1
    SolutionIndex: 9
    SolutionNameMin: Cijk_Alik_Bljk_BBH_MT64x128x32_MI32x32x2x2_SE_AF0EM2_ASEM2_GRVW4_WGM1
    SolutionIndex: 10
    SolutionNameMin: Cijk_Alik_Bljk_BBH_MT32x256x32_MI32x32x2x2_SE_AF0EM2_ASEM1_GRVW4_WGM8
    SolutionIndex: 11
    SolutionNameMin: Cijk_Alik_Bljk_BBH_MT64x128x32_MI32x32x2x2_SE_AF0EM2_ASEM1_GRVW4_WGM8
    SolutionIndex: 12
    SolutionNameMin: Cijk_Alik_Bljk_BBH_MT64x128x32_MI32x32x2x2_SE_AF0EM2_ASEM2_GRVW4_WGM8
    SolutionIndex: 13
    SolutionIndex: 14
    SolutionIndex: 15
    SolutionIndex: 16
    SolutionIndex: 17
    SolutionIndex: 18
    SolutionIndex: 19
    SolutionIndex: 20
    SolutionIndex: 21
    SolutionIndex: 22
    SolutionIndex: 23
    SolutionIndex: 24
    SolutionIndex: 25
    SolutionIndex: 26
    SolutionIndex: 27
    SolutionIndex: 28
    SolutionIndex: 29
    SolutionIndex: 30
    SolutionIndex: 31
    SolutionIndex: 32
    SolutionIndex: 33
    SolutionIndex: 34
    SolutionIndex: 35
    SolutionIndex: 36
    SolutionIndex: 37
    SolutionIndex: 38
    SolutionIndex: 39
    SolutionIndex: 40
    SolutionNameMin: Cijk_Alik_Bljk_BBH_MT64x80x64_MI16x16x8x1_SE_1LDSB0_AF0EM4_GRVW4_LBSPP128_PLR9_SU0_SUS256_SRVW0_TT1_80_WG64_4_1_WGM15
    SolutionIndex: 41
    SolutionNameMin: Cijk_Alik_Bljk_BBH_MT128x80x64_MI16x16x8x1_SE_1LDSB0_AF0EM4_GRVW2_LBSPP128_PLR9_SU0_SUS256_SRVW0_TT2_80_WG64_4_1_WGM2
    SolutionIndex: 42
    SolutionNameMin: Cijk_Alik_Bljk_BBH_MT128x80x64_MI16x16x8x1_SE_1LDSB0_AF0EM4_GRVW2_LBSPP128_PLR9_SU32_SUS128_SRVW0_TT2_80_WG64_4_1_WGM2
    SolutionIndex: 43
    SolutionNameMin: Cijk_Alik_Bljk_BBH_MT32x32x128_MI16x16x8x1_SE_1LDSB0_AF0EM1_GRVW8_LBSPP256_PLR17_SU0_SUS256_SRVW4_TT1_16_WG32_8_1_WGM1
    SolutionIndex: 44
    SolutionNameMin: Cijk_Alik_Bljk_BBH_MT32x32x128_MI16x16x8x1_SE_1LDSB0_AF0EM4_GRVW8_LBSPP256_PLR17_SU0_SUS256_SRVW4_TT1_16_WG32_8_1_WGM1
    SolutionIndex: 45
    SolutionNameMin: Cijk_Alik_Bljk_BBH_MT32x32x128_MI16x16x8x1_SE_1LDSB0_AF0EM4_GRVW8_LBSPP256_PLR17_SU0_SUS256_SRVW0_TT1_16_WG32_8_1_WGM2
    SolutionIndex: 46
    SolutionNameMin: Cijk_Alik_Bljk_BBH_MT128x80x64_MI16x16x8x1_SE_1LDSB0_AF0EM4_GRVW2_LBSPP128_PLR9_SU32_SUS128_SRVW0_TT2_80_WG64_4_1_WGM15
    SolutionIndex: 47
    SolutionNameMin: Cijk_Alik_Bljk_BBH_MT64x64x128_MI32x32x4x1_SE_1LDSB1_AF0EM1_GRVW8_LBSPP256_PLR33_SU0_SUS256_SRVW4_TT1_32_WG64_4_1_WGM15
    SolutionIndex: 48
    SolutionNameMin: Cijk_Alik_Bljk_BBH_MT128x96x32_MI32x32x4x1_SE_1LDSB0_AF0EM4_GRVW2_LBSPP128_PLR9_SU0_SUS256_SRVW4_TT1_96_WG128_2_1_WGM15
    SolutionIndex: 49
    SolutionNameMin: Cijk_Alik_Bljk_BBH_MT64x80x64_MI16x16x8x1_SE_1LDSB0_AF0EM4_GRVW4_LBSPP128_PLR9_SU16_SUS128_SRVW0_TT1_80_WG64_4_1_WGM15
    SolutionIndex: 50
    SolutionNameMin: Cijk_Alik_Bljk_BBH_MT64x80x64_MI16x16x8x1_SE_1LDSB0_AF0EM4_GRVW4_LBSPP128_PLR9_SU32_SUS256_SRVW0_TT1_80_WG64_4_1_WGM2
    SolutionIndex: 51
    SolutionNameMin: Cijk_Alik_Bljk_BBH_MT128x80x64_MI16x16x8x1_SE_1LDSB0_AF0EM4_GRVW2_LBSPP128_PLR9_SU32_SUS256_SRVW0_TT2_80_WG64_4_1_WGM2
    SolutionIndex: 52
    SolutionNameMin: Cijk_Alik_Bljk_BBH_MT32x32x128_MI16x16x8x1_SE_1LDSB0_AF0EM4_GRVW8_LBSPP256_PLR17_SU0_SUS256_SRVW0_TT1_16_WG32_8_1_WGM15
    SolutionIndex: 53
    SolutionNameMin: Cijk_Alik_Bljk_BBH_MT32x64x128_MI16x16x8x1_SE_1LDSB0_AF0EM4_GRVW8_LBSPP256_PLR17_SU0_SUS256_SRVW0_TT1_32_WG32_8_1_WGM15
    SolutionIndex: 54
    SolutionNameMin: Cijk_Alik_Bljk_BBH_MT64x32x128_MI16x16x8x1_SE_1LDSB0_AF0EM1_GRVW8_LBSPP256_PLR17_SU0_SUS256_SRVW0_TT2_16_WG32_8_1_WGM15
    SolutionIndex: 55
    SolutionNameMin: Cijk_Alik_Bljk_BBH_MT64x80x128_MI16x16x8x1_SE_1LDSB1_AF0EM4_GRVW8_LBSPP256_PLR17_SU0_SUS256_SRVW0_TT1_80_WG64_4_1_WGM15
    SolutionIndex: 56
    SolutionNameMin: Cijk_Alik_Bljk_BBH_MT128x96x32_MI32x32x4x1_SE_1LDSB0_AF0EM4_GRVW2_LBSPP128_PLR9_SU16_SUS128_SRVW4_TT1_96_WG128_2_1_WGM2
    SolutionIndex: 57
    SolutionNameMin: Cijk_Alik_Bljk_BBH_MT64x64x128_MI32x32x4x1_SE_1LDSB1_AF0EM4_GRVW8_LBSPP256_PLR33_SU0_SUS256_SRVW4_TT1_32_WG64_4_1_WGM15
    SolutionIndex: 58
    SolutionNameMin: Cijk_Alik_Bljk_BBH_MT32x32x128_MI16x16x8x1_SE_1LDSB0_AF0EM1_GRVW8_LBSPP256_PLR17_SU32_SUS256_SRVW4_TT1_16_WG32_8_1_WGM2
    SolutionIndex: 59
    SolutionNameMin: Cijk_Alik_Bljk_BBH_MT64x32x128_MI16x16x8x1_SE_1LDSB0_AF0EM1_GRVW8_LBSPP256_PLR17_SU16_SUS256_SRVW0_TT2_16_WG32_8_1_WGM15
    SolutionIndex: 60
    SolutionNameMin: Cijk_Alik_Bljk_BBH_MT32x32x128_MI16x16x8x1_SE_1LDSB0_AF0EM4_GRVW8_LBSPP256_PLR17_SU0_SUS256_SRVW4_TT1_16_WG32_8_1_WGM15
    SolutionIndex: 61
    SolutionNameMin: Cijk_Alik_Bljk_BBH_MT32x32x128_MI16x16x8x1_SE_1LDSB0_AF0EM4_GRVW8_LBSPP256_PLR17_SU16_SUS256_SRVW0_TT1_16_WG32_8_1_WGM2
    SolutionIndex: 62
    SolutionNameMin: Cijk_Alik_Bljk_BBH_MT32x32x128_MI16x16x8x1_SE_1LDSB0_AF0EM1_GRVW8_LBSPP256_PLR17_SU0_SUS256_SRVW0_TT1_16_WG32_8_1_WGM15
    SolutionIndex: 63
    SolutionNameMin: Cijk_Alik_Bljk_BBH_MT32x32x128_MI16x16x8x1_SE_1LDSB0_AF0EM4_GRVW8_LBSPP256_PLR17_SU32_SUS256_SRVW4_TT1_16_WG32_8_1_WGM1
    SolutionIndex: 64
    SolutionNameMin: Cijk_Alik_Bljk_BBH_MT128x96x32_MI32x32x4x1_SE_1LDSB0_AF0EM4_GRVW2_LBSPP128_PLR9_SU32_SUS128_SRVW0_TT1_96_WG128_2_1_WGM2
    SolutionIndex: 65
    SolutionNameMin: Cijk_Alik_Bljk_BBH_MT128x256x32_MI32x32x4x1_SE_1LDSB1_AF0EM8_GRVW2_GSU1_LBSPP128_LPA4_LPB4_PLR9_SU0_SUS256_SRVW4_TT2_128_WG64_4_1_WGM1
    SolutionIndex: 66
    SolutionNameMin: Cijk_Alik_Bljk_BBH_MT128x256x32_MI32x32x4x1_SE_1LDSB1_AF0EM8_GRVW2_GSU1_LBSPP128_LPA4_LPB4_PLR9_SU0_SUS256_SRVW4_TT2_128_WG64_4_1_WGM15
    SolutionIndex: 67
    SolutionNameMin: Cijk_Alik_Bljk_BBH_MT128x128x32_MI32x32x4x1_SE_1LDSB1_AF0EM8_GRVW2_GSU1_LBSPP128_LPA4_LPB4_PLR9_SU0_SUS256_SRVW4_TT2_64_WG64_4_1_WGM1
    SolutionIndex: 68
    SolutionNameMin: Cijk_Alik_Bljk_BBH_MT128x96x64_MI32x32x4x1_SE_1LDSB1_AF0EM8_GRVW8_GSU1_LBSPP128_LPA8_LPB8_PLR17_SU32_SUS256_SRVW4_TT1_96_WG128_2_1_WGM15
    SolutionIndex: 69
    SolutionNameMin: Cijk_Alik_Bljk_BBH_MT128x160x32_MI32x32x4x1_SE_1LDSB1_AF0EM8_GRVW4_GSU1_LBSPP128_LPA4_LPB4_PLR9_SU32_SUS128_SRVW4_TT1_160_WG128_2_1_WGM15
    SolutionIndex: 70
    SolutionNameMin: Cijk_Alik_Bljk_BBH_MT128x144x32_MI16x16x8x1_SE_1LDSB1_AF0EM8_GRVW2_GSU1_LBSPP128_LPA4_LPB4_PLR5_SU0_SUS256_SRVW4_TT2_144_WG64_4_1_WGM15
    SolutionIndex: 71
    SolutionNameMin: Cijk_Alik_Bljk_BBH_MT64x128x32_MI32x32x4x1_SE_1LDSB1_AF0EM8_GRVW8_GSU1_LBSPP128_LPA8_LPB8_PLR9_SU0_SUS256_SRVW4_TT1_64_WG64_4_1_WGM15
    SolutionIndex: 72
    SolutionNameMin: Cijk_Alik_Bljk_BBH_MT96x96x64_MI16x16x8x1_SE_1LDSB1_AF0EM8_GRVW2_GSU1_LBSPP128_LPA4_LPB4_PLR9_SU0_SUS256_SRVW0_TT3_48_WG32_8_1_WGM1
    SolutionIndex: 73
    SolutionNameMin: Cijk_Alik_Bljk_BBH_MT128x96x32_MI32x32x4x1_SE_1LDSB1_AF0EM8_GRVW2_GSU1_LBSPP128_LPA4_LPB4_PLR9_SU32_SUS256_SRVW4_TT1_96_WG128_2_1_WGM15
    SolutionIndex: 74
    SolutionNameMin: Cijk_Alik_Bljk_BBH_MT64x64x64_MI32x32x4x1_SE_1LDSB1_AF0EM8_GRVW4_GSU1_LBSPP128_LPA4_LPB4_PLR17_SU0_SUS256_SRVW4_TT1_32_WG64_4_1_WGM15
    SolutionIndex: 75
    SolutionNameMin: Cijk_Alik_Bljk_BBH_MT96x96x64_MI16x16x8x1_SE_1LDSB1_AF0EM8_GRVW2_GSU1_LBSPP128_LPA4_LPB4_PLR9_SU32_SUS128_SRVW0_TT3_48_WG32_8_1_WGM15
    SolutionIndex: 76
    SolutionNameMin: Cijk_Alik_Bljk_BBH_MT128x128x32_MI32x32x4x1_SE_1LDSB1_AF0EM8_GRVW8_GSU1_LBSPP128_LPA8_LPB8_PLR9_SU0_SUS256_SRVW4_TT2_64_WG64_4_1_WGM15
    SolutionIndex: 77
    SolutionNameMin: Cijk_Alik_Bljk_BBH_MT128x128x32_MI32x32x4x1_SE_1LDSB1_AF0EM8_GRVW2_GSU1_LBSPP128_LPA4_LPB4_PLR9_SU0_SUS256_SRVW4_TT2_64_WG64_4_1_WGM15
    SolutionIndex: 78
    SolutionNameMin: Cijk_Alik_Bljk_BBH_MT96x96x64_MI16x16x8x1_SE_1LDSB1_AF0EM8_GRVW2_GSU1_LBSPP128_LPA4_LPB4_PLR9_SU0_SUS256_SRVW0_TT3_48_WG32_8_1_WGM15
    SolutionIndex: 79
    SolutionNameMin: Cijk_Alik_Bljk_BBH_MT128x128x32_MI32x32x4x1_SE_1LDSB1_AF0EM8_GRVW8_GSU1_LBSPP128_LPA8_LPB8_PLR9_SU0_SUS256_SRVW4_TT2_64_WG64_4_1_WGM2
    SolutionIndex: 80
    SolutionNameMin: Cijk_Alik_Bljk_BBH_MT128x96x32_MI32x32x4x1_SE_1LDSB1_AF0EM8_GRVW2_GSU1_LBSPP128_LPA4_LPB4_PLR9_SU32_SUS128_SRVW4_TT1_96_WG128_2_1_WGM15
    SolutionIndex: 81
    SolutionNameMin: Cijk_Alik_Bljk_BBH_MT128x96x64_MI32x32x4x1_SE_1LDSB1_AF0EM8_GRVW2_GSU1_LBSPP128_LPA4_LPB4_PLR17_SU0_SUS256_SRVW4_TT1_96_WG128_2_1_WGM2
    SolutionIndex: 82
    SolutionNameMin: Cijk_Alik_Bljk_BBH_MT128x96x64_MI32x32x4x1_SE_1LDSB1_AF0EM8_GRVW2_GSU1_LBSPP128_LPA4_LPB4_PLR17_SU32_SUS256_SRVW4_TT1_96_WG128_2_1_WGM15
    SolutionIndex: 83
    SolutionNameMin: Cijk_Alik_Bljk_BBH_MT128x160x32_MI32x32x4x1_SE_1LDSB1_AF0EM8_GRVW2_GSU1_LBSPP128_LPA4_LPB4_PLR9_SU0_SUS256_SRVW4_TT1_160_WG128_2_1_WGM15
    SolutionIndex: 84
    SolutionNameMin: Cijk_Alik_Bljk_BBH_MT128x96x32_MI32x32x4x1_SE_1LDSB1_AF0EM8_GRVW2_GSU1_LBSPP128_LPA4_LPB4_PLR9_SU0_SUS256_SRVW4_TT1_96_WG128_2_1_WGM15
    SolutionIndex: 85
    SolutionNameMin: Cijk_Alik_Bljk_BBH_MT128x96x64_MI32x32x4x1_SE_1LDSB1_AF0EM8_GRVW2_GSU1_LBSPP128_LPA4_LPB4_PLR17_SU0_SUS256_SRVW4_TT1_96_WG128_2_1_WGM15
    SolutionIndex: 86
    SolutionNameMin: Cijk_Alik_Bljk_BBH_MT128x64x32_MI32x32x4x1_SE_1LDSB1_AF0EM8_GRVW8_GSU1_LBSPP128_LPA8_LPB8_PLR9_SU32_SUS128_SRVW4_TT2_32_WG64_4_1_WGM15
    SolutionIndex: 87
    SolutionNameMin: Cijk_Alik_Bljk_BBH_MT128x64x64_MI32x32x4x1_SE_1LDSB1_AF0EM8_GRVW8_GSU1_LBSPP128_LPA8_LPB8_PLR17_SU32_SUS256_SRVW4_TT2_32_WG64_4_1_WGM15
    SolutionIndex: 88
    SolutionNameMin: Cijk_Alik_Bljk_BBH_MT128x96x64_MI32x32x4x1_SE_1LDSB1_AF0EM8_GRVW2_GSU1_LBSPP128_LPA4_LPB4_PLR17_SU32_SUS256_SRVW4_TT1_96_WG128_2_1_WGM2
    SolutionIndex: 89
    SolutionNameMin: Cijk_Alik_Bljk_BBH_MT128x64x64_MI32x32x4x1_SE_1LDSB1_AF0EM8_GRVW8_GSU1_LBSPP128_LPA8_LPB8_PLR17_SU0_SUS256_SRVW4_TT2_32_WG64_4_1_WGM15
    SolutionIndex: 90
    SolutionNameMin: Cijk_Alik_Bljk_BBH_MT128x144x32_MI16x16x8x1_SE_1LDSB1_AF0EM8_GRVW2_GSU1_LBSPP128_LPA4_LPB4_PLR5_SU0_SUS256_SRVW4_TT2_144_WG64_4_1_WGM2
    SolutionIndex: 91
    SolutionNameMin: Cijk_Alik_Bljk_BBH_MT64x128x32_MI32x32x4x1_SE_1LDSB1_AF0EM8_GRVW8_GSU1_LBSPP128_LPA8_LPB8_PLR9_SU32_SUS128_SRVW4_TT1_64_WG64_4_1_WGM1
    SolutionIndex: 92
    SolutionNameMin: Cijk_Alik_Bljk_BBH_MT128x128x32_MI32x32x4x1_SE_1LDSB1_AF0EM8_GRVW8_GSU1_LBSPP128_LPA8_LPB8_PLR9_SU32_SUS256_SRVW4_TT2_64_WG64_4_1_WGM15
    SolutionIndex: 93
    SolutionNameMin: Cijk_Alik_Bljk_BBH_MT144x128x32_MI16x16x8x1_SE_1LDSB1_AF0EM8_GRVW2_GSU1_LBSPP128_LPA4_LPB4_PLR5_SU0_SUS256_SRVW0_TT9_32_WG16_16_1_WGM1
    SolutionIndex: 94
    SolutionNameMin: Cijk_Alik_Bljk_BBH_MT128x128x32_MI32x32x4x1_SE_1LDSB1_AF0EM8_GRVW8_GSU1_LBSPP128_LPA8_LPB8_PLR9_SU0_SUS256_SRVW4_TT2_64_WG64_4_1_WGM1
    SolutionIndex: 95
    SolutionNameMin: Cijk_Alik_Bljk_BBH_MT128x64x32_MI32x32x4x1_SE_1LDSB1_AF0EM8_GRVW8_GSU1_LBSPP128_LPA8_LPB8_PLR9_SU0_SUS256_SRVW4_TT2_32_WG64_4_1_WGM1
    SolutionIndex: 96
    SolutionNameMin: Cijk_Alik_Bljk_BBH_MT128x64x64_MI32x32x4x1_SE_1LDSB1_AF0EM8_GRVW8_GSU1_LBSPP128_LPA8_LPB8_PLR17_SU0_SUS256_SRVW4_TT2_32_WG64_4_1_WGM2
    SolutionIndex: 97
    SolutionNameMin: Cijk_Alik_Bljk_BBH_MT128x160x32_MI32x32x4x1_SE_1LDSB1_AF0EM8_GRVW2_GSU1_LBSPP128_LPA4_LPB4_PLR9_SU32_SUS128_SRVW4_TT1_160_WG128_2_1_WGM2
    SolutionIndex: 98
    SolutionNameMin: Cijk_Alik_Bljk_BBH_MT64x128x32_MI32x32x4x1_SE_1LDSB1_AF0EM8_GRVW2_GSU1_LBSPP128_LPA4_LPB4_PLR9_SU0_SUS256_SRVW4_TT1_64_WG64_4_1_WGM15
    SolutionIndex: 99
    SolutionNameMin: Cijk_Alik_Bljk_BBH_MT128x128x32_MI32x32x4x1_SE_1LDSB1_AF0EM1_GRVW8_GSU1_LBSPP128_LPA8_LPB8_PLR9_SU32_SUS128_SRVW4_TT2_64_WG64_4_1_WGM15
    SolutionIndex: 100
    SolutionNameMin: Cijk_Alik_Bljk_BBH_MT32x32x64_MI16x16x8x1_SE_1LDSB0_AF0EM1_GRVW8_GSU15_LBSPP128_LPA8_LPB8_PLR9_SU0_SUS256_SRVW0_TT1_16_WG32_8_1_WGM1
    SolutionIndex: 101
    SolutionNameMin: Cijk_Alik_Bljk_BBH_MT128x160x32_MI32x32x4x1_SE_1LDSB1_AF0EM1_GRVW4_GSU1_LBSPP128_LPA4_LPB4_PLR9_SU32_SUS128_SRVW4_TT1_160_WG128_2_1_WGM2
    SolutionIndex: 102
    SolutionNameMin: Cijk_Alik_Bljk_BBH_MT128x160x32_MI32x32x4x1_SE_1LDSB1_AF0EM1_GRVW2_GSU1_LBSPP128_LPA4_LPB4_PLR9_SU0_SUS256_SRVW4_TT1_160_WG128_2_1_WGM15
    SolutionIndex: 103
    SolutionNameMin: Cijk_Alik_Bljk_BBH_MT128x64x64_MI32x32x4x1_SE_1LDSB1_AF0EM1_GRVW8_GSU1_LBSPP128_LPA8_LPB8_PLR17_SU32_SUS128_SRVW4_TT2_32_WG64_4_1_WGM15
    SolutionIndex: 104
    SolutionNameMin: Cijk_Alik_Bljk_BBH_MT32x32x64_MI16x16x8x1_SE_1LDSB0_AF0EM1_GRVW8_GSU7_LBSPP128_LPA8_LPB8_PLR9_SU0_SUS256_SRVW0_TT1_16_WG32_8_1_WGM1
    SolutionIndex: 105
    SolutionNameMin: Cijk_Alik_Bljk_BBH_MT128x144x32_MI16x16x8x1_SE_1LDSB1_AF0EM1_GRVW2_GSU1_LBSPP128_LPA4_LPB4_PLR5_SU0_SUS256_SRVW4_TT2_144_WG64_4_1_WGM15
    SolutionIndex: 106
    SolutionNameMin: Cijk_Alik_Bljk_BBH_MT128x96x32_MI32x32x4x1_SE_1LDSB1_AF0EM1_GRVW2_GSU1_LBSPP128_LPA4_LPB4_PLR9_SU32_SUS128_SRVW4_TT1_96_WG128_2_1_WGM15
    SolutionIndex: 107
    SolutionNameMin: Cijk_Alik_Bljk_BBH_MT128x96x64_MI32x32x4x1_SE_1LDSB1_AF0EM1_GRVW8_GSU1_LBSPP128_LPA8_LPB8_PLR17_SU32_SUS128_SRVW4_TT1_96_WG128_2_1_WGM15
    SolutionIndex: 108
    SolutionNameMin: Cijk_Alik_Bljk_BBH_MT64x128x64_MI32x32x4x1_SE_1LDSB1_AF0EM8_GRVW8_LBSPP128_LPA8_LPB8_PLR17_SU0_SUS256_SRVW4_TT1_64_WG64_4_1_WGM1
    SolutionIndex: 109
    SolutionNameMin: Cijk_Alik_Bljk_BBH_MT32x64x64_MI16x16x8x1_SE_1LDSB0_AF0EM8_GRVW8_LBSPP128_LPA8_LPB8_PLR9_SU32_SUS128_SRVW4_TT1_32_WG32_8_1_WGM1
    SolutionIndex: 110
    SolutionNameMin: Cijk_Alik_Bljk_BBH_MT128x128x32_MI32x32x4x1_SE_1LDSB1_AF0EM8_GRVW4_LBSPP128_LPA4_LPB4_PLR9_SU0_SUS256_SRVW4_TT2_64_WG64_4_1_WGM15
    SolutionIndex: 111
    SolutionNameMin: Cijk_Alik_Bljk_BBH_MT128x64x64_MI32x32x4x1_SE_1LDSB1_AF0EM8_GRVW8_LBSPP128_LPA8_LPB8_PLR17_SU0_SUS256_SRVW4_TT2_32_WG64_4_1_WGM2
    SolutionIndex: 112
    SolutionNameMin: Cijk_Alik_Bljk_BBH_MT32x32x64_MI16x16x8x1_SE_1LDSB0_AF0EM8_GRVW8_LBSPP128_LPA8_LPB8_PLR9_SU32_SUS128_SRVW4_TT1_16_WG32_8_1_WGM15
    SolutionIndex: 113
    SolutionNameMin: Cijk_Alik_Bljk_BBH_MT128x96x32_MI32x32x4x1_SE_1LDSB1_AF0EM8_GRVW4_LBSPP128_LPA4_LPB4_PLR9_SU0_SUS256_SRVW4_TT1_96_WG128_2_1_WGM2
    SolutionIndex: 114
    SolutionNameMin: Cijk_Alik_Bljk_BBH_MT64x64x64_MI32x32x4x1_SE_1LDSB1_AF0EM8_GRVW8_LBSPP128_LPA8_LPB8_PLR17_SU32_SUS128_SRVW4_TT1_32_WG64_4_1_WGM15
    SolutionIndex: 115
    SolutionNameMin: Cijk_Alik_Bljk_BBH_MT32x32x64_MI16x16x8x1_SE_1LDSB1_AF0EM8_GRVW4_LBSPP128_LPA4_LPB4_PLR9_SU32_SUS128_SRVW4_TT1_16_WG32_8_1_WGM15
    SolutionIndex: 116
    SolutionNameMin: Cijk_Alik_Bljk_BBH_MT64x64x32_MI32x32x4x1_SE_1LDSB1_AF0EM8_GRVW4_LBSPP128_LPA4_LPB4_PLR9_SU0_SUS256_SRVW4_TT1_32_WG64_4_1_WGM1
    SolutionIndex: 117
    SolutionNameMin: Cijk_Alik_Bljk_BBH_MT128x128x32_MI32x32x4x1_SE_1LDSB1_AF0EM8_GRVW8_LBSPP128_LPA8_LPB8_PLR9_SU0_SUS256_SRVW4_TT2_64_WG64_4_1_WGM15
    SolutionIndex: 118
    SolutionNameMin: Cijk_Alik_Bljk_BBH_MT32x32x64_MI16x16x8x1_SE_1LDSB1_AF0EM8_GRVW8_LBSPP128_LPA8_LPB8_PLR9_SU0_SUS256_SRVW0_TT1_16_WG32_8_1_WGM2
    SolutionIndex: 119
    SolutionNameMin: Cijk_Alik_Bljk_BBH_MT144x128x32_MI16x16x8x1_SE_1LDSB1_AF0EM8_GRVW2_LBSPP128_LPA4_LPB4_PLR5_SU0_SUS256_SRVW0_TT9_32_WG16_16_1_WGM1
    SolutionIndex: 120
    SolutionNameMin: Cijk_Alik_Bljk_BBH_MT64x64x32_MI32x32x4x1_SE_1LDSB1_AF0EM8_GRVW8_LBSPP128_LPA8_LPB8_PLR9_SU0_SUS256_SRVW4_TT1_32_WG64_4_1_WGM1
    SolutionIndex: 121
    SolutionNameMin: Cijk_Alik_Bljk_BBH_MT64x128x32_MI32x32x4x1_SE_1LDSB1_AF0EM8_GRVW8_LBSPP128_LPA8_LPB8_PLR9_SU0_SUS256_SRVW4_TT1_64_WG64_4_1_WGM2
    SolutionIndex: 122
    SolutionNameMin: Cijk_Alik_Bljk_BBH_MT16x16x128_MI16x16x8x1_SE_1LDSB1_AF0EM8_GRVW8_LBSPP256_LPA8_LPB8_PLR17_SU0_SUS256_SRVW0_TT1_16_WG16_4_1_WGM1
    SolutionIndex: 123
    SolutionNameMin: Cijk_Alik_Bljk_BBH_MT64x32x64_MI16x16x8x1_SE_1LDSB1_AF0EM8_GRVW8_LBSPP128_LPA8_LPB8_PLR9_SU32_SUS128_SRVW4_TT2_16_WG32_8_1_WGM15
    SolutionIndex: 124
    SolutionNameMin: Cijk_Alik_Bljk_BBH_MT96x128x64_MI32x32x4x1_SE_1LDSB1_AF0EM8_GRVW2_LBSPP128_LPA4_LPB4_PLR17_SU0_SUS256_SRVW0_TT3_32_WG32_8_1_WGM1
    SolutionIndex: 125
    SolutionNameMin: Cijk_Alik_Bljk_BBH_MT128x64x64_MI32x32x4x1_SE_1LDSB1_AF0EM8_GRVW8_LBSPP128_LPA8_LPB8_PLR17_SU0_SUS256_SRVW4_TT2_32_WG64_4_1_WGM15
    SolutionIndex: 126
    SolutionNameMin: Cijk_Alik_Bljk_BBH_MT64x64x64_MI32x32x4x1_SE_1LDSB1_AF0EM8_GRVW4_LBSPP128_LPA4_LPB4_PLR17_SU0_SUS256_SRVW4_TT1_32_WG64_4_1_WGM15
    SolutionIndex: 127
    SolutionNameMin: Cijk_Alik_Bljk_BBH_MT128x96x64_MI32x32x4x1_SE_1LDSB1_AF0EM8_GRVW2_LBSPP128_LPA4_LPB4_PLR17_SU0_SUS256_SRVW4_TT1_96_WG128_2_1_WGM15
    SolutionIndex: 128
    SolutionNameMin: Cijk_Alik_Bljk_BBH_MT128x128x32_MI32x32x4x1_SE_1LDSB1_AF0EM8_GRVW2_LBSPP128_LPA4_LPB4_PLR9_SU32_SUS128_SRVW4_TT2_64_WG64_4_1_WGM1
    SolutionIndex: 129
    SolutionNameMin: Cijk_Alik_Bljk_BBH_MT32x32x64_MI16x16x8x1_SE_1LDSB0_AF0EM8_GRVW8_LBSPP128_LPA8_LPB8_PLR9_SU0_SUS256_SRVW0_TT1_16_WG32_8_1_WGM2
    SolutionIndex: 130
    SolutionNameMin: Cijk_Alik_Bljk_BBH_MT64x64x64_MI32x32x4x1_SE_1LDSB1_AF0EM8_GRVW8_LBSPP128_LPA8_LPB8_PLR17_SU32_SUS128_SRVW4_TT1_32_WG64_4_1_WGM1
    SolutionIndex: 131
    SolutionNameMin: Cijk_Alik_Bljk_BBH_MT128x144x32_MI16x16x8x1_SE_1LDSB1_AF0EM8_GRVW2_LBSPP128_LPA4_LPB4_PLR5_SU0_SUS256_SRVW4_TT2_144_WG64_4_1_WGM15
    SolutionIndex: 132
    SolutionNameMin: Cijk_Alik_Bljk_BBH_MT128x144x32_MI16x16x8x1_SE_1LDSB0_AF0EM8_GRVW2_LBSPP128_LPA4_LPB4_PLR5_SU0_SUS256_SRVW4_TT2_144_WG64_4_1_WGM15
    SolutionIndex: 133
    SolutionNameMin: Cijk_Alik_Bljk_BBH_MT64x64x64_MI32x32x4x1_SE_1LDSB1_AF0EM8_GRVW8_LBSPP128_LPA8_LPB8_PLR17_SU0_SUS256_SRVW4_TT1_32_WG64_4_1_WGM15
    SolutionIndex: 134
    SolutionNameMin: Cijk_Alik_Bljk_BBH_MT64x64x32_MI32x32x4x1_SE_1LDSB1_AF0EM8_GRVW4_LBSPP128_LPA4_LPB4_PLR9_SU0_SUS256_SRVW4_TT1_32_WG64_4_1_WGM2
    SolutionIndex: 135
    SolutionNameMin: Cijk_Alik_Bljk_BBH_MT64x64x64_MI32x32x4x1_SE_1LDSB1_AF0EM8_GRVW8_LBSPP128_LPA8_LPB8_PLR17_SU32_SUS128_SRVW4_TT1_32_WG64_4_1_WGM2
    SolutionIndex: 136
    SolutionNameMin: Cijk_Alik_Bljk_BBH_MT128x128x32_MI32x32x4x1_SE_1LDSB1_AF0EM8_GRVW4_LBSPP128_LPA4_LPB4_PLR9_SU32_SUS256_SRVW4_TT2_64_WG64_4_1_WGM1
    SolutionIndex: 137
    SolutionNameMin: Cijk_Alik_Bljk_BBH_MT32x32x64_MI16x16x8x1_SE_1LDSB0_AF0EM8_GRVW8_LBSPP128_LPA8_LPB8_PLR9_SU32_SUS256_SRVW0_TT1_16_WG32_8_1_WGM2
    SolutionIndex: 138
    SolutionNameMin: Cijk_Alik_Bljk_BBH_MT64x128x64_MI32x32x4x1_SE_1LDSB1_AF0EM8_GRVW8_LBSPP128_LPA8_LPB8_PLR17_SU0_SUS256_SRVW4_TT1_64_WG64_4_1_WGM15
    SolutionIndex: 139
    SolutionNameMin: Cijk_Alik_Bljk_BBH_MT64x128x32_MI32x32x4x1_SE_1LDSB1_AF0EM8_GRVW8_LBSPP128_LPA8_LPB8_PLR9_SU0_SUS256_SRVW4_TT1_64_WG64_4_1_WGM15
    SolutionIndex: 140
    SolutionNameMin: Cijk_Alik_Bljk_BBH_MT128x128x32_MI32x32x4x1_SE_1LDSB1_AF0EM8_GRVW8_LBSPP128_LPA8_LPB8_PLR9_SU32_SUS256_SRVW4_TT2_64_WG64_4_1_WGM1
    SolutionIndex: 141
    SolutionNameMin: Cijk_Alik_Bljk_BBH_MT32x32x64_MI16x16x8x1_SE_1LDSB0_AF0EM8_GRVW2_LBSPP128_LPA4_LPB4_PLR9_SU0_SUS256_SRVW0_TT1_16_WG32_8_1_WGM15
    SolutionIndex: 142
    SolutionNameMin: Cijk_Alik_Bljk_BBH_MT96x96x32_MI16x16x8x1_SE_1LDSB1_AF0EM8_GRVW2_LBSPP128_LPA4_LPB4_PLR5_SU0_SUS256_SRVW0_TT3_48_WG32_8_1_WGM15
    SolutionIndex: 143
    SolutionNameMin: Cijk_Alik_Bljk_BBH_MT96x96x64_MI16x16x8x1_SE_1LDSB1_AF0EM8_GRVW2_LBSPP128_LPA4_LPB4_PLR9_SU32_SUS128_SRVW0_TT3_48_WG32_8_1_WGM1
    SolutionIndex: 144
    SolutionNameMin: Cijk_Alik_Bljk_BBH_MT32x32x64_MI16x16x8x1_SE_1LDSB1_AF0EM8_GRVW8_LBSPP128_LPA8_LPB8_PLR9_SU32_SUS256_SRVW0_TT1_16_WG32_8_1_WGM2
    SolutionIndex: 145
    SolutionNameMin: Cijk_Alik_Bljk_BBH_MT64x64x32_MI32x32x4x1_SE_1LDSB1_AF0EM8_GRVW2_LBSPP128_LPA4_LPB4_PLR9_SU0_SUS256_SRVW4_TT1_32_WG64_4_1_WGM1
    SolutionIndex: 146
    SolutionNameMin: Cijk_Alik_Bljk_BBH_MT64x128x64_MI32x32x4x1_SE_1LDSB1_AF0EM8_GRVW8_LBSPP128_LPA8_LPB8_PLR17_SU32_SUS256_SRVW4_TT1_64_WG64_4_1_WGM15
    SolutionIndex: 147
    SolutionNameMin: Cijk_Alik_Bljk_BBH_MT64x128x64_MI32x32x4x1_SE_1LDSB1_AF0EM8_GRVW8_LBSPP128_LPA8_LPB8_PLR17_SU0_SUS256_SRVW4_TT1_64_WG64_4_1_WGM2
    SolutionIndex: 148
    SolutionNameMin: Cijk_Alik_Bljk_BBH_MT128x64x32_MI32x32x4x1_SE_1LDSB1_AF0EM8_GRVW8_LBSPP128_LPA8_LPB8_PLR9_SU0_SUS256_SRVW4_TT2_32_WG64_4_1_WGM15
    SolutionIndex: 149
    SolutionNameMin: Cijk_Alik_Bljk_BBH_MT128x128x32_MI32x32x4x1_SE_1LDSB1_AF0EM8_GRVW4_LBSPP128_LPA4_LPB4_PLR9_SU0_SUS256_SRVW4_TT2_64_WG64_4_1_WGM1
    SolutionIndex: 150
    SolutionNameMin: Cijk_Alik_Bljk_BBH_MT128x160x32_MI32x32x4x1_SE_1LDSB1_AF0EM8_GRVW2_LBSPP128_LPA4_LPB4_PLR9_SU0_SUS256_SRVW4_TT1_160_WG128_2_1_WGM1
    SolutionIndex: 151
    SolutionNameMin: Cijk_Alik_Bljk_BBH_MT16x16x64_MI16x16x8x1_SE_1LDSB1_AF0EM8_GRVW2_LBSPP128_LPA4_LPB4_PLR9_SU0_SUS256_SRVW0_TT1_16_WG16_4_1_WGM15
    SolutionIndex: 152
    SolutionNameMin: Cijk_Alik_Bljk_BBH_MT64x64x64_MI32x32x4x1_SE_1LDSB1_AF0EM8_GRVW4_LBSPP128_LPA4_LPB4_PLR17_SU32_SUS256_SRVW4_TT1_32_WG64_4_1_WGM1
    SolutionIndex: 153
    SolutionNameMin: Cijk_Alik_Bljk_BBH_MT64x64x64_MI32x32x4x1_SE_1LDSB1_AF0EM8_GRVW8_LBSPP128_LPA8_LPB8_PLR17_SU0_SUS256_SRVW4_TT1_32_WG64_4_1_WGM1
    SolutionIndex: 154
    SolutionNameMin: Cijk_Alik_Bljk_BBH_MT128x96x64_MI32x32x4x1_SE_1LDSB1_AF0EM8_GRVW2_LBSPP128_LPA4_LPB4_PLR17_SU0_SUS256_SRVW4_TT1_96_WG128_2_1_WGM2
    SolutionIndex: 155
    SolutionNameMin: Cijk_Alik_Bljk_BBH_MT128x64x32_MI32x32x4x1_SE_1LDSB1_AF0EM8_GRVW8_LBSPP128_LPA8_LPB8_PLR9_SU32_SUS128_SRVW4_TT2_32_WG64_4_1_WGM2
    SolutionIndex: 156
    SolutionNameMin: Cijk_Alik_Bljk_BBH_MT128x160x32_MI32x32x4x1_SE_1LDSB1_AF0EM8_GRVW2_LBSPP128_LPA4_LPB4_PLR9_SU0_SUS256_SRVW4_TT1_160_WG128_2_1_WGM2
    SolutionIndex: 157
    SolutionNameMin: Cijk_Alik_Bljk_BBH_MT128x160x32_MI32x32x4x1_SE_1LDSB1_AF0EM8_GRVW2_LBSPP128_LPA4_LPB4_PLR9_SU32_SUS128_SRVW4_TT1_160_WG128_2_1_WGM2
    SolutionIndex: 158
    SolutionNameMin: Cijk_Alik_Bljk_BBH_MT128x128x32_MI32x32x4x1_SE_1LDSB1_AF0EM8_GRVW8_LBSPP128_LPA8_LPB8_PLR9_SU0_SUS256_SRVW4_TT2_64_WG64_4_1_WGM2
    SolutionIndex: 159
    SolutionNameMin: Cijk_Alik_Bljk_BBH_MT32x32x64_MI16x16x8x1_SE_1LDSB1_AF0EM8_GRVW2_LBSPP128_LPA4_LPB4_PLR9_SU32_SUS128_SRVW4_TT1_16_WG32_8_1_WGM2
    SolutionIndex: 160
    SolutionNameMin: Cijk_Alik_Bljk_BBH_MT32x64x32_MI16x16x8x1_SE_1LDSB1_AF0EM8_GRVW4_LBSPP128_LPA4_LPB4_PLR5_SU0_SUS256_SRVW4_TT1_32_WG32_8_1_WGM1
    SolutionIndex: 161
    SolutionNameMin: Cijk_Alik_Bljk_BBH_MT64x32x64_MI16x16x8x1_SE_1LDSB1_AF0EM8_GRVW2_LBSPP128_LPA4_LPB4_PLR9_SU0_SUS256_SRVW4_TT2_16_WG32_8_1_WGM1
    SolutionIndex: 162
    SolutionNameMin: Cijk_Alik_Bljk_BBH_MT64x32x64_MI16x16x8x1_SE_1LDSB0_AF0EM8_GRVW4_LBSPP128_LPA4_LPB4_PLR9_SU32_SUS256_SRVW4_TT2_16_WG32_8_1_WGM1
    SolutionIndex: 163
    SolutionNameMin: Cijk_Alik_Bljk_BBH_MT32x32x64_MI16x16x8x1_SE_1LDSB1_AF0EM8_GRVW2_LBSPP128_LPA4_LPB4_PLR9_SU0_SUS256_SRVW4_TT1_16_WG32_8_1_WGM1
    SolutionIndex: 164
    SolutionNameMin: Cijk_Alik_Bljk_BBH_MT64x64x32_MI32x32x4x1_SE_1LDSB1_AF0EM8_GRVW4_LBSPP128_LPA4_LPB4_PLR9_SU32_SUS256_SRVW4_TT1_32_WG64_4_1_WGM15
    SolutionIndex: 165
    SolutionNameMin: Cijk_Alik_Bljk_BBH_MT32x32x64_MI16x16x8x1_SE_1LDSB1_AF0EM8_GRVW8_LBSPP128_LPA8_LPB8_PLR9_SU0_SUS256_SRVW0_TT1_16_WG32_8_1_WGM1
    SolutionIndex: 166
    SolutionNameMin: Cijk_Alik_Bljk_BBH_MT64x128x32_MI32x32x4x1_SE_1LDSB0_AF0EM8_GRVW8_LBSPP128_LPA8_LPB8_PLR9_SU32_SUS128_SRVW4_TT1_64_WG64_4_1_WGM15
    SolutionIndex: 167
    SolutionNameMin: Cijk_Alik_Bljk_BBH_MT32x32x64_MI16x16x8x1_SE_1LDSB1_AF0EM8_GRVW8_LBSPP128_LPA8_LPB8_PLR9_SU32_SUS256_SRVW0_TT1_16_WG32_8_1_WGM1
    SolutionIndex: 168
    SolutionNameMin: Cijk_Alik_Bljk_BBH_MT64x128x32_MI32x32x4x1_SE_1LDSB0_AF0EM8_GRVW8_LBSPP128_LPA8_LPB8_PLR9_SU0_SUS256_SRVW4_TT1_64_WG64_4_1_WGM15
    SolutionIndex: 169
    SolutionNameMin: Cijk_Alik_Bljk_BBH_MT32x32x64_MI16x16x8x1_SE_1LDSB0_AF0EM8_GRVW8_LBSPP128_LPA8_LPB8_PLR9_SU32_SUS128_SRVW0_TT1_16_WG32_8_1_WGM15
    SolutionIndex: 170
    SolutionNameMin: Cijk_Alik_Bljk_BBH_MT64x64x32_MI32x32x4x1_SE_1LDSB1_AF0EM8_GRVW8_LBSPP128_LPA8_LPB8_PLR9_SU0_SUS256_SRVW4_TT1_32_WG64_4_1_WGM15
    SolutionIndex: 171
    SolutionNameMin: Cijk_Alik_Bljk_BBH_MT128x64x64_MI32x32x4x1_SE_1LDSB0_AF0EM8_GRVW8_LBSPP128_LPA8_LPB8_PLR17_SU32_SUS128_SRVW4_TT2_32_WG64_4_1_WGM15
    SolutionIndex: 172
    SolutionNameMin: Cijk_Alik_Bljk_BBH_MT64x128x64_MI32x32x4x1_SE_1LDSB0_AF0EM8_GRVW2_LBSPP128_LPA4_LPB4_PLR17_SU0_SUS256_SRVW4_TT1_64_WG64_4_1_WGM15
    SolutionIndex: 173
    SolutionNameMin: Cijk_Alik_Bljk_BBH_MT128x128x64_MI32x32x4x1_SE_1LDSB1_AF0EM8_GRVW2_LBSPP128_LPA4_LPB4_PLR17_SU0_SUS256_SRVW4_TT2_64_WG64_4_1_WGM2
    SolutionIndex: 174
    SolutionNameMin: Cijk_Alik_Bljk_BBH_MT128x128x32_MI32x32x4x1_SE_1LDSB0_AF0EM8_GRVW8_LBSPP128_LPA8_LPB8_PLR9_SU0_SUS256_SRVW4_TT2_64_WG64_4_1_WGM15
    SolutionIndex: 175
    SolutionNameMin: Cijk_Alik_Bljk_BBH_MT128x144x32_MI16x16x8x1_SE_1LDSB0_AF0EM8_GRVW2_LBSPP128_LPA4_LPB4_PLR5_SU0_SUS256_SRVW4_TT2_144_WG64_4_1_WGM2
    SolutionIndex: 176
    SolutionNameMin: Cijk_Alik_Bljk_BBH_MT128x160x32_MI32x32x4x1_SE_1LDSB1_AF0EM8_GRVW2_LBSPP128_LPA4_LPB4_PLR9_SU0_SUS256_SRVW4_TT1_160_WG128_2_1_WGM15
    SolutionIndex: 177
    SolutionNameMin: Cijk_Alik_Bljk_BBH_MT64x128x64_MI32x32x4x1_SE_1LDSB1_AF0EM8_GRVW4_LBSPP128_LPA4_LPB4_PLR17_SU0_SUS256_SRVW4_TT1_64_WG64_4_1_WGM15
    SolutionIndex: 178
    SolutionNameMin: Cijk_Alik_Bljk_BBH_MT128x64x64_MI32x32x4x1_SE_1LDSB1_AF0EM8_GRVW8_LBSPP128_LPA8_LPB8_PLR17_SU32_SUS256_SRVW4_TT2_32_WG64_4_1_WGM15
    SolutionIndex: 179
    SolutionNameMin: Cijk_Alik_Bljk_BBH_MT32x32x64_MI16x16x8x1_SE_1LDSB1_AF0EM8_GRVW4_LBSPP128_LPA4_LPB4_PLR9_SU32_SUS256_SRVW0_TT1_16_WG32_8_1_WGM15
    SolutionIndex: 180
    SolutionNameMin: Cijk_Alik_Bljk_BBH_MT64x32x64_MI16x16x8x1_SE_1LDSB0_AF0EM8_GRVW8_LBSPP128_LPA8_LPB8_PLR9_SU0_SUS256_SRVW4_TT2_16_WG32_8_1_WGM1
    SolutionIndex: 181
    SolutionNameMin: Cijk_Alik_Bljk_BBH_MT128x64x64_MI32x32x4x1_SE_1LDSB0_AF0EM8_GRVW8_LBSPP128_LPA8_LPB8_PLR17_SU0_SUS256_SRVW4_TT2_32_WG64_4_1_WGM15
    SolutionIndex: 182
    SolutionNameMin: Cijk_Alik_Bljk_BBH_MT128x96x32_MI32x32x4x1_SE_1LDSB1_AF0EM8_GRVW2_LBSPP128_LPA4_LPB4_PLR9_SU32_SUS128_SRVW4_TT1_96_WG128_2_1_WGM2
    SolutionIndex: 183
    SolutionNameMin: Cijk_Alik_Bljk_BBH_MT128x96x64_MI32x32x4x1_SE_1LDSB1_AF0EM8_GRVW4_LBSPP128_LPA4_LPB4_PLR17_SU32_SUS128_SRVW4_TT1_96_WG128_2_1_WGM1
    SolutionIndex: 184
    SolutionNameMin: Cijk_Alik_Bljk_BBH_MT64x32x64_MI16x16x8x1_SE_1LDSB1_AF0EM8_GRVW4_LBSPP128_LPA4_LPB4_PLR9_SU32_SUS128_SRVW4_TT2_16_WG32_8_1_WGM15
    SolutionIndex: 185
    SolutionNameMin: Cijk_Alik_Bljk_BBH_MT32x32x64_MI16x16x8x1_SE_1LDSB1_AF0EM8_GRVW4_LBSPP128_LPA4_LPB4_PLR9_SU0_SUS256_SRVW4_TT1_16_WG32_8_1_WGM15
    SolutionIndex: 186
    SolutionNameMin: Cijk_Alik_Bljk_BBH_MT64x32x64_MI16x16x8x1_SE_1LDSB0_AF0EM8_GRVW2_LBSPP128_LPA4_LPB4_PLR9_SU0_SUS256_SRVW4_TT2_16_WG32_8_1_WGM15
    SolutionIndex: 187
    SolutionNameMin: Cijk_Alik_Bljk_BBH_MT64x32x64_MI16x16x8x1_SE_1LDSB0_AF0EM8_GRVW4_LBSPP128_LPA4_LPB4_PLR9_SU32_SUS256_SRVW4_TT2_16_WG32_8_1_WGM15
    SolutionIndex: 188
    SolutionNameMin: Cijk_Alik_Bljk_BBH_MT64x64x64_MI32x32x4x1_SE_1LDSB1_AF0EM8_GRVW8_LBSPP128_LPA8_LPB8_PLR17_SU0_SUS256_SRVW4_TT1_32_WG64_4_1_WGM2
    SolutionIndex: 189
    SolutionNameMin: Cijk_Alik_Bljk_BBH_MT64x64x64_MI32x32x4x1_SE_1LDSB1_AF0EM8_GRVW8_LBSPP128_LPA8_LPB8_PLR17_SU32_SUS256_SRVW4_TT1_32_WG64_4_1_WGM2
    SolutionIndex: 190
    SolutionNameMin: Cijk_Alik_Bljk_BBH_MT32x64x32_MI16x16x8x1_SE_1LDSB1_AF0EM8_GRVW2_LBSPP128_LPA4_LPB4_PLR5_SU0_SUS256_SRVW4_TT1_32_WG32_8_1_WGM15
    SolutionIndex: 191
    SolutionNameMin: Cijk_Alik_Bljk_BBH_MT128x64x32_MI32x32x4x1_SE_1LDSB0_AF0EM8_GRVW4_LBSPP128_LPA4_LPB4_PLR9_SU0_SUS256_SRVW4_TT2_32_WG64_4_1_WGM15
    SolutionIndex: 192
    SolutionNameMin: Cijk_Alik_Bljk_BBH_MT256x64x64_MI32x32x4x1_SE_1LDSB1_AF0EM8_GRVW2_LBSPP128_LPA4_LPB4_PLR17_SU0_SUS256_SRVW4_TT4_32_WG64_4_1_WGM15
    SolutionIndex: 193
    SolutionNameMin: Cijk_Alik_Bljk_BBH_MT96x96x32_MI16x16x8x1_SE_1LDSB0_AF0EM8_GRVW2_LBSPP128_LPA4_LPB4_PLR5_SU32_SUS256_SRVW0_TT3_48_WG32_8_1_WGM1
    SolutionIndex: 194
    SolutionNameMin: Cijk_Alik_Bljk_BBH_MT64x128x32_MI32x32x4x1_SE_1LDSB1_AF0EM8_GRVW8_LBSPP128_LPA8_LPB8_PLR9_SU32_SUS256_SRVW4_TT1_64_WG64_4_1_WGM1
    SolutionIndex: 195
    SolutionNameMin: Cijk_Alik_Bljk_BBH_MT64x128x32_MI32x32x4x1_SE_1LDSB1_AF0EM8_GRVW8_LBSPP128_LPA8_LPB8_PLR9_SU32_SUS128_SRVW4_TT1_64_WG64_4_1_WGM1
    SolutionIndex: 196
    SolutionNameMin: Cijk_Alik_Bljk_BBH_MT144x128x32_MI16x16x8x1_SE_1LDSB0_AF0EM8_GRVW2_LBSPP128_LPA4_LPB4_PLR5_SU0_SUS256_SRVW0_TT9_32_WG16_16_1_WGM2
    SolutionIndex: 197
    SolutionNameMin: Cijk_Alik_Bljk_BBH_MT144x128x32_MI16x16x8x1_SE_1LDSB0_AF0EM8_GRVW2_LBSPP128_LPA4_LPB4_PLR5_SU0_SUS256_SRVW0_TT9_32_WG16_16_1_WGM15
    SolutionIndex: 198
    SolutionNameMin: Cijk_Alik_Bljk_BBH_MT32x32x64_MI16x16x8x1_SE_1LDSB1_AF0EM8_GRVW8_LBSPP128_LPA8_LPB8_PLR9_SU32_SUS256_SRVW0_TT1_16_WG32_8_1_WGM1
    SolutionIndex: 199
    SolutionNameMin: Cijk_Alik_Bljk_BBH_MT16x16x128_MI16x16x8x1_SE_1LDSB1_AF0EM1_GRVW8_LBSPP256_LPA8_LPB8_PLR17_SU0_SUS256_SRVW0_TT1_16_WG16_4_1_WGM1
    SolutionIndex: 200
    SolutionNameMin: Cijk_Alik_Bljk_BBH_MT128x128x32_MI32x32x4x1_SE_1LDSB1_AF0EM8_GRVW8_LBSPP128_LPA8_LPB8_PLR9_SU32_SUS128_SRVW4_TT2_64_WG64_4_1_WGM1
    SolutionIndex: 201
    SolutionNameMin: Cijk_Alik_Bljk_BBH_MT64x128x32_MI32x32x4x1_SE_1LDSB1_AF0EM8_GRVW2_LBSPP128_LPA4_LPB4_PLR9_SU32_SUS128_SRVW4_TT1_64_WG64_4_1_WGM1
    SolutionIndex: 202
    SolutionNameMin: Cijk_Alik_Bljk_BBH_MT64x64x64_MI32x32x4x1_SE_1LDSB1_AF0EM8_GRVW8_LBSPP128_LPA8_LPB8_PLR17_SU32_SUS256_SRVW4_TT1_32_WG64_4_1_WGM15
    SolutionIndex: 203
    SolutionNameMin: Cijk_Alik_Bljk_BBH_MT96x96x64_MI16x16x8x1_SE_1LDSB1_AF0EM8_GRVW2_LBSPP128_LPA4_LPB4_PLR9_SU0_SUS256_SRVW0_TT3_48_WG32_8_1_WGM15
    SolutionIndex: 204
    SolutionNameMin: Cijk_Alik_Bljk_BBH_MT16x16x128_MI16x16x8x1_SE_1LDSB0_AF0EM1_GRVW8_LBSPP256_LPA8_LPB8_PLR17_SU32_SUS256_SRVW0_TT1_16_WG16_4_1_WGM1
    SolutionIndex: 205
    SolutionNameMin: Cijk_Alik_Bljk_BBH_MT96x96x64_MI16x16x8x1_SE_1LDSB1_AF0EM8_GRVW8_LBSPP128_LPA8_LPB8_PLR9_SU32_SUS256_SRVW0_TT3_48_WG32_8_1_WGM1
    SolutionIndex: 206
    SolutionNameMin: Cijk_Alik_Bljk_BBH_MT64x128x64_MI32x32x4x1_SE_1LDSB1_AF0EM8_GRVW8_LBSPP128_LPA8_LPB8_PLR17_SU32_SUS256_SRVW4_TT1_64_WG64_4_1_WGM2
    SolutionIndex: 207
    SolutionNameMin: Cijk_Alik_Bljk_BBH_MT64x128x64_MI32x32x4x1_SE_1LDSB1_AF0EM8_GRVW8_LBSPP128_LPA8_LPB8_PLR17_SU32_SUS128_SRVW4_TT1_64_WG64_4_1_WGM1
    SolutionIndex: 208
    SolutionNameMin: Cijk_Alik_Bljk_BBH_MT64x128x64_MI32x32x4x1_SE_1LDSB1_AF0EM8_GRVW8_LBSPP128_LPA8_LPB8_PLR17_SU32_SUS256_SRVW4_TT1_64_WG64_4_1_WGM1
    SolutionIndex: 209
    SolutionNameMin: Cijk_Alik_Bljk_BBH_MT32x32x64_MI16x16x8x1_SE_1LDSB1_AF0EM8_GRVW4_LBSPP128_LPA4_LPB4_PLR9_SU0_SUS256_SRVW0_TT1_16_WG32_8_1_WGM15
    SolutionIndex: 210
    SolutionNameMin: Cijk_Alik_Bljk_BBH_MT64x64x64_MI32x32x4x1_SE_1LDSB1_AF0EM8_GRVW4_LBSPP128_LPA4_LPB4_PLR17_SU32_SUS256_SRVW4_TT1_32_WG64_4_1_WGM2
    SolutionIndex: 211
    SolutionNameMin: Cijk_Alik_Bljk_BBH_MT64x64x32_MI32x32x4x1_SE_1LDSB1_AF0EM8_GRVW8_LBSPP128_LPA8_LPB8_PLR9_SU32_SUS128_SRVW4_TT1_32_WG64_4_1_WGM15
    SolutionIndex: 212
    SolutionNameMin: Cijk_Alik_Bljk_BBH_MT64x64x32_MI32x32x4x1_SE_1LDSB1_AF0EM8_GRVW8_LBSPP128_LPA8_LPB8_PLR9_SU32_SUS256_SRVW4_TT1_32_WG64_4_1_WGM15
    SolutionIndex: 213
    SolutionNameMin: Cijk_Alik_Bljk_BBH_MT128x96x32_MI32x32x4x1_SE_1LDSB0_AF0EM8_GRVW2_LBSPP128_LPA4_LPB4_PLR9_SU32_SUS128_SRVW4_TT1_96_WG128_2_1_WGM15
    SolutionIndex: 214
    SolutionNameMin: Cijk_Alik_Bljk_BBH_MT128x64x64_MI32x32x4x1_SE_1LDSB1_AF0EM8_GRVW4_LBSPP128_LPA4_LPB4_PLR17_SU32_SUS128_SRVW4_TT2_32_WG64_4_1_WGM2
    SolutionIndex: 215
    SolutionNameMin: Cijk_Alik_Bljk_BBH_MT64x64x32_MI32x32x4x1_SE_1LDSB0_AF0EM8_GRVW8_LBSPP128_LPA8_LPB8_PLR9_SU32_SUS256_SRVW4_TT1_32_WG64_4_1_WGM15
    SolutionIndex: 216
    SolutionNameMin: Cijk_Alik_Bljk_BBH_MT64x64x64_MI32x32x4x1_SE_1LDSB0_AF0EM8_GRVW8_LBSPP128_LPA8_LPB8_PLR17_SU32_SUS128_SRVW4_TT1_32_WG64_4_1_WGM15
    SolutionIndex: 217
    SolutionNameMin: Cijk_Alik_Bljk_BBH_MT128x96x32_MI32x32x4x1_SE_1LDSB1_AF0EM8_GRVW2_LBSPP128_LPA4_LPB4_PLR9_SU0_SUS256_SRVW4_TT1_96_WG128_2_1_WGM1
    SolutionIndex: 218
    SolutionNameMin: Cijk_Alik_Bljk_BBH_MT64x128x64_MI32x32x4x1_SE_1LDSB0_AF0EM8_GRVW8_LBSPP128_LPA8_LPB8_PLR17_SU32_SUS128_SRVW4_TT1_64_WG64_4_1_WGM2
    SolutionIndex: 219
    SolutionNameMin: Cijk_Alik_Bljk_BBH_MT32x32x64_MI16x16x8x1_SE_1LDSB1_AF0EM8_GRVW2_LBSPP128_LPA4_LPB4_PLR9_SU32_SUS128_SRVW4_TT1_16_WG32_8_1_WGM1
    SolutionIndex: 220
    SolutionNameMin: Cijk_Alik_Bljk_BBH_MT128x64x64_MI32x32x4x1_SE_1LDSB1_AF0EM8_GRVW8_LBSPP128_LPA8_LPB8_PLR17_SU32_SUS128_SRVW4_TT2_32_WG64_4_1_WGM15
    SolutionIndex: 221
    SolutionNameMin: Cijk_Alik_Bljk_BBH_MT32x64x64_MI16x16x8x1_SE_1LDSB1_AF0EM8_GRVW8_LBSPP128_LPA8_LPB8_PLR9_SU32_SUS256_SRVW4_TT1_32_WG32_8_1_WGM2
    SolutionIndex: 222
    SolutionNameMin: Cijk_Alik_Bljk_BBH_MT16x16x128_MI16x16x8x1_SE_1LDSB0_AF0EM8_GRVW8_LBSPP256_LPA8_LPB8_PLR17_SU0_SUS256_SRVW0_TT1_16_WG16_4_1_WGM2
    SolutionIndex: 223
    SolutionNameMin: Cijk_Alik_Bljk_BBH_MT16x16x128_MI16x16x8x1_SE_1LDSB1_AF0EM8_GRVW8_LBSPP256_LPA8_LPB8_PLR17_SU0_SUS256_SRVW0_TT1_16_WG16_4_1_WGM15
    SolutionIndex: 224
    SolutionNameMin: Cijk_Alik_Bljk_BBH_MT128x128x32_MI32x32x4x1_SE_1LDSB1_AF0EM8_GRVW2_LBSPP128_LPA4_LPB4_PLR9_SU0_SUS256_SRVW4_TT2_64_WG64_4_1_WGM15
    SolutionIndex: 225
    SolutionNameMin: Cijk_Alik_Bljk_BBH_MT64x64x32_MI32x32x4x1_SE_1LDSB1_AF0EM8_GRVW2_LBSPP128_LPA4_LPB4_PLR9_SU32_SUS256_SRVW4_TT1_32_WG64_4_1_WGM15
    SolutionIndex: 226
    SolutionNameMin: Cijk_Alik_Bljk_BBH_MT128x96x32_MI32x32x4x1_SE_1LDSB1_AF0EM8_GRVW4_LBSPP128_LPA4_LPB4_PLR9_SU32_SUS128_SRVW4_TT1_96_WG128_2_1_WGM15
    SolutionIndex: 227
    SolutionNameMin: Cijk_Alik_Bljk_BBH_MT128x128x32_MI32x32x4x1_SE_1LDSB1_AF0EM8_GRVW8_LBSPP128_LPA8_LPB8_PLR9_SU32_SUS256_SRVW4_TT2_64_WG64_4_1_WGM15
    SolutionIndex: 228
    SolutionNameMin: Cijk_Alik_Bljk_BBH_MT64x64x64_MI32x32x4x1_SE_1LDSB0_AF0EM8_GRVW8_LBSPP128_LPA8_LPB8_PLR17_SU32_SUS256_SRVW4_TT1_32_WG64_4_1_WGM15
    SolutionIndex: 229
    SolutionNameMin: Cijk_Alik_Bljk_BBH_MT64x32x32_MI16x16x8x1_SE_1LDSB0_AF0EM8_GRVW8_LBSPP128_LPA8_LPB8_PLR5_SU32_SUS128_SRVW4_TT2_16_WG32_8_1_WGM15
    SolutionIndex: 230
    SolutionNameMin: Cijk_Alik_Bljk_BBH_MT16x16x64_MI16x16x8x1_SE_1LDSB1_AF0EM8_GRVW8_LBSPP128_LPA8_LPB8_PLR9_SU0_SUS256_SRVW0_TT1_16_WG16_4_1_WGM1
    SolutionIndex: 231
    SolutionNameMin: Cijk_Alik_Bljk_BBH_MT16x16x128_MI16x16x8x1_SE_1LDSB0_AF0EM8_GRVW8_LBSPP256_LPA8_LPB8_PLR17_SU0_SUS256_SRVW0_TT1_16_WG16_4_1_WGM1
    SolutionIndex: 232
    SolutionNameMin: Cijk_Alik_Bljk_BBH_MT128x64x32_MI32x32x4x1_SE_1LDSB1_AF0EM8_GRVW8_LBSPP128_LPA8_LPB8_PLR9_SU32_SUS128_SRVW4_TT2_32_WG64_4_1_WGM15
    SolutionIndex: 233
    SolutionNameMin: Cijk_Alik_Bljk_BBH_MT32x32x64_MI16x16x8x1_SE_1LDSB0_AF0EM8_GRVW8_LBSPP128_LPA8_LPB8_PLR9_SU32_SUS128_SRVW4_TT1_16_WG32_8_1_WGM2
    SolutionIndex: 234
    SolutionNameMin: Cijk_Alik_Bljk_BBH_MT64x64x64_MI32x32x4x1_SE_1LDSB1_AF0EM8_GRVW4_LBSPP128_LPA4_LPB4_PLR17_SU0_SUS256_SRVW4_TT1_32_WG64_4_1_WGM2
    SolutionIndex: 235
    SolutionNameMin: Cijk_Alik_Bljk_BBH_MT64x64x64_MI32x32x4x1_SE_1LDSB1_AF0EM8_GRVW4_LBSPP128_LPA4_LPB4_PLR17_SU0_SUS256_SRVW4_TT1_32_WG64_4_1_WGM1
    SolutionIndex: 236
    SolutionNameMin: Cijk_Alik_Bljk_BBH_MT64x64x32_MI32x32x4x1_SE_1LDSB1_AF0EM8_GRVW4_LBSPP128_LPA4_LPB4_PLR9_SU32_SUS256_SRVW4_TT1_32_WG64_4_1_WGM1
    SolutionIndex: 237
    SolutionNameMin: Cijk_Alik_Bljk_BBH_MT256x160x32_MI32x32x4x1_SE_1LDSB1_AF0EM8_GRVW2_LBSPP128_LPA4_LPB4_PLR9_SU32_SUS256_SRVW4_TT2_160_WG128_2_1_WGM15
    SolutionIndex: 238
    SolutionNameMin: Cijk_Alik_Bljk_BBH_MT128x96x32_MI32x32x4x1_SE_1LDSB1_AF0EM8_GRVW2_LBSPP128_LPA4_LPB4_PLR9_SU32_SUS128_SRVW4_TT1_96_WG128_2_1_WGM15
    SolutionIndex: 239
    SolutionNameMin: Cijk_Alik_Bljk_BBH_MT32x32x64_MI16x16x8x1_SE_1LDSB1_AF0EM8_GRVW4_LBSPP128_LPA4_LPB4_PLR9_SU0_SUS256_SRVW4_TT1_16_WG32_8_1_WGM1
    SolutionIndex: 240
    SolutionNameMin: Cijk_Alik_Bljk_BBH_MT64x64x32_MI32x32x4x1_SE_1LDSB1_AF0EM8_GRVW2_LBSPP128_LPA4_LPB4_PLR9_SU32_SUS128_SRVW4_TT1_32_WG64_4_1_WGM15
    SolutionIndex: 241
    SolutionNameMin: Cijk_Alik_Bljk_BBH_MT32x32x32_MI16x16x8x1_SE_1LDSB0_AF0EM8_GRVW4_LBSPP128_LPA4_LPB4_PLR5_SU0_SUS256_SRVW4_TT1_16_WG32_8_1_WGM15
    SolutionIndex: 242
    SolutionNameMin: Cijk_Alik_Bljk_BBH_MT32x64x32_MI16x16x8x1_SE_1LDSB0_AF0EM8_GRVW2_LBSPP128_LPA4_LPB4_PLR5_SU0_SUS256_SRVW4_TT1_32_WG32_8_1_WGM15
    SolutionIndex: 243
    SolutionNameMin: Cijk_Alik_Bljk_BBH_MT32x32x64_MI16x16x8x1_SE_1LDSB0_AF0EM8_GRVW2_LBSPP128_LPA4_LPB4_PLR9_SU32_SUS256_SRVW4_TT1_16_WG32_8_1_WGM2
    SolutionIndex: 244
    SolutionNameMin: Cijk_Alik_Bljk_BBH_MT32x32x64_MI16x16x8x1_SE_1LDSB0_AF0EM8_GRVW2_LBSPP128_LPA4_LPB4_PLR9_SU0_SUS256_SRVW0_TT1_16_WG32_8_1_WGM1
    SolutionIndex: 245
    SolutionNameMin: Cijk_Alik_Bljk_BBH_MT64x64x32_MI32x32x4x1_SE_1LDSB1_AF0EM8_GRVW2_LBSPP128_LPA4_LPB4_PLR9_SU0_SUS256_SRVW4_TT1_32_WG64_4_1_WGM15
    SolutionIndex: 246
    SolutionNameMin: Cijk_Alik_Bljk_BBH_MT32x64x32_MI16x16x8x1_SE_1LDSB1_AF0EM8_GRVW2_LBSPP128_LPA4_LPB4_PLR5_SU32_SUS256_SRVW4_TT1_32_WG32_8_1_WGM15
    SolutionIndex: 247
    SolutionNameMin: Cijk_Alik_Bljk_BBH_MT32x32x32_MI16x16x8x1_SE_1LDSB0_AF0EM8_GRVW4_LBSPP128_LPA4_LPB4_PLR5_SU0_SUS256_SRVW4_TT1_16_WG32_8_1_WGM1
    SolutionIndex: 248
    SolutionNameMin: Cijk_Alik_Bljk_BBH_MT32x64x64_MI16x16x8x1_SE_1LDSB1_AF0EM8_GRVW8_LBSPP128_LPA8_LPB8_PLR9_SU0_SUS256_SRVW0_TT1_32_WG32_8_1_WGM2
    SolutionIndex: 249
    SolutionNameMin: Cijk_Alik_Bljk_BBH_MT32x32x64_MI16x16x8x1_SE_1LDSB0_AF0EM8_GRVW2_LBSPP128_LPA4_LPB4_PLR9_SU0_SUS256_SRVW4_TT1_16_WG32_8_1_WGM1
    SolutionIndex: 250
    SolutionNameMin: Cijk_Alik_Bljk_BBH_MT32x32x64_MI16x16x8x1_SE_1LDSB0_AF0EM8_GRVW8_LBSPP128_LPA8_LPB8_PLR9_SU32_SUS256_SRVW0_TT1_16_WG32_8_1_WGM15
    SolutionIndex: 251
    SolutionNameMin: Cijk_Alik_Bljk_BBH_MT64x32x32_MI16x16x8x1_SE_1LDSB1_AF0EM8_GRVW4_LBSPP128_LPA4_LPB4_PLR5_SU0_SUS256_SRVW4_TT2_16_WG32_8_1_WGM1
    SolutionIndex: 252
    SolutionNameMin: Cijk_Alik_Bljk_BBH_MT32x32x64_MI16x16x8x1_SE_1LDSB0_AF0EM8_GRVW2_LBSPP128_LPA4_LPB4_PLR9_SU32_SUS128_SRVW4_TT1_16_WG32_8_1_WGM2
    SolutionIndex: 253
    SolutionNameMin: Cijk_Alik_Bljk_BBH_MT32x32x64_MI16x16x8x1_SE_1LDSB0_AF0EM8_GRVW8_LBSPP128_LPA8_LPB8_PLR9_SU32_SUS256_SRVW0_TT1_16_WG32_8_1_WGM2
    SolutionIndex: 254
    SolutionNameMin: Cijk_Alik_Bljk_BBH_MT128x64x64_MI32x32x4x1_SE_1LDSB0_AF0EM8_GRVW2_LBSPP128_LPA4_LPB4_PLR17_SU32_SUS256_SRVW0_TT2_32_WG64_4_1_WGM1
    SolutionIndex: 255
    SolutionNameMin: Cijk_Alik_Bljk_BBH_MT128x128x64_MI32x32x4x1_SE_1LDSB1_AF0EM8_GRVW2_LBSPP128_LPA4_LPB4_PLR17_SU0_SUS256_SRVW0_TT2_64_WG64_4_1_WGM1
    SolutionIndex: 256
    SolutionNameMin: Cijk_Alik_Bljk_BBH_MT64x128x64_MI32x32x4x1_SE_1LDSB1_AF0EM8_GRVW4_LBSPP128_LPA4_LPB4_PLR17_SU0_SUS256_SRVW0_TT1_64_WG64_4_1_WGM15
    SolutionIndex: 257
    SolutionNameMin: Cijk_Alik_Bljk_BBH_MT64x128x64_MI32x32x4x1_SE_1LDSB1_AF0EM8_GRVW4_LBSPP128_LPA4_LPB4_PLR17_SU0_SUS256_SRVW0_TT1_64_WG64_4_1_WGM1
    SolutionIndex: 258
    SolutionNameMin: Cijk_Alik_Bljk_BBH_MT128x128x64_MI32x32x4x1_SE_1LDSB1_AF0EM8_GRVW2_LBSPP128_LPA4_LPB4_PLR17_SU32_SUS256_SRVW4_TT2_64_WG64_4_1_WGM2
    SolutionIndex: 259
    SolutionNameMin: Cijk_Alik_Bljk_BBH_MT128x64x64_MI32x32x4x1_SE_1LDSB1_AF0EM8_GRVW8_LBSPP128_LPA8_LPB8_PLR17_SU0_SUS256_SRVW4_TT2_32_WG64_4_1_WGM1
    SolutionIndex: 260
    SolutionNameMin: Cijk_Alik_Bljk_BBH_MT64x64x64_MI32x32x4x1_SE_1LDSB1_AF0EM8_GRVW4_LBSPP128_LPA4_LPB4_PLR17_SU32_SUS128_SRVW4_TT1_32_WG64_4_1_WGM1
    SolutionIndex: 261
    SolutionNameMin: Cijk_Alik_Bljk_BBH_MT128x128x64_MI32x32x4x1_SE_1LDSB1_AF0EM8_GRVW2_LBSPP128_LPA4_LPB4_PLR17_SU0_SUS256_SRVW0_TT2_64_WG64_4_1_WGM1
    SolutionIndex: 262
    SolutionNameMin: Cijk_Alik_Bljk_BBH_MT128x64x64_MI32x32x4x1_SE_1LDSB1_AF0EM8_GRVW8_LBSPP128_LPA8_LPB8_PLR17_SU32_SUS128_SRVW4_TT2_32_WG64_4_1_WGM2
    SolutionIndex: 263
    SolutionNameMin: Cijk_Alik_Bljk_BBH_MT128x64x64_MI32x32x4x1_SE_1LDSB1_AF0EM8_GRVW8_LBSPP128_LPA8_LPB8_PLR17_SU32_SUS128_SRVW0_TT2_32_WG64_4_1_WGM1
    SolutionIndex: 264
    SolutionNameMin: Cijk_Alik_Bljk_BBH_MT64x128x64_MI32x32x4x1_SE_1LDSB0_AF0EM8_GRVW2_LBSPP128_LPA4_LPB4_PLR17_SU32_SUS256_SRVW0_TT1_64_WG64_4_1_WGM15
    SolutionIndex: 265
    SolutionNameMin: Cijk_Alik_Bljk_BBH_MT128x64x64_MI32x32x4x1_SE_1LDSB1_AF0EM8_GRVW8_LBSPP128_LPA8_LPB8_PLR17_SU32_SUS256_SRVW0_TT2_32_WG64_4_1_WGM15
    SolutionIndex: 266
    SolutionNameMin: Cijk_Alik_Bljk_BBH_MT64x128x64_MI32x32x4x1_SE_1LDSB1_AF0EM8_GRVW8_LBSPP128_LPA8_LPB8_PLR17_SU32_SUS128_SRVW4_TT1_64_WG64_4_1_WGM15
    SolutionIndex: 267
    SolutionNameMin: Cijk_Alik_Bljk_BBH_MT64x64x64_MI32x32x4x1_SE_1LDSB1_AF0EM8_GRVW4_LBSPP128_LPA4_LPB4_PLR17_SU32_SUS128_SRVW4_TT1_32_WG64_4_1_WGM15
    SolutionIndex: 268
    SolutionNameMin: Cijk_Alik_Bljk_BBH_MT64x64x64_MI32x32x4x1_SE_1LDSB1_AF0EM8_GRVW2_LBSPP128_LPA4_LPB4_PLR17_SU32_SUS256_SRVW0_TT1_32_WG64_4_1_WGM2
    SolutionIndex: 269
    SolutionNameMin: Cijk_Alik_Bljk_BBH_MT64x64x64_MI32x32x4x1_SE_1LDSB1_AF0EM8_GRVW2_LBSPP128_LPA4_LPB4_PLR17_SU32_SUS256_SRVW0_TT1_32_WG64_4_1_WGM2
    SolutionIndex: 270
    SolutionNameMin: Cijk_Alik_Bljk_BBH_MT64x64x64_MI32x32x4x1_SE_1LDSB1_AF0EM8_GRVW2_LBSPP128_LPA4_LPB4_PLR17_SU0_SUS256_SRVW0_TT1_32_WG64_4_1_WGM1
    SolutionIndex: 271
    SolutionNameMin: Cijk_Alik_Bljk_BBH_MT64x128x32_MI32x32x4x1_SE_1LDSB0_AF0EM8_GRVW8_LBSPP128_LPA8_LPB8_PLR9_SU32_SUS256_SRVW4_TT1_64_WG64_4_1_WGM1
    SolutionIndex: 272
    SolutionNameMin: Cijk_Alik_Bljk_BBH_MT16x16x128_MI16x16x8x1_SE_1LDSB1_AF0EM1_GRVW8_LBSPP256_LPA8_LPB8_PLR17_SU0_SUS256_SRVW0_TT1_16_WG16_4_1_WGM15
    SolutionIndex: 273
    SolutionNameMin: Cijk_Alik_Bljk_BBH_MT128x96x32_MI32x32x4x1_SE_1LDSB1_AF0EM8_GRVW4_LBSPP128_LPA4_LPB4_PLR9_SU0_SUS256_SRVW4_TT1_96_WG128_2_1_WGM1
    SolutionIndex: 274
    SolutionNameMin: Cijk_Alik_Bljk_BBH_MT32x32x64_MI16x16x8x1_SE_1LDSB1_AF0EM8_GRVW8_LBSPP128_LPA8_LPB8_PLR9_SU0_SUS256_SRVW0_TT1_16_WG32_8_1_WGM1
    SolutionIndex: 275
    SolutionNameMin: Cijk_Alik_Bljk_BBH_MT128x96x64_MI32x32x4x1_SE_1LDSB1_AF0EM8_GRVW2_LBSPP128_LPA4_LPB4_PLR17_SU32_SUS256_SRVW4_TT1_96_WG128_2_1_WGM1
    SolutionIndex: 276
    SolutionNameMin: Cijk_Alik_Bljk_BBH_MT32x32x64_MI16x16x8x1_SE_1LDSB1_AF0EM8_GRVW4_LBSPP128_LPA4_LPB4_PLR9_SU0_SUS256_SRVW0_TT1_16_WG32_8_1_WGM2
    SolutionIndex: 277
    SolutionNameMin: Cijk_Alik_Bljk_BBH_MT96x128x64_MI32x32x4x1_SE_1LDSB1_AF0EM8_GRVW2_LBSPP128_LPA4_LPB4_PLR17_SU0_SUS256_SRVW0_TT3_32_WG32_8_1_WGM15
    SolutionIndex: 278
    SolutionNameMin: Cijk_Alik_Bljk_BBH_MT32x32x32_MI16x16x8x1_SE_1LDSB0_AF0EM1_GRVW2_LBSPP128_LPA4_LPB4_PLR5_SU0_SUS256_SRVW4_TT1_16_WG32_8_1_WGM1
    SolutionIndex: 279
    SolutionNameMin: Cijk_Alik_Bljk_BBH_MT32x32x64_MI16x16x8x1_SE_1LDSB0_AF0EM1_GRVW4_LBSPP128_LPA4_LPB4_PLR9_SU0_SUS256_SRVW0_TT1_16_WG32_8_1_WGM1
    SolutionIndex: 280
    SolutionNameMin: Cijk_Alik_Bljk_BBH_MT128x96x32_MI32x32x4x1_SE_1LDSB0_AF0EM1_GRVW2_LBSPP128_LPA4_LPB4_PLR9_SU32_SUS128_SRVW4_TT1_96_WG128_2_1_WGM1
    SolutionIndex: 281
    SolutionNameMin: Cijk_Alik_Bljk_BBH_MT128x64x32_MI32x32x4x1_SE_1LDSB1_AF0EM1_GRVW8_LBSPP128_LPA8_LPB8_PLR9_SU32_SUS128_SRVW4_TT2_32_WG64_4_1_WGM15
    SolutionIndex: 282
    SolutionNameMin: Cijk_Alik_Bljk_BBH_MT32x32x64_MI16x16x8x1_SE_1LDSB1_AF0EM1_GRVW8_LBSPP128_LPA8_LPB8_PLR9_SU0_SUS256_SRVW0_TT1_16_WG32_8_1_WGM2
    SolutionIndex: 283
    SolutionNameMin: Cijk_Alik_Bljk_BBH_MT32x32x64_MI16x16x8x1_SE_1LDSB0_AF0EM1_GRVW2_LBSPP128_LPA4_LPB4_PLR9_SU0_SUS256_SRVW4_TT1_16_WG32_8_1_WGM1
    SolutionIndex: 284
    SolutionNameMin: Cijk_Alik_Bljk_BBH_MT32x32x64_MI16x16x8x1_SE_1LDSB1_AF0EM1_GRVW8_LBSPP128_LPA8_LPB8_PLR9_SU0_SUS256_SRVW0_TT1_16_WG32_8_1_WGM1
    SolutionIndex: 285
    SolutionNameMin: Cijk_Alik_Bljk_BBH_MT128x160x32_MI32x32x4x1_SE_1LDSB1_AF0EM1_GRVW2_LBSPP128_LPA4_LPB4_PLR9_SU0_SUS256_SRVW4_TT1_160_WG128_2_1_WGM2
    SolutionIndex: 286
    SolutionNameMin: Cijk_Alik_Bljk_BBH_MT32x32x64_MI16x16x8x1_SE_1LDSB1_AF0EM1_GRVW2_LBSPP128_LPA4_LPB4_PLR9_SU0_SUS256_SRVW0_TT1_16_WG32_8_1_WGM1
    SolutionIndex: 287
    SolutionNameMin: Cijk_Alik_Bljk_BBH_MT32x32x64_MI16x16x8x1_SE_1LDSB0_AF0EM1_GRVW2_LBSPP128_LPA4_LPB4_PLR9_SU0_SUS256_SRVW0_TT1_16_WG32_8_1_WGM1
    SolutionIndex: 288
    SolutionNameMin: Cijk_Alik_Bljk_BBH_MT16x16x64_MI16x16x8x1_SE_1LDSB1_AF0EM1_GRVW8_LBSPP128_LPA8_LPB8_PLR9_SU0_SUS256_SRVW0_TT1_16_WG16_4_1_WGM1
    SolutionIndex: 289
    SolutionNameMin: Cijk_Alik_Bljk_BBH_MT16x16x64_MI16x16x8x1_SE_1LDSB1_AF0EM1_GRVW4_LBSPP128_LPA4_LPB4_PLR9_SU32_SUS128_SRVW0_TT1_16_WG16_4_1_WGM15
    SolutionIndex: 290
    SolutionNameMin: Cijk_Alik_Bljk_BBH_MT16x16x64_MI16x16x8x1_SE_1LDSB1_AF0EM1_GRVW8_LBSPP128_LPA8_LPB8_PLR9_SU0_SUS256_SRVW0_TT1_16_WG16_4_1_WGM15
    SolutionIndex: 291
    SolutionNameMin: Cijk_Alik_Bljk_BBH_MT16x16x64_MI16x16x8x1_SE_1LDSB1_AF0EM1_GRVW4_LBSPP128_LPA4_LPB4_PLR9_SU32_SUS256_SRVW4_TT1_16_WG16_4_1_WGM1
    SolutionIndex: 292
    SolutionNameMin: Cijk_Alik_Bljk_BBH_MT16x16x64_MI16x16x8x1_SE_1LDSB1_AF0EM1_GRVW8_LBSPP128_LPA8_LPB8_PLR9_SU32_SUS256_SRVW0_TT1_16_WG16_4_1_WGM1
    SolutionIndex: 293
    SolutionNameMin: Cijk_Alik_Bljk_BBH_MT32x32x64_MI16x16x8x1_SE_1LDSB1_AF0EM1_GRVW4_LBSPP128_LPA4_LPB4_PLR9_SU0_SUS256_SRVW4_TT1_16_WG32_8_1_WGM1
    SolutionIndex: 294
    SolutionNameMin: Cijk_Alik_Bljk_BBH_MT32x32x64_MI16x16x8x1_SE_1LDSB1_AF0EM1_GRVW8_LBSPP128_LPA8_LPB8_PLR9_SU0_SUS256_SRVW4_TT1_16_WG32_8_1_WGM1
    SolutionIndex: 295
    SolutionNameMin: Cijk_Alik_Bljk_BBH_MT32x32x64_MI16x16x8x1_SE_1LDSB1_AF0EM1_GRVW8_LBSPP128_LPA8_LPB8_PLR9_SU32_SUS256_SRVW4_TT1_16_WG32_8_1_WGM1
    SolutionIndex: 296
    SolutionNameMin: Cijk_Alik_Bljk_BBH_MT32x32x64_MI16x16x8x1_SE_1LDSB1_AF0EM1_GRVW8_LBSPP128_LPA8_LPB8_PLR9_SU32_SUS128_SRVW4_TT1_16_WG32_8_1_WGM1
    SolutionIndex: 297
    SolutionNameMin: Cijk_Alik_Bljk_BBH_MT32x64x32_MI16x16x8x1_SE_1LDSB1_AF0EM1_GRVW4_LBSPP128_LPA4_LPB4_PLR5_SU0_SUS256_SRVW4_TT1_32_WG32_8_1_WGM2
    SolutionIndex: 298
    SolutionNameMin: Cijk_Alik_Bljk_BBH_MT32x64x32_MI16x16x8x1_SE_1LDSB1_AF0EM1_GRVW4_LBSPP128_LPA4_LPB4_PLR5_SU32_SUS256_SRVW4_TT1_32_WG32_8_1_WGM2
    SolutionIndex: 299
    SolutionNameMin: Cijk_Alik_Bljk_BBH_MT32x64x32_MI16x16x8x1_SE_1LDSB1_AF0EM1_GRVW2_LBSPP128_LPA4_LPB4_PLR5_SU0_SUS256_SRVW4_TT1_32_WG32_8_1_WGM1
    SolutionIndex: 300
    SolutionNameMin: Cijk_Alik_Bljk_BBH_MT64x32x32_MI16x16x8x1_SE_1LDSB1_AF0EM1_GRVW4_LBSPP128_LPA4_LPB4_PLR5_SU0_SUS256_SRVW4_TT2_16_WG32_8_1_WGM1
    SolutionIndex: 301
    SolutionNameMin: Cijk_Alik_Bljk_BBH_MT64x64x32_MI32x32x4x1_SE_1LDSB1_AF0EM1_GRVW2_LBSPP128_LPA4_LPB4_PLR9_SU0_SUS256_SRVW4_TT1_32_WG64_4_1_WGM1
    SolutionIndex: 302
    SolutionNameMin: Cijk_Alik_Bljk_BBH_MT32x32x32_MI16x16x8x1_SE_1LDSB0_AF0EM1_GRVW4_LBSPP128_LPA4_LPB4_PLR5_SU32_SUS256_SRVW4_TT1_16_WG32_8_1_WGM1
    SolutionIndex: 303
    SolutionNameMin: Cijk_Alik_Bljk_BBH_MT16x16x64_MI16x16x8x1_SE_1LDSB0_AF0EM1_GRVW8_LBSPP128_LPA8_LPB8_PLR9_SU32_SUS256_SRVW0_TT1_16_WG16_4_1_WGM1
    SolutionIndex: 304
    SolutionNameMin: Cijk_Alik_Bljk_BBH_MT16x16x64_MI16x16x8x1_SE_1LDSB1_AF0EM1_GRVW2_LBSPP128_LPA4_LPB4_PLR9_SU0_SUS256_SRVW0_TT1_16_WG16_4_1_WGM1
    SolutionIndex: 305
    SolutionNameMin: Cijk_Alik_Bljk_BBH_MT16x16x64_MI16x16x8x1_SE_1LDSB0_AF0EM1_GRVW2_LBSPP128_LPA4_LPB4_PLR9_SU0_SUS256_SRVW0_TT1_16_WG16_4_1_WGM1
    SolutionIndex: 306
    SolutionNameMin: Cijk_Alik_Bljk_BBH_MT32x32x64_MI16x16x8x1_SE_1LDSB1_AF0EM1_GRVW2_LBSPP128_LPA4_LPB4_PLR9_SU32_SUS128_SRVW4_TT1_16_WG32_8_1_WGM1
    SolutionIndex: 307
    SolutionNameMin: Cijk_Alik_Bljk_BBH_MT64x128x64_MI32x32x4x1_SE_1LDSB1_AF0EM1_GRVW8_LBSPP128_LPA8_LPB8_PLR17_SU32_SUS256_SRVW4_TT1_64_WG64_4_1_WGM2
    SolutionIndex: 308
    SolutionNameMin: Cijk_Alik_Bljk_BBH_MT32x32x64_MI16x16x8x1_SE_1LDSB0_AF0EM1_GRVW8_LBSPP128_LPA8_LPB8_PLR9_SU0_SUS256_SRVW0_TT1_16_WG32_8_1_WGM1
    SolutionIndex: 309
    SolutionNameMin: Cijk_Alik_Bljk_BBH_MT32x32x64_MI16x16x8x1_SE_1LDSB0_AF0EM1_GRVW8_LBSPP128_LPA8_LPB8_PLR9_SU0_SUS256_SRVW0_TT1_16_WG32_8_1_WGM1
    SolutionIndex: 310
    SolutionNameMin: Cijk_Alik_Bljk_BBH_MT64x32x64_MI16x16x8x1_SE_1LDSB0_AF0EM1_GRVW8_LBSPP128_LPA8_LPB8_PLR9_SU32_SUS128_SRVW0_TT2_16_WG32_8_1_WGM15
    SolutionIndex: 311
    SolutionNameMin: Cijk_Alik_Bljk_BBH_MT32x32x64_MI16x16x8x1_SE_1LDSB0_AF0EM1_GRVW4_LBSPP128_LPA4_LPB4_PLR9_SU0_SUS256_SRVW0_TT1_16_WG32_8_1_WGM1
    SolutionIndex: 312
    SolutionNameMin: Cijk_Alik_Bljk_BBH_MT16x16x64_MI16x16x8x1_SE_1LDSB0_AF0EM1_GRVW8_LBSPP128_LPA8_LPB8_PLR9_SU0_SUS256_SRVW0_TT1_16_WG16_4_1_WGM1
    SolutionIndex: 313
    SolutionNameMin: Cijk_Alik_Bljk_BBH_MT32x32x64_MI16x16x8x1_SE_1LDSB1_AF0EM1_GRVW4_LBSPP128_LPA4_LPB4_PLR9_SU0_SUS256_SRVW4_TT1_16_WG32_8_1_WGM2
    SolutionIndex: 314
    SolutionNameMin: Cijk_Alik_Bljk_BBH_MT32x32x64_MI16x16x8x1_SE_1LDSB0_AF0EM1_GRVW8_LBSPP128_LPA8_LPB8_PLR9_SU32_SUS256_SRVW0_TT1_16_WG32_8_1_WGM1
    SolutionIndex: 315
    SolutionNameMin: Cijk_Alik_Bljk_BBH_MT32x32x64_MI16x16x8x1_SE_1LDSB0_AF0EM1_GRVW8_LBSPP128_LPA8_LPB8_PLR9_SU0_SUS256_SRVW0_TT1_16_WG32_8_1_WGM15
    SolutionIndex: 316
    SolutionNameMin: Cijk_Alik_Bljk_BBH_MT16x16x128_MI16x16x8x1_SE_1LDSB0_AF0EM1_GRVW8_LBSPP256_LPA8_LPB8_PLR17_SU0_SUS256_SRVW0_TT1_16_WG16_4_1_WGM1
    SolutionIndex: 317
    SolutionNameMin: Cijk_Alik_Bljk_BBH_MT16x16x128_MI16x16x8x1_SE_1LDSB1_AF0EM1_GRVW8_LBSPP256_LPA8_LPB8_PLR17_SU32_SUS256_SRVW0_TT1_16_WG16_4_1_WGM2
    SolutionIndex: 318
    SolutionNameMin: Cijk_Alik_Bljk_BBH_MT16x16x128_MI16x16x8x1_SE_1LDSB1_AF0EM1_GRVW8_LBSPP256_LPA8_LPB8_PLR17_SU0_SUS256_SRVW4_TT1_16_WG16_4_1_WGM1
    SolutionIndex: 319
    SolutionNameMin: Cijk_Alik_Bljk_BBH_MT128x128x64_MI32x32x4x2_SE_1LDSB1_EPS1_GRVW8_PGR1_PLR17_SU0_SUS256_SRVW4_TT2_32_WG64_4_1_WGM2
    SolutionIndex: 320
    SolutionNameMin: Cijk_Alik_Bljk_BBH_MT128x128x32_MI32x32x4x2_SE_1LDSB0_EPS0_GRVW8_PGR0_PLR9_SU16_SUS128_SRVW0_TT2_32_WG64_4_1_WGM15
    SolutionIndex: 321
    SolutionNameMin: Cijk_Alik_Bljk_BBH_MT64x128x64_MI32x32x4x2_SE_1LDSB0_EPS0_GRVW8_PGR0_PLR17_SU0_SUS128_SRVW4_TT1_32_WG64_4_1_WGM15
    SolutionIndex: 322
    SolutionNameMin: Cijk_Alik_Bljk_BBH_MT128x256x64_MI32x32x4x2_SE_1LDSB1_EPS1_GRVW8_PGR1_PLR17_SU0_SUS256_SRVW4_TT2_64_WG64_4_1_WGM15
- - - [1024, 512, 1, 1025]
    - [0, 1.147]
  - - [8192, 8193, 1, 8192]
    - [2, 3.275]
  - - [8192, 8192, 1, 8193]
    - [2, 3.467]
  - - [4096, 4096, 1, 4097]
    - [0, 3.106]
  - - [1025, 1024, 1, 1024]
    - [1, 1.61]
  - - [8192, 8191, 1, 8192]
    - [2, 3.302]
  - - [2048, 513, 1, 2048]
    - [1, 1.636]
  - - [1024, 1024, 1, 1025]
    - [1, 1.594]
  - - [3072, 511, 1, 3072]
    - [0, 2.386]
  - - [2049, 512, 1, 2048]
    - [1, 1.627]
  - - [4096, 4095, 1, 4096]
    - [0, 3.063]
  - - [513, 512, 1, 512]
    - [3, 0.664]
  - - [1024, 511, 1, 1024]
    - [0, 1.152]
  - - [1023, 512, 1, 1024]
    - [0, 1.153]
  - - [1024, 513, 1, 1024]
    - [0, 1.164]
  - - [4096, 4097, 1, 4096]
    - [0, 3.051]
  - - [2048, 2047, 1, 2048]
    - [0, 2.645]
  - - [8193, 8192, 1, 8192]
    - [2, 3.304]
  - - [1024, 1023, 1, 1024]
    - [1, 1.605]
  - - [4096, 4096, 1, 4095]
    - [2, 3.094]
  - - [1025, 512, 1, 1024]
    - [0, 1.165]
  - - [1024, 512, 1, 1023]
    - [0, 1.153]
  - - [512, 512, 1, 513]
    - [3, 0.653]
  - - [1024, 1025, 1, 1024]
    - [1, 1.6]
  - - [512, 512, 1, 511]
    - [3, 0.666]
  - - [2047, 2048, 1, 2048]
    - [0, 2.645]
  - - [2049, 2048, 1, 2048]
    - [0, 2.646]
  - - [2048, 511, 1, 2048]
    - [1, 1.594]
  - - [2048, 2049, 1, 2048]
    - [0, 2.644]
  - - [2048, 512, 1, 2047]
    - [1, 1.623]
  - - [2047, 512, 1, 2048]
    - [1, 1.622]
  - - [3072, 513, 1, 3072]
    - [0, 2.38]
  - - [512, 511, 1, 512]
    - [3, 0.678]
  - - [4097, 4096, 1, 4096]
    - [0, 3.061]
  - - [2048, 2048, 1, 2047]
    - [0, 2.631]
  - - [2048, 2048, 1, 2049]
    - [0, 2.666]
  - - [8191, 8192, 1, 8192]
    - [2, 3.304]
  - - [512, 513, 1, 512]
    - [3, 0.687]
  - - [8192, 8192, 1, 8191]
    - [2, 3.469]
  - - [1024, 1024, 1, 1023]
    - [1, 1.613]
  - - [511, 512, 1, 512]
    - [3, 0.675]
  - - [4095, 4096, 1, 4096]
    - [0, 3.063]
  - - [2048, 512, 1, 2049]
    - [1, 1.64]
  - - [1023, 1024, 1, 1024]
    - [1, 1.605]
  - - [512, 512, 1, 512]
    - [115, 22.837]
  - - [1024, 1024, 1, 1024]
    - [114, 55.981]
  - - [2048, 2048, 1, 2048]
    - [113, 87.807]
  - - [4096, 4096, 1, 4096]
    - [69, 94.552]
  - - [8192, 8192, 1, 8192]
    - [68, 97.009]
  - - [479, 1024, 1, 1024]
    - [5, 1.499]
  - - [479, 2048, 1, 2048]
    - [5, 2.3]
  - - [480, 1023, 1, 1024]
    - [5, 1.503]
  - - [480, 1024, 1, 1023]
    - [5, 1.524]
  - - [480, 1024, 1, 1025]
    - [5, 1.528]
  - - [480, 1025, 1, 1024]
    - [4, 1.26]
  - - [480, 2047, 1, 2048]
    - [5, 2.302]
  - - [480, 2048, 1, 2047]
    - [5, 2.306]
  - - [480, 2048, 1, 2049]
    - [5, 2.31]
  - - [480, 2049, 1, 2048]
    - [5, 1.812]
  - - [481, 1024, 1, 1024]
    - [4, 1.225]
  - - [481, 2048, 1, 2048]
    - [5, 1.775]
  - - [511, 480, 1, 512]
    - [6, 0.75]
  - - [512, 479, 1, 512]
    - [6, 0.747]
  - - [512, 480, 1, 511]
    - [6, 0.755]
  - - [512, 480, 1, 513]
    - [6, 0.752]
  - - [512, 481, 1, 512]
    - [6, 0.727]
  - - [513, 480, 1, 512]
    - [6, 0.71]
  - - [1023, 480, 1, 1024]
    - [6, 1.419]
  - - [1024, 479, 1, 1024]
    - [6, 1.413]
  - - [1024, 480, 1, 1023]
    - [6, 1.408]
  - - [1024, 480, 1, 1025]
    - [6, 1.41]
  - - [1024, 481, 1, 1024]
    - [4, 1.252]
  - - [1025, 480, 1, 1024]
    - [4, 1.257]
  - - [2047, 480, 1, 2048]
    - [7, 2.319]
  - - [2048, 479, 1, 2048]
    - [7, 2.315]
  - - [2048, 480, 1, 2047]
    - [7, 2.279]
  - - [2048, 480, 1, 2049]
    - [7, 2.276]
  - - [2048, 481, 1, 2048]
    - [5, 1.789]
  - - [2049, 480, 1, 2048]
    - [5, 1.785]
  - - [480, 1024, 1, 1024]
    - [36, 41.869]
  - - [480, 2048, 1, 2048]
    - [37, 65.081]
  - - [512, 480, 1, 512]
    - [112, 23.318]
  - - [1024, 480, 1, 1024]
    - [38, 45.291]
  - - [2048, 480, 1, 2048]
    - [39, 65.306]
  - - [480, 3072, 1, 3072]
    - [8, 23.039]
  - - [480, 4096, 1, 4096]
    - [10, 22.557]
  - - [480, 8192, 1, 8192]
    - [9, 27.105]
  - - [3072, 480, 1, 3072]
    - [11, 23.395]
  - - [4096, 480, 1, 4096]
    - [11, 21.441]
  - - [8192, 480, 1, 8192]
    - [12, 27.075]
  - - [17, 17, 1, 64]
    - [15, 0.003]
  - - [24, 24, 1, 64]
    - [20, 0.006]
  - - [30, 31, 1, 64]
    - [20, 0.01]
  - - [32, 32, 1, 64]
    - [18, 0.01]
  - - [32, 35, 1, 64]
    - [21, 0.011]
  - - [31, 31, 1, 64]
    - [19, 0.01]
  - - [34, 34, 1, 64]
    - [17, 0.011]
  - - [30, 30, 1, 64]
    - [16, 0.009]
  - - [17, 15, 1, 64]
    - [22, 0.003]
  - - [35, 35, 1, 64]
    - [20, 0.013]
  - - [21, 17, 1, 64]
    - [16, 0.004]
  - - [21, 21, 1, 64]
    - [15, 0.004]
  - - [15, 14, 1, 64]
    - [15, 0.002]
  - - [14, 14, 1, 64]
    - [14, 0.001]
  - - [15, 15, 1, 64]
    - [15, 0.002]
  - - [34, 24, 1, 64]
    - [13, 0.008]
  - - [2, 4, 1, 1024]
    - [283, 0.001]
  - - [2, 32, 1, 1024]
    - [104, 0.012]
  - - [2, 2048, 1, 1024]
    - [199, 0.827]
  - - [64, 128, 512, 128]
    - [152, 38.062]
  - - [64, 512, 1, 512]
    - [58, 3.975]
  - - [64, 512, 64, 512]
    - [153, 54.316]
  - - [128, 128, 512, 64]
    - [134, 36.673]
  - - [512, 512, 1, 64]
    - [161, 5.816]
  - - [512, 512, 64, 64]
    - [128, 51.007]
  - - [1024, 4, 1, 1024]
    - [129, 0.734]
  - - [1024, 4, 1, 1024]
    - [129, 0.734]
  - - [1024, 32, 1, 1024]
    - [44, 5.414]
  - - [1024, 2048, 1, 1024]
    - [131, 75.27]
  - - [1024, 2048, 1, 4096]
    - [132, 85.702]
  - - [1024, 4096, 1, 1024]
    - [56, 79.278]
  - - [1024, 4096, 1, 4096]
    - [81, 89.121]
  - - [4096, 2048, 1, 1024]
    - [127, 85.884]
  - - [4096, 4096, 1, 1024]
    - [76, 89.568]
  - - [30528, 2048, 1, 1024]
    - [79, 95.04]
  - - [30528, 4096, 1, 1024]
    - [76, 95.575]
  - - [3, 3, 512, 64]
    - [303, 0.123]
  - - [5, 5, 512, 64]
    - [304, 0.326]
  - - [5, 5, 960, 64]
    - [288, 0.542]
  - - [9, 9, 512, 64]
    - [305, 0.975]
  - - [27, 27, 32768, 128]
    - [306, 17.315]
  - - [32, 1600, 1, 512]
    - [63, 5.772]
  - - [33, 33, 1600, 32]
    - [301, 5.244]
  - - [64, 512, 1, 1024]
    - [62, 5.658]
  - - [64, 960, 1, 1024]
    - [45, 9.652]
  - - [128, 32768, 1, 256]
    - [147, 59.109]
  - - [256, 684, 1, 1024]
    - [53, 23.144]
  - - [256, 1280, 1, 1024]
    - [57, 36.513]
  - - [256, 1536, 1, 1024]
    - [47, 41.869]
  - - [256, 2304, 1, 1024]
    - [49, 45.768]
  - - [256, 2560, 1, 1024]
    - [170, 46.693]
  - - [256, 2816, 1, 1024]
    - [114, 50.06]
  - - [256, 3328, 1, 1024]
    - [171, 60.477]
  - - [256, 3584, 1, 1024]
    - [172, 67.118]
  - - [256, 4608, 1, 1024]
    - [133, 59.654]
  - - [256, 4864, 1, 1024]
    - [124, 57.924]
  - - [256, 5376, 1, 1024]
    - [127, 72.865]
  - - [256, 5888, 1, 1024]
    - [111, 62.53]
  - - [256, 6144, 1, 1024]
    - [111, 65.676]
  - - [256, 6400, 1, 1024]
    - [125, 68.264]
  - - [256, 6656, 1, 1024]
    - [173, 70.08]
  - - [256, 7168, 1, 1024]
    - [174, 75.96]
  - - [256, 7424, 1, 1024]
    - [174, 79.187]
  - - [256, 7936, 1, 1024]
    - [175, 73.191]
  - - [256, 8192, 1, 1024]
    - [126, 68.707]
  - - [256, 8448, 1, 1024]
    - [126, 69.899]
  - - [256, 8960, 1, 1024]
    - [176, 78.363]
  - - [256, 9984, 1, 1024]
    - [177, 73.663]
  - - [256, 10496, 1, 1024]
    - [125, 77.093]
  - - [256, 11264, 1, 1024]
    - [138, 81.156]
  - - [256, 11520, 1, 1024]
    - [154, 83.986]
  - - [256, 11776, 1, 1024]
    - [126, 72.404]
  - - [256, 12544, 1, 1024]
    - [126, 73.271]
  - - [256, 13312, 1, 1024]
    - [138, 76.303]
  - - [256, 14336, 1, 1024]
    - [117, 81.695]
  - - [256, 14592, 1, 1024]
    - [117, 82.961]
  - - [256, 14848, 1, 1024]
    - [158, 84.514]
  - - [256, 15104, 1, 1024]
    - [117, 85.475]
  - - [256, 16128, 1, 1024]
    - [154, 81.412]
  - - [256, 18176, 1, 1024]
    - [138, 82.958]
  - - [256, 18944, 1, 1024]
    - [139, 84.192]
  - - [256, 19200, 1, 1024]
    - [156, 87.96]
  - - [256, 20480, 1, 1024]
    - [117, 80.131]
  - - [256, 20992, 1, 1024]
    - [79, 82.003]
  - - [256, 21248, 1, 1024]
    - [158, 82.872]
  - - [256, 21504, 1, 1024]
    - [76, 83.803]
  - - [256, 22016, 1, 1024]
    - [76, 85.392]
  - - [256, 22344, 1, 1024]
    - [138, 84.072]
  - - [256, 23296, 1, 1024]
    - [178, 78.992]
  - - [256, 23552, 1, 1024]
    - [138, 79.75]
  - - [256, 31488, 1, 1024]
    - [127, 83.556]
  - - [256, 32768, 1, 512]
    - [148, 81.364]
  - - [256, 33536, 1, 1024]
    - [139, 87.245]
  - - [256, 44505, 1, 1024]
    - [154, 88.801]
  - - [512, 1600, 1, 512]
    - [125, 47.292]
  - - [512, 32768, 1, 13]
    - [149, 10.155]
  - - [512, 32768, 1, 1024]
    - [79, 89.518]
  - - [684, 8976, 1, 256]
    - [307, 62.858]
  - - [1024, 200, 1, 560]
    - [180, 15.444]
  - - [1024, 512, 1, 1024]
    - [40, 43.126]
  - - [1024, 512, 1, 1600]
    - [49, 48.015]
  - - [1024, 960, 1, 1024]
    - [111, 73.027]
  - - [1024, 960, 1, 1600]
    - [181, 78.925]
  - - [1024, 1600, 1, 560]
    - [166, 49.632]
  - - [1024, 1600, 1, 1024]
    - [168, 66.67]
  - - [1024, 32768, 1, 480]
    - [182, 91.239]
  - - [1024, 32768, 1, 1024]
    - [80, 93.217]
  - - [1280, 8976, 1, 256]
    - [139, 76.887]
  - - [1792, 8976, 1, 256]
    - [183, 79.619]
  - - [2048, 114, 1, 512]
    - [184, 20.156]
  - - [2048, 114, 1, 768]
    - [185, 25.425]
  - - [2048, 215, 1, 512]
    - [186, 28.704]
  - - [2048, 215, 1, 768]
    - [187, 33.313]
  - - [2048, 256, 1, 512]
    - [188, 32.414]
  - - [2048, 256, 1, 768]
    - [189, 37.495]
  - - [2048, 512, 1, 67]
    - [190, 12.064]
  - - [2048, 512, 1, 74]
    - [164, 13.448]
  - - [2048, 512, 1, 100]
    - [164, 16.219]
  - - [2048, 512, 1, 2048]
    - [46, 63.598]
  - - [2048, 684, 1, 512]
    - [166, 50.85]
  - - [2048, 684, 1, 768]
    - [74, 57.043]
  - - [2048, 960, 1, 74]
    - [191, 20.022]
  - - [2048, 960, 1, 2048]
    - [192, 86.724]
  - - [2048, 1536, 1, 512]
    - [193, 65.964]
  - - [2048, 1536, 1, 768]
    - [153, 72.348]
  - - [2048, 8976, 1, 256]
    - [91, 78.926]
  - - [2304, 8976, 1, 256]
    - [194, 80.367]
  - - [2560, 8976, 1, 256]
    - [195, 81.617]
  - - [2816, 8976, 1, 256]
    - [91, 81.722]
  - - [3072, 8976, 1, 256]
    - [91, 83.095]
  - - [3328, 8976, 1, 256]
    - [91, 83.459]
  - - [3840, 8976, 1, 256]
    - [91, 84.433]
  - - [4096, 8976, 1, 256]
    - [91, 83.095]
  - - [4352, 8976, 1, 256]
    - [91, 84.731]
  - - [4608, 8976, 1, 256]
    - [195, 85.312]
  - - [4864, 8976, 1, 256]
    - [91, 85.419]
  - - [5120, 8976, 1, 256]
    - [195, 85.152]
  - - [5376, 8976, 1, 256]
    - [195, 85.192]
  - - [5632, 8976, 1, 256]
    - [91, 85.08]
  - - [5888, 8976, 1, 256]
    - [91, 85.206]
  - - [6144, 8976, 1, 256]
    - [182, 84.938]
  - - [6400, 8976, 1, 256]
    - [71, 85.377]
  - - [7168, 8976, 1, 256]
    - [71, 85.586]
  - - [7936, 8976, 1, 256]
    - [71, 85.478]
  - - [8192, 8976, 1, 256]
    - [140, 84.713]
  - - [8448, 8976, 1, 256]
    - [139, 85.631]
  - - [8960, 8976, 1, 256]
    - [71, 86.19]
  - - [9472, 8976, 1, 256]
    - [71, 85.998]
  - - [9728, 8976, 1, 256]
    - [71, 86.282]
  - - [9984, 8976, 1, 256]
    - [71, 85.571]
  - - [10240, 8976, 1, 256]
    - [71, 86.083]
  - - [10496, 8976, 1, 256]
    - [71, 86.263]
  - - [11264, 8976, 1, 256]
    - [139, 86.077]
  - - [11776, 8976, 1, 256]
    - [71, 86.221]
  - - [12544, 8976, 1, 256]
    - [71, 86.016]
  - - [13312, 8976, 1, 256]
    - [71, 86.642]
  - - [13568, 8976, 1, 256]
    - [71, 86.425]
  - - [13824, 8976, 1, 256]
    - [71, 86.922]
  - - [15104, 8976, 1, 256]
    - [71, 86.983]
  - - [15360, 8976, 1, 256]
    - [139, 86.546]
  - - [15872, 8976, 1, 256]
    - [71, 86.375]
  - - [16128, 8976, 1, 256]
    - [71, 86.51]
  - - [17152, 8976, 1, 256]
    - [71, 86.847]
  - - [18176, 8976, 1, 256]
    - [71, 86.819]
  - - [18688, 8976, 1, 256]
    - [71, 87.125]
  - - [18944, 8976, 1, 256]
    - [139, 86.39]
  - - [19712, 8976, 1, 256]
    - [71, 86.792]
  - - [19968, 8976, 1, 256]
    - [71, 86.922]
  - - [20480, 8976, 1, 256]
    - [71, 87.003]
  - - [20992, 8976, 1, 256]
    - [71, 87.263]
  - - [21248, 8976, 1, 256]
    - [71, 86.399]
  - - [23552, 8976, 1, 256]
    - [71, 87.17]
  - - [28672, 8976, 1, 256]
    - [71, 86.938]
  - - [31488, 8976, 1, 256]
    - [71, 86.928]
  - - [33536, 8976, 1, 256]
    - [71, 86.929]
  - - [44505, 8976, 1, 256]
    - [99, 86.053]
  - - [14, 14, 10880, 64]
    - [289, 7.448]
  - - [15, 14, 10880, 64]
    - [288, 7.731]
  - - [15, 15, 7680, 64]
    - [290, 7.088]
  - - [15, 15, 10880, 64]
    - [291, 7.946]
  - - [17, 15, 7680, 64]
    - [292, 5.908]
  - - [17, 17, 7680, 64]
    - [294, 5.934]
  - - [21, 17, 6144, 64]
    - [295, 5.341]
  - - [21, 21, 6144, 64]
    - [296, 6.045]
  - - [24, 24, 4736, 64]
    - [159, 11.002]
  - - [30, 30, 2048, 64]
    - [297, 9.012]
  - - [30, 31, 2048, 64]
    - [298, 9.2]
  - - [31, 31, 2048, 64]
    - [299, 9.393]
  - - [32, 32, 4608, 64]
    - [160, 12.73]
  - - [32, 35, 4608, 64]
    - [160, 13.154]
  - - [34, 24, 4736, 64]
    - [300, 10.74]
  - - [34, 34, 4736, 64]
    - [301, 10.698]
  - - [35, 35, 4608, 64]
    - [301, 10.323]
  - - [1024, 3840, 1, 1024]
    - [117, 87.428]
  - - [1024, 3840, 1, 4096]
    - [77, 95.096]
  - - [1024, 3968, 1, 1024]
    - [48, 77.027]
  - - [1024, 3968, 1, 4096]
    - [88, 86.193]
  - - [1024, 6528, 1, 1024]
    - [155, 85.985]
  - - [1024, 6528, 1, 4096]
    - [89, 89.593]
  - - [1024, 7104, 1, 1024]
    - [156, 88.747]
  - - [1024, 7104, 1, 4096]
    - [157, 94.141]
  - - [1024, 7200, 1, 1024]
    - [83, 90.291]
  - - [1024, 7200, 1, 4096]
    - [83, 96.571]
  - - [1024, 8064, 1, 1024]
    - [127, 85.872]
  - - [1024, 8064, 1, 4096]
    - [85, 89.934]
  - - [1024, 8160, 1, 1024]
    - [127, 86.801]
  - - [1024, 8160, 1, 4096]
    - [81, 91.069]
  - - [1024, 9216, 1, 1024]
    - [76, 88.62]
  - - [1024, 9216, 1, 4096]
    - [76, 93.149]
  - - [1024, 9520, 1, 1024]
    - [158, 89.999]
  - - [1024, 9520, 1, 4096]
    - [76, 95.289]
  - - [1024, 10064, 1, 1024]
    - [154, 89.902]
  - - [1024, 10064, 1, 4096]
    - [85, 95.371]
  - - [1024, 10080, 1, 1024]
    - [127, 90.497]
  - - [1024, 10080, 1, 4096]
    - [81, 95.767]
  - - [1024, 10200, 1, 1024]
    - [86, 87.762]
  - - [1024, 10200, 1, 4096]
    - [87, 91.168]
  - - [4096, 3840, 1, 1024]
    - [76, 93.013]
  - - [4096, 3968, 1, 1024]
    - [138, 89.822]
  - - [4096, 6528, 1, 1024]
    - [76, 92.42]
  - - [4096, 7104, 1, 1024]
    - [76, 93.29]
  - - [4096, 7200, 1, 1024]
    - [83, 94.298]
  - - [4096, 8064, 1, 1024]
    - [76, 94.106]
  - - [4096, 8160, 1, 1024]
    - [80, 93.326]
  - - [4096, 9216, 1, 1024]
    - [80, 93.329]
  - - [4096, 9520, 1, 1024]
    - [76, 94.35]
  - - [4096, 10064, 1, 1024]
    - [85, 93.808]
  - - [4096, 10080, 1, 1024]
    - [83, 94.013]
  - - [4096, 10200, 1, 1024]
    - [70, 93.012]
  - - [42720, 3968, 1, 1024]
    - [76, 95.313]
  - - [42720, 6528, 1, 1024]
    - [76, 96.214]
  - - [42720, 7104, 1, 1024]
    - [80, 95.798]
  - - [42720, 7200, 1, 1024]
    - [80, 95.777]
  - - [42720, 9520, 1, 1024]
    - [76, 95.395]
  - - [42720, 10080, 1, 1024]
    - [76, 96.066]
  - - [27, 27, 1920, 64]
    - [24, 4.213]
  - - [27, 33, 1920, 64]
    - [23, 4.595]
  - - [33, 33, 1920, 64]
    - [27, 3.385]
  - - [27, 27, 1920, 64]
    - [26, 4.299]
  - - [27, 33, 1920, 64]
    - [28, 4.637]
  - - [33, 33, 1920, 64]
    - [30, 3.488]
  - - [1024, 3240, 1, 1024]
    - [34, 35.327]
  - - [1024, 3240, 1, 4096]
    - [25, 38.283]
  - - [1024, 3960, 1, 1024]
    - [29, 35.104]
  - - [1024, 3960, 1, 4096]
    - [32, 37.527]
  - - [4096, 3240, 1, 1024]
    - [35, 42.293]
  - - [4096, 3960, 1, 1024]
    - [31, 43.442]
  - - [42720, 3960, 1, 1024]
    - [33, 45.756]
  - - [1024, 10, 1, 1024]
    - [122, 1.834]
  - - [1024, 32768, 1, 479]
    - [150, 83.795]
  - - [1024, 4992, 1, 4096]
    - [72, 86.262]
  - - [1024, 5, 1, 1024]
    - [137, 0.972]
  - - [2, 5, 1, 1024]
    - [278, 0.001]
  - - [8192, 7680, 1, 8192]
    - [66, 98.475]
  - - [2, 40, 1, 1024]
    - [284, 0.015]
  - - [128, 128, 128, 64]
    - [120, 24.628]
  - - [64, 128, 1, 128]
    - [163, 0.392]
  - - [1024, 2560, 1, 4096]
    - [138, 83.045]
  - - [30522, 462, 1, 1024]
    - [106, 86.567]
  - - [1024, 820, 1, 1024]
    - [135, 57.068]
  - - [4096, 5248, 1, 1024]
    - [76, 93.654]
  - - [4096, 3840, 1, 4096]
    - [65, 97.204]
  - - [1024, 39, 1, 1024]
    - [43, 6.486]
  - - [128, 128, 160, 64]
    - [121, 28.809]
  - - [4096, 1280, 1, 1024]
    - [125, 79.75]
  - - [1024, 2560, 1, 1024]
    - [125, 75.666]
  - - [1024, 800, 1, 1024]
    - [133, 54.517]
  - - [1024, 8, 1, 1024]
    - [144, 1.454]
  - - [30522, 160, 1, 1024]
    - [101, 74.877]
  - - [2, 1024, 1, 1024]
    - [282, 0.374]
  - - [30522, 308, 1, 1024]
    - [103, 81.49]
  - - [17, 17, 6144, 64]
    - [293, 4.779]
  - - [4096, 2560, 1, 1024]
    - [139, 88.924]
  - - [4096, 8192, 1, 1024]
    - [84, 93.068]
  - - [33, 33, 1, 32]
    - [302, 0.01]
  - - [1024, 5120, 1, 1024]
    - [117, 79.812]
  - - [1024, 9, 1, 1024]
    - [122, 1.667]
  - - [1024, 780, 1, 1024]
    - [126, 54.478]
  - - [512, 512, 80, 64]
    - [136, 52.886]
  - - [4096, 3072, 1, 1024]
    - [139, 89.852]
  - - [480, 512, 1, 512]
    - [109, 23.79]
  - - [1024, 3072, 1, 4096]
    - [143, 85.823]
  - - [4096, 1024, 1, 1024]
    - [127, 81.861]
  - - [1024, 1152, 1, 1024]
    - [42, 58.724]
  - - [128, 128, 656, 64]
    - [134, 37.866]
  - - [1024, 1024, 1, 4096]
    - [41, 67.666]
  - - [30522, 820, 1, 1024]
    - [103, 88.847]
  - - [2, 10, 1, 1024]
    - [100, 0.004]
  - - [1024, 180, 1, 1024]
    - [59, 22.939]
  - - [128, 128, 624, 64]
    - [116, 37.682]
  - - [1024, 160, 1, 1024]
    - [54, 21.807]
  - - [4096, 5120, 1, 1024]
    - [76, 91.788]
  - - [4, 4, 38400, 64]
    - [288, 1.381]
  - - [2048, 1920, 1, 2048]
    - [110, 93.098]
  - - [2, 39, 1, 1024]
    - [282, 0.015]
  - - [1024, 462, 1, 1024]
    - [50, 37.314]
  - - [2, 9, 1, 1024]
    - [287, 0.003]
  - - [30522, 180, 1, 1024]
    - [107, 74.519]
  - - [33712, 8192, 1, 1024]
    - [76, 95.999]
  - - [1024, 77, 1, 1024]
    - [60, 11.535]
  - - [5, 5, 1, 64]
    - [278, 0.0]
  - - [1024, 40, 1, 1024]
    - [61, 6.653]
  - - [2, 8, 1, 1024]
    - [279, 0.003]
  - - [512, 512, 96, 64]
    - [140, 54.415]
  - - [1024, 1152, 1, 4096]
    - [51, 75.615]
  - - [30522, 385, 1, 1024]
    - [105, 78.913]
  - - [1024, 200, 1, 1024]
    - [123, 24.38]
  - - [1024, 5120, 1, 4096]
    - [75, 86.848]
  - - [30522, 616, 1, 1024]
    - [99, 87.125]
  - - [1024, 41, 1, 1024]
    - [52, 6.596]
  - - [128, 128, 1, 64]
    - [162, 0.427]
  - - [1024, 5248, 1, 4096]
    - [77, 87.75]
  - - [4, 4, 32768, 64]
    - [288, 1.342]
  - - [128, 128, 640, 64]
    - [116, 38.062]
  - - [7680, 8192, 1, 8192]
    - [65, 98.43]
  - - [1024, 1280, 1, 4096]
    - [124, 78.32]
  - - [1024, 5248, 1, 1024]
    - [117, 82.265]
  - - [512, 512, 128, 64]
    - [117, 56.294]
  - - [512, 512, 16, 64]
    - [116, 34.178]
  - - [1024, 9600, 1, 1024]
    - [76, 91.862]
  - - [2, 6, 1, 1024]
    - [278, 0.001]
  - - [1024, 385, 1, 1024]
    - [133, 40.623]
  - - [1024, 4992, 1, 1024]
    - [127, 78.63]
  - - [33712, 9600, 1, 1024]
    - [76, 96.213]
  - - [1024, 512, 1, 4096]
    - [55, 55.44]
  - - [1024, 9600, 1, 4096]
    - [83, 96.93]
  - - [1024, 6, 1, 1024]
    - [141, 1.132]
  - - [1024, 308, 1, 1024]
    - [130, 32.498]
  - - [3840, 4096, 1, 4096]
    - [66, 97.235]
  - - [2, 41, 1, 1024]
    - [286, 0.015]
  - - [4096, 1152, 1, 1024]
    - [146, 83.274]
  - - [4096, 9600, 1, 1024]
    - [76, 95.433]
  - - [30522, 200, 1, 1024]
    - [281, 67.471]
  - - [4096, 4992, 1, 1024]
    - [73, 92.252]
  - - [1024, 8192, 1, 1024]
    - [138, 86.485]
  - - [30522, 780, 1, 1024]
    - [102, 88.892]
  - - [4096, 512, 1, 1024]
    - [119, 70.024]
  - - [1024, 1280, 1, 1024]
    - [64, 61.121]
  - - [1920, 2048, 1, 2048]
    - [67, 92.755]
  - - [1024, 3072, 1, 1024]
    - [142, 75.647]
  - - [1024, 8192, 1, 4096]
    - [82, 90.807]
  - - [128, 128, 144, 64]
    - [145, 27.439]
  - - [30522, 800, 1, 1024]
    - [285, 91.439]
  - - [30522, 77, 1, 1024]
    - [280, 58.881]
  - - [1024, 1024, 128, 96]
    - [140, 78.529]
  - - [30592, 4096, 1, 1024]
    - [76, 95.874]
  - - [64, 1024, 256, 1024]
    - [206, 73.48]
  - - [1536, 8192, 1, 1536]
    - [95, 92.094]
  - - [2048, 2, 1, 2048]
    - [198, 1.138]
  - - [3072, 8192, 1, 1024]
    - [76, 93.474]
  - - [3072, 2048, 1, 1024]
    - [131, 84.087]
  - - [50304, 8192, 1, 1024]
    - [76, 96.366]
  - - [64, 512, 40, 512]
    - [188, 48.873]
  - - [2048, 1024, 1, 8192]
    - [197, 86.509]
  - - [96, 1024, 64, 1024]
    - [205, 76.658]
  - - [1024, 16, 1, 1024]
    - [199, 3.079]
  - - [50304, 2048, 1, 1024]
    - [76, 94.915]
  - - [1536, 8192, 1, 6144]
    - [96, 95.202]
  - - [50304, 4096, 1, 1536]
    - [76, 97.048]
  - - [8192, 1024, 1, 2048]
    - [127, 88.973]
  - - [2, 4, 1, 2560]
    - [309, 0.004]
  - - [2560, 2048, 1, 640]
    - [121, 77.439]
  - - [1024, 1024, 128, 64]
    - [200, 62.656]
  - - [2048, 1024, 1, 2048]
    - [196, 80.955]
  - - [1536, 4096, 1, 1536]
    - [147, 85.076]
  - - [1024, 1024, 64, 64]
    - [200, 60.397]
  - - [30592, 8192, 1, 1024]
    - [76, 96.118]
  - - [50304, 16384, 1, 1024]
    - [76, 96.41]
  - - [4608, 4096, 1, 1536]
    - [80, 93.121]
  - - [2560, 2048, 1, 2560]
    - [203, 86.208]
  - - [7680, 2048, 1, 2560]
    - [94, 96.324]
  - - [2, 16, 1, 1024]
    - [308, 0.006]
  - - [50304, 4096, 1, 1024]
    - [76, 96.021]
  - - [64, 1024, 128, 1024]
    - [208, 72.848]
  - - [1920, 2048, 1, 2560]
    - [158, 92.95]
  - - [1024, 1024, 64, 96]
    - [140, 76.22]
  - - [64, 1024, 32, 1024]
    - [153, 61.552]
  - - [6144, 4096, 1, 1536]
    - [94, 94.278]
  - - [64, 512, 128, 512]
    - [202, 59.813]
  - - [1536, 4096, 1, 6144]
    - [78, 90.64]
  - - [512, 512, 256, 64]
    - [200, 60.715]
  - - [96, 1024, 128, 1024]
    - [205, 80.846]
  - - [50304, 8192, 1, 1536]
    - [76, 97.035]
  - - [6144, 8192, 1, 1536]
    - [76, 95.082]
  - - [4096, 16384, 1, 1024]
    - [80, 94.636]
  - - [30592, 1024, 1, 2048]
    - [92, 96.271]
  - - [2, 2, 1, 2048]
    - [287, 0.001]
  - - [1024, 16384, 1, 4096]
    - [83, 94.566]
  - - [64, 512, 256, 512]
    - [108, 63.698]
  - - [512, 512, 40, 64]
    - [136, 45.675]
  - - [6144, 1024, 1, 2048]
    - [93, 85.549]
  - - [4608, 8192, 1, 1536]
    - [80, 94.236]
  - - [30592, 2048, 1, 1024]
    - [76, 95.293]
  - - [3072, 16384, 1, 1024]
    - [79, 94.434]
  - - [1024, 1024, 256, 64]
    - [140, 64.067]
  - - [64, 1024, 64, 1024]
    - [207, 66.712]
  - - [1024, 16384, 1, 1024]
    - [79, 89.493]
  - - [1024, 1024, 32, 64]
    - [140, 56.373]
  - - [3072, 4096, 1, 1024]
    - [201, 89.852]
  - - [2560, 4, 1, 2560]
    - [204, 2.938]
  - - [960, 1024, 1, 1024]
    - [108, 73.311]
  - - [1024, 1, 1, 1024]
    - [118, 0.189]
  - - [32768, 1, 1, 256]
    - [151, 0.987]
  - - [512, 1, 1, 2048]
    - [165, 0.187]
  - - [1600, 1, 1, 1024]
    - [167, 0.292]
  - - [200, 1, 1, 1024]
    - [169, 0.039]
  - - [960, 1, 1, 2048]
    - [179, 0.325]
  - - [1024, 64, 1, 1024]
    - [209, 9.589]
  - - [30528, 8192, 1, 1024]
    - [76, 95.918]
  - - [128, 128, 1024, 64]
    - [116, 40.437]
  - - [64, 128, 1024, 128]
    - [210, 37.495]
  - - [1024, 3456, 1, 1024]
    - [158, 78.869]
  - - [1024, 3456, 1, 480]
    - [211, 72.258]
  - - [1024, 4096, 1, 480]
    - [212, 75.818]
  - - [1024, 6912, 1, 1024]
    - [127, 86.902]
  - - [1024, 6912, 1, 480]
    - [213, 81.943]
  - - [1024, 864, 1, 1024]
    - [214, 61.886]
  - - [1024, 864, 1, 480]
    - [215, 47.033]
  - - [128, 3456, 1, 256]
    - [216, 23.815]
  - - [128, 4096, 1, 256]
    - [185, 24.155]
  - - [128, 55296, 1, 256]
    - [217, 69.211]
  - - [128, 6912, 1, 256]
    - [218, 35.035]
  - - [128, 864, 1, 256]
    - [219, 8.153]
  - - [256, 3456, 1, 512]
    - [220, 49.292]
  - - [256, 4096, 1, 512]
    - [126, 42.22]
  - - [256, 55296, 1, 512]
    - [127, 85.371]
  - - [256, 6912, 1, 512]
    - [174, 63.987]
  - - [256, 864, 1, 512]
    - [221, 20.578]
  - - [3456, 1, 1, 256]
    - [222, 0.276]
  - - [4096, 1, 1, 256]
    - [223, 0.316]
  - - [512, 3456, 1, 1024]
    - [224, 74.046]
  - - [512, 3456, 1, 13]
    - [139, 4.679]
  - - [512, 4096, 1, 1024]
    - [126, 68.943]
  - - [512, 4096, 1, 13]
    - [225, 4.907]
  - - [512, 55296, 1, 13]
    - [226, 10.917]
  - - [512, 6912, 1, 1024]
    - [117, 79.145]
  - - [512, 6912, 1, 13]
    - [227, 6.834]
  - - [512, 864, 1, 1024]
    - [228, 42.181]
  - - [512, 864, 1, 13]
    - [229, 1.764]
  - - [6912, 1, 1, 256]
    - [230, 0.494]
  - - [864, 1, 1, 256]
    - [231, 0.058]
  - - [30528, 640, 1, 1024]
    - [76, 92.3]
  - - [30528, 1280, 1, 1024]
    - [76, 94.015]
  - - [30528, 1600, 1, 1024]
    - [97, 93.916]
  - - [1024, 10240, 1, 1024]
    - [232, 88.377]
  - - [1024, 80, 1, 1024]
    - [233, 11.461]
  - - [4096, 10240, 1, 1024]
    - [98, 92.955]
  - - [1024, 10240, 1, 4096]
    - [89, 91.484]
  - - [64, 128, 1280, 128]
    - [234, 37.89]
  - - [128, 128, 1280, 64]
    - [116, 40.981]
  - - [1024, 10496, 1, 4096]
    - [90, 92.874]
  - - [30528, 1640, 1, 1024]
    - [76, 93.881]
  - - [1024, 82, 1, 1024]
    - [233, 11.833]
  - - [4096, 10496, 1, 1024]
    - [76, 94.949]
  - - [1024, 10496, 1, 1024]
    - [71, 89.875]
  - - [64, 128, 1312, 128]
    - [235, 37.922]
  - - [128, 128, 1312, 64]
    - [236, 41.265]
  - - [30528, 160, 1, 1024]
    - [237, 84.111]
  - - [1024, 12, 1, 1024]
    - [137, 2.141]
  - - [30528, 240, 1, 1024]
    - [200, 82.65]
  - - [1024, 6144, 1, 1024]
    - [138, 82.647]
  - - [4096, 6144, 1, 1024]
    - [76, 93.185]
  - - [1024, 6144, 1, 4096]
    - [90, 89.056]
  - - [64, 512, 192, 512]
    - [208, 61.647]
  - - [512, 512, 192, 64]
    - [227, 58.592]
  - - [2, 64, 1, 1024]
    - [284, 0.024]
  - - [2, 80, 1, 1024]
    - [310, 0.031]
  - - [2, 82, 1, 1024]
    - [308, 0.03]
  - - [2, 12, 1, 1024]
    - [311, 0.004]
  - - [2, 1, 1, 1024]
    - [278, 0.0]
  - - [1, 4096, 1, 256]
    - [199, 0.316]
  - - [1, 6912, 1, 256]
    - [312, 0.487]
  - - [1024, 10224, 1, 1024]
    - [138, 87.852]
  - - [1024, 10192, 1, 1024]
    - [138, 87.578]
  - - [1024, 10208, 1, 1024]
    - [232, 87.792]
  - - [1024, 10224, 1, 4096]
    - [125, 91.083]
  - - [4096, 10224, 1, 1024]
    - [131, 93.133]
  - - [3072, 10224, 1, 1024]
    - [200, 93.91]
  - - [3072, 10240, 1, 1024]
    - [117, 94.485]
  - - [1024, 10192, 1, 4096]
    - [125, 90.695]
  - - [4096, 10192, 1, 1024]
    - [238, 92.466]
  - - [3072, 10192, 1, 1024]
    - [117, 93.586]
  - - [3072, 10200, 1, 1024]
    - [200, 93.675]
  - - [1024, 10184, 1, 1024]
    - [138, 87.509]
  - - [3072, 10208, 1, 1024]
    - [200, 93.53]
  - - [1024, 10208, 1, 4096]
    - [220, 91.002]
  - - [4096, 10208, 1, 1024]
    - [238, 92.687]
  - - [2048, 10224, 1, 1024]
    - [200, 90.182]
  - - [2048, 10240, 1, 1024]
    - [200, 91.329]
  - - [1024, 10120, 1, 1024]
    - [139, 87.111]
  - - [2048, 10192, 1, 1024]
    - [139, 90.469]
  - - [24, 24, 6816, 64]
    - [239, 9.637]
  - - [1024, 10152, 1, 1024]
    - [139, 87.31]
  - - [3072, 10080, 1, 1024]
    - [238, 93.566]
  - - [1024, 2048, 1, 49]
    - [240, 15.264]
  - - [1024, 256, 1, 196]
    - [241, 10.23]
  - - [1024, 512, 1, 196]
    - [242, 17.484]
  - - [1152, 128, 1, 784]
    - [243, 14.922]
  - - [128, 512, 1, 784]
    - [244, 6.969]
  - - [2048, 512, 1, 49]
    - [245, 9.814]
  - - [2304, 256, 1, 196]
    - [246, 19.494]
  - - [256, 1024, 1, 196]
    - [247, 10.568]
  - - [256, 128, 1, 3136]
    - [248, 13.545]
  - - [256, 512, 1, 784]
    - [249, 13.937]
  - - [256, 64, 1, 3136]
    - [250, 7.755]
  - - [4608, 512, 1, 49]
    - [240, 16.517]
  - - [512, 1024, 1, 196]
    - [251, 18.145]
  - - [512, 128, 1, 784]
    - [244, 6.919]
  - - [512, 2048, 1, 49]
    - [145, 10.123]
  - - [512, 256, 1, 784]
    - [252, 13.356]
  - - [576, 64, 1, 3136]
    - [179, 14.425]
  - - [64, 256, 1, 3136]
    - [253, 7.693]
  - - [64, 64, 1, 3136]
    - [250, 1.78]
  - - [128, 128, 49, 12800]
    - [220, 74.174]
  - - [128, 128, 25, 25088]
    - [254, 71.766]
  - - [128, 128, 49, 25600]
    - [255, 76.051]
  - - [128, 128, 25, 50176]
    - [256, 73.536]
  - - [256, 256, 25, 12544]
    - [257, 84.598]
  - - [256, 256, 49, 3200]
    - [147, 76.688]
  - - [256, 256, 25, 6272]
    - [258, 79.052]
  - - [256, 256, 49, 6400]
    - [259, 78.312]
  - - [512, 512, 49, 1152]
    - [147, 87.534]
  - - [512, 512, 25, 2048]
    - [111, 87.682]
  - - [512, 512, 49, 2304]
    - [147, 89.126]
  - - [512, 512, 25, 4096]
    - [108, 87.606]
  - - [64, 128, 2048, 128]
    - [260, 38.985]
  - - [128, 128, 2048, 64]
    - [145, 42.668]
  - - [30528, 2560, 1, 1024]
    - [158, 94.483]
  - - [1024, 128, 1, 1024]
    - [233, 17.445]
  - - [64, 128, 1536, 128]
    - [234, 38.45]
  - - [128, 128, 1536, 64]
    - [116, 41.869]
  - - [1024, 12288, 1, 1024]
    - [232, 89.023]
  - - [1024, 12288, 1, 4096]
    - [127, 91.306]
  - - [30528, 1920, 1, 1024]
    - [238, 94.109]
  - - [1024, 96, 1, 1024]
    - [233, 14.06]
  - - [4096, 12288, 1, 1024]
    - [140, 93.829]
  - - [128, 128, 36, 12544]
    - [261, 74.693]
  - - [128, 128, 49, 9216]
    - [262, 73.115]
  - - [128, 128, 64, 6400]
    - [263, 60.099]
  - - [128, 128, 81, 12544]
    - [264, 73.992]
  - - [128, 128, 121, 9216]
    - [265, 66.594]
  - - [128, 128, 169, 6400]
    - [266, 79.329]
  - - [256, 256, 36, 4096]
    - [127, 75.207]
  - - [256, 256, 49, 2304]
    - [267, 79.312]
  - - [256, 256, 64, 2304]
    - [235, 81.473]
  - - [256, 256, 81, 4096]
    - [158, 85.335]
  - - [256, 256, 121, 2304]
    - [147, 84.435]
  - - [256, 256, 169, 2304]
    - [125, 88.627]
  - - [512, 512, 81, 1024]
    - [117, 91.844]
  - - [512, 512, 121, 1024]
    - [111, 90.722]
  - - [512, 512, 169, 1024]
    - [117, 92.97]
  - - [512, 512, 36, 1024]
    - [117, 87.844]
  - - [512, 512, 49, 1024]
    - [117, 86.655]
  - - [512, 512, 64, 1024]
    - [117, 88.728]
  - - [64, 64, 36, 50176]
    - [268, 41.165]
  - - [64, 64, 49, 36864]
    - [269, 44.743]
  - - [64, 64, 64, 25600]
    - [270, 41.264]
  - - [128, 128, 192, 64]
    - [145, 29.21]
  - - [64, 128, 192, 128]
    - [271, 28.765]
  - - [768, 2048, 1, 768]
    - [189, 62.803]
  - - [3072, 2048, 1, 768]
    - [121, 81.328]
  - - [768, 2048, 1, 3072]
    - [138, 73.645]
  - - [768, 16, 1, 768]
    - [272, 1.984]
  - - [384, 384, 144, 64]
    - [273, 53.323]
  - - [64, 384, 144, 384]
    - [135, 52.771]
  - - [768, 4608, 1, 768]
    - [117, 76.611]
  - - [3072, 4608, 1, 768]
    - [121, 88.779]
  - - [768, 4608, 1, 3072]
    - [138, 84.643]
  - - [768, 12, 1, 768]
    - [231, 1.366]
  - - [512, 512, 48, 64]
    - [136, 46.81]
  - - [64, 512, 48, 512]
    - [108, 53.26]
  - - [768, 4, 1, 768]
    - [274, 0.46]
  - - [128, 128, 256, 64]
    - [116, 32.206]
  - - [64, 128, 256, 128]
    - [120, 31.206]
  - - [384, 384, 192, 64]
    - [113, 55.505]
  - - [64, 384, 192, 384]
    - [234, 54.262]
  - - [1024, 4608, 1, 1024]
    - [125, 83.198]
  - - [4096, 4608, 1, 1024]
    - [127, 91.719]
  - - [1024, 4608, 1, 4096]
    - [157, 91.096]
  - - [2880, 3072, 1, 3072]
    - [138, 93.546]
  - - [3072, 3072, 1, 3072]
    - [224, 91.719]
  - - [3072, 512, 1, 3072]
    - [206, 73.347]
  - - [4096, 512, 1, 4096]
    - [196, 84.842]
  - - [512, 1024, 1, 1024]
    - [153, 39.717]
  - - [512, 2048, 1, 2048]
    - [275, 57.585]
  - - [512, 3072, 1, 3072]
    - [125, 73.465]
  - - [512, 4096, 1, 4096]
    - [132, 82.112]
  - - [512, 8192, 1, 8192]
    - [154, 90.565]
  - - [64, 1024, 1, 1024]
    - [276, 9.589]
  - - [8192, 512, 1, 8192]
    - [277, 89.121]
  - - [26, 26, 6272, 64]
    - [313, 9.978]
  - - [147, 64, 1, 12544]
    - [314, 12.408]
  - - [2, 128, 1, 1024]
    - [315, 0.048]
  - - [2, 96, 1, 1024]
    - [315, 0.037]
  - - [2, 2048, 1, 768]
    - [316, 0.719]
  - - [2, 4608, 1, 768]
    - [317, 1.424]
  - - [2, 4608, 1, 1024]
    - [318, 1.635]
  - - [4224, 3840, 1, 4096]
    - [319, 77.2]
  - - [5376, 4096, 1, 4096]
    - [320, 76.425]
  - - [7040, 4096, 1, 384]
    - [321, 56.984]
  - - [7040, 4096, 1, 512]
    - [321, 61.694]
  - - [7040, 4096, 1, 768]
    - [321, 66.735]
  - - [7040, 4096, 1, 1536]
    - [322, 74.379]
- null
