library/src/blas3/Tensile/Logic/aldebaran/aldebaran_Cijk_Alik_Bljk_CB.yaml
- {MinimumRequiredVersion: 4.21.0}
- aldebaran
- gfx90a
- [Device 0050, Device 0051, Device 0052, Device 0054, Device 0062, Device 7400, Device 740c]
    SolutionIndex: 0
    SolutionNameMin: Cijk_Alik_Bljk_CB_MT32x32x16_MI16x16x4x1_SE_1LDSB0_IU4_SIA2_SRVW0
    SolutionIndex: 1
    SolutionNameMin: Cijk_Alik_Bljk_CB_MT128x64x16_MI32x32x2x1_SE_1LDSB0_IU1_SIA3_SRVW0
    SolutionIndex: 2
    SolutionNameMin: Cijk_Alik_Bljk_CB_MT32x32x16_MI16x16x4x1_SE_1LDSB1_IU4_SIA2_SRVW0
    SolutionIndex: 3
    SolutionNameMin: Cijk_Alik_Bljk_CB_MT128x64x8_MI16x16x4x1_SE_1LDSB0_IU2_SIA2_SRVW2
    SolutionIndex: 4
    SolutionNameMin: Cijk_Alik_Bljk_CB_MT32x32x16_MI16x16x4x1_SE_1LDSB0_IU4_SIA2_SRVW2
    SolutionIndex: 5
    SolutionNameMin: Cijk_Alik_Bljk_CB_MT128x128x8_MI32x32x2x1_SE_1LDSB0_IU1_SIA3_SRVW2
    SolutionIndex: 6
    SolutionNameMin: Cijk_Alik_Bljk_CB_MT128x64x16_MI32x32x2x1_SE_1LDSB0_IU1_SIA3_SRVW2
    SolutionIndex: 7
    SolutionNameMin: Cijk_Alik_Bljk_CB_MT64x64x8_MI16x16x4x1_SE_1LDSB1_IU2_SIA2_SRVW2
    SolutionIndex: 8
    SolutionNameMin: Cijk_Alik_Bljk_CB_MT64x64x16_MI16x16x4x1_SE_1LDSB1_IU4_SIA2_SRVW2
    SolutionIndex: 9
    SolutionNameMin: Cijk_Alik_Bljk_CB_MT128x64x16_MI16x16x4x1_SE_1LDSB1_IU4_SIA2_SRVW2
    SolutionIndex: 10
    SolutionNameMin: Cijk_Alik_Bljk_CB_MT64x64x8_MI16x16x4x1_SE_1LDSB0_IU2_SIA2_SRVW0
    SolutionIndex: 11
    SolutionNameMin: Cijk_Alik_Bljk_CB_MT64x64x16_MI16x16x4x1_SE_1LDSB0_IU1_SIA3_SRVW0
- - - [7680, 8192, 1, 8192, 7680, 7680, 8192, 8192]
    - [6, 98.537]
  - - [64, 1, 1, 256, 64, 64, 256, 256]
    - [10, 0.012]
  - - [960, 1024, 1, 1024, 1056, 1056, 1056, 1056]
    - [7, 93.853]
  - - [1920, 2048, 1, 2048, 2064, 2064, 2064, 2064]
    - [9, 97.447]
  - - [3840, 4096, 1, 4096, 4112, 4112, 4112, 4112]
    - [9, 98.561]
  - - [480, 512, 1, 512, 544, 544, 544, 544]
    - [0, 66.11]
  - - [1, 1, 1, 256, 1, 1, 256, 256]
    - [10, 0.0]
  - - [1920, 2048, 1, 2048, 2080, 2080, 2080, 2080]
    - [9, 97.291]
  - - [64, 64, 2, 64, 64, 64, 64, 64]
    - [11, 0.575]
  - - [1, 64, 1, 256, 1, 1, 256, 256]
    - [10, 0.012]
  - - [480, 512, 1, 512, 528, 528, 528, 528]
    - [4, 70.303]
  - - [7680, 8192, 1, 8192, 8224, 8224, 8224, 8224]
    - [6, 98.573]
  - - [480, 512, 1, 512, 480, 480, 512, 512]
    - [2, 68.267]
  - - [3840, 4096, 1, 4096, 3840, 3840, 4096, 4096]
    - [8, 98.513]
  - - [3840, 4096, 1, 4096, 4228, 4228, 4228, 4228]
    - [5, 98.285]
  - - [960, 1024, 1, 1024, 960, 960, 1024, 1024]
    - [7, 93.973]
  - - [7680, 8192, 1, 8192, 8208, 8208, 8208, 8208]
    - [1, 98.74]
  - - [1920, 2048, 1, 2048, 1920, 1920, 2048, 2048]
    - [3, 97.459]
  - - [64, 64, 1, 256, 64, 64, 256, 256]
    - [11, 0.527]
  - - [960, 1024, 1, 1024, 1040, 1040, 1040, 1040]
    - [7, 93.973]
- null
