library/src/blas3/Tensile/Logic/aldebaran/aldebaran_Cijk_Ailk_Bljk_HSS_BH.yaml
- {MinimumRequiredVersion: 4.23.0}
- aldebaran
- gfx90a
- [Device 0050, Device 0051, Device 0052, Device 0054, Device 0062, Device 7400, Device 740c]
    SolutionIndex: 0
    SolutionNameMin: Cijk_Ailk_Bljk_HSS_BH_MT16x16x8_SE_PGR1_PLR1_TT2_2
    SolutionIndex: 1
    SolutionNameMin: Cijk_Ailk_Bljk_HSS_BH_MT64x64x8_SE_PGR1_PLR1_TT4_4
    SolutionIndex: 2
    SolutionNameMin: Cijk_Ailk_Bljk_HSS_BH_MT16x16x16_SE_PGR1_PLR1_TT2_2
    SolutionIndex: 3
    SolutionNameMin: Cijk_Ailk_Bljk_HSS_BH_MT32x16x16_SE_PGR1_PLR1_TT4_2
    SolutionIndex: 4
    SolutionNameMin: Cijk_Ailk_Bljk_HSS_BH_MT32x16x16_SE_PGR1_PLR1_TT2_2
    SolutionIndex: 5
    SolutionNameMin: Cijk_Ailk_Bljk_HSS_BH_MT64x16x16_SE_PGR1_PLR1_TT4_2
    SolutionIndex: 6
    SolutionNameMin: Cijk_Ailk_Bljk_HSS_BH_MT16x16x32_SE_PGR1_PLR1_TT2_2
    SolutionIndex: 7
    SolutionNameMin: Cijk_Ailk_Bljk_HSS_BH_MT32x8x32_SE_PGR1_PLR1_TT2_2
    SolutionIndex: 8
    SolutionNameMin: Cijk_Ailk_Bljk_HSS_BH_MT32x16x32_SE_PGR1_PLR1_TT2_2
    SolutionIndex: 9
    SolutionNameMin: Cijk_Ailk_Bljk_HSS_BH_MT64x8x32_SE_PGR1_PLR1_TT2_2
    SolutionIndex: 10
    SolutionNameMin: Cijk_Ailk_Bljk_HSS_BH_MT64x16x32_SE_PGR1_PLR1_TT2_2
    SolutionIndex: 11
    SolutionNameMin: Cijk_Ailk_Bljk_HSS_BH_MT128x16x32_SE_PGR1_PLR1_TT4_2
    SolutionIndex: 12
    SolutionNameMin: Cijk_Ailk_Bljk_HSS_BH_MT32x8x64_SE_PGR1_PLR1_TT2_2
    SolutionIndex: 13
    SolutionNameMin: Cijk_Ailk_Bljk_HSS_BH_MT32x16x64_SE_PGR1_PLR1_TT2_2
    SolutionIndex: 14
    SolutionNameMin: Cijk_Ailk_Bljk_HSS_BH_MT64x8x64_SE_PGR1_PLR1_TT2_2
    SolutionIndex: 15
    SolutionNameMin: Cijk_Ailk_Bljk_HSS_BH_MT32x32x8_SE_PGR1_PLR1_TT4_4
    SolutionIndex: 16
    SolutionNameMin: Cijk_Ailk_Bljk_HSS_BH_MT64x32x8_SE_PGR1_PLR1_TT8_4
    SolutionIndex: 17
    SolutionNameMin: Cijk_Ailk_Bljk_HSS_BH_MT16x16x16_SE_PGR1_PLR1_TT2_2
    SolutionIndex: 18
    SolutionNameMin: Cijk_Ailk_Bljk_HSS_BH_MT32x16x16_SE_PGR1_PLR1_TT4_2
    SolutionIndex: 19
    SolutionNameMin: Cijk_Ailk_Bljk_HSS_BH_MT32x32x16_SE_PGR1_PLR1_TT4_4
    SolutionIndex: 20
    SolutionNameMin: Cijk_Ailk_Bljk_HSS_BH_MT32x16x16_SE_PGR1_PLR1_TT2_2
    SolutionIndex: 21
    SolutionNameMin: Cijk_Ailk_Bljk_HSS_BH_MT64x16x16_SE_PGR1_PLR1_TT4_2
    SolutionIndex: 22
    SolutionNameMin: Cijk_Ailk_Bljk_HSS_BH_MT32x8x16_SE_PGR1_PLR1_TT2_2
    SolutionIndex: 23
    SolutionNameMin: Cijk_Ailk_Bljk_HSS_BH_MT16x16x24_SE_PGR1_PLR1_TT2_2
    SolutionIndex: 24
    SolutionNameMin: Cijk_Ailk_Bljk_HSS_BH_MT32x32x24_SE_PGR1_PLR1_TT4_4
    SolutionIndex: 25
    SolutionNameMin: Cijk_Ailk_Bljk_HSS_BH_MT16x16x32_SE_PGR1_PLR1_TT2_2
    SolutionIndex: 26
    SolutionNameMin: Cijk_Ailk_Bljk_HSS_BH_MT32x32x32_SE_PGR1_PLR1_TT4_4
    SolutionIndex: 27
    SolutionNameMin: Cijk_Ailk_Bljk_HSS_BH_MT64x16x32_SE_PGR1_PLR1_TT2_2
    SolutionIndex: 28
    SolutionNameMin: Cijk_Ailk_Bljk_HSS_BH_MT128x16x32_SE_PGR1_PLR1_TT4_2
    SolutionIndex: 29
    SolutionNameMin: Cijk_Ailk_Bljk_HSS_BH_MT32x8x32_SE_PGR1_PLR1_TT2_2
    SolutionIndex: 30
    SolutionNameMin: Cijk_Ailk_Bljk_HSS_BH_MT64x8x32_SE_PGR1_PLR1_TT2_2
    SolutionIndex: 31
    SolutionNameMin: Cijk_Ailk_Bljk_HSS_BH_MT32x8x64_SE_PGR1_PLR1_TT2_2
    SolutionIndex: 32
    SolutionNameMin: Cijk_Ailk_Bljk_HSS_BH_MT64x64x8_SE_PGR1_PLR1_TT4_4
    SolutionIndex: 33
    SolutionNameMin: Cijk_Ailk_Bljk_HSS_BH_MT64x64x16_SE_PGR1_PLR1_TT4_4
    SolutionIndex: 34
    SolutionNameMin: Cijk_Ailk_Bljk_HSS_BH_MT64x128x16_SE_PGR1_PLR1_TT4_8
    SolutionIndex: 35
    SolutionNameMin: Cijk_Ailk_Bljk_HSS_BH_MT128x64x16_SE_PGR1_PLR1_TT8_4
    SolutionIndex: 36
    SolutionNameMin: Cijk_Ailk_Bljk_HSS_BH_MT64x64x32_SE_PGR1_PLR1_TT4_4
    SolutionIndex: 37
    SolutionNameMin: Cijk_Ailk_Bljk_HSS_BH_MT64x32x16_SE_PGR1_PLR1_TT4_2
    SolutionIndex: 38
    SolutionNameMin: Cijk_Ailk_Bljk_HSS_BH_MT64x32x16_SE_PGR1_PLR1_TT2_4
    SolutionIndex: 39
    SolutionNameMin: Cijk_Ailk_Bljk_HSS_BH_MT64x64x16_SE_PGR1_PLR1_TT2_4
    SolutionIndex: 40
    SolutionNameMin: Cijk_Ailk_Bljk_HSS_BH_MT64x32x16_SE_PGR1_PLR1_TT4_2
    SolutionIndex: 41
    SolutionNameMin: Cijk_Ailk_Bljk_HSS_BH_MT64x64x8_SE_PGR1_PLR1_TT4_4
    SolutionIndex: 42
    SolutionNameMin: Cijk_Ailk_Bljk_HSS_BH_MT64x64x8_SE_PGR1_PLR1_TT4_4
    SolutionIndex: 43
    SolutionNameMin: Cijk_Ailk_Bljk_HSS_BH_MT128x64x16_SE_PGR1_PLR1_TT8_4
    SolutionIndex: 44
    SolutionNameMin: Cijk_Ailk_Bljk_HSS_BH_MT64x64x16_SE_PGR1_PLR0_TT4_4
    SolutionIndex: 45
    SolutionNameMin: Cijk_Ailk_Bljk_HSS_BH_MT32x128x16_SE_PGR0_PLR0_TT4_4
    SolutionIndex: 46
    SolutionNameMin: Cijk_Ailk_Bljk_HSS_BH_MT64x32x16_SE_PGR1_PLR0_TT4_4
    SolutionIndex: 47
    SolutionNameMin: Cijk_Ailk_Bljk_HSS_BH_MT32x128x16_SE_PGR0_PLR0_TT4_4
    SolutionIndex: 48
    SolutionNameMin: Cijk_Ailk_Bljk_HSS_BH_MT32x128x16_SE_PGR1_PLR0_TT4_4
    SolutionIndex: 49
    SolutionNameMin: Cijk_Ailk_Bljk_HSS_BH_MT64x128x4_SE_PGR0_PLR0_TT4_8
    SolutionIndex: 50
    SolutionNameMin: Cijk_Ailk_Bljk_HSS_BH_MT64x64x4_SE_PGR0_PLR0_TT4_4
    SolutionIndex: 51
    SolutionNameMin: Cijk_Ailk_Bljk_HSS_BH_MT64x128x4_SE_PGR0_PLR1_TT4_8
    SolutionIndex: 52
    SolutionNameMin: Cijk_Ailk_Bljk_HSS_BH_MT64x64x4_SE_PGR0_PLR1_TT4_4
    SolutionIndex: 53
    SolutionNameMin: Cijk_Ailk_Bljk_HSS_BH_MT64x64x8_SE_PGR0_PLR0_TT4_4
    SolutionIndex: 54
    SolutionNameMin: Cijk_Ailk_Bljk_HSS_BH_MT128x128x8_SE_PGR1_PLR0_TT8_8
    SolutionIndex: 55
    SolutionNameMin: Cijk_Ailk_Bljk_HSS_BH_MT64x64x8_SE_PGR0_PLR1_TT4_4
    SolutionIndex: 56
    SolutionNameMin: Cijk_Ailk_Bljk_HSS_BH_MT64x64x16_SE_PGR0_PLR0_TT4_4
    SolutionIndex: 57
    SolutionNameMin: Cijk_Ailk_Bljk_HSS_BH_MT64x64x16_SE_PGR1_PLR0_TT4_4
    SolutionIndex: 58
    SolutionNameMin: Cijk_Ailk_Bljk_HSS_BH_MT64x64x16_SE_PGR0_PLR1_TT4_4
    SolutionIndex: 59
    SolutionNameMin: Cijk_Ailk_Bljk_HSS_BH_MT64x64x16_SE_PGR1_PLR1_TT4_4
    SolutionIndex: 60
    SolutionNameMin: Cijk_Ailk_Bljk_HSS_BH_MT128x128x4_SE_PGR0_PLR0_TT8_8
    SolutionIndex: 61
    SolutionNameMin: Cijk_Ailk_Bljk_HSS_BH_MT64x128x4_SE_PGR0_PLR0_TT4_8
    SolutionIndex: 62
    SolutionNameMin: Cijk_Ailk_Bljk_HSS_BH_MT64x64x4_SE_PGR0_PLR0_TT4_4
    SolutionIndex: 63
    SolutionNameMin: Cijk_Ailk_Bljk_HSS_BH_MT64x128x4_SE_PGR1_PLR0_TT4_8
    SolutionIndex: 64
    SolutionNameMin: Cijk_Ailk_Bljk_HSS_BH_MT64x64x4_SE_PGR1_PLR0_TT4_4
    SolutionIndex: 65
    SolutionNameMin: Cijk_Ailk_Bljk_HSS_BH_MT128x128x4_SE_PGR0_PLR1_TT8_8
    SolutionIndex: 66
    SolutionNameMin: Cijk_Ailk_Bljk_HSS_BH_MT64x128x4_SE_PGR0_PLR1_TT4_8
    SolutionIndex: 67
    SolutionNameMin: Cijk_Ailk_Bljk_HSS_BH_MT64x64x4_SE_PGR0_PLR1_TT4_4
    SolutionIndex: 68
    SolutionNameMin: Cijk_Ailk_Bljk_HSS_BH_MT128x128x4_SE_PGR1_PLR1_TT8_8
    SolutionIndex: 69
    SolutionNameMin: Cijk_Ailk_Bljk_HSS_BH_MT64x64x4_SE_PGR1_PLR1_TT4_4
    SolutionIndex: 70
    SolutionNameMin: Cijk_Ailk_Bljk_HSS_BH_MT64x128x8_SE_PGR0_PLR0_TT4_8
    SolutionIndex: 71
    SolutionNameMin: Cijk_Ailk_Bljk_HSS_BH_MT64x64x8_SE_PGR0_PLR0_TT4_4
    SolutionIndex: 72
    SolutionNameMin: Cijk_Ailk_Bljk_HSS_BH_MT64x64x8_SE_PGR1_PLR0_TT4_4
    SolutionIndex: 73
    SolutionNameMin: Cijk_Ailk_Bljk_HSS_BH_MT64x128x8_SE_PGR0_PLR1_TT4_8
    SolutionIndex: 74
    SolutionNameMin: Cijk_Ailk_Bljk_HSS_BH_MT64x64x8_SE_PGR0_PLR1_TT4_4
    SolutionIndex: 75
    SolutionNameMin: Cijk_Ailk_Bljk_HSS_BH_MT64x64x8_SE_PGR1_PLR1_TT4_4
    SolutionIndex: 76
    SolutionNameMin: Cijk_Ailk_Bljk_HSS_BH_MT64x64x16_SE_PGR1_PLR0_TT4_4
    SolutionIndex: 77
    SolutionNameMin: Cijk_Ailk_Bljk_HSS_BH_MT64x64x16_SE_PGR1_PLR1_TT4_4
    SolutionIndex: 78
    SolutionNameMin: Cijk_Ailk_Bljk_HSS_BH_MT128x256x32_MI32x32x8x1_SE_AF0EM4_GRVW8_LBSPP128_LPB8_NLCA1_SU16_SUS128_SRVW4_TT2_128_WG64_4_1_WGM2
    SolutionIndex: 79
    SolutionNameMin: Cijk_Ailk_Bljk_HSS_BH_MT128x256x32_MI32x32x8x1_SE_AF0EM4_GRVW8_LBSPP128_LPB8_NLCA1_SU0_SUS128_SRVW4_TT2_128_WG64_4_1_WGM1
    SolutionIndex: 80
    SolutionNameMin: Cijk_Ailk_Bljk_HSS_BH_MT128x256x32_MI32x32x8x1_SE_AF0EM1_GRVW4_LBSPP128_LPB4_NLCA1_SU16_SUS128_SRVW4_TT2_128_WG64_4_1_WGM1
    SolutionIndex: 81
    SolutionNameMin: Cijk_Ailk_Bljk_HSS_BH_MT64x128x64_MI32x32x8x1_SE_AF0EM4_GRVW8_LBSPP128_LPB8_NLCA1_SU32_SUS256_SRVW4_TT1_64_WG64_4_1_WGM2
    SolutionIndex: 82
    SolutionNameMin: Cijk_Ailk_Bljk_HSS_BH_MT32x64x128_MI16x16x16x1_SE_AF0EM4_GRVW8_LBSPP256_LPB8_NLCA1_SU16_SUS256_SRVW0_TT1_32_WG32_8_1_WGM2
    SolutionIndex: 83
    SolutionNameMin: Cijk_Ailk_Bljk_HSS_BH_MT128x256x32_MI32x32x8x1_SE_AF0EM1_GRVW8_LBSPP128_LPB8_NLCA1_SU16_SUS128_SRVW4_TT2_128_WG64_4_1_WGM2
    SolutionIndex: 84
    SolutionNameMin: Cijk_Ailk_Bljk_HSS_BH_MT256x128x32_MI32x32x8x1_SE_AF0EM1_GRVW8_LBSPP128_LPB8_NLCA1_SU0_SUS256_SRVW0_TT4_64_WG64_4_1_WGM15
    SolutionIndex: 85
    SolutionNameMin: Cijk_Ailk_Bljk_HSS_BH_MT128x64x64_MI32x32x8x1_SE_AF0EM4_GRVW8_LBSPP128_LPB8_NLCA1_SU0_SUS256_SRVW4_TT2_32_WG64_4_1_WGM15
    SolutionIndex: 86
    SolutionNameMin: Cijk_Ailk_Bljk_HSS_BH_MT64x32x128_MI16x16x16x1_SE_AF0EM1_GRVW2_LBSPP256_LPB4_NLCA1_SU0_SUS256_SRVW0_TT2_16_WG32_8_1_WGM1
    SolutionIndex: 87
    SolutionNameMin: Cijk_Ailk_Bljk_HSS_BH_MT128x288x32_MI32x32x8x1_SE_AF0EM4_GRVW4_LBSPP128_LPB4_NLCA1_SU0_SUS256_SRVW4_TT1_288_WG128_2_1_WGM1
    SolutionIndex: 88
    SolutionNameMin: Cijk_Ailk_Bljk_HSS_BH_MT256x144x32_MI16x16x16x1_SE_AF0EM4_GRVW2_LBSPP128_LPB4_NLCA2_SU0_SUS256_SRVW4_TT4_144_WG64_4_1_WGM2
    SolutionIndex: 89
    SolutionNameMin: Cijk_Ailk_Bljk_HSS_BH_MT128x80x64_MI16x16x16x1_SE_AF0EM4_GRVW2_LBSPP128_LPB4_NLCA1_SU16_SUS256_SRVW4_TT2_80_WG64_4_1_WGM2
    SolutionIndex: 90
    SolutionNameMin: Cijk_Ailk_Bljk_HSS_BH_MT32x64x64_MI16x16x16x1_SE_AF0EM1_GRVW2_LBSPP128_LPB4_NLCA1_SU16_SUS256_SRVW4_TT1_32_WG32_8_1_WGM2
    SolutionIndex: 91
    SolutionNameMin: Cijk_Ailk_Bljk_HSS_BH_MT64x80x64_MI16x16x16x1_SE_AF0EM4_GRVW2_LBSPP128_LPB4_NLCA1_SU16_SUS128_SRVW0_TT1_80_WG64_4_1_WGM2
    SolutionIndex: 92
    SolutionNameMin: Cijk_Ailk_Bljk_HSS_BH_MT64x128x64_MI32x32x8x1_SE_AF0EM4_GRVW8_LBSPP128_LPB8_NLCA1_SU0_SUS256_SRVW4_TT1_64_WG64_4_1_WGM1
    SolutionIndex: 93
    SolutionNameMin: Cijk_Ailk_Bljk_HSS_BH_MT32x32x128_MI16x16x16x1_SE_AF0EM4_GRVW8_LBSPP256_LPB8_NLCA1_SU0_SUS256_SRVW0_TT1_16_WG32_8_1_WGM1
    SolutionIndex: 94
    SolutionNameMin: Cijk_Ailk_Bljk_HSS_BH_MT32x32x128_MI16x16x16x1_SE_AF0EM4_GRVW8_LBSPP256_LPB8_NLCA1_SU0_SUS256_SRVW0_TT1_16_WG32_8_1_WGM15
    SolutionIndex: 95
    SolutionNameMin: Cijk_Ailk_Bljk_HSS_BH_MT32x32x128_MI16x16x16x1_SE_AF0EM4_GRVW8_LBSPP256_LPB8_NLCA1_SU32_SUS256_SRVW0_TT1_16_WG32_8_1_WGM1
    SolutionIndex: 96
    SolutionNameMin: Cijk_Ailk_Bljk_HSS_BH_MT64x64x32_MI32x32x8x1_SE_AF0EM1_GRVW8_LBSPP128_LPB8_NLCA1_SU0_SUS128_SRVW4_TT1_32_WG64_4_1_WGM1
    SolutionIndex: 97
    SolutionNameMin: Cijk_Ailk_Bljk_HSS_BH_MT64x80x64_MI16x16x16x1_SE_AF0EM4_GRVW2_LBSPP128_LPB4_NLCA1_SU0_SUS128_SRVW4_TT1_80_WG64_4_1_WGM15
    SolutionIndex: 98
    SolutionNameMin: Cijk_Ailk_Bljk_HSS_BH_MT64x80x64_MI16x16x16x1_SE_AF0EM4_GRVW2_LBSPP128_LPB4_NLCA1_SU16_SUS256_SRVW0_TT1_80_WG64_4_1_WGM15
    SolutionIndex: 99
    SolutionNameMin: Cijk_Ailk_Bljk_HSS_BH_MT64x128x64_MI32x32x8x1_SE_AF0EM4_GRVW8_LBSPP128_LPB8_NLCA1_SU32_SUS128_SRVW4_TT1_64_WG64_4_1_WGM2
    SolutionIndex: 100
    SolutionNameMin: Cijk_Ailk_Bljk_HSS_BH_MT128x288x32_MI32x32x8x1_SE_AF0EM4_GRVW4_LBSPP128_LPB4_NLCA1_SU0_SUS256_SRVW4_TT1_288_WG128_2_1_WGM2
    SolutionIndex: 101
    SolutionNameMin: Cijk_Ailk_Bljk_HSS_BH_MT256x144x32_MI16x16x16x1_SE_AF0EM4_GRVW2_LBSPP128_LPB4_NLCA2_SU0_SUS256_SRVW0_TT4_144_WG64_4_1_WGM15
    SolutionIndex: 102
    SolutionNameMin: Cijk_Ailk_Bljk_HSS_BH_MT256x144x32_MI16x16x16x1_SE_AF0EM4_GRVW2_LBSPP128_LPB4_NLCA2_SU0_SUS128_SRVW4_TT4_144_WG64_4_1_WGM15
    SolutionIndex: 103
    SolutionNameMin: Cijk_Ailk_Bljk_HSS_BH_MT160x128x32_MI32x32x8x1_SE_AF0EM4_GRVW4_LBSPP128_LPB4_NLCA5_SU16_SUS256_SRVW0_TT5_32_WG32_8_1_WGM1
    SolutionIndex: 104
    SolutionNameMin: Cijk_Ailk_Bljk_HSS_BH_MT128x256x32_MI32x32x8x1_SE_AF0EM4_GRVW8_LBSPP128_LPB8_NLCA1_SU32_SUS128_SRVW4_TT2_128_WG64_4_1_WGM1
    SolutionIndex: 105
    SolutionNameMin: Cijk_Ailk_Bljk_HSS_BH_MT64x128x32_MI32x32x8x1_SE_AF0EM4_GRVW2_LBSPP128_LPB4_NLCA1_SU16_SUS128_SRVW4_TT1_64_WG64_4_1_WGM1
    SolutionIndex: 106
    SolutionNameMin: Cijk_Ailk_Bljk_HSS_BH_MT64x128x32_MI32x32x8x1_SE_AF0EM4_GRVW8_LBSPP128_LPB8_NLCA1_SU0_SUS256_SRVW4_TT1_64_WG64_4_1_WGM1
    SolutionIndex: 107
    SolutionNameMin: Cijk_Ailk_Bljk_HSS_BH_MT32x32x32_MI16x16x16x1_SE_AF0EM4_GRVW4_LBSPP128_LPB4_NLCA1_SU0_SUS256_SRVW0_TT1_16_WG32_8_1_WGM1
    SolutionIndex: 108
    SolutionNameMin: Cijk_Ailk_Bljk_HSS_BH_MT32x64x128_MI16x16x16x1_SE_AF0EM4_GRVW8_LBSPP256_LPB8_NLCA1_SU16_SUS256_SRVW0_TT1_32_WG32_8_1_WGM15
    SolutionIndex: 109
    SolutionNameMin: Cijk_Ailk_Bljk_HSS_BH_MT64x32x128_MI16x16x16x1_SE_AF0EM4_GRVW8_LBSPP256_LPB8_NLCA1_SU0_SUS256_SRVW0_TT2_16_WG32_8_1_WGM15
    SolutionIndex: 110
    SolutionNameMin: Cijk_Ailk_Bljk_HSS_BH_MT64x80x32_MI16x16x16x1_SE_AF0EM4_GRVW2_LBSPP128_LPB4_NLCA1_SU0_SUS256_SRVW0_TT1_80_WG64_4_1_WGM2
    SolutionIndex: 111
    SolutionNameMin: Cijk_Ailk_Bljk_HSS_BH_MT128x80x64_MI16x16x16x1_SE_AF0EM4_GRVW2_LBSPP128_LPB4_NLCA1_SU0_SUS128_SRVW4_TT2_80_WG64_4_1_WGM15
    SolutionIndex: 112
    SolutionNameMin: Cijk_Ailk_Bljk_HSS_BH_MT64x128x32_MI32x32x8x1_SE_AF0EM4_GRVW4_LBSPP128_LPB4_NLCA1_SU0_SUS256_SRVW4_TT1_64_WG64_4_1_WGM2
    SolutionIndex: 113
    SolutionNameMin: Cijk_Ailk_Bljk_HSS_BH_MT128x96x64_MI32x32x8x1_SE_AF0EM4_GRVW2_LBSPP128_LPB4_NLCA1_SU32_SUS256_SRVW4_TT1_96_WG128_2_1_WGM15
    SolutionIndex: 114
    SolutionNameMin: Cijk_Ailk_Bljk_HSS_BH_MT128x96x64_MI32x32x8x1_SE_AF0EM1_GRVW2_LBSPP128_LPB4_NLCA1_SU0_SUS128_SRVW4_TT1_96_WG128_2_1_WGM1
    SolutionIndex: 115
    SolutionNameMin: Cijk_Ailk_Bljk_HSS_BH_MT128x256x32_MI32x32x8x1_SE_AF0EM4_GRVW8_LBSPP128_LPB8_NLCA1_SU32_SUS256_SRVW4_TT2_128_WG64_4_1_WGM1
    SolutionIndex: 116
    SolutionNameMin: Cijk_Ailk_Bljk_HSS_BH_MT64x128x32_MI32x32x8x1_SE_AF0EM4_GRVW2_LBSPP128_LPB4_NLCA1_SU32_SUS128_SRVW4_TT1_64_WG64_4_1_WGM15
    SolutionIndex: 117
    SolutionNameMin: Cijk_Ailk_Bljk_HSS_BH_MT32x32x32_MI16x16x16x1_SE_AF0EM4_GRVW8_LBSPP128_LPB8_NLCA1_SU0_SUS256_SRVW0_TT1_16_WG32_8_1_WGM15
    SolutionIndex: 118
    SolutionNameMin: Cijk_Ailk_Bljk_HSS_BH_MT32x32x128_MI16x16x16x1_SE_AF0EM4_GRVW4_LBSPP256_LPB4_NLCA1_SU32_SUS256_SRVW0_TT1_16_WG32_8_1_WGM15
    SolutionIndex: 119
    SolutionNameMin: Cijk_Ailk_Bljk_HSS_BH_MT64x128x64_MI32x32x8x1_SE_AF0EM4_GRVW4_LBSPP128_LPB4_NLCA1_SU0_SUS128_SRVW4_TT1_64_WG64_4_1_WGM15
    SolutionIndex: 120
    SolutionNameMin: Cijk_Ailk_Bljk_HSS_BH_MT128x96x32_MI32x32x8x1_SE_AF0EM4_GRVW4_LBSPP128_LPB4_NLCA1_SU0_SUS256_SRVW4_TT1_96_WG128_2_1_WGM15
    SolutionIndex: 121
    SolutionNameMin: Cijk_Ailk_Bljk_HSS_BH_MT128x96x32_MI32x32x8x1_SE_AF0EM4_GRVW2_LBSPP128_LPB4_NLCA1_SU0_SUS128_SRVW4_TT1_96_WG128_2_1_WGM15
    SolutionIndex: 122
    SolutionNameMin: Cijk_Ailk_Bljk_HSS_BH_MT256x128x32_MI32x32x4x2_SE_AF0EM4_GRVW8_LBSPP128_LPB8_NLCA1_SU0_SUS128_SRVW0_TT2_64_WG128_2_1_WGM15
    SolutionIndex: 123
    SolutionNameMin: Cijk_Ailk_Bljk_HSS_BH_MT256x144x32_MI16x16x16x1_SE_AF0EM4_GRVW2_LBSPP128_LPB4_NLCA2_SU32_SUS256_SRVW4_TT4_144_WG64_4_1_WGM2
    SolutionIndex: 124
    SolutionNameMin: Cijk_Ailk_Bljk_HSS_BH_MT64x80x32_MI16x16x16x1_SE_AF0EM4_GRVW2_LBSPP128_LPB4_NLCA1_SU0_SUS256_SRVW0_TT1_80_WG64_4_1_WGM1
    SolutionIndex: 125
    SolutionNameMin: Cijk_Ailk_Bljk_HSS_BH_MT32x32x32_MI16x16x16x1_SE_AF0EM4_GRVW2_LBSPP128_LPB4_NLCA1_SU0_SUS128_SRVW0_TT1_16_WG32_8_1_WGM1
    SolutionIndex: 126
    SolutionNameMin: Cijk_Ailk_Bljk_HSS_BH_MT64x64x64_MI32x32x8x1_SE_AF0EM4_GRVW8_LBSPP128_LPB8_NLCA1_SU16_SUS128_SRVW4_TT1_32_WG64_4_1_WGM2
    SolutionIndex: 127
    SolutionNameMin: Cijk_Ailk_Bljk_HSS_BH_MT128x144x32_MI16x16x16x1_SE_AF0EM4_GRVW2_LBSPP128_LPB4_NLCA1_SU0_SUS256_SRVW4_TT2_144_WG64_4_1_WGM2
    SolutionIndex: 128
    SolutionNameMin: Cijk_Ailk_Bljk_HSS_BH_MT128x144x32_MI16x16x16x1_SE_AF0EM1_GRVW2_LBSPP128_LPB4_NLCA1_SU0_SUS256_SRVW4_TT2_144_WG64_4_1_WGM15
    SolutionIndex: 129
    SolutionNameMin: Cijk_Ailk_Bljk_HSS_BH_MT64x128x32_MI32x32x8x1_SE_AF0EM4_GRVW2_LBSPP128_LPB4_NLCA1_SU16_SUS128_SRVW4_TT1_64_WG64_4_1_WGM15
    SolutionIndex: 130
    SolutionNameMin: Cijk_Ailk_Bljk_HSS_BH_MT64x128x64_MI32x32x8x1_SE_AF0EM4_GRVW8_LBSPP128_LPB8_NLCA1_SU0_SUS256_SRVW4_TT1_64_WG64_4_1_WGM15
    SolutionIndex: 131
    SolutionNameMin: Cijk_Ailk_Bljk_HSS_BH_MT64x128x32_MI32x32x8x1_SE_AF0EM4_GRVW4_LBSPP128_LPB4_NLCA1_SU0_SUS128_SRVW4_TT1_64_WG64_4_1_WGM2
    SolutionIndex: 132
    SolutionNameMin: Cijk_Ailk_Bljk_HSS_BH_MT256x128x32_MI32x32x4x2_SE_AF0EM1_GRVW8_LBSPP128_LPB8_NLCA1_SU0_SUS256_SRVW0_TT2_64_WG128_2_1_WGM15
    SolutionIndex: 133
    SolutionNameMin: Cijk_Ailk_Bljk_HSS_BH_MT64x128x32_MI32x32x8x1_SE_AF0EM4_GRVW2_LBSPP128_LPB4_NLCA1_SU0_SUS128_SRVW4_TT1_64_WG64_4_1_WGM2
    SolutionIndex: 134
    SolutionNameMin: Cijk_Ailk_Bljk_HSS_BH_MT32x32x128_MI16x16x16x1_SE_AF0EM4_GRVW8_LBSPP256_LPB8_NLCA1_SU32_SUS256_SRVW0_TT1_16_WG32_8_1_WGM2
    SolutionIndex: 135
    SolutionNameMin: Cijk_Ailk_Bljk_HSS_BH_MT128x96x64_MI32x32x8x1_SE_AF0EM4_GRVW8_LBSPP128_LPB8_NLCA1_SU32_SUS128_SRVW4_TT1_96_WG128_2_1_WGM2
    SolutionIndex: 136
    SolutionNameMin: Cijk_Ailk_Bljk_HSS_BH_MT128x256x32_MI32x32x8x1_SE_AF0EM4_GRVW8_LBSPP128_LPB8_NLCA1_SU32_SUS128_SRVW4_TT2_128_WG64_4_1_WGM2
    SolutionIndex: 137
    SolutionNameMin: Cijk_Ailk_Bljk_HSS_BH_MT64x128x64_MI32x32x4x2_SE_AF0EM4_GRVW8_LBSPP128_LPB8_NLCA1_SU16_SUS256_SRVW4_TT1_32_WG64_4_1_WGM1
    SolutionIndex: 138
    SolutionNameMin: Cijk_Ailk_Bljk_HSS_BH_MT32x32x128_MI16x16x16x1_SE_AF0EM4_GRVW8_LBSPP256_LPB8_NLCA1_SU16_SUS256_SRVW0_TT1_16_WG32_8_1_WGM1
    SolutionIndex: 139
    SolutionNameMin: Cijk_Ailk_Bljk_HSS_BH_MT64x64x64_MI32x32x8x1_SE_AF0EM4_GRVW2_LBSPP128_LPB4_NLCA1_SU0_SUS256_SRVW4_TT1_32_WG64_4_1_WGM15
    SolutionIndex: 140
    SolutionNameMin: Cijk_Ailk_Bljk_HSS_BH_MT128x96x32_MI32x32x8x1_SE_AF0EM4_GRVW4_LBSPP128_LPB4_NLCA1_SU32_SUS256_SRVW4_TT1_96_WG128_2_1_WGM1
    SolutionIndex: 141
    SolutionNameMin: Cijk_Ailk_Bljk_HSS_BH_MT128x96x64_MI32x32x8x1_SE_AF0EM4_GRVW8_LBSPP128_LPB8_NLCA1_SU0_SUS256_SRVW4_TT1_96_WG128_2_1_WGM15
    SolutionIndex: 142
    SolutionNameMin: Cijk_Ailk_Bljk_HSS_BH_MT128x256x32_MI32x32x8x1_SE_AF0EM1_GRVW8_LBSPP128_LPB8_NLCA1_SU16_SUS256_SRVW4_TT2_128_WG64_4_1_WGM2
    SolutionIndex: 143
    SolutionNameMin: Cijk_Ailk_Bljk_HSS_BH_MT32x32x32_MI16x16x16x1_SE_AF0EM4_GRVW8_LBSPP128_LPB8_NLCA1_SU0_SUS128_SRVW0_TT1_16_WG32_8_1_WGM1
    SolutionIndex: 144
    SolutionNameMin: Cijk_Ailk_Bljk_HSS_BH_MT32x32x128_MI16x16x16x1_SE_AF0EM4_GRVW8_LBSPP256_LPB8_NLCA1_SU32_SUS256_SRVW0_TT1_16_WG32_8_1_WGM15
    SolutionIndex: 145
    SolutionNameMin: Cijk_Ailk_Bljk_HSS_BH_MT64x128x32_MI32x32x8x1_SE_AF0EM4_GRVW8_LBSPP128_LPB8_NLCA1_SU0_SUS256_SRVW4_TT1_64_WG64_4_1_WGM15
    SolutionIndex: 146
    SolutionNameMin: Cijk_Ailk_Bljk_HSS_BH_MT128x256x32_MI32x32x8x1_SE_AF0EM4_GRVW8_LBSPP128_LPB8_NLCA1_SU0_SUS128_SRVW4_TT2_128_WG64_4_1_WGM15
    SolutionIndex: 147
    SolutionNameMin: Cijk_Ailk_Bljk_HSS_BH_MT256x128x32_MI32x32x4x2_SE_AF0EM4_GRVW8_LBSPP128_LPB8_NLCA1_SU16_SUS128_SRVW0_TT2_64_WG128_2_1_WGM15
    SolutionIndex: 148
    SolutionNameMin: Cijk_Ailk_Bljk_HSS_BH_MT128x288x32_MI32x32x8x1_SE_AF0EM4_GRVW4_LBSPP128_LPB4_NLCA1_SU16_SUS256_SRVW4_TT1_288_WG128_2_1_WGM2
    SolutionIndex: 149
    SolutionNameMin: Cijk_Ailk_Bljk_HSS_BH_MT64x128x32_MI32x32x8x1_SE_AF0EM4_GRVW4_LBSPP128_LPB4_NLCA1_SU16_SUS256_SRVW4_TT1_64_WG64_4_1_WGM1
    SolutionIndex: 150
    SolutionNameMin: Cijk_Ailk_Bljk_HSS_BH_MT32x32x128_MI16x16x16x1_SE_AF0EM4_GRVW8_LBSPP256_LPB8_NLCA1_SU16_SUS256_SRVW4_TT1_16_WG32_8_1_WGM1
    SolutionIndex: 151
    SolutionNameMin: Cijk_Ailk_Bljk_HSS_BH_MT32x64x128_MI16x16x16x1_SE_AF0EM4_GRVW8_LBSPP256_LPB8_NLCA1_SU32_SUS256_SRVW0_TT1_32_WG32_8_1_WGM1
    SolutionIndex: 152
    SolutionNameMin: Cijk_Ailk_Bljk_HSS_BH_MT64x128x32_MI32x32x8x1_SE_AF0EM4_GRVW8_LBSPP128_LPB8_NLCA1_SU16_SUS256_SRVW4_TT1_64_WG64_4_1_WGM15
    SolutionIndex: 153
    SolutionNameMin: Cijk_Ailk_Bljk_HSS_BH_MT128x96x64_MI32x32x8x1_SE_AF0EM1_GRVW4_LBSPP128_LPB4_NLCA1_SU16_SUS128_SRVW4_TT1_96_WG128_2_1_WGM15
    SolutionIndex: 154
    SolutionNameMin: Cijk_Ailk_Bljk_HSS_BH_MT128x96x32_MI32x32x8x1_SE_AF0EM4_GRVW4_LBSPP128_LPB4_NLCA1_SU32_SUS256_SRVW4_TT1_96_WG128_2_1_WGM2
    SolutionIndex: 155
    SolutionNameMin: Cijk_Ailk_Bljk_HSS_BH_MT128x96x32_MI32x32x8x1_SE_AF0EM4_GRVW2_LBSPP128_LPB4_NLCA1_SU32_SUS256_SRVW4_TT1_96_WG128_2_1_WGM15
    SolutionIndex: 156
    SolutionNameMin: Cijk_Ailk_Bljk_HSS_BH_MT128x288x32_MI32x32x8x1_SE_AF0EM1_GRVW2_LBSPP128_LPB4_NLCA1_SU0_SUS128_SRVW4_TT1_288_WG128_2_1_WGM15
    SolutionIndex: 157
    SolutionNameMin: Cijk_Ailk_Bljk_HSS_BH_MT256x144x32_MI16x16x16x1_SE_AF0EM4_GRVW2_LBSPP128_LPB4_NLCA2_SU16_SUS128_SRVW4_TT4_144_WG64_4_1_WGM2
    SolutionIndex: 158
    SolutionNameMin: Cijk_Ailk_Bljk_HSS_BH_MT256x144x32_MI16x16x16x1_SE_AF0EM4_GRVW2_LBSPP128_LPB4_NLCA2_SU0_SUS256_SRVW4_TT4_144_WG64_4_1_WGM1
    SolutionIndex: 159
    SolutionNameMin: Cijk_Ailk_Bljk_HSS_BH_MT256x144x32_MI16x16x16x1_SE_AF0EM4_GRVW2_LBSPP128_LPB4_NLCA2_SU0_SUS128_SRVW4_TT4_144_WG64_4_1_WGM1
    SolutionIndex: 160
    SolutionNameMin: Cijk_Ailk_Bljk_HSS_BH_MT32x32x32_MI16x16x16x1_SE_AF0EM4_GRVW4_LBSPP128_LPB4_NLCA1_SU0_SUS128_SRVW0_TT1_16_WG32_8_1_WGM1
    SolutionIndex: 161
    SolutionNameMin: Cijk_Ailk_Bljk_HSS_BH_MT256x144x32_MI16x16x16x1_SE_AF0EM4_GRVW2_LBSPP128_LPB4_NLCA2_SU0_SUS128_SRVW0_TT4_144_WG64_4_1_WGM15
    SolutionIndex: 162
    SolutionNameMin: Cijk_Ailk_Bljk_HSS_BH_MT160x128x32_MI32x32x8x1_SE_AF0EM1_GRVW4_LBSPP128_LPB4_NLCA5_SU0_SUS128_SRVW0_TT5_32_WG32_8_1_WGM1
    SolutionIndex: 163
    SolutionNameMin: Cijk_Ailk_Bljk_HSS_BH_MT64x32x32_MI16x16x16x1_SE_AF0EM4_GRVW2_LBSPP128_LPB4_NLCA1_SU0_SUS128_SRVW0_TT2_16_WG32_8_1_WGM1
    SolutionIndex: 164
    SolutionNameMin: Cijk_Ailk_Bljk_HSS_BH_MT256x144x32_MI16x16x16x1_SE_AF0EM4_GRVW2_LBSPP128_LPB4_NLCA2_SU0_SUS256_SRVW4_TT4_144_WG64_4_1_WGM15
    SolutionIndex: 165
    SolutionNameMin: Cijk_Ailk_Bljk_HSS_BH_MT128x256x32_MI32x32x8x1_SE_AF0EM4_GRVW8_LBSPP128_LPB8_NLCA1_SU0_SUS256_SRVW4_TT2_128_WG64_4_1_WGM1
    SolutionIndex: 166
    SolutionNameMin: Cijk_Ailk_Bljk_HSS_BH_MT128x256x32_MI32x32x8x1_SE_AF0EM4_GRVW8_LBSPP128_LPB8_NLCA1_SU0_SUS256_SRVW4_TT2_128_WG64_4_1_WGM15
    SolutionIndex: 167
    SolutionNameMin: Cijk_Ailk_Bljk_HSS_BH_MT256x128x32_MI32x32x8x1_SE_AF0EM4_GRVW8_LBSPP128_LPB8_NLCA1_SU0_SUS256_SRVW0_TT4_64_WG64_4_1_WGM15
    SolutionIndex: 168
    SolutionNameMin: Cijk_Ailk_Bljk_HSS_BH_MT128x256x32_MI32x32x8x1_SE_AF0EM1_GRVW8_LBSPP128_LPB8_NLCA1_SU0_SUS256_SRVW4_TT2_128_WG64_4_1_WGM15
    SolutionIndex: 169
    SolutionNameMin: Cijk_Ailk_Bljk_HSS_BH_MT256x128x32_MI32x32x4x2_SE_AF0EM1_GRVW8_LBSPP128_LPB8_NLCA1_SU0_SUS128_SRVW0_TT2_64_WG128_2_1_WGM15
    SolutionIndex: 170
    SolutionNameMin: Cijk_Ailk_Bljk_HSS_BH_MT256x128x32_MI32x32x8x1_SE_AF0EM1_GRVW8_LBSPP128_LPB8_NLCA1_SU0_SUS128_SRVW0_TT4_64_WG64_4_1_WGM15
    SolutionIndex: 171
    SolutionNameMin: Cijk_Ailk_Bljk_HSS_BH_MT256x128x32_MI32x32x4x2_SE_AF0EM4_GRVW8_LBSPP128_LPB8_NLCA1_SU0_SUS256_SRVW0_TT2_64_WG128_2_1_WGM15
    SolutionIndex: 172
    SolutionNameMin: Cijk_Ailk_Bljk_HSS_BH_MT256x128x32_MI32x32x4x2_SE_AF0EM1_GRVW4_LBSPP128_LPB4_NLCA1_SU0_SUS256_SRVW0_TT2_64_WG128_2_1_WGM15
    SolutionIndex: 173
    SolutionNameMin: Cijk_Ailk_Bljk_HSS_BH_MT256x144x32_MI16x16x16x1_SE_AF0EM1_GRVW2_LBSPP128_LPB4_NLCA2_SU0_SUS128_SRVW4_TT4_144_WG64_4_1_WGM15
    SolutionIndex: 174
    SolutionNameMin: Cijk_Ailk_Bljk_HSS_BH_MT256x144x32_MI16x16x16x1_SE_AF0EM1_GRVW2_LBSPP128_LPB4_NLCA2_SU0_SUS256_SRVW4_TT4_144_WG64_4_1_WGM15
    SolutionIndex: 175
    SolutionNameMin: Cijk_Ailk_Bljk_HSS_BH_MT256x128x32_MI32x32x4x2_SE_AF0EM4_GRVW8_LBSPP128_LPB8_NLCA1_SU0_SUS256_SRVW0_TT2_64_WG128_2_1_WGM2
    SolutionIndex: 176
    SolutionNameMin: Cijk_Ailk_Bljk_HSS_BH_MT128x256x32_MI32x32x8x1_SE_AF0EM4_GRVW4_LBSPP128_LPB4_NLCA1_SU0_SUS256_SRVW4_TT2_128_WG64_4_1_WGM15
    SolutionIndex: 177
    SolutionNameMin: Cijk_Ailk_Bljk_HSS_BH_MT128x256x32_MI32x32x8x1_SE_AF0EM1_GRVW2_LBSPP128_LPB4_NLCA1_SU16_SUS256_SRVW4_TT2_128_WG64_4_1_WGM2
    SolutionIndex: 178
    SolutionNameMin: Cijk_Ailk_Bljk_HSS_BH_MT256x144x32_MI16x16x16x1_SE_AF0EM1_GRVW2_LBSPP128_LPB4_NLCA2_SU0_SUS128_SRVW4_TT4_144_WG64_4_1_WGM1
    SolutionIndex: 179
    SolutionNameMin: Cijk_Ailk_Bljk_HSS_BH_MT64x32x32_MI16x16x16x1_SE_AF0EM4_GRVW2_LBSPP128_LPB4_NLCA1_SU0_SUS256_SRVW0_TT2_16_WG32_8_1_WGM1
    SolutionIndex: 180
    SolutionNameMin: Cijk_Ailk_Bljk_HSS_BH_MT64x32x32_MI16x16x16x1_SE_AF0EM4_GRVW4_LBSPP128_LPB4_NLCA1_SU0_SUS256_SRVW0_TT2_16_WG32_8_1_WGM2
    SolutionIndex: 181
    SolutionNameMin: Cijk_Ailk_Bljk_HSS_BH_MT64x32x32_MI16x16x16x1_SE_AF0EM4_GRVW2_LBSPP128_LPB4_NLCA1_SU16_SUS256_SRVW0_TT2_16_WG32_8_1_WGM1
    SolutionIndex: 182
    SolutionNameMin: Cijk_Ailk_Bljk_HSS_BH_MT64x64x32_MI32x32x8x1_SE_AF0EM4_GRVW2_LBSPP128_LPB4_NLCA1_SU0_SUS128_SRVW4_TT1_32_WG64_4_1_WGM2
    SolutionIndex: 183
    SolutionNameMin: Cijk_Ailk_Bljk_HSS_BH_MT64x64x32_MI32x32x8x1_SE_AF0EM4_GRVW8_LBSPP128_LPB8_NLCA1_SU0_SUS128_SRVW4_TT1_32_WG64_4_1_WGM15
    SolutionIndex: 184
    SolutionNameMin: Cijk_Ailk_Bljk_HSS_BH_MT32x32x128_MI16x16x16x1_SE_AF0EM4_GRVW8_LBSPP256_LPB8_NLCA1_SU0_SUS256_SRVW0_TT1_16_WG32_8_1_WGM2
    SolutionIndex: 185
    SolutionNameMin: Cijk_Ailk_Bljk_HSS_BH_MT32x32x32_MI16x16x16x1_SE_AF0EM4_GRVW2_LBSPP128_LPB4_NLCA1_SU0_SUS256_SRVW0_TT1_16_WG32_8_1_WGM15
    SolutionIndex: 186
    SolutionNameMin: Cijk_Ailk_Bljk_HSS_BH_MT32x32x64_MI16x16x16x1_SE_AF0EM4_GRVW4_LBSPP128_LPB4_NLCA1_SU0_SUS256_SRVW0_TT1_16_WG32_8_1_WGM15
    SolutionIndex: 187
    SolutionNameMin: Cijk_Ailk_Bljk_HSS_BH_MT32x32x128_MI16x16x16x1_SE_AF0EM4_GRVW8_LBSPP256_LPB8_NLCA1_SU16_SUS256_SRVW0_TT1_16_WG32_8_1_WGM2
    SolutionIndex: 188
    SolutionNameMin: Cijk_Ailk_Bljk_HSS_BH_MT32x32x128_MI16x16x16x1_SE_AF0EM1_GRVW8_LBSPP256_LPB8_NLCA1_SU16_SUS256_SRVW0_TT1_16_WG32_8_1_WGM2
    SolutionIndex: 189
    SolutionNameMin: Cijk_Ailk_Bljk_HSS_BH_MT128x80x64_MI16x16x16x1_SE_AF0EM4_GRVW2_LBSPP128_LPB4_NLCA1_SU0_SUS128_SRVW4_TT2_80_WG64_4_1_WGM1
    SolutionIndex: 190
    SolutionNameMin: Cijk_Ailk_Bljk_HSS_BH_MT64x128x64_MI32x32x8x1_SE_AF0EM4_GRVW8_LBSPP128_LPB8_NLCA1_SU32_SUS256_SRVW4_TT1_64_WG64_4_1_WGM15
    SolutionIndex: 191
    SolutionNameMin: Cijk_Ailk_Bljk_HSS_BH_MT64x128x64_MI32x32x8x1_SE_AF0EM4_GRVW8_LBSPP128_LPB8_NLCA1_SU16_SUS128_SRVW4_TT1_64_WG64_4_1_WGM1
    SolutionIndex: 192
    SolutionNameMin: Cijk_Ailk_Bljk_HSS_BH_MT64x32x32_MI16x16x16x1_SE_AF0EM4_GRVW2_LBSPP128_LPB4_NLCA1_SU0_SUS256_SRVW4_TT2_16_WG32_8_1_WGM1
    SolutionIndex: 193
    SolutionNameMin: Cijk_Ailk_Bljk_HSS_BH_MT128x128x32_MI32x32x8x1_SE_AF0EM4_GRVW4_LBSPP128_LPB4_NLCA1_SU0_SUS128_SRVW4_TT2_64_WG64_4_1_WGM15
    SolutionIndex: 194
    SolutionNameMin: Cijk_Ailk_Bljk_HSS_BH_MT32x64x32_MI16x16x16x1_SE_AF0EM4_GRVW2_LBSPP128_LPB4_NLCA1_SU0_SUS256_SRVW0_TT1_32_WG32_8_1_WGM15
    SolutionIndex: 195
    SolutionNameMin: Cijk_Ailk_Bljk_HSS_BH_MT64x32x32_MI16x16x16x1_SE_AF0EM4_GRVW8_LBSPP128_LPB8_NLCA1_SU0_SUS128_SRVW0_TT2_16_WG32_8_1_WGM1
    SolutionIndex: 196
    SolutionNameMin: Cijk_Ailk_Bljk_HSS_BH_MT32x32x128_MI16x16x16x1_SE_AF0EM1_GRVW8_LBSPP256_LPB8_NLCA1_SU32_SUS256_SRVW0_TT1_16_WG32_8_1_WGM1
    SolutionIndex: 197
    SolutionNameMin: Cijk_Ailk_Bljk_HSS_BH_MT32x32x128_MI16x16x16x1_SE_AF0EM1_GRVW8_LBSPP256_LPB8_NLCA1_SU16_SUS256_SRVW0_TT1_16_WG32_8_1_WGM1
    SolutionIndex: 198
    SolutionNameMin: Cijk_Ailk_Bljk_HSS_BH_MT32x32x128_MI16x16x16x1_SE_AF0EM1_GRVW8_LBSPP256_LPB8_NLCA1_SU0_SUS256_SRVW0_TT1_16_WG32_8_1_WGM15
    SolutionIndex: 199
    SolutionNameMin: Cijk_Ailk_Bljk_HSS_BH_MT128x96x32_MI32x32x8x1_SE_AF0EM4_GRVW4_LBSPP128_LPB4_NLCA1_SU0_SUS256_SRVW4_TT1_96_WG128_2_1_WGM2
    SolutionIndex: 200
    SolutionNameMin: Cijk_Ailk_Bljk_HSS_BH_MT128x160x32_MI32x32x8x1_SE_AF0EM4_GRVW4_LBSPP128_LPB4_NLCA1_SU0_SUS128_SRVW4_TT1_160_WG128_2_1_WGM15
    SolutionIndex: 201
    SolutionNameMin: Cijk_Ailk_Bljk_HSS_BH_MT128x160x32_MI32x32x8x1_SE_AF0EM1_GRVW4_LBSPP128_LPB4_NLCA1_SU0_SUS256_SRVW4_TT1_160_WG128_2_1_WGM2
    SolutionIndex: 202
    SolutionNameMin: Cijk_Ailk_Bljk_HSS_BH_MT128x160x32_MI32x32x8x1_SE_AF0EM1_GRVW4_LBSPP128_LPB4_NLCA1_SU16_SUS128_SRVW4_TT1_160_WG128_2_1_WGM15
    SolutionIndex: 203
    SolutionNameMin: Cijk_Ailk_Bljk_HSS_BH_MT128x160x32_MI32x32x8x1_SE_AF0EM1_GRVW4_LBSPP128_LPB4_NLCA1_SU32_SUS256_SRVW0_TT1_160_WG128_2_1_WGM15
    SolutionIndex: 204
    SolutionNameMin: Cijk_Ailk_Bljk_HSS_BH_MT128x160x32_MI32x32x8x1_SE_AF0EM4_GRVW4_LBSPP128_LPB4_NLCA1_SU16_SUS128_SRVW4_TT1_160_WG128_2_1_WGM2
    SolutionIndex: 205
    SolutionNameMin: Cijk_Ailk_Bljk_HSS_BH_MT128x160x32_MI32x32x8x1_SE_AF0EM1_GRVW4_LBSPP128_LPB4_NLCA1_SU0_SUS128_SRVW0_TT1_160_WG128_2_1_WGM15
    SolutionIndex: 206
    SolutionNameMin: Cijk_Ailk_Bljk_HSS_BH_MT128x160x32_MI32x32x8x1_SE_AF0EM1_GRVW4_LBSPP128_LPB4_NLCA1_SU16_SUS256_SRVW4_TT1_160_WG128_2_1_WGM15
    SolutionIndex: 207
    SolutionNameMin: Cijk_Ailk_Bljk_HSS_BH_MT128x160x32_MI32x32x8x1_SE_AF0EM4_GRVW4_LBSPP128_LPB4_NLCA1_SU32_SUS128_SRVW4_TT1_160_WG128_2_1_WGM2
    SolutionIndex: 208
    SolutionNameMin: Cijk_Ailk_Bljk_HSS_BH_MT128x160x32_MI32x32x8x1_SE_AF0EM1_GRVW4_LBSPP128_LPB4_NLCA1_SU16_SUS128_SRVW4_TT1_160_WG128_2_1_WGM2
    SolutionIndex: 209
    SolutionNameMin: Cijk_Ailk_Bljk_HSS_BH_MT64x64x64_MI32x32x8x1_SE_AF0EM1_GRVW2_LBSPP128_LPB4_NLCA1_SU32_SUS256_SRVW0_TT1_32_WG64_4_1_WGM15
    SolutionIndex: 210
    SolutionNameMin: Cijk_Ailk_Bljk_HSS_BH_MT256x144x32_MI16x16x16x1_SE_AF0EM4_GRVW2_LBSPP128_LPB4_NLCA2_SU32_SUS128_SRVW4_TT4_144_WG64_4_1_WGM15
    SolutionIndex: 211
    SolutionNameMin: Cijk_Ailk_Bljk_HSS_BH_MT32x32x128_MI16x16x16x1_SE_AF0EM4_GRVW2_LBSPP256_LPB4_NLCA1_SU16_SUS256_SRVW0_TT1_16_WG32_8_1_WGM15
    SolutionIndex: 212
    SolutionNameMin: Cijk_Ailk_Bljk_HSS_BH_MT32x64x128_MI16x16x16x1_SE_AF0EM4_GRVW8_LBSPP256_LPB8_NLCA1_SU16_SUS256_SRVW0_TT1_32_WG32_8_1_WGM1
    SolutionIndex: 213
    SolutionNameMin: Cijk_Ailk_Bljk_HSS_BH_MT64x64x32_MI32x32x8x1_SE_AF0EM4_GRVW8_LBSPP128_LPB8_NLCA1_SU0_SUS128_SRVW4_TT1_32_WG64_4_1_WGM1
    SolutionIndex: 214
    SolutionNameMin: Cijk_Ailk_Bljk_HSS_BH_MT64x64x32_MI32x32x8x1_SE_AF0EM4_GRVW4_LBSPP128_LPB4_NLCA1_SU32_SUS128_SRVW4_TT1_32_WG64_4_1_WGM15
    SolutionIndex: 215
    SolutionNameMin: Cijk_Ailk_Bljk_HSS_BH_MT128x80x32_MI16x16x16x1_SE_AF0EM4_GRVW2_LBSPP128_LPB4_NLCA1_SU16_SUS128_SRVW4_TT2_80_WG64_4_1_WGM1
    SolutionIndex: 216
    SolutionNameMin: Cijk_Ailk_Bljk_HSS_BH_MT128x128x32_MI32x32x8x1_SE_AF0EM4_GRVW8_LBSPP128_LPB8_NLCA1_SU32_SUS256_SRVW4_TT2_64_WG64_4_1_WGM15
    SolutionIndex: 217
    SolutionNameMin: Cijk_Ailk_Bljk_HSS_BH_MT128x144x32_MI16x16x16x1_SE_AF0EM4_GRVW2_LBSPP128_LPB4_NLCA1_SU16_SUS128_SRVW4_TT2_144_WG64_4_1_WGM15
    SolutionIndex: 218
    SolutionNameMin: Cijk_Ailk_Bljk_HSS_BH_MT64x128x32_MI32x32x8x1_SE_AF0EM1_GRVW8_LBSPP128_LPB8_NLCA1_SU16_SUS256_SRVW4_TT1_64_WG64_4_1_WGM2
    SolutionIndex: 219
    SolutionNameMin: Cijk_Ailk_Bljk_HSS_BH_MT128x256x32_MI32x32x8x1_SE_AF0EM1_GRVW8_LBSPP128_LPB8_NLCA1_SU32_SUS256_SRVW4_TT2_128_WG64_4_1_WGM15
    SolutionIndex: 220
    SolutionNameMin: Cijk_Ailk_Bljk_HSS_BH_MT128x256x32_MI32x32x8x1_SE_AF0EM4_GRVW8_LBSPP128_LPB8_NLCA1_SU16_SUS128_SRVW4_TT2_128_WG64_4_1_WGM15
    SolutionIndex: 221
    SolutionNameMin: Cijk_Ailk_Bljk_HSS_BH_MT128x288x32_MI32x32x8x1_SE_AF0EM4_GRVW4_LBSPP128_LPB4_NLCA1_SU16_SUS128_SRVW4_TT1_288_WG128_2_1_WGM2
    SolutionIndex: 222
    SolutionNameMin: Cijk_Ailk_Bljk_HSS_BH_MT128x96x32_MI32x32x8x1_SE_AF0EM4_GRVW4_LBSPP128_LPB4_NLCA1_SU16_SUS256_SRVW4_TT1_96_WG128_2_1_WGM15
    SolutionIndex: 223
    SolutionNameMin: Cijk_Ailk_Bljk_HSS_BH_MT128x96x32_MI32x32x8x1_SE_AF0EM4_GRVW4_LBSPP128_LPB4_NLCA1_SU0_SUS128_SRVW4_TT1_96_WG128_2_1_WGM15
    SolutionIndex: 224
    SolutionNameMin: Cijk_Ailk_Bljk_HSS_BH_MT128x256x32_MI32x32x8x1_SE_AF0EM4_GRVW8_LBSPP128_LPB8_NLCA1_SU32_SUS128_SRVW4_TT2_128_WG64_4_1_WGM15
    SolutionIndex: 225
    SolutionNameMin: Cijk_Ailk_Bljk_HSS_BH_MT128x256x32_MI32x32x8x1_SE_AF0EM4_GRVW8_LBSPP128_LPB8_NLCA1_SU16_SUS256_SRVW4_TT2_128_WG64_4_1_WGM15
    SolutionIndex: 226
    SolutionNameMin: Cijk_Ailk_Bljk_HSS_BH_MT128x256x32_MI32x32x8x1_SE_AF0EM1_GRVW8_LBSPP128_LPB8_NLCA1_SU16_SUS256_SRVW4_TT2_128_WG64_4_1_WGM15
    SolutionIndex: 227
    SolutionNameMin: Cijk_Ailk_Bljk_HSS_BH_MT128x96x32_MI32x32x8x1_SE_AF0EM4_GRVW2_LBSPP128_LPB4_NLCA1_SU0_SUS256_SRVW4_TT1_96_WG128_2_1_WGM15
    SolutionIndex: 228
    SolutionNameMin: Cijk_Ailk_Bljk_HSS_BH_MT128x96x32_MI32x32x8x1_SE_AF0EM4_GRVW4_LBSPP128_LPB4_NLCA1_SU32_SUS128_SRVW4_TT1_96_WG128_2_1_WGM2
    SolutionIndex: 229
    SolutionNameMin: Cijk_Ailk_Bljk_HSS_BH_MT128x256x32_MI32x32x8x1_SE_AF0EM1_GRVW8_LBSPP128_LPB8_NLCA1_SU16_SUS128_SRVW4_TT2_128_WG64_4_1_WGM1
    SolutionIndex: 230
    SolutionNameMin: Cijk_Ailk_Bljk_HSS_BH_MT128x256x32_MI32x32x8x1_SE_AF0EM4_GRVW8_LBSPP128_LPB8_NLCA1_SU16_SUS128_SRVW4_TT2_128_WG64_4_1_WGM1
    SolutionIndex: 231
    SolutionNameMin: Cijk_Ailk_Bljk_HSS_BH_MT128x256x32_MI32x32x8x1_SE_AF0EM4_GRVW8_LBSPP128_LPB8_NLCA1_SU32_SUS256_SRVW4_TT2_128_WG64_4_1_WGM15
    SolutionIndex: 232
    SolutionNameMin: Cijk_Ailk_Bljk_HSS_BH_MT128x256x32_MI32x32x8x1_SE_AF0EM1_GRVW8_LBSPP128_LPB8_NLCA1_SU32_SUS128_SRVW4_TT2_128_WG64_4_1_WGM1
    SolutionIndex: 233
    SolutionNameMin: Cijk_Ailk_Bljk_HSS_BH_MT64x128x64_MI32x32x8x1_SE_AF0EM4_GRVW4_LBSPP128_LPB4_NLCA1_SU16_SUS128_SRVW4_TT1_64_WG64_4_1_WGM1
    SolutionIndex: 234
    SolutionNameMin: Cijk_Ailk_Bljk_HSS_BH_MT64x80x32_MI16x16x16x1_SE_AF0EM4_GRVW2_LBSPP128_LPB4_NLCA1_SU32_SUS128_SRVW0_TT1_80_WG64_4_1_WGM1
    SolutionIndex: 235
    SolutionNameMin: Cijk_Ailk_Bljk_HSS_BH_MT128x80x32_MI16x16x16x1_SE_AF0EM4_GRVW2_LBSPP128_LPB4_NLCA1_SU16_SUS256_SRVW0_TT2_80_WG64_4_1_WGM1
    SolutionIndex: 236
    SolutionNameMin: Cijk_Ailk_Bljk_HSS_BH_MT256x128x32_MI32x32x4x2_SE_AF0EM4_GRVW8_LBSPP128_LPB8_NLCA1_SU0_SUS256_SRVW0_TT2_64_WG128_2_1_WGM1
    SolutionIndex: 237
    SolutionNameMin: Cijk_Ailk_Bljk_HSS_BH_MT128x96x32_MI32x32x8x1_SE_AF0EM4_GRVW2_LBSPP128_LPB4_NLCA1_SU0_SUS256_SRVW4_TT1_96_WG128_2_1_WGM2
    SolutionIndex: 238
    SolutionNameMin: Cijk_Ailk_Bljk_HSS_BH_MT128x288x32_MI32x32x8x1_SE_AF0EM1_GRVW4_LBSPP128_LPB4_NLCA1_SU0_SUS256_SRVW4_TT1_288_WG128_2_1_WGM15
    SolutionIndex: 239
    SolutionNameMin: Cijk_Ailk_Bljk_HSS_BH_MT128x96x64_MI32x32x8x1_SE_AF0EM4_GRVW8_LBSPP128_LPB8_NLCA1_SU16_SUS128_SRVW4_TT1_96_WG128_2_1_WGM15
    SolutionIndex: 240
    SolutionNameMin: Cijk_Ailk_Bljk_HSS_BH_MT128x96x64_MI32x32x8x1_SE_AF0EM1_GRVW8_LBSPP128_LPB8_NLCA1_SU0_SUS256_SRVW4_TT1_96_WG128_2_1_WGM1
    SolutionIndex: 241
    SolutionNameMin: Cijk_Ailk_Bljk_HSS_BH_MT128x80x32_MI16x16x16x1_SE_AF0EM4_GRVW2_LBSPP128_LPB4_NLCA1_SU0_SUS256_SRVW4_TT2_80_WG64_4_1_WGM1
    SolutionIndex: 242
    SolutionNameMin: Cijk_Ailk_Bljk_HSS_BH_MT64x128x32_MI32x32x8x1_SE_AF0EM4_GRVW2_LBSPP128_LPB4_NLCA1_SU16_SUS256_SRVW4_TT1_64_WG64_4_1_WGM15
    SolutionIndex: 243
    SolutionNameMin: Cijk_Ailk_Bljk_HSS_BH_MT256x144x32_MI16x16x16x1_SE_AF0EM1_GRVW2_LBSPP128_LPB4_NLCA2_SU32_SUS128_SRVW4_TT4_144_WG64_4_1_WGM2
    SolutionIndex: 244
    SolutionNameMin: Cijk_Ailk_Bljk_HSS_BH_MT256x144x32_MI16x16x16x1_SE_AF0EM4_GRVW2_LBSPP128_LPB4_NLCA2_SU16_SUS128_SRVW4_TT4_144_WG64_4_1_WGM15
    SolutionIndex: 245
    SolutionNameMin: Cijk_Ailk_Bljk_HSS_BH_MT256x144x32_MI16x16x16x1_SE_AF0EM4_GRVW2_LBSPP128_LPB4_NLCA2_SU32_SUS128_SRVW4_TT4_144_WG64_4_1_WGM2
    SolutionIndex: 246
    SolutionNameMin: Cijk_Ailk_Bljk_HSS_BH_MT64x128x64_MI32x32x8x1_SE_AF0EM4_GRVW2_LBSPP128_LPB4_NLCA1_SU16_SUS256_SRVW4_TT1_64_WG64_4_1_WGM1
    SolutionIndex: 247
    SolutionNameMin: Cijk_Ailk_Bljk_HSS_BH_MT64x80x32_MI16x16x16x1_SE_AF0EM4_GRVW2_LBSPP128_LPB4_NLCA1_SU0_SUS256_SRVW4_TT1_80_WG64_4_1_WGM1
    SolutionIndex: 248
    SolutionNameMin: Cijk_Ailk_Bljk_HSS_BH_MT64x128x64_MI32x32x4x2_SE_AF0EM4_GRVW2_LBSPP128_LPB4_NLCA1_SU0_SUS128_SRVW4_TT1_32_WG64_4_1_WGM15
    SolutionIndex: 249
    SolutionNameMin: Cijk_Ailk_Bljk_HSS_BH_MT64x128x64_MI32x32x8x1_SE_AF0EM4_GRVW2_LBSPP128_LPB4_NLCA1_SU0_SUS256_SRVW4_TT1_64_WG64_4_1_WGM1
    SolutionIndex: 250
    SolutionNameMin: Cijk_Ailk_Bljk_HSS_BH_MT256x160x32_MI32x32x8x1_SE_GRVW4_PLR5_SU32_SUS128_SRVW4_WGM15
    SolutionIndex: 251
    SolutionNameMin: Cijk_Ailk_Bljk_HSS_BH_MT64x16x32_MI16x16x16x1_SE_GRVW4_PLR2_SU0_SUS256_SRVW0_WGM2
    SolutionIndex: 252
    SolutionNameMin: Cijk_Ailk_Bljk_HSS_BH_MT128x96x64_MI32x32x8x1_SE_GRVW8_PLR9_SU32_SUS128_SRVW0_WGM1
    SolutionIndex: 253
    SolutionNameMin: Cijk_Ailk_Bljk_HSS_BH_MT128x96x64_MI32x32x8x1_SE_GRVW8_PLR9_SU32_SUS256_SRVW0_WGM1
    SolutionIndex: 254
    SolutionNameMin: Cijk_Ailk_Bljk_HSS_BH_MT256x128x32_MI32x32x8x1_SE_GRVW2_PLR5_SU32_SUS128_SRVW0_WGM1
    SolutionIndex: 255
    SolutionNameMin: Cijk_Ailk_Bljk_HSS_BH_MT256x160x32_MI32x32x8x1_SE_GRVW4_PLR5_SU0_SUS256_SRVW4_WGM15
    SolutionIndex: 256
    SolutionNameMin: Cijk_Ailk_Bljk_HSS_BH_MT160x160x32_MI16x16x16x1_SE_GRVW4_PLR2_SU32_SUS256_SRVW0_WGM1
    SolutionIndex: 257
    SolutionNameMin: Cijk_Ailk_Bljk_HSS_BH_MT256x160x32_MI32x32x8x1_SE_GRVW4_PLR5_SU0_SUS128_SRVW0_WGM15
    SolutionIndex: 258
    SolutionNameMin: Cijk_Ailk_Bljk_HSS_BH_MT128x96x64_MI32x32x8x1_SE_GRVW2_PLR9_SU0_SUS128_SRVW4_WGM2
    SolutionIndex: 259
    SolutionNameMin: Cijk_Ailk_Bljk_HSS_BH_MT128x96x64_MI32x32x8x1_SE_GRVW2_PLR9_SU0_SUS256_SRVW4_WGM15
    SolutionIndex: 260
    SolutionNameMin: Cijk_Ailk_Bljk_HSS_BH_MT256x160x32_MI32x32x8x1_SE_GRVW4_PLR5_SU32_SUS128_SRVW0_WGM1
    SolutionIndex: 261
    SolutionNameMin: Cijk_Ailk_Bljk_HSS_BH_MT128x160x64_MI32x32x8x1_SE_GRVW2_PLR9_SU0_SUS128_SRVW4_WGM15
    SolutionIndex: 262
    SolutionNameMin: Cijk_Ailk_Bljk_HSS_BH_MT256x144x64_MI16x16x16x1_SE_GRVW4_PLR5_SU0_SUS128_SRVW0_WGM1
    SolutionIndex: 263
    SolutionNameMin: Cijk_Ailk_Bljk_HSS_BH_MT128x128x64_MI32x32x8x1_SE_GRVW2_PLR9_SU32_SUS128_SRVW4_WGM1
    SolutionIndex: 264
    SolutionNameMin: Cijk_Ailk_Bljk_HSS_BH_MT128x96x64_MI32x32x8x1_SE_GRVW2_PLR9_SU0_SUS256_SRVW4_WGM2
    SolutionIndex: 265
    SolutionNameMin: Cijk_Ailk_Bljk_HSS_BH_MT160x160x64_MI16x16x16x1_SE_GRVW8_PLR5_SU0_SUS256_SRVW0_WGM15
    SolutionIndex: 266
    SolutionNameMin: Cijk_Ailk_Bljk_HSS_BH_MT32x32x32_MI16x16x16x1_SE_GRVW2_PLR2_SU0_SUS128_SRVW4_WGM1
    SolutionIndex: 267
    SolutionNameMin: Cijk_Ailk_Bljk_HSS_BH_MT256x256x32_MI32x32x8x1_SE_GRVW4_PLR5_SU32_SUS128_SRVW0_WGM1
    SolutionIndex: 268
    SolutionNameMin: Cijk_Ailk_Bljk_HSS_BH_MT64x128x32_MI32x32x8x1_SE_GRVW2_PLR5_SU0_SUS256_SRVW4_WGM1
    SolutionIndex: 269
    SolutionNameMin: Cijk_Ailk_Bljk_HSS_BH_MT256x256x32_MI32x32x8x1_SE_GRVW8_PLR5_SU32_SUS128_SRVW0_WGM1
    SolutionIndex: 270
    SolutionNameMin: Cijk_Ailk_Bljk_HSS_BH_MT128x160x64_MI32x32x8x1_SE_GRVW2_PLR9_SU0_SUS128_SRVW0_WGM1
    SolutionIndex: 271
    SolutionNameMin: Cijk_Ailk_Bljk_HSS_BH_MT256x128x32_MI32x32x8x1_SE_GRVW8_PLR5_SU0_SUS128_SRVW0_WGM1
    SolutionIndex: 272
    SolutionNameMin: Cijk_Ailk_Bljk_HSS_BH_MT128x96x32_MI32x32x8x1_SE_GRVW2_PLR5_SU0_SUS128_SRVW4_WGM15
    SolutionIndex: 273
    SolutionNameMin: Cijk_Ailk_Bljk_HSS_BH_MT256x160x32_MI32x32x8x1_SE_GRVW4_PLR5_SU0_SUS128_SRVW4_WGM1
    SolutionIndex: 274
    SolutionNameMin: Cijk_Ailk_Bljk_HSS_BH_MT32x64x32_MI16x16x16x1_SE_GRVW2_PLR2_SU0_SUS128_SRVW4_WGM15
    SolutionIndex: 275
    SolutionNameMin: Cijk_Ailk_Bljk_HSS_BH_MT64x32x32_MI16x16x16x1_SE_GRVW2_PLR2_SU32_SUS128_SRVW4_WGM1
    SolutionIndex: 276
    SolutionNameMin: Cijk_Ailk_Bljk_HSS_BH_MT128x96x64_MI32x32x8x1_SE_GRVW2_PLR9_SU0_SUS256_SRVW4_WGM1
    SolutionIndex: 277
    SolutionNameMin: Cijk_Ailk_Bljk_HSS_BH_MT256x160x32_MI32x32x8x1_SE_GRVW4_PLR5_SU0_SUS128_SRVW0_WGM15
    SolutionIndex: 278
    SolutionNameMin: Cijk_Ailk_Bljk_HSS_BH_MT256x160x32_MI32x32x8x1_SE_GRVW4_PLR5_SU0_SUS128_SRVW4_WGM15
    SolutionIndex: 279
    SolutionNameMin: Cijk_Ailk_Bljk_HSS_BH_MT256x160x32_MI32x32x8x1_SE_GRVW4_PLR5_SU0_SUS256_SRVW4_WGM1
    SolutionIndex: 280
    SolutionNameMin: Cijk_Ailk_Bljk_HSS_BH_MT256x160x32_MI32x32x8x1_SE_GRVW2_PLR5_SU32_SUS128_SRVW4_WGM2
    SolutionIndex: 281
    SolutionNameMin: Cijk_Ailk_Bljk_HSS_BH_MT256x160x32_MI32x32x8x1_SE_GRVW2_PLR5_SU32_SUS256_SRVW4_WGM2
    SolutionIndex: 282
    SolutionNameMin: Cijk_Ailk_Bljk_HSS_BH_MT256x160x32_MI32x32x8x1_SE_GRVW4_PLR5_SU0_SUS128_SRVW4_WGM2
    SolutionIndex: 283
    SolutionNameMin: Cijk_Ailk_Bljk_HSS_BH_MT256x160x32_MI32x32x8x1_SE_GRVW4_PLR5_SU0_SUS256_SRVW4_WGM2
    SolutionIndex: 284
    SolutionNameMin: Cijk_Ailk_Bljk_HSS_BH_MT256x160x32_MI32x32x8x1_SE_GRVW4_PLR5_SU32_SUS128_SRVW4_WGM2
    SolutionIndex: 285
    SolutionNameMin: Cijk_Ailk_Bljk_HSS_BH_MT64x32x32_MI16x16x16x1_SE_GRVW2_PLR2_SU32_SUS128_SRVW4_WGM2
    SolutionIndex: 286
    SolutionNameMin: Cijk_Ailk_Bljk_HSS_BH_MT64x32x32_MI16x16x16x1_SE_GRVW2_PLR2_SU0_SUS256_SRVW4_WGM2
    SolutionIndex: 287
    SolutionNameMin: Cijk_Ailk_Bljk_HSS_BH_MT64x32x32_MI16x16x16x1_SE_GRVW2_PLR2_SU0_SUS128_SRVW4_WGM1
    SolutionIndex: 288
    SolutionNameMin: Cijk_Ailk_Bljk_HSS_BH_MT64x32x32_MI16x16x16x1_SE_GRVW2_PLR2_SU0_SUS128_SRVW4_WGM2
    SolutionIndex: 289
    SolutionNameMin: Cijk_Ailk_Bljk_HSS_BH_MT64x32x32_MI16x16x16x1_SE_GRVW2_PLR2_SU32_SUS256_SRVW4_WGM2
    SolutionIndex: 290
    SolutionNameMin: Cijk_Ailk_Bljk_HSS_BH_MT32x64x32_MI16x16x16x1_SE_GRVW2_PLR2_SU0_SUS256_SRVW4_WGM1
    SolutionIndex: 291
    SolutionNameMin: Cijk_Ailk_Bljk_HSS_BH_MT64x16x32_MI16x16x16x1_SE_GRVW4_PLR2_SU32_SUS256_SRVW4_WGM15
    SolutionIndex: 292
    SolutionNameMin: Cijk_Ailk_Bljk_HSS_BH_MT64x32x32_MI16x16x16x1_SE_GRVW2_PLR2_SU0_SUS128_SRVW4_WGM15
    SolutionIndex: 293
    SolutionNameMin: Cijk_Ailk_Bljk_HSS_BH_MT128x160x64_MI32x32x8x1_SE_GRVW2_PLR9_SU0_SUS256_SRVW4_WGM15
    SolutionIndex: 294
    SolutionNameMin: Cijk_Ailk_Bljk_HSS_BH_MT256x160x32_MI32x32x8x1_SE_GRVW4_PLR5_SU32_SUS128_SRVW0_WGM15
    SolutionIndex: 295
    SolutionNameMin: Cijk_Ailk_Bljk_HSS_BH_MT256x160x32_MI32x32x8x1_SE_GRVW4_PLR5_SU0_SUS128_SRVW0_WGM1
    SolutionIndex: 296
    SolutionNameMin: Cijk_Ailk_Bljk_HSS_BH_MT256x160x32_MI32x32x8x1_SE_GRVW4_PLR5_SU0_SUS256_SRVW0_WGM15
    SolutionIndex: 297
    SolutionNameMin: Cijk_Ailk_Bljk_HSS_BH_MT256x160x32_MI32x32x8x1_SE_GRVW4_PLR5_SU32_SUS128_SRVW0_WGM2
    SolutionIndex: 298
    SolutionNameMin: Cijk_Ailk_Bljk_HSS_BH_MT256x160x32_MI32x32x8x1_SE_GRVW4_PLR5_SU0_SUS128_SRVW0_WGM2
    SolutionIndex: 299
    SolutionNameMin: Cijk_Ailk_Bljk_HSS_BH_MT256x160x32_MI32x32x8x1_SE_GRVW4_PLR5_SU32_SUS256_SRVW0_WGM15
    SolutionIndex: 300
    SolutionNameMin: Cijk_Ailk_Bljk_HSS_BH_MT256x160x32_MI32x32x8x1_SE_GRVW4_PLR5_SU32_SUS256_SRVW0_WGM1
    SolutionIndex: 301
    SolutionNameMin: Cijk_Ailk_Bljk_HSS_BH_MT256x160x32_MI32x32x8x1_SE_GRVW4_PLR5_SU0_SUS256_SRVW0_WGM2
    SolutionIndex: 302
    SolutionNameMin: Cijk_Ailk_Bljk_HSS_BH_MT256x160x32_MI32x32x8x1_SE_GRVW4_PLR5_SU32_SUS128_SRVW0_WGM1
    SolutionIndex: 303
    SolutionNameMin: Cijk_Ailk_Bljk_HSS_BH_MT256x160x32_MI32x32x8x1_SE_GRVW4_PLR5_SU32_SUS256_SRVW0_WGM2
    SolutionIndex: 304
    SolutionNameMin: Cijk_Ailk_Bljk_HSS_BH_MT32x32x64_MI16x16x16x1_SE_GRVW4_PLR5_SU0_SUS128_SRVW0_WGM2
    SolutionIndex: 305
    SolutionNameMin: Cijk_Ailk_Bljk_HSS_BH_MT128x96x32_MI32x32x8x1_SE_GRVW2_PLR5_SU0_SUS256_SRVW4_WGM15
    SolutionIndex: 306
    SolutionNameMin: Cijk_Ailk_Bljk_HSS_BH_MT128x160x32_MI32x32x8x1_SE_GRVW2_PLR5_SU32_SUS128_SRVW4_WGM2
    SolutionIndex: 307
    SolutionNameMin: Cijk_Ailk_Bljk_HSS_BH_MT128x160x32_MI32x32x8x1_SE_GRVW2_PLR5_SU32_SUS256_SRVW4_WGM15
    SolutionIndex: 308
    SolutionNameMin: Cijk_Ailk_Bljk_HSS_BH_MT128x160x32_MI32x32x8x1_SE_GRVW2_PLR5_SU0_SUS256_SRVW4_WGM15
    SolutionIndex: 309
    SolutionNameMin: Cijk_Ailk_Bljk_HSS_BH_MT128x96x64_MI32x32x8x1_SE_GRVW2_PLR9_SU0_SUS128_SRVW4_WGM1
    SolutionIndex: 310
    SolutionNameMin: Cijk_Ailk_Bljk_HSS_BH_MT128x160x32_MI32x32x8x1_SE_GRVW2_PLR5_SU0_SUS128_SRVW4_WGM2
    SolutionIndex: 311
    SolutionNameMin: Cijk_Ailk_Bljk_HSS_BH_MT128x96x64_MI32x32x8x1_SE_GRVW2_PLR9_SU32_SUS256_SRVW4_WGM2
    SolutionIndex: 312
    SolutionNameMin: Cijk_Ailk_Bljk_HSS_BH_MT128x96x64_MI32x32x8x1_SE_GRVW2_PLR9_SU32_SUS128_SRVW4_WGM2
    SolutionIndex: 313
    SolutionNameMin: Cijk_Ailk_Bljk_HSS_BH_MT128x160x64_MI32x32x8x1_SE_GRVW2_PLR9_SU0_SUS128_SRVW4_WGM2
    SolutionIndex: 314
    SolutionNameMin: Cijk_Ailk_Bljk_HSS_BH_MT256x256x32_MI32x32x8x1_SE_GRVW8_PLR5_SU0_SUS128_SRVW0_WGM15
    SolutionIndex: 315
    SolutionNameMin: Cijk_Ailk_Bljk_HSS_BH_MT128x160x64_MI32x32x8x1_SE_GRVW2_PLR9_SU0_SUS256_SRVW4_WGM2
    SolutionIndex: 316
    SolutionNameMin: Cijk_Ailk_Bljk_HSS_BH_MT128x160x64_MI32x32x8x1_SE_GRVW2_PLR9_SU32_SUS128_SRVW4_WGM1
    SolutionIndex: 317
    SolutionNameMin: Cijk_Ailk_Bljk_HSS_BH_MT64x32x64_MI16x16x16x1_SE_GRVW8_PLR5_SU0_SUS128_SRVW0_WGM1
    SolutionIndex: 318
    SolutionNameMin: Cijk_Ailk_Bljk_HSS_BH_MT128x96x64_MI32x32x8x1_SE_GRVW2_PLR9_SU0_SUS128_SRVW4_WGM15
    SolutionIndex: 319
    SolutionNameMin: Cijk_Ailk_Bljk_HSS_BH_MT64x32x64_MI16x16x16x1_SE_GRVW8_PLR5_SU0_SUS256_SRVW0_WGM15
    SolutionIndex: 320
    SolutionNameMin: Cijk_Ailk_Bljk_HSS_BH_MT96x128x32_MI32x32x8x1_SE_GRVW4_PLR5_SU32_SUS128_SRVW0_WGM15
    SolutionIndex: 321
    SolutionNameMin: Cijk_Ailk_Bljk_HSS_BH_MT64x256x64_MI32x32x8x1_SE_GRVW2_PLR9_SU0_SUS256_SRVW4_WGM1
    SolutionIndex: 322
    SolutionNameMin: Cijk_Ailk_Bljk_HSS_BH_MT96x96x32_MI16x16x16x1_SE_GRVW4_PLR2_SU0_SUS256_SRVW0_WGM1
    SolutionIndex: 323
    SolutionNameMin: Cijk_Ailk_Bljk_HSS_BH_MT64x32x32_MI16x16x16x1_SE_GRVW2_PLR2_SU0_SUS256_SRVW4_WGM1
    SolutionIndex: 324
    SolutionNameMin: Cijk_Ailk_Bljk_HSS_BH_MT32x32x64_MI16x16x16x1_SE_GRVW8_PLR5_SU32_SUS128_SRVW4_WGM1
    SolutionIndex: 325
    SolutionNameMin: Cijk_Ailk_Bljk_HSS_BH_MT128x256x32_MI32x32x8x1_SE_GRVW8_PLR5_SU0_SUS256_SRVW4_WGM2
    SolutionIndex: 326
    SolutionNameMin: Cijk_Ailk_Bljk_HSS_BH_MT128x160x32_MI32x32x8x1_SE_GRVW2_PLR5_SU0_SUS128_SRVW4_WGM15
    SolutionIndex: 327
    SolutionNameMin: Cijk_Ailk_Bljk_HSS_BH_MT128x256x32_MI32x32x8x1_SE_GRVW8_PLR5_SU0_SUS128_SRVW4_WGM15
    SolutionIndex: 328
    SolutionNameMin: Cijk_Ailk_Bljk_HSS_BH_MT128x256x32_MI32x32x8x1_SE_GRVW8_PLR5_SU32_SUS256_SRVW4_WGM15
    SolutionIndex: 329
    SolutionNameMin: Cijk_Ailk_Bljk_HSS_BH_MT64x128x64_MI32x32x8x1_SE_GRVW8_PLR9_SU32_SUS128_SRVW4_WGM15
    SolutionIndex: 330
    SolutionNameMin: Cijk_Ailk_Bljk_HSS_BH_MT64x128x64_MI32x32x8x1_SE_GRVW8_PLR9_SU0_SUS128_SRVW4_WGM1
    SolutionIndex: 331
    SolutionNameMin: Cijk_Ailk_Bljk_HSS_BH_MT32x64x32_MI16x16x16x1_SE_GRVW8_PLR2_SU0_SUS256_SRVW4_WGM1
    SolutionIndex: 332
    SolutionNameMin: Cijk_Ailk_Bljk_HSS_BH_MT32x64x32_MI16x16x16x1_SE_GRVW2_PLR2_SU0_SUS128_SRVW4_WGM1
    SolutionIndex: 333
    SolutionNameMin: Cijk_Ailk_Bljk_HSS_BH_MT64x128x32_MI32x32x8x1_SE_GRVW8_PLR5_SU0_SUS128_SRVW4_WGM15
    SolutionIndex: 334
    SolutionNameMin: Cijk_Ailk_Bljk_HSS_BH_MT32x32x64_MI16x16x16x1_SE_GRVW4_PLR5_SU0_SUS256_SRVW4_WGM2
    SolutionIndex: 335
    SolutionNameMin: Cijk_Ailk_Bljk_HSS_BH_MT64x128x32_MI32x32x8x1_SE_GRVW8_PLR5_SU0_SUS128_SRVW4_WGM1
    SolutionIndex: 336
    SolutionNameMin: Cijk_Ailk_Bljk_HSS_BH_MT96x96x32_MI16x16x16x1_SE_GRVW4_PLR2_SU0_SUS128_SRVW0_WGM1
    SolutionIndex: 337
    SolutionNameMin: Cijk_Ailk_Bljk_HSS_BH_MT128x256x32_MI32x32x8x1_SE_GRVW8_PLR5_SU0_SUS128_SRVW4_WGM15
    SolutionIndex: 338
    SolutionNameMin: Cijk_Ailk_Bljk_HSS_BH_MT64x64x64_MI32x32x8x1_SE_GRVW8_PLR9_SU32_SUS256_SRVW4_WGM15
    SolutionIndex: 339
    SolutionNameMin: Cijk_Ailk_Bljk_HSS_BH_MT64x128x32_MI32x32x8x1_SE_GRVW8_PLR5_SU0_SUS256_SRVW4_WGM1
    SolutionIndex: 340
    SolutionNameMin: Cijk_Ailk_Bljk_HSS_BH_MT128x96x32_MI32x32x8x1_SE_GRVW4_PLR5_SU0_SUS256_SRVW4_WGM15
    SolutionIndex: 341
    SolutionNameMin: Cijk_Ailk_Bljk_HSS_BH_MT128x144x32_MI16x16x16x1_SE_GRVW2_PLR2_SU0_SUS256_SRVW4_WGM1
    SolutionIndex: 342
    SolutionNameMin: Cijk_Ailk_Bljk_HSS_BH_MT32x64x64_MI16x16x16x1_SE_GRVW8_PLR5_SU0_SUS128_SRVW4_WGM2
    SolutionIndex: 343
    SolutionNameMin: Cijk_Ailk_Bljk_HSS_BH_MT256x160x32_MI32x32x8x1_SE_GRVW4_PLR5_SU0_SUS128_SRVW0_WGM2
    SolutionIndex: 344
    SolutionNameMin: Cijk_Ailk_Bljk_HSS_BH_MT128x256x32_MI32x32x8x1_SE_GRVW2_PLR5_SU0_SUS128_SRVW0_WGM15
    SolutionIndex: 345
    SolutionNameMin: Cijk_Ailk_Bljk_HSS_BH_MT256x160x32_MI32x32x8x1_SE_GRVW4_PLR5_SU0_SUS256_SRVW0_WGM15
    SolutionIndex: 346
    SolutionNameMin: Cijk_Ailk_Bljk_HSS_BH_MT128x256x32_MI32x32x8x1_SE_GRVW8_PLR5_SU0_SUS256_SRVW4_WGM15
    SolutionIndex: 347
    SolutionNameMin: Cijk_Ailk_Bljk_HSS_BH_MT128x256x32_MI32x32x8x1_SE_GRVW8_PLR5_SU32_SUS128_SRVW4_WGM15
    SolutionIndex: 348
    SolutionNameMin: Cijk_Ailk_Bljk_HSS_BH_MT32x32x32_MI16x16x16x1_SE_GRVW4_PLR2_SU0_SUS256_SRVW4_WGM1
    SolutionIndex: 349
    SolutionNameMin: Cijk_Ailk_Bljk_HSS_BH_MT256x128x32_MI32x32x8x1_SE_GRVW8_PLR5_SU0_SUS128_SRVW0_WGM15
    SolutionIndex: 350
    SolutionNameMin: Cijk_Ailk_Bljk_HSS_BH_MT128x256x32_MI32x32x8x1_SE_GRVW8_PLR5_SU0_SUS256_SRVW4_WGM15
    SolutionIndex: 351
    SolutionNameMin: Cijk_Ailk_Bljk_HSS_BH_MT128x256x32_MI32x32x8x1_SE_GRVW8_PLR5_SU32_SUS128_SRVW4_WGM15
    SolutionIndex: 352
    SolutionNameMin: Cijk_Ailk_Bljk_HSS_BH_MT32x32x64_MI16x16x16x1_SE_GRVW8_PLR5_SU0_SUS256_SRVW4_WGM15
    SolutionIndex: 353
    SolutionNameMin: Cijk_Ailk_Bljk_HSS_BH_MT64x32x32_MI16x16x16x1_SE_GRVW2_PLR2_SU32_SUS128_SRVW4_WGM15
    SolutionIndex: 354
    SolutionNameMin: Cijk_Ailk_Bljk_HSS_BH_MT256x128x32_MI32x32x8x1_SE_GRVW8_PLR5_SU0_SUS256_SRVW0_WGM1
    SolutionIndex: 355
    SolutionNameMin: Cijk_Ailk_Bljk_HSS_BH_MT32x32x64_MI16x16x16x1_SE_GRVW8_PLR5_SU0_SUS256_SRVW4_WGM2
    SolutionIndex: 356
    SolutionNameMin: Cijk_Ailk_Bljk_HSS_BH_MT128x256x32_MI32x32x8x1_SE_GRVW8_PLR5_SU32_SUS128_SRVW4_WGM2
    SolutionIndex: 357
    SolutionNameMin: Cijk_Ailk_Bljk_HSS_BH_MT64x128x64_MI32x32x8x1_SE_GRVW8_PLR9_SU0_SUS256_SRVW4_WGM15
    SolutionIndex: 358
    SolutionNameMin: Cijk_Ailk_Bljk_HSS_BH_MT64x128x32_MI32x32x8x1_SE_GRVW8_PLR5_SU0_SUS256_SRVW4_WGM2
    SolutionIndex: 359
    SolutionNameMin: Cijk_Ailk_Bljk_HSS_BH_MT64x128x32_MI32x32x8x1_SE_GRVW8_PLR5_SU0_SUS128_SRVW4_WGM2
    SolutionIndex: 360
    SolutionNameMin: Cijk_Ailk_Bljk_HSS_BH_MT128x96x32_MI32x32x8x1_SE_GRVW4_PLR5_SU0_SUS256_SRVW4_WGM2
    SolutionIndex: 361
    SolutionNameMin: Cijk_Ailk_Bljk_HSS_BH_MT128x96x32_MI32x32x8x1_SE_GRVW2_PLR5_SU0_SUS128_SRVW4_WGM1
    SolutionIndex: 362
    SolutionNameMin: Cijk_Ailk_Bljk_HSS_BH_MT128x160x32_MI32x32x8x1_SE_GRVW2_PLR5_SU32_SUS256_SRVW4_WGM1
    SolutionIndex: 363
    SolutionNameMin: Cijk_Ailk_Bljk_HSS_BH_MT128x96x32_MI32x32x8x1_SE_GRVW2_PLR5_SU0_SUS256_SRVW4_WGM2
    SolutionIndex: 364
    SolutionNameMin: Cijk_Ailk_Bljk_HSS_BH_MT128x96x32_MI32x32x8x1_SE_GRVW2_PLR5_SU0_SUS128_SRVW4_WGM2
    SolutionIndex: 365
    SolutionNameMin: Cijk_Ailk_Bljk_HSS_BH_MT128x160x32_MI32x32x8x1_SE_GRVW2_PLR5_SU0_SUS256_SRVW4_WGM1
    SolutionIndex: 366
    SolutionNameMin: Cijk_Ailk_Bljk_HSS_BH_MT128x96x32_MI32x32x8x1_SE_GRVW2_PLR5_SU0_SUS256_SRVW4_WGM1
    SolutionIndex: 367
    SolutionNameMin: Cijk_Ailk_Bljk_HSS_BH_MT64x32x32_MI16x16x16x1_SE_GRVW8_PLR2_SU0_SUS128_SRVW4_WGM15
    SolutionIndex: 368
    SolutionNameMin: Cijk_Ailk_Bljk_HSS_BH_MT64x64x32_MI32x32x8x1_SE_GRVW2_PLR5_SU0_SUS128_SRVW4_WGM1
    SolutionIndex: 369
    SolutionNameMin: Cijk_Ailk_Bljk_HSS_BH_MT64x128x32_MI32x32x8x1_SE_GRVW2_PLR5_SU32_SUS256_SRVW4_WGM1
    SolutionIndex: 370
    SolutionNameMin: Cijk_Ailk_Bljk_HSS_BH_MT64x64x32_MI32x32x8x1_SE_GRVW8_PLR5_SU0_SUS128_SRVW4_WGM1
    SolutionIndex: 371
    SolutionNameMin: Cijk_Ailk_Bljk_HSS_BH_MT64x128x64_MI32x32x8x1_SE_GRVW8_PLR9_SU0_SUS256_SRVW4_WGM2
    SolutionIndex: 372
    SolutionNameMin: Cijk_Ailk_Bljk_HSS_BH_MT64x128x32_MI32x32x8x1_SE_GRVW4_PLR5_SU32_SUS128_SRVW4_WGM2
    SolutionIndex: 373
    SolutionNameMin: Cijk_Ailk_Bljk_HSS_BH_MT32x64x64_MI16x16x16x1_SE_GRVW8_PLR5_SU0_SUS128_SRVW4_WGM15
    SolutionIndex: 374
    SolutionNameMin: Cijk_Ailk_Bljk_HSS_BH_MT64x128x64_MI32x32x8x1_SE_GRVW8_PLR9_SU0_SUS256_SRVW4_WGM1
    SolutionIndex: 375
    SolutionNameMin: Cijk_Ailk_Bljk_HSS_BH_MT64x64x32_MI32x32x8x1_SE_GRVW8_PLR5_SU0_SUS256_SRVW4_WGM1
    SolutionIndex: 376
    SolutionNameMin: Cijk_Ailk_Bljk_HSS_BH_MT64x64x64_MI32x32x8x1_SE_GRVW8_PLR9_SU0_SUS256_SRVW4_WGM1
    SolutionIndex: 377
    SolutionNameMin: Cijk_Ailk_Bljk_HSS_BH_MT64x64x32_MI32x32x8x1_SE_GRVW2_PLR5_SU0_SUS256_SRVW4_WGM1
    SolutionIndex: 378
    SolutionNameMin: Cijk_Ailk_Bljk_HSS_BH_MT128x160x32_MI32x32x8x1_SE_GRVW2_PLR5_SU0_SUS128_SRVW4_WGM1
    SolutionIndex: 379
    SolutionNameMin: Cijk_Ailk_Bljk_HSS_BH_MT128x256x32_MI32x32x8x1_SE_GRVW8_PLR5_SU0_SUS128_SRVW4_WGM1
    SolutionIndex: 380
    SolutionNameMin: Cijk_Ailk_Bljk_HSS_BH_MT128x256x32_MI32x32x8x1_SE_GRVW8_PLR5_SU0_SUS256_SRVW4_WGM1
    SolutionIndex: 381
    SolutionNameMin: Cijk_Ailk_Bljk_HSS_BH_MT128x96x32_MI32x32x8x1_SE_GRVW2_PLR5_SU32_SUS128_SRVW4_WGM15
    SolutionIndex: 382
    SolutionNameMin: Cijk_Ailk_Bljk_HSS_BH_MT128x256x32_MI32x32x8x1_SE_GRVW8_PLR5_SU32_SUS128_SRVW4_WGM1
    SolutionIndex: 383
    SolutionNameMin: Cijk_Ailk_Bljk_HSS_BH_MT128x96x32_MI32x32x8x1_SE_GRVW2_PLR5_SU32_SUS256_SRVW4_WGM15
    SolutionIndex: 384
    SolutionNameMin: Cijk_Ailk_Bljk_HSS_BH_MT128x96x32_MI32x32x8x1_SE_GRVW2_PLR5_SU32_SUS128_SRVW4_WGM15
    SolutionIndex: 385
    SolutionNameMin: Cijk_Ailk_Bljk_HSS_BH_MT64x32x32_MI16x16x16x1_SE_GRVW8_PLR2_SU0_SUS256_SRVW4_WGM2
    SolutionIndex: 386
    SolutionNameMin: Cijk_Ailk_Bljk_HSS_BH_MT64x32x32_MI16x16x16x1_SE_GRVW8_PLR2_SU0_SUS256_SRVW4_WGM1
    SolutionIndex: 387
    SolutionNameMin: Cijk_Ailk_Bljk_HSS_BH_MT288x128x32_MI32x32x8x1_SE_GRVW4_PLR5_SU32_SUS128_SRVW0_WGM1
    SolutionIndex: 388
    SolutionNameMin: Cijk_Ailk_Bljk_HSS_BH_MT128x96x64_MI32x32x8x1_SE_GRVW2_PLR9_SU32_SUS128_SRVW4_WGM1
    SolutionIndex: 389
    SolutionNameMin: Cijk_Ailk_Bljk_HSS_BH_MT64x32x32_MI16x16x16x1_SE_GRVW8_PLR2_SU32_SUS128_SRVW4_WGM1
    SolutionIndex: 390
    SolutionNameMin: Cijk_Ailk_Bljk_HSS_BH_MT256x256x32_MI32x32x8x1_SE_GRVW8_PLR5_SU32_SUS128_SRVW0_WGM1
    SolutionIndex: 391
    SolutionNameMin: Cijk_Ailk_Bljk_HSS_BH_MT32x32x64_MI16x16x16x1_SE_GRVW8_PLR5_SU32_SUS256_SRVW4_WGM15
    SolutionIndex: 392
    SolutionNameMin: Cijk_Ailk_Bljk_HSS_BH_MT32x32x32_MI16x16x16x1_SE_GRVW2_PLR2_SU0_SUS256_SRVW4_WGM1
    SolutionIndex: 393
    SolutionNameMin: Cijk_Ailk_Bljk_HSS_BH_MT256x160x32_MI32x32x8x1_SE_GRVW4_PLR5_SU32_SUS256_SRVW4_WGM15
    SolutionIndex: 394
    SolutionNameMin: Cijk_Ailk_Bljk_HSS_BH_MT256x128x32_MI32x32x8x1_SE_GRVW8_PLR5_SU0_SUS128_SRVW0_WGM2
    SolutionIndex: 395
    SolutionNameMin: Cijk_Ailk_Bljk_HSS_BH_MT64x128x32_MI32x32x8x1_SE_GRVW8_PLR5_SU0_SUS256_SRVW4_WGM15
    SolutionIndex: 396
    SolutionNameMin: Cijk_Ailk_Bljk_HSS_BH_MT128x128x64_MI32x32x8x1_SE_GRVW2_PLR9_SU0_SUS128_SRVW4_WGM1
    SolutionIndex: 397
    SolutionNameMin: Cijk_Ailk_Bljk_HSS_BH_MT128x128x32_MI32x32x8x1_SE_GRVW8_PLR5_SU32_SUS128_SRVW4_WGM2
    SolutionIndex: 398
    SolutionNameMin: Cijk_Ailk_Bljk_HSS_BH_MT64x128x32_MI32x32x8x1_SE_GRVW8_PLR5_SU32_SUS128_SRVW4_WGM1
    SolutionIndex: 399
    SolutionNameMin: Cijk_Ailk_Bljk_HSS_BH_MT128x160x32_MI32x32x8x1_SE_GRVW2_PLR5_SU32_SUS256_SRVW4_WGM2
    SolutionIndex: 400
    SolutionNameMin: Cijk_Ailk_Bljk_HSS_BH_MT64x128x32_MI32x32x8x1_SE_GRVW8_PLR5_SU32_SUS128_SRVW4_WGM2
    SolutionIndex: 401
    SolutionNameMin: Cijk_Ailk_Bljk_HSS_BH_MT64x128x32_MI32x32x8x1_SE_GRVW4_PLR5_SU0_SUS256_SRVW4_WGM2
    SolutionIndex: 402
    SolutionNameMin: Cijk_Ailk_Bljk_HSS_BH_MT128x160x32_MI32x32x8x1_SE_GRVW2_PLR5_SU32_SUS128_SRVW4_WGM1
    SolutionIndex: 403
    SolutionNameMin: Cijk_Ailk_Bljk_HSS_BH_MT64x128x64_MI32x32x8x1_SE_GRVW8_PLR9_SU0_SUS256_SRVW0_WGM1
    SolutionIndex: 404
    SolutionNameMin: Cijk_Ailk_Bljk_HSS_BH_MT128x96x32_MI32x32x8x1_SE_GRVW2_PLR5_SU0_SUS128_SRVW4_WGM15
    SolutionIndex: 405
    SolutionNameMin: Cijk_Ailk_Bljk_HSS_BH_MT128x96x32_MI32x32x8x1_SE_GRVW2_PLR5_SU0_SUS256_SRVW4_WGM1
    SolutionIndex: 406
    SolutionNameMin: Cijk_Ailk_Bljk_HSS_BH_MT128x160x32_MI32x32x8x1_SE_GRVW2_PLR5_SU0_SUS256_SRVW4_WGM15
    SolutionIndex: 407
    SolutionNameMin: Cijk_Ailk_Bljk_HSS_BH_MT64x128x32_MI32x32x8x1_SE_GRVW4_PLR5_SU0_SUS256_SRVW4_WGM2
    SolutionIndex: 408
    SolutionNameMin: Cijk_Ailk_Bljk_HSS_BH_MT64x128x64_MI32x32x8x1_SE_GRVW8_PLR9_SU0_SUS128_SRVW4_WGM15
    SolutionIndex: 409
    SolutionNameMin: Cijk_Ailk_Bljk_HSS_BH_MT128x96x32_MI32x32x8x1_SE_GRVW2_PLR5_SU0_SUS256_SRVW4_WGM2
    SolutionIndex: 410
    SolutionNameMin: Cijk_Ailk_Bljk_HSS_BH_MT128x96x32_MI32x32x8x1_SE_GRVW4_PLR5_SU0_SUS256_SRVW4_WGM15
    SolutionIndex: 411
    SolutionNameMin: Cijk_Ailk_Bljk_HSS_BH_MT128x160x32_MI32x32x8x1_SE_GRVW2_PLR5_SU0_SUS128_SRVW4_WGM15
    SolutionIndex: 412
    SolutionNameMin: Cijk_Ailk_Bljk_HSS_BH_MT96x96x32_MI16x16x16x1_SE_GRVW2_PLR2_SU32_SUS128_SRVW0_WGM15
    SolutionIndex: 413
    SolutionNameMin: Cijk_Ailk_Bljk_HSS_BH_MT64x128x32_MI32x32x8x1_SE_GRVW8_PLR5_SU0_SUS128_SRVW4_WGM1
    SolutionIndex: 414
    SolutionNameMin: Cijk_Ailk_Bljk_HSS_BH_MT64x32x32_MI16x16x16x1_SE_GRVW8_PLR2_SU0_SUS256_SRVW4_WGM1
    SolutionIndex: 415
    SolutionNameMin: Cijk_Ailk_Bljk_HSS_BH_MT64x64x32_MI32x32x8x1_SE_GRVW8_PLR5_SU0_SUS256_SRVW4_WGM1
    SolutionIndex: 416
    SolutionNameMin: Cijk_Ailk_Bljk_HSS_BH_MT64x64x32_MI32x32x8x1_SE_GRVW4_PLR5_SU0_SUS128_SRVW4_WGM15
    SolutionIndex: 417
    SolutionNameMin: Cijk_Ailk_Bljk_HSS_BH_MT128x96x32_MI32x32x8x1_SE_GRVW2_PLR5_SU0_SUS128_SRVW4_WGM1
    SolutionIndex: 418
    SolutionNameMin: Cijk_Ailk_Bljk_HSS_BH_MT64x64x32_MI32x32x8x1_SE_GRVW8_PLR5_SU0_SUS128_SRVW4_WGM1
    SolutionIndex: 419
    SolutionNameMin: Cijk_Ailk_Bljk_HSS_BH_MT64x32x32_MI16x16x16x1_SE_GRVW2_PLR2_SU0_SUS128_SRVW4_WGM2
    SolutionIndex: 420
    SolutionNameMin: Cijk_Ailk_Bljk_HSS_BH_MT64x128x64_MI32x32x8x1_SE_GRVW8_PLR9_SU32_SUS256_SRVW4_WGM2
    SolutionIndex: 421
    SolutionNameMin: Cijk_Ailk_Bljk_HSS_BH_MT128x160x32_MI32x32x8x1_SE_GRVW2_PLR5_SU0_SUS128_SRVW4_WGM2
    SolutionIndex: 422
    SolutionNameMin: Cijk_Ailk_Bljk_HSS_BH_MT64x32x32_MI16x16x16x1_SE_GRVW8_PLR2_SU0_SUS128_SRVW4_WGM1
    SolutionIndex: 423
    SolutionNameMin: Cijk_Ailk_Bljk_HSS_BH_MT64x64x32_MI32x32x8x1_SE_GRVW4_PLR5_SU0_SUS256_SRVW4_WGM2
    SolutionIndex: 424
    SolutionNameMin: Cijk_Ailk_Bljk_HSS_BH_MT64x64x32_MI32x32x8x1_SE_GRVW8_PLR5_SU0_SUS256_SRVW4_WGM15
    SolutionIndex: 425
    SolutionNameMin: Cijk_Ailk_Bljk_HSS_BH_MT64x32x32_MI16x16x16x1_SE_GRVW2_PLR2_SU0_SUS256_SRVW4_WGM1
    SolutionIndex: 426
    SolutionNameMin: Cijk_Ailk_Bljk_HSS_BH_MT64x128x32_MI32x32x8x1_SE_GRVW8_PLR5_SU0_SUS256_SRVW4_WGM15
    SolutionIndex: 427
    SolutionNameMin: Cijk_Ailk_Bljk_HSS_BH_MT128x96x32_MI32x32x8x1_SE_GRVW4_PLR5_SU0_SUS128_SRVW4_WGM1
    SolutionIndex: 428
    SolutionNameMin: Cijk_Ailk_Bljk_HSS_BH_MT128x96x32_MI32x32x8x1_SE_GRVW4_PLR5_SU0_SUS128_SRVW4_WGM15
    SolutionIndex: 429
    SolutionNameMin: Cijk_Ailk_Bljk_HSS_BH_MT32x64x64_MI16x16x16x1_SE_GRVW8_PLR5_SU0_SUS256_SRVW0_WGM2
    SolutionIndex: 430
    SolutionNameMin: Cijk_Ailk_Bljk_HSS_BH_MT32x64x64_MI16x16x16x1_SE_GRVW4_PLR5_SU0_SUS256_SRVW0_WGM15
    SolutionIndex: 431
    SolutionNameMin: Cijk_Ailk_Bljk_HSS_BH_MT128x96x32_MI32x32x8x1_SE_GRVW2_PLR5_SU0_SUS256_SRVW4_WGM15
    SolutionIndex: 432
    SolutionNameMin: Cijk_Ailk_Bljk_HSS_BH_MT128x96x32_MI32x32x8x1_SE_GRVW2_PLR5_SU0_SUS128_SRVW4_WGM15
    SolutionIndex: 433
    SolutionNameMin: Cijk_Ailk_Bljk_HSS_BH_MT128x96x32_MI32x32x8x1_SE_GRVW4_PLR5_SU0_SUS256_SRVW4_WGM1
    SolutionIndex: 434
    SolutionNameMin: Cijk_Ailk_Bljk_HSS_BH_MT128x256x32_MI32x32x8x1_SE_GRVW8_PLR5_SU0_SUS256_SRVW4_WGM15
    SolutionIndex: 435
    SolutionNameMin: Cijk_Ailk_Bljk_HSS_BH_MT64x256x32_MI32x32x8x1_SE_GRVW4_PLR5_SU0_SUS256_SRVW4_WGM1
    SolutionIndex: 436
    SolutionNameMin: Cijk_Ailk_Bljk_HSS_BH_MT64x128x64_MI32x32x8x1_SE_GRVW8_PLR9_SU32_SUS128_SRVW4_WGM1
    SolutionIndex: 437
    SolutionNameMin: Cijk_Ailk_Bljk_HSS_BH_MT64x128x64_MI32x32x8x1_SE_GRVW2_PLR9_SU0_SUS128_SRVW4_WGM2
- - - [512, 1, 1, 500000]
    - [12, 0.063]
  - - [512, 2, 1, 500000]
    - [12, 0.123]
  - - [512, 4, 1, 500000]
    - [12, 0.246]
  - - [512, 8, 1, 500000]
    - [12, 0.491]
  - - [512, 16, 1, 500000]
    - [12, 0.985]
  - - [1024, 1, 1, 500000]
    - [12, 0.123]
  - - [1024, 2, 1, 500000]
    - [12, 0.246]
  - - [1024, 4, 1, 500000]
    - [12, 0.491]
  - - [1024, 8, 1, 500000]
    - [12, 0.985]
  - - [1024, 16, 1, 500000]
    - [12, 1.967]
  - - [64, 1, 1, 1216]
    - [2, 0.006]
  - - [128, 1, 1, 1024]
    - [2, 0.012]
  - - [128, 1, 1, 1408]
    - [2, 0.012]
  - - [512, 1, 1, 512]
    - [2, 0.036]
  - - [3072, 1, 1, 128]
    - [6, 0.177]
  - - [512, 2, 1, 512]
    - [2, 0.075]
  - - [1024, 1, 1, 512]
    - [2, 0.075]
  - - [4224, 1, 1, 128]
    - [7, 0.246]
  - - [512, 4, 1, 512]
    - [4, 0.147]
  - - [1024, 2, 1, 512]
    - [2, 0.15]
  - - [1024, 4, 1, 512]
    - [2, 0.299]
  - - [3072, 1, 1, 1024]
    - [6, 0.314]
  - - [512, 16, 1, 512]
    - [4, 0.596]
  - - [3072, 2, 1, 1024]
    - [25, 0.626]
  - - [4608, 1, 1, 1536]
    - [12, 0.503]
  - - [1024, 16, 1, 512]
    - [2, 1.213]
  - - [3072, 4, 1, 1024]
    - [25, 1.249]
  - - [4608, 2, 1, 1536]
    - [12, 1.006]
  - - [6144, 1, 1, 2560]
    - [12, 0.692]
  - - [7680, 1, 1, 2560]
    - [14, 0.868]
  - - [8448, 1, 1, 2816]
    - [31, 0.925]
  - - [4608, 4, 1, 1536]
    - [12, 2.006]
  - - [6144, 2, 1, 2560]
    - [12, 1.387]
  - - [7680, 2, 1, 2560]
    - [14, 1.737]
  - - [8448, 2, 1, 2816]
    - [29, 1.851]
  - - [1760, 16, 1, 1760]
    - [7, 3.076]
  - - [3072, 16, 1, 1024]
    - [12, 5.163]
  - - [6144, 4, 1, 2560]
    - [12, 2.773]
  - - [2048, 16, 1, 2048]
    - [12, 3.671]
  - - [7680, 4, 1, 2560]
    - [14, 3.48]
  - - [8448, 4, 1, 2816]
    - [9, 3.695]
  - - [2560, 16, 1, 2560]
    - [12, 4.639]
  - - [4608, 16, 1, 1536]
    - [29, 7.765]
  - - [6144, 16, 1, 2560]
    - [29, 10.67]
  - - [4096, 16, 1, 4096]
    - [31, 7.307]
  - - [7680, 16, 1, 2560]
    - [9, 13.305]
  - - [8448, 16, 1, 2816]
    - [9, 13.689]
  - - [64, 64, 1, 256]
    - [13, 0.317]
  - - [128, 64, 1, 256]
    - [0, 0.479]
  - - [64, 128, 1, 256]
    - [0, 0.476]
  - - [128, 128, 1, 256]
    - [0, 0.952]
  - - [64, 256, 1, 256]
    - [2, 0.97]
  - - [128, 256, 1, 256]
    - [7, 2.596]
  - - [64, 448, 1, 256]
    - [7, 2.27]
  - - [128, 448, 1, 256]
    - [8, 4.504]
  - - [64, 704, 1, 256]
    - [29, 3.57]
  - - [128, 704, 1, 256]
    - [7, 6.801]
  - - [64, 1024, 1, 256]
    - [7, 5.025]
  - - [128, 1024, 1, 256]
    - [9, 9.517]
  - - [64, 1408, 1, 256]
    - [7, 6.855]
  - - [128, 1408, 1, 256]
    - [9, 12.985]
  - - [64, 1856, 1, 256]
    - [29, 9.035]
  - - [128, 1856, 1, 256]
    - [9, 16.033]
  - - [64, 2368, 1, 256]
    - [9, 11.002]
  - - [128, 2368, 1, 256]
    - [30, 17.186]
  - - [64, 2944, 1, 256]
    - [30, 12.991]
  - - [128, 2944, 1, 256]
    - [21, 18.055]
  - - [64, 3584, 1, 256]
    - [9, 15.701]
  - - [128, 3584, 1, 256]
    - [11, 21.657]
  - - [64, 4288, 1, 256]
    - [9, 15.56]
  - - [128, 4288, 1, 256]
    - [5, 22.008]
  - - [64, 5056, 1, 256]
    - [10, 17.133]
  - - [128, 5056, 1, 256]
    - [21, 24.907]
  - - [64, 5888, 1, 256]
    - [4, 17.965]
  - - [128, 5888, 1, 256]
    - [5, 25.521]
  - - [64, 6784, 1, 256]
    - [21, 20.004]
  - - [128, 6784, 1, 256]
    - [5, 28.497]
  - - [64, 64, 1, 1280]
    - [9, 0.44]
  - - [128, 64, 1, 1280]
    - [10, 0.847]
  - - [64, 128, 1, 1280]
    - [10, 0.844]
  - - [128, 128, 1, 1280]
    - [2, 1.521]
  - - [64, 256, 1, 1280]
    - [2, 1.566]
  - - [128, 256, 1, 1280]
    - [31, 3.552]
  - - [64, 448, 1, 1280]
    - [12, 3.114]
  - - [128, 448, 1, 1280]
    - [14, 6.202]
  - - [64, 704, 1, 1280]
    - [12, 4.851]
  - - [128, 704, 1, 1280]
    - [29, 9.346]
  - - [64, 1024, 1, 1280]
    - [29, 6.84]
  - - [128, 1024, 1, 1280]
    - [9, 12.661]
  - - [64, 1408, 1, 1280]
    - [29, 9.367]
  - - [128, 1408, 1, 1280]
    - [9, 17.48]
  - - [64, 1856, 1, 1280]
    - [29, 12.266]
  - - [128, 1856, 1, 1280]
    - [9, 21.478]
  - - [64, 2368, 1, 1280]
    - [30, 14.731]
  - - [128, 2368, 1, 1280]
    - [9, 23.053]
  - - [64, 2944, 1, 1280]
    - [30, 17.429]
  - - [128, 2944, 1, 1280]
    - [11, 23.601]
  - - [64, 3584, 1, 1280]
    - [30, 20.894]
  - - [128, 3584, 1, 1280]
    - [11, 28.437]
  - - [64, 4288, 1, 1280]
    - [30, 20.84]
  - - [128, 4288, 1, 1280]
    - [21, 27.338]
  - - [64, 5056, 1, 1280]
    - [27, 23.005]
  - - [128, 5056, 1, 1280]
    - [18, 28.818]
  - - [64, 5888, 1, 1280]
    - [21, 23.269]
  - - [128, 5888, 1, 1280]
    - [21, 30.019]
  - - [64, 6784, 1, 1280]
    - [21, 26.069]
  - - [128, 6784, 1, 1280]
    - [5, 33.178]
  - - [64, 64, 1, 3328]
    - [6, 0.449]
  - - [128, 64, 1, 3328]
    - [23, 0.883]
  - - [64, 128, 1, 3328]
    - [23, 0.874]
  - - [128, 128, 1, 3328]
    - [22, 1.725]
  - - [64, 256, 1, 3328]
    - [23, 1.743]
  - - [128, 256, 1, 3328]
    - [12, 3.767]
  - - [64, 448, 1, 3328]
    - [12, 3.309]
  - - [128, 448, 1, 3328]
    - [14, 6.609]
  - - [64, 704, 1, 3328]
    - [12, 5.178]
  - - [128, 704, 1, 3328]
    - [12, 9.951]
  - - [64, 1024, 1, 3328]
    - [12, 7.265]
  - - [128, 1024, 1, 3328]
    - [9, 13.539]
  - - [64, 1408, 1, 3328]
    - [12, 9.978]
  - - [128, 1408, 1, 3328]
    - [9, 18.417]
  - - [64, 1856, 1, 3328]
    - [29, 13.072]
  - - [128, 1856, 1, 3328]
    - [30, 22.643]
  - - [64, 2368, 1, 3328]
    - [9, 15.563]
  - - [128, 2368, 1, 3328]
    - [9, 24.269]
  - - [64, 2944, 1, 3328]
    - [9, 18.181]
  - - [128, 2944, 1, 3328]
    - [11, 24.709]
  - - [64, 3584, 1, 3328]
    - [9, 22.014]
  - - [128, 3584, 1, 3328]
    - [11, 29.827]
  - - [64, 4288, 1, 3328]
    - [30, 22.2]
  - - [128, 4288, 1, 3328]
    - [21, 28.56]
  - - [64, 5056, 1, 3328]
    - [27, 24.254]
  - - [128, 5056, 1, 3328]
    - [21, 28.132]
  - - [64, 5888, 1, 3328]
    - [4, 24.275]
  - - [128, 5888, 1, 3328]
    - [5, 31.318]
  - - [64, 6784, 1, 3328]
    - [5, 27.302]
  - - [128, 6784, 1, 3328]
    - [5, 34.397]
  - - [256, 64, 1, 256]
    - [2, 1.0]
  - - [448, 64, 1, 256]
    - [12, 2.27]
  - - [704, 64, 1, 256]
    - [7, 3.54]
  - - [1024, 64, 1, 256]
    - [29, 5.025]
  - - [1408, 64, 1, 256]
    - [29, 6.801]
  - - [1856, 64, 1, 256]
    - [10, 9.035]
  - - [2368, 64, 1, 256]
    - [30, 10.679]
  - - [2944, 64, 1, 256]
    - [30, 12.805]
  - - [3584, 64, 1, 256]
    - [10, 15.372]
  - - [4288, 64, 1, 256]
    - [4, 15.291]
  - - [5056, 64, 1, 256]
    - [27, 16.761]
  - - [5888, 64, 1, 256]
    - [11, 17.788]
  - - [6784, 64, 1, 256]
    - [28, 20.295]
  - - [256, 128, 1, 256]
    - [7, 2.596]
  - - [448, 128, 1, 256]
    - [8, 4.504]
  - - [704, 128, 1, 256]
    - [29, 6.855]
  - - [1024, 128, 1, 256]
    - [29, 9.373]
  - - [1408, 128, 1, 256]
    - [9, 12.7]
  - - [1856, 128, 1, 256]
    - [10, 16.033]
  - - [2368, 128, 1, 256]
    - [20, 16.791]
  - - [2944, 128, 1, 256]
    - [20, 18.238]
  - - [3584, 128, 1, 256]
    - [21, 21.55]
  - - [4288, 128, 1, 256]
    - [21, 22.101]
  - - [5056, 128, 1, 256]
    - [18, 23.763]
  - - [5888, 128, 1, 256]
    - [21, 25.431]
  - - [6784, 128, 1, 256]
    - [21, 28.303]
  - - [256, 64, 1, 1280]
    - [2, 1.569]
  - - [448, 64, 1, 1280]
    - [12, 3.114]
  - - [704, 64, 1, 1280]
    - [12, 4.872]
  - - [1024, 64, 1, 1280]
    - [29, 6.813]
  - - [1408, 64, 1, 1280]
    - [29, 9.367]
  - - [1856, 64, 1, 1280]
    - [10, 12.212]
  - - [2368, 64, 1, 1280]
    - [9, 14.731]
  - - [2944, 64, 1, 1280]
    - [9, 17.1]
  - - [3584, 64, 1, 1280]
    - [27, 20.582]
  - - [4288, 64, 1, 1280]
    - [9, 20.906]
  - - [5056, 64, 1, 1280]
    - [27, 22.867]
  - - [5888, 64, 1, 1280]
    - [4, 23.299]
  - - [6784, 64, 1, 1280]
    - [11, 26.844]
  - - [256, 128, 1, 1280]
    - [31, 3.537]
  - - [448, 128, 1, 1280]
    - [14, 6.202]
  - - [704, 128, 1, 1280]
    - [29, 9.346]
  - - [1024, 128, 1, 1280]
    - [9, 12.536]
  - - [1408, 128, 1, 1280]
    - [9, 17.237]
  - - [1856, 128, 1, 1280]
    - [9, 21.397]
  - - [2368, 128, 1, 1280]
    - [20, 22.942]
  - - [2944, 128, 1, 1280]
    - [11, 23.511]
  - - [3584, 128, 1, 1280]
    - [28, 28.252]
  - - [4288, 128, 1, 1280]
    - [21, 27.77]
  - - [5056, 128, 1, 1280]
    - [3, 29.393]
  - - [5888, 128, 1, 1280]
    - [21, 30.89]
  - - [6784, 128, 1, 1280]
    - [21, 34.019]
  - - [256, 64, 1, 3328]
    - [23, 1.755]
  - - [448, 64, 1, 3328]
    - [12, 3.309]
  - - [704, 64, 1, 3328]
    - [12, 5.172]
  - - [1024, 64, 1, 3328]
    - [12, 7.283]
  - - [1408, 64, 1, 3328]
    - [12, 9.942]
  - - [1856, 64, 1, 3328]
    - [10, 12.982]
  - - [2368, 64, 1, 3328]
    - [9, 15.45]
  - - [2944, 64, 1, 3328]
    - [9, 18.127]
  - - [3584, 64, 1, 3328]
    - [9, 21.813]
  - - [4288, 64, 1, 3328]
    - [9, 22.388]
  - - [5056, 64, 1, 3328]
    - [27, 24.329]
  - - [5888, 64, 1, 3328]
    - [11, 24.748]
  - - [6784, 64, 1, 3328]
    - [11, 28.333]
  - - [256, 128, 1, 3328]
    - [31, 3.761]
  - - [448, 128, 1, 3328]
    - [14, 6.597]
  - - [704, 128, 1, 3328]
    - [29, 9.951]
  - - [1024, 128, 1, 3328]
    - [9, 13.407]
  - - [1408, 128, 1, 3328]
    - [9, 18.312]
  - - [1856, 128, 1, 3328]
    - [30, 22.592]
  - - [2368, 128, 1, 3328]
    - [9, 24.535]
  - - [2944, 128, 1, 3328]
    - [11, 24.733]
  - - [3584, 128, 1, 3328]
    - [11, 29.923]
  - - [4288, 128, 1, 3328]
    - [21, 28.755]
  - - [5056, 128, 1, 3328]
    - [3, 30.689]
  - - [5888, 128, 1, 3328]
    - [21, 31.947]
  - - [6784, 128, 1, 3328]
    - [21, 35.044]
  - - [256, 256, 1, 256]
    - [7, 5.106]
  - - [448, 256, 1, 256]
    - [10, 8.655]
  - - [256, 448, 1, 256]
    - [10, 8.655]
  - - [448, 448, 1, 256]
    - [10, 13.545]
  - - [256, 256, 1, 1280]
    - [29, 6.798]
  - - [448, 256, 1, 1280]
    - [10, 11.817]
  - - [256, 448, 1, 1280]
    - [10, 11.844]
  - - [448, 448, 1, 1280]
    - [9, 18.145]
  - - [256, 256, 1, 3328]
    - [29, 7.265]
  - - [448, 256, 1, 3328]
    - [29, 12.566]
  - - [256, 448, 1, 3328]
    - [29, 12.578]
  - - [448, 448, 1, 3328]
    - [30, 19.235]
  - - [512, 32, 1, 512]
    - [17, 1.207]
  - - [1024, 32, 1, 512]
    - [29, 3.079]
  - - [1760, 32, 1, 1760]
    - [9, 6.175]
  - - [3072, 32, 1, 1024]
    - [29, 9.915]
  - - [2048, 32, 1, 2048]
    - [29, 7.085]
  - - [1760, 64, 1, 1760]
    - [29, 11.931]
  - - [3072, 64, 1, 1024]
    - [9, 17.486]
  - - [2560, 32, 1, 2560]
    - [12, 8.942]
  - - [4608, 32, 1, 1536]
    - [9, 14.371]
  - - [128, 1500, 1, 1280]
    - [9, 17.522]
  - - [2048, 64, 1, 2048]
    - [30, 13.171]
  - - [176, 1500, 1, 1408]
    - [9, 20.283]
  - - [1760, 128, 1, 1760]
    - [30, 20.759]
  - - [3072, 128, 1, 1024]
    - [11, 23.963]
  - - [2560, 64, 1, 2560]
    - [9, 16.528]
  - - [6144, 32, 1, 2560]
    - [10, 18.561]
  - - [2048, 128, 1, 2048]
    - [30, 21.065]
  - - [4096, 32, 1, 4096]
    - [9, 13.569]
  - - [7680, 32, 1, 2560]
    - [9, 23.023]
  - - [8448, 32, 1, 2816]
    - [9, 21.852]
  - - [2560, 128, 1, 2560]
    - [27, 24.437]
  - - [4096, 64, 1, 4096]
    - [30, 21.484]
  - - [7680, 64, 1, 2560]
    - [11, 31.57]
  - - [4096, 128, 1, 4096]
    - [21, 27.473]
  - - [7680, 128, 1, 2560]
    - [21, 39.122]
  - - [704, 256, 1, 256]
    - [19, 7.996]
  - - [1024, 256, 1, 256]
    - [19, 11.368]
  - - [1408, 256, 1, 256]
    - [26, 13.928]
  - - [1856, 256, 1, 256]
    - [33, 18.142]
  - - [2368, 256, 1, 256]
    - [32, 18.324]
  - - [2944, 256, 1, 256]
    - [33, 22.855]
  - - [3584, 256, 1, 256]
    - [33, 27.737]
  - - [4288, 256, 1, 256]
    - [32, 26.904]
  - - [5056, 256, 1, 256]
    - [33, 31.561]
  - - [5888, 256, 1, 256]
    - [32, 29.539]
  - - [6784, 256, 1, 256]
    - [32, 34.103]
  - - [704, 448, 1, 256]
    - [26, 12.488]
  - - [1024, 448, 1, 256]
    - [36, 17.171]
  - - [1408, 448, 1, 256]
    - [19, 18.95]
  - - [1856, 448, 1, 256]
    - [33, 25.377]
  - - [2368, 448, 1, 256]
    - [32, 26.069]
  - - [2944, 448, 1, 256]
    - [33, 32.408]
  - - [3584, 448, 1, 256]
    - [15, 31.66]
  - - [4288, 448, 1, 256]
    - [32, 37.568]
  - - [5056, 448, 1, 256]
    - [32, 35.068]
  - - [5888, 448, 1, 256]
    - [33, 35.753]
  - - [6784, 448, 1, 256]
    - [33, 36.316]
  - - [256, 704, 1, 256]
    - [19, 7.921]
  - - [448, 704, 1, 256]
    - [26, 12.437]
  - - [704, 704, 1, 256]
    - [19, 15.47]
  - - [1024, 704, 1, 256]
    - [32, 21.388]
  - - [1408, 704, 1, 256]
    - [32, 24.17]
  - - [1856, 704, 1, 256]
    - [33, 31.54]
  - - [2368, 704, 1, 256]
    - [32, 32.873]
  - - [2944, 704, 1, 256]
    - [33, 32.507]
  - - [3584, 704, 1, 256]
    - [33, 34.298]
  - - [4288, 704, 1, 256]
    - [33, 36.251]
  - - [5056, 704, 1, 256]
    - [32, 37.942]
  - - [5888, 704, 1, 256]
    - [33, 39.134]
  - - [6784, 704, 1, 256]
    - [33, 41.494]
  - - [256, 1024, 1, 256]
    - [19, 11.368]
  - - [448, 1024, 1, 256]
    - [19, 17.725]
  - - [704, 1024, 1, 256]
    - [33, 21.93]
  - - [1024, 1024, 1, 256]
    - [33, 25.569]
  - - [1408, 1024, 1, 256]
    - [32, 34.801]
  - - [1856, 1024, 1, 256]
    - [32, 36.646]
  - - [2368, 1024, 1, 256]
    - [32, 37.784]
  - - [2944, 1024, 1, 256]
    - [33, 35.933]
  - - [3584, 1024, 1, 256]
    - [33, 38.733]
  - - [4288, 1024, 1, 256]
    - [33, 41.539]
  - - [5056, 1024, 1, 256]
    - [33, 41.311]
  - - [5888, 1024, 1, 256]
    - [32, 41.036]
  - - [6784, 1024, 1, 256]
    - [32, 41.53]
  - - [256, 1408, 1, 256]
    - [26, 14.042]
  - - [448, 1408, 1, 256]
    - [33, 19.376]
  - - [704, 1408, 1, 256]
    - [32, 24.17]
  - - [1024, 1408, 1, 256]
    - [32, 34.115]
  - - [1408, 1408, 1, 256]
    - [32, 31.195]
  - - [1856, 1408, 1, 256]
    - [32, 35.322]
  - - [2368, 1408, 1, 256]
    - [32, 39.494]
  - - [2944, 1408, 1, 256]
    - [32, 39.368]
  - - [3584, 1408, 1, 256]
    - [32, 40.132]
  - - [4288, 1408, 1, 256]
    - [33, 41.297]
  - - [5056, 1408, 1, 256]
    - [33, 42.692]
  - - [5888, 1408, 1, 256]
    - [33, 43.989]
  - - [6784, 1408, 1, 256]
    - [33, 43.65]
  - - [256, 1856, 1, 256]
    - [19, 18.214]
  - - [448, 1856, 1, 256]
    - [33, 25.296]
  - - [704, 1856, 1, 256]
    - [32, 31.779]
  - - [1024, 1856, 1, 256]
    - [32, 36.424]
  - - [1408, 1856, 1, 256]
    - [32, 35.523]
  - - [1856, 1856, 1, 256]
    - [33, 37.05]
  - - [2368, 1856, 1, 256]
    - [32, 41.617]
  - - [2944, 1856, 1, 256]
    - [32, 40.341]
  - - [3584, 1856, 1, 256]
    - [33, 42.581]
  - - [4288, 1856, 1, 256]
    - [33, 42.348]
  - - [5056, 1856, 1, 256]
    - [32, 42.944]
  - - [5888, 1856, 1, 256]
    - [33, 43.689]
  - - [6784, 1856, 1, 256]
    - [33, 44.624]
  - - [256, 2368, 1, 256]
    - [33, 18.097]
  - - [448, 2368, 1, 256]
    - [32, 26.2]
  - - [704, 2368, 1, 256]
    - [32, 32.669]
  - - [1024, 2368, 1, 256]
    - [33, 38.032]
  - - [1408, 2368, 1, 256]
    - [32, 39.347]
  - - [1856, 2368, 1, 256]
    - [33, 41.536]
  - - [2368, 2368, 1, 256]
    - [32, 41.114]
  - - [2944, 2368, 1, 256]
    - [33, 41.782]
  - - [3584, 2368, 1, 256]
    - [32, 42.806]
  - - [4288, 2368, 1, 256]
    - [33, 44.189]
  - - [5056, 2368, 1, 256]
    - [32, 44.18]
  - - [5888, 2368, 1, 256]
    - [32, 44.465]
  - - [6784, 2368, 1, 256]
    - [33, 45.238]
  - - [256, 2944, 1, 256]
    - [32, 22.571]
  - - [448, 2944, 1, 256]
    - [33, 32.324]
  - - [704, 2944, 1, 256]
    - [32, 32.666]
  - - [1024, 2944, 1, 256]
    - [33, 35.978]
  - - [1408, 2944, 1, 256]
    - [32, 39.06]
  - - [1856, 2944, 1, 256]
    - [32, 40.464]
  - - [2368, 2944, 1, 256]
    - [32, 41.677]
  - - [2944, 2944, 1, 256]
    - [33, 43.713]
  - - [3584, 2944, 1, 256]
    - [33, 43.923]
  - - [4288, 2944, 1, 256]
    - [33, 44.887]
  - - [5056, 2944, 1, 256]
    - [32, 44.576]
  - - [5888, 2944, 1, 256]
    - [32, 45.004]
  - - [6784, 2944, 1, 256]
    - [33, 45.69]
  - - [256, 3584, 1, 256]
    - [32, 27.054]
  - - [448, 3584, 1, 256]
    - [32, 31.66]
  - - [704, 3584, 1, 256]
    - [32, 34.591]
  - - [1024, 3584, 1, 256]
    - [32, 38.904]
  - - [1408, 3584, 1, 256]
    - [32, 40.365]
  - - [1856, 3584, 1, 256]
    - [33, 42.467]
  - - [2368, 3584, 1, 256]
    - [32, 42.872]
  - - [2944, 3584, 1, 256]
    - [32, 43.98]
  - - [3584, 3584, 1, 256]
    - [32, 44.135]
  - - [4288, 3584, 1, 256]
    - [32, 44.71]
  - - [5056, 3584, 1, 256]
    - [33, 45.711]
  - - [5888, 3584, 1, 256]
    - [33, 45.98]
  - - [6784, 3584, 1, 256]
    - [35, 45.893]
  - - [256, 4288, 1, 256]
    - [32, 26.299]
  - - [448, 4288, 1, 256]
    - [33, 37.88]
  - - [704, 4288, 1, 256]
    - [32, 36.161]
  - - [1024, 4288, 1, 256]
    - [33, 41.704]
  - - [1408, 4288, 1, 256]
    - [32, 41.21]
  - - [1856, 4288, 1, 256]
    - [33, 42.417]
  - - [2368, 4288, 1, 256]
    - [32, 44.33]
  - - [2944, 4288, 1, 256]
    - [33, 44.806]
  - - [3584, 4288, 1, 256]
    - [33, 44.722]
  - - [4288, 4288, 1, 256]
    - [33, 45.214]
  - - [5056, 4288, 1, 256]
    - [32, 45.273]
  - - [5888, 4288, 1, 256]
    - [35, 45.815]
  - - [6784, 4288, 1, 256]
    - [35, 45.977]
  - - [256, 5056, 1, 256]
    - [32, 30.932]
  - - [448, 5056, 1, 256]
    - [33, 35.409]
  - - [704, 5056, 1, 256]
    - [32, 37.691]
  - - [1024, 5056, 1, 256]
    - [32, 41.243]
  - - [1408, 5056, 1, 256]
    - [32, 42.53]
  - - [1856, 5056, 1, 256]
    - [32, 43.006]
  - - [2368, 5056, 1, 256]
    - [32, 44.162]
  - - [2944, 5056, 1, 256]
    - [32, 44.716]
  - - [3584, 5056, 1, 256]
    - [33, 45.795]
  - - [4288, 5056, 1, 256]
    - [33, 45.321]
  - - [5056, 5056, 1, 256]
    - [33, 45.516]
  - - [5888, 5056, 1, 256]
    - [33, 46.103]
  - - [6784, 5056, 1, 256]
    - [35, 46.564]
  - - [256, 5888, 1, 256]
    - [33, 29.599]
  - - [448, 5888, 1, 256]
    - [32, 35.804]
  - - [704, 5888, 1, 256]
    - [33, 39.446]
  - - [1024, 5888, 1, 256]
    - [33, 40.979]
  - - [1408, 5888, 1, 256]
    - [32, 43.893]
  - - [1856, 5888, 1, 256]
    - [32, 43.743]
  - - [2368, 5888, 1, 256]
    - [32, 44.716]
  - - [2944, 5888, 1, 256]
    - [32, 45.079]
  - - [3584, 5888, 1, 256]
    - [33, 46.013]
  - - [4288, 5888, 1, 256]
    - [33, 45.815]
  - - [5056, 5888, 1, 256]
    - [32, 46.094]
  - - [5888, 5888, 1, 256]
    - [33, 46.265]
  - - [6784, 5888, 1, 256]
    - [35, 46.414]
  - - [256, 6784, 1, 256]
    - [33, 34.244]
  - - [448, 6784, 1, 256]
    - [33, 36.361]
  - - [704, 6784, 1, 256]
    - [32, 41.306]
  - - [1024, 6784, 1, 256]
    - [32, 41.452]
  - - [1408, 6784, 1, 256]
    - [32, 43.713]
  - - [1856, 6784, 1, 256]
    - [32, 44.755]
  - - [2368, 6784, 1, 256]
    - [33, 45.33]
  - - [2944, 6784, 1, 256]
    - [32, 45.645]
  - - [3584, 6784, 1, 256]
    - [35, 45.866]
  - - [4288, 6784, 1, 256]
    - [33, 45.887]
  - - [5056, 6784, 1, 256]
    - [34, 46.453]
  - - [5888, 6784, 1, 256]
    - [35, 46.492]
  - - [6784, 6784, 1, 256]
    - [35, 46.774]
  - - [704, 256, 1, 1280]
    - [24, 9.499]
  - - [1024, 256, 1, 1280]
    - [24, 13.668]
  - - [1408, 256, 1, 1280]
    - [26, 18.22]
  - - [1856, 256, 1, 1280]
    - [19, 23.79]
  - - [2368, 256, 1, 1280]
    - [19, 22.379]
  - - [2944, 256, 1, 1280]
    - [19, 27.608]
  - - [3584, 256, 1, 1280]
    - [33, 33.28]
  - - [4288, 256, 1, 1280]
    - [33, 31.031]
  - - [5056, 256, 1, 1280]
    - [33, 36.589]
  - - [5888, 256, 1, 1280]
    - [33, 33.609]
  - - [6784, 256, 1, 1280]
    - [32, 38.631]
  - - [704, 448, 1, 1280]
    - [26, 16.093]
  - - [1024, 448, 1, 1280]
    - [24, 23.236]
  - - [1408, 448, 1, 1280]
    - [33, 23.107]
  - - [1856, 448, 1, 1280]
    - [33, 30.297]
  - - [2368, 448, 1, 1280]
    - [19, 30.201]
  - - [2944, 448, 1, 1280]
    - [33, 37.481]
  - - [3584, 448, 1, 1280]
    - [33, 35.75]
  - - [4288, 448, 1, 1280]
    - [32, 42.536]
  - - [5056, 448, 1, 1280]
    - [33, 39.365]
  - - [5888, 448, 1, 1280]
    - [33, 39.41]
  - - [6784, 448, 1, 1280]
    - [33, 39.56]
  - - [256, 704, 1, 1280]
    - [19, 9.511]
  - - [448, 704, 1, 1280]
    - [26, 16.06]
  - - [704, 704, 1, 1280]
    - [19, 18.336]
  - - [1024, 704, 1, 1280]
    - [19, 26.347]
  - - [1408, 704, 1, 1280]
    - [19, 28.404]
  - - [1856, 704, 1, 1280]
    - [33, 36.936]
  - - [2368, 704, 1, 1280]
    - [32, 37.134]
  - - [2944, 704, 1, 1280]
    - [33, 36.008]
  - - [3584, 704, 1, 1280]
    - [33, 37.838]
  - - [4288, 704, 1, 1280]
    - [33, 39.413]
  - - [5056, 704, 1, 1280]
    - [33, 41.105]
  - - [5888, 704, 1, 1280]
    - [33, 42.539]
  - - [6784, 704, 1, 1280]
    - [33, 44.477]
  - - [256, 1024, 1, 1280]
    - [19, 13.653]
  - - [448, 1024, 1, 1280]
    - [24, 22.969]
  - - [704, 1024, 1, 1280]
    - [33, 26.326]
  - - [1024, 1024, 1, 1280]
    - [33, 29.764]
  - - [1408, 1024, 1, 1280]
    - [33, 40.377]
  - - [1856, 1024, 1, 1280]
    - [32, 42.159]
  - - [2368, 1024, 1, 1280]
    - [33, 42.051]
  - - [2944, 1024, 1, 1280]
    - [33, 39.305]
  - - [3584, 1024, 1, 1280]
    - [33, 42.426]
  - - [4288, 1024, 1, 1280]
    - [33, 44.944]
  - - [5056, 1024, 1, 1280]
    - [33, 44.007]
  - - [5888, 1024, 1, 1280]
    - [33, 43.659]
  - - [6784, 1024, 1, 1280]
    - [33, 43.947]
  - - [256, 1408, 1, 1280]
    - [24, 18.199]
  - - [448, 1408, 1, 1280]
    - [24, 23.143]
  - - [704, 1408, 1, 1280]
    - [33, 28.339]
  - - [1024, 1408, 1, 1280]
    - [33, 40.422]
  - - [1408, 1408, 1, 1280]
    - [33, 34.466]
  - - [1856, 1408, 1, 1280]
    - [33, 39.116]
  - - [2368, 1408, 1, 1280]
    - [33, 43.165]
  - - [2944, 1408, 1, 1280]
    - [33, 42.467]
  - - [3584, 1408, 1, 1280]
    - [33, 42.902]
  - - [4288, 1408, 1, 1280]
    - [33, 43.719]
  - - [5056, 1408, 1, 1280]
    - [33, 44.941]
  - - [5888, 1408, 1, 1280]
    - [33, 46.372]
  - - [6784, 1408, 1, 1280]
    - [33, 45.717]
  - - [256, 1856, 1, 1280]
    - [24, 23.763]
  - - [448, 1856, 1, 1280]
    - [33, 30.114]
  - - [704, 1856, 1, 1280]
    - [33, 37.044]
  - - [1024, 1856, 1, 1280]
    - [32, 42.024]
  - - [1408, 1856, 1, 1280]
    - [33, 39.033]
  - - [1856, 1856, 1, 1280]
    - [33, 39.859]
  - - [2368, 1856, 1, 1280]
    - [33, 44.92]
  - - [2944, 1856, 1, 1280]
    - [33, 42.872]
  - - [3584, 1856, 1, 1280]
    - [33, 44.974]
  - - [4288, 1856, 1, 1280]
    - [33, 44.564]
  - - [5056, 1856, 1, 1280]
    - [33, 44.941]
  - - [5888, 1856, 1, 1280]
    - [33, 45.654]
  - - [6784, 1856, 1, 1280]
    - [33, 46.678]
  - - [256, 2368, 1, 1280]
    - [19, 22.205]
  - - [448, 2368, 1, 1280]
    - [19, 30.114]
  - - [704, 2368, 1, 1280]
    - [33, 36.963]
  - - [1024, 2368, 1, 1280]
    - [33, 42.036]
  - - [1408, 2368, 1, 1280]
    - [33, 43.246]
  - - [1856, 2368, 1, 1280]
    - [33, 44.986]
  - - [2368, 2368, 1, 1280]
    - [33, 44.01]
  - - [2944, 2368, 1, 1280]
    - [33, 44.061]
  - - [3584, 2368, 1, 1280]
    - [33, 45.028]
  - - [4288, 2368, 1, 1280]
    - [33, 46.274]
  - - [5056, 2368, 1, 1280]
    - [33, 46.082]
  - - [5888, 2368, 1, 1280]
    - [33, 46.465]
  - - [6784, 2368, 1, 1280]
    - [33, 47.112]
  - - [256, 2944, 1, 1280]
    - [33, 27.461]
  - - [448, 2944, 1, 1280]
    - [33, 37.197]
  - - [704, 2944, 1, 1280]
    - [33, 35.981]
  - - [1024, 2944, 1, 1280]
    - [33, 39.155]
  - - [1408, 2944, 1, 1280]
    - [33, 42.446]
  - - [1856, 2944, 1, 1280]
    - [33, 42.956]
  - - [2368, 2944, 1, 1280]
    - [33, 44.04]
  - - [2944, 2944, 1, 1280]
    - [33, 45.98]
  - - [3584, 2944, 1, 1280]
    - [32, 45.98]
  - - [4288, 2944, 1, 1280]
    - [33, 46.732]
  - - [5056, 2944, 1, 1280]
    - [33, 46.414]
  - - [5888, 2944, 1, 1280]
    - [33, 46.675]
  - - [6784, 2944, 1, 1280]
    - [33, 47.304]
  - - [256, 3584, 1, 1280]
    - [33, 33.205]
  - - [448, 3584, 1, 1280]
    - [33, 35.553]
  - - [704, 3584, 1, 1280]
    - [33, 37.628]
  - - [1024, 3584, 1, 1280]
    - [33, 42.24]
  - - [1408, 3584, 1, 1280]
    - [33, 42.893]
  - - [1856, 3584, 1, 1280]
    - [33, 44.959]
  - - [2368, 3584, 1, 1280]
    - [33, 45.052]
  - - [2944, 3584, 1, 1280]
    - [33, 46.04]
  - - [3584, 3584, 1, 1280]
    - [33, 45.899]
  - - [4288, 3584, 1, 1280]
    - [33, 46.465]
  - - [5056, 3584, 1, 1280]
    - [33, 47.445]
  - - [5888, 3584, 1, 1280]
    - [33, 47.687]
  - - [6784, 3584, 1, 1280]
    - [33, 47.367]
  - - [256, 4288, 1, 1280]
    - [33, 31.106]
  - - [448, 4288, 1, 1280]
    - [32, 42.3]
  - - [704, 4288, 1, 1280]
    - [33, 39.263]
  - - [1024, 4288, 1, 1280]
    - [33, 44.983]
  - - [1408, 4288, 1, 1280]
    - [33, 43.746]
  - - [1856, 4288, 1, 1280]
    - [33, 44.6]
  - - [2368, 4288, 1, 1280]
    - [33, 46.295]
  - - [2944, 4288, 1, 1280]
    - [33, 46.753]
  - - [3584, 4288, 1, 1280]
    - [33, 46.477]
  - - [4288, 4288, 1, 1280]
    - [33, 46.947]
  - - [5056, 4288, 1, 1280]
    - [33, 46.843]
  - - [5888, 4288, 1, 1280]
    - [33, 47.295]
  - - [6784, 4288, 1, 1280]
    - [32, 47.313]
  - - [256, 5056, 1, 1280]
    - [33, 36.676]
  - - [448, 5056, 1, 1280]
    - [33, 39.251]
  - - [704, 5056, 1, 1280]
    - [33, 41.087]
  - - [1024, 5056, 1, 1280]
    - [33, 43.938]
  - - [1408, 5056, 1, 1280]
    - [33, 44.923]
  - - [1856, 5056, 1, 1280]
    - [33, 44.941]
  - - [2368, 5056, 1, 1280]
    - [33, 46.151]
  - - [2944, 5056, 1, 1280]
    - [33, 46.447]
  - - [3584, 5056, 1, 1280]
    - [33, 47.522]
  - - [4288, 5056, 1, 1280]
    - [33, 46.867]
  - - [5056, 5056, 1, 1280]
    - [32, 47.001]
  - - [5888, 5056, 1, 1280]
    - [33, 47.627]
  - - [6784, 5056, 1, 1280]
    - [32, 47.858]
  - - [256, 5888, 1, 1280]
    - [33, 33.498]
  - - [448, 5888, 1, 1280]
    - [33, 39.08]
  - - [704, 5888, 1, 1280]
    - [33, 42.411]
  - - [1024, 5888, 1, 1280]
    - [33, 43.632]
  - - [1408, 5888, 1, 1280]
    - [33, 46.387]
  - - [1856, 5888, 1, 1280]
    - [33, 45.627]
  - - [2368, 5888, 1, 1280]
    - [33, 46.459]
  - - [2944, 5888, 1, 1280]
    - [33, 46.708]
  - - [3584, 5888, 1, 1280]
    - [33, 47.672]
  - - [4288, 5888, 1, 1280]
    - [33, 47.292]
  - - [5056, 5888, 1, 1280]
    - [33, 47.636]
  - - [5888, 5888, 1, 1280]
    - [33, 47.72]
  - - [6784, 5888, 1, 1280]
    - [32, 47.672]
  - - [256, 6784, 1, 1280]
    - [33, 38.365]
  - - [448, 6784, 1, 1280]
    - [33, 39.518]
  - - [704, 6784, 1, 1280]
    - [33, 44.462]
  - - [1024, 6784, 1, 1280]
    - [33, 43.89]
  - - [1408, 6784, 1, 1280]
    - [33, 45.639]
  - - [1856, 6784, 1, 1280]
    - [33, 46.642]
  - - [2368, 6784, 1, 1280]
    - [33, 47.103]
  - - [2944, 6784, 1, 1280]
    - [32, 47.289]
  - - [3584, 6784, 1, 1280]
    - [33, 47.34]
  - - [4288, 6784, 1, 1280]
    - [33, 47.31]
  - - [5056, 6784, 1, 1280]
    - [33, 47.876]
  - - [5888, 6784, 1, 1280]
    - [32, 47.654]
  - - [6784, 6784, 1, 1280]
    - [35, 47.942]
  - - [704, 256, 1, 3328]
    - [24, 9.891]
  - - [1024, 256, 1, 3328]
    - [24, 14.225]
  - - [1408, 256, 1, 3328]
    - [24, 19.256]
  - - [1856, 256, 1, 3328]
    - [24, 25.392]
  - - [2368, 256, 1, 3328]
    - [24, 23.251]
  - - [2944, 256, 1, 3328]
    - [19, 28.635]
  - - [3584, 256, 1, 3328]
    - [19, 34.532]
  - - [4288, 256, 1, 3328]
    - [19, 32.139]
  - - [5056, 256, 1, 3328]
    - [33, 37.673]
  - - [5888, 256, 1, 3328]
    - [33, 34.343]
  - - [6784, 256, 1, 3328]
    - [33, 39.461]
  - - [704, 448, 1, 3328]
    - [24, 16.869]
  - - [1024, 448, 1, 3328]
    - [24, 24.404]
  - - [1408, 448, 1, 3328]
    - [19, 24.059]
  - - [1856, 448, 1, 3328]
    - [33, 31.294]
  - - [2368, 448, 1, 3328]
    - [24, 31.037]
  - - [2944, 448, 1, 3328]
    - [33, 38.266]
  - - [3584, 448, 1, 3328]
    - [33, 36.562]
  - - [4288, 448, 1, 3328]
    - [33, 43.599]
  - - [5056, 448, 1, 3328]
    - [33, 39.97]
  - - [5888, 448, 1, 3328]
    - [33, 40.105]
  - - [6784, 448, 1, 3328]
    - [33, 40.117]
  - - [256, 704, 1, 3328]
    - [24, 9.885]
  - - [448, 704, 1, 3328]
    - [24, 16.935]
  - - [704, 704, 1, 3328]
    - [19, 19.085]
  - - [1024, 704, 1, 3328]
    - [19, 27.566]
  - - [1408, 704, 1, 3328]
    - [24, 29.036]
  - - [1856, 704, 1, 3328]
    - [33, 37.925]
  - - [2368, 704, 1, 3328]
    - [33, 37.954]
  - - [2944, 704, 1, 3328]
    - [33, 36.688]
  - - [3584, 704, 1, 3328]
    - [33, 38.389]
  - - [4288, 704, 1, 3328]
    - [33, 39.814]
  - - [5056, 704, 1, 3328]
    - [33, 41.704]
  - - [5888, 704, 1, 3328]
    - [33, 42.983]
  - - [6784, 704, 1, 3328]
    - [33, 45.088]
  - - [256, 1024, 1, 3328]
    - [24, 14.219]
  - - [448, 1024, 1, 3328]
    - [24, 24.425]
  - - [704, 1024, 1, 3328]
    - [24, 27.431]
  - - [1024, 1024, 1, 3328]
    - [19, 30.707]
  - - [1408, 1024, 1, 3328]
    - [33, 41.86]
  - - [1856, 1024, 1, 3328]
    - [33, 43.072]
  - - [2368, 1024, 1, 3328]
    - [33, 42.728]
  - - [2944, 1024, 1, 3328]
    - [33, 39.787]
  - - [3584, 1024, 1, 3328]
    - [33, 42.938]
  - - [4288, 1024, 1, 3328]
    - [33, 45.42]
  - - [5056, 1024, 1, 3328]
    - [33, 44.423]
  - - [5888, 1024, 1, 3328]
    - [33, 44.118]
  - - [6784, 1024, 1, 3328]
    - [33, 44.282]
  - - [256, 1408, 1, 3328]
    - [19, 19.289]
  - - [448, 1408, 1, 3328]
    - [19, 24.083]
  - - [704, 1408, 1, 3328]
    - [33, 29.063]
  - - [1024, 1408, 1, 3328]
    - [33, 41.608]
  - - [1408, 1408, 1, 3328]
    - [33, 35.113]
  - - [1856, 1408, 1, 3328]
    - [33, 39.727]
  - - [2368, 1408, 1, 3328]
    - [33, 43.917]
  - - [2944, 1408, 1, 3328]
    - [33, 42.995]
  - - [3584, 1408, 1, 3328]
    - [33, 43.345]
  - - [4288, 1408, 1, 3328]
    - [33, 44.153]
  - - [5056, 1408, 1, 3328]
    - [33, 45.378]
  - - [5888, 1408, 1, 3328]
    - [33, 46.762]
  - - [6784, 1408, 1, 3328]
    - [33, 46.145]
  - - [256, 1856, 1, 3328]
    - [24, 25.23]
  - - [448, 1856, 1, 3328]
    - [19, 31.267]
  - - [704, 1856, 1, 3328]
    - [33, 37.901]
  - - [1024, 1856, 1, 3328]
    - [33, 43.072]
  - - [1408, 1856, 1, 3328]
    - [33, 39.754]
  - - [1856, 1856, 1, 3328]
    - [33, 40.347]
  - - [2368, 1856, 1, 3328]
    - [33, 45.429]
  - - [2944, 1856, 1, 3328]
    - [33, 43.321]
  - - [3584, 1856, 1, 3328]
    - [33, 45.378]
  - - [4288, 1856, 1, 3328]
    - [33, 44.953]
  - - [5056, 1856, 1, 3328]
    - [33, 45.342]
  - - [5888, 1856, 1, 3328]
    - [33, 46.001]
  - - [6784, 1856, 1, 3328]
    - [33, 46.965]
  - - [256, 2368, 1, 3328]
    - [19, 23.11]
  - - [448, 2368, 1, 3328]
    - [33, 30.923]
  - - [704, 2368, 1, 3328]
    - [33, 37.814]
  - - [1024, 2368, 1, 3328]
    - [33, 42.539]
  - - [1408, 2368, 1, 3328]
    - [33, 43.8]
  - - [1856, 2368, 1, 3328]
    - [33, 45.438]
  - - [2368, 2368, 1, 3328]
    - [33, 44.444]
  - - [2944, 2368, 1, 3328]
    - [33, 44.456]
  - - [3584, 2368, 1, 3328]
    - [33, 45.405]
  - - [4288, 2368, 1, 3328]
    - [33, 46.654]
  - - [5056, 2368, 1, 3328]
    - [33, 46.429]
  - - [5888, 2368, 1, 3328]
    - [33, 46.741]
  - - [6784, 2368, 1, 3328]
    - [33, 47.415]
  - - [256, 2944, 1, 3328]
    - [33, 28.357]
  - - [448, 2944, 1, 3328]
    - [33, 38.248]
  - - [704, 2944, 1, 3328]
    - [33, 36.583]
  - - [1024, 2944, 1, 3328]
    - [33, 39.781]
  - - [1408, 2944, 1, 3328]
    - [33, 42.938]
  - - [1856, 2944, 1, 3328]
    - [33, 43.3]
  - - [2368, 2944, 1, 3328]
    - [33, 44.408]
  - - [2944, 2944, 1, 3328]
    - [33, 46.331]
  - - [3584, 2944, 1, 3328]
    - [33, 46.387]
  - - [4288, 2944, 1, 3328]
    - [33, 47.109]
  - - [5056, 2944, 1, 3328]
    - [33, 46.741]
  - - [5888, 2944, 1, 3328]
    - [33, 46.986]
  - - [6784, 2944, 1, 3328]
    - [33, 47.606]
  - - [256, 3584, 1, 3328]
    - [33, 34.388]
  - - [448, 3584, 1, 3328]
    - [33, 36.301]
  - - [704, 3584, 1, 3328]
    - [33, 38.314]
  - - [1024, 3584, 1, 3328]
    - [33, 42.857]
  - - [1408, 3584, 1, 3328]
    - [33, 43.345]
  - - [1856, 3584, 1, 3328]
    - [33, 45.396]
  - - [2368, 3584, 1, 3328]
    - [33, 45.393]
  - - [2944, 3584, 1, 3328]
    - [33, 46.39]
  - - [3584, 3584, 1, 3328]
    - [33, 46.193]
  - - [4288, 3584, 1, 3328]
    - [33, 46.774]
  - - [5056, 3584, 1, 3328]
    - [33, 47.765]
  - - [5888, 3584, 1, 3328]
    - [33, 47.939]
  - - [6784, 3584, 1, 3328]
    - [33, 47.594]
  - - [256, 4288, 1, 3328]
    - [33, 31.974]
  - - [448, 4288, 1, 3328]
    - [33, 43.129]
  - - [704, 4288, 1, 3328]
    - [33, 39.757]
  - - [1024, 4288, 1, 3328]
    - [33, 45.39]
  - - [1408, 4288, 1, 3328]
    - [33, 44.121]
  - - [1856, 4288, 1, 3328]
    - [33, 44.902]
  - - [2368, 4288, 1, 3328]
    - [33, 46.615]
  - - [2944, 4288, 1, 3328]
    - [33, 47.064]
  - - [3584, 4288, 1, 3328]
    - [33, 46.723]
  - - [4288, 4288, 1, 3328]
    - [33, 47.196]
  - - [5056, 4288, 1, 3328]
    - [33, 47.091]
  - - [5888, 4288, 1, 3328]
    - [33, 47.528]
  - - [6784, 4288, 1, 3328]
    - [33, 47.552]
  - - [256, 5056, 1, 3328]
    - [33, 37.463]
  - - [448, 5056, 1, 3328]
    - [33, 39.907]
  - - [704, 5056, 1, 3328]
    - [33, 41.593]
  - - [1024, 5056, 1, 3328]
    - [33, 44.399]
  - - [1408, 5056, 1, 3328]
    - [33, 45.267]
  - - [1856, 5056, 1, 3328]
    - [33, 45.3]
  - - [2368, 5056, 1, 3328]
    - [33, 46.411]
  - - [2944, 5056, 1, 3328]
    - [33, 46.72]
  - - [3584, 5056, 1, 3328]
    - [33, 47.729]
  - - [4288, 5056, 1, 3328]
    - [33, 47.13]
  - - [5056, 5056, 1, 3328]
    - [33, 47.247]
  - - [5888, 5056, 1, 3328]
    - [33, 47.831]
  - - [6784, 5056, 1, 3328]
    - [33, 48.085]
  - - [256, 5888, 1, 3328]
    - [32, 34.067]
  - - [448, 5888, 1, 3328]
    - [33, 39.997]
  - - [704, 5888, 1, 3328]
    - [33, 42.911]
  - - [1024, 5888, 1, 3328]
    - [33, 44.04]
  - - [1408, 5888, 1, 3328]
    - [33, 46.762]
  - - [1856, 5888, 1, 3328]
    - [33, 45.929]
  - - [2368, 5888, 1, 3328]
    - [33, 46.72]
  - - [2944, 5888, 1, 3328]
    - [33, 46.956]
  - - [3584, 5888, 1, 3328]
    - [33, 47.93]
  - - [4288, 5888, 1, 3328]
    - [33, 47.561]
  - - [5056, 5888, 1, 3328]
    - [33, 47.837]
  - - [5888, 5888, 1, 3328]
    - [33, 47.951]
  - - [6784, 5888, 1, 3328]
    - [33, 47.867]
  - - [256, 6784, 1, 3328]
    - [33, 39.224]
  - - [448, 6784, 1, 3328]
    - [33, 39.982]
  - - [704, 6784, 1, 3328]
    - [33, 44.887]
  - - [1024, 6784, 1, 3328]
    - [33, 44.21]
  - - [1408, 6784, 1, 3328]
    - [33, 46.031]
  - - [1856, 6784, 1, 3328]
    - [33, 46.947]
  - - [2368, 6784, 1, 3328]
    - [33, 47.388]
  - - [2944, 6784, 1, 3328]
    - [33, 47.549]
  - - [3584, 6784, 1, 3328]
    - [33, 47.597]
  - - [4288, 6784, 1, 3328]
    - [33, 47.522]
  - - [5056, 6784, 1, 3328]
    - [33, 48.082]
  - - [5888, 6784, 1, 3328]
    - [33, 47.87]
  - - [6784, 6784, 1, 3328]
    - [33, 48.118]
  - - [1024, 1024, 1, 1024]
    - [89, 37.216]
  - - [1024, 700, 1, 512]
    - [19, 24.272]
  - - [3072, 1500, 1, 128]
    - [32, 37.044]
  - - [4224, 1500, 1, 176]
    - [15, 41.249]
  - - [512, 1500, 1, 1536]
    - [19, 28.342]
  - - [512, 1500, 1, 2048]
    - [19, 28.608]
  - - [512, 1500, 1, 2560]
    - [19, 28.761]
  - - [512, 1500, 1, 2816]
    - [19, 28.842]
  - - [512, 3000, 1, 1536]
    - [33, 34.364]
  - - [1024, 1500, 1, 1536]
    - [32, 34.31]
  - - [512, 3000, 1, 2048]
    - [33, 34.493]
  - - [1024, 1500, 1, 2048]
    - [33, 34.594]
  - - [512, 3000, 1, 2560]
    - [33, 34.741]
  - - [1024, 1500, 1, 2560]
    - [33, 34.732]
  - - [512, 3000, 1, 2816]
    - [33, 34.789]
  - - [1024, 1500, 1, 2816]
    - [33, 34.774]
  - - [512, 6000, 1, 1536]
    - [33, 39.817]
  - - [1024, 3000, 1, 1536]
    - [33, 39.943]
  - - [3072, 1500, 1, 1024]
    - [33, 42.767]
  - - [512, 6000, 1, 2048]
    - [33, 40.236]
  - - [1024, 3000, 1, 2048]
    - [33, 40.218]
  - - [5124, 700, 1, 2048]
    - [33, 41.74]
  - - [512, 6000, 1, 2560]
    - [33, 40.239]
  - - [1024, 3000, 1, 2560]
    - [33, 40.326]
  - - [512, 6000, 1, 2816]
    - [33, 40.293]
  - - [1024, 3000, 1, 2816]
    - [33, 40.398]
  - - [5124, 700, 1, 2560]
    - [33, 41.872]
  - - [1024, 6000, 1, 1536]
    - [33, 44.531]
  - - [3072, 3000, 1, 1024]
    - [33, 46.19]
  - - [4608, 1500, 1, 1536]
    - [33, 43.794]
  - - [1024, 6000, 1, 2048]
    - [33, 44.633]
  - - [1024, 6000, 1, 2560]
    - [33, 44.761]
  - - [5124, 1500, 1, 2048]
    - [16, 44.627]
  - - [1024, 6000, 1, 2816]
    - [33, 44.728]
  - - [512, 24000, 1, 1536]
    - [33, 47.298]
  - - [3072, 6000, 1, 1024]
    - [33, 46.944]
  - - [5124, 1500, 1, 2560]
    - [16, 44.845]
  - - [4608, 3000, 1, 1536]
    - [33, 46.139]
  - - [1760, 7000, 1, 1760]
    - [33, 45.78]
  - - [6144, 1500, 1, 2560]
    - [33, 44.435]
  - - [512, 24000, 1, 2048]
    - [33, 47.376]
  - - [2048, 7000, 1, 2048]
    - [33, 46.367]
  - - [7680, 1500, 1, 2560]
    - [33, 46.393]
  - - [512, 24000, 1, 2560]
    - [33, 47.466]
  - - [512, 24000, 1, 2816]
    - [33, 47.495]
  - - [8448, 1500, 1, 2816]
    - [16, 46.558]
  - - [512, 48000, 1, 1536]
    - [32, 47.747]
  - - [1024, 24000, 1, 1536]
    - [33, 47.846]
  - - [4608, 6000, 1, 1536]
    - [33, 47.364]
  - - [2560, 7000, 1, 2560]
    - [33, 47.184]
  - - [6144, 3000, 1, 2560]
    - [33, 47.283]
  - - [512, 48000, 1, 2048]
    - [33, 47.939]
  - - [1024, 24000, 1, 2048]
    - [33, 47.948]
  - - [7680, 3000, 1, 2560]
    - [33, 47.888]
  - - [512, 48000, 1, 2560]
    - [33, 48.005]
  - - [1024, 24000, 1, 2560]
    - [33, 47.99]
  - - [512, 48000, 1, 2816]
    - [33, 48.008]
  - - [1024, 24000, 1, 2816]
    - [33, 48.02]
  - - [8448, 3000, 1, 2816]
    - [33, 47.687]
  - - [1024, 48000, 1, 1536]
    - [33, 48.13]
  - - [3072, 24000, 1, 1024]
    - [35, 48.148]
  - - [5124, 9124, 1, 1760]
    - [32, 47.247]
  - - [6144, 6000, 1, 2560]
    - [33, 47.57]
  - - [5124, 9124, 1, 2048]
    - [32, 47.277]
  - - [1024, 48000, 1, 2048]
    - [33, 48.181]
  - - [4096, 7000, 1, 4096]
    - [33, 47.645]
  - - [7680, 6000, 1, 2560]
    - [33, 48.139]
  - - [5124, 9124, 1, 2560]
    - [33, 47.322]
  - - [1024, 48000, 1, 2560]
    - [33, 48.244]
  - - [1024, 48000, 1, 2816]
    - [33, 48.253]
  - - [8448, 6000, 1, 2816]
    - [33, 47.894]
  - - [3072, 48000, 1, 1024]
    - [35, 48.286]
  - - [4608, 24000, 1, 1536]
    - [33, 48.298]
  - - [5124, 9124, 1, 4096]
    - [33, 47.382]
  - - [4608, 48000, 1, 1536]
    - [35, 48.442]
  - - [6144, 24000, 1, 2560]
    - [35, 48.43]
  - - [7680, 24000, 1, 2560]
    - [32, 48.457]
  - - [8448, 24000, 1, 2816]
    - [33, 48.424]
  - - [6144, 48000, 1, 2560]
    - [35, 48.523]
  - - [7680, 48000, 1, 2560]
    - [35, 48.505]
  - - [8448, 48000, 1, 2816]
    - [33, 48.478]
  - - [256, 193600, 1, 64]
    - [43, 42.36]
  - - [64, 193600, 1, 64]
    - [41, 38.353]
  - - [64, 193600, 1, 256]
    - [42, 44.076]
  - - [512, 50176, 1, 128]
    - [1, 44.088]
  - - [128, 50176, 1, 512]
    - [40, 43.495]
  - - [256, 12544, 1, 1024]
    - [39, 42.111]
  - - [1024, 12544, 1, 256]
    - [42, 44.183]
  - - [2048, 3136, 1, 512]
    - [38, 43.68]
  - - [512, 3136, 1, 2048]
    - [37, 39.428]
  - - [196, 256, 64, 1024]
    - [48, 34.684]
  - - [784, 512, 64, 128]
    - [45, 41.446]
  - - [3136, 512, 1, 2048]
    - [46, 35.442]
  - - [196, 1024, 64, 256]
    - [47, 37.898]
  - - [3136, 2048, 1, 512]
    - [44, 41.446]
  - - [32, 32, 1, 32]
    - [49, 0.006]
  - - [32, 64, 1, 256]
    - [53, 0.036]
  - - [32, 128, 1, 256]
    - [53, 0.072]
  - - [32, 256, 1, 256]
    - [55, 0.15]
  - - [32, 448, 1, 256]
    - [55, 0.29]
  - - [32, 704, 1, 256]
    - [53, 0.455]
  - - [32, 1024, 1, 256]
    - [55, 0.659]
  - - [32, 1408, 1, 256]
    - [53, 0.901]
  - - [32, 1856, 1, 256]
    - [53, 1.177]
  - - [32, 2368, 1, 256]
    - [53, 1.533]
  - - [32, 2944, 1, 256]
    - [53, 1.935]
  - - [32, 3584, 1, 256]
    - [53, 2.285]
  - - [32, 4288, 1, 256]
    - [53, 2.716]
  - - [32, 5056, 1, 256]
    - [55, 3.171]
  - - [32, 5888, 1, 256]
    - [53, 3.492]
  - - [32, 6784, 1, 256]
    - [52, 4.025]
  - - [32, 64, 1, 1280]
    - [56, 0.048]
  - - [32, 128, 1, 1280]
    - [56, 0.096]
  - - [32, 256, 1, 1280]
    - [58, 0.195]
  - - [32, 448, 1, 1280]
    - [56, 0.356]
  - - [32, 704, 1, 1280]
    - [56, 0.56]
  - - [32, 1024, 1, 1280]
    - [56, 0.812]
  - - [32, 1408, 1, 1280]
    - [58, 1.12]
  - - [32, 1856, 1, 1280]
    - [56, 1.479]
  - - [32, 2368, 1, 1280]
    - [56, 1.884]
  - - [32, 2944, 1, 1280]
    - [56, 2.351]
  - - [32, 3584, 1, 1280]
    - [56, 2.866]
  - - [32, 4288, 1, 1280]
    - [56, 3.429]
  - - [32, 5056, 1, 1280]
    - [58, 4.052]
  - - [32, 5888, 1, 1280]
    - [56, 4.684]
  - - [32, 6784, 1, 1280]
    - [58, 5.366]
  - - [32, 64, 1, 3328]
    - [56, 0.051]
  - - [32, 128, 1, 3328]
    - [56, 0.102]
  - - [32, 256, 1, 3328]
    - [56, 0.204]
  - - [32, 448, 1, 3328]
    - [56, 0.365]
  - - [32, 704, 1, 3328]
    - [58, 0.581]
  - - [32, 1024, 1, 3328]
    - [56, 0.847]
  - - [32, 1408, 1, 3328]
    - [58, 1.168]
  - - [32, 1856, 1, 3328]
    - [56, 1.533]
  - - [32, 2368, 1, 3328]
    - [56, 1.967]
  - - [32, 2944, 1, 3328]
    - [58, 2.441]
  - - [32, 3584, 1, 3328]
    - [56, 2.962]
  - - [32, 4288, 1, 3328]
    - [58, 3.594]
  - - [32, 5056, 1, 3328]
    - [56, 4.228]
  - - [32, 5888, 1, 3328]
    - [58, 4.914]
  - - [32, 6784, 1, 3328]
    - [58, 5.609]
  - - [64, 32, 1, 256]
    - [59, 0.045]
  - - [128, 32, 1, 256]
    - [53, 0.078]
  - - [256, 32, 1, 256]
    - [55, 0.156]
  - - [448, 32, 1, 256]
    - [55, 0.296]
  - - [704, 32, 1, 256]
    - [53, 0.446]
  - - [1024, 32, 1, 256]
    - [53, 0.641]
  - - [1408, 32, 1, 256]
    - [53, 0.862]
  - - [1856, 32, 1, 256]
    - [53, 1.153]
  - - [2368, 32, 1, 256]
    - [55, 1.506]
  - - [2944, 32, 1, 256]
    - [53, 1.839]
  - - [3584, 32, 1, 256]
    - [55, 2.252]
  - - [4288, 32, 1, 256]
    - [55, 2.65]
  - - [5056, 32, 1, 256]
    - [55, 3.046]
  - - [5888, 32, 1, 256]
    - [53, 3.486]
  - - [6784, 32, 1, 256]
    - [58, 4.435]
  - - [64, 32, 1, 1280]
    - [53, 0.051]
  - - [128, 32, 1, 1280]
    - [53, 0.099]
  - - [256, 32, 1, 1280]
    - [53, 0.204]
  - - [448, 32, 1, 1280]
    - [55, 0.362]
  - - [704, 32, 1, 1280]
    - [53, 0.569]
  - - [1024, 32, 1, 1280]
    - [53, 0.833]
  - - [1408, 32, 1, 1280]
    - [53, 1.138]
  - - [1856, 32, 1, 1280]
    - [55, 1.476]
  - - [2368, 32, 1, 1280]
    - [55, 1.896]
  - - [2944, 32, 1, 1280]
    - [53, 2.381]
  - - [3584, 32, 1, 1280]
    - [53, 2.893]
  - - [4288, 32, 1, 1280]
    - [55, 3.417]
  - - [5056, 32, 1, 1280]
    - [53, 4.115]
  - - [5888, 32, 1, 1280]
    - [55, 4.827]
  - - [6784, 32, 1, 1280]
    - [58, 5.603]
  - - [64, 32, 1, 3328]
    - [53, 0.051]
  - - [128, 32, 1, 3328]
    - [56, 0.105]
  - - [256, 32, 1, 3328]
    - [58, 0.213]
  - - [448, 32, 1, 3328]
    - [56, 0.377]
  - - [704, 32, 1, 3328]
    - [55, 0.581]
  - - [1024, 32, 1, 3328]
    - [56, 0.865]
  - - [1408, 32, 1, 3328]
    - [58, 1.168]
  - - [1856, 32, 1, 3328]
    - [58, 1.536]
  - - [2368, 32, 1, 3328]
    - [58, 1.97]
  - - [2944, 32, 1, 3328]
    - [56, 2.447]
  - - [3584, 32, 1, 3328]
    - [58, 2.995]
  - - [4288, 32, 1, 3328]
    - [55, 3.609]
  - - [5056, 32, 1, 3328]
    - [53, 4.309]
  - - [5888, 32, 1, 3328]
    - [55, 5.046]
  - - [6784, 32, 1, 3328]
    - [56, 5.834]
  - - [64, 64, 1, 32]
    - [59, 0.039]
  - - [128, 64, 1, 32]
    - [59, 0.09]
  - - [256, 64, 1, 32]
    - [50, 0.093]
  - - [448, 64, 1, 32]
    - [50, 0.168]
  - - [704, 64, 1, 32]
    - [52, 0.27]
  - - [1024, 64, 1, 32]
    - [50, 0.386]
  - - [1408, 64, 1, 32]
    - [52, 0.536]
  - - [1856, 64, 1, 32]
    - [52, 0.719]
  - - [2368, 64, 1, 32]
    - [52, 0.904]
  - - [2944, 64, 1, 32]
    - [52, 1.129]
  - - [3584, 64, 1, 32]
    - [52, 1.381]
  - - [4288, 64, 1, 32]
    - [52, 1.566]
  - - [5056, 64, 1, 32]
    - [50, 1.77]
  - - [5888, 64, 1, 32]
    - [50, 1.851]
  - - [6784, 64, 1, 32]
    - [57, 3.27]
  - - [64, 128, 1, 32]
    - [50, 0.045]
  - - [128, 128, 1, 32]
    - [50, 0.093]
  - - [256, 128, 1, 32]
    - [52, 0.21]
  - - [448, 128, 1, 32]
    - [52, 0.356]
  - - [704, 128, 1, 32]
    - [50, 0.56]
  - - [1024, 128, 1, 32]
    - [52, 0.8]
  - - [1408, 128, 1, 32]
    - [50, 1.141]
  - - [1856, 128, 1, 32]
    - [52, 1.506]
  - - [2368, 128, 1, 32]
    - [50, 1.902]
  - - [2944, 128, 1, 32]
    - [50, 2.375]
  - - [3584, 128, 1, 32]
    - [55, 3.57]
  - - [4288, 128, 1, 32]
    - [55, 4.24]
  - - [5056, 128, 1, 32]
    - [56, 4.968]
  - - [5888, 128, 1, 32]
    - [55, 5.714]
  - - [6784, 128, 1, 32]
    - [55, 6.501]
  - - [64, 256, 1, 32]
    - [50, 0.093]
  - - [128, 256, 1, 32]
    - [52, 0.213]
  - - [256, 256, 1, 32]
    - [52, 0.407]
  - - [448, 256, 1, 32]
    - [52, 0.746]
  - - [704, 256, 1, 32]
    - [52, 1.123]
  - - [1024, 256, 1, 32]
    - [52, 1.734]
  - - [1408, 256, 1, 32]
    - [52, 2.261]
  - - [1856, 256, 1, 32]
    - [53, 3.77]
  - - [2368, 256, 1, 32]
    - [55, 4.842]
  - - [2944, 256, 1, 32]
    - [55, 5.938]
  - - [3584, 256, 1, 32]
    - [53, 6.783]
  - - [4288, 256, 1, 32]
    - [55, 7.921]
  - - [5056, 256, 1, 32]
    - [52, 8.472]
  - - [5888, 256, 1, 32]
    - [56, 8.894]
  - - [6784, 256, 1, 32]
    - [53, 9.954]
  - - [64, 448, 1, 32]
    - [50, 0.168]
  - - [128, 448, 1, 32]
    - [50, 0.341]
  - - [256, 448, 1, 32]
    - [52, 0.701]
  - - [448, 448, 1, 32]
    - [52, 1.24]
  - - [704, 448, 1, 32]
    - [50, 1.979]
  - - [1024, 448, 1, 32]
    - [55, 3.615]
  - - [1408, 448, 1, 32]
    - [50, 4.875]
  - - [1856, 448, 1, 32]
    - [55, 6.343]
  - - [2368, 448, 1, 32]
    - [55, 7.433]
  - - [2944, 448, 1, 32]
    - [55, 8.229]
  - - [3584, 448, 1, 32]
    - [53, 9.568]
  - - [4288, 448, 1, 32]
    - [55, 10.137]
  - - [5056, 448, 1, 32]
    - [55, 10.682]
  - - [5888, 448, 1, 32]
    - [55, 11.206]
  - - [6784, 448, 1, 32]
    - [53, 11.859]
  - - [64, 704, 1, 32]
    - [52, 0.281]
  - - [128, 704, 1, 32]
    - [50, 0.563]
  - - [256, 704, 1, 32]
    - [50, 1.108]
  - - [448, 704, 1, 32]
    - [52, 1.929]
  - - [704, 704, 1, 32]
    - [53, 3.881]
  - - [1024, 704, 1, 32]
    - [53, 5.72]
  - - [1408, 704, 1, 32]
    - [53, 7.109]
  - - [1856, 704, 1, 32]
    - [53, 8.026]
  - - [2368, 704, 1, 32]
    - [55, 9.936]
  - - [2944, 704, 1, 32]
    - [55, 10.52]
  - - [3584, 704, 1, 32]
    - [53, 11.362]
  - - [4288, 704, 1, 32]
    - [55, 12.257]
  - - [5056, 704, 1, 32]
    - [55, 12.652]
  - - [5888, 704, 1, 32]
    - [53, 13.275]
  - - [6784, 704, 1, 32]
    - [58, 13.59]
  - - [64, 1024, 1, 32]
    - [52, 0.422]
  - - [128, 1024, 1, 32]
    - [52, 0.83]
  - - [256, 1024, 1, 32]
    - [52, 1.698]
  - - [448, 1024, 1, 32]
    - [53, 3.615]
  - - [704, 1024, 1, 32]
    - [53, 5.681]
  - - [1024, 1024, 1, 32]
    - [53, 7.523]
  - - [1408, 1024, 1, 32]
    - [55, 8.723]
  - - [1856, 1024, 1, 32]
    - [53, 9.984]
  - - [2368, 1024, 1, 32]
    - [58, 10.96]
  - - [2944, 1024, 1, 32]
    - [53, 12.119]
  - - [3584, 1024, 1, 32]
    - [55, 13.084]
  - - [4288, 1024, 1, 32]
    - [53, 13.281]
  - - [5056, 1024, 1, 32]
    - [56, 13.904]
  - - [5888, 1024, 1, 32]
    - [55, 14.216]
  - - [6784, 1024, 1, 32]
    - [56, 14.572]
  - - [64, 1408, 1, 32]
    - [52, 0.569]
  - - [128, 1408, 1, 32]
    - [50, 1.156]
  - - [256, 1408, 1, 32]
    - [50, 2.273]
  - - [448, 1408, 1, 32]
    - [55, 5.004]
  - - [704, 1408, 1, 32]
    - [53, 6.984]
  - - [1024, 1408, 1, 32]
    - [53, 8.637]
  - - [1408, 1408, 1, 32]
    - [55, 10.281]
  - - [1856, 1408, 1, 32]
    - [55, 11.856]
  - - [2368, 1408, 1, 32]
    - [53, 12.638]
  - - [2944, 1408, 1, 32]
    - [53, 13.641]
  - - [3584, 1408, 1, 32]
    - [53, 14.156]
  - - [4288, 1408, 1, 32]
    - [55, 14.581]
  - - [5056, 1408, 1, 32]
    - [53, 14.779]
  - - [5888, 1408, 1, 32]
    - [53, 15.0]
  - - [6784, 1408, 1, 32]
    - [54, 15.545]
  - - [64, 1856, 1, 32]
    - [52, 0.758]
  - - [128, 1856, 1, 32]
    - [50, 1.512]
  - - [256, 1856, 1, 32]
    - [53, 3.77]
  - - [448, 1856, 1, 32]
    - [52, 6.148]
  - - [704, 1856, 1, 32]
    - [53, 8.46]
  - - [1024, 1856, 1, 32]
    - [55, 9.942]
  - - [1408, 1856, 1, 32]
    - [53, 11.637]
  - - [1856, 1856, 1, 32]
    - [55, 12.934]
  - - [2368, 1856, 1, 32]
    - [55, 13.638]
  - - [2944, 1856, 1, 32]
    - [53, 14.545]
  - - [3584, 1856, 1, 32]
    - [56, 14.782]
  - - [4288, 1856, 1, 32]
    - [53, 15.084]
  - - [5056, 1856, 1, 32]
    - [56, 15.399]
  - - [5888, 1856, 1, 32]
    - [54, 15.566]
  - - [6784, 1856, 1, 32]
    - [58, 15.962]
  - - [64, 2368, 1, 32]
    - [52, 0.955]
  - - [128, 2368, 1, 32]
    - [50, 1.941]
  - - [256, 2368, 1, 32]
    - [53, 4.654]
  - - [448, 2368, 1, 32]
    - [55, 7.52]
  - - [704, 2368, 1, 32]
    - [53, 9.79]
  - - [1024, 2368, 1, 32]
    - [53, 11.128]
  - - [1408, 2368, 1, 32]
    - [53, 12.679]
  - - [1856, 2368, 1, 32]
    - [55, 13.781]
  - - [2368, 2368, 1, 32]
    - [53, 14.731]
  - - [2944, 2368, 1, 32]
    - [55, 15.324]
  - - [3584, 2368, 1, 32]
    - [55, 15.473]
  - - [4288, 2368, 1, 32]
    - [55, 15.674]
  - - [5056, 2368, 1, 32]
    - [58, 15.848]
  - - [5888, 2368, 1, 32]
    - [56, 16.075]
  - - [6784, 2368, 1, 32]
    - [49, 16.336]
  - - [64, 2944, 1, 32]
    - [52, 1.195]
  - - [128, 2944, 1, 32]
    - [52, 2.339]
  - - [256, 2944, 1, 32]
    - [53, 5.825]
  - - [448, 2944, 1, 32]
    - [53, 8.271]
  - - [704, 2944, 1, 32]
    - [53, 10.565]
  - - [1024, 2944, 1, 32]
    - [55, 12.158]
  - - [1408, 2944, 1, 32]
    - [53, 13.868]
  - - [1856, 2944, 1, 32]
    - [53, 14.644]
  - - [2368, 2944, 1, 32]
    - [55, 15.324]
  - - [2944, 2944, 1, 32]
    - [55, 15.851]
  - - [3584, 2944, 1, 32]
    - [55, 16.081]
  - - [4288, 2944, 1, 32]
    - [58, 16.036]
  - - [5056, 2944, 1, 32]
    - [54, 16.465]
  - - [5888, 2944, 1, 32]
    - [54, 16.692]
  - - [6784, 2944, 1, 32]
    - [49, 16.8]
  - - [64, 3584, 1, 32]
    - [52, 1.485]
  - - [128, 3584, 1, 32]
    - [55, 3.591]
  - - [256, 3584, 1, 32]
    - [53, 6.621]
  - - [448, 3584, 1, 32]
    - [55, 9.52]
  - - [704, 3584, 1, 32]
    - [53, 11.58]
  - - [1024, 3584, 1, 32]
    - [58, 12.967]
  - - [1408, 3584, 1, 32]
    - [55, 14.425]
  - - [1856, 3584, 1, 32]
    - [53, 15.533]
  - - [2368, 3584, 1, 32]
    - [53, 15.86]
  - - [2944, 3584, 1, 32]
    - [53, 16.204]
  - - [3584, 3584, 1, 32]
    - [55, 16.264]
  - - [4288, 3584, 1, 32]
    - [54, 16.599]
  - - [5056, 3584, 1, 32]
    - [49, 16.812]
  - - [5888, 3584, 1, 32]
    - [54, 17.456]
  - - [6784, 3584, 1, 32]
    - [54, 17.273]
  - - [64, 4288, 1, 32]
    - [50, 1.749]
  - - [128, 4288, 1, 32]
    - [53, 4.214]
  - - [256, 4288, 1, 32]
    - [55, 7.873]
  - - [448, 4288, 1, 32]
    - [55, 9.876]
  - - [704, 4288, 1, 32]
    - [53, 12.341]
  - - [1024, 4288, 1, 32]
    - [55, 13.521]
  - - [1408, 4288, 1, 32]
    - [53, 15.036]
  - - [1856, 4288, 1, 32]
    - [55, 15.785]
  - - [2368, 4288, 1, 32]
    - [55, 16.393]
  - - [2944, 4288, 1, 32]
    - [53, 16.635]
  - - [3584, 4288, 1, 32]
    - [54, 16.92]
  - - [4288, 4288, 1, 32]
    - [56, 16.623]
  - - [5056, 4288, 1, 32]
    - [51, 16.788]
  - - [5888, 4288, 1, 32]
    - [51, 17.261]
  - - [6784, 4288, 1, 32]
    - [51, 17.294]
  - - [64, 5056, 1, 32]
    - [52, 2.03]
  - - [128, 5056, 1, 32]
    - [53, 5.169]
  - - [256, 5056, 1, 32]
    - [55, 8.382]
  - - [448, 5056, 1, 32]
    - [55, 10.811]
  - - [704, 5056, 1, 32]
    - [55, 13.078]
  - - [1024, 5056, 1, 32]
    - [53, 14.225]
  - - [1408, 5056, 1, 32]
    - [55, 15.503]
  - - [1856, 5056, 1, 32]
    - [55, 16.174]
  - - [2368, 5056, 1, 32]
    - [55, 16.677]
  - - [2944, 5056, 1, 32]
    - [53, 17.031]
  - - [3584, 5056, 1, 32]
    - [53, 16.998]
  - - [4288, 5056, 1, 32]
    - [49, 16.974]
  - - [5056, 5056, 1, 32]
    - [51, 17.36]
  - - [5888, 5056, 1, 32]
    - [49, 17.447]
  - - [6784, 5056, 1, 32]
    - [51, 17.627]
  - - [64, 5888, 1, 32]
    - [50, 2.375]
  - - [128, 5888, 1, 32]
    - [55, 5.938]
  - - [256, 5888, 1, 32]
    - [50, 8.984]
  - - [448, 5888, 1, 32]
    - [53, 11.79]
  - - [704, 5888, 1, 32]
    - [55, 13.641]
  - - [1024, 5888, 1, 32]
    - [53, 14.68]
  - - [1408, 5888, 1, 32]
    - [53, 15.713]
  - - [1856, 5888, 1, 32]
    - [53, 16.549]
  - - [2368, 5888, 1, 32]
    - [53, 16.938]
  - - [2944, 5888, 1, 32]
    - [54, 17.204]
  - - [3584, 5888, 1, 32]
    - [55, 17.243]
  - - [4288, 5888, 1, 32]
    - [49, 17.351]
  - - [5056, 5888, 1, 32]
    - [49, 17.525]
  - - [5888, 5888, 1, 32]
    - [54, 18.088]
  - - [6784, 5888, 1, 32]
    - [54, 17.947]
  - - [64, 6784, 1, 32]
    - [59, 3.492]
  - - [128, 6784, 1, 32]
    - [55, 6.582]
  - - [256, 6784, 1, 32]
    - [53, 9.954]
  - - [448, 6784, 1, 32]
    - [55, 12.425]
  - - [704, 6784, 1, 32]
    - [53, 14.09]
  - - [1024, 6784, 1, 32]
    - [55, 15.186]
  - - [1408, 6784, 1, 32]
    - [53, 16.276]
  - - [1856, 6784, 1, 32]
    - [53, 16.722]
  - - [2368, 6784, 1, 32]
    - [55, 17.15]
  - - [2944, 6784, 1, 32]
    - [53, 17.348]
  - - [3584, 6784, 1, 32]
    - [49, 17.306]
  - - [4288, 6784, 1, 32]
    - [49, 17.459]
  - - [5056, 6784, 1, 32]
    - [54, 17.839]
  - - [5888, 6784, 1, 32]
    - [54, 17.98]
  - - [6784, 6784, 1, 32]
    - [54, 18.136]
  - - [32, 32, 1, 256]
    - [53, 0.021]
  - - [32, 32, 1, 1280]
    - [53, 0.024]
  - - [32, 32, 1, 3328]
    - [53, 0.027]
  - - [32, 64, 1, 32]
    - [50, 0.012]
  - - [32, 128, 1, 32]
    - [50, 0.027]
  - - [32, 256, 1, 32]
    - [52, 0.09]
  - - [32, 448, 1, 32]
    - [52, 0.105]
  - - [32, 704, 1, 32]
    - [55, 0.183]
  - - [32, 1024, 1, 32]
    - [52, 0.249]
  - - [32, 1408, 1, 32]
    - [55, 0.335]
  - - [32, 1856, 1, 32]
    - [50, 0.443]
  - - [32, 2368, 1, 32]
    - [52, 0.59]
  - - [32, 2944, 1, 32]
    - [52, 0.737]
  - - [32, 3584, 1, 32]
    - [52, 0.874]
  - - [32, 4288, 1, 32]
    - [50, 0.961]
  - - [32, 5056, 1, 32]
    - [50, 1.048]
  - - [32, 5888, 1, 32]
    - [50, 1.153]
  - - [32, 6784, 1, 32]
    - [52, 1.818]
  - - [64, 32, 1, 32]
    - [59, 0.021]
  - - [128, 32, 1, 32]
    - [52, 0.027]
  - - [256, 32, 1, 32]
    - [50, 0.054]
  - - [448, 32, 1, 32]
    - [55, 0.12]
  - - [704, 32, 1, 32]
    - [52, 0.162]
  - - [1024, 32, 1, 32]
    - [52, 0.243]
  - - [1408, 32, 1, 32]
    - [52, 0.332]
  - - [1856, 32, 1, 32]
    - [55, 0.437]
  - - [2368, 32, 1, 32]
    - [52, 0.536]
  - - [2944, 32, 1, 32]
    - [50, 0.671]
  - - [3584, 32, 1, 32]
    - [50, 0.847]
  - - [4288, 32, 1, 32]
    - [55, 0.934]
  - - [5056, 32, 1, 32]
    - [52, 1.054]
  - - [5888, 32, 1, 32]
    - [52, 1.111]
  - - [6784, 32, 1, 32]
    - [59, 1.746]
  - - [1, 1, 1, 1]
    - [62, 0.0]
  - - [1, 64, 1, 256]
    - [72, 0.001]
  - - [1, 128, 1, 256]
    - [62, 0.003]
  - - [1, 256, 1, 256]
    - [72, 0.006]
  - - [1, 448, 1, 256]
    - [64, 0.009]
  - - [1, 704, 1, 256]
    - [72, 0.015]
  - - [1, 1024, 1, 256]
    - [72, 0.021]
  - - [1, 1408, 1, 256]
    - [72, 0.027]
  - - [1, 1856, 1, 256]
    - [72, 0.036]
  - - [1, 2368, 1, 256]
    - [72, 0.048]
  - - [1, 2944, 1, 256]
    - [72, 0.06]
  - - [1, 3584, 1, 256]
    - [72, 0.075]
  - - [1, 4288, 1, 256]
    - [72, 0.084]
  - - [1, 5056, 1, 256]
    - [72, 0.099]
  - - [1, 5888, 1, 256]
    - [72, 0.111]
  - - [1, 6784, 1, 256]
    - [72, 0.147]
  - - [1, 64, 1, 1280]
    - [72, 0.003]
  - - [1, 128, 1, 1280]
    - [62, 0.003]
  - - [1, 256, 1, 1280]
    - [64, 0.006]
  - - [1, 448, 1, 1280]
    - [72, 0.012]
  - - [1, 704, 1, 1280]
    - [72, 0.018]
  - - [1, 1024, 1, 1280]
    - [72, 0.027]
  - - [1, 1408, 1, 1280]
    - [72, 0.039]
  - - [1, 1856, 1, 1280]
    - [72, 0.051]
  - - [1, 2368, 1, 1280]
    - [72, 0.066]
  - - [1, 2944, 1, 1280]
    - [72, 0.081]
  - - [1, 3584, 1, 1280]
    - [72, 0.099]
  - - [1, 4288, 1, 1280]
    - [72, 0.12]
  - - [1, 5056, 1, 1280]
    - [72, 0.141]
  - - [1, 5888, 1, 1280]
    - [72, 0.159]
  - - [1, 6784, 1, 1280]
    - [72, 0.183]
  - - [1, 64, 1, 3328]
    - [72, 0.003]
  - - [1, 128, 1, 3328]
    - [62, 0.003]
  - - [1, 256, 1, 3328]
    - [72, 0.009]
  - - [1, 448, 1, 3328]
    - [72, 0.012]
  - - [1, 704, 1, 3328]
    - [72, 0.021]
  - - [1, 1024, 1, 3328]
    - [72, 0.03]
  - - [1, 1408, 1, 3328]
    - [72, 0.042]
  - - [1, 1856, 1, 3328]
    - [72, 0.054]
  - - [1, 2368, 1, 3328]
    - [72, 0.069]
  - - [1, 2944, 1, 3328]
    - [72, 0.087]
  - - [1, 3584, 1, 3328]
    - [72, 0.105]
  - - [1, 4288, 1, 3328]
    - [72, 0.126]
  - - [1, 5056, 1, 3328]
    - [72, 0.147]
  - - [1, 5888, 1, 3328]
    - [72, 0.171]
  - - [1, 6784, 1, 3328]
    - [72, 0.198]
  - - [64, 1, 1, 256]
    - [77, 0.003]
  - - [128, 1, 1, 256]
    - [62, 0.003]
  - - [256, 1, 1, 256]
    - [72, 0.006]
  - - [448, 1, 1, 256]
    - [72, 0.009]
  - - [704, 1, 1, 256]
    - [72, 0.015]
  - - [1024, 1, 1, 256]
    - [72, 0.021]
  - - [1408, 1, 1, 256]
    - [72, 0.03]
  - - [1856, 1, 1, 256]
    - [72, 0.039]
  - - [2368, 1, 1, 256]
    - [72, 0.051]
  - - [2944, 1, 1, 256]
    - [72, 0.063]
  - - [3584, 1, 1, 256]
    - [72, 0.075]
  - - [4288, 1, 1, 256]
    - [72, 0.087]
  - - [5056, 1, 1, 256]
    - [72, 0.102]
  - - [5888, 1, 1, 256]
    - [72, 0.111]
  - - [6784, 1, 1, 256]
    - [77, 0.141]
  - - [64, 1, 1, 1280]
    - [72, 0.003]
  - - [128, 1, 1, 1280]
    - [62, 0.003]
  - - [256, 1, 1, 1280]
    - [64, 0.006]
  - - [448, 1, 1, 1280]
    - [72, 0.012]
  - - [704, 1, 1, 1280]
    - [72, 0.021]
  - - [1024, 1, 1, 1280]
    - [72, 0.03]
  - - [1408, 1, 1, 1280]
    - [72, 0.039]
  - - [1856, 1, 1, 1280]
    - [72, 0.051]
  - - [2368, 1, 1, 1280]
    - [72, 0.066]
  - - [2944, 1, 1, 1280]
    - [72, 0.084]
  - - [3584, 1, 1, 1280]
    - [72, 0.102]
  - - [4288, 1, 1, 1280]
    - [72, 0.12]
  - - [5056, 1, 1, 1280]
    - [72, 0.141]
  - - [5888, 1, 1, 1280]
    - [72, 0.162]
  - - [6784, 1, 1, 1280]
    - [72, 0.192]
  - - [64, 1, 1, 3328]
    - [72, 0.003]
  - - [128, 1, 1, 3328]
    - [62, 0.003]
  - - [256, 1, 1, 3328]
    - [72, 0.009]
  - - [448, 1, 1, 3328]
    - [72, 0.012]
  - - [704, 1, 1, 3328]
    - [72, 0.021]
  - - [1024, 1, 1, 3328]
    - [72, 0.03]
  - - [1408, 1, 1, 3328]
    - [72, 0.042]
  - - [1856, 1, 1, 3328]
    - [72, 0.054]
  - - [2368, 1, 1, 3328]
    - [72, 0.069]
  - - [2944, 1, 1, 3328]
    - [72, 0.087]
  - - [3584, 1, 1, 3328]
    - [72, 0.105]
  - - [4288, 1, 1, 3328]
    - [72, 0.126]
  - - [5056, 1, 1, 3328]
    - [72, 0.147]
  - - [5888, 1, 1, 3328]
    - [72, 0.174]
  - - [6784, 1, 1, 3328]
    - [72, 0.198]
  - - [64, 64, 1, 1]
    - [77, 0.001]
  - - [128, 64, 1, 1]
    - [62, 0.003]
  - - [256, 64, 1, 1]
    - [62, 0.006]
  - - [448, 64, 1, 1]
    - [60, 0.006]
  - - [704, 64, 1, 1]
    - [62, 0.012]
  - - [1024, 64, 1, 1]
    - [61, 0.015]
  - - [1408, 64, 1, 1]
    - [69, 0.024]
  - - [1856, 64, 1, 1]
    - [62, 0.03]
  - - [2368, 64, 1, 1]
    - [67, 0.039]
  - - [2944, 64, 1, 1]
    - [64, 0.048]
  - - [3584, 64, 1, 1]
    - [62, 0.057]
  - - [4288, 64, 1, 1]
    - [62, 0.063]
  - - [5056, 64, 1, 1]
    - [74, 0.072]
  - - [5888, 64, 1, 1]
    - [69, 0.075]
  - - [6784, 64, 1, 1]
    - [62, 0.123]
  - - [64, 128, 1, 1]
    - [77, 0.006]
  - - [128, 128, 1, 1]
    - [69, 0.006]
  - - [256, 128, 1, 1]
    - [62, 0.009]
  - - [448, 128, 1, 1]
    - [62, 0.015]
  - - [704, 128, 1, 1]
    - [62, 0.021]
  - - [1024, 128, 1, 1]
    - [67, 0.033]
  - - [1408, 128, 1, 1]
    - [62, 0.042]
  - - [1856, 128, 1, 1]
    - [67, 0.06]
  - - [2368, 128, 1, 1]
    - [67, 0.078]
  - - [2944, 128, 1, 1]
    - [62, 0.096]
  - - [3584, 128, 1, 1]
    - [62, 0.123]
  - - [4288, 128, 1, 1]
    - [75, 0.15]
  - - [5056, 128, 1, 1]
    - [69, 0.186]
  - - [5888, 128, 1, 1]
    - [62, 0.216]
  - - [6784, 128, 1, 1]
    - [67, 0.234]
  - - [64, 256, 1, 1]
    - [77, 0.006]
  - - [128, 256, 1, 1]
    - [62, 0.009]
  - - [256, 256, 1, 1]
    - [62, 0.015]
  - - [448, 256, 1, 1]
    - [62, 0.027]
  - - [704, 256, 1, 1]
    - [69, 0.045]
  - - [1024, 256, 1, 1]
    - [67, 0.063]
  - - [1408, 256, 1, 1]
    - [67, 0.096]
  - - [1856, 256, 1, 1]
    - [62, 0.138]
  - - [2368, 256, 1, 1]
    - [71, 0.168]
  - - [2944, 256, 1, 1]
    - [62, 0.237]
  - - [3584, 256, 1, 1]
    - [62, 0.252]
  - - [4288, 256, 1, 1]
    - [61, 0.299]
  - - [5056, 256, 1, 1]
    - [62, 0.335]
  - - [5888, 256, 1, 1]
    - [61, 0.386]
  - - [6784, 256, 1, 1]
    - [61, 0.452]
  - - [64, 448, 1, 1]
    - [62, 0.006]
  - - [128, 448, 1, 1]
    - [71, 0.018]
  - - [256, 448, 1, 1]
    - [62, 0.027]
  - - [448, 448, 1, 1]
    - [62, 0.051]
  - - [704, 448, 1, 1]
    - [62, 0.078]
  - - [1024, 448, 1, 1]
    - [62, 0.126]
  - - [1408, 448, 1, 1]
    - [62, 0.177]
  - - [1856, 448, 1, 1]
    - [62, 0.243]
  - - [2368, 448, 1, 1]
    - [62, 0.302]
  - - [2944, 448, 1, 1]
    - [64, 0.341]
  - - [3584, 448, 1, 1]
    - [61, 0.383]
  - - [4288, 448, 1, 1]
    - [61, 0.458]
  - - [5056, 448, 1, 1]
    - [75, 0.506]
  - - [5888, 448, 1, 1]
    - [64, 0.578]
  - - [6784, 448, 1, 1]
    - [67, 0.629]
  - - [64, 704, 1, 1]
    - [62, 0.012]
  - - [128, 704, 1, 1]
    - [62, 0.024]
  - - [256, 704, 1, 1]
    - [62, 0.048]
  - - [448, 704, 1, 1]
    - [67, 0.081]
  - - [704, 704, 1, 1]
    - [62, 0.141]
  - - [1024, 704, 1, 1]
    - [64, 0.204]
  - - [1408, 704, 1, 1]
    - [64, 0.246]
  - - [1856, 704, 1, 1]
    - [61, 0.35]
  - - [2368, 704, 1, 1]
    - [64, 0.401]
  - - [2944, 704, 1, 1]
    - [61, 0.509]
  - - [3584, 704, 1, 1]
    - [64, 0.563]
  - - [4288, 704, 1, 1]
    - [64, 0.65]
  - - [5056, 704, 1, 1]
    - [62, 0.698]
  - - [5888, 704, 1, 1]
    - [62, 0.737]
  - - [6784, 704, 1, 1]
    - [67, 0.779]
  - - [64, 1024, 1, 1]
    - [71, 0.018]
  - - [128, 1024, 1, 1]
    - [64, 0.033]
  - - [256, 1024, 1, 1]
    - [67, 0.066]
  - - [448, 1024, 1, 1]
    - [62, 0.132]
  - - [704, 1024, 1, 1]
    - [62, 0.21]
  - - [1024, 1024, 1, 1]
    - [62, 0.281]
  - - [1408, 1024, 1, 1]
    - [61, 0.356]
  - - [1856, 1024, 1, 1]
    - [62, 0.455]
  - - [2368, 1024, 1, 1]
    - [75, 0.554]
  - - [2944, 1024, 1, 1]
    - [67, 0.653]
  - - [3584, 1024, 1, 1]
    - [69, 0.716]
  - - [4288, 1024, 1, 1]
    - [69, 0.788]
  - - [5056, 1024, 1, 1]
    - [61, 0.812]
  - - [5888, 1024, 1, 1]
    - [64, 0.859]
  - - [6784, 1024, 1, 1]
    - [61, 0.889]
  - - [64, 1408, 1, 1]
    - [62, 0.024]
  - - [128, 1408, 1, 1]
    - [74, 0.048]
  - - [256, 1408, 1, 1]
    - [62, 0.09]
  - - [448, 1408, 1, 1]
    - [67, 0.174]
  - - [704, 1408, 1, 1]
    - [69, 0.252]
  - - [1024, 1408, 1, 1]
    - [61, 0.344]
  - - [1408, 1408, 1, 1]
    - [61, 0.458]
  - - [1856, 1408, 1, 1]
    - [64, 0.551]
  - - [2368, 1408, 1, 1]
    - [64, 0.683]
  - - [2944, 1408, 1, 1]
    - [62, 0.731]
  - - [3584, 1408, 1, 1]
    - [64, 0.803]
  - - [4288, 1408, 1, 1]
    - [62, 0.85]
  - - [5056, 1408, 1, 1]
    - [70, 0.871]
  - - [5888, 1408, 1, 1]
    - [64, 0.913]
  - - [6784, 1408, 1, 1]
    - [61, 0.952]
  - - [64, 1856, 1, 1]
    - [62, 0.03]
  - - [128, 1856, 1, 1]
    - [62, 0.063]
  - - [256, 1856, 1, 1]
    - [69, 0.132]
  - - [448, 1856, 1, 1]
    - [67, 0.264]
  - - [704, 1856, 1, 1]
    - [61, 0.332]
  - - [1024, 1856, 1, 1]
    - [75, 0.437]
  - - [1408, 1856, 1, 1]
    - [61, 0.599]
  - - [1856, 1856, 1, 1]
    - [61, 0.695]
  - - [2368, 1856, 1, 1]
    - [74, 0.752]
  - - [2944, 1856, 1, 1]
    - [66, 0.803]
  - - [3584, 1856, 1, 1]
    - [66, 0.856]
  - - [4288, 1856, 1, 1]
    - [62, 0.883]
  - - [5056, 1856, 1, 1]
    - [66, 0.943]
  - - [5888, 1856, 1, 1]
    - [66, 0.988]
  - - [6784, 1856, 1, 1]
    - [61, 0.997]
  - - [64, 2368, 1, 1]
    - [62, 0.042]
  - - [128, 2368, 1, 1]
    - [62, 0.078]
  - - [256, 2368, 1, 1]
    - [62, 0.171]
  - - [448, 2368, 1, 1]
    - [72, 0.276]
  - - [704, 2368, 1, 1]
    - [70, 0.389]
  - - [1024, 2368, 1, 1]
    - [66, 0.539]
  - - [1408, 2368, 1, 1]
    - [67, 0.731]
  - - [1856, 2368, 1, 1]
    - [64, 0.803]
  - - [2368, 2368, 1, 1]
    - [61, 0.856]
  - - [2944, 2368, 1, 1]
    - [67, 0.862]
  - - [3584, 2368, 1, 1]
    - [61, 0.916]
  - - [4288, 2368, 1, 1]
    - [69, 0.961]
  - - [5056, 2368, 1, 1]
    - [61, 0.988]
  - - [5888, 2368, 1, 1]
    - [66, 1.003]
  - - [6784, 2368, 1, 1]
    - [66, 1.006]
  - - [64, 2944, 1, 1]
    - [62, 0.051]
  - - [128, 2944, 1, 1]
    - [62, 0.105]
  - - [256, 2944, 1, 1]
    - [62, 0.216]
  - - [448, 2944, 1, 1]
    - [69, 0.35]
  - - [704, 2944, 1, 1]
    - [75, 0.497]
  - - [1024, 2944, 1, 1]
    - [69, 0.644]
  - - [1408, 2944, 1, 1]
    - [66, 0.743]
  - - [1856, 2944, 1, 1]
    - [64, 0.818]
  - - [2368, 2944, 1, 1]
    - [61, 0.892]
  - - [2944, 2944, 1, 1]
    - [61, 0.937]
  - - [3584, 2944, 1, 1]
    - [61, 0.958]
  - - [4288, 2944, 1, 1]
    - [64, 0.976]
  - - [5056, 2944, 1, 1]
    - [61, 1.048]
  - - [5888, 2944, 1, 1]
    - [61, 1.027]
  - - [6784, 2944, 1, 1]
    - [61, 1.042]
  - - [64, 3584, 1, 1]
    - [62, 0.06]
  - - [128, 3584, 1, 1]
    - [62, 0.147]
  - - [256, 3584, 1, 1]
    - [62, 0.264]
  - - [448, 3584, 1, 1]
    - [61, 0.404]
  - - [704, 3584, 1, 1]
    - [62, 0.593]
  - - [1024, 3584, 1, 1]
    - [62, 0.731]
  - - [1408, 3584, 1, 1]
    - [62, 0.83]
  - - [1856, 3584, 1, 1]
    - [62, 0.874]
  - - [2368, 3584, 1, 1]
    - [66, 0.904]
  - - [2944, 3584, 1, 1]
    - [70, 0.955]
  - - [3584, 3584, 1, 1]
    - [61, 0.988]
  - - [4288, 3584, 1, 1]
    - [61, 1.003]
  - - [5056, 3584, 1, 1]
    - [61, 1.066]
  - - [5888, 3584, 1, 1]
    - [66, 1.045]
  - - [6784, 3584, 1, 1]
    - [61, 1.048]
  - - [64, 4288, 1, 1]
    - [62, 0.078]
  - - [128, 4288, 1, 1]
    - [62, 0.183]
  - - [256, 4288, 1, 1]
    - [61, 0.29]
  - - [448, 4288, 1, 1]
    - [61, 0.467]
  - - [704, 4288, 1, 1]
    - [62, 0.662]
  - - [1024, 4288, 1, 1]
    - [62, 0.74]
  - - [1408, 4288, 1, 1]
    - [61, 0.853]
  - - [1856, 4288, 1, 1]
    - [61, 0.886]
  - - [2368, 4288, 1, 1]
    - [61, 1.0]
  - - [2944, 4288, 1, 1]
    - [62, 0.973]
  - - [3584, 4288, 1, 1]
    - [61, 0.985]
  - - [4288, 4288, 1, 1]
    - [61, 1.012]
  - - [5056, 4288, 1, 1]
    - [61, 1.051]
  - - [5888, 4288, 1, 1]
    - [61, 1.054]
  - - [6784, 4288, 1, 1]
    - [65, 1.06]
  - - [64, 5056, 1, 1]
    - [62, 0.084]
  - - [128, 5056, 1, 1]
    - [67, 0.186]
  - - [256, 5056, 1, 1]
    - [62, 0.395]
  - - [448, 5056, 1, 1]
    - [62, 0.581]
  - - [704, 5056, 1, 1]
    - [61, 0.746]
  - - [1024, 5056, 1, 1]
    - [73, 0.779]
  - - [1408, 5056, 1, 1]
    - [61, 0.904]
  - - [1856, 5056, 1, 1]
    - [61, 0.946]
  - - [2368, 5056, 1, 1]
    - [66, 0.994]
  - - [2944, 5056, 1, 1]
    - [61, 1.006]
  - - [3584, 5056, 1, 1]
    - [65, 1.033]
  - - [4288, 5056, 1, 1]
    - [70, 1.03]
  - - [5056, 5056, 1, 1]
    - [66, 1.075]
  - - [5888, 5056, 1, 1]
    - [61, 1.072]
  - - [6784, 5056, 1, 1]
    - [61, 1.084]
  - - [64, 5888, 1, 1]
    - [62, 0.108]
  - - [128, 5888, 1, 1]
    - [62, 0.264]
  - - [256, 5888, 1, 1]
    - [73, 0.386]
  - - [448, 5888, 1, 1]
    - [69, 0.668]
  - - [704, 5888, 1, 1]
    - [64, 0.779]
  - - [1024, 5888, 1, 1]
    - [61, 0.797]
  - - [1408, 5888, 1, 1]
    - [70, 0.919]
  - - [1856, 5888, 1, 1]
    - [61, 0.982]
  - - [2368, 5888, 1, 1]
    - [61, 1.03]
  - - [2944, 5888, 1, 1]
    - [64, 1.021]
  - - [3584, 5888, 1, 1]
    - [68, 1.045]
  - - [4288, 5888, 1, 1]
    - [66, 1.051]
  - - [5056, 5888, 1, 1]
    - [65, 1.096]
  - - [5888, 5888, 1, 1]
    - [66, 1.078]
  - - [6784, 5888, 1, 1]
    - [66, 1.096]
  - - [64, 6784, 1, 1]
    - [69, 0.153]
  - - [128, 6784, 1, 1]
    - [72, 0.302]
  - - [256, 6784, 1, 1]
    - [64, 0.527]
  - - [448, 6784, 1, 1]
    - [62, 0.707]
  - - [704, 6784, 1, 1]
    - [73, 0.806]
  - - [1024, 6784, 1, 1]
    - [68, 0.842]
  - - [1408, 6784, 1, 1]
    - [66, 0.982]
  - - [1856, 6784, 1, 1]
    - [66, 1.0]
  - - [2368, 6784, 1, 1]
    - [66, 1.045]
  - - [2944, 6784, 1, 1]
    - [64, 1.051]
  - - [3584, 6784, 1, 1]
    - [65, 1.072]
  - - [4288, 6784, 1, 1]
    - [61, 1.081]
  - - [5056, 6784, 1, 1]
    - [65, 1.096]
  - - [5888, 6784, 1, 1]
    - [65, 1.093]
  - - [6784, 6784, 1, 1]
    - [61, 1.111]
  - - [1, 1, 1, 256]
    - [75, 0.0]
  - - [1, 1, 1, 1280]
    - [72, 0.0]
  - - [1, 1, 1, 3328]
    - [72, 0.0]
  - - [1, 64, 1, 1]
    - [67, 0.0]
  - - [1, 128, 1, 1]
    - [62, 0.0]
  - - [1, 256, 1, 1]
    - [67, 0.0]
  - - [1, 448, 1, 1]
    - [64, 0.0]
  - - [1, 704, 1, 1]
    - [74, 0.0]
  - - [1, 1024, 1, 1]
    - [67, 0.001]
  - - [1, 1408, 1, 1]
    - [62, 0.001]
  - - [1, 1856, 1, 1]
    - [75, 0.001]
  - - [1, 2368, 1, 1]
    - [62, 0.001]
  - - [1, 2944, 1, 1]
    - [62, 0.001]
  - - [1, 3584, 1, 1]
    - [62, 0.001]
  - - [1, 4288, 1, 1]
    - [62, 0.003]
  - - [1, 5056, 1, 1]
    - [62, 0.003]
  - - [1, 5888, 1, 1]
    - [61, 0.003]
  - - [1, 6784, 1, 1]
    - [60, 0.003]
  - - [64, 1, 1, 1]
    - [77, 0.0]
  - - [128, 1, 1, 1]
    - [76, 0.0]
  - - [256, 1, 1, 1]
    - [77, 0.0]
  - - [448, 1, 1, 1]
    - [67, 0.0]
  - - [704, 1, 1, 1]
    - [63, 0.0]
  - - [1024, 1, 1, 1]
    - [62, 0.001]
  - - [1408, 1, 1, 1]
    - [67, 0.001]
  - - [1856, 1, 1, 1]
    - [67, 0.001]
  - - [2368, 1, 1, 1]
    - [62, 0.001]
  - - [2944, 1, 1, 1]
    - [62, 0.001]
  - - [3584, 1, 1, 1]
    - [62, 0.003]
  - - [4288, 1, 1, 1]
    - [62, 0.003]
  - - [5056, 1, 1, 1]
    - [61, 0.003]
  - - [5888, 1, 1, 1]
    - [61, 0.003]
  - - [6784, 1, 1, 1]
    - [60, 0.003]
  - - [7680, 8192, 1, 8192]
    - [78, 92.169]
  - - [3840, 4096, 1, 4096]
    - [79, 90.08]
  - - [1920, 2048, 1, 2048]
    - [80, 80.345]
  - - [960, 1024, 1, 1024]
    - [81, 37.382]
  - - [480, 512, 1, 512]
    - [82, 10.609]
  - - [8192, 7680, 1, 8192]
    - [83, 92.905]
  - - [4096, 3840, 1, 4096]
    - [79, 89.772]
  - - [2048, 1920, 1, 2048]
    - [84, 76.823]
  - - [1024, 960, 1, 1024]
    - [85, 36.799]
  - - [512, 480, 1, 512]
    - [86, 11.109]
  - - [8192, 8192, 1, 8192]
    - [250, 90.456]
  - - [4096, 4096, 1, 4096]
    - [87, 84.898]
  - - [2048, 2048, 1, 2048]
    - [88, 75.553]
  - - [512, 512, 1, 512]
    - [90, 9.516]
  - - [64, 512, 16, 512]
    - [91, 16.313]
  - - [64, 512, 128, 512]
    - [92, 24.903]
  - - [1024, 1, 1, 2]
    - [251, 0.0]
  - - [1024, 1, 1, 1024]
    - [93, 0.072]
  - - [1024, 8, 1, 1024]
    - [94, 0.573]
  - - [1024, 77, 1, 1024]
    - [95, 5.768]
  - - [1024, 77, 1, 30522]
    - [252, 28.401]
  - - [1024, 512, 1, 2]
    - [96, 0.133]
  - - [1024, 512, 1, 1024]
    - [97, 23.047]
  - - [1024, 512, 1, 4096]
    - [253, 29.511]
  - - [1024, 616, 1, 1024]
    - [99, 25.399]
  - - [1024, 4096, 1, 2]
    - [100, 0.409]
  - - [1024, 4096, 1, 1024]
    - [101, 60.992]
  - - [1024, 4096, 1, 4096]
    - [102, 74.399]
  - - [4096, 512, 1, 1024]
    - [103, 39.875]
  - - [4096, 4096, 1, 1024]
    - [104, 63.8]
  - - [64, 128, 128, 128]
    - [105, 9.737]
  - - [64, 128, 160, 128]
    - [106, 11.63]
  - - [1024, 10, 1, 2]
    - [107, 0.004]
  - - [1024, 10, 1, 1024]
    - [94, 0.727]
  - - [1024, 160, 1, 1024]
    - [108, 10.467]
  - - [1024, 200, 1, 1024]
    - [109, 12.998]
  - - [1024, 200, 1, 30522]
    - [254, 39.129]
  - - [1024, 1024, 1, 2]
    - [110, 0.213]
  - - [1024, 1024, 1, 4096]
    - [111, 43.5]
  - - [1024, 1280, 1, 2]
    - [112, 0.258]
  - - [1024, 1280, 1, 1024]
    - [113, 40.649]
  - - [1024, 1280, 1, 4096]
    - [114, 47.443]
  - - [4096, 1024, 1, 1024]
    - [255, 50.495]
  - - [4096, 1280, 1, 1024]
    - [256, 48.496]
  - - [64, 128, 624, 128]
    - [116, 14.475]
  - - [1024, 39, 1, 2]
    - [117, 0.013]
  - - [1024, 39, 1, 1024]
    - [118, 2.877]
  - - [1024, 780, 1, 1024]
    - [119, 30.74]
  - - [1024, 780, 1, 30522]
    - [257, 59.911]
  - - [1024, 4992, 1, 2]
    - [120, 0.441]
  - - [1024, 4992, 1, 1024]
    - [258, 51.456]
  - - [1024, 4992, 1, 4096]
    - [259, 58.895]
  - - [4096, 4992, 1, 1024]
    - [123, 64.456]
  - - [64, 512, 64, 512]
    - [124, 22.734]
  - - [1024, 4, 1, 2]
    - [251, 0.001]
  - - [1024, 4, 1, 1024]
    - [93, 0.295]
  - - [1024, 308, 1, 1024]
    - [126, 15.112]
  - - [1024, 308, 1, 30522]
    - [260, 50.272]
  - - [1024, 2048, 1, 2]
    - [127, 0.332]
  - - [1024, 2048, 1, 1024]
    - [128, 43.5]
  - - [1024, 2048, 1, 4096]
    - [261, 56.491]
  - - [4096, 2048, 1, 1024]
    - [123, 56.531]
  - - [64, 128, 640, 128]
    - [129, 14.639]
  - - [1024, 40, 1, 2]
    - [117, 0.014]
  - - [1024, 40, 1, 1024]
    - [95, 2.951]
  - - [1024, 800, 1, 1024]
    - [130, 31.401]
  - - [1024, 800, 1, 30522]
    - [262, 60.245]
  - - [1024, 5120, 1, 2]
    - [131, 0.416]
  - - [1024, 5120, 1, 1024]
    - [259, 51.111]
  - - [1024, 5120, 1, 4096]
    - [263, 58.353]
  - - [4096, 5120, 1, 1024]
    - [104, 65.978]
  - - [64, 128, 656, 128]
    - [133, 14.663]
  - - [1024, 41, 1, 2]
    - [107, 0.015]
  - - [1024, 41, 1, 1024]
    - [134, 3.048]
  - - [1024, 820, 1, 1024]
    - [119, 31.556]
  - - [1024, 820, 1, 30522]
    - [262, 61.482]
  - - [1024, 5248, 1, 2]
    - [116, 0.421]
  - - [1024, 5248, 1, 1024]
    - [264, 52.549]
  - - [1024, 5248, 1, 4096]
    - [265, 59.553]
  - - [4096, 5248, 1, 1024]
    - [136, 64.172]
  - - [64, 512, 80, 512]
    - [137, 25.121]
  - - [1024, 5, 1, 2]
    - [266, 0.001]
  - - [1024, 5, 1, 1024]
    - [138, 0.358]
  - - [1024, 385, 1, 1024]
    - [139, 18.61]
  - - [1024, 385, 1, 30522]
    - [267, 47.077]
  - - [1024, 2560, 1, 2]
    - [140, 0.35]
  - - [1024, 2560, 1, 1024]
    - [141, 46.094]
  - - [1024, 2560, 1, 4096]
    - [122, 56.2]
  - - [4096, 2560, 1, 1024]
    - [142, 63.238]
  - - [64, 512, 96, 512]
    - [268, 26.168]
  - - [1024, 6, 1, 2]
    - [143, 0.002]
  - - [1024, 6, 1, 1024]
    - [144, 0.424]
  - - [1024, 462, 1, 1024]
    - [98, 20.514]
  - - [1024, 462, 1, 30522]
    - [269, 55.564]
  - - [1024, 3072, 1, 2]
    - [145, 0.353]
  - - [1024, 3072, 1, 1024]
    - [146, 48.156]
  - - [1024, 3072, 1, 4096]
    - [147, 65.676]
  - - [4096, 3072, 1, 1024]
    - [148, 61.678]
  - - [1024, 8, 1, 2]
    - [143, 0.003]
  - - [1024, 160, 1, 30522]
    - [270, 38.297]
  - - [64, 128, 144, 128]
    - [149, 10.705]
  - - [1024, 9, 1, 2]
    - [125, 0.003]
  - - [1024, 9, 1, 1024]
    - [150, 0.64]
  - - [1024, 180, 1, 1024]
    - [151, 11.697]
  - - [1024, 180, 1, 30522]
    - [271, 37.768]
  - - [1024, 1152, 1, 2]
    - [152, 0.237]
  - - [1024, 1152, 1, 1024]
    - [111, 37.308]
  - - [1024, 1152, 1, 4096]
    - [153, 45.263]
  - - [4096, 1152, 1, 1024]
    - [154, 49.203]
  - - [256, 32768, 1, 128]
    - [155, 24.097]
  - - [479, 32768, 1, 1024]
    - [156, 52.281]
  - - [512, 32768, 1, 256]
    - [272, 40.074]
  - - [1024, 32768, 1, 512]
    - [273, 55.268]
  - - [1024, 32768, 1, 1024]
    - [255, 69.3]
  - - [64, 128, 512, 128]
    - [274, 13.918]
  - - [128, 128, 512, 64]
    - [275, 14.073]
  - - [1024, 32, 1, 2]
    - [160, 0.01]
  - - [1024, 32, 1, 1024]
    - [93, 2.259]
  - - [1024, 4096, 1, 30528]
    - [161, 86.794]
  - - [512, 512, 64, 64]
    - [276, 17.236]
  - - [1024, 2048, 1, 30528]
    - [277, 75.754]
  - - [64, 4, 32768, 4]
    - [275, 0.144]
  - - [64, 4, 38400, 4]
    - [275, 0.147]
  - - [1024, 8192, 1, 1024]
    - [102, 61.98]
  - - [1024, 8192, 1, 4096]
    - [164, 74.227]
  - - [1024, 8192, 1, 33712]
    - [278, 80.726]
  - - [1024, 9600, 1, 1024]
    - [255, 66.859]
  - - [1024, 9600, 1, 4096]
    - [278, 79.649]
  - - [1024, 9600, 1, 33712]
    - [255, 85.184]
  - - [4096, 8192, 1, 1024]
    - [136, 66.505]
  - - [4096, 9600, 1, 1024]
    - [279, 67.397]
  - - [1024, 10064, 1, 1024]
    - [146, 57.517]
  - - [1024, 10064, 1, 4096]
    - [122, 75.058]
  - - [1024, 10080, 1, 1024]
    - [166, 57.044]
  - - [1024, 10080, 1, 4096]
    - [122, 74.793]
  - - [1024, 10080, 1, 42720]
    - [167, 84.751]
  - - [1024, 10200, 1, 1024]
    - [146, 57.359]
  - - [1024, 10200, 1, 4096]
    - [122, 75.713]
  - - [1024, 3840, 1, 1024]
    - [168, 61.371]
  - - [1024, 3840, 1, 4096]
    - [166, 74.031]
  - - [1024, 3968, 1, 1024]
    - [101, 58.641]
  - - [1024, 3968, 1, 4096]
    - [164, 75.571]
  - - [1024, 3968, 1, 42720]
    - [161, 86.971]
  - - [1024, 6528, 1, 1024]
    - [166, 55.849]
  - - [1024, 6528, 1, 4096]
    - [169, 72.321]
  - - [1024, 6528, 1, 42720]
    - [170, 82.613]
  - - [1024, 7104, 1, 1024]
    - [166, 58.828]
  - - [1024, 7104, 1, 4096]
    - [171, 75.404]
  - - [1024, 7104, 1, 42720]
    - [84, 88.467]
  - - [1024, 7200, 1, 1024]
    - [146, 60.647]
  - - [1024, 7200, 1, 4096]
    - [170, 71.784]
  - - [1024, 7200, 1, 42720]
    - [172, 88.026]
  - - [1024, 8064, 1, 1024]
    - [173, 65.183]
  - - [1024, 8064, 1, 4096]
    - [174, 74.284]
  - - [1024, 8160, 1, 1024]
    - [101, 61.737]
  - - [1024, 8160, 1, 4096]
    - [161, 74.975]
  - - [1024, 9216, 1, 1024]
    - [255, 61.106]
  - - [1024, 9216, 1, 4096]
    - [255, 79.768]
  - - [1024, 9520, 1, 1024]
    - [255, 62.697]
  - - [1024, 9520, 1, 4096]
    - [255, 79.692]
  - - [1024, 9520, 1, 42720]
    - [278, 91.86]
  - - [4096, 10064, 1, 1024]
    - [273, 68.546]
  - - [4096, 10080, 1, 1024]
    - [279, 70.015]
  - - [4096, 10200, 1, 1024]
    - [279, 69.029]
  - - [4096, 3840, 1, 1024]
    - [177, 63.84]
  - - [4096, 3968, 1, 1024]
    - [123, 63.365]
  - - [4096, 6528, 1, 1024]
    - [279, 65.4]
  - - [4096, 7104, 1, 1024]
    - [280, 65.626]
  - - [4096, 7200, 1, 1024]
    - [281, 67.936]
  - - [4096, 8064, 1, 1024]
    - [282, 68.173]
  - - [4096, 8160, 1, 1024]
    - [283, 70.659]
  - - [4096, 9216, 1, 1024]
    - [283, 69.075]
  - - [4096, 9520, 1, 1024]
    - [284, 66.044]
  - - [64, 14, 10880, 14]
    - [275, 1.443]
  - - [64, 14, 10880, 15]
    - [285, 1.539]
  - - [64, 15, 7680, 15]
    - [275, 1.573]
  - - [64, 15, 10880, 15]
    - [285, 1.651]
  - - [64, 15, 7680, 17]
    - [275, 1.636]
  - - [64, 17, 6144, 17]
    - [275, 1.718]
  - - [64, 17, 7680, 17]
    - [275, 1.846]
  - - [64, 17, 6144, 21]
    - [275, 2.063]
  - - [64, 21, 6144, 21]
    - [275, 2.474]
  - - [64, 24, 4736, 24]
    - [275, 3.1]
  - - [64, 24, 4736, 34]
    - [180, 3.628]
  - - [64, 30, 2048, 30]
    - [179, 3.549]
  - - [64, 31, 2048, 30]
    - [286, 3.633]
  - - [64, 31, 2048, 31]
    - [287, 3.707]
  - - [64, 32, 4608, 32]
    - [288, 5.498]
  - - [64, 34, 4736, 34]
    - [289, 3.496]
  - - [64, 35, 4608, 32]
    - [290, 4.961]
  - - [64, 35, 4608, 35]
    - [183, 3.331]
  - - [64, 512, 1, 512]
    - [184, 1.653]
  - - [512, 512, 1, 64]
    - [185, 2.908]
  - - [128, 128, 1, 64]
    - [186, 0.175]
  - - [64, 128, 1, 128]
    - [187, 0.151]
  - - [1024, 512, 1, 64]
    - [185, 3.975]
  - - [74, 512, 1, 2048]
    - [188, 3.331]
  - - [64, 5, 1, 5]
    - [291, 0.0]
  - - [2048, 512, 1, 2048]
    - [189, 40.93]
  - - [512, 1600, 1, 512]
    - [190, 24.081]
  - - [32, 33, 1, 33]
    - [266, 0.004]
  - - [560, 1600, 1, 1024]
    - [191, 31.452]
  - - [512, 1600, 1, 32]
    - [192, 3.361]
  - - [1024, 1600, 1, 1024]
    - [193, 39.252]
  - - [32, 33, 1600, 33]
    - [194, 2.278]
  - - [32, 200, 1, 1]
    - [266, 0.001]
  - - [64, 3, 512, 3]
    - [195, 0.031]
  - - [64, 5, 512, 5]
    - [125, 0.085]
  - - [64, 5, 960, 5]
    - [163, 0.118]
  - - [64, 9, 512, 9]
    - [292, 0.241]
  - - [64, 512, 1, 1]
    - [160, 0.005]
  - - [67, 512, 1, 2048]
    - [196, 2.922]
  - - [74, 960, 1, 2048]
    - [197, 6.025]
  - - [100, 512, 1, 2048]
    - [198, 4.673]
  - - [128, 27, 32768, 27]
    - [285, 4.773]
  - - [256, 8976, 1, 1536]
    - [199, 51.449]
  - - [256, 8976, 1, 2048]
    - [293, 52.933]
  - - [256, 8976, 1, 2304]
    - [261, 54.505]
  - - [256, 8976, 1, 2560]
    - [261, 56.346]
  - - [256, 8976, 1, 2816]
    - [293, 57.29]
  - - [256, 8976, 1, 3072]
    - [293, 57.146]
  - - [256, 8976, 1, 4352]
    - [261, 60.03]
  - - [256, 8976, 1, 4864]
    - [261, 59.975]
  - - [256, 8976, 1, 5376]
    - [294, 61.038]
  - - [256, 8976, 1, 5632]
    - [295, 61.697]
  - - [256, 8976, 1, 5888]
    - [277, 62.527]
  - - [256, 8976, 1, 6144]
    - [296, 63.489]
  - - [256, 8976, 1, 6656]
    - [297, 64.503]
  - - [256, 8976, 1, 7168]
    - [295, 66.07]
  - - [256, 8976, 1, 7424]
    - [294, 66.631]
  - - [256, 8976, 1, 8192]
    - [298, 67.109]
  - - [256, 8976, 1, 8448]
    - [298, 68.918]
  - - [256, 8976, 1, 8960]
    - [299, 69.458]
  - - [256, 8976, 1, 9472]
    - [277, 70.7]
  - - [256, 8976, 1, 9728]
    - [277, 71.251]
  - - [256, 8976, 1, 9984]
    - [296, 71.21]
  - - [256, 8976, 1, 10240]
    - [300, 72.056]
  - - [256, 8976, 1, 10496]
    - [277, 72.319]
  - - [256, 8976, 1, 11008]
    - [301, 72.479]
  - - [256, 8976, 1, 11520]
    - [302, 73.575]
  - - [256, 8976, 1, 12288]
    - [296, 74.288]
  - - [256, 8976, 1, 14336]
    - [303, 76.27]
  - - [256, 8976, 1, 14848]
    - [298, 76.022]
  - - [256, 8976, 1, 15104]
    - [300, 76.694]
  - - [256, 8976, 1, 15872]
    - [302, 77.255]
  - - [256, 8976, 1, 17152]
    - [296, 77.814]
  - - [256, 8976, 1, 19712]
    - [301, 79.261]
  - - [256, 8976, 1, 19968]
    - [302, 79.488]
  - - [256, 8976, 1, 20480]
    - [296, 79.682]
  - - [256, 8976, 1, 20992]
    - [301, 79.953]
  - - [256, 8976, 1, 22016]
    - [296, 80.325]
  - - [256, 8976, 1, 26112]
    - [277, 81.486]
  - - [256, 8976, 1, 33536]
    - [300, 83.4]
  - - [256, 8976, 1, 44505]
    - [302, 79.767]
  - - [257, 1024, 1, 4096]
    - [403, 18.078]
  - - [480, 32768, 1, 1024]
    - [210, 64.111]
  - - [512, 200, 1, 1]
    - [125, 0.025]
  - - [512, 200, 1, 32]
    - [125, 0.697]
  - - [512, 215, 1, 2048]
    - [211, 10.496]
  - - [512, 256, 1, 2048]
    - [151, 10.922]
  - - [560, 200, 1, 1024]
    - [212, 7.351]
  - - [768, 215, 1, 2048]
    - [151, 13.7]
  - - [768, 256, 1, 2048]
    - [82, 15.636]
  - - [1024, 1, 1, 200]
    - [143, 0.022]
  - - [1024, 1, 1, 1600]
    - [304, 0.094]
  - - [1024, 200, 1, 1]
    - [143, 0.046]
  - - [1024, 512, 1, 1]
    - [213, 0.067]
  - - [1024, 960, 1, 64]
    - [214, 7.009]
  - - [1024, 1600, 1, 1]
    - [215, 0.152]
  - - [1024, 1792, 1, 256]
    - [216, 26.325]
  - - [1024, 2048, 1, 256]
    - [217, 27.012]
  - - [1024, 2560, 1, 256]
    - [121, 26.499]
  - - [1024, 3072, 1, 256]
    - [218, 27.606]
  - - [1024, 3328, 1, 256]
    - [219, 32.271]
  - - [1024, 3840, 1, 256]
    - [220, 35.282]
  - - [1024, 4096, 1, 256]
    - [221, 34.77]
  - - [1024, 4608, 1, 256]
    - [222, 32.115]
  - - [1024, 4864, 1, 256]
    - [223, 32.337]
  - - [1024, 5120, 1, 256]
    - [222, 32.795]
  - - [1024, 5632, 1, 256]
    - [305, 32.433]
  - - [1024, 6144, 1, 256]
    - [305, 35.299]
  - - [1024, 6400, 1, 256]
    - [220, 34.583]
  - - [1024, 7168, 1, 256]
    - [136, 36.712]
  - - [1024, 7424, 1, 256]
    - [225, 37.321]
  - - [1024, 7680, 1, 256]
    - [226, 37.606]
  - - [1024, 7936, 1, 256]
    - [227, 34.89]
  - - [1024, 8192, 1, 256]
    - [306, 34.65]
  - - [1024, 8448, 1, 256]
    - [276, 35.918]
  - - [1024, 8704, 1, 256]
    - [307, 36.376]
  - - [1024, 8960, 1, 256]
    - [308, 37.898]
  - - [1024, 9728, 1, 256]
    - [229, 36.269]
  - - [1024, 9984, 1, 256]
    - [309, 36.887]
  - - [1024, 10240, 1, 256]
    - [136, 37.382]
  - - [1024, 10496, 1, 256]
    - [220, 37.811]
  - - [1024, 11008, 1, 256]
    - [224, 38.414]
  - - [1024, 11264, 1, 256]
    - [224, 38.54]
  - - [1024, 11520, 1, 256]
    - [308, 39.197]
  - - [1024, 12288, 1, 256]
    - [258, 38.598]
  - - [1024, 13312, 1, 256]
    - [232, 37.93]
  - - [1024, 13568, 1, 256]
    - [230, 38.303]
  - - [1024, 14336, 1, 256]
    - [136, 39.121]
  - - [1024, 14592, 1, 256]
    - [258, 39.908]
  - - [1024, 14848, 1, 256]
    - [78, 39.81]
  - - [1024, 15104, 1, 256]
    - [231, 39.335]
  - - [1024, 16128, 1, 256]
    - [159, 40.046]
  - - [1024, 17152, 1, 256]
    - [159, 41.091]
  - - [1024, 18944, 1, 256]
    - [219, 39.518]
  - - [1024, 19712, 1, 256]
    - [310, 39.605]
  - - [1024, 19968, 1, 256]
    - [309, 40.754]
  - - [1024, 20480, 1, 256]
    - [310, 40.947]
  - - [1024, 20992, 1, 256]
    - [311, 39.798]
  - - [1024, 21504, 1, 256]
    - [158, 40.832]
  - - [1024, 22016, 1, 256]
    - [78, 40.367]
  - - [1024, 23552, 1, 256]
    - [312, 40.518]
  - - [1024, 28672, 1, 256]
    - [311, 41.231]
  - - [1024, 33536, 1, 256]
    - [309, 41.467]
  - - [1024, 40448, 1, 256]
    - [276, 42.351]
  - - [1600, 512, 1, 1024]
    - [233, 30.665]
  - - [2048, 1, 1, 512]
    - [94, 0.099]
  - - [2048, 512, 1, 1]
    - [234, 0.115]
  - - [2048, 960, 1, 2048]
    - [313, 47.638]
  - - [2048, 1024, 1, 1]
    - [235, 0.161]
  - - [2048, 1024, 1, 256]
    - [207, 24.389]
  - - [3200, 1024, 1, 2048]
    - [236, 62.058]
  - - [4096, 1024, 1, 1]
    - [120, 0.191]
  - - [2048, 1024, 1, 2048]
    - [200, 49.992]
  - - [2048, 1024, 1, 30592]
    - [314, 70.123]
  - - [2048, 1024, 1, 6144]
    - [315, 60.021]
  - - [2048, 1024, 1, 8192]
    - [316, 60.419]
  - - [2048, 2, 1, 2]
    - [266, 0.001]
  - - [2048, 2, 1, 2048]
    - [317, 0.392]
  - - [8192, 1024, 1, 2048]
    - [283, 66.135]
  - - [1024, 16, 1, 1024]
    - [93, 1.138]
  - - [1024, 16, 1, 2]
    - [160, 0.005]
  - - [1024, 8192, 1, 30592]
    - [174, 80.636]
  - - [1024, 8192, 1, 3072]
    - [102, 74.988]
  - - [512, 512, 256, 64]
    - [309, 19.693]
  - - [64, 512, 256, 512]
    - [191, 27.663]
  - - [1024, 2048, 1, 30592]
    - [277, 71.792]
  - - [1024, 2048, 1, 3072]
    - [315, 54.073]
  - - [1024, 4096, 1, 30592]
    - [238, 75.764]
  - - [1024, 4096, 1, 3072]
    - [164, 76.511]
  - - [512, 512, 128, 64]
    - [312, 18.66]
  - - [2560, 2048, 1, 1920]
    - [259, 58.548]
  - - [2560, 2048, 1, 2560]
    - [239, 60.738]
  - - [2560, 2048, 1, 7680]
    - [318, 63.824]
  - - [2560, 4, 1, 2]
    - [160, 0.004]
  - - [2560, 4, 1, 2560]
    - [319, 1.005]
  - - [640, 2048, 1, 2560]
    - [240, 53.133]
  - - [512, 512, 40, 64]
    - [241, 15.819]
  - - [64, 512, 40, 512]
    - [242, 23.005]
  - - [1536, 4096, 1, 1536]
    - [169, 58.121]
  - - [1536, 4096, 1, 4608]
    - [122, 69.835]
  - - [1536, 4096, 1, 50304]
    - [132, 76.863]
  - - [1536, 4096, 1, 6144]
    - [132, 71.647]
  - - [6144, 4096, 1, 1536]
    - [157, 73.451]
  - - [1024, 1024, 64, 96]
    - [310, 27.861]
  - - [96, 1024, 64, 1024]
    - [259, 39.509]
  - - [1536, 8192, 1, 1536]
    - [157, 71.126]
  - - [1536, 8192, 1, 4608]
    - [157, 81.12]
  - - [1536, 8192, 1, 50304]
    - [243, 83.11]
  - - [1536, 8192, 1, 6144]
    - [244, 82.065]
  - - [6144, 8192, 1, 1536]
    - [245, 75.426]
  - - [1024, 1024, 128, 96]
    - [310, 28.806]
  - - [96, 1024, 128, 1024]
    - [320, 42.927]
  - - [1024, 16384, 1, 1024]
    - [164, 64.568]
  - - [1024, 16384, 1, 3072]
    - [102, 76.767]
  - - [1024, 16384, 1, 4096]
    - [210, 77.231]
  - - [1024, 16384, 1, 50304]
    - [101, 82.017]
  - - [4096, 16384, 1, 1024]
    - [283, 70.369]
  - - [1024, 1024, 256, 64]
    - [264, 21.848]
  - - [64, 1024, 256, 1024]
    - [321, 35.398]
  - - [1024, 2048, 1, 50304]
    - [296, 76.544]
  - - [1024, 1024, 32, 64]
    - [258, 19.665]
  - - [64, 1024, 32, 1024]
    - [322, 26.654]
  - - [1024, 4096, 1, 50304]
    - [296, 77.465]
  - - [1024, 1024, 64, 64]
    - [258, 20.913]
  - - [64, 1024, 64, 1024]
    - [248, 30.635]
  - - [1024, 8192, 1, 50304]
    - [164, 81.337]
  - - [1024, 1024, 128, 64]
    - [264, 21.494]
  - - [64, 1024, 128, 1024]
    - [249, 33.904]
  - - [128, 128, 1024, 64]
    - [275, 13.239]
  - - [64, 128, 1024, 128]
    - [323, 15.388]
  - - [1024, 64, 1, 2]
    - [266, 0.016]
  - - [1024, 8192, 1, 30528]
    - [255, 81.107]
  - - [1024, 64, 1, 1024]
    - [324, 3.568]
  - - [1024, 3456, 1, 1024]
    - [325, 52.99]
  - - [1024, 3456, 1, 512]
    - [258, 38.451]
  - - [1024, 4096, 1, 512]
    - [326, 40.194]
  - - [1024, 6912, 1, 1024]
    - [327, 55.324]
  - - [1024, 6912, 1, 512]
    - [328, 45.644]
  - - [1024, 864, 1, 1024]
    - [329, 30.498]
  - - [1024, 864, 1, 512]
    - [330, 21.851]
  - - [256, 3456, 1, 128]
    - [331, 9.905]
  - - [256, 4096, 1, 128]
    - [332, 10.38]
  - - [256, 55296, 1, 128]
    - [264, 27.483]
  - - [256, 6912, 1, 128]
    - [333, 15.585]
  - - [256, 864, 1, 128]
    - [334, 3.312]
  - - [480, 3456, 1, 1024]
    - [335, 37.056]
  - - [480, 4096, 1, 1024]
    - [336, 38.847]
  - - [480, 6912, 1, 1024]
    - [337, 45.098]
  - - [480, 864, 1, 1024]
    - [338, 17.742]
  - - [512, 3456, 1, 256]
    - [339, 23.293]
  - - [512, 4096, 1, 256]
    - [340, 23.047]
  - - [512, 55296, 1, 256]
    - [309, 42.82]
  - - [512, 6912, 1, 256]
    - [341, 28.356]
  - - [512, 864, 1, 256]
    - [342, 9.136]
  - - [1024, 640, 1, 30528]
    - [343, 70.441]
  - - [1024, 1280, 1, 30528]
    - [344, 71.722]
  - - [1024, 1600, 1, 30528]
    - [345, 81.546]
  - - [1024, 10240, 1, 1024]
    - [346, 56.389]
  - - [1024, 10240, 1, 4096]
    - [347, 68.125]
  - - [4096, 10240, 1, 1024]
    - [279, 70.901]
  - - [1024, 80, 1, 1024]
    - [324, 4.461]
  - - [1024, 80, 1, 2]
    - [348, 0.019]
  - - [128, 128, 1280, 64]
    - [287, 13.434]
  - - [64, 128, 1280, 128]
    - [289, 15.721]
  - - [1024, 1640, 1, 30528]
    - [349, 75.047]
  - - [1024, 10496, 1, 1024]
    - [350, 57.863]
  - - [1024, 10496, 1, 4096]
    - [351, 69.592]
  - - [4096, 10496, 1, 1024]
    - [283, 69.887]
  - - [1024, 82, 1, 1024]
    - [352, 4.598]
  - - [1024, 82, 1, 2]
    - [348, 0.021]
  - - [128, 128, 1312, 64]
    - [287, 13.481]
  - - [64, 128, 1312, 128]
    - [353, 15.739]
  - - [1024, 160, 1, 30528]
    - [270, 43.664]
  - - [1024, 240, 1, 30528]
    - [354, 53.312]
  - - [1024, 6144, 1, 4096]
    - [308, 61.552]
  - - [1024, 12, 1, 1024]
    - [355, 0.689]
  - - [4096, 6144, 1, 1024]
    - [356, 64.516]
  - - [1024, 6144, 1, 1024]
    - [308, 52.84]
  - - [1024, 12, 1, 2]
    - [266, 0.003]
  - - [512, 512, 192, 64]
    - [309, 19.225]
  - - [64, 512, 192, 512]
    - [357, 26.328]
  - - [256, 4096, 1, 1]
    - [288, 0.091]
  - - [256, 6912, 1, 1]
    - [358, 0.133]
  - - [3136, 128, 64, 64]
    - [359, 16.386]
  - - [3136, 256, 64, 64]
    - [360, 19.019]
  - - [3136, 256, 64, 128]
    - [318, 31.66]
  - - [784, 512, 64, 256]
    - [361, 38.419]
  - - [3136, 128, 64, 256]
    - [362, 36.013]
  - - [3136, 256, 64, 256]
    - [363, 44.056]
  - - [784, 256, 64, 512]
    - [364, 42.358]
  - - [784, 512, 64, 512]
    - [365, 45.321]
  - - [3136, 128, 32, 64]
    - [333, 15.295]
  - - [3136, 256, 32, 64]
    - [264, 18.017]
  - - [3136, 256, 32, 128]
    - [264, 29.733]
  - - [784, 512, 32, 256]
    - [361, 36.161]
  - - [3136, 128, 32, 256]
    - [362, 32.913]
  - - [3136, 256, 32, 256]
    - [366, 42.127]
  - - [784, 256, 32, 512]
    - [361, 40.491]
  - - [784, 512, 32, 512]
    - [361, 42.712]
  - - [3136, 64, 64, 64]
    - [367, 13.129]
  - - [3136, 64, 64, 256]
    - [366, 26.971]
  - - [784, 128, 64, 512]
    - [365, 36.635]
  - - [64, 192, 64, 1280]
    - [368, 23.789]
  - - [64, 320, 64, 1280]
    - [369, 25.405]
  - - [64, 384, 64, 1280]
    - [358, 29.953]
  - - [64, 448, 64, 1280]
    - [370, 28.961]
  - - [64, 192, 64, 2048]
    - [368, 23.588]
  - - [64, 320, 64, 2048]
    - [371, 25.898]
  - - [64, 384, 64, 2048]
    - [372, 29.381]
  - - [64, 448, 64, 2048]
    - [368, 29.431]
  - - [64, 192, 32, 1280]
    - [373, 19.225]
  - - [64, 320, 32, 1280]
    - [374, 23.575]
  - - [64, 384, 32, 1280]
    - [371, 26.241]
  - - [64, 448, 32, 1280]
    - [375, 27.895]
  - - [64, 192, 32, 2048]
    - [376, 19.99]
  - - [64, 320, 32, 2048]
    - [357, 25.478]
  - - [64, 384, 32, 2048]
    - [330, 27.964]
  - - [64, 448, 32, 2048]
    - [377, 29.162]
  - - [1024, 10224, 1, 1024]
    - [258, 55.004]
  - - [1024, 10192, 1, 1024]
    - [378, 55.873]
  - - [1024, 10208, 1, 1024]
    - [365, 55.558]
  - - [1024, 10224, 1, 4096]
    - [351, 67.515]
  - - [1024, 10224, 1, 3072]
    - [351, 65.091]
  - - [4096, 10224, 1, 1024]
    - [273, 69.167]
  - - [1024, 10240, 1, 3072]
    - [346, 65.349]
  - - [1024, 10192, 1, 3072]
    - [327, 65.326]
  - - [4096, 10192, 1, 1024]
    - [279, 68.444]
  - - [1024, 10192, 1, 4096]
    - [379, 67.531]
  - - [1024, 10200, 1, 3072]
    - [380, 65.32]
  - - [1024, 10184, 1, 1024]
    - [310, 55.892]
  - - [4096, 10208, 1, 1024]
    - [273, 68.586]
  - - [1024, 10208, 1, 3072]
    - [379, 65.258]
  - - [1024, 10208, 1, 4096]
    - [347, 67.626]
  - - [1024, 10224, 1, 2048]
    - [351, 63.079]
  - - [1024, 10240, 1, 2048]
    - [350, 63.019]
  - - [1024, 10120, 1, 1024]
    - [310, 55.541]
  - - [1024, 10192, 1, 2048]
    - [337, 63.04]
  - - [64, 24, 6816, 24]
    - [275, 3.03]
  - - [1024, 10152, 1, 1024]
    - [346, 56.03]
  - - [1024, 10080, 1, 3072]
    - [350, 64.608]
  - - [64, 26, 6272, 26]
    - [288, 3.256]
  - - [100352, 512, 1, 256]
    - [381, 42.98]
  - - [12544, 2048, 1, 1024]
    - [382, 67.615]
  - - [12544, 64, 1, 147]
    - [288, 7.723]
  - - [200704, 512, 1, 256]
    - [383, 41.769]
  - - [25088, 1024, 1, 512]
    - [306, 54.611]
  - - [3136, 64, 1, 576]
    - [324, 8.196]
  - - [50176, 1024, 1, 512]
    - [306, 56.143]
  - - [6272, 2048, 1, 1024]
    - [282, 59.958]
  - - [784, 128, 1, 1152]
    - [324, 5.304]
  - - [3136, 128, 128, 256]
    - [308, 38.708]
  - - [3136, 128, 256, 256]
    - [326, 40.266]
  - - [3136, 256, 128, 64]
    - [258, 19.657]
  - - [3136, 256, 256, 64]
    - [384, 19.973]
  - - [3136, 64, 128, 256]
    - [305, 28.507]
  - - [3136, 64, 256, 256]
    - [272, 29.266]
  - - [3136, 64, 128, 64]
    - [385, 14.014]
  - - [3136, 64, 256, 64]
    - [386, 14.557]
  - - [784, 128, 128, 512]
    - [365, 38.157]
  - - [784, 128, 256, 512]
    - [378, 41.113]
  - - [784, 256, 128, 512]
    - [365, 44.68]
  - - [784, 256, 256, 512]
    - [387, 46.259]
  - - [784, 512, 128, 128]
    - [388, 29.935]
  - - [784, 512, 256, 128]
    - [388, 31.084]
  - - [128, 128, 2048, 64]
    - [389, 13.841]
  - - [64, 128, 2048, 128]
    - [275, 16.5]
  - - [1024, 2560, 1, 30528]
    - [390, 85.876]
  - - [1024, 128, 1, 1024]
    - [391, 7.017]
  - - [1024, 128, 1, 2]
    - [392, 0.032]
  - - [128, 128, 1536, 64]
    - [386, 13.591]
  - - [64, 128, 1536, 128]
    - [275, 16.069]
  - - [1024, 12288, 1, 4096]
    - [393, 73.649]
  - - [1024, 12288, 1, 1024]
    - [279, 58.084]
  - - [4096, 12288, 1, 1024]
    - [273, 69.23]
  - - [1024, 1920, 1, 30528]
    - [394, 77.851]
  - - [1024, 96, 1, 1024]
    - [352, 5.383]
  - - [1024, 96, 1, 2]
    - [348, 0.025]
  - - [128, 128, 192, 64]
    - [287, 9.613]
  - - [64, 128, 192, 128]
    - [339, 12.905]
  - - [768, 2048, 1, 2]
    - [395, 0.246]
  - - [3072, 2048, 1, 768]
    - [363, 49.855]
  - - [768, 2048, 1, 3072]
    - [396, 48.207]
  - - [768, 2048, 1, 768]
    - [397, 33.846]
  - - [384, 384, 144, 64]
    - [276, 17.469]
  - - [64, 384, 144, 384]
    - [398, 24.224]
  - - [768, 4608, 1, 2]
    - [364, 0.345]
  - - [3072, 4608, 1, 768]
    - [399, 58.742]
  - - [768, 4608, 1, 3072]
    - [346, 64.969]
  - - [768, 4608, 1, 768]
    - [346, 47.901]
  - - [512, 512, 48, 64]
    - [309, 15.933]
  - - [64, 512, 48, 512]
    - [358, 25.987]
  - - [128, 128, 256, 64]
    - [323, 10.555]
  - - [64, 128, 256, 128]
    - [332, 12.078]
  - - [384, 384, 192, 64]
    - [318, 17.982]
  - - [64, 384, 192, 384]
    - [400, 22.761]
  - - [1024, 4608, 1, 2]
    - [401, 0.35]
  - - [4096, 4608, 1, 1024]
    - [282, 66.084]
  - - [1024, 4608, 1, 4096]
    - [278, 78.401]
  - - [1024, 4608, 1, 1024]
    - [279, 55.414]
  - - [8192, 1024, 1, 1024]
    - [402, 56.058]
  - - [8192, 4096, 1, 1024]
    - [273, 69.72]
  - - [196, 1024, 64, 512]
    - [404, 34.004]
  - - [196, 512, 64, 1024]
    - [405, 35.825]
  - - [196, 1024, 64, 1024]
    - [406, 41.196]
  - - [49, 2048, 64, 1024]
    - [407, 22.372]
  - - [49, 1024, 64, 2048]
    - [408, 22.694]
  - - [196, 1024, 32, 512]
    - [409, 31.242]
  - - [196, 512, 32, 1024]
    - [410, 31.824]
  - - [196, 1024, 32, 1024]
    - [411, 39.277]
  - - [49, 2048, 32, 1024]
    - [410, 20.543]
  - - [49, 1024, 32, 2048]
    - [412, 19.97]
  - - [49, 2048, 64, 512]
    - [413, 18.583]
  - - [49, 512, 64, 2048]
    - [408, 18.787]
  - - [1225, 32, 64, 192]
    - [414, 12.521]
  - - [1225, 48, 64, 192]
    - [414, 11.176]
  - - [1225, 64, 64, 192]
    - [415, 17.472]
  - - [1225, 48, 64, 256]
    - [409, 12.627]
  - - [1225, 64, 64, 256]
    - [416, 18.465]
  - - [1225, 48, 64, 288]
    - [417, 13.725]
  - - [1225, 64, 64, 288]
    - [418, 20.742]
  - - [5329, 80, 64, 64]
    - [419, 9.977]
  - - [289, 128, 64, 768]
    - [420, 25.246]
  - - [289, 160, 64, 768]
    - [421, 31.604]
  - - [289, 192, 64, 768]
    - [410, 32.681]
  - - [1225, 32, 32, 192]
    - [422, 10.339]
  - - [1225, 48, 32, 192]
    - [422, 10.002]
  - - [1225, 64, 32, 192]
    - [418, 15.077]
  - - [1225, 48, 32, 256]
    - [417, 11.326]
  - - [1225, 64, 32, 256]
    - [423, 16.695]
  - - [1225, 48, 32, 288]
    - [417, 12.075]
  - - [1225, 64, 32, 288]
    - [424, 18.679]
  - - [5329, 80, 32, 64]
    - [425, 9.546]
  - - [289, 128, 32, 768]
    - [426, 22.567]
  - - [289, 160, 32, 768]
    - [427, 22.724]
  - - [289, 192, 32, 768]
    - [428, 29.473]
  - - [196, 256, 1, 2304]
    - [429, 4.21]
  - - [49, 512, 1, 4608]
    - [430, 3.992]
  - - [196, 1024, 128, 256]
    - [431, 27.612]
  - - [196, 1024, 256, 256]
    - [431, 28.553]
  - - [196, 256, 128, 1024]
    - [432, 33.742]
  - - [196, 256, 256, 1024]
    - [410, 35.961]
  - - [196, 512, 128, 1024]
    - [433, 37.713]
  - - [196, 512, 256, 1024]
    - [434, 38.782]
  - - [49, 2048, 128, 512]
    - [435, 20.153]
  - - [49, 2048, 256, 512]
    - [435, 20.413]
  - - [49, 512, 128, 2048]
    - [436, 22.163]
  - - [49, 512, 256, 2048]
    - [437, 24.487]
- null
