library/src/blas3/Tensile/Logic/aldebaran/aldebaran_Cijk_Alik_Bjlk_I8II_BH.yaml
- {MinimumRequiredVersion: 4.25.0}
- aldebaran
- gfx90a
- [Device 7400, Device 7408, Device 740c]
    SolutionIndex: 0
    SolutionNameMin: Cijk_Alik_Bjlk_I8II_BH_MT64x64x32_MI32x32x8x1_SE_1LDSB0_EPS1_GRVW4_LPA4_NLCB1_OPLV0_PK0_PAP0_PGR1_PLR1_SU32_SUS256_SRVW0_TT1_32_WG64_4_1_WGM8
    SolutionIndex: 1
    SolutionNameMin: Cijk_Alik_Bjlk_I8II_BH_MT64x64x64_MI32x32x8x1_SE_1LDSB0_EPS1_GRVW4_LPA4_NLCB1_OPLV0_PK0_PAP0_PGR1_PLR1_SU32_SUS256_SRVW0_TT1_32_WG64_4_1_WGM8
    SolutionIndex: 2
    SolutionNameMin: Cijk_Alik_Bjlk_I8II_BH_MT64x128x64_MI32x32x8x1_SE_1LDSB0_EPS1_GRVW16_LPA16_NLCB1_OPLV1_PKn1_PAP1_PGR1_PLR9_SU32_SUS128_SRVW4_TT1_64_WG64_4_1_WGM1
    SolutionIndex: 3
    SolutionNameMin: Cijk_Alik_Bjlk_I8II_BH_MT128x256x64_MI32x32x8x1_SE_1LDSB0_EPS1_GRVW16_LPA16_NLCB1_OPLV1_PKn1_PAP1_PGR1_PLR9_SU32_SUS128_SRVW4_TT2_128_WG64_4_1_WGM1
    SolutionIndex: 4
    SolutionNameMin: Cijk_Alik_Bjlk_I8II_BH_MT128x192x64_MI32x32x8x1_SE_1LDSB0_EPS1_GRVW4_LPA16_NLCB3_OPLV1_PKn1_PAP1_PGR1_PLR9_SU32_SUS256_SRVW4_TT2_96_WG64_4_1_WGM1
    SolutionIndex: 5
    SolutionNameMin: Cijk_Alik_Bjlk_I8II_BH_MT128x64x128_MI32x32x8x1_SE_1LDSB0_EPS1_GRVW16_LPA16_NLCB1_OPLV1_PKn1_PAP1_PGR1_PLR17_SU32_SUS256_SRVW4_TT2_32_WG64_4_1_WGM1
    SolutionIndex: 6
    SolutionNameMin: Cijk_Alik_Bjlk_I8II_BH_MT64x128x64_MI32x32x8x1_SE_1LDSB0_EPS1_GRVW16_LPA16_NLCB1_OPLV1_PKn1_PAP1_PGR1_PLR9_SU32_SUS128_SRVW4_TT1_64_WG64_4_1_WGM2
    SolutionIndex: 7
    SolutionNameMin: Cijk_Alik_Bjlk_I8II_BH_MT128x64x128_MI32x32x8x1_SE_1LDSB0_EPS1_GRVW16_LPA16_NLCB1_OPLV1_PKn1_PAP1_PGR1_PLR17_SU32_SUS256_SRVW4_TT2_32_WG64_4_1_WGM2
    SolutionIndex: 8
    SolutionNameMin: Cijk_Alik_Bjlk_I8II_BH_MT64x64x64_MI32x32x8x1_SE_1LDSB0_EPS0_GRVW16_LPA16_NLCB1_OPLV0_PKn1_PAP0_PGR2_PLR9_SU0_SUS256_SRVW4_TT1_32_WG64_4_1_WGM15
    SolutionIndex: 9
    SolutionNameMin: Cijk_Alik_Bjlk_I8II_BH_MT128x96x64_MI32x32x8x1_SE_1LDSB0_EPS0_GRVW4_LPA16_NLCB3_OPLV0_PKn1_PAP0_PGR2_PLR9_SU32_SUS128_SRVW4_TT1_96_WG128_2_1_WGM15
    SolutionIndex: 10
    SolutionNameMin: Cijk_Alik_Bjlk_I8II_BH_MT32x32x128_MI16x16x16x1_SE_1LDSB0_EPS1_GRVW4_LPA32_NLCB1_OPLV0_PK0_PAP0_PGR1_PLR9_SU0_SUS128_SRVW0_TT1_16_WG32_8_1_WGM1
    SolutionIndex: 11
    SolutionNameMin: Cijk_Alik_Bjlk_I8II_BH_MT64x32x128_MI16x16x16x1_SE_1LDSB0_EPS1_GRVW8_LPA32_NLCB1_OPLV0_PK0_PAP0_PGR1_PLR9_SU0_SUS128_SRVW0_TT2_16_WG32_8_1_WGM1
    SolutionIndex: 12
    SolutionNameMin: Cijk_Alik_Bjlk_I8II_BH_MT32x32x128_MI16x16x16x1_SE_1LDSB0_EPS1_GRVW16_LPA32_NLCB1_OPLV0_PK0_PAP0_PGR1_PLR9_SU0_SUS128_SRVW0_TT1_16_WG32_8_1_WGM1
    SolutionIndex: 13
    SolutionNameMin: Cijk_Alik_Bjlk_I8II_BH_MT64x32x128_MI16x16x16x1_SE_1LDSB0_EPS1_GRVW16_LPA32_NLCB1_OPLV0_PK0_PAP0_PGR1_PLR9_SU0_SUS128_SRVW0_TT2_16_WG32_8_1_WGM1
    SolutionIndex: 14
    SolutionNameMin: Cijk_Alik_Bjlk_I8II_BH_MT32x32x128_MI16x16x16x1_SE_1LDSB0_EPS0_GRVW4_LPA32_NLCB1_OPLV0_PK0_PAP0_PGR2_PLR9_SU0_SUS128_SRVW0_TT1_16_WG32_8_1_WGM1
    SolutionIndex: 15
    SolutionNameMin: Cijk_Alik_Bjlk_I8II_BH_MT32x32x128_MI16x16x16x1_SE_1LDSB0_EPS0_GRVW16_LPA32_NLCB1_OPLV0_PK0_PAP0_PGR2_PLR9_SU0_SUS128_SRVW0_TT1_16_WG32_8_1_WGM1
    SolutionIndex: 16
    SolutionNameMin: Cijk_Alik_Bjlk_I8II_BH_MT64x32x128_MI16x16x16x1_SE_1LDSB0_EPS0_GRVW16_LPA32_NLCB1_OPLV0_PK0_PAP0_PGR2_PLR9_SU0_SUS128_SRVW0_TT2_16_WG32_8_1_WGM1
    SolutionIndex: 17
    SolutionNameMin: Cijk_Alik_Bjlk_I8II_BH_MT128x96x64_MI32x32x8x1_SE_1LDSB0_EPS0_GRVW8_LPA16_NLCB3_OPLV0_PK0_PAP0_PGR2_PLR9_SU0_SUS128_SRVW4_TT1_96_WG128_2_1_WGM1
    SolutionIndex: 18
    SolutionNameMin: Cijk_Alik_Bjlk_I8II_BH_MT64x128x64_MI32x32x8x1_SE_1LDSB0_EPS0_GRVW16_LPA16_NLCB1_OPLV0_PK0_PAP0_PGR2_PLR9_SU0_SUS128_SRVW4_TT1_64_WG64_4_1_WGM1
    SolutionIndex: 19
    SolutionNameMin: Cijk_Alik_Bjlk_I8II_BH_MT160x128x64_MI32x32x8x1_SE_1LDSB0_EPS1_GRVW4_LPA16_NLCB1_OPLV0_PK0_PAP0_PGR1_PLR9_SU0_SUS256_SRVW0_TT5_32_WG32_8_1_WGM1
    SolutionIndex: 20
    SolutionNameMin: Cijk_Alik_Bjlk_I8II_BH_MT32x32x128_MI16x16x16x1_SE_1LDSB0_EPS1_GRVW16_LPA32_NLCB1_OPLV0_PK0_PAP0_PGR1_PLR9_SU0_SUS256_SRVW0_TT1_16_WG32_8_1_WGM1
    SolutionIndex: 21
    SolutionNameMin: Cijk_Alik_Bjlk_I8II_BH_MT32x64x128_MI16x16x16x1_SE_1LDSB0_EPS1_GRVW16_LPA32_NLCB1_OPLV0_PK0_PAP0_PGR1_PLR9_SU0_SUS256_SRVW0_TT1_32_WG32_8_1_WGM1
    SolutionIndex: 22
    SolutionNameMin: Cijk_Alik_Bjlk_I8II_BH_MT64x32x128_MI16x16x16x1_SE_1LDSB0_EPS1_GRVW16_LPA32_NLCB1_OPLV0_PK0_PAP0_PGR1_PLR9_SU0_SUS256_SRVW0_TT2_16_WG32_8_1_WGM1
    SolutionIndex: 23
    SolutionNameMin: Cijk_Alik_Bjlk_I8II_BH_MT128x128x64_MI32x32x8x1_SE_1LDSB0_EPS0_GRVW4_LPA16_NLCB1_OPLV0_PK0_PAP0_PGR2_PLR9_SU0_SUS256_SRVW4_TT2_64_WG64_4_1_WGM1
    SolutionIndex: 24
    SolutionNameMin: Cijk_Alik_Bjlk_I8II_BH_MT64x64x64_MI32x32x8x1_SE_1LDSB0_EPS0_GRVW8_LPA16_NLCB1_OPLV0_PK0_PAP0_PGR2_PLR9_SU0_SUS256_SRVW4_TT1_32_WG64_4_1_WGM1
    SolutionIndex: 25
    SolutionNameMin: Cijk_Alik_Bjlk_I8II_BH_MT128x64x128_MI32x32x8x1_SE_1LDSB0_EPS1_GRVW16_LPA16_NLCB1_OPLV0_PK0_PAP0_PGR1_PLR17_SU0_SUS256_SRVW4_TT2_32_WG64_4_1_WGM1
    SolutionIndex: 26
    SolutionNameMin: Cijk_Alik_Bjlk_I8II_BH_MT64x128x64_MI32x32x8x1_SE_1LDSB0_EPS0_GRVW16_LPA16_NLCB1_OPLV0_PK0_PAP0_PGR2_PLR9_SU32_SUS128_SRVW4_TT1_64_WG64_4_1_WGM1
    SolutionIndex: 27
    SolutionNameMin: Cijk_Alik_Bjlk_I8II_BH_MT64x64x64_MI32x32x8x1_SE_1LDSB0_EPS0_GRVW16_LPA16_NLCB1_OPLV0_PK0_PAP0_PGR2_PLR9_SU32_SUS256_SRVW4_TT1_32_WG64_4_1_WGM1
    SolutionIndex: 28
    SolutionNameMin: Cijk_Alik_Bjlk_I8II_BH_MT96x96x128_MI16x16x16x1_SE_1LDSB0_EPS1_GRVW4_LPA32_NLCB3_OPLV0_PK0_PAP0_PGR1_PLR9_SU0_SUS128_SRVW0_TT3_48_WG32_8_1_WGM2
    SolutionIndex: 29
    SolutionNameMin: Cijk_Alik_Bjlk_I8II_BH_MT32x32x128_MI16x16x16x1_SE_1LDSB0_EPS0_GRVW4_LPA32_NLCB1_OPLV0_PK0_PAP0_PGR2_PLR9_SU0_SUS128_SRVW0_TT1_16_WG32_8_1_WGM2
    SolutionIndex: 30
    SolutionNameMin: Cijk_Alik_Bjlk_I8II_BH_MT32x32x128_MI16x16x16x1_SE_1LDSB0_EPS0_GRVW16_LPA32_NLCB1_OPLV0_PK0_PAP0_PGR2_PLR9_SU0_SUS128_SRVW0_TT1_16_WG32_8_1_WGM2
    SolutionIndex: 31
    SolutionNameMin: Cijk_Alik_Bjlk_I8II_BH_MT128x256x64_MI32x32x8x1_SE_1LDSB0_EPS1_GRVW4_LPA16_NLCB1_OPLV0_PK0_PAP0_PGR1_PLR9_SU0_SUS128_SRVW4_TT2_128_WG64_4_1_WGM2
    SolutionIndex: 32
    SolutionNameMin: Cijk_Alik_Bjlk_I8II_BH_MT128x256x64_MI32x32x8x1_SE_1LDSB0_EPS1_GRVW16_LPA16_NLCB1_OPLV0_PK0_PAP0_PGR1_PLR9_SU0_SUS128_SRVW4_TT2_128_WG64_4_1_WGM2
    SolutionIndex: 33
    SolutionNameMin: Cijk_Alik_Bjlk_I8II_BH_MT64x128x64_MI32x32x8x1_SE_1LDSB0_EPS0_GRVW16_LPA16_NLCB1_OPLV0_PK0_PAP0_PGR2_PLR9_SU0_SUS128_SRVW4_TT1_64_WG64_4_1_WGM2
    SolutionIndex: 34
    SolutionNameMin: Cijk_Alik_Bjlk_I8II_BH_MT128x96x128_MI32x32x8x1_SE_1LDSB0_EPS1_GRVW16_LPA16_NLCB3_OPLV0_PK0_PAP0_PGR1_PLR17_SU0_SUS128_SRVW4_TT1_96_WG128_2_1_WGM2
    SolutionIndex: 35
    SolutionNameMin: Cijk_Alik_Bjlk_I8II_BH_MT64x128x128_MI32x32x8x1_SE_1LDSB0_EPS0_GRVW4_LPA16_NLCB1_OPLV0_PK0_PAP0_PGR2_PLR17_SU0_SUS128_SRVW4_TT1_64_WG64_4_1_WGM2
    SolutionIndex: 36
    SolutionNameMin: Cijk_Alik_Bjlk_I8II_BH_MT64x64x128_MI32x32x8x1_SE_1LDSB0_EPS0_GRVW8_LPA16_NLCB1_OPLV0_PK0_PAP0_PGR2_PLR17_SU0_SUS128_SRVW4_TT1_32_WG64_4_1_WGM2
    SolutionIndex: 37
    SolutionNameMin: Cijk_Alik_Bjlk_I8II_BH_MT144x64x128_MI16x16x16x1_SE_1LDSB0_EPS1_GRVW8_LPA32_NLCB1_OPLV0_PK0_PAP0_PGR1_PLR9_SU0_SUS256_SRVW0_TT9_16_WG16_16_1_WGM2
    SolutionIndex: 38
    SolutionNameMin: Cijk_Alik_Bjlk_I8II_BH_MT64x32x128_MI16x16x16x1_SE_1LDSB0_EPS1_GRVW16_LPA32_NLCB1_OPLV0_PK0_PAP0_PGR1_PLR9_SU0_SUS256_SRVW0_TT2_16_WG32_8_1_WGM2
    SolutionIndex: 39
    SolutionNameMin: Cijk_Alik_Bjlk_I8II_BH_MT32x32x128_MI16x16x16x1_SE_1LDSB0_EPS0_GRVW4_LPA32_NLCB1_OPLV0_PK0_PAP0_PGR2_PLR9_SU0_SUS256_SRVW0_TT1_16_WG32_8_1_WGM2
    SolutionIndex: 40
    SolutionNameMin: Cijk_Alik_Bjlk_I8II_BH_MT64x64x64_MI32x32x8x1_SE_1LDSB0_EPS1_GRVW16_LPA16_NLCB1_OPLV0_PK0_PAP0_PGR1_PLR9_SU0_SUS256_SRVW4_TT1_32_WG64_4_1_WGM2
    SolutionIndex: 41
    SolutionNameMin: Cijk_Alik_Bjlk_I8II_BH_MT128x128x64_MI32x32x8x1_SE_1LDSB0_EPS0_GRVW4_LPA16_NLCB1_OPLV0_PK0_PAP0_PGR2_PLR9_SU0_SUS256_SRVW4_TT2_64_WG64_4_1_WGM2
    SolutionIndex: 42
    SolutionNameMin: Cijk_Alik_Bjlk_I8II_BH_MT64x64x64_MI32x32x8x1_SE_1LDSB0_EPS0_GRVW8_LPA16_NLCB1_OPLV0_PK0_PAP0_PGR2_PLR9_SU0_SUS256_SRVW4_TT1_32_WG64_4_1_WGM2
    SolutionIndex: 43
    SolutionNameMin: Cijk_Alik_Bjlk_I8II_BH_MT64x128x64_MI32x32x8x1_SE_1LDSB0_EPS0_GRVW16_LPA16_NLCB1_OPLV0_PK0_PAP0_PGR2_PLR9_SU0_SUS256_SRVW4_TT1_64_WG64_4_1_WGM2
    SolutionIndex: 44
    SolutionNameMin: Cijk_Alik_Bjlk_I8II_BH_MT128x96x128_MI32x32x8x1_SE_1LDSB0_EPS1_GRVW16_LPA16_NLCB3_OPLV0_PK0_PAP0_PGR1_PLR17_SU0_SUS256_SRVW4_TT1_96_WG128_2_1_WGM2
    SolutionIndex: 45
    SolutionNameMin: Cijk_Alik_Bjlk_I8II_BH_MT64x128x64_MI32x32x8x1_SE_1LDSB0_EPS0_GRVW16_LPA16_NLCB1_OPLV0_PK0_PAP0_PGR2_PLR9_SU32_SUS128_SRVW4_TT1_64_WG64_4_1_WGM2
    SolutionIndex: 46
    SolutionNameMin: Cijk_Alik_Bjlk_I8II_BH_MT256x160x64_MI32x32x8x1_SE_1LDSB0_EPS1_GRVW4_LPA16_NLCB5_OPLV0_PK0_PAP0_PGR1_PLR9_SU32_SUS256_SRVW4_TT2_160_WG128_2_1_WGM2
    SolutionIndex: 47
    SolutionNameMin: Cijk_Alik_Bjlk_I8II_BH_MT64x64x64_MI32x32x8x1_SE_1LDSB0_EPS0_GRVW16_LPA16_NLCB1_OPLV0_PK0_PAP0_PGR2_PLR9_SU32_SUS256_SRVW4_TT1_32_WG64_4_1_WGM2
    SolutionIndex: 48
    SolutionNameMin: Cijk_Alik_Bjlk_I8II_BH_MT64x64x64_MI32x32x8x1_SE_1LDSB0_EPS1_GRVW16_LPA16_NLCB1_OPLV0_PK0_PAP0_PGR1_PLR9_SU0_SUS128_SRVW4_TT1_32_WG64_4_1_WGM15
    SolutionIndex: 49
    SolutionNameMin: Cijk_Alik_Bjlk_I8II_BH_MT64x128x64_MI32x32x8x1_SE_1LDSB0_EPS1_GRVW16_LPA16_NLCB1_OPLV0_PK0_PAP0_PGR1_PLR9_SU0_SUS128_SRVW4_TT1_64_WG64_4_1_WGM15
    SolutionIndex: 50
    SolutionNameMin: Cijk_Alik_Bjlk_I8II_BH_MT128x96x64_MI32x32x8x1_SE_1LDSB0_EPS0_GRVW4_LPA16_NLCB3_OPLV0_PK0_PAP0_PGR2_PLR9_SU0_SUS128_SRVW4_TT1_96_WG128_2_1_WGM15
    SolutionIndex: 51
    SolutionNameMin: Cijk_Alik_Bjlk_I8II_BH_MT128x96x64_MI32x32x8x1_SE_1LDSB0_EPS0_GRVW8_LPA16_NLCB3_OPLV0_PK0_PAP0_PGR2_PLR9_SU0_SUS128_SRVW4_TT1_96_WG128_2_1_WGM15
    SolutionIndex: 52
    SolutionNameMin: Cijk_Alik_Bjlk_I8II_BH_MT64x64x64_MI32x32x8x1_SE_1LDSB0_EPS0_GRVW16_LPA16_NLCB1_OPLV0_PK0_PAP0_PGR2_PLR9_SU0_SUS128_SRVW4_TT1_32_WG64_4_1_WGM15
    SolutionIndex: 53
    SolutionNameMin: Cijk_Alik_Bjlk_I8II_BH_MT64x64x128_MI32x32x8x1_SE_1LDSB0_EPS0_GRVW8_LPA16_NLCB1_OPLV0_PK0_PAP0_PGR2_PLR17_SU0_SUS128_SRVW4_TT1_32_WG64_4_1_WGM15
    SolutionIndex: 54
    SolutionNameMin: Cijk_Alik_Bjlk_I8II_BH_MT32x32x128_MI16x16x16x1_SE_1LDSB0_EPS0_GRVW16_LPA32_NLCB1_OPLV0_PK0_PAP0_PGR2_PLR9_SU0_SUS256_SRVW0_TT1_16_WG32_8_1_WGM15
    SolutionIndex: 55
    SolutionNameMin: Cijk_Alik_Bjlk_I8II_BH_MT128x256x64_MI32x32x8x1_SE_1LDSB0_EPS1_GRVW4_LPA16_NLCB1_OPLV0_PK0_PAP0_PGR1_PLR9_SU0_SUS256_SRVW4_TT2_128_WG64_4_1_WGM15
    SolutionIndex: 56
    SolutionNameMin: Cijk_Alik_Bjlk_I8II_BH_MT128x96x64_MI32x32x8x1_SE_1LDSB0_EPS0_GRVW4_LPA16_NLCB3_OPLV0_PK0_PAP0_PGR2_PLR9_SU0_SUS256_SRVW4_TT1_96_WG128_2_1_WGM15
    SolutionIndex: 57
    SolutionNameMin: Cijk_Alik_Bjlk_I8II_BH_MT64x128x64_MI32x32x8x1_SE_1LDSB0_EPS0_GRVW16_LPA16_NLCB1_OPLV0_PK0_PAP0_PGR2_PLR9_SU0_SUS256_SRVW4_TT1_64_WG64_4_1_WGM15
    SolutionIndex: 58
    SolutionNameMin: Cijk_Alik_Bjlk_I8II_BH_MT64x64x128_MI32x32x8x1_SE_1LDSB0_EPS0_GRVW16_LPA16_NLCB1_OPLV0_PK0_PAP0_PGR2_PLR17_SU0_SUS256_SRVW4_TT1_32_WG64_4_1_WGM15
    SolutionIndex: 59
    SolutionNameMin: Cijk_Alik_Bjlk_I8II_BH_MT128x96x64_MI32x32x8x1_SE_1LDSB0_EPS1_GRVW8_LPA16_NLCB3_OPLV0_PK0_PAP0_PGR1_PLR9_SU32_SUS128_SRVW4_TT1_96_WG128_2_1_WGM15
    SolutionIndex: 60
    SolutionNameMin: Cijk_Alik_Bjlk_I8II_BH_MT256x256x64_MI32x32x8x1_SE_1LDSB1_EPS1_GRVW16_LPA16_NLCB1_OPLV0_PKn1_PAP0_PGR1_PLR9_SU0_SUS128_SRVW4_TT2_256_WG128_2_1_WGM2
    SolutionIndex: 61
    SolutionNameMin: Cijk_Alik_Bjlk_I8II_BH_MT128x64x64_MI32x32x8x1_SE_1LDSB0_EPS0_GRVW16_LPA16_NLCB1_OPLV0_PK0_PAP0_PGR2_PLR9_SU0_SUS256_SRVW4_TT1_64_WG128_2_1_WGM1
    SolutionIndex: 62
    SolutionNameMin: Cijk_Alik_Bjlk_I8II_BH_MT128x96x64_MI32x32x8x1_SE_1LDSB0_EPS0_GRVW8_LPA16_NLCB3_OPLV0_PK0_PAP0_PGR2_PLR9_SU32_SUS128_SRVW4_TT1_96_WG128_2_1_WGM2
    SolutionIndex: 63
    SolutionNameMin: Cijk_Alik_Bjlk_I8II_BH_MT128x96x64_MI32x32x8x1_SE_1LDSB0_EPS0_GRVW8_LPA16_NLCB3_OPLV0_PK0_PAP0_PGR2_PLR9_SU32_SUS128_SRVW4_TT1_96_WG128_2_1_WGM1
    SolutionIndex: 64
    SolutionNameMin: Cijk_Alik_Bjlk_I8II_BH_MT32x32x128_MI16x16x16x1_SE_1LDSB0_EPS1_GRVW16_LPA32_NLCB1_OPLV0_PK0_PAP0_PGR1_PLR9_SU0_SUS128_SRVW0_TT1_16_WG32_8_1_WGM2
    SolutionIndex: 65
    SolutionNameMin: Cijk_Alik_Bjlk_I8II_BH_MT96x128x64_MI32x32x8x1_SE_1LDSB0_EPS0_GRVW8_LPA16_NLCB1_OPLV0_PK0_PAP0_PGR2_PLR9_SU0_SUS256_SRVW0_TT3_32_WG32_8_1_WGM1
    SolutionIndex: 66
    SolutionNameMin: Cijk_Alik_Bjlk_I8II_BH_MT128x160x64_MI32x32x8x1_SE_1LDSB0_EPS0_GRVW4_LPA16_NLCB5_OPLV0_PK0_PAP0_PGR2_PLR9_SU0_SUS256_SRVW4_TT1_160_WG128_2_1_WGM1
    SolutionIndex: 67
    SolutionNameMin: Cijk_Alik_Bjlk_I8II_BH_MT64x64x64_MI32x32x8x1_SE_1LDSB0_EPS0_GRVW16_LPA16_NLCB1_OPLV0_PKn1_PAP0_PGR2_PLR9_SU32_SUS128_SRVW4_TT1_32_WG64_4_1_WGM15
    SolutionIndex: 68
    SolutionNameMin: Cijk_Alik_Bjlk_I8II_BH_MT128x64x64_MI32x32x8x1_SE_1LDSB0_EPS0_GRVW16_LPA16_NLCB1_OPLV0_PK0_PAP0_PGR2_PLR9_SU0_SUS128_SRVW4_TT1_64_WG128_2_1_WGM1
    SolutionIndex: 69
    SolutionNameMin: Cijk_Alik_Bjlk_I8II_BH_MT64x64x128_MI32x32x8x1_SE_1LDSB0_EPS0_GRVW16_LPA16_NLCB1_OPLV0_PK0_PAP0_PGR2_PLR17_SU0_SUS128_SRVW4_TT1_32_WG64_4_1_WGM15
    SolutionIndex: 70
    SolutionNameMin: Cijk_Alik_Bjlk_I8II_BH_MT128x64x64_MI32x32x8x1_SE_1LDSB0_EPS0_GRVW16_LPA16_NLCB1_OPLV0_PK0_PAP0_PGR2_PLR9_SU32_SUS128_SRVW4_TT1_64_WG128_2_1_WGM2
    SolutionIndex: 71
    SolutionNameMin: Cijk_Alik_Bjlk_I8II_BH_MT128x64x64_MI32x32x8x1_SE_1LDSB0_EPS1_GRVW16_LPA16_NLCB1_OPLV1_PKn1_PAP1_PGR1_PLR9_SU32_SUS256_SRVW4_TT1_64_WG128_2_1_WGM1
    SolutionIndex: 72
    SolutionNameMin: Cijk_Alik_Bjlk_I8II_BH_MT128x64x64_MI32x32x8x1_SE_1LDSB0_EPS0_GRVW16_LPA16_NLCB1_OPLV0_PK0_PAP0_PGR2_PLR9_SU32_SUS128_SRVW4_TT1_64_WG128_2_1_WGM1
    SolutionIndex: 73
    SolutionNameMin: Cijk_Alik_Bjlk_I8II_BH_MT128x96x64_MI32x32x8x1_SE_1LDSB0_EPS0_GRVW4_LPA16_NLCB3_OPLV0_PK0_PAP0_PGR2_PLR9_SU0_SUS256_SRVW4_TT1_96_WG128_2_1_WGM2
    SolutionIndex: 74
    SolutionNameMin: Cijk_Alik_Bjlk_I8II_BH_MT32x32x128_MI16x16x16x1_SE_1LDSB0_EPS0_GRVW16_LPA32_NLCB1_OPLV0_PK0_PAP0_PGR2_PLR9_SU0_SUS128_SRVW4_TT1_16_WG32_8_1_WGM15
    SolutionIndex: 75
    SolutionNameMin: Cijk_Alik_Bjlk_I8II_BH_MT64x64x128_MI32x32x8x1_SE_1LDSB0_EPS0_GRVW16_LPA16_NLCB1_OPLV0_PK0_PAP0_PGR2_PLR17_SU0_SUS128_SRVW4_TT1_32_WG64_4_1_WGM1
    SolutionIndex: 76
    SolutionNameMin: Cijk_Alik_Bjlk_I8II_BH_MT32x32x128_MI16x16x16x1_SE_1LDSB0_EPS1_GRVW16_LPA32_NLCB1_OPLV0_PK0_PAP0_PGR1_PLR9_SU0_SUS256_SRVW0_TT1_16_WG32_8_1_WGM15
    SolutionIndex: 77
    SolutionNameMin: Cijk_Alik_Bjlk_I8II_BH_MT128x64x64_MI32x32x8x1_SE_1LDSB0_EPS0_GRVW16_LPA16_NLCB1_OPLV0_PKn1_PAP0_PGR2_PLR9_SU0_SUS256_SRVW4_TT1_64_WG128_2_1_WGM1
    SolutionIndex: 78
    SolutionNameMin: Cijk_Alik_Bjlk_I8II_BH_MT64x64x64_MI32x32x8x1_SE_1LDSB0_EPS0_GRVW8_LPA16_NLCB1_OPLV0_PK0_PAP0_PGR2_PLR9_SU0_SUS128_SRVW4_TT1_32_WG64_4_1_WGM15
    SolutionIndex: 79
    SolutionNameMin: Cijk_Alik_Bjlk_I8II_BH_MT128x64x64_MI32x32x8x1_SE_1LDSB0_EPS0_GRVW8_LPA16_NLCB1_OPLV0_PK0_PAP0_PGR2_PLR9_SU0_SUS256_SRVW4_TT1_64_WG128_2_1_WGM1
    SolutionIndex: 80
    SolutionNameMin: Cijk_Alik_Bjlk_I8II_BH_MT64x64x128_MI32x32x8x1_SE_1LDSB0_EPS0_GRVW8_LPA16_NLCB1_OPLV0_PK0_PAP0_PGR2_PLR17_SU0_SUS256_SRVW4_TT1_32_WG64_4_1_WGM15
    SolutionIndex: 81
    SolutionNameMin: Cijk_Alik_Bjlk_I8II_BH_MT32x32x128_MI16x16x16x1_SE_1LDSB0_EPS0_GRVW4_LPA32_NLCB1_OPLV0_PK0_PAP0_PGR2_PLR9_SU0_SUS128_SRVW0_TT1_16_WG32_8_1_WGM15
    SolutionIndex: 82
    SolutionNameMin: Cijk_Alik_Bjlk_I8II_BH_MT64x128x64_MI32x32x8x1_SE_1LDSB0_EPS0_GRVW16_LPA16_NLCB1_OPLV0_PKn1_PAP0_PGR2_PLR9_SU0_SUS256_SRVW4_TT1_64_WG64_4_1_WGM15
- - - [35, 35, 1, 512]
    - [1, 0.043]
  - - [4, 64, 1, 128]
    - [0, 0.004]
  - - [480, 512, 1, 512]
    - [21, 17.576]
  - - [960, 1024, 1, 1024]
    - [24, 58.633]
  - - [1920, 2048, 1, 2048]
    - [32, 83.923]
  - - [3840, 4096, 1, 4096]
    - [60, 91.794]
  - - [7680, 8192, 1, 8192]
    - [3, 95.17]
  - - [1024, 128, 1, 128]
    - [30, 3.925]
  - - [1856, 448, 1, 3328]
    - [25, 65.727]
  - - [2944, 4288, 1, 1280]
    - [61, 79.171]
  - - [2368, 64, 1, 3328]
    - [16, 24.0]
  - - [2368, 5888, 1, 256]
    - [62, 53.56]
  - - [128, 64, 1, 256]
    - [12, 0.404]
  - - [5888, 1024, 1, 1280]
    - [45, 70.485]
  - - [128, 6784, 1, 3328]
    - [35, 65.855]
  - - [64, 4, 1, 256]
    - [10, 0.01]
  - - [5888, 1856, 1, 3328]
    - [4, 83.195]
  - - [5056, 704, 1, 256]
    - [57, 40.415]
  - - [5888, 2944, 1, 3328]
    - [50, 86.122]
  - - [1856, 4288, 1, 256]
    - [63, 48.026]
  - - [1024, 5056, 1, 128]
    - [59, 29.116]
  - - [5056, 5056, 1, 3328]
    - [4, 85.507]
  - - [1408, 5888, 1, 1280]
    - [18, 76.41]
  - - [2368, 448, 1, 128]
    - [27, 16.433]
  - - [1024, 3584, 1, 3328]
    - [55, 82.054]
  - - [1408, 64, 1, 128]
    - [64, 2.816]
  - - [256, 4288, 1, 3328]
    - [65, 59.423]
  - - [5888, 1408, 1, 1280]
    - [43, 76.449]
  - - [704, 1856, 1, 3328]
    - [44, 71.687]
  - - [1024, 2368, 1, 256]
    - [66, 35.86]
  - - [1408, 1856, 1, 1280]
    - [61, 66.18]
  - - [1408, 64, 1, 1280]
    - [15, 12.902]
  - - [448, 1024, 1, 1280]
    - [58, 45.415]
  - - [256, 1408, 1, 3328]
    - [53, 45.388]
  - - [5056, 5056, 1, 1280]
    - [33, 80.512]
  - - [448, 5056, 1, 256]
    - [67, 35.623]
  - - [704, 1856, 1, 1280]
    - [34, 59.891]
  - - [128, 5056, 1, 128]
    - [48, 13.844]
  - - [2368, 128, 1, 256]
    - [38, 12.665]
  - - [1856, 1408, 1, 128]
    - [49, 23.131]
  - - [64, 5056, 1, 256]
    - [22, 13.366]
  - - [6784, 256, 1, 3328]
    - [23, 75.158]
  - - [6784, 4288, 1, 3328]
    - [51, 87.476]
  - - [4288, 448, 1, 256]
    - [68, 35.769]
  - - [64, 704, 1, 128]
    - [20, 1.396]
  - - [1856, 2368, 1, 3328]
    - [46, 78.143]
  - - [4288, 2944, 1, 1280]
    - [18, 80.449]
  - - [704, 5056, 1, 1280]
    - [32, 70.165]
  - - [2368, 704, 1, 3328]
    - [5, 70.576]
  - - [256, 5888, 1, 256]
    - [57, 30.777]
  - - [1856, 4288, 1, 3328]
    - [4, 80.843]
  - - [256, 2944, 1, 256]
    - [40, 25.312]
  - - [5888, 1024, 1, 256]
    - [57, 43.772]
  - - [448, 64, 1, 1280]
    - [54, 4.041]
  - - [448, 5056, 1, 3328]
    - [19, 77.437]
  - - [3584, 4, 1, 1280]
    - [29, 2.146]
  - - [2944, 64, 1, 256]
    - [12, 8.851]
  - - [128, 4, 1, 1280]
    - [14, 0.063]
  - - [1408, 2944, 1, 256]
    - [6, 42.682]
  - - [256, 1856, 1, 1280]
    - [69, 47.037]
  - - [6784, 5056, 1, 3328]
    - [9, 86.998]
  - - [5056, 5056, 1, 256]
    - [70, 52.993]
  - - [1408, 6784, 1, 128]
    - [71, 33.133]
  - - [64, 1024, 1, 1280]
    - [30, 9.42]
  - - [2944, 4, 1, 256]
    - [39, 0.55]
  - - [704, 5056, 1, 128]
    - [72, 27.627]
  - - [2368, 2944, 1, 1280]
    - [73, 74.207]
  - - [128, 3584, 1, 1280]
    - [58, 44.677]
  - - [6784, 6784, 1, 1280]
    - [45, 82.274]
  - - [1024, 256, 1, 3328]
    - [36, 33.691]
  - - [1408, 4288, 1, 1280]
    - [47, 70.397]
  - - [3584, 4288, 1, 1280]
    - [45, 79.19]
  - - [2368, 704, 1, 1280]
    - [7, 60.452]
  - - [5056, 4288, 1, 3328]
    - [51, 86.637]
  - - [3584, 2368, 1, 3328]
    - [56, 83.929]
  - - [64, 704, 1, 1280]
    - [15, 6.529]
  - - [4288, 256, 1, 256]
    - [37, 27.299]
  - - [2944, 128, 1, 128]
    - [11, 9.15]
  - - [6784, 448, 1, 1280]
    - [52, 62.303]
  - - [1408, 2944, 1, 128]
    - [6, 30.154]
  - - [4288, 2944, 1, 256]
    - [26, 51.699]
  - - [5888, 704, 1, 1280]
    - [8, 67.925]
  - - [1856, 64, 1, 1280]
    - [74, 15.245]
  - - [448, 5888, 1, 128]
    - [57, 23.29]
  - - [5888, 64, 1, 3328]
    - [75, 45.431]
  - - [2944, 256, 1, 3328]
    - [42, 59.424]
  - - [1024, 64, 1, 128]
    - [76, 2.066]
  - - [5056, 2368, 1, 1280]
    - [33, 77.146]
  - - [448, 3584, 1, 1280]
    - [41, 59.793]
  - - [6784, 5888, 1, 256]
    - [61, 51.404]
  - - [64, 1024, 1, 3328]
    - [30, 13.283]
  - - [704, 128, 1, 1280]
    - [30, 12.902]
  - - [5888, 2944, 1, 128]
    - [77, 36.729]
  - - [1408, 448, 1, 1280]
    - [78, 42.291]
  - - [1024, 1408, 1, 256]
    - [17, 33.001]
  - - [2368, 2368, 1, 3328]
    - [50, 81.671]
  - - [1856, 6784, 1, 128]
    - [2, 34.409]
  - - [5056, 704, 1, 3328]
    - [31, 79.581]
  - - [1408, 1856, 1, 256]
    - [68, 37.34]
  - - [1408, 704, 1, 3328]
    - [28, 65.684]
  - - [2368, 5056, 1, 256]
    - [62, 53.084]
  - - [5888, 1856, 1, 256]
    - [79, 48.663]
  - - [4288, 64, 1, 3328]
    - [80, 34.418]
  - - [2368, 4, 1, 1280]
    - [81, 1.304]
  - - [704, 5888, 1, 256]
    - [82, 43.429]
  - - [4288, 64, 1, 256]
    - [13, 11.467]
  - - [6784, 64, 1, 256]
    - [52, 17.73]
- null
