library/src/blas3/Tensile/Logic/aldebaran/aldebaran_Cijk_Ailk_Bjlk_HSS_BH.yaml
- {MinimumRequiredVersion: 4.23.0}
- aldebaran
- gfx90a
- [Device 0050, Device 0051, Device 0052, Device 0054, Device 0062, Device 7400, Device 740c]
    SolutionIndex: 0
    SolutionNameMin: Cijk_Ailk_Bjlk_HSS_BH_MT16x16x8_SE_PGR1_PLR1_TT2_2
    SolutionIndex: 1
    SolutionNameMin: Cijk_Ailk_Bjlk_HSS_BH_MT32x32x8_SE_PGR1_PLR1_TT4_4
    SolutionIndex: 2
    SolutionNameMin: Cijk_Ailk_Bjlk_HSS_BH_MT16x16x16_SE_PGR1_PLR1_TT2_2
    SolutionIndex: 3
    SolutionNameMin: Cijk_Ailk_Bjlk_HSS_BH_MT32x16x16_SE_PGR1_PLR1_TT4_2
    SolutionIndex: 4
    SolutionNameMin: Cijk_Ailk_Bjlk_HSS_BH_MT32x16x16_SE_PGR1_PLR1_TT2_2
    SolutionIndex: 5
    SolutionNameMin: Cijk_Ailk_Bjlk_HSS_BH_MT64x16x16_SE_PGR1_PLR1_TT4_2
    SolutionIndex: 6
    SolutionNameMin: Cijk_Ailk_Bjlk_HSS_BH_MT32x16x16_SE_PGR1_PLR1_TT4_2
    SolutionIndex: 7
    SolutionNameMin: Cijk_Ailk_Bjlk_HSS_BH_MT32x32x16_SE_PGR1_PLR1_TT4_4
    SolutionIndex: 8
    SolutionNameMin: Cijk_Ailk_Bjlk_HSS_BH_MT32x16x16_SE_PGR1_PLR1_TT2_2
    SolutionIndex: 9
    SolutionNameMin: Cijk_Ailk_Bjlk_HSS_BH_MT64x16x16_SE_PGR1_PLR1_TT4_2
    SolutionIndex: 10
    SolutionNameMin: Cijk_Ailk_Bjlk_HSS_BH_MT16x16x24_SE_PGR1_PLR1_TT2_2
    SolutionIndex: 11
    SolutionNameMin: Cijk_Ailk_Bjlk_HSS_BH_MT16x16x32_SE_PGR1_PLR1_TT2_2
    SolutionIndex: 12
    SolutionNameMin: Cijk_Ailk_Bjlk_HSS_BH_MT32x16x32_SE_PGR1_PLR1_TT2_2
    SolutionIndex: 13
    SolutionNameMin: Cijk_Ailk_Bjlk_HSS_BH_MT64x16x32_SE_PGR1_PLR1_TT2_2
    SolutionIndex: 14
    SolutionNameMin: Cijk_Ailk_Bjlk_HSS_BH_MT128x16x32_SE_PGR1_PLR1_TT4_2
    SolutionIndex: 15
    SolutionNameMin: Cijk_Ailk_Bjlk_HSS_BH_MT32x8x32_SE_PGR1_PLR1_TT2_2
    SolutionIndex: 16
    SolutionNameMin: Cijk_Ailk_Bjlk_HSS_BH_MT16x16x32_SE_PGR1_PLR1_TT2_2
    SolutionIndex: 17
    SolutionNameMin: Cijk_Ailk_Bjlk_HSS_BH_MT32x32x32_SE_PGR1_PLR1_TT4_4
    SolutionIndex: 18
    SolutionNameMin: Cijk_Ailk_Bjlk_HSS_BH_MT32x16x32_SE_PGR1_PLR1_TT2_2
    SolutionIndex: 19
    SolutionNameMin: Cijk_Ailk_Bjlk_HSS_BH_MT64x16x32_SE_PGR1_PLR1_TT2_2
    SolutionIndex: 20
    SolutionNameMin: Cijk_Ailk_Bjlk_HSS_BH_MT16x16x64_SE_PGR1_PLR1_TT2_2
    SolutionIndex: 21
    SolutionNameMin: Cijk_Ailk_Bjlk_HSS_BH_MT32x16x64_SE_PGR1_PLR1_TT2_2
    SolutionIndex: 22
    SolutionNameMin: Cijk_Ailk_Bjlk_HSS_BH_MT64x16x64_SE_PGR1_PLR1_TT2_2
    SolutionIndex: 23
    SolutionNameMin: Cijk_Ailk_Bjlk_HSS_BH_MT16x16x64_SE_PGR1_PLR1_TT2_2
    SolutionIndex: 24
    SolutionNameMin: Cijk_Ailk_Bjlk_HSS_BH_MT32x16x64_SE_PGR1_PLR1_TT2_2
    SolutionIndex: 25
    SolutionNameMin: Cijk_Ailk_Bjlk_HSS_BH_MT64x16x64_SE_PGR1_PLR1_TT2_2
    SolutionIndex: 26
    SolutionNameMin: Cijk_Ailk_Bjlk_HSS_BH_MT64x128x8_SE_PGR1_PLR1_TT4_8
    SolutionIndex: 27
    SolutionNameMin: Cijk_Ailk_Bjlk_HSS_BH_MT64x64x16_SE_PGR1_PLR1_TT4_4
    SolutionIndex: 28
    SolutionNameMin: Cijk_Ailk_Bjlk_HSS_BH_MT64x128x16_SE_PGR1_PLR1_TT4_8
    SolutionIndex: 29
    SolutionNameMin: Cijk_Ailk_Bjlk_HSS_BH_MT128x64x16_SE_PGR1_PLR1_TT8_4
    SolutionIndex: 30
    SolutionNameMin: Cijk_Ailk_Bjlk_HSS_BH_MT64x64x32_SE_PGR1_PLR1_TT4_4
    SolutionIndex: 31
    SolutionNameMin: Cijk_Ailk_Bjlk_HSS_BH_MT32x32x32_SE_PGR1_PLR1_TT2_2
    SolutionIndex: 32
    SolutionNameMin: Cijk_Ailk_Bjlk_HSS_BH_MT32x32x64_SE_PGR1_PLR1_TT2_2
    SolutionIndex: 33
    SolutionNameMin: Cijk_Ailk_Bjlk_HSS_BH_MT64x128x4_SE_PGR0_PLR0_TT4_8
    SolutionIndex: 34
    SolutionNameMin: Cijk_Ailk_Bjlk_HSS_BH_MT64x64x4_SE_PGR0_PLR0_TT4_4
    SolutionIndex: 35
    SolutionNameMin: Cijk_Ailk_Bjlk_HSS_BH_MT64x64x4_SE_PGR1_PLR0_TT4_4
    SolutionIndex: 36
    SolutionNameMin: Cijk_Ailk_Bjlk_HSS_BH_MT64x64x4_SE_PGR0_PLR1_TT4_4
    SolutionIndex: 37
    SolutionNameMin: Cijk_Ailk_Bjlk_HSS_BH_MT64x128x8_SE_PGR0_PLR0_TT4_8
    SolutionIndex: 38
    SolutionNameMin: Cijk_Ailk_Bjlk_HSS_BH_MT64x64x8_SE_PGR0_PLR0_TT4_4
    SolutionIndex: 39
    SolutionNameMin: Cijk_Ailk_Bjlk_HSS_BH_MT64x128x8_SE_PGR0_PLR1_TT4_8
    SolutionIndex: 40
    SolutionNameMin: Cijk_Ailk_Bjlk_HSS_BH_MT64x64x8_SE_PGR0_PLR1_TT4_4
    SolutionIndex: 41
    SolutionNameMin: Cijk_Ailk_Bjlk_HSS_BH_MT64x128x16_SE_PGR0_PLR0_TT4_8
    SolutionIndex: 42
    SolutionNameMin: Cijk_Ailk_Bjlk_HSS_BH_MT64x64x16_SE_PGR0_PLR0_TT4_4
    SolutionIndex: 43
    SolutionNameMin: Cijk_Ailk_Bjlk_HSS_BH_MT64x64x16_SE_PGR1_PLR0_TT4_4
    SolutionIndex: 44
    SolutionNameMin: Cijk_Ailk_Bjlk_HSS_BH_MT64x128x16_SE_PGR0_PLR1_TT4_8
    SolutionIndex: 45
    SolutionNameMin: Cijk_Ailk_Bjlk_HSS_BH_MT64x64x16_SE_PGR0_PLR1_TT4_4
    SolutionIndex: 46
    SolutionNameMin: Cijk_Ailk_Bjlk_HSS_BH_MT64x64x16_SE_PGR1_PLR1_TT4_4
    SolutionIndex: 47
    SolutionNameMin: Cijk_Ailk_Bjlk_HSS_BH_MT128x128x4_SE_PGR0_PLR0_TT8_8
    SolutionIndex: 48
    SolutionNameMin: Cijk_Ailk_Bjlk_HSS_BH_MT64x128x4_SE_PGR0_PLR0_TT4_8
    SolutionIndex: 49
    SolutionNameMin: Cijk_Ailk_Bjlk_HSS_BH_MT64x64x4_SE_PGR0_PLR0_TT4_4
    SolutionIndex: 50
    SolutionNameMin: Cijk_Ailk_Bjlk_HSS_BH_MT64x128x4_SE_PGR1_PLR0_TT4_8
    SolutionIndex: 51
    SolutionNameMin: Cijk_Ailk_Bjlk_HSS_BH_MT64x64x4_SE_PGR1_PLR0_TT4_4
    SolutionIndex: 52
    SolutionNameMin: Cijk_Ailk_Bjlk_HSS_BH_MT64x128x4_SE_PGR0_PLR1_TT4_8
    SolutionIndex: 53
    SolutionNameMin: Cijk_Ailk_Bjlk_HSS_BH_MT64x64x4_SE_PGR0_PLR1_TT4_4
    SolutionIndex: 54
    SolutionNameMin: Cijk_Ailk_Bjlk_HSS_BH_MT64x64x4_SE_PGR1_PLR1_TT4_4
    SolutionIndex: 55
    SolutionNameMin: Cijk_Ailk_Bjlk_HSS_BH_MT64x128x8_SE_PGR0_PLR0_TT4_8
    SolutionIndex: 56
    SolutionNameMin: Cijk_Ailk_Bjlk_HSS_BH_MT64x64x8_SE_PGR0_PLR0_TT4_4
    SolutionIndex: 57
    SolutionNameMin: Cijk_Ailk_Bjlk_HSS_BH_MT64x64x8_SE_PGR1_PLR0_TT4_4
    SolutionIndex: 58
    SolutionNameMin: Cijk_Ailk_Bjlk_HSS_BH_MT64x128x8_SE_PGR0_PLR1_TT4_8
    SolutionIndex: 59
    SolutionNameMin: Cijk_Ailk_Bjlk_HSS_BH_MT64x64x8_SE_PGR0_PLR1_TT4_4
    SolutionIndex: 60
    SolutionNameMin: Cijk_Ailk_Bjlk_HSS_BH_MT64x64x8_SE_PGR1_PLR1_TT4_4
    SolutionIndex: 61
    SolutionNameMin: Cijk_Ailk_Bjlk_HSS_BH_MT64x64x16_SE_PGR0_PLR0_TT4_4
    SolutionIndex: 62
    SolutionNameMin: Cijk_Ailk_Bjlk_HSS_BH_MT64x64x16_SE_PGR1_PLR0_TT4_4
    SolutionIndex: 63
    SolutionNameMin: Cijk_Ailk_Bjlk_HSS_BH_MT64x128x16_SE_PGR1_PLR1_TT4_8
    SolutionIndex: 64
    SolutionNameMin: Cijk_Ailk_Bjlk_HSS_BH_MT64x64x16_SE_PGR1_PLR1_TT4_4
    SolutionIndex: 65
    SolutionNameMin: Cijk_Ailk_Bjlk_HSS_BH_MT256x256x16_MI32x32x8x1_SE_AF0EM4_GRVW8_NLCA1_NLCB1_SU16_SUS128_SRVW0_TT4_128_WG64_4_1_WGM2
    SolutionIndex: 66
    SolutionNameMin: Cijk_Ailk_Bjlk_HSS_BH_MT128x256x32_MI32x32x8x1_SE_AF0EM1_GRVW8_NLCA1_NLCB1_SU16_SUS128_SRVW4_TT2_128_WG64_4_1_WGM1
    SolutionIndex: 67
    SolutionNameMin: Cijk_Ailk_Bjlk_HSS_BH_MT64x128x64_MI32x32x8x1_SE_AF0EM1_GRVW8_NLCA1_NLCB1_SU16_SUS256_SRVW4_TT1_64_WG64_4_1_WGM15
    SolutionIndex: 68
    SolutionNameMin: Cijk_Ailk_Bjlk_HSS_BH_MT32x64x128_MI16x16x16x1_SE_AF0EM4_GRVW8_NLCA1_NLCB1_SU0_SUS256_SRVW4_TT1_32_WG32_8_1_WGM1
    SolutionIndex: 69
    SolutionNameMin: Cijk_Ailk_Bjlk_HSS_BH_MT256x256x16_MI32x32x8x1_SE_AF0EM1_GRVW8_NLCA1_NLCB1_SU16_SUS128_SRVW0_TT4_128_WG64_4_1_WGM1
    SolutionIndex: 70
    SolutionNameMin: Cijk_Ailk_Bjlk_HSS_BH_MT256x128x32_MI32x32x8x1_SE_AF0EM1_GRVW8_NLCA1_NLCB1_SU0_SUS256_SRVW0_TT4_64_WG64_4_1_WGM15
    SolutionIndex: 71
    SolutionNameMin: Cijk_Ailk_Bjlk_HSS_BH_MT128x64x64_MI32x32x8x1_SE_AF0EM4_GRVW8_NLCA1_NLCB1_SU0_SUS128_SRVW4_TT2_32_WG64_4_1_WGM15
    SolutionIndex: 72
    SolutionNameMin: Cijk_Ailk_Bjlk_HSS_BH_MT64x32x128_MI16x16x16x1_SE_AF0EM4_GRVW8_NLCA1_NLCB1_SU0_SUS256_SRVW4_TT2_16_WG32_8_1_WGM1
    SolutionIndex: 73
    SolutionNameMin: Cijk_Ailk_Bjlk_HSS_BH_MT128x256x32_MI32x32x8x1_SE_AF0EM4_GRVW4_NLCA1_NLCB1_SU16_SUS128_SRVW4_TT2_128_WG64_4_1_WGM2
    SolutionIndex: 74
    SolutionNameMin: Cijk_Ailk_Bjlk_HSS_BH_MT128x288x32_MI32x32x8x1_SE_AF0EM4_GRVW4_NLCA1_NLCB9_SU32_SUS128_SRVW4_TT1_288_WG128_2_1_WGM15
    SolutionIndex: 75
    SolutionNameMin: Cijk_Ailk_Bjlk_HSS_BH_MT256x144x32_MI16x16x16x1_SE_AF0EM4_GRVW2_NLCA2_NLCB9_SU0_SUS256_SRVW4_TT4_144_WG64_4_1_WGM15
    SolutionIndex: 76
    SolutionNameMin: Cijk_Ailk_Bjlk_HSS_BH_MT128x96x64_MI32x32x8x1_SE_AF0EM4_GRVW8_NLCA1_NLCB3_SU0_SUS128_SRVW4_TT1_96_WG128_2_1_WGM1
    SolutionIndex: 77
    SolutionNameMin: Cijk_Ailk_Bjlk_HSS_BH_MT32x32x64_MI16x16x16x1_SE_AF0EM1_GRVW4_NLCA1_NLCB1_SU0_SUS256_SRVW0_TT1_16_WG32_8_1_WGM15
    SolutionIndex: 78
    SolutionNameMin: Cijk_Ailk_Bjlk_HSS_BH_MT64x64x64_MI32x32x8x1_SE_AF0EM4_GRVW8_NLCA1_NLCB1_SU0_SUS128_SRVW4_TT1_32_WG64_4_1_WGM1
    SolutionIndex: 79
    SolutionNameMin: Cijk_Ailk_Bjlk_HSS_BH_MT32x32x64_MI16x16x16x1_SE_AF0EM4_GRVW2_NLCA1_NLCB1_SU0_SUS128_SRVW4_TT1_16_WG32_8_1_WGM1
    SolutionIndex: 80
    SolutionNameMin: Cijk_Ailk_Bjlk_HSS_BH_MT64x64x16_MI32x32x8x1_SE_AF0EM4_GRVW2_NLCA1_NLCB1_SU0_SUS256_SRVW4_TT1_32_WG64_4_1_WGM2
    SolutionIndex: 81
    SolutionNameMin: Cijk_Ailk_Bjlk_HSS_BH_MT128x80x64_MI16x16x16x1_SE_AF0EM4_GRVW4_NLCA1_NLCB5_SU0_SUS256_SRVW0_TT2_80_WG64_4_1_WGM15
    SolutionIndex: 82
    SolutionNameMin: Cijk_Ailk_Bjlk_HSS_BH_MT128x96x16_MI32x32x8x1_SE_AF0EM4_GRVW2_NLCA1_NLCB3_SU32_SUS128_SRVW4_TT1_96_WG128_2_1_WGM2
    SolutionIndex: 83
    SolutionNameMin: Cijk_Ailk_Bjlk_HSS_BH_MT128x160x32_MI32x32x8x1_SE_AF0EM4_GRVW2_NLCA1_NLCB5_SU32_SUS128_SRVW4_TT1_160_WG128_2_1_WGM15
    SolutionIndex: 84
    SolutionNameMin: Cijk_Ailk_Bjlk_HSS_BH_MT64x64x32_MI32x32x8x1_SE_AF0EM4_GRVW4_NLCA1_NLCB1_SU0_SUS128_SRVW4_TT1_32_WG64_4_1_WGM1
    SolutionIndex: 85
    SolutionNameMin: Cijk_Ailk_Bjlk_HSS_BH_MT32x32x16_MI16x16x16x1_SE_AF0EM4_GRVW2_NLCA1_NLCB1_SU0_SUS128_SRVW0_TT1_16_WG32_8_1_WGM1
    SolutionIndex: 86
    SolutionNameMin: Cijk_Ailk_Bjlk_HSS_BH_MT32x32x128_MI16x16x16x1_SE_AF0EM4_GRVW2_NLCA1_NLCB1_SU0_SUS256_SRVW0_TT1_16_WG32_8_1_WGM1
    SolutionIndex: 87
    SolutionNameMin: Cijk_Ailk_Bjlk_HSS_BH_MT64x64x16_MI32x32x8x1_SE_AF0EM4_GRVW2_NLCA1_NLCB1_SU0_SUS128_SRVW4_TT1_32_WG64_4_1_WGM15
    SolutionIndex: 88
    SolutionNameMin: Cijk_Ailk_Bjlk_HSS_BH_MT64x64x32_MI32x32x8x1_SE_AF0EM4_GRVW4_NLCA1_NLCB1_SU0_SUS256_SRVW4_TT1_32_WG64_4_1_WGM15
    SolutionIndex: 89
    SolutionNameMin: Cijk_Ailk_Bjlk_HSS_BH_MT128x96x64_MI32x32x8x1_SE_AF0EM4_GRVW8_NLCA1_NLCB3_SU0_SUS128_SRVW4_TT1_96_WG128_2_1_WGM2
    SolutionIndex: 90
    SolutionNameMin: Cijk_Ailk_Bjlk_HSS_BH_MT128x288x32_MI32x32x8x1_SE_AF0EM4_GRVW2_NLCA1_NLCB9_SU0_SUS256_SRVW4_TT1_288_WG128_2_1_WGM15
    SolutionIndex: 91
    SolutionNameMin: Cijk_Ailk_Bjlk_HSS_BH_MT128x160x16_MI32x32x8x1_SE_AF0EM4_GRVW2_NLCA1_NLCB5_SU32_SUS128_SRVW4_TT1_160_WG128_2_1_WGM1
    SolutionIndex: 92
    SolutionNameMin: Cijk_Ailk_Bjlk_HSS_BH_MT64x128x16_MI32x32x8x1_SE_AF0EM1_GRVW2_NLCA1_NLCB1_SU0_SUS128_SRVW4_TT1_64_WG64_4_1_WGM2
    SolutionIndex: 93
    SolutionNameMin: Cijk_Ailk_Bjlk_HSS_BH_MT32x32x16_MI16x16x16x1_SE_AF0EM4_GRVW4_NLCA1_NLCB1_SU0_SUS256_SRVW0_TT1_16_WG32_8_1_WGM1
    SolutionIndex: 94
    SolutionNameMin: Cijk_Ailk_Bjlk_HSS_BH_MT64x64x16_MI32x32x8x1_SE_AF0EM4_GRVW8_NLCA1_NLCB1_SU0_SUS128_SRVW4_TT1_32_WG64_4_1_WGM15
    SolutionIndex: 95
    SolutionNameMin: Cijk_Ailk_Bjlk_HSS_BH_MT64x128x32_MI32x32x8x1_SE_AF0EM4_GRVW8_NLCA1_NLCB1_SU32_SUS128_SRVW4_TT1_64_WG64_4_1_WGM2
    SolutionIndex: 96
    SolutionNameMin: Cijk_Ailk_Bjlk_HSS_BH_MT128x96x64_MI32x32x8x1_SE_AF0EM4_GRVW4_NLCA1_NLCB3_SU0_SUS128_SRVW4_TT1_96_WG128_2_1_WGM15
    SolutionIndex: 97
    SolutionNameMin: Cijk_Ailk_Bjlk_HSS_BH_MT256x256x16_MI32x32x8x1_SE_AF0EM4_GRVW8_NLCA1_NLCB1_SU0_SUS128_SRVW0_TT4_128_WG64_4_1_WGM1
    SolutionIndex: 98
    SolutionNameMin: Cijk_Ailk_Bjlk_HSS_BH_MT64x128x16_MI32x32x8x1_SE_AF0EM4_GRVW8_NLCA1_NLCB1_SU0_SUS128_SRVW4_TT1_64_WG64_4_1_WGM1
    SolutionIndex: 99
    SolutionNameMin: Cijk_Ailk_Bjlk_HSS_BH_MT32x32x128_MI16x16x16x1_SE_AF0EM4_GRVW2_NLCA1_NLCB1_SU16_SUS256_SRVW0_TT1_16_WG32_8_1_WGM1
    SolutionIndex: 100
    SolutionNameMin: Cijk_Ailk_Bjlk_HSS_BH_MT64x32x16_MI16x16x16x1_SE_AF0EM4_GRVW2_NLCA1_NLCB1_SU0_SUS128_SRVW4_TT2_16_WG32_8_1_WGM1
    SolutionIndex: 101
    SolutionNameMin: Cijk_Ailk_Bjlk_HSS_BH_MT64x64x32_MI32x32x8x1_SE_AF0EM1_GRVW4_NLCA1_NLCB1_SU16_SUS128_SRVW4_TT1_32_WG64_4_1_WGM15
    SolutionIndex: 102
    SolutionNameMin: Cijk_Ailk_Bjlk_HSS_BH_MT128x96x64_MI32x32x8x1_SE_AF0EM4_GRVW4_NLCA1_NLCB3_SU0_SUS256_SRVW4_TT1_96_WG128_2_1_WGM2
    SolutionIndex: 103
    SolutionNameMin: Cijk_Ailk_Bjlk_HSS_BH_MT128x160x16_MI32x32x8x1_SE_AF0EM4_GRVW2_NLCA1_NLCB5_SU16_SUS128_SRVW4_TT1_160_WG128_2_1_WGM1
    SolutionIndex: 104
    SolutionNameMin: Cijk_Ailk_Bjlk_HSS_BH_MT64x128x16_MI32x32x8x1_SE_AF0EM4_GRVW2_NLCA1_NLCB1_SU0_SUS256_SRVW4_TT1_64_WG64_4_1_WGM1
    SolutionIndex: 105
    SolutionNameMin: Cijk_Ailk_Bjlk_HSS_BH_MT32x32x16_MI16x16x16x1_SE_AF0EM4_GRVW8_NLCA1_NLCB1_SU0_SUS256_SRVW0_TT1_16_WG32_8_1_WGM1
    SolutionIndex: 106
    SolutionNameMin: Cijk_Ailk_Bjlk_HSS_BH_MT64x64x16_MI32x32x8x1_SE_AF0EM4_GRVW8_NLCA1_NLCB1_SU16_SUS256_SRVW4_TT1_32_WG64_4_1_WGM15
    SolutionIndex: 107
    SolutionNameMin: Cijk_Ailk_Bjlk_HSS_BH_MT128x96x32_MI32x32x8x1_SE_AF0EM4_GRVW4_NLCA1_NLCB3_SU0_SUS256_SRVW4_TT1_96_WG128_2_1_WGM2
    SolutionIndex: 108
    SolutionNameMin: Cijk_Ailk_Bjlk_HSS_BH_MT128x96x64_MI32x32x8x1_SE_AF0EM4_GRVW4_NLCA1_NLCB3_SU0_SUS256_SRVW4_TT1_96_WG128_2_1_WGM15
    SolutionIndex: 109
    SolutionNameMin: Cijk_Ailk_Bjlk_HSS_BH_MT128x256x32_MI32x32x8x1_SE_AF0EM4_GRVW4_NLCA1_NLCB1_SU32_SUS128_SRVW4_TT2_128_WG64_4_1_WGM2
    SolutionIndex: 110
    SolutionNameMin: Cijk_Ailk_Bjlk_HSS_BH_MT32x32x16_MI16x16x16x1_SE_AF0EM4_GRVW8_NLCA1_NLCB1_SU0_SUS128_SRVW0_TT1_16_WG32_8_1_WGM1
    SolutionIndex: 111
    SolutionNameMin: Cijk_Ailk_Bjlk_HSS_BH_MT64x64x16_MI32x32x8x1_SE_AF0EM4_GRVW2_NLCA1_NLCB1_SU32_SUS256_SRVW4_TT1_32_WG64_4_1_WGM2
    SolutionIndex: 112
    SolutionNameMin: Cijk_Ailk_Bjlk_HSS_BH_MT128x96x32_MI32x32x8x1_SE_AF0EM4_GRVW4_NLCA1_NLCB3_SU32_SUS128_SRVW4_TT1_96_WG128_2_1_WGM2
    SolutionIndex: 113
    SolutionNameMin: Cijk_Ailk_Bjlk_HSS_BH_MT256x256x16_MI32x32x4x2_SE_AF0EM4_GRVW8_NLCA1_NLCB1_SU32_SUS256_SRVW0_TT2_128_WG128_2_1_WGM1
    SolutionIndex: 114
    SolutionNameMin: Cijk_Ailk_Bjlk_HSS_BH_MT64x128x16_MI32x32x8x1_SE_AF0EM4_GRVW8_NLCA1_NLCB1_SU0_SUS256_SRVW4_TT1_64_WG64_4_1_WGM2
    SolutionIndex: 115
    SolutionNameMin: Cijk_Ailk_Bjlk_HSS_BH_MT32x32x128_MI16x16x16x1_SE_AF0EM4_GRVW2_NLCA1_NLCB1_SU32_SUS256_SRVW0_TT1_16_WG32_8_1_WGM1
    SolutionIndex: 116
    SolutionNameMin: Cijk_Ailk_Bjlk_HSS_BH_MT64x32x16_MI16x16x16x1_SE_AF0EM4_GRVW2_NLCA1_NLCB1_SU16_SUS256_SRVW0_TT2_16_WG32_8_1_WGM1
    SolutionIndex: 117
    SolutionNameMin: Cijk_Ailk_Bjlk_HSS_BH_MT64x64x32_MI32x32x8x1_SE_AF0EM4_GRVW8_NLCA1_NLCB1_SU16_SUS256_SRVW4_TT1_32_WG64_4_1_WGM15
    SolutionIndex: 118
    SolutionNameMin: Cijk_Ailk_Bjlk_HSS_BH_MT128x96x64_MI32x32x8x1_SE_AF0EM4_GRVW8_NLCA1_NLCB3_SU0_SUS256_SRVW4_TT1_96_WG128_2_1_WGM2
    SolutionIndex: 119
    SolutionNameMin: Cijk_Ailk_Bjlk_HSS_BH_MT128x288x32_MI32x32x8x1_SE_AF0EM4_GRVW2_NLCA1_NLCB9_SU0_SUS128_SRVW4_TT1_288_WG128_2_1_WGM15
    SolutionIndex: 120
    SolutionNameMin: Cijk_Ailk_Bjlk_HSS_BH_MT64x128x32_MI32x32x8x1_SE_AF0EM1_GRVW8_NLCA1_NLCB1_SU0_SUS256_SRVW4_TT1_64_WG64_4_1_WGM1
    SolutionIndex: 121
    SolutionNameMin: Cijk_Ailk_Bjlk_HSS_BH_MT32x32x16_MI16x16x16x1_SE_AF0EM4_GRVW2_NLCA1_NLCB1_SU0_SUS256_SRVW0_TT1_16_WG32_8_1_WGM1
    SolutionIndex: 122
    SolutionNameMin: Cijk_Ailk_Bjlk_HSS_BH_MT64x32x16_MI16x16x16x1_SE_AF0EM4_GRVW2_NLCA1_NLCB1_SU16_SUS128_SRVW0_TT2_16_WG32_8_1_WGM1
    SolutionIndex: 123
    SolutionNameMin: Cijk_Ailk_Bjlk_HSS_BH_MT128x96x64_MI32x32x8x1_SE_AF0EM4_GRVW8_NLCA1_NLCB3_SU32_SUS256_SRVW4_TT1_96_WG128_2_1_WGM15
    SolutionIndex: 124
    SolutionNameMin: Cijk_Ailk_Bjlk_HSS_BH_MT128x160x16_MI32x32x8x1_SE_AF0EM4_GRVW2_NLCA1_NLCB5_SU0_SUS256_SRVW4_TT1_160_WG128_2_1_WGM1
    SolutionIndex: 125
    SolutionNameMin: Cijk_Ailk_Bjlk_HSS_BH_MT64x64x32_MI32x32x8x1_SE_AF0EM4_GRVW4_NLCA1_NLCB1_SU0_SUS256_SRVW4_TT1_32_WG64_4_1_WGM1
    SolutionIndex: 126
    SolutionNameMin: Cijk_Ailk_Bjlk_HSS_BH_MT64x32x16_MI16x16x16x1_SE_AF0EM4_GRVW2_NLCA1_NLCB1_SU0_SUS128_SRVW0_TT2_16_WG32_8_1_WGM1
    SolutionIndex: 127
    SolutionNameMin: Cijk_Ailk_Bjlk_HSS_BH_MT64x64x32_MI32x32x8x1_SE_AF0EM4_GRVW8_NLCA1_NLCB1_SU16_SUS128_SRVW4_TT1_32_WG64_4_1_WGM15
    SolutionIndex: 128
    SolutionNameMin: Cijk_Ailk_Bjlk_HSS_BH_MT128x160x16_MI32x32x8x1_SE_AF0EM4_GRVW2_NLCA1_NLCB5_SU16_SUS256_SRVW4_TT1_160_WG128_2_1_WGM2
    SolutionIndex: 129
    SolutionNameMin: Cijk_Ailk_Bjlk_HSS_BH_MT64x32x16_MI16x16x16x1_SE_AF0EM4_GRVW2_NLCA1_NLCB1_SU0_SUS256_SRVW0_TT2_16_WG32_8_1_WGM1
    SolutionIndex: 130
    SolutionNameMin: Cijk_Ailk_Bjlk_HSS_BH_MT64x64x32_MI32x32x8x1_SE_AF0EM1_GRVW4_NLCA1_NLCB1_SU0_SUS128_SRVW4_TT1_32_WG64_4_1_WGM15
    SolutionIndex: 131
    SolutionNameMin: Cijk_Ailk_Bjlk_HSS_BH_MT128x160x16_MI32x32x8x1_SE_AF0EM4_GRVW2_NLCA1_NLCB5_SU32_SUS128_SRVW4_TT1_160_WG128_2_1_WGM2
    SolutionIndex: 132
    SolutionNameMin: Cijk_Ailk_Bjlk_HSS_BH_MT32x32x128_MI16x16x16x1_SE_AF0EM1_GRVW8_NLCA1_NLCB1_SU0_SUS256_SRVW0_TT1_16_WG32_8_1_WGM2
    SolutionIndex: 133
    SolutionNameMin: Cijk_Ailk_Bjlk_HSS_BH_MT64x32x16_MI16x16x16x1_SE_AF0EM4_GRVW4_NLCA1_NLCB1_SU0_SUS128_SRVW4_TT2_16_WG32_8_1_WGM1
    SolutionIndex: 134
    SolutionNameMin: Cijk_Ailk_Bjlk_HSS_BH_MT32x64x128_MI16x16x16x1_SE_AF0EM1_GRVW8_NLCA1_NLCB1_SU16_SUS256_SRVW0_TT1_32_WG32_8_1_WGM15
    SolutionIndex: 135
    SolutionNameMin: Cijk_Ailk_Bjlk_HSS_BH_MT128x96x64_MI32x32x8x1_SE_AF0EM4_GRVW4_NLCA1_NLCB3_SU0_SUS128_SRVW0_TT1_96_WG128_2_1_WGM15
    SolutionIndex: 136
    SolutionNameMin: Cijk_Ailk_Bjlk_HSS_BH_MT64x128x16_MI32x32x8x1_SE_AF0EM4_GRVW8_NLCA1_NLCB1_SU32_SUS256_SRVW4_TT1_64_WG64_4_1_WGM15
    SolutionIndex: 137
    SolutionNameMin: Cijk_Ailk_Bjlk_HSS_BH_MT128x96x16_MI32x32x8x1_SE_AF0EM4_GRVW2_NLCA1_NLCB3_SU16_SUS256_SRVW4_TT1_96_WG128_2_1_WGM15
    SolutionIndex: 138
    SolutionNameMin: Cijk_Ailk_Bjlk_HSS_BH_MT64x64x32_MI32x32x8x1_SE_AF0EM4_GRVW2_NLCA1_NLCB1_SU0_SUS256_SRVW4_TT1_32_WG64_4_1_WGM2
    SolutionIndex: 139
    SolutionNameMin: Cijk_Ailk_Bjlk_HSS_BH_MT256x256x16_MI32x32x8x1_SE_AF0EM4_GRVW8_NLCA1_NLCB1_SU16_SUS256_SRVW0_TT4_128_WG64_4_1_WGM1
    SolutionIndex: 140
    SolutionNameMin: Cijk_Ailk_Bjlk_HSS_BH_MT32x64x16_MI16x16x16x1_SE_AF0EM4_GRVW2_NLCA1_NLCB1_SU0_SUS256_SRVW0_TT1_32_WG32_8_1_WGM1
    SolutionIndex: 141
    SolutionNameMin: Cijk_Ailk_Bjlk_HSS_BH_MT128x288x32_MI32x32x8x1_SE_AF0EM1_GRVW2_NLCA1_NLCB9_SU0_SUS128_SRVW0_TT1_288_WG128_2_1_WGM15
    SolutionIndex: 142
    SolutionNameMin: Cijk_Ailk_Bjlk_HSS_BH_MT128x256x16_MI32x32x4x2_SE_AF0EM4_GRVW8_NLCA1_NLCB1_SU32_SUS128_SRVW0_TT2_64_WG64_4_1_WGM2
    SolutionIndex: 143
    SolutionNameMin: Cijk_Ailk_Bjlk_HSS_BH_MT128x96x64_MI32x32x8x1_SE_AF0EM4_GRVW4_NLCA1_NLCB3_SU0_SUS256_SRVW0_TT1_96_WG128_2_1_WGM15
    SolutionIndex: 144
    SolutionNameMin: Cijk_Ailk_Bjlk_HSS_BH_MT256x144x32_MI16x16x16x1_SE_AF0EM1_GRVW2_NLCA2_NLCB9_SU0_SUS256_SRVW0_TT4_144_WG64_4_1_WGM15
    SolutionIndex: 145
    SolutionNameMin: Cijk_Ailk_Bjlk_HSS_BH_MT256x256x16_MI32x32x8x1_SE_AF0EM4_GRVW4_NLCA1_NLCB1_SU16_SUS256_SRVW0_TT4_128_WG64_4_1_WGM1
    SolutionIndex: 146
    SolutionNameMin: Cijk_Ailk_Bjlk_HSS_BH_MT256x256x16_MI32x32x8x1_SE_AF0EM4_GRVW4_NLCA1_NLCB1_SU32_SUS256_SRVW0_TT4_128_WG64_4_1_WGM1
    SolutionIndex: 147
    SolutionNameMin: Cijk_Ailk_Bjlk_HSS_BH_MT128x128x64_MI32x32x8x1_SE_AF0EM1_GRVW8_NLCA1_NLCB1_SU32_SUS128_SRVW4_TT2_64_WG64_4_1_WGM15
    SolutionIndex: 148
    SolutionNameMin: Cijk_Ailk_Bjlk_HSS_BH_MT128x128x64_MI32x32x8x1_SE_AF0EM1_GRVW8_NLCA1_NLCB1_SU16_SUS128_SRVW4_TT2_64_WG64_4_1_WGM1
    SolutionIndex: 149
    SolutionNameMin: Cijk_Ailk_Bjlk_HSS_BH_MT128x128x64_MI32x32x8x1_SE_AF0EM4_GRVW8_NLCA1_NLCB1_SU16_SUS256_SRVW4_TT2_64_WG64_4_1_WGM2
    SolutionIndex: 150
    SolutionNameMin: Cijk_Ailk_Bjlk_HSS_BH_MT32x64x16_MI16x16x16x1_SE_AF0EM1_GRVW4_NLCA1_NLCB1_SU32_SUS128_SRVW4_TT1_32_WG32_8_1_WGM15
    SolutionIndex: 151
    SolutionNameMin: Cijk_Ailk_Bjlk_HSS_BH_MT32x64x16_MI16x16x16x1_SE_AF0EM1_GRVW2_NLCA1_NLCB1_SU32_SUS128_SRVW4_TT1_32_WG32_8_1_WGM2
    SolutionIndex: 152
    SolutionNameMin: Cijk_Ailk_Bjlk_HSS_BH_MT32x64x16_MI16x16x16x1_SE_AF0EM1_GRVW2_NLCA1_NLCB1_SU16_SUS256_SRVW4_TT1_32_WG32_8_1_WGM2
    SolutionIndex: 153
    SolutionNameMin: Cijk_Ailk_Bjlk_HSS_BH_MT32x64x16_MI16x16x16x1_SE_AF0EM1_GRVW2_NLCA1_NLCB1_SU16_SUS128_SRVW4_TT1_32_WG32_8_1_WGM15
    SolutionIndex: 154
    SolutionNameMin: Cijk_Ailk_Bjlk_HSS_BH_MT32x64x16_MI16x16x16x1_SE_AF0EM1_GRVW2_NLCA1_NLCB1_SU32_SUS128_SRVW4_TT1_32_WG32_8_1_WGM15
    SolutionIndex: 155
    SolutionNameMin: Cijk_Ailk_Bjlk_HSS_BH_MT32x64x16_MI16x16x16x1_SE_AF0EM1_GRVW4_NLCA1_NLCB1_SU16_SUS256_SRVW4_TT1_32_WG32_8_1_WGM15
    SolutionIndex: 156
    SolutionNameMin: Cijk_Ailk_Bjlk_HSS_BH_MT32x64x16_MI16x16x16x1_SE_AF0EM1_GRVW8_NLCA1_NLCB1_SU16_SUS256_SRVW4_TT1_32_WG32_8_1_WGM2
    SolutionIndex: 157
    SolutionNameMin: Cijk_Ailk_Bjlk_HSS_BH_MT32x64x16_MI16x16x16x1_SE_AF0EM4_GRVW2_NLCA1_NLCB1_SU32_SUS128_SRVW0_TT1_32_WG32_8_1_WGM1
    SolutionIndex: 158
    SolutionNameMin: Cijk_Ailk_Bjlk_HSS_BH_MT32x64x16_MI16x16x16x1_SE_AF0EM1_GRVW4_NLCA1_NLCB1_SU0_SUS128_SRVW4_TT1_32_WG32_8_1_WGM1
    SolutionIndex: 159
    SolutionNameMin: Cijk_Ailk_Bjlk_HSS_BH_MT32x32x16_MI16x16x16x1_SE_AF0EM1_GRVW2_NLCA1_NLCB1_SU16_SUS128_SRVW4_TT1_16_WG32_8_1_WGM1
    SolutionIndex: 160
    SolutionNameMin: Cijk_Ailk_Bjlk_HSS_BH_MT32x64x16_MI16x16x16x1_SE_AF0EM1_GRVW4_NLCA1_NLCB1_SU0_SUS128_SRVW4_TT1_32_WG32_8_1_WGM2
    SolutionIndex: 161
    SolutionNameMin: Cijk_Ailk_Bjlk_HSS_BH_MT32x64x16_MI16x16x16x1_SE_AF0EM4_GRVW2_NLCA1_NLCB1_SU16_SUS128_SRVW0_TT1_32_WG32_8_1_WGM15
    SolutionIndex: 162
    SolutionNameMin: Cijk_Ailk_Bjlk_HSS_BH_MT32x64x16_MI16x16x16x1_SE_AF0EM4_GRVW2_NLCA1_NLCB1_SU0_SUS256_SRVW4_TT1_32_WG32_8_1_WGM1
    SolutionIndex: 163
    SolutionNameMin: Cijk_Ailk_Bjlk_HSS_BH_MT32x64x16_MI16x16x16x1_SE_AF0EM1_GRVW4_NLCA1_NLCB1_SU16_SUS256_SRVW4_TT1_32_WG32_8_1_WGM1
    SolutionIndex: 164
    SolutionNameMin: Cijk_Ailk_Bjlk_HSS_BH_MT32x64x16_MI16x16x16x1_SE_AF0EM1_GRVW8_NLCA1_NLCB1_SU16_SUS128_SRVW4_TT1_32_WG32_8_1_WGM2
    SolutionIndex: 165
    SolutionNameMin: Cijk_Ailk_Bjlk_HSS_BH_MT64x32x16_MI16x16x16x1_SE_AF0EM4_GRVW2_NLCA1_NLCB1_SU0_SUS256_SRVW0_TT2_16_WG32_8_1_WGM2
    SolutionIndex: 166
    SolutionNameMin: Cijk_Ailk_Bjlk_HSS_BH_MT64x32x16_MI16x16x16x1_SE_AF0EM4_GRVW2_NLCA1_NLCB1_SU0_SUS128_SRVW0_TT2_16_WG32_8_1_WGM2
    SolutionIndex: 167
    SolutionNameMin: Cijk_Ailk_Bjlk_HSS_BH_MT64x32x16_MI16x16x16x1_SE_AF0EM4_GRVW2_NLCA1_NLCB1_SU32_SUS128_SRVW0_TT2_16_WG32_8_1_WGM2
    SolutionIndex: 168
    SolutionNameMin: Cijk_Ailk_Bjlk_HSS_BH_MT64x32x16_MI16x16x16x1_SE_AF0EM4_GRVW2_NLCA1_NLCB1_SU16_SUS256_SRVW0_TT2_16_WG32_8_1_WGM2
    SolutionIndex: 169
    SolutionNameMin: Cijk_Ailk_Bjlk_HSS_BH_MT64x32x16_MI16x16x16x1_SE_AF0EM4_GRVW2_NLCA1_NLCB1_SU32_SUS128_SRVW0_TT2_16_WG32_8_1_WGM1
    SolutionIndex: 170
    SolutionNameMin: Cijk_Ailk_Bjlk_HSS_BH_MT64x32x16_MI16x16x16x1_SE_AF0EM4_GRVW2_NLCA1_NLCB1_SU0_SUS128_SRVW0_TT2_16_WG32_8_1_WGM15
    SolutionIndex: 171
    SolutionNameMin: Cijk_Ailk_Bjlk_HSS_BH_MT64x32x16_MI16x16x16x1_SE_AF0EM4_GRVW2_NLCA1_NLCB1_SU0_SUS256_SRVW0_TT2_16_WG32_8_1_WGM15
    SolutionIndex: 172
    SolutionNameMin: Cijk_Ailk_Bjlk_HSS_BH_MT64x32x16_MI16x16x16x1_SE_AF0EM4_GRVW4_NLCA1_NLCB1_SU16_SUS128_SRVW4_TT2_16_WG32_8_1_WGM1
    SolutionIndex: 173
    SolutionNameMin: Cijk_Ailk_Bjlk_HSS_BH_MT64x32x16_MI16x16x16x1_SE_AF0EM4_GRVW2_NLCA1_NLCB1_SU16_SUS128_SRVW0_TT2_16_WG32_8_1_WGM15
    SolutionIndex: 174
    SolutionNameMin: Cijk_Ailk_Bjlk_HSS_BH_MT32x64x16_MI16x16x16x1_SE_AF0EM4_GRVW2_NLCA1_NLCB1_SU0_SUS128_SRVW0_TT1_32_WG32_8_1_WGM1
    SolutionIndex: 175
    SolutionNameMin: Cijk_Ailk_Bjlk_HSS_BH_MT32x64x16_MI16x16x16x1_SE_AF0EM4_GRVW2_NLCA1_NLCB1_SU0_SUS256_SRVW0_TT1_32_WG32_8_1_WGM2
    SolutionIndex: 176
    SolutionNameMin: Cijk_Ailk_Bjlk_HSS_BH_MT32x32x64_MI16x16x16x1_SE_AF0EM4_GRVW8_NLCA1_NLCB1_SU32_SUS128_SRVW0_TT1_16_WG32_8_1_WGM1
    SolutionIndex: 177
    SolutionNameMin: Cijk_Ailk_Bjlk_HSS_BH_MT32x32x64_MI16x16x16x1_SE_AF0EM4_GRVW4_NLCA1_NLCB1_SU32_SUS128_SRVW0_TT1_16_WG32_8_1_WGM1
    SolutionIndex: 178
    SolutionNameMin: Cijk_Ailk_Bjlk_HSS_BH_MT32x32x64_MI16x16x16x1_SE_AF0EM4_GRVW8_NLCA1_NLCB1_SU0_SUS128_SRVW0_TT1_16_WG32_8_1_WGM15
    SolutionIndex: 179
    SolutionNameMin: Cijk_Ailk_Bjlk_HSS_BH_MT32x32x32_MI16x16x16x1_SE_AF0EM4_GRVW8_NLCA1_NLCB1_SU0_SUS128_SRVW0_TT1_16_WG32_8_1_WGM1
    SolutionIndex: 180
    SolutionNameMin: Cijk_Ailk_Bjlk_HSS_BH_MT32x64x128_MI16x16x16x1_SE_AF0EM1_GRVW8_NLCA1_NLCB1_SU32_SUS256_SRVW0_TT1_32_WG32_8_1_WGM15
    SolutionIndex: 181
    SolutionNameMin: Cijk_Ailk_Bjlk_HSS_BH_MT256x144x32_MI16x16x16x1_SE_AF0EM4_GRVW2_NLCA2_NLCB9_SU16_SUS256_SRVW4_TT4_144_WG64_4_1_WGM15
    SolutionIndex: 182
    SolutionNameMin: Cijk_Ailk_Bjlk_HSS_BH_MT64x32x16_MI16x16x16x1_SE_AF0EM1_GRVW2_NLCA1_NLCB1_SU0_SUS256_SRVW4_TT2_16_WG32_8_1_WGM2
    SolutionIndex: 183
    SolutionNameMin: Cijk_Ailk_Bjlk_HSS_BH_MT128x128x64_MI32x32x8x1_SE_AF0EM4_GRVW8_NLCA1_NLCB1_SU32_SUS128_SRVW4_TT2_64_WG64_4_1_WGM1
    SolutionIndex: 184
    SolutionNameMin: Cijk_Ailk_Bjlk_HSS_BH_MT32x32x16_MI16x16x16x1_SE_AF0EM1_GRVW8_NLCA1_NLCB1_SU0_SUS128_SRVW0_TT1_16_WG32_8_1_WGM1
    SolutionIndex: 185
    SolutionNameMin: Cijk_Ailk_Bjlk_HSS_BH_MT64x128x64_MI32x32x8x1_SE_AF0EM4_GRVW8_NLCA1_NLCB1_SU32_SUS128_SRVW4_TT1_64_WG64_4_1_WGM15
    SolutionIndex: 186
    SolutionNameMin: Cijk_Ailk_Bjlk_HSS_BH_MT64x128x16_MI32x32x8x1_SE_AF0EM4_GRVW4_NLCA1_NLCB1_SU32_SUS256_SRVW4_TT1_64_WG64_4_1_WGM15
    SolutionIndex: 187
    SolutionNameMin: Cijk_Ailk_Bjlk_HSS_BH_MT64x64x64_MI32x32x8x1_SE_AF0EM4_GRVW8_NLCA1_NLCB1_SU16_SUS256_SRVW4_TT1_32_WG64_4_1_WGM2
    SolutionIndex: 188
    SolutionNameMin: Cijk_Ailk_Bjlk_HSS_BH_MT32x64x16_MI16x16x16x1_SE_AF0EM1_GRVW8_NLCA1_NLCB1_SU0_SUS128_SRVW0_TT1_32_WG32_8_1_WGM1
    SolutionIndex: 189
    SolutionNameMin: Cijk_Ailk_Bjlk_HSS_BH_MT32x64x16_MI16x16x16x1_SE_AF0EM1_GRVW2_NLCA1_NLCB1_SU0_SUS128_SRVW0_TT1_32_WG32_8_1_WGM1
    SolutionIndex: 190
    SolutionNameMin: Cijk_Ailk_Bjlk_HSS_BH_MT32x64x16_MI16x16x16x1_SE_AF0EM1_GRVW2_NLCA1_NLCB1_SU32_SUS128_SRVW0_TT1_32_WG32_8_1_WGM15
    SolutionIndex: 191
    SolutionNameMin: Cijk_Ailk_Bjlk_HSS_BH_MT32x32x16_MI16x16x16x1_SE_AF0EM1_GRVW8_NLCA1_NLCB1_SU0_SUS256_SRVW0_TT1_16_WG32_8_1_WGM1
    SolutionIndex: 192
    SolutionNameMin: Cijk_Ailk_Bjlk_HSS_BH_MT32x32x16_MI16x16x16x1_SE_AF0EM1_GRVW2_NLCA1_NLCB1_SU0_SUS256_SRVW0_TT1_16_WG32_8_1_WGM1
    SolutionIndex: 193
    SolutionNameMin: Cijk_Ailk_Bjlk_HSS_BH_MT32x32x64_MI16x16x16x1_SE_AF0EM1_GRVW4_NLCA1_NLCB1_SU0_SUS256_SRVW0_TT1_16_WG32_8_1_WGM2
    SolutionIndex: 194
    SolutionNameMin: Cijk_Ailk_Bjlk_HSS_BH_MT32x32x64_MI16x16x16x1_SE_AF0EM1_GRVW8_NLCA1_NLCB1_SU0_SUS128_SRVW0_TT1_16_WG32_8_1_WGM2
    SolutionIndex: 195
    SolutionNameMin: Cijk_Ailk_Bjlk_HSS_BH_MT32x32x64_MI16x16x16x1_SE_AF0EM4_GRVW8_NLCA1_NLCB1_SU0_SUS256_SRVW0_TT1_16_WG32_8_1_WGM2
    SolutionIndex: 196
    SolutionNameMin: Cijk_Ailk_Bjlk_HSS_BH_MT64x128x64_MI32x32x8x1_SE_AF0EM4_GRVW8_NLCA1_NLCB1_SU16_SUS256_SRVW4_TT1_64_WG64_4_1_WGM15
    SolutionIndex: 197
    SolutionNameMin: Cijk_Ailk_Bjlk_HSS_BH_MT64x128x64_MI32x32x8x1_SE_AF0EM1_GRVW4_NLCA1_NLCB1_SU0_SUS256_SRVW4_TT1_64_WG64_4_1_WGM15
    SolutionIndex: 198
    SolutionNameMin: Cijk_Ailk_Bjlk_HSS_BH_MT128x128x64_MI32x32x8x1_SE_AF0EM1_GRVW8_NLCA1_NLCB1_SU0_SUS256_SRVW4_TT2_64_WG64_4_1_WGM15
    SolutionIndex: 199
    SolutionNameMin: Cijk_Ailk_Bjlk_HSS_BH_MT128x128x64_MI32x32x8x1_SE_AF0EM1_GRVW8_NLCA1_NLCB1_SU0_SUS128_SRVW4_TT2_64_WG64_4_1_WGM15
    SolutionIndex: 200
    SolutionNameMin: Cijk_Ailk_Bjlk_HSS_BH_MT128x160x32_MI32x32x8x1_SE_AF0EM1_GRVW4_NLCA1_NLCB5_SU32_SUS256_SRVW4_TT1_160_WG128_2_1_WGM15
    SolutionIndex: 201
    SolutionNameMin: Cijk_Ailk_Bjlk_HSS_BH_MT128x256x32_MI32x32x8x1_SE_AF0EM4_GRVW8_NLCA1_NLCB1_SU32_SUS128_SRVW4_TT2_128_WG64_4_1_WGM2
    SolutionIndex: 202
    SolutionNameMin: Cijk_Ailk_Bjlk_HSS_BH_MT128x256x32_MI32x32x8x1_SE_AF0EM4_GRVW8_NLCA1_NLCB1_SU32_SUS256_SRVW4_TT2_128_WG64_4_1_WGM2
    SolutionIndex: 203
    SolutionNameMin: Cijk_Ailk_Bjlk_HSS_BH_MT128x256x32_MI32x32x8x1_SE_AF0EM4_GRVW8_NLCA1_NLCB1_SU32_SUS256_SRVW4_TT2_128_WG64_4_1_WGM15
    SolutionIndex: 204
    SolutionNameMin: Cijk_Ailk_Bjlk_HSS_BH_MT128x256x32_MI32x32x8x1_SE_AF0EM4_GRVW4_NLCA1_NLCB1_SU32_SUS256_SRVW4_TT2_128_WG64_4_1_WGM15
    SolutionIndex: 205
    SolutionNameMin: Cijk_Ailk_Bjlk_HSS_BH_MT128x256x32_MI32x32x8x1_SE_AF0EM4_GRVW8_NLCA1_NLCB1_SU0_SUS256_SRVW4_TT2_128_WG64_4_1_WGM1
    SolutionIndex: 206
    SolutionNameMin: Cijk_Ailk_Bjlk_HSS_BH_MT128x256x32_MI32x32x8x1_SE_AF0EM1_GRVW8_NLCA1_NLCB1_SU0_SUS256_SRVW4_TT2_128_WG64_4_1_WGM15
    SolutionIndex: 207
    SolutionNameMin: Cijk_Ailk_Bjlk_HSS_BH_MT128x288x32_MI32x32x8x1_SE_AF0EM4_GRVW4_NLCA1_NLCB9_SU32_SUS256_SRVW4_TT1_288_WG128_2_1_WGM15
    SolutionIndex: 208
    SolutionNameMin: Cijk_Ailk_Bjlk_HSS_BH_MT128x160x32_MI32x32x8x1_SE_AF0EM4_GRVW4_NLCA1_NLCB5_SU16_SUS128_SRVW4_TT1_160_WG128_2_1_WGM1
    SolutionIndex: 209
    SolutionNameMin: Cijk_Ailk_Bjlk_HSS_BH_MT128x128x32_MI32x32x8x1_SE_AF0EM4_GRVW8_NLCA1_NLCB1_SU0_SUS256_SRVW0_TT2_64_WG64_4_1_WGM2
    SolutionIndex: 210
    SolutionNameMin: Cijk_Ailk_Bjlk_HSS_BH_MT128x128x32_MI32x32x8x1_SE_AF0EM4_GRVW8_NLCA1_NLCB1_SU0_SUS128_SRVW0_TT2_64_WG64_4_1_WGM15
    SolutionIndex: 211
    SolutionNameMin: Cijk_Ailk_Bjlk_HSS_BH_MT256x256x16_MI32x32x8x1_SE_AF0EM1_GRVW8_NLCA1_NLCB1_SU0_SUS128_SRVW0_TT4_128_WG64_4_1_WGM1
    SolutionIndex: 212
    SolutionNameMin: Cijk_Ailk_Bjlk_HSS_BH_MT256x128x32_MI32x32x4x2_SE_AF0EM4_GRVW8_NLCA1_NLCB1_SU16_SUS256_SRVW0_TT2_64_WG128_2_1_WGM15
    SolutionIndex: 213
    SolutionNameMin: Cijk_Ailk_Bjlk_HSS_BH_MT128x128x64_MI32x32x8x1_SE_AF0EM1_GRVW8_NLCA1_NLCB1_SU16_SUS128_SRVW0_TT2_64_WG64_4_1_WGM2
    SolutionIndex: 214
    SolutionNameMin: Cijk_Ailk_Bjlk_HSS_BH_MT32x32x32_MI16x16x16x1_SE_AF0EM4_GRVW8_NLCA1_NLCB1_SU0_SUS256_SRVW0_TT1_16_WG32_8_1_WGM15
    SolutionIndex: 215
    SolutionNameMin: Cijk_Ailk_Bjlk_HSS_BH_MT32x32x32_MI16x16x16x1_SE_AF0EM4_GRVW4_NLCA1_NLCB1_SU0_SUS128_SRVW0_TT1_16_WG32_8_1_WGM15
    SolutionIndex: 216
    SolutionNameMin: Cijk_Ailk_Bjlk_HSS_BH_MT64x128x32_MI32x32x8x1_SE_AF0EM4_GRVW8_NLCA1_NLCB1_SU0_SUS128_SRVW4_TT1_64_WG64_4_1_WGM2
    SolutionIndex: 217
    SolutionNameMin: Cijk_Ailk_Bjlk_HSS_BH_MT128x128x64_MI32x32x8x1_SE_AF0EM4_GRVW8_NLCA1_NLCB1_SU32_SUS128_SRVW4_TT2_64_WG64_4_1_WGM15
    SolutionIndex: 218
    SolutionNameMin: Cijk_Ailk_Bjlk_HSS_BH_MT32x32x64_MI16x16x16x1_SE_AF0EM4_GRVW4_NLCA1_NLCB1_SU32_SUS128_SRVW0_TT1_16_WG32_8_1_WGM15
    SolutionIndex: 219
    SolutionNameMin: Cijk_Ailk_Bjlk_HSS_BH_MT64x64x64_MI32x32x8x1_SE_AF0EM4_GRVW8_NLCA1_NLCB1_SU16_SUS128_SRVW4_TT1_32_WG64_4_1_WGM1
    SolutionIndex: 220
    SolutionNameMin: Cijk_Ailk_Bjlk_HSS_BH_MT64x64x128_MI32x32x8x1_SE_AF0EM4_GRVW8_NLCA1_NLCB1_SU16_SUS256_SRVW4_TT1_32_WG64_4_1_WGM1
    SolutionIndex: 221
    SolutionNameMin: Cijk_Ailk_Bjlk_HSS_BH_MT64x64x128_MI32x32x8x1_SE_AF0EM4_GRVW8_NLCA1_NLCB1_SU16_SUS256_SRVW4_TT1_32_WG64_4_1_WGM15
    SolutionIndex: 222
    SolutionNameMin: Cijk_Ailk_Bjlk_HSS_BH_MT64x64x128_MI32x32x8x1_SE_AF0EM4_GRVW8_NLCA1_NLCB1_SU16_SUS256_SRVW4_TT1_32_WG64_4_1_WGM2
    SolutionIndex: 223
    SolutionNameMin: Cijk_Ailk_Bjlk_HSS_BH_MT64x64x128_MI32x32x8x1_SE_AF0EM4_GRVW8_NLCA1_NLCB1_SU32_SUS256_SRVW4_TT1_32_WG64_4_1_WGM1
    SolutionIndex: 224
    SolutionNameMin: Cijk_Ailk_Bjlk_HSS_BH_MT64x64x128_MI32x32x8x1_SE_AF0EM4_GRVW8_NLCA1_NLCB1_SU32_SUS256_SRVW4_TT1_32_WG64_4_1_WGM15
    SolutionIndex: 225
    SolutionNameMin: Cijk_Ailk_Bjlk_HSS_BH_MT64x64x128_MI32x32x8x1_SE_AF0EM1_GRVW8_NLCA1_NLCB1_SU32_SUS256_SRVW4_TT1_32_WG64_4_1_WGM1
    SolutionIndex: 226
    SolutionNameMin: Cijk_Ailk_Bjlk_HSS_BH_MT128x96x64_MI32x32x8x1_SE_AF0EM4_GRVW8_NLCA1_NLCB3_SU16_SUS128_SRVW4_TT1_96_WG128_2_1_WGM2
    SolutionIndex: 227
    SolutionNameMin: Cijk_Ailk_Bjlk_HSS_BH_MT32x64x16_MI16x16x16x1_SE_AF0EM4_GRVW2_NLCA1_NLCB1_SU0_SUS128_SRVW0_TT1_32_WG32_8_1_WGM15
    SolutionIndex: 228
    SolutionNameMin: Cijk_Ailk_Bjlk_HSS_BH_MT256x144x32_MI16x16x16x1_SE_AF0EM4_GRVW2_NLCA2_NLCB9_SU0_SUS128_SRVW4_TT4_144_WG64_4_1_WGM15
    SolutionIndex: 229
    SolutionNameMin: Cijk_Ailk_Bjlk_HSS_BH_MT128x96x16_MI32x32x8x1_SE_AF0EM4_GRVW2_NLCA1_NLCB3_SU16_SUS128_SRVW4_TT1_96_WG128_2_1_WGM2
    SolutionIndex: 230
    SolutionNameMin: Cijk_Ailk_Bjlk_HSS_BH_MT128x288x32_MI32x32x8x1_SE_AF0EM4_GRVW4_NLCA1_NLCB9_SU0_SUS256_SRVW4_TT1_288_WG128_2_1_WGM2
    SolutionIndex: 231
    SolutionNameMin: Cijk_Ailk_Bjlk_HSS_BH_MT128x256x32_MI32x32x8x1_SE_AF0EM4_GRVW4_NLCA1_NLCB1_SU16_SUS128_SRVW4_TT2_128_WG64_4_1_WGM1
    SolutionIndex: 232
    SolutionNameMin: Cijk_Ailk_Bjlk_HSS_BH_MT32x32x16_MI16x16x16x1_SE_AF0EM4_GRVW8_NLCA1_NLCB1_SU0_SUS128_SRVW0_TT1_16_WG32_8_1_WGM2
    SolutionIndex: 233
    SolutionNameMin: Cijk_Ailk_Bjlk_HSS_BH_MT256x256x32_MI32x32x8x1_SE_AF0EM4_GRVW8_NLCA1_NLCB1_SU16_SUS256_SRVW0_TT4_128_WG64_4_1_WGM15
    SolutionIndex: 234
    SolutionNameMin: Cijk_Ailk_Bjlk_HSS_BH_MT128x96x16_MI32x32x8x1_SE_AF0EM4_GRVW2_NLCA1_NLCB3_SU0_SUS256_SRVW4_TT1_96_WG128_2_1_WGM2
    SolutionIndex: 235
    SolutionNameMin: Cijk_Ailk_Bjlk_HSS_BH_MT64x128x16_MI32x32x8x1_SE_AF0EM4_GRVW2_NLCA1_NLCB1_SU0_SUS128_SRVW4_TT1_64_WG64_4_1_WGM15
    SolutionIndex: 236
    SolutionNameMin: Cijk_Ailk_Bjlk_HSS_BH_MT256x256x16_MI32x32x8x1_SE_AF0EM4_GRVW8_NLCA1_NLCB1_SU32_SUS256_SRVW0_TT4_128_WG64_4_1_WGM15
    SolutionIndex: 237
    SolutionNameMin: Cijk_Ailk_Bjlk_HSS_BH_MT64x64x32_MI32x32x8x1_SE_AF0EM1_GRVW2_NLCA1_NLCB1_SU0_SUS256_SRVW4_TT1_32_WG64_4_1_WGM1
    SolutionIndex: 238
    SolutionNameMin: Cijk_Ailk_Bjlk_HSS_BH_MT64x128x32_MI32x32x8x1_SE_AF0EM1_GRVW8_NLCA1_NLCB1_SU0_SUS128_SRVW4_TT1_64_WG64_4_1_WGM15
    SolutionIndex: 239
    SolutionNameMin: Cijk_Ailk_Bjlk_HSS_BH_MT32x32x16_MI16x16x16x1_SE_AF0EM4_GRVW4_NLCA1_NLCB1_SU0_SUS256_SRVW0_TT1_16_WG32_8_1_WGM15
    SolutionIndex: 240
    SolutionNameMin: Cijk_Ailk_Bjlk_HSS_BH_MT128x256x32_MI32x32x8x1_SE_AF0EM4_GRVW4_NLCA1_NLCB1_SU32_SUS256_SRVW4_TT2_128_WG64_4_1_WGM1
    SolutionIndex: 241
    SolutionNameMin: Cijk_Ailk_Bjlk_HSS_BH_MT64x32x16_MI16x16x16x1_SE_AF0EM1_GRVW2_NLCA1_NLCB1_SU32_SUS256_SRVW0_TT2_16_WG32_8_1_WGM15
    SolutionIndex: 242
    SolutionNameMin: Cijk_Ailk_Bjlk_HSS_BH_MT128x256x32_MI32x32x8x1_SE_AF0EM4_GRVW4_NLCA1_NLCB1_SU0_SUS128_SRVW4_TT2_128_WG64_4_1_WGM15
    SolutionIndex: 243
    SolutionNameMin: Cijk_Ailk_Bjlk_HSS_BH_MT128x128x64_MI32x32x8x1_SE_AF0EM1_GRVW4_NLCA1_NLCB1_SU0_SUS256_SRVW0_TT2_64_WG64_4_1_WGM15
    SolutionIndex: 244
    SolutionNameMin: Cijk_Ailk_Bjlk_HSS_BH_MT64x64x32_MI32x32x8x1_SE_AF0EM4_GRVW4_NLCA1_NLCB1_SU0_SUS128_SRVW4_TT1_32_WG64_4_1_WGM15
    SolutionIndex: 245
    SolutionNameMin: Cijk_Ailk_Bjlk_HSS_BH_MT64x128x32_MI32x32x8x1_SE_AF0EM4_GRVW8_NLCA1_NLCB1_SU0_SUS128_SRVW4_TT1_64_WG64_4_1_WGM15
    SolutionIndex: 246
    SolutionNameMin: Cijk_Ailk_Bjlk_HSS_BH_MT128x160x32_MI32x32x8x1_SE_AF0EM4_GRVW4_NLCA1_NLCB5_SU0_SUS256_SRVW4_TT1_160_WG128_2_1_WGM1
    SolutionIndex: 247
    SolutionNameMin: Cijk_Ailk_Bjlk_HSS_BH_MT160x128x32_MI32x32x8x1_SE_AF0EM4_GRVW4_NLCA5_NLCB1_SU0_SUS256_SRVW0_TT5_32_WG32_8_1_WGM1
    SolutionIndex: 248
    SolutionNameMin: Cijk_Ailk_Bjlk_HSS_BH_MT128x96x32_MI32x32x8x1_SE_AF0EM4_GRVW4_NLCA1_NLCB3_SU0_SUS256_SRVW4_TT1_96_WG128_2_1_WGM1
    SolutionIndex: 249
    SolutionNameMin: Cijk_Ailk_Bjlk_HSS_BH_MT128x96x64_MI32x32x8x1_SE_AF0EM1_GRVW4_NLCA1_NLCB3_SU0_SUS256_SRVW4_TT1_96_WG128_2_1_WGM15
    SolutionIndex: 250
    SolutionNameMin: Cijk_Ailk_Bjlk_HSS_BH_MT128x96x32_MI32x32x8x1_SE_AF0EM4_GRVW4_NLCA1_NLCB3_SU0_SUS128_SRVW4_TT1_96_WG128_2_1_WGM15
    SolutionIndex: 251
    SolutionNameMin: Cijk_Ailk_Bjlk_HSS_BH_MT64x128x16_MI32x32x8x1_SE_AF0EM4_GRVW4_NLCA1_NLCB1_SU0_SUS128_SRVW4_TT1_64_WG64_4_1_WGM1
    SolutionIndex: 252
    SolutionNameMin: Cijk_Ailk_Bjlk_HSS_BH_MT128x64x16_MI32x32x8x1_SE_AF0EM4_GRVW4_NLCA1_NLCB1_SU0_SUS128_SRVW0_TT2_32_WG64_4_1_WGM15
    SolutionIndex: 253
    SolutionNameMin: Cijk_Ailk_Bjlk_HSS_BH_MT64x128x16_MI32x32x8x1_SE_AF0EM4_GRVW8_NLCA1_NLCB1_SU32_SUS256_SRVW4_TT1_64_WG64_4_1_WGM2
    SolutionIndex: 254
    SolutionNameMin: Cijk_Ailk_Bjlk_HSS_BH_MT128x64x64_MI32x32x8x1_SE_AF0EM4_GRVW8_NLCA1_NLCB1_SU0_SUS256_SRVW4_TT2_32_WG64_4_1_WGM15
    SolutionIndex: 255
    SolutionNameMin: Cijk_Ailk_Bjlk_HSS_BH_MT64x128x32_MI32x32x8x1_SE_AF0EM4_GRVW8_NLCA1_NLCB1_SU0_SUS128_SRVW4_TT1_64_WG64_4_1_WGM1
    SolutionIndex: 256
    SolutionNameMin: Cijk_Ailk_Bjlk_HSS_BH_MT64x128x16_MI32x32x8x1_SE_AF0EM1_GRVW8_NLCA1_NLCB1_SU16_SUS256_SRVW4_TT1_64_WG64_4_1_WGM2
    SolutionIndex: 257
    SolutionNameMin: Cijk_Ailk_Bjlk_HSS_BH_MT128x256x32_MI32x32x8x1_SE_AF0EM8_GRVW8_GSU1_SU32_SUS128_SRVW4_VAW2_WG64_4_1_WGM2
    SolutionIndex: 258
    SolutionNameMin: Cijk_Ailk_Bjlk_HSS_BH_MT128x256x32_MI32x32x8x1_SE_AF0EM8_GRVW8_GSU1_SU32_SUS128_SRVW4_VAW2_WG64_4_1_WGM15
    SolutionIndex: 259
    SolutionNameMin: Cijk_Ailk_Bjlk_HSS_BH_MT256x160x32_MI32x32x8x1_SE_AF0EM8_GRVW4_GSU1_SU0_SUS256_SRVW4_VAW2_WG128_2_1_WGM15
    SolutionIndex: 260
    SolutionNameMin: Cijk_Ailk_Bjlk_HSS_BH_MT16x16x16_MI16x16x16x1_SE_AF0EM8_GRVW2_GSU1_SU0_SUS256_SRVW0_VAW2_WG16_4_1_WGM1
    SolutionIndex: 261
    SolutionNameMin: Cijk_Ailk_Bjlk_HSS_BH_MT32x32x16_MI16x16x16x1_SE_AF0EM8_GRVW2_GSU1_SU0_SUS128_SRVW4_VAW2_WG32_8_1_WGM1
    SolutionIndex: 262
    SolutionNameMin: Cijk_Ailk_Bjlk_HSS_BH_MT16x16x32_MI16x16x16x1_SE_AF0EM8_GRVW2_GSU5_SU32_SUS128_SRVW0_VAW1_WG16_4_1_WGM1
    SolutionIndex: 263
    SolutionNameMin: Cijk_Ailk_Bjlk_HSS_BH_MT144x256x32_MI16x16x16x1_SE_AF0EM8_GRVW2_GSU1_SU0_SUS128_SRVW0_VAW2_WG16_16_1_WGM1
    SolutionIndex: 264
    SolutionNameMin: Cijk_Ailk_Bjlk_HSS_BH_MT64x16x32_MI16x16x16x1_SE_AF0EM8_GRVW8_GSU15_SU0_SUS256_SRVW0_VAW1_WG64_4_1_WGM1
    SolutionIndex: 265
    SolutionNameMin: Cijk_Ailk_Bjlk_HSS_BH_MT160x256x32_MI32x32x8x1_SE_AF0EM8_GRVW4_GSU1_SU32_SUS128_SRVW0_VAW2_WG32_8_1_WGM1
    SolutionIndex: 266
    SolutionNameMin: Cijk_Ailk_Bjlk_HSS_BH_MT64x64x16_MI32x32x8x1_SE_AF0EM8_GRVW2_GSU1_SU0_SUS128_SRVW4_VAW2_WG64_4_1_WGM1
    SolutionIndex: 267
    SolutionNameMin: Cijk_Ailk_Bjlk_HSS_BH_MT64x16x32_MI16x16x16x1_SE_AF0EM8_GRVW8_GSU7_SU0_SUS128_SRVW0_VAW1_WG64_4_1_WGM1
    SolutionIndex: 268
    SolutionNameMin: Cijk_Ailk_Bjlk_HSS_BH_MT64x16x32_MI16x16x16x1_SE_AF0EM8_GRVW2_GSU15_SU0_SUS256_SRVW0_VAW1_WG64_4_1_WGM2
    SolutionIndex: 269
    SolutionNameMin: Cijk_Ailk_Bjlk_HSS_BH_MT256x160x32_MI32x32x8x1_SE_AF0EM8_GRVW4_GSU1_SU0_SUS128_SRVW4_VAW2_WG128_2_1_WGM15
    SolutionIndex: 270
    SolutionNameMin: Cijk_Ailk_Bjlk_HSS_BH_MT64x16x32_MI16x16x16x1_SE_AF0EM8_GRVW8_GSU15_SU0_SUS256_SRVW0_VAW1_WG64_4_1_WGM15
    SolutionIndex: 271
    SolutionNameMin: Cijk_Ailk_Bjlk_HSS_BH_MT160x256x32_MI32x32x8x1_SE_AF0EM8_GRVW4_GSU1_SU0_SUS256_SRVW0_VAW2_WG32_8_1_WGM1
    SolutionIndex: 272
    SolutionNameMin: Cijk_Ailk_Bjlk_HSS_BH_MT64x16x32_MI16x16x16x1_SE_AF0EM8_GRVW2_GSU7_SU0_SUS256_SRVW0_VAW1_WG64_4_1_WGM2
    SolutionIndex: 273
    SolutionNameMin: Cijk_Ailk_Bjlk_HSS_BH_MT64x16x64_MI16x16x16x1_SE_AF0EM8_GRVW2_GSU7_SU0_SUS128_SRVW4_VAW1_WG64_4_1_WGM1
    SolutionIndex: 274
    SolutionNameMin: Cijk_Ailk_Bjlk_HSS_BH_MT144x256x32_MI16x16x16x1_SE_AF0EM8_GRVW2_GSU1_SU0_SUS256_SRVW0_VAW2_WG16_16_1_WGM1
    SolutionIndex: 275
    SolutionNameMin: Cijk_Ailk_Bjlk_HSS_BH_MT64x64x64_MI32x32x8x1_SE_AF0EM8_GRVW8_GSU15_SU32_SUS256_SRVW0_VAW1_WG64_4_1_WGM1
    SolutionIndex: 276
    SolutionNameMin: Cijk_Ailk_Bjlk_HSS_BH_MT128x128x32_MI32x32x8x1_SE_AF0EM8_GRVW8_GSU15_SU0_SUS256_SRVW0_VAW1_WG64_4_1_WGM1
    SolutionIndex: 277
    SolutionNameMin: Cijk_Ailk_Bjlk_HSS_BH_MT256x128x32_MI32x32x8x1_SE_AF0EM8_GRVW8_GSU7_SU0_SUS256_SRVW0_VAW1_WG64_4_1_WGM15
    SolutionIndex: 278
    SolutionNameMin: Cijk_Ailk_Bjlk_HSS_BH_MT256x256x16_MI32x32x8x1_SE_AF0EM8_GRVW8_GSU7_SU0_SUS256_SRVW0_VAW1_WG64_4_1_WGM2
    SolutionIndex: 279
    SolutionNameMin: Cijk_Ailk_Bjlk_HSS_BH_MT64x16x32_MI16x16x16x1_SE_AF0EM8_GRVW4_GSU1_SU0_SUS256_SRVW0_VAW2_WG64_4_1_WGM15
    SolutionIndex: 280
    SolutionNameMin: Cijk_Ailk_Bjlk_HSS_BH_MT256x128x32_MI32x32x8x1_SE_AF0EM8_GRVW8_GSU3_SU0_SUS128_SRVW0_VAW1_WG64_4_1_WGM2
    SolutionIndex: 281
    SolutionNameMin: Cijk_Ailk_Bjlk_HSS_BH_MT128x256x32_MI32x32x8x1_SE_AF0EM8_GRVW8_GSU3_SU0_SUS128_SRVW0_VAW1_WG64_4_1_WGM15
    SolutionIndex: 282
    SolutionNameMin: Cijk_Ailk_Bjlk_HSS_BH_MT128x256x32_MI32x32x8x1_SE_AF0EM8_GRVW8_GSU1_SU0_SUS256_SRVW4_VAW2_WG64_4_1_WGM2
    SolutionIndex: 283
    SolutionNameMin: Cijk_Ailk_Bjlk_HSS_BH_MT128x256x32_MI32x32x8x1_SE_AF0EM8_GRVW8_GSU1_SU0_SUS128_SRVW4_VAW2_WG64_4_1_WGM2
    SolutionIndex: 284
    SolutionNameMin: Cijk_Ailk_Bjlk_HSS_BH_MT160x256x32_MI32x32x8x1_SE_AF0EM8_GRVW4_GSU1_SU0_SUS256_SRVW0_VAW2_WG32_8_1_WGM2
    SolutionIndex: 285
    SolutionNameMin: Cijk_Ailk_Bjlk_HSS_BH_MT128x256x32_MI32x32x8x1_SE_AF0EM8_GRVW8_GSU3_SU0_SUS256_SRVW0_VAW1_WG64_4_1_WGM15
    SolutionIndex: 286
    SolutionNameMin: Cijk_Ailk_Bjlk_HSS_BH_MT128x256x32_MI32x32x8x1_SE_AF0EM8_GRVW8_GSU3_SU0_SUS256_SRVW0_VAW1_WG64_4_1_WGM2
    SolutionIndex: 287
    SolutionNameMin: Cijk_Ailk_Bjlk_HSS_BH_MT128x256x32_MI32x32x8x1_SE_AF0EM8_GRVW8_GSU3_SU0_SUS128_SRVW0_VAW1_WG64_4_1_WGM2
    SolutionIndex: 288
    SolutionNameMin: Cijk_Ailk_Bjlk_HSS_BH_MT256x128x32_MI32x32x8x1_SE_AF0EM8_GRVW8_GSU3_SU32_SUS128_SRVW0_VAW1_WG64_4_1_WGM1
    SolutionIndex: 289
    SolutionNameMin: Cijk_Ailk_Bjlk_HSS_BH_MT256x128x32_MI32x32x8x1_SE_AF0EM8_GRVW8_GSU3_SU0_SUS256_SRVW0_VAW1_WG64_4_1_WGM2
    SolutionIndex: 290
    SolutionNameMin: Cijk_Ailk_Bjlk_HSS_BH_MT256x128x32_MI32x32x8x1_SE_AF0EM8_GRVW8_GSU3_SU0_SUS256_SRVW0_VAW1_WG64_4_1_WGM15
    SolutionIndex: 291
    SolutionNameMin: Cijk_Ailk_Bjlk_HSS_BH_MT128x256x32_MI32x32x8x1_SE_AF0EM8_GRVW8_GSU3_SU32_SUS128_SRVW0_VAW1_WG64_4_1_WGM15
    SolutionIndex: 292
    SolutionNameMin: Cijk_Ailk_Bjlk_HSS_BH_MT256x128x32_MI32x32x8x1_SE_AF0EM8_GRVW8_GSU3_SU0_SUS128_SRVW0_VAW1_WG64_4_1_WGM1
    SolutionIndex: 293
    SolutionNameMin: Cijk_Ailk_Bjlk_HSS_BH_MT256x160x32_MI32x32x8x1_SE_AF0EM8_GRVW4_GSU1_SU32_SUS256_SRVW4_VAW2_WG128_2_1_WGM15
    SolutionIndex: 294
    SolutionNameMin: Cijk_Ailk_Bjlk_HSS_BH_MT160x256x32_MI32x32x8x1_SE_AF0EM8_GRVW4_GSU1_SU0_SUS128_SRVW0_VAW2_WG32_8_1_WGM1
    SolutionIndex: 295
    SolutionNameMin: Cijk_Ailk_Bjlk_HSS_BH_MT160x256x32_MI32x32x8x1_SE_AF0EM8_GRVW4_GSU1_SU0_SUS128_SRVW0_VAW2_WG32_8_1_WGM2
    SolutionIndex: 296
    SolutionNameMin: Cijk_Ailk_Bjlk_HSS_BH_MT32x32x64_MI16x16x16x1_SE_AF0EM8_GRVW4_GSU5_SU0_SUS256_SRVW0_VAW1_WG32_8_1_WGM1
    SolutionIndex: 297
    SolutionNameMin: Cijk_Ailk_Bjlk_HSS_BH_MT128x128x64_MI32x32x8x1_SE_AF0EM8_GRVW8_GSU5_SU0_SUS128_SRVW0_VAW1_WG64_4_1_WGM1
    SolutionIndex: 298
    SolutionNameMin: Cijk_Ailk_Bjlk_HSS_BH_MT128x128x64_MI32x32x8x1_SE_AF0EM8_GRVW8_GSU3_SU32_SUS256_SRVW0_VAW1_WG64_4_1_WGM15
    SolutionIndex: 299
    SolutionNameMin: Cijk_Ailk_Bjlk_HSS_BH_MT256x128x32_MI32x32x8x1_SE_AF0EM8_GRVW8_GSU5_SU0_SUS256_SRVW0_VAW1_WG64_4_1_WGM1
    SolutionIndex: 300
    SolutionNameMin: Cijk_Ailk_Bjlk_HSS_BH_MT128x128x64_MI32x32x8x1_SE_AF0EM8_GRVW8_GSU2_SU0_SUS128_SRVW0_VAW1_WG64_4_1_WGM15
    SolutionIndex: 301
    SolutionNameMin: Cijk_Ailk_Bjlk_HSS_BH_MT128x128x64_MI32x32x8x1_SE_AF0EM8_GRVW8_GSU2_SU0_SUS128_SRVW0_VAW1_WG64_4_1_WGM2
    SolutionIndex: 302
    SolutionNameMin: Cijk_Ailk_Bjlk_HSS_BH_MT256x160x32_MI32x32x8x1_SE_AF0EM8_GRVW4_GSU5_SU32_SUS128_SRVW0_VAW1_WG128_2_1_WGM15
    SolutionIndex: 303
    SolutionNameMin: Cijk_Ailk_Bjlk_HSS_BH_MT256x128x32_MI32x32x8x1_SE_AF0EM8_GRVW8_GSU3_SU0_SUS256_SRVW0_VAW1_WG64_4_1_WGM1
    SolutionIndex: 304
    SolutionNameMin: Cijk_Ailk_Bjlk_HSS_BH_MT256x128x32_MI32x32x8x1_SE_AF0EM8_GRVW8_GSU3_SU32_SUS256_SRVW0_VAW1_WG64_4_1_WGM1
    SolutionIndex: 305
    SolutionNameMin: Cijk_Ailk_Bjlk_HSS_BH_MT128x288x32_MI32x32x8x1_SE_AF0EM8_GRVW4_GSU3_SU0_SUS256_SRVW0_VAW1_WG128_2_1_WGM1
    SolutionIndex: 306
    SolutionNameMin: Cijk_Ailk_Bjlk_HSS_BH_MT256x160x32_MI32x32x8x1_SE_AF0EM8_GRVW4_GSU3_SU0_SUS256_SRVW0_VAW1_WG128_2_1_WGM1
    SolutionIndex: 307
    SolutionNameMin: Cijk_Ailk_Bjlk_HSS_BH_MT256x128x32_MI32x32x8x1_SE_AF0EM8_GRVW8_GSU2_SU0_SUS256_SRVW0_VAW1_WG64_4_1_WGM2
    SolutionIndex: 308
    SolutionNameMin: Cijk_Ailk_Bjlk_HSS_BH_MT256x160x32_MI32x32x8x1_SE_AF0EM8_GRVW4_GSU2_SU0_SUS128_SRVW0_VAW1_WG128_2_1_WGM15
    SolutionIndex: 309
    SolutionNameMin: Cijk_Ailk_Bjlk_HSS_BH_MT256x160x32_MI32x32x8x1_SE_AF0EM8_GRVW4_GSU2_SU0_SUS256_SRVW0_VAW1_WG128_2_1_WGM1
    SolutionIndex: 310
    SolutionNameMin: Cijk_Ailk_Bjlk_HSS_BH_MT256x256x16_MI32x32x8x1_SE_AF0EM8_GRVW8_GSU3_SU0_SUS256_SRVW0_VAW1_WG64_4_1_WGM1
    SolutionIndex: 311
    SolutionNameMin: Cijk_Ailk_Bjlk_HSS_BH_MT256x256x16_MI32x32x8x1_SE_AF0EM8_GRVW4_GSU3_SU0_SUS128_SRVW0_VAW1_WG64_4_1_WGM2
    SolutionIndex: 312
    SolutionNameMin: Cijk_Ailk_Bjlk_HSS_BH_MT256x256x16_MI32x32x8x1_SE_AF0EM8_GRVW8_GSU3_SU0_SUS128_SRVW0_VAW1_WG64_4_1_WGM1
    SolutionIndex: 313
    SolutionNameMin: Cijk_Ailk_Bjlk_HSS_BH_MT128x256x32_MI32x32x8x1_SE_AF0EM8_GRVW8_GSU1_SU0_SUS256_SRVW4_VAW2_WG64_4_1_WGM15
    SolutionIndex: 314
    SolutionNameMin: Cijk_Ailk_Bjlk_HSS_BH_MT128x288x32_MI32x32x8x1_SE_AF0EM8_GRVW4_GSU1_SU32_SUS128_SRVW4_VAW2_WG128_2_1_WGM15
    SolutionIndex: 315
    SolutionNameMin: Cijk_Ailk_Bjlk_HSS_BH_MT128x288x32_MI32x32x8x1_SE_AF0EM8_GRVW4_GSU1_SU32_SUS128_SRVW4_VAW2_WG128_2_1_WGM2
    SolutionIndex: 316
    SolutionNameMin: Cijk_Ailk_Bjlk_HSS_BH_MT128x288x32_MI32x32x8x1_SE_AF0EM8_GRVW4_GSU1_SU0_SUS256_SRVW4_VAW2_WG128_2_1_WGM15
    SolutionIndex: 317
    SolutionNameMin: Cijk_Ailk_Bjlk_HSS_BH_MT256x160x32_MI32x32x8x1_SE_AF0EM8_GRVW4_GSU1_SU0_SUS128_SRVW4_VAW2_WG128_2_1_WGM2
    SolutionIndex: 318
    SolutionNameMin: Cijk_Ailk_Bjlk_HSS_BH_MT128x128x64_MI32x32x8x1_SE_AF0EM8_GRVW8_GSU1_SU0_SUS128_SRVW4_VAW2_WG64_4_1_WGM1
    SolutionIndex: 319
    SolutionNameMin: Cijk_Ailk_Bjlk_HSS_BH_MT128x128x64_MI32x32x8x1_SE_AF0EM8_GRVW8_GSU1_SU0_SUS128_SRVW4_VAW2_WG64_4_1_WGM15
    SolutionIndex: 320
    SolutionNameMin: Cijk_Ailk_Bjlk_HSS_BH_MT128x128x64_MI32x32x8x1_SE_AF0EM8_GRVW8_GSU1_SU0_SUS256_SRVW4_VAW2_WG64_4_1_WGM2
    SolutionIndex: 321
    SolutionNameMin: Cijk_Ailk_Bjlk_HSS_BH_MT128x128x64_MI32x32x8x1_SE_AF0EM8_GRVW8_GSU1_SU0_SUS256_SRVW4_VAW2_WG64_4_1_WGM1
    SolutionIndex: 322
    SolutionNameMin: Cijk_Ailk_Bjlk_HSS_BH_MT128x128x64_MI32x32x8x1_SE_AF0EM8_GRVW8_GSU1_SU0_SUS128_SRVW4_VAW2_WG64_4_1_WGM2
    SolutionIndex: 323
    SolutionNameMin: Cijk_Ailk_Bjlk_HSS_BH_MT128x288x32_MI32x32x8x1_SE_AF0EM8_GRVW4_GSU1_SU0_SUS256_SRVW4_VAW2_WG128_2_1_WGM2
    SolutionIndex: 324
    SolutionNameMin: Cijk_Ailk_Bjlk_HSS_BH_MT128x288x32_MI32x32x8x1_SE_AF0EM8_GRVW4_GSU1_SU0_SUS128_SRVW4_VAW2_WG128_2_1_WGM2
    SolutionIndex: 325
    SolutionNameMin: Cijk_Ailk_Bjlk_HSS_BH_MT256x128x32_MI32x32x8x1_SE_AF0EM8_GRVW8_GSU7_SU32_SUS128_SRVW0_VAW1_WG64_4_1_WGM15
    SolutionIndex: 326
    SolutionNameMin: Cijk_Ailk_Bjlk_HSS_BH_MT96x128x64_MI32x32x8x1_SE_AF0EM8_GRVW8_GSU5_SU32_SUS256_SRVW0_VAW1_WG32_8_1_WGM2
    SolutionIndex: 327
    SolutionNameMin: Cijk_Ailk_Bjlk_HSS_BH_MT128x128x32_MI32x32x8x1_SE_AF0EM8_GRVW8_GSU7_SU32_SUS256_SRVW0_VAW1_WG64_4_1_WGM1
    SolutionIndex: 328
    SolutionNameMin: Cijk_Ailk_Bjlk_HSS_BH_MT128x128x64_MI32x32x8x1_SE_AF0EM8_GRVW8_GSU7_SU0_SUS256_SRVW0_VAW1_WG64_4_1_WGM1
    SolutionIndex: 329
    SolutionNameMin: Cijk_Ailk_Bjlk_HSS_BH_MT96x128x64_MI32x32x8x1_SE_AF0EM8_GRVW4_GSU5_SU32_SUS256_SRVW0_VAW1_WG32_8_1_WGM15
    SolutionIndex: 330
    SolutionNameMin: Cijk_Ailk_Bjlk_HSS_BH_MT128x128x64_MI32x32x8x1_SE_AF0EM8_GRVW8_GSU7_SU0_SUS128_SRVW0_VAW1_WG64_4_1_WGM1
    SolutionIndex: 331
    SolutionNameMin: Cijk_Ailk_Bjlk_HSS_BH_MT128x128x64_MI32x32x8x1_SE_AF0EM8_GRVW8_GSU7_SU32_SUS128_SRVW0_VAW1_WG64_4_1_WGM1
    SolutionIndex: 332
    SolutionNameMin: Cijk_Ailk_Bjlk_HSS_BH_MT128x128x32_MI32x32x8x1_SE_AF0EM8_GRVW8_GSU7_SU0_SUS256_SRVW0_VAW1_WG64_4_1_WGM15
    SolutionIndex: 333
    SolutionNameMin: Cijk_Ailk_Bjlk_HSS_BH_MT128x128x32_MI32x32x8x1_SE_AF0EM8_GRVW8_GSU7_SU32_SUS128_SRVW0_VAW1_WG64_4_1_WGM2
    SolutionIndex: 334
    SolutionNameMin: Cijk_Ailk_Bjlk_HSS_BH_MT128x128x64_MI32x32x8x1_SE_AF0EM8_GRVW8_GSU7_SU0_SUS128_SRVW0_VAW1_WG64_4_1_WGM2
    SolutionIndex: 335
    SolutionNameMin: Cijk_Ailk_Bjlk_HSS_BH_MT128x128x64_MI32x32x8x1_SE_AF0EM8_GRVW8_GSU7_SU0_SUS256_SRVW0_VAW1_WG64_4_1_WGM2
    SolutionIndex: 336
    SolutionNameMin: Cijk_Ailk_Bjlk_HSS_BH_MT128x128x32_MI32x32x8x1_SE_AF0EM8_GRVW8_GSU7_SU0_SUS128_SRVW0_VAW1_WG64_4_1_WGM1
    SolutionIndex: 337
    SolutionNameMin: Cijk_Ailk_Bjlk_HSS_BH_MT128x128x32_MI32x32x8x1_SE_AF0EM8_GRVW8_GSU7_SU32_SUS128_SRVW0_VAW1_WG64_4_1_WGM15
    SolutionIndex: 338
    SolutionNameMin: Cijk_Ailk_Bjlk_HSS_BH_MT256x128x32_MI32x32x8x1_SE_AF0EM8_GRVW8_GSU15_SU0_SUS128_SRVW0_VAW1_WG64_4_1_WGM2
    SolutionIndex: 339
    SolutionNameMin: Cijk_Ailk_Bjlk_HSS_BH_MT256x128x32_MI32x32x8x1_SE_AF0EM8_GRVW8_GSU15_SU0_SUS128_SRVW0_VAW1_WG64_4_1_WGM1
    SolutionIndex: 340
    SolutionNameMin: Cijk_Ailk_Bjlk_HSS_BH_MT256x128x32_MI32x32x8x1_SE_AF0EM8_GRVW8_GSU15_SU0_SUS256_SRVW0_VAW1_WG64_4_1_WGM15
    SolutionIndex: 341
    SolutionNameMin: Cijk_Ailk_Bjlk_HSS_BH_MT256x128x32_MI32x32x8x1_SE_AF0EM8_GRVW8_GSU15_SU32_SUS128_SRVW0_VAW1_WG64_4_1_WGM1
    SolutionIndex: 342
    SolutionNameMin: Cijk_Ailk_Bjlk_HSS_BH_MT256x128x32_MI32x32x8x1_SE_AF0EM8_GRVW8_GSU15_SU0_SUS256_SRVW0_VAW1_WG64_4_1_WGM1
    SolutionIndex: 343
    SolutionNameMin: Cijk_Ailk_Bjlk_HSS_BH_MT256x128x32_MI32x32x8x1_SE_AF0EM8_GRVW8_GSU15_SU32_SUS128_SRVW0_VAW1_WG64_4_1_WGM15
    SolutionIndex: 344
    SolutionNameMin: Cijk_Ailk_Bjlk_HSS_BH_MT64x32x16_MI16x16x16x1_SE_AF0EM8_GRVW4_GSU1_SU0_SUS128_SRVW4_VAW2_WG32_8_1_WGM2
    SolutionIndex: 345
    SolutionNameMin: Cijk_Ailk_Bjlk_HSS_BH_MT128x256x32_MI32x32x8x1_SE_AF0EM8_GRVW8_GSU1_SU0_SUS128_SRVW4_VAW2_WG64_4_1_WGM15
    SolutionIndex: 346
    SolutionNameMin: Cijk_Ailk_Bjlk_HSS_BH_MT256x160x32_MI32x32x8x1_SE_AF0EM8_GRVW4_GSU1_SU0_SUS256_SRVW4_VAW2_WG128_2_1_WGM2
    SolutionIndex: 347
    SolutionNameMin: Cijk_Ailk_Bjlk_HSS_BH_MT96x128x32_MI32x32x8x1_SE_AF0EM8_GRVW4_GSU1_SU0_SUS128_SRVW0_VAW2_WG32_8_1_WGM1
    SolutionIndex: 348
    SolutionNameMin: Cijk_Ailk_Bjlk_HSS_BH_MT256x160x32_MI32x32x8x1_SE_AF0EM8_GRVW4_GSU2_SU0_SUS128_SRVW0_VAW1_WG128_2_1_WGM2
    SolutionIndex: 349
    SolutionNameMin: Cijk_Ailk_Bjlk_HSS_BH_MT96x128x16_MI32x32x8x1_SE_AF0EM8_GRVW2_GSU1_SU0_SUS128_SRVW0_VAW2_WG32_8_1_WGM15
    SolutionIndex: 350
    SolutionNameMin: Cijk_Ailk_Bjlk_HSS_BH_MT256x256x16_MI32x32x8x1_SE_AF0EM8_GRVW8_GSU7_SU0_SUS256_SRVW0_VAW1_WG64_4_1_WGM15
    SolutionIndex: 351
    SolutionNameMin: Cijk_Ailk_Bjlk_HSS_BH_MT16x64x64_MI16x16x16x1_SE_AF0EM8_GRVW2_GSU1_SU0_SUS128_SRVW0_VAW2_WG16_16_1_WGM1
    SolutionIndex: 352
    SolutionNameMin: Cijk_Ailk_Bjlk_HSS_BH_MT32x64x16_MI16x16x16x1_SE_AF0EM8_GRVW2_GSU1_SU0_SUS128_SRVW4_VAW2_WG32_8_1_WGM1
    SolutionIndex: 353
    SolutionNameMin: Cijk_Ailk_Bjlk_HSS_BH_MT64x128x16_MI32x32x8x1_SE_AF0EM8_GRVW2_GSU1_SU0_SUS256_SRVW4_VAW2_WG64_4_1_WGM15
    SolutionIndex: 354
    SolutionNameMin: Cijk_Ailk_Bjlk_HSS_BH_MT64x64x64_MI32x32x8x1_SE_AF0EM8_GRVW8_GSU1_SU0_SUS128_SRVW4_VAW2_WG64_4_1_WGM2
    SolutionIndex: 355
    SolutionNameMin: Cijk_Ailk_Bjlk_HSS_BH_MT128x96x64_MI32x32x8x1_SE_AF0EM8_GRVW8_GSU1_SU32_SUS128_SRVW4_VAW2_WG128_2_1_WGM15
    SolutionIndex: 356
    SolutionNameMin: Cijk_Ailk_Bjlk_HSS_BH_MT64x128x32_MI32x32x8x1_SE_AF0EM8_GRVW8_GSU1_SU32_SUS128_SRVW4_VAW2_WG64_4_1_WGM2
    SolutionIndex: 357
    SolutionNameMin: Cijk_Ailk_Bjlk_HSS_BH_MT128x128x64_MI32x32x8x1_SE_AF0EM8_GRVW8_GSU3_SU0_SUS128_SRVW0_VAW1_WG64_4_1_WGM1
    SolutionIndex: 358
    SolutionNameMin: Cijk_Ailk_Bjlk_HSS_BH_MT128x128x64_MI32x32x8x1_SE_AF0EM8_GRVW8_GSU3_SU0_SUS128_SRVW0_VAW1_WG64_4_1_WGM2
    SolutionIndex: 359
    SolutionNameMin: Cijk_Ailk_Bjlk_HSS_BH_MT64x64x32_MI32x32x8x1_SE_AF0EM8_GRVW8_GSU1_SU32_SUS128_SRVW4_VAW2_WG64_4_1_WGM1
    SolutionIndex: 360
    SolutionNameMin: Cijk_Ailk_Bjlk_HSS_BH_MT64x32x64_MI16x16x16x1_SE_AF0EM8_GRVW8_GSU5_SU32_SUS128_SRVW0_VAW1_WG32_8_1_WGM15
    SolutionIndex: 361
    SolutionNameMin: Cijk_Ailk_Bjlk_HSS_BH_MT32x64x64_MI16x16x16x1_SE_AF0EM8_GRVW8_GSU15_SU0_SUS128_SRVW0_VAW1_WG32_8_1_WGM2
    SolutionIndex: 362
    SolutionNameMin: Cijk_Ailk_Bjlk_HSS_BH_MT64x64x64_MI32x32x8x1_SE_AF0EM8_GRVW8_GSU15_SU0_SUS128_SRVW0_VAW1_WG64_4_1_WGM1
    SolutionIndex: 363
    SolutionNameMin: Cijk_Ailk_Bjlk_HSS_BH_MT32x64x64_MI16x16x16x1_SE_AF0EM8_GRVW8_GSU15_SU32_SUS256_SRVW0_VAW1_WG32_8_1_WGM15
    SolutionIndex: 364
    SolutionNameMin: Cijk_Ailk_Bjlk_HSS_BH_MT32x32x64_MI16x16x16x1_SE_AF0EM8_GRVW8_GSU1_SU0_SUS256_SRVW4_VAW2_WG32_8_1_WGM1
    SolutionIndex: 365
    SolutionNameMin: Cijk_Ailk_Bjlk_HSS_BH_MT64x32x16_MI16x16x16x1_SE_AF0EM8_GRVW4_GSU1_SU0_SUS128_SRVW4_VAW2_WG32_8_1_WGM1
    SolutionIndex: 366
    SolutionNameMin: Cijk_Ailk_Bjlk_HSS_BH_MT64x128x16_MI32x32x8x1_SE_AF0EM8_GRVW4_GSU1_SU0_SUS256_SRVW4_VAW2_WG64_4_1_WGM15
    SolutionIndex: 367
    SolutionNameMin: Cijk_Ailk_Bjlk_HSS_BH_MT32x32x16_MI16x16x16x1_SE_AF0EM8_GRVW2_GSU1_SU0_SUS256_SRVW4_VAW2_WG32_8_1_WGM1
    SolutionIndex: 368
    SolutionNameMin: Cijk_Ailk_Bjlk_HSS_BH_MT96x128x64_MI32x32x8x1_SE_AF0EM8_GRVW4_GSU3_SU0_SUS256_SRVW0_VAW1_WG32_8_1_WGM15
    SolutionIndex: 369
    SolutionNameMin: Cijk_Ailk_Bjlk_HSS_BH_MT128x128x64_MI32x32x8x1_SE_AF0EM8_GRVW8_GSU3_SU32_SUS128_SRVW0_VAW1_WG64_4_1_WGM15
    SolutionIndex: 370
    SolutionNameMin: Cijk_Ailk_Bjlk_HSS_BH_MT32x64x32_MI16x16x16x1_SE_AF0EM8_GRVW8_GSU1_SU0_SUS128_SRVW4_VAW2_WG32_8_1_WGM15
    SolutionIndex: 371
    SolutionNameMin: Cijk_Ailk_Bjlk_HSS_BH_MT64x64x32_MI32x32x8x1_SE_AF0EM8_GRVW8_GSU7_SU0_SUS256_SRVW0_VAW1_WG64_4_1_WGM1
    SolutionIndex: 372
    SolutionNameMin: Cijk_Ailk_Bjlk_HSS_BH_MT64x64x64_MI32x32x8x1_SE_AF0EM8_GRVW4_GSU7_SU0_SUS128_SRVW0_VAW1_WG64_4_1_WGM1
    SolutionIndex: 373
    SolutionNameMin: Cijk_Ailk_Bjlk_HSS_BH_MT128x128x32_MI32x32x8x1_SE_AF0EM8_GRVW8_GSU15_SU0_SUS128_SRVW0_VAW1_WG64_4_1_WGM1
    SolutionIndex: 374
    SolutionNameMin: Cijk_Ailk_Bjlk_HSS_BH_MT128x64x32_MI32x32x8x1_SE_AF0EM8_GRVW8_GSU15_SU32_SUS256_SRVW0_VAW1_WG64_4_1_WGM1
    SolutionIndex: 375
    SolutionNameMin: Cijk_Ailk_Bjlk_HSS_BH_MT32x32x64_MI16x16x16x1_SE_AF0EM8_GRVW8_GSU1_SU0_SUS128_SRVW4_VAW2_WG32_8_1_WGM1
    SolutionIndex: 376
    SolutionNameMin: Cijk_Ailk_Bjlk_HSS_BH_MT64x64x16_MI32x32x8x1_SE_AF0EM8_GRVW8_GSU1_SU0_SUS256_SRVW4_VAW2_WG64_4_1_WGM15
    SolutionIndex: 377
    SolutionNameMin: Cijk_Ailk_Bjlk_HSS_BH_MT64x128x16_MI32x32x8x1_SE_AF0EM8_GRVW2_GSU1_SU0_SUS128_SRVW4_VAW2_WG64_4_1_WGM1
    SolutionIndex: 378
    SolutionNameMin: Cijk_Ailk_Bjlk_HSS_BH_MT64x64x32_MI32x32x8x1_SE_AF0EM8_GRVW8_GSU1_SU0_SUS256_SRVW4_VAW2_WG64_4_1_WGM1
    SolutionIndex: 379
    SolutionNameMin: Cijk_Ailk_Bjlk_HSS_BH_MT64x32x16_MI16x16x16x1_SE_AF0EM8_GRVW2_GSU1_SU0_SUS256_SRVW4_VAW2_WG32_8_1_WGM2
    SolutionIndex: 380
    SolutionNameMin: Cijk_Ailk_Bjlk_HSS_BH_MT32x32x16_MI16x16x16x1_SE_AF0EM8_GRVW8_GSU1_SU0_SUS256_SRVW4_VAW2_WG32_8_1_WGM2
    SolutionIndex: 381
    SolutionNameMin: Cijk_Ailk_Bjlk_HSS_BH_MT64x64x32_MI32x32x8x1_SE_AF0EM8_GRVW2_GSU1_SU0_SUS256_SRVW4_VAW2_WG64_4_1_WGM1
    SolutionIndex: 382
    SolutionNameMin: Cijk_Ailk_Bjlk_HSS_BH_MT128x96x16_MI32x32x8x1_SE_AF0EM8_GRVW2_GSU1_SU0_SUS256_SRVW4_VAW2_WG128_2_1_WGM15
    SolutionIndex: 383
    SolutionNameMin: Cijk_Ailk_Bjlk_HSS_BH_MT64x64x16_MI32x32x8x1_SE_AF0EM8_GRVW2_GSU1_SU0_SUS256_SRVW4_VAW2_WG64_4_1_WGM1
    SolutionIndex: 384
    SolutionNameMin: Cijk_Ailk_Bjlk_HSS_BH_MT32x32x32_MI16x16x16x1_SE_AF0EM8_GRVW2_GSU1_SU0_SUS128_SRVW4_VAW2_WG32_8_1_WGM1
    SolutionIndex: 385
    SolutionNameMin: Cijk_Ailk_Bjlk_HSS_BH_MT64x128x32_MI32x32x8x1_SE_AF0EM8_GRVW8_GSU1_SU32_SUS128_SRVW4_VAW2_WG64_4_1_WGM1
    SolutionIndex: 386
    SolutionNameMin: Cijk_Ailk_Bjlk_HSS_BH_MT64x64x32_MI32x32x8x1_SE_AF0EM8_GRVW2_GSU1_SU32_SUS256_SRVW4_VAW2_WG64_4_1_WGM2
    SolutionIndex: 387
    SolutionNameMin: Cijk_Ailk_Bjlk_HSS_BH_MT64x64x32_MI32x32x8x1_SE_AF0EM8_GRVW8_GSU1_SU0_SUS128_SRVW4_VAW2_WG64_4_1_WGM2
    SolutionIndex: 388
    SolutionNameMin: Cijk_Ailk_Bjlk_HSS_BH_MT64x128x32_MI32x32x8x1_SE_AF0EM8_GRVW8_GSU1_SU0_SUS128_SRVW4_VAW2_WG64_4_1_WGM15
    SolutionIndex: 389
    SolutionNameMin: Cijk_Ailk_Bjlk_HSS_BH_MT128x256x32_MI32x32x8x1_SE_AF0EM8_GRVW8_GSU1_SU0_SUS256_SRVW4_VAW2_WG64_4_1_WGM1
    SolutionIndex: 390
    SolutionNameMin: Cijk_Ailk_Bjlk_HSS_BH_MT64x256x16_MI32x32x8x1_SE_AF0EM8_GRVW8_GSU1_SU0_SUS128_SRVW4_VAW2_WG64_4_1_WGM1
    SolutionIndex: 391
    SolutionNameMin: Cijk_Ailk_Bjlk_HSS_BH_MT128x96x32_MI32x32x8x1_SE_AF0EM8_GRVW4_GSU1_SU0_SUS256_SRVW4_VAW2_WG128_2_1_WGM1
    SolutionIndex: 392
    SolutionNameMin: Cijk_Ailk_Bjlk_HSS_BH_MT128x96x32_MI32x32x8x1_SE_AF0EM8_GRVW4_GSU1_SU0_SUS128_SRVW4_VAW2_WG128_2_1_WGM1
    SolutionIndex: 393
    SolutionNameMin: Cijk_Ailk_Bjlk_HSS_BH_MT64x256x16_MI32x32x8x1_SE_AF0EM8_GRVW8_GSU1_SU0_SUS256_SRVW4_VAW2_WG64_4_1_WGM1
    SolutionIndex: 394
    SolutionNameMin: Cijk_Ailk_Bjlk_HSS_BH_MT64x128x32_MI32x32x8x1_SE_AF0EM8_GRVW8_GSU1_SU0_SUS128_SRVW4_VAW2_WG64_4_1_WGM1
    SolutionIndex: 395
    SolutionNameMin: Cijk_Ailk_Bjlk_HSS_BH_MT64x32x16_MI16x16x16x1_SE_AF0EM8_GRVW2_GSU1_SU0_SUS128_SRVW4_VAW2_WG32_8_1_WGM1
    SolutionIndex: 396
    SolutionNameMin: Cijk_Ailk_Bjlk_HSS_BH_MT64x128x16_MI32x32x8x1_SE_AF0EM8_GRVW8_GSU1_SU0_SUS256_SRVW4_VAW2_WG64_4_1_WGM1
    SolutionIndex: 397
    SolutionNameMin: Cijk_Ailk_Bjlk_HSS_BH_MT64x128x32_MI32x32x8x1_SE_AF0EM8_GRVW8_GSU1_SU0_SUS128_SRVW4_VAW2_WG64_4_1_WGM2
    SolutionIndex: 398
    SolutionNameMin: Cijk_Ailk_Bjlk_HSS_BH_MT64x64x64_MI32x32x8x1_SE_AF0EM8_GRVW8_GSU1_SU0_SUS128_SRVW4_VAW2_WG64_4_1_WGM1
    SolutionIndex: 399
    SolutionNameMin: Cijk_Ailk_Bjlk_HSS_BH_MT96x128x32_MI32x32x8x1_SE_AF0EM8_GRVW4_GSU1_SU0_SUS128_SRVW0_VAW2_WG32_8_1_WGM15
    SolutionIndex: 400
    SolutionNameMin: Cijk_Ailk_Bjlk_HSS_BH_MT128x96x16_MI32x32x8x1_SE_AF0EM8_GRVW2_GSU1_SU0_SUS128_SRVW4_VAW2_WG128_2_1_WGM1
    SolutionIndex: 401
    SolutionNameMin: Cijk_Ailk_Bjlk_HSS_BH_MT64x128x16_MI32x32x8x1_SE_AF0EM8_GRVW4_GSU1_SU0_SUS128_SRVW4_VAW2_WG64_4_1_WGM1
    SolutionIndex: 402
    SolutionNameMin: Cijk_Ailk_Bjlk_HSS_BH_MT64x128x16_MI32x32x8x1_SE_AF0EM8_GRVW4_GSU1_SU0_SUS256_SRVW4_VAW2_WG64_4_1_WGM1
    SolutionIndex: 403
    SolutionNameMin: Cijk_Ailk_Bjlk_HSS_BH_MT64x128x16_MI32x32x8x1_SE_AF0EM8_GRVW8_GSU1_SU0_SUS128_SRVW4_VAW2_WG64_4_1_WGM15
    SolutionIndex: 404
    SolutionNameMin: Cijk_Ailk_Bjlk_HSS_BH_MT64x128x16_MI32x32x8x1_SE_AF0EM8_GRVW4_GSU1_SU0_SUS256_SRVW4_VAW2_WG64_4_1_WGM2
    SolutionIndex: 405
    SolutionNameMin: Cijk_Ailk_Bjlk_HSS_BH_MT64x128x32_MI32x32x8x1_SE_AF0EM8_GRVW8_GSU1_SU0_SUS256_SRVW4_VAW2_WG64_4_1_WGM1
    SolutionIndex: 406
    SolutionNameMin: Cijk_Ailk_Bjlk_HSS_BH_MT64x128x16_MI32x32x8x1_SE_AF0EM8_GRVW8_GSU1_SU0_SUS256_SRVW4_VAW2_WG64_4_1_WGM2
    SolutionIndex: 407
    SolutionNameMin: Cijk_Ailk_Bjlk_HSS_BH_MT64x128x16_MI32x32x8x1_SE_AF0EM8_GRVW8_GSU1_SU0_SUS128_SRVW4_VAW2_WG64_4_1_WGM2
    SolutionIndex: 408
    SolutionNameMin: Cijk_Ailk_Bjlk_HSS_BH_MT128x256x32_MI32x32x8x1_SE_AF0EM8_GRVW8_GSU3_SU0_SUS128_SRVW0_VAW1_WG64_4_1_WGM1
    SolutionIndex: 409
    SolutionNameMin: Cijk_Ailk_Bjlk_HSS_BH_MT256x160x32_MI32x32x8x1_SE_AF0EM8_GRVW4_GSU2_SU0_SUS256_SRVW0_VAW1_WG128_2_1_WGM15
    SolutionIndex: 410
    SolutionNameMin: Cijk_Ailk_Bjlk_HSS_BH_MT64x32x16_MI16x16x16x1_SE_AF0EM8_GRVW2_GSU1_SU0_SUS256_SRVW4_VAW2_WG32_8_1_WGM1
    SolutionIndex: 411
    SolutionNameMin: Cijk_Ailk_Bjlk_HSS_BH_MT64x32x16_MI16x16x16x1_SE_AF0EM8_GRVW2_GSU1_SU0_SUS128_SRVW4_VAW2_WG32_8_1_WGM2
    SolutionIndex: 412
    SolutionNameMin: Cijk_Ailk_Bjlk_HSS_BH_MT128x256x32_MI32x32x8x1_SE_AF0EM8_GRVW8_GSU1_SU0_SUS128_SRVW4_VAW2_WG64_4_1_WGM1
    SolutionIndex: 413
    SolutionNameMin: Cijk_Ailk_Bjlk_HSS_BH_MT64x32x16_MI16x16x16x1_SE_AF0EM8_GRVW2_GSU1_SU0_SUS256_SRVW4_VAW2_WG32_8_1_WGM15
    SolutionIndex: 414
    SolutionNameMin: Cijk_Ailk_Bjlk_HSS_BH_MT64x32x16_MI16x16x16x1_SE_AF0EM8_GRVW2_GSU1_SU0_SUS256_SRVW4_VAW2_WG32_8_1_WGM1
    SolutionIndex: 415
    SolutionNameMin: Cijk_Ailk_Bjlk_HSS_BH_MT128x96x16_MI32x32x8x1_SE_AF0EM8_GRVW2_GSU1_SU0_SUS128_SRVW4_VAW2_WG128_2_1_WGM15
    SolutionIndex: 416
    SolutionNameMin: Cijk_Ailk_Bjlk_HSS_BH_MT128x256x32_MI32x32x8x1_SE_AF0EM8_GRVW8_GSU1_SU32_SUS256_SRVW4_VAW2_WG64_4_1_WGM1
    SolutionIndex: 417
    SolutionNameMin: Cijk_Ailk_Bjlk_HSS_BH_MT128x96x32_MI32x32x8x1_SE_AF0EM8_GRVW4_GSU1_SU0_SUS256_SRVW4_VAW2_WG128_2_1_WGM2
    SolutionIndex: 418
    SolutionNameMin: Cijk_Ailk_Bjlk_HSS_BH_MT128x96x32_MI32x32x8x1_SE_AF0EM8_GRVW4_GSU1_SU0_SUS256_SRVW4_VAW2_WG128_2_1_WGM15
    SolutionIndex: 419
    SolutionNameMin: Cijk_Ailk_Bjlk_HSS_BH_MT64x64x64_MI32x32x8x1_SE_AF0EM8_GRVW8_GSU1_SU0_SUS256_SRVW4_VAW2_WG64_4_1_WGM15
    SolutionIndex: 420
    SolutionNameMin: Cijk_Ailk_Bjlk_HSS_BH_MT64x64x64_MI32x32x8x1_SE_AF0EM8_GRVW4_GSU1_SU32_SUS256_SRVW4_VAW2_WG64_4_1_WGM1
    SolutionIndex: 421
    SolutionNameMin: Cijk_Ailk_Bjlk_HSS_BH_MT96x128x16_MI32x32x8x1_SE_AF0EM8_GRVW2_GSU1_SU0_SUS128_SRVW0_VAW2_WG32_8_1_WGM2
    SolutionIndex: 422
    SolutionNameMin: Cijk_Ailk_Bjlk_HSS_BH_MT160x128x16_MI32x32x8x1_SE_AF0EM8_GRVW2_GSU1_SU0_SUS128_SRVW0_VAW2_WG32_8_1_WGM1
    SolutionIndex: 423
    SolutionNameMin: Cijk_Ailk_Bjlk_HSS_BH_MT128x256x32_MI32x32x8x1_SE_AF0EM8_GRVW8_GSU1_SU32_SUS128_SRVW4_VAW2_WG64_4_1_WGM1
    SolutionIndex: 424
    SolutionNameMin: Cijk_Ailk_Bjlk_HSS_BH_MT64x128x32_MI32x32x8x1_SE_AF0EM8_GRVW2_GSU1_SU0_SUS256_SRVW4_VAW2_WG64_4_1_WGM1
    SolutionIndex: 425
    SolutionNameMin: Cijk_Ailk_Bjlk_HSS_BH_MT64x64x32_MI32x32x8x1_SE_AF0EM8_GRVW8_GSU1_SU0_SUS256_SRVW4_VAW2_WG64_4_1_WGM2
    SolutionIndex: 426
    SolutionNameMin: Cijk_Ailk_Bjlk_HSS_BH_MT64x16x32_MI16x16x16x1_SE_AF0EM8_GRVW8_GSU1_SU0_SUS256_SRVW0_VAW2_WG64_4_1_WGM2
    SolutionIndex: 427
    SolutionNameMin: Cijk_Ailk_Bjlk_HSS_BH_MT64x64x32_MI32x32x8x1_SE_AF0EM8_GRVW8_GSU1_SU0_SUS256_SRVW4_VAW2_WG64_4_1_WGM15
    SolutionIndex: 428
    SolutionNameMin: Cijk_Ailk_Bjlk_HSS_BH_MT128x128x64_MI32x32x8x1_SE_AF0EM8_GRVW4_GSU1_SU0_SUS256_SRVW4_VAW2_WG64_4_1_WGM1
    SolutionIndex: 429
    SolutionNameMin: Cijk_Ailk_Bjlk_HSS_BH_MT128x128x64_MI32x32x8x1_SE_AF0EM8_GRVW4_GSU1_SU32_SUS256_SRVW4_VAW2_WG64_4_1_WGM1
    SolutionIndex: 430
    SolutionNameMin: Cijk_Ailk_Bjlk_HSS_BH_MT128x256x32_MI32x32x8x1_SE_AF0EM8_GRVW4_GSU1_SU32_SUS128_SRVW4_VAW2_WG64_4_1_WGM2
    SolutionIndex: 431
    SolutionNameMin: Cijk_Ailk_Bjlk_HSS_BH_MT128x96x16_MI32x32x8x1_SE_AF0EM8_GRVW2_GSU1_SU32_SUS256_SRVW4_VAW2_WG128_2_1_WGM15
    SolutionIndex: 432
    SolutionNameMin: Cijk_Ailk_Bjlk_HSS_BH_MT128x96x32_MI32x32x8x1_SE_AF0EM8_GRVW2_GSU1_SU32_SUS128_SRVW4_VAW2_WG128_2_1_WGM2
    SolutionIndex: 433
    SolutionNameMin: Cijk_Ailk_Bjlk_HSS_BH_MT128x96x32_MI32x32x8x1_SE_AF0EM8_GRVW2_GSU1_SU0_SUS128_SRVW4_VAW2_WG128_2_1_WGM15
    SolutionIndex: 434
    SolutionNameMin: Cijk_Ailk_Bjlk_HSS_BH_MT64x32x16_MI16x16x16x1_SE_AF0EM8_GRVW4_GSU1_SU0_SUS256_SRVW4_VAW2_WG32_8_1_WGM1
    SolutionIndex: 435
    SolutionNameMin: Cijk_Ailk_Bjlk_HSS_BH_MT32x32x64_MI16x16x16x1_SE_AF0EM8_GRVW2_GSU7_SU0_SUS128_SRVW0_VAW1_WG32_8_1_WGM15
    SolutionIndex: 436
    SolutionNameMin: Cijk_Ailk_Bjlk_HSS_BH_MT128x160x32_MI32x32x8x1_SE_AF0EM8_GRVW4_GSU1_SU32_SUS128_SRVW4_VAW2_WG128_2_1_WGM2
    SolutionIndex: 437
    SolutionNameMin: Cijk_Ailk_Bjlk_HSS_BH_MT128x160x32_MI32x32x8x1_SE_AF0EM8_GRVW4_GSU1_SU0_SUS256_SRVW4_VAW2_WG128_2_1_WGM1
    SolutionIndex: 438
    SolutionNameMin: Cijk_Ailk_Bjlk_HSS_BH_MT64x16x32_MI16x16x16x1_SE_AF0EM8_GRVW8_GSU15_SU0_SUS128_SRVW0_VAW1_WG64_4_1_WGM2
    SolutionIndex: 439
    SolutionNameMin: Cijk_Ailk_Bjlk_HSS_BH_MT128x160x32_MI32x32x8x1_SE_AF0EM8_GRVW4_GSU1_SU32_SUS128_SRVW4_VAW2_WG128_2_1_WGM15
    SolutionIndex: 440
    SolutionNameMin: Cijk_Ailk_Bjlk_HSS_BH_MT64x128x32_MI32x32x8x1_SE_AF0EM8_GRVW8_GSU1_SU32_SUS256_SRVW4_VAW2_WG64_4_1_WGM1
    SolutionIndex: 441
    SolutionNameMin: Cijk_Ailk_Bjlk_HSS_BH_MT64x32x16_MI16x16x16x1_SE_AF0EM8_GRVW4_GSU1_SU0_SUS128_SRVW4_VAW2_WG32_8_1_WGM15
    SolutionIndex: 442
    SolutionNameMin: Cijk_Ailk_Bjlk_HSS_BH_MT64x128x16_MI32x32x8x1_SE_AF0EM8_GRVW4_GSU1_SU0_SUS128_SRVW4_VAW2_WG64_4_1_WGM2
    SolutionIndex: 443
    SolutionNameMin: Cijk_Ailk_Bjlk_HSS_BH_MT128x96x16_MI32x32x8x1_SE_AF0EM8_GRVW2_GSU1_SU0_SUS256_SRVW4_VAW2_WG128_2_1_WGM2
    SolutionIndex: 444
    SolutionNameMin: Cijk_Ailk_Bjlk_HSS_BH_MT64x16x32_MI16x16x16x1_SE_AF0EM8_GRVW8_GSU15_SU0_SUS128_SRVW4_VAW1_WG64_4_1_WGM1
    SolutionIndex: 445
    SolutionNameMin: Cijk_Ailk_Bjlk_HSS_BH_MT128x96x64_MI32x32x8x1_SE_AF0EM8_GRVW8_GSU1_SU0_SUS256_SRVW4_VAW2_WG128_2_1_WGM2
    SolutionIndex: 446
    SolutionNameMin: Cijk_Ailk_Bjlk_HSS_BH_MT16x64x64_MI16x16x16x1_SE_AF0EM1_GRVW8_GSU15_SU0_SUS128_SRVW4_VAW1_WG16_16_1_WGM15
    SolutionIndex: 447
    SolutionNameMin: Cijk_Ailk_Bjlk_HSS_BH_MT128x256x32_MI32x32x8x1_SE_AF0EM1_GRVW8_GSU7_SU32_SUS128_SRVW0_VAW1_WG64_4_1_WGM2
    SolutionIndex: 448
    SolutionNameMin: Cijk_Ailk_Bjlk_HSS_BH_MT32x64x16_MI16x16x16x1_SE_AF0EM1_GRVW2_GSU1_SU32_SUS256_SRVW4_VAW2_WG32_8_1_WGM15
    SolutionIndex: 449
    SolutionNameMin: Cijk_Ailk_Bjlk_HSS_BH_MT32x64x16_MI16x16x16x1_SE_AF0EM1_GRVW8_GSU1_SU0_SUS128_SRVW4_VAW2_WG32_8_1_WGM1
    SolutionIndex: 450
    SolutionNameMin: Cijk_Ailk_Bjlk_HSS_BH_MT16x16x16_MI16x16x16x1_SE_AF0EM1_GRVW4_GSU1_SU0_SUS128_SRVW0_VAW2_WG16_4_1_WGM2
    SolutionIndex: 451
    SolutionNameMin: Cijk_Ailk_Bjlk_HSS_BH_MT32x32x32_MI16x16x16x1_SE_AF0EM1_GRVW4_GSU1_SU0_SUS128_SRVW4_VAW2_WG32_8_1_WGM15
    SolutionIndex: 452
    SolutionNameMin: Cijk_Ailk_Bjlk_HSS_BH_MT16x16x16_MI16x16x16x1_SE_AF0EM1_GRVW8_GSU1_SU0_SUS128_SRVW4_VAW2_WG16_4_1_WGM1
    SolutionIndex: 453
    SolutionNameMin: Cijk_Ailk_Bjlk_HSS_BH_MT32x64x16_MI16x16x16x1_SE_AF0EM1_GRVW2_GSU1_SU0_SUS256_SRVW4_VAW2_WG32_8_1_WGM1
    SolutionIndex: 454
    SolutionNameMin: Cijk_Ailk_Bjlk_HSS_BH_MT16x16x64_MI16x16x16x1_SE_AF0EM1_GRVW4_GSU7_SU0_SUS256_SRVW0_VAW1_WG16_4_1_WGM15
    SolutionIndex: 455
    SolutionNameMin: Cijk_Ailk_Bjlk_HSS_BH_MT32x32x64_MI16x16x16x1_SE_AF0EM1_GRVW4_GSU15_SU32_SUS128_SRVW0_VAW1_WG32_8_1_WGM15
    SolutionIndex: 456
    SolutionNameMin: Cijk_Ailk_Bjlk_HSS_BH_MT16x16x32_MI16x16x16x1_SE_AF0EM1_GRVW4_GSU15_SU0_SUS128_SRVW0_VAW1_WG16_4_1_WGM1
    SolutionIndex: 457
    SolutionNameMin: Cijk_Ailk_Bjlk_HSS_BH_MT16x16x32_MI16x16x16x1_SE_AF0EM1_GRVW8_GSU3_SU0_SUS128_SRVW0_VAW1_WG16_4_1_WGM2
    SolutionIndex: 458
    SolutionNameMin: Cijk_Ailk_Bjlk_HSS_BH_MT96x128x32_MI32x32x8x1_SE_AF0EM1_GRVW4_GSU1_SU0_SUS256_SRVW0_VAW2_WG32_8_1_WGM2
    SolutionIndex: 459
    SolutionNameMin: Cijk_Ailk_Bjlk_HSS_BH_MT64x256x16_MI32x32x8x1_SE_AF0EM1_GRVW8_GSU1_SU0_SUS256_SRVW4_VAW2_WG64_4_1_WGM15
    SolutionIndex: 460
    SolutionNameMin: Cijk_Ailk_Bjlk_HSS_BH_MT128x128x64_MI32x32x8x1_SE_AF0EM1_GRVW8_GSU1_SU0_SUS128_SRVW4_VAW2_WG64_4_1_WGM15
    SolutionIndex: 461
    SolutionNameMin: Cijk_Ailk_Bjlk_HSS_BH_MT64x128x32_MI32x32x8x1_SE_AF0EM1_GRVW8_GSU1_SU0_SUS128_SRVW4_VAW2_WG64_4_1_WGM1
    SolutionIndex: 462
    SolutionNameMin: Cijk_Ailk_Bjlk_HSS_BH_MT96x128x16_MI32x32x8x1_SE_AF0EM1_GRVW2_GSU1_SU0_SUS128_SRVW0_VAW2_WG32_8_1_WGM2
    SolutionIndex: 463
    SolutionNameMin: Cijk_Ailk_Bjlk_HSS_BH_MT128x96x16_MI32x32x8x1_SE_AF0EM1_GRVW2_GSU1_SU0_SUS256_SRVW4_VAW2_WG128_2_1_WGM15
    SolutionIndex: 464
    SolutionNameMin: Cijk_Ailk_Bjlk_HSS_BH_MT128x128x64_MI32x32x8x1_SE_AF0EM1_GRVW8_GSU1_SU0_SUS256_SRVW4_VAW2_WG64_4_1_WGM15
    SolutionIndex: 465
    SolutionNameMin: Cijk_Ailk_Bjlk_HSS_BH_MT64x128x16_MI32x32x8x1_SE_AF0EM1_GRVW8_GSU1_SU0_SUS128_SRVW4_VAW2_WG64_4_1_WGM15
    SolutionIndex: 466
    SolutionNameMin: Cijk_Ailk_Bjlk_HSS_BH_MT64x128x16_MI32x32x8x1_SE_AF0EM1_GRVW4_GSU1_SU0_SUS256_SRVW4_VAW2_WG64_4_1_WGM1
    SolutionIndex: 467
    SolutionNameMin: Cijk_Ailk_Bjlk_HSS_BH_MT64x128x32_MI32x32x8x1_SE_AF0EM1_GRVW8_GSU1_SU32_SUS256_SRVW4_VAW2_WG64_4_1_WGM15
    SolutionIndex: 468
    SolutionNameMin: Cijk_Ailk_Bjlk_HSS_BH_MT96x128x32_MI32x32x8x1_SE_AF0EM1_GRVW4_GSU1_SU0_SUS256_SRVW0_VAW2_WG32_8_1_WGM1
    SolutionIndex: 469
    SolutionNameMin: Cijk_Ailk_Bjlk_HSS_BH_MT64x128x16_MI32x32x8x1_SE_AF0EM1_GRVW2_GSU1_SU0_SUS256_SRVW4_VAW2_WG64_4_1_WGM15
    SolutionIndex: 470
    SolutionNameMin: Cijk_Ailk_Bjlk_HSS_BH_MT64x128x32_MI32x32x8x1_SE_AF0EM1_GRVW8_GSU1_SU0_SUS256_SRVW4_VAW2_WG64_4_1_WGM2
    SolutionIndex: 471
    SolutionNameMin: Cijk_Ailk_Bjlk_HSS_BH_MT96x128x16_MI32x32x8x1_SE_AF0EM1_GRVW2_GSU1_SU0_SUS256_SRVW0_VAW2_WG32_8_1_WGM15
    SolutionIndex: 472
    SolutionNameMin: Cijk_Ailk_Bjlk_HSS_BH_MT64x256x16_MI32x32x8x1_SE_AF0EM1_GRVW8_GSU1_SU0_SUS128_SRVW4_VAW2_WG64_4_1_WGM15
    SolutionIndex: 473
    SolutionNameMin: Cijk_Ailk_Bjlk_HSS_BH_MT64x128x16_MI32x32x8x1_SE_AF0EM1_GRVW8_GSU1_SU0_SUS128_SRVW4_VAW2_WG64_4_1_WGM2
    SolutionIndex: 474
    SolutionNameMin: Cijk_Ailk_Bjlk_HSS_BH_MT64x128x16_MI32x32x8x1_SE_AF0EM1_GRVW8_GSU1_SU0_SUS128_SRVW4_VAW2_WG64_4_1_WGM1
    SolutionIndex: 475
    SolutionNameMin: Cijk_Ailk_Bjlk_HSS_BH_MT64x64x32_MI32x32x8x1_SE_AF0EM1_GRVW8_GSU1_SU0_SUS256_SRVW4_VAW2_WG64_4_1_WGM1
    SolutionIndex: 476
    SolutionNameMin: Cijk_Ailk_Bjlk_HSS_BH_MT64x64x16_MI32x32x8x1_SE_AF0EM1_GRVW8_GSU1_SU0_SUS128_SRVW4_VAW2_WG64_4_1_WGM1
    SolutionIndex: 477
    SolutionNameMin: Cijk_Ailk_Bjlk_HSS_BH_MT64x64x32_MI32x32x8x1_SE_AF0EM1_GRVW8_GSU1_SU0_SUS128_SRVW4_VAW2_WG64_4_1_WGM2
    SolutionIndex: 478
    SolutionNameMin: Cijk_Ailk_Bjlk_HSS_BH_MT64x128x16_MI32x32x8x1_SE_AF0EM1_GRVW8_GSU1_SU0_SUS256_SRVW4_VAW2_WG64_4_1_WGM2
    SolutionIndex: 479
    SolutionNameMin: Cijk_Ailk_Bjlk_HSS_BH_MT128x96x16_MI32x32x8x1_SE_AF0EM1_GRVW2_GSU1_SU32_SUS128_SRVW4_VAW2_WG128_2_1_WGM2
    SolutionIndex: 480
    SolutionNameMin: Cijk_Ailk_Bjlk_HSS_BH_MT128x96x32_MI32x32x8x1_SE_AF0EM1_GRVW4_GSU1_SU0_SUS256_SRVW4_VAW2_WG128_2_1_WGM2
    SolutionIndex: 481
    SolutionNameMin: Cijk_Ailk_Bjlk_HSS_BH_MT64x64x16_MI32x32x8x1_SE_AF0EM1_GRVW4_GSU1_SU0_SUS256_SRVW4_VAW2_WG64_4_1_WGM2
    SolutionIndex: 482
    SolutionNameMin: Cijk_Ailk_Bjlk_HSS_BH_MT128x96x16_MI32x32x8x1_SE_AF0EM1_GRVW2_GSU1_SU0_SUS128_SRVW4_VAW2_WG128_2_1_WGM2
    SolutionIndex: 483
    SolutionNameMin: Cijk_Ailk_Bjlk_HSS_BH_MT128x96x16_MI32x32x8x1_SE_AF0EM1_GRVW2_GSU1_SU0_SUS128_SRVW4_VAW2_WG128_2_1_WGM15
    SolutionIndex: 484
    SolutionNameMin: Cijk_Ailk_Bjlk_HSS_BH_MT64x32x16_MI16x16x16x1_SE_AF0EM1_GRVW4_GSU1_SU0_SUS128_SRVW4_VAW2_WG32_8_1_WGM1
    SolutionIndex: 485
    SolutionNameMin: Cijk_Ailk_Bjlk_HSS_BH_MT128x96x32_MI32x32x8x1_SE_AF0EM1_GRVW4_GSU1_SU0_SUS128_SRVW4_VAW2_WG128_2_1_WGM2
    SolutionIndex: 486
    SolutionNameMin: Cijk_Ailk_Bjlk_HSS_BH_MT64x64x16_MI32x32x8x1_SE_AF0EM1_GRVW2_GSU1_SU0_SUS256_SRVW4_VAW2_WG64_4_1_WGM15
    SolutionIndex: 487
    SolutionNameMin: Cijk_Ailk_Bjlk_HSS_BH_MT64x32x32_MI16x16x16x1_SE_AF0EM1_GRVW8_GSU1_SU0_SUS256_SRVW4_VAW2_WG32_8_1_WGM2
    SolutionIndex: 488
    SolutionNameMin: Cijk_Ailk_Bjlk_HSS_BH_MT32x32x64_MI16x16x16x1_SE_AF0EM1_GRVW8_GSU1_SU0_SUS128_SRVW4_VAW2_WG32_8_1_WGM2
    SolutionIndex: 489
    SolutionNameMin: Cijk_Ailk_Bjlk_HSS_BH_MT64x256x16_MI32x32x8x1_SE_AF0EM1_GRVW8_GSU1_SU0_SUS256_SRVW4_VAW2_WG64_4_1_WGM1
    SolutionIndex: 490
    SolutionNameMin: Cijk_Ailk_Bjlk_HSS_BH_MT64x256x16_MI32x32x8x1_SE_AF0EM1_GRVW8_GSU1_SU32_SUS256_SRVW4_VAW2_WG64_4_1_WGM1
    SolutionIndex: 491
    SolutionNameMin: Cijk_Ailk_Bjlk_HSS_BH_MT64x128x16_MI32x32x8x1_SE_AF0EM1_GRVW8_GSU1_SU32_SUS256_SRVW4_VAW2_WG64_4_1_WGM15
- - - [64, 64, 1, 256]
    - [18, 0.326]
  - - [128, 64, 1, 256]
    - [25, 0.65]
  - - [64, 128, 1, 256]
    - [12, 0.65]
  - - [128, 128, 1, 256]
    - [14, 0.994]
  - - [64, 256, 1, 256]
    - [0, 0.958]
  - - [128, 256, 1, 256]
    - [11, 2.638]
  - - [64, 448, 1, 256]
    - [11, 2.291]
  - - [128, 448, 1, 256]
    - [11, 4.579]
  - - [64, 704, 1, 256]
    - [16, 3.57]
  - - [128, 704, 1, 256]
    - [11, 6.909]
  - - [64, 1024, 1, 256]
    - [11, 5.106]
  - - [128, 1024, 1, 256]
    - [21, 9.589]
  - - [64, 1408, 1, 256]
    - [11, 6.909]
  - - [128, 1408, 1, 256]
    - [21, 13.084]
  - - [64, 1856, 1, 256]
    - [31, 9.179]
  - - [128, 1856, 1, 256]
    - [13, 16.74]
  - - [64, 2368, 1, 256]
    - [12, 10.919]
  - - [128, 2368, 1, 256]
    - [4, 17.603]
  - - [64, 2944, 1, 256]
    - [12, 13.275]
  - - [128, 2944, 1, 256]
    - [4, 19.519]
  - - [64, 3584, 1, 256]
    - [13, 16.045]
  - - [128, 3584, 1, 256]
    - [14, 22.43]
  - - [64, 4288, 1, 256]
    - [12, 16.036]
  - - [128, 4288, 1, 256]
    - [4, 23.376]
  - - [64, 5056, 1, 256]
    - [31, 18.567]
  - - [128, 5056, 1, 256]
    - [3, 26.167]
  - - [64, 5888, 1, 256]
    - [4, 19.007]
  - - [128, 5888, 1, 256]
    - [3, 26.075]
  - - [64, 6784, 1, 256]
    - [31, 21.229]
  - - [128, 6784, 1, 256]
    - [5, 29.719]
  - - [64, 64, 1, 1280]
    - [18, 0.452]
  - - [128, 64, 1, 1280]
    - [10, 0.779]
  - - [64, 128, 1, 1280]
    - [10, 0.77]
  - - [128, 128, 1, 1280]
    - [2, 1.545]
  - - [64, 256, 1, 1280]
    - [2, 1.596]
  - - [128, 256, 1, 1280]
    - [20, 3.668]
  - - [64, 448, 1, 1280]
    - [23, 3.231]
  - - [128, 448, 1, 1280]
    - [24, 6.465]
  - - [64, 704, 1, 1280]
    - [20, 5.031]
  - - [128, 704, 1, 1280]
    - [21, 9.682]
  - - [64, 1024, 1, 1280]
    - [15, 7.103]
  - - [128, 1024, 1, 1280]
    - [21, 13.683]
  - - [64, 1408, 1, 1280]
    - [20, 9.682]
  - - [128, 1408, 1, 1280]
    - [21, 18.693]
  - - [64, 1856, 1, 1280]
    - [32, 13.359]
  - - [128, 1856, 1, 1280]
    - [25, 23.715]
  - - [64, 2368, 1, 1280]
    - [21, 15.683]
  - - [128, 2368, 1, 1280]
    - [12, 25.389]
  - - [64, 2944, 1, 1280]
    - [25, 19.007]
  - - [128, 2944, 1, 1280]
    - [12, 25.832]
  - - [64, 3584, 1, 1280]
    - [32, 23.041]
  - - [128, 3584, 1, 1280]
    - [14, 30.276]
  - - [64, 4288, 1, 1280]
    - [12, 23.029]
  - - [128, 4288, 1, 1280]
    - [4, 29.384]
  - - [64, 5056, 1, 1280]
    - [32, 26.503]
  - - [128, 5056, 1, 1280]
    - [3, 32.435]
  - - [64, 5888, 1, 1280]
    - [12, 25.757]
  - - [128, 5888, 1, 1280]
    - [9, 31.678]
  - - [64, 6784, 1, 1280]
    - [32, 28.893]
  - - [128, 6784, 1, 1280]
    - [9, 35.714]
  - - [64, 64, 1, 3328]
    - [11, 0.452]
  - - [128, 64, 1, 3328]
    - [10, 0.889]
  - - [64, 128, 1, 3328]
    - [25, 0.988]
  - - [128, 128, 1, 3328]
    - [18, 1.767]
  - - [64, 256, 1, 3328]
    - [10, 1.791]
  - - [128, 256, 1, 3328]
    - [20, 3.944]
  - - [64, 448, 1, 3328]
    - [23, 3.462]
  - - [128, 448, 1, 3328]
    - [24, 6.942]
  - - [64, 704, 1, 3328]
    - [23, 5.423]
  - - [128, 704, 1, 3328]
    - [23, 10.49]
  - - [64, 1024, 1, 3328]
    - [23, 7.672]
  - - [128, 1024, 1, 3328]
    - [21, 14.764]
  - - [64, 1408, 1, 3328]
    - [23, 10.52]
  - - [128, 1408, 1, 3328]
    - [21, 20.172]
  - - [64, 1856, 1, 3328]
    - [32, 14.338]
  - - [128, 1856, 1, 3328]
    - [22, 25.646]
  - - [64, 2368, 1, 3328]
    - [21, 16.932]
  - - [128, 2368, 1, 3328]
    - [12, 27.126]
  - - [64, 2944, 1, 3328]
    - [32, 20.591]
  - - [128, 2944, 1, 3328]
    - [12, 27.198]
  - - [64, 3584, 1, 3328]
    - [32, 24.913]
  - - [128, 3584, 1, 3328]
    - [14, 31.875]
  - - [64, 4288, 1, 3328]
    - [18, 24.739]
  - - [128, 4288, 1, 3328]
    - [18, 30.8]
  - - [64, 5056, 1, 3328]
    - [32, 28.734]
  - - [128, 5056, 1, 3328]
    - [3, 33.747]
  - - [64, 5888, 1, 3328]
    - [12, 27.566]
  - - [128, 5888, 1, 3328]
    - [6, 32.795]
  - - [64, 6784, 1, 3328]
    - [32, 30.926]
  - - [128, 6784, 1, 3328]
    - [9, 37.086]
  - - [256, 64, 1, 256]
    - [2, 0.988]
  - - [448, 64, 1, 256]
    - [20, 2.291]
  - - [704, 64, 1, 256]
    - [11, 3.57]
  - - [1024, 64, 1, 256]
    - [21, 5.106]
  - - [1408, 64, 1, 256]
    - [11, 6.855]
  - - [1856, 64, 1, 256]
    - [13, 9.254]
  - - [2368, 64, 1, 256]
    - [32, 11.086]
  - - [2944, 64, 1, 256]
    - [31, 13.374]
  - - [3584, 64, 1, 256]
    - [13, 16.045]
  - - [4288, 64, 1, 256]
    - [12, 16.234]
  - - [5056, 64, 1, 256]
    - [31, 18.348]
  - - [5888, 64, 1, 256]
    - [8, 19.007]
  - - [6784, 64, 1, 256]
    - [4, 21.014]
  - - [256, 128, 1, 256]
    - [11, 2.617]
  - - [448, 128, 1, 256]
    - [18, 4.579]
  - - [704, 128, 1, 256]
    - [12, 6.855]
  - - [1024, 128, 1, 256]
    - [18, 9.736]
  - - [1408, 128, 1, 256]
    - [18, 13.084]
  - - [1856, 128, 1, 256]
    - [19, 16.498]
  - - [2368, 128, 1, 256]
    - [4, 17.393]
  - - [2944, 128, 1, 256]
    - [4, 19.007]
  - - [3584, 128, 1, 256]
    - [14, 22.092]
  - - [4288, 128, 1, 256]
    - [4, 23.586]
  - - [5056, 128, 1, 256]
    - [3, 24.907]
  - - [5888, 128, 1, 256]
    - [9, 25.793]
  - - [6784, 128, 1, 256]
    - [6, 28.794]
  - - [256, 64, 1, 1280]
    - [2, 1.596]
  - - [448, 64, 1, 1280]
    - [23, 3.24]
  - - [704, 64, 1, 1280]
    - [23, 5.067]
  - - [1024, 64, 1, 1280]
    - [21, 7.103]
  - - [1408, 64, 1, 1280]
    - [21, 9.703]
  - - [1856, 64, 1, 1280]
    - [32, 13.392]
  - - [2368, 64, 1, 1280]
    - [21, 15.785]
  - - [2944, 64, 1, 1280]
    - [32, 19.085]
  - - [3584, 64, 1, 1280]
    - [32, 22.993]
  - - [4288, 64, 1, 1280]
    - [18, 22.867]
  - - [5056, 64, 1, 1280]
    - [32, 26.146]
  - - [5888, 64, 1, 1280]
    - [12, 25.574]
  - - [6784, 64, 1, 1280]
    - [31, 28.695]
  - - [256, 128, 1, 1280]
    - [23, 3.686]
  - - [448, 128, 1, 1280]
    - [24, 6.465]
  - - [704, 128, 1, 1280]
    - [24, 9.703]
  - - [1024, 128, 1, 1280]
    - [21, 13.683]
  - - [1408, 128, 1, 1280]
    - [21, 18.492]
  - - [1856, 128, 1, 1280]
    - [22, 23.517]
  - - [2368, 128, 1, 1280]
    - [18, 25.257]
  - - [2944, 128, 1, 1280]
    - [4, 25.395]
  - - [3584, 128, 1, 1280]
    - [14, 29.905]
  - - [4288, 128, 1, 1280]
    - [8, 29.318]
  - - [5056, 128, 1, 1280]
    - [6, 32.133]
  - - [5888, 128, 1, 1280]
    - [3, 31.567]
  - - [6784, 128, 1, 1280]
    - [5, 35.259]
  - - [256, 64, 1, 3328]
    - [10, 1.791]
  - - [448, 64, 1, 3328]
    - [23, 3.459]
  - - [704, 64, 1, 3328]
    - [23, 5.429]
  - - [1024, 64, 1, 3328]
    - [23, 7.66]
  - - [1408, 64, 1, 3328]
    - [23, 10.49]
  - - [1856, 64, 1, 3328]
    - [32, 14.338]
  - - [2368, 64, 1, 3328]
    - [21, 16.995]
  - - [2944, 64, 1, 3328]
    - [32, 20.466]
  - - [3584, 64, 1, 3328]
    - [32, 24.784]
  - - [4288, 64, 1, 3328]
    - [18, 24.595]
  - - [5056, 64, 1, 3328]
    - [32, 28.752]
  - - [5888, 64, 1, 3328]
    - [12, 26.886]
  - - [6784, 64, 1, 3328]
    - [32, 30.627]
  - - [256, 128, 1, 3328]
    - [23, 3.953]
  - - [448, 128, 1, 3328]
    - [21, 6.936]
  - - [704, 128, 1, 3328]
    - [23, 10.481]
  - - [1024, 128, 1, 3328]
    - [21, 14.752]
  - - [1408, 128, 1, 3328]
    - [21, 20.082]
  - - [1856, 128, 1, 3328]
    - [25, 25.557]
  - - [2368, 128, 1, 3328]
    - [18, 27.186]
  - - [2944, 128, 1, 3328]
    - [12, 26.811]
  - - [3584, 128, 1, 3328]
    - [14, 31.98]
  - - [4288, 128, 1, 3328]
    - [8, 30.662]
  - - [5056, 128, 1, 3328]
    - [6, 33.804]
  - - [5888, 128, 1, 3328]
    - [9, 32.702]
  - - [6784, 128, 1, 3328]
    - [9, 36.972]
  - - [256, 256, 1, 256]
    - [11, 5.064]
  - - [448, 256, 1, 256]
    - [13, 9.008]
  - - [256, 448, 1, 256]
    - [13, 8.936]
  - - [448, 448, 1, 256]
    - [19, 14.141]
  - - [256, 256, 1, 1280]
    - [23, 7.088]
  - - [448, 256, 1, 1280]
    - [25, 12.838]
  - - [256, 448, 1, 1280]
    - [22, 12.808]
  - - [448, 448, 1, 1280]
    - [25, 20.16]
  - - [256, 256, 1, 3328]
    - [23, 7.666]
  - - [448, 256, 1, 3328]
    - [22, 13.805]
  - - [256, 448, 1, 3328]
    - [22, 13.832]
  - - [448, 448, 1, 3328]
    - [25, 21.798]
  - - [512, 16, 1, 512]
    - [8, 0.596]
  - - [512, 32, 1, 512]
    - [2, 1.207]
  - - [1024, 16, 1, 512]
    - [8, 1.231]
  - - [1024, 32, 1, 512]
    - [15, 3.141]
  - - [704, 256, 1, 256]
    - [17, 8.146]
  - - [1024, 256, 1, 256]
    - [7, 11.523]
  - - [1408, 256, 1, 256]
    - [17, 14.273]
  - - [1856, 256, 1, 256]
    - [7, 18.36]
  - - [2368, 256, 1, 256]
    - [7, 18.501]
  - - [2944, 256, 1, 256]
    - [27, 23.448]
  - - [3584, 256, 1, 256]
    - [27, 28.18]
  - - [4288, 256, 1, 256]
    - [1, 27.042]
  - - [5056, 256, 1, 256]
    - [27, 32.217]
  - - [5888, 256, 1, 256]
    - [27, 30.219]
  - - [6784, 256, 1, 256]
    - [1, 34.175]
  - - [704, 448, 1, 256]
    - [17, 12.7]
  - - [1024, 448, 1, 256]
    - [27, 18.393]
  - - [1408, 448, 1, 256]
    - [27, 19.753]
  - - [1856, 448, 1, 256]
    - [30, 25.622]
  - - [2368, 448, 1, 256]
    - [27, 26.2]
  - - [2944, 448, 1, 256]
    - [27, 32.828]
  - - [3584, 448, 1, 256]
    - [27, 32.124]
  - - [4288, 448, 1, 256]
    - [27, 37.957]
  - - [5056, 448, 1, 256]
    - [27, 35.526]
  - - [5888, 448, 1, 256]
    - [27, 36.37]
  - - [6784, 448, 1, 256]
    - [27, 36.867]
  - - [256, 704, 1, 256]
    - [17, 8.11]
  - - [448, 704, 1, 256]
    - [17, 12.488]
  - - [704, 704, 1, 256]
    - [27, 15.521]
  - - [1024, 704, 1, 256]
    - [30, 21.861]
  - - [1408, 704, 1, 256]
    - [7, 24.673]
  - - [1856, 704, 1, 256]
    - [27, 32.354]
  - - [2368, 704, 1, 256]
    - [27, 33.076]
  - - [2944, 704, 1, 256]
    - [27, 32.884]
  - - [3584, 704, 1, 256]
    - [27, 34.993]
  - - [4288, 704, 1, 256]
    - [27, 36.481]
  - - [5056, 704, 1, 256]
    - [27, 38.239]
  - - [5888, 704, 1, 256]
    - [1, 39.485]
  - - [6784, 704, 1, 256]
    - [27, 41.874]
  - - [256, 1024, 1, 256]
    - [7, 11.631]
  - - [448, 1024, 1, 256]
    - [30, 18.708]
  - - [704, 1024, 1, 256]
    - [27, 22.502]
  - - [1024, 1024, 1, 256]
    - [27, 26.305]
  - - [1408, 1024, 1, 256]
    - [27, 35.517]
  - - [1856, 1024, 1, 256]
    - [27, 37.17]
  - - [2368, 1024, 1, 256]
    - [27, 38.281]
  - - [2944, 1024, 1, 256]
    - [1, 35.888]
  - - [3584, 1024, 1, 256]
    - [27, 39.209]
  - - [4288, 1024, 1, 256]
    - [27, 42.036]
  - - [5056, 1024, 1, 256]
    - [1, 41.243]
  - - [5888, 1024, 1, 256]
    - [27, 41.24]
  - - [6784, 1024, 1, 256]
    - [27, 41.791]
  - - [256, 1408, 1, 256]
    - [17, 14.392]
  - - [448, 1408, 1, 256]
    - [30, 19.627]
  - - [704, 1408, 1, 256]
    - [27, 24.802]
  - - [1024, 1408, 1, 256]
    - [27, 35.068]
  - - [1408, 1408, 1, 256]
    - [27, 31.77]
  - - [1856, 1408, 1, 256]
    - [27, 35.879]
  - - [2368, 1408, 1, 256]
    - [27, 39.593]
  - - [2944, 1408, 1, 256]
    - [27, 39.566]
  - - [3584, 1408, 1, 256]
    - [27, 40.365]
  - - [4288, 1408, 1, 256]
    - [27, 41.563]
  - - [5056, 1408, 1, 256]
    - [27, 42.638]
  - - [5888, 1408, 1, 256]
    - [27, 44.186]
  - - [6784, 1408, 1, 256]
    - [27, 43.818]
  - - [256, 1856, 1, 256]
    - [30, 19.052]
  - - [448, 1856, 1, 256]
    - [27, 25.787]
  - - [704, 1856, 1, 256]
    - [27, 32.438]
  - - [1024, 1856, 1, 256]
    - [27, 37.092]
  - - [1408, 1856, 1, 256]
    - [27, 36.292]
  - - [1856, 1856, 1, 256]
    - [30, 37.173]
  - - [2368, 1856, 1, 256]
    - [27, 41.949]
  - - [2944, 1856, 1, 256]
    - [27, 40.464]
  - - [3584, 1856, 1, 256]
    - [1, 42.3]
  - - [4288, 1856, 1, 256]
    - [27, 42.44]
  - - [5056, 1856, 1, 256]
    - [27, 42.821]
  - - [5888, 1856, 1, 256]
    - [27, 43.782]
  - - [6784, 1856, 1, 256]
    - [27, 44.704]
  - - [256, 2368, 1, 256]
    - [27, 18.801]
  - - [448, 2368, 1, 256]
    - [27, 26.545]
  - - [704, 2368, 1, 256]
    - [27, 33.145]
  - - [1024, 2368, 1, 256]
    - [27, 38.218]
  - - [1408, 2368, 1, 256]
    - [27, 40.188]
  - - [1856, 2368, 1, 256]
    - [27, 42.033]
  - - [2368, 2368, 1, 256]
    - [27, 41.21]
  - - [2944, 2368, 1, 256]
    - [27, 41.964]
  - - [3584, 2368, 1, 256]
    - [27, 42.986]
  - - [4288, 2368, 1, 256]
    - [27, 44.291]
  - - [5056, 2368, 1, 256]
    - [27, 44.144]
  - - [5888, 2368, 1, 256]
    - [27, 44.612]
  - - [6784, 2368, 1, 256]
    - [27, 45.411]
  - - [256, 2944, 1, 256]
    - [7, 23.299]
  - - [448, 2944, 1, 256]
    - [27, 32.828]
  - - [704, 2944, 1, 256]
    - [27, 33.103]
  - - [1024, 2944, 1, 256]
    - [27, 36.568]
  - - [1408, 2944, 1, 256]
    - [27, 39.763]
  - - [1856, 2944, 1, 256]
    - [27, 40.59]
  - - [2368, 2944, 1, 256]
    - [27, 41.677]
  - - [2944, 2944, 1, 256]
    - [27, 43.854]
  - - [3584, 2944, 1, 256]
    - [29, 44.019]
  - - [4288, 2944, 1, 256]
    - [27, 44.821]
  - - [5056, 2944, 1, 256]
    - [27, 44.603]
  - - [5888, 2944, 1, 256]
    - [29, 45.202]
  - - [6784, 2944, 1, 256]
    - [27, 45.636]
  - - [256, 3584, 1, 256]
    - [27, 27.563]
  - - [448, 3584, 1, 256]
    - [27, 32.124]
  - - [704, 3584, 1, 256]
    - [27, 34.789]
  - - [1024, 3584, 1, 256]
    - [27, 39.383]
  - - [1408, 3584, 1, 256]
    - [27, 40.266]
  - - [1856, 3584, 1, 256]
    - [27, 42.725]
  - - [2368, 3584, 1, 256]
    - [27, 42.941]
  - - [2944, 3584, 1, 256]
    - [27, 44.001]
  - - [3584, 3584, 1, 256]
    - [27, 44.168]
  - - [4288, 3584, 1, 256]
    - [28, 44.818]
  - - [5056, 3584, 1, 256]
    - [27, 45.636]
  - - [5888, 3584, 1, 256]
    - [27, 46.013]
  - - [6784, 3584, 1, 256]
    - [29, 46.085]
  - - [256, 4288, 1, 256]
    - [27, 27.183]
  - - [448, 4288, 1, 256]
    - [27, 37.957]
  - - [704, 4288, 1, 256]
    - [27, 36.481]
  - - [1024, 4288, 1, 256]
    - [27, 42.036]
  - - [1408, 4288, 1, 256]
    - [27, 41.533]
  - - [1856, 4288, 1, 256]
    - [27, 42.488]
  - - [2368, 4288, 1, 256]
    - [27, 44.15]
  - - [2944, 4288, 1, 256]
    - [29, 44.821]
  - - [3584, 4288, 1, 256]
    - [27, 44.833]
  - - [4288, 4288, 1, 256]
    - [28, 45.378]
  - - [5056, 4288, 1, 256]
    - [27, 45.205]
  - - [5888, 4288, 1, 256]
    - [29, 46.007]
  - - [6784, 4288, 1, 256]
    - [29, 46.169]
  - - [256, 5056, 1, 256]
    - [1, 31.723]
  - - [448, 5056, 1, 256]
    - [27, 36.056]
  - - [704, 5056, 1, 256]
    - [27, 38.197]
  - - [1024, 5056, 1, 256]
    - [27, 41.554]
  - - [1408, 5056, 1, 256]
    - [27, 42.878]
  - - [1856, 5056, 1, 256]
    - [27, 43.006]
  - - [2368, 5056, 1, 256]
    - [27, 44.315]
  - - [2944, 5056, 1, 256]
    - [27, 44.603]
  - - [3584, 5056, 1, 256]
    - [27, 45.759]
  - - [4288, 5056, 1, 256]
    - [27, 45.214]
  - - [5056, 5056, 1, 256]
    - [27, 45.441]
  - - [5888, 5056, 1, 256]
    - [27, 45.968]
  - - [6784, 5056, 1, 256]
    - [29, 46.804]
  - - [256, 5888, 1, 256]
    - [27, 30.282]
  - - [448, 5888, 1, 256]
    - [27, 36.164]
  - - [704, 5888, 1, 256]
    - [27, 39.721]
  - - [1024, 5888, 1, 256]
    - [27, 41.389]
  - - [1408, 5888, 1, 256]
    - [27, 43.917]
  - - [1856, 5888, 1, 256]
    - [27, 43.689]
  - - [2368, 5888, 1, 256]
    - [27, 44.507]
  - - [2944, 5888, 1, 256]
    - [28, 45.178]
  - - [3584, 5888, 1, 256]
    - [27, 45.929]
  - - [4288, 5888, 1, 256]
    - [26, 46.04]
  - - [5056, 5888, 1, 256]
    - [27, 46.139]
  - - [5888, 5888, 1, 256]
    - [27, 46.136]
  - - [6784, 5888, 1, 256]
    - [28, 46.63]
  - - [256, 6784, 1, 256]
    - [1, 34.316]
  - - [448, 6784, 1, 256]
    - [27, 36.867]
  - - [704, 6784, 1, 256]
    - [27, 41.758]
  - - [1024, 6784, 1, 256]
    - [27, 41.895]
  - - [1408, 6784, 1, 256]
    - [27, 43.587]
  - - [1856, 6784, 1, 256]
    - [27, 44.77]
  - - [2368, 6784, 1, 256]
    - [27, 45.399]
  - - [2944, 6784, 1, 256]
    - [27, 45.711]
  - - [3584, 6784, 1, 256]
    - [29, 46.112]
  - - [4288, 6784, 1, 256]
    - [28, 46.184]
  - - [5056, 6784, 1, 256]
    - [26, 46.768]
  - - [5888, 6784, 1, 256]
    - [28, 46.693]
  - - [6784, 6784, 1, 256]
    - [29, 46.983]
  - - [704, 256, 1, 1280]
    - [17, 9.891]
  - - [1024, 256, 1, 1280]
    - [17, 14.353]
  - - [1408, 256, 1, 1280]
    - [17, 19.001]
  - - [1856, 256, 1, 1280]
    - [30, 25.38]
  - - [2368, 256, 1, 1280]
    - [7, 22.87]
  - - [2944, 256, 1, 1280]
    - [30, 28.324]
  - - [3584, 256, 1, 1280]
    - [30, 34.211]
  - - [4288, 256, 1, 1280]
    - [30, 31.8]
  - - [5056, 256, 1, 1280]
    - [30, 37.427]
  - - [5888, 256, 1, 1280]
    - [30, 34.148]
  - - [6784, 256, 1, 1280]
    - [30, 39.068]
  - - [704, 448, 1, 1280]
    - [17, 16.773]
  - - [1024, 448, 1, 1280]
    - [30, 24.586]
  - - [1408, 448, 1, 1280]
    - [17, 23.799]
  - - [1856, 448, 1, 1280]
    - [7, 31.076]
  - - [2368, 448, 1, 1280]
    - [7, 30.695]
  - - [2944, 448, 1, 1280]
    - [27, 37.978]
  - - [3584, 448, 1, 1280]
    - [30, 36.256]
  - - [4288, 448, 1, 1280]
    - [27, 43.255]
  - - [5056, 448, 1, 1280]
    - [27, 39.799]
  - - [5888, 448, 1, 1280]
    - [27, 39.871]
  - - [6784, 448, 1, 1280]
    - [27, 39.952]
  - - [256, 704, 1, 1280]
    - [17, 9.87]
  - - [448, 704, 1, 1280]
    - [17, 16.734]
  - - [704, 704, 1, 1280]
    - [17, 18.819]
  - - [1024, 704, 1, 1280]
    - [17, 27.027]
  - - [1408, 704, 1, 1280]
    - [30, 28.836]
  - - [1856, 704, 1, 1280]
    - [30, 37.853]
  - - [2368, 704, 1, 1280]
    - [30, 37.571]
  - - [2944, 704, 1, 1280]
    - [27, 36.457]
  - - [3584, 704, 1, 1280]
    - [27, 38.209]
  - - [4288, 704, 1, 1280]
    - [27, 39.802]
  - - [5056, 704, 1, 1280]
    - [30, 41.596]
  - - [5888, 704, 1, 1280]
    - [27, 42.776]
  - - [6784, 704, 1, 1280]
    - [30, 44.764]
  - - [256, 1024, 1, 1280]
    - [17, 14.177]
  - - [448, 1024, 1, 1280]
    - [30, 24.643]
  - - [704, 1024, 1, 1280]
    - [7, 27.156]
  - - [1024, 1024, 1, 1280]
    - [89, 33.856]
  - - [1408, 1024, 1, 1280]
    - [30, 41.491]
  - - [1856, 1024, 1, 1280]
    - [27, 42.593]
  - - [2368, 1024, 1, 1280]
    - [27, 42.497]
  - - [2944, 1024, 1, 1280]
    - [30, 39.673]
  - - [3584, 1024, 1, 1280]
    - [30, 42.743]
  - - [4288, 1024, 1, 1280]
    - [27, 45.255]
  - - [5056, 1024, 1, 1280]
    - [27, 44.282]
  - - [5888, 1024, 1, 1280]
    - [27, 43.953]
  - - [6784, 1024, 1, 1280]
    - [27, 44.174]
  - - [256, 1408, 1, 1280]
    - [17, 19.148]
  - - [448, 1408, 1, 1280]
    - [17, 23.856]
  - - [704, 1408, 1, 1280]
    - [30, 28.872]
  - - [1024, 1408, 1, 1280]
    - [30, 41.44]
  - - [1408, 1408, 1, 1280]
    - [27, 34.897]
  - - [1856, 1408, 1, 1280]
    - [27, 39.488]
  - - [2368, 1408, 1, 1280]
    - [30, 43.767]
  - - [2944, 1408, 1, 1280]
    - [27, 42.842]
  - - [3584, 1408, 1, 1280]
    - [27, 43.231]
  - - [4288, 1408, 1, 1280]
    - [27, 44.019]
  - - [5056, 1408, 1, 1280]
    - [27, 45.16]
  - - [5888, 1408, 1, 1280]
    - [27, 46.633]
  - - [6784, 1408, 1, 1280]
    - [27, 45.959]
  - - [256, 1856, 1, 1280]
    - [30, 25.41]
  - - [448, 1856, 1, 1280]
    - [30, 31.127]
  - - [704, 1856, 1, 1280]
    - [30, 37.67]
  - - [1024, 1856, 1, 1280]
    - [30, 42.833]
  - - [1408, 1856, 1, 1280]
    - [27, 39.524]
  - - [1856, 1856, 1, 1280]
    - [30, 40.266]
  - - [2368, 1856, 1, 1280]
    - [27, 45.22]
  - - [2944, 1856, 1, 1280]
    - [30, 43.21]
  - - [3584, 1856, 1, 1280]
    - [27, 45.229]
  - - [4288, 1856, 1, 1280]
    - [27, 44.842]
  - - [5056, 1856, 1, 1280]
    - [30, 45.163]
  - - [5888, 1856, 1, 1280]
    - [27, 45.83]
  - - [6784, 1856, 1, 1280]
    - [27, 46.858]
  - - [256, 2368, 1, 1280]
    - [17, 22.834]
  - - [448, 2368, 1, 1280]
    - [30, 30.788]
  - - [704, 2368, 1, 1280]
    - [30, 37.661]
  - - [1024, 2368, 1, 1280]
    - [27, 42.512]
  - - [1408, 2368, 1, 1280]
    - [27, 43.743]
  - - [1856, 2368, 1, 1280]
    - [27, 45.288]
  - - [2368, 2368, 1, 1280]
    - [30, 44.234]
  - - [2944, 2368, 1, 1280]
    - [27, 44.273]
  - - [3584, 2368, 1, 1280]
    - [27, 45.244]
  - - [4288, 2368, 1, 1280]
    - [27, 46.522]
  - - [5056, 2368, 1, 1280]
    - [27, 46.25]
  - - [5888, 2368, 1, 1280]
    - [27, 46.603]
  - - [6784, 2368, 1, 1280]
    - [27, 47.31]
  - - [256, 2944, 1, 1280]
    - [7, 28.258]
  - - [448, 2944, 1, 1280]
    - [30, 38.092]
  - - [704, 2944, 1, 1280]
    - [27, 36.511]
  - - [1024, 2944, 1, 1280]
    - [27, 39.608]
  - - [1408, 2944, 1, 1280]
    - [27, 42.767]
  - - [1856, 2944, 1, 1280]
    - [30, 43.225]
  - - [2368, 2944, 1, 1280]
    - [27, 44.285]
  - - [2944, 2944, 1, 1280]
    - [30, 46.235]
  - - [3584, 2944, 1, 1280]
    - [27, 46.241]
  - - [4288, 2944, 1, 1280]
    - [27, 46.98]
  - - [5056, 2944, 1, 1280]
    - [27, 46.609]
  - - [5888, 2944, 1, 1280]
    - [27, 46.831]
  - - [6784, 2944, 1, 1280]
    - [27, 47.445]
  - - [256, 3584, 1, 1280]
    - [7, 34.025]
  - - [448, 3584, 1, 1280]
    - [30, 36.203]
  - - [704, 3584, 1, 1280]
    - [30, 38.161]
  - - [1024, 3584, 1, 1280]
    - [30, 42.62]
  - - [1408, 3584, 1, 1280]
    - [30, 43.216]
  - - [1856, 3584, 1, 1280]
    - [30, 45.202]
  - - [2368, 3584, 1, 1280]
    - [30, 45.199]
  - - [2944, 3584, 1, 1280]
    - [27, 46.187]
  - - [3584, 3584, 1, 1280]
    - [27, 46.055]
  - - [4288, 3584, 1, 1280]
    - [27, 46.669]
  - - [5056, 3584, 1, 1280]
    - [27, 47.681]
  - - [5888, 3584, 1, 1280]
    - [27, 47.879]
  - - [6784, 3584, 1, 1280]
    - [28, 47.645]
  - - [256, 4288, 1, 1280]
    - [30, 31.8]
  - - [448, 4288, 1, 1280]
    - [27, 43.132]
  - - [704, 4288, 1, 1280]
    - [27, 39.727]
  - - [1024, 4288, 1, 1280]
    - [27, 45.187]
  - - [1408, 4288, 1, 1280]
    - [27, 44.01]
  - - [1856, 4288, 1, 1280]
    - [27, 44.815]
  - - [2368, 4288, 1, 1280]
    - [27, 46.507]
  - - [2944, 4288, 1, 1280]
    - [30, 46.968]
  - - [3584, 4288, 1, 1280]
    - [27, 46.615]
  - - [4288, 4288, 1, 1280]
    - [27, 47.121]
  - - [5056, 4288, 1, 1280]
    - [27, 47.004]
  - - [5888, 4288, 1, 1280]
    - [29, 47.439]
  - - [6784, 4288, 1, 1280]
    - [29, 47.469]
  - - [256, 5056, 1, 1280]
    - [30, 37.362]
  - - [448, 5056, 1, 1280]
    - [27, 39.739]
  - - [704, 5056, 1, 1280]
    - [30, 41.476]
  - - [1024, 5056, 1, 1280]
    - [27, 44.243]
  - - [1408, 5056, 1, 1280]
    - [27, 45.226]
  - - [1856, 5056, 1, 1280]
    - [30, 45.136]
  - - [2368, 5056, 1, 1280]
    - [27, 46.313]
  - - [2944, 5056, 1, 1280]
    - [27, 46.639]
  - - [3584, 5056, 1, 1280]
    - [27, 47.588]
  - - [4288, 5056, 1, 1280]
    - [27, 47.013]
  - - [5056, 5056, 1, 1280]
    - [27, 47.109]
  - - [5888, 5056, 1, 1280]
    - [27, 47.747]
  - - [6784, 5056, 1, 1280]
    - [29, 48.044]
  - - [256, 5888, 1, 1280]
    - [30, 34.034]
  - - [448, 5888, 1, 1280]
    - [30, 39.883]
  - - [704, 5888, 1, 1280]
    - [27, 42.815]
  - - [1024, 5888, 1, 1280]
    - [27, 43.965]
  - - [1408, 5888, 1, 1280]
    - [27, 46.66]
  - - [1856, 5888, 1, 1280]
    - [27, 45.923]
  - - [2368, 5888, 1, 1280]
    - [27, 46.627]
  - - [2944, 5888, 1, 1280]
    - [27, 46.864]
  - - [3584, 5888, 1, 1280]
    - [27, 47.861]
  - - [4288, 5888, 1, 1280]
    - [27, 47.519]
  - - [5056, 5888, 1, 1280]
    - [27, 47.795]
  - - [5888, 5888, 1, 1280]
    - [27, 47.888]
  - - [6784, 5888, 1, 1280]
    - [28, 47.9]
  - - [256, 6784, 1, 1280]
    - [30, 39.14]
  - - [448, 6784, 1, 1280]
    - [30, 39.952]
  - - [704, 6784, 1, 1280]
    - [30, 44.827]
  - - [1024, 6784, 1, 1280]
    - [30, 44.186]
  - - [1408, 6784, 1, 1280]
    - [30, 45.947]
  - - [1856, 6784, 1, 1280]
    - [30, 46.906]
  - - [2368, 6784, 1, 1280]
    - [27, 47.262]
  - - [2944, 6784, 1, 1280]
    - [27, 47.442]
  - - [3584, 6784, 1, 1280]
    - [28, 47.516]
  - - [4288, 6784, 1, 1280]
    - [28, 47.534]
  - - [5056, 6784, 1, 1280]
    - [28, 48.061]
  - - [5888, 6784, 1, 1280]
    - [29, 47.864]
  - - [6784, 6784, 1, 1280]
    - [28, 48.244]
  - - [704, 256, 1, 3328]
    - [17, 10.242]
  - - [1024, 256, 1, 3328]
    - [223, 19.393]
  - - [1408, 256, 1, 3328]
    - [17, 20.136]
  - - [1856, 256, 1, 3328]
    - [30, 26.712]
  - - [2368, 256, 1, 3328]
    - [17, 23.712]
  - - [2944, 256, 1, 3328]
    - [17, 29.258]
  - - [3584, 256, 1, 3328]
    - [30, 35.463]
  - - [4288, 256, 1, 3328]
    - [30, 32.702]
  - - [5056, 256, 1, 3328]
    - [30, 38.329]
  - - [5888, 256, 1, 3328]
    - [30, 34.879]
  - - [6784, 256, 1, 3328]
    - [30, 39.97]
  - - [704, 448, 1, 3328]
    - [17, 17.636]
  - - [1024, 448, 1, 3328]
    - [30, 25.847]
  - - [1408, 448, 1, 3328]
    - [17, 24.649]
  - - [1856, 448, 1, 3328]
    - [17, 32.259]
  - - [2368, 448, 1, 3328]
    - [30, 31.609]
  - - [2944, 448, 1, 3328]
    - [30, 39.14]
  - - [3584, 448, 1, 3328]
    - [30, 37.098]
  - - [4288, 448, 1, 3328]
    - [30, 44.204]
  - - [5056, 448, 1, 3328]
    - [27, 40.515]
  - - [5888, 448, 1, 3328]
    - [30, 40.596]
  - - [6784, 448, 1, 3328]
    - [30, 40.542]
  - - [256, 704, 1, 3328]
    - [17, 10.239]
  - - [448, 704, 1, 3328]
    - [17, 17.651]
  - - [704, 704, 1, 3328]
    - [17, 19.459]
  - - [1024, 704, 1, 3328]
    - [17, 28.066]
  - - [1408, 704, 1, 3328]
    - [30, 29.626]
  - - [1856, 704, 1, 3328]
    - [30, 38.673]
  - - [2368, 704, 1, 3328]
    - [30, 38.473]
  - - [2944, 704, 1, 3328]
    - [27, 37.08]
  - - [3584, 704, 1, 3328]
    - [30, 38.829]
  - - [4288, 704, 1, 3328]
    - [30, 40.32]
  - - [5056, 704, 1, 3328]
    - [30, 42.12]
  - - [5888, 704, 1, 3328]
    - [27, 43.369]
  - - [6784, 704, 1, 3328]
    - [30, 45.315]
  - - [256, 1024, 1, 3328]
    - [17, 14.737]
  - - [448, 1024, 1, 3328]
    - [30, 25.871]
  - - [704, 1024, 1, 3328]
    - [17, 28.117]
  - - [1024, 1024, 1, 3328]
    - [30, 31.312]
  - - [1408, 1024, 1, 3328]
    - [30, 42.614]
  - - [1856, 1024, 1, 3328]
    - [30, 43.749]
  - - [2368, 1024, 1, 3328]
    - [27, 43.24]
  - - [2944, 1024, 1, 3328]
    - [30, 40.254]
  - - [3584, 1024, 1, 3328]
    - [30, 43.435]
  - - [4288, 1024, 1, 3328]
    - [27, 45.845]
  - - [5056, 1024, 1, 3328]
    - [30, 44.8]
  - - [5888, 1024, 1, 3328]
    - [27, 44.441]
  - - [6784, 1024, 1, 3328]
    - [27, 44.567]
  - - [256, 1408, 1, 3328]
    - [17, 20.127]
  - - [448, 1408, 1, 3328]
    - [17, 24.64]
  - - [704, 1408, 1, 3328]
    - [30, 29.614]
  - - [1024, 1408, 1, 3328]
    - [30, 42.602]
  - - [1408, 1408, 1, 3328]
    - [27, 35.577]
  - - [1856, 1408, 1, 3328]
    - [30, 40.153]
  - - [2368, 1408, 1, 3328]
    - [30, 44.39]
  - - [2944, 1408, 1, 3328]
    - [27, 43.348]
  - - [3584, 1408, 1, 3328]
    - [30, 43.692]
  - - [4288, 1408, 1, 3328]
    - [27, 44.471]
  - - [5056, 1408, 1, 3328]
    - [30, 45.669]
  - - [5888, 1408, 1, 3328]
    - [27, 47.046]
  - - [6784, 1408, 1, 3328]
    - [27, 46.337]
  - - [256, 1856, 1, 3328]
    - [30, 26.686]
  - - [448, 1856, 1, 3328]
    - [30, 32.28]
  - - [704, 1856, 1, 3328]
    - [30, 38.775]
  - - [1024, 1856, 1, 3328]
    - [30, 43.782]
  - - [1408, 1856, 1, 3328]
    - [30, 40.236]
  - - [1856, 1856, 1, 3328]
    - [30, 40.796]
  - - [2368, 1856, 1, 3328]
    - [27, 45.845]
  - - [2944, 1856, 1, 3328]
    - [30, 43.647]
  - - [3584, 1856, 1, 3328]
    - [30, 45.678]
  - - [4288, 1856, 1, 3328]
    - [27, 45.273]
  - - [5056, 1856, 1, 3328]
    - [30, 45.588]
  - - [5888, 1856, 1, 3328]
    - [27, 46.199]
  - - [6784, 1856, 1, 3328]
    - [27, 47.202]
  - - [256, 2368, 1, 3328]
    - [17, 23.688]
  - - [448, 2368, 1, 3328]
    - [30, 31.603]
  - - [704, 2368, 1, 3328]
    - [30, 38.383]
  - - [1024, 2368, 1, 3328]
    - [30, 43.192]
  - - [1408, 2368, 1, 3328]
    - [27, 44.342]
  - - [1856, 2368, 1, 3328]
    - [27, 45.833]
  - - [2368, 2368, 1, 3328]
    - [30, 44.77]
  - - [2944, 2368, 1, 3328]
    - [27, 44.681]
  - - [3584, 2368, 1, 3328]
    - [30, 45.585]
  - - [4288, 2368, 1, 3328]
    - [27, 46.834]
  - - [5056, 2368, 1, 3328]
    - [27, 46.555]
  - - [5888, 2368, 1, 3328]
    - [30, 46.915]
  - - [6784, 2368, 1, 3328]
    - [27, 47.594]
  - - [256, 2944, 1, 3328]
    - [17, 29.231]
  - - [448, 2944, 1, 3328]
    - [30, 39.14]
  - - [704, 2944, 1, 3328]
    - [27, 37.029]
  - - [1024, 2944, 1, 3328]
    - [30, 40.191]
  - - [1408, 2944, 1, 3328]
    - [30, 43.282]
  - - [1856, 2944, 1, 3328]
    - [30, 43.602]
  - - [2368, 2944, 1, 3328]
    - [27, 44.725]
  - - [2944, 2944, 1, 3328]
    - [30, 46.549]
  - - [3584, 2944, 1, 3328]
    - [30, 46.585]
  - - [4288, 2944, 1, 3328]
    - [27, 47.277]
  - - [5056, 2944, 1, 3328]
    - [27, 46.882]
  - - [5888, 2944, 1, 3328]
    - [30, 47.091]
  - - [6784, 2944, 1, 3328]
    - [27, 47.708]
  - - [256, 3584, 1, 3328]
    - [17, 35.397]
  - - [448, 3584, 1, 3328]
    - [30, 37.008]
  - - [704, 3584, 1, 3328]
    - [30, 38.748]
  - - [1024, 3584, 1, 3328]
    - [30, 43.345]
  - - [1408, 3584, 1, 3328]
    - [30, 43.635]
  - - [1856, 3584, 1, 3328]
    - [30, 45.636]
  - - [2368, 3584, 1, 3328]
    - [30, 45.573]
  - - [2944, 3584, 1, 3328]
    - [27, 46.546]
  - - [3584, 3584, 1, 3328]
    - [30, 46.319]
  - - [4288, 3584, 1, 3328]
    - [27, 46.891]
  - - [5056, 3584, 1, 3328]
    - [27, 47.927]
  - - [5888, 3584, 1, 3328]
    - [27, 48.103]
  - - [6784, 3584, 1, 3328]
    - [27, 47.741]
  - - [256, 4288, 1, 3328]
    - [30, 32.693]
  - - [448, 4288, 1, 3328]
    - [30, 44.067]
  - - [704, 4288, 1, 3328]
    - [30, 40.278]
  - - [1024, 4288, 1, 3328]
    - [27, 45.759]
  - - [1408, 4288, 1, 3328]
    - [30, 44.42]
  - - [1856, 4288, 1, 3328]
    - [30, 45.187]
  - - [2368, 4288, 1, 3328]
    - [27, 46.834]
  - - [2944, 4288, 1, 3328]
    - [27, 47.253]
  - - [3584, 4288, 1, 3328]
    - [27, 46.944]
  - - [4288, 4288, 1, 3328]
    - [30, 47.409]
  - - [5056, 4288, 1, 3328]
    - [27, 47.265]
  - - [5888, 4288, 1, 3328]
    - [27, 47.678]
  - - [6784, 4288, 1, 3328]
    - [27, 47.657]
  - - [256, 5056, 1, 3328]
    - [30, 38.401]
  - - [448, 5056, 1, 3328]
    - [30, 40.404]
  - - [704, 5056, 1, 3328]
    - [30, 42.09]
  - - [1024, 5056, 1, 3328]
    - [30, 44.761]
  - - [1408, 5056, 1, 3328]
    - [30, 45.606]
  - - [1856, 5056, 1, 3328]
    - [30, 45.498]
  - - [2368, 5056, 1, 3328]
    - [27, 46.558]
  - - [2944, 5056, 1, 3328]
    - [27, 46.858]
  - - [3584, 5056, 1, 3328]
    - [27, 47.891]
  - - [4288, 5056, 1, 3328]
    - [27, 47.208]
  - - [5056, 5056, 1, 3328]
    - [27, 47.355]
  - - [5888, 5056, 1, 3328]
    - [30, 47.975]
  - - [6784, 5056, 1, 3328]
    - [27, 48.202]
  - - [256, 5888, 1, 3328]
    - [30, 34.852]
  - - [448, 5888, 1, 3328]
    - [30, 40.554]
  - - [704, 5888, 1, 3328]
    - [27, 43.267]
  - - [1024, 5888, 1, 3328]
    - [27, 44.333]
  - - [1408, 5888, 1, 3328]
    - [30, 47.019]
  - - [1856, 5888, 1, 3328]
    - [27, 46.205]
  - - [2368, 5888, 1, 3328]
    - [27, 46.852]
  - - [2944, 5888, 1, 3328]
    - [27, 47.106]
  - - [3584, 5888, 1, 3328]
    - [27, 48.053]
  - - [4288, 5888, 1, 3328]
    - [27, 47.687]
  - - [5056, 5888, 1, 3328]
    - [27, 47.972]
  - - [5888, 5888, 1, 3328]
    - [27, 48.058]
  - - [6784, 5888, 1, 3328]
    - [28, 48.02]
  - - [256, 6784, 1, 3328]
    - [30, 39.991]
  - - [448, 6784, 1, 3328]
    - [30, 40.53]
  - - [704, 6784, 1, 3328]
    - [30, 45.357]
  - - [1024, 6784, 1, 3328]
    - [30, 44.549]
  - - [1408, 6784, 1, 3328]
    - [30, 46.292]
  - - [1856, 6784, 1, 3328]
    - [27, 47.121]
  - - [2368, 6784, 1, 3328]
    - [27, 47.546]
  - - [2944, 6784, 1, 3328]
    - [27, 47.738]
  - - [3584, 6784, 1, 3328]
    - [27, 47.69]
  - - [4288, 6784, 1, 3328]
    - [30, 47.645]
  - - [5056, 6784, 1, 3328]
    - [27, 48.178]
  - - [5888, 6784, 1, 3328]
    - [27, 47.981]
  - - [6784, 6784, 1, 3328]
    - [29, 48.256]
  - - [1024, 1024, 1, 1024]
    - [76, 32.104]
  - - [1760, 7133, 1, 1760]
    - [1, 46.558]
  - - [2048, 7133, 1, 2048]
    - [27, 47.328]
  - - [2560, 7133, 1, 2560]
    - [27, 46.935]
  - - [3072, 7435, 1, 1024]
    - [27, 47.271]
  - - [4096, 7133, 1, 4096]
    - [27, 47.855]
  - - [7680, 5481, 1, 2560]
    - [29, 48.133]
  - - [32, 32, 1, 32]
    - [33, 0.006]
  - - [32, 64, 1, 256]
    - [38, 0.042]
  - - [32, 128, 1, 256]
    - [38, 0.084]
  - - [32, 256, 1, 256]
    - [40, 0.171]
  - - [32, 448, 1, 256]
    - [40, 0.314]
  - - [32, 704, 1, 256]
    - [38, 0.506]
  - - [32, 1024, 1, 256]
    - [38, 0.731]
  - - [32, 1408, 1, 256]
    - [38, 1.009]
  - - [32, 1856, 1, 256]
    - [38, 1.342]
  - - [32, 2368, 1, 256]
    - [40, 1.722]
  - - [32, 2944, 1, 256]
    - [45, 2.108]
  - - [32, 3584, 1, 256]
    - [40, 2.593]
  - - [32, 4288, 1, 256]
    - [40, 3.031]
  - - [32, 5056, 1, 256]
    - [38, 3.588]
  - - [32, 5888, 1, 256]
    - [38, 3.899]
  - - [32, 6784, 1, 256]
    - [42, 5.268]
  - - [32, 64, 1, 1280]
    - [42, 0.06]
  - - [32, 128, 1, 1280]
    - [43, 0.12]
  - - [32, 256, 1, 1280]
    - [43, 0.24]
  - - [32, 448, 1, 1280]
    - [42, 0.422]
  - - [32, 704, 1, 1280]
    - [43, 0.671]
  - - [32, 1024, 1, 1280]
    - [42, 0.982]
  - - [32, 1408, 1, 1280]
    - [43, 1.342]
  - - [32, 1856, 1, 1280]
    - [43, 1.758]
  - - [32, 2368, 1, 1280]
    - [43, 2.24]
  - - [32, 2944, 1, 1280]
    - [43, 2.812]
  - - [32, 3584, 1, 1280]
    - [43, 3.423]
  - - [32, 4288, 1, 1280]
    - [43, 4.049]
  - - [32, 5056, 1, 1280]
    - [43, 4.732]
  - - [32, 5888, 1, 1280]
    - [45, 5.486]
  - - [32, 6784, 1, 1280]
    - [46, 6.588]
  - - [32, 64, 1, 3328]
    - [43, 0.066]
  - - [32, 128, 1, 3328]
    - [43, 0.132]
  - - [32, 256, 1, 3328]
    - [43, 0.264]
  - - [32, 448, 1, 3328]
    - [43, 0.464]
  - - [32, 704, 1, 3328]
    - [43, 0.731]
  - - [32, 1024, 1, 3328]
    - [43, 1.066]
  - - [32, 1408, 1, 3328]
    - [43, 1.464]
  - - [32, 1856, 1, 3328]
    - [43, 1.932]
  - - [32, 2368, 1, 3328]
    - [43, 2.462]
  - - [32, 2944, 1, 3328]
    - [43, 3.058]
  - - [32, 3584, 1, 3328]
    - [43, 3.725]
  - - [32, 4288, 1, 3328]
    - [43, 4.465]
  - - [32, 5056, 1, 3328]
    - [43, 5.244]
  - - [32, 5888, 1, 3328]
    - [43, 6.088]
  - - [32, 6784, 1, 3328]
    - [43, 6.954]
  - - [64, 32, 1, 256]
    - [38, 0.042]
  - - [128, 32, 1, 256]
    - [40, 0.087]
  - - [256, 32, 1, 256]
    - [38, 0.174]
  - - [448, 32, 1, 256]
    - [40, 0.326]
  - - [704, 32, 1, 256]
    - [42, 0.497]
  - - [1024, 32, 1, 256]
    - [38, 0.734]
  - - [1408, 32, 1, 256]
    - [40, 1.0]
  - - [1856, 32, 1, 256]
    - [40, 1.321]
  - - [2368, 32, 1, 256]
    - [40, 1.701]
  - - [2944, 32, 1, 256]
    - [40, 2.099]
  - - [3584, 32, 1, 256]
    - [40, 2.554]
  - - [4288, 32, 1, 256]
    - [38, 3.022]
  - - [5056, 32, 1, 256]
    - [40, 3.549]
  - - [5888, 32, 1, 256]
    - [38, 3.917]
  - - [6784, 32, 1, 256]
    - [43, 5.447]
  - - [64, 32, 1, 1280]
    - [43, 0.06]
  - - [128, 32, 1, 1280]
    - [43, 0.12]
  - - [256, 32, 1, 1280]
    - [43, 0.24]
  - - [448, 32, 1, 1280]
    - [43, 0.425]
  - - [704, 32, 1, 1280]
    - [43, 0.665]
  - - [1024, 32, 1, 1280]
    - [45, 0.973]
  - - [1408, 32, 1, 1280]
    - [43, 1.321]
  - - [1856, 32, 1, 1280]
    - [43, 1.755]
  - - [2368, 32, 1, 1280]
    - [43, 2.243]
  - - [2944, 32, 1, 1280]
    - [43, 2.785]
  - - [3584, 32, 1, 1280]
    - [43, 3.411]
  - - [4288, 32, 1, 1280]
    - [42, 4.019]
  - - [5056, 32, 1, 1280]
    - [42, 4.759]
  - - [5888, 32, 1, 1280]
    - [43, 5.489]
  - - [6784, 32, 1, 1280]
    - [40, 6.492]
  - - [64, 32, 1, 3328]
    - [43, 0.066]
  - - [128, 32, 1, 3328]
    - [43, 0.132]
  - - [256, 32, 1, 3328]
    - [43, 0.267]
  - - [448, 32, 1, 3328]
    - [43, 0.464]
  - - [704, 32, 1, 3328]
    - [43, 0.731]
  - - [1024, 32, 1, 3328]
    - [43, 1.06]
  - - [1408, 32, 1, 3328]
    - [43, 1.464]
  - - [1856, 32, 1, 3328]
    - [43, 1.932]
  - - [2368, 32, 1, 3328]
    - [43, 2.459]
  - - [2944, 32, 1, 3328]
    - [43, 3.058]
  - - [3584, 32, 1, 3328]
    - [43, 3.728]
  - - [4288, 32, 1, 3328]
    - [43, 4.456]
  - - [5056, 32, 1, 3328]
    - [43, 5.232]
  - - [5888, 32, 1, 3328]
    - [43, 6.094]
  - - [6784, 32, 1, 3328]
    - [42, 7.058]
  - - [64, 64, 1, 32]
    - [46, 0.039]
  - - [128, 64, 1, 32]
    - [34, 0.045]
  - - [256, 64, 1, 32]
    - [34, 0.102]
  - - [448, 64, 1, 32]
    - [40, 0.192]
  - - [704, 64, 1, 32]
    - [38, 0.279]
  - - [1024, 64, 1, 32]
    - [40, 0.416]
  - - [1408, 64, 1, 32]
    - [38, 0.554]
  - - [1856, 64, 1, 32]
    - [38, 0.734]
  - - [2368, 64, 1, 32]
    - [36, 0.913]
  - - [2944, 64, 1, 32]
    - [38, 1.162]
  - - [3584, 64, 1, 32]
    - [40, 1.396]
  - - [4288, 64, 1, 32]
    - [38, 1.602]
  - - [5056, 64, 1, 32]
    - [38, 1.836]
  - - [5888, 64, 1, 32]
    - [38, 2.006]
  - - [6784, 64, 1, 32]
    - [38, 3.612]
  - - [64, 128, 1, 32]
    - [46, 0.054]
  - - [128, 128, 1, 32]
    - [40, 0.117]
  - - [256, 128, 1, 32]
    - [38, 0.207]
  - - [448, 128, 1, 32]
    - [34, 0.362]
  - - [704, 128, 1, 32]
    - [38, 0.578]
  - - [1024, 128, 1, 32]
    - [36, 0.806]
  - - [1408, 128, 1, 32]
    - [40, 1.162]
  - - [1856, 128, 1, 32]
    - [40, 1.53]
  - - [2368, 128, 1, 32]
    - [40, 1.932]
  - - [2944, 128, 1, 32]
    - [40, 2.39]
  - - [3584, 128, 1, 32]
    - [42, 3.764]
  - - [4288, 128, 1, 32]
    - [38, 4.567]
  - - [5056, 128, 1, 32]
    - [38, 5.384]
  - - [5888, 128, 1, 32]
    - [38, 6.1]
  - - [6784, 128, 1, 32]
    - [40, 6.843]
  - - [64, 256, 1, 32]
    - [34, 0.09]
  - - [128, 256, 1, 32]
    - [36, 0.21]
  - - [256, 256, 1, 32]
    - [38, 0.44]
  - - [448, 256, 1, 32]
    - [36, 0.719]
  - - [704, 256, 1, 32]
    - [34, 1.129]
  - - [1024, 256, 1, 32]
    - [38, 1.653]
  - - [1408, 256, 1, 32]
    - [40, 2.087]
  - - [1856, 256, 1, 32]
    - [40, 4.094]
  - - [2368, 256, 1, 32]
    - [40, 5.262]
  - - [2944, 256, 1, 32]
    - [40, 6.403]
  - - [3584, 256, 1, 32]
    - [38, 6.912]
  - - [4288, 256, 1, 32]
    - [38, 8.217]
  - - [5056, 256, 1, 32]
    - [38, 9.014]
  - - [5888, 256, 1, 32]
    - [40, 9.655]
  - - [6784, 256, 1, 32]
    - [38, 10.454]
  - - [64, 448, 1, 32]
    - [34, 0.171]
  - - [128, 448, 1, 32]
    - [38, 0.359]
  - - [256, 448, 1, 32]
    - [40, 0.716]
  - - [448, 448, 1, 32]
    - [40, 1.306]
  - - [704, 448, 1, 32]
    - [40, 1.967]
  - - [1024, 448, 1, 32]
    - [40, 3.869]
  - - [1408, 448, 1, 32]
    - [38, 5.357]
  - - [1856, 448, 1, 32]
    - [38, 6.777]
  - - [2368, 448, 1, 32]
    - [40, 8.044]
  - - [2944, 448, 1, 32]
    - [40, 9.134]
  - - [3584, 448, 1, 32]
    - [40, 10.23]
  - - [4288, 448, 1, 32]
    - [40, 10.46]
  - - [5056, 448, 1, 32]
    - [45, 11.497]
  - - [5888, 448, 1, 32]
    - [45, 12.152]
  - - [6784, 448, 1, 32]
    - [38, 12.73]
  - - [64, 704, 1, 32]
    - [40, 0.299]
  - - [128, 704, 1, 32]
    - [38, 0.587]
  - - [256, 704, 1, 32]
    - [36, 1.174]
  - - [448, 704, 1, 32]
    - [40, 2.042]
  - - [704, 704, 1, 32]
    - [38, 4.303]
  - - [1024, 704, 1, 32]
    - [38, 6.214]
  - - [1408, 704, 1, 32]
    - [40, 7.283]
  - - [1856, 704, 1, 32]
    - [40, 8.697]
  - - [2368, 704, 1, 32]
    - [40, 10.242]
  - - [2944, 704, 1, 32]
    - [42, 11.134]
  - - [3584, 704, 1, 32]
    - [40, 12.188]
  - - [4288, 704, 1, 32]
    - [42, 13.054]
  - - [5056, 704, 1, 32]
    - [40, 13.71]
  - - [5888, 704, 1, 32]
    - [42, 14.27]
  - - [6784, 704, 1, 32]
    - [45, 14.668]
  - - [64, 1024, 1, 32]
    - [38, 0.413]
  - - [128, 1024, 1, 32]
    - [36, 0.853]
  - - [256, 1024, 1, 32]
    - [40, 1.698]
  - - [448, 1024, 1, 32]
    - [38, 4.04]
  - - [704, 1024, 1, 32]
    - [40, 6.492]
  - - [1024, 1024, 1, 32]
    - [40, 7.951]
  - - [1408, 1024, 1, 32]
    - [38, 9.236]
  - - [1856, 1024, 1, 32]
    - [42, 10.541]
  - - [2368, 1024, 1, 32]
    - [38, 11.904]
  - - [2944, 1024, 1, 32]
    - [38, 13.084]
  - - [3584, 1024, 1, 32]
    - [45, 14.0]
  - - [4288, 1024, 1, 32]
    - [42, 14.41]
  - - [5056, 1024, 1, 32]
    - [45, 15.126]
  - - [5888, 1024, 1, 32]
    - [42, 15.566]
  - - [6784, 1024, 1, 32]
    - [45, 15.971]
  - - [64, 1408, 1, 32]
    - [40, 0.581]
  - - [128, 1408, 1, 32]
    - [40, 1.18]
  - - [256, 1408, 1, 32]
    - [40, 2.333]
  - - [448, 1408, 1, 32]
    - [40, 5.516]
  - - [704, 1408, 1, 32]
    - [38, 7.421]
  - - [1024, 1408, 1, 32]
    - [40, 9.041]
  - - [1408, 1408, 1, 32]
    - [40, 10.895]
  - - [1856, 1408, 1, 32]
    - [38, 12.473]
  - - [2368, 1408, 1, 32]
    - [42, 13.224]
  - - [2944, 1408, 1, 32]
    - [40, 14.35]
  - - [3584, 1408, 1, 32]
    - [38, 15.0]
  - - [4288, 1408, 1, 32]
    - [45, 15.554]
  - - [5056, 1408, 1, 32]
    - [45, 15.881]
  - - [5888, 1408, 1, 32]
    - [42, 16.279]
  - - [6784, 1408, 1, 32]
    - [45, 16.68]
  - - [64, 1856, 1, 32]
    - [38, 0.758]
  - - [128, 1856, 1, 32]
    - [40, 1.554]
  - - [256, 1856, 1, 32]
    - [38, 4.067]
  - - [448, 1856, 1, 32]
    - [40, 6.51]
  - - [704, 1856, 1, 32]
    - [40, 8.744]
  - - [1024, 1856, 1, 32]
    - [38, 10.209]
  - - [1408, 1856, 1, 32]
    - [42, 12.374]
  - - [1856, 1856, 1, 32]
    - [42, 13.485]
  - - [2368, 1856, 1, 32]
    - [38, 14.422]
  - - [2944, 1856, 1, 32]
    - [38, 15.33]
  - - [3584, 1856, 1, 32]
    - [42, 15.779]
  - - [4288, 1856, 1, 32]
    - [45, 16.24]
  - - [5056, 1856, 1, 32]
    - [42, 16.531]
  - - [5888, 1856, 1, 32]
    - [42, 16.848]
  - - [6784, 1856, 1, 32]
    - [42, 17.258]
  - - [64, 2368, 1, 32]
    - [40, 0.991]
  - - [128, 2368, 1, 32]
    - [40, 1.994]
  - - [256, 2368, 1, 32]
    - [38, 5.301]
  - - [448, 2368, 1, 32]
    - [38, 7.993]
  - - [704, 2368, 1, 32]
    - [40, 10.4]
  - - [1024, 2368, 1, 32]
    - [40, 11.712]
  - - [1408, 2368, 1, 32]
    - [40, 13.183]
  - - [1856, 2368, 1, 32]
    - [45, 14.464]
  - - [2368, 2368, 1, 32]
    - [42, 15.372]
  - - [2944, 2368, 1, 32]
    - [42, 16.06]
  - - [3584, 2368, 1, 32]
    - [42, 16.45]
  - - [4288, 2368, 1, 32]
    - [45, 16.752]
  - - [5056, 2368, 1, 32]
    - [42, 17.195]
  - - [5888, 2368, 1, 32]
    - [42, 17.342]
  - - [6784, 2368, 1, 32]
    - [45, 17.591]
  - - [64, 2944, 1, 32]
    - [34, 1.153]
  - - [128, 2944, 1, 32]
    - [40, 2.375]
  - - [256, 2944, 1, 32]
    - [38, 6.358]
  - - [448, 2944, 1, 32]
    - [40, 8.927]
  - - [704, 2944, 1, 32]
    - [40, 11.233]
  - - [1024, 2944, 1, 32]
    - [45, 13.132]
  - - [1408, 2944, 1, 32]
    - [45, 14.392]
  - - [1856, 2944, 1, 32]
    - [42, 15.294]
  - - [2368, 2944, 1, 32]
    - [45, 16.06]
  - - [2944, 2944, 1, 32]
    - [40, 16.558]
  - - [3584, 2944, 1, 32]
    - [41, 17.058]
  - - [4288, 2944, 1, 32]
    - [39, 17.42]
  - - [5056, 2944, 1, 32]
    - [44, 17.636]
  - - [5888, 2944, 1, 32]
    - [44, 17.977]
  - - [6784, 2944, 1, 32]
    - [44, 18.25]
  - - [64, 3584, 1, 32]
    - [40, 1.536]
  - - [128, 3584, 1, 32]
    - [42, 3.953]
  - - [256, 3584, 1, 32]
    - [42, 7.002]
  - - [448, 3584, 1, 32]
    - [38, 10.287]
  - - [704, 3584, 1, 32]
    - [45, 12.089]
  - - [1024, 3584, 1, 32]
    - [45, 13.913]
  - - [1408, 3584, 1, 32]
    - [45, 15.075]
  - - [1856, 3584, 1, 32]
    - [38, 16.063]
  - - [2368, 3584, 1, 32]
    - [42, 16.611]
  - - [2944, 3584, 1, 32]
    - [45, 17.127]
  - - [3584, 3584, 1, 32]
    - [42, 17.366]
  - - [4288, 3584, 1, 32]
    - [41, 17.785]
  - - [5056, 3584, 1, 32]
    - [41, 18.241]
  - - [5888, 3584, 1, 32]
    - [44, 18.384]
  - - [6784, 3584, 1, 32]
    - [41, 18.456]
  - - [64, 4288, 1, 32]
    - [40, 1.704]
  - - [128, 4288, 1, 32]
    - [38, 4.567]
  - - [256, 4288, 1, 32]
    - [40, 8.217]
  - - [448, 4288, 1, 32]
    - [40, 10.412]
  - - [704, 4288, 1, 32]
    - [45, 12.916]
  - - [1024, 4288, 1, 32]
    - [38, 14.41]
  - - [1408, 4288, 1, 32]
    - [40, 15.62]
  - - [1856, 4288, 1, 32]
    - [42, 16.408]
  - - [2368, 4288, 1, 32]
    - [42, 17.013]
  - - [2944, 4288, 1, 32]
    - [42, 17.402]
  - - [3584, 4288, 1, 32]
    - [41, 17.719]
  - - [4288, 4288, 1, 32]
    - [45, 17.905]
  - - [5056, 4288, 1, 32]
    - [41, 18.25]
  - - [5888, 4288, 1, 32]
    - [41, 18.273]
  - - [6784, 4288, 1, 32]
    - [44, 18.417]
  - - [64, 5056, 1, 32]
    - [40, 2.084]
  - - [128, 5056, 1, 32]
    - [45, 5.618]
  - - [256, 5056, 1, 32]
    - [38, 8.759]
  - - [448, 5056, 1, 32]
    - [42, 11.745]
  - - [704, 5056, 1, 32]
    - [38, 13.623]
  - - [1024, 5056, 1, 32]
    - [45, 15.054]
  - - [1408, 5056, 1, 32]
    - [37, 15.998]
  - - [1856, 5056, 1, 32]
    - [45, 16.854]
  - - [2368, 5056, 1, 32]
    - [44, 17.3]
  - - [2944, 5056, 1, 32]
    - [42, 17.69]
  - - [3584, 5056, 1, 32]
    - [44, 17.983]
  - - [4288, 5056, 1, 32]
    - [44, 18.366]
  - - [5056, 5056, 1, 32]
    - [41, 18.492]
  - - [5888, 5056, 1, 32]
    - [41, 18.651]
  - - [6784, 5056, 1, 32]
    - [41, 18.839]
  - - [64, 5888, 1, 32]
    - [40, 2.327]
  - - [128, 5888, 1, 32]
    - [38, 6.495]
  - - [256, 5888, 1, 32]
    - [38, 9.655]
  - - [448, 5888, 1, 32]
    - [40, 12.296]
  - - [704, 5888, 1, 32]
    - [45, 14.228]
  - - [1024, 5888, 1, 32]
    - [45, 15.632]
  - - [1408, 5888, 1, 32]
    - [39, 16.387]
  - - [1856, 5888, 1, 32]
    - [42, 17.201]
  - - [2368, 5888, 1, 32]
    - [44, 17.654]
  - - [2944, 5888, 1, 32]
    - [41, 17.962]
  - - [3584, 5888, 1, 32]
    - [44, 18.492]
  - - [4288, 5888, 1, 32]
    - [44, 18.576]
  - - [5056, 5888, 1, 32]
    - [44, 18.828]
  - - [5888, 5888, 1, 32]
    - [41, 18.971]
  - - [6784, 5888, 1, 32]
    - [41, 19.07]
  - - [64, 6784, 1, 32]
    - [42, 3.588]
  - - [128, 6784, 1, 32]
    - [38, 6.888]
  - - [256, 6784, 1, 32]
    - [45, 10.454]
  - - [448, 6784, 1, 32]
    - [45, 13.003]
  - - [704, 6784, 1, 32]
    - [39, 14.782]
  - - [1024, 6784, 1, 32]
    - [45, 16.096]
  - - [1408, 6784, 1, 32]
    - [39, 17.153]
  - - [1856, 6784, 1, 32]
    - [37, 17.642]
  - - [2368, 6784, 1, 32]
    - [44, 18.052]
  - - [2944, 6784, 1, 32]
    - [44, 18.417]
  - - [3584, 6784, 1, 32]
    - [41, 18.609]
  - - [4288, 6784, 1, 32]
    - [44, 18.795]
  - - [5056, 6784, 1, 32]
    - [41, 19.049]
  - - [5888, 6784, 1, 32]
    - [41, 19.124]
  - - [6784, 6784, 1, 32]
    - [41, 19.031]
  - - [32, 32, 1, 256]
    - [38, 0.021]
  - - [32, 32, 1, 1280]
    - [38, 0.03]
  - - [32, 32, 1, 3328]
    - [38, 0.033]
  - - [32, 64, 1, 32]
    - [34, 0.012]
  - - [32, 128, 1, 32]
    - [36, 0.027]
  - - [32, 256, 1, 32]
    - [35, 0.078]
  - - [32, 448, 1, 32]
    - [36, 0.111]
  - - [32, 704, 1, 32]
    - [38, 0.174]
  - - [32, 1024, 1, 32]
    - [38, 0.246]
  - - [32, 1408, 1, 32]
    - [38, 0.341]
  - - [32, 1856, 1, 32]
    - [40, 0.464]
  - - [32, 2368, 1, 32]
    - [38, 0.578]
  - - [32, 2944, 1, 32]
    - [40, 0.725]
  - - [32, 3584, 1, 32]
    - [38, 0.88]
  - - [32, 4288, 1, 32]
    - [38, 1.033]
  - - [32, 5056, 1, 32]
    - [40, 1.12]
  - - [32, 5888, 1, 32]
    - [38, 1.201]
  - - [32, 6784, 1, 32]
    - [38, 2.015]
  - - [64, 32, 1, 32]
    - [46, 0.024]
  - - [128, 32, 1, 32]
    - [46, 0.03]
  - - [256, 32, 1, 32]
    - [34, 0.057]
  - - [448, 32, 1, 32]
    - [40, 0.117]
  - - [704, 32, 1, 32]
    - [40, 0.171]
  - - [1024, 32, 1, 32]
    - [40, 0.24]
  - - [1408, 32, 1, 32]
    - [38, 0.35]
  - - [1856, 32, 1, 32]
    - [36, 0.443]
  - - [2368, 32, 1, 32]
    - [40, 0.578]
  - - [2944, 32, 1, 32]
    - [38, 0.719]
  - - [3584, 32, 1, 32]
    - [40, 0.833]
  - - [4288, 32, 1, 32]
    - [40, 0.991]
  - - [5056, 32, 1, 32]
    - [38, 1.132]
  - - [5888, 32, 1, 32]
    - [40, 1.177]
  - - [6784, 32, 1, 32]
    - [40, 2.03]
  - - [1, 1, 1, 1]
    - [49, 0.0]
  - - [1, 64, 1, 256]
    - [57, 0.001]
  - - [1, 128, 1, 256]
    - [49, 0.003]
  - - [1, 256, 1, 256]
    - [56, 0.006]
  - - [1, 448, 1, 256]
    - [56, 0.009]
  - - [1, 704, 1, 256]
    - [57, 0.015]
  - - [1, 1024, 1, 256]
    - [57, 0.021]
  - - [1, 1408, 1, 256]
    - [56, 0.027]
  - - [1, 1856, 1, 256]
    - [57, 0.036]
  - - [1, 2368, 1, 256]
    - [57, 0.048]
  - - [1, 2944, 1, 256]
    - [57, 0.06]
  - - [1, 3584, 1, 256]
    - [57, 0.072]
  - - [1, 4288, 1, 256]
    - [57, 0.084]
  - - [1, 5056, 1, 256]
    - [57, 0.099]
  - - [1, 5888, 1, 256]
    - [60, 0.111]
  - - [1, 6784, 1, 256]
    - [60, 0.156]
  - - [1, 64, 1, 1280]
    - [57, 0.003]
  - - [1, 128, 1, 1280]
    - [48, 0.003]
  - - [1, 256, 1, 1280]
    - [49, 0.006]
  - - [1, 448, 1, 1280]
    - [57, 0.012]
  - - [1, 704, 1, 1280]
    - [62, 0.021]
  - - [1, 1024, 1, 1280]
    - [62, 0.03]
  - - [1, 1408, 1, 1280]
    - [57, 0.039]
  - - [1, 1856, 1, 1280]
    - [57, 0.051]
  - - [1, 2368, 1, 1280]
    - [62, 0.066]
  - - [1, 2944, 1, 1280]
    - [64, 0.084]
  - - [1, 3584, 1, 1280]
    - [64, 0.102]
  - - [1, 4288, 1, 1280]
    - [62, 0.12]
  - - [1, 5056, 1, 1280]
    - [62, 0.141]
  - - [1, 5888, 1, 1280]
    - [62, 0.162]
  - - [1, 6784, 1, 1280]
    - [57, 0.189]
  - - [1, 64, 1, 3328]
    - [56, 0.003]
  - - [1, 128, 1, 3328]
    - [48, 0.003]
  - - [1, 256, 1, 3328]
    - [62, 0.009]
  - - [1, 448, 1, 3328]
    - [62, 0.015]
  - - [1, 704, 1, 3328]
    - [57, 0.021]
  - - [1, 1024, 1, 3328]
    - [57, 0.03]
  - - [1, 1408, 1, 3328]
    - [60, 0.042]
  - - [1, 1856, 1, 3328]
    - [62, 0.057]
  - - [1, 2368, 1, 3328]
    - [62, 0.072]
  - - [1, 2944, 1, 3328]
    - [62, 0.09]
  - - [1, 3584, 1, 3328]
    - [64, 0.111]
  - - [1, 4288, 1, 3328]
    - [64, 0.132]
  - - [1, 5056, 1, 3328]
    - [64, 0.156]
  - - [1, 5888, 1, 3328]
    - [64, 0.18]
  - - [1, 6784, 1, 3328]
    - [64, 0.207]
  - - [64, 1, 1, 256]
    - [60, 0.001]
  - - [128, 1, 1, 256]
    - [49, 0.003]
  - - [256, 1, 1, 256]
    - [56, 0.006]
  - - [448, 1, 1, 256]
    - [49, 0.009]
  - - [704, 1, 1, 256]
    - [57, 0.015]
  - - [1024, 1, 1, 256]
    - [56, 0.021]
  - - [1408, 1, 1, 256]
    - [57, 0.03]
  - - [1856, 1, 1, 256]
    - [57, 0.039]
  - - [2368, 1, 1, 256]
    - [57, 0.048]
  - - [2944, 1, 1, 256]
    - [57, 0.06]
  - - [3584, 1, 1, 256]
    - [60, 0.075]
  - - [4288, 1, 1, 256]
    - [57, 0.087]
  - - [5056, 1, 1, 256]
    - [57, 0.102]
  - - [5888, 1, 1, 256]
    - [57, 0.114]
  - - [6784, 1, 1, 256]
    - [62, 0.165]
  - - [64, 1, 1, 1280]
    - [57, 0.003]
  - - [128, 1, 1, 1280]
    - [48, 0.003]
  - - [256, 1, 1, 1280]
    - [49, 0.006]
  - - [448, 1, 1, 1280]
    - [57, 0.012]
  - - [704, 1, 1, 1280]
    - [62, 0.021]
  - - [1024, 1, 1, 1280]
    - [62, 0.03]
  - - [1408, 1, 1, 1280]
    - [57, 0.039]
  - - [1856, 1, 1, 1280]
    - [64, 0.054]
  - - [2368, 1, 1, 1280]
    - [57, 0.066]
  - - [2944, 1, 1, 1280]
    - [62, 0.084]
  - - [3584, 1, 1, 1280]
    - [62, 0.102]
  - - [4288, 1, 1, 1280]
    - [64, 0.123]
  - - [5056, 1, 1, 1280]
    - [64, 0.144]
  - - [5888, 1, 1, 1280]
    - [62, 0.165]
  - - [6784, 1, 1, 1280]
    - [64, 0.207]
  - - [64, 1, 1, 3328]
    - [56, 0.003]
  - - [128, 1, 1, 3328]
    - [48, 0.003]
  - - [256, 1, 1, 3328]
    - [62, 0.009]
  - - [448, 1, 1, 3328]
    - [62, 0.015]
  - - [704, 1, 1, 3328]
    - [57, 0.021]
  - - [1024, 1, 1, 3328]
    - [57, 0.03]
  - - [1408, 1, 1, 3328]
    - [57, 0.042]
  - - [1856, 1, 1, 3328]
    - [62, 0.057]
  - - [2368, 1, 1, 3328]
    - [62, 0.072]
  - - [2944, 1, 1, 3328]
    - [62, 0.09]
  - - [3584, 1, 1, 3328]
    - [64, 0.111]
  - - [4288, 1, 1, 3328]
    - [64, 0.132]
  - - [5056, 1, 1, 3328]
    - [64, 0.156]
  - - [5888, 1, 1, 3328]
    - [62, 0.18]
  - - [6784, 1, 1, 3328]
    - [64, 0.207]
  - - [64, 64, 1, 1]
    - [64, 0.001]
  - - [128, 64, 1, 1]
    - [64, 0.006]
  - - [256, 64, 1, 1]
    - [49, 0.006]
  - - [448, 64, 1, 1]
    - [54, 0.009]
  - - [704, 64, 1, 1]
    - [51, 0.015]
  - - [1024, 64, 1, 1]
    - [49, 0.018]
  - - [1408, 64, 1, 1]
    - [49, 0.021]
  - - [1856, 64, 1, 1]
    - [53, 0.03]
  - - [2368, 64, 1, 1]
    - [49, 0.039]
  - - [2944, 64, 1, 1]
    - [49, 0.048]
  - - [3584, 64, 1, 1]
    - [51, 0.06]
  - - [4288, 64, 1, 1]
    - [49, 0.066]
  - - [5056, 64, 1, 1]
    - [51, 0.078]
  - - [5888, 64, 1, 1]
    - [49, 0.084]
  - - [6784, 64, 1, 1]
    - [53, 0.156]
  - - [64, 128, 1, 1]
    - [49, 0.003]
  - - [128, 128, 1, 1]
    - [54, 0.012]
  - - [256, 128, 1, 1]
    - [56, 0.012]
  - - [448, 128, 1, 1]
    - [49, 0.018]
  - - [704, 128, 1, 1]
    - [49, 0.021]
  - - [1024, 128, 1, 1]
    - [53, 0.033]
  - - [1408, 128, 1, 1]
    - [54, 0.045]
  - - [1856, 128, 1, 1]
    - [51, 0.057]
  - - [2368, 128, 1, 1]
    - [56, 0.072]
  - - [2944, 128, 1, 1]
    - [56, 0.093]
  - - [3584, 128, 1, 1]
    - [51, 0.168]
  - - [4288, 128, 1, 1]
    - [51, 0.198]
  - - [5056, 128, 1, 1]
    - [51, 0.228]
  - - [5888, 128, 1, 1]
    - [53, 0.255]
  - - [6784, 128, 1, 1]
    - [49, 0.302]
  - - [64, 256, 1, 1]
    - [47, 0.003]
  - - [128, 256, 1, 1]
    - [49, 0.009]
  - - [256, 256, 1, 1]
    - [49, 0.021]
  - - [448, 256, 1, 1]
    - [49, 0.027]
  - - [704, 256, 1, 1]
    - [54, 0.045]
  - - [1024, 256, 1, 1]
    - [56, 0.063]
  - - [1408, 256, 1, 1]
    - [56, 0.087]
  - - [1856, 256, 1, 1]
    - [51, 0.171]
  - - [2368, 256, 1, 1]
    - [49, 0.219]
  - - [2944, 256, 1, 1]
    - [51, 0.276]
  - - [3584, 256, 1, 1]
    - [51, 0.317]
  - - [4288, 256, 1, 1]
    - [49, 0.371]
  - - [5056, 256, 1, 1]
    - [51, 0.422]
  - - [5888, 256, 1, 1]
    - [50, 0.458]
  - - [6784, 256, 1, 1]
    - [59, 0.503]
  - - [64, 448, 1, 1]
    - [49, 0.006]
  - - [128, 448, 1, 1]
    - [56, 0.018]
  - - [256, 448, 1, 1]
    - [49, 0.027]
  - - [448, 448, 1, 1]
    - [49, 0.048]
  - - [704, 448, 1, 1]
    - [56, 0.075]
  - - [1024, 448, 1, 1]
    - [53, 0.162]
  - - [1408, 448, 1, 1]
    - [51, 0.231]
  - - [1856, 448, 1, 1]
    - [49, 0.302]
  - - [2368, 448, 1, 1]
    - [49, 0.341]
  - - [2944, 448, 1, 1]
    - [57, 0.395]
  - - [3584, 448, 1, 1]
    - [49, 0.434]
  - - [4288, 448, 1, 1]
    - [60, 0.509]
  - - [5056, 448, 1, 1]
    - [51, 0.596]
  - - [5888, 448, 1, 1]
    - [49, 0.662]
  - - [6784, 448, 1, 1]
    - [54, 0.695]
  - - [64, 704, 1, 1]
    - [49, 0.012]
  - - [128, 704, 1, 1]
    - [49, 0.024]
  - - [256, 704, 1, 1]
    - [49, 0.045]
  - - [448, 704, 1, 1]
    - [56, 0.078]
  - - [704, 704, 1, 1]
    - [49, 0.183]
  - - [1024, 704, 1, 1]
    - [49, 0.258]
  - - [1408, 704, 1, 1]
    - [49, 0.317]
  - - [1856, 704, 1, 1]
    - [51, 0.404]
  - - [2368, 704, 1, 1]
    - [49, 0.479]
  - - [2944, 704, 1, 1]
    - [57, 0.539]
  - - [3584, 704, 1, 1]
    - [54, 0.638]
  - - [4288, 704, 1, 1]
    - [49, 0.686]
  - - [5056, 704, 1, 1]
    - [53, 0.74]
  - - [5888, 704, 1, 1]
    - [54, 0.803]
  - - [6784, 704, 1, 1]
    - [51, 0.836]
  - - [64, 1024, 1, 1]
    - [54, 0.018]
  - - [128, 1024, 1, 1]
    - [49, 0.033]
  - - [256, 1024, 1, 1]
    - [56, 0.063]
  - - [448, 1024, 1, 1]
    - [53, 0.165]
  - - [704, 1024, 1, 1]
    - [53, 0.27]
  - - [1024, 1024, 1, 1]
    - [51, 0.353]
  - - [1408, 1024, 1, 1]
    - [52, 0.443]
  - - [1856, 1024, 1, 1]
    - [57, 0.536]
  - - [2368, 1024, 1, 1]
    - [49, 0.617]
  - - [2944, 1024, 1, 1]
    - [53, 0.701]
  - - [3584, 1024, 1, 1]
    - [53, 0.782]
  - - [4288, 1024, 1, 1]
    - [53, 0.806]
  - - [5056, 1024, 1, 1]
    - [52, 0.868]
  - - [5888, 1024, 1, 1]
    - [48, 0.907]
  - - [6784, 1024, 1, 1]
    - [48, 0.967]
  - - [64, 1408, 1, 1]
    - [49, 0.024]
  - - [128, 1408, 1, 1]
    - [49, 0.045]
  - - [256, 1408, 1, 1]
    - [56, 0.087]
  - - [448, 1408, 1, 1]
    - [49, 0.228]
  - - [704, 1408, 1, 1]
    - [54, 0.314]
  - - [1024, 1408, 1, 1]
    - [52, 0.428]
  - - [1408, 1408, 1, 1]
    - [57, 0.524]
  - - [1856, 1408, 1, 1]
    - [53, 0.665]
  - - [2368, 1408, 1, 1]
    - [51, 0.734]
  - - [2944, 1408, 1, 1]
    - [53, 0.797]
  - - [3584, 1408, 1, 1]
    - [49, 0.847]
  - - [4288, 1408, 1, 1]
    - [49, 0.886]
  - - [5056, 1408, 1, 1]
    - [52, 0.961]
  - - [5888, 1408, 1, 1]
    - [52, 0.982]
  - - [6784, 1408, 1, 1]
    - [58, 1.006]
  - - [64, 1856, 1, 1]
    - [49, 0.033]
  - - [128, 1856, 1, 1]
    - [49, 0.063]
  - - [256, 1856, 1, 1]
    - [49, 0.165]
  - - [448, 1856, 1, 1]
    - [59, 0.296]
  - - [704, 1856, 1, 1]
    - [49, 0.41]
  - - [1024, 1856, 1, 1]
    - [60, 0.524]
  - - [1408, 1856, 1, 1]
    - [54, 0.671]
  - - [1856, 1856, 1, 1]
    - [51, 0.755]
  - - [2368, 1856, 1, 1]
    - [54, 0.806]
  - - [2944, 1856, 1, 1]
    - [49, 0.877]
  - - [3584, 1856, 1, 1]
    - [48, 0.892]
  - - [4288, 1856, 1, 1]
    - [52, 0.952]
  - - [5056, 1856, 1, 1]
    - [52, 0.988]
  - - [5888, 1856, 1, 1]
    - [48, 1.039]
  - - [6784, 1856, 1, 1]
    - [52, 1.039]
  - - [64, 2368, 1, 1]
    - [49, 0.042]
  - - [128, 2368, 1, 1]
    - [49, 0.075]
  - - [256, 2368, 1, 1]
    - [53, 0.207]
  - - [448, 2368, 1, 1]
    - [51, 0.338]
  - - [704, 2368, 1, 1]
    - [51, 0.488]
  - - [1024, 2368, 1, 1]
    - [53, 0.626]
  - - [1408, 2368, 1, 1]
    - [52, 0.722]
  - - [1856, 2368, 1, 1]
    - [54, 0.815]
  - - [2368, 2368, 1, 1]
    - [52, 0.883]
  - - [2944, 2368, 1, 1]
    - [52, 0.913]
  - - [3584, 2368, 1, 1]
    - [54, 0.925]
  - - [4288, 2368, 1, 1]
    - [51, 0.985]
  - - [5056, 2368, 1, 1]
    - [48, 1.051]
  - - [5888, 2368, 1, 1]
    - [51, 1.045]
  - - [6784, 2368, 1, 1]
    - [48, 1.075]
  - - [64, 2944, 1, 1]
    - [49, 0.051]
  - - [128, 2944, 1, 1]
    - [56, 0.093]
  - - [256, 2944, 1, 1]
    - [53, 0.279]
  - - [448, 2944, 1, 1]
    - [53, 0.419]
  - - [704, 2944, 1, 1]
    - [51, 0.545]
  - - [1024, 2944, 1, 1]
    - [53, 0.701]
  - - [1408, 2944, 1, 1]
    - [51, 0.791]
  - - [1856, 2944, 1, 1]
    - [55, 0.862]
  - - [2368, 2944, 1, 1]
    - [52, 0.946]
  - - [2944, 2944, 1, 1]
    - [52, 0.964]
  - - [3584, 2944, 1, 1]
    - [52, 0.976]
  - - [4288, 2944, 1, 1]
    - [48, 1.048]
  - - [5056, 2944, 1, 1]
    - [48, 1.087]
  - - [5888, 2944, 1, 1]
    - [48, 1.099]
  - - [6784, 2944, 1, 1]
    - [52, 1.117]
  - - [64, 3584, 1, 1]
    - [49, 0.06]
  - - [128, 3584, 1, 1]
    - [54, 0.165]
  - - [256, 3584, 1, 1]
    - [49, 0.287]
  - - [448, 3584, 1, 1]
    - [49, 0.47]
  - - [704, 3584, 1, 1]
    - [54, 0.656]
  - - [1024, 3584, 1, 1]
    - [51, 0.764]
  - - [1408, 3584, 1, 1]
    - [52, 0.859]
  - - [1856, 3584, 1, 1]
    - [52, 0.916]
  - - [2368, 3584, 1, 1]
    - [48, 0.967]
  - - [2944, 3584, 1, 1]
    - [55, 0.997]
  - - [3584, 3584, 1, 1]
    - [52, 1.015]
  - - [4288, 3584, 1, 1]
    - [58, 1.054]
  - - [5056, 3584, 1, 1]
    - [58, 1.111]
  - - [5888, 3584, 1, 1]
    - [48, 1.099]
  - - [6784, 3584, 1, 1]
    - [52, 1.114]
  - - [64, 4288, 1, 1]
    - [56, 0.072]
  - - [128, 4288, 1, 1]
    - [54, 0.207]
  - - [256, 4288, 1, 1]
    - [51, 0.371]
  - - [448, 4288, 1, 1]
    - [57, 0.521]
  - - [704, 4288, 1, 1]
    - [53, 0.719]
  - - [1024, 4288, 1, 1]
    - [53, 0.788]
  - - [1408, 4288, 1, 1]
    - [58, 0.88]
  - - [1856, 4288, 1, 1]
    - [48, 0.949]
  - - [2368, 4288, 1, 1]
    - [52, 1.015]
  - - [2944, 4288, 1, 1]
    - [52, 1.009]
  - - [3584, 4288, 1, 1]
    - [47, 1.024]
  - - [4288, 4288, 1, 1]
    - [52, 1.087]
  - - [5056, 4288, 1, 1]
    - [52, 1.087]
  - - [5888, 4288, 1, 1]
    - [53, 1.108]
  - - [6784, 4288, 1, 1]
    - [58, 1.099]
  - - [64, 5056, 1, 1]
    - [56, 0.084]
  - - [128, 5056, 1, 1]
    - [49, 0.237]
  - - [256, 5056, 1, 1]
    - [54, 0.422]
  - - [448, 5056, 1, 1]
    - [54, 0.605]
  - - [704, 5056, 1, 1]
    - [53, 0.761]
  - - [1024, 5056, 1, 1]
    - [58, 0.856]
  - - [1408, 5056, 1, 1]
    - [52, 0.913]
  - - [1856, 5056, 1, 1]
    - [52, 0.988]
  - - [2368, 5056, 1, 1]
    - [48, 1.03]
  - - [2944, 5056, 1, 1]
    - [53, 1.042]
  - - [3584, 5056, 1, 1]
    - [52, 1.048]
  - - [4288, 5056, 1, 1]
    - [52, 1.12]
  - - [5056, 5056, 1, 1]
    - [52, 1.117]
  - - [5888, 5056, 1, 1]
    - [49, 1.108]
  - - [6784, 5056, 1, 1]
    - [52, 1.126]
  - - [64, 5888, 1, 1]
    - [56, 0.093]
  - - [128, 5888, 1, 1]
    - [54, 0.258]
  - - [256, 5888, 1, 1]
    - [48, 0.422]
  - - [448, 5888, 1, 1]
    - [53, 0.65]
  - - [704, 5888, 1, 1]
    - [53, 0.809]
  - - [1024, 5888, 1, 1]
    - [48, 0.859]
  - - [1408, 5888, 1, 1]
    - [58, 0.952]
  - - [1856, 5888, 1, 1]
    - [58, 0.994]
  - - [2368, 5888, 1, 1]
    - [48, 1.042]
  - - [2944, 5888, 1, 1]
    - [49, 1.048]
  - - [3584, 5888, 1, 1]
    - [52, 1.081]
  - - [4288, 5888, 1, 1]
    - [55, 1.12]
  - - [5056, 5888, 1, 1]
    - [58, 1.123]
  - - [5888, 5888, 1, 1]
    - [52, 1.114]
  - - [6784, 5888, 1, 1]
    - [48, 1.156]
  - - [64, 6784, 1, 1]
    - [61, 0.147]
  - - [128, 6784, 1, 1]
    - [51, 0.287]
  - - [256, 6784, 1, 1]
    - [53, 0.497]
  - - [448, 6784, 1, 1]
    - [49, 0.719]
  - - [704, 6784, 1, 1]
    - [48, 0.833]
  - - [1024, 6784, 1, 1]
    - [52, 0.85]
  - - [1408, 6784, 1, 1]
    - [58, 0.958]
  - - [1856, 6784, 1, 1]
    - [55, 1.012]
  - - [2368, 6784, 1, 1]
    - [52, 1.099]
  - - [2944, 6784, 1, 1]
    - [52, 1.066]
  - - [3584, 6784, 1, 1]
    - [52, 1.105]
  - - [4288, 6784, 1, 1]
    - [48, 1.138]
  - - [5056, 6784, 1, 1]
    - [52, 1.159]
  - - [5888, 6784, 1, 1]
    - [52, 1.144]
  - - [6784, 6784, 1, 1]
    - [48, 1.159]
  - - [1, 1, 1, 256]
    - [49, 0.0]
  - - [1, 1, 1, 1280]
    - [61, 0.0]
  - - [1, 1, 1, 3328]
    - [62, 0.0]
  - - [1, 64, 1, 1]
    - [49, 0.0]
  - - [1, 128, 1, 1]
    - [60, 0.0]
  - - [1, 256, 1, 1]
    - [53, 0.0]
  - - [1, 448, 1, 1]
    - [53, 0.0]
  - - [1, 704, 1, 1]
    - [59, 0.0]
  - - [1, 1024, 1, 1]
    - [53, 0.0]
  - - [1, 1408, 1, 1]
    - [53, 0.001]
  - - [1, 1856, 1, 1]
    - [49, 0.001]
  - - [1, 2368, 1, 1]
    - [49, 0.001]
  - - [1, 2944, 1, 1]
    - [53, 0.001]
  - - [1, 3584, 1, 1]
    - [49, 0.003]
  - - [1, 4288, 1, 1]
    - [53, 0.003]
  - - [1, 5056, 1, 1]
    - [48, 0.003]
  - - [1, 5888, 1, 1]
    - [48, 0.003]
  - - [1, 6784, 1, 1]
    - [47, 0.003]
  - - [64, 1, 1, 1]
    - [63, 0.0]
  - - [128, 1, 1, 1]
    - [62, 0.0]
  - - [256, 1, 1, 1]
    - [54, 0.0]
  - - [448, 1, 1, 1]
    - [59, 0.0]
  - - [704, 1, 1, 1]
    - [51, 0.0]
  - - [1024, 1, 1, 1]
    - [51, 0.001]
  - - [1408, 1, 1, 1]
    - [53, 0.001]
  - - [1856, 1, 1, 1]
    - [53, 0.001]
  - - [2368, 1, 1, 1]
    - [49, 0.001]
  - - [2944, 1, 1, 1]
    - [53, 0.001]
  - - [3584, 1, 1, 1]
    - [49, 0.003]
  - - [4288, 1, 1, 1]
    - [49, 0.003]
  - - [5056, 1, 1, 1]
    - [49, 0.003]
  - - [5888, 1, 1, 1]
    - [47, 0.003]
  - - [6784, 1, 1, 1]
    - [47, 0.003]
  - - [7680, 8192, 1, 8192]
    - [257, 92.725]
  - - [3840, 4096, 1, 4096]
    - [65, 88.442]
  - - [1920, 2048, 1, 2048]
    - [66, 77.138]
  - - [960, 1024, 1, 1024]
    - [67, 36.093]
  - - [480, 512, 1, 512]
    - [68, 9.732]
  - - [8192, 7680, 1, 8192]
    - [258, 92.758]
  - - [4096, 3840, 1, 4096]
    - [69, 88.39]
  - - [2048, 1920, 1, 2048]
    - [70, 74.25]
  - - [1024, 960, 1, 1024]
    - [71, 35.819]
  - - [512, 480, 1, 512]
    - [72, 10.705]
  - - [8192, 8192, 1, 8192]
    - [259, 90.988]
  - - [4096, 4096, 1, 4096]
    - [74, 80.438]
  - - [2048, 2048, 1, 2048]
    - [75, 67.723]
  - - [512, 512, 1, 512]
    - [77, 8.104]
  - - [64, 512, 16, 512]
    - [78, 15.225]
  - - [1024, 2, 1, 1]
    - [260, 0.0]
  - - [1024, 2, 1, 512]
    - [79, 0.078]
  - - [1024, 1024, 1, 77]
    - [80, 6.869]
  - - [1024, 1024, 1, 512]
    - [81, 21.94]
  - - [1024, 4096, 1, 512]
    - [74, 47.736]
  - - [1024, 30522, 1, 77]
    - [82, 18.598]
  - - [4096, 1024, 1, 512]
    - [83, 38.5]
  - - [64, 128, 160, 128]
    - [84, 12.461]
  - - [1024, 2, 1, 10]
    - [261, 0.003]
  - - [1024, 2, 1, 1280]
    - [262, 0.144]
  - - [1024, 1024, 1, 10]
    - [87, 1.141]
  - - [1024, 1024, 1, 200]
    - [88, 13.084]
  - - [1024, 4096, 1, 1280]
    - [90, 60.315]
  - - [1024, 30522, 1, 200]
    - [91, 33.6]
  - - [4096, 1024, 1, 1280]
    - [263, 51.425]
  - - [64, 128, 624, 128]
    - [92, 15.782]
  - - [1024, 2, 1, 39]
    - [93, 0.012]
  - - [1024, 2, 1, 4992]
    - [264, 0.425]
  - - [1024, 1024, 1, 39]
    - [94, 4.029]
  - - [1024, 1024, 1, 780]
    - [95, 22.986]
  - - [1024, 1024, 1, 4992]
    - [96, 44.983]
  - - [1024, 4096, 1, 4992]
    - [90, 71.123]
  - - [1024, 30522, 1, 780]
    - [97, 58.037]
  - - [4096, 1024, 1, 4992]
    - [265, 69.756]
  - - [64, 512, 64, 512]
    - [98, 26.168]
  - - [1024, 2, 1, 4]
    - [266, 0.001]
  - - [1024, 2, 1, 2048]
    - [267, 0.21]
  - - [1024, 1024, 1, 4]
    - [100, 0.451]
  - - [1024, 1024, 1, 308]
    - [101, 15.824]
  - - [1024, 1024, 1, 2048]
    - [102, 38.207]
  - - [1024, 4096, 1, 2048]
    - [90, 65.197]
  - - [1024, 30522, 1, 308]
    - [103, 40.543]
  - - [4096, 1024, 1, 2048]
    - [259, 59.813]
  - - [64, 128, 640, 128]
    - [104, 15.94]
  - - [1024, 2, 1, 40]
    - [105, 0.012]
  - - [1024, 2, 1, 5120]
    - [268, 0.44]
  - - [1024, 1024, 1, 40]
    - [106, 4.132]
  - - [1024, 1024, 1, 800]
    - [107, 25.242]
  - - [1024, 1024, 1, 5120]
    - [108, 45.02]
  - - [1024, 4096, 1, 5120]
    - [90, 71.494]
  - - [1024, 30522, 1, 800]
    - [109, 63.088]
  - - [4096, 1024, 1, 5120]
    - [269, 71.19]
  - - [64, 128, 656, 128]
    - [104, 15.855]
  - - [1024, 2, 1, 41]
    - [110, 0.012]
  - - [1024, 2, 1, 5248]
    - [270, 0.441]
  - - [1024, 1024, 1, 41]
    - [111, 4.106]
  - - [1024, 1024, 1, 820]
    - [112, 23.189]
  - - [1024, 1024, 1, 5248]
    - [96, 45.333]
  - - [1024, 4096, 1, 5248]
    - [259, 71.204]
  - - [1024, 30522, 1, 820]
    - [113, 59.841]
  - - [4096, 1024, 1, 5248]
    - [271, 70.185]
  - - [64, 512, 80, 512]
    - [114, 28.743]
  - - [1024, 2, 1, 5]
    - [261, 0.001]
  - - [1024, 2, 1, 2560]
    - [272, 0.249]
  - - [1024, 1024, 1, 5]
    - [116, 0.558]
  - - [1024, 1024, 1, 385]
    - [117, 17.905]
  - - [1024, 1024, 1, 2560]
    - [118, 40.847]
  - - [1024, 4096, 1, 2560]
    - [119, 67.124]
  - - [1024, 30522, 1, 385]
    - [73, 44.492]
  - - [4096, 1024, 1, 2560]
    - [269, 63.679]
  - - [64, 512, 96, 512]
    - [120, 27.913]
  - - [1024, 2, 1, 6]
    - [121, 0.002]
  - - [1024, 2, 1, 3072]
    - [273, 0.278]
  - - [1024, 1024, 1, 6]
    - [122, 0.677]
  - - [1024, 1024, 1, 462]
    - [101, 19.21]
  - - [1024, 1024, 1, 3072]
    - [123, 42.699]
  - - [1024, 4096, 1, 3072]
    - [119, 68.629]
  - - [1024, 30522, 1, 462]
    - [124, 46.453]
  - - [4096, 1024, 1, 3072]
    - [259, 65.64]
  - - [64, 128, 128, 128]
    - [125, 10.555]
  - - [1024, 2, 1, 8]
    - [261, 0.002]
  - - [1024, 2, 1, 1024]
    - [86, 0.112]
  - - [1024, 1024, 1, 8]
    - [126, 0.892]
  - - [1024, 1024, 1, 160]
    - [127, 12.87]
  - - [1024, 4096, 1, 1024]
    - [90, 57.667]
  - - [1024, 30522, 1, 160]
    - [128, 32.499]
  - - [4096, 1024, 1, 1024]
    - [274, 47.398]
  - - [64, 128, 144, 128]
    - [84, 11.488]
  - - [1024, 2, 1, 9]
    - [85, 0.003]
  - - [1024, 2, 1, 1152]
    - [99, 0.121]
  - - [1024, 1024, 1, 9]
    - [129, 1.015]
  - - [1024, 1024, 1, 180]
    - [130, 12.016]
  - - [1024, 1024, 1, 1152]
    - [118, 32.391]
  - - [1024, 4096, 1, 1152]
    - [90, 59.186]
  - - [1024, 30522, 1, 180]
    - [131, 31.889]
  - - [4096, 1024, 1, 1152]
    - [265, 49.473]
  - - [13, 512, 1, 32768]
    - [446, 4.408]
  - - [256, 128, 1, 32768]
    - [275, 17.629]
  - - [256, 32768, 1, 1]
    - [133, 0.29]
  - - [479, 1024, 1, 32768]
    - [447, 60.262]
  - - [512, 256, 1, 32768]
    - [276, 41.523]
  - - [1024, 512, 1, 32768]
    - [277, 67.781]
  - - [1024, 1024, 1, 32768]
    - [278, 73.666]
  - - [64, 128, 512, 128]
    - [136, 14.777]
  - - [128, 64, 512, 128]
    - [137, 14.355]
  - - [1024, 2, 1, 32]
    - [279, 0.01]
  - - [1024, 1024, 1, 4096]
    - [89, 43.879]
  - - [1024, 4096, 1, 4096]
    - [90, 70.392]
  - - [1024, 30528, 1, 4096]
    - [97, 86.369]
  - - [4096, 1024, 1, 4096]
    - [265, 67.723]
  - - [512, 64, 64, 512]
    - [138, 23.1]
  - - [1024, 30528, 1, 2048]
    - [139, 78.761]
  - - [4, 64, 32768, 4]
    - [140, 0.225]
  - - [4, 64, 38400, 4]
    - [140, 0.226]
  - - [64, 4, 32768, 4]
    - [129, 0.233]
  - - [64, 4, 38400, 4]
    - [126, 0.234]
  - - [1024, 1024, 1, 8192]
    - [280, 51.072]
  - - [1024, 1024, 1, 9600]
    - [281, 53.678]
  - - [1024, 4096, 1, 8192]
    - [259, 73.953]
  - - [1024, 4096, 1, 9600]
    - [259, 74.81]
  - - [1024, 33712, 1, 8192]
    - [282, 82.407]
  - - [1024, 33712, 1, 9600]
    - [283, 82.756]
  - - [4096, 1024, 1, 8192]
    - [284, 73.246]
  - - [4096, 1024, 1, 9600]
    - [271, 73.112]
  - - [1024, 1024, 1, 10064]
    - [285, 53.469]
  - - [1024, 1024, 1, 10080]
    - [286, 53.7]
  - - [1024, 1024, 1, 10200]
    - [281, 52.68]
  - - [1024, 1024, 1, 3840]
    - [118, 43.164]
  - - [1024, 1024, 1, 3968]
    - [108, 43.652]
  - - [1024, 1024, 1, 6528]
    - [287, 46.185]
  - - [1024, 1024, 1, 7104]
    - [288, 47.912]
  - - [1024, 1024, 1, 7200]
    - [289, 48.261]
  - - [1024, 1024, 1, 8064]
    - [290, 50.498]
  - - [1024, 1024, 1, 8160]
    - [291, 50.584]
  - - [1024, 1024, 1, 9216]
    - [292, 53.229]
  - - [1024, 1024, 1, 9520]
    - [281, 52.16]
  - - [1024, 4096, 1, 10064]
    - [293, 73.658]
  - - [1024, 4096, 1, 10080]
    - [293, 74.01]
  - - [1024, 4096, 1, 10200]
    - [259, 74.376]
  - - [1024, 4096, 1, 3840]
    - [90, 70.203]
  - - [1024, 4096, 1, 3968]
    - [119, 68.192]
  - - [1024, 4096, 1, 6528]
    - [269, 72.67]
  - - [1024, 4096, 1, 7104]
    - [269, 73.054]
  - - [1024, 4096, 1, 7200]
    - [269, 73.083]
  - - [1024, 4096, 1, 8064]
    - [269, 73.577]
  - - [1024, 4096, 1, 8160]
    - [269, 73.512]
  - - [1024, 4096, 1, 9216]
    - [259, 74.265]
  - - [1024, 4096, 1, 9520]
    - [259, 73.414]
  - - [1024, 42720, 1, 10080]
    - [269, 92.595]
  - - [1024, 42720, 1, 3968]
    - [269, 88.622]
  - - [1024, 42720, 1, 6528]
    - [269, 90.915]
  - - [1024, 42720, 1, 7104]
    - [259, 91.391]
  - - [1024, 42720, 1, 7200]
    - [269, 91.275]
  - - [1024, 42720, 1, 9520]
    - [259, 91.149]
  - - [4096, 1024, 1, 10064]
    - [284, 72.178]
  - - [4096, 1024, 1, 10080]
    - [294, 73.297]
  - - [4096, 1024, 1, 10200]
    - [271, 72.794]
  - - [4096, 1024, 1, 3840]
    - [259, 67.199]
  - - [4096, 1024, 1, 3968]
    - [269, 68.704]
  - - [4096, 1024, 1, 6528]
    - [271, 71.594]
  - - [4096, 1024, 1, 7104]
    - [295, 70.809]
  - - [4096, 1024, 1, 7200]
    - [265, 72.205]
  - - [4096, 1024, 1, 8064]
    - [271, 72.548]
  - - [4096, 1024, 1, 8160]
    - [271, 71.639]
  - - [4096, 1024, 1, 9216]
    - [271, 73.139]
  - - [4096, 1024, 1, 9520]
    - [271, 72.884]
  - - [14, 64, 10880, 14]
    - [150, 1.496]
  - - [15, 64, 10880, 14]
    - [151, 1.5]
  - - [15, 64, 7680, 15]
    - [152, 1.547]
  - - [15, 64, 10880, 15]
    - [153, 1.62]
  - - [17, 64, 7680, 15]
    - [154, 1.62]
  - - [17, 64, 6144, 17]
    - [154, 1.557]
  - - [17, 64, 7680, 17]
    - [448, 1.641]
  - - [21, 64, 6144, 17]
    - [155, 1.724]
  - - [21, 64, 6144, 21]
    - [156, 2.06]
  - - [24, 64, 4736, 24]
    - [157, 3.713]
  - - [30, 64, 2048, 30]
    - [158, 2.831]
  - - [30, 64, 2048, 31]
    - [159, 2.925]
  - - [31, 64, 2048, 31]
    - [160, 2.84]
  - - [32, 64, 4608, 32]
    - [161, 5.585]
  - - [32, 64, 4608, 35]
    - [162, 5.293]
  - - [34, 64, 4736, 24]
    - [449, 3.166]
  - - [34, 64, 4736, 34]
    - [163, 4.094]
  - - [35, 64, 4608, 35]
    - [164, 4.174]
  - - [64, 14, 10880, 14]
    - [165, 2.265]
  - - [64, 15, 10880, 14]
    - [129, 2.367]
  - - [64, 15, 7680, 15]
    - [165, 2.379]
  - - [64, 15, 10880, 15]
    - [126, 2.498]
  - - [64, 17, 7680, 15]
    - [166, 2.572]
  - - [64, 17, 6144, 17]
    - [167, 2.234]
  - - [64, 17, 7680, 17]
    - [168, 2.547]
  - - [64, 21, 6144, 17]
    - [129, 2.536]
  - - [64, 21, 6144, 21]
    - [165, 3.034]
  - - [64, 24, 4736, 24]
    - [169, 3.817]
  - - [64, 30, 2048, 30]
    - [166, 4.181]
  - - [64, 30, 2048, 31]
    - [170, 4.305]
  - - [64, 31, 2048, 31]
    - [171, 4.35]
  - - [64, 32, 4608, 32]
    - [172, 5.552]
  - - [64, 32, 4608, 35]
    - [173, 5.302]
  - - [64, 34, 4736, 24]
    - [174, 3.897]
  - - [64, 34, 4736, 34]
    - [175, 4.844]
  - - [64, 35, 4608, 35]
    - [166, 4.886]
  - - [512, 64, 1, 512]
    - [176, 1.428]
  - - [64, 512, 1, 512]
    - [177, 1.366]
  - - [64, 128, 1, 128]
    - [178, 0.14]
  - - [128, 64, 1, 128]
    - [179, 0.139]
  - - [74, 2048, 1, 512]
    - [180, 5.904]
  - - [2048, 2048, 1, 512]
    - [181, 46.306]
  - - [1024, 64, 1, 512]
    - [176, 2.779]
  - - [5, 64, 1, 5]
    - [450, 0.0]
  - - [2048, 512, 1, 1]
    - [182, 0.126]
  - - [1600, 1024, 1, 512]
    - [183, 32.173]
  - - [512, 32, 1, 1600]
    - [296, 1.208]
  - - [33, 32, 1, 33]
    - [451, 0.004]
  - - [560, 1024, 1, 1600]
    - [185, 24.603]
  - - [1024, 1600, 1, 1]
    - [186, 0.158]
  - - [1024, 1024, 1, 1600]
    - [89, 36.429]
  - - [512, 512, 1, 1600]
    - [187, 13.172]
  - - [3, 64, 512, 3]
    - [188, 0.04]
  - - [5, 64, 512, 5]
    - [189, 0.103]
  - - [5, 64, 960, 5]
    - [452, 0.125]
  - - [9, 64, 512, 9]
    - [190, 0.276]
  - - [27, 128, 32768, 27]
    - [453, 3.447]
  - - [33, 32, 200, 33]
    - [191, 0.932]
  - - [33, 32, 1600, 33]
    - [192, 2.298]
  - - [67, 2048, 1, 512]
    - [193, 5.177]
  - - [74, 2048, 1, 960]
    - [194, 7.018]
  - - [100, 2048, 1, 512]
    - [195, 6.862]
  - - [256, 1280, 1, 8976]
    - [297, 33.982]
  - - [256, 2560, 1, 8976]
    - [298, 47.213]
  - - [256, 2816, 1, 8976]
    - [299, 48.561]
  - - [256, 3328, 1, 8976]
    - [300, 50.864]
  - - [256, 3584, 1, 8976]
    - [301, 55.288]
  - - [256, 3840, 1, 8976]
    - [302, 53.378]
  - - [256, 4096, 1, 8976]
    - [288, 51.509]
  - - [256, 4352, 1, 8976]
    - [303, 54.986]
  - - [256, 4864, 1, 8976]
    - [287, 60.776]
  - - [256, 5120, 1, 8976]
    - [304, 63.495]
  - - [256, 5632, 1, 8976]
    - [305, 59.956]
  - - [256, 5888, 1, 8976]
    - [306, 60.293]
  - - [256, 6144, 1, 8976]
    - [306, 62.351]
  - - [256, 7168, 1, 8976]
    - [307, 66.326]
  - - [256, 8192, 1, 8976]
    - [308, 62.226]
  - - [256, 8960, 1, 8976]
    - [309, 66.809]
  - - [256, 9728, 1, 8976]
    - [310, 66.749]
  - - [256, 9984, 1, 8976]
    - [311, 67.963]
  - - [256, 10240, 1, 8976]
    - [312, 69.29]
  - - [256, 10496, 1, 8976]
    - [283, 61.101]
  - - [256, 11008, 1, 8976]
    - [282, 63.96]
  - - [256, 11264, 1, 8976]
    - [282, 65.342]
  - - [256, 11520, 1, 8976]
    - [283, 66.683]
  - - [256, 11776, 1, 8976]
    - [283, 68.128]
  - - [256, 12544, 1, 8976]
    - [313, 72.377]
  - - [256, 12800, 1, 8976]
    - [313, 73.637]
  - - [256, 13312, 1, 8976]
    - [283, 76.643]
  - - [256, 13568, 1, 8976]
    - [283, 78.055]
  - - [256, 14336, 1, 8976]
    - [283, 82.428]
  - - [256, 14848, 1, 8976]
    - [283, 85.122]
  - - [256, 15104, 1, 8976]
    - [283, 86.659]
  - - [256, 15872, 1, 8976]
    - [314, 77.465]
  - - [256, 16128, 1, 8976]
    - [315, 79.092]
  - - [256, 17152, 1, 8976]
    - [316, 82.092]
  - - [256, 17408, 1, 8976]
    - [317, 79.53]
  - - [256, 18688, 1, 8976]
    - [269, 84.908]
  - - [256, 19968, 1, 8976]
    - [318, 69.291]
  - - [256, 20480, 1, 8976]
    - [319, 69.784]
  - - [256, 20992, 1, 8976]
    - [320, 72.307]
  - - [256, 21248, 1, 8976]
    - [321, 68.034]
  - - [256, 22016, 1, 8976]
    - [322, 70.62]
  - - [256, 26112, 1, 8976]
    - [211, 77.376]
  - - [256, 32512, 1, 8976]
    - [323, 81.381]
  - - [256, 33536, 1, 8976]
    - [324, 82.921]
  - - [256, 44505, 1, 8976]
    - [282, 79.947]
  - - [257, 4096, 1, 1024]
    - [213, 25.032]
  - - [480, 1024, 1, 32768]
    - [325, 66.37]
  - - [512, 32, 1, 200]
    - [214, 0.316]
  - - [512, 512, 1, 200]
    - [215, 5.111]
  - - [512, 2048, 1, 256]
    - [216, 16.419]
  - - [560, 1024, 1, 200]
    - [84, 7.777]
  - - [768, 2048, 1, 256]
    - [217, 22.7]
  - - [1024, 64, 1, 960]
    - [218, 3.525]
  - - [1024, 256, 1, 1024]
    - [219, 11.419]
  - - [1024, 256, 1, 2304]
    - [220, 16.772]
  - - [1024, 256, 1, 2816]
    - [221, 18.373]
  - - [1024, 256, 1, 3072]
    - [222, 18.888]
  - - [1024, 256, 1, 3584]
    - [220, 19.758]
  - - [1024, 256, 1, 4096]
    - [326, 20.676]
  - - [1024, 256, 1, 4352]
    - [327, 21.525]
  - - [1024, 256, 1, 4608]
    - [328, 22.609]
  - - [1024, 256, 1, 5120]
    - [329, 23.304]
  - - [1024, 256, 1, 5376]
    - [328, 24.884]
  - - [1024, 256, 1, 5632]
    - [327, 24.806]
  - - [1024, 256, 1, 6144]
    - [330, 26.397]
  - - [1024, 256, 1, 6400]
    - [331, 26.978]
  - - [1024, 256, 1, 7680]
    - [332, 30.291]
  - - [1024, 256, 1, 7936]
    - [333, 31.351]
  - - [1024, 256, 1, 8192]
    - [334, 30.589]
  - - [1024, 256, 1, 8448]
    - [330, 31.166]
  - - [1024, 256, 1, 9728]
    - [328, 34.487]
  - - [1024, 256, 1, 9984]
    - [335, 33.737]
  - - [1024, 256, 1, 10496]
    - [330, 34.424]
  - - [1024, 256, 1, 11520]
    - [336, 35.371]
  - - [1024, 256, 1, 12032]
    - [337, 36.041]
  - - [1024, 256, 1, 13568]
    - [328, 38.041]
  - - [1024, 256, 1, 14336]
    - [338, 39.875]
  - - [1024, 256, 1, 14848]
    - [339, 40.428]
  - - [1024, 256, 1, 15104]
    - [340, 40.808]
  - - [1024, 256, 1, 15872]
    - [340, 41.959]
  - - [1024, 256, 1, 16128]
    - [341, 43.242]
  - - [1024, 256, 1, 17152]
    - [341, 43.695]
  - - [1024, 256, 1, 17408]
    - [340, 44.209]
  - - [1024, 256, 1, 18944]
    - [340, 46.335]
  - - [1024, 256, 1, 19712]
    - [342, 46.498]
  - - [1024, 256, 1, 19968]
    - [343, 47.193]
  - - [1024, 256, 1, 21248]
    - [338, 48.899]
  - - [1024, 256, 1, 21504]
    - [339, 48.982]
  - - [1024, 256, 1, 22016]
    - [340, 49.056]
  - - [1024, 256, 1, 28672]
    - [342, 55.824]
  - - [1024, 256, 1, 33536]
    - [342, 58.976]
  - - [1024, 1024, 1, 960]
    - [226, 29.256]
  - - [1600, 1024, 1, 960]
    - [149, 41.58]
  - - [2048, 256, 1, 1024]
    - [187, 19.703]
  - - [2048, 960, 1, 1]
    - [227, 0.179]
  - - [2048, 2048, 1, 960]
    - [228, 54.296]
  - - [2048, 2048, 1, 1024]
    - [228, 55.824]
  - - [3200, 2048, 1, 1024]
    - [204, 59.473]
  - - [4096, 4096, 1, 1024]
    - [73, 65.012]
  - - [2048, 2, 1, 2]
    - [266, 0.001]
  - - [2048, 2048, 1, 2]
    - [229, 0.459]
  - - [2048, 30592, 1, 1024]
    - [257, 71.817]
  - - [2048, 6144, 1, 1024]
    - [230, 61.615]
  - - [2048, 8192, 1, 1024]
    - [231, 64.672]
  - - [8192, 2048, 1, 1024]
    - [109, 63.927]
  - - [1024, 1024, 1, 16]
    - [344, 2.013]
  - - [1024, 2, 1, 16]
    - [232, 0.006]
  - - [1024, 30592, 1, 8192]
    - [233, 90.948]
  - - [1024, 3072, 1, 8192]
    - [345, 72.248]
  - - [512, 64, 256, 512]
    - [234, 30.04]
  - - [64, 512, 256, 512]
    - [235, 31.699]
  - - [1024, 30592, 1, 2048]
    - [97, 78.391]
  - - [1024, 3072, 1, 2048]
    - [283, 59.813]
  - - [1024, 30592, 1, 4096]
    - [236, 86.419]
  - - [1024, 3072, 1, 4096]
    - [313, 67.552]
  - - [512, 64, 128, 512]
    - [237, 26.76]
  - - [64, 512, 128, 512]
    - [238, 27.797]
  - - [2560, 1920, 1, 2048]
    - [346, 73.14]
  - - [2560, 2, 1, 4]
    - [239, 0.004]
  - - [2560, 2560, 1, 2048]
    - [240, 68.525]
  - - [2560, 2560, 1, 4]
    - [241, 0.985]
  - - [2560, 7680, 1, 2048]
    - [242, 82.006]
  - - [640, 2560, 1, 2048]
    - [243, 53.586]
  - - [512, 64, 40, 512]
    - [244, 22.35]
  - - [64, 512, 40, 512]
    - [245, 24.824]
  - - [1536, 1536, 1, 4096]
    - [246, 61.479]
  - - [1536, 4608, 1, 4096]
    - [73, 79.121]
  - - [1536, 50304, 1, 4096]
    - [258, 89.288]
  - - [1536, 6144, 1, 4096]
    - [259, 80.855]
  - - [6144, 1536, 1, 4096]
    - [259, 80.37]
  - - [1024, 96, 64, 1024]
    - [107, 45.537]
  - - [96, 1024, 64, 1024]
    - [347, 43.034]
  - - [1536, 1536, 1, 8192]
    - [348, 67.616]
  - - [1536, 4608, 1, 8192]
    - [282, 82.729]
  - - [1536, 50304, 1, 8192]
    - [258, 92.075]
  - - [1536, 6144, 1, 8192]
    - [259, 86.222]
  - - [6144, 1536, 1, 8192]
    - [269, 85.651]
  - - [1024, 96, 128, 1024]
    - [248, 48.937]
  - - [96, 1024, 128, 1024]
    - [349, 46.974]
  - - [1024, 1024, 1, 16384]
    - [350, 61.86]
  - - [1024, 3072, 1, 16384]
    - [257, 73.335]
  - - [1024, 4096, 1, 16384]
    - [259, 74.84]
  - - [1024, 50304, 1, 16384]
    - [269, 88.928]
  - - [4096, 1024, 1, 16384]
    - [271, 73.996]
  - - [1024, 64, 256, 1024]
    - [250, 36.531]
  - - [64, 1024, 256, 1024]
    - [251, 38.445]
  - - [1024, 50304, 1, 2048]
    - [283, 80.311]
  - - [1024, 64, 32, 1024]
    - [252, 28.833]
  - - [64, 1024, 32, 1024]
    - [253, 32.467]
  - - [1024, 50304, 1, 4096]
    - [283, 85.05]
  - - [1024, 64, 64, 1024]
    - [254, 32.388]
  - - [64, 1024, 64, 1024]
    - [255, 33.748]
  - - [1024, 50304, 1, 8192]
    - [283, 87.599]
  - - [1024, 64, 128, 1024]
    - [71, 35.759]
  - - [64, 1024, 128, 1024]
    - [256, 38.225]
  - - [1024, 2, 1, 64]
    - [351, 0.016]
  - - [1024, 30528, 1, 8192]
    - [346, 84.951]
  - - [1024, 1024, 1, 64]
    - [352, 6.039]
  - - [64, 128, 1024, 128]
    - [353, 16.052]
  - - [128, 64, 1024, 128]
    - [354, 15.388]
  - - [1024, 1024, 1, 3456]
    - [355, 41.561]
  - - [1024, 1024, 1, 6912]
    - [285, 47.833]
  - - [1024, 1024, 1, 864]
    - [356, 24.224]
  - - [1024, 512, 1, 3456]
    - [357, 27.438]
  - - [1024, 512, 1, 4096]
    - [357, 30.085]
  - - [1024, 512, 1, 6912]
    - [358, 38.234]
  - - [1024, 512, 1, 864]
    - [359, 14.875]
  - - [256, 128, 1, 3456]
    - [360, 4.092]
  - - [256, 128, 1, 4096]
    - [361, 4.705]
  - - [256, 128, 1, 55296]
    - [362, 23.356]
  - - [256, 128, 1, 6912]
    - [363, 7.019]
  - - [256, 128, 1, 864]
    - [364, 1.331]
  - - [256, 3456, 1, 1]
    - [261, 0.106]
  - - [256, 4096, 1, 1]
    - [365, 0.106]
  - - [256, 6912, 1, 1]
    - [366, 0.15]
  - - [256, 864, 1, 1]
    - [367, 0.029]
  - - [480, 1024, 1, 3456]
    - [368, 27.267]
  - - [480, 1024, 1, 4096]
    - [369, 30.388]
  - - [480, 1024, 1, 6912]
    - [358, 38.26]
  - - [480, 1024, 1, 864]
    - [370, 14.774]
  - - [512, 256, 1, 3456]
    - [371, 11.908]
  - - [512, 256, 1, 4096]
    - [372, 13.292]
  - - [512, 256, 1, 55296]
    - [373, 50.168]
  - - [512, 256, 1, 6912]
    - [374, 19.053]
  - - [512, 256, 1, 864]
    - [375, 5.195]
  - - [30528, 1024, 1, 640]
    - [258, 58.491]
  - - [30528, 1024, 1, 1280]
    - [258, 71.627]
  - - [4096, 1024, 1, 10240]
    - [295, 73.2]
  - - [1024, 4096, 1, 10240]
    - [259, 74.159]
  - - [30528, 1024, 1, 1600]
    - [258, 73.981]
  - - [1024, 2, 1, 80]
    - [367, 0.019]
  - - [1024, 1024, 1, 10240]
    - [289, 54.582]
  - - [1024, 1024, 1, 80]
    - [376, 7.073]
  - - [64, 128, 1280, 128]
    - [377, 16.636]
  - - [128, 64, 1280, 128]
    - [378, 16.062]
  - - [1024, 4096, 1, 10496]
    - [293, 73.833]
  - - [30528, 1024, 1, 1640]
    - [258, 69.513]
  - - [4096, 1024, 1, 10496]
    - [269, 72.982]
  - - [1024, 1024, 1, 10496]
    - [291, 55.049]
  - - [1024, 1024, 1, 82]
    - [379, 6.336]
  - - [1024, 2, 1, 82]
    - [380, 0.017]
  - - [128, 64, 1312, 128]
    - [381, 15.875]
  - - [64, 128, 1312, 128]
    - [377, 16.38]
  - - [30528, 1024, 1, 160]
    - [382, 32.778]
  - - [1024, 4096, 1, 6144]
    - [259, 71.647]
  - - [30528, 1024, 1, 240]
    - [382, 39.356]
  - - [4096, 1024, 1, 6144]
    - [294, 70.392]
  - - [1024, 1024, 1, 12]
    - [383, 1.143]
  - - [1024, 2, 1, 12]
    - [384, 0.003]
  - - [1024, 1024, 1, 6144]
    - [289, 45.744]
  - - [64, 512, 192, 512]
    - [385, 28.986]
  - - [512, 64, 192, 512]
    - [378, 26.915]
  - - [3136, 64, 64, 128]
    - [386, 19.651]
  - - [3136, 64, 64, 256]
    - [387, 26.235]
  - - [3136, 128, 64, 256]
    - [388, 36.161]
  - - [784, 256, 64, 512]
    - [389, 43.868]
  - - [3136, 256, 64, 128]
    - [382, 30.544]
  - - [3136, 256, 64, 256]
    - [258, 43.821]
  - - [784, 512, 64, 256]
    - [390, 37.369]
  - - [784, 512, 64, 512]
    - [283, 51.183]
  - - [3136, 64, 32, 128]
    - [381, 17.021]
  - - [3136, 64, 32, 256]
    - [378, 23.781]
  - - [3136, 128, 32, 256]
    - [388, 33.304]
  - - [784, 256, 32, 512]
    - [391, 38.563]
  - - [3136, 256, 32, 128]
    - [392, 28.494]
  - - [3136, 256, 32, 256]
    - [392, 40.043]
  - - [784, 512, 32, 256]
    - [393, 34.345]
  - - [784, 512, 32, 512]
    - [313, 45.827]
  - - [3136, 256, 32, 64]
    - [394, 17.564]
  - - [3136, 64, 32, 64]
    - [395, 11.517]
  - - [784, 512, 32, 128]
    - [396, 24.27]
  - - [784, 128, 32, 512]
    - [397, 32.257]
  - - [3136, 64, 64, 64]
    - [398, 12.909]
  - - [3136, 256, 64, 64]
    - [394, 18.81]
  - - [784, 128, 64, 512]
    - [399, 36.855]
  - - [784, 512, 64, 128]
    - [400, 27.042]
  - - [64, 1280, 64, 192]
    - [396, 22.483]
  - - [64, 1280, 64, 320]
    - [396, 27.74]
  - - [64, 1280, 64, 384]
    - [401, 29.578]
  - - [64, 1280, 64, 448]
    - [402, 31.267]
  - - [64, 2048, 64, 192]
    - [403, 23.442]
  - - [64, 2048, 64, 320]
    - [404, 28.612]
  - - [64, 2048, 64, 384]
    - [405, 30.145]
  - - [64, 2048, 64, 448]
    - [366, 31.656]
  - - [64, 1280, 32, 192]
    - [406, 20.129]
  - - [64, 1280, 32, 320]
    - [406, 26.168]
  - - [64, 1280, 32, 384]
    - [396, 27.385]
  - - [64, 1280, 32, 448]
    - [396, 28.771]
  - - [64, 2048, 32, 192]
    - [407, 20.535]
  - - [64, 2048, 32, 320]
    - [401, 25.021]
  - - [64, 2048, 32, 384]
    - [397, 26.63]
  - - [64, 2048, 32, 448]
    - [402, 27.957]
  - - [1024, 1024, 1, 10224]
    - [408, 53.366]
  - - [1024, 1024, 1, 10192]
    - [287, 52.889]
  - - [1024, 1024, 1, 10208]
    - [289, 54.738]
  - - [1024, 4096, 1, 10224]
    - [259, 73.179]
  - - [4096, 1024, 1, 10224]
    - [271, 72.714]
  - - [1024, 3072, 1, 10224]
    - [313, 71.612]
  - - [1024, 3072, 1, 10240]
    - [258, 72.032]
  - - [4096, 1024, 1, 10192]
    - [284, 72.592]
  - - [1024, 3072, 1, 10192]
    - [345, 71.677]
  - - [1024, 4096, 1, 10192]
    - [259, 72.896]
  - - [1024, 3072, 1, 10200]
    - [345, 71.392]
  - - [1024, 1024, 1, 10184]
    - [280, 53.498]
  - - [4096, 1024, 1, 10208]
    - [265, 72.065]
  - - [1024, 3072, 1, 10208]
    - [258, 72.465]
  - - [1024, 4096, 1, 10208]
    - [259, 74.173]
  - - [1024, 2048, 1, 10224]
    - [308, 62.666]
  - - [1024, 2048, 1, 10240]
    - [409, 63.8]
  - - [1024, 1024, 1, 10120]
    - [287, 53.825]
  - - [1024, 2048, 1, 10192]
    - [308, 62.842]
  - - [64, 24, 6816, 24]
    - [410, 3.541]
  - - [1024, 1024, 1, 10152]
    - [290, 54.112]
  - - [1024, 3072, 1, 10080]
    - [345, 73.036]
  - - [64, 26, 6272, 26]
    - [411, 3.987]
  - - [100352, 256, 1, 512]
    - [412, 53.172]
  - - [12544, 1024, 1, 2048]
    - [259, 68.633]
  - - [12544, 147, 1, 64]
    - [413, 7.462]
  - - [200704, 256, 1, 512]
    - [283, 52.258]
  - - [25088, 512, 1, 1024]
    - [283, 60.697]
  - - [3136, 576, 1, 64]
    - [414, 8.014]
  - - [50176, 512, 1, 1024]
    - [283, 69.505]
  - - [6272, 1024, 1, 2048]
    - [313, 66.002]
  - - [784, 1152, 1, 128]
    - [354, 9.015]
  - - [3136, 256, 128, 128]
    - [415, 31.898]
  - - [3136, 256, 256, 128]
    - [416, 33.224]
  - - [3136, 256, 128, 64]
    - [417, 19.569]
  - - [3136, 256, 256, 64]
    - [418, 19.973]
  - - [3136, 64, 128, 256]
    - [378, 27.774]
  - - [3136, 64, 256, 256]
    - [378, 28.963]
  - - [3136, 64, 128, 64]
    - [419, 13.9]
  - - [3136, 64, 256, 64]
    - [420, 14.55]
  - - [784, 128, 128, 512]
    - [421, 40.679]
  - - [784, 128, 256, 512]
    - [422, 44.246]
  - - [784, 512, 128, 128]
    - [393, 29.266]
  - - [784, 512, 256, 128]
    - [393, 30.431]
  - - [784, 512, 128, 256]
    - [282, 40.8]
  - - [784, 512, 256, 256]
    - [423, 43.039]
  - - [64, 128, 2048, 128]
    - [424, 17.251]
  - - [128, 64, 2048, 128]
    - [378, 16.903]
  - - [30528, 1024, 1, 2560]
    - [269, 76.467]
  - - [1024, 1024, 1, 128]
    - [425, 10.467]
  - - [1024, 2, 1, 128]
    - [426, 0.029]
  - - [128, 64, 1536, 128]
    - [398, 16.618]
  - - [64, 128, 1536, 128]
    - [353, 16.784]
  - - [1024, 4096, 1, 12288]
    - [269, 74.159]
  - - [30528, 1024, 1, 1920]
    - [282, 73.985]
  - - [1024, 1024, 1, 96]
    - [427, 8.487]
  - - [1024, 1024, 1, 12288]
    - [292, 57.229]
  - - [4096, 1024, 1, 12288]
    - [284, 74.548]
  - - [1024, 2, 1, 96]
    - [426, 0.023]
  - - [25600, 128, 25, 128]
    - [428, 26.936]
  - - [12544, 128, 36, 128]
    - [429, 26.754]
  - - [9216, 128, 49, 128]
    - [319, 27.058]
  - - [6400, 128, 64, 128]
    - [388, 27.129]
  - - [6400, 256, 25, 256]
    - [423, 43.286]
  - - [4096, 256, 36, 256]
    - [257, 42.84]
  - - [2304, 256, 49, 256]
    - [391, 41.019]
  - - [2304, 256, 64, 256]
    - [430, 42.24]
  - - [2304, 512, 25, 512]
    - [313, 58.657]
  - - [1024, 512, 36, 512]
    - [389, 54.976]
  - - [1024, 512, 49, 512]
    - [283, 56.804]
  - - [1024, 512, 64, 512]
    - [313, 58.634]
  - - [92416, 64, 25, 64]
    - [431, 14.064]
  - - [50176, 64, 36, 64]
    - [432, 14.273]
  - - [36864, 64, 49, 64]
    - [415, 14.315]
  - - [25600, 64, 64, 64]
    - [433, 14.424]
  - - [64, 128, 192, 128]
    - [396, 12.477]
  - - [128, 64, 192, 128]
    - [434, 10.828]
  - - [768, 2, 1, 2048]
    - [435, 0.161]
  - - [3072, 768, 1, 2048]
    - [436, 52.702]
  - - [768, 3072, 1, 2048]
    - [437, 52.887]
  - - [768, 768, 1, 2048]
    - [419, 25.987]
  - - [64, 384, 144, 384]
    - [397, 26.385]
  - - [384, 64, 144, 384]
    - [378, 23.727]
  - - [768, 2, 1, 4608]
    - [438, 0.315]
  - - [3072, 768, 1, 4608]
    - [439, 62.075]
  - - [768, 3072, 1, 4608]
    - [436, 61.29]
  - - [768, 768, 1, 4608]
    - [357, 35.875]
  - - [64, 512, 48, 512]
    - [440, 24.548]
  - - [512, 64, 48, 512]
    - [391, 21.719]
  - - [64, 128, 256, 128]
    - [396, 14.034]
  - - [128, 64, 256, 128]
    - [441, 11.523]
  - - [64, 384, 192, 384]
    - [442, 27.438]
  - - [384, 64, 192, 384]
    - [443, 24.258]
  - - [1024, 2, 1, 4608]
    - [444, 0.405]
  - - [4096, 1024, 1, 4608]
    - [259, 70.516]
  - - [1024, 4096, 1, 4608]
    - [269, 69.889]
  - - [1024, 1024, 1, 4608]
    - [445, 43.521]
  - - [13, 512, 1, 3456]
    - [454, 1.015]
  - - [13, 512, 1, 4096]
    - [455, 1.198]
  - - [13, 512, 1, 55296]
    - [446, 5.267]
  - - [13, 512, 1, 6912]
    - [456, 1.794]
  - - [13, 512, 1, 864]
    - [457, 0.286]
  - - [196, 512, 64, 1024]
    - [458, 35.679]
  - - [196, 1024, 64, 512]
    - [459, 33.577]
  - - [196, 1024, 64, 1024]
    - [460, 41.983]
  - - [49, 1024, 64, 2048]
    - [461, 26.529]
  - - [49, 2048, 64, 1024]
    - [461, 26.403]
  - - [196, 512, 32, 1024]
    - [462, 31.466]
  - - [196, 1024, 32, 512]
    - [463, 31.242]
  - - [196, 1024, 32, 1024]
    - [464, 37.945]
  - - [49, 1024, 32, 2048]
    - [465, 25.265]
  - - [49, 2048, 32, 1024]
    - [466, 23.017]
  - - [196, 1024, 32, 256]
    - [467, 23.173]
  - - [196, 256, 32, 1024]
    - [468, 28.6]
  - - [49, 2048, 32, 512]
    - [469, 18.405]
  - - [49, 512, 32, 2048]
    - [470, 19.983]
  - - [196, 256, 64, 1024]
    - [471, 31.306]
  - - [196, 1024, 64, 256]
    - [472, 26.506]
  - - [49, 512, 64, 2048]
    - [473, 24.56]
  - - [49, 2048, 64, 512]
    - [474, 21.326]
  - - [1225, 192, 64, 32]
    - [475, 8.57]
  - - [1225, 192, 64, 48]
    - [476, 10.323]
  - - [1225, 192, 64, 64]
    - [477, 14.043]
  - - [1225, 256, 64, 48]
    - [478, 12.134]
  - - [1225, 256, 64, 64]
    - [465, 15.178]
  - - [1225, 288, 64, 48]
    - [479, 10.767]
  - - [1225, 288, 64, 64]
    - [480, 14.651]
  - - [5329, 64, 64, 80]
    - [481, 14.565]
  - - [289, 768, 64, 128]
    - [474, 20.501]
  - - [289, 768, 64, 160]
    - [482, 23.347]
  - - [289, 768, 64, 192]
    - [483, 25.729]
  - - [1225, 192, 32, 32]
    - [477, 7.365]
  - - [1225, 192, 32, 48]
    - [481, 9.497]
  - - [1225, 192, 32, 64]
    - [477, 12.35]
  - - [1225, 256, 32, 48]
    - [474, 10.508]
  - - [1225, 256, 32, 64]
    - [474, 13.386]
  - - [1225, 288, 32, 48]
    - [484, 9.697]
  - - [1225, 288, 32, 64]
    - [485, 12.476]
  - - [5329, 64, 32, 80]
    - [486, 13.308]
  - - [289, 768, 32, 128]
    - [474, 17.578]
  - - [289, 768, 32, 160]
    - [470, 20.374]
  - - [289, 768, 32, 192]
    - [461, 22.627]
  - - [196, 2304, 1, 256]
    - [487, 7.461]
  - - [49, 4608, 1, 512]
    - [488, 6.327]
  - - [196, 1024, 128, 256]
    - [472, 29.114]
  - - [196, 1024, 256, 256]
    - [459, 30.529]
  - - [196, 1024, 128, 512]
    - [459, 35.27]
  - - [196, 1024, 256, 512]
    - [459, 36.646]
  - - [196, 256, 128, 1024]
    - [468, 35.576]
  - - [196, 256, 256, 1024]
    - [460, 38.818]
  - - [49, 2048, 128, 512]
    - [489, 23.086]
  - - [49, 2048, 256, 512]
    - [490, 24.155]
  - - [49, 512, 128, 2048]
    - [461, 25.496]
  - - [49, 512, 256, 2048]
    - [491, 29.526]
- null
