library/src/blas3/Tensile/Logic/aldebaran/aldebaran_Cijk_Alik_Bljk_I8II_BH.yaml
- {MinimumRequiredVersion: 4.25.0}
- aldebaran
- gfx90a
- [Device 7400, Device 7408, Device 740c]
    SolutionIndex: 0
    SolutionNameMin: Cijk_Alik_Bljk_I8II_BH_MT64x64x64_MI32x32x8x1_SE_1LDSB0_EPS1_GRVW4_LPA4_LPB4_OPLV0_PK0_PAP0_PGR1_PLR1_SU32_SUS256_SRVW0_TT1_32_WG64_4_1_WGM8
    SolutionIndex: 1
    SolutionNameMin: Cijk_Alik_Bljk_I8II_BH_MT64x64x128_MI32x32x8x1_SE_1LDSB1_EPS1_GRVW16_LPA16_LPB16_OPLV0_PKn1_PAP0_PGR1_PLR17_SU0_SUS256_SRVW4_TT1_32_WG64_4_1_WGM1
    SolutionIndex: 2
    SolutionNameMin: Cijk_Alik_Bljk_I8II_BH_MT64x64x128_MI32x32x8x1_SE_1LDSB1_EPS0_GRVW16_LPA16_LPB16_OPLV0_PKn1_PAP0_PGR2_PLR17_SU0_SUS256_SRVW4_TT1_32_WG64_4_1_WGM1
    SolutionIndex: 3
    SolutionNameMin: Cijk_Alik_Bljk_I8II_BH_MT64x64x128_MI32x32x8x1_SE_1LDSB1_EPS0_GRVW16_LPA16_LPB16_OPLV0_PKn1_PAP0_PGR2_PLR17_SU0_SUS128_SRVW4_TT1_32_WG64_4_1_WGM2
    SolutionIndex: 4
    SolutionNameMin: Cijk_Alik_Bljk_I8II_BH_MT64x128x64_MI32x32x8x1_SE_1LDSB0_EPS1_GRVW16_LPA16_LPB16_OPLV1_PKn1_PAP1_PGR1_PLR9_SU32_SUS128_SRVW4_TT1_64_WG64_4_1_WGM2
    SolutionIndex: 5
    SolutionNameMin: Cijk_Alik_Bljk_I8II_BH_MT64x128x128_MI32x32x8x1_SE_1LDSB1_EPS1_GRVW16_LPA16_LPB16_OPLV1_PKn1_PAP1_PGR1_PLR17_SU32_SUS128_SRVW4_TT1_64_WG64_4_1_WGM2
    SolutionIndex: 6
    SolutionNameMin: Cijk_Alik_Bljk_I8II_BH_MT32x32x128_MI16x16x16x1_SE_1LDSB0_EPS1_GRVW8_LPA32_LPB32_OPLV0_PK0_PAP0_PGR1_PLR9_SU0_SUS128_SRVW0_TT1_16_WG32_8_1_WGM1
    SolutionIndex: 7
    SolutionNameMin: Cijk_Alik_Bljk_I8II_BH_MT32x32x128_MI16x16x16x1_SE_1LDSB0_EPS0_GRVW4_LPA32_LPB32_OPLV0_PK0_PAP0_PGR2_PLR9_SU0_SUS128_SRVW0_TT1_16_WG32_8_1_WGM1
    SolutionIndex: 8
    SolutionNameMin: Cijk_Alik_Bljk_I8II_BH_MT64x32x128_MI16x16x16x1_SE_1LDSB0_EPS0_GRVW4_LPA32_LPB32_OPLV0_PK0_PAP0_PGR2_PLR9_SU0_SUS128_SRVW0_TT2_16_WG32_8_1_WGM1
    SolutionIndex: 9
    SolutionNameMin: Cijk_Alik_Bljk_I8II_BH_MT32x32x128_MI16x16x16x1_SE_1LDSB0_EPS0_GRVW8_LPA32_LPB32_OPLV0_PK0_PAP0_PGR2_PLR9_SU0_SUS128_SRVW0_TT1_16_WG32_8_1_WGM1
    SolutionIndex: 10
    SolutionNameMin: Cijk_Alik_Bljk_I8II_BH_MT128x96x64_MI32x32x8x1_SE_1LDSB0_EPS0_GRVW4_LPA16_LPB16_OPLV0_PK0_PAP0_PGR2_PLR9_SU0_SUS128_SRVW4_TT1_96_WG128_2_1_WGM1
    SolutionIndex: 11
    SolutionNameMin: Cijk_Alik_Bljk_I8II_BH_MT64x64x128_MI32x32x8x1_SE_1LDSB0_EPS0_GRVW16_LPA16_LPB16_OPLV0_PK0_PAP0_PGR2_PLR17_SU0_SUS128_SRVW4_TT1_32_WG64_4_1_WGM1
    SolutionIndex: 12
    SolutionNameMin: Cijk_Alik_Bljk_I8II_BH_MT32x32x128_MI16x16x16x1_SE_1LDSB1_EPS1_GRVW16_LPA32_LPB32_OPLV0_PK0_PAP0_PGR1_PLR9_SU0_SUS128_SRVW0_TT1_16_WG32_8_1_WGM1
    SolutionIndex: 13
    SolutionNameMin: Cijk_Alik_Bljk_I8II_BH_MT32x32x128_MI16x16x16x1_SE_1LDSB1_EPS0_GRVW16_LPA32_LPB32_OPLV0_PK0_PAP0_PGR2_PLR9_SU0_SUS128_SRVW0_TT1_16_WG32_8_1_WGM1
    SolutionIndex: 14
    SolutionNameMin: Cijk_Alik_Bljk_I8II_BH_MT32x32x128_MI16x16x16x1_SE_1LDSB0_EPS0_GRVW16_LPA32_LPB32_OPLV0_PK0_PAP0_PGR2_PLR9_SU0_SUS256_SRVW0_TT1_16_WG32_8_1_WGM1
    SolutionIndex: 15
    SolutionNameMin: Cijk_Alik_Bljk_I8II_BH_MT64x128x64_MI32x32x8x1_SE_1LDSB0_EPS0_GRVW16_LPA16_LPB16_OPLV0_PK0_PAP0_PGR2_PLR9_SU0_SUS256_SRVW4_TT1_64_WG64_4_1_WGM1
    SolutionIndex: 16
    SolutionNameMin: Cijk_Alik_Bljk_I8II_BH_MT64x32x128_MI16x16x16x1_SE_1LDSB1_EPS1_GRVW16_LPA32_LPB32_OPLV0_PK0_PAP0_PGR1_PLR9_SU0_SUS256_SRVW0_TT2_16_WG32_8_1_WGM1
    SolutionIndex: 17
    SolutionNameMin: Cijk_Alik_Bljk_I8II_BH_MT32x32x128_MI16x16x16x1_SE_1LDSB1_EPS0_GRVW16_LPA32_LPB32_OPLV0_PK0_PAP0_PGR2_PLR9_SU0_SUS256_SRVW0_TT1_16_WG32_8_1_WGM1
    SolutionIndex: 18
    SolutionNameMin: Cijk_Alik_Bljk_I8II_BH_MT128x96x128_MI32x32x8x1_SE_1LDSB1_EPS1_GRVW4_LPA16_LPB16_OPLV0_PK0_PAP0_PGR1_PLR17_SU0_SUS256_SRVW4_TT1_96_WG128_2_1_WGM1
    SolutionIndex: 19
    SolutionNameMin: Cijk_Alik_Bljk_I8II_BH_MT64x64x128_MI32x32x8x1_SE_1LDSB1_EPS1_GRVW16_LPA16_LPB16_OPLV0_PK0_PAP0_PGR1_PLR17_SU0_SUS256_SRVW4_TT1_32_WG64_4_1_WGM1
    SolutionIndex: 20
    SolutionNameMin: Cijk_Alik_Bljk_I8II_BH_MT128x96x128_MI32x32x8x1_SE_1LDSB1_EPS1_GRVW16_LPA16_LPB16_OPLV0_PK0_PAP0_PGR1_PLR17_SU0_SUS256_SRVW4_TT1_96_WG128_2_1_WGM1
    SolutionIndex: 21
    SolutionNameMin: Cijk_Alik_Bljk_I8II_BH_MT64x64x128_MI32x32x8x1_SE_1LDSB1_EPS0_GRVW16_LPA16_LPB16_OPLV0_PK0_PAP0_PGR2_PLR17_SU0_SUS256_SRVW4_TT1_32_WG64_4_1_WGM1
    SolutionIndex: 22
    SolutionNameMin: Cijk_Alik_Bljk_I8II_BH_MT64x32x128_MI16x16x16x1_SE_1LDSB0_EPS0_GRVW4_LPA32_LPB32_OPLV0_PK0_PAP0_PGR2_PLR9_SU32_SUS128_SRVW0_TT2_16_WG32_8_1_WGM1
    SolutionIndex: 23
    SolutionNameMin: Cijk_Alik_Bljk_I8II_BH_MT32x32x128_MI16x16x16x1_SE_1LDSB0_EPS0_GRVW16_LPA32_LPB32_OPLV0_PK0_PAP0_PGR2_PLR9_SU32_SUS128_SRVW0_TT1_16_WG32_8_1_WGM1
    SolutionIndex: 24
    SolutionNameMin: Cijk_Alik_Bljk_I8II_BH_MT64x64x128_MI32x32x8x1_SE_1LDSB1_EPS1_GRVW8_LPA16_LPB16_OPLV0_PK0_PAP0_PGR1_PLR17_SU32_SUS128_SRVW4_TT1_32_WG64_4_1_WGM1
    SolutionIndex: 25
    SolutionNameMin: Cijk_Alik_Bljk_I8II_BH_MT64x64x128_MI32x32x8x1_SE_1LDSB1_EPS1_GRVW16_LPA16_LPB16_OPLV0_PK0_PAP0_PGR1_PLR17_SU32_SUS128_SRVW4_TT1_32_WG64_4_1_WGM1
    SolutionIndex: 26
    SolutionNameMin: Cijk_Alik_Bljk_I8II_BH_MT64x64x128_MI32x32x8x1_SE_1LDSB1_EPS0_GRVW8_LPA16_LPB16_OPLV0_PK0_PAP0_PGR2_PLR17_SU32_SUS128_SRVW4_TT1_32_WG64_4_1_WGM1
    SolutionIndex: 27
    SolutionNameMin: Cijk_Alik_Bljk_I8II_BH_MT128x64x128_MI32x32x8x1_SE_1LDSB0_EPS0_GRVW16_LPA16_LPB16_OPLV0_PK0_PAP0_PGR2_PLR17_SU0_SUS128_SRVW4_TT2_32_WG64_4_1_WGM2
    SolutionIndex: 28
    SolutionNameMin: Cijk_Alik_Bljk_I8II_BH_MT64x128x128_MI32x32x8x1_SE_1LDSB1_EPS1_GRVW16_LPA16_LPB16_OPLV0_PK0_PAP0_PGR1_PLR17_SU0_SUS128_SRVW4_TT1_64_WG64_4_1_WGM2
    SolutionIndex: 29
    SolutionNameMin: Cijk_Alik_Bljk_I8II_BH_MT32x32x128_MI16x16x16x1_SE_1LDSB0_EPS0_GRVW16_LPA32_LPB32_OPLV0_PK0_PAP0_PGR2_PLR9_SU0_SUS256_SRVW0_TT1_16_WG32_8_1_WGM2
    SolutionIndex: 30
    SolutionNameMin: Cijk_Alik_Bljk_I8II_BH_MT64x64x128_MI32x32x8x1_SE_1LDSB1_EPS0_GRVW16_LPA16_LPB16_OPLV0_PK0_PAP0_PGR2_PLR17_SU32_SUS128_SRVW4_TT1_32_WG64_4_1_WGM2
    SolutionIndex: 31
    SolutionNameMin: Cijk_Alik_Bljk_I8II_BH_MT32x32x128_MI16x16x16x1_SE_1LDSB0_EPS0_GRVW16_LPA32_LPB32_OPLV0_PK0_PAP0_PGR2_PLR9_SU0_SUS128_SRVW0_TT1_16_WG32_8_1_WGM15
    SolutionIndex: 32
    SolutionNameMin: Cijk_Alik_Bljk_I8II_BH_MT64x144x128_MI16x16x16x1_SE_1LDSB1_EPS0_GRVW4_LPA32_LPB32_OPLV0_PK0_PAP0_PGR2_PLR9_SU0_SUS128_SRVW0_TT1_144_WG64_4_1_WGM15
    SolutionIndex: 33
    SolutionNameMin: Cijk_Alik_Bljk_I8II_BH_MT32x64x128_MI16x16x16x1_SE_1LDSB1_EPS0_GRVW16_LPA32_LPB32_OPLV0_PK0_PAP0_PGR2_PLR9_SU0_SUS128_SRVW0_TT1_32_WG32_8_1_WGM15
    SolutionIndex: 34
    SolutionNameMin: Cijk_Alik_Bljk_I8II_BH_MT64x64x64_MI32x32x8x1_SE_1LDSB0_EPS1_GRVW16_LPA16_LPB16_OPLV0_PK0_PAP0_PGR1_PLR9_SU0_SUS256_SRVW4_TT1_32_WG64_4_1_WGM15
    SolutionIndex: 35
    SolutionNameMin: Cijk_Alik_Bljk_I8II_BH_MT96x96x128_MI16x16x16x1_SE_1LDSB1_EPS1_GRVW4_LPA32_LPB32_OPLV0_PK0_PAP0_PGR1_PLR9_SU0_SUS256_SRVW0_TT3_48_WG32_8_1_WGM15
    SolutionIndex: 36
    SolutionNameMin: Cijk_Alik_Bljk_I8II_BH_MT32x32x128_MI16x16x16x1_SE_1LDSB1_EPS1_GRVW16_LPA32_LPB32_OPLV0_PK0_PAP0_PGR1_PLR9_SU0_SUS256_SRVW0_TT1_16_WG32_8_1_WGM15
    SolutionIndex: 37
    SolutionNameMin: Cijk_Alik_Bljk_I8II_BH_MT64x128x128_MI32x32x8x1_SE_1LDSB1_EPS1_GRVW16_LPA16_LPB16_OPLV0_PK0_PAP0_PGR1_PLR17_SU0_SUS256_SRVW4_TT1_64_WG64_4_1_WGM15
    SolutionIndex: 38
    SolutionNameMin: Cijk_Alik_Bljk_I8II_BH_MT64x64x128_MI32x32x8x1_SE_1LDSB1_EPS0_GRVW8_LPA16_LPB16_OPLV0_PK0_PAP0_PGR2_PLR17_SU0_SUS256_SRVW4_TT1_32_WG64_4_1_WGM15
    SolutionIndex: 39
    SolutionNameMin: Cijk_Alik_Bljk_I8II_BH_MT128x96x128_MI32x32x8x1_SE_1LDSB1_EPS0_GRVW16_LPA16_LPB16_OPLV0_PK0_PAP0_PGR2_PLR17_SU0_SUS256_SRVW4_TT1_96_WG128_2_1_WGM15
    SolutionIndex: 40
    SolutionNameMin: Cijk_Alik_Bljk_I8II_BH_MT32x32x128_MI16x16x16x1_SE_1LDSB0_EPS0_GRVW16_LPA32_LPB32_OPLV0_PK0_PAP0_PGR2_PLR9_SU32_SUS128_SRVW0_TT1_16_WG32_8_1_WGM15
    SolutionIndex: 41
    SolutionNameMin: Cijk_Alik_Bljk_I8II_BH_MT64x64x64_MI32x32x8x1_SE_1LDSB0_EPS0_GRVW16_LPA16_LPB16_OPLV0_PK0_PAP0_PGR2_PLR9_SU32_SUS128_SRVW4_TT1_32_WG64_4_1_WGM15
    SolutionIndex: 42
    SolutionNameMin: Cijk_Alik_Bljk_I8II_BH_MT64x192x64_MI32x32x8x1_SE_1LDSB1_EPS1_GRVW16_LPA16_LPB16_OPLV0_PK0_PAP0_PGR1_PLR9_SU32_SUS128_SRVW4_TT1_96_WG64_4_1_WGM15
    SolutionIndex: 43
    SolutionNameMin: Cijk_Alik_Bljk_I8II_BH_MT64x128x64_MI32x32x8x1_SE_1LDSB0_EPS0_GRVW16_LPA16_LPB16_OPLV0_PK0_PAP0_PGR2_PLR9_SU32_SUS256_SRVW4_TT1_64_WG64_4_1_WGM15
    SolutionIndex: 44
    SolutionNameMin: Cijk_Alik_Bljk_I8II_BH_MT64x64x64_MI32x32x8x1_SE_1LDSB0_EPS1_GRVW4_LPA4_LPB4_OPLV0_PK0_PAP0_PGR1_PLR1_SU32_SUS256_SRVW0_TT1_32_WG64_4_1_WGM8
    SolutionIndex: 45
    SolutionNameMin: Cijk_Alik_Bljk_I8II_BH_MT128x128x64_MI32x32x8x1_SE_1LDSB1_EPS1_GRVW16_LPA16_LPB16_OPLV0_PK0_PAP0_PGR1_PLR9_SU0_SUS256_SRVW4_TT1_128_WG128_2_1_WGM2
    SolutionIndex: 46
    SolutionNameMin: Cijk_Alik_Bljk_I8II_BH_MT128x128x64_MI32x32x8x1_SE_1LDSB1_EPS0_GRVW16_LPA16_LPB16_OPLV0_PK0_PAP0_PGR2_PLR9_SU0_SUS128_SRVW4_TT1_128_WG128_2_1_WGM15
    SolutionIndex: 47
    SolutionNameMin: Cijk_Alik_Bljk_I8II_BH_MT64x128x128_MI32x32x8x1_SE_1LDSB1_EPS1_GRVW16_LPA16_LPB16_OPLV0_PK0_PAP0_PGR1_PLR17_SU32_SUS256_SRVW4_TT1_64_WG64_4_1_WGM15
    SolutionIndex: 48
    SolutionNameMin: Cijk_Alik_Bljk_I8II_BH_MT128x64x128_MI32x32x8x1_SE_1LDSB1_EPS1_GRVW16_LPA16_LPB16_OPLV1_PKn1_PAP1_PGR1_PLR17_SU32_SUS256_SRVW4_TT1_64_WG128_2_1_WGM2
    SolutionIndex: 49
    SolutionNameMin: Cijk_Alik_Bljk_I8II_BH_MT128x96x128_MI32x32x8x1_SE_1LDSB1_EPS1_GRVW4_LPA16_LPB16_OPLV0_PK0_PAP0_PGR1_PLR17_SU32_SUS128_SRVW4_TT1_96_WG128_2_1_WGM2
    SolutionIndex: 50
    SolutionNameMin: Cijk_Alik_Bljk_I8II_BH_MT128x64x128_MI32x32x8x1_SE_1LDSB1_EPS1_GRVW16_LPA16_LPB16_OPLV0_PK0_PAP0_PGR1_PLR17_SU0_SUS128_SRVW4_TT1_64_WG128_2_1_WGM2
    SolutionIndex: 51
    SolutionNameMin: Cijk_Alik_Bljk_I8II_BH_MT64x128x128_MI32x32x8x1_SE_1LDSB0_EPS0_GRVW16_LPA16_LPB16_OPLV0_PK0_PAP0_PGR2_PLR17_SU0_SUS256_SRVW4_TT1_64_WG64_4_1_WGM2
    SolutionIndex: 52
    SolutionNameMin: Cijk_Alik_Bljk_I8II_BH_MT128x64x128_MI32x32x8x1_SE_1LDSB1_EPS1_GRVW16_LPA16_LPB16_OPLV0_PK0_PAP0_PGR1_PLR17_SU32_SUS128_SRVW4_TT1_64_WG128_2_1_WGM15
    SolutionIndex: 53
    SolutionNameMin: Cijk_Alik_Bljk_I8II_BH_MT128x128x64_MI32x32x8x1_SE_1LDSB1_EPS0_GRVW16_LPA16_LPB16_OPLV0_PK0_PAP0_PGR2_PLR9_SU0_SUS128_SRVW4_TT1_128_WG128_2_1_WGM1
    SolutionIndex: 54
    SolutionNameMin: Cijk_Alik_Bljk_I8II_BH_MT128x64x128_MI32x32x8x1_SE_1LDSB1_EPS1_GRVW16_LPA16_LPB16_OPLV0_PK0_PAP0_PGR1_PLR17_SU0_SUS256_SRVW4_TT1_64_WG128_2_1_WGM2
    SolutionIndex: 55
    SolutionNameMin: Cijk_Alik_Bljk_I8II_BH_MT128x96x128_MI32x32x8x1_SE_1LDSB1_EPS1_GRVW4_LPA16_LPB16_OPLV0_PK0_PAP0_PGR1_PLR17_SU0_SUS256_SRVW4_TT1_96_WG128_2_1_WGM2
    SolutionIndex: 56
    SolutionNameMin: Cijk_Alik_Bljk_I8II_BH_MT64x64x64_MI32x32x8x1_SE_1LDSB0_EPS0_GRVW4_LPA16_LPB16_OPLV0_PK0_PAP0_PGR2_PLR9_SU32_SUS128_SRVW4_TT1_32_WG64_4_1_WGM1
    SolutionIndex: 57
    SolutionNameMin: Cijk_Alik_Bljk_I8II_BH_MT128x128x64_MI32x32x8x1_SE_1LDSB1_EPS1_GRVW16_LPA16_LPB16_OPLV0_PKn1_PAP0_PGR1_PLR9_SU0_SUS128_SRVW4_TT1_128_WG128_2_1_WGM2
    SolutionIndex: 58
    SolutionNameMin: Cijk_Alik_Bljk_I8II_BH_MT128x128x64_MI32x32x8x1_SE_1LDSB1_EPS1_GRVW4_LPA16_LPB16_OPLV0_PK0_PAP0_PGR1_PLR9_SU0_SUS256_SRVW4_TT1_128_WG128_2_1_WGM2
    SolutionIndex: 59
    SolutionNameMin: Cijk_Alik_Bljk_I8II_BH_MT64x64x128_MI32x32x8x1_SE_1LDSB1_EPS0_GRVW16_LPA16_LPB16_OPLV0_PKn1_PAP0_PGR2_PLR17_SU0_SUS256_SRVW4_TT1_32_WG64_4_1_WGM2
    SolutionIndex: 60
    SolutionNameMin: Cijk_Alik_Bljk_I8II_BH_MT128x128x64_MI32x32x8x1_SE_1LDSB0_EPS0_GRVW16_LPA16_LPB16_OPLV0_PK0_PAP0_PGR2_PLR9_SU0_SUS128_SRVW4_TT1_128_WG128_2_1_WGM15
    SolutionIndex: 61
    SolutionNameMin: Cijk_Alik_Bljk_I8II_BH_MT128x64x64_MI32x32x8x1_SE_1LDSB0_EPS1_GRVW16_LPA16_LPB16_OPLV0_PK0_PAP0_PGR1_PLR9_SU0_SUS256_SRVW4_TT1_64_WG128_2_1_WGM1
    SolutionIndex: 62
    SolutionNameMin: Cijk_Alik_Bljk_I8II_BH_MT64x128x128_MI32x32x8x1_SE_1LDSB1_EPS1_GRVW16_LPA16_LPB16_OPLV1_PKn1_PAP1_PGR1_PLR17_SU32_SUS128_SRVW4_TT1_64_WG64_4_1_WGM1
    SolutionIndex: 63
    SolutionNameMin: Cijk_Alik_Bljk_I8II_BH_MT128x128x64_MI32x32x8x1_SE_1LDSB1_EPS0_GRVW16_LPA16_LPB16_OPLV0_PK0_PAP0_PGR2_PLR9_SU0_SUS128_SRVW4_TT1_128_WG128_2_1_WGM2
    SolutionIndex: 64
    SolutionNameMin: Cijk_Alik_Bljk_I8II_BH_MT64x64x64_MI32x32x8x1_SE_1LDSB0_EPS1_GRVW16_LPA16_LPB16_OPLV0_PK0_PAP0_PGR1_PLR9_SU0_SUS128_SRVW4_TT1_32_WG64_4_1_WGM2
    SolutionIndex: 65
    SolutionNameMin: Cijk_Alik_Bljk_I8II_BH_MT64x32x128_MI16x16x16x1_SE_1LDSB0_EPS0_GRVW8_LPA32_LPB32_OPLV0_PK0_PAP0_PGR2_PLR9_SU32_SUS128_SRVW0_TT2_16_WG32_8_1_WGM2
    SolutionIndex: 66
    SolutionNameMin: Cijk_Alik_Bljk_I8II_BH_MT128x128x64_MI32x32x8x1_SE_1LDSB1_EPS0_GRVW16_LPA16_LPB16_OPLV0_PKn1_PAP0_PGR2_PLR9_SU0_SUS128_SRVW4_TT1_128_WG128_2_1_WGM2
    SolutionIndex: 67
    SolutionNameMin: Cijk_Alik_Bljk_I8II_BH_MT32x32x128_MI16x16x16x1_SE_1LDSB0_EPS0_GRVW16_LPA32_LPB32_OPLV0_PK0_PAP0_PGR2_PLR9_SU32_SUS256_SRVW0_TT1_16_WG32_8_1_WGM1
    SolutionIndex: 68
    SolutionNameMin: Cijk_Alik_Bljk_I8II_BH_MT128x128x64_MI32x32x8x1_SE_1LDSB1_EPS0_GRVW16_LPA16_LPB16_OPLV0_PK0_PAP0_PGR2_PLR9_SU32_SUS128_SRVW4_TT1_128_WG128_2_1_WGM1
    SolutionIndex: 69
    SolutionNameMin: Cijk_Alik_Bljk_I8II_BH_MT64x64x64_MI32x32x8x1_SE_1LDSB0_EPS0_GRVW4_LPA16_LPB16_OPLV0_PK0_PAP0_PGR2_PLR9_SU0_SUS128_SRVW4_TT1_32_WG64_4_1_WGM2
    SolutionIndex: 70
    SolutionNameMin: Cijk_Alik_Bljk_I8II_BH_MT128x128x64_MI32x32x8x1_SE_1LDSB1_EPS1_GRVW16_LPA16_LPB16_OPLV0_PK0_PAP0_PGR1_PLR9_SU0_SUS128_SRVW4_TT1_128_WG128_2_1_WGM2
    SolutionIndex: 71
    SolutionNameMin: Cijk_Alik_Bljk_I8II_BH_MT64x64x128_MI32x32x8x1_SE_1LDSB1_EPS1_GRVW16_LPA16_LPB16_OPLV0_PK0_PAP0_PGR1_PLR17_SU32_SUS128_SRVW4_TT1_32_WG64_4_1_WGM2
    SolutionIndex: 72
    SolutionNameMin: Cijk_Alik_Bljk_I8II_BH_MT128x64x128_MI32x32x8x1_SE_1LDSB1_EPS1_GRVW16_LPA16_LPB16_OPLV1_PKn1_PAP1_PGR1_PLR17_SU32_SUS128_SRVW4_TT1_64_WG128_2_1_WGM15
    SolutionIndex: 73
    SolutionNameMin: Cijk_Alik_Bljk_I8II_BH_MT128x64x128_MI32x32x8x1_SE_1LDSB1_EPS1_GRVW16_LPA16_LPB16_OPLV0_PK0_PAP0_PGR1_PLR17_SU0_SUS256_SRVW4_TT1_64_WG128_2_1_WGM15
    SolutionIndex: 74
    SolutionNameMin: Cijk_Alik_Bljk_I8II_BH_MT32x32x128_MI16x16x16x1_SE_1LDSB0_EPS0_GRVW8_LPA32_LPB32_OPLV0_PK0_PAP0_PGR2_PLR9_SU0_SUS128_SRVW0_TT1_16_WG32_8_1_WGM2
    SolutionIndex: 75
    SolutionNameMin: Cijk_Alik_Bljk_I8II_BH_MT144x64x128_MI16x16x16x1_SE_1LDSB1_EPS1_GRVW4_LPA32_LPB32_OPLV0_PK0_PAP0_PGR1_PLR9_SU0_SUS256_SRVW0_TT9_16_WG16_16_1_WGM15
    SolutionIndex: 76
    SolutionNameMin: Cijk_Alik_Bljk_I8II_BH_MT64x64x128_MI32x32x8x1_SE_1LDSB1_EPS0_GRVW4_LPA16_LPB16_OPLV0_PK0_PAP0_PGR2_PLR17_SU32_SUS128_SRVW4_TT1_32_WG64_4_1_WGM1
    SolutionIndex: 77
    SolutionNameMin: Cijk_Alik_Bljk_I8II_BH_MT64x64x128_MI32x32x8x1_SE_1LDSB1_EPS1_GRVW16_LPA16_LPB16_OPLV0_PK0_PAP0_PGR1_PLR17_SU32_SUS128_SRVW4_TT1_32_WG64_4_1_WGM15
    SolutionIndex: 78
    SolutionNameMin: Cijk_Alik_Bljk_I8II_BH_MT64x64x128_MI32x32x8x1_SE_1LDSB1_EPS0_GRVW8_LPA16_LPB16_OPLV0_PK0_PAP0_PGR2_PLR17_SU32_SUS128_SRVW4_TT1_32_WG64_4_1_WGM15
    SolutionIndex: 79
    SolutionNameMin: Cijk_Alik_Bljk_I8II_BH_MT128x64x64_MI32x32x8x1_SE_1LDSB0_EPS0_GRVW16_LPA16_LPB16_OPLV0_PK0_PAP0_PGR2_PLR9_SU0_SUS128_SRVW4_TT1_64_WG128_2_1_WGM15
    SolutionIndex: 80
    SolutionNameMin: Cijk_Alik_Bljk_I8II_BH_MT128x128x64_MI32x32x8x1_SE_1LDSB1_EPS0_GRVW16_LPA16_LPB16_OPLV0_PK0_PAP0_PGR2_PLR9_SU32_SUS128_SRVW4_TT1_128_WG128_2_1_WGM15
    SolutionIndex: 81
    SolutionNameMin: Cijk_Alik_Bljk_I8II_BH_MT32x64x128_MI16x16x16x1_SE_1LDSB1_EPS0_GRVW16_LPA32_LPB32_OPLV0_PK0_PAP0_PGR2_PLR9_SU0_SUS256_SRVW0_TT1_32_WG32_8_1_WGM15
    SolutionIndex: 82
    SolutionNameMin: Cijk_Alik_Bljk_I8II_BH_MT64x64x128_MI32x32x8x1_SE_1LDSB1_EPS1_GRVW16_LPA16_LPB16_OPLV0_PK0_PAP0_PGR1_PLR17_SU0_SUS256_SRVW4_TT1_32_WG64_4_1_WGM15
- - - [35, 35, 1, 512]
    - [0, 0.052]
  - - [4, 64, 1, 128]
    - [44, 0.005]
  - - [480, 512, 1, 512]
    - [12, 21.541]
  - - [960, 1024, 1, 1024]
    - [15, 63.509]
  - - [1920, 2048, 1, 2048]
    - [45, 87.632]
  - - [3840, 4096, 1, 4096]
    - [46, 95.066]
  - - [7680, 8192, 1, 8192]
    - [46, 96.732]
  - - [1024, 128, 1, 128]
    - [17, 4.486]
  - - [1856, 448, 1, 3328]
    - [47, 69.241]
  - - [2944, 4288, 1, 1280]
    - [48, 84.747]
  - - [2368, 64, 1, 3328]
    - [8, 31.537]
  - - [1760, 32, 1, 1760]
    - [7, 8.948]
  - - [2368, 5888, 1, 256]
    - [49, 55.243]
  - - [5888, 1856, 1, 256]
    - [42, 54.055]
  - - [128, 64, 1, 256]
    - [17, 0.526]
  - - [512, 24000, 1, 1536]
    - [50, 86.162]
  - - [128, 6784, 1, 3328]
    - [51, 70.612]
  - - [5888, 1408, 1, 256]
    - [42, 49.041]
  - - [5888, 1856, 1, 3328]
    - [52, 87.359]
  - - [5056, 704, 1, 256]
    - [53, 43.068]
  - - [2048, 400, 1, 512]
    - [34, 37.03]
  - - [5888, 2944, 1, 3328]
    - [46, 91.877]
  - - [1856, 4288, 1, 256]
    - [26, 49.098]
  - - [1024, 5056, 1, 128]
    - [1, 32.414]
  - - [5056, 5056, 1, 3328]
    - [52, 91.424]
  - - [1408, 5888, 1, 1280]
    - [54, 81.577]
  - - [2368, 448, 1, 128]
    - [21, 19.352]
  - - [2368, 6784, 1, 128]
    - [3, 38.512]
  - - [1024, 3584, 1, 3328]
    - [37, 84.438]
  - - [512, 48000, 1, 2048]
    - [18, 90.447]
  - - [128, 448, 1, 1280]
    - [31, 11.512]
  - - [256, 4288, 1, 3328]
    - [32, 76.655]
  - - [5888, 1408, 1, 1280]
    - [28, 81.488]
  - - [704, 1856, 1, 3328]
    - [55, 75.64]
  - - [1024, 2368, 1, 256]
    - [24, 38.303]
  - - [64, 4, 1, 256]
    - [6, 0.013]
  - - [1408, 1856, 1, 1280]
    - [50, 70.822]
  - - [1408, 64, 1, 1280]
    - [23, 16.692]
  - - [448, 1024, 1, 1280]
    - [56, 48.064]
  - - [6144, 24000, 1, 2048]
    - [57, 94.023]
  - - [4096, 32, 1, 4096]
    - [22, 26.867]
  - - [256, 1408, 1, 3328]
    - [38, 53.799]
  - - [5056, 5056, 1, 1280]
    - [5, 86.623]
  - - [448, 5056, 1, 256]
    - [19, 37.948]
  - - [704, 1856, 1, 1280]
    - [10, 63.197]
  - - [128, 5056, 1, 128]
    - [16, 15.929]
  - - [2368, 128, 1, 256]
    - [36, 14.332]
  - - [1760, 6400, 1, 1760]
    - [58, 82.972]
  - - [1856, 1408, 1, 128]
    - [59, 26.679]
  - - [64, 5056, 1, 256]
    - [12, 15.504]
  - - [6784, 256, 1, 3328]
    - [60, 77.27]
  - - [6784, 4288, 1, 3328]
    - [52, 93.375]
  - - [4288, 448, 1, 256]
    - [61, 38.566]
  - - [64, 704, 1, 128]
    - [13, 1.619]
  - - [1856, 2368, 1, 3328]
    - [50, 82.194]
  - - [4288, 2944, 1, 1280]
    - [62, 84.778]
  - - [704, 5056, 1, 1280]
    - [63, 73.64]
  - - [2368, 704, 1, 3328]
    - [43, 74.066]
  - - [256, 5888, 1, 256]
    - [54, 32.631]
  - - [1856, 4288, 1, 3328]
    - [30, 84.26]
  - - [256, 2944, 1, 256]
    - [64, 25.312]
  - - [5888, 1024, 1, 256]
    - [26, 46.596]
  - - [448, 64, 1, 1280]
    - [9, 5.6]
  - - [3072, 64, 1, 1024]
    - [65, 22.977]
  - - [3584, 4, 1, 1280]
    - [23, 2.669]
  - - [16384, 3200, 1, 4096]
    - [66, 92.294]
  - - [2944, 64, 1, 256]
    - [29, 10.417]
  - - [128, 4, 1, 1280]
    - [67, 0.093]
  - - [1408, 2944, 1, 256]
    - [25, 44.4]
  - - [256, 1856, 1, 1280]
    - [41, 45.291]
  - - [6784, 5056, 1, 3328]
    - [52, 93.803]
  - - [5056, 5056, 1, 256]
    - [42, 57.183]
  - - [1408, 6784, 1, 128]
    - [68, 36.712]
  - - [64, 1024, 1, 1280]
    - [31, 12.87]
  - - [2944, 4, 1, 256]
    - [13, 0.711]
  - - [704, 5056, 1, 128]
    - [45, 29.473]
  - - [2368, 2944, 1, 1280]
    - [20, 79.582]
  - - [128, 3584, 1, 1280]
    - [69, 45.415]
  - - [6784, 6784, 1, 1280]
    - [70, 88.975]
  - - [1024, 256, 1, 3328]
    - [11, 40.351]
  - - [1408, 4288, 1, 1280]
    - [71, 76.101]
  - - [3584, 4288, 1, 1280]
    - [72, 84.329]
  - - [2368, 704, 1, 1280]
    - [43, 65.33]
  - - [5056, 4288, 1, 3328]
    - [39, 91.543]
  - - [3584, 2368, 1, 3328]
    - [73, 88.847]
  - - [64, 704, 1, 1280]
    - [74, 9.045]
  - - [4288, 256, 1, 256]
    - [75, 28.586]
  - - [2944, 128, 1, 128]
    - [33, 10.498]
  - - [6144, 32, 1, 2560]
    - [22, 29.686]
  - - [6784, 448, 1, 1280]
    - [35, 69.038]
  - - [1408, 2944, 1, 128]
    - [4, 31.36]
  - - [4288, 2944, 1, 256]
    - [76, 52.204]
  - - [5888, 704, 1, 1280]
    - [77, 73.2]
  - - [5056, 4, 1, 3328]
    - [14, 3.913]
  - - [1856, 64, 1, 1280]
    - [67, 19.228]
  - - [1760, 16, 1, 1760]
    - [29, 4.562]
  - - [448, 5888, 1, 128]
    - [2, 27.717]
  - - [5888, 64, 1, 3328]
    - [78, 52.161]
  - - [2944, 256, 1, 3328]
    - [27, 63.212]
  - - [1024, 64, 1, 128]
    - [13, 2.403]
  - - [5056, 2368, 1, 1280]
    - [5, 82.55]
  - - [448, 3584, 1, 1280]
    - [79, 63.129]
  - - [6784, 5888, 1, 256]
    - [80, 58.781]
  - - [704, 1024, 1, 128]
    - [81, 17.386]
  - - [704, 128, 1, 1280]
    - [40, 16.778]
  - - [1408, 448, 1, 1280]
    - [79, 44.101]
  - - [1024, 1408, 1, 256]
    - [82, 33.864]
- null
