library/src/blas3/Tensile/Logic/aldebaran/arcturus_Cijk_Ailk_Bljk_SB_GB.yaml
- {MinimumRequiredVersion: 4.26.0}
- arcturus
- gfx908
- [Device 7380, Device 7388, Device 738c, Device 7390]
    SolutionIndex: 0
    SolutionNameMin: Cijk_Ailk_Bljk_SB_GB_MT32x32x16_MI16x16x4x1_SN_1LDSB0_EPS1_GRVW1_LPB2_NLCA1_PGR1_PLR5_SRVW2_TT1_16_WG32_8_1_WGM1
    SolutionIndex: 1
    SolutionNameMin: Cijk_Ailk_Bljk_SB_GB_MT32x64x16_MI16x16x4x1_SN_1LDSB0_EPS1_GRVW1_LPB2_NLCA1_PGR1_PLR5_SRVW2_TT1_32_WG32_8_1_WGM1
    SolutionIndex: 2
    SolutionNameMin: Cijk_Ailk_Bljk_SB_GB_MT64x32x16_MI16x16x4x1_SN_1LDSB0_EPS1_GRVW1_LPB2_NLCA1_PGR1_PLR5_SRVW2_TT2_16_WG32_8_1_WGM1
    SolutionIndex: 3
    SolutionNameMin: Cijk_Ailk_Bljk_SB_GB_MT32x32x16_MI16x16x4x1_SN_1LDSB0_EPS0_GRVW1_LPB2_NLCA1_PGR2_PLR5_SRVW2_TT1_16_WG32_8_1_WGM1
    SolutionIndex: 4
    SolutionNameMin: Cijk_Ailk_Bljk_SB_GB_MT64x32x16_MI16x16x4x1_SN_1LDSB0_EPS0_GRVW1_LPB2_NLCA1_PGR2_PLR5_SRVW2_TT2_16_WG32_8_1_WGM1
    SolutionIndex: 5
    SolutionNameMin: Cijk_Ailk_Bljk_SB_GB_MT64x128x16_MI32x32x2x1_SN_1LDSB0_EPS1_GRVW1_LPB2_NLCA1_PGR1_PLR9_SRVW2_TT1_64_WG64_4_1_WGM1
    SolutionIndex: 6
    SolutionNameMin: Cijk_Ailk_Bljk_SB_GB_MT64x128x16_MI32x32x2x1_SN_1LDSB0_EPS0_GRVW1_LPB2_NLCA1_PGR2_PLR9_SRVW2_TT1_64_WG64_4_1_WGM1
    SolutionIndex: 7
    SolutionNameMin: Cijk_Ailk_Bljk_SB_GB_MT32x32x32_MI16x16x4x1_SN_1LDSB0_EPS1_GRVW1_LPB2_NLCA1_PGR1_PLR9_SRVW2_TT1_16_WG32_8_1_WGM1
    SolutionIndex: 8
    SolutionNameMin: Cijk_Ailk_Bljk_SB_GB_MT64x32x32_MI16x16x4x1_SN_1LDSB0_EPS0_GRVW1_LPB2_NLCA1_PGR2_PLR9_SRVW2_TT2_16_WG32_8_1_WGM1
    SolutionIndex: 9
    SolutionNameMin: Cijk_Ailk_Bljk_SB_GB_MT64x32x16_MI16x16x4x1_SN_1LDSB0_EPS1_GRVW2_LPB2_NLCA1_PGR1_PLR5_SRVW2_TT2_16_WG32_8_1_WGM1
    SolutionIndex: 10
    SolutionNameMin: Cijk_Ailk_Bljk_SB_GB_MT32x32x16_MI16x16x4x1_SN_1LDSB0_EPS0_GRVW2_LPB2_NLCA1_PGR2_PLR5_SRVW2_TT1_16_WG32_8_1_WGM1
    SolutionIndex: 11
    SolutionNameMin: Cijk_Ailk_Bljk_SB_GB_MT64x32x16_MI16x16x4x1_SN_1LDSB0_EPS0_GRVW2_LPB2_NLCA1_PGR2_PLR5_SRVW2_TT2_16_WG32_8_1_WGM1
    SolutionIndex: 12
    SolutionNameMin: Cijk_Ailk_Bljk_SB_GB_MT64x128x16_MI32x32x2x1_SN_1LDSB0_EPS1_GRVW2_LPB2_NLCA1_PGR1_PLR9_SRVW2_TT1_64_WG64_4_1_WGM1
    SolutionIndex: 13
    SolutionNameMin: Cijk_Ailk_Bljk_SB_GB_MT64x64x16_MI32x32x2x1_SN_1LDSB0_EPS0_GRVW2_LPB2_NLCA1_PGR2_PLR9_SRVW2_TT1_32_WG64_4_1_WGM1
    SolutionIndex: 14
    SolutionNameMin: Cijk_Ailk_Bljk_SB_GB_MT64x128x16_MI32x32x2x1_SN_1LDSB0_EPS0_GRVW2_LPB2_NLCA1_PGR2_PLR9_SRVW2_TT1_64_WG64_4_1_WGM1
    SolutionIndex: 15
    SolutionNameMin: Cijk_Ailk_Bljk_SB_GB_MT32x32x32_MI16x16x4x1_SN_1LDSB0_EPS1_GRVW2_LPB2_NLCA1_PGR1_PLR9_SRVW2_TT1_16_WG32_8_1_WGM1
    SolutionIndex: 16
    SolutionNameMin: Cijk_Ailk_Bljk_SB_GB_MT32x32x32_MI16x16x4x1_SN_1LDSB0_EPS0_GRVW2_LPB2_NLCA1_PGR2_PLR9_SRVW2_TT1_16_WG32_8_1_WGM1
    SolutionIndex: 17
    SolutionNameMin: Cijk_Ailk_Bljk_SB_GB_MT64x32x16_MI16x16x4x1_SN_1LDSB0_EPS1_GRVW4_LPB4_NLCA1_PGR1_PLR5_SRVW2_TT2_16_WG32_8_1_WGM1
    SolutionIndex: 18
    SolutionNameMin: Cijk_Ailk_Bljk_SB_GB_MT32x32x16_MI16x16x4x1_SN_1LDSB0_EPS0_GRVW4_LPB4_NLCA1_PGR2_PLR5_SRVW2_TT1_16_WG32_8_1_WGM1
    SolutionIndex: 19
    SolutionNameMin: Cijk_Ailk_Bljk_SB_GB_MT64x32x16_MI16x16x4x1_SN_1LDSB0_EPS0_GRVW4_LPB4_NLCA1_PGR2_PLR5_SRVW2_TT2_16_WG32_8_1_WGM1
    SolutionIndex: 20
    SolutionNameMin: Cijk_Ailk_Bljk_SB_GB_MT64x128x16_MI32x32x2x1_SN_1LDSB0_EPS1_GRVW4_LPB4_NLCA1_PGR1_PLR9_SRVW2_TT1_64_WG64_4_1_WGM1
    SolutionIndex: 21
    SolutionNameMin: Cijk_Ailk_Bljk_SB_GB_MT64x64x16_MI32x32x2x1_SN_1LDSB0_EPS0_GRVW4_LPB4_NLCA1_PGR2_PLR9_SRVW2_TT1_32_WG64_4_1_WGM1
    SolutionIndex: 22
    SolutionNameMin: Cijk_Ailk_Bljk_SB_GB_MT64x128x16_MI32x32x2x1_SN_1LDSB0_EPS0_GRVW4_LPB4_NLCA1_PGR2_PLR9_SRVW2_TT1_64_WG64_4_1_WGM1
    SolutionIndex: 23
    SolutionNameMin: Cijk_Ailk_Bljk_SB_GB_MT32x32x32_MI16x16x4x1_SN_1LDSB0_EPS1_GRVW4_LPB4_NLCA1_PGR1_PLR9_SRVW2_TT1_16_WG32_8_1_WGM1
    SolutionIndex: 24
    SolutionNameMin: Cijk_Ailk_Bljk_SB_GB_MT64x32x32_MI16x16x4x1_SN_1LDSB0_EPS1_GRVW4_LPB4_NLCA1_PGR1_PLR9_SRVW2_TT2_16_WG32_8_1_WGM1
    SolutionIndex: 25
    SolutionNameMin: Cijk_Ailk_Bljk_SB_GB_MT32x32x32_MI16x16x4x1_SN_1LDSB0_EPS0_GRVW4_LPB4_NLCA1_PGR2_PLR9_SRVW2_TT1_16_WG32_8_1_WGM1
    SolutionIndex: 26
    SolutionNameMin: Cijk_Ailk_Bljk_SB_GB_MT64x32x32_MI16x16x4x1_SN_1LDSB0_EPS0_GRVW4_LPB4_NLCA1_PGR2_PLR9_SRVW2_TT2_16_WG32_8_1_WGM1
    SolutionIndex: 27
    SolutionNameMin: Cijk_Ailk_Bljk_SB_GB_MT32x32x16_MI16x16x4x1_SN_1LDSB0_EPS1_GRVW1_LPB2_NLCA1_PGR1_PLR5_SRVW2_TT1_16_WG32_8_1_WGM2
    SolutionIndex: 28
    SolutionNameMin: Cijk_Ailk_Bljk_SB_GB_MT32x32x16_MI16x16x4x1_SN_1LDSB0_EPS0_GRVW1_LPB2_NLCA1_PGR2_PLR5_SRVW2_TT1_16_WG32_8_1_WGM2
    SolutionIndex: 29
    SolutionNameMin: Cijk_Ailk_Bljk_SB_GB_MT64x32x16_MI16x16x4x1_SN_1LDSB0_EPS0_GRVW1_LPB2_NLCA1_PGR2_PLR5_SRVW2_TT2_16_WG32_8_1_WGM2
    SolutionIndex: 30
    SolutionNameMin: Cijk_Ailk_Bljk_SB_GB_MT64x128x16_MI32x32x2x1_SN_1LDSB0_EPS1_GRVW1_LPB2_NLCA1_PGR1_PLR9_SRVW2_TT1_64_WG64_4_1_WGM2
    SolutionIndex: 31
    SolutionNameMin: Cijk_Ailk_Bljk_SB_GB_MT64x64x16_MI32x32x2x1_SN_1LDSB0_EPS0_GRVW1_LPB2_NLCA1_PGR2_PLR9_SRVW2_TT1_32_WG64_4_1_WGM2
    SolutionIndex: 32
    SolutionNameMin: Cijk_Ailk_Bljk_SB_GB_MT64x128x16_MI32x32x2x1_SN_1LDSB0_EPS0_GRVW1_LPB2_NLCA1_PGR2_PLR9_SRVW2_TT1_64_WG64_4_1_WGM2
    SolutionIndex: 33
    SolutionNameMin: Cijk_Ailk_Bljk_SB_GB_MT32x32x32_MI16x16x4x1_SN_1LDSB0_EPS0_GRVW1_LPB2_NLCA1_PGR2_PLR9_SRVW2_TT1_16_WG32_8_1_WGM2
    SolutionIndex: 34
    SolutionNameMin: Cijk_Ailk_Bljk_SB_GB_MT32x32x16_MI16x16x4x1_SN_1LDSB0_EPS0_GRVW2_LPB2_NLCA1_PGR2_PLR5_SRVW2_TT1_16_WG32_8_1_WGM2
    SolutionIndex: 35
    SolutionNameMin: Cijk_Ailk_Bljk_SB_GB_MT64x128x16_MI32x32x2x1_SN_1LDSB0_EPS1_GRVW2_LPB2_NLCA1_PGR1_PLR9_SRVW2_TT1_64_WG64_4_1_WGM2
    SolutionIndex: 36
    SolutionNameMin: Cijk_Ailk_Bljk_SB_GB_MT64x64x16_MI32x32x2x1_SN_1LDSB0_EPS0_GRVW2_LPB2_NLCA1_PGR2_PLR9_SRVW2_TT1_32_WG64_4_1_WGM2
    SolutionIndex: 37
    SolutionNameMin: Cijk_Ailk_Bljk_SB_GB_MT64x128x16_MI32x32x2x1_SN_1LDSB0_EPS0_GRVW2_LPB2_NLCA1_PGR2_PLR9_SRVW2_TT1_64_WG64_4_1_WGM2
    SolutionIndex: 38
    SolutionNameMin: Cijk_Ailk_Bljk_SB_GB_MT32x32x32_MI16x16x4x1_SN_1LDSB0_EPS0_GRVW2_LPB2_NLCA1_PGR2_PLR9_SRVW2_TT1_16_WG32_8_1_WGM2
    SolutionIndex: 39
    SolutionNameMin: Cijk_Ailk_Bljk_SB_GB_MT64x32x16_MI16x16x4x1_SN_1LDSB0_EPS1_GRVW4_LPB4_NLCA1_PGR1_PLR5_SRVW2_TT2_16_WG32_8_1_WGM2
    SolutionIndex: 40
    SolutionNameMin: Cijk_Ailk_Bljk_SB_GB_MT32x32x16_MI16x16x4x1_SN_1LDSB0_EPS0_GRVW4_LPB4_NLCA1_PGR2_PLR5_SRVW2_TT1_16_WG32_8_1_WGM2
    SolutionIndex: 41
    SolutionNameMin: Cijk_Ailk_Bljk_SB_GB_MT64x32x16_MI16x16x4x1_SN_1LDSB0_EPS0_GRVW4_LPB4_NLCA1_PGR2_PLR5_SRVW2_TT2_16_WG32_8_1_WGM2
    SolutionIndex: 42
    SolutionNameMin: Cijk_Ailk_Bljk_SB_GB_MT64x64x16_MI32x32x2x1_SN_1LDSB0_EPS1_GRVW4_LPB4_NLCA1_PGR1_PLR9_SRVW2_TT1_32_WG64_4_1_WGM2
    SolutionIndex: 43
    SolutionNameMin: Cijk_Ailk_Bljk_SB_GB_MT64x128x16_MI32x32x2x1_SN_1LDSB0_EPS1_GRVW4_LPB4_NLCA1_PGR1_PLR9_SRVW2_TT1_64_WG64_4_1_WGM2
    SolutionIndex: 44
    SolutionNameMin: Cijk_Ailk_Bljk_SB_GB_MT64x64x16_MI32x32x2x1_SN_1LDSB0_EPS0_GRVW4_LPB4_NLCA1_PGR2_PLR9_SRVW2_TT1_32_WG64_4_1_WGM2
    SolutionIndex: 45
    SolutionNameMin: Cijk_Ailk_Bljk_SB_GB_MT64x128x16_MI32x32x2x1_SN_1LDSB0_EPS0_GRVW4_LPB4_NLCA1_PGR2_PLR9_SRVW2_TT1_64_WG64_4_1_WGM2
    SolutionIndex: 46
    SolutionNameMin: Cijk_Ailk_Bljk_SB_GB_MT32x32x32_MI16x16x4x1_SN_1LDSB0_EPS1_GRVW4_LPB4_NLCA1_PGR1_PLR9_SRVW2_TT1_16_WG32_8_1_WGM2
    SolutionIndex: 47
    SolutionNameMin: Cijk_Ailk_Bljk_SB_GB_MT32x32x32_MI16x16x4x1_SN_1LDSB0_EPS0_GRVW4_LPB4_NLCA1_PGR2_PLR9_SRVW2_TT1_16_WG32_8_1_WGM2
    SolutionIndex: 48
    SolutionNameMin: Cijk_Ailk_Bljk_SB_GB_MT64x32x32_MI16x16x4x1_SN_1LDSB0_EPS0_GRVW4_LPB4_NLCA1_PGR2_PLR9_SRVW2_TT2_16_WG32_8_1_WGM2
    SolutionIndex: 49
    SolutionNameMin: Cijk_Ailk_Bljk_SB_GB_MT128x32x32_MI32x32x2x1_SN_1LDSB0_EPS0_GRVW4_LPB4_NLCA1_PGR2_PLR17_SRVW2_TT1_32_WG128_2_1_WGM2
    SolutionIndex: 50
    SolutionNameMin: Cijk_Ailk_Bljk_SB_GB_MT32x32x16_MI16x16x4x1_SN_1LDSB0_EPS1_GRVW1_LPB2_NLCA1_PGR1_PLR5_SRVW2_TT1_16_WG32_8_1_WGM15
    SolutionIndex: 51
    SolutionNameMin: Cijk_Ailk_Bljk_SB_GB_MT32x32x16_MI16x16x4x1_SN_1LDSB0_EPS0_GRVW1_LPB2_NLCA1_PGR2_PLR5_SRVW2_TT1_16_WG32_8_1_WGM15
    SolutionIndex: 52
    SolutionNameMin: Cijk_Ailk_Bljk_SB_GB_MT64x32x16_MI16x16x4x1_SN_1LDSB0_EPS0_GRVW1_LPB2_NLCA1_PGR2_PLR5_SRVW2_TT2_16_WG32_8_1_WGM15
    SolutionIndex: 53
    SolutionNameMin: Cijk_Ailk_Bljk_SB_GB_MT64x128x16_MI32x32x2x1_SN_1LDSB0_EPS1_GRVW1_LPB2_NLCA1_PGR1_PLR9_SRVW2_TT1_64_WG64_4_1_WGM15
    SolutionIndex: 54
    SolutionNameMin: Cijk_Ailk_Bljk_SB_GB_MT64x128x16_MI32x32x2x1_SN_1LDSB0_EPS0_GRVW1_LPB2_NLCA1_PGR2_PLR9_SRVW2_TT1_64_WG64_4_1_WGM15
    SolutionIndex: 55
    SolutionNameMin: Cijk_Ailk_Bljk_SB_GB_MT32x32x32_MI16x16x4x1_SN_1LDSB0_EPS0_GRVW1_LPB2_NLCA1_PGR2_PLR9_SRVW2_TT1_16_WG32_8_1_WGM15
    SolutionIndex: 56
    SolutionNameMin: Cijk_Ailk_Bljk_SB_GB_MT64x32x16_MI16x16x4x1_SN_1LDSB0_EPS0_GRVW2_LPB2_NLCA1_PGR2_PLR5_SRVW2_TT2_16_WG32_8_1_WGM15
    SolutionIndex: 57
    SolutionNameMin: Cijk_Ailk_Bljk_SB_GB_MT64x128x16_MI32x32x2x1_SN_1LDSB0_EPS1_GRVW2_LPB2_NLCA1_PGR1_PLR9_SRVW2_TT1_64_WG64_4_1_WGM15
    SolutionIndex: 58
    SolutionNameMin: Cijk_Ailk_Bljk_SB_GB_MT64x64x16_MI32x32x2x1_SN_1LDSB0_EPS0_GRVW2_LPB2_NLCA1_PGR2_PLR9_SRVW2_TT1_32_WG64_4_1_WGM15
    SolutionIndex: 59
    SolutionNameMin: Cijk_Ailk_Bljk_SB_GB_MT64x128x16_MI32x32x2x1_SN_1LDSB0_EPS0_GRVW2_LPB2_NLCA1_PGR2_PLR9_SRVW2_TT1_64_WG64_4_1_WGM15
    SolutionIndex: 60
    SolutionNameMin: Cijk_Ailk_Bljk_SB_GB_MT32x32x16_MI16x16x4x1_SN_1LDSB0_EPS1_GRVW4_LPB4_NLCA1_PGR1_PLR5_SRVW2_TT1_16_WG32_8_1_WGM15
    SolutionIndex: 61
    SolutionNameMin: Cijk_Ailk_Bljk_SB_GB_MT64x32x16_MI16x16x4x1_SN_1LDSB0_EPS1_GRVW4_LPB4_NLCA1_PGR1_PLR5_SRVW2_TT2_16_WG32_8_1_WGM15
    SolutionIndex: 62
    SolutionNameMin: Cijk_Ailk_Bljk_SB_GB_MT64x32x16_MI16x16x4x1_SN_1LDSB0_EPS0_GRVW4_LPB4_NLCA1_PGR2_PLR5_SRVW2_TT2_16_WG32_8_1_WGM15
    SolutionIndex: 63
    SolutionNameMin: Cijk_Ailk_Bljk_SB_GB_MT64x64x16_MI32x32x2x1_SN_1LDSB0_EPS1_GRVW4_LPB4_NLCA1_PGR1_PLR9_SRVW2_TT1_32_WG64_4_1_WGM15
    SolutionIndex: 64
    SolutionNameMin: Cijk_Ailk_Bljk_SB_GB_MT64x128x16_MI32x32x2x1_SN_1LDSB0_EPS1_GRVW4_LPB4_NLCA1_PGR1_PLR9_SRVW2_TT1_64_WG64_4_1_WGM15
    SolutionIndex: 65
    SolutionNameMin: Cijk_Ailk_Bljk_SB_GB_MT64x64x16_MI32x32x2x1_SN_1LDSB0_EPS0_GRVW4_LPB4_NLCA1_PGR2_PLR9_SRVW2_TT1_32_WG64_4_1_WGM15
    SolutionIndex: 66
    SolutionNameMin: Cijk_Ailk_Bljk_SB_GB_MT64x128x16_MI32x32x2x1_SN_1LDSB0_EPS0_GRVW4_LPB4_NLCA1_PGR2_PLR9_SRVW2_TT1_64_WG64_4_1_WGM15
    SolutionIndex: 67
    SolutionNameMin: Cijk_Ailk_Bljk_SB_GB_MT32x32x32_MI16x16x4x1_SN_1LDSB0_EPS1_GRVW4_LPB4_NLCA1_PGR1_PLR9_SRVW2_TT1_16_WG32_8_1_WGM15
    SolutionIndex: 68
    SolutionNameMin: Cijk_Ailk_Bljk_SB_GB_MT64x32x32_MI16x16x4x1_SN_1LDSB0_EPS1_GRVW4_LPB4_NLCA1_PGR1_PLR9_SRVW2_TT2_16_WG32_8_1_WGM15
    SolutionIndex: 69
    SolutionNameMin: Cijk_Ailk_Bljk_SB_GB_MT32x32x32_MI16x16x4x1_SN_1LDSB0_EPS0_GRVW4_LPB4_NLCA1_PGR2_PLR9_SRVW2_TT1_16_WG32_8_1_WGM15
    SolutionIndex: 70
    SolutionNameMin: Cijk_Ailk_Bljk_SB_GB_MT64x32x32_MI16x16x4x1_SN_1LDSB0_EPS0_GRVW4_LPB4_NLCA1_PGR2_PLR9_SRVW2_TT2_16_WG32_8_1_WGM15
    SolutionIndex: 71
    SolutionNameMin: Cijk_Ailk_Bljk_SB_GB_MT64x64x32_MI32x32x2x1_SN_1LDSB0_EPS1_GRVW4_LPB4_NLCA1_PGR1_PLR17_SRVW2_TT1_32_WG64_4_1_WGM15
    SolutionIndex: 72
    SolutionNameMin: Cijk_Ailk_Bljk_SB_GB_MT32x32x8_MI32x32x2x1_SN_1LDSB0_EPS1_GRVW1_LPB2_NLCA1_PGR1_PLR5_SRVW2_TT1_32_WG32_2_1_WGM1
    SolutionIndex: 73
    SolutionNameMin: Cijk_Ailk_Bljk_SB_GB_MT32x32x8_MI32x32x2x1_SN_1LDSB0_EPS0_GRVW1_LPB2_NLCA1_PGR2_PLR5_SRVW2_TT1_32_WG32_2_1_WGM1
    SolutionIndex: 74
    SolutionNameMin: Cijk_Ailk_Bljk_SB_GB_MT16x16x16_MI16x16x4x1_SN_1LDSB0_EPS1_GRVW1_LPB2_NLCA1_PGR1_PLR5_SRVW2_TT1_16_WG16_4_1_WGM1
    SolutionIndex: 75
    SolutionNameMin: Cijk_Ailk_Bljk_SB_GB_MT16x16x16_MI16x16x4x1_SN_1LDSB0_EPS0_GRVW1_LPB2_NLCA1_PGR2_PLR5_SRVW2_TT1_16_WG16_4_1_WGM1
    SolutionIndex: 76
    SolutionNameMin: Cijk_Ailk_Bljk_SB_GB_MT16x16x16_MI16x16x4x1_SN_1LDSB0_EPS1_GRVW2_LPB2_NLCA1_PGR1_PLR5_SRVW2_TT1_16_WG16_4_1_WGM1
    SolutionIndex: 77
    SolutionNameMin: Cijk_Ailk_Bljk_SB_GB_MT32x32x8_MI32x32x2x1_SN_1LDSB0_EPS1_GRVW1_LPB2_NLCA1_PGR1_PLR5_SRVW2_TT1_32_WG32_2_1_WGM2
    SolutionIndex: 78
    SolutionNameMin: Cijk_Ailk_Bljk_SB_GB_MT32x32x8_MI32x32x2x1_SN_1LDSB0_EPS0_GRVW1_LPB2_NLCA1_PGR2_PLR5_SRVW2_TT1_32_WG32_2_1_WGM2
    SolutionIndex: 79
    SolutionNameMin: Cijk_Ailk_Bljk_SB_GB_MT32x32x8_MI32x32x2x1_SN_1LDSB0_EPS1_GRVW1_LPB2_NLCA1_PGR1_PLR5_SRVW2_TT1_32_WG32_2_1_WGM15
    SolutionIndex: 80
    SolutionNameMin: Cijk_Ailk_Bljk_SB_GB_MT32x32x8_MI32x32x2x1_SN_1LDSB0_EPS0_GRVW1_LPB2_NLCA1_PGR2_PLR5_SRVW2_TT1_32_WG32_2_1_WGM15
    SolutionIndex: 81
    SolutionNameMin: Cijk_Ailk_Bljk_SB_GB_MT16x16x16_MI16x16x4x1_SN_1LDSB0_EPS0_GRVW1_LPB2_NLCA1_PGR2_PLR5_SRVW2_TT1_16_WG16_4_1_WGM15
    SolutionIndex: 82
    SolutionNameMin: Cijk_Ailk_Bljk_SB_GB_MT96x96x16_MI16x16x4x1_SN_1LDSB0_EPS0_GRVW2_LPB2_NLCA3_PGR2_PLR5_SRVW0_TT3_48_WG32_8_1_WGM1
    SolutionIndex: 83
    SolutionNameMin: Cijk_Ailk_Bljk_SB_GB_MT96x96x16_MI16x16x4x1_SN_1LDSB0_EPS0_GRVW1_LPB2_NLCA3_PGR2_PLR5_SRVW0_TT3_48_WG32_8_1_WGM15
    SolutionIndex: 84
    SolutionNameMin: Cijk_Ailk_Bljk_SB_GB_MT160x160x16_MI16x16x4x1_SN_1LDSB1_EPS1_GRVW1_LPB2_NLCA5_PGR1_PLR5_SRVW0_TT5_80_WG32_8_1_WGM1
    SolutionIndex: 85
    SolutionNameMin: Cijk_Ailk_Bljk_SB_GB_MT160x160x16_MI16x16x4x1_SN_1LDSB1_EPS0_GRVW1_LPB2_NLCA5_PGR2_PLR5_SRVW0_TT5_80_WG32_8_1_WGM1
    SolutionIndex: 86
    SolutionNameMin: Cijk_Ailk_Bljk_SB_GB_MT96x96x16_MI16x16x4x1_SN_1LDSB1_EPS1_GRVW2_LPB2_NLCA3_PGR1_PLR5_SRVW0_TT3_48_WG32_8_1_WGM1
    SolutionIndex: 87
    SolutionNameMin: Cijk_Ailk_Bljk_SB_GB_MT96x96x16_MI16x16x4x1_SN_1LDSB1_EPS0_GRVW2_LPB2_NLCA3_PGR2_PLR5_SRVW0_TT3_48_WG32_8_1_WGM1
    SolutionIndex: 88
    SolutionNameMin: Cijk_Ailk_Bljk_SB_GB_MT96x96x32_MI16x16x4x1_SN_1LDSB1_EPS1_GRVW4_LPB4_NLCA3_PGR1_PLR9_SRVW0_TT3_48_WG32_8_1_WGM1
    SolutionIndex: 89
    SolutionNameMin: Cijk_Ailk_Bljk_SB_GB_MT160x160x16_MI16x16x4x1_SN_1LDSB1_EPS1_GRVW1_LPB2_NLCA5_PGR1_PLR5_SRVW0_TT5_80_WG32_8_1_WGM2
    SolutionIndex: 90
    SolutionNameMin: Cijk_Ailk_Bljk_SB_GB_MT96x96x16_MI16x16x4x1_SN_1LDSB1_EPS1_GRVW2_LPB2_NLCA3_PGR1_PLR5_SRVW0_TT3_48_WG32_8_1_WGM2
    SolutionIndex: 91
    SolutionNameMin: Cijk_Ailk_Bljk_SB_GB_MT96x96x16_MI16x16x4x1_SN_1LDSB1_EPS0_GRVW2_LPB2_NLCA3_PGR2_PLR5_SRVW0_TT3_48_WG32_8_1_WGM2
    SolutionIndex: 92
    SolutionNameMin: Cijk_Ailk_Bljk_SB_GB_MT96x96x16_MI16x16x4x1_SN_1LDSB1_EPS1_GRVW2_LPB2_NLCA3_PGR1_PLR5_SRVW0_TT3_48_WG32_8_1_WGM15
    SolutionIndex: 93
    SolutionNameMin: Cijk_Ailk_Bljk_SB_GB_MT96x96x16_MI16x16x4x1_SN_1LDSB1_EPS0_GRVW2_LPB2_NLCA3_PGR2_PLR5_SRVW0_TT3_48_WG32_8_1_WGM15
- - - [192, 192, 1000, 32, 192, 192, 192, 32]
    - [4, 9550.0]
  - - [1536, 1536, 168, 32, 1536, 1536, 1536, 32]
    - [43, 11025.0]
  - - [1536, 32, 168, 1536, 1536, 1536, 1536, 1536]
    - [49, 15011.0]
  - - [32, 1536, 168, 32, 32, 32, 32, 32]
    - [1, 6839.0]
  - - [384, 384, 1024, 384, 384, 384, 384, 384]
    - [22, 23893.0]
  - - [1, 1, 1000, 1, 1, 1, 1, 1]
    - [72, 0.0]
  - - [2, 2, 1000, 2, 2, 2, 2, 2]
    - [74, 2.0]
  - - [3, 3, 1000, 3, 3, 3, 3, 3]
    - [74, 6.0]
  - - [4, 4, 1000, 4, 4, 4, 4, 4]
    - [76, 15.0]
  - - [5, 5, 1000, 5, 5, 5, 5, 5]
    - [74, 28.0]
  - - [6, 6, 1000, 6, 6, 6, 6, 6]
    - [74, 48.0]
  - - [7, 7, 1000, 7, 7, 7, 7, 7]
    - [75, 75.0]
  - - [8, 8, 1000, 8, 8, 8, 8, 8]
    - [75, 116.0]
  - - [9, 9, 1000, 9, 9, 9, 9, 9]
    - [74, 160.0]
  - - [10, 10, 1000, 10, 10, 10, 10, 10]
    - [74, 216.0]
  - - [11, 11, 1000, 11, 11, 11, 11, 11]
    - [75, 292.0]
  - - [12, 12, 1000, 12, 12, 12, 12, 12]
    - [74, 372.0]
  - - [13, 13, 1000, 13, 13, 13, 13, 13]
    - [74, 458.0]
  - - [14, 14, 1000, 14, 14, 14, 14, 14]
    - [75, 562.0]
  - - [15, 15, 1000, 15, 15, 15, 15, 15]
    - [81, 703.0]
  - - [16, 16, 1000, 16, 16, 16, 16, 16]
    - [74, 931.0]
  - - [17, 17, 1000, 17, 17, 17, 17, 17]
    - [73, 706.0]
  - - [18, 18, 1000, 18, 18, 18, 18, 18]
    - [77, 838.0]
  - - [19, 19, 1000, 19, 19, 19, 19, 19]
    - [80, 942.0]
  - - [20, 20, 1000, 20, 20, 20, 20, 20]
    - [77, 1075.0]
  - - [21, 21, 1000, 21, 21, 21, 21, 21]
    - [79, 1193.0]
  - - [22, 22, 1000, 22, 22, 22, 22, 22]
    - [77, 1318.0]
  - - [23, 23, 1000, 23, 23, 23, 23, 23]
    - [77, 1462.0]
  - - [24, 24, 1000, 24, 24, 24, 24, 24]
    - [72, 1745.0]
  - - [25, 25, 1000, 25, 25, 25, 25, 25]
    - [0, 1728.0]
  - - [26, 26, 1000, 26, 26, 26, 26, 26]
    - [0, 1910.0]
  - - [27, 27, 1000, 27, 27, 27, 27, 27]
    - [3, 2068.0]
  - - [28, 28, 1000, 28, 28, 28, 28, 28]
    - [28, 2287.0]
  - - [29, 29, 1000, 29, 29, 29, 29, 29]
    - [28, 2459.0]
  - - [30, 30, 1000, 30, 30, 30, 30, 30]
    - [50, 2616.0]
  - - [31, 31, 1000, 31, 31, 31, 31, 31]
    - [27, 2821.0]
  - - [32, 32, 1000, 32, 32, 32, 32, 32]
    - [78, 3593.0]
  - - [33, 33, 1000, 33, 33, 33, 33, 33]
    - [4, 1728.0]
  - - [34, 34, 1000, 34, 34, 34, 34, 34]
    - [29, 1890.0]
  - - [35, 35, 1000, 35, 35, 35, 35, 35]
    - [4, 2022.0]
  - - [36, 36, 1000, 36, 36, 36, 36, 36]
    - [4, 2234.0]
  - - [37, 37, 1000, 37, 37, 37, 37, 37]
    - [29, 2294.0]
  - - [38, 38, 1000, 38, 38, 38, 38, 38]
    - [4, 2476.0]
  - - [39, 39, 1000, 39, 39, 39, 39, 39]
    - [4, 2629.0]
  - - [40, 40, 1000, 40, 40, 40, 40, 40]
    - [4, 2909.0]
  - - [41, 41, 1000, 41, 41, 41, 41, 41]
    - [4, 2940.0]
  - - [42, 42, 1000, 42, 42, 42, 42, 42]
    - [4, 3161.0]
  - - [43, 43, 1000, 43, 43, 43, 43, 43]
    - [4, 3335.0]
  - - [44, 44, 1000, 44, 44, 44, 44, 44]
    - [52, 3561.0]
  - - [45, 45, 1000, 45, 45, 45, 45, 45]
    - [52, 3651.0]
  - - [46, 46, 1000, 46, 46, 46, 46, 46]
    - [52, 3912.0]
  - - [47, 47, 1000, 47, 47, 47, 47, 47]
    - [4, 4160.0]
  - - [48, 48, 1000, 48, 48, 48, 48, 48]
    - [4, 4834.0]
  - - [49, 49, 1000, 49, 49, 49, 49, 49]
    - [4, 4287.0]
  - - [50, 50, 1000, 50, 50, 50, 50, 50]
    - [4, 4452.0]
  - - [51, 51, 1000, 51, 51, 51, 51, 51]
    - [4, 4619.0]
  - - [52, 52, 1000, 52, 52, 52, 52, 52]
    - [4, 4923.0]
  - - [53, 53, 1000, 53, 53, 53, 53, 53]
    - [29, 4936.0]
  - - [54, 54, 1000, 54, 54, 54, 54, 54]
    - [29, 5166.0]
  - - [55, 55, 1000, 55, 55, 55, 55, 55]
    - [52, 5360.0]
  - - [56, 56, 1000, 56, 56, 56, 56, 56]
    - [29, 5672.0]
  - - [57, 57, 1000, 57, 57, 57, 57, 57]
    - [52, 5730.0]
  - - [58, 58, 1000, 58, 58, 58, 58, 58]
    - [52, 5891.0]
  - - [59, 59, 1000, 59, 59, 59, 59, 59]
    - [4, 6098.0]
  - - [60, 60, 1000, 60, 60, 60, 60, 60]
    - [4, 6368.0]
  - - [61, 61, 1000, 61, 61, 61, 61, 61]
    - [52, 6478.0]
  - - [62, 62, 1000, 62, 62, 62, 62, 62]
    - [2, 6695.0]
  - - [63, 63, 1000, 63, 63, 63, 63, 63]
    - [52, 6930.0]
  - - [64, 64, 1000, 64, 64, 64, 64, 64]
    - [4, 8111.0]
  - - [65, 65, 1000, 65, 65, 65, 65, 65]
    - [90, 4228.0]
  - - [66, 66, 1000, 66, 66, 66, 66, 66]
    - [92, 4566.0]
  - - [67, 67, 1000, 67, 67, 67, 67, 67]
    - [93, 4624.0]
  - - [68, 68, 1000, 68, 68, 68, 68, 68]
    - [91, 4718.0]
  - - [69, 69, 1000, 69, 69, 69, 69, 69]
    - [87, 4769.0]
  - - [70, 70, 1000, 70, 70, 70, 70, 70]
    - [83, 4872.0]
  - - [71, 71, 1000, 71, 71, 71, 71, 71]
    - [93, 5101.0]
  - - [72, 72, 1000, 72, 72, 72, 72, 72]
    - [87, 5817.0]
  - - [73, 73, 1000, 73, 73, 73, 73, 73]
    - [86, 5240.0]
  - - [74, 74, 1000, 74, 74, 74, 74, 74]
    - [90, 5458.0]
  - - [75, 75, 1000, 75, 75, 75, 75, 75]
    - [82, 5476.0]
  - - [76, 76, 1000, 76, 76, 76, 76, 76]
    - [87, 5740.0]
  - - [77, 77, 1000, 77, 77, 77, 77, 77]
    - [56, 5730.0]
  - - [78, 78, 1000, 78, 78, 78, 78, 78]
    - [56, 5885.0]
  - - [79, 79, 1000, 79, 79, 79, 79, 79]
    - [56, 6090.0]
  - - [80, 80, 1000, 80, 80, 80, 80, 80]
    - [62, 7891.0]
  - - [81, 81, 1000, 81, 81, 81, 81, 81]
    - [62, 6418.0]
  - - [82, 82, 1000, 82, 82, 82, 82, 82]
    - [62, 6614.0]
  - - [83, 83, 1000, 83, 83, 83, 83, 83]
    - [62, 6724.0]
  - - [84, 84, 1000, 84, 84, 84, 84, 84]
    - [62, 7165.0]
  - - [85, 85, 1000, 85, 85, 85, 85, 85]
    - [62, 6953.0]
  - - [86, 86, 1000, 86, 86, 86, 86, 86]
    - [62, 7221.0]
  - - [87, 87, 1000, 87, 87, 87, 87, 87]
    - [62, 7271.0]
  - - [88, 88, 1000, 88, 88, 88, 88, 88]
    - [62, 7895.0]
  - - [89, 89, 1000, 89, 89, 89, 89, 89]
    - [62, 7512.0]
  - - [90, 90, 1000, 90, 90, 90, 90, 90]
    - [56, 7722.0]
  - - [91, 91, 1000, 91, 91, 91, 91, 91]
    - [62, 7778.0]
  - - [92, 92, 1000, 92, 92, 92, 92, 92]
    - [56, 8355.0]
  - - [93, 93, 1000, 93, 93, 93, 93, 93]
    - [56, 7973.0]
  - - [94, 94, 1000, 94, 94, 94, 94, 94]
    - [56, 8346.0]
  - - [95, 95, 1000, 95, 95, 95, 95, 95]
    - [56, 8334.0]
  - - [96, 96, 1000, 96, 96, 96, 96, 96]
    - [88, 13213.0]
  - - [97, 97, 1000, 97, 97, 97, 97, 97]
    - [6, 8213.0]
  - - [98, 98, 1000, 98, 98, 98, 98, 98]
    - [6, 8482.0]
  - - [99, 99, 1000, 99, 99, 99, 99, 99]
    - [6, 8565.0]
  - - [100, 100, 1000, 100, 100, 100, 100, 100]
    - [6, 8973.0]
  - - [101, 101, 1000, 101, 101, 101, 101, 101]
    - [6, 8944.0]
  - - [102, 102, 1000, 102, 102, 102, 102, 102]
    - [32, 9117.0]
  - - [103, 103, 1000, 103, 103, 103, 103, 103]
    - [32, 9330.0]
  - - [104, 104, 1000, 104, 104, 104, 104, 104]
    - [6, 9958.0]
  - - [105, 105, 1000, 105, 105, 105, 105, 105]
    - [54, 9666.0]
  - - [106, 106, 1000, 106, 106, 106, 106, 106]
    - [32, 9965.0]
  - - [107, 107, 1000, 107, 107, 107, 107, 107]
    - [54, 10009.0]
  - - [108, 108, 1000, 108, 108, 108, 108, 108]
    - [54, 10332.0]
  - - [109, 109, 1000, 109, 109, 109, 109, 109]
    - [32, 10337.0]
  - - [110, 110, 1000, 110, 110, 110, 110, 110]
    - [32, 10624.0]
  - - [111, 111, 1000, 111, 111, 111, 111, 111]
    - [6, 10678.0]
  - - [112, 112, 1000, 112, 112, 112, 112, 112]
    - [22, 13635.0]
  - - [113, 113, 1000, 113, 113, 113, 113, 113]
    - [20, 10944.0]
  - - [114, 114, 1000, 114, 114, 114, 114, 114]
    - [22, 11251.0]
  - - [115, 115, 1000, 115, 115, 115, 115, 115]
    - [14, 11330.0]
  - - [116, 116, 1000, 116, 116, 116, 116, 116]
    - [22, 11883.0]
  - - [117, 117, 1000, 117, 117, 117, 117, 117]
    - [14, 11653.0]
  - - [118, 118, 1000, 118, 118, 118, 118, 118]
    - [6, 11885.0]
  - - [119, 119, 1000, 119, 119, 119, 119, 119]
    - [59, 11941.0]
  - - [120, 120, 1000, 120, 120, 120, 120, 120]
    - [22, 12865.0]
  - - [121, 121, 1000, 121, 121, 121, 121, 121]
    - [59, 12201.0]
  - - [122, 122, 1000, 122, 122, 122, 122, 122]
    - [14, 12638.0]
  - - [123, 123, 1000, 123, 123, 123, 123, 123]
    - [14, 12683.0]
  - - [124, 124, 1000, 124, 124, 124, 124, 124]
    - [37, 13131.0]
  - - [125, 125, 1000, 125, 125, 125, 125, 125]
    - [59, 12972.0]
  - - [126, 126, 1000, 126, 126, 126, 126, 126]
    - [6, 12777.0]
  - - [127, 127, 1000, 127, 127, 127, 127, 127]
    - [37, 13164.0]
  - - [128, 128, 1000, 128, 128, 128, 128, 128]
    - [19, 15109.0]
  - - [129, 129, 1000, 129, 129, 129, 129, 129]
    - [41, 8279.0]
  - - [130, 130, 1000, 130, 130, 130, 130, 130]
    - [41, 8604.0]
  - - [131, 131, 1000, 131, 131, 131, 131, 131]
    - [85, 8826.0]
  - - [132, 132, 1000, 132, 132, 132, 132, 132]
    - [19, 9209.0]
  - - [133, 133, 1000, 133, 133, 133, 133, 133]
    - [86, 8909.0]
  - - [134, 134, 1000, 134, 134, 134, 134, 134]
    - [86, 9081.0]
  - - [135, 135, 1000, 135, 135, 135, 135, 135]
    - [86, 9131.0]
  - - [136, 136, 1000, 136, 136, 136, 136, 136]
    - [19, 9838.0]
  - - [137, 137, 1000, 137, 137, 137, 137, 137]
    - [89, 9512.0]
  - - [138, 138, 1000, 138, 138, 138, 138, 138]
    - [85, 9597.0]
  - - [139, 139, 1000, 139, 139, 139, 139, 139]
    - [84, 9739.0]
  - - [140, 140, 1000, 140, 140, 140, 140, 140]
    - [62, 9956.0]
  - - [141, 141, 1000, 141, 141, 141, 141, 141]
    - [84, 9758.0]
  - - [142, 142, 1000, 142, 142, 142, 142, 142]
    - [41, 9760.0]
  - - [143, 143, 1000, 143, 143, 143, 143, 143]
    - [89, 9898.0]
  - - [144, 144, 1000, 144, 144, 144, 144, 144]
    - [19, 13340.0]
  - - [145, 145, 1000, 145, 145, 145, 145, 145]
    - [21, 10283.0]
  - - [146, 146, 1000, 146, 146, 146, 146, 146]
    - [21, 10477.0]
  - - [147, 147, 1000, 147, 147, 147, 147, 147]
    - [21, 10471.0]
  - - [148, 148, 1000, 148, 148, 148, 148, 148]
    - [21, 10858.0]
  - - [149, 149, 1000, 149, 149, 149, 149, 149]
    - [21, 10737.0]
  - - [150, 150, 1000, 150, 150, 150, 150, 150]
    - [21, 10978.0]
  - - [32, 32, 8, 32, 32, 32, 32, 32]
    - [23, 56.0]
  - - [32, 32, 8, 64, 32, 32, 32, 64]
    - [25, 101.0]
  - - [32, 32, 8, 128, 32, 32, 32, 128]
    - [25, 177.0]
  - - [32, 32, 8, 256, 32, 32, 32, 256]
    - [25, 267.0]
  - - [32, 32, 8, 512, 32, 32, 32, 512]
    - [25, 423.0]
  - - [32, 32, 8, 1024, 32, 32, 32, 1024]
    - [69, 546.0]
  - - [32, 32, 8, 2048, 32, 32, 32, 2048]
    - [25, 647.0]
  - - [32, 64, 8, 32, 32, 32, 32, 32]
    - [23, 115.0]
  - - [32, 64, 8, 64, 32, 32, 32, 64]
    - [25, 199.0]
  - - [32, 64, 8, 128, 32, 32, 32, 128]
    - [25, 340.0]
  - - [32, 64, 8, 256, 32, 32, 32, 256]
    - [25, 570.0]
  - - [32, 64, 8, 512, 32, 32, 32, 512]
    - [25, 846.0]
  - - [32, 64, 8, 1024, 32, 32, 32, 1024]
    - [25, 1110.0]
  - - [32, 64, 8, 2048, 32, 32, 32, 2048]
    - [69, 1303.0]
  - - [32, 128, 8, 32, 32, 32, 32, 32]
    - [7, 234.0]
  - - [32, 128, 8, 64, 32, 32, 32, 64]
    - [7, 391.0]
  - - [32, 128, 8, 128, 32, 32, 32, 128]
    - [25, 708.0]
  - - [32, 128, 8, 256, 32, 32, 32, 256]
    - [25, 1165.0]
  - - [32, 128, 8, 512, 32, 32, 32, 512]
    - [69, 1691.0]
  - - [32, 128, 8, 1024, 32, 32, 32, 1024]
    - [25, 2317.0]
  - - [32, 128, 8, 2048, 32, 32, 32, 2048]
    - [69, 2715.0]
  - - [32, 256, 8, 32, 32, 32, 32, 32]
    - [25, 430.0]
  - - [32, 256, 8, 64, 32, 32, 32, 64]
    - [25, 771.0]
  - - [32, 256, 8, 128, 32, 32, 32, 128]
    - [69, 1436.0]
  - - [32, 256, 8, 256, 32, 32, 32, 256]
    - [69, 2305.0]
  - - [32, 256, 8, 512, 32, 32, 32, 512]
    - [25, 3525.0]
  - - [32, 256, 8, 1024, 32, 32, 32, 1024]
    - [25, 4302.0]
  - - [32, 256, 8, 2048, 32, 32, 32, 2048]
    - [47, 5210.0]
  - - [32, 512, 8, 32, 32, 32, 32, 32]
    - [7, 971.0]
  - - [32, 512, 8, 64, 32, 32, 32, 64]
    - [47, 1748.0]
  - - [32, 512, 8, 128, 32, 32, 32, 128]
    - [25, 2759.0]
  - - [32, 512, 8, 256, 32, 32, 32, 256]
    - [38, 4194.0]
  - - [32, 512, 8, 512, 32, 32, 32, 512]
    - [47, 5447.0]
  - - [32, 512, 8, 1024, 32, 32, 32, 1024]
    - [16, 6503.0]
  - - [32, 512, 8, 2048, 32, 32, 32, 2048]
    - [47, 8853.0]
  - - [32, 1024, 8, 32, 32, 32, 32, 32]
    - [34, 1719.0]
  - - [32, 1024, 8, 64, 32, 32, 32, 64]
    - [3, 2796.0]
  - - [32, 1024, 8, 128, 32, 32, 32, 128]
    - [10, 4462.0]
  - - [32, 1024, 8, 256, 32, 32, 32, 256]
    - [28, 6079.0]
  - - [32, 1024, 8, 512, 32, 32, 32, 512]
    - [10, 7877.0]
  - - [32, 1024, 8, 1024, 32, 32, 32, 1024]
    - [18, 8900.0]
  - - [32, 1024, 8, 2048, 32, 32, 32, 2048]
    - [3, 10031.0]
  - - [32, 2048, 8, 32, 32, 32, 32, 32]
    - [3, 2834.0]
  - - [32, 2048, 8, 64, 32, 32, 32, 64]
    - [0, 4072.0]
  - - [32, 2048, 8, 128, 32, 32, 32, 128]
    - [60, 5668.0]
  - - [32, 2048, 8, 256, 32, 32, 32, 256]
    - [25, 7696.0]
  - - [32, 2048, 8, 512, 32, 32, 32, 512]
    - [25, 9244.0]
  - - [32, 2048, 8, 1024, 32, 32, 32, 1024]
    - [25, 10107.0]
  - - [32, 2048, 8, 2048, 32, 32, 32, 2048]
    - [25, 10885.0]
  - - [64, 32, 8, 32, 64, 64, 64, 32]
    - [69, 115.0]
  - - [64, 32, 8, 64, 64, 64, 64, 64]
    - [25, 202.0]
  - - [64, 32, 8, 128, 64, 64, 64, 128]
    - [25, 359.0]
  - - [64, 32, 8, 256, 64, 64, 64, 256]
    - [25, 596.0]
  - - [64, 32, 8, 512, 64, 64, 64, 512]
    - [25, 874.0]
  - - [64, 32, 8, 1024, 64, 64, 64, 1024]
    - [69, 1159.0]
  - - [64, 32, 8, 2048, 64, 64, 64, 2048]
    - [69, 1375.0]
  - - [64, 64, 8, 32, 64, 64, 64, 32]
    - [25, 222.0]
  - - [64, 64, 8, 64, 64, 64, 64, 64]
    - [7, 380.0]
  - - [64, 64, 8, 128, 64, 64, 64, 128]
    - [25, 718.0]
  - - [64, 64, 8, 256, 64, 64, 64, 256]
    - [69, 1152.0]
  - - [64, 64, 8, 512, 64, 64, 64, 512]
    - [25, 1762.0]
  - - [64, 64, 8, 1024, 64, 64, 64, 1024]
    - [69, 2330.0]
  - - [64, 64, 8, 2048, 64, 64, 64, 2048]
    - [25, 2759.0]
  - - [64, 128, 8, 32, 64, 64, 64, 32]
    - [23, 452.0]
  - - [64, 128, 8, 64, 64, 64, 64, 64]
    - [46, 807.0]
  - - [64, 128, 8, 128, 64, 64, 64, 128]
    - [25, 1398.0]
  - - [64, 128, 8, 256, 64, 64, 64, 256]
    - [25, 2305.0]
  - - [64, 128, 8, 512, 64, 64, 64, 512]
    - [69, 3495.0]
  - - [64, 128, 8, 1024, 64, 64, 64, 1024]
    - [69, 4686.0]
  - - [64, 128, 8, 2048, 64, 64, 64, 2048]
    - [25, 5465.0]
  - - [64, 256, 8, 32, 64, 64, 64, 32]
    - [25, 1008.0]
  - - [64, 256, 8, 64, 64, 64, 64, 64]
    - [25, 1808.0]
  - - [64, 256, 8, 128, 64, 64, 64, 128]
    - [25, 2873.0]
  - - [64, 256, 8, 256, 64, 64, 64, 256]
    - [47, 4510.0]
  - - [64, 256, 8, 512, 64, 64, 64, 512]
    - [25, 6123.0]
  - - [64, 256, 8, 1024, 64, 64, 64, 1024]
    - [25, 7424.0]
  - - [64, 256, 8, 2048, 64, 64, 64, 2048]
    - [47, 8125.0]
  - - [64, 512, 8, 32, 64, 64, 64, 32]
    - [18, 1808.0]
  - - [64, 512, 8, 64, 64, 64, 64, 64]
    - [3, 2996.0]
  - - [64, 512, 8, 128, 64, 64, 64, 128]
    - [10, 4713.0]
  - - [64, 512, 8, 256, 64, 64, 64, 256]
    - [24, 6711.0]
  - - [64, 512, 8, 512, 64, 64, 64, 512]
    - [24, 8738.0]
  - - [64, 512, 8, 1024, 64, 64, 64, 1024]
    - [71, 9506.0]
  - - [64, 512, 8, 2048, 64, 64, 64, 2048]
    - [70, 11651.0]
  - - [64, 1024, 8, 32, 64, 64, 64, 32]
    - [4, 2954.0]
  - - [64, 1024, 8, 64, 64, 64, 64, 64]
    - [17, 4877.0]
  - - [64, 1024, 8, 128, 64, 64, 64, 128]
    - [19, 7358.0]
  - - [64, 1024, 8, 256, 64, 64, 64, 256]
    - [19, 9754.0]
  - - [64, 1024, 8, 512, 64, 64, 64, 512]
    - [19, 11570.0]
  - - [64, 1024, 8, 1024, 64, 64, 64, 1024]
    - [17, 12758.0]
  - - [64, 1024, 8, 2048, 64, 64, 64, 2048]
    - [29, 13557.0]
  - - [64, 2048, 8, 32, 64, 64, 64, 32]
    - [52, 4462.0]
  - - [64, 2048, 8, 64, 64, 64, 64, 64]
    - [19, 6658.0]
  - - [64, 2048, 8, 128, 64, 64, 64, 128]
    - [65, 9587.0]
  - - [64, 2048, 8, 256, 64, 64, 64, 256]
    - [26, 12202.0]
  - - [64, 2048, 8, 512, 64, 64, 64, 512]
    - [41, 13724.0]
  - - [64, 2048, 8, 1024, 64, 64, 64, 1024]
    - [26, 14263.0]
  - - [64, 2048, 8, 2048, 64, 64, 64, 2048]
    - [26, 15252.0]
  - - [128, 32, 8, 32, 128, 128, 128, 32]
    - [46, 222.0]
  - - [128, 32, 8, 64, 128, 128, 128, 64]
    - [25, 397.0]
  - - [128, 32, 8, 128, 128, 128, 128, 128]
    - [69, 664.0]
  - - [128, 32, 8, 256, 128, 128, 128, 256]
    - [25, 1128.0]
  - - [128, 32, 8, 512, 128, 128, 128, 512]
    - [25, 1664.0]
  - - [128, 32, 8, 1024, 128, 128, 128, 1024]
    - [25, 2343.0]
  - - [128, 32, 8, 2048, 128, 128, 128, 2048]
    - [25, 2778.0]
  - - [128, 64, 8, 32, 128, 128, 128, 32]
    - [23, 444.0]
  - - [128, 64, 8, 64, 128, 128, 128, 64]
    - [69, 794.0]
  - - [128, 64, 8, 128, 128, 128, 128, 128]
    - [25, 1398.0]
  - - [128, 64, 8, 256, 128, 128, 128, 256]
    - [25, 2356.0]
  - - [128, 64, 8, 512, 128, 128, 128, 512]
    - [25, 3616.0]
  - - [128, 64, 8, 1024, 128, 128, 128, 1024]
    - [25, 4713.0]
  - - [128, 64, 8, 2048, 128, 128, 128, 2048]
    - [69, 5611.0]
  - - [128, 128, 8, 32, 128, 128, 128, 32]
    - [7, 989.0]
  - - [128, 128, 8, 64, 128, 128, 128, 64]
    - [25, 1748.0]
  - - [128, 128, 8, 128, 128, 128, 128, 128]
    - [25, 2954.0]
  - - [128, 128, 8, 256, 128, 128, 128, 256]
    - [38, 4280.0]
  - - [128, 128, 8, 512, 128, 128, 128, 512]
    - [47, 5992.0]
  - - [128, 128, 8, 1024, 128, 128, 128, 1024]
    - [47, 7731.0]
  - - [128, 128, 8, 2048, 128, 128, 128, 2048]
    - [25, 8715.0]
  - - [128, 256, 8, 32, 128, 128, 128, 32]
    - [19, 1808.0]
  - - [128, 256, 8, 64, 128, 128, 128, 64]
    - [10, 2996.0]
  - - [128, 256, 8, 128, 128, 128, 128, 128]
    - [10, 4766.0]
  - - [128, 256, 8, 256, 128, 128, 128, 256]
    - [24, 6214.0]
  - - [128, 256, 8, 512, 128, 128, 128, 512]
    - [48, 8389.0]
  - - [128, 256, 8, 1024, 128, 128, 128, 1024]
    - [19, 9726.0]
  - - [128, 256, 8, 2048, 128, 128, 128, 2048]
    - [19, 10772.0]
  - - [128, 512, 8, 32, 128, 128, 128, 32]
    - [4, 3130.0]
  - - [128, 512, 8, 64, 128, 128, 128, 64]
    - [17, 4993.0]
  - - [128, 512, 8, 128, 128, 128, 128, 128]
    - [39, 7358.0]
  - - [128, 512, 8, 256, 128, 128, 128, 256]
    - [39, 9269.0]
  - - [128, 512, 8, 512, 128, 128, 128, 512]
    - [41, 11148.0]
  - - [128, 512, 8, 1024, 128, 128, 128, 1024]
    - [39, 12955.0]
  - - [128, 512, 8, 2048, 128, 128, 128, 2048]
    - [17, 13880.0]
  - - [128, 1024, 8, 32, 128, 128, 128, 32]
    - [4, 4462.0]
  - - [128, 1024, 8, 64, 128, 128, 128, 64]
    - [62, 6933.0]
  - - [128, 1024, 8, 128, 128, 128, 128, 128]
    - [62, 9869.0]
  - - [128, 1024, 8, 256, 128, 128, 128, 256]
    - [44, 11773.0]
  - - [128, 1024, 8, 512, 128, 128, 128, 512]
    - [44, 13395.0]
  - - [128, 1024, 8, 1024, 128, 128, 128, 1024]
    - [44, 14637.0]
  - - [128, 1024, 8, 2048, 128, 128, 128, 2048]
    - [44, 15589.0]
  - - [128, 2048, 8, 32, 128, 128, 128, 32]
    - [19, 5949.0]
  - - [128, 2048, 8, 64, 128, 128, 128, 64]
    - [41, 9118.0]
  - - [128, 2048, 8, 128, 128, 128, 128, 128]
    - [65, 12567.0]
  - - [128, 2048, 8, 256, 128, 128, 128, 256]
    - [65, 15643.0]
  - - [128, 2048, 8, 512, 128, 128, 128, 512]
    - [65, 18040.0]
  - - [128, 2048, 8, 1024, 128, 128, 128, 1024]
    - [65, 19752.0]
  - - [128, 2048, 8, 2048, 128, 128, 128, 2048]
    - [65, 20499.0]
  - - [256, 32, 8, 32, 256, 256, 256, 32]
    - [15, 437.0]
  - - [256, 32, 8, 64, 256, 256, 256, 64]
    - [25, 819.0]
  - - [256, 32, 8, 128, 256, 256, 256, 128]
    - [25, 1398.0]
  - - [256, 32, 8, 256, 256, 256, 256, 256]
    - [69, 2255.0]
  - - [256, 32, 8, 512, 256, 256, 256, 512]
    - [25, 3466.0]
  - - [256, 32, 8, 1024, 256, 256, 256, 1024]
    - [47, 4438.0]
  - - [256, 32, 8, 2048, 256, 256, 256, 2048]
    - [25, 5501.0]
  - - [256, 64, 8, 32, 256, 256, 256, 32]
    - [23, 989.0]
  - - [256, 64, 8, 64, 256, 256, 256, 64]
    - [33, 1748.0]
  - - [256, 64, 8, 128, 256, 256, 256, 128]
    - [67, 2913.0]
  - - [256, 64, 8, 256, 256, 256, 256, 256]
    - [47, 4462.0]
  - - [256, 64, 8, 512, 256, 256, 256, 512]
    - [67, 5630.0]
  - - [256, 64, 8, 1024, 256, 256, 256, 1024]
    - [25, 7358.0]
  - - [256, 64, 8, 2048, 256, 256, 256, 2048]
    - [47, 8347.0]
  - - [256, 128, 8, 32, 256, 256, 256, 32]
    - [10, 1808.0]
  - - [256, 128, 8, 64, 256, 256, 256, 64]
    - [8, 2954.0]
  - - [256, 128, 8, 128, 256, 256, 256, 128]
    - [34, 4713.0]
  - - [256, 128, 8, 256, 256, 256, 256, 256]
    - [40, 6658.0]
  - - [256, 128, 8, 512, 256, 256, 256, 512]
    - [34, 8473.0]
  - - [256, 128, 8, 1024, 256, 256, 256, 1024]
    - [19, 9927.0]
  - - [256, 128, 8, 2048, 256, 256, 256, 2048]
    - [19, 10635.0]
  - - [256, 256, 8, 32, 256, 256, 256, 32]
    - [31, 3039.0]
  - - [256, 256, 8, 64, 256, 256, 256, 64]
    - [39, 5053.0]
  - - [256, 256, 8, 128, 256, 256, 256, 128]
    - [65, 7049.0]
  - - [256, 256, 8, 256, 256, 256, 256, 256]
    - [65, 9069.0]
  - - [256, 256, 8, 512, 256, 256, 256, 512]
    - [44, 11374.0]
  - - [256, 256, 8, 1024, 256, 256, 256, 1024]
    - [41, 12856.0]
  - - [256, 256, 8, 2048, 256, 256, 256, 2048]
    - [65, 13435.0]
  - - [256, 512, 8, 32, 256, 256, 256, 32]
    - [11, 4462.0]
  - - [256, 512, 8, 64, 256, 256, 256, 64]
    - [19, 7049.0]
  - - [256, 512, 8, 128, 256, 256, 256, 128]
    - [21, 9321.0]
  - - [256, 512, 8, 256, 256, 256, 256, 256]
    - [63, 11185.0]
  - - [256, 512, 8, 512, 256, 256, 256, 512]
    - [65, 13006.0]
  - - [256, 512, 8, 1024, 256, 256, 256, 1024]
    - [65, 14831.0]
  - - [256, 512, 8, 2048, 256, 256, 256, 2048]
    - [44, 15598.0]
  - - [256, 1024, 8, 32, 256, 256, 256, 32]
    - [56, 6035.0]
  - - [256, 1024, 8, 64, 256, 256, 256, 64]
    - [62, 9020.0]
  - - [256, 1024, 8, 128, 256, 256, 256, 128]
    - [65, 12662.0]
  - - [256, 1024, 8, 256, 256, 256, 256, 256]
    - [65, 14814.0]
  - - [256, 1024, 8, 512, 256, 256, 256, 512]
    - [21, 17568.0]
  - - [256, 1024, 8, 1024, 256, 256, 256, 1024]
    - [65, 19382.0]
  - - [256, 1024, 8, 2048, 256, 256, 256, 2048]
    - [65, 19862.0]
  - - [256, 2048, 8, 32, 256, 256, 256, 32]
    - [64, 7877.0]
  - - [256, 2048, 8, 64, 256, 256, 256, 64]
    - [17, 11148.0]
  - - [256, 2048, 8, 128, 256, 256, 256, 128]
    - [64, 14913.0]
  - - [256, 2048, 8, 256, 256, 256, 256, 256]
    - [21, 17824.0]
  - - [256, 2048, 8, 512, 256, 256, 256, 512]
    - [65, 20003.0]
  - - [256, 2048, 8, 1024, 256, 256, 256, 1024]
    - [65, 21851.0]
  - - [256, 2048, 8, 2048, 256, 256, 256, 2048]
    - [66, 21971.0]
  - - [512, 32, 8, 32, 512, 512, 512, 32]
    - [7, 989.0]
  - - [512, 32, 8, 64, 512, 512, 512, 64]
    - [55, 1748.0]
  - - [512, 32, 8, 128, 512, 512, 512, 128]
    - [16, 2724.0]
  - - [512, 32, 8, 256, 512, 512, 512, 256]
    - [47, 4237.0]
  - - [512, 32, 8, 512, 512, 512, 512, 512]
    - [25, 5707.0]
  - - [512, 32, 8, 1024, 512, 512, 512, 1024]
    - [25, 6684.0]
  - - [512, 32, 8, 2048, 512, 512, 512, 2048]
    - [26, 7822.0]
  - - [512, 64, 8, 32, 512, 512, 512, 32]
    - [19, 1777.0]
  - - [512, 64, 8, 64, 512, 512, 512, 64]
    - [18, 2954.0]
  - - [512, 64, 8, 128, 512, 512, 512, 128]
    - [24, 4559.0]
  - - [512, 64, 8, 256, 512, 512, 512, 256]
    - [51, 6404.0]
  - - [512, 64, 8, 512, 512, 512, 512, 512]
    - [48, 8144.0]
  - - [512, 64, 8, 1024, 512, 512, 512, 1024]
    - [62, 9399.0]
  - - [512, 64, 8, 2048, 512, 512, 512, 2048]
    - [62, 10261.0]
  - - [512, 128, 8, 32, 512, 512, 512, 32]
    - [17, 3039.0]
  - - [512, 128, 8, 64, 512, 512, 512, 64]
    - [39, 4821.0]
  - - [512, 128, 8, 128, 512, 512, 512, 128]
    - [13, 6991.0]
  - - [512, 128, 8, 256, 512, 512, 512, 256]
    - [61, 9321.0]
  - - [512, 128, 8, 512, 512, 512, 512, 512]
    - [70, 11222.0]
  - - [512, 128, 8, 1024, 512, 512, 512, 1024]
    - [62, 12451.0]
  - - [512, 128, 8, 2048, 512, 512, 512, 2048]
    - [65, 13289.0]
  - - [512, 256, 8, 32, 512, 512, 512, 32]
    - [62, 4462.0]
  - - [512, 256, 8, 64, 512, 512, 512, 64]
    - [62, 6991.0]
  - - [512, 256, 8, 128, 512, 512, 512, 128]
    - [44, 9698.0]
  - - [512, 256, 8, 256, 512, 512, 512, 256]
    - [42, 11941.0]
  - - [512, 256, 8, 512, 512, 512, 512, 512]
    - [65, 13449.0]
  - - [512, 256, 8, 1024, 512, 512, 512, 1024]
    - [44, 14557.0]
  - - [512, 256, 8, 2048, 512, 512, 512, 2048]
    - [65, 15330.0]
  - - [512, 512, 8, 32, 512, 512, 512, 32]
    - [65, 5949.0]
  - - [512, 512, 8, 64, 512, 512, 512, 64]
    - [65, 9118.0]
  - - [512, 512, 8, 128, 512, 512, 512, 128]
    - [44, 13006.0]
  - - [512, 512, 8, 256, 512, 512, 512, 256]
    - [65, 15865.0]
  - - [512, 512, 8, 512, 512, 512, 512, 512]
    - [65, 18040.0]
  - - [512, 512, 8, 1024, 512, 512, 512, 1024]
    - [65, 19298.0]
  - - [512, 512, 8, 2048, 512, 512, 512, 2048]
    - [65, 19126.0]
  - - [512, 1024, 8, 32, 512, 512, 512, 32]
    - [57, 7731.0]
  - - [512, 1024, 8, 64, 512, 512, 512, 64]
    - [22, 11074.0]
  - - [512, 1024, 8, 128, 512, 512, 512, 128]
    - [66, 15716.0]
  - - [512, 1024, 8, 256, 512, 512, 512, 256]
    - [43, 18641.0]
  - - [512, 1024, 8, 512, 512, 512, 512, 512]
    - [44, 20507.0]
  - - [512, 1024, 8, 1024, 512, 512, 512, 1024]
    - [44, 21492.0]
  - - [512, 1024, 8, 2048, 512, 512, 512, 2048]
    - [57, 22189.0]
  - - [512, 2048, 8, 32, 512, 512, 512, 32]
    - [64, 9069.0]
  - - [512, 2048, 8, 64, 512, 512, 512, 64]
    - [22, 12906.0]
  - - [512, 2048, 8, 128, 512, 512, 512, 128]
    - [22, 17824.0]
  - - [512, 2048, 8, 256, 512, 512, 512, 256]
    - [20, 21203.0]
  - - [512, 2048, 8, 512, 512, 512, 512, 512]
    - [66, 22643.0]
  - - [512, 2048, 8, 1024, 512, 512, 512, 1024]
    - [66, 24151.0]
  - - [512, 2048, 8, 2048, 512, 512, 512, 2048]
    - [64, 24647.0]
  - - [1024, 32, 8, 32, 1024, 1024, 1024, 32]
    - [28, 1777.0]
  - - [1024, 32, 8, 64, 1024, 1024, 1024, 64]
    - [26, 2873.0]
  - - [1024, 32, 8, 128, 1024, 1024, 1024, 128]
    - [24, 4415.0]
  - - [1024, 32, 8, 256, 1024, 1024, 1024, 256]
    - [24, 6168.0]
  - - [1024, 32, 8, 512, 1024, 1024, 1024, 512]
    - [68, 7951.0]
  - - [1024, 32, 8, 1024, 1024, 1024, 1024, 1024]
    - [19, 8996.0]
  - - [1024, 32, 8, 2048, 1024, 1024, 1024, 2048]
    - [62, 9740.0]
  - - [1024, 64, 8, 32, 1024, 1024, 1024, 32]
    - [17, 2954.0]
  - - [1024, 64, 8, 64, 1024, 1024, 1024, 64]
    - [9, 4766.0]
  - - [1024, 64, 8, 128, 1024, 1024, 1024, 128]
    - [4, 6820.0]
  - - [1024, 64, 8, 256, 1024, 1024, 1024, 256]
    - [52, 9069.0]
  - - [1024, 64, 8, 512, 1024, 1024, 1024, 512]
    - [26, 11001.0]
  - - [1024, 64, 8, 1024, 1024, 1024, 1024, 1024]
    - [48, 11920.0]
  - - [1024, 64, 8, 2048, 1024, 1024, 1024, 2048]
    - [44, 12674.0]
  - - [1024, 128, 8, 32, 1024, 1024, 1024, 32]
    - [19, 4415.0]
  - - [1024, 128, 8, 64, 1024, 1024, 1024, 64]
    - [13, 6453.0]
  - - [1024, 128, 8, 128, 1024, 1024, 1024, 128]
    - [70, 9168.0]
  - - [1024, 128, 8, 256, 1024, 1024, 1024, 256]
    - [70, 12027.0]
  - - [1024, 128, 8, 512, 1024, 1024, 1024, 512]
    - [48, 13422.0]
  - - [1024, 128, 8, 1024, 1024, 1024, 1024, 1024]
    - [70, 13996.0]
  - - [1024, 128, 8, 2048, 1024, 1024, 1024, 2048]
    - [36, 14409.0]
  - - [1024, 256, 8, 32, 1024, 1024, 1024, 32]
    - [44, 6168.0]
  - - [1024, 256, 8, 64, 1024, 1024, 1024, 64]
    - [44, 8877.0]
  - - [1024, 256, 8, 128, 1024, 1024, 1024, 128]
    - [44, 12614.0]
  - - [1024, 256, 8, 256, 1024, 1024, 1024, 256]
    - [36, 15534.0]
  - - [1024, 256, 8, 512, 1024, 1024, 1024, 512]
    - [36, 17207.0]
  - - [1024, 256, 8, 1024, 1024, 1024, 1024, 1024]
    - [44, 18273.0]
  - - [1024, 256, 8, 2048, 1024, 1024, 1024, 2048]
    - [44, 18526.0]
  - - [1024, 512, 8, 32, 1024, 1024, 1024, 32]
    - [32, 8144.0]
  - - [1024, 512, 8, 64, 1024, 1024, 1024, 64]
    - [22, 11185.0]
  - - [1024, 512, 8, 128, 1024, 1024, 1024, 128]
    - [45, 15571.0]
  - - [1024, 512, 8, 256, 1024, 1024, 1024, 256]
    - [35, 18641.0]
  - - [1024, 512, 8, 512, 1024, 1024, 1024, 512]
    - [57, 20460.0]
  - - [1024, 512, 8, 1024, 1024, 1024, 1024, 1024]
    - [35, 20633.0]
  - - [1024, 512, 8, 2048, 1024, 1024, 1024, 2048]
    - [57, 21440.0]
  - - [1024, 1024, 8, 32, 1024, 1024, 1024, 32]
    - [43, 9269.0]
  - - [1024, 1024, 8, 64, 1024, 1024, 1024, 64]
    - [45, 13006.0]
  - - [1024, 1024, 8, 128, 1024, 1024, 1024, 128]
    - [35, 17920.0]
  - - [1024, 1024, 8, 256, 1024, 1024, 1024, 256]
    - [35, 21355.0]
  - - [1024, 1024, 8, 512, 1024, 1024, 1024, 512]
    - [30, 23221.0]
  - - [1024, 1024, 8, 1024, 1024, 1024, 1024, 1024]
    - [66, 23383.0]
  - - [1024, 1024, 8, 2048, 1024, 1024, 1024, 2048]
    - [53, 23503.0]
  - - [1024, 2048, 8, 32, 1024, 1024, 1024, 32]
    - [43, 9740.0]
  - - [1024, 2048, 8, 64, 1024, 1024, 1024, 64]
    - [32, 14010.0]
  - - [1024, 2048, 8, 128, 1024, 1024, 1024, 128]
    - [35, 19243.0]
  - - [1024, 2048, 8, 256, 1024, 1024, 1024, 256]
    - [35, 22510.0]
  - - [1024, 2048, 8, 512, 1024, 1024, 1024, 512]
    - [30, 24167.0]
  - - [1024, 2048, 8, 1024, 1024, 1024, 1024, 1024]
    - [53, 24875.0]
  - - [1024, 2048, 8, 2048, 1024, 1024, 1024, 2048]
    - [53, 24736.0]
  - - [2048, 32, 8, 32, 2048, 2048, 2048, 32]
    - [9, 2913.0]
  - - [2048, 32, 8, 64, 2048, 2048, 2048, 64]
    - [39, 4713.0]
  - - [2048, 32, 8, 128, 2048, 2048, 2048, 128]
    - [4, 6711.0]
  - - [2048, 32, 8, 256, 2048, 2048, 2048, 256]
    - [52, 8972.0]
  - - [2048, 32, 8, 512, 2048, 2048, 2048, 512]
    - [4, 10230.0]
  - - [2048, 32, 8, 1024, 2048, 2048, 2048, 1024]
    - [4, 11336.0]
  - - [2048, 32, 8, 2048, 2048, 2048, 2048, 2048]
    - [4, 10974.0]
  - - [2048, 64, 8, 32, 2048, 2048, 2048, 32]
    - [4, 4462.0]
  - - [2048, 64, 8, 64, 2048, 2048, 2048, 64]
    - [4, 6658.0]
  - - [2048, 64, 8, 128, 2048, 2048, 2048, 128]
    - [36, 8924.0]
  - - [2048, 64, 8, 256, 2048, 2048, 2048, 256]
    - [13, 11260.0]
  - - [2048, 64, 8, 512, 2048, 2048, 2048, 512]
    - [36, 12881.0]
  - - [2048, 64, 8, 1024, 2048, 2048, 2048, 1024]
    - [13, 13851.0]
  - - [2048, 64, 8, 2048, 2048, 2048, 2048, 2048]
    - [48, 14317.0]
  - - [2048, 128, 8, 32, 2048, 2048, 2048, 32]
    - [4, 6035.0]
  - - [2048, 128, 8, 64, 2048, 2048, 2048, 64]
    - [21, 9069.0]
  - - [2048, 128, 8, 128, 2048, 2048, 2048, 128]
    - [21, 12474.0]
  - - [2048, 128, 8, 256, 2048, 2048, 2048, 256]
    - [21, 15217.0]
  - - [2048, 128, 8, 512, 2048, 2048, 2048, 512]
    - [36, 16904.0]
  - - [2048, 128, 8, 1024, 2048, 2048, 2048, 1024]
    - [58, 18298.0]
  - - [2048, 128, 8, 2048, 2048, 2048, 2048, 2048]
    - [65, 18462.0]
  - - [2048, 256, 8, 32, 2048, 2048, 2048, 32]
    - [6, 7989.0]
  - - [2048, 256, 8, 64, 2048, 2048, 2048, 64]
    - [22, 11531.0]
  - - [2048, 256, 8, 128, 2048, 2048, 2048, 128]
    - [22, 15322.0]
  - - [2048, 256, 8, 256, 2048, 2048, 2048, 256]
    - [12, 18590.0]
  - - [2048, 256, 8, 512, 2048, 2048, 2048, 512]
    - [35, 20777.0]
  - - [2048, 256, 8, 1024, 2048, 2048, 2048, 1024]
    - [35, 21518.0]
  - - [2048, 256, 8, 2048, 2048, 2048, 2048, 2048]
    - [35, 20797.0]
  - - [2048, 512, 8, 32, 2048, 2048, 2048, 32]
    - [32, 9295.0]
  - - [2048, 512, 8, 64, 2048, 2048, 2048, 64]
    - [22, 13342.0]
  - - [2048, 512, 8, 128, 2048, 2048, 2048, 128]
    - [43, 17801.0]
  - - [2048, 512, 8, 256, 2048, 2048, 2048, 256]
    - [12, 21137.0]
  - - [2048, 512, 8, 512, 2048, 2048, 2048, 512]
    - [35, 23465.0]
  - - [2048, 512, 8, 1024, 2048, 2048, 2048, 1024]
    - [30, 24091.0]
  - - [2048, 512, 8, 2048, 2048, 2048, 2048, 2048]
    - [53, 24398.0]
  - - [2048, 1024, 8, 32, 2048, 2048, 2048, 32]
    - [20, 9883.0]
  - - [2048, 1024, 8, 64, 2048, 2048, 2048, 64]
    - [22, 14069.0]
  - - [2048, 1024, 8, 128, 2048, 2048, 2048, 128]
    - [12, 19038.0]
  - - [2048, 1024, 8, 256, 2048, 2048, 2048, 256]
    - [5, 22444.0]
  - - [2048, 1024, 8, 512, 2048, 2048, 2048, 512]
    - [30, 24509.0]
  - - [2048, 1024, 8, 1024, 2048, 2048, 2048, 1024]
    - [30, 25208.0]
  - - [2048, 1024, 8, 2048, 2048, 2048, 2048, 2048]
    - [30, 24792.0]
  - - [2048, 2048, 8, 32, 2048, 2048, 2048, 32]
    - [20, 10176.0]
  - - [2048, 2048, 8, 64, 2048, 2048, 2048, 64]
    - [6, 14765.0]
  - - [2048, 2048, 8, 128, 2048, 2048, 2048, 128]
    - [43, 19951.0]
  - - [2048, 2048, 8, 256, 2048, 2048, 2048, 256]
    - [12, 23126.0]
  - - [2048, 2048, 8, 512, 2048, 2048, 2048, 512]
    - [30, 25084.0]
  - - [2048, 2048, 8, 1024, 2048, 2048, 2048, 1024]
    - [30, 25642.0]
  - - [2048, 2048, 8, 2048, 2048, 2048, 2048, 2048]
    - [53, 25792.0]
- null
